[I 2025-08-30 18:31:44,031] Trial 26 finished with values: [-1000000000.0, 1000000000.0] and parameters: {'p_sma': 46, 'p_std': 40, 'p_atr': 25, 'p_adx': 17, 'rsi_period': 20, 'ema1': 10, 'ema2': 29, 'slip_atr_k': 0.11773661787768536, 'slip_spread_k': 0.35098857269628647, 'spread_hl_frac': 0.040177424350631166, 'bb_std_mult': 1.0754004011658738, 'rsi_os': 35, 'rsi_ob': 46, 'vol_spike': 0.11277227666091666, 'adx_thresh': 28.220925607021375, 'atr_min_pct': 5.139388534196765e-05, 'atr_max_pct': 0.07462643573307758, 'tp_mult': 2.51016436725829, 'tsl_mult': 0.49219079508349406, 'strategy': 'breakout', 'time_stop': 293, 'use_sma': False, 'use_atr': True, 'use_adx': True, 'use_ema': True, 'use_spike': True, 'rsi_required': True, 'edge_k': 0.8854494349539946, 'edge_cap': 0.057283233518511854, 'bull_strategy': 'mean_reversion', 'bull_bb_std_mult': 1.1997802507070578, 'bull_rsi_os': 11, 'bull_rsi_ob': 61, 'bull_adx_thresh': 28.242025228113405, 'bull_atr_min_pct': 0.008975893769109329, 'bull_atr_max_pct': 0.059905268599642174, 'bull_tp_mult': 1.2189162151979487, 'bull_tsl_mult': 0.1532575729684998, 'bull_time_stop': 248, 'bull_use_sma': False, 'bull_use_ema': False, 'bull_use_atr': True, 'bull_use_adx': True, 'bull_use_spike': False, 'bull_rsi_required': True, 'bear_strategy': 'mean_reversion', 'bear_bb_std_mult': 3.1214602924921024, 'bear_rsi_os': 26, 'bear_rsi_ob': 54, 'bear_adx_thresh': 15.86378984362085, 'bear_atr_min_pct': 0.0038991254939, 'bear_atr_max_pct': 0.10304614445643603, 'bear_tp_mult': 1.5033717620197653, 'bear_tsl_mult': 0.796845352607526, 'bear_time_stop': 222, 'bear_use_sma': False, 'bear_use_ema': True, 'bear_use_atr': False, 'bear_use_adx': False, 'bear_use_spike': False, 'bear_rsi_required': False, 'sideways_strategy': 'mean_reversion', 'sideways_bb_std_mult': 3.0841006187422497, 'sideways_rsi_os': 6, 'sideways_rsi_ob': 95, 'sideways_adx_thresh': 30.026922445188806, 'sideways_atr_min_pct': 0.026859848506867283, 'sideways_atr_max_pct': 0.06294037362144014, 'sideways_tp_mult': 2.257464415660163, 'sideways_tsl_mult': 0.8020598412138615, 'sideways_time_stop': 62, 'sideways_use_sma': False, 'sideways_use_ema': True, 'sideways_use_atr': False, 'sideways_use_adx': True, 'sideways_use_spike': True, 'sideways_rsi_required': False}.
[I 2025-08-30 18:31:47,019] Trial 28 finished with values: [-1000000000.0, 1000000000.0] and parameters: {'p_sma': 46, 'p_std': 33, 'p_atr': 25, 'p_adx': 16, 'rsi_period': 19, 'ema1': 18, 'ema2': 10, 'slip_atr_k': 0.11988141730629333, 'slip_spread_k': 0.36217839350887754, 'spread_hl_frac': 0.04055140392956055, 'bb_std_mult': 1.125670321086739, 'rsi_os': 34, 'rsi_ob': 46, 'vol_spike': 0.17164271851936758, 'adx_thresh': 31.007806415016553, 'atr_min_pct': 0.0028618364048888702, 'atr_max_pct': 0.10981925538529251, 'tp_mult': 2.6379354925865037, 'tsl_mult': 0.4738989359324671, 'strategy': 'breakout', 'time_stop': 254, 'use_sma': False, 'use_atr': True, 'use_adx': True, 'use_ema': True, 'use_spike': True, 'rsi_required': False, 'edge_k': 0.9903488904411974, 'edge_cap': 0.1271514546251235, 'bull_strategy': 'mean_reversion', 'bull_bb_std_mult': 1.2423341163456494, 'bull_rsi_os': 9, 'bull_rsi_ob': 63, 'bull_adx_thresh': 28.920030144585972, 'bull_atr_min_pct': 0.008225694760942114, 'bull_atr_max_pct': 0.060133093760455704, 'bull_tp_mult': 1.2755459128915685, 'bull_tsl_mult': 0.17545611197495414, 'bull_time_stop': 259, 'bull_use_sma': False, 'bull_use_ema': False, 'bull_use_atr': True, 'bull_use_adx': False, 'bull_use_spike': False, 'bull_rsi_required': True, 'bear_strategy': 'breakout', 'bear_bb_std_mult': 3.247749438406847, 'bear_rsi_os': 25, 'bear_rsi_ob': 64, 'bear_adx_thresh': 23.766777246449365, 'bear_atr_min_pct': 0.0029246557853198213, 'bear_atr_max_pct': 0.10450782983013043, 'bear_tp_mult': 1.385851001980519, 'bear_tsl_mult': 0.7780078451722192, 'bear_time_stop': 221, 'bear_use_sma': True, 'bear_use_ema': True, 'bear_use_atr': False, 'bear_use_adx': False, 'bear_use_spike': False, 'bear_rsi_required': False, 'sideways_strategy': 'mean_reversion', 'sideways_bb_std_mult': 3.1491050092622364, 'sideways_rsi_os': 7, 'sideways_rsi_ob': 94, 'sideways_adx_thresh': 29.60933493897483, 'sideways_atr_min_pct': 0.027400037898797143, 'sideways_atr_max_pct': 0.027980014171628653, 'sideways_tp_mult': 2.264001733478659, 'sideways_tsl_mult': 0.7606410312118826, 'sideways_time_stop': 63, 'sideways_use_sma': False, 'sideways_use_ema': True, 'sideways_use_atr': False, 'sideways_use_adx': False, 'sideways_use_spike': True, 'sideways_rsi_required': False}.
[I 2025-08-30 18:31:47,260] Trial 27 finished with values: [-1000000000.0, 1000000000.0] and parameters: {'p_sma': 48, 'p_std': 31, 'p_atr': 25, 'p_adx': 16, 'rsi_period': 21, 'ema1': 18, 'ema2': 10, 'slip_atr_k': 0.1176736949742753, 'slip_spread_k': 0.3610510548658081, 'spread_hl_frac': 0.04137375377504392, 'bb_std_mult': 1.1372112322410914, 'rsi_os': 32, 'rsi_ob': 45, 'vol_spike': 0.17994685225423362, 'adx_thresh': 22.57573240555587, 'atr_min_pct': 0.0035751073677759704, 'atr_max_pct': 0.07284484442396999, 'tp_mult': 2.6649667679836524, 'tsl_mult': 0.4657604075387913, 'strategy': 'breakout', 'time_stop': 268, 'use_sma': False, 'use_atr': True, 'use_adx': True, 'use_ema': True, 'use_spike': True, 'rsi_required': False, 'edge_k': 0.9848338276641999, 'edge_cap': 0.12547101478932549, 'bull_strategy': 'mean_reversion', 'bull_bb_std_mult': 1.1813589139933587, 'bull_rsi_os': 10, 'bull_rsi_ob': 95, 'bull_adx_thresh': 29.10651002975157, 'bull_atr_min_pct': 0.00886750663893266, 'bull_atr_max_pct': 0.05932979748893444, 'bull_tp_mult': 1.2342495349481837, 'bull_tsl_mult': 0.20659238440384242, 'bull_time_stop': 251, 'bull_use_sma': False, 'bull_use_ema': False, 'bull_use_atr': True, 'bull_use_adx': False, 'bull_use_spike': False, 'bull_rsi_required': True, 'bear_strategy': 'breakout', 'bear_bb_std_mult': 3.2623507483112304, 'bear_rsi_os': 25, 'bear_rsi_ob': 64, 'bear_adx_thresh': 23.479210888533714, 'bear_atr_min_pct': 0.002855337911763567, 'bear_atr_max_pct': 0.10310166173433469, 'bear_tp_mult': 1.4863139310661133, 'bear_tsl_mult': 0.7765407691848757, 'bear_time_stop': 219, 'bear_use_sma': True, 'bear_use_ema': True, 'bear_use_atr': False, 'bear_use_adx': False, 'bear_use_spike': False, 'bear_rsi_required': False, 'sideways_strategy': 'mean_reversion', 'sideways_bb_std_mult': 3.0391332341352513, 'sideways_rsi_os': 11, 'sideways_rsi_ob': 94, 'sideways_adx_thresh': 30.676200944618916, 'sideways_atr_min_pct': 0.027095360947838334, 'sideways_atr_max_pct': 0.028699804510135207, 'sideways_tp_mult': 2.225167702159458, 'sideways_tsl_mult': 0.5241803686999764, 'sideways_time_stop': 64, 'sideways_use_sma': False, 'sideways_use_ema': True, 'sideways_use_atr': False, 'sideways_use_adx': False, 'sideways_use_spike': True, 'sideways_rsi_required': False}.
[I 2025-08-30 18:31:47,663] Trial 30 finished with values: [-1000000000.0, 1000000000.0] and parameters: {'p_sma': 27, 'p_std': 32, 'p_atr': 24, 'p_adx': 24, 'rsi_period': 7, 'ema1': 11, 'ema2': 31, 'slip_atr_k': 0.05697858481998391, 'slip_spread_k': 0.14459099946851228, 'spread_hl_frac': 0.030393412259751906, 'bb_std_mult': 1.8481303112624534, 'rsi_os': 48, 'rsi_ob': 52, 'vol_spike': 0.1255369838925244, 'adx_thresh': 20.461849745440478, 'atr_min_pct': 0.01111656237198821, 'atr_max_pct': 0.07481814764228527, 'tp_mult': 2.0391994711606114, 'tsl_mult': 0.42809299994904687, 'strategy': 'breakout', 'time_stop': 256, 'use_sma': False, 'use_atr': True, 'use_adx': True, 'use_ema': True, 'use_spike': True, 'rsi_required': False, 'edge_k': 1.6767438313340624, 'edge_cap': 0.2738414642371807, 'bull_strategy': 'mean_reversion', 'bull_bb_std_mult': 1.1870532030032521, 'bull_rsi_os': 37, 'bull_rsi_ob': 67, 'bull_adx_thresh': 28.55274476365044, 'bull_atr_min_pct': 0.015190098737088329, 'bull_atr_max_pct': 0.06130379497177792, 'bull_tp_mult': 1.7092823762969505, 'bull_tsl_mult': 0.08910416199704796, 'bull_time_stop': 181, 'bull_use_sma': False, 'bull_use_ema': False, 'bull_use_atr': True, 'bull_use_adx': False, 'bull_use_spike': False, 'bull_rsi_required': True, 'bear_strategy': 'breakout', 'bear_bb_std_mult': 2.4527355915988687, 'bear_rsi_os': 25, 'bear_rsi_ob': 64, 'bear_adx_thresh': 23.25752580804842, 'bear_atr_min_pct': 0.007817953199591854, 'bear_atr_max_pct': 0.1315521044541264, 'bear_tp_mult': 1.4043777889096676, 'bear_tsl_mult': 0.8869724147073239, 'bear_time_stop': 224, 'bear_use_sma': True, 'bear_use_ema': True, 'bear_use_atr': False, 'bear_use_adx': False, 'bear_use_spike': False, 'bear_rsi_required': False, 'sideways_strategy': 'mean_reversion', 'sideways_bb_std_mult': 0.6293933575472397, 'sideways_rsi_os': 9, 'sideways_rsi_ob': 82, 'sideways_adx_thresh': 29.237901814394853, 'sideways_atr_min_pct': 0.02708907174528727, 'sideways_atr_max_pct': 0.058963333124705565, 'sideways_tp_mult': 1.9125428166384302, 'sideways_tsl_mult': 0.512744341916923, 'sideways_time_stop': 66, 'sideways_use_sma': False, 'sideways_use_ema': True, 'sideways_use_atr': False, 'sideways_use_adx': False, 'sideways_use_spike': True, 'sideways_rsi_required': False}.
[I 2025-08-30 18:32:19,103] Trial 31 finished with values: [-1000000000.0, 1000000000.0] and parameters: {'p_sma': 28, 'p_std': 23, 'p_atr': 23, 'p_adx': 24, 'rsi_period': 7, 'ema1': 19, 'ema2': 32, 'slip_atr_k': 0.06293965545747392, 'slip_spread_k': 0.6052600075247637, 'spread_hl_frac': 0.02996450417077072, 'bb_std_mult': 1.8193915309078634, 'rsi_os': 46, 'rsi_ob': 52, 'vol_spike': 0.0781154801018811, 'adx_thresh': 13.957461124748917, 'atr_min_pct': 0.01083072063368325, 'atr_max_pct': 0.09044876658419981, 'tp_mult': 2.0697490114428883, 'tsl_mult': 0.40560137659662054, 'strategy': 'breakout', 'time_stop': 266, 'use_sma': False, 'use_atr': True, 'use_adx': True, 'use_ema': True, 'use_spike': True, 'rsi_required': False, 'edge_k': 1.3515428478314986, 'edge_cap': 0.2856335911103707, 'bull_strategy': 'mean_reversion', 'bull_bb_std_mult': 2.2841423665483194, 'bull_rsi_os': 37, 'bull_rsi_ob': 95, 'bull_adx_thresh': 34.12959370291355, 'bull_atr_min_pct': 0.015171081047286657, 'bull_atr_max_pct': 0.02302633557140893, 'bull_tp_mult': 1.7094908886450986, 'bull_tsl_mult': 0.09016273811563323, 'bull_time_stop': 182, 'bull_use_sma': False, 'bull_use_ema': False, 'bull_use_atr': True, 'bull_use_adx': False, 'bull_use_spike': False, 'bull_rsi_required': True, 'bear_strategy': 'breakout', 'bear_bb_std_mult': 2.3649833238653932, 'bear_rsi_os': 41, 'bear_rsi_ob': 73, 'bear_adx_thresh': 24.19690309815828, 'bear_atr_min_pct': 0.0076271487675753005, 'bear_atr_max_pct': 0.0849721081422225, 'bear_tp_mult': 1.694089651709, 'bear_tsl_mult': 0.8876695941284586, 'bear_time_stop': 272, 'bear_use_sma': True, 'bear_use_ema': True, 'bear_use_atr': True, 'bear_use_adx': True, 'bear_use_spike': False, 'bear_rsi_required': False, 'sideways_strategy': 'mean_reversion', 'sideways_bb_std_mult': 0.5377934960920625, 'sideways_rsi_os': 11, 'sideways_rsi_ob': 46, 'sideways_adx_thresh': 27.166484711144378, 'sideways_atr_min_pct': 0.027669951554369878, 'sideways_atr_max_pct': 0.02748057353797579, 'sideways_tp_mult': 1.9126193179092197, 'sideways_tsl_mult': 0.5189837903389768, 'sideways_time_stop': 170, 'sideways_use_sma': False, 'sideways_use_ema': True, 'sideways_use_atr': False, 'sideways_use_adx': False, 'sideways_use_spike': True, 'sideways_rsi_required': False}.
[I 2025-08-30 18:32:21,511] Trial 34 finished with values: [-1000000000.0, 1000000000.0] and parameters: {'p_sma': 36, 'p_std': 22, 'p_atr': 21, 'p_adx': 19, 'rsi_period': 33, 'ema1': 20, 'ema2': 25, 'slip_atr_k': 0.1446140420014459, 'slip_spread_k': 0.0018030319206256973, 'spread_hl_frac': 0.03741147398961868, 'bb_std_mult': 0.8230996757525377, 'rsi_os': 6, 'rsi_ob': 52, 'vol_spike': 0.07858759651787622, 'adx_thresh': 12.739528909044381, 'atr_min_pct': 0.0074445832237146105, 'atr_max_pct': 0.09328618147197833, 'tp_mult': 2.3610482647788653, 'tsl_mult': 0.686959123905223, 'strategy': 'mean_reversion', 'time_stop': 205, 'use_sma': True, 'use_atr': True, 'use_adx': True, 'use_ema': True, 'use_spike': True, 'rsi_required': True, 'edge_k': 1.2953436607910724, 'edge_cap': 0.9601068155793042, 'bull_strategy': 'mean_reversion', 'bull_bb_std_mult': 1.82753952492722, 'bull_rsi_os': 18, 'bull_rsi_ob': 47, 'bull_adx_thresh': 32.803363539336324, 'bull_atr_min_pct': 0.002561725339192953, 'bull_atr_max_pct': 0.07382501478884769, 'bull_tp_mult': 1.425376830575985, 'bull_tsl_mult': 0.01799739026013636, 'bull_time_stop': 292, 'bull_use_sma': True, 'bull_use_ema': True, 'bull_use_atr': True, 'bull_use_adx': False, 'bull_use_spike': False, 'bull_rsi_required': False, 'bear_strategy': 'breakout', 'bear_bb_std_mult': 2.7928641648598656, 'bear_rsi_os': 44, 'bear_rsi_ob': 72, 'bear_adx_thresh': 18.23316646633329, 'bear_atr_min_pct': 0.0060626209138259935, 'bear_atr_max_pct': 0.0846166970314211, 'bear_tp_mult': 1.6747759305064147, 'bear_tsl_mult': 0.8900541980444693, 'bear_time_stop': 275, 'bear_use_sma': True, 'bear_use_ema': True, 'bear_use_atr': True, 'bear_use_adx': True, 'bear_use_spike': False, 'bear_rsi_required': True, 'sideways_strategy': 'breakout', 'sideways_bb_std_mult': 2.318391050729249, 'sideways_rsi_os': 43, 'sideways_rsi_ob': 89, 'sideways_adx_thresh': 26.277355929157025, 'sideways_atr_min_pct': 0.02979639206173358, 'sideways_atr_max_pct': 0.05513414322388024, 'sideways_tp_mult': 2.983768711601421, 'sideways_tsl_mult': 0.9097592687188687, 'sideways_time_stop': 177, 'sideways_use_sma': False, 'sideways_use_ema': False, 'sideways_use_atr': True, 'sideways_use_adx': False, 'sideways_use_spike': True, 'sideways_rsi_required': True}.
[I 2025-08-30 18:32:21,710] Trial 33 finished with values: [-1000000000.0, 1000000000.0] and parameters: {'p_sma': 26, 'p_std': 23, 'p_atr': 20, 'p_adx': 24, 'rsi_period': 31, 'ema1': 12, 'ema2': 34, 'slip_atr_k': 0.05262341261280899, 'slip_spread_k': 0.17866886541653004, 'spread_hl_frac': 0.030164283742626908, 'bb_std_mult': 0.7688965154058187, 'rsi_os': 45, 'rsi_ob': 52, 'vol_spike': 0.07448025172487242, 'adx_thresh': 5.748227310086289, 'atr_min_pct': 0.01150565921570117, 'atr_max_pct': 0.08759269399427165, 'tp_mult': 2.356991016857617, 'tsl_mult': 0.40336664663152316, 'strategy': 'mean_reversion', 'time_stop': 200, 'use_sma': True, 'use_atr': False, 'use_adx': True, 'use_ema': False, 'use_spike': False, 'rsi_required': True, 'edge_k': 1.6589273441250842, 'edge_cap': 0.2742862828130831, 'bull_strategy': 'breakout', 'bull_bb_std_mult': 1.7686351512012348, 'bull_rsi_os': 18, 'bull_rsi_ob': 68, 'bull_adx_thresh': 33.44020213531634, 'bull_atr_min_pct': 0.015314851518687127, 'bull_atr_max_pct': 0.07187869537042281, 'bull_tp_mult': 1.590066982665356, 'bull_tsl_mult': 0.008413714415983563, 'bull_time_stop': 271, 'bull_use_sma': True, 'bull_use_ema': True, 'bull_use_atr': False, 'bull_use_adx': True, 'bull_use_spike': True, 'bull_rsi_required': False, 'bear_strategy': 'mean_reversion', 'bear_bb_std_mult': 2.5047826909033177, 'bear_rsi_os': 41, 'bear_rsi_ob': 73, 'bear_adx_thresh': 17.982952261506824, 'bear_atr_min_pct': 0.029784562533208096, 'bear_atr_max_pct': 0.08397790158857343, 'bear_tp_mult': 1.7143983972828907, 'bear_tsl_mult': 0.8795454185752127, 'bear_time_stop': 273, 'bear_use_sma': False, 'bear_use_ema': True, 'bear_use_atr': True, 'bear_use_adx': True, 'bear_use_spike': True, 'bear_rsi_required': True, 'sideways_strategy': 'breakout', 'sideways_bb_std_mult': 0.6406664641412017, 'sideways_rsi_os': 44, 'sideways_rsi_ob': 82, 'sideways_adx_thresh': 25.990465515808552, 'sideways_atr_min_pct': 0.015502207207063147, 'sideways_atr_max_pct': 0.053881245674614754, 'sideways_tp_mult': 1.9290695963444242, 'sideways_tsl_mult': 0.8806828713848621, 'sideways_time_stop': 167, 'sideways_use_sma': True, 'sideways_use_ema': False, 'sideways_use_atr': True, 'sideways_use_adx': True, 'sideways_use_spike': False, 'sideways_rsi_required': True}.
[I 2025-08-30 18:32:21,895] Trial 32 finished with values: [-1000000000.0, 1000000000.0] and parameters: {'p_sma': 27, 'p_std': 23, 'p_atr': 20, 'p_adx': 24, 'rsi_period': 32, 'ema1': 21, 'ema2': 32, 'slip_atr_k': 0.055674770935487006, 'slip_spread_k': 0.0028019083605816952, 'spread_hl_frac': 0.029952476719655646, 'bb_std_mult': 1.8058577849405117, 'rsi_os': 45, 'rsi_ob': 52, 'vol_spike': 0.20832152880801633, 'adx_thresh': 11.77837185918803, 'atr_min_pct': 0.010194983905475862, 'atr_max_pct': 0.09307896804285841, 'tp_mult': 2.1307673874542346, 'tsl_mult': 0.6892198876239556, 'strategy': 'mean_reversion', 'time_stop': 193, 'use_sma': False, 'use_atr': True, 'use_adx': True, 'use_ema': True, 'use_spike': True, 'rsi_required': False, 'edge_k': 1.377660618233529, 'edge_cap': 0.27668268151056874, 'bull_strategy': 'mean_reversion', 'bull_bb_std_mult': 1.7274219585856678, 'bull_rsi_os': 18, 'bull_rsi_ob': 52, 'bull_adx_thresh': 33.83221277819682, 'bull_atr_min_pct': 0.015389774193584026, 'bull_atr_max_pct': 0.07194436611185971, 'bull_tp_mult': 1.6957566743201853, 'bull_tsl_mult': 0.031723977439378825, 'bull_time_stop': 181, 'bull_use_sma': False, 'bull_use_ema': True, 'bull_use_atr': True, 'bull_use_adx': False, 'bull_use_spike': False, 'bull_rsi_required': True, 'bear_strategy': 'breakout', 'bear_bb_std_mult': 2.41464828767441, 'bear_rsi_os': 41, 'bear_rsi_ob': 74, 'bear_adx_thresh': 22.472970984430884, 'bear_atr_min_pct': 0.007408935322525003, 'bear_atr_max_pct': 0.13418331530235175, 'bear_tp_mult': 1.6755773774449574, 'bear_tsl_mult': 0.8962257314738233, 'bear_time_stop': 162, 'bear_use_sma': True, 'bear_use_ema': True, 'bear_use_atr': True, 'bear_use_adx': True, 'bear_use_spike': False, 'bear_rsi_required': False, 'sideways_strategy': 'mean_reversion', 'sideways_bb_std_mult': 2.282313551799159, 'sideways_rsi_os': 11, 'sideways_rsi_ob': 46, 'sideways_adx_thresh': 25.286917705368634, 'sideways_atr_min_pct': 0.015847644869622108, 'sideways_atr_max_pct': 0.05516245447639524, 'sideways_tp_mult': 1.8641322886763374, 'sideways_tsl_mult': 0.48147659986169217, 'sideways_time_stop': 163, 'sideways_use_sma': False, 'sideways_use_ema': False, 'sideways_use_atr': True, 'sideways_use_adx': False, 'sideways_use_spike': True, 'sideways_rsi_required': False}.
[I 2025-08-30 18:32:52,386] Trial 35 finished with values: [-1000000000.0, 1000000000.0] and parameters: {'p_sma': 37, 'p_std': 48, 'p_atr': 21, 'p_adx': 19, 'rsi_period': 33, 'ema1': 21, 'ema2': 25, 'slip_atr_k': 0.16357723267695184, 'slip_spread_k': 0.4680276479279905, 'spread_hl_frac': 0.04594323779357729, 'bb_std_mult': 0.8492817332401272, 'rsi_os': 5, 'rsi_ob': 54, 'vol_spike': 0.2156897861266785, 'adx_thresh': 9.742718312732823, 'atr_min_pct': 0.0067573771110237294, 'atr_max_pct': 0.09899606374101755, 'tp_mult': 2.4087294607995458, 'tsl_mult': 0.7001456694418176, 'strategy': 'mean_reversion', 'time_stop': 202, 'use_sma': True, 'use_atr': False, 'use_adx': True, 'use_ema': False, 'use_spike': False, 'rsi_required': True, 'edge_k': 0.5472744431066229, 'edge_cap': 0.9768378712813761, 'bull_strategy': 'breakout', 'bull_bb_std_mult': 1.7992816966667793, 'bull_rsi_os': 18, 'bull_rsi_ob': 46, 'bull_adx_thresh': 22.14100665123235, 'bull_atr_min_pct': 0.00347190657812975, 'bull_atr_max_pct': 0.04401898634742942, 'bull_tp_mult': 1.422503201453449, 'bull_tsl_mult': 0.0037494667987897357, 'bull_time_stop': 295, 'bull_use_sma': True, 'bull_use_ema': True, 'bull_use_atr': False, 'bull_use_adx': True, 'bull_use_spike': True, 'bull_rsi_required': False, 'bear_strategy': 'mean_reversion', 'bear_bb_std_mult': 2.7469590800288977, 'bear_rsi_os': 55, 'bear_rsi_ob': 84, 'bear_adx_thresh': 18.12457270669451, 'bear_atr_min_pct': 0.029993122581738384, 'bear_atr_max_pct': 0.071232522019465, 'bear_tp_mult': 1.7544367163532932, 'bear_tsl_mult': 0.6710138911027359, 'bear_time_stop': 155, 'bear_use_sma': False, 'bear_use_ema': True, 'bear_use_atr': True, 'bear_use_adx': True, 'bear_use_spike': True, 'bear_rsi_required': True, 'sideways_strategy': 'breakout', 'sideways_bb_std_mult': 2.50056593896959, 'sideways_rsi_os': 46, 'sideways_rsi_ob': 88, 'sideways_adx_thresh': 23.349227442676447, 'sideways_atr_min_pct': 0.006818188181018422, 'sideways_atr_max_pct': 0.0557721104786738, 'sideways_tp_mult': 2.9068226168923887, 'sideways_tsl_mult': 0.880499198272958, 'sideways_time_stop': 258, 'sideways_use_sma': True, 'sideways_use_ema': False, 'sideways_use_atr': True, 'sideways_use_adx': True, 'sideways_use_spike': False, 'sideways_rsi_required': True}.
