[I 2025-08-30 18:39:41,867] Trial 90 finished with values: [-1000000000.0, 1000000000.0] and parameters: {'p_sma': 50, 'p_std': 34, 'p_atr': 8, 'p_adx': 15, 'rsi_period': 20, 'ema1': 19, 'ema2': 35, 'slip_atr_k': 0.12374257360400824, 'slip_spread_k': 0.9709763634419711, 'spread_hl_frac': 0.039196023301392574, 'bb_std_mult': 2.3096104974519784, 'rsi_os': 34, 'rsi_ob': 83, 'vol_spike': 0.04324355781452165, 'adx_thresh': 18.533831480114138, 'atr_min_pct': 0.023648150807387525, 'atr_max_pct': 0.08224295006555558, 'tp_mult': 2.2531095237830985, 'tsl_mult': 0.8247444096617456, 'strategy': 'mean_reversion', 'time_stop': 171, 'use_sma': True, 'use_atr': False, 'use_adx': True, 'use_ema': False, 'use_spike': True, 'rsi_required': False, 'edge_k': 0.4694956998376574, 'edge_cap': 0.7548965938680604, 'bull_strategy': 'mean_reversion', 'bull_bb_std_mult': 1.7851636307779757, 'bull_rsi_os': 19, 'bull_rsi_ob': 83, 'bull_adx_thresh': 18.061445938841338, 'bull_atr_min_pct': 0.020621740022619874, 'bull_atr_max_pct': 0.09365038913905656, 'bull_tp_mult': 2.296539152750635, 'bull_tsl_mult': 0.8424093211200319, 'bull_time_stop': 179, 'bull_use_sma': True, 'bull_use_ema': True, 'bull_use_atr': False, 'bull_use_adx': True, 'bull_use_spike': True, 'bull_rsi_required': False, 'bear_strategy': 'breakout', 'bear_bb_std_mult': 3.2164739157701123, 'bear_rsi_os': 28, 'bear_rsi_ob': 81, 'bear_adx_thresh': 15.009423711797405, 'bear_atr_min_pct': 0.010773681117503587, 'bear_atr_max_pct': 0.04255467226429826, 'bear_tp_mult': 2.2840230460779405, 'bear_tsl_mult': 0.10597446776957292, 'bear_time_stop': 217, 'bear_use_sma': True, 'bear_use_ema': True, 'bear_use_atr': False, 'bear_use_adx': False, 'bear_use_spike': True, 'bear_rsi_required': False, 'sideways_strategy': 'breakout', 'sideways_bb_std_mult': 3.5642794361478294, 'sideways_rsi_os': 35, 'sideways_rsi_ob': 88, 'sideways_adx_thresh': 20.497643439437027, 'sideways_atr_min_pct': 0.017737608822773716, 'sideways_atr_max_pct': 0.07411207948384754, 'sideways_tp_mult': 2.7988386072759694, 'sideways_tsl_mult': 0.011089843920220471, 'sideways_time_stop': 78, 'sideways_use_sma': False, 'sideways_use_ema': True, 'sideways_use_atr': True, 'sideways_use_adx': False, 'sideways_use_spike': True, 'sideways_rsi_required': False}.
[I 2025-08-30 18:39:42,063] Trial 91 finished with values: [-0.026555874821681424, 0.02646188983360969] and parameters: {'p_sma': 49, 'p_std': 52, 'p_atr': 8, 'p_adx': 14, 'rsi_period': 13, 'ema1': 20, 'ema2': 35, 'slip_atr_k': 0.13556789724933466, 'slip_spread_k': 0.9686432624215813, 'spread_hl_frac': 0.034734443073893354, 'bb_std_mult': 2.316662610553996, 'rsi_os': 37, 'rsi_ob': 50, 'vol_spike': 0.042091891134089364, 'adx_thresh': 15.854403428893551, 'atr_min_pct': 0.021361415682522294, 'atr_max_pct': 0.08289767471604605, 'tp_mult': 2.013742139441999, 'tsl_mult': 0.8368468990690966, 'strategy': 'breakout', 'time_stop': 167, 'use_sma': True, 'use_atr': False, 'use_adx': True, 'use_ema': True, 'use_spike': True, 'rsi_required': False, 'edge_k': 0.45473052671063263, 'edge_cap': 0.7293699415400551, 'bull_strategy': 'mean_reversion', 'bull_bb_std_mult': 3.1617453323615523, 'bull_rsi_os': 45, 'bull_rsi_ob': 84, 'bull_adx_thresh': 18.38943410276279, 'bull_atr_min_pct': 0.0014241576187227923, 'bull_atr_max_pct': 0.1445550290766081, 'bull_tp_mult': 2.1232043217456487, 'bull_tsl_mult': 0.8299433525423789, 'bull_time_stop': 156, 'bull_use_sma': True, 'bull_use_ema': False, 'bull_use_atr': False, 'bull_use_adx': True, 'bull_use_spike': True, 'bull_rsi_required': False, 'bear_strategy': 'breakout', 'bear_bb_std_mult': 3.1801084444979164, 'bear_rsi_os': 30, 'bear_rsi_ob': 81, 'bear_adx_thresh': 13.670238235280168, 'bear_atr_min_pct': 0.010705708971752728, 'bear_atr_max_pct': 0.017594785194028947, 'bear_tp_mult': 2.3001528105771927, 'bear_tsl_mult': 0.11977630327828158, 'bear_time_stop': 229, 'bear_use_sma': True, 'bear_use_ema': True, 'bear_use_atr': False, 'bear_use_adx': True, 'bear_use_spike': True, 'bear_rsi_required': False, 'sideways_strategy': 'breakout', 'sideways_bb_std_mult': 3.48997470136809, 'sideways_rsi_os': 5, 'sideways_rsi_ob': 88, 'sideways_adx_thresh': 18.742168993214058, 'sideways_atr_min_pct': 0.01741564310016254, 'sideways_atr_max_pct': 0.12500349973683375, 'sideways_tp_mult': 1.4865591568087617, 'sideways_tsl_mult': 0.02188321726140506, 'sideways_time_stop': 73, 'sideways_use_sma': False, 'sideways_use_ema': True, 'sideways_use_atr': True, 'sideways_use_adx': False, 'sideways_use_spike': True, 'sideways_rsi_required': False}.
[I 2025-08-30 18:39:42,185] Trial 92 finished with values: [-1000000000.0, 1000000000.0] and parameters: {'p_sma': 55, 'p_std': 27, 'p_atr': 8, 'p_adx': 15, 'rsi_period': 14, 'ema1': 20, 'ema2': 35, 'slip_atr_k': 0.1148359222241621, 'slip_spread_k': 0.9820220527302208, 'spread_hl_frac': 0.00599984169308538, 'bb_std_mult': 2.497760116364784, 'rsi_os': 37, 'rsi_ob': 50, 'vol_spike': 0.2773626647600316, 'adx_thresh': 21.198034129212008, 'atr_min_pct': 0.020941249870807352, 'atr_max_pct': 0.08221123414516415, 'tp_mult': 1.9175001431456633, 'tsl_mult': 0.24489498846972085, 'strategy': 'breakout', 'time_stop': 172, 'use_sma': True, 'use_atr': False, 'use_adx': True, 'use_ema': True, 'use_spike': False, 'rsi_required': False, 'edge_k': 0.3484643568725614, 'edge_cap': 0.7471313881560342, 'bull_strategy': 'mean_reversion', 'bull_bb_std_mult': 2.107775223207089, 'bull_rsi_os': 44, 'bull_rsi_ob': 84, 'bull_adx_thresh': 18.04390995762795, 'bull_atr_min_pct': 0.016327083060625237, 'bull_atr_max_pct': 0.14525729679318264, 'bull_tp_mult': 2.304045838700443, 'bull_tsl_mult': 0.8437983470177722, 'bull_time_stop': 220, 'bull_use_sma': False, 'bull_use_ema': False, 'bull_use_atr': False, 'bull_use_adx': True, 'bull_use_spike': True, 'bull_rsi_required': False, 'bear_strategy': 'breakout', 'bear_bb_std_mult': 3.496049904541322, 'bear_rsi_os': 30, 'bear_rsi_ob': 87, 'bear_adx_thresh': 13.40995415095872, 'bear_atr_min_pct': 0.00711317312239155, 'bear_atr_max_pct': 0.01757385152873365, 'bear_tp_mult': 2.697747079823148, 'bear_tsl_mult': 0.05639818578314333, 'bear_time_stop': 216, 'bear_use_sma': False, 'bear_use_ema': True, 'bear_use_atr': False, 'bear_use_adx': True, 'bear_use_spike': True, 'bear_rsi_required': False, 'sideways_strategy': 'breakout', 'sideways_bb_std_mult': 3.5688223448219794, 'sideways_rsi_os': 45, 'sideways_rsi_ob': 88, 'sideways_adx_thresh': 18.240954814507216, 'sideways_atr_min_pct': 0.020691883465814853, 'sideways_atr_max_pct': 0.12531720829190135, 'sideways_tp_mult': 1.9812201506322322, 'sideways_tsl_mult': 0.04024220698009229, 'sideways_time_stop': 122, 'sideways_use_sma': True, 'sideways_use_ema': True, 'sideways_use_atr': True, 'sideways_use_adx': False, 'sideways_use_spike': True, 'sideways_rsi_required': False}.
[I 2025-08-30 18:40:12,848] Trial 93 finished with values: [-1000000000.0, 1000000000.0] and parameters: {'p_sma': 13, 'p_std': 35, 'p_atr': 8, 'p_adx': 17, 'rsi_period': 13, 'ema1': 27, 'ema2': 36, 'slip_atr_k': 0.06228589892147999, 'slip_spread_k': 0.15159896619141902, 'spread_hl_frac': 0.021578221516361306, 'bb_std_mult': 2.3224540089624686, 'rsi_os': 26, 'rsi_ob': 82, 'vol_spike': 0.2639961474744272, 'adx_thresh': 34.11277960611026, 'atr_min_pct': 0.020793788868034426, 'atr_max_pct': 0.09584737028890529, 'tp_mult': 2.2573499857387302, 'tsl_mult': 0.896240547994041, 'strategy': 'mean_reversion', 'time_stop': 175, 'use_sma': False, 'use_atr': False, 'use_adx': False, 'use_ema': False, 'use_spike': False, 'rsi_required': False, 'edge_k': 0.03941114676363, 'edge_cap': 0.4770960247087645, 'bull_strategy': 'breakout', 'bull_bb_std_mult': 2.87731015459789, 'bull_rsi_os': 46, 'bull_rsi_ob': 46, 'bull_adx_thresh': 18.482119013235547, 'bull_atr_min_pct': 0.0012335467906831512, 'bull_atr_max_pct': 0.11798510457684126, 'bull_tp_mult': 2.8245994309676288, 'bull_tsl_mult': 0.5369534710401274, 'bull_time_stop': 158, 'bull_use_sma': True, 'bull_use_ema': True, 'bull_use_atr': False, 'bull_use_adx': True, 'bull_use_spike': True, 'bull_rsi_required': False, 'bear_strategy': 'breakout', 'bear_bb_std_mult': 2.866427680281817, 'bear_rsi_os': 52, 'bear_rsi_ob': 86, 'bear_adx_thresh': 13.02828307509467, 'bear_atr_min_pct': 0.014753522812805854, 'bear_atr_max_pct': 0.04310056687555108, 'bear_tp_mult': 2.3138997326892703, 'bear_tsl_mult': 0.8664136416433612, 'bear_time_stop': 217, 'bear_use_sma': True, 'bear_use_ema': True, 'bear_use_atr': False, 'bear_use_adx': False, 'bear_use_spike': True, 'bear_rsi_required': True, 'sideways_strategy': 'breakout', 'sideways_bb_std_mult': 2.8094956843288736, 'sideways_rsi_os': 43, 'sideways_rsi_ob': 54, 'sideways_adx_thresh': 17.653949619192673, 'sideways_atr_min_pct': 0.004649383285868046, 'sideways_atr_max_pct': 0.07517732784221821, 'sideways_tp_mult': 2.886570139368521, 'sideways_tsl_mult': 0.7664835055615152, 'sideways_time_stop': 123, 'sideways_use_sma': True, 'sideways_use_ema': True, 'sideways_use_atr': True, 'sideways_use_adx': False, 'sideways_use_spike': False, 'sideways_rsi_required': True}.
[I 2025-08-30 18:40:14,339] Trial 95 finished with values: [-1000000000.0, 1000000000.0] and parameters: {'p_sma': 14, 'p_std': 41, 'p_atr': 10, 'p_adx': 19, 'rsi_period': 26, 'ema1': 27, 'ema2': 35, 'slip_atr_k': 0.025240050554063996, 'slip_spread_k': 0.12630222311224537, 'spread_hl_frac': 0.023479190075383925, 'bb_std_mult': 2.5217610639407866, 'rsi_os': 45, 'rsi_ob': 83, 'vol_spike': 0.2755802259263665, 'adx_thresh': 33.9290261533313, 'atr_min_pct': 0.0210919137790641, 'atr_max_pct': 0.09426966341603592, 'tp_mult': 2.2931585015345948, 'tsl_mult': 0.8956810978033153, 'strategy': 'mean_reversion', 'time_stop': 180, 'use_sma': False, 'use_atr': True, 'use_adx': False, 'use_ema': False, 'use_spike': False, 'rsi_required': False, 'edge_k': 0.06309915842942562, 'edge_cap': 0.5746497070208628, 'bull_strategy': 'breakout', 'bull_bb_std_mult': 2.84539051735592, 'bull_rsi_os': 44, 'bull_rsi_ob': 46, 'bull_adx_thresh': 19.914896738879072, 'bull_atr_min_pct': 0.0012779254687773482, 'bull_atr_max_pct': 0.11757622927976133, 'bull_tp_mult': 2.918131115219204, 'bull_tsl_mult': 0.5283734240784198, 'bull_time_stop': 159, 'bull_use_sma': False, 'bull_use_ema': True, 'bull_use_atr': True, 'bull_use_adx': True, 'bull_use_spike': False, 'bull_rsi_required': False, 'bear_strategy': 'breakout', 'bear_bb_std_mult': 2.8411007296044684, 'bear_rsi_os': 53, 'bear_rsi_ob': 77, 'bear_adx_thresh': 13.462111750254603, 'bear_atr_min_pct': 0.01544352621771172, 'bear_atr_max_pct': 0.01652514382123421, 'bear_tp_mult': 2.684748736812845, 'bear_tsl_mult': 0.3271564341813795, 'bear_time_stop': 228, 'bear_use_sma': True, 'bear_use_ema': True, 'bear_use_atr': False, 'bear_use_adx': False, 'bear_use_spike': False, 'bear_rsi_required': True, 'sideways_strategy': 'breakout', 'sideways_bb_std_mult': 2.819995719015282, 'sideways_rsi_os': 45, 'sideways_rsi_ob': 53, 'sideways_adx_thresh': 18.69906713724854, 'sideways_atr_min_pct': 0.006097536552416457, 'sideways_atr_max_pct': 0.08435362554975448, 'sideways_tp_mult': 1.0582377165947365, 'sideways_tsl_mult': 0.16914561439246228, 'sideways_time_stop': 126, 'sideways_use_sma': True, 'sideways_use_ema': True, 'sideways_use_atr': True, 'sideways_use_adx': False, 'sideways_use_spike': False, 'sideways_rsi_required': True}.
[I 2025-08-30 18:40:14,545] Trial 96 finished with values: [-1000000000.0, 1000000000.0] and parameters: {'p_sma': 5, 'p_std': 35, 'p_atr': 10, 'p_adx': 17, 'rsi_period': 27, 'ema1': 27, 'ema2': 35, 'slip_atr_k': 0.06370779282244893, 'slip_spread_k': 0.14305347283475328, 'spread_hl_frac': 0.021716565625914133, 'bb_std_mult': 2.0763039709430737, 'rsi_os': 45, 'rsi_ob': 83, 'vol_spike': 0.19322863351131025, 'adx_thresh': 33.61507961569548, 'atr_min_pct': 0.021571218495924097, 'atr_max_pct': 0.09626536025103877, 'tp_mult': 1.1040212412104708, 'tsl_mult': 0.33676315261407075, 'strategy': 'mean_reversion', 'time_stop': 186, 'use_sma': False, 'use_atr': True, 'use_adx': False, 'use_ema': False, 'use_spike': True, 'rsi_required': False, 'edge_k': 0.0541970247142729, 'edge_cap': 0.5645649624105201, 'bull_strategy': 'breakout', 'bull_bb_std_mult': 2.854595847229714, 'bull_rsi_os': 55, 'bull_rsi_ob': 46, 'bull_adx_thresh': 20.06746751033801, 'bull_atr_min_pct': 0.001098482334745329, 'bull_atr_max_pct': 0.11888951108907375, 'bull_tp_mult': 2.827501971496117, 'bull_tsl_mult': 0.5385112386884471, 'bull_time_stop': 158, 'bull_use_sma': False, 'bull_use_ema': True, 'bull_use_atr': True, 'bull_use_adx': False, 'bull_use_spike': False, 'bull_rsi_required': True, 'bear_strategy': 'breakout', 'bear_bb_std_mult': 2.9180248111378333, 'bear_rsi_os': 52, 'bear_rsi_ob': 77, 'bear_adx_thresh': 13.63410405643501, 'bear_atr_min_pct': 0.015726258385286133, 'bear_atr_max_pct': 0.036020073809979604, 'bear_tp_mult': 2.563809053311479, 'bear_tsl_mult': 0.32252253313925006, 'bear_time_stop': 205, 'bear_use_sma': True, 'bear_use_ema': True, 'bear_use_atr': False, 'bear_use_adx': False, 'bear_use_spike': False, 'bear_rsi_required': True, 'sideways_strategy': 'breakout', 'sideways_bb_std_mult': 2.796903196023483, 'sideways_rsi_os': 43, 'sideways_rsi_ob': 54, 'sideways_adx_thresh': 17.425794027190378, 'sideways_atr_min_pct': 0.006037322793442176, 'sideways_atr_max_pct': 0.0830424199404555, 'sideways_tp_mult': 1.0450504377295908, 'sideways_tsl_mult': 0.7701312852463182, 'sideways_time_stop': 119, 'sideways_use_sma': False, 'sideways_use_ema': True, 'sideways_use_atr': True, 'sideways_use_adx': False, 'sideways_use_spike': False, 'sideways_rsi_required': True}.
[I 2025-08-30 18:40:14,635] Trial 94 finished with values: [-1000000000.0, 1000000000.0] and parameters: {'p_sma': 14, 'p_std': 41, 'p_atr': 11, 'p_adx': 19, 'rsi_period': 26, 'ema1': 27, 'ema2': 34, 'slip_atr_k': 0.062173534822595966, 'slip_spread_k': 0.12028126060709493, 'spread_hl_frac': 0.024043607954664196, 'bb_std_mult': 2.4646950149867615, 'rsi_os': 45, 'rsi_ob': 93, 'vol_spike': 0.27263896307114344, 'adx_thresh': 34.13303170618041, 'atr_min_pct': 0.021388670987332378, 'atr_max_pct': 0.09415316148906876, 'tp_mult': 2.1390551954229244, 'tsl_mult': 0.2246944058894173, 'strategy': 'mean_reversion', 'time_stop': 185, 'use_sma': False, 'use_atr': True, 'use_adx': True, 'use_ema': False, 'use_spike': False, 'rsi_required': True, 'edge_k': 0.035482751321686726, 'edge_cap': 0.55275267949066, 'bull_strategy': 'breakout', 'bull_bb_std_mult': 2.92165560079815, 'bull_rsi_os': 45, 'bull_rsi_ob': 46, 'bull_adx_thresh': 19.946347967974365, 'bull_atr_min_pct': 0.00150302870861646, 'bull_atr_max_pct': 0.11754212403056528, 'bull_tp_mult': 2.837715469979608, 'bull_tsl_mult': 0.532718776373022, 'bull_time_stop': 157, 'bull_use_sma': False, 'bull_use_ema': True, 'bull_use_atr': True, 'bull_use_adx': False, 'bull_use_spike': False, 'bull_rsi_required': True, 'bear_strategy': 'breakout', 'bear_bb_std_mult': 2.883722127723563, 'bear_rsi_os': 53, 'bear_rsi_ob': 87, 'bear_adx_thresh': 13.638309577212816, 'bear_atr_min_pct': 0.015524353259237402, 'bear_atr_max_pct': 0.02471812518499017, 'bear_tp_mult': 2.6841236623638944, 'bear_tsl_mult': 0.8547264105062181, 'bear_time_stop': 208, 'bear_use_sma': False, 'bear_use_ema': True, 'bear_use_atr': False, 'bear_use_adx': False, 'bear_use_spike': False, 'bear_rsi_required': True, 'sideways_strategy': 'breakout', 'sideways_bb_std_mult': 3.11392890424477, 'sideways_rsi_os': 43, 'sideways_rsi_ob': 61, 'sideways_adx_thresh': 18.293931932435235, 'sideways_atr_min_pct': 0.006302571790059306, 'sideways_atr_max_pct': 0.12453101027755914, 'sideways_tp_mult': 1.0551631080360926, 'sideways_tsl_mult': 0.9812504724195029, 'sideways_time_stop': 117, 'sideways_use_sma': True, 'sideways_use_ema': True, 'sideways_use_atr': True, 'sideways_use_adx': False, 'sideways_use_spike': False, 'sideways_rsi_required': True}.
[I 2025-08-30 18:40:47,353] Trial 97 finished with values: [-1000000000.0, 1000000000.0] and parameters: {'p_sma': 5, 'p_std': 29, 'p_atr': 10, 'p_adx': 19, 'rsi_period': 27, 'ema1': 26, 'ema2': 33, 'slip_atr_k': 0.032416757474502685, 'slip_spread_k': 0.024920714511741854, 'spread_hl_frac': 0.023877953016137154, 'bb_std_mult': 2.0672542049183753, 'rsi_os': 46, 'rsi_ob': 88, 'vol_spike': 0.2774733428324726, 'adx_thresh': 31.64422365028733, 'atr_min_pct': 0.01939702573761362, 'atr_max_pct': 0.09154779359055251, 'tp_mult': 2.1351662545629706, 'tsl_mult': 0.8614415548386946, 'strategy': 'mean_reversion', 'time_stop': 186, 'use_sma': False, 'use_atr': True, 'use_adx': True, 'use_ema': False, 'use_spike': True, 'rsi_required': True, 'edge_k': 0.16411257848235247, 'edge_cap': 0.5775812437117561, 'bull_strategy': 'breakout', 'bull_bb_std_mult': 3.213099649861055, 'bull_rsi_os': 39, 'bull_rsi_ob': 45, 'bull_adx_thresh': 20.212214248701883, 'bull_atr_min_pct': 0.0014576088065411195, 'bull_atr_max_pct': 0.11425677299001138, 'bull_tp_mult': 2.7982258686439625, 'bull_tsl_mult': 0.33054650660783713, 'bull_time_stop': 155, 'bull_use_sma': False, 'bull_use_ema': True, 'bull_use_atr': True, 'bull_use_adx': False, 'bull_use_spike': False, 'bull_rsi_required': True, 'bear_strategy': 'breakout', 'bear_bb_std_mult': 2.8790768308790358, 'bear_rsi_os': 53, 'bear_rsi_ob': 77, 'bear_adx_thresh': 16.184240197962286, 'bear_atr_min_pct': 0.013164403442324876, 'bear_atr_max_pct': 0.11858897003792229, 'bear_tp_mult': 2.556038012046619, 'bear_tsl_mult': 0.8030917236899873, 'bear_time_stop': 230, 'bear_use_sma': True, 'bear_use_ema': True, 'bear_use_atr': False, 'bear_use_adx': False, 'bear_use_spike': False, 'bear_rsi_required': True, 'sideways_strategy': 'breakout', 'sideways_bb_std_mult': 2.9565299986402724, 'sideways_rsi_os': 39, 'sideways_rsi_ob': 62, 'sideways_adx_thresh': 24.025301943474815, 'sideways_atr_min_pct': 0.006189057315757161, 'sideways_atr_max_pct': 0.06479235843568687, 'sideways_tp_mult': 1.0560382213692854, 'sideways_tsl_mult': 0.982340094571744, 'sideways_time_stop': 143, 'sideways_use_sma': False, 'sideways_use_ema': True, 'sideways_use_atr': True, 'sideways_use_adx': False, 'sideways_use_spike': False, 'sideways_rsi_required': True}.
[I 2025-08-30 18:40:47,526] Trial 100 finished with values: [-1000000000.0, 1000000000.0] and parameters: {'p_sma': 9, 'p_std': 31, 'p_atr': 12, 'p_adx': 18, 'rsi_period': 21, 'ema1': 26, 'ema2': 32, 'slip_atr_k': 0.016628084726627843, 'slip_spread_k': 0.21615951681021228, 'spread_hl_frac': 0.019331977910104197, 'bb_std_mult': 1.8974290853668525, 'rsi_os': 47, 'rsi_ob': 87, 'vol_spike': 0.2528688136582855, 'adx_thresh': 31.51600914268017, 'atr_min_pct': 0.022820213393854046, 'atr_max_pct': 0.09994268365136443, 'tp_mult': 2.9846381937720174, 'tsl_mult': 0.9722573591411969, 'strategy': 'mean_reversion', 'time_stop': 196, 'use_sma': False, 'use_atr': True, 'use_adx': True, 'use_ema': False, 'use_spike': True, 'rsi_required': True, 'edge_k': 0.17506991145477896, 'edge_cap': 0.5172069348563274, 'bull_strategy': 'mean_reversion', 'bull_bb_std_mult': 3.166583450379103, 'bull_rsi_os': 39, 'bull_rsi_ob': 45, 'bull_adx_thresh': 23.133874582795467, 'bull_atr_min_pct': 0.002397843898730175, 'bull_atr_max_pct': 0.11368697892315481, 'bull_tp_mult': 2.897172164682543, 'bull_tsl_mult': 0.5910280891776359, 'bull_time_stop': 140, 'bull_use_sma': False, 'bull_use_ema': True, 'bull_use_atr': True, 'bull_use_adx': False, 'bull_use_spike': False, 'bull_rsi_required': True, 'bear_strategy': 'breakout', 'bear_bb_std_mult': 2.6795795386347616, 'bear_rsi_os': 48, 'bear_rsi_ob': 74, 'bear_adx_thresh': 16.10772696211388, 'bear_atr_min_pct': 0.013209974030096147, 'bear_atr_max_pct': 0.029395985182192972, 'bear_tp_mult': 2.41881065768116, 'bear_tsl_mult': 0.7009158843218458, 'bear_time_stop': 27, 'bear_use_sma': True, 'bear_use_ema': True, 'bear_use_atr': False, 'bear_use_adx': False, 'bear_use_spike': False, 'bear_rsi_required': True, 'sideways_strategy': 'breakout', 'sideways_bb_std_mult': 2.9241481512709955, 'sideways_rsi_os': 33, 'sideways_rsi_ob': 45, 'sideways_adx_thresh': 23.89128266886626, 'sideways_atr_min_pct': 0.004175599301617447, 'sideways_atr_max_pct': 0.14022407336847598, 'sideways_tp_mult': 1.1405147596634417, 'sideways_tsl_mult': 0.31478092356203996, 'sideways_time_stop': 142, 'sideways_use_sma': False, 'sideways_use_ema': False, 'sideways_use_atr': True, 'sideways_use_adx': True, 'sideways_use_spike': False, 'sideways_rsi_required': True}.
