[I 2025-08-30 19:26:40,482] Trial 503 finished with values: [-1000000000.0, 1000000000.0] and parameters: {'p_sma': 60, 'p_std': 31, 'p_atr': 22, 'p_adx': 29, 'rsi_period': 20, 'ema1': 27, 'ema2': 34, 'slip_atr_k': 0.017581389558195076, 'slip_spread_k': 0.2404443350849095, 'spread_hl_frac': 0.02098418314088179, 'bb_std_mult': 1.2499585807638711, 'rsi_os': 20, 'rsi_ob': 84, 'vol_spike': 0.0796590245738066, 'adx_thresh': 34.261825410323034, 'atr_min_pct': 0.023192486908129167, 'atr_max_pct': 0.0458775388719026, 'tp_mult': 1.4858455431951092, 'tsl_mult': 0.11120685250580731, 'strategy': 'mean_reversion', 'time_stop': 184, 'use_sma': True, 'use_atr': False, 'use_adx': True, 'use_ema': False, 'use_spike': True, 'rsi_required': True, 'edge_k': 0.07048024169871536, 'edge_cap': 0.24199323804887213, 'bull_strategy': 'mean_reversion', 'bull_bb_std_mult': 3.0252110350597206, 'bull_rsi_os': 47, 'bull_rsi_ob': 71, 'bull_adx_thresh': 21.287902162751045, 'bull_atr_min_pct': 0.002727059554805184, 'bull_atr_max_pct': 0.11207440917741526, 'bull_tp_mult': 2.6376873987665386, 'bull_tsl_mult': 0.5667112696895313, 'bull_time_stop': 171, 'bull_use_sma': False, 'bull_use_ema': True, 'bull_use_atr': True, 'bull_use_adx': False, 'bull_use_spike': False, 'bull_rsi_required': False, 'bear_strategy': 'breakout', 'bear_bb_std_mult': 0.6717412755857892, 'bear_rsi_os': 31, 'bear_rsi_ob': 77, 'bear_adx_thresh': 33.749040213303886, 'bear_atr_min_pct': 0.0027392927495264695, 'bear_atr_max_pct': 0.09681316722219033, 'bear_tp_mult': 2.8780791056565316, 'bear_tsl_mult': 0.24237015566002373, 'bear_time_stop': 236, 'bear_use_sma': True, 'bear_use_ema': False, 'bear_use_atr': True, 'bear_use_adx': False, 'bear_use_spike': False, 'bear_rsi_required': True, 'sideways_strategy': 'breakout', 'sideways_bb_std_mult': 3.42103805498077, 'sideways_rsi_os': 10, 'sideways_rsi_ob': 60, 'sideways_adx_thresh': 21.954731639985614, 'sideways_atr_min_pct': 0.01095783065697797, 'sideways_atr_max_pct': 0.14286709189015154, 'sideways_tp_mult': 1.088664589973743, 'sideways_tsl_mult': 0.2987069914290911, 'sideways_time_stop': 173, 'sideways_use_sma': False, 'sideways_use_ema': True, 'sideways_use_atr': False, 'sideways_use_adx': False, 'sideways_use_spike': True, 'sideways_rsi_required': True}.
[I 2025-08-30 19:26:40,778] Trial 502 finished with values: [-1000000000.0, 1000000000.0] and parameters: {'p_sma': 32, 'p_std': 33, 'p_atr': 17, 'p_adx': 21, 'rsi_period': 21, 'ema1': 30, 'ema2': 24, 'slip_atr_k': 0.07325246978743064, 'slip_spread_k': 0.22400350722708662, 'spread_hl_frac': 0.022376968451624554, 'bb_std_mult': 2.2206678476857578, 'rsi_os': 46, 'rsi_ob': 87, 'vol_spike': 0.24563034330027078, 'adx_thresh': 34.49996660374118, 'atr_min_pct': 0.0004823439438960339, 'atr_max_pct': 0.03191390713272493, 'tp_mult': 2.4085957763560852, 'tsl_mult': 0.8416541926209343, 'strategy': 'mean_reversion', 'time_stop': 165, 'use_sma': True, 'use_atr': False, 'use_adx': True, 'use_ema': False, 'use_spike': True, 'rsi_required': True, 'edge_k': 0.5867834949268013, 'edge_cap': 0.6274397503197662, 'bull_strategy': 'mean_reversion', 'bull_bb_std_mult': 2.0003252353949956, 'bull_rsi_os': 32, 'bull_rsi_ob': 75, 'bull_adx_thresh': 22.645016155442484, 'bull_atr_min_pct': 0.0003623918749699306, 'bull_atr_max_pct': 0.0910175308059874, 'bull_tp_mult': 1.707929198194004, 'bull_tsl_mult': 0.41208216645336687, 'bull_time_stop': 21, 'bull_use_sma': False, 'bull_use_ema': True, 'bull_use_atr': True, 'bull_use_adx': True, 'bull_use_spike': False, 'bull_rsi_required': False, 'bear_strategy': 'breakout', 'bear_bb_std_mult': 3.037558477728994, 'bear_rsi_os': 55, 'bear_rsi_ob': 77, 'bear_adx_thresh': 33.19511362851418, 'bear_atr_min_pct': 0.002829375094789581, 'bear_atr_max_pct': 0.06448126484751711, 'bear_tp_mult': 2.3690591126843477, 'bear_tsl_mult': 0.24044024480342174, 'bear_time_stop': 201, 'bear_use_sma': True, 'bear_use_ema': False, 'bear_use_atr': True, 'bear_use_adx': False, 'bear_use_spike': False, 'bear_rsi_required': True, 'sideways_strategy': 'mean_reversion', 'sideways_bb_std_mult': 3.2571132459474907, 'sideways_rsi_os': 52, 'sideways_rsi_ob': 59, 'sideways_adx_thresh': 22.234710570979395, 'sideways_atr_min_pct': 0.003211733287704692, 'sideways_atr_max_pct': 0.14223234857211978, 'sideways_tp_mult': 1.0796542138836724, 'sideways_tsl_mult': 0.9611137902180785, 'sideways_time_stop': 174, 'sideways_use_sma': False, 'sideways_use_ema': True, 'sideways_use_atr': False, 'sideways_use_adx': False, 'sideways_use_spike': True, 'sideways_rsi_required': True}.
[I 2025-08-30 19:26:42,770] Trial 504 finished with values: [-1000000000.0, 1000000000.0] and parameters: {'p_sma': 8, 'p_std': 17, 'p_atr': 29, 'p_adx': 20, 'rsi_period': 20, 'ema1': 14, 'ema2': 26, 'slip_atr_k': 0.061167786555695734, 'slip_spread_k': 0.1593956026758229, 'spread_hl_frac': 0.049782838145292496, 'bb_std_mult': 1.8235978104317987, 'rsi_os': 48, 'rsi_ob': 61, 'vol_spike': 0.09155012521208984, 'adx_thresh': 22.560811741532966, 'atr_min_pct': 0.02220314935927216, 'atr_max_pct': 0.04565048111658962, 'tp_mult': 2.843410905323707, 'tsl_mult': 0.1136406495283529, 'strategy': 'mean_reversion', 'time_stop': 76, 'use_sma': False, 'use_atr': False, 'use_adx': True, 'use_ema': True, 'use_spike': True, 'rsi_required': False, 'edge_k': 1.4902404829526525, 'edge_cap': 0.6850859655272588, 'bull_strategy': 'mean_reversion', 'bull_bb_std_mult': 3.193020366518244, 'bull_rsi_os': 32, 'bull_rsi_ob': 58, 'bull_adx_thresh': 22.71450269666135, 'bull_atr_min_pct': 0.0026647346145874853, 'bull_atr_max_pct': 0.11276320863046486, 'bull_tp_mult': 2.742684167321893, 'bull_tsl_mult': 0.5657974720716621, 'bull_time_stop': 52, 'bull_use_sma': False, 'bull_use_ema': True, 'bull_use_atr': False, 'bull_use_adx': False, 'bull_use_spike': True, 'bull_rsi_required': False, 'bear_strategy': 'breakout', 'bear_bb_std_mult': 3.0939819684966547, 'bear_rsi_os': 34, 'bear_rsi_ob': 77, 'bear_adx_thresh': 17.253371093837952, 'bear_atr_min_pct': 0.016228311584819802, 'bear_atr_max_pct': 0.09679099341628725, 'bear_tp_mult': 1.5007519516678238, 'bear_tsl_mult': 0.18804350157709926, 'bear_time_stop': 236, 'bear_use_sma': True, 'bear_use_ema': True, 'bear_use_atr': True, 'bear_use_adx': False, 'bear_use_spike': False, 'bear_rsi_required': False, 'sideways_strategy': 'breakout', 'sideways_bb_std_mult': 0.9101139241334246, 'sideways_rsi_os': 52, 'sideways_rsi_ob': 59, 'sideways_adx_thresh': 5.000561904028176, 'sideways_atr_min_pct': 0.003284984080060011, 'sideways_atr_max_pct': 0.14800610220937688, 'sideways_tp_mult': 1.0630418050421355, 'sideways_tsl_mult': 0.9616189833306422, 'sideways_time_stop': 172, 'sideways_use_sma': False, 'sideways_use_ema': True, 'sideways_use_atr': False, 'sideways_use_adx': False, 'sideways_use_spike': True, 'sideways_rsi_required': True}.
[I 2025-08-30 19:26:49,029] Trial 507 finished with values: [-0.05666127687985534, 0.05655200414666632] and parameters: {'p_sma': 48, 'p_std': 31, 'p_atr': 27, 'p_adx': 20, 'rsi_period': 44, 'ema1': 28, 'ema2': 28, 'slip_atr_k': 0.17953859474969608, 'slip_spread_k': 0.9671455680170331, 'spread_hl_frac': 0.01095700232901197, 'bb_std_mult': 1.5671186695033854, 'rsi_os': 46, 'rsi_ob': 84, 'vol_spike': 0.24763660512106042, 'adx_thresh': 32.82311873506857, 'atr_min_pct': 0.024890018596116892, 'atr_max_pct': 0.06409896424648275, 'tp_mult': 2.2576451280995977, 'tsl_mult': 0.8169631279310741, 'strategy': 'mean_reversion', 'time_stop': 185, 'use_sma': False, 'use_atr': True, 'use_adx': True, 'use_ema': False, 'use_spike': True, 'rsi_required': False, 'edge_k': 0.03277503030626, 'edge_cap': 0.6354735166168194, 'bull_strategy': 'mean_reversion', 'bull_bb_std_mult': 0.868729640563874, 'bull_rsi_os': 44, 'bull_rsi_ob': 46, 'bull_adx_thresh': 13.302252306045991, 'bull_atr_min_pct': 0.0035024538382780112, 'bull_atr_max_pct': 0.1302678991210239, 'bull_tp_mult': 2.69068749117829, 'bull_tsl_mult': 0.6000824684423722, 'bull_time_stop': 71, 'bull_use_sma': False, 'bull_use_ema': True, 'bull_use_atr': False, 'bull_use_adx': False, 'bull_use_spike': True, 'bull_rsi_required': True, 'bear_strategy': 'breakout', 'bear_bb_std_mult': 3.018170757664859, 'bear_rsi_os': 49, 'bear_rsi_ob': 77, 'bear_adx_thresh': 25.018865855733516, 'bear_atr_min_pct': 0.015453272497394864, 'bear_atr_max_pct': 0.03511608062928182, 'bear_tp_mult': 2.5767839272866953, 'bear_tsl_mult': 0.547987196665353, 'bear_time_stop': 136, 'bear_use_sma': True, 'bear_use_ema': True, 'bear_use_atr': False, 'bear_use_adx': False, 'bear_use_spike': False, 'bear_rsi_required': True, 'sideways_strategy': 'breakout', 'sideways_bb_std_mult': 3.546498312631006, 'sideways_rsi_os': 53, 'sideways_rsi_ob': 50, 'sideways_adx_thresh': 20.788505474700358, 'sideways_atr_min_pct': 0.0016645902316197252, 'sideways_atr_max_pct': 0.10295160268523548, 'sideways_tp_mult': 1.1316993019470905, 'sideways_tsl_mult': 0.962567944404637, 'sideways_time_stop': 45, 'sideways_use_sma': True, 'sideways_use_ema': True, 'sideways_use_atr': False, 'sideways_use_adx': True, 'sideways_use_spike': False, 'sideways_rsi_required': True}.
[I 2025-08-30 19:26:50,116] Trial 511 finished with values: [-1000000000.0, 1000000000.0] and parameters: {'p_sma': 42, 'p_std': 29, 'p_atr': 15, 'p_adx': 19, 'rsi_period': 24, 'ema1': 26, 'ema2': 32, 'slip_atr_k': 0.24292056763230913, 'slip_spread_k': 0.6351767895482648, 'spread_hl_frac': 0.023727448210250423, 'bb_std_mult': 3.1896528641457764, 'rsi_os': 50, 'rsi_ob': 52, 'vol_spike': 0.26640088152248137, 'adx_thresh': 9.192916784419811, 'atr_min_pct': 0.013297344558669712, 'atr_max_pct': 0.09082514785613852, 'tp_mult': 1.5464294954211035, 'tsl_mult': 0.6175449891678639, 'strategy': 'mean_reversion', 'time_stop': 190, 'use_sma': False, 'use_atr': True, 'use_adx': False, 'use_ema': False, 'use_spike': False, 'rsi_required': False, 'edge_k': 1.1282567560773753, 'edge_cap': 0.17904240260544552, 'bull_strategy': 'breakout', 'bull_bb_std_mult': 3.5798914287656762, 'bull_rsi_os': 16, 'bull_rsi_ob': 46, 'bull_adx_thresh': 18.49310275905773, 'bull_atr_min_pct': 0.0011976431725752293, 'bull_atr_max_pct': 0.1235185426999285, 'bull_tp_mult': 1.9485632326545774, 'bull_tsl_mult': 0.8611730145362632, 'bull_time_stop': 189, 'bull_use_sma': False, 'bull_use_ema': False, 'bull_use_atr': True, 'bull_use_adx': False, 'bull_use_spike': False, 'bull_rsi_required': True, 'bear_strategy': 'mean_reversion', 'bear_bb_std_mult': 1.6068367079122359, 'bear_rsi_os': 46, 'bear_rsi_ob': 75, 'bear_adx_thresh': 18.14611471858938, 'bear_atr_min_pct': 0.0019235338671833337, 'bear_atr_max_pct': 0.033951484366290974, 'bear_tp_mult': 1.86574999853003, 'bear_tsl_mult': 0.7429380637470117, 'bear_time_stop': 210, 'bear_use_sma': False, 'bear_use_ema': True, 'bear_use_atr': False, 'bear_use_adx': False, 'bear_use_spike': True, 'bear_rsi_required': True, 'sideways_strategy': 'breakout', 'sideways_bb_std_mult': 3.1963340528061552, 'sideways_rsi_os': 35, 'sideways_rsi_ob': 64, 'sideways_adx_thresh': 21.294415678965237, 'sideways_atr_min_pct': 0.0006758492354031536, 'sideways_atr_max_pct': 0.04643335168409422, 'sideways_tp_mult': 1.039774307916299, 'sideways_tsl_mult': 0.7094247816730027, 'sideways_time_stop': 143, 'sideways_use_sma': True, 'sideways_use_ema': True, 'sideways_use_atr': True, 'sideways_use_adx': True, 'sideways_use_spike': False, 'sideways_rsi_required': False}.
[I 2025-08-30 19:27:18,819] Trial 509 finished with values: [-1000000000.0, 1000000000.0] and parameters: {'p_sma': 7, 'p_std': 27, 'p_atr': 10, 'p_adx': 20, 'rsi_period': 43, 'ema1': 28, 'ema2': 32, 'slip_atr_k': 0.0626977898110469, 'slip_spread_k': 0.9654660026340074, 'spread_hl_frac': 0.024196988097005063, 'bb_std_mult': 2.231197576903985, 'rsi_os': 36, 'rsi_ob': 83, 'vol_spike': 0.26771690669030695, 'adx_thresh': 10.140207213509317, 'atr_min_pct': 0.02518346968613665, 'atr_max_pct': 0.06908459329906436, 'tp_mult': 2.2613921694766224, 'tsl_mult': 0.8054226021165697, 'strategy': 'mean_reversion', 'time_stop': 185, 'use_sma': False, 'use_atr': True, 'use_adx': False, 'use_ema': True, 'use_spike': True, 'rsi_required': False, 'edge_k': 0.026452745401718908, 'edge_cap': 0.5502481176594026, 'bull_strategy': 'mean_reversion', 'bull_bb_std_mult': 3.284270545373625, 'bull_rsi_os': 32, 'bull_rsi_ob': 58, 'bull_adx_thresh': 18.65169159010882, 'bull_atr_min_pct': 0.020330627174803672, 'bull_atr_max_pct': 0.1499284636301588, 'bull_tp_mult': 2.8479515863587155, 'bull_tsl_mult': 0.9112348358877238, 'bull_time_stop': 35, 'bull_use_sma': False, 'bull_use_ema': False, 'bull_use_atr': False, 'bull_use_adx': False, 'bull_use_spike': True, 'bull_rsi_required': True, 'bear_strategy': 'breakout', 'bear_bb_std_mult': 2.9394850580461966, 'bear_rsi_os': 46, 'bear_rsi_ob': 76, 'bear_adx_thresh': 14.988503715183988, 'bear_atr_min_pct': 0.017781453130642614, 'bear_atr_max_pct': 0.03472200383930399, 'bear_tp_mult': 2.571960702187895, 'bear_tsl_mult': 0.5515039280660522, 'bear_time_stop': 284, 'bear_use_sma': True, 'bear_use_ema': True, 'bear_use_atr': False, 'bear_use_adx': False, 'bear_use_spike': True, 'bear_rsi_required': False, 'sideways_strategy': 'breakout', 'sideways_bb_std_mult': 3.526481341050488, 'sideways_rsi_os': 34, 'sideways_rsi_ob': 86, 'sideways_adx_thresh': 23.235534277336257, 'sideways_atr_min_pct': 0.0015493902020946642, 'sideways_atr_max_pct': 0.015682822750794426, 'sideways_tp_mult': 1.0423729075795858, 'sideways_tsl_mult': 0.9798122756773147, 'sideways_time_stop': 268, 'sideways_use_sma': True, 'sideways_use_ema': True, 'sideways_use_atr': True, 'sideways_use_adx': True, 'sideways_use_spike': False, 'sideways_rsi_required': False}.
[I 2025-08-30 19:27:20,834] Trial 508 finished with values: [-0.05255707653764763, 0.05256714982099998] and parameters: {'p_sma': 42, 'p_std': 32, 'p_atr': 21, 'p_adx': 15, 'rsi_period': 23, 'ema1': 28, 'ema2': 28, 'slip_atr_k': 0.06181355807262773, 'slip_spread_k': 0.9777318366886265, 'spread_hl_frac': 0.022262281759254314, 'bb_std_mult': 1.3953021207766716, 'rsi_os': 46, 'rsi_ob': 64, 'vol_spike': 0.2439524284841793, 'adx_thresh': 32.706850610579195, 'atr_min_pct': 0.025085809453109613, 'atr_max_pct': 0.06299600097280306, 'tp_mult': 2.240507101078573, 'tsl_mult': 0.8141945562778912, 'strategy': 'mean_reversion', 'time_stop': 166, 'use_sma': False, 'use_atr': True, 'use_adx': True, 'use_ema': True, 'use_spike': True, 'rsi_required': False, 'edge_k': 0.26684493425380695, 'edge_cap': 0.5071974876063055, 'bull_strategy': 'mean_reversion', 'bull_bb_std_mult': 0.6414426655164889, 'bull_rsi_os': 16, 'bull_rsi_ob': 46, 'bull_adx_thresh': 18.57347962922846, 'bull_atr_min_pct': 0.010980952365843118, 'bull_atr_max_pct': 0.13234300699737567, 'bull_tp_mult': 2.867004860147995, 'bull_tsl_mult': 0.4800332335693289, 'bull_time_stop': 122, 'bull_use_sma': False, 'bull_use_ema': True, 'bull_use_atr': False, 'bull_use_adx': False, 'bull_use_spike': True, 'bull_rsi_required': True, 'bear_strategy': 'breakout', 'bear_bb_std_mult': 1.6083020065765146, 'bear_rsi_os': 45, 'bear_rsi_ob': 77, 'bear_adx_thresh': 28.738874477777948, 'bear_atr_min_pct': 0.015240800193394612, 'bear_atr_max_pct': 0.06155988820171533, 'bear_tp_mult': 2.580882962053324, 'bear_tsl_mult': 0.7395937737387265, 'bear_time_stop': 195, 'bear_use_sma': True, 'bear_use_ema': True, 'bear_use_atr': False, 'bear_use_adx': False, 'bear_use_spike': True, 'bear_rsi_required': False, 'sideways_strategy': 'breakout', 'sideways_bb_std_mult': 3.594688833579545, 'sideways_rsi_os': 53, 'sideways_rsi_ob': 47, 'sideways_adx_thresh': 10.611416176700294, 'sideways_atr_min_pct': 0.001703409798291091, 'sideways_atr_max_pct': 0.09699001121456281, 'sideways_tp_mult': 1.0383530704468482, 'sideways_tsl_mult': 0.8121465652468386, 'sideways_time_stop': 144, 'sideways_use_sma': True, 'sideways_use_ema': True, 'sideways_use_atr': True, 'sideways_use_adx': True, 'sideways_use_spike': False, 'sideways_rsi_required': True}.
[I 2025-08-30 19:27:21,263] Trial 510 finished with values: [-0.0304889707092747, 0.03070905769677055] and parameters: {'p_sma': 7, 'p_std': 7, 'p_atr': 10, 'p_adx': 19, 'rsi_period': 23, 'ema1': 26, 'ema2': 60, 'slip_atr_k': 0.08130835403465089, 'slip_spread_k': 0.11753422554451884, 'spread_hl_frac': 0.024144948367478197, 'bb_std_mult': 1.5830908789057059, 'rsi_os': 43, 'rsi_ob': 74, 'vol_spike': 0.2397913540389999, 'adx_thresh': 32.7711294669384, 'atr_min_pct': 0.025168824855149957, 'atr_max_pct': 0.09154742182068461, 'tp_mult': 2.268350482837634, 'tsl_mult': 0.6252179166878389, 'strategy': 'mean_reversion', 'time_stop': 136, 'use_sma': False, 'use_atr': True, 'use_adx': False, 'use_ema': False, 'use_spike': True, 'rsi_required': False, 'edge_k': 0.27582821721699935, 'edge_cap': 0.5095440934964988, 'bull_strategy': 'mean_reversion', 'bull_bb_std_mult': 1.7706834116061598, 'bull_rsi_os': 10, 'bull_rsi_ob': 73, 'bull_adx_thresh': 18.561768729199432, 'bull_atr_min_pct': 0.0035303072401337834, 'bull_atr_max_pct': 0.13138374270497666, 'bull_tp_mult': 1.3164445910695823, 'bull_tsl_mult': 0.48145985377206707, 'bull_time_stop': 69, 'bull_use_sma': False, 'bull_use_ema': False, 'bull_use_atr': True, 'bull_use_adx': False, 'bull_use_spike': False, 'bull_rsi_required': True, 'bear_strategy': 'mean_reversion', 'bear_bb_std_mult': 1.5971325208091296, 'bear_rsi_os': 49, 'bear_rsi_ob': 76, 'bear_adx_thresh': 18.22448681062631, 'bear_atr_min_pct': 0.015261783825072367, 'bear_atr_max_pct': 0.03341096900530817, 'bear_tp_mult': 2.6842671009904935, 'bear_tsl_mult': 0.5536669196537609, 'bear_time_stop': 195, 'bear_use_sma': False, 'bear_use_ema': True, 'bear_use_atr': False, 'bear_use_adx': False, 'bear_use_spike': True, 'bear_rsi_required': True, 'sideways_strategy': 'breakout', 'sideways_bb_std_mult': 0.5348475478478354, 'sideways_rsi_os': 34, 'sideways_rsi_ob': 61, 'sideways_adx_thresh': 20.684943893691848, 'sideways_atr_min_pct': 0.0016487454653242926, 'sideways_atr_max_pct': 0.14726106128736852, 'sideways_tp_mult': 1.1517113168024253, 'sideways_tsl_mult': 0.8009601294533708, 'sideways_time_stop': 230, 'sideways_use_sma': True, 'sideways_use_ema': True, 'sideways_use_atr': True, 'sideways_use_adx': True, 'sideways_use_spike': False, 'sideways_rsi_required': False}.
[I 2025-08-30 19:27:25,185] Trial 512 finished with values: [-1000000000.0, 1000000000.0] and parameters: {'p_sma': 5, 'p_std': 57, 'p_atr': 9, 'p_adx': 15, 'rsi_period': 26, 'ema1': 25, 'ema2': 30, 'slip_atr_k': 0.20987511138553155, 'slip_spread_k': 0.11997309584636698, 'spread_hl_frac': 0.02438130252725803, 'bb_std_mult': 1.401052590223892, 'rsi_os': 43, 'rsi_ob': 86, 'vol_spike': 0.28021394787324944, 'adx_thresh': 20.962134694027036, 'atr_min_pct': 0.029983576540960864, 'atr_max_pct': 0.09703623056080161, 'tp_mult': 2.07283594002125, 'tsl_mult': 0.8664402265104548, 'strategy': 'mean_reversion', 'time_stop': 170, 'use_sma': False, 'use_atr': True, 'use_adx': False, 'use_ema': True, 'use_spike': True, 'rsi_required': False, 'edge_k': 0.17338427096530337, 'edge_cap': 0.5513717122710283, 'bull_strategy': 'mean_reversion', 'bull_bb_std_mult': 2.7050756849792448, 'bull_rsi_os': 40, 'bull_rsi_ob': 91, 'bull_adx_thresh': 33.75890518645167, 'bull_atr_min_pct': 0.021422824978917197, 'bull_atr_max_pct': 0.03710222623916664, 'bull_tp_mult': 2.8038465716377234, 'bull_tsl_mult': 0.4946062009460899, 'bull_time_stop': 107, 'bull_use_sma': False, 'bull_use_ema': True, 'bull_use_atr': True, 'bull_use_adx': False, 'bull_use_spike': False, 'bull_rsi_required': True, 'bear_strategy': 'breakout', 'bear_bb_std_mult': 0.5469263329370226, 'bear_rsi_os': 53, 'bear_rsi_ob': 63, 'bear_adx_thresh': 28.56308960457661, 'bear_atr_min_pct': 0.011518174898521532, 'bear_atr_max_pct': 0.047254645266357906, 'bear_tp_mult': 2.6883376935883407, 'bear_tsl_mult': 0.7793848845771737, 'bear_time_stop': 195, 'bear_use_sma': True, 'bear_use_ema': True, 'bear_use_atr': False, 'bear_use_adx': False, 'bear_use_spike': True, 'bear_rsi_required': False, 'sideways_strategy': 'breakout', 'sideways_bb_std_mult': 3.0416055488469107, 'sideways_rsi_os': 34, 'sideways_rsi_ob': 69, 'sideways_adx_thresh': 23.232867908291787, 'sideways_atr_min_pct': 0.02819838968223317, 'sideways_atr_max_pct': 0.0952333602342828, 'sideways_tp_mult': 1.7428368561895562, 'sideways_tsl_mult': 0.9992981183794453, 'sideways_time_stop': 152, 'sideways_use_sma': False, 'sideways_use_ema': True, 'sideways_use_atr': True, 'sideways_use_adx': False, 'sideways_use_spike': False, 'sideways_rsi_required': False}.
