[I 2025-08-30 19:50:38,542] Trial 709 finished with values: [-1000000000.0, 1000000000.0] and parameters: {'p_sma': 8, 'p_std': 46, 'p_atr': 30, 'p_adx': 18, 'rsi_period': 18, 'ema1': 26, 'ema2': 38, 'slip_atr_k': 0.10507905295245366, 'slip_spread_k': 0.15962046883327402, 'spread_hl_frac': 0.02530831431172125, 'bb_std_mult': 2.2264069562675, 'rsi_os': 48, 'rsi_ob': 90, 'vol_spike': 0.2435843478579594, 'adx_thresh': 32.50635383318055, 'atr_min_pct': 0.002454715799708889, 'atr_max_pct': 0.09216705151994486, 'tp_mult': 2.9149457893327253, 'tsl_mult': 0.6605782232268589, 'strategy': 'mean_reversion', 'time_stop': 10, 'use_sma': False, 'use_atr': True, 'use_adx': True, 'use_ema': False, 'use_spike': True, 'rsi_required': False, 'edge_k': 0.23369558321190836, 'edge_cap': 0.6211499067640336, 'bull_strategy': 'mean_reversion', 'bull_bb_std_mult': 3.001724480835871, 'bull_rsi_os': 31, 'bull_rsi_ob': 45, 'bull_adx_thresh': 18.011909743735824, 'bull_atr_min_pct': 0.000864236241094185, 'bull_atr_max_pct': 0.11750448221225145, 'bull_tp_mult': 2.7397031212385987, 'bull_tsl_mult': 0.5926333434887837, 'bull_time_stop': 186, 'bull_use_sma': False, 'bull_use_ema': False, 'bull_use_atr': True, 'bull_use_adx': False, 'bull_use_spike': False, 'bull_rsi_required': True, 'bear_strategy': 'breakout', 'bear_bb_std_mult': 0.7780671707478812, 'bear_rsi_os': 51, 'bear_rsi_ob': 75, 'bear_adx_thresh': 18.567361705048768, 'bear_atr_min_pct': 0.01394605350550692, 'bear_atr_max_pct': 0.026214916200730173, 'bear_tp_mult': 2.6133625275042087, 'bear_tsl_mult': 0.7745897574285434, 'bear_time_stop': 25, 'bear_use_sma': False, 'bear_use_ema': True, 'bear_use_atr': False, 'bear_use_adx': False, 'bear_use_spike': True, 'bear_rsi_required': True, 'sideways_strategy': 'breakout', 'sideways_bb_std_mult': 0.8266076081699658, 'sideways_rsi_os': 10, 'sideways_rsi_ob': 66, 'sideways_adx_thresh': 9.886830133668095, 'sideways_atr_min_pct': 0.02886078302469482, 'sideways_atr_max_pct': 0.01940329302948582, 'sideways_tp_mult': 2.4862118155266435, 'sideways_tsl_mult': 0.9996386852106418, 'sideways_time_stop': 162, 'sideways_use_sma': False, 'sideways_use_ema': True, 'sideways_use_atr': False, 'sideways_use_adx': False, 'sideways_use_spike': False, 'sideways_rsi_required': True}.
[I 2025-08-30 19:50:39,065] Trial 712 finished with values: [-1000000000.0, 1000000000.0] and parameters: {'p_sma': 54, 'p_std': 37, 'p_atr': 17, 'p_adx': 18, 'rsi_period': 77, 'ema1': 25, 'ema2': 28, 'slip_atr_k': 0.06927853469705404, 'slip_spread_k': 0.15707511025544435, 'spread_hl_frac': 0.023723040075408867, 'bb_std_mult': 2.1264345274437946, 'rsi_os': 54, 'rsi_ob': 82, 'vol_spike': 0.2820193314305277, 'adx_thresh': 32.28963840740437, 'atr_min_pct': 0.025560711768148572, 'atr_max_pct': 0.09221243579296198, 'tp_mult': 2.2164859332919002, 'tsl_mult': 0.7263531232800695, 'strategy': 'breakout', 'time_stop': 9, 'use_sma': True, 'use_atr': True, 'use_adx': True, 'use_ema': False, 'use_spike': True, 'rsi_required': False, 'edge_k': 0.39782602547665513, 'edge_cap': 0.6165534517434309, 'bull_strategy': 'breakout', 'bull_bb_std_mult': 2.990900927550003, 'bull_rsi_os': 31, 'bull_rsi_ob': 58, 'bull_adx_thresh': 28.58217357952821, 'bull_atr_min_pct': 0.0008809783292676905, 'bull_atr_max_pct': 0.031766408113730805, 'bull_tp_mult': 2.884787034449408, 'bull_tsl_mult': 0.5172512946009096, 'bull_time_stop': 71, 'bull_use_sma': False, 'bull_use_ema': True, 'bull_use_atr': True, 'bull_use_adx': False, 'bull_use_spike': False, 'bull_rsi_required': True, 'bear_strategy': 'breakout', 'bear_bb_std_mult': 2.9805779764412117, 'bear_rsi_os': 55, 'bear_rsi_ob': 75, 'bear_adx_thresh': 18.51680185789259, 'bear_atr_min_pct': 0.01418990188702145, 'bear_atr_max_pct': 0.085188216552862, 'bear_tp_mult': 1.22276552679228, 'bear_tsl_mult': 0.7718639528871133, 'bear_time_stop': 190, 'bear_use_sma': True, 'bear_use_ema': True, 'bear_use_atr': False, 'bear_use_adx': True, 'bear_use_spike': False, 'bear_rsi_required': True, 'sideways_strategy': 'breakout', 'sideways_bb_std_mult': 2.1228306741608587, 'sideways_rsi_os': 34, 'sideways_rsi_ob': 58, 'sideways_adx_thresh': 9.130647982671968, 'sideways_atr_min_pct': 0.01134646861170349, 'sideways_atr_max_pct': 0.0414960853299519, 'sideways_tp_mult': 1.6830526393762324, 'sideways_tsl_mult': 0.9986311937850727, 'sideways_time_stop': 164, 'sideways_use_sma': False, 'sideways_use_ema': True, 'sideways_use_atr': True, 'sideways_use_adx': False, 'sideways_use_spike': False, 'sideways_rsi_required': True}.
[I 2025-08-30 19:50:44,185] Trial 713 finished with values: [-0.06692271747520917, 0.06681631887314757] and parameters: {'p_sma': 39, 'p_std': 31, 'p_atr': 13, 'p_adx': 18, 'rsi_period': 24, 'ema1': 25, 'ema2': 28, 'slip_atr_k': 0.06797799539623758, 'slip_spread_k': 0.6076101077781153, 'spread_hl_frac': 0.03535189423071731, 'bb_std_mult': 2.155582524847578, 'rsi_os': 13, 'rsi_ob': 68, 'vol_spike': 0.24456498262876916, 'adx_thresh': 32.429639446939746, 'atr_min_pct': 0.024210205892357634, 'atr_max_pct': 0.09143055134153981, 'tp_mult': 1.6725490430955794, 'tsl_mult': 0.7233800257717607, 'strategy': 'breakout', 'time_stop': 173, 'use_sma': True, 'use_atr': True, 'use_adx': True, 'use_ema': False, 'use_spike': True, 'rsi_required': False, 'edge_k': 0.2518565052424981, 'edge_cap': 0.4169135186042481, 'bull_strategy': 'breakout', 'bull_bb_std_mult': 3.2569958835331687, 'bull_rsi_os': 31, 'bull_rsi_ob': 45, 'bull_adx_thresh': 5.028536263480811, 'bull_atr_min_pct': 0.0011033287484375153, 'bull_atr_max_pct': 0.12107109661186245, 'bull_tp_mult': 2.530217151727166, 'bull_tsl_mult': 0.5803912442298363, 'bull_time_stop': 154, 'bull_use_sma': False, 'bull_use_ema': True, 'bull_use_atr': True, 'bull_use_adx': False, 'bull_use_spike': False, 'bull_rsi_required': False, 'bear_strategy': 'breakout', 'bear_bb_std_mult': 3.008279090772118, 'bear_rsi_os': 55, 'bear_rsi_ob': 75, 'bear_adx_thresh': 13.108587150859774, 'bear_atr_min_pct': 0.014211009349902212, 'bear_atr_max_pct': 0.10618841798077677, 'bear_tp_mult': 1.0722448754884972, 'bear_tsl_mult': 0.7682779459546291, 'bear_time_stop': 189, 'bear_use_sma': True, 'bear_use_ema': True, 'bear_use_atr': False, 'bear_use_adx': True, 'bear_use_spike': False, 'bear_rsi_required': True, 'sideways_strategy': 'breakout', 'sideways_bb_std_mult': 1.550647897823779, 'sideways_rsi_os': 35, 'sideways_rsi_ob': 86, 'sideways_adx_thresh': 9.326097311927379, 'sideways_atr_min_pct': 0.0015168812954900722, 'sideways_atr_max_pct': 0.13581036484703873, 'sideways_tp_mult': 1.0497459099130326, 'sideways_tsl_mult': 0.16713318036687042, 'sideways_time_stop': 235, 'sideways_use_sma': False, 'sideways_use_ema': True, 'sideways_use_atr': True, 'sideways_use_adx': False, 'sideways_use_spike': False, 'sideways_rsi_required': True}.
[I 2025-08-30 19:50:44,380] Trial 714 finished with values: [-0.015861481531737498, 0.0157579813969368] and parameters: {'p_sma': 39, 'p_std': 32, 'p_atr': 12, 'p_adx': 18, 'rsi_period': 77, 'ema1': 27, 'ema2': 28, 'slip_atr_k': 0.06789282462018524, 'slip_spread_k': 0.6081117071005957, 'spread_hl_frac': 0.04852691248781677, 'bb_std_mult': 2.136256273714589, 'rsi_os': 49, 'rsi_ob': 59, 'vol_spike': 0.2694589267308047, 'adx_thresh': 27.04383856410801, 'atr_min_pct': 0.023938890701106035, 'atr_max_pct': 0.10973561358929299, 'tp_mult': 2.1334382441739987, 'tsl_mult': 0.6617483107911366, 'strategy': 'breakout', 'time_stop': 176, 'use_sma': False, 'use_atr': True, 'use_adx': True, 'use_ema': False, 'use_spike': True, 'rsi_required': False, 'edge_k': 1.507197926780806, 'edge_cap': 0.857904898652761, 'bull_strategy': 'breakout', 'bull_bb_std_mult': 2.1949134452050214, 'bull_rsi_os': 31, 'bull_rsi_ob': 67, 'bull_adx_thresh': 17.156385777066276, 'bull_atr_min_pct': 0.0025762099477844753, 'bull_atr_max_pct': 0.03125358574894322, 'bull_tp_mult': 2.1556124316998706, 'bull_tsl_mult': 0.49976712952927815, 'bull_time_stop': 182, 'bull_use_sma': False, 'bull_use_ema': True, 'bull_use_atr': True, 'bull_use_adx': False, 'bull_use_spike': False, 'bull_rsi_required': False, 'bear_strategy': 'breakout', 'bear_bb_std_mult': 2.8823586941261006, 'bear_rsi_os': 50, 'bear_rsi_ob': 77, 'bear_adx_thresh': 18.603788149450388, 'bear_atr_min_pct': 0.014176212583625732, 'bear_atr_max_pct': 0.13608994764272866, 'bear_tp_mult': 1.998591600465628, 'bear_tsl_mult': 0.773510284183348, 'bear_time_stop': 211, 'bear_use_sma': True, 'bear_use_ema': True, 'bear_use_atr': False, 'bear_use_adx': True, 'bear_use_spike': False, 'bear_rsi_required': False, 'sideways_strategy': 'breakout', 'sideways_bb_std_mult': 2.101181126256982, 'sideways_rsi_os': 35, 'sideways_rsi_ob': 65, 'sideways_adx_thresh': 9.186080022874663, 'sideways_atr_min_pct': 0.001176754599026684, 'sideways_atr_max_pct': 0.03931625048943269, 'sideways_tp_mult': 2.7522130154401423, 'sideways_tsl_mult': 0.8803536188600167, 'sideways_time_stop': 147, 'sideways_use_sma': False, 'sideways_use_ema': True, 'sideways_use_atr': True, 'sideways_use_adx': False, 'sideways_use_spike': False, 'sideways_rsi_required': True}.
[I 2025-08-30 19:51:17,691] Trial 716 finished with values: [-1000000000.0, 1000000000.0] and parameters: {'p_sma': 38, 'p_std': 59, 'p_atr': 25, 'p_adx': 14, 'rsi_period': 73, 'ema1': 27, 'ema2': 33, 'slip_atr_k': 0.08730557337845804, 'slip_spread_k': 0.39853264097221947, 'spread_hl_frac': 0.022304063669505485, 'bb_std_mult': 2.026250787503745, 'rsi_os': 21, 'rsi_ob': 84, 'vol_spike': 0.268377700956168, 'adx_thresh': 18.28181095977935, 'atr_min_pct': 0.024013208047952827, 'atr_max_pct': 0.09530575982234692, 'tp_mult': 2.733508847878798, 'tsl_mult': 0.7794660821167096, 'strategy': 'breakout', 'time_stop': 176, 'use_sma': False, 'use_atr': True, 'use_adx': True, 'use_ema': False, 'use_spike': True, 'rsi_required': False, 'edge_k': 0.08210235493370155, 'edge_cap': 0.44076275555964745, 'bull_strategy': 'breakout', 'bull_bb_std_mult': 3.284684710983908, 'bull_rsi_os': 33, 'bull_rsi_ob': 48, 'bull_adx_thresh': 32.438673392574465, 'bull_atr_min_pct': 0.025429405899039567, 'bull_atr_max_pct': 0.016557878255152342, 'bull_tp_mult': 2.164565190759287, 'bull_tsl_mult': 0.490168795633083, 'bull_time_stop': 236, 'bull_use_sma': False, 'bull_use_ema': True, 'bull_use_atr': True, 'bull_use_adx': False, 'bull_use_spike': False, 'bull_rsi_required': False, 'bear_strategy': 'breakout', 'bear_bb_std_mult': 2.841392032155654, 'bear_rsi_os': 48, 'bear_rsi_ob': 57, 'bear_adx_thresh': 17.99318741653418, 'bear_atr_min_pct': 0.015291573403893819, 'bear_atr_max_pct': 0.03554455358233809, 'bear_tp_mult': 2.0014298810607176, 'bear_tsl_mult': 0.7445030276629833, 'bear_time_stop': 213, 'bear_use_sma': True, 'bear_use_ema': True, 'bear_use_atr': False, 'bear_use_adx': True, 'bear_use_spike': False, 'bear_rsi_required': False, 'sideways_strategy': 'breakout', 'sideways_bb_std_mult': 3.3074410726024923, 'sideways_rsi_os': 35, 'sideways_rsi_ob': 56, 'sideways_adx_thresh': 21.93724508063061, 'sideways_atr_min_pct': 0.0165339456314504, 'sideways_atr_max_pct': 0.09779573661483103, 'sideways_tp_mult': 2.7393106082858556, 'sideways_tsl_mult': 0.8715402396317866, 'sideways_time_stop': 238, 'sideways_use_sma': False, 'sideways_use_ema': True, 'sideways_use_atr': True, 'sideways_use_adx': False, 'sideways_use_spike': False, 'sideways_rsi_required': True}.
[I 2025-08-30 19:51:18,674] Trial 715 finished with values: [-1000000000.0, 1000000000.0] and parameters: {'p_sma': 7, 'p_std': 59, 'p_atr': 26, 'p_adx': 14, 'rsi_period': 77, 'ema1': 17, 'ema2': 26, 'slip_atr_k': 0.13049408029518886, 'slip_spread_k': 0.9178471737446048, 'spread_hl_frac': 0.02238400872888909, 'bb_std_mult': 2.134571798849279, 'rsi_os': 46, 'rsi_ob': 61, 'vol_spike': 0.27171306508832255, 'adx_thresh': 19.750399511577733, 'atr_min_pct': 0.02427299178624301, 'atr_max_pct': 0.10630683341847777, 'tp_mult': 2.74684370515428, 'tsl_mult': 0.7814742138749909, 'strategy': 'breakout', 'time_stop': 228, 'use_sma': False, 'use_atr': True, 'use_adx': True, 'use_ema': False, 'use_spike': True, 'rsi_required': False, 'edge_k': 1.8245089333122362, 'edge_cap': 0.47252957109266003, 'bull_strategy': 'breakout', 'bull_bb_std_mult': 3.2873675644144034, 'bull_rsi_os': 42, 'bull_rsi_ob': 48, 'bull_adx_thresh': 17.18947630798242, 'bull_atr_min_pct': 0.0027025721166401397, 'bull_atr_max_pct': 0.12194795688628814, 'bull_tp_mult': 2.876831620983541, 'bull_tsl_mult': 0.06549011253428716, 'bull_time_stop': 235, 'bull_use_sma': False, 'bull_use_ema': True, 'bull_use_atr': True, 'bull_use_adx': False, 'bull_use_spike': False, 'bull_rsi_required': False, 'bear_strategy': 'breakout', 'bear_bb_std_mult': 2.847734322059818, 'bear_rsi_os': 48, 'bear_rsi_ob': 77, 'bear_adx_thresh': 27.254672943107494, 'bear_atr_min_pct': 0.015280309196228262, 'bear_atr_max_pct': 0.03998361941488621, 'bear_tp_mult': 2.8375329957495796, 'bear_tsl_mult': 0.7614371343317187, 'bear_time_stop': 212, 'bear_use_sma': True, 'bear_use_ema': True, 'bear_use_atr': False, 'bear_use_adx': True, 'bear_use_spike': False, 'bear_rsi_required': False, 'sideways_strategy': 'breakout', 'sideways_bb_std_mult': 3.28687267510298, 'sideways_rsi_os': 35, 'sideways_rsi_ob': 86, 'sideways_adx_thresh': 21.62126387899026, 'sideways_atr_min_pct': 0.001359022610512729, 'sideways_atr_max_pct': 0.1385113467287995, 'sideways_tp_mult': 2.7061852510996838, 'sideways_tsl_mult': 0.1722040107100704, 'sideways_time_stop': 148, 'sideways_use_sma': False, 'sideways_use_ema': True, 'sideways_use_atr': True, 'sideways_use_adx': False, 'sideways_use_spike': False, 'sideways_rsi_required': True}.
[I 2025-08-30 19:51:19,878] Trial 718 finished with values: [-1000000000.0, 1000000000.0] and parameters: {'p_sma': 41, 'p_std': 32, 'p_atr': 15, 'p_adx': 20, 'rsi_period': 48, 'ema1': 26, 'ema2': 29, 'slip_atr_k': 0.08532870619748108, 'slip_spread_k': 0.10475245157541174, 'spread_hl_frac': 0.0224732482597442, 'bb_std_mult': 2.0190948836883122, 'rsi_os': 49, 'rsi_ob': 84, 'vol_spike': 0.26937782663941945, 'adx_thresh': 9.954752003308545, 'atr_min_pct': 0.009835945998768742, 'atr_max_pct': 0.10751492340645195, 'tp_mult': 2.2908884669806007, 'tsl_mult': 0.8161244935010272, 'strategy': 'mean_reversion', 'time_stop': 213, 'use_sma': False, 'use_atr': True, 'use_adx': True, 'use_ema': False, 'use_spike': True, 'rsi_required': False, 'edge_k': 1.360371872121642, 'edge_cap': 0.4764419326030548, 'bull_strategy': 'mean_reversion', 'bull_bb_std_mult': 3.3123933689611085, 'bull_rsi_os': 27, 'bull_rsi_ob': 66, 'bull_adx_thresh': 14.406610716826282, 'bull_atr_min_pct': 0.002463122635907442, 'bull_atr_max_pct': 0.026614524935125464, 'bull_tp_mult': 2.157824547978442, 'bull_tsl_mult': 0.48313966375950257, 'bull_time_stop': 182, 'bull_use_sma': False, 'bull_use_ema': True, 'bull_use_atr': True, 'bull_use_adx': True, 'bull_use_spike': False, 'bull_rsi_required': False, 'bear_strategy': 'breakout', 'bear_bb_std_mult': 2.8386996990930258, 'bear_rsi_os': 16, 'bear_rsi_ob': 76, 'bear_adx_thresh': 18.04144766389112, 'bear_atr_min_pct': 0.0251871255828775, 'bear_atr_max_pct': 0.12629791268271973, 'bear_tp_mult': 1.995994383748987, 'bear_tsl_mult': 0.3780865140864238, 'bear_time_stop': 208, 'bear_use_sma': True, 'bear_use_ema': True, 'bear_use_atr': False, 'bear_use_adx': False, 'bear_use_spike': False, 'bear_rsi_required': False, 'sideways_strategy': 'breakout', 'sideways_bb_std_mult': 3.2840085268246426, 'sideways_rsi_os': 35, 'sideways_rsi_ob': 56, 'sideways_adx_thresh': 34.972478418097346, 'sideways_atr_min_pct': 0.002672231786236825, 'sideways_atr_max_pct': 0.10507171803569734, 'sideways_tp_mult': 2.753593219425196, 'sideways_tsl_mult': 0.7856886522020442, 'sideways_time_stop': 148, 'sideways_use_sma': False, 'sideways_use_ema': True, 'sideways_use_atr': True, 'sideways_use_adx': False, 'sideways_use_spike': False, 'sideways_rsi_required': True}.
[I 2025-08-30 19:51:20,226] Trial 717 finished with values: [-1000000000.0, 1000000000.0] and parameters: {'p_sma': 6, 'p_std': 32, 'p_atr': 8, 'p_adx': 23, 'rsi_period': 29, 'ema1': 17, 'ema2': 41, 'slip_atr_k': 0.05355499157996915, 'slip_spread_k': 0.9130402479477532, 'spread_hl_frac': 0.04853193373989767, 'bb_std_mult': 1.3265307039393595, 'rsi_os': 49, 'rsi_ob': 51, 'vol_spike': 0.2691169800931054, 'adx_thresh': 18.262755871925286, 'atr_min_pct': 0.024041560955356537, 'atr_max_pct': 0.10778124634262268, 'tp_mult': 2.1499647325221716, 'tsl_mult': 0.779821283896834, 'strategy': 'mean_reversion', 'time_stop': 212, 'use_sma': False, 'use_atr': True, 'use_adx': True, 'use_ema': False, 'use_spike': True, 'rsi_required': False, 'edge_k': 0.08311171860236846, 'edge_cap': 0.47633025239797894, 'bull_strategy': 'mean_reversion', 'bull_bb_std_mult': 3.365242082792523, 'bull_rsi_os': 51, 'bull_rsi_ob': 67, 'bull_adx_thresh': 32.2714295347551, 'bull_atr_min_pct': 0.004423251597684414, 'bull_atr_max_pct': 0.1321947708171262, 'bull_tp_mult': 1.8839392359943643, 'bull_tsl_mult': 0.4129946106418743, 'bull_time_stop': 183, 'bull_use_sma': False, 'bull_use_ema': True, 'bull_use_atr': True, 'bull_use_adx': True, 'bull_use_spike': False, 'bull_rsi_required': False, 'bear_strategy': 'breakout', 'bear_bb_std_mult': 2.878084246591282, 'bear_rsi_os': 48, 'bear_rsi_ob': 77, 'bear_adx_thresh': 17.360896046816833, 'bear_atr_min_pct': 0.011875572171632251, 'bear_atr_max_pct': 0.12589463331413464, 'bear_tp_mult': 1.5556082869247019, 'bear_tsl_mult': 0.0033078953899313146, 'bear_time_stop': 255, 'bear_use_sma': True, 'bear_use_ema': True, 'bear_use_atr': False, 'bear_use_adx': False, 'bear_use_spike': False, 'bear_rsi_required': False, 'sideways_strategy': 'breakout', 'sideways_bb_std_mult': 3.326462625486908, 'sideways_rsi_os': 35, 'sideways_rsi_ob': 56, 'sideways_adx_thresh': 14.96976421478824, 'sideways_atr_min_pct': 0.002766098317040515, 'sideways_atr_max_pct': 0.10060920494450051, 'sideways_tp_mult': 1.1562874458750358, 'sideways_tsl_mult': 0.960614325526971, 'sideways_time_stop': 199, 'sideways_use_sma': False, 'sideways_use_ema': True, 'sideways_use_atr': True, 'sideways_use_adx': False, 'sideways_use_spike': False, 'sideways_rsi_required': True}.
[I 2025-08-30 19:51:21,110] Trial 722 finished with values: [-1000000000.0, 1000000000.0] and parameters: {'p_sma': 5, 'p_std': 31, 'p_atr': 9, 'p_adx': 28, 'rsi_period': 21, 'ema1': 20, 'ema2': 30, 'slip_atr_k': 0.07574040957176517, 'slip_spread_k': 0.19725860385161303, 'spread_hl_frac': 0.02633950091733834, 'bb_std_mult': 2.307359360800202, 'rsi_os': 52, 'rsi_ob': 76, 'vol_spike': 0.16848865227662002, 'adx_thresh': 34.13981899245243, 'atr_min_pct': 0.02181988881839403, 'atr_max_pct': 0.09949063383445961, 'tp_mult': 2.415216876901201, 'tsl_mult': 0.41576945730592135, 'strategy': 'mean_reversion', 'time_stop': 187, 'use_sma': False, 'use_atr': True, 'use_adx': True, 'use_ema': False, 'use_spike': True, 'rsi_required': True, 'edge_k': 0.02859073662577294, 'edge_cap': 0.5049643089915388, 'bull_strategy': 'mean_reversion', 'bull_bb_std_mult': 3.1562807446944, 'bull_rsi_os': 34, 'bull_rsi_ob': 46, 'bull_adx_thresh': 6.938058097788275, 'bull_atr_min_pct': 0.010178956494616757, 'bull_atr_max_pct': 0.12545941818937603, 'bull_tp_mult': 1.1744256115760152, 'bull_tsl_mult': 0.3556346079150946, 'bull_time_stop': 172, 'bull_use_sma': False, 'bull_use_ema': True, 'bull_use_atr': False, 'bull_use_adx': False, 'bull_use_spike': True, 'bull_rsi_required': True, 'bear_strategy': 'breakout', 'bear_bb_std_mult': 2.9137923952382687, 'bear_rsi_os': 29, 'bear_rsi_ob': 76, 'bear_adx_thresh': 19.2918855543058, 'bear_atr_min_pct': 0.014776430655922556, 'bear_atr_max_pct': 0.05009144200781961, 'bear_tp_mult': 1.9005855847671114, 'bear_tsl_mult': 0.20083851270942127, 'bear_time_stop': 135, 'bear_use_sma': True, 'bear_use_ema': False, 'bear_use_atr': True, 'bear_use_adx': False, 'bear_use_spike': False, 'bear_rsi_required': True, 'sideways_strategy': 'mean_reversion', 'sideways_bb_std_mult': 3.0699887639366352, 'sideways_rsi_os': 48, 'sideways_rsi_ob': 60, 'sideways_adx_thresh': 20.755841986718785, 'sideways_atr_min_pct': 0.027181734195152456, 'sideways_atr_max_pct': 0.14101471394794307, 'sideways_tp_mult': 1.0980562351702459, 'sideways_tsl_mult': 0.9796635315410926, 'sideways_time_stop': 246, 'sideways_use_sma': False, 'sideways_use_ema': False, 'sideways_use_atr': True, 'sideways_use_adx': True, 'sideways_use_spike': False, 'sideways_rsi_required': False}.
