[I 2025-08-30 19:06:39,296] Trial 333 finished with values: [-1000000000.0, 1000000000.0] and parameters: {'p_sma': 25, 'p_std': 5, 'p_atr': 15, 'p_adx': 18, 'rsi_period': 19, 'ema1': 26, 'ema2': 32, 'slip_atr_k': 0.07197850805815853, 'slip_spread_k': 0.5324388100900352, 'spread_hl_frac': 0.020493258966281548, 'bb_std_mult': 2.2851480618893265, 'rsi_os': 49, 'rsi_ob': 85, 'vol_spike': 0.2570895057995048, 'adx_thresh': 29.63347108243817, 'atr_min_pct': 0.009763761224121204, 'atr_max_pct': 0.0972876003237308, 'tp_mult': 2.4416506091726924, 'tsl_mult': 0.8315058293701197, 'strategy': 'mean_reversion', 'time_stop': 185, 'use_sma': True, 'use_atr': True, 'use_adx': True, 'use_ema': False, 'use_spike': True, 'rsi_required': False, 'edge_k': 0.5858877864382329, 'edge_cap': 0.20250832582032535, 'bull_strategy': 'mean_reversion', 'bull_bb_std_mult': 1.9919850757292594, 'bull_rsi_os': 28, 'bull_rsi_ob': 49, 'bull_adx_thresh': 20.172819300056837, 'bull_atr_min_pct': 0.013649151295077057, 'bull_atr_max_pct': 0.11860203681739453, 'bull_tp_mult': 2.669682274281844, 'bull_tsl_mult': 0.4576013782800092, 'bull_time_stop': 161, 'bull_use_sma': False, 'bull_use_ema': True, 'bull_use_atr': False, 'bull_use_adx': False, 'bull_use_spike': True, 'bull_rsi_required': True, 'bear_strategy': 'breakout', 'bear_bb_std_mult': 2.928143722280124, 'bear_rsi_os': 52, 'bear_rsi_ob': 75, 'bear_adx_thresh': 10.806731444716268, 'bear_atr_min_pct': 0.016821232572551772, 'bear_atr_max_pct': 0.035279224132435096, 'bear_tp_mult': 2.381997100645222, 'bear_tsl_mult': 0.7718437665353889, 'bear_time_stop': 194, 'bear_use_sma': True, 'bear_use_ema': False, 'bear_use_atr': False, 'bear_use_adx': False, 'bear_use_spike': False, 'bear_rsi_required': True, 'sideways_strategy': 'breakout', 'sideways_bb_std_mult': 3.3458319678167996, 'sideways_rsi_os': 46, 'sideways_rsi_ob': 71, 'sideways_adx_thresh': 21.38172912734884, 'sideways_atr_min_pct': 0.008342455024719156, 'sideways_atr_max_pct': 0.03001158997238705, 'sideways_tp_mult': 1.4114113806188697, 'sideways_tsl_mult': 0.9704766742790508, 'sideways_time_stop': 220, 'sideways_use_sma': False, 'sideways_use_ema': True, 'sideways_use_atr': True, 'sideways_use_adx': False, 'sideways_use_spike': False, 'sideways_rsi_required': True}.
[I 2025-08-30 19:07:14,806] Trial 335 finished with values: [-1000000000.0, 1000000000.0] and parameters: {'p_sma': 8, 'p_std': 54, 'p_atr': 14, 'p_adx': 28, 'rsi_period': 47, 'ema1': 26, 'ema2': 36, 'slip_atr_k': 0.0716357747247734, 'slip_spread_k': 0.8830751680525819, 'spread_hl_frac': 0.02429661095947363, 'bb_std_mult': 2.680630689616608, 'rsi_os': 49, 'rsi_ob': 74, 'vol_spike': 0.25752614427410897, 'adx_thresh': 26.031800154844035, 'atr_min_pct': 0.011879727392562272, 'atr_max_pct': 0.10041915848303179, 'tp_mult': 2.3448831941867088, 'tsl_mult': 0.6411018651967261, 'strategy': 'mean_reversion', 'time_stop': 89, 'use_sma': False, 'use_atr': True, 'use_adx': False, 'use_ema': False, 'use_spike': False, 'rsi_required': True, 'edge_k': 1.9484953787675876, 'edge_cap': 0.19461625646468084, 'bull_strategy': 'mean_reversion', 'bull_bb_std_mult': 1.2272541075174024, 'bull_rsi_os': 31, 'bull_rsi_ob': 76, 'bull_adx_thresh': 34.380287903805794, 'bull_atr_min_pct': 0.0034353998960721136, 'bull_atr_max_pct': 0.11118289919970253, 'bull_tp_mult': 2.3479797189434595, 'bull_tsl_mult': 0.1300786736195521, 'bull_time_stop': 52, 'bull_use_sma': False, 'bull_use_ema': True, 'bull_use_atr': True, 'bull_use_adx': True, 'bull_use_spike': False, 'bull_rsi_required': False, 'bear_strategy': 'breakout', 'bear_bb_std_mult': 0.9607737456357373, 'bear_rsi_os': 45, 'bear_rsi_ob': 76, 'bear_adx_thresh': 17.81177109470069, 'bear_atr_min_pct': 0.024232104612465097, 'bear_atr_max_pct': 0.13905672329410182, 'bear_tp_mult': 2.6930288753870877, 'bear_tsl_mult': 0.7792646874350866, 'bear_time_stop': 196, 'bear_use_sma': True, 'bear_use_ema': True, 'bear_use_atr': False, 'bear_use_adx': False, 'bear_use_spike': False, 'bear_rsi_required': True, 'sideways_strategy': 'breakout', 'sideways_bb_std_mult': 2.131495682600991, 'sideways_rsi_os': 21, 'sideways_rsi_ob': 60, 'sideways_adx_thresh': 23.29486674006242, 'sideways_atr_min_pct': 0.0026352597613617233, 'sideways_atr_max_pct': 0.02863062055023371, 'sideways_tp_mult': 1.5612520308943867, 'sideways_tsl_mult': 0.6381972063001426, 'sideways_time_stop': 50, 'sideways_use_sma': False, 'sideways_use_ema': False, 'sideways_use_atr': True, 'sideways_use_adx': False, 'sideways_use_spike': False, 'sideways_rsi_required': False}.
[I 2025-08-30 19:07:15,233] Trial 336 finished with values: [-1000000000.0, 1000000000.0] and parameters: {'p_sma': 8, 'p_std': 33, 'p_atr': 19, 'p_adx': 20, 'rsi_period': 10, 'ema1': 16, 'ema2': 22, 'slip_atr_k': 0.06932409495434297, 'slip_spread_k': 0.7222567358913915, 'spread_hl_frac': 0.024392678495144024, 'bb_std_mult': 2.0861552548188493, 'rsi_os': 49, 'rsi_ob': 82, 'vol_spike': 0.2576824790977016, 'adx_thresh': 33.73396764815721, 'atr_min_pct': 0.023715474923129767, 'atr_max_pct': 0.09462088293430555, 'tp_mult': 1.1363310418541197, 'tsl_mult': 0.7619947286310746, 'strategy': 'mean_reversion', 'time_stop': 187, 'use_sma': False, 'use_atr': False, 'use_adx': False, 'use_ema': False, 'use_spike': False, 'rsi_required': True, 'edge_k': 1.7798676110222278, 'edge_cap': 0.4817964225887091, 'bull_strategy': 'mean_reversion', 'bull_bb_std_mult': 1.2197115344368783, 'bull_rsi_os': 31, 'bull_rsi_ob': 49, 'bull_adx_thresh': 16.430184515204154, 'bull_atr_min_pct': 0.0034191617838735394, 'bull_atr_max_pct': 0.11912447081347614, 'bull_tp_mult': 2.3442011200683237, 'bull_tsl_mult': 0.494163751490077, 'bull_time_stop': 187, 'bull_use_sma': False, 'bull_use_ema': True, 'bull_use_atr': True, 'bull_use_adx': False, 'bull_use_spike': False, 'bull_rsi_required': False, 'bear_strategy': 'breakout', 'bear_bb_std_mult': 1.6059238121472053, 'bear_rsi_os': 45, 'bear_rsi_ob': 77, 'bear_adx_thresh': 27.717500661701916, 'bear_atr_min_pct': 0.014945283343443909, 'bear_atr_max_pct': 0.13886983943216463, 'bear_tp_mult': 1.8156010584430113, 'bear_tsl_mult': 0.7479899564721285, 'bear_time_stop': 286, 'bear_use_sma': True, 'bear_use_ema': True, 'bear_use_atr': False, 'bear_use_adx': False, 'bear_use_spike': False, 'bear_rsi_required': False, 'sideways_strategy': 'breakout', 'sideways_bb_std_mult': 1.96498147759856, 'sideways_rsi_os': 19, 'sideways_rsi_ob': 60, 'sideways_adx_thresh': 23.386687295616554, 'sideways_atr_min_pct': 0.008174462629589995, 'sideways_atr_max_pct': 0.1410870292333356, 'sideways_tp_mult': 1.4091996271593734, 'sideways_tsl_mult': 0.9732834863838759, 'sideways_time_stop': 282, 'sideways_use_sma': False, 'sideways_use_ema': False, 'sideways_use_atr': True, 'sideways_use_adx': False, 'sideways_use_spike': False, 'sideways_rsi_required': False}.
[I 2025-08-30 19:07:15,615] Trial 337 finished with values: [-0.06653642034846396, 0.06660798519707557] and parameters: {'p_sma': 8, 'p_std': 54, 'p_atr': 10, 'p_adx': 11, 'rsi_period': 9, 'ema1': 25, 'ema2': 39, 'slip_atr_k': 0.06784736096404455, 'slip_spread_k': 0.884980678139065, 'spread_hl_frac': 0.02436211516366569, 'bb_std_mult': 2.084607300357261, 'rsi_os': 51, 'rsi_ob': 82, 'vol_spike': 0.11627140794827187, 'adx_thresh': 34.09440343003009, 'atr_min_pct': 0.017422116690428098, 'atr_max_pct': 0.10618081747137095, 'tp_mult': 2.353550576292525, 'tsl_mult': 0.7572732359192889, 'strategy': 'breakout', 'time_stop': 188, 'use_sma': False, 'use_atr': False, 'use_adx': False, 'use_ema': False, 'use_spike': False, 'rsi_required': True, 'edge_k': 1.7777425785776653, 'edge_cap': 0.4802321805081549, 'bull_strategy': 'breakout', 'bull_bb_std_mult': 0.6021571217286552, 'bull_rsi_os': 31, 'bull_rsi_ob': 46, 'bull_adx_thresh': 29.81607722786634, 'bull_atr_min_pct': 0.0025016607167180757, 'bull_atr_max_pct': 0.05071004629078841, 'bull_tp_mult': 2.70725988797555, 'bull_tsl_mult': 0.486079955084757, 'bull_time_stop': 187, 'bull_use_sma': True, 'bull_use_ema': False, 'bull_use_atr': True, 'bull_use_adx': False, 'bull_use_spike': False, 'bull_rsi_required': False, 'bear_strategy': 'breakout', 'bear_bb_std_mult': 0.9912041733102253, 'bear_rsi_os': 51, 'bear_rsi_ob': 77, 'bear_adx_thresh': 11.912594040932987, 'bear_atr_min_pct': 0.009560096481406091, 'bear_atr_max_pct': 0.028253868557572892, 'bear_tp_mult': 1.77806643940277, 'bear_tsl_mult': 0.7436115938513519, 'bear_time_stop': 196, 'bear_use_sma': True, 'bear_use_ema': True, 'bear_use_atr': False, 'bear_use_adx': True, 'bear_use_spike': False, 'bear_rsi_required': False, 'sideways_strategy': 'breakout', 'sideways_bb_std_mult': 3.114020241996037, 'sideways_rsi_os': 21, 'sideways_rsi_ob': 60, 'sideways_adx_thresh': 19.765280946113407, 'sideways_atr_min_pct': 1.4366404059431778e-05, 'sideways_atr_max_pct': 0.14440410175500404, 'sideways_tp_mult': 1.1029498546014609, 'sideways_tsl_mult': 0.8976749944865126, 'sideways_time_stop': 86, 'sideways_use_sma': False, 'sideways_use_ema': False, 'sideways_use_atr': True, 'sideways_use_adx': False, 'sideways_use_spike': True, 'sideways_rsi_required': False}.
[I 2025-08-30 19:07:15,849] Trial 334 finished with values: [-1000000000.0, 1000000000.0] and parameters: {'p_sma': 7, 'p_std': 33, 'p_atr': 24, 'p_adx': 18, 'rsi_period': 47, 'ema1': 16, 'ema2': 42, 'slip_atr_k': 0.0726451796134625, 'slip_spread_k': 0.7213888631499858, 'spread_hl_frac': 0.020439681882788267, 'bb_std_mult': 2.2451495167057343, 'rsi_os': 48, 'rsi_ob': 82, 'vol_spike': 0.25780558723578567, 'adx_thresh': 25.94179931729201, 'atr_min_pct': 0.009945433735212495, 'atr_max_pct': 0.01354184486970976, 'tp_mult': 2.3408071520233578, 'tsl_mult': 0.8311586907169517, 'strategy': 'mean_reversion', 'time_stop': 187, 'use_sma': False, 'use_atr': True, 'use_adx': False, 'use_ema': False, 'use_spike': True, 'rsi_required': True, 'edge_k': 1.944073530580222, 'edge_cap': 0.43707367415795395, 'bull_strategy': 'mean_reversion', 'bull_bb_std_mult': 3.2104003973935673, 'bull_rsi_os': 31, 'bull_rsi_ob': 49, 'bull_adx_thresh': 28.264254784224654, 'bull_atr_min_pct': 0.027862440607465087, 'bull_atr_max_pct': 0.11814234531580023, 'bull_tp_mult': 2.628659612908505, 'bull_tsl_mult': 0.44658799153637535, 'bull_time_stop': 185, 'bull_use_sma': False, 'bull_use_ema': True, 'bull_use_atr': True, 'bull_use_adx': False, 'bull_use_spike': False, 'bull_rsi_required': True, 'bear_strategy': 'breakout', 'bear_bb_std_mult': 0.9905196620501266, 'bear_rsi_os': 27, 'bear_rsi_ob': 75, 'bear_adx_thresh': 11.937499657454222, 'bear_atr_min_pct': 0.015135190480708965, 'bear_atr_max_pct': 0.030166481389976255, 'bear_tp_mult': 2.58777085339074, 'bear_tsl_mult': 0.7778510639600491, 'bear_time_stop': 193, 'bear_use_sma': True, 'bear_use_ema': True, 'bear_use_atr': False, 'bear_use_adx': False, 'bear_use_spike': False, 'bear_rsi_required': True, 'sideways_strategy': 'breakout', 'sideways_bb_std_mult': 3.22101856316215, 'sideways_rsi_os': 19, 'sideways_rsi_ob': 71, 'sideways_adx_thresh': 6.525902259142711, 'sideways_atr_min_pct': 0.01204598934727628, 'sideways_atr_max_pct': 0.1413449734512574, 'sideways_tp_mult': 1.3977433347943826, 'sideways_tsl_mult': 0.9690651189411248, 'sideways_time_stop': 232, 'sideways_use_sma': False, 'sideways_use_ema': True, 'sideways_use_atr': True, 'sideways_use_adx': True, 'sideways_use_spike': False, 'sideways_rsi_required': False}.
[I 2025-08-30 19:07:16,475] Trial 340 finished with values: [-1000000000.0, 1000000000.0] and parameters: {'p_sma': 7, 'p_std': 56, 'p_atr': 11, 'p_adx': 19, 'rsi_period': 66, 'ema1': 27, 'ema2': 42, 'slip_atr_k': 0.07655740803530706, 'slip_spread_k': 0.40161471876847954, 'spread_hl_frac': 0.022852276659082207, 'bb_std_mult': 2.176619438030259, 'rsi_os': 47, 'rsi_ob': 47, 'vol_spike': 0.16634361469961334, 'adx_thresh': 17.47935789649869, 'atr_min_pct': 0.0072927403984201595, 'atr_max_pct': 0.08821359431689449, 'tp_mult': 1.8592944432672975, 'tsl_mult': 0.856006297855761, 'strategy': 'mean_reversion', 'time_stop': 204, 'use_sma': False, 'use_atr': True, 'use_adx': True, 'use_ema': False, 'use_spike': True, 'rsi_required': False, 'edge_k': 0.018286684553455376, 'edge_cap': 0.28360895206960796, 'bull_strategy': 'mean_reversion', 'bull_bb_std_mult': 3.2106467560937837, 'bull_rsi_os': 32, 'bull_rsi_ob': 45, 'bull_adx_thresh': 28.58527131998263, 'bull_atr_min_pct': 0.024066642402313564, 'bull_atr_max_pct': 0.12296701663618188, 'bull_tp_mult': 2.2703400875965998, 'bull_tsl_mult': 0.41801247773788175, 'bull_time_stop': 288, 'bull_use_sma': True, 'bull_use_ema': True, 'bull_use_atr': True, 'bull_use_adx': False, 'bull_use_spike': False, 'bull_rsi_required': True, 'bear_strategy': 'breakout', 'bear_bb_std_mult': 2.855689784126826, 'bear_rsi_os': 33, 'bear_rsi_ob': 76, 'bear_adx_thresh': 18.717325070163852, 'bear_atr_min_pct': 0.014356717456576833, 'bear_atr_max_pct': 0.03020845364674709, 'bear_tp_mult': 2.535221682202168, 'bear_tsl_mult': 0.7187467771239997, 'bear_time_stop': 202, 'bear_use_sma': False, 'bear_use_ema': True, 'bear_use_atr': False, 'bear_use_adx': False, 'bear_use_spike': False, 'bear_rsi_required': True, 'sideways_strategy': 'mean_reversion', 'sideways_bb_std_mult': 0.5735852342242165, 'sideways_rsi_os': 35, 'sideways_rsi_ob': 58, 'sideways_adx_thresh': 7.545453015354138, 'sideways_atr_min_pct': 0.022132820169602573, 'sideways_atr_max_pct': 0.1448552892735018, 'sideways_tp_mult': 1.0922034650734949, 'sideways_tsl_mult': 0.5305735435542865, 'sideways_time_stop': 157, 'sideways_use_sma': False, 'sideways_use_ema': True, 'sideways_use_atr': False, 'sideways_use_adx': False, 'sideways_use_spike': False, 'sideways_rsi_required': True}.
[I 2025-08-30 19:07:49,077] Trial 338 finished with values: [-1000000000.0, 1000000000.0] and parameters: {'p_sma': 7, 'p_std': 16, 'p_atr': 10, 'p_adx': 25, 'rsi_period': 24, 'ema1': 16, 'ema2': 42, 'slip_atr_k': 0.0769295873424417, 'slip_spread_k': 0.18792876052178537, 'spread_hl_frac': 0.022345025045060907, 'bb_std_mult': 2.105010604594007, 'rsi_os': 47, 'rsi_ob': 82, 'vol_spike': 0.06748933381008397, 'adx_thresh': 17.487247402697363, 'atr_min_pct': 0.01750704069832949, 'atr_max_pct': 0.08789373905867945, 'tp_mult': 1.3334217097616259, 'tsl_mult': 0.8658581443480552, 'strategy': 'breakout', 'time_stop': 191, 'use_sma': False, 'use_atr': False, 'use_adx': False, 'use_ema': False, 'use_spike': False, 'rsi_required': True, 'edge_k': 0.14311197795459518, 'edge_cap': 0.8606183967705677, 'bull_strategy': 'breakout', 'bull_bb_std_mult': 3.1955965364768595, 'bull_rsi_os': 13, 'bull_rsi_ob': 45, 'bull_adx_thresh': 28.430002360652047, 'bull_atr_min_pct': 0.002455346061592308, 'bull_atr_max_pct': 0.05154834535693978, 'bull_tp_mult': 2.716526082021729, 'bull_tsl_mult': 0.4894709999323899, 'bull_time_stop': 188, 'bull_use_sma': True, 'bull_use_ema': False, 'bull_use_atr': True, 'bull_use_adx': False, 'bull_use_spike': False, 'bull_rsi_required': False, 'bear_strategy': 'breakout', 'bear_bb_std_mult': 2.918169607232831, 'bear_rsi_os': 14, 'bear_rsi_ob': 77, 'bear_adx_thresh': 23.28702834404256, 'bear_atr_min_pct': 0.014859490279110321, 'bear_atr_max_pct': 0.027478332718804656, 'bear_tp_mult': 2.7549816293315774, 'bear_tsl_mult': 0.39190097791063405, 'bear_time_stop': 75, 'bear_use_sma': True, 'bear_use_ema': True, 'bear_use_atr': False, 'bear_use_adx': True, 'bear_use_spike': False, 'bear_rsi_required': False, 'sideways_strategy': 'mean_reversion', 'sideways_bb_std_mult': 3.212756098766868, 'sideways_rsi_os': 36, 'sideways_rsi_ob': 92, 'sideways_adx_thresh': 6.553865607173215, 'sideways_atr_min_pct': 0.007139849963887973, 'sideways_atr_max_pct': 0.1444596896534567, 'sideways_tp_mult': 1.1036521382663456, 'sideways_tsl_mult': 0.8926647099028202, 'sideways_time_stop': 234, 'sideways_use_sma': False, 'sideways_use_ema': True, 'sideways_use_atr': True, 'sideways_use_adx': False, 'sideways_use_spike': True, 'sideways_rsi_required': False}.
[I 2025-08-30 19:07:50,152] Trial 339 finished with values: [-1000000000.0, 1000000000.0] and parameters: {'p_sma': 7, 'p_std': 57, 'p_atr': 10, 'p_adx': 25, 'rsi_period': 24, 'ema1': 25, 'ema2': 33, 'slip_atr_k': 0.07571913597779562, 'slip_spread_k': 0.14462858679866256, 'spread_hl_frac': 0.022399215863550048, 'bb_std_mult': 1.0025433628193663, 'rsi_os': 51, 'rsi_ob': 83, 'vol_spike': 0.24800658411561602, 'adx_thresh': 17.73713172694028, 'atr_min_pct': 0.024492790235910424, 'atr_max_pct': 0.03996417666512396, 'tp_mult': 2.5053585714163225, 'tsl_mult': 0.8581445166586248, 'strategy': 'breakout', 'time_stop': 119, 'use_sma': False, 'use_atr': False, 'use_adx': True, 'use_ema': False, 'use_spike': True, 'rsi_required': False, 'edge_k': 1.3496617510520836, 'edge_cap': 0.8614422357600218, 'bull_strategy': 'breakout', 'bull_bb_std_mult': 3.5933242777027177, 'bull_rsi_os': 32, 'bull_rsi_ob': 45, 'bull_adx_thresh': 17.77399448761454, 'bull_atr_min_pct': 0.007637768746022789, 'bull_atr_max_pct': 0.12236031918041808, 'bull_tp_mult': 2.6168899595396944, 'bull_tsl_mult': 0.41889001850739926, 'bull_time_stop': 173, 'bull_use_sma': True, 'bull_use_ema': False, 'bull_use_atr': True, 'bull_use_adx': False, 'bull_use_spike': False, 'bull_rsi_required': True, 'bear_strategy': 'breakout', 'bear_bb_std_mult': 0.7999180582700982, 'bear_rsi_os': 33, 'bear_rsi_ob': 75, 'bear_adx_thresh': 18.894712347980665, 'bear_atr_min_pct': 0.014532672205122929, 'bear_atr_max_pct': 0.029692920172879445, 'bear_tp_mult': 2.7571808005614598, 'bear_tsl_mult': 0.734203420927368, 'bear_time_stop': 179, 'bear_use_sma': True, 'bear_use_ema': True, 'bear_use_atr': False, 'bear_use_adx': True, 'bear_use_spike': False, 'bear_rsi_required': True, 'sideways_strategy': 'mean_reversion', 'sideways_bb_std_mult': 3.2209406974109807, 'sideways_rsi_os': 36, 'sideways_rsi_ob': 58, 'sideways_adx_thresh': 31.066049181744386, 'sideways_atr_min_pct': 1.1070205898361038e-05, 'sideways_atr_max_pct': 0.14446369393828215, 'sideways_tp_mult': 1.1033953088452397, 'sideways_tsl_mult': 0.08407680202126122, 'sideways_time_stop': 157, 'sideways_use_sma': False, 'sideways_use_ema': True, 'sideways_use_atr': True, 'sideways_use_adx': False, 'sideways_use_spike': True, 'sideways_rsi_required': True}.
[I 2025-08-30 19:07:50,412] Trial 341 finished with values: [-0.08803897019495599, 0.08812863709149756] and parameters: {'p_sma': 13, 'p_std': 16, 'p_atr': 9, 'p_adx': 17, 'rsi_period': 24, 'ema1': 27, 'ema2': 29, 'slip_atr_k': 0.07640981167282641, 'slip_spread_k': 0.14400681553617953, 'spread_hl_frac': 0.022495237431066066, 'bb_std_mult': 2.1510575433805292, 'rsi_os': 47, 'rsi_ob': 47, 'vol_spike': 0.10243462278048363, 'adx_thresh': 17.729300480785238, 'atr_min_pct': 0.02681128711685354, 'atr_max_pct': 0.08884225548559084, 'tp_mult': 2.2700367208169894, 'tsl_mult': 0.8592096320260154, 'strategy': 'breakout', 'time_stop': 203, 'use_sma': False, 'use_atr': True, 'use_adx': True, 'use_ema': False, 'use_spike': True, 'rsi_required': False, 'edge_k': 1.6483541478487478, 'edge_cap': 0.8488009911690912, 'bull_strategy': 'breakout', 'bull_bb_std_mult': 2.65112707669444, 'bull_rsi_os': 51, 'bull_rsi_ob': 45, 'bull_adx_thresh': 7.309106543970442, 'bull_atr_min_pct': 6.631586175214615e-05, 'bull_atr_max_pct': 0.08084137256411415, 'bull_tp_mult': 2.7780245961686143, 'bull_tsl_mult': 0.5312650798623884, 'bull_time_stop': 173, 'bull_use_sma': True, 'bull_use_ema': False, 'bull_use_atr': False, 'bull_use_adx': False, 'bull_use_spike': True, 'bull_rsi_required': True, 'bear_strategy': 'breakout', 'bear_bb_std_mult': 2.8679833145853473, 'bear_rsi_os': 52, 'bear_rsi_ob': 77, 'bear_adx_thresh': 18.91937106922905, 'bear_atr_min_pct': 0.0007174738570392292, 'bear_atr_max_pct': 0.02457299996857845, 'bear_tp_mult': 2.753223302802395, 'bear_tsl_mult': 0.7103473882139294, 'bear_time_stop': 230, 'bear_use_sma': False, 'bear_use_ema': True, 'bear_use_atr': False, 'bear_use_adx': True, 'bear_use_spike': False, 'bear_rsi_required': True, 'sideways_strategy': 'mean_reversion', 'sideways_bb_std_mult': 0.5802276642546458, 'sideways_rsi_os': 36, 'sideways_rsi_ob': 58, 'sideways_adx_thresh': 20.031416055543787, 'sideways_atr_min_pct': 0.015092778120190664, 'sideways_atr_max_pct': 0.12874297272038707, 'sideways_tp_mult': 2.2776943861296903, 'sideways_tsl_mult': 0.5297438214659099, 'sideways_time_stop': 158, 'sideways_use_sma': False, 'sideways_use_ema': True, 'sideways_use_atr': False, 'sideways_use_adx': False, 'sideways_use_spike': True, 'sideways_rsi_required': True}.
