[I 2025-08-30 19:59:25,509] Trial 787 finished with values: [-0.032452370985446954, 0.03249669013115924] and parameters: {'p_sma': 8, 'p_std': 33, 'p_atr': 8, 'p_adx': 20, 'rsi_period': 24, 'ema1': 26, 'ema2': 29, 'slip_atr_k': 0.08534821754834916, 'slip_spread_k': 0.4419065322735961, 'spread_hl_frac': 0.006139449743919299, 'bb_std_mult': 2.226002577656772, 'rsi_os': 48, 'rsi_ob': 80, 'vol_spike': 0.10532803024287503, 'adx_thresh': 32.96195580507461, 'atr_min_pct': 0.02325545368047988, 'atr_max_pct': 0.09732678959742862, 'tp_mult': 2.2865847268851223, 'tsl_mult': 0.8231987121760753, 'strategy': 'mean_reversion', 'time_stop': 195, 'use_sma': False, 'use_atr': True, 'use_adx': True, 'use_ema': False, 'use_spike': True, 'rsi_required': False, 'edge_k': 0.07684586919098628, 'edge_cap': 0.496399088459051, 'bull_strategy': 'breakout', 'bull_bb_std_mult': 2.3733272692156264, 'bull_rsi_os': 31, 'bull_rsi_ob': 64, 'bull_adx_thresh': 18.048302165359644, 'bull_atr_min_pct': 0.020490546186456193, 'bull_atr_max_pct': 0.12403063810212102, 'bull_tp_mult': 2.4976656888139046, 'bull_tsl_mult': 0.5771999056733503, 'bull_time_stop': 192, 'bull_use_sma': False, 'bull_use_ema': True, 'bull_use_atr': True, 'bull_use_adx': False, 'bull_use_spike': False, 'bull_rsi_required': True, 'bear_strategy': 'breakout', 'bear_bb_std_mult': 2.258589298630524, 'bear_rsi_os': 49, 'bear_rsi_ob': 80, 'bear_adx_thresh': 12.702702049395398, 'bear_atr_min_pct': 0.014996378704643439, 'bear_atr_max_pct': 0.0852500240230461, 'bear_tp_mult': 2.6849230490074203, 'bear_tsl_mult': 0.7821317594082228, 'bear_time_stop': 47, 'bear_use_sma': True, 'bear_use_ema': True, 'bear_use_atr': False, 'bear_use_adx': False, 'bear_use_spike': False, 'bear_rsi_required': False, 'sideways_strategy': 'breakout', 'sideways_bb_std_mult': 1.9175513341273616, 'sideways_rsi_os': 34, 'sideways_rsi_ob': 87, 'sideways_adx_thresh': 27.446116075880468, 'sideways_atr_min_pct': 0.00038590522145507213, 'sideways_atr_max_pct': 0.14557620640629132, 'sideways_tp_mult': 1.3098768925691244, 'sideways_tsl_mult': 0.9243668262047781, 'sideways_time_stop': 232, 'sideways_use_sma': False, 'sideways_use_ema': True, 'sideways_use_atr': True, 'sideways_use_adx': False, 'sideways_use_spike': False, 'sideways_rsi_required': True}.
[I 2025-08-30 19:59:26,477] Trial 794 finished with values: [-1000000000.0, 1000000000.0] and parameters: {'p_sma': 6, 'p_std': 45, 'p_atr': 20, 'p_adx': 20, 'rsi_period': 21, 'ema1': 13, 'ema2': 35, 'slip_atr_k': 0.23922783193877434, 'slip_spread_k': 0.16404088920787113, 'spread_hl_frac': 0.02710229591504082, 'bb_std_mult': 1.806904274398687, 'rsi_os': 19, 'rsi_ob': 47, 'vol_spike': 0.27761150348595764, 'adx_thresh': 34.54819558502294, 'atr_min_pct': 0.021844248144347038, 'atr_max_pct': 0.09949819451173837, 'tp_mult': 2.120947977033495, 'tsl_mult': 0.5284901255852773, 'strategy': 'mean_reversion', 'time_stop': 34, 'use_sma': False, 'use_atr': True, 'use_adx': True, 'use_ema': False, 'use_spike': True, 'rsi_required': False, 'edge_k': 0.18364354963889307, 'edge_cap': 0.39659505255650745, 'bull_strategy': 'mean_reversion', 'bull_bb_std_mult': 1.2003842177233361, 'bull_rsi_os': 33, 'bull_rsi_ob': 47, 'bull_adx_thresh': 33.059438248994006, 'bull_atr_min_pct': 0.025337000890421436, 'bull_atr_max_pct': 0.012025782220740994, 'bull_tp_mult': 2.833833897260337, 'bull_tsl_mult': 0.4968716625814625, 'bull_time_stop': 189, 'bull_use_sma': False, 'bull_use_ema': True, 'bull_use_atr': True, 'bull_use_adx': False, 'bull_use_spike': False, 'bull_rsi_required': True, 'bear_strategy': 'breakout', 'bear_bb_std_mult': 2.8607388837438026, 'bear_rsi_os': 30, 'bear_rsi_ob': 61, 'bear_adx_thresh': 8.850516739631919, 'bear_atr_min_pct': 0.013854660564492045, 'bear_atr_max_pct': 0.03641681810136805, 'bear_tp_mult': 2.756957861534604, 'bear_tsl_mult': 0.7247203812677802, 'bear_time_stop': 31, 'bear_use_sma': True, 'bear_use_ema': True, 'bear_use_atr': True, 'bear_use_adx': False, 'bear_use_spike': False, 'bear_rsi_required': True, 'sideways_strategy': 'breakout', 'sideways_bb_std_mult': 3.2741338083911016, 'sideways_rsi_os': 40, 'sideways_rsi_ob': 67, 'sideways_adx_thresh': 7.393733448014855, 'sideways_atr_min_pct': 0.0016225565148267355, 'sideways_atr_max_pct': 0.1453230299452546, 'sideways_tp_mult': 2.789263781908863, 'sideways_tsl_mult': 0.4364850124126244, 'sideways_time_stop': 56, 'sideways_use_sma': False, 'sideways_use_ema': True, 'sideways_use_atr': True, 'sideways_use_adx': False, 'sideways_use_spike': False, 'sideways_rsi_required': True}.
[I 2025-08-30 19:59:53,101] Trial 793 finished with values: [-0.05304716595194714, 0.05298872746733603] and parameters: {'p_sma': 44, 'p_std': 33, 'p_atr': 20, 'p_adx': 22, 'rsi_period': 31, 'ema1': 26, 'ema2': 18, 'slip_atr_k': 0.2384172022060329, 'slip_spread_k': 0.05538571609023557, 'spread_hl_frac': 0.027800246591885888, 'bb_std_mult': 2.052625204074398, 'rsi_os': 7, 'rsi_ob': 90, 'vol_spike': 0.19873207534265058, 'adx_thresh': 20.7697839964826, 'atr_min_pct': 0.004214223959766984, 'atr_max_pct': 0.08944948415385481, 'tp_mult': 2.244154574089406, 'tsl_mult': 0.8383443321907247, 'strategy': 'mean_reversion', 'time_stop': 48, 'use_sma': False, 'use_atr': True, 'use_adx': True, 'use_ema': False, 'use_spike': True, 'rsi_required': False, 'edge_k': 0.17834053125767585, 'edge_cap': 0.4957454866178026, 'bull_strategy': 'mean_reversion', 'bull_bb_std_mult': 2.3364371348561916, 'bull_rsi_os': 16, 'bull_rsi_ob': 47, 'bull_adx_thresh': 34.20046182666617, 'bull_atr_min_pct': 0.020459744544157877, 'bull_atr_max_pct': 0.12956479458785114, 'bull_tp_mult': 2.839217113253432, 'bull_tsl_mult': 0.33572502831692963, 'bull_time_stop': 189, 'bull_use_sma': False, 'bull_use_ema': True, 'bull_use_atr': True, 'bull_use_adx': False, 'bull_use_spike': False, 'bull_rsi_required': True, 'bear_strategy': 'breakout', 'bear_bb_std_mult': 2.865060806081537, 'bear_rsi_os': 21, 'bear_rsi_ob': 74, 'bear_adx_thresh': 5.30614072385425, 'bear_atr_min_pct': 0.008298763305548108, 'bear_atr_max_pct': 0.0370500449243854, 'bear_tp_mult': 1.577622399067634, 'bear_tsl_mult': 0.7704538849698094, 'bear_time_stop': 31, 'bear_use_sma': True, 'bear_use_ema': True, 'bear_use_atr': False, 'bear_use_adx': False, 'bear_use_spike': False, 'bear_rsi_required': True, 'sideways_strategy': 'breakout', 'sideways_bb_std_mult': 2.7958845677916635, 'sideways_rsi_os': 36, 'sideways_rsi_ob': 61, 'sideways_adx_thresh': 22.293987585886523, 'sideways_atr_min_pct': 0.0013072800969311624, 'sideways_atr_max_pct': 0.1455054370051331, 'sideways_tp_mult': 1.1754567582478053, 'sideways_tsl_mult': 0.9831886571111937, 'sideways_time_stop': 249, 'sideways_use_sma': False, 'sideways_use_ema': True, 'sideways_use_atr': True, 'sideways_use_adx': False, 'sideways_use_spike': False, 'sideways_rsi_required': True}.
[I 2025-08-30 19:59:57,679] Trial 795 finished with values: [-0.02540976121961469, 0.02534545919229263] and parameters: {'p_sma': 52, 'p_std': 33, 'p_atr': 29, 'p_adx': 28, 'rsi_period': 23, 'ema1': 5, 'ema2': 34, 'slip_atr_k': 0.05711614364986523, 'slip_spread_k': 0.1595064489140785, 'spread_hl_frac': 0.026941731826696843, 'bb_std_mult': 0.8467712107065342, 'rsi_os': 45, 'rsi_ob': 84, 'vol_spike': 0.19880216736946074, 'adx_thresh': 24.923667889365827, 'atr_min_pct': 0.011327057252556715, 'atr_max_pct': 0.09432231884009053, 'tp_mult': 2.1242769118298175, 'tsl_mult': 0.15427758583240098, 'strategy': 'mean_reversion', 'time_stop': 179, 'use_sma': False, 'use_atr': True, 'use_adx': True, 'use_ema': False, 'use_spike': True, 'rsi_required': False, 'edge_k': 1.808840096346736, 'edge_cap': 0.4882507268515915, 'bull_strategy': 'mean_reversion', 'bull_bb_std_mult': 0.8788347550695053, 'bull_rsi_os': 16, 'bull_rsi_ob': 47, 'bull_adx_thresh': 14.949909109114609, 'bull_atr_min_pct': 0.007755577753715013, 'bull_atr_max_pct': 0.038895375605079247, 'bull_tp_mult': 2.7749029064083066, 'bull_tsl_mult': 0.3363135880610193, 'bull_time_stop': 187, 'bull_use_sma': False, 'bull_use_ema': True, 'bull_use_atr': True, 'bull_use_adx': False, 'bull_use_spike': False, 'bull_rsi_required': True, 'bear_strategy': 'breakout', 'bear_bb_std_mult': 3.2349926391137576, 'bear_rsi_os': 53, 'bear_rsi_ob': 68, 'bear_adx_thresh': 18.31254256940639, 'bear_atr_min_pct': 0.006134162307188221, 'bear_atr_max_pct': 0.03543100216474905, 'bear_tp_mult': 2.105508290797079, 'bear_tsl_mult': 0.7291901296092173, 'bear_time_stop': 155, 'bear_use_sma': True, 'bear_use_ema': True, 'bear_use_atr': True, 'bear_use_adx': False, 'bear_use_spike': False, 'bear_rsi_required': True, 'sideways_strategy': 'breakout', 'sideways_bb_std_mult': 3.2514596769238313, 'sideways_rsi_os': 40, 'sideways_rsi_ob': 59, 'sideways_adx_thresh': 31.699503504214377, 'sideways_atr_min_pct': 0.0019081863918079356, 'sideways_atr_max_pct': 0.010134611520347253, 'sideways_tp_mult': 2.799657404580974, 'sideways_tsl_mult': 0.4362926074175977, 'sideways_time_stop': 241, 'sideways_use_sma': False, 'sideways_use_ema': True, 'sideways_use_atr': True, 'sideways_use_adx': False, 'sideways_use_spike': False, 'sideways_rsi_required': True}.
[I 2025-08-30 19:59:57,681] Trial 796 finished with values: [-0.08116552763203022, 0.08112280547084545] and parameters: {'p_sma': 55, 'p_std': 27, 'p_atr': 7, 'p_adx': 22, 'rsi_period': 37, 'ema1': 5, 'ema2': 19, 'slip_atr_k': 0.2364558851992713, 'slip_spread_k': 0.1650399358989389, 'spread_hl_frac': 0.027429090234866504, 'bb_std_mult': 0.5018464141296093, 'rsi_os': 7, 'rsi_ob': 90, 'vol_spike': 0.27866860210975825, 'adx_thresh': 34.377635362159474, 'atr_min_pct': 0.010603112645625194, 'atr_max_pct': 0.11208167285804149, 'tp_mult': 2.2518627724588565, 'tsl_mult': 0.15290470141800244, 'strategy': 'mean_reversion', 'time_stop': 22, 'use_sma': True, 'use_atr': True, 'use_adx': False, 'use_ema': False, 'use_spike': True, 'rsi_required': False, 'edge_k': 0.19869716572042767, 'edge_cap': 0.540971186128346, 'bull_strategy': 'mean_reversion', 'bull_bb_std_mult': 3.116589715166148, 'bull_rsi_os': 33, 'bull_rsi_ob': 47, 'bull_adx_thresh': 14.699485691381902, 'bull_atr_min_pct': 0.02516554274628869, 'bull_atr_max_pct': 0.05571749894868151, 'bull_tp_mult': 2.8251514511450146, 'bull_tsl_mult': 0.4247325156552197, 'bull_time_stop': 279, 'bull_use_sma': False, 'bull_use_ema': True, 'bull_use_atr': True, 'bull_use_adx': True, 'bull_use_spike': False, 'bull_rsi_required': False, 'bear_strategy': 'breakout', 'bear_bb_std_mult': 2.85183241364511, 'bear_rsi_os': 52, 'bear_rsi_ob': 67, 'bear_adx_thresh': 18.14757199729438, 'bear_atr_min_pct': 0.006132350158305171, 'bear_atr_max_pct': 0.036095065015861204, 'bear_tp_mult': 2.7497519817793488, 'bear_tsl_mult': 0.06668417516818781, 'bear_time_stop': 120, 'bear_use_sma': True, 'bear_use_ema': False, 'bear_use_atr': True, 'bear_use_adx': False, 'bear_use_spike': False, 'bear_rsi_required': True, 'sideways_strategy': 'breakout', 'sideways_bb_std_mult': 3.2678627530826225, 'sideways_rsi_os': 36, 'sideways_rsi_ob': 59, 'sideways_adx_thresh': 8.47439213116674, 'sideways_atr_min_pct': 0.001293648067840512, 'sideways_atr_max_pct': 0.012683688419767997, 'sideways_tp_mult': 1.1669141178273836, 'sideways_tsl_mult': 0.9832709035425007, 'sideways_time_stop': 185, 'sideways_use_sma': False, 'sideways_use_ema': False, 'sideways_use_atr': True, 'sideways_use_adx': False, 'sideways_use_spike': False, 'sideways_rsi_required': False}.
[I 2025-08-30 20:00:02,124] Trial 797 finished with values: [-0.08649723371287377, 0.08641012365190716] and parameters: {'p_sma': 36, 'p_std': 32, 'p_atr': 10, 'p_adx': 11, 'rsi_period': 72, 'ema1': 28, 'ema2': 19, 'slip_atr_k': 0.20738523547018728, 'slip_spread_k': 0.14338609619398804, 'spread_hl_frac': 0.028234325505986806, 'bb_std_mult': 0.8286084590505653, 'rsi_os': 47, 'rsi_ob': 84, 'vol_spike': 0.20025544105614332, 'adx_thresh': 23.22241627187985, 'atr_min_pct': 0.01042513114927257, 'atr_max_pct': 0.09027320866347541, 'tp_mult': 2.248400681451199, 'tsl_mult': 0.8917402301969772, 'strategy': 'mean_reversion', 'time_stop': 202, 'use_sma': True, 'use_atr': True, 'use_adx': False, 'use_ema': True, 'use_spike': True, 'rsi_required': False, 'edge_k': 0.20163751546496242, 'edge_cap': 0.9393496641331929, 'bull_strategy': 'mean_reversion', 'bull_bb_std_mult': 2.9026490463948926, 'bull_rsi_os': 17, 'bull_rsi_ob': 47, 'bull_adx_thresh': 20.005188824168847, 'bull_atr_min_pct': 0.010030253624166638, 'bull_atr_max_pct': 0.03858150605633268, 'bull_tp_mult': 2.271798850419988, 'bull_tsl_mult': 0.5319838736137903, 'bull_time_stop': 278, 'bull_use_sma': False, 'bull_use_ema': False, 'bull_use_atr': True, 'bull_use_adx': True, 'bull_use_spike': True, 'bull_rsi_required': False, 'bear_strategy': 'breakout', 'bear_bb_std_mult': 2.8724071600148386, 'bear_rsi_os': 52, 'bear_rsi_ob': 83, 'bear_adx_thresh': 18.133929587074537, 'bear_atr_min_pct': 0.02541610568442146, 'bear_atr_max_pct': 0.10426521533093583, 'bear_tp_mult': 2.1066693821357716, 'bear_tsl_mult': 0.764630334137272, 'bear_time_stop': 154, 'bear_use_sma': True, 'bear_use_ema': False, 'bear_use_atr': False, 'bear_use_adx': False, 'bear_use_spike': True, 'bear_rsi_required': True, 'sideways_strategy': 'mean_reversion', 'sideways_bb_std_mult': 2.372804276322989, 'sideways_rsi_os': 36, 'sideways_rsi_ob': 55, 'sideways_adx_thresh': 19.049948369524444, 'sideways_atr_min_pct': 0.0010994989914011378, 'sideways_atr_max_pct': 0.01337771485628124, 'sideways_tp_mult': 2.9980563384412124, 'sideways_tsl_mult': 0.9823555434271947, 'sideways_time_stop': 78, 'sideways_use_sma': False, 'sideways_use_ema': False, 'sideways_use_atr': True, 'sideways_use_adx': True, 'sideways_use_spike': False, 'sideways_rsi_required': False}.
[I 2025-08-30 20:00:02,662] Trial 800 finished with values: [-1000000000.0, 1000000000.0] and parameters: {'p_sma': 14, 'p_std': 11, 'p_atr': 12, 'p_adx': 30, 'rsi_period': 26, 'ema1': 27, 'ema2': 32, 'slip_atr_k': 0.03223315214960763, 'slip_spread_k': 0.7312324806470434, 'spread_hl_frac': 0.023128540515215897, 'bb_std_mult': 2.16661453304546, 'rsi_os': 51, 'rsi_ob': 86, 'vol_spike': 0.2684580986474319, 'adx_thresh': 33.83482408761635, 'atr_min_pct': 0.014053326444270136, 'atr_max_pct': 0.10239751773816076, 'tp_mult': 2.4340645105624725, 'tsl_mult': 0.880686513109518, 'strategy': 'mean_reversion', 'time_stop': 200, 'use_sma': True, 'use_atr': False, 'use_adx': False, 'use_ema': True, 'use_spike': False, 'rsi_required': True, 'edge_k': 0.10299485949314527, 'edge_cap': 0.9438688432105673, 'bull_strategy': 'mean_reversion', 'bull_bb_std_mult': 2.942795404901273, 'bull_rsi_os': 29, 'bull_rsi_ob': 75, 'bull_adx_thresh': 18.505720301017625, 'bull_atr_min_pct': 0.027867262063653416, 'bull_atr_max_pct': 0.11208558911761722, 'bull_tp_mult': 1.8672320558632416, 'bull_tsl_mult': 0.10055745751294404, 'bull_time_stop': 171, 'bull_use_sma': True, 'bull_use_ema': False, 'bull_use_atr': True, 'bull_use_adx': True, 'bull_use_spike': True, 'bull_rsi_required': False, 'bear_strategy': 'mean_reversion', 'bear_bb_std_mult': 2.6040818498809406, 'bear_rsi_os': 51, 'bear_rsi_ob': 76, 'bear_adx_thresh': 16.63165451803885, 'bear_atr_min_pct': 0.016483134599528843, 'bear_atr_max_pct': 0.031997968384385164, 'bear_tp_mult': 2.6415052371770624, 'bear_tsl_mult': 0.9568707482217145, 'bear_time_stop': 224, 'bear_use_sma': True, 'bear_use_ema': False, 'bear_use_atr': False, 'bear_use_adx': False, 'bear_use_spike': True, 'bear_rsi_required': True, 'sideways_strategy': 'mean_reversion', 'sideways_bb_std_mult': 2.341642675423595, 'sideways_rsi_os': 11, 'sideways_rsi_ob': 95, 'sideways_adx_thresh': 18.999439512020693, 'sideways_atr_min_pct': 0.007767306751475133, 'sideways_atr_max_pct': 0.12769283890580885, 'sideways_tp_mult': 1.0393150561825242, 'sideways_tsl_mult': 0.9579832944513159, 'sideways_time_stop': 81, 'sideways_use_sma': True, 'sideways_use_ema': False, 'sideways_use_atr': False, 'sideways_use_adx': True, 'sideways_use_spike': True, 'sideways_rsi_required': False}.
[I 2025-08-30 20:00:32,847] Trial 798 finished with values: [-1000000000.0, 1000000000.0] and parameters: {'p_sma': 39, 'p_std': 31, 'p_atr': 8, 'p_adx': 28, 'rsi_period': 23, 'ema1': 27, 'ema2': 32, 'slip_atr_k': 0.20866357732561353, 'slip_spread_k': 0.5998424100468643, 'spread_hl_frac': 0.02300519238407285, 'bb_std_mult': 2.1676585066033836, 'rsi_os': 13, 'rsi_ob': 84, 'vol_spike': 0.05963878596306456, 'adx_thresh': 25.033205062262688, 'atr_min_pct': 0.010354475924475566, 'atr_max_pct': 0.09302018193542166, 'tp_mult': 2.4335380494301906, 'tsl_mult': 0.03572254162076932, 'strategy': 'mean_reversion', 'time_stop': 22, 'use_sma': True, 'use_atr': False, 'use_adx': False, 'use_ema': True, 'use_spike': False, 'rsi_required': False, 'edge_k': 0.11113048327400346, 'edge_cap': 0.9247010561812281, 'bull_strategy': 'mean_reversion', 'bull_bb_std_mult': 0.8409759759165645, 'bull_rsi_os': 36, 'bull_rsi_ob': 45, 'bull_adx_thresh': 20.16642981780154, 'bull_atr_min_pct': 0.0025176109520128297, 'bull_atr_max_pct': 0.12014378372684559, 'bull_tp_mult': 2.392105773370925, 'bull_tsl_mult': 0.42456930332636805, 'bull_time_stop': 170, 'bull_use_sma': True, 'bull_use_ema': False, 'bull_use_atr': True, 'bull_use_adx': True, 'bull_use_spike': True, 'bull_rsi_required': False, 'bear_strategy': 'mean_reversion', 'bear_bb_std_mult': 3.1193890375093956, 'bear_rsi_os': 28, 'bear_rsi_ob': 83, 'bear_adx_thresh': 16.620027991256066, 'bear_atr_min_pct': 0.005753348847815297, 'bear_atr_max_pct': 0.03265560726644864, 'bear_tp_mult': 2.7522101172906206, 'bear_tsl_mult': 0.25351853094785654, 'bear_time_stop': 156, 'bear_use_sma': True, 'bear_use_ema': False, 'bear_use_atr': True, 'bear_use_adx': False, 'bear_use_spike': True, 'bear_rsi_required': True, 'sideways_strategy': 'mean_reversion', 'sideways_bb_std_mult': 2.3713765001703626, 'sideways_rsi_os': 11, 'sideways_rsi_ob': 91, 'sideways_adx_thresh': 17.7461263535892, 'sideways_atr_min_pct': 0.002485445080084184, 'sideways_atr_max_pct': 0.13755724268128844, 'sideways_tp_mult': 1.078098711899468, 'sideways_tsl_mult': 0.984699736845425, 'sideways_time_stop': 85, 'sideways_use_sma': True, 'sideways_use_ema': False, 'sideways_use_atr': False, 'sideways_use_adx': True, 'sideways_use_spike': False, 'sideways_rsi_required': False}.
[I 2025-08-30 20:00:33,245] Trial 799 finished with values: [-1000000000.0, 1000000000.0] and parameters: {'p_sma': 7, 'p_std': 31, 'p_atr': 25, 'p_adx': 21, 'rsi_period': 72, 'ema1': 27, 'ema2': 32, 'slip_atr_k': 0.10363097898384503, 'slip_spread_k': 0.5934525236294316, 'spread_hl_frac': 0.0233476916955917, 'bb_std_mult': 2.1602523618598592, 'rsi_os': 49, 'rsi_ob': 86, 'vol_spike': 0.12486404654757087, 'adx_thresh': 33.65067603422742, 'atr_min_pct': 0.02414579650094788, 'atr_max_pct': 0.056449835835282264, 'tp_mult': 2.424146958619821, 'tsl_mult': 0.8820813824189637, 'strategy': 'mean_reversion', 'time_stop': 182, 'use_sma': True, 'use_atr': False, 'use_adx': False, 'use_ema': True, 'use_spike': False, 'rsi_required': True, 'edge_k': 0.10896739562558062, 'edge_cap': 0.635492919399789, 'bull_strategy': 'mean_reversion', 'bull_bb_std_mult': 2.90915575445926, 'bull_rsi_os': 20, 'bull_rsi_ob': 45, 'bull_adx_thresh': 19.993581416411285, 'bull_atr_min_pct': 0.014833291668975667, 'bull_atr_max_pct': 0.12065331903101685, 'bull_tp_mult': 2.674439869119134, 'bull_tsl_mult': 0.5099841653582636, 'bull_time_stop': 171, 'bull_use_sma': True, 'bull_use_ema': False, 'bull_use_atr': True, 'bull_use_adx': True, 'bull_use_spike': True, 'bull_rsi_required': False, 'bear_strategy': 'mean_reversion', 'bear_bb_std_mult': 2.619802905850898, 'bear_rsi_os': 51, 'bear_rsi_ob': 66, 'bear_adx_thresh': 19.45069893355489, 'bear_atr_min_pct': 0.016518655070985506, 'bear_atr_max_pct': 0.10399811722116462, 'bear_tp_mult': 1.060101399897484, 'bear_tsl_mult': 0.7557739040792671, 'bear_time_stop': 202, 'bear_use_sma': True, 'bear_use_ema': False, 'bear_use_atr': False, 'bear_use_adx': False, 'bear_use_spike': True, 'bear_rsi_required': True, 'sideways_strategy': 'mean_reversion', 'sideways_bb_std_mult': 3.461424587264893, 'sideways_rsi_os': 11, 'sideways_rsi_ob': 55, 'sideways_adx_thresh': 11.231066460731281, 'sideways_atr_min_pct': 0.007228346810534762, 'sideways_atr_max_pct': 0.13733555860720184, 'sideways_tp_mult': 1.6197799411104046, 'sideways_tsl_mult': 0.9981684961565673, 'sideways_time_stop': 83, 'sideways_use_sma': True, 'sideways_use_ema': False, 'sideways_use_atr': False, 'sideways_use_adx': True, 'sideways_use_spike': True, 'sideways_rsi_required': False}.
