[I 2025-08-30 19:32:58,186] Trial 558 finished with values: [-1000000000.0, 1000000000.0] and parameters: {'p_sma': 12, 'p_std': 10, 'p_atr': 8, 'p_adx': 10, 'rsi_period': 30, 'ema1': 5, 'ema2': 17, 'slip_atr_k': 0.08401127029818195, 'slip_spread_k': 0.06531959144567556, 'spread_hl_frac': 0.024744253481104008, 'bb_std_mult': 2.1894671421006926, 'rsi_os': 45, 'rsi_ob': 76, 'vol_spike': 0.05907642740184453, 'adx_thresh': 33.533512391011, 'atr_min_pct': 0.004977343870811177, 'atr_max_pct': 0.09504706522572937, 'tp_mult': 2.1992926608442187, 'tsl_mult': 0.8517658885819962, 'strategy': 'breakout', 'time_stop': 171, 'use_sma': False, 'use_atr': False, 'use_adx': True, 'use_ema': True, 'use_spike': False, 'rsi_required': True, 'edge_k': 0.7375114156165659, 'edge_cap': 0.5672182931855205, 'bull_strategy': 'mean_reversion', 'bull_bb_std_mult': 3.0822127087597364, 'bull_rsi_os': 28, 'bull_rsi_ob': 66, 'bull_adx_thresh': 17.36552250283764, 'bull_atr_min_pct': 0.0024236092687161476, 'bull_atr_max_pct': 0.11452252002803295, 'bull_tp_mult': 2.7830081427309263, 'bull_tsl_mult': 0.5022394531875616, 'bull_time_stop': 43, 'bull_use_sma': True, 'bull_use_ema': False, 'bull_use_atr': True, 'bull_use_adx': True, 'bull_use_spike': False, 'bull_rsi_required': True, 'bear_strategy': 'breakout', 'bear_bb_std_mult': 0.8124793620245467, 'bear_rsi_os': 18, 'bear_rsi_ob': 61, 'bear_adx_thresh': 24.486044194613832, 'bear_atr_min_pct': 0.01665389377287451, 'bear_atr_max_pct': 0.03626234520422297, 'bear_tp_mult': 2.59784232502412, 'bear_tsl_mult': 0.37402944303535657, 'bear_time_stop': 203, 'bear_use_sma': False, 'bear_use_ema': True, 'bear_use_atr': True, 'bear_use_adx': True, 'bear_use_spike': False, 'bear_rsi_required': False, 'sideways_strategy': 'mean_reversion', 'sideways_bb_std_mult': 1.621425820945749, 'sideways_rsi_os': 35, 'sideways_rsi_ob': 58, 'sideways_adx_thresh': 21.586451437949428, 'sideways_atr_min_pct': 0.025460281522305082, 'sideways_atr_max_pct': 0.14996221732089487, 'sideways_tp_mult': 1.010848362438088, 'sideways_tsl_mult': 0.7764361064674237, 'sideways_time_stop': 54, 'sideways_use_sma': False, 'sideways_use_ema': False, 'sideways_use_atr': True, 'sideways_use_adx': False, 'sideways_use_spike': True, 'sideways_rsi_required': True}.
[I 2025-08-30 19:33:07,503] Trial 559 finished with values: [-0.05485953360596252, 0.05480331609235181] and parameters: {'p_sma': 15, 'p_std': 5, 'p_atr': 27, 'p_adx': 21, 'rsi_period': 30, 'ema1': 5, 'ema2': 32, 'slip_atr_k': 0.07988866788463558, 'slip_spread_k': 0.15528459139075798, 'spread_hl_frac': 0.023133837818037496, 'bb_std_mult': 2.174903605481891, 'rsi_os': 10, 'rsi_ob': 89, 'vol_spike': 0.27642164583464834, 'adx_thresh': 33.57883741563748, 'atr_min_pct': 0.011711844019998037, 'atr_max_pct': 0.13634289413305767, 'tp_mult': 2.7902202759819104, 'tsl_mult': 0.8520967386381765, 'strategy': 'breakout', 'time_stop': 295, 'use_sma': False, 'use_atr': False, 'use_adx': True, 'use_ema': True, 'use_spike': True, 'rsi_required': True, 'edge_k': 0.24656505977785131, 'edge_cap': 0.5812313108969456, 'bull_strategy': 'mean_reversion', 'bull_bb_std_mult': 3.0813850857155964, 'bull_rsi_os': 28, 'bull_rsi_ob': 48, 'bull_adx_thresh': 10.803400181145452, 'bull_atr_min_pct': 0.0025088866450282844, 'bull_atr_max_pct': 0.12919112666661983, 'bull_tp_mult': 2.781965727333723, 'bull_tsl_mult': 0.469599825194306, 'bull_time_stop': 278, 'bull_use_sma': False, 'bull_use_ema': False, 'bull_use_atr': True, 'bull_use_adx': True, 'bull_use_spike': False, 'bull_rsi_required': True, 'bear_strategy': 'breakout', 'bear_bb_std_mult': 2.8054138663358406, 'bear_rsi_os': 18, 'bear_rsi_ob': 76, 'bear_adx_thresh': 24.716540939363608, 'bear_atr_min_pct': 0.029715483142897882, 'bear_atr_max_pct': 0.03704156536086735, 'bear_tp_mult': 2.6034840671663293, 'bear_tsl_mult': 0.8400816189042035, 'bear_time_stop': 198, 'bear_use_sma': True, 'bear_use_ema': True, 'bear_use_atr': True, 'bear_use_adx': True, 'bear_use_spike': False, 'bear_rsi_required': False, 'sideways_strategy': 'mean_reversion', 'sideways_bb_std_mult': 0.717907826841961, 'sideways_rsi_os': 35, 'sideways_rsi_ob': 60, 'sideways_adx_thresh': 20.581539481047738, 'sideways_atr_min_pct': 0.0015434775535091132, 'sideways_atr_max_pct': 0.14763999935808228, 'sideways_tp_mult': 1.4362523274228853, 'sideways_tsl_mult': 0.7737231913125975, 'sideways_time_stop': 70, 'sideways_use_sma': False, 'sideways_use_ema': False, 'sideways_use_atr': False, 'sideways_use_adx': False, 'sideways_use_spike': True, 'sideways_rsi_required': True}.
[I 2025-08-30 19:33:12,516] Trial 560 finished with values: [-1000000000.0, 1000000000.0] and parameters: {'p_sma': 57, 'p_std': 20, 'p_atr': 9, 'p_adx': 20, 'rsi_period': 23, 'ema1': 13, 'ema2': 34, 'slip_atr_k': 0.07887425036659579, 'slip_spread_k': 0.15130353074540814, 'spread_hl_frac': 0.02879415353196732, 'bb_std_mult': 0.6477900771118945, 'rsi_os': 10, 'rsi_ob': 88, 'vol_spike': 0.06800827660098217, 'adx_thresh': 33.597233552586395, 'atr_min_pct': 0.015776420450653608, 'atr_max_pct': 0.06779595643627645, 'tp_mult': 2.2121641992138947, 'tsl_mult': 0.27434964692080566, 'strategy': 'breakout', 'time_stop': 202, 'use_sma': False, 'use_atr': False, 'use_adx': True, 'use_ema': True, 'use_spike': True, 'rsi_required': True, 'edge_k': 0.08826977363947147, 'edge_cap': 0.21428277147226255, 'bull_strategy': 'mean_reversion', 'bull_bb_std_mult': 3.0632605394950416, 'bull_rsi_os': 5, 'bull_rsi_ob': 66, 'bull_adx_thresh': 34.62292342961267, 'bull_atr_min_pct': 0.004065111228071682, 'bull_atr_max_pct': 0.07578435711279126, 'bull_tp_mult': 2.7372284961734668, 'bull_tsl_mult': 0.4615297955055556, 'bull_time_stop': 175, 'bull_use_sma': False, 'bull_use_ema': False, 'bull_use_atr': True, 'bull_use_adx': False, 'bull_use_spike': False, 'bull_rsi_required': True, 'bear_strategy': 'breakout', 'bear_bb_std_mult': 0.8188533265500082, 'bear_rsi_os': 51, 'bear_rsi_ob': 61, 'bear_adx_thresh': 19.4244588730666, 'bear_atr_min_pct': 0.02140668986530225, 'bear_atr_max_pct': 0.017523239700455516, 'bear_tp_mult': 1.282488291051286, 'bear_tsl_mult': 0.853441100162625, 'bear_time_stop': 198, 'bear_use_sma': True, 'bear_use_ema': True, 'bear_use_atr': True, 'bear_use_adx': True, 'bear_use_spike': False, 'bear_rsi_required': False, 'sideways_strategy': 'mean_reversion', 'sideways_bb_std_mult': 2.016676500367429, 'sideways_rsi_os': 35, 'sideways_rsi_ob': 84, 'sideways_adx_thresh': 24.464464119122503, 'sideways_atr_min_pct': 0.017951451641716357, 'sideways_atr_max_pct': 0.14715938773385703, 'sideways_tp_mult': 1.0798769805063488, 'sideways_tsl_mult': 0.9985513011766355, 'sideways_time_stop': 212, 'sideways_use_sma': False, 'sideways_use_ema': False, 'sideways_use_atr': False, 'sideways_use_adx': False, 'sideways_use_spike': True, 'sideways_rsi_required': True}.
[I 2025-08-30 19:33:16,389] Trial 561 finished with values: [-1000000000.0, 1000000000.0] and parameters: {'p_sma': 11, 'p_std': 21, 'p_atr': 28, 'p_adx': 17, 'rsi_period': 23, 'ema1': 26, 'ema2': 37, 'slip_atr_k': 0.06363123663909967, 'slip_spread_k': 0.30752802848089056, 'spread_hl_frac': 0.02879369915809941, 'bb_std_mult': 3.251947027973311, 'rsi_os': 34, 'rsi_ob': 79, 'vol_spike': 0.05611074224293802, 'adx_thresh': 29.850952689307288, 'atr_min_pct': 0.016173159807513257, 'atr_max_pct': 0.09744295001643005, 'tp_mult': 2.20669794687618, 'tsl_mult': 0.2748488338765053, 'strategy': 'mean_reversion', 'time_stop': 111, 'use_sma': False, 'use_atr': True, 'use_adx': True, 'use_ema': False, 'use_spike': True, 'rsi_required': False, 'edge_k': 0.39321158269351497, 'edge_cap': 0.45800421030577954, 'bull_strategy': 'mean_reversion', 'bull_bb_std_mult': 3.2391382577914225, 'bull_rsi_os': 28, 'bull_rsi_ob': 79, 'bull_adx_thresh': 18.057490644914054, 'bull_atr_min_pct': 0.015397813113770236, 'bull_atr_max_pct': 0.11019855906918061, 'bull_tp_mult': 2.738151598885132, 'bull_tsl_mult': 0.8793890883720976, 'bull_time_stop': 223, 'bull_use_sma': False, 'bull_use_ema': False, 'bull_use_atr': True, 'bull_use_adx': False, 'bull_use_spike': True, 'bull_rsi_required': True, 'bear_strategy': 'breakout', 'bear_bb_std_mult': 0.5004450322801897, 'bear_rsi_os': 52, 'bear_rsi_ob': 61, 'bear_adx_thresh': 19.287151830938647, 'bear_atr_min_pct': 0.015006587232875561, 'bear_atr_max_pct': 0.03552712531928472, 'bear_tp_mult': 2.8993860104469675, 'bear_tsl_mult': 0.8173096209376168, 'bear_time_stop': 199, 'bear_use_sma': True, 'bear_use_ema': True, 'bear_use_atr': True, 'bear_use_adx': False, 'bear_use_spike': False, 'bear_rsi_required': True, 'sideways_strategy': 'breakout', 'sideways_bb_std_mult': 0.7323409027930969, 'sideways_rsi_os': 50, 'sideways_rsi_ob': 91, 'sideways_adx_thresh': 20.58128793039937, 'sideways_atr_min_pct': 0.0130001529594488, 'sideways_atr_max_pct': 0.09937227759706573, 'sideways_tp_mult': 2.0657907590542943, 'sideways_tsl_mult': 0.951170221657719, 'sideways_time_stop': 63, 'sideways_use_sma': False, 'sideways_use_ema': True, 'sideways_use_atr': False, 'sideways_use_adx': False, 'sideways_use_spike': True, 'sideways_rsi_required': True}.
[I 2025-08-30 19:33:39,008] Trial 562 finished with values: [-1000000000.0, 1000000000.0] and parameters: {'p_sma': 10, 'p_std': 33, 'p_atr': 9, 'p_adx': 21, 'rsi_period': 23, 'ema1': 26, 'ema2': 30, 'slip_atr_k': 0.2321191847289949, 'slip_spread_k': 0.1439435752778746, 'spread_hl_frac': 0.028711912139576728, 'bb_std_mult': 2.433178304127065, 'rsi_os': 10, 'rsi_ob': 79, 'vol_spike': 0.06770612597775107, 'adx_thresh': 14.382335688358939, 'atr_min_pct': 0.0065323716084584905, 'atr_max_pct': 0.0978601055021815, 'tp_mult': 1.0857932088024107, 'tsl_mult': 0.8269026767173981, 'strategy': 'mean_reversion', 'time_stop': 195, 'use_sma': False, 'use_atr': True, 'use_adx': True, 'use_ema': False, 'use_spike': True, 'rsi_required': False, 'edge_k': 0.6890007104857347, 'edge_cap': 0.1661165571548715, 'bull_strategy': 'mean_reversion', 'bull_bb_std_mult': 3.2197715807043528, 'bull_rsi_os': 30, 'bull_rsi_ob': 95, 'bull_adx_thresh': 34.64137445916069, 'bull_atr_min_pct': 0.004032092176009252, 'bull_atr_max_pct': 0.1107451125207788, 'bull_tp_mult': 2.7417460307984114, 'bull_tsl_mult': 0.6042553484613622, 'bull_time_stop': 174, 'bull_use_sma': False, 'bull_use_ema': True, 'bull_use_atr': True, 'bull_use_adx': False, 'bull_use_spike': True, 'bull_rsi_required': True, 'bear_strategy': 'breakout', 'bear_bb_std_mult': 3.1301364645830496, 'bear_rsi_os': 52, 'bear_rsi_ob': 76, 'bear_adx_thresh': 19.568342296146138, 'bear_atr_min_pct': 0.0217210501806695, 'bear_atr_max_pct': 0.03127611645219191, 'bear_tp_mult': 2.7585774839763086, 'bear_tsl_mult': 0.8106576761709176, 'bear_time_stop': 178, 'bear_use_sma': True, 'bear_use_ema': True, 'bear_use_atr': False, 'bear_use_adx': False, 'bear_use_spike': False, 'bear_rsi_required': True, 'sideways_strategy': 'breakout', 'sideways_bb_std_mult': 2.5509418853622323, 'sideways_rsi_os': 33, 'sideways_rsi_ob': 61, 'sideways_adx_thresh': 20.35248661693862, 'sideways_atr_min_pct': 0.01277068688929859, 'sideways_atr_max_pct': 0.0990225069106164, 'sideways_tp_mult': 1.4396899492504014, 'sideways_tsl_mult': 0.10377847867556139, 'sideways_time_stop': 64, 'sideways_use_sma': False, 'sideways_use_ema': True, 'sideways_use_atr': False, 'sideways_use_adx': False, 'sideways_use_spike': False, 'sideways_rsi_required': True}.
[I 2025-08-30 19:33:45,259] Trial 563 finished with values: [-1000000000.0, 1000000000.0] and parameters: {'p_sma': 57, 'p_std': 20, 'p_atr': 9, 'p_adx': 20, 'rsi_period': 41, 'ema1': 18, 'ema2': 53, 'slip_atr_k': 0.2301720714552305, 'slip_spread_k': 0.14835862360797125, 'spread_hl_frac': 0.022863189925962472, 'bb_std_mult': 2.2568414054169152, 'rsi_os': 31, 'rsi_ob': 84, 'vol_spike': 0.268015583196185, 'adx_thresh': 14.37905210356431, 'atr_min_pct': 0.028504480391167736, 'atr_max_pct': 0.13126827564477023, 'tp_mult': 2.2624818018073767, 'tsl_mult': 0.8223736139501608, 'strategy': 'mean_reversion', 'time_stop': 205, 'use_sma': False, 'use_atr': True, 'use_adx': True, 'use_ema': False, 'use_spike': True, 'rsi_required': False, 'edge_k': 0.08263509123162327, 'edge_cap': 0.6135399968014191, 'bull_strategy': 'mean_reversion', 'bull_bb_std_mult': 3.2533262448695237, 'bull_rsi_os': 18, 'bull_rsi_ob': 95, 'bull_adx_thresh': 18.92914073596102, 'bull_atr_min_pct': 0.003664595452518305, 'bull_atr_max_pct': 0.1421029363793369, 'bull_tp_mult': 2.7340057538108082, 'bull_tsl_mult': 0.5574150505704019, 'bull_time_stop': 175, 'bull_use_sma': False, 'bull_use_ema': True, 'bull_use_atr': False, 'bull_use_adx': False, 'bull_use_spike': True, 'bull_rsi_required': True, 'bear_strategy': 'breakout', 'bear_bb_std_mult': 3.054794964532397, 'bear_rsi_os': 52, 'bear_rsi_ob': 76, 'bear_adx_thresh': 20.4535906409355, 'bear_atr_min_pct': 0.021739957819760226, 'bear_atr_max_pct': 0.031925257540853104, 'bear_tp_mult': 2.7447494021148056, 'bear_tsl_mult': 0.8158012342943273, 'bear_time_stop': 178, 'bear_use_sma': True, 'bear_use_ema': True, 'bear_use_atr': False, 'bear_use_adx': False, 'bear_use_spike': False, 'bear_rsi_required': True, 'sideways_strategy': 'breakout', 'sideways_bb_std_mult': 2.552026153176786, 'sideways_rsi_os': 34, 'sideways_rsi_ob': 61, 'sideways_adx_thresh': 22.748660962736853, 'sideways_atr_min_pct': 0.017787039539913525, 'sideways_atr_max_pct': 0.12125064638490402, 'sideways_tp_mult': 1.0762550956909218, 'sideways_tsl_mult': 0.9981751313522778, 'sideways_time_stop': 160, 'sideways_use_sma': False, 'sideways_use_ema': True, 'sideways_use_atr': False, 'sideways_use_adx': False, 'sideways_use_spike': False, 'sideways_rsi_required': False}.
[I 2025-08-30 19:33:49,306] Trial 564 finished with values: [-1000000000.0, 1000000000.0] and parameters: {'p_sma': 10, 'p_std': 34, 'p_atr': 15, 'p_adx': 7, 'rsi_period': 59, 'ema1': 26, 'ema2': 30, 'slip_atr_k': 0.10384982489392511, 'slip_spread_k': 0.6570876552719089, 'spread_hl_frac': 0.03647076260903449, 'bb_std_mult': 2.4227880154203456, 'rsi_os': 33, 'rsi_ob': 84, 'vol_spike': 0.10485325848000902, 'adx_thresh': 8.654171707412592, 'atr_min_pct': 0.022828447034130117, 'atr_max_pct': 0.12017471058936915, 'tp_mult': 1.5245159629372793, 'tsl_mult': 0.7576509232867138, 'strategy': 'mean_reversion', 'time_stop': 112, 'use_sma': False, 'use_atr': True, 'use_adx': False, 'use_ema': False, 'use_spike': True, 'rsi_required': False, 'edge_k': 0.14947382921034036, 'edge_cap': 0.9014359663100839, 'bull_strategy': 'mean_reversion', 'bull_bb_std_mult': 3.235554750601062, 'bull_rsi_os': 45, 'bull_rsi_ob': 47, 'bull_adx_thresh': 12.870500970153072, 'bull_atr_min_pct': 0.0005768179486957221, 'bull_atr_max_pct': 0.10992590659249805, 'bull_tp_mult': 2.32136187200254, 'bull_tsl_mult': 0.241549032232731, 'bull_time_stop': 182, 'bull_use_sma': False, 'bull_use_ema': True, 'bull_use_atr': False, 'bull_use_adx': False, 'bull_use_spike': True, 'bull_rsi_required': True, 'bear_strategy': 'mean_reversion', 'bear_bb_std_mult': 1.7839557893864262, 'bear_rsi_os': 29, 'bear_rsi_ob': 56, 'bear_adx_thresh': 18.628891958412986, 'bear_atr_min_pct': 0.017818104355768326, 'bear_atr_max_pct': 0.031080053775521695, 'bear_tp_mult': 2.1152390913313055, 'bear_tsl_mult': 0.06322236797188169, 'bear_time_stop': 189, 'bear_use_sma': True, 'bear_use_ema': True, 'bear_use_atr': False, 'bear_use_adx': False, 'bear_use_spike': False, 'bear_rsi_required': True, 'sideways_strategy': 'breakout', 'sideways_bb_std_mult': 1.4654124660473566, 'sideways_rsi_os': 19, 'sideways_rsi_ob': 55, 'sideways_adx_thresh': 33.96346476591916, 'sideways_atr_min_pct': 0.0020760146757404668, 'sideways_atr_max_pct': 0.12066180855727235, 'sideways_tp_mult': 2.782930906122774, 'sideways_tsl_mult': 0.9602390456456161, 'sideways_time_stop': 118, 'sideways_use_sma': False, 'sideways_use_ema': True, 'sideways_use_atr': True, 'sideways_use_adx': False, 'sideways_use_spike': False, 'sideways_rsi_required': False}.
[I 2025-08-30 19:33:52,235] Trial 565 finished with values: [-1000000000.0, 1000000000.0] and parameters: {'p_sma': 14, 'p_std': 33, 'p_atr': 10, 'p_adx': 20, 'rsi_period': 59, 'ema1': 17, 'ema2': 29, 'slip_atr_k': 0.07108242526287298, 'slip_spread_k': 0.9434060209108448, 'spread_hl_frac': 0.022977125545070313, 'bb_std_mult': 3.5959700302298847, 'rsi_os': 49, 'rsi_ob': 85, 'vol_spike': 0.26808509441242967, 'adx_thresh': 34.58302642829012, 'atr_min_pct': 0.007918248743973861, 'atr_max_pct': 0.1018139115314862, 'tp_mult': 2.2669870474009155, 'tsl_mult': 0.8261886822430673, 'strategy': 'mean_reversion', 'time_stop': 195, 'use_sma': False, 'use_atr': True, 'use_adx': False, 'use_ema': False, 'use_spike': True, 'rsi_required': False, 'edge_k': 0.1782790995041736, 'edge_cap': 0.4783385882244859, 'bull_strategy': 'mean_reversion', 'bull_bb_std_mult': 3.2465334018949097, 'bull_rsi_os': 30, 'bull_rsi_ob': 93, 'bull_adx_thresh': 18.905799583529667, 'bull_atr_min_pct': 0.0005967245317411241, 'bull_atr_max_pct': 0.11920048615217847, 'bull_tp_mult': 1.1011222223972572, 'bull_tsl_mult': 0.5527529375731421, 'bull_time_stop': 198, 'bull_use_sma': False, 'bull_use_ema': True, 'bull_use_atr': False, 'bull_use_adx': False, 'bull_use_spike': True, 'bull_rsi_required': True, 'bear_strategy': 'mean_reversion', 'bear_bb_std_mult': 3.059232332907047, 'bear_rsi_os': 26, 'bear_rsi_ob': 90, 'bear_adx_thresh': 18.50888540458391, 'bear_atr_min_pct': 0.015912303629142165, 'bear_atr_max_pct': 0.08289603523131536, 'bear_tp_mult': 2.7459043929200058, 'bear_tsl_mult': 0.3237930703332341, 'bear_time_stop': 207, 'bear_use_sma': True, 'bear_use_ema': True, 'bear_use_atr': False, 'bear_use_adx': False, 'bear_use_spike': False, 'bear_rsi_required': True, 'sideways_strategy': 'breakout', 'sideways_bb_std_mult': 3.2406684433978983, 'sideways_rsi_os': 11, 'sideways_rsi_ob': 56, 'sideways_adx_thresh': 20.270273807081864, 'sideways_atr_min_pct': 0.0016765354663571585, 'sideways_atr_max_pct': 0.14563822921048103, 'sideways_tp_mult': 1.807320164025493, 'sideways_tsl_mult': 0.980433729228807, 'sideways_time_stop': 119, 'sideways_use_sma': True, 'sideways_use_ema': True, 'sideways_use_atr': True, 'sideways_use_adx': False, 'sideways_use_spike': False, 'sideways_rsi_required': False}.
[I 2025-08-30 19:34:23,467] Trial 566 finished with values: [-1000000000.0, 1000000000.0] and parameters: {'p_sma': 7, 'p_std': 27, 'p_atr': 20, 'p_adx': 9, 'rsi_period': 59, 'ema1': 18, 'ema2': 30, 'slip_atr_k': 0.07395424063887661, 'slip_spread_k': 0.8849431958809679, 'spread_hl_frac': 0.018598051516198873, 'bb_std_mult': 1.719615954330461, 'rsi_os': 47, 'rsi_ob': 85, 'vol_spike': 0.10669511029021334, 'adx_thresh': 27.730751845336126, 'atr_min_pct': 0.02230444307625225, 'atr_max_pct': 0.11955427392860044, 'tp_mult': 1.52074442460347, 'tsl_mult': 0.8718516250322605, 'strategy': 'mean_reversion', 'time_stop': 178, 'use_sma': False, 'use_atr': True, 'use_adx': False, 'use_ema': False, 'use_spike': True, 'rsi_required': False, 'edge_k': 0.14310160627652507, 'edge_cap': 0.47467907994094954, 'bull_strategy': 'mean_reversion', 'bull_bb_std_mult': 2.812061450957455, 'bull_rsi_os': 31, 'bull_rsi_ob': 47, 'bull_adx_thresh': 18.975811442348274, 'bull_atr_min_pct': 0.0005924425959946125, 'bull_atr_max_pct': 0.11951135548293601, 'bull_tp_mult': 2.1752670181364318, 'bull_tsl_mult': 0.5250859519588813, 'bull_time_stop': 102, 'bull_use_sma': False, 'bull_use_ema': True, 'bull_use_atr': False, 'bull_use_adx': False, 'bull_use_spike': False, 'bull_rsi_required': True, 'bear_strategy': 'mean_reversion', 'bear_bb_std_mult': 1.7844803905354123, 'bear_rsi_os': 53, 'bear_rsi_ob': 56, 'bear_adx_thresh': 7.372715282913417, 'bear_atr_min_pct': 0.015835869642173418, 'bear_atr_max_pct': 0.08167941089961005, 'bear_tp_mult': 2.116510179539116, 'bear_tsl_mult': 0.5946233427052452, 'bear_time_stop': 189, 'bear_use_sma': True, 'bear_use_ema': True, 'bear_use_atr': False, 'bear_use_adx': False, 'bear_use_spike': True, 'bear_rsi_required': True, 'sideways_strategy': 'breakout', 'sideways_bb_std_mult': 1.4712328754659585, 'sideways_rsi_os': 39, 'sideways_rsi_ob': 48, 'sideways_adx_thresh': 30.44834455969142, 'sideways_atr_min_pct': 0.001961013092330633, 'sideways_atr_max_pct': 0.14559595596278344, 'sideways_tp_mult': 2.671194632151816, 'sideways_tsl_mult': 0.629577336545036, 'sideways_time_stop': 162, 'sideways_use_sma': True, 'sideways_use_ema': True, 'sideways_use_atr': True, 'sideways_use_adx': False, 'sideways_use_spike': False, 'sideways_rsi_required': False}.
