[I 2025-08-30 19:36:44,661] Trial 593 finished with values: [-1000000000.0, 1000000000.0] and parameters: {'p_sma': 6, 'p_std': 30, 'p_atr': 11, 'p_adx': 29, 'rsi_period': 24, 'ema1': 12, 'ema2': 57, 'slip_atr_k': 0.006097833481947909, 'slip_spread_k': 0.07784502525568576, 'spread_hl_frac': 0.022956464418938095, 'bb_std_mult': 1.875347218226119, 'rsi_os': 42, 'rsi_ob': 84, 'vol_spike': 0.04038437974856669, 'adx_thresh': 12.978626340264473, 'atr_min_pct': 0.02917162852005848, 'atr_max_pct': 0.09873376082707451, 'tp_mult': 2.1963467801139, 'tsl_mult': 0.5570336830307502, 'strategy': 'breakout', 'time_stop': 209, 'use_sma': False, 'use_atr': True, 'use_adx': True, 'use_ema': True, 'use_spike': False, 'rsi_required': True, 'edge_k': 0.006546669342920239, 'edge_cap': 0.5120639066265141, 'bull_strategy': 'mean_reversion', 'bull_bb_std_mult': 1.0410796798422186, 'bull_rsi_os': 29, 'bull_rsi_ob': 76, 'bull_adx_thresh': 20.593205438792587, 'bull_atr_min_pct': 0.002630635750047809, 'bull_atr_max_pct': 0.11873081192495312, 'bull_tp_mult': 2.704710460116429, 'bull_tsl_mult': 0.748957525142659, 'bull_time_stop': 80, 'bull_use_sma': True, 'bull_use_ema': True, 'bull_use_atr': True, 'bull_use_adx': False, 'bull_use_spike': False, 'bull_rsi_required': True, 'bear_strategy': 'breakout', 'bear_bb_std_mult': 2.541001642348541, 'bear_rsi_os': 24, 'bear_rsi_ob': 79, 'bear_adx_thresh': 13.45860222838138, 'bear_atr_min_pct': 0.016233776829448935, 'bear_atr_max_pct': 0.14405386846432927, 'bear_tp_mult': 1.617114836970392, 'bear_tsl_mult': 0.753672961877585, 'bear_time_stop': 210, 'bear_use_sma': False, 'bear_use_ema': True, 'bear_use_atr': False, 'bear_use_adx': True, 'bear_use_spike': False, 'bear_rsi_required': False, 'sideways_strategy': 'breakout', 'sideways_bb_std_mult': 3.1958921120891546, 'sideways_rsi_os': 5, 'sideways_rsi_ob': 60, 'sideways_adx_thresh': 21.417029414368397, 'sideways_atr_min_pct': 0.019052870052441634, 'sideways_atr_max_pct': 0.1477330708942956, 'sideways_tp_mult': 2.299946287308542, 'sideways_tsl_mult': 0.4741570050424384, 'sideways_time_stop': 128, 'sideways_use_sma': False, 'sideways_use_ema': True, 'sideways_use_atr': True, 'sideways_use_adx': False, 'sideways_use_spike': False, 'sideways_rsi_required': True}.
[I 2025-08-30 19:36:46,242] Trial 597 finished with values: [-1000000000.0, 1000000000.0] and parameters: {'p_sma': 53, 'p_std': 30, 'p_atr': 12, 'p_adx': 21, 'rsi_period': 19, 'ema1': 25, 'ema2': 31, 'slip_atr_k': 0.06743605822252582, 'slip_spread_k': 0.07741862763444834, 'spread_hl_frac': 0.03838845847229152, 'bb_std_mult': 2.030001568587439, 'rsi_os': 24, 'rsi_ob': 84, 'vol_spike': 0.2936052121033919, 'adx_thresh': 33.682550382100025, 'atr_min_pct': 0.022767417454210313, 'atr_max_pct': 0.019360569613793135, 'tp_mult': 2.2669836500814786, 'tsl_mult': 0.8438535813822712, 'strategy': 'breakout', 'time_stop': 120, 'use_sma': False, 'use_atr': True, 'use_adx': True, 'use_ema': False, 'use_spike': True, 'rsi_required': True, 'edge_k': 0.1500080519261952, 'edge_cap': 0.1910957589551578, 'bull_strategy': 'mean_reversion', 'bull_bb_std_mult': 0.5743755450447161, 'bull_rsi_os': 27, 'bull_rsi_ob': 47, 'bull_adx_thresh': 17.72796144061248, 'bull_atr_min_pct': 0.011030185472725957, 'bull_atr_max_pct': 0.1154492902797741, 'bull_tp_mult': 2.129148155079541, 'bull_tsl_mult': 0.7912189749708398, 'bull_time_stop': 200, 'bull_use_sma': False, 'bull_use_ema': False, 'bull_use_atr': True, 'bull_use_adx': False, 'bull_use_spike': False, 'bull_rsi_required': True, 'bear_strategy': 'breakout', 'bear_bb_std_mult': 2.9587242740832327, 'bear_rsi_os': 32, 'bear_rsi_ob': 46, 'bear_adx_thresh': 16.756429007076488, 'bear_atr_min_pct': 0.013725844919131258, 'bear_atr_max_pct': 0.0373253089465792, 'bear_tp_mult': 2.7878743907310466, 'bear_tsl_mult': 0.7686711196559434, 'bear_time_stop': 189, 'bear_use_sma': False, 'bear_use_ema': True, 'bear_use_atr': False, 'bear_use_adx': True, 'bear_use_spike': False, 'bear_rsi_required': False, 'sideways_strategy': 'breakout', 'sideways_bb_std_mult': 3.1508933422446774, 'sideways_rsi_os': 51, 'sideways_rsi_ob': 56, 'sideways_adx_thresh': 18.88520215404877, 'sideways_atr_min_pct': 0.020821822692947516, 'sideways_atr_max_pct': 0.04876127719575678, 'sideways_tp_mult': 2.505394702743216, 'sideways_tsl_mult': 0.9623975965657725, 'sideways_time_stop': 82, 'sideways_use_sma': True, 'sideways_use_ema': True, 'sideways_use_atr': False, 'sideways_use_adx': False, 'sideways_use_spike': False, 'sideways_rsi_required': True}.
[I 2025-08-30 19:37:08,391] Trial 595 finished with values: [-1000000000.0, 1000000000.0] and parameters: {'p_sma': 7, 'p_std': 42, 'p_atr': 9, 'p_adx': 21, 'rsi_period': 75, 'ema1': 21, 'ema2': 57, 'slip_atr_k': 0.24018437792594405, 'slip_spread_k': 0.13356315105077207, 'spread_hl_frac': 0.03809580235134178, 'bb_std_mult': 2.0256324727294412, 'rsi_os': 24, 'rsi_ob': 84, 'vol_spike': 0.2949883904970995, 'adx_thresh': 13.061418275744959, 'atr_min_pct': 0.02263403484196573, 'atr_max_pct': 0.09854936960510599, 'tp_mult': 2.247977900449968, 'tsl_mult': 0.7923940640485235, 'strategy': 'mean_reversion', 'time_stop': 137, 'use_sma': False, 'use_atr': False, 'use_adx': False, 'use_ema': False, 'use_spike': True, 'rsi_required': False, 'edge_k': 0.14899704261193614, 'edge_cap': 0.5997975133152771, 'bull_strategy': 'mean_reversion', 'bull_bb_std_mult': 1.6638996823359358, 'bull_rsi_os': 29, 'bull_rsi_ob': 46, 'bull_adx_thresh': 20.49977158123866, 'bull_atr_min_pct': 0.0025991139201270055, 'bull_atr_max_pct': 0.11853312975372958, 'bull_tp_mult': 2.2321652435893253, 'bull_tsl_mult': 0.21339621901179628, 'bull_time_stop': 64, 'bull_use_sma': False, 'bull_use_ema': True, 'bull_use_atr': True, 'bull_use_adx': False, 'bull_use_spike': True, 'bull_rsi_required': True, 'bear_strategy': 'mean_reversion', 'bear_bb_std_mult': 3.1255470540985146, 'bear_rsi_os': 43, 'bear_rsi_ob': 77, 'bear_adx_thresh': 17.3801663904776, 'bear_atr_min_pct': 0.013718557294316197, 'bear_atr_max_pct': 0.1429740200228051, 'bear_tp_mult': 2.786120261534157, 'bear_tsl_mult': 0.7636271605290313, 'bear_time_stop': 157, 'bear_use_sma': False, 'bear_use_ema': True, 'bear_use_atr': False, 'bear_use_adx': False, 'bear_use_spike': False, 'bear_rsi_required': False, 'sideways_strategy': 'breakout', 'sideways_bb_std_mult': 3.2361057642210924, 'sideways_rsi_os': 5, 'sideways_rsi_ob': 60, 'sideways_adx_thresh': 21.746670511295076, 'sideways_atr_min_pct': 0.01895603461221792, 'sideways_atr_max_pct': 0.14371514553073952, 'sideways_tp_mult': 2.5176711726076344, 'sideways_tsl_mult': 0.5969349546469852, 'sideways_time_stop': 157, 'sideways_use_sma': True, 'sideways_use_ema': True, 'sideways_use_atr': True, 'sideways_use_adx': False, 'sideways_use_spike': False, 'sideways_rsi_required': True}.
[I 2025-08-30 19:37:09,820] Trial 596 finished with values: [-1000000000.0, 1000000000.0] and parameters: {'p_sma': 6, 'p_std': 30, 'p_atr': 8, 'p_adx': 21, 'rsi_period': 18, 'ema1': 12, 'ema2': 58, 'slip_atr_k': 0.07515382985749146, 'slip_spread_k': 0.1338371485508611, 'spread_hl_frac': 0.02113827567130368, 'bb_std_mult': 2.0294227897392028, 'rsi_os': 49, 'rsi_ob': 84, 'vol_spike': 0.29342997059927883, 'adx_thresh': 13.040991854416212, 'atr_min_pct': 0.005728405926553687, 'atr_max_pct': 0.09859634021754121, 'tp_mult': 2.904350555068578, 'tsl_mult': 0.8507395984493603, 'strategy': 'breakout', 'time_stop': 136, 'use_sma': False, 'use_atr': True, 'use_adx': True, 'use_ema': False, 'use_spike': True, 'rsi_required': True, 'edge_k': 0.15139212642672673, 'edge_cap': 0.19012830098815586, 'bull_strategy': 'mean_reversion', 'bull_bb_std_mult': 3.0612362718327013, 'bull_rsi_os': 52, 'bull_rsi_ob': 48, 'bull_adx_thresh': 17.49724112555314, 'bull_atr_min_pct': 0.020966952990985107, 'bull_atr_max_pct': 0.11463927199233025, 'bull_tp_mult': 1.0425185949826945, 'bull_tsl_mult': 0.4966066371890487, 'bull_time_stop': 294, 'bull_use_sma': False, 'bull_use_ema': True, 'bull_use_atr': False, 'bull_use_adx': False, 'bull_use_spike': False, 'bull_rsi_required': True, 'bear_strategy': 'breakout', 'bear_bb_std_mult': 2.9242859081622634, 'bear_rsi_os': 50, 'bear_rsi_ob': 79, 'bear_adx_thresh': 16.632842494219616, 'bear_atr_min_pct': 0.014798073321864981, 'bear_atr_max_pct': 0.03803429077047915, 'bear_tp_mult': 2.020904262168495, 'bear_tsl_mult': 0.767041487995436, 'bear_time_stop': 158, 'bear_use_sma': False, 'bear_use_ema': True, 'bear_use_atr': False, 'bear_use_adx': True, 'bear_use_spike': False, 'bear_rsi_required': True, 'sideways_strategy': 'breakout', 'sideways_bb_std_mult': 3.1735440916481523, 'sideways_rsi_os': 34, 'sideways_rsi_ob': 60, 'sideways_adx_thresh': 29.520752479923807, 'sideways_atr_min_pct': 0.002284718379576396, 'sideways_atr_max_pct': 0.08187044126807425, 'sideways_tp_mult': 1.9986883230442354, 'sideways_tsl_mult': 0.1497761111125695, 'sideways_time_stop': 85, 'sideways_use_sma': True, 'sideways_use_ema': True, 'sideways_use_atr': False, 'sideways_use_adx': False, 'sideways_use_spike': False, 'sideways_rsi_required': True}.
[I 2025-08-30 19:37:20,594] Trial 598 finished with values: [-1000000000.0, 1000000000.0] and parameters: {'p_sma': 7, 'p_std': 26, 'p_atr': 9, 'p_adx': 20, 'rsi_period': 19, 'ema1': 11, 'ema2': 31, 'slip_atr_k': 0.2442489939659565, 'slip_spread_k': 0.9050427603181432, 'spread_hl_frac': 0.021930296403322017, 'bb_std_mult': 3.5087234433461916, 'rsi_os': 24, 'rsi_ob': 93, 'vol_spike': 0.2947309953227981, 'adx_thresh': 33.75826778530636, 'atr_min_pct': 0.022590185676860487, 'atr_max_pct': 0.08984412497424726, 'tp_mult': 2.8199456952331747, 'tsl_mult': 0.8442080007849034, 'strategy': 'mean_reversion', 'time_stop': 102, 'use_sma': True, 'use_atr': False, 'use_adx': False, 'use_ema': False, 'use_spike': True, 'rsi_required': False, 'edge_k': 0.1451853435341011, 'edge_cap': 0.9320603758711624, 'bull_strategy': 'mean_reversion', 'bull_bb_std_mult': 3.0728017901051023, 'bull_rsi_os': 51, 'bull_rsi_ob': 57, 'bull_adx_thresh': 28.703997014670065, 'bull_atr_min_pct': 0.0020505050897331274, 'bull_atr_max_pct': 0.13804352233625092, 'bull_tp_mult': 2.8006076740081087, 'bull_tsl_mult': 0.9560400513359324, 'bull_time_stop': 64, 'bull_use_sma': False, 'bull_use_ema': False, 'bull_use_atr': True, 'bull_use_adx': False, 'bull_use_spike': True, 'bull_rsi_required': True, 'bear_strategy': 'mean_reversion', 'bear_bb_std_mult': 2.9706148543356843, 'bear_rsi_os': 22, 'bear_rsi_ob': 76, 'bear_adx_thresh': 16.893140517649606, 'bear_atr_min_pct': 0.014724249750151821, 'bear_atr_max_pct': 0.04513573318101573, 'bear_tp_mult': 2.788057167370413, 'bear_tsl_mult': 0.7696169417116562, 'bear_time_stop': 71, 'bear_use_sma': True, 'bear_use_ema': True, 'bear_use_atr': True, 'bear_use_adx': False, 'bear_use_spike': False, 'bear_rsi_required': True, 'sideways_strategy': 'breakout', 'sideways_bb_std_mult': 3.1304242052926563, 'sideways_rsi_os': 34, 'sideways_rsi_ob': 57, 'sideways_adx_thresh': 18.754999195616517, 'sideways_atr_min_pct': 0.0072831798553179596, 'sideways_atr_max_pct': 0.09211203195988961, 'sideways_tp_mult': 1.096607198472101, 'sideways_tsl_mult': 0.9524050561402397, 'sideways_time_stop': 84, 'sideways_use_sma': True, 'sideways_use_ema': True, 'sideways_use_atr': False, 'sideways_use_adx': False, 'sideways_use_spike': False, 'sideways_rsi_required': True}.
[I 2025-08-30 19:37:21,232] Trial 599 finished with values: [-1000000000.0, 1000000000.0] and parameters: {'p_sma': 19, 'p_std': 34, 'p_atr': 9, 'p_adx': 21, 'rsi_period': 28, 'ema1': 9, 'ema2': 34, 'slip_atr_k': 0.08126667862833109, 'slip_spread_k': 0.12779526071940792, 'spread_hl_frac': 0.017872874740673134, 'bb_std_mult': 2.221798341283705, 'rsi_os': 35, 'rsi_ob': 82, 'vol_spike': 0.2621410499690297, 'adx_thresh': 33.9045821829014, 'atr_min_pct': 0.0028917610702197845, 'atr_max_pct': 0.14639785087840806, 'tp_mult': 2.8353969630096536, 'tsl_mult': 0.7295656085227038, 'strategy': 'mean_reversion', 'time_stop': 80, 'use_sma': True, 'use_atr': False, 'use_adx': False, 'use_ema': False, 'use_spike': True, 'rsi_required': False, 'edge_k': 0.06209907611989009, 'edge_cap': 0.4870501117210819, 'bull_strategy': 'mean_reversion', 'bull_bb_std_mult': 3.045063068443197, 'bull_rsi_os': 33, 'bull_rsi_ob': 50, 'bull_adx_thresh': 17.528690593380365, 'bull_atr_min_pct': 0.029626256103737036, 'bull_atr_max_pct': 0.11315061243404116, 'bull_tp_mult': 1.0611846447705569, 'bull_tsl_mult': 0.4980688604398177, 'bull_time_stop': 177, 'bull_use_sma': False, 'bull_use_ema': True, 'bull_use_atr': True, 'bull_use_adx': False, 'bull_use_spike': True, 'bull_rsi_required': True, 'bear_strategy': 'mean_reversion', 'bear_bb_std_mult': 1.0124872037973254, 'bear_rsi_os': 5, 'bear_rsi_ob': 49, 'bear_adx_thresh': 19.032255667998424, 'bear_atr_min_pct': 0.014743351529081149, 'bear_atr_max_pct': 0.06907479220508217, 'bear_tp_mult': 2.8496719678439715, 'bear_tsl_mult': 0.7694797827069849, 'bear_time_stop': 68, 'bear_use_sma': True, 'bear_use_ema': True, 'bear_use_atr': True, 'bear_use_adx': False, 'bear_use_spike': True, 'bear_rsi_required': True, 'sideways_strategy': 'breakout', 'sideways_bb_std_mult': 1.9141246211411451, 'sideways_rsi_os': 34, 'sideways_rsi_ob': 58, 'sideways_adx_thresh': 20.229567761617037, 'sideways_atr_min_pct': 0.004227550587074837, 'sideways_atr_max_pct': 0.016920151925038485, 'sideways_tp_mult': 2.150295833092815, 'sideways_tsl_mult': 0.8278461757600994, 'sideways_time_stop': 145, 'sideways_use_sma': True, 'sideways_use_ema': False, 'sideways_use_atr': True, 'sideways_use_adx': False, 'sideways_use_spike': False, 'sideways_rsi_required': True}.
[I 2025-08-30 19:37:52,552] Trial 600 finished with values: [-1000000000.0, 1000000000.0] and parameters: {'p_sma': 9, 'p_std': 46, 'p_atr': 9, 'p_adx': 20, 'rsi_period': 33, 'ema1': 26, 'ema2': 34, 'slip_atr_k': 0.12622759747420903, 'slip_spread_k': 0.1774443414659425, 'spread_hl_frac': 0.02196257884391876, 'bb_std_mult': 2.2275872695118597, 'rsi_os': 35, 'rsi_ob': 83, 'vol_spike': 0.2615423078730781, 'adx_thresh': 31.161063375027208, 'atr_min_pct': 0.02363196921447369, 'atr_max_pct': 0.09142799052827995, 'tp_mult': 2.3281987535904745, 'tsl_mult': 0.8111886591956539, 'strategy': 'mean_reversion', 'time_stop': 183, 'use_sma': True, 'use_atr': True, 'use_adx': True, 'use_ema': False, 'use_spike': True, 'rsi_required': False, 'edge_k': 0.05914731235874529, 'edge_cap': 0.5643472460100135, 'bull_strategy': 'mean_reversion', 'bull_bb_std_mult': 3.047431630591001, 'bull_rsi_os': 41, 'bull_rsi_ob': 50, 'bull_adx_thresh': 28.095475077098886, 'bull_atr_min_pct': 0.003165260632636253, 'bull_atr_max_pct': 0.1125104026162687, 'bull_tp_mult': 1.4195527005937607, 'bull_tsl_mult': 0.48973620622964015, 'bull_time_stop': 176, 'bull_use_sma': False, 'bull_use_ema': False, 'bull_use_atr': False, 'bull_use_adx': False, 'bull_use_spike': False, 'bull_rsi_required': True, 'bear_strategy': 'breakout', 'bear_bb_std_mult': 2.373284234412872, 'bear_rsi_os': 28, 'bear_rsi_ob': 76, 'bear_adx_thresh': 19.046935139547532, 'bear_atr_min_pct': 0.014736917645951468, 'bear_atr_max_pct': 0.04505395714283659, 'bear_tp_mult': 2.0309874913604777, 'bear_tsl_mult': 0.7505252918676009, 'bear_time_stop': 260, 'bear_use_sma': True, 'bear_use_ema': True, 'bear_use_atr': True, 'bear_use_adx': False, 'bear_use_spike': True, 'bear_rsi_required': True, 'sideways_strategy': 'breakout', 'sideways_bb_std_mult': 1.6926155488079604, 'sideways_rsi_os': 34, 'sideways_rsi_ob': 58, 'sideways_adx_thresh': 20.41171780759425, 'sideways_atr_min_pct': 0.00845811595405832, 'sideways_atr_max_pct': 0.08254385991557169, 'sideways_tp_mult': 1.1056309728115974, 'sideways_tsl_mult': 0.15666426285414975, 'sideways_time_stop': 47, 'sideways_use_sma': False, 'sideways_use_ema': False, 'sideways_use_atr': False, 'sideways_use_adx': False, 'sideways_use_spike': True, 'sideways_rsi_required': True}.
[I 2025-08-30 19:37:52,853] Trial 601 finished with values: [-0.04152068923264629, 0.041417116957331676] and parameters: {'p_sma': 25, 'p_std': 34, 'p_atr': 9, 'p_adx': 20, 'rsi_period': 52, 'ema1': 26, 'ema2': 18, 'slip_atr_k': 0.05071860387827418, 'slip_spread_k': 0.5339843677978174, 'spread_hl_frac': 0.015191134255001428, 'bb_std_mult': 2.2046750286464425, 'rsi_os': 39, 'rsi_ob': 82, 'vol_spike': 0.2624093908127724, 'adx_thresh': 22.487427143925323, 'atr_min_pct': 0.02355673169734424, 'atr_max_pct': 0.1495667656197564, 'tp_mult': 2.3425243908754636, 'tsl_mult': 0.8065825243677589, 'strategy': 'mean_reversion', 'time_stop': 85, 'use_sma': True, 'use_atr': True, 'use_adx': False, 'use_ema': False, 'use_spike': True, 'rsi_required': False, 'edge_k': 0.7884562789021131, 'edge_cap': 0.4865499646315804, 'bull_strategy': 'mean_reversion', 'bull_bb_std_mult': 3.306479932919518, 'bull_rsi_os': 41, 'bull_rsi_ob': 50, 'bull_adx_thresh': 18.16076323704375, 'bull_atr_min_pct': 0.0034286882394744364, 'bull_atr_max_pct': 0.12293361101119446, 'bull_tp_mult': 2.780588704133643, 'bull_tsl_mult': 0.572389195943007, 'bull_time_stop': 176, 'bull_use_sma': False, 'bull_use_ema': False, 'bull_use_atr': True, 'bull_use_adx': False, 'bull_use_spike': False, 'bull_rsi_required': True, 'bear_strategy': 'mean_reversion', 'bear_bb_std_mult': 1.0106302112840553, 'bear_rsi_os': 52, 'bear_rsi_ob': 74, 'bear_adx_thresh': 18.935562097232022, 'bear_atr_min_pct': 0.009624854315246888, 'bear_atr_max_pct': 0.03263137509912249, 'bear_tp_mult': 2.335030654309808, 'bear_tsl_mult': 0.7808949881277623, 'bear_time_stop': 198, 'bear_use_sma': True, 'bear_use_ema': True, 'bear_use_atr': True, 'bear_use_adx': False, 'bear_use_spike': True, 'bear_rsi_required': True, 'sideways_strategy': 'mean_reversion', 'sideways_bb_std_mult': 2.780091391962494, 'sideways_rsi_os': 39, 'sideways_rsi_ob': 58, 'sideways_adx_thresh': 19.45246464100104, 'sideways_atr_min_pct': 0.0016183361399420594, 'sideways_atr_max_pct': 0.1478864306392621, 'sideways_tp_mult': 1.1095211528488946, 'sideways_tsl_mult': 0.9460058021371512, 'sideways_time_stop': 144, 'sideways_use_sma': False, 'sideways_use_ema': False, 'sideways_use_atr': True, 'sideways_use_adx': True, 'sideways_use_spike': True, 'sideways_rsi_required': True}.
[I 2025-08-30 19:37:55,670] Trial 602 finished with values: [-1000000000.0, 1000000000.0] and parameters: {'p_sma': 9, 'p_std': 33, 'p_atr': 16, 'p_adx': 20, 'rsi_period': 51, 'ema1': 26, 'ema2': 19, 'slip_atr_k': 0.24950765608140263, 'slip_spread_k': 0.17108791870491905, 'spread_hl_frac': 0.024310064636019844, 'bb_std_mult': 2.214033246719845, 'rsi_os': 35, 'rsi_ob': 52, 'vol_spike': 0.2610373884373399, 'adx_thresh': 34.36736204709053, 'atr_min_pct': 0.003004575116122234, 'atr_max_pct': 0.05453202183787801, 'tp_mult': 2.3348980137899193, 'tsl_mult': 0.8208976496901181, 'strategy': 'mean_reversion', 'time_stop': 83, 'use_sma': True, 'use_atr': True, 'use_adx': True, 'use_ema': False, 'use_spike': True, 'rsi_required': False, 'edge_k': 0.05305928666229637, 'edge_cap': 0.5671565727863561, 'bull_strategy': 'breakout', 'bull_bb_std_mult': 2.0322695196318326, 'bull_rsi_os': 33, 'bull_rsi_ob': 62, 'bull_adx_thresh': 18.09102736582861, 'bull_atr_min_pct': 0.003637776212237173, 'bull_atr_max_pct': 0.12178020584424731, 'bull_tp_mult': 2.770039679843377, 'bull_tsl_mult': 0.569830492061691, 'bull_time_stop': 176, 'bull_use_sma': False, 'bull_use_ema': True, 'bull_use_atr': True, 'bull_use_adx': False, 'bull_use_spike': False, 'bull_rsi_required': True, 'bear_strategy': 'breakout', 'bear_bb_std_mult': 2.774320532792559, 'bear_rsi_os': 51, 'bear_rsi_ob': 74, 'bear_adx_thresh': 18.87420277926185, 'bear_atr_min_pct': 0.024088341947427955, 'bear_atr_max_pct': 0.11279547234098358, 'bear_tp_mult': 2.7407417013474755, 'bear_tsl_mult': 0.7467893412253944, 'bear_time_stop': 264, 'bear_use_sma': True, 'bear_use_ema': True, 'bear_use_atr': True, 'bear_use_adx': False, 'bear_use_spike': True, 'bear_rsi_required': True, 'sideways_strategy': 'mean_reversion', 'sideways_bb_std_mult': 2.470734349730802, 'sideways_rsi_os': 39, 'sideways_rsi_ob': 58, 'sideways_adx_thresh': 19.68629623807651, 'sideways_atr_min_pct': 0.02356117001376509, 'sideways_atr_max_pct': 0.01992580213153681, 'sideways_tp_mult': 2.143345396410328, 'sideways_tsl_mult': 0.0023110930012583686, 'sideways_time_stop': 145, 'sideways_use_sma': False, 'sideways_use_ema': False, 'sideways_use_atr': True, 'sideways_use_adx': True, 'sideways_use_spike': True, 'sideways_rsi_required': True}.
