[I 2025-08-30 18:53:43,987] Trial 216 finished with values: [-0.08079780234177414, 0.08077428761057173] and parameters: {'p_sma': 47, 'p_std': 32, 'p_atr': 12, 'p_adx': 20, 'rsi_period': 11, 'ema1': 29, 'ema2': 34, 'slip_atr_k': 0.17720391400741217, 'slip_spread_k': 0.11315758260569558, 'spread_hl_frac': 0.023560725529808674, 'bb_std_mult': 2.1883834861327713, 'rsi_os': 49, 'rsi_ob': 66, 'vol_spike': 0.2637432723755875, 'adx_thresh': 34.481142322924086, 'atr_min_pct': 0.023457018634163895, 'atr_max_pct': 0.04407131406833934, 'tp_mult': 2.7603806061186607, 'tsl_mult': 0.6994197141749765, 'strategy': 'mean_reversion', 'time_stop': 112, 'use_sma': False, 'use_atr': True, 'use_adx': True, 'use_ema': False, 'use_spike': True, 'rsi_required': False, 'edge_k': 1.376935036847258, 'edge_cap': 0.5362606152376246, 'bull_strategy': 'mean_reversion', 'bull_bb_std_mult': 2.6733756738241836, 'bull_rsi_os': 13, 'bull_rsi_ob': 46, 'bull_adx_thresh': 18.85412618596778, 'bull_atr_min_pct': 0.0032039137975439147, 'bull_atr_max_pct': 0.05837992452192553, 'bull_tp_mult': 1.4640256663764228, 'bull_tsl_mult': 0.7415018020650221, 'bull_time_stop': 177, 'bull_use_sma': True, 'bull_use_ema': True, 'bull_use_atr': True, 'bull_use_adx': False, 'bull_use_spike': False, 'bull_rsi_required': True, 'bear_strategy': 'mean_reversion', 'bear_bb_std_mult': 3.0980276427085096, 'bear_rsi_os': 37, 'bear_rsi_ob': 82, 'bear_adx_thresh': 16.91389725485278, 'bear_atr_min_pct': 0.028485847984785508, 'bear_atr_max_pct': 0.06611696929582074, 'bear_tp_mult': 1.9355753552377568, 'bear_tsl_mult': 0.713189926753121, 'bear_time_stop': 36, 'bear_use_sma': True, 'bear_use_ema': True, 'bear_use_atr': False, 'bear_use_adx': False, 'bear_use_spike': True, 'bear_rsi_required': True, 'sideways_strategy': 'mean_reversion', 'sideways_bb_std_mult': 3.0595570290967995, 'sideways_rsi_os': 6, 'sideways_rsi_ob': 60, 'sideways_adx_thresh': 8.351707723281473, 'sideways_atr_min_pct': 0.0015450894347728763, 'sideways_atr_max_pct': 0.1499598220680695, 'sideways_tp_mult': 1.7750162164070906, 'sideways_tsl_mult': 0.9790317695628136, 'sideways_time_stop': 159, 'sideways_use_sma': False, 'sideways_use_ema': False, 'sideways_use_atr': True, 'sideways_use_adx': True, 'sideways_use_spike': False, 'sideways_rsi_required': True}.
[I 2025-08-30 18:53:44,513] Trial 218 finished with values: [-1000000000.0, 1000000000.0] and parameters: {'p_sma': 31, 'p_std': 32, 'p_atr': 16, 'p_adx': 20, 'rsi_period': 24, 'ema1': 6, 'ema2': 48, 'slip_atr_k': 0.19715580180738024, 'slip_spread_k': 0.7850770449917865, 'spread_hl_frac': 0.023821083405163205, 'bb_std_mult': 1.2760390843966003, 'rsi_os': 48, 'rsi_ob': 82, 'vol_spike': 0.2619699988091091, 'adx_thresh': 19.16106859873927, 'atr_min_pct': 0.021562722467693834, 'atr_max_pct': 0.0985194319376351, 'tp_mult': 2.271650039126391, 'tsl_mult': 0.5693129029687981, 'strategy': 'mean_reversion', 'time_stop': 284, 'use_sma': True, 'use_atr': False, 'use_adx': True, 'use_ema': True, 'use_spike': False, 'rsi_required': True, 'edge_k': 1.4754461799972372, 'edge_cap': 0.547856632354781, 'bull_strategy': 'mean_reversion', 'bull_bb_std_mult': 1.2927737674735909, 'bull_rsi_os': 14, 'bull_rsi_ob': 46, 'bull_adx_thresh': 19.29060831729662, 'bull_atr_min_pct': 0.021032220980901184, 'bull_atr_max_pct': 0.1260241382600997, 'bull_tp_mult': 2.6311606327112975, 'bull_tsl_mult': 0.4982440701536395, 'bull_time_stop': 171, 'bull_use_sma': True, 'bull_use_ema': True, 'bull_use_atr': True, 'bull_use_adx': False, 'bull_use_spike': False, 'bull_rsi_required': True, 'bear_strategy': 'mean_reversion', 'bear_bb_std_mult': 3.1003564158465173, 'bear_rsi_os': 32, 'bear_rsi_ob': 71, 'bear_adx_thresh': 5.196412879591932, 'bear_atr_min_pct': 0.015074613918599216, 'bear_atr_max_pct': 0.06585236559021299, 'bear_tp_mult': 2.7679749129347986, 'bear_tsl_mult': 0.8528933929031981, 'bear_time_stop': 188, 'bear_use_sma': False, 'bear_use_ema': True, 'bear_use_atr': False, 'bear_use_adx': False, 'bear_use_spike': True, 'bear_rsi_required': False, 'sideways_strategy': 'mean_reversion', 'sideways_bb_std_mult': 0.9441409882948981, 'sideways_rsi_os': 52, 'sideways_rsi_ob': 60, 'sideways_adx_thresh': 20.817927503754404, 'sideways_atr_min_pct': 0.008850684065753716, 'sideways_atr_max_pct': 0.0763693471622139, 'sideways_tp_mult': 1.0772467528613872, 'sideways_tsl_mult': 0.9731373015483047, 'sideways_time_stop': 211, 'sideways_use_sma': True, 'sideways_use_ema': False, 'sideways_use_atr': False, 'sideways_use_adx': True, 'sideways_use_spike': False, 'sideways_rsi_required': True}.
[I 2025-08-30 18:53:44,593] Trial 217 finished with values: [-1000000000.0, 1000000000.0] and parameters: {'p_sma': 5, 'p_std': 58, 'p_atr': 12, 'p_adx': 14, 'rsi_period': 23, 'ema1': 29, 'ema2': 34, 'slip_atr_k': 0.17583966596051423, 'slip_spread_k': 0.7761400070294855, 'spread_hl_frac': 0.023450015558627316, 'bb_std_mult': 3.34788931292291, 'rsi_os': 28, 'rsi_ob': 67, 'vol_spike': 0.11764322225904542, 'adx_thresh': 25.492480077066983, 'atr_min_pct': 0.02227170080538795, 'atr_max_pct': 0.09162417317386859, 'tp_mult': 1.0596207808541764, 'tsl_mult': 0.7904168005045495, 'strategy': 'mean_reversion', 'time_stop': 244, 'use_sma': True, 'use_atr': True, 'use_adx': True, 'use_ema': True, 'use_spike': True, 'rsi_required': True, 'edge_k': 0.1282293419708287, 'edge_cap': 0.2667291741958387, 'bull_strategy': 'mean_reversion', 'bull_bb_std_mult': 1.283164987046777, 'bull_rsi_os': 29, 'bull_rsi_ob': 80, 'bull_adx_thresh': 19.178337778492963, 'bull_atr_min_pct': 0.003310361451070343, 'bull_atr_max_pct': 0.12549513120270295, 'bull_tp_mult': 2.02074669830332, 'bull_tsl_mult': 0.7398640910369003, 'bull_time_stop': 168, 'bull_use_sma': True, 'bull_use_ema': True, 'bull_use_atr': True, 'bull_use_adx': False, 'bull_use_spike': False, 'bull_rsi_required': True, 'bear_strategy': 'breakout', 'bear_bb_std_mult': 2.927920542149144, 'bear_rsi_os': 19, 'bear_rsi_ob': 81, 'bear_adx_thresh': 18.896775971359126, 'bear_atr_min_pct': 0.025984059674105463, 'bear_atr_max_pct': 0.10288093935714905, 'bear_tp_mult': 2.332045890440822, 'bear_tsl_mult': 0.5500997510918259, 'bear_time_stop': 203, 'bear_use_sma': False, 'bear_use_ema': True, 'bear_use_atr': False, 'bear_use_adx': False, 'bear_use_spike': True, 'bear_rsi_required': True, 'sideways_strategy': 'mean_reversion', 'sideways_bb_std_mult': 2.7549502386230054, 'sideways_rsi_os': 36, 'sideways_rsi_ob': 74, 'sideways_adx_thresh': 20.714475276721792, 'sideways_atr_min_pct': 0.001663888583141997, 'sideways_atr_max_pct': 0.14941065023549432, 'sideways_tp_mult': 1.1799995168957813, 'sideways_tsl_mult': 0.059061529871901886, 'sideways_time_stop': 151, 'sideways_use_sma': False, 'sideways_use_ema': False, 'sideways_use_atr': False, 'sideways_use_adx': True, 'sideways_use_spike': False, 'sideways_rsi_required': True}.
[I 2025-08-30 18:54:16,471] Trial 219 finished with values: [-1000000000.0, 1000000000.0] and parameters: {'p_sma': 20, 'p_std': 58, 'p_atr': 23, 'p_adx': 20, 'rsi_period': 24, 'ema1': 22, 'ema2': 32, 'slip_atr_k': 0.08497993045181773, 'slip_spread_k': 0.9603444334606139, 'spread_hl_frac': 0.023380323542409116, 'bb_std_mult': 2.799904901960506, 'rsi_os': 47, 'rsi_ob': 82, 'vol_spike': 0.2515964971790881, 'adx_thresh': 34.334647516724914, 'atr_min_pct': 0.023825909364296502, 'atr_max_pct': 0.044205007339945875, 'tp_mult': 2.287403225051176, 'tsl_mult': 0.6853659155143456, 'strategy': 'mean_reversion', 'time_stop': 244, 'use_sma': True, 'use_atr': False, 'use_adx': True, 'use_ema': True, 'use_spike': False, 'rsi_required': True, 'edge_k': 1.384213135226788, 'edge_cap': 0.5547878212569535, 'bull_strategy': 'breakout', 'bull_bb_std_mult': 3.0784231200354686, 'bull_rsi_os': 31, 'bull_rsi_ob': 85, 'bull_adx_thresh': 6.908310227141044, 'bull_atr_min_pct': 0.0010580479183845506, 'bull_atr_max_pct': 0.056971719913693715, 'bull_tp_mult': 2.3398138187724675, 'bull_tsl_mult': 0.49994953325671165, 'bull_time_stop': 131, 'bull_use_sma': True, 'bull_use_ema': True, 'bull_use_atr': False, 'bull_use_adx': False, 'bull_use_spike': True, 'bull_rsi_required': True, 'bear_strategy': 'breakout', 'bear_bb_std_mult': 0.9871554513368395, 'bear_rsi_os': 28, 'bear_rsi_ob': 71, 'bear_adx_thresh': 18.67268479769904, 'bear_atr_min_pct': 0.014712185876561062, 'bear_atr_max_pct': 0.06617781672625356, 'bear_tp_mult': 1.6093276622008363, 'bear_tsl_mult': 0.8404515920655259, 'bear_time_stop': 47, 'bear_use_sma': False, 'bear_use_ema': True, 'bear_use_atr': True, 'bear_use_adx': False, 'bear_use_spike': True, 'bear_rsi_required': False, 'sideways_strategy': 'mean_reversion', 'sideways_bb_std_mult': 3.0707529778624303, 'sideways_rsi_os': 36, 'sideways_rsi_ob': 47, 'sideways_adx_thresh': 21.593545016039503, 'sideways_atr_min_pct': 0.0148643216495309, 'sideways_atr_max_pct': 0.018039275762745922, 'sideways_tp_mult': 1.0754504209114082, 'sideways_tsl_mult': 0.06175761482349479, 'sideways_time_stop': 191, 'sideways_use_sma': True, 'sideways_use_ema': False, 'sideways_use_atr': False, 'sideways_use_adx': True, 'sideways_use_spike': False, 'sideways_rsi_required': True}.
[I 2025-08-30 18:54:17,239] Trial 220 finished with values: [-0.031662170611453044, 0.03178150477257612] and parameters: {'p_sma': 31, 'p_std': 15, 'p_atr': 8, 'p_adx': 27, 'rsi_period': 24, 'ema1': 22, 'ema2': 38, 'slip_atr_k': 0.1974715641203572, 'slip_spread_k': 0.2104297341316194, 'spread_hl_frac': 0.023205819045407364, 'bb_std_mult': 3.3105102070416965, 'rsi_os': 14, 'rsi_ob': 82, 'vol_spike': 0.25080093666343883, 'adx_thresh': 18.91244195684854, 'atr_min_pct': 0.020558289667868018, 'atr_max_pct': 0.09719702109899082, 'tp_mult': 2.275090186347581, 'tsl_mult': 0.7898388861958129, 'strategy': 'breakout', 'time_stop': 124, 'use_sma': True, 'use_atr': False, 'use_adx': True, 'use_ema': True, 'use_spike': False, 'rsi_required': True, 'edge_k': 1.3311069026152194, 'edge_cap': 0.706738869443755, 'bull_strategy': 'breakout', 'bull_bb_std_mult': 0.8918205089503544, 'bull_rsi_os': 22, 'bull_rsi_ob': 48, 'bull_adx_thresh': 17.401985924396527, 'bull_atr_min_pct': 0.0010790036358002933, 'bull_atr_max_pct': 0.0734632500272841, 'bull_tp_mult': 2.6448249163392825, 'bull_tsl_mult': 0.9051874799008979, 'bull_time_stop': 168, 'bull_use_sma': False, 'bull_use_ema': False, 'bull_use_atr': False, 'bull_use_adx': True, 'bull_use_spike': True, 'bull_rsi_required': False, 'bear_strategy': 'breakout', 'bear_bb_std_mult': 0.9449265372129669, 'bear_rsi_os': 53, 'bear_rsi_ob': 69, 'bear_adx_thresh': 5.0661939916232654, 'bear_atr_min_pct': 0.01729381227126573, 'bear_atr_max_pct': 0.10554163145873195, 'bear_tp_mult': 2.696521964600194, 'bear_tsl_mult': 0.6768982072630518, 'bear_time_stop': 202, 'bear_use_sma': False, 'bear_use_ema': True, 'bear_use_atr': True, 'bear_use_adx': True, 'bear_use_spike': False, 'bear_rsi_required': False, 'sideways_strategy': 'breakout', 'sideways_bb_std_mult': 3.401907356074012, 'sideways_rsi_os': 36, 'sideways_rsi_ob': 57, 'sideways_adx_thresh': 18.536636071624862, 'sideways_atr_min_pct': 0.014563112632267764, 'sideways_atr_max_pct': 0.14420769976041956, 'sideways_tp_mult': 1.062024039232293, 'sideways_tsl_mult': 0.9692627748868938, 'sideways_time_stop': 300, 'sideways_use_sma': True, 'sideways_use_ema': True, 'sideways_use_atr': False, 'sideways_use_adx': True, 'sideways_use_spike': False, 'sideways_rsi_required': True}.
[I 2025-08-30 18:54:17,369] Trial 221 finished with values: [-0.025467290043187152, 0.025707473329704827] and parameters: {'p_sma': 10, 'p_std': 22, 'p_atr': 8, 'p_adx': 27, 'rsi_period': 22, 'ema1': 7, 'ema2': 15, 'slip_atr_k': 0.08563554672082006, 'slip_spread_k': 0.14461805459223934, 'spread_hl_frac': 0.008000864376305664, 'bb_std_mult': 3.3078661855211307, 'rsi_os': 28, 'rsi_ob': 83, 'vol_spike': 0.25000851762318593, 'adx_thresh': 5.75710201940554, 'atr_min_pct': 0.023768854048728465, 'atr_max_pct': 0.0937936325792631, 'tp_mult': 2.927902727731853, 'tsl_mult': 0.5195523203410966, 'strategy': 'breakout', 'time_stop': 242, 'use_sma': True, 'use_atr': True, 'use_adx': True, 'use_ema': True, 'use_spike': True, 'rsi_required': True, 'edge_k': 0.13002806147576618, 'edge_cap': 0.23053627876055233, 'bull_strategy': 'breakout', 'bull_bb_std_mult': 3.0777107658703415, 'bull_rsi_os': 33, 'bull_rsi_ob': 85, 'bull_adx_thresh': 17.186179584926805, 'bull_atr_min_pct': 0.001068685959793269, 'bull_atr_max_pct': 0.12121939616781788, 'bull_tp_mult': 1.5153899871972962, 'bull_tsl_mult': 0.45911299063825856, 'bull_time_stop': 86, 'bull_use_sma': False, 'bull_use_ema': False, 'bull_use_atr': False, 'bull_use_adx': True, 'bull_use_spike': True, 'bull_rsi_required': False, 'bear_strategy': 'breakout', 'bear_bb_std_mult': 1.0703081957739058, 'bear_rsi_os': 19, 'bear_rsi_ob': 69, 'bear_adx_thresh': 18.75600613179774, 'bear_atr_min_pct': 0.02502196133414563, 'bear_atr_max_pct': 0.03505871012906613, 'bear_tp_mult': 2.7018576115762793, 'bear_tsl_mult': 0.9467666792688942, 'bear_time_stop': 202, 'bear_use_sma': False, 'bear_use_ema': True, 'bear_use_atr': True, 'bear_use_adx': True, 'bear_use_spike': False, 'bear_rsi_required': True, 'sideways_strategy': 'breakout', 'sideways_bb_std_mult': 3.421499181347863, 'sideways_rsi_os': 36, 'sideways_rsi_ob': 48, 'sideways_adx_thresh': 15.79395629082237, 'sideways_atr_min_pct': 0.003610820388594947, 'sideways_atr_max_pct': 0.14407674235360235, 'sideways_tp_mult': 1.1556457753158602, 'sideways_tsl_mult': 0.32926303198489404, 'sideways_time_stop': 150, 'sideways_use_sma': False, 'sideways_use_ema': True, 'sideways_use_atr': False, 'sideways_use_adx': False, 'sideways_use_spike': False, 'sideways_rsi_required': True}.
[I 2025-08-30 18:54:17,490] Trial 222 finished with values: [-0.025220519114311002, 0.025653548560686513] and parameters: {'p_sma': 51, 'p_std': 18, 'p_atr': 9, 'p_adx': 17, 'rsi_period': 21, 'ema1': 23, 'ema2': 38, 'slip_atr_k': 0.08617571496130626, 'slip_spread_k': 0.42226583199074463, 'spread_hl_frac': 0.027789173717248934, 'bb_std_mult': 1.0020663880648648, 'rsi_os': 47, 'rsi_ob': 59, 'vol_spike': 0.2526974540649348, 'adx_thresh': 24.443378854724106, 'atr_min_pct': 0.023696266458751634, 'atr_max_pct': 0.1408590292421779, 'tp_mult': 2.2047054533981973, 'tsl_mult': 0.34566835807875956, 'strategy': 'breakout', 'time_stop': 300, 'use_sma': False, 'use_atr': False, 'use_adx': False, 'use_ema': False, 'use_spike': False, 'rsi_required': False, 'edge_k': 0.16488587514351677, 'edge_cap': 0.4005829407486904, 'bull_strategy': 'breakout', 'bull_bb_std_mult': 3.2430621681245837, 'bull_rsi_os': 34, 'bull_rsi_ob': 48, 'bull_adx_thresh': 17.163677530513585, 'bull_atr_min_pct': 0.0008939684834462943, 'bull_atr_max_pct': 0.11053787911193325, 'bull_tp_mult': 2.9393331347312426, 'bull_tsl_mult': 0.9042336070923691, 'bull_time_stop': 84, 'bull_use_sma': False, 'bull_use_ema': False, 'bull_use_atr': False, 'bull_use_adx': True, 'bull_use_spike': True, 'bull_rsi_required': False, 'bear_strategy': 'breakout', 'bear_bb_std_mult': 0.9757512276588765, 'bear_rsi_os': 52, 'bear_rsi_ob': 70, 'bear_adx_thresh': 18.20571167440073, 'bear_atr_min_pct': 0.014058594707451268, 'bear_atr_max_pct': 0.03525921362397723, 'bear_tp_mult': 2.705684670641933, 'bear_tsl_mult': 0.6836627623944009, 'bear_time_stop': 195, 'bear_use_sma': True, 'bear_use_ema': True, 'bear_use_atr': True, 'bear_use_adx': True, 'bear_use_spike': False, 'bear_rsi_required': False, 'sideways_strategy': 'breakout', 'sideways_bb_std_mult': 3.403266597270546, 'sideways_rsi_os': 36, 'sideways_rsi_ob': 89, 'sideways_adx_thresh': 21.775923929007313, 'sideways_atr_min_pct': 0.01076995047016063, 'sideways_atr_max_pct': 0.04830149898874795, 'sideways_tp_mult': 2.3108258369164956, 'sideways_tsl_mult': 0.3241817261410939, 'sideways_time_stop': 185, 'sideways_use_sma': True, 'sideways_use_ema': True, 'sideways_use_atr': True, 'sideways_use_adx': False, 'sideways_use_spike': False, 'sideways_rsi_required': True}.
[I 2025-08-30 18:54:50,786] Trial 224 finished with values: [-1000000000.0, 1000000000.0] and parameters: {'p_sma': 6, 'p_std': 7, 'p_atr': 9, 'p_adx': 11, 'rsi_period': 7, 'ema1': 26, 'ema2': 38, 'slip_atr_k': 0.053829800456589055, 'slip_spread_k': 0.41743147632672933, 'spread_hl_frac': 0.0228477408294201, 'bb_std_mult': 0.9419347509925271, 'rsi_os': 13, 'rsi_ob': 83, 'vol_spike': 0.0001315201833630708, 'adx_thresh': 23.474995085306873, 'atr_min_pct': 0.023764882267272087, 'atr_max_pct': 0.09495285842773121, 'tp_mult': 2.94982765535001, 'tsl_mult': 0.2501347254017011, 'strategy': 'breakout', 'time_stop': 71, 'use_sma': False, 'use_atr': True, 'use_adx': False, 'use_ema': False, 'use_spike': True, 'rsi_required': False, 'edge_k': 0.1687618297885299, 'edge_cap': 0.38914805438953115, 'bull_strategy': 'breakout', 'bull_bb_std_mult': 0.7265312025856354, 'bull_rsi_os': 34, 'bull_rsi_ob': 48, 'bull_adx_thresh': 18.38084811336691, 'bull_atr_min_pct': 0.002273035228998139, 'bull_atr_max_pct': 0.023789441110817988, 'bull_tp_mult': 1.1774980672054163, 'bull_tsl_mult': 0.5421007487301205, 'bull_time_stop': 31, 'bull_use_sma': False, 'bull_use_ema': False, 'bull_use_atr': False, 'bull_use_adx': True, 'bull_use_spike': True, 'bull_rsi_required': False, 'bear_strategy': 'breakout', 'bear_bb_std_mult': 2.7087254241610097, 'bear_rsi_os': 52, 'bear_rsi_ob': 76, 'bear_adx_thresh': 18.14924513416135, 'bear_atr_min_pct': 0.011131242526569897, 'bear_atr_max_pct': 0.03604922898884579, 'bear_tp_mult': 1.2943460868587744, 'bear_tsl_mult': 0.6851224624500889, 'bear_time_stop': 196, 'bear_use_sma': True, 'bear_use_ema': True, 'bear_use_atr': True, 'bear_use_adx': True, 'bear_use_spike': False, 'bear_rsi_required': True, 'sideways_strategy': 'breakout', 'sideways_bb_std_mult': 3.3021807254836104, 'sideways_rsi_os': 35, 'sideways_rsi_ob': 57, 'sideways_adx_thresh': 15.952231232803657, 'sideways_atr_min_pct': 0.01901027176969487, 'sideways_atr_max_pct': 0.05332115675293178, 'sideways_tp_mult': 2.1995112239704295, 'sideways_tsl_mult': 0.5170253270310933, 'sideways_time_stop': 165, 'sideways_use_sma': False, 'sideways_use_ema': True, 'sideways_use_atr': True, 'sideways_use_adx': False, 'sideways_use_spike': False, 'sideways_rsi_required': True}.
[I 2025-08-30 18:54:50,914] Trial 223 finished with values: [-1000000000.0, 1000000000.0] and parameters: {'p_sma': 10, 'p_std': 55, 'p_atr': 22, 'p_adx': 17, 'rsi_period': 21, 'ema1': 22, 'ema2': 38, 'slip_atr_k': 0.05474037024361243, 'slip_spread_k': 0.2072431725556651, 'spread_hl_frac': 0.016413571843307117, 'bb_std_mult': 2.736673354763605, 'rsi_os': 12, 'rsi_ob': 59, 'vol_spike': 0.25708874291783174, 'adx_thresh': 23.54195741084374, 'atr_min_pct': 0.005523837453034204, 'atr_max_pct': 0.1306222882635345, 'tp_mult': 2.1967187509201755, 'tsl_mult': 0.8637779916119248, 'strategy': 'breakout', 'time_stop': 146, 'use_sma': False, 'use_atr': True, 'use_adx': False, 'use_ema': False, 'use_spike': True, 'rsi_required': False, 'edge_k': 0.1709025133674315, 'edge_cap': 0.39990258585378147, 'bull_strategy': 'breakout', 'bull_bb_std_mult': 0.8658369453322834, 'bull_rsi_os': 34, 'bull_rsi_ob': 48, 'bull_adx_thresh': 18.25266119958643, 'bull_atr_min_pct': 8.827520334050314e-05, 'bull_atr_max_pct': 0.08369078126685589, 'bull_tp_mult': 2.9317799622902085, 'bull_tsl_mult': 0.5371401263665831, 'bull_time_stop': 31, 'bull_use_sma': False, 'bull_use_ema': False, 'bull_use_atr': False, 'bull_use_adx': True, 'bull_use_spike': True, 'bull_rsi_required': False, 'bear_strategy': 'breakout', 'bear_bb_std_mult': 2.703568524179777, 'bear_rsi_os': 13, 'bear_rsi_ob': 87, 'bear_adx_thresh': 17.4466799914128, 'bear_atr_min_pct': 0.004841033652389243, 'bear_atr_max_pct': 0.03559542975861404, 'bear_tp_mult': 2.687627900045307, 'bear_tsl_mult': 0.39948807518414325, 'bear_time_stop': 175, 'bear_use_sma': True, 'bear_use_ema': True, 'bear_use_atr': True, 'bear_use_adx': True, 'bear_use_spike': False, 'bear_rsi_required': True, 'sideways_strategy': 'breakout', 'sideways_bb_std_mult': 2.6207976035344567, 'sideways_rsi_os': 35, 'sideways_rsi_ob': 57, 'sideways_adx_thresh': 19.067096988236052, 'sideways_atr_min_pct': 0.01079512390754557, 'sideways_atr_max_pct': 0.053806987141675734, 'sideways_tp_mult': 2.2950705093008072, 'sideways_tsl_mult': 0.9483884277679036, 'sideways_time_stop': 166, 'sideways_use_sma': False, 'sideways_use_ema': True, 'sideways_use_atr': True, 'sideways_use_adx': False, 'sideways_use_spike': False, 'sideways_rsi_required': True}.
