[I 2025-08-30 18:29:29,442] Trial 11 finished with values: [-1000000000.0, 1000000000.0] and parameters: {'p_sma': 40, 'p_std': 37, 'p_atr': 22, 'p_adx': 13, 'rsi_period': 9, 'ema1': 28, 'ema2': 18, 'slip_atr_k': 0.0009436089286849747, 'slip_spread_k': 0.23652778552016196, 'spread_hl_frac': 0.004436218024330496, 'bb_std_mult': 1.2963578534902895, 'rsi_os': 53, 'rsi_ob': 59, 'vol_spike': 0.15058763536861247, 'adx_thresh': 11.079925355880155, 'atr_min_pct': 0.019923493113355065, 'atr_max_pct': 0.08442616752305787, 'tp_mult': 1.5589312757817881, 'tsl_mult': 0.7423008053446597, 'strategy': 'breakout', 'time_stop': 19, 'use_sma': True, 'use_atr': True, 'use_adx': False, 'use_ema': True, 'use_spike': True, 'rsi_required': False, 'edge_k': 0.07255982147293172, 'edge_cap': 0.5523925149462837, 'bull_strategy': 'mean_reversion', 'bull_bb_std_mult': 0.6524608536372476, 'bull_rsi_os': 14, 'bull_rsi_ob': 45, 'bull_adx_thresh': 24.81872097978756, 'bull_atr_min_pct': 0.027678407133575056, 'bull_atr_max_pct': 0.10112189185527662, 'bull_tp_mult': 1.7544331053051911, 'bull_tsl_mult': 0.2353406907527501, 'bull_time_stop': 242, 'bull_use_sma': True, 'bull_use_ema': False, 'bull_use_atr': True, 'bull_use_adx': False, 'bull_use_spike': False, 'bull_rsi_required': False, 'bear_strategy': 'breakout', 'bear_bb_std_mult': 1.0236744700273874, 'bear_rsi_os': 37, 'bear_rsi_ob': 91, 'bear_adx_thresh': 28.008266771355895, 'bear_atr_min_pct': 0.013774037318538605, 'bear_atr_max_pct': 0.11453105040508688, 'bear_tp_mult': 1.2344062620138228, 'bear_tsl_mult': 0.16382073428467192, 'bear_time_stop': 86, 'bear_use_sma': False, 'bear_use_ema': True, 'bear_use_atr': True, 'bear_use_adx': True, 'bear_use_spike': True, 'bear_rsi_required': True, 'sideways_strategy': 'breakout', 'sideways_bb_std_mult': 1.122018886412162, 'sideways_rsi_os': 43, 'sideways_rsi_ob': 82, 'sideways_adx_thresh': 33.10776815893385, 'sideways_atr_min_pct': 0.028848313759372947, 'sideways_atr_max_pct': 0.0662987823342624, 'sideways_tp_mult': 2.5008084732456237, 'sideways_tsl_mult': 0.03462224951435422, 'sideways_time_stop': 243, 'sideways_use_sma': False, 'sideways_use_ema': False, 'sideways_use_atr': False, 'sideways_use_adx': True, 'sideways_use_spike': False, 'sideways_rsi_required': False}.
[I 2025-08-30 18:29:30,267] Trial 8 finished with values: [-1000000000.0, 1000000000.0] and parameters: {'p_sma': 29, 'p_std': 21, 'p_atr': 7, 'p_adx': 27, 'rsi_period': 70, 'ema1': 13, 'ema2': 59, 'slip_atr_k': 0.22226217835293657, 'slip_spread_k': 0.6432452468994758, 'spread_hl_frac': 0.04742152323111721, 'bb_std_mult': 3.403123067532414, 'rsi_os': 8, 'rsi_ob': 80, 'vol_spike': 0.1042528798393348, 'adx_thresh': 26.469987766809, 'atr_min_pct': 0.028145689317655976, 'atr_max_pct': 0.1376177897920733, 'tp_mult': 2.856560765799293, 'tsl_mult': 0.33182711043020785, 'strategy': 'mean_reversion', 'time_stop': 66, 'use_sma': True, 'use_atr': True, 'use_adx': False, 'use_ema': False, 'use_spike': False, 'rsi_required': True, 'edge_k': 1.7318635901135035, 'edge_cap': 0.19224368372498826, 'bull_strategy': 'breakout', 'bull_bb_std_mult': 2.2666082197707254, 'bull_rsi_os': 43, 'bull_rsi_ob': 92, 'bull_adx_thresh': 21.283669984751047, 'bull_atr_min_pct': 0.014708123760370386, 'bull_atr_max_pct': 0.12672460255449927, 'bull_tp_mult': 2.554737908248065, 'bull_tsl_mult': 0.7524639271717062, 'bull_time_stop': 8, 'bull_use_sma': True, 'bull_use_ema': True, 'bull_use_atr': False, 'bull_use_adx': True, 'bull_use_spike': True, 'bull_rsi_required': False, 'bear_strategy': 'mean_reversion', 'bear_bb_std_mult': 2.5353557849607653, 'bear_rsi_os': 42, 'bear_rsi_ob': 78, 'bear_adx_thresh': 30.566606132757247, 'bear_atr_min_pct': 0.0167742570204811, 'bear_atr_max_pct': 0.02126460481676922, 'bear_tp_mult': 2.617169677218922, 'bear_tsl_mult': 0.7908558517961911, 'bear_time_stop': 108, 'bear_use_sma': True, 'bear_use_ema': True, 'bear_use_atr': True, 'bear_use_adx': False, 'bear_use_spike': True, 'bear_rsi_required': False, 'sideways_strategy': 'breakout', 'sideways_bb_std_mult': 2.54514832672374, 'sideways_rsi_os': 13, 'sideways_rsi_ob': 91, 'sideways_adx_thresh': 12.695447153204126, 'sideways_atr_min_pct': 0.003980947815603447, 'sideways_atr_max_pct': 0.1267225962300446, 'sideways_tp_mult': 1.8014807518040443, 'sideways_tsl_mult': 0.6945917053553764, 'sideways_time_stop': 144, 'sideways_use_sma': True, 'sideways_use_ema': True, 'sideways_use_atr': False, 'sideways_use_adx': False, 'sideways_use_spike': True, 'sideways_rsi_required': False}.
[I 2025-08-30 18:29:30,422] Trial 12 finished with values: [-1000000000.0, 1000000000.0] and parameters: {'p_sma': 22, 'p_std': 15, 'p_atr': 23, 'p_adx': 15, 'rsi_period': 81, 'ema1': 20, 'ema2': 53, 'slip_atr_k': 0.012894101119470203, 'slip_spread_k': 0.513460385238023, 'spread_hl_frac': 0.004883148057145015, 'bb_std_mult': 3.1753181996033955, 'rsi_os': 41, 'rsi_ob': 82, 'vol_spike': 0.26517277544301737, 'adx_thresh': 24.3658062308981, 'atr_min_pct': 0.024204376423005092, 'atr_max_pct': 0.13071862951498495, 'tp_mult': 1.5695063095232145, 'tsl_mult': 0.5613170221315108, 'strategy': 'breakout', 'time_stop': 278, 'use_sma': True, 'use_atr': True, 'use_adx': False, 'use_ema': False, 'use_spike': False, 'rsi_required': False, 'edge_k': 1.2042835302025496, 'edge_cap': 0.17668879523436026, 'bull_strategy': 'breakout', 'bull_bb_std_mult': 0.5693881720242541, 'bull_rsi_os': 48, 'bull_rsi_ob': 86, 'bull_adx_thresh': 5.401046788430472, 'bull_atr_min_pct': 0.019857169968974017, 'bull_atr_max_pct': 0.012762731468848381, 'bull_tp_mult': 1.0127972612901743, 'bull_tsl_mult': 0.4650415210960859, 'bull_time_stop': 75, 'bull_use_sma': True, 'bull_use_ema': False, 'bull_use_atr': True, 'bull_use_adx': True, 'bull_use_spike': False, 'bull_rsi_required': False, 'bear_strategy': 'breakout', 'bear_bb_std_mult': 0.7862067009815873, 'bear_rsi_os': 50, 'bear_rsi_ob': 89, 'bear_adx_thresh': 34.53150003646881, 'bear_atr_min_pct': 0.009683395921314453, 'bear_atr_max_pct': 0.06472369684845809, 'bear_tp_mult': 2.760301722460378, 'bear_tsl_mult': 0.21318917389406944, 'bear_time_stop': 145, 'bear_use_sma': True, 'bear_use_ema': False, 'bear_use_atr': False, 'bear_use_adx': False, 'bear_use_spike': False, 'bear_rsi_required': False, 'sideways_strategy': 'breakout', 'sideways_bb_std_mult': 0.7988342874919837, 'sideways_rsi_os': 18, 'sideways_rsi_ob': 67, 'sideways_adx_thresh': 24.762953210593082, 'sideways_atr_min_pct': 0.002704133663722845, 'sideways_atr_max_pct': 0.029754053300346774, 'sideways_tp_mult': 2.4096196728941153, 'sideways_tsl_mult': 0.4033747917746979, 'sideways_time_stop': 293, 'sideways_use_sma': True, 'sideways_use_ema': False, 'sideways_use_atr': False, 'sideways_use_adx': True, 'sideways_use_spike': False, 'sideways_rsi_required': False}.
[I 2025-08-30 18:29:30,612] Trial 10 finished with values: [-1000000000.0, 1000000000.0] and parameters: {'p_sma': 23, 'p_std': 35, 'p_atr': 19, 'p_adx': 17, 'rsi_period': 37, 'ema1': 14, 'ema2': 28, 'slip_atr_k': 0.08715018246707418, 'slip_spread_k': 0.22135095527629312, 'spread_hl_frac': 0.04820883278707596, 'bb_std_mult': 0.8750583495534491, 'rsi_os': 48, 'rsi_ob': 76, 'vol_spike': 0.20700856173676793, 'adx_thresh': 6.112384695784739, 'atr_min_pct': 0.0268688778647482, 'atr_max_pct': 0.14999897659853975, 'tp_mult': 1.5917980782751937, 'tsl_mult': 0.9745488650978552, 'strategy': 'mean_reversion', 'time_stop': 141, 'use_sma': False, 'use_atr': True, 'use_adx': False, 'use_ema': True, 'use_spike': True, 'rsi_required': True, 'edge_k': 0.8072142983849409, 'edge_cap': 0.3341443135013445, 'bull_strategy': 'breakout', 'bull_bb_std_mult': 0.9380819169670597, 'bull_rsi_os': 39, 'bull_rsi_ob': 86, 'bull_adx_thresh': 13.196183864254715, 'bull_atr_min_pct': 0.023481528410611, 'bull_atr_max_pct': 0.1334672785383733, 'bull_tp_mult': 2.857011516605304, 'bull_tsl_mult': 0.9898596542066471, 'bull_time_stop': 273, 'bull_use_sma': False, 'bull_use_ema': False, 'bull_use_atr': True, 'bull_use_adx': False, 'bull_use_spike': True, 'bull_rsi_required': False, 'bear_strategy': 'mean_reversion', 'bear_bb_std_mult': 1.5914481215457823, 'bear_rsi_os': 55, 'bear_rsi_ob': 45, 'bear_adx_thresh': 11.26335751648664, 'bear_atr_min_pct': 0.018454890064457823, 'bear_atr_max_pct': 0.08978666226389875, 'bear_tp_mult': 2.439995831564091, 'bear_tsl_mult': 0.3627005121353585, 'bear_time_stop': 101, 'bear_use_sma': False, 'bear_use_ema': False, 'bear_use_atr': False, 'bear_use_adx': False, 'bear_use_spike': False, 'bear_rsi_required': True, 'sideways_strategy': 'mean_reversion', 'sideways_bb_std_mult': 2.7600564956030804, 'sideways_rsi_os': 9, 'sideways_rsi_ob': 80, 'sideways_adx_thresh': 13.232989013724017, 'sideways_atr_min_pct': 0.021274582684343915, 'sideways_atr_max_pct': 0.13434136944295763, 'sideways_tp_mult': 2.7041727625342142, 'sideways_tsl_mult': 0.5488762178527293, 'sideways_time_stop': 236, 'sideways_use_sma': False, 'sideways_use_ema': True, 'sideways_use_atr': False, 'sideways_use_adx': False, 'sideways_use_spike': True, 'sideways_rsi_required': True}.
[I 2025-08-30 18:30:02,597] Trial 13 finished with values: [-1000000000.0, 1000000000.0] and parameters: {'p_sma': 7, 'p_std': 55, 'p_atr': 15, 'p_adx': 30, 'rsi_period': 60, 'ema1': 23, 'ema2': 60, 'slip_atr_k': 0.08605254263306167, 'slip_spread_k': 0.6998652570288098, 'spread_hl_frac': 0.013253172432223563, 'bb_std_mult': 1.4119733642384875, 'rsi_os': 16, 'rsi_ob': 93, 'vol_spike': 0.259977839614594, 'adx_thresh': 34.86111859757055, 'atr_min_pct': 0.02920832603003587, 'atr_max_pct': 0.06071113196287939, 'tp_mult': 1.0520228808566936, 'tsl_mult': 0.9474338544151067, 'strategy': 'breakout', 'time_stop': 97, 'use_sma': False, 'use_atr': False, 'use_adx': False, 'use_ema': False, 'use_spike': False, 'rsi_required': True, 'edge_k': 1.9829104000139415, 'edge_cap': 0.07397449944357842, 'bull_strategy': 'breakout', 'bull_bb_std_mult': 2.7040780369917505, 'bull_rsi_os': 29, 'bull_rsi_ob': 55, 'bull_adx_thresh': 15.066084883815822, 'bull_atr_min_pct': 0.022034778495879995, 'bull_atr_max_pct': 0.14943047901065748, 'bull_tp_mult': 1.1300378835479665, 'bull_tsl_mult': 0.6135706719988586, 'bull_time_stop': 20, 'bull_use_sma': True, 'bull_use_ema': True, 'bull_use_atr': False, 'bull_use_adx': True, 'bull_use_spike': True, 'bull_rsi_required': True, 'bear_strategy': 'mean_reversion', 'bear_bb_std_mult': 1.780738276988075, 'bear_rsi_os': 20, 'bear_rsi_ob': 48, 'bear_adx_thresh': 7.075680831512896, 'bear_atr_min_pct': 0.009020168330712052, 'bear_atr_max_pct': 0.1463905997039509, 'bear_tp_mult': 2.9226315008014634, 'bear_tsl_mult': 0.8714670590488764, 'bear_time_stop': 124, 'bear_use_sma': True, 'bear_use_ema': False, 'bear_use_atr': True, 'bear_use_adx': False, 'bear_use_spike': True, 'bear_rsi_required': False, 'sideways_strategy': 'mean_reversion', 'sideways_bb_std_mult': 1.8319244819079732, 'sideways_rsi_os': 16, 'sideways_rsi_ob': 66, 'sideways_adx_thresh': 5.133807475047543, 'sideways_atr_min_pct': 0.00037727722888322365, 'sideways_atr_max_pct': 0.013856586654336112, 'sideways_tp_mult': 1.8654552005424405, 'sideways_tsl_mult': 0.6870117083267866, 'sideways_time_stop': 298, 'sideways_use_sma': True, 'sideways_use_ema': True, 'sideways_use_atr': False, 'sideways_use_adx': False, 'sideways_use_spike': True, 'sideways_rsi_required': True}.
[I 2025-08-30 18:30:03,525] Trial 14 finished with values: [-1000000000.0, 1000000000.0] and parameters: {'p_sma': 5, 'p_std': 60, 'p_atr': 15, 'p_adx': 18, 'rsi_period': 53, 'ema1': 22, 'ema2': 42, 'slip_atr_k': 0.10344943365149625, 'slip_spread_k': 0.6874366861339002, 'spread_hl_frac': 0.01450564018301891, 'bb_std_mult': 1.524655869545546, 'rsi_os': 18, 'rsi_ob': 95, 'vol_spike': 0.2919115128472526, 'adx_thresh': 34.352078503619914, 'atr_min_pct': 0.02934707042456472, 'atr_max_pct': 0.056792070446007134, 'tp_mult': 1.010421023389283, 'tsl_mult': 0.9638777006967314, 'strategy': 'breakout', 'time_stop': 120, 'use_sma': False, 'use_atr': False, 'use_adx': False, 'use_ema': True, 'use_spike': False, 'rsi_required': False, 'edge_k': 1.8609214301820107, 'edge_cap': 0.37861183422680766, 'bull_strategy': 'mean_reversion', 'bull_bb_std_mult': 3.247495963939099, 'bull_rsi_os': 30, 'bull_rsi_ob': 56, 'bull_adx_thresh': 14.3564585906581, 'bull_atr_min_pct': 0.02123960892599648, 'bull_atr_max_pct': 0.14901167857810876, 'bull_tp_mult': 2.2233939108936256, 'bull_tsl_mult': 0.5583718684668477, 'bull_time_stop': 107, 'bull_use_sma': False, 'bull_use_ema': False, 'bull_use_atr': True, 'bull_use_adx': False, 'bull_use_spike': True, 'bull_rsi_required': True, 'bear_strategy': 'breakout', 'bear_bb_std_mult': 1.86061451431988, 'bear_rsi_os': 19, 'bear_rsi_ob': 47, 'bear_adx_thresh': 5.0893267948593195, 'bear_atr_min_pct': 0.010593199814534557, 'bear_atr_max_pct': 0.14495666053175124, 'bear_tp_mult': 2.904785353199539, 'bear_tsl_mult': 0.9745017885533336, 'bear_time_stop': 137, 'bear_use_sma': True, 'bear_use_ema': False, 'bear_use_atr': True, 'bear_use_adx': True, 'bear_use_spike': False, 'bear_rsi_required': False, 'sideways_strategy': 'mean_reversion', 'sideways_bb_std_mult': 1.9173798697651034, 'sideways_rsi_os': 23, 'sideways_rsi_ob': 65, 'sideways_adx_thresh': 5.3717994025822735, 'sideways_atr_min_pct': 0.024389157284620124, 'sideways_atr_max_pct': 0.011812329957944154, 'sideways_tp_mult': 1.0486855707808764, 'sideways_tsl_mult': 0.6314490366425021, 'sideways_time_stop': 287, 'sideways_use_sma': True, 'sideways_use_ema': True, 'sideways_use_atr': False, 'sideways_use_adx': False, 'sideways_use_spike': True, 'sideways_rsi_required': True}.
[I 2025-08-30 18:30:03,704] Trial 17 finished with values: [-1000000000.0, 1000000000.0] and parameters: {'p_sma': 10, 'p_std': 5, 'p_atr': 14, 'p_adx': 9, 'rsi_period': 55, 'ema1': 24, 'ema2': 42, 'slip_atr_k': 0.18934686062588876, 'slip_spread_k': 0.9722547345160043, 'spread_hl_frac': 0.017274406715392446, 'bb_std_mult': 1.621246099457969, 'rsi_os': 20, 'rsi_ob': 68, 'vol_spike': 0.002470645061980997, 'adx_thresh': 16.89965175409397, 'atr_min_pct': 0.014027864892275423, 'atr_max_pct': 0.011395076431899534, 'tp_mult': 1.0258346460063068, 'tsl_mult': 0.8222418639325336, 'strategy': 'breakout', 'time_stop': 107, 'use_sma': False, 'use_atr': False, 'use_adx': False, 'use_ema': True, 'use_spike': True, 'rsi_required': False, 'edge_k': 1.9614955736934725, 'edge_cap': 0.41200961390501906, 'bull_strategy': 'mean_reversion', 'bull_bb_std_mult': 3.5617512669121334, 'bull_rsi_os': 27, 'bull_rsi_ob': 54, 'bull_adx_thresh': 20.54663086078196, 'bull_atr_min_pct': 0.01243885088239173, 'bull_atr_max_pct': 0.024852126253942446, 'bull_tp_mult': 2.182680784850022, 'bull_tsl_mult': 0.5791985097895477, 'bull_time_stop': 119, 'bull_use_sma': False, 'bull_use_ema': False, 'bull_use_atr': True, 'bull_use_adx': False, 'bull_use_spike': False, 'bull_rsi_required': True, 'bear_strategy': 'breakout', 'bear_bb_std_mult': 2.266224230607361, 'bear_rsi_os': 26, 'bear_rsi_ob': 58, 'bear_adx_thresh': 20.503098468420852, 'bear_atr_min_pct': 0.0005244686417400506, 'bear_atr_max_pct': 0.11824633934762979, 'bear_tp_mult': 2.338519517655792, 'bear_tsl_mult': 0.5497619720197204, 'bear_time_stop': 64, 'bear_use_sma': True, 'bear_use_ema': False, 'bear_use_atr': True, 'bear_use_adx': True, 'bear_use_spike': False, 'bear_rsi_required': False, 'sideways_strategy': 'mean_reversion', 'sideways_bb_std_mult': 2.0243141054575977, 'sideways_rsi_os': 23, 'sideways_rsi_ob': 61, 'sideways_adx_thresh': 18.838678419919468, 'sideways_atr_min_pct': 0.025736396578210977, 'sideways_atr_max_pct': 0.04202973307271611, 'sideways_tp_mult': 1.0271313008860636, 'sideways_tsl_mult': 0.0020180195940718293, 'sideways_time_stop': 18, 'sideways_use_sma': False, 'sideways_use_ema': True, 'sideways_use_atr': False, 'sideways_use_adx': False, 'sideways_use_spike': True, 'sideways_rsi_required': False}.
[I 2025-08-30 18:30:04,465] Trial 15 finished with values: [-1000000000.0, 1000000000.0] and parameters: {'p_sma': 7, 'p_std': 5, 'p_atr': 14, 'p_adx': 7, 'rsi_period': 55, 'ema1': 24, 'ema2': 41, 'slip_atr_k': 0.1002537899433353, 'slip_spread_k': 0.740618556999823, 'spread_hl_frac': 0.01474350764907107, 'bb_std_mult': 1.4476927350687274, 'rsi_os': 18, 'rsi_ob': 93, 'vol_spike': 0.00804543744926342, 'adx_thresh': 16.46536083788784, 'atr_min_pct': 0.013765613841450487, 'atr_max_pct': 0.059406813544638594, 'tp_mult': 1.0627784192529046, 'tsl_mult': 0.9928001960179555, 'strategy': 'breakout', 'time_stop': 120, 'use_sma': False, 'use_atr': False, 'use_adx': False, 'use_ema': True, 'use_spike': False, 'rsi_required': False, 'edge_k': 1.9650796299852225, 'edge_cap': 0.4054312161054283, 'bull_strategy': 'mean_reversion', 'bull_bb_std_mult': 3.2766667356930146, 'bull_rsi_os': 30, 'bull_rsi_ob': 57, 'bull_adx_thresh': 14.311938660855873, 'bull_atr_min_pct': 0.02290616811598587, 'bull_atr_max_pct': 0.14843755612543488, 'bull_tp_mult': 2.1964720652160348, 'bull_tsl_mult': 0.9963592426934085, 'bull_time_stop': 126, 'bull_use_sma': False, 'bull_use_ema': True, 'bull_use_atr': False, 'bull_use_adx': False, 'bull_use_spike': True, 'bull_rsi_required': True, 'bear_strategy': 'breakout', 'bear_bb_std_mult': 1.8246052200560507, 'bear_rsi_os': 19, 'bear_rsi_ob': 45, 'bear_adx_thresh': 6.1828566105060485, 'bear_atr_min_pct': 0.010337951980807685, 'bear_atr_max_pct': 0.1470571512344118, 'bear_tp_mult': 2.4007969168794774, 'bear_tsl_mult': 0.6035960376900789, 'bear_time_stop': 87, 'bear_use_sma': True, 'bear_use_ema': False, 'bear_use_atr': True, 'bear_use_adx': True, 'bear_use_spike': True, 'bear_rsi_required': True, 'sideways_strategy': 'mean_reversion', 'sideways_bb_std_mult': 2.003685112634081, 'sideways_rsi_os': 23, 'sideways_rsi_ob': 61, 'sideways_adx_thresh': 5.292133618282391, 'sideways_atr_min_pct': 0.025235670685610695, 'sideways_atr_max_pct': 0.01446922619997705, 'sideways_tp_mult': 1.6097497114349024, 'sideways_tsl_mult': 0.6180116560203627, 'sideways_time_stop': 19, 'sideways_use_sma': True, 'sideways_use_ema': True, 'sideways_use_atr': False, 'sideways_use_adx': False, 'sideways_use_spike': True, 'sideways_rsi_required': True}.
[I 2025-08-30 18:30:04,579] Trial 16 finished with values: [-1000000000.0, 1000000000.0] and parameters: {'p_sma': 5, 'p_std': 56, 'p_atr': 15, 'p_adx': 7, 'rsi_period': 55, 'ema1': 24, 'ema2': 42, 'slip_atr_k': 0.1907695261743293, 'slip_spread_k': 0.6826185643428333, 'spread_hl_frac': 0.015326215655907364, 'bb_std_mult': 1.5231960913285405, 'rsi_os': 18, 'rsi_ob': 95, 'vol_spike': 0.004253256544969164, 'adx_thresh': 17.66228573546372, 'atr_min_pct': 0.015345415170244008, 'atr_max_pct': 0.05095645018375236, 'tp_mult': 1.032802813412293, 'tsl_mult': 0.8041023419342397, 'strategy': 'breakout', 'time_stop': 89, 'use_sma': False, 'use_atr': False, 'use_adx': False, 'use_ema': True, 'use_spike': False, 'rsi_required': False, 'edge_k': 1.9875027623798678, 'edge_cap': 0.42105054667057096, 'bull_strategy': 'mean_reversion', 'bull_bb_std_mult': 3.257412249986607, 'bull_rsi_os': 28, 'bull_rsi_ob': 55, 'bull_adx_thresh': 18.125116228262968, 'bull_atr_min_pct': 0.00047226112394479526, 'bull_atr_max_pct': 0.14719363767570906, 'bull_tp_mult': 2.2729221385276057, 'bull_tsl_mult': 0.6352516083815215, 'bull_time_stop': 124, 'bull_use_sma': False, 'bull_use_ema': True, 'bull_use_atr': False, 'bull_use_adx': False, 'bull_use_spike': True, 'bull_rsi_required': True, 'bear_strategy': 'breakout', 'bear_bb_std_mult': 2.0373646722881134, 'bear_rsi_os': 17, 'bear_rsi_ob': 56, 'bear_adx_thresh': 5.916643925113112, 'bear_atr_min_pct': 0.00022240530391230825, 'bear_atr_max_pct': 0.14472334127366634, 'bear_tp_mult': 2.945152326916877, 'bear_tsl_mult': 0.9885965250524641, 'bear_time_stop': 63, 'bear_use_sma': True, 'bear_use_ema': False, 'bear_use_atr': True, 'bear_use_adx': True, 'bear_use_spike': True, 'bear_rsi_required': False, 'sideways_strategy': 'mean_reversion', 'sideways_bb_std_mult': 1.8985800607417889, 'sideways_rsi_os': 23, 'sideways_rsi_ob': 60, 'sideways_adx_thresh': 7.214640504516952, 'sideways_atr_min_pct': 0.029936611588940225, 'sideways_atr_max_pct': 0.011074742899392392, 'sideways_tp_mult': 1.0272081202082222, 'sideways_tsl_mult': 0.6433653279734155, 'sideways_time_stop': 292, 'sideways_use_sma': True, 'sideways_use_ema': True, 'sideways_use_atr': False, 'sideways_use_adx': False, 'sideways_use_spike': True, 'sideways_rsi_required': True}.
