[I 2025-08-30 19:35:02,542] Trial 576 finished with values: [-1000000000.0, 1000000000.0] and parameters: {'p_sma': 33, 'p_std': 32, 'p_atr': 23, 'p_adx': 12, 'rsi_period': 22, 'ema1': 29, 'ema2': 31, 'slip_atr_k': 0.06547132350266427, 'slip_spread_k': 0.8233300232334502, 'spread_hl_frac': 0.0011227339278453465, 'bb_std_mult': 2.2704338593742968, 'rsi_os': 50, 'rsi_ob': 83, 'vol_spike': 0.2865924845143037, 'adx_thresh': 19.125576128153046, 'atr_min_pct': 0.023348243073778994, 'atr_max_pct': 0.11349091478826748, 'tp_mult': 1.7719610389634886, 'tsl_mult': 0.8777494487861847, 'strategy': 'breakout', 'time_stop': 227, 'use_sma': False, 'use_atr': False, 'use_adx': True, 'use_ema': False, 'use_spike': False, 'rsi_required': True, 'edge_k': 1.3918755699948449, 'edge_cap': 0.5257752656504415, 'bull_strategy': 'mean_reversion', 'bull_bb_std_mult': 0.735346315015897, 'bull_rsi_os': 32, 'bull_rsi_ob': 51, 'bull_adx_thresh': 23.32947394830228, 'bull_atr_min_pct': 0.024058483295518115, 'bull_atr_max_pct': 0.116749373968071, 'bull_tp_mult': 2.8825177646044726, 'bull_tsl_mult': 0.1640579414127717, 'bull_time_stop': 111, 'bull_use_sma': True, 'bull_use_ema': True, 'bull_use_atr': True, 'bull_use_adx': False, 'bull_use_spike': False, 'bull_rsi_required': True, 'bear_strategy': 'breakout', 'bear_bb_std_mult': 2.8911327288349242, 'bear_rsi_os': 13, 'bear_rsi_ob': 77, 'bear_adx_thresh': 15.879809272071864, 'bear_atr_min_pct': 0.0014685693815315228, 'bear_atr_max_pct': 0.033520035895471256, 'bear_tp_mult': 1.8784204590590436, 'bear_tsl_mult': 0.9129195591745239, 'bear_time_stop': 142, 'bear_use_sma': False, 'bear_use_ema': True, 'bear_use_atr': False, 'bear_use_adx': True, 'bear_use_spike': False, 'bear_rsi_required': True, 'sideways_strategy': 'mean_reversion', 'sideways_bb_std_mult': 2.3641328212357138, 'sideways_rsi_os': 44, 'sideways_rsi_ob': 66, 'sideways_adx_thresh': 26.923682809829835, 'sideways_atr_min_pct': 0.017160019530561246, 'sideways_atr_max_pct': 0.14063217643457013, 'sideways_tp_mult': 1.2284171411049905, 'sideways_tsl_mult': 0.26585499021486547, 'sideways_time_stop': 148, 'sideways_use_sma': False, 'sideways_use_ema': True, 'sideways_use_atr': True, 'sideways_use_adx': False, 'sideways_use_spike': True, 'sideways_rsi_required': True}.
[I 2025-08-30 19:35:03,429] Trial 579 finished with values: [-1000000000.0, 1000000000.0] and parameters: {'p_sma': 32, 'p_std': 31, 'p_atr': 29, 'p_adx': 18, 'rsi_period': 22, 'ema1': 14, 'ema2': 31, 'slip_atr_k': 0.06563446126006253, 'slip_spread_k': 0.13019287027261361, 'spread_hl_frac': 0.03276244763730666, 'bb_std_mult': 2.126194248489938, 'rsi_os': 50, 'rsi_ob': 53, 'vol_spike': 0.13611815822220108, 'adx_thresh': 11.36421156147248, 'atr_min_pct': 0.025371506108143423, 'atr_max_pct': 0.08338527255898243, 'tp_mult': 2.105835531537566, 'tsl_mult': 0.9965689627667188, 'strategy': 'mean_reversion', 'time_stop': 217, 'use_sma': False, 'use_atr': False, 'use_adx': True, 'use_ema': True, 'use_spike': True, 'rsi_required': False, 'edge_k': 0.20667563876606465, 'edge_cap': 0.5265273257281111, 'bull_strategy': 'mean_reversion', 'bull_bb_std_mult': 3.3304790149298418, 'bull_rsi_os': 15, 'bull_rsi_ob': 48, 'bull_adx_thresh': 6.235666285164802, 'bull_atr_min_pct': 0.009244896378206016, 'bull_atr_max_pct': 0.0807863629781229, 'bull_tp_mult': 2.891614775185621, 'bull_tsl_mult': 0.0022013734320302514, 'bull_time_stop': 140, 'bull_use_sma': False, 'bull_use_ema': True, 'bull_use_atr': True, 'bull_use_adx': False, 'bull_use_spike': False, 'bull_rsi_required': True, 'bear_strategy': 'breakout', 'bear_bb_std_mult': 2.8437072487221045, 'bear_rsi_os': 54, 'bear_rsi_ob': 73, 'bear_adx_thresh': 15.907882427788845, 'bear_atr_min_pct': 0.007768004375756324, 'bear_atr_max_pct': 0.03372409986354808, 'bear_tp_mult': 2.5286589258284495, 'bear_tsl_mult': 0.7382392867933488, 'bear_time_stop': 201, 'bear_use_sma': True, 'bear_use_ema': True, 'bear_use_atr': False, 'bear_use_adx': False, 'bear_use_spike': False, 'bear_rsi_required': False, 'sideways_strategy': 'breakout', 'sideways_bb_std_mult': 3.3322706947997256, 'sideways_rsi_os': 27, 'sideways_rsi_ob': 59, 'sideways_adx_thresh': 25.94152415842896, 'sideways_atr_min_pct': 0.000168401003218276, 'sideways_atr_max_pct': 0.07241693075072764, 'sideways_tp_mult': 1.0479855717875792, 'sideways_tsl_mult': 0.9849242844358267, 'sideways_time_stop': 153, 'sideways_use_sma': False, 'sideways_use_ema': True, 'sideways_use_atr': False, 'sideways_use_adx': False, 'sideways_use_spike': False, 'sideways_rsi_required': True}.
[I 2025-08-30 19:35:35,609] Trial 577 finished with values: [-0.041751210156457774, 0.04169543540698631] and parameters: {'p_sma': 41, 'p_std': 32, 'p_atr': 23, 'p_adx': 12, 'rsi_period': 22, 'ema1': 29, 'ema2': 33, 'slip_atr_k': 0.06640312825667685, 'slip_spread_k': 0.02711430006791332, 'spread_hl_frac': 0.045621419606660205, 'bb_std_mult': 2.2744944529875064, 'rsi_os': 47, 'rsi_ob': 47, 'vol_spike': 0.12197330379057642, 'adx_thresh': 9.800945778078065, 'atr_min_pct': 0.023344014793171233, 'atr_max_pct': 0.10242102598302176, 'tp_mult': 1.2716167788752153, 'tsl_mult': 0.24547857460934147, 'strategy': 'breakout', 'time_stop': 217, 'use_sma': False, 'use_atr': False, 'use_adx': True, 'use_ema': False, 'use_spike': False, 'rsi_required': True, 'edge_k': 0.0932754357587949, 'edge_cap': 0.5309588794765121, 'bull_strategy': 'mean_reversion', 'bull_bb_std_mult': 2.945519771446053, 'bull_rsi_os': 32, 'bull_rsi_ob': 46, 'bull_adx_thresh': 31.113448500699306, 'bull_atr_min_pct': 0.0030380783097944852, 'bull_atr_max_pct': 0.10752028372733362, 'bull_tp_mult': 2.82603882769173, 'bull_tsl_mult': 0.5616833950392734, 'bull_time_stop': 168, 'bull_use_sma': True, 'bull_use_ema': True, 'bull_use_atr': True, 'bull_use_adx': True, 'bull_use_spike': False, 'bull_rsi_required': True, 'bear_strategy': 'breakout', 'bear_bb_std_mult': 0.7171900231757893, 'bear_rsi_os': 54, 'bear_rsi_ob': 87, 'bear_adx_thresh': 17.78623568987531, 'bear_atr_min_pct': 0.004589500067658403, 'bear_atr_max_pct': 0.034808253326333825, 'bear_tp_mult': 1.3299060300265462, 'bear_tsl_mult': 0.7034313229383984, 'bear_time_stop': 203, 'bear_use_sma': False, 'bear_use_ema': True, 'bear_use_atr': False, 'bear_use_adx': True, 'bear_use_spike': False, 'bear_rsi_required': True, 'sideways_strategy': 'mean_reversion', 'sideways_bb_std_mult': 3.134744828139446, 'sideways_rsi_os': 41, 'sideways_rsi_ob': 59, 'sideways_adx_thresh': 27.97519994861593, 'sideways_atr_min_pct': 0.0007399258340656427, 'sideways_atr_max_pct': 0.12441163958386928, 'sideways_tp_mult': 2.5966774400880874, 'sideways_tsl_mult': 0.27644750746384184, 'sideways_time_stop': 154, 'sideways_use_sma': False, 'sideways_use_ema': True, 'sideways_use_atr': True, 'sideways_use_adx': False, 'sideways_use_spike': False, 'sideways_rsi_required': True}.
[I 2025-08-30 19:35:37,019] Trial 580 finished with values: [-1000000000.0, 1000000000.0] and parameters: {'p_sma': 44, 'p_std': 31, 'p_atr': 18, 'p_adx': 18, 'rsi_period': 77, 'ema1': 26, 'ema2': 28, 'slip_atr_k': 0.15724286696975637, 'slip_spread_k': 0.12738544223588324, 'spread_hl_frac': 0.009143179412558863, 'bb_std_mult': 2.1337994601456125, 'rsi_os': 47, 'rsi_ob': 64, 'vol_spike': 0.12183953831194141, 'adx_thresh': 34.02553033804624, 'atr_min_pct': 0.017634098354847607, 'atr_max_pct': 0.10166262419244722, 'tp_mult': 2.134932960213444, 'tsl_mult': 0.19687375688602832, 'strategy': 'mean_reversion', 'time_stop': 195, 'use_sma': False, 'use_atr': True, 'use_adx': True, 'use_ema': True, 'use_spike': True, 'rsi_required': False, 'edge_k': 0.5039149317069787, 'edge_cap': 0.4547123464527929, 'bull_strategy': 'mean_reversion', 'bull_bb_std_mult': 2.430048440759715, 'bull_rsi_os': 30, 'bull_rsi_ob': 48, 'bull_adx_thresh': 17.791441886343822, 'bull_atr_min_pct': 0.0204076277601462, 'bull_atr_max_pct': 0.09048766555326329, 'bull_tp_mult': 2.811192596421188, 'bull_tsl_mult': 0.6288441424375109, 'bull_time_stop': 166, 'bull_use_sma': False, 'bull_use_ema': True, 'bull_use_atr': True, 'bull_use_adx': False, 'bull_use_spike': False, 'bull_rsi_required': True, 'bear_strategy': 'breakout', 'bear_bb_std_mult': 1.4386528636178664, 'bear_rsi_os': 47, 'bear_rsi_ob': 74, 'bear_adx_thresh': 10.522448023498269, 'bear_atr_min_pct': 0.005069680391676485, 'bear_atr_max_pct': 0.12090994655636325, 'bear_tp_mult': 2.719668887502337, 'bear_tsl_mult': 0.7052421258426589, 'bear_time_stop': 204, 'bear_use_sma': True, 'bear_use_ema': True, 'bear_use_atr': True, 'bear_use_adx': False, 'bear_use_spike': False, 'bear_rsi_required': False, 'sideways_strategy': 'breakout', 'sideways_bb_std_mult': 1.0978333400468974, 'sideways_rsi_os': 54, 'sideways_rsi_ob': 53, 'sideways_adx_thresh': 27.92263041868175, 'sideways_atr_min_pct': 0.02750307455077499, 'sideways_atr_max_pct': 0.14391073812363345, 'sideways_tp_mult': 2.6030461786154593, 'sideways_tsl_mult': 0.9828083042273384, 'sideways_time_stop': 227, 'sideways_use_sma': True, 'sideways_use_ema': True, 'sideways_use_atr': False, 'sideways_use_adx': False, 'sideways_use_spike': False, 'sideways_rsi_required': True}.
[I 2025-08-30 19:35:37,279] Trial 578 finished with values: [-1000000000.0, 1000000000.0] and parameters: {'p_sma': 50, 'p_std': 32, 'p_atr': 9, 'p_adx': 21, 'rsi_period': 22, 'ema1': 29, 'ema2': 55, 'slip_atr_k': 0.09461939260069845, 'slip_spread_k': 0.8231464850819167, 'spread_hl_frac': 0.023834677440119138, 'bb_std_mult': 2.2783880135690042, 'rsi_os': 17, 'rsi_ob': 83, 'vol_spike': 0.25489691281725013, 'adx_thresh': 18.959465284382933, 'atr_min_pct': 0.023296671666608156, 'atr_max_pct': 0.11538567399725627, 'tp_mult': 2.0953338883884234, 'tsl_mult': 0.50753970558673, 'strategy': 'breakout', 'time_stop': 195, 'use_sma': False, 'use_atr': False, 'use_adx': True, 'use_ema': False, 'use_spike': True, 'rsi_required': True, 'edge_k': 1.4811966963229422, 'edge_cap': 0.5343169379671117, 'bull_strategy': 'mean_reversion', 'bull_bb_std_mult': 0.7387114011714473, 'bull_rsi_os': 22, 'bull_rsi_ob': 74, 'bull_adx_thresh': 29.98312663054741, 'bull_atr_min_pct': 0.0012477445859601915, 'bull_atr_max_pct': 0.09033010217279039, 'bull_tp_mult': 1.9035230906544485, 'bull_tsl_mult': 0.6279975646508472, 'bull_time_stop': 172, 'bull_use_sma': False, 'bull_use_ema': True, 'bull_use_atr': True, 'bull_use_adx': False, 'bull_use_spike': False, 'bull_rsi_required': True, 'bear_strategy': 'breakout', 'bear_bb_std_mult': 2.8866895021156314, 'bear_rsi_os': 13, 'bear_rsi_ob': 87, 'bear_adx_thresh': 15.838665802155738, 'bear_atr_min_pct': 0.014195298302096291, 'bear_atr_max_pct': 0.03435736593928617, 'bear_tp_mult': 1.8918898413815628, 'bear_tsl_mult': 0.7322741469965459, 'bear_time_stop': 129, 'bear_use_sma': True, 'bear_use_ema': True, 'bear_use_atr': False, 'bear_use_adx': True, 'bear_use_spike': False, 'bear_rsi_required': False, 'sideways_strategy': 'breakout', 'sideways_bb_std_mult': 3.3232522085255347, 'sideways_rsi_os': 14, 'sideways_rsi_ob': 59, 'sideways_adx_thresh': 27.90609326169809, 'sideways_atr_min_pct': 0.02259526905877438, 'sideways_atr_max_pct': 0.03791212399640157, 'sideways_tp_mult': 1.2263239707237756, 'sideways_tsl_mult': 0.2617402290284218, 'sideways_time_stop': 151, 'sideways_use_sma': False, 'sideways_use_ema': True, 'sideways_use_atr': False, 'sideways_use_adx': False, 'sideways_use_spike': True, 'sideways_rsi_required': True}.
[I 2025-08-30 19:35:37,941] Trial 581 finished with values: [-0.07852350293593868, 0.0784660954754132] and parameters: {'p_sma': 59, 'p_std': 16, 'p_atr': 22, 'p_adx': 21, 'rsi_period': 25, 'ema1': 7, 'ema2': 32, 'slip_atr_k': 0.0881084697414069, 'slip_spread_k': 0.11068026091628999, 'spread_hl_frac': 0.00963897305773227, 'bb_std_mult': 2.202265617303455, 'rsi_os': 47, 'rsi_ob': 80, 'vol_spike': 0.25403436381873223, 'adx_thresh': 34.030761949667934, 'atr_min_pct': 0.01869139989533076, 'atr_max_pct': 0.08684884653428036, 'tp_mult': 2.294294708589182, 'tsl_mult': 0.9403071238435525, 'strategy': 'mean_reversion', 'time_stop': 194, 'use_sma': False, 'use_atr': True, 'use_adx': True, 'use_ema': False, 'use_spike': True, 'rsi_required': False, 'edge_k': 0.08181623241295016, 'edge_cap': 0.4605714268088099, 'bull_strategy': 'mean_reversion', 'bull_bb_std_mult': 2.958088710128227, 'bull_rsi_os': 44, 'bull_rsi_ob': 73, 'bull_adx_thresh': 17.693676654210915, 'bull_atr_min_pct': 0.002104184972825232, 'bull_atr_max_pct': 0.08869618943921616, 'bull_tp_mult': 2.588850875831679, 'bull_tsl_mult': 0.5059579775092224, 'bull_time_stop': 169, 'bull_use_sma': False, 'bull_use_ema': True, 'bull_use_atr': True, 'bull_use_adx': False, 'bull_use_spike': False, 'bull_rsi_required': True, 'bear_strategy': 'breakout', 'bear_bb_std_mult': 0.705315266939728, 'bear_rsi_os': 50, 'bear_rsi_ob': 86, 'bear_adx_thresh': 17.098126653626668, 'bear_atr_min_pct': 0.01406612959106136, 'bear_atr_max_pct': 0.04020522841674058, 'bear_tp_mult': 2.6185079794030353, 'bear_tsl_mult': 0.7078307984421035, 'bear_time_stop': 205, 'bear_use_sma': True, 'bear_use_ema': True, 'bear_use_atr': True, 'bear_use_adx': False, 'bear_use_spike': False, 'bear_rsi_required': True, 'sideways_strategy': 'breakout', 'sideways_bb_std_mult': 3.1415953632294022, 'sideways_rsi_os': 54, 'sideways_rsi_ob': 92, 'sideways_adx_thresh': 27.943832903380496, 'sideways_atr_min_pct': 0.001270120790836529, 'sideways_atr_max_pct': 0.056021360976873213, 'sideways_tp_mult': 2.8434960701028245, 'sideways_tsl_mult': 0.36965326535128235, 'sideways_time_stop': 300, 'sideways_use_sma': True, 'sideways_use_ema': False, 'sideways_use_atr': False, 'sideways_use_adx': False, 'sideways_use_spike': False, 'sideways_rsi_required': True}.
[I 2025-08-30 19:36:14,844] Trial 582 finished with values: [-1000000000.0, 1000000000.0] and parameters: {'p_sma': 9, 'p_std': 30, 'p_atr': 9, 'p_adx': 26, 'rsi_period': 78, 'ema1': 7, 'ema2': 28, 'slip_atr_k': 0.08773266289058904, 'slip_spread_k': 0.11293138276485438, 'spread_hl_frac': 0.027423523679150387, 'bb_std_mult': 2.2000129653412293, 'rsi_os': 16, 'rsi_ob': 81, 'vol_spike': 0.25692879949230285, 'adx_thresh': 15.435694747953846, 'atr_min_pct': 0.02590277334332536, 'atr_max_pct': 0.08627469050961048, 'tp_mult': 2.299472724731276, 'tsl_mult': 0.16529960865901683, 'strategy': 'mean_reversion', 'time_stop': 193, 'use_sma': False, 'use_atr': True, 'use_adx': True, 'use_ema': True, 'use_spike': True, 'rsi_required': False, 'edge_k': 1.4706966686265486, 'edge_cap': 0.7393868588005734, 'bull_strategy': 'mean_reversion', 'bull_bb_std_mult': 2.1319164581218306, 'bull_rsi_os': 30, 'bull_rsi_ob': 72, 'bull_adx_thresh': 33.64417008805924, 'bull_atr_min_pct': 0.002088053388237052, 'bull_atr_max_pct': 0.1215697944462188, 'bull_tp_mult': 1.8939190753861685, 'bull_tsl_mult': 0.5207067397190415, 'bull_time_stop': 32, 'bull_use_sma': False, 'bull_use_ema': False, 'bull_use_atr': True, 'bull_use_adx': False, 'bull_use_spike': False, 'bull_rsi_required': True, 'bear_strategy': 'breakout', 'bear_bb_std_mult': 1.870112797110729, 'bear_rsi_os': 49, 'bear_rsi_ob': 68, 'bear_adx_thresh': 14.878723782372063, 'bear_atr_min_pct': 0.012515305501312319, 'bear_atr_max_pct': 0.10623182918361364, 'bear_tp_mult': 2.612853629873236, 'bear_tsl_mult': 0.79626342144112, 'bear_time_stop': 131, 'bear_use_sma': True, 'bear_use_ema': True, 'bear_use_atr': True, 'bear_use_adx': False, 'bear_use_spike': False, 'bear_rsi_required': False, 'sideways_strategy': 'breakout', 'sideways_bb_std_mult': 3.2570173085351977, 'sideways_rsi_os': 37, 'sideways_rsi_ob': 67, 'sideways_adx_thresh': 18.224375634539637, 'sideways_atr_min_pct': 0.0012837387046270303, 'sideways_atr_max_pct': 0.056970327096948443, 'sideways_tp_mult': 1.1925191429690698, 'sideways_tsl_mult': 0.37304426916747435, 'sideways_time_stop': 162, 'sideways_use_sma': True, 'sideways_use_ema': False, 'sideways_use_atr': False, 'sideways_use_adx': False, 'sideways_use_spike': False, 'sideways_rsi_required': True}.
[I 2025-08-30 19:36:15,424] Trial 583 finished with values: [-1000000000.0, 1000000000.0] and parameters: {'p_sma': 50, 'p_std': 49, 'p_atr': 7, 'p_adx': 22, 'rsi_period': 25, 'ema1': 7, 'ema2': 47, 'slip_atr_k': 0.07749307829021558, 'slip_spread_k': 0.09779841289233057, 'spread_hl_frac': 0.00635968190960251, 'bb_std_mult': 2.3492562705481634, 'rsi_os': 40, 'rsi_ob': 68, 'vol_spike': 0.23975286317783912, 'adx_thresh': 7.457163762585678, 'atr_min_pct': 0.018665367189549278, 'atr_max_pct': 0.08745864904380392, 'tp_mult': 2.2806132419712606, 'tsl_mult': 0.5099453981598159, 'strategy': 'mean_reversion', 'time_stop': 272, 'use_sma': True, 'use_atr': True, 'use_adx': False, 'use_ema': False, 'use_spike': True, 'rsi_required': False, 'edge_k': 0.1020793334140209, 'edge_cap': 0.5437650784794439, 'bull_strategy': 'mean_reversion', 'bull_bb_std_mult': 3.021448960428209, 'bull_rsi_os': 43, 'bull_rsi_ob': 74, 'bull_adx_thresh': 16.518740875125474, 'bull_atr_min_pct': 0.013467674065565415, 'bull_atr_max_pct': 0.12182953840420158, 'bull_tp_mult': 1.7209878481828262, 'bull_tsl_mult': 0.7000247595012995, 'bull_time_stop': 173, 'bull_use_sma': False, 'bull_use_ema': False, 'bull_use_atr': True, 'bull_use_adx': False, 'bull_use_spike': True, 'bull_rsi_required': True, 'bear_strategy': 'mean_reversion', 'bear_bb_std_mult': 1.333798766818485, 'bear_rsi_os': 49, 'bear_rsi_ob': 68, 'bear_adx_thresh': 16.941426419308, 'bear_atr_min_pct': 0.014330757052305798, 'bear_atr_max_pct': 0.03980737889317017, 'bear_tp_mult': 1.2084041446755274, 'bear_tsl_mult': 0.7342254863081982, 'bear_time_stop': 183, 'bear_use_sma': True, 'bear_use_ema': True, 'bear_use_atr': True, 'bear_use_adx': False, 'bear_use_spike': False, 'bear_rsi_required': True, 'sideways_strategy': 'breakout', 'sideways_bb_std_mult': 3.196062165274561, 'sideways_rsi_os': 36, 'sideways_rsi_ob': 60, 'sideways_adx_thresh': 19.857605537980096, 'sideways_atr_min_pct': 0.020096127459247652, 'sideways_atr_max_pct': 0.024305104344727317, 'sideways_tp_mult': 1.173172801413699, 'sideways_tsl_mult': 0.37540381425373726, 'sideways_time_stop': 163, 'sideways_use_sma': False, 'sideways_use_ema': False, 'sideways_use_atr': True, 'sideways_use_adx': True, 'sideways_use_spike': False, 'sideways_rsi_required': True}.
[I 2025-08-30 19:36:15,443] Trial 585 finished with values: [-1000000000.0, 1000000000.0] and parameters: {'p_sma': 9, 'p_std': 57, 'p_atr': 17, 'p_adx': 20, 'rsi_period': 48, 'ema1': 26, 'ema2': 43, 'slip_atr_k': 0.06028455535837845, 'slip_spread_k': 0.7505366083189837, 'spread_hl_frac': 0.022364584722159825, 'bb_std_mult': 3.1420971774085205, 'rsi_os': 48, 'rsi_ob': 68, 'vol_spike': 0.2644978149158442, 'adx_thresh': 33.250943449427865, 'atr_min_pct': 0.02452891269443623, 'atr_max_pct': 0.09574898782486305, 'tp_mult': 2.3552486111153135, 'tsl_mult': 0.8656007296849354, 'strategy': 'mean_reversion', 'time_stop': 202, 'use_sma': True, 'use_atr': True, 'use_adx': False, 'use_ema': False, 'use_spike': True, 'rsi_required': False, 'edge_k': 0.17063330977108981, 'edge_cap': 0.7374776614292402, 'bull_strategy': 'breakout', 'bull_bb_std_mult': 1.9511907875317631, 'bull_rsi_os': 49, 'bull_rsi_ob': 64, 'bull_adx_thresh': 16.365670317815667, 'bull_atr_min_pct': 0.0276203554451084, 'bull_atr_max_pct': 0.12122644125885206, 'bull_tp_mult': 1.2747325983201585, 'bull_tsl_mult': 0.5988225295989746, 'bull_time_stop': 156, 'bull_use_sma': False, 'bull_use_ema': False, 'bull_use_atr': False, 'bull_use_adx': False, 'bull_use_spike': True, 'bull_rsi_required': False, 'bear_strategy': 'mean_reversion', 'bear_bb_std_mult': 1.3348708182871194, 'bear_rsi_os': 11, 'bear_rsi_ob': 78, 'bear_adx_thresh': 8.92272641995003, 'bear_atr_min_pct': 0.013207914629984123, 'bear_atr_max_pct': 0.024916847204796096, 'bear_tp_mult': 1.45673107186392, 'bear_tsl_mult': 0.7913331454515389, 'bear_time_stop': 135, 'bear_use_sma': True, 'bear_use_ema': False, 'bear_use_atr': False, 'bear_use_adx': False, 'bear_use_spike': True, 'bear_rsi_required': True, 'sideways_strategy': 'breakout', 'sideways_bb_std_mult': 2.828566366345325, 'sideways_rsi_os': 46, 'sideways_rsi_ob': 67, 'sideways_adx_thresh': 21.96120141510621, 'sideways_atr_min_pct': 0.019767106814784337, 'sideways_atr_max_pct': 0.027470743575785495, 'sideways_tp_mult': 1.175642779395282, 'sideways_tsl_mult': 0.967623310197576, 'sideways_time_stop': 163, 'sideways_use_sma': False, 'sideways_use_ema': False, 'sideways_use_atr': True, 'sideways_use_adx': True, 'sideways_use_spike': False, 'sideways_rsi_required': False}.
