[I 2025-08-30 19:54:44,428] Trial 748 finished with values: [-1000000000.0, 1000000000.0] and parameters: {'p_sma': 8, 'p_std': 28, 'p_atr': 29, 'p_adx': 20, 'rsi_period': 19, 'ema1': 26, 'ema2': 33, 'slip_atr_k': 0.06357046369055178, 'slip_spread_k': 0.32126027497215065, 'spread_hl_frac': 0.007254354719922095, 'bb_std_mult': 3.5889705641134846, 'rsi_os': 52, 'rsi_ob': 82, 'vol_spike': 0.25008481602961047, 'adx_thresh': 33.97686850790913, 'atr_min_pct': 0.02325804246035323, 'atr_max_pct': 0.08786257357659308, 'tp_mult': 1.01291584230602, 'tsl_mult': 0.912459668594563, 'strategy': 'breakout', 'time_stop': 201, 'use_sma': True, 'use_atr': True, 'use_adx': False, 'use_ema': False, 'use_spike': True, 'rsi_required': True, 'edge_k': 0.13736821841533564, 'edge_cap': 0.13981262864689958, 'bull_strategy': 'breakout', 'bull_bb_std_mult': 1.2583366287439832, 'bull_rsi_os': 32, 'bull_rsi_ob': 50, 'bull_adx_thresh': 16.79505140762758, 'bull_atr_min_pct': 0.002630933041774525, 'bull_atr_max_pct': 0.10035650669124849, 'bull_tp_mult': 1.6448990604562128, 'bull_tsl_mult': 0.7768104947458255, 'bull_time_stop': 201, 'bull_use_sma': False, 'bull_use_ema': True, 'bull_use_atr': True, 'bull_use_adx': True, 'bull_use_spike': False, 'bull_rsi_required': False, 'bear_strategy': 'breakout', 'bear_bb_std_mult': 2.817150783352413, 'bear_rsi_os': 27, 'bear_rsi_ob': 81, 'bear_adx_thresh': 17.686684836691708, 'bear_atr_min_pct': 0.0019224983065559437, 'bear_atr_max_pct': 0.030820336847166244, 'bear_tp_mult': 2.079559442401988, 'bear_tsl_mult': 0.7576610956002262, 'bear_time_stop': 37, 'bear_use_sma': False, 'bear_use_ema': False, 'bear_use_atr': False, 'bear_use_adx': True, 'bear_use_spike': False, 'bear_rsi_required': True, 'sideways_strategy': 'breakout', 'sideways_bb_std_mult': 3.1224582958162546, 'sideways_rsi_os': 14, 'sideways_rsi_ob': 88, 'sideways_adx_thresh': 22.162806943337056, 'sideways_atr_min_pct': 0.006642724134208763, 'sideways_atr_max_pct': 0.14204639012439657, 'sideways_tp_mult': 1.2082997059282954, 'sideways_tsl_mult': 0.5277112426281163, 'sideways_time_stop': 155, 'sideways_use_sma': False, 'sideways_use_ema': False, 'sideways_use_atr': True, 'sideways_use_adx': False, 'sideways_use_spike': False, 'sideways_rsi_required': False}.
[I 2025-08-30 19:54:44,811] Trial 747 finished with values: [-1000000000.0, 1000000000.0] and parameters: {'p_sma': 8, 'p_std': 31, 'p_atr': 24, 'p_adx': 20, 'rsi_period': 20, 'ema1': 18, 'ema2': 29, 'slip_atr_k': 0.06540766172226664, 'slip_spread_k': 0.6918515543077497, 'spread_hl_frac': 0.011397044490118607, 'bb_std_mult': 1.897502859648588, 'rsi_os': 11, 'rsi_ob': 86, 'vol_spike': 0.27155699465244487, 'adx_thresh': 17.5272003479422, 'atr_min_pct': 0.01570924313142698, 'atr_max_pct': 0.07849066303356261, 'tp_mult': 1.369818686010389, 'tsl_mult': 0.8226902273100339, 'strategy': 'mean_reversion', 'time_stop': 222, 'use_sma': True, 'use_atr': True, 'use_adx': False, 'use_ema': False, 'use_spike': True, 'rsi_required': True, 'edge_k': 0.1425284065373857, 'edge_cap': 0.6546915766341128, 'bull_strategy': 'breakout', 'bull_bb_std_mult': 3.2161388451137345, 'bull_rsi_os': 32, 'bull_rsi_ob': 78, 'bull_adx_thresh': 16.827623699536645, 'bull_atr_min_pct': 0.0026427202959199356, 'bull_atr_max_pct': 0.03395675963006741, 'bull_tp_mult': 2.443147562599625, 'bull_tsl_mult': 0.08594038568421136, 'bull_time_stop': 246, 'bull_use_sma': False, 'bull_use_ema': True, 'bull_use_atr': True, 'bull_use_adx': True, 'bull_use_spike': False, 'bull_rsi_required': False, 'bear_strategy': 'breakout', 'bear_bb_std_mult': 2.834264553355509, 'bear_rsi_os': 49, 'bear_rsi_ob': 95, 'bear_adx_thresh': 26.136509919440844, 'bear_atr_min_pct': 0.02094565486626125, 'bear_atr_max_pct': 0.03187944529355199, 'bear_tp_mult': 2.7188831158515034, 'bear_tsl_mult': 0.7602903785851916, 'bear_time_stop': 85, 'bear_use_sma': False, 'bear_use_ema': False, 'bear_use_atr': False, 'bear_use_adx': False, 'bear_use_spike': False, 'bear_rsi_required': True, 'sideways_strategy': 'breakout', 'sideways_bb_std_mult': 3.1279617762727288, 'sideways_rsi_os': 33, 'sideways_rsi_ob': 61, 'sideways_adx_thresh': 21.899861485892842, 'sideways_atr_min_pct': 0.003716203176539184, 'sideways_atr_max_pct': 0.13798335983844906, 'sideways_tp_mult': 1.0519645497036543, 'sideways_tsl_mult': 0.969278799354742, 'sideways_time_stop': 154, 'sideways_use_sma': False, 'sideways_use_ema': False, 'sideways_use_atr': True, 'sideways_use_adx': False, 'sideways_use_spike': True, 'sideways_rsi_required': False}.
[I 2025-08-30 19:54:47,289] Trial 749 finished with values: [-0.07911451900530442, 0.07908486715169455] and parameters: {'p_sma': 29, 'p_std': 31, 'p_atr': 9, 'p_adx': 21, 'rsi_period': 16, 'ema1': 26, 'ema2': 33, 'slip_atr_k': 0.06373554946060972, 'slip_spread_k': 0.3227360627170639, 'spread_hl_frac': 0.02374170858906794, 'bb_std_mult': 0.529751676883057, 'rsi_os': 52, 'rsi_ob': 82, 'vol_spike': 0.15102877235637657, 'adx_thresh': 17.61758040223532, 'atr_min_pct': 0.025628700490844286, 'atr_max_pct': 0.05816729900212558, 'tp_mult': 1.8899205810770239, 'tsl_mult': 0.25815253371262514, 'strategy': 'breakout', 'time_stop': 234, 'use_sma': False, 'use_atr': True, 'use_adx': True, 'use_ema': False, 'use_spike': True, 'rsi_required': False, 'edge_k': 0.5536381363190099, 'edge_cap': 0.49620265648934475, 'bull_strategy': 'breakout', 'bull_bb_std_mult': 2.940136980158581, 'bull_rsi_os': 10, 'bull_rsi_ob': 92, 'bull_adx_thresh': 19.77153835531826, 'bull_atr_min_pct': 0.005944625792594764, 'bull_atr_max_pct': 0.03680743050648297, 'bull_tp_mult': 2.451130567478487, 'bull_tsl_mult': 0.040032414493808566, 'bull_time_stop': 190, 'bull_use_sma': False, 'bull_use_ema': True, 'bull_use_atr': True, 'bull_use_adx': False, 'bull_use_spike': False, 'bull_rsi_required': False, 'bear_strategy': 'breakout', 'bear_bb_std_mult': 2.822513606818788, 'bear_rsi_os': 49, 'bear_rsi_ob': 92, 'bear_adx_thresh': 17.639994862511404, 'bear_atr_min_pct': 0.014762479322312843, 'bear_atr_max_pct': 0.031960867394966, 'bear_tp_mult': 1.2487697244249014, 'bear_tsl_mult': 0.7403041905334399, 'bear_time_stop': 186, 'bear_use_sma': False, 'bear_use_ema': True, 'bear_use_atr': False, 'bear_use_adx': True, 'bear_use_spike': False, 'bear_rsi_required': True, 'sideways_strategy': 'breakout', 'sideways_bb_std_mult': 3.1161327607761624, 'sideways_rsi_os': 38, 'sideways_rsi_ob': 84, 'sideways_adx_thresh': 23.974877892260473, 'sideways_atr_min_pct': 0.001301838632999621, 'sideways_atr_max_pct': 0.14704334093188584, 'sideways_tp_mult': 1.217617964048634, 'sideways_tsl_mult': 0.8819933089771772, 'sideways_time_stop': 161, 'sideways_use_sma': False, 'sideways_use_ema': False, 'sideways_use_atr': True, 'sideways_use_adx': False, 'sideways_use_spike': False, 'sideways_rsi_required': False}.
[I 2025-08-30 19:54:47,988] Trial 751 finished with values: [-1000000000.0, 1000000000.0] and parameters: {'p_sma': 23, 'p_std': 34, 'p_atr': 8, 'p_adx': 21, 'rsi_period': 24, 'ema1': 25, 'ema2': 44, 'slip_atr_k': 0.15416380596378176, 'slip_spread_k': 0.16924785138804618, 'spread_hl_frac': 0.024770969029777004, 'bb_std_mult': 2.112425094877544, 'rsi_os': 51, 'rsi_ob': 69, 'vol_spike': 0.23492492265814519, 'adx_thresh': 34.99815540023205, 'atr_min_pct': 0.004787881556215611, 'atr_max_pct': 0.060621385258090014, 'tp_mult': 1.8815655210625124, 'tsl_mult': 0.24016305582081787, 'strategy': 'mean_reversion', 'time_stop': 191, 'use_sma': False, 'use_atr': True, 'use_adx': True, 'use_ema': False, 'use_spike': True, 'rsi_required': False, 'edge_k': 0.71264808214787, 'edge_cap': 0.5694416590144491, 'bull_strategy': 'mean_reversion', 'bull_bb_std_mult': 2.9388963318082757, 'bull_rsi_os': 52, 'bull_rsi_ob': 69, 'bull_adx_thresh': 19.503893930435744, 'bull_atr_min_pct': 0.00577167273957239, 'bull_atr_max_pct': 0.11569655059113529, 'bull_tp_mult': 1.8079399526270834, 'bull_tsl_mult': 0.45135238734848476, 'bull_time_stop': 191, 'bull_use_sma': False, 'bull_use_ema': True, 'bull_use_atr': False, 'bull_use_adx': False, 'bull_use_spike': False, 'bull_rsi_required': False, 'bear_strategy': 'breakout', 'bear_bb_std_mult': 1.8715246960161203, 'bear_rsi_os': 54, 'bear_rsi_ob': 75, 'bear_adx_thresh': 10.212781903777284, 'bear_atr_min_pct': 0.021360356126595897, 'bear_atr_max_pct': 0.13130981967831679, 'bear_tp_mult': 2.6944118990966683, 'bear_tsl_mult': 0.7361450582191814, 'bear_time_stop': 170, 'bear_use_sma': True, 'bear_use_ema': True, 'bear_use_atr': False, 'bear_use_adx': False, 'bear_use_spike': False, 'bear_rsi_required': False, 'sideways_strategy': 'breakout', 'sideways_bb_std_mult': 3.244807989170859, 'sideways_rsi_os': 38, 'sideways_rsi_ob': 49, 'sideways_adx_thresh': 32.47187063305983, 'sideways_atr_min_pct': 0.0011297248284661277, 'sideways_atr_max_pct': 0.11319320252930096, 'sideways_tp_mult': 1.0921270984079914, 'sideways_tsl_mult': 0.970233177987875, 'sideways_time_stop': 160, 'sideways_use_sma': False, 'sideways_use_ema': False, 'sideways_use_atr': True, 'sideways_use_adx': False, 'sideways_use_spike': False, 'sideways_rsi_required': False}.
[I 2025-08-30 19:54:48,993] Trial 754 finished with values: [-1000000000.0, 1000000000.0] and parameters: {'p_sma': 45, 'p_std': 47, 'p_atr': 15, 'p_adx': 19, 'rsi_period': 34, 'ema1': 6, 'ema2': 35, 'slip_atr_k': 0.028420136979065397, 'slip_spread_k': 0.8056882879557459, 'spread_hl_frac': 0.027858523042777177, 'bb_std_mult': 2.9987382177300708, 'rsi_os': 49, 'rsi_ob': 80, 'vol_spike': 0.18848962404110417, 'adx_thresh': 31.84488765960726, 'atr_min_pct': 0.024103097183339552, 'atr_max_pct': 0.0102514423809974, 'tp_mult': 2.6409829670319147, 'tsl_mult': 0.5563981430657113, 'strategy': 'mean_reversion', 'time_stop': 194, 'use_sma': False, 'use_atr': True, 'use_adx': True, 'use_ema': False, 'use_spike': True, 'rsi_required': False, 'edge_k': 1.2789082248634571, 'edge_cap': 0.480379955098156, 'bull_strategy': 'mean_reversion', 'bull_bb_std_mult': 3.054103747902739, 'bull_rsi_os': 31, 'bull_rsi_ob': 47, 'bull_adx_thresh': 12.185338364296474, 'bull_atr_min_pct': 0.0016909397898672786, 'bull_atr_max_pct': 0.04739894889722201, 'bull_tp_mult': 1.0650633005784695, 'bull_tsl_mult': 0.5605596978711653, 'bull_time_stop': 219, 'bull_use_sma': False, 'bull_use_ema': True, 'bull_use_atr': False, 'bull_use_adx': False, 'bull_use_spike': False, 'bull_rsi_required': True, 'bear_strategy': 'breakout', 'bear_bb_std_mult': 2.6938197558017922, 'bear_rsi_os': 41, 'bear_rsi_ob': 56, 'bear_adx_thresh': 16.556217706945738, 'bear_atr_min_pct': 0.02465111768260741, 'bear_atr_max_pct': 0.05863877925985722, 'bear_tp_mult': 2.6635449147372396, 'bear_tsl_mult': 0.6031810323288483, 'bear_time_stop': 200, 'bear_use_sma': True, 'bear_use_ema': True, 'bear_use_atr': False, 'bear_use_adx': False, 'bear_use_spike': False, 'bear_rsi_required': False, 'sideways_strategy': 'breakout', 'sideways_bb_std_mult': 3.2311477903394668, 'sideways_rsi_os': 19, 'sideways_rsi_ob': 59, 'sideways_adx_thresh': 31.176373712322174, 'sideways_atr_min_pct': 0.009872118155936955, 'sideways_atr_max_pct': 0.06276710856988929, 'sideways_tp_mult': 1.32880527414963, 'sideways_tsl_mult': 0.9036365776868669, 'sideways_time_stop': 34, 'sideways_use_sma': False, 'sideways_use_ema': True, 'sideways_use_atr': True, 'sideways_use_adx': False, 'sideways_use_spike': False, 'sideways_rsi_required': True}.
[I 2025-08-30 19:55:12,656] Trial 750 finished with values: [-0.11213980699444981, 0.11210672838753843] and parameters: {'p_sma': 27, 'p_std': 32, 'p_atr': 13, 'p_adx': 26, 'rsi_period': 18, 'ema1': 25, 'ema2': 33, 'slip_atr_k': 0.1561920765445075, 'slip_spread_k': 0.8166887221053791, 'spread_hl_frac': 0.025058273086728235, 'bb_std_mult': 1.5329240914924034, 'rsi_os': 38, 'rsi_ob': 86, 'vol_spike': 0.2736644888953261, 'adx_thresh': 34.162854793155546, 'atr_min_pct': 0.005449224356482854, 'atr_max_pct': 0.1296156969928064, 'tp_mult': 2.259578751160379, 'tsl_mult': 0.5607203159998582, 'strategy': 'breakout', 'time_stop': 192, 'use_sma': False, 'use_atr': True, 'use_adx': True, 'use_ema': False, 'use_spike': True, 'rsi_required': False, 'edge_k': 0.1396396569192274, 'edge_cap': 0.8161361953896473, 'bull_strategy': 'breakout', 'bull_bb_std_mult': 2.9696660657096388, 'bull_rsi_os': 31, 'bull_rsi_ob': 70, 'bull_adx_thresh': 19.574529928367728, 'bull_atr_min_pct': 0.024202569670552884, 'bull_atr_max_pct': 0.10144570879423592, 'bull_tp_mult': 2.9631432701829934, 'bull_tsl_mult': 0.4487985086127481, 'bull_time_stop': 220, 'bull_use_sma': False, 'bull_use_ema': True, 'bull_use_atr': False, 'bull_use_adx': False, 'bull_use_spike': False, 'bull_rsi_required': False, 'bear_strategy': 'breakout', 'bear_bb_std_mult': 2.7936512503491917, 'bear_rsi_os': 49, 'bear_rsi_ob': 75, 'bear_adx_thresh': 17.618803717886863, 'bear_atr_min_pct': 0.0019304093629972877, 'bear_atr_max_pct': 0.08997185815179608, 'bear_tp_mult': 2.5169613620885656, 'bear_tsl_mult': 0.733471919951531, 'bear_time_stop': 186, 'bear_use_sma': True, 'bear_use_ema': True, 'bear_use_atr': False, 'bear_use_adx': True, 'bear_use_spike': False, 'bear_rsi_required': False, 'sideways_strategy': 'breakout', 'sideways_bb_std_mult': 3.246470094803585, 'sideways_rsi_os': 38, 'sideways_rsi_ob': 84, 'sideways_adx_thresh': 22.38311419788601, 'sideways_atr_min_pct': 0.001235909151920195, 'sideways_atr_max_pct': 0.14714476028636841, 'sideways_tp_mult': 1.2274626324378577, 'sideways_tsl_mult': 0.9639341857093199, 'sideways_time_stop': 160, 'sideways_use_sma': False, 'sideways_use_ema': False, 'sideways_use_atr': True, 'sideways_use_adx': False, 'sideways_use_spike': False, 'sideways_rsi_required': False}.
[I 2025-08-30 19:55:13,544] Trial 752 finished with values: [-0.058454470264316494, 0.05844196109994974] and parameters: {'p_sma': 27, 'p_std': 34, 'p_atr': 26, 'p_adx': 21, 'rsi_period': 24, 'ema1': 6, 'ema2': 33, 'slip_atr_k': 0.026822542799559368, 'slip_spread_k': 0.06736799677962668, 'spread_hl_frac': 0.02509131035703021, 'bb_std_mult': 2.1096654344703674, 'rsi_os': 37, 'rsi_ob': 93, 'vol_spike': 0.2568561516982409, 'adx_thresh': 34.49976441185035, 'atr_min_pct': 0.0255069949417908, 'atr_max_pct': 0.030803394598515957, 'tp_mult': 2.243844361825541, 'tsl_mult': 0.8552487362889907, 'strategy': 'breakout', 'time_stop': 195, 'use_sma': False, 'use_atr': True, 'use_adx': True, 'use_ema': False, 'use_spike': True, 'rsi_required': False, 'edge_k': 0.002408986670732985, 'edge_cap': 0.9689913208660678, 'bull_strategy': 'mean_reversion', 'bull_bb_std_mult': 3.0125212774286245, 'bull_rsi_os': 54, 'bull_rsi_ob': 47, 'bull_adx_thresh': 12.154791130350649, 'bull_atr_min_pct': 0.006059975457707558, 'bull_atr_max_pct': 0.11676020580536865, 'bull_tp_mult': 2.684170345264062, 'bull_tsl_mult': 0.8521707819930271, 'bull_time_stop': 102, 'bull_use_sma': False, 'bull_use_ema': True, 'bull_use_atr': False, 'bull_use_adx': False, 'bull_use_spike': False, 'bull_rsi_required': True, 'bear_strategy': 'breakout', 'bear_bb_std_mult': 2.6709174873782198, 'bear_rsi_os': 14, 'bear_rsi_ob': 75, 'bear_adx_thresh': 17.949197511530155, 'bear_atr_min_pct': 0.01503112765598594, 'bear_atr_max_pct': 0.027590049245623683, 'bear_tp_mult': 1.2469160940531743, 'bear_tsl_mult': 0.737896251901222, 'bear_time_stop': 171, 'bear_use_sma': True, 'bear_use_ema': True, 'bear_use_atr': False, 'bear_use_adx': True, 'bear_use_spike': False, 'bear_rsi_required': False, 'sideways_strategy': 'breakout', 'sideways_bb_std_mult': 3.2273746585215766, 'sideways_rsi_os': 40, 'sideways_rsi_ob': 62, 'sideways_adx_thresh': 20.971117583681018, 'sideways_atr_min_pct': 0.0012717751539022184, 'sideways_atr_max_pct': 0.11278826568932993, 'sideways_tp_mult': 1.0928947696222848, 'sideways_tsl_mult': 0.899564790267638, 'sideways_time_stop': 164, 'sideways_use_sma': False, 'sideways_use_ema': True, 'sideways_use_atr': True, 'sideways_use_adx': False, 'sideways_use_spike': False, 'sideways_rsi_required': True}.
[I 2025-08-30 19:55:15,335] Trial 753 finished with values: [-1000000000.0, 1000000000.0] and parameters: {'p_sma': 5, 'p_std': 34, 'p_atr': 19, 'p_adx': 21, 'rsi_period': 35, 'ema1': 25, 'ema2': 44, 'slip_atr_k': 0.158172723097474, 'slip_spread_k': 0.8038733297051377, 'spread_hl_frac': 0.024927161826289023, 'bb_std_mult': 2.619610899249156, 'rsi_os': 38, 'rsi_ob': 79, 'vol_spike': 0.2564428293730864, 'adx_thresh': 34.99458305709845, 'atr_min_pct': 0.020304246882090985, 'atr_max_pct': 0.031073273668728293, 'tp_mult': 2.8218392660942953, 'tsl_mult': 0.5617213695833414, 'strategy': 'mean_reversion', 'time_stop': 192, 'use_sma': False, 'use_atr': True, 'use_adx': True, 'use_ema': False, 'use_spike': True, 'rsi_required': False, 'edge_k': 0.7139543018425847, 'edge_cap': 0.9703723012095815, 'bull_strategy': 'mean_reversion', 'bull_bb_std_mult': 3.0430572218115257, 'bull_rsi_os': 30, 'bull_rsi_ob': 69, 'bull_adx_thresh': 18.186556011924065, 'bull_atr_min_pct': 0.0015420800339261374, 'bull_atr_max_pct': 0.08444936461827453, 'bull_tp_mult': 2.068924667541026, 'bull_tsl_mult': 0.6007216268440972, 'bull_time_stop': 221, 'bull_use_sma': False, 'bull_use_ema': True, 'bull_use_atr': False, 'bull_use_adx': False, 'bull_use_spike': False, 'bull_rsi_required': True, 'bear_strategy': 'breakout', 'bear_bb_std_mult': 2.7172184460891406, 'bear_rsi_os': 35, 'bear_rsi_ob': 75, 'bear_adx_thresh': 16.54097535853677, 'bear_atr_min_pct': 0.02801649114667905, 'bear_atr_max_pct': 0.13197881489266736, 'bear_tp_mult': 2.7739928038890995, 'bear_tsl_mult': 0.7288420491150879, 'bear_time_stop': 169, 'bear_use_sma': True, 'bear_use_ema': True, 'bear_use_atr': False, 'bear_use_adx': False, 'bear_use_spike': False, 'bear_rsi_required': False, 'sideways_strategy': 'breakout', 'sideways_bb_std_mult': 3.2494276670340643, 'sideways_rsi_os': 50, 'sideways_rsi_ob': 59, 'sideways_adx_thresh': 19.208439967427545, 'sideways_atr_min_pct': 0.0021615300265405255, 'sideways_atr_max_pct': 0.0953572510275557, 'sideways_tp_mult': 1.0900649629551682, 'sideways_tsl_mult': 0.9031333669836525, 'sideways_time_stop': 166, 'sideways_use_sma': False, 'sideways_use_ema': True, 'sideways_use_atr': True, 'sideways_use_adx': False, 'sideways_use_spike': False, 'sideways_rsi_required': True}.
[I 2025-08-30 19:55:22,678] Trial 755 finished with values: [-1000000000.0, 1000000000.0] and parameters: {'p_sma': 6, 'p_std': 32, 'p_atr': 10, 'p_adx': 29, 'rsi_period': 47, 'ema1': 23, 'ema2': 32, 'slip_atr_k': 0.13885040544365004, 'slip_spread_k': 0.19882005945161882, 'spread_hl_frac': 0.017768589884100846, 'bb_std_mult': 1.5205406825028978, 'rsi_os': 49, 'rsi_ob': 81, 'vol_spike': 0.2565856598470212, 'adx_thresh': 34.29475024259325, 'atr_min_pct': 0.023332152941401476, 'atr_max_pct': 0.10104198924685678, 'tp_mult': 2.2482364478987846, 'tsl_mult': 0.851256703380378, 'strategy': 'mean_reversion', 'time_stop': 289, 'use_sma': False, 'use_atr': True, 'use_adx': True, 'use_ema': False, 'use_spike': True, 'rsi_required': False, 'edge_k': 1.895385849885516, 'edge_cap': 0.2894905347680452, 'bull_strategy': 'mean_reversion', 'bull_bb_std_mult': 2.797712406468438, 'bull_rsi_os': 30, 'bull_rsi_ob': 46, 'bull_adx_thresh': 18.229074566146796, 'bull_atr_min_pct': 0.024227313836535914, 'bull_atr_max_pct': 0.11960770472609497, 'bull_tp_mult': 2.689232992109473, 'bull_tsl_mult': 0.5925487712123961, 'bull_time_stop': 286, 'bull_use_sma': False, 'bull_use_ema': True, 'bull_use_atr': True, 'bull_use_adx': False, 'bull_use_spike': False, 'bull_rsi_required': True, 'bear_strategy': 'breakout', 'bear_bb_std_mult': 1.42535264645872, 'bear_rsi_os': 13, 'bear_rsi_ob': 76, 'bear_adx_thresh': 18.22054763142959, 'bear_atr_min_pct': 0.016187220910081762, 'bear_atr_max_pct': 0.037329412416807095, 'bear_tp_mult': 2.7718050963963994, 'bear_tsl_mult': 0.4830453473855094, 'bear_time_stop': 72, 'bear_use_sma': True, 'bear_use_ema': True, 'bear_use_atr': False, 'bear_use_adx': False, 'bear_use_spike': False, 'bear_rsi_required': True, 'sideways_strategy': 'breakout', 'sideways_bb_std_mult': 3.0218195900242617, 'sideways_rsi_os': 37, 'sideways_rsi_ob': 62, 'sideways_adx_thresh': 25.773200875764758, 'sideways_atr_min_pct': 5.512870308711608e-05, 'sideways_atr_max_pct': 0.14699167260446472, 'sideways_tp_mult': 1.1643334891037438, 'sideways_tsl_mult': 0.2881379294438069, 'sideways_time_stop': 131, 'sideways_use_sma': False, 'sideways_use_ema': True, 'sideways_use_atr': True, 'sideways_use_adx': False, 'sideways_use_spike': False, 'sideways_rsi_required': True}.
