[I 2025-08-30 19:20:20,461] Trial 450 finished with values: [-1000000000.0, 1000000000.0] and parameters: {'p_sma': 43, 'p_std': 39, 'p_atr': 8, 'p_adx': 16, 'rsi_period': 79, 'ema1': 27, 'ema2': 31, 'slip_atr_k': 0.08862434619693194, 'slip_spread_k': 0.8343060917952552, 'spread_hl_frac': 0.0058906113007718905, 'bb_std_mult': 1.494153057564242, 'rsi_os': 49, 'rsi_ob': 81, 'vol_spike': 0.2108774811343495, 'adx_thresh': 9.640394912406256, 'atr_min_pct': 0.02837009560625917, 'atr_max_pct': 0.09690324623891379, 'tp_mult': 2.293874361475142, 'tsl_mult': 0.17659651648218166, 'strategy': 'breakout', 'time_stop': 97, 'use_sma': False, 'use_atr': True, 'use_adx': True, 'use_ema': True, 'use_spike': True, 'rsi_required': False, 'edge_k': 0.04104136498645235, 'edge_cap': 0.5334399530313869, 'bull_strategy': 'breakout', 'bull_bb_std_mult': 3.5147660971761643, 'bull_rsi_os': 30, 'bull_rsi_ob': 73, 'bull_adx_thresh': 18.621680433907454, 'bull_atr_min_pct': 0.008836718960167259, 'bull_atr_max_pct': 0.09865637658897648, 'bull_tp_mult': 2.735800767488206, 'bull_tsl_mult': 0.1744831406537315, 'bull_time_stop': 41, 'bull_use_sma': False, 'bull_use_ema': False, 'bull_use_atr': True, 'bull_use_adx': True, 'bull_use_spike': True, 'bull_rsi_required': True, 'bear_strategy': 'mean_reversion', 'bear_bb_std_mult': 2.9306592461196144, 'bear_rsi_os': 46, 'bear_rsi_ob': 72, 'bear_adx_thresh': 17.571906079228096, 'bear_atr_min_pct': 0.005249251295356246, 'bear_atr_max_pct': 0.09018853910993371, 'bear_tp_mult': 1.1841438550267487, 'bear_tsl_mult': 0.7172897351885951, 'bear_time_stop': 243, 'bear_use_sma': True, 'bear_use_ema': True, 'bear_use_atr': True, 'bear_use_adx': True, 'bear_use_spike': False, 'bear_rsi_required': True, 'sideways_strategy': 'breakout', 'sideways_bb_std_mult': 2.1925904095874476, 'sideways_rsi_os': 36, 'sideways_rsi_ob': 61, 'sideways_adx_thresh': 24.704244412634015, 'sideways_atr_min_pct': 0.02981041747227351, 'sideways_atr_max_pct': 0.14279248735599495, 'sideways_tp_mult': 1.1153711513827078, 'sideways_tsl_mult': 0.969301443161048, 'sideways_time_stop': 49, 'sideways_use_sma': False, 'sideways_use_ema': False, 'sideways_use_atr': True, 'sideways_use_adx': True, 'sideways_use_spike': False, 'sideways_rsi_required': False}.
[I 2025-08-30 19:20:54,729] Trial 453 finished with values: [-1000000000.0, 1000000000.0] and parameters: {'p_sma': 9, 'p_std': 44, 'p_atr': 9, 'p_adx': 20, 'rsi_period': 21, 'ema1': 27, 'ema2': 20, 'slip_atr_k': 0.0004828381956838296, 'slip_spread_k': 0.48660349143207643, 'spread_hl_frac': 0.026977956539731424, 'bb_std_mult': 2.078457268840847, 'rsi_os': 49, 'rsi_ob': 87, 'vol_spike': 0.010566923041593623, 'adx_thresh': 15.07196412587176, 'atr_min_pct': 0.0166893181756314, 'atr_max_pct': 0.09671154059974932, 'tp_mult': 2.163460010399598, 'tsl_mult': 0.8247043408058217, 'strategy': 'mean_reversion', 'time_stop': 88, 'use_sma': False, 'use_atr': False, 'use_adx': True, 'use_ema': False, 'use_spike': True, 'rsi_required': False, 'edge_k': 1.1670360699580724, 'edge_cap': 0.5412735228205757, 'bull_strategy': 'mean_reversion', 'bull_bb_std_mult': 2.8934069179929653, 'bull_rsi_os': 31, 'bull_rsi_ob': 48, 'bull_adx_thresh': 6.7698225016086475, 'bull_atr_min_pct': 0.0022795788667386687, 'bull_atr_max_pct': 0.09864819399055949, 'bull_tp_mult': 2.6890406183507327, 'bull_tsl_mult': 0.17891523876806475, 'bull_time_stop': 188, 'bull_use_sma': False, 'bull_use_ema': False, 'bull_use_atr': True, 'bull_use_adx': False, 'bull_use_spike': False, 'bull_rsi_required': True, 'bear_strategy': 'mean_reversion', 'bear_bb_std_mult': 3.5551413779282264, 'bear_rsi_os': 28, 'bear_rsi_ob': 64, 'bear_adx_thresh': 31.099364050808152, 'bear_atr_min_pct': 0.020822952954825814, 'bear_atr_max_pct': 0.06005027265030424, 'bear_tp_mult': 1.8246692126895536, 'bear_tsl_mult': 0.11552202985806281, 'bear_time_stop': 40, 'bear_use_sma': True, 'bear_use_ema': True, 'bear_use_atr': False, 'bear_use_adx': False, 'bear_use_spike': False, 'bear_rsi_required': True, 'sideways_strategy': 'breakout', 'sideways_bb_std_mult': 3.0588612784031275, 'sideways_rsi_os': 55, 'sideways_rsi_ob': 58, 'sideways_adx_thresh': 20.530800427955057, 'sideways_atr_min_pct': 0.019094379497009213, 'sideways_atr_max_pct': 0.14291748525932327, 'sideways_tp_mult': 1.1701459018585452, 'sideways_tsl_mult': 0.9692026869933041, 'sideways_time_stop': 14, 'sideways_use_sma': False, 'sideways_use_ema': False, 'sideways_use_atr': True, 'sideways_use_adx': False, 'sideways_use_spike': False, 'sideways_rsi_required': True}.
[I 2025-08-30 19:20:55,415] Trial 452 finished with values: [-1000000000.0, 1000000000.0] and parameters: {'p_sma': 59, 'p_std': 30, 'p_atr': 16, 'p_adx': 16, 'rsi_period': 79, 'ema1': 27, 'ema2': 30, 'slip_atr_k': 0.00012613114263038128, 'slip_spread_k': 0.7940490925687618, 'spread_hl_frac': 0.0053892195882889946, 'bb_std_mult': 1.499044960538451, 'rsi_os': 49, 'rsi_ob': 78, 'vol_spike': 0.2665365322365927, 'adx_thresh': 33.19957180188658, 'atr_min_pct': 0.008885979232124294, 'atr_max_pct': 0.09654909374533353, 'tp_mult': 2.223384704839438, 'tsl_mult': 0.2826542958494015, 'strategy': 'breakout', 'time_stop': 25, 'use_sma': False, 'use_atr': True, 'use_adx': True, 'use_ema': False, 'use_spike': True, 'rsi_required': False, 'edge_k': 0.06731322469941704, 'edge_cap': 0.5218549038125265, 'bull_strategy': 'breakout', 'bull_bb_std_mult': 3.1310217569215197, 'bull_rsi_os': 30, 'bull_rsi_ob': 48, 'bull_adx_thresh': 6.8047978668029145, 'bull_atr_min_pct': 0.0036915361114163636, 'bull_atr_max_pct': 0.09816879935317163, 'bull_tp_mult': 1.4114000151325428, 'bull_tsl_mult': 0.3751660944654678, 'bull_time_stop': 157, 'bull_use_sma': False, 'bull_use_ema': False, 'bull_use_atr': True, 'bull_use_adx': True, 'bull_use_spike': True, 'bull_rsi_required': True, 'bear_strategy': 'mean_reversion', 'bear_bb_std_mult': 1.844914270099855, 'bear_rsi_os': 28, 'bear_rsi_ob': 64, 'bear_adx_thresh': 10.066965549393393, 'bear_atr_min_pct': 0.010125493879594119, 'bear_atr_max_pct': 0.08066102043984083, 'bear_tp_mult': 1.8245398074605899, 'bear_tsl_mult': 0.12033626962701505, 'bear_time_stop': 242, 'bear_use_sma': True, 'bear_use_ema': True, 'bear_use_atr': False, 'bear_use_adx': True, 'bear_use_spike': False, 'bear_rsi_required': True, 'sideways_strategy': 'breakout', 'sideways_bb_std_mult': 2.623114671275106, 'sideways_rsi_os': 34, 'sideways_rsi_ob': 58, 'sideways_adx_thresh': 20.532014795625837, 'sideways_atr_min_pct': 0.0005671854119650903, 'sideways_atr_max_pct': 0.14247190937017715, 'sideways_tp_mult': 1.5889834781964207, 'sideways_tsl_mult': 0.02218337239035889, 'sideways_time_stop': 14, 'sideways_use_sma': False, 'sideways_use_ema': False, 'sideways_use_atr': True, 'sideways_use_adx': True, 'sideways_use_spike': False, 'sideways_rsi_required': False}.
[I 2025-08-30 19:20:55,696] Trial 451 finished with values: [-0.018637947870535188, 0.01885663499435085] and parameters: {'p_sma': 17, 'p_std': 29, 'p_atr': 9, 'p_adx': 30, 'rsi_period': 73, 'ema1': 27, 'ema2': 43, 'slip_atr_k': 0.08613900506517945, 'slip_spread_k': 0.629191508760254, 'spread_hl_frac': 0.004826431311963149, 'bb_std_mult': 1.46143391601548, 'rsi_os': 49, 'rsi_ob': 65, 'vol_spike': 0.04586641781838004, 'adx_thresh': 15.094506061640871, 'atr_min_pct': 0.020995595697563617, 'atr_max_pct': 0.09629430792320556, 'tp_mult': 2.299686890349009, 'tsl_mult': 0.8221239136304673, 'strategy': 'breakout', 'time_stop': 183, 'use_sma': False, 'use_atr': True, 'use_adx': True, 'use_ema': True, 'use_spike': True, 'rsi_required': False, 'edge_k': 0.5393783832174858, 'edge_cap': 0.5290409724639149, 'bull_strategy': 'breakout', 'bull_bb_std_mult': 3.4982731326842846, 'bull_rsi_os': 30, 'bull_rsi_ob': 48, 'bull_adx_thresh': 17.479904958484788, 'bull_atr_min_pct': 0.0009275031474647552, 'bull_atr_max_pct': 0.03366715268652938, 'bull_tp_mult': 2.67621896756165, 'bull_tsl_mult': 0.18096556867572877, 'bull_time_stop': 40, 'bull_use_sma': False, 'bull_use_ema': False, 'bull_use_atr': True, 'bull_use_adx': True, 'bull_use_spike': True, 'bull_rsi_required': True, 'bear_strategy': 'mean_reversion', 'bear_bb_std_mult': 1.8413899757720058, 'bear_rsi_os': 52, 'bear_rsi_ob': 83, 'bear_adx_thresh': 30.04123203425834, 'bear_atr_min_pct': 0.016987463983690027, 'bear_atr_max_pct': 0.060829037779681246, 'bear_tp_mult': 2.4077740385759734, 'bear_tsl_mult': 0.8348725062165692, 'bear_time_stop': 221, 'bear_use_sma': True, 'bear_use_ema': True, 'bear_use_atr': False, 'bear_use_adx': True, 'bear_use_spike': False, 'bear_rsi_required': True, 'sideways_strategy': 'breakout', 'sideways_bb_std_mult': 2.2559706829176775, 'sideways_rsi_os': 38, 'sideways_rsi_ob': 58, 'sideways_adx_thresh': 20.58861423724096, 'sideways_atr_min_pct': 0.023241452983111845, 'sideways_atr_max_pct': 0.0804765065980359, 'sideways_tp_mult': 1.1291289346523952, 'sideways_tsl_mult': 0.9701281224169623, 'sideways_time_stop': 166, 'sideways_use_sma': False, 'sideways_use_ema': False, 'sideways_use_atr': True, 'sideways_use_adx': True, 'sideways_use_spike': False, 'sideways_rsi_required': False}.
[I 2025-08-30 19:20:56,084] Trial 454 finished with values: [-0.1144317520688597, 0.11434448950655088] and parameters: {'p_sma': 9, 'p_std': 56, 'p_atr': 9, 'p_adx': 7, 'rsi_period': 29, 'ema1': 26, 'ema2': 30, 'slip_atr_k': 0.06464653533632328, 'slip_spread_k': 0.3951644122938647, 'spread_hl_frac': 0.02680869881285723, 'bb_std_mult': 3.01657270960914, 'rsi_os': 41, 'rsi_ob': 56, 'vol_spike': 0.04246118204232366, 'adx_thresh': 15.120681180714676, 'atr_min_pct': 0.015541291812992682, 'atr_max_pct': 0.09485156600530226, 'tp_mult': 2.216170826817406, 'tsl_mult': 0.0796579514141822, 'strategy': 'mean_reversion', 'time_stop': 28, 'use_sma': True, 'use_atr': False, 'use_adx': True, 'use_ema': False, 'use_spike': True, 'rsi_required': True, 'edge_k': 1.202455390467873, 'edge_cap': 0.5469501045959808, 'bull_strategy': 'mean_reversion', 'bull_bb_std_mult': 3.0320762383737914, 'bull_rsi_os': 39, 'bull_rsi_ob': 83, 'bull_adx_thresh': 17.542478421314094, 'bull_atr_min_pct': 0.003622285039194848, 'bull_atr_max_pct': 0.14086422120998265, 'bull_tp_mult': 2.31363212127206, 'bull_tsl_mult': 0.527501770959451, 'bull_time_stop': 219, 'bull_use_sma': True, 'bull_use_ema': False, 'bull_use_atr': True, 'bull_use_adx': False, 'bull_use_spike': False, 'bull_rsi_required': True, 'bear_strategy': 'mean_reversion', 'bear_bb_std_mult': 3.590413144601205, 'bear_rsi_os': 49, 'bear_rsi_ob': 74, 'bear_adx_thresh': 18.16574575240575, 'bear_atr_min_pct': 0.020899536195417463, 'bear_atr_max_pct': 0.023054632459587054, 'bear_tp_mult': 2.4201381203678682, 'bear_tsl_mult': 0.8742995243637732, 'bear_time_stop': 40, 'bear_use_sma': True, 'bear_use_ema': False, 'bear_use_atr': False, 'bear_use_adx': False, 'bear_use_spike': False, 'bear_rsi_required': True, 'sideways_strategy': 'breakout', 'sideways_bb_std_mult': 2.6299400224034377, 'sideways_rsi_os': 55, 'sideways_rsi_ob': 49, 'sideways_adx_thresh': 20.466435989726975, 'sideways_atr_min_pct': 0.0002201301717913457, 'sideways_atr_max_pct': 0.14425962856327865, 'sideways_tp_mult': 1.161018501235024, 'sideways_tsl_mult': 0.021470110044691293, 'sideways_time_stop': 141, 'sideways_use_sma': False, 'sideways_use_ema': False, 'sideways_use_atr': True, 'sideways_use_adx': False, 'sideways_use_spike': True, 'sideways_rsi_required': True}.
[I 2025-08-30 19:20:57,207] Trial 458 finished with values: [-1000000000.0, 1000000000.0] and parameters: {'p_sma': 6, 'p_std': 49, 'p_atr': 9, 'p_adx': 20, 'rsi_period': 24, 'ema1': 18, 'ema2': 34, 'slip_atr_k': 0.07289936139651423, 'slip_spread_k': 0.7040225086320033, 'spread_hl_frac': 0.0031192458410089254, 'bb_std_mult': 1.1744784832312813, 'rsi_os': 47, 'rsi_ob': 46, 'vol_spike': 0.24696223054880997, 'adx_thresh': 6.0459232316318, 'atr_min_pct': 0.0070067253806911384, 'atr_max_pct': 0.1435654677174188, 'tp_mult': 1.6079398513076895, 'tsl_mult': 0.9033546841502345, 'strategy': 'mean_reversion', 'time_stop': 178, 'use_sma': True, 'use_atr': True, 'use_adx': True, 'use_ema': False, 'use_spike': False, 'rsi_required': True, 'edge_k': 0.27798528709849324, 'edge_cap': 0.3929185278071768, 'bull_strategy': 'mean_reversion', 'bull_bb_std_mult': 3.0670727068442662, 'bull_rsi_os': 9, 'bull_rsi_ob': 45, 'bull_adx_thresh': 19.218402393136472, 'bull_atr_min_pct': 0.02746652680458203, 'bull_atr_max_pct': 0.03425298884208857, 'bull_tp_mult': 2.2574242999611123, 'bull_tsl_mult': 0.06899781913122999, 'bull_time_stop': 172, 'bull_use_sma': True, 'bull_use_ema': True, 'bull_use_atr': True, 'bull_use_adx': False, 'bull_use_spike': False, 'bull_rsi_required': False, 'bear_strategy': 'breakout', 'bear_bb_std_mult': 2.750314854997544, 'bear_rsi_os': 54, 'bear_rsi_ob': 67, 'bear_adx_thresh': 19.387465818787675, 'bear_atr_min_pct': 0.0148768953692773, 'bear_atr_max_pct': 0.032090290012334446, 'bear_tp_mult': 2.566809245996546, 'bear_tsl_mult': 0.6655989355117901, 'bear_time_stop': 212, 'bear_use_sma': False, 'bear_use_ema': False, 'bear_use_atr': False, 'bear_use_adx': False, 'bear_use_spike': False, 'bear_rsi_required': False, 'sideways_strategy': 'breakout', 'sideways_bb_std_mult': 1.8622401849236982, 'sideways_rsi_os': 35, 'sideways_rsi_ob': 57, 'sideways_adx_thresh': 21.78178726628353, 'sideways_atr_min_pct': 0.011740182820508344, 'sideways_atr_max_pct': 0.14734273206094328, 'sideways_tp_mult': 1.010781815078002, 'sideways_tsl_mult': 0.2022046121479088, 'sideways_time_stop': 171, 'sideways_use_sma': True, 'sideways_use_ema': True, 'sideways_use_atr': True, 'sideways_use_adx': False, 'sideways_use_spike': False, 'sideways_rsi_required': True}.
[I 2025-08-30 19:20:57,208] Trial 456 finished with values: [-1000000000.0, 1000000000.0] and parameters: {'p_sma': 6, 'p_std': 29, 'p_atr': 17, 'p_adx': 7, 'rsi_period': 45, 'ema1': 26, 'ema2': 32, 'slip_atr_k': 0.06256708637129947, 'slip_spread_k': 0.6250968062913691, 'spread_hl_frac': 0.04247367018071197, 'bb_std_mult': 1.8663200913251576, 'rsi_os': 50, 'rsi_ob': 85, 'vol_spike': 0.0457040340932595, 'adx_thresh': 12.637825718578288, 'atr_min_pct': 0.01991318125633619, 'atr_max_pct': 0.14268027629534635, 'tp_mult': 1.6158632616791595, 'tsl_mult': 0.9076515830451337, 'strategy': 'mean_reversion', 'time_stop': 177, 'use_sma': True, 'use_atr': True, 'use_adx': True, 'use_ema': False, 'use_spike': False, 'rsi_required': True, 'edge_k': 0.09015935564193509, 'edge_cap': 0.4857620153214062, 'bull_strategy': 'mean_reversion', 'bull_bb_std_mult': 3.0616565423734015, 'bull_rsi_os': 31, 'bull_rsi_ob': 45, 'bull_adx_thresh': 17.374638255209614, 'bull_atr_min_pct': 0.0018434890972735065, 'bull_atr_max_pct': 0.13080837616236696, 'bull_tp_mult': 2.6436113850701473, 'bull_tsl_mult': 0.5263827283598835, 'bull_time_stop': 182, 'bull_use_sma': True, 'bull_use_ema': True, 'bull_use_atr': True, 'bull_use_adx': False, 'bull_use_spike': False, 'bull_rsi_required': False, 'bear_strategy': 'breakout', 'bear_bb_std_mult': 0.882429237299063, 'bear_rsi_os': 52, 'bear_rsi_ob': 67, 'bear_adx_thresh': 19.270256065746675, 'bear_atr_min_pct': 0.014193366793077833, 'bear_atr_max_pct': 0.049584577679763424, 'bear_tp_mult': 2.5592061364924334, 'bear_tsl_mult': 0.3842208829399312, 'bear_time_stop': 198, 'bear_use_sma': False, 'bear_use_ema': False, 'bear_use_atr': False, 'bear_use_adx': False, 'bear_use_spike': False, 'bear_rsi_required': False, 'sideways_strategy': 'breakout', 'sideways_bb_std_mult': 1.8473755301245411, 'sideways_rsi_os': 35, 'sideways_rsi_ob': 75, 'sideways_adx_thresh': 11.189885487341616, 'sideways_atr_min_pct': 0.002209705719681873, 'sideways_atr_max_pct': 0.14739208654271257, 'sideways_tp_mult': 1.8052706721984326, 'sideways_tsl_mult': 0.9373165721017186, 'sideways_time_stop': 140, 'sideways_use_sma': True, 'sideways_use_ema': True, 'sideways_use_atr': True, 'sideways_use_adx': False, 'sideways_use_spike': True, 'sideways_rsi_required': True}.
[I 2025-08-30 19:20:58,133] Trial 460 finished with values: [-1000000000.0, 1000000000.0] and parameters: {'p_sma': 39, 'p_std': 30, 'p_atr': 7, 'p_adx': 20, 'rsi_period': 20, 'ema1': 21, 'ema2': 34, 'slip_atr_k': 0.07227106465148204, 'slip_spread_k': 0.0687399881146218, 'spread_hl_frac': 0.022923868069035146, 'bb_std_mult': 1.2992443214782505, 'rsi_os': 50, 'rsi_ob': 84, 'vol_spike': 0.12602702354351478, 'adx_thresh': 34.187924491791726, 'atr_min_pct': 0.02104744039848018, 'atr_max_pct': 0.10290159564246831, 'tp_mult': 2.8993434921008214, 'tsl_mult': 0.7000733881767386, 'strategy': 'mean_reversion', 'time_stop': 198, 'use_sma': False, 'use_atr': True, 'use_adx': False, 'use_ema': True, 'use_spike': True, 'rsi_required': False, 'edge_k': 0.5497801794749961, 'edge_cap': 0.9049104070535795, 'bull_strategy': 'mean_reversion', 'bull_bb_std_mult': 1.9488871551494191, 'bull_rsi_os': 35, 'bull_rsi_ob': 47, 'bull_adx_thresh': 14.011549517262214, 'bull_atr_min_pct': 0.02334832410219162, 'bull_atr_max_pct': 0.1176484838392035, 'bull_tp_mult': 2.7757231870402195, 'bull_tsl_mult': 0.5456785494469704, 'bull_time_stop': 273, 'bull_use_sma': False, 'bull_use_ema': True, 'bull_use_atr': True, 'bull_use_adx': False, 'bull_use_spike': False, 'bull_rsi_required': True, 'bear_strategy': 'breakout', 'bear_bb_std_mult': 2.4669652727401514, 'bear_rsi_os': 25, 'bear_rsi_ob': 78, 'bear_adx_thresh': 34.29993471433776, 'bear_atr_min_pct': 0.013268503263455484, 'bear_atr_max_pct': 0.04041377064157236, 'bear_tp_mult': 2.798075412853294, 'bear_tsl_mult': 0.4309618978115484, 'bear_time_stop': 193, 'bear_use_sma': True, 'bear_use_ema': True, 'bear_use_atr': False, 'bear_use_adx': False, 'bear_use_spike': True, 'bear_rsi_required': True, 'sideways_strategy': 'breakout', 'sideways_bb_std_mult': 1.57553599937087, 'sideways_rsi_os': 32, 'sideways_rsi_ob': 68, 'sideways_adx_thresh': 16.600581811230015, 'sideways_atr_min_pct': 0.024219842593244896, 'sideways_atr_max_pct': 0.04842768909421066, 'sideways_tp_mult': 1.084684304151176, 'sideways_tsl_mult': 0.9982696881884036, 'sideways_time_stop': 165, 'sideways_use_sma': False, 'sideways_use_ema': True, 'sideways_use_atr': True, 'sideways_use_adx': False, 'sideways_use_spike': False, 'sideways_rsi_required': True}.
[I 2025-08-30 19:20:58,226] Trial 459 finished with values: [-1000000000.0, 1000000000.0] and parameters: {'p_sma': 39, 'p_std': 53, 'p_atr': 7, 'p_adx': 20, 'rsi_period': 64, 'ema1': 21, 'ema2': 55, 'slip_atr_k': 0.2035654985201526, 'slip_spread_k': 0.12267356022358337, 'spread_hl_frac': 0.022793810768489686, 'bb_std_mult': 2.109909926775291, 'rsi_os': 55, 'rsi_ob': 76, 'vol_spike': 0.16329858802968578, 'adx_thresh': 34.87505289722801, 'atr_min_pct': 0.02404567873671855, 'atr_max_pct': 0.08923174958913674, 'tp_mult': 2.0091232457383303, 'tsl_mult': 0.6972317026665252, 'strategy': 'mean_reversion', 'time_stop': 12, 'use_sma': False, 'use_atr': True, 'use_adx': False, 'use_ema': True, 'use_spike': True, 'rsi_required': False, 'edge_k': 0.16563354177124587, 'edge_cap': 0.5699480799169396, 'bull_strategy': 'mean_reversion', 'bull_bb_std_mult': 3.2546671910226364, 'bull_rsi_os': 27, 'bull_rsi_ob': 65, 'bull_adx_thresh': 5.776928292464117, 'bull_atr_min_pct': 0.0006503941223702451, 'bull_atr_max_pct': 0.11797081789069422, 'bull_tp_mult': 2.790860828919628, 'bull_tsl_mult': 0.5539204811315235, 'bull_time_stop': 257, 'bull_use_sma': False, 'bull_use_ema': True, 'bull_use_atr': True, 'bull_use_adx': False, 'bull_use_spike': False, 'bull_rsi_required': True, 'bear_strategy': 'breakout', 'bear_bb_std_mult': 3.018622834495233, 'bear_rsi_os': 51, 'bear_rsi_ob': 45, 'bear_adx_thresh': 17.28730426145939, 'bear_atr_min_pct': 0.0173065706762388, 'bear_atr_max_pct': 0.04115780332363261, 'bear_tp_mult': 2.9049624688988724, 'bear_tsl_mult': 0.7077115037244524, 'bear_time_stop': 192, 'bear_use_sma': True, 'bear_use_ema': True, 'bear_use_atr': False, 'bear_use_adx': False, 'bear_use_spike': True, 'bear_rsi_required': True, 'sideways_strategy': 'breakout', 'sideways_bb_std_mult': 3.0643686743385232, 'sideways_rsi_os': 16, 'sideways_rsi_ob': 68, 'sideways_adx_thresh': 13.86901016084326, 'sideways_atr_min_pct': 0.023270066890843592, 'sideways_atr_max_pct': 0.0776744417654436, 'sideways_tp_mult': 1.0778501267258007, 'sideways_tsl_mult': 0.9804206428823725, 'sideways_time_stop': 163, 'sideways_use_sma': False, 'sideways_use_ema': True, 'sideways_use_atr': True, 'sideways_use_adx': False, 'sideways_use_spike': False, 'sideways_rsi_required': True}.
