[I 2025-08-30 19:56:33,796] Trial 767 finished with values: [-1000000000.0, 1000000000.0] and parameters: {'p_sma': 7, 'p_std': 32, 'p_atr': 10, 'p_adx': 9, 'rsi_period': 75, 'ema1': 27, 'ema2': 12, 'slip_atr_k': 0.0517127423957086, 'slip_spread_k': 0.2940842359681154, 'spread_hl_frac': 0.022463877843024498, 'bb_std_mult': 2.0205068714588825, 'rsi_os': 49, 'rsi_ob': 83, 'vol_spike': 0.26965831865090556, 'adx_thresh': 24.24077294441426, 'atr_min_pct': 0.022476066512576536, 'atr_max_pct': 0.09539575991366575, 'tp_mult': 2.2770078108945047, 'tsl_mult': 0.0953293797135012, 'strategy': 'breakout', 'time_stop': 201, 'use_sma': False, 'use_atr': True, 'use_adx': True, 'use_ema': False, 'use_spike': True, 'rsi_required': True, 'edge_k': 0.1080477717618908, 'edge_cap': 0.2269235171335816, 'bull_strategy': 'breakout', 'bull_bb_std_mult': 2.249469296587053, 'bull_rsi_os': 31, 'bull_rsi_ob': 47, 'bull_adx_thresh': 17.449160204067518, 'bull_atr_min_pct': 0.027134964771487906, 'bull_atr_max_pct': 0.11794287669532973, 'bull_tp_mult': 2.8229811508055764, 'bull_tsl_mult': 0.9974253980360556, 'bull_time_stop': 159, 'bull_use_sma': False, 'bull_use_ema': True, 'bull_use_atr': True, 'bull_use_adx': False, 'bull_use_spike': False, 'bull_rsi_required': False, 'bear_strategy': 'breakout', 'bear_bb_std_mult': 1.5462548031795817, 'bear_rsi_os': 43, 'bear_rsi_ob': 76, 'bear_adx_thresh': 32.27854809695367, 'bear_atr_min_pct': 0.013450098961992816, 'bear_atr_max_pct': 0.02869061435415984, 'bear_tp_mult': 1.9522089012226227, 'bear_tsl_mult': 0.926255833804288, 'bear_time_stop': 191, 'bear_use_sma': False, 'bear_use_ema': False, 'bear_use_atr': False, 'bear_use_adx': True, 'bear_use_spike': False, 'bear_rsi_required': True, 'sideways_strategy': 'breakout', 'sideways_bb_std_mult': 3.296747562275991, 'sideways_rsi_os': 33, 'sideways_rsi_ob': 58, 'sideways_adx_thresh': 22.00041885991404, 'sideways_atr_min_pct': 0.012093989346302424, 'sideways_atr_max_pct': 0.14668808125307164, 'sideways_tp_mult': 1.1379552696961535, 'sideways_tsl_mult': 0.3300751298346781, 'sideways_time_stop': 65, 'sideways_use_sma': False, 'sideways_use_ema': False, 'sideways_use_atr': True, 'sideways_use_adx': False, 'sideways_use_spike': False, 'sideways_rsi_required': False}.
[I 2025-08-30 19:56:34,250] Trial 765 finished with values: [-1000000000.0, 1000000000.0] and parameters: {'p_sma': 7, 'p_std': 32, 'p_atr': 8, 'p_adx': 19, 'rsi_period': 74, 'ema1': 24, 'ema2': 37, 'slip_atr_k': 0.11649868893098099, 'slip_spread_k': 0.4980020525002148, 'spread_hl_frac': 0.02623214357388729, 'bb_std_mult': 2.182379416425999, 'rsi_os': 15, 'rsi_ob': 83, 'vol_spike': 0.27994375457756326, 'adx_thresh': 33.508347352290414, 'atr_min_pct': 0.02230990186866975, 'atr_max_pct': 0.07404757766778226, 'tp_mult': 2.0332359320441182, 'tsl_mult': 0.8429604657314955, 'strategy': 'breakout', 'time_stop': 279, 'use_sma': False, 'use_atr': True, 'use_adx': True, 'use_ema': False, 'use_spike': True, 'rsi_required': True, 'edge_k': 1.1508257597494742, 'edge_cap': 0.4419324653839673, 'bull_strategy': 'breakout', 'bull_bb_std_mult': 2.250081498469653, 'bull_rsi_os': 31, 'bull_rsi_ob': 47, 'bull_adx_thresh': 20.615644362362243, 'bull_atr_min_pct': 0.013240840992068643, 'bull_atr_max_pct': 0.11523152179754038, 'bull_tp_mult': 1.1368931127876039, 'bull_tsl_mult': 0.27691660848091676, 'bull_time_stop': 152, 'bull_use_sma': True, 'bull_use_ema': True, 'bull_use_atr': True, 'bull_use_adx': False, 'bull_use_spike': False, 'bull_rsi_required': True, 'bear_strategy': 'mean_reversion', 'bear_bb_std_mult': 2.9620846301005472, 'bear_rsi_os': 51, 'bear_rsi_ob': 73, 'bear_adx_thresh': 28.383664584297982, 'bear_atr_min_pct': 0.013414006999479066, 'bear_atr_max_pct': 0.02894520128632499, 'bear_tp_mult': 1.9448367632498165, 'bear_tsl_mult': 0.7743848938449548, 'bear_time_stop': 198, 'bear_use_sma': False, 'bear_use_ema': False, 'bear_use_atr': False, 'bear_use_adx': True, 'bear_use_spike': False, 'bear_rsi_required': True, 'sideways_strategy': 'breakout', 'sideways_bb_std_mult': 1.4904027279670635, 'sideways_rsi_os': 32, 'sideways_rsi_ob': 58, 'sideways_adx_thresh': 6.684076762029058, 'sideways_atr_min_pct': 0.010726544681549422, 'sideways_atr_max_pct': 0.08957372277025996, 'sideways_tp_mult': 2.599991585574644, 'sideways_tsl_mult': 0.46081181781219055, 'sideways_time_stop': 150, 'sideways_use_sma': True, 'sideways_use_ema': True, 'sideways_use_atr': False, 'sideways_use_adx': False, 'sideways_use_spike': True, 'sideways_rsi_required': True}.
[I 2025-08-30 19:56:34,542] Trial 764 finished with values: [-1000000000.0, 1000000000.0] and parameters: {'p_sma': 7, 'p_std': 32, 'p_atr': 8, 'p_adx': 19, 'rsi_period': 22, 'ema1': 27, 'ema2': 55, 'slip_atr_k': 0.017077628220328378, 'slip_spread_k': 0.1278522956893475, 'spread_hl_frac': 0.04542105087744948, 'bb_std_mult': 3.1971492551870107, 'rsi_os': 49, 'rsi_ob': 83, 'vol_spike': 0.2885995637980578, 'adx_thresh': 28.800026602217446, 'atr_min_pct': 0.008483285776644487, 'atr_max_pct': 0.020227806064743177, 'tp_mult': 1.9575948207191063, 'tsl_mult': 0.8407117421515724, 'strategy': 'breakout', 'time_stop': 177, 'use_sma': True, 'use_atr': False, 'use_adx': False, 'use_ema': True, 'use_spike': False, 'rsi_required': True, 'edge_k': 0.2927873524385957, 'edge_cap': 0.1056960057333044, 'bull_strategy': 'breakout', 'bull_bb_std_mult': 3.244908601012316, 'bull_rsi_os': 30, 'bull_rsi_ob': 48, 'bull_adx_thresh': 20.194968455312903, 'bull_atr_min_pct': 0.027158044268503073, 'bull_atr_max_pct': 0.11420232259991525, 'bull_tp_mult': 2.7226982524681977, 'bull_tsl_mult': 0.2791071488249673, 'bull_time_stop': 161, 'bull_use_sma': True, 'bull_use_ema': True, 'bull_use_atr': True, 'bull_use_adx': True, 'bull_use_spike': True, 'bull_rsi_required': True, 'bear_strategy': 'mean_reversion', 'bear_bb_std_mult': 1.997988468257026, 'bear_rsi_os': 47, 'bear_rsi_ob': 82, 'bear_adx_thresh': 24.61146884590307, 'bear_atr_min_pct': 0.0154104490296742, 'bear_atr_max_pct': 0.028577016114092708, 'bear_tp_mult': 2.6674689991256146, 'bear_tsl_mult': 0.7648019997527059, 'bear_time_stop': 199, 'bear_use_sma': False, 'bear_use_ema': False, 'bear_use_atr': False, 'bear_use_adx': True, 'bear_use_spike': True, 'bear_rsi_required': True, 'sideways_strategy': 'mean_reversion', 'sideways_bb_std_mult': 3.3292905818733374, 'sideways_rsi_os': 33, 'sideways_rsi_ob': 58, 'sideways_adx_thresh': 20.847479184463396, 'sideways_atr_min_pct': 0.010555020224171523, 'sideways_atr_max_pct': 0.1474894147348568, 'sideways_tp_mult': 1.1515603706007573, 'sideways_tsl_mult': 0.09497863556822189, 'sideways_time_stop': 151, 'sideways_use_sma': True, 'sideways_use_ema': True, 'sideways_use_atr': False, 'sideways_use_adx': False, 'sideways_use_spike': True, 'sideways_rsi_required': True}.
[I 2025-08-30 19:56:35,593] Trial 768 finished with values: [-1000000000.0, 1000000000.0] and parameters: {'p_sma': 7, 'p_std': 36, 'p_atr': 10, 'p_adx': 20, 'rsi_period': 74, 'ema1': 30, 'ema2': 42, 'slip_atr_k': 0.12362400025390377, 'slip_spread_k': 0.6765314030467734, 'spread_hl_frac': 0.034628083497532776, 'bb_std_mult': 2.315087606823834, 'rsi_os': 49, 'rsi_ob': 45, 'vol_spike': 0.28741257653833685, 'adx_thresh': 33.93993559624224, 'atr_min_pct': 0.023804930323025945, 'atr_max_pct': 0.09660074425160804, 'tp_mult': 2.0364416055068517, 'tsl_mult': 0.8184862719895047, 'strategy': 'mean_reversion', 'time_stop': 199, 'use_sma': False, 'use_atr': True, 'use_adx': True, 'use_ema': False, 'use_spike': True, 'rsi_required': False, 'edge_k': 0.05648950253604912, 'edge_cap': 0.10383679249511713, 'bull_strategy': 'breakout', 'bull_bb_std_mult': 3.2740864564449836, 'bull_rsi_os': 27, 'bull_rsi_ob': 63, 'bull_adx_thresh': 16.147620117331538, 'bull_atr_min_pct': 0.021200170813114, 'bull_atr_max_pct': 0.10465032045456596, 'bull_tp_mult': 2.7620331940434473, 'bull_tsl_mult': 0.5553512085021701, 'bull_time_stop': 197, 'bull_use_sma': False, 'bull_use_ema': True, 'bull_use_atr': True, 'bull_use_adx': False, 'bull_use_spike': False, 'bull_rsi_required': True, 'bear_strategy': 'breakout', 'bear_bb_std_mult': 1.7444310311335929, 'bear_rsi_os': 43, 'bear_rsi_ob': 76, 'bear_adx_thresh': 28.407235135978908, 'bear_atr_min_pct': 0.01531392745509803, 'bear_atr_max_pct': 0.12110568709360206, 'bear_tp_mult': 1.6822806397942864, 'bear_tsl_mult': 0.7692899110531161, 'bear_time_stop': 199, 'bear_use_sma': False, 'bear_use_ema': True, 'bear_use_atr': False, 'bear_use_adx': False, 'bear_use_spike': False, 'bear_rsi_required': False, 'sideways_strategy': 'breakout', 'sideways_bb_std_mult': 2.9041141602231546, 'sideways_rsi_os': 25, 'sideways_rsi_ob': 80, 'sideways_adx_thresh': 21.7030400707924, 'sideways_atr_min_pct': 0.0016436850125309645, 'sideways_atr_max_pct': 0.08910423163914438, 'sideways_tp_mult': 2.2467530451479183, 'sideways_tsl_mult': 0.46130530874321474, 'sideways_time_stop': 149, 'sideways_use_sma': False, 'sideways_use_ema': True, 'sideways_use_atr': True, 'sideways_use_adx': False, 'sideways_use_spike': False, 'sideways_rsi_required': True}.
[I 2025-08-30 19:57:10,030] Trial 770 finished with values: [-1000000000.0, 1000000000.0] and parameters: {'p_sma': 58, 'p_std': 27, 'p_atr': 18, 'p_adx': 20, 'rsi_period': 39, 'ema1': 20, 'ema2': 31, 'slip_atr_k': 0.10967539139276963, 'slip_spread_k': 0.15407478705817956, 'spread_hl_frac': 0.0036073756087845257, 'bb_std_mult': 2.326093347578533, 'rsi_os': 47, 'rsi_ob': 51, 'vol_spike': 0.26340109000074025, 'adx_thresh': 18.842906800816618, 'atr_min_pct': 0.0030648539980225094, 'atr_max_pct': 0.1434727237564453, 'tp_mult': 2.314834404324747, 'tsl_mult': 0.48051871411182, 'strategy': 'mean_reversion', 'time_stop': 186, 'use_sma': False, 'use_atr': True, 'use_adx': True, 'use_ema': False, 'use_spike': True, 'rsi_required': False, 'edge_k': 0.976487045118626, 'edge_cap': 0.8919068762035289, 'bull_strategy': 'mean_reversion', 'bull_bb_std_mult': 3.284082316169477, 'bull_rsi_os': 27, 'bull_rsi_ob': 85, 'bull_adx_thresh': 19.040000855680322, 'bull_atr_min_pct': 0.0021550084039009577, 'bull_atr_max_pct': 0.04328779123748983, 'bull_tp_mult': 2.7518970292742897, 'bull_tsl_mult': 0.5547788077575944, 'bull_time_stop': 108, 'bull_use_sma': False, 'bull_use_ema': True, 'bull_use_atr': False, 'bull_use_adx': False, 'bull_use_spike': False, 'bull_rsi_required': True, 'bear_strategy': 'breakout', 'bear_bb_std_mult': 1.7366657042595524, 'bear_rsi_os': 52, 'bear_rsi_ob': 76, 'bear_adx_thresh': 17.075461283901905, 'bear_atr_min_pct': 0.01582508434699921, 'bear_atr_max_pct': 0.07424038468973841, 'bear_tp_mult': 1.4142370633530565, 'bear_tsl_mult': 0.7647906168495227, 'bear_time_stop': 209, 'bear_use_sma': True, 'bear_use_ema': True, 'bear_use_atr': False, 'bear_use_adx': False, 'bear_use_spike': False, 'bear_rsi_required': False, 'sideways_strategy': 'breakout', 'sideways_bb_std_mult': 2.1004745072930975, 'sideways_rsi_os': 23, 'sideways_rsi_ob': 78, 'sideways_adx_thresh': 23.09038167771117, 'sideways_atr_min_pct': 0.0045669743954686644, 'sideways_atr_max_pct': 0.12260703614761602, 'sideways_tp_mult': 1.1044982489123552, 'sideways_tsl_mult': 0.600822357230902, 'sideways_time_stop': 24, 'sideways_use_sma': False, 'sideways_use_ema': True, 'sideways_use_atr': True, 'sideways_use_adx': False, 'sideways_use_spike': False, 'sideways_rsi_required': True}.
[I 2025-08-30 19:57:10,294] Trial 769 finished with values: [-1000000000.0, 1000000000.0] and parameters: {'p_sma': 8, 'p_std': 43, 'p_atr': 10, 'p_adx': 20, 'rsi_period': 24, 'ema1': 28, 'ema2': 41, 'slip_atr_k': 0.07886998478421979, 'slip_spread_k': 0.1510731124591177, 'spread_hl_frac': 0.014968461505837478, 'bb_std_mult': 3.0614469097992654, 'rsi_os': 47, 'rsi_ob': 78, 'vol_spike': 0.23961983950816543, 'adx_thresh': 19.23955105597807, 'atr_min_pct': 0.025168023094028262, 'atr_max_pct': 0.0866142311922677, 'tp_mult': 1.6582208231787456, 'tsl_mult': 0.05725342233812214, 'strategy': 'mean_reversion', 'time_stop': 197, 'use_sma': False, 'use_atr': True, 'use_adx': True, 'use_ema': False, 'use_spike': True, 'rsi_required': False, 'edge_k': 0.04571663350832385, 'edge_cap': 0.5865573369118957, 'bull_strategy': 'mean_reversion', 'bull_bb_std_mult': 3.257737125621527, 'bull_rsi_os': 30, 'bull_rsi_ob': 57, 'bull_adx_thresh': 33.503339295610616, 'bull_atr_min_pct': 0.002165819751920249, 'bull_atr_max_pct': 0.1197944526601729, 'bull_tp_mult': 2.7606028693594507, 'bull_tsl_mult': 0.5540420893594623, 'bull_time_stop': 109, 'bull_use_sma': False, 'bull_use_ema': True, 'bull_use_atr': False, 'bull_use_adx': False, 'bull_use_spike': False, 'bull_rsi_required': True, 'bear_strategy': 'breakout', 'bear_bb_std_mult': 3.1823960822337076, 'bear_rsi_os': 51, 'bear_rsi_ob': 78, 'bear_adx_thresh': 28.48766193018995, 'bear_atr_min_pct': 0.015357295849843203, 'bear_atr_max_pct': 0.07290374318230583, 'bear_tp_mult': 2.5574274623313236, 'bear_tsl_mult': 0.8952328665806619, 'bear_time_stop': 199, 'bear_use_sma': True, 'bear_use_ema': True, 'bear_use_atr': False, 'bear_use_adx': False, 'bear_use_spike': False, 'bear_rsi_required': False, 'sideways_strategy': 'breakout', 'sideways_bb_std_mult': 3.515387924227216, 'sideways_rsi_os': 31, 'sideways_rsi_ob': 55, 'sideways_adx_thresh': 29.83824736933687, 'sideways_atr_min_pct': 0.0105644450212273, 'sideways_atr_max_pct': 0.1228632123427929, 'sideways_tp_mult': 1.010154947495421, 'sideways_tsl_mult': 0.6063125509190159, 'sideways_time_stop': 194, 'sideways_use_sma': False, 'sideways_use_ema': True, 'sideways_use_atr': True, 'sideways_use_adx': False, 'sideways_use_spike': False, 'sideways_rsi_required': True}.
[I 2025-08-30 19:57:10,531] Trial 771 finished with values: [-1000000000.0, 1000000000.0] and parameters: {'p_sma': 16, 'p_std': 14, 'p_atr': 12, 'p_adx': 20, 'rsi_period': 83, 'ema1': 26, 'ema2': 41, 'slip_atr_k': 0.06019731011307999, 'slip_spread_k': 0.6711690390498793, 'spread_hl_frac': 0.012353363551768547, 'bb_std_mult': 2.2954812380672394, 'rsi_os': 29, 'rsi_ob': 84, 'vol_spike': 0.2397054800756511, 'adx_thresh': 34.1203141769759, 'atr_min_pct': 0.026425775859630275, 'atr_max_pct': 0.08667719217138296, 'tp_mult': 2.581295227963211, 'tsl_mult': 0.48980561041323956, 'strategy': 'mean_reversion', 'time_stop': 125, 'use_sma': False, 'use_atr': True, 'use_adx': True, 'use_ema': False, 'use_spike': True, 'rsi_required': False, 'edge_k': 1.4061724987132505, 'edge_cap': 0.4966271356385915, 'bull_strategy': 'mean_reversion', 'bull_bb_std_mult': 3.2435687999763876, 'bull_rsi_os': 32, 'bull_rsi_ob': 46, 'bull_adx_thresh': 16.185281722469302, 'bull_atr_min_pct': 0.002136432377715009, 'bull_atr_max_pct': 0.12011263795596262, 'bull_tp_mult': 2.7705155414839546, 'bull_tsl_mult': 0.5551099412356338, 'bull_time_stop': 172, 'bull_use_sma': False, 'bull_use_ema': True, 'bull_use_atr': False, 'bull_use_adx': False, 'bull_use_spike': False, 'bull_rsi_required': True, 'bear_strategy': 'breakout', 'bear_bb_std_mult': 1.8052144883913062, 'bear_rsi_os': 51, 'bear_rsi_ob': 76, 'bear_adx_thresh': 19.884653434811693, 'bear_atr_min_pct': 0.015853896886727906, 'bear_atr_max_pct': 0.10074641804204466, 'bear_tp_mult': 2.9623272550823234, 'bear_tsl_mult': 0.35696362457624986, 'bear_time_stop': 179, 'bear_use_sma': True, 'bear_use_ema': True, 'bear_use_atr': False, 'bear_use_adx': False, 'bear_use_spike': False, 'bear_rsi_required': False, 'sideways_strategy': 'breakout', 'sideways_bb_std_mult': 1.1283629488151954, 'sideways_rsi_os': 36, 'sideways_rsi_ob': 60, 'sideways_adx_thresh': 23.064926304879748, 'sideways_atr_min_pct': 0.021414565055172894, 'sideways_atr_max_pct': 0.12381664661084754, 'sideways_tp_mult': 1.0914674314062451, 'sideways_tsl_mult': 0.9488929620902565, 'sideways_time_stop': 195, 'sideways_use_sma': False, 'sideways_use_ema': True, 'sideways_use_atr': True, 'sideways_use_adx': False, 'sideways_use_spike': False, 'sideways_rsi_required': True}.
[I 2025-08-30 19:57:11,325] Trial 772 finished with values: [-1000000000.0, 1000000000.0] and parameters: {'p_sma': 50, 'p_std': 14, 'p_atr': 9, 'p_adx': 11, 'rsi_period': 40, 'ema1': 26, 'ema2': 31, 'slip_atr_k': 0.07901220499573658, 'slip_spread_k': 0.15619935726279532, 'spread_hl_frac': 0.00441988842975715, 'bb_std_mult': 2.123606133936946, 'rsi_os': 25, 'rsi_ob': 84, 'vol_spike': 0.07491621189978458, 'adx_thresh': 9.604882306436927, 'atr_min_pct': 0.025380971854281252, 'atr_max_pct': 0.08690452836048218, 'tp_mult': 1.3207160906410769, 'tsl_mult': 0.4976013590025086, 'strategy': 'mean_reversion', 'time_stop': 39, 'use_sma': False, 'use_atr': True, 'use_adx': True, 'use_ema': False, 'use_spike': True, 'rsi_required': False, 'edge_k': 0.2300129662994037, 'edge_cap': 0.5920137624664653, 'bull_strategy': 'mean_reversion', 'bull_bb_std_mult': 3.5022751352062205, 'bull_rsi_os': 32, 'bull_rsi_ob': 85, 'bull_adx_thresh': 18.962274076207343, 'bull_atr_min_pct': 0.0021432205062833034, 'bull_atr_max_pct': 0.12080465329785173, 'bull_tp_mult': 2.8571981007310403, 'bull_tsl_mult': 0.5208207596021684, 'bull_time_stop': 68, 'bull_use_sma': False, 'bull_use_ema': True, 'bull_use_atr': False, 'bull_use_adx': False, 'bull_use_spike': False, 'bull_rsi_required': True, 'bear_strategy': 'breakout', 'bear_bb_std_mult': 0.5001324822578621, 'bear_rsi_os': 52, 'bear_rsi_ob': 51, 'bear_adx_thresh': 30.856429496414965, 'bear_atr_min_pct': 0.018359164847796965, 'bear_atr_max_pct': 0.04383663748088805, 'bear_tp_mult': 2.5554728873513413, 'bear_tsl_mult': 0.028138385363905227, 'bear_time_stop': 209, 'bear_use_sma': True, 'bear_use_ema': True, 'bear_use_atr': False, 'bear_use_adx': False, 'bear_use_spike': False, 'bear_rsi_required': False, 'sideways_strategy': 'breakout', 'sideways_bb_std_mult': 0.8721971381988194, 'sideways_rsi_os': 51, 'sideways_rsi_ob': 60, 'sideways_adx_thresh': 22.987889655442306, 'sideways_atr_min_pct': 0.019860015615057902, 'sideways_atr_max_pct': 0.12307438313344901, 'sideways_tp_mult': 1.0931042506792863, 'sideways_tsl_mult': 0.9483392508914236, 'sideways_time_stop': 171, 'sideways_use_sma': False, 'sideways_use_ema': True, 'sideways_use_atr': True, 'sideways_use_adx': False, 'sideways_use_spike': False, 'sideways_rsi_required': True}.
[I 2025-08-30 19:57:12,321] Trial 774 finished with values: [-1000000000.0, 1000000000.0] and parameters: {'p_sma': 48, 'p_std': 31, 'p_atr': 21, 'p_adx': 20, 'rsi_period': 9, 'ema1': 26, 'ema2': 52, 'slip_atr_k': 0.061519212276969576, 'slip_spread_k': 0.182424507134106, 'spread_hl_frac': 0.04896129427251844, 'bb_std_mult': 2.1197835256468123, 'rsi_os': 53, 'rsi_ob': 61, 'vol_spike': 0.07160831067924477, 'adx_thresh': 21.53996600128194, 'atr_min_pct': 0.022974651265495395, 'atr_max_pct': 0.09241552138568855, 'tp_mult': 2.257036259670509, 'tsl_mult': 0.1889593356713017, 'strategy': 'mean_reversion', 'time_stop': 166, 'use_sma': False, 'use_atr': True, 'use_adx': True, 'use_ema': False, 'use_spike': True, 'rsi_required': False, 'edge_k': 0.22194201609476275, 'edge_cap': 0.48803544150697076, 'bull_strategy': 'mean_reversion', 'bull_bb_std_mult': 3.5179800739057088, 'bull_rsi_os': 32, 'bull_rsi_ob': 76, 'bull_adx_thresh': 17.47376577934213, 'bull_atr_min_pct': 0.0014552553497578957, 'bull_atr_max_pct': 0.12131765267710587, 'bull_tp_mult': 2.2111010177661936, 'bull_tsl_mult': 0.5127277797505221, 'bull_time_stop': 172, 'bull_use_sma': False, 'bull_use_ema': True, 'bull_use_atr': True, 'bull_use_adx': False, 'bull_use_spike': False, 'bull_rsi_required': False, 'bear_strategy': 'breakout', 'bear_bb_std_mult': 1.827811803726937, 'bear_rsi_os': 53, 'bear_rsi_ob': 74, 'bear_adx_thresh': 30.942594405520268, 'bear_atr_min_pct': 0.014496183768244042, 'bear_atr_max_pct': 0.036519008143641146, 'bear_tp_mult': 2.623815978536258, 'bear_tsl_mult': 0.7059484829744311, 'bear_time_stop': 5, 'bear_use_sma': True, 'bear_use_ema': True, 'bear_use_atr': False, 'bear_use_adx': False, 'bear_use_spike': False, 'bear_rsi_required': True, 'sideways_strategy': 'breakout', 'sideways_bb_std_mult': 3.188464108505351, 'sideways_rsi_os': 5, 'sideways_rsi_ob': 60, 'sideways_adx_thresh': 10.68959484910135, 'sideways_atr_min_pct': 0.021565762476509865, 'sideways_atr_max_pct': 0.14995364936464134, 'sideways_tp_mult': 1.062981998446142, 'sideways_tsl_mult': 0.5576191362960202, 'sideways_time_stop': 12, 'sideways_use_sma': False, 'sideways_use_ema': False, 'sideways_use_atr': True, 'sideways_use_adx': False, 'sideways_use_spike': False, 'sideways_rsi_required': False}.
