[I 2025-08-30 19:11:16,632] Trial 370 finished with values: [-1000000000.0, 1000000000.0] and parameters: {'p_sma': 5, 'p_std': 31, 'p_atr': 9, 'p_adx': 8, 'rsi_period': 40, 'ema1': 22, 'ema2': 52, 'slip_atr_k': 0.19024563945307738, 'slip_spread_k': 0.510783979740454, 'spread_hl_frac': 0.045879896746455914, 'bb_std_mult': 2.1424626204856763, 'rsi_os': 37, 'rsi_ob': 93, 'vol_spike': 0.2691417241485675, 'adx_thresh': 11.584168539964356, 'atr_min_pct': 0.01819363522751377, 'atr_max_pct': 0.10331062043150135, 'tp_mult': 1.6886732616821347, 'tsl_mult': 0.26572765530113873, 'strategy': 'breakout', 'time_stop': 176, 'use_sma': True, 'use_atr': False, 'use_adx': False, 'use_ema': False, 'use_spike': True, 'rsi_required': True, 'edge_k': 1.1761680748648327, 'edge_cap': 0.519466691114931, 'bull_strategy': 'mean_reversion', 'bull_bb_std_mult': 3.1042703664001645, 'bull_rsi_os': 25, 'bull_rsi_ob': 71, 'bull_adx_thresh': 21.757266484168998, 'bull_atr_min_pct': 0.00880857241707524, 'bull_atr_max_pct': 0.12056158966852018, 'bull_tp_mult': 2.772172916925116, 'bull_tsl_mult': 0.04369193208341521, 'bull_time_stop': 23, 'bull_use_sma': False, 'bull_use_ema': True, 'bull_use_atr': False, 'bull_use_adx': True, 'bull_use_spike': True, 'bull_rsi_required': False, 'bear_strategy': 'mean_reversion', 'bear_bb_std_mult': 2.7529448811916293, 'bear_rsi_os': 41, 'bear_rsi_ob': 93, 'bear_adx_thresh': 17.27880643220302, 'bear_atr_min_pct': 0.01193564416472519, 'bear_atr_max_pct': 0.06358453521753119, 'bear_tp_mult': 2.729246248338822, 'bear_tsl_mult': 0.28329981495379597, 'bear_time_stop': 277, 'bear_use_sma': True, 'bear_use_ema': True, 'bear_use_atr': False, 'bear_use_adx': True, 'bear_use_spike': False, 'bear_rsi_required': True, 'sideways_strategy': 'mean_reversion', 'sideways_bb_std_mult': 0.6611340589839545, 'sideways_rsi_os': 33, 'sideways_rsi_ob': 57, 'sideways_adx_thresh': 21.03545602902121, 'sideways_atr_min_pct': 0.0034511242068359337, 'sideways_atr_max_pct': 0.14803532240167164, 'sideways_tp_mult': 2.2253210152256013, 'sideways_tsl_mult': 0.871121348792071, 'sideways_time_stop': 176, 'sideways_use_sma': False, 'sideways_use_ema': False, 'sideways_use_atr': True, 'sideways_use_adx': False, 'sideways_use_spike': True, 'sideways_rsi_required': True}.
[I 2025-08-30 19:11:16,739] Trial 368 finished with values: [-1000000000.0, 1000000000.0] and parameters: {'p_sma': 23, 'p_std': 34, 'p_atr': 10, 'p_adx': 19, 'rsi_period': 40, 'ema1': 22, 'ema2': 13, 'slip_atr_k': 0.069145366477869, 'slip_spread_k': 0.5085067481843637, 'spread_hl_frac': 0.025693502674976464, 'bb_std_mult': 2.210526925384023, 'rsi_os': 36, 'rsi_ob': 83, 'vol_spike': 0.18639736191866377, 'adx_thresh': 11.633401940493671, 'atr_min_pct': 0.022677840623055723, 'atr_max_pct': 0.10440127340998201, 'tp_mult': 1.4012918903246518, 'tsl_mult': 0.3650941029925966, 'strategy': 'mean_reversion', 'time_stop': 178, 'use_sma': False, 'use_atr': False, 'use_adx': True, 'use_ema': True, 'use_spike': True, 'rsi_required': False, 'edge_k': 0.1569488139479546, 'edge_cap': 0.9634324358119543, 'bull_strategy': 'mean_reversion', 'bull_bb_std_mult': 3.0369008333165968, 'bull_rsi_os': 30, 'bull_rsi_ob': 48, 'bull_adx_thresh': 6.213170224221228, 'bull_atr_min_pct': 0.0021634524736304076, 'bull_atr_max_pct': 0.04562284379493577, 'bull_tp_mult': 2.7677042532834606, 'bull_tsl_mult': 0.18608680310820286, 'bull_time_stop': 73, 'bull_use_sma': False, 'bull_use_ema': True, 'bull_use_atr': True, 'bull_use_adx': True, 'bull_use_spike': False, 'bull_rsi_required': False, 'bear_strategy': 'breakout', 'bear_bb_std_mult': 2.73517735053161, 'bear_rsi_os': 53, 'bear_rsi_ob': 78, 'bear_adx_thresh': 18.35277469817161, 'bear_atr_min_pct': 0.008744555419160369, 'bear_atr_max_pct': 0.02617106722577743, 'bear_tp_mult': 2.719906884930276, 'bear_tsl_mult': 0.7330743304196675, 'bear_time_stop': 194, 'bear_use_sma': True, 'bear_use_ema': False, 'bear_use_atr': False, 'bear_use_adx': False, 'bear_use_spike': True, 'bear_rsi_required': True, 'sideways_strategy': 'mean_reversion', 'sideways_bb_std_mult': 2.6769866500415636, 'sideways_rsi_os': 52, 'sideways_rsi_ob': 74, 'sideways_adx_thresh': 22.029261236471648, 'sideways_atr_min_pct': 0.00380940254084717, 'sideways_atr_max_pct': 0.14996107293954844, 'sideways_tp_mult': 2.437715881439458, 'sideways_tsl_mult': 0.9729023633111985, 'sideways_time_stop': 175, 'sideways_use_sma': False, 'sideways_use_ema': True, 'sideways_use_atr': True, 'sideways_use_adx': False, 'sideways_use_spike': False, 'sideways_rsi_required': True}.
[I 2025-08-30 19:11:16,858] Trial 371 finished with values: [-1000000000.0, 1000000000.0] and parameters: {'p_sma': 23, 'p_std': 31, 'p_atr': 10, 'p_adx': 8, 'rsi_period': 75, 'ema1': 23, 'ema2': 13, 'slip_atr_k': 0.07109968230378466, 'slip_spread_k': 0.5183420366493149, 'spread_hl_frac': 0.023949769414493678, 'bb_std_mult': 2.1382538637980404, 'rsi_os': 50, 'rsi_ob': 80, 'vol_spike': 0.18283894693884997, 'adx_thresh': 11.5542497309562, 'atr_min_pct': 0.01579631978541146, 'atr_max_pct': 0.024522315208577374, 'tp_mult': 2.3312147328722634, 'tsl_mult': 0.3522389698256421, 'strategy': 'breakout', 'time_stop': 63, 'use_sma': True, 'use_atr': False, 'use_adx': False, 'use_ema': False, 'use_spike': False, 'rsi_required': True, 'edge_k': 0.09851702782207095, 'edge_cap': 0.34426312692055777, 'bull_strategy': 'mean_reversion', 'bull_bb_std_mult': 3.1001763112242466, 'bull_rsi_os': 25, 'bull_rsi_ob': 45, 'bull_adx_thresh': 23.329018689906093, 'bull_atr_min_pct': 0.0020301268671499974, 'bull_atr_max_pct': 0.12234552924810504, 'bull_tp_mult': 2.7888366892649397, 'bull_tsl_mult': 0.010259324447885021, 'bull_time_stop': 150, 'bull_use_sma': True, 'bull_use_ema': True, 'bull_use_atr': False, 'bull_use_adx': True, 'bull_use_spike': True, 'bull_rsi_required': False, 'bear_strategy': 'mean_reversion', 'bear_bb_std_mult': 1.4267407336587508, 'bear_rsi_os': 29, 'bear_rsi_ob': 93, 'bear_adx_thresh': 18.331884905397832, 'bear_atr_min_pct': 0.01465951801547593, 'bear_atr_max_pct': 0.026050264900107842, 'bear_tp_mult': 2.7214477759005806, 'bear_tsl_mult': 0.7323400733645357, 'bear_time_stop': 106, 'bear_use_sma': True, 'bear_use_ema': True, 'bear_use_atr': False, 'bear_use_adx': True, 'bear_use_spike': False, 'bear_rsi_required': True, 'sideways_strategy': 'mean_reversion', 'sideways_bb_std_mult': 3.096047499950153, 'sideways_rsi_os': 39, 'sideways_rsi_ob': 74, 'sideways_adx_thresh': 22.276063839634666, 'sideways_atr_min_pct': 0.026917094913703834, 'sideways_atr_max_pct': 0.14291715930324841, 'sideways_tp_mult': 2.228796828589326, 'sideways_tsl_mult': 0.8257666957685824, 'sideways_time_stop': 163, 'sideways_use_sma': True, 'sideways_use_ema': False, 'sideways_use_atr': True, 'sideways_use_adx': True, 'sideways_use_spike': True, 'sideways_rsi_required': True}.
[I 2025-08-30 19:11:17,483] Trial 375 finished with values: [-1000000000.0, 1000000000.0] and parameters: {'p_sma': 8, 'p_std': 29, 'p_atr': 25, 'p_adx': 22, 'rsi_period': 19, 'ema1': 24, 'ema2': 56, 'slip_atr_k': 0.1526247863307463, 'slip_spread_k': 0.43572725959716063, 'spread_hl_frac': 0.004527435866874461, 'bb_std_mult': 0.6511795697559355, 'rsi_os': 55, 'rsi_ob': 85, 'vol_spike': 0.09444370477136235, 'adx_thresh': 34.00239825714862, 'atr_min_pct': 0.023400343076547474, 'atr_max_pct': 0.09479757261118228, 'tp_mult': 2.639846990771295, 'tsl_mult': 0.8871023407334963, 'strategy': 'mean_reversion', 'time_stop': 199, 'use_sma': False, 'use_atr': True, 'use_adx': True, 'use_ema': False, 'use_spike': False, 'rsi_required': False, 'edge_k': 0.6481975171985527, 'edge_cap': 0.47989465777177587, 'bull_strategy': 'breakout', 'bull_bb_std_mult': 1.131613770688129, 'bull_rsi_os': 46, 'bull_rsi_ob': 47, 'bull_adx_thresh': 7.98653845292594, 'bull_atr_min_pct': 0.016064226220797968, 'bull_atr_max_pct': 0.01539394195769861, 'bull_tp_mult': 2.6964451100059055, 'bull_tsl_mult': 0.5058556799365392, 'bull_time_stop': 10, 'bull_use_sma': True, 'bull_use_ema': False, 'bull_use_atr': True, 'bull_use_adx': False, 'bull_use_spike': False, 'bull_rsi_required': True, 'bear_strategy': 'breakout', 'bear_bb_std_mult': 2.860758823360704, 'bear_rsi_os': 20, 'bear_rsi_ob': 76, 'bear_adx_thresh': 16.582047861698715, 'bear_atr_min_pct': 0.020485869426568194, 'bear_atr_max_pct': 0.03656901199615742, 'bear_tp_mult': 2.854529890036154, 'bear_tsl_mult': 0.791368629960574, 'bear_time_stop': 198, 'bear_use_sma': False, 'bear_use_ema': True, 'bear_use_atr': False, 'bear_use_adx': False, 'bear_use_spike': False, 'bear_rsi_required': False, 'sideways_strategy': 'breakout', 'sideways_bb_std_mult': 3.2563246318089982, 'sideways_rsi_os': 38, 'sideways_rsi_ob': 63, 'sideways_adx_thresh': 14.10109266613231, 'sideways_atr_min_pct': 0.002333914603271151, 'sideways_atr_max_pct': 0.14504348706914838, 'sideways_tp_mult': 2.592334046190708, 'sideways_tsl_mult': 0.4294827763023792, 'sideways_time_stop': 293, 'sideways_use_sma': True, 'sideways_use_ema': True, 'sideways_use_atr': False, 'sideways_use_adx': True, 'sideways_use_spike': False, 'sideways_rsi_required': False}.
[I 2025-08-30 19:11:50,952] Trial 374 finished with values: [-1000000000.0, 1000000000.0] and parameters: {'p_sma': 8, 'p_std': 33, 'p_atr': 8, 'p_adx': 21, 'rsi_period': 43, 'ema1': 24, 'ema2': 32, 'slip_atr_k': 0.17410194170962584, 'slip_spread_k': 0.18841822155959334, 'spread_hl_frac': 0.023294733388338155, 'bb_std_mult': 3.204184302462079, 'rsi_os': 23, 'rsi_ob': 80, 'vol_spike': 0.014109552758814065, 'adx_thresh': 24.78725472541404, 'atr_min_pct': 0.023422821446899948, 'atr_max_pct': 0.024638934629512402, 'tp_mult': 1.8141054337036957, 'tsl_mult': 0.8702617788905831, 'strategy': 'breakout', 'time_stop': 191, 'use_sma': True, 'use_atr': True, 'use_adx': True, 'use_ema': False, 'use_spike': False, 'rsi_required': True, 'edge_k': 1.5826812381569129, 'edge_cap': 0.4856175474043945, 'bull_strategy': 'breakout', 'bull_bb_std_mult': 3.229215021278683, 'bull_rsi_os': 8, 'bull_rsi_ob': 81, 'bull_adx_thresh': 18.09884857108718, 'bull_atr_min_pct': 0.004981183749733388, 'bull_atr_max_pct': 0.12315432124759743, 'bull_tp_mult': 2.795649305570569, 'bull_tsl_mult': 0.5014522959308871, 'bull_time_stop': 182, 'bull_use_sma': True, 'bull_use_ema': False, 'bull_use_atr': False, 'bull_use_adx': False, 'bull_use_spike': True, 'bull_rsi_required': True, 'bear_strategy': 'breakout', 'bear_bb_std_mult': 1.664623419438923, 'bear_rsi_os': 29, 'bear_rsi_ob': 50, 'bear_adx_thresh': 32.06449397897745, 'bear_atr_min_pct': 0.014522592460830803, 'bear_atr_max_pct': 0.03435186394830676, 'bear_tp_mult': 1.9316593401610507, 'bear_tsl_mult': 0.7959389829144138, 'bear_time_stop': 198, 'bear_use_sma': False, 'bear_use_ema': True, 'bear_use_atr': False, 'bear_use_adx': True, 'bear_use_spike': False, 'bear_rsi_required': False, 'sideways_strategy': 'breakout', 'sideways_bb_std_mult': 1.5095336202820009, 'sideways_rsi_os': 38, 'sideways_rsi_ob': 60, 'sideways_adx_thresh': 19.84076930318191, 'sideways_atr_min_pct': 0.0023128946716260996, 'sideways_atr_max_pct': 0.1432712482015358, 'sideways_tp_mult': 2.999186403423125, 'sideways_tsl_mult': 0.6763151034627886, 'sideways_time_stop': 8, 'sideways_use_sma': True, 'sideways_use_ema': True, 'sideways_use_atr': False, 'sideways_use_adx': True, 'sideways_use_spike': True, 'sideways_rsi_required': False}.
[I 2025-08-30 19:11:51,567] Trial 373 finished with values: [-0.022379112211208696, 0.022615636173465088] and parameters: {'p_sma': 8, 'p_std': 34, 'p_atr': 18, 'p_adx': 9, 'rsi_period': 19, 'ema1': 6, 'ema2': 31, 'slip_atr_k': 0.14732097791239265, 'slip_spread_k': 0.6619102709059106, 'spread_hl_frac': 0.0445225645085092, 'bb_std_mult': 3.459031779880599, 'rsi_os': 50, 'rsi_ob': 80, 'vol_spike': 0.18073090510107576, 'adx_thresh': 31.973505860125478, 'atr_min_pct': 0.01539857487770502, 'atr_max_pct': 0.0942261773400659, 'tp_mult': 2.336828104094398, 'tsl_mult': 0.6075511766255792, 'strategy': 'breakout', 'time_stop': 132, 'use_sma': False, 'use_atr': True, 'use_adx': True, 'use_ema': False, 'use_spike': False, 'rsi_required': False, 'edge_k': 0.11128081986970947, 'edge_cap': 0.6608920845258879, 'bull_strategy': 'mean_reversion', 'bull_bb_std_mult': 2.8661100197936715, 'bull_rsi_os': 32, 'bull_rsi_ob': 87, 'bull_adx_thresh': 18.362200912299933, 'bull_atr_min_pct': 0.002032190360778942, 'bull_atr_max_pct': 0.0162215022649035, 'bull_tp_mult': 2.7816492765008918, 'bull_tsl_mult': 0.49984086668893957, 'bull_time_stop': 149, 'bull_use_sma': True, 'bull_use_ema': False, 'bull_use_atr': True, 'bull_use_adx': False, 'bull_use_spike': False, 'bull_rsi_required': True, 'bear_strategy': 'breakout', 'bear_bb_std_mult': 3.0483073331977177, 'bear_rsi_os': 29, 'bear_rsi_ob': 50, 'bear_adx_thresh': 16.454942950289567, 'bear_atr_min_pct': 0.01470980166482905, 'bear_atr_max_pct': 0.02527985542598715, 'bear_tp_mult': 1.3669086661028191, 'bear_tsl_mult': 0.7310598721725055, 'bear_time_stop': 192, 'bear_use_sma': False, 'bear_use_ema': True, 'bear_use_atr': False, 'bear_use_adx': True, 'bear_use_spike': False, 'bear_rsi_required': False, 'sideways_strategy': 'breakout', 'sideways_bb_std_mult': 3.4697922535947465, 'sideways_rsi_os': 49, 'sideways_rsi_ob': 60, 'sideways_adx_thresh': 22.27967684845124, 'sideways_atr_min_pct': 0.002339336155779808, 'sideways_atr_max_pct': 0.14326702901776542, 'sideways_tp_mult': 1.0119778743084809, 'sideways_tsl_mult': 0.9813867447319718, 'sideways_time_stop': 158, 'sideways_use_sma': True, 'sideways_use_ema': True, 'sideways_use_atr': False, 'sideways_use_adx': True, 'sideways_use_spike': True, 'sideways_rsi_required': True}.
[I 2025-08-30 19:11:51,915] Trial 372 finished with values: [-1000000000.0, 1000000000.0] and parameters: {'p_sma': 5, 'p_std': 9, 'p_atr': 20, 'p_adx': 21, 'rsi_period': 40, 'ema1': 24, 'ema2': 12, 'slip_atr_k': 0.07868258381839105, 'slip_spread_k': 0.5029374775635777, 'spread_hl_frac': 0.04599732286116971, 'bb_std_mult': 2.1296611351729977, 'rsi_os': 37, 'rsi_ob': 80, 'vol_spike': 0.0881687524598839, 'adx_thresh': 31.851490422974297, 'atr_min_pct': 0.01604795401022848, 'atr_max_pct': 0.025325701365769844, 'tp_mult': 2.3169217229211716, 'tsl_mult': 0.81486084945185, 'strategy': 'breakout', 'time_stop': 201, 'use_sma': True, 'use_atr': False, 'use_adx': False, 'use_ema': False, 'use_spike': False, 'rsi_required': True, 'edge_k': 0.10198506075699161, 'edge_cap': 0.6117061546347781, 'bull_strategy': 'mean_reversion', 'bull_bb_std_mult': 1.9155082177252374, 'bull_rsi_os': 32, 'bull_rsi_ob': 45, 'bull_adx_thresh': 23.322744982964263, 'bull_atr_min_pct': 0.004937541515801074, 'bull_atr_max_pct': 0.09526967480861935, 'bull_tp_mult': 2.7744435243237198, 'bull_tsl_mult': 0.039641921217273834, 'bull_time_stop': 74, 'bull_use_sma': True, 'bull_use_ema': True, 'bull_use_atr': False, 'bull_use_adx': True, 'bull_use_spike': True, 'bull_rsi_required': False, 'bear_strategy': 'breakout', 'bear_bb_std_mult': 2.7718503922232545, 'bear_rsi_os': 53, 'bear_rsi_ob': 76, 'bear_adx_thresh': 26.24588437326004, 'bear_atr_min_pct': 0.014553765040677746, 'bear_atr_max_pct': 0.14260588377604255, 'bear_tp_mult': 2.8691388097754205, 'bear_tsl_mult': 0.7272449190295183, 'bear_time_stop': 197, 'bear_use_sma': True, 'bear_use_ema': True, 'bear_use_atr': False, 'bear_use_adx': True, 'bear_use_spike': False, 'bear_rsi_required': True, 'sideways_strategy': 'mean_reversion', 'sideways_bb_std_mult': 3.1020513101049056, 'sideways_rsi_os': 38, 'sideways_rsi_ob': 60, 'sideways_adx_thresh': 22.3747000961645, 'sideways_atr_min_pct': 0.0038099452867248456, 'sideways_atr_max_pct': 0.14296122146743845, 'sideways_tp_mult': 1.010667348718898, 'sideways_tsl_mult': 0.11748097347803022, 'sideways_time_stop': 294, 'sideways_use_sma': True, 'sideways_use_ema': True, 'sideways_use_atr': True, 'sideways_use_adx': True, 'sideways_use_spike': True, 'sideways_rsi_required': True}.
[I 2025-08-30 19:11:52,759] Trial 376 finished with values: [-1000000000.0, 1000000000.0] and parameters: {'p_sma': 8, 'p_std': 33, 'p_atr': 29, 'p_adx': 21, 'rsi_period': 22, 'ema1': 6, 'ema2': 32, 'slip_atr_k': 0.08212186203676655, 'slip_spread_k': 0.19019510547051782, 'spread_hl_frac': 0.04411712730802749, 'bb_std_mult': 1.9666747915094647, 'rsi_os': 49, 'rsi_ob': 70, 'vol_spike': 0.018240560936913813, 'adx_thresh': 31.839641982179163, 'atr_min_pct': 5.264088316295559e-05, 'atr_max_pct': 0.08527576402798714, 'tp_mult': 2.275089860531516, 'tsl_mult': 0.8178157140148079, 'strategy': 'mean_reversion', 'time_stop': 189, 'use_sma': False, 'use_atr': True, 'use_adx': True, 'use_ema': False, 'use_spike': True, 'rsi_required': False, 'edge_k': 0.1024846197260733, 'edge_cap': 0.6674833412089016, 'bull_strategy': 'mean_reversion', 'bull_bb_std_mult': 3.2200919830081896, 'bull_rsi_os': 35, 'bull_rsi_ob': 59, 'bull_adx_thresh': 18.42472356519088, 'bull_atr_min_pct': 0.0031898146510742, 'bull_atr_max_pct': 0.03079756778451248, 'bull_tp_mult': 2.786439632972299, 'bull_tsl_mult': 0.538472696194277, 'bull_time_stop': 275, 'bull_use_sma': False, 'bull_use_ema': True, 'bull_use_atr': True, 'bull_use_adx': False, 'bull_use_spike': False, 'bull_rsi_required': True, 'bear_strategy': 'breakout', 'bear_bb_std_mult': 1.6472205446330586, 'bear_rsi_os': 6, 'bear_rsi_ob': 74, 'bear_adx_thresh': 13.303240721348327, 'bear_atr_min_pct': 0.0145886091655109, 'bear_atr_max_pct': 0.03497585707663168, 'bear_tp_mult': 2.6207294341333065, 'bear_tsl_mult': 0.7495203007327361, 'bear_time_stop': 41, 'bear_use_sma': True, 'bear_use_ema': True, 'bear_use_atr': False, 'bear_use_adx': False, 'bear_use_spike': False, 'bear_rsi_required': True, 'sideways_strategy': 'breakout', 'sideways_bb_std_mult': 1.5097569431132045, 'sideways_rsi_os': 37, 'sideways_rsi_ob': 58, 'sideways_adx_thresh': 19.68551471893065, 'sideways_atr_min_pct': 0.015693750666719686, 'sideways_atr_max_pct': 0.04177498441162979, 'sideways_tp_mult': 1.1806237283174252, 'sideways_tsl_mult': 0.6685603448438692, 'sideways_time_stop': 5, 'sideways_use_sma': False, 'sideways_use_ema': True, 'sideways_use_atr': True, 'sideways_use_adx': False, 'sideways_use_spike': False, 'sideways_rsi_required': True}.
[I 2025-08-30 19:11:53,437] Trial 377 finished with values: [-1000000000.0, 1000000000.0] and parameters: {'p_sma': 7, 'p_std': 30, 'p_atr': 26, 'p_adx': 20, 'rsi_period': 22, 'ema1': 10, 'ema2': 33, 'slip_atr_k': 0.08039769369874138, 'slip_spread_k': 0.15284417431349107, 'spread_hl_frac': 0.04428148243704522, 'bb_std_mult': 3.4893810189640275, 'rsi_os': 50, 'rsi_ob': 67, 'vol_spike': 0.12383069509452438, 'adx_thresh': 32.020663435015734, 'atr_min_pct': 0.014901511776058732, 'atr_max_pct': 0.09483602639726414, 'tp_mult': 2.2911705762349976, 'tsl_mult': 0.9181290723805162, 'strategy': 'mean_reversion', 'time_stop': 72, 'use_sma': False, 'use_atr': True, 'use_adx': True, 'use_ema': False, 'use_spike': True, 'rsi_required': False, 'edge_k': 0.05209503198715386, 'edge_cap': 0.5103037640973669, 'bull_strategy': 'mean_reversion', 'bull_bb_std_mult': 3.1913920435811836, 'bull_rsi_os': 32, 'bull_rsi_ob': 79, 'bull_adx_thresh': 17.547989714355996, 'bull_atr_min_pct': 0.0005461572655370776, 'bull_atr_max_pct': 0.059132038944231295, 'bull_tp_mult': 2.7045176360107184, 'bull_tsl_mult': 0.5424281307079578, 'bull_time_stop': 99, 'bull_use_sma': False, 'bull_use_ema': True, 'bull_use_atr': True, 'bull_use_adx': False, 'bull_use_spike': False, 'bull_rsi_required': True, 'bear_strategy': 'breakout', 'bear_bb_std_mult': 3.041656548896586, 'bear_rsi_os': 49, 'bear_rsi_ob': 74, 'bear_adx_thresh': 26.258855059783958, 'bear_atr_min_pct': 0.016172830873711748, 'bear_atr_max_pct': 0.08553764697834665, 'bear_tp_mult': 2.2013580110620796, 'bear_tsl_mult': 0.7528488583035104, 'bear_time_stop': 131, 'bear_use_sma': True, 'bear_use_ema': True, 'bear_use_atr': True, 'bear_use_adx': False, 'bear_use_spike': False, 'bear_rsi_required': True, 'sideways_strategy': 'breakout', 'sideways_bb_std_mult': 3.120338099369388, 'sideways_rsi_os': 22, 'sideways_rsi_ob': 58, 'sideways_adx_thresh': 21.713506410996533, 'sideways_atr_min_pct': 0.015766875064573648, 'sideways_atr_max_pct': 0.08363053294593087, 'sideways_tp_mult': 1.0172016860793986, 'sideways_tsl_mult': 0.38216586171320727, 'sideways_time_stop': 150, 'sideways_use_sma': False, 'sideways_use_ema': True, 'sideways_use_atr': True, 'sideways_use_adx': False, 'sideways_use_spike': False, 'sideways_rsi_required': True}.
