[I 2025-08-30 18:42:28,703] Trial 117 finished with values: [-1000000000.0, 1000000000.0] and parameters: {'p_sma': 12, 'p_std': 32, 'p_atr': 29, 'p_adx': 16, 'rsi_period': 77, 'ema1': 25, 'ema2': 47, 'slip_atr_k': 0.07496572360284058, 'slip_spread_k': 0.20478531548367557, 'spread_hl_frac': 0.003980592979609211, 'bb_std_mult': 1.7727960362068704, 'rsi_os': 12, 'rsi_ob': 73, 'vol_spike': 0.26076288198049447, 'adx_thresh': 32.76564576955079, 'atr_min_pct': 0.022148724130526817, 'atr_max_pct': 0.09894135260643044, 'tp_mult': 2.3105005437617754, 'tsl_mult': 0.8360554426316835, 'strategy': 'mean_reversion', 'time_stop': 180, 'use_sma': True, 'use_atr': True, 'use_adx': True, 'use_ema': False, 'use_spike': False, 'rsi_required': True, 'edge_k': 0.20552875733196602, 'edge_cap': 0.9986341108739798, 'bull_strategy': 'mean_reversion', 'bull_bb_std_mult': 3.10954013542723, 'bull_rsi_os': 29, 'bull_rsi_ob': 49, 'bull_adx_thresh': 25.21560762950448, 'bull_atr_min_pct': 0.0007943881328390148, 'bull_atr_max_pct': 0.11559982462559223, 'bull_tp_mult': 2.945569320558229, 'bull_tsl_mult': 0.6609329325806207, 'bull_time_stop': 184, 'bull_use_sma': False, 'bull_use_ema': True, 'bull_use_atr': True, 'bull_use_adx': False, 'bull_use_spike': False, 'bull_rsi_required': True, 'bear_strategy': 'breakout', 'bear_bb_std_mult': 1.7307658619143447, 'bear_rsi_os': 55, 'bear_rsi_ob': 75, 'bear_adx_thresh': 16.742309975415367, 'bear_atr_min_pct': 0.014887398389849675, 'bear_atr_max_pct': 0.10958498545911932, 'bear_tp_mult': 2.3658085223174887, 'bear_tsl_mult': 0.7823445907897459, 'bear_time_stop': 131, 'bear_use_sma': True, 'bear_use_ema': True, 'bear_use_atr': False, 'bear_use_adx': False, 'bear_use_spike': False, 'bear_rsi_required': True, 'sideways_strategy': 'mean_reversion', 'sideways_bb_std_mult': 2.0873773902718655, 'sideways_rsi_os': 27, 'sideways_rsi_ob': 65, 'sideways_adx_thresh': 12.108723276803607, 'sideways_atr_min_pct': 0.026045221335578246, 'sideways_atr_max_pct': 0.016755977225173316, 'sideways_tp_mult': 2.6653267139166688, 'sideways_tsl_mult': 0.9787776635259984, 'sideways_time_stop': 136, 'sideways_use_sma': True, 'sideways_use_ema': False, 'sideways_use_atr': False, 'sideways_use_adx': False, 'sideways_use_spike': False, 'sideways_rsi_required': True}.
[I 2025-08-30 18:42:29,327] Trial 118 finished with values: [-1000000000.0, 1000000000.0] and parameters: {'p_sma': 6, 'p_std': 29, 'p_atr': 26, 'p_adx': 18, 'rsi_period': 78, 'ema1': 25, 'ema2': 55, 'slip_atr_k': 0.07604111660669842, 'slip_spread_k': 0.20503738934167415, 'spread_hl_frac': 0.02687915550275675, 'bb_std_mult': 2.4252777686166813, 'rsi_os': 9, 'rsi_ob': 85, 'vol_spike': 0.2494821115150365, 'adx_thresh': 13.245941664110742, 'atr_min_pct': 0.02223553852498837, 'atr_max_pct': 0.025222029139092897, 'tp_mult': 1.3564261021644028, 'tsl_mult': 0.8407360437346572, 'strategy': 'mean_reversion', 'time_stop': 180, 'use_sma': True, 'use_atr': True, 'use_adx': True, 'use_ema': False, 'use_spike': False, 'rsi_required': True, 'edge_k': 0.07691893971416766, 'edge_cap': 0.09177067555399032, 'bull_strategy': 'mean_reversion', 'bull_bb_std_mult': 3.115820432110258, 'bull_rsi_os': 34, 'bull_rsi_ob': 51, 'bull_adx_thresh': 19.185460939863106, 'bull_atr_min_pct': 0.005293322027112496, 'bull_atr_max_pct': 0.10588216146421482, 'bull_tp_mult': 2.6433174370535744, 'bull_tsl_mult': 0.36559196223044194, 'bull_time_stop': 70, 'bull_use_sma': False, 'bull_use_ema': True, 'bull_use_atr': True, 'bull_use_adx': False, 'bull_use_spike': False, 'bull_rsi_required': False, 'bear_strategy': 'breakout', 'bear_bb_std_mult': 1.5497657693784712, 'bear_rsi_os': 55, 'bear_rsi_ob': 72, 'bear_adx_thresh': 19.422827053484163, 'bear_atr_min_pct': 0.012602317662859214, 'bear_atr_max_pct': 0.10013616347704603, 'bear_tp_mult': 2.6620559916773527, 'bear_tsl_mult': 0.7876014465157292, 'bear_time_stop': 75, 'bear_use_sma': True, 'bear_use_ema': True, 'bear_use_atr': False, 'bear_use_adx': False, 'bear_use_spike': False, 'bear_rsi_required': True, 'sideways_strategy': 'mean_reversion', 'sideways_bb_std_mult': 2.20372788356767, 'sideways_rsi_os': 42, 'sideways_rsi_ob': 65, 'sideways_adx_thresh': 12.18896895776357, 'sideways_atr_min_pct': 0.016356731251087844, 'sideways_atr_max_pct': 0.13969812503274884, 'sideways_tp_mult': 2.188010011743864, 'sideways_tsl_mult': 0.9706207611239922, 'sideways_time_stop': 134, 'sideways_use_sma': True, 'sideways_use_ema': True, 'sideways_use_atr': False, 'sideways_use_adx': False, 'sideways_use_spike': False, 'sideways_rsi_required': True}.
[I 2025-08-30 18:43:01,352] Trial 120 finished with values: [-1000000000.0, 1000000000.0] and parameters: {'p_sma': 6, 'p_std': 32, 'p_atr': 27, 'p_adx': 18, 'rsi_period': 71, 'ema1': 25, 'ema2': 31, 'slip_atr_k': 0.07570036135723884, 'slip_spread_k': 0.20435004925092834, 'spread_hl_frac': 0.002505033180482126, 'bb_std_mult': 3.328336416478783, 'rsi_os': 24, 'rsi_ob': 65, 'vol_spike': 0.2863970623825432, 'adx_thresh': 10.698918099133849, 'atr_min_pct': 0.01289231484042998, 'atr_max_pct': 0.09169854002670269, 'tp_mult': 2.4416195140919266, 'tsl_mult': 0.8093922877382911, 'strategy': 'mean_reversion', 'time_stop': 178, 'use_sma': True, 'use_atr': True, 'use_adx': True, 'use_ema': False, 'use_spike': False, 'rsi_required': True, 'edge_k': 0.19527069880873418, 'edge_cap': 0.45764285828793927, 'bull_strategy': 'mean_reversion', 'bull_bb_std_mult': 3.2694957882434514, 'bull_rsi_os': 34, 'bull_rsi_ob': 49, 'bull_adx_thresh': 19.5315437054796, 'bull_atr_min_pct': 0.0006779118365082982, 'bull_atr_max_pct': 0.1070259658744089, 'bull_tp_mult': 2.646468780573351, 'bull_tsl_mult': 0.3516652986255511, 'bull_time_stop': 70, 'bull_use_sma': False, 'bull_use_ema': True, 'bull_use_atr': True, 'bull_use_adx': True, 'bull_use_spike': False, 'bull_rsi_required': False, 'bear_strategy': 'breakout', 'bear_bb_std_mult': 2.5548914676064975, 'bear_rsi_os': 55, 'bear_rsi_ob': 75, 'bear_adx_thresh': 16.41202421576496, 'bear_atr_min_pct': 0.015955413797689375, 'bear_atr_max_pct': 0.09846239796472955, 'bear_tp_mult': 1.562761251717739, 'bear_tsl_mult': 0.7849106393402372, 'bear_time_stop': 103, 'bear_use_sma': True, 'bear_use_ema': False, 'bear_use_atr': False, 'bear_use_adx': False, 'bear_use_spike': False, 'bear_rsi_required': True, 'sideways_strategy': 'breakout', 'sideways_bb_std_mult': 3.2384573388872298, 'sideways_rsi_os': 36, 'sideways_rsi_ob': 47, 'sideways_adx_thresh': 28.29817371647514, 'sideways_atr_min_pct': 0.0033344828702702722, 'sideways_atr_max_pct': 0.14814466515375477, 'sideways_tp_mult': 1.1680643310135463, 'sideways_tsl_mult': 0.6131827150619646, 'sideways_time_stop': 148, 'sideways_use_sma': True, 'sideways_use_ema': False, 'sideways_use_atr': False, 'sideways_use_adx': False, 'sideways_use_spike': False, 'sideways_rsi_required': True}.
[I 2025-08-30 18:43:02,270] Trial 121 finished with values: [-1000000000.0, 1000000000.0] and parameters: {'p_sma': 9, 'p_std': 33, 'p_atr': 26, 'p_adx': 12, 'rsi_period': 71, 'ema1': 8, 'ema2': 29, 'slip_atr_k': 0.06744776663574821, 'slip_spread_k': 0.15337518377088857, 'spread_hl_frac': 0.027097344191602726, 'bb_std_mult': 1.8815679809165735, 'rsi_os': 5, 'rsi_ob': 64, 'vol_spike': 0.2834589852116919, 'adx_thresh': 10.086691186809645, 'atr_min_pct': 0.012800437504874505, 'atr_max_pct': 0.0850999519642208, 'tp_mult': 2.226501980452235, 'tsl_mult': 0.8135549572486515, 'strategy': 'mean_reversion', 'time_stop': 56, 'use_sma': True, 'use_atr': False, 'use_adx': False, 'use_ema': False, 'use_spike': False, 'rsi_required': True, 'edge_k': 0.2641089121090784, 'edge_cap': 0.7985100911303855, 'bull_strategy': 'mean_reversion', 'bull_bb_std_mult': 2.655112088291186, 'bull_rsi_os': 34, 'bull_rsi_ob': 88, 'bull_adx_thresh': 16.543216585446572, 'bull_atr_min_pct': 1.7249433444074683e-05, 'bull_atr_max_pct': 0.10559585556083269, 'bull_tp_mult': 2.6457061363180308, 'bull_tsl_mult': 0.3629792221909456, 'bull_time_stop': 193, 'bull_use_sma': False, 'bull_use_ema': True, 'bull_use_atr': False, 'bull_use_adx': True, 'bull_use_spike': True, 'bull_rsi_required': False, 'bear_strategy': 'mean_reversion', 'bear_bb_std_mult': 2.9702935483123567, 'bear_rsi_os': 49, 'bear_rsi_ob': 72, 'bear_adx_thresh': 7.654087885562321, 'bear_atr_min_pct': 0.016216670213937173, 'bear_atr_max_pct': 0.1001709183825305, 'bear_tp_mult': 2.659222749036986, 'bear_tsl_mult': 0.6118621014353758, 'bear_time_stop': 94, 'bear_use_sma': True, 'bear_use_ema': False, 'bear_use_atr': False, 'bear_use_adx': False, 'bear_use_spike': True, 'bear_rsi_required': True, 'sideways_strategy': 'breakout', 'sideways_bb_std_mult': 3.2075597979042185, 'sideways_rsi_os': 35, 'sideways_rsi_ob': 65, 'sideways_adx_thresh': 11.014302571179838, 'sideways_atr_min_pct': 0.016202474448673846, 'sideways_atr_max_pct': 0.1478611528312726, 'sideways_tp_mult': 1.1746720577838836, 'sideways_tsl_mult': 0.6689967911984029, 'sideways_time_stop': 147, 'sideways_use_sma': True, 'sideways_use_ema': True, 'sideways_use_atr': False, 'sideways_use_adx': False, 'sideways_use_spike': False, 'sideways_rsi_required': True}.
[I 2025-08-30 18:43:02,613] Trial 119 finished with values: [-1000000000.0, 1000000000.0] and parameters: {'p_sma': 6, 'p_std': 32, 'p_atr': 26, 'p_adx': 18, 'rsi_period': 22, 'ema1': 25, 'ema2': 31, 'slip_atr_k': 0.08914614988289025, 'slip_spread_k': 0.2115301150343105, 'spread_hl_frac': 0.008973117529741195, 'bb_std_mult': 3.3471577933601537, 'rsi_os': 48, 'rsi_ob': 72, 'vol_spike': 0.2490942746531003, 'adx_thresh': 10.415776133623478, 'atr_min_pct': 0.012929809482222412, 'atr_max_pct': 0.0922617333116374, 'tp_mult': 2.4373416922047277, 'tsl_mult': 0.9092568179358149, 'strategy': 'mean_reversion', 'time_stop': 180, 'use_sma': True, 'use_atr': True, 'use_adx': True, 'use_ema': False, 'use_spike': False, 'rsi_required': True, 'edge_k': 0.27226527674739387, 'edge_cap': 0.9033722102424695, 'bull_strategy': 'mean_reversion', 'bull_bb_std_mult': 2.645220384526306, 'bull_rsi_os': 33, 'bull_rsi_ob': 51, 'bull_adx_thresh': 19.21219702140414, 'bull_atr_min_pct': 0.0007894373335268518, 'bull_atr_max_pct': 0.05628337295016024, 'bull_tp_mult': 2.634263656664842, 'bull_tsl_mult': 0.3574206345272948, 'bull_time_stop': 45, 'bull_use_sma': False, 'bull_use_ema': True, 'bull_use_atr': True, 'bull_use_adx': True, 'bull_use_spike': False, 'bull_rsi_required': False, 'bear_strategy': 'breakout', 'bear_bb_std_mult': 2.982208335865503, 'bear_rsi_os': 51, 'bear_rsi_ob': 75, 'bear_adx_thresh': 16.680032986498947, 'bear_atr_min_pct': 0.01388470480710941, 'bear_atr_max_pct': 0.035814763842748815, 'bear_tp_mult': 2.801010099364483, 'bear_tsl_mult': 0.5266769450848078, 'bear_time_stop': 101, 'bear_use_sma': True, 'bear_use_ema': True, 'bear_use_atr': False, 'bear_use_adx': False, 'bear_use_spike': False, 'bear_rsi_required': True, 'sideways_strategy': 'breakout', 'sideways_bb_std_mult': 3.251401299180378, 'sideways_rsi_os': 27, 'sideways_rsi_ob': 65, 'sideways_adx_thresh': 11.369176282679584, 'sideways_atr_min_pct': 0.01183962564266658, 'sideways_atr_max_pct': 0.14820078562806352, 'sideways_tp_mult': 2.6663817335239814, 'sideways_tsl_mult': 0.9747149174863079, 'sideways_time_stop': 162, 'sideways_use_sma': True, 'sideways_use_ema': True, 'sideways_use_atr': False, 'sideways_use_adx': False, 'sideways_use_spike': False, 'sideways_rsi_required': True}.
[I 2025-08-30 18:43:02,700] Trial 122 finished with values: [-1000000000.0, 1000000000.0] and parameters: {'p_sma': 8, 'p_std': 33, 'p_atr': 20, 'p_adx': 28, 'rsi_period': 22, 'ema1': 12, 'ema2': 43, 'slip_atr_k': 0.18330492120555963, 'slip_spread_k': 0.14125395349735437, 'spread_hl_frac': 0.02461648174688849, 'bb_std_mult': 2.6260146944920715, 'rsi_os': 48, 'rsi_ob': 64, 'vol_spike': 0.2964313197393738, 'adx_thresh': 10.419547746110156, 'atr_min_pct': 0.01242065843114265, 'atr_max_pct': 0.09262232923602783, 'tp_mult': 2.4306994942289677, 'tsl_mult': 0.8031075189200738, 'strategy': 'mean_reversion', 'time_stop': 208, 'use_sma': False, 'use_atr': False, 'use_adx': False, 'use_ema': False, 'use_spike': True, 'rsi_required': False, 'edge_k': 0.9441853443897386, 'edge_cap': 0.7978445301930592, 'bull_strategy': 'mean_reversion', 'bull_bb_std_mult': 3.2535371608276753, 'bull_rsi_os': 31, 'bull_rsi_ob': 77, 'bull_adx_thresh': 11.470559978044264, 'bull_atr_min_pct': 6.760489358398065e-05, 'bull_atr_max_pct': 0.056647431536630044, 'bull_tp_mult': 2.8757742761478458, 'bull_tsl_mult': 0.7100490970707602, 'bull_time_stop': 191, 'bull_use_sma': False, 'bull_use_ema': True, 'bull_use_atr': False, 'bull_use_adx': True, 'bull_use_spike': True, 'bull_rsi_required': False, 'bear_strategy': 'mean_reversion', 'bear_bb_std_mult': 0.6266753870277093, 'bear_rsi_os': 49, 'bear_rsi_ob': 73, 'bear_adx_thresh': 18.08162038474609, 'bear_atr_min_pct': 0.01399275371159672, 'bear_atr_max_pct': 0.03659812718170747, 'bear_tp_mult': 1.0850670025534992, 'bear_tsl_mult': 0.26719270888822677, 'bear_time_stop': 214, 'bear_use_sma': True, 'bear_use_ema': False, 'bear_use_atr': False, 'bear_use_adx': False, 'bear_use_spike': True, 'bear_rsi_required': True, 'sideways_strategy': 'breakout', 'sideways_bb_std_mult': 3.2108505018487756, 'sideways_rsi_os': 37, 'sideways_rsi_ob': 56, 'sideways_adx_thresh': 10.916599485154338, 'sideways_atr_min_pct': 0.0033943941196930925, 'sideways_atr_max_pct': 0.14887634302047761, 'sideways_tp_mult': 1.661446524422958, 'sideways_tsl_mult': 0.7083366773088305, 'sideways_time_stop': 30, 'sideways_use_sma': False, 'sideways_use_ema': True, 'sideways_use_atr': True, 'sideways_use_adx': True, 'sideways_use_spike': False, 'sideways_rsi_required': True}.
[I 2025-08-30 18:43:35,983] Trial 124 finished with values: [-1000000000.0, 1000000000.0] and parameters: {'p_sma': 8, 'p_std': 44, 'p_atr': 24, 'p_adx': 21, 'rsi_period': 29, 'ema1': 23, 'ema2': 44, 'slip_atr_k': 0.18334013730513427, 'slip_spread_k': 0.0683894496767858, 'spread_hl_frac': 0.008944300404330734, 'bb_std_mult': 2.572449631158717, 'rsi_os': 17, 'rsi_ob': 78, 'vol_spike': 0.29681998235455903, 'adx_thresh': 27.971108649981133, 'atr_min_pct': 0.009210169189781467, 'atr_max_pct': 0.0959105595610027, 'tp_mult': 2.1762546734141845, 'tsl_mult': 0.05116171547661119, 'strategy': 'mean_reversion', 'time_stop': 190, 'use_sma': False, 'use_atr': True, 'use_adx': True, 'use_ema': False, 'use_spike': True, 'rsi_required': False, 'edge_k': 0.13116562623679076, 'edge_cap': 0.9278329707203867, 'bull_strategy': 'mean_reversion', 'bull_bb_std_mult': 3.230948649387927, 'bull_rsi_os': 30, 'bull_rsi_ob': 48, 'bull_adx_thresh': 15.129617594981031, 'bull_atr_min_pct': 0.002893456990914137, 'bull_atr_max_pct': 0.06772077285826814, 'bull_tp_mult': 2.7962184910903902, 'bull_tsl_mult': 0.30027638468516105, 'bull_time_stop': 5, 'bull_use_sma': False, 'bull_use_ema': True, 'bull_use_atr': True, 'bull_use_adx': False, 'bull_use_spike': False, 'bull_rsi_required': True, 'bear_strategy': 'mean_reversion', 'bear_bb_std_mult': 3.1668599897466745, 'bear_rsi_os': 51, 'bear_rsi_ob': 50, 'bear_adx_thresh': 17.4546712415488, 'bear_atr_min_pct': 0.013824968182698898, 'bear_atr_max_pct': 0.03544996856792193, 'bear_tp_mult': 2.585260994833239, 'bear_tsl_mult': 0.43359521913864174, 'bear_time_stop': 212, 'bear_use_sma': False, 'bear_use_ema': True, 'bear_use_atr': False, 'bear_use_adx': False, 'bear_use_spike': False, 'bear_rsi_required': True, 'sideways_strategy': 'breakout', 'sideways_bb_std_mult': 3.0091405974797985, 'sideways_rsi_os': 47, 'sideways_rsi_ob': 56, 'sideways_adx_thresh': 21.466042414333756, 'sideways_atr_min_pct': 0.002534062561777229, 'sideways_atr_max_pct': 0.04136456024130593, 'sideways_tp_mult': 1.5067553298980227, 'sideways_tsl_mult': 0.8786315825286155, 'sideways_time_stop': 202, 'sideways_use_sma': False, 'sideways_use_ema': True, 'sideways_use_atr': True, 'sideways_use_adx': True, 'sideways_use_spike': False, 'sideways_rsi_required': True}.
[I 2025-08-30 18:43:36,250] Trial 125 finished with values: [-0.022629859601548175, 0.022578544711320668] and parameters: {'p_sma': 58, 'p_std': 46, 'p_atr': 24, 'p_adx': 21, 'rsi_period': 29, 'ema1': 30, 'ema2': 33, 'slip_atr_k': 0.08448045294844178, 'slip_spread_k': 0.07426878473275376, 'spread_hl_frac': 0.025460627798893236, 'bb_std_mult': 3.0677573870473203, 'rsi_os': 17, 'rsi_ob': 61, 'vol_spike': 0.2594511638525923, 'adx_thresh': 28.359750991970397, 'atr_min_pct': 0.023924344030409748, 'atr_max_pct': 0.10211959844936866, 'tp_mult': 2.2518543318165323, 'tsl_mult': 0.04808553166458618, 'strategy': 'mean_reversion', 'time_stop': 191, 'use_sma': False, 'use_atr': True, 'use_adx': True, 'use_ema': False, 'use_spike': True, 'rsi_required': False, 'edge_k': 0.14786536365386252, 'edge_cap': 0.6698742992543765, 'bull_strategy': 'mean_reversion', 'bull_bb_std_mult': 2.8064384825412634, 'bull_rsi_os': 31, 'bull_rsi_ob': 48, 'bull_adx_thresh': 32.154783466967984, 'bull_atr_min_pct': 0.0030319853864768974, 'bull_atr_max_pct': 0.12456516718968864, 'bull_tp_mult': 2.593270969469632, 'bull_tsl_mult': 0.6301247350603335, 'bull_time_stop': 173, 'bull_use_sma': False, 'bull_use_ema': True, 'bull_use_atr': True, 'bull_use_adx': False, 'bull_use_spike': False, 'bull_rsi_required': True, 'bear_strategy': 'mean_reversion', 'bear_bb_std_mult': 3.1599501219281394, 'bear_rsi_os': 53, 'bear_rsi_ob': 76, 'bear_adx_thresh': 17.25962445577504, 'bear_atr_min_pct': 0.02359954405335641, 'bear_atr_max_pct': 0.02754471131428591, 'bear_tp_mult': 2.586345438285024, 'bear_tsl_mult': 0.4337574431898995, 'bear_time_stop': 189, 'bear_use_sma': False, 'bear_use_ema': True, 'bear_use_atr': False, 'bear_use_adx': False, 'bear_use_spike': False, 'bear_rsi_required': True, 'sideways_strategy': 'breakout', 'sideways_bb_std_mult': 2.9845873802875422, 'sideways_rsi_os': 48, 'sideways_rsi_ob': 51, 'sideways_adx_thresh': 21.83436671007964, 'sideways_atr_min_pct': 0.002477461753763715, 'sideways_atr_max_pct': 0.1363251219024264, 'sideways_tp_mult': 1.0690838585062923, 'sideways_tsl_mult': 0.9188237664055627, 'sideways_time_stop': 44, 'sideways_use_sma': False, 'sideways_use_ema': True, 'sideways_use_atr': True, 'sideways_use_adx': False, 'sideways_use_spike': False, 'sideways_rsi_required': True}.
[I 2025-08-30 18:43:36,671] Trial 126 finished with values: [-0.03667122799956346, 0.03655752203401116] and parameters: {'p_sma': 15, 'p_std': 30, 'p_atr': 10, 'p_adx': 29, 'rsi_period': 47, 'ema1': 23, 'ema2': 33, 'slip_atr_k': 0.08430862924608266, 'slip_spread_k': 0.07282608504467364, 'spread_hl_frac': 0.02828959602836944, 'bb_std_mult': 2.8427838915790145, 'rsi_os': 20, 'rsi_ob': 78, 'vol_spike': 0.21015471170268646, 'adx_thresh': 32.20404570906558, 'atr_min_pct': 0.023975435234721128, 'atr_max_pct': 0.10258166184340808, 'tp_mult': 2.185693316330086, 'tsl_mult': 0.5054073842689958, 'strategy': 'mean_reversion', 'time_stop': 192, 'use_sma': False, 'use_atr': True, 'use_adx': True, 'use_ema': False, 'use_spike': True, 'rsi_required': False, 'edge_k': 0.9028632441426465, 'edge_cap': 0.6806508497961411, 'bull_strategy': 'mean_reversion', 'bull_bb_std_mult': 3.219508035477961, 'bull_rsi_os': 30, 'bull_rsi_ob': 48, 'bull_adx_thresh': 27.615948547243775, 'bull_atr_min_pct': 0.0031467188181901373, 'bull_atr_max_pct': 0.12414017760429623, 'bull_tp_mult': 1.6362187501099548, 'bull_tsl_mult': 0.6216482692250782, 'bull_time_stop': 25, 'bull_use_sma': False, 'bull_use_ema': True, 'bull_use_atr': True, 'bull_use_adx': False, 'bull_use_spike': False, 'bull_rsi_required': True, 'bear_strategy': 'mean_reversion', 'bear_bb_std_mult': 3.1833359529649026, 'bear_rsi_os': 20, 'bear_rsi_ob': 49, 'bear_adx_thresh': 17.44298036183553, 'bear_atr_min_pct': 0.017252407457889803, 'bear_atr_max_pct': 0.02788600143289733, 'bear_tp_mult': 2.589592981597586, 'bear_tsl_mult': 0.19327843750389662, 'bear_time_stop': 13, 'bear_use_sma': False, 'bear_use_ema': True, 'bear_use_atr': False, 'bear_use_adx': False, 'bear_use_spike': False, 'bear_rsi_required': True, 'sideways_strategy': 'breakout', 'sideways_bb_std_mult': 1.0256674072374887, 'sideways_rsi_os': 48, 'sideways_rsi_ob': 59, 'sideways_adx_thresh': 24.86861471174678, 'sideways_atr_min_pct': 0.0014887074350134945, 'sideways_atr_max_pct': 0.05160528421696791, 'sideways_tp_mult': 2.7752037208791256, 'sideways_tsl_mult': 0.7927198142409732, 'sideways_time_stop': 55, 'sideways_use_sma': False, 'sideways_use_ema': True, 'sideways_use_atr': True, 'sideways_use_adx': False, 'sideways_use_spike': False, 'sideways_rsi_required': True}.
