[I 2025-08-30 20:04:45,080] Trial 837 finished with values: [-1000000000.0, 1000000000.0] and parameters: {'p_sma': 6, 'p_std': 31, 'p_atr': 17, 'p_adx': 20, 'rsi_period': 23, 'ema1': 26, 'ema2': 31, 'slip_atr_k': 0.06484922359069184, 'slip_spread_k': 0.6396092056108516, 'spread_hl_frac': 0.03195751177262415, 'bb_std_mult': 0.5852958183122308, 'rsi_os': 47, 'rsi_ob': 72, 'vol_spike': 0.27612964822434327, 'adx_thresh': 6.0160490058637865, 'atr_min_pct': 0.00898494714323405, 'atr_max_pct': 0.09368852981390335, 'tp_mult': 2.1531014429613893, 'tsl_mult': 0.8664230137551345, 'strategy': 'mean_reversion', 'time_stop': 232, 'use_sma': True, 'use_atr': True, 'use_adx': True, 'use_ema': False, 'use_spike': True, 'rsi_required': False, 'edge_k': 0.06626692899384778, 'edge_cap': 0.49645597925605206, 'bull_strategy': 'mean_reversion', 'bull_bb_std_mult': 2.988329849555428, 'bull_rsi_os': 29, 'bull_rsi_ob': 46, 'bull_adx_thresh': 18.664737957247297, 'bull_atr_min_pct': 0.026656377130117426, 'bull_atr_max_pct': 0.12224019490687005, 'bull_tp_mult': 1.8114462900923956, 'bull_tsl_mult': 0.5546066071366094, 'bull_time_stop': 205, 'bull_use_sma': False, 'bull_use_ema': True, 'bull_use_atr': True, 'bull_use_adx': False, 'bull_use_spike': False, 'bull_rsi_required': True, 'bear_strategy': 'breakout', 'bear_bb_std_mult': 3.5376470017184998, 'bear_rsi_os': 50, 'bear_rsi_ob': 73, 'bear_adx_thresh': 34.590285374448, 'bear_atr_min_pct': 0.015239768862838569, 'bear_atr_max_pct': 0.01243562502527236, 'bear_tp_mult': 2.66902388675503, 'bear_tsl_mult': 0.744363822518933, 'bear_time_stop': 128, 'bear_use_sma': True, 'bear_use_ema': True, 'bear_use_atr': False, 'bear_use_adx': False, 'bear_use_spike': False, 'bear_rsi_required': False, 'sideways_strategy': 'breakout', 'sideways_bb_std_mult': 3.1169840363765617, 'sideways_rsi_os': 6, 'sideways_rsi_ob': 87, 'sideways_adx_thresh': 21.48433148099169, 'sideways_atr_min_pct': 0.002645939380815039, 'sideways_atr_max_pct': 0.14974832766552462, 'sideways_tp_mult': 2.63396372842457, 'sideways_tsl_mult': 0.9670739421987092, 'sideways_time_stop': 161, 'sideways_use_sma': False, 'sideways_use_ema': True, 'sideways_use_atr': True, 'sideways_use_adx': False, 'sideways_use_spike': False, 'sideways_rsi_required': True}.
[I 2025-08-30 20:04:45,761] Trial 838 finished with values: [-1000000000.0, 1000000000.0] and parameters: {'p_sma': 5, 'p_std': 31, 'p_atr': 17, 'p_adx': 20, 'rsi_period': 22, 'ema1': 12, 'ema2': 34, 'slip_atr_k': 0.06625169312518056, 'slip_spread_k': 0.5150387059888384, 'spread_hl_frac': 0.03170118696090176, 'bb_std_mult': 0.9084013726556441, 'rsi_os': 25, 'rsi_ob': 50, 'vol_spike': 0.22997721021683182, 'adx_thresh': 22.360409013349358, 'atr_min_pct': 0.014522362863120766, 'atr_max_pct': 0.08486497653804387, 'tp_mult': 2.1603745715659124, 'tsl_mult': 0.8676101875086224, 'strategy': 'breakout', 'time_stop': 229, 'use_sma': False, 'use_atr': True, 'use_adx': True, 'use_ema': False, 'use_spike': True, 'rsi_required': False, 'edge_k': 1.4148161085336757, 'edge_cap': 0.5010423376654671, 'bull_strategy': 'breakout', 'bull_bb_std_mult': 2.817389701444842, 'bull_rsi_os': 27, 'bull_rsi_ob': 80, 'bull_adx_thresh': 10.226809129756166, 'bull_atr_min_pct': 0.029950359969552358, 'bull_atr_max_pct': 0.1235451011926403, 'bull_tp_mult': 2.3067347784238543, 'bull_tsl_mult': 0.5634936182302738, 'bull_time_stop': 65, 'bull_use_sma': False, 'bull_use_ema': True, 'bull_use_atr': True, 'bull_use_adx': False, 'bull_use_spike': False, 'bull_rsi_required': True, 'bear_strategy': 'breakout', 'bear_bb_std_mult': 0.9970030044229654, 'bear_rsi_os': 50, 'bear_rsi_ob': 55, 'bear_adx_thresh': 18.687290936226542, 'bear_atr_min_pct': 0.02878304553090169, 'bear_atr_max_pct': 0.10732455347391351, 'bear_tp_mult': 2.731797890510345, 'bear_tsl_mult': 0.742278365861293, 'bear_time_stop': 129, 'bear_use_sma': True, 'bear_use_ema': True, 'bear_use_atr': False, 'bear_use_adx': True, 'bear_use_spike': False, 'bear_rsi_required': True, 'sideways_strategy': 'breakout', 'sideways_bb_std_mult': 3.151970159702901, 'sideways_rsi_os': 35, 'sideways_rsi_ob': 60, 'sideways_adx_thresh': 14.472567307456995, 'sideways_atr_min_pct': 0.0028393228145786368, 'sideways_atr_max_pct': 0.14977224089032523, 'sideways_tp_mult': 2.94383795138317, 'sideways_tsl_mult': 0.9682229234610346, 'sideways_time_stop': 148, 'sideways_use_sma': True, 'sideways_use_ema': True, 'sideways_use_atr': True, 'sideways_use_adx': False, 'sideways_use_spike': False, 'sideways_rsi_required': True}.
[I 2025-08-30 20:04:46,689] Trial 841 finished with values: [-1000000000.0, 1000000000.0] and parameters: {'p_sma': 7, 'p_std': 6, 'p_atr': 7, 'p_adx': 20, 'rsi_period': 22, 'ema1': 26, 'ema2': 13, 'slip_atr_k': 0.06739608460919315, 'slip_spread_k': 0.13405959545060953, 'spread_hl_frac': 0.02448792491215774, 'bb_std_mult': 2.034536905746901, 'rsi_os': 50, 'rsi_ob': 45, 'vol_spike': 0.27677971045580896, 'adx_thresh': 33.70905786805108, 'atr_min_pct': 0.02344142104607871, 'atr_max_pct': 0.014504461990371989, 'tp_mult': 2.2214149162503407, 'tsl_mult': 0.9352593543509753, 'strategy': 'breakout', 'time_stop': 206, 'use_sma': False, 'use_atr': True, 'use_adx': True, 'use_ema': False, 'use_spike': True, 'rsi_required': False, 'edge_k': 0.19194938378225448, 'edge_cap': 0.9003668864860799, 'bull_strategy': 'breakout', 'bull_bb_std_mult': 3.172420806090481, 'bull_rsi_os': 33, 'bull_rsi_ob': 79, 'bull_adx_thresh': 5.634697993052157, 'bull_atr_min_pct': 0.023512786050528943, 'bull_atr_max_pct': 0.07004826619953022, 'bull_tp_mult': 2.3026550313290364, 'bull_tsl_mult': 0.5310546782232779, 'bull_time_stop': 64, 'bull_use_sma': False, 'bull_use_ema': True, 'bull_use_atr': False, 'bull_use_adx': True, 'bull_use_spike': False, 'bull_rsi_required': False, 'bear_strategy': 'breakout', 'bear_bb_std_mult': 2.8222898067096613, 'bear_rsi_os': 51, 'bear_rsi_ob': 64, 'bear_adx_thresh': 19.991334192654232, 'bear_atr_min_pct': 0.015443282476528736, 'bear_atr_max_pct': 0.022704228755239076, 'bear_tp_mult': 2.7653147048920053, 'bear_tsl_mult': 0.7653417614956495, 'bear_time_stop': 115, 'bear_use_sma': False, 'bear_use_ema': True, 'bear_use_atr': False, 'bear_use_adx': True, 'bear_use_spike': False, 'bear_rsi_required': True, 'sideways_strategy': 'breakout', 'sideways_bb_std_mult': 3.070261724338813, 'sideways_rsi_os': 36, 'sideways_rsi_ob': 66, 'sideways_adx_thresh': 6.045786384145094, 'sideways_atr_min_pct': 0.0061923636707839555, 'sideways_atr_max_pct': 0.02362033459084758, 'sideways_tp_mult': 2.9558458663411447, 'sideways_tsl_mult': 0.985817793405627, 'sideways_time_stop': 147, 'sideways_use_sma': True, 'sideways_use_ema': False, 'sideways_use_atr': False, 'sideways_use_adx': False, 'sideways_use_spike': True, 'sideways_rsi_required': False}.
[I 2025-08-30 20:05:11,528] Trial 839 finished with values: [-0.13087531820955833, 0.13085813670590693] and parameters: {'p_sma': 54, 'p_std': 33, 'p_atr': 17, 'p_adx': 20, 'rsi_period': 37, 'ema1': 12, 'ema2': 34, 'slip_atr_k': 0.06620988883861084, 'slip_spread_k': 0.4205263246559777, 'spread_hl_frac': 0.024555067471162505, 'bb_std_mult': 2.425028960289651, 'rsi_os': 54, 'rsi_ob': 85, 'vol_spike': 0.2289014826322605, 'adx_thresh': 6.263203247686963, 'atr_min_pct': 0.02132151733251852, 'atr_max_pct': 0.10491837600108529, 'tp_mult': 2.9048902732965254, 'tsl_mult': 0.8683274087664022, 'strategy': 'breakout', 'time_stop': 229, 'use_sma': False, 'use_atr': True, 'use_adx': True, 'use_ema': False, 'use_spike': True, 'rsi_required': False, 'edge_k': 0.07509228681165836, 'edge_cap': 0.5010511275265322, 'bull_strategy': 'breakout', 'bull_bb_std_mult': 3.1858348144393283, 'bull_rsi_os': 23, 'bull_rsi_ob': 80, 'bull_adx_thresh': 19.60100612969071, 'bull_atr_min_pct': 0.018365064357966178, 'bull_atr_max_pct': 0.12254080703923305, 'bull_tp_mult': 1.0404060400914827, 'bull_tsl_mult': 0.3759341533189294, 'bull_time_stop': 119, 'bull_use_sma': False, 'bull_use_ema': True, 'bull_use_atr': True, 'bull_use_adx': False, 'bull_use_spike': False, 'bull_rsi_required': True, 'bear_strategy': 'breakout', 'bear_bb_std_mult': 0.9853980438763303, 'bear_rsi_os': 50, 'bear_rsi_ob': 76, 'bear_adx_thresh': 21.34781428893789, 'bear_atr_min_pct': 0.015178882270308173, 'bear_atr_max_pct': 0.04496528682014031, 'bear_tp_mult': 1.4622631171953653, 'bear_tsl_mult': 0.5298173680595278, 'bear_time_stop': 38, 'bear_use_sma': False, 'bear_use_ema': True, 'bear_use_atr': False, 'bear_use_adx': True, 'bear_use_spike': False, 'bear_rsi_required': False, 'sideways_strategy': 'breakout', 'sideways_bb_std_mult': 1.4483075649152772, 'sideways_rsi_os': 48, 'sideways_rsi_ob': 60, 'sideways_adx_thresh': 20.08905719892361, 'sideways_atr_min_pct': 0.0006450506012229201, 'sideways_atr_max_pct': 0.042228847061560486, 'sideways_tp_mult': 2.9017386797699896, 'sideways_tsl_mult': 0.6448967784288576, 'sideways_time_stop': 89, 'sideways_use_sma': True, 'sideways_use_ema': True, 'sideways_use_atr': False, 'sideways_use_adx': False, 'sideways_use_spike': False, 'sideways_rsi_required': True}.
[I 2025-08-30 20:05:12,076] Trial 840 finished with values: [-0.05153358131454566, 0.0514499106770789] and parameters: {'p_sma': 29, 'p_std': 33, 'p_atr': 30, 'p_adx': 20, 'rsi_period': 22, 'ema1': 12, 'ema2': 35, 'slip_atr_k': 0.006577200894430674, 'slip_spread_k': 0.13773985508416683, 'spread_hl_frac': 0.023980060274540513, 'bb_std_mult': 2.4113251400427864, 'rsi_os': 24, 'rsi_ob': 85, 'vol_spike': 0.2724857922868193, 'adx_thresh': 33.54014018790636, 'atr_min_pct': 0.014597622297287883, 'atr_max_pct': 0.017586138476793196, 'tp_mult': 2.911972036292711, 'tsl_mult': 0.5180394244970598, 'strategy': 'breakout', 'time_stop': 209, 'use_sma': False, 'use_atr': True, 'use_adx': True, 'use_ema': False, 'use_spike': True, 'rsi_required': False, 'edge_k': 0.5211696005708336, 'edge_cap': 0.12816859081570653, 'bull_strategy': 'breakout', 'bull_bb_std_mult': 3.18699412330062, 'bull_rsi_os': 23, 'bull_rsi_ob': 72, 'bull_adx_thresh': 15.477196196241295, 'bull_atr_min_pct': 0.004283046152284172, 'bull_atr_max_pct': 0.1225032970237158, 'bull_tp_mult': 1.7251804598076497, 'bull_tsl_mult': 0.4537853751245501, 'bull_time_stop': 205, 'bull_use_sma': False, 'bull_use_ema': True, 'bull_use_atr': False, 'bull_use_adx': False, 'bull_use_spike': False, 'bull_rsi_required': True, 'bear_strategy': 'breakout', 'bear_bb_std_mult': 0.9526248556346075, 'bear_rsi_os': 51, 'bear_rsi_ob': 76, 'bear_adx_thresh': 18.484188671722094, 'bear_atr_min_pct': 0.028653060148527264, 'bear_atr_max_pct': 0.023945146679740674, 'bear_tp_mult': 1.788578576574618, 'bear_tsl_mult': 0.7438333143985173, 'bear_time_stop': 212, 'bear_use_sma': False, 'bear_use_ema': True, 'bear_use_atr': False, 'bear_use_adx': True, 'bear_use_spike': False, 'bear_rsi_required': False, 'sideways_strategy': 'breakout', 'sideways_bb_std_mult': 2.9501124114690076, 'sideways_rsi_os': 29, 'sideways_rsi_ob': 66, 'sideways_adx_thresh': 6.080484033414802, 'sideways_atr_min_pct': 0.0004978579517907335, 'sideways_atr_max_pct': 0.14374043657576566, 'sideways_tp_mult': 2.915838862170471, 'sideways_tsl_mult': 0.9999667349485151, 'sideways_time_stop': 148, 'sideways_use_sma': True, 'sideways_use_ema': True, 'sideways_use_atr': False, 'sideways_use_adx': False, 'sideways_use_spike': True, 'sideways_rsi_required': True}.
[I 2025-08-30 20:05:14,447] Trial 842 finished with values: [-0.09713302813078462, 0.09704355357483606] and parameters: {'p_sma': 7, 'p_std': 28, 'p_atr': 12, 'p_adx': 21, 'rsi_period': 13, 'ema1': 28, 'ema2': 29, 'slip_atr_k': 0.165320935390602, 'slip_spread_k': 0.9647205309511747, 'spread_hl_frac': 0.02440900171052746, 'bb_std_mult': 2.421931588936627, 'rsi_os': 50, 'rsi_ob': 57, 'vol_spike': 0.2621557740168282, 'adx_thresh': 33.71086263526214, 'atr_min_pct': 0.0235246031337244, 'atr_max_pct': 0.11399166090669886, 'tp_mult': 2.216116290952419, 'tsl_mult': 0.8368661985187268, 'strategy': 'breakout', 'time_stop': 42, 'use_sma': False, 'use_atr': True, 'use_adx': True, 'use_ema': False, 'use_spike': True, 'rsi_required': False, 'edge_k': 0.518266839689609, 'edge_cap': 0.4157151722090347, 'bull_strategy': 'breakout', 'bull_bb_std_mult': 2.525645289397841, 'bull_rsi_os': 32, 'bull_rsi_ob': 77, 'bull_adx_thresh': 19.73043371163658, 'bull_atr_min_pct': 0.005010799027230834, 'bull_atr_max_pct': 0.09856477053874471, 'bull_tp_mult': 2.820585978872356, 'bull_tsl_mult': 0.26164205372999927, 'bull_time_stop': 150, 'bull_use_sma': False, 'bull_use_ema': True, 'bull_use_atr': False, 'bull_use_adx': True, 'bull_use_spike': False, 'bull_rsi_required': False, 'bear_strategy': 'breakout', 'bear_bb_std_mult': 0.5718709744830526, 'bear_rsi_os': 51, 'bear_rsi_ob': 76, 'bear_adx_thresh': 19.953756872861273, 'bear_atr_min_pct': 0.01541944175397769, 'bear_atr_max_pct': 0.03508955340086713, 'bear_tp_mult': 2.7569233744115453, 'bear_tsl_mult': 0.5322418597536452, 'bear_time_stop': 212, 'bear_use_sma': False, 'bear_use_ema': True, 'bear_use_atr': False, 'bear_use_adx': True, 'bear_use_spike': False, 'bear_rsi_required': True, 'sideways_strategy': 'breakout', 'sideways_bb_std_mult': 1.565093873597199, 'sideways_rsi_os': 36, 'sideways_rsi_ob': 57, 'sideways_adx_thresh': 7.905597455650476, 'sideways_atr_min_pct': 0.0007165462467053202, 'sideways_atr_max_pct': 0.13547724090419672, 'sideways_tp_mult': 1.8611954549314744, 'sideways_tsl_mult': 0.1884647528323562, 'sideways_time_stop': 20, 'sideways_use_sma': True, 'sideways_use_ema': False, 'sideways_use_atr': False, 'sideways_use_adx': False, 'sideways_use_spike': True, 'sideways_rsi_required': False}.
[I 2025-08-30 20:05:22,340] Trial 843 finished with values: [-0.09511556758810435, 0.09509919811910493] and parameters: {'p_sma': 30, 'p_std': 44, 'p_atr': 8, 'p_adx': 18, 'rsi_period': 28, 'ema1': 28, 'ema2': 31, 'slip_atr_k': 0.2146360132190649, 'slip_spread_k': 0.4207503498225955, 'spread_hl_frac': 0.02244082436245439, 'bb_std_mult': 3.036879033887918, 'rsi_os': 48, 'rsi_ob': 60, 'vol_spike': 0.25967700388949977, 'adx_thresh': 9.820252349083793, 'atr_min_pct': 0.02440737422920328, 'atr_max_pct': 0.03782217417865158, 'tp_mult': 2.276042375337235, 'tsl_mult': 0.8027497663578765, 'strategy': 'mean_reversion', 'time_stop': 194, 'use_sma': False, 'use_atr': True, 'use_adx': False, 'use_ema': False, 'use_spike': True, 'rsi_required': False, 'edge_k': 0.07936494011060344, 'edge_cap': 0.43634814628698243, 'bull_strategy': 'mean_reversion', 'bull_bb_std_mult': 1.552142791912066, 'bull_rsi_os': 23, 'bull_rsi_ob': 48, 'bull_adx_thresh': 19.492612151658196, 'bull_atr_min_pct': 0.004290125582230483, 'bull_atr_max_pct': 0.13177232297358488, 'bull_tp_mult': 2.611014395774936, 'bull_tsl_mult': 0.4567411388007716, 'bull_time_stop': 137, 'bull_use_sma': False, 'bull_use_ema': True, 'bull_use_atr': True, 'bull_use_adx': False, 'bull_use_spike': False, 'bull_rsi_required': True, 'bear_strategy': 'breakout', 'bear_bb_std_mult': 2.7671640946658016, 'bear_rsi_os': 7, 'bear_rsi_ob': 77, 'bear_adx_thresh': 18.24142494419262, 'bear_atr_min_pct': 0.014979896408607411, 'bear_atr_max_pct': 0.08926933155103238, 'bear_tp_mult': 1.4578196739224212, 'bear_tsl_mult': 0.8121453931940361, 'bear_time_stop': 211, 'bear_use_sma': False, 'bear_use_ema': True, 'bear_use_atr': True, 'bear_use_adx': False, 'bear_use_spike': False, 'bear_rsi_required': False, 'sideways_strategy': 'breakout', 'sideways_bb_std_mult': 0.9315275407449264, 'sideways_rsi_os': 39, 'sideways_rsi_ob': 57, 'sideways_adx_thresh': 7.789651443341459, 'sideways_atr_min_pct': 0.0011937196059288472, 'sideways_atr_max_pct': 0.14364439703114948, 'sideways_tp_mult': 2.8919461331498675, 'sideways_tsl_mult': 0.18411146644138932, 'sideways_time_stop': 156, 'sideways_use_sma': False, 'sideways_use_ema': True, 'sideways_use_atr': False, 'sideways_use_adx': False, 'sideways_use_spike': False, 'sideways_rsi_required': True}.
[I 2025-08-30 20:05:23,228] Trial 847 finished with values: [-1000000000.0, 1000000000.0] and parameters: {'p_sma': 8, 'p_std': 58, 'p_atr': 25, 'p_adx': 19, 'rsi_period': 24, 'ema1': 17, 'ema2': 40, 'slip_atr_k': 0.1100732347906478, 'slip_spread_k': 0.16460820682465718, 'spread_hl_frac': 0.02643323079068125, 'bb_std_mult': 2.1590680188991414, 'rsi_os': 47, 'rsi_ob': 49, 'vol_spike': 0.1903792846798411, 'adx_thresh': 34.54385345444261, 'atr_min_pct': 0.009699929193050176, 'atr_max_pct': 0.14270999872506257, 'tp_mult': 2.2990889027692876, 'tsl_mult': 0.29552106639062997, 'strategy': 'mean_reversion', 'time_stop': 160, 'use_sma': True, 'use_atr': True, 'use_adx': False, 'use_ema': False, 'use_spike': True, 'rsi_required': True, 'edge_k': 0.16286197082781748, 'edge_cap': 0.5362283188600476, 'bull_strategy': 'mean_reversion', 'bull_bb_std_mult': 3.298521918123315, 'bull_rsi_os': 31, 'bull_rsi_ob': 46, 'bull_adx_thresh': 18.61313165302918, 'bull_atr_min_pct': 0.0014921481646467253, 'bull_atr_max_pct': 0.11502288635079018, 'bull_tp_mult': 2.710758936121075, 'bull_tsl_mult': 0.4975098791841528, 'bull_time_stop': 173, 'bull_use_sma': False, 'bull_use_ema': False, 'bull_use_atr': True, 'bull_use_adx': False, 'bull_use_spike': True, 'bull_rsi_required': True, 'bear_strategy': 'breakout', 'bear_bb_std_mult': 2.8641917284470453, 'bear_rsi_os': 48, 'bear_rsi_ob': 75, 'bear_adx_thresh': 17.166107358769814, 'bear_atr_min_pct': 0.01097217569483126, 'bear_atr_max_pct': 0.07894773687725938, 'bear_tp_mult': 2.6264302689214416, 'bear_tsl_mult': 0.02640181985421386, 'bear_time_stop': 180, 'bear_use_sma': True, 'bear_use_ema': False, 'bear_use_atr': True, 'bear_use_adx': False, 'bear_use_spike': False, 'bear_rsi_required': True, 'sideways_strategy': 'mean_reversion', 'sideways_bb_std_mult': 3.3063407491894172, 'sideways_rsi_os': 33, 'sideways_rsi_ob': 58, 'sideways_adx_thresh': 33.35147307047036, 'sideways_atr_min_pct': 0.012856807742496706, 'sideways_atr_max_pct': 0.14628765431722424, 'sideways_tp_mult': 1.106657253152475, 'sideways_tsl_mult': 0.9309987954893909, 'sideways_time_stop': 8, 'sideways_use_sma': False, 'sideways_use_ema': True, 'sideways_use_atr': True, 'sideways_use_adx': True, 'sideways_use_spike': False, 'sideways_rsi_required': True}.
[I 2025-08-30 20:05:48,168] Trial 845 finished with values: [-1000000000.0, 1000000000.0] and parameters: {'p_sma': 8, 'p_std': 18, 'p_atr': 25, 'p_adx': 21, 'rsi_period': 25, 'ema1': 14, 'ema2': 29, 'slip_atr_k': 0.07780434348706812, 'slip_spread_k': 0.16546424700408985, 'spread_hl_frac': 0.02216656078897797, 'bb_std_mult': 0.7044025645026986, 'rsi_os': 48, 'rsi_ob': 80, 'vol_spike': 0.2603251683452943, 'adx_thresh': 24.42523851556462, 'atr_min_pct': 0.024333669800375907, 'atr_max_pct': 0.0998488173665455, 'tp_mult': 2.9994283880203696, 'tsl_mult': 0.8021635429432177, 'strategy': 'mean_reversion', 'time_stop': 197, 'use_sma': False, 'use_atr': True, 'use_adx': False, 'use_ema': False, 'use_spike': True, 'rsi_required': True, 'edge_k': 0.9172593609327436, 'edge_cap': 0.29088637701526127, 'bull_strategy': 'mean_reversion', 'bull_bb_std_mult': 3.311672667834644, 'bull_rsi_os': 32, 'bull_rsi_ob': 46, 'bull_adx_thresh': 18.848584918171248, 'bull_atr_min_pct': 0.021818721343824867, 'bull_atr_max_pct': 0.14248620175500296, 'bull_tp_mult': 2.8651434942115066, 'bull_tsl_mult': 0.5047911180099776, 'bull_time_stop': 172, 'bull_use_sma': False, 'bull_use_ema': False, 'bull_use_atr': True, 'bull_use_adx': True, 'bull_use_spike': False, 'bull_rsi_required': False, 'bear_strategy': 'breakout', 'bear_bb_std_mult': 2.878504175712422, 'bear_rsi_os': 32, 'bear_rsi_ob': 77, 'bear_adx_thresh': 17.91445543999981, 'bear_atr_min_pct': 0.014722525770451952, 'bear_atr_max_pct': 0.034890476985963356, 'bear_tp_mult': 2.6260047612299835, 'bear_tsl_mult': 0.8176870261425712, 'bear_time_stop': 164, 'bear_use_sma': True, 'bear_use_ema': False, 'bear_use_atr': True, 'bear_use_adx': False, 'bear_use_spike': False, 'bear_rsi_required': True, 'sideways_strategy': 'breakout', 'sideways_bb_std_mult': 1.550374885132507, 'sideways_rsi_os': 9, 'sideways_rsi_ob': 58, 'sideways_adx_thresh': 28.57735805577154, 'sideways_atr_min_pct': 0.013260739921138645, 'sideways_atr_max_pct': 0.017731163896596867, 'sideways_tp_mult': 1.1083311914315668, 'sideways_tsl_mult': 0.8868500513906874, 'sideways_time_stop': 201, 'sideways_use_sma': False, 'sideways_use_ema': False, 'sideways_use_atr': True, 'sideways_use_adx': True, 'sideways_use_spike': False, 'sideways_rsi_required': False}.
