[I 2025-08-30 19:23:14,956] Trial 474 finished with values: [-1000000000.0, 1000000000.0] and parameters: {'p_sma': 54, 'p_std': 29, 'p_atr': 14, 'p_adx': 28, 'rsi_period': 16, 'ema1': 27, 'ema2': 12, 'slip_atr_k': 0.1930583702242139, 'slip_spread_k': 0.17204347999489691, 'spread_hl_frac': 0.02363930678760464, 'bb_std_mult': 2.092024609744936, 'rsi_os': 5, 'rsi_ob': 95, 'vol_spike': 0.0015741697660755782, 'adx_thresh': 6.783464682514179, 'atr_min_pct': 0.001638394166595395, 'atr_max_pct': 0.13912729472158575, 'tp_mult': 1.2278163295143565, 'tsl_mult': 0.7893792917860837, 'strategy': 'mean_reversion', 'time_stop': 115, 'use_sma': True, 'use_atr': True, 'use_adx': True, 'use_ema': False, 'use_spike': False, 'rsi_required': True, 'edge_k': 0.05707391137627761, 'edge_cap': 0.48396215560581557, 'bull_strategy': 'mean_reversion', 'bull_bb_std_mult': 1.6875364962432018, 'bull_rsi_os': 32, 'bull_rsi_ob': 48, 'bull_adx_thresh': 27.338312447270077, 'bull_atr_min_pct': 0.0031743612055298203, 'bull_atr_max_pct': 0.0635720105201394, 'bull_tp_mult': 2.7305470299535255, 'bull_tsl_mult': 0.515453207161653, 'bull_time_stop': 151, 'bull_use_sma': True, 'bull_use_ema': True, 'bull_use_atr': True, 'bull_use_adx': False, 'bull_use_spike': False, 'bull_rsi_required': False, 'bear_strategy': 'breakout', 'bear_bb_std_mult': 1.4809143856433207, 'bear_rsi_os': 54, 'bear_rsi_ob': 74, 'bear_adx_thresh': 17.118474691246515, 'bear_atr_min_pct': 0.015965098432465897, 'bear_atr_max_pct': 0.03329698039092099, 'bear_tp_mult': 2.6558088237713666, 'bear_tsl_mult': 0.7312096820354353, 'bear_time_stop': 5, 'bear_use_sma': False, 'bear_use_ema': False, 'bear_use_atr': False, 'bear_use_adx': False, 'bear_use_spike': False, 'bear_rsi_required': True, 'sideways_strategy': 'breakout', 'sideways_bb_std_mult': 3.0060093619596824, 'sideways_rsi_os': 41, 'sideways_rsi_ob': 82, 'sideways_adx_thresh': 20.28504835169414, 'sideways_atr_min_pct': 0.007078984306502181, 'sideways_atr_max_pct': 0.13859991635336089, 'sideways_tp_mult': 1.2290430234140435, 'sideways_tsl_mult': 0.2552558167570528, 'sideways_time_stop': 157, 'sideways_use_sma': True, 'sideways_use_ema': True, 'sideways_use_atr': True, 'sideways_use_adx': False, 'sideways_use_spike': True, 'sideways_rsi_required': True}.
[I 2025-08-30 19:23:45,164] Trial 478 finished with values: [-1000000000.0, 1000000000.0] and parameters: {'p_sma': 46, 'p_std': 20, 'p_atr': 18, 'p_adx': 8, 'rsi_period': 12, 'ema1': 26, 'ema2': 41, 'slip_atr_k': 0.07556975525527165, 'slip_spread_k': 0.7546644054155225, 'spread_hl_frac': 0.02268825094617457, 'bb_std_mult': 3.4962894893485306, 'rsi_os': 26, 'rsi_ob': 84, 'vol_spike': 0.13341639188623436, 'adx_thresh': 18.984034914952666, 'atr_min_pct': 0.002394634741994415, 'atr_max_pct': 0.09609804122489171, 'tp_mult': 2.3613015686216245, 'tsl_mult': 0.871911527753683, 'strategy': 'mean_reversion', 'time_stop': 196, 'use_sma': True, 'use_atr': True, 'use_adx': True, 'use_ema': False, 'use_spike': True, 'rsi_required': True, 'edge_k': 0.038600911909993235, 'edge_cap': 0.516141383023197, 'bull_strategy': 'mean_reversion', 'bull_bb_std_mult': 1.713297353354322, 'bull_rsi_os': 29, 'bull_rsi_ob': 46, 'bull_adx_thresh': 8.429865363127034, 'bull_atr_min_pct': 0.0014359618718893569, 'bull_atr_max_pct': 0.1204414922525423, 'bull_tp_mult': 2.017347954358872, 'bull_tsl_mult': 0.5353793812150973, 'bull_time_stop': 167, 'bull_use_sma': True, 'bull_use_ema': True, 'bull_use_atr': True, 'bull_use_adx': False, 'bull_use_spike': False, 'bull_rsi_required': True, 'bear_strategy': 'breakout', 'bear_bb_std_mult': 1.4952590838946707, 'bear_rsi_os': 13, 'bear_rsi_ob': 70, 'bear_adx_thresh': 25.75415133837014, 'bear_atr_min_pct': 0.010839325024864864, 'bear_atr_max_pct': 0.03884817195868287, 'bear_tp_mult': 2.7869372501578678, 'bear_tsl_mult': 0.7122748433358765, 'bear_time_stop': 7, 'bear_use_sma': True, 'bear_use_ema': False, 'bear_use_atr': False, 'bear_use_adx': False, 'bear_use_spike': False, 'bear_rsi_required': True, 'sideways_strategy': 'breakout', 'sideways_bb_std_mult': 3.3583376217251018, 'sideways_rsi_os': 38, 'sideways_rsi_ob': 91, 'sideways_adx_thresh': 23.97351801224537, 'sideways_atr_min_pct': 0.028997226792909496, 'sideways_atr_max_pct': 0.14171669477138088, 'sideways_tp_mult': 2.930487580503471, 'sideways_tsl_mult': 0.244658407862754, 'sideways_time_stop': 254, 'sideways_use_sma': False, 'sideways_use_ema': True, 'sideways_use_atr': True, 'sideways_use_adx': False, 'sideways_use_spike': False, 'sideways_rsi_required': True}.
[I 2025-08-30 19:23:49,580] Trial 479 finished with values: [-0.03014297535596766, 0.030108491606746706] and parameters: {'p_sma': 21, 'p_std': 58, 'p_atr': 18, 'p_adx': 20, 'rsi_period': 23, 'ema1': 26, 'ema2': 58, 'slip_atr_k': 0.10137834444101454, 'slip_spread_k': 0.15779443727166717, 'spread_hl_frac': 0.022041425388251126, 'bb_std_mult': 2.2730318751738543, 'rsi_os': 17, 'rsi_ob': 83, 'vol_spike': 0.22034533682935323, 'adx_thresh': 34.99710063210072, 'atr_min_pct': 0.0247371671889654, 'atr_max_pct': 0.0945760986393382, 'tp_mult': 2.3542843059399843, 'tsl_mult': 0.741783332489003, 'strategy': 'mean_reversion', 'time_stop': 197, 'use_sma': True, 'use_atr': True, 'use_adx': True, 'use_ema': False, 'use_spike': True, 'rsi_required': True, 'edge_k': 0.23684063131604832, 'edge_cap': 0.48508440472487724, 'bull_strategy': 'mean_reversion', 'bull_bb_std_mult': 2.1522343923123914, 'bull_rsi_os': 33, 'bull_rsi_ob': 46, 'bull_adx_thresh': 8.292773705210006, 'bull_atr_min_pct': 0.0013666886054800567, 'bull_atr_max_pct': 0.12123043902236802, 'bull_tp_mult': 2.8579393692214325, 'bull_tsl_mult': 0.815643920201736, 'bull_time_stop': 167, 'bull_use_sma': True, 'bull_use_ema': True, 'bull_use_atr': True, 'bull_use_adx': False, 'bull_use_spike': False, 'bull_rsi_required': True, 'bear_strategy': 'breakout', 'bear_bb_std_mult': 1.2603180948653745, 'bear_rsi_os': 50, 'bear_rsi_ob': 77, 'bear_adx_thresh': 17.49465127639511, 'bear_atr_min_pct': 0.013004112719769206, 'bear_atr_max_pct': 0.12757330818578547, 'bear_tp_mult': 2.3237541530147805, 'bear_tsl_mult': 0.8950330406157474, 'bear_time_stop': 196, 'bear_use_sma': True, 'bear_use_ema': False, 'bear_use_atr': False, 'bear_use_adx': False, 'bear_use_spike': False, 'bear_rsi_required': True, 'sideways_strategy': 'breakout', 'sideways_bb_std_mult': 3.3450941124367373, 'sideways_rsi_os': 30, 'sideways_rsi_ob': 82, 'sideways_adx_thresh': 23.726401245394904, 'sideways_atr_min_pct': 0.001087084453166527, 'sideways_atr_max_pct': 0.12055611489026685, 'sideways_tp_mult': 2.5170445349530284, 'sideways_tsl_mult': 0.897133100145194, 'sideways_time_stop': 66, 'sideways_use_sma': False, 'sideways_use_ema': True, 'sideways_use_atr': True, 'sideways_use_adx': False, 'sideways_use_spike': False, 'sideways_rsi_required': True}.
[I 2025-08-30 19:23:50,182] Trial 481 finished with values: [-0.018431610299290746, 0.01847503783499077] and parameters: {'p_sma': 48, 'p_std': 25, 'p_atr': 17, 'p_adx': 20, 'rsi_period': 21, 'ema1': 26, 'ema2': 51, 'slip_atr_k': 0.04449781185181299, 'slip_spread_k': 0.09144332003635285, 'spread_hl_frac': 0.0037421081517590403, 'bb_std_mult': 2.269460717165808, 'rsi_os': 49, 'rsi_ob': 54, 'vol_spike': 0.2912810820708399, 'adx_thresh': 21.655211959947604, 'atr_min_pct': 0.024479717229330133, 'atr_max_pct': 0.04578472346251594, 'tp_mult': 1.6977025326517041, 'tsl_mult': 0.8212382592621188, 'strategy': 'mean_reversion', 'time_stop': 197, 'use_sma': False, 'use_atr': True, 'use_adx': True, 'use_ema': False, 'use_spike': True, 'rsi_required': False, 'edge_k': 0.2479343637518655, 'edge_cap': 0.5415059542187346, 'bull_strategy': 'mean_reversion', 'bull_bb_std_mult': 3.4218731964340465, 'bull_rsi_os': 29, 'bull_rsi_ob': 56, 'bull_adx_thresh': 18.47025995609954, 'bull_atr_min_pct': 0.025114143765101973, 'bull_atr_max_pct': 0.12114858521114953, 'bull_tp_mult': 2.822562723123991, 'bull_tsl_mult': 0.535207558409554, 'bull_time_stop': 187, 'bull_use_sma': False, 'bull_use_ema': True, 'bull_use_atr': True, 'bull_use_adx': False, 'bull_use_spike': False, 'bull_rsi_required': True, 'bear_strategy': 'breakout', 'bear_bb_std_mult': 3.087661045316961, 'bear_rsi_os': 51, 'bear_rsi_ob': 76, 'bear_adx_thresh': 31.94244666583238, 'bear_atr_min_pct': 0.013132968963495854, 'bear_atr_max_pct': 0.03758342695187297, 'bear_tp_mult': 2.8457287441501005, 'bear_tsl_mult': 0.23518157870874512, 'bear_time_stop': 206, 'bear_use_sma': True, 'bear_use_ema': True, 'bear_use_atr': False, 'bear_use_adx': False, 'bear_use_spike': False, 'bear_rsi_required': True, 'sideways_strategy': 'mean_reversion', 'sideways_bb_std_mult': 3.1996987219590336, 'sideways_rsi_os': 53, 'sideways_rsi_ob': 55, 'sideways_adx_thresh': 19.7244389704589, 'sideways_atr_min_pct': 0.0012979972129195274, 'sideways_atr_max_pct': 0.051865648528954846, 'sideways_tp_mult': 1.1713346381175738, 'sideways_tsl_mult': 0.2239328212119125, 'sideways_time_stop': 67, 'sideways_use_sma': False, 'sideways_use_ema': True, 'sideways_use_atr': True, 'sideways_use_adx': False, 'sideways_use_spike': False, 'sideways_rsi_required': True}.
[I 2025-08-30 19:23:50,311] Trial 480 finished with values: [-1000000000.0, 1000000000.0] and parameters: {'p_sma': 31, 'p_std': 6, 'p_atr': 15, 'p_adx': 12, 'rsi_period': 22, 'ema1': 26, 'ema2': 31, 'slip_atr_k': 0.039605876478274196, 'slip_spread_k': 0.933068683190992, 'spread_hl_frac': 0.04655853087668208, 'bb_std_mult': 1.92513141301359, 'rsi_os': 47, 'rsi_ob': 95, 'vol_spike': 0.22114287571920976, 'adx_thresh': 32.94688446324967, 'atr_min_pct': 0.0024416519719724725, 'atr_max_pct': 0.12787938846071792, 'tp_mult': 2.250093999472128, 'tsl_mult': 0.8307667965392297, 'strategy': 'mean_reversion', 'time_stop': 181, 'use_sma': True, 'use_atr': True, 'use_adx': True, 'use_ema': False, 'use_spike': True, 'rsi_required': True, 'edge_k': 0.2480418522742318, 'edge_cap': 0.1508593415721466, 'bull_strategy': 'mean_reversion', 'bull_bb_std_mult': 3.468228037784447, 'bull_rsi_os': 32, 'bull_rsi_ob': 76, 'bull_adx_thresh': 8.453228729110613, 'bull_atr_min_pct': 0.02511171717519248, 'bull_atr_max_pct': 0.12180585484617164, 'bull_tp_mult': 1.8151194449331551, 'bull_tsl_mult': 0.5353444602140676, 'bull_time_stop': 186, 'bull_use_sma': False, 'bull_use_ema': True, 'bull_use_atr': True, 'bull_use_adx': False, 'bull_use_spike': False, 'bull_rsi_required': True, 'bear_strategy': 'breakout', 'bear_bb_std_mult': 3.0995981722587667, 'bear_rsi_os': 50, 'bear_rsi_ob': 76, 'bear_adx_thresh': 31.92851245236516, 'bear_atr_min_pct': 0.013726226386843076, 'bear_atr_max_pct': 0.03831677926886242, 'bear_tp_mult': 2.780847729194623, 'bear_tsl_mult': 0.82676542785482, 'bear_time_stop': 112, 'bear_use_sma': True, 'bear_use_ema': True, 'bear_use_atr': False, 'bear_use_adx': False, 'bear_use_spike': False, 'bear_rsi_required': True, 'sideways_strategy': 'breakout', 'sideways_bb_std_mult': 3.350428819093435, 'sideways_rsi_os': 38, 'sideways_rsi_ob': 61, 'sideways_adx_thresh': 29.445970814821205, 'sideways_atr_min_pct': 0.017271284033411004, 'sideways_atr_max_pct': 0.05178601637980426, 'sideways_tp_mult': 2.0278474254251813, 'sideways_tsl_mult': 0.7719504283132628, 'sideways_time_stop': 217, 'sideways_use_sma': False, 'sideways_use_ema': True, 'sideways_use_atr': True, 'sideways_use_adx': False, 'sideways_use_spike': False, 'sideways_rsi_required': True}.
[I 2025-08-30 19:24:24,038] Trial 482 finished with values: [-1000000000.0, 1000000000.0] and parameters: {'p_sma': 5, 'p_std': 32, 'p_atr': 9, 'p_adx': 20, 'rsi_period': 22, 'ema1': 25, 'ema2': 31, 'slip_atr_k': 0.058447836331511405, 'slip_spread_k': 0.08695585644318105, 'spread_hl_frac': 0.04015662129175078, 'bb_std_mult': 2.2490308254108338, 'rsi_os': 8, 'rsi_ob': 83, 'vol_spike': 0.28950696841150975, 'adx_thresh': 33.00644326041657, 'atr_min_pct': 0.024822297577559077, 'atr_max_pct': 0.1003053900101498, 'tp_mult': 2.2532139100236668, 'tsl_mult': 0.7360818146366217, 'strategy': 'mean_reversion', 'time_stop': 183, 'use_sma': False, 'use_atr': False, 'use_adx': True, 'use_ema': False, 'use_spike': True, 'rsi_required': False, 'edge_k': 0.10831776713065078, 'edge_cap': 0.5416270211156183, 'bull_strategy': 'mean_reversion', 'bull_bb_std_mult': 3.224663725936048, 'bull_rsi_os': 31, 'bull_rsi_ob': 81, 'bull_adx_thresh': 18.288783617122082, 'bull_atr_min_pct': 0.005417700597703074, 'bull_atr_max_pct': 0.013578576580523555, 'bull_tp_mult': 2.80348991161656, 'bull_tsl_mult': 0.08314664701252056, 'bull_time_stop': 185, 'bull_use_sma': False, 'bull_use_ema': True, 'bull_use_atr': True, 'bull_use_adx': True, 'bull_use_spike': False, 'bull_rsi_required': True, 'bear_strategy': 'breakout', 'bear_bb_std_mult': 1.2876963348841695, 'bear_rsi_os': 50, 'bear_rsi_ob': 76, 'bear_adx_thresh': 17.80174724428976, 'bear_atr_min_pct': 0.013133987285855995, 'bear_atr_max_pct': 0.11159745123520115, 'bear_tp_mult': 2.6080245551592367, 'bear_tsl_mult': 0.8279829454694349, 'bear_time_stop': 206, 'bear_use_sma': True, 'bear_use_ema': True, 'bear_use_atr': False, 'bear_use_adx': False, 'bear_use_spike': False, 'bear_rsi_required': True, 'sideways_strategy': 'mean_reversion', 'sideways_bb_std_mult': 3.195284577363339, 'sideways_rsi_os': 34, 'sideways_rsi_ob': 56, 'sideways_adx_thresh': 20.616617973761354, 'sideways_atr_min_pct': 0.001120905062658618, 'sideways_atr_max_pct': 0.036489069322469925, 'sideways_tp_mult': 1.1486569719915638, 'sideways_tsl_mult': 0.45229829038592695, 'sideways_time_stop': 166, 'sideways_use_sma': False, 'sideways_use_ema': True, 'sideways_use_atr': True, 'sideways_use_adx': False, 'sideways_use_spike': False, 'sideways_rsi_required': True}.
[I 2025-08-30 19:24:25,692] Trial 484 finished with values: [-1000000000.0, 1000000000.0] and parameters: {'p_sma': 5, 'p_std': 32, 'p_atr': 9, 'p_adx': 12, 'rsi_period': 21, 'ema1': 12, 'ema2': 30, 'slip_atr_k': 0.24921133688374753, 'slip_spread_k': 0.08925111718672332, 'spread_hl_frac': 0.04707140179026877, 'bb_std_mult': 2.2286723413701774, 'rsi_os': 47, 'rsi_ob': 88, 'vol_spike': 0.25015391001243753, 'adx_thresh': 28.968838515538536, 'atr_min_pct': 0.025969852990142026, 'atr_max_pct': 0.13348787356927708, 'tp_mult': 2.2495060082597984, 'tsl_mult': 0.004757191239104841, 'strategy': 'breakout', 'time_stop': 291, 'use_sma': False, 'use_atr': False, 'use_adx': True, 'use_ema': False, 'use_spike': True, 'rsi_required': False, 'edge_k': 0.09810258468325567, 'edge_cap': 0.7322074621675841, 'bull_strategy': 'breakout', 'bull_bb_std_mult': 3.2122132051983807, 'bull_rsi_os': 31, 'bull_rsi_ob': 85, 'bull_adx_thresh': 18.166300761580178, 'bull_atr_min_pct': 0.016733403940173575, 'bull_atr_max_pct': 0.023191818894168, 'bull_tp_mult': 1.9280648007258534, 'bull_tsl_mult': 0.553432354634596, 'bull_time_stop': 187, 'bull_use_sma': False, 'bull_use_ema': False, 'bull_use_atr': True, 'bull_use_adx': True, 'bull_use_spike': False, 'bull_rsi_required': True, 'bear_strategy': 'breakout', 'bear_bb_std_mult': 2.990809387171169, 'bear_rsi_os': 53, 'bear_rsi_ob': 75, 'bear_adx_thresh': 16.370455002225476, 'bear_atr_min_pct': 0.0269765101358252, 'bear_atr_max_pct': 0.0532129066565918, 'bear_tp_mult': 2.8400296871161417, 'bear_tsl_mult': 0.8341201134265681, 'bear_time_stop': 207, 'bear_use_sma': True, 'bear_use_ema': True, 'bear_use_atr': True, 'bear_use_adx': True, 'bear_use_spike': False, 'bear_rsi_required': True, 'sideways_strategy': 'mean_reversion', 'sideways_bb_std_mult': 3.2087254887013996, 'sideways_rsi_os': 24, 'sideways_rsi_ob': 48, 'sideways_adx_thresh': 22.77026989043581, 'sideways_atr_min_pct': 0.022373576196721243, 'sideways_atr_max_pct': 0.1451011773963085, 'sideways_tp_mult': 2.0052759299532745, 'sideways_tsl_mult': 0.9643082248661087, 'sideways_time_stop': 165, 'sideways_use_sma': False, 'sideways_use_ema': True, 'sideways_use_atr': False, 'sideways_use_adx': False, 'sideways_use_spike': False, 'sideways_rsi_required': True}.
[I 2025-08-30 19:24:25,704] Trial 483 finished with values: [-1000000000.0, 1000000000.0] and parameters: {'p_sma': 57, 'p_std': 32, 'p_atr': 13, 'p_adx': 21, 'rsi_period': 22, 'ema1': 12, 'ema2': 31, 'slip_atr_k': 0.058047682698086696, 'slip_spread_k': 0.08140001510384437, 'spread_hl_frac': 0.04782025592484744, 'bb_std_mult': 2.250341411775394, 'rsi_os': 47, 'rsi_ob': 48, 'vol_spike': 0.2522844886931394, 'adx_thresh': 33.15523920223632, 'atr_min_pct': 0.025613409901558637, 'atr_max_pct': 0.1281920802537467, 'tp_mult': 2.2799676836687874, 'tsl_mult': 0.8234847227700794, 'strategy': 'breakout', 'time_stop': 180, 'use_sma': False, 'use_atr': False, 'use_adx': True, 'use_ema': False, 'use_spike': True, 'rsi_required': False, 'edge_k': 0.8297913059270021, 'edge_cap': 0.7172048427658347, 'bull_strategy': 'breakout', 'bull_bb_std_mult': 0.7379968962554468, 'bull_rsi_os': 31, 'bull_rsi_ob': 65, 'bull_adx_thresh': 18.150501801007664, 'bull_atr_min_pct': 0.028276264639618916, 'bull_atr_max_pct': 0.014001762308624335, 'bull_tp_mult': 1.825110625051065, 'bull_tsl_mult': 0.5509224772597312, 'bull_time_stop': 96, 'bull_use_sma': False, 'bull_use_ema': True, 'bull_use_atr': True, 'bull_use_adx': True, 'bull_use_spike': False, 'bull_rsi_required': True, 'bear_strategy': 'breakout', 'bear_bb_std_mult': 2.985856133675844, 'bear_rsi_os': 50, 'bear_rsi_ob': 81, 'bear_adx_thresh': 16.10065865971418, 'bear_atr_min_pct': 0.022585399455938224, 'bear_atr_max_pct': 0.1473931748847765, 'bear_tp_mult': 2.6033327472062417, 'bear_tsl_mult': 0.8489050364344164, 'bear_time_stop': 206, 'bear_use_sma': True, 'bear_use_ema': True, 'bear_use_atr': False, 'bear_use_adx': True, 'bear_use_spike': False, 'bear_rsi_required': True, 'sideways_strategy': 'mean_reversion', 'sideways_bb_std_mult': 1.062237454920003, 'sideways_rsi_os': 34, 'sideways_rsi_ob': 61, 'sideways_adx_thresh': 20.562549130834967, 'sideways_atr_min_pct': 0.001997125331125247, 'sideways_atr_max_pct': 0.14491168971124577, 'sideways_tp_mult': 1.1573286761776473, 'sideways_tsl_mult': 0.9651271636394028, 'sideways_time_stop': 168, 'sideways_use_sma': False, 'sideways_use_ema': True, 'sideways_use_atr': False, 'sideways_use_adx': False, 'sideways_use_spike': False, 'sideways_rsi_required': True}.
[I 2025-08-30 19:24:25,959] Trial 485 finished with values: [-0.02186137908002217, 0.0219581046626558] and parameters: {'p_sma': 27, 'p_std': 33, 'p_atr': 9, 'p_adx': 20, 'rsi_period': 25, 'ema1': 12, 'ema2': 30, 'slip_atr_k': 0.11366159322043384, 'slip_spread_k': 0.35852013079849415, 'spread_hl_frac': 0.004224771906263358, 'bb_std_mult': 2.226132825461931, 'rsi_os': 7, 'rsi_ob': 48, 'vol_spike': 0.11296500307287341, 'adx_thresh': 33.4249901871303, 'atr_min_pct': 0.01203325015621157, 'atr_max_pct': 0.13342048505043463, 'tp_mult': 2.2527205981102476, 'tsl_mult': 0.35196317811649136, 'strategy': 'breakout', 'time_stop': 225, 'use_sma': False, 'use_atr': False, 'use_adx': True, 'use_ema': False, 'use_spike': True, 'rsi_required': False, 'edge_k': 0.10161007977451873, 'edge_cap': 0.36749506560931894, 'bull_strategy': 'breakout', 'bull_bb_std_mult': 0.7115097658322513, 'bull_rsi_os': 31, 'bull_rsi_ob': 45, 'bull_adx_thresh': 18.3293948864451, 'bull_atr_min_pct': 0.0021774932836956242, 'bull_atr_max_pct': 0.02285687023093943, 'bull_tp_mult': 2.7035529186762246, 'bull_tsl_mult': 0.5530661322743634, 'bull_time_stop': 180, 'bull_use_sma': False, 'bull_use_ema': False, 'bull_use_atr': False, 'bull_use_adx': True, 'bull_use_spike': True, 'bull_rsi_required': True, 'bear_strategy': 'breakout', 'bear_bb_std_mult': 2.6353909717301596, 'bear_rsi_os': 34, 'bear_rsi_ob': 76, 'bear_adx_thresh': 15.060504920609045, 'bear_atr_min_pct': 0.023848943473073533, 'bear_atr_max_pct': 0.14761528440389993, 'bear_tp_mult': 2.6084537389925027, 'bear_tsl_mult': 0.20083273132772994, 'bear_time_stop': 227, 'bear_use_sma': True, 'bear_use_ema': True, 'bear_use_atr': True, 'bear_use_adx': True, 'bear_use_spike': False, 'bear_rsi_required': True, 'sideways_strategy': 'mean_reversion', 'sideways_bb_std_mult': 3.210234219284669, 'sideways_rsi_os': 33, 'sideways_rsi_ob': 51, 'sideways_adx_thresh': 20.640353998485335, 'sideways_atr_min_pct': 0.001856705641029991, 'sideways_atr_max_pct': 0.01067825802024823, 'sideways_tp_mult': 1.1565022838403602, 'sideways_tsl_mult': 0.8366797787252815, 'sideways_time_stop': 167, 'sideways_use_sma': False, 'sideways_use_ema': True, 'sideways_use_atr': False, 'sideways_use_adx': False, 'sideways_use_spike': False, 'sideways_rsi_required': False}.
