[I 2025-08-30 18:52:35,660] Trial 205 finished with values: [-1000000000.0, 1000000000.0] and parameters: {'p_sma': 44, 'p_std': 33, 'p_atr': 9, 'p_adx': 30, 'rsi_period': 26, 'ema1': 5, 'ema2': 41, 'slip_atr_k': 0.24584868397410387, 'slip_spread_k': 0.8227672880741727, 'spread_hl_frac': 0.031690109121626446, 'bb_std_mult': 0.6788852169370643, 'rsi_os': 33, 'rsi_ob': 79, 'vol_spike': 0.278534799854841, 'adx_thresh': 33.19858062820084, 'atr_min_pct': 0.014679140345899904, 'atr_max_pct': 0.06297706276272026, 'tp_mult': 1.3106288098162202, 'tsl_mult': 0.7713457364631868, 'strategy': 'breakout', 'time_stop': 194, 'use_sma': False, 'use_atr': True, 'use_adx': True, 'use_ema': False, 'use_spike': True, 'rsi_required': True, 'edge_k': 0.057414404741333566, 'edge_cap': 0.5173462391158368, 'bull_strategy': 'mean_reversion', 'bull_bb_std_mult': 3.1118025522430495, 'bull_rsi_os': 19, 'bull_rsi_ob': 45, 'bull_adx_thresh': 17.97443980840273, 'bull_atr_min_pct': 0.00180775935000322, 'bull_atr_max_pct': 0.12033468516710724, 'bull_tp_mult': 2.1161449291081866, 'bull_tsl_mult': 0.5162908755650066, 'bull_time_stop': 174, 'bull_use_sma': False, 'bull_use_ema': False, 'bull_use_atr': True, 'bull_use_adx': False, 'bull_use_spike': False, 'bull_rsi_required': True, 'bear_strategy': 'breakout', 'bear_bb_std_mult': 1.467000711846223, 'bear_rsi_os': 51, 'bear_rsi_ob': 74, 'bear_adx_thresh': 18.253440883472358, 'bear_atr_min_pct': 0.021598245185582433, 'bear_atr_max_pct': 0.03305228000680905, 'bear_tp_mult': 2.579726293316467, 'bear_tsl_mult': 0.49611007645316374, 'bear_time_stop': 182, 'bear_use_sma': True, 'bear_use_ema': True, 'bear_use_atr': False, 'bear_use_adx': True, 'bear_use_spike': False, 'bear_rsi_required': True, 'sideways_strategy': 'breakout', 'sideways_bb_std_mult': 3.2021806498065915, 'sideways_rsi_os': 39, 'sideways_rsi_ob': 59, 'sideways_adx_thresh': 21.163716843661764, 'sideways_atr_min_pct': 0.01810823674025949, 'sideways_atr_max_pct': 0.12152469167113031, 'sideways_tp_mult': 1.083820166289267, 'sideways_tsl_mult': 0.2757189729633668, 'sideways_time_stop': 46, 'sideways_use_sma': False, 'sideways_use_ema': True, 'sideways_use_atr': True, 'sideways_use_adx': False, 'sideways_use_spike': True, 'sideways_rsi_required': False}.
[I 2025-08-30 18:52:36,461] Trial 211 finished with values: [-1000000000.0, 1000000000.0] and parameters: {'p_sma': 8, 'p_std': 29, 'p_atr': 8, 'p_adx': 20, 'rsi_period': 41, 'ema1': 9, 'ema2': 32, 'slip_atr_k': 0.06836375112321219, 'slip_spread_k': 0.453923455345994, 'spread_hl_frac': 0.026789751771144506, 'bb_std_mult': 1.4255659227462245, 'rsi_os': 51, 'rsi_ob': 51, 'vol_spike': 0.2720711913759347, 'adx_thresh': 13.887437527921978, 'atr_min_pct': 0.029608272671485525, 'atr_max_pct': 0.09263245189497415, 'tp_mult': 2.1422787418412153, 'tsl_mult': 0.4377912659370941, 'strategy': 'mean_reversion', 'time_stop': 179, 'use_sma': False, 'use_atr': False, 'use_adx': False, 'use_ema': True, 'use_spike': True, 'rsi_required': False, 'edge_k': 0.19213801500916544, 'edge_cap': 0.5117909796114047, 'bull_strategy': 'mean_reversion', 'bull_bb_std_mult': 3.3024482296863553, 'bull_rsi_os': 45, 'bull_rsi_ob': 62, 'bull_adx_thresh': 18.754978294349442, 'bull_atr_min_pct': 0.019936612530558964, 'bull_atr_max_pct': 0.13073949869211837, 'bull_tp_mult': 2.8973332663166937, 'bull_tsl_mult': 0.5540813545638777, 'bull_time_stop': 190, 'bull_use_sma': False, 'bull_use_ema': True, 'bull_use_atr': True, 'bull_use_adx': False, 'bull_use_spike': False, 'bull_rsi_required': True, 'bear_strategy': 'mean_reversion', 'bear_bb_std_mult': 2.867218677397275, 'bear_rsi_os': 49, 'bear_rsi_ob': 77, 'bear_adx_thresh': 18.949691483914627, 'bear_atr_min_pct': 0.026595129947289735, 'bear_atr_max_pct': 0.042219399331324826, 'bear_tp_mult': 1.0230894460616469, 'bear_tsl_mult': 0.6589245406051695, 'bear_time_stop': 215, 'bear_use_sma': False, 'bear_use_ema': False, 'bear_use_atr': False, 'bear_use_adx': False, 'bear_use_spike': False, 'bear_rsi_required': True, 'sideways_strategy': 'breakout', 'sideways_bb_std_mult': 1.3323126724646241, 'sideways_rsi_os': 11, 'sideways_rsi_ob': 58, 'sideways_adx_thresh': 21.808266220830827, 'sideways_atr_min_pct': 0.0029734789204524585, 'sideways_atr_max_pct': 0.11285640031973657, 'sideways_tp_mult': 1.2469573101836797, 'sideways_tsl_mult': 0.9347710239276803, 'sideways_time_stop': 241, 'sideways_use_sma': False, 'sideways_use_ema': False, 'sideways_use_atr': True, 'sideways_use_adx': False, 'sideways_use_spike': False, 'sideways_rsi_required': True}.
[I 2025-08-30 18:52:36,519] Trial 208 finished with values: [-1000000000.0, 1000000000.0] and parameters: {'p_sma': 8, 'p_std': 33, 'p_atr': 20, 'p_adx': 26, 'rsi_period': 27, 'ema1': 24, 'ema2': 11, 'slip_atr_k': 0.10526024876492061, 'slip_spread_k': 0.6255519926783522, 'spread_hl_frac': 0.021694263743931762, 'bb_std_mult': 2.00890665587469, 'rsi_os': 51, 'rsi_ob': 79, 'vol_spike': 0.27401553329750045, 'adx_thresh': 34.705065196152376, 'atr_min_pct': 0.024908322860303513, 'atr_max_pct': 0.03154661055519322, 'tp_mult': 2.1382056884912175, 'tsl_mult': 0.3824085066135799, 'strategy': 'mean_reversion', 'time_stop': 168, 'use_sma': False, 'use_atr': True, 'use_adx': False, 'use_ema': False, 'use_spike': True, 'rsi_required': False, 'edge_k': 0.5725304670159241, 'edge_cap': 0.505548472230605, 'bull_strategy': 'mean_reversion', 'bull_bb_std_mult': 3.102667966728311, 'bull_rsi_os': 32, 'bull_rsi_ob': 47, 'bull_adx_thresh': 18.030083499153406, 'bull_atr_min_pct': 0.0017293565672022067, 'bull_atr_max_pct': 0.11391520343568029, 'bull_tp_mult': 2.9009275884493775, 'bull_tsl_mult': 0.5102977379563026, 'bull_time_stop': 190, 'bull_use_sma': False, 'bull_use_ema': True, 'bull_use_atr': True, 'bull_use_adx': False, 'bull_use_spike': False, 'bull_rsi_required': True, 'bear_strategy': 'breakout', 'bear_bb_std_mult': 2.7424756704909594, 'bear_rsi_os': 50, 'bear_rsi_ob': 77, 'bear_adx_thresh': 19.719922079549075, 'bear_atr_min_pct': 0.016399225845333987, 'bear_atr_max_pct': 0.13406849123356535, 'bear_tp_mult': 2.5869203003446604, 'bear_tsl_mult': 0.6548535973625377, 'bear_time_stop': 215, 'bear_use_sma': True, 'bear_use_ema': False, 'bear_use_atr': False, 'bear_use_adx': False, 'bear_use_spike': False, 'bear_rsi_required': True, 'sideways_strategy': 'breakout', 'sideways_bb_std_mult': 3.2115427766168816, 'sideways_rsi_os': 39, 'sideways_rsi_ob': 59, 'sideways_adx_thresh': 21.047470396433194, 'sideways_atr_min_pct': 0.002840662519248693, 'sideways_atr_max_pct': 0.11983172430698091, 'sideways_tp_mult': 1.5775168246281717, 'sideways_tsl_mult': 0.9273307815832084, 'sideways_time_stop': 242, 'sideways_use_sma': False, 'sideways_use_ema': True, 'sideways_use_atr': True, 'sideways_use_adx': False, 'sideways_use_spike': False, 'sideways_rsi_required': True}.
[I 2025-08-30 18:52:36,538] Trial 210 finished with values: [-1000000000.0, 1000000000.0] and parameters: {'p_sma': 8, 'p_std': 29, 'p_atr': 10, 'p_adx': 30, 'rsi_period': 26, 'ema1': 28, 'ema2': 54, 'slip_atr_k': 0.07340086831200686, 'slip_spread_k': 0.18067971240294123, 'spread_hl_frac': 0.02596344988710839, 'bb_std_mult': 2.9141430624874123, 'rsi_os': 51, 'rsi_ob': 79, 'vol_spike': 0.0926079465617656, 'adx_thresh': 11.411789861690506, 'atr_min_pct': 0.023203217838622666, 'atr_max_pct': 0.14662692118718545, 'tp_mult': 1.3214782346114524, 'tsl_mult': 0.8159868995899024, 'strategy': 'mean_reversion', 'time_stop': 182, 'use_sma': False, 'use_atr': False, 'use_adx': True, 'use_ema': True, 'use_spike': True, 'rsi_required': False, 'edge_k': 0.20417616044156295, 'edge_cap': 0.5154884377044692, 'bull_strategy': 'mean_reversion', 'bull_bb_std_mult': 1.7803706880930579, 'bull_rsi_os': 32, 'bull_rsi_ob': 47, 'bull_adx_thresh': 17.736844764508703, 'bull_atr_min_pct': 0.0018931947006018386, 'bull_atr_max_pct': 0.129677872929776, 'bull_tp_mult': 2.1170978744355375, 'bull_tsl_mult': 0.1116193800377474, 'bull_time_stop': 188, 'bull_use_sma': False, 'bull_use_ema': True, 'bull_use_atr': True, 'bull_use_adx': False, 'bull_use_spike': False, 'bull_rsi_required': True, 'bear_strategy': 'breakout', 'bear_bb_std_mult': 2.8642379587722377, 'bear_rsi_os': 51, 'bear_rsi_ob': 78, 'bear_adx_thresh': 26.358380894108656, 'bear_atr_min_pct': 0.014114448953138249, 'bear_atr_max_pct': 0.033009342661576735, 'bear_tp_mult': 2.683048895161309, 'bear_tsl_mult': 0.7483901838150777, 'bear_time_stop': 215, 'bear_use_sma': False, 'bear_use_ema': False, 'bear_use_atr': False, 'bear_use_adx': False, 'bear_use_spike': False, 'bear_rsi_required': True, 'sideways_strategy': 'breakout', 'sideways_bb_std_mult': 1.3287638827691086, 'sideways_rsi_os': 10, 'sideways_rsi_ob': 58, 'sideways_adx_thresh': 31.37022655705495, 'sideways_atr_min_pct': 0.002866649329316217, 'sideways_atr_max_pct': 0.14441743461060233, 'sideways_tp_mult': 1.9936664980251613, 'sideways_tsl_mult': 0.9343965816652664, 'sideways_time_stop': 46, 'sideways_use_sma': False, 'sideways_use_ema': True, 'sideways_use_atr': True, 'sideways_use_adx': False, 'sideways_use_spike': True, 'sideways_rsi_required': False}.
[I 2025-08-30 18:53:07,547] Trial 209 finished with values: [-1000000000.0, 1000000000.0] and parameters: {'p_sma': 8, 'p_std': 49, 'p_atr': 8, 'p_adx': 19, 'rsi_period': 20, 'ema1': 24, 'ema2': 31, 'slip_atr_k': 0.06725537527946757, 'slip_spread_k': 0.6329164289725933, 'spread_hl_frac': 0.032309994696927566, 'bb_std_mult': 2.652982131817872, 'rsi_os': 21, 'rsi_ob': 86, 'vol_spike': 0.2726362673345271, 'adx_thresh': 33.32006472347247, 'atr_min_pct': 0.024809632934845338, 'atr_max_pct': 0.02661768919478183, 'tp_mult': 2.144987063719748, 'tsl_mult': 0.8160472013295893, 'strategy': 'mean_reversion', 'time_stop': 34, 'use_sma': False, 'use_atr': True, 'use_adx': False, 'use_ema': False, 'use_spike': True, 'rsi_required': False, 'edge_k': 0.048888929462575156, 'edge_cap': 0.5116061112546194, 'bull_strategy': 'mean_reversion', 'bull_bb_std_mult': 1.4589026911578107, 'bull_rsi_os': 46, 'bull_rsi_ob': 66, 'bull_adx_thresh': 17.890979233869366, 'bull_atr_min_pct': 0.0020139349771497424, 'bull_atr_max_pct': 0.1430898521003856, 'bull_tp_mult': 2.4095313349018803, 'bull_tsl_mult': 0.6902200509183192, 'bull_time_stop': 15, 'bull_use_sma': False, 'bull_use_ema': True, 'bull_use_atr': True, 'bull_use_adx': False, 'bull_use_spike': False, 'bull_rsi_required': True, 'bear_strategy': 'breakout', 'bear_bb_std_mult': 1.4530884569978042, 'bear_rsi_os': 50, 'bear_rsi_ob': 78, 'bear_adx_thresh': 26.659357590047954, 'bear_atr_min_pct': 0.01652710770405307, 'bear_atr_max_pct': 0.03286055133930355, 'bear_tp_mult': 2.5826584075350016, 'bear_tsl_mult': 0.37469833387124063, 'bear_time_stop': 214, 'bear_use_sma': True, 'bear_use_ema': False, 'bear_use_atr': False, 'bear_use_adx': False, 'bear_use_spike': False, 'bear_rsi_required': True, 'sideways_strategy': 'breakout', 'sideways_bb_std_mult': 3.213200289280213, 'sideways_rsi_os': 41, 'sideways_rsi_ob': 58, 'sideways_adx_thresh': 34.367227335964046, 'sideways_atr_min_pct': 0.0030093779518875307, 'sideways_atr_max_pct': 0.1399950321841463, 'sideways_tp_mult': 1.0154670817722755, 'sideways_tsl_mult': 0.26485770061071, 'sideways_time_stop': 135, 'sideways_use_sma': False, 'sideways_use_ema': True, 'sideways_use_atr': True, 'sideways_use_adx': False, 'sideways_use_spike': True, 'sideways_rsi_required': False}.
[I 2025-08-30 18:53:10,672] Trial 212 finished with values: [-1000000000.0, 1000000000.0] and parameters: {'p_sma': 7, 'p_std': 30, 'p_atr': 29, 'p_adx': 16, 'rsi_period': 54, 'ema1': 28, 'ema2': 54, 'slip_atr_k': 0.06340726198921659, 'slip_spread_k': 0.177792949280756, 'spread_hl_frac': 0.021830449565105204, 'bb_std_mult': 2.9151890697887564, 'rsi_os': 20, 'rsi_ob': 88, 'vol_spike': 0.06861513529235559, 'adx_thresh': 33.36065550673042, 'atr_min_pct': 0.024882120335769566, 'atr_max_pct': 0.06021956895198495, 'tp_mult': 1.8178824037777785, 'tsl_mult': 0.3017553489090702, 'strategy': 'mean_reversion', 'time_stop': 184, 'use_sma': False, 'use_atr': True, 'use_adx': True, 'use_ema': False, 'use_spike': True, 'rsi_required': False, 'edge_k': 0.04972375779495383, 'edge_cap': 0.11119824313839727, 'bull_strategy': 'mean_reversion', 'bull_bb_std_mult': 1.6401561137495213, 'bull_rsi_os': 32, 'bull_rsi_ob': 66, 'bull_adx_thresh': 17.549646165668097, 'bull_atr_min_pct': 0.0004480487508987203, 'bull_atr_max_pct': 0.12007316606621084, 'bull_tp_mult': 2.9958345898701952, 'bull_tsl_mult': 0.6878151573013656, 'bull_time_stop': 186, 'bull_use_sma': False, 'bull_use_ema': True, 'bull_use_atr': True, 'bull_use_adx': False, 'bull_use_spike': False, 'bull_rsi_required': True, 'bear_strategy': 'breakout', 'bear_bb_std_mult': 0.7256678199803437, 'bear_rsi_os': 30, 'bear_rsi_ob': 78, 'bear_adx_thresh': 15.502438725231377, 'bear_atr_min_pct': 0.016442303572140913, 'bear_atr_max_pct': 0.02921826259104564, 'bear_tp_mult': 2.680540321759797, 'bear_tsl_mult': 0.7535731711147112, 'bear_time_stop': 251, 'bear_use_sma': True, 'bear_use_ema': True, 'bear_use_atr': False, 'bear_use_adx': False, 'bear_use_spike': False, 'bear_rsi_required': True, 'sideways_strategy': 'breakout', 'sideways_bb_std_mult': 1.534091971470691, 'sideways_rsi_os': 34, 'sideways_rsi_ob': 61, 'sideways_adx_thresh': 32.585435859633336, 'sideways_atr_min_pct': 0.0009181719433478917, 'sideways_atr_max_pct': 0.13961088750579628, 'sideways_tp_mult': 1.0111758500916175, 'sideways_tsl_mult': 0.9999336984025775, 'sideways_time_stop': 12, 'sideways_use_sma': False, 'sideways_use_ema': True, 'sideways_use_atr': True, 'sideways_use_adx': False, 'sideways_use_spike': False, 'sideways_rsi_required': True}.
[I 2025-08-30 18:53:11,134] Trial 214 finished with values: [-1000000000.0, 1000000000.0] and parameters: {'p_sma': 7, 'p_std': 38, 'p_atr': 9, 'p_adx': 19, 'rsi_period': 53, 'ema1': 23, 'ema2': 31, 'slip_atr_k': 0.020971381850632936, 'slip_spread_k': 0.11341088576373143, 'spread_hl_frac': 0.04033777182390994, 'bb_std_mult': 2.173008797530966, 'rsi_os': 49, 'rsi_ob': 88, 'vol_spike': 0.2652504543124607, 'adx_thresh': 33.3559727916994, 'atr_min_pct': 0.012055745510951087, 'atr_max_pct': 0.027015437058846473, 'tp_mult': 2.238972962770346, 'tsl_mult': 0.8462921728197246, 'strategy': 'mean_reversion', 'time_stop': 192, 'use_sma': False, 'use_atr': True, 'use_adx': True, 'use_ema': False, 'use_spike': True, 'rsi_required': False, 'edge_k': 1.2191053084023133, 'edge_cap': 0.9045419768933468, 'bull_strategy': 'mean_reversion', 'bull_bb_std_mult': 3.009035368075999, 'bull_rsi_os': 47, 'bull_rsi_ob': 94, 'bull_adx_thresh': 19.125640701023176, 'bull_atr_min_pct': 0.0011397898643625208, 'bull_atr_max_pct': 0.1245058487109337, 'bull_tp_mult': 2.856052773828191, 'bull_tsl_mult': 0.5571000932148794, 'bull_time_stop': 176, 'bull_use_sma': False, 'bull_use_ema': True, 'bull_use_atr': True, 'bull_use_adx': False, 'bull_use_spike': False, 'bull_rsi_required': True, 'bear_strategy': 'mean_reversion', 'bear_bb_std_mult': 3.004101769314329, 'bear_rsi_os': 37, 'bear_rsi_ob': 82, 'bear_adx_thresh': 16.79469140298161, 'bear_atr_min_pct': 0.015135349566453788, 'bear_atr_max_pct': 0.04036563933442426, 'bear_tp_mult': 1.9769799456339894, 'bear_tsl_mult': 0.7074984436090377, 'bear_time_stop': 34, 'bear_use_sma': True, 'bear_use_ema': True, 'bear_use_atr': False, 'bear_use_adx': False, 'bear_use_spike': False, 'bear_rsi_required': True, 'sideways_strategy': 'breakout', 'sideways_bb_std_mult': 0.6149749733198109, 'sideways_rsi_os': 33, 'sideways_rsi_ob': 61, 'sideways_adx_thresh': 19.598501130120457, 'sideways_atr_min_pct': 0.020933354082160138, 'sideways_atr_max_pct': 0.08705810390487499, 'sideways_tp_mult': 1.1144502801646545, 'sideways_tsl_mult': 0.9806983765107726, 'sideways_time_stop': 159, 'sideways_use_sma': False, 'sideways_use_ema': True, 'sideways_use_atr': True, 'sideways_use_adx': False, 'sideways_use_spike': False, 'sideways_rsi_required': True}.
[I 2025-08-30 18:53:11,494] Trial 213 finished with values: [-1000000000.0, 1000000000.0] and parameters: {'p_sma': 5, 'p_std': 30, 'p_atr': 10, 'p_adx': 14, 'rsi_period': 52, 'ema1': 28, 'ema2': 14, 'slip_atr_k': 0.1789524597452109, 'slip_spread_k': 0.17626511701089753, 'spread_hl_frac': 0.025780121024697653, 'bb_std_mult': 0.8566073845687534, 'rsi_os': 49, 'rsi_ob': 85, 'vol_spike': 0.2662776634141649, 'adx_thresh': 33.38539384621211, 'atr_min_pct': 0.023292195675249455, 'atr_max_pct': 0.09164216545234738, 'tp_mult': 2.7244079414189857, 'tsl_mult': 0.30334390114950305, 'strategy': 'mean_reversion', 'time_stop': 50, 'use_sma': False, 'use_atr': True, 'use_adx': True, 'use_ema': False, 'use_spike': True, 'rsi_required': False, 'edge_k': 1.057418450229031, 'edge_cap': 0.8956396529648937, 'bull_strategy': 'mean_reversion', 'bull_bb_std_mult': 1.8682218928348753, 'bull_rsi_os': 29, 'bull_rsi_ob': 80, 'bull_adx_thresh': 18.914955338953025, 'bull_atr_min_pct': 0.0032662463122788195, 'bull_atr_max_pct': 0.046830515319988615, 'bull_tp_mult': 1.4278538582219442, 'bull_tsl_mult': 0.6945415328773408, 'bull_time_stop': 161, 'bull_use_sma': False, 'bull_use_ema': True, 'bull_use_atr': True, 'bull_use_adx': False, 'bull_use_spike': False, 'bull_rsi_required': True, 'bear_strategy': 'breakout', 'bear_bb_std_mult': 2.9923846124667266, 'bear_rsi_os': 54, 'bear_rsi_ob': 78, 'bear_adx_thresh': 16.82874442775851, 'bear_atr_min_pct': 0.014249282677910615, 'bear_atr_max_pct': 0.14984038003395428, 'bear_tp_mult': 2.5395119857984416, 'bear_tsl_mult': 0.5486283732097939, 'bear_time_stop': 31, 'bear_use_sma': True, 'bear_use_ema': True, 'bear_use_atr': False, 'bear_use_adx': False, 'bear_use_spike': False, 'bear_rsi_required': True, 'sideways_strategy': 'breakout', 'sideways_bb_std_mult': 2.7474370018719574, 'sideways_rsi_os': 5, 'sideways_rsi_ob': 61, 'sideways_adx_thresh': 22.88811528670837, 'sideways_atr_min_pct': 0.0008296218309331129, 'sideways_atr_max_pct': 0.1395906993885787, 'sideways_tp_mult': 1.7772819389824213, 'sideways_tsl_mult': 0.22480099153598976, 'sideways_time_stop': 14, 'sideways_use_sma': False, 'sideways_use_ema': True, 'sideways_use_atr': True, 'sideways_use_adx': False, 'sideways_use_spike': True, 'sideways_rsi_required': False}.
[I 2025-08-30 18:53:42,902] Trial 215 finished with values: [-1000000000.0, 1000000000.0] and parameters: {'p_sma': 5, 'p_std': 30, 'p_atr': 29, 'p_adx': 16, 'rsi_period': 57, 'ema1': 28, 'ema2': 34, 'slip_atr_k': 0.06169173036281354, 'slip_spread_k': 0.10775481779801083, 'spread_hl_frac': 0.04998733288695352, 'bb_std_mult': 2.1572740131905555, 'rsi_os': 49, 'rsi_ob': 66, 'vol_spike': 0.26425330001519814, 'adx_thresh': 33.69863316825446, 'atr_min_pct': 0.02244235777316377, 'atr_max_pct': 0.06036935554513252, 'tp_mult': 2.241535570834688, 'tsl_mult': 0.8472956233178418, 'strategy': 'mean_reversion', 'time_stop': 199, 'use_sma': False, 'use_atr': True, 'use_adx': True, 'use_ema': False, 'use_spike': True, 'rsi_required': False, 'edge_k': 1.19569638035794, 'edge_cap': 0.5352564154270691, 'bull_strategy': 'mean_reversion', 'bull_bb_std_mult': 0.5966844387193815, 'bull_rsi_os': 29, 'bull_rsi_ob': 91, 'bull_adx_thresh': 19.463891761241694, 'bull_atr_min_pct': 0.01581489533997527, 'bull_atr_max_pct': 0.125406186940613, 'bull_tp_mult': 1.434677290213806, 'bull_tsl_mult': 0.5519479750129604, 'bull_time_stop': 176, 'bull_use_sma': True, 'bull_use_ema': True, 'bull_use_atr': True, 'bull_use_adx': False, 'bull_use_spike': False, 'bull_rsi_required': True, 'bear_strategy': 'mean_reversion', 'bear_bb_std_mult': 3.075180633738968, 'bear_rsi_os': 30, 'bear_rsi_ob': 82, 'bear_adx_thresh': 34.801004011248175, 'bear_atr_min_pct': 0.015131705749243074, 'bear_atr_max_pct': 0.029211912695210274, 'bear_tp_mult': 2.7593177966539972, 'bear_tsl_mult': 0.7108325367495012, 'bear_time_stop': 38, 'bear_use_sma': True, 'bear_use_ema': True, 'bear_use_atr': False, 'bear_use_adx': False, 'bear_use_spike': True, 'bear_rsi_required': True, 'sideways_strategy': 'mean_reversion', 'sideways_bb_std_mult': 0.6217649141687465, 'sideways_rsi_os': 6, 'sideways_rsi_ob': 78, 'sideways_adx_thresh': 20.906764094642178, 'sideways_atr_min_pct': 0.008727676823167937, 'sideways_atr_max_pct': 0.08700286560572523, 'sideways_tp_mult': 1.1082892907485364, 'sideways_tsl_mult': 0.9986237745458552, 'sideways_time_stop': 215, 'sideways_use_sma': False, 'sideways_use_ema': False, 'sideways_use_atr': True, 'sideways_use_adx': False, 'sideways_use_spike': False, 'sideways_rsi_required': True}.
