[I 2025-08-30 18:58:54,627] Trial 258 finished with values: [-1000000000.0, 1000000000.0] and parameters: {'p_sma': 28, 'p_std': 32, 'p_atr': 18, 'p_adx': 20, 'rsi_period': 77, 'ema1': 26, 'ema2': 31, 'slip_atr_k': 0.059980256705085, 'slip_spread_k': 0.07878176129076508, 'spread_hl_frac': 0.021660397944062576, 'bb_std_mult': 2.0013398783697474, 'rsi_os': 49, 'rsi_ob': 85, 'vol_spike': 0.05317947232354499, 'adx_thresh': 8.474306158803966, 'atr_min_pct': 0.018808858382853125, 'atr_max_pct': 0.10956939417759923, 'tp_mult': 2.5453587212085917, 'tsl_mult': 0.848076608618744, 'strategy': 'breakout', 'time_stop': 193, 'use_sma': True, 'use_atr': True, 'use_adx': False, 'use_ema': False, 'use_spike': True, 'rsi_required': True, 'edge_k': 0.149814835871516, 'edge_cap': 0.4545195703870164, 'bull_strategy': 'breakout', 'bull_bb_std_mult': 2.735563357886134, 'bull_rsi_os': 31, 'bull_rsi_ob': 49, 'bull_adx_thresh': 18.025516349926654, 'bull_atr_min_pct': 0.01943727574999185, 'bull_atr_max_pct': 0.08743489071171724, 'bull_tp_mult': 2.2994623143320956, 'bull_tsl_mult': 0.5903370939793321, 'bull_time_stop': 162, 'bull_use_sma': True, 'bull_use_ema': False, 'bull_use_atr': True, 'bull_use_adx': True, 'bull_use_spike': False, 'bull_rsi_required': True, 'bear_strategy': 'breakout', 'bear_bb_std_mult': 1.8315093141723402, 'bear_rsi_os': 24, 'bear_rsi_ob': 72, 'bear_adx_thresh': 7.522501075296894, 'bear_atr_min_pct': 0.0040063227180379985, 'bear_atr_max_pct': 0.04119794179595745, 'bear_tp_mult': 2.2823872548983957, 'bear_tsl_mult': 0.15538123306318624, 'bear_time_stop': 268, 'bear_use_sma': True, 'bear_use_ema': False, 'bear_use_atr': True, 'bear_use_adx': True, 'bear_use_spike': True, 'bear_rsi_required': True, 'sideways_strategy': 'breakout', 'sideways_bb_std_mult': 0.727364050084456, 'sideways_rsi_os': 37, 'sideways_rsi_ob': 79, 'sideways_adx_thresh': 25.903836495909182, 'sideways_atr_min_pct': 0.022974615842978854, 'sideways_atr_max_pct': 0.024367097764283197, 'sideways_tp_mult': 1.1588940318670566, 'sideways_tsl_mult': 0.620546731815513, 'sideways_time_stop': 61, 'sideways_use_sma': False, 'sideways_use_ema': True, 'sideways_use_atr': True, 'sideways_use_adx': True, 'sideways_use_spike': True, 'sideways_rsi_required': True}.
[I 2025-08-30 18:59:26,367] Trial 264 finished with values: [-1000000000.0, 1000000000.0] and parameters: {'p_sma': 6, 'p_std': 52, 'p_atr': 15, 'p_adx': 23, 'rsi_period': 26, 'ema1': 13, 'ema2': 34, 'slip_atr_k': 0.05858355421549154, 'slip_spread_k': 0.32192926024727775, 'spread_hl_frac': 0.04830719543079674, 'bb_std_mult': 2.187657910523723, 'rsi_os': 49, 'rsi_ob': 82, 'vol_spike': 0.09620280198794166, 'adx_thresh': 8.354887123033725, 'atr_min_pct': 0.029275118344496164, 'atr_max_pct': 0.0646526474483061, 'tp_mult': 1.68912037155641, 'tsl_mult': 0.8549266079085575, 'strategy': 'mean_reversion', 'time_stop': 53, 'use_sma': False, 'use_atr': True, 'use_adx': True, 'use_ema': False, 'use_spike': True, 'rsi_required': False, 'edge_k': 0.3006295986557991, 'edge_cap': 0.4568057247727786, 'bull_strategy': 'mean_reversion', 'bull_bb_std_mult': 0.8491958538496684, 'bull_rsi_os': 33, 'bull_rsi_ob': 47, 'bull_adx_thresh': 18.882143148950043, 'bull_atr_min_pct': 0.01878237216347608, 'bull_atr_max_pct': 0.03356470077068209, 'bull_tp_mult': 2.697266907885955, 'bull_tsl_mult': 0.09537471391973179, 'bull_time_stop': 189, 'bull_use_sma': False, 'bull_use_ema': True, 'bull_use_atr': True, 'bull_use_adx': False, 'bull_use_spike': False, 'bull_rsi_required': True, 'bear_strategy': 'breakout', 'bear_bb_std_mult': 2.6503197694727527, 'bear_rsi_os': 43, 'bear_rsi_ob': 81, 'bear_adx_thresh': 17.31726397011853, 'bear_atr_min_pct': 0.015155591630071762, 'bear_atr_max_pct': 0.02502007046073254, 'bear_tp_mult': 2.7601626874071656, 'bear_tsl_mult': 0.11822228991298228, 'bear_time_stop': 191, 'bear_use_sma': True, 'bear_use_ema': True, 'bear_use_atr': False, 'bear_use_adx': False, 'bear_use_spike': False, 'bear_rsi_required': False, 'sideways_strategy': 'breakout', 'sideways_bb_std_mult': 3.2858126900185276, 'sideways_rsi_os': 26, 'sideways_rsi_ob': 49, 'sideways_adx_thresh': 28.994717179403114, 'sideways_atr_min_pct': 0.0015461092146395344, 'sideways_atr_max_pct': 0.14670606695070748, 'sideways_tp_mult': 2.896595343557595, 'sideways_tsl_mult': 0.9365308369873463, 'sideways_time_stop': 161, 'sideways_use_sma': False, 'sideways_use_ema': False, 'sideways_use_atr': True, 'sideways_use_adx': False, 'sideways_use_spike': False, 'sideways_rsi_required': True}.
[I 2025-08-30 18:59:26,478] Trial 265 finished with values: [-1000000000.0, 1000000000.0] and parameters: {'p_sma': 48, 'p_std': 33, 'p_atr': 15, 'p_adx': 9, 'rsi_period': 29, 'ema1': 13, 'ema2': 33, 'slip_atr_k': 0.08307548575866501, 'slip_spread_k': 0.18702069476423366, 'spread_hl_frac': 0.04861952859153462, 'bb_std_mult': 2.234022373410706, 'rsi_os': 48, 'rsi_ob': 81, 'vol_spike': 0.16960623013598056, 'adx_thresh': 9.859863094720259, 'atr_min_pct': 0.01695733884279752, 'atr_max_pct': 0.11794606513881485, 'tp_mult': 2.328543049544897, 'tsl_mult': 0.8767126007375255, 'strategy': 'mean_reversion', 'time_stop': 176, 'use_sma': False, 'use_atr': True, 'use_adx': True, 'use_ema': False, 'use_spike': True, 'rsi_required': False, 'edge_k': 0.03413234771147618, 'edge_cap': 0.7716590325148103, 'bull_strategy': 'mean_reversion', 'bull_bb_std_mult': 3.185942014755711, 'bull_rsi_os': 29, 'bull_rsi_ob': 93, 'bull_adx_thresh': 31.284349460299964, 'bull_atr_min_pct': 0.02561210448057443, 'bull_atr_max_pct': 0.05399446221604756, 'bull_tp_mult': 2.683860117545078, 'bull_tsl_mult': 0.4886429383896312, 'bull_time_stop': 6, 'bull_use_sma': False, 'bull_use_ema': True, 'bull_use_atr': True, 'bull_use_adx': False, 'bull_use_spike': False, 'bull_rsi_required': True, 'bear_strategy': 'breakout', 'bear_bb_std_mult': 2.654736316894476, 'bear_rsi_os': 7, 'bear_rsi_ob': 84, 'bear_adx_thresh': 17.190756472087195, 'bear_atr_min_pct': 0.015198645089800235, 'bear_atr_max_pct': 0.05440793681595377, 'bear_tp_mult': 2.782007927662055, 'bear_tsl_mult': 0.7792178437709167, 'bear_time_stop': 81, 'bear_use_sma': True, 'bear_use_ema': True, 'bear_use_atr': False, 'bear_use_adx': False, 'bear_use_spike': False, 'bear_rsi_required': False, 'sideways_strategy': 'breakout', 'sideways_bb_std_mult': 2.5415374729225455, 'sideways_rsi_os': 32, 'sideways_rsi_ob': 47, 'sideways_adx_thresh': 13.468197621275632, 'sideways_atr_min_pct': 0.014425631146565573, 'sideways_atr_max_pct': 0.1470001747992304, 'sideways_tp_mult': 2.6333895161459466, 'sideways_tsl_mult': 0.24039545983334443, 'sideways_time_stop': 162, 'sideways_use_sma': False, 'sideways_use_ema': False, 'sideways_use_atr': True, 'sideways_use_adx': False, 'sideways_use_spike': False, 'sideways_rsi_required': True}.
[I 2025-08-30 18:59:27,176] Trial 262 finished with values: [-1000000000.0, 1000000000.0] and parameters: {'p_sma': 48, 'p_std': 54, 'p_atr': 10, 'p_adx': 20, 'rsi_period': 19, 'ema1': 18, 'ema2': 34, 'slip_atr_k': 0.059888294618250425, 'slip_spread_k': 0.19614062591303796, 'spread_hl_frac': 0.023438773628493382, 'bb_std_mult': 2.1945975992774214, 'rsi_os': 47, 'rsi_ob': 82, 'vol_spike': 0.10910108325843373, 'adx_thresh': 31.9782490042446, 'atr_min_pct': 0.01704689960219346, 'atr_max_pct': 0.1091697345460315, 'tp_mult': 2.179972478064462, 'tsl_mult': 0.859329020283941, 'strategy': 'breakout', 'time_stop': 193, 'use_sma': False, 'use_atr': True, 'use_adx': True, 'use_ema': False, 'use_spike': True, 'rsi_required': False, 'edge_k': 0.19593769317873022, 'edge_cap': 0.26710308230273677, 'bull_strategy': 'mean_reversion', 'bull_bb_std_mult': 1.7398498476972015, 'bull_rsi_os': 33, 'bull_rsi_ob': 47, 'bull_adx_thresh': 28.38326525415873, 'bull_atr_min_pct': 0.019163514908522247, 'bull_atr_max_pct': 0.11545129251918633, 'bull_tp_mult': 2.7004145414828895, 'bull_tsl_mult': 0.5822053093697829, 'bull_time_stop': 171, 'bull_use_sma': True, 'bull_use_ema': False, 'bull_use_atr': False, 'bull_use_adx': False, 'bull_use_spike': False, 'bull_rsi_required': True, 'bear_strategy': 'breakout', 'bear_bb_std_mult': 3.597714358383593, 'bear_rsi_os': 43, 'bear_rsi_ob': 83, 'bear_adx_thresh': 17.21087179439601, 'bear_atr_min_pct': 0.015215946508861409, 'bear_atr_max_pct': 0.13716900822060302, 'bear_tp_mult': 2.165916552740933, 'bear_tsl_mult': 0.7702627115800452, 'bear_time_stop': 267, 'bear_use_sma': True, 'bear_use_ema': True, 'bear_use_atr': True, 'bear_use_adx': True, 'bear_use_spike': False, 'bear_rsi_required': True, 'sideways_strategy': 'breakout', 'sideways_bb_std_mult': 0.7060210916878051, 'sideways_rsi_os': 32, 'sideways_rsi_ob': 59, 'sideways_adx_thresh': 13.558954737303772, 'sideways_atr_min_pct': 0.02297867800799719, 'sideways_atr_max_pct': 0.14577141271701893, 'sideways_tp_mult': 1.161757021307357, 'sideways_tsl_mult': 0.9987574389340664, 'sideways_time_stop': 60, 'sideways_use_sma': False, 'sideways_use_ema': True, 'sideways_use_atr': True, 'sideways_use_adx': False, 'sideways_use_spike': True, 'sideways_rsi_required': True}.
[I 2025-08-30 18:59:27,340] Trial 263 finished with values: [-1000000000.0, 1000000000.0] and parameters: {'p_sma': 6, 'p_std': 17, 'p_atr': 21, 'p_adx': 21, 'rsi_period': 19, 'ema1': 27, 'ema2': 33, 'slip_atr_k': 0.05983221217535133, 'slip_spread_k': 0.9172096434577165, 'spread_hl_frac': 0.0038504432077835007, 'bb_std_mult': 2.219147319794299, 'rsi_os': 47, 'rsi_ob': 81, 'vol_spike': 0.10828144676840637, 'adx_thresh': 15.932705488487318, 'atr_min_pct': 0.024951552741868156, 'atr_max_pct': 0.08555321735518955, 'tp_mult': 1.7249420472745474, 'tsl_mult': 0.8551035968854703, 'strategy': 'mean_reversion', 'time_stop': 193, 'use_sma': False, 'use_atr': True, 'use_adx': True, 'use_ema': True, 'use_spike': True, 'rsi_required': False, 'edge_k': 0.8329773329185387, 'edge_cap': 0.4919978027928464, 'bull_strategy': 'mean_reversion', 'bull_bb_std_mult': 2.7355782384556995, 'bull_rsi_os': 55, 'bull_rsi_ob': 47, 'bull_adx_thresh': 11.26658564654244, 'bull_atr_min_pct': 0.002820307152432697, 'bull_atr_max_pct': 0.11587820769778041, 'bull_tp_mult': 2.437979916764382, 'bull_tsl_mult': 0.42895811423092, 'bull_time_stop': 171, 'bull_use_sma': False, 'bull_use_ema': True, 'bull_use_atr': True, 'bull_use_adx': False, 'bull_use_spike': False, 'bull_rsi_required': True, 'bear_strategy': 'breakout', 'bear_bb_std_mult': 0.5972193636741971, 'bear_rsi_os': 8, 'bear_rsi_ob': 60, 'bear_adx_thresh': 17.038154139829565, 'bear_atr_min_pct': 0.01617995416584617, 'bear_atr_max_pct': 0.1258883198562153, 'bear_tp_mult': 2.755620845602128, 'bear_tsl_mult': 0.753516131269814, 'bear_time_stop': 192, 'bear_use_sma': True, 'bear_use_ema': True, 'bear_use_atr': False, 'bear_use_adx': False, 'bear_use_spike': False, 'bear_rsi_required': True, 'sideways_strategy': 'breakout', 'sideways_bb_std_mult': 3.0891780547632592, 'sideways_rsi_os': 8, 'sideways_rsi_ob': 95, 'sideways_adx_thresh': 17.57624456924535, 'sideways_atr_min_pct': 0.0015440376798000952, 'sideways_atr_max_pct': 0.14592799311485283, 'sideways_tp_mult': 2.6172025694540473, 'sideways_tsl_mult': 0.9371113280987383, 'sideways_time_stop': 128, 'sideways_use_sma': False, 'sideways_use_ema': True, 'sideways_use_atr': True, 'sideways_use_adx': False, 'sideways_use_spike': True, 'sideways_rsi_required': True}.
[I 2025-08-30 18:59:27,906] Trial 267 finished with values: [-1000000000.0, 1000000000.0] and parameters: {'p_sma': 5, 'p_std': 26, 'p_atr': 10, 'p_adx': 22, 'rsi_period': 70, 'ema1': 27, 'ema2': 20, 'slip_atr_k': 0.04757339278562106, 'slip_spread_k': 0.8753196386915612, 'spread_hl_frac': 0.03582760279884696, 'bb_std_mult': 2.0784739004220993, 'rsi_os': 51, 'rsi_ob': 71, 'vol_spike': 0.11137438615136158, 'adx_thresh': 34.58526391077384, 'atr_min_pct': 0.02252475499528627, 'atr_max_pct': 0.07013242823356391, 'tp_mult': 1.1936077086471908, 'tsl_mult': 0.9098875557065744, 'strategy': 'mean_reversion', 'time_stop': 185, 'use_sma': False, 'use_atr': True, 'use_adx': True, 'use_ema': True, 'use_spike': True, 'rsi_required': False, 'edge_k': 0.6583466642051226, 'edge_cap': 0.33550325005005543, 'bull_strategy': 'mean_reversion', 'bull_bb_std_mult': 2.462684292359902, 'bull_rsi_os': 30, 'bull_rsi_ob': 74, 'bull_adx_thresh': 10.982027713818612, 'bull_atr_min_pct': 0.0006046588662543628, 'bull_atr_max_pct': 0.028825710051462193, 'bull_tp_mult': 2.791530358853955, 'bull_tsl_mult': 0.43802895147604787, 'bull_time_stop': 56, 'bull_use_sma': False, 'bull_use_ema': True, 'bull_use_atr': False, 'bull_use_adx': False, 'bull_use_spike': True, 'bull_rsi_required': True, 'bear_strategy': 'mean_reversion', 'bear_bb_std_mult': 0.5581300082427667, 'bear_rsi_os': 32, 'bear_rsi_ob': 83, 'bear_adx_thresh': 19.16747269978852, 'bear_atr_min_pct': 0.027265443085211085, 'bear_atr_max_pct': 0.04506761600123114, 'bear_tp_mult': 2.6376433186418122, 'bear_tsl_mult': 0.7637217478859902, 'bear_time_stop': 186, 'bear_use_sma': True, 'bear_use_ema': True, 'bear_use_atr': False, 'bear_use_adx': False, 'bear_use_spike': False, 'bear_rsi_required': True, 'sideways_strategy': 'mean_reversion', 'sideways_bb_std_mult': 3.098659607573558, 'sideways_rsi_os': 48, 'sideways_rsi_ob': 69, 'sideways_adx_thresh': 21.912468770332115, 'sideways_atr_min_pct': 0.029978139266250828, 'sideways_atr_max_pct': 0.14222786245034794, 'sideways_tp_mult': 1.0986723069979192, 'sideways_tsl_mult': 0.4164411970499019, 'sideways_time_stop': 225, 'sideways_use_sma': False, 'sideways_use_ema': True, 'sideways_use_atr': True, 'sideways_use_adx': False, 'sideways_use_spike': False, 'sideways_rsi_required': False}.
[I 2025-08-30 18:59:27,921] Trial 266 finished with values: [-1000000000.0, 1000000000.0] and parameters: {'p_sma': 5, 'p_std': 26, 'p_atr': 10, 'p_adx': 13, 'rsi_period': 18, 'ema1': 18, 'ema2': 48, 'slip_atr_k': 0.04716380867504171, 'slip_spread_k': 0.9107716411196032, 'spread_hl_frac': 0.0349121996632467, 'bb_std_mult': 3.4578848429120352, 'rsi_os': 51, 'rsi_ob': 84, 'vol_spike': 0.15907284443288472, 'adx_thresh': 34.33346541846049, 'atr_min_pct': 0.02254051570882153, 'atr_max_pct': 0.06931981521963537, 'tp_mult': 2.470649545885829, 'tsl_mult': 0.4791207728578054, 'strategy': 'mean_reversion', 'time_stop': 185, 'use_sma': False, 'use_atr': True, 'use_adx': True, 'use_ema': True, 'use_spike': True, 'rsi_required': False, 'edge_k': 0.07984903745111199, 'edge_cap': 0.33387144310434097, 'bull_strategy': 'mean_reversion', 'bull_bb_std_mult': 1.170837025249418, 'bull_rsi_os': 30, 'bull_rsi_ob': 74, 'bull_adx_thresh': 24.66626375769142, 'bull_atr_min_pct': 0.007992387396556368, 'bull_atr_max_pct': 0.11289048971774511, 'bull_tp_mult': 1.117502394252198, 'bull_tsl_mult': 0.8021485564700942, 'bull_time_stop': 104, 'bull_use_sma': False, 'bull_use_ema': True, 'bull_use_atr': False, 'bull_use_adx': False, 'bull_use_spike': True, 'bull_rsi_required': True, 'bear_strategy': 'mean_reversion', 'bear_bb_std_mult': 0.5657882214222583, 'bear_rsi_os': 50, 'bear_rsi_ob': 71, 'bear_adx_thresh': 16.352310269052154, 'bear_atr_min_pct': 0.0165402537286761, 'bear_atr_max_pct': 0.036046607560355326, 'bear_tp_mult': 1.7967807468696073, 'bear_tsl_mult': 0.752745544684991, 'bear_time_stop': 13, 'bear_use_sma': True, 'bear_use_ema': True, 'bear_use_atr': False, 'bear_use_adx': False, 'bear_use_spike': False, 'bear_rsi_required': True, 'sideways_strategy': 'mean_reversion', 'sideways_bb_std_mult': 3.5174772235015643, 'sideways_rsi_os': 48, 'sideways_rsi_ob': 59, 'sideways_adx_thresh': 21.821671982412116, 'sideways_atr_min_pct': 0.018496728622400198, 'sideways_atr_max_pct': 0.13455135613249963, 'sideways_tp_mult': 1.090102680416691, 'sideways_tsl_mult': 0.4021782468377154, 'sideways_time_stop': 207, 'sideways_use_sma': False, 'sideways_use_ema': True, 'sideways_use_atr': True, 'sideways_use_adx': False, 'sideways_use_spike': False, 'sideways_rsi_required': False}.
[I 2025-08-30 18:59:27,927] Trial 269 finished with values: [-1000000000.0, 1000000000.0] and parameters: {'p_sma': 5, 'p_std': 26, 'p_atr': 10, 'p_adx': 25, 'rsi_period': 23, 'ema1': 27, 'ema2': 57, 'slip_atr_k': 0.08034450087609009, 'slip_spread_k': 0.4696882452285487, 'spread_hl_frac': 0.024197784185379573, 'bb_std_mult': 2.054381012128146, 'rsi_os': 51, 'rsi_ob': 50, 'vol_spike': 0.2565742890081001, 'adx_thresh': 13.447972449023307, 'atr_min_pct': 0.02381650589969936, 'atr_max_pct': 0.1347176307058726, 'tp_mult': 2.2396562931029895, 'tsl_mult': 0.8935802883064564, 'strategy': 'mean_reversion', 'time_stop': 144, 'use_sma': False, 'use_atr': False, 'use_adx': False, 'use_ema': False, 'use_spike': True, 'rsi_required': False, 'edge_k': 0.767634292140916, 'edge_cap': 0.49726924705230197, 'bull_strategy': 'mean_reversion', 'bull_bb_std_mult': 2.9537836346328743, 'bull_rsi_os': 30, 'bull_rsi_ob': 74, 'bull_adx_thresh': 20.100787236119565, 'bull_atr_min_pct': 0.0006673740352517287, 'bull_atr_max_pct': 0.02920961349111246, 'bull_tp_mult': 2.772392059969002, 'bull_tsl_mult': 0.5360577010890873, 'bull_time_stop': 281, 'bull_use_sma': False, 'bull_use_ema': True, 'bull_use_atr': True, 'bull_use_adx': False, 'bull_use_spike': True, 'bull_rsi_required': True, 'bear_strategy': 'mean_reversion', 'bear_bb_std_mult': 3.1296755230015734, 'bear_rsi_os': 50, 'bear_rsi_ob': 88, 'bear_adx_thresh': 19.165948962660156, 'bear_atr_min_pct': 0.009346118798165624, 'bear_atr_max_pct': 0.03623632436133296, 'bear_tp_mult': 2.5217307708019083, 'bear_tsl_mult': 0.9128289450094298, 'bear_time_stop': 13, 'bear_use_sma': True, 'bear_use_ema': True, 'bear_use_atr': False, 'bear_use_adx': False, 'bear_use_spike': False, 'bear_rsi_required': True, 'sideways_strategy': 'mean_reversion', 'sideways_bb_std_mult': 3.5162901323262004, 'sideways_rsi_os': 42, 'sideways_rsi_ob': 69, 'sideways_adx_thresh': 21.884587261305427, 'sideways_atr_min_pct': 0.004941585730895379, 'sideways_atr_max_pct': 0.13425499912055358, 'sideways_tp_mult': 1.6238952722304207, 'sideways_tsl_mult': 0.41327122512822856, 'sideways_time_stop': 289, 'sideways_use_sma': False, 'sideways_use_ema': True, 'sideways_use_atr': True, 'sideways_use_adx': False, 'sideways_use_spike': False, 'sideways_rsi_required': False}.
[I 2025-08-30 18:59:27,979] Trial 268 finished with values: [-1000000000.0, 1000000000.0] and parameters: {'p_sma': 42, 'p_std': 43, 'p_atr': 27, 'p_adx': 21, 'rsi_period': 21, 'ema1': 27, 'ema2': 47, 'slip_atr_k': 0.07857174814508792, 'slip_spread_k': 0.7979757310371338, 'spread_hl_frac': 0.02332474325878416, 'bb_std_mult': 1.9226146002329592, 'rsi_os': 51, 'rsi_ob': 71, 'vol_spike': 0.2772412390303116, 'adx_thresh': 34.41155300771468, 'atr_min_pct': 0.02267268542152065, 'atr_max_pct': 0.08797098514331653, 'tp_mult': 2.238869214793384, 'tsl_mult': 0.8982428346884934, 'strategy': 'mean_reversion', 'time_stop': 72, 'use_sma': False, 'use_atr': False, 'use_adx': True, 'use_ema': True, 'use_spike': True, 'rsi_required': False, 'edge_k': 0.10324688901682652, 'edge_cap': 0.5396684956770184, 'bull_strategy': 'mean_reversion', 'bull_bb_std_mult': 2.9428733857908473, 'bull_rsi_os': 30, 'bull_rsi_ob': 76, 'bull_adx_thresh': 34.99693170384246, 'bull_atr_min_pct': 0.0008467208939168451, 'bull_atr_max_pct': 0.11200136840668097, 'bull_tp_mult': 2.4567558353180603, 'bull_tsl_mult': 0.5387661555870193, 'bull_time_stop': 104, 'bull_use_sma': False, 'bull_use_ema': True, 'bull_use_atr': True, 'bull_use_adx': False, 'bull_use_spike': True, 'bull_rsi_required': True, 'bear_strategy': 'mean_reversion', 'bear_bb_std_mult': 2.954987430778929, 'bear_rsi_os': 51, 'bear_rsi_ob': 71, 'bear_adx_thresh': 19.16409526930974, 'bear_atr_min_pct': 0.01639933179530211, 'bear_atr_max_pct': 0.031122192940361035, 'bear_tp_mult': 2.042435384637526, 'bear_tsl_mult': 0.7579468405827807, 'bear_time_stop': 188, 'bear_use_sma': True, 'bear_use_ema': True, 'bear_use_atr': False, 'bear_use_adx': False, 'bear_use_spike': False, 'bear_rsi_required': True, 'sideways_strategy': 'mean_reversion', 'sideways_bb_std_mult': 3.0556637338997654, 'sideways_rsi_os': 46, 'sideways_rsi_ob': 74, 'sideways_adx_thresh': 21.893023158481856, 'sideways_atr_min_pct': 0.0285435405872951, 'sideways_atr_max_pct': 0.027616322878750488, 'sideways_tp_mult': 1.087594091528945, 'sideways_tsl_mult': 0.40144320362518776, 'sideways_time_stop': 148, 'sideways_use_sma': False, 'sideways_use_ema': True, 'sideways_use_atr': True, 'sideways_use_adx': False, 'sideways_use_spike': False, 'sideways_rsi_required': False}.
