[I 2025-08-30 19:49:33,654] Trial 702 finished with values: [-1000000000.0, 1000000000.0] and parameters: {'p_sma': 6, 'p_std': 32, 'p_atr': 10, 'p_adx': 22, 'rsi_period': 21, 'ema1': 26, 'ema2': 49, 'slip_atr_k': 0.0036645853294224734, 'slip_spread_k': 0.13579309540631604, 'spread_hl_frac': 0.04223838889541197, 'bb_std_mult': 2.5328700359597476, 'rsi_os': 50, 'rsi_ob': 92, 'vol_spike': 0.25833531467368276, 'adx_thresh': 33.192251571456104, 'atr_min_pct': 0.02333554466735822, 'atr_max_pct': 0.042821602743231026, 'tp_mult': 2.277638245423565, 'tsl_mult': 0.19009316643771873, 'strategy': 'mean_reversion', 'time_stop': 197, 'use_sma': False, 'use_atr': True, 'use_adx': True, 'use_ema': False, 'use_spike': True, 'rsi_required': False, 'edge_k': 1.0329484583062793, 'edge_cap': 0.5185562375845434, 'bull_strategy': 'mean_reversion', 'bull_bb_std_mult': 3.231401240461883, 'bull_rsi_os': 32, 'bull_rsi_ob': 46, 'bull_adx_thresh': 19.56168715879776, 'bull_atr_min_pct': 0.020855739213512865, 'bull_atr_max_pct': 0.11294501154525817, 'bull_tp_mult': 2.6839840402546113, 'bull_tsl_mult': 0.015191525502071923, 'bull_time_stop': 180, 'bull_use_sma': False, 'bull_use_ema': True, 'bull_use_atr': False, 'bull_use_adx': False, 'bull_use_spike': False, 'bull_rsi_required': True, 'bear_strategy': 'breakout', 'bear_bb_std_mult': 2.6617357202373317, 'bear_rsi_os': 46, 'bear_rsi_ob': 59, 'bear_adx_thresh': 8.265165415049443, 'bear_atr_min_pct': 0.016247116411590472, 'bear_atr_max_pct': 0.03295468450098767, 'bear_tp_mult': 2.490813122289325, 'bear_tsl_mult': 0.7380208989916365, 'bear_time_stop': 181, 'bear_use_sma': True, 'bear_use_ema': True, 'bear_use_atr': True, 'bear_use_adx': False, 'bear_use_spike': False, 'bear_rsi_required': True, 'sideways_strategy': 'breakout', 'sideways_bb_std_mult': 2.2999729845961014, 'sideways_rsi_os': 44, 'sideways_rsi_ob': 59, 'sideways_adx_thresh': 25.359561161190545, 'sideways_atr_min_pct': 0.0022326741683718057, 'sideways_atr_max_pct': 0.14840984302944757, 'sideways_tp_mult': 1.1089727067732196, 'sideways_tsl_mult': 0.9406841373992944, 'sideways_time_stop': 115, 'sideways_use_sma': False, 'sideways_use_ema': False, 'sideways_use_atr': True, 'sideways_use_adx': False, 'sideways_use_spike': False, 'sideways_rsi_required': False}.
[I 2025-08-30 19:49:33,696] Trial 703 finished with values: [-1000000000.0, 1000000000.0] and parameters: {'p_sma': 6, 'p_std': 28, 'p_atr': 9, 'p_adx': 22, 'rsi_period': 80, 'ema1': 16, 'ema2': 31, 'slip_atr_k': 0.07568500261977967, 'slip_spread_k': 0.14377983148397105, 'spread_hl_frac': 0.016724475513653043, 'bb_std_mult': 2.7972578951798974, 'rsi_os': 50, 'rsi_ob': 85, 'vol_spike': 0.2572743291680734, 'adx_thresh': 33.144126060090734, 'atr_min_pct': 0.023438436901983675, 'atr_max_pct': 0.09730452712276974, 'tp_mult': 1.1841066288028212, 'tsl_mult': 0.6187950830815828, 'strategy': 'mean_reversion', 'time_stop': 206, 'use_sma': False, 'use_atr': True, 'use_adx': True, 'use_ema': False, 'use_spike': True, 'rsi_required': True, 'edge_k': 1.0340026096568276, 'edge_cap': 0.17482076866028096, 'bull_strategy': 'mean_reversion', 'bull_bb_std_mult': 1.8935658594161517, 'bull_rsi_os': 29, 'bull_rsi_ob': 73, 'bull_adx_thresh': 15.862576179788176, 'bull_atr_min_pct': 0.02759291868810191, 'bull_atr_max_pct': 0.1124008399293142, 'bull_tp_mult': 2.688249740930367, 'bull_tsl_mult': 0.7485432483531997, 'bull_time_stop': 175, 'bull_use_sma': False, 'bull_use_ema': True, 'bull_use_atr': False, 'bull_use_adx': False, 'bull_use_spike': True, 'bull_rsi_required': True, 'bear_strategy': 'breakout', 'bear_bb_std_mult': 1.64624990232125, 'bear_rsi_os': 53, 'bear_rsi_ob': 78, 'bear_adx_thresh': 16.474808662875265, 'bear_atr_min_pct': 0.00529457195558904, 'bear_atr_max_pct': 0.033431784852141835, 'bear_tp_mult': 2.4769847727034233, 'bear_tsl_mult': 0.7187110991343778, 'bear_time_stop': 183, 'bear_use_sma': True, 'bear_use_ema': False, 'bear_use_atr': True, 'bear_use_adx': False, 'bear_use_spike': False, 'bear_rsi_required': True, 'sideways_strategy': 'mean_reversion', 'sideways_bb_std_mult': 2.300965967691472, 'sideways_rsi_os': 36, 'sideways_rsi_ob': 59, 'sideways_adx_thresh': 19.376035094687232, 'sideways_atr_min_pct': 0.0022251528981750523, 'sideways_atr_max_pct': 0.035819129611777, 'sideways_tp_mult': 2.3536083706825086, 'sideways_tsl_mult': 0.9383160989274028, 'sideways_time_stop': 157, 'sideways_use_sma': False, 'sideways_use_ema': False, 'sideways_use_atr': True, 'sideways_use_adx': True, 'sideways_use_spike': True, 'sideways_rsi_required': False}.
[I 2025-08-30 19:49:33,844] Trial 704 finished with values: [-1000000000.0, 1000000000.0] and parameters: {'p_sma': 6, 'p_std': 25, 'p_atr': 9, 'p_adx': 24, 'rsi_period': 44, 'ema1': 18, 'ema2': 36, 'slip_atr_k': 0.07391498641685722, 'slip_spread_k': 0.13015076964021932, 'spread_hl_frac': 0.026511590949160183, 'bb_std_mult': 2.190720323121219, 'rsi_os': 50, 'rsi_ob': 45, 'vol_spike': 0.23356800394493843, 'adx_thresh': 34.96479080692707, 'atr_min_pct': 0.007326623630882855, 'atr_max_pct': 0.0837502622645129, 'tp_mult': 2.2698871157171454, 'tsl_mult': 0.605891413386368, 'strategy': 'mean_reversion', 'time_stop': 205, 'use_sma': False, 'use_atr': False, 'use_adx': False, 'use_ema': True, 'use_spike': False, 'rsi_required': True, 'edge_k': 0.1196128346707088, 'edge_cap': 0.518244051451329, 'bull_strategy': 'mean_reversion', 'bull_bb_std_mult': 3.235105914589045, 'bull_rsi_os': 40, 'bull_rsi_ob': 75, 'bull_adx_thresh': 6.199584585365084, 'bull_atr_min_pct': 0.016842921039734306, 'bull_atr_max_pct': 0.11136939081460442, 'bull_tp_mult': 2.6811002093528593, 'bull_tsl_mult': 0.017485298961233076, 'bull_time_stop': 176, 'bull_use_sma': True, 'bull_use_ema': True, 'bull_use_atr': False, 'bull_use_adx': False, 'bull_use_spike': True, 'bull_rsi_required': True, 'bear_strategy': 'mean_reversion', 'bear_bb_std_mult': 1.6516274682716494, 'bear_rsi_os': 53, 'bear_rsi_ob': 51, 'bear_adx_thresh': 17.35751102928258, 'bear_atr_min_pct': 0.016312287933148557, 'bear_atr_max_pct': 0.07699958779486059, 'bear_tp_mult': 2.6841923568746906, 'bear_tsl_mult': 0.7201910412226886, 'bear_time_stop': 120, 'bear_use_sma': True, 'bear_use_ema': False, 'bear_use_atr': True, 'bear_use_adx': False, 'bear_use_spike': False, 'bear_rsi_required': True, 'sideways_strategy': 'mean_reversion', 'sideways_bb_std_mult': 3.235379339725388, 'sideways_rsi_os': 36, 'sideways_rsi_ob': 75, 'sideways_adx_thresh': 23.645164037244818, 'sideways_atr_min_pct': 0.001766694721629425, 'sideways_atr_max_pct': 0.1480997120214914, 'sideways_tp_mult': 1.5643449907208158, 'sideways_tsl_mult': 0.9410694114829682, 'sideways_time_stop': 154, 'sideways_use_sma': True, 'sideways_use_ema': False, 'sideways_use_atr': True, 'sideways_use_adx': True, 'sideways_use_spike': True, 'sideways_rsi_required': False}.
[I 2025-08-30 19:50:07,860] Trial 706 finished with values: [-0.08329770468960196, 0.08324339784186306] and parameters: {'p_sma': 17, 'p_std': 27, 'p_atr': 24, 'p_adx': 25, 'rsi_period': 23, 'ema1': 29, 'ema2': 31, 'slip_atr_k': 0.0748548430280355, 'slip_spread_k': 0.17977083386266685, 'spread_hl_frac': 0.02142064723717917, 'bb_std_mult': 3.3270610121266277, 'rsi_os': 47, 'rsi_ob': 79, 'vol_spike': 0.017487081847646607, 'adx_thresh': 33.774461160998506, 'atr_min_pct': 0.015145486762114775, 'atr_max_pct': 0.08453762278936397, 'tp_mult': 1.9366581716009827, 'tsl_mult': 0.8471698532600946, 'strategy': 'mean_reversion', 'time_stop': 205, 'use_sma': False, 'use_atr': False, 'use_adx': False, 'use_ema': True, 'use_spike': False, 'rsi_required': True, 'edge_k': 0.1283488131952757, 'edge_cap': 0.17495093373272796, 'bull_strategy': 'mean_reversion', 'bull_bb_std_mult': 3.165510427762982, 'bull_rsi_os': 12, 'bull_rsi_ob': 61, 'bull_adx_thresh': 34.967204628961525, 'bull_atr_min_pct': 0.02260201271635252, 'bull_atr_max_pct': 0.11742660185338344, 'bull_tp_mult': 2.621766319408247, 'bull_tsl_mult': 0.54391035722336, 'bull_time_stop': 97, 'bull_use_sma': True, 'bull_use_ema': False, 'bull_use_atr': True, 'bull_use_adx': True, 'bull_use_spike': True, 'bull_rsi_required': True, 'bear_strategy': 'mean_reversion', 'bear_bb_std_mult': 2.332486816237603, 'bear_rsi_os': 53, 'bear_rsi_ob': 69, 'bear_adx_thresh': 25.831361107480628, 'bear_atr_min_pct': 0.01972478769659823, 'bear_atr_max_pct': 0.12251563300416618, 'bear_tp_mult': 2.6779768736739653, 'bear_tsl_mult': 0.5649043901885302, 'bear_time_stop': 221, 'bear_use_sma': False, 'bear_use_ema': False, 'bear_use_atr': False, 'bear_use_adx': False, 'bear_use_spike': True, 'bear_rsi_required': True, 'sideways_strategy': 'mean_reversion', 'sideways_bb_std_mult': 3.239675349880457, 'sideways_rsi_os': 36, 'sideways_rsi_ob': 60, 'sideways_adx_thresh': 23.156510013310072, 'sideways_atr_min_pct': 0.00067001221247825, 'sideways_atr_max_pct': 0.149814059960961, 'sideways_tp_mult': 1.0684804482997492, 'sideways_tsl_mult': 0.5866537349871002, 'sideways_time_stop': 155, 'sideways_use_sma': True, 'sideways_use_ema': False, 'sideways_use_atr': False, 'sideways_use_adx': True, 'sideways_use_spike': True, 'sideways_rsi_required': False}.
[I 2025-08-30 19:50:08,271] Trial 708 finished with values: [-1000000000.0, 1000000000.0] and parameters: {'p_sma': 8, 'p_std': 29, 'p_atr': 30, 'p_adx': 24, 'rsi_period': 23, 'ema1': 26, 'ema2': 33, 'slip_atr_k': 0.2341043452570067, 'slip_spread_k': 0.18368602028218095, 'spread_hl_frac': 0.024959453053928788, 'bb_std_mult': 2.36765418256881, 'rsi_os': 29, 'rsi_ob': 80, 'vol_spike': 0.1830849699512645, 'adx_thresh': 33.44511506861131, 'atr_min_pct': 0.0024215667418725616, 'atr_max_pct': 0.12339395989963052, 'tp_mult': 1.2380341992527597, 'tsl_mult': 0.8469769169402507, 'strategy': 'mean_reversion', 'time_stop': 198, 'use_sma': False, 'use_atr': False, 'use_adx': False, 'use_ema': True, 'use_spike': False, 'rsi_required': False, 'edge_k': 0.16097141692116973, 'edge_cap': 0.5549170535605412, 'bull_strategy': 'mean_reversion', 'bull_bb_std_mult': 1.3947038616435217, 'bull_rsi_os': 12, 'bull_rsi_ob': 61, 'bull_adx_thresh': 18.065823905425308, 'bull_atr_min_pct': 0.0020004418688130787, 'bull_atr_max_pct': 0.14994513444670896, 'bull_tp_mult': 2.7411510570684516, 'bull_tsl_mult': 0.2276076155270953, 'bull_time_stop': 187, 'bull_use_sma': True, 'bull_use_ema': False, 'bull_use_atr': True, 'bull_use_adx': True, 'bull_use_spike': False, 'bull_rsi_required': True, 'bear_strategy': 'mean_reversion', 'bear_bb_std_mult': 3.5315825314407343, 'bear_rsi_os': 52, 'bear_rsi_ob': 77, 'bear_adx_thresh': 31.80284315298885, 'bear_atr_min_pct': 0.01905175092109024, 'bear_atr_max_pct': 0.027966647605605917, 'bear_tp_mult': 2.6050526935288607, 'bear_tsl_mult': 0.8109693443428145, 'bear_time_stop': 27, 'bear_use_sma': False, 'bear_use_ema': True, 'bear_use_atr': False, 'bear_use_adx': False, 'bear_use_spike': True, 'bear_rsi_required': True, 'sideways_strategy': 'breakout', 'sideways_bb_std_mult': 3.1782252163561067, 'sideways_rsi_os': 38, 'sideways_rsi_ob': 94, 'sideways_adx_thresh': 20.23766204632599, 'sideways_atr_min_pct': 0.003238604669424581, 'sideways_atr_max_pct': 0.14323542580349513, 'sideways_tp_mult': 1.0729718814280276, 'sideways_tsl_mult': 0.9652602038369015, 'sideways_time_stop': 206, 'sideways_use_sma': True, 'sideways_use_ema': True, 'sideways_use_atr': False, 'sideways_use_adx': False, 'sideways_use_spike': False, 'sideways_rsi_required': True}.
[I 2025-08-30 19:50:08,521] Trial 705 finished with values: [-1000000000.0, 1000000000.0] and parameters: {'p_sma': 8, 'p_std': 15, 'p_atr': 27, 'p_adx': 23, 'rsi_period': 82, 'ema1': 26, 'ema2': 45, 'slip_atr_k': 0.0035199543589444354, 'slip_spread_k': 0.18321581177150198, 'spread_hl_frac': 0.02165966649995783, 'bb_std_mult': 1.600447385508358, 'rsi_os': 47, 'rsi_ob': 78, 'vol_spike': 0.18290599601122703, 'adx_thresh': 33.23334198887749, 'atr_min_pct': 0.0238227449831587, 'atr_max_pct': 0.08388124093376502, 'tp_mult': 1.1304247764991886, 'tsl_mult': 0.849454991718302, 'strategy': 'mean_reversion', 'time_stop': 205, 'use_sma': False, 'use_atr': False, 'use_adx': False, 'use_ema': True, 'use_spike': False, 'rsi_required': True, 'edge_k': 1.022859940104077, 'edge_cap': 0.5414494440641437, 'bull_strategy': 'mean_reversion', 'bull_bb_std_mult': 1.3922377534857682, 'bull_rsi_os': 53, 'bull_rsi_ob': 85, 'bull_adx_thresh': 34.91258530716489, 'bull_atr_min_pct': 0.011570166890419174, 'bull_atr_max_pct': 0.1127945975938164, 'bull_tp_mult': 2.605224630023168, 'bull_tsl_mult': 0.7540964320272299, 'bull_time_stop': 93, 'bull_use_sma': True, 'bull_use_ema': False, 'bull_use_atr': False, 'bull_use_adx': False, 'bull_use_spike': True, 'bull_rsi_required': True, 'bear_strategy': 'mean_reversion', 'bear_bb_std_mult': 2.269324828249986, 'bear_rsi_os': 51, 'bear_rsi_ob': 75, 'bear_adx_thresh': 16.999400776067407, 'bear_atr_min_pct': 0.016058094635148335, 'bear_atr_max_pct': 0.07179800168275385, 'bear_tp_mult': 2.6719287026959875, 'bear_tsl_mult': 0.9372151995247806, 'bear_time_stop': 65, 'bear_use_sma': False, 'bear_use_ema': False, 'bear_use_atr': False, 'bear_use_adx': False, 'bear_use_spike': True, 'bear_rsi_required': True, 'sideways_strategy': 'mean_reversion', 'sideways_bb_std_mult': 3.1892761802841303, 'sideways_rsi_os': 46, 'sideways_rsi_ob': 75, 'sideways_adx_thresh': 16.0436570815499, 'sideways_atr_min_pct': 0.01935298848416715, 'sideways_atr_max_pct': 0.14823218889105633, 'sideways_tp_mult': 1.1130585686617143, 'sideways_tsl_mult': 0.9637809834644671, 'sideways_time_stop': 155, 'sideways_use_sma': True, 'sideways_use_ema': False, 'sideways_use_atr': False, 'sideways_use_adx': True, 'sideways_use_spike': True, 'sideways_rsi_required': False}.
[I 2025-08-30 19:50:08,707] Trial 707 finished with values: [-0.03453465907498432, 0.03445353058359452] and parameters: {'p_sma': 51, 'p_std': 29, 'p_atr': 27, 'p_adx': 23, 'rsi_period': 44, 'ema1': 26, 'ema2': 53, 'slip_atr_k': 0.2108647575070873, 'slip_spread_k': 0.18016210911662928, 'spread_hl_frac': 0.02514515989084363, 'bb_std_mult': 2.222248180784154, 'rsi_os': 48, 'rsi_ob': 80, 'vol_spike': 0.2002585091959297, 'adx_thresh': 33.578261776395536, 'atr_min_pct': 0.015234025342097232, 'atr_max_pct': 0.06867985075769176, 'tp_mult': 2.343081803020079, 'tsl_mult': 0.4360126210600536, 'strategy': 'mean_reversion', 'time_stop': 257, 'use_sma': False, 'use_atr': False, 'use_adx': False, 'use_ema': True, 'use_spike': False, 'rsi_required': True, 'edge_k': 0.12030042593105215, 'edge_cap': 0.5504840973793054, 'bull_strategy': 'mean_reversion', 'bull_bb_std_mult': 3.1665075174255874, 'bull_rsi_os': 30, 'bull_rsi_ob': 45, 'bull_adx_thresh': 17.972444025765807, 'bull_atr_min_pct': 0.0017642207267562883, 'bull_atr_max_pct': 0.11708924826770666, 'bull_tp_mult': 2.590239789149057, 'bull_tsl_mult': 0.5460960794222833, 'bull_time_stop': 94, 'bull_use_sma': True, 'bull_use_ema': False, 'bull_use_atr': True, 'bull_use_adx': True, 'bull_use_spike': True, 'bull_rsi_required': True, 'bear_strategy': 'mean_reversion', 'bear_bb_std_mult': 2.3475679235862184, 'bear_rsi_os': 51, 'bear_rsi_ob': 69, 'bear_adx_thresh': 20.159781877385488, 'bear_atr_min_pct': 0.013122305512508559, 'bear_atr_max_pct': 0.1496243208398636, 'bear_tp_mult': 2.678691210006361, 'bear_tsl_mult': 0.522856737880115, 'bear_time_stop': 66, 'bear_use_sma': False, 'bear_use_ema': False, 'bear_use_atr': False, 'bear_use_adx': False, 'bear_use_spike': True, 'bear_rsi_required': True, 'sideways_strategy': 'mean_reversion', 'sideways_bb_std_mult': 3.5351200497698487, 'sideways_rsi_os': 10, 'sideways_rsi_ob': 52, 'sideways_adx_thresh': 20.17189398279045, 'sideways_atr_min_pct': 0.028732772486682063, 'sideways_atr_max_pct': 0.1499021907455995, 'sideways_tp_mult': 1.4208474263251336, 'sideways_tsl_mult': 0.5837414390996232, 'sideways_time_stop': 163, 'sideways_use_sma': True, 'sideways_use_ema': True, 'sideways_use_atr': False, 'sideways_use_adx': True, 'sideways_use_spike': True, 'sideways_rsi_required': True}.
[I 2025-08-30 19:50:09,723] Trial 710 finished with values: [-1000000000.0, 1000000000.0] and parameters: {'p_sma': 8, 'p_std': 30, 'p_atr': 17, 'p_adx': 15, 'rsi_period': 19, 'ema1': 6, 'ema2': 52, 'slip_atr_k': 0.02286895597287268, 'slip_spread_k': 0.15566777087540068, 'spread_hl_frac': 0.02326450775736492, 'bb_std_mult': 2.2637160147032196, 'rsi_os': 54, 'rsi_ob': 83, 'vol_spike': 0.2834175151451378, 'adx_thresh': 21.708348072158792, 'atr_min_pct': 0.02512970057411293, 'atr_max_pct': 0.018096340379863622, 'tp_mult': 1.0484058722470655, 'tsl_mult': 0.362100473965408, 'strategy': 'mean_reversion', 'time_stop': 11, 'use_sma': True, 'use_atr': True, 'use_adx': True, 'use_ema': False, 'use_spike': True, 'rsi_required': False, 'edge_k': 1.174218373170695, 'edge_cap': 0.5399597984568355, 'bull_strategy': 'mean_reversion', 'bull_bb_std_mult': 2.9979037759725378, 'bull_rsi_os': 30, 'bull_rsi_ob': 58, 'bull_adx_thresh': 17.362883142126748, 'bull_atr_min_pct': 0.011295741826908725, 'bull_atr_max_pct': 0.1251830341661233, 'bull_tp_mult': 2.9346176773146158, 'bull_tsl_mult': 0.5249287992867914, 'bull_time_stop': 293, 'bull_use_sma': False, 'bull_use_ema': True, 'bull_use_atr': True, 'bull_use_adx': False, 'bull_use_spike': False, 'bull_rsi_required': True, 'bear_strategy': 'breakout', 'bear_bb_std_mult': 0.7686982952722583, 'bear_rsi_os': 51, 'bear_rsi_ob': 71, 'bear_adx_thresh': 19.039485079924255, 'bear_atr_min_pct': 0.012994838187777946, 'bear_atr_max_pct': 0.02521716214983126, 'bear_tp_mult': 2.602501884671455, 'bear_tsl_mult': 0.5902897947383061, 'bear_time_stop': 50, 'bear_use_sma': True, 'bear_use_ema': True, 'bear_use_atr': False, 'bear_use_adx': False, 'bear_use_spike': False, 'bear_rsi_required': True, 'sideways_strategy': 'breakout', 'sideways_bb_std_mult': 0.9620801624766915, 'sideways_rsi_os': 9, 'sideways_rsi_ob': 58, 'sideways_adx_thresh': 15.902317002592639, 'sideways_atr_min_pct': 0.0034554991122916654, 'sideways_atr_max_pct': 0.14426678138310164, 'sideways_tp_mult': 1.1234402025719283, 'sideways_tsl_mult': 0.9808399215944704, 'sideways_time_stop': 164, 'sideways_use_sma': False, 'sideways_use_ema': True, 'sideways_use_atr': True, 'sideways_use_adx': False, 'sideways_use_spike': False, 'sideways_rsi_required': True}.
[I 2025-08-30 19:50:09,747] Trial 711 finished with values: [-1000000000.0, 1000000000.0] and parameters: {'p_sma': 36, 'p_std': 37, 'p_atr': 9, 'p_adx': 15, 'rsi_period': 19, 'ema1': 25, 'ema2': 32, 'slip_atr_k': 0.1446951289561096, 'slip_spread_k': 0.9794404905029939, 'spread_hl_frac': 0.02334241302049368, 'bb_std_mult': 2.261635027647774, 'rsi_os': 52, 'rsi_ob': 82, 'vol_spike': 0.28437499046069903, 'adx_thresh': 32.51151710161966, 'atr_min_pct': 0.029927135431402206, 'atr_max_pct': 0.09147156837255666, 'tp_mult': 2.35946720351131, 'tsl_mult': 0.358356706747602, 'strategy': 'mean_reversion', 'time_stop': 10, 'use_sma': True, 'use_atr': True, 'use_adx': True, 'use_ema': False, 'use_spike': True, 'rsi_required': False, 'edge_k': 0.2681941627880052, 'edge_cap': 0.07847396983369337, 'bull_strategy': 'mean_reversion', 'bull_bb_std_mult': 2.6370488427609216, 'bull_rsi_os': 30, 'bull_rsi_ob': 49, 'bull_adx_thresh': 34.08830894019275, 'bull_atr_min_pct': 0.0009558365222989093, 'bull_atr_max_pct': 0.13622850197465544, 'bull_tp_mult': 2.737660295542491, 'bull_tsl_mult': 0.5857456124524972, 'bull_time_stop': 260, 'bull_use_sma': False, 'bull_use_ema': True, 'bull_use_atr': True, 'bull_use_adx': False, 'bull_use_spike': False, 'bull_rsi_required': True, 'bear_strategy': 'breakout', 'bear_bb_std_mult': 2.9875369465049064, 'bear_rsi_os': 51, 'bear_rsi_ob': 75, 'bear_adx_thresh': 13.146538120024935, 'bear_atr_min_pct': 0.013340218940679473, 'bear_atr_max_pct': 0.09920551046610529, 'bear_tp_mult': 1.644264876668324, 'bear_tsl_mult': 0.5035807694088117, 'bear_time_stop': 189, 'bear_use_sma': True, 'bear_use_ema': True, 'bear_use_atr': False, 'bear_use_adx': False, 'bear_use_spike': False, 'bear_rsi_required': True, 'sideways_strategy': 'breakout', 'sideways_bb_std_mult': 0.9660277425838024, 'sideways_rsi_os': 26, 'sideways_rsi_ob': 48, 'sideways_adx_thresh': 21.094797062821186, 'sideways_atr_min_pct': 0.003399721691450995, 'sideways_atr_max_pct': 0.13554018279282523, 'sideways_tp_mult': 1.031509529898397, 'sideways_tsl_mult': 0.9798098740278525, 'sideways_time_stop': 164, 'sideways_use_sma': False, 'sideways_use_ema': True, 'sideways_use_atr': True, 'sideways_use_adx': False, 'sideways_use_spike': False, 'sideways_rsi_required': True}.
