[I 2025-08-30 19:08:54,498] Trial 351 finished with values: [-1000000000.0, 1000000000.0] and parameters: {'p_sma': 11, 'p_std': 32, 'p_atr': 26, 'p_adx': 14, 'rsi_period': 23, 'ema1': 26, 'ema2': 23, 'slip_atr_k': 0.0712204654532163, 'slip_spread_k': 0.1226948497298896, 'spread_hl_frac': 0.024679101275458467, 'bb_std_mult': 1.4392616693306843, 'rsi_os': 29, 'rsi_ob': 87, 'vol_spike': 0.2752120961391108, 'adx_thresh': 34.509700053487585, 'atr_min_pct': 0.024988309679036234, 'atr_max_pct': 0.09889947855297486, 'tp_mult': 2.1728224533507987, 'tsl_mult': 0.5209992953866258, 'strategy': 'mean_reversion', 'time_stop': 54, 'use_sma': False, 'use_atr': False, 'use_adx': True, 'use_ema': False, 'use_spike': False, 'rsi_required': False, 'edge_k': 0.8690080024074758, 'edge_cap': 0.5312744652147546, 'bull_strategy': 'mean_reversion', 'bull_bb_std_mult': 3.1572851586450628, 'bull_rsi_os': 29, 'bull_rsi_ob': 95, 'bull_adx_thresh': 12.602076295360856, 'bull_atr_min_pct': 0.0018066936250364235, 'bull_atr_max_pct': 0.12511175965851978, 'bull_tp_mult': 1.38845783290968, 'bull_tsl_mult': 0.5490235228233568, 'bull_time_stop': 180, 'bull_use_sma': False, 'bull_use_ema': True, 'bull_use_atr': True, 'bull_use_adx': False, 'bull_use_spike': False, 'bull_rsi_required': False, 'bear_strategy': 'breakout', 'bear_bb_std_mult': 2.923113696492029, 'bear_rsi_os': 22, 'bear_rsi_ob': 58, 'bear_adx_thresh': 16.79672375135214, 'bear_atr_min_pct': 0.013712154365723279, 'bear_atr_max_pct': 0.07184367226258817, 'bear_tp_mult': 2.06228273907547, 'bear_tsl_mult': 0.1385900286719438, 'bear_time_stop': 48, 'bear_use_sma': False, 'bear_use_ema': True, 'bear_use_atr': True, 'bear_use_adx': False, 'bear_use_spike': False, 'bear_rsi_required': False, 'sideways_strategy': 'breakout', 'sideways_bb_std_mult': 3.039840286035959, 'sideways_rsi_os': 11, 'sideways_rsi_ob': 61, 'sideways_adx_thresh': 21.301502669212745, 'sideways_atr_min_pct': 0.028784063306440087, 'sideways_atr_max_pct': 0.10243608989973163, 'sideways_tp_mult': 2.669882908481567, 'sideways_tsl_mult': 0.3513509475349328, 'sideways_time_stop': 117, 'sideways_use_sma': True, 'sideways_use_ema': False, 'sideways_use_atr': True, 'sideways_use_adx': False, 'sideways_use_spike': False, 'sideways_rsi_required': True}.
[I 2025-08-30 19:08:56,628] Trial 353 finished with values: [-1000000000.0, 1000000000.0] and parameters: {'p_sma': 11, 'p_std': 32, 'p_atr': 22, 'p_adx': 19, 'rsi_period': 35, 'ema1': 9, 'ema2': 10, 'slip_atr_k': 0.0720951434685118, 'slip_spread_k': 0.01127947348887931, 'spread_hl_frac': 0.0034212133426722337, 'bb_std_mult': 2.130648967609596, 'rsi_os': 49, 'rsi_ob': 84, 'vol_spike': 0.2758431593825221, 'adx_thresh': 33.01385829486226, 'atr_min_pct': 0.02369541517979494, 'atr_max_pct': 0.08408153564372303, 'tp_mult': 2.2510306925644796, 'tsl_mult': 0.3129044162224896, 'strategy': 'mean_reversion', 'time_stop': 30, 'use_sma': False, 'use_atr': False, 'use_adx': False, 'use_ema': False, 'use_spike': False, 'rsi_required': True, 'edge_k': 0.1396574582982405, 'edge_cap': 0.5226167235323113, 'bull_strategy': 'mean_reversion', 'bull_bb_std_mult': 0.5042468711936345, 'bull_rsi_os': 27, 'bull_rsi_ob': 65, 'bull_adx_thresh': 10.582025469402534, 'bull_atr_min_pct': 0.0026341279326286804, 'bull_atr_max_pct': 0.11917293388064283, 'bull_tp_mult': 2.58248067865631, 'bull_tsl_mult': 0.544621332882006, 'bull_time_stop': 181, 'bull_use_sma': False, 'bull_use_ema': True, 'bull_use_atr': True, 'bull_use_adx': False, 'bull_use_spike': False, 'bull_rsi_required': False, 'bear_strategy': 'breakout', 'bear_bb_std_mult': 1.0610440833138322, 'bear_rsi_os': 50, 'bear_rsi_ob': 95, 'bear_adx_thresh': 18.114632178065083, 'bear_atr_min_pct': 0.013681691192110015, 'bear_atr_max_pct': 0.06794968024711562, 'bear_tp_mult': 2.7991064446938627, 'bear_tsl_mult': 0.7017507471226481, 'bear_time_stop': 50, 'bear_use_sma': False, 'bear_use_ema': True, 'bear_use_atr': False, 'bear_use_adx': False, 'bear_use_spike': False, 'bear_rsi_required': True, 'sideways_strategy': 'breakout', 'sideways_bb_std_mult': 3.0215943583601574, 'sideways_rsi_os': 51, 'sideways_rsi_ob': 56, 'sideways_adx_thresh': 21.971135274072903, 'sideways_atr_min_pct': 0.021343808386335286, 'sideways_atr_max_pct': 0.14996708252691324, 'sideways_tp_mult': 1.463050844151236, 'sideways_tsl_mult': 0.9219580469514594, 'sideways_time_stop': 19, 'sideways_use_sma': False, 'sideways_use_ema': True, 'sideways_use_atr': True, 'sideways_use_adx': False, 'sideways_use_spike': False, 'sideways_rsi_required': False}.
[I 2025-08-30 19:08:57,420] Trial 352 finished with values: [-0.017968751408950823, 0.018025791521533947] and parameters: {'p_sma': 29, 'p_std': 27, 'p_atr': 26, 'p_adx': 23, 'rsi_period': 18, 'ema1': 9, 'ema2': 32, 'slip_atr_k': 0.0721250579472664, 'slip_spread_k': 0.16162686096834133, 'spread_hl_frac': 0.012348167260937723, 'bb_std_mult': 1.380498504027617, 'rsi_os': 18, 'rsi_ob': 67, 'vol_spike': 0.27611703981437646, 'adx_thresh': 30.632027357683484, 'atr_min_pct': 0.024989879097262552, 'atr_max_pct': 0.09985516765469749, 'tp_mult': 1.7441470639075518, 'tsl_mult': 0.3188092904882166, 'strategy': 'mean_reversion', 'time_stop': 57, 'use_sma': True, 'use_atr': False, 'use_adx': True, 'use_ema': False, 'use_spike': False, 'rsi_required': True, 'edge_k': 1.131676171028904, 'edge_cap': 0.0944212346240812, 'bull_strategy': 'mean_reversion', 'bull_bb_std_mult': 0.9431089327831326, 'bull_rsi_os': 29, 'bull_rsi_ob': 65, 'bull_adx_thresh': 10.592946893656507, 'bull_atr_min_pct': 0.0021020286250837705, 'bull_atr_max_pct': 0.12569362224521843, 'bull_tp_mult': 1.670754227867117, 'bull_tsl_mult': 0.5252265532385869, 'bull_time_stop': 180, 'bull_use_sma': False, 'bull_use_ema': True, 'bull_use_atr': True, 'bull_use_adx': False, 'bull_use_spike': False, 'bull_rsi_required': False, 'bear_strategy': 'breakout', 'bear_bb_std_mult': 2.8389012365575375, 'bear_rsi_os': 50, 'bear_rsi_ob': 74, 'bear_adx_thresh': 18.168874629497143, 'bear_atr_min_pct': 0.013820264956889988, 'bear_atr_max_pct': 0.08892380374511408, 'bear_tp_mult': 2.713660461740089, 'bear_tsl_mult': 0.3669706971545771, 'bear_time_stop': 253, 'bear_use_sma': False, 'bear_use_ema': False, 'bear_use_atr': False, 'bear_use_adx': False, 'bear_use_spike': False, 'bear_rsi_required': True, 'sideways_strategy': 'breakout', 'sideways_bb_std_mult': 2.305130387451893, 'sideways_rsi_os': 37, 'sideways_rsi_ob': 56, 'sideways_adx_thresh': 20.415440185462376, 'sideways_atr_min_pct': 0.0023592154400284547, 'sideways_atr_max_pct': 0.10219999461701794, 'sideways_tp_mult': 2.427783325988553, 'sideways_tsl_mult': 0.050302418147716466, 'sideways_time_stop': 119, 'sideways_use_sma': False, 'sideways_use_ema': True, 'sideways_use_atr': True, 'sideways_use_adx': False, 'sideways_use_spike': False, 'sideways_rsi_required': True}.
[I 2025-08-30 19:08:58,355] Trial 354 finished with values: [-0.02979713629614611, 0.029697037000446274] and parameters: {'p_sma': 29, 'p_std': 21, 'p_atr': 11, 'p_adx': 15, 'rsi_period': 33, 'ema1': 9, 'ema2': 33, 'slip_atr_k': 0.0727527945840249, 'slip_spread_k': 0.34366600570737094, 'spread_hl_frac': 0.04946654336413619, 'bb_std_mult': 2.1602212106963075, 'rsi_os': 48, 'rsi_ob': 84, 'vol_spike': 0.23685692899748617, 'adx_thresh': 33.049825683948455, 'atr_min_pct': 0.024957205687801493, 'atr_max_pct': 0.0840945234155065, 'tp_mult': 2.4199135495087845, 'tsl_mult': 0.471278811393972, 'strategy': 'mean_reversion', 'time_stop': 60, 'use_sma': False, 'use_atr': False, 'use_adx': False, 'use_ema': False, 'use_spike': False, 'rsi_required': True, 'edge_k': 0.11695768980812449, 'edge_cap': 0.3502508683675911, 'bull_strategy': 'mean_reversion', 'bull_bb_std_mult': 1.1491271751267957, 'bull_rsi_os': 43, 'bull_rsi_ob': 52, 'bull_adx_thresh': 15.644569901278178, 'bull_atr_min_pct': 0.025223922570702082, 'bull_atr_max_pct': 0.11868510939721993, 'bull_tp_mult': 1.6773619876449246, 'bull_tsl_mult': 0.5458069433998304, 'bull_time_stop': 48, 'bull_use_sma': False, 'bull_use_ema': True, 'bull_use_atr': True, 'bull_use_adx': False, 'bull_use_spike': False, 'bull_rsi_required': False, 'bear_strategy': 'breakout', 'bear_bb_std_mult': 2.768335291244382, 'bear_rsi_os': 49, 'bear_rsi_ob': 75, 'bear_adx_thresh': 34.84286542731422, 'bear_atr_min_pct': 0.028498216437054403, 'bear_atr_max_pct': 0.06338312189929901, 'bear_tp_mult': 2.805110835889378, 'bear_tsl_mult': 0.7000488014057149, 'bear_time_stop': 253, 'bear_use_sma': False, 'bear_use_ema': True, 'bear_use_atr': False, 'bear_use_adx': False, 'bear_use_spike': False, 'bear_rsi_required': True, 'sideways_strategy': 'breakout', 'sideways_bb_std_mult': 2.3999131314548054, 'sideways_rsi_os': 37, 'sideways_rsi_ob': 56, 'sideways_adx_thresh': 20.320402935455576, 'sideways_atr_min_pct': 0.0023361894037489334, 'sideways_atr_max_pct': 0.04586891016773168, 'sideways_tp_mult': 1.6293990775050853, 'sideways_tsl_mult': 0.9614386463963092, 'sideways_time_stop': 122, 'sideways_use_sma': False, 'sideways_use_ema': True, 'sideways_use_atr': True, 'sideways_use_adx': False, 'sideways_use_spike': False, 'sideways_rsi_required': False}.
[I 2025-08-30 19:08:59,048] Trial 358 finished with values: [-1000000000.0, 1000000000.0] and parameters: {'p_sma': 18, 'p_std': 21, 'p_atr': 9, 'p_adx': 11, 'rsi_period': 25, 'ema1': 28, 'ema2': 49, 'slip_atr_k': 0.07496487793335715, 'slip_spread_k': 0.5696689149539739, 'spread_hl_frac': 0.023682632518462424, 'bb_std_mult': 2.184529847481045, 'rsi_os': 53, 'rsi_ob': 78, 'vol_spike': 0.15319062987896573, 'adx_thresh': 13.740282357526374, 'atr_min_pct': 0.003848282828756898, 'atr_max_pct': 0.06541889864094017, 'tp_mult': 2.3170787348887156, 'tsl_mult': 0.7289120554780317, 'strategy': 'mean_reversion', 'time_stop': 221, 'use_sma': False, 'use_atr': True, 'use_adx': False, 'use_ema': False, 'use_spike': True, 'rsi_required': False, 'edge_k': 0.12200811183834666, 'edge_cap': 0.36578041542122575, 'bull_strategy': 'mean_reversion', 'bull_bb_std_mult': 1.5207824523988287, 'bull_rsi_os': 33, 'bull_rsi_ob': 46, 'bull_adx_thresh': 5.029253325750275, 'bull_atr_min_pct': 0.0022046165694539, 'bull_atr_max_pct': 0.10201281034581654, 'bull_tp_mult': 2.411263975751572, 'bull_tsl_mult': 0.5119840622751325, 'bull_time_stop': 193, 'bull_use_sma': True, 'bull_use_ema': True, 'bull_use_atr': True, 'bull_use_adx': False, 'bull_use_spike': False, 'bull_rsi_required': True, 'bear_strategy': 'breakout', 'bear_bb_std_mult': 2.820643344423858, 'bear_rsi_os': 49, 'bear_rsi_ob': 75, 'bear_adx_thresh': 33.65092699592359, 'bear_atr_min_pct': 0.024835000256060412, 'bear_atr_max_pct': 0.031662920764477354, 'bear_tp_mult': 1.6223746771737824, 'bear_tsl_mult': 0.7264851230004872, 'bear_time_stop': 212, 'bear_use_sma': True, 'bear_use_ema': True, 'bear_use_atr': False, 'bear_use_adx': False, 'bear_use_spike': False, 'bear_rsi_required': True, 'sideways_strategy': 'mean_reversion', 'sideways_bb_std_mult': 3.1520207947304537, 'sideways_rsi_os': 37, 'sideways_rsi_ob': 52, 'sideways_adx_thresh': 20.324119881966308, 'sideways_atr_min_pct': 0.0026075306915225214, 'sideways_atr_max_pct': 0.044957588866996065, 'sideways_tp_mult': 1.751024857295123, 'sideways_tsl_mult': 0.04370847792766952, 'sideways_time_stop': 214, 'sideways_use_sma': False, 'sideways_use_ema': True, 'sideways_use_atr': False, 'sideways_use_adx': False, 'sideways_use_spike': False, 'sideways_rsi_required': False}.
[I 2025-08-30 19:09:31,253] Trial 356 finished with values: [-1000000000.0, 1000000000.0] and parameters: {'p_sma': 18, 'p_std': 30, 'p_atr': 13, 'p_adx': 23, 'rsi_period': 51, 'ema1': 25, 'ema2': 33, 'slip_atr_k': 0.07597643037948561, 'slip_spread_k': 0.20785164508391277, 'spread_hl_frac': 0.034598555000980365, 'bb_std_mult': 1.2881930190297504, 'rsi_os': 53, 'rsi_ob': 68, 'vol_spike': 0.26255975045915275, 'adx_thresh': 7.239997804055621, 'atr_min_pct': 0.019812112414332558, 'atr_max_pct': 0.06263407132197019, 'tp_mult': 2.0490467102507286, 'tsl_mult': 0.7303357014678017, 'strategy': 'breakout', 'time_stop': 222, 'use_sma': True, 'use_atr': True, 'use_adx': True, 'use_ema': False, 'use_spike': True, 'rsi_required': True, 'edge_k': 1.4545959652005374, 'edge_cap': 0.4023022782581926, 'bull_strategy': 'breakout', 'bull_bb_std_mult': 1.8026549648637158, 'bull_rsi_os': 17, 'bull_rsi_ob': 72, 'bull_adx_thresh': 16.8287516921755, 'bull_atr_min_pct': 0.012576555000997922, 'bull_atr_max_pct': 0.129901746201082, 'bull_tp_mult': 2.566106025415, 'bull_tsl_mult': 0.523774692498286, 'bull_time_stop': 193, 'bull_use_sma': True, 'bull_use_ema': False, 'bull_use_atr': True, 'bull_use_adx': False, 'bull_use_spike': False, 'bull_rsi_required': True, 'bear_strategy': 'breakout', 'bear_bb_std_mult': 2.818535185575137, 'bear_rsi_os': 49, 'bear_rsi_ob': 75, 'bear_adx_thresh': 15.752852971530723, 'bear_atr_min_pct': 0.014186501448309881, 'bear_atr_max_pct': 0.08770813763570436, 'bear_tp_mult': 1.3044586943492218, 'bear_tsl_mult': 0.48312343976073896, 'bear_time_stop': 188, 'bear_use_sma': True, 'bear_use_ema': False, 'bear_use_atr': False, 'bear_use_adx': True, 'bear_use_spike': False, 'bear_rsi_required': True, 'sideways_strategy': 'mean_reversion', 'sideways_bb_std_mult': 3.222683154731189, 'sideways_rsi_os': 32, 'sideways_rsi_ob': 50, 'sideways_adx_thresh': 20.357754924046056, 'sideways_atr_min_pct': 0.002427674815531741, 'sideways_atr_max_pct': 0.14676811391371106, 'sideways_tp_mult': 1.1249107537639227, 'sideways_tsl_mult': 0.5749180141997109, 'sideways_time_stop': 153, 'sideways_use_sma': False, 'sideways_use_ema': True, 'sideways_use_atr': False, 'sideways_use_adx': False, 'sideways_use_spike': True, 'sideways_rsi_required': False}.
[I 2025-08-30 19:09:31,543] Trial 357 finished with values: [-0.04394240122279247, 0.04418841868196798] and parameters: {'p_sma': 38, 'p_std': 21, 'p_atr': 10, 'p_adx': 22, 'rsi_period': 60, 'ema1': 25, 'ema2': 33, 'slip_atr_k': 0.07463624053031151, 'slip_spread_k': 0.9944612999040201, 'spread_hl_frac': 0.02166276465894857, 'bb_std_mult': 2.186126450917891, 'rsi_os': 5, 'rsi_ob': 68, 'vol_spike': 0.260786375909955, 'adx_thresh': 33.5267710329176, 'atr_min_pct': 0.007925732785765555, 'atr_max_pct': 0.09031053194476765, 'tp_mult': 1.074730614961325, 'tsl_mult': 0.843614178037356, 'strategy': 'mean_reversion', 'time_stop': 266, 'use_sma': True, 'use_atr': True, 'use_adx': False, 'use_ema': False, 'use_spike': True, 'rsi_required': False, 'edge_k': 0.25563248569830355, 'edge_cap': 0.4464880846605697, 'bull_strategy': 'breakout', 'bull_bb_std_mult': 0.9224625185470334, 'bull_rsi_os': 48, 'bull_rsi_ob': 46, 'bull_adx_thresh': 16.87484106705048, 'bull_atr_min_pct': 0.0009776465796040572, 'bull_atr_max_pct': 0.12058353722093097, 'bull_tp_mult': 2.423178705791829, 'bull_tsl_mult': 0.5140049877649889, 'bull_time_stop': 35, 'bull_use_sma': True, 'bull_use_ema': True, 'bull_use_atr': True, 'bull_use_adx': False, 'bull_use_spike': False, 'bull_rsi_required': True, 'bear_strategy': 'breakout', 'bear_bb_std_mult': 1.9044943875575662, 'bear_rsi_os': 51, 'bear_rsi_ob': 78, 'bear_adx_thresh': 33.57696258055405, 'bear_atr_min_pct': 0.0035730905436488457, 'bear_atr_max_pct': 0.03164501646075403, 'bear_tp_mult': 1.0191299575010722, 'bear_tsl_mult': 0.7605371450172705, 'bear_time_stop': 209, 'bear_use_sma': True, 'bear_use_ema': True, 'bear_use_atr': False, 'bear_use_adx': False, 'bear_use_spike': False, 'bear_rsi_required': True, 'sideways_strategy': 'mean_reversion', 'sideways_bb_std_mult': 2.404541104156761, 'sideways_rsi_os': 37, 'sideways_rsi_ob': 77, 'sideways_adx_thresh': 20.41224745675081, 'sideways_atr_min_pct': 0.0031418341528294804, 'sideways_atr_max_pct': 0.14642250106781335, 'sideways_tp_mult': 1.141634153430605, 'sideways_tsl_mult': 0.042285367912880234, 'sideways_time_stop': 238, 'sideways_use_sma': False, 'sideways_use_ema': True, 'sideways_use_atr': False, 'sideways_use_adx': False, 'sideways_use_spike': False, 'sideways_rsi_required': False}.
[I 2025-08-30 19:09:31,728] Trial 355 finished with values: [-1000000000.0, 1000000000.0] and parameters: {'p_sma': 16, 'p_std': 50, 'p_atr': 11, 'p_adx': 19, 'rsi_period': 34, 'ema1': 9, 'ema2': 34, 'slip_atr_k': 0.23275064775793775, 'slip_spread_k': 0.9981481958348539, 'spread_hl_frac': 0.01747109827807805, 'bb_std_mult': 0.5438476164413115, 'rsi_os': 53, 'rsi_ob': 84, 'vol_spike': 0.26163295792208974, 'adx_thresh': 30.739157257518663, 'atr_min_pct': 0.004177710911891792, 'atr_max_pct': 0.0672687655473451, 'tp_mult': 2.399313612751377, 'tsl_mult': 0.8397877987792306, 'strategy': 'breakout', 'time_stop': 268, 'use_sma': False, 'use_atr': True, 'use_adx': False, 'use_ema': False, 'use_spike': True, 'rsi_required': True, 'edge_k': 0.11888931154636773, 'edge_cap': 0.4692301961788524, 'bull_strategy': 'mean_reversion', 'bull_bb_std_mult': 0.9069948520836926, 'bull_rsi_os': 48, 'bull_rsi_ob': 53, 'bull_adx_thresh': 24.483663182714366, 'bull_atr_min_pct': 0.0027434900935648615, 'bull_atr_max_pct': 0.10063970125837624, 'bull_tp_mult': 2.7297546797773986, 'bull_tsl_mult': 0.5319166209558431, 'bull_time_stop': 298, 'bull_use_sma': True, 'bull_use_ema': True, 'bull_use_atr': True, 'bull_use_adx': False, 'bull_use_spike': False, 'bull_rsi_required': True, 'bear_strategy': 'breakout', 'bear_bb_std_mult': 1.890911250914109, 'bear_rsi_os': 51, 'bear_rsi_ob': 75, 'bear_adx_thresh': 17.698028550368967, 'bear_atr_min_pct': 0.01661635920126301, 'bear_atr_max_pct': 0.08904986740973773, 'bear_tp_mult': 1.6161670392400205, 'bear_tsl_mult': 0.36883720826518984, 'bear_time_stop': 211, 'bear_use_sma': False, 'bear_use_ema': True, 'bear_use_atr': False, 'bear_use_adx': True, 'bear_use_spike': False, 'bear_rsi_required': True, 'sideways_strategy': 'breakout', 'sideways_bb_std_mult': 1.6999815465069137, 'sideways_rsi_os': 35, 'sideways_rsi_ob': 50, 'sideways_adx_thresh': 20.26399766874985, 'sideways_atr_min_pct': 0.002992799614587877, 'sideways_atr_max_pct': 0.14698281408598043, 'sideways_tp_mult': 1.128265095546526, 'sideways_tsl_mult': 0.9255498189314596, 'sideways_time_stop': 153, 'sideways_use_sma': False, 'sideways_use_ema': True, 'sideways_use_atr': False, 'sideways_use_adx': False, 'sideways_use_spike': True, 'sideways_rsi_required': False}.
[I 2025-08-30 19:09:33,104] Trial 359 finished with values: [-0.029728293481178447, 0.02961747931021051] and parameters: {'p_sma': 40, 'p_std': 35, 'p_atr': 13, 'p_adx': 20, 'rsi_period': 33, 'ema1': 23, 'ema2': 17, 'slip_atr_k': 0.08154194167186754, 'slip_spread_k': 0.3462000113697147, 'spread_hl_frac': 0.012186828563732875, 'bb_std_mult': 2.181820424739929, 'rsi_os': 48, 'rsi_ob': 89, 'vol_spike': 0.18372085842421232, 'adx_thresh': 33.456972628111366, 'atr_min_pct': 0.02464712976431242, 'atr_max_pct': 0.11858381969969832, 'tp_mult': 2.0387240251865095, 'tsl_mult': 0.5520944819796925, 'strategy': 'mean_reversion', 'time_stop': 269, 'use_sma': True, 'use_atr': True, 'use_adx': True, 'use_ema': False, 'use_spike': True, 'rsi_required': False, 'edge_k': 0.2626321190020692, 'edge_cap': 0.4643486581912401, 'bull_strategy': 'breakout', 'bull_bb_std_mult': 1.7668205050028107, 'bull_rsi_os': 49, 'bull_rsi_ob': 51, 'bull_adx_thresh': 15.442229096347578, 'bull_atr_min_pct': 0.0008847118153490554, 'bull_atr_max_pct': 0.04466470177008615, 'bull_tp_mult': 2.823323910988245, 'bull_tsl_mult': 0.9822614691395202, 'bull_time_stop': 35, 'bull_use_sma': True, 'bull_use_ema': True, 'bull_use_atr': True, 'bull_use_adx': False, 'bull_use_spike': False, 'bull_rsi_required': True, 'bear_strategy': 'breakout', 'bear_bb_std_mult': 2.8567712299776007, 'bear_rsi_os': 12, 'bear_rsi_ob': 78, 'bear_adx_thresh': 15.732836888466906, 'bear_atr_min_pct': 0.028505784972496742, 'bear_atr_max_pct': 0.14996500909374094, 'bear_tp_mult': 1.461318364133331, 'bear_tsl_mult': 0.36416980277850763, 'bear_time_stop': 189, 'bear_use_sma': True, 'bear_use_ema': True, 'bear_use_atr': False, 'bear_use_adx': False, 'bear_use_spike': False, 'bear_rsi_required': True, 'sideways_strategy': 'breakout', 'sideways_bb_std_mult': 3.2191170331715244, 'sideways_rsi_os': 35, 'sideways_rsi_ob': 59, 'sideways_adx_thresh': 9.891373030727337, 'sideways_atr_min_pct': 0.00328072795448909, 'sideways_atr_max_pct': 0.08524180918258116, 'sideways_tp_mult': 1.1436396453373372, 'sideways_tsl_mult': 0.8311645560501328, 'sideways_time_stop': 139, 'sideways_use_sma': False, 'sideways_use_ema': True, 'sideways_use_atr': True, 'sideways_use_adx': False, 'sideways_use_spike': True, 'sideways_rsi_required': True}.
