[I 2025-08-30 20:03:33,977] Trial 829 finished with values: [-1000000000.0, 1000000000.0] and parameters: {'p_sma': 38, 'p_std': 31, 'p_atr': 10, 'p_adx': 20, 'rsi_period': 33, 'ema1': 26, 'ema2': 20, 'slip_atr_k': 0.07248557122546251, 'slip_spread_k': 0.11470543281661516, 'spread_hl_frac': 0.014192203304448687, 'bb_std_mult': 2.332127111048555, 'rsi_os': 51, 'rsi_ob': 87, 'vol_spike': 0.11199263436277009, 'adx_thresh': 33.20928922080882, 'atr_min_pct': 0.007877895195716418, 'atr_max_pct': 0.09619443330785646, 'tp_mult': 2.3775957103298513, 'tsl_mult': 0.8685491705998246, 'strategy': 'mean_reversion', 'time_stop': 217, 'use_sma': False, 'use_atr': True, 'use_adx': False, 'use_ema': False, 'use_spike': True, 'rsi_required': False, 'edge_k': 0.40472031919977725, 'edge_cap': 0.7655000720968637, 'bull_strategy': 'mean_reversion', 'bull_bb_std_mult': 1.7388599606505457, 'bull_rsi_os': 28, 'bull_rsi_ob': 45, 'bull_adx_thresh': 19.293038786332346, 'bull_atr_min_pct': 0.0019445699943160535, 'bull_atr_max_pct': 0.11961388686403736, 'bull_tp_mult': 2.715806357520022, 'bull_tsl_mult': 0.03483134479135891, 'bull_time_stop': 184, 'bull_use_sma': False, 'bull_use_ema': True, 'bull_use_atr': True, 'bull_use_adx': True, 'bull_use_spike': False, 'bull_rsi_required': False, 'bear_strategy': 'breakout', 'bear_bb_std_mult': 2.8374163023277696, 'bear_rsi_os': 44, 'bear_rsi_ob': 79, 'bear_adx_thresh': 25.4387854745123, 'bear_atr_min_pct': 0.007636382703884838, 'bear_atr_max_pct': 0.04145542650058193, 'bear_tp_mult': 1.525756780142513, 'bear_tsl_mult': 0.21507908387965669, 'bear_time_stop': 196, 'bear_use_sma': True, 'bear_use_ema': True, 'bear_use_atr': False, 'bear_use_adx': False, 'bear_use_spike': False, 'bear_rsi_required': True, 'sideways_strategy': 'breakout', 'sideways_bb_std_mult': 3.2353560205283975, 'sideways_rsi_os': 19, 'sideways_rsi_ob': 56, 'sideways_adx_thresh': 22.700529619282445, 'sideways_atr_min_pct': 0.0037840799810438808, 'sideways_atr_max_pct': 0.1451089936409259, 'sideways_tp_mult': 1.0765901594076284, 'sideways_tsl_mult': 0.9417753631513466, 'sideways_time_stop': 39, 'sideways_use_sma': False, 'sideways_use_ema': False, 'sideways_use_atr': True, 'sideways_use_adx': False, 'sideways_use_spike': False, 'sideways_rsi_required': False}.
[I 2025-08-30 20:04:00,287] Trial 830 finished with values: [-0.0339550391968767, 0.0338734487070094] and parameters: {'p_sma': 57, 'p_std': 27, 'p_atr': 8, 'p_adx': 29, 'rsi_period': 26, 'ema1': 24, 'ema2': 20, 'slip_atr_k': 0.07329232321094693, 'slip_spread_k': 0.20995236234563708, 'spread_hl_frac': 0.020378554303860666, 'bb_std_mult': 2.324276181678101, 'rsi_os': 42, 'rsi_ob': 92, 'vol_spike': 0.2673745311520109, 'adx_thresh': 32.9932613166579, 'atr_min_pct': 0.018391152476625015, 'atr_max_pct': 0.1278310986019363, 'tp_mult': 1.6826550222988046, 'tsl_mult': 0.46014186128887774, 'strategy': 'mean_reversion', 'time_stop': 82, 'use_sma': False, 'use_atr': True, 'use_adx': False, 'use_ema': False, 'use_spike': True, 'rsi_required': True, 'edge_k': 0.41524735084230724, 'edge_cap': 0.5412356262180503, 'bull_strategy': 'mean_reversion', 'bull_bb_std_mult': 3.252368965833885, 'bull_rsi_os': 54, 'bull_rsi_ob': 50, 'bull_adx_thresh': 17.95112293600342, 'bull_atr_min_pct': 0.0020564109745381427, 'bull_atr_max_pct': 0.12139147521811537, 'bull_tp_mult': 1.5293725417278534, 'bull_tsl_mult': 0.5867943519675546, 'bull_time_stop': 193, 'bull_use_sma': False, 'bull_use_ema': False, 'bull_use_atr': True, 'bull_use_adx': True, 'bull_use_spike': True, 'bull_rsi_required': False, 'bear_strategy': 'breakout', 'bear_bb_std_mult': 1.9122427926441599, 'bear_rsi_os': 42, 'bear_rsi_ob': 75, 'bear_adx_thresh': 18.153484451757706, 'bear_atr_min_pct': 0.007064011625328477, 'bear_atr_max_pct': 0.03650714986554688, 'bear_tp_mult': 1.2863500040585547, 'bear_tsl_mult': 0.12995853771125798, 'bear_time_stop': 194, 'bear_use_sma': True, 'bear_use_ema': True, 'bear_use_atr': False, 'bear_use_adx': False, 'bear_use_spike': False, 'bear_rsi_required': True, 'sideways_strategy': 'mean_reversion', 'sideways_bb_std_mult': 0.8148624102365987, 'sideways_rsi_os': 38, 'sideways_rsi_ob': 63, 'sideways_adx_thresh': 26.6612439039006, 'sideways_atr_min_pct': 0.0037919862116945714, 'sideways_atr_max_pct': 0.04820167591778088, 'sideways_tp_mult': 1.0705558128817083, 'sideways_tsl_mult': 0.9440335132005007, 'sideways_time_stop': 170, 'sideways_use_sma': False, 'sideways_use_ema': False, 'sideways_use_atr': True, 'sideways_use_adx': True, 'sideways_use_spike': False, 'sideways_rsi_required': False}.
[I 2025-08-30 20:04:02,186] Trial 827 finished with values: [-0.018956193822032175, 0.019006614014905485] and parameters: {'p_sma': 5, 'p_std': 55, 'p_atr': 10, 'p_adx': 20, 'rsi_period': 23, 'ema1': 26, 'ema2': 53, 'slip_atr_k': 0.06782264522980333, 'slip_spread_k': 0.12253072488923818, 'spread_hl_frac': 0.011454571069382, 'bb_std_mult': 2.3410270385637837, 'rsi_os': 30, 'rsi_ob': 60, 'vol_spike': 0.26670952875735104, 'adx_thresh': 6.071438709777949, 'atr_min_pct': 0.024023016755370163, 'atr_max_pct': 0.09238363451464456, 'tp_mult': 2.345033606202546, 'tsl_mult': 0.46440382047549833, 'strategy': 'mean_reversion', 'time_stop': 205, 'use_sma': False, 'use_atr': True, 'use_adx': True, 'use_ema': False, 'use_spike': True, 'rsi_required': False, 'edge_k': 0.5415170770403548, 'edge_cap': 0.2507407461296515, 'bull_strategy': 'mean_reversion', 'bull_bb_std_mult': 2.8268295561970285, 'bull_rsi_os': 31, 'bull_rsi_ob': 50, 'bull_adx_thresh': 18.25744063657112, 'bull_atr_min_pct': 0.001361801871400194, 'bull_atr_max_pct': 0.12109990421274153, 'bull_tp_mult': 2.718839560948288, 'bull_tsl_mult': 0.5282360454860905, 'bull_time_stop': 186, 'bull_use_sma': False, 'bull_use_ema': True, 'bull_use_atr': True, 'bull_use_adx': False, 'bull_use_spike': False, 'bull_rsi_required': True, 'bear_strategy': 'breakout', 'bear_bb_std_mult': 2.979875732715867, 'bear_rsi_os': 49, 'bear_rsi_ob': 79, 'bear_adx_thresh': 22.887183369284006, 'bear_atr_min_pct': 0.0195348090332723, 'bear_atr_max_pct': 0.04142348669063143, 'bear_tp_mult': 1.279533237888706, 'bear_tsl_mult': 0.13283484353097763, 'bear_time_stop': 194, 'bear_use_sma': True, 'bear_use_ema': True, 'bear_use_atr': False, 'bear_use_adx': False, 'bear_use_spike': False, 'bear_rsi_required': True, 'sideways_strategy': 'breakout', 'sideways_bb_std_mult': 3.223623854571155, 'sideways_rsi_os': 35, 'sideways_rsi_ob': 60, 'sideways_adx_thresh': 20.494304734190514, 'sideways_atr_min_pct': 0.0008046001689987936, 'sideways_atr_max_pct': 0.14458060686772767, 'sideways_tp_mult': 1.0869834765165476, 'sideways_tsl_mult': 0.9390724912949378, 'sideways_time_stop': 42, 'sideways_use_sma': False, 'sideways_use_ema': True, 'sideways_use_atr': True, 'sideways_use_adx': False, 'sideways_use_spike': False, 'sideways_rsi_required': True}.
[I 2025-08-30 20:04:09,658] Trial 831 finished with values: [-1000000000.0, 1000000000.0] and parameters: {'p_sma': 57, 'p_std': 27, 'p_atr': 28, 'p_adx': 29, 'rsi_period': 50, 'ema1': 27, 'ema2': 32, 'slip_atr_k': 0.0726069913329298, 'slip_spread_k': 0.2126743239997828, 'spread_hl_frac': 0.02128540167000356, 'bb_std_mult': 2.343622815664203, 'rsi_os': 43, 'rsi_ob': 87, 'vol_spike': 0.2697651879172108, 'adx_thresh': 34.34195499409529, 'atr_min_pct': 0.025162975708241067, 'atr_max_pct': 0.09699075556404083, 'tp_mult': 2.370530197264262, 'tsl_mult': 0.004181007695807315, 'strategy': 'mean_reversion', 'time_stop': 182, 'use_sma': False, 'use_atr': False, 'use_adx': False, 'use_ema': True, 'use_spike': False, 'rsi_required': True, 'edge_k': 1.8498455687541866, 'edge_cap': 0.2511387711965244, 'bull_strategy': 'mean_reversion', 'bull_bb_std_mult': 3.2502189610169223, 'bull_rsi_os': 41, 'bull_rsi_ob': 50, 'bull_adx_thresh': 17.906064683829065, 'bull_atr_min_pct': 0.0032471444939826243, 'bull_atr_max_pct': 0.12546362401019467, 'bull_tp_mult': 2.719439628334536, 'bull_tsl_mult': 0.6009642448874853, 'bull_time_stop': 179, 'bull_use_sma': True, 'bull_use_ema': False, 'bull_use_atr': True, 'bull_use_adx': True, 'bull_use_spike': True, 'bull_rsi_required': False, 'bear_strategy': 'mean_reversion', 'bear_bb_std_mult': 1.3656312274504654, 'bear_rsi_os': 49, 'bear_rsi_ob': 75, 'bear_adx_thresh': 17.991273926157568, 'bear_atr_min_pct': 0.013323795077379574, 'bear_atr_max_pct': 0.04941149666507655, 'bear_tp_mult': 2.699318994087258, 'bear_tsl_mult': 0.7703103276073698, 'bear_time_stop': 194, 'bear_use_sma': True, 'bear_use_ema': True, 'bear_use_atr': False, 'bear_use_adx': False, 'bear_use_spike': True, 'bear_rsi_required': True, 'sideways_strategy': 'mean_reversion', 'sideways_bb_std_mult': 3.2231066407681563, 'sideways_rsi_os': 38, 'sideways_rsi_ob': 59, 'sideways_adx_thresh': 34.520709081175795, 'sideways_atr_min_pct': 0.029435475775767266, 'sideways_atr_max_pct': 0.14597310399863334, 'sideways_tp_mult': 1.2406828161009527, 'sideways_tsl_mult': 0.760962252849813, 'sideways_time_stop': 181, 'sideways_use_sma': False, 'sideways_use_ema': False, 'sideways_use_atr': True, 'sideways_use_adx': True, 'sideways_use_spike': False, 'sideways_rsi_required': False}.
[I 2025-08-30 20:04:10,067] Trial 832 finished with values: [-1000000000.0, 1000000000.0] and parameters: {'p_sma': 9, 'p_std': 32, 'p_atr': 8, 'p_adx': 19, 'rsi_period': 25, 'ema1': 24, 'ema2': 28, 'slip_atr_k': 0.05395743931198278, 'slip_spread_k': 0.0791324438208101, 'spread_hl_frac': 0.020932579043883515, 'bb_std_mult': 2.1939939652276985, 'rsi_os': 8, 'rsi_ob': 83, 'vol_spike': 0.26860595192248937, 'adx_thresh': 16.203717241013834, 'atr_min_pct': 0.025114386710867066, 'atr_max_pct': 0.09950380751500082, 'tp_mult': 2.2655699707248855, 'tsl_mult': 0.8504849644983634, 'strategy': 'mean_reversion', 'time_stop': 185, 'use_sma': False, 'use_atr': False, 'use_adx': True, 'use_ema': True, 'use_spike': False, 'rsi_required': True, 'edge_k': 1.2794621211721422, 'edge_cap': 0.822515795432426, 'bull_strategy': 'mean_reversion', 'bull_bb_std_mult': 1.076612038811137, 'bull_rsi_os': 32, 'bull_rsi_ob': 50, 'bull_adx_thresh': 17.939098192851816, 'bull_atr_min_pct': 0.0033980010959922475, 'bull_atr_max_pct': 0.12504996801368473, 'bull_tp_mult': 2.761718569144105, 'bull_tsl_mult': 0.5970999955056664, 'bull_time_stop': 179, 'bull_use_sma': True, 'bull_use_ema': False, 'bull_use_atr': True, 'bull_use_adx': False, 'bull_use_spike': True, 'bull_rsi_required': True, 'bear_strategy': 'mean_reversion', 'bear_bb_std_mult': 1.3899950105202348, 'bear_rsi_os': 41, 'bear_rsi_ob': 57, 'bear_adx_thresh': 16.034480366107015, 'bear_atr_min_pct': 0.006934184311089022, 'bear_atr_max_pct': 0.12340326441809658, 'bear_tp_mult': 2.7066513322416546, 'bear_tsl_mult': 0.7685845654373383, 'bear_time_stop': 146, 'bear_use_sma': True, 'bear_use_ema': True, 'bear_use_atr': False, 'bear_use_adx': False, 'bear_use_spike': True, 'bear_rsi_required': True, 'sideways_strategy': 'mean_reversion', 'sideways_bb_std_mult': 0.8517956655662082, 'sideways_rsi_os': 34, 'sideways_rsi_ob': 63, 'sideways_adx_thresh': 21.452410367680365, 'sideways_atr_min_pct': 0.0015717546159881562, 'sideways_atr_max_pct': 0.14563037026222472, 'sideways_tp_mult': 1.0403838535841363, 'sideways_tsl_mult': 0.25780816925740113, 'sideways_time_stop': 170, 'sideways_use_sma': False, 'sideways_use_ema': True, 'sideways_use_atr': True, 'sideways_use_adx': True, 'sideways_use_spike': False, 'sideways_rsi_required': True}.
[I 2025-08-30 20:04:11,070] Trial 835 finished with values: [-1000000000.0, 1000000000.0] and parameters: {'p_sma': 7, 'p_std': 42, 'p_atr': 9, 'p_adx': 19, 'rsi_period': 76, 'ema1': 25, 'ema2': 28, 'slip_atr_k': 0.08138565391416257, 'slip_spread_k': 0.0712955574078552, 'spread_hl_frac': 0.023195243609288804, 'bb_std_mult': 2.196761032656407, 'rsi_os': 52, 'rsi_ob': 83, 'vol_spike': 0.2554100551111494, 'adx_thresh': 32.29805920752805, 'atr_min_pct': 0.0049101887378714786, 'atr_max_pct': 0.09237843523875736, 'tp_mult': 2.25460167334983, 'tsl_mult': 0.735625812042356, 'strategy': 'mean_reversion', 'time_stop': 128, 'use_sma': False, 'use_atr': False, 'use_adx': True, 'use_ema': True, 'use_spike': False, 'rsi_required': False, 'edge_k': 1.9549014785769117, 'edge_cap': 0.6089982229421933, 'bull_strategy': 'mean_reversion', 'bull_bb_std_mult': 3.064136146478305, 'bull_rsi_os': 14, 'bull_rsi_ob': 94, 'bull_adx_thresh': 17.05714377570507, 'bull_atr_min_pct': 0.0293465364509256, 'bull_atr_max_pct': 0.03479293741074585, 'bull_tp_mult': 2.7647178665423975, 'bull_tsl_mult': 0.6644087345894352, 'bull_time_stop': 100, 'bull_use_sma': True, 'bull_use_ema': True, 'bull_use_atr': True, 'bull_use_adx': False, 'bull_use_spike': False, 'bull_rsi_required': True, 'bear_strategy': 'breakout', 'bear_bb_std_mult': 2.9287056471948856, 'bear_rsi_os': 52, 'bear_rsi_ob': 76, 'bear_adx_thresh': 17.56006562394555, 'bear_atr_min_pct': 0.014119000043232645, 'bear_atr_max_pct': 0.06579241973614004, 'bear_tp_mult': 2.642539544834066, 'bear_tsl_mult': 0.6878046934399238, 'bear_time_stop': 216, 'bear_use_sma': True, 'bear_use_ema': False, 'bear_use_atr': True, 'bear_use_adx': False, 'bear_use_spike': False, 'bear_rsi_required': True, 'sideways_strategy': 'breakout', 'sideways_bb_std_mult': 3.2999243930972275, 'sideways_rsi_os': 34, 'sideways_rsi_ob': 58, 'sideways_adx_thresh': 13.171129356040705, 'sideways_atr_min_pct': 0.002701306434094005, 'sideways_atr_max_pct': 0.14029783273127475, 'sideways_tp_mult': 1.768309178908006, 'sideways_tsl_mult': 0.2669080762487205, 'sideways_time_stop': 139, 'sideways_use_sma': False, 'sideways_use_ema': True, 'sideways_use_atr': True, 'sideways_use_adx': False, 'sideways_use_spike': False, 'sideways_rsi_required': True}.
[I 2025-08-30 20:04:11,108] Trial 836 finished with values: [-1000000000.0, 1000000000.0] and parameters: {'p_sma': 16, 'p_std': 47, 'p_atr': 9, 'p_adx': 7, 'rsi_period': 23, 'ema1': 25, 'ema2': 56, 'slip_atr_k': 0.08259396998792065, 'slip_spread_k': 0.15106713922455545, 'spread_hl_frac': 0.01134871757940306, 'bb_std_mult': 2.1862815938780265, 'rsi_os': 52, 'rsi_ob': 83, 'vol_spike': 0.2554837125892425, 'adx_thresh': 32.26767994955605, 'atr_min_pct': 0.024045989420375977, 'atr_max_pct': 0.09368932508384245, 'tp_mult': 1.102656859431144, 'tsl_mult': 0.838454308088104, 'strategy': 'mean_reversion', 'time_stop': 191, 'use_sma': True, 'use_atr': True, 'use_adx': True, 'use_ema': False, 'use_spike': True, 'rsi_required': False, 'edge_k': 0.3467897580177409, 'edge_cap': 0.8768615869081791, 'bull_strategy': 'mean_reversion', 'bull_bb_std_mult': 3.0810096969918863, 'bull_rsi_os': 21, 'bull_rsi_ob': 45, 'bull_adx_thresh': 21.595823918013004, 'bull_atr_min_pct': 0.00096679630228509, 'bull_atr_max_pct': 0.05039768749873688, 'bull_tp_mult': 1.6761233890439047, 'bull_tsl_mult': 0.5504148502641675, 'bull_time_stop': 99, 'bull_use_sma': False, 'bull_use_ema': True, 'bull_use_atr': True, 'bull_use_adx': False, 'bull_use_spike': False, 'bull_rsi_required': True, 'bear_strategy': 'breakout', 'bear_bb_std_mult': 2.9178081300322822, 'bear_rsi_os': 52, 'bear_rsi_ob': 60, 'bear_adx_thresh': 17.545039890032758, 'bear_atr_min_pct': 0.014192824700320282, 'bear_atr_max_pct': 0.013522726064327736, 'bear_tp_mult': 2.6444269964786726, 'bear_tsl_mult': 0.6933007193116518, 'bear_time_stop': 201, 'bear_use_sma': True, 'bear_use_ema': False, 'bear_use_atr': True, 'bear_use_adx': False, 'bear_use_spike': False, 'bear_rsi_required': False, 'sideways_strategy': 'breakout', 'sideways_bb_std_mult': 2.5010001345191313, 'sideways_rsi_os': 27, 'sideways_rsi_ob': 53, 'sideways_adx_thresh': 19.26037667665825, 'sideways_atr_min_pct': 0.025145897683487416, 'sideways_atr_max_pct': 0.14020211596533008, 'sideways_tp_mult': 1.1080595251902337, 'sideways_tsl_mult': 0.9997419334482641, 'sideways_time_stop': 161, 'sideways_use_sma': False, 'sideways_use_ema': True, 'sideways_use_atr': True, 'sideways_use_adx': False, 'sideways_use_spike': False, 'sideways_rsi_required': True}.
[I 2025-08-30 20:04:30,490] Trial 833 finished with values: [-1000000000.0, 1000000000.0] and parameters: {'p_sma': 9, 'p_std': 25, 'p_atr': 29, 'p_adx': 30, 'rsi_period': 84, 'ema1': 27, 'ema2': 56, 'slip_atr_k': 0.056168828729248804, 'slip_spread_k': 0.5147318907730848, 'spread_hl_frac': 0.0247853089835116, 'bb_std_mult': 2.196268724638109, 'rsi_os': 22, 'rsi_ob': 83, 'vol_spike': 0.2465777688893076, 'adx_thresh': 20.47256790713084, 'atr_min_pct': 0.025265249532463768, 'atr_max_pct': 0.0849821799314744, 'tp_mult': 2.339323292527162, 'tsl_mult': 0.7379811654054123, 'strategy': 'mean_reversion', 'time_stop': 182, 'use_sma': True, 'use_atr': False, 'use_adx': True, 'use_ema': True, 'use_spike': False, 'rsi_required': False, 'edge_k': 0.6796204807369168, 'edge_cap': 0.4640193435253589, 'bull_strategy': 'mean_reversion', 'bull_bb_std_mult': 2.829121778584363, 'bull_rsi_os': 21, 'bull_rsi_ob': 68, 'bull_adx_thresh': 16.891861967866795, 'bull_atr_min_pct': 0.0033438867677881125, 'bull_atr_max_pct': 0.03371890247621693, 'bull_tp_mult': 2.7479292962232678, 'bull_tsl_mult': 0.5508506843352616, 'bull_time_stop': 239, 'bull_use_sma': True, 'bull_use_ema': True, 'bull_use_atr': True, 'bull_use_adx': False, 'bull_use_spike': False, 'bull_rsi_required': True, 'bear_strategy': 'mean_reversion', 'bear_bb_std_mult': 3.519614544818483, 'bear_rsi_os': 50, 'bear_rsi_ob': 55, 'bear_adx_thresh': 16.02446543424929, 'bear_atr_min_pct': 0.013953332020547526, 'bear_atr_max_pct': 0.14981000493599195, 'bear_tp_mult': 2.6928677958821456, 'bear_tsl_mult': 0.8859328942869973, 'bear_time_stop': 219, 'bear_use_sma': True, 'bear_use_ema': True, 'bear_use_atr': False, 'bear_use_adx': False, 'bear_use_spike': True, 'bear_rsi_required': True, 'sideways_strategy': 'breakout', 'sideways_bb_std_mult': 3.20798854066873, 'sideways_rsi_os': 34, 'sideways_rsi_ob': 59, 'sideways_adx_thresh': 21.609922950753344, 'sideways_atr_min_pct': 0.0025383969597672987, 'sideways_atr_max_pct': 0.1395363336901811, 'sideways_tp_mult': 1.1979883817715318, 'sideways_tsl_mult': 0.2588437995602765, 'sideways_time_stop': 138, 'sideways_use_sma': False, 'sideways_use_ema': True, 'sideways_use_atr': True, 'sideways_use_adx': False, 'sideways_use_spike': False, 'sideways_rsi_required': True}.
[I 2025-08-30 20:04:31,281] Trial 834 finished with values: [-1000000000.0, 1000000000.0] and parameters: {'p_sma': 54, 'p_std': 31, 'p_atr': 19, 'p_adx': 19, 'rsi_period': 25, 'ema1': 25, 'ema2': 32, 'slip_atr_k': 0.05605311881135151, 'slip_spread_k': 0.7498070918518249, 'spread_hl_frac': 0.011505834466571286, 'bb_std_mult': 0.9059045779023591, 'rsi_os': 30, 'rsi_ob': 65, 'vol_spike': 0.22805968549412786, 'adx_thresh': 16.194807399644866, 'atr_min_pct': 0.024899690886548854, 'atr_max_pct': 0.03479699207455426, 'tp_mult': 1.111426738459503, 'tsl_mult': 0.7375804279332941, 'strategy': 'mean_reversion', 'time_stop': 183, 'use_sma': False, 'use_atr': False, 'use_adx': True, 'use_ema': True, 'use_spike': False, 'rsi_required': True, 'edge_k': 0.6704068554622398, 'edge_cap': 0.8484793950809615, 'bull_strategy': 'mean_reversion', 'bull_bb_std_mult': 2.82421431540433, 'bull_rsi_os': 14, 'bull_rsi_ob': 68, 'bull_adx_thresh': 17.13658320362365, 'bull_atr_min_pct': 0.029947428213342148, 'bull_atr_max_pct': 0.12492478885879908, 'bull_tp_mult': 2.7600718231513683, 'bull_tsl_mult': 0.49849804465480907, 'bull_time_stop': 213, 'bull_use_sma': True, 'bull_use_ema': False, 'bull_use_atr': True, 'bull_use_adx': False, 'bull_use_spike': True, 'bull_rsi_required': True, 'bear_strategy': 'mean_reversion', 'bear_bb_std_mult': 2.9412634313154395, 'bear_rsi_os': 49, 'bear_rsi_ob': 76, 'bear_adx_thresh': 16.169126246185037, 'bear_atr_min_pct': 0.013238123474974077, 'bear_atr_max_pct': 0.12281254830492114, 'bear_tp_mult': 2.3016403009704876, 'bear_tsl_mult': 0.9366320207605503, 'bear_time_stop': 124, 'bear_use_sma': True, 'bear_use_ema': False, 'bear_use_atr': False, 'bear_use_adx': False, 'bear_use_spike': True, 'bear_rsi_required': True, 'sideways_strategy': 'mean_reversion', 'sideways_bb_std_mult': 3.211673435838837, 'sideways_rsi_os': 27, 'sideways_rsi_ob': 59, 'sideways_adx_thresh': 34.26889066506384, 'sideways_atr_min_pct': 0.0027313476570344428, 'sideways_atr_max_pct': 0.14996536598259674, 'sideways_tp_mult': 1.7845311213566486, 'sideways_tsl_mult': 0.7549267870894816, 'sideways_time_stop': 62, 'sideways_use_sma': False, 'sideways_use_ema': True, 'sideways_use_atr': True, 'sideways_use_adx': False, 'sideways_use_spike': False, 'sideways_rsi_required': True}.
