[I 2025-08-30 19:57:13,255] Trial 777 finished with values: [-1000000000.0, 1000000000.0] and parameters: {'p_sma': 47, 'p_std': 51, 'p_atr': 9, 'p_adx': 8, 'rsi_period': 59, 'ema1': 22, 'ema2': 35, 'slip_atr_k': 0.06943893300697024, 'slip_spread_k': 0.17435293878378924, 'spread_hl_frac': 0.024097418414799805, 'bb_std_mult': 0.6233471213747468, 'rsi_os': 50, 'rsi_ob': 82, 'vol_spike': 0.2735215143234518, 'adx_thresh': 15.93422309676848, 'atr_min_pct': 0.01911937446190052, 'atr_max_pct': 0.11593370330989651, 'tp_mult': 2.1629373921763957, 'tsl_mult': 0.638207042110381, 'strategy': 'mean_reversion', 'time_stop': 191, 'use_sma': True, 'use_atr': True, 'use_adx': False, 'use_ema': False, 'use_spike': True, 'rsi_required': False, 'edge_k': 0.10073053689412273, 'edge_cap': 0.5133809623557328, 'bull_strategy': 'mean_reversion', 'bull_bb_std_mult': 3.085264368000458, 'bull_rsi_os': 47, 'bull_rsi_ob': 46, 'bull_adx_thresh': 18.299627410592613, 'bull_atr_min_pct': 0.0014929151315440637, 'bull_atr_max_pct': 0.09522356293936524, 'bull_tp_mult': 2.6543346332299635, 'bull_tsl_mult': 0.8037277435416175, 'bull_time_stop': 166, 'bull_use_sma': False, 'bull_use_ema': True, 'bull_use_atr': True, 'bull_use_adx': True, 'bull_use_spike': False, 'bull_rsi_required': False, 'bear_strategy': 'breakout', 'bear_bb_std_mult': 2.9510499164634263, 'bear_rsi_os': 36, 'bear_rsi_ob': 62, 'bear_adx_thresh': 23.117650727541655, 'bear_atr_min_pct': 0.018892996576578516, 'bear_atr_max_pct': 0.11586663948465983, 'bear_tp_mult': 2.0401017417158007, 'bear_tsl_mult': 0.7882682911197697, 'bear_time_stop': 187, 'bear_use_sma': True, 'bear_use_ema': True, 'bear_use_atr': True, 'bear_use_adx': False, 'bear_use_spike': False, 'bear_rsi_required': True, 'sideways_strategy': 'breakout', 'sideways_bb_std_mult': 0.6412438765066255, 'sideways_rsi_os': 39, 'sideways_rsi_ob': 57, 'sideways_adx_thresh': 20.45096137203555, 'sideways_atr_min_pct': 0.0022714817648305215, 'sideways_atr_max_pct': 0.027771590470092408, 'sideways_tp_mult': 1.1904365945561426, 'sideways_tsl_mult': 0.9991158191655053, 'sideways_time_stop': 157, 'sideways_use_sma': False, 'sideways_use_ema': False, 'sideways_use_atr': True, 'sideways_use_adx': False, 'sideways_use_spike': False, 'sideways_rsi_required': False}.
[I 2025-08-30 19:57:37,204] Trial 773 finished with values: [-1000000000.0, 1000000000.0] and parameters: {'p_sma': 8, 'p_std': 31, 'p_atr': 21, 'p_adx': 20, 'rsi_period': 24, 'ema1': 22, 'ema2': 57, 'slip_atr_k': 0.07826074279908032, 'slip_spread_k': 0.18570254586563395, 'spread_hl_frac': 0.04938360581036226, 'bb_std_mult': 0.6520824995373629, 'rsi_os': 29, 'rsi_ob': 91, 'vol_spike': 0.11879343472807524, 'adx_thresh': 14.732182550302486, 'atr_min_pct': 0.025184395442734205, 'atr_max_pct': 0.08690544309559059, 'tp_mult': 2.253225233947764, 'tsl_mult': 0.6480604082648417, 'strategy': 'mean_reversion', 'time_stop': 189, 'use_sma': False, 'use_atr': True, 'use_adx': True, 'use_ema': False, 'use_spike': True, 'rsi_required': False, 'edge_k': 0.03716918753686943, 'edge_cap': 0.49238746237329856, 'bull_strategy': 'mean_reversion', 'bull_bb_std_mult': 3.0884472960368905, 'bull_rsi_os': 48, 'bull_rsi_ob': 46, 'bull_adx_thresh': 18.41279806482302, 'bull_atr_min_pct': 0.028916978862655533, 'bull_atr_max_pct': 0.06908147521857508, 'bull_tp_mult': 2.6235593170401312, 'bull_tsl_mult': 0.9271241179868581, 'bull_time_stop': 40, 'bull_use_sma': False, 'bull_use_ema': True, 'bull_use_atr': False, 'bull_use_adx': False, 'bull_use_spike': False, 'bull_rsi_required': False, 'bear_strategy': 'breakout', 'bear_bb_std_mult': 1.8112024736613668, 'bear_rsi_os': 51, 'bear_rsi_ob': 78, 'bear_adx_thresh': 31.230527985109845, 'bear_atr_min_pct': 0.014467723229314078, 'bear_atr_max_pct': 0.10038389902710648, 'bear_tp_mult': 2.5813826664638766, 'bear_tsl_mult': 0.7054048236267578, 'bear_time_stop': 184, 'bear_use_sma': True, 'bear_use_ema': True, 'bear_use_atr': False, 'bear_use_adx': False, 'bear_use_spike': False, 'bear_rsi_required': True, 'sideways_strategy': 'breakout', 'sideways_bb_std_mult': 1.15151365245757, 'sideways_rsi_os': 30, 'sideways_rsi_ob': 92, 'sideways_adx_thresh': 29.44624050754905, 'sideways_atr_min_pct': 0.019542867716592482, 'sideways_atr_max_pct': 0.139998192503395, 'sideways_tp_mult': 1.5236000988222471, 'sideways_tsl_mult': 0.04644194100293597, 'sideways_time_stop': 156, 'sideways_use_sma': False, 'sideways_use_ema': False, 'sideways_use_atr': True, 'sideways_use_adx': False, 'sideways_use_spike': False, 'sideways_rsi_required': False}.
[I 2025-08-30 19:57:38,273] Trial 776 finished with values: [-1000000000.0, 1000000000.0] and parameters: {'p_sma': 48, 'p_std': 31, 'p_atr': 9, 'p_adx': 12, 'rsi_period': 59, 'ema1': 15, 'ema2': 25, 'slip_atr_k': 0.07066284342667495, 'slip_spread_k': 0.17963236168056385, 'spread_hl_frac': 0.021834700401436414, 'bb_std_mult': 2.8999629326309018, 'rsi_os': 21, 'rsi_ob': 82, 'vol_spike': 0.27087005658269464, 'adx_thresh': 31.812716174389585, 'atr_min_pct': 0.021508362633632015, 'atr_max_pct': 0.11997601885591036, 'tp_mult': 1.2104977598045055, 'tsl_mult': 0.8010898932530561, 'strategy': 'mean_reversion', 'time_stop': 168, 'use_sma': False, 'use_atr': True, 'use_adx': True, 'use_ema': False, 'use_spike': True, 'rsi_required': False, 'edge_k': 1.6467794310845782, 'edge_cap': 0.4732093675951359, 'bull_strategy': 'mean_reversion', 'bull_bb_std_mult': 1.9958957521517757, 'bull_rsi_os': 13, 'bull_rsi_ob': 46, 'bull_adx_thresh': 17.507054710633458, 'bull_atr_min_pct': 0.001408039607396978, 'bull_atr_max_pct': 0.06152827877541005, 'bull_tp_mult': 2.6373782605670066, 'bull_tsl_mult': 0.8050162404302712, 'bull_time_stop': 39, 'bull_use_sma': False, 'bull_use_ema': True, 'bull_use_atr': True, 'bull_use_adx': False, 'bull_use_spike': False, 'bull_rsi_required': False, 'bear_strategy': 'breakout', 'bear_bb_std_mult': 2.7683281675365983, 'bear_rsi_os': 50, 'bear_rsi_ob': 87, 'bear_adx_thresh': 19.054006049899378, 'bear_atr_min_pct': 0.014320818216890418, 'bear_atr_max_pct': 0.01553287196183345, 'bear_tp_mult': 2.2736595971689244, 'bear_tsl_mult': 0.7055318792079588, 'bear_time_stop': 15, 'bear_use_sma': True, 'bear_use_ema': True, 'bear_use_atr': True, 'bear_use_adx': False, 'bear_use_spike': False, 'bear_rsi_required': True, 'sideways_strategy': 'breakout', 'sideways_bb_std_mult': 3.0836352706321115, 'sideways_rsi_os': 29, 'sideways_rsi_ob': 72, 'sideways_adx_thresh': 20.53174604345712, 'sideways_atr_min_pct': 0.0022246966956376065, 'sideways_atr_max_pct': 0.04972100401480366, 'sideways_tp_mult': 1.061171589746473, 'sideways_tsl_mult': 0.6558817556979857, 'sideways_time_stop': 159, 'sideways_use_sma': False, 'sideways_use_ema': False, 'sideways_use_atr': True, 'sideways_use_adx': False, 'sideways_use_spike': False, 'sideways_rsi_required': False}.
[I 2025-08-30 19:57:38,533] Trial 775 finished with values: [-1000000000.0, 1000000000.0] and parameters: {'p_sma': 47, 'p_std': 6, 'p_atr': 21, 'p_adx': 26, 'rsi_period': 27, 'ema1': 26, 'ema2': 51, 'slip_atr_k': 0.06993756325312152, 'slip_spread_k': 0.16135891949718845, 'spread_hl_frac': 0.021606633219865726, 'bb_std_mult': 2.1024379513675586, 'rsi_os': 20, 'rsi_ob': 66, 'vol_spike': 0.2735971853590215, 'adx_thresh': 32.16529324884842, 'atr_min_pct': 0.023837898600628505, 'atr_max_pct': 0.09207644874930887, 'tp_mult': 1.3173877868865713, 'tsl_mult': 0.7997794231958917, 'strategy': 'mean_reversion', 'time_stop': 166, 'use_sma': False, 'use_atr': True, 'use_adx': True, 'use_ema': False, 'use_spike': True, 'rsi_required': False, 'edge_k': 1.6464523931553723, 'edge_cap': 0.46835301015654635, 'bull_strategy': 'mean_reversion', 'bull_bb_std_mult': 3.110670348992515, 'bull_rsi_os': 40, 'bull_rsi_ob': 46, 'bull_adx_thresh': 17.61693026535687, 'bull_atr_min_pct': 0.005131065930697329, 'bull_atr_max_pct': 0.12208774843932234, 'bull_tp_mult': 2.620756717366122, 'bull_tsl_mult': 0.5160727627312454, 'bull_time_stop': 166, 'bull_use_sma': False, 'bull_use_ema': True, 'bull_use_atr': True, 'bull_use_adx': False, 'bull_use_spike': False, 'bull_rsi_required': False, 'bear_strategy': 'breakout', 'bear_bb_std_mult': 0.8508618411431397, 'bear_rsi_os': 54, 'bear_rsi_ob': 89, 'bear_adx_thresh': 18.979564995423523, 'bear_atr_min_pct': 0.014428126889732062, 'bear_atr_max_pct': 0.043521802498254665, 'bear_tp_mult': 2.622758988037625, 'bear_tsl_mult': 0.7104031940366782, 'bear_time_stop': 208, 'bear_use_sma': True, 'bear_use_ema': True, 'bear_use_atr': True, 'bear_use_adx': False, 'bear_use_spike': False, 'bear_rsi_required': True, 'sideways_strategy': 'breakout', 'sideways_bb_std_mult': 3.175150006052684, 'sideways_rsi_os': 8, 'sideways_rsi_ob': 59, 'sideways_adx_thresh': 18.458685585942423, 'sideways_atr_min_pct': 0.0017711412522612223, 'sideways_atr_max_pct': 0.14066350087550009, 'sideways_tp_mult': 2.526275175650373, 'sideways_tsl_mult': 0.5635499066761238, 'sideways_time_stop': 173, 'sideways_use_sma': False, 'sideways_use_ema': False, 'sideways_use_atr': True, 'sideways_use_adx': False, 'sideways_use_spike': False, 'sideways_rsi_required': False}.
[I 2025-08-30 19:57:45,799] Trial 778 finished with values: [-1000000000.0, 1000000000.0] and parameters: {'p_sma': 5, 'p_std': 39, 'p_atr': 16, 'p_adx': 21, 'rsi_period': 27, 'ema1': 25, 'ema2': 59, 'slip_atr_k': 0.16660985786589366, 'slip_spread_k': 0.7837085237767372, 'spread_hl_frac': 0.04038335124241685, 'bb_std_mult': 1.666256415492767, 'rsi_os': 21, 'rsi_ob': 66, 'vol_spike': 0.0951638630384638, 'adx_thresh': 31.836279567135165, 'atr_min_pct': 0.0007340228474822831, 'atr_max_pct': 0.12053646840677673, 'tp_mult': 2.3310177587637124, 'tsl_mult': 0.8022043039387005, 'strategy': 'mean_reversion', 'time_stop': 184, 'use_sma': False, 'use_atr': True, 'use_adx': True, 'use_ema': False, 'use_spike': True, 'rsi_required': False, 'edge_k': 0.1388211478321016, 'edge_cap': 0.47032263249701406, 'bull_strategy': 'mean_reversion', 'bull_bb_std_mult': 3.1591741987031106, 'bull_rsi_os': 29, 'bull_rsi_ob': 65, 'bull_adx_thresh': 17.481728920349468, 'bull_atr_min_pct': 0.0030450140987732036, 'bull_atr_max_pct': 0.11765112521511009, 'bull_tp_mult': 2.5621766699546384, 'bull_tsl_mult': 0.46691552555128074, 'bull_time_stop': 88, 'bull_use_sma': False, 'bull_use_ema': False, 'bull_use_atr': True, 'bull_use_adx': False, 'bull_use_spike': True, 'bull_rsi_required': True, 'bear_strategy': 'breakout', 'bear_bb_std_mult': 2.784659528700388, 'bear_rsi_os': 54, 'bear_rsi_ob': 71, 'bear_adx_thresh': 17.50626509315991, 'bear_atr_min_pct': 0.004387082241022584, 'bear_atr_max_pct': 0.1385961773855229, 'bear_tp_mult': 2.7282228811095637, 'bear_tsl_mult': 0.16369542167878387, 'bear_time_stop': 206, 'bear_use_sma': True, 'bear_use_ema': True, 'bear_use_atr': False, 'bear_use_adx': False, 'bear_use_spike': False, 'bear_rsi_required': True, 'sideways_strategy': 'mean_reversion', 'sideways_bb_std_mult': 3.081031418748014, 'sideways_rsi_os': 7, 'sideways_rsi_ob': 52, 'sideways_adx_thresh': 24.83429698637693, 'sideways_atr_min_pct': 0.018784767684155865, 'sideways_atr_max_pct': 0.13994392880552273, 'sideways_tp_mult': 1.0561212902508372, 'sideways_tsl_mult': 0.4206060436691175, 'sideways_time_stop': 210, 'sideways_use_sma': False, 'sideways_use_ema': True, 'sideways_use_atr': True, 'sideways_use_adx': True, 'sideways_use_spike': False, 'sideways_rsi_required': True}.
[I 2025-08-30 19:58:20,615] Trial 779 finished with values: [-1000000000.0, 1000000000.0] and parameters: {'p_sma': 18, 'p_std': 22, 'p_atr': 16, 'p_adx': 21, 'rsi_period': 56, 'ema1': 25, 'ema2': 28, 'slip_atr_k': 0.0926904582969894, 'slip_spread_k': 0.4067063811688633, 'spread_hl_frac': 0.02157551546751546, 'bb_std_mult': 2.5471255226839644, 'rsi_os': 46, 'rsi_ob': 55, 'vol_spike': 0.09614275881020695, 'adx_thresh': 22.123675030132574, 'atr_min_pct': 0.02436930723179619, 'atr_max_pct': 0.09086902506330921, 'tp_mult': 1.5855621194521479, 'tsl_mult': 0.7942340317023127, 'strategy': 'mean_reversion', 'time_stop': 259, 'use_sma': False, 'use_atr': False, 'use_adx': True, 'use_ema': True, 'use_spike': False, 'rsi_required': False, 'edge_k': 1.9753797977382146, 'edge_cap': 0.9991312494840028, 'bull_strategy': 'mean_reversion', 'bull_bb_std_mult': 3.188587679206595, 'bull_rsi_os': 34, 'bull_rsi_ob': 49, 'bull_adx_thresh': 29.01533110459746, 'bull_atr_min_pct': 0.014035604291394298, 'bull_atr_max_pct': 0.1162763351340485, 'bull_tp_mult': 2.571074528692907, 'bull_tsl_mult': 0.48107050390950595, 'bull_time_stop': 187, 'bull_use_sma': True, 'bull_use_ema': False, 'bull_use_atr': True, 'bull_use_adx': False, 'bull_use_spike': True, 'bull_rsi_required': True, 'bear_strategy': 'mean_reversion', 'bear_bb_std_mult': 2.7542369436179515, 'bear_rsi_os': 50, 'bear_rsi_ob': 77, 'bear_adx_thresh': 18.597211981779804, 'bear_atr_min_pct': 0.02003067209556065, 'bear_atr_max_pct': 0.1386359874721042, 'bear_tp_mult': 2.715521729133699, 'bear_tsl_mult': 0.17262572648647434, 'bear_time_stop': 204, 'bear_use_sma': True, 'bear_use_ema': True, 'bear_use_atr': True, 'bear_use_adx': False, 'bear_use_spike': True, 'bear_rsi_required': True, 'sideways_strategy': 'mean_reversion', 'sideways_bb_std_mult': 3.0709000954199728, 'sideways_rsi_os': 17, 'sideways_rsi_ob': 59, 'sideways_adx_thresh': 18.552201249344485, 'sideways_atr_min_pct': 0.0017900760014222044, 'sideways_atr_max_pct': 0.05781408788020017, 'sideways_tp_mult': 2.5245890678713256, 'sideways_tsl_mult': 0.9667077761580485, 'sideways_time_stop': 207, 'sideways_use_sma': True, 'sideways_use_ema': True, 'sideways_use_atr': True, 'sideways_use_adx': True, 'sideways_use_spike': False, 'sideways_rsi_required': True}.
[I 2025-08-30 19:58:20,973] Trial 781 finished with values: [-1000000000.0, 1000000000.0] and parameters: {'p_sma': 5, 'p_std': 20, 'p_atr': 15, 'p_adx': 21, 'rsi_period': 20, 'ema1': 25, 'ema2': 33, 'slip_atr_k': 0.09372326792188033, 'slip_spread_k': 0.11339272681918011, 'spread_hl_frac': 0.038287502183501874, 'bb_std_mult': 2.548317224968859, 'rsi_os': 48, 'rsi_ob': 76, 'vol_spike': 0.2257302998217731, 'adx_thresh': 27.01185456186319, 'atr_min_pct': 0.02416716154769518, 'atr_max_pct': 0.09704174883179618, 'tp_mult': 2.32359893352617, 'tsl_mult': 0.8606953022441499, 'strategy': 'mean_reversion', 'time_stop': 185, 'use_sma': True, 'use_atr': False, 'use_adx': False, 'use_ema': True, 'use_spike': False, 'rsi_required': False, 'edge_k': 0.14740779433037887, 'edge_cap': 0.266866021614431, 'bull_strategy': 'mean_reversion', 'bull_bb_std_mult': 1.3146472240533118, 'bull_rsi_os': 38, 'bull_rsi_ob': 90, 'bull_adx_thresh': 18.65612178499761, 'bull_atr_min_pct': 0.0140155166300725, 'bull_atr_max_pct': 0.11704884883903532, 'bull_tp_mult': 2.548962900373959, 'bull_tsl_mult': 0.4959094242125699, 'bull_time_stop': 126, 'bull_use_sma': True, 'bull_use_ema': False, 'bull_use_atr': True, 'bull_use_adx': True, 'bull_use_spike': True, 'bull_rsi_required': True, 'bear_strategy': 'mean_reversion', 'bear_bb_std_mult': 3.597185229775838, 'bear_rsi_os': 50, 'bear_rsi_ob': 77, 'bear_adx_thresh': 11.560903367166702, 'bear_atr_min_pct': 0.01634427138874991, 'bear_atr_max_pct': 0.14069076270783662, 'bear_tp_mult': 2.7106198096766785, 'bear_tsl_mult': 0.8253277172710022, 'bear_time_stop': 102, 'bear_use_sma': True, 'bear_use_ema': False, 'bear_use_atr': False, 'bear_use_adx': False, 'bear_use_spike': True, 'bear_rsi_required': True, 'sideways_strategy': 'mean_reversion', 'sideways_bb_std_mult': 3.090369432589769, 'sideways_rsi_os': 36, 'sideways_rsi_ob': 61, 'sideways_adx_thresh': 21.53118677644207, 'sideways_atr_min_pct': 0.02428902210388844, 'sideways_atr_max_pct': 0.08095129694141359, 'sideways_tp_mult': 1.1171811993809855, 'sideways_tsl_mult': 0.9664124101067091, 'sideways_time_stop': 209, 'sideways_use_sma': True, 'sideways_use_ema': True, 'sideways_use_atr': False, 'sideways_use_adx': True, 'sideways_use_spike': True, 'sideways_rsi_required': True}.
[I 2025-08-30 19:58:21,805] Trial 780 finished with values: [-1000000000.0, 1000000000.0] and parameters: {'p_sma': 5, 'p_std': 18, 'p_atr': 15, 'p_adx': 10, 'rsi_period': 27, 'ema1': 25, 'ema2': 33, 'slip_atr_k': 0.0729156884578755, 'slip_spread_k': 0.9809268451150279, 'spread_hl_frac': 0.025296300728122348, 'bb_std_mult': 2.2366752350735206, 'rsi_os': 48, 'rsi_ob': 94, 'vol_spike': 0.13375618699128028, 'adx_thresh': 33.514357513809124, 'atr_min_pct': 0.023918109603989875, 'atr_max_pct': 0.09222350882150086, 'tp_mult': 2.4810297363952665, 'tsl_mult': 0.8557055002418205, 'strategy': 'mean_reversion', 'time_stop': 264, 'use_sma': False, 'use_atr': False, 'use_adx': True, 'use_ema': True, 'use_spike': False, 'rsi_required': False, 'edge_k': 0.1354936937355021, 'edge_cap': 0.5117697088307837, 'bull_strategy': 'mean_reversion', 'bull_bb_std_mult': 3.1778634667388257, 'bull_rsi_os': 41, 'bull_rsi_ob': 49, 'bull_adx_thresh': 26.5183908825189, 'bull_atr_min_pct': 0.0029848794049195364, 'bull_atr_max_pct': 0.13915784409682283, 'bull_tp_mult': 2.697183046265083, 'bull_tsl_mult': 0.4726085471938676, 'bull_time_stop': 128, 'bull_use_sma': True, 'bull_use_ema': False, 'bull_use_atr': True, 'bull_use_adx': False, 'bull_use_spike': True, 'bull_rsi_required': True, 'bear_strategy': 'mean_reversion', 'bear_bb_std_mult': 2.858139663752761, 'bear_rsi_os': 25, 'bear_rsi_ob': 59, 'bear_adx_thresh': 17.436047640824963, 'bear_atr_min_pct': 0.00448288407248577, 'bear_atr_max_pct': 0.05351260581095501, 'bear_tp_mult': 2.7189745632988354, 'bear_tsl_mult': 0.7418897544846669, 'bear_time_stop': 106, 'bear_use_sma': True, 'bear_use_ema': True, 'bear_use_atr': False, 'bear_use_adx': False, 'bear_use_spike': True, 'bear_rsi_required': True, 'sideways_strategy': 'mean_reversion', 'sideways_bb_std_mult': 3.112330052001985, 'sideways_rsi_os': 21, 'sideways_rsi_ob': 59, 'sideways_adx_thresh': 24.85528326926012, 'sideways_atr_min_pct': 0.001598625459554047, 'sideways_atr_max_pct': 0.0813170950372416, 'sideways_tp_mult': 2.1237900600027166, 'sideways_tsl_mult': 0.9678135681321761, 'sideways_time_stop': 205, 'sideways_use_sma': True, 'sideways_use_ema': True, 'sideways_use_atr': False, 'sideways_use_adx': True, 'sideways_use_spike': True, 'sideways_rsi_required': True}.
[I 2025-08-30 19:58:22,517] Trial 782 finished with values: [-1000000000.0, 1000000000.0] and parameters: {'p_sma': 18, 'p_std': 24, 'p_atr': 22, 'p_adx': 19, 'rsi_period': 20, 'ema1': 10, 'ema2': 33, 'slip_atr_k': 0.1484774157552885, 'slip_spread_k': 0.8894190673457564, 'spread_hl_frac': 0.0162028276079083, 'bb_std_mult': 2.014828969731343, 'rsi_os': 33, 'rsi_ob': 49, 'vol_spike': 0.24758973052995087, 'adx_thresh': 27.115958249720705, 'atr_min_pct': 0.024407732025209128, 'atr_max_pct': 0.06706057536092086, 'tp_mult': 2.205691099121614, 'tsl_mult': 0.8609531603543764, 'strategy': 'breakout', 'time_stop': 206, 'use_sma': True, 'use_atr': False, 'use_adx': False, 'use_ema': True, 'use_spike': False, 'rsi_required': True, 'edge_k': 1.3247377293015212, 'edge_cap': 0.5118798989765846, 'bull_strategy': 'mean_reversion', 'bull_bb_std_mult': 1.3146075735030953, 'bull_rsi_os': 22, 'bull_rsi_ob': 49, 'bull_adx_thresh': 25.977788658906057, 'bull_atr_min_pct': 0.0029673510339284755, 'bull_atr_max_pct': 0.02376885666244341, 'bull_tp_mult': 2.6981550138419226, 'bull_tsl_mult': 0.8837052916677599, 'bull_time_stop': 259, 'bull_use_sma': True, 'bull_use_ema': False, 'bull_use_atr': True, 'bull_use_adx': True, 'bull_use_spike': True, 'bull_rsi_required': True, 'bear_strategy': 'mean_reversion', 'bear_bb_std_mult': 3.0471293607397487, 'bear_rsi_os': 9, 'bear_rsi_ob': 77, 'bear_adx_thresh': 11.946939820145781, 'bear_atr_min_pct': 0.012623040543128468, 'bear_atr_max_pct': 0.05256251213658221, 'bear_tp_mult': 2.693960231994468, 'bear_tsl_mult': 0.8260242347578853, 'bear_time_stop': 103, 'bear_use_sma': False, 'bear_use_ema': False, 'bear_use_atr': False, 'bear_use_adx': True, 'bear_use_spike': True, 'bear_rsi_required': True, 'sideways_strategy': 'mean_reversion', 'sideways_bb_std_mult': 2.6543905459777553, 'sideways_rsi_os': 17, 'sideways_rsi_ob': 85, 'sideways_adx_thresh': 21.448936676349394, 'sideways_atr_min_pct': 0.00857005930729572, 'sideways_atr_max_pct': 0.10295359035005767, 'sideways_tp_mult': 2.116683666934233, 'sideways_tsl_mult': 0.9680980967400697, 'sideways_time_stop': 166, 'sideways_use_sma': True, 'sideways_use_ema': True, 'sideways_use_atr': False, 'sideways_use_adx': True, 'sideways_use_spike': True, 'sideways_rsi_required': True}.
