[I 2025-08-30 19:27:58,944] Trial 513 finished with values: [-1000000000.0, 1000000000.0] and parameters: {'p_sma': 5, 'p_std': 32, 'p_atr': 9, 'p_adx': 8, 'rsi_period': 25, 'ema1': 11, 'ema2': 38, 'slip_atr_k': 0.20901051949560523, 'slip_spread_k': 0.11829886977093187, 'spread_hl_frac': 0.016539068641438802, 'bb_std_mult': 1.3847909445410882, 'rsi_os': 24, 'rsi_ob': 58, 'vol_spike': 0.2632688957688319, 'adx_thresh': 33.26265345797544, 'atr_min_pct': 0.0235159818798075, 'atr_max_pct': 0.09667331889814217, 'tp_mult': 2.2218690946984965, 'tsl_mult': 0.8598630704246369, 'strategy': 'mean_reversion', 'time_stop': 279, 'use_sma': False, 'use_atr': True, 'use_adx': True, 'use_ema': False, 'use_spike': True, 'rsi_required': False, 'edge_k': 0.18092566445235683, 'edge_cap': 0.5104633748286573, 'bull_strategy': 'mean_reversion', 'bull_bb_std_mult': 0.639708155380116, 'bull_rsi_os': 35, 'bull_rsi_ob': 91, 'bull_adx_thresh': 30.49635108426703, 'bull_atr_min_pct': 0.0018361826534989793, 'bull_atr_max_pct': 0.07209796557308805, 'bull_tp_mult': 2.800169672562381, 'bull_tsl_mult': 0.4807018065283105, 'bull_time_stop': 119, 'bull_use_sma': False, 'bull_use_ema': True, 'bull_use_atr': True, 'bull_use_adx': False, 'bull_use_spike': False, 'bull_rsi_required': True, 'bear_strategy': 'breakout', 'bear_bb_std_mult': 2.802755217410629, 'bear_rsi_os': 53, 'bear_rsi_ob': 75, 'bear_adx_thresh': 19.83430092518307, 'bear_atr_min_pct': 0.01494239351883988, 'bear_atr_max_pct': 0.04767606631040014, 'bear_tp_mult': 2.677084912406261, 'bear_tsl_mult': 0.7845526087310281, 'bear_time_stop': 195, 'bear_use_sma': True, 'bear_use_ema': True, 'bear_use_atr': False, 'bear_use_adx': False, 'bear_use_spike': False, 'bear_rsi_required': True, 'sideways_strategy': 'breakout', 'sideways_bb_std_mult': 3.041156703807769, 'sideways_rsi_os': 36, 'sideways_rsi_ob': 62, 'sideways_adx_thresh': 20.715713803864833, 'sideways_atr_min_pct': 0.028191571357602606, 'sideways_atr_max_pct': 0.14778698949130153, 'sideways_tp_mult': 1.1375685445613555, 'sideways_tsl_mult': 0.4694989551540805, 'sideways_time_stop': 152, 'sideways_use_sma': False, 'sideways_use_ema': True, 'sideways_use_atr': True, 'sideways_use_adx': False, 'sideways_use_spike': False, 'sideways_rsi_required': True}.
[I 2025-08-30 19:27:58,955] Trial 515 finished with values: [-1000000000.0, 1000000000.0] and parameters: {'p_sma': 5, 'p_std': 29, 'p_atr': 9, 'p_adx': 22, 'rsi_period': 26, 'ema1': 25, 'ema2': 32, 'slip_atr_k': 0.06699238655461512, 'slip_spread_k': 0.11778674953874285, 'spread_hl_frac': 0.02701665916512551, 'bb_std_mult': 2.1403159759015495, 'rsi_os': 48, 'rsi_ob': 83, 'vol_spike': 0.28574966227231935, 'adx_thresh': 33.275092848639666, 'atr_min_pct': 0.017348447605601416, 'atr_max_pct': 0.09707837980541863, 'tp_mult': 2.209450454861847, 'tsl_mult': 0.5642500528371741, 'strategy': 'breakout', 'time_stop': 178, 'use_sma': False, 'use_atr': True, 'use_adx': True, 'use_ema': False, 'use_spike': False, 'rsi_required': False, 'edge_k': 1.3137678276136924, 'edge_cap': 0.5385771650105171, 'bull_strategy': 'breakout', 'bull_bb_std_mult': 1.0938395249587594, 'bull_rsi_os': 34, 'bull_rsi_ob': 45, 'bull_adx_thresh': 16.201767806902712, 'bull_atr_min_pct': 0.0016931774487400437, 'bull_atr_max_pct': 0.03900862295765523, 'bull_tp_mult': 2.806398940621985, 'bull_tsl_mult': 0.5288043406151246, 'bull_time_stop': 160, 'bull_use_sma': True, 'bull_use_ema': True, 'bull_use_atr': True, 'bull_use_adx': False, 'bull_use_spike': False, 'bull_rsi_required': True, 'bear_strategy': 'breakout', 'bear_bb_std_mult': 1.19359121297504, 'bear_rsi_os': 11, 'bear_rsi_ob': 52, 'bear_adx_thresh': 15.487296280522507, 'bear_atr_min_pct': 0.004013240597001068, 'bear_atr_max_pct': 0.04877903786425857, 'bear_tp_mult': 2.2863623796737635, 'bear_tsl_mult': 0.6700446013838729, 'bear_time_stop': 126, 'bear_use_sma': True, 'bear_use_ema': True, 'bear_use_atr': False, 'bear_use_adx': True, 'bear_use_spike': False, 'bear_rsi_required': True, 'sideways_strategy': 'breakout', 'sideways_bb_std_mult': 3.0152050220562843, 'sideways_rsi_os': 36, 'sideways_rsi_ob': 69, 'sideways_adx_thresh': 11.483226868449156, 'sideways_atr_min_pct': 0.0025314296865806846, 'sideways_atr_max_pct': 0.02013898770834479, 'sideways_tp_mult': 1.7399288619584854, 'sideways_tsl_mult': 0.9969599466433572, 'sideways_time_stop': 152, 'sideways_use_sma': False, 'sideways_use_ema': False, 'sideways_use_atr': True, 'sideways_use_adx': False, 'sideways_use_spike': False, 'sideways_rsi_required': True}.
[I 2025-08-30 19:27:59,148] Trial 514 finished with values: [-1000000000.0, 1000000000.0] and parameters: {'p_sma': 7, 'p_std': 30, 'p_atr': 9, 'p_adx': 21, 'rsi_period': 81, 'ema1': 26, 'ema2': 59, 'slip_atr_k': 0.11193407464013125, 'slip_spread_k': 0.11087738548923903, 'spread_hl_frac': 0.026812313302274342, 'bb_std_mult': 2.144927577222128, 'rsi_os': 39, 'rsi_ob': 81, 'vol_spike': 0.27955057680253803, 'adx_thresh': 33.86198978314107, 'atr_min_pct': 0.006145495899910701, 'atr_max_pct': 0.09763335603378817, 'tp_mult': 1.389244175197569, 'tsl_mult': 0.8712757747165696, 'strategy': 'mean_reversion', 'time_stop': 130, 'use_sma': False, 'use_atr': True, 'use_adx': True, 'use_ema': False, 'use_spike': True, 'rsi_required': False, 'edge_k': 1.2518774358509361, 'edge_cap': 0.5151800452819505, 'bull_strategy': 'mean_reversion', 'bull_bb_std_mult': 3.1453402469007226, 'bull_rsi_os': 11, 'bull_rsi_ob': 92, 'bull_adx_thresh': 5.061625160386166, 'bull_atr_min_pct': 0.0018202587303989143, 'bull_atr_max_pct': 0.07295591810029188, 'bull_tp_mult': 1.3162368104631652, 'bull_tsl_mult': 0.5364518625150994, 'bull_time_stop': 185, 'bull_use_sma': False, 'bull_use_ema': True, 'bull_use_atr': True, 'bull_use_adx': False, 'bull_use_spike': False, 'bull_rsi_required': True, 'bear_strategy': 'mean_reversion', 'bear_bb_std_mult': 1.2098153340798254, 'bear_rsi_os': 53, 'bear_rsi_ob': 52, 'bear_adx_thresh': 19.953853724075376, 'bear_atr_min_pct': 0.014858879568391577, 'bear_atr_max_pct': 0.11655536442198128, 'bear_tp_mult': 1.1562112012646621, 'bear_tsl_mult': 0.3489928686658834, 'bear_time_stop': 194, 'bear_use_sma': False, 'bear_use_ema': True, 'bear_use_atr': False, 'bear_use_adx': False, 'bear_use_spike': False, 'bear_rsi_required': True, 'sideways_strategy': 'breakout', 'sideways_bb_std_mult': 3.0327177749866188, 'sideways_rsi_os': 39, 'sideways_rsi_ob': 70, 'sideways_adx_thresh': 20.541811724014494, 'sideways_atr_min_pct': 0.005217430660545858, 'sideways_atr_max_pct': 0.07487043553743798, 'sideways_tp_mult': 1.6551899703549413, 'sideways_tsl_mult': 0.07959254463108112, 'sideways_time_stop': 152, 'sideways_use_sma': False, 'sideways_use_ema': True, 'sideways_use_atr': True, 'sideways_use_adx': False, 'sideways_use_spike': False, 'sideways_rsi_required': True}.
[I 2025-08-30 19:27:59,382] Trial 516 finished with values: [-1000000000.0, 1000000000.0] and parameters: {'p_sma': 9, 'p_std': 28, 'p_atr': 8, 'p_adx': 8, 'rsi_period': 81, 'ema1': 26, 'ema2': 33, 'slip_atr_k': 0.031004351698182067, 'slip_spread_k': 0.1640317868863217, 'spread_hl_frac': 0.016848188983978798, 'bb_std_mult': 2.8265125448795985, 'rsi_os': 48, 'rsi_ob': 80, 'vol_spike': 0.03546129376940679, 'adx_thresh': 33.438353171124646, 'atr_min_pct': 0.0032888096016484326, 'atr_max_pct': 0.0959140632458844, 'tp_mult': 2.1969649240445728, 'tsl_mult': 0.20490450462169152, 'strategy': 'breakout', 'time_stop': 177, 'use_sma': False, 'use_atr': True, 'use_adx': True, 'use_ema': False, 'use_spike': False, 'rsi_required': False, 'edge_k': 0.11150580659604159, 'edge_cap': 0.48412771641399965, 'bull_strategy': 'breakout', 'bull_bb_std_mult': 3.1372791971592817, 'bull_rsi_os': 21, 'bull_rsi_ob': 45, 'bull_adx_thresh': 5.539848233926843, 'bull_atr_min_pct': 0.02920545541074581, 'bull_atr_max_pct': 0.12249214789654207, 'bull_tp_mult': 1.011223606673843, 'bull_tsl_mult': 0.5343735500827984, 'bull_time_stop': 282, 'bull_use_sma': True, 'bull_use_ema': True, 'bull_use_atr': True, 'bull_use_adx': True, 'bull_use_spike': False, 'bull_rsi_required': True, 'bear_strategy': 'breakout', 'bear_bb_std_mult': 2.806321075268746, 'bear_rsi_os': 38, 'bear_rsi_ob': 78, 'bear_adx_thresh': 15.60270979414187, 'bear_atr_min_pct': 0.008185634198025645, 'bear_atr_max_pct': 0.1363257348759147, 'bear_tp_mult': 1.1532828319259327, 'bear_tsl_mult': 0.3417468698971764, 'bear_time_stop': 202, 'bear_use_sma': True, 'bear_use_ema': True, 'bear_use_atr': False, 'bear_use_adx': True, 'bear_use_spike': False, 'bear_rsi_required': True, 'sideways_strategy': 'breakout', 'sideways_bb_std_mult': 3.1551392063663504, 'sideways_rsi_os': 36, 'sideways_rsi_ob': 58, 'sideways_adx_thresh': 26.385765534025666, 'sideways_atr_min_pct': 0.01953666114415006, 'sideways_atr_max_pct': 0.14534452794902425, 'sideways_tp_mult': 1.8341313933542767, 'sideways_tsl_mult': 0.9998695924884615, 'sideways_time_stop': 208, 'sideways_use_sma': False, 'sideways_use_ema': False, 'sideways_use_atr': True, 'sideways_use_adx': False, 'sideways_use_spike': False, 'sideways_rsi_required': True}.
[I 2025-08-30 19:28:00,299] Trial 520 finished with values: [-1000000000.0, 1000000000.0] and parameters: {'p_sma': 21, 'p_std': 31, 'p_atr': 30, 'p_adx': 28, 'rsi_period': 52, 'ema1': 27, 'ema2': 16, 'slip_atr_k': 0.12055645901386973, 'slip_spread_k': 0.19115719012334415, 'spread_hl_frac': 0.025763124757987057, 'bb_std_mult': 3.5531174222675794, 'rsi_os': 51, 'rsi_ob': 85, 'vol_spike': 0.16836133727855013, 'adx_thresh': 16.365486416321048, 'atr_min_pct': 0.02434751067536961, 'atr_max_pct': 0.12505682506653337, 'tp_mult': 2.2994233089639846, 'tsl_mult': 0.9604642774325116, 'strategy': 'mean_reversion', 'time_stop': 150, 'use_sma': True, 'use_atr': False, 'use_adx': True, 'use_ema': False, 'use_spike': True, 'rsi_required': True, 'edge_k': 0.12069729587479915, 'edge_cap': 0.5790998612437399, 'bull_strategy': 'mean_reversion', 'bull_bb_std_mult': 2.277605055490042, 'bull_rsi_os': 38, 'bull_rsi_ob': 48, 'bull_adx_thresh': 16.925071211708833, 'bull_atr_min_pct': 0.019077766383098677, 'bull_atr_max_pct': 0.11738049436401635, 'bull_tp_mult': 1.5267135957016704, 'bull_tsl_mult': 0.5569203265742482, 'bull_time_stop': 174, 'bull_use_sma': False, 'bull_use_ema': False, 'bull_use_atr': True, 'bull_use_adx': True, 'bull_use_spike': False, 'bull_rsi_required': False, 'bear_strategy': 'breakout', 'bear_bb_std_mult': 2.356954228742003, 'bear_rsi_os': 52, 'bear_rsi_ob': 78, 'bear_adx_thresh': 17.688543666048915, 'bear_atr_min_pct': 0.0005316708683299771, 'bear_atr_max_pct': 0.037750707743726665, 'bear_tp_mult': 2.7770982429023596, 'bear_tsl_mult': 0.8080807032466305, 'bear_time_stop': 209, 'bear_use_sma': True, 'bear_use_ema': False, 'bear_use_atr': True, 'bear_use_adx': False, 'bear_use_spike': False, 'bear_rsi_required': True, 'sideways_strategy': 'mean_reversion', 'sideways_bb_std_mult': 1.6636395750680348, 'sideways_rsi_os': 49, 'sideways_rsi_ob': 58, 'sideways_adx_thresh': 19.701709657328465, 'sideways_atr_min_pct': 0.023841625167301178, 'sideways_atr_max_pct': 0.06367041257885314, 'sideways_tp_mult': 1.1212580925372118, 'sideways_tsl_mult': 0.9048940330701954, 'sideways_time_stop': 287, 'sideways_use_sma': False, 'sideways_use_ema': True, 'sideways_use_atr': True, 'sideways_use_adx': False, 'sideways_use_spike': True, 'sideways_rsi_required': True}.
[I 2025-08-30 19:28:00,341] Trial 517 finished with values: [-1000000000.0, 1000000000.0] and parameters: {'p_sma': 9, 'p_std': 54, 'p_atr': 8, 'p_adx': 28, 'rsi_period': 84, 'ema1': 10, 'ema2': 48, 'slip_atr_k': 0.11128764853220904, 'slip_spread_k': 0.16415652509423626, 'spread_hl_frac': 0.025180630772895382, 'bb_std_mult': 2.0524364981296737, 'rsi_os': 51, 'rsi_ob': 80, 'vol_spike': 0.2636830497878272, 'adx_thresh': 13.431406711849984, 'atr_min_pct': 0.015280672067371442, 'atr_max_pct': 0.09291891857047371, 'tp_mult': 1.3974311015937149, 'tsl_mult': 0.8417740674613149, 'strategy': 'mean_reversion', 'time_stop': 127, 'use_sma': True, 'use_atr': True, 'use_adx': True, 'use_ema': False, 'use_spike': False, 'rsi_required': True, 'edge_k': 0.42356046120388735, 'edge_cap': 0.882788569033157, 'bull_strategy': 'breakout', 'bull_bb_std_mult': 1.607454826782106, 'bull_rsi_os': 31, 'bull_rsi_ob': 48, 'bull_adx_thresh': 32.25195829071943, 'bull_atr_min_pct': 0.0022771743948253338, 'bull_atr_max_pct': 0.12226405672122335, 'bull_tp_mult': 1.543942082916313, 'bull_tsl_mult': 0.5248822165158271, 'bull_time_stop': 183, 'bull_use_sma': False, 'bull_use_ema': True, 'bull_use_atr': True, 'bull_use_adx': True, 'bull_use_spike': False, 'bull_rsi_required': True, 'bear_strategy': 'mean_reversion', 'bear_bb_std_mult': 1.0896150092846475, 'bear_rsi_os': 52, 'bear_rsi_ob': 78, 'bear_adx_thresh': 17.49927911865839, 'bear_atr_min_pct': 0.027522308422618096, 'bear_atr_max_pct': 0.1369305064254047, 'bear_tp_mult': 2.767964358390918, 'bear_tsl_mult': 0.8137546535923503, 'bear_time_stop': 58, 'bear_use_sma': False, 'bear_use_ema': False, 'bear_use_atr': False, 'bear_use_adx': False, 'bear_use_spike': False, 'bear_rsi_required': True, 'sideways_strategy': 'mean_reversion', 'sideways_bb_std_mult': 3.140373328095234, 'sideways_rsi_os': 39, 'sideways_rsi_ob': 87, 'sideways_adx_thresh': 26.6279493081849, 'sideways_atr_min_pct': 0.005203019712398751, 'sideways_atr_max_pct': 0.1442402147728902, 'sideways_tp_mult': 1.1117188919142134, 'sideways_tsl_mult': 0.5316444474839345, 'sideways_time_stop': 163, 'sideways_use_sma': False, 'sideways_use_ema': True, 'sideways_use_atr': True, 'sideways_use_adx': False, 'sideways_use_spike': False, 'sideways_rsi_required': True}.
[I 2025-08-30 19:28:31,439] Trial 519 finished with values: [-0.035570193635079295, 0.03547945780485655] and parameters: {'p_sma': 9, 'p_std': 53, 'p_atr': 30, 'p_adx': 18, 'rsi_period': 50, 'ema1': 26, 'ema2': 48, 'slip_atr_k': 0.08989096062028867, 'slip_spread_k': 0.16548074292545178, 'spread_hl_frac': 0.025618480108357555, 'bb_std_mult': 1.0330108245648342, 'rsi_os': 48, 'rsi_ob': 84, 'vol_spike': 0.27021219676936853, 'adx_thresh': 34.376076119239045, 'atr_min_pct': 0.024366095996361012, 'atr_max_pct': 0.08492502557727673, 'tp_mult': 2.3105761320545444, 'tsl_mult': 0.8373423683179844, 'strategy': 'breakout', 'time_stop': 59, 'use_sma': True, 'use_atr': True, 'use_adx': True, 'use_ema': False, 'use_spike': False, 'rsi_required': True, 'edge_k': 1.8066468747930728, 'edge_cap': 0.48457956227293514, 'bull_strategy': 'breakout', 'bull_bb_std_mult': 3.087096430801701, 'bull_rsi_os': 31, 'bull_rsi_ob': 48, 'bull_adx_thresh': 23.993347997116395, 'bull_atr_min_pct': 0.01423916942418159, 'bull_atr_max_pct': 0.12256963424415346, 'bull_tp_mult': 2.0534384757697017, 'bull_tsl_mult': 0.5511656862569614, 'bull_time_stop': 175, 'bull_use_sma': True, 'bull_use_ema': True, 'bull_use_atr': True, 'bull_use_adx': True, 'bull_use_spike': False, 'bull_rsi_required': False, 'bear_strategy': 'breakout', 'bear_bb_std_mult': 2.872748766997561, 'bear_rsi_os': 43, 'bear_rsi_ob': 78, 'bear_adx_thresh': 32.38318742745567, 'bear_atr_min_pct': 0.0006016675704579762, 'bear_atr_max_pct': 0.024479685471747732, 'bear_tp_mult': 2.7644355640059013, 'bear_tsl_mult': 0.8658081796465614, 'bear_time_stop': 206, 'bear_use_sma': True, 'bear_use_ema': False, 'bear_use_atr': True, 'bear_use_adx': True, 'bear_use_spike': False, 'bear_rsi_required': True, 'sideways_strategy': 'mean_reversion', 'sideways_bb_std_mult': 3.1533944699637466, 'sideways_rsi_os': 35, 'sideways_rsi_ob': 58, 'sideways_adx_thresh': 21.548676432135657, 'sideways_atr_min_pct': 0.0008671284747429142, 'sideways_atr_max_pct': 0.14507658397506568, 'sideways_tp_mult': 1.0107083164591124, 'sideways_tsl_mult': 0.9042615488586784, 'sideways_time_stop': 165, 'sideways_use_sma': False, 'sideways_use_ema': False, 'sideways_use_atr': True, 'sideways_use_adx': False, 'sideways_use_spike': True, 'sideways_rsi_required': True}.
[I 2025-08-30 19:28:31,707] Trial 518 finished with values: [-1000000000.0, 1000000000.0] and parameters: {'p_sma': 8, 'p_std': 22, 'p_atr': 8, 'p_adx': 21, 'rsi_period': 81, 'ema1': 10, 'ema2': 33, 'slip_atr_k': 0.1475165228618907, 'slip_spread_k': 0.16542799204936098, 'spread_hl_frac': 0.03363468418745224, 'bb_std_mult': 2.0673618183186253, 'rsi_os': 16, 'rsi_ob': 56, 'vol_spike': 0.17017102778873375, 'adx_thresh': 33.9580114467776, 'atr_min_pct': 0.0242638213015925, 'atr_max_pct': 0.08556351361759104, 'tp_mult': 1.3955569339855463, 'tsl_mult': 0.8357723961585114, 'strategy': 'mean_reversion', 'time_stop': 126, 'use_sma': True, 'use_atr': True, 'use_adx': True, 'use_ema': False, 'use_spike': False, 'rsi_required': True, 'edge_k': 0.7862522199925914, 'edge_cap': 0.3365306747244853, 'bull_strategy': 'breakout', 'bull_bb_std_mult': 3.1102812723824504, 'bull_rsi_os': 31, 'bull_rsi_ob': 47, 'bull_adx_thresh': 20.644620390633442, 'bull_atr_min_pct': 0.014582018208347449, 'bull_atr_max_pct': 0.12195493386828693, 'bull_tp_mult': 2.060407301480119, 'bull_tsl_mult': 0.5332732573418546, 'bull_time_stop': 184, 'bull_use_sma': False, 'bull_use_ema': True, 'bull_use_atr': True, 'bull_use_adx': True, 'bull_use_spike': False, 'bull_rsi_required': True, 'bear_strategy': 'mean_reversion', 'bear_bb_std_mult': 1.0838368783858823, 'bear_rsi_os': 39, 'bear_rsi_ob': 78, 'bear_adx_thresh': 16.855217539108487, 'bear_atr_min_pct': 0.013315744165956099, 'bear_atr_max_pct': 0.11802804162119415, 'bear_tp_mult': 1.1432747108945556, 'bear_tsl_mult': 0.348387775576387, 'bear_time_stop': 52, 'bear_use_sma': False, 'bear_use_ema': False, 'bear_use_atr': False, 'bear_use_adx': False, 'bear_use_spike': False, 'bear_rsi_required': True, 'sideways_strategy': 'mean_reversion', 'sideways_bb_std_mult': 3.1400073847486856, 'sideways_rsi_os': 26, 'sideways_rsi_ob': 58, 'sideways_adx_thresh': 24.968687402081795, 'sideways_atr_min_pct': 0.004475221824924122, 'sideways_atr_max_pct': 0.14411381298350504, 'sideways_tp_mult': 1.1774191070981077, 'sideways_tsl_mult': 0.5359514226631605, 'sideways_time_stop': 163, 'sideways_use_sma': False, 'sideways_use_ema': True, 'sideways_use_atr': True, 'sideways_use_adx': False, 'sideways_use_spike': False, 'sideways_rsi_required': True}.
[I 2025-08-30 19:28:34,759] Trial 521 finished with values: [-1000000000.0, 1000000000.0] and parameters: {'p_sma': 52, 'p_std': 12, 'p_atr': 8, 'p_adx': 18, 'rsi_period': 22, 'ema1': 10, 'ema2': 30, 'slip_atr_k': 0.1324805444246878, 'slip_spread_k': 0.8092938723288189, 'spread_hl_frac': 0.012720833137001697, 'bb_std_mult': 2.05663818333962, 'rsi_os': 27, 'rsi_ob': 79, 'vol_spike': 0.2529078563166552, 'adx_thresh': 26.06812572091485, 'atr_min_pct': 0.023653211750073833, 'atr_max_pct': 0.0517396895672276, 'tp_mult': 2.344316889697409, 'tsl_mult': 0.8397628449394735, 'strategy': 'mean_reversion', 'time_stop': 87, 'use_sma': False, 'use_atr': True, 'use_adx': True, 'use_ema': False, 'use_spike': True, 'rsi_required': True, 'edge_k': 0.16237269115956265, 'edge_cap': 0.8054586062642892, 'bull_strategy': 'mean_reversion', 'bull_bb_std_mult': 0.9761771218768134, 'bull_rsi_os': 13, 'bull_rsi_ob': 49, 'bull_adx_thresh': 24.078077659789823, 'bull_atr_min_pct': 0.02610764704864052, 'bull_atr_max_pct': 0.11958084398029249, 'bull_tp_mult': 1.6171080437373264, 'bull_tsl_mult': 0.5050873100555936, 'bull_time_stop': 250, 'bull_use_sma': False, 'bull_use_ema': True, 'bull_use_atr': True, 'bull_use_adx': False, 'bull_use_spike': False, 'bull_rsi_required': True, 'bear_strategy': 'mean_reversion', 'bear_bb_std_mult': 1.0982190352097785, 'bear_rsi_os': 20, 'bear_rsi_ob': 66, 'bear_adx_thresh': 16.898561474097047, 'bear_atr_min_pct': 0.013729107950441511, 'bear_atr_max_pct': 0.12428256394386916, 'bear_tp_mult': 1.6596432208276672, 'bear_tsl_mult': 0.8655533909956281, 'bear_time_stop': 183, 'bear_use_sma': False, 'bear_use_ema': False, 'bear_use_atr': False, 'bear_use_adx': False, 'bear_use_spike': False, 'bear_rsi_required': True, 'sideways_strategy': 'mean_reversion', 'sideways_bb_std_mult': 1.754221851987196, 'sideways_rsi_os': 26, 'sideways_rsi_ob': 60, 'sideways_adx_thresh': 34.943839059865006, 'sideways_atr_min_pct': 0.004445992750565187, 'sideways_atr_max_pct': 0.14995066708613627, 'sideways_tp_mult': 1.1861375914432992, 'sideways_tsl_mult': 0.9478138400646425, 'sideways_time_stop': 277, 'sideways_use_sma': False, 'sideways_use_ema': True, 'sideways_use_atr': True, 'sideways_use_adx': False, 'sideways_use_spike': False, 'sideways_rsi_required': True}.
