[I 2025-08-30 19:47:46,022] Trial 683 finished with values: [-1000000000.0, 1000000000.0] and parameters: {'p_sma': 7, 'p_std': 29, 'p_atr': 22, 'p_adx': 23, 'rsi_period': 26, 'ema1': 26, 'ema2': 43, 'slip_atr_k': 0.09129828669851196, 'slip_spread_k': 0.5446971110916486, 'spread_hl_frac': 0.020505862845615053, 'bb_std_mult': 2.1942804310883224, 'rsi_os': 5, 'rsi_ob': 72, 'vol_spike': 0.25312721839440394, 'adx_thresh': 32.96257140994012, 'atr_min_pct': 0.027012333219553868, 'atr_max_pct': 0.09127544029560006, 'tp_mult': 2.3230162019401184, 'tsl_mult': 0.13507635038703258, 'strategy': 'mean_reversion', 'time_stop': 181, 'use_sma': False, 'use_atr': True, 'use_adx': True, 'use_ema': False, 'use_spike': True, 'rsi_required': False, 'edge_k': 0.11954936930908279, 'edge_cap': 0.5263296867086729, 'bull_strategy': 'mean_reversion', 'bull_bb_std_mult': 1.5165806875878007, 'bull_rsi_os': 30, 'bull_rsi_ob': 45, 'bull_adx_thresh': 21.015938873701458, 'bull_atr_min_pct': 0.0004116497315908489, 'bull_atr_max_pct': 0.11542246364463496, 'bull_tp_mult': 1.097202755168921, 'bull_tsl_mult': 0.9046384735411517, 'bull_time_stop': 178, 'bull_use_sma': False, 'bull_use_ema': True, 'bull_use_atr': False, 'bull_use_adx': True, 'bull_use_spike': False, 'bull_rsi_required': True, 'bear_strategy': 'breakout', 'bear_bb_std_mult': 2.135871378615261, 'bear_rsi_os': 49, 'bear_rsi_ob': 78, 'bear_adx_thresh': 13.96984546489188, 'bear_atr_min_pct': 0.0165467823293162, 'bear_atr_max_pct': 0.030595231974305033, 'bear_tp_mult': 2.5512684360263678, 'bear_tsl_mult': 0.7277986157114169, 'bear_time_stop': 105, 'bear_use_sma': True, 'bear_use_ema': True, 'bear_use_atr': False, 'bear_use_adx': False, 'bear_use_spike': False, 'bear_rsi_required': True, 'sideways_strategy': 'breakout', 'sideways_bb_std_mult': 3.212829978405279, 'sideways_rsi_os': 34, 'sideways_rsi_ob': 59, 'sideways_adx_thresh': 8.58497736052367, 'sideways_atr_min_pct': 0.007248693478088793, 'sideways_atr_max_pct': 0.14439137025051857, 'sideways_tp_mult': 1.1232592863331807, 'sideways_tsl_mult': 0.9597841012388734, 'sideways_time_stop': 177, 'sideways_use_sma': False, 'sideways_use_ema': True, 'sideways_use_atr': True, 'sideways_use_adx': True, 'sideways_use_spike': False, 'sideways_rsi_required': False}.
[I 2025-08-30 19:47:47,477] Trial 685 finished with values: [-0.023243208164499762, 0.023186142100903723] and parameters: {'p_sma': 5, 'p_std': 39, 'p_atr': 8, 'p_adx': 23, 'rsi_period': 26, 'ema1': 15, 'ema2': 35, 'slip_atr_k': 0.07144000961172323, 'slip_spread_k': 0.48172810224408275, 'spread_hl_frac': 0.020375144415186924, 'bb_std_mult': 2.2077949010423548, 'rsi_os': 47, 'rsi_ob': 95, 'vol_spike': 0.253208559930729, 'adx_thresh': 7.698306305126481, 'atr_min_pct': 0.025787084027524533, 'atr_max_pct': 0.10199190737266989, 'tp_mult': 2.3141477245847453, 'tsl_mult': 0.8282567125536947, 'strategy': 'mean_reversion', 'time_stop': 179, 'use_sma': False, 'use_atr': False, 'use_adx': False, 'use_ema': True, 'use_spike': False, 'rsi_required': True, 'edge_k': 0.08261220950423914, 'edge_cap': 0.5301564934824972, 'bull_strategy': 'mean_reversion', 'bull_bb_std_mult': 1.646635632085637, 'bull_rsi_os': 31, 'bull_rsi_ob': 76, 'bull_adx_thresh': 28.04564353097824, 'bull_atr_min_pct': 0.0030617958615184707, 'bull_atr_max_pct': 0.1478467208949682, 'bull_tp_mult': 2.6397457604377577, 'bull_tsl_mult': 0.257969075405443, 'bull_time_stop': 179, 'bull_use_sma': False, 'bull_use_ema': True, 'bull_use_atr': False, 'bull_use_adx': False, 'bull_use_spike': False, 'bull_rsi_required': True, 'bear_strategy': 'breakout', 'bear_bb_std_mult': 2.9602983248608643, 'bear_rsi_os': 42, 'bear_rsi_ob': 73, 'bear_adx_thresh': 14.184332181407818, 'bear_atr_min_pct': 0.009763843082828141, 'bear_atr_max_pct': 0.030808786852262102, 'bear_tp_mult': 2.632615446344023, 'bear_tsl_mult': 0.11055467613318681, 'bear_time_stop': 202, 'bear_use_sma': True, 'bear_use_ema': False, 'bear_use_atr': False, 'bear_use_adx': False, 'bear_use_spike': False, 'bear_rsi_required': True, 'sideways_strategy': 'mean_reversion', 'sideways_bb_std_mult': 3.1209965000559907, 'sideways_rsi_os': 35, 'sideways_rsi_ob': 62, 'sideways_adx_thresh': 21.214399709154108, 'sideways_atr_min_pct': 0.0008545431531619897, 'sideways_atr_max_pct': 0.14751905948358454, 'sideways_tp_mult': 1.047110629483546, 'sideways_tsl_mult': 0.2860788210961604, 'sideways_time_stop': 179, 'sideways_use_sma': False, 'sideways_use_ema': False, 'sideways_use_atr': True, 'sideways_use_adx': True, 'sideways_use_spike': True, 'sideways_rsi_required': False}.
[I 2025-08-30 19:47:48,241] Trial 686 finished with values: [-1000000000.0, 1000000000.0] and parameters: {'p_sma': 24, 'p_std': 31, 'p_atr': 8, 'p_adx': 16, 'rsi_period': 27, 'ema1': 26, 'ema2': 35, 'slip_atr_k': 0.06990089310649991, 'slip_spread_k': 0.48138953432309617, 'spread_hl_frac': 0.02531587364810585, 'bb_std_mult': 2.295889632859289, 'rsi_os': 51, 'rsi_ob': 83, 'vol_spike': 0.025736262042097294, 'adx_thresh': 11.30960924702088, 'atr_min_pct': 0.005935814949067787, 'atr_max_pct': 0.09162409444872852, 'tp_mult': 2.317790085509796, 'tsl_mult': 0.13314245690983495, 'strategy': 'mean_reversion', 'time_stop': 166, 'use_sma': False, 'use_atr': False, 'use_adx': False, 'use_ema': True, 'use_spike': False, 'rsi_required': True, 'edge_k': 0.07851072664207359, 'edge_cap': 0.2870254115824762, 'bull_strategy': 'mean_reversion', 'bull_bb_std_mult': 2.0649509032272197, 'bull_rsi_os': 30, 'bull_rsi_ob': 92, 'bull_adx_thresh': 16.53317965551062, 'bull_atr_min_pct': 0.0029783744925964035, 'bull_atr_max_pct': 0.01000336827872396, 'bull_tp_mult': 2.7219688991457267, 'bull_tsl_mult': 0.9036655016393094, 'bull_time_stop': 107, 'bull_use_sma': True, 'bull_use_ema': False, 'bull_use_atr': False, 'bull_use_adx': False, 'bull_use_spike': False, 'bull_rsi_required': True, 'bear_strategy': 'mean_reversion', 'bear_bb_std_mult': 2.9377107585644944, 'bear_rsi_os': 53, 'bear_rsi_ob': 74, 'bear_adx_thresh': 22.31632944192823, 'bear_atr_min_pct': 0.009779157707384068, 'bear_atr_max_pct': 0.03087436726074097, 'bear_tp_mult': 2.6448283885506383, 'bear_tsl_mult': 0.046224120922475465, 'bear_time_stop': 82, 'bear_use_sma': True, 'bear_use_ema': False, 'bear_use_atr': False, 'bear_use_adx': False, 'bear_use_spike': False, 'bear_rsi_required': True, 'sideways_strategy': 'mean_reversion', 'sideways_bb_std_mult': 3.1260190204523535, 'sideways_rsi_os': 34, 'sideways_rsi_ob': 61, 'sideways_adx_thresh': 31.992424757349443, 'sideways_atr_min_pct': 0.002038854141373602, 'sideways_atr_max_pct': 0.1499624210906312, 'sideways_tp_mult': 1.1347398840534826, 'sideways_tsl_mult': 0.33819169685202877, 'sideways_time_stop': 178, 'sideways_use_sma': True, 'sideways_use_ema': False, 'sideways_use_atr': False, 'sideways_use_adx': False, 'sideways_use_spike': True, 'sideways_rsi_required': False}.
[I 2025-08-30 19:47:48,717] Trial 689 finished with values: [-1000000000.0, 1000000000.0] and parameters: {'p_sma': 49, 'p_std': 31, 'p_atr': 14, 'p_adx': 16, 'rsi_period': 32, 'ema1': 27, 'ema2': 34, 'slip_atr_k': 0.07036966682610557, 'slip_spread_k': 0.2417015424860068, 'spread_hl_frac': 0.033273562556392036, 'bb_std_mult': 2.3434354403687916, 'rsi_os': 51, 'rsi_ob': 83, 'vol_spike': 0.02558138905130726, 'adx_thresh': 34.309742356024294, 'atr_min_pct': 0.023336840738984118, 'atr_max_pct': 0.024884487721212656, 'tp_mult': 2.38366365221271, 'tsl_mult': 0.8258875001707427, 'strategy': 'mean_reversion', 'time_stop': 195, 'use_sma': False, 'use_atr': False, 'use_adx': False, 'use_ema': True, 'use_spike': False, 'rsi_required': False, 'edge_k': 0.5731844671037258, 'edge_cap': 0.754318906896926, 'bull_strategy': 'mean_reversion', 'bull_bb_std_mult': 2.0858474829634672, 'bull_rsi_os': 9, 'bull_rsi_ob': 51, 'bull_adx_thresh': 16.786846815050374, 'bull_atr_min_pct': 0.0053983271356591745, 'bull_atr_max_pct': 0.1192168872567177, 'bull_tp_mult': 2.7174533871718967, 'bull_tsl_mult': 0.6154505525703445, 'bull_time_stop': 125, 'bull_use_sma': True, 'bull_use_ema': False, 'bull_use_atr': True, 'bull_use_adx': False, 'bull_use_spike': True, 'bull_rsi_required': True, 'bear_strategy': 'mean_reversion', 'bear_bb_std_mult': 0.5408042929116983, 'bear_rsi_os': 28, 'bear_rsi_ob': 74, 'bear_adx_thresh': 18.275396040789126, 'bear_atr_min_pct': 0.014405504670884032, 'bear_atr_max_pct': 0.04235938456593024, 'bear_tp_mult': 2.6951089735931304, 'bear_tsl_mult': 0.362367051512024, 'bear_time_stop': 19, 'bear_use_sma': False, 'bear_use_ema': True, 'bear_use_atr': True, 'bear_use_adx': False, 'bear_use_spike': True, 'bear_rsi_required': True, 'sideways_strategy': 'mean_reversion', 'sideways_bb_std_mult': 1.6558376562197386, 'sideways_rsi_os': 36, 'sideways_rsi_ob': 61, 'sideways_adx_thresh': 17.367191482009225, 'sideways_atr_min_pct': 0.020321185067722236, 'sideways_atr_max_pct': 0.14178885056024507, 'sideways_tp_mult': 1.7260258889307185, 'sideways_tsl_mult': 0.4307488955669919, 'sideways_time_stop': 160, 'sideways_use_sma': True, 'sideways_use_ema': True, 'sideways_use_atr': False, 'sideways_use_adx': False, 'sideways_use_spike': False, 'sideways_rsi_required': True}.
[I 2025-08-30 19:48:13,034] Trial 687 finished with values: [-1000000000.0, 1000000000.0] and parameters: {'p_sma': 5, 'p_std': 21, 'p_atr': 8, 'p_adx': 16, 'rsi_period': 27, 'ema1': 10, 'ema2': 43, 'slip_atr_k': 0.09098070320390286, 'slip_spread_k': 0.15230013380321, 'spread_hl_frac': 0.03336331938874999, 'bb_std_mult': 2.272757829295168, 'rsi_os': 25, 'rsi_ob': 83, 'vol_spike': 7.377775940828335e-05, 'adx_thresh': 7.372684082055308, 'atr_min_pct': 0.005870228070663378, 'atr_max_pct': 0.1018703784333917, 'tp_mult': 2.262732944277137, 'tsl_mult': 0.830001096198815, 'strategy': 'mean_reversion', 'time_stop': 165, 'use_sma': False, 'use_atr': False, 'use_adx': False, 'use_ema': True, 'use_spike': False, 'rsi_required': False, 'edge_k': 1.6218399873684652, 'edge_cap': 0.529628339912573, 'bull_strategy': 'mean_reversion', 'bull_bb_std_mult': 2.060570827559422, 'bull_rsi_os': 9, 'bull_rsi_ob': 46, 'bull_adx_thresh': 18.315084907198298, 'bull_atr_min_pct': 0.0022817266785894077, 'bull_atr_max_pct': 0.11882434598483893, 'bull_tp_mult': 2.7227309356795946, 'bull_tsl_mult': 0.9135483954108151, 'bull_time_stop': 194, 'bull_use_sma': True, 'bull_use_ema': False, 'bull_use_atr': False, 'bull_use_adx': False, 'bull_use_spike': False, 'bull_rsi_required': True, 'bear_strategy': 'mean_reversion', 'bear_bb_std_mult': 2.9412837961398326, 'bear_rsi_os': 37, 'bear_rsi_ob': 74, 'bear_adx_thresh': 9.350573109680166, 'bear_atr_min_pct': 0.014619804047399104, 'bear_atr_max_pct': 0.030033099889881464, 'bear_tp_mult': 2.646350635081961, 'bear_tsl_mult': 0.8074085955024851, 'bear_time_stop': 187, 'bear_use_sma': False, 'bear_use_ema': True, 'bear_use_atr': False, 'bear_use_adx': False, 'bear_use_spike': True, 'bear_rsi_required': True, 'sideways_strategy': 'mean_reversion', 'sideways_bb_std_mult': 3.1307669453489635, 'sideways_rsi_os': 7, 'sideways_rsi_ob': 61, 'sideways_adx_thresh': 20.93720900887759, 'sideways_atr_min_pct': 0.017262878278386653, 'sideways_atr_max_pct': 0.13046042536769664, 'sideways_tp_mult': 1.5112734561942933, 'sideways_tsl_mult': 0.6386728755595545, 'sideways_time_stop': 213, 'sideways_use_sma': True, 'sideways_use_ema': False, 'sideways_use_atr': False, 'sideways_use_adx': False, 'sideways_use_spike': False, 'sideways_rsi_required': False}.
[I 2025-08-30 19:48:14,823] Trial 688 finished with values: [-1000000000.0, 1000000000.0] and parameters: {'p_sma': 5, 'p_std': 31, 'p_atr': 8, 'p_adx': 16, 'rsi_period': 22, 'ema1': 26, 'ema2': 34, 'slip_atr_k': 0.07117738383603978, 'slip_spread_k': 0.2638449356286614, 'spread_hl_frac': 0.03337680482695238, 'bb_std_mult': 2.23767956008015, 'rsi_os': 16, 'rsi_ob': 74, 'vol_spike': 0.09082952501739427, 'adx_thresh': 34.444300522587326, 'atr_min_pct': 0.024585075854433945, 'atr_max_pct': 0.10173002808013644, 'tp_mult': 2.384093021033611, 'tsl_mult': 0.825465380860712, 'strategy': 'mean_reversion', 'time_stop': 160, 'use_sma': False, 'use_atr': False, 'use_adx': False, 'use_ema': True, 'use_spike': False, 'rsi_required': True, 'edge_k': 1.3019246073937365, 'edge_cap': 0.7563651815757908, 'bull_strategy': 'mean_reversion', 'bull_bb_std_mult': 3.5333295172352974, 'bull_rsi_os': 18, 'bull_rsi_ob': 51, 'bull_adx_thresh': 16.64830751644897, 'bull_atr_min_pct': 0.02943177734268699, 'bull_atr_max_pct': 0.11844181241856813, 'bull_tp_mult': 2.719183956849371, 'bull_tsl_mult': 0.5326035215877254, 'bull_time_stop': 120, 'bull_use_sma': True, 'bull_use_ema': False, 'bull_use_atr': True, 'bull_use_adx': False, 'bull_use_spike': True, 'bull_rsi_required': True, 'bear_strategy': 'mean_reversion', 'bear_bb_std_mult': 2.9434297453321285, 'bear_rsi_os': 37, 'bear_rsi_ob': 74, 'bear_adx_thresh': 10.318169602117552, 'bear_atr_min_pct': 0.014593938392142174, 'bear_atr_max_pct': 0.0321222416406421, 'bear_tp_mult': 2.631146745067078, 'bear_tsl_mult': 0.04491627350461397, 'bear_time_stop': 192, 'bear_use_sma': False, 'bear_use_ema': False, 'bear_use_atr': False, 'bear_use_adx': False, 'bear_use_spike': True, 'bear_rsi_required': True, 'sideways_strategy': 'mean_reversion', 'sideways_bb_std_mult': 3.131964418066889, 'sideways_rsi_os': 36, 'sideways_rsi_ob': 73, 'sideways_adx_thresh': 20.99316961629737, 'sideways_atr_min_pct': 0.017167190226965633, 'sideways_atr_max_pct': 0.14203011620626652, 'sideways_tp_mult': 1.0848526556666178, 'sideways_tsl_mult': 0.9825285897410827, 'sideways_time_stop': 158, 'sideways_use_sma': True, 'sideways_use_ema': False, 'sideways_use_atr': False, 'sideways_use_adx': False, 'sideways_use_spike': True, 'sideways_rsi_required': True}.
[I 2025-08-30 19:48:20,682] Trial 690 finished with values: [-1000000000.0, 1000000000.0] and parameters: {'p_sma': 49, 'p_std': 21, 'p_atr': 7, 'p_adx': 24, 'rsi_period': 22, 'ema1': 27, 'ema2': 34, 'slip_atr_k': 0.07848448934538643, 'slip_spread_k': 0.3064000477970312, 'spread_hl_frac': 0.030009862063099448, 'bb_std_mult': 3.423682608877277, 'rsi_os': 45, 'rsi_ob': 86, 'vol_spike': 0.08886775935902941, 'adx_thresh': 34.37928311329746, 'atr_min_pct': 0.023291330448464265, 'atr_max_pct': 0.05484389826018492, 'tp_mult': 2.5980872440892155, 'tsl_mult': 0.8199931657309306, 'strategy': 'mean_reversion', 'time_stop': 194, 'use_sma': False, 'use_atr': True, 'use_adx': True, 'use_ema': False, 'use_spike': True, 'rsi_required': False, 'edge_k': 0.1955422925240684, 'edge_cap': 0.5164622405798284, 'bull_strategy': 'mean_reversion', 'bull_bb_std_mult': 3.1838026465947937, 'bull_rsi_os': 18, 'bull_rsi_ob': 51, 'bull_adx_thresh': 18.297987834197812, 'bull_atr_min_pct': 0.023658051880472215, 'bull_atr_max_pct': 0.10682069883693841, 'bull_tp_mult': 2.2327945544011327, 'bull_tsl_mult': 0.6103825203373254, 'bull_time_stop': 197, 'bull_use_sma': True, 'bull_use_ema': False, 'bull_use_atr': True, 'bull_use_adx': False, 'bull_use_spike': True, 'bull_rsi_required': True, 'bear_strategy': 'mean_reversion', 'bear_bb_std_mult': 3.0247264367977564, 'bear_rsi_os': 52, 'bear_rsi_ob': 47, 'bear_adx_thresh': 33.33413019297809, 'bear_atr_min_pct': 0.014627814458736675, 'bear_atr_max_pct': 0.04051131214213033, 'bear_tp_mult': 2.6787783531708933, 'bear_tsl_mult': 0.7535655925205307, 'bear_time_stop': 56, 'bear_use_sma': False, 'bear_use_ema': True, 'bear_use_atr': True, 'bear_use_adx': False, 'bear_use_spike': True, 'bear_rsi_required': True, 'sideways_strategy': 'breakout', 'sideways_bb_std_mult': 2.5008629224623724, 'sideways_rsi_os': 39, 'sideways_rsi_ob': 45, 'sideways_adx_thresh': 17.375968877288013, 'sideways_atr_min_pct': 0.017383480574599527, 'sideways_atr_max_pct': 0.12954766125242742, 'sideways_tp_mult': 2.2812838596051512, 'sideways_tsl_mult': 0.6353046340307897, 'sideways_time_stop': 139, 'sideways_use_sma': True, 'sideways_use_ema': True, 'sideways_use_atr': False, 'sideways_use_adx': False, 'sideways_use_spike': False, 'sideways_rsi_required': True}.
[I 2025-08-30 19:48:22,955] Trial 691 finished with values: [-1000000000.0, 1000000000.0] and parameters: {'p_sma': 32, 'p_std': 30, 'p_atr': 16, 'p_adx': 24, 'rsi_period': 36, 'ema1': 10, 'ema2': 18, 'slip_atr_k': 0.08026714991162073, 'slip_spread_k': 0.15643866124699665, 'spread_hl_frac': 0.013337053753869102, 'bb_std_mult': 2.6675984752618667, 'rsi_os': 49, 'rsi_ob': 74, 'vol_spike': 0.2656741552464964, 'adx_thresh': 34.496186299308675, 'atr_min_pct': 0.011505617978557063, 'atr_max_pct': 0.08820720900053462, 'tp_mult': 2.2522288262155508, 'tsl_mult': 0.7997959525711721, 'strategy': 'mean_reversion', 'time_stop': 158, 'use_sma': True, 'use_atr': True, 'use_adx': True, 'use_ema': False, 'use_spike': True, 'rsi_required': False, 'edge_k': 0.0309350594043437, 'edge_cap': 0.83521492965747, 'bull_strategy': 'mean_reversion', 'bull_bb_std_mult': 0.6426929126724794, 'bull_rsi_os': 32, 'bull_rsi_ob': 46, 'bull_adx_thresh': 18.65241339477538, 'bull_atr_min_pct': 0.02347903136169996, 'bull_atr_max_pct': 0.1278479128710274, 'bull_tp_mult': 2.841398518905914, 'bull_tsl_mult': 0.5349700484470878, 'bull_time_stop': 195, 'bull_use_sma': False, 'bull_use_ema': True, 'bull_use_atr': True, 'bull_use_adx': False, 'bull_use_spike': False, 'bull_rsi_required': True, 'bear_strategy': 'breakout', 'bear_bb_std_mult': 1.3858082721068241, 'bear_rsi_os': 52, 'bear_rsi_ob': 64, 'bear_adx_thresh': 9.328459867273542, 'bear_atr_min_pct': 0.015352079933202126, 'bear_atr_max_pct': 0.045987136019401416, 'bear_tp_mult': 2.344082037131222, 'bear_tsl_mult': 0.7586400649705735, 'bear_time_stop': 189, 'bear_use_sma': False, 'bear_use_ema': True, 'bear_use_atr': False, 'bear_use_adx': False, 'bear_use_spike': True, 'bear_rsi_required': True, 'sideways_strategy': 'breakout', 'sideways_bb_std_mult': 3.0541820032305407, 'sideways_rsi_os': 39, 'sideways_rsi_ob': 93, 'sideways_adx_thresh': 20.741158627449796, 'sideways_atr_min_pct': 0.02597182603998289, 'sideways_atr_max_pct': 0.1455422208829335, 'sideways_tp_mult': 2.3034576282379087, 'sideways_tsl_mult': 0.6857547455800809, 'sideways_time_stop': 19, 'sideways_use_sma': False, 'sideways_use_ema': True, 'sideways_use_atr': True, 'sideways_use_adx': False, 'sideways_use_spike': False, 'sideways_rsi_required': True}.
[I 2025-08-30 19:48:54,984] Trial 692 finished with values: [-1000000000.0, 1000000000.0] and parameters: {'p_sma': 44, 'p_std': 9, 'p_atr': 28, 'p_adx': 22, 'rsi_period': 22, 'ema1': 8, 'ema2': 34, 'slip_atr_k': 0.0788062437898299, 'slip_spread_k': 0.792941891469167, 'spread_hl_frac': 0.024692131608642278, 'bb_std_mult': 1.0117739808483739, 'rsi_os': 48, 'rsi_ob': 87, 'vol_spike': 0.2996419447739437, 'adx_thresh': 34.25897840313412, 'atr_min_pct': 0.024741375823155828, 'atr_max_pct': 0.08824498856124331, 'tp_mult': 1.996135300543698, 'tsl_mult': 0.7998149491988239, 'strategy': 'mean_reversion', 'time_stop': 191, 'use_sma': True, 'use_atr': True, 'use_adx': True, 'use_ema': False, 'use_spike': True, 'rsi_required': False, 'edge_k': 0.17635235861406484, 'edge_cap': 0.4945719405544755, 'bull_strategy': 'mean_reversion', 'bull_bb_std_mult': 3.42257861413371, 'bull_rsi_os': 18, 'bull_rsi_ob': 77, 'bull_adx_thresh': 18.77934153996839, 'bull_atr_min_pct': 0.026222804545810992, 'bull_atr_max_pct': 0.12978803308720122, 'bull_tp_mult': 2.8282564901634624, 'bull_tsl_mult': 0.5304092792682168, 'bull_time_stop': 194, 'bull_use_sma': False, 'bull_use_ema': True, 'bull_use_atr': True, 'bull_use_adx': False, 'bull_use_spike': True, 'bull_rsi_required': True, 'bear_strategy': 'breakout', 'bear_bb_std_mult': 3.0182814589268485, 'bear_rsi_os': 39, 'bear_rsi_ob': 65, 'bear_adx_thresh': 33.16473015262501, 'bear_atr_min_pct': 0.015244802686374504, 'bear_atr_max_pct': 0.08858219921413832, 'bear_tp_mult': 2.7731209749362793, 'bear_tsl_mult': 0.7536579214229053, 'bear_time_stop': 56, 'bear_use_sma': True, 'bear_use_ema': True, 'bear_use_atr': False, 'bear_use_adx': False, 'bear_use_spike': False, 'bear_rsi_required': True, 'sideways_strategy': 'breakout', 'sideways_bb_std_mult': 3.465042787199808, 'sideways_rsi_os': 18, 'sideways_rsi_ob': 58, 'sideways_adx_thresh': 20.45753972322836, 'sideways_atr_min_pct': 0.012714614509694898, 'sideways_atr_max_pct': 0.14712409401055113, 'sideways_tp_mult': 1.0880498455845644, 'sideways_tsl_mult': 0.47918392383913644, 'sideways_time_stop': 141, 'sideways_use_sma': False, 'sideways_use_ema': True, 'sideways_use_atr': True, 'sideways_use_adx': False, 'sideways_use_spike': False, 'sideways_rsi_required': True}.
