[I 2025-08-30 18:49:13,734] Trial 180 finished with values: [-1000000000.0, 1000000000.0] and parameters: {'p_sma': 43, 'p_std': 30, 'p_atr': 24, 'p_adx': 24, 'rsi_period': 25, 'ema1': 28, 'ema2': 28, 'slip_atr_k': 0.2056155708752772, 'slip_spread_k': 0.3419829924339138, 'spread_hl_frac': 0.012019631252963722, 'bb_std_mult': 2.50420744168706, 'rsi_os': 43, 'rsi_ob': 87, 'vol_spike': 0.28769644022684837, 'adx_thresh': 5.022014732333524, 'atr_min_pct': 0.016548458614449233, 'atr_max_pct': 0.09589452425066483, 'tp_mult': 2.2977429612428146, 'tsl_mult': 0.23182537742454984, 'strategy': 'mean_reversion', 'time_stop': 175, 'use_sma': False, 'use_atr': True, 'use_adx': True, 'use_ema': False, 'use_spike': True, 'rsi_required': True, 'edge_k': 0.12464246961619223, 'edge_cap': 0.5025447999955299, 'bull_strategy': 'mean_reversion', 'bull_bb_std_mult': 3.4560780744649233, 'bull_rsi_os': 17, 'bull_rsi_ob': 68, 'bull_adx_thresh': 18.43897733939329, 'bull_atr_min_pct': 0.029723803188821705, 'bull_atr_max_pct': 0.12261999824355882, 'bull_tp_mult': 1.289573663501657, 'bull_tsl_mult': 0.5310651992948138, 'bull_time_stop': 173, 'bull_use_sma': False, 'bull_use_ema': True, 'bull_use_atr': True, 'bull_use_adx': False, 'bull_use_spike': False, 'bull_rsi_required': True, 'bear_strategy': 'breakout', 'bear_bb_std_mult': 1.857062474090645, 'bear_rsi_os': 52, 'bear_rsi_ob': 76, 'bear_adx_thresh': 17.52418769734124, 'bear_atr_min_pct': 0.013834017047668977, 'bear_atr_max_pct': 0.09548554304406032, 'bear_tp_mult': 1.753986456870855, 'bear_tsl_mult': 0.13917068523023224, 'bear_time_stop': 59, 'bear_use_sma': True, 'bear_use_ema': False, 'bear_use_atr': False, 'bear_use_adx': False, 'bear_use_spike': False, 'bear_rsi_required': True, 'sideways_strategy': 'breakout', 'sideways_bb_std_mult': 2.269229121128031, 'sideways_rsi_os': 34, 'sideways_rsi_ob': 95, 'sideways_adx_thresh': 13.508332030588537, 'sideways_atr_min_pct': 0.02666311124267475, 'sideways_atr_max_pct': 0.13791392609357148, 'sideways_tp_mult': 1.0502526647131385, 'sideways_tsl_mult': 0.9094344748832336, 'sideways_time_stop': 131, 'sideways_use_sma': False, 'sideways_use_ema': True, 'sideways_use_atr': True, 'sideways_use_adx': True, 'sideways_use_spike': True, 'sideways_rsi_required': False}.
[I 2025-08-30 18:49:41,554] Trial 181 finished with values: [-1000000000.0, 1000000000.0] and parameters: {'p_sma': 12, 'p_std': 10, 'p_atr': 28, 'p_adx': 22, 'rsi_period': 50, 'ema1': 27, 'ema2': 29, 'slip_atr_k': 0.007158051616992345, 'slip_spread_k': 0.19432914087987255, 'spread_hl_frac': 0.02612529029205209, 'bb_std_mult': 1.1689203636660226, 'rsi_os': 47, 'rsi_ob': 75, 'vol_spike': 0.14124766384450316, 'adx_thresh': 19.892319672170082, 'atr_min_pct': 0.004939200054355773, 'atr_max_pct': 0.0934776105344481, 'tp_mult': 2.297583245069342, 'tsl_mult': 0.1363526397712399, 'strategy': 'mean_reversion', 'time_stop': 5, 'use_sma': False, 'use_atr': True, 'use_adx': False, 'use_ema': True, 'use_spike': True, 'rsi_required': False, 'edge_k': 0.2419481906022204, 'edge_cap': 0.5809845060441895, 'bull_strategy': 'mean_reversion', 'bull_bb_std_mult': 3.498109411540011, 'bull_rsi_os': 11, 'bull_rsi_ob': 54, 'bull_adx_thresh': 30.780358902943423, 'bull_atr_min_pct': 0.0024238802996784806, 'bull_atr_max_pct': 0.03157445434355161, 'bull_tp_mult': 1.316377174350925, 'bull_tsl_mult': 0.7578569195344211, 'bull_time_stop': 76, 'bull_use_sma': False, 'bull_use_ema': True, 'bull_use_atr': True, 'bull_use_adx': False, 'bull_use_spike': False, 'bull_rsi_required': True, 'bear_strategy': 'breakout', 'bear_bb_std_mult': 2.576191403553665, 'bear_rsi_os': 38, 'bear_rsi_ob': 49, 'bear_adx_thresh': 7.6734555679938605, 'bear_atr_min_pct': 0.013203731321872544, 'bear_atr_max_pct': 0.03065414493455967, 'bear_tp_mult': 1.3532520286742635, 'bear_tsl_mult': 0.13852812657825486, 'bear_time_stop': 125, 'bear_use_sma': True, 'bear_use_ema': True, 'bear_use_atr': False, 'bear_use_adx': False, 'bear_use_spike': False, 'bear_rsi_required': True, 'sideways_strategy': 'breakout', 'sideways_bb_std_mult': 2.2685871058810765, 'sideways_rsi_os': 34, 'sideways_rsi_ob': 45, 'sideways_adx_thresh': 5.181337976520494, 'sideways_atr_min_pct': 0.013784658105345366, 'sideways_atr_max_pct': 0.1377537340206202, 'sideways_tp_mult': 1.412104856033785, 'sideways_tsl_mult': 0.5309339704472182, 'sideways_time_stop': 198, 'sideways_use_sma': False, 'sideways_use_ema': True, 'sideways_use_atr': True, 'sideways_use_adx': False, 'sideways_use_spike': True, 'sideways_rsi_required': False}.
[I 2025-08-30 18:49:42,276] Trial 182 finished with values: [-1000000000.0, 1000000000.0] and parameters: {'p_sma': 9, 'p_std': 11, 'p_atr': 28, 'p_adx': 21, 'rsi_period': 25, 'ema1': 28, 'ema2': 33, 'slip_atr_k': 0.006344035049398414, 'slip_spread_k': 0.19166167588817362, 'spread_hl_frac': 0.041342419973208, 'bb_std_mult': 2.047704985850378, 'rsi_os': 47, 'rsi_ob': 86, 'vol_spike': 0.14258362023361731, 'adx_thresh': 5.131443506165089, 'atr_min_pct': 0.00955005872827009, 'atr_max_pct': 0.09424459997291376, 'tp_mult': 1.0136212284946786, 'tsl_mult': 0.6546751730574072, 'strategy': 'mean_reversion', 'time_stop': 175, 'use_sma': True, 'use_atr': True, 'use_adx': True, 'use_ema': False, 'use_spike': False, 'rsi_required': False, 'edge_k': 0.2355848692416413, 'edge_cap': 0.9752596637238593, 'bull_strategy': 'breakout', 'bull_bb_std_mult': 3.4578017966680563, 'bull_rsi_os': 9, 'bull_rsi_ob': 45, 'bull_adx_thresh': 18.403861267967297, 'bull_atr_min_pct': 0.001782462315484059, 'bull_atr_max_pct': 0.12254606466821528, 'bull_tp_mult': 2.872832471494792, 'bull_tsl_mult': 0.17852241386561774, 'bull_time_stop': 182, 'bull_use_sma': False, 'bull_use_ema': True, 'bull_use_atr': False, 'bull_use_adx': False, 'bull_use_spike': True, 'bull_rsi_required': True, 'bear_strategy': 'breakout', 'bear_bb_std_mult': 3.024933416183143, 'bear_rsi_os': 21, 'bear_rsi_ob': 61, 'bear_adx_thresh': 21.725643334053046, 'bear_atr_min_pct': 0.013634006849048797, 'bear_atr_max_pct': 0.02992912085468257, 'bear_tp_mult': 1.5599471960608036, 'bear_tsl_mult': 0.7457641215227903, 'bear_time_stop': 138, 'bear_use_sma': True, 'bear_use_ema': True, 'bear_use_atr': True, 'bear_use_adx': False, 'bear_use_spike': True, 'bear_rsi_required': False, 'sideways_strategy': 'breakout', 'sideways_bb_std_mult': 1.0930677530755328, 'sideways_rsi_os': 9, 'sideways_rsi_ob': 45, 'sideways_adx_thresh': 20.212019631100105, 'sideways_atr_min_pct': 0.007972342738321276, 'sideways_atr_max_pct': 0.07384884447816903, 'sideways_tp_mult': 2.817086033460984, 'sideways_tsl_mult': 0.8726059476094422, 'sideways_time_stop': 198, 'sideways_use_sma': True, 'sideways_use_ema': True, 'sideways_use_atr': False, 'sideways_use_adx': True, 'sideways_use_spike': True, 'sideways_rsi_required': False}.
[I 2025-08-30 18:49:42,749] Trial 183 finished with values: [-1000000000.0, 1000000000.0] and parameters: {'p_sma': 9, 'p_std': 5, 'p_atr': 8, 'p_adx': 9, 'rsi_period': 25, 'ema1': 11, 'ema2': 30, 'slip_atr_k': 0.07213928497198695, 'slip_spread_k': 0.35639651331642425, 'spread_hl_frac': 0.012874558303933317, 'bb_std_mult': 3.435445070412438, 'rsi_os': 45, 'rsi_ob': 87, 'vol_spike': 0.14004566419148914, 'adx_thresh': 17.965535344628673, 'atr_min_pct': 0.023982665875894763, 'atr_max_pct': 0.09350562315472635, 'tp_mult': 1.9950439842158698, 'tsl_mult': 0.16098654435171145, 'strategy': 'mean_reversion', 'time_stop': 179, 'use_sma': True, 'use_atr': True, 'use_adx': True, 'use_ema': False, 'use_spike': False, 'rsi_required': False, 'edge_k': 0.12294493493528293, 'edge_cap': 0.837407789470966, 'bull_strategy': 'breakout', 'bull_bb_std_mult': 3.2810697828086415, 'bull_rsi_os': 17, 'bull_rsi_ob': 69, 'bull_adx_thresh': 18.61340591120004, 'bull_atr_min_pct': 0.004107757387672609, 'bull_atr_max_pct': 0.08892417406165753, 'bull_tp_mult': 2.847542928456771, 'bull_tsl_mult': 0.5180770055241155, 'bull_time_stop': 98, 'bull_use_sma': False, 'bull_use_ema': True, 'bull_use_atr': False, 'bull_use_adx': False, 'bull_use_spike': True, 'bull_rsi_required': True, 'bear_strategy': 'breakout', 'bear_bb_std_mult': 3.4597667711780127, 'bear_rsi_os': 52, 'bear_rsi_ob': 61, 'bear_adx_thresh': 21.53303338491745, 'bear_atr_min_pct': 0.013395353078527331, 'bear_atr_max_pct': 0.03021764793764564, 'bear_tp_mult': 1.5508828406261044, 'bear_tsl_mult': 0.884118976486451, 'bear_time_stop': 168, 'bear_use_sma': True, 'bear_use_ema': True, 'bear_use_atr': True, 'bear_use_adx': False, 'bear_use_spike': True, 'bear_rsi_required': False, 'sideways_strategy': 'breakout', 'sideways_bb_std_mult': 2.970071811558683, 'sideways_rsi_os': 33, 'sideways_rsi_ob': 57, 'sideways_adx_thresh': 18.82766353477162, 'sideways_atr_min_pct': 0.007687024242106824, 'sideways_atr_max_pct': 0.14769743353693995, 'sideways_tp_mult': 1.3190362690005317, 'sideways_tsl_mult': 0.916433576477759, 'sideways_time_stop': 139, 'sideways_use_sma': True, 'sideways_use_ema': True, 'sideways_use_atr': False, 'sideways_use_adx': True, 'sideways_use_spike': True, 'sideways_rsi_required': False}.
[I 2025-08-30 18:49:46,432] Trial 184 finished with values: [-1000000000.0, 1000000000.0] and parameters: {'p_sma': 9, 'p_std': 32, 'p_atr': 8, 'p_adx': 19, 'rsi_period': 27, 'ema1': 25, 'ema2': 10, 'slip_atr_k': 0.07032786519898188, 'slip_spread_k': 0.6625794014330131, 'spread_hl_frac': 0.043894386072320726, 'bb_std_mult': 1.1824283437283707, 'rsi_os': 47, 'rsi_ob': 90, 'vol_spike': 0.2727762886363318, 'adx_thresh': 13.240881055389744, 'atr_min_pct': 0.009568603624171685, 'atr_max_pct': 0.09236349119208205, 'tp_mult': 2.256974717599286, 'tsl_mult': 0.8047416808741589, 'strategy': 'mean_reversion', 'time_stop': 197, 'use_sma': True, 'use_atr': True, 'use_adx': True, 'use_ema': True, 'use_spike': False, 'rsi_required': False, 'edge_k': 0.06394728360680514, 'edge_cap': 0.9381509565594881, 'bull_strategy': 'breakout', 'bull_bb_std_mult': 3.27426788681868, 'bull_rsi_os': 32, 'bull_rsi_ob': 45, 'bull_adx_thresh': 10.12106022602841, 'bull_atr_min_pct': 0.002016147487034597, 'bull_atr_max_pct': 0.11740337977466275, 'bull_tp_mult': 2.725193248050921, 'bull_tsl_mult': 0.8736544778726842, 'bull_time_stop': 99, 'bull_use_sma': False, 'bull_use_ema': True, 'bull_use_atr': False, 'bull_use_adx': False, 'bull_use_spike': True, 'bull_rsi_required': True, 'bear_strategy': 'mean_reversion', 'bear_bb_std_mult': 3.0076830778482906, 'bear_rsi_os': 33, 'bear_rsi_ob': 75, 'bear_adx_thresh': 17.55690448410083, 'bear_atr_min_pct': 0.013037008518781125, 'bear_atr_max_pct': 0.03102951060704663, 'bear_tp_mult': 1.0923401368631547, 'bear_tsl_mult': 0.8938492279953522, 'bear_time_stop': 137, 'bear_use_sma': True, 'bear_use_ema': True, 'bear_use_atr': True, 'bear_use_adx': False, 'bear_use_spike': True, 'bear_rsi_required': False, 'sideways_strategy': 'breakout', 'sideways_bb_std_mult': 3.3637686267720257, 'sideways_rsi_os': 8, 'sideways_rsi_ob': 92, 'sideways_adx_thresh': 15.063181232202123, 'sideways_atr_min_pct': 0.00128306384401149, 'sideways_atr_max_pct': 0.14681350400730636, 'sideways_tp_mult': 1.4701678219019534, 'sideways_tsl_mult': 0.9652301123881369, 'sideways_time_stop': 197, 'sideways_use_sma': True, 'sideways_use_ema': True, 'sideways_use_atr': False, 'sideways_use_adx': False, 'sideways_use_spike': True, 'sideways_rsi_required': False}.
[I 2025-08-30 18:50:18,120] Trial 185 finished with values: [-0.017054736741128673, 0.01704509886707789] and parameters: {'p_sma': 52, 'p_std': 32, 'p_atr': 19, 'p_adx': 26, 'rsi_period': 12, 'ema1': 25, 'ema2': 32, 'slip_atr_k': 0.0724520675951478, 'slip_spread_k': 0.6441230645148881, 'spread_hl_frac': 0.028336787401621544, 'bb_std_mult': 2.077845341402306, 'rsi_os': 45, 'rsi_ob': 91, 'vol_spike': 0.26968097485865933, 'adx_thresh': 33.25965100532787, 'atr_min_pct': 0.023196791079768617, 'atr_max_pct': 0.10021837833054834, 'tp_mult': 1.2196845138173367, 'tsl_mult': 0.8104605185198639, 'strategy': 'mean_reversion', 'time_stop': 23, 'use_sma': True, 'use_atr': True, 'use_adx': True, 'use_ema': False, 'use_spike': False, 'rsi_required': False, 'edge_k': 0.05799746560781424, 'edge_cap': 0.3037515224632984, 'bull_strategy': 'breakout', 'bull_bb_std_mult': 3.0508968390243987, 'bull_rsi_os': 41, 'bull_rsi_ob': 45, 'bull_adx_thresh': 14.890730287048983, 'bull_atr_min_pct': 0.001745117620031437, 'bull_atr_max_pct': 0.12038556861459491, 'bull_tp_mult': 2.9199181624793775, 'bull_tsl_mult': 0.8650796821561284, 'bull_time_stop': 264, 'bull_use_sma': False, 'bull_use_ema': True, 'bull_use_atr': False, 'bull_use_adx': False, 'bull_use_spike': True, 'bull_rsi_required': True, 'bear_strategy': 'mean_reversion', 'bear_bb_std_mult': 2.8684231734013084, 'bear_rsi_os': 9, 'bear_rsi_ob': 75, 'bear_adx_thresh': 16.59162105871844, 'bear_atr_min_pct': 0.012168410970616076, 'bear_atr_max_pct': 0.02941751164782792, 'bear_tp_mult': 1.830037171746748, 'bear_tsl_mult': 0.8299845193453536, 'bear_time_stop': 136, 'bear_use_sma': True, 'bear_use_ema': True, 'bear_use_atr': True, 'bear_use_adx': False, 'bear_use_spike': True, 'bear_rsi_required': False, 'sideways_strategy': 'breakout', 'sideways_bb_std_mult': 2.9743158525099194, 'sideways_rsi_os': 8, 'sideways_rsi_ob': 58, 'sideways_adx_thresh': 21.104796204945163, 'sideways_atr_min_pct': 0.0012053057637335701, 'sideways_atr_max_pct': 0.14710259880858495, 'sideways_tp_mult': 2.8186284322899025, 'sideways_tsl_mult': 0.964155884389905, 'sideways_time_stop': 154, 'sideways_use_sma': True, 'sideways_use_ema': False, 'sideways_use_atr': False, 'sideways_use_adx': False, 'sideways_use_spike': False, 'sideways_rsi_required': True}.
[I 2025-08-30 18:50:18,401] Trial 187 finished with values: [-1000000000.0, 1000000000.0] and parameters: {'p_sma': 21, 'p_std': 57, 'p_atr': 19, 'p_adx': 19, 'rsi_period': 69, 'ema1': 25, 'ema2': 32, 'slip_atr_k': 0.21940302438497258, 'slip_spread_k': 0.9230614707164987, 'spread_hl_frac': 0.04419148268659872, 'bb_std_mult': 2.186778925315677, 'rsi_os': 10, 'rsi_ob': 77, 'vol_spike': 0.27070370932908283, 'adx_thresh': 33.293155719970834, 'atr_min_pct': 0.023039303701064315, 'atr_max_pct': 0.08653521016870952, 'tp_mult': 2.2442474608368284, 'tsl_mult': 0.80482437511912, 'strategy': 'breakout', 'time_stop': 196, 'use_sma': False, 'use_atr': True, 'use_adx': True, 'use_ema': True, 'use_spike': True, 'rsi_required': True, 'edge_k': 0.7880791236360128, 'edge_cap': 0.5028339236211915, 'bull_strategy': 'mean_reversion', 'bull_bb_std_mult': 3.596538104600757, 'bull_rsi_os': 32, 'bull_rsi_ob': 87, 'bull_adx_thresh': 7.8585224315161835, 'bull_atr_min_pct': 0.010815699553887897, 'bull_atr_max_pct': 0.11696496058696411, 'bull_tp_mult': 2.7587719872019134, 'bull_tsl_mult': 0.5495159966634932, 'bull_time_stop': 255, 'bull_use_sma': False, 'bull_use_ema': False, 'bull_use_atr': True, 'bull_use_adx': False, 'bull_use_spike': False, 'bull_rsi_required': True, 'bear_strategy': 'mean_reversion', 'bear_bb_std_mult': 2.905291658103239, 'bear_rsi_os': 34, 'bear_rsi_ob': 75, 'bear_adx_thresh': 22.75470497639384, 'bear_atr_min_pct': 0.010008205374608507, 'bear_atr_max_pct': 0.0694022168135277, 'bear_tp_mult': 2.744140599823086, 'bear_tsl_mult': 0.07858024476326181, 'bear_time_stop': 199, 'bear_use_sma': False, 'bear_use_ema': True, 'bear_use_atr': False, 'bear_use_adx': True, 'bear_use_spike': False, 'bear_rsi_required': True, 'sideways_strategy': 'breakout', 'sideways_bb_std_mult': 3.34280942227122, 'sideways_rsi_os': 36, 'sideways_rsi_ob': 58, 'sideways_adx_thresh': 15.04841174143765, 'sideways_atr_min_pct': 0.001261348423870306, 'sideways_atr_max_pct': 0.14439411261822585, 'sideways_tp_mult': 1.0824059811129045, 'sideways_tsl_mult': 0.9650938037881976, 'sideways_time_stop': 256, 'sideways_use_sma': False, 'sideways_use_ema': False, 'sideways_use_atr': True, 'sideways_use_adx': False, 'sideways_use_spike': False, 'sideways_rsi_required': True}.
[I 2025-08-30 18:50:18,401] Trial 186 finished with values: [-1000000000.0, 1000000000.0] and parameters: {'p_sma': 7, 'p_std': 17, 'p_atr': 19, 'p_adx': 23, 'rsi_period': 80, 'ema1': 25, 'ema2': 30, 'slip_atr_k': 0.05648291350117244, 'slip_spread_k': 0.12586608480105196, 'spread_hl_frac': 0.04499206454268448, 'bb_std_mult': 2.2090881386676444, 'rsi_os': 53, 'rsi_ob': 85, 'vol_spike': 0.11080462575431652, 'adx_thresh': 34.97867053742954, 'atr_min_pct': 0.023273801197827494, 'atr_max_pct': 0.086900805260853, 'tp_mult': 2.23274517315416, 'tsl_mult': 0.8030147433177985, 'strategy': 'breakout', 'time_stop': 199, 'use_sma': False, 'use_atr': True, 'use_adx': True, 'use_ema': False, 'use_spike': False, 'rsi_required': False, 'edge_k': 0.07282116181202258, 'edge_cap': 0.8366371050574524, 'bull_strategy': 'breakout', 'bull_bb_std_mult': 1.1035322082442063, 'bull_rsi_os': 32, 'bull_rsi_ob': 78, 'bull_adx_thresh': 24.016077178348066, 'bull_atr_min_pct': 0.0040940537668742935, 'bull_atr_max_pct': 0.1179397316022138, 'bull_tp_mult': 2.6649827810696625, 'bull_tsl_mult': 0.9971267310276521, 'bull_time_stop': 249, 'bull_use_sma': False, 'bull_use_ema': False, 'bull_use_atr': False, 'bull_use_adx': False, 'bull_use_spike': True, 'bull_rsi_required': True, 'bear_strategy': 'mean_reversion', 'bear_bb_std_mult': 2.864272086908843, 'bear_rsi_os': 51, 'bear_rsi_ob': 75, 'bear_adx_thresh': 9.610286151367463, 'bear_atr_min_pct': 0.0158427183948389, 'bear_atr_max_pct': 0.03259452407146359, 'bear_tp_mult': 1.0947503314323488, 'bear_tsl_mult': 0.24977806113985435, 'bear_time_stop': 171, 'bear_use_sma': True, 'bear_use_ema': True, 'bear_use_atr': True, 'bear_use_adx': True, 'bear_use_spike': True, 'bear_rsi_required': False, 'sideways_strategy': 'breakout', 'sideways_bb_std_mult': 3.3338027899608442, 'sideways_rsi_os': 32, 'sideways_rsi_ob': 57, 'sideways_adx_thresh': 21.845071321630574, 'sideways_atr_min_pct': 0.0012084076497328462, 'sideways_atr_max_pct': 0.14995360770236194, 'sideways_tp_mult': 2.749301030064385, 'sideways_tsl_mult': 0.9623426162291487, 'sideways_time_stop': 83, 'sideways_use_sma': True, 'sideways_use_ema': False, 'sideways_use_atr': True, 'sideways_use_adx': False, 'sideways_use_spike': False, 'sideways_rsi_required': True}.
[I 2025-08-30 18:50:18,651] Trial 188 finished with values: [-0.0530157657374144, 0.05293990081186199] and parameters: {'p_sma': 52, 'p_std': 55, 'p_atr': 11, 'p_adx': 20, 'rsi_period': 21, 'ema1': 26, 'ema2': 32, 'slip_atr_k': 0.16531860565944068, 'slip_spread_k': 0.2840339357833792, 'spread_hl_frac': 0.02787396026953896, 'bb_std_mult': 2.2077816023263694, 'rsi_os': 53, 'rsi_ob': 85, 'vol_spike': 0.13008591051479235, 'adx_thresh': 33.260303436100976, 'atr_min_pct': 0.023421570811026533, 'atr_max_pct': 0.03186700858216415, 'tp_mult': 2.4046409642049418, 'tsl_mult': 0.8236155766688518, 'strategy': 'breakout', 'time_stop': 188, 'use_sma': False, 'use_atr': True, 'use_adx': True, 'use_ema': False, 'use_spike': True, 'rsi_required': True, 'edge_k': 0.16536448406927273, 'edge_cap': 0.22887450182110902, 'bull_strategy': 'mean_reversion', 'bull_bb_std_mult': 3.068209993836984, 'bull_rsi_os': 42, 'bull_rsi_ob': 87, 'bull_adx_thresh': 7.293906638697834, 'bull_atr_min_pct': 0.017072421394918408, 'bull_atr_max_pct': 0.013708330219092194, 'bull_tp_mult': 2.998933869965269, 'bull_tsl_mult': 0.5357510899299294, 'bull_time_stop': 220, 'bull_use_sma': False, 'bull_use_ema': False, 'bull_use_atr': True, 'bull_use_adx': False, 'bull_use_spike': False, 'bull_rsi_required': True, 'bear_strategy': 'mean_reversion', 'bear_bb_std_mult': 2.8556263372611927, 'bear_rsi_os': 54, 'bear_rsi_ob': 73, 'bear_adx_thresh': 29.466236926582802, 'bear_atr_min_pct': 0.01010221931477076, 'bear_atr_max_pct': 0.0710270978672765, 'bear_tp_mult': 2.232881818556985, 'bear_tsl_mult': 0.2528578572535748, 'bear_time_stop': 281, 'bear_use_sma': False, 'bear_use_ema': False, 'bear_use_atr': False, 'bear_use_adx': True, 'bear_use_spike': False, 'bear_rsi_required': True, 'sideways_strategy': 'breakout', 'sideways_bb_std_mult': 3.119193997129206, 'sideways_rsi_os': 36, 'sideways_rsi_ob': 63, 'sideways_adx_thresh': 21.456918512044815, 'sideways_atr_min_pct': 0.001859474902104913, 'sideways_atr_max_pct': 0.1433964878155294, 'sideways_tp_mult': 1.1984041848028426, 'sideways_tsl_mult': 0.9747179507314645, 'sideways_time_stop': 68, 'sideways_use_sma': False, 'sideways_use_ema': False, 'sideways_use_atr': True, 'sideways_use_adx': False, 'sideways_use_spike': False, 'sideways_rsi_required': True}.
