[I 2025-08-30 19:19:11,554] Trial 440 finished with values: [-1000000000.0, 1000000000.0] and parameters: {'p_sma': 5, 'p_std': 33, 'p_atr': 10, 'p_adx': 12, 'rsi_period': 26, 'ema1': 25, 'ema2': 33, 'slip_atr_k': 0.07948138110418893, 'slip_spread_k': 0.559139016211358, 'spread_hl_frac': 0.021632602611768324, 'bb_std_mult': 0.5570784526418784, 'rsi_os': 23, 'rsi_ob': 73, 'vol_spike': 0.1917420512722707, 'adx_thresh': 34.715763892615655, 'atr_min_pct': 0.01844274475130856, 'atr_max_pct': 0.09219815132495657, 'tp_mult': 2.257762621792645, 'tsl_mult': 0.8597955700321318, 'strategy': 'mean_reversion', 'time_stop': 193, 'use_sma': True, 'use_atr': False, 'use_adx': True, 'use_ema': False, 'use_spike': False, 'rsi_required': False, 'edge_k': 1.4294676642021893, 'edge_cap': 0.5116303940021402, 'bull_strategy': 'mean_reversion', 'bull_bb_std_mult': 1.4043875696522767, 'bull_rsi_os': 32, 'bull_rsi_ob': 47, 'bull_adx_thresh': 16.481722972313754, 'bull_atr_min_pct': 0.017306707111787792, 'bull_atr_max_pct': 0.12360575335458318, 'bull_tp_mult': 1.3468459895583496, 'bull_tsl_mult': 0.678194379407631, 'bull_time_stop': 177, 'bull_use_sma': False, 'bull_use_ema': True, 'bull_use_atr': True, 'bull_use_adx': False, 'bull_use_spike': False, 'bull_rsi_required': False, 'bear_strategy': 'breakout', 'bear_bb_std_mult': 3.156899931878295, 'bear_rsi_os': 34, 'bear_rsi_ob': 61, 'bear_adx_thresh': 16.611154251646614, 'bear_atr_min_pct': 0.01202957375985576, 'bear_atr_max_pct': 0.04539781974257318, 'bear_tp_mult': 2.638362906362998, 'bear_tsl_mult': 0.7512860522493655, 'bear_time_stop': 205, 'bear_use_sma': False, 'bear_use_ema': True, 'bear_use_atr': False, 'bear_use_adx': False, 'bear_use_spike': True, 'bear_rsi_required': False, 'sideways_strategy': 'breakout', 'sideways_bb_std_mult': 3.1105979202421743, 'sideways_rsi_os': 36, 'sideways_rsi_ob': 59, 'sideways_adx_thresh': 23.177141551926407, 'sideways_atr_min_pct': 0.0020373998690766033, 'sideways_atr_max_pct': 0.08867787377519253, 'sideways_tp_mult': 2.6406483995850647, 'sideways_tsl_mult': 0.9987863734913889, 'sideways_time_stop': 203, 'sideways_use_sma': True, 'sideways_use_ema': True, 'sideways_use_atr': True, 'sideways_use_adx': False, 'sideways_use_spike': True, 'sideways_rsi_required': True}.
[I 2025-08-30 19:19:45,339] Trial 444 finished with values: [-1000000000.0, 1000000000.0] and parameters: {'p_sma': 7, 'p_std': 12, 'p_atr': 10, 'p_adx': 20, 'rsi_period': 51, 'ema1': 25, 'ema2': 39, 'slip_atr_k': 0.011400792598738552, 'slip_spread_k': 0.01392189758861051, 'spread_hl_frac': 0.02150354700139639, 'bb_std_mult': 2.8590646907171244, 'rsi_os': 23, 'rsi_ob': 86, 'vol_spike': 0.19605082078630365, 'adx_thresh': 33.90519930685635, 'atr_min_pct': 0.005718743974163387, 'atr_max_pct': 0.0933035044251602, 'tp_mult': 2.6113696123566843, 'tsl_mult': 0.854061934631135, 'strategy': 'mean_reversion', 'time_stop': 170, 'use_sma': False, 'use_atr': True, 'use_adx': True, 'use_ema': False, 'use_spike': True, 'rsi_required': True, 'edge_k': 0.13786260924177313, 'edge_cap': 0.5653431177775013, 'bull_strategy': 'mean_reversion', 'bull_bb_std_mult': 2.2436774723194755, 'bull_rsi_os': 30, 'bull_rsi_ob': 91, 'bull_adx_thresh': 21.08281142819071, 'bull_atr_min_pct': 0.006075222701042273, 'bull_atr_max_pct': 0.017051367048212793, 'bull_tp_mult': 2.0862756064494485, 'bull_tsl_mult': 0.3128459300309473, 'bull_time_stop': 176, 'bull_use_sma': True, 'bull_use_ema': True, 'bull_use_atr': True, 'bull_use_adx': False, 'bull_use_spike': False, 'bull_rsi_required': True, 'bear_strategy': 'breakout', 'bear_bb_std_mult': 2.842290266227257, 'bear_rsi_os': 53, 'bear_rsi_ob': 71, 'bear_adx_thresh': 18.170236147699026, 'bear_atr_min_pct': 0.016314109343546147, 'bear_atr_max_pct': 0.033681644716767274, 'bear_tp_mult': 1.0514379328715049, 'bear_tsl_mult': 0.6106271958446459, 'bear_time_stop': 194, 'bear_use_sma': False, 'bear_use_ema': False, 'bear_use_atr': False, 'bear_use_adx': False, 'bear_use_spike': False, 'bear_rsi_required': True, 'sideways_strategy': 'breakout', 'sideways_bb_std_mult': 3.134509391229198, 'sideways_rsi_os': 33, 'sideways_rsi_ob': 92, 'sideways_adx_thresh': 27.584859222388765, 'sideways_atr_min_pct': 0.0030582136919885946, 'sideways_atr_max_pct': 0.14486686578281055, 'sideways_tp_mult': 1.2084972727017276, 'sideways_tsl_mult': 0.390866735640228, 'sideways_time_stop': 202, 'sideways_use_sma': False, 'sideways_use_ema': True, 'sideways_use_atr': True, 'sideways_use_adx': False, 'sideways_use_spike': False, 'sideways_rsi_required': True}.
[I 2025-08-30 19:19:45,340] Trial 443 finished with values: [-0.030297497018746067, 0.030207101512902054] and parameters: {'p_sma': 56, 'p_std': 9, 'p_atr': 10, 'p_adx': 20, 'rsi_period': 26, 'ema1': 25, 'ema2': 39, 'slip_atr_k': 0.0709128706811566, 'slip_spread_k': 0.007774080496281199, 'spread_hl_frac': 0.021314242285346088, 'bb_std_mult': 2.5486042970093705, 'rsi_os': 28, 'rsi_ob': 59, 'vol_spike': 0.2007388662523903, 'adx_thresh': 33.66724491607768, 'atr_min_pct': 0.022324313854233144, 'atr_max_pct': 0.09322724628570053, 'tp_mult': 2.3460212504138105, 'tsl_mult': 0.8289760239303638, 'strategy': 'mean_reversion', 'time_stop': 80, 'use_sma': False, 'use_atr': True, 'use_adx': True, 'use_ema': False, 'use_spike': True, 'rsi_required': True, 'edge_k': 1.4185150124030161, 'edge_cap': 0.8346297279403201, 'bull_strategy': 'mean_reversion', 'bull_bb_std_mult': 3.3128148797494132, 'bull_rsi_os': 14, 'bull_rsi_ob': 46, 'bull_adx_thresh': 20.368531344227755, 'bull_atr_min_pct': 0.001926782135247938, 'bull_atr_max_pct': 0.01725724198751062, 'bull_tp_mult': 2.8306816921955194, 'bull_tsl_mult': 0.5070144026144745, 'bull_time_stop': 177, 'bull_use_sma': True, 'bull_use_ema': True, 'bull_use_atr': True, 'bull_use_adx': False, 'bull_use_spike': False, 'bull_rsi_required': True, 'bear_strategy': 'breakout', 'bear_bb_std_mult': 2.8491543824270047, 'bear_rsi_os': 53, 'bear_rsi_ob': 60, 'bear_adx_thresh': 11.468328071856538, 'bear_atr_min_pct': 0.015161383719780751, 'bear_atr_max_pct': 0.0340584966615278, 'bear_tp_mult': 2.1227683272311983, 'bear_tsl_mult': 0.6111938635076094, 'bear_time_stop': 193, 'bear_use_sma': True, 'bear_use_ema': False, 'bear_use_atr': False, 'bear_use_adx': False, 'bear_use_spike': True, 'bear_rsi_required': True, 'sideways_strategy': 'breakout', 'sideways_bb_std_mult': 2.868068383013617, 'sideways_rsi_os': 47, 'sideways_rsi_ob': 57, 'sideways_adx_thresh': 21.972195148081244, 'sideways_atr_min_pct': 0.002885775078093068, 'sideways_atr_max_pct': 0.14550887146147826, 'sideways_tp_mult': 2.616455464792265, 'sideways_tsl_mult': 0.9584080661770444, 'sideways_time_stop': 247, 'sideways_use_sma': False, 'sideways_use_ema': True, 'sideways_use_atr': True, 'sideways_use_adx': False, 'sideways_use_spike': False, 'sideways_rsi_required': True}.
[I 2025-08-30 19:19:45,958] Trial 445 finished with values: [-1000000000.0, 1000000000.0] and parameters: {'p_sma': 7, 'p_std': 24, 'p_atr': 11, 'p_adx': 19, 'rsi_period': 21, 'ema1': 26, 'ema2': 16, 'slip_atr_k': 0.06913751557359878, 'slip_spread_k': 0.16760658904819672, 'spread_hl_frac': 0.03887456630043415, 'bb_std_mult': 2.2350104927147436, 'rsi_os': 46, 'rsi_ob': 85, 'vol_spike': 0.28167057042914606, 'adx_thresh': 33.793940135070386, 'atr_min_pct': 0.02524959624083825, 'atr_max_pct': 0.10081751811294981, 'tp_mult': 2.614498870602546, 'tsl_mult': 0.5004317128779989, 'strategy': 'mean_reversion', 'time_stop': 162, 'use_sma': False, 'use_atr': True, 'use_adx': False, 'use_ema': False, 'use_spike': True, 'rsi_required': True, 'edge_k': 0.12449315438293945, 'edge_cap': 0.9982959323245548, 'bull_strategy': 'mean_reversion', 'bull_bb_std_mult': 2.0449938334056994, 'bull_rsi_os': 44, 'bull_rsi_ob': 46, 'bull_adx_thresh': 31.528126843945163, 'bull_atr_min_pct': 0.014018087112382744, 'bull_atr_max_pct': 0.018401465131727614, 'bull_tp_mult': 2.8525749250264756, 'bull_tsl_mult': 0.5071476787607567, 'bull_time_stop': 247, 'bull_use_sma': True, 'bull_use_ema': True, 'bull_use_atr': False, 'bull_use_adx': False, 'bull_use_spike': False, 'bull_rsi_required': True, 'bear_strategy': 'breakout', 'bear_bb_std_mult': 2.872776436723086, 'bear_rsi_os': 7, 'bear_rsi_ob': 59, 'bear_adx_thresh': 13.759419005572695, 'bear_atr_min_pct': 0.016239527696427006, 'bear_atr_max_pct': 0.06936686001012536, 'bear_tp_mult': 2.833791268955797, 'bear_tsl_mult': 0.7694050864832205, 'bear_time_stop': 56, 'bear_use_sma': True, 'bear_use_ema': False, 'bear_use_atr': False, 'bear_use_adx': False, 'bear_use_spike': False, 'bear_rsi_required': True, 'sideways_strategy': 'mean_reversion', 'sideways_bb_std_mult': 0.752921787280606, 'sideways_rsi_os': 37, 'sideways_rsi_ob': 56, 'sideways_adx_thresh': 33.102080954834335, 'sideways_atr_min_pct': 0.0029193919573572164, 'sideways_atr_max_pct': 0.0735311294654144, 'sideways_tp_mult': 1.4397471778282618, 'sideways_tsl_mult': 0.7022586008524714, 'sideways_time_stop': 159, 'sideways_use_sma': False, 'sideways_use_ema': True, 'sideways_use_atr': False, 'sideways_use_adx': False, 'sideways_use_spike': False, 'sideways_rsi_required': True}.
[I 2025-08-30 19:19:45,958] Trial 442 finished with values: [-1000000000.0, 1000000000.0] and parameters: {'p_sma': 5, 'p_std': 9, 'p_atr': 25, 'p_adx': 20, 'rsi_period': 26, 'ema1': 25, 'ema2': 32, 'slip_atr_k': 0.03564910464177534, 'slip_spread_k': 0.5642704970434671, 'spread_hl_frac': 0.021859963110935538, 'bb_std_mult': 0.5098251859616683, 'rsi_os': 23, 'rsi_ob': 59, 'vol_spike': 0.25059305167849033, 'adx_thresh': 34.57784959715669, 'atr_min_pct': 0.018028761281369172, 'atr_max_pct': 0.09333647146028917, 'tp_mult': 2.946629589960073, 'tsl_mult': 0.8577629246522982, 'strategy': 'mean_reversion', 'time_stop': 193, 'use_sma': False, 'use_atr': True, 'use_adx': False, 'use_ema': False, 'use_spike': True, 'rsi_required': False, 'edge_k': 1.4206503469814562, 'edge_cap': 0.8342917301160755, 'bull_strategy': 'mean_reversion', 'bull_bb_std_mult': 3.3365576830596244, 'bull_rsi_os': 14, 'bull_rsi_ob': 69, 'bull_adx_thresh': 31.621319313001123, 'bull_atr_min_pct': 0.00604076572863735, 'bull_atr_max_pct': 0.11883973952179731, 'bull_tp_mult': 2.8339886840648747, 'bull_tsl_mult': 0.30948829414580736, 'bull_time_stop': 177, 'bull_use_sma': False, 'bull_use_ema': True, 'bull_use_atr': True, 'bull_use_adx': False, 'bull_use_spike': False, 'bull_rsi_required': True, 'bear_strategy': 'breakout', 'bear_bb_std_mult': 3.380829108657853, 'bear_rsi_os': 53, 'bear_rsi_ob': 59, 'bear_adx_thresh': 16.648861854889685, 'bear_atr_min_pct': 0.006085866392891258, 'bear_atr_max_pct': 0.04484518827315453, 'bear_tp_mult': 1.0670603576732922, 'bear_tsl_mult': 0.9593339826272052, 'bear_time_stop': 67, 'bear_use_sma': False, 'bear_use_ema': True, 'bear_use_atr': False, 'bear_use_adx': False, 'bear_use_spike': True, 'bear_rsi_required': False, 'sideways_strategy': 'mean_reversion', 'sideways_bb_std_mult': 3.244061298235974, 'sideways_rsi_os': 47, 'sideways_rsi_ob': 56, 'sideways_adx_thresh': 27.402830263038766, 'sideways_atr_min_pct': 0.0028880068265330697, 'sideways_atr_max_pct': 0.14679291496889915, 'sideways_tp_mult': 1.0548121291635686, 'sideways_tsl_mult': 0.3874738901369848, 'sideways_time_stop': 147, 'sideways_use_sma': False, 'sideways_use_ema': True, 'sideways_use_atr': True, 'sideways_use_adx': False, 'sideways_use_spike': False, 'sideways_rsi_required': True}.
[I 2025-08-30 19:19:46,717] Trial 446 finished with values: [-1000000000.0, 1000000000.0] and parameters: {'p_sma': 41, 'p_std': 31, 'p_atr': 25, 'p_adx': 19, 'rsi_period': 22, 'ema1': 26, 'ema2': 49, 'slip_atr_k': 0.0703127617491593, 'slip_spread_k': 0.1647903620518896, 'spread_hl_frac': 0.024681292585505103, 'bb_std_mult': 2.264095223480151, 'rsi_os': 51, 'rsi_ob': 83, 'vol_spike': 0.2827592266099513, 'adx_thresh': 32.61515938204146, 'atr_min_pct': 0.02505426389395976, 'atr_max_pct': 0.09931025689068743, 'tp_mult': 1.317073680019199, 'tsl_mult': 0.8842569967133505, 'strategy': 'mean_reversion', 'time_stop': 188, 'use_sma': False, 'use_atr': True, 'use_adx': False, 'use_ema': False, 'use_spike': True, 'rsi_required': False, 'edge_k': 1.7270864047680377, 'edge_cap': 0.5019712268831126, 'bull_strategy': 'mean_reversion', 'bull_bb_std_mult': 3.343461384932901, 'bull_rsi_os': 33, 'bull_rsi_ob': 58, 'bull_adx_thresh': 18.26636009619675, 'bull_atr_min_pct': 0.01364480662035408, 'bull_atr_max_pct': 0.10331207846304963, 'bull_tp_mult': 2.7244792167264618, 'bull_tsl_mult': 0.8741430040652063, 'bull_time_stop': 181, 'bull_use_sma': False, 'bull_use_ema': True, 'bull_use_atr': False, 'bull_use_adx': False, 'bull_use_spike': False, 'bull_rsi_required': True, 'bear_strategy': 'breakout', 'bear_bb_std_mult': 3.0300042524686215, 'bear_rsi_os': 48, 'bear_rsi_ob': 80, 'bear_adx_thresh': 21.967330420576943, 'bear_atr_min_pct': 0.02965241561835573, 'bear_atr_max_pct': 0.03125744203022922, 'bear_tp_mult': 2.017498571080057, 'bear_tsl_mult': 0.6899168420425057, 'bear_time_stop': 187, 'bear_use_sma': True, 'bear_use_ema': True, 'bear_use_atr': True, 'bear_use_adx': False, 'bear_use_spike': False, 'bear_rsi_required': True, 'sideways_strategy': 'mean_reversion', 'sideways_bb_std_mult': 1.6914892516402746, 'sideways_rsi_os': 38, 'sideways_rsi_ob': 60, 'sideways_adx_thresh': 33.12878270797111, 'sideways_atr_min_pct': 0.004463371868554437, 'sideways_atr_max_pct': 0.09677273034590073, 'sideways_tp_mult': 1.0514532570338944, 'sideways_tsl_mult': 0.3125453442070333, 'sideways_time_stop': 157, 'sideways_use_sma': False, 'sideways_use_ema': True, 'sideways_use_atr': False, 'sideways_use_adx': False, 'sideways_use_spike': False, 'sideways_rsi_required': True}.
[I 2025-08-30 19:20:19,627] Trial 447 finished with values: [-1000000000.0, 1000000000.0] and parameters: {'p_sma': 44, 'p_std': 36, 'p_atr': 11, 'p_adx': 19, 'rsi_period': 18, 'ema1': 26, 'ema2': 49, 'slip_atr_k': 0.12253709155648615, 'slip_spread_k': 0.84253185981448, 'spread_hl_frac': 0.024693229717147203, 'bb_std_mult': 0.5042746634363886, 'rsi_os': 19, 'rsi_ob': 83, 'vol_spike': 0.28175310788970487, 'adx_thresh': 32.23876734379134, 'atr_min_pct': 0.029258873349616497, 'atr_max_pct': 0.09953449511795985, 'tp_mult': 2.077385157531393, 'tsl_mult': 0.650566681022772, 'strategy': 'mean_reversion', 'time_stop': 5, 'use_sma': False, 'use_atr': True, 'use_adx': False, 'use_ema': False, 'use_spike': True, 'rsi_required': False, 'edge_k': 1.7412255179588723, 'edge_cap': 0.8093409743370743, 'bull_strategy': 'mean_reversion', 'bull_bb_std_mult': 3.3457894105887815, 'bull_rsi_os': 5, 'bull_rsi_ob': 80, 'bull_adx_thresh': 33.06750935217572, 'bull_atr_min_pct': 0.008766959098798342, 'bull_atr_max_pct': 0.10474191916892507, 'bull_tp_mult': 2.744562958900054, 'bull_tsl_mult': 0.7672130221388824, 'bull_time_stop': 171, 'bull_use_sma': False, 'bull_use_ema': True, 'bull_use_atr': False, 'bull_use_adx': False, 'bull_use_spike': False, 'bull_rsi_required': True, 'bear_strategy': 'breakout', 'bear_bb_std_mult': 2.9166712535137815, 'bear_rsi_os': 48, 'bear_rsi_ob': 80, 'bear_adx_thresh': 22.024381037293765, 'bear_atr_min_pct': 0.01573151646990001, 'bear_atr_max_pct': 0.1407880345313388, 'bear_tp_mult': 1.0102492687486762, 'bear_tsl_mult': 0.7717779922842752, 'bear_time_stop': 216, 'bear_use_sma': True, 'bear_use_ema': True, 'bear_use_atr': True, 'bear_use_adx': False, 'bear_use_spike': False, 'bear_rsi_required': True, 'sideways_strategy': 'mean_reversion', 'sideways_bb_std_mult': 3.184380067147351, 'sideways_rsi_os': 36, 'sideways_rsi_ob': 60, 'sideways_adx_thresh': 21.072012693283188, 'sideways_atr_min_pct': 0.0249174745245157, 'sideways_atr_max_pct': 0.10887966081136506, 'sideways_tp_mult': 1.4669846862043614, 'sideways_tsl_mult': 0.09073599824757267, 'sideways_time_stop': 158, 'sideways_use_sma': False, 'sideways_use_ema': True, 'sideways_use_atr': False, 'sideways_use_adx': False, 'sideways_use_spike': False, 'sideways_rsi_required': True}.
[I 2025-08-30 19:20:20,132] Trial 449 finished with values: [-1000000000.0, 1000000000.0] and parameters: {'p_sma': 10, 'p_std': 35, 'p_atr': 23, 'p_adx': 26, 'rsi_period': 18, 'ema1': 8, 'ema2': 27, 'slip_atr_k': 0.07548362522119141, 'slip_spread_k': 0.8399362030332942, 'spread_hl_frac': 0.023964526560008304, 'bb_std_mult': 2.2771698496885335, 'rsi_os': 51, 'rsi_ob': 65, 'vol_spike': 0.2697080979636648, 'adx_thresh': 32.606898880519005, 'atr_min_pct': 0.02371683938060838, 'atr_max_pct': 0.0974596059029927, 'tp_mult': 2.6673813188931588, 'tsl_mult': 0.18586364638036634, 'strategy': 'breakout', 'time_stop': 183, 'use_sma': False, 'use_atr': True, 'use_adx': True, 'use_ema': True, 'use_spike': True, 'rsi_required': False, 'edge_k': 1.7271202589746177, 'edge_cap': 0.5030657651933288, 'bull_strategy': 'breakout', 'bull_bb_std_mult': 2.4939483683356447, 'bull_rsi_os': 33, 'bull_rsi_ob': 55, 'bull_adx_thresh': 18.457708679296474, 'bull_atr_min_pct': 0.0010566836770057736, 'bull_atr_max_pct': 0.11542645902961085, 'bull_tp_mult': 1.6174231477069136, 'bull_tsl_mult': 0.7534044897898976, 'bull_time_stop': 112, 'bull_use_sma': False, 'bull_use_ema': True, 'bull_use_atr': False, 'bull_use_adx': True, 'bull_use_spike': True, 'bull_rsi_required': True, 'bear_strategy': 'breakout', 'bear_bb_std_mult': 3.288441315508412, 'bear_rsi_os': 51, 'bear_rsi_ob': 83, 'bear_adx_thresh': 21.869154138028197, 'bear_atr_min_pct': 0.015487819128893158, 'bear_atr_max_pct': 0.035808708046278406, 'bear_tp_mult': 2.6821214282938026, 'bear_tsl_mult': 0.840626769675253, 'bear_time_stop': 128, 'bear_use_sma': True, 'bear_use_ema': True, 'bear_use_atr': True, 'bear_use_adx': True, 'bear_use_spike': False, 'bear_rsi_required': True, 'sideways_strategy': 'breakout', 'sideways_bb_std_mult': 3.185279404788067, 'sideways_rsi_os': 38, 'sideways_rsi_ob': 46, 'sideways_adx_thresh': 21.201796903877632, 'sideways_atr_min_pct': 0.02991791939729606, 'sideways_atr_max_pct': 0.03990365010221851, 'sideways_tp_mult': 1.1148231848273613, 'sideways_tsl_mult': 0.3210057367434038, 'sideways_time_stop': 158, 'sideways_use_sma': False, 'sideways_use_ema': True, 'sideways_use_atr': False, 'sideways_use_adx': True, 'sideways_use_spike': False, 'sideways_rsi_required': False}.
[I 2025-08-30 19:20:20,172] Trial 448 finished with values: [-1000000000.0, 1000000000.0] and parameters: {'p_sma': 19, 'p_std': 36, 'p_atr': 23, 'p_adx': 26, 'rsi_period': 23, 'ema1': 27, 'ema2': 27, 'slip_atr_k': 0.08851973935546198, 'slip_spread_k': 0.09961277864949661, 'spread_hl_frac': 0.0051631292960115545, 'bb_std_mult': 1.4656112492982007, 'rsi_os': 51, 'rsi_ob': 83, 'vol_spike': 0.26967498435589826, 'adx_thresh': 32.450252455778696, 'atr_min_pct': 0.02902761096465826, 'atr_max_pct': 0.09826370884562294, 'tp_mult': 2.2994211993056504, 'tsl_mult': 0.8804205490165934, 'strategy': 'breakout', 'time_stop': 24, 'use_sma': False, 'use_atr': True, 'use_adx': True, 'use_ema': True, 'use_spike': True, 'rsi_required': False, 'edge_k': 0.17220457479104223, 'edge_cap': 0.5222218508114482, 'bull_strategy': 'breakout', 'bull_bb_std_mult': 3.128327340267275, 'bull_rsi_os': 33, 'bull_rsi_ob': 46, 'bull_adx_thresh': 18.57329735293047, 'bull_atr_min_pct': 0.016327234657158612, 'bull_atr_max_pct': 0.11421878813783286, 'bull_tp_mult': 1.0246483493958238, 'bull_tsl_mult': 0.5849973090124002, 'bull_time_stop': 170, 'bull_use_sma': False, 'bull_use_ema': True, 'bull_use_atr': False, 'bull_use_adx': True, 'bull_use_spike': True, 'bull_rsi_required': True, 'bear_strategy': 'breakout', 'bear_bb_std_mult': 1.8200916463771377, 'bear_rsi_os': 51, 'bear_rsi_ob': 54, 'bear_adx_thresh': 21.574657177478386, 'bear_atr_min_pct': 0.015451520441917334, 'bear_atr_max_pct': 0.09138037095909321, 'bear_tp_mult': 1.9041471391848608, 'bear_tsl_mult': 0.8398574741952932, 'bear_time_stop': 220, 'bear_use_sma': True, 'bear_use_ema': True, 'bear_use_atr': True, 'bear_use_adx': True, 'bear_use_spike': False, 'bear_rsi_required': True, 'sideways_strategy': 'breakout', 'sideways_bb_std_mult': 2.211213218451573, 'sideways_rsi_os': 31, 'sideways_rsi_ob': 60, 'sideways_adx_thresh': 21.191929211096486, 'sideways_atr_min_pct': 0.004313854468012508, 'sideways_atr_max_pct': 0.043054877187844766, 'sideways_tp_mult': 1.1148505522762207, 'sideways_tsl_mult': 0.8659836304655684, 'sideways_time_stop': 221, 'sideways_use_sma': False, 'sideways_use_ema': True, 'sideways_use_atr': False, 'sideways_use_adx': True, 'sideways_use_spike': False, 'sideways_rsi_required': False}.
