[I 2025-08-30 18:44:40,955] Trial 136 finished with values: [-1000000000.0, 1000000000.0] and parameters: {'p_sma': 6, 'p_std': 28, 'p_atr': 9, 'p_adx': 20, 'rsi_period': 56, 'ema1': 23, 'ema2': 34, 'slip_atr_k': 0.16009285199702455, 'slip_spread_k': 0.18095107291875634, 'spread_hl_frac': 0.04666013065729875, 'bb_std_mult': 2.208384872981307, 'rsi_os': 36, 'rsi_ob': 81, 'vol_spike': 0.25442567276725947, 'adx_thresh': 34.24928105972004, 'atr_min_pct': 0.02277638973715738, 'atr_max_pct': 0.09738470031764848, 'tp_mult': 2.1978108352395127, 'tsl_mult': 0.8633455347160086, 'strategy': 'mean_reversion', 'time_stop': 197, 'use_sma': False, 'use_atr': True, 'use_adx': True, 'use_ema': False, 'use_spike': True, 'rsi_required': False, 'edge_k': 0.8738627481130201, 'edge_cap': 0.5477410284967041, 'bull_strategy': 'mean_reversion', 'bull_bb_std_mult': 3.175698313633091, 'bull_rsi_os': 31, 'bull_rsi_ob': 64, 'bull_adx_thresh': 7.2580493128843635, 'bull_atr_min_pct': 0.0025337987254941017, 'bull_atr_max_pct': 0.03753038449907917, 'bull_tp_mult': 2.739326200552714, 'bull_tsl_mult': 0.4655983212151582, 'bull_time_stop': 277, 'bull_use_sma': False, 'bull_use_ema': True, 'bull_use_atr': True, 'bull_use_adx': False, 'bull_use_spike': False, 'bull_rsi_required': True, 'bear_strategy': 'breakout', 'bear_bb_std_mult': 2.5970269359252596, 'bear_rsi_os': 13, 'bear_rsi_ob': 95, 'bear_adx_thresh': 15.497620983150279, 'bear_atr_min_pct': 0.015337091332181894, 'bear_atr_max_pct': 0.020283977103535605, 'bear_tp_mult': 2.710886074896906, 'bear_tsl_mult': 0.29533189844056085, 'bear_time_stop': 16, 'bear_use_sma': True, 'bear_use_ema': True, 'bear_use_atr': False, 'bear_use_adx': False, 'bear_use_spike': False, 'bear_rsi_required': True, 'sideways_strategy': 'breakout', 'sideways_bb_std_mult': 1.4392164564167371, 'sideways_rsi_os': 33, 'sideways_rsi_ob': 93, 'sideways_adx_thresh': 18.969581507269567, 'sideways_atr_min_pct': 0.0027478029857076814, 'sideways_atr_max_pct': 0.011541656193391717, 'sideways_tp_mult': 1.8625262977083041, 'sideways_tsl_mult': 0.4982677752747354, 'sideways_time_stop': 165, 'sideways_use_sma': False, 'sideways_use_ema': False, 'sideways_use_atr': True, 'sideways_use_adx': True, 'sideways_use_spike': False, 'sideways_rsi_required': True}.
[I 2025-08-30 18:44:41,264] Trial 137 finished with values: [-1000000000.0, 1000000000.0] and parameters: {'p_sma': 6, 'p_std': 27, 'p_atr': 9, 'p_adx': 7, 'rsi_period': 66, 'ema1': 23, 'ema2': 30, 'slip_atr_k': 0.08853125038083243, 'slip_spread_k': 0.16569016529993852, 'spread_hl_frac': 0.023280001674927317, 'bb_std_mult': 2.2497571726412553, 'rsi_os': 26, 'rsi_ob': 81, 'vol_spike': 0.25398762689936283, 'adx_thresh': 34.32940348750825, 'atr_min_pct': 0.005946712356296959, 'atr_max_pct': 0.09794302427179283, 'tp_mult': 2.3454500766538526, 'tsl_mult': 0.8708248542009736, 'strategy': 'mean_reversion', 'time_stop': 193, 'use_sma': False, 'use_atr': True, 'use_adx': True, 'use_ema': False, 'use_spike': True, 'rsi_required': False, 'edge_k': 1.8182179014047293, 'edge_cap': 0.5600906292552859, 'bull_strategy': 'mean_reversion', 'bull_bb_std_mult': 1.0924414196351804, 'bull_rsi_os': 30, 'bull_rsi_ob': 65, 'bull_adx_thresh': 9.9665868117667, 'bull_atr_min_pct': 0.01297240770165188, 'bull_atr_max_pct': 0.11946553764132345, 'bull_tp_mult': 2.741519680012849, 'bull_tsl_mult': 0.5491193983676014, 'bull_time_stop': 243, 'bull_use_sma': False, 'bull_use_ema': True, 'bull_use_atr': True, 'bull_use_adx': False, 'bull_use_spike': False, 'bull_rsi_required': True, 'bear_strategy': 'breakout', 'bear_bb_std_mult': 3.3116854857413704, 'bear_rsi_os': 11, 'bear_rsi_ob': 94, 'bear_adx_thresh': 15.692885729404082, 'bear_atr_min_pct': 0.015209424314842962, 'bear_atr_max_pct': 0.11496598051695024, 'bear_tp_mult': 2.705076734857288, 'bear_tsl_mult': 0.9649696864177179, 'bear_time_stop': 116, 'bear_use_sma': False, 'bear_use_ema': True, 'bear_use_atr': False, 'bear_use_adx': False, 'bear_use_spike': False, 'bear_rsi_required': True, 'sideways_strategy': 'breakout', 'sideways_bb_std_mult': 1.198523753585914, 'sideways_rsi_os': 39, 'sideways_rsi_ob': 58, 'sideways_adx_thresh': 18.947944747787584, 'sideways_atr_min_pct': 0.0027129640231619598, 'sideways_atr_max_pct': 0.14383931589546667, 'sideways_tp_mult': 1.1965320137144002, 'sideways_tsl_mult': 0.983858384943921, 'sideways_time_stop': 164, 'sideways_use_sma': False, 'sideways_use_ema': True, 'sideways_use_atr': False, 'sideways_use_adx': False, 'sideways_use_spike': False, 'sideways_rsi_required': True}.
[I 2025-08-30 18:44:41,348] Trial 135 finished with values: [-1000000000.0, 1000000000.0] and parameters: {'p_sma': 6, 'p_std': 27, 'p_atr': 9, 'p_adx': 7, 'rsi_period': 26, 'ema1': 22, 'ema2': 30, 'slip_atr_k': 0.10032990704198859, 'slip_spread_k': 0.16955944506755788, 'spread_hl_frac': 0.025578158710445966, 'bb_std_mult': 1.949175411451023, 'rsi_os': 37, 'rsi_ob': 81, 'vol_spike': 0.255344160353112, 'adx_thresh': 34.34754543458937, 'atr_min_pct': 0.0227529169983404, 'atr_max_pct': 0.097987921776807, 'tp_mult': 1.1027591079152312, 'tsl_mult': 0.860718168654855, 'strategy': 'mean_reversion', 'time_stop': 199, 'use_sma': False, 'use_atr': True, 'use_adx': False, 'use_ema': False, 'use_spike': True, 'rsi_required': False, 'edge_k': 1.0390726582786707, 'edge_cap': 0.14670121543724413, 'bull_strategy': 'mean_reversion', 'bull_bb_std_mult': 3.1801463818975932, 'bull_rsi_os': 30, 'bull_rsi_ob': 64, 'bull_adx_thresh': 18.51436333471796, 'bull_atr_min_pct': 0.0023141484465760472, 'bull_atr_max_pct': 0.11955163563434835, 'bull_tp_mult': 2.587371329246121, 'bull_tsl_mult': 0.6302707264356608, 'bull_time_stop': 173, 'bull_use_sma': False, 'bull_use_ema': True, 'bull_use_atr': True, 'bull_use_adx': False, 'bull_use_spike': False, 'bull_rsi_required': True, 'bear_strategy': 'breakout', 'bear_bb_std_mult': 1.0269693968372624, 'bear_rsi_os': 52, 'bear_rsi_ob': 74, 'bear_adx_thresh': 12.203345128677725, 'bear_atr_min_pct': 0.015268763224652773, 'bear_atr_max_pct': 0.041924884861871514, 'bear_tp_mult': 2.7116232015026553, 'bear_tsl_mult': 0.8159718802728707, 'bear_time_stop': 195, 'bear_use_sma': False, 'bear_use_ema': True, 'bear_use_atr': False, 'bear_use_adx': False, 'bear_use_spike': True, 'bear_rsi_required': True, 'sideways_strategy': 'breakout', 'sideways_bb_std_mult': 1.0323377369202373, 'sideways_rsi_os': 31, 'sideways_rsi_ob': 60, 'sideways_adx_thresh': 20.167977906547016, 'sideways_atr_min_pct': 0.0027542744156526053, 'sideways_atr_max_pct': 0.01118652046454345, 'sideways_tp_mult': 1.8265685859366665, 'sideways_tsl_mult': 0.49573965876736714, 'sideways_time_stop': 155, 'sideways_use_sma': False, 'sideways_use_ema': True, 'sideways_use_atr': True, 'sideways_use_adx': False, 'sideways_use_spike': False, 'sideways_rsi_required': True}.
[I 2025-08-30 18:44:41,570] Trial 138 finished with values: [-1000000000.0, 1000000000.0] and parameters: {'p_sma': 9, 'p_std': 22, 'p_atr': 9, 'p_adx': 19, 'rsi_period': 21, 'ema1': 18, 'ema2': 34, 'slip_atr_k': 0.08185659843615145, 'slip_spread_k': 0.17540617320158527, 'spread_hl_frac': 0.02567383619988346, 'bb_std_mult': 2.215413859173437, 'rsi_os': 55, 'rsi_ob': 82, 'vol_spike': 0.2750270748299657, 'adx_thresh': 32.7332751462563, 'atr_min_pct': 0.006364105777123355, 'atr_max_pct': 0.12210509704560109, 'tp_mult': 1.7706276045506346, 'tsl_mult': 0.8714650550722502, 'strategy': 'mean_reversion', 'time_stop': 199, 'use_sma': False, 'use_atr': False, 'use_adx': True, 'use_ema': False, 'use_spike': False, 'rsi_required': False, 'edge_k': 1.9997607904793884, 'edge_cap': 0.488578921797942, 'bull_strategy': 'mean_reversion', 'bull_bb_std_mult': 3.3797498286882566, 'bull_rsi_os': 30, 'bull_rsi_ob': 85, 'bull_adx_thresh': 18.523210127947657, 'bull_atr_min_pct': 0.003946037951196749, 'bull_atr_max_pct': 0.11863225864490495, 'bull_tp_mult': 1.797648670000883, 'bull_tsl_mult': 0.579135239527894, 'bull_time_stop': 178, 'bull_use_sma': False, 'bull_use_ema': True, 'bull_use_atr': False, 'bull_use_adx': False, 'bull_use_spike': True, 'bull_rsi_required': True, 'bear_strategy': 'breakout', 'bear_bb_std_mult': 3.3135197938285947, 'bear_rsi_os': 11, 'bear_rsi_ob': 74, 'bear_adx_thresh': 12.104162258112172, 'bear_atr_min_pct': 0.014372453253056361, 'bear_atr_max_pct': 0.04076386256585094, 'bear_tp_mult': 2.6301591172597374, 'bear_tsl_mult': 0.8669202561988247, 'bear_time_stop': 15, 'bear_use_sma': True, 'bear_use_ema': True, 'bear_use_atr': False, 'bear_use_adx': False, 'bear_use_spike': True, 'bear_rsi_required': True, 'sideways_strategy': 'breakout', 'sideways_bb_std_mult': 1.5465311987805055, 'sideways_rsi_os': 31, 'sideways_rsi_ob': 58, 'sideways_adx_thresh': 22.728811342336225, 'sideways_atr_min_pct': 0.003692493809096976, 'sideways_atr_max_pct': 0.09021849992976518, 'sideways_tp_mult': 1.1406696688893216, 'sideways_tsl_mult': 0.9643961239044948, 'sideways_time_stop': 154, 'sideways_use_sma': True, 'sideways_use_ema': True, 'sideways_use_atr': False, 'sideways_use_adx': False, 'sideways_use_spike': False, 'sideways_rsi_required': True}.
[I 2025-08-30 18:45:14,826] Trial 139 finished with values: [-1000000000.0, 1000000000.0] and parameters: {'p_sma': 9, 'p_std': 31, 'p_atr': 8, 'p_adx': 19, 'rsi_period': 15, 'ema1': 6, 'ema2': 30, 'slip_atr_k': 0.08299800217984174, 'slip_spread_k': 0.15803409345670869, 'spread_hl_frac': 0.042605437000163844, 'bb_std_mult': 2.759160360097764, 'rsi_os': 38, 'rsi_ob': 79, 'vol_spike': 0.2742943547527578, 'adx_thresh': 32.845630825422575, 'atr_min_pct': 0.019995916765403174, 'atr_max_pct': 0.08848052604028692, 'tp_mult': 1.1676677630884749, 'tsl_mult': 0.7855186316829742, 'strategy': 'mean_reversion', 'time_stop': 160, 'use_sma': False, 'use_atr': False, 'use_adx': False, 'use_ema': False, 'use_spike': False, 'rsi_required': False, 'edge_k': 1.4284251205076681, 'edge_cap': 0.48607532071975934, 'bull_strategy': 'mean_reversion', 'bull_bb_std_mult': 3.384901313681952, 'bull_rsi_os': 30, 'bull_rsi_ob': 48, 'bull_adx_thresh': 26.15202887003549, 'bull_atr_min_pct': 0.014379339724818025, 'bull_atr_max_pct': 0.12003972613608384, 'bull_tp_mult': 2.821436531689827, 'bull_tsl_mult': 0.6309364817380732, 'bull_time_stop': 242, 'bull_use_sma': True, 'bull_use_ema': True, 'bull_use_atr': False, 'bull_use_adx': False, 'bull_use_spike': True, 'bull_rsi_required': False, 'bear_strategy': 'breakout', 'bear_bb_std_mult': 3.2980392234449276, 'bear_rsi_os': 46, 'bear_rsi_ob': 93, 'bear_adx_thresh': 30.905760497958255, 'bear_atr_min_pct': 0.016374691391750785, 'bear_atr_max_pct': 0.030838195736857775, 'bear_tp_mult': 2.001677603848084, 'bear_tsl_mult': 0.9648528622421535, 'bear_time_stop': 149, 'bear_use_sma': True, 'bear_use_ema': True, 'bear_use_atr': False, 'bear_use_adx': False, 'bear_use_spike': True, 'bear_rsi_required': True, 'sideways_strategy': 'breakout', 'sideways_bb_std_mult': 2.388643101902899, 'sideways_rsi_os': 31, 'sideways_rsi_ob': 58, 'sideways_adx_thresh': 22.265437832326846, 'sideways_atr_min_pct': 0.018199138365121315, 'sideways_atr_max_pct': 0.07056135853721864, 'sideways_tp_mult': 1.1985258264933716, 'sideways_tsl_mult': 0.999692901510472, 'sideways_time_stop': 154, 'sideways_use_sma': True, 'sideways_use_ema': True, 'sideways_use_atr': False, 'sideways_use_adx': False, 'sideways_use_spike': False, 'sideways_rsi_required': True}.
[I 2025-08-30 18:45:15,012] Trial 142 finished with values: [-1000000000.0, 1000000000.0] and parameters: {'p_sma': 8, 'p_std': 31, 'p_atr': 12, 'p_adx': 9, 'rsi_period': 9, 'ema1': 5, 'ema2': 20, 'slip_atr_k': 0.04766084056574438, 'slip_spread_k': 0.11741072549587432, 'spread_hl_frac': 0.01716916791566761, 'bb_std_mult': 3.599020197087188, 'rsi_os': 31, 'rsi_ob': 79, 'vol_spike': 0.2700896605634755, 'adx_thresh': 33.65960990449215, 'atr_min_pct': 0.025980385232838594, 'atr_max_pct': 0.08746877579468146, 'tp_mult': 1.5099354691580622, 'tsl_mult': 0.31866490237211215, 'strategy': 'mean_reversion', 'time_stop': 185, 'use_sma': True, 'use_atr': False, 'use_adx': False, 'use_ema': False, 'use_spike': False, 'rsi_required': True, 'edge_k': 1.442791599422691, 'edge_cap': 0.6997944933419928, 'bull_strategy': 'breakout', 'bull_bb_std_mult': 2.8055036034115943, 'bull_rsi_os': 26, 'bull_rsi_ob': 47, 'bull_adx_thresh': 26.148064836472603, 'bull_atr_min_pct': 0.028970492816932047, 'bull_atr_max_pct': 0.020030683615519344, 'bull_tp_mult': 2.7980625934045116, 'bull_tsl_mult': 0.19832811963202707, 'bull_time_stop': 209, 'bull_use_sma': True, 'bull_use_ema': True, 'bull_use_atr': False, 'bull_use_adx': True, 'bull_use_spike': True, 'bull_rsi_required': False, 'bear_strategy': 'mean_reversion', 'bear_bb_std_mult': 3.014200264933246, 'bear_rsi_os': 47, 'bear_rsi_ob': 70, 'bear_adx_thresh': 17.1317404232434, 'bear_atr_min_pct': 0.0291989979212232, 'bear_atr_max_pct': 0.06544765308968652, 'bear_tp_mult': 1.866327563558624, 'bear_tsl_mult': 0.9048812087834432, 'bear_time_stop': 298, 'bear_use_sma': True, 'bear_use_ema': False, 'bear_use_atr': False, 'bear_use_adx': False, 'bear_use_spike': False, 'bear_rsi_required': True, 'sideways_strategy': 'mean_reversion', 'sideways_bb_std_mult': 3.088234303435603, 'sideways_rsi_os': 38, 'sideways_rsi_ob': 62, 'sideways_adx_thresh': 22.20173022087067, 'sideways_atr_min_pct': 0.0008328856334434153, 'sideways_atr_max_pct': 0.13200367253422762, 'sideways_tp_mult': 1.0683725942139584, 'sideways_tsl_mult': 0.9986067246706134, 'sideways_time_stop': 127, 'sideways_use_sma': True, 'sideways_use_ema': True, 'sideways_use_atr': True, 'sideways_use_adx': False, 'sideways_use_spike': False, 'sideways_rsi_required': True}.
[I 2025-08-30 18:45:15,031] Trial 140 finished with values: [-0.02636671918825173, 0.0262697311574952] and parameters: {'p_sma': 9, 'p_std': 31, 'p_atr': 28, 'p_adx': 15, 'rsi_period': 20, 'ema1': 5, 'ema2': 20, 'slip_atr_k': 0.08278800237266569, 'slip_spread_k': 0.435803583244592, 'spread_hl_frac': 0.02557007921773646, 'bb_std_mult': 0.9147796830578196, 'rsi_os': 38, 'rsi_ob': 86, 'vol_spike': 0.0004521693064613308, 'adx_thresh': 33.16563104730835, 'atr_min_pct': 0.003415957447302975, 'atr_max_pct': 0.05778867734755544, 'tp_mult': 2.11157721120613, 'tsl_mult': 0.3294197621098939, 'strategy': 'mean_reversion', 'time_stop': 183, 'use_sma': False, 'use_atr': False, 'use_adx': False, 'use_ema': False, 'use_spike': False, 'rsi_required': True, 'edge_k': 1.5296490449930038, 'edge_cap': 0.6917720909866664, 'bull_strategy': 'mean_reversion', 'bull_bb_std_mult': 3.3550674510753975, 'bull_rsi_os': 29, 'bull_rsi_ob': 47, 'bull_adx_thresh': 26.090445981321167, 'bull_atr_min_pct': 0.00385581331401978, 'bull_atr_max_pct': 0.12805016739605968, 'bull_tp_mult': 1.7885635897011216, 'bull_tsl_mult': 0.6274936777300014, 'bull_time_stop': 177, 'bull_use_sma': True, 'bull_use_ema': True, 'bull_use_atr': False, 'bull_use_adx': True, 'bull_use_spike': True, 'bull_rsi_required': False, 'bear_strategy': 'breakout', 'bear_bb_std_mult': 2.3212578863724516, 'bear_rsi_os': 54, 'bear_rsi_ob': 58, 'bear_adx_thresh': 12.326899372308588, 'bear_atr_min_pct': 0.016233725392278936, 'bear_atr_max_pct': 0.04062098247185203, 'bear_tp_mult': 2.6116829696346087, 'bear_tsl_mult': 0.8533942340515859, 'bear_time_stop': 222, 'bear_use_sma': True, 'bear_use_ema': True, 'bear_use_atr': False, 'bear_use_adx': False, 'bear_use_spike': True, 'bear_rsi_required': True, 'sideways_strategy': 'breakout', 'sideways_bb_std_mult': 3.0668155987709085, 'sideways_rsi_os': 31, 'sideways_rsi_ob': 62, 'sideways_adx_thresh': 22.27427332597395, 'sideways_atr_min_pct': 0.0010634570415493337, 'sideways_atr_max_pct': 0.13119663229747347, 'sideways_tp_mult': 1.134923833233335, 'sideways_tsl_mult': 0.35873263040888503, 'sideways_time_stop': 153, 'sideways_use_sma': True, 'sideways_use_ema': True, 'sideways_use_atr': True, 'sideways_use_adx': False, 'sideways_use_spike': False, 'sideways_rsi_required': True}.
[I 2025-08-30 18:45:15,163] Trial 141 finished with values: [-1000000000.0, 1000000000.0] and parameters: {'p_sma': 8, 'p_std': 31, 'p_atr': 28, 'p_adx': 26, 'rsi_period': 21, 'ema1': 18, 'ema2': 36, 'slip_atr_k': 0.08336680036351622, 'slip_spread_k': 0.13007535397177453, 'spread_hl_frac': 0.017166168445343008, 'bb_std_mult': 2.0557099069403506, 'rsi_os': 32, 'rsi_ob': 89, 'vol_spike': 0.27390346011353267, 'adx_thresh': 6.827542563460158, 'atr_min_pct': 0.02600634584373754, 'atr_max_pct': 0.14837183037926027, 'tp_mult': 1.7062272418975044, 'tsl_mult': 0.9093276206036285, 'strategy': 'mean_reversion', 'time_stop': 66, 'use_sma': True, 'use_atr': False, 'use_adx': True, 'use_ema': False, 'use_spike': False, 'rsi_required': True, 'edge_k': 1.528940458464118, 'edge_cap': 0.5106714300468475, 'bull_strategy': 'mean_reversion', 'bull_bb_std_mult': 2.9114336781339762, 'bull_rsi_os': 35, 'bull_rsi_ob': 47, 'bull_adx_thresh': 26.356081082703025, 'bull_atr_min_pct': 0.014671883906043239, 'bull_atr_max_pct': 0.01826875080395378, 'bull_tp_mult': 1.0464919420081038, 'bull_tsl_mult': 0.5795620030579364, 'bull_time_stop': 117, 'bull_use_sma': True, 'bull_use_ema': True, 'bull_use_atr': False, 'bull_use_adx': True, 'bull_use_spike': True, 'bull_rsi_required': False, 'bear_strategy': 'mean_reversion', 'bear_bb_std_mult': 2.9585343205785075, 'bear_rsi_os': 46, 'bear_rsi_ob': 80, 'bear_adx_thresh': 11.006399332949416, 'bear_atr_min_pct': 0.016255489613774432, 'bear_atr_max_pct': 0.03205562023758108, 'bear_tp_mult': 2.6025855623025578, 'bear_tsl_mult': 0.8667185601272738, 'bear_time_stop': 222, 'bear_use_sma': True, 'bear_use_ema': True, 'bear_use_atr': False, 'bear_use_adx': False, 'bear_use_spike': False, 'bear_rsi_required': True, 'sideways_strategy': 'breakout', 'sideways_bb_std_mult': 3.0780798095675825, 'sideways_rsi_os': 34, 'sideways_rsi_ob': 56, 'sideways_adx_thresh': 21.913042609827954, 'sideways_atr_min_pct': 0.00374218832393281, 'sideways_atr_max_pct': 0.13076823155334732, 'sideways_tp_mult': 1.1406082550746544, 'sideways_tsl_mult': 0.2149507813501172, 'sideways_time_stop': 151, 'sideways_use_sma': True, 'sideways_use_ema': True, 'sideways_use_atr': False, 'sideways_use_adx': False, 'sideways_use_spike': False, 'sideways_rsi_required': True}.
[I 2025-08-30 18:45:48,554] Trial 143 finished with values: [-0.07019109752733332, 0.07014121930888663] and parameters: {'p_sma': 7, 'p_std': 36, 'p_atr': 28, 'p_adx': 9, 'rsi_period': 7, 'ema1': 24, 'ema2': 26, 'slip_atr_k': 0.00916629520645626, 'slip_spread_k': 0.11576914522509431, 'spread_hl_frac': 0.020990551819439287, 'bb_std_mult': 2.127851556752477, 'rsi_os': 42, 'rsi_ob': 86, 'vol_spike': 0.2897265112819675, 'adx_thresh': 33.49398026025512, 'atr_min_pct': 0.0115927532887618, 'atr_max_pct': 0.04041447738565078, 'tp_mult': 1.5086959785284597, 'tsl_mult': 0.39080297754723026, 'strategy': 'mean_reversion', 'time_stop': 63, 'use_sma': True, 'use_atr': True, 'use_adx': True, 'use_ema': False, 'use_spike': True, 'rsi_required': True, 'edge_k': 0.1617699099359025, 'edge_cap': 0.19912311204832733, 'bull_strategy': 'breakout', 'bull_bb_std_mult': 2.905767232134651, 'bull_rsi_os': 10, 'bull_rsi_ob': 81, 'bull_adx_thresh': 8.427575555691634, 'bull_atr_min_pct': 0.009540995127625213, 'bull_atr_max_pct': 0.09356306592062612, 'bull_tp_mult': 1.2660176941256882, 'bull_tsl_mult': 0.6037766256266985, 'bull_time_stop': 208, 'bull_use_sma': True, 'bull_use_ema': True, 'bull_use_atr': True, 'bull_use_adx': True, 'bull_use_spike': False, 'bull_rsi_required': False, 'bear_strategy': 'mean_reversion', 'bear_bb_std_mult': 3.15615124894342, 'bear_rsi_os': 45, 'bear_rsi_ob': 59, 'bear_adx_thresh': 27.29770964604715, 'bear_atr_min_pct': 0.01346006715489018, 'bear_atr_max_pct': 0.06678398419687454, 'bear_tp_mult': 2.807470352244065, 'bear_tsl_mult': 0.901650737194794, 'bear_time_stop': 222, 'bear_use_sma': True, 'bear_use_ema': False, 'bear_use_atr': False, 'bear_use_adx': False, 'bear_use_spike': False, 'bear_rsi_required': True, 'sideways_strategy': 'mean_reversion', 'sideways_bb_std_mult': 3.0732117546743525, 'sideways_rsi_os': 38, 'sideways_rsi_ob': 62, 'sideways_adx_thresh': 23.604153992286896, 'sideways_atr_min_pct': 0.0008056735528928704, 'sideways_atr_max_pct': 0.13143480735975313, 'sideways_tp_mult': 1.3923388543119923, 'sideways_tsl_mult': 0.9198114071927928, 'sideways_time_stop': 139, 'sideways_use_sma': False, 'sideways_use_ema': False, 'sideways_use_atr': True, 'sideways_use_adx': True, 'sideways_use_spike': False, 'sideways_rsi_required': True}.
