[I 2025-08-30 19:31:38,161] Trial 550 finished with values: [-1000000000.0, 1000000000.0] and parameters: {'p_sma': 35, 'p_std': 32, 'p_atr': 24, 'p_adx': 24, 'rsi_period': 25, 'ema1': 26, 'ema2': 21, 'slip_atr_k': 0.06555791494196893, 'slip_spread_k': 0.17718820140964264, 'spread_hl_frac': 0.02368925637467855, 'bb_std_mult': 2.647611814975724, 'rsi_os': 14, 'rsi_ob': 45, 'vol_spike': 0.14827846171824688, 'adx_thresh': 12.165916708417264, 'atr_min_pct': 0.02424019181584141, 'atr_max_pct': 0.0877071344586004, 'tp_mult': 2.0351599003650813, 'tsl_mult': 0.8090958593877335, 'strategy': 'mean_reversion', 'time_stop': 236, 'use_sma': True, 'use_atr': True, 'use_adx': True, 'use_ema': False, 'use_spike': True, 'rsi_required': False, 'edge_k': 1.1652760056454263, 'edge_cap': 0.0959995201017253, 'bull_strategy': 'breakout', 'bull_bb_std_mult': 3.439783360136217, 'bull_rsi_os': 37, 'bull_rsi_ob': 45, 'bull_adx_thresh': 14.983244160940863, 'bull_atr_min_pct': 0.02566501868504016, 'bull_atr_max_pct': 0.057121268785715815, 'bull_tp_mult': 2.849800081282022, 'bull_tsl_mult': 0.27941265863775167, 'bull_time_stop': 187, 'bull_use_sma': False, 'bull_use_ema': True, 'bull_use_atr': True, 'bull_use_adx': False, 'bull_use_spike': False, 'bull_rsi_required': False, 'bear_strategy': 'breakout', 'bear_bb_std_mult': 2.203280390508215, 'bear_rsi_os': 51, 'bear_rsi_ob': 74, 'bear_adx_thresh': 17.729040411830013, 'bear_atr_min_pct': 0.010094077786672036, 'bear_atr_max_pct': 0.01008930089087362, 'bear_tp_mult': 2.74462894472429, 'bear_tsl_mult': 0.7981715600273412, 'bear_time_stop': 23, 'bear_use_sma': True, 'bear_use_ema': True, 'bear_use_atr': False, 'bear_use_adx': False, 'bear_use_spike': True, 'bear_rsi_required': True, 'sideways_strategy': 'breakout', 'sideways_bb_std_mult': 3.165371985453891, 'sideways_rsi_os': 36, 'sideways_rsi_ob': 58, 'sideways_adx_thresh': 22.25247192426295, 'sideways_atr_min_pct': 0.02199524932994267, 'sideways_atr_max_pct': 0.14311399959054652, 'sideways_tp_mult': 1.1424684591573255, 'sideways_tsl_mult': 0.05434955412055614, 'sideways_time_stop': 101, 'sideways_use_sma': True, 'sideways_use_ema': True, 'sideways_use_atr': True, 'sideways_use_adx': True, 'sideways_use_spike': False, 'sideways_rsi_required': True}.
[I 2025-08-30 19:31:47,774] Trial 553 finished with values: [-1000000000.0, 1000000000.0] and parameters: {'p_sma': 7, 'p_std': 32, 'p_atr': 10, 'p_adx': 19, 'rsi_period': 12, 'ema1': 25, 'ema2': 10, 'slip_atr_k': 0.07296180889436171, 'slip_spread_k': 0.4652621129518236, 'spread_hl_frac': 0.02628017427619694, 'bb_std_mult': 2.145547776751407, 'rsi_os': 52, 'rsi_ob': 49, 'vol_spike': 0.256713914519958, 'adx_thresh': 32.706154985835184, 'atr_min_pct': 0.0089044542521495, 'atr_max_pct': 0.040667338589240314, 'tp_mult': 2.72807194163775, 'tsl_mult': 0.7137028203986104, 'strategy': 'mean_reversion', 'time_stop': 188, 'use_sma': True, 'use_atr': False, 'use_adx': True, 'use_ema': False, 'use_spike': True, 'rsi_required': False, 'edge_k': 0.18382695665013832, 'edge_cap': 0.8514365286282084, 'bull_strategy': 'breakout', 'bull_bb_std_mult': 3.12901691103971, 'bull_rsi_os': 31, 'bull_rsi_ob': 46, 'bull_adx_thresh': 18.398652130322947, 'bull_atr_min_pct': 0.0013722855483060568, 'bull_atr_max_pct': 0.10138891969591057, 'bull_tp_mult': 1.1569715145578265, 'bull_tsl_mult': 0.5323244606824333, 'bull_time_stop': 15, 'bull_use_sma': False, 'bull_use_ema': False, 'bull_use_atr': True, 'bull_use_adx': False, 'bull_use_spike': True, 'bull_rsi_required': True, 'bear_strategy': 'breakout', 'bear_bb_std_mult': 2.907301079657614, 'bear_rsi_os': 40, 'bear_rsi_ob': 84, 'bear_adx_thresh': 34.209248576336606, 'bear_atr_min_pct': 0.015079152643640603, 'bear_atr_max_pct': 0.03813316174193488, 'bear_tp_mult': 2.8132330216738444, 'bear_tsl_mult': 0.7306452671185011, 'bear_time_stop': 13, 'bear_use_sma': True, 'bear_use_ema': False, 'bear_use_atr': True, 'bear_use_adx': False, 'bear_use_spike': False, 'bear_rsi_required': True, 'sideways_strategy': 'breakout', 'sideways_bb_std_mult': 2.8698676019410447, 'sideways_rsi_os': 34, 'sideways_rsi_ob': 88, 'sideways_adx_thresh': 19.3798466505609, 'sideways_atr_min_pct': 0.0005907760771647274, 'sideways_atr_max_pct': 0.14569066280761056, 'sideways_tp_mult': 1.082764731283631, 'sideways_tsl_mult': 0.9596991508875939, 'sideways_time_stop': 179, 'sideways_use_sma': False, 'sideways_use_ema': True, 'sideways_use_atr': True, 'sideways_use_adx': True, 'sideways_use_spike': False, 'sideways_rsi_required': True}.
[I 2025-08-30 19:31:51,984] Trial 549 finished with values: [-1000000000.0, 1000000000.0] and parameters: {'p_sma': 8, 'p_std': 28, 'p_atr': 10, 'p_adx': 20, 'rsi_period': 35, 'ema1': 25, 'ema2': 35, 'slip_atr_k': 0.07176417062568893, 'slip_spread_k': 0.18599719083525815, 'spread_hl_frac': 0.026125949082128053, 'bb_std_mult': 0.8426882533860232, 'rsi_os': 26, 'rsi_ob': 94, 'vol_spike': 0.1476072703920227, 'adx_thresh': 34.66560247014427, 'atr_min_pct': 0.009662254910463866, 'atr_max_pct': 0.09086625511655869, 'tp_mult': 1.6584452309871591, 'tsl_mult': 0.8015291590676941, 'strategy': 'mean_reversion', 'time_stop': 49, 'use_sma': True, 'use_atr': True, 'use_adx': False, 'use_ema': False, 'use_spike': True, 'rsi_required': False, 'edge_k': 1.1977296275111329, 'edge_cap': 0.8457352708347905, 'bull_strategy': 'breakout', 'bull_bb_std_mult': 1.4357252795560482, 'bull_rsi_os': 33, 'bull_rsi_ob': 82, 'bull_adx_thresh': 32.65380355608881, 'bull_atr_min_pct': 2.0163810542672602e-05, 'bull_atr_max_pct': 0.04288513246132334, 'bull_tp_mult': 2.8546880705223923, 'bull_tsl_mult': 0.7609673372074847, 'bull_time_stop': 190, 'bull_use_sma': False, 'bull_use_ema': True, 'bull_use_atr': True, 'bull_use_adx': False, 'bull_use_spike': True, 'bull_rsi_required': True, 'bear_strategy': 'mean_reversion', 'bear_bb_std_mult': 1.383255396678929, 'bear_rsi_os': 51, 'bear_rsi_ob': 77, 'bear_adx_thresh': 16.488747119713494, 'bear_atr_min_pct': 0.01432865503942394, 'bear_atr_max_pct': 0.03423196216702023, 'bear_tp_mult': 2.8126464679507377, 'bear_tsl_mult': 0.72270480082665, 'bear_time_stop': 211, 'bear_use_sma': True, 'bear_use_ema': True, 'bear_use_atr': False, 'bear_use_adx': False, 'bear_use_spike': True, 'bear_rsi_required': True, 'sideways_strategy': 'breakout', 'sideways_bb_std_mult': 3.2809013491463768, 'sideways_rsi_os': 37, 'sideways_rsi_ob': 62, 'sideways_adx_thresh': 6.54621104121334, 'sideways_atr_min_pct': 0.014862253699416678, 'sideways_atr_max_pct': 0.14284554027439947, 'sideways_tp_mult': 1.0425681603675918, 'sideways_tsl_mult': 0.9724463012728962, 'sideways_time_stop': 180, 'sideways_use_sma': True, 'sideways_use_ema': True, 'sideways_use_atr': True, 'sideways_use_adx': True, 'sideways_use_spike': False, 'sideways_rsi_required': True}.
[I 2025-08-30 19:32:00,861] Trial 551 finished with values: [-1000000000.0, 1000000000.0] and parameters: {'p_sma': 34, 'p_std': 32, 'p_atr': 16, 'p_adx': 20, 'rsi_period': 17, 'ema1': 25, 'ema2': 32, 'slip_atr_k': 0.14141346100611388, 'slip_spread_k': 0.6105677405821806, 'spread_hl_frac': 0.026335620852968405, 'bb_std_mult': 2.6376377654004006, 'rsi_os': 14, 'rsi_ob': 70, 'vol_spike': 0.25701903858178, 'adx_thresh': 32.361404072406074, 'atr_min_pct': 0.023802225670646538, 'atr_max_pct': 0.040340919289531395, 'tp_mult': 2.365901630030288, 'tsl_mult': 0.8014974238459508, 'strategy': 'mean_reversion', 'time_stop': 189, 'use_sma': True, 'use_atr': True, 'use_adx': True, 'use_ema': False, 'use_spike': True, 'rsi_required': False, 'edge_k': 0.17889877121626097, 'edge_cap': 0.0910210075727072, 'bull_strategy': 'breakout', 'bull_bb_std_mult': 2.0834080351469266, 'bull_rsi_os': 46, 'bull_rsi_ob': 84, 'bull_adx_thresh': 18.462221312967145, 'bull_atr_min_pct': 0.012792876926228353, 'bull_atr_max_pct': 0.09500922472747739, 'bull_tp_mult': 2.845906465292225, 'bull_tsl_mult': 0.6901578844817001, 'bull_time_stop': 186, 'bull_use_sma': False, 'bull_use_ema': True, 'bull_use_atr': True, 'bull_use_adx': False, 'bull_use_spike': False, 'bull_rsi_required': False, 'bear_strategy': 'breakout', 'bear_bb_std_mult': 2.945211341354984, 'bear_rsi_os': 40, 'bear_rsi_ob': 84, 'bear_adx_thresh': 17.692441127255783, 'bear_atr_min_pct': 0.014324445355448566, 'bear_atr_max_pct': 0.04010917563800101, 'bear_tp_mult': 2.9817985924479307, 'bear_tsl_mult': 0.13694971158601055, 'bear_time_stop': 300, 'bear_use_sma': True, 'bear_use_ema': False, 'bear_use_atr': False, 'bear_use_adx': False, 'bear_use_spike': True, 'bear_rsi_required': True, 'sideways_strategy': 'breakout', 'sideways_bb_std_mult': 3.177628294541919, 'sideways_rsi_os': 37, 'sideways_rsi_ob': 59, 'sideways_adx_thresh': 6.432244484130839, 'sideways_atr_min_pct': 0.024450057625093332, 'sideways_atr_max_pct': 0.14293596366100483, 'sideways_tp_mult': 1.0830786446142264, 'sideways_tsl_mult': 0.975635172925044, 'sideways_time_stop': 149, 'sideways_use_sma': False, 'sideways_use_ema': True, 'sideways_use_atr': True, 'sideways_use_adx': True, 'sideways_use_spike': False, 'sideways_rsi_required': True}.
[I 2025-08-30 19:32:06,743] Trial 552 finished with values: [-1000000000.0, 1000000000.0] and parameters: {'p_sma': 7, 'p_std': 28, 'p_atr': 8, 'p_adx': 24, 'rsi_period': 71, 'ema1': 25, 'ema2': 50, 'slip_atr_k': 0.14074721090910855, 'slip_spread_k': 0.6156124977391438, 'spread_hl_frac': 0.020747977185606697, 'bb_std_mult': 2.015986450089832, 'rsi_os': 26, 'rsi_ob': 82, 'vol_spike': 0.007744453993350053, 'adx_thresh': 20.277879443138833, 'atr_min_pct': 0.023939480578779006, 'atr_max_pct': 0.08751595146209175, 'tp_mult': 2.33641036004507, 'tsl_mult': 0.7988327663657309, 'strategy': 'mean_reversion', 'time_stop': 189, 'use_sma': True, 'use_atr': True, 'use_adx': True, 'use_ema': False, 'use_spike': True, 'rsi_required': False, 'edge_k': 0.9765433881239295, 'edge_cap': 0.10063730737596438, 'bull_strategy': 'breakout', 'bull_bb_std_mult': 3.4015264543516897, 'bull_rsi_os': 31, 'bull_rsi_ob': 46, 'bull_adx_thresh': 14.842564845916655, 'bull_atr_min_pct': 0.0013072114590326088, 'bull_atr_max_pct': 0.09483347553706273, 'bull_tp_mult': 1.172505528993005, 'bull_tsl_mult': 0.4896108150881303, 'bull_time_stop': 5, 'bull_use_sma': False, 'bull_use_ema': True, 'bull_use_atr': True, 'bull_use_adx': False, 'bull_use_spike': False, 'bull_rsi_required': False, 'bear_strategy': 'breakout', 'bear_bb_std_mult': 2.9361042685896246, 'bear_rsi_os': 40, 'bear_rsi_ob': 74, 'bear_adx_thresh': 29.613671918417474, 'bear_atr_min_pct': 0.011151076822143523, 'bear_atr_max_pct': 0.04029933958669623, 'bear_tp_mult': 1.7962557366512293, 'bear_tsl_mult': 0.6234663280470204, 'bear_time_stop': 63, 'bear_use_sma': True, 'bear_use_ema': False, 'bear_use_atr': False, 'bear_use_adx': False, 'bear_use_spike': False, 'bear_rsi_required': True, 'sideways_strategy': 'breakout', 'sideways_bb_std_mult': 3.173216718466783, 'sideways_rsi_os': 32, 'sideways_rsi_ob': 60, 'sideways_adx_thresh': 19.28040176622206, 'sideways_atr_min_pct': 0.002822680552779843, 'sideways_atr_max_pct': 0.14297456311854342, 'sideways_tp_mult': 1.1339193966371086, 'sideways_tsl_mult': 0.44064291338036776, 'sideways_time_stop': 104, 'sideways_use_sma': False, 'sideways_use_ema': True, 'sideways_use_atr': True, 'sideways_use_adx': True, 'sideways_use_spike': False, 'sideways_rsi_required': True}.
[I 2025-08-30 19:32:22,909] Trial 554 finished with values: [-1000000000.0, 1000000000.0] and parameters: {'p_sma': 5, 'p_std': 38, 'p_atr': 8, 'p_adx': 19, 'rsi_period': 71, 'ema1': 25, 'ema2': 50, 'slip_atr_k': 0.026685909493368923, 'slip_spread_k': 0.12466253286346424, 'spread_hl_frac': 0.024833381838553634, 'bb_std_mult': 3.442123740743493, 'rsi_os': 12, 'rsi_ob': 83, 'vol_spike': 0.20273130942701897, 'adx_thresh': 20.210448264711925, 'atr_min_pct': 0.02405080747583497, 'atr_max_pct': 0.09550246832715394, 'tp_mult': 2.2902083874137174, 'tsl_mult': 0.7976260767058724, 'strategy': 'mean_reversion', 'time_stop': 43, 'use_sma': False, 'use_atr': True, 'use_adx': True, 'use_ema': False, 'use_spike': False, 'rsi_required': False, 'edge_k': 0.9699245874451135, 'edge_cap': 0.4960942039790591, 'bull_strategy': 'mean_reversion', 'bull_bb_std_mult': 2.5245357383450013, 'bull_rsi_os': 32, 'bull_rsi_ob': 49, 'bull_adx_thresh': 20.382769747167927, 'bull_atr_min_pct': 0.016437949748754007, 'bull_atr_max_pct': 0.12349286411604571, 'bull_tp_mult': 1.7658563790275688, 'bull_tsl_mult': 0.3682199202939719, 'bull_time_stop': 164, 'bull_use_sma': True, 'bull_use_ema': True, 'bull_use_atr': True, 'bull_use_adx': False, 'bull_use_spike': False, 'bull_rsi_required': False, 'bear_strategy': 'breakout', 'bear_bb_std_mult': 2.925185551371919, 'bear_rsi_os': 53, 'bear_rsi_ob': 75, 'bear_adx_thresh': 17.372006495604843, 'bear_atr_min_pct': 0.009059698359006852, 'bear_atr_max_pct': 0.13194663981088334, 'bear_tp_mult': 1.7956473878978714, 'bear_tsl_mult': 0.6960308213349985, 'bear_time_stop': 103, 'bear_use_sma': False, 'bear_use_ema': False, 'bear_use_atr': False, 'bear_use_adx': False, 'bear_use_spike': False, 'bear_rsi_required': True, 'sideways_strategy': 'breakout', 'sideways_bb_std_mult': 1.016822544819832, 'sideways_rsi_os': 37, 'sideways_rsi_ob': 51, 'sideways_adx_thresh': 13.186636935730562, 'sideways_atr_min_pct': 0.0027409400471148575, 'sideways_atr_max_pct': 0.1412758221798265, 'sideways_tp_mult': 1.1329990025432706, 'sideways_tsl_mult': 0.9280746538134976, 'sideways_time_stop': 9, 'sideways_use_sma': False, 'sideways_use_ema': True, 'sideways_use_atr': True, 'sideways_use_adx': False, 'sideways_use_spike': False, 'sideways_rsi_required': True}.
[I 2025-08-30 19:32:27,929] Trial 555 finished with values: [-1000000000.0, 1000000000.0] and parameters: {'p_sma': 22, 'p_std': 31, 'p_atr': 8, 'p_adx': 19, 'rsi_period': 21, 'ema1': 16, 'ema2': 17, 'slip_atr_k': 0.027061980800882776, 'slip_spread_k': 0.1247433033803998, 'spread_hl_frac': 0.024845365388683736, 'bb_std_mult': 1.9969762918862155, 'rsi_os': 22, 'rsi_ob': 82, 'vol_spike': 0.2656451591288102, 'adx_thresh': 6.330844334610195, 'atr_min_pct': 0.024169591224538475, 'atr_max_pct': 0.09559861331000614, 'tp_mult': 1.1542330420353606, 'tsl_mult': 0.8429966912892497, 'strategy': 'mean_reversion', 'time_stop': 174, 'use_sma': False, 'use_atr': True, 'use_adx': True, 'use_ema': False, 'use_spike': False, 'rsi_required': False, 'edge_k': 0.011157594813053243, 'edge_cap': 0.38559065376358104, 'bull_strategy': 'mean_reversion', 'bull_bb_std_mult': 2.3456864119103407, 'bull_rsi_os': 35, 'bull_rsi_ob': 49, 'bull_adx_thresh': 17.21325749859606, 'bull_atr_min_pct': 0.012690798732001764, 'bull_atr_max_pct': 0.11416058743126718, 'bull_tp_mult': 1.5743522554806872, 'bull_tsl_mult': 0.5002231696703945, 'bull_time_stop': 45, 'bull_use_sma': True, 'bull_use_ema': True, 'bull_use_atr': True, 'bull_use_adx': True, 'bull_use_spike': False, 'bull_rsi_required': False, 'bear_strategy': 'breakout', 'bear_bb_std_mult': 3.431256920406282, 'bear_rsi_os': 49, 'bear_rsi_ob': 58, 'bear_adx_thresh': 18.409767648240347, 'bear_atr_min_pct': 0.01666572333930785, 'bear_atr_max_pct': 0.12836978970273197, 'bear_tp_mult': 1.7304764414023384, 'bear_tsl_mult': 0.38313643364492256, 'bear_time_stop': 62, 'bear_use_sma': False, 'bear_use_ema': False, 'bear_use_atr': False, 'bear_use_adx': False, 'bear_use_spike': False, 'bear_rsi_required': True, 'sideways_strategy': 'breakout', 'sideways_bb_std_mult': 2.712797840495816, 'sideways_rsi_os': 32, 'sideways_rsi_ob': 59, 'sideways_adx_thresh': 21.610328341761313, 'sideways_atr_min_pct': 0.008882748155276208, 'sideways_atr_max_pct': 0.1471521615946852, 'sideways_tp_mult': 1.498682790005557, 'sideways_tsl_mult': 0.9275227302477945, 'sideways_time_stop': 149, 'sideways_use_sma': False, 'sideways_use_ema': True, 'sideways_use_atr': True, 'sideways_use_adx': False, 'sideways_use_spike': False, 'sideways_rsi_required': True}.
[I 2025-08-30 19:32:36,624] Trial 556 finished with values: [-1000000000.0, 1000000000.0] and parameters: {'p_sma': 54, 'p_std': 10, 'p_atr': 8, 'p_adx': 10, 'rsi_period': 21, 'ema1': 19, 'ema2': 32, 'slip_atr_k': 0.21572917151355459, 'slip_spread_k': 0.5744671844800033, 'spread_hl_frac': 0.024940941463980203, 'bb_std_mult': 2.0622934034458456, 'rsi_os': 45, 'rsi_ob': 75, 'vol_spike': 0.277490807603363, 'adx_thresh': 20.21316430492833, 'atr_min_pct': 0.024624960941714624, 'atr_max_pct': 0.13542722677515825, 'tp_mult': 1.1688533006532298, 'tsl_mult': 0.8573756259376263, 'strategy': 'breakout', 'time_stop': 170, 'use_sma': False, 'use_atr': False, 'use_adx': True, 'use_ema': True, 'use_spike': False, 'rsi_required': True, 'edge_k': 0.9428434608393024, 'edge_cap': 0.5815186624800327, 'bull_strategy': 'mean_reversion', 'bull_bb_std_mult': 2.3444478592422, 'bull_rsi_os': 35, 'bull_rsi_ob': 49, 'bull_adx_thresh': 17.0970464202329, 'bull_atr_min_pct': 0.0024648191360361798, 'bull_atr_max_pct': 0.046723604906368975, 'bull_tp_mult': 2.7787932531918718, 'bull_tsl_mult': 0.4884337977519353, 'bull_time_stop': 45, 'bull_use_sma': True, 'bull_use_ema': True, 'bull_use_atr': True, 'bull_use_adx': True, 'bull_use_spike': False, 'bull_rsi_required': True, 'bear_strategy': 'breakout', 'bear_bb_std_mult': 2.806087547519944, 'bear_rsi_os': 18, 'bear_rsi_ob': 75, 'bear_adx_thresh': 18.404550400043444, 'bear_atr_min_pct': 0.025934714325624414, 'bear_atr_max_pct': 0.03678531459711022, 'bear_tp_mult': 2.691415269870174, 'bear_tsl_mult': 0.6207352318676396, 'bear_time_stop': 33, 'bear_use_sma': False, 'bear_use_ema': True, 'bear_use_atr': False, 'bear_use_adx': True, 'bear_use_spike': False, 'bear_rsi_required': False, 'sideways_strategy': 'mean_reversion', 'sideways_bb_std_mult': 0.8933269770143464, 'sideways_rsi_os': 38, 'sideways_rsi_ob': 60, 'sideways_adx_thresh': 21.640471442046827, 'sideways_atr_min_pct': 0.029100006787350093, 'sideways_atr_max_pct': 0.05206390690898915, 'sideways_tp_mult': 1.1259000799496262, 'sideways_tsl_mult': 0.9276037543166439, 'sideways_time_stop': 221, 'sideways_use_sma': False, 'sideways_use_ema': False, 'sideways_use_atr': True, 'sideways_use_adx': False, 'sideways_use_spike': False, 'sideways_rsi_required': True}.
[I 2025-08-30 19:32:42,064] Trial 557 finished with values: [-1000000000.0, 1000000000.0] and parameters: {'p_sma': 5, 'p_std': 10, 'p_atr': 8, 'p_adx': 30, 'rsi_period': 30, 'ema1': 19, 'ema2': 32, 'slip_atr_k': 0.08189416988783726, 'slip_spread_k': 0.7829497549091583, 'spread_hl_frac': 0.007214833940550929, 'bb_std_mult': 2.188678086114434, 'rsi_os': 45, 'rsi_ob': 83, 'vol_spike': 0.2006161061837724, 'adx_thresh': 22.989769771486046, 'atr_min_pct': 0.005291441068685896, 'atr_max_pct': 0.09552011943906898, 'tp_mult': 2.293049203111641, 'tsl_mult': 0.5989871780818055, 'strategy': 'breakout', 'time_stop': 44, 'use_sma': False, 'use_atr': False, 'use_adx': True, 'use_ema': True, 'use_spike': False, 'rsi_required': True, 'edge_k': 0.22814147910792454, 'edge_cap': 0.49368943039786817, 'bull_strategy': 'mean_reversion', 'bull_bb_std_mult': 3.078913889454069, 'bull_rsi_os': 32, 'bull_rsi_ob': 88, 'bull_adx_thresh': 16.217257417955103, 'bull_atr_min_pct': 0.028608538703978816, 'bull_atr_max_pct': 0.11377424850236363, 'bull_tp_mult': 2.7816802029469305, 'bull_tsl_mult': 0.8439558181170209, 'bull_time_stop': 163, 'bull_use_sma': True, 'bull_use_ema': False, 'bull_use_atr': True, 'bull_use_adx': True, 'bull_use_spike': False, 'bull_rsi_required': True, 'bear_strategy': 'breakout', 'bear_bb_std_mult': 0.8451830406237995, 'bear_rsi_os': 49, 'bear_rsi_ob': 47, 'bear_adx_thresh': 17.283298546078406, 'bear_atr_min_pct': 0.01277531518393617, 'bear_atr_max_pct': 0.0160610709637969, 'bear_tp_mult': 1.284916226765653, 'bear_tsl_mult': 0.20426575742182196, 'bear_time_stop': 187, 'bear_use_sma': False, 'bear_use_ema': True, 'bear_use_atr': True, 'bear_use_adx': True, 'bear_use_spike': False, 'bear_rsi_required': False, 'sideways_strategy': 'mean_reversion', 'sideways_bb_std_mult': 2.997841300898871, 'sideways_rsi_os': 8, 'sideways_rsi_ob': 46, 'sideways_adx_thresh': 13.424221721261269, 'sideways_atr_min_pct': 0.0038797735795339625, 'sideways_atr_max_pct': 0.1452431319744617, 'sideways_tp_mult': 1.1536640448275628, 'sideways_tsl_mult': 0.9392003713045631, 'sideways_time_stop': 156, 'sideways_use_sma': False, 'sideways_use_ema': False, 'sideways_use_atr': True, 'sideways_use_adx': False, 'sideways_use_spike': True, 'sideways_rsi_required': True}.
