[I 2025-08-30 19:00:36,011] Trial 280 finished with values: [-1000000000.0, 1000000000.0] and parameters: {'p_sma': 7, 'p_std': 33, 'p_atr': 9, 'p_adx': 18, 'rsi_period': 55, 'ema1': 30, 'ema2': 33, 'slip_atr_k': 0.08677596821269512, 'slip_spread_k': 0.13612685490099347, 'spread_hl_frac': 0.022377511830510018, 'bb_std_mult': 2.1189040824375716, 'rsi_os': 32, 'rsi_ob': 80, 'vol_spike': 0.08797767397471246, 'adx_thresh': 33.057611179591454, 'atr_min_pct': 0.025648392083166407, 'atr_max_pct': 0.14551375880035916, 'tp_mult': 1.2770647399883601, 'tsl_mult': 0.7968329150217763, 'strategy': 'breakout', 'time_stop': 180, 'use_sma': True, 'use_atr': True, 'use_adx': True, 'use_ema': False, 'use_spike': False, 'rsi_required': True, 'edge_k': 0.12780273941304077, 'edge_cap': 0.5956386094202034, 'bull_strategy': 'mean_reversion', 'bull_bb_std_mult': 3.2239275968347014, 'bull_rsi_os': 32, 'bull_rsi_ob': 68, 'bull_adx_thresh': 17.309377152774164, 'bull_atr_min_pct': 0.011885427956647276, 'bull_atr_max_pct': 0.07984881669923453, 'bull_tp_mult': 1.0124035937295401, 'bull_tsl_mult': 0.28874244451636544, 'bull_time_stop': 66, 'bull_use_sma': False, 'bull_use_ema': False, 'bull_use_atr': False, 'bull_use_adx': False, 'bull_use_spike': False, 'bull_rsi_required': True, 'bear_strategy': 'breakout', 'bear_bb_std_mult': 2.5807186347502964, 'bear_rsi_os': 51, 'bear_rsi_ob': 79, 'bear_adx_thresh': 22.484380665428578, 'bear_atr_min_pct': 0.020751231995757603, 'bear_atr_max_pct': 0.08176695053763283, 'bear_tp_mult': 2.6165874517334555, 'bear_tsl_mult': 0.03786795029070705, 'bear_time_stop': 211, 'bear_use_sma': True, 'bear_use_ema': False, 'bear_use_atr': False, 'bear_use_adx': True, 'bear_use_spike': False, 'bear_rsi_required': True, 'sideways_strategy': 'breakout', 'sideways_bb_std_mult': 3.126721264282541, 'sideways_rsi_os': 35, 'sideways_rsi_ob': 58, 'sideways_adx_thresh': 21.384872109350418, 'sideways_atr_min_pct': 0.003967669112233233, 'sideways_atr_max_pct': 0.14790420509746824, 'sideways_tp_mult': 1.1255046612937571, 'sideways_tsl_mult': 0.3385989568261164, 'sideways_time_stop': 159, 'sideways_use_sma': True, 'sideways_use_ema': False, 'sideways_use_atr': True, 'sideways_use_adx': False, 'sideways_use_spike': True, 'sideways_rsi_required': True}.
[I 2025-08-30 19:00:36,845] Trial 279 finished with values: [-1000000000.0, 1000000000.0] and parameters: {'p_sma': 6, 'p_std': 6, 'p_atr': 13, 'p_adx': 10, 'rsi_period': 56, 'ema1': 30, 'ema2': 32, 'slip_atr_k': 0.08668229234162342, 'slip_spread_k': 0.14335949410763066, 'spread_hl_frac': 0.023084389659852277, 'bb_std_mult': 2.141655724952581, 'rsi_os': 29, 'rsi_ob': 95, 'vol_spike': 0.07366812948145757, 'adx_thresh': 33.173815108511825, 'atr_min_pct': 0.022994479725617106, 'atr_max_pct': 0.05762727497528747, 'tp_mult': 2.3079734372348417, 'tsl_mult': 0.7998787529886974, 'strategy': 'breakout', 'time_stop': 158, 'use_sma': True, 'use_atr': True, 'use_adx': True, 'use_ema': False, 'use_spike': True, 'rsi_required': False, 'edge_k': 0.17496998624705098, 'edge_cap': 0.4241029194719377, 'bull_strategy': 'breakout', 'bull_bb_std_mult': 1.9069542413473561, 'bull_rsi_os': 52, 'bull_rsi_ob': 68, 'bull_adx_thresh': 17.78791123596499, 'bull_atr_min_pct': 0.022135902108417982, 'bull_atr_max_pct': 0.0906173867086762, 'bull_tp_mult': 2.9252923613340465, 'bull_tsl_mult': 0.07486615594641044, 'bull_time_stop': 69, 'bull_use_sma': False, 'bull_use_ema': False, 'bull_use_atr': False, 'bull_use_adx': False, 'bull_use_spike': False, 'bull_rsi_required': True, 'bear_strategy': 'breakout', 'bear_bb_std_mult': 3.0065731896780363, 'bear_rsi_os': 51, 'bear_rsi_ob': 94, 'bear_adx_thresh': 30.638189730440942, 'bear_atr_min_pct': 0.028993206836923843, 'bear_atr_max_pct': 0.03969845069853328, 'bear_tp_mult': 2.6180398249220294, 'bear_tsl_mult': 0.033904871510202494, 'bear_time_stop': 89, 'bear_use_sma': True, 'bear_use_ema': False, 'bear_use_atr': False, 'bear_use_adx': True, 'bear_use_spike': True, 'bear_rsi_required': True, 'sideways_strategy': 'breakout', 'sideways_bb_std_mult': 3.140120932788988, 'sideways_rsi_os': 34, 'sideways_rsi_ob': 58, 'sideways_adx_thresh': 5.558212320234324, 'sideways_atr_min_pct': 0.02473775455939524, 'sideways_atr_max_pct': 0.14428681091809412, 'sideways_tp_mult': 1.0412540231472744, 'sideways_tsl_mult': 0.9662641012438269, 'sideways_time_stop': 156, 'sideways_use_sma': False, 'sideways_use_ema': True, 'sideways_use_atr': True, 'sideways_use_adx': True, 'sideways_use_spike': True, 'sideways_rsi_required': True}.
[I 2025-08-30 19:00:36,861] Trial 281 finished with values: [-0.05028851915787569, 0.050207196281913086] and parameters: {'p_sma': 21, 'p_std': 6, 'p_atr': 9, 'p_adx': 10, 'rsi_period': 55, 'ema1': 30, 'ema2': 26, 'slip_atr_k': 0.014966862540290157, 'slip_spread_k': 0.1429664122414985, 'spread_hl_frac': 0.006090953052854169, 'bb_std_mult': 2.1650946662028474, 'rsi_os': 52, 'rsi_ob': 45, 'vol_spike': 0.2511839293982374, 'adx_thresh': 32.59735619970902, 'atr_min_pct': 0.02173795800975992, 'atr_max_pct': 0.09577851380309407, 'tp_mult': 2.017403649476489, 'tsl_mult': 0.8011159230711794, 'strategy': 'breakout', 'time_stop': 172, 'use_sma': True, 'use_atr': True, 'use_adx': True, 'use_ema': False, 'use_spike': False, 'rsi_required': True, 'edge_k': 0.0707892810147389, 'edge_cap': 0.6038737712245094, 'bull_strategy': 'mean_reversion', 'bull_bb_std_mult': 3.18575013995906, 'bull_rsi_os': 32, 'bull_rsi_ob': 68, 'bull_adx_thresh': 17.508001128332634, 'bull_atr_min_pct': 0.001518491130931792, 'bull_atr_max_pct': 0.12352864886982076, 'bull_tp_mult': 2.542548694649665, 'bull_tsl_mult': 0.22687388187691127, 'bull_time_stop': 65, 'bull_use_sma': False, 'bull_use_ema': False, 'bull_use_atr': True, 'bull_use_adx': True, 'bull_use_spike': False, 'bull_rsi_required': False, 'bear_strategy': 'breakout', 'bear_bb_std_mult': 3.346191280877272, 'bear_rsi_os': 51, 'bear_rsi_ob': 94, 'bear_adx_thresh': 30.40225495567136, 'bear_atr_min_pct': 0.017324762494144552, 'bear_atr_max_pct': 0.024546538845499524, 'bear_tp_mult': 1.6049632891184862, 'bear_tsl_mult': 0.9738117145907178, 'bear_time_stop': 117, 'bear_use_sma': True, 'bear_use_ema': False, 'bear_use_atr': False, 'bear_use_adx': True, 'bear_use_spike': False, 'bear_rsi_required': True, 'sideways_strategy': 'breakout', 'sideways_bb_std_mult': 3.13031932327664, 'sideways_rsi_os': 35, 'sideways_rsi_ob': 59, 'sideways_adx_thresh': 31.6770061808525, 'sideways_atr_min_pct': 0.0007522452071002162, 'sideways_atr_max_pct': 0.09376251164659495, 'sideways_tp_mult': 1.1161085314284025, 'sideways_tsl_mult': 0.16826829777149532, 'sideways_time_stop': 156, 'sideways_use_sma': True, 'sideways_use_ema': False, 'sideways_use_atr': True, 'sideways_use_adx': False, 'sideways_use_spike': True, 'sideways_rsi_required': True}.
[I 2025-08-30 19:00:37,263] Trial 282 finished with values: [-1000000000.0, 1000000000.0] and parameters: {'p_sma': 6, 'p_std': 33, 'p_atr': 9, 'p_adx': 12, 'rsi_period': 27, 'ema1': 30, 'ema2': 15, 'slip_atr_k': 0.01584943755463669, 'slip_spread_k': 0.14383415588137638, 'spread_hl_frac': 0.006152288527520224, 'bb_std_mult': 3.2738244967525265, 'rsi_os': 25, 'rsi_ob': 45, 'vol_spike': 0.17656658342212, 'adx_thresh': 34.07623057015046, 'atr_min_pct': 0.023053740478424786, 'atr_max_pct': 0.01740183696972858, 'tp_mult': 1.6436443104142153, 'tsl_mult': 0.8283532617790199, 'strategy': 'mean_reversion', 'time_stop': 180, 'use_sma': False, 'use_atr': True, 'use_adx': True, 'use_ema': False, 'use_spike': False, 'rsi_required': True, 'edge_k': 0.06613641193099765, 'edge_cap': 0.29277526067224996, 'bull_strategy': 'mean_reversion', 'bull_bb_std_mult': 0.9251756604549586, 'bull_rsi_os': 32, 'bull_rsi_ob': 70, 'bull_adx_thresh': 9.991841396935623, 'bull_atr_min_pct': 0.011697931199166782, 'bull_atr_max_pct': 0.11695145426000535, 'bull_tp_mult': 2.650793531540934, 'bull_tsl_mult': 0.24549490089748482, 'bull_time_stop': 175, 'bull_use_sma': False, 'bull_use_ema': True, 'bull_use_atr': True, 'bull_use_adx': True, 'bull_use_spike': False, 'bull_rsi_required': False, 'bear_strategy': 'breakout', 'bear_bb_std_mult': 2.373034704228099, 'bear_rsi_os': 18, 'bear_rsi_ob': 80, 'bear_adx_thresh': 25.579666197344345, 'bear_atr_min_pct': 0.017833559136091012, 'bear_atr_max_pct': 0.12214797252283043, 'bear_tp_mult': 1.1257200459693424, 'bear_tsl_mult': 0.47887051745721115, 'bear_time_stop': 196, 'bear_use_sma': True, 'bear_use_ema': True, 'bear_use_atr': False, 'bear_use_adx': False, 'bear_use_spike': False, 'bear_rsi_required': True, 'sideways_strategy': 'breakout', 'sideways_bb_std_mult': 3.1203386849112276, 'sideways_rsi_os': 34, 'sideways_rsi_ob': 58, 'sideways_adx_thresh': 11.668561065880642, 'sideways_atr_min_pct': 0.0005966264568471515, 'sideways_atr_max_pct': 0.11454959771558851, 'sideways_tp_mult': 1.1095942505830283, 'sideways_tsl_mult': 0.16945108567447942, 'sideways_time_stop': 157, 'sideways_use_sma': True, 'sideways_use_ema': False, 'sideways_use_atr': True, 'sideways_use_adx': False, 'sideways_use_spike': False, 'sideways_rsi_required': True}.
[I 2025-08-30 19:00:37,463] Trial 283 finished with values: [-1000000000.0, 1000000000.0] and parameters: {'p_sma': 11, 'p_std': 34, 'p_atr': 13, 'p_adx': 13, 'rsi_period': 74, 'ema1': 23, 'ema2': 31, 'slip_atr_k': 0.06968263811140649, 'slip_spread_k': 0.18918376353034963, 'spread_hl_frac': 0.047186982031638056, 'bb_std_mult': 3.2918064169658345, 'rsi_os': 11, 'rsi_ob': 69, 'vol_spike': 0.17647942112936543, 'adx_thresh': 34.088718809363115, 'atr_min_pct': 0.02462913096297442, 'atr_max_pct': 0.017324831041920424, 'tp_mult': 2.7134402146971204, 'tsl_mult': 0.1551154742758244, 'strategy': 'mean_reversion', 'time_stop': 207, 'use_sma': False, 'use_atr': True, 'use_adx': True, 'use_ema': True, 'use_spike': True, 'rsi_required': False, 'edge_k': 0.07228059000217374, 'edge_cap': 0.42053897035054516, 'bull_strategy': 'mean_reversion', 'bull_bb_std_mult': 3.0105951649365172, 'bull_rsi_os': 36, 'bull_rsi_ob': 84, 'bull_adx_thresh': 17.633023283901764, 'bull_atr_min_pct': 0.0014839694212011568, 'bull_atr_max_pct': 0.11741878527725985, 'bull_tp_mult': 2.8106756331010487, 'bull_tsl_mult': 0.49401918613167367, 'bull_time_stop': 177, 'bull_use_sma': False, 'bull_use_ema': True, 'bull_use_atr': True, 'bull_use_adx': True, 'bull_use_spike': False, 'bull_rsi_required': False, 'bear_strategy': 'mean_reversion', 'bear_bb_std_mult': 2.0026792650269183, 'bear_rsi_os': 34, 'bear_rsi_ob': 68, 'bear_adx_thresh': 18.67109068824882, 'bear_atr_min_pct': 0.005204958323728604, 'bear_atr_max_pct': 0.04805430230578078, 'bear_tp_mult': 1.956409698609401, 'bear_tsl_mult': 0.42008350455408494, 'bear_time_stop': 195, 'bear_use_sma': True, 'bear_use_ema': True, 'bear_use_atr': False, 'bear_use_adx': False, 'bear_use_spike': False, 'bear_rsi_required': True, 'sideways_strategy': 'breakout', 'sideways_bb_std_mult': 3.1692756851826265, 'sideways_rsi_os': 40, 'sideways_rsi_ob': 57, 'sideways_adx_thresh': 12.038594777875547, 'sideways_atr_min_pct': 0.0004975374564127315, 'sideways_atr_max_pct': 0.09481039113259877, 'sideways_tp_mult': 1.1130760472417285, 'sideways_tsl_mult': 0.9842036902432447, 'sideways_time_stop': 156, 'sideways_use_sma': False, 'sideways_use_ema': True, 'sideways_use_atr': True, 'sideways_use_adx': False, 'sideways_use_spike': False, 'sideways_rsi_required': True}.
[I 2025-08-30 19:00:37,518] Trial 284 finished with values: [-1000000000.0, 1000000000.0] and parameters: {'p_sma': 21, 'p_std': 34, 'p_atr': 9, 'p_adx': 20, 'rsi_period': 27, 'ema1': 21, 'ema2': 31, 'slip_atr_k': 0.030852478469142464, 'slip_spread_k': 0.1730297438706012, 'spread_hl_frac': 0.04722584243990618, 'bb_std_mult': 1.5203843496758607, 'rsi_os': 34, 'rsi_ob': 45, 'vol_spike': 0.2490755181540078, 'adx_thresh': 34.20788890056893, 'atr_min_pct': 0.021806500524073916, 'atr_max_pct': 0.09529131049547249, 'tp_mult': 2.247605659348072, 'tsl_mult': 0.8303760243003775, 'strategy': 'mean_reversion', 'time_stop': 209, 'use_sma': False, 'use_atr': True, 'use_adx': True, 'use_ema': True, 'use_spike': False, 'rsi_required': True, 'edge_k': 0.05236897385999305, 'edge_cap': 0.4765560723600453, 'bull_strategy': 'mean_reversion', 'bull_bb_std_mult': 3.1289481613826093, 'bull_rsi_os': 47, 'bull_rsi_ob': 48, 'bull_adx_thresh': 9.878566318468188, 'bull_atr_min_pct': 0.0014102639201292752, 'bull_atr_max_pct': 0.11736486587879662, 'bull_tp_mult': 2.7491676383026102, 'bull_tsl_mult': 0.8551671946318073, 'bull_time_stop': 176, 'bull_use_sma': False, 'bull_use_ema': True, 'bull_use_atr': True, 'bull_use_adx': True, 'bull_use_spike': False, 'bull_rsi_required': False, 'bear_strategy': 'mean_reversion', 'bear_bb_std_mult': 3.3372298649345375, 'bear_rsi_os': 5, 'bear_rsi_ob': 48, 'bear_adx_thresh': 18.50256113220269, 'bear_atr_min_pct': 0.01771465136722303, 'bear_atr_max_pct': 0.03174230775364219, 'bear_tp_mult': 1.4702966009660443, 'bear_tsl_mult': 0.41373572264511294, 'bear_time_stop': 194, 'bear_use_sma': False, 'bear_use_ema': True, 'bear_use_atr': False, 'bear_use_adx': False, 'bear_use_spike': False, 'bear_rsi_required': False, 'sideways_strategy': 'breakout', 'sideways_bb_std_mult': 3.2200083339158003, 'sideways_rsi_os': 38, 'sideways_rsi_ob': 57, 'sideways_adx_thresh': 20.380669263166993, 'sideways_atr_min_pct': 0.0008067481247245095, 'sideways_atr_max_pct': 0.0939655153585435, 'sideways_tp_mult': 1.1086623073141726, 'sideways_tsl_mult': 0.9836261647400926, 'sideways_time_stop': 162, 'sideways_use_sma': True, 'sideways_use_ema': False, 'sideways_use_atr': True, 'sideways_use_adx': False, 'sideways_use_spike': False, 'sideways_rsi_required': True}.
[I 2025-08-30 19:00:37,542] Trial 285 finished with values: [-1000000000.0, 1000000000.0] and parameters: {'p_sma': 36, 'p_std': 32, 'p_atr': 9, 'p_adx': 20, 'rsi_period': 27, 'ema1': 21, 'ema2': 31, 'slip_atr_k': 0.17051563105572215, 'slip_spread_k': 0.17935888121836607, 'spread_hl_frac': 0.024920429093850192, 'bb_std_mult': 2.241440671275494, 'rsi_os': 45, 'rsi_ob': 85, 'vol_spike': 0.2767687787426714, 'adx_thresh': 27.707747451233708, 'atr_min_pct': 0.02472815559678584, 'atr_max_pct': 0.017187204052934474, 'tp_mult': 2.2644340611485916, 'tsl_mult': 0.8363080374423477, 'strategy': 'mean_reversion', 'time_stop': 209, 'use_sma': False, 'use_atr': True, 'use_adx': True, 'use_ema': True, 'use_spike': True, 'rsi_required': False, 'edge_k': 1.4151894212618121, 'edge_cap': 0.4807446600088139, 'bull_strategy': 'mean_reversion', 'bull_bb_std_mult': 2.8294342785580033, 'bull_rsi_os': 47, 'bull_rsi_ob': 48, 'bull_adx_thresh': 19.111226424461965, 'bull_atr_min_pct': 0.002615569454055131, 'bull_atr_max_pct': 0.11695160092286447, 'bull_tp_mult': 2.651146343509127, 'bull_tsl_mult': 0.19204497252533964, 'bull_time_stop': 176, 'bull_use_sma': True, 'bull_use_ema': True, 'bull_use_atr': True, 'bull_use_adx': True, 'bull_use_spike': False, 'bull_rsi_required': False, 'bear_strategy': 'mean_reversion', 'bear_bb_std_mult': 2.7018017405950125, 'bear_rsi_os': 5, 'bear_rsi_ob': 80, 'bear_adx_thresh': 18.768864275600983, 'bear_atr_min_pct': 0.01441983182253438, 'bear_atr_max_pct': 0.029867787525708338, 'bear_tp_mult': 1.6643512079511331, 'bear_tsl_mult': 0.7840903060860123, 'bear_time_stop': 193, 'bear_use_sma': False, 'bear_use_ema': True, 'bear_use_atr': False, 'bear_use_adx': False, 'bear_use_spike': False, 'bear_rsi_required': False, 'sideways_strategy': 'breakout', 'sideways_bb_std_mult': 3.2289754352368174, 'sideways_rsi_os': 40, 'sideways_rsi_ob': 57, 'sideways_adx_thresh': 11.425931166704515, 'sideways_atr_min_pct': 0.02108685643155761, 'sideways_atr_max_pct': 0.05611500057952834, 'sideways_tp_mult': 2.7256254085675704, 'sideways_tsl_mult': 0.9839811605478457, 'sideways_time_stop': 163, 'sideways_use_sma': False, 'sideways_use_ema': True, 'sideways_use_atr': True, 'sideways_use_adx': False, 'sideways_use_spike': False, 'sideways_rsi_required': True}.
[I 2025-08-30 19:01:10,850] Trial 286 finished with values: [-1000000000.0, 1000000000.0] and parameters: {'p_sma': 36, 'p_std': 45, 'p_atr': 10, 'p_adx': 20, 'rsi_period': 23, 'ema1': 21, 'ema2': 31, 'slip_atr_k': 0.06955088312959055, 'slip_spread_k': 0.18148364110952045, 'spread_hl_frac': 0.02470711273683448, 'bb_std_mult': 1.5224168758500238, 'rsi_os': 45, 'rsi_ob': 69, 'vol_spike': 0.277208560510404, 'adx_thresh': 30.170521740999085, 'atr_min_pct': 0.024626031699923043, 'atr_max_pct': 0.09635387206604992, 'tp_mult': 2.2581831649970927, 'tsl_mult': 0.7512930224953864, 'strategy': 'mean_reversion', 'time_stop': 188, 'use_sma': False, 'use_atr': True, 'use_adx': True, 'use_ema': True, 'use_spike': True, 'rsi_required': False, 'edge_k': 1.9827334630515505, 'edge_cap': 0.49079980120285205, 'bull_strategy': 'mean_reversion', 'bull_bb_std_mult': 3.0274848379897614, 'bull_rsi_os': 24, 'bull_rsi_ob': 48, 'bull_adx_thresh': 19.219330085896445, 'bull_atr_min_pct': 0.0029124419945510066, 'bull_atr_max_pct': 0.1182737512852239, 'bull_tp_mult': 2.74443812327463, 'bull_tsl_mult': 0.4996699099384213, 'bull_time_stop': 194, 'bull_use_sma': True, 'bull_use_ema': True, 'bull_use_atr': True, 'bull_use_adx': False, 'bull_use_spike': True, 'bull_rsi_required': True, 'bear_strategy': 'mean_reversion', 'bear_bb_std_mult': 2.8867348529667787, 'bear_rsi_os': 47, 'bear_rsi_ob': 48, 'bear_adx_thresh': 18.586649593329653, 'bear_atr_min_pct': 0.0032025628990303735, 'bear_atr_max_pct': 0.030526423281069196, 'bear_tp_mult': 2.558699183942307, 'bear_tsl_mult': 0.06829880698963497, 'bear_time_stop': 53, 'bear_use_sma': False, 'bear_use_ema': True, 'bear_use_atr': True, 'bear_use_adx': False, 'bear_use_spike': False, 'bear_rsi_required': False, 'sideways_strategy': 'mean_reversion', 'sideways_bb_std_mult': 3.241118290815684, 'sideways_rsi_os': 38, 'sideways_rsi_ob': 92, 'sideways_adx_thresh': 10.930495070939878, 'sideways_atr_min_pct': 0.016885044707910624, 'sideways_atr_max_pct': 0.12435855357006154, 'sideways_tp_mult': 1.0117196322988213, 'sideways_tsl_mult': 0.5798096532684903, 'sideways_time_stop': 151, 'sideways_use_sma': False, 'sideways_use_ema': True, 'sideways_use_atr': True, 'sideways_use_adx': False, 'sideways_use_spike': False, 'sideways_rsi_required': False}.
[I 2025-08-30 19:01:12,127] Trial 288 finished with values: [-1000000000.0, 1000000000.0] and parameters: {'p_sma': 10, 'p_std': 28, 'p_atr': 19, 'p_adx': 28, 'rsi_period': 23, 'ema1': 29, 'ema2': 17, 'slip_atr_k': 0.0559594086534147, 'slip_spread_k': 0.11657039402688157, 'spread_hl_frac': 0.02466873222174045, 'bb_std_mult': 1.7867806896530343, 'rsi_os': 46, 'rsi_ob': 82, 'vol_spike': 0.18531889230675486, 'adx_thresh': 27.651257098943134, 'atr_min_pct': 0.014184428720517677, 'atr_max_pct': 0.10149557896168468, 'tp_mult': 2.283479151027391, 'tsl_mult': 0.33059701690062915, 'strategy': 'mean_reversion', 'time_stop': 189, 'use_sma': False, 'use_atr': False, 'use_adx': True, 'use_ema': False, 'use_spike': True, 'rsi_required': False, 'edge_k': 1.6050204827126973, 'edge_cap': 0.508513362581315, 'bull_strategy': 'mean_reversion', 'bull_bb_std_mult': 2.8419986980358503, 'bull_rsi_os': 24, 'bull_rsi_ob': 45, 'bull_adx_thresh': 19.02334387599437, 'bull_atr_min_pct': 0.0028144286084474026, 'bull_atr_max_pct': 0.060004945346718214, 'bull_tp_mult': 2.732608140297728, 'bull_tsl_mult': 0.5092594457845818, 'bull_time_stop': 195, 'bull_use_sma': True, 'bull_use_ema': True, 'bull_use_atr': True, 'bull_use_adx': False, 'bull_use_spike': True, 'bull_rsi_required': True, 'bear_strategy': 'breakout', 'bear_bb_std_mult': 2.8888068493868237, 'bear_rsi_os': 40, 'bear_rsi_ob': 73, 'bear_adx_thresh': 16.636953149892214, 'bear_atr_min_pct': 0.014527625268097479, 'bear_atr_max_pct': 0.028450744206758197, 'bear_tp_mult': 1.4123293736497278, 'bear_tsl_mult': 0.7791655575319831, 'bear_time_stop': 44, 'bear_use_sma': False, 'bear_use_ema': True, 'bear_use_atr': True, 'bear_use_adx': False, 'bear_use_spike': False, 'bear_rsi_required': False, 'sideways_strategy': 'mean_reversion', 'sideways_bb_std_mult': 0.9038465827887057, 'sideways_rsi_os': 37, 'sideways_rsi_ob': 66, 'sideways_adx_thresh': 10.566787334360694, 'sideways_atr_min_pct': 0.011543378988028475, 'sideways_atr_max_pct': 0.14774655945803514, 'sideways_tp_mult': 1.2801509912392965, 'sideways_tsl_mult': 0.9414576632641058, 'sideways_time_stop': 150, 'sideways_use_sma': False, 'sideways_use_ema': True, 'sideways_use_atr': True, 'sideways_use_adx': False, 'sideways_use_spike': False, 'sideways_rsi_required': False}.
