[I 2025-08-30 19:43:49,556] Trial 646 finished with values: [-1000000000.0, 1000000000.0] and parameters: {'p_sma': 35, 'p_std': 35, 'p_atr': 14, 'p_adx': 19, 'rsi_period': 50, 'ema1': 14, 'ema2': 31, 'slip_atr_k': 0.2053895595726412, 'slip_spread_k': 0.15711484073410126, 'spread_hl_frac': 0.031868178665085165, 'bb_std_mult': 2.8519033628823665, 'rsi_os': 46, 'rsi_ob': 89, 'vol_spike': 0.03664079622321509, 'adx_thresh': 6.032343031640723, 'atr_min_pct': 0.02489222501114489, 'atr_max_pct': 0.09587857652103993, 'tp_mult': 2.184465453014094, 'tsl_mult': 0.8890317773039527, 'strategy': 'mean_reversion', 'time_stop': 249, 'use_sma': False, 'use_atr': True, 'use_adx': True, 'use_ema': True, 'use_spike': True, 'rsi_required': True, 'edge_k': 0.6130171344501614, 'edge_cap': 0.12056544898515098, 'bull_strategy': 'mean_reversion', 'bull_bb_std_mult': 3.175416877351355, 'bull_rsi_os': 14, 'bull_rsi_ob': 51, 'bull_adx_thresh': 17.928118140924887, 'bull_atr_min_pct': 0.010689143656073964, 'bull_atr_max_pct': 0.12592592602414024, 'bull_tp_mult': 2.8364825802532216, 'bull_tsl_mult': 0.8272906978328449, 'bull_time_stop': 274, 'bull_use_sma': False, 'bull_use_ema': True, 'bull_use_atr': False, 'bull_use_adx': True, 'bull_use_spike': False, 'bull_rsi_required': False, 'bear_strategy': 'breakout', 'bear_bb_std_mult': 3.0095206751602555, 'bear_rsi_os': 35, 'bear_rsi_ob': 77, 'bear_adx_thresh': 30.421147693431823, 'bear_atr_min_pct': 0.003930058587213424, 'bear_atr_max_pct': 0.11901986760599995, 'bear_tp_mult': 1.8534413362409545, 'bear_tsl_mult': 0.2778828941063221, 'bear_time_stop': 123, 'bear_use_sma': True, 'bear_use_ema': False, 'bear_use_atr': False, 'bear_use_adx': False, 'bear_use_spike': False, 'bear_rsi_required': False, 'sideways_strategy': 'breakout', 'sideways_bb_std_mult': 0.6490179003180274, 'sideways_rsi_os': 8, 'sideways_rsi_ob': 60, 'sideways_adx_thresh': 23.053136658887738, 'sideways_atr_min_pct': 0.0046272600945626565, 'sideways_atr_max_pct': 0.13677731292066628, 'sideways_tp_mult': 1.121701270189523, 'sideways_tsl_mult': 0.30916410470741973, 'sideways_time_stop': 153, 'sideways_use_sma': False, 'sideways_use_ema': True, 'sideways_use_atr': True, 'sideways_use_adx': True, 'sideways_use_spike': False, 'sideways_rsi_required': True}.
[I 2025-08-30 19:43:49,675] Trial 649 finished with values: [-1000000000.0, 1000000000.0] and parameters: {'p_sma': 6, 'p_std': 32, 'p_atr': 9, 'p_adx': 20, 'rsi_period': 23, 'ema1': 27, 'ema2': 10, 'slip_atr_k': 0.2048220108133232, 'slip_spread_k': 0.37495963444016345, 'spread_hl_frac': 0.039532778234098495, 'bb_std_mult': 2.171366563682923, 'rsi_os': 40, 'rsi_ob': 89, 'vol_spike': 0.11356401585451226, 'adx_thresh': 29.994887905453943, 'atr_min_pct': 0.023751690313742677, 'atr_max_pct': 0.07462765559084711, 'tp_mult': 2.2691887468060115, 'tsl_mult': 0.8115884805452238, 'strategy': 'breakout', 'time_stop': 193, 'use_sma': False, 'use_atr': True, 'use_adx': True, 'use_ema': True, 'use_spike': False, 'rsi_required': False, 'edge_k': 0.9233801733067595, 'edge_cap': 0.4534911461305435, 'bull_strategy': 'mean_reversion', 'bull_bb_std_mult': 3.204801338910603, 'bull_rsi_os': 32, 'bull_rsi_ob': 67, 'bull_adx_thresh': 26.979248595016095, 'bull_atr_min_pct': 0.002434346261960191, 'bull_atr_max_pct': 0.12578831854595662, 'bull_tp_mult': 1.342275362776908, 'bull_tsl_mult': 0.9783282765621995, 'bull_time_stop': 288, 'bull_use_sma': False, 'bull_use_ema': True, 'bull_use_atr': False, 'bull_use_adx': False, 'bull_use_spike': False, 'bull_rsi_required': True, 'bear_strategy': 'breakout', 'bear_bb_std_mult': 2.918078523831255, 'bear_rsi_os': 49, 'bear_rsi_ob': 77, 'bear_adx_thresh': 24.20619882093333, 'bear_atr_min_pct': 0.015908867238918656, 'bear_atr_max_pct': 0.018583494164730367, 'bear_tp_mult': 2.746720790856366, 'bear_tsl_mult': 0.8018631184025711, 'bear_time_stop': 206, 'bear_use_sma': True, 'bear_use_ema': True, 'bear_use_atr': True, 'bear_use_adx': True, 'bear_use_spike': False, 'bear_rsi_required': False, 'sideways_strategy': 'breakout', 'sideways_bb_std_mult': 1.9825810131241828, 'sideways_rsi_os': 35, 'sideways_rsi_ob': 75, 'sideways_adx_thresh': 19.208847398956312, 'sideways_atr_min_pct': 0.022776044997340338, 'sideways_atr_max_pct': 0.1477714188033521, 'sideways_tp_mult': 2.043029420663069, 'sideways_tsl_mult': 0.9291192317502235, 'sideways_time_stop': 51, 'sideways_use_sma': False, 'sideways_use_ema': True, 'sideways_use_atr': True, 'sideways_use_adx': True, 'sideways_use_spike': False, 'sideways_rsi_required': True}.
[I 2025-08-30 19:43:50,498] Trial 650 finished with values: [-1000000000.0, 1000000000.0] and parameters: {'p_sma': 13, 'p_std': 33, 'p_atr': 9, 'p_adx': 24, 'rsi_period': 23, 'ema1': 9, 'ema2': 31, 'slip_atr_k': 0.18663985223362478, 'slip_spread_k': 0.16276448807146576, 'spread_hl_frac': 0.03922229261239648, 'bb_std_mult': 1.1836233360200237, 'rsi_os': 50, 'rsi_ob': 80, 'vol_spike': 0.07238476096136691, 'adx_thresh': 23.2645814215953, 'atr_min_pct': 0.023723304240892324, 'atr_max_pct': 0.10529141492706205, 'tp_mult': 2.248520082530788, 'tsl_mult': 0.8147997096187202, 'strategy': 'mean_reversion', 'time_stop': 193, 'use_sma': False, 'use_atr': True, 'use_adx': True, 'use_ema': True, 'use_spike': False, 'rsi_required': False, 'edge_k': 0.5351871585254686, 'edge_cap': 0.45420556576553545, 'bull_strategy': 'mean_reversion', 'bull_bb_std_mult': 3.254075474138189, 'bull_rsi_os': 46, 'bull_rsi_ob': 48, 'bull_adx_thresh': 15.89108711952792, 'bull_atr_min_pct': 0.01382850539375177, 'bull_atr_max_pct': 0.09262280877651903, 'bull_tp_mult': 2.9180769001225753, 'bull_tsl_mult': 0.5342866005061276, 'bull_time_stop': 53, 'bull_use_sma': False, 'bull_use_ema': True, 'bull_use_atr': False, 'bull_use_adx': False, 'bull_use_spike': False, 'bull_rsi_required': True, 'bear_strategy': 'breakout', 'bear_bb_std_mult': 2.9264778514775, 'bear_rsi_os': 34, 'bear_rsi_ob': 88, 'bear_adx_thresh': 18.080424317959597, 'bear_atr_min_pct': 0.016436737538592455, 'bear_atr_max_pct': 0.03249218482235736, 'bear_tp_mult': 2.760251849400149, 'bear_tsl_mult': 0.5304012589648426, 'bear_time_stop': 205, 'bear_use_sma': True, 'bear_use_ema': True, 'bear_use_atr': False, 'bear_use_adx': False, 'bear_use_spike': False, 'bear_rsi_required': True, 'sideways_strategy': 'breakout', 'sideways_bb_std_mult': 3.1973282093077313, 'sideways_rsi_os': 35, 'sideways_rsi_ob': 61, 'sideways_adx_thresh': 33.26832074843324, 'sideways_atr_min_pct': 0.02278995907065613, 'sideways_atr_max_pct': 0.14775864099548067, 'sideways_tp_mult': 2.8804971694584802, 'sideways_tsl_mult': 0.9723818423408632, 'sideways_time_stop': 155, 'sideways_use_sma': False, 'sideways_use_ema': True, 'sideways_use_atr': True, 'sideways_use_adx': False, 'sideways_use_spike': False, 'sideways_rsi_required': True}.
[I 2025-08-30 19:43:50,520] Trial 651 finished with values: [-1000000000.0, 1000000000.0] and parameters: {'p_sma': 12, 'p_std': 40, 'p_atr': 8, 'p_adx': 19, 'rsi_period': 23, 'ema1': 11, 'ema2': 31, 'slip_atr_k': 0.09016145194148434, 'slip_spread_k': 0.009502211328530574, 'spread_hl_frac': 0.039662236577937916, 'bb_std_mult': 3.2593365826463025, 'rsi_os': 52, 'rsi_ob': 67, 'vol_spike': 0.2545595859437189, 'adx_thresh': 29.91920933477042, 'atr_min_pct': 0.02350944261610244, 'atr_max_pct': 0.08971073894071172, 'tp_mult': 2.3128341159848893, 'tsl_mult': 0.811061862822979, 'strategy': 'mean_reversion', 'time_stop': 193, 'use_sma': False, 'use_atr': True, 'use_adx': False, 'use_ema': True, 'use_spike': False, 'rsi_required': False, 'edge_k': 0.19023597481713111, 'edge_cap': 0.21118713800070782, 'bull_strategy': 'mean_reversion', 'bull_bb_std_mult': 3.320417538185696, 'bull_rsi_os': 25, 'bull_rsi_ob': 71, 'bull_adx_thresh': 25.3803383782231, 'bull_atr_min_pct': 0.0025402679607233504, 'bull_atr_max_pct': 0.06774341775668974, 'bull_tp_mult': 2.7619525477546576, 'bull_tsl_mult': 0.5792954870143363, 'bull_time_stop': 51, 'bull_use_sma': True, 'bull_use_ema': True, 'bull_use_atr': True, 'bull_use_adx': False, 'bull_use_spike': False, 'bull_rsi_required': True, 'bear_strategy': 'mean_reversion', 'bear_bb_std_mult': 1.936110162359517, 'bear_rsi_os': 6, 'bear_rsi_ob': 77, 'bear_adx_thresh': 21.534642936325604, 'bear_atr_min_pct': 0.014233053406092837, 'bear_atr_max_pct': 0.06595898818798365, 'bear_tp_mult': 1.8494235037067526, 'bear_tsl_mult': 0.8042164495276183, 'bear_time_stop': 205, 'bear_use_sma': True, 'bear_use_ema': True, 'bear_use_atr': False, 'bear_use_adx': False, 'bear_use_spike': False, 'bear_rsi_required': True, 'sideways_strategy': 'breakout', 'sideways_bb_std_mult': 3.2309833550657543, 'sideways_rsi_os': 50, 'sideways_rsi_ob': 60, 'sideways_adx_thresh': 19.645659007895258, 'sideways_atr_min_pct': 0.02180602025398897, 'sideways_atr_max_pct': 0.10240951358447309, 'sideways_tp_mult': 1.116556832581083, 'sideways_tsl_mult': 0.9770008357330976, 'sideways_time_stop': 126, 'sideways_use_sma': True, 'sideways_use_ema': True, 'sideways_use_atr': True, 'sideways_use_adx': False, 'sideways_use_spike': False, 'sideways_rsi_required': True}.
[I 2025-08-30 19:43:50,526] Trial 653 finished with values: [-1000000000.0, 1000000000.0] and parameters: {'p_sma': 5, 'p_std': 31, 'p_atr': 29, 'p_adx': 27, 'rsi_period': 19, 'ema1': 9, 'ema2': 31, 'slip_atr_k': 0.05517711259264596, 'slip_spread_k': 0.012883278589684466, 'spread_hl_frac': 0.022600111070348188, 'bb_std_mult': 1.351717168248321, 'rsi_os': 53, 'rsi_ob': 82, 'vol_spike': 0.09445551480236647, 'adx_thresh': 34.162158559322464, 'atr_min_pct': 0.019519730384250176, 'atr_max_pct': 0.0909611544155081, 'tp_mult': 2.3138629131990673, 'tsl_mult': 0.31210113491043273, 'strategy': 'mean_reversion', 'time_stop': 185, 'use_sma': False, 'use_atr': True, 'use_adx': False, 'use_ema': False, 'use_spike': False, 'rsi_required': False, 'edge_k': 0.5093526243863672, 'edge_cap': 0.21494504921206387, 'bull_strategy': 'mean_reversion', 'bull_bb_std_mult': 3.327516684129517, 'bull_rsi_os': 47, 'bull_rsi_ob': 84, 'bull_adx_thresh': 17.61419859218932, 'bull_atr_min_pct': 0.013782018401590393, 'bull_atr_max_pct': 0.12025837870679887, 'bull_tp_mult': 2.5933804594338, 'bull_tsl_mult': 0.5781284116245501, 'bull_time_stop': 50, 'bull_use_sma': True, 'bull_use_ema': True, 'bull_use_atr': True, 'bull_use_adx': False, 'bull_use_spike': False, 'bull_rsi_required': True, 'bear_strategy': 'mean_reversion', 'bear_bb_std_mult': 2.9361667637647284, 'bear_rsi_os': 53, 'bear_rsi_ob': 46, 'bear_adx_thresh': 20.6719462080159, 'bear_atr_min_pct': 0.013195109689365197, 'bear_atr_max_pct': 0.06674977760428448, 'bear_tp_mult': 1.6825877213379334, 'bear_tsl_mult': 0.7692386121616746, 'bear_time_stop': 174, 'bear_use_sma': False, 'bear_use_ema': True, 'bear_use_atr': False, 'bear_use_adx': False, 'bear_use_spike': True, 'bear_rsi_required': True, 'sideways_strategy': 'breakout', 'sideways_bb_std_mult': 1.5306669539067905, 'sideways_rsi_os': 27, 'sideways_rsi_ob': 58, 'sideways_adx_thresh': 33.2506254431341, 'sideways_atr_min_pct': 0.001510509566175714, 'sideways_atr_max_pct': 0.11817008882458131, 'sideways_tp_mult': 1.0517983429587474, 'sideways_tsl_mult': 0.9724162677279771, 'sideways_time_stop': 172, 'sideways_use_sma': True, 'sideways_use_ema': True, 'sideways_use_atr': True, 'sideways_use_adx': False, 'sideways_use_spike': True, 'sideways_rsi_required': True}.
[I 2025-08-30 19:43:53,437] Trial 654 finished with values: [-1000000000.0, 1000000000.0] and parameters: {'p_sma': 55, 'p_std': 11, 'p_atr': 16, 'p_adx': 27, 'rsi_period': 27, 'ema1': 25, 'ema2': 33, 'slip_atr_k': 0.2160528023769779, 'slip_spread_k': 0.0017306125639571235, 'spread_hl_frac': 0.02310770964494692, 'bb_std_mult': 3.252762191989382, 'rsi_os': 53, 'rsi_ob': 86, 'vol_spike': 0.13925678775347822, 'adx_thresh': 19.524427941130714, 'atr_min_pct': 0.022882486005036538, 'atr_max_pct': 0.08978442798290666, 'tp_mult': 2.358637483872474, 'tsl_mult': 0.6989420026343665, 'strategy': 'mean_reversion', 'time_stop': 185, 'use_sma': False, 'use_atr': True, 'use_adx': False, 'use_ema': False, 'use_spike': True, 'rsi_required': False, 'edge_k': 0.18378603605977226, 'edge_cap': 0.49957146397813607, 'bull_strategy': 'mean_reversion', 'bull_bb_std_mult': 3.309615212454281, 'bull_rsi_os': 23, 'bull_rsi_ob': 46, 'bull_adx_thresh': 29.059362941962238, 'bull_atr_min_pct': 0.0016124573118885433, 'bull_atr_max_pct': 0.0614750824659966, 'bull_tp_mult': 1.745147225247265, 'bull_tsl_mult': 0.5838327368133026, 'bull_time_stop': 300, 'bull_use_sma': True, 'bull_use_ema': True, 'bull_use_atr': True, 'bull_use_adx': False, 'bull_use_spike': False, 'bull_rsi_required': True, 'bear_strategy': 'mean_reversion', 'bear_bb_std_mult': 1.2495115093981575, 'bear_rsi_os': 25, 'bear_rsi_ob': 86, 'bear_adx_thresh': 11.087655533945181, 'bear_atr_min_pct': 0.014300562362004084, 'bear_atr_max_pct': 0.05068301022017854, 'bear_tp_mult': 1.5782484591055723, 'bear_tsl_mult': 0.7165005985218281, 'bear_time_stop': 187, 'bear_use_sma': False, 'bear_use_ema': True, 'bear_use_atr': False, 'bear_use_adx': False, 'bear_use_spike': True, 'bear_rsi_required': True, 'sideways_strategy': 'mean_reversion', 'sideways_bb_std_mult': 3.044464605315304, 'sideways_rsi_os': 36, 'sideways_rsi_ob': 58, 'sideways_adx_thresh': 10.342685844979885, 'sideways_atr_min_pct': 0.001631717513661526, 'sideways_atr_max_pct': 0.07885533452049108, 'sideways_tp_mult': 1.0992511955862894, 'sideways_tsl_mult': 0.9615541080756385, 'sideways_time_stop': 126, 'sideways_use_sma': True, 'sideways_use_ema': True, 'sideways_use_atr': True, 'sideways_use_adx': False, 'sideways_use_spike': True, 'sideways_rsi_required': True}.
[I 2025-08-30 19:43:53,865] Trial 655 finished with values: [-1000000000.0, 1000000000.0] and parameters: {'p_sma': 5, 'p_std': 31, 'p_atr': 29, 'p_adx': 21, 'rsi_period': 70, 'ema1': 25, 'ema2': 42, 'slip_atr_k': 0.07551215969493123, 'slip_spread_k': 0.7146461987449327, 'spread_hl_frac': 0.022930749115508187, 'bb_std_mult': 0.798037735370432, 'rsi_os': 51, 'rsi_ob': 82, 'vol_spike': 0.13262868026229474, 'adx_thresh': 33.99110436105828, 'atr_min_pct': 0.02291800792978449, 'atr_max_pct': 0.09337750150839544, 'tp_mult': 1.3087590010161163, 'tsl_mult': 0.832467803434231, 'strategy': 'mean_reversion', 'time_stop': 184, 'use_sma': False, 'use_atr': False, 'use_adx': False, 'use_ema': False, 'use_spike': True, 'rsi_required': False, 'edge_k': 0.000521792415403205, 'edge_cap': 0.5004627816452406, 'bull_strategy': 'mean_reversion', 'bull_bb_std_mult': 3.0601724369403103, 'bull_rsi_os': 34, 'bull_rsi_ob': 84, 'bull_adx_thresh': 12.3005220205084, 'bull_atr_min_pct': 0.02718310971653707, 'bull_atr_max_pct': 0.12054349785455579, 'bull_tp_mult': 2.6144818626931436, 'bull_tsl_mult': 0.5326747461042829, 'bull_time_stop': 195, 'bull_use_sma': True, 'bull_use_ema': True, 'bull_use_atr': True, 'bull_use_adx': False, 'bull_use_spike': False, 'bull_rsi_required': True, 'bear_strategy': 'mean_reversion', 'bear_bb_std_mult': 3.3933816387872504, 'bear_rsi_os': 53, 'bear_rsi_ob': 46, 'bear_adx_thresh': 33.92378353088763, 'bear_atr_min_pct': 0.013404632840854601, 'bear_atr_max_pct': 0.0312424155954165, 'bear_tp_mult': 2.147375554732164, 'bear_tsl_mult': 0.7200778992050423, 'bear_time_stop': 186, 'bear_use_sma': False, 'bear_use_ema': True, 'bear_use_atr': False, 'bear_use_adx': False, 'bear_use_spike': True, 'bear_rsi_required': True, 'sideways_strategy': 'mean_reversion', 'sideways_bb_std_mult': 3.085981215580706, 'sideways_rsi_os': 36, 'sideways_rsi_ob': 64, 'sideways_adx_thresh': 20.710970949655678, 'sideways_atr_min_pct': 0.008094616533013112, 'sideways_atr_max_pct': 0.03703801442494262, 'sideways_tp_mult': 1.0534396745670496, 'sideways_tsl_mult': 0.9607036491569768, 'sideways_time_stop': 41, 'sideways_use_sma': True, 'sideways_use_ema': True, 'sideways_use_atr': False, 'sideways_use_adx': False, 'sideways_use_spike': True, 'sideways_rsi_required': True}.
[I 2025-08-30 19:44:03,290] Trial 652 finished with values: [-1000000000.0, 1000000000.0] and parameters: {'p_sma': 12, 'p_std': 31, 'p_atr': 27, 'p_adx': 9, 'rsi_period': 19, 'ema1': 27, 'ema2': 21, 'slip_atr_k': 0.05286217094171404, 'slip_spread_k': 0.1118519793629001, 'spread_hl_frac': 0.005263459572163287, 'bb_std_mult': 0.7498925284200029, 'rsi_os': 12, 'rsi_ob': 80, 'vol_spike': 0.13960753599950926, 'adx_thresh': 29.85406577898636, 'atr_min_pct': 0.022938197784544347, 'atr_max_pct': 0.049751600959585654, 'tp_mult': 2.2622808606344886, 'tsl_mult': 0.7129686182583105, 'strategy': 'mean_reversion', 'time_stop': 194, 'use_sma': False, 'use_atr': True, 'use_adx': False, 'use_ema': False, 'use_spike': False, 'rsi_required': False, 'edge_k': 0.5039464213795172, 'edge_cap': 0.45363418384322424, 'bull_strategy': 'mean_reversion', 'bull_bb_std_mult': 0.8943337507545333, 'bull_rsi_os': 16, 'bull_rsi_ob': 84, 'bull_adx_thresh': 20.07172299301897, 'bull_atr_min_pct': 0.0026504753184225334, 'bull_atr_max_pct': 0.12165778720971003, 'bull_tp_mult': 2.1181825116554927, 'bull_tsl_mult': 0.5376267955820215, 'bull_time_stop': 163, 'bull_use_sma': True, 'bull_use_ema': True, 'bull_use_atr': True, 'bull_use_adx': False, 'bull_use_spike': False, 'bull_rsi_required': True, 'bear_strategy': 'mean_reversion', 'bear_bb_std_mult': 1.9151285670522755, 'bear_rsi_os': 6, 'bear_rsi_ob': 88, 'bear_adx_thresh': 34.385509155754875, 'bear_atr_min_pct': 0.014292196750055951, 'bear_atr_max_pct': 0.013230514273952984, 'bear_tp_mult': 2.7763380566672815, 'bear_tsl_mult': 0.138412827779392, 'bear_time_stop': 172, 'bear_use_sma': False, 'bear_use_ema': True, 'bear_use_atr': False, 'bear_use_adx': False, 'bear_use_spike': True, 'bear_rsi_required': True, 'sideways_strategy': 'breakout', 'sideways_bb_std_mult': 3.246122569661792, 'sideways_rsi_os': 35, 'sideways_rsi_ob': 58, 'sideways_adx_thresh': 24.23785045081243, 'sideways_atr_min_pct': 0.006175387235073082, 'sideways_atr_max_pct': 0.14763416971615018, 'sideways_tp_mult': 1.0435887040477065, 'sideways_tsl_mult': 0.4061203848312258, 'sideways_time_stop': 175, 'sideways_use_sma': True, 'sideways_use_ema': True, 'sideways_use_atr': True, 'sideways_use_adx': False, 'sideways_use_spike': False, 'sideways_rsi_required': True}.
[I 2025-08-30 19:44:05,998] Trial 658 finished with values: [-1000000000.0, 1000000000.0] and parameters: {'p_sma': 9, 'p_std': 8, 'p_atr': 19, 'p_adx': 30, 'rsi_period': 13, 'ema1': 26, 'ema2': 37, 'slip_atr_k': 0.0751196690401215, 'slip_spread_k': 0.12051535355188496, 'spread_hl_frac': 0.025937197103143385, 'bb_std_mult': 1.254169971347629, 'rsi_os': 50, 'rsi_ob': 53, 'vol_spike': 0.2878194703649014, 'adx_thresh': 32.94801711852213, 'atr_min_pct': 0.0243817344207511, 'atr_max_pct': 0.04613172730262488, 'tp_mult': 1.754709059293249, 'tsl_mult': 0.20363807870103345, 'strategy': 'mean_reversion', 'time_stop': 175, 'use_sma': True, 'use_atr': False, 'use_adx': True, 'use_ema': False, 'use_spike': True, 'rsi_required': True, 'edge_k': 0.14269212995697036, 'edge_cap': 0.6006775547875124, 'bull_strategy': 'mean_reversion', 'bull_bb_std_mult': 2.409006064644006, 'bull_rsi_os': 39, 'bull_rsi_ob': 53, 'bull_adx_thresh': 31.332885098914122, 'bull_atr_min_pct': 0.0011718545407500384, 'bull_atr_max_pct': 0.09702411157976844, 'bull_tp_mult': 2.192381251402907, 'bull_tsl_mult': 0.16024313147948782, 'bull_time_stop': 164, 'bull_use_sma': False, 'bull_use_ema': False, 'bull_use_atr': True, 'bull_use_adx': False, 'bull_use_spike': True, 'bull_rsi_required': True, 'bear_strategy': 'breakout', 'bear_bb_std_mult': 2.827064077440037, 'bear_rsi_os': 12, 'bear_rsi_ob': 75, 'bear_adx_thresh': 16.97669714406712, 'bear_atr_min_pct': 0.015124981844922546, 'bear_atr_max_pct': 0.03613872154262705, 'bear_tp_mult': 2.6677765839343, 'bear_tsl_mult': 0.026807470159287528, 'bear_time_stop': 197, 'bear_use_sma': True, 'bear_use_ema': False, 'bear_use_atr': True, 'bear_use_adx': False, 'bear_use_spike': False, 'bear_rsi_required': True, 'sideways_strategy': 'breakout', 'sideways_bb_std_mult': 1.861360366011284, 'sideways_rsi_os': 45, 'sideways_rsi_ob': 55, 'sideways_adx_thresh': 5.802143857832776, 'sideways_atr_min_pct': 0.00623398380274545, 'sideways_atr_max_pct': 0.1336308130421989, 'sideways_tp_mult': 2.246493556360489, 'sideways_tsl_mult': 0.4068809283164413, 'sideways_time_stop': 145, 'sideways_use_sma': False, 'sideways_use_ema': False, 'sideways_use_atr': True, 'sideways_use_adx': False, 'sideways_use_spike': False, 'sideways_rsi_required': False}.
