[I 2025-08-30 19:21:18,148] Trial 455 finished with values: [-0.03147086273860078, 0.03152575457714032] and parameters: {'p_sma': 7, 'p_std': 56, 'p_atr': 16, 'p_adx': 21, 'rsi_period': 24, 'ema1': 18, 'ema2': 25, 'slip_atr_k': 0.06300110011616716, 'slip_spread_k': 0.7001866159188144, 'spread_hl_frac': 0.022928384784274756, 'bb_std_mult': 1.3077850944358702, 'rsi_os': 45, 'rsi_ob': 78, 'vol_spike': 0.08600300952927287, 'adx_thresh': 12.622090525970904, 'atr_min_pct': 0.024099158902453656, 'atr_max_pct': 0.1430920861359954, 'tp_mult': 2.2152205008090347, 'tsl_mult': 0.321868277017748, 'strategy': 'mean_reversion', 'time_stop': 199, 'use_sma': True, 'use_atr': True, 'use_adx': True, 'use_ema': False, 'use_spike': False, 'rsi_required': True, 'edge_k': 0.5327951587467181, 'edge_cap': 0.9214350214632094, 'bull_strategy': 'mean_reversion', 'bull_bb_std_mult': 3.0496933976681673, 'bull_rsi_os': 30, 'bull_rsi_ob': 45, 'bull_adx_thresh': 17.494077040267886, 'bull_atr_min_pct': 0.0007920446512792393, 'bull_atr_max_pct': 0.11886292125817839, 'bull_tp_mult': 1.728022505889563, 'bull_tsl_mult': 0.843410623534889, 'bull_time_stop': 12, 'bull_use_sma': True, 'bull_use_ema': True, 'bull_use_atr': True, 'bull_use_adx': False, 'bull_use_spike': False, 'bull_rsi_required': False, 'bear_strategy': 'breakout', 'bear_bb_std_mult': 2.718982024642427, 'bear_rsi_os': 41, 'bear_rsi_ob': 45, 'bear_adx_thresh': 19.168615572804406, 'bear_atr_min_pct': 0.016786941324163793, 'bear_atr_max_pct': 0.04072745782434221, 'bear_tp_mult': 2.508273731384352, 'bear_tsl_mult': 0.6835057560143396, 'bear_time_stop': 211, 'bear_use_sma': False, 'bear_use_ema': False, 'bear_use_atr': False, 'bear_use_adx': False, 'bear_use_spike': False, 'bear_rsi_required': True, 'sideways_strategy': 'breakout', 'sideways_bb_std_mult': 2.6279982219547424, 'sideways_rsi_os': 35, 'sideways_rsi_ob': 54, 'sideways_adx_thresh': 21.859033749855527, 'sideways_atr_min_pct': 0.00023896347379987913, 'sideways_atr_max_pct': 0.14735086709523004, 'sideways_tp_mult': 1.0152007658549036, 'sideways_tsl_mult': 0.20324501467535333, 'sideways_time_stop': 166, 'sideways_use_sma': True, 'sideways_use_ema': True, 'sideways_use_atr': True, 'sideways_use_adx': False, 'sideways_use_spike': True, 'sideways_rsi_required': True}.
[I 2025-08-30 19:21:18,356] Trial 457 finished with values: [-1000000000.0, 1000000000.0] and parameters: {'p_sma': 39, 'p_std': 48, 'p_atr': 9, 'p_adx': 20, 'rsi_period': 74, 'ema1': 26, 'ema2': 34, 'slip_atr_k': 0.0638525175450896, 'slip_spread_k': 0.6997534652282595, 'spread_hl_frac': 0.042436145527185984, 'bb_std_mult': 2.9654350763228043, 'rsi_os': 45, 'rsi_ob': 71, 'vol_spike': 0.06495085942857584, 'adx_thresh': 13.943379049058276, 'atr_min_pct': 0.019911206612568573, 'atr_max_pct': 0.08740234574048956, 'tp_mult': 2.326743611350894, 'tsl_mult': 0.7717147424765445, 'strategy': 'mean_reversion', 'time_stop': 177, 'use_sma': True, 'use_atr': True, 'use_adx': True, 'use_ema': False, 'use_spike': False, 'rsi_required': True, 'edge_k': 0.09700214011275107, 'edge_cap': 0.5594080359250507, 'bull_strategy': 'mean_reversion', 'bull_bb_std_mult': 3.0405668955081016, 'bull_rsi_os': 39, 'bull_rsi_ob': 45, 'bull_adx_thresh': 19.231374243211363, 'bull_atr_min_pct': 0.0005401613749904, 'bull_atr_max_pct': 0.03382599673427834, 'bull_tp_mult': 2.7853290044203094, 'bull_tsl_mult': 0.5225601156608739, 'bull_time_stop': 172, 'bull_use_sma': True, 'bull_use_ema': True, 'bull_use_atr': True, 'bull_use_adx': False, 'bull_use_spike': False, 'bull_rsi_required': False, 'bear_strategy': 'breakout', 'bear_bb_std_mult': 2.730128901550953, 'bear_rsi_os': 49, 'bear_rsi_ob': 73, 'bear_adx_thresh': 19.981467669278373, 'bear_atr_min_pct': 0.016791817000043285, 'bear_atr_max_pct': 0.10411212210682728, 'bear_tp_mult': 2.573969135663376, 'bear_tsl_mult': 0.08140929842236444, 'bear_time_stop': 290, 'bear_use_sma': False, 'bear_use_ema': False, 'bear_use_atr': False, 'bear_use_adx': False, 'bear_use_spike': False, 'bear_rsi_required': False, 'sideways_strategy': 'breakout', 'sideways_bb_std_mult': 3.0768187871059363, 'sideways_rsi_os': 32, 'sideways_rsi_ob': 75, 'sideways_adx_thresh': 21.80234361015885, 'sideways_atr_min_pct': 0.00010364773199431597, 'sideways_atr_max_pct': 0.1472240305175984, 'sideways_tp_mult': 1.0127014946222204, 'sideways_tsl_mult': 0.11260822700788448, 'sideways_time_stop': 141, 'sideways_use_sma': True, 'sideways_use_ema': True, 'sideways_use_atr': True, 'sideways_use_adx': False, 'sideways_use_spike': True, 'sideways_rsi_required': True}.
[I 2025-08-30 19:21:38,109] Trial 461 finished with values: [-1000000000.0, 1000000000.0] and parameters: {'p_sma': 7, 'p_std': 32, 'p_atr': 10, 'p_adx': 20, 'rsi_period': 24, 'ema1': 16, 'ema2': 43, 'slip_atr_k': 0.20326107717977626, 'slip_spread_k': 0.1287635357330595, 'spread_hl_frac': 0.025670907381074137, 'bb_std_mult': 2.3399364064607817, 'rsi_os': 48, 'rsi_ob': 81, 'vol_spike': 0.2999431083060963, 'adx_thresh': 33.29665923058226, 'atr_min_pct': 0.02407641542650179, 'atr_max_pct': 0.08825833116871194, 'tp_mult': 1.1549063973161489, 'tsl_mult': 0.8349457988037048, 'strategy': 'mean_reversion', 'time_stop': 12, 'use_sma': False, 'use_atr': True, 'use_adx': True, 'use_ema': False, 'use_spike': True, 'rsi_required': False, 'edge_k': 1.3699370341681019, 'edge_cap': 0.5617383692462542, 'bull_strategy': 'mean_reversion', 'bull_bb_std_mult': 1.0580317225098819, 'bull_rsi_os': 53, 'bull_rsi_ob': 49, 'bull_adx_thresh': 17.79108005009469, 'bull_atr_min_pct': 0.0009124690191475212, 'bull_atr_max_pct': 0.12458609344136293, 'bull_tp_mult': 1.4579461005581025, 'bull_tsl_mult': 0.5120905157994402, 'bull_time_stop': 128, 'bull_use_sma': False, 'bull_use_ema': True, 'bull_use_atr': True, 'bull_use_adx': False, 'bull_use_spike': False, 'bull_rsi_required': True, 'bear_strategy': 'breakout', 'bear_bb_std_mult': 3.0340339201760647, 'bear_rsi_os': 41, 'bear_rsi_ob': 45, 'bear_adx_thresh': 17.19421177110563, 'bear_atr_min_pct': 0.017266263657090428, 'bear_atr_max_pct': 0.03626920799262887, 'bear_tp_mult': 2.4975398805962663, 'bear_tsl_mult': 0.5809012350408901, 'bear_time_stop': 201, 'bear_use_sma': True, 'bear_use_ema': True, 'bear_use_atr': False, 'bear_use_adx': False, 'bear_use_spike': False, 'bear_rsi_required': True, 'sideways_strategy': 'breakout', 'sideways_bb_std_mult': 3.295530861657623, 'sideways_rsi_os': 22, 'sideways_rsi_ob': 85, 'sideways_adx_thresh': 13.866770145872259, 'sideways_atr_min_pct': 0.016391874220209553, 'sideways_atr_max_pct': 0.06534859768418017, 'sideways_tp_mult': 2.1384735944001267, 'sideways_tsl_mult': 0.7484782798806872, 'sideways_time_stop': 96, 'sideways_use_sma': False, 'sideways_use_ema': True, 'sideways_use_atr': True, 'sideways_use_adx': False, 'sideways_use_spike': False, 'sideways_rsi_required': True}.
[I 2025-08-30 19:21:40,698] Trial 462 finished with values: [-1000000000.0, 1000000000.0] and parameters: {'p_sma': 14, 'p_std': 28, 'p_atr': 8, 'p_adx': 20, 'rsi_period': 25, 'ema1': 26, 'ema2': 23, 'slip_atr_k': 0.06626182121197705, 'slip_spread_k': 0.1983054629322124, 'spread_hl_frac': 0.025876037018160866, 'bb_std_mult': 0.9400430224014531, 'rsi_os': 48, 'rsi_ob': 81, 'vol_spike': 0.08634979287008272, 'adx_thresh': 18.175835318961425, 'atr_min_pct': 0.024542768526356108, 'atr_max_pct': 0.07322284647567782, 'tp_mult': 2.3920682015515995, 'tsl_mult': 0.829814232990035, 'strategy': 'mean_reversion', 'time_stop': 49, 'use_sma': False, 'use_atr': True, 'use_adx': True, 'use_ema': False, 'use_spike': True, 'rsi_required': False, 'edge_k': 0.6618478625426734, 'edge_cap': 0.9317939134791258, 'bull_strategy': 'mean_reversion', 'bull_bb_std_mult': 3.1720585241360757, 'bull_rsi_os': 31, 'bull_rsi_ob': 49, 'bull_adx_thresh': 17.79826941787499, 'bull_atr_min_pct': 0.0014048986068135132, 'bull_atr_max_pct': 0.146920890657427, 'bull_tp_mult': 2.8041851348744875, 'bull_tsl_mult': 0.5965879254123786, 'bull_time_stop': 59, 'bull_use_sma': False, 'bull_use_ema': True, 'bull_use_atr': True, 'bull_use_adx': False, 'bull_use_spike': False, 'bull_rsi_required': True, 'bear_strategy': 'breakout', 'bear_bb_std_mult': 2.9139723369441795, 'bear_rsi_os': 8, 'bear_rsi_ob': 73, 'bear_adx_thresh': 17.724766666846, 'bear_atr_min_pct': 0.006652015941688473, 'bear_atr_max_pct': 0.10479694702065932, 'bear_tp_mult': 2.688439268482263, 'bear_tsl_mult': 0.7864527153846376, 'bear_time_stop': 290, 'bear_use_sma': True, 'bear_use_ema': True, 'bear_use_atr': False, 'bear_use_adx': False, 'bear_use_spike': False, 'bear_rsi_required': True, 'sideways_strategy': 'breakout', 'sideways_bb_std_mult': 3.288837335123989, 'sideways_rsi_os': 23, 'sideways_rsi_ob': 61, 'sideways_adx_thresh': 22.204037392956362, 'sideways_atr_min_pct': 0.01643435631797761, 'sideways_atr_max_pct': 0.11514343884100381, 'sideways_tp_mult': 1.0459572743877563, 'sideways_tsl_mult': 0.622922118479672, 'sideways_time_stop': 166, 'sideways_use_sma': False, 'sideways_use_ema': True, 'sideways_use_atr': True, 'sideways_use_adx': False, 'sideways_use_spike': False, 'sideways_rsi_required': True}.
[I 2025-08-30 19:21:55,166] Trial 463 finished with values: [-1000000000.0, 1000000000.0] and parameters: {'p_sma': 36, 'p_std': 48, 'p_atr': 8, 'p_adx': 20, 'rsi_period': 56, 'ema1': 19, 'ema2': 43, 'slip_atr_k': 0.21982242133405416, 'slip_spread_k': 0.15558756084441316, 'spread_hl_frac': 0.0202839108100977, 'bb_std_mult': 1.9991968244012694, 'rsi_os': 48, 'rsi_ob': 82, 'vol_spike': 0.25531337724054076, 'adx_thresh': 13.991407410057251, 'atr_min_pct': 0.023227372225199695, 'atr_max_pct': 0.08774732185740299, 'tp_mult': 2.7420340772530616, 'tsl_mult': 0.9827916061013555, 'strategy': 'mean_reversion', 'time_stop': 186, 'use_sma': False, 'use_atr': False, 'use_adx': True, 'use_ema': False, 'use_spike': True, 'rsi_required': False, 'edge_k': 1.9155617986951685, 'edge_cap': 0.5083561280101474, 'bull_strategy': 'mean_reversion', 'bull_bb_std_mult': 3.1640934250817527, 'bull_rsi_os': 21, 'bull_rsi_ob': 47, 'bull_adx_thresh': 17.96194711009446, 'bull_atr_min_pct': 0.002625242257182334, 'bull_atr_max_pct': 0.07791681582166254, 'bull_tp_mult': 2.675662773669704, 'bull_tsl_mult': 0.580658102102202, 'bull_time_stop': 59, 'bull_use_sma': False, 'bull_use_ema': True, 'bull_use_atr': True, 'bull_use_adx': False, 'bull_use_spike': False, 'bull_rsi_required': True, 'bear_strategy': 'breakout', 'bear_bb_std_mult': 0.7300522543598844, 'bear_rsi_os': 50, 'bear_rsi_ob': 48, 'bear_adx_thresh': 17.767281397257225, 'bear_atr_min_pct': 0.006563525863541574, 'bear_atr_max_pct': 0.036384208308337336, 'bear_tp_mult': 1.2731895296352378, 'bear_tsl_mult': 0.7932057962302728, 'bear_time_stop': 296, 'bear_use_sma': True, 'bear_use_ema': True, 'bear_use_atr': False, 'bear_use_adx': False, 'bear_use_spike': False, 'bear_rsi_required': True, 'sideways_strategy': 'mean_reversion', 'sideways_bb_std_mult': 1.34223575773473, 'sideways_rsi_os': 14, 'sideways_rsi_ob': 85, 'sideways_adx_thresh': 22.56435932381382, 'sideways_atr_min_pct': 0.001469723828481533, 'sideways_atr_max_pct': 0.01750759985946433, 'sideways_tp_mult': 2.466693712883927, 'sideways_tsl_mult': 0.5840125639993725, 'sideways_time_stop': 80, 'sideways_use_sma': False, 'sideways_use_ema': True, 'sideways_use_atr': True, 'sideways_use_adx': False, 'sideways_use_spike': False, 'sideways_rsi_required': True}.
[I 2025-08-30 19:21:55,735] Trial 464 finished with values: [-1000000000.0, 1000000000.0] and parameters: {'p_sma': 11, 'p_std': 28, 'p_atr': 8, 'p_adx': 24, 'rsi_period': 27, 'ema1': 25, 'ema2': 32, 'slip_atr_k': 0.16831775964736895, 'slip_spread_k': 0.19937142855502127, 'spread_hl_frac': 0.04509594413149623, 'bb_std_mult': 2.334826808903435, 'rsi_os': 48, 'rsi_ob': 81, 'vol_spike': 0.2559348907207186, 'adx_thresh': 24.50179913285129, 'atr_min_pct': 0.022977627762403804, 'atr_max_pct': 0.11441358995304118, 'tp_mult': 2.276307552459305, 'tsl_mult': 0.9812363637348693, 'strategy': 'breakout', 'time_stop': 186, 'use_sma': False, 'use_atr': False, 'use_adx': True, 'use_ema': False, 'use_spike': True, 'rsi_required': False, 'edge_k': 1.9061193779113281, 'edge_cap': 0.4997147717321647, 'bull_strategy': 'breakout', 'bull_bb_std_mult': 3.1593238098949223, 'bull_rsi_os': 31, 'bull_rsi_ob': 49, 'bull_adx_thresh': 9.55003644684224, 'bull_atr_min_pct': 0.029973086005945677, 'bull_atr_max_pct': 0.1237966326657176, 'bull_tp_mult': 2.6695864688102025, 'bull_tsl_mult': 0.5766465338762292, 'bull_time_stop': 191, 'bull_use_sma': False, 'bull_use_ema': True, 'bull_use_atr': True, 'bull_use_adx': True, 'bull_use_spike': False, 'bull_rsi_required': True, 'bear_strategy': 'breakout', 'bear_bb_std_mult': 1.3522493824105355, 'bear_rsi_os': 8, 'bear_rsi_ob': 71, 'bear_adx_thresh': 28.166137817621163, 'bear_atr_min_pct': 0.014904720606968513, 'bear_atr_max_pct': 0.03607429630304909, 'bear_tp_mult': 1.5886597170105323, 'bear_tsl_mult': 0.8017991792207425, 'bear_time_stop': 201, 'bear_use_sma': True, 'bear_use_ema': True, 'bear_use_atr': False, 'bear_use_adx': True, 'bear_use_spike': False, 'bear_rsi_required': True, 'sideways_strategy': 'mean_reversion', 'sideways_bb_std_mult': 3.302732347063013, 'sideways_rsi_os': 37, 'sideways_rsi_ob': 63, 'sideways_adx_thresh': 17.8735603344888, 'sideways_atr_min_pct': 0.008546128232218637, 'sideways_atr_max_pct': 0.08013404152086212, 'sideways_tp_mult': 1.0633688217719737, 'sideways_tsl_mult': 0.7440246549784244, 'sideways_time_stop': 176, 'sideways_use_sma': False, 'sideways_use_ema': True, 'sideways_use_atr': False, 'sideways_use_adx': False, 'sideways_use_spike': False, 'sideways_rsi_required': True}.
[I 2025-08-30 19:22:13,300] Trial 465 finished with values: [-1000000000.0, 1000000000.0] and parameters: {'p_sma': 11, 'p_std': 27, 'p_atr': 8, 'p_adx': 24, 'rsi_period': 27, 'ema1': 9, 'ema2': 32, 'slip_atr_k': 0.2299254226241835, 'slip_spread_k': 0.20135213202221772, 'spread_hl_frac': 0.006883057982496606, 'bb_std_mult': 3.3264646752565845, 'rsi_os': 32, 'rsi_ob': 80, 'vol_spike': 0.25609333717003135, 'adx_thresh': 24.238569540794025, 'atr_min_pct': 0.022724046021304557, 'atr_max_pct': 0.10228070677366125, 'tp_mult': 1.446848516878783, 'tsl_mult': 0.14144608581795426, 'strategy': 'breakout', 'time_stop': 55, 'use_sma': False, 'use_atr': False, 'use_adx': True, 'use_ema': False, 'use_spike': True, 'rsi_required': False, 'edge_k': 0.021875597639068545, 'edge_cap': 0.5073866276970537, 'bull_strategy': 'breakout', 'bull_bb_std_mult': 3.160114764998908, 'bull_rsi_os': 19, 'bull_rsi_ob': 67, 'bull_adx_thresh': 9.755936291563039, 'bull_atr_min_pct': 0.024131727297161877, 'bull_atr_max_pct': 0.14631378339515694, 'bull_tp_mult': 2.6795805962260206, 'bull_tsl_mult': 0.1072698934031458, 'bull_time_stop': 192, 'bull_use_sma': False, 'bull_use_ema': False, 'bull_use_atr': True, 'bull_use_adx': True, 'bull_use_spike': False, 'bull_rsi_required': True, 'bear_strategy': 'breakout', 'bear_bb_std_mult': 2.01178605325159, 'bear_rsi_os': 10, 'bear_rsi_ob': 92, 'bear_adx_thresh': 30.157196872443876, 'bear_atr_min_pct': 0.014922338914036597, 'bear_atr_max_pct': 0.12036180221589365, 'bear_tp_mult': 2.6994866791636394, 'bear_tsl_mult': 0.791812875034035, 'bear_time_stop': 277, 'bear_use_sma': True, 'bear_use_ema': True, 'bear_use_atr': True, 'bear_use_adx': True, 'bear_use_spike': False, 'bear_rsi_required': True, 'sideways_strategy': 'mean_reversion', 'sideways_bb_std_mult': 3.1999500734596324, 'sideways_rsi_os': 45, 'sideways_rsi_ob': 62, 'sideways_adx_thresh': 14.645668346023221, 'sideways_atr_min_pct': 0.002542787572306161, 'sideways_atr_max_pct': 0.1499887857877214, 'sideways_tp_mult': 1.0549686264595808, 'sideways_tsl_mult': 0.9511869518360506, 'sideways_time_stop': 153, 'sideways_use_sma': False, 'sideways_use_ema': True, 'sideways_use_atr': False, 'sideways_use_adx': False, 'sideways_use_spike': False, 'sideways_rsi_required': False}.
[I 2025-08-30 19:22:14,706] Trial 466 finished with values: [-1000000000.0, 1000000000.0] and parameters: {'p_sma': 30, 'p_std': 14, 'p_atr': 24, 'p_adx': 21, 'rsi_period': 56, 'ema1': 6, 'ema2': 32, 'slip_atr_k': 0.1689964236343835, 'slip_spread_k': 0.44678689948940137, 'spread_hl_frac': 0.030846787153244536, 'bb_std_mult': 3.2985942734704032, 'rsi_os': 31, 'rsi_ob': 82, 'vol_spike': 0.2741469223517054, 'adx_thresh': 33.941512847298114, 'atr_min_pct': 0.022840833598713306, 'atr_max_pct': 0.06579956654757545, 'tp_mult': 2.2760979055610298, 'tsl_mult': 0.8087189101030327, 'strategy': 'breakout', 'time_stop': 186, 'use_sma': False, 'use_atr': False, 'use_adx': True, 'use_ema': False, 'use_spike': True, 'rsi_required': False, 'edge_k': 0.13424171666365098, 'edge_cap': 0.4975114234112237, 'bull_strategy': 'breakout', 'bull_bb_std_mult': 3.2150695052298297, 'bull_rsi_os': 17, 'bull_rsi_ob': 46, 'bull_adx_thresh': 22.072453594429625, 'bull_atr_min_pct': 0.011522152458966664, 'bull_atr_max_pct': 0.10795173631712487, 'bull_tp_mult': 2.6686733629856705, 'bull_tsl_mult': 0.5751823745576863, 'bull_time_stop': 209, 'bull_use_sma': False, 'bull_use_ema': False, 'bull_use_atr': False, 'bull_use_adx': True, 'bull_use_spike': True, 'bull_rsi_required': True, 'bear_strategy': 'mean_reversion', 'bear_bb_std_mult': 1.9768259381725661, 'bear_rsi_os': 6, 'bear_rsi_ob': 79, 'bear_adx_thresh': 5.031304076845821, 'bear_atr_min_pct': 0.014947771105454264, 'bear_atr_max_pct': 0.030728830192017324, 'bear_tp_mult': 2.6233985553697288, 'bear_tsl_mult': 0.7967800905237548, 'bear_time_stop': 159, 'bear_use_sma': True, 'bear_use_ema': True, 'bear_use_atr': True, 'bear_use_adx': True, 'bear_use_spike': False, 'bear_rsi_required': True, 'sideways_strategy': 'mean_reversion', 'sideways_bb_std_mult': 2.270022539773448, 'sideways_rsi_os': 43, 'sideways_rsi_ob': 58, 'sideways_adx_thresh': 31.620513042034737, 'sideways_atr_min_pct': 0.0015001589853698037, 'sideways_atr_max_pct': 0.14999747153359738, 'sideways_tp_mult': 1.5157037561922242, 'sideways_tsl_mult': 0.9519680094127196, 'sideways_time_stop': 153, 'sideways_use_sma': False, 'sideways_use_ema': True, 'sideways_use_atr': False, 'sideways_use_adx': True, 'sideways_use_spike': False, 'sideways_rsi_required': False}.
[I 2025-08-30 19:22:29,347] Trial 467 finished with values: [-1000000000.0, 1000000000.0] and parameters: {'p_sma': 11, 'p_std': 33, 'p_atr': 9, 'p_adx': 10, 'rsi_period': 83, 'ema1': 25, 'ema2': 32, 'slip_atr_k': 0.16811302704346864, 'slip_spread_k': 0.4464634126989667, 'spread_hl_frac': 0.03603918182161342, 'bb_std_mult': 2.466991782429835, 'rsi_os': 10, 'rsi_ob': 66, 'vol_spike': 0.2643115717924961, 'adx_thresh': 29.63725974697772, 'atr_min_pct': 0.004422917125848367, 'atr_max_pct': 0.08238020407054457, 'tp_mult': 2.2984248034193313, 'tsl_mult': 0.8500335655736803, 'strategy': 'breakout', 'time_stop': 188, 'use_sma': False, 'use_atr': False, 'use_adx': True, 'use_ema': False, 'use_spike': True, 'rsi_required': False, 'edge_k': 0.11988538047822075, 'edge_cap': 0.4650079225477788, 'bull_strategy': 'breakout', 'bull_bb_std_mult': 2.5950894489501852, 'bull_rsi_os': 28, 'bull_rsi_ob': 46, 'bull_adx_thresh': 18.83592472917913, 'bull_atr_min_pct': 0.018789245526710328, 'bull_atr_max_pct': 0.10985082793329613, 'bull_tp_mult': 1.134034193467738, 'bull_tsl_mult': 0.4958050356612365, 'bull_time_stop': 238, 'bull_use_sma': False, 'bull_use_ema': False, 'bull_use_atr': False, 'bull_use_adx': True, 'bull_use_spike': True, 'bull_rsi_required': True, 'bear_strategy': 'mean_reversion', 'bear_bb_std_mult': 2.0147882940022197, 'bear_rsi_os': 36, 'bear_rsi_ob': 79, 'bear_adx_thresh': 18.473987994602286, 'bear_atr_min_pct': 0.015079817850839906, 'bear_atr_max_pct': 0.03055486355448158, 'bear_tp_mult': 1.5815442648927815, 'bear_tsl_mult': 0.7606224661482657, 'bear_time_stop': 278, 'bear_use_sma': True, 'bear_use_ema': True, 'bear_use_atr': True, 'bear_use_adx': True, 'bear_use_spike': True, 'bear_rsi_required': True, 'sideways_strategy': 'mean_reversion', 'sideways_bb_std_mult': 2.7388525008116487, 'sideways_rsi_os': 37, 'sideways_rsi_ob': 89, 'sideways_adx_thresh': 20.96425721067118, 'sideways_atr_min_pct': 0.00243463868349442, 'sideways_atr_max_pct': 0.1497540589072199, 'sideways_tp_mult': 1.1231105608706196, 'sideways_tsl_mult': 0.944547687048306, 'sideways_time_stop': 176, 'sideways_use_sma': False, 'sideways_use_ema': False, 'sideways_use_atr': False, 'sideways_use_adx': True, 'sideways_use_spike': False, 'sideways_rsi_required': False}.
