[I 2025-08-30 18:34:03,582] Trial 45 finished with values: [-1000000000.0, 1000000000.0] and parameters: {'p_sma': 43, 'p_std': 11, 'p_atr': 7, 'p_adx': 22, 'rsi_period': 76, 'ema1': 13, 'ema2': 37, 'slip_atr_k': 0.14856290428012864, 'slip_spread_k': 0.07481874987043596, 'spread_hl_frac': 0.008836308587343501, 'bb_std_mult': 3.5920240284345715, 'rsi_os': 39, 'rsi_ob': 61, 'vol_spike': 0.18031020203016318, 'adx_thresh': 26.32425565448011, 'atr_min_pct': 0.002013863548170335, 'atr_max_pct': 0.13947099021650863, 'tp_mult': 2.178996337594654, 'tsl_mult': 0.2948604213521905, 'strategy': 'breakout', 'time_stop': 50, 'use_sma': False, 'use_atr': True, 'use_adx': True, 'use_ema': True, 'use_spike': True, 'rsi_required': True, 'edge_k': 1.227443073677685, 'edge_cap': 0.11467689538592397, 'bull_strategy': 'mean_reversion', 'bull_bb_std_mult': 1.4060032293894762, 'bull_rsi_os': 53, 'bull_rsi_ob': 45, 'bull_adx_thresh': 26.97885879634878, 'bull_atr_min_pct': 0.010686171729384103, 'bull_atr_max_pct': 0.03050794170783421, 'bull_tp_mult': 1.5360959977259927, 'bull_tsl_mult': 0.09203444377205279, 'bull_time_stop': 161, 'bull_use_sma': False, 'bull_use_ema': False, 'bull_use_atr': True, 'bull_use_adx': False, 'bull_use_spike': False, 'bull_rsi_required': True, 'bear_strategy': 'breakout', 'bear_bb_std_mult': 1.4458559596520644, 'bear_rsi_os': 29, 'bear_rsi_ob': 60, 'bear_adx_thresh': 31.762822290214984, 'bear_atr_min_pct': 0.0020699225331925726, 'bear_atr_max_pct': 0.0742604808583248, 'bear_tp_mult': 1.273223042188884, 'bear_tsl_mult': 0.6351747686242245, 'bear_time_stop': 117, 'bear_use_sma': True, 'bear_use_ema': False, 'bear_use_atr': False, 'bear_use_adx': False, 'bear_use_spike': False, 'bear_rsi_required': False, 'sideways_strategy': 'mean_reversion', 'sideways_bb_std_mult': 3.4527608283631923, 'sideways_rsi_os': 32, 'sideways_rsi_ob': 84, 'sideways_adx_thresh': 31.90898773533446, 'sideways_atr_min_pct': 0.025304440450453384, 'sideways_atr_max_pct': 0.12316182345324408, 'sideways_tp_mult': 2.4077038670693733, 'sideways_tsl_mult': 0.7264649352373919, 'sideways_time_stop': 95, 'sideways_use_sma': False, 'sideways_use_ema': True, 'sideways_use_atr': False, 'sideways_use_adx': False, 'sideways_use_spike': True, 'sideways_rsi_required': False}.
[I 2025-08-30 18:34:03,711] Trial 43 finished with values: [-1000000000.0, 1000000000.0] and parameters: {'p_sma': 43, 'p_std': 18, 'p_atr': 7, 'p_adx': 14, 'rsi_period': 49, 'ema1': 27, 'ema2': 38, 'slip_atr_k': 0.03821448987030886, 'slip_spread_k': 0.7788893357350011, 'spread_hl_frac': 0.03808616195435677, 'bb_std_mult': 3.4550694366409305, 'rsi_os': 39, 'rsi_ob': 63, 'vol_spike': 0.16200457837828935, 'adx_thresh': 32.53155581986377, 'atr_min_pct': 0.002044093288440195, 'atr_max_pct': 0.08239039518742049, 'tp_mult': 2.8183641720106114, 'tsl_mult': 0.5953866576964044, 'strategy': 'breakout', 'time_stop': 41, 'use_sma': False, 'use_atr': True, 'use_adx': True, 'use_ema': True, 'use_spike': True, 'rsi_required': False, 'edge_k': 1.112451119478527, 'edge_cap': 0.71498436600991, 'bull_strategy': 'mean_reversion', 'bull_bb_std_mult': 1.4411132918437097, 'bull_rsi_os': 8, 'bull_rsi_ob': 58, 'bull_adx_thresh': 17.593952734705226, 'bull_atr_min_pct': 0.010114080008676345, 'bull_atr_max_pct': 0.10290588788689324, 'bull_tp_mult': 2.5327658916518176, 'bull_tsl_mult': 0.37070383412982816, 'bull_time_stop': 53, 'bull_use_sma': False, 'bull_use_ema': False, 'bull_use_atr': True, 'bull_use_adx': False, 'bull_use_spike': False, 'bull_rsi_required': True, 'bear_strategy': 'breakout', 'bear_bb_std_mult': 1.3763338462162993, 'bear_rsi_os': 29, 'bear_rsi_ob': 79, 'bear_adx_thresh': 29.64846935069354, 'bear_atr_min_pct': 0.0020072291331174313, 'bear_atr_max_pct': 0.09459347678600095, 'bear_tp_mult': 1.2295184311427543, 'bear_tsl_mult': 0.27054536922968975, 'bear_time_stop': 250, 'bear_use_sma': True, 'bear_use_ema': True, 'bear_use_atr': False, 'bear_use_adx': False, 'bear_use_spike': False, 'bear_rsi_required': False, 'sideways_strategy': 'mean_reversion', 'sideways_bb_std_mult': 2.849204162953737, 'sideways_rsi_os': 31, 'sideways_rsi_ob': 54, 'sideways_adx_thresh': 32.18748632088425, 'sideways_atr_min_pct': 0.010864831297930245, 'sideways_atr_max_pct': 0.09355967354640499, 'sideways_tp_mult': 1.7157660224324545, 'sideways_tsl_mult': 0.23395487796426906, 'sideways_time_stop': 146, 'sideways_use_sma': False, 'sideways_use_ema': True, 'sideways_use_atr': False, 'sideways_use_adx': False, 'sideways_use_spike': True, 'sideways_rsi_required': False}.
[I 2025-08-30 18:34:04,034] Trial 50 finished with values: [-1000000000.0, 1000000000.0] and parameters: {'p_sma': 19, 'p_std': 39, 'p_atr': 17, 'p_adx': 17, 'rsi_period': 24, 'ema1': 15, 'ema2': 57, 'slip_atr_k': 0.09240421365225243, 'slip_spread_k': 0.9872203963642856, 'spread_hl_frac': 0.01104677874745886, 'bb_std_mult': 0.975379699692825, 'rsi_os': 21, 'rsi_ob': 85, 'vol_spike': 0.24176881532277214, 'adx_thresh': 21.551754637536835, 'atr_min_pct': 0.026399686010309793, 'atr_max_pct': 0.020794160323700878, 'tp_mult': 2.429818811545946, 'tsl_mult': 0.5405409237042049, 'strategy': 'mean_reversion', 'time_stop': 217, 'use_sma': True, 'use_atr': False, 'use_adx': False, 'use_ema': False, 'use_spike': False, 'rsi_required': False, 'edge_k': 1.5768239824024162, 'edge_cap': 0.3372925593526044, 'bull_strategy': 'breakout', 'bull_bb_std_mult': 1.0016761752674765, 'bull_rsi_os': 15, 'bull_rsi_ob': 87, 'bull_adx_thresh': 8.316040966625472, 'bull_atr_min_pct': 0.013799568812772112, 'bull_atr_max_pct': 0.12548400380433167, 'bull_tp_mult': 2.978759204493954, 'bull_tsl_mult': 0.5089026089252483, 'bull_time_stop': 278, 'bull_use_sma': True, 'bull_use_ema': True, 'bull_use_atr': False, 'bull_use_adx': True, 'bull_use_spike': True, 'bull_rsi_required': False, 'bear_strategy': 'mean_reversion', 'bear_bb_std_mult': 2.5835616986453847, 'bear_rsi_os': 22, 'bear_rsi_ob': 57, 'bear_adx_thresh': 34.116210615281005, 'bear_atr_min_pct': 0.017631901111582554, 'bear_atr_max_pct': 0.058722826934103724, 'bear_tp_mult': 1.5913147147438385, 'bear_tsl_mult': 0.7386158150126367, 'bear_time_stop': 137, 'bear_use_sma': False, 'bear_use_ema': False, 'bear_use_atr': True, 'bear_use_adx': True, 'bear_use_spike': True, 'bear_rsi_required': True, 'sideways_strategy': 'breakout', 'sideways_bb_std_mult': 1.2514615997743541, 'sideways_rsi_os': 41, 'sideways_rsi_ob': 90, 'sideways_adx_thresh': 12.70673842084716, 'sideways_atr_min_pct': 0.003555207833682801, 'sideways_atr_max_pct': 0.13420238038997162, 'sideways_tp_mult': 1.4391785989169181, 'sideways_tsl_mult': 0.5887679751859493, 'sideways_time_stop': 242, 'sideways_use_sma': True, 'sideways_use_ema': False, 'sideways_use_atr': False, 'sideways_use_adx': True, 'sideways_use_spike': True, 'sideways_rsi_required': True}.
[I 2025-08-30 18:34:04,044] Trial 48 finished with values: [-1000000000.0, 1000000000.0] and parameters: {'p_sma': 20, 'p_std': 37, 'p_atr': 23, 'p_adx': 18, 'rsi_period': 75, 'ema1': 14, 'ema2': 50, 'slip_atr_k': 0.079039288352661, 'slip_spread_k': 0.7896532347725801, 'spread_hl_frac': 0.04927746012327042, 'bb_std_mult': 3.522283317854975, 'rsi_os': 52, 'rsi_ob': 89, 'vol_spike': 0.24664756209216573, 'adx_thresh': 21.612445212283877, 'atr_min_pct': 0.001966727858181325, 'atr_max_pct': 0.020177227051296404, 'tp_mult': 2.8019401588949147, 'tsl_mult': 0.5259865060524648, 'strategy': 'mean_reversion', 'time_stop': 76, 'use_sma': False, 'use_atr': False, 'use_adx': False, 'use_ema': True, 'use_spike': False, 'rsi_required': False, 'edge_k': 1.630598368049591, 'edge_cap': 0.15977499108087667, 'bull_strategy': 'breakout', 'bull_bb_std_mult': 1.01695918421514, 'bull_rsi_os': 33, 'bull_rsi_ob': 89, 'bull_adx_thresh': 24.0704258419858, 'bull_atr_min_pct': 0.007557886286531439, 'bull_atr_max_pct': 0.1222973253879438, 'bull_tp_mult': 1.5175413590192184, 'bull_tsl_mult': 0.5196531093432951, 'bull_time_stop': 166, 'bull_use_sma': False, 'bull_use_ema': True, 'bull_use_atr': False, 'bull_use_adx': True, 'bull_use_spike': True, 'bull_rsi_required': False, 'bear_strategy': 'mean_reversion', 'bear_bb_std_mult': 2.6476714230239713, 'bear_rsi_os': 38, 'bear_rsi_ob': 59, 'bear_adx_thresh': 29.87905628342089, 'bear_atr_min_pct': 0.004316059516130697, 'bear_atr_max_pct': 0.07448449010043179, 'bear_tp_mult': 2.2075429493295933, 'bear_tsl_mult': 0.6295389605537359, 'bear_time_stop': 123, 'bear_use_sma': False, 'bear_use_ema': False, 'bear_use_atr': True, 'bear_use_adx': False, 'bear_use_spike': True, 'bear_rsi_required': False, 'sideways_strategy': 'mean_reversion', 'sideways_bb_std_mult': 1.004468002965618, 'sideways_rsi_os': 47, 'sideways_rsi_ob': 91, 'sideways_adx_thresh': 11.993770886037849, 'sideways_atr_min_pct': 0.028873069419350084, 'sideways_atr_max_pct': 0.036203927434016576, 'sideways_tp_mult': 2.0370667426820126, 'sideways_tsl_mult': 0.5810105850606584, 'sideways_time_stop': 86, 'sideways_use_sma': True, 'sideways_use_ema': True, 'sideways_use_atr': False, 'sideways_use_adx': False, 'sideways_use_spike': True, 'sideways_rsi_required': True}.
[I 2025-08-30 18:34:35,924] Trial 49 finished with values: [-1000000000.0, 1000000000.0] and parameters: {'p_sma': 20, 'p_std': 37, 'p_atr': 23, 'p_adx': 18, 'rsi_period': 25, 'ema1': 26, 'ema2': 56, 'slip_atr_k': 0.08615724348841972, 'slip_spread_k': 0.793241533897573, 'spread_hl_frac': 0.04990044892575022, 'bb_std_mult': 0.99286385786349, 'rsi_os': 37, 'rsi_ob': 91, 'vol_spike': 0.24343186782968346, 'adx_thresh': 29.267602177651654, 'atr_min_pct': 0.002093664009446097, 'atr_max_pct': 0.02193241064061255, 'tp_mult': 2.775105978130741, 'tsl_mult': 0.5308032057248497, 'strategy': 'mean_reversion', 'time_stop': 76, 'use_sma': True, 'use_atr': False, 'use_adx': False, 'use_ema': False, 'use_spike': False, 'rsi_required': False, 'edge_k': 1.5877708533271833, 'edge_cap': 0.17249835316124834, 'bull_strategy': 'breakout', 'bull_bb_std_mult': 1.000000596241175, 'bull_rsi_os': 12, 'bull_rsi_ob': 87, 'bull_adx_thresh': 23.746257688847518, 'bull_atr_min_pct': 0.013757635743213549, 'bull_atr_max_pct': 0.016262850469608653, 'bull_tp_mult': 2.0660199136557393, 'bull_tsl_mult': 0.5032679655558658, 'bull_time_stop': 60, 'bull_use_sma': False, 'bull_use_ema': True, 'bull_use_atr': False, 'bull_use_adx': True, 'bull_use_spike': True, 'bull_rsi_required': False, 'bear_strategy': 'mean_reversion', 'bear_bb_std_mult': 2.6284543760934422, 'bear_rsi_os': 34, 'bear_rsi_ob': 56, 'bear_adx_thresh': 25.39530284997228, 'bear_atr_min_pct': 0.016558657429734162, 'bear_atr_max_pct': 0.09680728326745054, 'bear_tp_mult': 1.5921274935944192, 'bear_tsl_mult': 0.8279217599499283, 'bear_time_stop': 136, 'bear_use_sma': False, 'bear_use_ema': True, 'bear_use_atr': True, 'bear_use_adx': True, 'bear_use_spike': True, 'bear_rsi_required': True, 'sideways_strategy': 'mean_reversion', 'sideways_bb_std_mult': 1.297630459251998, 'sideways_rsi_os': 48, 'sideways_rsi_ob': 91, 'sideways_adx_thresh': 13.092780708784156, 'sideways_atr_min_pct': 0.02888375472596783, 'sideways_atr_max_pct': 0.020875643173999727, 'sideways_tp_mult': 1.4488751313355488, 'sideways_tsl_mult': 0.5817970881866577, 'sideways_time_stop': 238, 'sideways_use_sma': True, 'sideways_use_ema': False, 'sideways_use_atr': False, 'sideways_use_adx': True, 'sideways_use_spike': True, 'sideways_rsi_required': True}.
[I 2025-08-30 18:34:36,819] Trial 47 finished with values: [-1000000000.0, 1000000000.0] and parameters: {'p_sma': 18, 'p_std': 12, 'p_atr': 11, 'p_adx': 18, 'rsi_period': 38, 'ema1': 14, 'ema2': 37, 'slip_atr_k': 0.24496415733294197, 'slip_spread_k': 0.7689604554498772, 'spread_hl_frac': 0.010204228149509071, 'bb_std_mult': 3.44418498505697, 'rsi_os': 37, 'rsi_ob': 85, 'vol_spike': 0.16454643321496495, 'adx_thresh': 29.860072838268252, 'atr_min_pct': 0.001753115819573323, 'atr_max_pct': 0.018661081672748582, 'tp_mult': 2.7888839746355303, 'tsl_mult': 0.36487356459861053, 'strategy': 'breakout', 'time_stop': 219, 'use_sma': False, 'use_atr': True, 'use_adx': False, 'use_ema': True, 'use_spike': False, 'rsi_required': False, 'edge_k': 1.5648225636884248, 'edge_cap': 0.11171026773407818, 'bull_strategy': 'breakout', 'bull_bb_std_mult': 1.0132624907124592, 'bull_rsi_os': 34, 'bull_rsi_ob': 45, 'bull_adx_thresh': 17.215152214965013, 'bull_atr_min_pct': 0.013683335524396538, 'bull_atr_max_pct': 0.11891922095958056, 'bull_tp_mult': 2.9879991412615166, 'bull_tsl_mult': 0.057732356817530306, 'bull_time_stop': 163, 'bull_use_sma': True, 'bull_use_ema': False, 'bull_use_atr': False, 'bull_use_adx': True, 'bull_use_spike': True, 'bull_rsi_required': True, 'bear_strategy': 'breakout', 'bear_bb_std_mult': 2.614011074949442, 'bear_rsi_os': 48, 'bear_rsi_ob': 48, 'bear_adx_thresh': 30.042629247800427, 'bear_atr_min_pct': 0.015975294496726196, 'bear_atr_max_pct': 0.0749180093520916, 'bear_tp_mult': 1.3188792684561559, 'bear_tsl_mult': 0.017126504285157496, 'bear_time_stop': 128, 'bear_use_sma': True, 'bear_use_ema': False, 'bear_use_atr': True, 'bear_use_adx': False, 'bear_use_spike': True, 'bear_rsi_required': False, 'sideways_strategy': 'mean_reversion', 'sideways_bb_std_mult': 1.0369883910933444, 'sideways_rsi_os': 34, 'sideways_rsi_ob': 91, 'sideways_adx_thresh': 31.91392323887497, 'sideways_atr_min_pct': 0.028778744732622066, 'sideways_atr_max_pct': 0.1011771687916016, 'sideways_tp_mult': 2.5513964040321913, 'sideways_tsl_mult': 0.5869279209594676, 'sideways_time_stop': 89, 'sideways_use_sma': True, 'sideways_use_ema': True, 'sideways_use_atr': False, 'sideways_use_adx': True, 'sideways_use_spike': True, 'sideways_rsi_required': True}.
[I 2025-08-30 18:34:37,449] Trial 51 finished with values: [-1000000000.0, 1000000000.0] and parameters: {'p_sma': 20, 'p_std': 36, 'p_atr': 24, 'p_adx': 18, 'rsi_period': 40, 'ema1': 17, 'ema2': 49, 'slip_atr_k': 0.12775898194343038, 'slip_spread_k': 0.6276670756493542, 'spread_hl_frac': 0.04955552211280145, 'bb_std_mult': 0.7186116764970261, 'rsi_os': 43, 'rsi_ob': 72, 'vol_spike': 0.06074058291145287, 'adx_thresh': 30.036007271589412, 'atr_min_pct': 0.020281255629873554, 'atr_max_pct': 0.04348733841159333, 'tp_mult': 1.9607221509182051, 'tsl_mult': 0.6411905890853363, 'strategy': 'breakout', 'time_stop': 69, 'use_sma': False, 'use_atr': False, 'use_adx': False, 'use_ema': True, 'use_spike': False, 'rsi_required': False, 'edge_k': 1.448392302808841, 'edge_cap': 0.17095086788461247, 'bull_strategy': 'breakout', 'bull_bb_std_mult': 3.0438583538826447, 'bull_rsi_os': 33, 'bull_rsi_ob': 55, 'bull_adx_thresh': 23.754354947550883, 'bull_atr_min_pct': 0.01355601106644793, 'bull_atr_max_pct': 0.06592048665589285, 'bull_tp_mult': 2.0742372241613745, 'bull_tsl_mult': 0.9507790887090213, 'bull_time_stop': 169, 'bull_use_sma': False, 'bull_use_ema': True, 'bull_use_atr': False, 'bull_use_adx': True, 'bull_use_spike': True, 'bull_rsi_required': False, 'bear_strategy': 'breakout', 'bear_bb_std_mult': 1.1607917945054402, 'bear_rsi_os': 33, 'bear_rsi_ob': 51, 'bear_adx_thresh': 21.97704501278679, 'bear_atr_min_pct': 0.019907789657339272, 'bear_atr_max_pct': 0.14035836495973686, 'bear_tp_mult': 2.1804349536925955, 'bear_tsl_mult': 0.55891108063243, 'bear_time_stop': 7, 'bear_use_sma': True, 'bear_use_ema': True, 'bear_use_atr': True, 'bear_use_adx': True, 'bear_use_spike': True, 'bear_rsi_required': True, 'sideways_strategy': 'mean_reversion', 'sideways_bb_std_mult': 3.5969213916885665, 'sideways_rsi_os': 16, 'sideways_rsi_ob': 78, 'sideways_adx_thresh': 14.648884769537338, 'sideways_atr_min_pct': 0.013418571040963827, 'sideways_atr_max_pct': 0.03832933464475279, 'sideways_tp_mult': 2.049691233755871, 'sideways_tsl_mult': 0.12467874979074867, 'sideways_time_stop': 280, 'sideways_use_sma': True, 'sideways_use_ema': True, 'sideways_use_atr': False, 'sideways_use_adx': False, 'sideways_use_spike': False, 'sideways_rsi_required': True}.
[I 2025-08-30 18:34:37,553] Trial 52 finished with values: [-1000000000.0, 1000000000.0] and parameters: {'p_sma': 39, 'p_std': 35, 'p_atr': 12, 'p_adx': 20, 'rsi_period': 37, 'ema1': 9, 'ema2': 16, 'slip_atr_k': 0.13134350589545593, 'slip_spread_k': 0.6244131649920723, 'spread_hl_frac': 0.032651969819148294, 'bb_std_mult': 0.6343425773924932, 'rsi_os': 15, 'rsi_ob': 79, 'vol_spike': 0.29945674510647347, 'adx_thresh': 24.88997599125465, 'atr_min_pct': 0.01323340578636736, 'atr_max_pct': 0.043309226635378034, 'tp_mult': 1.9758747407716082, 'tsl_mult': 0.6349484891681738, 'strategy': 'breakout', 'time_stop': 137, 'use_sma': False, 'use_atr': False, 'use_adx': False, 'use_ema': False, 'use_spike': False, 'rsi_required': False, 'edge_k': 1.3776432392589861, 'edge_cap': 0.481523212617083, 'bull_strategy': 'mean_reversion', 'bull_bb_std_mult': 2.932942557327748, 'bull_rsi_os': 13, 'bull_rsi_ob': 54, 'bull_adx_thresh': 11.965244607218255, 'bull_atr_min_pct': 0.02029032598684525, 'bull_atr_max_pct': 0.06607040192237949, 'bull_tp_mult': 2.067251793569178, 'bull_tsl_mult': 0.9391718889491689, 'bull_time_stop': 105, 'bull_use_sma': False, 'bull_use_ema': False, 'bull_use_atr': False, 'bull_use_adx': False, 'bull_use_spike': True, 'bull_rsi_required': True, 'bear_strategy': 'breakout', 'bear_bb_std_mult': 1.0371977240781303, 'bear_rsi_os': 33, 'bear_rsi_ob': 76, 'bear_adx_thresh': 25.81741222004427, 'bear_atr_min_pct': 0.019085594177771777, 'bear_atr_max_pct': 0.14150496926872239, 'bear_tp_mult': 2.688510805518798, 'bear_tsl_mult': 0.945307565314621, 'bear_time_stop': 172, 'bear_use_sma': True, 'bear_use_ema': True, 'bear_use_atr': True, 'bear_use_adx': True, 'bear_use_spike': True, 'bear_rsi_required': True, 'sideways_strategy': 'mean_reversion', 'sideways_bb_std_mult': 2.1617083926130256, 'sideways_rsi_os': 27, 'sideways_rsi_ob': 77, 'sideways_adx_thresh': 14.185222374961647, 'sideways_atr_min_pct': 0.012751356369495828, 'sideways_atr_max_pct': 0.019140155524350142, 'sideways_tp_mult': 2.5996982181768287, 'sideways_tsl_mult': 0.11580815387162574, 'sideways_time_stop': 277, 'sideways_use_sma': True, 'sideways_use_ema': True, 'sideways_use_atr': True, 'sideways_use_adx': False, 'sideways_use_spike': False, 'sideways_rsi_required': False}.
[I 2025-08-30 18:35:10,161] Trial 55 finished with values: [-1000000000.0, 1000000000.0] and parameters: {'p_sma': 25, 'p_std': 8, 'p_atr': 16, 'p_adx': 20, 'rsi_period': 28, 'ema1': 19, 'ema2': 25, 'slip_atr_k': 0.1045418361502024, 'slip_spread_k': 0.6709377782267223, 'spread_hl_frac': 0.033145760510884685, 'bb_std_mult': 0.6440765102518359, 'rsi_os': 16, 'rsi_ob': 49, 'vol_spike': 0.2855010556346045, 'adx_thresh': 24.445811400069275, 'atr_min_pct': 0.012252696316596576, 'atr_max_pct': 0.1482374636716717, 'tp_mult': 2.3113177142750088, 'tsl_mult': 0.6504259802124185, 'strategy': 'breakout', 'time_stop': 127, 'use_sma': False, 'use_atr': True, 'use_adx': True, 'use_ema': True, 'use_spike': True, 'rsi_required': False, 'edge_k': 1.8808610569377355, 'edge_cap': 0.4802545108526324, 'bull_strategy': 'mean_reversion', 'bull_bb_std_mult': 1.5960776556079637, 'bull_rsi_os': 14, 'bull_rsi_ob': 81, 'bull_adx_thresh': 10.818195512149066, 'bull_atr_min_pct': 0.019829884783030986, 'bull_atr_max_pct': 0.13377498446147582, 'bull_tp_mult': 1.3379649730338907, 'bull_tsl_mult': 0.6901751772538117, 'bull_time_stop': 20, 'bull_use_sma': False, 'bull_use_ema': False, 'bull_use_atr': True, 'bull_use_adx': False, 'bull_use_spike': False, 'bull_rsi_required': True, 'bear_strategy': 'breakout', 'bear_bb_std_mult': 3.321011214953695, 'bear_rsi_os': 44, 'bear_rsi_ob': 89, 'bear_adx_thresh': 14.37706898580743, 'bear_atr_min_pct': 0.011915410545235747, 'bear_atr_max_pct': 0.03629681202010609, 'bear_tp_mult': 1.9320463150046026, 'bear_tsl_mult': 0.18294310023829347, 'bear_time_stop': 176, 'bear_use_sma': True, 'bear_use_ema': True, 'bear_use_atr': True, 'bear_use_adx': True, 'bear_use_spike': False, 'bear_rsi_required': False, 'sideways_strategy': 'breakout', 'sideways_bb_std_mult': 3.289661717102551, 'sideways_rsi_os': 26, 'sideways_rsi_ob': 83, 'sideways_adx_thresh': 24.18386925650173, 'sideways_atr_min_pct': 0.0055144747297271365, 'sideways_atr_max_pct': 0.04689872244150153, 'sideways_tp_mult': 2.6278453397242103, 'sideways_tsl_mult': 0.9907290686448953, 'sideways_time_stop': 262, 'sideways_use_sma': False, 'sideways_use_ema': True, 'sideways_use_atr': True, 'sideways_use_adx': False, 'sideways_use_spike': False, 'sideways_rsi_required': False}.
