[I 2025-08-30 18:38:35,480] Trial 78 finished with values: [-1000000000.0, 0.1507215112153678] and parameters: {'p_sma': 49, 'p_std': 45, 'p_atr': 13, 'p_adx': 30, 'rsi_period': 30, 'ema1': 29, 'ema2': 24, 'slip_atr_k': 0.17705294592787063, 'slip_spread_k': 0.9989390867037216, 'spread_hl_frac': 0.029221034075707187, 'bb_std_mult': 3.0160434414985535, 'rsi_os': 44, 'rsi_ob': 54, 'vol_spike': 0.13910124256605821, 'adx_thresh': 22.042725312020266, 'atr_min_pct': 0.024890672563781958, 'atr_max_pct': 0.0725741138234801, 'tp_mult': 2.384502533211913, 'tsl_mult': 0.7166614911333842, 'strategy': 'breakout', 'time_stop': 187, 'use_sma': True, 'use_atr': True, 'use_adx': True, 'use_ema': True, 'use_spike': True, 'rsi_required': True, 'edge_k': 0.4817083418876269, 'edge_cap': 0.6678604451466823, 'bull_strategy': 'mean_reversion', 'bull_bb_std_mult': 1.5093667249921001, 'bull_rsi_os': 41, 'bull_rsi_ob': 52, 'bull_adx_thresh': 20.940328152899976, 'bull_atr_min_pct': 0.024518877382317374, 'bull_atr_max_pct': 0.14978041419157856, 'bull_tp_mult': 1.9709730499659166, 'bull_tsl_mult': 0.8005171523927325, 'bull_time_stop': 175, 'bull_use_sma': False, 'bull_use_ema': False, 'bull_use_atr': True, 'bull_use_adx': False, 'bull_use_spike': False, 'bull_rsi_required': True, 'bear_strategy': 'mean_reversion', 'bear_bb_std_mult': 3.38774828092045, 'bear_rsi_os': 27, 'bear_rsi_ob': 64, 'bear_adx_thresh': 17.37387383857981, 'bear_atr_min_pct': 0.02335713937300684, 'bear_atr_max_pct': 0.046734970155382645, 'bear_tp_mult': 2.9121925150309136, 'bear_tsl_mult': 0.7756435971611227, 'bear_time_stop': 183, 'bear_use_sma': False, 'bear_use_ema': False, 'bear_use_atr': True, 'bear_use_adx': True, 'bear_use_spike': False, 'bear_rsi_required': False, 'sideways_strategy': 'breakout', 'sideways_bb_std_mult': 3.1536568446974855, 'sideways_rsi_os': 51, 'sideways_rsi_ob': 80, 'sideways_adx_thresh': 5.8906013946517675, 'sideways_atr_min_pct': 0.0006843339844414865, 'sideways_atr_max_pct': 0.13746529181893188, 'sideways_tp_mult': 1.4947793329400625, 'sideways_tsl_mult': 0.9995336509676448, 'sideways_time_stop': 268, 'sideways_use_sma': False, 'sideways_use_ema': True, 'sideways_use_atr': True, 'sideways_use_adx': False, 'sideways_use_spike': True, 'sideways_rsi_required': False}.
[I 2025-08-30 18:39:08,283] Trial 83 finished with values: [-1000000000.0, 1000000000.0] and parameters: {'p_sma': 49, 'p_std': 46, 'p_atr': 14, 'p_adx': 22, 'rsi_period': 52, 'ema1': 28, 'ema2': 24, 'slip_atr_k': 0.10995547460376505, 'slip_spread_k': 0.8126737590214175, 'spread_hl_frac': 0.005953729367949946, 'bb_std_mult': 1.1116133003810729, 'rsi_os': 52, 'rsi_ob': 54, 'vol_spike': 0.21987930703588351, 'adx_thresh': 23.995197131448005, 'atr_min_pct': 0.025335312519152817, 'atr_max_pct': 0.10622150150712142, 'tp_mult': 2.1965639259366467, 'tsl_mult': 0.6719740455697123, 'strategy': 'breakout', 'time_stop': 289, 'use_sma': True, 'use_atr': True, 'use_adx': True, 'use_ema': True, 'use_spike': True, 'rsi_required': False, 'edge_k': 0.2315514826856757, 'edge_cap': 0.44842858868132474, 'bull_strategy': 'mean_reversion', 'bull_bb_std_mult': 1.853058784345972, 'bull_rsi_os': 23, 'bull_rsi_ob': 48, 'bull_adx_thresh': 16.939235915572656, 'bull_atr_min_pct': 0.01652852638995161, 'bull_atr_max_pct': 0.12469272957422968, 'bull_tp_mult': 1.9825847067020625, 'bull_tsl_mult': 0.477408275965256, 'bull_time_stop': 202, 'bull_use_sma': False, 'bull_use_ema': False, 'bull_use_atr': True, 'bull_use_adx': False, 'bull_use_spike': False, 'bull_rsi_required': True, 'bear_strategy': 'mean_reversion', 'bear_bb_std_mult': 3.3918133584770507, 'bear_rsi_os': 31, 'bear_rsi_ob': 93, 'bear_adx_thresh': 20.006436300315556, 'bear_atr_min_pct': 0.02552021586932015, 'bear_atr_max_pct': 0.02673115530024563, 'bear_tp_mult': 2.888233823838344, 'bear_tsl_mult': 0.22635039715087207, 'bear_time_stop': 154, 'bear_use_sma': True, 'bear_use_ema': False, 'bear_use_atr': True, 'bear_use_adx': True, 'bear_use_spike': False, 'bear_rsi_required': False, 'sideways_strategy': 'breakout', 'sideways_bb_std_mult': 3.3678544480230235, 'sideways_rsi_os': 12, 'sideways_rsi_ob': 67, 'sideways_adx_thresh': 6.038733884744127, 'sideways_atr_min_pct': 8.839385971288653e-05, 'sideways_atr_max_pct': 0.13766501924800575, 'sideways_tp_mult': 1.1613947577144303, 'sideways_tsl_mult': 0.07759833376532127, 'sideways_time_stop': 54, 'sideways_use_sma': False, 'sideways_use_ema': False, 'sideways_use_atr': True, 'sideways_use_adx': True, 'sideways_use_spike': True, 'sideways_rsi_required': False}.
[I 2025-08-30 18:39:08,409] Trial 84 finished with values: [-1000000000.0, 0.15387437312481259] and parameters: {'p_sma': 48, 'p_std': 30, 'p_atr': 18, 'p_adx': 22, 'rsi_period': 10, 'ema1': 29, 'ema2': 44, 'slip_atr_k': 0.09307990557374615, 'slip_spread_k': 0.1956231067760998, 'spread_hl_frac': 0.028988681129725975, 'bb_std_mult': 1.0517147951513353, 'rsi_os': 50, 'rsi_ob': 74, 'vol_spike': 0.08555179842274209, 'adx_thresh': 22.155073994903333, 'atr_min_pct': 0.0252837503495732, 'atr_max_pct': 0.10458667623117052, 'tp_mult': 2.206269635024204, 'tsl_mult': 0.7662866687245514, 'strategy': 'breakout', 'time_stop': 188, 'use_sma': True, 'use_atr': True, 'use_adx': True, 'use_ema': True, 'use_spike': True, 'rsi_required': False, 'edge_k': 0.2280274632856053, 'edge_cap': 0.6449284208944567, 'bull_strategy': 'mean_reversion', 'bull_bb_std_mult': 1.686698692568336, 'bull_rsi_os': 24, 'bull_rsi_ob': 48, 'bull_adx_thresh': 20.8253178807174, 'bull_atr_min_pct': 0.016584001407446813, 'bull_atr_max_pct': 0.12689217678976197, 'bull_tp_mult': 2.2273480374931527, 'bull_tsl_mult': 0.4765857105436128, 'bull_time_stop': 202, 'bull_use_sma': False, 'bull_use_ema': False, 'bull_use_atr': True, 'bull_use_adx': False, 'bull_use_spike': False, 'bull_rsi_required': True, 'bear_strategy': 'mean_reversion', 'bear_bb_std_mult': 3.409222873276532, 'bear_rsi_os': 51, 'bear_rsi_ob': 91, 'bear_adx_thresh': 17.518034605116483, 'bear_atr_min_pct': 0.0032788236564277925, 'bear_atr_max_pct': 0.03146164762989328, 'bear_tp_mult': 2.886472777670308, 'bear_tsl_mult': 0.6567029776575555, 'bear_time_stop': 183, 'bear_use_sma': True, 'bear_use_ema': False, 'bear_use_atr': True, 'bear_use_adx': True, 'bear_use_spike': False, 'bear_rsi_required': False, 'sideways_strategy': 'breakout', 'sideways_bb_std_mult': 3.392903097714682, 'sideways_rsi_os': 50, 'sideways_rsi_ob': 73, 'sideways_adx_thresh': 21.31304323392342, 'sideways_atr_min_pct': 5.8260682576724934e-05, 'sideways_atr_max_pct': 0.14574352169931423, 'sideways_tp_mult': 1.1701772090034002, 'sideways_tsl_mult': 0.8958053215888396, 'sideways_time_stop': 286, 'sideways_use_sma': False, 'sideways_use_ema': False, 'sideways_use_atr': True, 'sideways_use_adx': True, 'sideways_use_spike': True, 'sideways_rsi_required': False}.
[I 2025-08-30 18:39:08,444] Trial 82 finished with values: [-1000000000.0, 0.16182543266442168] and parameters: {'p_sma': 27, 'p_std': 30, 'p_atr': 18, 'p_adx': 30, 'rsi_period': 18, 'ema1': 19, 'ema2': 24, 'slip_atr_k': 0.1110554878785046, 'slip_spread_k': 0.4039071711568281, 'spread_hl_frac': 0.02916710514263166, 'bb_std_mult': 1.335759260838442, 'rsi_os': 8, 'rsi_ob': 87, 'vol_spike': 0.0837311043641129, 'adx_thresh': 22.246216079034625, 'atr_min_pct': 0.02519869724436534, 'atr_max_pct': 0.10404825394172328, 'tp_mult': 2.1798340737227133, 'tsl_mult': 0.7662802235789801, 'strategy': 'breakout', 'time_stop': 289, 'use_sma': True, 'use_atr': True, 'use_adx': True, 'use_ema': True, 'use_spike': True, 'rsi_required': False, 'edge_k': 0.3228966621292697, 'edge_cap': 0.6462856185588413, 'bull_strategy': 'mean_reversion', 'bull_bb_std_mult': 1.290065806364019, 'bull_rsi_os': 24, 'bull_rsi_ob': 60, 'bull_adx_thresh': 20.696332162469457, 'bull_atr_min_pct': 0.019089634696590675, 'bull_atr_max_pct': 0.13577986175413284, 'bull_tp_mult': 2.2666528064258227, 'bull_tsl_mult': 0.4091041152080039, 'bull_time_stop': 197, 'bull_use_sma': False, 'bull_use_ema': False, 'bull_use_atr': True, 'bull_use_adx': False, 'bull_use_spike': False, 'bull_rsi_required': True, 'bear_strategy': 'mean_reversion', 'bear_bb_std_mult': 3.378285358674347, 'bear_rsi_os': 23, 'bear_rsi_ob': 88, 'bear_adx_thresh': 19.91074467423742, 'bear_atr_min_pct': 0.0028859327227525114, 'bear_atr_max_pct': 0.02597347978459319, 'bear_tp_mult': 2.901434655268048, 'bear_tsl_mult': 0.12337810871886407, 'bear_time_stop': 181, 'bear_use_sma': True, 'bear_use_ema': False, 'bear_use_atr': True, 'bear_use_adx': True, 'bear_use_spike': False, 'bear_rsi_required': False, 'sideways_strategy': 'breakout', 'sideways_bb_std_mult': 3.3815823986000177, 'sideways_rsi_os': 50, 'sideways_rsi_ob': 73, 'sideways_adx_thresh': 6.101968611032824, 'sideways_atr_min_pct': 0.0005434392032786203, 'sideways_atr_max_pct': 0.13756176559734015, 'sideways_tp_mult': 1.5204194303740413, 'sideways_tsl_mult': 0.9038576804505872, 'sideways_time_stop': 281, 'sideways_use_sma': False, 'sideways_use_ema': False, 'sideways_use_atr': True, 'sideways_use_adx': True, 'sideways_use_spike': True, 'sideways_rsi_required': False}.
[I 2025-08-30 18:39:09,251] Trial 85 finished with values: [-0.030700394448117785, 0.03064292089718368] and parameters: {'p_sma': 49, 'p_std': 30, 'p_atr': 9, 'p_adx': 22, 'rsi_period': 23, 'ema1': 20, 'ema2': 32, 'slip_atr_k': 0.11113731907829982, 'slip_spread_k': 0.9934155213452313, 'spread_hl_frac': 0.028760016450278807, 'bb_std_mult': 1.6202203811501574, 'rsi_os': 44, 'rsi_ob': 47, 'vol_spike': 0.08390627987407978, 'adx_thresh': 22.05390148051682, 'atr_min_pct': 0.025846677286250144, 'atr_max_pct': 0.07743215878082203, 'tp_mult': 2.2018559895015115, 'tsl_mult': 0.7734690143850239, 'strategy': 'breakout', 'time_stop': 187, 'use_sma': True, 'use_atr': True, 'use_adx': True, 'use_ema': True, 'use_spike': True, 'rsi_required': False, 'edge_k': 0.3039191426492869, 'edge_cap': 0.6498940106310012, 'bull_strategy': 'mean_reversion', 'bull_bb_std_mult': 1.6730207290776717, 'bull_rsi_os': 24, 'bull_rsi_ob': 81, 'bull_adx_thresh': 18.445130157388405, 'bull_atr_min_pct': 0.020696441209027507, 'bull_atr_max_pct': 0.1445240726646651, 'bull_tp_mult': 2.2879022148176817, 'bull_tsl_mult': 0.8073339084142486, 'bull_time_stop': 197, 'bull_use_sma': False, 'bull_use_ema': False, 'bull_use_atr': True, 'bull_use_adx': False, 'bull_use_spike': False, 'bull_rsi_required': True, 'bear_strategy': 'breakout', 'bear_bb_std_mult': 3.3436681103836974, 'bear_rsi_os': 31, 'bear_rsi_ob': 75, 'bear_adx_thresh': 17.59181387839447, 'bear_atr_min_pct': 0.0029929140069905047, 'bear_atr_max_pct': 0.031122337607667742, 'bear_tp_mult': 2.774383380319469, 'bear_tsl_mult': 0.12385145444514217, 'bear_time_stop': 187, 'bear_use_sma': True, 'bear_use_ema': True, 'bear_use_atr': False, 'bear_use_adx': True, 'bear_use_spike': False, 'bear_rsi_required': False, 'sideways_strategy': 'breakout', 'sideways_bb_std_mult': 3.391202897399936, 'sideways_rsi_os': 19, 'sideways_rsi_ob': 83, 'sideways_adx_thresh': 20.502896883796325, 'sideways_atr_min_pct': 0.0022211039816487452, 'sideways_atr_max_pct': 0.1381704321588652, 'sideways_tp_mult': 1.1479968945331278, 'sideways_tsl_mult': 0.006391046170323489, 'sideways_time_stop': 151, 'sideways_use_sma': False, 'sideways_use_ema': True, 'sideways_use_atr': True, 'sideways_use_adx': False, 'sideways_use_spike': True, 'sideways_rsi_required': False}.
[I 2025-08-30 18:39:09,538] Trial 87 finished with values: [-1000000000.0, 1000000000.0] and parameters: {'p_sma': 8, 'p_std': 31, 'p_atr': 9, 'p_adx': 20, 'rsi_period': 23, 'ema1': 26, 'ema2': 32, 'slip_atr_k': 0.07077110279817363, 'slip_spread_k': 0.30107608585784795, 'spread_hl_frac': 0.02152876177921827, 'bb_std_mult': 2.1872912507454845, 'rsi_os': 49, 'rsi_ob': 47, 'vol_spike': 0.07350001388844968, 'adx_thresh': 23.564094786382565, 'atr_min_pct': 0.02752607987533918, 'atr_max_pct': 0.07685903081770257, 'tp_mult': 2.5655077493949907, 'tsl_mult': 0.9999811799583085, 'strategy': 'mean_reversion', 'time_stop': 237, 'use_sma': False, 'use_atr': True, 'use_adx': True, 'use_ema': False, 'use_spike': True, 'rsi_required': False, 'edge_k': 0.12146102665168833, 'edge_cap': 0.5031124313986364, 'bull_strategy': 'mean_reversion', 'bull_bb_std_mult': 1.1227449467859743, 'bull_rsi_os': 27, 'bull_rsi_ob': 79, 'bull_adx_thresh': 19.25388576852994, 'bull_atr_min_pct': 0.024330452173241878, 'bull_atr_max_pct': 0.01289898641484935, 'bull_tp_mult': 2.2088016378288806, 'bull_tsl_mult': 0.8023669839191355, 'bull_time_stop': 37, 'bull_use_sma': False, 'bull_use_ema': True, 'bull_use_atr': True, 'bull_use_adx': False, 'bull_use_spike': False, 'bull_rsi_required': True, 'bear_strategy': 'breakout', 'bear_bb_std_mult': 1.967746590385482, 'bear_rsi_os': 42, 'bear_rsi_ob': 76, 'bear_adx_thresh': 17.530607118990694, 'bear_atr_min_pct': 0.027926572601695152, 'bear_atr_max_pct': 0.03378537683204604, 'bear_tp_mult': 2.77932276907859, 'bear_tsl_mult': 0.7626383369374258, 'bear_time_stop': 167, 'bear_use_sma': True, 'bear_use_ema': True, 'bear_use_atr': False, 'bear_use_adx': False, 'bear_use_spike': False, 'bear_rsi_required': True, 'sideways_strategy': 'breakout', 'sideways_bb_std_mult': 3.49807208151111, 'sideways_rsi_os': 40, 'sideways_rsi_ob': 83, 'sideways_adx_thresh': 11.205200549825584, 'sideways_atr_min_pct': 0.0019306205177258247, 'sideways_atr_max_pct': 0.11528215598052177, 'sideways_tp_mult': 1.0921960066507874, 'sideways_tsl_mult': 0.37727684722432664, 'sideways_time_stop': 178, 'sideways_use_sma': False, 'sideways_use_ema': True, 'sideways_use_atr': True, 'sideways_use_adx': False, 'sideways_use_spike': False, 'sideways_rsi_required': True}.
[I 2025-08-30 18:39:09,547] Trial 88 finished with values: [-1000000000.0, 1000000000.0] and parameters: {'p_sma': 7, 'p_std': 33, 'p_atr': 16, 'p_adx': 20, 'rsi_period': 30, 'ema1': 29, 'ema2': 12, 'slip_atr_k': 0.12267792833553874, 'slip_spread_k': 0.32461504381482786, 'spread_hl_frac': 0.01564319558071702, 'bb_std_mult': 3.02779290106454, 'rsi_os': 49, 'rsi_ob': 47, 'vol_spike': 0.07761855750599288, 'adx_thresh': 25.169411649407998, 'atr_min_pct': 0.024030962504638348, 'atr_max_pct': 0.09687155964204613, 'tp_mult': 2.552503745893102, 'tsl_mult': 0.8186126064404775, 'strategy': 'mean_reversion', 'time_stop': 88, 'use_sma': False, 'use_atr': True, 'use_adx': True, 'use_ema': False, 'use_spike': True, 'rsi_required': False, 'edge_k': 0.10965522293157938, 'edge_cap': 0.5094036303311102, 'bull_strategy': 'mean_reversion', 'bull_bb_std_mult': 1.6936385304334882, 'bull_rsi_os': 27, 'bull_rsi_ob': 46, 'bull_adx_thresh': 10.667302579814281, 'bull_atr_min_pct': 0.02077057647726389, 'bull_atr_max_pct': 0.010450222618165167, 'bull_tp_mult': 2.2199281986951176, 'bull_tsl_mult': 0.8009115610768904, 'bull_time_stop': 175, 'bull_use_sma': False, 'bull_use_ema': True, 'bull_use_atr': True, 'bull_use_adx': False, 'bull_use_spike': False, 'bull_rsi_required': True, 'bear_strategy': 'breakout', 'bear_bb_std_mult': 3.03357397050123, 'bear_rsi_os': 50, 'bear_rsi_ob': 75, 'bear_adx_thresh': 28.619860116853452, 'bear_atr_min_pct': 0.028703015487082137, 'bear_atr_max_pct': 0.03339432898765274, 'bear_tp_mult': 2.7757857997283413, 'bear_tsl_mult': 0.7622246004125371, 'bear_time_stop': 199, 'bear_use_sma': True, 'bear_use_ema': True, 'bear_use_atr': False, 'bear_use_adx': False, 'bear_use_spike': False, 'bear_rsi_required': True, 'sideways_strategy': 'breakout', 'sideways_bb_std_mult': 3.5093890548470097, 'sideways_rsi_os': 36, 'sideways_rsi_ob': 58, 'sideways_adx_thresh': 20.63809348002525, 'sideways_atr_min_pct': 0.0021110834373573206, 'sideways_atr_max_pct': 0.14617110844137926, 'sideways_tp_mult': 2.1240496440977434, 'sideways_tsl_mult': 0.9773465569140721, 'sideways_time_stop': 159, 'sideways_use_sma': False, 'sideways_use_ema': True, 'sideways_use_atr': True, 'sideways_use_adx': False, 'sideways_use_spike': False, 'sideways_rsi_required': True}.
[I 2025-08-30 18:39:09,576] Trial 89 finished with values: [-1000000000.0, 1000000000.0] and parameters: {'p_sma': 51, 'p_std': 53, 'p_atr': 9, 'p_adx': 14, 'rsi_period': 23, 'ema1': 19, 'ema2': 33, 'slip_atr_k': 0.13454994146085508, 'slip_spread_k': 0.9841068329029989, 'spread_hl_frac': 0.03432587588440354, 'bb_std_mult': 2.1840115285908235, 'rsi_os': 33, 'rsi_ob': 46, 'vol_spike': 0.07333597969957037, 'adx_thresh': 18.56151933543018, 'atr_min_pct': 0.023670154288816678, 'atr_max_pct': 0.07756012499856282, 'tp_mult': 2.5581354864663313, 'tsl_mult': 0.8313327842058729, 'strategy': 'mean_reversion', 'time_stop': 166, 'use_sma': True, 'use_atr': False, 'use_adx': True, 'use_ema': False, 'use_spike': True, 'rsi_required': False, 'edge_k': 0.2876954455799462, 'edge_cap': 0.7238750348931065, 'bull_strategy': 'mean_reversion', 'bull_bb_std_mult': 3.140826198535561, 'bull_rsi_os': 20, 'bull_rsi_ob': 79, 'bull_adx_thresh': 19.03506171094687, 'bull_atr_min_pct': 0.020452080010049452, 'bull_atr_max_pct': 0.1495759350843248, 'bull_tp_mult': 2.1197090447607594, 'bull_tsl_mult': 0.8948999884860539, 'bull_time_stop': 177, 'bull_use_sma': True, 'bull_use_ema': True, 'bull_use_atr': False, 'bull_use_adx': False, 'bull_use_spike': True, 'bull_rsi_required': True, 'bear_strategy': 'breakout', 'bear_bb_std_mult': 3.2277196701346376, 'bear_rsi_os': 28, 'bear_rsi_ob': 81, 'bear_adx_thresh': 15.069760115641962, 'bear_atr_min_pct': 0.010015067827070775, 'bear_atr_max_pct': 0.01892032665223295, 'bear_tp_mult': 2.762048566072141, 'bear_tsl_mult': 0.133387370506521, 'bear_time_stop': 265, 'bear_use_sma': True, 'bear_use_ema': True, 'bear_use_atr': False, 'bear_use_adx': False, 'bear_use_spike': True, 'bear_rsi_required': True, 'sideways_strategy': 'breakout', 'sideways_bb_std_mult': 3.495889577812512, 'sideways_rsi_os': 37, 'sideways_rsi_ob': 87, 'sideways_adx_thresh': 20.413467534946406, 'sideways_atr_min_pct': 0.017016393848118205, 'sideways_atr_max_pct': 0.11583332377022067, 'sideways_tp_mult': 1.0800298588404478, 'sideways_tsl_mult': 0.0012460582376179682, 'sideways_time_stop': 153, 'sideways_use_sma': False, 'sideways_use_ema': True, 'sideways_use_atr': True, 'sideways_use_adx': False, 'sideways_use_spike': False, 'sideways_rsi_required': True}.
[I 2025-08-30 18:39:37,428] Trial 86 finished with values: [-0.012681885530766879, 0.012612543247513198] and parameters: {'p_sma': 7, 'p_std': 31, 'p_atr': 9, 'p_adx': 20, 'rsi_period': 23, 'ema1': 26, 'ema2': 32, 'slip_atr_k': 0.07106710632447004, 'slip_spread_k': 0.15051624985083334, 'spread_hl_frac': 0.02379305598729383, 'bb_std_mult': 2.1754304750624125, 'rsi_os': 49, 'rsi_ob': 83, 'vol_spike': 0.2646583428276009, 'adx_thresh': 33.786474246409114, 'atr_min_pct': 0.02383499626471487, 'atr_max_pct': 0.0947037277690691, 'tp_mult': 2.2702213723020233, 'tsl_mult': 0.8367483984898856, 'strategy': 'mean_reversion', 'time_stop': 189, 'use_sma': False, 'use_atr': True, 'use_adx': True, 'use_ema': False, 'use_spike': True, 'rsi_required': False, 'edge_k': 0.12453806047655623, 'edge_cap': 0.5090237622197865, 'bull_strategy': 'mean_reversion', 'bull_bb_std_mult': 3.1393090937875696, 'bull_rsi_os': 31, 'bull_rsi_ob': 46, 'bull_adx_thresh': 18.31476782571891, 'bull_atr_min_pct': 0.001831035048060219, 'bull_atr_max_pct': 0.11937222042521387, 'bull_tp_mult': 2.742187103389974, 'bull_tsl_mult': 0.5323666117473498, 'bull_time_stop': 179, 'bull_use_sma': False, 'bull_use_ema': True, 'bull_use_atr': True, 'bull_use_adx': False, 'bull_use_spike': False, 'bull_rsi_required': True, 'bear_strategy': 'breakout', 'bear_bb_std_mult': 2.907738889802866, 'bear_rsi_os': 51, 'bear_rsi_ob': 76, 'bear_adx_thresh': 17.735545658811755, 'bear_atr_min_pct': 0.014958529316022085, 'bear_atr_max_pct': 0.03348242162344348, 'bear_tp_mult': 2.6857181548969673, 'bear_tsl_mult': 0.7605662432080121, 'bear_time_stop': 199, 'bear_use_sma': True, 'bear_use_ema': True, 'bear_use_atr': False, 'bear_use_adx': False, 'bear_use_spike': False, 'bear_rsi_required': True, 'sideways_strategy': 'breakout', 'sideways_bb_std_mult': 3.172223034058174, 'sideways_rsi_os': 36, 'sideways_rsi_ob': 59, 'sideways_adx_thresh': 20.785392727535417, 'sideways_atr_min_pct': 0.002113596996875741, 'sideways_atr_max_pct': 0.14637455188542897, 'sideways_tp_mult': 1.0807025133613695, 'sideways_tsl_mult': 0.9800489563079785, 'sideways_time_stop': 157, 'sideways_use_sma': False, 'sideways_use_ema': True, 'sideways_use_atr': True, 'sideways_use_adx': False, 'sideways_use_spike': False, 'sideways_rsi_required': True}.
