[I 2025-08-30 18:57:46,994] Trial 252 finished with values: [-1000000000.0, 1000000000.0] and parameters: {'p_sma': 7, 'p_std': 30, 'p_atr': 8, 'p_adx': 21, 'rsi_period': 60, 'ema1': 25, 'ema2': 29, 'slip_atr_k': 0.06855190345165672, 'slip_spread_k': 0.21209261296402482, 'spread_hl_frac': 0.0001531774622337105, 'bb_std_mult': 3.5540159564962526, 'rsi_os': 49, 'rsi_ob': 83, 'vol_spike': 0.2610881458344256, 'adx_thresh': 21.00306641472972, 'atr_min_pct': 0.013585859605749253, 'atr_max_pct': 0.0902869322468219, 'tp_mult': 1.5573407705926947, 'tsl_mult': 0.8183116165262838, 'strategy': 'mean_reversion', 'time_stop': 201, 'use_sma': False, 'use_atr': True, 'use_adx': True, 'use_ema': False, 'use_spike': True, 'rsi_required': False, 'edge_k': 0.2307002599482625, 'edge_cap': 0.5089292637942447, 'bull_strategy': 'mean_reversion', 'bull_bb_std_mult': 3.099512122867257, 'bull_rsi_os': 51, 'bull_rsi_ob': 83, 'bull_adx_thresh': 33.346139639870756, 'bull_atr_min_pct': 0.0012659403397034569, 'bull_atr_max_pct': 0.12351163258394204, 'bull_tp_mult': 2.066935511313272, 'bull_tsl_mult': 0.16821547764310396, 'bull_time_stop': 43, 'bull_use_sma': False, 'bull_use_ema': True, 'bull_use_atr': True, 'bull_use_adx': False, 'bull_use_spike': False, 'bull_rsi_required': True, 'bear_strategy': 'breakout', 'bear_bb_std_mult': 3.244133919676424, 'bear_rsi_os': 52, 'bear_rsi_ob': 67, 'bear_adx_thresh': 10.225100682931346, 'bear_atr_min_pct': 0.01580539590429416, 'bear_atr_max_pct': 0.07644301803287522, 'bear_tp_mult': 2.6982009291923386, 'bear_tsl_mult': 0.31164284635566697, 'bear_time_stop': 153, 'bear_use_sma': True, 'bear_use_ema': True, 'bear_use_atr': False, 'bear_use_adx': False, 'bear_use_spike': False, 'bear_rsi_required': True, 'sideways_strategy': 'breakout', 'sideways_bb_std_mult': 3.3220497334036447, 'sideways_rsi_os': 38, 'sideways_rsi_ob': 84, 'sideways_adx_thresh': 9.237616053934914, 'sideways_atr_min_pct': 0.0014792034198518895, 'sideways_atr_max_pct': 0.07116222611879655, 'sideways_tp_mult': 2.952295358444095, 'sideways_tsl_mult': 0.5462893256669334, 'sideways_time_stop': 178, 'sideways_use_sma': False, 'sideways_use_ema': True, 'sideways_use_atr': False, 'sideways_use_adx': False, 'sideways_use_spike': False, 'sideways_rsi_required': True}.
[I 2025-08-30 18:57:47,487] Trial 255 finished with values: [-1000000000.0, 1000000000.0] and parameters: {'p_sma': 8, 'p_std': 13, 'p_atr': 26, 'p_adx': 22, 'rsi_period': 25, 'ema1': 25, 'ema2': 29, 'slip_atr_k': 0.08611342304497042, 'slip_spread_k': 0.2505649975597724, 'spread_hl_frac': 0.013863326110113563, 'bb_std_mult': 2.1395088713679153, 'rsi_os': 51, 'rsi_ob': 56, 'vol_spike': 0.261935796531927, 'adx_thresh': 33.917583826459634, 'atr_min_pct': 0.02308245079706666, 'atr_max_pct': 0.037308245577259085, 'tp_mult': 2.2760405928205274, 'tsl_mult': 0.5994260135187343, 'strategy': 'mean_reversion', 'time_stop': 179, 'use_sma': False, 'use_atr': True, 'use_adx': False, 'use_ema': False, 'use_spike': False, 'rsi_required': True, 'edge_k': 0.22184306765838246, 'edge_cap': 0.5048769427807894, 'bull_strategy': 'mean_reversion', 'bull_bb_std_mult': 3.1011922032923303, 'bull_rsi_os': 32, 'bull_rsi_ob': 48, 'bull_adx_thresh': 30.46193687671219, 'bull_atr_min_pct': 0.0014889548083954502, 'bull_atr_max_pct': 0.12058104787998702, 'bull_tp_mult': 2.7682198420956516, 'bull_tsl_mult': 0.5190422394944347, 'bull_time_stop': 167, 'bull_use_sma': True, 'bull_use_ema': True, 'bull_use_atr': False, 'bull_use_adx': True, 'bull_use_spike': True, 'bull_rsi_required': False, 'bear_strategy': 'breakout', 'bear_bb_std_mult': 3.058091455450464, 'bear_rsi_os': 11, 'bear_rsi_ob': 70, 'bear_adx_thresh': 23.293085652770948, 'bear_atr_min_pct': 0.008684482092964971, 'bear_atr_max_pct': 0.07403108311920154, 'bear_tp_mult': 2.6564879458398543, 'bear_tsl_mult': 0.45577078375133373, 'bear_time_stop': 208, 'bear_use_sma': False, 'bear_use_ema': True, 'bear_use_atr': True, 'bear_use_adx': False, 'bear_use_spike': False, 'bear_rsi_required': True, 'sideways_strategy': 'mean_reversion', 'sideways_bb_std_mult': 1.098285605077233, 'sideways_rsi_os': 51, 'sideways_rsi_ob': 72, 'sideways_adx_thresh': 20.941948672101358, 'sideways_atr_min_pct': 0.0012915483356687068, 'sideways_atr_max_pct': 0.1408813889381897, 'sideways_tp_mult': 2.160993259132106, 'sideways_tsl_mult': 0.9516489791511638, 'sideways_time_stop': 82, 'sideways_use_sma': True, 'sideways_use_ema': True, 'sideways_use_atr': False, 'sideways_use_adx': False, 'sideways_use_spike': False, 'sideways_rsi_required': True}.
[I 2025-08-30 18:58:19,193] Trial 253 finished with values: [-1000000000.0, 1000000000.0] and parameters: {'p_sma': 8, 'p_std': 12, 'p_atr': 9, 'p_adx': 19, 'rsi_period': 25, 'ema1': 25, 'ema2': 29, 'slip_atr_k': 0.23841764479045427, 'slip_spread_k': 0.22807276730107412, 'spread_hl_frac': 0.02541712981804584, 'bb_std_mult': 2.13324000865772, 'rsi_os': 36, 'rsi_ob': 55, 'vol_spike': 0.24376610174687344, 'adx_thresh': 18.59342274416246, 'atr_min_pct': 0.019649148874829665, 'atr_max_pct': 0.1018787814278019, 'tp_mult': 2.285375211397738, 'tsl_mult': 0.8187117913542497, 'strategy': 'mean_reversion', 'time_stop': 197, 'use_sma': False, 'use_atr': False, 'use_adx': True, 'use_ema': False, 'use_spike': False, 'rsi_required': False, 'edge_k': 1.088721362685052, 'edge_cap': 0.5131003115138564, 'bull_strategy': 'mean_reversion', 'bull_bb_std_mult': 3.100393515440859, 'bull_rsi_os': 12, 'bull_rsi_ob': 45, 'bull_adx_thresh': 17.814391754718, 'bull_atr_min_pct': 0.029997810226549557, 'bull_atr_max_pct': 0.1237807725709033, 'bull_tp_mult': 2.3710854036054343, 'bull_tsl_mult': 0.5108624025828907, 'bull_time_stop': 76, 'bull_use_sma': False, 'bull_use_ema': True, 'bull_use_atr': True, 'bull_use_adx': False, 'bull_use_spike': False, 'bull_rsi_required': False, 'bear_strategy': 'breakout', 'bear_bb_std_mult': 3.0551284828351157, 'bear_rsi_os': 50, 'bear_rsi_ob': 67, 'bear_adx_thresh': 6.495830659665705, 'bear_atr_min_pct': 0.015858429751785898, 'bear_atr_max_pct': 0.073992840369684, 'bear_tp_mult': 1.9007484136051156, 'bear_tsl_mult': 0.8643267171691211, 'bear_time_stop': 130, 'bear_use_sma': False, 'bear_use_ema': True, 'bear_use_atr': False, 'bear_use_adx': False, 'bear_use_spike': False, 'bear_rsi_required': True, 'sideways_strategy': 'breakout', 'sideways_bb_std_mult': 3.3926120111067637, 'sideways_rsi_os': 38, 'sideways_rsi_ob': 82, 'sideways_adx_thresh': 20.93152366358664, 'sideways_atr_min_pct': 0.009716017327305895, 'sideways_atr_max_pct': 0.07192281386871008, 'sideways_tp_mult': 2.151509361617717, 'sideways_tsl_mult': 0.9506924924496684, 'sideways_time_stop': 180, 'sideways_use_sma': True, 'sideways_use_ema': True, 'sideways_use_atr': False, 'sideways_use_adx': False, 'sideways_use_spike': False, 'sideways_rsi_required': True}.
[I 2025-08-30 18:58:20,130] Trial 254 finished with values: [-1000000000.0, 1000000000.0] and parameters: {'p_sma': 8, 'p_std': 32, 'p_atr': 26, 'p_adx': 19, 'rsi_period': 25, 'ema1': 25, 'ema2': 31, 'slip_atr_k': 0.23764225565524008, 'slip_spread_k': 0.23290589230642816, 'spread_hl_frac': 0.02527353610773158, 'bb_std_mult': 1.9799940030640075, 'rsi_os': 27, 'rsi_ob': 83, 'vol_spike': 0.051150314853700266, 'adx_thresh': 33.744451349170774, 'atr_min_pct': 0.01866987943095451, 'atr_max_pct': 0.11227808649837678, 'tp_mult': 2.2852642748115914, 'tsl_mult': 0.4230633083812465, 'strategy': 'mean_reversion', 'time_stop': 201, 'use_sma': False, 'use_atr': False, 'use_adx': False, 'use_ema': False, 'use_spike': False, 'rsi_required': True, 'edge_k': 0.22048094638018978, 'edge_cap': 0.5129356609193675, 'bull_strategy': 'mean_reversion', 'bull_bb_std_mult': 3.0923122575642346, 'bull_rsi_os': 32, 'bull_rsi_ob': 49, 'bull_adx_thresh': 17.641476461778442, 'bull_atr_min_pct': 0.0012820279366717966, 'bull_atr_max_pct': 0.12013293729880342, 'bull_tp_mult': 1.5297323396639668, 'bull_tsl_mult': 0.9549782856170563, 'bull_time_stop': 164, 'bull_use_sma': False, 'bull_use_ema': True, 'bull_use_atr': True, 'bull_use_adx': True, 'bull_use_spike': False, 'bull_rsi_required': False, 'bear_strategy': 'breakout', 'bear_bb_std_mult': 3.22465971885019, 'bear_rsi_os': 11, 'bear_rsi_ob': 72, 'bear_adx_thresh': 7.631294920065384, 'bear_atr_min_pct': 0.015518022159420532, 'bear_atr_max_pct': 0.031782199142999505, 'bear_tp_mult': 1.8848033028492859, 'bear_tsl_mult': 0.16264016728136604, 'bear_time_stop': 208, 'bear_use_sma': False, 'bear_use_ema': True, 'bear_use_atr': False, 'bear_use_adx': False, 'bear_use_spike': False, 'bear_rsi_required': True, 'sideways_strategy': 'breakout', 'sideways_bb_std_mult': 0.5307981204442949, 'sideways_rsi_os': 37, 'sideways_rsi_ob': 60, 'sideways_adx_thresh': 9.032850399129162, 'sideways_atr_min_pct': 0.009728065766450012, 'sideways_atr_max_pct': 0.1426625628419258, 'sideways_tp_mult': 2.9596807976781685, 'sideways_tsl_mult': 0.5525541656652324, 'sideways_time_stop': 184, 'sideways_use_sma': True, 'sideways_use_ema': True, 'sideways_use_atr': False, 'sideways_use_adx': False, 'sideways_use_spike': True, 'sideways_rsi_required': True}.
[I 2025-08-30 18:58:21,036] Trial 256 finished with values: [-1000000000.0, 1000000000.0] and parameters: {'p_sma': 30, 'p_std': 32, 'p_atr': 7, 'p_adx': 15, 'rsi_period': 76, 'ema1': 26, 'ema2': 50, 'slip_atr_k': 0.09978271840207276, 'slip_spread_k': 0.25321712296224524, 'spread_hl_frac': 0.025314046701517854, 'bb_std_mult': 2.1420121889750137, 'rsi_os': 15, 'rsi_ob': 63, 'vol_spike': 0.24321054898989428, 'adx_thresh': 18.57060198082759, 'atr_min_pct': 0.01869738516132176, 'atr_max_pct': 0.10051973219255508, 'tp_mult': 2.272956977996822, 'tsl_mult': 0.786316266385044, 'strategy': 'mean_reversion', 'time_stop': 277, 'use_sma': True, 'use_atr': True, 'use_adx': False, 'use_ema': False, 'use_spike': False, 'rsi_required': True, 'edge_k': 1.0872987231583373, 'edge_cap': 0.5598230635359127, 'bull_strategy': 'breakout', 'bull_bb_std_mult': 3.0377892348290607, 'bull_rsi_os': 12, 'bull_rsi_ob': 48, 'bull_adx_thresh': 30.337315555712408, 'bull_atr_min_pct': 0.011063875692447829, 'bull_atr_max_pct': 0.11861755168723849, 'bull_tp_mult': 1.3757420933305309, 'bull_tsl_mult': 0.5211320258405922, 'bull_time_stop': 142, 'bull_use_sma': True, 'bull_use_ema': True, 'bull_use_atr': False, 'bull_use_adx': True, 'bull_use_spike': True, 'bull_rsi_required': False, 'bear_strategy': 'breakout', 'bear_bb_std_mult': 1.8280072413315156, 'bear_rsi_os': 22, 'bear_rsi_ob': 69, 'bear_adx_thresh': 6.488933810248636, 'bear_atr_min_pct': 0.005757950372218417, 'bear_atr_max_pct': 0.09174901990897288, 'bear_tp_mult': 2.65009224905552, 'bear_tsl_mult': 0.45865310249252417, 'bear_time_stop': 207, 'bear_use_sma': False, 'bear_use_ema': True, 'bear_use_atr': True, 'bear_use_adx': False, 'bear_use_spike': True, 'bear_rsi_required': True, 'sideways_strategy': 'mean_reversion', 'sideways_bb_std_mult': 1.5952570219400206, 'sideways_rsi_os': 35, 'sideways_rsi_ob': 91, 'sideways_adx_thresh': 20.866737090480882, 'sideways_atr_min_pct': 0.0025680953855213616, 'sideways_atr_max_pct': 0.02419480215950439, 'sideways_tp_mult': 1.0169559089605318, 'sideways_tsl_mult': 0.7813787343204461, 'sideways_time_stop': 136, 'sideways_use_sma': True, 'sideways_use_ema': True, 'sideways_use_atr': False, 'sideways_use_adx': True, 'sideways_use_spike': False, 'sideways_rsi_required': True}.
[I 2025-08-30 18:58:21,587] Trial 257 finished with values: [-1000000000.0, 1000000000.0] and parameters: {'p_sma': 9, 'p_std': 31, 'p_atr': 7, 'p_adx': 15, 'rsi_period': 23, 'ema1': 26, 'ema2': 31, 'slip_atr_k': 0.10045109485608031, 'slip_spread_k': 0.5677911568900766, 'spread_hl_frac': 0.02486547126653987, 'bb_std_mult': 2.378410440268173, 'rsi_os': 16, 'rsi_ob': 63, 'vol_spike': 0.269565528617859, 'adx_thresh': 34.92606831186252, 'atr_min_pct': 0.010849840791887996, 'atr_max_pct': 0.11165313150797009, 'tp_mult': 2.5332728206668342, 'tsl_mult': 0.21007779763971546, 'strategy': 'mean_reversion', 'time_stop': 110, 'use_sma': True, 'use_atr': False, 'use_adx': True, 'use_ema': False, 'use_spike': False, 'rsi_required': True, 'edge_k': 0.9998386788948096, 'edge_cap': 0.5601849650119155, 'bull_strategy': 'breakout', 'bull_bb_std_mult': 3.0285681349175864, 'bull_rsi_os': 31, 'bull_rsi_ob': 49, 'bull_adx_thresh': 17.864813377420983, 'bull_atr_min_pct': 0.0027483512982580285, 'bull_atr_max_pct': 0.0644753142440935, 'bull_tp_mult': 2.570907103552248, 'bull_tsl_mult': 0.5503325381082688, 'bull_time_stop': 138, 'bull_use_sma': False, 'bull_use_ema': True, 'bull_use_atr': True, 'bull_use_adx': True, 'bull_use_spike': False, 'bull_rsi_required': False, 'bear_strategy': 'breakout', 'bear_bb_std_mult': 2.9923520784836577, 'bear_rsi_os': 23, 'bear_rsi_ob': 69, 'bear_adx_thresh': 18.397289340736783, 'bear_atr_min_pct': 0.01465995604670314, 'bear_atr_max_pct': 0.04136928817976218, 'bear_tp_mult': 1.847915873085239, 'bear_tsl_mult': 0.8679842542286992, 'bear_time_stop': 132, 'bear_use_sma': False, 'bear_use_ema': False, 'bear_use_atr': False, 'bear_use_adx': False, 'bear_use_spike': True, 'bear_rsi_required': True, 'sideways_strategy': 'breakout', 'sideways_bb_std_mult': 3.3943205293757175, 'sideways_rsi_os': 37, 'sideways_rsi_ob': 79, 'sideways_adx_thresh': 20.954425024321704, 'sideways_atr_min_pct': 0.0032272322927911906, 'sideways_atr_max_pct': 0.09931116724881357, 'sideways_tp_mult': 1.0186577137684274, 'sideways_tsl_mult': 0.9602819722611305, 'sideways_time_stop': 135, 'sideways_use_sma': True, 'sideways_use_ema': True, 'sideways_use_atr': True, 'sideways_use_adx': True, 'sideways_use_spike': False, 'sideways_rsi_required': True}.
[I 2025-08-30 18:58:53,939] Trial 260 finished with values: [-1000000000.0, 1000000000.0] and parameters: {'p_sma': 28, 'p_std': 31, 'p_atr': 18, 'p_adx': 20, 'rsi_period': 34, 'ema1': 26, 'ema2': 13, 'slip_atr_k': 0.000352929109980582, 'slip_spread_k': 0.08560418532469564, 'spread_hl_frac': 0.021712321411783968, 'bb_std_mult': 3.023089908271963, 'rsi_os': 49, 'rsi_ob': 85, 'vol_spike': 0.25212916311960065, 'adx_thresh': 11.071819342802964, 'atr_min_pct': 0.02451549768503492, 'atr_max_pct': 0.09571739407306647, 'tp_mult': 1.3882800266780073, 'tsl_mult': 0.06643663816725998, 'strategy': 'breakout', 'time_stop': 184, 'use_sma': True, 'use_atr': True, 'use_adx': True, 'use_ema': True, 'use_spike': True, 'rsi_required': False, 'edge_k': 0.12850129293393758, 'edge_cap': 0.14197648679474073, 'bull_strategy': 'breakout', 'bull_bb_std_mult': 3.256535282209629, 'bull_rsi_os': 9, 'bull_rsi_ob': 46, 'bull_adx_thresh': 16.62395317962786, 'bull_atr_min_pct': 0.028897202873516, 'bull_atr_max_pct': 0.04940854642074507, 'bull_tp_mult': 2.3039487853485396, 'bull_tsl_mult': 0.5528810076734879, 'bull_time_stop': 126, 'bull_use_sma': False, 'bull_use_ema': False, 'bull_use_atr': True, 'bull_use_adx': False, 'bull_use_spike': False, 'bull_rsi_required': True, 'bear_strategy': 'mean_reversion', 'bear_bb_std_mult': 1.3935376912381754, 'bear_rsi_os': 24, 'bear_rsi_ob': 80, 'bear_adx_thresh': 20.67722436467718, 'bear_atr_min_pct': 0.014577647013277845, 'bear_atr_max_pct': 0.11110472656449602, 'bear_tp_mult': 2.8187287546099515, 'bear_tsl_mult': 0.688382708272065, 'bear_time_stop': 203, 'bear_use_sma': True, 'bear_use_ema': False, 'bear_use_atr': False, 'bear_use_adx': True, 'bear_use_spike': True, 'bear_rsi_required': True, 'sideways_strategy': 'breakout', 'sideways_bb_std_mult': 3.1654591372071192, 'sideways_rsi_os': 34, 'sideways_rsi_ob': 58, 'sideways_adx_thresh': 20.326133764604545, 'sideways_atr_min_pct': 0.0032835148479849327, 'sideways_atr_max_pct': 0.03705794192353071, 'sideways_tp_mult': 1.5399016114105597, 'sideways_tsl_mult': 0.6198822186985455, 'sideways_time_stop': 24, 'sideways_use_sma': False, 'sideways_use_ema': True, 'sideways_use_atr': True, 'sideways_use_adx': True, 'sideways_use_spike': False, 'sideways_rsi_required': True}.
[I 2025-08-30 18:58:54,259] Trial 259 finished with values: [-1000000000.0, 1000000000.0] and parameters: {'p_sma': 30, 'p_std': 31, 'p_atr': 7, 'p_adx': 20, 'rsi_period': 23, 'ema1': 26, 'ema2': 50, 'slip_atr_k': 0.0963720612870978, 'slip_spread_k': 0.09175411059007177, 'spread_hl_frac': 0.022164022054952826, 'bb_std_mult': 1.3364812299218514, 'rsi_os': 50, 'rsi_ob': 68, 'vol_spike': 0.26787354363050586, 'adx_thresh': 32.116649117050414, 'atr_min_pct': 0.010044545774765008, 'atr_max_pct': 0.10836575596319113, 'tp_mult': 2.1883724397944952, 'tsl_mult': 0.21440866619572857, 'strategy': 'breakout', 'time_stop': 275, 'use_sma': True, 'use_atr': True, 'use_adx': True, 'use_ema': False, 'use_spike': True, 'rsi_required': False, 'edge_k': 1.0054529591278683, 'edge_cap': 0.2577877553413614, 'bull_strategy': 'breakout', 'bull_bb_std_mult': 2.320876774256286, 'bull_rsi_os': 9, 'bull_rsi_ob': 46, 'bull_adx_thresh': 18.244910964314762, 'bull_atr_min_pct': 0.023690314025224646, 'bull_atr_max_pct': 0.08622753047164813, 'bull_tp_mult': 1.950729604307342, 'bull_tsl_mult': 0.5917219235763787, 'bull_time_stop': 123, 'bull_use_sma': True, 'bull_use_ema': False, 'bull_use_atr': False, 'bull_use_adx': False, 'bull_use_spike': True, 'bull_rsi_required': True, 'bear_strategy': 'breakout', 'bear_bb_std_mult': 1.383075807456827, 'bear_rsi_os': 16, 'bear_rsi_ob': 80, 'bear_adx_thresh': 9.118900797101109, 'bear_atr_min_pct': 0.014617668309860912, 'bear_atr_max_pct': 0.10552420396501154, 'bear_tp_mult': 2.178388440604598, 'bear_tsl_mult': 0.6855482837435924, 'bear_time_stop': 203, 'bear_use_sma': True, 'bear_use_ema': False, 'bear_use_atr': True, 'bear_use_adx': True, 'bear_use_spike': True, 'bear_rsi_required': True, 'sideways_strategy': 'mean_reversion', 'sideways_bb_std_mult': 0.6946575961915507, 'sideways_rsi_os': 35, 'sideways_rsi_ob': 61, 'sideways_adx_thresh': 30.091108736985355, 'sideways_atr_min_pct': 0.002542356426328891, 'sideways_atr_max_pct': 0.09957394090289054, 'sideways_tp_mult': 1.1565496915893783, 'sideways_tsl_mult': 0.4748405383732775, 'sideways_time_stop': 60, 'sideways_use_sma': False, 'sideways_use_ema': True, 'sideways_use_atr': True, 'sideways_use_adx': True, 'sideways_use_spike': False, 'sideways_rsi_required': True}.
[I 2025-08-30 18:58:54,493] Trial 261 finished with values: [-1000000000.0, 1000000000.0] and parameters: {'p_sma': 19, 'p_std': 17, 'p_atr': 18, 'p_adx': 20, 'rsi_period': 19, 'ema1': 27, 'ema2': 34, 'slip_atr_k': 0.06393386026697388, 'slip_spread_k': 0.10145970012846911, 'spread_hl_frac': 0.021299198289708495, 'bb_std_mult': 1.3490230752679166, 'rsi_os': 47, 'rsi_ob': 48, 'vol_spike': 0.28043315115587203, 'adx_thresh': 10.882936493999226, 'atr_min_pct': 0.02491562813009926, 'atr_max_pct': 0.08392710249766994, 'tp_mult': 2.656192127769208, 'tsl_mult': 0.07096575295669422, 'strategy': 'breakout', 'time_stop': 192, 'use_sma': False, 'use_atr': True, 'use_adx': True, 'use_ema': True, 'use_spike': True, 'rsi_required': False, 'edge_k': 0.1448525023977811, 'edge_cap': 0.2654182647679856, 'bull_strategy': 'mean_reversion', 'bull_bb_std_mult': 2.7407674754737585, 'bull_rsi_os': 54, 'bull_rsi_ob': 60, 'bull_adx_thresh': 16.63657917016723, 'bull_atr_min_pct': 0.028931041060687647, 'bull_atr_max_pct': 0.11642041099844139, 'bull_tp_mult': 1.9625806096130383, 'bull_tsl_mult': 0.5941852243883641, 'bull_time_stop': 171, 'bull_use_sma': False, 'bull_use_ema': False, 'bull_use_atr': True, 'bull_use_adx': False, 'bull_use_spike': False, 'bull_rsi_required': True, 'bear_strategy': 'mean_reversion', 'bear_bb_std_mult': 2.074646663484619, 'bear_rsi_os': 48, 'bear_rsi_ob': 72, 'bear_adx_thresh': 9.091074434821593, 'bear_atr_min_pct': 0.012747039905823255, 'bear_atr_max_pct': 0.12568033062026537, 'bear_tp_mult': 1.5103380169179614, 'bear_tsl_mult': 0.6946700316047739, 'bear_time_stop': 202, 'bear_use_sma': True, 'bear_use_ema': False, 'bear_use_atr': False, 'bear_use_adx': True, 'bear_use_spike': False, 'bear_rsi_required': True, 'sideways_strategy': 'breakout', 'sideways_bb_std_mult': 3.155957971371393, 'sideways_rsi_os': 8, 'sideways_rsi_ob': 76, 'sideways_adx_thresh': 25.890901284218394, 'sideways_atr_min_pct': 0.022148696410432298, 'sideways_atr_max_pct': 0.14581414676745155, 'sideways_tp_mult': 1.1653773540923433, 'sideways_tsl_mult': 0.9991456099076902, 'sideways_time_stop': 171, 'sideways_use_sma': False, 'sideways_use_ema': True, 'sideways_use_atr': True, 'sideways_use_adx': False, 'sideways_use_spike': True, 'sideways_rsi_required': True}.
