[I 2025-08-30 19:14:10,849] Trial 396 finished with values: [-1000000000.0, 1000000000.0] and parameters: {'p_sma': 5, 'p_std': 31, 'p_atr': 10, 'p_adx': 15, 'rsi_period': 67, 'ema1': 25, 'ema2': 33, 'slip_atr_k': 0.07283240781852782, 'slip_spread_k': 0.10703687607726775, 'spread_hl_frac': 0.02401097189526433, 'bb_std_mult': 0.7272364534742732, 'rsi_os': 35, 'rsi_ob': 82, 'vol_spike': 0.25014312408409406, 'adx_thresh': 33.10173868309187, 'atr_min_pct': 0.005203812463570318, 'atr_max_pct': 0.09143235998838853, 'tp_mult': 2.820913264611507, 'tsl_mult': 0.7870781797235776, 'strategy': 'mean_reversion', 'time_stop': 176, 'use_sma': False, 'use_atr': True, 'use_adx': True, 'use_ema': False, 'use_spike': True, 'rsi_required': False, 'edge_k': 0.14090450429704218, 'edge_cap': 0.1347393555138972, 'bull_strategy': 'mean_reversion', 'bull_bb_std_mult': 2.989900151620655, 'bull_rsi_os': 31, 'bull_rsi_ob': 46, 'bull_adx_thresh': 8.54276425248121, 'bull_atr_min_pct': 0.003522978363564134, 'bull_atr_max_pct': 0.07908360333442628, 'bull_tp_mult': 2.0702374270125032, 'bull_tsl_mult': 0.4929575635567721, 'bull_time_stop': 285, 'bull_use_sma': False, 'bull_use_ema': True, 'bull_use_atr': True, 'bull_use_adx': False, 'bull_use_spike': False, 'bull_rsi_required': True, 'bear_strategy': 'breakout', 'bear_bb_std_mult': 2.9624379872131654, 'bear_rsi_os': 51, 'bear_rsi_ob': 75, 'bear_adx_thresh': 22.5316277957745, 'bear_atr_min_pct': 0.0020150619099211352, 'bear_atr_max_pct': 0.04333784628194857, 'bear_tp_mult': 2.643650436015536, 'bear_tsl_mult': 0.8155111984884942, 'bear_time_stop': 263, 'bear_use_sma': True, 'bear_use_ema': True, 'bear_use_atr': True, 'bear_use_adx': False, 'bear_use_spike': False, 'bear_rsi_required': True, 'sideways_strategy': 'breakout', 'sideways_bb_std_mult': 3.395852795623194, 'sideways_rsi_os': 36, 'sideways_rsi_ob': 81, 'sideways_adx_thresh': 21.71353843056104, 'sideways_atr_min_pct': 0.004991998990151798, 'sideways_atr_max_pct': 0.14517099263566652, 'sideways_tp_mult': 1.0827236807025875, 'sideways_tsl_mult': 0.5623300115268064, 'sideways_time_stop': 72, 'sideways_use_sma': False, 'sideways_use_ema': True, 'sideways_use_atr': True, 'sideways_use_adx': False, 'sideways_use_spike': False, 'sideways_rsi_required': True}.
[I 2025-08-30 19:14:11,015] Trial 397 finished with values: [-1000000000.0, 1000000000.0] and parameters: {'p_sma': 5, 'p_std': 31, 'p_atr': 10, 'p_adx': 10, 'rsi_period': 19, 'ema1': 25, 'ema2': 18, 'slip_atr_k': 0.06262212871461736, 'slip_spread_k': 0.11186714954331758, 'spread_hl_frac': 0.02450652844135152, 'bb_std_mult': 2.1891727596373256, 'rsi_os': 49, 'rsi_ob': 75, 'vol_spike': 0.26982247634126877, 'adx_thresh': 30.142110117015477, 'atr_min_pct': 0.005095569560212246, 'atr_max_pct': 0.0910131126645156, 'tp_mult': 2.2968818167959175, 'tsl_mult': 0.15375295592186594, 'strategy': 'mean_reversion', 'time_stop': 174, 'use_sma': False, 'use_atr': True, 'use_adx': True, 'use_ema': False, 'use_spike': True, 'rsi_required': False, 'edge_k': 0.04841304990537676, 'edge_cap': 0.5139352155052131, 'bull_strategy': 'mean_reversion', 'bull_bb_std_mult': 1.0574975727786675, 'bull_rsi_os': 36, 'bull_rsi_ob': 46, 'bull_adx_thresh': 33.628267867071834, 'bull_atr_min_pct': 0.014979671034492843, 'bull_atr_max_pct': 0.02202834464846614, 'bull_tp_mult': 2.7531877019605897, 'bull_tsl_mult': 0.49992692193029653, 'bull_time_stop': 170, 'bull_use_sma': False, 'bull_use_ema': True, 'bull_use_atr': True, 'bull_use_adx': False, 'bull_use_spike': False, 'bull_rsi_required': True, 'bear_strategy': 'breakout', 'bear_bb_std_mult': 2.953291183744928, 'bear_rsi_os': 51, 'bear_rsi_ob': 75, 'bear_adx_thresh': 16.289402243312296, 'bear_atr_min_pct': 0.01693415543431096, 'bear_atr_max_pct': 0.042733055466983215, 'bear_tp_mult': 1.5204174823161642, 'bear_tsl_mult': 0.4436076849708709, 'bear_time_stop': 199, 'bear_use_sma': True, 'bear_use_ema': False, 'bear_use_atr': True, 'bear_use_adx': False, 'bear_use_spike': False, 'bear_rsi_required': True, 'sideways_strategy': 'breakout', 'sideways_bb_std_mult': 3.161879024064694, 'sideways_rsi_os': 36, 'sideways_rsi_ob': 57, 'sideways_adx_thresh': 23.7735973712791, 'sideways_atr_min_pct': 0.0049918345888111774, 'sideways_atr_max_pct': 0.14459406556064883, 'sideways_tp_mult': 1.0756156760068842, 'sideways_tsl_mult': 0.5539568479308966, 'sideways_time_stop': 152, 'sideways_use_sma': False, 'sideways_use_ema': True, 'sideways_use_atr': True, 'sideways_use_adx': False, 'sideways_use_spike': False, 'sideways_rsi_required': False}.
[I 2025-08-30 19:14:11,782] Trial 401 finished with values: [-1000000000.0, 1000000000.0] and parameters: {'p_sma': 9, 'p_std': 28, 'p_atr': 13, 'p_adx': 16, 'rsi_period': 70, 'ema1': 27, 'ema2': 31, 'slip_atr_k': 0.19535458347658496, 'slip_spread_k': 0.1717554661879768, 'spread_hl_frac': 0.02203755426783118, 'bb_std_mult': 0.8422389926318306, 'rsi_os': 13, 'rsi_ob': 48, 'vol_spike': 0.2679790898541361, 'adx_thresh': 33.80857212792519, 'atr_min_pct': 0.022819732427293793, 'atr_max_pct': 0.09462178345699948, 'tp_mult': 2.1474508181221594, 'tsl_mult': 0.7739986798567933, 'strategy': 'mean_reversion', 'time_stop': 205, 'use_sma': False, 'use_atr': True, 'use_adx': True, 'use_ema': True, 'use_spike': True, 'rsi_required': False, 'edge_k': 0.07912443185166179, 'edge_cap': 0.30956887570631797, 'bull_strategy': 'breakout', 'bull_bb_std_mult': 3.1698629428060707, 'bull_rsi_os': 39, 'bull_rsi_ob': 48, 'bull_adx_thresh': 20.669543258190078, 'bull_atr_min_pct': 0.0011947089832917608, 'bull_atr_max_pct': 0.1238535064815193, 'bull_tp_mult': 2.7608653827839422, 'bull_tsl_mult': 0.6599368015248259, 'bull_time_stop': 243, 'bull_use_sma': False, 'bull_use_ema': False, 'bull_use_atr': True, 'bull_use_adx': False, 'bull_use_spike': False, 'bull_rsi_required': True, 'bear_strategy': 'mean_reversion', 'bear_bb_std_mult': 2.8716972381571813, 'bear_rsi_os': 19, 'bear_rsi_ob': 77, 'bear_adx_thresh': 25.490725568453453, 'bear_atr_min_pct': 0.01898223737241504, 'bear_atr_max_pct': 0.0400923886247827, 'bear_tp_mult': 2.2606078603194724, 'bear_tsl_mult': 0.22166105707606554, 'bear_time_stop': 156, 'bear_use_sma': True, 'bear_use_ema': False, 'bear_use_atr': False, 'bear_use_adx': False, 'bear_use_spike': False, 'bear_rsi_required': True, 'sideways_strategy': 'breakout', 'sideways_bb_std_mult': 3.303918378746676, 'sideways_rsi_os': 35, 'sideways_rsi_ob': 83, 'sideways_adx_thresh': 32.837541608680375, 'sideways_atr_min_pct': 0.022653757524814244, 'sideways_atr_max_pct': 0.07126879992529528, 'sideways_tp_mult': 1.1354404060302976, 'sideways_tsl_mult': 0.23081003230810077, 'sideways_time_stop': 136, 'sideways_use_sma': False, 'sideways_use_ema': False, 'sideways_use_atr': False, 'sideways_use_adx': False, 'sideways_use_spike': False, 'sideways_rsi_required': False}.
[I 2025-08-30 19:14:11,791] Trial 400 finished with values: [-1000000000.0, 1000000000.0] and parameters: {'p_sma': 27, 'p_std': 23, 'p_atr': 23, 'p_adx': 17, 'rsi_period': 20, 'ema1': 5, 'ema2': 32, 'slip_atr_k': 0.06301629510649615, 'slip_spread_k': 0.7446858863266531, 'spread_hl_frac': 0.027402014848487394, 'bb_std_mult': 0.8590692752685944, 'rsi_os': 49, 'rsi_ob': 49, 'vol_spike': 0.03613782093945647, 'adx_thresh': 33.84920188660322, 'atr_min_pct': 0.023321576659470787, 'atr_max_pct': 0.10039298665325512, 'tp_mult': 1.5782206164323151, 'tsl_mult': 0.8319403836495803, 'strategy': 'mean_reversion', 'time_stop': 131, 'use_sma': False, 'use_atr': True, 'use_adx': True, 'use_ema': False, 'use_spike': True, 'rsi_required': False, 'edge_k': 0.04289569724839101, 'edge_cap': 0.46964281354529297, 'bull_strategy': 'breakout', 'bull_bb_std_mult': 3.150699302257293, 'bull_rsi_os': 41, 'bull_rsi_ob': 62, 'bull_adx_thresh': 18.23334599177964, 'bull_atr_min_pct': 0.0149531352441032, 'bull_atr_max_pct': 0.12164266717591242, 'bull_tp_mult': 1.970543745040214, 'bull_tsl_mult': 0.8947482379990043, 'bull_time_stop': 165, 'bull_use_sma': False, 'bull_use_ema': True, 'bull_use_atr': True, 'bull_use_adx': False, 'bull_use_spike': False, 'bull_rsi_required': True, 'bear_strategy': 'mean_reversion', 'bear_bb_std_mult': 1.2531761192062651, 'bear_rsi_os': 19, 'bear_rsi_ob': 77, 'bear_adx_thresh': 14.399334021778833, 'bear_atr_min_pct': 0.01570130896457672, 'bear_atr_max_pct': 0.04050800220858158, 'bear_tp_mult': 2.7465512220001753, 'bear_tsl_mult': 0.9890669948131646, 'bear_time_stop': 200, 'bear_use_sma': True, 'bear_use_ema': False, 'bear_use_atr': False, 'bear_use_adx': False, 'bear_use_spike': False, 'bear_rsi_required': True, 'sideways_strategy': 'breakout', 'sideways_bb_std_mult': 1.6480896267956138, 'sideways_rsi_os': 23, 'sideways_rsi_ob': 83, 'sideways_adx_thresh': 15.369277250870082, 'sideways_atr_min_pct': 0.001632489414493444, 'sideways_atr_max_pct': 0.09196188371956454, 'sideways_tp_mult': 2.338379426602484, 'sideways_tsl_mult': 0.9316698736686511, 'sideways_time_stop': 133, 'sideways_use_sma': False, 'sideways_use_ema': False, 'sideways_use_atr': False, 'sideways_use_adx': False, 'sideways_use_spike': False, 'sideways_rsi_required': False}.
[I 2025-08-30 19:14:37,400] Trial 398 finished with values: [-1000000000.0, 1000000000.0] and parameters: {'p_sma': 8, 'p_std': 25, 'p_atr': 14, 'p_adx': 20, 'rsi_period': 25, 'ema1': 5, 'ema2': 19, 'slip_atr_k': 0.057898619651895196, 'slip_spread_k': 0.9540779124654412, 'spread_hl_frac': 0.02469247740036581, 'bb_std_mult': 2.188270866645403, 'rsi_os': 32, 'rsi_ob': 85, 'vol_spike': 0.2496493209021602, 'adx_thresh': 33.51990774302926, 'atr_min_pct': 0.027491016663590162, 'atr_max_pct': 0.09455442890834839, 'tp_mult': 2.4427073191244077, 'tsl_mult': 0.7745728489050849, 'strategy': 'mean_reversion', 'time_stop': 189, 'use_sma': False, 'use_atr': True, 'use_adx': True, 'use_ema': False, 'use_spike': True, 'rsi_required': False, 'edge_k': 0.045513884412408084, 'edge_cap': 0.6934802617112952, 'bull_strategy': 'mean_reversion', 'bull_bb_std_mult': 3.1650231747220685, 'bull_rsi_os': 31, 'bull_rsi_ob': 57, 'bull_adx_thresh': 25.061267012936348, 'bull_atr_min_pct': 0.015358797406008774, 'bull_atr_max_pct': 0.12129440206279804, 'bull_tp_mult': 2.7515463702773526, 'bull_tsl_mult': 0.5642551949942137, 'bull_time_stop': 171, 'bull_use_sma': False, 'bull_use_ema': True, 'bull_use_atr': True, 'bull_use_adx': False, 'bull_use_spike': False, 'bull_rsi_required': True, 'bear_strategy': 'breakout', 'bear_bb_std_mult': 2.04697830750187, 'bear_rsi_os': 42, 'bear_rsi_ob': 62, 'bear_adx_thresh': 16.256819383424215, 'bear_atr_min_pct': 0.0170682994711785, 'bear_atr_max_pct': 0.11899699990442396, 'bear_tp_mult': 2.6449329212208044, 'bear_tsl_mult': 0.4010532738366751, 'bear_time_stop': 114, 'bear_use_sma': True, 'bear_use_ema': False, 'bear_use_atr': True, 'bear_use_adx': False, 'bear_use_spike': False, 'bear_rsi_required': True, 'sideways_strategy': 'breakout', 'sideways_bb_std_mult': 2.051651397410161, 'sideways_rsi_os': 35, 'sideways_rsi_ob': 57, 'sideways_adx_thresh': 20.943974528322702, 'sideways_atr_min_pct': 0.007552368953497511, 'sideways_atr_max_pct': 0.1414365722530276, 'sideways_tp_mult': 1.0777485584444069, 'sideways_tsl_mult': 0.7387775360510989, 'sideways_time_stop': 131, 'sideways_use_sma': False, 'sideways_use_ema': True, 'sideways_use_atr': True, 'sideways_use_adx': False, 'sideways_use_spike': False, 'sideways_rsi_required': False}.
[I 2025-08-30 19:14:39,456] Trial 399 finished with values: [-0.02639011243554601, 0.026379523948720156] and parameters: {'p_sma': 8, 'p_std': 25, 'p_atr': 13, 'p_adx': 20, 'rsi_period': 25, 'ema1': 27, 'ema2': 33, 'slip_atr_k': 0.06324724445578585, 'slip_spread_k': 0.11204024284972888, 'spread_hl_frac': 0.024614577607155925, 'bb_std_mult': 2.1639451257014612, 'rsi_os': 13, 'rsi_ob': 83, 'vol_spike': 0.025659114054740736, 'adx_thresh': 32.47129822020329, 'atr_min_pct': 0.022803422284523617, 'atr_max_pct': 0.09420922938009511, 'tp_mult': 1.5817572425948827, 'tsl_mult': 0.1501138249382677, 'strategy': 'mean_reversion', 'time_stop': 189, 'use_sma': False, 'use_atr': True, 'use_adx': True, 'use_ema': False, 'use_spike': True, 'rsi_required': False, 'edge_k': 1.9921983991750423, 'edge_cap': 0.12947745758435436, 'bull_strategy': 'mean_reversion', 'bull_bb_std_mult': 2.9839261032176068, 'bull_rsi_os': 36, 'bull_rsi_ob': 65, 'bull_adx_thresh': 25.0458859040964, 'bull_atr_min_pct': 0.0012500797357408297, 'bull_atr_max_pct': 0.07913818567770389, 'bull_tp_mult': 2.7618405179038055, 'bull_tsl_mult': 0.8952343221624481, 'bull_time_stop': 167, 'bull_use_sma': False, 'bull_use_ema': True, 'bull_use_atr': True, 'bull_use_adx': False, 'bull_use_spike': False, 'bull_rsi_required': True, 'bear_strategy': 'breakout', 'bear_bb_std_mult': 2.0750442741583455, 'bear_rsi_os': 52, 'bear_rsi_ob': 57, 'bear_adx_thresh': 16.331526208052047, 'bear_atr_min_pct': 0.0169193797748182, 'bear_atr_max_pct': 0.04351351336710474, 'bear_tp_mult': 2.741537084156066, 'bear_tsl_mult': 0.8739297398341891, 'bear_time_stop': 199, 'bear_use_sma': True, 'bear_use_ema': False, 'bear_use_atr': True, 'bear_use_adx': False, 'bear_use_spike': False, 'bear_rsi_required': True, 'sideways_strategy': 'breakout', 'sideways_bb_std_mult': 3.15733609169527, 'sideways_rsi_os': 35, 'sideways_rsi_ob': 65, 'sideways_adx_thresh': 5.738009374740898, 'sideways_atr_min_pct': 0.00141385513390553, 'sideways_atr_max_pct': 0.14207524120498666, 'sideways_tp_mult': 2.5369649146480775, 'sideways_tsl_mult': 0.5515108514554877, 'sideways_time_stop': 135, 'sideways_use_sma': False, 'sideways_use_ema': False, 'sideways_use_atr': False, 'sideways_use_adx': False, 'sideways_use_spike': False, 'sideways_rsi_required': False}.
[I 2025-08-30 19:14:45,062] Trial 402 finished with values: [-0.029184392661921632, 0.029223464604739628] and parameters: {'p_sma': 6, 'p_std': 30, 'p_atr': 8, 'p_adx': 20, 'rsi_period': 25, 'ema1': 20, 'ema2': 33, 'slip_atr_k': 0.022243699398304118, 'slip_spread_k': 0.08276503488759834, 'spread_hl_frac': 0.023150702494178433, 'bb_std_mult': 1.9484379081386212, 'rsi_os': 48, 'rsi_ob': 62, 'vol_spike': 0.09947046432508638, 'adx_thresh': 23.159914289291176, 'atr_min_pct': 0.02350421091616652, 'atr_max_pct': 0.08641150915414775, 'tp_mult': 2.2064406586484036, 'tsl_mult': 0.06195978064972568, 'strategy': 'mean_reversion', 'time_stop': 133, 'use_sma': False, 'use_atr': True, 'use_adx': True, 'use_ema': False, 'use_spike': True, 'rsi_required': False, 'edge_k': 1.9900857950618676, 'edge_cap': 0.4651983448894341, 'bull_strategy': 'mean_reversion', 'bull_bb_std_mult': 0.800536436399025, 'bull_rsi_os': 41, 'bull_rsi_ob': 50, 'bull_adx_thresh': 26.397573722551485, 'bull_atr_min_pct': 0.0025094983344054987, 'bull_atr_max_pct': 0.010022931951240321, 'bull_tp_mult': 2.7069992995053656, 'bull_tsl_mult': 0.5283670458488302, 'bull_time_stop': 164, 'bull_use_sma': False, 'bull_use_ema': True, 'bull_use_atr': True, 'bull_use_adx': False, 'bull_use_spike': False, 'bull_rsi_required': True, 'bear_strategy': 'breakout', 'bear_bb_std_mult': 2.3972036577699236, 'bear_rsi_os': 52, 'bear_rsi_ob': 90, 'bear_adx_thresh': 18.81388422078399, 'bear_atr_min_pct': 0.020045897689643544, 'bear_atr_max_pct': 0.026699094572972502, 'bear_tp_mult': 2.7464277922467524, 'bear_tsl_mult': 0.9947556809346769, 'bear_time_stop': 198, 'bear_use_sma': False, 'bear_use_ema': True, 'bear_use_atr': False, 'bear_use_adx': False, 'bear_use_spike': True, 'bear_rsi_required': False, 'sideways_strategy': 'breakout', 'sideways_bb_std_mult': 3.148633364542683, 'sideways_rsi_os': 39, 'sideways_rsi_ob': 70, 'sideways_adx_thresh': 5.504108860341713, 'sideways_atr_min_pct': 0.0014964500280207622, 'sideways_atr_max_pct': 0.13505250487252263, 'sideways_tp_mult': 2.34971902713533, 'sideways_tsl_mult': 0.9361749442086085, 'sideways_time_stop': 147, 'sideways_use_sma': False, 'sideways_use_ema': True, 'sideways_use_atr': True, 'sideways_use_adx': False, 'sideways_use_spike': False, 'sideways_rsi_required': True}.
[I 2025-08-30 19:14:45,186] Trial 403 finished with values: [-0.02123486883710668, 0.021158969468783834] and parameters: {'p_sma': 37, 'p_std': 29, 'p_atr': 17, 'p_adx': 13, 'rsi_period': 25, 'ema1': 27, 'ema2': 35, 'slip_atr_k': 0.017532536421690406, 'slip_spread_k': 0.1754926327809821, 'spread_hl_frac': 0.013142740708458675, 'bb_std_mult': 2.4725483314229053, 'rsi_os': 31, 'rsi_ob': 83, 'vol_spike': 0.027587807117632646, 'adx_thresh': 32.52456617932976, 'atr_min_pct': 0.027589472959529446, 'atr_max_pct': 0.09517580122904272, 'tp_mult': 2.1927507963994057, 'tsl_mult': 0.9393831338817455, 'strategy': 'breakout', 'time_stop': 16, 'use_sma': False, 'use_atr': True, 'use_adx': False, 'use_ema': False, 'use_spike': True, 'rsi_required': False, 'edge_k': 1.051502489774305, 'edge_cap': 0.4292045678307301, 'bull_strategy': 'mean_reversion', 'bull_bb_std_mult': 1.572655926827418, 'bull_rsi_os': 55, 'bull_rsi_ob': 49, 'bull_adx_thresh': 26.487347095074927, 'bull_atr_min_pct': 3.4495541095403565e-06, 'bull_atr_max_pct': 0.11695805812958109, 'bull_tp_mult': 2.832248220766737, 'bull_tsl_mult': 0.2961510363276363, 'bull_time_stop': 175, 'bull_use_sma': False, 'bull_use_ema': False, 'bull_use_atr': True, 'bull_use_adx': False, 'bull_use_spike': False, 'bull_rsi_required': True, 'bear_strategy': 'breakout', 'bear_bb_std_mult': 2.407361952171401, 'bear_rsi_os': 52, 'bear_rsi_ob': 76, 'bear_adx_thresh': 27.168114836359386, 'bear_atr_min_pct': 0.014003941601205529, 'bear_atr_max_pct': 0.11841407156111135, 'bear_tp_mult': 2.582066160231794, 'bear_tsl_mult': 0.31082178060571064, 'bear_time_stop': 99, 'bear_use_sma': False, 'bear_use_ema': True, 'bear_use_atr': False, 'bear_use_adx': True, 'bear_use_spike': True, 'bear_rsi_required': False, 'sideways_strategy': 'breakout', 'sideways_bb_std_mult': 3.149833842790377, 'sideways_rsi_os': 16, 'sideways_rsi_ob': 70, 'sideways_adx_thresh': 22.753515027875906, 'sideways_atr_min_pct': 0.0074775985850306, 'sideways_atr_max_pct': 0.1349265113797359, 'sideways_tp_mult': 2.041138676659549, 'sideways_tsl_mult': 0.9451845480268812, 'sideways_time_stop': 152, 'sideways_use_sma': False, 'sideways_use_ema': True, 'sideways_use_atr': True, 'sideways_use_adx': False, 'sideways_use_spike': True, 'sideways_rsi_required': True}.
[I 2025-08-30 19:15:16,256] Trial 405 finished with values: [-0.03938292591769876, 0.0393063345283345] and parameters: {'p_sma': 54, 'p_std': 27, 'p_atr': 8, 'p_adx': 18, 'rsi_period': 38, 'ema1': 20, 'ema2': 40, 'slip_atr_k': 0.06861476000113549, 'slip_spread_k': 0.08719361311018275, 'spread_hl_frac': 0.025582045974010034, 'bb_std_mult': 1.96553101259888, 'rsi_os': 26, 'rsi_ob': 70, 'vol_spike': 0.07026427990236568, 'adx_thresh': 6.472576649414577, 'atr_min_pct': 0.011442669255588922, 'atr_max_pct': 0.04477968306804835, 'tp_mult': 2.1990687697027482, 'tsl_mult': 0.8675951071329695, 'strategy': 'mean_reversion', 'time_stop': 189, 'use_sma': False, 'use_atr': False, 'use_adx': False, 'use_ema': True, 'use_spike': False, 'rsi_required': True, 'edge_k': 0.16181252229602233, 'edge_cap': 0.4344699661722936, 'bull_strategy': 'mean_reversion', 'bull_bb_std_mult': 2.4323080588610235, 'bull_rsi_os': 55, 'bull_rsi_ob': 49, 'bull_adx_thresh': 26.27837442780105, 'bull_atr_min_pct': 0.0024522043866810374, 'bull_atr_max_pct': 0.116170327618736, 'bull_tp_mult': 1.874724122494712, 'bull_tsl_mult': 0.9873426102318439, 'bull_time_stop': 185, 'bull_use_sma': True, 'bull_use_ema': True, 'bull_use_atr': False, 'bull_use_adx': True, 'bull_use_spike': True, 'bull_rsi_required': False, 'bear_strategy': 'breakout', 'bear_bb_std_mult': 2.7944886128726245, 'bear_rsi_os': 49, 'bear_rsi_ob': 76, 'bear_adx_thresh': 29.260193516343037, 'bear_atr_min_pct': 0.023904668584593045, 'bear_atr_max_pct': 0.02762922125811789, 'bear_tp_mult': 1.7642425495952232, 'bear_tsl_mult': 0.8752659786908594, 'bear_time_stop': 135, 'bear_use_sma': False, 'bear_use_ema': True, 'bear_use_atr': False, 'bear_use_adx': False, 'bear_use_spike': True, 'bear_rsi_required': False, 'sideways_strategy': 'breakout', 'sideways_bb_std_mult': 3.1552773210597995, 'sideways_rsi_os': 39, 'sideways_rsi_ob': 88, 'sideways_adx_thresh': 22.791730916019915, 'sideways_atr_min_pct': 0.002109364177344589, 'sideways_atr_max_pct': 0.14874259141023394, 'sideways_tp_mult': 1.0409946802463297, 'sideways_tsl_mult': 0.9997204579078673, 'sideways_time_stop': 145, 'sideways_use_sma': True, 'sideways_use_ema': True, 'sideways_use_atr': True, 'sideways_use_adx': False, 'sideways_use_spike': False, 'sideways_rsi_required': True}.
