[I 2025-08-30 19:39:06,242] Trial 612 finished with values: [-0.018063818446074187, 0.018076917154123386] and parameters: {'p_sma': 47, 'p_std': 29, 'p_atr': 8, 'p_adx': 18, 'rsi_period': 15, 'ema1': 25, 'ema2': 30, 'slip_atr_k': 0.06435227610165088, 'slip_spread_k': 0.10128036445030797, 'spread_hl_frac': 0.010615410069320437, 'bb_std_mult': 1.6754929780958767, 'rsi_os': 38, 'rsi_ob': 83, 'vol_spike': 0.09817494258300458, 'adx_thresh': 10.506895007175409, 'atr_min_pct': 0.024269115449213754, 'atr_max_pct': 0.08157941149522481, 'tp_mult': 2.6364634583663267, 'tsl_mult': 0.12988753449743012, 'strategy': 'mean_reversion', 'time_stop': 55, 'use_sma': False, 'use_atr': False, 'use_adx': True, 'use_ema': False, 'use_spike': True, 'rsi_required': False, 'edge_k': 0.28839475947503357, 'edge_cap': 0.503273206420581, 'bull_strategy': 'mean_reversion', 'bull_bb_std_mult': 1.4884976875254745, 'bull_rsi_os': 11, 'bull_rsi_ob': 46, 'bull_adx_thresh': 10.273540906792727, 'bull_atr_min_pct': 0.0023649204941942658, 'bull_atr_max_pct': 0.03683416638891529, 'bull_tp_mult': 2.8295411072668943, 'bull_tsl_mult': 0.6568300094739622, 'bull_time_stop': 184, 'bull_use_sma': False, 'bull_use_ema': False, 'bull_use_atr': False, 'bull_use_adx': False, 'bull_use_spike': True, 'bull_rsi_required': True, 'bear_strategy': 'mean_reversion', 'bear_bb_std_mult': 2.91336175052701, 'bear_rsi_os': 48, 'bear_rsi_ob': 73, 'bear_adx_thresh': 23.70882980493173, 'bear_atr_min_pct': 0.015372671798742046, 'bear_atr_max_pct': 0.025730314159621213, 'bear_tp_mult': 2.7003618341485223, 'bear_tsl_mult': 0.7642612887362448, 'bear_time_stop': 78, 'bear_use_sma': False, 'bear_use_ema': True, 'bear_use_atr': False, 'bear_use_adx': False, 'bear_use_spike': False, 'bear_rsi_required': False, 'sideways_strategy': 'breakout', 'sideways_bb_std_mult': 0.8519535002695442, 'sideways_rsi_os': 25, 'sideways_rsi_ob': 59, 'sideways_adx_thresh': 16.065624909336197, 'sideways_atr_min_pct': 0.010665236352583752, 'sideways_atr_max_pct': 0.13935264030681352, 'sideways_tp_mult': 1.9121042647963369, 'sideways_tsl_mult': 0.2356253412667726, 'sideways_time_stop': 285, 'sideways_use_sma': False, 'sideways_use_ema': True, 'sideways_use_atr': False, 'sideways_use_adx': False, 'sideways_use_spike': False, 'sideways_rsi_required': True}.
[I 2025-08-30 19:39:06,684] Trial 614 finished with values: [-1000000000.0, 1000000000.0] and parameters: {'p_sma': 6, 'p_std': 31, 'p_atr': 30, 'p_adx': 28, 'rsi_period': 61, 'ema1': 17, 'ema2': 33, 'slip_atr_k': 0.06508948152652637, 'slip_spread_k': 0.997594139755109, 'spread_hl_frac': 0.011006907637802488, 'bb_std_mult': 1.2898454768855068, 'rsi_os': 48, 'rsi_ob': 83, 'vol_spike': 0.25335772584672567, 'adx_thresh': 28.684161978338643, 'atr_min_pct': 0.01997218889146029, 'atr_max_pct': 0.08912252416468774, 'tp_mult': 1.9938514233997036, 'tsl_mult': 0.8742350060894026, 'strategy': 'mean_reversion', 'time_stop': 173, 'use_sma': False, 'use_atr': True, 'use_adx': False, 'use_ema': False, 'use_spike': True, 'rsi_required': False, 'edge_k': 0.08880369614396133, 'edge_cap': 0.4960484437814083, 'bull_strategy': 'mean_reversion', 'bull_bb_std_mult': 3.4842455252304814, 'bull_rsi_os': 31, 'bull_rsi_ob': 83, 'bull_adx_thresh': 10.176025216460982, 'bull_atr_min_pct': 4.682492144129739e-05, 'bull_atr_max_pct': 0.03957349692182932, 'bull_tp_mult': 2.820432142151434, 'bull_tsl_mult': 0.5254883277410106, 'bull_time_stop': 160, 'bull_use_sma': False, 'bull_use_ema': False, 'bull_use_atr': True, 'bull_use_adx': False, 'bull_use_spike': False, 'bull_rsi_required': True, 'bear_strategy': 'mean_reversion', 'bear_bb_std_mult': 2.8004192747782053, 'bear_rsi_os': 49, 'bear_rsi_ob': 78, 'bear_adx_thresh': 23.64210227283633, 'bear_atr_min_pct': 0.02791035334863009, 'bear_atr_max_pct': 0.036148872104171295, 'bear_tp_mult': 1.2496247408341512, 'bear_tsl_mult': 0.7366453793697089, 'bear_time_stop': 35, 'bear_use_sma': False, 'bear_use_ema': True, 'bear_use_atr': False, 'bear_use_adx': False, 'bear_use_spike': False, 'bear_rsi_required': True, 'sideways_strategy': 'breakout', 'sideways_bb_std_mult': 3.1840501705697752, 'sideways_rsi_os': 25, 'sideways_rsi_ob': 59, 'sideways_adx_thresh': 20.774231445193344, 'sideways_atr_min_pct': 0.010543798608715143, 'sideways_atr_max_pct': 0.14655062311676906, 'sideways_tp_mult': 1.9196642754758164, 'sideways_tsl_mult': 0.791514301043806, 'sideways_time_stop': 283, 'sideways_use_sma': True, 'sideways_use_ema': True, 'sideways_use_atr': False, 'sideways_use_adx': False, 'sideways_use_spike': False, 'sideways_rsi_required': True}.
[I 2025-08-30 19:39:06,797] Trial 613 finished with values: [-1000000000.0, 1000000000.0] and parameters: {'p_sma': 5, 'p_std': 23, 'p_atr': 11, 'p_adx': 18, 'rsi_period': 62, 'ema1': 26, 'ema2': 30, 'slip_atr_k': 0.06468102913111284, 'slip_spread_k': 0.048765378758636846, 'spread_hl_frac': 0.0446118792623888, 'bb_std_mult': 2.508454076277122, 'rsi_os': 38, 'rsi_ob': 83, 'vol_spike': 0.18722988396690993, 'adx_thresh': 33.089171297966296, 'atr_min_pct': 0.028044457036191843, 'atr_max_pct': 0.03798630425831671, 'tp_mult': 2.622169622533348, 'tsl_mult': 0.8765015036240236, 'strategy': 'mean_reversion', 'time_stop': 284, 'use_sma': False, 'use_atr': False, 'use_adx': False, 'use_ema': False, 'use_spike': True, 'rsi_required': False, 'edge_k': 0.46324972191507785, 'edge_cap': 0.15497376355127762, 'bull_strategy': 'mean_reversion', 'bull_bb_std_mult': 3.3756597284230194, 'bull_rsi_os': 31, 'bull_rsi_ob': 79, 'bull_adx_thresh': 18.427784760839845, 'bull_atr_min_pct': 1.1943537727931997e-05, 'bull_atr_max_pct': 0.11995485773347363, 'bull_tp_mult': 1.960773410026439, 'bull_tsl_mult': 0.5244622971508097, 'bull_time_stop': 184, 'bull_use_sma': False, 'bull_use_ema': False, 'bull_use_atr': True, 'bull_use_adx': False, 'bull_use_spike': True, 'bull_rsi_required': True, 'bear_strategy': 'breakout', 'bear_bb_std_mult': 1.5188846986030975, 'bear_rsi_os': 51, 'bear_rsi_ob': 53, 'bear_adx_thresh': 22.553844236272816, 'bear_atr_min_pct': 0.015303395790973598, 'bear_atr_max_pct': 0.0256750686203063, 'bear_tp_mult': 1.5032203916415912, 'bear_tsl_mult': 0.758786637090172, 'bear_time_stop': 77, 'bear_use_sma': True, 'bear_use_ema': True, 'bear_use_atr': False, 'bear_use_adx': False, 'bear_use_spike': False, 'bear_rsi_required': True, 'sideways_strategy': 'breakout', 'sideways_bb_std_mult': 3.2953028157390367, 'sideways_rsi_os': 35, 'sideways_rsi_ob': 47, 'sideways_adx_thresh': 20.674518095343913, 'sideways_atr_min_pct': 0.0032440729022029033, 'sideways_atr_max_pct': 0.14994429539584925, 'sideways_tp_mult': 1.7692903324446412, 'sideways_tsl_mult': 0.7553125736155035, 'sideways_time_stop': 234, 'sideways_use_sma': False, 'sideways_use_ema': True, 'sideways_use_atr': False, 'sideways_use_adx': False, 'sideways_use_spike': False, 'sideways_rsi_required': True}.
[I 2025-08-30 19:39:07,847] Trial 618 finished with values: [-1000000000.0, 1000000000.0] and parameters: {'p_sma': 7, 'p_std': 38, 'p_atr': 9, 'p_adx': 20, 'rsi_period': 66, 'ema1': 24, 'ema2': 26, 'slip_atr_k': 0.15371333406081225, 'slip_spread_k': 0.7652510616430109, 'spread_hl_frac': 0.024752794807894263, 'bb_std_mult': 0.7026860354305509, 'rsi_os': 55, 'rsi_ob': 78, 'vol_spike': 0.22725619804755837, 'adx_thresh': 34.34148999786688, 'atr_min_pct': 0.0073937035526544835, 'atr_max_pct': 0.10779834164570753, 'tp_mult': 1.199165358009425, 'tsl_mult': 0.8505092080555425, 'strategy': 'mean_reversion', 'time_stop': 57, 'use_sma': True, 'use_atr': True, 'use_adx': True, 'use_ema': False, 'use_spike': True, 'rsi_required': False, 'edge_k': 0.17694598736634815, 'edge_cap': 0.9990491914367925, 'bull_strategy': 'mean_reversion', 'bull_bb_std_mult': 3.5939378547380185, 'bull_rsi_os': 19, 'bull_rsi_ob': 49, 'bull_adx_thresh': 19.88602188668631, 'bull_atr_min_pct': 0.026548971828712575, 'bull_atr_max_pct': 0.11592654439284002, 'bull_tp_mult': 1.38876168172803, 'bull_tsl_mult': 0.47371011657220796, 'bull_time_stop': 169, 'bull_use_sma': False, 'bull_use_ema': True, 'bull_use_atr': True, 'bull_use_adx': False, 'bull_use_spike': False, 'bull_rsi_required': True, 'bear_strategy': 'mean_reversion', 'bear_bb_std_mult': 2.5975589235038528, 'bear_rsi_os': 52, 'bear_rsi_ob': 73, 'bear_adx_thresh': 8.218006996822886, 'bear_atr_min_pct': 0.016750784604410457, 'bear_atr_max_pct': 0.06244925740731366, 'bear_tp_mult': 2.7101793779946117, 'bear_tsl_mult': 0.7593348158259488, 'bear_time_stop': 208, 'bear_use_sma': True, 'bear_use_ema': True, 'bear_use_atr': True, 'bear_use_adx': False, 'bear_use_spike': False, 'bear_rsi_required': True, 'sideways_strategy': 'breakout', 'sideways_bb_std_mult': 0.9906679889162044, 'sideways_rsi_os': 28, 'sideways_rsi_ob': 61, 'sideways_adx_thresh': 31.07713077312453, 'sideways_atr_min_pct': 0.0010958468232064678, 'sideways_atr_max_pct': 0.11467911369300099, 'sideways_tp_mult': 1.0124089646646826, 'sideways_tsl_mult': 0.9780572812832568, 'sideways_time_stop': 173, 'sideways_use_sma': True, 'sideways_use_ema': False, 'sideways_use_atr': True, 'sideways_use_adx': False, 'sideways_use_spike': False, 'sideways_rsi_required': True}.
[I 2025-08-30 19:39:39,092] Trial 617 finished with values: [-0.02031293896017705, 0.020325574465753574] and parameters: {'p_sma': 29, 'p_std': 29, 'p_atr': 9, 'p_adx': 20, 'rsi_period': 57, 'ema1': 28, 'ema2': 42, 'slip_atr_k': 0.04278831901065913, 'slip_spread_k': 0.7655700463171078, 'spread_hl_frac': 0.027251158686373705, 'bb_std_mult': 1.775808259864576, 'rsi_os': 38, 'rsi_ob': 62, 'vol_spike': 0.2521727150868828, 'adx_thresh': 32.434294880325126, 'atr_min_pct': 0.021872643512015077, 'atr_max_pct': 0.09840238975054502, 'tp_mult': 2.1729616257963698, 'tsl_mult': 0.4260691646962042, 'strategy': 'mean_reversion', 'time_stop': 287, 'use_sma': False, 'use_atr': True, 'use_adx': False, 'use_ema': False, 'use_spike': True, 'rsi_required': False, 'edge_k': 0.4438503685508185, 'edge_cap': 0.5440719401548783, 'bull_strategy': 'mean_reversion', 'bull_bb_std_mult': 2.5810159995068, 'bull_rsi_os': 26, 'bull_rsi_ob': 49, 'bull_adx_thresh': 12.6919829133674, 'bull_atr_min_pct': 0.002061666851936511, 'bull_atr_max_pct': 0.11978981534144324, 'bull_tp_mult': 1.3888124903108319, 'bull_tsl_mult': 0.6000457000882902, 'bull_time_stop': 26, 'bull_use_sma': False, 'bull_use_ema': True, 'bull_use_atr': True, 'bull_use_adx': False, 'bull_use_spike': False, 'bull_rsi_required': True, 'bear_strategy': 'breakout', 'bear_bb_std_mult': 2.083407318894913, 'bear_rsi_os': 52, 'bear_rsi_ob': 73, 'bear_adx_thresh': 19.963483294580747, 'bear_atr_min_pct': 0.015366804688470443, 'bear_atr_max_pct': 0.022846607055834973, 'bear_tp_mult': 1.508766062506471, 'bear_tsl_mult': 0.7616241231575582, 'bear_time_stop': 206, 'bear_use_sma': True, 'bear_use_ema': True, 'bear_use_atr': False, 'bear_use_adx': False, 'bear_use_spike': False, 'bear_rsi_required': True, 'sideways_strategy': 'breakout', 'sideways_bb_std_mult': 3.268138247860702, 'sideways_rsi_os': 35, 'sideways_rsi_ob': 70, 'sideways_adx_thresh': 21.117305791412527, 'sideways_atr_min_pct': 0.0012010418309874905, 'sideways_atr_max_pct': 0.14532887280155612, 'sideways_tp_mult': 1.0123219036657602, 'sideways_tsl_mult': 0.9825990965867766, 'sideways_time_stop': 173, 'sideways_use_sma': False, 'sideways_use_ema': True, 'sideways_use_atr': True, 'sideways_use_adx': False, 'sideways_use_spike': False, 'sideways_rsi_required': True}.
[I 2025-08-30 19:39:39,452] Trial 615 finished with values: [-1000000000.0, 1000000000.0] and parameters: {'p_sma': 6, 'p_std': 38, 'p_atr': 11, 'p_adx': 25, 'rsi_period': 43, 'ema1': 8, 'ema2': 30, 'slip_atr_k': 0.06776087265034304, 'slip_spread_k': 0.766475379258682, 'spread_hl_frac': 0.01964760725744672, 'bb_std_mult': 0.95673616107556, 'rsi_os': 44, 'rsi_ob': 83, 'vol_spike': 0.25177784328398817, 'adx_thresh': 28.41392950207317, 'atr_min_pct': 0.022095059838559472, 'atr_max_pct': 0.08267917813453221, 'tp_mult': 2.1484959149647826, 'tsl_mult': 0.8723689658222319, 'strategy': 'mean_reversion', 'time_stop': 182, 'use_sma': False, 'use_atr': True, 'use_adx': False, 'use_ema': False, 'use_spike': True, 'rsi_required': False, 'edge_k': 0.38206375017350835, 'edge_cap': 0.1418518297927901, 'bull_strategy': 'mean_reversion', 'bull_bb_std_mult': 1.8746921733793067, 'bull_rsi_os': 19, 'bull_rsi_ob': 61, 'bull_adx_thresh': 19.8281901526392, 'bull_atr_min_pct': 0.0026315318773608783, 'bull_atr_max_pct': 0.1194787296714909, 'bull_tp_mult': 2.7362059788818205, 'bull_tsl_mult': 0.5203975603063355, 'bull_time_stop': 168, 'bull_use_sma': False, 'bull_use_ema': False, 'bull_use_atr': True, 'bull_use_adx': False, 'bull_use_spike': False, 'bull_rsi_required': True, 'bear_strategy': 'mean_reversion', 'bear_bb_std_mult': 2.9224699744848195, 'bear_rsi_os': 51, 'bear_rsi_ob': 73, 'bear_adx_thresh': 19.918859644640484, 'bear_atr_min_pct': 0.0224104094819701, 'bear_atr_max_pct': 0.03615914544858324, 'bear_tp_mult': 2.736226695784468, 'bear_tsl_mult': 0.7597231174847725, 'bear_time_stop': 77, 'bear_use_sma': True, 'bear_use_ema': True, 'bear_use_atr': False, 'bear_use_adx': False, 'bear_use_spike': False, 'bear_rsi_required': True, 'sideways_strategy': 'breakout', 'sideways_bb_std_mult': 3.1781018541336676, 'sideways_rsi_os': 35, 'sideways_rsi_ob': 61, 'sideways_adx_thresh': 31.776197816084238, 'sideways_atr_min_pct': 0.003236582160953244, 'sideways_atr_max_pct': 0.14532135864558676, 'sideways_tp_mult': 1.0168714050349013, 'sideways_tsl_mult': 0.7536795291674332, 'sideways_time_stop': 172, 'sideways_use_sma': True, 'sideways_use_ema': True, 'sideways_use_atr': False, 'sideways_use_adx': False, 'sideways_use_spike': False, 'sideways_rsi_required': True}.
[I 2025-08-30 19:39:39,776] Trial 616 finished with values: [-0.02318158920735136, 0.023149211881377463] and parameters: {'p_sma': 45, 'p_std': 18, 'p_atr': 9, 'p_adx': 20, 'rsi_period': 15, 'ema1': 24, 'ema2': 30, 'slip_atr_k': 0.04302023635319781, 'slip_spread_k': 0.7682737571314875, 'spread_hl_frac': 0.0251120889371893, 'bb_std_mult': 0.9167072930992948, 'rsi_os': 44, 'rsi_ob': 83, 'vol_spike': 0.22620247327086204, 'adx_thresh': 9.325768540847339, 'atr_min_pct': 0.028060329217102747, 'atr_max_pct': 0.04276895909749837, 'tp_mult': 1.6310805707610654, 'tsl_mult': 0.5877244179386641, 'strategy': 'mean_reversion', 'time_stop': 288, 'use_sma': False, 'use_atr': True, 'use_adx': False, 'use_ema': False, 'use_spike': True, 'rsi_required': False, 'edge_k': 0.43563407384439523, 'edge_cap': 0.5401058440015661, 'bull_strategy': 'mean_reversion', 'bull_bb_std_mult': 3.4701281758999074, 'bull_rsi_os': 31, 'bull_rsi_ob': 49, 'bull_adx_thresh': 10.322622015706637, 'bull_atr_min_pct': 0.0020703744063259658, 'bull_atr_max_pct': 0.11974360910321934, 'bull_tp_mult': 2.822533125703309, 'bull_tsl_mult': 0.9214647930157778, 'bull_time_stop': 184, 'bull_use_sma': False, 'bull_use_ema': False, 'bull_use_atr': True, 'bull_use_adx': False, 'bull_use_spike': False, 'bull_rsi_required': True, 'bear_strategy': 'mean_reversion', 'bear_bb_std_mult': 2.805878223682121, 'bear_rsi_os': 10, 'bear_rsi_ob': 53, 'bear_adx_thresh': 22.863167164881023, 'bear_atr_min_pct': 0.029096618919740833, 'bear_atr_max_pct': 0.1296942820587076, 'bear_tp_mult': 2.7376303103621353, 'bear_tsl_mult': 0.7583782641677342, 'bear_time_stop': 208, 'bear_use_sma': True, 'bear_use_ema': True, 'bear_use_atr': False, 'bear_use_adx': False, 'bear_use_spike': False, 'bear_rsi_required': True, 'sideways_strategy': 'breakout', 'sideways_bb_std_mult': 3.177169036013553, 'sideways_rsi_os': 25, 'sideways_rsi_ob': 47, 'sideways_adx_thresh': 30.93971805365043, 'sideways_atr_min_pct': 0.010771286806842341, 'sideways_atr_max_pct': 0.14559041790758034, 'sideways_tp_mult': 1.913407685391363, 'sideways_tsl_mult': 0.978728260645066, 'sideways_time_stop': 286, 'sideways_use_sma': True, 'sideways_use_ema': True, 'sideways_use_atr': False, 'sideways_use_adx': False, 'sideways_use_spike': False, 'sideways_rsi_required': True}.
[I 2025-08-30 19:39:41,429] Trial 619 finished with values: [-1000000000.0, 1000000000.0] and parameters: {'p_sma': 43, 'p_std': 36, 'p_atr': 9, 'p_adx': 19, 'rsi_period': 20, 'ema1': 28, 'ema2': 31, 'slip_atr_k': 0.07370514243288334, 'slip_spread_k': 0.281370535248064, 'spread_hl_frac': 0.043182763938356655, 'bb_std_mult': 2.079900076697575, 'rsi_os': 49, 'rsi_ob': 65, 'vol_spike': 0.09868056636071923, 'adx_thresh': 32.29175183499001, 'atr_min_pct': 0.008467527518307868, 'atr_max_pct': 0.0813945553364767, 'tp_mult': 2.1475436424392456, 'tsl_mult': 0.7899974520058509, 'strategy': 'mean_reversion', 'time_stop': 181, 'use_sma': False, 'use_atr': True, 'use_adx': True, 'use_ema': False, 'use_spike': True, 'rsi_required': False, 'edge_k': 0.21123055384591563, 'edge_cap': 0.5447018652076088, 'bull_strategy': 'mean_reversion', 'bull_bb_std_mult': 2.271874990180841, 'bull_rsi_os': 21, 'bull_rsi_ob': 45, 'bull_adx_thresh': 17.731776982777447, 'bull_atr_min_pct': 0.022191559400708646, 'bull_atr_max_pct': 0.10710286943994542, 'bull_tp_mult': 1.5921709352766582, 'bull_tsl_mult': 0.5069449101016515, 'bull_time_stop': 123, 'bull_use_sma': False, 'bull_use_ema': True, 'bull_use_atr': True, 'bull_use_adx': False, 'bull_use_spike': False, 'bull_rsi_required': True, 'bear_strategy': 'breakout', 'bear_bb_std_mult': 2.2080863986027732, 'bear_rsi_os': 48, 'bear_rsi_ob': 77, 'bear_adx_thresh': 27.6713218805374, 'bear_atr_min_pct': 0.01373192777153062, 'bear_atr_max_pct': 0.0320240680342775, 'bear_tp_mult': 2.631024110368841, 'bear_tsl_mult': 0.7612332943120939, 'bear_time_stop': 99, 'bear_use_sma': True, 'bear_use_ema': True, 'bear_use_atr': False, 'bear_use_adx': False, 'bear_use_spike': True, 'bear_rsi_required': True, 'sideways_strategy': 'breakout', 'sideways_bb_std_mult': 0.7912869028822638, 'sideways_rsi_os': 7, 'sideways_rsi_ob': 54, 'sideways_adx_thresh': 16.087149875102355, 'sideways_atr_min_pct': 0.0024625611750919165, 'sideways_atr_max_pct': 0.041486241777265565, 'sideways_tp_mult': 2.908119019562478, 'sideways_tsl_mult': 0.9598547636913115, 'sideways_time_stop': 150, 'sideways_use_sma': False, 'sideways_use_ema': True, 'sideways_use_atr': True, 'sideways_use_adx': False, 'sideways_use_spike': False, 'sideways_rsi_required': True}.
[I 2025-08-30 19:40:16,292] Trial 621 finished with values: [-1000000000.0, 1000000000.0] and parameters: {'p_sma': 60, 'p_std': 29, 'p_atr': 13, 'p_adx': 20, 'rsi_period': 25, 'ema1': 28, 'ema2': 41, 'slip_atr_k': 0.07402384241220518, 'slip_spread_k': 0.45416037308806195, 'spread_hl_frac': 0.02234849856912119, 'bb_std_mult': 0.8809530996399155, 'rsi_os': 49, 'rsi_ob': 65, 'vol_spike': 0.004440964733794517, 'adx_thresh': 32.24761190203695, 'atr_min_pct': 0.027411804664653906, 'atr_max_pct': 0.09714393526286089, 'tp_mult': 2.3782941974748506, 'tsl_mult': 0.7874001628461009, 'strategy': 'mean_reversion', 'time_stop': 191, 'use_sma': False, 'use_atr': True, 'use_adx': True, 'use_ema': False, 'use_spike': True, 'rsi_required': False, 'edge_k': 0.21394162012258133, 'edge_cap': 0.27421942090100493, 'bull_strategy': 'mean_reversion', 'bull_bb_std_mult': 3.117151217339348, 'bull_rsi_os': 26, 'bull_rsi_ob': 46, 'bull_adx_thresh': 9.235935398284315, 'bull_atr_min_pct': 0.005943229358644138, 'bull_atr_max_pct': 0.14529115715394714, 'bull_tp_mult': 2.7286888744381423, 'bull_tsl_mult': 0.891481628160723, 'bull_time_stop': 74, 'bull_use_sma': False, 'bull_use_ema': True, 'bull_use_atr': True, 'bull_use_adx': False, 'bull_use_spike': False, 'bull_rsi_required': True, 'bear_strategy': 'breakout', 'bear_bb_std_mult': 2.23199534121685, 'bear_rsi_os': 10, 'bear_rsi_ob': 77, 'bear_adx_thresh': 15.215652111741383, 'bear_atr_min_pct': 0.013693454031954981, 'bear_atr_max_pct': 0.12925557499894663, 'bear_tp_mult': 2.625119228769176, 'bear_tsl_mult': 0.7735825501760414, 'bear_time_stop': 215, 'bear_use_sma': True, 'bear_use_ema': True, 'bear_use_atr': False, 'bear_use_adx': False, 'bear_use_spike': True, 'bear_rsi_required': True, 'sideways_strategy': 'mean_reversion', 'sideways_bb_std_mult': 1.1318057521876033, 'sideways_rsi_os': 23, 'sideways_rsi_ob': 57, 'sideways_adx_thresh': 21.233992352950693, 'sideways_atr_min_pct': 0.002490241321148688, 'sideways_atr_max_pct': 0.08797989208469548, 'sideways_tp_mult': 1.538970602931994, 'sideways_tsl_mult': 0.9581784298095696, 'sideways_time_stop': 216, 'sideways_use_sma': False, 'sideways_use_ema': True, 'sideways_use_atr': True, 'sideways_use_adx': False, 'sideways_use_spike': False, 'sideways_rsi_required': True}.
