[I 2025-08-30 19:17:35,182] Trial 425 finished with values: [-1000000000.0, 1000000000.0] and parameters: {'p_sma': 8, 'p_std': 33, 'p_atr': 30, 'p_adx': 25, 'rsi_period': 22, 'ema1': 10, 'ema2': 31, 'slip_atr_k': 0.22775801105024987, 'slip_spread_k': 0.11877870156900164, 'spread_hl_frac': 0.026605183641507393, 'bb_std_mult': 1.0807988695142132, 'rsi_os': 38, 'rsi_ob': 94, 'vol_spike': 0.2665452887154734, 'adx_thresh': 8.115287643485733, 'atr_min_pct': 0.02633437929798066, 'atr_max_pct': 0.08835339682339705, 'tp_mult': 1.1897335016545647, 'tsl_mult': 0.10095336494767804, 'strategy': 'mean_reversion', 'time_stop': 38, 'use_sma': False, 'use_atr': False, 'use_adx': False, 'use_ema': False, 'use_spike': False, 'rsi_required': False, 'edge_k': 1.4756135762756246, 'edge_cap': 0.37889885591316286, 'bull_strategy': 'mean_reversion', 'bull_bb_std_mult': 0.8017050922436992, 'bull_rsi_os': 30, 'bull_rsi_ob': 74, 'bull_adx_thresh': 18.96101682568972, 'bull_atr_min_pct': 0.004121764194464198, 'bull_atr_max_pct': 0.010451678748253965, 'bull_tp_mult': 2.749633265464725, 'bull_tsl_mult': 0.4001044831652011, 'bull_time_stop': 153, 'bull_use_sma': False, 'bull_use_ema': False, 'bull_use_atr': True, 'bull_use_adx': False, 'bull_use_spike': False, 'bull_rsi_required': False, 'bear_strategy': 'mean_reversion', 'bear_bb_std_mult': 2.1777014809740782, 'bear_rsi_os': 50, 'bear_rsi_ob': 79, 'bear_adx_thresh': 18.28829786246218, 'bear_atr_min_pct': 0.01800731920061268, 'bear_atr_max_pct': 0.037068066871273835, 'bear_tp_mult': 2.6794766267311765, 'bear_tsl_mult': 0.8414505284020964, 'bear_time_stop': 30, 'bear_use_sma': False, 'bear_use_ema': True, 'bear_use_atr': False, 'bear_use_adx': False, 'bear_use_spike': False, 'bear_rsi_required': True, 'sideways_strategy': 'mean_reversion', 'sideways_bb_std_mult': 1.7818042498402933, 'sideways_rsi_os': 49, 'sideways_rsi_ob': 93, 'sideways_adx_thresh': 17.307391630609512, 'sideways_atr_min_pct': 0.004010140235855993, 'sideways_atr_max_pct': 0.1498949961695868, 'sideways_tp_mult': 1.0411247041097502, 'sideways_tsl_mult': 0.8857275311314853, 'sideways_time_stop': 111, 'sideways_use_sma': False, 'sideways_use_ema': False, 'sideways_use_atr': True, 'sideways_use_adx': True, 'sideways_use_spike': False, 'sideways_rsi_required': True}.
[I 2025-08-30 19:17:35,451] Trial 424 finished with values: [-1000000000.0, 1000000000.0] and parameters: {'p_sma': 11, 'p_std': 32, 'p_atr': 16, 'p_adx': 20, 'rsi_period': 22, 'ema1': 25, 'ema2': 31, 'slip_atr_k': 0.06345983489924187, 'slip_spread_k': 0.12613317093657248, 'spread_hl_frac': 0.002230773016033409, 'bb_std_mult': 2.2224503486929312, 'rsi_os': 39, 'rsi_ob': 84, 'vol_spike': 0.2556385407306361, 'adx_thresh': 34.510847665351776, 'atr_min_pct': 0.01039984268230993, 'atr_max_pct': 0.09353754301958629, 'tp_mult': 2.3068305529329325, 'tsl_mult': 0.8697288468769916, 'strategy': 'mean_reversion', 'time_stop': 37, 'use_sma': False, 'use_atr': False, 'use_adx': False, 'use_ema': False, 'use_spike': False, 'rsi_required': True, 'edge_k': 0.09047633883526823, 'edge_cap': 0.5859725690828783, 'bull_strategy': 'mean_reversion', 'bull_bb_std_mult': 0.676725371107251, 'bull_rsi_os': 31, 'bull_rsi_ob': 47, 'bull_adx_thresh': 18.942244580526463, 'bull_atr_min_pct': 0.0041771095691732, 'bull_atr_max_pct': 0.07547982337507211, 'bull_tp_mult': 1.5781225967870571, 'bull_tsl_mult': 0.35194359979164125, 'bull_time_stop': 165, 'bull_use_sma': True, 'bull_use_ema': False, 'bull_use_atr': True, 'bull_use_adx': False, 'bull_use_spike': False, 'bull_rsi_required': False, 'bear_strategy': 'mean_reversion', 'bear_bb_std_mult': 3.066476071234727, 'bear_rsi_os': 47, 'bear_rsi_ob': 81, 'bear_adx_thresh': 6.995261114536106, 'bear_atr_min_pct': 0.001184311575952621, 'bear_atr_max_pct': 0.11438031861065295, 'bear_tp_mult': 2.6677289213215998, 'bear_tsl_mult': 0.1681910953458206, 'bear_time_stop': 31, 'bear_use_sma': False, 'bear_use_ema': True, 'bear_use_atr': False, 'bear_use_adx': False, 'bear_use_spike': False, 'bear_rsi_required': True, 'sideways_strategy': 'mean_reversion', 'sideways_bb_std_mult': 3.206092712482935, 'sideways_rsi_os': 39, 'sideways_rsi_ob': 58, 'sideways_adx_thresh': 17.32699511853456, 'sideways_atr_min_pct': 0.0025736712004589134, 'sideways_atr_max_pct': 0.1494419951026943, 'sideways_tp_mult': 1.868212285722531, 'sideways_tsl_mult': 0.2794699453994458, 'sideways_time_stop': 160, 'sideways_use_sma': False, 'sideways_use_ema': False, 'sideways_use_atr': True, 'sideways_use_adx': True, 'sideways_use_spike': False, 'sideways_rsi_required': True}.
[I 2025-08-30 19:17:35,906] Trial 422 finished with values: [-0.017363148275996165, 0.017206896976363066] and parameters: {'p_sma': 45, 'p_std': 33, 'p_atr': 30, 'p_adx': 11, 'rsi_period': 80, 'ema1': 13, 'ema2': 32, 'slip_atr_k': 0.06457959006361258, 'slip_spread_k': 0.12754179239348148, 'spread_hl_frac': 0.014746956892656279, 'bb_std_mult': 2.225799121151723, 'rsi_os': 8, 'rsi_ob': 85, 'vol_spike': 0.11594877082138302, 'adx_thresh': 34.54481801074107, 'atr_min_pct': 0.02630344082956331, 'atr_max_pct': 0.09343433671409787, 'tp_mult': 2.304312803264045, 'tsl_mult': 0.8311185094603217, 'strategy': 'mean_reversion', 'time_stop': 37, 'use_sma': False, 'use_atr': False, 'use_adx': False, 'use_ema': False, 'use_spike': False, 'rsi_required': False, 'edge_k': 0.9145233561666011, 'edge_cap': 0.3778113799557762, 'bull_strategy': 'breakout', 'bull_bb_std_mult': 2.99850360648574, 'bull_rsi_os': 29, 'bull_rsi_ob': 50, 'bull_adx_thresh': 18.294564602520545, 'bull_atr_min_pct': 0.0015090800460057642, 'bull_atr_max_pct': 0.1207153995094585, 'bull_tp_mult': 2.7689468309788245, 'bull_tsl_mult': 0.8255527159640683, 'bull_time_stop': 234, 'bull_use_sma': False, 'bull_use_ema': True, 'bull_use_atr': True, 'bull_use_adx': True, 'bull_use_spike': False, 'bull_rsi_required': False, 'bear_strategy': 'breakout', 'bear_bb_std_mult': 3.0839971387202536, 'bear_rsi_os': 27, 'bear_rsi_ob': 87, 'bear_adx_thresh': 16.582079716591455, 'bear_atr_min_pct': 0.014892086528422544, 'bear_atr_max_pct': 0.13507136765417854, 'bear_tp_mult': 1.9662400961628632, 'bear_tsl_mult': 0.4929779236099992, 'bear_time_stop': 193, 'bear_use_sma': False, 'bear_use_ema': True, 'bear_use_atr': False, 'bear_use_adx': False, 'bear_use_spike': False, 'bear_rsi_required': False, 'sideways_strategy': 'mean_reversion', 'sideways_bb_std_mult': 3.137010349576273, 'sideways_rsi_os': 34, 'sideways_rsi_ob': 95, 'sideways_adx_thresh': 19.267368719531174, 'sideways_atr_min_pct': 0.0038574647363038422, 'sideways_atr_max_pct': 0.061613595913913174, 'sideways_tp_mult': 1.8729265667872996, 'sideways_tsl_mult': 0.9968678992192662, 'sideways_time_stop': 162, 'sideways_use_sma': False, 'sideways_use_ema': True, 'sideways_use_atr': True, 'sideways_use_adx': False, 'sideways_use_spike': False, 'sideways_rsi_required': False}.
[I 2025-08-30 19:17:36,636] Trial 428 finished with values: [-1000000000.0, 1000000000.0] and parameters: {'p_sma': 7, 'p_std': 30, 'p_atr': 8, 'p_adx': 29, 'rsi_period': 81, 'ema1': 12, 'ema2': 35, 'slip_atr_k': 0.06731113227974098, 'slip_spread_k': 0.9001168735904282, 'spread_hl_frac': 0.016595482603580163, 'bb_std_mult': 2.1327895565111614, 'rsi_os': 54, 'rsi_ob': 82, 'vol_spike': 0.2679588073546584, 'adx_thresh': 27.468127089430777, 'atr_min_pct': 0.023247454353815384, 'atr_max_pct': 0.07036569949170453, 'tp_mult': 2.230186513538779, 'tsl_mult': 0.7499409504985334, 'strategy': 'mean_reversion', 'time_stop': 211, 'use_sma': True, 'use_atr': True, 'use_adx': True, 'use_ema': False, 'use_spike': True, 'rsi_required': False, 'edge_k': 1.0523671628570226, 'edge_cap': 0.8848901167546711, 'bull_strategy': 'mean_reversion', 'bull_bb_std_mult': 0.9712042667642442, 'bull_rsi_os': 29, 'bull_rsi_ob': 79, 'bull_adx_thresh': 19.85633454480078, 'bull_atr_min_pct': 0.002140544833574614, 'bull_atr_max_pct': 0.12757913649106156, 'bull_tp_mult': 2.7048898005167787, 'bull_tsl_mult': 0.612521311530559, 'bull_time_stop': 183, 'bull_use_sma': False, 'bull_use_ema': True, 'bull_use_atr': True, 'bull_use_adx': False, 'bull_use_spike': False, 'bull_rsi_required': True, 'bear_strategy': 'breakout', 'bear_bb_std_mult': 2.7693527512264717, 'bear_rsi_os': 37, 'bear_rsi_ob': 81, 'bear_adx_thresh': 23.93193841733338, 'bear_atr_min_pct': 0.015910569479234457, 'bear_atr_max_pct': 0.08447417852971024, 'bear_tp_mult': 2.460286392558017, 'bear_tsl_mult': 0.056016615502455014, 'bear_time_stop': 192, 'bear_use_sma': True, 'bear_use_ema': True, 'bear_use_atr': False, 'bear_use_adx': False, 'bear_use_spike': False, 'bear_rsi_required': True, 'sideways_strategy': 'breakout', 'sideways_bb_std_mult': 3.435833264431357, 'sideways_rsi_os': 34, 'sideways_rsi_ob': 61, 'sideways_adx_thresh': 19.264721417231634, 'sideways_atr_min_pct': 0.009371853219463183, 'sideways_atr_max_pct': 0.1303240915457772, 'sideways_tp_mult': 1.5527492143584682, 'sideways_tsl_mult': 0.9993981365192982, 'sideways_time_stop': 163, 'sideways_use_sma': False, 'sideways_use_ema': True, 'sideways_use_atr': True, 'sideways_use_adx': False, 'sideways_use_spike': False, 'sideways_rsi_required': True}.
[I 2025-08-30 19:17:36,706] Trial 429 finished with values: [-1000000000.0, 1000000000.0] and parameters: {'p_sma': 45, 'p_std': 8, 'p_atr': 26, 'p_adx': 18, 'rsi_period': 58, 'ema1': 13, 'ema2': 10, 'slip_atr_k': 0.15075950860261111, 'slip_spread_k': 0.9043754057768262, 'spread_hl_frac': 0.02537692268613402, 'bb_std_mult': 2.3861309210724935, 'rsi_os': 50, 'rsi_ob': 82, 'vol_spike': 0.28951966873995466, 'adx_thresh': 27.340763150444804, 'atr_min_pct': 0.024079099664060497, 'atr_max_pct': 0.09843831378784787, 'tp_mult': 2.1277638910304075, 'tsl_mult': 0.823660927422366, 'strategy': 'mean_reversion', 'time_stop': 191, 'use_sma': True, 'use_atr': True, 'use_adx': True, 'use_ema': False, 'use_spike': True, 'rsi_required': False, 'edge_k': 1.5597650314714948, 'edge_cap': 0.5385550312849151, 'bull_strategy': 'mean_reversion', 'bull_bb_std_mult': 2.6967319787972084, 'bull_rsi_os': 33, 'bull_rsi_ob': 45, 'bull_adx_thresh': 18.196897730231576, 'bull_atr_min_pct': 0.0010253331711500935, 'bull_atr_max_pct': 0.026149129018827197, 'bull_tp_mult': 1.834038547720977, 'bull_tsl_mult': 0.4997738851477934, 'bull_time_stop': 144, 'bull_use_sma': False, 'bull_use_ema': True, 'bull_use_atr': True, 'bull_use_adx': False, 'bull_use_spike': False, 'bull_rsi_required': True, 'bear_strategy': 'breakout', 'bear_bb_std_mult': 2.8018824980562305, 'bear_rsi_os': 30, 'bear_rsi_ob': 87, 'bear_adx_thresh': 20.94539745254888, 'bear_atr_min_pct': 0.007955548496793433, 'bear_atr_max_pct': 0.03622016325870803, 'bear_tp_mult': 1.1274613891517957, 'bear_tsl_mult': 0.33473906851407587, 'bear_time_stop': 141, 'bear_use_sma': True, 'bear_use_ema': True, 'bear_use_atr': False, 'bear_use_adx': False, 'bear_use_spike': False, 'bear_rsi_required': True, 'sideways_strategy': 'breakout', 'sideways_bb_std_mult': 1.2404194017303967, 'sideways_rsi_os': 34, 'sideways_rsi_ob': 60, 'sideways_adx_thresh': 19.14521248153057, 'sideways_atr_min_pct': 0.02593281322200912, 'sideways_atr_max_pct': 0.13020747010142183, 'sideways_tp_mult': 1.1719718175035387, 'sideways_tsl_mult': 0.9985816383582609, 'sideways_time_stop': 210, 'sideways_use_sma': False, 'sideways_use_ema': True, 'sideways_use_atr': True, 'sideways_use_adx': False, 'sideways_use_spike': True, 'sideways_rsi_required': True}.
[I 2025-08-30 19:17:37,418] Trial 430 finished with values: [-1000000000.0, 1000000000.0] and parameters: {'p_sma': 25, 'p_std': 28, 'p_atr': 26, 'p_adx': 28, 'rsi_period': 58, 'ema1': 13, 'ema2': 32, 'slip_atr_k': 0.15008234108135882, 'slip_spread_k': 0.18487624770644495, 'spread_hl_frac': 0.025322869039962552, 'bb_std_mult': 2.398487072702498, 'rsi_os': 44, 'rsi_ob': 84, 'vol_spike': 0.17349363768995, 'adx_thresh': 33.72925416107846, 'atr_min_pct': 0.024381955843083634, 'atr_max_pct': 0.014489607978795713, 'tp_mult': 2.123467251966499, 'tsl_mult': 0.22523828220758596, 'strategy': 'breakout', 'time_stop': 202, 'use_sma': False, 'use_atr': True, 'use_adx': True, 'use_ema': False, 'use_spike': True, 'rsi_required': False, 'edge_k': 0.07937156429065967, 'edge_cap': 0.5412159677029753, 'bull_strategy': 'breakout', 'bull_bb_std_mult': 2.9462178157928647, 'bull_rsi_os': 19, 'bull_rsi_ob': 60, 'bull_adx_thresh': 18.13182443450524, 'bull_atr_min_pct': 0.0006904096352389907, 'bull_atr_max_pct': 0.12073907707989291, 'bull_tp_mult': 2.8437723516248345, 'bull_tsl_mult': 0.43965825423858373, 'bull_time_stop': 291, 'bull_use_sma': False, 'bull_use_ema': True, 'bull_use_atr': True, 'bull_use_adx': False, 'bull_use_spike': False, 'bull_rsi_required': True, 'bear_strategy': 'breakout', 'bear_bb_std_mult': 2.815447811598823, 'bear_rsi_os': 49, 'bear_rsi_ob': 85, 'bear_adx_thresh': 24.727054046812402, 'bear_atr_min_pct': 0.013728712724436664, 'bear_atr_max_pct': 0.09517405664040002, 'bear_tp_mult': 1.692260227716853, 'bear_tsl_mult': 0.7215133297372227, 'bear_time_stop': 181, 'bear_use_sma': True, 'bear_use_ema': True, 'bear_use_atr': True, 'bear_use_adx': True, 'bear_use_spike': False, 'bear_rsi_required': True, 'sideways_strategy': 'breakout', 'sideways_bb_std_mult': 3.24118163137591, 'sideways_rsi_os': 50, 'sideways_rsi_ob': 87, 'sideways_adx_thresh': 29.799521825956475, 'sideways_atr_min_pct': 0.028383432503019237, 'sideways_atr_max_pct': 0.1465160403464041, 'sideways_tp_mult': 1.0949992979376255, 'sideways_tsl_mult': 0.9718176299119119, 'sideways_time_stop': 29, 'sideways_use_sma': False, 'sideways_use_ema': True, 'sideways_use_atr': False, 'sideways_use_adx': False, 'sideways_use_spike': True, 'sideways_rsi_required': True}.
[I 2025-08-30 19:17:45,188] Trial 432 finished with values: [-1000000000.0, 1000000000.0] and parameters: {'p_sma': 8, 'p_std': 46, 'p_atr': 22, 'p_adx': 21, 'rsi_period': 42, 'ema1': 27, 'ema2': 34, 'slip_atr_k': 0.235726359019196, 'slip_spread_k': 0.1645086780235312, 'spread_hl_frac': 0.02388892676603107, 'bb_std_mult': 1.745224771902348, 'rsi_os': 50, 'rsi_ob': 84, 'vol_spike': 0.26120355289954306, 'adx_thresh': 16.49041413588006, 'atr_min_pct': 0.013103637458873782, 'atr_max_pct': 0.036291319404137594, 'tp_mult': 2.492029998873293, 'tsl_mult': 0.6106816764204678, 'strategy': 'mean_reversion', 'time_stop': 196, 'use_sma': False, 'use_atr': True, 'use_adx': True, 'use_ema': False, 'use_spike': True, 'rsi_required': True, 'edge_k': 0.19942036402104013, 'edge_cap': 0.6220938222599047, 'bull_strategy': 'mean_reversion', 'bull_bb_std_mult': 2.5530138757321215, 'bull_rsi_os': 26, 'bull_rsi_ob': 46, 'bull_adx_thresh': 17.347655580330436, 'bull_atr_min_pct': 0.0018961757569594688, 'bull_atr_max_pct': 0.06956531411255694, 'bull_tp_mult': 2.7870632285437704, 'bull_tsl_mult': 0.5479903612820758, 'bull_time_stop': 28, 'bull_use_sma': True, 'bull_use_ema': True, 'bull_use_atr': False, 'bull_use_adx': False, 'bull_use_spike': True, 'bull_rsi_required': True, 'bear_strategy': 'breakout', 'bear_bb_std_mult': 3.0080575346765994, 'bear_rsi_os': 53, 'bear_rsi_ob': 66, 'bear_adx_thresh': 12.288569223248285, 'bear_atr_min_pct': 0.01626050493163178, 'bear_atr_max_pct': 0.031570470964005115, 'bear_tp_mult': 2.6437004891624487, 'bear_tsl_mult': 0.7969873991909837, 'bear_time_stop': 272, 'bear_use_sma': True, 'bear_use_ema': False, 'bear_use_atr': False, 'bear_use_adx': False, 'bear_use_spike': False, 'bear_rsi_required': True, 'sideways_strategy': 'breakout', 'sideways_bb_std_mult': 3.286169113694852, 'sideways_rsi_os': 10, 'sideways_rsi_ob': 73, 'sideways_adx_thresh': 22.394748933445477, 'sideways_atr_min_pct': 0.0033797119407594583, 'sideways_atr_max_pct': 0.06224990719027523, 'sideways_tp_mult': 1.0145109527771936, 'sideways_tsl_mult': 0.48128793590814584, 'sideways_time_stop': 263, 'sideways_use_sma': False, 'sideways_use_ema': True, 'sideways_use_atr': True, 'sideways_use_adx': True, 'sideways_use_spike': False, 'sideways_rsi_required': True}.
[I 2025-08-30 19:18:01,101] Trial 426 finished with values: [-1000000000.0, 1000000000.0] and parameters: {'p_sma': 8, 'p_std': 32, 'p_atr': 20, 'p_adx': 18, 'rsi_period': 61, 'ema1': 27, 'ema2': 35, 'slip_atr_k': 0.06726188028826473, 'slip_spread_k': 0.4613842797947271, 'spread_hl_frac': 0.025041810705849172, 'bb_std_mult': 2.2396754220522364, 'rsi_os': 44, 'rsi_ob': 63, 'vol_spike': 0.26719735253800503, 'adx_thresh': 25.428000485132742, 'atr_min_pct': 0.010471072122096688, 'atr_max_pct': 0.033066231672252366, 'tp_mult': 2.3196732032893608, 'tsl_mult': 0.22126565835058615, 'strategy': 'mean_reversion', 'time_stop': 206, 'use_sma': False, 'use_atr': True, 'use_adx': False, 'use_ema': False, 'use_spike': True, 'rsi_required': False, 'edge_k': 0.6051348632067659, 'edge_cap': 0.7581611214327487, 'bull_strategy': 'mean_reversion', 'bull_bb_std_mult': 0.8209640135015475, 'bull_rsi_os': 7, 'bull_rsi_ob': 60, 'bull_adx_thresh': 34.403402217543636, 'bull_atr_min_pct': 0.0042407423314319796, 'bull_atr_max_pct': 0.12794722364006383, 'bull_tp_mult': 2.7607325682461696, 'bull_tsl_mult': 0.4455416428626797, 'bull_time_stop': 184, 'bull_use_sma': False, 'bull_use_ema': True, 'bull_use_atr': True, 'bull_use_adx': False, 'bull_use_spike': False, 'bull_rsi_required': True, 'bear_strategy': 'breakout', 'bear_bb_std_mult': 1.7110944448443166, 'bear_rsi_os': 27, 'bear_rsi_ob': 81, 'bear_adx_thresh': 7.04667947667102, 'bear_atr_min_pct': 0.0011293696155877126, 'bear_atr_max_pct': 0.0258091365647922, 'bear_tp_mult': 2.6627790396692954, 'bear_tsl_mult': 0.04917136451205406, 'bear_time_stop': 144, 'bear_use_sma': True, 'bear_use_ema': True, 'bear_use_atr': False, 'bear_use_adx': False, 'bear_use_spike': False, 'bear_rsi_required': True, 'sideways_strategy': 'mean_reversion', 'sideways_bb_std_mult': 3.4603753491487996, 'sideways_rsi_os': 40, 'sideways_rsi_ob': 77, 'sideways_adx_thresh': 19.275506682962547, 'sideways_atr_min_pct': 0.003780771412718349, 'sideways_atr_max_pct': 0.14955380036521526, 'sideways_tp_mult': 1.1740242393021627, 'sideways_tsl_mult': 0.2729645569700715, 'sideways_time_stop': 162, 'sideways_use_sma': False, 'sideways_use_ema': True, 'sideways_use_atr': True, 'sideways_use_adx': True, 'sideways_use_spike': False, 'sideways_rsi_required': True}.
[I 2025-08-30 19:18:01,735] Trial 427 finished with values: [-1000000000.0, 1000000000.0] and parameters: {'p_sma': 14, 'p_std': 32, 'p_atr': 8, 'p_adx': 21, 'rsi_period': 36, 'ema1': 12, 'ema2': 14, 'slip_atr_k': 0.06450277045632488, 'slip_spread_k': 0.17740324296800072, 'spread_hl_frac': 0.023381894071414472, 'bb_std_mult': 3.134758156516914, 'rsi_os': 40, 'rsi_ob': 84, 'vol_spike': 0.2599844477413785, 'adx_thresh': 25.441819262223703, 'atr_min_pct': 0.024351116101905414, 'atr_max_pct': 0.03695771729959693, 'tp_mult': 2.5088703096344878, 'tsl_mult': 0.5829193776999535, 'strategy': 'mean_reversion', 'time_stop': 205, 'use_sma': True, 'use_atr': True, 'use_adx': True, 'use_ema': False, 'use_spike': True, 'rsi_required': True, 'edge_k': 1.0365484458897831, 'edge_cap': 0.7602752715057587, 'bull_strategy': 'mean_reversion', 'bull_bb_std_mult': 2.806970686395727, 'bull_rsi_os': 26, 'bull_rsi_ob': 60, 'bull_adx_thresh': 19.627186598490468, 'bull_atr_min_pct': 0.002079973693083022, 'bull_atr_max_pct': 0.1269411639252774, 'bull_tp_mult': 1.5420353048501103, 'bull_tsl_mult': 0.3477326771951008, 'bull_time_stop': 186, 'bull_use_sma': False, 'bull_use_ema': True, 'bull_use_atr': True, 'bull_use_adx': False, 'bull_use_spike': False, 'bull_rsi_required': True, 'bear_strategy': 'breakout', 'bear_bb_std_mult': 2.799909917792022, 'bear_rsi_os': 47, 'bear_rsi_ob': 79, 'bear_adx_thresh': 23.965339459153917, 'bear_atr_min_pct': 0.013717069841289216, 'bear_atr_max_pct': 0.0996644395714126, 'bear_tp_mult': 2.65816245707533, 'bear_tsl_mult': 0.18183267593142816, 'bear_time_stop': 193, 'bear_use_sma': True, 'bear_use_ema': True, 'bear_use_atr': False, 'bear_use_adx': False, 'bear_use_spike': False, 'bear_rsi_required': True, 'sideways_strategy': 'breakout', 'sideways_bb_std_mult': 3.206673339981223, 'sideways_rsi_os': 20, 'sideways_rsi_ob': 61, 'sideways_adx_thresh': 19.225399441199638, 'sideways_atr_min_pct': 0.0017819867129109529, 'sideways_atr_max_pct': 0.02180781413789281, 'sideways_tp_mult': 1.3197990636457817, 'sideways_tsl_mult': 0.5091838686414403, 'sideways_time_stop': 161, 'sideways_use_sma': False, 'sideways_use_ema': True, 'sideways_use_atr': True, 'sideways_use_adx': True, 'sideways_use_spike': False, 'sideways_rsi_required': True}.
