[I 2025-08-30 20:05:50,005] Trial 846 finished with values: [-1000000000.0, 1000000000.0] and parameters: {'p_sma': 8, 'p_std': 55, 'p_atr': 9, 'p_adx': 21, 'rsi_period': 20, 'ema1': 21, 'ema2': 31, 'slip_atr_k': 0.0496766956973415, 'slip_spread_k': 0.16819699388381987, 'spread_hl_frac': 7.068742003723053e-05, 'bb_std_mult': 3.2320649835319015, 'rsi_os': 15, 'rsi_ob': 80, 'vol_spike': 0.18704058782497082, 'adx_thresh': 34.56813066153401, 'atr_min_pct': 0.026682220795911985, 'atr_max_pct': 0.10009963880243311, 'tp_mult': 1.930624153016875, 'tsl_mult': 0.800508087256158, 'strategy': 'mean_reversion', 'time_stop': 161, 'use_sma': False, 'use_atr': True, 'use_adx': False, 'use_ema': False, 'use_spike': True, 'rsi_required': True, 'edge_k': 0.1700799478438899, 'edge_cap': 0.29458676742801404, 'bull_strategy': 'mean_reversion', 'bull_bb_std_mult': 1.602882084608583, 'bull_rsi_os': 37, 'bull_rsi_ob': 47, 'bull_adx_thresh': 18.84745298761547, 'bull_atr_min_pct': 0.0163812651502582, 'bull_atr_max_pct': 0.04225235205829086, 'bull_tp_mult': 2.1901254179339813, 'bull_tsl_mult': 0.9394868418889641, 'bull_time_stop': 140, 'bull_use_sma': False, 'bull_use_ema': False, 'bull_use_atr': True, 'bull_use_adx': False, 'bull_use_spike': True, 'bull_rsi_required': True, 'bear_strategy': 'breakout', 'bear_bb_std_mult': 2.761336956804149, 'bear_rsi_os': 48, 'bear_rsi_ob': 48, 'bear_adx_thresh': 13.433041379103027, 'bear_atr_min_pct': 0.02362717748731779, 'bear_atr_max_pct': 0.03230937193638866, 'bear_tp_mult': 2.2571617888826236, 'bear_tsl_mult': 0.5882328858748006, 'bear_time_stop': 205, 'bear_use_sma': True, 'bear_use_ema': False, 'bear_use_atr': True, 'bear_use_adx': False, 'bear_use_spike': False, 'bear_rsi_required': True, 'sideways_strategy': 'mean_reversion', 'sideways_bb_std_mult': 2.698546664212277, 'sideways_rsi_os': 35, 'sideways_rsi_ob': 58, 'sideways_adx_thresh': 22.458152574965524, 'sideways_atr_min_pct': 0.018516873815236735, 'sideways_atr_max_pct': 0.14656516867052868, 'sideways_tp_mult': 1.0156324195584354, 'sideways_tsl_mult': 0.03728429657427523, 'sideways_time_stop': 157, 'sideways_use_sma': False, 'sideways_use_ema': True, 'sideways_use_atr': True, 'sideways_use_adx': True, 'sideways_use_spike': False, 'sideways_rsi_required': True}.
[I 2025-08-30 20:05:50,555] Trial 844 finished with values: [-0.04957461260906604, 0.049488804502646894] and parameters: {'p_sma': 30, 'p_std': 50, 'p_atr': 9, 'p_adx': 21, 'rsi_period': 21, 'ema1': 28, 'ema2': 60, 'slip_atr_k': 0.2173401936321812, 'slip_spread_k': 0.16506422909074167, 'spread_hl_frac': 0.02275656415045327, 'bb_std_mult': 2.128945532618124, 'rsi_os': 15, 'rsi_ob': 60, 'vol_spike': 0.2659378614769033, 'adx_thresh': 9.245298587929906, 'atr_min_pct': 0.02646431933526749, 'atr_max_pct': 0.05258824580342434, 'tp_mult': 1.911833264676453, 'tsl_mult': 0.801670971225832, 'strategy': 'mean_reversion', 'time_stop': 162, 'use_sma': False, 'use_atr': True, 'use_adx': False, 'use_ema': False, 'use_spike': True, 'rsi_required': False, 'edge_k': 0.5620570555499389, 'edge_cap': 0.4312567101920481, 'bull_strategy': 'mean_reversion', 'bull_bb_std_mult': 3.3061804076719064, 'bull_rsi_os': 32, 'bull_rsi_ob': 60, 'bull_adx_thresh': 18.56328552269686, 'bull_atr_min_pct': 0.0050638722708932285, 'bull_atr_max_pct': 0.13111500622923256, 'bull_tp_mult': 2.861499149824333, 'bull_tsl_mult': 0.31774462519183266, 'bull_time_stop': 173, 'bull_use_sma': False, 'bull_use_ema': True, 'bull_use_atr': False, 'bull_use_adx': False, 'bull_use_spike': False, 'bull_rsi_required': True, 'bear_strategy': 'breakout', 'bear_bb_std_mult': 2.750856944448878, 'bear_rsi_os': 7, 'bear_rsi_ob': 84, 'bear_adx_thresh': 18.16605360509015, 'bear_atr_min_pct': 0.01016790806198024, 'bear_atr_max_pct': 0.035742118839018684, 'bear_tp_mult': 1.8594078732392874, 'bear_tsl_mult': 0.020598119619406496, 'bear_time_stop': 212, 'bear_use_sma': True, 'bear_use_ema': True, 'bear_use_atr': True, 'bear_use_adx': False, 'bear_use_spike': False, 'bear_rsi_required': True, 'sideways_strategy': 'breakout', 'sideways_bb_std_mult': 1.9539067227422933, 'sideways_rsi_os': 39, 'sideways_rsi_ob': 57, 'sideways_adx_thresh': 24.26181297361577, 'sideways_atr_min_pct': 0.0020187853112328463, 'sideways_atr_max_pct': 0.14395952789244415, 'sideways_tp_mult': 1.0983524587437459, 'sideways_tsl_mult': 0.9168352809583309, 'sideways_time_stop': 22, 'sideways_use_sma': False, 'sideways_use_ema': True, 'sideways_use_atr': True, 'sideways_use_adx': True, 'sideways_use_spike': True, 'sideways_rsi_required': True}.
[I 2025-08-30 20:05:56,948] Trial 848 finished with values: [-1000000000.0, 1000000000.0] and parameters: {'p_sma': 10, 'p_std': 32, 'p_atr': 10, 'p_adx': 21, 'rsi_period': 20, 'ema1': 13, 'ema2': 10, 'slip_atr_k': 0.07659629967815991, 'slip_spread_k': 0.16541349138172276, 'spread_hl_frac': 0.01713632291806289, 'bb_std_mult': 1.8407970015903077, 'rsi_os': 33, 'rsi_ob': 81, 'vol_spike': 0.16800763145564412, 'adx_thresh': 8.70756442891386, 'atr_min_pct': 0.026471910356446932, 'atr_max_pct': 0.10106308399071114, 'tp_mult': 2.690444674606309, 'tsl_mult': 0.8125439121862285, 'strategy': 'mean_reversion', 'time_stop': 187, 'use_sma': False, 'use_atr': True, 'use_adx': True, 'use_ema': False, 'use_spike': True, 'rsi_required': False, 'edge_k': 1.0739549553564087, 'edge_cap': 0.2939124771817949, 'bull_strategy': 'mean_reversion', 'bull_bb_std_mult': 3.099089435860927, 'bull_rsi_os': 49, 'bull_rsi_ob': 74, 'bull_adx_thresh': 17.59517781827508, 'bull_atr_min_pct': 0.025893022196716894, 'bull_atr_max_pct': 0.06269184381257367, 'bull_tp_mult': 2.221110463105272, 'bull_tsl_mult': 0.5332613411179822, 'bull_time_stop': 188, 'bull_use_sma': False, 'bull_use_ema': True, 'bull_use_atr': True, 'bull_use_adx': True, 'bull_use_spike': False, 'bull_rsi_required': False, 'bear_strategy': 'breakout', 'bear_bb_std_mult': 2.986891432347011, 'bear_rsi_os': 32, 'bear_rsi_ob': 81, 'bear_adx_thresh': 9.438834389792778, 'bear_atr_min_pct': 0.014532799979610713, 'bear_atr_max_pct': 0.03242681561954465, 'bear_tp_mult': 2.6849554455042495, 'bear_tsl_mult': 0.7756409382331133, 'bear_time_stop': 190, 'bear_use_sma': True, 'bear_use_ema': True, 'bear_use_atr': False, 'bear_use_adx': False, 'bear_use_spike': False, 'bear_rsi_required': True, 'sideways_strategy': 'breakout', 'sideways_bb_std_mult': 2.436642307434671, 'sideways_rsi_os': 35, 'sideways_rsi_ob': 64, 'sideways_adx_thresh': 20.76767747932298, 'sideways_atr_min_pct': 0.020192604074381174, 'sideways_atr_max_pct': 0.14631858049591978, 'sideways_tp_mult': 1.0119754261502925, 'sideways_tsl_mult': 0.3297902425123982, 'sideways_time_stop': 164, 'sideways_use_sma': False, 'sideways_use_ema': False, 'sideways_use_atr': True, 'sideways_use_adx': True, 'sideways_use_spike': False, 'sideways_rsi_required': False}.
[I 2025-08-30 20:05:57,340] Trial 850 finished with values: [-1000000000.0, 1000000000.0] and parameters: {'p_sma': 6, 'p_std': 32, 'p_atr': 10, 'p_adx': 22, 'rsi_period': 29, 'ema1': 27, 'ema2': 37, 'slip_atr_k': 0.08798669255094696, 'slip_spread_k': 0.7103808418257641, 'spread_hl_frac': 0.02316299526596627, 'bb_std_mult': 1.8324617307319016, 'rsi_os': 51, 'rsi_ob': 82, 'vol_spike': 0.25138617606943775, 'adx_thresh': 28.104990940165017, 'atr_min_pct': 0.022326101954564397, 'atr_max_pct': 0.08896092812427216, 'tp_mult': 2.6880252945420464, 'tsl_mult': 0.41415701640116276, 'strategy': 'mean_reversion', 'time_stop': 187, 'use_sma': False, 'use_atr': False, 'use_adx': True, 'use_ema': True, 'use_spike': False, 'rsi_required': False, 'edge_k': 1.7191382794372754, 'edge_cap': 0.47553750938651157, 'bull_strategy': 'mean_reversion', 'bull_bb_std_mult': 3.1192145419343063, 'bull_rsi_os': 49, 'bull_rsi_ob': 86, 'bull_adx_thresh': 17.74750991690818, 'bull_atr_min_pct': 0.013231082957039323, 'bull_atr_max_pct': 0.06182982728833389, 'bull_tp_mult': 1.583973948525668, 'bull_tsl_mult': 0.5339441185867452, 'bull_time_stop': 185, 'bull_use_sma': True, 'bull_use_ema': True, 'bull_use_atr': True, 'bull_use_adx': False, 'bull_use_spike': False, 'bull_rsi_required': True, 'bear_strategy': 'mean_reversion', 'bear_bb_std_mult': 2.983143723696612, 'bear_rsi_os': 53, 'bear_rsi_ob': 84, 'bear_adx_thresh': 31.78331073200186, 'bear_atr_min_pct': 0.010079760914024138, 'bear_atr_max_pct': 0.038870763222859386, 'bear_tp_mult': 2.391025629511033, 'bear_tsl_mult': 0.7770251782669958, 'bear_time_stop': 290, 'bear_use_sma': True, 'bear_use_ema': True, 'bear_use_atr': False, 'bear_use_adx': False, 'bear_use_spike': True, 'bear_rsi_required': True, 'sideways_strategy': 'breakout', 'sideways_bb_std_mult': 1.9941859626807172, 'sideways_rsi_os': 50, 'sideways_rsi_ob': 60, 'sideways_adx_thresh': 24.323453157472112, 'sideways_atr_min_pct': 0.0019795394306237925, 'sideways_atr_max_pct': 0.14252175255473143, 'sideways_tp_mult': 1.175441581292936, 'sideways_tsl_mult': 0.9168160601274145, 'sideways_time_stop': 163, 'sideways_use_sma': False, 'sideways_use_ema': True, 'sideways_use_atr': True, 'sideways_use_adx': False, 'sideways_use_spike': False, 'sideways_rsi_required': True}.
[I 2025-08-30 20:06:29,619] Trial 849 finished with values: [-1000000000.0, 1000000000.0] and parameters: {'p_sma': 10, 'p_std': 32, 'p_atr': 10, 'p_adx': 12, 'rsi_period': 20, 'ema1': 26, 'ema2': 32, 'slip_atr_k': 0.08890246101895856, 'slip_spread_k': 0.30624406061982234, 'spread_hl_frac': 0.023025439771949097, 'bb_std_mult': 3.183873169301349, 'rsi_os': 35, 'rsi_ob': 82, 'vol_spike': 0.08621435348274178, 'adx_thresh': 21.39446663422035, 'atr_min_pct': 0.022207264320756585, 'atr_max_pct': 0.08793124554884496, 'tp_mult': 2.2547016073666377, 'tsl_mult': 0.8196549298608345, 'strategy': 'mean_reversion', 'time_stop': 190, 'use_sma': False, 'use_atr': True, 'use_adx': True, 'use_ema': False, 'use_spike': True, 'rsi_required': False, 'edge_k': 0.13349850672622032, 'edge_cap': 0.51524296090959, 'bull_strategy': 'mean_reversion', 'bull_bb_std_mult': 3.1228318494635587, 'bull_rsi_os': 39, 'bull_rsi_ob': 53, 'bull_adx_thresh': 17.513325703132562, 'bull_atr_min_pct': 0.016267301738047787, 'bull_atr_max_pct': 0.11823719036166482, 'bull_tp_mult': 2.8031418837008286, 'bull_tsl_mult': 0.7314825417334319, 'bull_time_stop': 54, 'bull_use_sma': False, 'bull_use_ema': True, 'bull_use_atr': True, 'bull_use_adx': False, 'bull_use_spike': True, 'bull_rsi_required': True, 'bear_strategy': 'mean_reversion', 'bear_bb_std_mult': 2.9734772707649983, 'bear_rsi_os': 53, 'bear_rsi_ob': 74, 'bear_adx_thresh': 13.545090488755086, 'bear_atr_min_pct': 0.016425074993349015, 'bear_atr_max_pct': 0.03245533564696742, 'bear_tp_mult': 2.9395796420712337, 'bear_tsl_mult': 0.7798310235327524, 'bear_time_stop': 203, 'bear_use_sma': True, 'bear_use_ema': True, 'bear_use_atr': False, 'bear_use_adx': False, 'bear_use_spike': True, 'bear_rsi_required': True, 'sideways_strategy': 'mean_reversion', 'sideways_bb_std_mult': 3.170431572476143, 'sideways_rsi_os': 43, 'sideways_rsi_ob': 77, 'sideways_adx_thresh': 20.925985898065367, 'sideways_atr_min_pct': 0.018787413172961842, 'sideways_atr_max_pct': 0.14628124409357166, 'sideways_tp_mult': 1.6551901365896504, 'sideways_tsl_mult': 0.32025864104417046, 'sideways_time_stop': 165, 'sideways_use_sma': False, 'sideways_use_ema': True, 'sideways_use_atr': True, 'sideways_use_adx': False, 'sideways_use_spike': False, 'sideways_rsi_required': True}.
[I 2025-08-30 20:06:29,626] Trial 851 finished with values: [-1000000000.0, 1000000000.0] and parameters: {'p_sma': 6, 'p_std': 32, 'p_atr': 10, 'p_adx': 12, 'rsi_period': 30, 'ema1': 29, 'ema2': 10, 'slip_atr_k': 0.17217203491764427, 'slip_spread_k': 0.6949280315485004, 'spread_hl_frac': 0.04016585639088423, 'bb_std_mult': 2.742494542510496, 'rsi_os': 49, 'rsi_ob': 82, 'vol_spike': 0.25338067697130257, 'adx_thresh': 13.309555455795573, 'atr_min_pct': 0.02234740015251429, 'atr_max_pct': 0.08856278421293433, 'tp_mult': 2.2616623797085547, 'tsl_mult': 0.8261646774083657, 'strategy': 'mean_reversion', 'time_stop': 188, 'use_sma': True, 'use_atr': False, 'use_adx': True, 'use_ema': True, 'use_spike': False, 'rsi_required': False, 'edge_k': 1.6964694209542155, 'edge_cap': 0.5151953611142104, 'bull_strategy': 'mean_reversion', 'bull_bb_std_mult': 3.106168720818732, 'bull_rsi_os': 49, 'bull_rsi_ob': 48, 'bull_adx_thresh': 17.79223610674086, 'bull_atr_min_pct': 0.002189209757341987, 'bull_atr_max_pct': 0.11758093241947472, 'bull_tp_mult': 2.8051747764970907, 'bull_tsl_mult': 0.532267945431927, 'bull_time_stop': 10, 'bull_use_sma': True, 'bull_use_ema': True, 'bull_use_atr': True, 'bull_use_adx': False, 'bull_use_spike': False, 'bull_rsi_required': True, 'bear_strategy': 'mean_reversion', 'bear_bb_std_mult': 2.9880904125181575, 'bear_rsi_os': 36, 'bear_rsi_ob': 74, 'bear_adx_thresh': 9.823919522546866, 'bear_atr_min_pct': 0.00296874768250603, 'bear_atr_max_pct': 0.11904509440386223, 'bear_tp_mult': 2.1415172325270673, 'bear_tsl_mult': 0.2850359129912309, 'bear_time_stop': 191, 'bear_use_sma': True, 'bear_use_ema': True, 'bear_use_atr': False, 'bear_use_adx': False, 'bear_use_spike': True, 'bear_rsi_required': True, 'sideways_strategy': 'breakout', 'sideways_bb_std_mult': 2.4371831166484306, 'sideways_rsi_os': 37, 'sideways_rsi_ob': 83, 'sideways_adx_thresh': 20.955409932282777, 'sideways_atr_min_pct': 0.020123616408857674, 'sideways_atr_max_pct': 0.02732898506290475, 'sideways_tp_mult': 1.1592280199567528, 'sideways_tsl_mult': 0.8056018728157852, 'sideways_time_stop': 72, 'sideways_use_sma': False, 'sideways_use_ema': True, 'sideways_use_atr': True, 'sideways_use_adx': False, 'sideways_use_spike': False, 'sideways_rsi_required': True}.
[I 2025-08-30 20:06:32,608] Trial 852 finished with values: [-1000000000.0, 1000000000.0] and parameters: {'p_sma': 6, 'p_std': 30, 'p_atr': 22, 'p_adx': 20, 'rsi_period': 30, 'ema1': 11, 'ema2': 33, 'slip_atr_k': 0.06915803837015026, 'slip_spread_k': 0.8981017484299298, 'spread_hl_frac': 0.03456463815325324, 'bb_std_mult': 2.656693834069921, 'rsi_os': 5, 'rsi_ob': 84, 'vol_spike': 0.021094746458510033, 'adx_thresh': 28.19809327677762, 'atr_min_pct': 0.022295248761264038, 'atr_max_pct': 0.08884919712749799, 'tp_mult': 1.5439931556267539, 'tsl_mult': 0.9106345512031289, 'strategy': 'mean_reversion', 'time_stop': 171, 'use_sma': True, 'use_atr': False, 'use_adx': True, 'use_ema': True, 'use_spike': False, 'rsi_required': False, 'edge_k': 1.9960593331250984, 'edge_cap': 0.47509364949676247, 'bull_strategy': 'mean_reversion', 'bull_bb_std_mult': 3.1354001727727403, 'bull_rsi_os': 28, 'bull_rsi_ob': 57, 'bull_adx_thresh': 28.767534932828376, 'bull_atr_min_pct': 0.002211566611196619, 'bull_atr_max_pct': 0.11847696132024874, 'bull_tp_mult': 2.803793980922969, 'bull_tsl_mult': 0.47706599020826995, 'bull_time_stop': 158, 'bull_use_sma': True, 'bull_use_ema': True, 'bull_use_atr': True, 'bull_use_adx': False, 'bull_use_spike': False, 'bull_rsi_required': True, 'bear_strategy': 'mean_reversion', 'bear_bb_std_mult': 2.976487617995818, 'bear_rsi_os': 53, 'bear_rsi_ob': 89, 'bear_adx_thresh': 19.000647643943015, 'bear_atr_min_pct': 0.016535166110605636, 'bear_atr_max_pct': 0.1144619128229345, 'bear_tp_mult': 1.6589079383974576, 'bear_tsl_mult': 0.7184453598275263, 'bear_time_stop': 198, 'bear_use_sma': True, 'bear_use_ema': True, 'bear_use_atr': False, 'bear_use_adx': False, 'bear_use_spike': True, 'bear_rsi_required': True, 'sideways_strategy': 'breakout', 'sideways_bb_std_mult': 0.7680212662879544, 'sideways_rsi_os': 37, 'sideways_rsi_ob': 83, 'sideways_adx_thresh': 19.812752821431733, 'sideways_atr_min_pct': 0.028606239384861724, 'sideways_atr_max_pct': 0.06204918650769149, 'sideways_tp_mult': 1.0562143668332795, 'sideways_tsl_mult': 0.7985966721903528, 'sideways_time_stop': 162, 'sideways_use_sma': False, 'sideways_use_ema': True, 'sideways_use_atr': True, 'sideways_use_adx': False, 'sideways_use_spike': False, 'sideways_rsi_required': True}.
[I 2025-08-30 20:06:33,515] Trial 853 finished with values: [-1000000000.0, 1000000000.0] and parameters: {'p_sma': 6, 'p_std': 37, 'p_atr': 9, 'p_adx': 9, 'rsi_period': 78, 'ema1': 29, 'ema2': 53, 'slip_atr_k': 0.07015082345236252, 'slip_spread_k': 0.13561673418380596, 'spread_hl_frac': 0.0019454750716106674, 'bb_std_mult': 2.2495252176751452, 'rsi_os': 49, 'rsi_ob': 56, 'vol_spike': 0.013225111229143077, 'adx_thresh': 32.426273569632315, 'atr_min_pct': 0.007329668843961502, 'atr_max_pct': 0.09575682207253557, 'tp_mult': 2.180995116308623, 'tsl_mult': 0.9040548771145798, 'strategy': 'mean_reversion', 'time_stop': 173, 'use_sma': True, 'use_atr': True, 'use_adx': True, 'use_ema': False, 'use_spike': True, 'rsi_required': False, 'edge_k': 1.143388056801349, 'edge_cap': 0.5171527948808711, 'bull_strategy': 'mean_reversion', 'bull_bb_std_mult': 1.2259133898158514, 'bull_rsi_os': 29, 'bull_rsi_ob': 45, 'bull_adx_thresh': 18.194139296222836, 'bull_atr_min_pct': 0.010592349561685957, 'bull_atr_max_pct': 0.11901096686315572, 'bull_tp_mult': 2.0472057305264624, 'bull_tsl_mult': 0.4765843960233629, 'bull_time_stop': 160, 'bull_use_sma': False, 'bull_use_ema': True, 'bull_use_atr': True, 'bull_use_adx': False, 'bull_use_spike': True, 'bull_rsi_required': True, 'bear_strategy': 'mean_reversion', 'bear_bb_std_mult': 3.180921392176827, 'bear_rsi_os': 52, 'bear_rsi_ob': 47, 'bear_adx_thresh': 18.98705119366022, 'bear_atr_min_pct': 0.016415906327291084, 'bear_atr_max_pct': 0.11699959030570589, 'bear_tp_mult': 1.647968606576772, 'bear_tsl_mult': 0.39125587285840185, 'bear_time_stop': 204, 'bear_use_sma': True, 'bear_use_ema': True, 'bear_use_atr': False, 'bear_use_adx': False, 'bear_use_spike': True, 'bear_rsi_required': True, 'sideways_strategy': 'mean_reversion', 'sideways_bb_std_mult': 3.161626673860595, 'sideways_rsi_os': 55, 'sideways_rsi_ob': 62, 'sideways_adx_thresh': 19.72996420085561, 'sideways_atr_min_pct': 0.02431274497509421, 'sideways_atr_max_pct': 0.11711860708349099, 'sideways_tp_mult': 1.5057362331331612, 'sideways_tsl_mult': 0.9999185385888776, 'sideways_time_stop': 72, 'sideways_use_sma': False, 'sideways_use_ema': True, 'sideways_use_atr': True, 'sideways_use_adx': False, 'sideways_use_spike': False, 'sideways_rsi_required': True}.
[I 2025-08-30 20:06:34,602] Trial 855 finished with values: [-1000000000.0, 1000000000.0] and parameters: {'p_sma': 5, 'p_std': 39, 'p_atr': 8, 'p_adx': 19, 'rsi_period': 16, 'ema1': 26, 'ema2': 23, 'slip_atr_k': 0.07155237465757838, 'slip_spread_k': 0.09643945197225806, 'spread_hl_frac': 0.025619152614969894, 'bb_std_mult': 1.4567206282342375, 'rsi_os': 50, 'rsi_ob': 84, 'vol_spike': 0.2675667470920575, 'adx_thresh': 32.49609664744917, 'atr_min_pct': 0.02997794764428037, 'atr_max_pct': 0.095168892548924, 'tp_mult': 2.31435431384284, 'tsl_mult': 0.916669367541588, 'strategy': 'mean_reversion', 'time_stop': 171, 'use_sma': True, 'use_atr': True, 'use_adx': True, 'use_ema': False, 'use_spike': True, 'rsi_required': False, 'edge_k': 0.2167372145369616, 'edge_cap': 0.23228131611894964, 'bull_strategy': 'mean_reversion', 'bull_bb_std_mult': 3.0237101397151047, 'bull_rsi_os': 45, 'bull_rsi_ob': 45, 'bull_adx_thresh': 18.23962407084292, 'bull_atr_min_pct': 0.015420711490787548, 'bull_atr_max_pct': 0.1080415589508064, 'bull_tp_mult': 2.0481227452280484, 'bull_tsl_mult': 0.47541935635553306, 'bull_time_stop': 193, 'bull_use_sma': False, 'bull_use_ema': True, 'bull_use_atr': False, 'bull_use_adx': False, 'bull_use_spike': False, 'bull_rsi_required': True, 'bear_strategy': 'breakout', 'bear_bb_std_mult': 2.824740534401772, 'bear_rsi_os': 54, 'bear_rsi_ob': 75, 'bear_adx_thresh': 29.07975962169416, 'bear_atr_min_pct': 0.018932569418430193, 'bear_atr_max_pct': 0.04125594330618373, 'bear_tp_mult': 1.1257289266273167, 'bear_tsl_mult': 0.7207621811497742, 'bear_time_stop': 197, 'bear_use_sma': True, 'bear_use_ema': True, 'bear_use_atr': False, 'bear_use_adx': False, 'bear_use_spike': False, 'bear_rsi_required': False, 'sideways_strategy': 'breakout', 'sideways_bb_std_mult': 3.0529176036483827, 'sideways_rsi_os': 30, 'sideways_rsi_ob': 47, 'sideways_adx_thresh': 19.76607391614034, 'sideways_atr_min_pct': 0.0034984750667627976, 'sideways_atr_max_pct': 0.1407166495008369, 'sideways_tp_mult': 2.8456669716077334, 'sideways_tsl_mult': 0.48678401871936444, 'sideways_time_stop': 154, 'sideways_use_sma': False, 'sideways_use_ema': True, 'sideways_use_atr': True, 'sideways_use_adx': False, 'sideways_use_spike': True, 'sideways_rsi_required': True}.
