[I 2025-08-30 20:08:38,997] Trial 872 finished with values: [-1000000000.0, 1000000000.0] and parameters: {'p_sma': 7, 'p_std': 33, 'p_atr': 9, 'p_adx': 18, 'rsi_period': 22, 'ema1': 6, 'ema2': 17, 'slip_atr_k': 0.06796823801169447, 'slip_spread_k': 0.14647171753050223, 'spread_hl_frac': 0.028621978628099683, 'bb_std_mult': 2.1336314704703985, 'rsi_os': 37, 'rsi_ob': 84, 'vol_spike': 0.2567659440639906, 'adx_thresh': 33.56003687115795, 'atr_min_pct': 0.023099336288818648, 'atr_max_pct': 0.1061438036280106, 'tp_mult': 2.630467192441101, 'tsl_mult': 0.045298067235681416, 'strategy': 'mean_reversion', 'time_stop': 300, 'use_sma': True, 'use_atr': True, 'use_adx': True, 'use_ema': False, 'use_spike': True, 'rsi_required': True, 'edge_k': 0.08726175585713355, 'edge_cap': 0.7990005392066013, 'bull_strategy': 'mean_reversion', 'bull_bb_std_mult': 3.1618886101921495, 'bull_rsi_os': 33, 'bull_rsi_ob': 64, 'bull_adx_thresh': 19.09699196449686, 'bull_atr_min_pct': 0.01457836317930777, 'bull_atr_max_pct': 0.06681298326358637, 'bull_tp_mult': 2.7418660765419114, 'bull_tsl_mult': 0.5253006939755679, 'bull_time_stop': 261, 'bull_use_sma': False, 'bull_use_ema': True, 'bull_use_atr': False, 'bull_use_adx': True, 'bull_use_spike': False, 'bull_rsi_required': False, 'bear_strategy': 'mean_reversion', 'bear_bb_std_mult': 2.831965929605455, 'bear_rsi_os': 52, 'bear_rsi_ob': 69, 'bear_adx_thresh': 11.110156569196196, 'bear_atr_min_pct': 0.02185829925837922, 'bear_atr_max_pct': 0.03639738429795619, 'bear_tp_mult': 2.603734184838877, 'bear_tsl_mult': 0.8307821373063808, 'bear_time_stop': 183, 'bear_use_sma': True, 'bear_use_ema': False, 'bear_use_atr': False, 'bear_use_adx': False, 'bear_use_spike': False, 'bear_rsi_required': True, 'sideways_strategy': 'breakout', 'sideways_bb_std_mult': 3.440659177476078, 'sideways_rsi_os': 35, 'sideways_rsi_ob': 90, 'sideways_adx_thresh': 31.39666246758251, 'sideways_atr_min_pct': 0.005390253609463153, 'sideways_atr_max_pct': 0.13586127313857455, 'sideways_tp_mult': 1.012812396063902, 'sideways_tsl_mult': 0.3892637039035299, 'sideways_time_stop': 167, 'sideways_use_sma': False, 'sideways_use_ema': False, 'sideways_use_atr': True, 'sideways_use_adx': False, 'sideways_use_spike': True, 'sideways_rsi_required': True}.
[I 2025-08-30 20:08:50,563] Trial 874 finished with values: [-1000000000.0, 1000000000.0] and parameters: {'p_sma': 7, 'p_std': 31, 'p_atr': 19, 'p_adx': 26, 'rsi_period': 18, 'ema1': 27, 'ema2': 32, 'slip_atr_k': 0.06687061402874987, 'slip_spread_k': 0.1431432964741817, 'spread_hl_frac': 0.028990351224541907, 'bb_std_mult': 2.214213754521, 'rsi_os': 39, 'rsi_ob': 84, 'vol_spike': 0.27412152164400044, 'adx_thresh': 11.911356653036572, 'atr_min_pct': 0.02554481895783826, 'atr_max_pct': 0.14698929000940758, 'tp_mult': 1.6401771753314198, 'tsl_mult': 0.7879025587075773, 'strategy': 'mean_reversion', 'time_stop': 72, 'use_sma': True, 'use_atr': True, 'use_adx': True, 'use_ema': False, 'use_spike': True, 'rsi_required': True, 'edge_k': 0.19152866147612602, 'edge_cap': 0.6446040360176475, 'bull_strategy': 'mean_reversion', 'bull_bb_std_mult': 1.4090807678100425, 'bull_rsi_os': 5, 'bull_rsi_ob': 49, 'bull_adx_thresh': 18.54824920047661, 'bull_atr_min_pct': 0.021089708306734064, 'bull_atr_max_pct': 0.1277957395666761, 'bull_tp_mult': 1.4612932030349888, 'bull_tsl_mult': 0.18347704168168044, 'bull_time_stop': 169, 'bull_use_sma': False, 'bull_use_ema': True, 'bull_use_atr': False, 'bull_use_adx': True, 'bull_use_spike': False, 'bull_rsi_required': False, 'bear_strategy': 'breakout', 'bear_bb_std_mult': 1.982422625543603, 'bear_rsi_os': 15, 'bear_rsi_ob': 51, 'bear_adx_thresh': 18.056055855541533, 'bear_atr_min_pct': 0.01543934433705004, 'bear_atr_max_pct': 0.037222217591638455, 'bear_tp_mult': 2.6092204236314442, 'bear_tsl_mult': 0.6945839957303844, 'bear_time_stop': 182, 'bear_use_sma': True, 'bear_use_ema': False, 'bear_use_atr': False, 'bear_use_adx': False, 'bear_use_spike': False, 'bear_rsi_required': False, 'sideways_strategy': 'breakout', 'sideways_bb_std_mult': 3.208457838567872, 'sideways_rsi_os': 7, 'sideways_rsi_ob': 58, 'sideways_adx_thresh': 22.651737033885258, 'sideways_atr_min_pct': 0.0011526116346489011, 'sideways_atr_max_pct': 0.14366354936007308, 'sideways_tp_mult': 1.0123394516799178, 'sideways_tsl_mult': 0.937334123182307, 'sideways_time_stop': 187, 'sideways_use_sma': False, 'sideways_use_ema': False, 'sideways_use_atr': True, 'sideways_use_adx': False, 'sideways_use_spike': True, 'sideways_rsi_required': False}.
[I 2025-08-30 20:08:50,695] Trial 875 finished with values: [-0.046999442246174694, 0.047023465907765946] and parameters: {'p_sma': 11, 'p_std': 33, 'p_atr': 9, 'p_adx': 18, 'rsi_period': 22, 'ema1': 27, 'ema2': 43, 'slip_atr_k': 0.06921099049245641, 'slip_spread_k': 0.14751939795493807, 'spread_hl_frac': 0.022138454559330938, 'bb_std_mult': 1.6422221316824743, 'rsi_os': 52, 'rsi_ob': 85, 'vol_spike': 0.2725211632168246, 'adx_thresh': 33.427354582083325, 'atr_min_pct': 0.02565643402752589, 'atr_max_pct': 0.028107112797360695, 'tp_mult': 2.1783146585616158, 'tsl_mult': 0.6861214839030864, 'strategy': 'breakout', 'time_stop': 182, 'use_sma': False, 'use_atr': True, 'use_adx': True, 'use_ema': False, 'use_spike': True, 'rsi_required': True, 'edge_k': 0.1874988178067834, 'edge_cap': 0.5357487733054017, 'bull_strategy': 'breakout', 'bull_bb_std_mult': 3.374475760861075, 'bull_rsi_os': 31, 'bull_rsi_ob': 46, 'bull_adx_thresh': 10.900387355756568, 'bull_atr_min_pct': 0.0004113296873008473, 'bull_atr_max_pct': 0.12888592622331352, 'bull_tp_mult': 2.599597209965202, 'bull_tsl_mult': 0.6188281511717233, 'bull_time_stop': 246, 'bull_use_sma': False, 'bull_use_ema': False, 'bull_use_atr': True, 'bull_use_adx': True, 'bull_use_spike': False, 'bull_rsi_required': False, 'bear_strategy': 'breakout', 'bear_bb_std_mult': 2.837021245164113, 'bear_rsi_os': 16, 'bear_rsi_ob': 68, 'bear_adx_thresh': 15.867014574669223, 'bear_atr_min_pct': 0.015622282429105926, 'bear_atr_max_pct': 0.03756495354684164, 'bear_tp_mult': 2.8221555610433096, 'bear_tsl_mult': 0.6023048520410114, 'bear_time_stop': 16, 'bear_use_sma': True, 'bear_use_ema': False, 'bear_use_atr': False, 'bear_use_adx': True, 'bear_use_spike': False, 'bear_rsi_required': False, 'sideways_strategy': 'breakout', 'sideways_bb_std_mult': 3.1967722410913098, 'sideways_rsi_os': 33, 'sideways_rsi_ob': 94, 'sideways_adx_thresh': 29.513034651574074, 'sideways_atr_min_pct': 0.0010532539158064765, 'sideways_atr_max_pct': 0.14317794227476122, 'sideways_tp_mult': 1.04446618831191, 'sideways_tsl_mult': 0.9430644735515681, 'sideways_time_stop': 190, 'sideways_use_sma': True, 'sideways_use_ema': False, 'sideways_use_atr': True, 'sideways_use_adx': False, 'sideways_use_spike': False, 'sideways_rsi_required': False}.
[I 2025-08-30 20:08:56,241] Trial 876 finished with values: [-1000000000.0, 1000000000.0] and parameters: {'p_sma': 10, 'p_std': 33, 'p_atr': 10, 'p_adx': 30, 'rsi_period': 25, 'ema1': 26, 'ema2': 33, 'slip_atr_k': 0.06853576048065982, 'slip_spread_k': 0.15427820549761045, 'spread_hl_frac': 0.02255232064211952, 'bb_std_mult': 1.624396692365142, 'rsi_os': 51, 'rsi_ob': 94, 'vol_spike': 0.27286001288581546, 'adx_thresh': 15.368903369542494, 'atr_min_pct': 0.02569155628479641, 'atr_max_pct': 0.09126073523285311, 'tp_mult': 2.184445975142245, 'tsl_mult': 0.8357027934795483, 'strategy': 'breakout', 'time_stop': 243, 'use_sma': False, 'use_atr': True, 'use_adx': True, 'use_ema': False, 'use_spike': True, 'rsi_required': False, 'edge_k': 0.1780560880585994, 'edge_cap': 0.4654717021739523, 'bull_strategy': 'breakout', 'bull_bb_std_mult': 3.186833327826634, 'bull_rsi_os': 31, 'bull_rsi_ob': 49, 'bull_adx_thresh': 18.402929791110605, 'bull_atr_min_pct': 0.021095466758470773, 'bull_atr_max_pct': 0.11715445289312806, 'bull_tp_mult': 2.592401278568172, 'bull_tsl_mult': 0.39969682126536726, 'bull_time_stop': 176, 'bull_use_sma': True, 'bull_use_ema': False, 'bull_use_atr': True, 'bull_use_adx': False, 'bull_use_spike': False, 'bull_rsi_required': True, 'bear_strategy': 'breakout', 'bear_bb_std_mult': 2.8525171338398225, 'bear_rsi_os': 15, 'bear_rsi_ob': 73, 'bear_adx_thresh': 11.089377376126869, 'bear_atr_min_pct': 0.008628168651582568, 'bear_atr_max_pct': 0.03689064904535389, 'bear_tp_mult': 1.972250583173292, 'bear_tsl_mult': 0.7853570680084789, 'bear_time_stop': 184, 'bear_use_sma': False, 'bear_use_ema': True, 'bear_use_atr': True, 'bear_use_adx': True, 'bear_use_spike': False, 'bear_rsi_required': True, 'sideways_strategy': 'breakout', 'sideways_bb_std_mult': 2.812559255321589, 'sideways_rsi_os': 33, 'sideways_rsi_ob': 60, 'sideways_adx_thresh': 23.513226962491874, 'sideways_atr_min_pct': 0.022077763575039433, 'sideways_atr_max_pct': 0.14283863649307724, 'sideways_tp_mult': 2.5670855399508823, 'sideways_tsl_mult': 0.9323772351177411, 'sideways_time_stop': 158, 'sideways_use_sma': True, 'sideways_use_ema': True, 'sideways_use_atr': True, 'sideways_use_adx': False, 'sideways_use_spike': False, 'sideways_rsi_required': False}.
[I 2025-08-30 20:09:21,066] Trial 877 finished with values: [-1000000000.0, 1000000000.0] and parameters: {'p_sma': 51, 'p_std': 31, 'p_atr': 16, 'p_adx': 19, 'rsi_period': 40, 'ema1': 10, 'ema2': 45, 'slip_atr_k': 0.0638277590907011, 'slip_spread_k': 0.22970966099402096, 'spread_hl_frac': 0.03694214072915895, 'bb_std_mult': 2.215388638332949, 'rsi_os': 39, 'rsi_ob': 54, 'vol_spike': 0.27602020949922096, 'adx_thresh': 30.808107170261913, 'atr_min_pct': 0.025785068600373058, 'atr_max_pct': 0.0917168058595944, 'tp_mult': 2.186097786352277, 'tsl_mult': 0.46752042616418055, 'strategy': 'breakout', 'time_stop': 243, 'use_sma': False, 'use_atr': True, 'use_adx': False, 'use_ema': False, 'use_spike': True, 'rsi_required': False, 'edge_k': 1.6154087324698525, 'edge_cap': 0.5409407585439601, 'bull_strategy': 'breakout', 'bull_bb_std_mult': 3.070297064725824, 'bull_rsi_os': 35, 'bull_rsi_ob': 46, 'bull_adx_thresh': 18.18454869851609, 'bull_atr_min_pct': 0.021329179208215223, 'bull_atr_max_pct': 0.11639895873231461, 'bull_tp_mult': 2.828902735223306, 'bull_tsl_mult': 0.40110266700561403, 'bull_time_stop': 175, 'bull_use_sma': True, 'bull_use_ema': False, 'bull_use_atr': True, 'bull_use_adx': False, 'bull_use_spike': False, 'bull_rsi_required': True, 'bear_strategy': 'breakout', 'bear_bb_std_mult': 2.9436821547127776, 'bear_rsi_os': 33, 'bear_rsi_ob': 73, 'bear_adx_thresh': 26.713583505956848, 'bear_atr_min_pct': 0.012821695527738564, 'bear_atr_max_pct': 0.03922427620093412, 'bear_tp_mult': 2.693062273155859, 'bear_tsl_mult': 0.6025462666892659, 'bear_time_stop': 96, 'bear_use_sma': False, 'bear_use_ema': True, 'bear_use_atr': True, 'bear_use_adx': True, 'bear_use_spike': False, 'bear_rsi_required': False, 'sideways_strategy': 'breakout', 'sideways_bb_std_mult': 3.222436606613923, 'sideways_rsi_os': 33, 'sideways_rsi_ob': 70, 'sideways_adx_thresh': 20.900623979064488, 'sideways_atr_min_pct': 0.022380028785208228, 'sideways_atr_max_pct': 0.1419833402670676, 'sideways_tp_mult': 1.5949337739072877, 'sideways_tsl_mult': 0.1602516621729665, 'sideways_time_stop': 158, 'sideways_use_sma': True, 'sideways_use_ema': True, 'sideways_use_atr': False, 'sideways_use_adx': False, 'sideways_use_spike': False, 'sideways_rsi_required': False}.
[I 2025-08-30 20:09:28,978] Trial 878 finished with values: [-0.0393437594969277, 0.039720120623788165] and parameters: {'p_sma': 34, 'p_std': 11, 'p_atr': 8, 'p_adx': 19, 'rsi_period': 25, 'ema1': 10, 'ema2': 33, 'slip_atr_k': 0.08457749512663414, 'slip_spread_k': 0.17518987534672067, 'spread_hl_frac': 0.022602964038484254, 'bb_std_mult': 3.2873486153467857, 'rsi_os': 52, 'rsi_ob': 82, 'vol_spike': 0.2657102116251129, 'adx_thresh': 31.923717387955264, 'atr_min_pct': 0.023288581601720794, 'atr_max_pct': 0.11724837114454147, 'tp_mult': 2.176634154660478, 'tsl_mult': 0.5740326070191824, 'strategy': 'breakout', 'time_stop': 184, 'use_sma': False, 'use_atr': True, 'use_adx': False, 'use_ema': False, 'use_spike': True, 'rsi_required': False, 'edge_k': 0.17428258983960118, 'edge_cap': 0.5456618105220683, 'bull_strategy': 'breakout', 'bull_bb_std_mult': 1.6838127676757322, 'bull_rsi_os': 31, 'bull_rsi_ob': 61, 'bull_adx_thresh': 18.14309448701277, 'bull_atr_min_pct': 0.0005411258330377969, 'bull_atr_max_pct': 0.11676505852761757, 'bull_tp_mult': 2.8454538840685215, 'bull_tsl_mult': 0.6370560900962166, 'bull_time_stop': 176, 'bull_use_sma': True, 'bull_use_ema': False, 'bull_use_atr': True, 'bull_use_adx': False, 'bull_use_spike': False, 'bull_rsi_required': True, 'bear_strategy': 'breakout', 'bear_bb_std_mult': 2.942064292753528, 'bear_rsi_os': 17, 'bear_rsi_ob': 80, 'bear_adx_thresh': 14.639089570661923, 'bear_atr_min_pct': 0.00525319038481996, 'bear_atr_max_pct': 0.031020244849718374, 'bear_tp_mult': 2.813219753724174, 'bear_tsl_mult': 0.6424634226494761, 'bear_time_stop': 296, 'bear_use_sma': False, 'bear_use_ema': True, 'bear_use_atr': True, 'bear_use_adx': True, 'bear_use_spike': False, 'bear_rsi_required': True, 'sideways_strategy': 'breakout', 'sideways_bb_std_mult': 3.193965002098883, 'sideways_rsi_os': 33, 'sideways_rsi_ob': 80, 'sideways_adx_thresh': 29.315921496667265, 'sideways_atr_min_pct': 0.0041511322581982875, 'sideways_atr_max_pct': 0.051166907735631526, 'sideways_tp_mult': 1.0556034514979395, 'sideways_tsl_mult': 0.5831769098923191, 'sideways_time_stop': 160, 'sideways_use_sma': True, 'sideways_use_ema': True, 'sideways_use_atr': False, 'sideways_use_adx': False, 'sideways_use_spike': False, 'sideways_rsi_required': False}.
[I 2025-08-30 20:09:30,110] Trial 879 finished with values: [-1000000000.0, 1000000000.0] and parameters: {'p_sma': 9, 'p_std': 15, 'p_atr': 10, 'p_adx': 19, 'rsi_period': 25, 'ema1': 24, 'ema2': 33, 'slip_atr_k': 0.19245078518835462, 'slip_spread_k': 0.2873049788656544, 'spread_hl_frac': 0.008413515939828854, 'bb_std_mult': 3.297727540713333, 'rsi_os': 44, 'rsi_ob': 82, 'vol_spike': 0.26278357057228, 'adx_thresh': 15.142576801010787, 'atr_min_pct': 0.0028261863493100614, 'atr_max_pct': 0.09111506893775144, 'tp_mult': 1.0105633249604689, 'tsl_mult': 0.3263428018381405, 'strategy': 'breakout', 'time_stop': 30, 'use_sma': False, 'use_atr': True, 'use_adx': False, 'use_ema': False, 'use_spike': True, 'rsi_required': False, 'edge_k': 0.14325693279195267, 'edge_cap': 0.0651454764652829, 'bull_strategy': 'breakout', 'bull_bb_std_mult': 3.077994136748869, 'bull_rsi_os': 35, 'bull_rsi_ob': 76, 'bull_adx_thresh': 18.1225449175227, 'bull_atr_min_pct': 0.0037071720418205435, 'bull_atr_max_pct': 0.0522814592052306, 'bull_tp_mult': 2.8281284725126175, 'bull_tsl_mult': 0.4113502903865799, 'bull_time_stop': 177, 'bull_use_sma': True, 'bull_use_ema': False, 'bull_use_atr': True, 'bull_use_adx': False, 'bull_use_spike': True, 'bull_rsi_required': True, 'bear_strategy': 'breakout', 'bear_bb_std_mult': 2.9317075458603084, 'bear_rsi_os': 6, 'bear_rsi_ob': 80, 'bear_adx_thresh': 6.209695059925878, 'bear_atr_min_pct': 0.02499800634582365, 'bear_atr_max_pct': 0.031194054813317225, 'bear_tp_mult': 2.693054770274431, 'bear_tsl_mult': 0.35007724108096505, 'bear_time_stop': 142, 'bear_use_sma': False, 'bear_use_ema': True, 'bear_use_atr': True, 'bear_use_adx': True, 'bear_use_spike': False, 'bear_rsi_required': True, 'sideways_strategy': 'mean_reversion', 'sideways_bb_std_mult': 3.080638853803113, 'sideways_rsi_os': 32, 'sideways_rsi_ob': 59, 'sideways_adx_thresh': 11.20816229048707, 'sideways_atr_min_pct': 0.003959374431897001, 'sideways_atr_max_pct': 0.14752536447457928, 'sideways_tp_mult': 1.0862998052936634, 'sideways_tsl_mult': 0.5785256906263054, 'sideways_time_stop': 244, 'sideways_use_sma': True, 'sideways_use_ema': True, 'sideways_use_atr': False, 'sideways_use_adx': False, 'sideways_use_spike': False, 'sideways_rsi_required': True}.
[I 2025-08-30 20:09:32,013] Trial 880 finished with values: [-1000000000.0, 1000000000.0] and parameters: {'p_sma': 9, 'p_std': 31, 'p_atr': 8, 'p_adx': 14, 'rsi_period': 28, 'ema1': 10, 'ema2': 31, 'slip_atr_k': 0.19148036291782478, 'slip_spread_k': 0.11242892767142632, 'spread_hl_frac': 0.037154009951152756, 'bb_std_mult': 2.217069907346504, 'rsi_os': 41, 'rsi_ob': 82, 'vol_spike': 0.2656036175428863, 'adx_thresh': 31.797481538152066, 'atr_min_pct': 0.008436664072307008, 'atr_max_pct': 0.10297786986302661, 'tp_mult': 2.1092152317243085, 'tsl_mult': 0.5754255540574315, 'strategy': 'mean_reversion', 'time_stop': 186, 'use_sma': False, 'use_atr': False, 'use_adx': False, 'use_ema': True, 'use_spike': False, 'rsi_required': False, 'edge_k': 0.5953027335593573, 'edge_cap': 0.5500306626487219, 'bull_strategy': 'mean_reversion', 'bull_bb_std_mult': 3.0820983936965067, 'bull_rsi_os': 26, 'bull_rsi_ob': 61, 'bull_adx_thresh': 33.9852268913506, 'bull_atr_min_pct': 0.0036214406664881746, 'bull_atr_max_pct': 0.052778337195265035, 'bull_tp_mult': 2.855033614235661, 'bull_tsl_mult': 0.9999429627137475, 'bull_time_stop': 193, 'bull_use_sma': True, 'bull_use_ema': True, 'bull_use_atr': True, 'bull_use_adx': False, 'bull_use_spike': True, 'bull_rsi_required': True, 'bear_strategy': 'breakout', 'bear_bb_std_mult': 3.027270179871595, 'bear_rsi_os': 11, 'bear_rsi_ob': 76, 'bear_adx_thresh': 6.256722687270937, 'bear_atr_min_pct': 0.012836880258046789, 'bear_atr_max_pct': 0.11141036099458937, 'bear_tp_mult': 2.69579010651743, 'bear_tsl_mult': 0.7591345029461569, 'bear_time_stop': 296, 'bear_use_sma': False, 'bear_use_ema': True, 'bear_use_atr': True, 'bear_use_adx': False, 'bear_use_spike': False, 'bear_rsi_required': True, 'sideways_strategy': 'mean_reversion', 'sideways_bb_std_mult': 2.9628336425805544, 'sideways_rsi_os': 37, 'sideways_rsi_ob': 59, 'sideways_adx_thresh': 20.9053466210878, 'sideways_atr_min_pct': 0.004075932669518239, 'sideways_atr_max_pct': 0.1472237144728704, 'sideways_tp_mult': 1.6058179266156518, 'sideways_tsl_mult': 0.7352628155339354, 'sideways_time_stop': 149, 'sideways_use_sma': False, 'sideways_use_ema': True, 'sideways_use_atr': False, 'sideways_use_adx': False, 'sideways_use_spike': False, 'sideways_rsi_required': True}.
