[I 2025-08-30 19:53:37,246] Trial 739 finished with values: [-0.03042347537924328, 0.030450585128803817] and parameters: {'p_sma': 6, 'p_std': 54, 'p_atr': 9, 'p_adx': 28, 'rsi_period': 12, 'ema1': 19, 'ema2': 23, 'slip_atr_k': 0.18786563562843583, 'slip_spread_k': 0.8349618836140781, 'spread_hl_frac': 0.021159583938546625, 'bb_std_mult': 2.1660675126000384, 'rsi_os': 16, 'rsi_ob': 53, 'vol_spike': 0.2586437741337313, 'adx_thresh': 33.00352310371862, 'atr_min_pct': 0.014538102403716585, 'atr_max_pct': 0.09413114672089679, 'tp_mult': 2.3667575366932687, 'tsl_mult': 0.7576393486198338, 'strategy': 'mean_reversion', 'time_stop': 247, 'use_sma': False, 'use_atr': True, 'use_adx': True, 'use_ema': False, 'use_spike': True, 'rsi_required': False, 'edge_k': 0.06234977418265803, 'edge_cap': 0.45947078501750505, 'bull_strategy': 'mean_reversion', 'bull_bb_std_mult': 0.7852014436524029, 'bull_rsi_os': 15, 'bull_rsi_ob': 80, 'bull_adx_thresh': 15.222585040999224, 'bull_atr_min_pct': 0.01531177158971405, 'bull_atr_max_pct': 0.08018912729166028, 'bull_tp_mult': 1.366415866201125, 'bull_tsl_mult': 0.11987908145614318, 'bull_time_stop': 273, 'bull_use_sma': False, 'bull_use_ema': True, 'bull_use_atr': True, 'bull_use_adx': False, 'bull_use_spike': False, 'bull_rsi_required': True, 'bear_strategy': 'breakout', 'bear_bb_std_mult': 2.908856303493548, 'bear_rsi_os': 26, 'bear_rsi_ob': 74, 'bear_adx_thresh': 21.409499671879015, 'bear_atr_min_pct': 0.013612384210505899, 'bear_atr_max_pct': 0.10842370975278176, 'bear_tp_mult': 2.6437210435787746, 'bear_tsl_mult': 0.23065326268853426, 'bear_time_stop': 209, 'bear_use_sma': True, 'bear_use_ema': True, 'bear_use_atr': True, 'bear_use_adx': False, 'bear_use_spike': False, 'bear_rsi_required': True, 'sideways_strategy': 'breakout', 'sideways_bb_std_mult': 3.0100916675714844, 'sideways_rsi_os': 36, 'sideways_rsi_ob': 58, 'sideways_adx_thresh': 12.150089973128999, 'sideways_atr_min_pct': 0.0016711559434098512, 'sideways_atr_max_pct': 0.02478705573377788, 'sideways_tp_mult': 1.1189343705405983, 'sideways_tsl_mult': 0.3890776603211561, 'sideways_time_stop': 51, 'sideways_use_sma': False, 'sideways_use_ema': True, 'sideways_use_atr': True, 'sideways_use_adx': False, 'sideways_use_spike': False, 'sideways_rsi_required': True}.
[I 2025-08-30 19:53:37,488] Trial 738 finished with values: [-1000000000.0, 1000000000.0] and parameters: {'p_sma': 6, 'p_std': 12, 'p_atr': 9, 'p_adx': 21, 'rsi_period': 67, 'ema1': 27, 'ema2': 36, 'slip_atr_k': 0.18984019558705797, 'slip_spread_k': 0.13774899942461652, 'spread_hl_frac': 0.020925259645847658, 'bb_std_mult': 3.497523907929644, 'rsi_os': 42, 'rsi_ob': 53, 'vol_spike': 0.12930809835410256, 'adx_thresh': 25.70278515085122, 'atr_min_pct': 0.02372109480976839, 'atr_max_pct': 0.09415438768679005, 'tp_mult': 2.372517094247338, 'tsl_mult': 0.7512429078390748, 'strategy': 'mean_reversion', 'time_stop': 182, 'use_sma': False, 'use_atr': True, 'use_adx': True, 'use_ema': False, 'use_spike': True, 'rsi_required': False, 'edge_k': 0.0735050645848482, 'edge_cap': 0.35465257638286607, 'bull_strategy': 'mean_reversion', 'bull_bb_std_mult': 3.126933632501597, 'bull_rsi_os': 20, 'bull_rsi_ob': 46, 'bull_adx_thresh': 22.25318761577643, 'bull_atr_min_pct': 0.008050139532201718, 'bull_atr_max_pct': 0.12265852003448785, 'bull_tp_mult': 2.7200920322260873, 'bull_tsl_mult': 0.4914118970824327, 'bull_time_stop': 168, 'bull_use_sma': False, 'bull_use_ema': True, 'bull_use_atr': True, 'bull_use_adx': False, 'bull_use_spike': False, 'bull_rsi_required': True, 'bear_strategy': 'breakout', 'bear_bb_std_mult': 1.2101553476105238, 'bear_rsi_os': 11, 'bear_rsi_ob': 74, 'bear_adx_thresh': 17.874039640764273, 'bear_atr_min_pct': 0.014388441554730612, 'bear_atr_max_pct': 0.0954745751128207, 'bear_tp_mult': 2.901863490011495, 'bear_tsl_mult': 0.7793399095837159, 'bear_time_stop': 220, 'bear_use_sma': True, 'bear_use_ema': True, 'bear_use_atr': True, 'bear_use_adx': False, 'bear_use_spike': False, 'bear_rsi_required': True, 'sideways_strategy': 'breakout', 'sideways_bb_std_mult': 1.8200681852342957, 'sideways_rsi_os': 36, 'sideways_rsi_ob': 71, 'sideways_adx_thresh': 18.141192257795023, 'sideways_atr_min_pct': 0.02070690693495814, 'sideways_atr_max_pct': 0.022066400244096097, 'sideways_tp_mult': 1.0737355911283086, 'sideways_tsl_mult': 0.9572890553511771, 'sideways_time_stop': 49, 'sideways_use_sma': False, 'sideways_use_ema': True, 'sideways_use_atr': True, 'sideways_use_adx': False, 'sideways_use_spike': False, 'sideways_rsi_required': True}.
[I 2025-08-30 19:53:38,066] Trial 740 finished with values: [-1000000000.0, 1000000000.0] and parameters: {'p_sma': 42, 'p_std': 31, 'p_atr': 9, 'p_adx': 21, 'rsi_period': 26, 'ema1': 27, 'ema2': 36, 'slip_atr_k': 0.07580552354302356, 'slip_spread_k': 0.14654499056556458, 'spread_hl_frac': 0.02546524285675156, 'bb_std_mult': 2.2730046014366905, 'rsi_os': 17, 'rsi_ob': 64, 'vol_spike': 0.2647738684272013, 'adx_thresh': 32.99798455527514, 'atr_min_pct': 0.024660618939680638, 'atr_max_pct': 0.09386839250132227, 'tp_mult': 2.3684948975754154, 'tsl_mult': 0.8696047828740766, 'strategy': 'mean_reversion', 'time_stop': 152, 'use_sma': False, 'use_atr': True, 'use_adx': True, 'use_ema': False, 'use_spike': True, 'rsi_required': False, 'edge_k': 0.8857671286642738, 'edge_cap': 0.3818837349983112, 'bull_strategy': 'mean_reversion', 'bull_bb_std_mult': 1.459874561579998, 'bull_rsi_os': 29, 'bull_rsi_ob': 95, 'bull_adx_thresh': 10.972438772503953, 'bull_atr_min_pct': 0.009219675243749469, 'bull_atr_max_pct': 0.12325079759968927, 'bull_tp_mult': 2.7384867656147347, 'bull_tsl_mult': 0.17511507283131278, 'bull_time_stop': 168, 'bull_use_sma': False, 'bull_use_ema': True, 'bull_use_atr': True, 'bull_use_adx': False, 'bull_use_spike': False, 'bull_rsi_required': True, 'bear_strategy': 'breakout', 'bear_bb_std_mult': 1.159007782829983, 'bear_rsi_os': 49, 'bear_rsi_ob': 77, 'bear_adx_thresh': 20.408315548041998, 'bear_atr_min_pct': 0.014152634900380148, 'bear_atr_max_pct': 0.03941017151574455, 'bear_tp_mult': 1.8079492307977068, 'bear_tsl_mult': 0.7140807590162717, 'bear_time_stop': 127, 'bear_use_sma': True, 'bear_use_ema': True, 'bear_use_atr': True, 'bear_use_adx': False, 'bear_use_spike': False, 'bear_rsi_required': True, 'sideways_strategy': 'breakout', 'sideways_bb_std_mult': 1.037751716860958, 'sideways_rsi_os': 42, 'sideways_rsi_ob': 58, 'sideways_adx_thresh': 33.786717725991835, 'sideways_atr_min_pct': 0.02070419975226708, 'sideways_atr_max_pct': 0.0730892426698355, 'sideways_tp_mult': 1.1348907891178492, 'sideways_tsl_mult': 0.39093986165482975, 'sideways_time_stop': 16, 'sideways_use_sma': False, 'sideways_use_ema': True, 'sideways_use_atr': True, 'sideways_use_adx': False, 'sideways_use_spike': False, 'sideways_rsi_required': True}.
[I 2025-08-30 19:54:03,723] Trial 741 finished with values: [-1000000000.0, 1000000000.0] and parameters: {'p_sma': 6, 'p_std': 54, 'p_atr': 9, 'p_adx': 13, 'rsi_period': 23, 'ema1': 27, 'ema2': 16, 'slip_atr_k': 0.07437063761353663, 'slip_spread_k': 0.14707693145939943, 'spread_hl_frac': 0.02123495793341448, 'bb_std_mult': 2.265613144209054, 'rsi_os': 17, 'rsi_ob': 84, 'vol_spike': 0.2639296264930924, 'adx_thresh': 16.956483143148816, 'atr_min_pct': 0.0067835074109253764, 'atr_max_pct': 0.09500432101631445, 'tp_mult': 2.360805832683175, 'tsl_mult': 0.6889247393114267, 'strategy': 'mean_reversion', 'time_stop': 248, 'use_sma': False, 'use_atr': True, 'use_adx': True, 'use_ema': False, 'use_spike': True, 'rsi_required': False, 'edge_k': 0.8774489942933272, 'edge_cap': 0.2476165384288504, 'bull_strategy': 'mean_reversion', 'bull_bb_std_mult': 3.13385782751058, 'bull_rsi_os': 14, 'bull_rsi_ob': 48, 'bull_adx_thresh': 18.796119823165334, 'bull_atr_min_pct': 0.0010696679259740108, 'bull_atr_max_pct': 0.1233877799993588, 'bull_tp_mult': 2.3462066781843323, 'bull_tsl_mult': 0.5408390488015586, 'bull_time_stop': 168, 'bull_use_sma': False, 'bull_use_ema': False, 'bull_use_atr': True, 'bull_use_adx': False, 'bull_use_spike': True, 'bull_rsi_required': True, 'bear_strategy': 'breakout', 'bear_bb_std_mult': 2.9099429296151444, 'bear_rsi_os': 39, 'bear_rsi_ob': 77, 'bear_adx_thresh': 34.92971340470118, 'bear_atr_min_pct': 0.01356499546738369, 'bear_atr_max_pct': 0.04085534819494441, 'bear_tp_mult': 2.6827151988283586, 'bear_tsl_mult': 0.23247284110842453, 'bear_time_stop': 218, 'bear_use_sma': True, 'bear_use_ema': True, 'bear_use_atr': True, 'bear_use_adx': False, 'bear_use_spike': True, 'bear_rsi_required': True, 'sideways_strategy': 'mean_reversion', 'sideways_bb_std_mult': 3.389978982905106, 'sideways_rsi_os': 43, 'sideways_rsi_ob': 58, 'sideways_adx_thresh': 26.506325615909923, 'sideways_atr_min_pct': 0.0025963956345134045, 'sideways_atr_max_pct': 0.05481193748414268, 'sideways_tp_mult': 1.1245212889457699, 'sideways_tsl_mult': 0.9276352310293351, 'sideways_time_stop': 149, 'sideways_use_sma': False, 'sideways_use_ema': True, 'sideways_use_atr': True, 'sideways_use_adx': True, 'sideways_use_spike': False, 'sideways_rsi_required': True}.
[I 2025-08-30 19:54:12,566] Trial 742 finished with values: [-1000000000.0, 1000000000.0] and parameters: {'p_sma': 9, 'p_std': 31, 'p_atr': 7, 'p_adx': 20, 'rsi_period': 66, 'ema1': 27, 'ema2': 31, 'slip_atr_k': 0.07668392164267021, 'slip_spread_k': 0.14221826780243782, 'spread_hl_frac': 0.022673975632031385, 'bb_std_mult': 2.2598188695077104, 'rsi_os': 26, 'rsi_ob': 64, 'vol_spike': 0.26602572171138605, 'adx_thresh': 25.82089018098433, 'atr_min_pct': 0.024846701757257984, 'atr_max_pct': 0.05381588923412711, 'tp_mult': 2.425300499652765, 'tsl_mult': 0.9609728122134615, 'strategy': 'mean_reversion', 'time_stop': 111, 'use_sma': False, 'use_atr': False, 'use_adx': True, 'use_ema': True, 'use_spike': False, 'rsi_required': False, 'edge_k': 0.20242651816061474, 'edge_cap': 0.5517162541373145, 'bull_strategy': 'mean_reversion', 'bull_bb_std_mult': 3.1314520614001955, 'bull_rsi_os': 28, 'bull_rsi_ob': 95, 'bull_adx_thresh': 18.757589670490912, 'bull_atr_min_pct': 0.00878326991799203, 'bull_atr_max_pct': 0.12272491071317519, 'bull_tp_mult': 2.747577824640418, 'bull_tsl_mult': 0.5352750498776655, 'bull_time_stop': 173, 'bull_use_sma': True, 'bull_use_ema': False, 'bull_use_atr': True, 'bull_use_adx': False, 'bull_use_spike': True, 'bull_rsi_required': True, 'bear_strategy': 'mean_reversion', 'bear_bb_std_mult': 2.0955744718518936, 'bear_rsi_os': 30, 'bear_rsi_ob': 68, 'bear_adx_thresh': 19.20250143395948, 'bear_atr_min_pct': 0.014203129981550596, 'bear_atr_max_pct': 0.03815447209677635, 'bear_tp_mult': 1.8241423529121465, 'bear_tsl_mult': 0.8206173041595343, 'bear_time_stop': 265, 'bear_use_sma': True, 'bear_use_ema': True, 'bear_use_atr': True, 'bear_use_adx': False, 'bear_use_spike': True, 'bear_rsi_required': True, 'sideways_strategy': 'mean_reversion', 'sideways_bb_std_mult': 1.732464039753926, 'sideways_rsi_os': 42, 'sideways_rsi_ob': 60, 'sideways_adx_thresh': 33.938423519877134, 'sideways_atr_min_pct': 0.002600881380392481, 'sideways_atr_max_pct': 0.03962560382824353, 'sideways_tp_mult': 1.135306827315101, 'sideways_tsl_mult': 0.950946159952692, 'sideways_time_stop': 44, 'sideways_use_sma': True, 'sideways_use_ema': True, 'sideways_use_atr': False, 'sideways_use_adx': True, 'sideways_use_spike': False, 'sideways_rsi_required': True}.
[I 2025-08-30 19:54:13,093] Trial 743 finished with values: [-0.06109812272641124, 0.06108099314354211] and parameters: {'p_sma': 42, 'p_std': 5, 'p_atr': 7, 'p_adx': 20, 'rsi_period': 26, 'ema1': 26, 'ema2': 17, 'slip_atr_k': 0.16937866297788268, 'slip_spread_k': 0.09158308363134715, 'spread_hl_frac': 0.002744400836170984, 'bb_std_mult': 3.403239789873627, 'rsi_os': 47, 'rsi_ob': 84, 'vol_spike': 0.26579241606212795, 'adx_thresh': 33.52778639768029, 'atr_min_pct': 0.0014702810340347684, 'atr_max_pct': 0.08995448092486213, 'tp_mult': 1.5445472266274065, 'tsl_mult': 0.9497419322816802, 'strategy': 'mean_reversion', 'time_stop': 170, 'use_sma': False, 'use_atr': False, 'use_adx': True, 'use_ema': True, 'use_spike': False, 'rsi_required': False, 'edge_k': 0.9298559533486489, 'edge_cap': 0.5563931237760714, 'bull_strategy': 'mean_reversion', 'bull_bb_std_mult': 3.2192534287603456, 'bull_rsi_os': 46, 'bull_rsi_ob': 60, 'bull_adx_thresh': 10.627245181973349, 'bull_atr_min_pct': 3.258491044602998e-05, 'bull_atr_max_pct': 0.11914930521273807, 'bull_tp_mult': 2.752902545124753, 'bull_tsl_mult': 0.5380811352892143, 'bull_time_stop': 22, 'bull_use_sma': True, 'bull_use_ema': False, 'bull_use_atr': True, 'bull_use_adx': False, 'bull_use_spike': True, 'bull_rsi_required': True, 'bear_strategy': 'mean_reversion', 'bear_bb_std_mult': 2.975255459452889, 'bear_rsi_os': 22, 'bear_rsi_ob': 63, 'bear_adx_thresh': 28.998664085056035, 'bear_atr_min_pct': 0.015390057454437108, 'bear_atr_max_pct': 0.06856544521746412, 'bear_tp_mult': 2.2419696993343394, 'bear_tsl_mult': 0.721944230143112, 'bear_time_stop': 206, 'bear_use_sma': True, 'bear_use_ema': True, 'bear_use_atr': False, 'bear_use_adx': False, 'bear_use_spike': True, 'bear_rsi_required': True, 'sideways_strategy': 'mean_reversion', 'sideways_bb_std_mult': 3.4050853308054463, 'sideways_rsi_os': 39, 'sideways_rsi_ob': 60, 'sideways_adx_thresh': 20.291872579772164, 'sideways_atr_min_pct': 0.02544933100329292, 'sideways_atr_max_pct': 0.038630992275958134, 'sideways_tp_mult': 1.129435339492566, 'sideways_tsl_mult': 0.9343917550102422, 'sideways_time_stop': 218, 'sideways_use_sma': True, 'sideways_use_ema': True, 'sideways_use_atr': False, 'sideways_use_adx': True, 'sideways_use_spike': True, 'sideways_rsi_required': True}.
[I 2025-08-30 19:54:13,162] Trial 744 finished with values: [-0.024479697121255084, 0.024399765589087907] and parameters: {'p_sma': 35, 'p_std': 29, 'p_atr': 14, 'p_adx': 20, 'rsi_period': 42, 'ema1': 28, 'ema2': 31, 'slip_atr_k': 0.07162481868010125, 'slip_spread_k': 0.10062999642217144, 'spread_hl_frac': 0.022952719538034877, 'bb_std_mult': 2.1290488247159574, 'rsi_os': 14, 'rsi_ob': 84, 'vol_spike': 0.26614105838521396, 'adx_thresh': 16.85487017157349, 'atr_min_pct': 0.0068277317083149415, 'atr_max_pct': 0.03442294705003909, 'tp_mult': 1.8022487122166198, 'tsl_mult': 0.818657699609952, 'strategy': 'mean_reversion', 'time_stop': 111, 'use_sma': True, 'use_atr': False, 'use_adx': False, 'use_ema': True, 'use_spike': False, 'rsi_required': True, 'edge_k': 0.7952329551050071, 'edge_cap': 0.6652451271030047, 'bull_strategy': 'mean_reversion', 'bull_bb_std_mult': 3.1922611171828157, 'bull_rsi_os': 28, 'bull_rsi_ob': 78, 'bull_adx_thresh': 18.795323647063547, 'bull_atr_min_pct': 0.0012124407295204176, 'bull_atr_max_pct': 0.10942836134410924, 'bull_tp_mult': 2.3299966617638423, 'bull_tsl_mult': 0.5415697712645656, 'bull_time_stop': 177, 'bull_use_sma': True, 'bull_use_ema': False, 'bull_use_atr': True, 'bull_use_adx': True, 'bull_use_spike': True, 'bull_rsi_required': True, 'bear_strategy': 'mean_reversion', 'bear_bb_std_mult': 2.9846778073061566, 'bear_rsi_os': 38, 'bear_rsi_ob': 90, 'bear_adx_thresh': 19.229204943844834, 'bear_atr_min_pct': 0.015303603692172395, 'bear_atr_max_pct': 0.042146897045371653, 'bear_tp_mult': 2.7230116851751394, 'bear_tsl_mult': 0.7557500984149522, 'bear_time_stop': 276, 'bear_use_sma': True, 'bear_use_ema': False, 'bear_use_atr': False, 'bear_use_adx': False, 'bear_use_spike': True, 'bear_rsi_required': True, 'sideways_strategy': 'mean_reversion', 'sideways_bb_std_mult': 3.3913396883204, 'sideways_rsi_os': 34, 'sideways_rsi_ob': 82, 'sideways_adx_thresh': 20.243218747988088, 'sideways_atr_min_pct': 0.0036975794127654853, 'sideways_atr_max_pct': 0.13862361015568325, 'sideways_tp_mult': 1.0594924307274618, 'sideways_tsl_mult': 0.9329591483864937, 'sideways_time_stop': 216, 'sideways_use_sma': True, 'sideways_use_ema': True, 'sideways_use_atr': False, 'sideways_use_adx': True, 'sideways_use_spike': True, 'sideways_rsi_required': True}.
[I 2025-08-30 19:54:14,168] Trial 746 finished with values: [-1000000000.0, 1000000000.0] and parameters: {'p_sma': 51, 'p_std': 28, 'p_atr': 28, 'p_adx': 8, 'rsi_period': 32, 'ema1': 18, 'ema2': 29, 'slip_atr_k': 0.06674418590333525, 'slip_spread_k': 0.10164395471439658, 'spread_hl_frac': 0.007551014030774947, 'bb_std_mult': 1.8779717415192716, 'rsi_os': 45, 'rsi_ob': 48, 'vol_spike': 0.2476135889649122, 'adx_thresh': 6.74785350732458, 'atr_min_pct': 0.018276444497654608, 'atr_max_pct': 0.08993260137851458, 'tp_mult': 1.3728337136040203, 'tsl_mult': 0.8184656741437781, 'strategy': 'mean_reversion', 'time_stop': 221, 'use_sma': True, 'use_atr': False, 'use_adx': False, 'use_ema': True, 'use_spike': False, 'rsi_required': True, 'edge_k': 1.2387619964312688, 'edge_cap': 0.5125929550793056, 'bull_strategy': 'breakout', 'bull_bb_std_mult': 3.2034379826017974, 'bull_rsi_os': 32, 'bull_rsi_ob': 49, 'bull_adx_thresh': 16.982537373644785, 'bull_atr_min_pct': 5.048275280103301e-06, 'bull_atr_max_pct': 0.10852598567020684, 'bull_tp_mult': 1.9308009628482607, 'bull_tsl_mult': 0.5087971830802155, 'bull_time_stop': 176, 'bull_use_sma': True, 'bull_use_ema': True, 'bull_use_atr': True, 'bull_use_adx': True, 'bull_use_spike': False, 'bull_rsi_required': True, 'bear_strategy': 'mean_reversion', 'bear_bb_std_mult': 2.9828512734819013, 'bear_rsi_os': 51, 'bear_rsi_ob': 65, 'bear_adx_thresh': 7.677216816614555, 'bear_atr_min_pct': 0.007820039579659991, 'bear_atr_max_pct': 0.06849862522946411, 'bear_tp_mult': 1.7378341714729317, 'bear_tsl_mult': 0.760421629497719, 'bear_time_stop': 276, 'bear_use_sma': False, 'bear_use_ema': False, 'bear_use_atr': False, 'bear_use_adx': False, 'bear_use_spike': False, 'bear_rsi_required': True, 'sideways_strategy': 'breakout', 'sideways_bb_std_mult': 3.0924440523059653, 'sideways_rsi_os': 34, 'sideways_rsi_ob': 88, 'sideways_adx_thresh': 20.607506435888823, 'sideways_atr_min_pct': 0.0036061638455400346, 'sideways_atr_max_pct': 0.1426272726285844, 'sideways_tp_mult': 1.051653277121008, 'sideways_tsl_mult': 0.5362766233158324, 'sideways_time_stop': 154, 'sideways_use_sma': True, 'sideways_use_ema': True, 'sideways_use_atr': False, 'sideways_use_adx': False, 'sideways_use_spike': True, 'sideways_rsi_required': True}.
[I 2025-08-30 19:54:41,573] Trial 745 finished with values: [-0.037242861959650875, 0.037282494274694204] and parameters: {'p_sma': 53, 'p_std': 28, 'p_atr': 7, 'p_adx': 20, 'rsi_period': 20, 'ema1': 26, 'ema2': 31, 'slip_atr_k': 0.06763241074153364, 'slip_spread_k': 0.7139073840633284, 'spread_hl_frac': 0.007725539030294305, 'bb_std_mult': 3.372342139103471, 'rsi_os': 12, 'rsi_ob': 82, 'vol_spike': 0.14570697456465992, 'adx_thresh': 33.47794728670448, 'atr_min_pct': 0.0160286743516336, 'atr_max_pct': 0.07987093673546475, 'tp_mult': 2.188549669948418, 'tsl_mult': 0.021078446340942192, 'strategy': 'mean_reversion', 'time_stop': 112, 'use_sma': True, 'use_atr': False, 'use_adx': False, 'use_ema': True, 'use_spike': False, 'rsi_required': True, 'edge_k': 0.217465066555167, 'edge_cap': 0.5135589508347785, 'bull_strategy': 'mean_reversion', 'bull_bb_std_mult': 1.0249033594534176, 'bull_rsi_os': 28, 'bull_rsi_ob': 78, 'bull_adx_thresh': 16.906126787738085, 'bull_atr_min_pct': 0.002705127613861102, 'bull_atr_max_pct': 0.11893636826717095, 'bull_tp_mult': 2.435008065849561, 'bull_tsl_mult': 0.522773851255142, 'bull_time_stop': 177, 'bull_use_sma': True, 'bull_use_ema': False, 'bull_use_atr': True, 'bull_use_adx': True, 'bull_use_spike': True, 'bull_rsi_required': True, 'bear_strategy': 'mean_reversion', 'bear_bb_std_mult': 0.6277314190897907, 'bear_rsi_os': 22, 'bear_rsi_ob': 65, 'bear_adx_thresh': 7.4629079913467375, 'bear_atr_min_pct': 0.0031256436116917276, 'bear_atr_max_pct': 0.03193798785483903, 'bear_tp_mult': 1.751468988473722, 'bear_tsl_mult': 0.7485829049578695, 'bear_time_stop': 278, 'bear_use_sma': False, 'bear_use_ema': False, 'bear_use_atr': False, 'bear_use_adx': False, 'bear_use_spike': True, 'bear_rsi_required': True, 'sideways_strategy': 'mean_reversion', 'sideways_bb_std_mult': 2.001248522430934, 'sideways_rsi_os': 34, 'sideways_rsi_ob': 60, 'sideways_adx_thresh': 20.462394633797516, 'sideways_atr_min_pct': 0.004001094053084304, 'sideways_atr_max_pct': 0.14221341352949018, 'sideways_tp_mult': 2.6424349004728667, 'sideways_tsl_mult': 0.9542172632311233, 'sideways_time_stop': 93, 'sideways_use_sma': True, 'sideways_use_ema': True, 'sideways_use_atr': False, 'sideways_use_adx': True, 'sideways_use_spike': True, 'sideways_rsi_required': True}.
