[I 2025-08-30 19:40:16,436] Trial 623 finished with values: [-1000000000.0, 1000000000.0] and parameters: {'p_sma': 28, 'p_std': 29, 'p_atr': 8, 'p_adx': 30, 'rsi_period': 28, 'ema1': 28, 'ema2': 35, 'slip_atr_k': 0.16293445032425397, 'slip_spread_k': 0.13903291028118323, 'spread_hl_frac': 0.02200490374233167, 'bb_std_mult': 1.1245205228566966, 'rsi_os': 27, 'rsi_ob': 51, 'vol_spike': 0.23813905582714523, 'adx_thresh': 33.85379632732948, 'atr_min_pct': 0.023223663285687667, 'atr_max_pct': 0.09699356760715078, 'tp_mult': 2.3893745067978163, 'tsl_mult': 0.8405628117956214, 'strategy': 'mean_reversion', 'time_stop': 192, 'use_sma': True, 'use_atr': True, 'use_adx': True, 'use_ema': False, 'use_spike': True, 'rsi_required': False, 'edge_k': 0.13758043891749513, 'edge_cap': 0.5202039908589703, 'bull_strategy': 'breakout', 'bull_bb_std_mult': 2.9891371065996624, 'bull_rsi_os': 35, 'bull_rsi_ob': 46, 'bull_adx_thresh': 12.796753333875873, 'bull_atr_min_pct': 0.0009459172820595273, 'bull_atr_max_pct': 0.12518650692062133, 'bull_tp_mult': 2.7224685386810017, 'bull_tsl_mult': 0.6755919159392878, 'bull_time_stop': 27, 'bull_use_sma': False, 'bull_use_ema': True, 'bull_use_atr': True, 'bull_use_adx': True, 'bull_use_spike': False, 'bull_rsi_required': False, 'bear_strategy': 'breakout', 'bear_bb_std_mult': 3.282243230657362, 'bear_rsi_os': 53, 'bear_rsi_ob': 75, 'bear_adx_thresh': 17.20993733260828, 'bear_atr_min_pct': 0.026463233797589178, 'bear_atr_max_pct': 0.04173262243186551, 'bear_tp_mult': 1.0446919999623918, 'bear_tsl_mult': 0.7871413329381295, 'bear_time_stop': 215, 'bear_use_sma': True, 'bear_use_ema': False, 'bear_use_atr': True, 'bear_use_adx': False, 'bear_use_spike': True, 'bear_rsi_required': True, 'sideways_strategy': 'mean_reversion', 'sideways_bb_std_mult': 1.1437575382605651, 'sideways_rsi_os': 19, 'sideways_rsi_ob': 86, 'sideways_adx_thresh': 25.156449149731028, 'sideways_atr_min_pct': 0.025212601783061388, 'sideways_atr_max_pct': 0.13962179551783865, 'sideways_tp_mult': 1.121265749752095, 'sideways_tsl_mult': 0.9409120997620383, 'sideways_time_stop': 180, 'sideways_use_sma': False, 'sideways_use_ema': False, 'sideways_use_atr': True, 'sideways_use_adx': False, 'sideways_use_spike': True, 'sideways_rsi_required': False}.
[I 2025-08-30 19:40:16,761] Trial 622 finished with values: [-1000000000.0, 1000000000.0] and parameters: {'p_sma': 43, 'p_std': 29, 'p_atr': 8, 'p_adx': 19, 'rsi_period': 57, 'ema1': 28, 'ema2': 44, 'slip_atr_k': 0.16425221649025426, 'slip_spread_k': 0.4658016610896441, 'spread_hl_frac': 0.02253110663541027, 'bb_std_mult': 1.1318963930488228, 'rsi_os': 49, 'rsi_ob': 82, 'vol_spike': 0.0504766831754007, 'adx_thresh': 33.76422443760045, 'atr_min_pct': 0.023000024726731093, 'atr_max_pct': 0.0963536256894409, 'tp_mult': 2.1754839255214082, 'tsl_mult': 0.7791979012129904, 'strategy': 'mean_reversion', 'time_stop': 192, 'use_sma': True, 'use_atr': True, 'use_adx': True, 'use_ema': False, 'use_spike': True, 'rsi_required': False, 'edge_k': 0.06720579723378248, 'edge_cap': 0.2650784869923356, 'bull_strategy': 'breakout', 'bull_bb_std_mult': 2.5843011007590286, 'bull_rsi_os': 35, 'bull_rsi_ob': 46, 'bull_adx_thresh': 6.796070054671947, 'bull_atr_min_pct': 0.0010470479850477495, 'bull_atr_max_pct': 0.028346965716505627, 'bull_tp_mult': 2.733969792187224, 'bull_tsl_mult': 0.5464379895484052, 'bull_time_stop': 39, 'bull_use_sma': False, 'bull_use_ema': True, 'bull_use_atr': True, 'bull_use_adx': False, 'bull_use_spike': False, 'bull_rsi_required': True, 'bear_strategy': 'breakout', 'bear_bb_std_mult': 3.3003935097237243, 'bear_rsi_os': 52, 'bear_rsi_ob': 77, 'bear_adx_thresh': 27.924081777308857, 'bear_atr_min_pct': 0.026526641253183894, 'bear_atr_max_pct': 0.03205138804649824, 'bear_tp_mult': 2.587116610279622, 'bear_tsl_mult': 0.788420735959604, 'bear_time_stop': 202, 'bear_use_sma': True, 'bear_use_ema': True, 'bear_use_atr': True, 'bear_use_adx': False, 'bear_use_spike': True, 'bear_rsi_required': True, 'sideways_strategy': 'mean_reversion', 'sideways_bb_std_mult': 3.2729262917878046, 'sideways_rsi_os': 38, 'sideways_rsi_ob': 57, 'sideways_adx_thresh': 20.943785504030025, 'sideways_atr_min_pct': 0.024785599609082748, 'sideways_atr_max_pct': 0.044283765483584446, 'sideways_tp_mult': 1.1181589570499388, 'sideways_tsl_mult': 0.9530124577132026, 'sideways_time_stop': 152, 'sideways_use_sma': False, 'sideways_use_ema': True, 'sideways_use_atr': True, 'sideways_use_adx': False, 'sideways_use_spike': True, 'sideways_rsi_required': True}.
[I 2025-08-30 19:40:16,929] Trial 620 finished with values: [-0.02718345094541108, 0.027158919001536868] and parameters: {'p_sma': 28, 'p_std': 29, 'p_atr': 8, 'p_adx': 19, 'rsi_period': 28, 'ema1': 28, 'ema2': 33, 'slip_atr_k': 0.07250073180669685, 'slip_spread_k': 0.45618102397494914, 'spread_hl_frac': 0.019929016094679536, 'bb_std_mult': 0.869345145032359, 'rsi_os': 27, 'rsi_ob': 82, 'vol_spike': 0.1647571484875001, 'adx_thresh': 17.916974772878415, 'atr_min_pct': 0.010781007002664857, 'atr_max_pct': 0.0969933132838221, 'tp_mult': 1.6210207514249904, 'tsl_mult': 0.795080150350143, 'strategy': 'mean_reversion', 'time_stop': 179, 'use_sma': False, 'use_atr': True, 'use_adx': True, 'use_ema': False, 'use_spike': True, 'rsi_required': False, 'edge_k': 1.0273535762571797, 'edge_cap': 0.37976961137050275, 'bull_strategy': 'mean_reversion', 'bull_bb_std_mult': 2.222145567650298, 'bull_rsi_os': 35, 'bull_rsi_ob': 46, 'bull_adx_thresh': 17.847786715904064, 'bull_atr_min_pct': 0.0026964409871469376, 'bull_atr_max_pct': 0.023009741558545002, 'bull_tp_mult': 2.2878791738527164, 'bull_tsl_mult': 0.3221269711072288, 'bull_time_stop': 24, 'bull_use_sma': False, 'bull_use_ema': True, 'bull_use_atr': True, 'bull_use_adx': False, 'bull_use_spike': False, 'bull_rsi_required': True, 'bear_strategy': 'breakout', 'bear_bb_std_mult': 3.282795705439017, 'bear_rsi_os': 10, 'bear_rsi_ob': 77, 'bear_adx_thresh': 12.845158762906436, 'bear_atr_min_pct': 0.02233768168279944, 'bear_atr_max_pct': 0.13462951102043152, 'bear_tp_mult': 1.0301456755582143, 'bear_tsl_mult': 0.7640746811642156, 'bear_time_stop': 28, 'bear_use_sma': True, 'bear_use_ema': True, 'bear_use_atr': False, 'bear_use_adx': False, 'bear_use_spike': True, 'bear_rsi_required': True, 'sideways_strategy': 'breakout', 'sideways_bb_std_mult': 3.2662426427799143, 'sideways_rsi_os': 38, 'sideways_rsi_ob': 50, 'sideways_adx_thresh': 17.86989137382008, 'sideways_atr_min_pct': 0.0026384945216709533, 'sideways_atr_max_pct': 0.1283615651424806, 'sideways_tp_mult': 1.1212990904408733, 'sideways_tsl_mult': 0.9546648134440758, 'sideways_time_stop': 205, 'sideways_use_sma': False, 'sideways_use_ema': True, 'sideways_use_atr': True, 'sideways_use_adx': False, 'sideways_use_spike': False, 'sideways_rsi_required': True}.
[I 2025-08-30 19:40:51,797] Trial 626 finished with values: [-1000000000.0, 1000000000.0] and parameters: {'p_sma': 7, 'p_std': 32, 'p_atr': 15, 'p_adx': 7, 'rsi_period': 21, 'ema1': 23, 'ema2': 33, 'slip_atr_k': 0.060332020511387266, 'slip_spread_k': 0.20129676366865107, 'spread_hl_frac': 0.025938895714435348, 'bb_std_mult': 2.154055761916463, 'rsi_os': 48, 'rsi_ob': 84, 'vol_spike': 0.1627741711881124, 'adx_thresh': 16.51535836985214, 'atr_min_pct': 0.02374531852879719, 'atr_max_pct': 0.07040117212478389, 'tp_mult': 2.2981882938859863, 'tsl_mult': 0.024063799336124236, 'strategy': 'mean_reversion', 'time_stop': 184, 'use_sma': False, 'use_atr': False, 'use_adx': True, 'use_ema': True, 'use_spike': True, 'rsi_required': False, 'edge_k': 0.04094224312297766, 'edge_cap': 0.4433791015139264, 'bull_strategy': 'mean_reversion', 'bull_bb_std_mult': 2.475364138400695, 'bull_rsi_os': 28, 'bull_rsi_ob': 77, 'bull_adx_thresh': 17.551527399682556, 'bull_atr_min_pct': 0.004661592295782151, 'bull_atr_max_pct': 0.12268163921903236, 'bull_tp_mult': 2.8645080807415217, 'bull_tsl_mult': 0.8453965934685952, 'bull_time_stop': 217, 'bull_use_sma': True, 'bull_use_ema': True, 'bull_use_atr': False, 'bull_use_adx': False, 'bull_use_spike': True, 'bull_rsi_required': False, 'bear_strategy': 'breakout', 'bear_bb_std_mult': 3.211771802327977, 'bear_rsi_os': 44, 'bear_rsi_ob': 85, 'bear_adx_thresh': 26.822438406177945, 'bear_atr_min_pct': 0.015815309784512892, 'bear_atr_max_pct': 0.03815675922504273, 'bear_tp_mult': 1.744982260803555, 'bear_tsl_mult': 0.7221981226247972, 'bear_time_stop': 182, 'bear_use_sma': False, 'bear_use_ema': True, 'bear_use_atr': False, 'bear_use_adx': False, 'bear_use_spike': False, 'bear_rsi_required': True, 'sideways_strategy': 'breakout', 'sideways_bb_std_mult': 3.1092460593710234, 'sideways_rsi_os': 33, 'sideways_rsi_ob': 95, 'sideways_adx_thresh': 20.1621663694508, 'sideways_atr_min_pct': 0.016781391560586625, 'sideways_atr_max_pct': 0.14092652080857015, 'sideways_tp_mult': 1.0858693445106684, 'sideways_tsl_mult': 0.6985751368511524, 'sideways_time_stop': 187, 'sideways_use_sma': False, 'sideways_use_ema': False, 'sideways_use_atr': True, 'sideways_use_adx': True, 'sideways_use_spike': False, 'sideways_rsi_required': True}.
[I 2025-08-30 19:40:52,604] Trial 627 finished with values: [-1000000000.0, 1000000000.0] and parameters: {'p_sma': 22, 'p_std': 32, 'p_atr': 21, 'p_adx': 21, 'rsi_period': 17, 'ema1': 26, 'ema2': 33, 'slip_atr_k': 0.10110073859872722, 'slip_spread_k': 0.19582649172021785, 'spread_hl_frac': 0.027001620707861967, 'bb_std_mult': 2.131999245743781, 'rsi_os': 13, 'rsi_ob': 85, 'vol_spike': 0.2823701528503422, 'adx_thresh': 34.48144279418764, 'atr_min_pct': 0.02630316170600685, 'atr_max_pct': 0.10598666173015492, 'tp_mult': 2.9982899849020415, 'tsl_mult': 0.4063370771396425, 'strategy': 'mean_reversion', 'time_stop': 146, 'use_sma': False, 'use_atr': False, 'use_adx': True, 'use_ema': True, 'use_spike': True, 'rsi_required': True, 'edge_k': 1.127945304498139, 'edge_cap': 0.7730944472589406, 'bull_strategy': 'mean_reversion', 'bull_bb_std_mult': 3.098637018203217, 'bull_rsi_os': 34, 'bull_rsi_ob': 90, 'bull_adx_thresh': 18.56190772911748, 'bull_atr_min_pct': 0.004823011047920114, 'bull_atr_max_pct': 0.133744722629767, 'bull_tp_mult': 2.8637012732825675, 'bull_tsl_mult': 0.5944289276510157, 'bull_time_stop': 13, 'bull_use_sma': True, 'bull_use_ema': True, 'bull_use_atr': False, 'bull_use_adx': True, 'bull_use_spike': True, 'bull_rsi_required': False, 'bear_strategy': 'breakout', 'bear_bb_std_mult': 2.0615457811790416, 'bear_rsi_os': 50, 'bear_rsi_ob': 75, 'bear_adx_thresh': 18.446645248212697, 'bear_atr_min_pct': 0.016181578035945818, 'bear_atr_max_pct': 0.08579144923590823, 'bear_tp_mult': 2.6953355623003947, 'bear_tsl_mult': 0.7296656894121221, 'bear_time_stop': 184, 'bear_use_sma': False, 'bear_use_ema': False, 'bear_use_atr': False, 'bear_use_adx': False, 'bear_use_spike': False, 'bear_rsi_required': False, 'sideways_strategy': 'breakout', 'sideways_bb_std_mult': 1.8184786718663515, 'sideways_rsi_os': 33, 'sideways_rsi_ob': 60, 'sideways_adx_thresh': 34.190806638972084, 'sideways_atr_min_pct': 0.02934879721730349, 'sideways_atr_max_pct': 0.14071146412475358, 'sideways_tp_mult': 2.2296814510592715, 'sideways_tsl_mult': 0.4526995969595886, 'sideways_time_stop': 148, 'sideways_use_sma': False, 'sideways_use_ema': False, 'sideways_use_atr': True, 'sideways_use_adx': True, 'sideways_use_spike': False, 'sideways_rsi_required': False}.
[I 2025-08-30 19:40:52,857] Trial 624 finished with values: [-1000000000.0, 1000000000.0] and parameters: {'p_sma': 30, 'p_std': 32, 'p_atr': 21, 'p_adx': 21, 'rsi_period': 11, 'ema1': 23, 'ema2': 60, 'slip_atr_k': 0.07879687395222848, 'slip_spread_k': 0.8542546062719665, 'spread_hl_frac': 0.027332464332984432, 'bb_std_mult': 1.6567287718590862, 'rsi_os': 22, 'rsi_ob': 72, 'vol_spike': 0.0831015839599801, 'adx_thresh': 33.74347820843442, 'atr_min_pct': 0.02313783944686175, 'atr_max_pct': 0.10049071150512892, 'tp_mult': 2.2935258961134615, 'tsl_mult': 0.642054447002193, 'strategy': 'mean_reversion', 'time_stop': 191, 'use_sma': True, 'use_atr': True, 'use_adx': True, 'use_ema': True, 'use_spike': True, 'rsi_required': False, 'edge_k': 0.0626574896001279, 'edge_cap': 0.5136291719324475, 'bull_strategy': 'breakout', 'bull_bb_std_mult': 2.5840202319111687, 'bull_rsi_os': 36, 'bull_rsi_ob': 46, 'bull_adx_thresh': 12.951857666093371, 'bull_atr_min_pct': 0.028239747057189565, 'bull_atr_max_pct': 0.0313521977285989, 'bull_tp_mult': 2.2913335235631775, 'bull_tsl_mult': 0.5931542102365945, 'bull_time_stop': 196, 'bull_use_sma': False, 'bull_use_ema': True, 'bull_use_atr': False, 'bull_use_adx': True, 'bull_use_spike': False, 'bull_rsi_required': False, 'bear_strategy': 'breakout', 'bear_bb_std_mult': 3.2944039503481215, 'bear_rsi_os': 44, 'bear_rsi_ob': 75, 'bear_adx_thresh': 26.812192556694903, 'bear_atr_min_pct': 0.026440686502299124, 'bear_atr_max_pct': 0.03958526754767803, 'bear_tp_mult': 2.42948230851303, 'bear_tsl_mult': 0.7305999637524885, 'bear_time_stop': 202, 'bear_use_sma': True, 'bear_use_ema': False, 'bear_use_atr': True, 'bear_use_adx': False, 'bear_use_spike': False, 'bear_rsi_required': True, 'sideways_strategy': 'breakout', 'sideways_bb_std_mult': 3.2673458914020754, 'sideways_rsi_os': 33, 'sideways_rsi_ob': 95, 'sideways_adx_thresh': 11.681886063428296, 'sideways_atr_min_pct': 0.029331776738827454, 'sideways_atr_max_pct': 0.126375294250067, 'sideways_tp_mult': 1.2992465355841747, 'sideways_tsl_mult': 0.45466329743033673, 'sideways_time_stop': 186, 'sideways_use_sma': False, 'sideways_use_ema': False, 'sideways_use_atr': True, 'sideways_use_adx': True, 'sideways_use_spike': True, 'sideways_rsi_required': False}.
[I 2025-08-30 19:40:53,261] Trial 625 finished with values: [-1000000000.0, 1000000000.0] and parameters: {'p_sma': 8, 'p_std': 26, 'p_atr': 8, 'p_adx': 19, 'rsi_period': 10, 'ema1': 23, 'ema2': 33, 'slip_atr_k': 0.05908839159388005, 'slip_spread_k': 0.24325088704106249, 'spread_hl_frac': 0.027240410024663278, 'bb_std_mult': 2.1520864265072195, 'rsi_os': 7, 'rsi_ob': 85, 'vol_spike': 0.28260597878155724, 'adx_thresh': 10.637001916067398, 'atr_min_pct': 0.010637549059898468, 'atr_max_pct': 0.10038267254820535, 'tp_mult': 2.28677500680158, 'tsl_mult': 0.42742085140560787, 'strategy': 'mean_reversion', 'time_stop': 184, 'use_sma': False, 'use_atr': False, 'use_adx': True, 'use_ema': True, 'use_spike': True, 'rsi_required': False, 'edge_k': 0.07003215979087571, 'edge_cap': 0.5092217733859824, 'bull_strategy': 'mean_reversion', 'bull_bb_std_mult': 1.7375398027060744, 'bull_rsi_os': 36, 'bull_rsi_ob': 90, 'bull_adx_thresh': 17.385687611646013, 'bull_atr_min_pct': 0.002810162852575431, 'bull_atr_max_pct': 0.1340881159466548, 'bull_tp_mult': 1.2479798299844922, 'bull_tsl_mult': 0.6457226067938755, 'bull_time_stop': 180, 'bull_use_sma': True, 'bull_use_ema': True, 'bull_use_atr': False, 'bull_use_adx': False, 'bull_use_spike': True, 'bull_rsi_required': True, 'bear_strategy': 'breakout', 'bear_bb_std_mult': 2.047976228068746, 'bear_rsi_os': 16, 'bear_rsi_ob': 76, 'bear_adx_thresh': 18.521200207850743, 'bear_atr_min_pct': 0.01431615264731398, 'bear_atr_max_pct': 0.032355059983636726, 'bear_tp_mult': 2.581762343113269, 'bear_tsl_mult': 0.7298681107882243, 'bear_time_stop': 203, 'bear_use_sma': True, 'bear_use_ema': True, 'bear_use_atr': True, 'bear_use_adx': False, 'bear_use_spike': False, 'bear_rsi_required': True, 'sideways_strategy': 'breakout', 'sideways_bb_std_mult': 2.053486412404699, 'sideways_rsi_os': 33, 'sideways_rsi_ob': 70, 'sideways_adx_thresh': 11.594853926741838, 'sideways_atr_min_pct': 0.027194323603151938, 'sideways_atr_max_pct': 0.14051291020742254, 'sideways_tp_mult': 1.0834738972232956, 'sideways_tsl_mult': 0.6572270008875909, 'sideways_time_stop': 187, 'sideways_use_sma': False, 'sideways_use_ema': True, 'sideways_use_atr': True, 'sideways_use_adx': True, 'sideways_use_spike': False, 'sideways_rsi_required': True}.
[I 2025-08-30 19:40:54,145] Trial 628 finished with values: [-1000000000.0, 1000000000.0] and parameters: {'p_sma': 23, 'p_std': 5, 'p_atr': 10, 'p_adx': 21, 'rsi_period': 10, 'ema1': 22, 'ema2': 32, 'slip_atr_k': 0.07943372315241834, 'slip_spread_k': 0.09875771749397239, 'spread_hl_frac': 0.02740047192480671, 'bb_std_mult': 1.7844381005384056, 'rsi_os': 52, 'rsi_ob': 46, 'vol_spike': 0.08276438747496812, 'adx_thresh': 34.43263013173874, 'atr_min_pct': 0.025865376318819577, 'atr_max_pct': 0.10096582780990218, 'tp_mult': 2.9703932679596083, 'tsl_mult': 0.0013820618070942148, 'strategy': 'mean_reversion', 'time_stop': 205, 'use_sma': False, 'use_atr': True, 'use_adx': True, 'use_ema': True, 'use_spike': False, 'rsi_required': True, 'edge_k': 1.1310594469495725, 'edge_cap': 0.9636885495369982, 'bull_strategy': 'mean_reversion', 'bull_bb_std_mult': 1.499183324872981, 'bull_rsi_os': 28, 'bull_rsi_ob': 45, 'bull_adx_thresh': 33.90127673051123, 'bull_atr_min_pct': 0.02135504667124749, 'bull_atr_max_pct': 0.11588538599829798, 'bull_tp_mult': 1.1358612030804034, 'bull_tsl_mult': 0.6058345014634254, 'bull_time_stop': 180, 'bull_use_sma': False, 'bull_use_ema': True, 'bull_use_atr': False, 'bull_use_adx': True, 'bull_use_spike': False, 'bull_rsi_required': True, 'bear_strategy': 'breakout', 'bear_bb_std_mult': 2.9556578945639846, 'bear_rsi_os': 50, 'bear_rsi_ob': 75, 'bear_adx_thresh': 18.54132985249768, 'bear_atr_min_pct': 0.01447681584112283, 'bear_atr_max_pct': 0.030330833709219806, 'bear_tp_mult': 2.6849652024031285, 'bear_tsl_mult': 0.7399442904438205, 'bear_time_stop': 199, 'bear_use_sma': True, 'bear_use_ema': False, 'bear_use_atr': False, 'bear_use_adx': False, 'bear_use_spike': False, 'bear_rsi_required': False, 'sideways_strategy': 'breakout', 'sideways_bb_std_mult': 2.7379869497596943, 'sideways_rsi_os': 35, 'sideways_rsi_ob': 93, 'sideways_adx_thresh': 11.756321961317333, 'sideways_atr_min_pct': 0.003859684250787719, 'sideways_atr_max_pct': 0.10793083984446993, 'sideways_tp_mult': 1.1933551236923594, 'sideways_tsl_mult': 0.999848413242831, 'sideways_time_stop': 156, 'sideways_use_sma': False, 'sideways_use_ema': True, 'sideways_use_atr': True, 'sideways_use_adx': True, 'sideways_use_spike': False, 'sideways_rsi_required': False}.
[I 2025-08-30 19:41:25,769] Trial 629 finished with values: [-1000000000.0, 1000000000.0] and parameters: {'p_sma': 37, 'p_std': 27, 'p_atr': 25, 'p_adx': 20, 'rsi_period': 38, 'ema1': 16, 'ema2': 36, 'slip_atr_k': 0.08173116025624168, 'slip_spread_k': 0.5583320340878721, 'spread_hl_frac': 0.02459769276933886, 'bb_std_mult': 3.1929708534449883, 'rsi_os': 50, 'rsi_ob': 74, 'vol_spike': 0.15514168623505747, 'adx_thresh': 24.59148232386872, 'atr_min_pct': 0.024137234302334526, 'atr_max_pct': 0.10092430868986606, 'tp_mult': 2.7031595482408295, 'tsl_mult': 0.6370217250398924, 'strategy': 'breakout', 'time_stop': 171, 'use_sma': True, 'use_atr': True, 'use_adx': False, 'use_ema': False, 'use_spike': False, 'rsi_required': False, 'edge_k': 0.130937609967167, 'edge_cap': 0.9128623159644995, 'bull_strategy': 'breakout', 'bull_bb_std_mult': 3.192245150054365, 'bull_rsi_os': 11, 'bull_rsi_ob': 54, 'bull_adx_thresh': 21.19369988919555, 'bull_atr_min_pct': 0.001880018383358516, 'bull_atr_max_pct': 0.012984166007637854, 'bull_tp_mult': 2.6157140381289237, 'bull_tsl_mult': 0.3671693427055904, 'bull_time_stop': 181, 'bull_use_sma': False, 'bull_use_ema': True, 'bull_use_atr': True, 'bull_use_adx': False, 'bull_use_spike': False, 'bull_rsi_required': True, 'bear_strategy': 'mean_reversion', 'bear_bb_std_mult': 2.969289083102873, 'bear_rsi_os': 41, 'bear_rsi_ob': 83, 'bear_adx_thresh': 17.579913747180054, 'bear_atr_min_pct': 0.0025531913430989605, 'bear_atr_max_pct': 0.03405540349941144, 'bear_tp_mult': 2.4379350882961703, 'bear_tsl_mult': 0.7379119334972942, 'bear_time_stop': 292, 'bear_use_sma': True, 'bear_use_ema': True, 'bear_use_atr': True, 'bear_use_adx': True, 'bear_use_spike': False, 'bear_rsi_required': True, 'sideways_strategy': 'breakout', 'sideways_bb_std_mult': 2.0643698112521087, 'sideways_rsi_os': 35, 'sideways_rsi_ob': 59, 'sideways_adx_thresh': 29.114831807900092, 'sideways_atr_min_pct': 0.013432725839930265, 'sideways_atr_max_pct': 0.14578185496189866, 'sideways_tp_mult': 1.1673648568020853, 'sideways_tsl_mult': 0.9997620919349582, 'sideways_time_stop': 158, 'sideways_use_sma': False, 'sideways_use_ema': True, 'sideways_use_atr': True, 'sideways_use_adx': False, 'sideways_use_spike': False, 'sideways_rsi_required': True}.
