[I 2025-08-30 20:07:45,839] Trial 865 finished with values: [-1000000000.0, 1000000000.0] and parameters: {'p_sma': 8, 'p_std': 26, 'p_atr': 9, 'p_adx': 20, 'rsi_period': 65, 'ema1': 25, 'ema2': 34, 'slip_atr_k': 0.03573752339074557, 'slip_spread_k': 0.2420429496407513, 'spread_hl_frac': 0.02364014546049093, 'bb_std_mult': 1.9271427614016052, 'rsi_os': 51, 'rsi_ob': 77, 'vol_spike': 0.13030810571848664, 'adx_thresh': 17.8187541644138, 'atr_min_pct': 0.02438648020063009, 'atr_max_pct': 0.09452690898589028, 'tp_mult': 1.742922001724264, 'tsl_mult': 0.8752528692989202, 'strategy': 'mean_reversion', 'time_stop': 284, 'use_sma': False, 'use_atr': False, 'use_adx': False, 'use_ema': True, 'use_spike': False, 'rsi_required': False, 'edge_k': 0.043784142113779276, 'edge_cap': 0.7036112835740053, 'bull_strategy': 'mean_reversion', 'bull_bb_std_mult': 2.6911051711377665, 'bull_rsi_os': 30, 'bull_rsi_ob': 46, 'bull_adx_thresh': 25.3481293212673, 'bull_atr_min_pct': 0.028429024969712058, 'bull_atr_max_pct': 0.11436734140570798, 'bull_tp_mult': 2.6475880287276325, 'bull_tsl_mult': 0.544884999522384, 'bull_time_stop': 186, 'bull_use_sma': True, 'bull_use_ema': True, 'bull_use_atr': True, 'bull_use_adx': False, 'bull_use_spike': True, 'bull_rsi_required': True, 'bear_strategy': 'breakout', 'bear_bb_std_mult': 1.5702276027859126, 'bear_rsi_os': 49, 'bear_rsi_ob': 63, 'bear_adx_thresh': 18.082462099073123, 'bear_atr_min_pct': 0.011879112539719162, 'bear_atr_max_pct': 0.0272568828818031, 'bear_tp_mult': 2.674378949753759, 'bear_tsl_mult': 0.7928264550076729, 'bear_time_stop': 272, 'bear_use_sma': True, 'bear_use_ema': True, 'bear_use_atr': True, 'bear_use_adx': False, 'bear_use_spike': False, 'bear_rsi_required': True, 'sideways_strategy': 'mean_reversion', 'sideways_bb_std_mult': 1.307005414035062, 'sideways_rsi_os': 18, 'sideways_rsi_ob': 78, 'sideways_adx_thresh': 20.34571350921393, 'sideways_atr_min_pct': 0.006626123615403864, 'sideways_atr_max_pct': 0.14433526736073993, 'sideways_tp_mult': 2.7292981375660434, 'sideways_tsl_mult': 0.9830750132694819, 'sideways_time_stop': 31, 'sideways_use_sma': False, 'sideways_use_ema': True, 'sideways_use_atr': True, 'sideways_use_adx': True, 'sideways_use_spike': False, 'sideways_rsi_required': True}.
[I 2025-08-30 20:08:16,856] Trial 864 finished with values: [-1000000000.0, 1000000000.0] and parameters: {'p_sma': 20, 'p_std': 29, 'p_atr': 27, 'p_adx': 15, 'rsi_period': 64, 'ema1': 25, 'ema2': 36, 'slip_atr_k': 0.07645306646295537, 'slip_spread_k': 0.3440559268921389, 'spread_hl_frac': 0.023733466369497306, 'bb_std_mult': 1.3422463686908048, 'rsi_os': 47, 'rsi_ob': 77, 'vol_spike': 0.07846791348462927, 'adx_thresh': 14.10551801981569, 'atr_min_pct': 0.024784075734994852, 'atr_max_pct': 0.09866822012661411, 'tp_mult': 1.233596983575704, 'tsl_mult': 0.3769504227012534, 'strategy': 'mean_reversion', 'time_stop': 143, 'use_sma': False, 'use_atr': False, 'use_adx': False, 'use_ema': True, 'use_spike': False, 'rsi_required': False, 'edge_k': 0.8514590940572327, 'edge_cap': 0.7456356282621802, 'bull_strategy': 'mean_reversion', 'bull_bb_std_mult': 2.713165079183393, 'bull_rsi_os': 30, 'bull_rsi_ob': 92, 'bull_adx_thresh': 15.825176891079396, 'bull_atr_min_pct': 0.0030616390471282654, 'bull_atr_max_pct': 0.1141757195262708, 'bull_tp_mult': 2.718067695970668, 'bull_tsl_mult': 0.5033970597683042, 'bull_time_stop': 186, 'bull_use_sma': True, 'bull_use_ema': True, 'bull_use_atr': True, 'bull_use_adx': False, 'bull_use_spike': True, 'bull_rsi_required': True, 'bear_strategy': 'breakout', 'bear_bb_std_mult': 3.0782298464638833, 'bear_rsi_os': 49, 'bear_rsi_ob': 77, 'bear_adx_thresh': 20.69078494178681, 'bear_atr_min_pct': 0.014547758539069436, 'bear_atr_max_pct': 0.027148565881399526, 'bear_tp_mult': 2.0264378470694266, 'bear_tsl_mult': 0.802270942204595, 'bear_time_stop': 191, 'bear_use_sma': True, 'bear_use_ema': True, 'bear_use_atr': True, 'bear_use_adx': False, 'bear_use_spike': False, 'bear_rsi_required': True, 'sideways_strategy': 'mean_reversion', 'sideways_bb_std_mult': 3.1220250909832807, 'sideways_rsi_os': 36, 'sideways_rsi_ob': 56, 'sideways_adx_thresh': 8.88349440297915, 'sideways_atr_min_pct': 0.0023899587023660687, 'sideways_atr_max_pct': 0.06424069042652457, 'sideways_tp_mult': 1.0856299820240705, 'sideways_tsl_mult': 0.9863216646195415, 'sideways_time_stop': 178, 'sideways_use_sma': False, 'sideways_use_ema': True, 'sideways_use_atr': True, 'sideways_use_adx': True, 'sideways_use_spike': False, 'sideways_rsi_required': True}.
[I 2025-08-30 20:08:18,112] Trial 867 finished with values: [-1000000000.0, 1000000000.0] and parameters: {'p_sma': 5, 'p_std': 60, 'p_atr': 18, 'p_adx': 20, 'rsi_period': 65, 'ema1': 26, 'ema2': 35, 'slip_atr_k': 0.22231787713605572, 'slip_spread_k': 0.11627154174621002, 'spread_hl_frac': 0.023793019062738067, 'bb_std_mult': 2.2446785206230473, 'rsi_os': 45, 'rsi_ob': 70, 'vol_spike': 0.13640882710805954, 'adx_thresh': 32.782227710628554, 'atr_min_pct': 0.015524828627387906, 'atr_max_pct': 0.09476043271136965, 'tp_mult': 2.7646770879436438, 'tsl_mult': 0.8262260154738669, 'strategy': 'mean_reversion', 'time_stop': 143, 'use_sma': False, 'use_atr': True, 'use_adx': True, 'use_ema': False, 'use_spike': True, 'rsi_required': False, 'edge_k': 0.03409415900865327, 'edge_cap': 0.7466340483953112, 'bull_strategy': 'mean_reversion', 'bull_bb_std_mult': 3.0538297644270425, 'bull_rsi_os': 30, 'bull_rsi_ob': 90, 'bull_adx_thresh': 19.281369722857484, 'bull_atr_min_pct': 0.0017277023815543255, 'bull_atr_max_pct': 0.12093954517297052, 'bull_tp_mult': 2.7705018941362023, 'bull_tsl_mult': 0.5456058318921003, 'bull_time_stop': 185, 'bull_use_sma': False, 'bull_use_ema': True, 'bull_use_atr': True, 'bull_use_adx': False, 'bull_use_spike': False, 'bull_rsi_required': True, 'bear_strategy': 'breakout', 'bear_bb_std_mult': 1.5653637512802616, 'bear_rsi_os': 51, 'bear_rsi_ob': 77, 'bear_adx_thresh': 20.795763384043997, 'bear_atr_min_pct': 0.01459491339314581, 'bear_atr_max_pct': 0.1300193991123405, 'bear_tp_mult': 2.7854062787051435, 'bear_tsl_mult': 0.05765949510744206, 'bear_time_stop': 205, 'bear_use_sma': True, 'bear_use_ema': True, 'bear_use_atr': False, 'bear_use_adx': False, 'bear_use_spike': True, 'bear_rsi_required': True, 'sideways_strategy': 'breakout', 'sideways_bb_std_mult': 1.0144550903434122, 'sideways_rsi_os': 46, 'sideways_rsi_ob': 61, 'sideways_adx_thresh': 20.144691428060778, 'sideways_atr_min_pct': 0.002503930961353934, 'sideways_atr_max_pct': 0.07781901750113901, 'sideways_tp_mult': 1.2034621663407994, 'sideways_tsl_mult': 0.21908190299266944, 'sideways_time_stop': 141, 'sideways_use_sma': False, 'sideways_use_ema': True, 'sideways_use_atr': True, 'sideways_use_adx': True, 'sideways_use_spike': False, 'sideways_rsi_required': True}.
[I 2025-08-30 20:08:18,528] Trial 866 finished with values: [-1000000000.0, 1000000000.0] and parameters: {'p_sma': 7, 'p_std': 28, 'p_atr': 9, 'p_adx': 27, 'rsi_period': 64, 'ema1': 26, 'ema2': 34, 'slip_atr_k': 0.07419591839925302, 'slip_spread_k': 0.614795820065007, 'spread_hl_frac': 0.02490739947781889, 'bb_std_mult': 1.3540592150609445, 'rsi_os': 9, 'rsi_ob': 81, 'vol_spike': 0.24288718356361785, 'adx_thresh': 5.169432282714794, 'atr_min_pct': 0.0008498359071460859, 'atr_max_pct': 0.09818106242164507, 'tp_mult': 2.2785672824635905, 'tsl_mult': 0.20360012284904622, 'strategy': 'mean_reversion', 'time_stop': 100, 'use_sma': False, 'use_atr': True, 'use_adx': True, 'use_ema': False, 'use_spike': True, 'rsi_required': False, 'edge_k': 1.3297443252812853, 'edge_cap': 0.7145140129024814, 'bull_strategy': 'mean_reversion', 'bull_bb_std_mult': 0.9223649395476656, 'bull_rsi_os': 29, 'bull_rsi_ob': 59, 'bull_adx_thresh': 20.182749134978817, 'bull_atr_min_pct': 0.0017847184800293802, 'bull_atr_max_pct': 0.11503740759352946, 'bull_tp_mult': 1.3552853525282198, 'bull_tsl_mult': 0.5545232057038855, 'bull_time_stop': 187, 'bull_use_sma': False, 'bull_use_ema': True, 'bull_use_atr': True, 'bull_use_adx': False, 'bull_use_spike': False, 'bull_rsi_required': True, 'bear_strategy': 'breakout', 'bear_bb_std_mult': 3.1015387013984803, 'bear_rsi_os': 51, 'bear_rsi_ob': 82, 'bear_adx_thresh': 18.59410727272768, 'bear_atr_min_pct': 0.014520193583196452, 'bear_atr_max_pct': 0.0321787696757852, 'bear_tp_mult': 2.0375578246072212, 'bear_tsl_mult': 0.05945834484651341, 'bear_time_stop': 206, 'bear_use_sma': True, 'bear_use_ema': True, 'bear_use_atr': False, 'bear_use_adx': False, 'bear_use_spike': True, 'bear_rsi_required': True, 'sideways_strategy': 'breakout', 'sideways_bb_std_mult': 1.0073120870305012, 'sideways_rsi_os': 46, 'sideways_rsi_ob': 49, 'sideways_adx_thresh': 18.465605044110205, 'sideways_atr_min_pct': 0.006920937277959933, 'sideways_atr_max_pct': 0.14999717364084164, 'sideways_tp_mult': 1.1953863177421749, 'sideways_tsl_mult': 0.9997431877746678, 'sideways_time_stop': 144, 'sideways_use_sma': False, 'sideways_use_ema': True, 'sideways_use_atr': True, 'sideways_use_adx': True, 'sideways_use_spike': False, 'sideways_rsi_required': True}.
[I 2025-08-30 20:08:19,800] Trial 868 finished with values: [-1000000000.0, 1000000000.0] and parameters: {'p_sma': 41, 'p_std': 28, 'p_atr': 20, 'p_adx': 16, 'rsi_period': 47, 'ema1': 26, 'ema2': 27, 'slip_atr_k': 0.22216783972438425, 'slip_spread_k': 0.7797009800037129, 'spread_hl_frac': 0.024861080757891466, 'bb_std_mult': 2.2913557263926485, 'rsi_os': 49, 'rsi_ob': 70, 'vol_spike': 0.18080428537608645, 'adx_thresh': 5.089856671168153, 'atr_min_pct': 0.01935836634015712, 'atr_max_pct': 0.13505214925566683, 'tp_mult': 2.2657366617445187, 'tsl_mult': 0.19833939052957678, 'strategy': 'mean_reversion', 'time_stop': 150, 'use_sma': False, 'use_atr': True, 'use_adx': True, 'use_ema': False, 'use_spike': True, 'rsi_required': False, 'edge_k': 0.9885017387153744, 'edge_cap': 0.5267475061126079, 'bull_strategy': 'mean_reversion', 'bull_bb_std_mult': 0.6939237266275711, 'bull_rsi_os': 42, 'bull_rsi_ob': 88, 'bull_adx_thresh': 17.16665345724223, 'bull_atr_min_pct': 0.017412120681216302, 'bull_atr_max_pct': 0.12028341849673253, 'bull_tp_mult': 2.771952818671576, 'bull_tsl_mult': 0.21912060265056582, 'bull_time_stop': 21, 'bull_use_sma': False, 'bull_use_ema': True, 'bull_use_atr': True, 'bull_use_adx': False, 'bull_use_spike': False, 'bull_rsi_required': True, 'bear_strategy': 'mean_reversion', 'bear_bb_std_mult': 0.7528676380338315, 'bear_rsi_os': 51, 'bear_rsi_ob': 77, 'bear_adx_thresh': 20.825444301731157, 'bear_atr_min_pct': 0.014544631006406416, 'bear_atr_max_pct': 0.016987425917718443, 'bear_tp_mult': 2.0705270844124657, 'bear_tsl_mult': 0.5624620471159354, 'bear_time_stop': 207, 'bear_use_sma': True, 'bear_use_ema': True, 'bear_use_atr': False, 'bear_use_adx': False, 'bear_use_spike': True, 'bear_rsi_required': True, 'sideways_strategy': 'breakout', 'sideways_bb_std_mult': 3.36614176929089, 'sideways_rsi_os': 25, 'sideways_rsi_ob': 61, 'sideways_adx_thresh': 8.803969310092207, 'sideways_atr_min_pct': 0.0023815789652617604, 'sideways_atr_max_pct': 0.054877411203176345, 'sideways_tp_mult': 1.316923014694327, 'sideways_tsl_mult': 0.9814072526865688, 'sideways_time_stop': 145, 'sideways_use_sma': False, 'sideways_use_ema': True, 'sideways_use_atr': True, 'sideways_use_adx': False, 'sideways_use_spike': False, 'sideways_rsi_required': True}.
[I 2025-08-30 20:08:20,623] Trial 869 finished with values: [-1000000000.0, 1000000000.0] and parameters: {'p_sma': 5, 'p_std': 46, 'p_atr': 9, 'p_adx': 16, 'rsi_period': 46, 'ema1': 22, 'ema2': 30, 'slip_atr_k': 0.1057272228579494, 'slip_spread_k': 0.12000413104447999, 'spread_hl_frac': 0.024907313100652133, 'bb_std_mult': 2.261879662028785, 'rsi_os': 37, 'rsi_ob': 47, 'vol_spike': 0.11839498789764787, 'adx_thresh': 5.230521782553893, 'atr_min_pct': 0.0003403310994563539, 'atr_max_pct': 0.0970164224015771, 'tp_mult': 2.278191790183637, 'tsl_mult': 0.8248253016111078, 'strategy': 'mean_reversion', 'time_stop': 192, 'use_sma': False, 'use_atr': True, 'use_adx': True, 'use_ema': False, 'use_spike': True, 'rsi_required': False, 'edge_k': 0.07801004158536567, 'edge_cap': 0.8009478709390017, 'bull_strategy': 'mean_reversion', 'bull_bb_std_mult': 3.0278198167176162, 'bull_rsi_os': 29, 'bull_rsi_ob': 48, 'bull_adx_thresh': 19.318933395219887, 'bull_atr_min_pct': 0.017408903204518426, 'bull_atr_max_pct': 0.1208586293003949, 'bull_tp_mult': 2.766600253157513, 'bull_tsl_mult': 0.21382044727687904, 'bull_time_stop': 257, 'bull_use_sma': False, 'bull_use_ema': True, 'bull_use_atr': True, 'bull_use_adx': False, 'bull_use_spike': False, 'bull_rsi_required': True, 'bear_strategy': 'mean_reversion', 'bear_bb_std_mult': 0.7728632529369701, 'bear_rsi_os': 51, 'bear_rsi_ob': 90, 'bear_adx_thresh': 33.80316733832573, 'bear_atr_min_pct': 0.01461069589390738, 'bear_atr_max_pct': 0.017454193002651455, 'bear_tp_mult': 2.5921954259493787, 'bear_tsl_mult': 0.49008535861176145, 'bear_time_stop': 207, 'bear_use_sma': True, 'bear_use_ema': True, 'bear_use_atr': False, 'bear_use_adx': False, 'bear_use_spike': True, 'bear_rsi_required': True, 'sideways_strategy': 'breakout', 'sideways_bb_std_mult': 1.0142255599743468, 'sideways_rsi_os': 25, 'sideways_rsi_ob': 59, 'sideways_adx_thresh': 22.15471868538186, 'sideways_atr_min_pct': 0.005146723297556156, 'sideways_atr_max_pct': 0.13407767721504313, 'sideways_tp_mult': 2.154326792002804, 'sideways_tsl_mult': 0.7142810586976571, 'sideways_time_stop': 141, 'sideways_use_sma': False, 'sideways_use_ema': True, 'sideways_use_atr': True, 'sideways_use_adx': False, 'sideways_use_spike': False, 'sideways_rsi_required': True}.
[I 2025-08-30 20:08:20,656] Trial 870 finished with values: [-1000000000.0, 1000000000.0] and parameters: {'p_sma': 41, 'p_std': 28, 'p_atr': 23, 'p_adx': 22, 'rsi_period': 46, 'ema1': 6, 'ema2': 31, 'slip_atr_k': 0.07300326126649567, 'slip_spread_k': 0.3668348915359101, 'spread_hl_frac': 0.025282621150838284, 'bb_std_mult': 2.1571448895546577, 'rsi_os': 9, 'rsi_ob': 48, 'vol_spike': 0.1798870377138022, 'adx_thresh': 23.425744111240746, 'atr_min_pct': 5.6560407358761944e-05, 'atr_max_pct': 0.02251600906720947, 'tp_mult': 2.2668517363813394, 'tsl_mult': 0.19925757472137323, 'strategy': 'mean_reversion', 'time_stop': 191, 'use_sma': True, 'use_atr': True, 'use_adx': True, 'use_ema': False, 'use_spike': True, 'rsi_required': False, 'edge_k': 0.07881232086189363, 'edge_cap': 0.509970333292215, 'bull_strategy': 'mean_reversion', 'bull_bb_std_mult': 2.5963353719204396, 'bull_rsi_os': 33, 'bull_rsi_ob': 48, 'bull_adx_thresh': 20.069205669907543, 'bull_atr_min_pct': 0.017245417872149303, 'bull_atr_max_pct': 0.12026461781913772, 'bull_tp_mult': 2.357325129951417, 'bull_tsl_mult': 0.11446182032516261, 'bull_time_stop': 259, 'bull_use_sma': False, 'bull_use_ema': True, 'bull_use_atr': False, 'bull_use_adx': False, 'bull_use_spike': False, 'bull_rsi_required': True, 'bear_strategy': 'mean_reversion', 'bear_bb_std_mult': 0.7342971416926172, 'bear_rsi_os': 55, 'bear_rsi_ob': 58, 'bear_adx_thresh': 18.64785338671758, 'bear_atr_min_pct': 0.021360613801259476, 'bear_atr_max_pct': 0.03381490038591949, 'bear_tp_mult': 1.2056391949503764, 'bear_tsl_mult': 0.7396124528929431, 'bear_time_stop': 71, 'bear_use_sma': True, 'bear_use_ema': True, 'bear_use_atr': False, 'bear_use_adx': False, 'bear_use_spike': False, 'bear_rsi_required': True, 'sideways_strategy': 'breakout', 'sideways_bb_std_mult': 3.5983974181748453, 'sideways_rsi_os': 35, 'sideways_rsi_ob': 49, 'sideways_adx_thresh': 18.19381112385221, 'sideways_atr_min_pct': 0.008721082906796896, 'sideways_atr_max_pct': 0.021086028569362425, 'sideways_tp_mult': 1.3058991857495954, 'sideways_tsl_mult': 0.41397531711307434, 'sideways_time_stop': 166, 'sideways_use_sma': False, 'sideways_use_ema': True, 'sideways_use_atr': True, 'sideways_use_adx': False, 'sideways_use_spike': True, 'sideways_rsi_required': True}.
[I 2025-08-30 20:08:20,668] Trial 871 finished with values: [-1000000000.0, 1000000000.0] and parameters: {'p_sma': 7, 'p_std': 31, 'p_atr': 23, 'p_adx': 16, 'rsi_period': 21, 'ema1': 27, 'ema2': 30, 'slip_atr_k': 0.06688815717318465, 'slip_spread_k': 0.14613522454273478, 'spread_hl_frac': 0.029010413438069968, 'bb_std_mult': 2.157883132750621, 'rsi_os': 50, 'rsi_ob': 62, 'vol_spike': 0.11674911401367288, 'adx_thresh': 34.40190535798383, 'atr_min_pct': 0.020643144647539715, 'atr_max_pct': 0.08091244678651204, 'tp_mult': 2.5132777757136724, 'tsl_mult': 0.8614943332700813, 'strategy': 'mean_reversion', 'time_stop': 192, 'use_sma': True, 'use_atr': True, 'use_adx': True, 'use_ema': False, 'use_spike': True, 'rsi_required': True, 'edge_k': 0.07722315184037608, 'edge_cap': 0.528929144632669, 'bull_strategy': 'mean_reversion', 'bull_bb_std_mult': 2.3118523275799667, 'bull_rsi_os': 33, 'bull_rsi_ob': 70, 'bull_adx_thresh': 19.05393826789549, 'bull_atr_min_pct': 0.012681772359322697, 'bull_atr_max_pct': 0.12063064581386607, 'bull_tp_mult': 2.764571125835238, 'bull_tsl_mult': 0.5306065576988662, 'bull_time_stop': 170, 'bull_use_sma': False, 'bull_use_ema': True, 'bull_use_atr': False, 'bull_use_adx': True, 'bull_use_spike': False, 'bull_rsi_required': False, 'bear_strategy': 'mean_reversion', 'bear_bb_std_mult': 3.3562282003624446, 'bear_rsi_os': 9, 'bear_rsi_ob': 75, 'bear_adx_thresh': 19.130582773718412, 'bear_atr_min_pct': 0.027407062508439113, 'bear_atr_max_pct': 0.14684084370522496, 'bear_tp_mult': 1.3279103984372225, 'bear_tsl_mult': 0.1470619572747794, 'bear_time_stop': 80, 'bear_use_sma': True, 'bear_use_ema': False, 'bear_use_atr': False, 'bear_use_adx': False, 'bear_use_spike': False, 'bear_rsi_required': True, 'sideways_strategy': 'breakout', 'sideways_bb_std_mult': 3.3523028997610593, 'sideways_rsi_os': 41, 'sideways_rsi_ob': 58, 'sideways_adx_thresh': 22.2665916509996, 'sideways_atr_min_pct': 0.01129530337610352, 'sideways_atr_max_pct': 0.13410710350228633, 'sideways_tp_mult': 1.3076849891121411, 'sideways_tsl_mult': 0.39536801818567546, 'sideways_time_stop': 168, 'sideways_use_sma': False, 'sideways_use_ema': False, 'sideways_use_atr': True, 'sideways_use_adx': False, 'sideways_use_spike': True, 'sideways_rsi_required': True}.
[I 2025-08-30 20:08:23,653] Trial 873 finished with values: [-1000000000.0, 1000000000.0] and parameters: {'p_sma': 28, 'p_std': 20, 'p_atr': 19, 'p_adx': 21, 'rsi_period': 21, 'ema1': 27, 'ema2': 17, 'slip_atr_k': 0.04589722956876194, 'slip_spread_k': 0.1399945625534221, 'spread_hl_frac': 0.004781045196109196, 'bb_std_mult': 1.0628527820617046, 'rsi_os': 55, 'rsi_ob': 84, 'vol_spike': 0.25631189339419, 'adx_thresh': 23.432154766763144, 'atr_min_pct': 0.012429199069378205, 'atr_max_pct': 0.02779994021608667, 'tp_mult': 2.394872296240073, 'tsl_mult': 0.8654713957028688, 'strategy': 'mean_reversion', 'time_stop': 238, 'use_sma': True, 'use_atr': True, 'use_adx': True, 'use_ema': False, 'use_spike': True, 'rsi_required': True, 'edge_k': 1.4695291177134058, 'edge_cap': 0.6459081879957734, 'bull_strategy': 'mean_reversion', 'bull_bb_std_mult': 2.6106598996358477, 'bull_rsi_os': 33, 'bull_rsi_ob': 48, 'bull_adx_thresh': 13.252085398380471, 'bull_atr_min_pct': 2.2523468218309164e-05, 'bull_atr_max_pct': 0.12894805778413124, 'bull_tp_mult': 1.9038755077945044, 'bull_tsl_mult': 0.5256003249865364, 'bull_time_stop': 194, 'bull_use_sma': False, 'bull_use_ema': True, 'bull_use_atr': False, 'bull_use_adx': True, 'bull_use_spike': False, 'bull_rsi_required': False, 'bear_strategy': 'breakout', 'bear_bb_std_mult': 2.80141279954877, 'bear_rsi_os': 52, 'bear_rsi_ob': 95, 'bear_adx_thresh': 15.396772556981066, 'bear_atr_min_pct': 0.022716340294145085, 'bear_atr_max_pct': 0.13423172580222478, 'bear_tp_mult': 1.328711843701968, 'bear_tsl_mult': 0.7378091507209352, 'bear_time_stop': 83, 'bear_use_sma': True, 'bear_use_ema': False, 'bear_use_atr': False, 'bear_use_adx': False, 'bear_use_spike': False, 'bear_rsi_required': False, 'sideways_strategy': 'breakout', 'sideways_bb_std_mult': 3.038858208887557, 'sideways_rsi_os': 35, 'sideways_rsi_ob': 58, 'sideways_adx_thresh': 22.673156270521144, 'sideways_atr_min_pct': 0.008837838382934417, 'sideways_atr_max_pct': 0.12744701755294743, 'sideways_tp_mult': 2.4920803937822242, 'sideways_tsl_mult': 0.9512719392051925, 'sideways_time_stop': 169, 'sideways_use_sma': False, 'sideways_use_ema': False, 'sideways_use_atr': True, 'sideways_use_adx': False, 'sideways_use_spike': True, 'sideways_rsi_required': True}.
