[I 2025-08-30 18:36:19,368] Trial 62 finished with values: [-1000000000.0, 1000000000.0] and parameters: {'p_sma': 11, 'p_std': 25, 'p_atr': 17, 'p_adx': 23, 'rsi_period': 22, 'ema1': 26, 'ema2': 27, 'slip_atr_k': 0.10760011521967318, 'slip_spread_k': 0.8294571509568173, 'spread_hl_frac': 0.027693218271278734, 'bb_std_mult': 1.6980263042912378, 'rsi_os': 51, 'rsi_ob': 54, 'vol_spike': 0.06549899965933738, 'adx_thresh': 22.94845906192073, 'atr_min_pct': 0.026782295484370885, 'atr_max_pct': 0.062037314947782696, 'tp_mult': 1.426154266672806, 'tsl_mult': 0.865712782958989, 'strategy': 'breakout', 'time_stop': 251, 'use_sma': True, 'use_atr': True, 'use_adx': True, 'use_ema': False, 'use_spike': True, 'rsi_required': False, 'edge_k': 0.1803554275780867, 'edge_cap': 0.532421522481896, 'bull_strategy': 'mean_reversion', 'bull_bb_std_mult': 2.1773699635447996, 'bull_rsi_os': 25, 'bull_rsi_ob': 91, 'bull_adx_thresh': 9.161452904544966, 'bull_atr_min_pct': 0.025294732488726008, 'bull_atr_max_pct': 0.14277379614857752, 'bull_tp_mult': 2.3466944735853597, 'bull_tsl_mult': 0.7641380302566931, 'bull_time_stop': 213, 'bull_use_sma': False, 'bull_use_ema': False, 'bull_use_atr': True, 'bull_use_adx': False, 'bull_use_spike': False, 'bull_rsi_required': True, 'bear_strategy': 'breakout', 'bear_bb_std_mult': 3.0183819159642207, 'bear_rsi_os': 9, 'bear_rsi_ob': 71, 'bear_adx_thresh': 17.035650409495883, 'bear_atr_min_pct': 0.005364569451672163, 'bear_atr_max_pct': 0.010123537081599077, 'bear_tp_mult': 2.850836724744421, 'bear_tsl_mult': 0.7206418998091833, 'bear_time_stop': 22, 'bear_use_sma': False, 'bear_use_ema': True, 'bear_use_atr': False, 'bear_use_adx': True, 'bear_use_spike': False, 'bear_rsi_required': False, 'sideways_strategy': 'breakout', 'sideways_bb_std_mult': 2.176862762676854, 'sideways_rsi_os': 22, 'sideways_rsi_ob': 75, 'sideways_adx_thresh': 33.83448327313289, 'sideways_atr_min_pct': 0.005125959468620404, 'sideways_atr_max_pct': 0.1422757259542728, 'sideways_tp_mult': 1.1391198957634063, 'sideways_tsl_mult': 0.9310710122603497, 'sideways_time_stop': 252, 'sideways_use_sma': False, 'sideways_use_ema': False, 'sideways_use_atr': True, 'sideways_use_adx': False, 'sideways_use_spike': True, 'sideways_rsi_required': False}.
[I 2025-08-30 18:36:19,445] Trial 64 finished with values: [-1000000000.0, 1000000000.0] and parameters: {'p_sma': 12, 'p_std': 34, 'p_atr': 16, 'p_adx': 23, 'rsi_period': 16, 'ema1': 25, 'ema2': 27, 'slip_atr_k': 0.001600975889158432, 'slip_spread_k': 0.940105882226278, 'spread_hl_frac': 0.019555078701663876, 'bb_std_mult': 1.2430066623932847, 'rsi_os': 51, 'rsi_ob': 58, 'vol_spike': 0.05262802334494856, 'adx_thresh': 23.640244029986473, 'atr_min_pct': 0.028052463180278462, 'atr_max_pct': 0.07989841637908526, 'tp_mult': 2.2327247386119096, 'tsl_mult': 0.8676525330978981, 'strategy': 'breakout', 'time_stop': 249, 'use_sma': True, 'use_atr': True, 'use_adx': True, 'use_ema': False, 'use_spike': True, 'rsi_required': False, 'edge_k': 0.12223477837859101, 'edge_cap': 0.44621503014013053, 'bull_strategy': 'mean_reversion', 'bull_bb_std_mult': 1.9399898892707728, 'bull_rsi_os': 25, 'bull_rsi_ob': 92, 'bull_adx_thresh': 13.655895288710658, 'bull_atr_min_pct': 0.027979782228532795, 'bull_atr_max_pct': 0.14171172459807893, 'bull_tp_mult': 2.353559080882741, 'bull_tsl_mult': 0.6085629119114313, 'bull_time_stop': 211, 'bull_use_sma': False, 'bull_use_ema': True, 'bull_use_atr': True, 'bull_use_adx': False, 'bull_use_spike': False, 'bull_rsi_required': True, 'bear_strategy': 'mean_reversion', 'bear_bb_std_mult': 2.95962199665584, 'bear_rsi_os': 39, 'bear_rsi_ob': 71, 'bear_adx_thresh': 17.062937721558402, 'bear_atr_min_pct': 0.00383657174712841, 'bear_atr_max_pct': 0.03918463349838173, 'bear_tp_mult': 2.987310626236371, 'bear_tsl_mult': 0.831656967318575, 'bear_time_stop': 145, 'bear_use_sma': False, 'bear_use_ema': True, 'bear_use_atr': False, 'bear_use_adx': False, 'bear_use_spike': False, 'bear_rsi_required': False, 'sideways_strategy': 'breakout', 'sideways_bb_std_mult': 3.029615231994202, 'sideways_rsi_os': 21, 'sideways_rsi_ob': 75, 'sideways_adx_thresh': 30.842899400297163, 'sideways_atr_min_pct': 0.004909587389157973, 'sideways_atr_max_pct': 0.1411215942730814, 'sideways_tp_mult': 1.0990057383413037, 'sideways_tsl_mult': 0.9401740720493162, 'sideways_time_stop': 291, 'sideways_use_sma': False, 'sideways_use_ema': False, 'sideways_use_atr': True, 'sideways_use_adx': True, 'sideways_use_spike': True, 'sideways_rsi_required': False}.
[I 2025-08-30 18:36:53,934] Trial 65 finished with values: [-1000000000.0, 1000000000.0] and parameters: {'p_sma': 30, 'p_std': 29, 'p_atr': 17, 'p_adx': 25, 'rsi_period': 28, 'ema1': 22, 'ema2': 27, 'slip_atr_k': 0.2216060599572618, 'slip_spread_k': 0.9360914972508834, 'spread_hl_frac': 0.027623399979488122, 'bb_std_mult': 1.2502070278769073, 'rsi_os': 49, 'rsi_ob': 58, 'vol_spike': 0.06584428156706502, 'adx_thresh': 14.676425080505394, 'atr_min_pct': 0.025110277612881822, 'atr_max_pct': 0.07838431585083697, 'tp_mult': 2.4792654911386363, 'tsl_mult': 0.9285782511593274, 'strategy': 'mean_reversion', 'time_stop': 224, 'use_sma': False, 'use_atr': False, 'use_adx': True, 'use_ema': False, 'use_spike': True, 'rsi_required': False, 'edge_k': 0.4079348384028335, 'edge_cap': 0.6037286110898488, 'bull_strategy': 'mean_reversion', 'bull_bb_std_mult': 1.7055620017238475, 'bull_rsi_os': 21, 'bull_rsi_ob': 91, 'bull_adx_thresh': 19.736448900016697, 'bull_atr_min_pct': 0.02833826606120466, 'bull_atr_max_pct': 0.13037424241034468, 'bull_tp_mult': 2.16768709132126, 'bull_tsl_mult': 0.6648666505650521, 'bull_time_stop': 216, 'bull_use_sma': False, 'bull_use_ema': True, 'bull_use_atr': True, 'bull_use_adx': False, 'bull_use_spike': False, 'bull_rsi_required': True, 'bear_strategy': 'breakout', 'bear_bb_std_mult': 0.6420014293764942, 'bear_rsi_os': 43, 'bear_rsi_ob': 62, 'bear_adx_thresh': 16.996118478294825, 'bear_atr_min_pct': 0.012324639993321087, 'bear_atr_max_pct': 0.03856195103969241, 'bear_tp_mult': 2.9906960760290398, 'bear_tsl_mult': 0.6381599769724553, 'bear_time_stop': 146, 'bear_use_sma': True, 'bear_use_ema': True, 'bear_use_atr': False, 'bear_use_adx': False, 'bear_use_spike': False, 'bear_rsi_required': True, 'sideways_strategy': 'breakout', 'sideways_bb_std_mult': 2.9857367498893006, 'sideways_rsi_os': 20, 'sideways_rsi_ob': 75, 'sideways_adx_thresh': 30.749638835020917, 'sideways_atr_min_pct': 0.007842837157723844, 'sideways_atr_max_pct': 0.14088421854103497, 'sideways_tp_mult': 1.2570549600624044, 'sideways_tsl_mult': 0.9988277840900786, 'sideways_time_stop': 228, 'sideways_use_sma': False, 'sideways_use_ema': True, 'sideways_use_atr': True, 'sideways_use_adx': False, 'sideways_use_spike': True, 'sideways_rsi_required': False}.
[I 2025-08-30 18:36:54,180] Trial 66 finished with values: [-1000000000.0, 1000000000.0] and parameters: {'p_sma': 17, 'p_std': 51, 'p_atr': 17, 'p_adx': 25, 'rsi_period': 22, 'ema1': 22, 'ema2': 27, 'slip_atr_k': 0.21662631721761844, 'slip_spread_k': 0.9455069696312215, 'spread_hl_frac': 0.017707772622263154, 'bb_std_mult': 1.2602136033927656, 'rsi_os': 49, 'rsi_ob': 58, 'vol_spike': 0.06467426065388691, 'adx_thresh': 14.54099317357537, 'atr_min_pct': 0.029949908508155564, 'atr_max_pct': 0.03746172744283336, 'tp_mult': 2.492833175638145, 'tsl_mult': 0.9203871352046209, 'strategy': 'mean_reversion', 'time_stop': 227, 'use_sma': False, 'use_atr': False, 'use_adx': True, 'use_ema': False, 'use_spike': True, 'rsi_required': False, 'edge_k': 0.40552391315647884, 'edge_cap': 0.5874343281689923, 'bull_strategy': 'mean_reversion', 'bull_bb_std_mult': 2.1973155826037547, 'bull_rsi_os': 21, 'bull_rsi_ob': 92, 'bull_adx_thresh': 14.212973382886286, 'bull_atr_min_pct': 0.029420401316609304, 'bull_atr_max_pct': 0.13136607973402809, 'bull_tp_mult': 2.627534550750791, 'bull_tsl_mult': 0.5717237552557507, 'bull_time_stop': 213, 'bull_use_sma': False, 'bull_use_ema': True, 'bull_use_atr': True, 'bull_use_adx': False, 'bull_use_spike': False, 'bull_rsi_required': True, 'bear_strategy': 'breakout', 'bear_bb_std_mult': 0.7909712956482602, 'bear_rsi_os': 44, 'bear_rsi_ob': 70, 'bear_adx_thresh': 20.979041482109704, 'bear_atr_min_pct': 0.005236846994952317, 'bear_atr_max_pct': 0.033181501979270486, 'bear_tp_mult': 2.9819536734182432, 'bear_tsl_mult': 0.8358042534383572, 'bear_time_stop': 146, 'bear_use_sma': True, 'bear_use_ema': True, 'bear_use_atr': False, 'bear_use_adx': False, 'bear_use_spike': False, 'bear_rsi_required': True, 'sideways_strategy': 'breakout', 'sideways_bb_std_mult': 3.0320749004253926, 'sideways_rsi_os': 16, 'sideways_rsi_ob': 75, 'sideways_adx_thresh': 30.77943283842506, 'sideways_atr_min_pct': 0.008419726787518298, 'sideways_atr_max_pct': 0.137179498831097, 'sideways_tp_mult': 1.304736156990368, 'sideways_tsl_mult': 0.9960140501595556, 'sideways_time_stop': 194, 'sideways_use_sma': False, 'sideways_use_ema': True, 'sideways_use_atr': True, 'sideways_use_adx': False, 'sideways_use_spike': True, 'sideways_rsi_required': False}.
[I 2025-08-30 18:36:54,393] Trial 67 finished with values: [-1000000000.0, 1000000000.0] and parameters: {'p_sma': 17, 'p_std': 20, 'p_atr': 19, 'p_adx': 19, 'rsi_period': 30, 'ema1': 21, 'ema2': 53, 'slip_atr_k': 0.0015098050028610754, 'slip_spread_k': 0.948715375725141, 'spread_hl_frac': 0.018242946033725768, 'bb_std_mult': 1.186394221609823, 'rsi_os': 48, 'rsi_ob': 58, 'vol_spike': 0.021654824963823954, 'adx_thresh': 20.70148197465033, 'atr_min_pct': 0.029882726333933556, 'atr_max_pct': 0.03705836351831797, 'tp_mult': 2.4627483765357367, 'tsl_mult': 0.9104216877839835, 'strategy': 'mean_reversion', 'time_stop': 210, 'use_sma': False, 'use_atr': False, 'use_adx': True, 'use_ema': True, 'use_spike': True, 'rsi_required': False, 'edge_k': 0.40987968825463417, 'edge_cap': 0.6152838812720938, 'bull_strategy': 'mean_reversion', 'bull_bb_std_mult': 0.5378689231278941, 'bull_rsi_os': 20, 'bull_rsi_ob': 65, 'bull_adx_thresh': 14.58662488121809, 'bull_atr_min_pct': 0.02204709079302732, 'bull_atr_max_pct': 0.12983706662411537, 'bull_tp_mult': 2.6023156110780854, 'bull_tsl_mult': 0.5671754047424563, 'bull_time_stop': 233, 'bull_use_sma': True, 'bull_use_ema': True, 'bull_use_atr': True, 'bull_use_adx': False, 'bull_use_spike': False, 'bull_rsi_required': True, 'bear_strategy': 'mean_reversion', 'bear_bb_std_mult': 3.2651794034455457, 'bear_rsi_os': 39, 'bear_rsi_ob': 62, 'bear_adx_thresh': 20.79318280653731, 'bear_atr_min_pct': 0.0014035911566395807, 'bear_atr_max_pct': 0.04029502560613891, 'bear_tp_mult': 2.63804902337347, 'bear_tsl_mult': 0.8252081114643036, 'bear_time_stop': 209, 'bear_use_sma': True, 'bear_use_ema': True, 'bear_use_atr': True, 'bear_use_adx': False, 'bear_use_spike': False, 'bear_rsi_required': True, 'sideways_strategy': 'breakout', 'sideways_bb_std_mult': 3.034446984581676, 'sideways_rsi_os': 20, 'sideways_rsi_ob': 84, 'sideways_adx_thresh': 30.80717278458399, 'sideways_atr_min_pct': 0.008470811113153974, 'sideways_atr_max_pct': 0.1333066948591038, 'sideways_tp_mult': 1.2766860477202453, 'sideways_tsl_mult': 0.8502641096625566, 'sideways_time_stop': 231, 'sideways_use_sma': False, 'sideways_use_ema': True, 'sideways_use_atr': True, 'sideways_use_adx': True, 'sideways_use_spike': True, 'sideways_rsi_required': False}.
[I 2025-08-30 18:36:54,548] Trial 68 finished with values: [-1000000000.0, 1000000000.0] and parameters: {'p_sma': 29, 'p_std': 20, 'p_atr': 19, 'p_adx': 25, 'rsi_period': 28, 'ema1': 22, 'ema2': 17, 'slip_atr_k': 0.2231613542722821, 'slip_spread_k': 0.9490010914877443, 'spread_hl_frac': 0.025132442160776206, 'bb_std_mult': 1.549685971006289, 'rsi_os': 48, 'rsi_ob': 51, 'vol_spike': 0.1172331294634558, 'adx_thresh': 14.402428958063929, 'atr_min_pct': 0.025084542700181442, 'atr_max_pct': 0.03829114447401448, 'tp_mult': 2.472123159177535, 'tsl_mult': 0.9405956563130791, 'strategy': 'mean_reversion', 'time_stop': 225, 'use_sma': False, 'use_atr': False, 'use_adx': False, 'use_ema': True, 'use_spike': True, 'rsi_required': False, 'edge_k': 0.3831888625680434, 'edge_cap': 0.5963048582144735, 'bull_strategy': 'mean_reversion', 'bull_bb_std_mult': 0.5436814567168513, 'bull_rsi_os': 21, 'bull_rsi_ob': 71, 'bull_adx_thresh': 6.688712182650292, 'bull_atr_min_pct': 0.021564386079052544, 'bull_atr_max_pct': 0.13261904944542005, 'bull_tp_mult': 2.164055345339332, 'bull_tsl_mult': 0.6850135689055462, 'bull_time_stop': 80, 'bull_use_sma': True, 'bull_use_ema': True, 'bull_use_atr': True, 'bull_use_adx': True, 'bull_use_spike': False, 'bull_rsi_required': False, 'bear_strategy': 'breakout', 'bear_bb_std_mult': 2.2976017655562457, 'bear_rsi_os': 35, 'bear_rsi_ob': 62, 'bear_adx_thresh': 21.08426168056209, 'bear_atr_min_pct': 0.011786954921389432, 'bear_atr_max_pct': 0.022432698374168312, 'bear_tp_mult': 2.6144251521533004, 'bear_tsl_mult': 0.41274480738871117, 'bear_time_stop': 234, 'bear_use_sma': True, 'bear_use_ema': True, 'bear_use_atr': True, 'bear_use_adx': False, 'bear_use_spike': False, 'bear_rsi_required': True, 'sideways_strategy': 'breakout', 'sideways_bb_std_mult': 1.4404410412568596, 'sideways_rsi_os': 28, 'sideways_rsi_ob': 57, 'sideways_adx_thresh': 30.707485331024206, 'sideways_atr_min_pct': 0.008441197582852151, 'sideways_atr_max_pct': 0.12979676031612272, 'sideways_tp_mult': 1.2587828163670078, 'sideways_tsl_mult': 0.8530103482998923, 'sideways_time_stop': 299, 'sideways_use_sma': False, 'sideways_use_ema': True, 'sideways_use_atr': True, 'sideways_use_adx': False, 'sideways_use_spike': True, 'sideways_rsi_required': False}.
[I 2025-08-30 18:36:55,095] Trial 69 finished with values: [-1000000000.0, 1000000000.0] and parameters: {'p_sma': 16, 'p_std': 59, 'p_atr': 15, 'p_adx': 19, 'rsi_period': 35, 'ema1': 22, 'ema2': 17, 'slip_atr_k': 0.03880863299103354, 'slip_spread_k': 0.6694279782142702, 'spread_hl_frac': 0.01786899133525917, 'bb_std_mult': 2.002204098147987, 'rsi_os': 46, 'rsi_ob': 46, 'vol_spike': 0.01958387429841499, 'adx_thresh': 20.493635613776522, 'atr_min_pct': 0.022055505110401715, 'atr_max_pct': 0.05140736465618098, 'tp_mult': 2.0841365546769874, 'tsl_mult': 0.09797386642369516, 'strategy': 'mean_reversion', 'time_stop': 106, 'use_sma': False, 'use_atr': False, 'use_adx': False, 'use_ema': True, 'use_spike': True, 'rsi_required': False, 'edge_k': 0.4006948198138812, 'edge_cap': 0.38392962930844843, 'bull_strategy': 'mean_reversion', 'bull_bb_std_mult': 3.3869958870758907, 'bull_rsi_os': 28, 'bull_rsi_ob': 48, 'bull_adx_thresh': 6.366090112063606, 'bull_atr_min_pct': 0.021382887760020897, 'bull_atr_max_pct': 0.1468126389199506, 'bull_tp_mult': 2.610773402091824, 'bull_tsl_mult': 0.5550747736140837, 'bull_time_stop': 94, 'bull_use_sma': True, 'bull_use_ema': False, 'bull_use_atr': False, 'bull_use_adx': True, 'bull_use_spike': True, 'bull_rsi_required': False, 'bear_strategy': 'breakout', 'bear_bb_std_mult': 3.2336660296255273, 'bear_rsi_os': 36, 'bear_rsi_ob': 69, 'bear_adx_thresh': 21.138104528716912, 'bear_atr_min_pct': 0.0014410964548462976, 'bear_atr_max_pct': 0.030200068099215983, 'bear_tp_mult': 2.623880762763166, 'bear_tsl_mult': 0.8069836595663562, 'bear_time_stop': 236, 'bear_use_sma': True, 'bear_use_ema': True, 'bear_use_atr': True, 'bear_use_adx': True, 'bear_use_spike': True, 'bear_rsi_required': True, 'sideways_strategy': 'breakout', 'sideways_bb_std_mult': 1.4633529827170426, 'sideways_rsi_os': 17, 'sideways_rsi_ob': 86, 'sideways_adx_thresh': 34.949742610174866, 'sideways_atr_min_pct': 0.0029984704313217978, 'sideways_atr_max_pct': 0.13150011114126206, 'sideways_tp_mult': 1.3492784270274432, 'sideways_tsl_mult': 0.859609832534981, 'sideways_time_stop': 197, 'sideways_use_sma': False, 'sideways_use_ema': True, 'sideways_use_atr': True, 'sideways_use_adx': False, 'sideways_use_spike': False, 'sideways_rsi_required': True}.
[I 2025-08-30 18:37:27,776] Trial 73 finished with values: [-0.07639300607902966, 0.07635654407802928] and parameters: {'p_sma': 52, 'p_std': 32, 'p_atr': 13, 'p_adx': 8, 'rsi_period': 11, 'ema1': 24, 'ema2': 30, 'slip_atr_k': 0.18304538525108321, 'slip_spread_k': 0.7221058842236014, 'spread_hl_frac': 0.031720559210139096, 'bb_std_mult': 1.5635814058134578, 'rsi_os': 53, 'rsi_ob': 72, 'vol_spike': 0.1033825958328224, 'adx_thresh': 27.443598805584895, 'atr_min_pct': 0.021966734574094014, 'atr_max_pct': 0.030080874495711153, 'tp_mult': 2.6236732719537033, 'tsl_mult': 0.7970677159083663, 'strategy': 'breakout', 'time_stop': 264, 'use_sma': False, 'use_atr': True, 'use_adx': True, 'use_ema': True, 'use_spike': False, 'rsi_required': True, 'edge_k': 0.05330416689633419, 'edge_cap': 0.4370274188621714, 'bull_strategy': 'breakout', 'bull_bb_std_mult': 1.5574442422141608, 'bull_rsi_os': 31, 'bull_rsi_ob': 52, 'bull_adx_thresh': 11.75229772464141, 'bull_atr_min_pct': 0.02642197567467486, 'bull_atr_max_pct': 0.11000376261610466, 'bull_tp_mult': 2.426695133944787, 'bull_tsl_mult': 0.8619084095206424, 'bull_time_stop': 259, 'bull_use_sma': False, 'bull_use_ema': False, 'bull_use_atr': False, 'bull_use_adx': False, 'bull_use_spike': True, 'bull_rsi_required': True, 'bear_strategy': 'mean_reversion', 'bear_bb_std_mult': 2.717592927948923, 'bear_rsi_os': 27, 'bear_rsi_ob': 75, 'bear_adx_thresh': 14.535990310267266, 'bear_atr_min_pct': 0.00923714211252893, 'bear_atr_max_pct': 0.052628754781632425, 'bear_tp_mult': 2.7687171176104246, 'bear_tsl_mult': 0.5628035504513337, 'bear_time_stop': 41, 'bear_use_sma': False, 'bear_use_ema': True, 'bear_use_atr': True, 'bear_use_adx': True, 'bear_use_spike': True, 'bear_rsi_required': False, 'sideways_strategy': 'breakout', 'sideways_bb_std_mult': 3.316733983654224, 'sideways_rsi_os': 25, 'sideways_rsi_ob': 48, 'sideways_adx_thresh': 6.042960730623783, 'sideways_atr_min_pct': 0.0011620586097481585, 'sideways_atr_max_pct': 0.11621450694886568, 'sideways_tp_mult': 1.3861363242708913, 'sideways_tsl_mult': 0.9657919850927834, 'sideways_time_stop': 217, 'sideways_use_sma': True, 'sideways_use_ema': True, 'sideways_use_atr': True, 'sideways_use_adx': True, 'sideways_use_spike': False, 'sideways_rsi_required': True}.
[I 2025-08-30 18:37:27,914] Trial 70 finished with values: [-1000000000.0, 1000000000.0] and parameters: {'p_sma': 29, 'p_std': 20, 'p_atr': 19, 'p_adx': 8, 'rsi_period': 35, 'ema1': 21, 'ema2': 30, 'slip_atr_k': 0.04409412823327814, 'slip_spread_k': 0.7302145428725835, 'spread_hl_frac': 0.025121175298777724, 'bb_std_mult': 3.277665495193572, 'rsi_os': 47, 'rsi_ob': 51, 'vol_spike': 0.016913685029488063, 'adx_thresh': 25.883069289227052, 'atr_min_pct': 0.02239977124014042, 'atr_max_pct': 0.03004673491851679, 'tp_mult': 2.0816988928516715, 'tsl_mult': 0.797482726462053, 'strategy': 'breakout', 'time_stop': 103, 'use_sma': False, 'use_atr': True, 'use_adx': False, 'use_ema': True, 'use_spike': False, 'rsi_required': False, 'edge_k': 0.07119083033405427, 'edge_cap': 0.4012990517935207, 'bull_strategy': 'mean_reversion', 'bull_bb_std_mult': 0.5538716936228629, 'bull_rsi_os': 31, 'bull_rsi_ob': 65, 'bull_adx_thresh': 14.993667480716589, 'bull_atr_min_pct': 0.022245140770688218, 'bull_atr_max_pct': 0.10899394489616687, 'bull_tp_mult': 2.273350223489947, 'bull_tsl_mult': 0.8631679436268374, 'bull_time_stop': 235, 'bull_use_sma': True, 'bull_use_ema': False, 'bull_use_atr': False, 'bull_use_adx': True, 'bull_use_spike': True, 'bull_rsi_required': False, 'bear_strategy': 'mean_reversion', 'bear_bb_std_mult': 2.2411306082951965, 'bear_rsi_os': 35, 'bear_rsi_ob': 68, 'bear_adx_thresh': 18.322792640520394, 'bear_atr_min_pct': 0.001319681831731095, 'bear_atr_max_pct': 0.017720401596495856, 'bear_tp_mult': 2.633529570000391, 'bear_tsl_mult': 0.5910346383771106, 'bear_time_stop': 211, 'bear_use_sma': True, 'bear_use_ema': True, 'bear_use_atr': True, 'bear_use_adx': True, 'bear_use_spike': True, 'bear_rsi_required': False, 'sideways_strategy': 'breakout', 'sideways_bb_std_mult': 3.3190363340368028, 'sideways_rsi_os': 16, 'sideways_rsi_ob': 84, 'sideways_adx_thresh': 7.62262883244764, 'sideways_atr_min_pct': 0.003768948098230903, 'sideways_atr_max_pct': 0.12913168180184467, 'sideways_tp_mult': 1.3620727677492483, 'sideways_tsl_mult': 0.8579090493481003, 'sideways_time_stop': 297, 'sideways_use_sma': True, 'sideways_use_ema': True, 'sideways_use_atr': True, 'sideways_use_adx': True, 'sideways_use_spike': False, 'sideways_rsi_required': True}.
