[I 2025-08-30 19:52:30,140] Trial 728 finished with values: [-1000000000.0, 1000000000.0] and parameters: {'p_sma': 7, 'p_std': 26, 'p_atr': 8, 'p_adx': 20, 'rsi_period': 23, 'ema1': 27, 'ema2': 56, 'slip_atr_k': 0.24438109711232525, 'slip_spread_k': 0.5744725912358575, 'spread_hl_frac': 0.03720712246241287, 'bb_std_mult': 2.3626911875092977, 'rsi_os': 46, 'rsi_ob': 56, 'vol_spike': 0.039199972908583444, 'adx_thresh': 14.370677016781212, 'atr_min_pct': 0.01360607569725309, 'atr_max_pct': 0.09635837727198046, 'tp_mult': 2.2918729978241017, 'tsl_mult': 0.9969771709946967, 'strategy': 'mean_reversion', 'time_stop': 140, 'use_sma': True, 'use_atr': True, 'use_adx': False, 'use_ema': False, 'use_spike': True, 'rsi_required': True, 'edge_k': 0.641504911944345, 'edge_cap': 0.5261507786143099, 'bull_strategy': 'breakout', 'bull_bb_std_mult': 0.5108714682777369, 'bull_rsi_os': 25, 'bull_rsi_ob': 45, 'bull_adx_thresh': 27.41248087843634, 'bull_atr_min_pct': 0.0032421756213293347, 'bull_atr_max_pct': 0.11474926856671394, 'bull_tp_mult': 1.745114216337207, 'bull_tsl_mult': 0.6494050769694776, 'bull_time_stop': 58, 'bull_use_sma': False, 'bull_use_ema': False, 'bull_use_atr': True, 'bull_use_adx': False, 'bull_use_spike': True, 'bull_rsi_required': True, 'bear_strategy': 'breakout', 'bear_bb_std_mult': 3.125328032897057, 'bear_rsi_os': 50, 'bear_rsi_ob': 48, 'bear_adx_thresh': 15.996169721412329, 'bear_atr_min_pct': 0.015874293132205276, 'bear_atr_max_pct': 0.03189154083219087, 'bear_tp_mult': 1.0101290365139823, 'bear_tsl_mult': 0.41077524761498785, 'bear_time_stop': 9, 'bear_use_sma': False, 'bear_use_ema': False, 'bear_use_atr': False, 'bear_use_adx': False, 'bear_use_spike': True, 'bear_rsi_required': True, 'sideways_strategy': 'mean_reversion', 'sideways_bb_std_mult': 3.188169145664722, 'sideways_rsi_os': 37, 'sideways_rsi_ob': 63, 'sideways_adx_thresh': 21.32108302474475, 'sideways_atr_min_pct': 0.0005892121808290034, 'sideways_atr_max_pct': 0.03308904371045342, 'sideways_tp_mult': 1.9744621444254713, 'sideways_tsl_mult': 0.9606290396016227, 'sideways_time_stop': 171, 'sideways_use_sma': False, 'sideways_use_ema': True, 'sideways_use_atr': False, 'sideways_use_adx': True, 'sideways_use_spike': True, 'sideways_rsi_required': True}.
[I 2025-08-30 19:53:00,098] Trial 730 finished with values: [-0.11217718240054331, 0.11211779118150464] and parameters: {'p_sma': 60, 'p_std': 26, 'p_atr': 8, 'p_adx': 20, 'rsi_period': 61, 'ema1': 9, 'ema2': 50, 'slip_atr_k': 0.24419647453178528, 'slip_spread_k': 0.34853765387082797, 'spread_hl_frac': 0.02453068882231113, 'bb_std_mult': 2.3730605260135165, 'rsi_os': 48, 'rsi_ob': 83, 'vol_spike': 0.03749083289377543, 'adx_thresh': 31.58523469840709, 'atr_min_pct': 0.023075134633833087, 'atr_max_pct': 0.09641129820310425, 'tp_mult': 2.298977317206147, 'tsl_mult': 0.8381479654324162, 'strategy': 'breakout', 'time_stop': 26, 'use_sma': False, 'use_atr': True, 'use_adx': True, 'use_ema': False, 'use_spike': True, 'rsi_required': True, 'edge_k': 0.15641045674990806, 'edge_cap': 0.523215412367798, 'bull_strategy': 'breakout', 'bull_bb_std_mult': 2.4671853352411435, 'bull_rsi_os': 36, 'bull_rsi_ob': 45, 'bull_adx_thresh': 27.29351905375914, 'bull_atr_min_pct': 0.001519253922767484, 'bull_atr_max_pct': 0.05927563485877709, 'bull_tp_mult': 1.4782291476410399, 'bull_tsl_mult': 0.559907249687714, 'bull_time_stop': 144, 'bull_use_sma': False, 'bull_use_ema': False, 'bull_use_atr': True, 'bull_use_adx': False, 'bull_use_spike': True, 'bull_rsi_required': True, 'bear_strategy': 'breakout', 'bear_bb_std_mult': 3.0734892109959913, 'bear_rsi_os': 5, 'bear_rsi_ob': 67, 'bear_adx_thresh': 18.49061988691787, 'bear_atr_min_pct': 0.01696026200857177, 'bear_atr_max_pct': 0.06240807469450658, 'bear_tp_mult': 1.4375367224558657, 'bear_tsl_mult': 0.8054651528689425, 'bear_time_stop': 205, 'bear_use_sma': False, 'bear_use_ema': True, 'bear_use_atr': False, 'bear_use_adx': True, 'bear_use_spike': True, 'bear_rsi_required': True, 'sideways_strategy': 'mean_reversion', 'sideways_bb_std_mult': 3.181284730633011, 'sideways_rsi_os': 28, 'sideways_rsi_ob': 57, 'sideways_adx_thresh': 21.316149424713117, 'sideways_atr_min_pct': 0.0008089407975737483, 'sideways_atr_max_pct': 0.14737216984698426, 'sideways_tp_mult': 1.4773560814335438, 'sideways_tsl_mult': 0.9826214282098202, 'sideways_time_stop': 173, 'sideways_use_sma': False, 'sideways_use_ema': False, 'sideways_use_atr': True, 'sideways_use_adx': True, 'sideways_use_spike': False, 'sideways_rsi_required': False}.
[I 2025-08-30 19:53:02,353] Trial 732 finished with values: [-1000000000.0, 1000000000.0] and parameters: {'p_sma': 7, 'p_std': 57, 'p_atr': 8, 'p_adx': 19, 'rsi_period': 27, 'ema1': 27, 'ema2': 20, 'slip_atr_k': 0.17614784042624268, 'slip_spread_k': 0.12084943427503644, 'spread_hl_frac': 0.024371858024534496, 'bb_std_mult': 1.7142777596304057, 'rsi_os': 48, 'rsi_ob': 83, 'vol_spike': 0.0393051544631933, 'adx_thresh': 28.02584055029363, 'atr_min_pct': 0.011003753982737867, 'atr_max_pct': 0.10406826489376363, 'tp_mult': 2.3354723375545547, 'tsl_mult': 0.5854341743952678, 'strategy': 'breakout', 'time_stop': 30, 'use_sma': False, 'use_atr': True, 'use_adx': True, 'use_ema': False, 'use_spike': True, 'rsi_required': False, 'edge_k': 0.10807171569150523, 'edge_cap': 0.5042535594732221, 'bull_strategy': 'mean_reversion', 'bull_bb_std_mult': 1.7226595970966976, 'bull_rsi_os': 48, 'bull_rsi_ob': 72, 'bull_adx_thresh': 30.83846514928532, 'bull_atr_min_pct': 0.028409305605384773, 'bull_atr_max_pct': 0.11561103847402886, 'bull_tp_mult': 1.2376104697429313, 'bull_tsl_mult': 0.5702956116667397, 'bull_time_stop': 188, 'bull_use_sma': False, 'bull_use_ema': True, 'bull_use_atr': False, 'bull_use_adx': False, 'bull_use_spike': False, 'bull_rsi_required': False, 'bear_strategy': 'breakout', 'bear_bb_std_mult': 2.924325763582492, 'bear_rsi_os': 5, 'bear_rsi_ob': 75, 'bear_adx_thresh': 18.571981920145486, 'bear_atr_min_pct': 0.01699449521769846, 'bear_atr_max_pct': 0.06283761440132593, 'bear_tp_mult': 2.5655745932602585, 'bear_tsl_mult': 0.9781907416799802, 'bear_time_stop': 145, 'bear_use_sma': True, 'bear_use_ema': True, 'bear_use_atr': False, 'bear_use_adx': True, 'bear_use_spike': False, 'bear_rsi_required': False, 'sideways_strategy': 'breakout', 'sideways_bb_std_mult': 1.6239492779004474, 'sideways_rsi_os': 28, 'sideways_rsi_ob': 46, 'sideways_adx_thresh': 21.47868398097123, 'sideways_atr_min_pct': 0.013401629418506476, 'sideways_atr_max_pct': 0.14997323479400285, 'sideways_tp_mult': 1.9773866971317158, 'sideways_tsl_mult': 0.9995510395173827, 'sideways_time_stop': 144, 'sideways_use_sma': False, 'sideways_use_ema': False, 'sideways_use_atr': True, 'sideways_use_adx': False, 'sideways_use_spike': False, 'sideways_rsi_required': False}.
[I 2025-08-30 19:53:02,385] Trial 731 finished with values: [-1000000000.0, 1000000000.0] and parameters: {'p_sma': 7, 'p_std': 30, 'p_atr': 8, 'p_adx': 19, 'rsi_period': 21, 'ema1': 9, 'ema2': 11, 'slip_atr_k': 0.06296170166523471, 'slip_spread_k': 0.22974660959183968, 'spread_hl_frac': 0.0008041152963122154, 'bb_std_mult': 2.3656890292089203, 'rsi_os': 48, 'rsi_ob': 83, 'vol_spike': 0.27650176199801063, 'adx_thresh': 13.96118837940967, 'atr_min_pct': 0.022377305617633687, 'atr_max_pct': 0.027066602590572142, 'tp_mult': 2.297425630050134, 'tsl_mult': 0.8363508373486279, 'strategy': 'breakout', 'time_stop': 54, 'use_sma': False, 'use_atr': True, 'use_adx': True, 'use_ema': False, 'use_spike': True, 'rsi_required': False, 'edge_k': 0.16036488335967725, 'edge_cap': 0.7855319412522158, 'bull_strategy': 'breakout', 'bull_bb_std_mult': 1.6911726872357329, 'bull_rsi_os': 33, 'bull_rsi_ob': 94, 'bull_adx_thresh': 27.480674460455063, 'bull_atr_min_pct': 0.0034156411244787846, 'bull_atr_max_pct': 0.05725088415787231, 'bull_tp_mult': 1.4977835060751072, 'bull_tsl_mult': 0.5685645894960265, 'bull_time_stop': 190, 'bull_use_sma': False, 'bull_use_ema': True, 'bull_use_atr': True, 'bull_use_adx': False, 'bull_use_spike': False, 'bull_rsi_required': True, 'bear_strategy': 'breakout', 'bear_bb_std_mult': 3.4657791995308314, 'bear_rsi_os': 53, 'bear_rsi_ob': 78, 'bear_adx_thresh': 18.272665364691072, 'bear_atr_min_pct': 0.016763129731494693, 'bear_atr_max_pct': 0.03772944528838423, 'bear_tp_mult': 2.711175939649989, 'bear_tsl_mult': 0.7430173073805117, 'bear_time_stop': 194, 'bear_use_sma': False, 'bear_use_ema': True, 'bear_use_atr': False, 'bear_use_adx': True, 'bear_use_spike': False, 'bear_rsi_required': False, 'sideways_strategy': 'breakout', 'sideways_bb_std_mult': 3.165268489345949, 'sideways_rsi_os': 28, 'sideways_rsi_ob': 46, 'sideways_adx_thresh': 21.366173416588587, 'sideways_atr_min_pct': 0.013550771278051085, 'sideways_atr_max_pct': 0.11917133366122551, 'sideways_tp_mult': 1.9930474384461596, 'sideways_tsl_mult': 0.9998601705453435, 'sideways_time_stop': 77, 'sideways_use_sma': False, 'sideways_use_ema': False, 'sideways_use_atr': True, 'sideways_use_adx': False, 'sideways_use_spike': False, 'sideways_rsi_required': False}.
[I 2025-08-30 19:53:02,670] Trial 733 finished with values: [-1000000000.0, 1000000000.0] and parameters: {'p_sma': 22, 'p_std': 49, 'p_atr': 10, 'p_adx': 19, 'rsi_period': 14, 'ema1': 25, 'ema2': 30, 'slip_atr_k': 0.18111989908637768, 'slip_spread_k': 0.3508263560944411, 'spread_hl_frac': 0.024069627841176177, 'bb_std_mult': 2.058805081536057, 'rsi_os': 48, 'rsi_ob': 71, 'vol_spike': 0.06615763534895626, 'adx_thresh': 27.67814049386778, 'atr_min_pct': 0.0037487002448656145, 'atr_max_pct': 0.08977678268987693, 'tp_mult': 1.2857227446921056, 'tsl_mult': 0.21706803072265152, 'strategy': 'breakout', 'time_stop': 177, 'use_sma': False, 'use_atr': True, 'use_adx': True, 'use_ema': False, 'use_spike': True, 'rsi_required': False, 'edge_k': 0.10111473388890385, 'edge_cap': 0.497689406067405, 'bull_strategy': 'mean_reversion', 'bull_bb_std_mult': 2.471975959764131, 'bull_rsi_os': 17, 'bull_rsi_ob': 87, 'bull_adx_thresh': 17.897482466787956, 'bull_atr_min_pct': 0.0003698167092684782, 'bull_atr_max_pct': 0.06545842734621049, 'bull_tp_mult': 2.6522932979036935, 'bull_tsl_mult': 0.8214157663855665, 'bull_time_stop': 5, 'bull_use_sma': False, 'bull_use_ema': True, 'bull_use_atr': False, 'bull_use_adx': False, 'bull_use_spike': False, 'bull_rsi_required': False, 'bear_strategy': 'breakout', 'bear_bb_std_mult': 1.5082674307067794, 'bear_rsi_os': 52, 'bear_rsi_ob': 78, 'bear_adx_thresh': 14.824865655793081, 'bear_atr_min_pct': 0.029257395136161865, 'bear_atr_max_pct': 0.06362633867917626, 'bear_tp_mult': 2.7990960268463643, 'bear_tsl_mult': 0.542513333466815, 'bear_time_stop': 194, 'bear_use_sma': True, 'bear_use_ema': True, 'bear_use_atr': False, 'bear_use_adx': True, 'bear_use_spike': False, 'bear_rsi_required': False, 'sideways_strategy': 'breakout', 'sideways_bb_std_mult': 1.6042377555989855, 'sideways_rsi_os': 6, 'sideways_rsi_ob': 46, 'sideways_adx_thresh': 22.431403608495774, 'sideways_atr_min_pct': 0.024680345656606865, 'sideways_atr_max_pct': 0.14993658165826101, 'sideways_tp_mult': 2.8685426021992164, 'sideways_tsl_mult': 0.9832793110746478, 'sideways_time_stop': 135, 'sideways_use_sma': False, 'sideways_use_ema': False, 'sideways_use_atr': True, 'sideways_use_adx': False, 'sideways_use_spike': False, 'sideways_rsi_required': False}.
[I 2025-08-30 19:53:03,545] Trial 736 finished with values: [-1000000000.0, 1000000000.0] and parameters: {'p_sma': 31, 'p_std': 33, 'p_atr': 22, 'p_adx': 19, 'rsi_period': 22, 'ema1': 25, 'ema2': 54, 'slip_atr_k': 0.08233762704607975, 'slip_spread_k': 0.16476587346879643, 'spread_hl_frac': 0.02018654400777229, 'bb_std_mult': 2.0466506588829243, 'rsi_os': 50, 'rsi_ob': 73, 'vol_spike': 0.0641343915723554, 'adx_thresh': 34.55061477744222, 'atr_min_pct': 0.019623964702772362, 'atr_max_pct': 0.13612152996810353, 'tp_mult': 2.247254056467419, 'tsl_mult': 0.8032884892060443, 'strategy': 'mean_reversion', 'time_stop': 181, 'use_sma': False, 'use_atr': True, 'use_adx': True, 'use_ema': False, 'use_spike': True, 'rsi_required': False, 'edge_k': 0.44994885263279394, 'edge_cap': 0.49507254653812865, 'bull_strategy': 'mean_reversion', 'bull_bb_std_mult': 3.0613239813862627, 'bull_rsi_os': 43, 'bull_rsi_ob': 48, 'bull_adx_thresh': 25.52726186086617, 'bull_atr_min_pct': 0.0020699375483449163, 'bull_atr_max_pct': 0.020555964930204146, 'bull_tp_mult': 2.655909418394646, 'bull_tsl_mult': 0.1454350270213597, 'bull_time_stop': 160, 'bull_use_sma': False, 'bull_use_ema': True, 'bull_use_atr': False, 'bull_use_adx': True, 'bull_use_spike': False, 'bull_rsi_required': False, 'bear_strategy': 'breakout', 'bear_bb_std_mult': 1.3185895953899824, 'bear_rsi_os': 52, 'bear_rsi_ob': 54, 'bear_adx_thresh': 25.311217774558855, 'bear_atr_min_pct': 0.0006738404070600005, 'bear_atr_max_pct': 0.03457777192882103, 'bear_tp_mult': 2.1529168454591834, 'bear_tsl_mult': 0.45167879262977245, 'bear_time_stop': 200, 'bear_use_sma': True, 'bear_use_ema': True, 'bear_use_atr': False, 'bear_use_adx': False, 'bear_use_spike': False, 'bear_rsi_required': True, 'sideways_strategy': 'breakout', 'sideways_bb_std_mult': 2.6057097114615164, 'sideways_rsi_os': 13, 'sideways_rsi_ob': 79, 'sideways_adx_thresh': 18.816831047247096, 'sideways_atr_min_pct': 0.0019120750426911397, 'sideways_atr_max_pct': 0.08554034662530667, 'sideways_tp_mult': 1.8302498437077857, 'sideways_tsl_mult': 0.1416968517065172, 'sideways_time_stop': 159, 'sideways_use_sma': False, 'sideways_use_ema': True, 'sideways_use_atr': True, 'sideways_use_adx': False, 'sideways_use_spike': False, 'sideways_rsi_required': True}.
[I 2025-08-30 19:53:03,559] Trial 735 finished with values: [-1000000000.0, 1000000000.0] and parameters: {'p_sma': 8, 'p_std': 33, 'p_atr': 10, 'p_adx': 19, 'rsi_period': 21, 'ema1': 22, 'ema2': 34, 'slip_atr_k': 0.20206044528262732, 'slip_spread_k': 0.22840874960302954, 'spread_hl_frac': 0.02328283408733294, 'bb_std_mult': 2.070213430379361, 'rsi_os': 50, 'rsi_ob': 73, 'vol_spike': 0.2751190369908593, 'adx_thresh': 10.918638217393301, 'atr_min_pct': 0.023761335674611483, 'atr_max_pct': 0.13679452863224414, 'tp_mult': 2.268415743348234, 'tsl_mult': 0.8036448614258384, 'strategy': 'mean_reversion', 'time_stop': 180, 'use_sma': False, 'use_atr': True, 'use_adx': True, 'use_ema': False, 'use_spike': True, 'rsi_required': False, 'edge_k': 0.4371777390310271, 'edge_cap': 0.3473555039727806, 'bull_strategy': 'mean_reversion', 'bull_bb_std_mult': 3.0742984930063537, 'bull_rsi_os': 33, 'bull_rsi_ob': 83, 'bull_adx_thresh': 17.79433274098654, 'bull_atr_min_pct': 0.0022794917520766317, 'bull_atr_max_pct': 0.01970441986356935, 'bull_tp_mult': 1.303596544569912, 'bull_tsl_mult': 0.49730700576177445, 'bull_time_stop': 191, 'bull_use_sma': False, 'bull_use_ema': True, 'bull_use_atr': False, 'bull_use_adx': False, 'bull_use_spike': False, 'bull_rsi_required': True, 'bear_strategy': 'breakout', 'bear_bb_std_mult': 2.803885238930106, 'bear_rsi_os': 52, 'bear_rsi_ob': 78, 'bear_adx_thresh': 14.823168762110363, 'bear_atr_min_pct': 1.3734215779208359e-06, 'bear_atr_max_pct': 0.03511178861009299, 'bear_tp_mult': 2.8920717998162315, 'bear_tsl_mult': 0.7788667821421925, 'bear_time_stop': 193, 'bear_use_sma': True, 'bear_use_ema': True, 'bear_use_atr': False, 'bear_use_adx': False, 'bear_use_spike': False, 'bear_rsi_required': False, 'sideways_strategy': 'breakout', 'sideways_bb_std_mult': 1.8625783444009532, 'sideways_rsi_os': 36, 'sideways_rsi_ob': 61, 'sideways_adx_thresh': 8.0810332693597, 'sideways_atr_min_pct': 0.023365837398286043, 'sideways_atr_max_pct': 0.07859321362757882, 'sideways_tp_mult': 1.0868471253025709, 'sideways_tsl_mult': 0.6167275845881542, 'sideways_time_stop': 157, 'sideways_use_sma': False, 'sideways_use_ema': True, 'sideways_use_atr': True, 'sideways_use_adx': False, 'sideways_use_spike': False, 'sideways_rsi_required': True}.
[I 2025-08-30 19:53:03,561] Trial 737 finished with values: [-1000000000.0, 1000000000.0] and parameters: {'p_sma': 19, 'p_std': 12, 'p_atr': 10, 'p_adx': 30, 'rsi_period': 54, 'ema1': 16, 'ema2': 34, 'slip_atr_k': 0.08179901410763228, 'slip_spread_k': 0.7444298405232974, 'spread_hl_frac': 0.020423402305477466, 'bb_std_mult': 2.182656918088625, 'rsi_os': 50, 'rsi_ob': 67, 'vol_spike': 0.25818251036878, 'adx_thresh': 22.886747009616165, 'atr_min_pct': 0.007795385559455619, 'atr_max_pct': 0.11071730353174358, 'tp_mult': 1.0962681703417223, 'tsl_mult': 0.8671961766365697, 'strategy': 'mean_reversion', 'time_stop': 183, 'use_sma': False, 'use_atr': True, 'use_adx': True, 'use_ema': False, 'use_spike': True, 'rsi_required': False, 'edge_k': 0.0647663046430891, 'edge_cap': 0.35811361360080357, 'bull_strategy': 'mean_reversion', 'bull_bb_std_mult': 0.9191025562982067, 'bull_rsi_os': 26, 'bull_rsi_ob': 89, 'bull_adx_thresh': 22.305108863548593, 'bull_atr_min_pct': 0.020039175362679563, 'bull_atr_max_pct': 0.09212458384632566, 'bull_tp_mult': 1.302045523949509, 'bull_tsl_mult': 0.5024846065607228, 'bull_time_stop': 175, 'bull_use_sma': False, 'bull_use_ema': True, 'bull_use_atr': True, 'bull_use_adx': True, 'bull_use_spike': False, 'bull_rsi_required': True, 'bear_strategy': 'breakout', 'bear_bb_std_mult': 1.03769917787517, 'bear_rsi_os': 52, 'bear_rsi_ob': 74, 'bear_adx_thresh': 17.63008006442534, 'bear_atr_min_pct': 0.01261215389268777, 'bear_atr_max_pct': 0.034956970682522195, 'bear_tp_mult': 2.623164912108894, 'bear_tsl_mult': 0.7829192620985855, 'bear_time_stop': 202, 'bear_use_sma': True, 'bear_use_ema': True, 'bear_use_atr': False, 'bear_use_adx': False, 'bear_use_spike': False, 'bear_rsi_required': True, 'sideways_strategy': 'breakout', 'sideways_bb_std_mult': 3.075242321761615, 'sideways_rsi_os': 36, 'sideways_rsi_ob': 54, 'sideways_adx_thresh': 12.433653169696816, 'sideways_atr_min_pct': 0.0019640531550952555, 'sideways_atr_max_pct': 0.08666176292160711, 'sideways_tp_mult': 1.0851680865574784, 'sideways_tsl_mult': 0.7427160542480046, 'sideways_time_stop': 28, 'sideways_use_sma': False, 'sideways_use_ema': True, 'sideways_use_atr': True, 'sideways_use_adx': False, 'sideways_use_spike': False, 'sideways_rsi_required': True}.
[I 2025-08-30 19:53:21,243] Trial 734 finished with values: [-0.052907720621123144, 0.05287134690683884] and parameters: {'p_sma': 30, 'p_std': 22, 'p_atr': 10, 'p_adx': 12, 'rsi_period': 27, 'ema1': 25, 'ema2': 23, 'slip_atr_k': 0.08204921369444487, 'slip_spread_k': 0.123166442321521, 'spread_hl_frac': 0.0050715563973424, 'bb_std_mult': 2.735185875284355, 'rsi_os': 48, 'rsi_ob': 73, 'vol_spike': 0.27507804741164016, 'adx_thresh': 34.97175476478888, 'atr_min_pct': 0.022456537838954693, 'atr_max_pct': 0.10418604278121651, 'tp_mult': 1.75344048251646, 'tsl_mult': 0.7549589463588411, 'strategy': 'breakout', 'time_stop': 181, 'use_sma': False, 'use_atr': True, 'use_adx': True, 'use_ema': False, 'use_spike': True, 'rsi_required': False, 'edge_k': 0.09326111260748722, 'edge_cap': 0.3485547017603583, 'bull_strategy': 'mean_reversion', 'bull_bb_std_mult': 3.0729372907532397, 'bull_rsi_os': 43, 'bull_rsi_ob': 46, 'bull_adx_thresh': 17.733499978472143, 'bull_atr_min_pct': 0.002105236803567585, 'bull_atr_max_pct': 0.06582881533379013, 'bull_tp_mult': 1.3299865920552145, 'bull_tsl_mult': 0.9775616305313293, 'bull_time_stop': 272, 'bull_use_sma': False, 'bull_use_ema': True, 'bull_use_atr': False, 'bull_use_adx': False, 'bull_use_spike': False, 'bull_rsi_required': False, 'bear_strategy': 'breakout', 'bear_bb_std_mult': 1.2033793256538092, 'bear_rsi_os': 52, 'bear_rsi_ob': 54, 'bear_adx_thresh': 20.957933085949616, 'bear_atr_min_pct': 0.029414076962626046, 'bear_atr_max_pct': 0.0352425013587357, 'bear_tp_mult': 1.1348193035639145, 'bear_tsl_mult': 0.9800842335053914, 'bear_time_stop': 195, 'bear_use_sma': True, 'bear_use_ema': True, 'bear_use_atr': False, 'bear_use_adx': True, 'bear_use_spike': False, 'bear_rsi_required': False, 'sideways_strategy': 'breakout', 'sideways_bb_std_mult': 3.243624939412927, 'sideways_rsi_os': 36, 'sideways_rsi_ob': 54, 'sideways_adx_thresh': 12.12619090758242, 'sideways_atr_min_pct': 0.001627250451111259, 'sideways_atr_max_pct': 0.08600676921911435, 'sideways_tp_mult': 2.8687531890238818, 'sideways_tsl_mult': 0.35373663474124384, 'sideways_time_stop': 144, 'sideways_use_sma': False, 'sideways_use_ema': True, 'sideways_use_atr': True, 'sideways_use_adx': False, 'sideways_use_spike': False, 'sideways_rsi_required': True}.
