[I 2025-08-30 18:32:53,748] Trial 37 finished with values: [-1000000000.0, 1000000000.0] and parameters: {'p_sma': 34, 'p_std': 48, 'p_atr': 28, 'p_adx': 27, 'rsi_period': 36, 'ema1': 15, 'ema2': 19, 'slip_atr_k': 0.1695558995845777, 'slip_spread_k': 0.4459120652841253, 'spread_hl_frac': 0.0017131688806177325, 'bb_std_mult': 2.2187964577430526, 'rsi_os': 29, 'rsi_ob': 56, 'vol_spike': 0.20100989709580067, 'adx_thresh': 22.74670681184928, 'atr_min_pct': 0.017070696246192875, 'atr_max_pct': 0.11649052877295835, 'tp_mult': 1.8647733228808592, 'tsl_mult': 0.13561252601855506, 'strategy': 'mean_reversion', 'time_stop': 244, 'use_sma': True, 'use_atr': True, 'use_adx': True, 'use_ema': False, 'use_spike': True, 'rsi_required': False, 'edge_k': 0.5117488677824302, 'edge_cap': 0.20756711931516678, 'bull_strategy': 'breakout', 'bull_bb_std_mult': 2.0371840073874443, 'bull_rsi_os': 5, 'bull_rsi_ob': 52, 'bull_adx_thresh': 22.594827027970805, 'bull_atr_min_pct': 0.006524397756176147, 'bull_atr_max_pct': 0.04657486306327051, 'bull_tp_mult': 1.0877344287626354, 'bull_tsl_mult': 0.27071033344405054, 'bull_time_stop': 147, 'bull_use_sma': False, 'bull_use_ema': False, 'bull_use_atr': True, 'bull_use_adx': False, 'bull_use_spike': False, 'bull_rsi_required': False, 'bear_strategy': 'mean_reversion', 'bear_bb_std_mult': 3.512816672295922, 'bear_rsi_os': 55, 'bear_rsi_ob': 84, 'bear_adx_thresh': 27.20953290990667, 'bear_atr_min_pct': 0.02093704735364265, 'bear_atr_max_pct': 0.1350800791201506, 'bear_tp_mult': 1.8712991081588146, 'bear_tsl_mult': 0.6821115857720575, 'bear_time_stop': 159, 'bear_use_sma': False, 'bear_use_ema': True, 'bear_use_atr': True, 'bear_use_adx': True, 'bear_use_spike': False, 'bear_rsi_required': False, 'sideways_strategy': 'breakout', 'sideways_bb_std_mult': 2.615169140656257, 'sideways_rsi_os': 19, 'sideways_rsi_ob': 79, 'sideways_adx_thresh': 21.81952309907468, 'sideways_atr_min_pct': 0.023269802022641388, 'sideways_atr_max_pct': 0.07016023142785394, 'sideways_tp_mult': 2.709981014333149, 'sideways_tsl_mult': 0.4261685068574837, 'sideways_time_stop': 205, 'sideways_use_sma': False, 'sideways_use_ema': False, 'sideways_use_atr': True, 'sideways_use_adx': False, 'sideways_use_spike': False, 'sideways_rsi_required': False}.
[I 2025-08-30 18:32:54,261] Trial 38 finished with values: [-1000000000.0, 1000000000.0] and parameters: {'p_sma': 57, 'p_std': 28, 'p_atr': 30, 'p_adx': 28, 'rsi_period': 14, 'ema1': 16, 'ema2': 20, 'slip_atr_k': 0.16879709428812376, 'slip_spread_k': 0.4695927420580692, 'spread_hl_frac': 0.023632233835976763, 'bb_std_mult': 2.222297163066338, 'rsi_os': 22, 'rsi_ob': 56, 'vol_spike': 0.12716222360661325, 'adx_thresh': 22.92579043998954, 'atr_min_pct': 0.0063135342500836265, 'atr_max_pct': 0.1140376212881733, 'tp_mult': 1.8877643786096852, 'tsl_mult': 0.14877842881122488, 'strategy': 'mean_reversion', 'time_stop': 234, 'use_sma': True, 'use_atr': False, 'use_adx': True, 'use_ema': False, 'use_spike': True, 'rsi_required': False, 'edge_k': 0.6861537145292909, 'edge_cap': 0.8102545878895451, 'bull_strategy': 'breakout', 'bull_bb_std_mult': 0.7961241430374475, 'bull_rsi_os': 5, 'bull_rsi_ob': 72, 'bull_adx_thresh': 31.76509445811819, 'bull_atr_min_pct': 0.006411726946495892, 'bull_atr_max_pct': 0.04745448352730249, 'bull_tp_mult': 1.0858042329866644, 'bull_tsl_mult': 0.2824123793719008, 'bull_time_stop': 299, 'bull_use_sma': False, 'bull_use_ema': False, 'bull_use_atr': True, 'bull_use_adx': False, 'bull_use_spike': True, 'bull_rsi_required': False, 'bear_strategy': 'mean_reversion', 'bear_bb_std_mult': 3.4669557373879365, 'bear_rsi_os': 52, 'bear_rsi_ob': 69, 'bear_adx_thresh': 26.644735390021346, 'bear_atr_min_pct': 0.023991855271140256, 'bear_atr_max_pct': 0.012733823121667417, 'bear_tp_mult': 1.8625022856966307, 'bear_tsl_mult': 0.6909923140693184, 'bear_time_stop': 204, 'bear_use_sma': False, 'bear_use_ema': True, 'bear_use_atr': True, 'bear_use_adx': True, 'bear_use_spike': False, 'bear_rsi_required': True, 'sideways_strategy': 'breakout', 'sideways_bb_std_mult': 2.624719527719937, 'sideways_rsi_os': 19, 'sideways_rsi_ob': 78, 'sideways_adx_thresh': 22.034049512859603, 'sideways_atr_min_pct': 0.007261672965515347, 'sideways_atr_max_pct': 0.11200327691527551, 'sideways_tp_mult': 2.8042605346719376, 'sideways_tsl_mult': 0.32890249982366393, 'sideways_time_stop': 212, 'sideways_use_sma': False, 'sideways_use_ema': False, 'sideways_use_atr': True, 'sideways_use_adx': True, 'sideways_use_spike': False, 'sideways_rsi_required': False}.
[I 2025-08-30 18:32:54,470] Trial 36 finished with values: [-1000000000.0, 1000000000.0] and parameters: {'p_sma': 60, 'p_std': 49, 'p_atr': 30, 'p_adx': 30, 'rsi_period': 30, 'ema1': 16, 'ema2': 19, 'slip_atr_k': 0.16681911851755316, 'slip_spread_k': 0.46215782122426624, 'spread_hl_frac': 0.045790496852628405, 'bb_std_mult': 0.8044378551860047, 'rsi_os': 28, 'rsi_ob': 56, 'vol_spike': 0.2006084416609088, 'adx_thresh': 6.408457227363607, 'atr_min_pct': 0.005709446598833659, 'atr_max_pct': 0.11811053217462339, 'tp_mult': 1.8557106949594653, 'tsl_mult': 0.691334032643809, 'strategy': 'mean_reversion', 'time_stop': 197, 'use_sma': True, 'use_atr': False, 'use_adx': True, 'use_ema': False, 'use_spike': False, 'rsi_required': True, 'edge_k': 0.6302588870036917, 'edge_cap': 0.2148020524080981, 'bull_strategy': 'breakout', 'bull_bb_std_mult': 0.7309055514281002, 'bull_rsi_os': 5, 'bull_rsi_ob': 53, 'bull_adx_thresh': 22.449758879788213, 'bull_atr_min_pct': 0.006652461655711563, 'bull_atr_max_pct': 0.04859798463935222, 'bull_tp_mult': 1.0318064926098134, 'bull_tsl_mult': 0.28555926282083616, 'bull_time_stop': 300, 'bull_use_sma': True, 'bull_use_ema': True, 'bull_use_atr': False, 'bull_use_adx': True, 'bull_use_spike': True, 'bull_rsi_required': False, 'bear_strategy': 'mean_reversion', 'bear_bb_std_mult': 3.51388295917742, 'bear_rsi_os': 54, 'bear_rsi_ob': 85, 'bear_adx_thresh': 11.356118956858028, 'bear_atr_min_pct': 0.028303648637721127, 'bear_atr_max_pct': 0.13463653912680074, 'bear_tp_mult': 1.829396022015036, 'bear_tsl_mult': 0.6826661008929846, 'bear_time_stop': 162, 'bear_use_sma': False, 'bear_use_ema': True, 'bear_use_atr': True, 'bear_use_adx': True, 'bear_use_spike': True, 'bear_rsi_required': True, 'sideways_strategy': 'breakout', 'sideways_bb_std_mult': 2.5590217714966186, 'sideways_rsi_os': 18, 'sideways_rsi_ob': 85, 'sideways_adx_thresh': 22.136744643446868, 'sideways_atr_min_pct': 0.01721818803545422, 'sideways_atr_max_pct': 0.06814123717361584, 'sideways_tp_mult': 2.6996825404899285, 'sideways_tsl_mult': 0.8977207116824003, 'sideways_time_stop': 207, 'sideways_use_sma': True, 'sideways_use_ema': False, 'sideways_use_atr': True, 'sideways_use_adx': True, 'sideways_use_spike': False, 'sideways_rsi_required': True}.
[I 2025-08-30 18:33:27,173] Trial 39 finished with values: [-1000000000.0, 1000000000.0] and parameters: {'p_sma': 33, 'p_std': 27, 'p_atr': 30, 'p_adx': 28, 'rsi_period': 25, 'ema1': 8, 'ema2': 14, 'slip_atr_k': 0.17200261457304894, 'slip_spread_k': 0.27677950890572023, 'spread_hl_frac': 0.04513258343815995, 'bb_std_mult': 2.675803529162204, 'rsi_os': 28, 'rsi_ob': 57, 'vol_spike': 0.03595878668933128, 'adx_thresh': 19.071652388641493, 'atr_min_pct': 0.008345513491581021, 'atr_max_pct': 0.11126270666772511, 'tp_mult': 1.8334183350082918, 'tsl_mult': 0.17167495754513307, 'strategy': 'breakout', 'time_stop': 160, 'use_sma': True, 'use_atr': True, 'use_adx': True, 'use_ema': True, 'use_spike': True, 'rsi_required': False, 'edge_k': 0.6987035610549125, 'edge_cap': 0.8519836406260582, 'bull_strategy': 'mean_reversion', 'bull_bb_std_mult': 2.0331300540134465, 'bull_rsi_os': 5, 'bull_rsi_ob': 77, 'bull_adx_thresh': 7.714477127018183, 'bull_atr_min_pct': 0.006343639543100837, 'bull_atr_max_pct': 0.04988995592546689, 'bull_tp_mult': 1.3405892098568195, 'bull_tsl_mult': 0.2713105365154204, 'bull_time_stop': 225, 'bull_use_sma': False, 'bull_use_ema': False, 'bull_use_atr': True, 'bull_use_adx': False, 'bull_use_spike': False, 'bull_rsi_required': False, 'bear_strategy': 'breakout', 'bear_bb_std_mult': 3.5288268092500474, 'bear_rsi_os': 13, 'bear_rsi_ob': 95, 'bear_adx_thresh': 26.755823894182416, 'bear_atr_min_pct': 0.02254780830928165, 'bear_atr_max_pct': 0.028053879834336375, 'bear_tp_mult': 2.0738125101910643, 'bear_tsl_mult': 0.34430882323304457, 'bear_time_stop': 205, 'bear_use_sma': True, 'bear_use_ema': True, 'bear_use_atr': True, 'bear_use_adx': True, 'bear_use_spike': False, 'bear_rsi_required': False, 'sideways_strategy': 'breakout', 'sideways_bb_std_mult': 3.4499596100685586, 'sideways_rsi_os': 18, 'sideways_rsi_ob': 70, 'sideways_adx_thresh': 10.018999664264626, 'sideways_atr_min_pct': 0.023215055261094613, 'sideways_atr_max_pct': 0.11010986850333336, 'sideways_tp_mult': 2.5866627805494202, 'sideways_tsl_mult': 0.3571918790674302, 'sideways_time_stop': 130, 'sideways_use_sma': False, 'sideways_use_ema': True, 'sideways_use_atr': False, 'sideways_use_adx': False, 'sideways_use_spike': False, 'sideways_rsi_required': False}.
[I 2025-08-30 18:33:28,146] Trial 40 finished with values: [-1000000000.0, 1000000000.0] and parameters: {'p_sma': 59, 'p_std': 28, 'p_atr': 29, 'p_adx': 14, 'rsi_period': 12, 'ema1': 30, 'ema2': 46, 'slip_atr_k': 0.0266642823707562, 'slip_spread_k': 0.26641942695274506, 'spread_hl_frac': 0.043891585176652204, 'bb_std_mult': 2.6040779760253994, 'rsi_os': 11, 'rsi_ob': 49, 'vol_spike': 0.12976660799187315, 'adx_thresh': 19.393627397716422, 'atr_min_pct': 0.0024988969674883204, 'atr_max_pct': 0.12058574422523399, 'tp_mult': 1.8508836011896381, 'tsl_mult': 0.5906487974774479, 'strategy': 'breakout', 'time_stop': 152, 'use_sma': False, 'use_atr': True, 'use_adx': True, 'use_ema': True, 'use_spike': True, 'rsi_required': False, 'edge_k': 1.1023742392405667, 'edge_cap': 0.882078871536426, 'bull_strategy': 'mean_reversion', 'bull_bb_std_mult': 0.8159832476924211, 'bull_rsi_os': 8, 'bull_rsi_ob': 75, 'bull_adx_thresh': 18.468055377433032, 'bull_atr_min_pct': 0.005710564920870164, 'bull_atr_max_pct': 0.09895395522017778, 'bull_tp_mult': 2.5177417490313765, 'bull_tsl_mult': 0.3687382460740041, 'bull_time_stop': 227, 'bull_use_sma': False, 'bull_use_ema': False, 'bull_use_atr': True, 'bull_use_adx': False, 'bull_use_spike': False, 'bull_rsi_required': True, 'bear_strategy': 'breakout', 'bear_bb_std_mult': 3.443419272253055, 'bear_rsi_os': 12, 'bear_rsi_ob': 68, 'bear_adx_thresh': 11.957840225202823, 'bear_atr_min_pct': 0.026519136610770863, 'bear_atr_max_pct': 0.028208255918854876, 'bear_tp_mult': 2.048623517872404, 'bear_tsl_mult': 0.5224092094572517, 'bear_time_stop': 249, 'bear_use_sma': True, 'bear_use_ema': True, 'bear_use_atr': False, 'bear_use_adx': True, 'bear_use_spike': False, 'bear_rsi_required': False, 'sideways_strategy': 'breakout', 'sideways_bb_std_mult': 2.9205843625049477, 'sideways_rsi_os': 30, 'sideways_rsi_ob': 71, 'sideways_adx_thresh': 9.449813043403738, 'sideways_atr_min_pct': 0.009946376008678402, 'sideways_atr_max_pct': 0.1087766230503297, 'sideways_tp_mult': 1.7424810147014431, 'sideways_tsl_mult': 0.2687569616448646, 'sideways_time_stop': 133, 'sideways_use_sma': False, 'sideways_use_ema': True, 'sideways_use_atr': False, 'sideways_use_adx': False, 'sideways_use_spike': True, 'sideways_rsi_required': False}.
[I 2025-08-30 18:33:28,146] Trial 41 finished with values: [-1000000000.0, 1000000000.0] and parameters: {'p_sma': 52, 'p_std': 18, 'p_atr': 27, 'p_adx': 22, 'rsi_period': 49, 'ema1': 30, 'ema2': 46, 'slip_atr_k': 0.02658304762909873, 'slip_spread_k': 0.2646249968233316, 'spread_hl_frac': 0.04524065452392772, 'bb_std_mult': 2.7925356736244713, 'rsi_os': 28, 'rsi_ob': 49, 'vol_spike': 0.03586815591093767, 'adx_thresh': 19.764742696538633, 'atr_min_pct': 0.008333171403180158, 'atr_max_pct': 0.12617893759113233, 'tp_mult': 1.7366124778874417, 'tsl_mult': 0.5760550678080348, 'strategy': 'breakout', 'time_stop': 177, 'use_sma': False, 'use_atr': True, 'use_adx': True, 'use_ema': True, 'use_spike': False, 'rsi_required': False, 'edge_k': 1.1071191578182458, 'edge_cap': 0.21514548964837218, 'bull_strategy': 'mean_reversion', 'bull_bb_std_mult': 1.4138921296706435, 'bull_rsi_os': 8, 'bull_rsi_ob': 59, 'bull_adx_thresh': 19.2532747344174, 'bull_atr_min_pct': 0.017654908646025584, 'bull_atr_max_pct': 0.09811758325175875, 'bull_tp_mult': 2.483289639158932, 'bull_tsl_mult': 0.38454832183049714, 'bull_time_stop': 40, 'bull_use_sma': False, 'bull_use_ema': False, 'bull_use_atr': False, 'bull_use_adx': True, 'bull_use_spike': False, 'bull_rsi_required': True, 'bear_strategy': 'breakout', 'bear_bb_std_mult': 2.872941040988238, 'bear_rsi_os': 12, 'bear_rsi_ob': 78, 'bear_adx_thresh': 12.785610214845027, 'bear_atr_min_pct': 0.02624369967696638, 'bear_atr_max_pct': 0.09425353042694035, 'bear_tp_mult': 2.063747668917544, 'bear_tsl_mult': 0.29724855211699086, 'bear_time_stop': 202, 'bear_use_sma': True, 'bear_use_ema': True, 'bear_use_atr': False, 'bear_use_adx': True, 'bear_use_spike': False, 'bear_rsi_required': False, 'sideways_strategy': 'mean_reversion', 'sideways_bb_std_mult': 2.889110650230843, 'sideways_rsi_os': 29, 'sideways_rsi_ob': 71, 'sideways_adx_thresh': 9.830193050882201, 'sideways_atr_min_pct': 0.009105361558102161, 'sideways_atr_max_pct': 0.08627346845929286, 'sideways_tp_mult': 1.7254613105563599, 'sideways_tsl_mult': 0.20692502879632452, 'sideways_time_stop': 135, 'sideways_use_sma': True, 'sideways_use_ema': True, 'sideways_use_atr': False, 'sideways_use_adx': False, 'sideways_use_spike': True, 'sideways_rsi_required': False}.
[I 2025-08-30 18:33:28,543] Trial 42 finished with values: [-1000000000.0, 1000000000.0] and parameters: {'p_sma': 42, 'p_std': 18, 'p_atr': 27, 'p_adx': 22, 'rsi_period': 48, 'ema1': 30, 'ema2': 13, 'slip_atr_k': 0.14047001347644472, 'slip_spread_k': 0.2754327455380359, 'spread_hl_frac': 0.026473025778071937, 'bb_std_mult': 2.96908130649006, 'rsi_os': 10, 'rsi_ob': 49, 'vol_spike': 0.03366339601897478, 'adx_thresh': 19.4173106715588, 'atr_min_pct': 0.009024431193720352, 'atr_max_pct': 0.12768586704134802, 'tp_mult': 1.7058033214245325, 'tsl_mult': 0.5604309897314994, 'strategy': 'breakout', 'time_stop': 164, 'use_sma': False, 'use_atr': True, 'use_adx': True, 'use_ema': True, 'use_spike': True, 'rsi_required': False, 'edge_k': 1.0865004262986324, 'edge_cap': 0.8102418324572396, 'bull_strategy': 'mean_reversion', 'bull_bb_std_mult': 2.075951702089208, 'bull_rsi_os': 54, 'bull_rsi_ob': 58, 'bull_adx_thresh': 26.98085173492984, 'bull_atr_min_pct': 0.017560924579178492, 'bull_atr_max_pct': 0.09801157132681089, 'bull_tp_mult': 2.4725641879094526, 'bull_tsl_mult': 0.10495586983027455, 'bull_time_stop': 223, 'bull_use_sma': False, 'bull_use_ema': False, 'bull_use_atr': True, 'bull_use_adx': False, 'bull_use_spike': False, 'bull_rsi_required': True, 'bear_strategy': 'breakout', 'bear_bb_std_mult': 1.3577674201379262, 'bear_rsi_os': 29, 'bear_rsi_ob': 79, 'bear_adx_thresh': 12.924823378411384, 'bear_atr_min_pct': 0.00177538022853632, 'bear_atr_max_pct': 0.09184763463740539, 'bear_tp_mult': 2.026055897909126, 'bear_tsl_mult': 0.3530941459170265, 'bear_time_stop': 245, 'bear_use_sma': True, 'bear_use_ema': True, 'bear_use_atr': False, 'bear_use_adx': True, 'bear_use_spike': False, 'bear_rsi_required': False, 'sideways_strategy': 'mean_reversion', 'sideways_bb_std_mult': 2.9127699163810696, 'sideways_rsi_os': 31, 'sideways_rsi_ob': 71, 'sideways_adx_thresh': 10.39071997453131, 'sideways_atr_min_pct': 0.025122474224644337, 'sideways_atr_max_pct': 0.08732904388803604, 'sideways_tp_mult': 1.7160193956248464, 'sideways_tsl_mult': 0.24168418332031988, 'sideways_time_stop': 133, 'sideways_use_sma': False, 'sideways_use_ema': True, 'sideways_use_atr': False, 'sideways_use_adx': False, 'sideways_use_spike': True, 'sideways_rsi_required': False}.
[I 2025-08-30 18:34:03,155] Trial 44 finished with values: [-1000000000.0, 1000000000.0] and parameters: {'p_sma': 42, 'p_std': 14, 'p_atr': 8, 'p_adx': 10, 'rsi_period': 66, 'ema1': 13, 'ema2': 38, 'slip_atr_k': 0.14166937330600896, 'slip_spread_k': 0.09107330780912992, 'spread_hl_frac': 0.026035200313753105, 'bb_std_mult': 0.5048127963458613, 'rsi_os': 40, 'rsi_ob': 60, 'vol_spike': 0.1841146496823716, 'adx_thresh': 25.5403016776462, 'atr_min_pct': 0.00458584152682208, 'atr_max_pct': 0.1396209768321551, 'tp_mult': 2.9527355853253963, 'tsl_mult': 0.2588397339323643, 'strategy': 'breakout', 'time_stop': 42, 'use_sma': False, 'use_atr': True, 'use_adx': True, 'use_ema': True, 'use_spike': True, 'rsi_required': True, 'edge_k': 1.8166780967709655, 'edge_cap': 0.7175552878497751, 'bull_strategy': 'mean_reversion', 'bull_bb_std_mult': 1.44568496247638, 'bull_rsi_os': 42, 'bull_rsi_ob': 48, 'bull_adx_thresh': 27.06774769406441, 'bull_atr_min_pct': 0.010624779357110578, 'bull_atr_max_pct': 0.035069707097046814, 'bull_tp_mult': 2.7685753075511803, 'bull_tsl_mult': 0.1152452250404824, 'bull_time_stop': 151, 'bull_use_sma': False, 'bull_use_ema': False, 'bull_use_atr': True, 'bull_use_adx': False, 'bull_use_spike': False, 'bull_rsi_required': True, 'bear_strategy': 'breakout', 'bear_bb_std_mult': 1.4442532254981608, 'bear_rsi_os': 29, 'bear_rsi_ob': 61, 'bear_adx_thresh': 8.10938004213357, 'bear_atr_min_pct': 0.002065216379749983, 'bear_atr_max_pct': 0.11034423176118156, 'bear_tp_mult': 1.1817804160042984, 'bear_tsl_mult': 0.08561213846033539, 'bear_time_stop': 299, 'bear_use_sma': True, 'bear_use_ema': False, 'bear_use_atr': False, 'bear_use_adx': False, 'bear_use_spike': False, 'bear_rsi_required': False, 'sideways_strategy': 'mean_reversion', 'sideways_bb_std_mult': 3.4414036050828796, 'sideways_rsi_os': 14, 'sideways_rsi_ob': 51, 'sideways_adx_thresh': 17.498863973843303, 'sideways_atr_min_pct': 0.025221579091853526, 'sideways_atr_max_pct': 0.12262140312653719, 'sideways_tp_mult': 1.1774119853413976, 'sideways_tsl_mult': 0.7412241064952058, 'sideways_time_stop': 114, 'sideways_use_sma': False, 'sideways_use_ema': True, 'sideways_use_atr': False, 'sideways_use_adx': False, 'sideways_use_spike': True, 'sideways_rsi_required': False}.
[I 2025-08-30 18:34:03,476] Trial 46 finished with values: [-1000000000.0, 1000000000.0] and parameters: {'p_sma': 31, 'p_std': 14, 'p_atr': 10, 'p_adx': 12, 'rsi_period': 69, 'ema1': 27, 'ema2': 37, 'slip_atr_k': 0.2372320701170197, 'slip_spread_k': 0.09012814960858562, 'spread_hl_frac': 0.03772800833154107, 'bb_std_mult': 0.5139232638221399, 'rsi_os': 41, 'rsi_ob': 63, 'vol_spike': 0.1631427514690959, 'adx_thresh': 32.969670587381856, 'atr_min_pct': 0.00455554445226344, 'atr_max_pct': 0.1370030281059959, 'tp_mult': 2.143379955527819, 'tsl_mult': 0.2835602747385435, 'strategy': 'breakout', 'time_stop': 212, 'use_sma': False, 'use_atr': True, 'use_adx': False, 'use_ema': True, 'use_spike': True, 'rsi_required': True, 'edge_k': 1.7921511400589916, 'edge_cap': 0.11888875883052667, 'bull_strategy': 'breakout', 'bull_bb_std_mult': 1.370339823907236, 'bull_rsi_os': 45, 'bull_rsi_ob': 47, 'bull_adx_thresh': 30.782829552066143, 'bull_atr_min_pct': 0.010297120625460907, 'bull_atr_max_pct': 0.03175412350471016, 'bull_tp_mult': 2.6688004257699296, 'bull_tsl_mult': 0.11198279730485644, 'bull_time_stop': 138, 'bull_use_sma': True, 'bull_use_ema': False, 'bull_use_atr': True, 'bull_use_adx': False, 'bull_use_spike': False, 'bull_rsi_required': True, 'bear_strategy': 'breakout', 'bear_bb_std_mult': 2.083406576453463, 'bear_rsi_os': 48, 'bear_rsi_ob': 49, 'bear_adx_thresh': 8.705351565194292, 'bear_atr_min_pct': 0.004957323657999623, 'bear_atr_max_pct': 0.1113159259816996, 'bear_tp_mult': 1.195974704310834, 'bear_tsl_mult': 0.0816982342061815, 'bear_time_stop': 291, 'bear_use_sma': True, 'bear_use_ema': False, 'bear_use_atr': True, 'bear_use_adx': False, 'bear_use_spike': True, 'bear_rsi_required': False, 'sideways_strategy': 'mean_reversion', 'sideways_bb_std_mult': 3.4233664677271687, 'sideways_rsi_os': 35, 'sideways_rsi_ob': 54, 'sideways_adx_thresh': 32.50328613726603, 'sideways_atr_min_pct': 0.02827548498380407, 'sideways_atr_max_pct': 0.09969099512917715, 'sideways_tp_mult': 2.422620673706743, 'sideways_tsl_mult': 0.7320941839741999, 'sideways_time_stop': 97, 'sideways_use_sma': False, 'sideways_use_ema': True, 'sideways_use_atr': False, 'sideways_use_adx': True, 'sideways_use_spike': True, 'sideways_rsi_required': True}.
