[I 2025-08-30 19:58:56,767] Trial 785 finished with values: [-1000000000.0, 1000000000.0] and parameters: {'p_sma': 12, 'p_std': 60, 'p_atr': 10, 'p_adx': 19, 'rsi_period': 25, 'ema1': 27, 'ema2': 48, 'slip_atr_k': 0.04059195205608866, 'slip_spread_k': 0.13525779802198107, 'spread_hl_frac': 0.002156816073322139, 'bb_std_mult': 1.9892947056144745, 'rsi_os': 50, 'rsi_ob': 87, 'vol_spike': 0.26167219610695736, 'adx_thresh': 34.46535369760262, 'atr_min_pct': 0.023186581413753828, 'atr_max_pct': 0.09493162067246345, 'tp_mult': 2.2074578947122108, 'tsl_mult': 0.8262757818005595, 'strategy': 'breakout', 'time_stop': 297, 'use_sma': True, 'use_atr': True, 'use_adx': False, 'use_ema': False, 'use_spike': True, 'rsi_required': True, 'edge_k': 1.214305419918198, 'edge_cap': 0.5614025716412928, 'bull_strategy': 'breakout', 'bull_bb_std_mult': 3.0158402518132656, 'bull_rsi_os': 5, 'bull_rsi_ob': 71, 'bull_adx_thresh': 19.311327470959014, 'bull_atr_min_pct': 0.015854213753804094, 'bull_atr_max_pct': 0.030411968234811355, 'bull_tp_mult': 2.8002685584447673, 'bull_tsl_mult': 0.530658911491703, 'bull_time_stop': 177, 'bull_use_sma': False, 'bull_use_ema': True, 'bull_use_atr': True, 'bull_use_adx': True, 'bull_use_spike': False, 'bull_rsi_required': True, 'bear_strategy': 'breakout', 'bear_bb_std_mult': 3.036890916031381, 'bear_rsi_os': 18, 'bear_rsi_ob': 75, 'bear_adx_thresh': 33.86560765785764, 'bear_atr_min_pct': 0.012335670523349178, 'bear_atr_max_pct': 0.04106020205005592, 'bear_tp_mult': 2.8252890174039704, 'bear_tsl_mult': 0.7721892657994426, 'bear_time_stop': 92, 'bear_use_sma': False, 'bear_use_ema': False, 'bear_use_atr': False, 'bear_use_adx': True, 'bear_use_spike': False, 'bear_rsi_required': True, 'sideways_strategy': 'breakout', 'sideways_bb_std_mult': 3.2074896001007818, 'sideways_rsi_os': 35, 'sideways_rsi_ob': 57, 'sideways_adx_thresh': 20.21567976000489, 'sideways_atr_min_pct': 0.027875694429214212, 'sideways_atr_max_pct': 0.1316568576897527, 'sideways_tp_mult': 1.013272904292607, 'sideways_tsl_mult': 0.9989918573686407, 'sideways_time_stop': 162, 'sideways_use_sma': False, 'sideways_use_ema': True, 'sideways_use_atr': True, 'sideways_use_adx': False, 'sideways_use_spike': False, 'sideways_rsi_required': True}.
[I 2025-08-30 19:58:57,188] Trial 786 finished with values: [-1000000000.0, 1000000000.0] and parameters: {'p_sma': 12, 'p_std': 33, 'p_atr': 10, 'p_adx': 7, 'rsi_period': 23, 'ema1': 27, 'ema2': 38, 'slip_atr_k': 0.04083494925370787, 'slip_spread_k': 0.13417251681723277, 'spread_hl_frac': 0.023181597420955633, 'bb_std_mult': 1.9611636824265113, 'rsi_os': 50, 'rsi_ob': 57, 'vol_spike': 0.26145962816803264, 'adx_thresh': 34.340097349250385, 'atr_min_pct': 0.023012575686373205, 'atr_max_pct': 0.09530375247582194, 'tp_mult': 2.706052039732648, 'tsl_mult': 0.8267667220391636, 'strategy': 'breakout', 'time_stop': 195, 'use_sma': False, 'use_atr': True, 'use_adx': True, 'use_ema': False, 'use_spike': True, 'rsi_required': True, 'edge_k': 1.2035677218915422, 'edge_cap': 0.558526218543934, 'bull_strategy': 'breakout', 'bull_bb_std_mult': 3.347549512919583, 'bull_rsi_os': 31, 'bull_rsi_ob': 87, 'bull_adx_thresh': 19.421855885668315, 'bull_atr_min_pct': 0.02263445181771855, 'bull_atr_max_pct': 0.02831439953515262, 'bull_tp_mult': 2.8013351361509025, 'bull_tsl_mult': 0.625732057835871, 'bull_time_stop': 178, 'bull_use_sma': False, 'bull_use_ema': True, 'bull_use_atr': True, 'bull_use_adx': False, 'bull_use_spike': False, 'bull_rsi_required': True, 'bear_strategy': 'breakout', 'bear_bb_std_mult': 0.5979616932877461, 'bear_rsi_os': 18, 'bear_rsi_ob': 47, 'bear_adx_thresh': 15.791858382751418, 'bear_atr_min_pct': 0.00918885230768059, 'bear_atr_max_pct': 0.04070794543946223, 'bear_tp_mult': 2.6522663122399757, 'bear_tsl_mult': 0.5726867790307798, 'bear_time_stop': 47, 'bear_use_sma': False, 'bear_use_ema': True, 'bear_use_atr': False, 'bear_use_adx': True, 'bear_use_spike': False, 'bear_rsi_required': True, 'sideways_strategy': 'breakout', 'sideways_bb_std_mult': 2.5699895249545333, 'sideways_rsi_os': 34, 'sideways_rsi_ob': 57, 'sideways_adx_thresh': 28.71604737369511, 'sideways_atr_min_pct': 0.02793556918035182, 'sideways_atr_max_pct': 0.1452149760190026, 'sideways_tp_mult': 1.8247851689883714, 'sideways_tsl_mult': 0.0006867687135651557, 'sideways_time_stop': 161, 'sideways_use_sma': False, 'sideways_use_ema': True, 'sideways_use_atr': True, 'sideways_use_adx': False, 'sideways_use_spike': False, 'sideways_rsi_required': True}.
[I 2025-08-30 19:58:57,446] Trial 783 finished with values: [-1000000000.0, 1000000000.0] and parameters: {'p_sma': 6, 'p_std': 24, 'p_atr': 22, 'p_adx': 10, 'rsi_period': 20, 'ema1': 10, 'ema2': 33, 'slip_atr_k': 0.14880819715049443, 'slip_spread_k': 0.43913148446475553, 'spread_hl_frac': 0.0380603361856232, 'bb_std_mult': 1.99360507656228, 'rsi_os': 48, 'rsi_ob': 81, 'vol_spike': 0.24714388536394832, 'adx_thresh': 33.721441136401786, 'atr_min_pct': 0.020827516848575017, 'atr_max_pct': 0.06669041652693933, 'tp_mult': 2.4868915301831223, 'tsl_mult': 0.8632250924226481, 'strategy': 'breakout', 'time_stop': 212, 'use_sma': True, 'use_atr': False, 'use_adx': False, 'use_ema': True, 'use_spike': False, 'rsi_required': True, 'edge_k': 1.7440479121539623, 'edge_cap': 0.5092424578965751, 'bull_strategy': 'breakout', 'bull_bb_std_mult': 2.63143234491733, 'bull_rsi_os': 38, 'bull_rsi_ob': 50, 'bull_adx_thresh': 19.172500425432872, 'bull_atr_min_pct': 0.02246599183681772, 'bull_atr_max_pct': 0.11041638827267254, 'bull_tp_mult': 2.724707720278967, 'bull_tsl_mult': 0.6271037526436807, 'bull_time_stop': 178, 'bull_use_sma': True, 'bull_use_ema': True, 'bull_use_atr': True, 'bull_use_adx': True, 'bull_use_spike': False, 'bull_rsi_required': True, 'bear_strategy': 'mean_reversion', 'bear_bb_std_mult': 1.2686189287325287, 'bear_rsi_os': 19, 'bear_rsi_ob': 75, 'bear_adx_thresh': 12.583302120380477, 'bear_atr_min_pct': 0.009345198922176893, 'bear_atr_max_pct': 0.039117086532230845, 'bear_tp_mult': 2.6938132906927073, 'bear_tsl_mult': 0.7449939967424218, 'bear_time_stop': 47, 'bear_use_sma': False, 'bear_use_ema': False, 'bear_use_atr': False, 'bear_use_adx': True, 'bear_use_spike': True, 'bear_rsi_required': True, 'sideways_strategy': 'breakout', 'sideways_bb_std_mult': 3.1528773294827093, 'sideways_rsi_os': 36, 'sideways_rsi_ob': 57, 'sideways_adx_thresh': 21.606718278443, 'sideways_atr_min_pct': 0.0026450254119289945, 'sideways_atr_max_pct': 0.10376702061472805, 'sideways_tp_mult': 2.1198693435903304, 'sideways_tsl_mult': 0.9264732857420788, 'sideways_time_stop': 166, 'sideways_use_sma': True, 'sideways_use_ema': True, 'sideways_use_atr': False, 'sideways_use_adx': False, 'sideways_use_spike': True, 'sideways_rsi_required': True}.
[I 2025-08-30 19:58:57,755] Trial 784 finished with values: [-1000000000.0, 1000000000.0] and parameters: {'p_sma': 6, 'p_std': 41, 'p_atr': 10, 'p_adx': 19, 'rsi_period': 23, 'ema1': 7, 'ema2': 22, 'slip_atr_k': 0.14341993589771776, 'slip_spread_k': 0.13813214754861158, 'spread_hl_frac': 0.02579556331125952, 'bb_std_mult': 2.2345631810357762, 'rsi_os': 34, 'rsi_ob': 80, 'vol_spike': 0.26326737551173285, 'adx_thresh': 33.65228198283834, 'atr_min_pct': 0.02303412310772906, 'atr_max_pct': 0.05137313908841948, 'tp_mult': 2.963848151866139, 'tsl_mult': 0.9043842524801748, 'strategy': 'breakout', 'time_stop': 211, 'use_sma': False, 'use_atr': True, 'use_adx': True, 'use_ema': False, 'use_spike': True, 'rsi_required': True, 'edge_k': 0.07531564913378308, 'edge_cap': 0.7749500718058873, 'bull_strategy': 'breakout', 'bull_bb_std_mult': 3.0348128354152357, 'bull_rsi_os': 31, 'bull_rsi_ob': 87, 'bull_adx_thresh': 26.050656484349627, 'bull_atr_min_pct': 0.0005412958044752128, 'bull_atr_max_pct': 0.13846530976941362, 'bull_tp_mult': 2.6984824826534113, 'bull_tsl_mult': 0.5725194223772682, 'bull_time_stop': 176, 'bull_use_sma': False, 'bull_use_ema': True, 'bull_use_atr': True, 'bull_use_adx': False, 'bull_use_spike': False, 'bull_rsi_required': True, 'bear_strategy': 'breakout', 'bear_bb_std_mult': 2.855674389178525, 'bear_rsi_os': 25, 'bear_rsi_ob': 75, 'bear_adx_thresh': 16.245990246372514, 'bear_atr_min_pct': 0.012417568691981563, 'bear_atr_max_pct': 0.03339022059095815, 'bear_tp_mult': 2.6775979972668953, 'bear_tsl_mult': 0.748209175945904, 'bear_time_stop': 196, 'bear_use_sma': False, 'bear_use_ema': True, 'bear_use_atr': False, 'bear_use_adx': True, 'bear_use_spike': False, 'bear_rsi_required': True, 'sideways_strategy': 'breakout', 'sideways_bb_std_mult': 2.559111337275097, 'sideways_rsi_os': 35, 'sideways_rsi_ob': 89, 'sideways_adx_thresh': 27.408966981960543, 'sideways_atr_min_pct': 0.0025398125104783434, 'sideways_atr_max_pct': 0.1321220362597048, 'sideways_tp_mult': 2.0843023407363783, 'sideways_tsl_mult': 0.9281901430946053, 'sideways_time_stop': 97, 'sideways_use_sma': False, 'sideways_use_ema': True, 'sideways_use_atr': False, 'sideways_use_adx': False, 'sideways_use_spike': True, 'sideways_rsi_required': True}.
[I 2025-08-30 19:58:58,977] Trial 790 finished with values: [-1000000000.0, 1000000000.0] and parameters: {'p_sma': 20, 'p_std': 56, 'p_atr': 9, 'p_adx': 14, 'rsi_period': 69, 'ema1': 26, 'ema2': 31, 'slip_atr_k': 0.06486346478096243, 'slip_spread_k': 0.24744346748546475, 'spread_hl_frac': 0.04294184282711462, 'bb_std_mult': 2.69837980902247, 'rsi_os': 51, 'rsi_ob': 54, 'vol_spike': 0.26785556086280193, 'adx_thresh': 32.71964909799144, 'atr_min_pct': 0.02487059942129729, 'atr_max_pct': 0.1246306371654983, 'tp_mult': 1.4116672375777812, 'tsl_mult': 0.7686031164398159, 'strategy': 'mean_reversion', 'time_stop': 88, 'use_sma': False, 'use_atr': True, 'use_adx': True, 'use_ema': False, 'use_spike': True, 'rsi_required': False, 'edge_k': 0.8339630739134021, 'edge_cap': 0.19550062201033586, 'bull_strategy': 'mean_reversion', 'bull_bb_std_mult': 1.621301261500838, 'bull_rsi_os': 29, 'bull_rsi_ob': 81, 'bull_adx_thresh': 24.937460902050596, 'bull_atr_min_pct': 0.0017021791958610924, 'bull_atr_max_pct': 0.14513489475172192, 'bull_tp_mult': 2.914861580118461, 'bull_tsl_mult': 0.5753025686252938, 'bull_time_stop': 198, 'bull_use_sma': False, 'bull_use_ema': True, 'bull_use_atr': False, 'bull_use_adx': False, 'bull_use_spike': False, 'bull_rsi_required': True, 'bear_strategy': 'breakout', 'bear_bb_std_mult': 2.951676048165781, 'bear_rsi_os': 40, 'bear_rsi_ob': 80, 'bear_adx_thresh': 18.06977807332543, 'bear_atr_min_pct': 0.0025355609842363826, 'bear_atr_max_pct': 0.08517218903850712, 'bear_tp_mult': 2.4367042233813234, 'bear_tsl_mult': 0.10203683093306198, 'bear_time_stop': 216, 'bear_use_sma': True, 'bear_use_ema': True, 'bear_use_atr': True, 'bear_use_adx': False, 'bear_use_spike': False, 'bear_rsi_required': False, 'sideways_strategy': 'breakout', 'sideways_bb_std_mult': 2.961981277594275, 'sideways_rsi_os': 45, 'sideways_rsi_ob': 70, 'sideways_adx_thresh': 20.972308154138894, 'sideways_atr_min_pct': 1.5562254529167922e-05, 'sideways_atr_max_pct': 0.14251781012452686, 'sideways_tp_mult': 1.1151815264064007, 'sideways_tsl_mult': 0.7015197904091914, 'sideways_time_stop': 154, 'sideways_use_sma': False, 'sideways_use_ema': True, 'sideways_use_atr': True, 'sideways_use_adx': False, 'sideways_use_spike': False, 'sideways_rsi_required': True}.
[I 2025-08-30 19:58:59,891] Trial 791 finished with values: [-1000000000.0, 1000000000.0] and parameters: {'p_sma': 9, 'p_std': 30, 'p_atr': 8, 'p_adx': 27, 'rsi_period': 18, 'ema1': 26, 'ema2': 30, 'slip_atr_k': 0.0743694761086447, 'slip_spread_k': 0.08858419591428307, 'spread_hl_frac': 0.024508741465370104, 'bb_std_mult': 2.162173346005877, 'rsi_os': 55, 'rsi_ob': 75, 'vol_spike': 0.2548922215405239, 'adx_thresh': 32.4536036202527, 'atr_min_pct': 0.02361185498028525, 'atr_max_pct': 0.1040978400289088, 'tp_mult': 2.3961665327257147, 'tsl_mult': 0.824708262355743, 'strategy': 'mean_reversion', 'time_stop': 57, 'use_sma': False, 'use_atr': True, 'use_adx': True, 'use_ema': False, 'use_spike': True, 'rsi_required': False, 'edge_k': 1.4606084322689523, 'edge_cap': 0.6955258685305463, 'bull_strategy': 'mean_reversion', 'bull_bb_std_mult': 1.8133602196472058, 'bull_rsi_os': 30, 'bull_rsi_ob': 45, 'bull_adx_thresh': 13.889250014789551, 'bull_atr_min_pct': 0.004017945206123864, 'bull_atr_max_pct': 0.12441134223876874, 'bull_tp_mult': 2.498325936030764, 'bull_tsl_mult': 0.5381086045981144, 'bull_time_stop': 81, 'bull_use_sma': False, 'bull_use_ema': True, 'bull_use_atr': False, 'bull_use_adx': False, 'bull_use_spike': False, 'bull_rsi_required': True, 'bear_strategy': 'breakout', 'bear_bb_std_mult': 2.944366361945284, 'bear_rsi_os': 49, 'bear_rsi_ob': 53, 'bear_adx_thresh': 29.592682296744744, 'bear_atr_min_pct': 0.015020529822296574, 'bear_atr_max_pct': 0.026000029275394878, 'bear_tp_mult': 2.6048148375502294, 'bear_tsl_mult': 0.5068179523184645, 'bear_time_stop': 192, 'bear_use_sma': True, 'bear_use_ema': True, 'bear_use_atr': False, 'bear_use_adx': False, 'bear_use_spike': False, 'bear_rsi_required': False, 'sideways_strategy': 'breakout', 'sideways_bb_std_mult': 1.2362976039913263, 'sideways_rsi_os': 38, 'sideways_rsi_ob': 61, 'sideways_adx_thresh': 13.904396876981586, 'sideways_atr_min_pct': 0.01634433801373862, 'sideways_atr_max_pct': 0.14768421434208365, 'sideways_tp_mult': 2.194622101555819, 'sideways_tsl_mult': 0.5005205977026778, 'sideways_time_stop': 285, 'sideways_use_sma': False, 'sideways_use_ema': True, 'sideways_use_atr': True, 'sideways_use_adx': False, 'sideways_use_spike': False, 'sideways_rsi_required': True}.
[I 2025-08-30 19:59:15,839] Trial 792 finished with values: [-1000000000.0, 1000000000.0] and parameters: {'p_sma': 8, 'p_std': 16, 'p_atr': 19, 'p_adx': 20, 'rsi_period': 25, 'ema1': 8, 'ema2': 32, 'slip_atr_k': 0.08704733193608757, 'slip_spread_k': 0.11325343059643447, 'spread_hl_frac': 0.00621228915490054, 'bb_std_mult': 1.6037996016728513, 'rsi_os': 23, 'rsi_ob': 52, 'vol_spike': 0.10509209538009492, 'adx_thresh': 33.214511165257534, 'atr_min_pct': 0.027483241241775744, 'atr_max_pct': 0.02399017252309426, 'tp_mult': 2.2872729262701275, 'tsl_mult': 0.3828613465400163, 'strategy': 'mean_reversion', 'time_stop': 239, 'use_sma': False, 'use_atr': True, 'use_adx': True, 'use_ema': False, 'use_spike': True, 'rsi_required': False, 'edge_k': 0.6042118176247439, 'edge_cap': 0.3098639434099797, 'bull_strategy': 'mean_reversion', 'bull_bb_std_mult': 3.214822634743548, 'bull_rsi_os': 35, 'bull_rsi_ob': 55, 'bull_adx_thresh': 18.11474980395857, 'bull_atr_min_pct': 0.012313791785333676, 'bull_atr_max_pct': 0.11838661364585776, 'bull_tp_mult': 1.7684527019589047, 'bull_tsl_mult': 0.3971111830496237, 'bull_time_stop': 18, 'bull_use_sma': False, 'bull_use_ema': True, 'bull_use_atr': True, 'bull_use_adx': False, 'bull_use_spike': False, 'bull_rsi_required': False, 'bear_strategy': 'breakout', 'bear_bb_std_mult': 2.28163475846318, 'bear_rsi_os': 11, 'bear_rsi_ob': 91, 'bear_adx_thresh': 17.12183480777523, 'bear_atr_min_pct': 0.016188846612866077, 'bear_atr_max_pct': 0.047855473222165615, 'bear_tp_mult': 1.3479613790328449, 'bear_tsl_mult': 0.7862057822490913, 'bear_time_stop': 193, 'bear_use_sma': True, 'bear_use_ema': True, 'bear_use_atr': False, 'bear_use_adx': False, 'bear_use_spike': False, 'bear_rsi_required': True, 'sideways_strategy': 'breakout', 'sideways_bb_std_mult': 1.3788283206531675, 'sideways_rsi_os': 37, 'sideways_rsi_ob': 64, 'sideways_adx_thresh': 20.227521661716548, 'sideways_atr_min_pct': 0.0033286336683698084, 'sideways_atr_max_pct': 0.07621930331656412, 'sideways_tp_mult': 1.448790518223511, 'sideways_tsl_mult': 0.9469062398946905, 'sideways_time_stop': 229, 'sideways_use_sma': False, 'sideways_use_ema': False, 'sideways_use_atr': True, 'sideways_use_adx': False, 'sideways_use_spike': False, 'sideways_rsi_required': False}.
[I 2025-08-30 19:59:24,895] Trial 788 finished with values: [-1000000000.0, 1000000000.0] and parameters: {'p_sma': 9, 'p_std': 16, 'p_atr': 9, 'p_adx': 14, 'rsi_period': 17, 'ema1': 8, 'ema2': 29, 'slip_atr_k': 0.06611258682541538, 'slip_spread_k': 0.5276854214725297, 'spread_hl_frac': 0.043169984849837875, 'bb_std_mult': 0.7409812198826862, 'rsi_os': 48, 'rsi_ob': 52, 'vol_spike': 0.25359797977456877, 'adx_thresh': 32.98826166373747, 'atr_min_pct': 0.024728688007925492, 'atr_max_pct': 0.12387484709459862, 'tp_mult': 2.307470736383059, 'tsl_mult': 0.8347772395255537, 'strategy': 'mean_reversion', 'time_stop': 177, 'use_sma': False, 'use_atr': True, 'use_adx': True, 'use_ema': False, 'use_spike': True, 'rsi_required': False, 'edge_k': 0.08329029838061894, 'edge_cap': 0.5075243723583993, 'bull_strategy': 'mean_reversion', 'bull_bb_std_mult': 1.8569826577122501, 'bull_rsi_os': 30, 'bull_rsi_ob': 45, 'bull_adx_thresh': 6.376859561362597, 'bull_atr_min_pct': 0.000428772226916272, 'bull_atr_max_pct': 0.14486996630688853, 'bull_tp_mult': 2.726950573827919, 'bull_tsl_mult': 0.576236535518669, 'bull_time_stop': 13, 'bull_use_sma': False, 'bull_use_ema': True, 'bull_use_atr': False, 'bull_use_adx': False, 'bull_use_spike': False, 'bull_rsi_required': True, 'bear_strategy': 'breakout', 'bear_bb_std_mult': 2.9362162210215073, 'bear_rsi_os': 49, 'bear_rsi_ob': 85, 'bear_adx_thresh': 5.13168266376695, 'bear_atr_min_pct': 0.015111042716043348, 'bear_atr_max_pct': 0.02487706258668001, 'bear_tp_mult': 2.4542495378224327, 'bear_tsl_mult': 0.5124245921591022, 'bear_time_stop': 192, 'bear_use_sma': True, 'bear_use_ema': True, 'bear_use_atr': False, 'bear_use_adx': False, 'bear_use_spike': False, 'bear_rsi_required': False, 'sideways_strategy': 'breakout', 'sideways_bb_std_mult': 1.895168172871744, 'sideways_rsi_os': 37, 'sideways_rsi_ob': 89, 'sideways_adx_thresh': 20.147593360690706, 'sideways_atr_min_pct': 0.016348097191547888, 'sideways_atr_max_pct': 0.1428523906594445, 'sideways_tp_mult': 2.6797425245857007, 'sideways_tsl_mult': 0.9327353080846766, 'sideways_time_stop': 153, 'sideways_use_sma': False, 'sideways_use_ema': True, 'sideways_use_atr': True, 'sideways_use_adx': False, 'sideways_use_spike': False, 'sideways_rsi_required': True}.
[I 2025-08-30 19:59:25,030] Trial 789 finished with values: [-1000000000.0, 1000000000.0] and parameters: {'p_sma': 9, 'p_std': 30, 'p_atr': 9, 'p_adx': 27, 'rsi_period': 17, 'ema1': 7, 'ema2': 31, 'slip_atr_k': 0.1939303884951213, 'slip_spread_k': 0.05452384250610055, 'spread_hl_frac': 0.04343735606642149, 'bb_std_mult': 1.748949707325587, 'rsi_os': 49, 'rsi_ob': 83, 'vol_spike': 0.01936619938760739, 'adx_thresh': 32.76434709635418, 'atr_min_pct': 0.027488492094725786, 'atr_max_pct': 0.09781429778651116, 'tp_mult': 1.7332496546060172, 'tsl_mult': 0.30901369902984605, 'strategy': 'mean_reversion', 'time_stop': 190, 'use_sma': False, 'use_atr': True, 'use_adx': True, 'use_ema': False, 'use_spike': True, 'rsi_required': False, 'edge_k': 0.08564910956686028, 'edge_cap': 0.2003117677379706, 'bull_strategy': 'mean_reversion', 'bull_bb_std_mult': 1.8281824369071598, 'bull_rsi_os': 52, 'bull_rsi_ob': 59, 'bull_adx_thresh': 18.203437853204495, 'bull_atr_min_pct': 0.017349786161601207, 'bull_atr_max_pct': 0.12334543385691016, 'bull_tp_mult': 2.904261666493909, 'bull_tsl_mult': 0.5710478828703506, 'bull_time_stop': 189, 'bull_use_sma': False, 'bull_use_ema': True, 'bull_use_atr': False, 'bull_use_adx': False, 'bull_use_spike': False, 'bull_rsi_required': True, 'bear_strategy': 'breakout', 'bear_bb_std_mult': 2.954814067128995, 'bear_rsi_os': 52, 'bear_rsi_ob': 74, 'bear_adx_thresh': 29.973812491909108, 'bear_atr_min_pct': 0.015270280382756919, 'bear_atr_max_pct': 0.03304845434915798, 'bear_tp_mult': 2.6453770915399395, 'bear_tsl_mult': 0.10670822579176847, 'bear_time_stop': 215, 'bear_use_sma': True, 'bear_use_ema': True, 'bear_use_atr': False, 'bear_use_adx': False, 'bear_use_spike': False, 'bear_rsi_required': False, 'sideways_strategy': 'breakout', 'sideways_bb_std_mult': 2.736039490877281, 'sideways_rsi_os': 38, 'sideways_rsi_ob': 89, 'sideways_adx_thresh': 20.070302172980373, 'sideways_atr_min_pct': 0.0033220056398720896, 'sideways_atr_max_pct': 0.14997267695354963, 'sideways_tp_mult': 2.196876791526732, 'sideways_tsl_mult': 0.5085606078663054, 'sideways_time_stop': 300, 'sideways_use_sma': False, 'sideways_use_ema': True, 'sideways_use_atr': True, 'sideways_use_adx': False, 'sideways_use_spike': False, 'sideways_rsi_required': True}.
