[I 2025-08-30 19:25:22,939] Trial 492 finished with values: [-0.03052658831608457, 0.0306838927719787] and parameters: {'p_sma': 16, 'p_std': 30, 'p_atr': 9, 'p_adx': 19, 'rsi_period': 27, 'ema1': 25, 'ema2': 51, 'slip_atr_k': 0.07625185603318561, 'slip_spread_k': 0.361203181568582, 'spread_hl_frac': 0.004103289719638924, 'bb_std_mult': 2.166618631070052, 'rsi_os': 49, 'rsi_ob': 85, 'vol_spike': 0.2720857880861918, 'adx_thresh': 21.669233145158824, 'atr_min_pct': 0.023910332882702907, 'atr_max_pct': 0.0916190679601947, 'tp_mult': 1.7126924624323028, 'tsl_mult': 0.9281478325413769, 'strategy': 'mean_reversion', 'time_stop': 273, 'use_sma': False, 'use_atr': True, 'use_adx': True, 'use_ema': False, 'use_spike': False, 'rsi_required': False, 'edge_k': 0.15161743110116277, 'edge_cap': 0.36333907306112345, 'bull_strategy': 'breakout', 'bull_bb_std_mult': 1.2679110655026635, 'bull_rsi_os': 55, 'bull_rsi_ob': 46, 'bull_adx_thresh': 19.320050050392087, 'bull_atr_min_pct': 0.001980343832141749, 'bull_atr_max_pct': 0.11630139499896693, 'bull_tp_mult': 1.3713871465940097, 'bull_tsl_mult': 0.7284463866637676, 'bull_time_stop': 176, 'bull_use_sma': False, 'bull_use_ema': False, 'bull_use_atr': True, 'bull_use_adx': False, 'bull_use_spike': False, 'bull_rsi_required': True, 'bear_strategy': 'mean_reversion', 'bear_bb_std_mult': 2.7888246485357597, 'bear_rsi_os': 17, 'bear_rsi_ob': 76, 'bear_adx_thresh': 14.358837386640856, 'bear_atr_min_pct': 0.015253333393036632, 'bear_atr_max_pct': 0.07427338034617438, 'bear_tp_mult': 1.9855247471745499, 'bear_tsl_mult': 0.6503617988033785, 'bear_time_stop': 215, 'bear_use_sma': False, 'bear_use_ema': True, 'bear_use_atr': False, 'bear_use_adx': False, 'bear_use_spike': False, 'bear_rsi_required': True, 'sideways_strategy': 'breakout', 'sideways_bb_std_mult': 2.129858017644502, 'sideways_rsi_os': 37, 'sideways_rsi_ob': 67, 'sideways_adx_thresh': 30.7353492922182, 'sideways_atr_min_pct': 0.0024247020271972045, 'sideways_atr_max_pct': 0.14702975854023176, 'sideways_tp_mult': 2.4023038504647123, 'sideways_tsl_mult': 0.1278993150632725, 'sideways_time_stop': 191, 'sideways_use_sma': True, 'sideways_use_ema': True, 'sideways_use_atr': True, 'sideways_use_adx': True, 'sideways_use_spike': False, 'sideways_rsi_required': True}.
[I 2025-08-30 19:25:35,093] Trial 496 finished with values: [-1000000000.0, 1000000000.0] and parameters: {'p_sma': 7, 'p_std': 38, 'p_atr': 9, 'p_adx': 20, 'rsi_period': 60, 'ema1': 24, 'ema2': 18, 'slip_atr_k': 0.07900790670780075, 'slip_spread_k': 0.35917076801677117, 'spread_hl_frac': 0.02961557448176482, 'bb_std_mult': 2.138433130258039, 'rsi_os': 49, 'rsi_ob': 63, 'vol_spike': 0.2573174263961216, 'adx_thresh': 33.58079640665255, 'atr_min_pct': 0.014543974553378405, 'atr_max_pct': 0.07902704159185596, 'tp_mult': 2.3257486324190517, 'tsl_mult': 0.7597125548771566, 'strategy': 'mean_reversion', 'time_stop': 222, 'use_sma': False, 'use_atr': True, 'use_adx': True, 'use_ema': False, 'use_spike': False, 'rsi_required': False, 'edge_k': 0.35089321989619493, 'edge_cap': 0.07213813755800741, 'bull_strategy': 'breakout', 'bull_bb_std_mult': 3.1155764606557264, 'bull_rsi_os': 33, 'bull_rsi_ob': 53, 'bull_adx_thresh': 19.527244185450197, 'bull_atr_min_pct': 0.004688656930362552, 'bull_atr_max_pct': 0.12638609029935016, 'bull_tp_mult': 2.8176380249847433, 'bull_tsl_mult': 0.13548141538574698, 'bull_time_stop': 180, 'bull_use_sma': True, 'bull_use_ema': True, 'bull_use_atr': True, 'bull_use_adx': False, 'bull_use_spike': False, 'bull_rsi_required': True, 'bear_strategy': 'breakout', 'bear_bb_std_mult': 2.933027906515912, 'bear_rsi_os': 51, 'bear_rsi_ob': 75, 'bear_adx_thresh': 18.8868775544268, 'bear_atr_min_pct': 0.025596589768868867, 'bear_atr_max_pct': 0.03015187819787253, 'bear_tp_mult': 2.714482137512344, 'bear_tsl_mult': 0.7684335580426807, 'bear_time_stop': 201, 'bear_use_sma': True, 'bear_use_ema': True, 'bear_use_atr': False, 'bear_use_adx': False, 'bear_use_spike': False, 'bear_rsi_required': True, 'sideways_strategy': 'breakout', 'sideways_bb_std_mult': 2.1418387029699812, 'sideways_rsi_os': 38, 'sideways_rsi_ob': 78, 'sideways_adx_thresh': 20.051808148139486, 'sideways_atr_min_pct': 0.002397805019223806, 'sideways_atr_max_pct': 0.10581661798009812, 'sideways_tp_mult': 1.3834946994908042, 'sideways_tsl_mult': 0.9276653726420355, 'sideways_time_stop': 161, 'sideways_use_sma': True, 'sideways_use_ema': True, 'sideways_use_atr': True, 'sideways_use_adx': False, 'sideways_use_spike': False, 'sideways_rsi_required': True}.
[I 2025-08-30 19:25:36,198] Trial 497 finished with values: [-1000000000.0, 1000000000.0] and parameters: {'p_sma': 8, 'p_std': 51, 'p_atr': 20, 'p_adx': 20, 'rsi_period': 29, 'ema1': 26, 'ema2': 19, 'slip_atr_k': 0.115778092362812, 'slip_spread_k': 0.37005773474269327, 'spread_hl_frac': 0.0252747679767977, 'bb_std_mult': 0.783230400611844, 'rsi_os': 49, 'rsi_ob': 72, 'vol_spike': 0.2568181625798953, 'adx_thresh': 28.14025848964594, 'atr_min_pct': 0.02465777507214725, 'atr_max_pct': 0.09906752611331535, 'tp_mult': 2.2132527386520846, 'tsl_mult': 0.48858776168788914, 'strategy': 'breakout', 'time_stop': 195, 'use_sma': False, 'use_atr': True, 'use_adx': False, 'use_ema': False, 'use_spike': True, 'rsi_required': False, 'edge_k': 0.13617048295764184, 'edge_cap': 0.9493594964778123, 'bull_strategy': 'breakout', 'bull_bb_std_mult': 3.3940841123668117, 'bull_rsi_os': 50, 'bull_rsi_ob': 62, 'bull_adx_thresh': 10.267283916404782, 'bull_atr_min_pct': 0.0047275940388019355, 'bull_atr_max_pct': 0.0848099334558944, 'bull_tp_mult': 2.795907763343125, 'bull_tsl_mult': 0.7286499502108353, 'bull_time_stop': 89, 'bull_use_sma': True, 'bull_use_ema': True, 'bull_use_atr': True, 'bull_use_adx': False, 'bull_use_spike': False, 'bull_rsi_required': True, 'bear_strategy': 'breakout', 'bear_bb_std_mult': 0.7865190011121757, 'bear_rsi_os': 51, 'bear_rsi_ob': 75, 'bear_adx_thresh': 27.422656398899257, 'bear_atr_min_pct': 0.01394451190200467, 'bear_atr_max_pct': 0.031206828728485125, 'bear_tp_mult': 2.6462213449749394, 'bear_tsl_mult': 0.2732092136205287, 'bear_time_stop': 177, 'bear_use_sma': True, 'bear_use_ema': True, 'bear_use_atr': False, 'bear_use_adx': True, 'bear_use_spike': False, 'bear_rsi_required': True, 'sideways_strategy': 'breakout', 'sideways_bb_std_mult': 3.140071029667983, 'sideways_rsi_os': 20, 'sideways_rsi_ob': 78, 'sideways_adx_thresh': 20.186217830732303, 'sideways_atr_min_pct': 0.001983332065524431, 'sideways_atr_max_pct': 0.01111690179028721, 'sideways_tp_mult': 1.380030706960318, 'sideways_tsl_mult': 0.9316057616001086, 'sideways_time_stop': 159, 'sideways_use_sma': False, 'sideways_use_ema': False, 'sideways_use_atr': True, 'sideways_use_adx': False, 'sideways_use_spike': False, 'sideways_rsi_required': True}.
[I 2025-08-30 19:26:03,587] Trial 498 finished with values: [-1000000000.0, 1000000000.0] and parameters: {'p_sma': 19, 'p_std': 34, 'p_atr': 8, 'p_adx': 20, 'rsi_period': 76, 'ema1': 26, 'ema2': 33, 'slip_atr_k': 0.0744053729744534, 'slip_spread_k': 0.13950763979961944, 'spread_hl_frac': 0.029482398454392093, 'bb_std_mult': 2.5778401772388913, 'rsi_os': 51, 'rsi_ob': 82, 'vol_spike': 0.25926187962669767, 'adx_thresh': 33.497367891416424, 'atr_min_pct': 0.021554430228185206, 'atr_max_pct': 0.09854339538660187, 'tp_mult': 2.3238718788057255, 'tsl_mult': 0.8902066715950167, 'strategy': 'breakout', 'time_stop': 199, 'use_sma': False, 'use_atr': True, 'use_adx': True, 'use_ema': False, 'use_spike': True, 'rsi_required': False, 'edge_k': 0.34527529179531113, 'edge_cap': 0.9490503108656707, 'bull_strategy': 'breakout', 'bull_bb_std_mult': 2.7811283387804333, 'bull_rsi_os': 30, 'bull_rsi_ob': 78, 'bull_adx_thresh': 17.38957986037275, 'bull_atr_min_pct': 0.0019786507795737, 'bull_atr_max_pct': 0.11943757910199596, 'bull_tp_mult': 1.3697609511934468, 'bull_tsl_mult': 0.38610270495933696, 'bull_time_stop': 179, 'bull_use_sma': True, 'bull_use_ema': True, 'bull_use_atr': True, 'bull_use_adx': True, 'bull_use_spike': False, 'bull_rsi_required': True, 'bear_strategy': 'breakout', 'bear_bb_std_mult': 3.203486172036352, 'bear_rsi_os': 51, 'bear_rsi_ob': 75, 'bear_adx_thresh': 8.624384256456006, 'bear_atr_min_pct': 0.014067038980905994, 'bear_atr_max_pct': 0.030322277965459575, 'bear_tp_mult': 2.6412625289692557, 'bear_tsl_mult': 0.6883271074853622, 'bear_time_stop': 100, 'bear_use_sma': True, 'bear_use_ema': True, 'bear_use_atr': False, 'bear_use_adx': True, 'bear_use_spike': False, 'bear_rsi_required': True, 'sideways_strategy': 'mean_reversion', 'sideways_bb_std_mult': 2.1204581182005646, 'sideways_rsi_os': 36, 'sideways_rsi_ob': 57, 'sideways_adx_thresh': 20.195508877735637, 'sideways_atr_min_pct': 0.007834455978516203, 'sideways_atr_max_pct': 0.10634029551035176, 'sideways_tp_mult': 2.698151155773718, 'sideways_tsl_mult': 0.8382346281284121, 'sideways_time_stop': 191, 'sideways_use_sma': False, 'sideways_use_ema': False, 'sideways_use_atr': True, 'sideways_use_adx': False, 'sideways_use_spike': False, 'sideways_rsi_required': True}.
[I 2025-08-30 19:26:04,928] Trial 499 finished with values: [-1000000000.0, 1000000000.0] and parameters: {'p_sma': 6, 'p_std': 34, 'p_atr': 8, 'p_adx': 20, 'rsi_period': 67, 'ema1': 13, 'ema2': 33, 'slip_atr_k': 0.0732160502051967, 'slip_spread_k': 0.1379979734951348, 'spread_hl_frac': 0.0253897801800082, 'bb_std_mult': 2.7658027884356, 'rsi_os': 46, 'rsi_ob': 87, 'vol_spike': 0.26009406567141274, 'adx_thresh': 5.094255214472113, 'atr_min_pct': 0.0003814875302027773, 'atr_max_pct': 0.03178155999868211, 'tp_mult': 2.208621272292583, 'tsl_mult': 0.5352681995597275, 'strategy': 'breakout', 'time_stop': 199, 'use_sma': True, 'use_atr': True, 'use_adx': True, 'use_ema': False, 'use_spike': True, 'rsi_required': True, 'edge_k': 0.4946272388477674, 'edge_cap': 0.46515985763633266, 'bull_strategy': 'mean_reversion', 'bull_bb_std_mult': 2.441818436550829, 'bull_rsi_os': 30, 'bull_rsi_ob': 47, 'bull_adx_thresh': 17.70693597091274, 'bull_atr_min_pct': 0.0008643590245788285, 'bull_atr_max_pct': 0.11968801411611792, 'bull_tp_mult': 1.245611121860297, 'bull_tsl_mult': 0.5366222359086816, 'bull_time_stop': 180, 'bull_use_sma': True, 'bull_use_ema': True, 'bull_use_atr': True, 'bull_use_adx': True, 'bull_use_spike': False, 'bull_rsi_required': True, 'bear_strategy': 'breakout', 'bear_bb_std_mult': 2.137644417355394, 'bear_rsi_os': 55, 'bear_rsi_ob': 75, 'bear_adx_thresh': 18.902690233748142, 'bear_atr_min_pct': 0.014283509560760443, 'bear_atr_max_pct': 0.030775554291927944, 'bear_tp_mult': 2.369022893989792, 'bear_tsl_mult': 0.7662441618985435, 'bear_time_stop': 118, 'bear_use_sma': True, 'bear_use_ema': False, 'bear_use_atr': False, 'bear_use_adx': True, 'bear_use_spike': False, 'bear_rsi_required': True, 'sideways_strategy': 'mean_reversion', 'sideways_bb_std_mult': 3.2250927822436806, 'sideways_rsi_os': 20, 'sideways_rsi_ob': 57, 'sideways_adx_thresh': 28.262205623115825, 'sideways_atr_min_pct': 0.0018921016981423566, 'sideways_atr_max_pct': 0.05559915349033409, 'sideways_tp_mult': 2.0782128373196804, 'sideways_tsl_mult': 0.9309184521296147, 'sideways_time_stop': 161, 'sideways_use_sma': False, 'sideways_use_ema': False, 'sideways_use_atr': True, 'sideways_use_adx': False, 'sideways_use_spike': False, 'sideways_rsi_required': True}.
[I 2025-08-30 19:26:11,126] Trial 500 finished with values: [-1000000000.0, 1000000000.0] and parameters: {'p_sma': 6, 'p_std': 33, 'p_atr': 22, 'p_adx': 21, 'rsi_period': 23, 'ema1': 30, 'ema2': 34, 'slip_atr_k': 0.071044373553446, 'slip_spread_k': 0.23403158099924504, 'spread_hl_frac': 0.01821199071728868, 'bb_std_mult': 2.585383942982738, 'rsi_os': 20, 'rsi_ob': 82, 'vol_spike': 0.26028924297153627, 'adx_thresh': 34.98989283956429, 'atr_min_pct': 0.0004634732944916939, 'atr_max_pct': 0.04221667518028037, 'tp_mult': 2.3151100908720945, 'tsl_mult': 0.8937847633480189, 'strategy': 'breakout', 'time_stop': 198, 'use_sma': True, 'use_atr': True, 'use_adx': True, 'use_ema': False, 'use_spike': True, 'rsi_required': True, 'edge_k': 0.08125582485466319, 'edge_cap': 0.45665844001084244, 'bull_strategy': 'mean_reversion', 'bull_bb_std_mult': 3.0112101283303967, 'bull_rsi_os': 30, 'bull_rsi_ob': 67, 'bull_adx_thresh': 17.560246043546403, 'bull_atr_min_pct': 0.0006907355310418141, 'bull_atr_max_pct': 0.08510860616273125, 'bull_tp_mult': 2.7662839673621815, 'bull_tsl_mult': 0.0278378651692206, 'bull_time_stop': 140, 'bull_use_sma': True, 'bull_use_ema': True, 'bull_use_atr': True, 'bull_use_adx': True, 'bull_use_spike': False, 'bull_rsi_required': True, 'bear_strategy': 'breakout', 'bear_bb_std_mult': 3.4819794086679337, 'bear_rsi_os': 52, 'bear_rsi_ob': 75, 'bear_adx_thresh': 27.696754415899004, 'bear_atr_min_pct': 0.009360040043004007, 'bear_atr_max_pct': 0.03766348991930889, 'bear_tp_mult': 2.6459307601081794, 'bear_tsl_mult': 0.754802033699382, 'bear_time_stop': 176, 'bear_use_sma': True, 'bear_use_ema': False, 'bear_use_atr': True, 'bear_use_adx': True, 'bear_use_spike': False, 'bear_rsi_required': True, 'sideways_strategy': 'mean_reversion', 'sideways_bb_std_mult': 3.245173340480753, 'sideways_rsi_os': 35, 'sideways_rsi_ob': 57, 'sideways_adx_thresh': 22.110008269401714, 'sideways_atr_min_pct': 0.0029638044105196335, 'sideways_atr_max_pct': 0.1414749885789295, 'sideways_tp_mult': 1.0857518526978711, 'sideways_tsl_mult': 0.9992456632083685, 'sideways_time_stop': 155, 'sideways_use_sma': False, 'sideways_use_ema': False, 'sideways_use_atr': False, 'sideways_use_adx': False, 'sideways_use_spike': False, 'sideways_rsi_required': True}.
[I 2025-08-30 19:26:11,334] Trial 501 finished with values: [-1000000000.0, 1000000000.0] and parameters: {'p_sma': 6, 'p_std': 34, 'p_atr': 29, 'p_adx': 22, 'rsi_period': 10, 'ema1': 30, 'ema2': 34, 'slip_atr_k': 0.12672068376405132, 'slip_spread_k': 0.13810450380250047, 'spread_hl_frac': 0.022763094004437885, 'bb_std_mult': 2.0604730813786656, 'rsi_os': 29, 'rsi_ob': 82, 'vol_spike': 0.061045247356200275, 'adx_thresh': 34.365578791833975, 'atr_min_pct': 0.021436014581580932, 'atr_max_pct': 0.030935393008480937, 'tp_mult': 2.4208214667537953, 'tsl_mult': 0.5351729197338467, 'strategy': 'breakout', 'time_stop': 287, 'use_sma': True, 'use_atr': False, 'use_adx': True, 'use_ema': False, 'use_spike': True, 'rsi_required': True, 'edge_k': 0.07114280863382635, 'edge_cap': 0.4694949309375791, 'bull_strategy': 'mean_reversion', 'bull_bb_std_mult': 3.1935522810976305, 'bull_rsi_os': 30, 'bull_rsi_ob': 47, 'bull_adx_thresh': 22.693425917269625, 'bull_atr_min_pct': 0.013084655149224632, 'bull_atr_max_pct': 0.11943555082122043, 'bull_tp_mult': 2.75157644600697, 'bull_tsl_mult': 0.3958946206379184, 'bull_time_stop': 26, 'bull_use_sma': False, 'bull_use_ema': True, 'bull_use_atr': True, 'bull_use_adx': True, 'bull_use_spike': False, 'bull_rsi_required': False, 'bear_strategy': 'breakout', 'bear_bb_std_mult': 3.2272638274913223, 'bear_rsi_os': 31, 'bear_rsi_ob': 77, 'bear_adx_thresh': 33.23884718157785, 'bear_atr_min_pct': 0.021767437823440722, 'bear_atr_max_pct': 0.09666375306118229, 'bear_tp_mult': 1.2208636207792933, 'bear_tsl_mult': 0.6955063660292231, 'bear_time_stop': 249, 'bear_use_sma': True, 'bear_use_ema': False, 'bear_use_atr': True, 'bear_use_adx': True, 'bear_use_spike': False, 'bear_rsi_required': True, 'sideways_strategy': 'mean_reversion', 'sideways_bb_std_mult': 1.9775239854828301, 'sideways_rsi_os': 17, 'sideways_rsi_ob': 84, 'sideways_adx_thresh': 22.069310451748912, 'sideways_atr_min_pct': 0.00786238921496291, 'sideways_atr_max_pct': 0.1498360780492464, 'sideways_tp_mult': 1.0834283423575628, 'sideways_tsl_mult': 0.4200682919565534, 'sideways_time_stop': 154, 'sideways_use_sma': False, 'sideways_use_ema': False, 'sideways_use_atr': False, 'sideways_use_adx': False, 'sideways_use_spike': True, 'sideways_rsi_required': True}.
[I 2025-08-30 19:26:12,173] Trial 505 finished with values: [-1000000000.0, 1000000000.0] and parameters: {'p_sma': 8, 'p_std': 17, 'p_atr': 17, 'p_adx': 20, 'rsi_period': 20, 'ema1': 14, 'ema2': 30, 'slip_atr_k': 0.006401528188426639, 'slip_spread_k': 0.21789827822925212, 'spread_hl_frac': 0.027895799975507004, 'bb_std_mult': 2.3760904925072226, 'rsi_os': 50, 'rsi_ob': 61, 'vol_spike': 0.07821486096182058, 'adx_thresh': 33.513694102292476, 'atr_min_pct': 0.0232781075741866, 'atr_max_pct': 0.10211163087165939, 'tp_mult': 2.2921161891763817, 'tsl_mult': 0.8378575364895349, 'strategy': 'mean_reversion', 'time_stop': 191, 'use_sma': False, 'use_atr': False, 'use_adx': False, 'use_ema': True, 'use_spike': True, 'rsi_required': False, 'edge_k': 0.21286827727274082, 'edge_cap': 0.6800166881530352, 'bull_strategy': 'mean_reversion', 'bull_bb_std_mult': 1.4945492348319687, 'bull_rsi_os': 27, 'bull_rsi_ob': 71, 'bull_adx_thresh': 18.174667693735557, 'bull_atr_min_pct': 0.0026583470744387153, 'bull_atr_max_pct': 0.1131286282163985, 'bull_tp_mult': 1.0809555640254638, 'bull_tsl_mult': 0.26334681345645494, 'bull_time_stop': 171, 'bull_use_sma': False, 'bull_use_ema': False, 'bull_use_atr': False, 'bull_use_adx': False, 'bull_use_spike': True, 'bull_rsi_required': False, 'bear_strategy': 'breakout', 'bear_bb_std_mult': 3.068771944469798, 'bear_rsi_os': 34, 'bear_rsi_ob': 78, 'bear_adx_thresh': 17.530985938223772, 'bear_atr_min_pct': 0.016102531650999754, 'bear_atr_max_pct': 0.027138213769036284, 'bear_tp_mult': 2.8053920908508343, 'bear_tsl_mult': 0.8072875330397509, 'bear_time_stop': 201, 'bear_use_sma': True, 'bear_use_ema': True, 'bear_use_atr': False, 'bear_use_adx': False, 'bear_use_spike': True, 'bear_rsi_required': False, 'sideways_strategy': 'breakout', 'sideways_bb_std_mult': 1.2729201296624488, 'sideways_rsi_os': 46, 'sideways_rsi_ob': 59, 'sideways_adx_thresh': 21.054499992378748, 'sideways_atr_min_pct': 0.009255206421152592, 'sideways_atr_max_pct': 0.13720579600099647, 'sideways_tp_mult': 2.7776352018980437, 'sideways_tsl_mult': 0.22587107818089525, 'sideways_time_stop': 172, 'sideways_use_sma': False, 'sideways_use_ema': True, 'sideways_use_atr': True, 'sideways_use_adx': False, 'sideways_use_spike': True, 'sideways_rsi_required': False}.
[I 2025-08-30 19:26:16,392] Trial 506 finished with values: [-1000000000.0, 1000000000.0] and parameters: {'p_sma': 28, 'p_std': 31, 'p_atr': 10, 'p_adx': 21, 'rsi_period': 21, 'ema1': 27, 'ema2': 31, 'slip_atr_k': 0.05230316298967283, 'slip_spread_k': 0.1552708394608801, 'spread_hl_frac': 0.02115393543189164, 'bb_std_mult': 1.8192874221042612, 'rsi_os': 51, 'rsi_ob': 62, 'vol_spike': 0.09252777405226956, 'adx_thresh': 31.935760514778476, 'atr_min_pct': 0.022426200845678305, 'atr_max_pct': 0.0184489801287954, 'tp_mult': 1.0561336924652265, 'tsl_mult': 0.11353400159774196, 'strategy': 'mean_reversion', 'time_stop': 74, 'use_sma': False, 'use_atr': True, 'use_adx': True, 'use_ema': False, 'use_spike': True, 'rsi_required': False, 'edge_k': 0.11022169533520197, 'edge_cap': 0.2357159289214068, 'bull_strategy': 'mean_reversion', 'bull_bb_std_mult': 3.0615293076211514, 'bull_rsi_os': 47, 'bull_rsi_ob': 50, 'bull_adx_thresh': 21.319502009231368, 'bull_atr_min_pct': 0.0016137330234697461, 'bull_atr_max_pct': 0.048827188872700655, 'bull_tp_mult': 2.6298476736833574, 'bull_tsl_mult': 0.5734921197459617, 'bull_time_stop': 194, 'bull_use_sma': False, 'bull_use_ema': True, 'bull_use_atr': True, 'bull_use_adx': False, 'bull_use_spike': False, 'bull_rsi_required': True, 'bear_strategy': 'mean_reversion', 'bear_bb_std_mult': 2.8786629139614903, 'bear_rsi_os': 22, 'bear_rsi_ob': 76, 'bear_adx_thresh': 16.97226778618017, 'bear_atr_min_pct': 0.012327204845387088, 'bear_atr_max_pct': 0.06512685489337283, 'bear_tp_mult': 1.093808387131984, 'bear_tsl_mult': 0.7147433294401748, 'bear_time_stop': 46, 'bear_use_sma': False, 'bear_use_ema': True, 'bear_use_atr': False, 'bear_use_adx': False, 'bear_use_spike': False, 'bear_rsi_required': True, 'sideways_strategy': 'breakout', 'sideways_bb_std_mult': 2.917997964339209, 'sideways_rsi_os': 13, 'sideways_rsi_ob': 60, 'sideways_adx_thresh': 18.997161886262056, 'sideways_atr_min_pct': 0.0032995093863947035, 'sideways_atr_max_pct': 0.14339185514845518, 'sideways_tp_mult': 2.182905636322588, 'sideways_tsl_mult': 0.29777572269594793, 'sideways_time_stop': 115, 'sideways_use_sma': False, 'sideways_use_ema': True, 'sideways_use_atr': True, 'sideways_use_adx': False, 'sideways_use_spike': False, 'sideways_rsi_required': True}.
