[I 2025-08-30 18:59:28,523] Trial 272 finished with values: [-1000000000.0, 1000000000.0] and parameters: {'p_sma': 9, 'p_std': 42, 'p_atr': 8, 'p_adx': 21, 'rsi_period': 9, 'ema1': 26, 'ema2': 37, 'slip_atr_k': 0.06585570207696853, 'slip_spread_k': 0.12190511277892968, 'spread_hl_frac': 0.023435205447521954, 'bb_std_mult': 1.464879871520714, 'rsi_os': 50, 'rsi_ob': 84, 'vol_spike': 0.23621211715692003, 'adx_thresh': 33.13571971301975, 'atr_min_pct': 0.024038235029614784, 'atr_max_pct': 0.09862610970464986, 'tp_mult': 2.321720189281069, 'tsl_mult': 0.26449807930239533, 'strategy': 'mean_reversion', 'time_stop': 215, 'use_sma': False, 'use_atr': False, 'use_adx': True, 'use_ema': False, 'use_spike': False, 'rsi_required': True, 'edge_k': 0.0026802440240413228, 'edge_cap': 0.5401225854208512, 'bull_strategy': 'mean_reversion', 'bull_bb_std_mult': 3.3053981048251355, 'bull_rsi_os': 5, 'bull_rsi_ob': 46, 'bull_adx_thresh': 19.16294762444627, 'bull_atr_min_pct': 0.0019769089015748203, 'bull_atr_max_pct': 0.12046407045772074, 'bull_tp_mult': 1.6155167090033966, 'bull_tsl_mult': 0.6431236476283269, 'bull_time_stop': 182, 'bull_use_sma': False, 'bull_use_ema': True, 'bull_use_atr': True, 'bull_use_adx': True, 'bull_use_spike': False, 'bull_rsi_required': False, 'bear_strategy': 'breakout', 'bear_bb_std_mult': 1.6926748905775602, 'bear_rsi_os': 53, 'bear_rsi_ob': 70, 'bear_adx_thresh': 18.367269957878953, 'bear_atr_min_pct': 0.013461443850038973, 'bear_atr_max_pct': 0.0316344483852154, 'bear_tp_mult': 1.2751821523503764, 'bear_tsl_mult': 0.7164785186033245, 'bear_time_stop': 199, 'bear_use_sma': False, 'bear_use_ema': True, 'bear_use_atr': False, 'bear_use_adx': False, 'bear_use_spike': False, 'bear_rsi_required': False, 'sideways_strategy': 'breakout', 'sideways_bb_std_mult': 3.0430768905179897, 'sideways_rsi_os': 30, 'sideways_rsi_ob': 62, 'sideways_adx_thresh': 6.722382764887129, 'sideways_atr_min_pct': 0.002288008800759968, 'sideways_atr_max_pct': 0.06879209821955456, 'sideways_tp_mult': 1.0635746609473757, 'sideways_tsl_mult': 0.29458160580583737, 'sideways_time_stop': 174, 'sideways_use_sma': True, 'sideways_use_ema': False, 'sideways_use_atr': False, 'sideways_use_adx': False, 'sideways_use_spike': False, 'sideways_rsi_required': True}.
[I 2025-08-30 18:59:28,554] Trial 271 finished with values: [-1000000000.0, 1000000000.0] and parameters: {'p_sma': 8, 'p_std': 42, 'p_atr': 8, 'p_adx': 17, 'rsi_period': 21, 'ema1': 5, 'ema2': 30, 'slip_atr_k': 0.07960648433469683, 'slip_spread_k': 0.4709293765034661, 'spread_hl_frac': 0.024448803314851643, 'bb_std_mult': 2.8416990313671078, 'rsi_os': 48, 'rsi_ob': 50, 'vol_spike': 0.015406132992431126, 'adx_thresh': 13.146166754217296, 'atr_min_pct': 0.02387356674035159, 'atr_max_pct': 0.1496341612435444, 'tp_mult': 2.233745355871145, 'tsl_mult': 0.6581579517339878, 'strategy': 'mean_reversion', 'time_stop': 100, 'use_sma': False, 'use_atr': False, 'use_adx': False, 'use_ema': False, 'use_spike': True, 'rsi_required': False, 'edge_k': 0.3872489304438572, 'edge_cap': 0.9369217907643483, 'bull_strategy': 'mean_reversion', 'bull_bb_std_mult': 3.3172555311854968, 'bull_rsi_os': 31, 'bull_rsi_ob': 46, 'bull_adx_thresh': 19.88246935101801, 'bull_atr_min_pct': 0.0020500218523652695, 'bull_atr_max_pct': 0.12065974880713104, 'bull_tp_mult': 2.59117399334656, 'bull_tsl_mult': 0.5354265293802709, 'bull_time_stop': 186, 'bull_use_sma': False, 'bull_use_ema': True, 'bull_use_atr': True, 'bull_use_adx': False, 'bull_use_spike': False, 'bull_rsi_required': True, 'bear_strategy': 'breakout', 'bear_bb_std_mult': 3.1576223855382355, 'bear_rsi_os': 49, 'bear_rsi_ob': 86, 'bear_adx_thresh': 18.074998040862113, 'bear_atr_min_pct': 0.019505056461869723, 'bear_atr_max_pct': 0.01411316663163123, 'bear_tp_mult': 2.6668315284106368, 'bear_tsl_mult': 0.7184687311132745, 'bear_time_stop': 290, 'bear_use_sma': True, 'bear_use_ema': True, 'bear_use_atr': False, 'bear_use_adx': False, 'bear_use_spike': False, 'bear_rsi_required': True, 'sideways_strategy': 'breakout', 'sideways_bb_std_mult': 3.028766428878159, 'sideways_rsi_os': 36, 'sideways_rsi_ob': 60, 'sideways_adx_thresh': 19.460769922949265, 'sideways_atr_min_pct': 0.004923673724591937, 'sideways_atr_max_pct': 0.141283619330155, 'sideways_tp_mult': 2.3227613844647776, 'sideways_tsl_mult': 0.6566344035142997, 'sideways_time_stop': 151, 'sideways_use_sma': False, 'sideways_use_ema': True, 'sideways_use_atr': False, 'sideways_use_adx': False, 'sideways_use_spike': False, 'sideways_rsi_required': True}.
[I 2025-08-30 18:59:28,589] Trial 273 finished with values: [-1000000000.0, 1000000000.0] and parameters: {'p_sma': 55, 'p_std': 35, 'p_atr': 8, 'p_adx': 19, 'rsi_period': 48, 'ema1': 5, 'ema2': 40, 'slip_atr_k': 0.06516056869319692, 'slip_spread_k': 0.05505307458006575, 'spread_hl_frac': 0.02626680601055773, 'bb_std_mult': 2.288925528477458, 'rsi_os': 19, 'rsi_ob': 83, 'vol_spike': 0.2639452385540565, 'adx_thresh': 22.790235581773004, 'atr_min_pct': 0.02114002533150674, 'atr_max_pct': 0.010168201767689275, 'tp_mult': 2.075853658279949, 'tsl_mult': 0.5318849981317942, 'strategy': 'mean_reversion', 'time_stop': 216, 'use_sma': False, 'use_atr': True, 'use_adx': False, 'use_ema': False, 'use_spike': False, 'rsi_required': True, 'edge_k': 1.4941442271495744, 'edge_cap': 0.6861193358985171, 'bull_strategy': 'mean_reversion', 'bull_bb_std_mult': 2.1789732811929357, 'bull_rsi_os': 27, 'bull_rsi_ob': 46, 'bull_adx_thresh': 18.42529251771342, 'bull_atr_min_pct': 0.0022954358118758428, 'bull_atr_max_pct': 0.12065436323817488, 'bull_tp_mult': 2.599411798389564, 'bull_tsl_mult': 0.645903387262864, 'bull_time_stop': 183, 'bull_use_sma': True, 'bull_use_ema': True, 'bull_use_atr': True, 'bull_use_adx': True, 'bull_use_spike': False, 'bull_rsi_required': False, 'bear_strategy': 'breakout', 'bear_bb_std_mult': 2.818356471726346, 'bear_rsi_os': 53, 'bear_rsi_ob': 50, 'bear_adx_thresh': 18.054061559891817, 'bear_atr_min_pct': 0.023467141916370525, 'bear_atr_max_pct': 0.08682320821960558, 'bear_tp_mult': 2.35955360974319, 'bear_tsl_mult': 0.7977702040657632, 'bear_time_stop': 22, 'bear_use_sma': False, 'bear_use_ema': True, 'bear_use_atr': True, 'bear_use_adx': False, 'bear_use_spike': False, 'bear_rsi_required': False, 'sideways_strategy': 'breakout', 'sideways_bb_std_mult': 3.187358654666422, 'sideways_rsi_os': 29, 'sideways_rsi_ob': 61, 'sideways_adx_thresh': 20.434428927430453, 'sideways_atr_min_pct': 0.002418556672141158, 'sideways_atr_max_pct': 0.14249074239881682, 'sideways_tp_mult': 1.3586154023086285, 'sideways_tsl_mult': 0.29881611676124686, 'sideways_time_stop': 156, 'sideways_use_sma': True, 'sideways_use_ema': False, 'sideways_use_atr': False, 'sideways_use_adx': False, 'sideways_use_spike': False, 'sideways_rsi_required': True}.
[I 2025-08-30 18:59:29,257] Trial 275 finished with values: [-1000000000.0, 1000000000.0] and parameters: {'p_sma': 55, 'p_std': 30, 'p_atr': 22, 'p_adx': 19, 'rsi_period': 36, 'ema1': 9, 'ema2': 32, 'slip_atr_k': 0.040600036947212315, 'slip_spread_k': 0.3927856281521533, 'spread_hl_frac': 0.02655663319380818, 'bb_std_mult': 2.318873865653325, 'rsi_os': 7, 'rsi_ob': 83, 'vol_spike': 0.2063658755377532, 'adx_thresh': 33.65549532142537, 'atr_min_pct': 0.016053497887809964, 'atr_max_pct': 0.010569869039448607, 'tp_mult': 2.074290100754485, 'tsl_mult': 0.8275294139778612, 'strategy': 'mean_reversion', 'time_stop': 267, 'use_sma': True, 'use_atr': True, 'use_adx': True, 'use_ema': False, 'use_spike': True, 'rsi_required': False, 'edge_k': 0.18690700382590908, 'edge_cap': 0.8517259628053975, 'bull_strategy': 'breakout', 'bull_bb_std_mult': 2.2094180421849683, 'bull_rsi_os': 35, 'bull_rsi_ob': 55, 'bull_adx_thresh': 18.63107957757584, 'bull_atr_min_pct': 0.0038388736290707924, 'bull_atr_max_pct': 0.12397624080610463, 'bull_tp_mult': 2.838619965997369, 'bull_tsl_mult': 0.3320596948988035, 'bull_time_stop': 154, 'bull_use_sma': True, 'bull_use_ema': True, 'bull_use_atr': True, 'bull_use_adx': False, 'bull_use_spike': False, 'bull_rsi_required': True, 'bear_strategy': 'breakout', 'bear_bb_std_mult': 2.7625867503740196, 'bear_rsi_os': 55, 'bear_rsi_ob': 63, 'bear_adx_thresh': 17.75913964350291, 'bear_atr_min_pct': 0.022155173525731632, 'bear_atr_max_pct': 0.03502754514000182, 'bear_tp_mult': 2.719420485733945, 'bear_tsl_mult': 0.8345302038124867, 'bear_time_stop': 142, 'bear_use_sma': False, 'bear_use_ema': True, 'bear_use_atr': True, 'bear_use_adx': False, 'bear_use_spike': True, 'bear_rsi_required': False, 'sideways_strategy': 'breakout', 'sideways_bb_std_mult': 3.2826047517748473, 'sideways_rsi_os': 36, 'sideways_rsi_ob': 56, 'sideways_adx_thresh': 34.97789165756079, 'sideways_atr_min_pct': 0.026409377420265296, 'sideways_atr_max_pct': 0.0839872201986828, 'sideways_tp_mult': 1.8386745770523896, 'sideways_tsl_mult': 0.9670532058598396, 'sideways_time_stop': 169, 'sideways_use_sma': False, 'sideways_use_ema': True, 'sideways_use_atr': True, 'sideways_use_adx': True, 'sideways_use_spike': False, 'sideways_rsi_required': True}.
[I 2025-08-30 18:59:53,422] Trial 270 finished with values: [-1000000000.0, 1000000000.0] and parameters: {'p_sma': 9, 'p_std': 30, 'p_atr': 8, 'p_adx': 27, 'rsi_period': 21, 'ema1': 7, 'ema2': 57, 'slip_atr_k': 0.07895137146256351, 'slip_spread_k': 0.5302211470180305, 'spread_hl_frac': 0.023651628846669888, 'bb_std_mult': 3.4062068719669556, 'rsi_os': 19, 'rsi_ob': 84, 'vol_spike': 0.2560153096053767, 'adx_thresh': 22.78483759812824, 'atr_min_pct': 0.023940407280684896, 'atr_max_pct': 0.0985551218702526, 'tp_mult': 2.470431268365453, 'tsl_mult': 0.6624992075907953, 'strategy': 'mean_reversion', 'time_stop': 99, 'use_sma': False, 'use_atr': False, 'use_adx': False, 'use_ema': False, 'use_spike': True, 'rsi_required': False, 'edge_k': 0.5145987043927978, 'edge_cap': 0.6521898883393692, 'bull_strategy': 'mean_reversion', 'bull_bb_std_mult': 2.197099311572654, 'bull_rsi_os': 5, 'bull_rsi_ob': 46, 'bull_adx_thresh': 19.97070276114561, 'bull_atr_min_pct': 0.003714630658479351, 'bull_atr_max_pct': 0.11156258694950132, 'bull_tp_mult': 2.597370566720149, 'bull_tsl_mult': 0.3336204255135871, 'bull_time_stop': 155, 'bull_use_sma': False, 'bull_use_ema': True, 'bull_use_atr': True, 'bull_use_adx': False, 'bull_use_spike': True, 'bull_rsi_required': True, 'bear_strategy': 'breakout', 'bear_bb_std_mult': 3.1444918100788453, 'bear_rsi_os': 50, 'bear_rsi_ob': 88, 'bear_adx_thresh': 16.309894364394072, 'bear_atr_min_pct': 0.023245818516923707, 'bear_atr_max_pct': 0.03592793496892411, 'bear_tp_mult': 2.7178666957207795, 'bear_tsl_mult': 0.6653894819990797, 'bear_time_stop': 14, 'bear_use_sma': True, 'bear_use_ema': True, 'bear_use_atr': False, 'bear_use_adx': False, 'bear_use_spike': False, 'bear_rsi_required': True, 'sideways_strategy': 'mean_reversion', 'sideways_bb_std_mult': 3.1920921253816408, 'sideways_rsi_os': 30, 'sideways_rsi_ob': 61, 'sideways_adx_thresh': 19.225452717784083, 'sideways_atr_min_pct': 0.0024999707709937747, 'sideways_atr_max_pct': 0.14171073424175573, 'sideways_tp_mult': 2.3303960248338442, 'sideways_tsl_mult': 0.2935911435856777, 'sideways_time_stop': 289, 'sideways_use_sma': False, 'sideways_use_ema': True, 'sideways_use_atr': False, 'sideways_use_adx': False, 'sideways_use_spike': False, 'sideways_rsi_required': False}.
[I 2025-08-30 18:59:59,791] Trial 276 finished with values: [-0.03066053881234243, 0.030876002360081083] and parameters: {'p_sma': 7, 'p_std': 30, 'p_atr': 9, 'p_adx': 27, 'rsi_period': 27, 'ema1': 25, 'ema2': 26, 'slip_atr_k': 0.08629380667374768, 'slip_spread_k': 0.19519892583706092, 'spread_hl_frac': 0.02267133508375724, 'bb_std_mult': 2.1515745861033575, 'rsi_os': 49, 'rsi_ob': 80, 'vol_spike': 0.20777508459285907, 'adx_thresh': 33.48814289002999, 'atr_min_pct': 0.023083455679632273, 'atr_max_pct': 0.09310217497543599, 'tp_mult': 2.3026182337679377, 'tsl_mult': 0.8330423750546729, 'strategy': 'breakout', 'time_stop': 174, 'use_sma': True, 'use_atr': True, 'use_adx': True, 'use_ema': False, 'use_spike': True, 'rsi_required': False, 'edge_k': 0.1865392814428893, 'edge_cap': 0.11426888134951524, 'bull_strategy': 'breakout', 'bull_bb_std_mult': 3.226234800938356, 'bull_rsi_os': 15, 'bull_rsi_ob': 95, 'bull_adx_thresh': 17.434921525522928, 'bull_atr_min_pct': 0.0032435864073140953, 'bull_atr_max_pct': 0.1248187149087314, 'bull_tp_mult': 2.92488279677197, 'bull_tsl_mult': 0.2982467133729738, 'bull_time_stop': 63, 'bull_use_sma': False, 'bull_use_ema': False, 'bull_use_atr': True, 'bull_use_adx': False, 'bull_use_spike': False, 'bull_rsi_required': True, 'bear_strategy': 'breakout', 'bear_bb_std_mult': 2.5422632177755764, 'bear_rsi_os': 51, 'bear_rsi_ob': 80, 'bear_adx_thresh': 16.320612722779117, 'bear_atr_min_pct': 0.025452972457675922, 'bear_atr_max_pct': 0.035478210869941976, 'bear_tp_mult': 2.7133203485234674, 'bear_tsl_mult': 0.8253158366020299, 'bear_time_stop': 210, 'bear_use_sma': True, 'bear_use_ema': False, 'bear_use_atr': False, 'bear_use_adx': True, 'bear_use_spike': True, 'bear_rsi_required': True, 'sideways_strategy': 'breakout', 'sideways_bb_std_mult': 3.28022076683631, 'sideways_rsi_os': 35, 'sideways_rsi_ob': 51, 'sideways_adx_thresh': 18.423550567918713, 'sideways_atr_min_pct': 0.0008592445519678775, 'sideways_atr_max_pct': 0.09354028756540245, 'sideways_tp_mult': 1.2741623500868413, 'sideways_tsl_mult': 0.9675109834045058, 'sideways_time_stop': 164, 'sideways_use_sma': False, 'sideways_use_ema': True, 'sideways_use_atr': True, 'sideways_use_adx': True, 'sideways_use_spike': True, 'sideways_rsi_required': True}.
[I 2025-08-30 19:00:00,125] Trial 274 finished with values: [-1000000000.0, 1000000000.0] and parameters: {'p_sma': 55, 'p_std': 30, 'p_atr': 22, 'p_adx': 11, 'rsi_period': 45, 'ema1': 7, 'ema2': 30, 'slip_atr_k': 0.04175606087163211, 'slip_spread_k': 0.0473696549409732, 'spread_hl_frac': 0.0261243822483637, 'bb_std_mult': 3.3933953881903833, 'rsi_os': 39, 'rsi_ob': 83, 'vol_spike': 0.26351651401891363, 'adx_thresh': 33.63750841217948, 'atr_min_pct': 0.0006316071794065358, 'atr_max_pct': 0.09338583602581509, 'tp_mult': 2.3122098387374446, 'tsl_mult': 0.355418228993155, 'strategy': 'mean_reversion', 'time_stop': 158, 'use_sma': False, 'use_atr': True, 'use_adx': False, 'use_ema': False, 'use_spike': True, 'rsi_required': False, 'edge_k': 0.37243150495792565, 'edge_cap': 0.11451994739506982, 'bull_strategy': 'breakout', 'bull_bb_std_mult': 2.155563138887155, 'bull_rsi_os': 44, 'bull_rsi_ob': 62, 'bull_adx_thresh': 18.339445301479522, 'bull_atr_min_pct': 0.003670578507866604, 'bull_atr_max_pct': 0.02077217456832378, 'bull_tp_mult': 2.5947172391550226, 'bull_tsl_mult': 0.4691596992397763, 'bull_time_stop': 188, 'bull_use_sma': True, 'bull_use_ema': True, 'bull_use_atr': True, 'bull_use_adx': False, 'bull_use_spike': False, 'bull_rsi_required': True, 'bear_strategy': 'breakout', 'bear_bb_std_mult': 2.7785369034604916, 'bear_rsi_os': 49, 'bear_rsi_ob': 73, 'bear_adx_thresh': 18.066647943392528, 'bear_atr_min_pct': 0.019769443505015024, 'bear_atr_max_pct': 0.10253368069600147, 'bear_tp_mult': 2.6737647153373048, 'bear_tsl_mult': 0.8059718960733361, 'bear_time_stop': 140, 'bear_use_sma': True, 'bear_use_ema': True, 'bear_use_atr': True, 'bear_use_adx': False, 'bear_use_spike': True, 'bear_rsi_required': True, 'sideways_strategy': 'breakout', 'sideways_bb_std_mult': 1.1823167313027247, 'sideways_rsi_os': 24, 'sideways_rsi_ob': 60, 'sideways_adx_thresh': 19.314825606227885, 'sideways_atr_min_pct': 0.026617823743544485, 'sideways_atr_max_pct': 0.14037766329631376, 'sideways_tp_mult': 1.0370882480682817, 'sideways_tsl_mult': 0.9632357551652889, 'sideways_time_stop': 169, 'sideways_use_sma': False, 'sideways_use_ema': True, 'sideways_use_atr': False, 'sideways_use_adx': True, 'sideways_use_spike': False, 'sideways_rsi_required': True}.
[I 2025-08-30 19:00:02,762] Trial 277 finished with values: [-1000000000.0, 1000000000.0] and parameters: {'p_sma': 7, 'p_std': 10, 'p_atr': 9, 'p_adx': 7, 'rsi_period': 43, 'ema1': 7, 'ema2': 11, 'slip_atr_k': 0.14670008805941648, 'slip_spread_k': 0.30194390573976304, 'spread_hl_frac': 0.022536730400101068, 'bb_std_mult': 2.1053991813376545, 'rsi_os': 39, 'rsi_ob': 52, 'vol_spike': 0.26886950072471794, 'adx_thresh': 33.16738470164528, 'atr_min_pct': 0.0007257170658964349, 'atr_max_pct': 0.14504758443495064, 'tp_mult': 1.1182414331652395, 'tsl_mult': 0.11057603237107749, 'strategy': 'breakout', 'time_stop': 161, 'use_sma': False, 'use_atr': True, 'use_adx': True, 'use_ema': False, 'use_spike': True, 'rsi_required': False, 'edge_k': 0.17485499971498664, 'edge_cap': 0.12430543192567822, 'bull_strategy': 'mean_reversion', 'bull_bb_std_mult': 3.1582940341653702, 'bull_rsi_os': 28, 'bull_rsi_ob': 53, 'bull_adx_thresh': 17.125601292899983, 'bull_atr_min_pct': 0.013474813725680332, 'bull_atr_max_pct': 0.1276137921456029, 'bull_tp_mult': 2.922737745256577, 'bull_tsl_mult': 0.5662053665753523, 'bull_time_stop': 294, 'bull_use_sma': False, 'bull_use_ema': False, 'bull_use_atr': False, 'bull_use_adx': False, 'bull_use_spike': False, 'bull_rsi_required': True, 'bear_strategy': 'breakout', 'bear_bb_std_mult': 2.937367859789883, 'bear_rsi_os': 51, 'bear_rsi_ob': 79, 'bear_adx_thresh': 16.25116954897032, 'bear_atr_min_pct': 0.010467682916421184, 'bear_atr_max_pct': 0.10276999593626883, 'bear_tp_mult': 2.6037893895125914, 'bear_tsl_mult': 0.6491315130125503, 'bear_time_stop': 90, 'bear_use_sma': True, 'bear_use_ema': False, 'bear_use_atr': False, 'bear_use_adx': True, 'bear_use_spike': False, 'bear_rsi_required': True, 'sideways_strategy': 'breakout', 'sideways_bb_std_mult': 2.884422085460633, 'sideways_rsi_os': 54, 'sideways_rsi_ob': 58, 'sideways_adx_thresh': 18.42463311217423, 'sideways_atr_min_pct': 0.0036021876585672985, 'sideways_atr_max_pct': 0.14412164731178156, 'sideways_tp_mult': 1.0480525730269163, 'sideways_tsl_mult': 0.7321406420495866, 'sideways_time_stop': 192, 'sideways_use_sma': False, 'sideways_use_ema': True, 'sideways_use_atr': True, 'sideways_use_adx': False, 'sideways_use_spike': True, 'sideways_rsi_required': True}.
[I 2025-08-30 19:00:32,792] Trial 278 finished with values: [-1000000000.0, 1000000000.0] and parameters: {'p_sma': 7, 'p_std': 10, 'p_atr': 9, 'p_adx': 8, 'rsi_period': 67, 'ema1': 12, 'ema2': 11, 'slip_atr_k': 0.08721456110277867, 'slip_spread_k': 0.30151250693121534, 'spread_hl_frac': 0.022247807334202212, 'bb_std_mult': 2.091184091016584, 'rsi_os': 49, 'rsi_ob': 59, 'vol_spike': 0.07412253093154254, 'adx_thresh': 33.295531150453265, 'atr_min_pct': 0.025590325357345078, 'atr_max_pct': 0.09284975062829387, 'tp_mult': 2.205957436481526, 'tsl_mult': 0.7988491516495935, 'strategy': 'breakout', 'time_stop': 171, 'use_sma': True, 'use_atr': True, 'use_adx': True, 'use_ema': False, 'use_spike': True, 'rsi_required': False, 'edge_k': 0.18566025291758143, 'edge_cap': 0.5208842915415139, 'bull_strategy': 'breakout', 'bull_bb_std_mult': 3.2246006740687996, 'bull_rsi_os': 15, 'bull_rsi_ob': 58, 'bull_adx_thresh': 9.249005604357066, 'bull_atr_min_pct': 0.022106915247883833, 'bull_atr_max_pct': 0.04345325263999648, 'bull_tp_mult': 2.9227346230997253, 'bull_tsl_mult': 0.04936607352062933, 'bull_time_stop': 65, 'bull_use_sma': False, 'bull_use_ema': False, 'bull_use_atr': False, 'bull_use_adx': False, 'bull_use_spike': False, 'bull_rsi_required': True, 'bear_strategy': 'breakout', 'bear_bb_std_mult': 2.5715702736546713, 'bear_rsi_os': 51, 'bear_rsi_ob': 79, 'bear_adx_thresh': 30.694774707306586, 'bear_atr_min_pct': 0.010554491092831568, 'bear_atr_max_pct': 0.14210262404709378, 'bear_tp_mult': 2.63012980075761, 'bear_tsl_mult': 0.9712979928259258, 'bear_time_stop': 210, 'bear_use_sma': True, 'bear_use_ema': False, 'bear_use_atr': False, 'bear_use_adx': True, 'bear_use_spike': True, 'bear_rsi_required': True, 'sideways_strategy': 'breakout', 'sideways_bb_std_mult': 1.466369588797702, 'sideways_rsi_os': 33, 'sideways_rsi_ob': 51, 'sideways_adx_thresh': 31.991898232274202, 'sideways_atr_min_pct': 0.003542647033536553, 'sideways_atr_max_pct': 0.14444524334103828, 'sideways_tp_mult': 1.040515010506203, 'sideways_tsl_mult': 0.9666990932301981, 'sideways_time_stop': 189, 'sideways_use_sma': False, 'sideways_use_ema': True, 'sideways_use_atr': True, 'sideways_use_adx': True, 'sideways_use_spike': True, 'sideways_rsi_required': True}.
