[I 2025-08-30 18:41:22,942] Trial 110 finished with values: [-1000000000.0, 1000000000.0] and parameters: {'p_sma': 18, 'p_std': 31, 'p_atr': 8, 'p_adx': 21, 'rsi_period': 52, 'ema1': 9, 'ema2': 28, 'slip_atr_k': 0.07240156764410792, 'slip_spread_k': 0.29684855634969926, 'spread_hl_frac': 0.013194634331786324, 'bb_std_mult': 2.137886868922468, 'rsi_os': 50, 'rsi_ob': 66, 'vol_spike': 0.2682226412443658, 'adx_thresh': 30.649439153541227, 'atr_min_pct': 0.014473948989001844, 'atr_max_pct': 0.13411577778703312, 'tp_mult': 2.6972862571438476, 'tsl_mult': 0.44325063962422495, 'strategy': 'mean_reversion', 'time_stop': 137, 'use_sma': False, 'use_atr': False, 'use_adx': False, 'use_ema': False, 'use_spike': False, 'rsi_required': False, 'edge_k': 0.28141895610105633, 'edge_cap': 0.5350765262532252, 'bull_strategy': 'mean_reversion', 'bull_bb_std_mult': 3.03126974225826, 'bull_rsi_os': 52, 'bull_rsi_ob': 69, 'bull_adx_thresh': 18.694689217204605, 'bull_atr_min_pct': 0.0034723108186281108, 'bull_atr_max_pct': 0.09212897835812421, 'bull_tp_mult': 2.7692203624373835, 'bull_tsl_mult': 0.5953580595679799, 'bull_time_stop': 36, 'bull_use_sma': False, 'bull_use_ema': True, 'bull_use_atr': True, 'bull_use_adx': True, 'bull_use_spike': False, 'bull_rsi_required': False, 'bear_strategy': 'breakout', 'bear_bb_std_mult': 3.0748615571571163, 'bear_rsi_os': 51, 'bear_rsi_ob': 75, 'bear_adx_thresh': 21.75420467165051, 'bear_atr_min_pct': 0.014588014846505605, 'bear_atr_max_pct': 0.08002473930853446, 'bear_tp_mult': 2.7194439537260235, 'bear_tsl_mult': 0.7110127189375798, 'bear_time_stop': 243, 'bear_use_sma': True, 'bear_use_ema': True, 'bear_use_atr': False, 'bear_use_adx': False, 'bear_use_spike': True, 'bear_rsi_required': True, 'sideways_strategy': 'breakout', 'sideways_bb_std_mult': 1.1344023622005388, 'sideways_rsi_os': 54, 'sideways_rsi_ob': 69, 'sideways_adx_thresh': 27.259653127308408, 'sideways_atr_min_pct': 0.02394568548659219, 'sideways_atr_max_pct': 0.1468502522092452, 'sideways_tp_mult': 1.2299971346719907, 'sideways_tsl_mult': 0.9172586198110934, 'sideways_time_stop': 147, 'sideways_use_sma': True, 'sideways_use_ema': True, 'sideways_use_atr': False, 'sideways_use_adx': True, 'sideways_use_spike': False, 'sideways_rsi_required': True}.
[I 2025-08-30 18:41:23,235] Trial 112 finished with values: [-1000000000.0, 1000000000.0] and parameters: {'p_sma': 15, 'p_std': 26, 'p_atr': 11, 'p_adx': 20, 'rsi_period': 32, 'ema1': 6, 'ema2': 58, 'slip_atr_k': 0.0582436151563103, 'slip_spread_k': 0.48626813726891693, 'spread_hl_frac': 0.04286362298104468, 'bb_std_mult': 2.262684572696727, 'rsi_os': 51, 'rsi_ob': 95, 'vol_spike': 0.28431015022662065, 'adx_thresh': 34.934324333586304, 'atr_min_pct': 0.024524169585842557, 'atr_max_pct': 0.1437241085802632, 'tp_mult': 1.2668585549804758, 'tsl_mult': 0.37247704730643516, 'strategy': 'mean_reversion', 'time_stop': 214, 'use_sma': False, 'use_atr': True, 'use_adx': True, 'use_ema': False, 'use_spike': True, 'rsi_required': False, 'edge_k': 0.7638551435022382, 'edge_cap': 0.6296529874032857, 'bull_strategy': 'mean_reversion', 'bull_bb_std_mult': 2.7258419082103575, 'bull_rsi_os': 17, 'bull_rsi_ob': 62, 'bull_adx_thresh': 17.47411161234509, 'bull_atr_min_pct': 0.007330472247562534, 'bull_atr_max_pct': 0.07974458327576782, 'bull_tp_mult': 1.4636445475774686, 'bull_tsl_mult': 0.4887201507772849, 'bull_time_stop': 291, 'bull_use_sma': False, 'bull_use_ema': True, 'bull_use_atr': True, 'bull_use_adx': False, 'bull_use_spike': False, 'bull_rsi_required': True, 'bear_strategy': 'breakout', 'bear_bb_std_mult': 1.2330129126804636, 'bear_rsi_os': 50, 'bear_rsi_ob': 72, 'bear_adx_thresh': 31.811639521431673, 'bear_atr_min_pct': 0.01104379080844611, 'bear_atr_max_pct': 0.030328000527396388, 'bear_tp_mult': 2.655856284284695, 'bear_tsl_mult': 0.03294546267188003, 'bear_time_stop': 191, 'bear_use_sma': True, 'bear_use_ema': True, 'bear_use_atr': False, 'bear_use_adx': False, 'bear_use_spike': False, 'bear_rsi_required': True, 'sideways_strategy': 'breakout', 'sideways_bb_std_mult': 0.5023742755553733, 'sideways_rsi_os': 5, 'sideways_rsi_ob': 55, 'sideways_adx_thresh': 9.005356047198056, 'sideways_atr_min_pct': 0.013549400553613387, 'sideways_atr_max_pct': 0.1406292886817299, 'sideways_tp_mult': 1.1308868331009807, 'sideways_tsl_mult': 0.3942837382869844, 'sideways_time_stop': 163, 'sideways_use_sma': False, 'sideways_use_ema': True, 'sideways_use_atr': True, 'sideways_use_adx': False, 'sideways_use_spike': False, 'sideways_rsi_required': True}.
[I 2025-08-30 18:41:51,893] Trial 107 finished with values: [-0.06253809139712552, 0.0624970639963571] and parameters: {'p_sma': 15, 'p_std': 24, 'p_atr': 9, 'p_adx': 20, 'rsi_period': 19, 'ema1': 11, 'ema2': 32, 'slip_atr_k': 0.07444012977336886, 'slip_spread_k': 0.16695478640128525, 'spread_hl_frac': 0.027107753723379018, 'bb_std_mult': 2.356045521073851, 'rsi_os': 14, 'rsi_ob': 70, 'vol_spike': 0.2573361722921535, 'adx_thresh': 29.57187022603832, 'atr_min_pct': 0.02444608069073648, 'atr_max_pct': 0.08900586376790454, 'tp_mult': 2.4186211065527767, 'tsl_mult': 0.810359667428184, 'strategy': 'mean_reversion', 'time_stop': 205, 'use_sma': False, 'use_atr': False, 'use_adx': False, 'use_ema': False, 'use_spike': True, 'rsi_required': False, 'edge_k': 1.2788214313683568, 'edge_cap': 0.8705224212986505, 'bull_strategy': 'mean_reversion', 'bull_bb_std_mult': 3.0584995760880367, 'bull_rsi_os': 32, 'bull_rsi_ob': 73, 'bull_adx_thresh': 21.903984780129356, 'bull_atr_min_pct': 0.0005303911696859635, 'bull_atr_max_pct': 0.12203977148218466, 'bull_tp_mult': 1.801553391354536, 'bull_tsl_mult': 0.46098760018308566, 'bull_time_stop': 147, 'bull_use_sma': False, 'bull_use_ema': True, 'bull_use_atr': False, 'bull_use_adx': True, 'bull_use_spike': True, 'bull_rsi_required': False, 'bear_strategy': 'mean_reversion', 'bear_bb_std_mult': 2.510677543199881, 'bear_rsi_os': 51, 'bear_rsi_ob': 75, 'bear_adx_thresh': 18.786508853249174, 'bear_atr_min_pct': 0.014570340718333397, 'bear_atr_max_pct': 0.10806743179822959, 'bear_tp_mult': 2.591600239667728, 'bear_tsl_mult': 0.3816419567512149, 'bear_time_stop': 190, 'bear_use_sma': False, 'bear_use_ema': True, 'bear_use_atr': False, 'bear_use_adx': False, 'bear_use_spike': True, 'bear_rsi_required': True, 'sideways_strategy': 'breakout', 'sideways_bb_std_mult': 2.671621810103146, 'sideways_rsi_os': 53, 'sideways_rsi_ob': 49, 'sideways_adx_thresh': 16.273874031706118, 'sideways_atr_min_pct': 0.0017177575353956743, 'sideways_atr_max_pct': 0.14340978172471064, 'sideways_tp_mult': 1.2315763169744, 'sideways_tsl_mult': 0.460880787609036, 'sideways_time_stop': 172, 'sideways_use_sma': False, 'sideways_use_ema': True, 'sideways_use_atr': False, 'sideways_use_adx': False, 'sideways_use_spike': False, 'sideways_rsi_required': True}.
[I 2025-08-30 18:41:52,068] Trial 106 finished with values: [-1000000000.0, 1000000000.0] and parameters: {'p_sma': 36, 'p_std': 16, 'p_atr': 9, 'p_adx': 20, 'rsi_period': 19, 'ema1': 23, 'ema2': 51, 'slip_atr_k': 0.07094435353650223, 'slip_spread_k': 0.17070590845390068, 'spread_hl_frac': 0.020738178097117747, 'bb_std_mult': 2.357525230495617, 'rsi_os': 44, 'rsi_ob': 76, 'vol_spike': 0.21654254572602066, 'adx_thresh': 28.949575996818385, 'atr_min_pct': 0.024570539181636503, 'atr_max_pct': 0.10757495276598554, 'tp_mult': 2.685515337966153, 'tsl_mult': 0.8826302744973967, 'strategy': 'mean_reversion', 'time_stop': 201, 'use_sma': False, 'use_atr': False, 'use_adx': False, 'use_ema': False, 'use_spike': True, 'rsi_required': False, 'edge_k': 0.003516674184935953, 'edge_cap': 0.4998405386690369, 'bull_strategy': 'mean_reversion', 'bull_bb_std_mult': 3.030621132956049, 'bull_rsi_os': 32, 'bull_rsi_ob': 74, 'bull_adx_thresh': 21.285452322503314, 'bull_atr_min_pct': 0.00747905855339226, 'bull_atr_max_pct': 0.12182864537966258, 'bull_tp_mult': 2.5608421284255503, 'bull_tsl_mult': 0.5926775736604262, 'bull_time_stop': 169, 'bull_use_sma': False, 'bull_use_ema': True, 'bull_use_atr': False, 'bull_use_adx': False, 'bull_use_spike': True, 'bull_rsi_required': True, 'bear_strategy': 'mean_reversion', 'bear_bb_std_mult': 2.4557040739766953, 'bear_rsi_os': 51, 'bear_rsi_ob': 82, 'bear_adx_thresh': 32.48105394799333, 'bear_atr_min_pct': 0.016802649422789976, 'bear_atr_max_pct': 0.0880611858713591, 'bear_tp_mult': 2.135555597023092, 'bear_tsl_mult': 0.38293066346791593, 'bear_time_stop': 281, 'bear_use_sma': False, 'bear_use_ema': True, 'bear_use_atr': False, 'bear_use_adx': False, 'bear_use_spike': True, 'bear_rsi_required': True, 'sideways_strategy': 'breakout', 'sideways_bb_std_mult': 2.669543714622712, 'sideways_rsi_os': 29, 'sideways_rsi_ob': 59, 'sideways_adx_thresh': 15.397159059443883, 'sideways_atr_min_pct': 0.0191065737229996, 'sideways_atr_max_pct': 0.14334969467542952, 'sideways_tp_mult': 1.2331962524518056, 'sideways_tsl_mult': 0.4682555561745593, 'sideways_time_stop': 168, 'sideways_use_sma': False, 'sideways_use_ema': True, 'sideways_use_atr': True, 'sideways_use_adx': False, 'sideways_use_spike': False, 'sideways_rsi_required': True}.
[I 2025-08-30 18:41:55,211] Trial 111 finished with values: [-1000000000.0, 1000000000.0] and parameters: {'p_sma': 16, 'p_std': 26, 'p_atr': 8, 'p_adx': 20, 'rsi_period': 32, 'ema1': 9, 'ema2': 58, 'slip_atr_k': 0.05751129640285747, 'slip_spread_k': 0.3130387127727754, 'spread_hl_frac': 0.025776041048340224, 'bb_std_mult': 2.1602902643121626, 'rsi_os': 40, 'rsi_ob': 94, 'vol_spike': 0.268025110150908, 'adx_thresh': 33.206947065703915, 'atr_min_pct': 0.01827316176888458, 'atr_max_pct': 0.13214507356859118, 'tp_mult': 1.230214630419768, 'tsl_mult': 0.846884925187835, 'strategy': 'mean_reversion', 'time_stop': 141, 'use_sma': False, 'use_atr': True, 'use_adx': True, 'use_ema': False, 'use_spike': True, 'rsi_required': False, 'edge_k': 1.8978624971474543, 'edge_cap': 0.5310120260151389, 'bull_strategy': 'mean_reversion', 'bull_bb_std_mult': 3.451578405593799, 'bull_rsi_os': 52, 'bull_rsi_ob': 70, 'bull_adx_thresh': 17.428009789617104, 'bull_atr_min_pct': 0.007368874255388331, 'bull_atr_max_pct': 0.07534942240263735, 'bull_tp_mult': 2.773475270720807, 'bull_tsl_mult': 0.39390760064521513, 'bull_time_stop': 289, 'bull_use_sma': False, 'bull_use_ema': True, 'bull_use_atr': True, 'bull_use_adx': False, 'bull_use_spike': False, 'bull_rsi_required': True, 'bear_strategy': 'breakout', 'bear_bb_std_mult': 1.1456861939166907, 'bear_rsi_os': 5, 'bear_rsi_ob': 80, 'bear_adx_thresh': 32.26928828440716, 'bear_atr_min_pct': 0.017037583678468287, 'bear_atr_max_pct': 0.031912739068172304, 'bear_tp_mult': 2.733697869991517, 'bear_tsl_mult': 0.6993109863602487, 'bear_time_stop': 51, 'bear_use_sma': True, 'bear_use_ema': True, 'bear_use_atr': False, 'bear_use_adx': False, 'bear_use_spike': False, 'bear_rsi_required': True, 'sideways_strategy': 'breakout', 'sideways_bb_std_mult': 2.6776693759765524, 'sideways_rsi_os': 10, 'sideways_rsi_ob': 69, 'sideways_adx_thresh': 26.694419029332437, 'sideways_atr_min_pct': 0.014823333329305622, 'sideways_atr_max_pct': 0.022525344166105764, 'sideways_tp_mult': 1.241601272612275, 'sideways_tsl_mult': 0.400130955903623, 'sideways_time_stop': 186, 'sideways_use_sma': False, 'sideways_use_ema': True, 'sideways_use_atr': True, 'sideways_use_adx': True, 'sideways_use_spike': False, 'sideways_rsi_required': True}.
[I 2025-08-30 18:41:56,766] Trial 113 finished with values: [-1000000000.0, 1000000000.0] and parameters: {'p_sma': 56, 'p_std': 53, 'p_atr': 8, 'p_adx': 26, 'rsi_period': 68, 'ema1': 28, 'ema2': 38, 'slip_atr_k': 0.23148577442723592, 'slip_spread_k': 0.32572936963795374, 'spread_hl_frac': 0.02231736361993712, 'bb_std_mult': 2.3553267005777414, 'rsi_os': 41, 'rsi_ob': 80, 'vol_spike': 0.24007459673111745, 'adx_thresh': 5.091412786517315, 'atr_min_pct': 0.018160650553115984, 'atr_max_pct': 0.12341228384098049, 'tp_mult': 1.6209721082385815, 'tsl_mult': 0.1669446517787294, 'strategy': 'mean_reversion', 'time_stop': 164, 'use_sma': False, 'use_atr': True, 'use_adx': True, 'use_ema': False, 'use_spike': True, 'rsi_required': False, 'edge_k': 0.009648107677679416, 'edge_cap': 0.859882875607651, 'bull_strategy': 'breakout', 'bull_bb_std_mult': 2.9840436814536324, 'bull_rsi_os': 42, 'bull_rsi_ob': 67, 'bull_adx_thresh': 17.843587450537523, 'bull_atr_min_pct': 0.003635018899698094, 'bull_atr_max_pct': 0.11205816670225445, 'bull_tp_mult': 1.613748941738914, 'bull_tsl_mult': 0.9728617891869706, 'bull_time_stop': 182, 'bull_use_sma': True, 'bull_use_ema': True, 'bull_use_atr': True, 'bull_use_adx': False, 'bull_use_spike': False, 'bull_rsi_required': True, 'bear_strategy': 'mean_reversion', 'bear_bb_std_mult': 2.3954010752106694, 'bear_rsi_os': 45, 'bear_rsi_ob': 80, 'bear_adx_thresh': 15.685320667654606, 'bear_atr_min_pct': 0.018756523810343803, 'bear_atr_max_pct': 0.040717420632048335, 'bear_tp_mult': 2.5317188862228086, 'bear_tsl_mult': 0.23575598370424955, 'bear_time_stop': 34, 'bear_use_sma': False, 'bear_use_ema': True, 'bear_use_atr': False, 'bear_use_adx': False, 'bear_use_spike': False, 'bear_rsi_required': True, 'sideways_strategy': 'breakout', 'sideways_bb_std_mult': 0.7264456139218576, 'sideways_rsi_os': 32, 'sideways_rsi_ob': 63, 'sideways_adx_thresh': 16.699649757656676, 'sideways_atr_min_pct': 0.010690457540265255, 'sideways_atr_max_pct': 0.02375287469873822, 'sideways_tp_mult': 1.1198739300693188, 'sideways_tsl_mult': 0.44104777931111844, 'sideways_time_stop': 188, 'sideways_use_sma': False, 'sideways_use_ema': True, 'sideways_use_atr': True, 'sideways_use_adx': False, 'sideways_use_spike': False, 'sideways_rsi_required': True}.
[I 2025-08-30 18:41:56,975] Trial 116 finished with values: [-1000000000.0, 1000000000.0] and parameters: {'p_sma': 11, 'p_std': 51, 'p_atr': 10, 'p_adx': 13, 'rsi_period': 62, 'ema1': 28, 'ema2': 46, 'slip_atr_k': 0.2493196340344243, 'slip_spread_k': 0.10344444659395358, 'spread_hl_frac': 0.022435595411820962, 'bb_std_mult': 2.2218599758565705, 'rsi_os': 54, 'rsi_ob': 74, 'vol_spike': 0.2392697938998571, 'adx_thresh': 11.513597038853067, 'atr_min_pct': 0.02332867383910506, 'atr_max_pct': 0.09052412422722363, 'tp_mult': 2.314545642871049, 'tsl_mult': 0.18648849994237676, 'strategy': 'mean_reversion', 'time_stop': 164, 'use_sma': False, 'use_atr': True, 'use_adx': True, 'use_ema': False, 'use_spike': True, 'rsi_required': False, 'edge_k': 0.2072783051104057, 'edge_cap': 0.9979590157648649, 'bull_strategy': 'breakout', 'bull_bb_std_mult': 2.980794755454953, 'bull_rsi_os': 29, 'bull_rsi_ob': 47, 'bull_adx_thresh': 24.787284497093623, 'bull_atr_min_pct': 0.002029763950639229, 'bull_atr_max_pct': 0.11571348717026839, 'bull_tp_mult': 2.700349174920351, 'bull_tsl_mult': 0.6675573825559368, 'bull_time_stop': 185, 'bull_use_sma': True, 'bull_use_ema': True, 'bull_use_atr': True, 'bull_use_adx': False, 'bull_use_spike': False, 'bull_rsi_required': True, 'bear_strategy': 'breakout', 'bear_bb_std_mult': 1.7395340834114599, 'bear_rsi_os': 17, 'bear_rsi_ob': 78, 'bear_adx_thresh': 24.878373957993922, 'bear_atr_min_pct': 0.015025029847459006, 'bear_atr_max_pct': 0.10734156690717525, 'bear_tp_mult': 2.3747839872703143, 'bear_tsl_mult': 0.8196941517318754, 'bear_time_stop': 176, 'bear_use_sma': True, 'bear_use_ema': True, 'bear_use_atr': False, 'bear_use_adx': False, 'bear_use_spike': False, 'bear_rsi_required': True, 'sideways_strategy': 'mean_reversion', 'sideways_bb_std_mult': 3.3080612300259262, 'sideways_rsi_os': 53, 'sideways_rsi_ob': 50, 'sideways_adx_thresh': 19.508169428956965, 'sideways_atr_min_pct': 0.010181285327710335, 'sideways_atr_max_pct': 0.0324292547376262, 'sideways_tp_mult': 1.1068844742096466, 'sideways_tsl_mult': 0.8359091096834822, 'sideways_time_stop': 155, 'sideways_use_sma': False, 'sideways_use_ema': False, 'sideways_use_atr': True, 'sideways_use_adx': False, 'sideways_use_spike': False, 'sideways_rsi_required': True}.
[I 2025-08-30 18:42:26,744] Trial 115 finished with values: [-1000000000.0, 1000000000.0] and parameters: {'p_sma': 11, 'p_std': 29, 'p_atr': 8, 'p_adx': 24, 'rsi_period': 76, 'ema1': 28, 'ema2': 47, 'slip_atr_k': 0.2406472500261465, 'slip_spread_k': 0.10040101869803045, 'spread_hl_frac': 0.022668811547708997, 'bb_std_mult': 2.2359008736061967, 'rsi_os': 12, 'rsi_ob': 80, 'vol_spike': 0.2393507219268293, 'adx_thresh': 15.975476625235002, 'atr_min_pct': 0.02600433530920291, 'atr_max_pct': 0.09824714737711854, 'tp_mult': 2.304537435756145, 'tsl_mult': 0.8463924974443604, 'strategy': 'mean_reversion', 'time_stop': 169, 'use_sma': False, 'use_atr': True, 'use_adx': True, 'use_ema': False, 'use_spike': True, 'rsi_required': False, 'edge_k': 0.08997610734863024, 'edge_cap': 0.5275470978350966, 'bull_strategy': 'breakout', 'bull_bb_std_mult': 2.965182080957899, 'bull_rsi_os': 29, 'bull_rsi_ob': 47, 'bull_adx_thresh': 32.82599269901018, 'bull_atr_min_pct': 0.001898988435503154, 'bull_atr_max_pct': 0.11112562831468463, 'bull_tp_mult': 2.7704632611437057, 'bull_tsl_mult': 0.6663777195258347, 'bull_time_stop': 184, 'bull_use_sma': True, 'bull_use_ema': True, 'bull_use_atr': True, 'bull_use_adx': False, 'bull_use_spike': False, 'bull_rsi_required': True, 'bear_strategy': 'breakout', 'bear_bb_std_mult': 1.7280812131746663, 'bear_rsi_os': 8, 'bear_rsi_ob': 78, 'bear_adx_thresh': 22.906556768675596, 'bear_atr_min_pct': 0.014955251894978613, 'bear_atr_max_pct': 0.10671150436183122, 'bear_tp_mult': 1.4321996467898828, 'bear_tsl_mult': 0.7284215955902329, 'bear_time_stop': 174, 'bear_use_sma': True, 'bear_use_ema': True, 'bear_use_atr': False, 'bear_use_adx': False, 'bear_use_spike': False, 'bear_rsi_required': True, 'sideways_strategy': 'mean_reversion', 'sideways_bb_std_mult': 0.684328551985746, 'sideways_rsi_os': 42, 'sideways_rsi_ob': 63, 'sideways_adx_thresh': 19.668416383418663, 'sideways_atr_min_pct': 0.010020901836896162, 'sideways_atr_max_pct': 0.021086502242034462, 'sideways_tp_mult': 1.013558036331379, 'sideways_tsl_mult': 0.16076350851504595, 'sideways_time_stop': 136, 'sideways_use_sma': False, 'sideways_use_ema': True, 'sideways_use_atr': True, 'sideways_use_adx': True, 'sideways_use_spike': False, 'sideways_rsi_required': True}.
[I 2025-08-30 18:42:27,296] Trial 114 finished with values: [-1000000000.0, 1000000000.0] and parameters: {'p_sma': 11, 'p_std': 53, 'p_atr': 9, 'p_adx': 20, 'rsi_period': 17, 'ema1': 25, 'ema2': 32, 'slip_atr_k': 0.08684010888678956, 'slip_spread_k': 0.10525973542771798, 'spread_hl_frac': 0.020518830680443582, 'bb_std_mult': 2.377647024267634, 'rsi_os': 11, 'rsi_ob': 73, 'vol_spike': 0.2486268195919949, 'adx_thresh': 12.70406313697977, 'atr_min_pct': 0.021957615359169402, 'atr_max_pct': 0.10717647713362285, 'tp_mult': 2.3161839242410074, 'tsl_mult': 0.8444937175223289, 'strategy': 'mean_reversion', 'time_stop': 115, 'use_sma': False, 'use_atr': True, 'use_adx': True, 'use_ema': False, 'use_spike': True, 'rsi_required': False, 'edge_k': 1.9130131294463764, 'edge_cap': 0.4882978985558981, 'bull_strategy': 'breakout', 'bull_bb_std_mult': 2.9631453201060944, 'bull_rsi_os': 33, 'bull_rsi_ob': 51, 'bull_adx_thresh': 24.53019187391123, 'bull_atr_min_pct': 0.0019082530012399707, 'bull_atr_max_pct': 0.11131574629174075, 'bull_tp_mult': 2.9475885983749177, 'bull_tsl_mult': 0.9778384787357909, 'bull_time_stop': 183, 'bull_use_sma': True, 'bull_use_ema': True, 'bull_use_atr': True, 'bull_use_adx': False, 'bull_use_spike': False, 'bull_rsi_required': True, 'bear_strategy': 'breakout', 'bear_bb_std_mult': 1.7870956774698241, 'bear_rsi_os': 5, 'bear_rsi_ob': 78, 'bear_adx_thresh': 24.872654581717953, 'bear_atr_min_pct': 0.013867287679483784, 'bear_atr_max_pct': 0.14865787158673227, 'bear_tp_mult': 1.0203663441992852, 'bear_tsl_mult': 0.5425012953180747, 'bear_time_stop': 225, 'bear_use_sma': False, 'bear_use_ema': True, 'bear_use_atr': False, 'bear_use_adx': False, 'bear_use_spike': False, 'bear_rsi_required': True, 'sideways_strategy': 'breakout', 'sideways_bb_std_mult': 3.3120776954843145, 'sideways_rsi_os': 53, 'sideways_rsi_ob': 63, 'sideways_adx_thresh': 11.892577434354383, 'sideways_atr_min_pct': 0.019016589628960294, 'sideways_atr_max_pct': 0.14348406779022368, 'sideways_tp_mult': 2.6586395828234624, 'sideways_tsl_mult': 0.8303045521225987, 'sideways_time_stop': 187, 'sideways_use_sma': False, 'sideways_use_ema': True, 'sideways_use_atr': True, 'sideways_use_adx': False, 'sideways_use_spike': False, 'sideways_rsi_required': True}.
