[I 2025-08-30 19:01:12,129] Trial 289 finished with values: [-1000000000.0, 1000000000.0] and parameters: {'p_sma': 46, 'p_std': 28, 'p_atr': 10, 'p_adx': 21, 'rsi_period': 24, 'ema1': 29, 'ema2': 33, 'slip_atr_k': 0.0547634332494239, 'slip_spread_k': 0.11774435845975667, 'spread_hl_frac': 0.012882619904523966, 'bb_std_mult': 2.3746477365758625, 'rsi_os': 46, 'rsi_ob': 82, 'vol_spike': 0.2725304755585091, 'adx_thresh': 14.704131851274092, 'atr_min_pct': 0.028634233535803987, 'atr_max_pct': 0.10355315161814918, 'tp_mult': 2.1542971299038114, 'tsl_mult': 0.8682696272181413, 'strategy': 'mean_reversion', 'time_stop': 189, 'use_sma': False, 'use_atr': False, 'use_adx': False, 'use_ema': False, 'use_spike': True, 'rsi_required': False, 'edge_k': 1.5457019117912907, 'edge_cap': 0.9883558177284733, 'bull_strategy': 'mean_reversion', 'bull_bb_std_mult': 1.0633879021096408, 'bull_rsi_os': 31, 'bull_rsi_ob': 91, 'bull_adx_thresh': 19.16217230520164, 'bull_atr_min_pct': 0.0032165731156613667, 'bull_atr_max_pct': 0.12471555813395657, 'bull_tp_mult': 2.831931689374392, 'bull_tsl_mult': 0.3749323686618207, 'bull_time_stop': 251, 'bull_use_sma': True, 'bull_use_ema': True, 'bull_use_atr': True, 'bull_use_adx': False, 'bull_use_spike': True, 'bull_rsi_required': True, 'bear_strategy': 'breakout', 'bear_bb_std_mult': 2.853562700459546, 'bear_rsi_os': 47, 'bear_rsi_ob': 65, 'bear_adx_thresh': 31.460076095208603, 'bear_atr_min_pct': 0.02800855055906616, 'bear_atr_max_pct': 0.06177970525107836, 'bear_tp_mult': 1.4076690898667237, 'bear_tsl_mult': 0.8216326174465685, 'bear_time_stop': 202, 'bear_use_sma': True, 'bear_use_ema': True, 'bear_use_atr': True, 'bear_use_adx': False, 'bear_use_spike': False, 'bear_rsi_required': True, 'sideways_strategy': 'mean_reversion', 'sideways_bb_std_mult': 3.2675096273099093, 'sideways_rsi_os': 36, 'sideways_rsi_ob': 52, 'sideways_adx_thresh': 25.27058822820677, 'sideways_atr_min_pct': 0.0017739554661022115, 'sideways_atr_max_pct': 0.14817927884937723, 'sideways_tp_mult': 1.495798925017165, 'sideways_tsl_mult': 0.9435109182080395, 'sideways_time_stop': 150, 'sideways_use_sma': False, 'sideways_use_ema': True, 'sideways_use_atr': True, 'sideways_use_adx': False, 'sideways_use_spike': False, 'sideways_rsi_required': False}.
[I 2025-08-30 19:01:12,228] Trial 287 finished with values: [-1000000000.0, 1000000000.0] and parameters: {'p_sma': 26, 'p_std': 45, 'p_atr': 25, 'p_adx': 20, 'rsi_period': 24, 'ema1': 21, 'ema2': 35, 'slip_atr_k': 0.0528010556932194, 'slip_spread_k': 0.17489809744262608, 'spread_hl_frac': 0.03986433189346219, 'bb_std_mult': 2.264634422691705, 'rsi_os': 46, 'rsi_ob': 61, 'vol_spike': 0.007486698231368827, 'adx_thresh': 12.113223126070048, 'atr_min_pct': 0.014388756610228755, 'atr_max_pct': 0.035061805701857136, 'tp_mult': 2.9875396371698533, 'tsl_mult': 0.8377605421903002, 'strategy': 'mean_reversion', 'time_stop': 188, 'use_sma': False, 'use_atr': True, 'use_adx': True, 'use_ema': True, 'use_spike': True, 'rsi_required': False, 'edge_k': 0.2715653834015541, 'edge_cap': 0.9871936527036601, 'bull_strategy': 'mean_reversion', 'bull_bb_std_mult': 3.1370232922797894, 'bull_rsi_os': 50, 'bull_rsi_ob': 45, 'bull_adx_thresh': 18.682438178413374, 'bull_atr_min_pct': 0.0029989554666401833, 'bull_atr_max_pct': 0.038827940120307464, 'bull_tp_mult': 2.74363448859109, 'bull_tsl_mult': 0.6210310464121055, 'bull_time_stop': 196, 'bull_use_sma': True, 'bull_use_ema': True, 'bull_use_atr': True, 'bull_use_adx': False, 'bull_use_spike': True, 'bull_rsi_required': True, 'bear_strategy': 'mean_reversion', 'bear_bb_std_mult': 2.244131774179237, 'bear_rsi_os': 54, 'bear_rsi_ob': 52, 'bear_adx_thresh': 16.759586041182335, 'bear_atr_min_pct': 0.025362733927223206, 'bear_atr_max_pct': 0.03169884713235067, 'bear_tp_mult': 1.6608907980891359, 'bear_tsl_mult': 0.06506106800754285, 'bear_time_stop': 247, 'bear_use_sma': False, 'bear_use_ema': True, 'bear_use_atr': True, 'bear_use_adx': False, 'bear_use_spike': False, 'bear_rsi_required': False, 'sideways_strategy': 'mean_reversion', 'sideways_bb_std_mult': 1.8655890153646206, 'sideways_rsi_os': 38, 'sideways_rsi_ob': 71, 'sideways_adx_thresh': 27.663193706087515, 'sideways_atr_min_pct': 0.01672139269429219, 'sideways_atr_max_pct': 0.14762135098129497, 'sideways_tp_mult': 2.3821039332145366, 'sideways_tsl_mult': 0.009050779812912912, 'sideways_time_stop': 162, 'sideways_use_sma': False, 'sideways_use_ema': True, 'sideways_use_atr': True, 'sideways_use_adx': False, 'sideways_use_spike': False, 'sideways_rsi_required': False}.
[I 2025-08-30 19:01:12,825] Trial 292 finished with values: [-1000000000.0, 1000000000.0] and parameters: {'p_sma': 8, 'p_std': 31, 'p_atr': 9, 'p_adx': 19, 'rsi_period': 82, 'ema1': 28, 'ema2': 59, 'slip_atr_k': 0.24980042439973268, 'slip_spread_k': 0.5998901806863095, 'spread_hl_frac': 0.042066751586415596, 'bb_std_mult': 2.0203153520193746, 'rsi_os': 50, 'rsi_ob': 84, 'vol_spike': 0.1225431695416825, 'adx_thresh': 34.884902299171024, 'atr_min_pct': 0.023214882495603096, 'atr_max_pct': 0.09229584461448237, 'tp_mult': 2.851087266959151, 'tsl_mult': 0.8468318469070134, 'strategy': 'mean_reversion', 'time_stop': 198, 'use_sma': False, 'use_atr': True, 'use_adx': False, 'use_ema': False, 'use_spike': True, 'rsi_required': False, 'edge_k': 0.2533107728813975, 'edge_cap': 0.5268422632970566, 'bull_strategy': 'breakout', 'bull_bb_std_mult': 1.4704023161095372, 'bull_rsi_os': 20, 'bull_rsi_ob': 47, 'bull_adx_thresh': 18.24558647483346, 'bull_atr_min_pct': 0.001028999620347493, 'bull_atr_max_pct': 0.12126119272008787, 'bull_tp_mult': 1.6835401061657218, 'bull_tsl_mult': 0.5524432542901754, 'bull_time_stop': 167, 'bull_use_sma': False, 'bull_use_ema': True, 'bull_use_atr': True, 'bull_use_adx': False, 'bull_use_spike': False, 'bull_rsi_required': True, 'bear_strategy': 'breakout', 'bear_bb_std_mult': 2.3073223169794015, 'bear_rsi_os': 14, 'bear_rsi_ob': 73, 'bear_adx_thresh': 15.289989383101226, 'bear_atr_min_pct': 0.015470934210972924, 'bear_atr_max_pct': 0.09720599967741728, 'bear_tp_mult': 2.6870799563707726, 'bear_tsl_mult': 0.7414717425308927, 'bear_time_stop': 247, 'bear_use_sma': True, 'bear_use_ema': True, 'bear_use_atr': False, 'bear_use_adx': False, 'bear_use_spike': True, 'bear_rsi_required': True, 'sideways_strategy': 'breakout', 'sideways_bb_std_mult': 3.1912486344710898, 'sideways_rsi_os': 13, 'sideways_rsi_ob': 46, 'sideways_adx_thresh': 21.3737008416098, 'sideways_atr_min_pct': 0.003003555993469541, 'sideways_atr_max_pct': 0.050580679516363095, 'sideways_tp_mult': 2.385450439890683, 'sideways_tsl_mult': 0.9163372104273638, 'sideways_time_stop': 165, 'sideways_use_sma': False, 'sideways_use_ema': True, 'sideways_use_atr': False, 'sideways_use_adx': True, 'sideways_use_spike': False, 'sideways_rsi_required': True}.
[I 2025-08-30 19:01:45,337] Trial 291 finished with values: [-1000000000.0, 1000000000.0] and parameters: {'p_sma': 38, 'p_std': 38, 'p_atr': 16, 'p_adx': 19, 'rsi_period': 82, 'ema1': 24, 'ema2': 35, 'slip_atr_k': 0.10973430196999726, 'slip_spread_k': 0.6123445001344168, 'spread_hl_frac': 0.008122833148408417, 'bb_std_mult': 0.9018889986294947, 'rsi_os': 17, 'rsi_ob': 85, 'vol_spike': 0.2596836244931042, 'adx_thresh': 24.992604115543813, 'atr_min_pct': 0.004339192136451812, 'atr_max_pct': 0.03540939139154556, 'tp_mult': 1.532270345023446, 'tsl_mult': 0.8431388136931939, 'strategy': 'mean_reversion', 'time_stop': 202, 'use_sma': False, 'use_atr': True, 'use_adx': False, 'use_ema': False, 'use_spike': True, 'rsi_required': False, 'edge_k': 0.11798702228532165, 'edge_cap': 0.7850049761018733, 'bull_strategy': 'breakout', 'bull_bb_std_mult': 3.083001850037324, 'bull_rsi_os': 20, 'bull_rsi_ob': 47, 'bull_adx_thresh': 32.08634536701064, 'bull_atr_min_pct': 0.01601180371872813, 'bull_atr_max_pct': 0.12204343385421472, 'bull_tp_mult': 2.0386337780447312, 'bull_tsl_mult': 0.5572078820045387, 'bull_time_stop': 163, 'bull_use_sma': False, 'bull_use_ema': True, 'bull_use_atr': True, 'bull_use_adx': False, 'bull_use_spike': False, 'bull_rsi_required': True, 'bear_strategy': 'breakout', 'bear_bb_std_mult': 2.2174317108990547, 'bear_rsi_os': 53, 'bear_rsi_ob': 73, 'bear_adx_thresh': 32.94850737302846, 'bear_atr_min_pct': 0.025520199871564113, 'bear_atr_max_pct': 0.09747612507156589, 'bear_tp_mult': 2.689696554568354, 'bear_tsl_mult': 0.7337906633865467, 'bear_time_stop': 200, 'bear_use_sma': True, 'bear_use_ema': True, 'bear_use_atr': False, 'bear_use_adx': False, 'bear_use_spike': True, 'bear_rsi_required': True, 'sideways_strategy': 'breakout', 'sideways_bb_std_mult': 2.0124247661336203, 'sideways_rsi_os': 13, 'sideways_rsi_ob': 60, 'sideways_adx_thresh': 27.886791655865323, 'sideways_atr_min_pct': 0.007633050446096869, 'sideways_atr_max_pct': 0.10364741894588814, 'sideways_tp_mult': 2.83630527745904, 'sideways_tsl_mult': 0.7591029468181484, 'sideways_time_stop': 166, 'sideways_use_sma': False, 'sideways_use_ema': True, 'sideways_use_atr': False, 'sideways_use_adx': True, 'sideways_use_spike': False, 'sideways_rsi_required': True}.
[I 2025-08-30 19:01:46,885] Trial 290 finished with values: [-1000000000.0, 1000000000.0] and parameters: {'p_sma': 32, 'p_std': 28, 'p_atr': 16, 'p_adx': 21, 'rsi_period': 24, 'ema1': 28, 'ema2': 33, 'slip_atr_k': 0.10900602529082892, 'slip_spread_k': 0.3407356455026586, 'spread_hl_frac': 0.016053617299102756, 'bb_std_mult': 2.277891238783068, 'rsi_os': 46, 'rsi_ob': 82, 'vol_spike': 0.2590701355899648, 'adx_thresh': 11.973849121943477, 'atr_min_pct': 0.006012155190064535, 'atr_max_pct': 0.10355916501015379, 'tp_mult': 1.418461840861195, 'tsl_mult': 0.8478012859328785, 'strategy': 'mean_reversion', 'time_stop': 198, 'use_sma': False, 'use_atr': False, 'use_adx': False, 'use_ema': False, 'use_spike': True, 'rsi_required': False, 'edge_k': 0.12430548606611747, 'edge_cap': 0.5252465711589914, 'bull_strategy': 'breakout', 'bull_bb_std_mult': 1.6380970427141972, 'bull_rsi_os': 20, 'bull_rsi_ob': 45, 'bull_adx_thresh': 16.122049878183375, 'bull_atr_min_pct': 0.002217066664903849, 'bull_atr_max_pct': 0.038558016444296996, 'bull_tp_mult': 2.8514143933990517, 'bull_tsl_mult': 0.5232957699690882, 'bull_time_stop': 248, 'bull_use_sma': False, 'bull_use_ema': True, 'bull_use_atr': True, 'bull_use_adx': False, 'bull_use_spike': True, 'bull_rsi_required': True, 'bear_strategy': 'breakout', 'bear_bb_std_mult': 2.512737530232382, 'bear_rsi_os': 19, 'bear_rsi_ob': 81, 'bear_adx_thresh': 17.54841806757737, 'bear_atr_min_pct': 0.015545298009209573, 'bear_atr_max_pct': 0.03410695739184091, 'bear_tp_mult': 2.6884291523031214, 'bear_tsl_mult': 0.8248592418229985, 'bear_time_stop': 202, 'bear_use_sma': True, 'bear_use_ema': True, 'bear_use_atr': True, 'bear_use_adx': False, 'bear_use_spike': True, 'bear_rsi_required': True, 'sideways_strategy': 'mean_reversion', 'sideways_bb_std_mult': 3.181759178704811, 'sideways_rsi_os': 12, 'sideways_rsi_ob': 62, 'sideways_adx_thresh': 21.138740575773443, 'sideways_atr_min_pct': 0.01550772682591378, 'sideways_atr_max_pct': 0.14786299934137379, 'sideways_tp_mult': 2.8034542819889756, 'sideways_tsl_mult': 0.7555052579699493, 'sideways_time_stop': 149, 'sideways_use_sma': False, 'sideways_use_ema': True, 'sideways_use_atr': False, 'sideways_use_adx': True, 'sideways_use_spike': False, 'sideways_rsi_required': False}.
[I 2025-08-30 19:01:47,141] Trial 293 finished with values: [-1000000000.0, 1000000000.0] and parameters: {'p_sma': 8, 'p_std': 31, 'p_atr': 9, 'p_adx': 14, 'rsi_period': 51, 'ema1': 24, 'ema2': 39, 'slip_atr_k': 0.1088044046242003, 'slip_spread_k': 0.1563528862824055, 'spread_hl_frac': 0.015768287618626725, 'bb_std_mult': 0.8921783901489055, 'rsi_os': 17, 'rsi_ob': 65, 'vol_spike': 0.2843421452917333, 'adx_thresh': 6.803274178770895, 'atr_min_pct': 0.005970885237385282, 'atr_max_pct': 0.08841364428277163, 'tp_mult': 1.8336463274947348, 'tsl_mult': 0.17911942322324004, 'strategy': 'mean_reversion', 'time_stop': 197, 'use_sma': False, 'use_atr': True, 'use_adx': False, 'use_ema': False, 'use_spike': True, 'rsi_required': False, 'edge_k': 0.12098297783860587, 'edge_cap': 0.5328267142283869, 'bull_strategy': 'breakout', 'bull_bb_std_mult': 1.6081339619616997, 'bull_rsi_os': 33, 'bull_rsi_ob': 47, 'bull_adx_thresh': 33.83811395493365, 'bull_atr_min_pct': 0.02693738112082614, 'bull_atr_max_pct': 0.12182143172775699, 'bull_tp_mult': 2.028320415755156, 'bull_tsl_mult': 0.5532953022099375, 'bull_time_stop': 272, 'bull_use_sma': False, 'bull_use_ema': True, 'bull_use_atr': False, 'bull_use_adx': False, 'bull_use_spike': False, 'bull_rsi_required': True, 'bear_strategy': 'breakout', 'bear_bb_std_mult': 2.5081651701292467, 'bear_rsi_os': 53, 'bear_rsi_ob': 57, 'bear_adx_thresh': 28.58431302414375, 'bear_atr_min_pct': 0.01569562141354415, 'bear_atr_max_pct': 0.03445603224488367, 'bear_tp_mult': 2.6973948228739415, 'bear_tsl_mult': 0.5049559979502917, 'bear_time_stop': 181, 'bear_use_sma': True, 'bear_use_ema': True, 'bear_use_atr': False, 'bear_use_adx': False, 'bear_use_spike': True, 'bear_rsi_required': True, 'sideways_strategy': 'breakout', 'sideways_bb_std_mult': 2.008687498131653, 'sideways_rsi_os': 36, 'sideways_rsi_ob': 76, 'sideways_adx_thresh': 21.18461225201961, 'sideways_atr_min_pct': 0.00309281556382289, 'sideways_atr_max_pct': 0.04963368195425029, 'sideways_tp_mult': 1.9207529482734607, 'sideways_tsl_mult': 0.9638073209821657, 'sideways_time_stop': 166, 'sideways_use_sma': False, 'sideways_use_ema': True, 'sideways_use_atr': False, 'sideways_use_adx': True, 'sideways_use_spike': False, 'sideways_rsi_required': True}.
[I 2025-08-30 19:01:47,363] Trial 294 finished with values: [-1000000000.0, 1000000000.0] and parameters: {'p_sma': 15, 'p_std': 47, 'p_atr': 16, 'p_adx': 26, 'rsi_period': 16, 'ema1': 24, 'ema2': 46, 'slip_atr_k': 0.19869743529259687, 'slip_spread_k': 0.42395027841311517, 'spread_hl_frac': 0.015292019949988864, 'bb_std_mult': 1.1133720676600924, 'rsi_os': 48, 'rsi_ob': 64, 'vol_spike': 0.2597974957149938, 'adx_thresh': 25.595143508079147, 'atr_min_pct': 0.012301990963537558, 'atr_max_pct': 0.08931997637250719, 'tp_mult': 2.3294769881399375, 'tsl_mult': 0.7771778053467487, 'strategy': 'mean_reversion', 'time_stop': 136, 'use_sma': True, 'use_atr': True, 'use_adx': True, 'use_ema': False, 'use_spike': True, 'rsi_required': False, 'edge_k': 0.1237506200231378, 'edge_cap': 0.5441501655116726, 'bull_strategy': 'breakout', 'bull_bb_std_mult': 3.0891413308058904, 'bull_rsi_os': 29, 'bull_rsi_ob': 71, 'bull_adx_thresh': 16.71778710955962, 'bull_atr_min_pct': 0.027049809495771217, 'bull_atr_max_pct': 0.11367233106628141, 'bull_tp_mult': 2.39040132055798, 'bull_tsl_mult': 0.5303400863519803, 'bull_time_stop': 39, 'bull_use_sma': False, 'bull_use_ema': True, 'bull_use_atr': False, 'bull_use_adx': False, 'bull_use_spike': False, 'bull_rsi_required': True, 'bear_strategy': 'breakout', 'bear_bb_std_mult': 3.0570348952794695, 'bear_rsi_os': 39, 'bear_rsi_ob': 90, 'bear_adx_thresh': 28.584614199610012, 'bear_atr_min_pct': 0.014906329970982938, 'bear_atr_max_pct': 0.034565802323321564, 'bear_tp_mult': 2.834273407137055, 'bear_tsl_mult': 0.001435612505200079, 'bear_time_stop': 238, 'bear_use_sma': True, 'bear_use_ema': True, 'bear_use_atr': False, 'bear_use_adx': False, 'bear_use_spike': True, 'bear_rsi_required': True, 'sideways_strategy': 'breakout', 'sideways_bb_std_mult': 2.2218255840104617, 'sideways_rsi_os': 35, 'sideways_rsi_ob': 62, 'sideways_adx_thresh': 22.962378633157613, 'sideways_atr_min_pct': 0.01977525498334468, 'sideways_atr_max_pct': 0.13760854076901108, 'sideways_tp_mult': 2.805299842018014, 'sideways_tsl_mult': 0.9992409203134309, 'sideways_time_stop': 145, 'sideways_use_sma': False, 'sideways_use_ema': True, 'sideways_use_atr': False, 'sideways_use_adx': True, 'sideways_use_spike': False, 'sideways_rsi_required': True}.
[I 2025-08-30 19:02:19,766] Trial 295 finished with values: [-0.04819135535996544, 0.04808620290909118] and parameters: {'p_sma': 15, 'p_std': 30, 'p_atr': 23, 'p_adx': 29, 'rsi_period': 12, 'ema1': 24, 'ema2': 45, 'slip_atr_k': 0.07513981094378595, 'slip_spread_k': 0.7376361487090634, 'spread_hl_frac': 0.015781870617029015, 'bb_std_mult': 2.1973746143062116, 'rsi_os': 48, 'rsi_ob': 73, 'vol_spike': 0.061442863648419735, 'adx_thresh': 9.189594086956905, 'atr_min_pct': 0.008866845200193381, 'atr_max_pct': 0.14005958803072668, 'tp_mult': 1.7806152387942609, 'tsl_mult': 0.17581612845257194, 'strategy': 'mean_reversion', 'time_stop': 139, 'use_sma': True, 'use_atr': False, 'use_adx': True, 'use_ema': False, 'use_spike': False, 'rsi_required': True, 'edge_k': 0.12953868975267396, 'edge_cap': 0.5245088756412066, 'bull_strategy': 'mean_reversion', 'bull_bb_std_mult': 1.6462694282930617, 'bull_rsi_os': 40, 'bull_rsi_ob': 46, 'bull_adx_thresh': 16.01048626642438, 'bull_atr_min_pct': 8.178167682683889e-05, 'bull_atr_max_pct': 0.01743907973895649, 'bull_tp_mult': 2.2374769234498304, 'bull_tsl_mult': 0.7206859676161257, 'bull_time_stop': 180, 'bull_use_sma': False, 'bull_use_ema': True, 'bull_use_atr': False, 'bull_use_adx': False, 'bull_use_spike': False, 'bull_rsi_required': True, 'bear_strategy': 'breakout', 'bear_bb_std_mult': 3.0813650483316657, 'bear_rsi_os': 49, 'bear_rsi_ob': 54, 'bear_adx_thresh': 17.348532971801458, 'bear_atr_min_pct': 0.01152881943916606, 'bear_atr_max_pct': 0.03901899309259811, 'bear_tp_mult': 1.054784499597638, 'bear_tsl_mult': 0.5118644688685245, 'bear_time_stop': 149, 'bear_use_sma': True, 'bear_use_ema': False, 'bear_use_atr': False, 'bear_use_adx': False, 'bear_use_spike': False, 'bear_rsi_required': True, 'sideways_strategy': 'breakout', 'sideways_bb_std_mult': 3.3227211522034343, 'sideways_rsi_os': 52, 'sideways_rsi_ob': 62, 'sideways_adx_thresh': 20.57666954024676, 'sideways_atr_min_pct': 0.0014794706761123736, 'sideways_atr_max_pct': 0.14424385916079208, 'sideways_tp_mult': 2.7985698754558883, 'sideways_tsl_mult': 0.9996779429255831, 'sideways_time_stop': 158, 'sideways_use_sma': True, 'sideways_use_ema': False, 'sideways_use_atr': True, 'sideways_use_adx': False, 'sideways_use_spike': False, 'sideways_rsi_required': True}.
[I 2025-08-30 19:02:21,012] Trial 296 finished with values: [-0.025561381448313103, 0.02546484724940941] and parameters: {'p_sma': 51, 'p_std': 31, 'p_atr': 11, 'p_adx': 22, 'rsi_period': 16, 'ema1': 24, 'ema2': 45, 'slip_atr_k': 0.07485375928431275, 'slip_spread_k': 0.1582225749595264, 'spread_hl_frac': 0.04453669073069652, 'bb_std_mult': 2.2030434756664947, 'rsi_os': 22, 'rsi_ob': 65, 'vol_spike': 0.28444782329905244, 'adx_thresh': 31.985127631723824, 'atr_min_pct': 0.023696510418697532, 'atr_max_pct': 0.1404653976389896, 'tp_mult': 1.8207240113692802, 'tsl_mult': 0.5012174718104893, 'strategy': 'breakout', 'time_stop': 92, 'use_sma': True, 'use_atr': True, 'use_adx': True, 'use_ema': False, 'use_spike': False, 'rsi_required': True, 'edge_k': 1.310649015543855, 'edge_cap': 0.5022168749682234, 'bull_strategy': 'mean_reversion', 'bull_bb_std_mult': 3.5330630537366248, 'bull_rsi_os': 29, 'bull_rsi_ob': 90, 'bull_adx_thresh': 18.140272799224157, 'bull_atr_min_pct': 0.0015839256055921683, 'bull_atr_max_pct': 0.11406514988860675, 'bull_tp_mult': 2.210170010255743, 'bull_tsl_mult': 0.5248915260769671, 'bull_time_stop': 271, 'bull_use_sma': False, 'bull_use_ema': False, 'bull_use_atr': False, 'bull_use_adx': False, 'bull_use_spike': False, 'bull_rsi_required': True, 'bear_strategy': 'breakout', 'bear_bb_std_mult': 3.044416620799708, 'bear_rsi_os': 38, 'bear_rsi_ob': 59, 'bear_adx_thresh': 17.611977231505534, 'bear_atr_min_pct': 0.012134421497489379, 'bear_atr_max_pct': 0.03914187270426193, 'bear_tp_mult': 2.7601192752818378, 'bear_tsl_mult': 0.007888889065747917, 'bear_time_stop': 122, 'bear_use_sma': True, 'bear_use_ema': False, 'bear_use_atr': False, 'bear_use_adx': True, 'bear_use_spike': False, 'bear_rsi_required': True, 'sideways_strategy': 'breakout', 'sideways_bb_std_mult': 3.3329374064013355, 'sideways_rsi_os': 10, 'sideways_rsi_ob': 59, 'sideways_adx_thresh': 23.143899601096393, 'sideways_atr_min_pct': 0.0019030158188172886, 'sideways_atr_max_pct': 0.13954152229813163, 'sideways_tp_mult': 1.202243289040669, 'sideways_tsl_mult': 0.9616559229457354, 'sideways_time_stop': 158, 'sideways_use_sma': True, 'sideways_use_ema': False, 'sideways_use_atr': True, 'sideways_use_adx': False, 'sideways_use_spike': True, 'sideways_rsi_required': True}.
