[I 2025-08-30 19:13:35,444] Trial 390 finished with values: [-1000000000.0, 1000000000.0] and parameters: {'p_sma': 6, 'p_std': 34, 'p_atr': 9, 'p_adx': 29, 'rsi_period': 23, 'ema1': 26, 'ema2': 30, 'slip_atr_k': 0.0685294216086877, 'slip_spread_k': 0.54880417239866, 'spread_hl_frac': 0.019240357293314383, 'bb_std_mult': 1.5651740176546929, 'rsi_os': 47, 'rsi_ob': 82, 'vol_spike': 0.2633679399989804, 'adx_thresh': 15.441993668994932, 'atr_min_pct': 0.019295162394583867, 'atr_max_pct': 0.0426448456097887, 'tp_mult': 2.5760336075044115, 'tsl_mult': 0.8793916479091873, 'strategy': 'mean_reversion', 'time_stop': 195, 'use_sma': False, 'use_atr': False, 'use_adx': True, 'use_ema': False, 'use_spike': False, 'rsi_required': False, 'edge_k': 0.0629664021775253, 'edge_cap': 0.4936457653012379, 'bull_strategy': 'mean_reversion', 'bull_bb_std_mult': 3.5397048898214303, 'bull_rsi_os': 30, 'bull_rsi_ob': 48, 'bull_adx_thresh': 15.032529365646305, 'bull_atr_min_pct': 0.002619826049307122, 'bull_atr_max_pct': 0.11840272188757364, 'bull_tp_mult': 2.676518289661531, 'bull_tsl_mult': 0.5666058320768069, 'bull_time_stop': 178, 'bull_use_sma': True, 'bull_use_ema': True, 'bull_use_atr': True, 'bull_use_adx': True, 'bull_use_spike': False, 'bull_rsi_required': False, 'bear_strategy': 'breakout', 'bear_bb_std_mult': 3.5479687893966707, 'bear_rsi_os': 12, 'bear_rsi_ob': 53, 'bear_adx_thresh': 8.078820793788227, 'bear_atr_min_pct': 0.029126020494974744, 'bear_atr_max_pct': 0.04773676596132492, 'bear_tp_mult': 2.6850232647522234, 'bear_tsl_mult': 0.6753607412595027, 'bear_time_stop': 93, 'bear_use_sma': True, 'bear_use_ema': True, 'bear_use_atr': False, 'bear_use_adx': False, 'bear_use_spike': False, 'bear_rsi_required': True, 'sideways_strategy': 'mean_reversion', 'sideways_bb_std_mult': 2.779962468418069, 'sideways_rsi_os': 31, 'sideways_rsi_ob': 60, 'sideways_adx_thresh': 19.503336180681796, 'sideways_atr_min_pct': 0.002761396054447432, 'sideways_atr_max_pct': 0.05526787388685983, 'sideways_tp_mult': 2.747918221789841, 'sideways_tsl_mult': 0.9144466158989791, 'sideways_time_stop': 279, 'sideways_use_sma': True, 'sideways_use_ema': True, 'sideways_use_atr': True, 'sideways_use_adx': True, 'sideways_use_spike': False, 'sideways_rsi_required': True}.
[I 2025-08-30 19:13:36,162] Trial 388 finished with values: [-1000000000.0, 1000000000.0] and parameters: {'p_sma': 10, 'p_std': 33, 'p_atr': 9, 'p_adx': 19, 'rsi_period': 45, 'ema1': 26, 'ema2': 57, 'slip_atr_k': 0.20184519535410025, 'slip_spread_k': 0.1759973169159412, 'spread_hl_frac': 0.019284236694453758, 'bb_std_mult': 3.371711226297956, 'rsi_os': 47, 'rsi_ob': 57, 'vol_spike': 0.2645669494571793, 'adx_thresh': 20.044804149480708, 'atr_min_pct': 0.02185538152580429, 'atr_max_pct': 0.1474894855300815, 'tp_mult': 2.3748865799211556, 'tsl_mult': 0.4026853982963644, 'strategy': 'breakout', 'time_stop': 195, 'use_sma': True, 'use_atr': False, 'use_adx': False, 'use_ema': False, 'use_spike': False, 'rsi_required': True, 'edge_k': 0.35972821890203377, 'edge_cap': 0.49404268901747256, 'bull_strategy': 'mean_reversion', 'bull_bb_std_mult': 3.110642857487899, 'bull_rsi_os': 31, 'bull_rsi_ob': 52, 'bull_adx_thresh': 9.41569458107854, 'bull_atr_min_pct': 0.0023212867325245828, 'bull_atr_max_pct': 0.06694431844739847, 'bull_tp_mult': 2.8127227375761805, 'bull_tsl_mult': 0.4670949523748652, 'bull_time_stop': 180, 'bull_use_sma': True, 'bull_use_ema': True, 'bull_use_atr': False, 'bull_use_adx': True, 'bull_use_spike': True, 'bull_rsi_required': False, 'bear_strategy': 'breakout', 'bear_bb_std_mult': 2.326495131740534, 'bear_rsi_os': 23, 'bear_rsi_ob': 53, 'bear_adx_thresh': 17.736118021372473, 'bear_atr_min_pct': 0.01479224889941026, 'bear_atr_max_pct': 0.03731051919470582, 'bear_tp_mult': 1.847750416618128, 'bear_tsl_mult': 0.6837007855895436, 'bear_time_stop': 206, 'bear_use_sma': True, 'bear_use_ema': True, 'bear_use_atr': False, 'bear_use_adx': True, 'bear_use_spike': False, 'bear_rsi_required': True, 'sideways_strategy': 'mean_reversion', 'sideways_bb_std_mult': 3.0143238794527045, 'sideways_rsi_os': 6, 'sideways_rsi_ob': 53, 'sideways_adx_thresh': 13.017967688654968, 'sideways_atr_min_pct': 0.0027973106779351753, 'sideways_atr_max_pct': 0.07619910692149551, 'sideways_tp_mult': 1.1456666361585692, 'sideways_tsl_mult': 0.9780009017192556, 'sideways_time_stop': 166, 'sideways_use_sma': True, 'sideways_use_ema': True, 'sideways_use_atr': True, 'sideways_use_adx': True, 'sideways_use_spike': True, 'sideways_rsi_required': True}.
[I 2025-08-30 19:13:36,362] Trial 389 finished with values: [-1000000000.0, 1000000000.0] and parameters: {'p_sma': 9, 'p_std': 32, 'p_atr': 19, 'p_adx': 19, 'rsi_period': 7, 'ema1': 26, 'ema2': 28, 'slip_atr_k': 0.1609400033502947, 'slip_spread_k': 0.9303959769563954, 'spread_hl_frac': 0.03145854286414312, 'bb_std_mult': 2.250408676821353, 'rsi_os': 51, 'rsi_ob': 57, 'vol_spike': 0.2639161612618399, 'adx_thresh': 34.98782965584355, 'atr_min_pct': 0.0219230824987563, 'atr_max_pct': 0.08862823622267775, 'tp_mult': 2.349662410708127, 'tsl_mult': 0.20437811203297956, 'strategy': 'breakout', 'time_stop': 194, 'use_sma': True, 'use_atr': False, 'use_adx': True, 'use_ema': False, 'use_spike': False, 'rsi_required': True, 'edge_k': 1.842536300091271, 'edge_cap': 0.49678637450364627, 'bull_strategy': 'mean_reversion', 'bull_bb_std_mult': 3.11388278054293, 'bull_rsi_os': 34, 'bull_rsi_ob': 52, 'bull_adx_thresh': 18.013211991098984, 'bull_atr_min_pct': 0.018616061731584845, 'bull_atr_max_pct': 0.1191418789969856, 'bull_tp_mult': 2.800383578879797, 'bull_tsl_mult': 0.5189681246830374, 'bull_time_stop': 180, 'bull_use_sma': True, 'bull_use_ema': True, 'bull_use_atr': False, 'bull_use_adx': True, 'bull_use_spike': True, 'bull_rsi_required': False, 'bear_strategy': 'breakout', 'bear_bb_std_mult': 1.9739402730046607, 'bear_rsi_os': 53, 'bear_rsi_ob': 77, 'bear_adx_thresh': 31.385730169984477, 'bear_atr_min_pct': 0.012954248752299122, 'bear_atr_max_pct': 0.03787765598451477, 'bear_tp_mult': 2.690423033384557, 'bear_tsl_mult': 0.6944916498216435, 'bear_time_stop': 205, 'bear_use_sma': True, 'bear_use_ema': True, 'bear_use_atr': False, 'bear_use_adx': True, 'bear_use_spike': False, 'bear_rsi_required': True, 'sideways_strategy': 'mean_reversion', 'sideways_bb_std_mult': 3.030835776465539, 'sideways_rsi_os': 7, 'sideways_rsi_ob': 53, 'sideways_adx_thresh': 19.391719921588795, 'sideways_atr_min_pct': 0.002906605860511887, 'sideways_atr_max_pct': 0.12643863277071787, 'sideways_tp_mult': 2.737659534952229, 'sideways_tsl_mult': 0.9124323238180123, 'sideways_time_stop': 82, 'sideways_use_sma': True, 'sideways_use_ema': True, 'sideways_use_atr': True, 'sideways_use_adx': True, 'sideways_use_spike': True, 'sideways_rsi_required': True}.
[I 2025-08-30 19:13:36,377] Trial 387 finished with values: [-1000000000.0, 1000000000.0] and parameters: {'p_sma': 7, 'p_std': 37, 'p_atr': 9, 'p_adx': 19, 'rsi_period': 23, 'ema1': 14, 'ema2': 31, 'slip_atr_k': 0.1349732470778172, 'slip_spread_k': 0.8628345038780154, 'spread_hl_frac': 0.019210663809044216, 'bb_std_mult': 2.0666000454587454, 'rsi_os': 51, 'rsi_ob': 60, 'vol_spike': 0.25734419238741335, 'adx_thresh': 34.088744724465286, 'atr_min_pct': 0.021881717486244033, 'atr_max_pct': 0.09682825974506684, 'tp_mult': 2.9938039339535902, 'tsl_mult': 0.33145729884719066, 'strategy': 'breakout', 'time_stop': 242, 'use_sma': True, 'use_atr': False, 'use_adx': False, 'use_ema': True, 'use_spike': False, 'rsi_required': True, 'edge_k': 0.7597180152914911, 'edge_cap': 0.4877146337331944, 'bull_strategy': 'mean_reversion', 'bull_bb_std_mult': 3.4293711141239704, 'bull_rsi_os': 34, 'bull_rsi_ob': 45, 'bull_adx_thresh': 19.440686499846283, 'bull_atr_min_pct': 0.0018347689553660815, 'bull_atr_max_pct': 0.1186586745866332, 'bull_tp_mult': 2.8105118183328135, 'bull_tsl_mult': 0.5845549052358956, 'bull_time_stop': 126, 'bull_use_sma': True, 'bull_use_ema': True, 'bull_use_atr': False, 'bull_use_adx': True, 'bull_use_spike': True, 'bull_rsi_required': False, 'bear_strategy': 'breakout', 'bear_bb_std_mult': 1.151757596087807, 'bear_rsi_os': 12, 'bear_rsi_ob': 52, 'bear_adx_thresh': 18.04085603747157, 'bear_atr_min_pct': 0.015144383942629753, 'bear_atr_max_pct': 0.03344447621915028, 'bear_tp_mult': 2.5392062338345767, 'bear_tsl_mult': 0.7014274696210478, 'bear_time_stop': 204, 'bear_use_sma': False, 'bear_use_ema': True, 'bear_use_atr': False, 'bear_use_adx': True, 'bear_use_spike': True, 'bear_rsi_required': False, 'sideways_strategy': 'mean_reversion', 'sideways_bb_std_mult': 3.2157756897649694, 'sideways_rsi_os': 40, 'sideways_rsi_ob': 61, 'sideways_adx_thresh': 15.948406402725066, 'sideways_atr_min_pct': 0.0028690501125261786, 'sideways_atr_max_pct': 0.11871980549096368, 'sideways_tp_mult': 1.9336498322935645, 'sideways_tsl_mult': 0.9849393163244117, 'sideways_time_stop': 166, 'sideways_use_sma': True, 'sideways_use_ema': True, 'sideways_use_atr': True, 'sideways_use_adx': True, 'sideways_use_spike': True, 'sideways_rsi_required': True}.
[I 2025-08-30 19:13:37,002] Trial 392 finished with values: [-1000000000.0, 1000000000.0] and parameters: {'p_sma': 32, 'p_std': 32, 'p_atr': 19, 'p_adx': 19, 'rsi_period': 24, 'ema1': 25, 'ema2': 32, 'slip_atr_k': 0.16186992493670133, 'slip_spread_k': 0.1487380448520294, 'spread_hl_frac': 0.04067823797980353, 'bb_std_mult': 2.265180500780807, 'rsi_os': 51, 'rsi_ob': 81, 'vol_spike': 0.16933041208332159, 'adx_thresh': 34.99241039074404, 'atr_min_pct': 0.024576057727781868, 'atr_max_pct': 0.12263405571804648, 'tp_mult': 1.9721628262792015, 'tsl_mult': 0.8164982800901643, 'strategy': 'mean_reversion', 'time_stop': 300, 'use_sma': False, 'use_atr': True, 'use_adx': True, 'use_ema': False, 'use_spike': True, 'rsi_required': False, 'edge_k': 0.10975524427226724, 'edge_cap': 0.5500611077035142, 'bull_strategy': 'mean_reversion', 'bull_bb_std_mult': 3.052270268021151, 'bull_rsi_os': 33, 'bull_rsi_ob': 47, 'bull_adx_thresh': 32.02523703600861, 'bull_atr_min_pct': 0.020919764658044043, 'bull_atr_max_pct': 0.11895589731622622, 'bull_tp_mult': 1.666521830475203, 'bull_tsl_mult': 0.5228940797167243, 'bull_time_stop': 196, 'bull_use_sma': False, 'bull_use_ema': True, 'bull_use_atr': True, 'bull_use_adx': False, 'bull_use_spike': False, 'bull_rsi_required': True, 'bear_strategy': 'breakout', 'bear_bb_std_mult': 0.502644932048615, 'bear_rsi_os': 39, 'bear_rsi_ob': 73, 'bear_adx_thresh': 28.212087295356792, 'bear_atr_min_pct': 0.013505405310636829, 'bear_atr_max_pct': 0.03266814341414344, 'bear_tp_mult': 2.54703315369777, 'bear_tsl_mult': 0.7750147774640467, 'bear_time_stop': 18, 'bear_use_sma': True, 'bear_use_ema': True, 'bear_use_atr': False, 'bear_use_adx': False, 'bear_use_spike': False, 'bear_rsi_required': True, 'sideways_strategy': 'breakout', 'sideways_bb_std_mult': 1.6003950137345897, 'sideways_rsi_os': 36, 'sideways_rsi_ob': 59, 'sideways_adx_thresh': 30.391371429384613, 'sideways_atr_min_pct': 0.0021948979688684042, 'sideways_atr_max_pct': 0.1262329248807846, 'sideways_tp_mult': 1.1798969680738542, 'sideways_tsl_mult': 0.7194515938364097, 'sideways_time_stop': 253, 'sideways_use_sma': False, 'sideways_use_ema': True, 'sideways_use_atr': True, 'sideways_use_adx': False, 'sideways_use_spike': False, 'sideways_rsi_required': True}.
[I 2025-08-30 19:13:37,003] Trial 391 finished with values: [-1000000000.0, 1000000000.0] and parameters: {'p_sma': 10, 'p_std': 32, 'p_atr': 9, 'p_adx': 19, 'rsi_period': 49, 'ema1': 26, 'ema2': 28, 'slip_atr_k': 0.0035344801825713257, 'slip_spread_k': 0.15052821998667346, 'spread_hl_frac': 0.04110422777807056, 'bb_std_mult': 2.1842494310545915, 'rsi_os': 50, 'rsi_ob': 57, 'vol_spike': 0.05327205166845633, 'adx_thresh': 23.918288704206415, 'atr_min_pct': 0.021760562260636704, 'atr_max_pct': 0.053350977029779034, 'tp_mult': 2.360731179314027, 'tsl_mult': 0.8157706829457003, 'strategy': 'mean_reversion', 'time_stop': 242, 'use_sma': False, 'use_atr': True, 'use_adx': True, 'use_ema': False, 'use_spike': True, 'rsi_required': False, 'edge_k': 1.8292253873067987, 'edge_cap': 0.4897576108608465, 'bull_strategy': 'mean_reversion', 'bull_bb_std_mult': 3.108444185195999, 'bull_rsi_os': 33, 'bull_rsi_ob': 52, 'bull_adx_thresh': 30.693683960474797, 'bull_atr_min_pct': 0.020954389254866066, 'bull_atr_max_pct': 0.06665279888319872, 'bull_tp_mult': 1.6649838948744138, 'bull_tsl_mult': 0.465444507872524, 'bull_time_stop': 197, 'bull_use_sma': False, 'bull_use_ema': True, 'bull_use_atr': True, 'bull_use_adx': True, 'bull_use_spike': False, 'bull_rsi_required': True, 'bear_strategy': 'breakout', 'bear_bb_std_mult': 1.1425153536639057, 'bear_rsi_os': 23, 'bear_rsi_ob': 75, 'bear_adx_thresh': 17.92856161432017, 'bear_atr_min_pct': 0.014297195887222095, 'bear_atr_max_pct': 0.11036325795194339, 'bear_tp_mult': 2.619609246463027, 'bear_tsl_mult': 0.7798904820561471, 'bear_time_stop': 205, 'bear_use_sma': True, 'bear_use_ema': True, 'bear_use_atr': False, 'bear_use_adx': False, 'bear_use_spike': False, 'bear_rsi_required': True, 'sideways_strategy': 'mean_reversion', 'sideways_bb_std_mult': 3.0014877136066382, 'sideways_rsi_os': 7, 'sideways_rsi_ob': 72, 'sideways_adx_thresh': 21.32255141615209, 'sideways_atr_min_pct': 0.013832871426868478, 'sideways_atr_max_pct': 0.14638164746597185, 'sideways_tp_mult': 2.4857100142080606, 'sideways_tsl_mult': 0.961257865059521, 'sideways_time_stop': 166, 'sideways_use_sma': False, 'sideways_use_ema': True, 'sideways_use_atr': True, 'sideways_use_adx': False, 'sideways_use_spike': False, 'sideways_rsi_required': True}.
[I 2025-08-30 19:13:37,048] Trial 393 finished with values: [-1000000000.0, 1000000000.0] and parameters: {'p_sma': 7, 'p_std': 7, 'p_atr': 15, 'p_adx': 9, 'rsi_period': 49, 'ema1': 25, 'ema2': 36, 'slip_atr_k': 0.07228150375208946, 'slip_spread_k': 0.15125392947551505, 'spread_hl_frac': 0.041521173313745205, 'bb_std_mult': 1.8800718892447739, 'rsi_os': 50, 'rsi_ob': 82, 'vol_spike': 0.2585975141757823, 'adx_thresh': 34.13910490185551, 'atr_min_pct': 0.02466828198733318, 'atr_max_pct': 0.12189816833839456, 'tp_mult': 2.770381202605475, 'tsl_mult': 0.12229283736651297, 'strategy': 'mean_reversion', 'time_stop': 49, 'use_sma': False, 'use_atr': True, 'use_adx': True, 'use_ema': False, 'use_spike': True, 'rsi_required': False, 'edge_k': 0.1278561817114563, 'edge_cap': 0.5558430783506366, 'bull_strategy': 'mean_reversion', 'bull_bb_std_mult': 3.042832716980671, 'bull_rsi_os': 28, 'bull_rsi_ob': 46, 'bull_adx_thresh': 32.56823559370167, 'bull_atr_min_pct': 0.0032337880834188964, 'bull_atr_max_pct': 0.12949457140865805, 'bull_tp_mult': 2.6715180268073824, 'bull_tsl_mult': 0.20198677439755697, 'bull_time_stop': 200, 'bull_use_sma': False, 'bull_use_ema': True, 'bull_use_atr': True, 'bull_use_adx': False, 'bull_use_spike': False, 'bull_rsi_required': True, 'bear_strategy': 'breakout', 'bear_bb_std_mult': 2.965496083389166, 'bear_rsi_os': 40, 'bear_rsi_ob': 47, 'bear_adx_thresh': 18.093031165219326, 'bear_atr_min_pct': 0.009749421913230888, 'bear_atr_max_pct': 0.052978246348664715, 'bear_tp_mult': 2.537417680112263, 'bear_tsl_mult': 0.8151705668013882, 'bear_time_stop': 216, 'bear_use_sma': True, 'bear_use_ema': True, 'bear_use_atr': False, 'bear_use_adx': False, 'bear_use_spike': False, 'bear_rsi_required': True, 'sideways_strategy': 'breakout', 'sideways_bb_std_mult': 3.242991872281465, 'sideways_rsi_os': 44, 'sideways_rsi_ob': 68, 'sideways_adx_thresh': 21.408932897754347, 'sideways_atr_min_pct': 0.020327431058484533, 'sideways_atr_max_pct': 0.14703492760571898, 'sideways_tp_mult': 1.1934050259536282, 'sideways_tsl_mult': 0.952722146108746, 'sideways_time_stop': 106, 'sideways_use_sma': False, 'sideways_use_ema': True, 'sideways_use_atr': True, 'sideways_use_adx': False, 'sideways_use_spike': False, 'sideways_rsi_required': True}.
[I 2025-08-30 19:14:04,420] Trial 394 finished with values: [-1000000000.0, 1000000000.0] and parameters: {'p_sma': 5, 'p_std': 43, 'p_atr': 10, 'p_adx': 21, 'rsi_period': 18, 'ema1': 25, 'ema2': 34, 'slip_atr_k': 0.11497248707647227, 'slip_spread_k': 0.150066125493987, 'spread_hl_frac': 0.023740261589294737, 'bb_std_mult': 0.7235671854021761, 'rsi_os': 49, 'rsi_ob': 82, 'vol_spike': 0.05549054850355742, 'adx_thresh': 33.090304832212624, 'atr_min_pct': 0.024914720534906495, 'atr_max_pct': 0.09082979967570907, 'tp_mult': 2.257175188617025, 'tsl_mult': 0.6714766153662972, 'strategy': 'mean_reversion', 'time_stop': 174, 'use_sma': False, 'use_atr': True, 'use_adx': True, 'use_ema': False, 'use_spike': True, 'rsi_required': False, 'edge_k': 0.11145776123583134, 'edge_cap': 0.5547018462171396, 'bull_strategy': 'mean_reversion', 'bull_bb_std_mult': 3.047743231160272, 'bull_rsi_os': 28, 'bull_rsi_ob': 47, 'bull_adx_thresh': 30.956596431341048, 'bull_atr_min_pct': 0.0031992683923894186, 'bull_atr_max_pct': 0.14933323961990055, 'bull_tp_mult': 1.6748674655200435, 'bull_tsl_mult': 0.630722973249642, 'bull_time_stop': 198, 'bull_use_sma': False, 'bull_use_ema': True, 'bull_use_atr': True, 'bull_use_adx': False, 'bull_use_spike': False, 'bull_rsi_required': True, 'bear_strategy': 'breakout', 'bear_bb_std_mult': 2.9867359199815184, 'bear_rsi_os': 39, 'bear_rsi_ob': 47, 'bear_adx_thresh': 22.68148334520267, 'bear_atr_min_pct': 0.022188742118401696, 'bear_atr_max_pct': 0.03167380104390138, 'bear_tp_mult': 1.527677409111074, 'bear_tsl_mult': 0.817663165094915, 'bear_time_stop': 217, 'bear_use_sma': True, 'bear_use_ema': True, 'bear_use_atr': False, 'bear_use_adx': False, 'bear_use_spike': False, 'bear_rsi_required': True, 'sideways_strategy': 'breakout', 'sideways_bb_std_mult': 1.901948551369364, 'sideways_rsi_os': 36, 'sideways_rsi_ob': 62, 'sideways_adx_thresh': 21.568692261700686, 'sideways_atr_min_pct': 0.006529204332653008, 'sideways_atr_max_pct': 0.14668006704727624, 'sideways_tp_mult': 1.3545059035737586, 'sideways_tsl_mult': 0.07123069424871187, 'sideways_time_stop': 73, 'sideways_use_sma': False, 'sideways_use_ema': True, 'sideways_use_atr': True, 'sideways_use_adx': False, 'sideways_use_spike': False, 'sideways_rsi_required': True}.
[I 2025-08-30 19:14:10,641] Trial 395 finished with values: [-1000000000.0, 1000000000.0] and parameters: {'p_sma': 59, 'p_std': 31, 'p_atr': 10, 'p_adx': 21, 'rsi_period': 68, 'ema1': 26, 'ema2': 51, 'slip_atr_k': 0.05697417265818371, 'slip_spread_k': 0.20454369189767788, 'spread_hl_frac': 0.02621486983242185, 'bb_std_mult': 0.7153318589517452, 'rsi_os': 35, 'rsi_ob': 85, 'vol_spike': 0.2877918961780776, 'adx_thresh': 33.0874472975043, 'atr_min_pct': 0.008588448001393651, 'atr_max_pct': 0.09139379428840128, 'tp_mult': 2.4457144460430174, 'tsl_mult': 0.6772509866622407, 'strategy': 'mean_reversion', 'time_stop': 141, 'use_sma': False, 'use_atr': True, 'use_adx': True, 'use_ema': False, 'use_spike': True, 'rsi_required': False, 'edge_k': 0.11408004561170221, 'edge_cap': 0.5218779555373511, 'bull_strategy': 'mean_reversion', 'bull_bb_std_mult': 3.1727125615412146, 'bull_rsi_os': 28, 'bull_rsi_ob': 46, 'bull_adx_thresh': 17.20621104251255, 'bull_atr_min_pct': 0.0008501335228306951, 'bull_atr_max_pct': 0.03676982080998739, 'bull_tp_mult': 2.6721398095103748, 'bull_tsl_mult': 0.48621529138485553, 'bull_time_stop': 178, 'bull_use_sma': False, 'bull_use_ema': True, 'bull_use_atr': True, 'bull_use_adx': False, 'bull_use_spike': False, 'bull_rsi_required': True, 'bear_strategy': 'breakout', 'bear_bb_std_mult': 2.9538355735285244, 'bear_rsi_os': 51, 'bear_rsi_ob': 62, 'bear_adx_thresh': 6.206213104960327, 'bear_atr_min_pct': 0.02210651100493376, 'bear_atr_max_pct': 0.029504029766123728, 'bear_tp_mult': 2.648901477718916, 'bear_tsl_mult': 0.8111769628093675, 'bear_time_stop': 298, 'bear_use_sma': True, 'bear_use_ema': True, 'bear_use_atr': True, 'bear_use_adx': False, 'bear_use_spike': False, 'bear_rsi_required': True, 'sideways_strategy': 'breakout', 'sideways_bb_std_mult': 2.054110921856701, 'sideways_rsi_os': 36, 'sideways_rsi_ob': 78, 'sideways_adx_thresh': 21.699285554083275, 'sideways_atr_min_pct': 0.02062236055896355, 'sideways_atr_max_pct': 0.14540658774884033, 'sideways_tp_mult': 1.1030710327092115, 'sideways_tsl_mult': 0.9634553952675736, 'sideways_time_stop': 121, 'sideways_use_sma': False, 'sideways_use_ema': True, 'sideways_use_atr': True, 'sideways_use_adx': False, 'sideways_use_spike': False, 'sideways_rsi_required': True}.
