[I 2025-08-30 19:51:52,562] Trial 721 finished with values: [-1000000000.0, 1000000000.0] and parameters: {'p_sma': 56, 'p_std': 7, 'p_atr': 7, 'p_adx': 21, 'rsi_period': 71, 'ema1': 14, 'ema2': 31, 'slip_atr_k': 0.04050139909221799, 'slip_spread_k': 0.8738639923100768, 'spread_hl_frac': 0.02425465761322654, 'bb_std_mult': 1.1996766498558662, 'rsi_os': 40, 'rsi_ob': 58, 'vol_spike': 0.05365190633459381, 'adx_thresh': 26.740255732974333, 'atr_min_pct': 0.021571916959712785, 'atr_max_pct': 0.09938376009569352, 'tp_mult': 2.1390357887583518, 'tsl_mult': 0.8594496293996852, 'strategy': 'mean_reversion', 'time_stop': 191, 'use_sma': False, 'use_atr': True, 'use_adx': True, 'use_ema': False, 'use_spike': True, 'rsi_required': False, 'edge_k': 0.010858716627580672, 'edge_cap': 0.5008116289802683, 'bull_strategy': 'mean_reversion', 'bull_bb_std_mult': 2.192338486346261, 'bull_rsi_os': 34, 'bull_rsi_ob': 47, 'bull_adx_thresh': 7.060399038935712, 'bull_atr_min_pct': 0.02989339284648416, 'bull_atr_max_pct': 0.12507249759645453, 'bull_tp_mult': 1.1676588469420333, 'bull_tsl_mult': 0.5442153178894799, 'bull_time_stop': 170, 'bull_use_sma': False, 'bull_use_ema': True, 'bull_use_atr': False, 'bull_use_adx': True, 'bull_use_spike': False, 'bull_rsi_required': True, 'bear_strategy': 'breakout', 'bear_bb_std_mult': 1.9725243659233314, 'bear_rsi_os': 29, 'bear_rsi_ob': 77, 'bear_adx_thresh': 17.25208094683026, 'bear_atr_min_pct': 0.014980791916004708, 'bear_atr_max_pct': 0.14232241680573762, 'bear_tp_mult': 1.5260861772903456, 'bear_tsl_mult': 0.2560825591857696, 'bear_time_stop': 196, 'bear_use_sma': True, 'bear_use_ema': True, 'bear_use_atr': True, 'bear_use_adx': False, 'bear_use_spike': False, 'bear_rsi_required': True, 'sideways_strategy': 'breakout', 'sideways_bb_std_mult': 2.3934773849144118, 'sideways_rsi_os': 37, 'sideways_rsi_ob': 91, 'sideways_adx_thresh': 14.857740404400513, 'sideways_atr_min_pct': 0.0027250792412711238, 'sideways_atr_max_pct': 0.14489652953495014, 'sideways_tp_mult': 1.1824812205495026, 'sideways_tsl_mult': 0.7069409406720678, 'sideways_time_stop': 254, 'sideways_use_sma': False, 'sideways_use_ema': False, 'sideways_use_atr': True, 'sideways_use_adx': False, 'sideways_use_spike': False, 'sideways_rsi_required': False}.
[I 2025-08-30 19:51:52,849] Trial 719 finished with values: [-1000000000.0, 1000000000.0] and parameters: {'p_sma': 56, 'p_std': 41, 'p_atr': 9, 'p_adx': 20, 'rsi_period': 29, 'ema1': 14, 'ema2': 26, 'slip_atr_k': 0.13099306347567413, 'slip_spread_k': 0.20152857825885506, 'spread_hl_frac': 0.0264215074741272, 'bb_std_mult': 2.1209405404506896, 'rsi_os': 49, 'rsi_ob': 84, 'vol_spike': 0.2616815381695778, 'adx_thresh': 34.01378206979428, 'atr_min_pct': 0.017620580183967133, 'atr_max_pct': 0.09906590919436804, 'tp_mult': 2.166752613927596, 'tsl_mult': 0.8147167781653252, 'strategy': 'mean_reversion', 'time_stop': 187, 'use_sma': False, 'use_atr': True, 'use_adx': True, 'use_ema': False, 'use_spike': True, 'rsi_required': False, 'edge_k': 1.3743751125801107, 'edge_cap': 0.4820522912455933, 'bull_strategy': 'mean_reversion', 'bull_bb_std_mult': 2.186751413532592, 'bull_rsi_os': 34, 'bull_rsi_ob': 66, 'bull_adx_thresh': 31.747552724726983, 'bull_atr_min_pct': 0.0025965363379029417, 'bull_atr_max_pct': 0.026393468932777678, 'bull_tp_mult': 1.9901438065246169, 'bull_tsl_mult': 0.06362383800484644, 'bull_time_stop': 182, 'bull_use_sma': False, 'bull_use_ema': True, 'bull_use_atr': True, 'bull_use_adx': True, 'bull_use_spike': False, 'bull_rsi_required': True, 'bear_strategy': 'breakout', 'bear_bb_std_mult': 2.759059075920186, 'bear_rsi_os': 16, 'bear_rsi_ob': 77, 'bear_adx_thresh': 17.27615593062497, 'bear_atr_min_pct': 0.014828995355431392, 'bear_atr_max_pct': 0.1269907339898676, 'bear_tp_mult': 2.8395465475162633, 'bear_tsl_mult': 0.08414387255168343, 'bear_time_stop': 257, 'bear_use_sma': True, 'bear_use_ema': True, 'bear_use_atr': True, 'bear_use_adx': False, 'bear_use_spike': False, 'bear_rsi_required': True, 'sideways_strategy': 'breakout', 'sideways_bb_std_mult': 3.0991887644999094, 'sideways_rsi_os': 53, 'sideways_rsi_ob': 65, 'sideways_adx_thresh': 20.639927229709077, 'sideways_atr_min_pct': 0.026982586710304197, 'sideways_atr_max_pct': 0.1406989294381368, 'sideways_tp_mult': 1.1719602958507682, 'sideways_tsl_mult': 0.019717237804284915, 'sideways_time_stop': 149, 'sideways_use_sma': False, 'sideways_use_ema': True, 'sideways_use_atr': True, 'sideways_use_adx': False, 'sideways_use_spike': False, 'sideways_rsi_required': True}.
[I 2025-08-30 19:51:53,268] Trial 720 finished with values: [-1000000000.0, 1000000000.0] and parameters: {'p_sma': 5, 'p_std': 32, 'p_atr': 9, 'p_adx': 21, 'rsi_period': 29, 'ema1': 14, 'ema2': 32, 'slip_atr_k': 0.07365337936188907, 'slip_spread_k': 0.64791780094932, 'spread_hl_frac': 0.026649496549306307, 'bb_std_mult': 2.2990245435763716, 'rsi_os': 49, 'rsi_ob': 58, 'vol_spike': 0.26339468261450005, 'adx_thresh': 34.014793465886136, 'atr_min_pct': 0.026354099786324935, 'atr_max_pct': 0.09804524100483644, 'tp_mult': 2.141824148656993, 'tsl_mult': 0.3182747831961799, 'strategy': 'mean_reversion', 'time_stop': 189, 'use_sma': False, 'use_atr': True, 'use_adx': True, 'use_ema': False, 'use_spike': True, 'rsi_required': False, 'edge_k': 1.5665875405189889, 'edge_cap': 0.8577329642936651, 'bull_strategy': 'mean_reversion', 'bull_bb_std_mult': 3.356503291733793, 'bull_rsi_os': 34, 'bull_rsi_ob': 47, 'bull_adx_thresh': 19.349720915414753, 'bull_atr_min_pct': 0.0021556921661187297, 'bull_atr_max_pct': 0.1315412967901755, 'bull_tp_mult': 2.785804878513059, 'bull_tsl_mult': 0.5406269204786471, 'bull_time_stop': 185, 'bull_use_sma': False, 'bull_use_ema': True, 'bull_use_atr': False, 'bull_use_adx': True, 'bull_use_spike': False, 'bull_rsi_required': True, 'bear_strategy': 'breakout', 'bear_bb_std_mult': 2.9289147589913185, 'bear_rsi_os': 7, 'bear_rsi_ob': 76, 'bear_adx_thresh': 17.022889867130953, 'bear_atr_min_pct': 0.014846740297868043, 'bear_atr_max_pct': 0.010146154912773153, 'bear_tp_mult': 2.7418060709322134, 'bear_tsl_mult': 0.20212370576875743, 'bear_time_stop': 136, 'bear_use_sma': True, 'bear_use_ema': True, 'bear_use_atr': True, 'bear_use_adx': False, 'bear_use_spike': False, 'bear_rsi_required': True, 'sideways_strategy': 'breakout', 'sideways_bb_std_mult': 2.925235383712003, 'sideways_rsi_os': 49, 'sideways_rsi_ob': 60, 'sideways_adx_thresh': 20.664253704295444, 'sideways_atr_min_pct': 0.005527564134301005, 'sideways_atr_max_pct': 0.14147302972112935, 'sideways_tp_mult': 2.421880344710006, 'sideways_tsl_mult': 0.792854104827352, 'sideways_time_stop': 280, 'sideways_use_sma': False, 'sideways_use_ema': True, 'sideways_use_atr': True, 'sideways_use_adx': False, 'sideways_use_spike': False, 'sideways_rsi_required': True}.
[I 2025-08-30 19:51:55,238] Trial 723 finished with values: [-1000000000.0, 1000000000.0] and parameters: {'p_sma': 14, 'p_std': 35, 'p_atr': 23, 'p_adx': 21, 'rsi_period': 25, 'ema1': 26, 'ema2': 32, 'slip_atr_k': 0.06799852267361062, 'slip_spread_k': 0.6526297031353154, 'spread_hl_frac': 0.0188047795031205, 'bb_std_mult': 2.1093139840342214, 'rsi_os': 49, 'rsi_ob': 86, 'vol_spike': 0.10143959078029191, 'adx_thresh': 5.622608818034342, 'atr_min_pct': 0.024902237080916833, 'atr_max_pct': 0.11759418256066856, 'tp_mult': 2.532182262200124, 'tsl_mult': 0.8625588912602687, 'strategy': 'mean_reversion', 'time_stop': 89, 'use_sma': False, 'use_atr': False, 'use_adx': True, 'use_ema': True, 'use_spike': False, 'rsi_required': False, 'edge_k': 1.5095056130060729, 'edge_cap': 0.8642795212764647, 'bull_strategy': 'mean_reversion', 'bull_bb_std_mult': 3.071053536789197, 'bull_rsi_os': 7, 'bull_rsi_ob': 47, 'bull_adx_thresh': 18.835838260270865, 'bull_atr_min_pct': 0.012432986254210188, 'bull_atr_max_pct': 0.11942666731053916, 'bull_tp_mult': 1.0119905970482526, 'bull_tsl_mult': 0.5298980462759155, 'bull_time_stop': 30, 'bull_use_sma': True, 'bull_use_ema': True, 'bull_use_atr': True, 'bull_use_adx': False, 'bull_use_spike': False, 'bull_rsi_required': True, 'bear_strategy': 'mean_reversion', 'bear_bb_std_mult': 2.56529384234318, 'bear_rsi_os': 33, 'bear_rsi_ob': 76, 'bear_adx_thresh': 16.71901506280727, 'bear_atr_min_pct': 0.0065805185265330815, 'bear_atr_max_pct': 0.13573892778180865, 'bear_tp_mult': 2.755477710065029, 'bear_tsl_mult': 0.08515477472313904, 'bear_time_stop': 196, 'bear_use_sma': True, 'bear_use_ema': True, 'bear_use_atr': True, 'bear_use_adx': False, 'bear_use_spike': False, 'bear_rsi_required': True, 'sideways_strategy': 'breakout', 'sideways_bb_std_mult': 1.4044149063740763, 'sideways_rsi_os': 53, 'sideways_rsi_ob': 65, 'sideways_adx_thresh': 27.257232434194535, 'sideways_atr_min_pct': 0.022211813003901702, 'sideways_atr_max_pct': 0.144605805434741, 'sideways_tp_mult': 2.4265499716827312, 'sideways_tsl_mult': 0.9108699475809342, 'sideways_time_stop': 157, 'sideways_use_sma': True, 'sideways_use_ema': True, 'sideways_use_atr': True, 'sideways_use_adx': False, 'sideways_use_spike': False, 'sideways_rsi_required': True}.
[I 2025-08-30 19:51:56,058] Trial 724 finished with values: [-1000000000.0, 1000000000.0] and parameters: {'p_sma': 10, 'p_std': 33, 'p_atr': 21, 'p_adx': 10, 'rsi_period': 25, 'ema1': 26, 'ema2': 32, 'slip_atr_k': 0.071267126514603, 'slip_spread_k': 0.9478293355761092, 'spread_hl_frac': 0.010018029810074864, 'bb_std_mult': 2.181658622435418, 'rsi_os': 51, 'rsi_ob': 81, 'vol_spike': 0.26205199074589025, 'adx_thresh': 33.969407828929484, 'atr_min_pct': 0.01275287017411976, 'atr_max_pct': 0.1498490110100418, 'tp_mult': 2.219736564580549, 'tsl_mult': 0.3329788310302936, 'strategy': 'mean_reversion', 'time_stop': 197, 'use_sma': False, 'use_atr': False, 'use_adx': True, 'use_ema': True, 'use_spike': False, 'rsi_required': False, 'edge_k': 1.5226734660928363, 'edge_cap': 0.7122261156185372, 'bull_strategy': 'mean_reversion', 'bull_bb_std_mult': 1.157838927987879, 'bull_rsi_os': 29, 'bull_rsi_ob': 47, 'bull_adx_thresh': 19.201198650794037, 'bull_atr_min_pct': 0.0016923246548415918, 'bull_atr_max_pct': 0.0754977259002262, 'bull_tp_mult': 2.2605195914017955, 'bull_tsl_mult': 0.5191457325929574, 'bull_time_stop': 181, 'bull_use_sma': True, 'bull_use_ema': True, 'bull_use_atr': True, 'bull_use_adx': False, 'bull_use_spike': False, 'bull_rsi_required': True, 'bear_strategy': 'mean_reversion', 'bear_bb_std_mult': 2.7572388402627412, 'bear_rsi_os': 50, 'bear_rsi_ob': 76, 'bear_adx_thresh': 16.822908753001236, 'bear_atr_min_pct': 0.014689782746140178, 'bear_atr_max_pct': 0.1355003694077282, 'bear_tp_mult': 2.7069943826539937, 'bear_tsl_mult': 0.12609864974988594, 'bear_time_stop': 240, 'bear_use_sma': True, 'bear_use_ema': True, 'bear_use_atr': False, 'bear_use_adx': False, 'bear_use_spike': False, 'bear_rsi_required': True, 'sideways_strategy': 'breakout', 'sideways_bb_std_mult': 0.6930678371238908, 'sideways_rsi_os': 39, 'sideways_rsi_ob': 65, 'sideways_adx_thresh': 19.467551095040204, 'sideways_atr_min_pct': 0.009186212292751364, 'sideways_atr_max_pct': 0.14507901297645903, 'sideways_tp_mult': 1.0382796323099333, 'sideways_tsl_mult': 0.01251754588847781, 'sideways_time_stop': 270, 'sideways_use_sma': True, 'sideways_use_ema': True, 'sideways_use_atr': False, 'sideways_use_adx': False, 'sideways_use_spike': True, 'sideways_rsi_required': True}.
[I 2025-08-30 19:51:56,071] Trial 726 finished with values: [-1000000000.0, 1000000000.0] and parameters: {'p_sma': 10, 'p_std': 35, 'p_atr': 11, 'p_adx': 20, 'rsi_period': 24, 'ema1': 26, 'ema2': 13, 'slip_atr_k': 0.06714346645910041, 'slip_spread_k': 0.5737502866736316, 'spread_hl_frac': 0.036589582277892295, 'bb_std_mult': 2.211061980794288, 'rsi_os': 51, 'rsi_ob': 82, 'vol_spike': 0.15892623687869883, 'adx_thresh': 5.612517667685344, 'atr_min_pct': 0.012739082454549785, 'atr_max_pct': 0.07143302914122593, 'tp_mult': 2.214394422969172, 'tsl_mult': 0.5116614458712854, 'strategy': 'mean_reversion', 'time_stop': 196, 'use_sma': True, 'use_atr': False, 'use_adx': False, 'use_ema': True, 'use_spike': False, 'rsi_required': True, 'edge_k': 0.20728030107741185, 'edge_cap': 0.5316397734450434, 'bull_strategy': 'mean_reversion', 'bull_bb_std_mult': 2.3751229445127913, 'bull_rsi_os': 29, 'bull_rsi_ob': 46, 'bull_adx_thresh': 18.433363035575887, 'bull_atr_min_pct': 0.0030423779153112545, 'bull_atr_max_pct': 0.07425575788048362, 'bull_tp_mult': 1.597522047099369, 'bull_tsl_mult': 0.3214927307163057, 'bull_time_stop': 134, 'bull_use_sma': True, 'bull_use_ema': False, 'bull_use_atr': True, 'bull_use_adx': False, 'bull_use_spike': True, 'bull_rsi_required': True, 'bear_strategy': 'mean_reversion', 'bear_bb_std_mult': 2.526919937682311, 'bear_rsi_os': 50, 'bear_rsi_ob': 84, 'bear_adx_thresh': 23.860842176921288, 'bear_atr_min_pct': 0.01603311433757537, 'bear_atr_max_pct': 0.028369202852815405, 'bear_tp_mult': 2.6477753400822275, 'bear_tsl_mult': 0.7936182281628179, 'bear_time_stop': 203, 'bear_use_sma': True, 'bear_use_ema': False, 'bear_use_atr': False, 'bear_use_adx': False, 'bear_use_spike': True, 'bear_rsi_required': True, 'sideways_strategy': 'mean_reversion', 'sideways_bb_std_mult': 0.7592791325290931, 'sideways_rsi_os': 38, 'sideways_rsi_ob': 63, 'sideways_adx_thresh': 19.82223134321814, 'sideways_atr_min_pct': 0.004169345641659522, 'sideways_atr_max_pct': 0.14514280372354818, 'sideways_tp_mult': 1.0137301234320284, 'sideways_tsl_mult': 0.9596836572749601, 'sideways_time_stop': 102, 'sideways_use_sma': True, 'sideways_use_ema': True, 'sideways_use_atr': False, 'sideways_use_adx': True, 'sideways_use_spike': True, 'sideways_rsi_required': True}.
[I 2025-08-30 19:52:23,340] Trial 725 finished with values: [-1000000000.0, 1000000000.0] and parameters: {'p_sma': 10, 'p_std': 45, 'p_atr': 23, 'p_adx': 21, 'rsi_period': 24, 'ema1': 26, 'ema2': 19, 'slip_atr_k': 0.05758811020091902, 'slip_spread_k': 0.9400638771423436, 'spread_hl_frac': 0.018883164047752695, 'bb_std_mult': 2.208640926776223, 'rsi_os': 34, 'rsi_ob': 59, 'vol_spike': 0.25356971206037576, 'adx_thresh': 33.88893304925665, 'atr_min_pct': 0.024952370288073553, 'atr_max_pct': 0.06485518361095889, 'tp_mult': 2.2354745229861552, 'tsl_mult': 0.8314911185666245, 'strategy': 'mean_reversion', 'time_stop': 193, 'use_sma': True, 'use_atr': False, 'use_adx': False, 'use_ema': True, 'use_spike': False, 'rsi_required': False, 'edge_k': 1.5090198138874673, 'edge_cap': 0.9291972254560104, 'bull_strategy': 'mean_reversion', 'bull_bb_std_mult': 1.1051851128159527, 'bull_rsi_os': 23, 'bull_rsi_ob': 63, 'bull_adx_thresh': 22.99786113982611, 'bull_atr_min_pct': 0.016069257218473267, 'bull_atr_max_pct': 0.07486204370280615, 'bull_tp_mult': 2.798640106898439, 'bull_tsl_mult': 0.5163424498906571, 'bull_time_stop': 60, 'bull_use_sma': True, 'bull_use_ema': True, 'bull_use_atr': True, 'bull_use_adx': False, 'bull_use_spike': False, 'bull_rsi_required': True, 'bear_strategy': 'mean_reversion', 'bear_bb_std_mult': 2.550737063540174, 'bear_rsi_os': 33, 'bear_rsi_ob': 76, 'bear_adx_thresh': 16.142538085295058, 'bear_atr_min_pct': 0.015642691984653945, 'bear_atr_max_pct': 0.02907393346297669, 'bear_tp_mult': 2.746124529775826, 'bear_tsl_mult': 0.42563789585891015, 'bear_time_stop': 204, 'bear_use_sma': True, 'bear_use_ema': False, 'bear_use_atr': False, 'bear_use_adx': False, 'bear_use_spike': False, 'bear_rsi_required': True, 'sideways_strategy': 'breakout', 'sideways_bb_std_mult': 0.7093348474019028, 'sideways_rsi_os': 32, 'sideways_rsi_ob': 59, 'sideways_adx_thresh': 19.51496768917147, 'sideways_atr_min_pct': 0.0222974809731018, 'sideways_atr_max_pct': 0.1440705506174107, 'sideways_tp_mult': 1.0138082834809239, 'sideways_tsl_mult': 0.6668552272414436, 'sideways_time_stop': 104, 'sideways_use_sma': True, 'sideways_use_ema': True, 'sideways_use_atr': False, 'sideways_use_adx': False, 'sideways_use_spike': True, 'sideways_rsi_required': True}.
[I 2025-08-30 19:52:25,775] Trial 727 finished with values: [-0.0306448679393323, 0.030774852871134656] and parameters: {'p_sma': 10, 'p_std': 30, 'p_atr': 11, 'p_adx': 20, 'rsi_period': 23, 'ema1': 26, 'ema2': 33, 'slip_atr_k': 0.05629707049032848, 'slip_spread_k': 0.14672213614871207, 'spread_hl_frac': 0.04100797510703784, 'bb_std_mult': 1.04945654218121, 'rsi_os': 44, 'rsi_ob': 81, 'vol_spike': 0.2514370788970625, 'adx_thresh': 33.24105294115739, 'atr_min_pct': 0.022935286221510483, 'atr_max_pct': 0.1499235273769841, 'tp_mult': 2.2197128559901436, 'tsl_mult': 0.994012935578624, 'strategy': 'mean_reversion', 'time_stop': 130, 'use_sma': True, 'use_atr': False, 'use_adx': False, 'use_ema': True, 'use_spike': False, 'rsi_required': True, 'edge_k': 0.6373864424187694, 'edge_cap': 0.5294446678001958, 'bull_strategy': 'breakout', 'bull_bb_std_mult': 1.1287597453825444, 'bull_rsi_os': 29, 'bull_rsi_ob': 81, 'bull_adx_thresh': 18.344126160574433, 'bull_atr_min_pct': 0.0016047972064994426, 'bull_atr_max_pct': 0.07466401368670872, 'bull_tp_mult': 2.794984003033877, 'bull_tsl_mult': 0.4427924857717106, 'bull_time_stop': 137, 'bull_use_sma': True, 'bull_use_ema': False, 'bull_use_atr': True, 'bull_use_adx': False, 'bull_use_spike': True, 'bull_rsi_required': True, 'bear_strategy': 'mean_reversion', 'bear_bb_std_mult': 3.1254466902527405, 'bear_rsi_os': 50, 'bear_rsi_ob': 60, 'bear_adx_thresh': 23.53524455884773, 'bear_atr_min_pct': 0.015638872149721855, 'bear_atr_max_pct': 0.030956889619495342, 'bear_tp_mult': 2.6481017686822583, 'bear_tsl_mult': 0.7999600681911376, 'bear_time_stop': 241, 'bear_use_sma': False, 'bear_use_ema': False, 'bear_use_atr': False, 'bear_use_adx': False, 'bear_use_spike': True, 'bear_rsi_required': True, 'sideways_strategy': 'mean_reversion', 'sideways_bb_std_mult': 3.192649388694858, 'sideways_rsi_os': 24, 'sideways_rsi_ob': 59, 'sideways_adx_thresh': 19.89208984285589, 'sideways_atr_min_pct': 0.000779064725672108, 'sideways_atr_max_pct': 0.1462331885920509, 'sideways_tp_mult': 2.1727184087014955, 'sideways_tsl_mult': 0.06734093340989333, 'sideways_time_stop': 268, 'sideways_use_sma': True, 'sideways_use_ema': True, 'sideways_use_atr': False, 'sideways_use_adx': True, 'sideways_use_spike': True, 'sideways_rsi_required': True}.
[I 2025-08-30 19:52:29,513] Trial 729 finished with values: [-0.04714475770306048, 0.04694115009717935] and parameters: {'p_sma': 7, 'p_std': 30, 'p_atr': 12, 'p_adx': 20, 'rsi_period': 21, 'ema1': 9, 'ema2': 60, 'slip_atr_k': 0.05987929944024624, 'slip_spread_k': 0.2788968529868488, 'spread_hl_frac': 0.0007372151943139324, 'bb_std_mult': 2.3950016018813436, 'rsi_os': 46, 'rsi_ob': 83, 'vol_spike': 0.2524560115412798, 'adx_thresh': 15.625677224062612, 'atr_min_pct': 0.022931605453528056, 'atr_max_pct': 0.09662753760790785, 'tp_mult': 2.299158250993864, 'tsl_mult': 0.8342856810199665, 'strategy': 'mean_reversion', 'time_stop': 103, 'use_sma': True, 'use_atr': True, 'use_adx': False, 'use_ema': False, 'use_spike': True, 'rsi_required': True, 'edge_k': 0.1592130870140825, 'edge_cap': 0.9838017213766859, 'bull_strategy': 'breakout', 'bull_bb_std_mult': 3.189380605652002, 'bull_rsi_os': 37, 'bull_rsi_ob': 45, 'bull_adx_thresh': 17.283280851969508, 'bull_atr_min_pct': 0.001502155899927971, 'bull_atr_max_pct': 0.05843117123665377, 'bull_tp_mult': 2.698839008331443, 'bull_tsl_mult': 0.6505791535668205, 'bull_time_stop': 145, 'bull_use_sma': False, 'bull_use_ema': True, 'bull_use_atr': True, 'bull_use_adx': False, 'bull_use_spike': False, 'bull_rsi_required': True, 'bear_strategy': 'breakout', 'bear_bb_std_mult': 3.0489168860316807, 'bear_rsi_os': 53, 'bear_rsi_ob': 94, 'bear_adx_thresh': 15.678575274289827, 'bear_atr_min_pct': 0.015754934307773548, 'bear_atr_max_pct': 0.017465359828289187, 'bear_tp_mult': 2.397152039642641, 'bear_tsl_mult': 0.7433954016805387, 'bear_time_stop': 9, 'bear_use_sma': False, 'bear_use_ema': False, 'bear_use_atr': False, 'bear_use_adx': False, 'bear_use_spike': False, 'bear_rsi_required': True, 'sideways_strategy': 'breakout', 'sideways_bb_std_mult': 2.7658099174227173, 'sideways_rsi_os': 37, 'sideways_rsi_ob': 57, 'sideways_adx_thresh': 21.221435472254843, 'sideways_atr_min_pct': 0.00071957885526667, 'sideways_atr_max_pct': 0.12035272138959908, 'sideways_tp_mult': 2.571450441592458, 'sideways_tsl_mult': 0.979740473617169, 'sideways_time_stop': 168, 'sideways_use_sma': False, 'sideways_use_ema': False, 'sideways_use_atr': True, 'sideways_use_adx': False, 'sideways_use_spike': False, 'sideways_rsi_required': False}.
