[I 2025-08-30 19:15:16,747] Trial 404 finished with values: [-0.015469377311859711, 0.015357236107579336] and parameters: {'p_sma': 54, 'p_std': 39, 'p_atr': 17, 'p_adx': 20, 'rsi_period': 23, 'ema1': 26, 'ema2': 40, 'slip_atr_k': 0.06744028032643086, 'slip_spread_k': 0.5896382940123106, 'spread_hl_frac': 0.02314219143995677, 'bb_std_mult': 0.9633309689195217, 'rsi_os': 8, 'rsi_ob': 70, 'vol_spike': 0.24127967640321024, 'adx_thresh': 32.49884422882532, 'atr_min_pct': 0.023584694929780402, 'atr_max_pct': 0.02884691989733982, 'tp_mult': 2.325996938072723, 'tsl_mult': 0.8030360532086142, 'strategy': 'breakout', 'time_stop': 153, 'use_sma': True, 'use_atr': True, 'use_adx': False, 'use_ema': False, 'use_spike': True, 'rsi_required': True, 'edge_k': 1.6917739785576265, 'edge_cap': 0.5258409822269168, 'bull_strategy': 'mean_reversion', 'bull_bb_std_mult': 3.25112367252695, 'bull_rsi_os': 30, 'bull_rsi_ob': 50, 'bull_adx_thresh': 17.362269444457134, 'bull_atr_min_pct': 0.0023266317913840096, 'bull_atr_max_pct': 0.06357760254846591, 'bull_tp_mult': 2.7121589736329796, 'bull_tsl_mult': 0.29204474274526954, 'bull_time_stop': 105, 'bull_use_sma': False, 'bull_use_ema': False, 'bull_use_atr': False, 'bull_use_adx': False, 'bull_use_spike': True, 'bull_rsi_required': True, 'bear_strategy': 'breakout', 'bear_bb_std_mult': 2.7984241974665682, 'bear_rsi_os': 50, 'bear_rsi_ob': 79, 'bear_adx_thresh': 27.394773439017047, 'bear_atr_min_pct': 0.014273926607802008, 'bear_atr_max_pct': 0.14711044062435655, 'bear_tp_mult': 2.746522955226869, 'bear_tsl_mult': 0.7201331652687075, 'bear_time_stop': 175, 'bear_use_sma': False, 'bear_use_ema': True, 'bear_use_atr': False, 'bear_use_adx': True, 'bear_use_spike': True, 'bear_rsi_required': False, 'sideways_strategy': 'breakout', 'sideways_bb_std_mult': 3.1552816575818894, 'sideways_rsi_os': 14, 'sideways_rsi_ob': 76, 'sideways_adx_thresh': 19.913532798127125, 'sideways_atr_min_pct': 0.0005170464281522593, 'sideways_atr_max_pct': 0.13542327529217274, 'sideways_tp_mult': 2.4022200434354657, 'sideways_tsl_mult': 0.9461059382501837, 'sideways_time_stop': 65, 'sideways_use_sma': False, 'sideways_use_ema': True, 'sideways_use_atr': True, 'sideways_use_adx': False, 'sideways_use_spike': True, 'sideways_rsi_required': True}.
[I 2025-08-30 19:15:18,429] Trial 407 finished with values: [-1000000000.0, 1000000000.0] and parameters: {'p_sma': 29, 'p_std': 60, 'p_atr': 17, 'p_adx': 13, 'rsi_period': 23, 'ema1': 26, 'ema2': 35, 'slip_atr_k': 0.017618792463213198, 'slip_spread_k': 0.2831870500594575, 'spread_hl_frac': 0.025751312521761358, 'bb_std_mult': 2.32995850154658, 'rsi_os': 48, 'rsi_ob': 51, 'vol_spike': 0.2743549639130757, 'adx_thresh': 26.86968353289114, 'atr_min_pct': 0.025421800986357837, 'atr_max_pct': 0.0853224420978378, 'tp_mult': 2.2624146162988947, 'tsl_mult': 0.014360832022464465, 'strategy': 'mean_reversion', 'time_stop': 200, 'use_sma': False, 'use_atr': False, 'use_adx': False, 'use_ema': True, 'use_spike': False, 'rsi_required': True, 'edge_k': 1.6856455592820851, 'edge_cap': 0.5202832348429669, 'bull_strategy': 'mean_reversion', 'bull_bb_std_mult': 3.396438250133031, 'bull_rsi_os': 30, 'bull_rsi_ob': 93, 'bull_adx_thresh': 20.166597900392595, 'bull_atr_min_pct': 0.002330648388899038, 'bull_atr_max_pct': 0.11613007745673756, 'bull_tp_mult': 1.149199598939593, 'bull_tsl_mult': 0.7323368906909664, 'bull_time_stop': 190, 'bull_use_sma': False, 'bull_use_ema': True, 'bull_use_atr': True, 'bull_use_adx': True, 'bull_use_spike': False, 'bull_rsi_required': False, 'bear_strategy': 'breakout', 'bear_bb_std_mult': 2.8321687768130928, 'bear_rsi_os': 50, 'bear_rsi_ob': 90, 'bear_adx_thresh': 29.213629967228567, 'bear_atr_min_pct': 0.02827685099726117, 'bear_atr_max_pct': 0.010517543620334635, 'bear_tp_mult': 1.7655473686705783, 'bear_tsl_mult': 0.8590749417347171, 'bear_time_stop': 176, 'bear_use_sma': False, 'bear_use_ema': True, 'bear_use_atr': False, 'bear_use_adx': False, 'bear_use_spike': True, 'bear_rsi_required': False, 'sideways_strategy': 'mean_reversion', 'sideways_bb_std_mult': 3.150433733392974, 'sideways_rsi_os': 32, 'sideways_rsi_ob': 59, 'sideways_adx_thresh': 26.88551016038305, 'sideways_atr_min_pct': 0.012306649091858341, 'sideways_atr_max_pct': 0.14860910347382264, 'sideways_tp_mult': 1.223449773860234, 'sideways_tsl_mult': 0.9447582296833362, 'sideways_time_stop': 65, 'sideways_use_sma': True, 'sideways_use_ema': True, 'sideways_use_atr': True, 'sideways_use_adx': False, 'sideways_use_spike': False, 'sideways_rsi_required': True}.
[I 2025-08-30 19:15:18,621] Trial 406 finished with values: [-1000000000.0, 1000000000.0] and parameters: {'p_sma': 9, 'p_std': 27, 'p_atr': 11, 'p_adx': 13, 'rsi_period': 23, 'ema1': 6, 'ema2': 40, 'slip_atr_k': 0.06660702389207511, 'slip_spread_k': 0.2727873698396497, 'spread_hl_frac': 0.021098315096193282, 'bb_std_mult': 2.486277131321188, 'rsi_os': 48, 'rsi_ob': 90, 'vol_spike': 0.2740819898440942, 'adx_thresh': 29.258224240740823, 'atr_min_pct': 0.011282287087309387, 'atr_max_pct': 0.029025468743886028, 'tp_mult': 1.3640959243159163, 'tsl_mult': 0.047215747667169516, 'strategy': 'mean_reversion', 'time_stop': 16, 'use_sma': False, 'use_atr': False, 'use_adx': False, 'use_ema': False, 'use_spike': False, 'rsi_required': True, 'edge_k': 1.6870084089182495, 'edge_cap': 0.5192251460384749, 'bull_strategy': 'mean_reversion', 'bull_bb_std_mult': 0.5701333085673319, 'bull_rsi_os': 16, 'bull_rsi_ob': 45, 'bull_adx_thresh': 22.5929433509908, 'bull_atr_min_pct': 0.009610135984692892, 'bull_atr_max_pct': 0.1162457205713022, 'bull_tp_mult': 1.317427946796765, 'bull_tsl_mult': 0.5283514795663496, 'bull_time_stop': 190, 'bull_use_sma': True, 'bull_use_ema': True, 'bull_use_atr': False, 'bull_use_adx': True, 'bull_use_spike': True, 'bull_rsi_required': False, 'bear_strategy': 'breakout', 'bear_bb_std_mult': 2.4016523511297674, 'bear_rsi_os': 48, 'bear_rsi_ob': 89, 'bear_adx_thresh': 18.852476076737947, 'bear_atr_min_pct': 0.02795324772963742, 'bear_atr_max_pct': 0.1447399794783295, 'bear_tp_mult': 2.5857183004265494, 'bear_tsl_mult': 0.7246396927685136, 'bear_time_stop': 194, 'bear_use_sma': False, 'bear_use_ema': True, 'bear_use_atr': False, 'bear_use_adx': False, 'bear_use_spike': True, 'bear_rsi_required': False, 'sideways_strategy': 'breakout', 'sideways_bb_std_mult': 3.1882490103468526, 'sideways_rsi_os': 16, 'sideways_rsi_ob': 90, 'sideways_adx_thresh': 19.961741798140697, 'sideways_atr_min_pct': 0.003328305115168264, 'sideways_atr_max_pct': 0.13603876276733762, 'sideways_tp_mult': 1.0443123578437816, 'sideways_tsl_mult': 0.9453305853302194, 'sideways_time_stop': 145, 'sideways_use_sma': True, 'sideways_use_ema': True, 'sideways_use_atr': True, 'sideways_use_adx': False, 'sideways_use_spike': False, 'sideways_rsi_required': True}.
[I 2025-08-30 19:15:19,168] Trial 408 finished with values: [-1000000000.0, 1000000000.0] and parameters: {'p_sma': 12, 'p_std': 34, 'p_atr': 11, 'p_adx': 21, 'rsi_period': 24, 'ema1': 26, 'ema2': 59, 'slip_atr_k': 0.02630868076263991, 'slip_spread_k': 0.2625414920548097, 'spread_hl_frac': 0.023178056045911315, 'bb_std_mult': 2.2842418199959145, 'rsi_os': 47, 'rsi_ob': 46, 'vol_spike': 0.2718437833194885, 'adx_thresh': 32.588299996251685, 'atr_min_pct': 0.023678756400481324, 'atr_max_pct': 0.028833355958942777, 'tp_mult': 1.7845063020334093, 'tsl_mult': 0.8029671748973175, 'strategy': 'mean_reversion', 'time_stop': 104, 'use_sma': False, 'use_atr': True, 'use_adx': False, 'use_ema': False, 'use_spike': True, 'rsi_required': False, 'edge_k': 1.6768506752461199, 'edge_cap': 0.5290354887802374, 'bull_strategy': 'mean_reversion', 'bull_bb_std_mult': 1.8640191819309408, 'bull_rsi_os': 30, 'bull_rsi_ob': 93, 'bull_adx_thresh': 27.594836834023216, 'bull_atr_min_pct': 0.009754420001099436, 'bull_atr_max_pct': 0.11630392524890938, 'bull_tp_mult': 2.708027728205967, 'bull_tsl_mult': 0.5302780717347926, 'bull_time_stop': 107, 'bull_use_sma': False, 'bull_use_ema': False, 'bull_use_atr': True, 'bull_use_adx': False, 'bull_use_spike': False, 'bull_rsi_required': True, 'bear_strategy': 'mean_reversion', 'bear_bb_std_mult': 1.526577268132776, 'bear_rsi_os': 50, 'bear_rsi_ob': 74, 'bear_adx_thresh': 18.80598269744562, 'bear_atr_min_pct': 0.013938722215191957, 'bear_atr_max_pct': 0.1450136686326311, 'bear_tp_mult': 2.5806745989443036, 'bear_tsl_mult': 0.8494236261200875, 'bear_time_stop': 99, 'bear_use_sma': True, 'bear_use_ema': True, 'bear_use_atr': False, 'bear_use_adx': False, 'bear_use_spike': False, 'bear_rsi_required': True, 'sideways_strategy': 'mean_reversion', 'sideways_bb_std_mult': 3.0675988267369427, 'sideways_rsi_os': 11, 'sideways_rsi_ob': 59, 'sideways_adx_thresh': 7.193319167926596, 'sideways_atr_min_pct': 0.01677690645015621, 'sideways_atr_max_pct': 0.13631161462333327, 'sideways_tp_mult': 1.135295925488601, 'sideways_tsl_mult': 0.9487995931972721, 'sideways_time_stop': 152, 'sideways_use_sma': False, 'sideways_use_ema': False, 'sideways_use_atr': True, 'sideways_use_adx': True, 'sideways_use_spike': False, 'sideways_rsi_required': True}.
[I 2025-08-30 19:15:48,450] Trial 409 finished with values: [-0.03302867316189573, 0.03298772830862136] and parameters: {'p_sma': 6, 'p_std': 29, 'p_atr': 7, 'p_adx': 13, 'rsi_period': 23, 'ema1': 27, 'ema2': 60, 'slip_atr_k': 0.021532667900800273, 'slip_spread_k': 0.7772586023642547, 'spread_hl_frac': 0.02951100621349103, 'bb_std_mult': 2.3186138725161602, 'rsi_os': 48, 'rsi_ob': 51, 'vol_spike': 0.2656308461920629, 'adx_thresh': 13.014210666152206, 'atr_min_pct': 0.02377775798315296, 'atr_max_pct': 0.08642376699184824, 'tp_mult': 2.264081059820675, 'tsl_mult': 0.05613237020180606, 'strategy': 'mean_reversion', 'time_stop': 198, 'use_sma': True, 'use_atr': True, 'use_adx': True, 'use_ema': False, 'use_spike': True, 'rsi_required': False, 'edge_k': 0.4658727265902931, 'edge_cap': 0.5297617140162931, 'bull_strategy': 'mean_reversion', 'bull_bb_std_mult': 2.869295477278632, 'bull_rsi_os': 52, 'bull_rsi_ob': 45, 'bull_adx_thresh': 17.734393090303115, 'bull_atr_min_pct': 0.02363875822189232, 'bull_atr_max_pct': 0.11643509088725953, 'bull_tp_mult': 2.7143780634568526, 'bull_tsl_mult': 0.5254956065185983, 'bull_time_stop': 225, 'bull_use_sma': False, 'bull_use_ema': False, 'bull_use_atr': True, 'bull_use_adx': False, 'bull_use_spike': False, 'bull_rsi_required': True, 'bear_strategy': 'mean_reversion', 'bear_bb_std_mult': 2.878096088574295, 'bear_rsi_os': 50, 'bear_rsi_ob': 78, 'bear_adx_thresh': 18.827324075262766, 'bear_atr_min_pct': 0.010661630805108402, 'bear_atr_max_pct': 0.057509818628981704, 'bear_tp_mult': 2.607440270910117, 'bear_tsl_mult': 0.8573228054988616, 'bear_time_stop': 174, 'bear_use_sma': True, 'bear_use_ema': True, 'bear_use_atr': False, 'bear_use_adx': False, 'bear_use_spike': False, 'bear_rsi_required': True, 'sideways_strategy': 'mean_reversion', 'sideways_bb_std_mult': 3.061891563289557, 'sideways_rsi_os': 45, 'sideways_rsi_ob': 60, 'sideways_adx_thresh': 10.594693539515145, 'sideways_atr_min_pct': 0.0015095304544489288, 'sideways_atr_max_pct': 0.06844365022914148, 'sideways_tp_mult': 2.0396170506405595, 'sideways_tsl_mult': 0.9444689711143162, 'sideways_time_stop': 154, 'sideways_use_sma': False, 'sideways_use_ema': False, 'sideways_use_atr': True, 'sideways_use_adx': True, 'sideways_use_spike': False, 'sideways_rsi_required': True}.
[I 2025-08-30 19:15:49,890] Trial 410 finished with values: [-1000000000.0, 1000000000.0] and parameters: {'p_sma': 9, 'p_std': 29, 'p_atr': 7, 'p_adx': 24, 'rsi_period': 24, 'ema1': 27, 'ema2': 30, 'slip_atr_k': 0.07588707551635018, 'slip_spread_k': 0.7740336213314758, 'spread_hl_frac': 0.022995016510460733, 'bb_std_mult': 2.2551580074020774, 'rsi_os': 30, 'rsi_ob': 90, 'vol_spike': 0.26251397457954967, 'adx_thresh': 32.22722321655745, 'atr_min_pct': 0.023657586331060996, 'atr_max_pct': 0.060422870339325536, 'tp_mult': 2.3318882273386863, 'tsl_mult': 0.054989234884254556, 'strategy': 'mean_reversion', 'time_stop': 106, 'use_sma': True, 'use_atr': True, 'use_adx': True, 'use_ema': False, 'use_spike': True, 'rsi_required': False, 'edge_k': 0.4672802467289012, 'edge_cap': 0.47246825247602847, 'bull_strategy': 'mean_reversion', 'bull_bb_std_mult': 1.5756367974570464, 'bull_rsi_os': 52, 'bull_rsi_ob': 66, 'bull_adx_thresh': 17.655224029091087, 'bull_atr_min_pct': 0.019832239557492658, 'bull_atr_max_pct': 0.09196429656894962, 'bull_tp_mult': 2.731237022514076, 'bull_tsl_mult': 0.5149467962163535, 'bull_time_stop': 121, 'bull_use_sma': False, 'bull_use_ema': False, 'bull_use_atr': True, 'bull_use_adx': False, 'bull_use_spike': False, 'bull_rsi_required': True, 'bear_strategy': 'mean_reversion', 'bear_bb_std_mult': 3.089389089106673, 'bear_rsi_os': 25, 'bear_rsi_ob': 79, 'bear_adx_thresh': 18.758208495556364, 'bear_atr_min_pct': 0.014151226440383193, 'bear_atr_max_pct': 0.022577004636506755, 'bear_tp_mult': 2.601463202043866, 'bear_tsl_mult': 0.3152909915292165, 'bear_time_stop': 121, 'bear_use_sma': True, 'bear_use_ema': True, 'bear_use_atr': False, 'bear_use_adx': False, 'bear_use_spike': False, 'bear_rsi_required': True, 'sideways_strategy': 'breakout', 'sideways_bb_std_mult': 3.0809297007186163, 'sideways_rsi_os': 33, 'sideways_rsi_ob': 60, 'sideways_adx_thresh': 34.34614856519459, 'sideways_atr_min_pct': 0.0013837349067823833, 'sideways_atr_max_pct': 0.13657621841455692, 'sideways_tp_mult': 1.129701129821799, 'sideways_tsl_mult': 0.0010203039385345836, 'sideways_time_stop': 153, 'sideways_use_sma': False, 'sideways_use_ema': False, 'sideways_use_atr': True, 'sideways_use_adx': True, 'sideways_use_spike': False, 'sideways_rsi_required': True}.
[I 2025-08-30 19:15:51,016] Trial 411 finished with values: [-1000000000.0, 1000000000.0] and parameters: {'p_sma': 12, 'p_std': 34, 'p_atr': 7, 'p_adx': 9, 'rsi_period': 65, 'ema1': 27, 'ema2': 54, 'slip_atr_k': 0.07767895168432352, 'slip_spread_k': 0.40918926726165705, 'spread_hl_frac': 0.022788823675413888, 'bb_std_mult': 2.016765811667261, 'rsi_os': 42, 'rsi_ob': 83, 'vol_spike': 0.13125910762808365, 'adx_thresh': 32.42250032163449, 'atr_min_pct': 0.023694266442123725, 'atr_max_pct': 0.10099650159455208, 'tp_mult': 2.325952780436903, 'tsl_mult': 0.809384505639514, 'strategy': 'breakout', 'time_stop': 107, 'use_sma': True, 'use_atr': True, 'use_adx': True, 'use_ema': False, 'use_spike': True, 'rsi_required': False, 'edge_k': 0.0005522895275036077, 'edge_cap': 0.7174275292248821, 'bull_strategy': 'mean_reversion', 'bull_bb_std_mult': 1.8460939626629458, 'bull_rsi_os': 50, 'bull_rsi_ob': 85, 'bull_adx_thresh': 17.850349480171793, 'bull_atr_min_pct': 0.019729070160846584, 'bull_atr_max_pct': 0.1211459675132585, 'bull_tp_mult': 2.708448334022432, 'bull_tsl_mult': 0.5123409030877, 'bull_time_stop': 226, 'bull_use_sma': False, 'bull_use_ema': False, 'bull_use_atr': True, 'bull_use_adx': False, 'bull_use_spike': False, 'bull_rsi_required': True, 'bear_strategy': 'mean_reversion', 'bear_bb_std_mult': 2.881781571610821, 'bear_rsi_os': 54, 'bear_rsi_ob': 79, 'bear_adx_thresh': 18.392123351119192, 'bear_atr_min_pct': 0.014323790036587713, 'bear_atr_max_pct': 0.05647336290380493, 'bear_tp_mult': 2.698240920662614, 'bear_tsl_mult': 0.6597433476169833, 'bear_time_stop': 285, 'bear_use_sma': True, 'bear_use_ema': True, 'bear_use_atr': False, 'bear_use_adx': True, 'bear_use_spike': False, 'bear_rsi_required': True, 'sideways_strategy': 'mean_reversion', 'sideways_bb_std_mult': 3.0748435784696655, 'sideways_rsi_os': 28, 'sideways_rsi_ob': 76, 'sideways_adx_thresh': 7.120119906060577, 'sideways_atr_min_pct': 0.0015890509817586336, 'sideways_atr_max_pct': 0.1408475153839025, 'sideways_tp_mult': 1.1330074542964053, 'sideways_tsl_mult': 0.9815537703520786, 'sideways_time_stop': 155, 'sideways_use_sma': False, 'sideways_use_ema': False, 'sideways_use_atr': False, 'sideways_use_adx': True, 'sideways_use_spike': True, 'sideways_rsi_required': True}.
[I 2025-08-30 19:15:52,317] Trial 412 finished with values: [-0.016346358479545575, 0.016420716368838923] and parameters: {'p_sma': 6, 'p_std': 29, 'p_atr': 7, 'p_adx': 28, 'rsi_period': 14, 'ema1': 27, 'ema2': 30, 'slip_atr_k': 0.07755362954459769, 'slip_spread_k': 0.7909604672642134, 'spread_hl_frac': 0.01308857796935842, 'bb_std_mult': 2.0101886046392203, 'rsi_os': 30, 'rsi_ob': 83, 'vol_spike': 0.2630009858274267, 'adx_thresh': 31.04804746696056, 'atr_min_pct': 0.024387246125053927, 'atr_max_pct': 0.06097763764851563, 'tp_mult': 1.719588391870776, 'tsl_mult': 0.9365999274596826, 'strategy': 'breakout', 'time_stop': 272, 'use_sma': True, 'use_atr': True, 'use_adx': True, 'use_ema': False, 'use_spike': True, 'rsi_required': False, 'edge_k': 0.9119155679491622, 'edge_cap': 0.7223895759420976, 'bull_strategy': 'mean_reversion', 'bull_bb_std_mult': 3.290218075407589, 'bull_rsi_os': 23, 'bull_rsi_ob': 82, 'bull_adx_thresh': 11.509291443091602, 'bull_atr_min_pct': 0.0001168978747501275, 'bull_atr_max_pct': 0.08737341290200987, 'bull_tp_mult': 2.831732017632545, 'bull_tsl_mult': 0.5159923942858771, 'bull_time_stop': 225, 'bull_use_sma': False, 'bull_use_ema': False, 'bull_use_atr': True, 'bull_use_adx': False, 'bull_use_spike': False, 'bull_rsi_required': True, 'bear_strategy': 'mean_reversion', 'bear_bb_std_mult': 2.874324275792668, 'bear_rsi_os': 52, 'bear_rsi_ob': 87, 'bear_adx_thresh': 12.69489774091764, 'bear_atr_min_pct': 0.015863025862012024, 'bear_atr_max_pct': 0.13416789490933106, 'bear_tp_mult': 2.7023548959495027, 'bear_tsl_mult': 0.8875749518586383, 'bear_time_stop': 70, 'bear_use_sma': True, 'bear_use_ema': True, 'bear_use_atr': True, 'bear_use_adx': True, 'bear_use_spike': False, 'bear_rsi_required': True, 'sideways_strategy': 'breakout', 'sideways_bb_std_mult': 3.224238569924535, 'sideways_rsi_os': 27, 'sideways_rsi_ob': 69, 'sideways_adx_thresh': 31.18663442603501, 'sideways_atr_min_pct': 0.0015512738973936856, 'sideways_atr_max_pct': 0.1409975123745202, 'sideways_tp_mult': 1.1025146299424557, 'sideways_tsl_mult': 0.9985676273266335, 'sideways_time_stop': 156, 'sideways_use_sma': False, 'sideways_use_ema': False, 'sideways_use_atr': False, 'sideways_use_adx': True, 'sideways_use_spike': True, 'sideways_rsi_required': True}.
[I 2025-08-30 19:16:25,487] Trial 413 finished with values: [-1000000000.0, 1000000000.0] and parameters: {'p_sma': 8, 'p_std': 14, 'p_atr': 12, 'p_adx': 22, 'rsi_period': 21, 'ema1': 18, 'ema2': 24, 'slip_atr_k': 0.2167753278462471, 'slip_spread_k': 0.17522411613243705, 'spread_hl_frac': 0.013292454992230557, 'bb_std_mult': 2.0305091520333765, 'rsi_os': 18, 'rsi_ob': 83, 'vol_spike': 0.25971773102961143, 'adx_thresh': 23.275887009322194, 'atr_min_pct': 0.02435324898100614, 'atr_max_pct': 0.061053449710903575, 'tp_mult': 2.700527074447962, 'tsl_mult': 0.6333731722703855, 'strategy': 'breakout', 'time_stop': 155, 'use_sma': True, 'use_atr': True, 'use_adx': True, 'use_ema': False, 'use_spike': True, 'rsi_required': False, 'edge_k': 0.6934901381313778, 'edge_cap': 0.05673360292455165, 'bull_strategy': 'mean_reversion', 'bull_bb_std_mult': 3.271955216606861, 'bull_rsi_os': 45, 'bull_rsi_ob': 47, 'bull_adx_thresh': 17.074545021683456, 'bull_atr_min_pct': 0.019800735905667662, 'bull_atr_max_pct': 0.1274833158183485, 'bull_tp_mult': 2.8132996439347444, 'bull_tsl_mult': 0.7048759637988513, 'bull_time_stop': 173, 'bull_use_sma': False, 'bull_use_ema': True, 'bull_use_atr': True, 'bull_use_adx': False, 'bull_use_spike': False, 'bull_rsi_required': True, 'bear_strategy': 'breakout', 'bear_bb_std_mult': 2.895286980559869, 'bear_rsi_os': 52, 'bear_rsi_ob': 57, 'bear_adx_thresh': 17.74325958900182, 'bear_atr_min_pct': 0.015404271658488558, 'bear_atr_max_pct': 0.03437467856636118, 'bear_tp_mult': 2.690297705199776, 'bear_tsl_mult': 0.6338015259511286, 'bear_time_stop': 73, 'bear_use_sma': True, 'bear_use_ema': True, 'bear_use_atr': True, 'bear_use_adx': True, 'bear_use_spike': False, 'bear_rsi_required': True, 'sideways_strategy': 'breakout', 'sideways_bb_std_mult': 3.2488593869002176, 'sideways_rsi_os': 28, 'sideways_rsi_ob': 65, 'sideways_adx_thresh': 34.614003840037284, 'sideways_atr_min_pct': 0.021762603214068685, 'sideways_atr_max_pct': 0.1054010847823858, 'sideways_tp_mult': 2.5501464501422344, 'sideways_tsl_mult': 0.6412732134534841, 'sideways_time_stop': 185, 'sideways_use_sma': False, 'sideways_use_ema': True, 'sideways_use_atr': False, 'sideways_use_adx': False, 'sideways_use_spike': True, 'sideways_rsi_required': True}.
