[I 2025-08-30 20:02:55,010] Trial 819 finished with values: [-1000000000.0, 1000000000.0] and parameters: {'p_sma': 32, 'p_std': 57, 'p_atr': 9, 'p_adx': 21, 'rsi_period': 43, 'ema1': 25, 'ema2': 49, 'slip_atr_k': 0.13508168346027236, 'slip_spread_k': 0.1787524418744775, 'spread_hl_frac': 0.03606367808229504, 'bb_std_mult': 2.2432463834418463, 'rsi_os': 10, 'rsi_ob': 79, 'vol_spike': 0.2748683538258636, 'adx_thresh': 31.417667558092457, 'atr_min_pct': 0.003385507651818243, 'atr_max_pct': 0.0970874950049362, 'tp_mult': 2.2211811113512274, 'tsl_mult': 0.7782583287692726, 'strategy': 'breakout', 'time_stop': 182, 'use_sma': True, 'use_atr': False, 'use_adx': True, 'use_ema': True, 'use_spike': False, 'rsi_required': False, 'edge_k': 0.04926522534838988, 'edge_cap': 0.5785800567690627, 'bull_strategy': 'breakout', 'bull_bb_std_mult': 0.7708517974064402, 'bull_rsi_os': 34, 'bull_rsi_ob': 46, 'bull_adx_thresh': 17.175163131556324, 'bull_atr_min_pct': 0.00044000723299119347, 'bull_atr_max_pct': 0.09219883518888985, 'bull_tp_mult': 2.875924313095156, 'bull_tsl_mult': 0.8307219073795045, 'bull_time_stop': 174, 'bull_use_sma': True, 'bull_use_ema': False, 'bull_use_atr': True, 'bull_use_adx': False, 'bull_use_spike': True, 'bull_rsi_required': True, 'bear_strategy': 'mean_reversion', 'bear_bb_std_mult': 1.1059874238366088, 'bear_rsi_os': 51, 'bear_rsi_ob': 74, 'bear_adx_thresh': 17.068344838405157, 'bear_atr_min_pct': 0.017954602746417074, 'bear_atr_max_pct': 0.03006056393895272, 'bear_tp_mult': 2.5924153107153978, 'bear_tsl_mult': 0.5493311485472945, 'bear_time_stop': 207, 'bear_use_sma': False, 'bear_use_ema': False, 'bear_use_atr': False, 'bear_use_adx': True, 'bear_use_spike': True, 'bear_rsi_required': True, 'sideways_strategy': 'mean_reversion', 'sideways_bb_std_mult': 1.0660717490542564, 'sideways_rsi_os': 37, 'sideways_rsi_ob': 71, 'sideways_adx_thresh': 23.621860387749912, 'sideways_atr_min_pct': 0.0017898893169241343, 'sideways_atr_max_pct': 0.14999373547059924, 'sideways_tp_mult': 1.3711377250988628, 'sideways_tsl_mult': 0.9733571941440339, 'sideways_time_stop': 263, 'sideways_use_sma': True, 'sideways_use_ema': True, 'sideways_use_atr': True, 'sideways_use_adx': True, 'sideways_use_spike': False, 'sideways_rsi_required': True}.
[I 2025-08-30 20:02:55,622] Trial 820 finished with values: [-1000000000.0, 1000000000.0] and parameters: {'p_sma': 6, 'p_std': 30, 'p_atr': 9, 'p_adx': 21, 'rsi_period': 24, 'ema1': 17, 'ema2': 49, 'slip_atr_k': 0.20073947336122125, 'slip_spread_k': 0.1803846141158345, 'spread_hl_frac': 0.00999948962038638, 'bb_std_mult': 2.257171355017707, 'rsi_os': 10, 'rsi_ob': 79, 'vol_spike': 0.17696558154457798, 'adx_thresh': 12.717844662833777, 'atr_min_pct': 0.029456570288625823, 'atr_max_pct': 0.10029610525467855, 'tp_mult': 2.21228098277794, 'tsl_mult': 0.7667662285345247, 'strategy': 'breakout', 'time_stop': 119, 'use_sma': True, 'use_atr': False, 'use_adx': True, 'use_ema': True, 'use_spike': False, 'rsi_required': False, 'edge_k': 0.22186288038898394, 'edge_cap': 0.45509833591636156, 'bull_strategy': 'breakout', 'bull_bb_std_mult': 2.148167218050544, 'bull_rsi_os': 34, 'bull_rsi_ob': 73, 'bull_adx_thresh': 24.391822935634302, 'bull_atr_min_pct': 0.010959388369864181, 'bull_atr_max_pct': 0.08200897590720926, 'bull_tp_mult': 1.0982220735658363, 'bull_tsl_mult': 0.12799513924664518, 'bull_time_stop': 48, 'bull_use_sma': True, 'bull_use_ema': False, 'bull_use_atr': True, 'bull_use_adx': False, 'bull_use_spike': True, 'bull_rsi_required': True, 'bear_strategy': 'mean_reversion', 'bear_bb_std_mult': 1.6120031788254257, 'bear_rsi_os': 51, 'bear_rsi_ob': 50, 'bear_adx_thresh': 16.908723592330063, 'bear_atr_min_pct': 0.016959215520078348, 'bear_atr_max_pct': 0.030088869808998324, 'bear_tp_mult': 2.56116597799848, 'bear_tsl_mult': 0.7921233871586744, 'bear_time_stop': 76, 'bear_use_sma': False, 'bear_use_ema': False, 'bear_use_atr': False, 'bear_use_adx': True, 'bear_use_spike': True, 'bear_rsi_required': True, 'sideways_strategy': 'mean_reversion', 'sideways_bb_std_mult': 1.0835292112962136, 'sideways_rsi_os': 37, 'sideways_rsi_ob': 82, 'sideways_adx_thresh': 15.450215156628786, 'sideways_atr_min_pct': 0.0022852479551604566, 'sideways_atr_max_pct': 0.03526983284859703, 'sideways_tp_mult': 1.1519295118982902, 'sideways_tsl_mult': 0.9790413246648272, 'sideways_time_stop': 223, 'sideways_use_sma': True, 'sideways_use_ema': True, 'sideways_use_atr': True, 'sideways_use_adx': True, 'sideways_use_spike': False, 'sideways_rsi_required': True}.
[I 2025-08-30 20:02:56,816] Trial 821 finished with values: [-0.05128299105982659, 0.05116916929879448] and parameters: {'p_sma': 31, 'p_std': 30, 'p_atr': 9, 'p_adx': 21, 'rsi_period': 43, 'ema1': 25, 'ema2': 33, 'slip_atr_k': 0.12737307509062987, 'slip_spread_k': 0.1813765672165076, 'spread_hl_frac': 0.04180887878498464, 'bb_std_mult': 2.1169838334018505, 'rsi_os': 47, 'rsi_ob': 84, 'vol_spike': 0.2633934418238761, 'adx_thresh': 26.33442127391449, 'atr_min_pct': 0.019967745637756606, 'atr_max_pct': 0.048150111070290734, 'tp_mult': 2.5564284486024462, 'tsl_mult': 0.7824937080953726, 'strategy': 'breakout', 'time_stop': 269, 'use_sma': False, 'use_atr': True, 'use_adx': True, 'use_ema': False, 'use_spike': True, 'rsi_required': False, 'edge_k': 0.11409385930486757, 'edge_cap': 0.5650021385070927, 'bull_strategy': 'breakout', 'bull_bb_std_mult': 1.0148959965119835, 'bull_rsi_os': 33, 'bull_rsi_ob': 46, 'bull_adx_thresh': 29.71268687751064, 'bull_atr_min_pct': 0.000559469250677536, 'bull_atr_max_pct': 0.0807914996070397, 'bull_tp_mult': 1.2060620690706032, 'bull_tsl_mult': 0.9681501617548975, 'bull_time_stop': 173, 'bull_use_sma': False, 'bull_use_ema': True, 'bull_use_atr': False, 'bull_use_adx': False, 'bull_use_spike': False, 'bull_rsi_required': True, 'bear_strategy': 'breakout', 'bear_bb_std_mult': 2.7040565598285125, 'bear_rsi_os': 12, 'bear_rsi_ob': 94, 'bear_adx_thresh': 16.94897946515769, 'bear_atr_min_pct': 0.017049168238540448, 'bear_atr_max_pct': 0.03082089784089412, 'bear_tp_mult': 2.6008416372350736, 'bear_tsl_mult': 0.3718266955760494, 'bear_time_stop': 202, 'bear_use_sma': False, 'bear_use_ema': True, 'bear_use_atr': False, 'bear_use_adx': True, 'bear_use_spike': False, 'bear_rsi_required': True, 'sideways_strategy': 'breakout', 'sideways_bb_std_mult': 1.773098623087697, 'sideways_rsi_os': 41, 'sideways_rsi_ob': 93, 'sideways_adx_thresh': 20.609508726433024, 'sideways_atr_min_pct': 0.0018698621890388342, 'sideways_atr_max_pct': 0.14466148183630173, 'sideways_tp_mult': 1.1098120406565892, 'sideways_tsl_mult': 0.13085759129401203, 'sideways_time_stop': 124, 'sideways_use_sma': True, 'sideways_use_ema': True, 'sideways_use_atr': False, 'sideways_use_adx': False, 'sideways_use_spike': True, 'sideways_rsi_required': True}.
[I 2025-08-30 20:02:57,547] Trial 822 finished with values: [-0.026854412482060996, 0.026750499980447297] and parameters: {'p_sma': 26, 'p_std': 30, 'p_atr': 9, 'p_adx': 13, 'rsi_period': 48, 'ema1': 20, 'ema2': 16, 'slip_atr_k': 0.13559661829914751, 'slip_spread_k': 0.17921113493770083, 'spread_hl_frac': 0.010072875809421384, 'bb_std_mult': 2.2634141695675436, 'rsi_os': 49, 'rsi_ob': 81, 'vol_spike': 0.2607812408573936, 'adx_thresh': 33.8046108578647, 'atr_min_pct': 0.019952622587497294, 'atr_max_pct': 0.0974261346195591, 'tp_mult': 1.7919512066084815, 'tsl_mult': 0.11127569296635154, 'strategy': 'breakout', 'time_stop': 183, 'use_sma': False, 'use_atr': True, 'use_adx': True, 'use_ema': False, 'use_spike': True, 'rsi_required': False, 'edge_k': 0.11638957194822541, 'edge_cap': 0.5749520964341864, 'bull_strategy': 'breakout', 'bull_bb_std_mult': 2.1205535525476162, 'bull_rsi_os': 29, 'bull_rsi_ob': 47, 'bull_adx_thresh': 9.344180467200442, 'bull_atr_min_pct': 0.0004408433695865762, 'bull_atr_max_pct': 0.11371805621963561, 'bull_tp_mult': 1.9511670670795735, 'bull_tsl_mult': 0.5259312950437011, 'bull_time_stop': 165, 'bull_use_sma': False, 'bull_use_ema': True, 'bull_use_atr': False, 'bull_use_adx': False, 'bull_use_spike': False, 'bull_rsi_required': True, 'bear_strategy': 'breakout', 'bear_bb_std_mult': 1.1080677802764314, 'bear_rsi_os': 38, 'bear_rsi_ob': 74, 'bear_adx_thresh': 17.228725036076764, 'bear_atr_min_pct': 0.020569267924389657, 'bear_atr_max_pct': 0.0297457777050063, 'bear_tp_mult': 2.8114284172205, 'bear_tsl_mult': 0.790176010546805, 'bear_time_stop': 205, 'bear_use_sma': False, 'bear_use_ema': False, 'bear_use_atr': False, 'bear_use_adx': True, 'bear_use_spike': False, 'bear_rsi_required': True, 'sideways_strategy': 'breakout', 'sideways_bb_std_mult': 2.8995565608430844, 'sideways_rsi_os': 36, 'sideways_rsi_ob': 61, 'sideways_adx_thresh': 20.422104483907862, 'sideways_atr_min_pct': 0.023040165304183985, 'sideways_atr_max_pct': 0.03487142150034616, 'sideways_tp_mult': 1.150512601303029, 'sideways_tsl_mult': 0.14104503388084233, 'sideways_time_stop': 223, 'sideways_use_sma': True, 'sideways_use_ema': True, 'sideways_use_atr': False, 'sideways_use_adx': False, 'sideways_use_spike': True, 'sideways_rsi_required': True}.
[I 2025-08-30 20:03:31,596] Trial 826 finished with values: [-0.03897068423818051, 0.03893407116165144] and parameters: {'p_sma': 46, 'p_std': 34, 'p_atr': 11, 'p_adx': 18, 'rsi_period': 19, 'ema1': 26, 'ema2': 30, 'slip_atr_k': 0.17504276447347042, 'slip_spread_k': 0.5630668643091945, 'spread_hl_frac': 0.023811259924762553, 'bb_std_mult': 2.0595413516529537, 'rsi_os': 48, 'rsi_ob': 83, 'vol_spike': 0.2834386428481552, 'adx_thresh': 34.97689451843048, 'atr_min_pct': 0.022903329985564398, 'atr_max_pct': 0.09190266644536277, 'tp_mult': 1.43728150415062, 'tsl_mult': 0.8359393965318556, 'strategy': 'mean_reversion', 'time_stop': 201, 'use_sma': False, 'use_atr': True, 'use_adx': True, 'use_ema': False, 'use_spike': True, 'rsi_required': False, 'edge_k': 0.9490299610247034, 'edge_cap': 0.14960952433217395, 'bull_strategy': 'mean_reversion', 'bull_bb_std_mult': 3.10606366630667, 'bull_rsi_os': 26, 'bull_rsi_ob': 54, 'bull_adx_thresh': 11.538371957197924, 'bull_atr_min_pct': 0.009519367862562307, 'bull_atr_max_pct': 0.10932103445190175, 'bull_tp_mult': 1.6193668293062145, 'bull_tsl_mult': 0.7719372230201875, 'bull_time_stop': 179, 'bull_use_sma': False, 'bull_use_ema': True, 'bull_use_atr': True, 'bull_use_adx': False, 'bull_use_spike': False, 'bull_rsi_required': True, 'bear_strategy': 'breakout', 'bear_bb_std_mult': 2.490197313863088, 'bear_rsi_os': 8, 'bear_rsi_ob': 77, 'bear_adx_thresh': 32.67428906440654, 'bear_atr_min_pct': 0.01594576078856304, 'bear_atr_max_pct': 0.14403908637590693, 'bear_tp_mult': 1.3955584790303812, 'bear_tsl_mult': 0.7222828924170136, 'bear_time_stop': 261, 'bear_use_sma': True, 'bear_use_ema': True, 'bear_use_atr': True, 'bear_use_adx': False, 'bear_use_spike': False, 'bear_rsi_required': False, 'sideways_strategy': 'breakout', 'sideways_bb_std_mult': 3.066131802888783, 'sideways_rsi_os': 24, 'sideways_rsi_ob': 45, 'sideways_adx_thresh': 19.708697055230125, 'sideways_atr_min_pct': 0.001088044368123823, 'sideways_atr_max_pct': 0.06824170164035451, 'sideways_tp_mult': 2.317429375876693, 'sideways_tsl_mult': 0.9157823682927172, 'sideways_time_stop': 153, 'sideways_use_sma': False, 'sideways_use_ema': True, 'sideways_use_atr': True, 'sideways_use_adx': False, 'sideways_use_spike': False, 'sideways_rsi_required': True}.
[I 2025-08-30 20:03:32,376] Trial 824 finished with values: [-1000000000.0, 1000000000.0] and parameters: {'p_sma': 60, 'p_std': 28, 'p_atr': 11, 'p_adx': 13, 'rsi_period': 23, 'ema1': 20, 'ema2': 30, 'slip_atr_k': 0.06810505401076634, 'slip_spread_k': 0.5559842958647917, 'spread_hl_frac': 0.042047249478065304, 'bb_std_mult': 2.9515383217345468, 'rsi_os': 49, 'rsi_ob': 81, 'vol_spike': 0.261340918320682, 'adx_thresh': 33.94984893731304, 'atr_min_pct': 0.022904108630456187, 'atr_max_pct': 0.026674633063019773, 'tp_mult': 1.8145450852626934, 'tsl_mult': 0.8160592203567165, 'strategy': 'mean_reversion', 'time_stop': 203, 'use_sma': False, 'use_atr': True, 'use_adx': True, 'use_ema': False, 'use_spike': True, 'rsi_required': False, 'edge_k': 0.10446332411272474, 'edge_cap': 0.1614824270839395, 'bull_strategy': 'mean_reversion', 'bull_bb_std_mult': 2.9809172195728477, 'bull_rsi_os': 31, 'bull_rsi_ob': 47, 'bull_adx_thresh': 18.40245213016427, 'bull_atr_min_pct': 0.0012542061843035138, 'bull_atr_max_pct': 0.1129754010269251, 'bull_tp_mult': 1.2342522405379301, 'bull_tsl_mult': 0.5201602102684045, 'bull_time_stop': 166, 'bull_use_sma': False, 'bull_use_ema': True, 'bull_use_atr': False, 'bull_use_adx': False, 'bull_use_spike': False, 'bull_rsi_required': True, 'bear_strategy': 'breakout', 'bear_bb_std_mult': 2.960900073240823, 'bear_rsi_os': 26, 'bear_rsi_ob': 77, 'bear_adx_thresh': 22.86974728652868, 'bear_atr_min_pct': 0.01962660677726577, 'bear_atr_max_pct': 0.02686734786262733, 'bear_tp_mult': 1.387061238311797, 'bear_tsl_mult': 0.4739693047932424, 'bear_time_stop': 201, 'bear_use_sma': True, 'bear_use_ema': True, 'bear_use_atr': True, 'bear_use_adx': False, 'bear_use_spike': False, 'bear_rsi_required': False, 'sideways_strategy': 'breakout', 'sideways_bb_std_mult': 2.8786236181651326, 'sideways_rsi_os': 36, 'sideways_rsi_ob': 61, 'sideways_adx_thresh': 20.578457005869133, 'sideways_atr_min_pct': 0.023485771431266535, 'sideways_atr_max_pct': 0.031649196520540226, 'sideways_tp_mult': 1.10629021152016, 'sideways_tsl_mult': 0.1357564289445804, 'sideways_time_stop': 157, 'sideways_use_sma': False, 'sideways_use_ema': True, 'sideways_use_atr': False, 'sideways_use_adx': False, 'sideways_use_spike': True, 'sideways_rsi_required': True}.
[I 2025-08-30 20:03:32,708] Trial 823 finished with values: [-0.0951832706186233, 0.09517113298064099] and parameters: {'p_sma': 45, 'p_std': 30, 'p_atr': 7, 'p_adx': 26, 'rsi_period': 19, 'ema1': 20, 'ema2': 33, 'slip_atr_k': 0.19945706931783214, 'slip_spread_k': 0.5622124593920989, 'spread_hl_frac': 0.009684934752430034, 'bb_std_mult': 2.1203621145753457, 'rsi_os': 48, 'rsi_ob': 62, 'vol_spike': 0.26325377430315544, 'adx_thresh': 11.338939978551391, 'atr_min_pct': 0.022901566641881567, 'atr_max_pct': 0.048186745394942235, 'tp_mult': 2.854228335227542, 'tsl_mult': 0.2147170509215915, 'strategy': 'breakout', 'time_stop': 196, 'use_sma': False, 'use_atr': True, 'use_adx': True, 'use_ema': False, 'use_spike': True, 'rsi_required': False, 'edge_k': 0.10894032844420176, 'edge_cap': 0.5182513779706193, 'bull_strategy': 'mean_reversion', 'bull_bb_std_mult': 3.120414911312293, 'bull_rsi_os': 31, 'bull_rsi_ob': 89, 'bull_adx_thresh': 18.44862064922317, 'bull_atr_min_pct': 0.0012630501104485554, 'bull_atr_max_pct': 0.11482124476330201, 'bull_tp_mult': 1.929173182472989, 'bull_tsl_mult': 0.52155694265317, 'bull_time_stop': 165, 'bull_use_sma': False, 'bull_use_ema': True, 'bull_use_atr': False, 'bull_use_adx': False, 'bull_use_spike': False, 'bull_rsi_required': True, 'bear_strategy': 'breakout', 'bear_bb_std_mult': 3.0730973580969816, 'bear_rsi_os': 55, 'bear_rsi_ob': 94, 'bear_adx_thresh': 27.649073095497975, 'bear_atr_min_pct': 0.024336873422370835, 'bear_atr_max_pct': 0.02707541319400314, 'bear_tp_mult': 2.7967800053581566, 'bear_tsl_mult': 0.7939672910583595, 'bear_time_stop': 262, 'bear_use_sma': False, 'bear_use_ema': True, 'bear_use_atr': False, 'bear_use_adx': True, 'bear_use_spike': False, 'bear_rsi_required': True, 'sideways_strategy': 'breakout', 'sideways_bb_std_mult': 2.8823423903488203, 'sideways_rsi_os': 35, 'sideways_rsi_ob': 60, 'sideways_adx_thresh': 20.506750582375172, 'sideways_atr_min_pct': 0.0009810257784666594, 'sideways_atr_max_pct': 0.06802705717490583, 'sideways_tp_mult': 1.1541385912020123, 'sideways_tsl_mult': 0.13288141751677235, 'sideways_time_stop': 152, 'sideways_use_sma': False, 'sideways_use_ema': True, 'sideways_use_atr': False, 'sideways_use_adx': False, 'sideways_use_spike': True, 'sideways_rsi_required': True}.
[I 2025-08-30 20:03:32,820] Trial 825 finished with values: [-1000000000.0, 1000000000.0] and parameters: {'p_sma': 59, 'p_std': 34, 'p_atr': 10, 'p_adx': 20, 'rsi_period': 19, 'ema1': 26, 'ema2': 16, 'slip_atr_k': 0.020743591175739623, 'slip_spread_k': 0.12127813942305037, 'spread_hl_frac': 0.02381998133413453, 'bb_std_mult': 1.9177413498141052, 'rsi_os': 31, 'rsi_ob': 81, 'vol_spike': 0.28318208209759976, 'adx_thresh': 33.902457021059206, 'atr_min_pct': 0.02403667238130357, 'atr_max_pct': 0.09136674028860754, 'tp_mult': 2.318218559968398, 'tsl_mult': 0.8178023104413356, 'strategy': 'mean_reversion', 'time_stop': 197, 'use_sma': False, 'use_atr': True, 'use_adx': True, 'use_ema': False, 'use_spike': True, 'rsi_required': False, 'edge_k': 0.1131451124757227, 'edge_cap': 0.3765046729864414, 'bull_strategy': 'mean_reversion', 'bull_bb_std_mult': 1.9378736692422391, 'bull_rsi_os': 31, 'bull_rsi_ob': 47, 'bull_adx_thresh': 11.661084855924564, 'bull_atr_min_pct': 0.009507202362229907, 'bull_atr_max_pct': 0.11875022809406026, 'bull_tp_mult': 2.7150019389577396, 'bull_tsl_mult': 0.7791390421168627, 'bull_time_stop': 166, 'bull_use_sma': False, 'bull_use_ema': True, 'bull_use_atr': False, 'bull_use_adx': False, 'bull_use_spike': False, 'bull_rsi_required': True, 'bear_strategy': 'breakout', 'bear_bb_std_mult': 3.0647292812276508, 'bear_rsi_os': 44, 'bear_rsi_ob': 45, 'bear_adx_thresh': 27.55171861950872, 'bear_atr_min_pct': 0.015965832021834134, 'bear_atr_max_pct': 0.05868311589958728, 'bear_tp_mult': 1.5270158117920274, 'bear_tsl_mult': 0.7228039441631038, 'bear_time_stop': 262, 'bear_use_sma': True, 'bear_use_ema': True, 'bear_use_atr': True, 'bear_use_adx': False, 'bear_use_spike': False, 'bear_rsi_required': False, 'sideways_strategy': 'breakout', 'sideways_bb_std_mult': 3.2838589540384917, 'sideways_rsi_os': 36, 'sideways_rsi_ob': 61, 'sideways_adx_thresh': 20.44728242859571, 'sideways_atr_min_pct': 0.011538379386656276, 'sideways_atr_max_pct': 0.06772568845249774, 'sideways_tp_mult': 2.2746504613752956, 'sideways_tsl_mult': 0.358314827852643, 'sideways_time_stop': 40, 'sideways_use_sma': False, 'sideways_use_ema': True, 'sideways_use_atr': False, 'sideways_use_adx': False, 'sideways_use_spike': True, 'sideways_rsi_required': True}.
[I 2025-08-30 20:03:33,925] Trial 828 finished with values: [-1000000000.0, 1000000000.0] and parameters: {'p_sma': 5, 'p_std': 22, 'p_atr': 10, 'p_adx': 22, 'rsi_period': 33, 'ema1': 30, 'ema2': 36, 'slip_atr_k': 0.020441463096116413, 'slip_spread_k': 0.12434441660791301, 'spread_hl_frac': 0.017790190815072625, 'bb_std_mult': 3.4941909537685882, 'rsi_os': 50, 'rsi_ob': 85, 'vol_spike': 0.11098694292159093, 'adx_thresh': 32.9762012151677, 'atr_min_pct': 0.018577981280247596, 'atr_max_pct': 0.10971194542076461, 'tp_mult': 2.3022588055783078, 'tsl_mult': 0.9743554850745924, 'strategy': 'mean_reversion', 'time_stop': 195, 'use_sma': False, 'use_atr': True, 'use_adx': True, 'use_ema': False, 'use_spike': True, 'rsi_required': False, 'edge_k': 0.19504495069691624, 'edge_cap': 0.5231851040460035, 'bull_strategy': 'mean_reversion', 'bull_bb_std_mult': 0.621799987672605, 'bull_rsi_os': 31, 'bull_rsi_ob': 93, 'bull_adx_thresh': 18.9981105244784, 'bull_atr_min_pct': 0.0019850723867068263, 'bull_atr_max_pct': 0.11964668715421267, 'bull_tp_mult': 2.7602880078878966, 'bull_tsl_mult': 0.035132621144907616, 'bull_time_stop': 188, 'bull_use_sma': False, 'bull_use_ema': True, 'bull_use_atr': True, 'bull_use_adx': False, 'bull_use_spike': False, 'bull_rsi_required': True, 'bear_strategy': 'breakout', 'bear_bb_std_mult': 3.055429984582907, 'bear_rsi_os': 14, 'bear_rsi_ob': 79, 'bear_adx_thresh': 10.632367976833159, 'bear_atr_min_pct': 0.01530969019461857, 'bear_atr_max_pct': 0.05963821427879555, 'bear_tp_mult': 1.708390734112212, 'bear_tsl_mult': 0.41735499658140235, 'bear_time_stop': 193, 'bear_use_sma': True, 'bear_use_ema': True, 'bear_use_atr': False, 'bear_use_adx': False, 'bear_use_spike': False, 'bear_rsi_required': True, 'sideways_strategy': 'breakout', 'sideways_bb_std_mult': 3.2264689027146356, 'sideways_rsi_os': 54, 'sideways_rsi_ob': 57, 'sideways_adx_thresh': 26.691094486299832, 'sideways_atr_min_pct': 0.015506385532250007, 'sideways_atr_max_pct': 0.14303000744893388, 'sideways_tp_mult': 1.0697402978121424, 'sideways_tsl_mult': 0.9444886852831605, 'sideways_time_stop': 43, 'sideways_use_sma': False, 'sideways_use_ema': True, 'sideways_use_atr': True, 'sideways_use_adx': False, 'sideways_use_spike': False, 'sideways_rsi_required': True}.
