[I 2025-08-30 18:50:19,129] Trial 191 finished with values: [-1000000000.0, 1000000000.0] and parameters: {'p_sma': 24, 'p_std': 21, 'p_atr': 17, 'p_adx': 13, 'rsi_period': 22, 'ema1': 26, 'ema2': 32, 'slip_atr_k': 0.08502305884200566, 'slip_spread_k': 0.272777674813274, 'spread_hl_frac': 0.02773862874992165, 'bb_std_mult': 2.3253901698940385, 'rsi_os': 50, 'rsi_ob': 82, 'vol_spike': 0.03319585570655649, 'adx_thresh': 31.27341778288829, 'atr_min_pct': 0.002970188967746413, 'atr_max_pct': 0.09836116260255351, 'tp_mult': 2.3831373430366827, 'tsl_mult': 0.18891568688697963, 'strategy': 'mean_reversion', 'time_stop': 189, 'use_sma': False, 'use_atr': True, 'use_adx': False, 'use_ema': False, 'use_spike': True, 'rsi_required': False, 'edge_k': 0.45194778933892477, 'edge_cap': 0.18128963561568018, 'bull_strategy': 'mean_reversion', 'bull_bb_std_mult': 2.0234222783809557, 'bull_rsi_os': 31, 'bull_rsi_ob': 47, 'bull_adx_thresh': 14.665749362914704, 'bull_atr_min_pct': 0.028547969036039463, 'bull_atr_max_pct': 0.11223609307993786, 'bull_tp_mult': 2.9691413027475058, 'bull_tsl_mult': 0.07548733321933637, 'bull_time_stop': 165, 'bull_use_sma': False, 'bull_use_ema': True, 'bull_use_atr': True, 'bull_use_adx': True, 'bull_use_spike': False, 'bull_rsi_required': False, 'bear_strategy': 'breakout', 'bear_bb_std_mult': 2.799781545041147, 'bear_rsi_os': 54, 'bear_rsi_ob': 72, 'bear_adx_thresh': 16.38744133383924, 'bear_atr_min_pct': 0.018428789257483823, 'bear_atr_max_pct': 0.06288722797009247, 'bear_tp_mult': 2.622227860043017, 'bear_tsl_mult': 0.7190005305474836, 'bear_time_stop': 191, 'bear_use_sma': True, 'bear_use_ema': False, 'bear_use_atr': False, 'bear_use_adx': False, 'bear_use_spike': False, 'bear_rsi_required': True, 'sideways_strategy': 'breakout', 'sideways_bb_std_mult': 3.1146842726700346, 'sideways_rsi_os': 38, 'sideways_rsi_ob': 60, 'sideways_adx_thresh': 21.355101969488, 'sideways_atr_min_pct': 0.00040025351923235236, 'sideways_atr_max_pct': 0.10154944139274244, 'sideways_tp_mult': 1.1999741450100339, 'sideways_tsl_mult': 0.9997230280872114, 'sideways_time_stop': 246, 'sideways_use_sma': False, 'sideways_use_ema': True, 'sideways_use_atr': True, 'sideways_use_adx': False, 'sideways_use_spike': False, 'sideways_rsi_required': True}.
[I 2025-08-30 18:50:19,187] Trial 190 finished with values: [-1000000000.0, 1000000000.0] and parameters: {'p_sma': 7, 'p_std': 55, 'p_atr': 9, 'p_adx': 25, 'rsi_period': 21, 'ema1': 26, 'ema2': 35, 'slip_atr_k': 0.16515465281194477, 'slip_spread_k': 0.28294728104455097, 'spread_hl_frac': 0.03504386963873185, 'bb_std_mult': 2.326521395849518, 'rsi_os': 50, 'rsi_ob': 70, 'vol_spike': 0.029218238741906863, 'adx_thresh': 31.58786695773936, 'atr_min_pct': 0.011364005506749238, 'atr_max_pct': 0.09708230402563332, 'tp_mult': 1.2482088497656139, 'tsl_mult': 0.19521110723345475, 'strategy': 'mean_reversion', 'time_stop': 188, 'use_sma': False, 'use_atr': True, 'use_adx': False, 'use_ema': False, 'use_spike': True, 'rsi_required': False, 'edge_k': 0.1707852758867711, 'edge_cap': 0.2187294956977347, 'bull_strategy': 'mean_reversion', 'bull_bb_std_mult': 3.0468155246359143, 'bull_rsi_os': 41, 'bull_rsi_ob': 72, 'bull_adx_thresh': 16.1558065819213, 'bull_atr_min_pct': 0.0013890659669221592, 'bull_atr_max_pct': 0.03579000064112133, 'bull_tp_mult': 2.48158146894522, 'bull_tsl_mult': 0.8284455696144986, 'bull_time_stop': 266, 'bull_use_sma': False, 'bull_use_ema': True, 'bull_use_atr': True, 'bull_use_adx': True, 'bull_use_spike': False, 'bull_rsi_required': False, 'bear_strategy': 'breakout', 'bear_bb_std_mult': 2.946019457967492, 'bear_rsi_os': 10, 'bear_rsi_ob': 45, 'bear_adx_thresh': 16.31016657148505, 'bear_atr_min_pct': 0.029394623413802463, 'bear_atr_max_pct': 0.05821386694180368, 'bear_tp_mult': 2.21860238166068, 'bear_tsl_mult': 0.7856331050905027, 'bear_time_stop': 192, 'bear_use_sma': True, 'bear_use_ema': False, 'bear_use_atr': False, 'bear_use_adx': False, 'bear_use_spike': False, 'bear_rsi_required': True, 'sideways_strategy': 'breakout', 'sideways_bb_std_mult': 3.0941331936450895, 'sideways_rsi_os': 17, 'sideways_rsi_ob': 63, 'sideways_adx_thresh': 21.346908752062628, 'sideways_atr_min_pct': 0.00013952942882228085, 'sideways_atr_max_pct': 0.08952493765642187, 'sideways_tp_mult': 2.5998044325804024, 'sideways_tsl_mult': 0.9828860064625172, 'sideways_time_stop': 154, 'sideways_use_sma': False, 'sideways_use_ema': True, 'sideways_use_atr': True, 'sideways_use_adx': False, 'sideways_use_spike': False, 'sideways_rsi_required': True}.
[I 2025-08-30 18:50:48,806] Trial 189 finished with values: [-1000000000.0, 1000000000.0] and parameters: {'p_sma': 7, 'p_std': 28, 'p_atr': 17, 'p_adx': 12, 'rsi_period': 79, 'ema1': 26, 'ema2': 32, 'slip_atr_k': 0.16242104572482421, 'slip_spread_k': 0.2747972945472898, 'spread_hl_frac': 0.04542819380209026, 'bb_std_mult': 2.1919847886322583, 'rsi_os': 51, 'rsi_ob': 77, 'vol_spike': 0.26667026777852426, 'adx_thresh': 33.36316303534248, 'atr_min_pct': 0.02333666464214436, 'atr_max_pct': 0.09965835332620783, 'tp_mult': 2.4008802637175863, 'tsl_mult': 0.834081869420428, 'strategy': 'breakout', 'time_stop': 189, 'use_sma': False, 'use_atr': True, 'use_adx': True, 'use_ema': False, 'use_spike': True, 'rsi_required': True, 'edge_k': 1.0062047899199098, 'edge_cap': 0.18334155344928876, 'bull_strategy': 'mean_reversion', 'bull_bb_std_mult': 1.1311106141228469, 'bull_rsi_os': 43, 'bull_rsi_ob': 78, 'bull_adx_thresh': 7.771510989252459, 'bull_atr_min_pct': 0.006317359968318106, 'bull_atr_max_pct': 0.1329311661985063, 'bull_tp_mult': 2.9295055366303657, 'bull_tsl_mult': 0.994056862386034, 'bull_time_stop': 182, 'bull_use_sma': False, 'bull_use_ema': False, 'bull_use_atr': True, 'bull_use_adx': False, 'bull_use_spike': False, 'bull_rsi_required': True, 'bear_strategy': 'breakout', 'bear_bb_std_mult': 2.860933148011496, 'bear_rsi_os': 51, 'bear_rsi_ob': 75, 'bear_adx_thresh': 16.449535974855213, 'bear_atr_min_pct': 0.01568603326786654, 'bear_atr_max_pct': 0.07060015563130345, 'bear_tp_mult': 2.2839549521635076, 'bear_tsl_mult': 0.32512677915337007, 'bear_time_stop': 281, 'bear_use_sma': True, 'bear_use_ema': False, 'bear_use_atr': False, 'bear_use_adx': True, 'bear_use_spike': False, 'bear_rsi_required': True, 'sideways_strategy': 'breakout', 'sideways_bb_std_mult': 3.099548577000882, 'sideways_rsi_os': 36, 'sideways_rsi_ob': 61, 'sideways_adx_thresh': 10.169962551790686, 'sideways_atr_min_pct': 0.00018097541000641824, 'sideways_atr_max_pct': 0.09173837811134178, 'sideways_tp_mult': 2.766977187134898, 'sideways_tsl_mult': 0.7487933195837088, 'sideways_time_stop': 154, 'sideways_use_sma': False, 'sideways_use_ema': False, 'sideways_use_atr': True, 'sideways_use_adx': False, 'sideways_use_spike': False, 'sideways_rsi_required': True}.
[I 2025-08-30 18:50:50,351] Trial 192 finished with values: [-1000000000.0, 1000000000.0] and parameters: {'p_sma': 37, 'p_std': 27, 'p_atr': 17, 'p_adx': 12, 'rsi_period': 21, 'ema1': 15, 'ema2': 35, 'slip_atr_k': 0.04475035821240733, 'slip_spread_k': 0.15405036249043202, 'spread_hl_frac': 0.028545565269528877, 'bb_std_mult': 0.8038687387912711, 'rsi_os': 48, 'rsi_ob': 81, 'vol_spike': 0.2656995777847027, 'adx_thresh': 31.37061709525866, 'atr_min_pct': 0.017933391966003024, 'atr_max_pct': 0.09952284581059817, 'tp_mult': 2.4094694804815147, 'tsl_mult': 0.8271102129370791, 'strategy': 'mean_reversion', 'time_stop': 187, 'use_sma': False, 'use_atr': True, 'use_adx': False, 'use_ema': False, 'use_spike': True, 'rsi_required': False, 'edge_k': 0.005004258750588408, 'edge_cap': 0.057835184754174096, 'bull_strategy': 'mean_reversion', 'bull_bb_std_mult': 3.0309833499939876, 'bull_rsi_os': 53, 'bull_rsi_ob': 47, 'bull_adx_thresh': 14.399813912868261, 'bull_atr_min_pct': 0.00611119907198782, 'bull_atr_max_pct': 0.13552832291234665, 'bull_tp_mult': 2.982256797098983, 'bull_tsl_mult': 0.499196850553809, 'bull_time_stop': 181, 'bull_use_sma': False, 'bull_use_ema': True, 'bull_use_atr': True, 'bull_use_adx': False, 'bull_use_spike': False, 'bull_rsi_required': True, 'bear_strategy': 'breakout', 'bear_bb_std_mult': 2.8337035966152175, 'bear_rsi_os': 50, 'bear_rsi_ob': 45, 'bear_adx_thresh': 29.059610425859013, 'bear_atr_min_pct': 0.01861791171652329, 'bear_atr_max_pct': 0.057391171673587524, 'bear_tp_mult': 2.101700965589782, 'bear_tsl_mult': 0.10124397581701422, 'bear_time_stop': 80, 'bear_use_sma': True, 'bear_use_ema': False, 'bear_use_atr': False, 'bear_use_adx': False, 'bear_use_spike': False, 'bear_rsi_required': True, 'sideways_strategy': 'breakout', 'sideways_bb_std_mult': 3.1644055348269107, 'sideways_rsi_os': 26, 'sideways_rsi_ob': 60, 'sideways_adx_thresh': 10.301881774545377, 'sideways_atr_min_pct': 0.02466908801428153, 'sideways_atr_max_pct': 0.03525335566763312, 'sideways_tp_mult': 1.2007556760166729, 'sideways_tsl_mult': 0.9915938560563701, 'sideways_time_stop': 67, 'sideways_use_sma': False, 'sideways_use_ema': True, 'sideways_use_atr': True, 'sideways_use_adx': False, 'sideways_use_spike': False, 'sideways_rsi_required': True}.
[I 2025-08-30 18:50:52,433] Trial 193 finished with values: [-1000000000.0, 1000000000.0] and parameters: {'p_sma': 6, 'p_std': 28, 'p_atr': 15, 'p_adx': 25, 'rsi_period': 64, 'ema1': 26, 'ema2': 35, 'slip_atr_k': 0.1663346624111222, 'slip_spread_k': 0.16053591087671462, 'spread_hl_frac': 0.019742863938370034, 'bb_std_mult': 2.0313798710385607, 'rsi_os': 24, 'rsi_ob': 84, 'vol_spike': 0.13183336470578144, 'adx_thresh': 30.401530255772478, 'atr_min_pct': 0.022063680884654546, 'atr_max_pct': 0.10058552650650202, 'tp_mult': 2.198363271498393, 'tsl_mult': 0.8358426871717054, 'strategy': 'mean_reversion', 'time_stop': 232, 'use_sma': False, 'use_atr': False, 'use_adx': False, 'use_ema': False, 'use_spike': True, 'rsi_required': False, 'edge_k': 0.6818505745040869, 'edge_cap': 0.29939853213973, 'bull_strategy': 'mean_reversion', 'bull_bb_std_mult': 3.043509556829616, 'bull_rsi_os': 41, 'bull_rsi_ob': 48, 'bull_adx_thresh': 12.882638366862153, 'bull_atr_min_pct': 0.0062830980145335055, 'bull_atr_max_pct': 0.13494108046031467, 'bull_tp_mult': 2.4803389893391095, 'bull_tsl_mult': 0.824534724960595, 'bull_time_stop': 265, 'bull_use_sma': False, 'bull_use_ema': True, 'bull_use_atr': True, 'bull_use_adx': False, 'bull_use_spike': False, 'bull_rsi_required': True, 'bear_strategy': 'breakout', 'bear_bb_std_mult': 1.649646346409333, 'bear_rsi_os': 9, 'bear_rsi_ob': 45, 'bear_adx_thresh': 16.870148459409283, 'bear_atr_min_pct': 0.015567917547185355, 'bear_atr_max_pct': 0.049170487529121246, 'bear_tp_mult': 1.8306107662298399, 'bear_tsl_mult': 0.7765213836876239, 'bear_time_stop': 277, 'bear_use_sma': False, 'bear_use_ema': True, 'bear_use_atr': False, 'bear_use_adx': False, 'bear_use_spike': False, 'bear_rsi_required': True, 'sideways_strategy': 'breakout', 'sideways_bb_std_mult': 3.1564029736396333, 'sideways_rsi_os': 44, 'sideways_rsi_ob': 63, 'sideways_adx_thresh': 9.672743046511522, 'sideways_atr_min_pct': 0.022470096592948453, 'sideways_atr_max_pct': 0.09095615369200007, 'sideways_tp_mult': 1.040509999249075, 'sideways_tsl_mult': 0.9779145739867523, 'sideways_time_stop': 154, 'sideways_use_sma': False, 'sideways_use_ema': True, 'sideways_use_atr': True, 'sideways_use_adx': False, 'sideways_use_spike': False, 'sideways_rsi_required': True}.
[I 2025-08-30 18:50:52,643] Trial 194 finished with values: [-1000000000.0, 1000000000.0] and parameters: {'p_sma': 37, 'p_std': 28, 'p_atr': 11, 'p_adx': 20, 'rsi_period': 23, 'ema1': 16, 'ema2': 21, 'slip_atr_k': 0.04234724111294917, 'slip_spread_k': 0.16063016475402764, 'spread_hl_frac': 0.022626821880754468, 'bb_std_mult': 2.1085203083211783, 'rsi_os': 48, 'rsi_ob': 84, 'vol_spike': 0.26478527774467137, 'adx_thresh': 33.95652055790435, 'atr_min_pct': 0.02419102548293504, 'atr_max_pct': 0.10138666917407836, 'tp_mult': 2.196017478790445, 'tsl_mult': 0.8311548361212506, 'strategy': 'mean_reversion', 'time_stop': 183, 'use_sma': False, 'use_atr': False, 'use_adx': True, 'use_ema': False, 'use_spike': True, 'rsi_required': True, 'edge_k': 0.9639981535436196, 'edge_cap': 0.05727226172695965, 'bull_strategy': 'mean_reversion', 'bull_bb_std_mult': 3.0825868382626225, 'bull_rsi_os': 30, 'bull_rsi_ob': 46, 'bull_adx_thresh': 12.846341802679373, 'bull_atr_min_pct': 0.0027562529017572065, 'bull_atr_max_pct': 0.13640099451241228, 'bull_tp_mult': 2.9144415163430706, 'bull_tsl_mult': 0.5352632426091551, 'bull_time_stop': 180, 'bull_use_sma': False, 'bull_use_ema': True, 'bull_use_atr': True, 'bull_use_adx': False, 'bull_use_spike': False, 'bull_rsi_required': True, 'bear_strategy': 'breakout', 'bear_bb_std_mult': 2.829375218786587, 'bear_rsi_os': 49, 'bear_rsi_ob': 89, 'bear_adx_thresh': 30.28480743668257, 'bear_atr_min_pct': 0.01560520708191205, 'bear_atr_max_pct': 0.037059081185163587, 'bear_tp_mult': 2.078899382556042, 'bear_tsl_mult': 0.8406163608708273, 'bear_time_stop': 291, 'bear_use_sma': False, 'bear_use_ema': True, 'bear_use_atr': False, 'bear_use_adx': False, 'bear_use_spike': False, 'bear_rsi_required': True, 'sideways_strategy': 'mean_reversion', 'sideways_bb_std_mult': 3.1510716300623574, 'sideways_rsi_os': 36, 'sideways_rsi_ob': 53, 'sideways_adx_thresh': 20.084542218773496, 'sideways_atr_min_pct': 0.00199667037690617, 'sideways_atr_max_pct': 0.1421787384954717, 'sideways_tp_mult': 1.0468427972812808, 'sideways_tsl_mult': 0.9815885449495659, 'sideways_time_stop': 69, 'sideways_use_sma': False, 'sideways_use_ema': True, 'sideways_use_atr': True, 'sideways_use_adx': False, 'sideways_use_spike': False, 'sideways_rsi_required': True}.
[I 2025-08-30 18:51:24,485] Trial 195 finished with values: [-1000000000.0, 1000000000.0] and parameters: {'p_sma': 28, 'p_std': 30, 'p_atr': 11, 'p_adx': 20, 'rsi_period': 65, 'ema1': 12, 'ema2': 51, 'slip_atr_k': 0.22533448167023318, 'slip_spread_k': 0.16892032108091146, 'spread_hl_frac': 0.04680604030155939, 'bb_std_mult': 2.1235388593945563, 'rsi_os': 48, 'rsi_ob': 84, 'vol_spike': 0.2581270473154485, 'adx_thresh': 34.12742576823967, 'atr_min_pct': 0.017761804728709425, 'atr_max_pct': 0.1336144465022207, 'tp_mult': 2.3509974085309913, 'tsl_mult': 0.8643267988207392, 'strategy': 'mean_reversion', 'time_stop': 230, 'use_sma': False, 'use_atr': False, 'use_adx': True, 'use_ema': False, 'use_spike': True, 'rsi_required': False, 'edge_k': 0.6932747544191321, 'edge_cap': 0.7365198254357952, 'bull_strategy': 'mean_reversion', 'bull_bb_std_mult': 3.1839460297140536, 'bull_rsi_os': 54, 'bull_rsi_ob': 46, 'bull_adx_thresh': 10.88420594499825, 'bull_atr_min_pct': 0.017249441299864002, 'bull_atr_max_pct': 0.13548944679452368, 'bull_tp_mult': 2.535565683826771, 'bull_tsl_mult': 0.5297759497595529, 'bull_time_stop': 283, 'bull_use_sma': True, 'bull_use_ema': True, 'bull_use_atr': True, 'bull_use_adx': False, 'bull_use_spike': False, 'bull_rsi_required': True, 'bear_strategy': 'breakout', 'bear_bb_std_mult': 3.0411618740378286, 'bear_rsi_os': 14, 'bear_rsi_ob': 67, 'bear_adx_thresh': 29.16908082635552, 'bear_atr_min_pct': 0.014595383549163076, 'bear_atr_max_pct': 0.035388061364494246, 'bear_tp_mult': 2.026146365336741, 'bear_tsl_mult': 0.09794426926211264, 'bear_time_stop': 118, 'bear_use_sma': False, 'bear_use_ema': True, 'bear_use_atr': False, 'bear_use_adx': False, 'bear_use_spike': False, 'bear_rsi_required': True, 'sideways_strategy': 'mean_reversion', 'sideways_bb_std_mult': 3.1635829643724667, 'sideways_rsi_os': 35, 'sideways_rsi_ob': 53, 'sideways_adx_thresh': 20.202697846880863, 'sideways_atr_min_pct': 0.0022030206390505265, 'sideways_atr_max_pct': 0.14258657914887876, 'sideways_tp_mult': 1.0404409106535695, 'sideways_tsl_mult': 0.3793105281685092, 'sideways_time_stop': 162, 'sideways_use_sma': False, 'sideways_use_ema': True, 'sideways_use_atr': True, 'sideways_use_adx': False, 'sideways_use_spike': False, 'sideways_rsi_required': True}.
[I 2025-08-30 18:51:25,728] Trial 198 finished with values: [-1000000000.0, 1000000000.0] and parameters: {'p_sma': 52, 'p_std': 31, 'p_atr': 10, 'p_adx': 20, 'rsi_period': 23, 'ema1': 14, 'ema2': 49, 'slip_atr_k': 0.11224907375993035, 'slip_spread_k': 0.553421488687077, 'spread_hl_frac': 0.03712019814726921, 'bb_std_mult': 2.1025402192103058, 'rsi_os': 49, 'rsi_ob': 89, 'vol_spike': 0.20133472492960428, 'adx_thresh': 32.35778210404832, 'atr_min_pct': 0.024041742187139784, 'atr_max_pct': 0.08936145609608896, 'tp_mult': 2.3456052636824745, 'tsl_mult': 0.8694021190095795, 'strategy': 'mean_reversion', 'time_stop': 212, 'use_sma': True, 'use_atr': True, 'use_adx': True, 'use_ema': True, 'use_spike': True, 'rsi_required': False, 'edge_k': 0.15804878545324916, 'edge_cap': 0.626637180018479, 'bull_strategy': 'mean_reversion', 'bull_bb_std_mult': 3.2272668258248167, 'bull_rsi_os': 33, 'bull_rsi_ob': 50, 'bull_adx_thresh': 5.022583281530826, 'bull_atr_min_pct': 0.008437004345770032, 'bull_atr_max_pct': 0.10073010154516326, 'bull_tp_mult': 2.531401591281757, 'bull_tsl_mult': 0.9454743354832458, 'bull_time_stop': 169, 'bull_use_sma': True, 'bull_use_ema': True, 'bull_use_atr': True, 'bull_use_adx': False, 'bull_use_spike': False, 'bull_rsi_required': True, 'bear_strategy': 'mean_reversion', 'bear_bb_std_mult': 2.669844018363808, 'bear_rsi_os': 41, 'bear_rsi_ob': 73, 'bear_adx_thresh': 27.974331033257037, 'bear_atr_min_pct': 0.012195236203456201, 'bear_atr_max_pct': 0.03473463145826296, 'bear_tp_mult': 2.649308040237555, 'bear_tsl_mult': 0.7392430984115975, 'bear_time_stop': 225, 'bear_use_sma': True, 'bear_use_ema': True, 'bear_use_atr': False, 'bear_use_adx': False, 'bear_use_spike': False, 'bear_rsi_required': True, 'sideways_strategy': 'mean_reversion', 'sideways_bb_std_mult': 2.4503786446767246, 'sideways_rsi_os': 35, 'sideways_rsi_ob': 66, 'sideways_adx_thresh': 20.700827303123315, 'sideways_atr_min_pct': 0.0025974006809298157, 'sideways_atr_max_pct': 0.0972111983697953, 'sideways_tp_mult': 1.137600321971658, 'sideways_tsl_mult': 0.7826845833561638, 'sideways_time_stop': 144, 'sideways_use_sma': False, 'sideways_use_ema': False, 'sideways_use_atr': False, 'sideways_use_adx': True, 'sideways_use_spike': False, 'sideways_rsi_required': True}.
[I 2025-08-30 18:51:26,425] Trial 196 finished with values: [-1000000000.0, 1000000000.0] and parameters: {'p_sma': 6, 'p_std': 31, 'p_atr': 14, 'p_adx': 20, 'rsi_period': 65, 'ema1': 14, 'ema2': 58, 'slip_atr_k': 0.08023330365264152, 'slip_spread_k': 0.7120870650729929, 'spread_hl_frac': 0.030201189983415692, 'bb_std_mult': 2.0903181258294805, 'rsi_os': 48, 'rsi_ob': 83, 'vol_spike': 0.25883239883292936, 'adx_thresh': 33.9010349180865, 'atr_min_pct': 0.019219921316411075, 'atr_max_pct': 0.10310546260780015, 'tp_mult': 2.338341100665592, 'tsl_mult': 0.4795212999259575, 'strategy': 'mean_reversion', 'time_stop': 83, 'use_sma': False, 'use_atr': False, 'use_adx': True, 'use_ema': False, 'use_spike': True, 'rsi_required': False, 'edge_k': 1.833934135960202, 'edge_cap': 0.7349086495106757, 'bull_strategy': 'mean_reversion', 'bull_bb_std_mult': 3.2039618894192463, 'bull_rsi_os': 30, 'bull_rsi_ob': 57, 'bull_adx_thresh': 20.55779891421538, 'bull_atr_min_pct': 0.0024806734542671127, 'bull_atr_max_pct': 0.014019499631901453, 'bull_tp_mult': 2.561014667881931, 'bull_tsl_mult': 0.5367849785021348, 'bull_time_stop': 200, 'bull_use_sma': True, 'bull_use_ema': True, 'bull_use_atr': True, 'bull_use_adx': False, 'bull_use_spike': False, 'bull_rsi_required': True, 'bear_strategy': 'breakout', 'bear_bb_std_mult': 1.591640387600292, 'bear_rsi_os': 42, 'bear_rsi_ob': 76, 'bear_adx_thresh': 27.84089843678707, 'bear_atr_min_pct': 0.015001394746986292, 'bear_atr_max_pct': 0.03803282199499818, 'bear_tp_mult': 2.642491904433455, 'bear_tsl_mult': 0.7749588647674097, 'bear_time_stop': 225, 'bear_use_sma': False, 'bear_use_ema': True, 'bear_use_atr': False, 'bear_use_adx': False, 'bear_use_spike': False, 'bear_rsi_required': True, 'sideways_strategy': 'mean_reversion', 'sideways_bb_std_mult': 2.460937643430685, 'sideways_rsi_os': 35, 'sideways_rsi_ob': 70, 'sideways_adx_thresh': 20.311617834373987, 'sideways_atr_min_pct': 0.00200602961289004, 'sideways_atr_max_pct': 0.12684805068425806, 'sideways_tp_mult': 2.363779846312167, 'sideways_tsl_mult': 0.18915291381297217, 'sideways_time_stop': 223, 'sideways_use_sma': False, 'sideways_use_ema': True, 'sideways_use_atr': True, 'sideways_use_adx': False, 'sideways_use_spike': False, 'sideways_rsi_required': True}.
