[I 2025-08-30 20:01:45,756] Trial 810 finished with values: [-1000000000.0, 1000000000.0] and parameters: {'p_sma': 8, 'p_std': 29, 'p_atr': 10, 'p_adx': 20, 'rsi_period': 54, 'ema1': 26, 'ema2': 35, 'slip_atr_k': 0.06075254252769363, 'slip_spread_k': 0.09933173039754864, 'spread_hl_frac': 0.02552385210404823, 'bb_std_mult': 2.8297570668606267, 'rsi_os': 46, 'rsi_ob': 69, 'vol_spike': 0.14117062065385422, 'adx_thresh': 30.3079448421176, 'atr_min_pct': 0.024585190447132255, 'atr_max_pct': 0.09328334782132658, 'tp_mult': 1.1589666787671653, 'tsl_mult': 0.8498790431734964, 'strategy': 'mean_reversion', 'time_stop': 188, 'use_sma': False, 'use_atr': True, 'use_adx': True, 'use_ema': False, 'use_spike': True, 'rsi_required': False, 'edge_k': 0.14954384734653153, 'edge_cap': 0.792457519389679, 'bull_strategy': 'mean_reversion', 'bull_bb_std_mult': 3.2126749848659664, 'bull_rsi_os': 30, 'bull_rsi_ob': 48, 'bull_adx_thresh': 17.75448701679776, 'bull_atr_min_pct': 0.019740598404379667, 'bull_atr_max_pct': 0.12776106442774074, 'bull_tp_mult': 2.660900102780724, 'bull_tsl_mult': 0.8513350782227722, 'bull_time_stop': 74, 'bull_use_sma': False, 'bull_use_ema': True, 'bull_use_atr': True, 'bull_use_adx': False, 'bull_use_spike': False, 'bull_rsi_required': True, 'bear_strategy': 'breakout', 'bear_bb_std_mult': 2.794831010533393, 'bear_rsi_os': 23, 'bear_rsi_ob': 73, 'bear_adx_thresh': 20.418891931793834, 'bear_atr_min_pct': 0.01568331009690627, 'bear_atr_max_pct': 0.03874296957413664, 'bear_tp_mult': 1.6240794450858926, 'bear_tsl_mult': 0.7539894266967831, 'bear_time_stop': 186, 'bear_use_sma': True, 'bear_use_ema': True, 'bear_use_atr': True, 'bear_use_adx': False, 'bear_use_spike': False, 'bear_rsi_required': False, 'sideways_strategy': 'breakout', 'sideways_bb_std_mult': 3.364145188317995, 'sideways_rsi_os': 52, 'sideways_rsi_ob': 81, 'sideways_adx_thresh': 21.89231464914417, 'sideways_atr_min_pct': 0.0044840055632264075, 'sideways_atr_max_pct': 0.1481378731595528, 'sideways_tp_mult': 1.0717142580543055, 'sideways_tsl_mult': 0.9537773931475799, 'sideways_time_stop': 157, 'sideways_use_sma': False, 'sideways_use_ema': True, 'sideways_use_atr': True, 'sideways_use_adx': False, 'sideways_use_spike': False, 'sideways_rsi_required': True}.
[I 2025-08-30 20:01:46,183] Trial 811 finished with values: [-1000000000.0, 1000000000.0] and parameters: {'p_sma': 11, 'p_std': 31, 'p_atr': 14, 'p_adx': 19, 'rsi_period': 82, 'ema1': 26, 'ema2': 39, 'slip_atr_k': 0.06338743049007212, 'slip_spread_k': 0.10113355670093474, 'spread_hl_frac': 0.02538789084590214, 'bb_std_mult': 1.0924496709107425, 'rsi_os': 46, 'rsi_ob': 83, 'vol_spike': 0.2525472100341577, 'adx_thresh': 33.261572733713926, 'atr_min_pct': 0.024722949315457057, 'atr_max_pct': 0.08965466270025198, 'tp_mult': 2.6132000697179807, 'tsl_mult': 0.669814108225308, 'strategy': 'mean_reversion', 'time_stop': 189, 'use_sma': False, 'use_atr': True, 'use_adx': True, 'use_ema': False, 'use_spike': True, 'rsi_required': True, 'edge_k': 0.15145037027500988, 'edge_cap': 0.4638164777334657, 'bull_strategy': 'mean_reversion', 'bull_bb_std_mult': 3.3272738732760216, 'bull_rsi_os': 7, 'bull_rsi_ob': 56, 'bull_adx_thresh': 16.42001315689878, 'bull_atr_min_pct': 0.0036772031111780472, 'bull_atr_max_pct': 0.016921767995137574, 'bull_tp_mult': 2.6739555698283164, 'bull_tsl_mult': 0.23016811298248285, 'bull_time_stop': 154, 'bull_use_sma': False, 'bull_use_ema': True, 'bull_use_atr': True, 'bull_use_adx': False, 'bull_use_spike': False, 'bull_rsi_required': True, 'bear_strategy': 'breakout', 'bear_bb_std_mult': 2.7939895948229045, 'bear_rsi_os': 23, 'bear_rsi_ob': 75, 'bear_adx_thresh': 6.9295982529881055, 'bear_atr_min_pct': 0.015639722081482642, 'bear_atr_max_pct': 0.019727612998834798, 'bear_tp_mult': 2.862566103672046, 'bear_tsl_mult': 0.33702962360976485, 'bear_time_stop': 187, 'bear_use_sma': True, 'bear_use_ema': True, 'bear_use_atr': True, 'bear_use_adx': False, 'bear_use_spike': False, 'bear_rsi_required': False, 'sideways_strategy': 'breakout', 'sideways_bb_std_mult': 2.17833951552723, 'sideways_rsi_os': 49, 'sideways_rsi_ob': 58, 'sideways_adx_thresh': 22.010574626506163, 'sideways_atr_min_pct': 0.003310208620258461, 'sideways_atr_max_pct': 0.07315412065248818, 'sideways_tp_mult': 1.0416348712959183, 'sideways_tsl_mult': 0.9563113800967064, 'sideways_time_stop': 167, 'sideways_use_sma': False, 'sideways_use_ema': True, 'sideways_use_atr': True, 'sideways_use_adx': False, 'sideways_use_spike': False, 'sideways_rsi_required': True}.
[I 2025-08-30 20:01:47,501] Trial 812 finished with values: [-1000000000.0, 1000000000.0] and parameters: {'p_sma': 8, 'p_std': 53, 'p_atr': 13, 'p_adx': 15, 'rsi_period': 28, 'ema1': 26, 'ema2': 50, 'slip_atr_k': 0.07114306091357997, 'slip_spread_k': 0.14902972725851235, 'spread_hl_frac': 0.025731702206157406, 'bb_std_mult': 2.8215382105532667, 'rsi_os': 46, 'rsi_ob': 68, 'vol_spike': 0.0063221156451639116, 'adx_thresh': 34.99010434576426, 'atr_min_pct': 0.013327840287006266, 'atr_max_pct': 0.09822193494278017, 'tp_mult': 2.289644412013522, 'tsl_mult': 0.5928731472965838, 'strategy': 'mean_reversion', 'time_stop': 191, 'use_sma': False, 'use_atr': True, 'use_adx': True, 'use_ema': False, 'use_spike': True, 'rsi_required': True, 'edge_k': 0.1495283456004477, 'edge_cap': 0.48366714803372823, 'bull_strategy': 'mean_reversion', 'bull_bb_std_mult': 3.325326519196011, 'bull_rsi_os': 30, 'bull_rsi_ob': 67, 'bull_adx_thresh': 16.31159159388423, 'bull_atr_min_pct': 0.002572029280089522, 'bull_atr_max_pct': 0.12279630402158906, 'bull_tp_mult': 2.6712080217553877, 'bull_tsl_mult': 0.5564339490981547, 'bull_time_stop': 230, 'bull_use_sma': False, 'bull_use_ema': True, 'bull_use_atr': True, 'bull_use_adx': False, 'bull_use_spike': False, 'bull_rsi_required': True, 'bear_strategy': 'breakout', 'bear_bb_std_mult': 0.6821592385660151, 'bear_rsi_os': 53, 'bear_rsi_ob': 76, 'bear_adx_thresh': 6.86297752243313, 'bear_atr_min_pct': 0.022403386035475738, 'bear_atr_max_pct': 0.03829579788812481, 'bear_tp_mult': 2.690278811019606, 'bear_tsl_mult': 0.0006819977790873955, 'bear_time_stop': 187, 'bear_use_sma': True, 'bear_use_ema': True, 'bear_use_atr': False, 'bear_use_adx': False, 'bear_use_spike': False, 'bear_rsi_required': True, 'sideways_strategy': 'breakout', 'sideways_bb_std_mult': 3.3233215697954535, 'sideways_rsi_os': 26, 'sideways_rsi_ob': 56, 'sideways_adx_thresh': 22.023306350659045, 'sideways_atr_min_pct': 0.0028899593613866794, 'sideways_atr_max_pct': 0.14763142880784105, 'sideways_tp_mult': 1.0394834960718118, 'sideways_tsl_mult': 0.6753343306614814, 'sideways_time_stop': 154, 'sideways_use_sma': False, 'sideways_use_ema': True, 'sideways_use_atr': True, 'sideways_use_adx': False, 'sideways_use_spike': False, 'sideways_rsi_required': True}.
[I 2025-08-30 20:01:48,397] Trial 815 finished with values: [-1000000000.0, 1000000000.0] and parameters: {'p_sma': 34, 'p_std': 53, 'p_atr': 24, 'p_adx': 21, 'rsi_period': 26, 'ema1': 25, 'ema2': 31, 'slip_atr_k': 0.07125601997931255, 'slip_spread_k': 0.1458886857603664, 'spread_hl_frac': 0.02434254642973504, 'bb_std_mult': 2.2172106657540125, 'rsi_os': 50, 'rsi_ob': 71, 'vol_spike': 0.27007220269775045, 'adx_thresh': 6.986531939465978, 'atr_min_pct': 0.0018679478098721815, 'atr_max_pct': 0.07157055131564412, 'tp_mult': 2.2941614003662916, 'tsl_mult': 0.07436243692213712, 'strategy': 'mean_reversion', 'time_stop': 94, 'use_sma': True, 'use_atr': True, 'use_adx': False, 'use_ema': False, 'use_spike': True, 'rsi_required': True, 'edge_k': 0.16004822347773162, 'edge_cap': 0.48630226299418244, 'bull_strategy': 'mean_reversion', 'bull_bb_std_mult': 3.1601855638992187, 'bull_rsi_os': 30, 'bull_rsi_ob': 46, 'bull_adx_thresh': 28.10619646270513, 'bull_atr_min_pct': 0.0024174699197831283, 'bull_atr_max_pct': 0.13512557033314873, 'bull_tp_mult': 2.7940563071341544, 'bull_tsl_mult': 0.549546592888694, 'bull_time_stop': 31, 'bull_use_sma': False, 'bull_use_ema': False, 'bull_use_atr': True, 'bull_use_adx': True, 'bull_use_spike': True, 'bull_rsi_required': False, 'bear_strategy': 'breakout', 'bear_bb_std_mult': 2.1828218197230265, 'bear_rsi_os': 35, 'bear_rsi_ob': 76, 'bear_adx_thresh': 15.428272553322504, 'bear_atr_min_pct': 0.01476294958443162, 'bear_atr_max_pct': 0.03482532221923931, 'bear_tp_mult': 2.7307760743841434, 'bear_tsl_mult': 0.7306199774921582, 'bear_time_stop': 269, 'bear_use_sma': True, 'bear_use_ema': False, 'bear_use_atr': False, 'bear_use_adx': False, 'bear_use_spike': False, 'bear_rsi_required': True, 'sideways_strategy': 'breakout', 'sideways_bb_std_mult': 3.1097815849549386, 'sideways_rsi_os': 44, 'sideways_rsi_ob': 59, 'sideways_adx_thresh': 19.852394390609952, 'sideways_atr_min_pct': 0.01778064115558956, 'sideways_atr_max_pct': 0.14777762443512574, 'sideways_tp_mult': 1.419485158821688, 'sideways_tsl_mult': 0.9710704466392973, 'sideways_time_stop': 108, 'sideways_use_sma': False, 'sideways_use_ema': False, 'sideways_use_atr': True, 'sideways_use_adx': True, 'sideways_use_spike': False, 'sideways_rsi_required': False}.
[I 2025-08-30 20:01:49,479] Trial 817 finished with values: [-1000000000.0, 1000000000.0] and parameters: {'p_sma': 43, 'p_std': 32, 'p_atr': 8, 'p_adx': 20, 'rsi_period': 80, 'ema1': 28, 'ema2': 25, 'slip_atr_k': 0.22870633168888882, 'slip_spread_k': 0.262642577033095, 'spread_hl_frac': 0.022186323890451283, 'bb_std_mult': 2.068367887930433, 'rsi_os': 51, 'rsi_ob': 85, 'vol_spike': 0.15704555813154214, 'adx_thresh': 32.323592357725985, 'atr_min_pct': 0.012072622917827715, 'atr_max_pct': 0.10253276354881785, 'tp_mult': 2.2500603271351993, 'tsl_mult': 0.2758171773755278, 'strategy': 'mean_reversion', 'time_stop': 174, 'use_sma': False, 'use_atr': False, 'use_adx': True, 'use_ema': True, 'use_spike': False, 'rsi_required': False, 'edge_k': 0.2538607736460651, 'edge_cap': 0.504377538687309, 'bull_strategy': 'mean_reversion', 'bull_bb_std_mult': 1.453125933387812, 'bull_rsi_os': 11, 'bull_rsi_ob': 91, 'bull_adx_thresh': 19.219759232280254, 'bull_atr_min_pct': 0.002996526753864915, 'bull_atr_max_pct': 0.10440452499376407, 'bull_tp_mult': 1.3868344541091355, 'bull_tsl_mult': 0.4871162420213126, 'bull_time_stop': 197, 'bull_use_sma': True, 'bull_use_ema': True, 'bull_use_atr': True, 'bull_use_adx': False, 'bull_use_spike': False, 'bull_rsi_required': True, 'bear_strategy': 'mean_reversion', 'bear_bb_std_mult': 2.907871290620207, 'bear_rsi_os': 20, 'bear_rsi_ob': 64, 'bear_adx_thresh': 8.29083618937917, 'bear_atr_min_pct': 0.014813522477312347, 'bear_atr_max_pct': 0.02623069089189577, 'bear_tp_mult': 2.6548834601204785, 'bear_tsl_mult': 0.7562610568241179, 'bear_time_stop': 210, 'bear_use_sma': True, 'bear_use_ema': True, 'bear_use_atr': False, 'bear_use_adx': False, 'bear_use_spike': True, 'bear_rsi_required': True, 'sideways_strategy': 'mean_reversion', 'sideways_bb_std_mult': 2.039748426689659, 'sideways_rsi_os': 37, 'sideways_rsi_ob': 62, 'sideways_adx_thresh': 19.543024081207353, 'sideways_atr_min_pct': 0.00936180326556096, 'sideways_atr_max_pct': 0.1065215383175836, 'sideways_tp_mult': 2.383942132711665, 'sideways_tsl_mult': 0.07475915826794766, 'sideways_time_stop': 150, 'sideways_use_sma': True, 'sideways_use_ema': True, 'sideways_use_atr': False, 'sideways_use_adx': False, 'sideways_use_spike': True, 'sideways_rsi_required': True}.
[I 2025-08-30 20:02:16,145] Trial 814 finished with values: [-1000000000.0, 1000000000.0] and parameters: {'p_sma': 21, 'p_std': 32, 'p_atr': 8, 'p_adx': 20, 'rsi_period': 68, 'ema1': 15, 'ema2': 39, 'slip_atr_k': 0.00017698373857222283, 'slip_spread_k': 0.2654715696058825, 'spread_hl_frac': 0.022493116121449417, 'bb_std_mult': 2.084767339304477, 'rsi_os': 44, 'rsi_ob': 84, 'vol_spike': 0.2520675720562315, 'adx_thresh': 34.568850553991105, 'atr_min_pct': 0.0016813297067200614, 'atr_max_pct': 0.0892681554670689, 'tp_mult': 2.283849580042131, 'tsl_mult': 0.6636817258121224, 'strategy': 'mean_reversion', 'time_stop': 173, 'use_sma': False, 'use_atr': True, 'use_adx': False, 'use_ema': False, 'use_spike': True, 'rsi_required': True, 'edge_k': 0.14743660430502392, 'edge_cap': 0.4777320597179252, 'bull_strategy': 'mean_reversion', 'bull_bb_std_mult': 3.4209594348497996, 'bull_rsi_os': 11, 'bull_rsi_ob': 46, 'bull_adx_thresh': 22.925427094008395, 'bull_atr_min_pct': 0.002559752390490158, 'bull_atr_max_pct': 0.13568134709888358, 'bull_tp_mult': 2.7925938905227725, 'bull_tsl_mult': 0.4858965531962726, 'bull_time_stop': 200, 'bull_use_sma': False, 'bull_use_ema': True, 'bull_use_atr': True, 'bull_use_adx': True, 'bull_use_spike': False, 'bull_rsi_required': False, 'bear_strategy': 'breakout', 'bear_bb_std_mult': 2.182705681813551, 'bear_rsi_os': 31, 'bear_rsi_ob': 70, 'bear_adx_thresh': 15.17546830880897, 'bear_atr_min_pct': 0.013018578921891314, 'bear_atr_max_pct': 0.03434529054176472, 'bear_tp_mult': 2.996889207348464, 'bear_tsl_mult': 0.6229196778073731, 'bear_time_stop': 21, 'bear_use_sma': True, 'bear_use_ema': True, 'bear_use_atr': False, 'bear_use_adx': False, 'bear_use_spike': False, 'bear_rsi_required': True, 'sideways_strategy': 'breakout', 'sideways_bb_std_mult': 3.111972101685289, 'sideways_rsi_os': 13, 'sideways_rsi_ob': 48, 'sideways_adx_thresh': 16.947155471767456, 'sideways_atr_min_pct': 0.0031595301575255115, 'sideways_atr_max_pct': 0.14743711544941812, 'sideways_tp_mult': 1.201452360439511, 'sideways_tsl_mult': 0.999692927666974, 'sideways_time_stop': 167, 'sideways_use_sma': False, 'sideways_use_ema': False, 'sideways_use_atr': True, 'sideways_use_adx': False, 'sideways_use_spike': False, 'sideways_rsi_required': False}.
[I 2025-08-30 20:02:16,173] Trial 813 finished with values: [-1000000000.0, 1000000000.0] and parameters: {'p_sma': 8, 'p_std': 32, 'p_atr': 14, 'p_adx': 12, 'rsi_period': 45, 'ema1': 26, 'ema2': 58, 'slip_atr_k': 0.18458401053433868, 'slip_spread_k': 0.1529652201401214, 'spread_hl_frac': 0.029476941270295123, 'bb_std_mult': 1.3021184469183384, 'rsi_os': 46, 'rsi_ob': 83, 'vol_spike': 0.005643466275176562, 'adx_thresh': 6.8441316383181885, 'atr_min_pct': 0.011851785777909919, 'atr_max_pct': 0.0895779978386597, 'tp_mult': 1.1555416114291908, 'tsl_mult': 0.5910005700652915, 'strategy': 'mean_reversion', 'time_stop': 192, 'use_sma': False, 'use_atr': True, 'use_adx': True, 'use_ema': False, 'use_spike': True, 'rsi_required': True, 'edge_k': 0.15941633766686372, 'edge_cap': 0.4829630791246218, 'bull_strategy': 'mean_reversion', 'bull_bb_std_mult': 3.1394767711636686, 'bull_rsi_os': 19, 'bull_rsi_ob': 67, 'bull_adx_thresh': 12.757678694335585, 'bull_atr_min_pct': 0.0025698654798829417, 'bull_atr_max_pct': 0.1277734478149009, 'bull_tp_mult': 2.665265998126032, 'bull_tsl_mult': 0.004355525951662775, 'bull_time_stop': 199, 'bull_use_sma': False, 'bull_use_ema': True, 'bull_use_atr': True, 'bull_use_adx': False, 'bull_use_spike': False, 'bull_rsi_required': True, 'bear_strategy': 'breakout', 'bear_bb_std_mult': 1.4701703504547428, 'bear_rsi_os': 54, 'bear_rsi_ob': 70, 'bear_adx_thresh': 18.72094044856193, 'bear_atr_min_pct': 0.01466985831263287, 'bear_atr_max_pct': 0.02059210912412819, 'bear_tp_mult': 1.1015163907202346, 'bear_tsl_mult': 0.7475258100305316, 'bear_time_stop': 185, 'bear_use_sma': True, 'bear_use_ema': True, 'bear_use_atr': True, 'bear_use_adx': False, 'bear_use_spike': False, 'bear_rsi_required': False, 'sideways_strategy': 'breakout', 'sideways_bb_std_mult': 2.1795623031761684, 'sideways_rsi_os': 26, 'sideways_rsi_ob': 79, 'sideways_adx_thresh': 10.235675589346725, 'sideways_atr_min_pct': 0.003175085564061567, 'sideways_atr_max_pct': 0.07307599783337727, 'sideways_tp_mult': 1.8936219036834285, 'sideways_tsl_mult': 0.9659721393499009, 'sideways_time_stop': 108, 'sideways_use_sma': False, 'sideways_use_ema': True, 'sideways_use_atr': True, 'sideways_use_adx': False, 'sideways_use_spike': False, 'sideways_rsi_required': True}.
[I 2025-08-30 20:02:16,572] Trial 816 finished with values: [-0.03146802902570034, 0.03141342580091031] and parameters: {'p_sma': 10, 'p_std': 49, 'p_atr': 8, 'p_adx': 20, 'rsi_period': 7, 'ema1': 15, 'ema2': 31, 'slip_atr_k': 0.08065770605706821, 'slip_spread_k': 0.02430310864056834, 'spread_hl_frac': 0.022206579757016325, 'bb_std_mult': 2.2413404937852572, 'rsi_os': 40, 'rsi_ob': 78, 'vol_spike': 0.27157052949874205, 'adx_thresh': 34.185253702605195, 'atr_min_pct': 0.00639158235577687, 'atr_max_pct': 0.07521652859065822, 'tp_mult': 1.2625713148740867, 'tsl_mult': 0.40190562627463766, 'strategy': 'mean_reversion', 'time_stop': 176, 'use_sma': True, 'use_atr': False, 'use_adx': False, 'use_ema': True, 'use_spike': False, 'rsi_required': False, 'edge_k': 0.23714887697100315, 'edge_cap': 0.5025467861840555, 'bull_strategy': 'mean_reversion', 'bull_bb_std_mult': 3.4300840386353753, 'bull_rsi_os': 34, 'bull_rsi_ob': 46, 'bull_adx_thresh': 24.314374853943676, 'bull_atr_min_pct': 0.0024831507144233394, 'bull_atr_max_pct': 0.0861107067989628, 'bull_tp_mult': 2.803592158280346, 'bull_tsl_mult': 0.00386694559665135, 'bull_time_stop': 30, 'bull_use_sma': True, 'bull_use_ema': False, 'bull_use_atr': True, 'bull_use_adx': True, 'bull_use_spike': True, 'bull_rsi_required': False, 'bear_strategy': 'mean_reversion', 'bear_bb_std_mult': 2.9014639108176308, 'bear_rsi_os': 35, 'bear_rsi_ob': 50, 'bear_adx_thresh': 18.744654819967252, 'bear_atr_min_pct': 0.014743779929424865, 'bear_atr_max_pct': 0.034568503810534, 'bear_tp_mult': 2.739696592906287, 'bear_tsl_mult': 0.6279482218791963, 'bear_time_stop': 211, 'bear_use_sma': True, 'bear_use_ema': False, 'bear_use_atr': False, 'bear_use_adx': False, 'bear_use_spike': True, 'bear_rsi_required': True, 'sideways_strategy': 'mean_reversion', 'sideways_bb_std_mult': 3.1146683188206112, 'sideways_rsi_os': 37, 'sideways_rsi_ob': 59, 'sideways_adx_thresh': 9.917553249106259, 'sideways_atr_min_pct': 0.0020879028844530342, 'sideways_atr_max_pct': 0.05987005577318932, 'sideways_tp_mult': 1.9402729194385546, 'sideways_tsl_mult': 0.9737485272328564, 'sideways_time_stop': 136, 'sideways_use_sma': False, 'sideways_use_ema': False, 'sideways_use_atr': True, 'sideways_use_adx': True, 'sideways_use_spike': False, 'sideways_rsi_required': False}.
[I 2025-08-30 20:02:23,007] Trial 818 finished with values: [-1000000000.0, 1000000000.0] and parameters: {'p_sma': 6, 'p_std': 38, 'p_atr': 18, 'p_adx': 8, 'rsi_period': 24, 'ema1': 24, 'ema2': 33, 'slip_atr_k': 0.013762320072309667, 'slip_spread_k': 0.46848076024435636, 'spread_hl_frac': 0.03262532045647153, 'bb_std_mult': 3.316623186833268, 'rsi_os': 11, 'rsi_ob': 84, 'vol_spike': 0.045367632573325545, 'adx_thresh': 31.401187499630353, 'atr_min_pct': 0.022040214008725835, 'atr_max_pct': 0.08220221829520029, 'tp_mult': 2.539181502019019, 'tsl_mult': 0.781468463934563, 'strategy': 'mean_reversion', 'time_stop': 148, 'use_sma': True, 'use_atr': True, 'use_adx': False, 'use_ema': False, 'use_spike': True, 'rsi_required': False, 'edge_k': 0.053754817136027255, 'edge_cap': 0.5591050466740259, 'bull_strategy': 'mean_reversion', 'bull_bb_std_mult': 3.450977591314997, 'bull_rsi_os': 34, 'bull_rsi_ob': 62, 'bull_adx_thresh': 12.699889721051878, 'bull_atr_min_pct': 0.008476625270131079, 'bull_atr_max_pct': 0.04594883292456885, 'bull_tp_mult': 1.0954122168811335, 'bull_tsl_mult': 0.964412260738888, 'bull_time_stop': 175, 'bull_use_sma': False, 'bull_use_ema': True, 'bull_use_atr': True, 'bull_use_adx': True, 'bull_use_spike': False, 'bull_rsi_required': False, 'bear_strategy': 'breakout', 'bear_bb_std_mult': 2.719105430168942, 'bear_rsi_os': 52, 'bear_rsi_ob': 92, 'bear_adx_thresh': 18.542241509074262, 'bear_atr_min_pct': 0.01404944822134395, 'bear_atr_max_pct': 0.03303399672975796, 'bear_tp_mult': 2.5808734154744615, 'bear_tsl_mult': 0.18970861821571228, 'bear_time_stop': 196, 'bear_use_sma': True, 'bear_use_ema': True, 'bear_use_atr': False, 'bear_use_adx': False, 'bear_use_spike': False, 'bear_rsi_required': True, 'sideways_strategy': 'breakout', 'sideways_bb_std_mult': 1.771286712180318, 'sideways_rsi_os': 32, 'sideways_rsi_ob': 51, 'sideways_adx_thresh': 16.523498358708572, 'sideways_atr_min_pct': 0.002148967424486299, 'sideways_atr_max_pct': 0.09940758646907855, 'sideways_tp_mult': 1.3625997627881496, 'sideways_tsl_mult': 0.8295519623109757, 'sideways_time_stop': 123, 'sideways_use_sma': False, 'sideways_use_ema': False, 'sideways_use_atr': True, 'sideways_use_adx': False, 'sideways_use_spike': False, 'sideways_rsi_required': False}.
