[I 2025-08-30 20:00:36,274] Trial 801 finished with values: [-0.02774811381875475, 0.027667124347554053] and parameters: {'p_sma': 40, 'p_std': 29, 'p_atr': 27, 'p_adx': 21, 'rsi_period': 25, 'ema1': 27, 'ema2': 32, 'slip_atr_k': 0.07530229095838237, 'slip_spread_k': 0.19564013735656388, 'spread_hl_frac': 0.02302890589081709, 'bb_std_mult': 2.1730347899020446, 'rsi_os': 49, 'rsi_ob': 82, 'vol_spike': 0.26802144699851266, 'adx_thresh': 33.727834010020786, 'atr_min_pct': 0.016524005060003993, 'atr_max_pct': 0.040787952007712715, 'tp_mult': 2.4177821697344912, 'tsl_mult': 0.705032787054186, 'strategy': 'breakout', 'time_stop': 102, 'use_sma': False, 'use_atr': False, 'use_adx': True, 'use_ema': True, 'use_spike': False, 'rsi_required': True, 'edge_k': 1.5715585256835833, 'edge_cap': 0.42185251264048873, 'bull_strategy': 'mean_reversion', 'bull_bb_std_mult': 3.595359666172124, 'bull_rsi_os': 32, 'bull_rsi_ob': 45, 'bull_adx_thresh': 18.77312845000596, 'bull_atr_min_pct': 0.001167028470145794, 'bull_atr_max_pct': 0.1120434281205568, 'bull_tp_mult': 1.8598895741995611, 'bull_tsl_mult': 0.5155150449032326, 'bull_time_stop': 182, 'bull_use_sma': True, 'bull_use_ema': False, 'bull_use_atr': True, 'bull_use_adx': False, 'bull_use_spike': True, 'bull_rsi_required': True, 'bear_strategy': 'mean_reversion', 'bear_bb_std_mult': 3.0085127569323604, 'bear_rsi_os': 45, 'bear_rsi_ob': 76, 'bear_adx_thresh': 16.559161045566015, 'bear_atr_min_pct': 0.02341666287632104, 'bear_atr_max_pct': 0.03228764886500281, 'bear_tp_mult': 2.6439311909137992, 'bear_tsl_mult': 0.2584741940428231, 'bear_time_stop': 176, 'bear_use_sma': False, 'bear_use_ema': True, 'bear_use_atr': False, 'bear_use_adx': True, 'bear_use_spike': True, 'bear_rsi_required': True, 'sideways_strategy': 'mean_reversion', 'sideways_bb_std_mult': 3.1741542722068177, 'sideways_rsi_os': 34, 'sideways_rsi_ob': 73, 'sideways_adx_thresh': 17.761977872359264, 'sideways_atr_min_pct': 0.0054948725767022845, 'sideways_atr_max_pct': 0.1477622384288593, 'sideways_tp_mult': 2.0229791524075713, 'sideways_tsl_mult': 0.9997474239233127, 'sideways_time_stop': 145, 'sideways_use_sma': True, 'sideways_use_ema': True, 'sideways_use_atr': False, 'sideways_use_adx': True, 'sideways_use_spike': True, 'sideways_rsi_required': True}.
[I 2025-08-30 20:00:37,080] Trial 802 finished with values: [-0.03372939636633032, 0.033665659326417276] and parameters: {'p_sma': 40, 'p_std': 8, 'p_atr': 28, 'p_adx': 21, 'rsi_period': 22, 'ema1': 27, 'ema2': 45, 'slip_atr_k': 0.07648108926930013, 'slip_spread_k': 0.1159919285049123, 'spread_hl_frac': 0.024251537415185733, 'bb_std_mult': 2.0948010903829144, 'rsi_os': 13, 'rsi_ob': 82, 'vol_spike': 0.058509510372149784, 'adx_thresh': 29.38735631659577, 'atr_min_pct': 0.02389563607677515, 'atr_max_pct': 0.1316604233092151, 'tp_mult': 1.057261459514021, 'tsl_mult': 0.7033893212178558, 'strategy': 'breakout', 'time_stop': 70, 'use_sma': False, 'use_atr': False, 'use_adx': True, 'use_ema': False, 'use_spike': False, 'rsi_required': False, 'edge_k': 1.5850122257257504, 'edge_cap': 0.07673977802176207, 'bull_strategy': 'breakout', 'bull_bb_std_mult': 3.0775378576326995, 'bull_rsi_os': 36, 'bull_rsi_ob': 83, 'bull_adx_thresh': 18.77686589370563, 'bull_atr_min_pct': 0.0010456634604000103, 'bull_atr_max_pct': 0.12048992080738927, 'bull_tp_mult': 2.007411278399646, 'bull_tsl_mult': 0.5090872050391608, 'bull_time_stop': 300, 'bull_use_sma': True, 'bull_use_ema': True, 'bull_use_atr': True, 'bull_use_adx': False, 'bull_use_spike': False, 'bull_rsi_required': True, 'bear_strategy': 'mean_reversion', 'bear_bb_std_mult': 3.1353198915260005, 'bear_rsi_os': 28, 'bear_rsi_ob': 78, 'bear_adx_thresh': 19.45990828344179, 'bear_atr_min_pct': 0.026934846369412253, 'bear_atr_max_pct': 0.08063680754849119, 'bear_tp_mult': 2.1828485922488747, 'bear_tsl_mult': 0.2533081089878445, 'bear_time_stop': 177, 'bear_use_sma': False, 'bear_use_ema': True, 'bear_use_atr': False, 'bear_use_adx': True, 'bear_use_spike': False, 'bear_rsi_required': True, 'sideways_strategy': 'breakout', 'sideways_bb_std_mult': 3.1733164187970853, 'sideways_rsi_os': 35, 'sideways_rsi_ob': 69, 'sideways_adx_thresh': 21.051428900703353, 'sideways_atr_min_pct': 0.0024434247023706434, 'sideways_atr_max_pct': 0.1381519459307804, 'sideways_tp_mult': 1.6934242002166568, 'sideways_tsl_mult': 0.7283999070113873, 'sideways_time_stop': 144, 'sideways_use_sma': True, 'sideways_use_ema': True, 'sideways_use_atr': False, 'sideways_use_adx': False, 'sideways_use_spike': True, 'sideways_rsi_required': True}.
[I 2025-08-30 20:00:37,952] Trial 806 finished with values: [-1000000000.0, 1000000000.0] and parameters: {'p_sma': 6, 'p_std': 35, 'p_atr': 11, 'p_adx': 25, 'rsi_period': 21, 'ema1': 16, 'ema2': 11, 'slip_atr_k': 0.06721340221200352, 'slip_spread_k': 0.13220764073225477, 'spread_hl_frac': 0.019788163433591972, 'bb_std_mult': 1.3807349484775497, 'rsi_os': 53, 'rsi_ob': 82, 'vol_spike': 0.2591702978596832, 'adx_thresh': 19.845026891891788, 'atr_min_pct': 0.02260282029516213, 'atr_max_pct': 0.06281448123937025, 'tp_mult': 2.175349478476078, 'tsl_mult': 0.8109146257518698, 'strategy': 'mean_reversion', 'time_stop': 156, 'use_sma': False, 'use_atr': True, 'use_adx': True, 'use_ema': False, 'use_spike': True, 'rsi_required': False, 'edge_k': 0.0015989527865338249, 'edge_cap': 0.3257422887109725, 'bull_strategy': 'breakout', 'bull_bb_std_mult': 3.1485805496336745, 'bull_rsi_os': 28, 'bull_rsi_ob': 82, 'bull_adx_thresh': 17.21413152219765, 'bull_atr_min_pct': 0.006717147644812779, 'bull_atr_max_pct': 0.11627365259131651, 'bull_tp_mult': 2.751218808770724, 'bull_tsl_mult': 0.5385885723813296, 'bull_time_stop': 163, 'bull_use_sma': False, 'bull_use_ema': True, 'bull_use_atr': False, 'bull_use_adx': False, 'bull_use_spike': False, 'bull_rsi_required': True, 'bear_strategy': 'breakout', 'bear_bb_std_mult': 3.0054863818449133, 'bear_rsi_os': 50, 'bear_rsi_ob': 58, 'bear_adx_thresh': 17.50330818509471, 'bear_atr_min_pct': 0.001243061868089845, 'bear_atr_max_pct': 0.11008675955391668, 'bear_tp_mult': 2.8001310151778767, 'bear_tsl_mult': 0.8035012466685618, 'bear_time_stop': 200, 'bear_use_sma': True, 'bear_use_ema': True, 'bear_use_atr': False, 'bear_use_adx': False, 'bear_use_spike': False, 'bear_rsi_required': False, 'sideways_strategy': 'breakout', 'sideways_bb_std_mult': 1.677695261665347, 'sideways_rsi_os': 47, 'sideways_rsi_ob': 60, 'sideways_adx_thresh': 21.136090123384687, 'sideways_atr_min_pct': 0.014141009278023078, 'sideways_atr_max_pct': 0.04470235403193542, 'sideways_tp_mult': 1.1277963714482682, 'sideways_tsl_mult': 0.8660420268157438, 'sideways_time_stop': 176, 'sideways_use_sma': False, 'sideways_use_ema': True, 'sideways_use_atr': True, 'sideways_use_adx': False, 'sideways_use_spike': False, 'sideways_rsi_required': True}.
[I 2025-08-30 20:01:10,130] Trial 804 finished with values: [-0.0345407377219944, 0.03439416415885918] and parameters: {'p_sma': 7, 'p_std': 35, 'p_atr': 9, 'p_adx': 20, 'rsi_period': 21, 'ema1': 29, 'ema2': 30, 'slip_atr_k': 0.07686670791776129, 'slip_spread_k': 0.22388220144790655, 'spread_hl_frac': 0.0476225818873664, 'bb_std_mult': 2.4653494089226524, 'rsi_os': 50, 'rsi_ob': 82, 'vol_spike': 0.08295504306101394, 'adx_thresh': 15.031380679344686, 'atr_min_pct': 0.01723688781166223, 'atr_max_pct': 0.1316964901268256, 'tp_mult': 2.17945575126689, 'tsl_mult': 0.9128959085522523, 'strategy': 'breakout', 'time_stop': 136, 'use_sma': False, 'use_atr': True, 'use_adx': True, 'use_ema': False, 'use_spike': True, 'rsi_required': False, 'edge_k': 0.003816094080895116, 'edge_cap': 0.519432395585671, 'bull_strategy': 'breakout', 'bull_bb_std_mult': 2.696163668600317, 'bull_rsi_os': 32, 'bull_rsi_ob': 82, 'bull_adx_thresh': 31.525682317884655, 'bull_atr_min_pct': 0.0011025849241506046, 'bull_atr_max_pct': 0.11757216270582702, 'bull_tp_mult': 2.7330903369550867, 'bull_tsl_mult': 0.5369387524799345, 'bull_time_stop': 183, 'bull_use_sma': False, 'bull_use_ema': True, 'bull_use_atr': False, 'bull_use_adx': False, 'bull_use_spike': False, 'bull_rsi_required': True, 'bear_strategy': 'breakout', 'bear_bb_std_mult': 3.3328709060688837, 'bear_rsi_os': 50, 'bear_rsi_ob': 78, 'bear_adx_thresh': 17.563972523530772, 'bear_atr_min_pct': 0.0010724683872625693, 'bear_atr_max_pct': 0.08266706958628649, 'bear_tp_mult': 2.6036680032135964, 'bear_tsl_mult': 0.44593707791776016, 'bear_time_stop': 140, 'bear_use_sma': False, 'bear_use_ema': True, 'bear_use_atr': False, 'bear_use_adx': True, 'bear_use_spike': False, 'bear_rsi_required': True, 'sideways_strategy': 'breakout', 'sideways_bb_std_mult': 3.1832977720796265, 'sideways_rsi_os': 20, 'sideways_rsi_ob': 69, 'sideways_adx_thresh': 21.06034247592279, 'sideways_atr_min_pct': 0.0262781672298299, 'sideways_atr_max_pct': 0.044688391658469336, 'sideways_tp_mult': 1.1181026130281493, 'sideways_tsl_mult': 0.3000793088916934, 'sideways_time_stop': 145, 'sideways_use_sma': False, 'sideways_use_ema': True, 'sideways_use_atr': True, 'sideways_use_adx': False, 'sideways_use_spike': False, 'sideways_rsi_required': True}.
[I 2025-08-30 20:01:10,813] Trial 803 finished with values: [-0.022314295121146244, 0.02221838188525599] and parameters: {'p_sma': 24, 'p_std': 8, 'p_atr': 26, 'p_adx': 20, 'rsi_period': 21, 'ema1': 25, 'ema2': 31, 'slip_atr_k': 0.07591147351596861, 'slip_spread_k': 0.1930500423147812, 'spread_hl_frac': 0.04757451537286626, 'bb_std_mult': 1.151419461934188, 'rsi_os': 49, 'rsi_ob': 82, 'vol_spike': 0.16332362721478008, 'adx_thresh': 10.652003839406424, 'atr_min_pct': 0.025883076948938388, 'atr_max_pct': 0.14641596642746482, 'tp_mult': 1.619409803807951, 'tsl_mult': 0.810757203267039, 'strategy': 'breakout', 'time_stop': 137, 'use_sma': False, 'use_atr': True, 'use_adx': True, 'use_ema': False, 'use_spike': True, 'rsi_required': False, 'edge_k': 0.4751117208686504, 'edge_cap': 0.5209102522303988, 'bull_strategy': 'breakout', 'bull_bb_std_mult': 3.0340537896183895, 'bull_rsi_os': 32, 'bull_rsi_ob': 45, 'bull_adx_thresh': 7.89087663211563, 'bull_atr_min_pct': 0.0016139504365034391, 'bull_atr_max_pct': 0.11680267826001013, 'bull_tp_mult': 2.742525599838841, 'bull_tsl_mult': 0.5103012522086899, 'bull_time_stop': 182, 'bull_use_sma': False, 'bull_use_ema': True, 'bull_use_atr': False, 'bull_use_adx': False, 'bull_use_spike': False, 'bull_rsi_required': True, 'bear_strategy': 'breakout', 'bear_bb_std_mult': 3.011947818790049, 'bear_rsi_os': 15, 'bear_rsi_ob': 78, 'bear_adx_thresh': 19.331428051418175, 'bear_atr_min_pct': 0.00095822200058957, 'bear_atr_max_pct': 0.09214239862516994, 'bear_tp_mult': 1.8972938879559857, 'bear_tsl_mult': 0.9969306267750869, 'bear_time_stop': 59, 'bear_use_sma': False, 'bear_use_ema': True, 'bear_use_atr': False, 'bear_use_adx': True, 'bear_use_spike': False, 'bear_rsi_required': True, 'sideways_strategy': 'breakout', 'sideways_bb_std_mult': 3.1701360283736024, 'sideways_rsi_os': 34, 'sideways_rsi_ob': 58, 'sideways_adx_thresh': 21.18406221030771, 'sideways_atr_min_pct': 0.01397523491074348, 'sideways_atr_max_pct': 0.14095942583000942, 'sideways_tp_mult': 2.4704972378361965, 'sideways_tsl_mult': 0.22586241469070062, 'sideways_time_stop': 174, 'sideways_use_sma': False, 'sideways_use_ema': True, 'sideways_use_atr': True, 'sideways_use_adx': False, 'sideways_use_spike': True, 'sideways_rsi_required': True}.
[I 2025-08-30 20:01:11,027] Trial 805 finished with values: [-1000000000.0, 1000000000.0] and parameters: {'p_sma': 24, 'p_std': 35, 'p_atr': 9, 'p_adx': 20, 'rsi_period': 61, 'ema1': 16, 'ema2': 14, 'slip_atr_k': 0.06783602768488775, 'slip_spread_k': 0.9972112360352867, 'spread_hl_frac': 0.02394876871745185, 'bb_std_mult': 2.297849584204234, 'rsi_os': 27, 'rsi_ob': 82, 'vol_spike': 0.03103043760888996, 'adx_thresh': 34.102562062648374, 'atr_min_pct': 0.02365107301632073, 'atr_max_pct': 0.13216645614328806, 'tp_mult': 2.347901258540025, 'tsl_mult': 0.4343706555633722, 'strategy': 'breakout', 'time_stop': 252, 'use_sma': False, 'use_atr': True, 'use_adx': True, 'use_ema': False, 'use_spike': True, 'rsi_required': False, 'edge_k': 0.7741123167504369, 'edge_cap': 0.5246001081880555, 'bull_strategy': 'breakout', 'bull_bb_std_mult': 3.0646574432509013, 'bull_rsi_os': 44, 'bull_rsi_ob': 52, 'bull_adx_thresh': 30.869950839257992, 'bull_atr_min_pct': 0.011782943578827476, 'bull_atr_max_pct': 0.11672790487564329, 'bull_tp_mult': 1.999893874685181, 'bull_tsl_mult': 0.543764609471043, 'bull_time_stop': 250, 'bull_use_sma': False, 'bull_use_ema': True, 'bull_use_atr': False, 'bull_use_adx': False, 'bull_use_spike': False, 'bull_rsi_required': True, 'bear_strategy': 'breakout', 'bear_bb_std_mult': 3.4434165513404786, 'bear_rsi_os': 50, 'bear_rsi_ob': 78, 'bear_adx_thresh': 17.86145002986209, 'bear_atr_min_pct': 0.013947420497654078, 'bear_atr_max_pct': 0.029555948223688896, 'bear_tp_mult': 2.1967106210575142, 'bear_tsl_mult': 0.8103582271173234, 'bear_time_stop': 199, 'bear_use_sma': False, 'bear_use_ema': True, 'bear_use_atr': False, 'bear_use_adx': True, 'bear_use_spike': False, 'bear_rsi_required': True, 'sideways_strategy': 'breakout', 'sideways_bb_std_mult': 3.1490979027052597, 'sideways_rsi_os': 35, 'sideways_rsi_ob': 60, 'sideways_adx_thresh': 20.982831496353484, 'sideways_atr_min_pct': 0.025945903034596825, 'sideways_atr_max_pct': 0.14212141708997025, 'sideways_tp_mult': 1.1288489108605755, 'sideways_tsl_mult': 0.8602662962446945, 'sideways_time_stop': 276, 'sideways_use_sma': False, 'sideways_use_ema': True, 'sideways_use_atr': True, 'sideways_use_adx': False, 'sideways_use_spike': False, 'sideways_rsi_required': True}.
[I 2025-08-30 20:01:12,573] Trial 807 finished with values: [-1000000000.0, 1000000000.0] and parameters: {'p_sma': 7, 'p_std': 29, 'p_atr': 9, 'p_adx': 19, 'rsi_period': 65, 'ema1': 25, 'ema2': 14, 'slip_atr_k': 0.08243137977669888, 'slip_spread_k': 0.8573411306302041, 'spread_hl_frac': 0.047976955219815924, 'bb_std_mult': 2.4772137827272855, 'rsi_os': 36, 'rsi_ob': 59, 'vol_spike': 0.030955238270344465, 'adx_thresh': 10.661734083523072, 'atr_min_pct': 0.01741265812206135, 'atr_max_pct': 0.09476329931094434, 'tp_mult': 2.2155109054706523, 'tsl_mult': 0.3418231687060118, 'strategy': 'mean_reversion', 'time_stop': 188, 'use_sma': False, 'use_atr': True, 'use_adx': True, 'use_ema': False, 'use_spike': True, 'rsi_required': False, 'edge_k': 0.04140465216279192, 'edge_cap': 0.5274959048323522, 'bull_strategy': 'mean_reversion', 'bull_bb_std_mult': 3.2086592965648837, 'bull_rsi_os': 25, 'bull_rsi_ob': 48, 'bull_adx_thresh': 7.611853702956449, 'bull_atr_min_pct': 0.0018243730329678294, 'bull_atr_max_pct': 0.1172386915955535, 'bull_tp_mult': 2.132277249603498, 'bull_tsl_mult': 0.1598543599794841, 'bull_time_stop': 183, 'bull_use_sma': False, 'bull_use_ema': True, 'bull_use_atr': False, 'bull_use_adx': False, 'bull_use_spike': False, 'bull_rsi_required': True, 'bear_strategy': 'breakout', 'bear_bb_std_mult': 3.4188122448621288, 'bear_rsi_os': 48, 'bear_rsi_ob': 72, 'bear_adx_thresh': 17.676163833680157, 'bear_atr_min_pct': 0.029917541416160945, 'bear_atr_max_pct': 0.09504762987306369, 'bear_tp_mult': 2.5078067860438638, 'bear_tsl_mult': 0.44597119816458264, 'bear_time_stop': 84, 'bear_use_sma': True, 'bear_use_ema': True, 'bear_use_atr': False, 'bear_use_adx': False, 'bear_use_spike': False, 'bear_rsi_required': True, 'sideways_strategy': 'breakout', 'sideways_bb_std_mult': 3.01811222407946, 'sideways_rsi_os': 39, 'sideways_rsi_ob': 94, 'sideways_adx_thresh': 30.635639473143463, 'sideways_atr_min_pct': 0.004365786430223711, 'sideways_atr_max_pct': 0.14248699837340564, 'sideways_tp_mult': 1.0840010459537404, 'sideways_tsl_mult': 0.19949739896307378, 'sideways_time_stop': 160, 'sideways_use_sma': False, 'sideways_use_ema': True, 'sideways_use_atr': True, 'sideways_use_adx': False, 'sideways_use_spike': False, 'sideways_rsi_required': True}.
[I 2025-08-30 20:01:13,474] Trial 809 finished with values: [-1000000000.0, 1000000000.0] and parameters: {'p_sma': 11, 'p_std': 29, 'p_atr': 23, 'p_adx': 19, 'rsi_period': 11, 'ema1': 19, 'ema2': 34, 'slip_atr_k': 0.06082106720751723, 'slip_spread_k': 0.8411720985725886, 'spread_hl_frac': 0.024540693301183823, 'bb_std_mult': 2.3079561187293094, 'rsi_os': 52, 'rsi_ob': 85, 'vol_spike': 0.2622475831418842, 'adx_thresh': 33.289095698213465, 'atr_min_pct': 0.023592297648303378, 'atr_max_pct': 0.09399593025734207, 'tp_mult': 2.7855067794280886, 'tsl_mult': 0.854345610515862, 'strategy': 'mean_reversion', 'time_stop': 252, 'use_sma': False, 'use_atr': True, 'use_adx': True, 'use_ema': False, 'use_spike': True, 'rsi_required': False, 'edge_k': 0.7775392592905314, 'edge_cap': 0.5431668270173553, 'bull_strategy': 'mean_reversion', 'bull_bb_std_mult': 3.2192937328433295, 'bull_rsi_os': 8, 'bull_rsi_ob': 48, 'bull_adx_thresh': 30.820928577047958, 'bull_atr_min_pct': 0.01973720322558002, 'bull_atr_max_pct': 0.01541209245598879, 'bull_tp_mult': 2.9994445200552646, 'bull_tsl_mult': 0.16516817196179695, 'bull_time_stop': 75, 'bull_use_sma': False, 'bull_use_ema': True, 'bull_use_atr': True, 'bull_use_adx': False, 'bull_use_spike': False, 'bull_rsi_required': True, 'bear_strategy': 'breakout', 'bear_bb_std_mult': 2.045510055008207, 'bear_rsi_os': 48, 'bear_rsi_ob': 77, 'bear_adx_thresh': 26.48477206111632, 'bear_atr_min_pct': 0.003592932156827563, 'bear_atr_max_pct': 0.03028225996808091, 'bear_tp_mult': 2.8561307807744445, 'bear_tsl_mult': 0.3093214327137913, 'bear_time_stop': 235, 'bear_use_sma': True, 'bear_use_ema': True, 'bear_use_atr': True, 'bear_use_adx': False, 'bear_use_spike': False, 'bear_rsi_required': False, 'sideways_strategy': 'breakout', 'sideways_bb_std_mult': 3.0117353218078984, 'sideways_rsi_os': 52, 'sideways_rsi_ob': 61, 'sideways_adx_thresh': 30.688615378510676, 'sideways_atr_min_pct': 0.00461128587935722, 'sideways_atr_max_pct': 0.14297415089288373, 'sideways_tp_mult': 1.0746820998091238, 'sideways_tsl_mult': 0.9544429806609852, 'sideways_time_stop': 162, 'sideways_use_sma': False, 'sideways_use_ema': True, 'sideways_use_atr': True, 'sideways_use_adx': False, 'sideways_use_spike': False, 'sideways_rsi_required': True}.
[I 2025-08-30 20:01:45,254] Trial 808 finished with values: [-0.127649008551194, 0.12759400904136387] and parameters: {'p_sma': 24, 'p_std': 10, 'p_atr': 26, 'p_adx': 19, 'rsi_period': 14, 'ema1': 26, 'ema2': 34, 'slip_atr_k': 0.061437466320753795, 'slip_spread_k': 0.8654529177118224, 'spread_hl_frac': 0.025586866627976355, 'bb_std_mult': 2.826014072437768, 'rsi_os': 36, 'rsi_ob': 69, 'vol_spike': 0.14201448783783754, 'adx_thresh': 33.246847563257354, 'atr_min_pct': 0.026008625350982445, 'atr_max_pct': 0.09484353442611843, 'tp_mult': 2.3469118578015893, 'tsl_mult': 0.8474635507777569, 'strategy': 'mean_reversion', 'time_stop': 253, 'use_sma': False, 'use_atr': True, 'use_adx': True, 'use_ema': False, 'use_spike': True, 'rsi_required': False, 'edge_k': 0.7725494579357983, 'edge_cap': 0.5408681863756419, 'bull_strategy': 'mean_reversion', 'bull_bb_std_mult': 3.027911307570149, 'bull_rsi_os': 50, 'bull_rsi_ob': 48, 'bull_adx_thresh': 17.77290950775822, 'bull_atr_min_pct': 0.0018128583179732882, 'bull_atr_max_pct': 0.12267618267151803, 'bull_tp_mult': 2.125789808735652, 'bull_tsl_mult': 0.7062693967912163, 'bull_time_stop': 267, 'bull_use_sma': False, 'bull_use_ema': True, 'bull_use_atr': True, 'bull_use_adx': False, 'bull_use_spike': False, 'bull_rsi_required': True, 'bear_strategy': 'breakout', 'bear_bb_std_mult': 2.083153992044084, 'bear_rsi_os': 53, 'bear_rsi_ob': 72, 'bear_adx_thresh': 6.95618545227617, 'bear_atr_min_pct': 0.013984434542308752, 'bear_atr_max_pct': 0.03866433298141099, 'bear_tp_mult': 2.683498492483177, 'bear_tsl_mult': 0.7842357274614313, 'bear_time_stop': 60, 'bear_use_sma': True, 'bear_use_ema': True, 'bear_use_atr': False, 'bear_use_adx': False, 'bear_use_spike': False, 'bear_rsi_required': True, 'sideways_strategy': 'breakout', 'sideways_bb_std_mult': 3.0176030043884166, 'sideways_rsi_os': 38, 'sideways_rsi_ob': 58, 'sideways_adx_thresh': 22.067803268850067, 'sideways_atr_min_pct': 0.00062877192556742, 'sideways_atr_max_pct': 0.05336104116363277, 'sideways_tp_mult': 1.010969633040116, 'sideways_tsl_mult': 0.9523620277731302, 'sideways_time_stop': 274, 'sideways_use_sma': False, 'sideways_use_ema': True, 'sideways_use_atr': True, 'sideways_use_adx': False, 'sideways_use_spike': False, 'sideways_rsi_required': True}.
