[I 2025-08-30 19:42:38,082] Trial 638 finished with values: [-0.022157188584447485, 0.022087459351702046] and parameters: {'p_sma': 7, 'p_std': 31, 'p_atr': 9, 'p_adx': 21, 'rsi_period': 21, 'ema1': 26, 'ema2': 34, 'slip_atr_k': 0.0764921485361845, 'slip_spread_k': 0.14314702047124506, 'spread_hl_frac': 0.021039110423583585, 'bb_std_mult': 0.6093990455605234, 'rsi_os': 47, 'rsi_ob': 56, 'vol_spike': 0.2500233373386723, 'adx_thresh': 33.24947307916352, 'atr_min_pct': 0.022034130398980126, 'atr_max_pct': 0.11701904304584895, 'tp_mult': 1.4856687716354187, 'tsl_mult': 0.9258809567447549, 'strategy': 'mean_reversion', 'time_stop': 188, 'use_sma': True, 'use_atr': True, 'use_adx': True, 'use_ema': False, 'use_spike': True, 'rsi_required': True, 'edge_k': 1.9415435133425825, 'edge_cap': 0.4003849313914487, 'bull_strategy': 'breakout', 'bull_bb_std_mult': 3.037268190077476, 'bull_rsi_os': 29, 'bull_rsi_ob': 45, 'bull_adx_thresh': 19.236485377204648, 'bull_atr_min_pct': 0.01629487892945016, 'bull_atr_max_pct': 0.08219563767492806, 'bull_tp_mult': 1.8512622006426669, 'bull_tsl_mult': 0.5104264514993773, 'bull_time_stop': 204, 'bull_use_sma': False, 'bull_use_ema': False, 'bull_use_atr': True, 'bull_use_adx': True, 'bull_use_spike': True, 'bull_rsi_required': False, 'bear_strategy': 'breakout', 'bear_bb_std_mult': 3.0889952819747246, 'bear_rsi_os': 45, 'bear_rsi_ob': 76, 'bear_adx_thresh': 19.491019625653998, 'bear_atr_min_pct': 0.015133382286482191, 'bear_atr_max_pct': 0.03744988963005228, 'bear_tp_mult': 2.300617714529023, 'bear_tsl_mult': 0.7681367279635604, 'bear_time_stop': 149, 'bear_use_sma': True, 'bear_use_ema': False, 'bear_use_atr': False, 'bear_use_adx': False, 'bear_use_spike': True, 'bear_rsi_required': True, 'sideways_strategy': 'breakout', 'sideways_bb_std_mult': 3.3641160598686173, 'sideways_rsi_os': 38, 'sideways_rsi_ob': 56, 'sideways_adx_thresh': 19.933691884153408, 'sideways_atr_min_pct': 0.0018107519343117026, 'sideways_atr_max_pct': 0.1499278211283657, 'sideways_tp_mult': 1.0830944815537786, 'sideways_tsl_mult': 0.8890717368867243, 'sideways_time_stop': 137, 'sideways_use_sma': False, 'sideways_use_ema': False, 'sideways_use_atr': False, 'sideways_use_adx': False, 'sideways_use_spike': True, 'sideways_rsi_required': False}.
[I 2025-08-30 19:42:38,225] Trial 637 finished with values: [-0.09358919476629923, 0.09383596018566506] and parameters: {'p_sma': 7, 'p_std': 30, 'p_atr': 7, 'p_adx': 26, 'rsi_period': 21, 'ema1': 26, 'ema2': 16, 'slip_atr_k': 0.13592176490598556, 'slip_spread_k': 0.17637737613088528, 'spread_hl_frac': 0.047479933764693484, 'bb_std_mult': 2.212248997534666, 'rsi_os': 47, 'rsi_ob': 58, 'vol_spike': 0.25743863288845414, 'adx_thresh': 33.252546813800805, 'atr_min_pct': 0.02195536799857154, 'atr_max_pct': 0.0852766038580299, 'tp_mult': 1.4477162897464741, 'tsl_mult': 0.926062745432019, 'strategy': 'mean_reversion', 'time_stop': 165, 'use_sma': True, 'use_atr': False, 'use_adx': True, 'use_ema': False, 'use_spike': True, 'rsi_required': False, 'edge_k': 0.6731031562862937, 'edge_cap': 0.635146417462778, 'bull_strategy': 'breakout', 'bull_bb_std_mult': 2.9973533702134683, 'bull_rsi_os': 27, 'bull_rsi_ob': 75, 'bull_adx_thresh': 19.19249134135983, 'bull_atr_min_pct': 0.0007235601773173737, 'bull_atr_max_pct': 0.1220680113958655, 'bull_tp_mult': 1.8447570804733016, 'bull_tsl_mult': 0.489630660867944, 'bull_time_stop': 168, 'bull_use_sma': True, 'bull_use_ema': False, 'bull_use_atr': True, 'bull_use_adx': False, 'bull_use_spike': True, 'bull_rsi_required': True, 'bear_strategy': 'breakout', 'bear_bb_std_mult': 2.851645515645311, 'bear_rsi_os': 15, 'bear_rsi_ob': 48, 'bear_adx_thresh': 28.871879203235004, 'bear_atr_min_pct': 0.01712823582050627, 'bear_atr_max_pct': 0.028882159456254174, 'bear_tp_mult': 2.635913566395157, 'bear_tsl_mult': 0.30333054382928043, 'bear_time_stop': 150, 'bear_use_sma': False, 'bear_use_ema': True, 'bear_use_atr': False, 'bear_use_adx': False, 'bear_use_spike': False, 'bear_rsi_required': True, 'sideways_strategy': 'breakout', 'sideways_bb_std_mult': 2.6743704291941657, 'sideways_rsi_os': 37, 'sideways_rsi_ob': 56, 'sideways_adx_thresh': 7.136003615291777, 'sideways_atr_min_pct': 6.696335763214977e-05, 'sideways_atr_max_pct': 0.14371052648454008, 'sideways_tp_mult': 1.6028573364298984, 'sideways_tsl_mult': 0.8535379101669333, 'sideways_time_stop': 149, 'sideways_use_sma': False, 'sideways_use_ema': False, 'sideways_use_atr': False, 'sideways_use_adx': False, 'sideways_use_spike': True, 'sideways_rsi_required': True}.
[I 2025-08-30 19:42:39,016] Trial 644 finished with values: [-1000000000.0, 1000000000.0] and parameters: {'p_sma': 8, 'p_std': 60, 'p_atr': 9, 'p_adx': 18, 'rsi_period': 34, 'ema1': 25, 'ema2': 39, 'slip_atr_k': 0.10754298646748861, 'slip_spread_k': 0.1444409007941572, 'spread_hl_frac': 0.03691286743597133, 'bb_std_mult': 2.0898098188333765, 'rsi_os': 48, 'rsi_ob': 49, 'vol_spike': 0.26634126488893806, 'adx_thresh': 31.49203357989581, 'atr_min_pct': 0.02533837655646995, 'atr_max_pct': 0.09175141834700554, 'tp_mult': 1.129733637704653, 'tsl_mult': 0.16835894249081973, 'strategy': 'mean_reversion', 'time_stop': 178, 'use_sma': False, 'use_atr': True, 'use_adx': True, 'use_ema': False, 'use_spike': True, 'rsi_required': False, 'edge_k': 1.3351910814573646, 'edge_cap': 0.5150637560129092, 'bull_strategy': 'mean_reversion', 'bull_bb_std_mult': 3.097347382604023, 'bull_rsi_os': 30, 'bull_rsi_ob': 94, 'bull_adx_thresh': 5.801409623474841, 'bull_atr_min_pct': 0.008535442284859609, 'bull_atr_max_pct': 0.11774296633543026, 'bull_tp_mult': 2.742858947538033, 'bull_tsl_mult': 0.7704923470565515, 'bull_time_stop': 174, 'bull_use_sma': False, 'bull_use_ema': True, 'bull_use_atr': True, 'bull_use_adx': False, 'bull_use_spike': False, 'bull_rsi_required': True, 'bear_strategy': 'breakout', 'bear_bb_std_mult': 2.7650142600465095, 'bear_rsi_os': 23, 'bear_rsi_ob': 74, 'bear_adx_thresh': 18.25133957315587, 'bear_atr_min_pct': 0.014158780589037, 'bear_atr_max_pct': 0.11515802116246866, 'bear_tp_mult': 2.6984134706951326, 'bear_tsl_mult': 0.747394503188811, 'bear_time_stop': 227, 'bear_use_sma': True, 'bear_use_ema': True, 'bear_use_atr': False, 'bear_use_adx': False, 'bear_use_spike': False, 'bear_rsi_required': True, 'sideways_strategy': 'breakout', 'sideways_bb_std_mult': 3.1245500327124054, 'sideways_rsi_os': 13, 'sideways_rsi_ob': 58, 'sideways_adx_thresh': 27.055585628302687, 'sideways_atr_min_pct': 0.003134892656690161, 'sideways_atr_max_pct': 0.050025648957089025, 'sideways_tp_mult': 2.332032577612904, 'sideways_tsl_mult': 0.7219636360961539, 'sideways_time_stop': 98, 'sideways_use_sma': False, 'sideways_use_ema': True, 'sideways_use_atr': True, 'sideways_use_adx': False, 'sideways_use_spike': False, 'sideways_rsi_required': True}.
[I 2025-08-30 19:43:12,276] Trial 643 finished with values: [-1000000000.0, 1000000000.0] and parameters: {'p_sma': 7, 'p_std': 34, 'p_atr': 9, 'p_adx': 17, 'rsi_period': 21, 'ema1': 19, 'ema2': 32, 'slip_atr_k': 0.01140508226096236, 'slip_spread_k': 0.42989227772927485, 'spread_hl_frac': 0.01741903384125399, 'bb_std_mult': 2.38330029879609, 'rsi_os': 48, 'rsi_ob': 84, 'vol_spike': 0.2651537549346639, 'adx_thresh': 13.705419351150194, 'atr_min_pct': 0.006646484118227592, 'atr_max_pct': 0.06661275039013834, 'tp_mult': 1.7926089126397027, 'tsl_mult': 0.16773003733122543, 'strategy': 'mean_reversion', 'time_stop': 178, 'use_sma': False, 'use_atr': True, 'use_adx': True, 'use_ema': False, 'use_spike': True, 'rsi_required': False, 'edge_k': 1.4401830902476125, 'edge_cap': 0.4753150211561192, 'bull_strategy': 'mean_reversion', 'bull_bb_std_mult': 3.1126313625129334, 'bull_rsi_os': 30, 'bull_rsi_ob': 47, 'bull_adx_thresh': 18.5152276004771, 'bull_atr_min_pct': 0.0032813320349595974, 'bull_atr_max_pct': 0.11738260100815624, 'bull_tp_mult': 2.7242793579205875, 'bull_tsl_mult': 0.5191350712807795, 'bull_time_stop': 243, 'bull_use_sma': False, 'bull_use_ema': True, 'bull_use_atr': True, 'bull_use_adx': False, 'bull_use_spike': False, 'bull_rsi_required': True, 'bear_strategy': 'breakout', 'bear_bb_std_mult': 2.7617098857426514, 'bear_rsi_os': 51, 'bear_rsi_ob': 66, 'bear_adx_thresh': 31.670248711528913, 'bear_atr_min_pct': 0.012639962715932642, 'bear_atr_max_pct': 0.07145209748323308, 'bear_tp_mult': 2.703805223778029, 'bear_tsl_mult': 0.7472539657507486, 'bear_time_stop': 227, 'bear_use_sma': True, 'bear_use_ema': True, 'bear_use_atr': False, 'bear_use_adx': False, 'bear_use_spike': False, 'bear_rsi_required': True, 'sideways_strategy': 'breakout', 'sideways_bb_std_mult': 3.1414837069926635, 'sideways_rsi_os': 47, 'sideways_rsi_ob': 77, 'sideways_adx_thresh': 6.970235341439361, 'sideways_atr_min_pct': 0.003142684804767632, 'sideways_atr_max_pct': 0.05143344169303463, 'sideways_tp_mult': 1.2536719842288044, 'sideways_tsl_mult': 0.7280721871814657, 'sideways_time_stop': 148, 'sideways_use_sma': False, 'sideways_use_ema': True, 'sideways_use_atr': True, 'sideways_use_adx': False, 'sideways_use_spike': False, 'sideways_rsi_required': True}.
[I 2025-08-30 19:43:12,572] Trial 642 finished with values: [-1000000000.0, 1000000000.0] and parameters: {'p_sma': 16, 'p_std': 23, 'p_atr': 9, 'p_adx': 19, 'rsi_period': 46, 'ema1': 21, 'ema2': 49, 'slip_atr_k': 0.009855573315469712, 'slip_spread_k': 0.14193975038737053, 'spread_hl_frac': 0.0321539797873356, 'bb_std_mult': 2.8814912242051203, 'rsi_os': 48, 'rsi_ob': 84, 'vol_spike': 0.26551476203487967, 'adx_thresh': 31.67071873716068, 'atr_min_pct': 0.021986182851982488, 'atr_max_pct': 0.11138481680476661, 'tp_mult': 2.062608203395184, 'tsl_mult': 0.838128006733835, 'strategy': 'mean_reversion', 'time_stop': 176, 'use_sma': True, 'use_atr': True, 'use_adx': True, 'use_ema': False, 'use_spike': True, 'rsi_required': True, 'edge_k': 1.943782294832579, 'edge_cap': 0.5515332585066431, 'bull_strategy': 'breakout', 'bull_bb_std_mult': 3.1129050152404907, 'bull_rsi_os': 29, 'bull_rsi_ob': 93, 'bull_adx_thresh': 18.56373680610839, 'bull_atr_min_pct': 0.009089326452071188, 'bull_atr_max_pct': 0.11824253420688421, 'bull_tp_mult': 2.998605902110372, 'bull_tsl_mult': 0.513774600248966, 'bull_time_stop': 172, 'bull_use_sma': False, 'bull_use_ema': True, 'bull_use_atr': True, 'bull_use_adx': True, 'bull_use_spike': False, 'bull_rsi_required': False, 'bear_strategy': 'breakout', 'bear_bb_std_mult': 2.8637780425941086, 'bear_rsi_os': 54, 'bear_rsi_ob': 62, 'bear_adx_thresh': 5.724591810548885, 'bear_atr_min_pct': 0.004088158889254432, 'bear_atr_max_pct': 0.10414010698429664, 'bear_tp_mult': 2.2900046086716026, 'bear_tsl_mult': 0.7529592022150399, 'bear_time_stop': 195, 'bear_use_sma': True, 'bear_use_ema': False, 'bear_use_atr': False, 'bear_use_adx': False, 'bear_use_spike': False, 'bear_rsi_required': True, 'sideways_strategy': 'breakout', 'sideways_bb_std_mult': 3.143239062148237, 'sideways_rsi_os': 9, 'sideways_rsi_ob': 77, 'sideways_adx_thresh': 7.860241654233505, 'sideways_atr_min_pct': 0.0019496242214254813, 'sideways_atr_max_pct': 0.0222139191793021, 'sideways_tp_mult': 1.0490306049880966, 'sideways_tsl_mult': 0.3163059525155527, 'sideways_time_stop': 258, 'sideways_use_sma': False, 'sideways_use_ema': True, 'sideways_use_atr': True, 'sideways_use_adx': False, 'sideways_use_spike': False, 'sideways_rsi_required': True}.
[I 2025-08-30 19:43:12,690] Trial 641 finished with values: [-1000000000.0, 1000000000.0] and parameters: {'p_sma': 8, 'p_std': 54, 'p_atr': 9, 'p_adx': 10, 'rsi_period': 49, 'ema1': 26, 'ema2': 32, 'slip_atr_k': 0.011929462395285792, 'slip_spread_k': 0.14414042799503124, 'spread_hl_frac': 0.047124579348658845, 'bb_std_mult': 2.706593393072729, 'rsi_os': 48, 'rsi_ob': 84, 'vol_spike': 0.26723047257207994, 'adx_thresh': 34.96840901147687, 'atr_min_pct': 0.02225574010223079, 'atr_max_pct': 0.08617999118437915, 'tp_mult': 2.550366342666775, 'tsl_mult': 0.8907301594669322, 'strategy': 'mean_reversion', 'time_stop': 187, 'use_sma': True, 'use_atr': False, 'use_adx': True, 'use_ema': False, 'use_spike': True, 'rsi_required': True, 'edge_k': 0.09621415917549034, 'edge_cap': 0.5378324990760158, 'bull_strategy': 'breakout', 'bull_bb_std_mult': 2.992387793506091, 'bull_rsi_os': 27, 'bull_rsi_ob': 93, 'bull_adx_thresh': 19.133424902607256, 'bull_atr_min_pct': 0.003362895235246856, 'bull_atr_max_pct': 0.11723747138102256, 'bull_tp_mult': 2.663625902636716, 'bull_tsl_mult': 0.5138324617066646, 'bull_time_stop': 242, 'bull_use_sma': True, 'bull_use_ema': True, 'bull_use_atr': True, 'bull_use_adx': True, 'bull_use_spike': True, 'bull_rsi_required': False, 'bear_strategy': 'breakout', 'bear_bb_std_mult': 2.8707918933038585, 'bear_rsi_os': 22, 'bear_rsi_ob': 76, 'bear_adx_thresh': 16.963638286530408, 'bear_atr_min_pct': 0.0058300338143900746, 'bear_atr_max_pct': 0.11790995504778802, 'bear_tp_mult': 2.705080497468555, 'bear_tsl_mult': 0.7511874511911395, 'bear_time_stop': 228, 'bear_use_sma': True, 'bear_use_ema': False, 'bear_use_atr': False, 'bear_use_adx': False, 'bear_use_spike': True, 'bear_rsi_required': True, 'sideways_strategy': 'breakout', 'sideways_bb_std_mult': 2.194247636248867, 'sideways_rsi_os': 11, 'sideways_rsi_ob': 57, 'sideways_adx_thresh': 20.46641440895264, 'sideways_atr_min_pct': 3.576806744871874e-05, 'sideways_atr_max_pct': 0.0532546140574977, 'sideways_tp_mult': 1.865664700940155, 'sideways_tsl_mult': 0.8980305107027134, 'sideways_time_stop': 244, 'sideways_use_sma': False, 'sideways_use_ema': False, 'sideways_use_atr': True, 'sideways_use_adx': False, 'sideways_use_spike': False, 'sideways_rsi_required': False}.
[I 2025-08-30 19:43:13,851] Trial 645 finished with values: [-1000000000.0, 1000000000.0] and parameters: {'p_sma': 15, 'p_std': 35, 'p_atr': 9, 'p_adx': 15, 'rsi_period': 46, 'ema1': 25, 'ema2': 56, 'slip_atr_k': 0.06294972427109026, 'slip_spread_k': 0.43206816417047195, 'spread_hl_frac': 0.03577692706016403, 'bb_std_mult': 2.3962124901098747, 'rsi_os': 46, 'rsi_ob': 84, 'vol_spike': 0.1937655774538432, 'adx_thresh': 34.9755071140463, 'atr_min_pct': 0.02477372940850443, 'atr_max_pct': 0.09517610264689547, 'tp_mult': 2.3066779684268277, 'tsl_mult': 0.8915686069260595, 'strategy': 'mean_reversion', 'time_stop': 52, 'use_sma': False, 'use_atr': True, 'use_adx': True, 'use_ema': False, 'use_spike': True, 'rsi_required': False, 'edge_k': 1.4483268462930052, 'edge_cap': 0.34771864690222576, 'bull_strategy': 'mean_reversion', 'bull_bb_std_mult': 3.1479499869735124, 'bull_rsi_os': 33, 'bull_rsi_ob': 47, 'bull_adx_thresh': 18.17927921631631, 'bull_atr_min_pct': 0.025676373357812265, 'bull_atr_max_pct': 0.1171950849859772, 'bull_tp_mult': 1.4675092255857634, 'bull_tsl_mult': 0.39096659227875863, 'bull_time_stop': 173, 'bull_use_sma': False, 'bull_use_ema': True, 'bull_use_atr': True, 'bull_use_adx': False, 'bull_use_spike': False, 'bull_rsi_required': False, 'bear_strategy': 'breakout', 'bear_bb_std_mult': 3.0160571271862127, 'bear_rsi_os': 51, 'bear_rsi_ob': 78, 'bear_adx_thresh': 30.525791252215818, 'bear_atr_min_pct': 0.01524819546753729, 'bear_atr_max_pct': 0.10241554751817769, 'bear_tp_mult': 2.7152030176312674, 'bear_tsl_mult': 0.07618398251785047, 'bear_time_stop': 195, 'bear_use_sma': True, 'bear_use_ema': True, 'bear_use_atr': False, 'bear_use_adx': False, 'bear_use_spike': False, 'bear_rsi_required': False, 'sideways_strategy': 'breakout', 'sideways_bb_std_mult': 3.0337528351635044, 'sideways_rsi_os': 47, 'sideways_rsi_ob': 60, 'sideways_adx_thresh': 21.90971818962352, 'sideways_atr_min_pct': 0.004864710188796849, 'sideways_atr_max_pct': 0.13675931968407828, 'sideways_tp_mult': 1.8695191532792486, 'sideways_tsl_mult': 0.5454335028698059, 'sideways_time_stop': 59, 'sideways_use_sma': False, 'sideways_use_ema': True, 'sideways_use_atr': True, 'sideways_use_adx': True, 'sideways_use_spike': False, 'sideways_rsi_required': True}.
[I 2025-08-30 19:43:49,188] Trial 648 finished with values: [-1000000000.0, 1000000000.0] and parameters: {'p_sma': 34, 'p_std': 32, 'p_atr': 9, 'p_adx': 20, 'rsi_period': 79, 'ema1': 18, 'ema2': 10, 'slip_atr_k': 0.06293856858964053, 'slip_spread_k': 0.19065695022335943, 'spread_hl_frac': 0.007672808473654008, 'bb_std_mult': 2.1660108229826647, 'rsi_os': 46, 'rsi_ob': 87, 'vol_spike': 0.19298654687361907, 'adx_thresh': 32.619493942198986, 'atr_min_pct': 0.004259846211960698, 'atr_max_pct': 0.09682995119991775, 'tp_mult': 2.1836357124592123, 'tsl_mult': 0.8109054781103584, 'strategy': 'breakout', 'time_stop': 28, 'use_sma': False, 'use_atr': True, 'use_adx': True, 'use_ema': True, 'use_spike': True, 'rsi_required': False, 'edge_k': 0.22872137339090193, 'edge_cap': 0.1194961351782029, 'bull_strategy': 'mean_reversion', 'bull_bb_std_mult': 3.167805238161472, 'bull_rsi_os': 33, 'bull_rsi_ob': 45, 'bull_adx_thresh': 16.6552218370209, 'bull_atr_min_pct': 0.010746718471833682, 'bull_atr_max_pct': 0.12611622572520773, 'bull_tp_mult': 2.830307166646303, 'bull_tsl_mult': 0.38931611962425006, 'bull_time_stop': 177, 'bull_use_sma': False, 'bull_use_ema': True, 'bull_use_atr': False, 'bull_use_adx': False, 'bull_use_spike': False, 'bull_rsi_required': True, 'bear_strategy': 'breakout', 'bear_bb_std_mult': 2.432009385738924, 'bear_rsi_os': 8, 'bear_rsi_ob': 95, 'bear_adx_thresh': 30.296417471462554, 'bear_atr_min_pct': 0.015805501195641634, 'bear_atr_max_pct': 0.04181605931253597, 'bear_tp_mult': 1.433829607730619, 'bear_tsl_mult': 0.45427935550212406, 'bear_time_stop': 209, 'bear_use_sma': True, 'bear_use_ema': True, 'bear_use_atr': True, 'bear_use_adx': True, 'bear_use_spike': False, 'bear_rsi_required': False, 'sideways_strategy': 'breakout', 'sideways_bb_std_mult': 2.9044248523969256, 'sideways_rsi_os': 15, 'sideways_rsi_ob': 81, 'sideways_adx_thresh': 21.771779141459223, 'sideways_atr_min_pct': 0.004988906054407818, 'sideways_atr_max_pct': 0.06313882521205888, 'sideways_tp_mult': 2.6535120851170233, 'sideways_tsl_mult': 0.9322372040100109, 'sideways_time_stop': 58, 'sideways_use_sma': False, 'sideways_use_ema': True, 'sideways_use_atr': True, 'sideways_use_adx': True, 'sideways_use_spike': False, 'sideways_rsi_required': True}.
[I 2025-08-30 19:43:49,294] Trial 647 finished with values: [-0.020566155437956146, 0.02046364488799266] and parameters: {'p_sma': 12, 'p_std': 35, 'p_atr': 9, 'p_adx': 27, 'rsi_period': 19, 'ema1': 9, 'ema2': 30, 'slip_atr_k': 0.09012614704419301, 'slip_spread_k': 0.1893764762503211, 'spread_hl_frac': 0.049848731434539606, 'bb_std_mult': 1.4406090685653072, 'rsi_os': 46, 'rsi_ob': 79, 'vol_spike': 0.11747742441292751, 'adx_thresh': 5.957157105631833, 'atr_min_pct': 0.024741463497312845, 'atr_max_pct': 0.09586441701062214, 'tp_mult': 2.2634922042316976, 'tsl_mult': 0.8902893192801564, 'strategy': 'mean_reversion', 'time_stop': 194, 'use_sma': False, 'use_atr': True, 'use_adx': True, 'use_ema': True, 'use_spike': False, 'rsi_required': False, 'edge_k': 0.5147651931717354, 'edge_cap': 0.35728330186366775, 'bull_strategy': 'mean_reversion', 'bull_bb_std_mult': 3.1602753529238474, 'bull_rsi_os': 34, 'bull_rsi_ob': 84, 'bull_adx_thresh': 25.38294655030073, 'bull_atr_min_pct': 0.025305545750559294, 'bull_atr_max_pct': 0.08693700180352891, 'bull_tp_mult': 2.918552936868414, 'bull_tsl_mult': 0.17937071667655602, 'bull_time_stop': 278, 'bull_use_sma': True, 'bull_use_ema': True, 'bull_use_atr': False, 'bull_use_adx': False, 'bull_use_spike': False, 'bull_rsi_required': True, 'bear_strategy': 'breakout', 'bear_bb_std_mult': 1.9397556171030454, 'bear_rsi_os': 20, 'bear_rsi_ob': 60, 'bear_adx_thresh': 11.120231960759314, 'bear_atr_min_pct': 0.015295246317134694, 'bear_atr_max_pct': 0.03206740639000748, 'bear_tp_mult': 2.7174108042193077, 'bear_tsl_mult': 0.8013785565741167, 'bear_time_stop': 239, 'bear_use_sma': True, 'bear_use_ema': True, 'bear_use_atr': True, 'bear_use_adx': False, 'bear_use_spike': False, 'bear_rsi_required': False, 'sideways_strategy': 'breakout', 'sideways_bb_std_mult': 1.0528737995471777, 'sideways_rsi_os': 35, 'sideways_rsi_ob': 60, 'sideways_adx_thresh': 32.62976009548372, 'sideways_atr_min_pct': 0.0015272533968925459, 'sideways_atr_max_pct': 0.13697691889903765, 'sideways_tp_mult': 1.14277785577276, 'sideways_tsl_mult': 0.9746555589593408, 'sideways_time_stop': 127, 'sideways_use_sma': False, 'sideways_use_ema': True, 'sideways_use_atr': True, 'sideways_use_adx': True, 'sideways_use_spike': False, 'sideways_rsi_required': True}.
