[I 2025-08-30 19:34:25,360] Trial 567 finished with values: [-1000000000.0, 1000000000.0] and parameters: {'p_sma': 28, 'p_std': 29, 'p_atr': 14, 'p_adx': 25, 'rsi_period': 39, 'ema1': 27, 'ema2': 30, 'slip_atr_k': 0.07350418377172864, 'slip_spread_k': 0.643067943829296, 'spread_hl_frac': 0.030659751128131366, 'bb_std_mult': 3.016081876632839, 'rsi_os': 49, 'rsi_ob': 85, 'vol_spike': 0.015304223256520921, 'adx_thresh': 34.36621522565745, 'atr_min_pct': 0.022899187256150765, 'atr_max_pct': 0.09215811653849387, 'tp_mult': 2.3293419676370335, 'tsl_mult': 0.7669907033564957, 'strategy': 'mean_reversion', 'time_stop': 246, 'use_sma': False, 'use_atr': True, 'use_adx': False, 'use_ema': False, 'use_spike': True, 'rsi_required': False, 'edge_k': 0.1471611955263764, 'edge_cap': 0.2598174801385743, 'bull_strategy': 'mean_reversion', 'bull_bb_std_mult': 2.800562827170693, 'bull_rsi_os': 13, 'bull_rsi_ob': 47, 'bull_adx_thresh': 18.356927952700538, 'bull_atr_min_pct': 0.0005758079364573123, 'bull_atr_max_pct': 0.12006588851926962, 'bull_tp_mult': 2.443769023085406, 'bull_tsl_mult': 0.23690193193848463, 'bull_time_stop': 259, 'bull_use_sma': False, 'bull_use_ema': True, 'bull_use_atr': False, 'bull_use_adx': False, 'bull_use_spike': False, 'bull_rsi_required': True, 'bear_strategy': 'mean_reversion', 'bear_bb_std_mult': 3.002907234731664, 'bear_rsi_os': 26, 'bear_rsi_ob': 56, 'bear_adx_thresh': 23.38587630670098, 'bear_atr_min_pct': 0.01932463629239789, 'bear_atr_max_pct': 0.08181807748059887, 'bear_tp_mult': 2.6478675202269204, 'bear_tsl_mult': 0.0625742799129464, 'bear_time_stop': 206, 'bear_use_sma': True, 'bear_use_ema': True, 'bear_use_atr': False, 'bear_use_adx': False, 'bear_use_spike': True, 'bear_rsi_required': True, 'sideways_strategy': 'breakout', 'sideways_bb_std_mult': 3.0678962174314997, 'sideways_rsi_os': 12, 'sideways_rsi_ob': 56, 'sideways_adx_thresh': 18.823958014203356, 'sideways_atr_min_pct': 0.0017001473752941655, 'sideways_atr_max_pct': 0.14997203532475273, 'sideways_tp_mult': 2.3498772238581567, 'sideways_tsl_mult': 0.9642280288996291, 'sideways_time_stop': 292, 'sideways_use_sma': True, 'sideways_use_ema': True, 'sideways_use_atr': True, 'sideways_use_adx': False, 'sideways_use_spike': False, 'sideways_rsi_required': False}.
[I 2025-08-30 19:34:26,260] Trial 568 finished with values: [-0.02098691870290803, 0.02091863928760517] and parameters: {'p_sma': 50, 'p_std': 29, 'p_atr': 10, 'p_adx': 25, 'rsi_period': 9, 'ema1': 27, 'ema2': 58, 'slip_atr_k': 0.07283917638147566, 'slip_spread_k': 0.9489953085855525, 'spread_hl_frac': 0.04523798536311353, 'bb_std_mult': 2.101532514602263, 'rsi_os': 49, 'rsi_ob': 55, 'vol_spike': 0.24665351580576209, 'adx_thresh': 34.47992894608124, 'atr_min_pct': 0.023218872262404825, 'atr_max_pct': 0.10311425227330968, 'tp_mult': 2.3277517487046984, 'tsl_mult': 0.17129748201033307, 'strategy': 'mean_reversion', 'time_stop': 179, 'use_sma': True, 'use_atr': True, 'use_adx': False, 'use_ema': False, 'use_spike': True, 'rsi_required': False, 'edge_k': 0.3048298830034934, 'edge_cap': 0.26566673036006083, 'bull_strategy': 'breakout', 'bull_bb_std_mult': 3.1467983125483436, 'bull_rsi_os': 30, 'bull_rsi_ob': 45, 'bull_adx_thresh': 25.75799410057372, 'bull_atr_min_pct': 0.0017202590869735907, 'bull_atr_max_pct': 0.12515148821588437, 'bull_tp_mult': 2.6824792760961595, 'bull_tsl_mult': 0.526319531663136, 'bull_time_stop': 110, 'bull_use_sma': False, 'bull_use_ema': True, 'bull_use_atr': True, 'bull_use_adx': False, 'bull_use_spike': False, 'bull_rsi_required': True, 'bear_strategy': 'mean_reversion', 'bear_bb_std_mult': 3.0150319936449264, 'bear_rsi_os': 53, 'bear_rsi_ob': 78, 'bear_adx_thresh': 13.907275462611578, 'bear_atr_min_pct': 0.016098470543862098, 'bear_atr_max_pct': 0.08231805538661269, 'bear_tp_mult': 1.3766554113314382, 'bear_tsl_mult': 0.32134510185594223, 'bear_time_stop': 206, 'bear_use_sma': True, 'bear_use_ema': True, 'bear_use_atr': False, 'bear_use_adx': False, 'bear_use_spike': True, 'bear_rsi_required': True, 'sideways_strategy': 'breakout', 'sideways_bb_std_mult': 3.377583253648172, 'sideways_rsi_os': 13, 'sideways_rsi_ob': 81, 'sideways_adx_thresh': 32.616955562456205, 'sideways_atr_min_pct': 0.0016661061843966287, 'sideways_atr_max_pct': 0.01036828373775163, 'sideways_tp_mult': 1.0520930283080827, 'sideways_tsl_mult': 0.9812485783697129, 'sideways_time_stop': 38, 'sideways_use_sma': True, 'sideways_use_ema': True, 'sideways_use_atr': True, 'sideways_use_adx': True, 'sideways_use_spike': False, 'sideways_rsi_required': True}.
[I 2025-08-30 19:34:27,024] Trial 569 finished with values: [-1000000000.0, 1000000000.0] and parameters: {'p_sma': 6, 'p_std': 29, 'p_atr': 10, 'p_adx': 20, 'rsi_period': 14, 'ema1': 27, 'ema2': 34, 'slip_atr_k': 0.0756257601971717, 'slip_spread_k': 0.21090227745726528, 'spread_hl_frac': 0.030653483303634717, 'bb_std_mult': 2.8971212895999576, 'rsi_os': 48, 'rsi_ob': 77, 'vol_spike': 0.015624850709112376, 'adx_thresh': 33.04881262881395, 'atr_min_pct': 0.022100657836361927, 'atr_max_pct': 0.09322724059106197, 'tp_mult': 2.310365878949333, 'tsl_mult': 0.03866232691893429, 'strategy': 'mean_reversion', 'time_stop': 179, 'use_sma': True, 'use_atr': True, 'use_adx': True, 'use_ema': False, 'use_spike': True, 'rsi_required': False, 'edge_k': 0.8455377653506988, 'edge_cap': 0.52762707751146, 'bull_strategy': 'breakout', 'bull_bb_std_mult': 3.1578996536733754, 'bull_rsi_os': 31, 'bull_rsi_ob': 46, 'bull_adx_thresh': 18.20692920015915, 'bull_atr_min_pct': 0.001845312245925717, 'bull_atr_max_pct': 0.12505441372201356, 'bull_tp_mult': 2.6820765799174238, 'bull_tsl_mult': 0.09250323854314607, 'bull_time_stop': 103, 'bull_use_sma': False, 'bull_use_ema': True, 'bull_use_atr': True, 'bull_use_adx': False, 'bull_use_spike': False, 'bull_rsi_required': False, 'bear_strategy': 'breakout', 'bear_bb_std_mult': 3.0005866885249617, 'bear_rsi_os': 42, 'bear_rsi_ob': 78, 'bear_adx_thresh': 7.743405414542263, 'bear_atr_min_pct': 0.019430415494122773, 'bear_atr_max_pct': 0.14725267733506897, 'bear_tp_mult': 2.670473031432561, 'bear_tsl_mult': 0.6682780549589061, 'bear_time_stop': 220, 'bear_use_sma': True, 'bear_use_ema': False, 'bear_use_atr': False, 'bear_use_adx': False, 'bear_use_spike': True, 'bear_rsi_required': True, 'sideways_strategy': 'breakout', 'sideways_bb_std_mult': 3.0577604088534467, 'sideways_rsi_os': 17, 'sideways_rsi_ob': 49, 'sideways_adx_thresh': 32.43403042850758, 'sideways_atr_min_pct': 0.0011821954139421102, 'sideways_atr_max_pct': 0.14999451549040765, 'sideways_tp_mult': 1.8502492462243019, 'sideways_tsl_mult': 0.9607787132659071, 'sideways_time_stop': 155, 'sideways_use_sma': True, 'sideways_use_ema': True, 'sideways_use_atr': True, 'sideways_use_adx': True, 'sideways_use_spike': False, 'sideways_rsi_required': True}.
[I 2025-08-30 19:34:27,850] Trial 570 finished with values: [-1000000000.0, 1000000000.0] and parameters: {'p_sma': 6, 'p_std': 29, 'p_atr': 14, 'p_adx': 19, 'rsi_period': 26, 'ema1': 27, 'ema2': 34, 'slip_atr_k': 0.062011606211577724, 'slip_spread_k': 0.10001776484800336, 'spread_hl_frac': 0.02101897490759469, 'bb_std_mult': 2.09125942607486, 'rsi_os': 51, 'rsi_ob': 55, 'vol_spike': 0.2494031177996888, 'adx_thresh': 32.837031756536135, 'atr_min_pct': 0.0037010164926289807, 'atr_max_pct': 0.09029944780711689, 'tp_mult': 2.419720860576401, 'tsl_mult': 0.4344229886037817, 'strategy': 'mean_reversion', 'time_stop': 179, 'use_sma': True, 'use_atr': True, 'use_adx': True, 'use_ema': False, 'use_spike': True, 'rsi_required': False, 'edge_k': 0.8493849629421644, 'edge_cap': 0.7000122122184504, 'bull_strategy': 'breakout', 'bull_bb_std_mult': 3.1446393470412777, 'bull_rsi_os': 25, 'bull_rsi_ob': 45, 'bull_adx_thresh': 25.795156233796007, 'bull_atr_min_pct': 0.0016676745137611771, 'bull_atr_max_pct': 0.12366078176862252, 'bull_tp_mult': 1.6410713117723459, 'bull_tsl_mult': 0.5361235355333979, 'bull_time_stop': 183, 'bull_use_sma': False, 'bull_use_ema': True, 'bull_use_atr': True, 'bull_use_adx': False, 'bull_use_spike': False, 'bull_rsi_required': False, 'bear_strategy': 'breakout', 'bear_bb_std_mult': 3.002649649646301, 'bear_rsi_os': 51, 'bear_rsi_ob': 63, 'bear_adx_thresh': 16.908180501501466, 'bear_atr_min_pct': 2.8437789291149013e-05, 'bear_atr_max_pct': 0.026107338315494222, 'bear_tp_mult': 2.661962985830607, 'bear_tsl_mult': 0.6703031153878263, 'bear_time_stop': 220, 'bear_use_sma': True, 'bear_use_ema': False, 'bear_use_atr': False, 'bear_use_adx': False, 'bear_use_spike': True, 'bear_rsi_required': True, 'sideways_strategy': 'breakout', 'sideways_bb_std_mult': 3.084481513696551, 'sideways_rsi_os': 17, 'sideways_rsi_ob': 58, 'sideways_adx_thresh': 10.22301650459806, 'sideways_atr_min_pct': 0.0032552580901904233, 'sideways_atr_max_pct': 0.0762320732869822, 'sideways_tp_mult': 1.5873319257295155, 'sideways_tsl_mult': 0.9837819158275185, 'sideways_time_stop': 38, 'sideways_use_sma': False, 'sideways_use_ema': True, 'sideways_use_atr': True, 'sideways_use_adx': True, 'sideways_use_spike': False, 'sideways_rsi_required': True}.
[I 2025-08-30 19:34:27,866] Trial 571 finished with values: [-1000000000.0, 1000000000.0] and parameters: {'p_sma': 18, 'p_std': 31, 'p_atr': 10, 'p_adx': 16, 'rsi_period': 9, 'ema1': 27, 'ema2': 33, 'slip_atr_k': 0.03613437578387302, 'slip_spread_k': 0.21930543121274718, 'spread_hl_frac': 0.040054528859872776, 'bb_std_mult': 1.915822646904991, 'rsi_os': 53, 'rsi_ob': 81, 'vol_spike': 0.24796628110901953, 'adx_thresh': 29.072229530745723, 'atr_min_pct': 0.02487777958195775, 'atr_max_pct': 0.09366209076907936, 'tp_mult': 1.4503726496214029, 'tsl_mult': 0.32615136952732615, 'strategy': 'mean_reversion', 'time_stop': 262, 'use_sma': True, 'use_atr': True, 'use_adx': True, 'use_ema': False, 'use_spike': True, 'rsi_required': False, 'edge_k': 0.03623033344452804, 'edge_cap': 0.41270711781943203, 'bull_strategy': 'breakout', 'bull_bb_std_mult': 1.554997454599384, 'bull_rsi_os': 8, 'bull_rsi_ob': 45, 'bull_adx_thresh': 24.872949187417912, 'bull_atr_min_pct': 0.0016976924170190267, 'bull_atr_max_pct': 0.12498142681403053, 'bull_tp_mult': 2.6968557404238167, 'bull_tsl_mult': 0.5353160827713117, 'bull_time_stop': 182, 'bull_use_sma': False, 'bull_use_ema': True, 'bull_use_atr': True, 'bull_use_adx': False, 'bull_use_spike': False, 'bull_rsi_required': False, 'bear_strategy': 'breakout', 'bear_bb_std_mult': 2.7625290909220843, 'bear_rsi_os': 51, 'bear_rsi_ob': 64, 'bear_adx_thresh': 11.213601765027036, 'bear_atr_min_pct': 0.014830742316724089, 'bear_atr_max_pct': 0.02855503506707777, 'bear_tp_mult': 2.698418532471529, 'bear_tsl_mult': 0.7700032888480095, 'bear_time_stop': 273, 'bear_use_sma': True, 'bear_use_ema': False, 'bear_use_atr': False, 'bear_use_adx': False, 'bear_use_spike': False, 'bear_rsi_required': True, 'sideways_strategy': 'breakout', 'sideways_bb_std_mult': 3.3971248886938783, 'sideways_rsi_os': 9, 'sideways_rsi_ob': 58, 'sideways_adx_thresh': 20.925587902259576, 'sideways_atr_min_pct': 0.003725237065404314, 'sideways_atr_max_pct': 0.07720451196271498, 'sideways_tp_mult': 1.0403956911687882, 'sideways_tsl_mult': 0.8905340768952306, 'sideways_time_stop': 253, 'sideways_use_sma': False, 'sideways_use_ema': True, 'sideways_use_atr': True, 'sideways_use_adx': True, 'sideways_use_spike': False, 'sideways_rsi_required': True}.
[I 2025-08-30 19:34:27,993] Trial 573 finished with values: [-1000000000.0, 1000000000.0] and parameters: {'p_sma': 8, 'p_std': 31, 'p_atr': 9, 'p_adx': 16, 'rsi_period': 20, 'ema1': 26, 'ema2': 33, 'slip_atr_k': 0.03664363277592586, 'slip_spread_k': 0.17032897624341647, 'spread_hl_frac': 0.023991697085028088, 'bb_std_mult': 2.0874725535729906, 'rsi_os': 51, 'rsi_ob': 55, 'vol_spike': 0.02978502570401817, 'adx_thresh': 17.228894073087726, 'atr_min_pct': 0.02478560629108815, 'atr_max_pct': 0.08961595232368795, 'tp_mult': 2.2430096211161055, 'tsl_mult': 0.8401626408070464, 'strategy': 'mean_reversion', 'time_stop': 262, 'use_sma': True, 'use_atr': True, 'use_adx': True, 'use_ema': False, 'use_spike': False, 'rsi_required': False, 'edge_k': 0.0523387101074648, 'edge_cap': 0.5053565803220949, 'bull_strategy': 'breakout', 'bull_bb_std_mult': 3.1428040096192067, 'bull_rsi_os': 34, 'bull_rsi_ob': 45, 'bull_adx_thresh': 19.762654724433137, 'bull_atr_min_pct': 0.005449501298823191, 'bull_atr_max_pct': 0.12398144488132949, 'bull_tp_mult': 2.6980702709047164, 'bull_tsl_mult': 0.5357267617718093, 'bull_time_stop': 192, 'bull_use_sma': True, 'bull_use_ema': True, 'bull_use_atr': True, 'bull_use_adx': True, 'bull_use_spike': False, 'bull_rsi_required': False, 'bear_strategy': 'breakout', 'bear_bb_std_mult': 2.7049811624377065, 'bear_rsi_os': 15, 'bear_rsi_ob': 63, 'bear_adx_thresh': 34.9320453665674, 'bear_atr_min_pct': 0.015051342007441165, 'bear_atr_max_pct': 0.05939158727050544, 'bear_tp_mult': 2.261950123239081, 'bear_tsl_mult': 0.7678990790139375, 'bear_time_stop': 196, 'bear_use_sma': False, 'bear_use_ema': False, 'bear_use_atr': False, 'bear_use_adx': False, 'bear_use_spike': False, 'bear_rsi_required': True, 'sideways_strategy': 'breakout', 'sideways_bb_std_mult': 3.2138473176532223, 'sideways_rsi_os': 38, 'sideways_rsi_ob': 77, 'sideways_adx_thresh': 20.961883361768614, 'sideways_atr_min_pct': 0.0035856663654345775, 'sideways_atr_max_pct': 0.14106283164497901, 'sideways_tp_mult': 1.3454369225307574, 'sideways_tsl_mult': 0.21594565686614203, 'sideways_time_stop': 91, 'sideways_use_sma': False, 'sideways_use_ema': True, 'sideways_use_atr': True, 'sideways_use_adx': False, 'sideways_use_spike': False, 'sideways_rsi_required': True}.
[I 2025-08-30 19:34:56,216] Trial 572 finished with values: [-0.022661539887599558, 0.022598449257395327] and parameters: {'p_sma': 40, 'p_std': 31, 'p_atr': 10, 'p_adx': 12, 'rsi_period': 26, 'ema1': 27, 'ema2': 55, 'slip_atr_k': 0.06211129257275616, 'slip_spread_k': 0.2155794089067147, 'spread_hl_frac': 0.04145781371435617, 'bb_std_mult': 1.9220402190200574, 'rsi_os': 47, 'rsi_ob': 55, 'vol_spike': 0.03096694995382704, 'adx_thresh': 32.926599593051215, 'atr_min_pct': 0.003772975577802748, 'atr_max_pct': 0.10311243697983376, 'tp_mult': 2.4129590119918323, 'tsl_mult': 0.3363674568469135, 'strategy': 'mean_reversion', 'time_stop': 218, 'use_sma': True, 'use_atr': True, 'use_adx': True, 'use_ema': False, 'use_spike': False, 'rsi_required': False, 'edge_k': 1.3768095088109242, 'edge_cap': 0.5264171648882742, 'bull_strategy': 'breakout', 'bull_bb_std_mult': 3.1544316366660614, 'bull_rsi_os': 31, 'bull_rsi_ob': 45, 'bull_adx_thresh': 24.825948069727676, 'bull_atr_min_pct': 0.0018181048444007252, 'bull_atr_max_pct': 0.12504404992161852, 'bull_tp_mult': 2.703615971069618, 'bull_tsl_mult': 0.5387461392159604, 'bull_time_stop': 193, 'bull_use_sma': True, 'bull_use_ema': True, 'bull_use_atr': True, 'bull_use_adx': False, 'bull_use_spike': False, 'bull_rsi_required': False, 'bear_strategy': 'breakout', 'bear_bb_std_mult': 2.7112972441485987, 'bear_rsi_os': 51, 'bear_rsi_ob': 78, 'bear_adx_thresh': 13.721088677854759, 'bear_atr_min_pct': 0.014766913792902844, 'bear_atr_max_pct': 0.028397613306875936, 'bear_tp_mult': 2.6692266991244367, 'bear_tsl_mult': 0.6772701794422393, 'bear_time_stop': 222, 'bear_use_sma': True, 'bear_use_ema': False, 'bear_use_atr': False, 'bear_use_adx': False, 'bear_use_spike': False, 'bear_rsi_required': True, 'sideways_strategy': 'breakout', 'sideways_bb_std_mult': 3.3502701193004407, 'sideways_rsi_os': 54, 'sideways_rsi_ob': 66, 'sideways_adx_thresh': 20.91514886500914, 'sideways_atr_min_pct': 0.0034633906306327173, 'sideways_atr_max_pct': 0.14076873233797543, 'sideways_tp_mult': 1.233305338545046, 'sideways_tsl_mult': 0.9791056559047934, 'sideways_time_stop': 152, 'sideways_use_sma': False, 'sideways_use_ema': True, 'sideways_use_atr': True, 'sideways_use_adx': True, 'sideways_use_spike': False, 'sideways_rsi_required': True}.
[I 2025-08-30 19:35:02,118] Trial 574 finished with values: [-0.035870927776145645, 0.035870881186613295] and parameters: {'p_sma': 8, 'p_std': 8, 'p_atr': 13, 'p_adx': 19, 'rsi_period': 20, 'ema1': 26, 'ema2': 33, 'slip_atr_k': 0.03609101254786891, 'slip_spread_k': 0.17557673719746789, 'spread_hl_frac': 0.0013128739912643891, 'bb_std_mult': 2.250035302071925, 'rsi_os': 25, 'rsi_ob': 58, 'vol_spike': 0.2608165430117564, 'adx_thresh': 34.95189714266152, 'atr_min_pct': 0.013001776879939185, 'atr_max_pct': 0.10363894225985895, 'tp_mult': 2.178577806828375, 'tsl_mult': 0.8334764888316002, 'strategy': 'mean_reversion', 'time_stop': 186, 'use_sma': False, 'use_atr': True, 'use_adx': True, 'use_ema': False, 'use_spike': False, 'rsi_required': False, 'edge_k': 0.29885362417630595, 'edge_cap': 0.4952959039097734, 'bull_strategy': 'mean_reversion', 'bull_bb_std_mult': 2.6701325786820087, 'bull_rsi_os': 32, 'bull_rsi_ob': 45, 'bull_adx_thresh': 21.956772181765164, 'bull_atr_min_pct': 0.0028757739039540833, 'bull_atr_max_pct': 0.11750860789852888, 'bull_tp_mult': 2.8180404731420277, 'bull_tsl_mult': 0.5219752438903456, 'bull_time_stop': 113, 'bull_use_sma': True, 'bull_use_ema': True, 'bull_use_atr': True, 'bull_use_adx': True, 'bull_use_spike': False, 'bull_rsi_required': True, 'bear_strategy': 'breakout', 'bear_bb_std_mult': 2.689026528276237, 'bear_rsi_os': 36, 'bear_rsi_ob': 75, 'bear_adx_thresh': 17.707289584354264, 'bear_atr_min_pct': 0.0016053324079544108, 'bear_atr_max_pct': 0.029457706982932867, 'bear_tp_mult': 1.3772520503559593, 'bear_tsl_mult': 0.764840119553161, 'bear_time_stop': 248, 'bear_use_sma': False, 'bear_use_ema': True, 'bear_use_atr': False, 'bear_use_adx': False, 'bear_use_spike': False, 'bear_rsi_required': True, 'sideways_strategy': 'mean_reversion', 'sideways_bb_std_mult': 3.3907875880956353, 'sideways_rsi_os': 22, 'sideways_rsi_ob': 81, 'sideways_adx_thresh': 21.002942793080585, 'sideways_atr_min_pct': 0.000731743972328548, 'sideways_atr_max_pct': 0.1408561262331774, 'sideways_tp_mult': 2.2026585043042872, 'sideways_tsl_mult': 0.9482519385094629, 'sideways_time_stop': 251, 'sideways_use_sma': False, 'sideways_use_ema': True, 'sideways_use_atr': True, 'sideways_use_adx': False, 'sideways_use_spike': False, 'sideways_rsi_required': True}.
[I 2025-08-30 19:35:02,309] Trial 575 finished with values: [-1000000000.0, 1000000000.0] and parameters: {'p_sma': 41, 'p_std': 35, 'p_atr': 9, 'p_adx': 13, 'rsi_period': 20, 'ema1': 26, 'ema2': 36, 'slip_atr_k': 0.09453232120409823, 'slip_spread_k': 0.16779354245900538, 'spread_hl_frac': 0.02386905267246031, 'bb_std_mult': 2.2663905401881905, 'rsi_os': 48, 'rsi_ob': 83, 'vol_spike': 0.2604203389206908, 'adx_thresh': 33.647947838183065, 'atr_min_pct': 0.023349950580698123, 'atr_max_pct': 0.09889877986477844, 'tp_mult': 2.2441083676069034, 'tsl_mult': 0.8473466074838106, 'strategy': 'breakout', 'time_stop': 187, 'use_sma': False, 'use_atr': False, 'use_adx': True, 'use_ema': False, 'use_spike': False, 'rsi_required': True, 'edge_k': 1.5254754691170753, 'edge_cap': 0.5062530838423139, 'bull_strategy': 'mean_reversion', 'bull_bb_std_mult': 0.7326714044709599, 'bull_rsi_os': 40, 'bull_rsi_ob': 63, 'bull_adx_thresh': 29.46277505168596, 'bull_atr_min_pct': 0.0238171940795227, 'bull_atr_max_pct': 0.11720022115604535, 'bull_tp_mult': 1.485791453040917, 'bull_tsl_mult': 0.556675443402013, 'bull_time_stop': 193, 'bull_use_sma': True, 'bull_use_ema': True, 'bull_use_atr': True, 'bull_use_adx': True, 'bull_use_spike': False, 'bull_rsi_required': True, 'bear_strategy': 'breakout', 'bear_bb_std_mult': 2.907775219850635, 'bear_rsi_os': 48, 'bear_rsi_ob': 77, 'bear_adx_thresh': 17.698751091002396, 'bear_atr_min_pct': 0.01511890734191429, 'bear_atr_max_pct': 0.08894898484762614, 'bear_tp_mult': 1.3489768181062238, 'bear_tsl_mult': 0.9131176830905332, 'bear_time_stop': 193, 'bear_use_sma': False, 'bear_use_ema': True, 'bear_use_atr': False, 'bear_use_adx': True, 'bear_use_spike': False, 'bear_rsi_required': True, 'sideways_strategy': 'mean_reversion', 'sideways_bb_std_mult': 2.3825311837486063, 'sideways_rsi_os': 14, 'sideways_rsi_ob': 74, 'sideways_adx_thresh': 17.027564426643696, 'sideways_atr_min_pct': 0.002501977148918193, 'sideways_atr_max_pct': 0.013536681570706019, 'sideways_tp_mult': 1.3471349904436238, 'sideways_tsl_mult': 0.9480214116794939, 'sideways_time_stop': 148, 'sideways_use_sma': False, 'sideways_use_ema': True, 'sideways_use_atr': True, 'sideways_use_adx': False, 'sideways_use_spike': True, 'sideways_rsi_required': True}.
