[I 2025-08-30 19:24:59,874] Trial 488 finished with values: [-0.02471082450840223, 0.024759620373760425] and parameters: {'p_sma': 48, 'p_std': 51, 'p_atr': 11, 'p_adx': 11, 'rsi_period': 24, 'ema1': 15, 'ema2': 46, 'slip_atr_k': 0.06937132688261925, 'slip_spread_k': 0.2976955788137976, 'spread_hl_frac': 0.02942493220234108, 'bb_std_mult': 2.1620061586677033, 'rsi_os': 49, 'rsi_ob': 82, 'vol_spike': 0.2734689804949442, 'adx_thresh': 31.98714666552829, 'atr_min_pct': 0.023940089291661353, 'atr_max_pct': 0.09214793425486369, 'tp_mult': 1.7087813991118925, 'tsl_mult': 0.38176795543056086, 'strategy': 'mean_reversion', 'time_stop': 214, 'use_sma': False, 'use_atr': True, 'use_adx': False, 'use_ema': True, 'use_spike': True, 'rsi_required': False, 'edge_k': 0.9988073415345183, 'edge_cap': 0.12968539368089838, 'bull_strategy': 'mean_reversion', 'bull_bb_std_mult': 3.0860788846480265, 'bull_rsi_os': 24, 'bull_rsi_ob': 91, 'bull_adx_thresh': 17.05170874935965, 'bull_atr_min_pct': 0.015769947588816027, 'bull_atr_max_pct': 0.11589139541674981, 'bull_tp_mult': 2.617037050018357, 'bull_tsl_mult': 0.5084171676951407, 'bull_time_stop': 268, 'bull_use_sma': False, 'bull_use_ema': False, 'bull_use_atr': False, 'bull_use_adx': False, 'bull_use_spike': True, 'bull_rsi_required': True, 'bear_strategy': 'mean_reversion', 'bear_bb_std_mult': 2.788917482715571, 'bear_rsi_os': 52, 'bear_rsi_ob': 76, 'bear_adx_thresh': 18.644198837910047, 'bear_atr_min_pct': 0.02751327692099763, 'bear_atr_max_pct': 0.02128959285597075, 'bear_tp_mult': 2.702030542261794, 'bear_tsl_mult': 0.6558891109141587, 'bear_time_stop': 89, 'bear_use_sma': True, 'bear_use_ema': True, 'bear_use_atr': True, 'bear_use_adx': False, 'bear_use_spike': True, 'bear_rsi_required': False, 'sideways_strategy': 'breakout', 'sideways_bb_std_mult': 1.435426224167002, 'sideways_rsi_os': 33, 'sideways_rsi_ob': 51, 'sideways_adx_thresh': 19.454435863206065, 'sideways_atr_min_pct': 0.0024924385321792837, 'sideways_atr_max_pct': 0.1471605001288825, 'sideways_tp_mult': 1.099579672037968, 'sideways_tsl_mult': 0.9963688373817983, 'sideways_time_stop': 193, 'sideways_use_sma': False, 'sideways_use_ema': False, 'sideways_use_atr': True, 'sideways_use_adx': True, 'sideways_use_spike': False, 'sideways_rsi_required': False}.
[I 2025-08-30 19:25:00,510] Trial 487 finished with values: [-0.022053233834924524, 0.022097736898567893] and parameters: {'p_sma': 9, 'p_std': 30, 'p_atr': 11, 'p_adx': 25, 'rsi_period': 25, 'ema1': 8, 'ema2': 51, 'slip_atr_k': 0.1135075245857417, 'slip_spread_k': 0.18145733575605857, 'spread_hl_frac': 0.025747965789349174, 'bb_std_mult': 2.042009016270791, 'rsi_os': 49, 'rsi_ob': 62, 'vol_spike': 0.2714840594425911, 'adx_thresh': 34.07837475060198, 'atr_min_pct': 0.024145347375883672, 'atr_max_pct': 0.09186517247662136, 'tp_mult': 2.408682269370641, 'tsl_mult': 0.8513174658237828, 'strategy': 'mean_reversion', 'time_stop': 207, 'use_sma': False, 'use_atr': True, 'use_adx': False, 'use_ema': True, 'use_spike': True, 'rsi_required': False, 'edge_k': 0.1494533565398304, 'edge_cap': 0.5247380715828917, 'bull_strategy': 'mean_reversion', 'bull_bb_std_mult': 1.2684674252058474, 'bull_rsi_os': 29, 'bull_rsi_ob': 78, 'bull_adx_thresh': 17.219152297142408, 'bull_atr_min_pct': 0.0020208097014967983, 'bull_atr_max_pct': 0.1379229629570426, 'bull_tp_mult': 2.6946481456829017, 'bull_tsl_mult': 0.9969458309802699, 'bull_time_stop': 264, 'bull_use_sma': False, 'bull_use_ema': False, 'bull_use_atr': False, 'bull_use_adx': False, 'bull_use_spike': True, 'bull_rsi_required': True, 'bear_strategy': 'mean_reversion', 'bear_bb_std_mult': 2.6123987336356054, 'bear_rsi_os': 52, 'bear_rsi_ob': 76, 'bear_adx_thresh': 14.379825951511563, 'bear_atr_min_pct': 0.011349618506670697, 'bear_atr_max_pct': 0.036002362027222096, 'bear_tp_mult': 1.981979823878822, 'bear_tsl_mult': 0.6908532235128877, 'bear_time_stop': 88, 'bear_use_sma': True, 'bear_use_ema': True, 'bear_use_atr': True, 'bear_use_adx': False, 'bear_use_spike': True, 'bear_rsi_required': False, 'sideways_strategy': 'breakout', 'sideways_bb_std_mult': 2.4327650970860515, 'sideways_rsi_os': 52, 'sideways_rsi_ob': 59, 'sideways_adx_thresh': 19.67764891329749, 'sideways_atr_min_pct': 0.002470493805719966, 'sideways_atr_max_pct': 0.1422053353916887, 'sideways_tp_mult': 2.6940367613672436, 'sideways_tsl_mult': 0.8405007416653489, 'sideways_time_stop': 192, 'sideways_use_sma': False, 'sideways_use_ema': False, 'sideways_use_atr': True, 'sideways_use_adx': True, 'sideways_use_spike': False, 'sideways_rsi_required': False}.
[I 2025-08-30 19:25:00,702] Trial 489 finished with values: [-1000000000.0, 1000000000.0] and parameters: {'p_sma': 10, 'p_std': 25, 'p_atr': 11, 'p_adx': 25, 'rsi_period': 25, 'ema1': 5, 'ema2': 52, 'slip_atr_k': 0.06867229708588549, 'slip_spread_k': 0.5278005645619223, 'spread_hl_frac': 0.02341513298370711, 'bb_std_mult': 2.0135445739758677, 'rsi_os': 30, 'rsi_ob': 84, 'vol_spike': 0.11277704293811588, 'adx_thresh': 7.9584791941694455, 'atr_min_pct': 0.008253198829255612, 'atr_max_pct': 0.10796806023690358, 'tp_mult': 1.7578686943324382, 'tsl_mult': 0.3509057650201334, 'strategy': 'mean_reversion', 'time_stop': 211, 'use_sma': False, 'use_atr': True, 'use_adx': False, 'use_ema': True, 'use_spike': True, 'rsi_required': False, 'edge_k': 0.9953358864917198, 'edge_cap': 0.4912001914410337, 'bull_strategy': 'mean_reversion', 'bull_bb_std_mult': 1.3540099491233897, 'bull_rsi_os': 29, 'bull_rsi_ob': 45, 'bull_adx_thresh': 17.20168407375676, 'bull_atr_min_pct': 0.015764294301913964, 'bull_atr_max_pct': 0.13745988862227007, 'bull_tp_mult': 2.7065929283780448, 'bull_tsl_mult': 0.501831436613412, 'bull_time_stop': 265, 'bull_use_sma': False, 'bull_use_ema': True, 'bull_use_atr': False, 'bull_use_adx': False, 'bull_use_spike': True, 'bull_rsi_required': True, 'bear_strategy': 'mean_reversion', 'bear_bb_std_mult': 2.242828642918801, 'bear_rsi_os': 15, 'bear_rsi_ob': 76, 'bear_adx_thresh': 5.940006181337823, 'bear_atr_min_pct': 0.015521413925270499, 'bear_atr_max_pct': 0.0675517913448897, 'bear_tp_mult': 2.146177107699722, 'bear_tsl_mult': 0.40301761259236407, 'bear_time_stop': 90, 'bear_use_sma': True, 'bear_use_ema': True, 'bear_use_atr': True, 'bear_use_adx': False, 'bear_use_spike': True, 'bear_rsi_required': False, 'sideways_strategy': 'breakout', 'sideways_bb_std_mult': 3.091602192388818, 'sideways_rsi_os': 33, 'sideways_rsi_ob': 52, 'sideways_adx_thresh': 7.645459048709897, 'sideways_atr_min_pct': 0.02662490147069191, 'sideways_atr_max_pct': 0.06911293543925842, 'sideways_tp_mult': 1.1048481459224402, 'sideways_tsl_mult': 0.9789710151002264, 'sideways_time_stop': 155, 'sideways_use_sma': False, 'sideways_use_ema': False, 'sideways_use_atr': True, 'sideways_use_adx': True, 'sideways_use_spike': False, 'sideways_rsi_required': False}.
[I 2025-08-30 19:25:00,785] Trial 486 finished with values: [-1000000000.0, 1000000000.0] and parameters: {'p_sma': 9, 'p_std': 25, 'p_atr': 9, 'p_adx': 25, 'rsi_period': 25, 'ema1': 16, 'ema2': 56, 'slip_atr_k': 0.06812135556959406, 'slip_spread_k': 0.1793119812264868, 'spread_hl_frac': 0.020393683550174565, 'bb_std_mult': 2.003492977248454, 'rsi_os': 49, 'rsi_ob': 48, 'vol_spike': 0.13996951569739952, 'adx_thresh': 31.932444602161134, 'atr_min_pct': 0.026131138750156904, 'atr_max_pct': 0.10914796839261007, 'tp_mult': 1.7105210062527008, 'tsl_mult': 0.3638147581399791, 'strategy': 'breakout', 'time_stop': 203, 'use_sma': False, 'use_atr': False, 'use_adx': True, 'use_ema': False, 'use_spike': True, 'rsi_required': False, 'edge_k': 0.09788583524727325, 'edge_cap': 0.4289911841493509, 'bull_strategy': 'breakout', 'bull_bb_std_mult': 1.2726772269472142, 'bull_rsi_os': 29, 'bull_rsi_ob': 56, 'bull_adx_thresh': 12.076906892938501, 'bull_atr_min_pct': 0.027011819781488554, 'bull_atr_max_pct': 0.11628354739295914, 'bull_tp_mult': 2.708041218142816, 'bull_tsl_mult': 0.5490888724827409, 'bull_time_stop': 78, 'bull_use_sma': False, 'bull_use_ema': False, 'bull_use_atr': False, 'bull_use_adx': False, 'bull_use_spike': True, 'bull_rsi_required': True, 'bear_strategy': 'mean_reversion', 'bear_bb_std_mult': 2.9682550677063233, 'bear_rsi_os': 17, 'bear_rsi_ob': 76, 'bear_adx_thresh': 16.479648482237288, 'bear_atr_min_pct': 0.026760292710355345, 'bear_atr_max_pct': 0.02070090994767386, 'bear_tp_mult': 2.8458893574489474, 'bear_tsl_mult': 0.3116444652009236, 'bear_time_stop': 225, 'bear_use_sma': True, 'bear_use_ema': True, 'bear_use_atr': True, 'bear_use_adx': True, 'bear_use_spike': True, 'bear_rsi_required': True, 'sideways_strategy': 'mean_reversion', 'sideways_bb_std_mult': 3.239470363843178, 'sideways_rsi_os': 33, 'sideways_rsi_ob': 55, 'sideways_adx_thresh': 32.23164153823663, 'sideways_atr_min_pct': 0.0252435286715312, 'sideways_atr_max_pct': 0.14523512301367386, 'sideways_tp_mult': 1.1835993137223197, 'sideways_tsl_mult': 0.9994550793860523, 'sideways_time_stop': 128, 'sideways_use_sma': False, 'sideways_use_ema': True, 'sideways_use_atr': False, 'sideways_use_adx': True, 'sideways_use_spike': False, 'sideways_rsi_required': False}.
[I 2025-08-30 19:25:01,479] Trial 491 finished with values: [-1000000000.0, 1000000000.0] and parameters: {'p_sma': 10, 'p_std': 30, 'p_atr': 9, 'p_adx': 11, 'rsi_period': 24, 'ema1': 25, 'ema2': 15, 'slip_atr_k': 0.06738520802341114, 'slip_spread_k': 0.17976338844496909, 'spread_hl_frac': 0.015082668195119326, 'bb_std_mult': 2.1845566427125074, 'rsi_os': 50, 'rsi_ob': 85, 'vol_spike': 0.11250334508239668, 'adx_thresh': 33.95482797618, 'atr_min_pct': 0.024079434646857984, 'atr_max_pct': 0.10916534499948886, 'tp_mult': 1.7101979825245786, 'tsl_mult': 0.8604934219429107, 'strategy': 'mean_reversion', 'time_stop': 212, 'use_sma': False, 'use_atr': True, 'use_adx': False, 'use_ema': True, 'use_spike': True, 'rsi_required': False, 'edge_k': 1.0775067510088066, 'edge_cap': 0.4938831174616314, 'bull_strategy': 'mean_reversion', 'bull_bb_std_mult': 1.3489900619386506, 'bull_rsi_os': 29, 'bull_rsi_ob': 45, 'bull_adx_thresh': 16.958772198145418, 'bull_atr_min_pct': 0.0021966046421801125, 'bull_atr_max_pct': 0.11640025761479679, 'bull_tp_mult': 2.700676256974018, 'bull_tsl_mult': 0.511449794796191, 'bull_time_stop': 267, 'bull_use_sma': False, 'bull_use_ema': False, 'bull_use_atr': False, 'bull_use_adx': False, 'bull_use_spike': True, 'bull_rsi_required': True, 'bear_strategy': 'mean_reversion', 'bear_bb_std_mult': 2.778208045507583, 'bear_rsi_os': 48, 'bear_rsi_ob': 76, 'bear_adx_thresh': 14.40965489480785, 'bear_atr_min_pct': 0.01536435362509727, 'bear_atr_max_pct': 0.0729086696567768, 'bear_tp_mult': 2.17611312203229, 'bear_tsl_mult': 0.21482001433198372, 'bear_time_stop': 93, 'bear_use_sma': False, 'bear_use_ema': True, 'bear_use_atr': False, 'bear_use_adx': False, 'bear_use_spike': True, 'bear_rsi_required': False, 'sideways_strategy': 'breakout', 'sideways_bb_std_mult': 3.0971804899835815, 'sideways_rsi_os': 37, 'sideways_rsi_ob': 52, 'sideways_adx_thresh': 19.488017439887845, 'sideways_atr_min_pct': 0.020911898374265596, 'sideways_atr_max_pct': 0.1467902660176725, 'sideways_tp_mult': 2.4002566356607353, 'sideways_tsl_mult': 0.9928921491877439, 'sideways_time_stop': 147, 'sideways_use_sma': False, 'sideways_use_ema': True, 'sideways_use_atr': True, 'sideways_use_adx': True, 'sideways_use_spike': False, 'sideways_rsi_required': False}.
[I 2025-08-30 19:25:01,482] Trial 493 finished with values: [-1000000000.0, 1000000000.0] and parameters: {'p_sma': 27, 'p_std': 30, 'p_atr': 9, 'p_adx': 19, 'rsi_period': 73, 'ema1': 25, 'ema2': 46, 'slip_atr_k': 0.15596206867187112, 'slip_spread_k': 0.15474121731423085, 'spread_hl_frac': 0.02619764824379448, 'bb_std_mult': 2.920217531948861, 'rsi_os': 50, 'rsi_ob': 82, 'vol_spike': 0.12050584882844204, 'adx_thresh': 33.970639253259016, 'atr_min_pct': 0.02414978369192475, 'atr_max_pct': 0.09070709913387404, 'tp_mult': 1.975123187337156, 'tsl_mult': 0.8558531514971042, 'strategy': 'mean_reversion', 'time_stop': 174, 'use_sma': False, 'use_atr': True, 'use_adx': True, 'use_ema': True, 'use_spike': False, 'rsi_required': False, 'edge_k': 0.15858185085709506, 'edge_cap': 0.525979801003096, 'bull_strategy': 'mean_reversion', 'bull_bb_std_mult': 3.0836138498783394, 'bull_rsi_os': 28, 'bull_rsi_ob': 47, 'bull_adx_thresh': 19.233581074343263, 'bull_atr_min_pct': 0.0018913202795977561, 'bull_atr_max_pct': 0.052132505923822035, 'bull_tp_mult': 2.619125957327462, 'bull_tsl_mult': 0.5158666818093003, 'bull_time_stop': 176, 'bull_use_sma': False, 'bull_use_ema': True, 'bull_use_atr': True, 'bull_use_adx': False, 'bull_use_spike': False, 'bull_rsi_required': False, 'bear_strategy': 'breakout', 'bear_bb_std_mult': 2.6341138945618967, 'bear_rsi_os': 48, 'bear_rsi_ob': 76, 'bear_adx_thresh': 18.568109831030764, 'bear_atr_min_pct': 0.024144186754905345, 'bear_atr_max_pct': 0.034999421797712295, 'bear_tp_mult': 2.69030355251485, 'bear_tsl_mult': 0.22134945099286618, 'bear_time_stop': 215, 'bear_use_sma': False, 'bear_use_ema': True, 'bear_use_atr': False, 'bear_use_adx': False, 'bear_use_spike': False, 'bear_rsi_required': False, 'sideways_strategy': 'breakout', 'sideways_bb_std_mult': 2.4525473518335126, 'sideways_rsi_os': 37, 'sideways_rsi_ob': 59, 'sideways_adx_thresh': 19.60326641394976, 'sideways_atr_min_pct': 0.018274501563815177, 'sideways_atr_max_pct': 0.12375940034581867, 'sideways_tp_mult': 2.384549708070151, 'sideways_tsl_mult': 0.6540906346606326, 'sideways_time_stop': 148, 'sideways_use_sma': True, 'sideways_use_ema': True, 'sideways_use_atr': True, 'sideways_use_adx': False, 'sideways_use_spike': True, 'sideways_rsi_required': True}.
[I 2025-08-30 19:25:02,262] Trial 495 finished with values: [-1000000000.0, 1000000000.0] and parameters: {'p_sma': 6, 'p_std': 11, 'p_atr': 9, 'p_adx': 21, 'rsi_period': 28, 'ema1': 15, 'ema2': 51, 'slip_atr_k': 0.044096016428300314, 'slip_spread_k': 0.8724218809950142, 'spread_hl_frac': 0.023352440103059185, 'bb_std_mult': 2.310281535972706, 'rsi_os': 54, 'rsi_ob': 80, 'vol_spike': 0.2720875624029682, 'adx_thresh': 34.615633733166725, 'atr_min_pct': 0.012000176094810914, 'atr_max_pct': 0.11745332948121905, 'tp_mult': 1.8080594167025275, 'tsl_mult': 0.8108708370521709, 'strategy': 'mean_reversion', 'time_stop': 229, 'use_sma': False, 'use_atr': True, 'use_adx': True, 'use_ema': False, 'use_spike': True, 'rsi_required': False, 'edge_k': 0.000150402834016225, 'edge_cap': 0.27727744677978955, 'bull_strategy': 'mean_reversion', 'bull_bb_std_mult': 2.914080849947837, 'bull_rsi_os': 55, 'bull_rsi_ob': 87, 'bull_adx_thresh': 18.907894691810693, 'bull_atr_min_pct': 0.0025981091036160315, 'bull_atr_max_pct': 0.12427218177023214, 'bull_tp_mult': 2.163980847721412, 'bull_tsl_mult': 0.4622763669434743, 'bull_time_stop': 160, 'bull_use_sma': False, 'bull_use_ema': True, 'bull_use_atr': True, 'bull_use_adx': False, 'bull_use_spike': False, 'bull_rsi_required': True, 'bear_strategy': 'breakout', 'bear_bb_std_mult': 2.8900295310000246, 'bear_rsi_os': 44, 'bear_rsi_ob': 77, 'bear_adx_thresh': 17.96032257940695, 'bear_atr_min_pct': 0.014635129453718504, 'bear_atr_max_pct': 0.08400539867653, 'bear_tp_mult': 1.9707131830010043, 'bear_tsl_mult': 0.6501948008578351, 'bear_time_stop': 190, 'bear_use_sma': True, 'bear_use_ema': True, 'bear_use_atr': False, 'bear_use_adx': False, 'bear_use_spike': False, 'bear_rsi_required': True, 'sideways_strategy': 'breakout', 'sideways_bb_std_mult': 1.4309116622580538, 'sideways_rsi_os': 40, 'sideways_rsi_ob': 58, 'sideways_adx_thresh': 21.26666255648587, 'sideways_atr_min_pct': 0.02010644019492115, 'sideways_atr_max_pct': 0.14232374488561111, 'sideways_tp_mult': 2.8323003228112715, 'sideways_tsl_mult': 0.13502194403035722, 'sideways_time_stop': 298, 'sideways_use_sma': False, 'sideways_use_ema': True, 'sideways_use_atr': True, 'sideways_use_adx': False, 'sideways_use_spike': False, 'sideways_rsi_required': True}.
[I 2025-08-30 19:25:02,268] Trial 494 finished with values: [-1000000000.0, 1000000000.0] and parameters: {'p_sma': 7, 'p_std': 23, 'p_atr': 9, 'p_adx': 19, 'rsi_period': 61, 'ema1': 19, 'ema2': 35, 'slip_atr_k': 0.07804864698679775, 'slip_spread_k': 0.2921501740249969, 'spread_hl_frac': 0.003701368493206174, 'bb_std_mult': 2.3130676817012072, 'rsi_os': 54, 'rsi_ob': 54, 'vol_spike': 0.27287427572639084, 'adx_thresh': 21.668151915528185, 'atr_min_pct': 0.02346486253136883, 'atr_max_pct': 0.07903523364457085, 'tp_mult': 1.3472446549159853, 'tsl_mult': 0.2473231207722405, 'strategy': 'mean_reversion', 'time_stop': 222, 'use_sma': False, 'use_atr': True, 'use_adx': True, 'use_ema': False, 'use_spike': False, 'rsi_required': False, 'edge_k': 0.7191224321665821, 'edge_cap': 0.5291495037767953, 'bull_strategy': 'mean_reversion', 'bull_bb_std_mult': 3.1133459581902567, 'bull_rsi_os': 33, 'bull_rsi_ob': 47, 'bull_adx_thresh': 19.269122071058153, 'bull_atr_min_pct': 0.022516423463064303, 'bull_atr_max_pct': 0.12523092071502953, 'bull_tp_mult': 2.8253153423617445, 'bull_tsl_mult': 0.5176086429495491, 'bull_time_stop': 201, 'bull_use_sma': False, 'bull_use_ema': True, 'bull_use_atr': True, 'bull_use_adx': False, 'bull_use_spike': False, 'bull_rsi_required': False, 'bear_strategy': 'breakout', 'bear_bb_std_mult': 2.659230279404597, 'bear_rsi_os': 24, 'bear_rsi_ob': 77, 'bear_adx_thresh': 20.3989215707248, 'bear_atr_min_pct': 0.014698572701071229, 'bear_atr_max_pct': 0.03595031197432475, 'bear_tp_mult': 1.365353207103455, 'bear_tsl_mult': 0.6461030216814976, 'bear_time_stop': 191, 'bear_use_sma': True, 'bear_use_ema': True, 'bear_use_atr': False, 'bear_use_adx': False, 'bear_use_spike': False, 'bear_rsi_required': True, 'sideways_strategy': 'breakout', 'sideways_bb_std_mult': 2.4301176688669948, 'sideways_rsi_os': 38, 'sideways_rsi_ob': 59, 'sideways_adx_thresh': 21.31138387539584, 'sideways_atr_min_pct': 0.002499004990639572, 'sideways_atr_max_pct': 0.027885452702438578, 'sideways_tp_mult': 1.0496882473716485, 'sideways_tsl_mult': 0.9602556721042281, 'sideways_time_stop': 56, 'sideways_use_sma': True, 'sideways_use_ema': True, 'sideways_use_atr': True, 'sideways_use_adx': False, 'sideways_use_spike': True, 'sideways_rsi_required': True}.
[I 2025-08-30 19:25:22,267] Trial 490 finished with values: [-1000000000.0, 1000000000.0] and parameters: {'p_sma': 9, 'p_std': 50, 'p_atr': 9, 'p_adx': 19, 'rsi_period': 73, 'ema1': 8, 'ema2': 35, 'slip_atr_k': 0.06797016019911578, 'slip_spread_k': 0.18423509352555625, 'spread_hl_frac': 0.0042028697149996165, 'bb_std_mult': 1.9812911791706647, 'rsi_os': 49, 'rsi_ob': 54, 'vol_spike': 0.2715853463585817, 'adx_thresh': 34.013213871372834, 'atr_min_pct': 0.024111888126445213, 'atr_max_pct': 0.07811235225504565, 'tp_mult': 1.8264689891280823, 'tsl_mult': 0.37155165539777857, 'strategy': 'mean_reversion', 'time_stop': 209, 'use_sma': False, 'use_atr': True, 'use_adx': False, 'use_ema': True, 'use_spike': False, 'rsi_required': False, 'edge_k': 0.15054330647778916, 'edge_cap': 0.36120684601210423, 'bull_strategy': 'mean_reversion', 'bull_bb_std_mult': 1.366547983421012, 'bull_rsi_os': 24, 'bull_rsi_ob': 45, 'bull_adx_thresh': 12.174223830824639, 'bull_atr_min_pct': 0.02678627411275547, 'bull_atr_max_pct': 0.11587183036906369, 'bull_tp_mult': 2.7106916836191153, 'bull_tsl_mult': 0.7284956945850611, 'bull_time_stop': 263, 'bull_use_sma': False, 'bull_use_ema': False, 'bull_use_atr': False, 'bull_use_adx': False, 'bull_use_spike': True, 'bull_rsi_required': True, 'bear_strategy': 'mean_reversion', 'bear_bb_std_mult': 2.6361075124199966, 'bear_rsi_os': 17, 'bear_rsi_ob': 76, 'bear_adx_thresh': 5.785931579974401, 'bear_atr_min_pct': 0.02365510724524722, 'bear_atr_max_pct': 0.02083278682654375, 'bear_tp_mult': 2.715574941280002, 'bear_tsl_mult': 0.4117474600739784, 'bear_time_stop': 88, 'bear_use_sma': False, 'bear_use_ema': True, 'bear_use_atr': False, 'bear_use_adx': False, 'bear_use_spike': True, 'bear_rsi_required': False, 'sideways_strategy': 'breakout', 'sideways_bb_std_mult': 3.0935867891005904, 'sideways_rsi_os': 37, 'sideways_rsi_ob': 72, 'sideways_adx_thresh': 19.55979369508142, 'sideways_atr_min_pct': 0.026732024555101784, 'sideways_atr_max_pct': 0.1471346828658152, 'sideways_tp_mult': 2.3902823498127836, 'sideways_tsl_mult': 0.6633220491049321, 'sideways_time_stop': 146, 'sideways_use_sma': False, 'sideways_use_ema': True, 'sideways_use_atr': True, 'sideways_use_adx': True, 'sideways_use_spike': False, 'sideways_rsi_required': False}.
