[I 2025-08-30 19:05:25,452] Trial 326 finished with values: [-1000000000.0, 1000000000.0] and parameters: {'p_sma': 42, 'p_std': 13, 'p_atr': 8, 'p_adx': 12, 'rsi_period': 26, 'ema1': 14, 'ema2': 30, 'slip_atr_k': 0.06117758060804984, 'slip_spread_k': 0.14772595181194598, 'spread_hl_frac': 0.03607237675764615, 'bb_std_mult': 3.162892037138864, 'rsi_os': 50, 'rsi_ob': 84, 'vol_spike': 0.2834910998941724, 'adx_thresh': 33.52334684525138, 'atr_min_pct': 0.0236310133437796, 'atr_max_pct': 0.02907590227436113, 'tp_mult': 2.3767891922728057, 'tsl_mult': 0.4959609756435628, 'strategy': 'mean_reversion', 'time_stop': 238, 'use_sma': False, 'use_atr': True, 'use_adx': False, 'use_ema': False, 'use_spike': False, 'rsi_required': True, 'edge_k': 0.0748114747525295, 'edge_cap': 0.5129945540369422, 'bull_strategy': 'breakout', 'bull_bb_std_mult': 3.1765537360849945, 'bull_rsi_os': 32, 'bull_rsi_ob': 46, 'bull_adx_thresh': 18.639566471094643, 'bull_atr_min_pct': 0.00136970940788945, 'bull_atr_max_pct': 0.12279743593653726, 'bull_tp_mult': 2.7989035062983376, 'bull_tsl_mult': 0.530025486459002, 'bull_time_stop': 179, 'bull_use_sma': False, 'bull_use_ema': True, 'bull_use_atr': False, 'bull_use_adx': False, 'bull_use_spike': True, 'bull_rsi_required': True, 'bear_strategy': 'breakout', 'bear_bb_std_mult': 2.8529145616321503, 'bear_rsi_os': 42, 'bear_rsi_ob': 75, 'bear_adx_thresh': 18.65985701521457, 'bear_atr_min_pct': 0.014630704525435372, 'bear_atr_max_pct': 0.13259348187127948, 'bear_tp_mult': 2.6687818376820585, 'bear_tsl_mult': 0.8138936271394557, 'bear_time_stop': 208, 'bear_use_sma': False, 'bear_use_ema': True, 'bear_use_atr': False, 'bear_use_adx': False, 'bear_use_spike': False, 'bear_rsi_required': True, 'sideways_strategy': 'mean_reversion', 'sideways_bb_std_mult': 1.1198077199060208, 'sideways_rsi_os': 39, 'sideways_rsi_ob': 58, 'sideways_adx_thresh': 29.422661319047343, 'sideways_atr_min_pct': 0.017870377681157797, 'sideways_atr_max_pct': 0.013593965501368571, 'sideways_tp_mult': 1.1346200896117022, 'sideways_tsl_mult': 0.46133283759339544, 'sideways_time_stop': 32, 'sideways_use_sma': False, 'sideways_use_ema': True, 'sideways_use_atr': False, 'sideways_use_adx': False, 'sideways_use_spike': False, 'sideways_rsi_required': False}.
[I 2025-08-30 19:05:58,446] Trial 324 finished with values: [-1000000000.0, 1000000000.0] and parameters: {'p_sma': 9, 'p_std': 52, 'p_atr': 17, 'p_adx': 21, 'rsi_period': 26, 'ema1': 15, 'ema2': 31, 'slip_atr_k': 0.06232782701004366, 'slip_spread_k': 0.9789175234514327, 'spread_hl_frac': 0.02937393963332699, 'bb_std_mult': 2.16313256141555, 'rsi_os': 14, 'rsi_ob': 84, 'vol_spike': 0.2845864727370278, 'adx_thresh': 21.84560611285066, 'atr_min_pct': 0.022955883884546342, 'atr_max_pct': 0.09046650581592262, 'tp_mult': 2.1076565974667196, 'tsl_mult': 0.9386450043655074, 'strategy': 'breakout', 'time_stop': 196, 'use_sma': False, 'use_atr': True, 'use_adx': True, 'use_ema': False, 'use_spike': True, 'rsi_required': False, 'edge_k': 0.074441806810571, 'edge_cap': 0.5106016298681181, 'bull_strategy': 'breakout', 'bull_bb_std_mult': 3.1580840798731145, 'bull_rsi_os': 37, 'bull_rsi_ob': 82, 'bull_adx_thresh': 26.80054057892449, 'bull_atr_min_pct': 0.00678568700030335, 'bull_atr_max_pct': 0.12284099711760628, 'bull_tp_mult': 2.821719417240295, 'bull_tsl_mult': 0.2735243045618393, 'bull_time_stop': 263, 'bull_use_sma': True, 'bull_use_ema': True, 'bull_use_atr': True, 'bull_use_adx': False, 'bull_use_spike': False, 'bull_rsi_required': True, 'bear_strategy': 'breakout', 'bear_bb_std_mult': 1.2865784617516134, 'bear_rsi_os': 54, 'bear_rsi_ob': 79, 'bear_adx_thresh': 5.398066824443855, 'bear_atr_min_pct': 0.004629390443165168, 'bear_atr_max_pct': 0.03270863127436025, 'bear_tp_mult': 2.6548571737458158, 'bear_tsl_mult': 0.33670170514465303, 'bear_time_stop': 207, 'bear_use_sma': False, 'bear_use_ema': True, 'bear_use_atr': False, 'bear_use_adx': True, 'bear_use_spike': False, 'bear_rsi_required': False, 'sideways_strategy': 'breakout', 'sideways_bb_std_mult': 0.838855534164495, 'sideways_rsi_os': 38, 'sideways_rsi_ob': 88, 'sideways_adx_thresh': 33.81556240811321, 'sideways_atr_min_pct': 0.0019474387854372082, 'sideways_atr_max_pct': 0.14637556363538518, 'sideways_tp_mult': 1.0508607393487184, 'sideways_tsl_mult': 0.9995721609711348, 'sideways_time_stop': 206, 'sideways_use_sma': False, 'sideways_use_ema': True, 'sideways_use_atr': True, 'sideways_use_adx': False, 'sideways_use_spike': True, 'sideways_rsi_required': True}.
[I 2025-08-30 19:06:01,768] Trial 327 finished with values: [-1000000000.0, 1000000000.0] and parameters: {'p_sma': 7, 'p_std': 29, 'p_atr': 8, 'p_adx': 20, 'rsi_period': 26, 'ema1': 15, 'ema2': 32, 'slip_atr_k': 0.06237659168520764, 'slip_spread_k': 0.14509785692864396, 'spread_hl_frac': 0.02422740050547565, 'bb_std_mult': 3.0729989977699805, 'rsi_os': 38, 'rsi_ob': 84, 'vol_spike': 0.031071481303600504, 'adx_thresh': 34.99395785580943, 'atr_min_pct': 0.0021219801665972905, 'atr_max_pct': 0.05112706447414162, 'tp_mult': 2.2564433871307084, 'tsl_mult': 0.2900932328108402, 'strategy': 'mean_reversion', 'time_stop': 195, 'use_sma': False, 'use_atr': True, 'use_adx': False, 'use_ema': True, 'use_spike': False, 'rsi_required': True, 'edge_k': 0.07592486380870778, 'edge_cap': 0.5140447688411696, 'bull_strategy': 'mean_reversion', 'bull_bb_std_mult': 3.0777333906507414, 'bull_rsi_os': 37, 'bull_rsi_ob': 46, 'bull_adx_thresh': 18.76065463134254, 'bull_atr_min_pct': 0.004331652834410235, 'bull_atr_max_pct': 0.05466176926738125, 'bull_tp_mult': 2.465368230742372, 'bull_tsl_mult': 0.024857035161004293, 'bull_time_stop': 262, 'bull_use_sma': False, 'bull_use_ema': True, 'bull_use_atr': False, 'bull_use_adx': False, 'bull_use_spike': True, 'bull_rsi_required': True, 'bear_strategy': 'mean_reversion', 'bear_bb_std_mult': 2.100358256108531, 'bear_rsi_os': 52, 'bear_rsi_ob': 69, 'bear_adx_thresh': 22.13713313014, 'bear_atr_min_pct': 0.01277523870730113, 'bear_atr_max_pct': 0.03231396825757172, 'bear_tp_mult': 2.251750859923495, 'bear_tsl_mult': 0.8041256422394651, 'bear_time_stop': 192, 'bear_use_sma': False, 'bear_use_ema': True, 'bear_use_atr': False, 'bear_use_adx': False, 'bear_use_spike': False, 'bear_rsi_required': True, 'sideways_strategy': 'mean_reversion', 'sideways_bb_std_mult': 2.4711149831979196, 'sideways_rsi_os': 39, 'sideways_rsi_ob': 84, 'sideways_adx_thresh': 18.89817564685958, 'sideways_atr_min_pct': 0.002040187426416908, 'sideways_atr_max_pct': 0.03383127073062038, 'sideways_tp_mult': 2.5243690416626396, 'sideways_tsl_mult': 0.4840148899663873, 'sideways_time_stop': 34, 'sideways_use_sma': True, 'sideways_use_ema': True, 'sideways_use_atr': False, 'sideways_use_adx': False, 'sideways_use_spike': False, 'sideways_rsi_required': False}.
[I 2025-08-30 19:06:02,104] Trial 325 finished with values: [-0.0305753223309857, 0.030461875581825275] and parameters: {'p_sma': 7, 'p_std': 52, 'p_atr': 8, 'p_adx': 18, 'rsi_period': 26, 'ema1': 15, 'ema2': 42, 'slip_atr_k': 0.06239724442946036, 'slip_spread_k': 0.14838563346381073, 'spread_hl_frac': 0.021080383626858833, 'bb_std_mult': 0.9744229759814387, 'rsi_os': 21, 'rsi_ob': 84, 'vol_spike': 0.03193058242919625, 'adx_thresh': 34.306029677069766, 'atr_min_pct': 0.02278375296580069, 'atr_max_pct': 0.12978330531276572, 'tp_mult': 2.3664391733463006, 'tsl_mult': 0.2940544485085481, 'strategy': 'breakout', 'time_stop': 122, 'use_sma': False, 'use_atr': True, 'use_adx': True, 'use_ema': False, 'use_spike': True, 'rsi_required': False, 'edge_k': 0.30615737824508577, 'edge_cap': 0.19568324226017064, 'bull_strategy': 'breakout', 'bull_bb_std_mult': 2.1025419938777126, 'bull_rsi_os': 32, 'bull_rsi_ob': 46, 'bull_adx_thresh': 18.52657158111313, 'bull_atr_min_pct': 0.0013679566188534035, 'bull_atr_max_pct': 0.14416429821699803, 'bull_tp_mult': 1.4960479755630214, 'bull_tsl_mult': 0.2770870347722547, 'bull_time_stop': 158, 'bull_use_sma': True, 'bull_use_ema': True, 'bull_use_atr': False, 'bull_use_adx': False, 'bull_use_spike': True, 'bull_rsi_required': True, 'bear_strategy': 'breakout', 'bear_bb_std_mult': 1.7758287129022314, 'bear_rsi_os': 52, 'bear_rsi_ob': 70, 'bear_adx_thresh': 10.743199636963176, 'bear_atr_min_pct': 0.00029387619762294946, 'bear_atr_max_pct': 0.13083088956727845, 'bear_tp_mult': 2.2484069965819526, 'bear_tsl_mult': 0.8110514607322098, 'bear_time_stop': 208, 'bear_use_sma': False, 'bear_use_ema': True, 'bear_use_atr': False, 'bear_use_adx': True, 'bear_use_spike': False, 'bear_rsi_required': False, 'sideways_strategy': 'breakout', 'sideways_bb_std_mult': 0.8699712543694593, 'sideways_rsi_os': 38, 'sideways_rsi_ob': 57, 'sideways_adx_thresh': 18.579343850561347, 'sideways_atr_min_pct': 0.017573408353723494, 'sideways_atr_max_pct': 0.03528190512505042, 'sideways_tp_mult': 1.0426467953036198, 'sideways_tsl_mult': 0.45678735775802826, 'sideways_time_stop': 236, 'sideways_use_sma': False, 'sideways_use_ema': True, 'sideways_use_atr': False, 'sideways_use_adx': False, 'sideways_use_spike': True, 'sideways_rsi_required': True}.
[I 2025-08-30 19:06:03,019] Trial 328 finished with values: [-1000000000.0, 1000000000.0] and parameters: {'p_sma': 27, 'p_std': 29, 'p_atr': 8, 'p_adx': 24, 'rsi_period': 58, 'ema1': 15, 'ema2': 31, 'slip_atr_k': 0.09607524996563954, 'slip_spread_k': 0.80512010863185, 'spread_hl_frac': 0.021553166831455514, 'bb_std_mult': 2.2155899182405103, 'rsi_os': 21, 'rsi_ob': 58, 'vol_spike': 0.21584538717041113, 'adx_thresh': 33.17081118741227, 'atr_min_pct': 0.02296197565672588, 'atr_max_pct': 0.0908630283726565, 'tp_mult': 2.250809942036998, 'tsl_mult': 0.9114875868684307, 'strategy': 'mean_reversion', 'time_stop': 173, 'use_sma': False, 'use_atr': True, 'use_adx': True, 'use_ema': True, 'use_spike': True, 'rsi_required': False, 'edge_k': 0.1007078766520989, 'edge_cap': 0.5322707858115692, 'bull_strategy': 'mean_reversion', 'bull_bb_std_mult': 3.0875882867161915, 'bull_rsi_os': 35, 'bull_rsi_ob': 47, 'bull_adx_thresh': 27.005227699345486, 'bull_atr_min_pct': 0.0010348520276616154, 'bull_atr_max_pct': 0.11561383346676372, 'bull_tp_mult': 2.4839348826619574, 'bull_tsl_mult': 0.6086485957144718, 'bull_time_stop': 189, 'bull_use_sma': False, 'bull_use_ema': True, 'bull_use_atr': True, 'bull_use_adx': False, 'bull_use_spike': False, 'bull_rsi_required': True, 'bear_strategy': 'mean_reversion', 'bear_bb_std_mult': 3.5049397051613793, 'bear_rsi_os': 50, 'bear_rsi_ob': 69, 'bear_adx_thresh': 17.418548711647126, 'bear_atr_min_pct': 0.01258844154684187, 'bear_atr_max_pct': 0.03231621296727824, 'bear_tp_mult': 2.6028379365259715, 'bear_tsl_mult': 0.30442337857558244, 'bear_time_stop': 186, 'bear_use_sma': True, 'bear_use_ema': True, 'bear_use_atr': True, 'bear_use_adx': False, 'bear_use_spike': False, 'bear_rsi_required': True, 'sideways_strategy': 'breakout', 'sideways_bb_std_mult': 3.2752756277496773, 'sideways_rsi_os': 27, 'sideways_rsi_ob': 56, 'sideways_adx_thresh': 33.78572908764082, 'sideways_atr_min_pct': 0.0020203583462836865, 'sideways_atr_max_pct': 0.03372884019535305, 'sideways_tp_mult': 1.012943868057281, 'sideways_tsl_mult': 0.1437594422029248, 'sideways_time_stop': 161, 'sideways_use_sma': True, 'sideways_use_ema': True, 'sideways_use_atr': False, 'sideways_use_adx': False, 'sideways_use_spike': False, 'sideways_rsi_required': True}.
[I 2025-08-30 19:06:03,636] Trial 332 finished with values: [-1000000000.0, 1000000000.0] and parameters: {'p_sma': 22, 'p_std': 34, 'p_atr': 9, 'p_adx': 20, 'rsi_period': 24, 'ema1': 26, 'ema2': 15, 'slip_atr_k': 0.07045559044350434, 'slip_spread_k': 0.10632191017797632, 'spread_hl_frac': 0.02745709165402407, 'bb_std_mult': 2.0465632619772083, 'rsi_os': 50, 'rsi_ob': 61, 'vol_spike': 0.04324337480439737, 'adx_thresh': 28.71121738662007, 'atr_min_pct': 0.024950552538901105, 'atr_max_pct': 0.1363655971835122, 'tp_mult': 2.2132104391670913, 'tsl_mult': 0.835003077968184, 'strategy': 'mean_reversion', 'time_stop': 292, 'use_sma': True, 'use_atr': False, 'use_adx': True, 'use_ema': False, 'use_spike': True, 'rsi_required': False, 'edge_k': 0.23087234590047703, 'edge_cap': 0.8114168179653003, 'bull_strategy': 'mean_reversion', 'bull_bb_std_mult': 1.3675188462027474, 'bull_rsi_os': 34, 'bull_rsi_ob': 92, 'bull_adx_thresh': 17.164670464974222, 'bull_atr_min_pct': 0.00143601129292992, 'bull_atr_max_pct': 0.06172995886370539, 'bull_tp_mult': 1.488126942288504, 'bull_tsl_mult': 0.6680715879281041, 'bull_time_stop': 180, 'bull_use_sma': False, 'bull_use_ema': True, 'bull_use_atr': True, 'bull_use_adx': True, 'bull_use_spike': False, 'bull_rsi_required': True, 'bear_strategy': 'breakout', 'bear_bb_std_mult': 2.7892645747710034, 'bear_rsi_os': 51, 'bear_rsi_ob': 76, 'bear_adx_thresh': 16.482730145097474, 'bear_atr_min_pct': 0.01598513398352917, 'bear_atr_max_pct': 0.026960343982664933, 'bear_tp_mult': 2.816132082944144, 'bear_tsl_mult': 0.7636014272372151, 'bear_time_stop': 162, 'bear_use_sma': True, 'bear_use_ema': False, 'bear_use_atr': True, 'bear_use_adx': False, 'bear_use_spike': True, 'bear_rsi_required': True, 'sideways_strategy': 'breakout', 'sideways_bb_std_mult': 3.140282277702758, 'sideways_rsi_os': 7, 'sideways_rsi_ob': 57, 'sideways_adx_thresh': 18.1124408726387, 'sideways_atr_min_pct': 0.0035809332970845736, 'sideways_atr_max_pct': 0.14772907426896645, 'sideways_tp_mult': 1.8818067996130685, 'sideways_tsl_mult': 0.9426854149845655, 'sideways_time_stop': 165, 'sideways_use_sma': False, 'sideways_use_ema': False, 'sideways_use_atr': True, 'sideways_use_adx': True, 'sideways_use_spike': False, 'sideways_rsi_required': True}.
[I 2025-08-30 19:06:37,451] Trial 329 finished with values: [-1000000000.0, 1000000000.0] and parameters: {'p_sma': 49, 'p_std': 29, 'p_atr': 8, 'p_adx': 20, 'rsi_period': 72, 'ema1': 12, 'ema2': 33, 'slip_atr_k': 0.09674771671936344, 'slip_spread_k': 0.7623151905222947, 'spread_hl_frac': 0.02153655248975597, 'bb_std_mult': 3.0566441976683003, 'rsi_os': 21, 'rsi_ob': 85, 'vol_spike': 0.22103985418060262, 'adx_thresh': 28.570707219303387, 'atr_min_pct': 0.010945515490961923, 'atr_max_pct': 0.13560362814767024, 'tp_mult': 2.2433410551361157, 'tsl_mult': 0.6860734228231093, 'strategy': 'mean_reversion', 'time_stop': 175, 'use_sma': True, 'use_atr': True, 'use_adx': True, 'use_ema': True, 'use_spike': True, 'rsi_required': False, 'edge_k': 0.3102232109001516, 'edge_cap': 0.5442896162820506, 'bull_strategy': 'mean_reversion', 'bull_bb_std_mult': 3.064529571018674, 'bull_rsi_os': 28, 'bull_rsi_ob': 47, 'bull_adx_thresh': 22.97942017051395, 'bull_atr_min_pct': 0.001153265863624484, 'bull_atr_max_pct': 0.11537382003282298, 'bull_tp_mult': 2.66424250531991, 'bull_tsl_mult': 0.5470410949506141, 'bull_time_stop': 178, 'bull_use_sma': False, 'bull_use_ema': True, 'bull_use_atr': False, 'bull_use_adx': False, 'bull_use_spike': True, 'bull_rsi_required': True, 'bear_strategy': 'mean_reversion', 'bear_bb_std_mult': 1.7706109625169515, 'bear_rsi_os': 50, 'bear_rsi_ob': 68, 'bear_adx_thresh': 10.663819880432365, 'bear_atr_min_pct': 0.015846950199726546, 'bear_atr_max_pct': 0.10772408158987644, 'bear_tp_mult': 2.3907608786245023, 'bear_tsl_mult': 0.6437041691925895, 'bear_time_stop': 165, 'bear_use_sma': True, 'bear_use_ema': False, 'bear_use_atr': True, 'bear_use_adx': False, 'bear_use_spike': True, 'bear_rsi_required': True, 'sideways_strategy': 'mean_reversion', 'sideways_bb_std_mult': 3.338899281115546, 'sideways_rsi_os': 34, 'sideways_rsi_ob': 49, 'sideways_adx_thresh': 18.602539993915748, 'sideways_atr_min_pct': 0.0022665525022995112, 'sideways_atr_max_pct': 0.1472981987236746, 'sideways_tp_mult': 1.1412318132265602, 'sideways_tsl_mult': 0.9452115403761925, 'sideways_time_stop': 162, 'sideways_use_sma': True, 'sideways_use_ema': True, 'sideways_use_atr': False, 'sideways_use_adx': False, 'sideways_use_spike': False, 'sideways_rsi_required': True}.
[I 2025-08-30 19:06:38,084] Trial 330 finished with values: [-1000000000.0, 1000000000.0] and parameters: {'p_sma': 24, 'p_std': 27, 'p_atr': 12, 'p_adx': 18, 'rsi_period': 72, 'ema1': 26, 'ema2': 48, 'slip_atr_k': 0.0906243307408178, 'slip_spread_k': 0.17170382563641773, 'spread_hl_frac': 0.020141514786348326, 'bb_std_mult': 2.2333234576796754, 'rsi_os': 21, 'rsi_ob': 85, 'vol_spike': 0.21672400368914632, 'adx_thresh': 19.309829116405435, 'atr_min_pct': 0.010714804747656344, 'atr_max_pct': 0.09610905879432577, 'tp_mult': 1.992110106776096, 'tsl_mult': 0.089551217863868, 'strategy': 'mean_reversion', 'time_stop': 175, 'use_sma': True, 'use_atr': True, 'use_adx': True, 'use_ema': True, 'use_spike': True, 'rsi_required': False, 'edge_k': 0.3243434195713678, 'edge_cap': 0.8912066218187465, 'bull_strategy': 'mean_reversion', 'bull_bb_std_mult': 3.0549196248739503, 'bull_rsi_os': 34, 'bull_rsi_ob': 63, 'bull_adx_thresh': 13.43686007312213, 'bull_atr_min_pct': 0.02792287370738189, 'bull_atr_max_pct': 0.11578531681161597, 'bull_tp_mult': 2.9982130096366433, 'bull_tsl_mult': 0.8362976692391373, 'bull_time_stop': 158, 'bull_use_sma': False, 'bull_use_ema': True, 'bull_use_atr': True, 'bull_use_adx': False, 'bull_use_spike': False, 'bull_rsi_required': True, 'bear_strategy': 'breakout', 'bear_bb_std_mult': 1.7638296349991458, 'bear_rsi_os': 50, 'bear_rsi_ob': 70, 'bear_adx_thresh': 10.786118426764183, 'bear_atr_min_pct': 0.01616493831020369, 'bear_atr_max_pct': 0.10821821544429276, 'bear_tp_mult': 2.5726087878405623, 'bear_tsl_mult': 0.6470018156140165, 'bear_time_stop': 112, 'bear_use_sma': True, 'bear_use_ema': False, 'bear_use_atr': True, 'bear_use_adx': False, 'bear_use_spike': True, 'bear_rsi_required': True, 'sideways_strategy': 'breakout', 'sideways_bb_std_mult': 3.3235737051435197, 'sideways_rsi_os': 24, 'sideways_rsi_ob': 57, 'sideways_adx_thresh': 21.390467064609293, 'sideways_atr_min_pct': 0.0034286011590745668, 'sideways_atr_max_pct': 0.14999934169717566, 'sideways_tp_mult': 1.8033570699044694, 'sideways_tsl_mult': 0.953401802096533, 'sideways_time_stop': 164, 'sideways_use_sma': True, 'sideways_use_ema': True, 'sideways_use_atr': True, 'sideways_use_adx': True, 'sideways_use_spike': False, 'sideways_rsi_required': True}.
[I 2025-08-30 19:06:38,195] Trial 331 finished with values: [-1000000000.0, 1000000000.0] and parameters: {'p_sma': 53, 'p_std': 37, 'p_atr': 24, 'p_adx': 28, 'rsi_period': 72, 'ema1': 26, 'ema2': 36, 'slip_atr_k': 0.07258609598413754, 'slip_spread_k': 0.8259954825106706, 'spread_hl_frac': 0.020120802376769397, 'bb_std_mult': 2.2287406967082406, 'rsi_os': 25, 'rsi_ob': 74, 'vol_spike': 0.215954879819782, 'adx_thresh': 33.18654486770089, 'atr_min_pct': 0.013073284902127232, 'atr_max_pct': 0.09660567062815531, 'tp_mult': 2.2239059475813012, 'tsl_mult': 0.833503410228171, 'strategy': 'mean_reversion', 'time_stop': 106, 'use_sma': True, 'use_atr': True, 'use_adx': True, 'use_ema': True, 'use_spike': True, 'rsi_required': False, 'edge_k': 0.32350337809400187, 'edge_cap': 0.2048709140197542, 'bull_strategy': 'mean_reversion', 'bull_bb_std_mult': 3.0573235579338105, 'bull_rsi_os': 45, 'bull_rsi_ob': 48, 'bull_adx_thresh': 8.970935840323529, 'bull_atr_min_pct': 0.02789388391686214, 'bull_atr_max_pct': 0.14789266965094172, 'bull_tp_mult': 2.671267466711039, 'bull_tsl_mult': 0.6080121555268856, 'bull_time_stop': 180, 'bull_use_sma': False, 'bull_use_ema': True, 'bull_use_atr': True, 'bull_use_adx': True, 'bull_use_spike': False, 'bull_rsi_required': True, 'bear_strategy': 'mean_reversion', 'bear_bb_std_mult': 2.781627113162984, 'bear_rsi_os': 26, 'bear_rsi_ob': 75, 'bear_adx_thresh': 13.738789627959541, 'bear_atr_min_pct': 0.0016144617955261235, 'bear_atr_max_pct': 0.07886892667070608, 'bear_tp_mult': 2.5844243857896103, 'bear_tsl_mult': 0.7799698371869246, 'bear_time_stop': 187, 'bear_use_sma': True, 'bear_use_ema': False, 'bear_use_atr': True, 'bear_use_adx': False, 'bear_use_spike': True, 'bear_rsi_required': True, 'sideways_strategy': 'breakout', 'sideways_bb_std_mult': 3.266274789327388, 'sideways_rsi_os': 26, 'sideways_rsi_ob': 66, 'sideways_adx_thresh': 17.89829919354694, 'sideways_atr_min_pct': 0.0031550912977659964, 'sideways_atr_max_pct': 0.14737761231765734, 'sideways_tp_mult': 1.1743609572736406, 'sideways_tsl_mult': 0.13679579009336146, 'sideways_time_stop': 162, 'sideways_use_sma': True, 'sideways_use_ema': True, 'sideways_use_atr': True, 'sideways_use_adx': True, 'sideways_use_spike': False, 'sideways_rsi_required': True}.
