[I 2025-08-30 18:46:23,432] Trial 152 finished with values: [-1000000000.0, 1000000000.0] and parameters: {'p_sma': 7, 'p_std': 28, 'p_atr': 9, 'p_adx': 20, 'rsi_period': 28, 'ema1': 7, 'ema2': 26, 'slip_atr_k': 0.009155063911658878, 'slip_spread_k': 0.08397143519436262, 'spread_hl_frac': 0.021917724850778725, 'bb_std_mult': 2.167694101505374, 'rsi_os': 46, 'rsi_ob': 83, 'vol_spike': 0.026505665299459913, 'adx_thresh': 31.962676430903862, 'atr_min_pct': 0.0012979836850439234, 'atr_max_pct': 0.09441847625210148, 'tp_mult': 1.915963673598059, 'tsl_mult': 0.8976321382500055, 'strategy': 'mean_reversion', 'time_stop': 147, 'use_sma': True, 'use_atr': True, 'use_adx': False, 'use_ema': False, 'use_spike': True, 'rsi_required': False, 'edge_k': 1.7426004924041703, 'edge_cap': 0.5207478581831912, 'bull_strategy': 'mean_reversion', 'bull_bb_std_mult': 3.2346619817379962, 'bull_rsi_os': 33, 'bull_rsi_ob': 57, 'bull_adx_thresh': 20.297610764023965, 'bull_atr_min_pct': 0.011472075641794442, 'bull_atr_max_pct': 0.09901980796075519, 'bull_tp_mult': 1.23342169553338, 'bull_tsl_mult': 0.14452625893664672, 'bull_time_stop': 14, 'bull_use_sma': False, 'bull_use_ema': True, 'bull_use_atr': True, 'bull_use_adx': True, 'bull_use_spike': False, 'bull_rsi_required': False, 'bear_strategy': 'mean_reversion', 'bear_bb_std_mult': 1.9302679601176052, 'bear_rsi_os': 18, 'bear_rsi_ob': 47, 'bear_adx_thresh': 23.998628172142485, 'bear_atr_min_pct': 0.014204049266775858, 'bear_atr_max_pct': 0.03948029788892739, 'bear_tp_mult': 2.857907935525932, 'bear_tsl_mult': 0.656491102501217, 'bear_time_stop': 233, 'bear_use_sma': True, 'bear_use_ema': True, 'bear_use_atr': False, 'bear_use_adx': False, 'bear_use_spike': False, 'bear_rsi_required': True, 'sideways_strategy': 'breakout', 'sideways_bb_std_mult': 1.806171843929094, 'sideways_rsi_os': 36, 'sideways_rsi_ob': 55, 'sideways_adx_thresh': 18.226046098541904, 'sideways_atr_min_pct': 0.021760669493900292, 'sideways_atr_max_pct': 0.14616675984967564, 'sideways_tp_mult': 2.5168507988966335, 'sideways_tsl_mult': 0.9534233116836573, 'sideways_time_stop': 182, 'sideways_use_sma': False, 'sideways_use_ema': True, 'sideways_use_atr': True, 'sideways_use_adx': False, 'sideways_use_spike': False, 'sideways_rsi_required': True}.
[I 2025-08-30 18:46:23,828] Trial 156 finished with values: [-1000000000.0, 1000000000.0] and parameters: {'p_sma': 54, 'p_std': 30, 'p_atr': 8, 'p_adx': 29, 'rsi_period': 23, 'ema1': 10, 'ema2': 49, 'slip_atr_k': 0.07271939082914414, 'slip_spread_k': 0.7647896063466766, 'spread_hl_frac': 0.023488312491265338, 'bb_std_mult': 2.137507817954717, 'rsi_os': 53, 'rsi_ob': 82, 'vol_spike': 0.04432173384612399, 'adx_thresh': 33.53110028256994, 'atr_min_pct': 0.015600142668686276, 'atr_max_pct': 0.09043226678691788, 'tp_mult': 2.9235934707841915, 'tsl_mult': 0.7833739066114501, 'strategy': 'mean_reversion', 'time_stop': 192, 'use_sma': False, 'use_atr': False, 'use_adx': True, 'use_ema': False, 'use_spike': False, 'rsi_required': True, 'edge_k': 1.2674500911138713, 'edge_cap': 0.4873207438558686, 'bull_strategy': 'breakout', 'bull_bb_std_mult': 3.2460570884186257, 'bull_rsi_os': 6, 'bull_rsi_ob': 47, 'bull_adx_thresh': 17.670640948397743, 'bull_atr_min_pct': 0.002734194854109977, 'bull_atr_max_pct': 0.11552143401323542, 'bull_tp_mult': 2.699551022104486, 'bull_tsl_mult': 0.48730007394828295, 'bull_time_stop': 178, 'bull_use_sma': True, 'bull_use_ema': True, 'bull_use_atr': False, 'bull_use_adx': False, 'bull_use_spike': True, 'bull_rsi_required': True, 'bear_strategy': 'mean_reversion', 'bear_bb_std_mult': 2.63340394095268, 'bear_rsi_os': 54, 'bear_rsi_ob': 46, 'bear_adx_thresh': 9.030197669842591, 'bear_atr_min_pct': 0.008276667982380765, 'bear_atr_max_pct': 0.037558190176690175, 'bear_tp_mult': 1.1442170923748964, 'bear_tsl_mult': 0.16301595123800844, 'bear_time_stop': 5, 'bear_use_sma': False, 'bear_use_ema': True, 'bear_use_atr': False, 'bear_use_adx': False, 'bear_use_spike': True, 'bear_rsi_required': True, 'sideways_strategy': 'breakout', 'sideways_bb_std_mult': 3.164005457972944, 'sideways_rsi_os': 38, 'sideways_rsi_ob': 60, 'sideways_adx_thresh': 20.217786173714615, 'sideways_atr_min_pct': 0.0021436078306975572, 'sideways_atr_max_pct': 0.1095280808558872, 'sideways_tp_mult': 1.0532411287659458, 'sideways_tsl_mult': 0.27536677244095503, 'sideways_time_stop': 160, 'sideways_use_sma': True, 'sideways_use_ema': True, 'sideways_use_atr': True, 'sideways_use_adx': False, 'sideways_use_spike': False, 'sideways_rsi_required': True}.
[I 2025-08-30 18:46:54,679] Trial 154 finished with values: [-1000000000.0, 1000000000.0] and parameters: {'p_sma': 10, 'p_std': 30, 'p_atr': 23, 'p_adx': 20, 'rsi_period': 28, 'ema1': 7, 'ema2': 29, 'slip_atr_k': 0.0914578381751813, 'slip_spread_k': 0.22585599857509803, 'spread_hl_frac': 0.022635743387894737, 'bb_std_mult': 0.7420482629577145, 'rsi_os': 40, 'rsi_ob': 83, 'vol_spike': 0.15353771205623246, 'adx_thresh': 33.4405994014305, 'atr_min_pct': 0.015554295541677058, 'atr_max_pct': 0.09064704255718876, 'tp_mult': 2.2210403645261545, 'tsl_mult': 0.789723824635529, 'strategy': 'mean_reversion', 'time_stop': 190, 'use_sma': False, 'use_atr': True, 'use_adx': False, 'use_ema': False, 'use_spike': True, 'rsi_required': True, 'edge_k': 1.743282254016889, 'edge_cap': 0.5160157509893095, 'bull_strategy': 'breakout', 'bull_bb_std_mult': 3.000154007891387, 'bull_rsi_os': 47, 'bull_rsi_ob': 67, 'bull_adx_thresh': 20.512587816551523, 'bull_atr_min_pct': 0.0029008150260546083, 'bull_atr_max_pct': 0.11593384763113293, 'bull_tp_mult': 2.750113736427201, 'bull_tsl_mult': 0.6048309389551824, 'bull_time_stop': 189, 'bull_use_sma': False, 'bull_use_ema': True, 'bull_use_atr': True, 'bull_use_adx': True, 'bull_use_spike': False, 'bull_rsi_required': False, 'bear_strategy': 'mean_reversion', 'bear_bb_std_mult': 3.1179545356518115, 'bear_rsi_os': 40, 'bear_rsi_ob': 79, 'bear_adx_thresh': 19.796155740086096, 'bear_atr_min_pct': 0.01444244683144338, 'bear_atr_max_pct': 0.023077389974346878, 'bear_tp_mult': 2.651477205089549, 'bear_tsl_mult': 0.843793604889266, 'bear_time_stop': 5, 'bear_use_sma': False, 'bear_use_ema': True, 'bear_use_atr': False, 'bear_use_adx': False, 'bear_use_spike': True, 'bear_rsi_required': True, 'sideways_strategy': 'breakout', 'sideways_bb_std_mult': 3.190546270809584, 'sideways_rsi_os': 35, 'sideways_rsi_ob': 55, 'sideways_adx_thresh': 20.39397979544525, 'sideways_atr_min_pct': 0.02160983839789825, 'sideways_atr_max_pct': 0.14928006038421315, 'sideways_tp_mult': 2.5045013228029678, 'sideways_tsl_mult': 0.9720516468931153, 'sideways_time_stop': 159, 'sideways_use_sma': False, 'sideways_use_ema': True, 'sideways_use_atr': True, 'sideways_use_adx': False, 'sideways_use_spike': False, 'sideways_rsi_required': True}.
[I 2025-08-30 18:46:56,298] Trial 155 finished with values: [-1000000000.0, 1000000000.0] and parameters: {'p_sma': 54, 'p_std': 29, 'p_atr': 8, 'p_adx': 29, 'rsi_period': 74, 'ema1': 29, 'ema2': 33, 'slip_atr_k': 0.23167349838844303, 'slip_spread_k': 0.10723769716943879, 'spread_hl_frac': 0.03912547824455706, 'bb_std_mult': 2.1690388507817335, 'rsi_os': 19, 'rsi_ob': 92, 'vol_spike': 0.2111702229948481, 'adx_thresh': 33.62094191890701, 'atr_min_pct': 0.02477500844230285, 'atr_max_pct': 0.058061059867916896, 'tp_mult': 2.227170801953582, 'tsl_mult': 0.2750333213671678, 'strategy': 'mean_reversion', 'time_stop': 183, 'use_sma': False, 'use_atr': True, 'use_adx': True, 'use_ema': False, 'use_spike': False, 'rsi_required': True, 'edge_k': 1.7356616386284056, 'edge_cap': 0.5209865977450804, 'bull_strategy': 'breakout', 'bull_bb_std_mult': 3.144451574495007, 'bull_rsi_os': 48, 'bull_rsi_ob': 45, 'bull_adx_thresh': 17.820517144468447, 'bull_atr_min_pct': 0.002907232364213464, 'bull_atr_max_pct': 0.11495000447315055, 'bull_tp_mult': 2.7591291745484177, 'bull_tsl_mult': 0.6018233145563898, 'bull_time_stop': 179, 'bull_use_sma': False, 'bull_use_ema': True, 'bull_use_atr': False, 'bull_use_adx': True, 'bull_use_spike': True, 'bull_rsi_required': False, 'bear_strategy': 'mean_reversion', 'bear_bb_std_mult': 3.1065665549332597, 'bear_rsi_os': 15, 'bear_rsi_ob': 47, 'bear_adx_thresh': 23.747289449925486, 'bear_atr_min_pct': 0.014213958669439943, 'bear_atr_max_pct': 0.038766153948579886, 'bear_tp_mult': 2.568149455639653, 'bear_tsl_mult': 0.6754196283451819, 'bear_time_stop': 178, 'bear_use_sma': False, 'bear_use_ema': True, 'bear_use_atr': False, 'bear_use_adx': False, 'bear_use_spike': True, 'bear_rsi_required': True, 'sideways_strategy': 'breakout', 'sideways_bb_std_mult': 3.122518221438018, 'sideways_rsi_os': 35, 'sideways_rsi_ob': 60, 'sideways_adx_thresh': 17.996567967173007, 'sideways_atr_min_pct': 0.0022314490722743097, 'sideways_atr_max_pct': 0.05765560362281545, 'sideways_tp_mult': 1.0476592048707798, 'sideways_tsl_mult': 0.34473885440879876, 'sideways_time_stop': 181, 'sideways_use_sma': True, 'sideways_use_ema': True, 'sideways_use_atr': False, 'sideways_use_adx': False, 'sideways_use_spike': False, 'sideways_rsi_required': True}.
[I 2025-08-30 18:46:56,706] Trial 157 finished with values: [-1000000000.0, 1000000000.0] and parameters: {'p_sma': 9, 'p_std': 19, 'p_atr': 8, 'p_adx': 29, 'rsi_period': 24, 'ema1': 29, 'ema2': 29, 'slip_atr_k': 0.2341576987618526, 'slip_spread_k': 0.6974267496104875, 'spread_hl_frac': 0.03931197902206248, 'bb_std_mult': 3.513695622874086, 'rsi_os': 40, 'rsi_ob': 88, 'vol_spike': 0.15598560841619746, 'adx_thresh': 33.699727181574055, 'atr_min_pct': 0.015247212404056378, 'atr_max_pct': 0.09056765668162589, 'tp_mult': 2.2107952101298363, 'tsl_mult': 0.4045777436892044, 'strategy': 'mean_reversion', 'time_stop': 189, 'use_sma': False, 'use_atr': False, 'use_adx': True, 'use_ema': False, 'use_spike': False, 'rsi_required': True, 'edge_k': 1.264705115894606, 'edge_cap': 0.44184633135903223, 'bull_strategy': 'breakout', 'bull_bb_std_mult': 3.298104068125781, 'bull_rsi_os': 6, 'bull_rsi_ob': 45, 'bull_adx_thresh': 23.45943675087724, 'bull_atr_min_pct': 0.025866756131445574, 'bull_atr_max_pct': 0.13114731578824612, 'bull_tp_mult': 2.747733965902199, 'bull_tsl_mult': 0.039186869159229865, 'bull_time_stop': 178, 'bull_use_sma': True, 'bull_use_ema': True, 'bull_use_atr': False, 'bull_use_adx': False, 'bull_use_spike': True, 'bull_rsi_required': True, 'bear_strategy': 'breakout', 'bear_bb_std_mult': 3.112978720291633, 'bear_rsi_os': 7, 'bear_rsi_ob': 75, 'bear_adx_thresh': 14.866050896605547, 'bear_atr_min_pct': 0.009289181547016039, 'bear_atr_max_pct': 0.11995723133259008, 'bear_tp_mult': 1.1612159603883718, 'bear_tsl_mult': 0.41412295760928497, 'bear_time_stop': 240, 'bear_use_sma': False, 'bear_use_ema': True, 'bear_use_atr': True, 'bear_use_adx': False, 'bear_use_spike': True, 'bear_rsi_required': True, 'sideways_strategy': 'breakout', 'sideways_bb_std_mult': 3.160190575404754, 'sideways_rsi_os': 38, 'sideways_rsi_ob': 60, 'sideways_adx_thresh': 21.60949050430321, 'sideways_atr_min_pct': 0.009329263337103329, 'sideways_atr_max_pct': 0.0673973263584785, 'sideways_tp_mult': 1.0670586084145477, 'sideways_tsl_mult': 0.7997718303161376, 'sideways_time_stop': 159, 'sideways_use_sma': True, 'sideways_use_ema': True, 'sideways_use_atr': True, 'sideways_use_adx': False, 'sideways_use_spike': False, 'sideways_rsi_required': True}.
[I 2025-08-30 18:46:57,053] Trial 158 finished with values: [-0.0445832047389918, 0.04456982524139286] and parameters: {'p_sma': 44, 'p_std': 60, 'p_atr': 25, 'p_adx': 21, 'rsi_period': 25, 'ema1': 29, 'ema2': 34, 'slip_atr_k': 0.09257555355056422, 'slip_spread_k': 0.23212165969364715, 'spread_hl_frac': 0.04475561964468309, 'bb_std_mult': 3.5312934153010893, 'rsi_os': 40, 'rsi_ob': 88, 'vol_spike': 0.2683566377058139, 'adx_thresh': 33.19646464879138, 'atr_min_pct': 0.02462180172660579, 'atr_max_pct': 0.12857820458962507, 'tp_mult': 2.845754006366824, 'tsl_mult': 0.802033279166332, 'strategy': 'mean_reversion', 'time_stop': 35, 'use_sma': False, 'use_atr': True, 'use_adx': True, 'use_ema': False, 'use_spike': True, 'rsi_required': True, 'edge_k': 0.6368547202653128, 'edge_cap': 0.9545718074517171, 'bull_strategy': 'mean_reversion', 'bull_bb_std_mult': 0.6586792438078404, 'bull_rsi_os': 31, 'bull_rsi_ob': 45, 'bull_adx_thresh': 21.388534801519114, 'bull_atr_min_pct': 0.008295300559335743, 'bull_atr_max_pct': 0.13302292435020696, 'bull_tp_mult': 2.110091426632247, 'bull_tsl_mult': 0.5343649431805424, 'bull_time_stop': 189, 'bull_use_sma': False, 'bull_use_ema': True, 'bull_use_atr': True, 'bull_use_adx': False, 'bull_use_spike': False, 'bull_rsi_required': True, 'bear_strategy': 'breakout', 'bear_bb_std_mult': 3.0916068937577483, 'bear_rsi_os': 7, 'bear_rsi_ob': 89, 'bear_adx_thresh': 14.229193956532884, 'bear_atr_min_pct': 0.015689277549952026, 'bear_atr_max_pct': 0.08902616182967976, 'bear_tp_mult': 2.5674056147355855, 'bear_tsl_mult': 0.8354060586416664, 'bear_time_stop': 171, 'bear_use_sma': False, 'bear_use_ema': True, 'bear_use_atr': True, 'bear_use_adx': False, 'bear_use_spike': False, 'bear_rsi_required': True, 'sideways_strategy': 'breakout', 'sideways_bb_std_mult': 3.3559687233773703, 'sideways_rsi_os': 35, 'sideways_rsi_ob': 58, 'sideways_adx_thresh': 19.35245666111303, 'sideways_atr_min_pct': 0.0013850200366602357, 'sideways_atr_max_pct': 0.0256017625396995, 'sideways_tp_mult': 1.1143335267398196, 'sideways_tsl_mult': 0.7948246437132883, 'sideways_time_stop': 5, 'sideways_use_sma': False, 'sideways_use_ema': True, 'sideways_use_atr': False, 'sideways_use_adx': False, 'sideways_use_spike': False, 'sideways_rsi_required': True}.
[I 2025-08-30 18:46:57,348] Trial 159 finished with values: [-1000000000.0, 1000000000.0] and parameters: {'p_sma': 45, 'p_std': 46, 'p_atr': 7, 'p_adx': 17, 'rsi_period': 25, 'ema1': 16, 'ema2': 33, 'slip_atr_k': 0.22898476400993817, 'slip_spread_k': 0.11475947768525346, 'spread_hl_frac': 0.020125430635715934, 'bb_std_mult': 1.758886234612465, 'rsi_os': 22, 'rsi_ob': 77, 'vol_spike': 0.2675456541587859, 'adx_thresh': 8.262040854493634, 'atr_min_pct': 0.02475853345863081, 'atr_max_pct': 0.024489454917653933, 'tp_mult': 2.8573757159284208, 'tsl_mult': 0.4103195528936355, 'strategy': 'breakout', 'time_stop': 35, 'use_sma': False, 'use_atr': False, 'use_adx': True, 'use_ema': True, 'use_spike': False, 'rsi_required': False, 'edge_k': 0.1272546703507848, 'edge_cap': 0.44048841334319977, 'bull_strategy': 'mean_reversion', 'bull_bb_std_mult': 0.6371856462625622, 'bull_rsi_os': 31, 'bull_rsi_ob': 61, 'bull_adx_thresh': 21.654902957140436, 'bull_atr_min_pct': 0.008158211967288078, 'bull_atr_max_pct': 0.13303570509781157, 'bull_tp_mult': 2.1201738366760146, 'bull_tsl_mult': 0.061142651735246134, 'bull_time_stop': 170, 'bull_use_sma': False, 'bull_use_ema': False, 'bull_use_atr': False, 'bull_use_adx': False, 'bull_use_spike': True, 'bull_rsi_required': True, 'bear_strategy': 'breakout', 'bear_bb_std_mult': 2.7393501837824425, 'bear_rsi_os': 51, 'bear_rsi_ob': 75, 'bear_adx_thresh': 14.319980582896383, 'bear_atr_min_pct': 0.016000890725272117, 'bear_atr_max_pct': 0.12026965589790621, 'bear_tp_mult': 2.555021694434529, 'bear_tsl_mult': 0.7157827978061636, 'bear_time_stop': 211, 'bear_use_sma': True, 'bear_use_ema': True, 'bear_use_atr': True, 'bear_use_adx': True, 'bear_use_spike': False, 'bear_rsi_required': True, 'sideways_strategy': 'breakout', 'sideways_bb_std_mult': 3.347343960712545, 'sideways_rsi_os': 33, 'sideways_rsi_ob': 62, 'sideways_adx_thresh': 24.934166309547038, 'sideways_atr_min_pct': 0.0009737307092888483, 'sideways_atr_max_pct': 0.11236513977592681, 'sideways_tp_mult': 1.103543132673844, 'sideways_tsl_mult': 0.35435922975503054, 'sideways_time_stop': 211, 'sideways_use_sma': True, 'sideways_use_ema': True, 'sideways_use_atr': False, 'sideways_use_adx': False, 'sideways_use_spike': False, 'sideways_rsi_required': True}.
[I 2025-08-30 18:47:28,981] Trial 160 finished with values: [-0.08338914029775313, 0.08337735090048828] and parameters: {'p_sma': 47, 'p_std': 60, 'p_atr': 7, 'p_adx': 10, 'rsi_period': 25, 'ema1': 26, 'ema2': 35, 'slip_atr_k': 0.17311060408907453, 'slip_spread_k': 0.19269025906747292, 'spread_hl_frac': 0.0007238889858513578, 'bb_std_mult': 2.2873065659846548, 'rsi_os': 29, 'rsi_ob': 89, 'vol_spike': 0.26564350888343885, 'adx_thresh': 17.362835377119325, 'atr_min_pct': 0.023915897964712985, 'atr_max_pct': 0.14292456600199582, 'tp_mult': 2.3218162323083478, 'tsl_mult': 0.36929095788965893, 'strategy': 'breakout', 'time_stop': 45, 'use_sma': False, 'use_atr': False, 'use_adx': True, 'use_ema': True, 'use_spike': True, 'rsi_required': False, 'edge_k': 0.1110455438218853, 'edge_cap': 0.4382738305179022, 'bull_strategy': 'mean_reversion', 'bull_bb_std_mult': 2.2276934763586813, 'bull_rsi_os': 31, 'bull_rsi_ob': 45, 'bull_adx_thresh': 14.60429855316986, 'bull_atr_min_pct': 0.02577583923438221, 'bull_atr_max_pct': 0.06358442354813815, 'bull_tp_mult': 2.673486474855308, 'bull_tsl_mult': 0.5423264088060918, 'bull_time_stop': 170, 'bull_use_sma': True, 'bull_use_ema': False, 'bull_use_atr': True, 'bull_use_adx': False, 'bull_use_spike': False, 'bull_rsi_required': True, 'bear_strategy': 'breakout', 'bear_bb_std_mult': 2.7594704389558373, 'bear_rsi_os': 51, 'bear_rsi_ob': 76, 'bear_adx_thresh': 14.737115777928716, 'bear_atr_min_pct': 0.01582602844982442, 'bear_atr_max_pct': 0.11984605189241065, 'bear_tp_mult': 2.5968679712617986, 'bear_tsl_mult': 0.93119730242494, 'bear_time_stop': 212, 'bear_use_sma': True, 'bear_use_ema': True, 'bear_use_atr': True, 'bear_use_adx': True, 'bear_use_spike': False, 'bear_rsi_required': False, 'sideways_strategy': 'breakout', 'sideways_bb_std_mult': 2.015057725355447, 'sideways_rsi_os': 34, 'sideways_rsi_ob': 62, 'sideways_adx_thresh': 24.80756498078022, 'sideways_atr_min_pct': 0.0009006109588363743, 'sideways_atr_max_pct': 0.05144072726861722, 'sideways_tp_mult': 1.7587316657120835, 'sideways_tsl_mult': 0.9728249837474701, 'sideways_time_stop': 235, 'sideways_use_sma': False, 'sideways_use_ema': False, 'sideways_use_atr': True, 'sideways_use_adx': True, 'sideways_use_spike': True, 'sideways_rsi_required': False}.
[I 2025-08-30 18:47:29,846] Trial 161 finished with values: [-0.021472254447392536, 0.021561268745764427] and parameters: {'p_sma': 45, 'p_std': 33, 'p_atr': 10, 'p_adx': 17, 'rsi_period': 51, 'ema1': 28, 'ema2': 31, 'slip_atr_k': 0.05172647859938004, 'slip_spread_k': 0.14845546018633185, 'spread_hl_frac': 0.00013070928404376042, 'bb_std_mult': 2.4418580765214246, 'rsi_os': 49, 'rsi_ob': 79, 'vol_spike': 0.26527954084039546, 'adx_thresh': 14.969718785744048, 'atr_min_pct': 0.02345419666360713, 'atr_max_pct': 0.046043364251063874, 'tp_mult': 2.3308704469630204, 'tsl_mult': 0.5769009255669149, 'strategy': 'breakout', 'time_stop': 116, 'use_sma': True, 'use_atr': True, 'use_adx': True, 'use_ema': True, 'use_spike': True, 'rsi_required': False, 'edge_k': 0.3548142300612268, 'edge_cap': 0.47080865628374097, 'bull_strategy': 'mean_reversion', 'bull_bb_std_mult': 0.6800473336628667, 'bull_rsi_os': 31, 'bull_rsi_ob': 49, 'bull_adx_thresh': 13.951789433877527, 'bull_atr_min_pct': 0.00376076694201391, 'bull_atr_max_pct': 0.10841591323514799, 'bull_tp_mult': 1.3861909436041366, 'bull_tsl_mult': 0.542915555771328, 'bull_time_stop': 171, 'bull_use_sma': False, 'bull_use_ema': False, 'bull_use_atr': True, 'bull_use_adx': False, 'bull_use_spike': False, 'bull_rsi_required': True, 'bear_strategy': 'breakout', 'bear_bb_std_mult': 1.2632149842884832, 'bear_rsi_os': 51, 'bear_rsi_ob': 89, 'bear_adx_thresh': 16.680388557825367, 'bear_atr_min_pct': 0.019618836211507392, 'bear_atr_max_pct': 0.08770368549179984, 'bear_tp_mult': 1.2420335507050992, 'bear_tsl_mult': 0.012631096053200397, 'bear_time_stop': 216, 'bear_use_sma': True, 'bear_use_ema': True, 'bear_use_atr': True, 'bear_use_adx': True, 'bear_use_spike': False, 'bear_rsi_required': False, 'sideways_strategy': 'breakout', 'sideways_bb_std_mult': 3.0353885603052113, 'sideways_rsi_os': 33, 'sideways_rsi_ob': 58, 'sideways_adx_thresh': 19.53876285203701, 'sideways_atr_min_pct': 0.0012034325896104524, 'sideways_atr_max_pct': 0.08090760366781158, 'sideways_tp_mult': 2.228742940239409, 'sideways_tsl_mult': 0.6075847398006822, 'sideways_time_stop': 25, 'sideways_use_sma': False, 'sideways_use_ema': False, 'sideways_use_atr': True, 'sideways_use_adx': True, 'sideways_use_spike': True, 'sideways_rsi_required': False}.
