[I 2025-08-30 19:04:14,792] Trial 316 finished with values: [-1000000000.0, 1000000000.0] and parameters: {'p_sma': 7, 'p_std': 35, 'p_atr': 20, 'p_adx': 22, 'rsi_period': 22, 'ema1': 8, 'ema2': 37, 'slip_atr_k': 0.08223745033886629, 'slip_spread_k': 0.17025617971250523, 'spread_hl_frac': 0.025548511054452678, 'bb_std_mult': 2.3477905725384063, 'rsi_os': 6, 'rsi_ob': 55, 'vol_spike': 0.2618422098291368, 'adx_thresh': 34.35408179589053, 'atr_min_pct': 0.023587742291651448, 'atr_max_pct': 0.021726188952159442, 'tp_mult': 2.6004843175728496, 'tsl_mult': 0.7186443216280981, 'strategy': 'mean_reversion', 'time_stop': 151, 'use_sma': False, 'use_atr': False, 'use_adx': False, 'use_ema': False, 'use_spike': True, 'rsi_required': False, 'edge_k': 0.15507168361533874, 'edge_cap': 0.4890988037237212, 'bull_strategy': 'mean_reversion', 'bull_bb_std_mult': 2.3839863462433315, 'bull_rsi_os': 53, 'bull_rsi_ob': 54, 'bull_adx_thresh': 18.16195113989574, 'bull_atr_min_pct': 0.015319407021093478, 'bull_atr_max_pct': 0.0765740055605478, 'bull_tp_mult': 1.177805916698857, 'bull_tsl_mult': 0.5484669364639121, 'bull_time_stop': 171, 'bull_use_sma': False, 'bull_use_ema': True, 'bull_use_atr': True, 'bull_use_adx': True, 'bull_use_spike': False, 'bull_rsi_required': False, 'bear_strategy': 'breakout', 'bear_bb_std_mult': 2.9425600738343443, 'bear_rsi_os': 50, 'bear_rsi_ob': 78, 'bear_adx_thresh': 19.429380270463273, 'bear_atr_min_pct': 0.013975649510682073, 'bear_atr_max_pct': 0.05062931764994705, 'bear_tp_mult': 2.9952611003852354, 'bear_tsl_mult': 0.354054253635312, 'bear_time_stop': 102, 'bear_use_sma': True, 'bear_use_ema': True, 'bear_use_atr': False, 'bear_use_adx': False, 'bear_use_spike': False, 'bear_rsi_required': True, 'sideways_strategy': 'breakout', 'sideways_bb_std_mult': 3.17583132083067, 'sideways_rsi_os': 54, 'sideways_rsi_ob': 80, 'sideways_adx_thresh': 21.851066195346082, 'sideways_atr_min_pct': 0.0009262154064577268, 'sideways_atr_max_pct': 0.1499028756016324, 'sideways_tp_mult': 1.1423952829626358, 'sideways_tsl_mult': 0.9811559952686668, 'sideways_time_stop': 144, 'sideways_use_sma': False, 'sideways_use_ema': False, 'sideways_use_atr': True, 'sideways_use_adx': False, 'sideways_use_spike': False, 'sideways_rsi_required': True}.
[I 2025-08-30 19:04:41,223] Trial 312 finished with values: [-1000000000.0, 1000000000.0] and parameters: {'p_sma': 10, 'p_std': 32, 'p_atr': 7, 'p_adx': 19, 'rsi_period': 78, 'ema1': 26, 'ema2': 34, 'slip_atr_k': 0.22381550529047378, 'slip_spread_k': 0.5806865660978244, 'spread_hl_frac': 0.025521038326134463, 'bb_std_mult': 2.346874874944629, 'rsi_os': 41, 'rsi_ob': 55, 'vol_spike': 0.27043951685800716, 'adx_thresh': 20.48471456827186, 'atr_min_pct': 0.020499824137301087, 'atr_max_pct': 0.09354569955200369, 'tp_mult': 2.3123532482965783, 'tsl_mult': 0.8148309383344214, 'strategy': 'mean_reversion', 'time_stop': 186, 'use_sma': True, 'use_atr': True, 'use_adx': True, 'use_ema': True, 'use_spike': False, 'rsi_required': False, 'edge_k': 0.4230139852412965, 'edge_cap': 0.0734492924266894, 'bull_strategy': 'mean_reversion', 'bull_bb_std_mult': 2.3945267610105825, 'bull_rsi_os': 29, 'bull_rsi_ob': 61, 'bull_adx_thresh': 25.330448992187442, 'bull_atr_min_pct': 0.026073739649999393, 'bull_atr_max_pct': 0.07142919596807441, 'bull_tp_mult': 2.882965068216988, 'bull_tsl_mult': 0.15044318242399324, 'bull_time_stop': 113, 'bull_use_sma': False, 'bull_use_ema': True, 'bull_use_atr': True, 'bull_use_adx': False, 'bull_use_spike': False, 'bull_rsi_required': True, 'bear_strategy': 'mean_reversion', 'bear_bb_std_mult': 2.8887245982298864, 'bear_rsi_os': 10, 'bear_rsi_ob': 72, 'bear_adx_thresh': 27.01857978821696, 'bear_atr_min_pct': 0.008216433230186906, 'bear_atr_max_pct': 0.09323721625290811, 'bear_tp_mult': 2.0047198806592452, 'bear_tsl_mult': 0.7929969629369352, 'bear_time_stop': 27, 'bear_use_sma': False, 'bear_use_ema': False, 'bear_use_atr': True, 'bear_use_adx': False, 'bear_use_spike': True, 'bear_rsi_required': True, 'sideways_strategy': 'breakout', 'sideways_bb_std_mult': 3.2709174007160393, 'sideways_rsi_os': 35, 'sideways_rsi_ob': 86, 'sideways_adx_thresh': 20.754358897128483, 'sideways_atr_min_pct': 0.0010877282057223999, 'sideways_atr_max_pct': 0.01902782544235896, 'sideways_tp_mult': 1.6664501161218783, 'sideways_tsl_mult': 0.9356101084529421, 'sideways_time_stop': 144, 'sideways_use_sma': True, 'sideways_use_ema': True, 'sideways_use_atr': True, 'sideways_use_adx': True, 'sideways_use_spike': False, 'sideways_rsi_required': True}.
[I 2025-08-30 19:04:47,092] Trial 317 finished with values: [-1000000000.0, 1000000000.0] and parameters: {'p_sma': 10, 'p_std': 31, 'p_atr': 12, 'p_adx': 19, 'rsi_period': 22, 'ema1': 8, 'ema2': 25, 'slip_atr_k': 0.13097434033410665, 'slip_spread_k': 0.16764921029029514, 'spread_hl_frac': 0.001838398921988206, 'bb_std_mult': 2.3580797106033518, 'rsi_os': 47, 'rsi_ob': 82, 'vol_spike': 0.2646137800936153, 'adx_thresh': 31.77283260807375, 'atr_min_pct': 0.005227255456696923, 'atr_max_pct': 0.09585426514927173, 'tp_mult': 2.2103174668158423, 'tsl_mult': 0.13910141776236362, 'strategy': 'mean_reversion', 'time_stop': 77, 'use_sma': False, 'use_atr': False, 'use_adx': False, 'use_ema': False, 'use_spike': True, 'rsi_required': False, 'edge_k': 0.16590456313270677, 'edge_cap': 0.6370588660447755, 'bull_strategy': 'mean_reversion', 'bull_bb_std_mult': 2.386240022344988, 'bull_rsi_os': 26, 'bull_rsi_ob': 49, 'bull_adx_thresh': 17.772000361851283, 'bull_atr_min_pct': 0.002294724726222689, 'bull_atr_max_pct': 0.126862502241076, 'bull_tp_mult': 1.191310201768942, 'bull_tsl_mult': 0.5693547535293251, 'bull_time_stop': 19, 'bull_use_sma': False, 'bull_use_ema': True, 'bull_use_atr': True, 'bull_use_adx': True, 'bull_use_spike': False, 'bull_rsi_required': False, 'bear_strategy': 'breakout', 'bear_bb_std_mult': 2.944052831216673, 'bear_rsi_os': 51, 'bear_rsi_ob': 78, 'bear_adx_thresh': 19.547671456381956, 'bear_atr_min_pct': 0.01395454976385162, 'bear_atr_max_pct': 0.05138093309931946, 'bear_tp_mult': 2.7334376888739205, 'bear_tsl_mult': 0.7792377043068401, 'bear_time_stop': 217, 'bear_use_sma': True, 'bear_use_ema': True, 'bear_use_atr': False, 'bear_use_adx': False, 'bear_use_spike': False, 'bear_rsi_required': True, 'sideways_strategy': 'breakout', 'sideways_bb_std_mult': 2.6000333346439444, 'sideways_rsi_os': 23, 'sideways_rsi_ob': 61, 'sideways_adx_thresh': 24.239254566255358, 'sideways_atr_min_pct': 0.0011369540205920688, 'sideways_atr_max_pct': 0.03967963653669715, 'sideways_tp_mult': 1.0106013372391822, 'sideways_tsl_mult': 0.9771267674059383, 'sideways_time_stop': 147, 'sideways_use_sma': False, 'sideways_use_ema': False, 'sideways_use_atr': True, 'sideways_use_adx': False, 'sideways_use_spike': False, 'sideways_rsi_required': True}.
[I 2025-08-30 19:04:47,224] Trial 318 finished with values: [-1000000000.0, 1000000000.0] and parameters: {'p_sma': 7, 'p_std': 31, 'p_atr': 28, 'p_adx': 22, 'rsi_period': 23, 'ema1': 6, 'ema2': 28, 'slip_atr_k': 0.13027843875448486, 'slip_spread_k': 0.6529013885495255, 'spread_hl_frac': 0.010703627621179067, 'bb_std_mult': 1.8509710005359756, 'rsi_os': 36, 'rsi_ob': 82, 'vol_spike': 0.26319530616271747, 'adx_thresh': 32.587064257442094, 'atr_min_pct': 0.02625183901141068, 'atr_max_pct': 0.09029694363116192, 'tp_mult': 1.4765714005952428, 'tsl_mult': 0.7818137064260389, 'strategy': 'mean_reversion', 'time_stop': 253, 'use_sma': False, 'use_atr': False, 'use_adx': True, 'use_ema': False, 'use_spike': True, 'rsi_required': False, 'edge_k': 0.1554596537993468, 'edge_cap': 0.5032144679047617, 'bull_strategy': 'mean_reversion', 'bull_bb_std_mult': 3.28704443237193, 'bull_rsi_os': 8, 'bull_rsi_ob': 57, 'bull_adx_thresh': 18.655044263229893, 'bull_atr_min_pct': 0.002380298198909964, 'bull_atr_max_pct': 0.11042431828679944, 'bull_tp_mult': 1.8444078643742126, 'bull_tsl_mult': 0.5016627194457338, 'bull_time_stop': 190, 'bull_use_sma': False, 'bull_use_ema': False, 'bull_use_atr': True, 'bull_use_adx': True, 'bull_use_spike': False, 'bull_rsi_required': False, 'bear_strategy': 'breakout', 'bear_bb_std_mult': 2.9800967533646765, 'bear_rsi_os': 48, 'bear_rsi_ob': 78, 'bear_adx_thresh': 19.369121123589665, 'bear_atr_min_pct': 0.013984411556110344, 'bear_atr_max_pct': 0.055829478476096525, 'bear_tp_mult': 2.732307953979902, 'bear_tsl_mult': 0.7636226099735349, 'bear_time_stop': 156, 'bear_use_sma': True, 'bear_use_ema': True, 'bear_use_atr': False, 'bear_use_adx': False, 'bear_use_spike': False, 'bear_rsi_required': True, 'sideways_strategy': 'breakout', 'sideways_bb_std_mult': 1.4816194419282915, 'sideways_rsi_os': 41, 'sideways_rsi_ob': 59, 'sideways_adx_thresh': 24.394062520276485, 'sideways_atr_min_pct': 0.020458324149144766, 'sideways_atr_max_pct': 0.02136615768662864, 'sideways_tp_mult': 1.0875570735255047, 'sideways_tsl_mult': 0.026932742620900674, 'sideways_time_stop': 152, 'sideways_use_sma': False, 'sideways_use_ema': False, 'sideways_use_atr': True, 'sideways_use_adx': False, 'sideways_use_spike': False, 'sideways_rsi_required': True}.
[I 2025-08-30 19:04:49,941] Trial 319 finished with values: [-1000000000.0, 1000000000.0] and parameters: {'p_sma': 5, 'p_std': 8, 'p_atr': 28, 'p_adx': 19, 'rsi_period': 23, 'ema1': 25, 'ema2': 33, 'slip_atr_k': 0.05102707823156086, 'slip_spread_k': 0.9420697735854049, 'spread_hl_frac': 0.010665002857731205, 'bb_std_mult': 2.1126472006900503, 'rsi_os': 10, 'rsi_ob': 53, 'vol_spike': 0.24142139222573228, 'adx_thresh': 31.747537701784474, 'atr_min_pct': 0.0029597216465363785, 'atr_max_pct': 0.09601846180317464, 'tp_mult': 2.678548195692649, 'tsl_mult': 0.38825605131002866, 'strategy': 'mean_reversion', 'time_stop': 249, 'use_sma': False, 'use_atr': True, 'use_adx': True, 'use_ema': True, 'use_spike': False, 'rsi_required': False, 'edge_k': 0.1794450596304453, 'edge_cap': 0.6418726093812158, 'bull_strategy': 'mean_reversion', 'bull_bb_std_mult': 3.27195071874308, 'bull_rsi_os': 30, 'bull_rsi_ob': 61, 'bull_adx_thresh': 20.77888781562809, 'bull_atr_min_pct': 0.026042361713688487, 'bull_atr_max_pct': 0.13996523722866164, 'bull_tp_mult': 2.9599756129795303, 'bull_tsl_mult': 0.5048542063459963, 'bull_time_stop': 83, 'bull_use_sma': False, 'bull_use_ema': False, 'bull_use_atr': True, 'bull_use_adx': False, 'bull_use_spike': False, 'bull_rsi_required': False, 'bear_strategy': 'breakout', 'bear_bb_std_mult': 2.9235071637684324, 'bear_rsi_os': 16, 'bear_rsi_ob': 67, 'bear_adx_thresh': 8.344623536977721, 'bear_atr_min_pct': 0.015276028507478018, 'bear_atr_max_pct': 0.038797413936262515, 'bear_tp_mult': 2.308179286169578, 'bear_tsl_mult': 0.17525879660720306, 'bear_time_stop': 212, 'bear_use_sma': True, 'bear_use_ema': True, 'bear_use_atr': False, 'bear_use_adx': False, 'bear_use_spike': False, 'bear_rsi_required': True, 'sideways_strategy': 'breakout', 'sideways_bb_std_mult': 2.583020153935446, 'sideways_rsi_os': 37, 'sideways_rsi_ob': 59, 'sideways_adx_thresh': 17.180862796117133, 'sideways_atr_min_pct': 0.018685443181620305, 'sideways_atr_max_pct': 0.07397440756807935, 'sideways_tp_mult': 1.6759961290252137, 'sideways_tsl_mult': 0.3694747543017408, 'sideways_time_stop': 151, 'sideways_use_sma': True, 'sideways_use_ema': True, 'sideways_use_atr': True, 'sideways_use_adx': False, 'sideways_use_spike': False, 'sideways_rsi_required': True}.
[I 2025-08-30 19:05:16,837] Trial 320 finished with values: [-1000000000.0, 1000000000.0] and parameters: {'p_sma': 5, 'p_std': 31, 'p_atr': 28, 'p_adx': 21, 'rsi_period': 20, 'ema1': 25, 'ema2': 25, 'slip_atr_k': 0.06865636764001691, 'slip_spread_k': 0.1966770366192493, 'spread_hl_frac': 0.04102065620496459, 'bb_std_mult': 1.622995420138762, 'rsi_os': 27, 'rsi_ob': 81, 'vol_spike': 0.13611624341248027, 'adx_thresh': 32.505533767937116, 'atr_min_pct': 0.0030411992230120043, 'atr_max_pct': 0.11448783202681118, 'tp_mult': 1.4628985588378391, 'tsl_mult': 0.7778504992966085, 'strategy': 'mean_reversion', 'time_stop': 255, 'use_sma': False, 'use_atr': False, 'use_adx': True, 'use_ema': False, 'use_spike': True, 'rsi_required': False, 'edge_k': 0.1959299658029151, 'edge_cap': 0.16322948422943434, 'bull_strategy': 'mean_reversion', 'bull_bb_std_mult': 3.2625772624731635, 'bull_rsi_os': 31, 'bull_rsi_ob': 51, 'bull_adx_thresh': 17.561592823249136, 'bull_atr_min_pct': 0.016908659058383332, 'bull_atr_max_pct': 0.12840052724462103, 'bull_tp_mult': 2.9598121533644934, 'bull_tsl_mult': 0.5666899140092837, 'bull_time_stop': 79, 'bull_use_sma': False, 'bull_use_ema': False, 'bull_use_atr': True, 'bull_use_adx': True, 'bull_use_spike': False, 'bull_rsi_required': False, 'bear_strategy': 'breakout', 'bear_bb_std_mult': 3.0118943541529406, 'bear_rsi_os': 48, 'bear_rsi_ob': 51, 'bear_adx_thresh': 18.08697763497285, 'bear_atr_min_pct': 0.015207804864408295, 'bear_atr_max_pct': 0.03760719492095757, 'bear_tp_mult': 2.720989499537194, 'bear_tsl_mult': 0.7470397623203107, 'bear_time_stop': 214, 'bear_use_sma': True, 'bear_use_ema': True, 'bear_use_atr': False, 'bear_use_adx': False, 'bear_use_spike': False, 'bear_rsi_required': True, 'sideways_strategy': 'breakout', 'sideways_bb_std_mult': 3.0663778118030627, 'sideways_rsi_os': 37, 'sideways_rsi_ob': 61, 'sideways_adx_thresh': 8.248405586223594, 'sideways_atr_min_pct': 0.004376706151512389, 'sideways_atr_max_pct': 0.13721978055734146, 'sideways_tp_mult': 1.08171835874023, 'sideways_tsl_mult': 0.2559301667504149, 'sideways_time_stop': 152, 'sideways_use_sma': False, 'sideways_use_ema': False, 'sideways_use_atr': True, 'sideways_use_adx': False, 'sideways_use_spike': False, 'sideways_rsi_required': True}.
[I 2025-08-30 19:05:23,445] Trial 321 finished with values: [-1000000000.0, 1000000000.0] and parameters: {'p_sma': 5, 'p_std': 30, 'p_atr': 17, 'p_adx': 21, 'rsi_period': 17, 'ema1': 11, 'ema2': 60, 'slip_atr_k': 0.050001870388997345, 'slip_spread_k': 0.9681518474550139, 'spread_hl_frac': 0.02309827550341482, 'bb_std_mult': 1.6024006055789362, 'rsi_os': 48, 'rsi_ob': 81, 'vol_spike': 0.1369021681864552, 'adx_thresh': 32.862892781044984, 'atr_min_pct': 0.022218519927637535, 'atr_max_pct': 0.11556677695532332, 'tp_mult': 2.1659486086707913, 'tsl_mult': 0.3846880519920224, 'strategy': 'breakout', 'time_stop': 251, 'use_sma': False, 'use_atr': True, 'use_adx': True, 'use_ema': False, 'use_spike': True, 'rsi_required': False, 'edge_k': 1.7046800212156752, 'edge_cap': 0.31960758650534227, 'bull_strategy': 'mean_reversion', 'bull_bb_std_mult': 3.2682752799586794, 'bull_rsi_os': 30, 'bull_rsi_ob': 45, 'bull_adx_thresh': 33.00099881495473, 'bull_atr_min_pct': 0.0005209012687212517, 'bull_atr_max_pct': 0.032937519051539015, 'bull_tp_mult': 2.9600674471322304, 'bull_tsl_mult': 0.3069519732230408, 'bull_time_stop': 85, 'bull_use_sma': True, 'bull_use_ema': False, 'bull_use_atr': True, 'bull_use_adx': False, 'bull_use_spike': False, 'bull_rsi_required': True, 'bear_strategy': 'breakout', 'bear_bb_std_mult': 3.0234966241561336, 'bear_rsi_os': 48, 'bear_rsi_ob': 46, 'bear_adx_thresh': 17.949560821780942, 'bear_atr_min_pct': 0.004394281302520578, 'bear_atr_max_pct': 0.037083606289531716, 'bear_tp_mult': 1.1618905641595232, 'bear_tsl_mult': 0.7517348756825093, 'bear_time_stop': 273, 'bear_use_sma': True, 'bear_use_ema': True, 'bear_use_atr': False, 'bear_use_adx': True, 'bear_use_spike': False, 'bear_rsi_required': False, 'sideways_strategy': 'breakout', 'sideways_bb_std_mult': 3.0330508068098454, 'sideways_rsi_os': 50, 'sideways_rsi_ob': 68, 'sideways_adx_thresh': 32.72363167001937, 'sideways_atr_min_pct': 0.004387501371411439, 'sideways_atr_max_pct': 0.13826133144487296, 'sideways_tp_mult': 1.0723762760593798, 'sideways_tsl_mult': 0.9079626146891839, 'sideways_time_stop': 202, 'sideways_use_sma': False, 'sideways_use_ema': True, 'sideways_use_atr': True, 'sideways_use_adx': False, 'sideways_use_spike': True, 'sideways_rsi_required': True}.
[I 2025-08-30 19:05:23,566] Trial 322 finished with values: [-1000000000.0, 1000000000.0] and parameters: {'p_sma': 5, 'p_std': 52, 'p_atr': 30, 'p_adx': 9, 'rsi_period': 20, 'ema1': 27, 'ema2': 20, 'slip_atr_k': 0.20651497740725439, 'slip_spread_k': 0.10921787214243421, 'spread_hl_frac': 0.02299229941601219, 'bb_std_mult': 2.1237721021220106, 'rsi_os': 14, 'rsi_ob': 81, 'vol_spike': 0.1962117383902778, 'adx_thresh': 34.44699400818826, 'atr_min_pct': 0.022299257968787782, 'atr_max_pct': 0.04676704283381081, 'tp_mult': 2.1126198608768085, 'tsl_mult': 0.857017763692238, 'strategy': 'breakout', 'time_stop': 202, 'use_sma': False, 'use_atr': True, 'use_adx': True, 'use_ema': False, 'use_spike': True, 'rsi_required': False, 'edge_k': 0.9469448125722741, 'edge_cap': 0.4755682593147643, 'bull_strategy': 'breakout', 'bull_bb_std_mult': 3.1484615161122944, 'bull_rsi_os': 31, 'bull_rsi_ob': 45, 'bull_adx_thresh': 20.867788148832727, 'bull_atr_min_pct': 0.017220519766138608, 'bull_atr_max_pct': 0.14314894062647338, 'bull_tp_mult': 1.0565536765017762, 'bull_tsl_mult': 0.5187818367888312, 'bull_time_stop': 82, 'bull_use_sma': True, 'bull_use_ema': False, 'bull_use_atr': True, 'bull_use_adx': False, 'bull_use_spike': False, 'bull_rsi_required': True, 'bear_strategy': 'breakout', 'bear_bb_std_mult': 3.0190492245872207, 'bear_rsi_os': 53, 'bear_rsi_ob': 80, 'bear_adx_thresh': 5.67177082144179, 'bear_atr_min_pct': 1.2584919695612581e-05, 'bear_atr_max_pct': 0.11266332169884297, 'bear_tp_mult': 2.3082390407963036, 'bear_tsl_mult': 0.21117076572679166, 'bear_time_stop': 293, 'bear_use_sma': True, 'bear_use_ema': True, 'bear_use_atr': False, 'bear_use_adx': True, 'bear_use_spike': False, 'bear_rsi_required': False, 'sideways_strategy': 'breakout', 'sideways_bb_std_mult': 1.7686306872036983, 'sideways_rsi_os': 37, 'sideways_rsi_ob': 59, 'sideways_adx_thresh': 8.321998667962028, 'sideways_atr_min_pct': 0.004098072703663113, 'sideways_atr_max_pct': 0.13905237425320982, 'sideways_tp_mult': 1.051147185970097, 'sideways_tsl_mult': 0.2446589008803305, 'sideways_time_stop': 259, 'sideways_use_sma': False, 'sideways_use_ema': True, 'sideways_use_atr': True, 'sideways_use_adx': False, 'sideways_use_spike': True, 'sideways_rsi_required': True}.
[I 2025-08-30 19:05:24,806] Trial 323 finished with values: [-1000000000.0, 1000000000.0] and parameters: {'p_sma': 9, 'p_std': 13, 'p_atr': 10, 'p_adx': 21, 'rsi_period': 37, 'ema1': 27, 'ema2': 30, 'slip_atr_k': 0.2080817370259856, 'slip_spread_k': 0.19662650106691465, 'spread_hl_frac': 0.023448438595041112, 'bb_std_mult': 2.442766550542071, 'rsi_os': 48, 'rsi_ob': 86, 'vol_spike': 0.2839209385055858, 'adx_thresh': 34.225965478746474, 'atr_min_pct': 0.022059652221998887, 'atr_max_pct': 0.13113433804448593, 'tp_mult': 2.1197342073418692, 'tsl_mult': 0.8523565348362023, 'strategy': 'breakout', 'time_stop': 166, 'use_sma': False, 'use_atr': True, 'use_adx': True, 'use_ema': False, 'use_spike': True, 'rsi_required': False, 'edge_k': 0.48570569201345715, 'edge_cap': 0.725888557384192, 'bull_strategy': 'breakout', 'bull_bb_std_mult': 2.1064290588818264, 'bull_rsi_os': 42, 'bull_rsi_ob': 86, 'bull_adx_thresh': 31.13098582839998, 'bull_atr_min_pct': 0.006978969689775941, 'bull_atr_max_pct': 0.12516556974117368, 'bull_tp_mult': 1.0669665066892844, 'bull_tsl_mult': 0.5658408025450948, 'bull_time_stop': 227, 'bull_use_sma': True, 'bull_use_ema': True, 'bull_use_atr': True, 'bull_use_adx': False, 'bull_use_spike': False, 'bull_rsi_required': True, 'bear_strategy': 'breakout', 'bear_bb_std_mult': 3.01706191013113, 'bear_rsi_os': 53, 'bear_rsi_ob': 80, 'bear_adx_thresh': 18.24684489395133, 'bear_atr_min_pct': 0.018923597843216962, 'bear_atr_max_pct': 0.1466563618386078, 'bear_tp_mult': 2.6440923919674204, 'bear_tsl_mult': 0.7340235448109638, 'bear_time_stop': 208, 'bear_use_sma': False, 'bear_use_ema': True, 'bear_use_atr': False, 'bear_use_adx': True, 'bear_use_spike': False, 'bear_rsi_required': False, 'sideways_strategy': 'breakout', 'sideways_bb_std_mult': 0.851581327311739, 'sideways_rsi_os': 38, 'sideways_rsi_ob': 73, 'sideways_adx_thresh': 8.424673510519579, 'sideways_atr_min_pct': 0.017677231352337387, 'sideways_atr_max_pct': 0.13723917903470526, 'sideways_tp_mult': 1.3173155543681347, 'sideways_tsl_mult': 0.9832968603000604, 'sideways_time_stop': 171, 'sideways_use_sma': False, 'sideways_use_ema': True, 'sideways_use_atr': True, 'sideways_use_adx': False, 'sideways_use_spike': True, 'sideways_rsi_required': True}.
