[I 2025-08-30 18:30:36,894] Trial 19 finished with values: [-1000000000.0, 1000000000.0] and parameters: {'p_sma': 32, 'p_std': 26, 'p_atr': 26, 'p_adx': 20, 'rsi_period': 26, 'ema1': 16, 'ema2': 23, 'slip_atr_k': 0.13466675525755487, 'slip_spread_k': 0.8033981594658067, 'spread_hl_frac': 0.03543878913125888, 'bb_std_mult': 0.6854678910221976, 'rsi_os': 26, 'rsi_ob': 47, 'vol_spike': 0.1451422808855597, 'adx_thresh': 15.552521748896144, 'atr_min_pct': 0.015041354195919213, 'atr_max_pct': 0.08948803855294893, 'tp_mult': 1.3101920849304296, 'tsl_mult': 0.6204534041294417, 'strategy': 'breakout', 'time_stop': 229, 'use_sma': False, 'use_atr': True, 'use_adx': True, 'use_ema': True, 'use_spike': True, 'rsi_required': False, 'edge_k': 1.5217752028139073, 'edge_cap': 0.5768412741356286, 'bull_strategy': 'mean_reversion', 'bull_bb_std_mult': 1.5242628550217359, 'bull_rsi_os': 7, 'bull_rsi_ob': 63, 'bull_adx_thresh': 10.526543562487625, 'bull_atr_min_pct': 0.00017158114333130393, 'bull_atr_max_pct': 0.038564594668566446, 'bull_tp_mult': 1.5031955571655917, 'bull_tsl_mult': 0.02222560551687086, 'bull_time_stop': 202, 'bull_use_sma': False, 'bull_use_ema': True, 'bull_use_atr': False, 'bull_use_adx': False, 'bull_use_spike': False, 'bull_rsi_required': True, 'bear_strategy': 'breakout', 'bear_bb_std_mult': 3.592625083472977, 'bear_rsi_os': 6, 'bear_rsi_ob': 61, 'bear_adx_thresh': 19.807519469502367, 'bear_atr_min_pct': 0.00026422750998370036, 'bear_atr_max_pct': 0.1235084015099775, 'bear_tp_mult': 2.495936509866526, 'bear_tsl_mult': 0.6039538104868125, 'bear_time_stop': 188, 'bear_use_sma': True, 'bear_use_ema': True, 'bear_use_atr': True, 'bear_use_adx': True, 'bear_use_spike': True, 'bear_rsi_required': True, 'sideways_strategy': 'mean_reversion', 'sideways_bb_std_mult': 2.335161060511167, 'sideways_rsi_os': 5, 'sideways_rsi_ob': 74, 'sideways_adx_thresh': 28.670971159933355, 'sideways_atr_min_pct': 0.014468905979215227, 'sideways_atr_max_pct': 0.049644959436961913, 'sideways_tp_mult': 1.57439426863042, 'sideways_tsl_mult': 0.9711302488346836, 'sideways_time_stop': 43, 'sideways_use_sma': False, 'sideways_use_ema': True, 'sideways_use_atr': False, 'sideways_use_adx': False, 'sideways_use_spike': True, 'sideways_rsi_required': False}.
[I 2025-08-30 18:30:37,496] Trial 21 finished with values: [-1000000000.0, 1000000000.0] and parameters: {'p_sma': 30, 'p_std': 27, 'p_atr': 26, 'p_adx': 22, 'rsi_period': 27, 'ema1': 15, 'ema2': 21, 'slip_atr_k': 0.14653040460628952, 'slip_spread_k': 0.5434597765073886, 'spread_hl_frac': 0.03578981669346024, 'bb_std_mult': 0.5868535687760122, 'rsi_os': 25, 'rsi_ob': 67, 'vol_spike': 0.14309724756011, 'adx_thresh': 24.167509439897323, 'atr_min_pct': 0.023207626912151034, 'atr_max_pct': 0.10050091469385553, 'tp_mult': 2.21056589050105, 'tsl_mult': 0.6142245130477968, 'strategy': 'breakout', 'time_stop': 229, 'use_sma': False, 'use_atr': True, 'use_adx': True, 'use_ema': False, 'use_spike': True, 'rsi_required': False, 'edge_k': 1.5011850617663898, 'edge_cap': 0.6201433523767906, 'bull_strategy': 'mean_reversion', 'bull_bb_std_mult': 1.587743415151821, 'bull_rsi_os': 5, 'bull_rsi_ob': 50, 'bull_adx_thresh': 25.452644865746496, 'bull_atr_min_pct': 0.029937744448508517, 'bull_atr_max_pct': 0.053525503284863996, 'bull_tp_mult': 1.4025503709942708, 'bull_tsl_mult': 0.0880952166430582, 'bull_time_stop': 207, 'bull_use_sma': True, 'bull_use_ema': False, 'bull_use_atr': True, 'bull_use_adx': False, 'bull_use_spike': False, 'bull_rsi_required': True, 'bear_strategy': 'breakout', 'bear_bb_std_mult': 0.5379157715548517, 'bear_rsi_os': 6, 'bear_rsi_ob': 66, 'bear_adx_thresh': 19.986648651069096, 'bear_atr_min_pct': 0.006261673013998532, 'bear_atr_max_pct': 0.12433847996665613, 'bear_tp_mult': 2.5640944878485294, 'bear_tsl_mult': 0.6796167511165186, 'bear_time_stop': 182, 'bear_use_sma': True, 'bear_use_ema': True, 'bear_use_atr': True, 'bear_use_adx': True, 'bear_use_spike': False, 'bear_rsi_required': True, 'sideways_strategy': 'mean_reversion', 'sideways_bb_std_mult': 3.290528589472565, 'sideways_rsi_os': 53, 'sideways_rsi_ob': 74, 'sideways_adx_thresh': 26.74882071786069, 'sideways_atr_min_pct': 0.015155361759781391, 'sideways_atr_max_pct': 0.044283822963348915, 'sideways_tp_mult': 2.138092217156943, 'sideways_tsl_mult': 0.9631707258266393, 'sideways_time_stop': 190, 'sideways_use_sma': False, 'sideways_use_ema': True, 'sideways_use_atr': True, 'sideways_use_adx': False, 'sideways_use_spike': False, 'sideways_rsi_required': False}.
[I 2025-08-30 18:30:37,779] Trial 18 finished with values: [-1000000000.0, 1000000000.0] and parameters: {'p_sma': 14, 'p_std': 5, 'p_atr': 13, 'p_adx': 7, 'rsi_period': 58, 'ema1': 16, 'ema2': 23, 'slip_atr_k': 0.1821787246016796, 'slip_spread_k': 0.9262788932860572, 'spread_hl_frac': 0.03426233480797462, 'bb_std_mult': 0.5642523144827942, 'rsi_os': 23, 'rsi_ob': 69, 'vol_spike': 0.1471527293680867, 'adx_thresh': 16.720135744436107, 'atr_min_pct': 0.0001390015422179751, 'atr_max_pct': 0.012444437134571775, 'tp_mult': 2.264819723226907, 'tsl_mult': 0.78379839464579, 'strategy': 'breakout', 'time_stop': 218, 'use_sma': False, 'use_atr': False, 'use_adx': True, 'use_ema': True, 'use_spike': True, 'rsi_required': False, 'edge_k': 1.4823223956397813, 'edge_cap': 0.49565357400037535, 'bull_strategy': 'mean_reversion', 'bull_bb_std_mult': 3.3409182047436836, 'bull_rsi_os': 22, 'bull_rsi_ob': 51, 'bull_adx_thresh': 20.785391034129425, 'bull_atr_min_pct': 0.011299935401703808, 'bull_atr_max_pct': 0.04614075306941019, 'bull_tp_mult': 2.257524808906947, 'bull_tsl_mult': 0.16132429258283054, 'bull_time_stop': 216, 'bull_use_sma': False, 'bull_use_ema': True, 'bull_use_atr': False, 'bull_use_adx': False, 'bull_use_spike': False, 'bull_rsi_required': True, 'bear_strategy': 'breakout', 'bear_bb_std_mult': 0.5112123041731456, 'bear_rsi_os': 31, 'bear_rsi_ob': 58, 'bear_adx_thresh': 21.12692800633522, 'bear_atr_min_pct': 0.00040483845970293265, 'bear_atr_max_pct': 0.12201204271591741, 'bear_tp_mult': 2.3773441501943973, 'bear_tsl_mult': 0.5891819794022114, 'bear_time_stop': 65, 'bear_use_sma': True, 'bear_use_ema': True, 'bear_use_atr': True, 'bear_use_adx': True, 'bear_use_spike': True, 'bear_rsi_required': True, 'sideways_strategy': 'mean_reversion', 'sideways_bb_std_mult': 2.2756127827225936, 'sideways_rsi_os': 24, 'sideways_rsi_ob': 75, 'sideways_adx_thresh': 19.42446282243071, 'sideways_atr_min_pct': 0.029762833900699004, 'sideways_atr_max_pct': 0.03962282944777046, 'sideways_tp_mult': 1.5468699606381549, 'sideways_tsl_mult': 0.9631378901608348, 'sideways_time_stop': 27, 'sideways_use_sma': False, 'sideways_use_ema': True, 'sideways_use_atr': False, 'sideways_use_adx': False, 'sideways_use_spike': True, 'sideways_rsi_required': False}.
[I 2025-08-30 18:30:37,932] Trial 20 finished with values: [-0.04937121528837218, 0.049166336458873576] and parameters: {'p_sma': 33, 'p_std': 28, 'p_atr': 25, 'p_adx': 19, 'rsi_period': 28, 'ema1': 16, 'ema2': 23, 'slip_atr_k': 0.14441287905701572, 'slip_spread_k': 0.5550101568027936, 'spread_hl_frac': 0.03671460958116879, 'bb_std_mult': 0.5045922544375319, 'rsi_os': 26, 'rsi_ob': 47, 'vol_spike': 0.13512147050628182, 'adx_thresh': 24.95902189055716, 'atr_min_pct': 0.00040212166209473675, 'atr_max_pct': 0.08557847457858313, 'tp_mult': 2.2545226745760862, 'tsl_mult': 0.6191145860935933, 'strategy': 'breakout', 'time_stop': 219, 'use_sma': False, 'use_atr': True, 'use_adx': True, 'use_ema': True, 'use_spike': True, 'rsi_required': False, 'edge_k': 1.4731375666966173, 'edge_cap': 0.05113201726437916, 'bull_strategy': 'mean_reversion', 'bull_bb_std_mult': 1.410160026469737, 'bull_rsi_os': 6, 'bull_rsi_ob': 50, 'bull_adx_thresh': 25.907703021272333, 'bull_atr_min_pct': 0.009432991352928646, 'bull_atr_max_pct': 0.05375324272308567, 'bull_tp_mult': 1.2555445062928898, 'bull_tsl_mult': 0.0437587254896421, 'bull_time_stop': 220, 'bull_use_sma': False, 'bull_use_ema': False, 'bull_use_atr': True, 'bull_use_adx': False, 'bull_use_spike': False, 'bull_rsi_required': True, 'bear_strategy': 'breakout', 'bear_bb_std_mult': 3.5001979411799655, 'bear_rsi_os': 34, 'bear_rsi_ob': 61, 'bear_adx_thresh': 20.506474870541233, 'bear_atr_min_pct': 0.00045479356491146374, 'bear_atr_max_pct': 0.12592569972844875, 'bear_tp_mult': 1.5980617273441715, 'bear_tsl_mult': 0.710471046688685, 'bear_time_stop': 181, 'bear_use_sma': True, 'bear_use_ema': True, 'bear_use_atr': True, 'bear_use_adx': True, 'bear_use_spike': False, 'bear_rsi_required': False, 'sideways_strategy': 'mean_reversion', 'sideways_bb_std_mult': 3.573206821986942, 'sideways_rsi_os': 5, 'sideways_rsi_ob': 85, 'sideways_adx_thresh': 28.043018321743787, 'sideways_atr_min_pct': 0.029927716957398834, 'sideways_atr_max_pct': 0.04744174172657753, 'sideways_tp_mult': 2.161994622146514, 'sideways_tsl_mult': 0.9171259271415266, 'sideways_time_stop': 199, 'sideways_use_sma': False, 'sideways_use_ema': True, 'sideways_use_atr': False, 'sideways_use_adx': False, 'sideways_use_spike': True, 'sideways_rsi_required': False}.
[I 2025-08-30 18:31:10,392] Trial 22 finished with values: [-1000000000.0, 1000000000.0] and parameters: {'p_sma': 16, 'p_std': 42, 'p_atr': 18, 'p_adx': 21, 'rsi_period': 42, 'ema1': 7, 'ema2': 10, 'slip_atr_k': 0.1567492386591699, 'slip_spread_k': 0.5232692553852292, 'spread_hl_frac': 0.03376421924648727, 'bb_std_mult': 2.4147190841678916, 'rsi_os': 25, 'rsi_ob': 67, 'vol_spike': 0.14721989299610602, 'adx_thresh': 24.428446943828853, 'atr_min_pct': 0.02410889098648428, 'atr_max_pct': 0.10165053297058677, 'tp_mult': 2.249337460025862, 'tsl_mult': 0.820893258139819, 'strategy': 'breakout', 'time_stop': 177, 'use_sma': False, 'use_atr': True, 'use_adx': True, 'use_ema': False, 'use_spike': True, 'rsi_required': False, 'edge_k': 0.24710710826330784, 'edge_cap': 0.674026917366153, 'bull_strategy': 'mean_reversion', 'bull_bb_std_mult': 2.6132167615988906, 'bull_rsi_os': 22, 'bull_rsi_ob': 49, 'bull_adx_thresh': 25.3091358259139, 'bull_atr_min_pct': 0.012153941846193317, 'bull_atr_max_pct': 0.08718616141333921, 'bull_tp_mult': 1.8606362146409319, 'bull_tsl_mult': 0.8193752271545282, 'bull_time_stop': 205, 'bull_use_sma': True, 'bull_use_ema': False, 'bull_use_atr': True, 'bull_use_adx': False, 'bull_use_spike': False, 'bull_rsi_required': True, 'bear_strategy': 'breakout', 'bear_bb_std_mult': 0.5268476259716042, 'bear_rsi_os': 34, 'bear_rsi_ob': 68, 'bear_adx_thresh': 19.934824706687877, 'bear_atr_min_pct': 0.01363750230304165, 'bear_atr_max_pct': 0.04959665093721714, 'bear_tp_mult': 1.0477257432510019, 'bear_tsl_mult': 0.45135418971884844, 'bear_time_stop': 178, 'bear_use_sma': True, 'bear_use_ema': True, 'bear_use_atr': True, 'bear_use_adx': True, 'bear_use_spike': False, 'bear_rsi_required': False, 'sideways_strategy': 'mean_reversion', 'sideways_bb_std_mult': 3.3258476742075387, 'sideways_rsi_os': 52, 'sideways_rsi_ob': 86, 'sideways_adx_thresh': 18.808065049155232, 'sideways_atr_min_pct': 0.019866888741773007, 'sideways_atr_max_pct': 0.078659024380471, 'sideways_tp_mult': 2.0745055056338972, 'sideways_tsl_mult': 0.815271546109403, 'sideways_time_stop': 194, 'sideways_use_sma': False, 'sideways_use_ema': True, 'sideways_use_atr': True, 'sideways_use_adx': False, 'sideways_use_spike': False, 'sideways_rsi_required': False}.
[I 2025-08-30 18:31:12,803] Trial 23 finished with values: [-1000000000.0, 1000000000.0] and parameters: {'p_sma': 15, 'p_std': 42, 'p_atr': 18, 'p_adx': 10, 'rsi_period': 44, 'ema1': 5, 'ema2': 28, 'slip_atr_k': 0.20812430888700045, 'slip_spread_k': 0.8773215220352741, 'spread_hl_frac': 0.020056845872052326, 'bb_std_mult': 2.402615789242871, 'rsi_os': 13, 'rsi_ob': 75, 'vol_spike': 0.10473873974691394, 'adx_thresh': 27.22478170385306, 'atr_min_pct': 0.000539856474013306, 'atr_max_pct': 0.035122573006680965, 'tp_mult': 1.3027031866380796, 'tsl_mult': 0.8234632777828613, 'strategy': 'breakout', 'time_stop': 28, 'use_sma': False, 'use_atr': True, 'use_adx': False, 'use_ema': True, 'use_spike': True, 'rsi_required': False, 'edge_k': 0.3160936862152999, 'edge_cap': 0.07769991469928558, 'bull_strategy': 'mean_reversion', 'bull_bb_std_mult': 2.7529933140719356, 'bull_rsi_os': 22, 'bull_rsi_ob': 77, 'bull_adx_thresh': 24.15105696562443, 'bull_atr_min_pct': 0.012453589323228952, 'bull_atr_max_pct': 0.08676364049622955, 'bull_tp_mult': 1.8628783065652517, 'bull_tsl_mult': 0.8165774222911528, 'bull_time_stop': 200, 'bull_use_sma': False, 'bull_use_ema': False, 'bull_use_atr': True, 'bull_use_adx': False, 'bull_use_spike': False, 'bull_rsi_required': True, 'bear_strategy': 'breakout', 'bear_bb_std_mult': 3.0016323810500243, 'bear_rsi_os': 34, 'bear_rsi_ob': 52, 'bear_adx_thresh': 11.299202057423203, 'bear_atr_min_pct': 0.01408779258991461, 'bear_atr_max_pct': 0.04583656576375881, 'bear_tp_mult': 1.0644089591260602, 'bear_tsl_mult': 0.44962376573148877, 'bear_time_stop': 40, 'bear_use_sma': True, 'bear_use_ema': False, 'bear_use_atr': True, 'bear_use_adx': True, 'bear_use_spike': False, 'bear_rsi_required': False, 'sideways_strategy': 'mean_reversion', 'sideways_bb_std_mult': 1.623744000745661, 'sideways_rsi_os': 37, 'sideways_rsi_ob': 86, 'sideways_adx_thresh': 19.657677728797875, 'sideways_atr_min_pct': 0.020126397504925377, 'sideways_atr_max_pct': 0.07730364495928732, 'sideways_tp_mult': 1.331546865345221, 'sideways_tsl_mult': 0.8198984097483792, 'sideways_time_stop': 264, 'sideways_use_sma': False, 'sideways_use_ema': True, 'sideways_use_atr': False, 'sideways_use_adx': False, 'sideways_use_spike': True, 'sideways_rsi_required': False}.
[I 2025-08-30 18:31:12,852] Trial 24 finished with values: [-1000000000.0, 1000000000.0] and parameters: {'p_sma': 38, 'p_std': 45, 'p_atr': 18, 'p_adx': 21, 'rsi_period': 41, 'ema1': 10, 'ema2': 55, 'slip_atr_k': 0.20759302694196322, 'slip_spread_k': 0.5824157044262457, 'spread_hl_frac': 0.021077218507849705, 'bb_std_mult': 1.8204735818154676, 'rsi_os': 13, 'rsi_ob': 76, 'vol_spike': 0.1071774726643436, 'adx_thresh': 27.58398957740794, 'atr_min_pct': 0.01918001742099357, 'atr_max_pct': 0.032790841561416234, 'tp_mult': 2.518380563026245, 'tsl_mult': 0.8708086022951329, 'strategy': 'breakout', 'time_stop': 11, 'use_sma': False, 'use_atr': True, 'use_adx': False, 'use_ema': True, 'use_spike': True, 'rsi_required': True, 'edge_k': 0.03207854881812078, 'edge_cap': 0.057679639633776314, 'bull_strategy': 'mean_reversion', 'bull_bb_std_mult': 1.8916417881465701, 'bull_rsi_os': 14, 'bull_rsi_ob': 81, 'bull_adx_thresh': 25.805199097717534, 'bull_atr_min_pct': 0.02663267965380118, 'bull_atr_max_pct': 0.08192579281315605, 'bull_tp_mult': 1.9476473982101636, 'bull_tsl_mult': 0.8302668991521795, 'bull_time_stop': 90, 'bull_use_sma': False, 'bull_use_ema': False, 'bull_use_atr': True, 'bull_use_adx': True, 'bull_use_spike': False, 'bull_rsi_required': True, 'bear_strategy': 'mean_reversion', 'bear_bb_std_mult': 2.979914960159456, 'bear_rsi_os': 38, 'bear_rsi_ob': 53, 'bear_adx_thresh': 15.804118391035407, 'bear_atr_min_pct': 0.013930379429197197, 'bear_atr_max_pct': 0.04925408107537796, 'bear_tp_mult': 1.5187232246981823, 'bear_tsl_mult': 0.43918452281295123, 'bear_time_stop': 20, 'bear_use_sma': False, 'bear_use_ema': False, 'bear_use_atr': True, 'bear_use_adx': True, 'bear_use_spike': False, 'bear_rsi_required': False, 'sideways_strategy': 'mean_reversion', 'sideways_bb_std_mult': 1.5402780816913006, 'sideways_rsi_os': 38, 'sideways_rsi_ob': 88, 'sideways_adx_thresh': 16.229984007210103, 'sideways_atr_min_pct': 0.019267724226136484, 'sideways_atr_max_pct': 0.1493705816678293, 'sideways_tp_mult': 1.3043159430839597, 'sideways_tsl_mult': 0.7997436702590255, 'sideways_time_stop': 186, 'sideways_use_sma': False, 'sideways_use_ema': True, 'sideways_use_atr': True, 'sideways_use_adx': True, 'sideways_use_spike': True, 'sideways_rsi_required': False}.
[I 2025-08-30 18:31:13,123] Trial 25 finished with values: [-1000000000.0, 1000000000.0] and parameters: {'p_sma': 46, 'p_std': 43, 'p_atr': 25, 'p_adx': 20, 'rsi_period': 19, 'ema1': 5, 'ema2': 10, 'slip_atr_k': 0.11933588738955064, 'slip_spread_k': 0.3510620917145717, 'spread_hl_frac': 0.04123521390299008, 'bb_std_mult': 1.0102433707273197, 'rsi_os': 32, 'rsi_ob': 47, 'vol_spike': 0.10721708270202485, 'adx_thresh': 26.412967152299288, 'atr_min_pct': 0.0002959906576111391, 'atr_max_pct': 0.10805327498823403, 'tp_mult': 2.5699782409863254, 'tsl_mult': 0.49088633067273835, 'strategy': 'breakout', 'time_stop': 177, 'use_sma': False, 'use_atr': True, 'use_adx': True, 'use_ema': True, 'use_spike': True, 'rsi_required': False, 'edge_k': 0.0016791909350793999, 'edge_cap': 0.061902174954158104, 'bull_strategy': 'mean_reversion', 'bull_bb_std_mult': 1.2239633112291197, 'bull_rsi_os': 12, 'bull_rsi_ob': 49, 'bull_adx_thresh': 26.205048458820944, 'bull_atr_min_pct': 0.009269349868571843, 'bull_atr_max_pct': 0.060586459232858714, 'bull_tp_mult': 1.2746425245670667, 'bull_tsl_mult': 0.1862797735487703, 'bull_time_stop': 248, 'bull_use_sma': False, 'bull_use_ema': False, 'bull_use_atr': True, 'bull_use_adx': False, 'bull_use_spike': False, 'bull_rsi_required': True, 'bear_strategy': 'breakout', 'bear_bb_std_mult': 3.115172049834224, 'bear_rsi_os': 36, 'bear_rsi_ob': 53, 'bear_adx_thresh': 16.858914475064346, 'bear_atr_min_pct': 0.004009603039872826, 'bear_atr_max_pct': 0.04491962555509355, 'bear_tp_mult': 1.480368955366489, 'bear_tsl_mult': 0.7828907221570209, 'bear_time_stop': 223, 'bear_use_sma': True, 'bear_use_ema': True, 'bear_use_atr': True, 'bear_use_adx': True, 'bear_use_spike': False, 'bear_rsi_required': False, 'sideways_strategy': 'mean_reversion', 'sideways_bb_std_mult': 3.197619457297692, 'sideways_rsi_os': 6, 'sideways_rsi_ob': 95, 'sideways_adx_thresh': 34.92908294288144, 'sideways_atr_min_pct': 0.02689988863524838, 'sideways_atr_max_pct': 0.07984155945612532, 'sideways_tp_mult': 2.1869201691382942, 'sideways_tsl_mult': 0.8156506280069304, 'sideways_time_stop': 70, 'sideways_use_sma': False, 'sideways_use_ema': True, 'sideways_use_atr': False, 'sideways_use_adx': False, 'sideways_use_spike': True, 'sideways_rsi_required': False}.
[I 2025-08-30 18:31:13,375] Trial 29 finished with values: [-1000000000.0, 1000000000.0] and parameters: {'p_sma': 35, 'p_std': 32, 'p_atr': 28, 'p_adx': 16, 'rsi_period': 19, 'ema1': 18, 'ema2': 16, 'slip_atr_k': 0.11791243165686432, 'slip_spread_k': 0.40850177411749267, 'spread_hl_frac': 0.04154680545460134, 'bb_std_mult': 1.2168546834179983, 'rsi_os': 35, 'rsi_ob': 45, 'vol_spike': 0.1731078352785906, 'adx_thresh': 30.87057699688766, 'atr_min_pct': 0.0035770456809710964, 'atr_max_pct': 0.07025442157078512, 'tp_mult': 2.7263191818941106, 'tsl_mult': 0.020323056496224845, 'strategy': 'mean_reversion', 'time_stop': 295, 'use_sma': True, 'use_atr': True, 'use_adx': True, 'use_ema': False, 'use_spike': False, 'rsi_required': True, 'edge_k': 0.9269647009831938, 'edge_cap': 0.13912632165461972, 'bull_strategy': 'breakout', 'bull_bb_std_mult': 1.6718518303331975, 'bull_rsi_os': 11, 'bull_rsi_ob': 61, 'bull_adx_thresh': 30.15785369928497, 'bull_atr_min_pct': 0.003843996034888066, 'bull_atr_max_pct': 0.034085710939266343, 'bull_tp_mult': 1.1875643521978612, 'bull_tsl_mult': 0.32772890002773475, 'bull_time_stop': 237, 'bull_use_sma': True, 'bull_use_ema': False, 'bull_use_atr': True, 'bull_use_adx': True, 'bull_use_spike': True, 'bull_rsi_required': True, 'bear_strategy': 'mean_reversion', 'bear_bb_std_mult': 3.3560582101737593, 'bear_rsi_os': 25, 'bear_rsi_ob': 63, 'bear_adx_thresh': 24.57439723107395, 'bear_atr_min_pct': 0.00253050781641042, 'bear_atr_max_pct': 0.10361648215695925, 'bear_tp_mult': 1.918497957909609, 'bear_tsl_mult': 0.7394539417687764, 'bear_time_stop': 164, 'bear_use_sma': False, 'bear_use_ema': True, 'bear_use_atr': False, 'bear_use_adx': False, 'bear_use_spike': False, 'bear_rsi_required': False, 'sideways_strategy': 'mean_reversion', 'sideways_bb_std_mult': 3.5763991192350955, 'sideways_rsi_os': 27, 'sideways_rsi_ob': 94, 'sideways_adx_thresh': 29.719895624673867, 'sideways_atr_min_pct': 0.022396427467680845, 'sideways_atr_max_pct': 0.027607562579665998, 'sideways_tp_mult': 2.3224268738031126, 'sideways_tsl_mult': 0.13429022669013402, 'sideways_time_stop': 220, 'sideways_use_sma': True, 'sideways_use_ema': False, 'sideways_use_atr': False, 'sideways_use_adx': True, 'sideways_use_spike': False, 'sideways_rsi_required': True}.
