[I 2025-08-30 19:44:08,819] Trial 656 finished with values: [-1000000000.0, 1000000000.0] and parameters: {'p_sma': 8, 'p_std': 56, 'p_atr': 19, 'p_adx': 20, 'rsi_period': 41, 'ema1': 25, 'ema2': 21, 'slip_atr_k': 0.07711155802980496, 'slip_spread_k': 0.9243556544455493, 'spread_hl_frac': 0.026084559384947154, 'bb_std_mult': 2.0809954268004955, 'rsi_os': 15, 'rsi_ob': 79, 'vol_spike': 0.26234098330870603, 'adx_thresh': 14.994195219511118, 'atr_min_pct': 0.022850819012097467, 'atr_max_pct': 0.05077285703167074, 'tp_mult': 1.8414312898967917, 'tsl_mult': 0.8430587889769355, 'strategy': 'mean_reversion', 'time_stop': 172, 'use_sma': True, 'use_atr': False, 'use_adx': True, 'use_ema': False, 'use_spike': True, 'rsi_required': False, 'edge_k': 1.5488014687353548, 'edge_cap': 0.4903043075872278, 'bull_strategy': 'mean_reversion', 'bull_bb_std_mult': 3.068611294300014, 'bull_rsi_os': 39, 'bull_rsi_ob': 46, 'bull_adx_thresh': 17.00343083984041, 'bull_atr_min_pct': 0.0012191196677127135, 'bull_atr_max_pct': 0.12314357421535828, 'bull_tp_mult': 2.7525140851247234, 'bull_tsl_mult': 0.7164250151486622, 'bull_time_stop': 155, 'bull_use_sma': False, 'bull_use_ema': True, 'bull_use_atr': True, 'bull_use_adx': False, 'bull_use_spike': False, 'bull_rsi_required': True, 'bear_strategy': 'breakout', 'bear_bb_std_mult': 3.402057617058387, 'bear_rsi_os': 51, 'bear_rsi_ob': 75, 'bear_adx_thresh': 10.937984954764737, 'bear_atr_min_pct': 0.014942994763575588, 'bear_atr_max_pct': 0.030724271642119997, 'bear_tp_mult': 2.8704467679238457, 'bear_tsl_mult': 0.9490972933711354, 'bear_time_stop': 190, 'bear_use_sma': False, 'bear_use_ema': True, 'bear_use_atr': False, 'bear_use_adx': False, 'bear_use_spike': True, 'bear_rsi_required': True, 'sideways_strategy': 'mean_reversion', 'sideways_bb_std_mult': 3.2943857904054648, 'sideways_rsi_os': 36, 'sideways_rsi_ob': 58, 'sideways_adx_thresh': 20.538975091494276, 'sideways_atr_min_pct': 0.002802104308401363, 'sideways_atr_max_pct': 0.14505602287745126, 'sideways_tp_mult': 1.093159010616267, 'sideways_tsl_mult': 0.9547615361694819, 'sideways_time_stop': 36, 'sideways_use_sma': False, 'sideways_use_ema': False, 'sideways_use_atr': False, 'sideways_use_adx': False, 'sideways_use_spike': True, 'sideways_rsi_required': False}.
[I 2025-08-30 19:44:18,523] Trial 657 finished with values: [-1000000000.0, 1000000000.0] and parameters: {'p_sma': 8, 'p_std': 24, 'p_atr': 30, 'p_adx': 9, 'rsi_period': 25, 'ema1': 20, 'ema2': 34, 'slip_atr_k': 0.17509196742482136, 'slip_spread_k': 0.11012233994277376, 'spread_hl_frac': 0.02543557485547533, 'bb_std_mult': 2.108321669801352, 'rsi_os': 11, 'rsi_ob': 83, 'vol_spike': 0.28854105828172494, 'adx_thresh': 32.809109300478134, 'atr_min_pct': 0.022981033138792413, 'atr_max_pct': 0.029285412736958873, 'tp_mult': 1.845990539679822, 'tsl_mult': 0.8390264311759702, 'strategy': 'mean_reversion', 'time_stop': 61, 'use_sma': True, 'use_atr': False, 'use_adx': True, 'use_ema': False, 'use_spike': True, 'rsi_required': True, 'edge_k': 1.2281562169807554, 'edge_cap': 0.5988056339251815, 'bull_strategy': 'mean_reversion', 'bull_bb_std_mult': 3.053542636017807, 'bull_rsi_os': 34, 'bull_rsi_ob': 47, 'bull_adx_thresh': 17.15881033290392, 'bull_atr_min_pct': 0.0010889323475591892, 'bull_atr_max_pct': 0.1145883001539771, 'bull_tp_mult': 2.098108062943437, 'bull_tsl_mult': 0.7133571188921952, 'bull_time_stop': 18, 'bull_use_sma': False, 'bull_use_ema': True, 'bull_use_atr': True, 'bull_use_adx': False, 'bull_use_spike': False, 'bull_rsi_required': True, 'bear_strategy': 'breakout', 'bear_bb_std_mult': 3.0791468187517617, 'bear_rsi_os': 50, 'bear_rsi_ob': 67, 'bear_adx_thresh': 16.803192170743003, 'bear_atr_min_pct': 0.014974409632281, 'bear_atr_max_pct': 0.013398655176245292, 'bear_tp_mult': 2.6898654503967157, 'bear_tsl_mult': 0.7204330002910251, 'bear_time_stop': 239, 'bear_use_sma': True, 'bear_use_ema': False, 'bear_use_atr': False, 'bear_use_adx': False, 'bear_use_spike': False, 'bear_rsi_required': True, 'sideways_strategy': 'breakout', 'sideways_bb_std_mult': 3.2893588430257914, 'sideways_rsi_os': 38, 'sideways_rsi_ob': 59, 'sideways_adx_thresh': 24.592483779171605, 'sideways_atr_min_pct': 0.008101334052876753, 'sideways_atr_max_pct': 0.14501817676418843, 'sideways_tp_mult': 1.0107195506961903, 'sideways_tsl_mult': 0.9396855243036982, 'sideways_time_stop': 144, 'sideways_use_sma': False, 'sideways_use_ema': False, 'sideways_use_atr': False, 'sideways_use_adx': False, 'sideways_use_spike': False, 'sideways_rsi_required': False}.
[I 2025-08-30 19:44:33,645] Trial 659 finished with values: [-1000000000.0, 1000000000.0] and parameters: {'p_sma': 8, 'p_std': 55, 'p_atr': 9, 'p_adx': 20, 'rsi_period': 64, 'ema1': 26, 'ema2': 32, 'slip_atr_k': 0.07481032068328143, 'slip_spread_k': 0.21726387589287177, 'spread_hl_frac': 0.026055871256041745, 'bb_std_mult': 1.4690563691260787, 'rsi_os': 50, 'rsi_ob': 83, 'vol_spike': 0.26052002683458136, 'adx_thresh': 32.62475049508968, 'atr_min_pct': 0.024511138248335344, 'atr_max_pct': 0.13042487901948477, 'tp_mult': 1.8983993903154281, 'tsl_mult': 0.5382760945137331, 'strategy': 'breakout', 'time_stop': 62, 'use_sma': True, 'use_atr': False, 'use_adx': True, 'use_ema': False, 'use_spike': True, 'rsi_required': True, 'edge_k': 0.12871713265306997, 'edge_cap': 0.32015112562634707, 'bull_strategy': 'breakout', 'bull_bb_std_mult': 2.1494005733512465, 'bull_rsi_os': 30, 'bull_rsi_ob': 53, 'bull_adx_thresh': 19.65216571104396, 'bull_atr_min_pct': 0.0012124547590265313, 'bull_atr_max_pct': 0.09706749651167748, 'bull_tp_mult': 2.7427945682684345, 'bull_tsl_mult': 0.8702000017982401, 'bull_time_stop': 83, 'bull_use_sma': False, 'bull_use_ema': False, 'bull_use_atr': True, 'bull_use_adx': False, 'bull_use_spike': True, 'bull_rsi_required': True, 'bear_strategy': 'breakout', 'bear_bb_std_mult': 3.079929898622873, 'bear_rsi_os': 12, 'bear_rsi_ob': 75, 'bear_adx_thresh': 19.675086569317553, 'bear_atr_min_pct': 0.01499167526291095, 'bear_atr_max_pct': 0.07960104041780819, 'bear_tp_mult': 2.8147034517994802, 'bear_tsl_mult': 0.9620261984727873, 'bear_time_stop': 193, 'bear_use_sma': True, 'bear_use_ema': False, 'bear_use_atr': True, 'bear_use_adx': True, 'bear_use_spike': False, 'bear_rsi_required': True, 'sideways_strategy': 'breakout', 'sideways_bb_std_mult': 3.281981828437694, 'sideways_rsi_os': 38, 'sideways_rsi_ob': 55, 'sideways_adx_thresh': 6.0680742839027975, 'sideways_atr_min_pct': 0.0025524110703292816, 'sideways_atr_max_pct': 0.13344387070883484, 'sideways_tp_mult': 1.1362947043198115, 'sideways_tsl_mult': 0.9435527845583558, 'sideways_time_stop': 144, 'sideways_use_sma': False, 'sideways_use_ema': False, 'sideways_use_atr': False, 'sideways_use_adx': False, 'sideways_use_spike': False, 'sideways_rsi_required': False}.
[I 2025-08-30 19:44:42,399] Trial 660 finished with values: [-1000000000.0, 1000000000.0] and parameters: {'p_sma': 8, 'p_std': 19, 'p_atr': 20, 'p_adx': 11, 'rsi_period': 41, 'ema1': 26, 'ema2': 29, 'slip_atr_k': 0.06520091979744774, 'slip_spread_k': 0.20951489479714475, 'spread_hl_frac': 0.015723471243426525, 'bb_std_mult': 1.442556126641624, 'rsi_os': 49, 'rsi_ob': 83, 'vol_spike': 0.2604550372526336, 'adx_thresh': 27.85826999311069, 'atr_min_pct': 0.010064842985022868, 'atr_max_pct': 0.12197258688186421, 'tp_mult': 2.5073079099071442, 'tsl_mult': 0.5353850388104461, 'strategy': 'breakout', 'time_stop': 204, 'use_sma': True, 'use_atr': True, 'use_adx': True, 'use_ema': False, 'use_spike': True, 'rsi_required': False, 'edge_k': 0.8193226017791352, 'edge_cap': 0.4813547004003983, 'bull_strategy': 'breakout', 'bull_bb_std_mult': 2.862288955664285, 'bull_rsi_os': 32, 'bull_rsi_ob': 46, 'bull_adx_thresh': 17.999888973455864, 'bull_atr_min_pct': 0.015288874401842466, 'bull_atr_max_pct': 0.14209169737083943, 'bull_tp_mult': 2.758815556540027, 'bull_tsl_mult': 0.49427505966773827, 'bull_time_stop': 157, 'bull_use_sma': False, 'bull_use_ema': True, 'bull_use_atr': True, 'bull_use_adx': True, 'bull_use_spike': False, 'bull_rsi_required': False, 'bear_strategy': 'breakout', 'bear_bb_std_mult': 3.07269136971486, 'bear_rsi_os': 50, 'bear_rsi_ob': 60, 'bear_adx_thresh': 18.576231824368907, 'bear_atr_min_pct': 0.014873698827443523, 'bear_atr_max_pct': 0.02247474041527671, 'bear_tp_mult': 2.3909871439096646, 'bear_tsl_mult': 0.7650210583380433, 'bear_time_stop': 140, 'bear_use_sma': True, 'bear_use_ema': True, 'bear_use_atr': False, 'bear_use_adx': True, 'bear_use_spike': False, 'bear_rsi_required': False, 'sideways_strategy': 'breakout', 'sideways_bb_std_mult': 3.3300336035787117, 'sideways_rsi_os': 38, 'sideways_rsi_ob': 69, 'sideways_adx_thresh': 30.127409233633657, 'sideways_atr_min_pct': 0.02391408471773635, 'sideways_atr_max_pct': 0.14163358851879546, 'sideways_tp_mult': 2.8183969910377433, 'sideways_tsl_mult': 0.9411601645197513, 'sideways_time_stop': 162, 'sideways_use_sma': False, 'sideways_use_ema': False, 'sideways_use_atr': False, 'sideways_use_adx': True, 'sideways_use_spike': False, 'sideways_rsi_required': False}.
[I 2025-08-30 19:44:45,772] Trial 661 finished with values: [-1000000000.0, 1000000000.0] and parameters: {'p_sma': 6, 'p_std': 19, 'p_atr': 20, 'p_adx': 11, 'rsi_period': 31, 'ema1': 24, 'ema2': 29, 'slip_atr_k': 0.06575383048155484, 'slip_spread_k': 0.6310815310636584, 'spread_hl_frac': 0.02535513201399363, 'bb_std_mult': 1.9740248641451363, 'rsi_os': 55, 'rsi_ob': 83, 'vol_spike': 0.24898941853258186, 'adx_thresh': 33.62859714625154, 'atr_min_pct': 0.025459212369657633, 'atr_max_pct': 0.057931489382540474, 'tp_mult': 2.6691267206600684, 'tsl_mult': 0.7459980311157314, 'strategy': 'breakout', 'time_stop': 107, 'use_sma': False, 'use_atr': True, 'use_adx': True, 'use_ema': False, 'use_spike': True, 'rsi_required': True, 'edge_k': 0.8847839083961113, 'edge_cap': 0.3101969826329326, 'bull_strategy': 'breakout', 'bull_bb_std_mult': 2.955640725451299, 'bull_rsi_os': 8, 'bull_rsi_ob': 47, 'bull_adx_thresh': 19.64747729810825, 'bull_atr_min_pct': 0.028868491869675605, 'bull_atr_max_pct': 0.11015293887791235, 'bull_tp_mult': 2.4650129306869593, 'bull_tsl_mult': 0.05011012380454932, 'bull_time_stop': 184, 'bull_use_sma': False, 'bull_use_ema': True, 'bull_use_atr': True, 'bull_use_adx': True, 'bull_use_spike': True, 'bull_rsi_required': False, 'bear_strategy': 'breakout', 'bear_bb_std_mult': 3.0818256079054547, 'bear_rsi_os': 50, 'bear_rsi_ob': 93, 'bear_adx_thresh': 19.699303740047306, 'bear_atr_min_pct': 0.016905456456993515, 'bear_atr_max_pct': 0.02304900858612858, 'bear_tp_mult': 2.8086540940589697, 'bear_tsl_mult': 0.48918578843382565, 'bear_time_stop': 216, 'bear_use_sma': True, 'bear_use_ema': False, 'bear_use_atr': True, 'bear_use_adx': True, 'bear_use_spike': False, 'bear_rsi_required': False, 'sideways_strategy': 'breakout', 'sideways_bb_std_mult': 0.9238671142520452, 'sideways_rsi_os': 38, 'sideways_rsi_ob': 59, 'sideways_adx_thresh': 30.212772180783904, 'sideways_atr_min_pct': 0.01204377714166004, 'sideways_atr_max_pct': 0.03104612125625763, 'sideways_tp_mult': 1.0111042133142336, 'sideways_tsl_mult': 0.06228687853260323, 'sideways_time_stop': 164, 'sideways_use_sma': False, 'sideways_use_ema': True, 'sideways_use_atr': True, 'sideways_use_adx': True, 'sideways_use_spike': False, 'sideways_rsi_required': True}.
[I 2025-08-30 19:44:51,128] Trial 662 finished with values: [-1000000000.0, 1000000000.0] and parameters: {'p_sma': 6, 'p_std': 15, 'p_atr': 20, 'p_adx': 8, 'rsi_period': 67, 'ema1': 24, 'ema2': 28, 'slip_atr_k': 0.0659754325554538, 'slip_spread_k': 0.21762866092424976, 'spread_hl_frac': 0.04998933489115647, 'bb_std_mult': 1.9691944460550777, 'rsi_os': 49, 'rsi_ob': 85, 'vol_spike': 0.12709513416199386, 'adx_thresh': 34.466184957342875, 'atr_min_pct': 1.3830683589169043e-05, 'atr_max_pct': 0.09880056157800784, 'tp_mult': 2.2076372908842954, 'tsl_mult': 0.8739231533476683, 'strategy': 'breakout', 'time_stop': 271, 'use_sma': False, 'use_atr': True, 'use_adx': True, 'use_ema': False, 'use_spike': True, 'rsi_required': False, 'edge_k': 0.27667033232608595, 'edge_cap': 0.5189481251415052, 'bull_strategy': 'breakout', 'bull_bb_std_mult': 2.87466704880575, 'bull_rsi_os': 30, 'bull_rsi_ob': 46, 'bull_adx_thresh': 18.72310105267082, 'bull_atr_min_pct': 0.003941115395318273, 'bull_atr_max_pct': 0.14144454342192553, 'bull_tp_mult': 1.286222506783865, 'bull_tsl_mult': 0.8680593174381518, 'bull_time_stop': 86, 'bull_use_sma': False, 'bull_use_ema': False, 'bull_use_atr': True, 'bull_use_adx': True, 'bull_use_spike': True, 'bull_rsi_required': False, 'bear_strategy': 'breakout', 'bear_bb_std_mult': 2.694471475873414, 'bear_rsi_os': 49, 'bear_rsi_ob': 73, 'bear_adx_thresh': 19.689775267558808, 'bear_atr_min_pct': 0.02865936308147569, 'bear_atr_max_pct': 0.022743515357560647, 'bear_tp_mult': 2.5953162955736895, 'bear_tsl_mult': 0.7659970344935726, 'bear_time_stop': 217, 'bear_use_sma': True, 'bear_use_ema': True, 'bear_use_atr': True, 'bear_use_adx': True, 'bear_use_spike': False, 'bear_rsi_required': False, 'sideways_strategy': 'breakout', 'sideways_bb_std_mult': 3.1472014444529854, 'sideways_rsi_os': 34, 'sideways_rsi_ob': 53, 'sideways_adx_thresh': 12.793604057752024, 'sideways_atr_min_pct': 0.023919124082887135, 'sideways_atr_max_pct': 0.14168764138657158, 'sideways_tp_mult': 2.8193901051887624, 'sideways_tsl_mult': 0.9819094587402593, 'sideways_time_stop': 164, 'sideways_use_sma': False, 'sideways_use_ema': True, 'sideways_use_atr': True, 'sideways_use_adx': True, 'sideways_use_spike': False, 'sideways_rsi_required': True}.
[I 2025-08-30 19:45:12,280] Trial 663 finished with values: [-0.04641235180457093, 0.04678283241597897] and parameters: {'p_sma': 29, 'p_std': 19, 'p_atr': 13, 'p_adx': 21, 'rsi_period': 8, 'ema1': 24, 'ema2': 29, 'slip_atr_k': 0.06433222644492681, 'slip_spread_k': 0.06451428576093832, 'spread_hl_frac': 0.015547831841886593, 'bb_std_mult': 1.9764292918944883, 'rsi_os': 32, 'rsi_ob': 77, 'vol_spike': 0.2452508192840454, 'adx_thresh': 34.35626792153699, 'atr_min_pct': 0.017902681916172076, 'atr_max_pct': 0.09827684581957276, 'tp_mult': 2.664115301987254, 'tsl_mult': 0.8703487470589163, 'strategy': 'breakout', 'time_stop': 277, 'use_sma': False, 'use_atr': True, 'use_adx': True, 'use_ema': False, 'use_spike': True, 'rsi_required': False, 'edge_k': 0.7410696437323777, 'edge_cap': 0.6794947527218801, 'bull_strategy': 'breakout', 'bull_bb_std_mult': 2.879387338157154, 'bull_rsi_os': 32, 'bull_rsi_ob': 45, 'bull_adx_thresh': 22.133026568609967, 'bull_atr_min_pct': 0.0036891954939790514, 'bull_atr_max_pct': 0.1293147034083429, 'bull_tp_mult': 2.6582234621217107, 'bull_tsl_mult': 0.3450933592616918, 'bull_time_stop': 185, 'bull_use_sma': False, 'bull_use_ema': True, 'bull_use_atr': False, 'bull_use_adx': True, 'bull_use_spike': False, 'bull_rsi_required': False, 'bear_strategy': 'breakout', 'bear_bb_std_mult': 2.9826849626017347, 'bear_rsi_os': 19, 'bear_rsi_ob': 72, 'bear_adx_thresh': 18.61334600276907, 'bear_atr_min_pct': 0.0010174091691058738, 'bear_atr_max_pct': 0.03521634415441265, 'bear_tp_mult': 2.6787680273126773, 'bear_tsl_mult': 0.22953204338055744, 'bear_time_stop': 180, 'bear_use_sma': True, 'bear_use_ema': True, 'bear_use_atr': False, 'bear_use_adx': True, 'bear_use_spike': False, 'bear_rsi_required': False, 'sideways_strategy': 'breakout', 'sideways_bb_std_mult': 2.5902280670747455, 'sideways_rsi_os': 34, 'sideways_rsi_ob': 61, 'sideways_adx_thresh': 16.646513462659637, 'sideways_atr_min_pct': 0.0036313784545533943, 'sideways_atr_max_pct': 0.08541517630774796, 'sideways_tp_mult': 2.7753573023456983, 'sideways_tsl_mult': 0.1158204287073909, 'sideways_time_stop': 161, 'sideways_use_sma': False, 'sideways_use_ema': True, 'sideways_use_atr': True, 'sideways_use_adx': True, 'sideways_use_spike': False, 'sideways_rsi_required': True}.
[I 2025-08-30 19:45:21,053] Trial 664 finished with values: [-0.11345516887673279, 0.11344167444600252] and parameters: {'p_sma': 37, 'p_std': 30, 'p_atr': 8, 'p_adx': 15, 'rsi_period': 22, 'ema1': 24, 'ema2': 46, 'slip_atr_k': 0.059559162253714715, 'slip_spread_k': 0.8916643256433574, 'spread_hl_frac': 0.023690152170346618, 'bb_std_mult': 1.967503625394364, 'rsi_os': 28, 'rsi_ob': 85, 'vol_spike': 0.25102769230504485, 'adx_thresh': 10.282846632284151, 'atr_min_pct': 0.013927472617276023, 'atr_max_pct': 0.09883496603208262, 'tp_mult': 2.874611862758365, 'tsl_mult': 0.8682020431352382, 'strategy': 'mean_reversion', 'time_stop': 273, 'use_sma': False, 'use_atr': True, 'use_adx': True, 'use_ema': False, 'use_spike': True, 'rsi_required': False, 'edge_k': 0.04583727980104574, 'edge_cap': 0.6810756456759527, 'bull_strategy': 'mean_reversion', 'bull_bb_std_mult': 1.215077920947984, 'bull_rsi_os': 28, 'bull_rsi_ob': 49, 'bull_adx_thresh': 18.603431672977976, 'bull_atr_min_pct': 0.002903257402723776, 'bull_atr_max_pct': 0.11163206941197493, 'bull_tp_mult': 2.3344975310521656, 'bull_tsl_mult': 0.47089898134080793, 'bull_time_stop': 226, 'bull_use_sma': False, 'bull_use_ema': True, 'bull_use_atr': False, 'bull_use_adx': True, 'bull_use_spike': False, 'bull_rsi_required': False, 'bear_strategy': 'breakout', 'bear_bb_std_mult': 2.9840390243866377, 'bear_rsi_os': 20, 'bear_rsi_ob': 72, 'bear_adx_thresh': 17.89338753928814, 'bear_atr_min_pct': 0.02836918545770134, 'bear_atr_max_pct': 0.05575151812388895, 'bear_tp_mult': 2.5983145656254294, 'bear_tsl_mult': 0.7989496783177867, 'bear_time_stop': 214, 'bear_use_sma': True, 'bear_use_ema': True, 'bear_use_atr': False, 'bear_use_adx': False, 'bear_use_spike': False, 'bear_rsi_required': False, 'sideways_strategy': 'breakout', 'sideways_bb_std_mult': 1.3929553279062679, 'sideways_rsi_os': 40, 'sideways_rsi_ob': 53, 'sideways_adx_thresh': 16.72934650204055, 'sideways_atr_min_pct': 0.0008611864717922588, 'sideways_atr_max_pct': 0.03001653231437447, 'sideways_tp_mult': 2.443108957522226, 'sideways_tsl_mult': 0.9854977340759354, 'sideways_time_stop': 227, 'sideways_use_sma': False, 'sideways_use_ema': True, 'sideways_use_atr': True, 'sideways_use_adx': True, 'sideways_use_spike': False, 'sideways_rsi_required': True}.
[I 2025-08-30 19:45:23,347] Trial 665 finished with values: [-1000000000.0, 1000000000.0] and parameters: {'p_sma': 6, 'p_std': 30, 'p_atr': 8, 'p_adx': 19, 'rsi_period': 22, 'ema1': 6, 'ema2': 54, 'slip_atr_k': 0.18161717968087396, 'slip_spread_k': 0.17228798103602758, 'spread_hl_frac': 0.023785062170551832, 'bb_std_mult': 2.298582596349576, 'rsi_os': 32, 'rsi_ob': 75, 'vol_spike': 0.27858533681803865, 'adx_thresh': 34.41065597786286, 'atr_min_pct': 0.023908957679080408, 'atr_max_pct': 0.13947566331209824, 'tp_mult': 2.8771298212545746, 'tsl_mult': 0.06522616996388558, 'strategy': 'mean_reversion', 'time_stop': 97, 'use_sma': False, 'use_atr': True, 'use_adx': True, 'use_ema': True, 'use_spike': True, 'rsi_required': False, 'edge_k': 1.0862076511940246, 'edge_cap': 0.7001238012047054, 'bull_strategy': 'mean_reversion', 'bull_bb_std_mult': 2.5208834401850573, 'bull_rsi_os': 28, 'bull_rsi_ob': 88, 'bull_adx_thresh': 21.749451203198696, 'bull_atr_min_pct': 0.0039637157692471395, 'bull_atr_max_pct': 0.11338636584808813, 'bull_tp_mult': 1.5126999659284674, 'bull_tsl_mult': 0.09810002871708895, 'bull_time_stop': 226, 'bull_use_sma': False, 'bull_use_ema': True, 'bull_use_atr': False, 'bull_use_adx': False, 'bull_use_spike': False, 'bull_rsi_required': True, 'bear_strategy': 'breakout', 'bear_bb_std_mult': 2.988626314375938, 'bear_rsi_os': 19, 'bear_rsi_ob': 72, 'bear_adx_thresh': 17.78310045040152, 'bear_atr_min_pct': 0.010757775256895197, 'bear_atr_max_pct': 0.03907364883595747, 'bear_tp_mult': 2.583208183119641, 'bear_tsl_mult': 0.7880807461725865, 'bear_time_stop': 198, 'bear_use_sma': True, 'bear_use_ema': True, 'bear_use_atr': False, 'bear_use_adx': False, 'bear_use_spike': False, 'bear_rsi_required': True, 'sideways_strategy': 'mean_reversion', 'sideways_bb_std_mult': 3.1360026326625463, 'sideways_rsi_os': 55, 'sideways_rsi_ob': 61, 'sideways_adx_thresh': 18.76062785301707, 'sideways_atr_min_pct': 0.003580402866569817, 'sideways_atr_max_pct': 0.14998202014610917, 'sideways_tp_mult': 1.7917916837652776, 'sideways_tsl_mult': 0.9751202961093531, 'sideways_time_stop': 151, 'sideways_use_sma': False, 'sideways_use_ema': True, 'sideways_use_atr': True, 'sideways_use_adx': False, 'sideways_use_spike': False, 'sideways_rsi_required': True}.
