[I 2025-08-30 18:37:28,030] Trial 71 finished with values: [-1000000000.0, 1000000000.0] and parameters: {'p_sma': 29, 'p_std': 39, 'p_atr': 15, 'p_adx': 8, 'rsi_period': 44, 'ema1': 6, 'ema2': 30, 'slip_atr_k': 0.04675762837770418, 'slip_spread_k': 0.7436912760276766, 'spread_hl_frac': 0.02506879831341087, 'bb_std_mult': 1.5522242656798781, 'rsi_os': 53, 'rsi_ob': 78, 'vol_spike': 0.11371569180635652, 'adx_thresh': 27.864476933308463, 'atr_min_pct': 0.022526645604469882, 'atr_max_pct': 0.029127205132001968, 'tp_mult': 1.6497281580460976, 'tsl_mult': 0.7944039713288352, 'strategy': 'breakout', 'time_stop': 104, 'use_sma': False, 'use_atr': True, 'use_adx': False, 'use_ema': True, 'use_spike': False, 'rsi_required': False, 'edge_k': 0.5613702107351075, 'edge_cap': 0.24978042003104206, 'bull_strategy': 'breakout', 'bull_bb_std_mult': 3.546358039404094, 'bull_rsi_os': 28, 'bull_rsi_ob': 53, 'bull_adx_thresh': 6.265665490344912, 'bull_atr_min_pct': 0.021976472909418742, 'bull_atr_max_pct': 0.10990753204510444, 'bull_tp_mult': 2.4185886102025704, 'bull_tsl_mult': 0.9052799295692255, 'bull_time_stop': 82, 'bull_use_sma': True, 'bull_use_ema': False, 'bull_use_atr': False, 'bull_use_adx': True, 'bull_use_spike': True, 'bull_rsi_required': False, 'bear_strategy': 'breakout', 'bear_bb_std_mult': 2.817604697399538, 'bear_rsi_os': 36, 'bear_rsi_ob': 68, 'bear_adx_thresh': 14.599104114702829, 'bear_atr_min_pct': 0.0012147252633018172, 'bear_atr_max_pct': 0.02161501566041453, 'bear_tp_mult': 2.536973457726044, 'bear_tsl_mult': 0.5837163686709081, 'bear_time_stop': 236, 'bear_use_sma': True, 'bear_use_ema': True, 'bear_use_atr': True, 'bear_use_adx': True, 'bear_use_spike': True, 'bear_rsi_required': False, 'sideways_strategy': 'breakout', 'sideways_bb_std_mult': 3.261759762104083, 'sideways_rsi_os': 24, 'sideways_rsi_ob': 85, 'sideways_adx_thresh': 7.79303691055164, 'sideways_atr_min_pct': 0.0029151456010083586, 'sideways_atr_max_pct': 0.1283619638962065, 'sideways_tp_mult': 1.348953002671533, 'sideways_tsl_mult': 0.9639952321771944, 'sideways_time_stop': 271, 'sideways_use_sma': True, 'sideways_use_ema': True, 'sideways_use_atr': True, 'sideways_use_adx': False, 'sideways_use_spike': False, 'sideways_rsi_required': True}.
[I 2025-08-30 18:37:28,207] Trial 72 finished with values: [-1000000000.0, 1000000000.0] and parameters: {'p_sma': 53, 'p_std': 32, 'p_atr': 15, 'p_adx': 20, 'rsi_period': 35, 'ema1': 24, 'ema2': 30, 'slip_atr_k': 0.04562366745111619, 'slip_spread_k': 0.7455535875965678, 'spread_hl_frac': 0.03137826919644487, 'bb_std_mult': 1.470419481472864, 'rsi_os': 53, 'rsi_ob': 45, 'vol_spike': 0.10188913063135815, 'adx_thresh': 25.90431026240591, 'atr_min_pct': 0.028329552419303416, 'atr_max_pct': 0.049535187825213496, 'tp_mult': 2.095854087305423, 'tsl_mult': 0.0809126608016737, 'strategy': 'breakout', 'time_stop': 106, 'use_sma': False, 'use_atr': True, 'use_adx': False, 'use_ema': True, 'use_spike': False, 'rsi_required': False, 'edge_k': 0.08566466106738986, 'edge_cap': 0.3914251847596974, 'bull_strategy': 'breakout', 'bull_bb_std_mult': 3.3846477488729243, 'bull_rsi_os': 30, 'bull_rsi_ob': 47, 'bull_adx_thresh': 5.317899365534387, 'bull_atr_min_pct': 0.02282606706815217, 'bull_atr_max_pct': 0.10970359730140904, 'bull_tp_mult': 2.4337247748147353, 'bull_tsl_mult': 0.8582559995644969, 'bull_time_stop': 99, 'bull_use_sma': False, 'bull_use_ema': False, 'bull_use_atr': False, 'bull_use_adx': True, 'bull_use_spike': True, 'bull_rsi_required': False, 'bear_strategy': 'breakout', 'bear_bb_std_mult': 2.7558860598142028, 'bear_rsi_os': 46, 'bear_rsi_ob': 68, 'bear_adx_thresh': 18.352569250459087, 'bear_atr_min_pct': 0.006615619662170379, 'bear_atr_max_pct': 0.05034981369193363, 'bear_tp_mult': 2.5017907011719314, 'bear_tsl_mult': 0.4873566695243414, 'bear_time_stop': 50, 'bear_use_sma': True, 'bear_use_ema': True, 'bear_use_atr': True, 'bear_use_adx': True, 'bear_use_spike': True, 'bear_rsi_required': False, 'sideways_strategy': 'breakout', 'sideways_bb_std_mult': 0.8495313147949894, 'sideways_rsi_os': 25, 'sideways_rsi_ob': 48, 'sideways_adx_thresh': 8.011606295960082, 'sideways_atr_min_pct': 0.003766209916040086, 'sideways_atr_max_pct': 0.14552903694046143, 'sideways_tp_mult': 1.397278174185554, 'sideways_tsl_mult': 0.9593961235999146, 'sideways_time_stop': 217, 'sideways_use_sma': True, 'sideways_use_ema': True, 'sideways_use_atr': True, 'sideways_use_adx': False, 'sideways_use_spike': False, 'sideways_rsi_required': True}.
[I 2025-08-30 18:37:59,042] Trial 76 finished with values: [-1000000000.0, 1000000000.0] and parameters: {'p_sma': 22, 'p_std': 32, 'p_atr': 12, 'p_adx': 21, 'rsi_period': 59, 'ema1': 24, 'ema2': 40, 'slip_atr_k': 0.1549836499924538, 'slip_spread_k': 0.8985354450670627, 'spread_hl_frac': 0.00032917473499314426, 'bb_std_mult': 1.9487589001041452, 'rsi_os': 42, 'rsi_ob': 71, 'vol_spike': 0.10214422607881911, 'adx_thresh': 26.94261173480674, 'atr_min_pct': 0.028959004357116215, 'atr_max_pct': 0.08594405633735988, 'tp_mult': 2.6302357233581697, 'tsl_mult': 0.6689105925778951, 'strategy': 'breakout', 'time_stop': 269, 'use_sma': False, 'use_atr': True, 'use_adx': True, 'use_ema': True, 'use_spike': True, 'rsi_required': True, 'edge_k': 0.23627635388381882, 'edge_cap': 0.30240959893469566, 'bull_strategy': 'breakout', 'bull_bb_std_mult': 1.5863273196753294, 'bull_rsi_os': 36, 'bull_rsi_ob': 75, 'bull_adx_thresh': 34.970984009648525, 'bull_atr_min_pct': 0.026508514042102044, 'bull_atr_max_pct': 0.1369895766548636, 'bull_tp_mult': 2.4397134171772272, 'bull_tsl_mult': 0.7292699258009281, 'bull_time_stop': 114, 'bull_use_sma': False, 'bull_use_ema': False, 'bull_use_atr': True, 'bull_use_adx': False, 'bull_use_spike': False, 'bull_rsi_required': True, 'bear_strategy': 'breakout', 'bear_bb_std_mult': 3.5952126912856017, 'bear_rsi_os': 22, 'bear_rsi_ob': 82, 'bear_adx_thresh': 8.893612785870575, 'bear_atr_min_pct': 0.008890744862425328, 'bear_atr_max_pct': 0.05161971373826694, 'bear_tp_mult': 2.7486721259363605, 'bear_tsl_mult': 0.4866586701457923, 'bear_time_stop': 169, 'bear_use_sma': False, 'bear_use_ema': True, 'bear_use_atr': True, 'bear_use_adx': True, 'bear_use_spike': False, 'bear_rsi_required': False, 'sideways_strategy': 'breakout', 'sideways_bb_std_mult': 0.8522267530345764, 'sideways_rsi_os': 25, 'sideways_rsi_ob': 82, 'sideways_adx_thresh': 32.749870783688884, 'sideways_atr_min_pct': 0.0010274541241893664, 'sideways_atr_max_pct': 0.11742342920102464, 'sideways_tp_mult': 1.0247779540780315, 'sideways_tsl_mult': 0.9630887206566656, 'sideways_time_stop': 219, 'sideways_use_sma': False, 'sideways_use_ema': False, 'sideways_use_atr': True, 'sideways_use_adx': False, 'sideways_use_spike': True, 'sideways_rsi_required': False}.
[I 2025-08-30 18:38:00,065] Trial 77 finished with values: [-0.09680185166252486, 0.09670944754280951] and parameters: {'p_sma': 50, 'p_std': 53, 'p_atr': 13, 'p_adx': 21, 'rsi_period': 17, 'ema1': 20, 'ema2': 24, 'slip_atr_k': 0.0657432327377726, 'slip_spread_k': 0.9063831489920835, 'spread_hl_frac': 0.005658865100032301, 'bb_std_mult': 1.117518693959691, 'rsi_os': 42, 'rsi_ob': 54, 'vol_spike': 0.08140485047664095, 'adx_thresh': 27.101459598976284, 'atr_min_pct': 0.02434817865976863, 'atr_max_pct': 0.09565315490982494, 'tp_mult': 2.579993044145741, 'tsl_mult': 0.7146686856097826, 'strategy': 'breakout', 'time_stop': 236, 'use_sma': True, 'use_atr': True, 'use_adx': True, 'use_ema': True, 'use_spike': True, 'rsi_required': True, 'edge_k': 0.2287888714110623, 'edge_cap': 0.24130891583625813, 'bull_strategy': 'mean_reversion', 'bull_bb_std_mult': 1.5442025663181205, 'bull_rsi_os': 23, 'bull_rsi_ob': 75, 'bull_adx_thresh': 12.224199363905132, 'bull_atr_min_pct': 0.026714509035325823, 'bull_atr_max_pct': 0.1468271646358626, 'bull_tp_mult': 2.2590895929155854, 'bull_tsl_mult': 0.7223067778729574, 'bull_time_stop': 173, 'bull_use_sma': False, 'bull_use_ema': False, 'bull_use_atr': True, 'bull_use_adx': False, 'bull_use_spike': False, 'bull_rsi_required': True, 'bear_strategy': 'breakout', 'bear_bb_std_mult': 2.891585727932951, 'bear_rsi_os': 31, 'bear_rsi_ob': 64, 'bear_adx_thresh': 34.036437124658576, 'bear_atr_min_pct': 0.0028068320679322627, 'bear_atr_max_pct': 0.05660299512451389, 'bear_tp_mult': 2.748270292939644, 'bear_tsl_mult': 0.7689713190764196, 'bear_time_stop': 185, 'bear_use_sma': False, 'bear_use_ema': False, 'bear_use_atr': True, 'bear_use_adx': True, 'bear_use_spike': False, 'bear_rsi_required': False, 'sideways_strategy': 'breakout', 'sideways_bb_std_mult': 3.150235262513189, 'sideways_rsi_os': 50, 'sideways_rsi_ob': 79, 'sideways_adx_thresh': 6.303188862795222, 'sideways_atr_min_pct': 0.0013476546172196823, 'sideways_atr_max_pct': 0.11741960066478496, 'sideways_tp_mult': 1.0206213237242783, 'sideways_tsl_mult': 0.04855994050716711, 'sideways_time_stop': 285, 'sideways_use_sma': False, 'sideways_use_ema': False, 'sideways_use_atr': True, 'sideways_use_adx': False, 'sideways_use_spike': True, 'sideways_rsi_required': False}.
[I 2025-08-30 18:38:00,894] Trial 75 finished with values: [-1000000000.0, 1000000000.0] and parameters: {'p_sma': 22, 'p_std': 39, 'p_atr': 13, 'p_adx': 21, 'rsi_period': 84, 'ema1': 24, 'ema2': 29, 'slip_atr_k': 0.15280895073568762, 'slip_spread_k': 0.896888272729109, 'spread_hl_frac': 0.030846726250937102, 'bb_std_mult': 1.477380967618755, 'rsi_os': 43, 'rsi_ob': 78, 'vol_spike': 0.09792798099333191, 'adx_thresh': 27.27636429451685, 'atr_min_pct': 0.028785179659879825, 'atr_max_pct': 0.08622469491151818, 'tp_mult': 2.352703732759158, 'tsl_mult': 0.7133580410224226, 'strategy': 'breakout', 'time_stop': 261, 'use_sma': False, 'use_atr': True, 'use_adx': True, 'use_ema': True, 'use_spike': False, 'rsi_required': True, 'edge_k': 0.5179269598145275, 'edge_cap': 0.24697213045283295, 'bull_strategy': 'breakout', 'bull_bb_std_mult': 3.5645415808684096, 'bull_rsi_os': 40, 'bull_rsi_ob': 52, 'bull_adx_thresh': 12.249255912600901, 'bull_atr_min_pct': 0.02687457074128222, 'bull_atr_max_pct': 0.14532884627546902, 'bull_tp_mult': 2.4341085823303206, 'bull_tsl_mult': 0.7871423326772589, 'bull_time_stop': 173, 'bull_use_sma': False, 'bull_use_ema': False, 'bull_use_atr': True, 'bull_use_adx': False, 'bull_use_spike': False, 'bull_rsi_required': True, 'bear_strategy': 'breakout', 'bear_bb_std_mult': 2.755110209185366, 'bear_rsi_os': 46, 'bear_rsi_ob': 65, 'bear_adx_thresh': 9.97223609124017, 'bear_atr_min_pct': 0.0026374626171014725, 'bear_atr_max_pct': 0.043409203974841284, 'bear_tp_mult': 2.4647003384869577, 'bear_tsl_mult': 0.47333951269702834, 'bear_time_stop': 42, 'bear_use_sma': False, 'bear_use_ema': True, 'bear_use_atr': True, 'bear_use_adx': True, 'bear_use_spike': False, 'bear_rsi_required': False, 'sideways_strategy': 'breakout', 'sideways_bb_std_mult': 3.2399677460774496, 'sideways_rsi_os': 25, 'sideways_rsi_ob': 79, 'sideways_adx_thresh': 28.97009280581898, 'sideways_atr_min_pct': 0.0012246457013617047, 'sideways_atr_max_pct': 0.14537176486343573, 'sideways_tp_mult': 1.0323004466935006, 'sideways_tsl_mult': 0.9546797939192854, 'sideways_time_stop': 269, 'sideways_use_sma': True, 'sideways_use_ema': True, 'sideways_use_atr': True, 'sideways_use_adx': False, 'sideways_use_spike': True, 'sideways_rsi_required': False}.
[I 2025-08-30 18:38:01,266] Trial 74 finished with values: [-1000000000.0, 1000000000.0] and parameters: {'p_sma': 26, 'p_std': 7, 'p_atr': 16, 'p_adx': 21, 'rsi_period': 84, 'ema1': 24, 'ema2': 29, 'slip_atr_k': 0.09484780932920213, 'slip_spread_k': 0.8989617617131366, 'spread_hl_frac': 0.03122978330442626, 'bb_std_mult': 1.5022585908849428, 'rsi_os': 53, 'rsi_ob': 45, 'vol_spike': 0.10269260599156815, 'adx_thresh': 27.181456798511096, 'atr_min_pct': 0.028702748209911824, 'atr_max_pct': 0.04966603505886153, 'tp_mult': 2.365268931343942, 'tsl_mult': 0.7237534359677933, 'strategy': 'breakout', 'time_stop': 264, 'use_sma': False, 'use_atr': True, 'use_adx': True, 'use_ema': True, 'use_spike': False, 'rsi_required': True, 'edge_k': 0.4954181974029318, 'edge_cap': 0.9183365659140943, 'bull_strategy': 'breakout', 'bull_bb_std_mult': 1.5087257083636556, 'bull_rsi_os': 27, 'bull_rsi_ob': 53, 'bull_adx_thresh': 12.274311264369317, 'bull_atr_min_pct': 0.02656047271081433, 'bull_atr_max_pct': 0.14934038986735748, 'bull_tp_mult': 2.4359576056231527, 'bull_tsl_mult': 0.7442738291968078, 'bull_time_stop': 261, 'bull_use_sma': False, 'bull_use_ema': False, 'bull_use_atr': True, 'bull_use_adx': False, 'bull_use_spike': False, 'bull_rsi_required': True, 'bear_strategy': 'breakout', 'bear_bb_std_mult': 2.772478654636977, 'bear_rsi_os': 27, 'bear_rsi_ob': 64, 'bear_adx_thresh': 34.99681911082581, 'bear_atr_min_pct': 0.008645658162362686, 'bear_atr_max_pct': 0.05274859745362493, 'bear_tp_mult': 2.487582785437988, 'bear_tsl_mult': 0.7704275963173152, 'bear_time_stop': 172, 'bear_use_sma': False, 'bear_use_ema': True, 'bear_use_atr': True, 'bear_use_adx': True, 'bear_use_spike': False, 'bear_rsi_required': False, 'sideways_strategy': 'breakout', 'sideways_bb_std_mult': 0.887686778341231, 'sideways_rsi_os': 24, 'sideways_rsi_ob': 80, 'sideways_adx_thresh': 34.37847027354129, 'sideways_atr_min_pct': 0.001034325957262638, 'sideways_atr_max_pct': 0.1454418130973858, 'sideways_tp_mult': 1.219082031646984, 'sideways_tsl_mult': 0.9573600418275778, 'sideways_time_stop': 270, 'sideways_use_sma': True, 'sideways_use_ema': True, 'sideways_use_atr': True, 'sideways_use_adx': False, 'sideways_use_spike': True, 'sideways_rsi_required': False}.
[I 2025-08-30 18:38:34,578] Trial 80 finished with values: [-1000000000.0, 0.18107620639461494] and parameters: {'p_sma': 26, 'p_std': 7, 'p_atr': 18, 'p_adx': 29, 'rsi_period': 11, 'ema1': 28, 'ema2': 24, 'slip_atr_k': 0.0960701969635206, 'slip_spread_k': 0.8137642457612415, 'spread_hl_frac': 0.026587778734845077, 'bb_std_mult': 1.3529096363366842, 'rsi_os': 46, 'rsi_ob': 54, 'vol_spike': 0.13599637067386822, 'adx_thresh': 17.221896651932873, 'atr_min_pct': 0.025385053062946007, 'atr_max_pct': 0.10273596089586658, 'tp_mult': 1.7661359441877766, 'tsl_mult': 0.003391427686104842, 'strategy': 'breakout', 'time_stop': 6, 'use_sma': True, 'use_atr': True, 'use_adx': True, 'use_ema': True, 'use_spike': True, 'rsi_required': False, 'edge_k': 0.2249301645411536, 'edge_cap': 0.44566840486275433, 'bull_strategy': 'mean_reversion', 'bull_bb_std_mult': 1.5252856885938038, 'bull_rsi_os': 23, 'bull_rsi_ob': 48, 'bull_adx_thresh': 21.43690657209317, 'bull_atr_min_pct': 0.01841467560608239, 'bull_atr_max_pct': 0.12615880363716186, 'bull_tp_mult': 1.9444279161201397, 'bull_tsl_mult': 0.42638337443668656, 'bull_time_stop': 205, 'bull_use_sma': False, 'bull_use_ema': False, 'bull_use_atr': True, 'bull_use_adx': False, 'bull_use_spike': False, 'bull_rsi_required': True, 'bear_strategy': 'mean_reversion', 'bear_bb_std_mult': 3.403886748876757, 'bear_rsi_os': 27, 'bear_rsi_ob': 91, 'bear_adx_thresh': 33.539707215140616, 'bear_atr_min_pct': 0.024320782304734806, 'bear_atr_max_pct': 0.053667651819524834, 'bear_tp_mult': 2.9135699149279155, 'bear_tsl_mult': 0.6609938962913513, 'bear_time_stop': 111, 'bear_use_sma': True, 'bear_use_ema': False, 'bear_use_atr': True, 'bear_use_adx': True, 'bear_use_spike': False, 'bear_rsi_required': False, 'sideways_strategy': 'breakout', 'sideways_bb_std_mult': 3.135030694727014, 'sideways_rsi_os': 49, 'sideways_rsi_ob': 68, 'sideways_adx_thresh': 5.917915330041458, 'sideways_atr_min_pct': 0.0006143358956168676, 'sideways_atr_max_pct': 0.13741811614333704, 'sideways_tp_mult': 1.212809123246899, 'sideways_tsl_mult': 0.8973709235910968, 'sideways_time_stop': 282, 'sideways_use_sma': False, 'sideways_use_ema': False, 'sideways_use_atr': True, 'sideways_use_adx': True, 'sideways_use_spike': True, 'sideways_rsi_required': False}.
[I 2025-08-30 18:38:34,937] Trial 81 finished with values: [-0.09166099480836509, 0.09158217765266502] and parameters: {'p_sma': 7, 'p_std': 30, 'p_atr': 18, 'p_adx': 22, 'rsi_period': 23, 'ema1': 19, 'ema2': 24, 'slip_atr_k': 0.06939987094789155, 'slip_spread_k': 0.3121160212956854, 'spread_hl_frac': 0.004511112729607872, 'bb_std_mult': 1.0648646441140242, 'rsi_os': 44, 'rsi_ob': 47, 'vol_spike': 0.08053007674579395, 'adx_thresh': 22.275834973522603, 'atr_min_pct': 0.025571288615362238, 'atr_max_pct': 0.0714388197720535, 'tp_mult': 2.1880572365475035, 'tsl_mult': 0.7692406916289722, 'strategy': 'breakout', 'time_stop': 190, 'use_sma': True, 'use_atr': True, 'use_adx': True, 'use_ema': True, 'use_spike': True, 'rsi_required': False, 'edge_k': 0.30932276741191816, 'edge_cap': 0.6538656392171953, 'bull_strategy': 'mean_reversion', 'bull_bb_std_mult': 1.649206913395555, 'bull_rsi_os': 24, 'bull_rsi_ob': 56, 'bull_adx_thresh': 21.003453247773344, 'bull_atr_min_pct': 0.019039271499709787, 'bull_atr_max_pct': 0.12482472058928429, 'bull_tp_mult': 2.2444953451904537, 'bull_tsl_mult': 0.45626187322329576, 'bull_time_stop': 200, 'bull_use_sma': False, 'bull_use_ema': False, 'bull_use_atr': True, 'bull_use_adx': False, 'bull_use_spike': False, 'bull_rsi_required': True, 'bear_strategy': 'mean_reversion', 'bear_bb_std_mult': 3.414793593748716, 'bear_rsi_os': 50, 'bear_rsi_ob': 91, 'bear_adx_thresh': 13.122622482300734, 'bear_atr_min_pct': 0.02573101614808832, 'bear_atr_max_pct': 0.026173667359558964, 'bear_tp_mult': 2.9005778455194355, 'bear_tsl_mult': 0.7033419299000923, 'bear_time_stop': 182, 'bear_use_sma': True, 'bear_use_ema': False, 'bear_use_atr': True, 'bear_use_adx': True, 'bear_use_spike': False, 'bear_rsi_required': False, 'sideways_strategy': 'breakout', 'sideways_bb_std_mult': 3.1212084741638626, 'sideways_rsi_os': 49, 'sideways_rsi_ob': 73, 'sideways_adx_thresh': 20.758037390935613, 'sideways_atr_min_pct': 0.0004165302084856234, 'sideways_atr_max_pct': 0.13824224176746125, 'sideways_tp_mult': 1.5404929009660944, 'sideways_tsl_mult': 0.03152962987780861, 'sideways_time_stop': 284, 'sideways_use_sma': False, 'sideways_use_ema': False, 'sideways_use_atr': True, 'sideways_use_adx': True, 'sideways_use_spike': True, 'sideways_rsi_required': False}.
[I 2025-08-30 18:38:35,223] Trial 79 finished with values: [-1000000000.0, 0.16478356587897106] and parameters: {'p_sma': 26, 'p_std': 28, 'p_atr': 13, 'p_adx': 22, 'rsi_period': 17, 'ema1': 20, 'ema2': 24, 'slip_atr_k': 0.09583409949775411, 'slip_spread_k': 0.9998781349590767, 'spread_hl_frac': 0.029451337452689033, 'bb_std_mult': 1.0805879351296193, 'rsi_os': 43, 'rsi_ob': 54, 'vol_spike': 0.0846527684981766, 'adx_thresh': 22.179275834192502, 'atr_min_pct': 0.025470355477850187, 'atr_max_pct': 0.07068349787312035, 'tp_mult': 2.341621224538703, 'tsl_mult': 0.7182295297874302, 'strategy': 'breakout', 'time_stop': 262, 'use_sma': True, 'use_atr': True, 'use_adx': True, 'use_ema': True, 'use_spike': True, 'rsi_required': True, 'edge_k': 0.004226282983589763, 'edge_cap': 0.2428689983708932, 'bull_strategy': 'mean_reversion', 'bull_bb_std_mult': 1.5190558978321853, 'bull_rsi_os': 23, 'bull_rsi_ob': 52, 'bull_adx_thresh': 12.288865967224002, 'bull_atr_min_pct': 0.018897548890415488, 'bull_atr_max_pct': 0.1451856945251968, 'bull_tp_mult': 2.000163679521426, 'bull_tsl_mult': 0.4173782209780279, 'bull_time_stop': 197, 'bull_use_sma': False, 'bull_use_ema': False, 'bull_use_atr': True, 'bull_use_adx': False, 'bull_use_spike': False, 'bull_rsi_required': True, 'bear_strategy': 'mean_reversion', 'bear_bb_std_mult': 3.3999465057501133, 'bear_rsi_os': 31, 'bear_rsi_ob': 64, 'bear_adx_thresh': 10.325892594605966, 'bear_atr_min_pct': 0.003478213718164072, 'bear_atr_max_pct': 0.05500735985130867, 'bear_tp_mult': 2.910380223867664, 'bear_tsl_mult': 0.6999565732392937, 'bear_time_stop': 185, 'bear_use_sma': False, 'bear_use_ema': False, 'bear_use_atr': True, 'bear_use_adx': True, 'bear_use_spike': False, 'bear_rsi_required': False, 'sideways_strategy': 'breakout', 'sideways_bb_std_mult': 3.131640444421151, 'sideways_rsi_os': 51, 'sideways_rsi_ob': 67, 'sideways_adx_thresh': 16.28703331318394, 'sideways_atr_min_pct': 0.0005234627413399543, 'sideways_atr_max_pct': 0.1448225154242859, 'sideways_tp_mult': 1.1967660536173774, 'sideways_tsl_mult': 0.9007495085038467, 'sideways_time_stop': 262, 'sideways_use_sma': False, 'sideways_use_ema': True, 'sideways_use_atr': True, 'sideways_use_adx': False, 'sideways_use_spike': True, 'sideways_rsi_required': False}.
