[I 2025-08-30 19:30:28,713] Trial 543 finished with values: [-1000000000.0, 1000000000.0] and parameters: {'p_sma': 7, 'p_std': 31, 'p_atr': 11, 'p_adx': 16, 'rsi_period': 19, 'ema1': 22, 'ema2': 32, 'slip_atr_k': 0.07017376972378399, 'slip_spread_k': 0.1545561386252003, 'spread_hl_frac': 0.048635365639387695, 'bb_std_mult': 2.3100977395644096, 'rsi_os': 18, 'rsi_ob': 84, 'vol_spike': 0.2100621585886004, 'adx_thresh': 30.784706657075187, 'atr_min_pct': 0.025387063890244522, 'atr_max_pct': 0.021496435830674933, 'tp_mult': 2.23732339164889, 'tsl_mult': 0.8551938030969978, 'strategy': 'breakout', 'time_stop': 199, 'use_sma': False, 'use_atr': True, 'use_adx': True, 'use_ema': False, 'use_spike': True, 'rsi_required': True, 'edge_k': 0.050148099924659365, 'edge_cap': 0.5183856501994617, 'bull_strategy': 'mean_reversion', 'bull_bb_std_mult': 3.184957491909275, 'bull_rsi_os': 9, 'bull_rsi_ob': 61, 'bull_adx_thresh': 16.810851979592762, 'bull_atr_min_pct': 0.00809377952228634, 'bull_atr_max_pct': 0.10526952856774147, 'bull_tp_mult': 2.2591172204782524, 'bull_tsl_mult': 0.1113776062329297, 'bull_time_stop': 205, 'bull_use_sma': False, 'bull_use_ema': True, 'bull_use_atr': True, 'bull_use_adx': True, 'bull_use_spike': True, 'bull_rsi_required': True, 'bear_strategy': 'breakout', 'bear_bb_std_mult': 3.100850946032059, 'bear_rsi_os': 52, 'bear_rsi_ob': 74, 'bear_adx_thresh': 19.045889940694828, 'bear_atr_min_pct': 0.018612682541549606, 'bear_atr_max_pct': 0.036556192004257144, 'bear_tp_mult': 2.0565641317589836, 'bear_tsl_mult': 0.2923769156066126, 'bear_time_stop': 200, 'bear_use_sma': True, 'bear_use_ema': True, 'bear_use_atr': False, 'bear_use_adx': True, 'bear_use_spike': True, 'bear_rsi_required': True, 'sideways_strategy': 'breakout', 'sideways_bb_std_mult': 1.3519713115775467, 'sideways_rsi_os': 35, 'sideways_rsi_ob': 60, 'sideways_adx_thresh': 9.63887854499427, 'sideways_atr_min_pct': 0.026273376649460445, 'sideways_atr_max_pct': 0.14729574404653145, 'sideways_tp_mult': 1.9701300580324135, 'sideways_tsl_mult': 0.6796457482924039, 'sideways_time_stop': 157, 'sideways_use_sma': True, 'sideways_use_ema': True, 'sideways_use_atr': True, 'sideways_use_adx': False, 'sideways_use_spike': True, 'sideways_rsi_required': True}.
[I 2025-08-30 19:30:41,740] Trial 537 finished with values: [-1000000000.0, 1000000000.0] and parameters: {'p_sma': 26, 'p_std': 40, 'p_atr': 7, 'p_adx': 27, 'rsi_period': 27, 'ema1': 27, 'ema2': 31, 'slip_atr_k': 0.0681396558084136, 'slip_spread_k': 0.13634341731604527, 'spread_hl_frac': 0.04868712135210135, 'bb_std_mult': 2.1049443030284767, 'rsi_os': 6, 'rsi_ob': 91, 'vol_spike': 0.26894336984395917, 'adx_thresh': 33.06502390652379, 'atr_min_pct': 0.016672241581775823, 'atr_max_pct': 0.07180863498693173, 'tp_mult': 1.8663999223893424, 'tsl_mult': 0.8821015316604313, 'strategy': 'mean_reversion', 'time_stop': 182, 'use_sma': False, 'use_atr': True, 'use_adx': True, 'use_ema': True, 'use_spike': True, 'rsi_required': False, 'edge_k': 1.8658870212852596, 'edge_cap': 0.9779837724324861, 'bull_strategy': 'mean_reversion', 'bull_bb_std_mult': 2.9097054218900666, 'bull_rsi_os': 42, 'bull_rsi_ob': 47, 'bull_adx_thresh': 7.720786793863411, 'bull_atr_min_pct': 0.018146816873863516, 'bull_atr_max_pct': 0.11897480016282036, 'bull_tp_mult': 1.862174448757589, 'bull_tsl_mult': 0.19551968504315836, 'bull_time_stop': 178, 'bull_use_sma': True, 'bull_use_ema': True, 'bull_use_atr': True, 'bull_use_adx': False, 'bull_use_spike': False, 'bull_rsi_required': True, 'bear_strategy': 'breakout', 'bear_bb_std_mult': 2.451003880670343, 'bear_rsi_os': 48, 'bear_rsi_ob': 54, 'bear_adx_thresh': 21.06526062982159, 'bear_atr_min_pct': 0.015507974851052004, 'bear_atr_max_pct': 0.10850045663048422, 'bear_tp_mult': 2.632057107893329, 'bear_tsl_mult': 0.7794946044597775, 'bear_time_stop': 162, 'bear_use_sma': False, 'bear_use_ema': True, 'bear_use_atr': True, 'bear_use_adx': False, 'bear_use_spike': False, 'bear_rsi_required': False, 'sideways_strategy': 'mean_reversion', 'sideways_bb_std_mult': 3.215482487339804, 'sideways_rsi_os': 43, 'sideways_rsi_ob': 59, 'sideways_adx_thresh': 20.037177620427094, 'sideways_atr_min_pct': 0.002972519577258604, 'sideways_atr_max_pct': 0.06066574855298694, 'sideways_tp_mult': 2.724319822373828, 'sideways_tsl_mult': 0.6848371840041007, 'sideways_time_stop': 168, 'sideways_use_sma': False, 'sideways_use_ema': False, 'sideways_use_atr': True, 'sideways_use_adx': False, 'sideways_use_spike': False, 'sideways_rsi_required': True}.
[I 2025-08-30 19:30:49,461] Trial 541 finished with values: [-1000000000.0, 1000000000.0] and parameters: {'p_sma': 6, 'p_std': 44, 'p_atr': 11, 'p_adx': 20, 'rsi_period': 54, 'ema1': 15, 'ema2': 12, 'slip_atr_k': 0.04643723649882147, 'slip_spread_k': 0.09606376559986302, 'spread_hl_frac': 0.01439747052996136, 'bb_std_mult': 2.363136592509816, 'rsi_os': 50, 'rsi_ob': 84, 'vol_spike': 0.18046028373079592, 'adx_thresh': 32.81853180875871, 'atr_min_pct': 0.02187533268945772, 'atr_max_pct': 0.05958368175966536, 'tp_mult': 2.2381075849058303, 'tsl_mult': 0.8217199543189482, 'strategy': 'breakout', 'time_stop': 161, 'use_sma': False, 'use_atr': False, 'use_adx': True, 'use_ema': True, 'use_spike': False, 'rsi_required': True, 'edge_k': 0.0507514143789366, 'edge_cap': 0.5131224738387786, 'bull_strategy': 'mean_reversion', 'bull_bb_std_mult': 3.18587117314458, 'bull_rsi_os': 27, 'bull_rsi_ob': 47, 'bull_adx_thresh': 11.598142423098155, 'bull_atr_min_pct': 0.008259373568396997, 'bull_atr_max_pct': 0.026066305421184356, 'bull_tp_mult': 2.371250178496034, 'bull_tsl_mult': 0.5477972729170746, 'bull_time_stop': 156, 'bull_use_sma': False, 'bull_use_ema': False, 'bull_use_atr': True, 'bull_use_adx': True, 'bull_use_spike': False, 'bull_rsi_required': False, 'bear_strategy': 'breakout', 'bear_bb_std_mult': 3.3632907796802254, 'bear_rsi_os': 35, 'bear_rsi_ob': 48, 'bear_adx_thresh': 31.13163844093698, 'bear_atr_min_pct': 0.0159392868587808, 'bear_atr_max_pct': 0.09364499914795467, 'bear_tp_mult': 2.056550925341823, 'bear_tsl_mult': 0.8268814975661578, 'bear_time_stop': 192, 'bear_use_sma': True, 'bear_use_ema': False, 'bear_use_atr': False, 'bear_use_adx': True, 'bear_use_spike': False, 'bear_rsi_required': False, 'sideways_strategy': 'mean_reversion', 'sideways_bb_std_mult': 1.9149441877758164, 'sideways_rsi_os': 21, 'sideways_rsi_ob': 54, 'sideways_adx_thresh': 21.10356249772651, 'sideways_atr_min_pct': 0.015954974690299214, 'sideways_atr_max_pct': 0.14985723741632753, 'sideways_tp_mult': 2.4720304576534256, 'sideways_tsl_mult': 0.7246588642762178, 'sideways_time_stop': 168, 'sideways_use_sma': False, 'sideways_use_ema': False, 'sideways_use_atr': False, 'sideways_use_adx': False, 'sideways_use_spike': False, 'sideways_rsi_required': True}.
[I 2025-08-30 19:30:54,046] Trial 542 finished with values: [-1000000000.0, 1000000000.0] and parameters: {'p_sma': 6, 'p_std': 44, 'p_atr': 26, 'p_adx': 20, 'rsi_period': 22, 'ema1': 15, 'ema2': 33, 'slip_atr_k': 0.1895347956671271, 'slip_spread_k': 0.39301755179327036, 'spread_hl_frac': 0.021819707564015516, 'bb_std_mult': 2.313101890004532, 'rsi_os': 50, 'rsi_ob': 84, 'vol_spike': 0.271547230012143, 'adx_thresh': 34.03789496106537, 'atr_min_pct': 0.02565136647556528, 'atr_max_pct': 0.07354202931642258, 'tp_mult': 2.2512325737575107, 'tsl_mult': 0.8586299135249511, 'strategy': 'breakout', 'time_stop': 198, 'use_sma': False, 'use_atr': True, 'use_adx': True, 'use_ema': False, 'use_spike': False, 'rsi_required': True, 'edge_k': 0.11783497923493612, 'edge_cap': 0.5174870334710044, 'bull_strategy': 'mean_reversion', 'bull_bb_std_mult': 3.190027230338208, 'bull_rsi_os': 29, 'bull_rsi_ob': 47, 'bull_adx_thresh': 11.580775429044744, 'bull_atr_min_pct': 0.0022939059702262237, 'bull_atr_max_pct': 0.12084780461178177, 'bull_tp_mult': 1.9818968062996087, 'bull_tsl_mult': 0.1137222627128941, 'bull_time_stop': 179, 'bull_use_sma': False, 'bull_use_ema': False, 'bull_use_atr': True, 'bull_use_adx': True, 'bull_use_spike': True, 'bull_rsi_required': True, 'bear_strategy': 'breakout', 'bear_bb_std_mult': 2.4854145849692224, 'bear_rsi_os': 52, 'bear_rsi_ob': 88, 'bear_adx_thresh': 19.026439335467366, 'bear_atr_min_pct': 0.018624540014454606, 'bear_atr_max_pct': 0.07911982790696409, 'bear_tp_mult': 2.6728529052517738, 'bear_tsl_mult': 0.7077998058562526, 'bear_time_stop': 147, 'bear_use_sma': True, 'bear_use_ema': True, 'bear_use_atr': False, 'bear_use_adx': True, 'bear_use_spike': False, 'bear_rsi_required': True, 'sideways_strategy': 'breakout', 'sideways_bb_std_mult': 1.3540191276906168, 'sideways_rsi_os': 48, 'sideways_rsi_ob': 76, 'sideways_adx_thresh': 21.02849465835278, 'sideways_atr_min_pct': 0.01593354706421553, 'sideways_atr_max_pct': 0.03353717437019818, 'sideways_tp_mult': 2.2647753364194294, 'sideways_tsl_mult': 0.1734998154334429, 'sideways_time_stop': 157, 'sideways_use_sma': False, 'sideways_use_ema': True, 'sideways_use_atr': False, 'sideways_use_adx': False, 'sideways_use_spike': True, 'sideways_rsi_required': True}.
[I 2025-08-30 19:31:03,863] Trial 544 finished with values: [-1000000000.0, 1000000000.0] and parameters: {'p_sma': 49, 'p_std': 44, 'p_atr': 12, 'p_adx': 21, 'rsi_period': 37, 'ema1': 27, 'ema2': 34, 'slip_atr_k': 0.07944849274625111, 'slip_spread_k': 0.3869459977385479, 'spread_hl_frac': 0.002597719079111247, 'bb_std_mult': 2.510346084691868, 'rsi_os': 6, 'rsi_ob': 86, 'vol_spike': 0.16111620314771102, 'adx_thresh': 34.01513510310375, 'atr_min_pct': 0.011154608356126762, 'atr_max_pct': 0.09961347024335063, 'tp_mult': 2.3154165488891416, 'tsl_mult': 0.6670963716967964, 'strategy': 'mean_reversion', 'time_stop': 187, 'use_sma': False, 'use_atr': True, 'use_adx': True, 'use_ema': False, 'use_spike': True, 'rsi_required': False, 'edge_k': 0.12182306516328263, 'edge_cap': 0.5164292555750505, 'bull_strategy': 'mean_reversion', 'bull_bb_std_mult': 3.156556695489745, 'bull_rsi_os': 29, 'bull_rsi_ob': 50, 'bull_adx_thresh': 26.699719624365773, 'bull_atr_min_pct': 0.023164015910682692, 'bull_atr_max_pct': 0.12105157089643118, 'bull_tp_mult': 2.6296159745494516, 'bull_tsl_mult': 0.5838571263626228, 'bull_time_stop': 130, 'bull_use_sma': False, 'bull_use_ema': True, 'bull_use_atr': False, 'bull_use_adx': False, 'bull_use_spike': False, 'bull_rsi_required': True, 'bear_strategy': 'breakout', 'bear_bb_std_mult': 1.905562726443747, 'bear_rsi_os': 50, 'bear_rsi_ob': 75, 'bear_adx_thresh': 30.782814920020925, 'bear_atr_min_pct': 0.014943876627719448, 'bear_atr_max_pct': 0.11072643815389009, 'bear_tp_mult': 1.9285473593927291, 'bear_tsl_mult': 0.09596120945412928, 'bear_time_stop': 228, 'bear_use_sma': True, 'bear_use_ema': True, 'bear_use_atr': False, 'bear_use_adx': False, 'bear_use_spike': False, 'bear_rsi_required': True, 'sideways_strategy': 'breakout', 'sideways_bb_std_mult': 3.0965893993238653, 'sideways_rsi_os': 43, 'sideways_rsi_ob': 90, 'sideways_adx_thresh': 21.075352537305154, 'sideways_atr_min_pct': 0.015849958845082588, 'sideways_atr_max_pct': 0.043676599087572314, 'sideways_tp_mult': 2.728769537862625, 'sideways_tsl_mult': 0.9567543812470666, 'sideways_time_stop': 78, 'sideways_use_sma': False, 'sideways_use_ema': True, 'sideways_use_atr': False, 'sideways_use_adx': False, 'sideways_use_spike': False, 'sideways_rsi_required': False}.
[I 2025-08-30 19:31:20,151] Trial 545 finished with values: [-1000000000.0, 1000000000.0] and parameters: {'p_sma': 10, 'p_std': 30, 'p_atr': 11, 'p_adx': 21, 'rsi_period': 7, 'ema1': 9, 'ema2': 57, 'slip_atr_k': 0.05524950280449452, 'slip_spread_k': 0.09801947418892482, 'spread_hl_frac': 0.022231176860572636, 'bb_std_mult': 2.261905747530687, 'rsi_os': 48, 'rsi_ob': 86, 'vol_spike': 0.2616414330884346, 'adx_thresh': 34.055365379422916, 'atr_min_pct': 0.019303848211518017, 'atr_max_pct': 0.09926349824665406, 'tp_mult': 2.8680141662757417, 'tsl_mult': 0.9179789474550253, 'strategy': 'breakout', 'time_stop': 255, 'use_sma': False, 'use_atr': True, 'use_adx': False, 'use_ema': False, 'use_spike': True, 'rsi_required': True, 'edge_k': 0.11819181448619186, 'edge_cap': 0.5358977083583497, 'bull_strategy': 'mean_reversion', 'bull_bb_std_mult': 3.0109541631438184, 'bull_rsi_os': 29, 'bull_rsi_ob': 46, 'bull_adx_thresh': 19.67984107461399, 'bull_atr_min_pct': 0.002164450176356401, 'bull_atr_max_pct': 0.07015318880453351, 'bull_tp_mult': 2.6382055175009755, 'bull_tsl_mult': 0.5493414648044517, 'bull_time_stop': 239, 'bull_use_sma': False, 'bull_use_ema': True, 'bull_use_atr': False, 'bull_use_adx': False, 'bull_use_spike': False, 'bull_rsi_required': True, 'bear_strategy': 'mean_reversion', 'bear_bb_std_mult': 3.347107604051826, 'bear_rsi_os': 50, 'bear_rsi_ob': 92, 'bear_adx_thresh': 31.4357055061216, 'bear_atr_min_pct': 0.020116620517208084, 'bear_atr_max_pct': 0.02957606547075929, 'bear_tp_mult': 2.41178087366011, 'bear_tsl_mult': 0.5732021181228315, 'bear_time_stop': 81, 'bear_use_sma': True, 'bear_use_ema': True, 'bear_use_atr': False, 'bear_use_adx': True, 'bear_use_spike': False, 'bear_rsi_required': True, 'sideways_strategy': 'breakout', 'sideways_bb_std_mult': 3.1147689019412703, 'sideways_rsi_os': 21, 'sideways_rsi_ob': 57, 'sideways_adx_thresh': 21.287212742743787, 'sideways_atr_min_pct': 0.015900708316980563, 'sideways_atr_max_pct': 0.039766374700293955, 'sideways_tp_mult': 2.4401011412036877, 'sideways_tsl_mult': 0.8514833703096851, 'sideways_time_stop': 141, 'sideways_use_sma': False, 'sideways_use_ema': True, 'sideways_use_atr': False, 'sideways_use_adx': False, 'sideways_use_spike': True, 'sideways_rsi_required': False}.
[I 2025-08-30 19:31:27,089] Trial 546 finished with values: [-1000000000.0, 1000000000.0] and parameters: {'p_sma': 48, 'p_std': 30, 'p_atr': 12, 'p_adx': 14, 'rsi_period': 35, 'ema1': 8, 'ema2': 33, 'slip_atr_k': 0.056546453902176844, 'slip_spread_k': 0.9227113962240238, 'spread_hl_frac': 0.02189485812735079, 'bb_std_mult': 1.2061089131324727, 'rsi_os': 37, 'rsi_ob': 82, 'vol_spike': 0.12878485511337068, 'adx_thresh': 34.07071982671398, 'atr_min_pct': 0.02325695262450317, 'atr_max_pct': 0.09159296162043803, 'tp_mult': 1.962144333667684, 'tsl_mult': 0.9126225926949991, 'strategy': 'mean_reversion', 'time_stop': 32, 'use_sma': False, 'use_atr': True, 'use_adx': False, 'use_ema': False, 'use_spike': True, 'rsi_required': False, 'edge_k': 0.13058021622226818, 'edge_cap': 0.5443978999931793, 'bull_strategy': 'mean_reversion', 'bull_bb_std_mult': 3.0095120168801994, 'bull_rsi_os': 33, 'bull_rsi_ob': 82, 'bull_adx_thresh': 17.419427496634846, 'bull_atr_min_pct': 0.02298912809150406, 'bull_atr_max_pct': 0.06871016439281812, 'bull_tp_mult': 2.6631881605045833, 'bull_tsl_mult': 0.5771558759124598, 'bull_time_stop': 131, 'bull_use_sma': False, 'bull_use_ema': True, 'bull_use_atr': False, 'bull_use_adx': False, 'bull_use_spike': True, 'bull_rsi_required': True, 'bear_strategy': 'mean_reversion', 'bear_bb_std_mult': 2.783136602751497, 'bear_rsi_os': 50, 'bear_rsi_ob': 77, 'bear_adx_thresh': 16.600604714401257, 'bear_atr_min_pct': 0.022853059447382217, 'bear_atr_max_pct': 0.03337900334098409, 'bear_tp_mult': 2.679992706113812, 'bear_tsl_mult': 0.44302148432571825, 'bear_time_stop': 216, 'bear_use_sma': True, 'bear_use_ema': True, 'bear_use_atr': False, 'bear_use_adx': False, 'bear_use_spike': False, 'bear_rsi_required': True, 'sideways_strategy': 'breakout', 'sideways_bb_std_mult': 3.285870350635003, 'sideways_rsi_os': 48, 'sideways_rsi_ob': 57, 'sideways_adx_thresh': 20.762748120507695, 'sideways_atr_min_pct': 0.018656224880530675, 'sideways_atr_max_pct': 0.13436087679967068, 'sideways_tp_mult': 1.2910882813222448, 'sideways_tsl_mult': 0.5761947686474331, 'sideways_time_stop': 142, 'sideways_use_sma': True, 'sideways_use_ema': True, 'sideways_use_atr': True, 'sideways_use_adx': False, 'sideways_use_spike': True, 'sideways_rsi_required': False}.
[I 2025-08-30 19:31:32,392] Trial 547 finished with values: [-1000000000.0, 1000000000.0] and parameters: {'p_sma': 9, 'p_std': 30, 'p_atr': 10, 'p_adx': 21, 'rsi_period': 25, 'ema1': 26, 'ema2': 35, 'slip_atr_k': 0.05568089706423619, 'slip_spread_k': 0.18232257827531154, 'spread_hl_frac': 0.03147195440157335, 'bb_std_mult': 0.9449202255056592, 'rsi_os': 48, 'rsi_ob': 82, 'vol_spike': 0.1437523320058843, 'adx_thresh': 34.592614585445055, 'atr_min_pct': 0.01021146470836634, 'atr_max_pct': 0.01560556269215041, 'tp_mult': 2.032240008182305, 'tsl_mult': 0.6511494815977943, 'strategy': 'mean_reversion', 'time_stop': 255, 'use_sma': False, 'use_atr': True, 'use_adx': False, 'use_ema': False, 'use_spike': True, 'rsi_required': False, 'edge_k': 1.1016060038455744, 'edge_cap': 0.488064801644837, 'bull_strategy': 'mean_reversion', 'bull_bb_std_mult': 3.003257076833214, 'bull_rsi_os': 33, 'bull_rsi_ob': 45, 'bull_adx_thresh': 26.440700209326764, 'bull_atr_min_pct': 0.022980643816404106, 'bull_atr_max_pct': 0.13452021915630355, 'bull_tp_mult': 2.6414163597565943, 'bull_tsl_mult': 0.582245916344737, 'bull_time_stop': 131, 'bull_use_sma': False, 'bull_use_ema': True, 'bull_use_atr': False, 'bull_use_adx': False, 'bull_use_spike': False, 'bull_rsi_required': True, 'bear_strategy': 'mean_reversion', 'bear_bb_std_mult': 2.9937565522552356, 'bear_rsi_os': 50, 'bear_rsi_ob': 94, 'bear_adx_thresh': 16.189000277180053, 'bear_atr_min_pct': 0.02318411464409861, 'bear_atr_max_pct': 0.029448509071758798, 'bear_tp_mult': 1.5411874982585285, 'bear_tsl_mult': 0.10388365614397821, 'bear_time_stop': 213, 'bear_use_sma': True, 'bear_use_ema': True, 'bear_use_atr': False, 'bear_use_adx': False, 'bear_use_spike': True, 'bear_rsi_required': True, 'sideways_strategy': 'breakout', 'sideways_bb_std_mult': 3.101252222093175, 'sideways_rsi_os': 36, 'sideways_rsi_ob': 57, 'sideways_adx_thresh': 17.646451280771675, 'sideways_atr_min_pct': 0.023154024611680223, 'sideways_atr_max_pct': 0.06746705077764928, 'sideways_tp_mult': 1.01035694252111, 'sideways_tsl_mult': 0.5773613589932873, 'sideways_time_stop': 142, 'sideways_use_sma': True, 'sideways_use_ema': True, 'sideways_use_atr': True, 'sideways_use_adx': False, 'sideways_use_spike': False, 'sideways_rsi_required': False}.
[I 2025-08-30 19:31:38,075] Trial 548 finished with values: [-1000000000.0, 1000000000.0] and parameters: {'p_sma': 8, 'p_std': 30, 'p_atr': 21, 'p_adx': 20, 'rsi_period': 18, 'ema1': 11, 'ema2': 33, 'slip_atr_k': 0.056524077575595744, 'slip_spread_k': 0.18468895695930054, 'spread_hl_frac': 0.023559043673840752, 'bb_std_mult': 2.2224183874912193, 'rsi_os': 37, 'rsi_ob': 94, 'vol_spike': 0.26425043070586096, 'adx_thresh': 32.16408587935577, 'atr_min_pct': 0.023214583023741523, 'atr_max_pct': 0.09145755652578699, 'tp_mult': 2.372720801834523, 'tsl_mult': 0.9079516341220619, 'strategy': 'mean_reversion', 'time_stop': 33, 'use_sma': False, 'use_atr': True, 'use_adx': False, 'use_ema': False, 'use_spike': True, 'rsi_required': False, 'edge_k': 1.2039424083712493, 'edge_cap': 0.5436582358519232, 'bull_strategy': 'mean_reversion', 'bull_bb_std_mult': 1.1844598381397042, 'bull_rsi_os': 33, 'bull_rsi_ob': 82, 'bull_adx_thresh': 19.805880473393337, 'bull_atr_min_pct': 0.0015934433894110311, 'bull_atr_max_pct': 0.042377051100888304, 'bull_tp_mult': 2.6612208109890427, 'bull_tsl_mult': 0.2798755524994023, 'bull_time_stop': 187, 'bull_use_sma': False, 'bull_use_ema': True, 'bull_use_atr': False, 'bull_use_adx': False, 'bull_use_spike': False, 'bull_rsi_required': True, 'bear_strategy': 'mean_reversion', 'bear_bb_std_mult': 2.2945459353045825, 'bear_rsi_os': 23, 'bear_rsi_ob': 77, 'bear_adx_thresh': 16.586320942029786, 'bear_atr_min_pct': 0.01426623753440488, 'bear_atr_max_pct': 0.033386860415906744, 'bear_tp_mult': 1.552434313979977, 'bear_tsl_mult': 0.5151656493799909, 'bear_time_stop': 212, 'bear_use_sma': True, 'bear_use_ema': True, 'bear_use_atr': False, 'bear_use_adx': False, 'bear_use_spike': True, 'bear_rsi_required': True, 'sideways_strategy': 'breakout', 'sideways_bb_std_mult': 3.289863303515533, 'sideways_rsi_os': 36, 'sideways_rsi_ob': 57, 'sideways_adx_thresh': 22.40676262196288, 'sideways_atr_min_pct': 0.02127665599843885, 'sideways_atr_max_pct': 0.13424294250755833, 'sideways_tp_mult': 1.053763059586541, 'sideways_tsl_mult': 0.9794439572171135, 'sideways_time_stop': 140, 'sideways_use_sma': True, 'sideways_use_ema': True, 'sideways_use_atr': True, 'sideways_use_adx': False, 'sideways_use_spike': False, 'sideways_rsi_required': False}.
