[I 2025-08-30 18:35:10,417] Trial 53 finished with values: [-1000000000.0, 1000000000.0] and parameters: {'p_sma': 39, 'p_std': 30, 'p_atr': 16, 'p_adx': 26, 'rsi_period': 38, 'ema1': 17, 'ema2': 25, 'slip_atr_k': 0.12857211700813936, 'slip_spread_k': 0.8945026451299498, 'spread_hl_frac': 0.032363430050919136, 'bb_std_mult': 3.213120779800996, 'rsi_os': 16, 'rsi_ob': 81, 'vol_spike': 0.09014649058545325, 'adx_thresh': 24.850183685800275, 'atr_min_pct': 0.020466670792213267, 'atr_max_pct': 0.045933493069867055, 'tp_mult': 1.9688078799748474, 'tsl_mult': 0.6379473837648058, 'strategy': 'breakout', 'time_stop': 242, 'use_sma': False, 'use_atr': True, 'use_adx': False, 'use_ema': True, 'use_spike': True, 'rsi_required': False, 'edge_k': 1.4415093851580494, 'edge_cap': 0.44958808951346263, 'bull_strategy': 'mean_reversion', 'bull_bb_std_mult': 1.5866681808234493, 'bull_rsi_os': 49, 'bull_rsi_ob': 83, 'bull_adx_thresh': 12.724649532365634, 'bull_atr_min_pct': 0.019298304608434985, 'bull_atr_max_pct': 0.13783005066386472, 'bull_tp_mult': 1.3589003710829775, 'bull_tsl_mult': 0.720811118880595, 'bull_time_stop': 11, 'bull_use_sma': True, 'bull_use_ema': False, 'bull_use_atr': True, 'bull_use_adx': False, 'bull_use_spike': False, 'bull_rsi_required': True, 'bear_strategy': 'breakout', 'bear_bb_std_mult': 2.068386010602261, 'bear_rsi_os': 32, 'bear_rsi_ob': 51, 'bear_adx_thresh': 22.237554701547353, 'bear_atr_min_pct': 0.001493166806647899, 'bear_atr_max_pct': 0.14108329697223945, 'bear_tp_mult': 2.727403318723436, 'bear_tsl_mult': 0.17676339044363448, 'bear_time_stop': 181, 'bear_use_sma': True, 'bear_use_ema': True, 'bear_use_atr': True, 'bear_use_adx': True, 'bear_use_spike': False, 'bear_rsi_required': False, 'sideways_strategy': 'mean_reversion', 'sideways_bb_std_mult': 1.742026608978632, 'sideways_rsi_os': 21, 'sideways_rsi_ob': 77, 'sideways_adx_thresh': 28.020215569068107, 'sideways_atr_min_pct': 1.6912266542030638e-05, 'sideways_atr_max_pct': 0.04873089235178224, 'sideways_tp_mult': 2.5630112545476216, 'sideways_tsl_mult': 0.1342639839084071, 'sideways_time_stop': 274, 'sideways_use_sma': False, 'sideways_use_ema': True, 'sideways_use_atr': True, 'sideways_use_adx': False, 'sideways_use_spike': False, 'sideways_rsi_required': False}.
[I 2025-08-30 18:35:10,693] Trial 54 finished with values: [-0.06606684979420152, 0.0660052890100579] and parameters: {'p_sma': 25, 'p_std': 30, 'p_atr': 16, 'p_adx': 20, 'rsi_period': 28, 'ema1': 19, 'ema2': 26, 'slip_atr_k': 0.1322755149022896, 'slip_spread_k': 0.6530200232069553, 'spread_hl_frac': 0.03263362041167049, 'bb_std_mult': 0.6593199329110716, 'rsi_os': 43, 'rsi_ob': 50, 'vol_spike': 0.28999377701596046, 'adx_thresh': 24.675443732947425, 'atr_min_pct': 0.004952914321142684, 'atr_max_pct': 0.042322655986872224, 'tp_mult': 2.3176199905747694, 'tsl_mult': 0.6322607889245957, 'strategy': 'breakout', 'time_stop': 240, 'use_sma': False, 'use_atr': True, 'use_adx': True, 'use_ema': True, 'use_spike': True, 'rsi_required': False, 'edge_k': 1.44407377138593, 'edge_cap': 0.4739462576434202, 'bull_strategy': 'mean_reversion', 'bull_bb_std_mult': 3.0117207057142354, 'bull_rsi_os': 49, 'bull_rsi_ob': 55, 'bull_adx_thresh': 12.181382377629072, 'bull_atr_min_pct': 0.019951350255381046, 'bull_atr_max_pct': 0.13542623631232667, 'bull_tp_mult': 1.14911871210071, 'bull_tsl_mult': 0.9131679211120562, 'bull_time_stop': 11, 'bull_use_sma': False, 'bull_use_ema': False, 'bull_use_atr': True, 'bull_use_adx': False, 'bull_use_spike': False, 'bull_rsi_required': True, 'bear_strategy': 'breakout', 'bear_bb_std_mult': 1.0572197778685615, 'bear_rsi_os': 44, 'bear_rsi_ob': 90, 'bear_adx_thresh': 22.07140379267858, 'bear_atr_min_pct': 9.800861160152774e-05, 'bear_atr_max_pct': 0.14006873337509557, 'bear_tp_mult': 2.6957471375485853, 'bear_tsl_mult': 0.1956569368841452, 'bear_time_stop': 177, 'bear_use_sma': True, 'bear_use_ema': True, 'bear_use_atr': True, 'bear_use_adx': True, 'bear_use_spike': False, 'bear_rsi_required': False, 'sideways_strategy': 'mean_reversion', 'sideways_bb_std_mult': 2.1593877575791702, 'sideways_rsi_os': 21, 'sideways_rsi_ob': 83, 'sideways_adx_thresh': 34.33447438918703, 'sideways_atr_min_pct': 0.012179473666707285, 'sideways_atr_max_pct': 0.04675359126153811, 'sideways_tp_mult': 1.2351240674069197, 'sideways_tsl_mult': 0.6648003106220315, 'sideways_time_stop': 38, 'sideways_use_sma': False, 'sideways_use_ema': True, 'sideways_use_atr': True, 'sideways_use_adx': False, 'sideways_use_spike': False, 'sideways_rsi_required': False}.
[I 2025-08-30 18:35:11,019] Trial 56 finished with values: [-0.043773366028854066, 0.0438293651763629] and parameters: {'p_sma': 24, 'p_std': 30, 'p_atr': 16, 'p_adx': 21, 'rsi_period': 28, 'ema1': 23, 'ema2': 26, 'slip_atr_k': 0.1039193048111429, 'slip_spread_k': 0.8509031641027779, 'spread_hl_frac': 0.027446586212555225, 'bb_std_mult': 1.323194847509062, 'rsi_os': 51, 'rsi_ob': 49, 'vol_spike': 0.09555133282153358, 'adx_thresh': 23.73937582772558, 'atr_min_pct': 0.027196756128201716, 'atr_max_pct': 0.06511885007103793, 'tp_mult': 2.253212033061749, 'tsl_mult': 0.7315099551816077, 'strategy': 'breakout', 'time_stop': 237, 'use_sma': False, 'use_atr': True, 'use_adx': True, 'use_ema': True, 'use_spike': True, 'rsi_required': False, 'edge_k': 0.19385506972310917, 'edge_cap': 0.3642129411072549, 'bull_strategy': 'mean_reversion', 'bull_bb_std_mult': 1.5780286771168355, 'bull_rsi_os': 25, 'bull_rsi_ob': 50, 'bull_adx_thresh': 15.41140524865793, 'bull_atr_min_pct': 0.024306995652381973, 'bull_atr_max_pct': 0.1412799539720878, 'bull_tp_mult': 2.3619568512761013, 'bull_tsl_mult': 0.6786390803782386, 'bull_time_stop': 197, 'bull_use_sma': False, 'bull_use_ema': False, 'bull_use_atr': True, 'bull_use_adx': False, 'bull_use_spike': False, 'bull_rsi_required': True, 'bear_strategy': 'breakout', 'bear_bb_std_mult': 3.294155432230557, 'bear_rsi_os': 36, 'bear_rsi_ob': 66, 'bear_adx_thresh': 18.76597233067476, 'bear_atr_min_pct': 0.0010015313707779356, 'bear_atr_max_pct': 0.036910127339799655, 'bear_tp_mult': 2.787651515277361, 'bear_tsl_mult': 0.7297933804422774, 'bear_time_stop': 182, 'bear_use_sma': True, 'bear_use_ema': True, 'bear_use_atr': True, 'bear_use_adx': True, 'bear_use_spike': False, 'bear_rsi_required': False, 'sideways_strategy': 'breakout', 'sideways_bb_std_mult': 3.305496829455491, 'sideways_rsi_os': 21, 'sideways_rsi_ob': 82, 'sideways_adx_thresh': 33.84797784525551, 'sideways_atr_min_pct': 0.00015444754400122454, 'sideways_atr_max_pct': 0.14983946292161, 'sideways_tp_mult': 1.149704406441215, 'sideways_tsl_mult': 0.9995655828210357, 'sideways_time_stop': 256, 'sideways_use_sma': False, 'sideways_use_ema': True, 'sideways_use_atr': True, 'sideways_use_adx': False, 'sideways_use_spike': True, 'sideways_rsi_required': False}.
[I 2025-08-30 18:35:45,304] Trial 59 finished with values: [-1000000000.0, 1000000000.0] and parameters: {'p_sma': 24, 'p_std': 56, 'p_atr': 22, 'p_adx': 21, 'rsi_period': 80, 'ema1': 23, 'ema2': 22, 'slip_atr_k': 0.19888448999303465, 'slip_spread_k': 0.5692867271740092, 'spread_hl_frac': 0.035655731201580915, 'bb_std_mult': 0.9190029947382062, 'rsi_os': 55, 'rsi_ob': 48, 'vol_spike': 0.1205875046494656, 'adx_thresh': 8.623872132177905, 'atr_min_pct': 0.0008020772210097576, 'atr_max_pct': 0.0674321348574938, 'tp_mult': 1.1683267720960644, 'tsl_mult': 0.7659749046562991, 'strategy': 'breakout', 'time_stop': 276, 'use_sma': False, 'use_atr': True, 'use_adx': True, 'use_ema': True, 'use_spike': True, 'rsi_required': True, 'edge_k': 0.8204333629664626, 'edge_cap': 0.32877527765272596, 'bull_strategy': 'mean_reversion', 'bull_bb_std_mult': 2.5216264225431444, 'bull_rsi_os': 16, 'bull_rsi_ob': 50, 'bull_adx_thresh': 15.944330311217177, 'bull_atr_min_pct': 0.00472583208156219, 'bull_atr_max_pct': 0.07982786718135763, 'bull_tp_mult': 1.14169501779581, 'bull_tsl_mult': 0.0512153846170883, 'bull_time_stop': 187, 'bull_use_sma': False, 'bull_use_ema': False, 'bull_use_atr': True, 'bull_use_adx': False, 'bull_use_spike': False, 'bull_rsi_required': True, 'bear_strategy': 'breakout', 'bear_bb_std_mult': 1.6466222347353336, 'bear_rsi_os': 37, 'bear_rsi_ob': 55, 'bear_adx_thresh': 19.121436027717845, 'bear_atr_min_pct': 2.175364610285807e-05, 'bear_atr_max_pct': 0.06306680122950614, 'bear_tp_mult': 2.8347368682513547, 'bear_tsl_mult': 0.8447886781313225, 'bear_time_stop': 96, 'bear_use_sma': True, 'bear_use_ema': False, 'bear_use_atr': True, 'bear_use_adx': True, 'bear_use_spike': False, 'bear_rsi_required': False, 'sideways_strategy': 'mean_reversion', 'sideways_bb_std_mult': 2.7465086494265374, 'sideways_rsi_os': 8, 'sideways_rsi_ob': 87, 'sideways_adx_thresh': 34.89365266564334, 'sideways_atr_min_pct': 0.0013473051108108518, 'sideways_atr_max_pct': 0.03453024338204626, 'sideways_tp_mult': 1.6392834731268222, 'sideways_tsl_mult': 0.6517910387190593, 'sideways_time_stop': 9, 'sideways_use_sma': False, 'sideways_use_ema': True, 'sideways_use_atr': False, 'sideways_use_adx': False, 'sideways_use_spike': True, 'sideways_rsi_required': False}.
[I 2025-08-30 18:35:45,533] Trial 57 finished with values: [-1000000000.0, 1000000000.0] and parameters: {'p_sma': 24, 'p_std': 30, 'p_atr': 22, 'p_adx': 12, 'rsi_period': 64, 'ema1': 17, 'ema2': 23, 'slip_atr_k': 0.19984464154200277, 'slip_spread_k': 0.8872152232648831, 'spread_hl_frac': 0.02251082129363581, 'bb_std_mult': 1.3380366120844118, 'rsi_os': 19, 'rsi_ob': 48, 'vol_spike': 0.08544406299860768, 'adx_thresh': 8.068138935485337, 'atr_min_pct': 0.004972487421199499, 'atr_max_pct': 0.05570027655975552, 'tp_mult': 1.2939725613047635, 'tsl_mult': 0.7357506271540968, 'strategy': 'breakout', 'time_stop': 237, 'use_sma': False, 'use_atr': True, 'use_adx': True, 'use_ema': True, 'use_spike': True, 'rsi_required': True, 'edge_k': 0.32585098675848756, 'edge_cap': 0.33857890527675294, 'bull_strategy': 'mean_reversion', 'bull_bb_std_mult': 2.5557744658480903, 'bull_rsi_os': 48, 'bull_rsi_ob': 50, 'bull_adx_thresh': 16.11273477023904, 'bull_atr_min_pct': 0.023748224391373585, 'bull_atr_max_pct': 0.03967100825106344, 'bull_tp_mult': 1.3398715135780823, 'bull_tsl_mult': 0.1421252071102071, 'bull_time_stop': 189, 'bull_use_sma': True, 'bull_use_ema': False, 'bull_use_atr': True, 'bull_use_adx': False, 'bull_use_spike': False, 'bull_rsi_required': True, 'bear_strategy': 'breakout', 'bear_bb_std_mult': 3.1176817357288438, 'bear_rsi_os': 15, 'bear_rsi_ob': 66, 'bear_adx_thresh': 28.031433941630706, 'bear_atr_min_pct': 0.0005415441093974162, 'bear_atr_max_pct': 0.1279639077844025, 'bear_tp_mult': 1.793019725586148, 'bear_tsl_mult': 0.7466645455443766, 'bear_time_stop': 191, 'bear_use_sma': True, 'bear_use_ema': False, 'bear_use_atr': True, 'bear_use_adx': True, 'bear_use_spike': False, 'bear_rsi_required': False, 'sideways_strategy': 'mean_reversion', 'sideways_bb_std_mult': 1.630642523861621, 'sideways_rsi_os': 55, 'sideways_rsi_ob': 80, 'sideways_adx_thresh': 27.951709843852687, 'sideways_atr_min_pct': 0.0018403642555917341, 'sideways_atr_max_pct': 0.1495585781898507, 'sideways_tp_mult': 1.615191637708031, 'sideways_tsl_mult': 0.680067268744668, 'sideways_time_stop': 227, 'sideways_use_sma': False, 'sideways_use_ema': True, 'sideways_use_atr': False, 'sideways_use_adx': False, 'sideways_use_spike': True, 'sideways_rsi_required': False}.
[I 2025-08-30 18:35:45,698] Trial 58 finished with values: [-1000000000.0, 1000000000.0] and parameters: {'p_sma': 23, 'p_std': 25, 'p_atr': 22, 'p_adx': 21, 'rsi_period': 63, 'ema1': 25, 'ema2': 22, 'slip_atr_k': 0.20182074504553452, 'slip_spread_k': 0.7227909820012318, 'spread_hl_frac': 0.027982655559060432, 'bb_std_mult': 1.382726297363867, 'rsi_os': 55, 'rsi_ob': 48, 'vol_spike': 0.13312545391669112, 'adx_thresh': 9.204395850785339, 'atr_min_pct': 0.01743516912311692, 'atr_max_pct': 0.05500416439494102, 'tp_mult': 1.4157681807257447, 'tsl_mult': 0.7527983092778108, 'strategy': 'breakout', 'time_stop': 279, 'use_sma': False, 'use_atr': True, 'use_adx': True, 'use_ema': True, 'use_spike': True, 'rsi_required': True, 'edge_k': 0.8047286203270718, 'edge_cap': 0.33457094083408173, 'bull_strategy': 'mean_reversion', 'bull_bb_std_mult': 1.303945195376101, 'bull_rsi_os': 7, 'bull_rsi_ob': 50, 'bull_adx_thresh': 15.816203726103735, 'bull_atr_min_pct': 0.023860261927476253, 'bull_atr_max_pct': 0.053828229923156085, 'bull_tp_mult': 1.150184165354697, 'bull_tsl_mult': 0.44585410740757875, 'bull_time_stop': 190, 'bull_use_sma': False, 'bull_use_ema': False, 'bull_use_atr': True, 'bull_use_adx': False, 'bull_use_spike': False, 'bull_rsi_required': True, 'bear_strategy': 'breakout', 'bear_bb_std_mult': 1.6552864859116796, 'bear_rsi_os': 9, 'bear_rsi_ob': 66, 'bear_adx_thresh': 18.969542387217963, 'bear_atr_min_pct': 0.0002622542347053199, 'bear_atr_max_pct': 0.05979993987544152, 'bear_tp_mult': 1.3921429159454761, 'bear_tsl_mult': 0.7407258099346912, 'bear_time_stop': 193, 'bear_use_sma': True, 'bear_use_ema': False, 'bear_use_atr': True, 'bear_use_adx': True, 'bear_use_spike': False, 'bear_rsi_required': False, 'sideways_strategy': 'mean_reversion', 'sideways_bb_std_mult': 3.2016379765784175, 'sideways_rsi_os': 14, 'sideways_rsi_ob': 81, 'sideways_adx_thresh': 33.72598272903969, 'sideways_atr_min_pct': 0.029966966371572316, 'sideways_atr_max_pct': 0.14970653352035168, 'sideways_tp_mult': 1.1899439899454056, 'sideways_tsl_mult': 0.46235738973036306, 'sideways_time_stop': 36, 'sideways_use_sma': False, 'sideways_use_ema': True, 'sideways_use_atr': False, 'sideways_use_adx': False, 'sideways_use_spike': True, 'sideways_rsi_required': False}.
[I 2025-08-30 18:35:45,908] Trial 60 finished with values: [-1000000000.0, 1000000000.0] and parameters: {'p_sma': 10, 'p_std': 25, 'p_atr': 13, 'p_adx': 23, 'rsi_period': 80, 'ema1': 23, 'ema2': 22, 'slip_atr_k': 0.07400699225059708, 'slip_spread_k': 0.8418334701693523, 'spread_hl_frac': 0.022943748580525645, 'bb_std_mult': 1.6776317120357662, 'rsi_os': 55, 'rsi_ob': 50, 'vol_spike': 0.09837022057187489, 'adx_thresh': 7.4720079168431965, 'atr_min_pct': 0.026643339104650644, 'atr_max_pct': 0.0669495284895205, 'tp_mult': 1.4493911465113727, 'tsl_mult': 0.8854681157878503, 'strategy': 'breakout', 'time_stop': 279, 'use_sma': False, 'use_atr': True, 'use_adx': True, 'use_ema': True, 'use_spike': True, 'rsi_required': True, 'edge_k': 0.1813045817020282, 'edge_cap': 0.36980918360024073, 'bull_strategy': 'mean_reversion', 'bull_bb_std_mult': 2.434776498139385, 'bull_rsi_os': 25, 'bull_rsi_ob': 50, 'bull_adx_thresh': 16.096648739226772, 'bull_atr_min_pct': 0.025094837521487775, 'bull_atr_max_pct': 0.14111186784619179, 'bull_tp_mult': 2.327320600764326, 'bull_tsl_mult': 0.7762573001585393, 'bull_time_stop': 187, 'bull_use_sma': False, 'bull_use_ema': False, 'bull_use_atr': True, 'bull_use_adx': False, 'bull_use_spike': False, 'bull_rsi_required': True, 'bear_strategy': 'breakout', 'bear_bb_std_mult': 3.1452404129878007, 'bear_rsi_os': 36, 'bear_rsi_ob': 66, 'bear_adx_thresh': 19.48060946462401, 'bear_atr_min_pct': 0.0006323526480073357, 'bear_atr_max_pct': 0.012112644811290364, 'bear_tp_mult': 2.8287730598155947, 'bear_tsl_mult': 0.7279073965020991, 'bear_time_stop': 196, 'bear_use_sma': True, 'bear_use_ema': False, 'bear_use_atr': True, 'bear_use_adx': True, 'bear_use_spike': False, 'bear_rsi_required': False, 'sideways_strategy': 'breakout', 'sideways_bb_std_mult': 2.728982902567258, 'sideways_rsi_os': 22, 'sideways_rsi_ob': 81, 'sideways_adx_thresh': 33.39572633858785, 'sideways_atr_min_pct': 0.002461769578687047, 'sideways_atr_max_pct': 0.14985188457465, 'sideways_tp_mult': 1.135475738935596, 'sideways_tsl_mult': 0.9273622052845942, 'sideways_time_stop': 253, 'sideways_use_sma': False, 'sideways_use_ema': True, 'sideways_use_atr': True, 'sideways_use_adx': False, 'sideways_use_spike': True, 'sideways_rsi_required': False}.
[I 2025-08-30 18:36:19,169] Trial 63 finished with values: [-1000000000.0, 1000000000.0] and parameters: {'p_sma': 12, 'p_std': 34, 'p_atr': 14, 'p_adx': 23, 'rsi_period': 15, 'ema1': 28, 'ema2': 27, 'slip_atr_k': 0.07831381253832045, 'slip_spread_k': 0.8611309124189, 'spread_hl_frac': 0.020402512093629543, 'bb_std_mult': 1.7048440874544906, 'rsi_os': 51, 'rsi_ob': 54, 'vol_spike': 0.05095795787952069, 'adx_thresh': 23.14306661106406, 'atr_min_pct': 0.02708291280696014, 'atr_max_pct': 0.062091954433404394, 'tp_mult': 2.2913540443780267, 'tsl_mult': 0.8503155531510004, 'strategy': 'breakout', 'time_stop': 251, 'use_sma': True, 'use_atr': True, 'use_adx': True, 'use_ema': False, 'use_spike': True, 'rsi_required': False, 'edge_k': 0.27261236308408476, 'edge_cap': 0.5381179220239318, 'bull_strategy': 'mean_reversion', 'bull_bb_std_mult': 1.95838871613353, 'bull_rsi_os': 25, 'bull_rsi_ob': 56, 'bull_adx_thresh': 13.499059631797085, 'bull_atr_min_pct': 0.026418993727184176, 'bull_atr_max_pct': 0.1390956659942325, 'bull_tp_mult': 2.388058720921794, 'bull_tsl_mult': 0.6429961302885642, 'bull_time_stop': 137, 'bull_use_sma': False, 'bull_use_ema': False, 'bull_use_atr': True, 'bull_use_adx': False, 'bull_use_spike': False, 'bull_rsi_required': True, 'bear_strategy': 'mean_reversion', 'bear_bb_std_mult': 2.9503046469481244, 'bear_rsi_os': 39, 'bear_rsi_ob': 71, 'bear_adx_thresh': 15.41751615330793, 'bear_atr_min_pct': 0.0036611231265236397, 'bear_atr_max_pct': 0.011908012750265644, 'bear_tp_mult': 2.8365460076464406, 'bear_tsl_mult': 0.9387444482868477, 'bear_time_stop': 76, 'bear_use_sma': False, 'bear_use_ema': True, 'bear_use_atr': False, 'bear_use_adx': True, 'bear_use_spike': False, 'bear_rsi_required': False, 'sideways_strategy': 'breakout', 'sideways_bb_std_mult': 2.4559482195643403, 'sideways_rsi_os': 25, 'sideways_rsi_ob': 64, 'sideways_adx_thresh': 33.791559169944456, 'sideways_atr_min_pct': 0.0051846281828293456, 'sideways_atr_max_pct': 0.14210361694349424, 'sideways_tp_mult': 1.0969077548350377, 'sideways_tsl_mult': 0.927851439065089, 'sideways_time_stop': 249, 'sideways_use_sma': False, 'sideways_use_ema': False, 'sideways_use_atr': True, 'sideways_use_adx': True, 'sideways_use_spike': True, 'sideways_rsi_required': False}.
[I 2025-08-30 18:36:19,256] Trial 61 finished with values: [-1000000000.0, 1000000000.0] and parameters: {'p_sma': 22, 'p_std': 26, 'p_atr': 14, 'p_adx': 23, 'rsi_period': 64, 'ema1': 25, 'ema2': 34, 'slip_atr_k': 0.10649530429094206, 'slip_spread_k': 0.8398572976290926, 'spread_hl_frac': 0.022783941159983577, 'bb_std_mult': 1.421259419858845, 'rsi_os': 50, 'rsi_ob': 65, 'vol_spike': 0.092959001583657, 'adx_thresh': 18.101718260564827, 'atr_min_pct': 0.02667546608755357, 'atr_max_pct': 0.06423913609891074, 'tp_mult': 1.4002160152317762, 'tsl_mult': 0.7349159515984707, 'strategy': 'breakout', 'time_stop': 247, 'use_sma': True, 'use_atr': True, 'use_adx': True, 'use_ema': True, 'use_spike': True, 'rsi_required': False, 'edge_k': 0.15937110294838153, 'edge_cap': 0.5448297135435357, 'bull_strategy': 'mean_reversion', 'bull_bb_std_mult': 2.426308265692878, 'bull_rsi_os': 25, 'bull_rsi_ob': 51, 'bull_adx_thresh': 9.583156847422856, 'bull_atr_min_pct': 0.02497751155276228, 'bull_atr_max_pct': 0.14133582542596693, 'bull_tp_mult': 2.363375266616963, 'bull_tsl_mult': 0.6234432620490139, 'bull_time_stop': 197, 'bull_use_sma': False, 'bull_use_ema': False, 'bull_use_atr': True, 'bull_use_adx': False, 'bull_use_spike': False, 'bull_rsi_required': True, 'bear_strategy': 'breakout', 'bear_bb_std_mult': 3.1399559408039477, 'bear_rsi_os': 15, 'bear_rsi_ob': 66, 'bear_adx_thresh': 16.113327914777145, 'bear_atr_min_pct': 0.003615092554325683, 'bear_atr_max_pct': 0.012382507604510547, 'bear_tp_mult': 2.83061907394913, 'bear_tsl_mult': 0.7181238884718446, 'bear_time_stop': 193, 'bear_use_sma': True, 'bear_use_ema': True, 'bear_use_atr': True, 'bear_use_adx': True, 'bear_use_spike': False, 'bear_rsi_required': False, 'sideways_strategy': 'breakout', 'sideways_bb_std_mult': 2.4245001972179887, 'sideways_rsi_os': 21, 'sideways_rsi_ob': 64, 'sideways_adx_thresh': 33.5373371944464, 'sideways_atr_min_pct': 0.005238915834731836, 'sideways_atr_max_pct': 0.14991926912826783, 'sideways_tp_mult': 1.0887444880861914, 'sideways_tsl_mult': 0.9271716791313684, 'sideways_time_stop': 250, 'sideways_use_sma': False, 'sideways_use_ema': False, 'sideways_use_atr': True, 'sideways_use_adx': False, 'sideways_use_spike': True, 'sideways_rsi_required': False}.
