[I 2025-08-30 19:18:04,802] Trial 431 finished with values: [-1000000000.0, 1000000000.0] and parameters: {'p_sma': 8, 'p_std': 46, 'p_atr': 20, 'p_adx': 21, 'rsi_period': 42, 'ema1': 27, 'ema2': 32, 'slip_atr_k': 0.12745267761404946, 'slip_spread_k': 0.18339410942785708, 'spread_hl_frac': 0.024277859221740097, 'bb_std_mult': 1.7608852817091416, 'rsi_os': 12, 'rsi_ob': 92, 'vol_spike': 0.26006264120707206, 'adx_thresh': 33.80231339127862, 'atr_min_pct': 0.024296413586046763, 'atr_max_pct': 0.03652737993199226, 'tp_mult': 2.536783341019333, 'tsl_mult': 0.7975678005095284, 'strategy': 'breakout', 'time_stop': 203, 'use_sma': False, 'use_atr': True, 'use_adx': True, 'use_ema': False, 'use_spike': True, 'rsi_required': True, 'edge_k': 0.07465172458127307, 'edge_cap': 0.4845045442637634, 'bull_strategy': 'breakout', 'bull_bb_std_mult': 2.995370993565145, 'bull_rsi_os': 26, 'bull_rsi_ob': 60, 'bull_adx_thresh': 30.0250352595986, 'bull_atr_min_pct': 0.02174776823816484, 'bull_atr_max_pct': 0.12065375069652852, 'bull_tp_mult': 2.7788227331891013, 'bull_tsl_mult': 0.5397067857457736, 'bull_time_stop': 291, 'bull_use_sma': True, 'bull_use_ema': True, 'bull_use_atr': False, 'bull_use_adx': False, 'bull_use_spike': True, 'bull_rsi_required': True, 'bear_strategy': 'breakout', 'bear_bb_std_mult': 1.6909910552407164, 'bear_rsi_os': 21, 'bear_rsi_ob': 79, 'bear_adx_thresh': 12.536777382368157, 'bear_atr_min_pct': 0.013647160488200376, 'bear_atr_max_pct': 0.03220082930670851, 'bear_tp_mult': 1.6900566133865635, 'bear_tsl_mult': 0.5246569119834211, 'bear_time_stop': 181, 'bear_use_sma': True, 'bear_use_ema': False, 'bear_use_atr': True, 'bear_use_adx': True, 'bear_use_spike': False, 'bear_rsi_required': True, 'sideways_strategy': 'breakout', 'sideways_bb_std_mult': 1.9568707688482816, 'sideways_rsi_os': 51, 'sideways_rsi_ob': 79, 'sideways_adx_thresh': 19.93482370709425, 'sideways_atr_min_pct': 0.005867658421195857, 'sideways_atr_max_pct': 0.012760029624078809, 'sideways_tp_mult': 2.170839922235434, 'sideways_tsl_mult': 0.9711800235705258, 'sideways_time_stop': 88, 'sideways_use_sma': False, 'sideways_use_ema': True, 'sideways_use_atr': False, 'sideways_use_adx': True, 'sideways_use_spike': False, 'sideways_rsi_required': True}.
[I 2025-08-30 19:18:22,024] Trial 433 finished with values: [-1000000000.0, 1000000000.0] and parameters: {'p_sma': 33, 'p_std': 5, 'p_atr': 9, 'p_adx': 21, 'rsi_period': 36, 'ema1': 27, 'ema2': 22, 'slip_atr_k': 0.05937083113989438, 'slip_spread_k': 0.14229584145534366, 'spread_hl_frac': 0.023700766251711438, 'bb_std_mult': 2.205756148897501, 'rsi_os': 12, 'rsi_ob': 53, 'vol_spike': 0.26053285108859847, 'adx_thresh': 32.68225053394642, 'atr_min_pct': 0.02511690947539612, 'atr_max_pct': 0.11137834398075007, 'tp_mult': 2.5353883396012833, 'tsl_mult': 0.7980185883029177, 'strategy': 'breakout', 'time_stop': 186, 'use_sma': False, 'use_atr': True, 'use_adx': False, 'use_ema': True, 'use_spike': True, 'rsi_required': False, 'edge_k': 0.9011919080105257, 'edge_cap': 0.7565102610496703, 'bull_strategy': 'breakout', 'bull_bb_std_mult': 3.01786645078396, 'bull_rsi_os': 29, 'bull_rsi_ob': 49, 'bull_adx_thresh': 34.94389548766917, 'bull_atr_min_pct': 0.0013185262557128229, 'bull_atr_max_pct': 0.12048885958526721, 'bull_tp_mult': 2.7603018750345307, 'bull_tsl_mult': 0.9324947768626624, 'bull_time_stop': 232, 'bull_use_sma': False, 'bull_use_ema': True, 'bull_use_atr': True, 'bull_use_adx': True, 'bull_use_spike': False, 'bull_rsi_required': True, 'bear_strategy': 'breakout', 'bear_bb_std_mult': 1.715436046027968, 'bear_rsi_os': 50, 'bear_rsi_ob': 51, 'bear_adx_thresh': 17.770213944895364, 'bear_atr_min_pct': 0.014354283374113116, 'bear_atr_max_pct': 0.10182262934444167, 'bear_tp_mult': 2.692127181664017, 'bear_tsl_mult': 0.28929776527017226, 'bear_time_stop': 169, 'bear_use_sma': True, 'bear_use_ema': True, 'bear_use_atr': False, 'bear_use_adx': True, 'bear_use_spike': False, 'bear_rsi_required': True, 'sideways_strategy': 'mean_reversion', 'sideways_bb_std_mult': 2.524261763635415, 'sideways_rsi_os': 26, 'sideways_rsi_ob': 58, 'sideways_adx_thresh': 20.00619400951513, 'sideways_atr_min_pct': 0.0060610202429541155, 'sideways_atr_max_pct': 0.053708030053832984, 'sideways_tp_mult': 1.0852787247818323, 'sideways_tsl_mult': 0.9697756515441128, 'sideways_time_stop': 38, 'sideways_use_sma': False, 'sideways_use_ema': True, 'sideways_use_atr': True, 'sideways_use_adx': False, 'sideways_use_spike': False, 'sideways_rsi_required': False}.
[I 2025-08-30 19:18:33,897] Trial 434 finished with values: [-1000000000.0, 1000000000.0] and parameters: {'p_sma': 10, 'p_std': 29, 'p_atr': 9, 'p_adx': 14, 'rsi_period': 54, 'ema1': 25, 'ema2': 30, 'slip_atr_k': 0.05881570916144494, 'slip_spread_k': 0.19704674914986267, 'spread_hl_frac': 0.033903565694415654, 'bb_std_mult': 3.4430598524163214, 'rsi_os': 6, 'rsi_ob': 92, 'vol_spike': 0.2605957922099338, 'adx_thresh': 19.648892618490947, 'atr_min_pct': 0.007624359295721378, 'atr_max_pct': 0.02005161214201774, 'tp_mult': 1.8555021522236543, 'tsl_mult': 0.5782408302034343, 'strategy': 'breakout', 'time_stop': 216, 'use_sma': False, 'use_atr': True, 'use_adx': True, 'use_ema': True, 'use_spike': True, 'rsi_required': False, 'edge_k': 0.13486779862378487, 'edge_cap': 0.28481253514712124, 'bull_strategy': 'breakout', 'bull_bb_std_mult': 2.987719431357457, 'bull_rsi_os': 29, 'bull_rsi_ob': 45, 'bull_adx_thresh': 19.553937904707418, 'bull_atr_min_pct': 0.0012488018784749897, 'bull_atr_max_pct': 0.05573720425973996, 'bull_tp_mult': 2.2005194641480705, 'bull_tsl_mult': 0.9381970305903331, 'bull_time_stop': 5, 'bull_use_sma': False, 'bull_use_ema': False, 'bull_use_atr': True, 'bull_use_adx': True, 'bull_use_spike': False, 'bull_rsi_required': True, 'bear_strategy': 'breakout', 'bear_bb_std_mult': 1.4205437992252803, 'bear_rsi_os': 21, 'bear_rsi_ob': 74, 'bear_adx_thresh': 17.998312630980475, 'bear_atr_min_pct': 0.024744256515138955, 'bear_atr_max_pct': 0.09976182327541659, 'bear_tp_mult': 2.7221270015758727, 'bear_tsl_mult': 0.7143049481143042, 'bear_time_stop': 166, 'bear_use_sma': True, 'bear_use_ema': True, 'bear_use_atr': True, 'bear_use_adx': True, 'bear_use_spike': False, 'bear_rsi_required': True, 'sideways_strategy': 'breakout', 'sideways_bb_std_mult': 2.9129785358901863, 'sideways_rsi_os': 25, 'sideways_rsi_ob': 80, 'sideways_adx_thresh': 26.219962302805236, 'sideways_atr_min_pct': 0.00596681972701534, 'sideways_atr_max_pct': 0.022949428576172035, 'sideways_tp_mult': 1.3232564547533807, 'sideways_tsl_mult': 0.5136206199605083, 'sideways_time_stop': 41, 'sideways_use_sma': False, 'sideways_use_ema': False, 'sideways_use_atr': False, 'sideways_use_adx': False, 'sideways_use_spike': False, 'sideways_rsi_required': False}.
[I 2025-08-30 19:18:34,578] Trial 435 finished with values: [-0.06501799871633374, 0.0650570772683457] and parameters: {'p_sma': 26, 'p_std': 55, 'p_atr': 10, 'p_adx': 14, 'rsi_period': 31, 'ema1': 26, 'ema2': 53, 'slip_atr_k': 0.17792319072642793, 'slip_spread_k': 0.14027928386402727, 'spread_hl_frac': 0.02785268828655625, 'bb_std_mult': 2.1677668030382793, 'rsi_os': 49, 'rsi_ob': 92, 'vol_spike': 0.14454904742621527, 'adx_thresh': 32.90946283258527, 'atr_min_pct': 0.023196948632129927, 'atr_max_pct': 0.11179107550797797, 'tp_mult': 1.2619540644955685, 'tsl_mult': 0.7960185705683622, 'strategy': 'breakout', 'time_stop': 186, 'use_sma': False, 'use_atr': True, 'use_adx': True, 'use_ema': True, 'use_spike': True, 'rsi_required': False, 'edge_k': 0.9053503853052115, 'edge_cap': 0.48239755719454497, 'bull_strategy': 'breakout', 'bull_bb_std_mult': 2.3294100781783227, 'bull_rsi_os': 29, 'bull_rsi_ob': 87, 'bull_adx_thresh': 7.346447133339385, 'bull_atr_min_pct': 0.002942732503242393, 'bull_atr_max_pct': 0.0547860234945944, 'bull_tp_mult': 2.693041558073604, 'bull_tsl_mult': 0.9347773878025754, 'bull_time_stop': 280, 'bull_use_sma': True, 'bull_use_ema': False, 'bull_use_atr': False, 'bull_use_adx': True, 'bull_use_spike': True, 'bull_rsi_required': True, 'bear_strategy': 'mean_reversion', 'bear_bb_std_mult': 2.68044634984368, 'bear_rsi_os': 21, 'bear_rsi_ob': 50, 'bear_adx_thresh': 32.877597217187216, 'bear_atr_min_pct': 0.01457805047415851, 'bear_atr_max_pct': 0.039114754705376356, 'bear_tp_mult': 2.7147570848407, 'bear_tsl_mult': 0.9272784504622502, 'bear_time_stop': 204, 'bear_use_sma': True, 'bear_use_ema': False, 'bear_use_atr': True, 'bear_use_adx': True, 'bear_use_spike': False, 'bear_rsi_required': True, 'sideways_strategy': 'breakout', 'sideways_bb_std_mult': 2.9798156466774595, 'sideways_rsi_os': 35, 'sideways_rsi_ob': 80, 'sideways_adx_thresh': 19.92733228022096, 'sideways_atr_min_pct': 0.0009621536459153961, 'sideways_atr_max_pct': 0.14013424077689032, 'sideways_tp_mult': 1.7780917274156003, 'sideways_tsl_mult': 0.9211586191560946, 'sideways_time_stop': 87, 'sideways_use_sma': False, 'sideways_use_ema': False, 'sideways_use_atr': False, 'sideways_use_adx': False, 'sideways_use_spike': False, 'sideways_rsi_required': False}.
[I 2025-08-30 19:18:37,331] Trial 436 finished with values: [-1000000000.0, 1000000000.0] and parameters: {'p_sma': 7, 'p_std': 31, 'p_atr': 9, 'p_adx': 19, 'rsi_period': 31, 'ema1': 26, 'ema2': 30, 'slip_atr_k': 0.05503965954593095, 'slip_spread_k': 0.14312939085880338, 'spread_hl_frac': 0.028480775631706756, 'bb_std_mult': 2.1983940575604963, 'rsi_os': 47, 'rsi_ob': 82, 'vol_spike': 0.2735155402819217, 'adx_thresh': 28.306195160612173, 'atr_min_pct': 0.013849208591962568, 'atr_max_pct': 0.09008944606047885, 'tp_mult': 1.506759702437968, 'tsl_mult': 0.8236145732326569, 'strategy': 'mean_reversion', 'time_stop': 293, 'use_sma': False, 'use_atr': False, 'use_adx': True, 'use_ema': True, 'use_spike': False, 'rsi_required': False, 'edge_k': 0.9266171603468515, 'edge_cap': 0.2530336520876682, 'bull_strategy': 'mean_reversion', 'bull_bb_std_mult': 3.1791030216484826, 'bull_rsi_os': 36, 'bull_rsi_ob': 45, 'bull_adx_thresh': 23.820460557411188, 'bull_atr_min_pct': 0.0028467088988911025, 'bull_atr_max_pct': 0.08278389454793215, 'bull_tp_mult': 2.214638726840403, 'bull_tsl_mult': 0.9441763563113841, 'bull_time_stop': 90, 'bull_use_sma': False, 'bull_use_ema': False, 'bull_use_atr': True, 'bull_use_adx': True, 'bull_use_spike': False, 'bull_rsi_required': False, 'bear_strategy': 'mean_reversion', 'bear_bb_std_mult': 2.9591186801378924, 'bear_rsi_os': 50, 'bear_rsi_ob': 49, 'bear_adx_thresh': 8.697691187728998, 'bear_atr_min_pct': 0.014556898037163214, 'bear_atr_max_pct': 0.03864266926070692, 'bear_tp_mult': 2.7086689453392543, 'bear_tsl_mult': 0.25770090576177895, 'bear_time_stop': 151, 'bear_use_sma': True, 'bear_use_ema': True, 'bear_use_atr': False, 'bear_use_adx': False, 'bear_use_spike': False, 'bear_rsi_required': True, 'sideways_strategy': 'breakout', 'sideways_bb_std_mult': 2.5151540550034057, 'sideways_rsi_os': 5, 'sideways_rsi_ob': 80, 'sideways_adx_thresh': 19.978112138679315, 'sideways_atr_min_pct': 0.0010648704260031998, 'sideways_atr_max_pct': 0.13937454466181906, 'sideways_tp_mult': 1.1013039696211029, 'sideways_tsl_mult': 0.9122685208228636, 'sideways_time_stop': 285, 'sideways_use_sma': True, 'sideways_use_ema': False, 'sideways_use_atr': True, 'sideways_use_adx': False, 'sideways_use_spike': False, 'sideways_rsi_required': False}.
[I 2025-08-30 19:18:56,361] Trial 437 finished with values: [-0.016736273055316442, 0.016977508009671963] and parameters: {'p_sma': 10, 'p_std': 57, 'p_atr': 10, 'p_adx': 19, 'rsi_period': 26, 'ema1': 26, 'ema2': 45, 'slip_atr_k': 0.07764271548647067, 'slip_spread_k': 0.009978802737719561, 'spread_hl_frac': 0.02625644034750462, 'bb_std_mult': 2.0970366322409335, 'rsi_os': 6, 'rsi_ob': 82, 'vol_spike': 0.24609657723882453, 'adx_thresh': 19.29273285450294, 'atr_min_pct': 0.023186560563251975, 'atr_max_pct': 0.08981579312066379, 'tp_mult': 2.2564810645808344, 'tsl_mult': 0.819157144009417, 'strategy': 'mean_reversion', 'time_stop': 26, 'use_sma': False, 'use_atr': False, 'use_adx': True, 'use_ema': True, 'use_spike': False, 'rsi_required': False, 'edge_k': 1.7362669471396974, 'edge_cap': 0.27852061639692594, 'bull_strategy': 'mean_reversion', 'bull_bb_std_mult': 3.1901960535625555, 'bull_rsi_os': 44, 'bull_rsi_ob': 73, 'bull_adx_thresh': 16.32642897952348, 'bull_atr_min_pct': 0.0030216581172502087, 'bull_atr_max_pct': 0.017696592220800625, 'bull_tp_mult': 2.2366424388635924, 'bull_tsl_mult': 0.47948976890411626, 'bull_time_stop': 192, 'bull_use_sma': False, 'bull_use_ema': False, 'bull_use_atr': True, 'bull_use_adx': True, 'bull_use_spike': False, 'bull_rsi_required': True, 'bear_strategy': 'mean_reversion', 'bear_bb_std_mult': 1.4178280330237434, 'bear_rsi_os': 51, 'bear_rsi_ob': 73, 'bear_adx_thresh': 18.21432183435709, 'bear_atr_min_pct': 0.029485177721471023, 'bear_atr_max_pct': 0.03976334655173519, 'bear_tp_mult': 1.0557184795301104, 'bear_tsl_mult': 0.7475062856919843, 'bear_time_stop': 126, 'bear_use_sma': True, 'bear_use_ema': True, 'bear_use_atr': False, 'bear_use_adx': False, 'bear_use_spike': False, 'bear_rsi_required': False, 'sideways_strategy': 'breakout', 'sideways_bb_std_mult': 2.9912598562252746, 'sideways_rsi_os': 36, 'sideways_rsi_ob': 59, 'sideways_adx_thresh': 24.73141893268499, 'sideways_atr_min_pct': 0.002121193791097319, 'sideways_atr_max_pct': 0.09699937272461179, 'sideways_tp_mult': 1.0542014822559376, 'sideways_tsl_mult': 0.3052532182712877, 'sideways_time_stop': 220, 'sideways_use_sma': True, 'sideways_use_ema': False, 'sideways_use_atr': False, 'sideways_use_adx': False, 'sideways_use_spike': True, 'sideways_rsi_required': False}.
[I 2025-08-30 19:19:08,206] Trial 438 finished with values: [-0.06727083226810959, 0.06722397487386687] and parameters: {'p_sma': 49, 'p_std': 59, 'p_atr': 28, 'p_adx': 17, 'rsi_period': 23, 'ema1': 26, 'ema2': 33, 'slip_atr_k': 0.08125450297192026, 'slip_spread_k': 0.15756579463366094, 'spread_hl_frac': 0.03231605495234938, 'bb_std_mult': 2.1149201579392902, 'rsi_os': 47, 'rsi_ob': 82, 'vol_spike': 0.15005366406757417, 'adx_thresh': 33.15491448287613, 'atr_min_pct': 0.02316690868050372, 'atr_max_pct': 0.09036490145740438, 'tp_mult': 2.2584130290420643, 'tsl_mult': 0.9249461223485739, 'strategy': 'mean_reversion', 'time_stop': 276, 'use_sma': True, 'use_atr': False, 'use_adx': True, 'use_ema': False, 'use_spike': False, 'rsi_required': False, 'edge_k': 0.22030992497287877, 'edge_cap': 0.44690596130344523, 'bull_strategy': 'mean_reversion', 'bull_bb_std_mult': 3.165726336780635, 'bull_rsi_os': 32, 'bull_rsi_ob': 47, 'bull_adx_thresh': 16.461151721660535, 'bull_atr_min_pct': 0.0025385892165951155, 'bull_atr_max_pct': 0.08192179483815129, 'bull_tp_mult': 2.6661272850758713, 'bull_tsl_mult': 0.47779797329683116, 'bull_time_stop': 101, 'bull_use_sma': False, 'bull_use_ema': False, 'bull_use_atr': True, 'bull_use_adx': False, 'bull_use_spike': True, 'bull_rsi_required': False, 'bear_strategy': 'mean_reversion', 'bear_bb_std_mult': 2.969812819201035, 'bear_rsi_os': 51, 'bear_rsi_ob': 95, 'bear_adx_thresh': 17.1863776964959, 'bear_atr_min_pct': 0.014713531295490499, 'bear_atr_max_pct': 0.03665980380587198, 'bear_tp_mult': 2.714205063083135, 'bear_tsl_mult': 0.7411736341008914, 'bear_time_stop': 204, 'bear_use_sma': True, 'bear_use_ema': True, 'bear_use_atr': False, 'bear_use_adx': False, 'bear_use_spike': False, 'bear_rsi_required': False, 'sideways_strategy': 'breakout', 'sideways_bb_std_mult': 3.0026611416863624, 'sideways_rsi_os': 35, 'sideways_rsi_ob': 59, 'sideways_adx_thresh': 11.96239671810107, 'sideways_atr_min_pct': 0.0011615725681720142, 'sideways_atr_max_pct': 0.14012962687796854, 'sideways_tp_mult': 2.3035587069992793, 'sideways_tsl_mult': 0.9136794032280248, 'sideways_time_stop': 153, 'sideways_use_sma': True, 'sideways_use_ema': False, 'sideways_use_atr': True, 'sideways_use_adx': False, 'sideways_use_spike': True, 'sideways_rsi_required': True}.
[I 2025-08-30 19:19:09,299] Trial 441 finished with values: [-1000000000.0, 1000000000.0] and parameters: {'p_sma': 51, 'p_std': 33, 'p_atr': 15, 'p_adx': 20, 'rsi_period': 24, 'ema1': 25, 'ema2': 45, 'slip_atr_k': 0.0782424774413315, 'slip_spread_k': 0.3147558276231615, 'spread_hl_frac': 0.026115048321435002, 'bb_std_mult': 0.6318108034292542, 'rsi_os': 50, 'rsi_ob': 79, 'vol_spike': 0.25107831383486323, 'adx_thresh': 34.517158796107275, 'atr_min_pct': 0.018097136052472852, 'atr_max_pct': 0.149352797219382, 'tp_mult': 2.252537522110245, 'tsl_mult': 0.8650317903531511, 'strategy': 'mean_reversion', 'time_stop': 193, 'use_sma': True, 'use_atr': True, 'use_adx': False, 'use_ema': False, 'use_spike': False, 'rsi_required': False, 'edge_k': 0.21109825949585082, 'edge_cap': 0.4472535749384756, 'bull_strategy': 'mean_reversion', 'bull_bb_std_mult': 3.218154617438386, 'bull_rsi_os': 32, 'bull_rsi_ob': 54, 'bull_adx_thresh': 16.75165884009704, 'bull_atr_min_pct': 0.017495086974338853, 'bull_atr_max_pct': 0.1179941348561383, 'bull_tp_mult': 2.720344873476618, 'bull_tsl_mult': 0.48142171459571087, 'bull_time_stop': 193, 'bull_use_sma': False, 'bull_use_ema': True, 'bull_use_atr': True, 'bull_use_adx': False, 'bull_use_spike': False, 'bull_rsi_required': False, 'bear_strategy': 'breakout', 'bear_bb_std_mult': 3.1512144449095905, 'bear_rsi_os': 43, 'bear_rsi_ob': 73, 'bear_adx_thresh': 15.115363852896893, 'bear_atr_min_pct': 0.012032889081370698, 'bear_atr_max_pct': 0.02897394390141056, 'bear_tp_mult': 2.6271858767961778, 'bear_tsl_mult': 0.789632725468278, 'bear_time_stop': 208, 'bear_use_sma': False, 'bear_use_ema': True, 'bear_use_atr': False, 'bear_use_adx': False, 'bear_use_spike': False, 'bear_rsi_required': False, 'sideways_strategy': 'mean_reversion', 'sideways_bb_std_mult': 3.2461475887425215, 'sideways_rsi_os': 12, 'sideways_rsi_ob': 59, 'sideways_adx_thresh': 12.2027898915325, 'sideways_atr_min_pct': 0.002116597027460806, 'sideways_atr_max_pct': 0.08974137442528907, 'sideways_tp_mult': 1.0604053056971532, 'sideways_tsl_mult': 0.9846568569336088, 'sideways_time_stop': 151, 'sideways_use_sma': True, 'sideways_use_ema': True, 'sideways_use_atr': True, 'sideways_use_adx': False, 'sideways_use_spike': True, 'sideways_rsi_required': True}.
[I 2025-08-30 19:19:09,586] Trial 439 finished with values: [-1000000000.0, 1000000000.0] and parameters: {'p_sma': 9, 'p_std': 31, 'p_atr': 28, 'p_adx': 17, 'rsi_period': 77, 'ema1': 26, 'ema2': 33, 'slip_atr_k': 0.08016123928953871, 'slip_spread_k': 0.10753313610127148, 'spread_hl_frac': 0.032598559825815235, 'bb_std_mult': 3.2307032224184438, 'rsi_os': 28, 'rsi_ob': 73, 'vol_spike': 0.2762371970182006, 'adx_thresh': 33.54494499766343, 'atr_min_pct': 0.022406901212975897, 'atr_max_pct': 0.0899953269826345, 'tp_mult': 2.9514235717276733, 'tsl_mult': 0.8159606409192236, 'strategy': 'mean_reversion', 'time_stop': 194, 'use_sma': True, 'use_atr': False, 'use_adx': True, 'use_ema': False, 'use_spike': False, 'rsi_required': False, 'edge_k': 0.4003409352870989, 'edge_cap': 0.4479046454253065, 'bull_strategy': 'mean_reversion', 'bull_bb_std_mult': 3.192129612784694, 'bull_rsi_os': 32, 'bull_rsi_ob': 72, 'bull_adx_thresh': 16.716110367225138, 'bull_atr_min_pct': 0.026397310276577775, 'bull_atr_max_pct': 0.12382910724349376, 'bull_tp_mult': 1.7768155797526872, 'bull_tsl_mult': 0.48643801716928997, 'bull_time_stop': 191, 'bull_use_sma': False, 'bull_use_ema': True, 'bull_use_atr': True, 'bull_use_adx': False, 'bull_use_spike': False, 'bull_rsi_required': False, 'bear_strategy': 'mean_reversion', 'bear_bb_std_mult': 2.9963209270543087, 'bear_rsi_os': 51, 'bear_rsi_ob': 95, 'bear_adx_thresh': 16.48702504758038, 'bear_atr_min_pct': 0.015575861156660736, 'bear_atr_max_pct': 0.028263823776929802, 'bear_tp_mult': 2.6133357077130297, 'bear_tsl_mult': 0.14904900721652226, 'bear_time_stop': 204, 'bear_use_sma': True, 'bear_use_ema': True, 'bear_use_atr': False, 'bear_use_adx': False, 'bear_use_spike': True, 'bear_rsi_required': False, 'sideways_strategy': 'breakout', 'sideways_bb_std_mult': 3.256068297095275, 'sideways_rsi_os': 12, 'sideways_rsi_ob': 59, 'sideways_adx_thresh': 28.43630941444966, 'sideways_atr_min_pct': 0.0020054140406823365, 'sideways_atr_max_pct': 0.14672230150231236, 'sideways_tp_mult': 2.6320406494552557, 'sideways_tsl_mult': 0.4353992289108382, 'sideways_time_stop': 149, 'sideways_use_sma': True, 'sideways_use_ema': True, 'sideways_use_atr': True, 'sideways_use_adx': False, 'sideways_use_spike': True, 'sideways_rsi_required': True}.
