[I 2025-08-30 18:51:26,428] Trial 197 finished with values: [-1000000000.0, 1000000000.0] and parameters: {'p_sma': 10, 'p_std': 31, 'p_atr': 9, 'p_adx': 20, 'rsi_period': 23, 'ema1': 12, 'ema2': 33, 'slip_atr_k': 0.11554489992087191, 'slip_spread_k': 0.1321812843459754, 'spread_hl_frac': 0.036854493421356, 'bb_std_mult': 2.1141771033031653, 'rsi_os': 48, 'rsi_ob': 94, 'vol_spike': 0.2588046512998108, 'adx_thresh': 34.12992718788627, 'atr_min_pct': 0.024360701181662173, 'atr_max_pct': 0.079505521135734, 'tp_mult': 2.8313003082911847, 'tsl_mult': 0.8601589692630556, 'strategy': 'mean_reversion', 'time_stop': 82, 'use_sma': True, 'use_atr': True, 'use_adx': True, 'use_ema': False, 'use_spike': True, 'rsi_required': False, 'edge_k': 0.13961965484573563, 'edge_cap': 0.6211358441727213, 'bull_strategy': 'mean_reversion', 'bull_bb_std_mult': 3.2044914936638738, 'bull_rsi_os': 30, 'bull_rsi_ob': 46, 'bull_adx_thresh': 19.84071926523676, 'bull_atr_min_pct': 0.0025286869714500277, 'bull_atr_max_pct': 0.011817652716283628, 'bull_tp_mult': 2.5444423586725544, 'bull_tsl_mult': 0.21153056538434012, 'bull_time_stop': 109, 'bull_use_sma': True, 'bull_use_ema': True, 'bull_use_atr': True, 'bull_use_adx': False, 'bull_use_spike': False, 'bull_rsi_required': True, 'bear_strategy': 'breakout', 'bear_bb_std_mult': 3.0446255864870855, 'bear_rsi_os': 26, 'bear_rsi_ob': 76, 'bear_adx_thresh': 17.814398251708795, 'bear_atr_min_pct': 0.014485336494488684, 'bear_atr_max_pct': 0.037125061130826476, 'bear_tp_mult': 2.6453526354019656, 'bear_tsl_mult': 0.8247819370968166, 'bear_time_stop': 224, 'bear_use_sma': True, 'bear_use_ema': True, 'bear_use_atr': False, 'bear_use_adx': False, 'bear_use_spike': False, 'bear_rsi_required': True, 'sideways_strategy': 'mean_reversion', 'sideways_bb_std_mult': 1.73418589158552, 'sideways_rsi_os': 35, 'sideways_rsi_ob': 85, 'sideways_adx_thresh': 20.082627486569653, 'sideways_atr_min_pct': 0.0020400256165829045, 'sideways_atr_max_pct': 0.14324187142868802, 'sideways_tp_mult': 1.144920182794814, 'sideways_tsl_mult': 0.9533294633549001, 'sideways_time_stop': 145, 'sideways_use_sma': False, 'sideways_use_ema': True, 'sideways_use_atr': False, 'sideways_use_adx': True, 'sideways_use_spike': False, 'sideways_rsi_required': True}.
[I 2025-08-30 18:51:26,940] Trial 202 finished with values: [-1000000000.0, 1000000000.0] and parameters: {'p_sma': 57, 'p_std': 46, 'p_atr': 23, 'p_adx': 21, 'rsi_period': 31, 'ema1': 27, 'ema2': 31, 'slip_atr_k': 0.09043939499973756, 'slip_spread_k': 0.09518131744213951, 'spread_hl_frac': 0.02450808702807613, 'bb_std_mult': 2.254866294849264, 'rsi_os': 50, 'rsi_ob': 91, 'vol_spike': 0.16461127675959364, 'adx_thresh': 32.71972609744441, 'atr_min_pct': 0.02651495660973515, 'atr_max_pct': 0.0186272380403475, 'tp_mult': 2.2953681541188873, 'tsl_mult': 0.0016026324840036632, 'strategy': 'breakout', 'time_stop': 60, 'use_sma': False, 'use_atr': True, 'use_adx': True, 'use_ema': True, 'use_spike': False, 'rsi_required': True, 'edge_k': 1.9506577657891209, 'edge_cap': 0.4879075666066357, 'bull_strategy': 'breakout', 'bull_bb_std_mult': 1.2223226090727324, 'bull_rsi_os': 31, 'bull_rsi_ob': 60, 'bull_adx_thresh': 28.785494276931473, 'bull_atr_min_pct': 0.0014989172436034835, 'bull_atr_max_pct': 0.10862913792457732, 'bull_tp_mult': 1.7397188830025943, 'bull_tsl_mult': 0.003279881706649168, 'bull_time_stop': 66, 'bull_use_sma': False, 'bull_use_ema': False, 'bull_use_atr': False, 'bull_use_adx': True, 'bull_use_spike': True, 'bull_rsi_required': False, 'bear_strategy': 'mean_reversion', 'bear_bb_std_mult': 2.9553309517897697, 'bear_rsi_os': 7, 'bear_rsi_ob': 92, 'bear_adx_thresh': 17.131717213620085, 'bear_atr_min_pct': 0.008002380855796364, 'bear_atr_max_pct': 0.026441014020284495, 'bear_tp_mult': 2.728734119667318, 'bear_tsl_mult': 0.697804833864368, 'bear_time_stop': 201, 'bear_use_sma': True, 'bear_use_ema': True, 'bear_use_atr': True, 'bear_use_adx': True, 'bear_use_spike': True, 'bear_rsi_required': False, 'sideways_strategy': 'breakout', 'sideways_bb_std_mult': 3.242195168134319, 'sideways_rsi_os': 37, 'sideways_rsi_ob': 81, 'sideways_adx_thresh': 12.791366510087187, 'sideways_atr_min_pct': 0.019692092845386037, 'sideways_atr_max_pct': 0.14653223178517968, 'sideways_tp_mult': 1.08582547413629, 'sideways_tsl_mult': 0.959198515862337, 'sideways_time_stop': 177, 'sideways_use_sma': True, 'sideways_use_ema': False, 'sideways_use_atr': True, 'sideways_use_adx': False, 'sideways_use_spike': True, 'sideways_rsi_required': False}.
[I 2025-08-30 18:51:58,403] Trial 199 finished with values: [-1000000000.0, 1000000000.0] and parameters: {'p_sma': 8, 'p_std': 40, 'p_atr': 14, 'p_adx': 21, 'rsi_period': 30, 'ema1': 27, 'ema2': 33, 'slip_atr_k': 0.058141765583003005, 'slip_spread_k': 0.126713554734274, 'spread_hl_frac': 0.025048264613928898, 'bb_std_mult': 2.2427881972221075, 'rsi_os': 49, 'rsi_ob': 74, 'vol_spike': 0.2550099559469934, 'adx_thresh': 32.39409135859239, 'atr_min_pct': 0.024040594809214114, 'atr_max_pct': 0.08912102046959909, 'tp_mult': 2.330059336327612, 'tsl_mult': 0.054553389215790615, 'strategy': 'mean_reversion', 'time_stop': 23, 'use_sma': True, 'use_atr': True, 'use_adx': True, 'use_ema': True, 'use_spike': False, 'rsi_required': False, 'edge_k': 0.15477459875001906, 'edge_cap': 0.5324414694873746, 'bull_strategy': 'breakout', 'bull_bb_std_mult': 2.966791615236471, 'bull_rsi_os': 33, 'bull_rsi_ob': 50, 'bull_adx_thresh': 20.41266429752935, 'bull_atr_min_pct': 0.008658635883480922, 'bull_atr_max_pct': 0.10794458430717074, 'bull_tp_mult': 2.59807051215918, 'bull_tsl_mult': 0.2139479665241209, 'bull_time_stop': 199, 'bull_use_sma': True, 'bull_use_ema': True, 'bull_use_atr': False, 'bull_use_adx': True, 'bull_use_spike': True, 'bull_rsi_required': False, 'bear_strategy': 'mean_reversion', 'bear_bb_std_mult': 2.6599057348990605, 'bear_rsi_os': 6, 'bear_rsi_ob': 70, 'bear_adx_thresh': 17.810621114082064, 'bear_atr_min_pct': 0.027803661242949144, 'bear_atr_max_pct': 0.08305411772728019, 'bear_tp_mult': 2.6392302512212042, 'bear_tsl_mult': 0.7330086000930757, 'bear_time_stop': 107, 'bear_use_sma': True, 'bear_use_ema': True, 'bear_use_atr': False, 'bear_use_adx': False, 'bear_use_spike': False, 'bear_rsi_required': False, 'sideways_strategy': 'breakout', 'sideways_bb_std_mult': 1.7286033051251937, 'sideways_rsi_os': 37, 'sideways_rsi_ob': 68, 'sideways_adx_thresh': 26.548251291764586, 'sideways_atr_min_pct': 0.0027242675213157374, 'sideways_atr_max_pct': 0.04215350023643, 'sideways_tp_mult': 1.1478520352054842, 'sideways_tsl_mult': 0.957608936906992, 'sideways_time_stop': 177, 'sideways_use_sma': True, 'sideways_use_ema': False, 'sideways_use_atr': False, 'sideways_use_adx': True, 'sideways_use_spike': False, 'sideways_rsi_required': True}.
[I 2025-08-30 18:51:59,300] Trial 200 finished with values: [-1000000000.0, 1000000000.0] and parameters: {'p_sma': 6, 'p_std': 31, 'p_atr': 14, 'p_adx': 21, 'rsi_period': 82, 'ema1': 27, 'ema2': 45, 'slip_atr_k': 0.1434732642698407, 'slip_spread_k': 0.13526223159492878, 'spread_hl_frac': 0.024508813778661653, 'bb_std_mult': 2.242265325516203, 'rsi_os': 49, 'rsi_ob': 94, 'vol_spike': 0.16433205335135098, 'adx_thresh': 26.34738060573953, 'atr_min_pct': 1.6131334328635047e-05, 'atr_max_pct': 0.09580323700032184, 'tp_mult': 2.3072584590447036, 'tsl_mult': 0.0036563719585778753, 'strategy': 'mean_reversion', 'time_stop': 83, 'use_sma': True, 'use_atr': True, 'use_adx': True, 'use_ema': False, 'use_spike': False, 'rsi_required': False, 'edge_k': 0.09514444381070494, 'edge_cap': 0.4848982444453364, 'bull_strategy': 'breakout', 'bull_bb_std_mult': 3.163686786893198, 'bull_rsi_os': 30, 'bull_rsi_ob': 73, 'bull_adx_thresh': 32.35269739310832, 'bull_atr_min_pct': 0.02348143373161765, 'bull_atr_max_pct': 0.01586785001985462, 'bull_tp_mult': 2.5707435253427, 'bull_tsl_mult': 0.581764661871854, 'bull_time_stop': 219, 'bull_use_sma': False, 'bull_use_ema': True, 'bull_use_atr': False, 'bull_use_adx': True, 'bull_use_spike': True, 'bull_rsi_required': False, 'bear_strategy': 'breakout', 'bear_bb_std_mult': 2.9614446097196754, 'bear_rsi_os': 52, 'bear_rsi_ob': 92, 'bear_adx_thresh': 17.391298526086224, 'bear_atr_min_pct': 0.007410821483472601, 'bear_atr_max_pct': 0.027538499308058895, 'bear_tp_mult': 2.7168593195879653, 'bear_tsl_mult': 0.8017227330873072, 'bear_time_stop': 68, 'bear_use_sma': True, 'bear_use_ema': True, 'bear_use_atr': True, 'bear_use_adx': False, 'bear_use_spike': True, 'bear_rsi_required': False, 'sideways_strategy': 'breakout', 'sideways_bb_std_mult': 3.2767378940542824, 'sideways_rsi_os': 37, 'sideways_rsi_ob': 70, 'sideways_adx_thresh': 19.333562216947463, 'sideways_atr_min_pct': 0.0017636273011092999, 'sideways_atr_max_pct': 0.12762949900865228, 'sideways_tp_mult': 1.905015086589999, 'sideways_tsl_mult': 0.19115481684477642, 'sideways_time_stop': 172, 'sideways_use_sma': True, 'sideways_use_ema': True, 'sideways_use_atr': False, 'sideways_use_adx': True, 'sideways_use_spike': False, 'sideways_rsi_required': True}.
[I 2025-08-30 18:51:59,735] Trial 201 finished with values: [-1000000000.0, 1000000000.0] and parameters: {'p_sma': 56, 'p_std': 35, 'p_atr': 9, 'p_adx': 21, 'rsi_period': 24, 'ema1': 10, 'ema2': 45, 'slip_atr_k': 0.09700955936202046, 'slip_spread_k': 0.37820926337519345, 'spread_hl_frac': 0.024541977942403072, 'bb_std_mult': 3.1036598991304762, 'rsi_os': 50, 'rsi_ob': 75, 'vol_spike': 0.012386923104816372, 'adx_thresh': 32.70685686960277, 'atr_min_pct': 0.026395120344284505, 'atr_max_pct': 0.09129844362396759, 'tp_mult': 2.81024148783483, 'tsl_mult': 0.7680819844049729, 'strategy': 'breakout', 'time_stop': 65, 'use_sma': True, 'use_atr': True, 'use_adx': True, 'use_ema': False, 'use_spike': False, 'rsi_required': True, 'edge_k': 0.10465507838587876, 'edge_cap': 0.4841581827190557, 'bull_strategy': 'breakout', 'bull_bb_std_mult': 3.1497085568474743, 'bull_rsi_os': 31, 'bull_rsi_ob': 73, 'bull_adx_thresh': 25.37278891059352, 'bull_atr_min_pct': 0.010042614241349586, 'bull_atr_max_pct': 0.06228709943272563, 'bull_tp_mult': 2.614494323565874, 'bull_tsl_mult': 0.2636819828403386, 'bull_time_stop': 220, 'bull_use_sma': False, 'bull_use_ema': False, 'bull_use_atr': False, 'bull_use_adx': True, 'bull_use_spike': True, 'bull_rsi_required': False, 'bear_strategy': 'breakout', 'bear_bb_std_mult': 2.9228189211632745, 'bear_rsi_os': 26, 'bear_rsi_ob': 79, 'bear_adx_thresh': 17.645638755775934, 'bear_atr_min_pct': 0.007391376763691528, 'bear_atr_max_pct': 0.026187839624098548, 'bear_tp_mult': 2.7287614593168485, 'bear_tsl_mult': 0.6026958800586573, 'bear_time_stop': 69, 'bear_use_sma': True, 'bear_use_ema': True, 'bear_use_atr': True, 'bear_use_adx': True, 'bear_use_spike': True, 'bear_rsi_required': False, 'sideways_strategy': 'breakout', 'sideways_bb_std_mult': 1.7463412046752174, 'sideways_rsi_os': 15, 'sideways_rsi_ob': 64, 'sideways_adx_thresh': 28.56895478597324, 'sideways_atr_min_pct': 0.023563964386150393, 'sideways_atr_max_pct': 0.042023913675360465, 'sideways_tp_mult': 1.881189486278132, 'sideways_tsl_mult': 0.96154289188283, 'sideways_time_stop': 161, 'sideways_use_sma': True, 'sideways_use_ema': True, 'sideways_use_atr': False, 'sideways_use_adx': True, 'sideways_use_spike': True, 'sideways_rsi_required': False}.
[I 2025-08-30 18:52:00,306] Trial 203 finished with values: [-1000000000.0, 1000000000.0] and parameters: {'p_sma': 39, 'p_std': 40, 'p_atr': 9, 'p_adx': 21, 'rsi_period': 13, 'ema1': 27, 'ema2': 33, 'slip_atr_k': 0.1317002035854677, 'slip_spread_k': 0.5043928917065085, 'spread_hl_frac': 0.02078297596457298, 'bb_std_mult': 2.2328955304174767, 'rsi_os': 17, 'rsi_ob': 81, 'vol_spike': 0.2784113680701196, 'adx_thresh': 26.555438114590313, 'atr_min_pct': 0.007816364191832414, 'atr_max_pct': 0.09559279509942192, 'tp_mult': 2.2589826279432548, 'tsl_mult': 0.9214714343989883, 'strategy': 'mean_reversion', 'time_stop': 254, 'use_sma': False, 'use_atr': True, 'use_adx': True, 'use_ema': False, 'use_spike': False, 'rsi_required': False, 'edge_k': 0.09059277299366653, 'edge_cap': 0.5501047562877873, 'bull_strategy': 'breakout', 'bull_bb_std_mult': 2.2774347616450226, 'bull_rsi_os': 19, 'bull_rsi_ob': 45, 'bull_adx_thresh': 32.508759170186536, 'bull_atr_min_pct': 0.009850622381089812, 'bull_atr_max_pct': 0.04053132653887052, 'bull_tp_mult': 1.9213942695292965, 'bull_tsl_mult': 0.5791174671887294, 'bull_time_stop': 222, 'bull_use_sma': False, 'bull_use_ema': True, 'bull_use_atr': False, 'bull_use_adx': True, 'bull_use_spike': True, 'bull_rsi_required': False, 'bear_strategy': 'breakout', 'bear_bb_std_mult': 0.502833333561101, 'bear_rsi_os': 53, 'bear_rsi_ob': 79, 'bear_adx_thresh': 18.09643099339643, 'bear_atr_min_pct': 0.006829300591498683, 'bear_atr_max_pct': 0.08332281380766902, 'bear_tp_mult': 2.8533457569501652, 'bear_tsl_mult': 0.8063367681863852, 'bear_time_stop': 109, 'bear_use_sma': True, 'bear_use_ema': True, 'bear_use_atr': True, 'bear_use_adx': False, 'bear_use_spike': False, 'bear_rsi_required': False, 'sideways_strategy': 'breakout', 'sideways_bb_std_mult': 2.986445408490203, 'sideways_rsi_os': 15, 'sideways_rsi_ob': 50, 'sideways_adx_thresh': 26.847357784645258, 'sideways_atr_min_pct': 0.00559532457839702, 'sideways_atr_max_pct': 0.044486568145410944, 'sideways_tp_mult': 2.466872265123471, 'sideways_tsl_mult': 0.6725553317897119, 'sideways_time_stop': 293, 'sideways_use_sma': True, 'sideways_use_ema': True, 'sideways_use_atr': True, 'sideways_use_adx': False, 'sideways_use_spike': False, 'sideways_rsi_required': True}.
[I 2025-08-30 18:52:33,970] Trial 206 finished with values: [-0.04025115162290427, 0.04015182245754659] and parameters: {'p_sma': 39, 'p_std': 33, 'p_atr': 9, 'p_adx': 8, 'rsi_period': 27, 'ema1': 24, 'ema2': 41, 'slip_atr_k': 0.2460778933548302, 'slip_spread_k': 0.6317947806820282, 'spread_hl_frac': 0.031893137937449245, 'bb_std_mult': 2.769940399439935, 'rsi_os': 34, 'rsi_ob': 79, 'vol_spike': 0.27883609329251746, 'adx_thresh': 34.536811063897844, 'atr_min_pct': 0.028032211591857085, 'atr_max_pct': 0.0964143626905753, 'tp_mult': 2.7418897857796383, 'tsl_mult': 0.6203201302266413, 'strategy': 'mean_reversion', 'time_stop': 192, 'use_sma': False, 'use_atr': True, 'use_adx': False, 'use_ema': False, 'use_spike': True, 'rsi_required': False, 'edge_k': 1.070883720348251, 'edge_cap': 0.5101060255039613, 'bull_strategy': 'mean_reversion', 'bull_bb_std_mult': 3.1211196777232777, 'bull_rsi_os': 32, 'bull_rsi_ob': 45, 'bull_adx_thresh': 17.88100656503918, 'bull_atr_min_pct': 0.01957799625562337, 'bull_atr_max_pct': 0.12069202306463264, 'bull_tp_mult': 2.3901626031686827, 'bull_tsl_mult': 0.5074661495354618, 'bull_time_stop': 175, 'bull_use_sma': False, 'bull_use_ema': True, 'bull_use_atr': True, 'bull_use_adx': False, 'bull_use_spike': False, 'bull_rsi_required': True, 'bear_strategy': 'breakout', 'bear_bb_std_mult': 2.745513182523882, 'bear_rsi_os': 50, 'bear_rsi_ob': 74, 'bear_adx_thresh': 26.500410354762252, 'bear_atr_min_pct': 0.014018009554269855, 'bear_atr_max_pct': 0.0336375139783488, 'bear_tp_mult': 2.7642972818182105, 'bear_tsl_mult': 0.7175552600383908, 'bear_time_stop': 183, 'bear_use_sma': True, 'bear_use_ema': False, 'bear_use_atr': False, 'bear_use_adx': False, 'bear_use_spike': False, 'bear_rsi_required': True, 'sideways_strategy': 'breakout', 'sideways_bb_std_mult': 3.0091659506975583, 'sideways_rsi_os': 39, 'sideways_rsi_ob': 59, 'sideways_adx_thresh': 27.252025710661314, 'sideways_atr_min_pct': 0.0026576547184504213, 'sideways_atr_max_pct': 0.1469713124479805, 'sideways_tp_mult': 1.1001246085072196, 'sideways_tsl_mult': 0.7248522619115632, 'sideways_time_stop': 137, 'sideways_use_sma': False, 'sideways_use_ema': True, 'sideways_use_atr': True, 'sideways_use_adx': False, 'sideways_use_spike': False, 'sideways_rsi_required': True}.
[I 2025-08-30 18:52:35,098] Trial 204 finished with values: [-1000000000.0, 1000000000.0] and parameters: {'p_sma': 44, 'p_std': 32, 'p_atr': 20, 'p_adx': 26, 'rsi_period': 37, 'ema1': 24, 'ema2': 41, 'slip_atr_k': 0.24463935553935523, 'slip_spread_k': 0.13969382436678496, 'spread_hl_frac': 0.014738106798208226, 'bb_std_mult': 3.0858564854897965, 'rsi_os': 33, 'rsi_ob': 79, 'vol_spike': 0.27643054939174844, 'adx_thresh': 20.7414555330987, 'atr_min_pct': 0.007840559098518343, 'atr_max_pct': 0.09577946883006923, 'tp_mult': 2.6286370192329453, 'tsl_mult': 0.6173906141480644, 'strategy': 'breakout', 'time_stop': 168, 'use_sma': False, 'use_atr': True, 'use_adx': True, 'use_ema': False, 'use_spike': True, 'rsi_required': True, 'edge_k': 0.5584881803959579, 'edge_cap': 0.4622867362236529, 'bull_strategy': 'mean_reversion', 'bull_bb_std_mult': 3.135305355524989, 'bull_rsi_os': 31, 'bull_rsi_ob': 45, 'bull_adx_thresh': 23.08555746627799, 'bull_atr_min_pct': 0.004958955295737404, 'bull_atr_max_pct': 0.11399493731121205, 'bull_tp_mult': 1.8078068667801857, 'bull_tsl_mult': 0.26334592408621793, 'bull_time_stop': 300, 'bull_use_sma': False, 'bull_use_ema': False, 'bull_use_atr': True, 'bull_use_adx': False, 'bull_use_spike': False, 'bull_rsi_required': True, 'bear_strategy': 'breakout', 'bear_bb_std_mult': 2.7572122840276188, 'bear_rsi_os': 52, 'bear_rsi_ob': 74, 'bear_adx_thresh': 19.714249480634198, 'bear_atr_min_pct': 0.02144657032090374, 'bear_atr_max_pct': 0.13250108477270922, 'bear_tp_mult': 2.781530817231993, 'bear_tsl_mult': 0.5974094940211508, 'bear_time_stop': 67, 'bear_use_sma': True, 'bear_use_ema': True, 'bear_use_atr': True, 'bear_use_adx': True, 'bear_use_spike': True, 'bear_rsi_required': True, 'sideways_strategy': 'breakout', 'sideways_bb_std_mult': 3.2780759236290717, 'sideways_rsi_os': 38, 'sideways_rsi_ob': 59, 'sideways_adx_thresh': 27.246670137385323, 'sideways_atr_min_pct': 0.023836343547139212, 'sideways_atr_max_pct': 0.1464158018919659, 'sideways_tp_mult': 1.0848073685098303, 'sideways_tsl_mult': 0.7217685221958943, 'sideways_time_stop': 32, 'sideways_use_sma': False, 'sideways_use_ema': True, 'sideways_use_atr': True, 'sideways_use_adx': False, 'sideways_use_spike': False, 'sideways_rsi_required': True}.
[I 2025-08-30 18:52:35,623] Trial 207 finished with values: [-1000000000.0, 1000000000.0] and parameters: {'p_sma': 44, 'p_std': 33, 'p_atr': 20, 'p_adx': 8, 'rsi_period': 20, 'ema1': 24, 'ema2': 30, 'slip_atr_k': 0.10540867751401344, 'slip_spread_k': 0.026974156693268525, 'spread_hl_frac': 0.022701184975657655, 'bb_std_mult': 2.626268189200842, 'rsi_os': 30, 'rsi_ob': 57, 'vol_spike': 0.18103038114027362, 'adx_thresh': 34.986884288987106, 'atr_min_pct': 0.028100683188511978, 'atr_max_pct': 0.032747793724560416, 'tp_mult': 1.2109913191977988, 'tsl_mult': 0.6278833796102488, 'strategy': 'breakout', 'time_stop': 99, 'use_sma': False, 'use_atr': True, 'use_adx': False, 'use_ema': False, 'use_spike': True, 'rsi_required': False, 'edge_k': 0.5485007519599596, 'edge_cap': 0.767812827841202, 'bull_strategy': 'mean_reversion', 'bull_bb_std_mult': 2.3918350514856614, 'bull_rsi_os': 27, 'bull_rsi_ob': 48, 'bull_adx_thresh': 18.051058033496858, 'bull_atr_min_pct': 0.0049916518701871825, 'bull_atr_max_pct': 0.11368005630089281, 'bull_tp_mult': 2.388851199241883, 'bull_tsl_mult': 0.5165900627263613, 'bull_time_stop': 15, 'bull_use_sma': False, 'bull_use_ema': False, 'bull_use_atr': True, 'bull_use_adx': False, 'bull_use_spike': False, 'bull_rsi_required': True, 'bear_strategy': 'breakout', 'bear_bb_std_mult': 2.747929745357263, 'bear_rsi_os': 50, 'bear_rsi_ob': 74, 'bear_adx_thresh': 19.76188474089308, 'bear_atr_min_pct': 0.01933478091310061, 'bear_atr_max_pct': 0.07602073450356131, 'bear_tp_mult': 2.1784778791867856, 'bear_tsl_mult': 0.4324448653311227, 'bear_time_stop': 183, 'bear_use_sma': True, 'bear_use_ema': False, 'bear_use_atr': False, 'bear_use_adx': True, 'bear_use_spike': False, 'bear_rsi_required': True, 'sideways_strategy': 'breakout', 'sideways_bb_std_mult': 3.0509827522529434, 'sideways_rsi_os': 39, 'sideways_rsi_ob': 59, 'sideways_adx_thresh': 7.022899330592926, 'sideways_atr_min_pct': 0.028159621285278203, 'sideways_atr_max_pct': 0.1470458583183059, 'sideways_tp_mult': 1.598630869683708, 'sideways_tsl_mult': 0.2785050689717449, 'sideways_time_stop': 170, 'sideways_use_sma': False, 'sideways_use_ema': True, 'sideways_use_atr': True, 'sideways_use_adx': False, 'sideways_use_spike': False, 'sideways_rsi_required': True}.
