[I 2025-08-30 19:03:34,893] Trial 303 finished with values: [-1000000000.0, 1000000000.0] and parameters: {'p_sma': 6, 'p_std': 30, 'p_atr': 21, 'p_adx': 17, 'rsi_period': 21, 'ema1': 28, 'ema2': 32, 'slip_atr_k': 0.06482760888931183, 'slip_spread_k': 0.15250202073959893, 'spread_hl_frac': 0.018371851939888495, 'bb_std_mult': 1.0512855293080987, 'rsi_os': 22, 'rsi_ob': 93, 'vol_spike': 0.2933522334143966, 'adx_thresh': 34.9708410963147, 'atr_min_pct': 0.027869265369168, 'atr_max_pct': 0.07370941813421897, 'tp_mult': 2.9378589616598534, 'tsl_mult': 0.23828013864777697, 'strategy': 'breakout', 'time_stop': 181, 'use_sma': False, 'use_atr': True, 'use_adx': True, 'use_ema': False, 'use_spike': True, 'rsi_required': False, 'edge_k': 0.038300132058038394, 'edge_cap': 0.5756241142378739, 'bull_strategy': 'mean_reversion', 'bull_bb_std_mult': 3.150124526199023, 'bull_rsi_os': 11, 'bull_rsi_ob': 94, 'bull_adx_thresh': 11.890674040325816, 'bull_atr_min_pct': 0.0205590945146681, 'bull_atr_max_pct': 0.11925090150632112, 'bull_tp_mult': 2.6357621678171177, 'bull_tsl_mult': 0.4837747611039692, 'bull_time_stop': 214, 'bull_use_sma': False, 'bull_use_ema': False, 'bull_use_atr': True, 'bull_use_adx': False, 'bull_use_spike': False, 'bull_rsi_required': True, 'bear_strategy': 'breakout', 'bear_bb_std_mult': 2.9836581604585275, 'bear_rsi_os': 21, 'bear_rsi_ob': 82, 'bear_adx_thresh': 17.79476437025859, 'bear_atr_min_pct': 0.013414610335958975, 'bear_atr_max_pct': 0.0176630265372303, 'bear_tp_mult': 2.7853937820694386, 'bear_tsl_mult': 0.6719743534607894, 'bear_time_stop': 260, 'bear_use_sma': True, 'bear_use_ema': True, 'bear_use_atr': False, 'bear_use_adx': True, 'bear_use_spike': False, 'bear_rsi_required': True, 'sideways_strategy': 'breakout', 'sideways_bb_std_mult': 1.0223316964725115, 'sideways_rsi_os': 36, 'sideways_rsi_ob': 60, 'sideways_adx_thresh': 12.593628305617584, 'sideways_atr_min_pct': 0.0027987211186370755, 'sideways_atr_max_pct': 0.10678203070251294, 'sideways_tp_mult': 1.072537426600773, 'sideways_tsl_mult': 0.957981777040188, 'sideways_time_stop': 153, 'sideways_use_sma': False, 'sideways_use_ema': True, 'sideways_use_atr': True, 'sideways_use_adx': False, 'sideways_use_spike': True, 'sideways_rsi_required': True}.
[I 2025-08-30 19:03:35,748] Trial 308 finished with values: [-1000000000.0, 1000000000.0] and parameters: {'p_sma': 13, 'p_std': 19, 'p_atr': 29, 'p_adx': 20, 'rsi_period': 62, 'ema1': 26, 'ema2': 53, 'slip_atr_k': 0.07504029657407582, 'slip_spread_k': 0.5041835646501959, 'spread_hl_frac': 0.043457538682188726, 'bb_std_mult': 2.9742589864450175, 'rsi_os': 50, 'rsi_ob': 83, 'vol_spike': 0.26472242499114146, 'adx_thresh': 33.65232447373098, 'atr_min_pct': 0.023179864388982115, 'atr_max_pct': 0.08657885318233048, 'tp_mult': 2.7821144808282274, 'tsl_mult': 0.23704309028083104, 'strategy': 'mean_reversion', 'time_stop': 177, 'use_sma': False, 'use_atr': True, 'use_adx': True, 'use_ema': True, 'use_spike': False, 'rsi_required': True, 'edge_k': 0.8024832786445182, 'edge_cap': 0.38119274218984256, 'bull_strategy': 'mean_reversion', 'bull_bb_std_mult': 3.363781590739419, 'bull_rsi_os': 18, 'bull_rsi_ob': 78, 'bull_adx_thresh': 19.63299841242902, 'bull_atr_min_pct': 0.0008946443235845458, 'bull_atr_max_pct': 0.11938120970366882, 'bull_tp_mult': 1.729823712727, 'bull_tsl_mult': 0.7753056147573723, 'bull_time_stop': 212, 'bull_use_sma': True, 'bull_use_ema': True, 'bull_use_atr': False, 'bull_use_adx': False, 'bull_use_spike': True, 'bull_rsi_required': True, 'bear_strategy': 'breakout', 'bear_bb_std_mult': 2.8744658739867655, 'bear_rsi_os': 25, 'bear_rsi_ob': 82, 'bear_adx_thresh': 24.270796853445148, 'bear_atr_min_pct': 0.0265177203924081, 'bear_atr_max_pct': 0.016963094541612184, 'bear_tp_mult': 2.7385159168393436, 'bear_tsl_mult': 0.2337013027244697, 'bear_time_stop': 200, 'bear_use_sma': False, 'bear_use_ema': True, 'bear_use_atr': False, 'bear_use_adx': False, 'bear_use_spike': False, 'bear_rsi_required': False, 'sideways_strategy': 'mean_reversion', 'sideways_bb_std_mult': 2.8268448685488163, 'sideways_rsi_os': 36, 'sideways_rsi_ob': 56, 'sideways_adx_thresh': 14.322590088978979, 'sideways_atr_min_pct': 0.0277748318971711, 'sideways_atr_max_pct': 0.14999317938733703, 'sideways_tp_mult': 1.2171409929692723, 'sideways_tsl_mult': 0.9701028298640761, 'sideways_time_stop': 247, 'sideways_use_sma': True, 'sideways_use_ema': True, 'sideways_use_atr': True, 'sideways_use_adx': False, 'sideways_use_spike': False, 'sideways_rsi_required': False}.
[I 2025-08-30 19:04:11,946] Trial 307 finished with values: [-1000000000.0, 1000000000.0] and parameters: {'p_sma': 58, 'p_std': 19, 'p_atr': 21, 'p_adx': 20, 'rsi_period': 63, 'ema1': 26, 'ema2': 53, 'slip_atr_k': 0.13904221174931924, 'slip_spread_k': 0.13164613236669925, 'spread_hl_frac': 0.03829183468628488, 'bb_std_mult': 0.7898455777997082, 'rsi_os': 49, 'rsi_ob': 80, 'vol_spike': 0.25362835420048857, 'adx_thresh': 33.757909780435675, 'atr_min_pct': 0.025200918789846767, 'atr_max_pct': 0.10012271688180473, 'tp_mult': 2.3124781561304517, 'tsl_mult': 0.5694693299925002, 'strategy': 'mean_reversion', 'time_stop': 44, 'use_sma': False, 'use_atr': True, 'use_adx': True, 'use_ema': False, 'use_spike': True, 'rsi_required': True, 'edge_k': 1.2469394653953498, 'edge_cap': 0.4660349368142884, 'bull_strategy': 'mean_reversion', 'bull_bb_std_mult': 3.3615649389289675, 'bull_rsi_os': 22, 'bull_rsi_ob': 94, 'bull_adx_thresh': 23.94746303972699, 'bull_atr_min_pct': 0.02036111619469446, 'bull_atr_max_pct': 0.01048165540205083, 'bull_tp_mult': 1.9154885355177542, 'bull_tsl_mult': 0.9310886937074125, 'bull_time_stop': 203, 'bull_use_sma': True, 'bull_use_ema': True, 'bull_use_atr': False, 'bull_use_adx': False, 'bull_use_spike': True, 'bull_rsi_required': True, 'bear_strategy': 'breakout', 'bear_bb_std_mult': 2.897101286909454, 'bear_rsi_os': 38, 'bear_rsi_ob': 69, 'bear_adx_thresh': 20.49255330364953, 'bear_atr_min_pct': 0.014771986242399051, 'bear_atr_max_pct': 0.11710696860588987, 'bear_tp_mult': 2.099819324056574, 'bear_tsl_mult': 0.6161322827468221, 'bear_time_stop': 200, 'bear_use_sma': True, 'bear_use_ema': True, 'bear_use_atr': False, 'bear_use_adx': False, 'bear_use_spike': False, 'bear_rsi_required': False, 'sideways_strategy': 'mean_reversion', 'sideways_bb_std_mult': 1.5977202104770352, 'sideways_rsi_os': 10, 'sideways_rsi_ob': 54, 'sideways_adx_thresh': 30.293415437170047, 'sideways_atr_min_pct': 0.014035781439858428, 'sideways_atr_max_pct': 0.14242081402924903, 'sideways_tp_mult': 1.2163099726869795, 'sideways_tsl_mult': 0.9564451359768765, 'sideways_time_stop': 161, 'sideways_use_sma': False, 'sideways_use_ema': True, 'sideways_use_atr': True, 'sideways_use_adx': False, 'sideways_use_spike': False, 'sideways_rsi_required': False}.
[I 2025-08-30 19:04:12,437] Trial 309 finished with values: [-1000000000.0, 1000000000.0] and parameters: {'p_sma': 57, 'p_std': 40, 'p_atr': 8, 'p_adx': 23, 'rsi_period': 78, 'ema1': 26, 'ema2': 27, 'slip_atr_k': 0.035432473586378355, 'slip_spread_k': 0.1279029049886184, 'spread_hl_frac': 0.023778155064215944, 'bb_std_mult': 0.6859150626800605, 'rsi_os': 49, 'rsi_ob': 83, 'vol_spike': 0.2537522085828642, 'adx_thresh': 20.541138207731144, 'atr_min_pct': 0.022392669616240677, 'atr_max_pct': 0.08679360497308938, 'tp_mult': 2.301850332036017, 'tsl_mult': 0.5880319298354569, 'strategy': 'mean_reversion', 'time_stop': 183, 'use_sma': False, 'use_atr': True, 'use_adx': True, 'use_ema': True, 'use_spike': False, 'rsi_required': True, 'edge_k': 0.7320642029921546, 'edge_cap': 0.5522987300300574, 'bull_strategy': 'mean_reversion', 'bull_bb_std_mult': 1.843889102702529, 'bull_rsi_os': 29, 'bull_rsi_ob': 80, 'bull_adx_thresh': 19.46687915256969, 'bull_atr_min_pct': 0.0009829789959901161, 'bull_atr_max_pct': 0.07205557964204004, 'bull_tp_mult': 2.78248339977814, 'bull_tsl_mult': 0.5208078520980015, 'bull_time_stop': 116, 'bull_use_sma': False, 'bull_use_ema': True, 'bull_use_atr': False, 'bull_use_adx': False, 'bull_use_spike': True, 'bull_rsi_required': True, 'bear_strategy': 'mean_reversion', 'bear_bb_std_mult': 2.86106331107933, 'bear_rsi_os': 32, 'bear_rsi_ob': 72, 'bear_adx_thresh': 20.469528530789887, 'bear_atr_min_pct': 0.015026755070705219, 'bear_atr_max_pct': 0.09357853751288465, 'bear_tp_mult': 2.6514777674436223, 'bear_tsl_mult': 0.9466764397363094, 'bear_time_stop': 200, 'bear_use_sma': False, 'bear_use_ema': True, 'bear_use_atr': False, 'bear_use_adx': False, 'bear_use_spike': False, 'bear_rsi_required': True, 'sideways_strategy': 'mean_reversion', 'sideways_bb_std_mult': 2.8339554406413323, 'sideways_rsi_os': 35, 'sideways_rsi_ob': 55, 'sideways_adx_thresh': 20.900227703932753, 'sideways_atr_min_pct': 0.0028058247751628755, 'sideways_atr_max_pct': 0.14204314378716865, 'sideways_tp_mult': 1.2017153106202556, 'sideways_tsl_mult': 0.7025538377192106, 'sideways_time_stop': 74, 'sideways_use_sma': True, 'sideways_use_ema': True, 'sideways_use_atr': True, 'sideways_use_adx': False, 'sideways_use_spike': False, 'sideways_rsi_required': False}.
[I 2025-08-30 19:04:13,287] Trial 310 finished with values: [-1000000000.0, 1000000000.0] and parameters: {'p_sma': 58, 'p_std': 33, 'p_atr': 7, 'p_adx': 20, 'rsi_period': 25, 'ema1': 26, 'ema2': 34, 'slip_atr_k': 0.14077572067180683, 'slip_spread_k': 0.12809769518440187, 'spread_hl_frac': 0.023853199364961525, 'bb_std_mult': 2.9691972151081147, 'rsi_os': 30, 'rsi_ob': 83, 'vol_spike': 0.02347275723429687, 'adx_thresh': 7.767605576362261, 'atr_min_pct': 0.020269620301740406, 'atr_max_pct': 0.09315922251737391, 'tp_mult': 2.294241043023487, 'tsl_mult': 0.817617155246093, 'strategy': 'mean_reversion', 'time_stop': 8, 'use_sma': False, 'use_atr': True, 'use_adx': True, 'use_ema': True, 'use_spike': False, 'rsi_required': True, 'edge_k': 0.7082232121621002, 'edge_cap': 0.5504193043701635, 'bull_strategy': 'mean_reversion', 'bull_bb_std_mult': 3.4273886362235744, 'bull_rsi_os': 29, 'bull_rsi_ob': 90, 'bull_adx_thresh': 19.627835405021894, 'bull_atr_min_pct': 0.023173400168048197, 'bull_atr_max_pct': 0.023477672291649987, 'bull_tp_mult': 1.7565512899839666, 'bull_tsl_mult': 0.15575894839601157, 'bull_time_stop': 117, 'bull_use_sma': True, 'bull_use_ema': True, 'bull_use_atr': False, 'bull_use_adx': False, 'bull_use_spike': True, 'bull_rsi_required': True, 'bear_strategy': 'mean_reversion', 'bear_bb_std_mult': 2.8549516333069453, 'bear_rsi_os': 38, 'bear_rsi_ob': 86, 'bear_adx_thresh': 24.230148613359006, 'bear_atr_min_pct': 0.014744323298012337, 'bear_atr_max_pct': 0.023076616463198037, 'bear_tp_mult': 2.005045628137118, 'bear_tsl_mult': 0.6125816945758692, 'bear_time_stop': 199, 'bear_use_sma': False, 'bear_use_ema': True, 'bear_use_atr': True, 'bear_use_adx': False, 'bear_use_spike': False, 'bear_rsi_required': False, 'sideways_strategy': 'mean_reversion', 'sideways_bb_std_mult': 3.2518420888212893, 'sideways_rsi_os': 15, 'sideways_rsi_ob': 86, 'sideways_adx_thresh': 20.647278875744917, 'sideways_atr_min_pct': 0.02783144247586239, 'sideways_atr_max_pct': 0.019126375090423267, 'sideways_tp_mult': 1.1705693053675539, 'sideways_tsl_mult': 0.9264856285105434, 'sideways_time_stop': 160, 'sideways_use_sma': True, 'sideways_use_ema': True, 'sideways_use_atr': True, 'sideways_use_adx': False, 'sideways_use_spike': False, 'sideways_rsi_required': False}.
[I 2025-08-30 19:04:13,383] Trial 311 finished with values: [-1000000000.0, 1000000000.0] and parameters: {'p_sma': 8, 'p_std': 32, 'p_atr': 7, 'p_adx': 27, 'rsi_period': 41, 'ema1': 19, 'ema2': 34, 'slip_atr_k': 0.022773985120334225, 'slip_spread_k': 0.12179213782628154, 'spread_hl_frac': 0.03834836003557726, 'bb_std_mult': 2.230296928943481, 'rsi_os': 49, 'rsi_ob': 83, 'vol_spike': 0.2519115778244715, 'adx_thresh': 31.043101736660983, 'atr_min_pct': 0.024317140190134263, 'atr_max_pct': 0.07871934100972959, 'tp_mult': 2.2882941410970186, 'tsl_mult': 0.8202814573745966, 'strategy': 'mean_reversion', 'time_stop': 9, 'use_sma': True, 'use_atr': True, 'use_adx': True, 'use_ema': False, 'use_spike': True, 'rsi_required': True, 'edge_k': 0.43631576140190054, 'edge_cap': 0.07544609850015521, 'bull_strategy': 'mean_reversion', 'bull_bb_std_mult': 2.9903568833671166, 'bull_rsi_os': 33, 'bull_rsi_ob': 47, 'bull_adx_thresh': 25.880760198749194, 'bull_atr_min_pct': 0.0015998448780546691, 'bull_atr_max_pct': 0.025526067458721623, 'bull_tp_mult': 1.5501602095471392, 'bull_tsl_mult': 0.5189129743306989, 'bull_time_stop': 204, 'bull_use_sma': False, 'bull_use_ema': True, 'bull_use_atr': False, 'bull_use_adx': False, 'bull_use_spike': True, 'bull_rsi_required': True, 'bear_strategy': 'mean_reversion', 'bear_bb_std_mult': 2.9060636933459287, 'bear_rsi_os': 29, 'bear_rsi_ob': 71, 'bear_adx_thresh': 12.658519404989567, 'bear_atr_min_pct': 0.0024120832334352596, 'bear_atr_max_pct': 0.04187613916860221, 'bear_tp_mult': 2.651117137309461, 'bear_tsl_mult': 0.948258624831533, 'bear_time_stop': 25, 'bear_use_sma': True, 'bear_use_ema': False, 'bear_use_atr': True, 'bear_use_adx': False, 'bear_use_spike': True, 'bear_rsi_required': True, 'sideways_strategy': 'mean_reversion', 'sideways_bb_std_mult': 1.4130827750932977, 'sideways_rsi_os': 15, 'sideways_rsi_ob': 54, 'sideways_adx_thresh': 20.703055381709348, 'sideways_atr_min_pct': 0.025723953537510766, 'sideways_atr_max_pct': 0.14296618942322892, 'sideways_tp_mult': 2.0966553523201212, 'sideways_tsl_mult': 0.9293644453797386, 'sideways_time_stop': 77, 'sideways_use_sma': False, 'sideways_use_ema': True, 'sideways_use_atr': True, 'sideways_use_adx': True, 'sideways_use_spike': False, 'sideways_rsi_required': False}.
[I 2025-08-30 19:04:14,048] Trial 314 finished with values: [-1000000000.0, 1000000000.0] and parameters: {'p_sma': 8, 'p_std': 32, 'p_atr': 10, 'p_adx': 19, 'rsi_period': 29, 'ema1': 19, 'ema2': 13, 'slip_atr_k': 0.09280911318719784, 'slip_spread_k': 0.37128024286363026, 'spread_hl_frac': 0.02519459252977679, 'bb_std_mult': 0.5951419019180335, 'rsi_os': 52, 'rsi_ob': 85, 'vol_spike': 0.27167125426585464, 'adx_thresh': 26.770745319528288, 'atr_min_pct': 0.024247783908173892, 'atr_max_pct': 0.12321895749144403, 'tp_mult': 1.048126167580408, 'tsl_mult': 0.02824110428673504, 'strategy': 'mean_reversion', 'time_stop': 282, 'use_sma': True, 'use_atr': True, 'use_adx': True, 'use_ema': False, 'use_spike': True, 'rsi_required': False, 'edge_k': 0.09416316671737121, 'edge_cap': 0.7505195025236484, 'bull_strategy': 'breakout', 'bull_bb_std_mult': 2.988896017473996, 'bull_rsi_os': 33, 'bull_rsi_ob': 47, 'bull_adx_thresh': 25.75128625054468, 'bull_atr_min_pct': 0.01457352161221818, 'bull_atr_max_pct': 0.06593561352263386, 'bull_tp_mult': 2.888252987292002, 'bull_tsl_mult': 0.5352275441148924, 'bull_time_stop': 167, 'bull_use_sma': False, 'bull_use_ema': True, 'bull_use_atr': True, 'bull_use_adx': False, 'bull_use_spike': False, 'bull_rsi_required': True, 'bear_strategy': 'breakout', 'bear_bb_std_mult': 2.814742983298135, 'bear_rsi_os': 44, 'bear_rsi_ob': 84, 'bear_adx_thresh': 16.90664752140636, 'bear_atr_min_pct': 0.01601316435140819, 'bear_atr_max_pct': 0.04221737675189721, 'bear_tp_mult': 2.4949160101541743, 'bear_tsl_mult': 0.849236784092096, 'bear_time_stop': 190, 'bear_use_sma': True, 'bear_use_ema': False, 'bear_use_atr': True, 'bear_use_adx': False, 'bear_use_spike': True, 'bear_rsi_required': True, 'sideways_strategy': 'breakout', 'sideways_bb_std_mult': 2.7038228864587954, 'sideways_rsi_os': 34, 'sideways_rsi_ob': 78, 'sideways_adx_thresh': 16.251241259769714, 'sideways_atr_min_pct': 0.025647348043930207, 'sideways_atr_max_pct': 0.14465593155209905, 'sideways_tp_mult': 1.0648613600923171, 'sideways_tsl_mult': 0.2140375357578208, 'sideways_time_stop': 108, 'sideways_use_sma': False, 'sideways_use_ema': True, 'sideways_use_atr': False, 'sideways_use_adx': True, 'sideways_use_spike': False, 'sideways_rsi_required': True}.
[I 2025-08-30 19:04:14,054] Trial 313 finished with values: [-1000000000.0, 1000000000.0] and parameters: {'p_sma': 34, 'p_std': 49, 'p_atr': 7, 'p_adx': 16, 'rsi_period': 25, 'ema1': 19, 'ema2': 51, 'slip_atr_k': 0.22385413262613238, 'slip_spread_k': 0.44641198481487054, 'spread_hl_frac': 0.025913552503331036, 'bb_std_mult': 1.2341543501353094, 'rsi_os': 52, 'rsi_ob': 55, 'vol_spike': 0.27190045862567713, 'adx_thresh': 16.919686265341674, 'atr_min_pct': 0.02433220042409574, 'atr_max_pct': 0.0926802567901586, 'tp_mult': 2.286356086178339, 'tsl_mult': 0.4215680981972102, 'strategy': 'mean_reversion', 'time_stop': 282, 'use_sma': True, 'use_atr': True, 'use_adx': True, 'use_ema': False, 'use_spike': True, 'rsi_required': False, 'edge_k': 1.1940351375340892, 'edge_cap': 0.9156585578264707, 'bull_strategy': 'mean_reversion', 'bull_bb_std_mult': 3.032624890039679, 'bull_rsi_os': 33, 'bull_rsi_ob': 64, 'bull_adx_thresh': 18.236440353528213, 'bull_atr_min_pct': 0.0017610260621017386, 'bull_atr_max_pct': 0.11445939256510297, 'bull_tp_mult': 1.3463823651027442, 'bull_tsl_mult': 0.15888013324486594, 'bull_time_stop': 168, 'bull_use_sma': False, 'bull_use_ema': True, 'bull_use_atr': True, 'bull_use_adx': False, 'bull_use_spike': False, 'bull_rsi_required': True, 'bear_strategy': 'mean_reversion', 'bear_bb_std_mult': 2.814754301278114, 'bear_rsi_os': 9, 'bear_rsi_ob': 71, 'bear_adx_thresh': 16.9667649747899, 'bear_atr_min_pct': 0.01613530819344628, 'bear_atr_max_pct': 0.04165140964771521, 'bear_tp_mult': 2.993801650937018, 'bear_tsl_mult': 0.7966791400611422, 'bear_time_stop': 25, 'bear_use_sma': True, 'bear_use_ema': False, 'bear_use_atr': True, 'bear_use_adx': False, 'bear_use_spike': True, 'bear_rsi_required': True, 'sideways_strategy': 'breakout', 'sideways_bb_std_mult': 3.1815134223389725, 'sideways_rsi_os': 15, 'sideways_rsi_ob': 81, 'sideways_adx_thresh': 20.602043723835717, 'sideways_atr_min_pct': 0.023975959752053647, 'sideways_atr_max_pct': 0.14586920228332537, 'sideways_tp_mult': 1.1473582456723452, 'sideways_tsl_mult': 0.20807783848950123, 'sideways_time_stop': 144, 'sideways_use_sma': False, 'sideways_use_ema': True, 'sideways_use_atr': False, 'sideways_use_adx': True, 'sideways_use_spike': False, 'sideways_rsi_required': True}.
[I 2025-08-30 19:04:14,124] Trial 315 finished with values: [-1000000000.0, 1000000000.0] and parameters: {'p_sma': 10, 'p_std': 58, 'p_atr': 10, 'p_adx': 16, 'rsi_period': 22, 'ema1': 27, 'ema2': 30, 'slip_atr_k': 0.22575399645033417, 'slip_spread_k': 0.16506044710166595, 'spread_hl_frac': 0.02561474766672343, 'bb_std_mult': 2.343572888616463, 'rsi_os': 47, 'rsi_ob': 84, 'vol_spike': 0.27338626690985307, 'adx_thresh': 16.91705221529823, 'atr_min_pct': 0.02335712698944517, 'atr_max_pct': 0.021841713685612357, 'tp_mult': 1.6110698171922584, 'tsl_mult': 0.03108008751819691, 'strategy': 'mean_reversion', 'time_stop': 285, 'use_sma': True, 'use_atr': True, 'use_adx': False, 'use_ema': False, 'use_spike': True, 'rsi_required': False, 'edge_k': 0.09262694354081386, 'edge_cap': 0.48958679639045144, 'bull_strategy': 'breakout', 'bull_bb_std_mult': 3.214389812058239, 'bull_rsi_os': 49, 'bull_rsi_ob': 59, 'bull_adx_thresh': 18.096939480313637, 'bull_atr_min_pct': 0.0020470457117578392, 'bull_atr_max_pct': 0.11391860578005528, 'bull_tp_mult': 2.6924662048872965, 'bull_tsl_mult': 0.5434266066595919, 'bull_time_stop': 172, 'bull_use_sma': False, 'bull_use_ema': True, 'bull_use_atr': True, 'bull_use_adx': False, 'bull_use_spike': False, 'bull_rsi_required': True, 'bear_strategy': 'breakout', 'bear_bb_std_mult': 2.811351555551792, 'bear_rsi_os': 9, 'bear_rsi_ob': 74, 'bear_adx_thresh': 16.970374953141555, 'bear_atr_min_pct': 0.014146759458338924, 'bear_atr_max_pct': 0.02910821525802795, 'bear_tp_mult': 1.340101182568325, 'bear_tsl_mult': 0.8562441488538827, 'bear_time_stop': 80, 'bear_use_sma': True, 'bear_use_ema': False, 'bear_use_atr': False, 'bear_use_adx': False, 'bear_use_spike': True, 'bear_rsi_required': True, 'sideways_strategy': 'breakout', 'sideways_bb_std_mult': 3.1736893886859248, 'sideways_rsi_os': 54, 'sideways_rsi_ob': 90, 'sideways_adx_thresh': 15.452846563586906, 'sideways_atr_min_pct': 0.005983647559678009, 'sideways_atr_max_pct': 0.010160144670630117, 'sideways_tp_mult': 1.0654174982771434, 'sideways_tsl_mult': 0.9813299852129314, 'sideways_time_stop': 141, 'sideways_use_sma': False, 'sideways_use_ema': True, 'sideways_use_atr': False, 'sideways_use_adx': True, 'sideways_use_spike': False, 'sideways_rsi_required': True}.
