[I 2025-08-30 19:48:54,984] Trial 693 finished with values: [-1000000000.0, 1000000000.0] and parameters: {'p_sma': 33, 'p_std': 9, 'p_atr': 18, 'p_adx': 17, 'rsi_period': 24, 'ema1': 8, 'ema2': 30, 'slip_atr_k': 0.07999789297742212, 'slip_spread_k': 0.19288516567421224, 'spread_hl_frac': 0.013812825398548518, 'bb_std_mult': 2.1462815766862686, 'rsi_os': 48, 'rsi_ob': 82, 'vol_spike': 0.2659656427673414, 'adx_thresh': 32.364432844202646, 'atr_min_pct': 0.024403922846000934, 'atr_max_pct': 0.09783169591791788, 'tp_mult': 2.2583508147873643, 'tsl_mult': 0.8060125296539652, 'strategy': 'mean_reversion', 'time_stop': 190, 'use_sma': True, 'use_atr': True, 'use_adx': True, 'use_ema': False, 'use_spike': True, 'rsi_required': False, 'edge_k': 0.1891130945492362, 'edge_cap': 0.8366714436401499, 'bull_strategy': 'breakout', 'bull_bb_std_mult': 3.1844730546617197, 'bull_rsi_os': 49, 'bull_rsi_ob': 47, 'bull_adx_thresh': 18.93796545824018, 'bull_atr_min_pct': 0.02629497071304119, 'bull_atr_max_pct': 0.10694328602919254, 'bull_tp_mult': 2.839041624535202, 'bull_tsl_mult': 0.47043843814531083, 'bull_time_stop': 36, 'bull_use_sma': False, 'bull_use_ema': True, 'bull_use_atr': True, 'bull_use_adx': False, 'bull_use_spike': False, 'bull_rsi_required': True, 'bear_strategy': 'breakout', 'bear_bb_std_mult': 2.7259382405426242, 'bear_rsi_os': 21, 'bear_rsi_ob': 85, 'bear_adx_thresh': 33.12186897629611, 'bear_atr_min_pct': 0.01548128601007774, 'bear_atr_max_pct': 0.02619614418178484, 'bear_tp_mult': 2.780855627145722, 'bear_tsl_mult': 0.7561182465195477, 'bear_time_stop': 195, 'bear_use_sma': True, 'bear_use_ema': True, 'bear_use_atr': True, 'bear_use_adx': False, 'bear_use_spike': False, 'bear_rsi_required': True, 'sideways_strategy': 'breakout', 'sideways_bb_std_mult': 3.047532228413468, 'sideways_rsi_os': 32, 'sideways_rsi_ob': 58, 'sideways_adx_thresh': 20.433931399437302, 'sideways_atr_min_pct': 0.02650604856020404, 'sideways_atr_max_pct': 0.14662908021647417, 'sideways_tp_mult': 1.1599602498280372, 'sideways_tsl_mult': 0.48658351107862957, 'sideways_time_stop': 140, 'sideways_use_sma': False, 'sideways_use_ema': True, 'sideways_use_atr': True, 'sideways_use_adx': False, 'sideways_use_spike': False, 'sideways_rsi_required': True}.
[I 2025-08-30 19:48:57,320] Trial 694 finished with values: [-0.029248141521695636, 0.02918355054971162] and parameters: {'p_sma': 33, 'p_std': 30, 'p_atr': 16, 'p_adx': 17, 'rsi_period': 24, 'ema1': 13, 'ema2': 15, 'slip_atr_k': 0.16028908823253335, 'slip_spread_k': 0.18083174292087498, 'spread_hl_frac': 0.022663505823175122, 'bb_std_mult': 2.145001851650365, 'rsi_os': 42, 'rsi_ob': 63, 'vol_spike': 0.26464641643762954, 'adx_thresh': 12.348333280999805, 'atr_min_pct': 0.024301815907435957, 'atr_max_pct': 0.08829409733373067, 'tp_mult': 2.7855554082497433, 'tsl_mult': 0.04344040917864023, 'strategy': 'breakout', 'time_stop': 188, 'use_sma': True, 'use_atr': True, 'use_adx': True, 'use_ema': False, 'use_spike': True, 'rsi_required': False, 'edge_k': 1.6806454080434925, 'edge_cap': 0.4870122548790737, 'bull_strategy': 'breakout', 'bull_bb_std_mult': 2.301704884972285, 'bull_rsi_os': 33, 'bull_rsi_ob': 70, 'bull_adx_thresh': 18.879132123779254, 'bull_atr_min_pct': 0.0014480334466930142, 'bull_atr_max_pct': 0.1286057808994681, 'bull_tp_mult': 2.8379247980657647, 'bull_tsl_mult': 0.4669591688101028, 'bull_time_stop': 167, 'bull_use_sma': False, 'bull_use_ema': True, 'bull_use_atr': True, 'bull_use_adx': False, 'bull_use_spike': False, 'bull_rsi_required': True, 'bear_strategy': 'breakout', 'bear_bb_std_mult': 2.7403826606616932, 'bear_rsi_os': 9, 'bear_rsi_ob': 52, 'bear_adx_thresh': 17.46247704815384, 'bear_atr_min_pct': 0.01748773076330332, 'bear_atr_max_pct': 0.04640173228208483, 'bear_tp_mult': 1.7787206336881962, 'bear_tsl_mult': 0.7541868677191557, 'bear_time_stop': 196, 'bear_use_sma': True, 'bear_use_ema': True, 'bear_use_atr': False, 'bear_use_adx': True, 'bear_use_spike': False, 'bear_rsi_required': True, 'sideways_strategy': 'breakout', 'sideways_bb_std_mult': 3.0417019082940575, 'sideways_rsi_os': 20, 'sideways_rsi_ob': 57, 'sideways_adx_thresh': 28.548016855244832, 'sideways_atr_min_pct': 0.0013123943972790807, 'sideways_atr_max_pct': 0.1454480568311365, 'sideways_tp_mult': 1.170282275499797, 'sideways_tsl_mult': 0.2359397738504393, 'sideways_time_stop': 170, 'sideways_use_sma': False, 'sideways_use_ema': True, 'sideways_use_atr': True, 'sideways_use_adx': False, 'sideways_use_spike': False, 'sideways_rsi_required': True}.
[I 2025-08-30 19:48:57,469] Trial 695 finished with values: [-1000000000.0, 1000000000.0] and parameters: {'p_sma': 9, 'p_std': 17, 'p_atr': 18, 'p_adx': 17, 'rsi_period': 15, 'ema1': 28, 'ema2': 30, 'slip_atr_k': 0.0619741855690881, 'slip_spread_k': 0.10628585384428779, 'spread_hl_frac': 0.024342467697373797, 'bb_std_mult': 0.6705677071928746, 'rsi_os': 8, 'rsi_ob': 82, 'vol_spike': 0.26453423186446984, 'adx_thresh': 12.25152938463857, 'atr_min_pct': 0.02432248235093802, 'atr_max_pct': 0.094274645383119, 'tp_mult': 1.9950830779202775, 'tsl_mult': 0.8804017372712106, 'strategy': 'breakout', 'time_stop': 39, 'use_sma': True, 'use_atr': True, 'use_adx': True, 'use_ema': False, 'use_spike': True, 'rsi_required': False, 'edge_k': 0.17465712950834683, 'edge_cap': 0.48723396770385563, 'bull_strategy': 'breakout', 'bull_bb_std_mult': 3.109784369479421, 'bull_rsi_os': 33, 'bull_rsi_ob': 47, 'bull_adx_thresh': 20.1896823039999, 'bull_atr_min_pct': 0.013028079627676218, 'bull_atr_max_pct': 0.12100147955849519, 'bull_tp_mult': 2.7706556023838567, 'bull_tsl_mult': 0.4781200285021884, 'bull_time_stop': 163, 'bull_use_sma': False, 'bull_use_ema': True, 'bull_use_atr': True, 'bull_use_adx': False, 'bull_use_spike': False, 'bull_rsi_required': False, 'bear_strategy': 'breakout', 'bear_bb_std_mult': 1.1337136282753302, 'bear_rsi_os': 32, 'bear_rsi_ob': 62, 'bear_adx_thresh': 28.21802496601545, 'bear_atr_min_pct': 0.017427444046193785, 'bear_atr_max_pct': 0.11277977459156323, 'bear_tp_mult': 2.7800032455182935, 'bear_tsl_mult': 0.7972761730033986, 'bear_time_stop': 196, 'bear_use_sma': True, 'bear_use_ema': True, 'bear_use_atr': False, 'bear_use_adx': True, 'bear_use_spike': False, 'bear_rsi_required': False, 'sideways_strategy': 'breakout', 'sideways_bb_std_mult': 1.310742537988696, 'sideways_rsi_os': 18, 'sideways_rsi_ob': 68, 'sideways_adx_thresh': 19.20733259776743, 'sideways_atr_min_pct': 0.01262789770867909, 'sideways_atr_max_pct': 0.12460773919778069, 'sideways_tp_mult': 1.2792921887076099, 'sideways_tsl_mult': 0.2525687010756442, 'sideways_time_stop': 171, 'sideways_use_sma': False, 'sideways_use_ema': True, 'sideways_use_atr': True, 'sideways_use_adx': False, 'sideways_use_spike': False, 'sideways_rsi_required': True}.
[I 2025-08-30 19:48:58,631] Trial 699 finished with values: [-1000000000.0, 1000000000.0] and parameters: {'p_sma': 8, 'p_std': 42, 'p_atr': 11, 'p_adx': 24, 'rsi_period': 69, 'ema1': 11, 'ema2': 32, 'slip_atr_k': 0.22000689606087073, 'slip_spread_k': 0.1631046900063703, 'spread_hl_frac': 0.04352343053271105, 'bb_std_mult': 1.8272915065188085, 'rsi_os': 39, 'rsi_ob': 50, 'vol_spike': 0.0769412862493381, 'adx_thresh': 29.31302476370655, 'atr_min_pct': 0.022487722908029275, 'atr_max_pct': 0.09927572775159293, 'tp_mult': 2.192369156437258, 'tsl_mult': 0.9010850746739397, 'strategy': 'mean_reversion', 'time_stop': 173, 'use_sma': False, 'use_atr': True, 'use_adx': True, 'use_ema': False, 'use_spike': True, 'rsi_required': True, 'edge_k': 0.11202193735624734, 'edge_cap': 0.4618771285320894, 'bull_strategy': 'mean_reversion', 'bull_bb_std_mult': 2.7536374547085782, 'bull_rsi_os': 31, 'bull_rsi_ob': 55, 'bull_adx_thresh': 29.481895637092745, 'bull_atr_min_pct': 0.0008974148748001969, 'bull_atr_max_pct': 0.0638247428899473, 'bull_tp_mult': 1.676339505684436, 'bull_tsl_mult': 0.563127221656259, 'bull_time_stop': 77, 'bull_use_sma': False, 'bull_use_ema': True, 'bull_use_atr': True, 'bull_use_adx': True, 'bull_use_spike': False, 'bull_rsi_required': False, 'bear_strategy': 'breakout', 'bear_bb_std_mult': 0.9103891890082232, 'bear_rsi_os': 48, 'bear_rsi_ob': 77, 'bear_adx_thresh': 17.949489087604356, 'bear_atr_min_pct': 0.02316993955756494, 'bear_atr_max_pct': 0.03683921016404877, 'bear_tp_mult': 1.30860991877206, 'bear_tsl_mult': 0.782828343360253, 'bear_time_stop': 203, 'bear_use_sma': True, 'bear_use_ema': False, 'bear_use_atr': False, 'bear_use_adx': False, 'bear_use_spike': False, 'bear_rsi_required': False, 'sideways_strategy': 'breakout', 'sideways_bb_std_mult': 3.334661259865224, 'sideways_rsi_os': 12, 'sideways_rsi_ob': 60, 'sideways_adx_thresh': 21.946990769061983, 'sideways_atr_min_pct': 0.004101650857902792, 'sideways_atr_max_pct': 0.14271920413473527, 'sideways_tp_mult': 2.050251787882671, 'sideways_tsl_mult': 0.9685657948946856, 'sideways_time_stop': 150, 'sideways_use_sma': False, 'sideways_use_ema': True, 'sideways_use_atr': True, 'sideways_use_adx': True, 'sideways_use_spike': True, 'sideways_rsi_required': True}.
[I 2025-08-30 19:49:30,482] Trial 696 finished with values: [-1000000000.0, 1000000000.0] and parameters: {'p_sma': 9, 'p_std': 17, 'p_atr': 12, 'p_adx': 25, 'rsi_period': 63, 'ema1': 11, 'ema2': 40, 'slip_atr_k': 0.059469479652716026, 'slip_spread_k': 0.10552373605996485, 'spread_hl_frac': 0.022800064428617803, 'bb_std_mult': 3.1194692732574394, 'rsi_os': 19, 'rsi_ob': 47, 'vol_spike': 0.2750481015175594, 'adx_thresh': 30.85010459621593, 'atr_min_pct': 0.022471207037267266, 'atr_max_pct': 0.0933929165627641, 'tp_mult': 2.0855961422468883, 'tsl_mult': 0.8960690659555154, 'strategy': 'breakout', 'time_stop': 184, 'use_sma': False, 'use_atr': True, 'use_adx': True, 'use_ema': False, 'use_spike': True, 'rsi_required': False, 'edge_k': 0.31532845851892666, 'edge_cap': 0.4646685087390583, 'bull_strategy': 'breakout', 'bull_bb_std_mult': 3.1108838880733973, 'bull_rsi_os': 22, 'bull_rsi_ob': 49, 'bull_adx_thresh': 17.565242161133778, 'bull_atr_min_pct': 0.0015396607104886527, 'bull_atr_max_pct': 0.12075631269388568, 'bull_tp_mult': 2.4053032816401134, 'bull_tsl_mult': 0.5671783306793008, 'bull_time_stop': 164, 'bull_use_sma': False, 'bull_use_ema': True, 'bull_use_atr': True, 'bull_use_adx': False, 'bull_use_spike': False, 'bull_rsi_required': False, 'bear_strategy': 'breakout', 'bear_bb_std_mult': 2.8738560132594997, 'bear_rsi_os': 50, 'bear_rsi_ob': 52, 'bear_adx_thresh': 17.855087420872408, 'bear_atr_min_pct': 0.01385273749393013, 'bear_atr_max_pct': 0.036882699549906875, 'bear_tp_mult': 1.310464249696809, 'bear_tsl_mult': 0.792434911066082, 'bear_time_stop': 202, 'bear_use_sma': True, 'bear_use_ema': True, 'bear_use_atr': False, 'bear_use_adx': True, 'bear_use_spike': False, 'bear_rsi_required': False, 'sideways_strategy': 'breakout', 'sideways_bb_std_mult': 1.1936039625533605, 'sideways_rsi_os': 12, 'sideways_rsi_ob': 57, 'sideways_adx_thresh': 10.878766200535374, 'sideways_atr_min_pct': 0.01534133095687722, 'sideways_atr_max_pct': 0.057584944331264626, 'sideways_tp_mult': 1.2719598532297975, 'sideways_tsl_mult': 0.9985104833236002, 'sideways_time_stop': 131, 'sideways_use_sma': False, 'sideways_use_ema': True, 'sideways_use_atr': True, 'sideways_use_adx': False, 'sideways_use_spike': False, 'sideways_rsi_required': True}.
[I 2025-08-30 19:49:30,777] Trial 698 finished with values: [-1000000000.0, 1000000000.0] and parameters: {'p_sma': 10, 'p_std': 34, 'p_atr': 10, 'p_adx': 18, 'rsi_period': 63, 'ema1': 21, 'ema2': 32, 'slip_atr_k': 0.06195169048540898, 'slip_spread_k': 0.11678362382458904, 'spread_hl_frac': 0.023826311471730685, 'bb_std_mult': 3.141823749883627, 'rsi_os': 9, 'rsi_ob': 85, 'vol_spike': 0.22083222067325808, 'adx_thresh': 30.826767714994624, 'atr_min_pct': 0.008900863261860221, 'atr_max_pct': 0.093814966385582, 'tp_mult': 2.089950957899896, 'tsl_mult': 0.8794842287064513, 'strategy': 'breakout', 'time_stop': 46, 'use_sma': False, 'use_atr': True, 'use_adx': True, 'use_ema': False, 'use_spike': True, 'rsi_required': False, 'edge_k': 0.33882437204449467, 'edge_cap': 0.5031725115471885, 'bull_strategy': 'mean_reversion', 'bull_bb_std_mult': 3.093540248524004, 'bull_rsi_os': 5, 'bull_rsi_ob': 47, 'bull_adx_thresh': 17.69314787498315, 'bull_atr_min_pct': 0.007101512515375637, 'bull_atr_max_pct': 0.07812132921611066, 'bull_tp_mult': 2.761787577409231, 'bull_tsl_mult': 0.5595637788221436, 'bull_time_stop': 116, 'bull_use_sma': False, 'bull_use_ema': True, 'bull_use_atr': True, 'bull_use_adx': True, 'bull_use_spike': False, 'bull_rsi_required': False, 'bear_strategy': 'breakout', 'bear_bb_std_mult': 2.851289560497713, 'bear_rsi_os': 50, 'bear_rsi_ob': 49, 'bear_adx_thresh': 11.596060940122241, 'bear_atr_min_pct': 0.022990612790231027, 'bear_atr_max_pct': 0.11254510367203911, 'bear_tp_mult': 2.7296501745840627, 'bear_tsl_mult': 0.2722633291260744, 'bear_time_stop': 199, 'bear_use_sma': True, 'bear_use_ema': True, 'bear_use_atr': False, 'bear_use_adx': True, 'bear_use_spike': False, 'bear_rsi_required': False, 'sideways_strategy': 'breakout', 'sideways_bb_std_mult': 1.3123620177765882, 'sideways_rsi_os': 37, 'sideways_rsi_ob': 68, 'sideways_adx_thresh': 5.012711738932433, 'sideways_atr_min_pct': 0.015100987407312846, 'sideways_atr_max_pct': 0.06559528489102953, 'sideways_tp_mult': 1.2612362669351158, 'sideways_tsl_mult': 0.9687653847068379, 'sideways_time_stop': 148, 'sideways_use_sma': False, 'sideways_use_ema': True, 'sideways_use_atr': True, 'sideways_use_adx': False, 'sideways_use_spike': False, 'sideways_rsi_required': True}.
[I 2025-08-30 19:49:31,420] Trial 697 finished with values: [-1000000000.0, 1000000000.0] and parameters: {'p_sma': 9, 'p_std': 32, 'p_atr': 10, 'p_adx': 17, 'rsi_period': 63, 'ema1': 11, 'ema2': 15, 'slip_atr_k': 0.2199114966361742, 'slip_spread_k': 0.8567606770763498, 'spread_hl_frac': 0.028242975560067298, 'bb_std_mult': 2.0365458054742547, 'rsi_os': 20, 'rsi_ob': 63, 'vol_spike': 0.10853504349233314, 'adx_thresh': 31.094237925845185, 'atr_min_pct': 0.022661863435942148, 'atr_max_pct': 0.08082658559890442, 'tp_mult': 2.0727609041993964, 'tsl_mult': 0.8976111171323529, 'strategy': 'breakout', 'time_stop': 184, 'use_sma': False, 'use_atr': True, 'use_adx': True, 'use_ema': False, 'use_spike': True, 'rsi_required': False, 'edge_k': 1.6758177222432762, 'edge_cap': 0.8884384684368964, 'bull_strategy': 'breakout', 'bull_bb_std_mult': 3.110487263907766, 'bull_rsi_os': 32, 'bull_rsi_ob': 46, 'bull_adx_thresh': 20.223373542818486, 'bull_atr_min_pct': 0.007000897487300666, 'bull_atr_max_pct': 0.05381020329494168, 'bull_tp_mult': 2.7688505942138413, 'bull_tsl_mult': 0.6865636355359159, 'bull_time_stop': 116, 'bull_use_sma': False, 'bull_use_ema': True, 'bull_use_atr': True, 'bull_use_adx': False, 'bull_use_spike': False, 'bull_rsi_required': False, 'bear_strategy': 'breakout', 'bear_bb_std_mult': 0.8925147553610389, 'bear_rsi_os': 32, 'bear_rsi_ob': 93, 'bear_adx_thresh': 6.384353614195849, 'bear_atr_min_pct': 0.017499167392470812, 'bear_atr_max_pct': 0.037977115220345914, 'bear_tp_mult': 2.7210829623772783, 'bear_tsl_mult': 0.47330254537834004, 'bear_time_stop': 204, 'bear_use_sma': True, 'bear_use_ema': True, 'bear_use_atr': False, 'bear_use_adx': True, 'bear_use_spike': False, 'bear_rsi_required': False, 'sideways_strategy': 'breakout', 'sideways_bb_std_mult': 0.5576392430511792, 'sideways_rsi_os': 37, 'sideways_rsi_ob': 68, 'sideways_adx_thresh': 22.265143686083245, 'sideways_atr_min_pct': 0.0013042929438384083, 'sideways_atr_max_pct': 0.11440751342591812, 'sideways_tp_mult': 1.262271314597021, 'sideways_tsl_mult': 0.24588894251138543, 'sideways_time_stop': 168, 'sideways_use_sma': False, 'sideways_use_ema': True, 'sideways_use_atr': True, 'sideways_use_adx': False, 'sideways_use_spike': False, 'sideways_rsi_required': True}.
[I 2025-08-30 19:49:32,878] Trial 700 finished with values: [-1000000000.0, 1000000000.0] and parameters: {'p_sma': 11, 'p_std': 34, 'p_atr': 10, 'p_adx': 18, 'rsi_period': 21, 'ema1': 19, 'ema2': 39, 'slip_atr_k': 0.06565612998157723, 'slip_spread_k': 0.5128171114656148, 'spread_hl_frac': 0.008879166553185065, 'bb_std_mult': 3.129884265783742, 'rsi_os': 9, 'rsi_ob': 85, 'vol_spike': 0.27412949015348315, 'adx_thresh': 24.92141465130633, 'atr_min_pct': 0.023405754308367954, 'atr_max_pct': 0.043891670461598524, 'tp_mult': 2.094097491641213, 'tsl_mult': 0.8631998482131532, 'strategy': 'mean_reversion', 'time_stop': 182, 'use_sma': False, 'use_atr': True, 'use_adx': True, 'use_ema': False, 'use_spike': True, 'rsi_required': False, 'edge_k': 0.05552869113171209, 'edge_cap': 0.9500994098674722, 'bull_strategy': 'mean_reversion', 'bull_bb_std_mult': 2.945056203990672, 'bull_rsi_os': 21, 'bull_rsi_ob': 46, 'bull_adx_thresh': 15.787468535080531, 'bull_atr_min_pct': 0.002290213708271664, 'bull_atr_max_pct': 0.05335368121388513, 'bull_tp_mult': 2.6731563888889744, 'bull_tsl_mult': 0.6840317705463416, 'bull_time_stop': 209, 'bull_use_sma': False, 'bull_use_ema': True, 'bull_use_atr': True, 'bull_use_adx': False, 'bull_use_spike': False, 'bull_rsi_required': True, 'bear_strategy': 'breakout', 'bear_bb_std_mult': 2.8954427594042755, 'bear_rsi_os': 46, 'bear_rsi_ob': 93, 'bear_adx_thresh': 16.287304978638094, 'bear_atr_min_pct': 0.004961072671094266, 'bear_atr_max_pct': 0.03325374366643816, 'bear_tp_mult': 2.719970603583764, 'bear_tsl_mult': 0.7355773131633129, 'bear_time_stop': 182, 'bear_use_sma': True, 'bear_use_ema': True, 'bear_use_atr': True, 'bear_use_adx': False, 'bear_use_spike': False, 'bear_rsi_required': True, 'sideways_strategy': 'breakout', 'sideways_bb_std_mult': 1.9417762845403967, 'sideways_rsi_os': 22, 'sideways_rsi_ob': 78, 'sideways_adx_thresh': 5.233461736841317, 'sideways_atr_min_pct': 0.0022756466476890453, 'sideways_atr_max_pct': 0.13930877215939616, 'sideways_tp_mult': 2.3535837580669683, 'sideways_tsl_mult': 0.9995156630706179, 'sideways_time_stop': 159, 'sideways_use_sma': False, 'sideways_use_ema': True, 'sideways_use_atr': True, 'sideways_use_adx': False, 'sideways_use_spike': False, 'sideways_rsi_required': True}.
[I 2025-08-30 19:49:33,637] Trial 701 finished with values: [-1000000000.0, 1000000000.0] and parameters: {'p_sma': 26, 'p_std': 33, 'p_atr': 10, 'p_adx': 22, 'rsi_period': 7, 'ema1': 27, 'ema2': 48, 'slip_atr_k': 0.0658172332675315, 'slip_spread_k': 0.13173266955039778, 'spread_hl_frac': 0.008673718642800605, 'bb_std_mult': 3.539688818159803, 'rsi_os': 50, 'rsi_ob': 85, 'vol_spike': 0.11874348984939205, 'adx_thresh': 34.93528915247843, 'atr_min_pct': 0.023597545764090136, 'atr_max_pct': 0.11391889247872253, 'tp_mult': 1.5817411778460395, 'tsl_mult': 0.6137444280313896, 'strategy': 'mean_reversion', 'time_stop': 266, 'use_sma': False, 'use_atr': True, 'use_adx': True, 'use_ema': False, 'use_spike': True, 'rsi_required': False, 'edge_k': 0.039409493985306215, 'edge_cap': 0.5119122688535995, 'bull_strategy': 'mean_reversion', 'bull_bb_std_mult': 1.8901404896084755, 'bull_rsi_os': 32, 'bull_rsi_ob': 79, 'bull_adx_thresh': 19.650930866133685, 'bull_atr_min_pct': 0.016737660560969852, 'bull_atr_max_pct': 0.04057211804306544, 'bull_tp_mult': 2.791742606641417, 'bull_tsl_mult': 0.6900211762431938, 'bull_time_stop': 175, 'bull_use_sma': False, 'bull_use_ema': True, 'bull_use_atr': False, 'bull_use_adx': False, 'bull_use_spike': False, 'bull_rsi_required': True, 'bear_strategy': 'breakout', 'bear_bb_std_mult': 2.821442558678006, 'bear_rsi_os': 50, 'bear_rsi_ob': 78, 'bear_adx_thresh': 6.300781191078009, 'bear_atr_min_pct': 0.004876739811845854, 'bear_atr_max_pct': 0.07773622848933483, 'bear_tp_mult': 2.7108335508160737, 'bear_tsl_mult': 0.7108913264825197, 'bear_time_stop': 178, 'bear_use_sma': True, 'bear_use_ema': True, 'bear_use_atr': True, 'bear_use_adx': False, 'bear_use_spike': False, 'bear_rsi_required': True, 'sideways_strategy': 'breakout', 'sideways_bb_std_mult': 0.5892597109588806, 'sideways_rsi_os': 22, 'sideways_rsi_ob': 81, 'sideways_adx_thresh': 13.523047531086618, 'sideways_atr_min_pct': 0.0021691128968075526, 'sideways_atr_max_pct': 0.06681041503702324, 'sideways_tp_mult': 1.5628755098967173, 'sideways_tsl_mult': 0.9392456464638617, 'sideways_time_stop': 115, 'sideways_use_sma': False, 'sideways_use_ema': True, 'sideways_use_atr': True, 'sideways_use_adx': False, 'sideways_use_spike': False, 'sideways_rsi_required': True}.
