[I 2025-08-30 19:36:15,533] Trial 584 finished with values: [-0.03236330228376505, 0.03224838612081755] and parameters: {'p_sma': 8, 'p_std': 16, 'p_atr': 17, 'p_adx': 20, 'rsi_period': 26, 'ema1': 7, 'ema2': 32, 'slip_atr_k': 0.08524657284725878, 'slip_spread_k': 0.7247671453634112, 'spread_hl_frac': 0.04186707877278584, 'bb_std_mult': 2.0443447598846696, 'rsi_os': 48, 'rsi_ob': 73, 'vol_spike': 0.26468753606322115, 'adx_thresh': 15.792538895477849, 'atr_min_pct': 0.01884296075706967, 'atr_max_pct': 0.1243962393403697, 'tp_mult': 2.3205591734881565, 'tsl_mult': 0.8631805366177986, 'strategy': 'mean_reversion', 'time_stop': 152, 'use_sma': True, 'use_atr': True, 'use_adx': False, 'use_ema': False, 'use_spike': True, 'rsi_required': False, 'edge_k': 0.10797971738160222, 'edge_cap': 0.5533697969848984, 'bull_strategy': 'breakout', 'bull_bb_std_mult': 1.9453056096784618, 'bull_rsi_os': 53, 'bull_rsi_ob': 46, 'bull_adx_thresh': 16.450095011040307, 'bull_atr_min_pct': 0.011945420160162468, 'bull_atr_max_pct': 0.12115966602762442, 'bull_tp_mult': 1.7050502223498838, 'bull_tsl_mult': 0.5155653639631649, 'bull_time_stop': 179, 'bull_use_sma': False, 'bull_use_ema': False, 'bull_use_atr': True, 'bull_use_adx': False, 'bull_use_spike': True, 'bull_rsi_required': False, 'bear_strategy': 'mean_reversion', 'bear_bb_std_mult': 2.1363495559995744, 'bear_rsi_os': 49, 'bear_rsi_ob': 65, 'bear_adx_thresh': 8.851385175396238, 'bear_atr_min_pct': 0.013122836029103104, 'bear_atr_max_pct': 0.052210794633402696, 'bear_tp_mult': 2.612861434111092, 'bear_tsl_mult': 0.25822371997402094, 'bear_time_stop': 183, 'bear_use_sma': True, 'bear_use_ema': True, 'bear_use_atr': True, 'bear_use_adx': False, 'bear_use_spike': True, 'bear_rsi_required': True, 'sideways_strategy': 'breakout', 'sideways_bb_std_mult': 3.4731439670535424, 'sideways_rsi_os': 36, 'sideways_rsi_ob': 62, 'sideways_adx_thresh': 19.755847113199437, 'sideways_atr_min_pct': 0.0013697575239339837, 'sideways_atr_max_pct': 0.030011611819221337, 'sideways_tp_mult': 1.0958855721176144, 'sideways_tsl_mult': 0.3675608602157415, 'sideways_time_stop': 264, 'sideways_use_sma': True, 'sideways_use_ema': False, 'sideways_use_atr': True, 'sideways_use_adx': True, 'sideways_use_spike': False, 'sideways_rsi_required': True}.
[I 2025-08-30 19:36:16,590] Trial 587 finished with values: [-1000000000.0, 1000000000.0] and parameters: {'p_sma': 7, 'p_std': 33, 'p_atr': 8, 'p_adx': 15, 'rsi_period': 26, 'ema1': 20, 'ema2': 25, 'slip_atr_k': 0.0707694708378916, 'slip_spread_k': 0.15314698327306184, 'spread_hl_frac': 0.011679988098510695, 'bb_std_mult': 2.751499703788885, 'rsi_os': 52, 'rsi_ob': 90, 'vol_spike': 0.2730816892735337, 'adx_thresh': 32.5559346974379, 'atr_min_pct': 0.012526416275920162, 'atr_max_pct': 0.09492858649098843, 'tp_mult': 1.336569426886871, 'tsl_mult': 0.8943828084153571, 'strategy': 'mean_reversion', 'time_stop': 155, 'use_sma': False, 'use_atr': True, 'use_adx': True, 'use_ema': False, 'use_spike': True, 'rsi_required': False, 'edge_k': 0.5742558022320197, 'edge_cap': 0.8232707081223494, 'bull_strategy': 'breakout', 'bull_bb_std_mult': 3.135560035328827, 'bull_rsi_os': 31, 'bull_rsi_ob': 86, 'bull_adx_thresh': 19.462975376089705, 'bull_atr_min_pct': 0.018511534529150275, 'bull_atr_max_pct': 0.11381198065653071, 'bull_tp_mult': 1.2082860222555545, 'bull_tsl_mult': 0.541172641030482, 'bull_time_stop': 285, 'bull_use_sma': False, 'bull_use_ema': True, 'bull_use_atr': True, 'bull_use_adx': False, 'bull_use_spike': False, 'bull_rsi_required': False, 'bear_strategy': 'breakout', 'bear_bb_std_mult': 3.5158559039592765, 'bear_rsi_os': 51, 'bear_rsi_ob': 66, 'bear_adx_thresh': 18.16987169888626, 'bear_atr_min_pct': 0.006202994731014202, 'bear_atr_max_pct': 0.03163112839478428, 'bear_tp_mult': 2.6590865376423305, 'bear_tsl_mult': 0.6832109700550808, 'bear_time_stop': 171, 'bear_use_sma': True, 'bear_use_ema': False, 'bear_use_atr': False, 'bear_use_adx': False, 'bear_use_spike': True, 'bear_rsi_required': True, 'sideways_strategy': 'breakout', 'sideways_bb_std_mult': 2.9709223997681113, 'sideways_rsi_os': 35, 'sideways_rsi_ob': 58, 'sideways_adx_thresh': 22.667818541137304, 'sideways_atr_min_pct': 0.01137728064924689, 'sideways_atr_max_pct': 0.14551629130680602, 'sideways_tp_mult': 1.0880305728715833, 'sideways_tsl_mult': 0.9150068416456845, 'sideways_time_stop': 240, 'sideways_use_sma': False, 'sideways_use_ema': True, 'sideways_use_atr': True, 'sideways_use_adx': False, 'sideways_use_spike': False, 'sideways_rsi_required': True}.
[I 2025-08-30 19:36:16,624] Trial 588 finished with values: [-1000000000.0, 1000000000.0] and parameters: {'p_sma': 7, 'p_std': 53, 'p_atr': 10, 'p_adx': 20, 'rsi_period': 26, 'ema1': 28, 'ema2': 52, 'slip_atr_k': 0.06970247308264527, 'slip_spread_k': 0.3311384460934564, 'spread_hl_frac': 0.02542394173928069, 'bb_std_mult': 2.809874280853776, 'rsi_os': 50, 'rsi_ob': 71, 'vol_spike': 0.27086881140511454, 'adx_thresh': 32.55410668484273, 'atr_min_pct': 0.013636312939677583, 'atr_max_pct': 0.07575435053383667, 'tp_mult': 2.4562364817502935, 'tsl_mult': 0.8996168989476001, 'strategy': 'mean_reversion', 'time_stop': 183, 'use_sma': False, 'use_atr': True, 'use_adx': True, 'use_ema': False, 'use_spike': True, 'rsi_required': False, 'edge_k': 1.059241245509413, 'edge_cap': 0.4899888504962858, 'bull_strategy': 'breakout', 'bull_bb_std_mult': 3.138247319033758, 'bull_rsi_os': 31, 'bull_rsi_ob': 86, 'bull_adx_thresh': 19.48561132526208, 'bull_atr_min_pct': 0.012080525783962431, 'bull_atr_max_pct': 0.052429997186079366, 'bull_tp_mult': 2.7545545801324063, 'bull_tsl_mult': 0.3416295238886485, 'bull_time_stop': 180, 'bull_use_sma': False, 'bull_use_ema': True, 'bull_use_atr': True, 'bull_use_adx': False, 'bull_use_spike': False, 'bull_rsi_required': False, 'bear_strategy': 'breakout', 'bear_bb_std_mult': 3.4915782351963545, 'bear_rsi_os': 52, 'bear_rsi_ob': 75, 'bear_adx_thresh': 17.991424004551128, 'bear_atr_min_pct': 0.015504111943675899, 'bear_atr_max_pct': 0.05240828015325097, 'bear_tp_mult': 2.459832068839079, 'bear_tsl_mult': 0.8354111990865967, 'bear_time_stop': 196, 'bear_use_sma': True, 'bear_use_ema': False, 'bear_use_atr': False, 'bear_use_adx': False, 'bear_use_spike': True, 'bear_rsi_required': True, 'sideways_strategy': 'breakout', 'sideways_bb_std_mult': 2.988301240882828, 'sideways_rsi_os': 35, 'sideways_rsi_ob': 79, 'sideways_adx_thresh': 11.050877331071474, 'sideways_atr_min_pct': 0.0117733903611218, 'sideways_atr_max_pct': 0.1448139603987392, 'sideways_tp_mult': 1.11353650517944, 'sideways_tsl_mult': 0.9168921859297418, 'sideways_time_stop': 19, 'sideways_use_sma': False, 'sideways_use_ema': True, 'sideways_use_atr': True, 'sideways_use_adx': False, 'sideways_use_spike': False, 'sideways_rsi_required': True}.
[I 2025-08-30 19:36:16,636] Trial 589 finished with values: [-1000000000.0, 1000000000.0] and parameters: {'p_sma': 5, 'p_std': 28, 'p_atr': 8, 'p_adx': 19, 'rsi_period': 68, 'ema1': 20, 'ema2': 40, 'slip_atr_k': 0.07105641965443521, 'slip_spread_k': 0.1551905867024523, 'spread_hl_frac': 0.02537517176477598, 'bb_std_mult': 1.9531934579587742, 'rsi_os': 29, 'rsi_ob': 50, 'vol_spike': 0.2720431674293257, 'adx_thresh': 34.952990514134214, 'atr_min_pct': 0.0018864044831409157, 'atr_max_pct': 0.0943010556531021, 'tp_mult': 2.383212294404574, 'tsl_mult': 0.8235160059082522, 'strategy': 'mean_reversion', 'time_stop': 69, 'use_sma': False, 'use_atr': True, 'use_adx': True, 'use_ema': False, 'use_spike': True, 'rsi_required': False, 'edge_k': 1.7692234518030574, 'edge_cap': 0.30455897392393383, 'bull_strategy': 'mean_reversion', 'bull_bb_std_mult': 3.133560747636657, 'bull_rsi_os': 38, 'bull_rsi_ob': 46, 'bull_adx_thresh': 19.421192559913163, 'bull_atr_min_pct': 0.018471083381404598, 'bull_atr_max_pct': 0.0541904023004548, 'bull_tp_mult': 2.754496838452335, 'bull_tsl_mult': 0.5675619022709297, 'bull_time_stop': 184, 'bull_use_sma': False, 'bull_use_ema': True, 'bull_use_atr': False, 'bull_use_adx': True, 'bull_use_spike': False, 'bull_rsi_required': True, 'bear_strategy': 'breakout', 'bear_bb_std_mult': 2.8362339569090134, 'bear_rsi_os': 51, 'bear_rsi_ob': 75, 'bear_adx_thresh': 18.410658566978938, 'bear_atr_min_pct': 0.015529931137992817, 'bear_atr_max_pct': 0.031099654372419648, 'bear_tp_mult': 2.6698021957358926, 'bear_tsl_mult': 0.17788607352937846, 'bear_time_stop': 116, 'bear_use_sma': True, 'bear_use_ema': False, 'bear_use_atr': False, 'bear_use_adx': False, 'bear_use_spike': False, 'bear_rsi_required': True, 'sideways_strategy': 'breakout', 'sideways_bb_std_mult': 2.9704214332104675, 'sideways_rsi_os': 31, 'sideways_rsi_ob': 79, 'sideways_adx_thresh': 7.497550123345755, 'sideways_atr_min_pct': 0.002308571923971532, 'sideways_atr_max_pct': 0.13656692340990215, 'sideways_tp_mult': 1.049818251002123, 'sideways_tsl_mult': 0.9190263369363938, 'sideways_time_stop': 175, 'sideways_use_sma': False, 'sideways_use_ema': True, 'sideways_use_atr': True, 'sideways_use_adx': False, 'sideways_use_spike': True, 'sideways_rsi_required': False}.
[I 2025-08-30 19:36:18,561] Trial 590 finished with values: [-1000000000.0, 1000000000.0] and parameters: {'p_sma': 38, 'p_std': 28, 'p_atr': 10, 'p_adx': 19, 'rsi_period': 55, 'ema1': 13, 'ema2': 31, 'slip_atr_k': 0.0776877021998591, 'slip_spread_k': 0.3306285218227082, 'spread_hl_frac': 0.025361307942950405, 'bb_std_mult': 2.124405775620608, 'rsi_os': 50, 'rsi_ob': 60, 'vol_spike': 0.2715850807877056, 'adx_thresh': 33.48145869609876, 'atr_min_pct': 0.026726344021128293, 'atr_max_pct': 0.01306010648833636, 'tp_mult': 2.4875273203255412, 'tsl_mult': 0.8222366493921823, 'strategy': 'mean_reversion', 'time_stop': 68, 'use_sma': False, 'use_atr': True, 'use_adx': True, 'use_ema': True, 'use_spike': True, 'rsi_required': False, 'edge_k': 0.24221828766817444, 'edge_cap': 0.4801989185296043, 'bull_strategy': 'mean_reversion', 'bull_bb_std_mult': 3.1928638786806824, 'bull_rsi_os': 38, 'bull_rsi_ob': 47, 'bull_adx_thresh': 18.609079578447624, 'bull_atr_min_pct': 0.0011362087726389217, 'bull_atr_max_pct': 0.12741498541717816, 'bull_tp_mult': 2.6915147821454894, 'bull_tsl_mult': 0.13864247598484586, 'bull_time_stop': 96, 'bull_use_sma': False, 'bull_use_ema': True, 'bull_use_atr': False, 'bull_use_adx': True, 'bull_use_spike': False, 'bull_rsi_required': True, 'bear_strategy': 'breakout', 'bear_bb_std_mult': 2.8349118912524864, 'bear_rsi_os': 53, 'bear_rsi_ob': 75, 'bear_adx_thresh': 32.3905920263187, 'bear_atr_min_pct': 0.01556503560241466, 'bear_atr_max_pct': 0.02878665989929915, 'bear_tp_mult': 2.6898161200036053, 'bear_tsl_mult': 0.5004799874839685, 'bear_time_stop': 195, 'bear_use_sma': True, 'bear_use_ema': True, 'bear_use_atr': False, 'bear_use_adx': False, 'bear_use_spike': False, 'bear_rsi_required': True, 'sideways_strategy': 'mean_reversion', 'sideways_bb_std_mult': 1.221241046398048, 'sideways_rsi_os': 31, 'sideways_rsi_ob': 45, 'sideways_adx_thresh': 8.615857544128136, 'sideways_atr_min_pct': 0.002942331215615231, 'sideways_atr_max_pct': 0.1473093872191563, 'sideways_tp_mult': 1.0100277157251405, 'sideways_tsl_mult': 0.4201098877941025, 'sideways_time_stop': 169, 'sideways_use_sma': False, 'sideways_use_ema': True, 'sideways_use_atr': True, 'sideways_use_adx': False, 'sideways_use_spike': True, 'sideways_rsi_required': False}.
[I 2025-08-30 19:36:19,351] Trial 592 finished with values: [-1000000000.0, 1000000000.0] and parameters: {'p_sma': 6, 'p_std': 7, 'p_atr': 20, 'p_adx': 14, 'rsi_period': 55, 'ema1': 13, 'ema2': 20, 'slip_atr_k': 0.1789332372130372, 'slip_spread_k': 0.49508116825722115, 'spread_hl_frac': 0.022933078227783506, 'bb_std_mult': 2.1298614905922317, 'rsi_os': 49, 'rsi_ob': 60, 'vol_spike': 0.27828436588251276, 'adx_thresh': 23.96884150613615, 'atr_min_pct': 0.024018037442401493, 'atr_max_pct': 0.02351993189150961, 'tp_mult': 2.1862154026948595, 'tsl_mult': 0.5669225396242245, 'strategy': 'breakout', 'time_stop': 188, 'use_sma': False, 'use_atr': True, 'use_adx': True, 'use_ema': True, 'use_spike': False, 'rsi_required': True, 'edge_k': 1.9305125095164504, 'edge_cap': 0.42610291624386176, 'bull_strategy': 'mean_reversion', 'bull_bb_std_mult': 1.121388345288532, 'bull_rsi_os': 30, 'bull_rsi_ob': 47, 'bull_adx_thresh': 18.548587987657555, 'bull_atr_min_pct': 0.017527199156657944, 'bull_atr_max_pct': 0.127890737656231, 'bull_tp_mult': 2.6956407115133056, 'bull_tsl_mult': 0.0454540612183284, 'bull_time_stop': 91, 'bull_use_sma': True, 'bull_use_ema': True, 'bull_use_atr': True, 'bull_use_adx': True, 'bull_use_spike': False, 'bull_rsi_required': True, 'bear_strategy': 'breakout', 'bear_bb_std_mult': 2.953950819969048, 'bear_rsi_os': 53, 'bear_rsi_ob': 94, 'bear_adx_thresh': 32.58543290522564, 'bear_atr_min_pct': 0.017334895426813608, 'bear_atr_max_pct': 0.13881112886501465, 'bear_tp_mult': 2.7158248383407066, 'bear_tsl_mult': 0.756252551996767, 'bear_time_stop': 211, 'bear_use_sma': False, 'bear_use_ema': True, 'bear_use_atr': False, 'bear_use_adx': True, 'bear_use_spike': False, 'bear_rsi_required': True, 'sideways_strategy': 'mean_reversion', 'sideways_bb_std_mult': 0.5062635415047729, 'sideways_rsi_os': 38, 'sideways_rsi_ob': 62, 'sideways_adx_thresh': 20.446292079998464, 'sideways_atr_min_pct': 0.0027596443188966525, 'sideways_atr_max_pct': 0.010437053518849812, 'sideways_tp_mult': 1.0497840359404624, 'sideways_tsl_mult': 0.9808214576413172, 'sideways_time_stop': 273, 'sideways_use_sma': False, 'sideways_use_ema': True, 'sideways_use_atr': True, 'sideways_use_adx': False, 'sideways_use_spike': False, 'sideways_rsi_required': False}.
[I 2025-08-30 19:36:31,448] Trial 586 finished with values: [-0.015818614276595144, 0.01600276182647053] and parameters: {'p_sma': 7, 'p_std': 23, 'p_atr': 8, 'p_adx': 20, 'rsi_period': 26, 'ema1': 8, 'ema2': 40, 'slip_atr_k': 0.05951503598619124, 'slip_spread_k': 0.7295889996983246, 'spread_hl_frac': 0.006455296301475868, 'bb_std_mult': 1.9700389514883299, 'rsi_os': 29, 'rsi_ob': 73, 'vol_spike': 0.2659087861423521, 'adx_thresh': 33.29497051967341, 'atr_min_pct': 0.026909534554220415, 'atr_max_pct': 0.07583011408250288, 'tp_mult': 1.3342399675973395, 'tsl_mult': 0.5656816516213052, 'strategy': 'mean_reversion', 'time_stop': 208, 'use_sma': True, 'use_atr': True, 'use_adx': False, 'use_ema': False, 'use_spike': True, 'rsi_required': False, 'edge_k': 1.761585565480988, 'edge_cap': 0.5467043941248568, 'bull_strategy': 'breakout', 'bull_bb_std_mult': 3.0397176567924253, 'bull_rsi_os': 31, 'bull_rsi_ob': 53, 'bull_adx_thresh': 16.588001386903567, 'bull_atr_min_pct': 0.0012512509620401912, 'bull_atr_max_pct': 0.13741006335641126, 'bull_tp_mult': 2.7584491337921078, 'bull_tsl_mult': 0.9580057498436514, 'bull_time_stop': 177, 'bull_use_sma': False, 'bull_use_ema': False, 'bull_use_atr': False, 'bull_use_adx': False, 'bull_use_spike': True, 'bull_rsi_required': False, 'bear_strategy': 'mean_reversion', 'bear_bb_std_mult': 2.8352626863743904, 'bear_rsi_os': 11, 'bear_rsi_ob': 78, 'bear_adx_thresh': 8.918952507292198, 'bear_atr_min_pct': 0.013408800197059331, 'bear_atr_max_pct': 0.0530594488943497, 'bear_tp_mult': 2.6641822061907128, 'bear_tsl_mult': 0.7878634851192037, 'bear_time_stop': 173, 'bear_use_sma': True, 'bear_use_ema': False, 'bear_use_atr': False, 'bear_use_adx': False, 'bear_use_spike': True, 'bear_rsi_required': True, 'sideways_strategy': 'breakout', 'sideways_bb_std_mult': 2.7928597113994256, 'sideways_rsi_os': 31, 'sideways_rsi_ob': 62, 'sideways_adx_thresh': 19.61187367262133, 'sideways_atr_min_pct': 0.00289124608851209, 'sideways_atr_max_pct': 0.13630415408589586, 'sideways_tp_mult': 1.097853373262669, 'sideways_tsl_mult': 0.9996832756269366, 'sideways_time_stop': 265, 'sideways_use_sma': False, 'sideways_use_ema': True, 'sideways_use_atr': True, 'sideways_use_adx': True, 'sideways_use_spike': False, 'sideways_rsi_required': False}.
[I 2025-08-30 19:36:31,771] Trial 594 finished with values: [-1000000000.0, 1000000000.0] and parameters: {'p_sma': 8, 'p_std': 55, 'p_atr': 9, 'p_adx': 29, 'rsi_period': 24, 'ema1': 25, 'ema2': 32, 'slip_atr_k': 0.11731161902652504, 'slip_spread_k': 0.1905102949244037, 'spread_hl_frac': 0.024207957463622268, 'bb_std_mult': 1.8789604260675214, 'rsi_os': 51, 'rsi_ob': 82, 'vol_spike': 0.24544820528707967, 'adx_thresh': 26.404047137238006, 'atr_min_pct': 0.024595005135736196, 'atr_max_pct': 0.04836851281220544, 'tp_mult': 2.2284036641536926, 'tsl_mult': 0.7822184210934942, 'strategy': 'mean_reversion', 'time_stop': 208, 'use_sma': False, 'use_atr': False, 'use_adx': False, 'use_ema': False, 'use_spike': True, 'rsi_required': False, 'edge_k': 0.0070935857223777266, 'edge_cap': 0.5168302645580116, 'bull_strategy': 'mean_reversion', 'bull_bb_std_mult': 1.0454444662522486, 'bull_rsi_os': 29, 'bull_rsi_ob': 45, 'bull_adx_thresh': 20.322586746727403, 'bull_atr_min_pct': 0.024921447678601744, 'bull_atr_max_pct': 0.11853268932349244, 'bull_tp_mult': 2.4861311288091703, 'bull_tsl_mult': 0.3048984809846359, 'bull_time_stop': 190, 'bull_use_sma': False, 'bull_use_ema': True, 'bull_use_atr': True, 'bull_use_adx': False, 'bull_use_spike': True, 'bull_rsi_required': True, 'bear_strategy': 'mean_reversion', 'bear_bb_std_mult': 3.1403912780028547, 'bear_rsi_os': 50, 'bear_rsi_ob': 77, 'bear_adx_thresh': 17.46899692406788, 'bear_atr_min_pct': 0.016333440286258626, 'bear_atr_max_pct': 0.10132412183755246, 'bear_tp_mult': 2.562852555386737, 'bear_tsl_mult': 0.41990934763577564, 'bear_time_stop': 18, 'bear_use_sma': True, 'bear_use_ema': True, 'bear_use_atr': False, 'bear_use_adx': False, 'bear_use_spike': False, 'bear_rsi_required': False, 'sideways_strategy': 'breakout', 'sideways_bb_std_mult': 3.241961093426412, 'sideways_rsi_os': 37, 'sideways_rsi_ob': 76, 'sideways_adx_thresh': 21.61855317147601, 'sideways_atr_min_pct': 0.0019850351146656177, 'sideways_atr_max_pct': 0.0699799413347613, 'sideways_tp_mult': 1.1409908402966644, 'sideways_tsl_mult': 0.03482701571523561, 'sideways_time_stop': 156, 'sideways_use_sma': False, 'sideways_use_ema': True, 'sideways_use_atr': True, 'sideways_use_adx': True, 'sideways_use_spike': False, 'sideways_rsi_required': True}.
[I 2025-08-30 19:36:37,728] Trial 591 finished with values: [-1000000000.0, 1000000000.0] and parameters: {'p_sma': 5, 'p_std': 28, 'p_atr': 8, 'p_adx': 17, 'rsi_period': 24, 'ema1': 24, 'ema2': 35, 'slip_atr_k': 0.07691860544499551, 'slip_spread_k': 0.20741356995451027, 'spread_hl_frac': 0.021151395126589118, 'bb_std_mult': 2.101254737168492, 'rsi_os': 49, 'rsi_ob': 60, 'vol_spike': 0.27897550549412026, 'adx_thresh': 34.43810419312207, 'atr_min_pct': 0.021463930074075883, 'atr_max_pct': 0.09891539474566198, 'tp_mult': 1.0162223625888447, 'tsl_mult': 0.6824021277279744, 'strategy': 'mean_reversion', 'time_stop': 189, 'use_sma': False, 'use_atr': True, 'use_adx': True, 'use_ema': True, 'use_spike': False, 'rsi_required': False, 'edge_k': 0.20866712932277165, 'edge_cap': 0.5105442108959835, 'bull_strategy': 'mean_reversion', 'bull_bb_std_mult': 1.147138120524653, 'bull_rsi_os': 20, 'bull_rsi_ob': 53, 'bull_adx_thresh': 13.762782157976517, 'bull_atr_min_pct': 0.0011936183100101085, 'bull_atr_max_pct': 0.12940076944107753, 'bull_tp_mult': 2.703308307418145, 'bull_tsl_mult': 0.21409369237617099, 'bull_time_stop': 56, 'bull_use_sma': False, 'bull_use_ema': True, 'bull_use_atr': False, 'bull_use_adx': True, 'bull_use_spike': False, 'bull_rsi_required': True, 'bear_strategy': 'breakout', 'bear_bb_std_mult': 2.849423909689547, 'bear_rsi_os': 53, 'bear_rsi_ob': 77, 'bear_adx_thresh': 17.378833834963967, 'bear_atr_min_pct': 0.015995013272953707, 'bear_atr_max_pct': 0.02881383761733533, 'bear_tp_mult': 2.710577757560637, 'bear_tsl_mult': 0.7461544031365239, 'bear_time_stop': 46, 'bear_use_sma': True, 'bear_use_ema': True, 'bear_use_atr': False, 'bear_use_adx': False, 'bear_use_spike': False, 'bear_rsi_required': True, 'sideways_strategy': 'mean_reversion', 'sideways_bb_std_mult': 3.245648822100477, 'sideways_rsi_os': 31, 'sideways_rsi_ob': 63, 'sideways_adx_thresh': 21.49849572686966, 'sideways_atr_min_pct': 0.002931533443690225, 'sideways_atr_max_pct': 0.13724527054315655, 'sideways_tp_mult': 1.0501418388582178, 'sideways_tsl_mult': 0.9991053658543947, 'sideways_time_stop': 273, 'sideways_use_sma': False, 'sideways_use_ema': True, 'sideways_use_atr': True, 'sideways_use_adx': False, 'sideways_use_spike': True, 'sideways_rsi_required': False}.
