[I 2025-08-30 19:22:29,952] Trial 468 finished with values: [-1000000000.0, 1000000000.0] and parameters: {'p_sma': 5, 'p_std': 14, 'p_atr': 10, 'p_adx': 21, 'rsi_period': 70, 'ema1': 6, 'ema2': 29, 'slip_atr_k': 0.05497251804842576, 'slip_spread_k': 0.04468730341534721, 'spread_hl_frac': 0.010113560252982642, 'bb_std_mult': 2.4532967573984275, 'rsi_os': 32, 'rsi_ob': 67, 'vol_spike': 0.021204851505113836, 'adx_thresh': 30.518907748642665, 'atr_min_pct': 0.019062206662939486, 'atr_max_pct': 0.09450473009534903, 'tp_mult': 1.0302687348178021, 'tsl_mult': 0.14769878832042083, 'strategy': 'breakout', 'time_stop': 170, 'use_sma': False, 'use_atr': True, 'use_adx': False, 'use_ema': True, 'use_spike': True, 'rsi_required': False, 'edge_k': 0.13703874619875595, 'edge_cap': 0.3173793030861019, 'bull_strategy': 'breakout', 'bull_bb_std_mult': 3.2472139902914408, 'bull_rsi_os': 18, 'bull_rsi_ob': 89, 'bull_adx_thresh': 14.675796606679768, 'bull_atr_min_pct': 0.007975358357759199, 'bull_atr_max_pct': 0.10936489685026324, 'bull_tp_mult': 1.8921777113757887, 'bull_tsl_mult': 0.2886829463810623, 'bull_time_stop': 211, 'bull_use_sma': False, 'bull_use_ema': False, 'bull_use_atr': False, 'bull_use_adx': True, 'bull_use_spike': True, 'bull_rsi_required': True, 'bear_strategy': 'mean_reversion', 'bear_bb_std_mult': 1.9517103174421975, 'bear_rsi_os': 52, 'bear_rsi_ob': 87, 'bear_adx_thresh': 30.223664777865146, 'bear_atr_min_pct': 0.003422685477094815, 'bear_atr_max_pct': 0.12275244489357917, 'bear_tp_mult': 1.4130735281793898, 'bear_tsl_mult': 0.5036317082237888, 'bear_time_stop': 182, 'bear_use_sma': True, 'bear_use_ema': True, 'bear_use_atr': True, 'bear_use_adx': True, 'bear_use_spike': True, 'bear_rsi_required': False, 'sideways_strategy': 'breakout', 'sideways_bb_std_mult': 3.1760647020394566, 'sideways_rsi_os': 45, 'sideways_rsi_ob': 58, 'sideways_adx_thresh': 14.612874927522913, 'sideways_atr_min_pct': 0.013984615190847968, 'sideways_atr_max_pct': 0.14517900027225447, 'sideways_tp_mult': 1.1342690805982634, 'sideways_tsl_mult': 0.9502132041534559, 'sideways_time_stop': 23, 'sideways_use_sma': False, 'sideways_use_ema': False, 'sideways_use_atr': False, 'sideways_use_adx': True, 'sideways_use_spike': False, 'sideways_rsi_required': False}.
[I 2025-08-30 19:22:45,652] Trial 469 finished with values: [-1000000000.0, 1000000000.0] and parameters: {'p_sma': 52, 'p_std': 31, 'p_atr': 9, 'p_adx': 30, 'rsi_period': 53, 'ema1': 6, 'ema2': 31, 'slip_atr_k': 0.14259710650420776, 'slip_spread_k': 0.1122060844705155, 'spread_hl_frac': 0.008207185955836152, 'bb_std_mult': 2.176299045618313, 'rsi_os': 49, 'rsi_ob': 66, 'vol_spike': 0.26687467851365604, 'adx_thresh': 20.295637433793498, 'atr_min_pct': 0.004552864439714184, 'atr_max_pct': 0.056074975477502426, 'tp_mult': 2.317846146019422, 'tsl_mult': 0.8086384068178876, 'strategy': 'mean_reversion', 'time_stop': 191, 'use_sma': False, 'use_atr': True, 'use_adx': False, 'use_ema': True, 'use_spike': True, 'rsi_required': False, 'edge_k': 0.13142645636185313, 'edge_cap': 0.4702139855578903, 'bull_strategy': 'mean_reversion', 'bull_bb_std_mult': 1.5578719068797722, 'bull_rsi_os': 34, 'bull_rsi_ob': 46, 'bull_adx_thresh': 19.79473386770858, 'bull_atr_min_pct': 0.011536414280771951, 'bull_atr_max_pct': 0.09460656673145117, 'bull_tp_mult': 2.6288420364850973, 'bull_tsl_mult': 0.4939872000975564, 'bull_time_stop': 209, 'bull_use_sma': False, 'bull_use_ema': False, 'bull_use_atr': False, 'bull_use_adx': False, 'bull_use_spike': True, 'bull_rsi_required': True, 'bear_strategy': 'mean_reversion', 'bear_bb_std_mult': 2.8498344560408837, 'bear_rsi_os': 37, 'bear_rsi_ob': 78, 'bear_adx_thresh': 5.04029614560652, 'bear_atr_min_pct': 0.014350702760203811, 'bear_atr_max_pct': 0.025685838248345836, 'bear_tp_mult': 1.4227361570813848, 'bear_tsl_mult': 0.7608401811317628, 'bear_time_stop': 261, 'bear_use_sma': True, 'bear_use_ema': True, 'bear_use_atr': True, 'bear_use_adx': False, 'bear_use_spike': True, 'bear_rsi_required': False, 'sideways_strategy': 'breakout', 'sideways_bb_std_mult': 2.7968966534392474, 'sideways_rsi_os': 36, 'sideways_rsi_ob': 58, 'sideways_adx_thresh': 25.554703529585346, 'sideways_atr_min_pct': 0.014268379050764994, 'sideways_atr_max_pct': 0.059550681729146404, 'sideways_tp_mult': 1.9027140835307437, 'sideways_tsl_mult': 0.980329934529864, 'sideways_time_stop': 146, 'sideways_use_sma': False, 'sideways_use_ema': False, 'sideways_use_atr': True, 'sideways_use_adx': True, 'sideways_use_spike': False, 'sideways_rsi_required': False}.
[I 2025-08-30 19:22:50,766] Trial 470 finished with values: [-1000000000.0, 1000000000.0] and parameters: {'p_sma': 24, 'p_std': 31, 'p_atr': 9, 'p_adx': 10, 'rsi_period': 19, 'ema1': 28, 'ema2': 29, 'slip_atr_k': 0.0839882328455061, 'slip_spread_k': 0.13411041152392875, 'spread_hl_frac': 0.024582901590108792, 'bb_std_mult': 1.65316159085297, 'rsi_os': 34, 'rsi_ob': 75, 'vol_spike': 0.26553484891996365, 'adx_thresh': 30.314110082444465, 'atr_min_pct': 0.00944603202308401, 'atr_max_pct': 0.08233502245145433, 'tp_mult': 2.16215880521376, 'tsl_mult': 0.853538451372694, 'strategy': 'mean_reversion', 'time_stop': 143, 'use_sma': False, 'use_atr': True, 'use_adx': False, 'use_ema': True, 'use_spike': False, 'rsi_required': False, 'edge_k': 0.19256266096246885, 'edge_cap': 0.6040645615161366, 'bull_strategy': 'mean_reversion', 'bull_bb_std_mult': 2.9766029163342305, 'bull_rsi_os': 37, 'bull_rsi_ob': 89, 'bull_adx_thresh': 18.77496887241878, 'bull_atr_min_pct': 0.0022550745375127766, 'bull_atr_max_pct': 0.11336458524644721, 'bull_tp_mult': 1.2060837379453444, 'bull_tsl_mult': 0.5484169934982714, 'bull_time_stop': 181, 'bull_use_sma': False, 'bull_use_ema': True, 'bull_use_atr': False, 'bull_use_adx': False, 'bull_use_spike': True, 'bull_rsi_required': False, 'bear_strategy': 'mean_reversion', 'bear_bb_std_mult': 2.845955918034438, 'bear_rsi_os': 51, 'bear_rsi_ob': 57, 'bear_adx_thresh': 18.317486025602054, 'bear_atr_min_pct': 0.01854059780624474, 'bear_atr_max_pct': 0.1331479280562958, 'bear_tp_mult': 2.953318204864995, 'bear_tsl_mult': 0.4775933460470753, 'bear_time_stop': 185, 'bear_use_sma': False, 'bear_use_ema': True, 'bear_use_atr': False, 'bear_use_adx': False, 'bear_use_spike': True, 'bear_rsi_required': False, 'sideways_strategy': 'breakout', 'sideways_bb_std_mult': 3.1221089211435222, 'sideways_rsi_os': 36, 'sideways_rsi_ob': 59, 'sideways_adx_thresh': 20.880466742838898, 'sideways_atr_min_pct': 0.013670498520747996, 'sideways_atr_max_pct': 0.14478348754232243, 'sideways_tp_mult': 2.8703079458250516, 'sideways_tsl_mult': 0.9863668033102799, 'sideways_time_stop': 22, 'sideways_use_sma': True, 'sideways_use_ema': False, 'sideways_use_atr': True, 'sideways_use_adx': True, 'sideways_use_spike': False, 'sideways_rsi_required': True}.
[I 2025-08-30 19:22:58,744] Trial 473 finished with values: [-1000000000.0, 1000000000.0] and parameters: {'p_sma': 8, 'p_std': 29, 'p_atr': 14, 'p_adx': 9, 'rsi_period': 38, 'ema1': 27, 'ema2': 21, 'slip_atr_k': 0.07709840650146249, 'slip_spread_k': 0.14322531203010824, 'spread_hl_frac': 0.024529012652550534, 'bb_std_mult': 1.6341632113843447, 'rsi_os': 50, 'rsi_ob': 69, 'vol_spike': 0.2633044740990934, 'adx_thresh': 33.44081254422461, 'atr_min_pct': 0.023558325438579567, 'atr_max_pct': 0.09216335283001091, 'tp_mult': 2.7896066414986116, 'tsl_mult': 0.8418461498251733, 'strategy': 'mean_reversion', 'time_stop': 142, 'use_sma': True, 'use_atr': True, 'use_adx': True, 'use_ema': False, 'use_spike': False, 'rsi_required': True, 'edge_k': 0.18356088591654104, 'edge_cap': 0.5285435574509775, 'bull_strategy': 'mean_reversion', 'bull_bb_std_mult': 2.963682113794367, 'bull_rsi_os': 8, 'bull_rsi_ob': 47, 'bull_adx_thresh': 27.527316664433854, 'bull_atr_min_pct': 0.007233573501286486, 'bull_atr_max_pct': 0.11363586471042085, 'bull_tp_mult': 2.726214307055311, 'bull_tsl_mult': 0.23084192485062366, 'bull_time_stop': 178, 'bull_use_sma': True, 'bull_use_ema': True, 'bull_use_atr': True, 'bull_use_adx': False, 'bull_use_spike': False, 'bull_rsi_required': False, 'bear_strategy': 'breakout', 'bear_bb_std_mult': 2.958873290430313, 'bear_rsi_os': 51, 'bear_rsi_ob': 74, 'bear_adx_thresh': 18.26037001843712, 'bear_atr_min_pct': 0.015905359149721937, 'bear_atr_max_pct': 0.033743274112056736, 'bear_tp_mult': 2.6562128516389842, 'bear_tsl_mult': 0.4673380641938319, 'bear_time_stop': 187, 'bear_use_sma': False, 'bear_use_ema': False, 'bear_use_atr': False, 'bear_use_adx': False, 'bear_use_spike': False, 'bear_rsi_required': True, 'sideways_strategy': 'breakout', 'sideways_bb_std_mult': 0.6689313202180842, 'sideways_rsi_os': 39, 'sideways_rsi_ob': 60, 'sideways_adx_thresh': 20.281404941675827, 'sideways_atr_min_pct': 0.0032034080197593886, 'sideways_atr_max_pct': 0.139776186654589, 'sideways_tp_mult': 1.2243835937456091, 'sideways_tsl_mult': 0.9849925528094753, 'sideways_time_stop': 158, 'sideways_use_sma': True, 'sideways_use_ema': True, 'sideways_use_atr': True, 'sideways_use_adx': False, 'sideways_use_spike': True, 'sideways_rsi_required': True}.
[I 2025-08-30 19:23:06,107] Trial 471 finished with values: [-1000000000.0, 1000000000.0] and parameters: {'p_sma': 24, 'p_std': 30, 'p_atr': 10, 'p_adx': 27, 'rsi_period': 16, 'ema1': 10, 'ema2': 11, 'slip_atr_k': 0.08476952576135928, 'slip_spread_k': 0.11002263412223995, 'spread_hl_frac': 0.023823819875302757, 'bb_std_mult': 2.162798431558977, 'rsi_os': 5, 'rsi_ob': 67, 'vol_spike': 0.2270292607602108, 'adx_thresh': 26.473097813032133, 'atr_min_pct': 0.023709011981220315, 'atr_max_pct': 0.05553886993007417, 'tp_mult': 2.178181910211931, 'tsl_mult': 0.40507345435796627, 'strategy': 'mean_reversion', 'time_stop': 191, 'use_sma': False, 'use_atr': True, 'use_adx': False, 'use_ema': True, 'use_spike': False, 'rsi_required': False, 'edge_k': 0.18593309350518394, 'edge_cap': 0.5895366264576924, 'bull_strategy': 'mean_reversion', 'bull_bb_std_mult': 3.26637574451545, 'bull_rsi_os': 34, 'bull_rsi_ob': 89, 'bull_adx_thresh': 27.498373059554243, 'bull_atr_min_pct': 0.002280118796421906, 'bull_atr_max_pct': 0.028613268704575687, 'bull_tp_mult': 2.736891399575607, 'bull_tsl_mult': 0.21288642035373312, 'bull_time_stop': 148, 'bull_use_sma': False, 'bull_use_ema': True, 'bull_use_atr': True, 'bull_use_adx': False, 'bull_use_spike': False, 'bull_rsi_required': False, 'bear_strategy': 'breakout', 'bear_bb_std_mult': 2.8311201040305836, 'bear_rsi_os': 52, 'bear_rsi_ob': 57, 'bear_adx_thresh': 16.038415691764598, 'bear_atr_min_pct': 0.014343135195600196, 'bear_atr_max_pct': 0.03252838477381034, 'bear_tp_mult': 1.3145740635725347, 'bear_tsl_mult': 0.7419449357820324, 'bear_time_stop': 186, 'bear_use_sma': False, 'bear_use_ema': True, 'bear_use_atr': False, 'bear_use_adx': False, 'bear_use_spike': True, 'bear_rsi_required': False, 'sideways_strategy': 'breakout', 'sideways_bb_std_mult': 3.1339433793135463, 'sideways_rsi_os': 36, 'sideways_rsi_ob': 60, 'sideways_adx_thresh': 21.294209688698476, 'sideways_atr_min_pct': 0.013755153817723931, 'sideways_atr_max_pct': 0.1447858365194527, 'sideways_tp_mult': 1.226352589347234, 'sideways_tsl_mult': 0.05757254069419554, 'sideways_time_stop': 104, 'sideways_use_sma': True, 'sideways_use_ema': False, 'sideways_use_atr': True, 'sideways_use_adx': False, 'sideways_use_spike': False, 'sideways_rsi_required': True}.
[I 2025-08-30 19:23:06,814] Trial 472 finished with values: [-1000000000.0, 1000000000.0] and parameters: {'p_sma': 8, 'p_std': 41, 'p_atr': 9, 'p_adx': 30, 'rsi_period': 19, 'ema1': 27, 'ema2': 36, 'slip_atr_k': 0.08377724016153645, 'slip_spread_k': 0.13884487242009114, 'spread_hl_frac': 0.024788968648106036, 'bb_std_mult': 2.202432980683959, 'rsi_os': 34, 'rsi_ob': 69, 'vol_spike': 0.2652124410731254, 'adx_thresh': 6.9477980038479075, 'atr_min_pct': 0.027467646697228988, 'atr_max_pct': 0.09321646958059344, 'tp_mult': 2.1576138516748906, 'tsl_mult': 0.41244375997935384, 'strategy': 'mean_reversion', 'time_stop': 263, 'use_sma': False, 'use_atr': True, 'use_adx': False, 'use_ema': True, 'use_spike': False, 'rsi_required': False, 'edge_k': 0.20172335328352575, 'edge_cap': 0.05006474153516288, 'bull_strategy': 'mean_reversion', 'bull_bb_std_mult': 0.5804757201032691, 'bull_rsi_os': 32, 'bull_rsi_ob': 48, 'bull_adx_thresh': 19.92719917518296, 'bull_atr_min_pct': 0.003080889520046785, 'bull_atr_max_pct': 0.06419044045972978, 'bull_tp_mult': 2.741694480403471, 'bull_tsl_mult': 0.458130680702251, 'bull_time_stop': 148, 'bull_use_sma': False, 'bull_use_ema': True, 'bull_use_atr': True, 'bull_use_adx': False, 'bull_use_spike': False, 'bull_rsi_required': False, 'bear_strategy': 'breakout', 'bear_bb_std_mult': 2.837984603714995, 'bear_rsi_os': 32, 'bear_rsi_ob': 74, 'bear_adx_thresh': 7.915114995080739, 'bear_atr_min_pct': 0.014157171794525037, 'bear_atr_max_pct': 0.024528318979423657, 'bear_tp_mult': 2.7383769248301544, 'bear_tsl_mult': 0.4684781472074824, 'bear_time_stop': 258, 'bear_use_sma': False, 'bear_use_ema': True, 'bear_use_atr': False, 'bear_use_adx': False, 'bear_use_spike': False, 'bear_rsi_required': False, 'sideways_strategy': 'breakout', 'sideways_bb_std_mult': 0.6602407372706425, 'sideways_rsi_os': 36, 'sideways_rsi_ob': 60, 'sideways_adx_thresh': 25.565107896983715, 'sideways_atr_min_pct': 0.015180239962797342, 'sideways_atr_max_pct': 0.1399526100457474, 'sideways_tp_mult': 1.8922915670987754, 'sideways_tsl_mult': 0.9815622973975247, 'sideways_time_stop': 242, 'sideways_use_sma': True, 'sideways_use_ema': True, 'sideways_use_atr': True, 'sideways_use_adx': False, 'sideways_use_spike': True, 'sideways_rsi_required': True}.
[I 2025-08-30 19:23:08,429] Trial 475 finished with values: [-1000000000.0, 1000000000.0] and parameters: {'p_sma': 7, 'p_std': 42, 'p_atr': 10, 'p_adx': 29, 'rsi_period': 8, 'ema1': 17, 'ema2': 33, 'slip_atr_k': 0.07053172058579167, 'slip_spread_k': 0.1739581870672559, 'spread_hl_frac': 0.001328479986881282, 'bb_std_mult': 2.105024886909135, 'rsi_os': 52, 'rsi_ob': 52, 'vol_spike': 0.27672530575343735, 'adx_thresh': 10.98160552709718, 'atr_min_pct': 0.027002858365642403, 'atr_max_pct': 0.012532803330293843, 'tp_mult': 1.2257398287064545, 'tsl_mult': 0.7809812639143731, 'strategy': 'mean_reversion', 'time_stop': 248, 'use_sma': False, 'use_atr': True, 'use_adx': True, 'use_ema': False, 'use_spike': True, 'rsi_required': False, 'edge_k': 0.06999914796514684, 'edge_cap': 0.656818916322161, 'bull_strategy': 'mean_reversion', 'bull_bb_std_mult': 3.114506792371581, 'bull_rsi_os': 30, 'bull_rsi_ob': 48, 'bull_adx_thresh': 15.885777811979896, 'bull_atr_min_pct': 0.002932297372306712, 'bull_atr_max_pct': 0.029855074113691406, 'bull_tp_mult': 2.777201545535917, 'bull_tsl_mult': 0.6171490983668273, 'bull_time_stop': 148, 'bull_use_sma': False, 'bull_use_ema': True, 'bull_use_atr': True, 'bull_use_adx': False, 'bull_use_spike': False, 'bull_rsi_required': True, 'bear_strategy': 'breakout', 'bear_bb_std_mult': 2.9058876403229483, 'bear_rsi_os': 33, 'bear_rsi_ob': 77, 'bear_adx_thresh': 17.032114349593275, 'bear_atr_min_pct': 0.004717575564021127, 'bear_atr_max_pct': 0.03289076950078856, 'bear_tp_mult': 2.734710600231455, 'bear_tsl_mult': 0.5348258536699632, 'bear_time_stop': 77, 'bear_use_sma': True, 'bear_use_ema': True, 'bear_use_atr': False, 'bear_use_adx': False, 'bear_use_spike': False, 'bear_rsi_required': True, 'sideways_strategy': 'breakout', 'sideways_bb_std_mult': 3.0040193597860303, 'sideways_rsi_os': 8, 'sideways_rsi_ob': 45, 'sideways_adx_thresh': 21.499888641469358, 'sideways_atr_min_pct': 0.0036230801220787767, 'sideways_atr_max_pct': 0.030897382170978482, 'sideways_tp_mult': 1.0915963652046718, 'sideways_tsl_mult': 0.9239914872861094, 'sideways_time_stop': 151, 'sideways_use_sma': False, 'sideways_use_ema': True, 'sideways_use_atr': True, 'sideways_use_adx': False, 'sideways_use_spike': True, 'sideways_rsi_required': True}.
[I 2025-08-30 19:23:13,837] Trial 476 finished with values: [-1000000000.0, 1000000000.0] and parameters: {'p_sma': 46, 'p_std': 41, 'p_atr': 19, 'p_adx': 19, 'rsi_period': 21, 'ema1': 26, 'ema2': 36, 'slip_atr_k': 0.07187117118101652, 'slip_spread_k': 0.4177977668708436, 'spread_hl_frac': 0.013581665599434878, 'bb_std_mult': 2.0924804673075967, 'rsi_os': 52, 'rsi_ob': 84, 'vol_spike': 0.27644436538049555, 'adx_thresh': 34.27510843819328, 'atr_min_pct': 0.01255715091879671, 'atr_max_pct': 0.13800680795910372, 'tp_mult': 2.2350083870294175, 'tsl_mult': 0.8751538967235243, 'strategy': 'mean_reversion', 'time_stop': 117, 'use_sma': False, 'use_atr': True, 'use_adx': True, 'use_ema': False, 'use_spike': True, 'rsi_required': False, 'edge_k': 1.5979015434112183, 'edge_cap': 0.521098074054788, 'bull_strategy': 'mean_reversion', 'bull_bb_std_mult': 3.1250941126791063, 'bull_rsi_os': 30, 'bull_rsi_ob': 48, 'bull_adx_thresh': 20.316866999676506, 'bull_atr_min_pct': 0.0016061387371722987, 'bull_atr_max_pct': 0.041509574854434676, 'bull_tp_mult': 2.7628669175671305, 'bull_tsl_mult': 0.6195430511799488, 'bull_time_stop': 300, 'bull_use_sma': False, 'bull_use_ema': True, 'bull_use_atr': True, 'bull_use_adx': False, 'bull_use_spike': False, 'bull_rsi_required': True, 'bear_strategy': 'breakout', 'bear_bb_std_mult': 2.9119622048683946, 'bear_rsi_os': 5, 'bear_rsi_ob': 85, 'bear_adx_thresh': 26.946312253632456, 'bear_atr_min_pct': 0.019327815600687262, 'bear_atr_max_pct': 0.028291991862076205, 'bear_tp_mult': 2.085043544938226, 'bear_tsl_mult': 0.0025203938653062807, 'bear_time_stop': 20, 'bear_use_sma': True, 'bear_use_ema': True, 'bear_use_atr': False, 'bear_use_adx': False, 'bear_use_spike': False, 'bear_rsi_required': True, 'sideways_strategy': 'breakout', 'sideways_bb_std_mult': 1.1975952761118136, 'sideways_rsi_os': 27, 'sideways_rsi_ob': 57, 'sideways_adx_thresh': 18.59721656306385, 'sideways_atr_min_pct': 0.0036413346983750344, 'sideways_atr_max_pct': 0.1326473719986151, 'sideways_tp_mult': 1.0884333670880864, 'sideways_tsl_mult': 0.9674947259597685, 'sideways_time_stop': 148, 'sideways_use_sma': False, 'sideways_use_ema': True, 'sideways_use_atr': True, 'sideways_use_adx': False, 'sideways_use_spike': True, 'sideways_rsi_required': True}.
[I 2025-08-30 19:23:14,483] Trial 477 finished with values: [-1000000000.0, 1000000000.0] and parameters: {'p_sma': 34, 'p_std': 34, 'p_atr': 10, 'p_adx': 19, 'rsi_period': 23, 'ema1': 17, 'ema2': 33, 'slip_atr_k': 0.10597568938596913, 'slip_spread_k': 0.42080633100773723, 'spread_hl_frac': 0.02204980972888759, 'bb_std_mult': 2.103024907017726, 'rsi_os': 52, 'rsi_ob': 83, 'vol_spike': 0.17735036676069788, 'adx_thresh': 10.751377421725756, 'atr_min_pct': 0.001350845764638094, 'atr_max_pct': 0.09519145383848006, 'tp_mult': 2.3658812746063225, 'tsl_mult': 0.7891176186948341, 'strategy': 'mean_reversion', 'time_stop': 236, 'use_sma': True, 'use_atr': True, 'use_adx': True, 'use_ema': False, 'use_spike': True, 'rsi_required': True, 'edge_k': 1.5972707522586527, 'edge_cap': 0.6557798355977817, 'bull_strategy': 'mean_reversion', 'bull_bb_std_mult': 1.2091939836372836, 'bull_rsi_os': 42, 'bull_rsi_ob': 70, 'bull_adx_thresh': 25.550948534999964, 'bull_atr_min_pct': 0.012399271254498677, 'bull_atr_max_pct': 0.12082148621756184, 'bull_tp_mult': 2.016565298041192, 'bull_tsl_mult': 0.6431752171456375, 'bull_time_stop': 166, 'bull_use_sma': True, 'bull_use_ema': True, 'bull_use_atr': True, 'bull_use_adx': False, 'bull_use_spike': False, 'bull_rsi_required': True, 'bear_strategy': 'breakout', 'bear_bb_std_mult': 1.0253434699508543, 'bear_rsi_os': 49, 'bear_rsi_ob': 70, 'bear_adx_thresh': 25.76394781653622, 'bear_atr_min_pct': 0.015851686247458197, 'bear_atr_max_pct': 0.028745785726792303, 'bear_tp_mult': 1.7254196243301592, 'bear_tsl_mult': 0.7267943925391847, 'bear_time_stop': 196, 'bear_use_sma': True, 'bear_use_ema': False, 'bear_use_atr': False, 'bear_use_adx': False, 'bear_use_spike': False, 'bear_rsi_required': True, 'sideways_strategy': 'breakout', 'sideways_bb_std_mult': 1.16324564380141, 'sideways_rsi_os': 30, 'sideways_rsi_ob': 82, 'sideways_adx_thresh': 15.739128888941895, 'sideways_atr_min_pct': 0.012734638260509065, 'sideways_atr_max_pct': 0.13251490621888548, 'sideways_tp_mult': 2.272741321033179, 'sideways_tsl_mult': 0.9326930005324735, 'sideways_time_stop': 162, 'sideways_use_sma': False, 'sideways_use_ema': True, 'sideways_use_atr': True, 'sideways_use_adx': False, 'sideways_use_spike': False, 'sideways_rsi_required': True}.
