[I 2025-08-30 19:10:07,028] Trial 363 finished with values: [-1000000000.0, 1000000000.0] and parameters: {'p_sma': 60, 'p_std': 25, 'p_atr': 9, 'p_adx': 15, 'rsi_period': 13, 'ema1': 23, 'ema2': 17, 'slip_atr_k': 0.15760500140353043, 'slip_spread_k': 0.3514294216775118, 'spread_hl_frac': 0.0492325624544783, 'bb_std_mult': 2.1521469467339616, 'rsi_os': 33, 'rsi_ob': 81, 'vol_spike': 0.23203181159536035, 'adx_thresh': 33.36959365901364, 'atr_min_pct': 0.02409037790228704, 'atr_max_pct': 0.11882689742121176, 'tp_mult': 2.284569872877387, 'tsl_mult': 0.4802188442754452, 'strategy': 'mean_reversion', 'time_stop': 40, 'use_sma': False, 'use_atr': True, 'use_adx': True, 'use_ema': False, 'use_spike': True, 'rsi_required': False, 'edge_k': 0.03716681923871701, 'edge_cap': 0.782360770045976, 'bull_strategy': 'mean_reversion', 'bull_bb_std_mult': 3.121567676192755, 'bull_rsi_os': 32, 'bull_rsi_ob': 50, 'bull_adx_thresh': 15.568133343808137, 'bull_atr_min_pct': 0.00068501106423176, 'bull_atr_max_pct': 0.117296534500073, 'bull_tp_mult': 2.755750674916776, 'bull_tsl_mult': 0.22277687612116986, 'bull_time_stop': 44, 'bull_use_sma': False, 'bull_use_ema': True, 'bull_use_atr': False, 'bull_use_adx': False, 'bull_use_spike': True, 'bull_rsi_required': True, 'bear_strategy': 'mean_reversion', 'bear_bb_std_mult': 2.8769833138334646, 'bear_rsi_os': 50, 'bear_rsi_ob': 63, 'bear_adx_thresh': 18.354409753293254, 'bear_atr_min_pct': 0.00722607732292618, 'bear_atr_max_pct': 0.14999716903254628, 'bear_tp_mult': 1.2537959579496463, 'bear_tsl_mult': 0.7497117635161109, 'bear_time_stop': 254, 'bear_use_sma': True, 'bear_use_ema': True, 'bear_use_atr': False, 'bear_use_adx': False, 'bear_use_spike': False, 'bear_rsi_required': True, 'sideways_strategy': 'breakout', 'sideways_bb_std_mult': 1.826983232084102, 'sideways_rsi_os': 35, 'sideways_rsi_ob': 59, 'sideways_adx_thresh': 9.62973331248929, 'sideways_atr_min_pct': 0.00898088622650281, 'sideways_atr_max_pct': 0.08781540175532324, 'sideways_tp_mult': 1.0340748336673162, 'sideways_tsl_mult': 0.9458829446337031, 'sideways_time_stop': 43, 'sideways_use_sma': False, 'sideways_use_ema': True, 'sideways_use_atr': True, 'sideways_use_adx': False, 'sideways_use_spike': False, 'sideways_rsi_required': True}.
[I 2025-08-30 19:10:07,395] Trial 361 finished with values: [-0.057038997571995265, 0.05702730877500625] and parameters: {'p_sma': 29, 'p_std': 35, 'p_atr': 9, 'p_adx': 13, 'rsi_period': 33, 'ema1': 29, 'ema2': 31, 'slip_atr_k': 0.0823330039903412, 'slip_spread_k': 0.15888955639362026, 'spread_hl_frac': 0.017506119615081077, 'bb_std_mult': 2.3152374670561238, 'rsi_os': 33, 'rsi_ob': 87, 'vol_spike': 0.236667773868084, 'adx_thresh': 33.37874698732104, 'atr_min_pct': 0.02412638560553512, 'atr_max_pct': 0.07641464240172198, 'tp_mult': 2.409461755776099, 'tsl_mult': 0.8361807954135011, 'strategy': 'mean_reversion', 'time_stop': 201, 'use_sma': False, 'use_atr': True, 'use_adx': True, 'use_ema': False, 'use_spike': True, 'rsi_required': False, 'edge_k': 0.05481899413439931, 'edge_cap': 0.4648458078149684, 'bull_strategy': 'mean_reversion', 'bull_bb_std_mult': 2.99956286900929, 'bull_rsi_os': 43, 'bull_rsi_ob': 51, 'bull_adx_thresh': 18.438609970625738, 'bull_atr_min_pct': 0.022741753485635088, 'bull_atr_max_pct': 0.08504607218020706, 'bull_tp_mult': 2.8175516325710563, 'bull_tsl_mult': 0.5579639434422218, 'bull_time_stop': 296, 'bull_use_sma': False, 'bull_use_ema': True, 'bull_use_atr': True, 'bull_use_adx': False, 'bull_use_spike': False, 'bull_rsi_required': True, 'bear_strategy': 'breakout', 'bear_bb_std_mult': 3.4490741698847946, 'bear_rsi_os': 12, 'bear_rsi_ob': 77, 'bear_adx_thresh': 17.728155670060715, 'bear_atr_min_pct': 0.028652763384367827, 'bear_atr_max_pct': 0.012778809059184298, 'bear_tp_mult': 2.6238711096019394, 'bear_tsl_mult': 0.5615256744035424, 'bear_time_stop': 175, 'bear_use_sma': True, 'bear_use_ema': True, 'bear_use_atr': False, 'bear_use_adx': False, 'bear_use_spike': False, 'bear_rsi_required': True, 'sideways_strategy': 'breakout', 'sideways_bb_std_mult': 3.283828127947271, 'sideways_rsi_os': 35, 'sideways_rsi_ob': 59, 'sideways_adx_thresh': 19.2897813104714, 'sideways_atr_min_pct': 0.0007162499003086607, 'sideways_atr_max_pct': 0.14204248388719923, 'sideways_tp_mult': 1.048747435911481, 'sideways_tsl_mult': 0.9550456434807219, 'sideways_time_stop': 140, 'sideways_use_sma': False, 'sideways_use_ema': True, 'sideways_use_atr': True, 'sideways_use_adx': False, 'sideways_use_spike': False, 'sideways_rsi_required': True}.
[I 2025-08-30 19:10:07,698] Trial 362 finished with values: [-1000000000.0, 1000000000.0] and parameters: {'p_sma': 6, 'p_std': 27, 'p_atr': 14, 'p_adx': 26, 'rsi_period': 53, 'ema1': 29, 'ema2': 44, 'slip_atr_k': 0.05949092603245803, 'slip_spread_k': 0.16918640241786714, 'spread_hl_frac': 0.02511420889140721, 'bb_std_mult': 2.4171709640550967, 'rsi_os': 48, 'rsi_ob': 89, 'vol_spike': 0.15770540667258656, 'adx_thresh': 14.592288839066462, 'atr_min_pct': 0.01367381631127936, 'atr_max_pct': 0.07211821428283469, 'tp_mult': 1.5311867354498663, 'tsl_mult': 0.8287113326676709, 'strategy': 'mean_reversion', 'time_stop': 167, 'use_sma': False, 'use_atr': True, 'use_adx': True, 'use_ema': False, 'use_spike': True, 'rsi_required': False, 'edge_k': 0.0008507191553017712, 'edge_cap': 0.5428474505700407, 'bull_strategy': 'mean_reversion', 'bull_bb_std_mult': 1.6946073782447395, 'bull_rsi_os': 43, 'bull_rsi_ob': 47, 'bull_adx_thresh': 20.02551808661307, 'bull_atr_min_pct': 0.022507468261865393, 'bull_atr_max_pct': 0.1171840763598291, 'bull_tp_mult': 1.4300775761111857, 'bull_tsl_mult': 0.557312722804972, 'bull_time_stop': 48, 'bull_use_sma': False, 'bull_use_ema': True, 'bull_use_atr': True, 'bull_use_adx': False, 'bull_use_spike': True, 'bull_rsi_required': True, 'bear_strategy': 'mean_reversion', 'bear_bb_std_mult': 3.446106421072211, 'bear_rsi_os': 52, 'bear_rsi_ob': 77, 'bear_adx_thresh': 34.78051793122533, 'bear_atr_min_pct': 0.0076035110953214715, 'bear_atr_max_pct': 0.08146734069921724, 'bear_tp_mult': 1.238777363974797, 'bear_tsl_mult': 0.5586728014817441, 'bear_time_stop': 254, 'bear_use_sma': True, 'bear_use_ema': True, 'bear_use_atr': False, 'bear_use_adx': False, 'bear_use_spike': False, 'bear_rsi_required': True, 'sideways_strategy': 'breakout', 'sideways_bb_std_mult': 2.3382050692547716, 'sideways_rsi_os': 47, 'sideways_rsi_ob': 67, 'sideways_adx_thresh': 9.953903027593645, 'sideways_atr_min_pct': 0.019689013976332406, 'sideways_atr_max_pct': 0.11231385574555637, 'sideways_tp_mult': 1.6267092787625868, 'sideways_tsl_mult': 0.9529751572330625, 'sideways_time_stop': 140, 'sideways_use_sma': False, 'sideways_use_ema': True, 'sideways_use_atr': True, 'sideways_use_adx': False, 'sideways_use_spike': False, 'sideways_rsi_required': True}.
[I 2025-08-30 19:10:07,716] Trial 360 finished with values: [-1000000000.0, 1000000000.0] and parameters: {'p_sma': 6, 'p_std': 41, 'p_atr': 23, 'p_adx': 30, 'rsi_period': 84, 'ema1': 28, 'ema2': 34, 'slip_atr_k': 0.060032966135862835, 'slip_spread_k': 0.16121997157895648, 'spread_hl_frac': 0.021857441677206796, 'bb_std_mult': 2.2926597696342887, 'rsi_os': 48, 'rsi_ob': 76, 'vol_spike': 0.2339628694067177, 'adx_thresh': 33.488125396643525, 'atr_min_pct': 0.024684050769323784, 'atr_max_pct': 0.07609983566844153, 'tp_mult': 2.3850085751878565, 'tsl_mult': 0.8437568234842164, 'strategy': 'mean_reversion', 'time_stop': 169, 'use_sma': False, 'use_atr': True, 'use_adx': True, 'use_ema': False, 'use_spike': True, 'rsi_required': False, 'edge_k': 0.2577964165578215, 'edge_cap': 0.44804226724440305, 'bull_strategy': 'mean_reversion', 'bull_bb_std_mult': 0.7002554051946865, 'bull_rsi_os': 48, 'bull_rsi_ob': 56, 'bull_adx_thresh': 24.391281023070718, 'bull_atr_min_pct': 0.0028854663868771472, 'bull_atr_max_pct': 0.1168462716837686, 'bull_tp_mult': 2.742685237305724, 'bull_tsl_mult': 0.09413070720753475, 'bull_time_stop': 176, 'bull_use_sma': False, 'bull_use_ema': True, 'bull_use_atr': True, 'bull_use_adx': False, 'bull_use_spike': False, 'bull_rsi_required': True, 'bear_strategy': 'breakout', 'bear_bb_std_mult': 2.8801975559848008, 'bear_rsi_os': 51, 'bear_rsi_ob': 78, 'bear_adx_thresh': 17.62132987315796, 'bear_atr_min_pct': 0.006966909349180343, 'bear_atr_max_pct': 0.13608021633279616, 'bear_tp_mult': 1.4724920446079632, 'bear_tsl_mult': 0.36217618341671587, 'bear_time_stop': 208, 'bear_use_sma': True, 'bear_use_ema': True, 'bear_use_atr': False, 'bear_use_adx': False, 'bear_use_spike': False, 'bear_rsi_required': True, 'sideways_strategy': 'breakout', 'sideways_bb_std_mult': 2.34362234413656, 'sideways_rsi_os': 35, 'sideways_rsi_ob': 59, 'sideways_adx_thresh': 20.782266804172323, 'sideways_atr_min_pct': 0.01926938465342643, 'sideways_atr_max_pct': 0.11227103258290472, 'sideways_tp_mult': 1.1545224464323727, 'sideways_tsl_mult': 0.9552707553899562, 'sideways_time_stop': 238, 'sideways_use_sma': False, 'sideways_use_ema': True, 'sideways_use_atr': True, 'sideways_use_adx': False, 'sideways_use_spike': False, 'sideways_rsi_required': True}.
[I 2025-08-30 19:10:41,088] Trial 367 finished with values: [-0.03141474001312039, 0.03133483274708915] and parameters: {'p_sma': 42, 'p_std': 28, 'p_atr': 27, 'p_adx': 21, 'rsi_period': 28, 'ema1': 24, 'ema2': 30, 'slip_atr_k': 0.0688400452833769, 'slip_spread_k': 0.12444628980275567, 'spread_hl_frac': 0.01170835230884092, 'bb_std_mult': 2.057487131554417, 'rsi_os': 7, 'rsi_ob': 83, 'vol_spike': 0.2989584151526242, 'adx_thresh': 32.62417297215945, 'atr_min_pct': 0.02517963268330869, 'atr_max_pct': 0.09207602890504915, 'tp_mult': 2.234784173574363, 'tsl_mult': 0.8639400301514681, 'strategy': 'mean_reversion', 'time_stop': 233, 'use_sma': True, 'use_atr': True, 'use_adx': True, 'use_ema': True, 'use_spike': False, 'rsi_required': False, 'edge_k': 0.5272481055828273, 'edge_cap': 0.10929848099886147, 'bull_strategy': 'breakout', 'bull_bb_std_mult': 1.4199852258307906, 'bull_rsi_os': 54, 'bull_rsi_ob': 46, 'bull_adx_thresh': 18.269858911065512, 'bull_atr_min_pct': 0.010312307842628085, 'bull_atr_max_pct': 0.019347118359731977, 'bull_tp_mult': 2.7313189488777248, 'bull_tsl_mult': 0.3561743429748857, 'bull_time_stop': 201, 'bull_use_sma': False, 'bull_use_ema': False, 'bull_use_atr': False, 'bull_use_adx': False, 'bull_use_spike': False, 'bull_rsi_required': True, 'bear_strategy': 'breakout', 'bear_bb_std_mult': 2.9983939427119517, 'bear_rsi_os': 18, 'bear_rsi_ob': 65, 'bear_adx_thresh': 16.441450708151514, 'bear_atr_min_pct': 0.01507784552348534, 'bear_atr_max_pct': 0.07715035177664638, 'bear_tp_mult': 2.155997475460519, 'bear_tsl_mult': 0.834663128592432, 'bear_time_stop': 241, 'bear_use_sma': False, 'bear_use_ema': False, 'bear_use_atr': True, 'bear_use_adx': False, 'bear_use_spike': True, 'bear_rsi_required': False, 'sideways_strategy': 'breakout', 'sideways_bb_std_mult': 2.510052334463286, 'sideways_rsi_os': 38, 'sideways_rsi_ob': 47, 'sideways_adx_thresh': 14.790287521193724, 'sideways_atr_min_pct': 0.0018154901268959012, 'sideways_atr_max_pct': 0.13195480114945546, 'sideways_tp_mult': 1.0892232103149027, 'sideways_tsl_mult': 0.18175791956246717, 'sideways_time_stop': 226, 'sideways_use_sma': False, 'sideways_use_ema': True, 'sideways_use_atr': True, 'sideways_use_adx': True, 'sideways_use_spike': False, 'sideways_rsi_required': True}.
[I 2025-08-30 19:10:41,115] Trial 366 finished with values: [-1000000000.0, 1000000000.0] and parameters: {'p_sma': 8, 'p_std': 59, 'p_atr': 27, 'p_adx': 10, 'rsi_period': 28, 'ema1': 28, 'ema2': 30, 'slip_atr_k': 0.06970898508240561, 'slip_spread_k': 0.1302860039250585, 'spread_hl_frac': 0.001286537627112335, 'bb_std_mult': 2.219854798223631, 'rsi_os': 48, 'rsi_ob': 76, 'vol_spike': 0.1455772972248305, 'adx_thresh': 34.99350835656401, 'atr_min_pct': 0.029749978386591824, 'atr_max_pct': 0.0916733479190534, 'tp_mult': 1.4211663453819434, 'tsl_mult': 0.5530220922027621, 'strategy': 'mean_reversion', 'time_stop': 187, 'use_sma': False, 'use_atr': True, 'use_adx': True, 'use_ema': True, 'use_spike': True, 'rsi_required': False, 'edge_k': 0.1450699736157599, 'edge_cap': 0.9681531686684013, 'bull_strategy': 'breakout', 'bull_bb_std_mult': 3.0584626915902446, 'bull_rsi_os': 30, 'bull_rsi_ob': 75, 'bull_adx_thresh': 6.193030051931737, 'bull_atr_min_pct': 0.005726038490459646, 'bull_atr_max_pct': 0.04122920986747042, 'bull_tp_mult': 2.7249889515584726, 'bull_tsl_mult': 0.9695502357187552, 'bull_time_stop': 161, 'bull_use_sma': False, 'bull_use_ema': False, 'bull_use_atr': True, 'bull_use_adx': False, 'bull_use_spike': False, 'bull_rsi_required': True, 'bear_strategy': 'breakout', 'bear_bb_std_mult': 2.9874689060216926, 'bear_rsi_os': 54, 'bear_rsi_ob': 65, 'bear_adx_thresh': 19.94874766182623, 'bear_atr_min_pct': 0.01829412202250599, 'bear_atr_max_pct': 0.07716436574188479, 'bear_tp_mult': 1.0963942653887977, 'bear_tsl_mult': 0.773220908169168, 'bear_time_stop': 193, 'bear_use_sma': False, 'bear_use_ema': False, 'bear_use_atr': True, 'bear_use_adx': False, 'bear_use_spike': True, 'bear_rsi_required': False, 'sideways_strategy': 'breakout', 'sideways_bb_std_mult': 2.670388885013364, 'sideways_rsi_os': 29, 'sideways_rsi_ob': 62, 'sideways_adx_thresh': 21.841097843181327, 'sideways_atr_min_pct': 0.024269218551757357, 'sideways_atr_max_pct': 0.07938906603061462, 'sideways_tp_mult': 1.0863820343055122, 'sideways_tsl_mult': 0.9725209911688304, 'sideways_time_stop': 267, 'sideways_use_sma': False, 'sideways_use_ema': True, 'sideways_use_atr': True, 'sideways_use_adx': False, 'sideways_use_spike': False, 'sideways_rsi_required': True}.
[I 2025-08-30 19:10:41,202] Trial 365 finished with values: [-1000000000.0, 1000000000.0] and parameters: {'p_sma': 7, 'p_std': 41, 'p_atr': 10, 'p_adx': 26, 'rsi_period': 28, 'ema1': 28, 'ema2': 27, 'slip_atr_k': 0.061749923120883066, 'slip_spread_k': 0.16093397877465782, 'spread_hl_frac': 0.025194743965639147, 'bb_std_mult': 1.1534893368350252, 'rsi_os': 48, 'rsi_ob': 83, 'vol_spike': 0.2529364332734306, 'adx_thresh': 32.81499142995538, 'atr_min_pct': 0.029818870549131057, 'atr_max_pct': 0.1285454733304039, 'tp_mult': 1.2881856283284536, 'tsl_mult': 0.7042322824911601, 'strategy': 'mean_reversion', 'time_stop': 212, 'use_sma': False, 'use_atr': True, 'use_adx': True, 'use_ema': True, 'use_spike': True, 'rsi_required': False, 'edge_k': 0.1507193839204385, 'edge_cap': 0.5442207670784394, 'bull_strategy': 'mean_reversion', 'bull_bb_std_mult': 1.7309909810623538, 'bull_rsi_os': 30, 'bull_rsi_ob': 77, 'bull_adx_thresh': 19.94069579740513, 'bull_atr_min_pct': 0.010430277068665075, 'bull_atr_max_pct': 0.08974848008743301, 'bull_tp_mult': 2.719150568905336, 'bull_tsl_mult': 0.9649018443151309, 'bull_time_stop': 176, 'bull_use_sma': False, 'bull_use_ema': True, 'bull_use_atr': True, 'bull_use_adx': False, 'bull_use_spike': False, 'bull_rsi_required': True, 'bear_strategy': 'breakout', 'bear_bb_std_mult': 2.720025601696187, 'bear_rsi_os': 52, 'bear_rsi_ob': 78, 'bear_adx_thresh': 20.02548612087049, 'bear_atr_min_pct': 0.008924774379362933, 'bear_atr_max_pct': 0.03982470798920023, 'bear_tp_mult': 1.469236534646005, 'bear_tsl_mult': 0.8281720378708015, 'bear_time_stop': 147, 'bear_use_sma': True, 'bear_use_ema': False, 'bear_use_atr': True, 'bear_use_adx': False, 'bear_use_spike': True, 'bear_rsi_required': True, 'sideways_strategy': 'breakout', 'sideways_bb_std_mult': 3.1801066072240483, 'sideways_rsi_os': 29, 'sideways_rsi_ob': 48, 'sideways_adx_thresh': 16.728611968821525, 'sideways_atr_min_pct': 0.0016847855562289998, 'sideways_atr_max_pct': 0.11234299083903154, 'sideways_tp_mult': 2.1255301141827196, 'sideways_tsl_mult': 0.18573221208330998, 'sideways_time_stop': 226, 'sideways_use_sma': False, 'sideways_use_ema': True, 'sideways_use_atr': True, 'sideways_use_adx': False, 'sideways_use_spike': False, 'sideways_rsi_required': True}.
[I 2025-08-30 19:10:41,346] Trial 364 finished with values: [-1000000000.0, 1000000000.0] and parameters: {'p_sma': 6, 'p_std': 35, 'p_atr': 9, 'p_adx': 30, 'rsi_period': 28, 'ema1': 28, 'ema2': 44, 'slip_atr_k': 0.18773854897496633, 'slip_spread_k': 0.12296840405085897, 'spread_hl_frac': 0.011878113658969763, 'bb_std_mult': 2.2871533459870266, 'rsi_os': 48, 'rsi_ob': 83, 'vol_spike': 0.15789594464708676, 'adx_thresh': 14.55301223804035, 'atr_min_pct': 0.02483894556198939, 'atr_max_pct': 0.10371451458545534, 'tp_mult': 1.6489546920473617, 'tsl_mult': 0.25695659283565686, 'strategy': 'mean_reversion', 'time_stop': 165, 'use_sma': False, 'use_atr': True, 'use_adx': True, 'use_ema': True, 'use_spike': True, 'rsi_required': False, 'edge_k': 0.16843236009326365, 'edge_cap': 0.9443800492394292, 'bull_strategy': 'mean_reversion', 'bull_bb_std_mult': 3.0004924447623247, 'bull_rsi_os': 54, 'bull_rsi_ob': 48, 'bull_adx_thresh': 14.039786033640404, 'bull_atr_min_pct': 0.01043016221891548, 'bull_atr_max_pct': 0.044636991448701695, 'bull_tp_mult': 2.744151922722464, 'bull_tsl_mult': 0.964281787853889, 'bull_time_stop': 161, 'bull_use_sma': False, 'bull_use_ema': True, 'bull_use_atr': True, 'bull_use_adx': False, 'bull_use_spike': False, 'bull_rsi_required': True, 'bear_strategy': 'breakout', 'bear_bb_std_mult': 2.9849932872222946, 'bear_rsi_os': 52, 'bear_rsi_ob': 78, 'bear_adx_thresh': 17.400709923327312, 'bear_atr_min_pct': 0.027432463533989912, 'bear_atr_max_pct': 0.0768374083775443, 'bear_tp_mult': 1.5739281111044128, 'bear_tsl_mult': 0.8298201911273155, 'bear_time_stop': 195, 'bear_use_sma': True, 'bear_use_ema': False, 'bear_use_atr': False, 'bear_use_adx': False, 'bear_use_spike': True, 'bear_rsi_required': True, 'sideways_strategy': 'breakout', 'sideways_bb_std_mult': 2.32621675110783, 'sideways_rsi_os': 29, 'sideways_rsi_ob': 59, 'sideways_adx_thresh': 19.06181908558103, 'sideways_atr_min_pct': 0.0018106611125044204, 'sideways_atr_max_pct': 0.11172048620724372, 'sideways_tp_mult': 1.621884330724426, 'sideways_tsl_mult': 0.9647613094520288, 'sideways_time_stop': 161, 'sideways_use_sma': False, 'sideways_use_ema': True, 'sideways_use_atr': True, 'sideways_use_adx': False, 'sideways_use_spike': False, 'sideways_rsi_required': True}.
[I 2025-08-30 19:11:15,947] Trial 369 finished with values: [-1000000000.0, 1000000000.0] and parameters: {'p_sma': 9, 'p_std': 31, 'p_atr': 10, 'p_adx': 19, 'rsi_period': 75, 'ema1': 22, 'ema2': 31, 'slip_atr_k': 0.009973415483261597, 'slip_spread_k': 0.1918757029511208, 'spread_hl_frac': 0.0396229548266933, 'bb_std_mult': 2.899584355866631, 'rsi_os': 18, 'rsi_ob': 93, 'vol_spike': 0.18859939742056797, 'adx_thresh': 33.99198162363424, 'atr_min_pct': 0.009229088292313264, 'atr_max_pct': 0.10355513650967742, 'tp_mult': 1.651389509354062, 'tsl_mult': 0.2651846542718166, 'strategy': 'mean_reversion', 'time_stop': 65, 'use_sma': False, 'use_atr': False, 'use_adx': False, 'use_ema': False, 'use_spike': True, 'rsi_required': False, 'edge_k': 1.0230925586329775, 'edge_cap': 0.918117646002701, 'bull_strategy': 'mean_reversion', 'bull_bb_std_mult': 3.331069305506808, 'bull_rsi_os': 33, 'bull_rsi_ob': 77, 'bull_adx_thresh': 21.59382110050683, 'bull_atr_min_pct': 0.025432706835650035, 'bull_atr_max_pct': 0.1445401996478866, 'bull_tp_mult': 2.695156282495313, 'bull_tsl_mult': 0.2474026819165142, 'bull_time_stop': 93, 'bull_use_sma': False, 'bull_use_ema': True, 'bull_use_atr': True, 'bull_use_adx': True, 'bull_use_spike': False, 'bull_rsi_required': False, 'bear_strategy': 'mean_reversion', 'bear_bb_std_mult': 2.712539604391513, 'bear_rsi_os': 50, 'bear_rsi_ob': 74, 'bear_adx_thresh': 18.338694250675424, 'bear_atr_min_pct': 0.008578924022406353, 'bear_atr_max_pct': 0.1221334297101292, 'bear_tp_mult': 2.7186122451159194, 'bear_tsl_mult': 0.24844931667185166, 'bear_time_stop': 107, 'bear_use_sma': True, 'bear_use_ema': True, 'bear_use_atr': False, 'bear_use_adx': False, 'bear_use_spike': False, 'bear_rsi_required': True, 'sideways_strategy': 'mean_reversion', 'sideways_bb_std_mult': 3.180407957979354, 'sideways_rsi_os': 33, 'sideways_rsi_ob': 57, 'sideways_adx_thresh': 20.949457983075508, 'sideways_atr_min_pct': 0.02339590478354891, 'sideways_atr_max_pct': 0.1497799681569348, 'sideways_tp_mult': 2.2178254450793067, 'sideways_tsl_mult': 0.9819831852293552, 'sideways_time_stop': 176, 'sideways_use_sma': False, 'sideways_use_ema': False, 'sideways_use_atr': True, 'sideways_use_adx': False, 'sideways_use_spike': False, 'sideways_rsi_required': True}.
