[I 2025-08-30 18:56:00,997] Trial 234 finished with values: [-0.030727024598006802, 0.03063857116768724] and parameters: {'p_sma': 50, 'p_std': 18, 'p_atr': 24, 'p_adx': 27, 'rsi_period': 24, 'ema1': 26, 'ema2': 15, 'slip_atr_k': 0.07501491122624832, 'slip_spread_k': 0.13907082125951287, 'spread_hl_frac': 0.02404340271521086, 'bb_std_mult': 2.053029359793921, 'rsi_os': 9, 'rsi_ob': 84, 'vol_spike': 0.04397842606220441, 'adx_thresh': 34.43207136798779, 'atr_min_pct': 0.024167066247168297, 'atr_max_pct': 0.09337714341541464, 'tp_mult': 2.2764478327142754, 'tsl_mult': 0.5385070082936241, 'strategy': 'mean_reversion', 'time_stop': 185, 'use_sma': False, 'use_atr': True, 'use_adx': True, 'use_ema': False, 'use_spike': True, 'rsi_required': False, 'edge_k': 1.7830606706106789, 'edge_cap': 0.16136615984412123, 'bull_strategy': 'mean_reversion', 'bull_bb_std_mult': 3.172777564835361, 'bull_rsi_os': 21, 'bull_rsi_ob': 46, 'bull_adx_thresh': 29.471247727776614, 'bull_atr_min_pct': 0.024763157515565574, 'bull_atr_max_pct': 0.11907205778749325, 'bull_tp_mult': 1.101308054029785, 'bull_tsl_mult': 0.5215870337610239, 'bull_time_stop': 175, 'bull_use_sma': False, 'bull_use_ema': True, 'bull_use_atr': True, 'bull_use_adx': False, 'bull_use_spike': False, 'bull_rsi_required': True, 'bear_strategy': 'breakout', 'bear_bb_std_mult': 2.6250208777752726, 'bear_rsi_os': 51, 'bear_rsi_ob': 75, 'bear_adx_thresh': 17.403327570137602, 'bear_atr_min_pct': 0.01544370124248104, 'bear_atr_max_pct': 0.10690772824102293, 'bear_tp_mult': 2.6307535678922447, 'bear_tsl_mult': 0.19843417450098733, 'bear_time_stop': 207, 'bear_use_sma': False, 'bear_use_ema': True, 'bear_use_atr': False, 'bear_use_adx': False, 'bear_use_spike': False, 'bear_rsi_required': False, 'sideways_strategy': 'breakout', 'sideways_bb_std_mult': 2.156034750479282, 'sideways_rsi_os': 36, 'sideways_rsi_ob': 60, 'sideways_adx_thresh': 21.528621143808273, 'sideways_atr_min_pct': 0.0018765662995173186, 'sideways_atr_max_pct': 0.10728649379187084, 'sideways_tp_mult': 1.1174450779895793, 'sideways_tsl_mult': 0.8141304629194044, 'sideways_time_stop': 92, 'sideways_use_sma': False, 'sideways_use_ema': True, 'sideways_use_atr': True, 'sideways_use_adx': False, 'sideways_use_spike': False, 'sideways_rsi_required': True}.
[I 2025-08-30 18:56:03,254] Trial 236 finished with values: [-1000000000.0, 1000000000.0] and parameters: {'p_sma': 50, 'p_std': 47, 'p_atr': 10, 'p_adx': 20, 'rsi_period': 24, 'ema1': 26, 'ema2': 30, 'slip_atr_k': 0.09190891403196762, 'slip_spread_k': 0.1391778694080396, 'spread_hl_frac': 0.024047494242914892, 'bb_std_mult': 2.062082578813214, 'rsi_os': 9, 'rsi_ob': 82, 'vol_spike': 0.03908026156962409, 'adx_thresh': 34.03668112018905, 'atr_min_pct': 0.024297987092394804, 'atr_max_pct': 0.09456018620118208, 'tp_mult': 2.303569764555804, 'tsl_mult': 0.8408978706173041, 'strategy': 'mean_reversion', 'time_stop': 195, 'use_sma': False, 'use_atr': True, 'use_adx': True, 'use_ema': False, 'use_spike': True, 'rsi_required': True, 'edge_k': 0.12718898380427457, 'edge_cap': 0.2280039468480149, 'bull_strategy': 'mean_reversion', 'bull_bb_std_mult': 3.0813356216556596, 'bull_rsi_os': 30, 'bull_rsi_ob': 63, 'bull_adx_thresh': 18.000007479934695, 'bull_atr_min_pct': 0.024802549388954147, 'bull_atr_max_pct': 0.06882189730152712, 'bull_tp_mult': 1.7108696858248706, 'bull_tsl_mult': 0.5210494519367781, 'bull_time_stop': 172, 'bull_use_sma': False, 'bull_use_ema': True, 'bull_use_atr': True, 'bull_use_adx': False, 'bull_use_spike': False, 'bull_rsi_required': True, 'bear_strategy': 'breakout', 'bear_bb_std_mult': 2.8091509035999973, 'bear_rsi_os': 51, 'bear_rsi_ob': 75, 'bear_adx_thresh': 17.389383576527912, 'bear_atr_min_pct': 0.01508521149856695, 'bear_atr_max_pct': 0.020715903030142938, 'bear_tp_mult': 2.622296894740136, 'bear_tsl_mult': 0.733345790295846, 'bear_time_stop': 208, 'bear_use_sma': True, 'bear_use_ema': True, 'bear_use_atr': False, 'bear_use_adx': False, 'bear_use_spike': False, 'bear_rsi_required': True, 'sideways_strategy': 'breakout', 'sideways_bb_std_mult': 2.376797651328486, 'sideways_rsi_os': 34, 'sideways_rsi_ob': 60, 'sideways_adx_thresh': 20.47452731916778, 'sideways_atr_min_pct': 0.0293507344943231, 'sideways_atr_max_pct': 0.013976576339967739, 'sideways_tp_mult': 1.119235679720482, 'sideways_tsl_mult': 0.9973975463369786, 'sideways_time_stop': 142, 'sideways_use_sma': False, 'sideways_use_ema': True, 'sideways_use_atr': False, 'sideways_use_adx': False, 'sideways_use_spike': False, 'sideways_rsi_required': True}.
[I 2025-08-30 18:56:03,260] Trial 235 finished with values: [-1000000000.0, 1000000000.0] and parameters: {'p_sma': 7, 'p_std': 51, 'p_atr': 10, 'p_adx': 20, 'rsi_period': 24, 'ema1': 26, 'ema2': 30, 'slip_atr_k': 0.09136634229366945, 'slip_spread_k': 0.8419724795431, 'spread_hl_frac': 0.02406249391236693, 'bb_std_mult': 2.2963665904219552, 'rsi_os': 47, 'rsi_ob': 84, 'vol_spike': 0.2599334312300471, 'adx_thresh': 34.54055075184838, 'atr_min_pct': 0.024360518955832196, 'atr_max_pct': 0.0935216630179057, 'tp_mult': 1.4693078360552854, 'tsl_mult': 0.8349382939435696, 'strategy': 'mean_reversion', 'time_stop': 184, 'use_sma': False, 'use_atr': True, 'use_adx': True, 'use_ema': False, 'use_spike': True, 'rsi_required': False, 'edge_k': 1.923567504906684, 'edge_cap': 0.49835704710396983, 'bull_strategy': 'mean_reversion', 'bull_bb_std_mult': 3.136811584618039, 'bull_rsi_os': 30, 'bull_rsi_ob': 89, 'bull_adx_thresh': 34.23778235492798, 'bull_atr_min_pct': 0.024475714599410378, 'bull_atr_max_pct': 0.11950448177095858, 'bull_tp_mult': 2.6530579502448965, 'bull_tsl_mult': 0.40182405054719667, 'bull_time_stop': 85, 'bull_use_sma': False, 'bull_use_ema': True, 'bull_use_atr': True, 'bull_use_adx': False, 'bull_use_spike': False, 'bull_rsi_required': True, 'bear_strategy': 'breakout', 'bear_bb_std_mult': 0.8292859510385249, 'bear_rsi_os': 51, 'bear_rsi_ob': 65, 'bear_adx_thresh': 31.732414483757395, 'bear_atr_min_pct': 0.014927020093582773, 'bear_atr_max_pct': 0.060787501075644595, 'bear_tp_mult': 2.6235577751797474, 'bear_tsl_mult': 0.759933218447056, 'bear_time_stop': 202, 'bear_use_sma': False, 'bear_use_ema': True, 'bear_use_atr': False, 'bear_use_adx': False, 'bear_use_spike': False, 'bear_rsi_required': False, 'sideways_strategy': 'breakout', 'sideways_bb_std_mult': 3.1295257272731316, 'sideways_rsi_os': 20, 'sideways_rsi_ob': 60, 'sideways_adx_thresh': 21.410691487122627, 'sideways_atr_min_pct': 0.01606469036891938, 'sideways_atr_max_pct': 0.06515870212991078, 'sideways_tp_mult': 1.1204768715613187, 'sideways_tsl_mult': 0.09187068973969736, 'sideways_time_stop': 144, 'sideways_use_sma': False, 'sideways_use_ema': True, 'sideways_use_atr': True, 'sideways_use_adx': False, 'sideways_use_spike': False, 'sideways_rsi_required': True}.
[I 2025-08-30 18:56:03,457] Trial 237 finished with values: [-1000000000.0, 1000000000.0] and parameters: {'p_sma': 6, 'p_std': 50, 'p_atr': 10, 'p_adx': 20, 'rsi_period': 72, 'ema1': 16, 'ema2': 33, 'slip_atr_k': 0.15601889740734776, 'slip_spread_k': 0.7524824437728046, 'spread_hl_frac': 0.03831595920579777, 'bb_std_mult': 2.0758087483682224, 'rsi_os': 31, 'rsi_ob': 82, 'vol_spike': 0.28280292710837074, 'adx_thresh': 34.49204991719799, 'atr_min_pct': 0.024273476071204943, 'atr_max_pct': 0.09396342058417695, 'tp_mult': 1.878749343133273, 'tsl_mult': 0.844837181963581, 'strategy': 'mean_reversion', 'time_stop': 194, 'use_sma': False, 'use_atr': True, 'use_adx': True, 'use_ema': False, 'use_spike': True, 'rsi_required': True, 'edge_k': 1.5768086015892178, 'edge_cap': 0.31415478571007305, 'bull_strategy': 'mean_reversion', 'bull_bb_std_mult': 1.0131611833457066, 'bull_rsi_os': 30, 'bull_rsi_ob': 70, 'bull_adx_thresh': 18.814101523586586, 'bull_atr_min_pct': 0.000649464650068324, 'bull_atr_max_pct': 0.07725646895992785, 'bull_tp_mult': 2.8765868184782146, 'bull_tsl_mult': 0.517726601425019, 'bull_time_stop': 179, 'bull_use_sma': False, 'bull_use_ema': True, 'bull_use_atr': True, 'bull_use_adx': False, 'bull_use_spike': False, 'bull_rsi_required': True, 'bear_strategy': 'mean_reversion', 'bear_bb_std_mult': 2.823764800099848, 'bear_rsi_os': 49, 'bear_rsi_ob': 76, 'bear_adx_thresh': 25.01243642955798, 'bear_atr_min_pct': 0.022742686826833555, 'bear_atr_max_pct': 0.11605674913594671, 'bear_tp_mult': 2.720146965298876, 'bear_tsl_mult': 0.7614689386294288, 'bear_time_stop': 192, 'bear_use_sma': True, 'bear_use_ema': True, 'bear_use_atr': False, 'bear_use_adx': False, 'bear_use_spike': False, 'bear_rsi_required': True, 'sideways_strategy': 'breakout', 'sideways_bb_std_mult': 0.8034261977498915, 'sideways_rsi_os': 34, 'sideways_rsi_ob': 58, 'sideways_adx_thresh': 33.17949118212609, 'sideways_atr_min_pct': 0.013274051936444445, 'sideways_atr_max_pct': 0.10762253385983424, 'sideways_tp_mult': 1.1197756523561992, 'sideways_tsl_mult': 0.09916999121514225, 'sideways_time_stop': 123, 'sideways_use_sma': False, 'sideways_use_ema': True, 'sideways_use_atr': False, 'sideways_use_adx': False, 'sideways_use_spike': False, 'sideways_rsi_required': True}.
[I 2025-08-30 18:56:36,871] Trial 240 finished with values: [-0.047097190320162685, 0.04699053499054013] and parameters: {'p_sma': 19, 'p_std': 44, 'p_atr': 9, 'p_adx': 21, 'rsi_period': 15, 'ema1': 20, 'ema2': 32, 'slip_atr_k': 0.030043303361697457, 'slip_spread_k': 0.23850188944587838, 'spread_hl_frac': 0.022474702906344377, 'bb_std_mult': 2.165808657131419, 'rsi_os': 48, 'rsi_ob': 81, 'vol_spike': 0.2696963910516871, 'adx_thresh': 32.70576035674511, 'atr_min_pct': 0.02350085413654092, 'atr_max_pct': 0.09236991572821808, 'tp_mult': 2.233535788474588, 'tsl_mult': 0.8686706761195238, 'strategy': 'mean_reversion', 'time_stop': 192, 'use_sma': True, 'use_atr': True, 'use_adx': False, 'use_ema': True, 'use_spike': False, 'rsi_required': False, 'edge_k': 0.21505526248806103, 'edge_cap': 0.5263214386720187, 'bull_strategy': 'breakout', 'bull_bb_std_mult': 0.9841249434681554, 'bull_rsi_os': 31, 'bull_rsi_ob': 46, 'bull_adx_thresh': 18.792032562851134, 'bull_atr_min_pct': 0.002780708112221672, 'bull_atr_max_pct': 0.11762330453770395, 'bull_tp_mult': 1.1134622873569953, 'bull_tsl_mult': 0.33054952118584546, 'bull_time_stop': 195, 'bull_use_sma': False, 'bull_use_ema': True, 'bull_use_atr': True, 'bull_use_adx': True, 'bull_use_spike': False, 'bull_rsi_required': False, 'bear_strategy': 'mean_reversion', 'bear_bb_std_mult': 1.5466458791632074, 'bear_rsi_os': 49, 'bear_rsi_ob': 56, 'bear_adx_thresh': 25.23891455768713, 'bear_atr_min_pct': 0.022667248053131455, 'bear_atr_max_pct': 0.03250862131897236, 'bear_tp_mult': 2.7213288030790297, 'bear_tsl_mult': 0.2815241488556497, 'bear_time_stop': 194, 'bear_use_sma': True, 'bear_use_ema': False, 'bear_use_atr': False, 'bear_use_adx': False, 'bear_use_spike': False, 'bear_rsi_required': True, 'sideways_strategy': 'breakout', 'sideways_bb_std_mult': 0.7574970586237313, 'sideways_rsi_os': 37, 'sideways_rsi_ob': 58, 'sideways_adx_thresh': 22.2382720638864, 'sideways_atr_min_pct': 0.0017572707155774764, 'sideways_atr_max_pct': 0.08173526425730827, 'sideways_tp_mult': 2.705324583759113, 'sideways_tsl_mult': 0.983567192044102, 'sideways_time_stop': 100, 'sideways_use_sma': True, 'sideways_use_ema': True, 'sideways_use_atr': True, 'sideways_use_adx': False, 'sideways_use_spike': False, 'sideways_rsi_required': True}.
[I 2025-08-30 18:56:37,553] Trial 239 finished with values: [-1000000000.0, 1000000000.0] and parameters: {'p_sma': 6, 'p_std': 22, 'p_atr': 9, 'p_adx': 21, 'rsi_period': 68, 'ema1': 15, 'ema2': 33, 'slip_atr_k': 0.1570002576375451, 'slip_spread_k': 0.0676788415829126, 'spread_hl_frac': 0.042466400298197884, 'bb_std_mult': 2.186972823135752, 'rsi_os': 48, 'rsi_ob': 82, 'vol_spike': 0.2700579615201843, 'adx_thresh': 32.99580970891487, 'atr_min_pct': 0.023764619317970463, 'atr_max_pct': 0.09938919843311603, 'tp_mult': 1.8869414580050228, 'tsl_mult': 0.8717693461152977, 'strategy': 'mean_reversion', 'time_stop': 175, 'use_sma': True, 'use_atr': True, 'use_adx': False, 'use_ema': True, 'use_spike': False, 'rsi_required': False, 'edge_k': 1.8569109385095581, 'edge_cap': 0.5303799529757078, 'bull_strategy': 'breakout', 'bull_bb_std_mult': 1.0083731716150344, 'bull_rsi_os': 31, 'bull_rsi_ob': 46, 'bull_adx_thresh': 18.861366199940516, 'bull_atr_min_pct': 0.002654709017853736, 'bull_atr_max_pct': 0.11737079186902959, 'bull_tp_mult': 2.869072097085884, 'bull_tsl_mult': 0.31780070934593946, 'bull_time_stop': 238, 'bull_use_sma': False, 'bull_use_ema': True, 'bull_use_atr': True, 'bull_use_adx': True, 'bull_use_spike': False, 'bull_rsi_required': False, 'bear_strategy': 'mean_reversion', 'bear_bb_std_mult': 2.615210081813861, 'bear_rsi_os': 17, 'bear_rsi_ob': 76, 'bear_adx_thresh': 24.70852249325543, 'bear_atr_min_pct': 0.0009684834839657295, 'bear_atr_max_pct': 0.033413619217326114, 'bear_tp_mult': 1.374388753418464, 'bear_tsl_mult': 0.7892178876830049, 'bear_time_stop': 196, 'bear_use_sma': True, 'bear_use_ema': False, 'bear_use_atr': False, 'bear_use_adx': False, 'bear_use_spike': False, 'bear_rsi_required': True, 'sideways_strategy': 'breakout', 'sideways_bb_std_mult': 0.7971087267209214, 'sideways_rsi_os': 37, 'sideways_rsi_ob': 58, 'sideways_adx_thresh': 22.46868193239793, 'sideways_atr_min_pct': 0.013274483450554854, 'sideways_atr_max_pct': 0.031850730742913856, 'sideways_tp_mult': 2.697062355805108, 'sideways_tsl_mult': 0.9802836379744932, 'sideways_time_stop': 117, 'sideways_use_sma': True, 'sideways_use_ema': True, 'sideways_use_atr': True, 'sideways_use_adx': False, 'sideways_use_spike': False, 'sideways_rsi_required': True}.
[I 2025-08-30 18:56:37,719] Trial 241 finished with values: [-1000000000.0, 1000000000.0] and parameters: {'p_sma': 53, 'p_std': 31, 'p_atr': 9, 'p_adx': 28, 'rsi_period': 49, 'ema1': 8, 'ema2': 21, 'slip_atr_k': 0.1260320260486838, 'slip_spread_k': 0.23251845119224618, 'spread_hl_frac': 0.0225849432756348, 'bb_std_mult': 1.832298784017627, 'rsi_os': 48, 'rsi_ob': 81, 'vol_spike': 0.148120777794804, 'adx_thresh': 32.72350601258775, 'atr_min_pct': 0.023526445269041445, 'atr_max_pct': 0.0743976903370549, 'tp_mult': 2.2540624595451244, 'tsl_mult': 0.9999860143290402, 'strategy': 'breakout', 'time_stop': 128, 'use_sma': True, 'use_atr': True, 'use_adx': False, 'use_ema': True, 'use_spike': False, 'rsi_required': False, 'edge_k': 1.6616817497542198, 'edge_cap': 0.5257609927780706, 'bull_strategy': 'breakout', 'bull_bb_std_mult': 3.3472183797978303, 'bull_rsi_os': 31, 'bull_rsi_ob': 46, 'bull_adx_thresh': 18.3444285551078, 'bull_atr_min_pct': 0.021571363735396226, 'bull_atr_max_pct': 0.11776573210305515, 'bull_tp_mult': 2.950627388120423, 'bull_tsl_mult': 0.023858262568300925, 'bull_time_stop': 195, 'bull_use_sma': True, 'bull_use_ema': False, 'bull_use_atr': True, 'bull_use_adx': True, 'bull_use_spike': False, 'bull_rsi_required': False, 'bear_strategy': 'breakout', 'bear_bb_std_mult': 1.3090549471105697, 'bear_rsi_os': 52, 'bear_rsi_ob': 77, 'bear_adx_thresh': 11.36307061519318, 'bear_atr_min_pct': 0.015913799996350134, 'bear_atr_max_pct': 0.033264787355807124, 'bear_tp_mult': 2.6658639090977454, 'bear_tsl_mult': 0.7940972689497398, 'bear_time_stop': 197, 'bear_use_sma': True, 'bear_use_ema': False, 'bear_use_atr': True, 'bear_use_adx': True, 'bear_use_spike': False, 'bear_rsi_required': True, 'sideways_strategy': 'mean_reversion', 'sideways_bb_std_mult': 2.9817077773774736, 'sideways_rsi_os': 12, 'sideways_rsi_ob': 57, 'sideways_adx_thresh': 22.226452888514537, 'sideways_atr_min_pct': 0.025543839396075765, 'sideways_atr_max_pct': 0.03216125546289203, 'sideways_tp_mult': 1.0682684597876426, 'sideways_tsl_mult': 0.9843698874676599, 'sideways_time_stop': 155, 'sideways_use_sma': True, 'sideways_use_ema': True, 'sideways_use_atr': True, 'sideways_use_adx': False, 'sideways_use_spike': False, 'sideways_rsi_required': True}.
[I 2025-08-30 18:56:37,732] Trial 238 finished with values: [-1000000000.0, 1000000000.0] and parameters: {'p_sma': 7, 'p_std': 22, 'p_atr': 10, 'p_adx': 21, 'rsi_period': 25, 'ema1': 17, 'ema2': 33, 'slip_atr_k': 0.12243498848863402, 'slip_spread_k': 0.24975735909924107, 'spread_hl_frac': 0.02295871955595181, 'bb_std_mult': 2.0655163465929482, 'rsi_os': 18, 'rsi_ob': 82, 'vol_spike': 0.27207921082145975, 'adx_thresh': 33.89121654529312, 'atr_min_pct': 0.024318453336628795, 'atr_max_pct': 0.0932664105279185, 'tp_mult': 2.2387102023168066, 'tsl_mult': 0.8527860823372503, 'strategy': 'mean_reversion', 'time_stop': 124, 'use_sma': False, 'use_atr': True, 'use_adx': True, 'use_ema': True, 'use_spike': True, 'rsi_required': True, 'edge_k': 1.6813768203293797, 'edge_cap': 0.49651123794037105, 'bull_strategy': 'mean_reversion', 'bull_bb_std_mult': 2.053876423340099, 'bull_rsi_os': 30, 'bull_rsi_ob': 56, 'bull_adx_thresh': 18.651257395677973, 'bull_atr_min_pct': 0.012348391877659484, 'bull_atr_max_pct': 0.11908850310821611, 'bull_tp_mult': 2.8677744406170294, 'bull_tsl_mult': 0.5277387400530227, 'bull_time_stop': 238, 'bull_use_sma': False, 'bull_use_ema': True, 'bull_use_atr': True, 'bull_use_adx': False, 'bull_use_spike': False, 'bull_rsi_required': True, 'bear_strategy': 'breakout', 'bear_bb_std_mult': 3.0005523100728952, 'bear_rsi_os': 49, 'bear_rsi_ob': 76, 'bear_adx_thresh': 17.427955044725078, 'bear_atr_min_pct': 0.02994400010734427, 'bear_atr_max_pct': 0.033392508071575094, 'bear_tp_mult': 2.7196335694617573, 'bear_tsl_mult': 0.27773802712102635, 'bear_time_stop': 197, 'bear_use_sma': True, 'bear_use_ema': True, 'bear_use_atr': False, 'bear_use_adx': False, 'bear_use_spike': False, 'bear_rsi_required': True, 'sideways_strategy': 'breakout', 'sideways_bb_std_mult': 2.361104595901346, 'sideways_rsi_os': 20, 'sideways_rsi_ob': 57, 'sideways_adx_thresh': 20.662281259157343, 'sideways_atr_min_pct': 0.0066970382836797, 'sideways_atr_max_pct': 0.14718761421731166, 'sideways_tp_mult': 1.1197441100570318, 'sideways_tsl_mult': 0.979894356723356, 'sideways_time_stop': 300, 'sideways_use_sma': False, 'sideways_use_ema': True, 'sideways_use_atr': False, 'sideways_use_adx': False, 'sideways_use_spike': False, 'sideways_rsi_required': True}.
[I 2025-08-30 18:56:38,313] Trial 242 finished with values: [-1000000000.0, 1000000000.0] and parameters: {'p_sma': 40, 'p_std': 22, 'p_atr': 9, 'p_adx': 21, 'rsi_period': 39, 'ema1': 17, 'ema2': 22, 'slip_atr_k': 0.027939135915882485, 'slip_spread_k': 0.06842645798377861, 'spread_hl_frac': 0.022675832538416544, 'bb_std_mult': 2.184470220038607, 'rsi_os': 48, 'rsi_ob': 81, 'vol_spike': 0.27283004905451186, 'adx_thresh': 32.74296714050795, 'atr_min_pct': 0.023570264914212238, 'atr_max_pct': 0.022354505849744848, 'tp_mult': 2.8883184264838464, 'tsl_mult': 0.8693553317806064, 'strategy': 'breakout', 'time_stop': 127, 'use_sma': True, 'use_atr': True, 'use_adx': False, 'use_ema': True, 'use_spike': False, 'rsi_required': False, 'edge_k': 1.7847110680992238, 'edge_cap': 0.5279705828355299, 'bull_strategy': 'breakout', 'bull_bb_std_mult': 2.976815522617626, 'bull_rsi_os': 28, 'bull_rsi_ob': 58, 'bull_adx_thresh': 27.08350379624999, 'bull_atr_min_pct': 0.006914591919517037, 'bull_atr_max_pct': 0.11810373189133118, 'bull_tp_mult': 2.9605042729245135, 'bull_tsl_mult': 0.5679182397635087, 'bull_time_stop': 192, 'bull_use_sma': True, 'bull_use_ema': False, 'bull_use_atr': True, 'bull_use_adx': True, 'bull_use_spike': False, 'bull_rsi_required': False, 'bear_strategy': 'breakout', 'bear_bb_std_mult': 1.2030558417517605, 'bear_rsi_os': 40, 'bear_rsi_ob': 77, 'bear_adx_thresh': 14.057659905811487, 'bear_atr_min_pct': 0.02988874697483155, 'bear_atr_max_pct': 0.03424131260031936, 'bear_tp_mult': 2.7459902686406474, 'bear_tsl_mult': 0.2617664627418196, 'bear_time_stop': 197, 'bear_use_sma': True, 'bear_use_ema': False, 'bear_use_atr': True, 'bear_use_adx': True, 'bear_use_spike': False, 'bear_rsi_required': True, 'sideways_strategy': 'breakout', 'sideways_bb_std_mult': 2.992613098780804, 'sideways_rsi_os': 36, 'sideways_rsi_ob': 56, 'sideways_adx_thresh': 22.39510150737901, 'sideways_atr_min_pct': 0.027303239588362813, 'sideways_atr_max_pct': 0.08038607055080335, 'sideways_tp_mult': 1.0663069559547196, 'sideways_tsl_mult': 0.9790828811248938, 'sideways_time_stop': 156, 'sideways_use_sma': True, 'sideways_use_ema': True, 'sideways_use_atr': True, 'sideways_use_adx': False, 'sideways_use_spike': False, 'sideways_rsi_required': True}.
