[I 2025-08-30 18:43:36,789] Trial 123 finished with values: [-1000000000.0, 1000000000.0] and parameters: {'p_sma': 8, 'p_std': 34, 'p_atr': 20, 'p_adx': 21, 'rsi_period': 46, 'ema1': 27, 'ema2': 44, 'slip_atr_k': 0.19128641929863902, 'slip_spread_k': 0.14533915180406026, 'spread_hl_frac': 0.009217318038239802, 'bb_std_mult': 2.1113267790685586, 'rsi_os': 20, 'rsi_ob': 71, 'vol_spike': 0.2977828070847172, 'adx_thresh': 28.177666828699667, 'atr_min_pct': 0.02395259097489786, 'atr_max_pct': 0.08529821140673123, 'tp_mult': 2.236325098647023, 'tsl_mult': 0.03807419400258005, 'strategy': 'mean_reversion', 'time_stop': 207, 'use_sma': False, 'use_atr': False, 'use_adx': False, 'use_ema': False, 'use_spike': True, 'rsi_required': False, 'edge_k': 0.26189817055309017, 'edge_cap': 0.7966674382577039, 'bull_strategy': 'mean_reversion', 'bull_bb_std_mult': 2.8000111533821475, 'bull_rsi_os': 31, 'bull_rsi_ob': 89, 'bull_adx_thresh': 15.117823019097383, 'bull_atr_min_pct': 0.00014942778010488796, 'bull_atr_max_pct': 0.10217364282295874, 'bull_tp_mult': 2.882958403558544, 'bull_tsl_mult': 0.2975387465770828, 'bull_time_stop': 46, 'bull_use_sma': False, 'bull_use_ema': True, 'bull_use_atr': False, 'bull_use_adx': True, 'bull_use_spike': True, 'bull_rsi_required': True, 'bear_strategy': 'mean_reversion', 'bear_bb_std_mult': 0.6588111200691633, 'bear_rsi_os': 49, 'bear_rsi_ob': 73, 'bear_adx_thresh': 18.07743598135612, 'bear_atr_min_pct': 0.011559517553142976, 'bear_atr_max_pct': 0.036266124485873436, 'bear_tp_mult': 2.4640979464145794, 'bear_tsl_mult': 0.1921293789442703, 'bear_time_stop': 159, 'bear_use_sma': True, 'bear_use_ema': False, 'bear_use_atr': False, 'bear_use_adx': False, 'bear_use_spike': True, 'bear_rsi_required': True, 'sideways_strategy': 'breakout', 'sideways_bb_std_mult': 2.995645734612887, 'sideways_rsi_os': 48, 'sideways_rsi_ob': 52, 'sideways_adx_thresh': 21.469773815130317, 'sideways_atr_min_pct': 0.01201927485795818, 'sideways_atr_max_pct': 0.1043288945074652, 'sideways_tp_mult': 2.7578739358901703, 'sideways_tsl_mult': 0.7031896622294276, 'sideways_time_stop': 160, 'sideways_use_sma': False, 'sideways_use_ema': True, 'sideways_use_atr': True, 'sideways_use_adx': True, 'sideways_use_spike': False, 'sideways_rsi_required': True}.
[I 2025-08-30 18:43:37,190] Trial 128 finished with values: [-1000000000.0, 1000000000.0] and parameters: {'p_sma': 10, 'p_std': 13, 'p_atr': 11, 'p_adx': 19, 'rsi_period': 47, 'ema1': 21, 'ema2': 36, 'slip_atr_k': 0.2123411003223754, 'slip_spread_k': 0.5218046961139731, 'spread_hl_frac': 0.028049254400840534, 'bb_std_mult': 2.0124115597956678, 'rsi_os': 50, 'rsi_ob': 86, 'vol_spike': 0.27063910644958306, 'adx_thresh': 32.17457000126867, 'atr_min_pct': 0.02403158066909326, 'atr_max_pct': 0.10204459642017258, 'tp_mult': 2.253366283173795, 'tsl_mult': 0.935474345948517, 'strategy': 'mean_reversion', 'time_stop': 87, 'use_sma': False, 'use_atr': True, 'use_adx': True, 'use_ema': False, 'use_spike': True, 'rsi_required': False, 'edge_k': 0.7216136275886813, 'edge_cap': 0.3551326354528147, 'bull_strategy': 'mean_reversion', 'bull_bb_std_mult': 3.3896298357164394, 'bull_rsi_os': 32, 'bull_rsi_ob': 94, 'bull_adx_thresh': 31.852745775979834, 'bull_atr_min_pct': 0.004062153007882348, 'bull_atr_max_pct': 0.027932002738223334, 'bull_tp_mult': 1.6736187488093865, 'bull_tsl_mult': 0.5006590731730532, 'bull_time_stop': 22, 'bull_use_sma': False, 'bull_use_ema': True, 'bull_use_atr': True, 'bull_use_adx': False, 'bull_use_spike': False, 'bull_rsi_required': True, 'bear_strategy': 'breakout', 'bear_bb_std_mult': 2.8110785457977148, 'bear_rsi_os': 47, 'bear_rsi_ob': 76, 'bear_adx_thresh': 20.42691276264382, 'bear_atr_min_pct': 0.01745675803866524, 'bear_atr_max_pct': 0.027328183629091764, 'bear_tp_mult': 1.7543413042233542, 'bear_tsl_mult': 0.6766882714202698, 'bear_time_stop': 160, 'bear_use_sma': True, 'bear_use_ema': True, 'bear_use_atr': False, 'bear_use_adx': False, 'bear_use_spike': False, 'bear_rsi_required': True, 'sideways_strategy': 'breakout', 'sideways_bb_std_mult': 1.6894597818343562, 'sideways_rsi_os': 45, 'sideways_rsi_ob': 51, 'sideways_adx_thresh': 21.036074150319294, 'sideways_atr_min_pct': 0.022814466657894543, 'sideways_atr_max_pct': 0.10426591642219657, 'sideways_tp_mult': 1.084070332906493, 'sideways_tsl_mult': 0.9152983128531744, 'sideways_time_stop': 50, 'sideways_use_sma': False, 'sideways_use_ema': False, 'sideways_use_atr': True, 'sideways_use_adx': False, 'sideways_use_spike': False, 'sideways_rsi_required': True}.
[I 2025-08-30 18:43:37,200] Trial 129 finished with values: [-1000000000.0, 1000000000.0] and parameters: {'p_sma': 58, 'p_std': 12, 'p_atr': 11, 'p_adx': 8, 'rsi_period': 46, 'ema1': 14, 'ema2': 33, 'slip_atr_k': 0.2120680421411834, 'slip_spread_k': 0.12170084434051509, 'spread_hl_frac': 0.028333597089285706, 'bb_std_mult': 2.111229559899952, 'rsi_os': 50, 'rsi_ob': 84, 'vol_spike': 0.26237331939077374, 'adx_thresh': 32.26085974915399, 'atr_min_pct': 0.024077577132188718, 'atr_max_pct': 0.10189291231561827, 'tp_mult': 2.2668247728583295, 'tsl_mult': 0.7541549275115852, 'strategy': 'mean_reversion', 'time_stop': 20, 'use_sma': False, 'use_atr': False, 'use_adx': True, 'use_ema': False, 'use_spike': True, 'rsi_required': False, 'edge_k': 0.0931459490608072, 'edge_cap': 0.8312014556614098, 'bull_strategy': 'mean_reversion', 'bull_bb_std_mult': 0.6562896465656889, 'bull_rsi_os': 32, 'bull_rsi_ob': 95, 'bull_adx_thresh': 13.137366444008286, 'bull_atr_min_pct': 0.003019135880451795, 'bull_atr_max_pct': 0.1297438616598269, 'bull_tp_mult': 2.511205069318239, 'bull_tsl_mult': 0.4884949617206989, 'bull_time_stop': 258, 'bull_use_sma': False, 'bull_use_ema': True, 'bull_use_atr': False, 'bull_use_adx': False, 'bull_use_spike': True, 'bull_rsi_required': True, 'bear_strategy': 'breakout', 'bear_bb_std_mult': 2.814476169499457, 'bear_rsi_os': 20, 'bear_rsi_ob': 76, 'bear_adx_thresh': 28.85155340682276, 'bear_atr_min_pct': 0.011723280801048234, 'bear_atr_max_pct': 0.027373218850772235, 'bear_tp_mult': 1.3059054243062915, 'bear_tsl_mult': 0.731907799251636, 'bear_time_stop': 163, 'bear_use_sma': True, 'bear_use_ema': True, 'bear_use_atr': False, 'bear_use_adx': False, 'bear_use_spike': False, 'bear_rsi_required': True, 'sideways_strategy': 'mean_reversion', 'sideways_bb_std_mult': 1.6486480791629456, 'sideways_rsi_os': 14, 'sideways_rsi_ob': 59, 'sideways_adx_thresh': 21.25811606473235, 'sideways_atr_min_pct': 0.0019132642194097857, 'sideways_atr_max_pct': 0.13610282851283653, 'sideways_tp_mult': 2.939192025232823, 'sideways_tsl_mult': 0.9462320493621696, 'sideways_time_stop': 51, 'sideways_use_sma': False, 'sideways_use_ema': True, 'sideways_use_atr': True, 'sideways_use_adx': False, 'sideways_use_spike': False, 'sideways_rsi_required': True}.
[I 2025-08-30 18:43:37,214] Trial 130 finished with values: [-1000000000.0, 1000000000.0] and parameters: {'p_sma': 58, 'p_std': 30, 'p_atr': 11, 'p_adx': 19, 'rsi_period': 25, 'ema1': 30, 'ema2': 33, 'slip_atr_k': 0.05820769328305879, 'slip_spread_k': 0.0762665104495543, 'spread_hl_frac': 0.019231838033395992, 'bb_std_mult': 3.1262912967514698, 'rsi_os': 52, 'rsi_ob': 84, 'vol_spike': 0.2625039559076261, 'adx_thresh': 33.455878237841944, 'atr_min_pct': 0.023506424466466815, 'atr_max_pct': 0.10432066239611056, 'tp_mult': 2.2714204180190896, 'tsl_mult': 0.9318000477617401, 'strategy': 'mean_reversion', 'time_stop': 300, 'use_sma': False, 'use_atr': True, 'use_adx': True, 'use_ema': False, 'use_spike': True, 'rsi_required': False, 'edge_k': 0.6170417685944705, 'edge_cap': 0.36518998010700443, 'bull_strategy': 'breakout', 'bull_bb_std_mult': 0.8664017425472874, 'bull_rsi_os': 32, 'bull_rsi_ob': 45, 'bull_adx_thresh': 14.089974080791665, 'bull_atr_min_pct': 0.003077208599238664, 'bull_atr_max_pct': 0.12443892947123772, 'bull_tp_mult': 2.5126398315632223, 'bull_tsl_mult': 0.5041230267093452, 'bull_time_stop': 25, 'bull_use_sma': True, 'bull_use_ema': True, 'bull_use_atr': True, 'bull_use_adx': False, 'bull_use_spike': False, 'bull_rsi_required': True, 'bear_strategy': 'breakout', 'bear_bb_std_mult': 2.812230350169101, 'bear_rsi_os': 53, 'bear_rsi_ob': 76, 'bear_adx_thresh': 20.256527248602577, 'bear_atr_min_pct': 0.017161785222921954, 'bear_atr_max_pct': 0.02847045922031013, 'bear_tp_mult': 2.2502251974307694, 'bear_tsl_mult': 0.7397857766458183, 'bear_time_stop': 268, 'bear_use_sma': True, 'bear_use_ema': True, 'bear_use_atr': False, 'bear_use_adx': False, 'bear_use_spike': False, 'bear_rsi_required': True, 'sideways_strategy': 'mean_reversion', 'sideways_bb_std_mult': 1.6621955918131115, 'sideways_rsi_os': 13, 'sideways_rsi_ob': 59, 'sideways_adx_thresh': 22.352767316788164, 'sideways_atr_min_pct': 0.0020131347786134218, 'sideways_atr_max_pct': 0.1362143160536104, 'sideways_tp_mult': 1.0694606639953457, 'sideways_tsl_mult': 0.24870947077521177, 'sideways_time_stop': 14, 'sideways_use_sma': False, 'sideways_use_ema': True, 'sideways_use_atr': True, 'sideways_use_adx': False, 'sideways_use_spike': False, 'sideways_rsi_required': True}.
[I 2025-08-30 18:44:05,106] Trial 127 finished with values: [-0.03557677300790296, 0.03555500938554735] and parameters: {'p_sma': 10, 'p_std': 13, 'p_atr': 21, 'p_adx': 19, 'rsi_period': 25, 'ema1': 30, 'ema2': 33, 'slip_atr_k': 0.10065881668103319, 'slip_spread_k': 0.12717989190179813, 'spread_hl_frac': 0.02857213195431181, 'bb_std_mult': 3.1006052234776735, 'rsi_os': 20, 'rsi_ob': 84, 'vol_spike': 0.27004663985622257, 'adx_thresh': 32.209063555408854, 'atr_min_pct': 0.023902951161873996, 'atr_max_pct': 0.10380038511530507, 'tp_mult': 2.377189608566184, 'tsl_mult': 0.12042798176289843, 'strategy': 'mean_reversion', 'time_stop': 23, 'use_sma': False, 'use_atr': True, 'use_adx': True, 'use_ema': False, 'use_spike': True, 'rsi_required': False, 'edge_k': 0.08906056654042072, 'edge_cap': 0.550756685524285, 'bull_strategy': 'mean_reversion', 'bull_bb_std_mult': 2.774517309369002, 'bull_rsi_os': 32, 'bull_rsi_ob': 64, 'bull_adx_thresh': 31.45822625647729, 'bull_atr_min_pct': 0.006320582663589791, 'bull_atr_max_pct': 0.04034171051754896, 'bull_tp_mult': 2.5892464230628836, 'bull_tsl_mult': 0.5103580746695945, 'bull_time_stop': 173, 'bull_use_sma': False, 'bull_use_ema': True, 'bull_use_atr': True, 'bull_use_adx': False, 'bull_use_spike': False, 'bull_rsi_required': True, 'bear_strategy': 'breakout', 'bear_bb_std_mult': 1.9592207468633192, 'bear_rsi_os': 47, 'bear_rsi_ob': 76, 'bear_adx_thresh': 20.268554815631454, 'bear_atr_min_pct': 0.023452476659329494, 'bear_atr_max_pct': 0.1274617759362118, 'bear_tp_mult': 1.7346123275103027, 'bear_tsl_mult': 0.7310904817869817, 'bear_time_stop': 266, 'bear_use_sma': False, 'bear_use_ema': True, 'bear_use_atr': False, 'bear_use_adx': False, 'bear_use_spike': False, 'bear_rsi_required': True, 'sideways_strategy': 'breakout', 'sideways_bb_std_mult': 1.2227592289657316, 'sideways_rsi_os': 45, 'sideways_rsi_ob': 51, 'sideways_adx_thresh': 22.364111535553256, 'sideways_atr_min_pct': 0.0015987820969602332, 'sideways_atr_max_pct': 0.13852019954770095, 'sideways_tp_mult': 1.070464322370707, 'sideways_tsl_mult': 0.9980641601247486, 'sideways_time_stop': 173, 'sideways_use_sma': False, 'sideways_use_ema': True, 'sideways_use_atr': True, 'sideways_use_adx': False, 'sideways_use_spike': False, 'sideways_rsi_required': True}.
[I 2025-08-30 18:44:09,341] Trial 131 finished with values: [-1000000000.0, 1000000000.0] and parameters: {'p_sma': 14, 'p_std': 9, 'p_atr': 10, 'p_adx': 22, 'rsi_period': 42, 'ema1': 30, 'ema2': 28, 'slip_atr_k': 0.05134819431648639, 'slip_spread_k': 0.24858939851685727, 'spread_hl_frac': 0.018973408925877407, 'bb_std_mult': 2.083612221137392, 'rsi_os': 47, 'rsi_ob': 67, 'vol_spike': 0.2649518214621422, 'adx_thresh': 33.578497203780444, 'atr_min_pct': 0.007288065083495221, 'atr_max_pct': 0.11577172195014035, 'tp_mult': 2.27490449306838, 'tsl_mult': 0.1168590999749512, 'strategy': 'mean_reversion', 'time_stop': 126, 'use_sma': False, 'use_atr': True, 'use_adx': True, 'use_ema': False, 'use_spike': True, 'rsi_required': False, 'edge_k': 0.09122498595479112, 'edge_cap': 0.413810476721558, 'bull_strategy': 'breakout', 'bull_bb_std_mult': 0.8069787942501927, 'bull_rsi_os': 28, 'bull_rsi_ob': 45, 'bull_adx_thresh': 27.59061386400839, 'bull_atr_min_pct': 0.003215497671408365, 'bull_atr_max_pct': 0.12387533570071207, 'bull_tp_mult': 1.8613968835954742, 'bull_tsl_mult': 0.5602673796705232, 'bull_time_stop': 163, 'bull_use_sma': True, 'bull_use_ema': True, 'bull_use_atr': True, 'bull_use_adx': False, 'bull_use_spike': False, 'bull_rsi_required': True, 'bear_strategy': 'breakout', 'bear_bb_std_mult': 1.9554203268277388, 'bear_rsi_os': 20, 'bear_rsi_ob': 77, 'bear_adx_thresh': 18.798659457885577, 'bear_atr_min_pct': 0.012656542921084177, 'bear_atr_max_pct': 0.12808900899443176, 'bear_tp_mult': 1.3358641080556088, 'bear_tsl_mult': 0.741181665597623, 'bear_time_stop': 188, 'bear_use_sma': True, 'bear_use_ema': True, 'bear_use_atr': False, 'bear_use_adx': False, 'bear_use_spike': False, 'bear_rsi_required': True, 'sideways_strategy': 'mean_reversion', 'sideways_bb_std_mult': 3.3594608716882313, 'sideways_rsi_os': 13, 'sideways_rsi_ob': 59, 'sideways_adx_thresh': 19.751225421084943, 'sideways_atr_min_pct': 0.0016505776326043234, 'sideways_atr_max_pct': 0.050622447259097265, 'sideways_tp_mult': 2.1156807526759507, 'sideways_tsl_mult': 0.9495420934574966, 'sideways_time_stop': 175, 'sideways_use_sma': False, 'sideways_use_ema': True, 'sideways_use_atr': True, 'sideways_use_adx': False, 'sideways_use_spike': False, 'sideways_rsi_required': True}.
[I 2025-08-30 18:44:09,498] Trial 133 finished with values: [-1000000000.0, 1000000000.0] and parameters: {'p_sma': 10, 'p_std': 56, 'p_atr': 10, 'p_adx': 29, 'rsi_period': 26, 'ema1': 15, 'ema2': 12, 'slip_atr_k': 0.10236440226910669, 'slip_spread_k': 0.24647268061342198, 'spread_hl_frac': 0.036621593540619286, 'bb_std_mult': 2.8710649702944373, 'rsi_os': 47, 'rsi_ob': 68, 'vol_spike': 0.2815989713112034, 'adx_thresh': 34.68962072682603, 'atr_min_pct': 0.010617333151649947, 'atr_max_pct': 0.0825221196160801, 'tp_mult': 1.0858613479855133, 'tsl_mult': 0.5159495951974825, 'strategy': 'mean_reversion', 'time_stop': 218, 'use_sma': False, 'use_atr': True, 'use_adx': False, 'use_ema': False, 'use_spike': True, 'rsi_required': False, 'edge_k': 0.1319044634118419, 'edge_cap': 0.417062503035561, 'bull_strategy': 'breakout', 'bull_bb_std_mult': 3.0935002071213535, 'bull_rsi_os': 36, 'bull_rsi_ob': 46, 'bull_adx_thresh': 27.74374278420648, 'bull_atr_min_pct': 0.0020297696488744115, 'bull_atr_max_pct': 0.0848959202748651, 'bull_tp_mult': 2.5891762824062092, 'bull_tsl_mult': 0.6162106351208418, 'bull_time_stop': 163, 'bull_use_sma': False, 'bull_use_ema': True, 'bull_use_atr': True, 'bull_use_adx': False, 'bull_use_spike': False, 'bull_rsi_required': True, 'bear_strategy': 'breakout', 'bear_bb_std_mult': 0.9401353014016662, 'bear_rsi_os': 52, 'bear_rsi_ob': 53, 'bear_adx_thresh': 18.916439041293476, 'bear_atr_min_pct': 0.018155514203616177, 'bear_atr_max_pct': 0.129799871004734, 'bear_tp_mult': 2.7195580125075125, 'bear_tsl_mult': 0.6568222505559423, 'bear_time_stop': 191, 'bear_use_sma': False, 'bear_use_ema': True, 'bear_use_atr': False, 'bear_use_adx': False, 'bear_use_spike': True, 'bear_rsi_required': True, 'sideways_strategy': 'breakout', 'sideways_bb_std_mult': 0.9950177668729567, 'sideways_rsi_os': 7, 'sideways_rsi_ob': 60, 'sideways_adx_thresh': 20.243261216064163, 'sideways_atr_min_pct': 0.0015163129403547963, 'sideways_atr_max_pct': 0.09743054234375159, 'sideways_tp_mult': 2.1179055977666614, 'sideways_tsl_mult': 0.09742894618614006, 'sideways_time_stop': 172, 'sideways_use_sma': False, 'sideways_use_ema': True, 'sideways_use_atr': True, 'sideways_use_adx': False, 'sideways_use_spike': False, 'sideways_rsi_required': True}.
[I 2025-08-30 18:44:09,748] Trial 132 finished with values: [-0.07654946846399291, 0.07697070857589278] and parameters: {'p_sma': 60, 'p_std': 9, 'p_atr': 10, 'p_adx': 19, 'rsi_period': 8, 'ema1': 30, 'ema2': 34, 'slip_atr_k': 0.08235725421020237, 'slip_spread_k': 0.5452703598655505, 'spread_hl_frac': 0.025788725997991264, 'bb_std_mult': 2.046541370617279, 'rsi_os': 27, 'rsi_ob': 61, 'vol_spike': 0.29017169838238377, 'adx_thresh': 33.69640265135669, 'atr_min_pct': 0.010327203522630914, 'atr_max_pct': 0.11516047418804529, 'tp_mult': 1.803087397836902, 'tsl_mult': 0.3150793849969523, 'strategy': 'mean_reversion', 'time_stop': 159, 'use_sma': False, 'use_atr': True, 'use_adx': True, 'use_ema': False, 'use_spike': True, 'rsi_required': False, 'edge_k': 0.8413174159859127, 'edge_cap': 0.5544568867029135, 'bull_strategy': 'breakout', 'bull_bb_std_mult': 2.779696974148121, 'bull_rsi_os': 37, 'bull_rsi_ob': 85, 'bull_adx_thresh': 27.782049173139967, 'bull_atr_min_pct': 0.0020349659821088115, 'bull_atr_max_pct': 0.12333563537154221, 'bull_tp_mult': 1.8934047304305555, 'bull_tsl_mult': 0.4644044622804922, 'bull_time_stop': 164, 'bull_use_sma': True, 'bull_use_ema': True, 'bull_use_atr': True, 'bull_use_adx': False, 'bull_use_spike': False, 'bull_rsi_required': True, 'bear_strategy': 'breakout', 'bear_bb_std_mult': 2.330125091148809, 'bear_rsi_os': 53, 'bear_rsi_ob': 77, 'bear_adx_thresh': 11.75309020547542, 'bear_atr_min_pct': 0.012689745745745343, 'bear_atr_max_pct': 0.12988837835802647, 'bear_tp_mult': 2.713172024426451, 'bear_tsl_mult': 0.8495476335809446, 'bear_time_stop': 262, 'bear_use_sma': False, 'bear_use_ema': True, 'bear_use_atr': False, 'bear_use_adx': False, 'bear_use_spike': False, 'bear_rsi_required': True, 'sideways_strategy': 'breakout', 'sideways_bb_std_mult': 1.3738155411126107, 'sideways_rsi_os': 31, 'sideways_rsi_ob': 60, 'sideways_adx_thresh': 19.114958622973475, 'sideways_atr_min_pct': 0.0015351827858924745, 'sideways_atr_max_pct': 0.14367004001259742, 'sideways_tp_mult': 2.348242762201295, 'sideways_tsl_mult': 0.10440348194081145, 'sideways_time_stop': 173, 'sideways_use_sma': False, 'sideways_use_ema': True, 'sideways_use_atr': True, 'sideways_use_adx': False, 'sideways_use_spike': False, 'sideways_rsi_required': True}.
[I 2025-08-30 18:44:38,288] Trial 134 finished with values: [-1000000000.0, 1000000000.0] and parameters: {'p_sma': 6, 'p_std': 57, 'p_atr': 10, 'p_adx': 20, 'rsi_period': 42, 'ema1': 23, 'ema2': 12, 'slip_atr_k': 0.06670131964950135, 'slip_spread_k': 0.58373098865737, 'spread_hl_frac': 0.006957107838216993, 'bb_std_mult': 1.9519456902064358, 'rsi_os': 26, 'rsi_ob': 81, 'vol_spike': 0.25614239942891986, 'adx_thresh': 34.23528058498566, 'atr_min_pct': 0.007419587578609243, 'atr_max_pct': 0.09762914394698932, 'tp_mult': 2.3416780561172765, 'tsl_mult': 0.5011185883645131, 'strategy': 'mean_reversion', 'time_stop': 196, 'use_sma': False, 'use_atr': True, 'use_adx': True, 'use_ema': False, 'use_spike': True, 'rsi_required': False, 'edge_k': 0.8633704104588891, 'edge_cap': 0.5459890020802531, 'bull_strategy': 'mean_reversion', 'bull_bb_std_mult': 3.2029870655760746, 'bull_rsi_os': 28, 'bull_rsi_ob': 64, 'bull_adx_thresh': 27.923862983692587, 'bull_atr_min_pct': 0.0020764907145804333, 'bull_atr_max_pct': 0.043919005289810444, 'bull_tp_mult': 2.6918053104100665, 'bull_tsl_mult': 0.5553086884265536, 'bull_time_stop': 172, 'bull_use_sma': False, 'bull_use_ema': True, 'bull_use_atr': True, 'bull_use_adx': False, 'bull_use_spike': False, 'bull_rsi_required': True, 'bear_strategy': 'breakout', 'bear_bb_std_mult': 2.72295860511363, 'bear_rsi_os': 52, 'bear_rsi_ob': 95, 'bear_adx_thresh': 19.32349576567376, 'bear_atr_min_pct': 0.015259113546809358, 'bear_atr_max_pct': 0.12859659787815236, 'bear_tp_mult': 2.5127374532901885, 'bear_tsl_mult': 0.2955889778283298, 'bear_time_stop': 192, 'bear_use_sma': False, 'bear_use_ema': True, 'bear_use_atr': False, 'bear_use_adx': False, 'bear_use_spike': False, 'bear_rsi_required': True, 'sideways_strategy': 'breakout', 'sideways_bb_std_mult': 1.391818346400405, 'sideways_rsi_os': 39, 'sideways_rsi_ob': 60, 'sideways_adx_thresh': 19.81328153061751, 'sideways_atr_min_pct': 0.0027395664829548737, 'sideways_atr_max_pct': 0.1434695960361105, 'sideways_tp_mult': 1.8307286471096638, 'sideways_tsl_mult': 0.4892663755979356, 'sideways_time_stop': 174, 'sideways_use_sma': False, 'sideways_use_ema': True, 'sideways_use_atr': True, 'sideways_use_adx': False, 'sideways_use_spike': False, 'sideways_rsi_required': True}.
