[I 2025-08-30 19:55:55,402] Trial 756 finished with values: [-1000000000.0, 1000000000.0] and parameters: {'p_sma': 5, 'p_std': 30, 'p_atr': 9, 'p_adx': 21, 'rsi_period': 52, 'ema1': 13, 'ema2': 32, 'slip_atr_k': 0.0711343792476238, 'slip_spread_k': 0.2064033083580661, 'spread_hl_frac': 0.023675750298441385, 'bb_std_mult': 0.9789835703991028, 'rsi_os': 47, 'rsi_ob': 93, 'vol_spike': 0.25890173787228643, 'adx_thresh': 8.020959906581663, 'atr_min_pct': 0.02350555212852424, 'atr_max_pct': 0.10107694808428981, 'tp_mult': 2.3308458393473557, 'tsl_mult': 0.7910359995397449, 'strategy': 'mean_reversion', 'time_stop': 200, 'use_sma': False, 'use_atr': True, 'use_adx': True, 'use_ema': False, 'use_spike': True, 'rsi_required': False, 'edge_k': 0.17992210565689667, 'edge_cap': 0.5365770555654221, 'bull_strategy': 'mean_reversion', 'bull_bb_std_mult': 3.127473283887663, 'bull_rsi_os': 50, 'bull_rsi_ob': 45, 'bull_adx_thresh': 9.857204594444022, 'bull_atr_min_pct': 0.004468473681669896, 'bull_atr_max_pct': 0.08476159967585112, 'bull_tp_mult': 2.073991006157721, 'bull_tsl_mult': 0.2045865308359292, 'bull_time_stop': 287, 'bull_use_sma': False, 'bull_use_ema': True, 'bull_use_atr': True, 'bull_use_adx': False, 'bull_use_spike': False, 'bull_rsi_required': True, 'bear_strategy': 'breakout', 'bear_bb_std_mult': 3.0367634548639977, 'bear_rsi_os': 51, 'bear_rsi_ob': 86, 'bear_adx_thresh': 18.296423477078434, 'bear_atr_min_pct': 0.008873225595105255, 'bear_atr_max_pct': 0.14553375907988098, 'bear_tp_mult': 2.789929638764545, 'bear_tsl_mult': 0.7046247729468982, 'bear_time_stop': 213, 'bear_use_sma': True, 'bear_use_ema': True, 'bear_use_atr': False, 'bear_use_adx': False, 'bear_use_spike': False, 'bear_rsi_required': True, 'sideways_strategy': 'breakout', 'sideways_bb_std_mult': 3.014743971572119, 'sideways_rsi_os': 37, 'sideways_rsi_ob': 62, 'sideways_adx_thresh': 19.288732239480332, 'sideways_atr_min_pct': 0.0021824081203748965, 'sideways_atr_max_pct': 0.09447303438443336, 'sideways_tp_mult': 1.0122746185938492, 'sideways_tsl_mult': 0.9843188228825458, 'sideways_time_stop': 168, 'sideways_use_sma': False, 'sideways_use_ema': True, 'sideways_use_atr': True, 'sideways_use_adx': False, 'sideways_use_spike': False, 'sideways_rsi_required': True}.
[I 2025-08-30 19:55:55,970] Trial 758 finished with values: [-1000000000.0, 1000000000.0] and parameters: {'p_sma': 9, 'p_std': 40, 'p_atr': 9, 'p_adx': 27, 'rsi_period': 52, 'ema1': 26, 'ema2': 32, 'slip_atr_k': 0.2499158315893315, 'slip_spread_k': 0.20562677338216842, 'spread_hl_frac': 0.02219396057209284, 'bb_std_mult': 0.989311156453778, 'rsi_os': 41, 'rsi_ob': 81, 'vol_spike': 0.1729696466266585, 'adx_thresh': 8.346753145556491, 'atr_min_pct': 0.023451412497472963, 'atr_max_pct': 0.10002862232109544, 'tp_mult': 2.3251439177666473, 'tsl_mult': 0.7945236920641933, 'strategy': 'mean_reversion', 'time_stop': 187, 'use_sma': False, 'use_atr': True, 'use_adx': True, 'use_ema': False, 'use_spike': True, 'rsi_required': False, 'edge_k': 0.17136368107080696, 'edge_cap': 0.5332098110402445, 'bull_strategy': 'mean_reversion', 'bull_bb_std_mult': 2.7655351623976627, 'bull_rsi_os': 33, 'bull_rsi_ob': 45, 'bull_adx_thresh': 18.229416258018116, 'bull_atr_min_pct': 0.0035940774561546377, 'bull_atr_max_pct': 0.12020760573750955, 'bull_tp_mult': 2.7911143053088523, 'bull_tsl_mult': 0.9518008545753729, 'bull_time_stop': 288, 'bull_use_sma': False, 'bull_use_ema': True, 'bull_use_atr': True, 'bull_use_adx': False, 'bull_use_spike': False, 'bull_rsi_required': True, 'bear_strategy': 'breakout', 'bear_bb_std_mult': 3.0267795857316817, 'bear_rsi_os': 51, 'bear_rsi_ob': 79, 'bear_adx_thresh': 21.977444796456254, 'bear_atr_min_pct': 0.02589334910527597, 'bear_atr_max_pct': 0.02077020370835054, 'bear_tp_mult': 2.6105287955127428, 'bear_tsl_mult': 0.806529471048695, 'bear_time_stop': 161, 'bear_use_sma': True, 'bear_use_ema': True, 'bear_use_atr': True, 'bear_use_adx': False, 'bear_use_spike': False, 'bear_rsi_required': True, 'sideways_strategy': 'breakout', 'sideways_bb_std_mult': 2.2405761586093282, 'sideways_rsi_os': 37, 'sideways_rsi_ob': 57, 'sideways_adx_thresh': 25.81327276721223, 'sideways_atr_min_pct': 0.014603536856562493, 'sideways_atr_max_pct': 0.14475593151239888, 'sideways_tp_mult': 1.7426120084851786, 'sideways_tsl_mult': 0.9837061818383521, 'sideways_time_stop': 132, 'sideways_use_sma': False, 'sideways_use_ema': True, 'sideways_use_atr': True, 'sideways_use_adx': False, 'sideways_use_spike': False, 'sideways_rsi_required': True}.
[I 2025-08-30 19:55:56,277] Trial 757 finished with values: [-1000000000.0, 1000000000.0] and parameters: {'p_sma': 13, 'p_std': 30, 'p_atr': 11, 'p_adx': 29, 'rsi_period': 79, 'ema1': 23, 'ema2': 32, 'slip_atr_k': 0.21369732009405784, 'slip_spread_k': 0.16398765130990303, 'spread_hl_frac': 0.023753032482704686, 'bb_std_mult': 2.217750767124592, 'rsi_os': 23, 'rsi_ob': 81, 'vol_spike': 0.2578275730078691, 'adx_thresh': 13.518631977997043, 'atr_min_pct': 0.02856201203226176, 'atr_max_pct': 0.09980672662820114, 'tp_mult': 1.5098799916484518, 'tsl_mult': 0.8785820780446358, 'strategy': 'mean_reversion', 'time_stop': 290, 'use_sma': False, 'use_atr': True, 'use_adx': True, 'use_ema': False, 'use_spike': True, 'rsi_required': False, 'edge_k': 1.892110961408948, 'edge_cap': 0.5394142558460427, 'bull_strategy': 'mean_reversion', 'bull_bb_std_mult': 3.1121217862277697, 'bull_rsi_os': 29, 'bull_rsi_ob': 54, 'bull_adx_thresh': 8.648409540074585, 'bull_atr_min_pct': 0.0009524590323667738, 'bull_atr_max_pct': 0.05034352842054207, 'bull_tp_mult': 2.7944232951089947, 'bull_tsl_mult': 0.6063286800462849, 'bull_time_stop': 181, 'bull_use_sma': False, 'bull_use_ema': True, 'bull_use_atr': True, 'bull_use_adx': False, 'bull_use_spike': False, 'bull_rsi_required': True, 'bear_strategy': 'breakout', 'bear_bb_std_mult': 0.9663179768331647, 'bear_rsi_os': 8, 'bear_rsi_ob': 45, 'bear_adx_thresh': 18.725770970022293, 'bear_atr_min_pct': 0.028137532979479716, 'bear_atr_max_pct': 0.03746277236862188, 'bear_tp_mult': 2.7603618379834063, 'bear_tsl_mult': 0.7917528734003061, 'bear_time_stop': 232, 'bear_use_sma': True, 'bear_use_ema': True, 'bear_use_atr': True, 'bear_use_adx': False, 'bear_use_spike': False, 'bear_rsi_required': True, 'sideways_strategy': 'breakout', 'sideways_bb_std_mult': 2.9962619283156484, 'sideways_rsi_os': 37, 'sideways_rsi_ob': 59, 'sideways_adx_thresh': 19.594673828520023, 'sideways_atr_min_pct': 0.002132379770240011, 'sideways_atr_max_pct': 0.0935247183478616, 'sideways_tp_mult': 1.7386461846597934, 'sideways_tsl_mult': 0.9830892755086894, 'sideways_time_stop': 139, 'sideways_use_sma': False, 'sideways_use_ema': True, 'sideways_use_atr': True, 'sideways_use_adx': False, 'sideways_use_spike': False, 'sideways_rsi_required': True}.
[I 2025-08-30 19:55:57,559] Trial 759 finished with values: [-1000000000.0, 1000000000.0] and parameters: {'p_sma': 9, 'p_std': 30, 'p_atr': 9, 'p_adx': 20, 'rsi_period': 50, 'ema1': 12, 'ema2': 30, 'slip_atr_k': 0.07196998087193296, 'slip_spread_k': 0.16699464347022455, 'spread_hl_frac': 0.023730442495085827, 'bb_std_mult': 0.9761433999854412, 'rsi_os': 6, 'rsi_ob': 85, 'vol_spike': 0.21923024709172367, 'adx_thresh': 32.87000696781927, 'atr_min_pct': 0.02457789159793047, 'atr_max_pct': 0.09768044160828213, 'tp_mult': 2.9365057584697793, 'tsl_mult': 0.8864366480923359, 'strategy': 'mean_reversion', 'time_stop': 186, 'use_sma': False, 'use_atr': True, 'use_adx': True, 'use_ema': False, 'use_spike': True, 'rsi_required': False, 'edge_k': 0.1846846016761542, 'edge_cap': 0.5305061054377045, 'bull_strategy': 'mean_reversion', 'bull_bb_std_mult': 3.1552367168448443, 'bull_rsi_os': 33, 'bull_rsi_ob': 45, 'bull_adx_thresh': 5.558927680164468, 'bull_atr_min_pct': 0.0007367566925434521, 'bull_atr_max_pct': 0.12655909658737002, 'bull_tp_mult': 1.550561913791547, 'bull_tsl_mult': 0.1961776235736607, 'bull_time_stop': 183, 'bull_use_sma': False, 'bull_use_ema': False, 'bull_use_atr': True, 'bull_use_adx': False, 'bull_use_spike': False, 'bull_rsi_required': True, 'bear_strategy': 'breakout', 'bear_bb_std_mult': 2.896570710762346, 'bear_rsi_os': 50, 'bear_rsi_ob': 77, 'bear_adx_thresh': 5.660182632099964, 'bear_atr_min_pct': 0.02197506717654971, 'bear_atr_max_pct': 0.033430689675374096, 'bear_tp_mult': 2.3440293659795435, 'bear_tsl_mult': 0.8141823435991167, 'bear_time_stop': 300, 'bear_use_sma': True, 'bear_use_ema': True, 'bear_use_atr': True, 'bear_use_adx': False, 'bear_use_spike': False, 'bear_rsi_required': True, 'sideways_strategy': 'breakout', 'sideways_bb_std_mult': 2.474347386097547, 'sideways_rsi_os': 15, 'sideways_rsi_ob': 76, 'sideways_adx_thresh': 19.857969416032702, 'sideways_atr_min_pct': 0.0029716801866792927, 'sideways_atr_max_pct': 0.14409200111467332, 'sideways_tp_mult': 1.043450660747322, 'sideways_tsl_mult': 0.9783777358836714, 'sideways_time_stop': 145, 'sideways_use_sma': False, 'sideways_use_ema': True, 'sideways_use_atr': True, 'sideways_use_adx': True, 'sideways_use_spike': False, 'sideways_rsi_required': True}.
[I 2025-08-30 19:55:58,404] Trial 760 finished with values: [-1000000000.0, 1000000000.0] and parameters: {'p_sma': 9, 'p_std': 30, 'p_atr': 9, 'p_adx': 13, 'rsi_period': 22, 'ema1': 29, 'ema2': 30, 'slip_atr_k': 0.0761823518115917, 'slip_spread_k': 0.38177758080573904, 'spread_hl_frac': 0.03050634987756924, 'bb_std_mult': 1.243603703275058, 'rsi_os': 51, 'rsi_ob': 88, 'vol_spike': 0.049255600152245435, 'adx_thresh': 33.490115894665074, 'atr_min_pct': 0.009312870049058383, 'atr_max_pct': 0.03813950830463958, 'tp_mult': 1.4926068924424982, 'tsl_mult': 0.8772152327925983, 'strategy': 'mean_reversion', 'time_stop': 186, 'use_sma': False, 'use_atr': False, 'use_adx': True, 'use_ema': True, 'use_spike': False, 'rsi_required': False, 'edge_k': 0.36889706658260846, 'edge_cap': 0.5234723891341893, 'bull_strategy': 'mean_reversion', 'bull_bb_std_mult': 3.156686741317389, 'bull_rsi_os': 33, 'bull_rsi_ob': 46, 'bull_adx_thresh': 21.42711656747069, 'bull_atr_min_pct': 0.0035025822622623704, 'bull_atr_max_pct': 0.12655731576061044, 'bull_tp_mult': 1.4290626004640228, 'bull_tsl_mult': 0.7351144260304987, 'bull_time_stop': 183, 'bull_use_sma': False, 'bull_use_ema': False, 'bull_use_atr': True, 'bull_use_adx': False, 'bull_use_spike': True, 'bull_rsi_required': True, 'bear_strategy': 'breakout', 'bear_bb_std_mult': 2.904963759157163, 'bear_rsi_os': 50, 'bear_rsi_ob': 79, 'bear_adx_thresh': 22.186972327380026, 'bear_atr_min_pct': 0.01147778978927166, 'bear_atr_max_pct': 0.033995372174969854, 'bear_tp_mult': 1.1833480766143518, 'bear_tsl_mult': 0.8062703042156534, 'bear_time_stop': 248, 'bear_use_sma': True, 'bear_use_ema': True, 'bear_use_atr': True, 'bear_use_adx': False, 'bear_use_spike': True, 'bear_rsi_required': True, 'sideways_strategy': 'mean_reversion', 'sideways_bb_std_mult': 3.1661140657321964, 'sideways_rsi_os': 35, 'sideways_rsi_ob': 50, 'sideways_adx_thresh': 19.828883714883382, 'sideways_atr_min_pct': 0.00301686594851035, 'sideways_atr_max_pct': 0.14407541611369007, 'sideways_tp_mult': 1.5986114293434257, 'sideways_tsl_mult': 0.9847541271013406, 'sideways_time_stop': 141, 'sideways_use_sma': False, 'sideways_use_ema': True, 'sideways_use_atr': True, 'sideways_use_adx': True, 'sideways_use_spike': False, 'sideways_rsi_required': True}.
[I 2025-08-30 19:55:58,427] Trial 762 finished with values: [-1000000000.0, 1000000000.0] and parameters: {'p_sma': 25, 'p_std': 29, 'p_atr': 25, 'p_adx': 20, 'rsi_period': 22, 'ema1': 21, 'ema2': 46, 'slip_atr_k': 0.08736668258738217, 'slip_spread_k': 0.376350184362353, 'spread_hl_frac': 0.03062633759448295, 'bb_std_mult': 1.4320061672788276, 'rsi_os': 50, 'rsi_ob': 85, 'vol_spike': 0.207492546188084, 'adx_thresh': 32.83320624989112, 'atr_min_pct': 0.024430089835460824, 'atr_max_pct': 0.09195506111053842, 'tp_mult': 1.9607453515990283, 'tsl_mult': 0.8367699427784586, 'strategy': 'mean_reversion', 'time_stop': 66, 'use_sma': True, 'use_atr': False, 'use_adx': False, 'use_ema': True, 'use_spike': False, 'rsi_required': False, 'edge_k': 1.097939239837072, 'edge_cap': 0.736405979661812, 'bull_strategy': 'mean_reversion', 'bull_bb_std_mult': 0.6789832817634736, 'bull_rsi_os': 24, 'bull_rsi_ob': 74, 'bull_adx_thresh': 29.970909482164643, 'bull_atr_min_pct': 0.01896721886383096, 'bull_atr_max_pct': 0.1269452976242978, 'bull_tp_mult': 2.71198268951353, 'bull_tsl_mult': 0.3711826143080176, 'bull_time_stop': 180, 'bull_use_sma': True, 'bull_use_ema': False, 'bull_use_atr': True, 'bull_use_adx': True, 'bull_use_spike': True, 'bull_rsi_required': True, 'bear_strategy': 'mean_reversion', 'bear_bb_std_mult': 2.8956476308123644, 'bear_rsi_os': 53, 'bear_rsi_ob': 77, 'bear_adx_thresh': 24.544262163025127, 'bear_atr_min_pct': 0.01452193628384209, 'bear_atr_max_pct': 0.024395784672656514, 'bear_tp_mult': 2.3506802403186575, 'bear_tsl_mult': 0.2880317940686207, 'bear_time_stop': 204, 'bear_use_sma': True, 'bear_use_ema': True, 'bear_use_atr': False, 'bear_use_adx': False, 'bear_use_spike': True, 'bear_rsi_required': True, 'sideways_strategy': 'mean_reversion', 'sideways_bb_std_mult': 0.5024656818080666, 'sideways_rsi_os': 35, 'sideways_rsi_ob': 76, 'sideways_adx_thresh': 20.94695719186427, 'sideways_atr_min_pct': 0.018121661203065312, 'sideways_atr_max_pct': 0.1434736963369844, 'sideways_tp_mult': 1.0585458477622394, 'sideways_tsl_mult': 0.10188196220159701, 'sideways_time_stop': 121, 'sideways_use_sma': True, 'sideways_use_ema': True, 'sideways_use_atr': False, 'sideways_use_adx': True, 'sideways_use_spike': True, 'sideways_rsi_required': True}.
[I 2025-08-30 19:55:58,479] Trial 761 finished with values: [-1000000000.0, 1000000000.0] and parameters: {'p_sma': 11, 'p_std': 29, 'p_atr': 11, 'p_adx': 19, 'rsi_period': 22, 'ema1': 12, 'ema2': 30, 'slip_atr_k': 0.11680700678425085, 'slip_spread_k': 0.6248900290816338, 'spread_hl_frac': 0.026144994103871985, 'bb_std_mult': 0.7898663004204247, 'rsi_os': 51, 'rsi_ob': 85, 'vol_spike': 0.21446401382287872, 'adx_thresh': 33.01705332478314, 'atr_min_pct': 0.02874199437125237, 'atr_max_pct': 0.02071102397366688, 'tp_mult': 2.2024096332205434, 'tsl_mult': 0.8735465601858718, 'strategy': 'mean_reversion', 'time_stop': 280, 'use_sma': False, 'use_atr': False, 'use_adx': True, 'use_ema': True, 'use_spike': False, 'rsi_required': False, 'edge_k': 0.28588028857858716, 'edge_cap': 0.7230704341975362, 'bull_strategy': 'mean_reversion', 'bull_bb_std_mult': 0.589414755860358, 'bull_rsi_os': 45, 'bull_rsi_ob': 52, 'bull_adx_thresh': 8.81848523641514, 'bull_atr_min_pct': 0.0008365722646637432, 'bull_atr_max_pct': 0.12512015759382078, 'bull_tp_mult': 1.6994468571073413, 'bull_tsl_mult': 0.5212393739481003, 'bull_time_stop': 182, 'bull_use_sma': True, 'bull_use_ema': False, 'bull_use_atr': True, 'bull_use_adx': False, 'bull_use_spike': True, 'bull_rsi_required': True, 'bear_strategy': 'mean_reversion', 'bear_bb_std_mult': 2.8935905562970246, 'bear_rsi_os': 17, 'bear_rsi_ob': 73, 'bear_adx_thresh': 24.331746161312584, 'bear_atr_min_pct': 0.01038614347316212, 'bear_atr_max_pct': 0.03382952061171056, 'bear_tp_mult': 2.3415814331535225, 'bear_tsl_mult': 0.7893385349436848, 'bear_time_stop': 249, 'bear_use_sma': True, 'bear_use_ema': True, 'bear_use_atr': True, 'bear_use_adx': False, 'bear_use_spike': True, 'bear_rsi_required': True, 'sideways_strategy': 'mean_reversion', 'sideways_bb_std_mult': 3.1524818238953767, 'sideways_rsi_os': 46, 'sideways_rsi_ob': 50, 'sideways_adx_thresh': 13.021441964284804, 'sideways_atr_min_pct': 0.0027864743666936405, 'sideways_atr_max_pct': 0.11668048846735246, 'sideways_tp_mult': 2.600237920841547, 'sideways_tsl_mult': 0.7683606343316168, 'sideways_time_stop': 144, 'sideways_use_sma': True, 'sideways_use_ema': True, 'sideways_use_atr': False, 'sideways_use_adx': True, 'sideways_use_spike': True, 'sideways_rsi_required': True}.
[I 2025-08-30 19:55:58,537] Trial 763 finished with values: [-1000000000.0, 1000000000.0] and parameters: {'p_sma': 7, 'p_std': 29, 'p_atr': 8, 'p_adx': 19, 'rsi_period': 22, 'ema1': 21, 'ema2': 34, 'slip_atr_k': 0.23050654228335815, 'slip_spread_k': 0.12298410724704799, 'spread_hl_frac': 0.03093522170597946, 'bb_std_mult': 2.1880665633972596, 'rsi_os': 31, 'rsi_ob': 88, 'vol_spike': 0.2071300177328355, 'adx_thresh': 28.826977544215843, 'atr_min_pct': 0.02419178273466092, 'atr_max_pct': 0.015221843540472027, 'tp_mult': 2.195300463836835, 'tsl_mult': 0.45402047203306156, 'strategy': 'breakout', 'time_stop': 172, 'use_sma': True, 'use_atr': False, 'use_adx': False, 'use_ema': True, 'use_spike': False, 'rsi_required': True, 'edge_k': 1.1017628494372609, 'edge_cap': 0.4410697012645029, 'bull_strategy': 'mean_reversion', 'bull_bb_std_mult': 3.405277425235673, 'bull_rsi_os': 35, 'bull_rsi_ob': 48, 'bull_adx_thresh': 20.78685620916681, 'bull_atr_min_pct': 0.01875399632077824, 'bull_atr_max_pct': 0.11398796886322485, 'bull_tp_mult': 1.4396607056292519, 'bull_tsl_mult': 0.24647129860526973, 'bull_time_stop': 208, 'bull_use_sma': True, 'bull_use_ema': False, 'bull_use_atr': True, 'bull_use_adx': True, 'bull_use_spike': True, 'bull_rsi_required': True, 'bear_strategy': 'mean_reversion', 'bear_bb_std_mult': 2.4276294234887543, 'bear_rsi_os': 47, 'bear_rsi_ob': 49, 'bear_adx_thresh': 24.40939083879401, 'bear_atr_min_pct': 0.011439144303619527, 'bear_atr_max_pct': 0.029327531938822256, 'bear_tp_mult': 1.1755317488581611, 'bear_tsl_mult': 0.39355955777611873, 'bear_time_stop': 287, 'bear_use_sma': True, 'bear_use_ema': False, 'bear_use_atr': False, 'bear_use_adx': True, 'bear_use_spike': True, 'bear_rsi_required': True, 'sideways_strategy': 'mean_reversion', 'sideways_bb_std_mult': 1.5047859745327208, 'sideways_rsi_os': 35, 'sideways_rsi_ob': 74, 'sideways_adx_thresh': 20.850848874177323, 'sideways_atr_min_pct': 0.0030606682073728297, 'sideways_atr_max_pct': 0.01823870104409934, 'sideways_tp_mult': 1.9102791656370417, 'sideways_tsl_mult': 0.8135719866496514, 'sideways_time_stop': 151, 'sideways_use_sma': True, 'sideways_use_ema': True, 'sideways_use_atr': False, 'sideways_use_adx': True, 'sideways_use_spike': True, 'sideways_rsi_required': True}.
[I 2025-08-30 19:56:32,893] Trial 766 finished with values: [-1000000000.0, 1000000000.0] and parameters: {'p_sma': 15, 'p_std': 33, 'p_atr': 8, 'p_adx': 9, 'rsi_period': 25, 'ema1': 24, 'ema2': 34, 'slip_atr_k': 0.05290271413491035, 'slip_spread_k': 0.12383068091019928, 'spread_hl_frac': 0.022823647812807282, 'bb_std_mult': 2.1780464530502073, 'rsi_os': 43, 'rsi_ob': 83, 'vol_spike': 0.2797072517949494, 'adx_thresh': 11.792994844624063, 'atr_min_pct': 0.02252811124652041, 'atr_max_pct': 0.046947646804951816, 'tp_mult': 2.2823113962444346, 'tsl_mult': 0.8438564797578736, 'strategy': 'breakout', 'time_stop': 176, 'use_sma': True, 'use_atr': True, 'use_adx': False, 'use_ema': False, 'use_spike': True, 'rsi_required': True, 'edge_k': 0.11519389093029186, 'edge_cap': 0.45016577000108343, 'bull_strategy': 'breakout', 'bull_bb_std_mult': 2.550978174480923, 'bull_rsi_os': 6, 'bull_rsi_ob': 48, 'bull_adx_thresh': 13.435758727520685, 'bull_atr_min_pct': 0.0020383955643454234, 'bull_atr_max_pct': 0.11420569100909508, 'bull_tp_mult': 1.1378905102772627, 'bull_tsl_mult': 0.49000909334210024, 'bull_time_stop': 210, 'bull_use_sma': False, 'bull_use_ema': True, 'bull_use_atr': True, 'bull_use_adx': True, 'bull_use_spike': False, 'bull_rsi_required': False, 'bear_strategy': 'breakout', 'bear_bb_std_mult': 2.42617170544326, 'bear_rsi_os': 47, 'bear_rsi_ob': 88, 'bear_adx_thresh': 17.04113675364338, 'bear_atr_min_pct': 0.013662846201249986, 'bear_atr_max_pct': 0.02904998083163504, 'bear_tp_mult': 2.668656323053172, 'bear_tsl_mult': 0.14542472696439884, 'bear_time_stop': 191, 'bear_use_sma': False, 'bear_use_ema': False, 'bear_use_atr': False, 'bear_use_adx': True, 'bear_use_spike': False, 'bear_rsi_required': True, 'sideways_strategy': 'breakout', 'sideways_bb_std_mult': 3.332505876937538, 'sideways_rsi_os': 33, 'sideways_rsi_ob': 58, 'sideways_adx_thresh': 6.364040410297097, 'sideways_atr_min_pct': 0.011957740267810404, 'sideways_atr_max_pct': 0.14789774362447908, 'sideways_tp_mult': 1.1589852059316441, 'sideways_tsl_mult': 0.946715393037293, 'sideways_time_stop': 258, 'sideways_use_sma': False, 'sideways_use_ema': False, 'sideways_use_atr': True, 'sideways_use_adx': False, 'sideways_use_spike': False, 'sideways_rsi_required': False}.
