[I 2025-08-30 20:06:34,767] Trial 856 finished with values: [-1000000000.0, 1000000000.0] and parameters: {'p_sma': 22, 'p_std': 34, 'p_atr': 8, 'p_adx': 20, 'rsi_period': 70, 'ema1': 26, 'ema2': 32, 'slip_atr_k': 0.06116314615524126, 'slip_spread_k': 0.13765313964260661, 'spread_hl_frac': 0.04427355338991173, 'bb_std_mult': 1.223914128643956, 'rsi_os': 50, 'rsi_ob': 86, 'vol_spike': 0.2680438494860715, 'adx_thresh': 34.98439185505238, 'atr_min_pct': 0.023761339282722456, 'atr_max_pct': 0.0692693230012436, 'tp_mult': 1.8448721273237751, 'tsl_mult': 0.245573771974952, 'strategy': 'mean_reversion', 'time_stop': 178, 'use_sma': False, 'use_atr': True, 'use_adx': True, 'use_ema': False, 'use_spike': True, 'rsi_required': True, 'edge_k': 0.034117954717827276, 'edge_cap': 0.5453749120901086, 'bull_strategy': 'mean_reversion', 'bull_bb_std_mult': 2.978457554310563, 'bull_rsi_os': 55, 'bull_rsi_ob': 45, 'bull_adx_thresh': 20.865717786139907, 'bull_atr_min_pct': 0.0008986782497360513, 'bull_atr_max_pct': 0.11006063790828702, 'bull_tp_mult': 2.035483455765004, 'bull_tsl_mult': 0.5707487944936834, 'bull_time_stop': 180, 'bull_use_sma': False, 'bull_use_ema': True, 'bull_use_atr': False, 'bull_use_adx': True, 'bull_use_spike': False, 'bull_rsi_required': False, 'bear_strategy': 'breakout', 'bear_bb_std_mult': 2.9075309635410913, 'bear_rsi_os': 52, 'bear_rsi_ob': 75, 'bear_adx_thresh': 16.697613674800763, 'bear_atr_min_pct': 0.015754637899675218, 'bear_atr_max_pct': 0.09729550398285625, 'bear_tp_mult': 2.725253200944804, 'bear_tsl_mult': 0.39204480316630935, 'bear_time_stop': 197, 'bear_use_sma': True, 'bear_use_ema': False, 'bear_use_atr': False, 'bear_use_adx': False, 'bear_use_spike': False, 'bear_rsi_required': False, 'sideways_strategy': 'breakout', 'sideways_bb_std_mult': 0.6058812078403002, 'sideways_rsi_os': 14, 'sideways_rsi_ob': 74, 'sideways_adx_thresh': 18.9361171275522, 'sideways_atr_min_pct': 0.026873033613201033, 'sideways_atr_max_pct': 0.08376932811602424, 'sideways_tp_mult': 1.0506802964370496, 'sideways_tsl_mult': 0.9678895828687231, 'sideways_time_stop': 152, 'sideways_use_sma': False, 'sideways_use_ema': False, 'sideways_use_atr': True, 'sideways_use_adx': False, 'sideways_use_spike': True, 'sideways_rsi_required': False}.
[I 2025-08-30 20:07:04,272] Trial 854 finished with values: [-1000000000.0, 1000000000.0] and parameters: {'p_sma': 7, 'p_std': 13, 'p_atr': 8, 'p_adx': 19, 'rsi_period': 55, 'ema1': 23, 'ema2': 23, 'slip_atr_k': 0.08027046304217123, 'slip_spread_k': 0.9036369805540162, 'spread_hl_frac': 0.019269586187090234, 'bb_std_mult': 1.457082465162544, 'rsi_os': 27, 'rsi_ob': 84, 'vol_spike': 0.2916759601709414, 'adx_thresh': 33.30493005996183, 'atr_min_pct': 0.023861520337223902, 'atr_max_pct': 0.0447398964125729, 'tp_mult': 1.8425172364493996, 'tsl_mult': 0.9028426956063493, 'strategy': 'mean_reversion', 'time_stop': 177, 'use_sma': True, 'use_atr': True, 'use_adx': True, 'use_ema': False, 'use_spike': True, 'rsi_required': False, 'edge_k': 0.23605222779477725, 'edge_cap': 0.22473757676093237, 'bull_strategy': 'mean_reversion', 'bull_bb_std_mult': 3.0062877889434407, 'bull_rsi_os': 51, 'bull_rsi_ob': 45, 'bull_adx_thresh': 8.16933360533336, 'bull_atr_min_pct': 0.0014463472610714324, 'bull_atr_max_pct': 0.07851849762270868, 'bull_tp_mult': 1.2684456366204908, 'bull_tsl_mult': 0.08278736836635953, 'bull_time_stop': 294, 'bull_use_sma': False, 'bull_use_ema': True, 'bull_use_atr': False, 'bull_use_adx': False, 'bull_use_spike': False, 'bull_rsi_required': True, 'bear_strategy': 'breakout', 'bear_bb_std_mult': 2.8161124932181765, 'bear_rsi_os': 27, 'bear_rsi_ob': 52, 'bear_adx_thresh': 16.934691967766895, 'bear_atr_min_pct': 0.015972779748499772, 'bear_atr_max_pct': 0.05543454301305743, 'bear_tp_mult': 2.726551460556772, 'bear_tsl_mult': 0.7250239281899364, 'bear_time_stop': 197, 'bear_use_sma': True, 'bear_use_ema': True, 'bear_use_atr': False, 'bear_use_adx': False, 'bear_use_spike': False, 'bear_rsi_required': False, 'sideways_strategy': 'breakout', 'sideways_bb_std_mult': 2.2469680164959627, 'sideways_rsi_os': 14, 'sideways_rsi_ob': 62, 'sideways_adx_thresh': 19.496812769381886, 'sideways_atr_min_pct': 0.00334067795288636, 'sideways_atr_max_pct': 0.1159224110835281, 'sideways_tp_mult': 2.8323154874579703, 'sideways_tsl_mult': 0.9651943029356901, 'sideways_time_stop': 155, 'sideways_use_sma': False, 'sideways_use_ema': True, 'sideways_use_atr': True, 'sideways_use_adx': False, 'sideways_use_spike': True, 'sideways_rsi_required': True}.
[I 2025-08-30 20:07:04,582] Trial 857 finished with values: [-1000000000.0, 1000000000.0] and parameters: {'p_sma': 17, 'p_std': 30, 'p_atr': 13, 'p_adx': 19, 'rsi_period': 23, 'ema1': 18, 'ema2': 32, 'slip_atr_k': 0.06049612527304044, 'slip_spread_k': 0.09834691950806462, 'spread_hl_frac': 0.026108034435590066, 'bb_std_mult': 3.5970366817346733, 'rsi_os': 49, 'rsi_ob': 89, 'vol_spike': 0.2988023461881586, 'adx_thresh': 34.075081148788634, 'atr_min_pct': 0.023879356699929202, 'atr_max_pct': 0.043728715349810855, 'tp_mult': 2.3346931495030057, 'tsl_mult': 0.8476877505771854, 'strategy': 'breakout', 'time_stop': 53, 'use_sma': False, 'use_atr': True, 'use_adx': True, 'use_ema': False, 'use_spike': True, 'rsi_required': True, 'edge_k': 0.2569821887964395, 'edge_cap': 0.557616770781064, 'bull_strategy': 'breakout', 'bull_bb_std_mult': 2.4254531934904575, 'bull_rsi_os': 10, 'bull_rsi_ob': 49, 'bull_adx_thresh': 23.65108985149343, 'bull_atr_min_pct': 0.001036666711070337, 'bull_atr_max_pct': 0.11012947317650622, 'bull_tp_mult': 2.954767013767741, 'bull_tsl_mult': 0.5738301855251647, 'bull_time_stop': 294, 'bull_use_sma': False, 'bull_use_ema': False, 'bull_use_atr': False, 'bull_use_adx': True, 'bull_use_spike': False, 'bull_rsi_required': False, 'bear_strategy': 'breakout', 'bear_bb_std_mult': 1.2857257910682072, 'bear_rsi_os': 46, 'bear_rsi_ob': 79, 'bear_adx_thresh': 16.701369124587515, 'bear_atr_min_pct': 0.017663636591155572, 'bear_atr_max_pct': 0.04167960055584747, 'bear_tp_mult': 2.719397036577803, 'bear_tsl_mult': 0.7504609654300471, 'bear_time_stop': 199, 'bear_use_sma': False, 'bear_use_ema': False, 'bear_use_atr': False, 'bear_use_adx': True, 'bear_use_spike': False, 'bear_rsi_required': False, 'sideways_strategy': 'breakout', 'sideways_bb_std_mult': 3.516436143296974, 'sideways_rsi_os': 15, 'sideways_rsi_ob': 85, 'sideways_adx_thresh': 21.59739647503378, 'sideways_atr_min_pct': 0.009844232799490005, 'sideways_atr_max_pct': 0.13931053549131378, 'sideways_tp_mult': 1.1410114405938319, 'sideways_tsl_mult': 0.9701193182629302, 'sideways_time_stop': 153, 'sideways_use_sma': True, 'sideways_use_ema': False, 'sideways_use_atr': True, 'sideways_use_adx': False, 'sideways_use_spike': True, 'sideways_rsi_required': False}.
[I 2025-08-30 20:07:10,022] Trial 858 finished with values: [-1000000000.0, 1000000000.0] and parameters: {'p_sma': 22, 'p_std': 52, 'p_atr': 30, 'p_adx': 11, 'rsi_period': 58, 'ema1': 23, 'ema2': 33, 'slip_atr_k': 0.0805826381899971, 'slip_spread_k': 0.4903258970618348, 'spread_hl_frac': 0.04998274084475983, 'bb_std_mult': 2.0926960019282905, 'rsi_os': 19, 'rsi_ob': 86, 'vol_spike': 0.05451437993660273, 'adx_thresh': 34.00779133955595, 'atr_min_pct': 0.028039730938674512, 'atr_max_pct': 0.05922402610549345, 'tp_mult': 2.3391794372710724, 'tsl_mult': 0.628294830997515, 'strategy': 'breakout', 'time_stop': 62, 'use_sma': False, 'use_atr': True, 'use_adx': True, 'use_ema': False, 'use_spike': True, 'rsi_required': True, 'edge_k': 0.26110554642422246, 'edge_cap': 0.6677142188241942, 'bull_strategy': 'breakout', 'bull_bb_std_mult': 2.0182031091387485, 'bull_rsi_os': 10, 'bull_rsi_ob': 47, 'bull_adx_thresh': 32.85941255562651, 'bull_atr_min_pct': 0.0009158794704956298, 'bull_atr_max_pct': 0.08949135020602066, 'bull_tp_mult': 1.2777815700981927, 'bull_tsl_mult': 0.5787900486424253, 'bull_time_stop': 180, 'bull_use_sma': False, 'bull_use_ema': False, 'bull_use_atr': True, 'bull_use_adx': True, 'bull_use_spike': False, 'bull_rsi_required': False, 'bear_strategy': 'breakout', 'bear_bb_std_mult': 0.8785586582479179, 'bear_rsi_os': 39, 'bear_rsi_ob': 73, 'bear_adx_thresh': 16.63380932366787, 'bear_atr_min_pct': 0.013876313544758871, 'bear_atr_max_pct': 0.07508605494938894, 'bear_tp_mult': 2.724429022590154, 'bear_tsl_mult': 0.8475360224981162, 'bear_time_stop': 223, 'bear_use_sma': False, 'bear_use_ema': False, 'bear_use_atr': False, 'bear_use_adx': True, 'bear_use_spike': False, 'bear_rsi_required': False, 'sideways_strategy': 'breakout', 'sideways_bb_std_mult': 3.275288744366685, 'sideways_rsi_os': 22, 'sideways_rsi_ob': 60, 'sideways_adx_thresh': 21.49710177322516, 'sideways_atr_min_pct': 0.0014616949253300885, 'sideways_atr_max_pct': 0.09178039930119361, 'sideways_tp_mult': 1.1299367168234882, 'sideways_tsl_mult': 0.9633044002121174, 'sideways_time_stop': 255, 'sideways_use_sma': True, 'sideways_use_ema': False, 'sideways_use_atr': False, 'sideways_use_adx': False, 'sideways_use_spike': False, 'sideways_rsi_required': False}.
[I 2025-08-30 20:07:10,910] Trial 859 finished with values: [-0.04598370902928839, 0.04592882129610794] and parameters: {'p_sma': 35, 'p_std': 30, 'p_atr': 24, 'p_adx': 11, 'rsi_period': 26, 'ema1': 27, 'ema2': 30, 'slip_atr_k': 0.07996103887788955, 'slip_spread_k': 0.19610522753192572, 'spread_hl_frac': 0.019560750002964786, 'bb_std_mult': 2.076082827956182, 'rsi_os': 28, 'rsi_ob': 75, 'vol_spike': 0.1515082136129585, 'adx_thresh': 33.28147038998024, 'atr_min_pct': 0.023478253934295597, 'atr_max_pct': 0.0919872564159248, 'tp_mult': 2.339139282568172, 'tsl_mult': 0.8399584942077087, 'strategy': 'breakout', 'time_stop': 201, 'use_sma': False, 'use_atr': True, 'use_adx': True, 'use_ema': False, 'use_spike': True, 'rsi_required': False, 'edge_k': 0.2538910103721829, 'edge_cap': 0.4591031418398139, 'bull_strategy': 'breakout', 'bull_bb_std_mult': 3.2352491620998247, 'bull_rsi_os': 10, 'bull_rsi_ob': 47, 'bull_adx_thresh': 32.654040217793685, 'bull_atr_min_pct': 0.0013067982456999938, 'bull_atr_max_pct': 0.09449194112062806, 'bull_tp_mult': 2.6908441099267932, 'bull_tsl_mult': 0.3551476040462708, 'bull_time_stop': 89, 'bull_use_sma': False, 'bull_use_ema': False, 'bull_use_atr': True, 'bull_use_adx': False, 'bull_use_spike': False, 'bull_rsi_required': True, 'bear_strategy': 'breakout', 'bear_bb_std_mult': 2.8938657666114334, 'bear_rsi_os': 13, 'bear_rsi_ob': 87, 'bear_adx_thresh': 17.128242524390537, 'bear_atr_min_pct': 0.013625878155203698, 'bear_atr_max_pct': 0.07156257780525445, 'bear_tp_mult': 2.5346531870069717, 'bear_tsl_mult': 0.9081026407102508, 'bear_time_stop': 245, 'bear_use_sma': False, 'bear_use_ema': True, 'bear_use_atr': False, 'bear_use_adx': True, 'bear_use_spike': False, 'bear_rsi_required': True, 'sideways_strategy': 'breakout', 'sideways_bb_std_mult': 3.2868891966106175, 'sideways_rsi_os': 37, 'sideways_rsi_ob': 59, 'sideways_adx_thresh': 21.363486515177605, 'sideways_atr_min_pct': 0.0017711201515104046, 'sideways_atr_max_pct': 0.1474653245959546, 'sideways_tp_mult': 2.07258759061724, 'sideways_tsl_mult': 0.9574172895166955, 'sideways_time_stop': 281, 'sideways_use_sma': True, 'sideways_use_ema': True, 'sideways_use_atr': False, 'sideways_use_adx': False, 'sideways_use_spike': False, 'sideways_rsi_required': False}.
[I 2025-08-30 20:07:42,085] Trial 860 finished with values: [-1000000000.0, 1000000000.0] and parameters: {'p_sma': 9, 'p_std': 52, 'p_atr': 13, 'p_adx': 10, 'rsi_period': 23, 'ema1': 19, 'ema2': 47, 'slip_atr_k': 0.06306700676556859, 'slip_spread_k': 0.19313038558781345, 'spread_hl_frac': 0.021642513303312936, 'bb_std_mult': 2.038505496362343, 'rsi_os': 48, 'rsi_ob': 67, 'vol_spike': 0.1522819877489211, 'adx_thresh': 34.02873789194789, 'atr_min_pct': 0.028246843925544288, 'atr_max_pct': 0.13777966515320655, 'tp_mult': 2.3292133531192603, 'tsl_mult': 0.8478812442378368, 'strategy': 'breakout', 'time_stop': 201, 'use_sma': False, 'use_atr': True, 'use_adx': True, 'use_ema': False, 'use_spike': True, 'rsi_required': True, 'edge_k': 0.12609476587335058, 'edge_cap': 0.6661904718218494, 'bull_strategy': 'breakout', 'bull_bb_std_mult': 3.22145871676468, 'bull_rsi_os': 46, 'bull_rsi_ob': 47, 'bull_adx_thresh': 14.14854342121415, 'bull_atr_min_pct': 0.007283463455632515, 'bull_atr_max_pct': 0.08947444971706457, 'bull_tp_mult': 2.715151935201994, 'bull_tsl_mult': 0.8838975646967347, 'bull_time_stop': 178, 'bull_use_sma': False, 'bull_use_ema': False, 'bull_use_atr': True, 'bull_use_adx': True, 'bull_use_spike': False, 'bull_rsi_required': False, 'bear_strategy': 'breakout', 'bear_bb_std_mult': 2.8905566489512267, 'bear_rsi_os': 39, 'bear_rsi_ob': 87, 'bear_adx_thresh': 17.567534037402048, 'bear_atr_min_pct': 0.013653919274362434, 'bear_atr_max_pct': 0.03747468031323229, 'bear_tp_mult': 2.6596780254428887, 'bear_tsl_mult': 0.7618982351371903, 'bear_time_stop': 183, 'bear_use_sma': False, 'bear_use_ema': False, 'bear_use_atr': False, 'bear_use_adx': True, 'bear_use_spike': False, 'bear_rsi_required': True, 'sideways_strategy': 'breakout', 'sideways_bb_std_mult': 3.252908455717213, 'sideways_rsi_os': 38, 'sideways_rsi_ob': 60, 'sideways_adx_thresh': 21.392417310374135, 'sideways_atr_min_pct': 0.01014699353879859, 'sideways_atr_max_pct': 0.11110893325752058, 'sideways_tp_mult': 2.0729854032128134, 'sideways_tsl_mult': 0.9428821964006591, 'sideways_time_stop': 99, 'sideways_use_sma': True, 'sideways_use_ema': False, 'sideways_use_atr': False, 'sideways_use_adx': False, 'sideways_use_spike': False, 'sideways_rsi_required': False}.
[I 2025-08-30 20:07:42,916] Trial 861 finished with values: [-1000000000.0, 1000000000.0] and parameters: {'p_sma': 36, 'p_std': 29, 'p_atr': 9, 'p_adx': 20, 'rsi_period': 35, 'ema1': 25, 'ema2': 54, 'slip_atr_k': 0.12406429901542092, 'slip_spread_k': 0.19496032342519576, 'spread_hl_frac': 0.04632791264163594, 'bb_std_mult': 2.060570887068015, 'rsi_os': 47, 'rsi_ob': 83, 'vol_spike': 0.21573241631091455, 'adx_thresh': 7.499798132560262, 'atr_min_pct': 0.005499727935776974, 'atr_max_pct': 0.09256454494786165, 'tp_mult': 2.217291758043805, 'tsl_mult': 0.8438942877471538, 'strategy': 'breakout', 'time_stop': 199, 'use_sma': False, 'use_atr': False, 'use_adx': True, 'use_ema': True, 'use_spike': False, 'rsi_required': False, 'edge_k': 0.1201270928545327, 'edge_cap': 0.49005176461868305, 'bull_strategy': 'breakout', 'bull_bb_std_mult': 0.5405903423427978, 'bull_rsi_os': 31, 'bull_rsi_ob': 55, 'bull_adx_thresh': 16.438527671905028, 'bull_atr_min_pct': 0.002702805821379085, 'bull_atr_max_pct': 0.022356948152229772, 'bull_tp_mult': 2.7180267730794956, 'bull_tsl_mult': 0.5129734170127335, 'bull_time_stop': 87, 'bull_use_sma': False, 'bull_use_ema': False, 'bull_use_atr': True, 'bull_use_adx': False, 'bull_use_spike': True, 'bull_rsi_required': True, 'bear_strategy': 'breakout', 'bear_bb_std_mult': 2.3705235155770965, 'bear_rsi_os': 20, 'bear_rsi_ob': 78, 'bear_adx_thresh': 17.506441878926363, 'bear_atr_min_pct': 0.013691213170063651, 'bear_atr_max_pct': 0.07180881126436603, 'bear_tp_mult': 2.52848953948717, 'bear_tsl_mult': 0.7601791555597636, 'bear_time_stop': 190, 'bear_use_sma': False, 'bear_use_ema': True, 'bear_use_atr': False, 'bear_use_adx': True, 'bear_use_spike': False, 'bear_rsi_required': True, 'sideways_strategy': 'mean_reversion', 'sideways_bb_std_mult': 3.266659356696058, 'sideways_rsi_os': 38, 'sideways_rsi_ob': 59, 'sideways_adx_thresh': 32.21583402497369, 'sideways_atr_min_pct': 0.001711874884093247, 'sideways_atr_max_pct': 0.14826562734685017, 'sideways_tp_mult': 1.1282280612472295, 'sideways_tsl_mult': 0.6882045230370899, 'sideways_time_stop': 176, 'sideways_use_sma': True, 'sideways_use_ema': True, 'sideways_use_atr': False, 'sideways_use_adx': False, 'sideways_use_spike': False, 'sideways_rsi_required': True}.
[I 2025-08-30 20:07:44,750] Trial 862 finished with values: [-1000000000.0, 1000000000.0] and parameters: {'p_sma': 8, 'p_std': 36, 'p_atr': 7, 'p_adx': 20, 'rsi_period': 26, 'ema1': 19, 'ema2': 47, 'slip_atr_k': 0.1810774160904548, 'slip_spread_k': 0.20077008678564096, 'spread_hl_frac': 0.02136689833202413, 'bb_std_mult': 1.9364438287060606, 'rsi_os': 47, 'rsi_ob': 75, 'vol_spike': 0.07709475836715499, 'adx_thresh': 17.969687676053436, 'atr_min_pct': 0.024614787743491566, 'atr_max_pct': 0.07680689078227229, 'tp_mult': 2.2179977675429297, 'tsl_mult': 0.3758471024536135, 'strategy': 'mean_reversion', 'time_stop': 5, 'use_sma': False, 'use_atr': False, 'use_adx': False, 'use_ema': True, 'use_spike': False, 'rsi_required': False, 'edge_k': 0.13608275071244286, 'edge_cap': 0.48972031251693193, 'bull_strategy': 'mean_reversion', 'bull_bb_std_mult': 3.2011004964404925, 'bull_rsi_os': 53, 'bull_rsi_ob': 47, 'bull_adx_thresh': 25.374265788210487, 'bull_atr_min_pct': 0.0026310347048031178, 'bull_atr_max_pct': 0.022358122721467054, 'bull_tp_mult': 2.694176385772652, 'bull_tsl_mult': 0.509463819188527, 'bull_time_stop': 89, 'bull_use_sma': True, 'bull_use_ema': True, 'bull_use_atr': True, 'bull_use_adx': False, 'bull_use_spike': True, 'bull_rsi_required': True, 'bear_strategy': 'breakout', 'bear_bb_std_mult': 2.8994248233630184, 'bear_rsi_os': 20, 'bear_rsi_ob': 61, 'bear_adx_thresh': 17.717599025781986, 'bear_atr_min_pct': 0.02598605504657513, 'bear_atr_max_pct': 0.027526898746068666, 'bear_tp_mult': 2.664010995483245, 'bear_tsl_mult': 0.760851196011922, 'bear_time_stop': 191, 'bear_use_sma': True, 'bear_use_ema': True, 'bear_use_atr': True, 'bear_use_adx': False, 'bear_use_spike': False, 'bear_rsi_required': True, 'sideways_strategy': 'mean_reversion', 'sideways_bb_std_mult': 1.2174380452756557, 'sideways_rsi_os': 31, 'sideways_rsi_ob': 56, 'sideways_adx_thresh': 20.360839758272977, 'sideways_atr_min_pct': 0.014930222641491301, 'sideways_atr_max_pct': 0.11116296818328227, 'sideways_tp_mult': 1.0754861596458292, 'sideways_tsl_mult': 0.5441356710444841, 'sideways_time_stop': 174, 'sideways_use_sma': False, 'sideways_use_ema': True, 'sideways_use_atr': False, 'sideways_use_adx': False, 'sideways_use_spike': False, 'sideways_rsi_required': True}.
[I 2025-08-30 20:07:44,823] Trial 863 finished with values: [-1000000000.0, 1000000000.0] and parameters: {'p_sma': 9, 'p_std': 23, 'p_atr': 11, 'p_adx': 8, 'rsi_period': 24, 'ema1': 25, 'ema2': 42, 'slip_atr_k': 0.1604959926884741, 'slip_spread_k': 0.33545814995387213, 'spread_hl_frac': 0.03892350615068842, 'bb_std_mult': 3.430167597638233, 'rsi_os': 48, 'rsi_ob': 83, 'vol_spike': 0.2787499709021597, 'adx_thresh': 32.84533211009206, 'atr_min_pct': 0.024539142390094627, 'atr_max_pct': 0.09697574956752533, 'tp_mult': 1.211878974504852, 'tsl_mult': 0.8867182152795658, 'strategy': 'mean_reversion', 'time_stop': 194, 'use_sma': False, 'use_atr': False, 'use_adx': False, 'use_ema': True, 'use_spike': False, 'rsi_required': False, 'edge_k': 0.8533643022534282, 'edge_cap': 0.49711918321560716, 'bull_strategy': 'mean_reversion', 'bull_bb_std_mult': 2.7039638159363504, 'bull_rsi_os': 46, 'bull_rsi_ob': 46, 'bull_adx_thresh': 26.82986985957606, 'bull_atr_min_pct': 0.0018386089420481325, 'bull_atr_max_pct': 0.02387066696491013, 'bull_tp_mult': 2.637298070993845, 'bull_tsl_mult': 0.5099238793053797, 'bull_time_stop': 176, 'bull_use_sma': True, 'bull_use_ema': True, 'bull_use_atr': True, 'bull_use_adx': False, 'bull_use_spike': True, 'bull_rsi_required': True, 'bear_strategy': 'breakout', 'bear_bb_std_mult': 2.642747084951426, 'bear_rsi_os': 49, 'bear_rsi_ob': 77, 'bear_adx_thresh': 17.624148845940148, 'bear_atr_min_pct': 0.011839814711839536, 'bear_atr_max_pct': 0.02858248627499351, 'bear_tp_mult': 2.653942949861399, 'bear_tsl_mult': 0.7985160262571481, 'bear_time_stop': 110, 'bear_use_sma': True, 'bear_use_ema': True, 'bear_use_atr': True, 'bear_use_adx': False, 'bear_use_spike': False, 'bear_rsi_required': True, 'sideways_strategy': 'mean_reversion', 'sideways_bb_std_mult': 3.1215206708221546, 'sideways_rsi_os': 36, 'sideways_rsi_ob': 56, 'sideways_adx_thresh': 20.750438737342503, 'sideways_atr_min_pct': 0.029955479571014763, 'sideways_atr_max_pct': 0.09793355265373868, 'sideways_tp_mult': 2.7185141495440024, 'sideways_tsl_mult': 0.9833778732202354, 'sideways_time_stop': 115, 'sideways_use_sma': False, 'sideways_use_ema': True, 'sideways_use_atr': True, 'sideways_use_adx': True, 'sideways_use_spike': False, 'sideways_rsi_required': True}.
