[I 2025-08-30 19:37:55,775] Trial 603 finished with values: [-1000000000.0, 1000000000.0] and parameters: {'p_sma': 9, 'p_std': 33, 'p_atr': 27, 'p_adx': 8, 'rsi_period': 45, 'ema1': 26, 'ema2': 11, 'slip_atr_k': 0.12827170637386665, 'slip_spread_k': 0.1802299171048388, 'spread_hl_frac': 0.012966272211799737, 'bb_std_mult': 2.334163458628093, 'rsi_os': 46, 'rsi_ob': 81, 'vol_spike': 0.25911403666485044, 'adx_thresh': 21.974840657660494, 'atr_min_pct': 0.023707925611730248, 'atr_max_pct': 0.03367624188671746, 'tp_mult': 2.3344987411411084, 'tsl_mult': 0.8227122231796781, 'strategy': 'mean_reversion', 'time_stop': 178, 'use_sma': False, 'use_atr': True, 'use_adx': True, 'use_ema': False, 'use_spike': True, 'rsi_required': False, 'edge_k': 0.19153492492126079, 'edge_cap': 0.5608258621603225, 'bull_strategy': 'breakout', 'bull_bb_std_mult': 2.739215868554634, 'bull_rsi_os': 34, 'bull_rsi_ob': 46, 'bull_adx_thresh': 18.197430838772977, 'bull_atr_min_pct': 0.01933307209488606, 'bull_atr_max_pct': 0.06575792583442025, 'bull_tp_mult': 1.7884725356222488, 'bull_tsl_mult': 0.5754951088742261, 'bull_time_stop': 174, 'bull_use_sma': True, 'bull_use_ema': True, 'bull_use_atr': True, 'bull_use_adx': False, 'bull_use_spike': False, 'bull_rsi_required': False, 'bear_strategy': 'breakout', 'bear_bb_std_mult': 1.1607200677242837, 'bear_rsi_os': 37, 'bear_rsi_ob': 74, 'bear_adx_thresh': 25.446892448875055, 'bear_atr_min_pct': 0.010358492351333536, 'bear_atr_max_pct': 0.07468632867402138, 'bear_tp_mult': 2.17977715096891, 'bear_tsl_mult': 0.7425512217932216, 'bear_time_stop': 53, 'bear_use_sma': True, 'bear_use_ema': False, 'bear_use_atr': False, 'bear_use_adx': False, 'bear_use_spike': True, 'bear_rsi_required': True, 'sideways_strategy': 'mean_reversion', 'sideways_bb_std_mult': 1.71725848444279, 'sideways_rsi_os': 39, 'sideways_rsi_ob': 85, 'sideways_adx_thresh': 19.677852456081343, 'sideways_atr_min_pct': 0.026025413598915345, 'sideways_atr_max_pct': 0.06587266366662387, 'sideways_tp_mult': 1.6458900097838902, 'sideways_tsl_mult': 0.968322710355397, 'sideways_time_stop': 166, 'sideways_use_sma': False, 'sideways_use_ema': False, 'sideways_use_atr': True, 'sideways_use_adx': True, 'sideways_use_spike': True, 'sideways_rsi_required': True}.
[I 2025-08-30 19:37:56,621] Trial 604 finished with values: [-1000000000.0, 1000000000.0] and parameters: {'p_sma': 25, 'p_std': 33, 'p_atr': 18, 'p_adx': 19, 'rsi_period': 21, 'ema1': 27, 'ema2': 38, 'slip_atr_k': 0.22431051137879005, 'slip_spread_k': 0.15590414019379514, 'spread_hl_frac': 0.02416951437411322, 'bb_std_mult': 2.315676373864079, 'rsi_os': 51, 'rsi_ob': 81, 'vol_spike': 0.2119690704360116, 'adx_thresh': 22.522144149964678, 'atr_min_pct': 0.014951055135885377, 'atr_max_pct': 0.09312507156848229, 'tp_mult': 2.269560772893582, 'tsl_mult': 0.8167239724645191, 'strategy': 'mean_reversion', 'time_stop': 200, 'use_sma': False, 'use_atr': True, 'use_adx': True, 'use_ema': False, 'use_spike': True, 'rsi_required': False, 'edge_k': 1.2513744619620963, 'edge_cap': 0.4709784004101705, 'bull_strategy': 'breakout', 'bull_bb_std_mult': 3.278303461231463, 'bull_rsi_os': 32, 'bull_rsi_ob': 47, 'bull_adx_thresh': 18.783139627241695, 'bull_atr_min_pct': 0.007444606128085983, 'bull_atr_max_pct': 0.10305471078208883, 'bull_tp_mult': 2.7570930340463655, 'bull_tsl_mult': 0.02409107471416988, 'bull_time_stop': 254, 'bull_use_sma': True, 'bull_use_ema': True, 'bull_use_atr': True, 'bull_use_adx': True, 'bull_use_spike': False, 'bull_rsi_required': False, 'bear_strategy': 'breakout', 'bear_bb_std_mult': 3.597453130355005, 'bear_rsi_os': 55, 'bear_rsi_ob': 54, 'bear_adx_thresh': 29.726192251006438, 'bear_atr_min_pct': 0.023988291488686034, 'bear_atr_max_pct': 0.12563029900822428, 'bear_tp_mult': 1.0860477593495377, 'bear_tsl_mult': 0.7449195885598985, 'bear_time_stop': 199, 'bear_use_sma': True, 'bear_use_ema': False, 'bear_use_atr': False, 'bear_use_adx': False, 'bear_use_spike': False, 'bear_rsi_required': True, 'sideways_strategy': 'mean_reversion', 'sideways_bb_std_mult': 3.052124301727153, 'sideways_rsi_os': 36, 'sideways_rsi_ob': 72, 'sideways_adx_thresh': 23.74112233074037, 'sideways_atr_min_pct': 0.009576477750429118, 'sideways_atr_max_pct': 0.1473270312815934, 'sideways_tp_mult': 1.6541795894608171, 'sideways_tsl_mult': 0.33798552204061494, 'sideways_time_stop': 166, 'sideways_use_sma': False, 'sideways_use_ema': True, 'sideways_use_atr': True, 'sideways_use_adx': True, 'sideways_use_spike': True, 'sideways_rsi_required': False}.
[I 2025-08-30 19:37:56,729] Trial 605 finished with values: [-1000000000.0, 1000000000.0] and parameters: {'p_sma': 31, 'p_std': 32, 'p_atr': 26, 'p_adx': 23, 'rsi_period': 21, 'ema1': 27, 'ema2': 32, 'slip_atr_k': 0.22551659125747947, 'slip_spread_k': 0.1701553605999545, 'spread_hl_frac': 0.03452675756986762, 'bb_std_mult': 2.312964649803631, 'rsi_os': 51, 'rsi_ob': 81, 'vol_spike': 0.2834352432779117, 'adx_thresh': 25.245168312430955, 'atr_min_pct': 0.02518504181758899, 'atr_max_pct': 0.09329154969457434, 'tp_mult': 2.756255751491457, 'tsl_mult': 0.8315828885233516, 'strategy': 'mean_reversion', 'time_stop': 200, 'use_sma': False, 'use_atr': True, 'use_adx': True, 'use_ema': True, 'use_spike': True, 'rsi_required': False, 'edge_k': 0.10973622881834177, 'edge_cap': 0.8723408406270365, 'bull_strategy': 'breakout', 'bull_bb_std_mult': 3.229689008021293, 'bull_rsi_os': 10, 'bull_rsi_ob': 70, 'bull_adx_thresh': 32.93488101190801, 'bull_atr_min_pct': 0.007582998926369137, 'bull_atr_max_pct': 0.05031272454572783, 'bull_tp_mult': 2.746030342896893, 'bull_tsl_mult': 0.41549895267386044, 'bull_time_stop': 253, 'bull_use_sma': True, 'bull_use_ema': True, 'bull_use_atr': True, 'bull_use_adx': True, 'bull_use_spike': False, 'bull_rsi_required': False, 'bear_strategy': 'breakout', 'bear_bb_std_mult': 3.043466672262663, 'bear_rsi_os': 33, 'bear_rsi_ob': 91, 'bear_adx_thresh': 26.15171189079642, 'bear_atr_min_pct': 0.011681258517163713, 'bear_atr_max_pct': 0.03489789191052515, 'bear_tp_mult': 2.9333334280790933, 'bear_tsl_mult': 0.752039900778995, 'bear_time_stop': 189, 'bear_use_sma': True, 'bear_use_ema': False, 'bear_use_atr': False, 'bear_use_adx': False, 'bear_use_spike': False, 'bear_rsi_required': True, 'sideways_strategy': 'mean_reversion', 'sideways_bb_std_mult': 2.2495447346736293, 'sideways_rsi_os': 36, 'sideways_rsi_ob': 61, 'sideways_adx_thresh': 14.439934864370095, 'sideways_atr_min_pct': 0.01524164044573767, 'sideways_atr_max_pct': 0.1433306230008549, 'sideways_tp_mult': 1.147063616979504, 'sideways_tsl_mult': 0.19036303987619896, 'sideways_time_stop': 165, 'sideways_use_sma': False, 'sideways_use_ema': True, 'sideways_use_atr': True, 'sideways_use_adx': True, 'sideways_use_spike': False, 'sideways_rsi_required': False}.
[I 2025-08-30 19:37:56,848] Trial 606 finished with values: [-1000000000.0, 1000000000.0] and parameters: {'p_sma': 8, 'p_std': 14, 'p_atr': 7, 'p_adx': 19, 'rsi_period': 83, 'ema1': 27, 'ema2': 32, 'slip_atr_k': 0.22489289489347072, 'slip_spread_k': 0.1524585279204822, 'spread_hl_frac': 0.02643947167629469, 'bb_std_mult': 2.336867011526188, 'rsi_os': 51, 'rsi_ob': 80, 'vol_spike': 0.022667112788522847, 'adx_thresh': 34.983127729674486, 'atr_min_pct': 0.025283202561597985, 'atr_max_pct': 0.09360863794511977, 'tp_mult': 2.2755396064626066, 'tsl_mult': 0.08144600387732154, 'strategy': 'mean_reversion', 'time_stop': 199, 'use_sma': False, 'use_atr': True, 'use_adx': True, 'use_ema': True, 'use_spike': False, 'rsi_required': False, 'edge_k': 0.11469384807019786, 'edge_cap': 0.469853554169246, 'bull_strategy': 'breakout', 'bull_bb_std_mult': 3.206913147883148, 'bull_rsi_os': 32, 'bull_rsi_ob': 59, 'bull_adx_thresh': 15.832731079592804, 'bull_atr_min_pct': 0.00136855507739305, 'bull_atr_max_pct': 0.10315507735836209, 'bull_tp_mult': 1.7991731202378252, 'bull_tsl_mult': 0.5483555278669285, 'bull_time_stop': 253, 'bull_use_sma': True, 'bull_use_ema': True, 'bull_use_atr': True, 'bull_use_adx': True, 'bull_use_spike': False, 'bull_rsi_required': False, 'bear_strategy': 'breakout', 'bear_bb_std_mult': 0.5917869383488348, 'bear_rsi_os': 55, 'bear_rsi_ob': 76, 'bear_adx_thresh': 17.88064071503044, 'bear_atr_min_pct': 0.008464084534977833, 'bear_atr_max_pct': 0.07631114568762053, 'bear_tp_mult': 1.111953967716366, 'bear_tsl_mult': 0.7362300230643941, 'bear_time_stop': 191, 'bear_use_sma': True, 'bear_use_ema': False, 'bear_use_atr': False, 'bear_use_adx': False, 'bear_use_spike': False, 'bear_rsi_required': True, 'sideways_strategy': 'breakout', 'sideways_bb_std_mult': 3.0519323414906365, 'sideways_rsi_os': 36, 'sideways_rsi_ob': 87, 'sideways_adx_thresh': 15.013804284861074, 'sideways_atr_min_pct': 0.000583170933359356, 'sideways_atr_max_pct': 0.14340603336448698, 'sideways_tp_mult': 1.6442446756442017, 'sideways_tsl_mult': 0.970236409510942, 'sideways_time_stop': 164, 'sideways_use_sma': False, 'sideways_use_ema': True, 'sideways_use_atr': True, 'sideways_use_adx': False, 'sideways_use_spike': False, 'sideways_rsi_required': False}.
[I 2025-08-30 19:38:24,493] Trial 607 finished with values: [-1000000000.0, 1000000000.0] and parameters: {'p_sma': 11, 'p_std': 29, 'p_atr': 28, 'p_adx': 23, 'rsi_period': 23, 'ema1': 27, 'ema2': 32, 'slip_atr_k': 0.05955203551733665, 'slip_spread_k': 0.6779310878648912, 'spread_hl_frac': 0.0343836448260467, 'bb_std_mult': 1.0666353465234106, 'rsi_os': 53, 'rsi_ob': 86, 'vol_spike': 0.21341582738256965, 'adx_thresh': 20.915539182585537, 'atr_min_pct': 0.0010741935510108457, 'atr_max_pct': 0.09344016925416135, 'tp_mult': 2.276605941397538, 'tsl_mult': 0.9614084910856776, 'strategy': 'breakout', 'time_stop': 15, 'use_sma': False, 'use_atr': True, 'use_adx': True, 'use_ema': True, 'use_spike': False, 'rsi_required': True, 'edge_k': 1.2733075958327253, 'edge_cap': 0.463488775211053, 'bull_strategy': 'mean_reversion', 'bull_bb_std_mult': 3.1892838350049844, 'bull_rsi_os': 32, 'bull_rsi_ob': 69, 'bull_adx_thresh': 18.958875792498343, 'bull_atr_min_pct': 0.0015260562098102645, 'bull_atr_max_pct': 0.01966032581617174, 'bull_tp_mult': 2.55600611624013, 'bull_tsl_mult': 0.4502424058094305, 'bull_time_stop': 235, 'bull_use_sma': True, 'bull_use_ema': True, 'bull_use_atr': True, 'bull_use_adx': True, 'bull_use_spike': False, 'bull_rsi_required': False, 'bear_strategy': 'breakout', 'bear_bb_std_mult': 3.030926977608738, 'bear_rsi_os': 20, 'bear_rsi_ob': 51, 'bear_adx_thresh': 21.10566997697782, 'bear_atr_min_pct': 0.0034276897837137634, 'bear_atr_max_pct': 0.09304753705608133, 'bear_tp_mult': 2.229047079521146, 'bear_tsl_mult': 0.7776992744462236, 'bear_time_stop': 191, 'bear_use_sma': True, 'bear_use_ema': False, 'bear_use_atr': False, 'bear_use_adx': True, 'bear_use_spike': False, 'bear_rsi_required': True, 'sideways_strategy': 'breakout', 'sideways_bb_std_mult': 3.0339165846807585, 'sideways_rsi_os': 36, 'sideways_rsi_ob': 72, 'sideways_adx_thresh': 14.126340287414983, 'sideways_atr_min_pct': 0.0026589169102363914, 'sideways_atr_max_pct': 0.14345345828377087, 'sideways_tp_mult': 1.1490380861332696, 'sideways_tsl_mult': 0.5046438578347693, 'sideways_time_stop': 160, 'sideways_use_sma': False, 'sideways_use_ema': True, 'sideways_use_atr': True, 'sideways_use_adx': False, 'sideways_use_spike': False, 'sideways_rsi_required': False}.
[I 2025-08-30 19:38:30,673] Trial 608 finished with values: [-0.052806932705120935, 0.05268227465876261] and parameters: {'p_sma': 20, 'p_std': 31, 'p_atr': 10, 'p_adx': 23, 'rsi_period': 22, 'ema1': 25, 'ema2': 13, 'slip_atr_k': 0.1962148716995631, 'slip_spread_k': 0.5841735426872221, 'spread_hl_frac': 0.02358434202862759, 'bb_std_mult': 2.147221538640852, 'rsi_os': 8, 'rsi_ob': 87, 'vol_spike': 0.26757838380481747, 'adx_thresh': 33.29903635638533, 'atr_min_pct': 0.02484354854717075, 'atr_max_pct': 0.09516439480456897, 'tp_mult': 2.226090049984765, 'tsl_mult': 0.23082137867609293, 'strategy': 'breakout', 'time_stop': 6, 'use_sma': False, 'use_atr': True, 'use_adx': True, 'use_ema': True, 'use_spike': False, 'rsi_required': True, 'edge_k': 0.10692156020727955, 'edge_cap': 0.8741495446588132, 'bull_strategy': 'mean_reversion', 'bull_bb_std_mult': 0.8436444534063405, 'bull_rsi_os': 30, 'bull_rsi_ob': 48, 'bull_adx_thresh': 19.09269844094872, 'bull_atr_min_pct': 0.001329337178143278, 'bull_atr_max_pct': 0.07490631899289805, 'bull_tp_mult': 2.6522662043960312, 'bull_tsl_mult': 0.5444052204374098, 'bull_time_stop': 231, 'bull_use_sma': False, 'bull_use_ema': True, 'bull_use_atr': False, 'bull_use_adx': True, 'bull_use_spike': False, 'bull_rsi_required': True, 'bear_strategy': 'breakout', 'bear_bb_std_mult': 3.0089401174899097, 'bear_rsi_os': 7, 'bear_rsi_ob': 76, 'bear_adx_thresh': 6.553268731873661, 'bear_atr_min_pct': 0.02058845867391782, 'bear_atr_max_pct': 0.09146684481747232, 'bear_tp_mult': 2.6468841767337667, 'bear_tsl_mult': 0.7885959150141298, 'bear_time_stop': 282, 'bear_use_sma': True, 'bear_use_ema': True, 'bear_use_atr': False, 'bear_use_adx': True, 'bear_use_spike': False, 'bear_rsi_required': False, 'sideways_strategy': 'breakout', 'sideways_bb_std_mult': 3.110816542143714, 'sideways_rsi_os': 37, 'sideways_rsi_ob': 83, 'sideways_adx_thresh': 14.105610808482563, 'sideways_atr_min_pct': 0.0018528662529273315, 'sideways_atr_max_pct': 0.10394661305109743, 'sideways_tp_mult': 2.9630379373944127, 'sideways_tsl_mult': 0.5047520651615864, 'sideways_time_stop': 137, 'sideways_use_sma': False, 'sideways_use_ema': True, 'sideways_use_atr': True, 'sideways_use_adx': False, 'sideways_use_spike': False, 'sideways_rsi_required': False}.
[I 2025-08-30 19:38:32,189] Trial 610 finished with values: [-1000000000.0, 1000000000.0] and parameters: {'p_sma': 56, 'p_std': 58, 'p_atr': 24, 'p_adx': 22, 'rsi_period': 23, 'ema1': 25, 'ema2': 29, 'slip_atr_k': 0.018855011445435194, 'slip_spread_k': 0.11012090292517795, 'spread_hl_frac': 0.023114436487208206, 'bb_std_mult': 2.967685298551855, 'rsi_os': 30, 'rsi_ob': 86, 'vol_spike': 0.17452719818337348, 'adx_thresh': 20.99182583301989, 'atr_min_pct': 0.0009821486378061572, 'atr_max_pct': 0.09172038713218274, 'tp_mult': 2.2123637987401668, 'tsl_mult': 0.2287604967261791, 'strategy': 'breakout', 'time_stop': 17, 'use_sma': False, 'use_atr': False, 'use_adx': True, 'use_ema': False, 'use_spike': False, 'rsi_required': True, 'edge_k': 0.1836342995829682, 'edge_cap': 0.07459630646753418, 'bull_strategy': 'mean_reversion', 'bull_bb_std_mult': 0.8341355529210046, 'bull_rsi_os': 30, 'bull_rsi_ob': 48, 'bull_adx_thresh': 16.958051261891367, 'bull_atr_min_pct': 0.002217018134673449, 'bull_atr_max_pct': 0.11703361145518958, 'bull_tp_mult': 2.6676410241744186, 'bull_tsl_mult': 0.45370810596930855, 'bull_time_stop': 189, 'bull_use_sma': False, 'bull_use_ema': True, 'bull_use_atr': False, 'bull_use_adx': False, 'bull_use_spike': True, 'bull_rsi_required': True, 'bear_strategy': 'breakout', 'bear_bb_std_mult': 2.9014128787977693, 'bear_rsi_os': 50, 'bear_rsi_ob': 75, 'bear_adx_thresh': 12.071376243307562, 'bear_atr_min_pct': 0.025175579690562767, 'bear_atr_max_pct': 0.09301945035944514, 'bear_tp_mult': 1.9400647861051454, 'bear_tsl_mult': 0.7882198000044616, 'bear_time_stop': 283, 'bear_use_sma': False, 'bear_use_ema': True, 'bear_use_atr': False, 'bear_use_adx': True, 'bear_use_spike': False, 'bear_rsi_required': False, 'sideways_strategy': 'breakout', 'sideways_bb_std_mult': 1.2886992648903013, 'sideways_rsi_os': 37, 'sideways_rsi_ob': 59, 'sideways_adx_thresh': 22.20324916162038, 'sideways_atr_min_pct': 0.005613998658523382, 'sideways_atr_max_pct': 0.13861478654697623, 'sideways_tp_mult': 1.06342771575614, 'sideways_tsl_mult': 0.9997849563632014, 'sideways_time_stop': 110, 'sideways_use_sma': False, 'sideways_use_ema': True, 'sideways_use_atr': True, 'sideways_use_adx': False, 'sideways_use_spike': False, 'sideways_rsi_required': True}.
[I 2025-08-30 19:38:32,497] Trial 609 finished with values: [-0.04284611053622922, 0.04270886458792231] and parameters: {'p_sma': 11, 'p_std': 13, 'p_atr': 28, 'p_adx': 22, 'rsi_period': 23, 'ema1': 25, 'ema2': 27, 'slip_atr_k': 0.19814603562823171, 'slip_spread_k': 0.14716257998445575, 'spread_hl_frac': 0.04473435503523206, 'bb_std_mult': 1.5181919620103852, 'rsi_os': 30, 'rsi_ob': 85, 'vol_spike': 0.2686320949294918, 'adx_thresh': 21.04368466665872, 'atr_min_pct': 0.024414934009629356, 'atr_max_pct': 0.09580614562025737, 'tp_mult': 1.9467078180856627, 'tsl_mult': 0.08229855675399578, 'strategy': 'breakout', 'time_stop': 282, 'use_sma': False, 'use_atr': False, 'use_adx': True, 'use_ema': True, 'use_spike': False, 'rsi_required': True, 'edge_k': 0.2824957958361603, 'edge_cap': 0.15727010828408994, 'bull_strategy': 'mean_reversion', 'bull_bb_std_mult': 3.1712243200145975, 'bull_rsi_os': 48, 'bull_rsi_ob': 59, 'bull_adx_thresh': 19.054589795614937, 'bull_atr_min_pct': 0.0013491029803740188, 'bull_atr_max_pct': 0.03526755187831354, 'bull_tp_mult': 2.5660366952434432, 'bull_tsl_mult': 0.551561527314368, 'bull_time_stop': 185, 'bull_use_sma': False, 'bull_use_ema': True, 'bull_use_atr': False, 'bull_use_adx': False, 'bull_use_spike': True, 'bull_rsi_required': True, 'bear_strategy': 'breakout', 'bear_bb_std_mult': 2.8757083781204713, 'bear_rsi_os': 48, 'bear_rsi_ob': 89, 'bear_adx_thresh': 17.951761654760105, 'bear_atr_min_pct': 0.0033942651376696036, 'bear_atr_max_pct': 0.026022247767062773, 'bear_tp_mult': 1.9347337592525313, 'bear_tsl_mult': 0.7786251978009295, 'bear_time_stop': 232, 'bear_use_sma': True, 'bear_use_ema': True, 'bear_use_atr': False, 'bear_use_adx': True, 'bear_use_spike': False, 'bear_rsi_required': False, 'sideways_strategy': 'breakout', 'sideways_bb_std_mult': 3.1083572544965046, 'sideways_rsi_os': 37, 'sideways_rsi_ob': 64, 'sideways_adx_thresh': 22.49771769925792, 'sideways_atr_min_pct': 0.001999521184208718, 'sideways_atr_max_pct': 0.1499104852295918, 'sideways_tp_mult': 1.0655733526568612, 'sideways_tsl_mult': 0.9381384561050224, 'sideways_time_stop': 158, 'sideways_use_sma': False, 'sideways_use_ema': True, 'sideways_use_atr': True, 'sideways_use_adx': False, 'sideways_use_spike': False, 'sideways_rsi_required': True}.
[I 2025-08-30 19:39:05,063] Trial 611 finished with values: [-0.06321284386578496, 0.06316626433890665] and parameters: {'p_sma': 47, 'p_std': 31, 'p_atr': 10, 'p_adx': 22, 'rsi_period': 23, 'ema1': 25, 'ema2': 29, 'slip_atr_k': 0.19477272907205104, 'slip_spread_k': 0.8000497702100007, 'spread_hl_frac': 0.023347073316368917, 'bb_std_mult': 2.1640692384228513, 'rsi_os': 20, 'rsi_ob': 83, 'vol_spike': 0.2667953973687388, 'adx_thresh': 33.10390068420318, 'atr_min_pct': 0.02443677229321664, 'atr_max_pct': 0.08956672601642826, 'tp_mult': 2.224401588612895, 'tsl_mult': 0.1302846345884141, 'strategy': 'breakout', 'time_stop': 188, 'use_sma': False, 'use_atr': False, 'use_adx': True, 'use_ema': False, 'use_spike': True, 'rsi_required': True, 'edge_k': 0.24438630368715838, 'edge_cap': 0.5032106417303124, 'bull_strategy': 'mean_reversion', 'bull_bb_std_mult': 3.371576105456996, 'bull_rsi_os': 17, 'bull_rsi_ob': 80, 'bull_adx_thresh': 16.896818498234325, 'bull_atr_min_pct': 0.01701214639629128, 'bull_atr_max_pct': 0.03706500016009436, 'bull_tp_mult': 2.6565434750693666, 'bull_tsl_mult': 0.5215596017450138, 'bull_time_stop': 161, 'bull_use_sma': False, 'bull_use_ema': False, 'bull_use_atr': False, 'bull_use_adx': False, 'bull_use_spike': True, 'bull_rsi_required': True, 'bear_strategy': 'breakout', 'bear_bb_std_mult': 2.877859404074641, 'bear_rsi_os': 50, 'bear_rsi_ob': 78, 'bear_adx_thresh': 18.063596224883632, 'bear_atr_min_pct': 0.015373413215277446, 'bear_atr_max_pct': 0.05761521784519333, 'bear_tp_mult': 2.6584881414079913, 'bear_tsl_mult': 0.783019173953813, 'bear_time_stop': 285, 'bear_use_sma': False, 'bear_use_ema': True, 'bear_use_atr': False, 'bear_use_adx': True, 'bear_use_spike': False, 'bear_rsi_required': False, 'sideways_strategy': 'breakout', 'sideways_bb_std_mult': 1.5838949110575788, 'sideways_rsi_os': 37, 'sideways_rsi_ob': 59, 'sideways_adx_thresh': 22.19049414152704, 'sideways_atr_min_pct': 0.0016699292363951822, 'sideways_atr_max_pct': 0.14978822205299144, 'sideways_tp_mult': 1.0669887598750731, 'sideways_tsl_mult': 0.23212810474658985, 'sideways_time_stop': 157, 'sideways_use_sma': False, 'sideways_use_ema': True, 'sideways_use_atr': False, 'sideways_use_adx': False, 'sideways_use_spike': False, 'sideways_rsi_required': True}.
