[I 2025-08-30 18:40:47,625] Trial 99 finished with values: [-1000000000.0, 1000000000.0] and parameters: {'p_sma': 9, 'p_std': 59, 'p_atr': 11, 'p_adx': 10, 'rsi_period': 72, 'ema1': 26, 'ema2': 33, 'slip_atr_k': 0.014708336288827353, 'slip_spread_k': 0.047436919076374096, 'spread_hl_frac': 0.02406323480431059, 'bb_std_mult': 2.1317003587791445, 'rsi_os': 23, 'rsi_ob': 92, 'vol_spike': 0.23141856079889164, 'adx_thresh': 31.499487372859555, 'atr_min_pct': 0.019175133723550897, 'atr_max_pct': 0.08934287301404976, 'tp_mult': 2.9911489931891397, 'tsl_mult': 0.2161164919742164, 'strategy': 'mean_reversion', 'time_stop': 194, 'use_sma': False, 'use_atr': True, 'use_adx': True, 'use_ema': False, 'use_spike': True, 'rsi_required': True, 'edge_k': 0.1631943294753142, 'edge_cap': 0.5200182740178568, 'bull_strategy': 'mean_reversion', 'bull_bb_std_mult': 3.146691945694631, 'bull_rsi_os': 39, 'bull_rsi_ob': 45, 'bull_adx_thresh': 16.834707158720033, 'bull_atr_min_pct': 0.0024377274258479725, 'bull_atr_max_pct': 0.10559725291496246, 'bull_tp_mult': 2.7080444334692193, 'bull_tsl_mult': 0.3432977391091302, 'bull_time_stop': 139, 'bull_use_sma': False, 'bull_use_ema': True, 'bull_use_atr': True, 'bull_use_adx': False, 'bull_use_spike': False, 'bull_rsi_required': True, 'bear_strategy': 'breakout', 'bear_bb_std_mult': 3.0622576825207135, 'bear_rsi_os': 50, 'bear_rsi_ob': 74, 'bear_adx_thresh': 16.484700029123516, 'bear_atr_min_pct': 0.013120279969981996, 'bear_atr_max_pct': 0.0236245297330632, 'bear_tp_mult': 2.413870464722614, 'bear_tsl_mult': 0.8049258595907216, 'bear_time_stop': 85, 'bear_use_sma': True, 'bear_use_ema': True, 'bear_use_atr': False, 'bear_use_adx': False, 'bear_use_spike': False, 'bear_rsi_required': True, 'sideways_strategy': 'breakout', 'sideways_bb_std_mult': 2.9334580661489045, 'sideways_rsi_os': 33, 'sideways_rsi_ob': 61, 'sideways_adx_thresh': 22.852648140549924, 'sideways_atr_min_pct': 0.0043203696607380365, 'sideways_atr_max_pct': 0.10521717506082254, 'sideways_tp_mult': 1.1240946435649415, 'sideways_tsl_mult': 0.3143943392744607, 'sideways_time_stop': 106, 'sideways_use_sma': False, 'sideways_use_ema': False, 'sideways_use_atr': True, 'sideways_use_adx': True, 'sideways_use_spike': False, 'sideways_rsi_required': True}.
[I 2025-08-30 18:40:48,159] Trial 98 finished with values: [-1000000000.0, 1000000000.0] and parameters: {'p_sma': 5, 'p_std': 36, 'p_atr': 10, 'p_adx': 19, 'rsi_period': 21, 'ema1': 26, 'ema2': 60, 'slip_atr_k': 0.06404064884238053, 'slip_spread_k': 0.05493144010632811, 'spread_hl_frac': 0.024184800357219188, 'bb_std_mult': 1.9329243552084616, 'rsi_os': 47, 'rsi_ob': 87, 'vol_spike': 0.19561767897740945, 'adx_thresh': 31.519690194110733, 'atr_min_pct': 0.022956906975744457, 'atr_max_pct': 0.0999508879084112, 'tp_mult': 2.1390718888477194, 'tsl_mult': 0.974005257778801, 'strategy': 'mean_reversion', 'time_stop': 194, 'use_sma': False, 'use_atr': True, 'use_adx': True, 'use_ema': False, 'use_spike': True, 'rsi_required': True, 'edge_k': 0.14076284086576532, 'edge_cap': 0.5637830228428159, 'bull_strategy': 'mean_reversion', 'bull_bb_std_mult': 3.1852613197126933, 'bull_rsi_os': 55, 'bull_rsi_ob': 45, 'bull_adx_thresh': 22.98847138731518, 'bull_atr_min_pct': 0.0028865952822677912, 'bull_atr_max_pct': 0.11275269234628466, 'bull_tp_mult': 2.724231719709207, 'bull_tsl_mult': 0.31463439587914416, 'bull_time_stop': 156, 'bull_use_sma': False, 'bull_use_ema': True, 'bull_use_atr': True, 'bull_use_adx': False, 'bull_use_spike': False, 'bull_rsi_required': True, 'bear_strategy': 'breakout', 'bear_bb_std_mult': 2.6943577101468126, 'bear_rsi_os': 48, 'bear_rsi_ob': 79, 'bear_adx_thresh': 18.87724510753627, 'bear_atr_min_pct': 0.01795664092124986, 'bear_atr_max_pct': 0.036403368294456694, 'bear_tp_mult': 1.1252743806905117, 'bear_tsl_mult': 0.7943516155089615, 'bear_time_stop': 22, 'bear_use_sma': True, 'bear_use_ema': True, 'bear_use_atr': False, 'bear_use_adx': False, 'bear_use_spike': False, 'bear_rsi_required': True, 'sideways_strategy': 'breakout', 'sideways_bb_std_mult': 2.948756224639186, 'sideways_rsi_os': 55, 'sideways_rsi_ob': 61, 'sideways_adx_thresh': 22.87068892365139, 'sideways_atr_min_pct': 0.004312254742358374, 'sideways_atr_max_pct': 0.09085954422084423, 'sideways_tp_mult': 1.0117200743811705, 'sideways_tsl_mult': 0.29697284896994885, 'sideways_time_stop': 107, 'sideways_use_sma': False, 'sideways_use_ema': True, 'sideways_use_atr': True, 'sideways_use_adx': True, 'sideways_use_spike': False, 'sideways_rsi_required': True}.
[I 2025-08-30 18:41:20,968] Trial 102 finished with values: [-1000000000.0, 1000000000.0] and parameters: {'p_sma': 7, 'p_std': 37, 'p_atr': 7, 'p_adx': 11, 'rsi_period': 18, 'ema1': 25, 'ema2': 40, 'slip_atr_k': 0.07976235807498203, 'slip_spread_k': 0.24653951307161454, 'spread_hl_frac': 0.047732287304409766, 'bb_std_mult': 2.0073800994842945, 'rsi_os': 7, 'rsi_ob': 90, 'vol_spike': 0.15405078442386239, 'adx_thresh': 34.81200540588036, 'atr_min_pct': 0.023174083954388275, 'atr_max_pct': 0.11118433918621418, 'tp_mult': 2.0198628071036824, 'tsl_mult': 0.8444097525754012, 'strategy': 'mean_reversion', 'time_stop': 151, 'use_sma': False, 'use_atr': True, 'use_adx': True, 'use_ema': False, 'use_spike': True, 'rsi_required': False, 'edge_k': 0.11695203070387382, 'edge_cap': 0.46566001429352644, 'bull_strategy': 'mean_reversion', 'bull_bb_std_mult': 3.0670994407060603, 'bull_rsi_os': 36, 'bull_rsi_ob': 49, 'bull_adx_thresh': 30.05023834843374, 'bull_atr_min_pct': 0.004637193791444018, 'bull_atr_max_pct': 0.1216466338303205, 'bull_tp_mult': 2.7337524901016588, 'bull_tsl_mult': 0.6475728325019903, 'bull_time_stop': 167, 'bull_use_sma': True, 'bull_use_ema': True, 'bull_use_atr': True, 'bull_use_adx': False, 'bull_use_spike': False, 'bull_rsi_required': True, 'bear_strategy': 'breakout', 'bear_bb_std_mult': 2.688877002045041, 'bear_rsi_os': 48, 'bear_rsi_ob': 73, 'bear_adx_thresh': 6.671938452717644, 'bear_atr_min_pct': 0.020869990038399833, 'bear_atr_max_pct': 0.06889723980503526, 'bear_tp_mult': 2.797110927645156, 'bear_tsl_mult': 0.9207480792490992, 'bear_time_stop': 244, 'bear_use_sma': True, 'bear_use_ema': False, 'bear_use_atr': False, 'bear_use_adx': False, 'bear_use_spike': False, 'bear_rsi_required': True, 'sideways_strategy': 'breakout', 'sideways_bb_std_mult': 3.2073961550261574, 'sideways_rsi_os': 40, 'sideways_rsi_ob': 57, 'sideways_adx_thresh': 25.704763459343454, 'sideways_atr_min_pct': 0.0031954067896082343, 'sideways_atr_max_pct': 0.13360426535943015, 'sideways_tp_mult': 1.7967885713946172, 'sideways_tsl_mult': 0.9435774961299926, 'sideways_time_stop': 181, 'sideways_use_sma': False, 'sideways_use_ema': True, 'sideways_use_atr': True, 'sideways_use_adx': False, 'sideways_use_spike': False, 'sideways_rsi_required': True}.
[I 2025-08-30 18:41:21,532] Trial 103 finished with values: [-1000000000.0, 1000000000.0] and parameters: {'p_sma': 7, 'p_std': 38, 'p_atr': 7, 'p_adx': 9, 'rsi_period': 24, 'ema1': 25, 'ema2': 40, 'slip_atr_k': 0.08213306602330206, 'slip_spread_k': 0.23399262162793977, 'spread_hl_frac': 0.012100241105484586, 'bb_std_mult': 2.287554794637674, 'rsi_os': 30, 'rsi_ob': 90, 'vol_spike': 0.23246920753665923, 'adx_thresh': 32.37947832745464, 'atr_min_pct': 0.017227871772088156, 'atr_max_pct': 0.11318577436881272, 'tp_mult': 2.031272151626196, 'tsl_mult': 0.7800632484333611, 'strategy': 'mean_reversion', 'time_stop': 155, 'use_sma': False, 'use_atr': True, 'use_adx': True, 'use_ema': False, 'use_spike': True, 'rsi_required': False, 'edge_k': 1.744187977453846, 'edge_cap': 0.4275000444290775, 'bull_strategy': 'mean_reversion', 'bull_bb_std_mult': 3.322319780236162, 'bull_rsi_os': 35, 'bull_rsi_ob': 49, 'bull_adx_thresh': 29.912101836994175, 'bull_atr_min_pct': 0.004460373610346376, 'bull_atr_max_pct': 0.10506054119679635, 'bull_tp_mult': 2.7324534800137448, 'bull_tsl_mult': 0.23968022825709584, 'bull_time_stop': 192, 'bull_use_sma': True, 'bull_use_ema': True, 'bull_use_atr': True, 'bull_use_adx': False, 'bull_use_spike': False, 'bull_rsi_required': True, 'bear_strategy': 'breakout', 'bear_bb_std_mult': 2.153534942932005, 'bear_rsi_os': 47, 'bear_rsi_ob': 79, 'bear_adx_thresh': 6.964392445969034, 'bear_atr_min_pct': 0.017672784522547946, 'bear_atr_max_pct': 0.04683864920924648, 'bear_tp_mult': 1.9642162179732054, 'bear_tsl_mult': 0.9187810024046066, 'bear_time_stop': 253, 'bear_use_sma': True, 'bear_use_ema': False, 'bear_use_atr': False, 'bear_use_adx': False, 'bear_use_spike': False, 'bear_rsi_required': True, 'sideways_strategy': 'breakout', 'sideways_bb_std_mult': 1.941938378084967, 'sideways_rsi_os': 41, 'sideways_rsi_ob': 57, 'sideways_adx_thresh': 25.600162578322625, 'sideways_atr_min_pct': 0.0030062666233719964, 'sideways_atr_max_pct': 0.09490405913970588, 'sideways_tp_mult': 2.444795777188742, 'sideways_tsl_mult': 0.9443279856474333, 'sideways_time_stop': 157, 'sideways_use_sma': False, 'sideways_use_ema': True, 'sideways_use_atr': True, 'sideways_use_adx': False, 'sideways_use_spike': False, 'sideways_rsi_required': True}.
[I 2025-08-30 18:41:21,756] Trial 101 finished with values: [-0.016819452718877304, 0.01675362750509171] and parameters: {'p_sma': 33, 'p_std': 38, 'p_atr': 11, 'p_adx': 11, 'rsi_period': 18, 'ema1': 25, 'ema2': 40, 'slip_atr_k': 0.05511100361744756, 'slip_spread_k': 0.39092960267658416, 'spread_hl_frac': 0.016462728487060818, 'bb_std_mult': 1.9796814769052042, 'rsi_os': 12, 'rsi_ob': 95, 'vol_spike': 0.23172505361079535, 'adx_thresh': 28.684234168185423, 'atr_min_pct': 0.024466785360927692, 'atr_max_pct': 0.10906318346619205, 'tp_mult': 2.707771754415478, 'tsl_mult': 0.8405205752000161, 'strategy': 'mean_reversion', 'time_stop': 150, 'use_sma': False, 'use_atr': True, 'use_adx': True, 'use_ema': False, 'use_spike': True, 'rsi_required': False, 'edge_k': 1.7265190296594528, 'edge_cap': 0.43096438588070174, 'bull_strategy': 'mean_reversion', 'bull_bb_std_mult': 2.9839938221696336, 'bull_rsi_os': 50, 'bull_rsi_ob': 49, 'bull_adx_thresh': 21.722098361210136, 'bull_atr_min_pct': 0.00521980360608227, 'bull_atr_max_pct': 0.12137660636646445, 'bull_tp_mult': 2.732187211620209, 'bull_tsl_mult': 0.48941994061430444, 'bull_time_stop': 169, 'bull_use_sma': True, 'bull_use_ema': True, 'bull_use_atr': True, 'bull_use_adx': False, 'bull_use_spike': False, 'bull_rsi_required': True, 'bear_strategy': 'breakout', 'bear_bb_std_mult': 0.8859766869021264, 'bear_rsi_os': 47, 'bear_rsi_ob': 80, 'bear_adx_thresh': 18.63608019151762, 'bear_atr_min_pct': 0.01804068949507492, 'bear_atr_max_pct': 0.04720297228982473, 'bear_tp_mult': 1.9528398287281743, 'bear_tsl_mult': 0.5225604348894447, 'bear_time_stop': 256, 'bear_use_sma': True, 'bear_use_ema': False, 'bear_use_atr': False, 'bear_use_adx': False, 'bear_use_spike': False, 'bear_rsi_required': True, 'sideways_strategy': 'breakout', 'sideways_bb_std_mult': 1.9604630919494588, 'sideways_rsi_os': 54, 'sideways_rsi_ob': 58, 'sideways_adx_thresh': 15.795780193284463, 'sideways_atr_min_pct': 0.003265448413516293, 'sideways_atr_max_pct': 0.13436994869192412, 'sideways_tp_mult': 2.371521497660208, 'sideways_tsl_mult': 0.8779798378850768, 'sideways_time_stop': 184, 'sideways_use_sma': False, 'sideways_use_ema': True, 'sideways_use_atr': True, 'sideways_use_adx': False, 'sideways_use_spike': False, 'sideways_rsi_required': True}.
[I 2025-08-30 18:41:21,847] Trial 104 finished with values: [-1000000000.0, 1000000000.0] and parameters: {'p_sma': 45, 'p_std': 33, 'p_atr': 7, 'p_adx': 11, 'rsi_period': 24, 'ema1': 29, 'ema2': 31, 'slip_atr_k': 0.08185847914563277, 'slip_spread_k': 0.17946886907744447, 'spread_hl_frac': 0.026803190551795947, 'bb_std_mult': 2.008156875398122, 'rsi_os': 14, 'rsi_ob': 76, 'vol_spike': 0.292045593735351, 'adx_thresh': 33.090360517865484, 'atr_min_pct': 0.016585040856459225, 'atr_max_pct': 0.10989009007386036, 'tp_mult': 2.407267978357103, 'tsl_mult': 0.7783583964691597, 'strategy': 'mean_reversion', 'time_stop': 152, 'use_sma': False, 'use_atr': True, 'use_adx': True, 'use_ema': False, 'use_spike': True, 'rsi_required': False, 'edge_k': 1.1675663152156224, 'edge_cap': 0.47140471336549505, 'bull_strategy': 'mean_reversion', 'bull_bb_std_mult': 3.2984560296534036, 'bull_rsi_os': 32, 'bull_rsi_ob': 49, 'bull_adx_thresh': 16.58937012325627, 'bull_atr_min_pct': 0.004435135776137243, 'bull_atr_max_pct': 0.12128669656315248, 'bull_tp_mult': 2.5644401671163335, 'bull_tsl_mult': 0.23009161444898402, 'bull_time_stop': 168, 'bull_use_sma': True, 'bull_use_ema': True, 'bull_use_atr': True, 'bull_use_adx': False, 'bull_use_spike': False, 'bull_rsi_required': True, 'bear_strategy': 'mean_reversion', 'bear_bb_std_mult': 2.474372139527452, 'bear_rsi_os': 49, 'bear_rsi_ob': 83, 'bear_adx_thresh': 17.718918376922698, 'bear_atr_min_pct': 0.021118710115176367, 'bear_atr_max_pct': 0.04625368396717555, 'bear_tp_mult': 2.609634694104653, 'bear_tsl_mult': 0.38453356949886763, 'bear_time_stop': 285, 'bear_use_sma': False, 'bear_use_ema': False, 'bear_use_atr': False, 'bear_use_adx': False, 'bear_use_spike': False, 'bear_rsi_required': True, 'sideways_strategy': 'breakout', 'sideways_bb_std_mult': 3.16553194338026, 'sideways_rsi_os': 30, 'sideways_rsi_ob': 59, 'sideways_adx_thresh': 13.859640508982558, 'sideways_atr_min_pct': 0.021742057734132424, 'sideways_atr_max_pct': 0.13433613248372062, 'sideways_tp_mult': 2.4899694976347795, 'sideways_tsl_mult': 0.9371343786589337, 'sideways_time_stop': 176, 'sideways_use_sma': False, 'sideways_use_ema': True, 'sideways_use_atr': True, 'sideways_use_adx': False, 'sideways_use_spike': False, 'sideways_rsi_required': True}.
[I 2025-08-30 18:41:22,340] Trial 105 finished with values: [-1000000000.0, 1000000000.0] and parameters: {'p_sma': 32, 'p_std': 24, 'p_atr': 9, 'p_adx': 27, 'rsi_period': 24, 'ema1': 29, 'ema2': 31, 'slip_atr_k': 0.051442425251264426, 'slip_spread_k': 0.17722319512349108, 'spread_hl_frac': 0.01571859563343627, 'bb_std_mult': 2.3071356583573253, 'rsi_os': 44, 'rsi_ob': 76, 'vol_spike': 0.22531819534721093, 'adx_thresh': 28.81563427340958, 'atr_min_pct': 0.015862538498587486, 'atr_max_pct': 0.014838779415775522, 'tp_mult': 2.388809692237443, 'tsl_mult': 0.8062345336864317, 'strategy': 'mean_reversion', 'time_stop': 204, 'use_sma': False, 'use_atr': True, 'use_adx': True, 'use_ema': False, 'use_spike': True, 'rsi_required': False, 'edge_k': 1.0485132914925965, 'edge_cap': 0.4310112327512492, 'bull_strategy': 'mean_reversion', 'bull_bb_std_mult': 3.3141764869596284, 'bull_rsi_os': 31, 'bull_rsi_ob': 73, 'bull_adx_thresh': 21.875905268097906, 'bull_atr_min_pct': 0.01149769580100601, 'bull_atr_max_pct': 0.12211383116554385, 'bull_tp_mult': 1.8047673990983042, 'bull_tsl_mult': 0.24565455508768486, 'bull_time_stop': 128, 'bull_use_sma': False, 'bull_use_ema': True, 'bull_use_atr': False, 'bull_use_adx': False, 'bull_use_spike': True, 'bull_rsi_required': True, 'bear_strategy': 'mean_reversion', 'bear_bb_std_mult': 0.8767775691584334, 'bear_rsi_os': 49, 'bear_rsi_ob': 83, 'bear_adx_thresh': 5.33151113883477, 'bear_atr_min_pct': 0.016576548576154156, 'bear_atr_max_pct': 0.046928710778130045, 'bear_tp_mult': 2.1316742092432257, 'bear_tsl_mult': 0.7551356965693974, 'bear_time_stop': 257, 'bear_use_sma': False, 'bear_use_ema': False, 'bear_use_atr': False, 'bear_use_adx': False, 'bear_use_spike': False, 'bear_rsi_required': True, 'sideways_strategy': 'breakout', 'sideways_bb_std_mult': 1.8182432038230132, 'sideways_rsi_os': 29, 'sideways_rsi_ob': 52, 'sideways_adx_thresh': 14.14938245857476, 'sideways_atr_min_pct': 0.002298185096042109, 'sideways_atr_max_pct': 0.14242459300342714, 'sideways_tp_mult': 2.387673656854952, 'sideways_tsl_mult': 0.9988929006519167, 'sideways_time_stop': 170, 'sideways_use_sma': False, 'sideways_use_ema': True, 'sideways_use_atr': True, 'sideways_use_adx': False, 'sideways_use_spike': False, 'sideways_rsi_required': True}.
[I 2025-08-30 18:41:22,407] Trial 108 finished with values: [-1000000000.0, 1000000000.0] and parameters: {'p_sma': 35, 'p_std': 28, 'p_atr': 9, 'p_adx': 20, 'rsi_period': 20, 'ema1': 11, 'ema2': 52, 'slip_atr_k': 0.05305975990307005, 'slip_spread_k': 0.3951329393941657, 'spread_hl_frac': 0.01635095317873698, 'bb_std_mult': 2.711738341098983, 'rsi_os': 54, 'rsi_ob': 69, 'vol_spike': 0.25786607794134864, 'adx_thresh': 29.627221094723794, 'atr_min_pct': 0.02450337837341194, 'atr_max_pct': 0.0889662728858067, 'tp_mult': 2.887495324829696, 'tsl_mult': 0.9529169323976716, 'strategy': 'mean_reversion', 'time_stop': 202, 'use_sma': False, 'use_atr': False, 'use_adx': False, 'use_ema': False, 'use_spike': True, 'rsi_required': False, 'edge_k': 1.2294524225614882, 'edge_cap': 0.498964232145191, 'bull_strategy': 'mean_reversion', 'bull_bb_std_mult': 3.470728062668703, 'bull_rsi_os': 49, 'bull_rsi_ob': 47, 'bull_adx_thresh': 21.904878375807492, 'bull_atr_min_pct': 0.0002329953888393387, 'bull_atr_max_pct': 0.021306552549804486, 'bull_tp_mult': 2.6773721148216008, 'bull_tsl_mult': 0.44488240893439235, 'bull_time_stop': 147, 'bull_use_sma': False, 'bull_use_ema': True, 'bull_use_atr': False, 'bull_use_adx': True, 'bull_use_spike': True, 'bull_rsi_required': False, 'bear_strategy': 'breakout', 'bear_bb_std_mult': 2.5394754175907464, 'bear_rsi_os': 54, 'bear_rsi_ob': 46, 'bear_adx_thresh': 18.76497469796918, 'bear_atr_min_pct': 0.01939222489372886, 'bear_atr_max_pct': 0.038199190549928624, 'bear_tp_mult': 2.1322045698225707, 'bear_tsl_mult': 0.7523656808520629, 'bear_time_stop': 199, 'bear_use_sma': True, 'bear_use_ema': True, 'bear_use_atr': False, 'bear_use_adx': False, 'bear_use_spike': True, 'bear_rsi_required': True, 'sideways_strategy': 'mean_reversion', 'sideways_bb_std_mult': 3.072775308135107, 'sideways_rsi_os': 38, 'sideways_rsi_ob': 48, 'sideways_adx_thresh': 15.704230050727979, 'sideways_atr_min_pct': 0.0023104150434805804, 'sideways_atr_max_pct': 0.06025718275153538, 'sideways_tp_mult': 2.302092163241976, 'sideways_tsl_mult': 0.8795937761558864, 'sideways_time_stop': 170, 'sideways_use_sma': False, 'sideways_use_ema': False, 'sideways_use_atr': False, 'sideways_use_adx': False, 'sideways_use_spike': False, 'sideways_rsi_required': True}.
[I 2025-08-30 18:41:22,909] Trial 109 finished with values: [-1000000000.0, 1000000000.0] and parameters: {'p_sma': 18, 'p_std': 16, 'p_atr': 9, 'p_adx': 21, 'rsi_period': 57, 'ema1': 11, 'ema2': 52, 'slip_atr_k': 0.07015369886947484, 'slip_spread_k': 0.3809121138254251, 'spread_hl_frac': 0.01916139522823832, 'bb_std_mult': 2.39667382641103, 'rsi_os': 52, 'rsi_ob': 69, 'vol_spike': 0.25518306256232576, 'adx_thresh': 30.51414468463743, 'atr_min_pct': 0.02598279918216344, 'atr_max_pct': 0.08801472795029747, 'tp_mult': 1.5056640292350405, 'tsl_mult': 0.8819391535486251, 'strategy': 'mean_reversion', 'time_stop': 30, 'use_sma': False, 'use_atr': False, 'use_adx': False, 'use_ema': False, 'use_spike': False, 'rsi_required': False, 'edge_k': 1.2957920586180387, 'edge_cap': 0.5024630028006238, 'bull_strategy': 'mean_reversion', 'bull_bb_std_mult': 3.051952356203315, 'bull_rsi_os': 51, 'bull_rsi_ob': 47, 'bull_adx_thresh': 15.479663982525945, 'bull_atr_min_pct': 0.00552087741310763, 'bull_atr_max_pct': 0.12807311119001571, 'bull_tp_mult': 2.8857493559642076, 'bull_tsl_mult': 0.4476117471803299, 'bull_time_stop': 146, 'bull_use_sma': False, 'bull_use_ema': True, 'bull_use_atr': False, 'bull_use_adx': True, 'bull_use_spike': True, 'bull_rsi_required': False, 'bear_strategy': 'breakout', 'bear_bb_std_mult': 3.0672469639249815, 'bear_rsi_os': 54, 'bear_rsi_ob': 76, 'bear_adx_thresh': 18.351142615746088, 'bear_atr_min_pct': 0.014302974404540963, 'bear_atr_max_pct': 0.07884807336807045, 'bear_tp_mult': 2.5887927055591655, 'bear_tsl_mult': 0.9846939866357021, 'bear_time_stop': 200, 'bear_use_sma': True, 'bear_use_ema': True, 'bear_use_atr': False, 'bear_use_adx': False, 'bear_use_spike': True, 'bear_rsi_required': True, 'sideways_strategy': 'mean_reversion', 'sideways_bb_std_mult': 3.0835619815278936, 'sideways_rsi_os': 47, 'sideways_rsi_ob': 49, 'sideways_adx_thresh': 24.749943482619173, 'sideways_atr_min_pct': 0.001585985330019601, 'sideways_atr_max_pct': 0.14682798003173153, 'sideways_tp_mult': 1.2923042825108757, 'sideways_tsl_mult': 0.5395276339200081, 'sideways_time_stop': 151, 'sideways_use_sma': True, 'sideways_use_ema': False, 'sideways_use_atr': False, 'sideways_use_adx': False, 'sideways_use_spike': False, 'sideways_rsi_required': True}.
