[I 2025-08-30 18:47:30,122] Trial 162 finished with values: [-0.06642896227337025, 0.06640608426058234] and parameters: {'p_sma': 45, 'p_std': 34, 'p_atr': 30, 'p_adx': 22, 'rsi_period': 20, 'ema1': 26, 'ema2': 31, 'slip_atr_k': 0.13703539774485266, 'slip_spread_k': 0.14361193624253282, 'spread_hl_frac': 0.02012882087125851, 'bb_std_mult': 2.4327780457559496, 'rsi_os': 22, 'rsi_ob': 77, 'vol_spike': 0.2662262707899903, 'adx_thresh': 17.878172976964702, 'atr_min_pct': 0.00821725129191286, 'atr_max_pct': 0.05305487079229787, 'tp_mult': 1.3612216138524171, 'tsl_mult': 0.3453896860858423, 'strategy': 'breakout', 'time_stop': 31, 'use_sma': True, 'use_atr': True, 'use_adx': True, 'use_ema': True, 'use_spike': True, 'rsi_required': False, 'edge_k': 0.616051866229951, 'edge_cap': 0.963817969779434, 'bull_strategy': 'mean_reversion', 'bull_bb_std_mult': 0.6393021615562187, 'bull_rsi_os': 31, 'bull_rsi_ob': 72, 'bull_adx_thresh': 14.749704323336767, 'bull_atr_min_pct': 0.02276787783173347, 'bull_atr_max_pct': 0.08272199437450642, 'bull_tp_mult': 2.6749421955365964, 'bull_tsl_mult': 0.5381955195026964, 'bull_time_stop': 29, 'bull_use_sma': False, 'bull_use_ema': False, 'bull_use_atr': True, 'bull_use_adx': False, 'bull_use_spike': False, 'bull_rsi_required': True, 'bear_strategy': 'breakout', 'bear_bb_std_mult': 2.025786693886365, 'bear_rsi_os': 51, 'bear_rsi_ob': 85, 'bear_adx_thresh': 16.988757755829806, 'bear_atr_min_pct': 0.015676257645961828, 'bear_atr_max_pct': 0.03342480429115189, 'bear_tp_mult': 2.9520279132393368, 'bear_tsl_mult': 0.9996558180742223, 'bear_time_stop': 219, 'bear_use_sma': True, 'bear_use_ema': True, 'bear_use_atr': False, 'bear_use_adx': True, 'bear_use_spike': False, 'bear_rsi_required': False, 'sideways_strategy': 'breakout', 'sideways_bb_std_mult': 2.2588617003566966, 'sideways_rsi_os': 33, 'sideways_rsi_ob': 58, 'sideways_adx_thresh': 17.005237561374518, 'sideways_atr_min_pct': 0.0010043851257544418, 'sideways_atr_max_pct': 0.1439684130969474, 'sideways_tp_mult': 2.253275208741444, 'sideways_tsl_mult': 0.8927005943206922, 'sideways_time_stop': 36, 'sideways_use_sma': False, 'sideways_use_ema': False, 'sideways_use_atr': False, 'sideways_use_adx': True, 'sideways_use_spike': True, 'sideways_rsi_required': False}.
[I 2025-08-30 18:47:30,300] Trial 163 finished with values: [-1000000000.0, 1000000000.0] and parameters: {'p_sma': 7, 'p_std': 60, 'p_atr': 10, 'p_adx': 19, 'rsi_period': 50, 'ema1': 26, 'ema2': 31, 'slip_atr_k': 0.05226433769770229, 'slip_spread_k': 0.14358239001823853, 'spread_hl_frac': 0.02345384438155637, 'bb_std_mult': 2.421271542792005, 'rsi_os': 49, 'rsi_ob': 85, 'vol_spike': 0.12358323498263533, 'adx_thresh': 17.071397552120647, 'atr_min_pct': 0.023715827747496993, 'atr_max_pct': 0.06794241428356607, 'tp_mult': 2.3456418914184027, 'tsl_mult': 0.8156351389810933, 'strategy': 'mean_reversion', 'time_stop': 205, 'use_sma': True, 'use_atr': True, 'use_adx': True, 'use_ema': False, 'use_spike': True, 'rsi_required': False, 'edge_k': 0.6005571904105995, 'edge_cap': 0.684410067816688, 'bull_strategy': 'mean_reversion', 'bull_bb_std_mult': 0.9331314437543696, 'bull_rsi_os': 32, 'bull_rsi_ob': 49, 'bull_adx_thresh': 31.576353098840595, 'bull_atr_min_pct': 0.00360732325322692, 'bull_atr_max_pct': 0.077315500879696, 'bull_tp_mult': 1.3827685763646667, 'bull_tsl_mult': 0.5369052049135692, 'bull_time_stop': 189, 'bull_use_sma': False, 'bull_use_ema': True, 'bull_use_atr': True, 'bull_use_adx': False, 'bull_use_spike': False, 'bull_rsi_required': True, 'bear_strategy': 'breakout', 'bear_bb_std_mult': 1.1190797010600635, 'bear_rsi_os': 52, 'bear_rsi_ob': 85, 'bear_adx_thresh': 16.933571882422772, 'bear_atr_min_pct': 0.005846805332075896, 'bear_atr_max_pct': 0.015082157867535875, 'bear_tp_mult': 2.608137229034701, 'bear_tsl_mult': 0.7643727261601789, 'bear_time_stop': 220, 'bear_use_sma': True, 'bear_use_ema': True, 'bear_use_atr': False, 'bear_use_adx': False, 'bear_use_spike': False, 'bear_rsi_required': False, 'sideways_strategy': 'breakout', 'sideways_bb_std_mult': 0.5815884787205148, 'sideways_rsi_os': 34, 'sideways_rsi_ob': 58, 'sideways_adx_thresh': 8.61842164125615, 'sideways_atr_min_pct': 0.0032177518377015323, 'sideways_atr_max_pct': 0.07886118441621895, 'sideways_tp_mult': 2.8544738010932824, 'sideways_tsl_mult': 0.6337583406363854, 'sideways_time_stop': 26, 'sideways_use_sma': False, 'sideways_use_ema': False, 'sideways_use_atr': True, 'sideways_use_adx': True, 'sideways_use_spike': True, 'sideways_rsi_required': False}.
[I 2025-08-30 18:48:03,885] Trial 165 finished with values: [-1000000000.0, 1000000000.0] and parameters: {'p_sma': 33, 'p_std': 34, 'p_atr': 10, 'p_adx': 21, 'rsi_period': 39, 'ema1': 26, 'ema2': 31, 'slip_atr_k': 0.06974508245127174, 'slip_spread_k': 0.16542591312860006, 'spread_hl_frac': 0.023340654478269714, 'bb_std_mult': 2.857277728871886, 'rsi_os': 49, 'rsi_ob': 82, 'vol_spike': 0.26134050369246353, 'adx_thresh': 32.94429603339503, 'atr_min_pct': 0.023379551548333547, 'atr_max_pct': 0.06670896670292488, 'tp_mult': 2.274525112108034, 'tsl_mult': 0.5797810039217813, 'strategy': 'mean_reversion', 'time_stop': 205, 'use_sma': True, 'use_atr': True, 'use_adx': True, 'use_ema': False, 'use_spike': True, 'rsi_required': False, 'edge_k': 0.19669661482821754, 'edge_cap': 0.47217945956526997, 'bull_strategy': 'mean_reversion', 'bull_bb_std_mult': 1.9610928039824107, 'bull_rsi_os': 13, 'bull_rsi_ob': 71, 'bull_adx_thresh': 29.28737204504423, 'bull_atr_min_pct': 0.022891551179647696, 'bull_atr_max_pct': 0.10852216043928592, 'bull_tp_mult': 1.4722423468452341, 'bull_tsl_mult': 0.5077755799108138, 'bull_time_stop': 187, 'bull_use_sma': False, 'bull_use_ema': True, 'bull_use_atr': True, 'bull_use_adx': False, 'bull_use_spike': False, 'bull_rsi_required': True, 'bear_strategy': 'breakout', 'bear_bb_std_mult': 3.55159738574221, 'bear_rsi_os': 53, 'bear_rsi_ob': 85, 'bear_adx_thresh': 17.156700913435635, 'bear_atr_min_pct': 0.02266914282546145, 'bear_atr_max_pct': 0.08970551846989683, 'bear_tp_mult': 1.2503510106304498, 'bear_tsl_mult': 0.7607899998276749, 'bear_time_stop': 196, 'bear_use_sma': True, 'bear_use_ema': True, 'bear_use_atr': False, 'bear_use_adx': False, 'bear_use_spike': False, 'bear_rsi_required': True, 'sideways_strategy': 'breakout', 'sideways_bb_std_mult': 3.041822984010609, 'sideways_rsi_os': 36, 'sideways_rsi_ob': 58, 'sideways_adx_thresh': 19.45986128755178, 'sideways_atr_min_pct': 0.0032945459822151125, 'sideways_atr_max_pct': 0.14358665376415516, 'sideways_tp_mult': 1.678222324412285, 'sideways_tsl_mult': 0.8909063113727435, 'sideways_time_stop': 149, 'sideways_use_sma': False, 'sideways_use_ema': False, 'sideways_use_atr': True, 'sideways_use_adx': False, 'sideways_use_spike': True, 'sideways_rsi_required': False}.
[I 2025-08-30 18:48:04,144] Trial 167 finished with values: [-0.08215119747796018, 0.08211096321315538] and parameters: {'p_sma': 33, 'p_std': 33, 'p_atr': 10, 'p_adx': 22, 'rsi_period': 22, 'ema1': 27, 'ema2': 32, 'slip_atr_k': 0.13820557118012367, 'slip_spread_k': 0.15875934353413623, 'spread_hl_frac': 0.048645893043316846, 'bb_std_mult': 2.3551485245978765, 'rsi_os': 15, 'rsi_ob': 80, 'vol_spike': 0.25895650858385627, 'adx_thresh': 32.946678830234355, 'atr_min_pct': 0.013571519557805008, 'atr_max_pct': 0.12519880460046787, 'tp_mult': 2.2784054800022964, 'tsl_mult': 0.8518861112076251, 'strategy': 'mean_reversion', 'time_stop': 272, 'use_sma': False, 'use_atr': True, 'use_adx': True, 'use_ema': False, 'use_spike': True, 'rsi_required': False, 'edge_k': 0.20748425750149774, 'edge_cap': 0.8721797320763081, 'bull_strategy': 'mean_reversion', 'bull_bb_std_mult': 3.1288558181864747, 'bull_rsi_os': 26, 'bull_rsi_ob': 47, 'bull_adx_thresh': 16.291200620043575, 'bull_atr_min_pct': 0.017965676010907775, 'bull_atr_max_pct': 0.13888870384200355, 'bull_tp_mult': 1.6404168870857858, 'bull_tsl_mult': 0.5686153852761808, 'bull_time_stop': 184, 'bull_use_sma': False, 'bull_use_ema': True, 'bull_use_atr': True, 'bull_use_adx': False, 'bull_use_spike': False, 'bull_rsi_required': True, 'bear_strategy': 'breakout', 'bear_bb_std_mult': 2.5055367678676195, 'bear_rsi_os': 49, 'bear_rsi_ob': 77, 'bear_adx_thresh': 33.3437653726733, 'bear_atr_min_pct': 0.004530085557169602, 'bear_atr_max_pct': 0.033611581852123935, 'bear_tp_mult': 1.4859971079863161, 'bear_tsl_mult': 0.8034432784874752, 'bear_time_stop': 197, 'bear_use_sma': True, 'bear_use_ema': True, 'bear_use_atr': False, 'bear_use_adx': False, 'bear_use_spike': False, 'bear_rsi_required': True, 'sideways_strategy': 'breakout', 'sideways_bb_std_mult': 3.0291179179777568, 'sideways_rsi_os': 44, 'sideways_rsi_ob': 59, 'sideways_adx_thresh': 19.41768686316965, 'sideways_atr_min_pct': 0.0016144877891993005, 'sideways_atr_max_pct': 0.14578218791765266, 'sideways_tp_mult': 1.1529366080188972, 'sideways_tsl_mult': 0.9837396335570289, 'sideways_time_stop': 39, 'sideways_use_sma': False, 'sideways_use_ema': True, 'sideways_use_atr': False, 'sideways_use_adx': False, 'sideways_use_spike': False, 'sideways_rsi_required': True}.
[I 2025-08-30 18:48:04,685] Trial 164 finished with values: [-1000000000.0, 1000000000.0] and parameters: {'p_sma': 33, 'p_std': 34, 'p_atr': 10, 'p_adx': 21, 'rsi_period': 22, 'ema1': 27, 'ema2': 31, 'slip_atr_k': 0.04948038458156705, 'slip_spread_k': 0.15233590074436337, 'spread_hl_frac': 0.023549028722300348, 'bb_std_mult': 0.5699073599404674, 'rsi_os': 48, 'rsi_ob': 80, 'vol_spike': 0.23495061372825043, 'adx_thresh': 15.024325773236415, 'atr_min_pct': 0.02165463006916599, 'atr_max_pct': 0.10067436025888159, 'tp_mult': 1.3683884836971658, 'tsl_mult': 0.8261524669827608, 'strategy': 'mean_reversion', 'time_stop': 206, 'use_sma': True, 'use_atr': True, 'use_adx': True, 'use_ema': False, 'use_spike': True, 'rsi_required': False, 'edge_k': 0.6289392924694042, 'edge_cap': 0.766098731989373, 'bull_strategy': 'mean_reversion', 'bull_bb_std_mult': 1.9482314687991142, 'bull_rsi_os': 32, 'bull_rsi_ob': 48, 'bull_adx_thresh': 18.89447673183543, 'bull_atr_min_pct': 0.01831688974426879, 'bull_atr_max_pct': 0.10917349936378042, 'bull_tp_mult': 1.5665056499207022, 'bull_tsl_mult': 0.5068075526241471, 'bull_time_stop': 187, 'bull_use_sma': False, 'bull_use_ema': True, 'bull_use_atr': True, 'bull_use_adx': False, 'bull_use_spike': False, 'bull_rsi_required': True, 'bear_strategy': 'breakout', 'bear_bb_std_mult': 2.9122515045485176, 'bear_rsi_os': 53, 'bear_rsi_ob': 55, 'bear_adx_thresh': 16.723282487996375, 'bear_atr_min_pct': 0.023261650006475225, 'bear_atr_max_pct': 0.14495923383569947, 'bear_tp_mult': 1.9166842044716141, 'bear_tsl_mult': 0.9980996382717585, 'bear_time_stop': 217, 'bear_use_sma': True, 'bear_use_ema': True, 'bear_use_atr': False, 'bear_use_adx': False, 'bear_use_spike': False, 'bear_rsi_required': True, 'sideways_strategy': 'breakout', 'sideways_bb_std_mult': 0.774810012209709, 'sideways_rsi_os': 36, 'sideways_rsi_ob': 59, 'sideways_adx_thresh': 19.668439610243507, 'sideways_atr_min_pct': 0.0032320838673127617, 'sideways_atr_max_pct': 0.14475898377020338, 'sideways_tp_mult': 1.6801370852793847, 'sideways_tsl_mult': 0.9823501535790272, 'sideways_time_stop': 41, 'sideways_use_sma': False, 'sideways_use_ema': True, 'sideways_use_atr': True, 'sideways_use_adx': False, 'sideways_use_spike': False, 'sideways_rsi_required': True}.
[I 2025-08-30 18:48:05,072] Trial 166 finished with values: [-1000000000.0, 1000000000.0] and parameters: {'p_sma': 34, 'p_std': 33, 'p_atr': 10, 'p_adx': 21, 'rsi_period': 23, 'ema1': 26, 'ema2': 31, 'slip_atr_k': 0.05386505964793328, 'slip_spread_k': 0.1583012246894418, 'spread_hl_frac': 0.007394338302488944, 'bb_std_mult': 2.257480647442827, 'rsi_os': 49, 'rsi_ob': 85, 'vol_spike': 0.25987073067132893, 'adx_thresh': 32.93272667820438, 'atr_min_pct': 0.02359420920647546, 'atr_max_pct': 0.12569902044277328, 'tp_mult': 2.2757953315156914, 'tsl_mult': 0.8289077313521458, 'strategy': 'mean_reversion', 'time_stop': 205, 'use_sma': False, 'use_atr': True, 'use_adx': True, 'use_ema': False, 'use_spike': True, 'rsi_required': False, 'edge_k': 0.19959844746579186, 'edge_cap': 0.08639743763376168, 'bull_strategy': 'mean_reversion', 'bull_bb_std_mult': 3.1179117442297803, 'bull_rsi_os': 28, 'bull_rsi_ob': 49, 'bull_adx_thresh': 5.714070257352828, 'bull_atr_min_pct': 0.027451770521565565, 'bull_atr_max_pct': 0.026937679911897237, 'bull_tp_mult': 1.6483831614646023, 'bull_tsl_mult': 0.5612112046502448, 'bull_time_stop': 30, 'bull_use_sma': False, 'bull_use_ema': True, 'bull_use_atr': True, 'bull_use_adx': False, 'bull_use_spike': False, 'bull_rsi_required': True, 'bear_strategy': 'breakout', 'bear_bb_std_mult': 2.0209579173863883, 'bear_rsi_os': 53, 'bear_rsi_ob': 90, 'bear_adx_thresh': 5.985555826312172, 'bear_atr_min_pct': 0.006307700006439683, 'bear_atr_max_pct': 0.09108271773208446, 'bear_tp_mult': 1.2273912675468752, 'bear_tsl_mult': 0.7615456655043082, 'bear_time_stop': 196, 'bear_use_sma': True, 'bear_use_ema': True, 'bear_use_atr': False, 'bear_use_adx': False, 'bear_use_spike': False, 'bear_rsi_required': True, 'sideways_strategy': 'breakout', 'sideways_bb_std_mult': 3.0448540617531368, 'sideways_rsi_os': 28, 'sideways_rsi_ob': 59, 'sideways_adx_thresh': 31.49619631773921, 'sideways_atr_min_pct': 0.0032004349834239528, 'sideways_atr_max_pct': 0.02583648628911927, 'sideways_tp_mult': 2.8680051656716397, 'sideways_tsl_mult': 0.6440169726651211, 'sideways_time_stop': 21, 'sideways_use_sma': False, 'sideways_use_ema': True, 'sideways_use_atr': True, 'sideways_use_adx': False, 'sideways_use_spike': True, 'sideways_rsi_required': False}.
[I 2025-08-30 18:48:38,705] Trial 171 finished with values: [-1000000000.0, 1000000000.0] and parameters: {'p_sma': 8, 'p_std': 31, 'p_atr': 30, 'p_adx': 11, 'rsi_period': 20, 'ema1': 27, 'ema2': 34, 'slip_atr_k': 0.09606054818013054, 'slip_spread_k': 0.4869381125250215, 'spread_hl_frac': 0.026751430278141208, 'bb_std_mult': 1.9767043935948798, 'rsi_os': 35, 'rsi_ob': 79, 'vol_spike': 0.18940493820546672, 'adx_thresh': 12.181525690258145, 'atr_min_pct': 0.022719369102916987, 'atr_max_pct': 0.0544642119044907, 'tp_mult': 2.379380461110606, 'tsl_mult': 0.878250410695087, 'strategy': 'breakout', 'time_stop': 117, 'use_sma': False, 'use_atr': True, 'use_adx': False, 'use_ema': True, 'use_spike': True, 'rsi_required': False, 'edge_k': 0.09348835578648496, 'edge_cap': 0.49520548258827346, 'bull_strategy': 'mean_reversion', 'bull_bb_std_mult': 1.3389760904846773, 'bull_rsi_os': 50, 'bull_rsi_ob': 76, 'bull_adx_thresh': 19.669581118279332, 'bull_atr_min_pct': 0.001631698854174858, 'bull_atr_max_pct': 0.1258921142455311, 'bull_tp_mult': 1.1851751140086189, 'bull_tsl_mult': 0.5411064124669976, 'bull_time_stop': 194, 'bull_use_sma': False, 'bull_use_ema': False, 'bull_use_atr': True, 'bull_use_adx': False, 'bull_use_spike': False, 'bull_rsi_required': True, 'bear_strategy': 'breakout', 'bear_bb_std_mult': 2.368977622329964, 'bear_rsi_os': 51, 'bear_rsi_ob': 73, 'bear_adx_thresh': 17.80685202803047, 'bear_atr_min_pct': 0.016774466285541707, 'bear_atr_max_pct': 0.02870883351931987, 'bear_tp_mult': 2.745729685622185, 'bear_tsl_mult': 0.4630526362762109, 'bear_time_stop': 72, 'bear_use_sma': True, 'bear_use_ema': False, 'bear_use_atr': True, 'bear_use_adx': True, 'bear_use_spike': False, 'bear_rsi_required': False, 'sideways_strategy': 'breakout', 'sideways_bb_std_mult': 3.211558971682062, 'sideways_rsi_os': 46, 'sideways_rsi_ob': 61, 'sideways_adx_thresh': 21.823203005335184, 'sideways_atr_min_pct': 0.012599868057180764, 'sideways_atr_max_pct': 0.030311134182226383, 'sideways_tp_mult': 2.251856920199309, 'sideways_tsl_mult': 0.9432807413110535, 'sideways_time_stop': 6, 'sideways_use_sma': False, 'sideways_use_ema': True, 'sideways_use_atr': False, 'sideways_use_adx': False, 'sideways_use_spike': False, 'sideways_rsi_required': True}.
[I 2025-08-30 18:48:38,997] Trial 170 finished with values: [-1000000000.0, 1000000000.0] and parameters: {'p_sma': 8, 'p_std': 32, 'p_atr': 25, 'p_adx': 19, 'rsi_period': 20, 'ema1': 26, 'ema2': 36, 'slip_atr_k': 0.07732029139695124, 'slip_spread_k': 0.868179108621483, 'spread_hl_frac': 0.018363088603785434, 'bb_std_mult': 2.251974625055443, 'rsi_os': 44, 'rsi_ob': 78, 'vol_spike': 0.05741553304240944, 'adx_thresh': 34.368754152006744, 'atr_min_pct': 0.008342872648433208, 'atr_max_pct': 0.1284559090822397, 'tp_mult': 2.5073542311434562, 'tsl_mult': 0.8904960501255924, 'strategy': 'breakout', 'time_stop': 117, 'use_sma': False, 'use_atr': True, 'use_adx': False, 'use_ema': True, 'use_spike': True, 'rsi_required': False, 'edge_k': 0.9273741431540881, 'edge_cap': 0.9561593924331866, 'bull_strategy': 'mean_reversion', 'bull_bb_std_mult': 3.074439692880243, 'bull_rsi_os': 28, 'bull_rsi_ob': 76, 'bull_adx_thresh': 22.412064918407502, 'bull_atr_min_pct': 0.0018036326297361407, 'bull_atr_max_pct': 0.02637086807571646, 'bull_tp_mult': 2.7863372718591832, 'bull_tsl_mult': 0.5581710550050941, 'bull_time_stop': 150, 'bull_use_sma': False, 'bull_use_ema': False, 'bull_use_atr': True, 'bull_use_adx': False, 'bull_use_spike': False, 'bull_rsi_required': True, 'bear_strategy': 'breakout', 'bear_bb_std_mult': 1.3611477799618412, 'bear_rsi_os': 51, 'bear_rsi_ob': 74, 'bear_adx_thresh': 5.910469699560354, 'bear_atr_min_pct': 0.025179395610137597, 'bear_atr_max_pct': 0.11372968943861997, 'bear_tp_mult': 1.7923092743808458, 'bear_tsl_mult': 0.8247897436747901, 'bear_time_stop': 187, 'bear_use_sma': True, 'bear_use_ema': True, 'bear_use_atr': True, 'bear_use_adx': True, 'bear_use_spike': False, 'bear_rsi_required': False, 'sideways_strategy': 'breakout', 'sideways_bb_std_mult': 1.9455154851308427, 'sideways_rsi_os': 28, 'sideways_rsi_ob': 61, 'sideways_adx_thresh': 21.727592920981493, 'sideways_atr_min_pct': 0.011307417484610683, 'sideways_atr_max_pct': 0.08232596540672174, 'sideways_tp_mult': 2.2681399876709194, 'sideways_tsl_mult': 0.9416266172360032, 'sideways_time_stop': 164, 'sideways_use_sma': False, 'sideways_use_ema': True, 'sideways_use_atr': True, 'sideways_use_adx': False, 'sideways_use_spike': False, 'sideways_rsi_required': True}.
[I 2025-08-30 18:48:39,174] Trial 169 finished with values: [-1000000000.0, 1000000000.0] and parameters: {'p_sma': 8, 'p_std': 43, 'p_atr': 25, 'p_adx': 15, 'rsi_period': 20, 'ema1': 27, 'ema2': 36, 'slip_atr_k': 0.07679254859791626, 'slip_spread_k': 0.055569764077201766, 'spread_hl_frac': 0.03413101651135986, 'bb_std_mult': 0.6051617019190216, 'rsi_os': 6, 'rsi_ob': 56, 'vol_spike': 0.18832946420987007, 'adx_thresh': 15.514349574665513, 'atr_min_pct': 0.0226617845393463, 'atr_max_pct': 0.05454024906935669, 'tp_mult': 1.6542906750018003, 'tsl_mult': 0.886317880216106, 'strategy': 'breakout', 'time_stop': 176, 'use_sma': False, 'use_atr': True, 'use_adx': False, 'use_ema': True, 'use_spike': True, 'rsi_required': False, 'edge_k': 1.3512497621072055, 'edge_cap': 0.08611334650330893, 'bull_strategy': 'mean_reversion', 'bull_bb_std_mult': 3.1754408743896994, 'bull_rsi_os': 50, 'bull_rsi_ob': 90, 'bull_adx_thresh': 19.497170971837207, 'bull_atr_min_pct': 0.02734806060789096, 'bull_atr_max_pct': 0.05151168885388532, 'bull_tp_mult': 2.792312906061986, 'bull_tsl_mult': 0.5550953023517965, 'bull_time_stop': 151, 'bull_use_sma': False, 'bull_use_ema': False, 'bull_use_atr': True, 'bull_use_adx': False, 'bull_use_spike': False, 'bull_rsi_required': True, 'bear_strategy': 'breakout', 'bear_bb_std_mult': 2.1314727943406946, 'bear_rsi_os': 50, 'bear_rsi_ob': 55, 'bear_adx_thresh': 17.981953216070902, 'bear_atr_min_pct': 0.02006907068027353, 'bear_atr_max_pct': 0.1434826011247312, 'bear_tp_mult': 2.6814282871437523, 'bear_tsl_mult': 0.5142703949989719, 'bear_time_stop': 203, 'bear_use_sma': True, 'bear_use_ema': True, 'bear_use_atr': False, 'bear_use_adx': True, 'bear_use_spike': False, 'bear_rsi_required': True, 'sideways_strategy': 'breakout', 'sideways_bb_std_mult': 2.579512251964533, 'sideways_rsi_os': 19, 'sideways_rsi_ob': 72, 'sideways_adx_thresh': 22.176797447259577, 'sideways_atr_min_pct': 0.012380382287775877, 'sideways_atr_max_pct': 0.13950294211027994, 'sideways_tp_mult': 1.1069702331753235, 'sideways_tsl_mult': 0.943802037482116, 'sideways_time_stop': 167, 'sideways_use_sma': False, 'sideways_use_ema': True, 'sideways_use_atr': True, 'sideways_use_adx': False, 'sideways_use_spike': False, 'sideways_rsi_required': True}.
