[I 2025-08-30 18:54:51,317] Trial 225 finished with values: [-0.014056740457245698, 0.014000507949030818] and parameters: {'p_sma': 9, 'p_std': 54, 'p_atr': 9, 'p_adx': 19, 'rsi_period': 22, 'ema1': 26, 'ema2': 59, 'slip_atr_k': 0.03665928207392827, 'slip_spread_k': 0.14983429831474532, 'spread_hl_frac': 0.0072826123722149715, 'bb_std_mult': 2.7249635947583246, 'rsi_os': 13, 'rsi_ob': 83, 'vol_spike': 0.000801136040823075, 'adx_thresh': 24.364919918418018, 'atr_min_pct': 0.004293930841427752, 'atr_max_pct': 0.09453494961024023, 'tp_mult': 2.2009137233344203, 'tsl_mult': 0.24573742699228285, 'strategy': 'breakout', 'time_stop': 190, 'use_sma': False, 'use_atr': True, 'use_adx': False, 'use_ema': False, 'use_spike': True, 'rsi_required': False, 'edge_k': 1.6666933692390542, 'edge_cap': 0.669117776349737, 'bull_strategy': 'mean_reversion', 'bull_bb_std_mult': 3.242126791173865, 'bull_rsi_os': 33, 'bull_rsi_ob': 48, 'bull_adx_thresh': 18.310150166242654, 'bull_atr_min_pct': 0.01426427225420116, 'bull_atr_max_pct': 0.07244098200989751, 'bull_tp_mult': 2.9536984827644437, 'bull_tsl_mult': 0.964572375188387, 'bull_time_stop': 182, 'bull_use_sma': False, 'bull_use_ema': False, 'bull_use_atr': True, 'bull_use_adx': True, 'bull_use_spike': False, 'bull_rsi_required': False, 'bear_strategy': 'breakout', 'bear_bb_std_mult': 2.797431402687757, 'bear_rsi_os': 13, 'bear_rsi_ob': 76, 'bear_adx_thresh': 17.902842267683422, 'bear_atr_min_pct': 0.02498591220610606, 'bear_atr_max_pct': 0.035989167260586784, 'bear_tp_mult': 2.705348735582412, 'bear_tsl_mult': 0.4106742587328651, 'bear_time_stop': 197, 'bear_use_sma': True, 'bear_use_ema': True, 'bear_use_atr': False, 'bear_use_adx': True, 'bear_use_spike': False, 'bear_rsi_required': True, 'sideways_strategy': 'breakout', 'sideways_bb_std_mult': 1.1866075693623006, 'sideways_rsi_os': 37, 'sideways_rsi_ob': 89, 'sideways_adx_thresh': 19.635243096289695, 'sideways_atr_min_pct': 0.002361804719276172, 'sideways_atr_max_pct': 0.14535943500932755, 'sideways_tp_mult': 2.3149424412237294, 'sideways_tsl_mult': 0.33675537754465545, 'sideways_time_stop': 128, 'sideways_use_sma': False, 'sideways_use_ema': True, 'sideways_use_atr': True, 'sideways_use_adx': False, 'sideways_use_spike': False, 'sideways_rsi_required': True}.
[I 2025-08-30 18:54:51,423] Trial 226 finished with values: [-1000000000.0, 1000000000.0] and parameters: {'p_sma': 10, 'p_std': 8, 'p_atr': 9, 'p_adx': 10, 'rsi_period': 21, 'ema1': 26, 'ema2': 32, 'slip_atr_k': 0.18660885785369938, 'slip_spread_k': 0.14639133038524652, 'spread_hl_frac': 0.0012349129660541303, 'bb_std_mult': 2.7243245345482254, 'rsi_os': 13, 'rsi_ob': 83, 'vol_spike': 0.000528747088245074, 'adx_thresh': 29.30354626235151, 'atr_min_pct': 0.0044111717042343655, 'atr_max_pct': 0.015247036695832494, 'tp_mult': 2.1960910095326156, 'tsl_mult': 0.1002391391956069, 'strategy': 'breakout', 'time_stop': 191, 'use_sma': False, 'use_atr': True, 'use_adx': False, 'use_ema': False, 'use_spike': True, 'rsi_required': False, 'edge_k': 0.10066974955994706, 'edge_cap': 0.4928503667631582, 'bull_strategy': 'mean_reversion', 'bull_bb_std_mult': 3.26939497268046, 'bull_rsi_os': 7, 'bull_rsi_ob': 47, 'bull_adx_thresh': 18.387309116616127, 'bull_atr_min_pct': 0.002363653861478075, 'bull_atr_max_pct': 0.12137095835507075, 'bull_tp_mult': 1.502908842541962, 'bull_tsl_mult': 0.9121056593283527, 'bull_time_stop': 183, 'bull_use_sma': False, 'bull_use_ema': False, 'bull_use_atr': False, 'bull_use_adx': True, 'bull_use_spike': True, 'bull_rsi_required': False, 'bear_strategy': 'breakout', 'bear_bb_std_mult': 2.7963685433197734, 'bear_rsi_os': 13, 'bear_rsi_ob': 76, 'bear_adx_thresh': 18.074877373157264, 'bear_atr_min_pct': 0.017420852481844433, 'bear_atr_max_pct': 0.03543907763826203, 'bear_tp_mult': 2.704045581539499, 'bear_tsl_mult': 0.22539512828250086, 'bear_time_stop': 196, 'bear_use_sma': True, 'bear_use_ema': True, 'bear_use_atr': True, 'bear_use_adx': True, 'bear_use_spike': False, 'bear_rsi_required': True, 'sideways_strategy': 'breakout', 'sideways_bb_std_mult': 3.440051509870022, 'sideways_rsi_os': 36, 'sideways_rsi_ob': 89, 'sideways_adx_thresh': 18.6926605153668, 'sideways_atr_min_pct': 0.011102688331325406, 'sideways_atr_max_pct': 0.1463621756406748, 'sideways_tp_mult': 1.0512919388261426, 'sideways_tsl_mult': 0.9580791270109257, 'sideways_time_stop': 166, 'sideways_use_sma': False, 'sideways_use_ema': True, 'sideways_use_atr': True, 'sideways_use_adx': False, 'sideways_use_spike': False, 'sideways_rsi_required': True}.
[I 2025-08-30 18:54:52,138] Trial 228 finished with values: [-1000000000.0, 1000000000.0] and parameters: {'p_sma': 60, 'p_std': 34, 'p_atr': 8, 'p_adx': 19, 'rsi_period': 22, 'ema1': 26, 'ema2': 32, 'slip_atr_k': 0.18665017306498718, 'slip_spread_k': 0.15805551847644997, 'spread_hl_frac': 0.007282261182119117, 'bb_std_mult': 2.5592970213157447, 'rsi_os': 50, 'rsi_ob': 83, 'vol_spike': 0.2540642490497991, 'adx_thresh': 6.069718270411714, 'atr_min_pct': 0.02288741416876664, 'atr_max_pct': 0.05189853983640951, 'tp_mult': 2.217942317822489, 'tsl_mult': 0.959098251826929, 'strategy': 'mean_reversion', 'time_stop': 189, 'use_sma': False, 'use_atr': False, 'use_adx': True, 'use_ema': False, 'use_spike': True, 'rsi_required': False, 'edge_k': 0.12053302785661679, 'edge_cap': 0.46249819247992235, 'bull_strategy': 'mean_reversion', 'bull_bb_std_mult': 3.2435193272432676, 'bull_rsi_os': 7, 'bull_rsi_ob': 47, 'bull_adx_thresh': 17.224926633622374, 'bull_atr_min_pct': 0.0013355830424923469, 'bull_atr_max_pct': 0.121405786823223, 'bull_tp_mult': 2.464630420327725, 'bull_tsl_mult': 0.9109348725127894, 'bull_time_stop': 183, 'bull_use_sma': False, 'bull_use_ema': True, 'bull_use_atr': True, 'bull_use_adx': False, 'bull_use_spike': False, 'bull_rsi_required': True, 'bear_strategy': 'breakout', 'bear_bb_std_mult': 2.898072279083306, 'bear_rsi_os': 35, 'bear_rsi_ob': 76, 'bear_adx_thresh': 17.907381514853405, 'bear_atr_min_pct': 0.01566052544880531, 'bear_atr_max_pct': 0.031218540908454225, 'bear_tp_mult': 1.691700848844923, 'bear_tsl_mult': 0.7916134958390485, 'bear_time_stop': 194, 'bear_use_sma': True, 'bear_use_ema': True, 'bear_use_atr': False, 'bear_use_adx': False, 'bear_use_spike': False, 'bear_rsi_required': True, 'sideways_strategy': 'breakout', 'sideways_bb_std_mult': 3.436248184726656, 'sideways_rsi_os': 55, 'sideways_rsi_ob': 59, 'sideways_adx_thresh': 14.52503345640585, 'sideways_atr_min_pct': 0.0037843995088341076, 'sideways_atr_max_pct': 0.14503486505119387, 'sideways_tp_mult': 1.0452400502128123, 'sideways_tsl_mult': 0.9708226060691866, 'sideways_time_stop': 149, 'sideways_use_sma': False, 'sideways_use_ema': True, 'sideways_use_atr': True, 'sideways_use_adx': False, 'sideways_use_spike': True, 'sideways_rsi_required': False}.
[I 2025-08-30 18:54:52,199] Trial 229 finished with values: [-1000000000.0, 1000000000.0] and parameters: {'p_sma': 25, 'p_std': 31, 'p_atr': 8, 'p_adx': 19, 'rsi_period': 22, 'ema1': 25, 'ema2': 28, 'slip_atr_k': 0.03766210250869856, 'slip_spread_k': 0.1542424120400125, 'spread_hl_frac': 0.00789380597685289, 'bb_std_mult': 0.5053992255983435, 'rsi_os': 50, 'rsi_ob': 83, 'vol_spike': 0.25415184216440095, 'adx_thresh': 34.021066743134796, 'atr_min_pct': 0.022843796970197998, 'atr_max_pct': 0.09726163943708209, 'tp_mult': 1.7602088354673122, 'tsl_mult': 0.5112416428349341, 'strategy': 'mean_reversion', 'time_stop': 200, 'use_sma': False, 'use_atr': False, 'use_adx': True, 'use_ema': False, 'use_spike': False, 'rsi_required': False, 'edge_k': 0.4451633419287606, 'edge_cap': 0.7065767372622831, 'bull_strategy': 'mean_reversion', 'bull_bb_std_mult': 0.5138311812593539, 'bull_rsi_os': 33, 'bull_rsi_ob': 45, 'bull_adx_thresh': 16.864774208944997, 'bull_atr_min_pct': 0.014089082643880566, 'bull_atr_max_pct': 0.11707904168459281, 'bull_tp_mult': 2.8160957211024638, 'bull_tsl_mult': 0.5710654585197579, 'bull_time_stop': 181, 'bull_use_sma': False, 'bull_use_ema': True, 'bull_use_atr': True, 'bull_use_adx': False, 'bull_use_spike': False, 'bull_rsi_required': True, 'bear_strategy': 'breakout', 'bear_bb_std_mult': 1.1079749663140757, 'bear_rsi_os': 21, 'bear_rsi_ob': 54, 'bear_adx_thresh': 8.360826167304811, 'bear_atr_min_pct': 0.014498210688463586, 'bear_atr_max_pct': 0.031116518438159095, 'bear_tp_mult': 1.4376529051344846, 'bear_tsl_mult': 0.7703960514560471, 'bear_time_stop': 202, 'bear_use_sma': True, 'bear_use_ema': False, 'bear_use_atr': False, 'bear_use_adx': False, 'bear_use_spike': False, 'bear_rsi_required': True, 'sideways_strategy': 'breakout', 'sideways_bb_std_mult': 1.8834568107111798, 'sideways_rsi_os': 38, 'sideways_rsi_ob': 59, 'sideways_adx_thresh': 27.855138657431297, 'sideways_atr_min_pct': 0.0036153042611429525, 'sideways_atr_max_pct': 0.14469809606388084, 'sideways_tp_mult': 1.1614130876030264, 'sideways_tsl_mult': 0.02688305635990862, 'sideways_time_stop': 183, 'sideways_use_sma': True, 'sideways_use_ema': True, 'sideways_use_atr': True, 'sideways_use_adx': False, 'sideways_use_spike': True, 'sideways_rsi_required': False}.
[I 2025-08-30 18:54:52,248] Trial 230 finished with values: [-1000000000.0, 1000000000.0] and parameters: {'p_sma': 59, 'p_std': 15, 'p_atr': 8, 'p_adx': 19, 'rsi_period': 62, 'ema1': 25, 'ema2': 59, 'slip_atr_k': 0.0796778469989165, 'slip_spread_k': 0.1642319759384482, 'spread_hl_frac': 0.025084880351519404, 'bb_std_mult': 1.0122062389311484, 'rsi_os': 50, 'rsi_ob': 83, 'vol_spike': 0.22855411145561508, 'adx_thresh': 7.2170196495474706, 'atr_min_pct': 0.02537739297763276, 'atr_max_pct': 0.09743882679868884, 'tp_mult': 2.5921925922661195, 'tsl_mult': 0.9550064375587787, 'strategy': 'mean_reversion', 'time_stop': 294, 'use_sma': False, 'use_atr': False, 'use_adx': True, 'use_ema': False, 'use_spike': False, 'rsi_required': False, 'edge_k': 0.8929460475172845, 'edge_cap': 0.7038968938487167, 'bull_strategy': 'mean_reversion', 'bull_bb_std_mult': 3.2239204859181574, 'bull_rsi_os': 33, 'bull_rsi_ob': 45, 'bull_adx_thresh': 17.203221105249174, 'bull_atr_min_pct': 0.0012661598796274915, 'bull_atr_max_pct': 0.07332859656213483, 'bull_tp_mult': 2.807650531303503, 'bull_tsl_mult': 0.7782637807838353, 'bull_time_stop': 276, 'bull_use_sma': False, 'bull_use_ema': True, 'bull_use_atr': True, 'bull_use_adx': False, 'bull_use_spike': False, 'bull_rsi_required': True, 'bear_strategy': 'breakout', 'bear_bb_std_mult': 1.0902794736295789, 'bear_rsi_os': 53, 'bear_rsi_ob': 53, 'bear_adx_thresh': 12.606067055958237, 'bear_atr_min_pct': 0.014062440151038845, 'bear_atr_max_pct': 0.03837524866163034, 'bear_tp_mult': 2.676537082714653, 'bear_tsl_mult': 0.9466879865648955, 'bear_time_stop': 200, 'bear_use_sma': True, 'bear_use_ema': False, 'bear_use_atr': False, 'bear_use_adx': False, 'bear_use_spike': False, 'bear_rsi_required': True, 'sideways_strategy': 'breakout', 'sideways_bb_std_mult': 1.2189324707666342, 'sideways_rsi_os': 37, 'sideways_rsi_ob': 59, 'sideways_adx_thresh': 19.91829475671408, 'sideways_atr_min_pct': 0.002393122451656685, 'sideways_atr_max_pct': 0.14424745432238395, 'sideways_tp_mult': 2.5612099330314537, 'sideways_tsl_mult': 0.9748372818734518, 'sideways_time_stop': 130, 'sideways_use_sma': True, 'sideways_use_ema': True, 'sideways_use_atr': True, 'sideways_use_adx': False, 'sideways_use_spike': True, 'sideways_rsi_required': False}.
[I 2025-08-30 18:55:21,615] Trial 227 finished with values: [-0.03122870082448448, 0.03118805464131289] and parameters: {'p_sma': 35, 'p_std': 16, 'p_atr': 24, 'p_adx': 24, 'rsi_period': 62, 'ema1': 8, 'ema2': 32, 'slip_atr_k': 0.07889695229202588, 'slip_spread_k': 0.8470116262513498, 'spread_hl_frac': 0.024285896587352217, 'bb_std_mult': 2.2948173409711896, 'rsi_os': 9, 'rsi_ob': 83, 'vol_spike': 0.19619853576256116, 'adx_thresh': 7.2089178086465235, 'atr_min_pct': 0.006818381868743992, 'atr_max_pct': 0.0961324315776999, 'tp_mult': 2.2171359876181933, 'tsl_mult': 0.8289392536693306, 'strategy': 'mean_reversion', 'time_stop': 191, 'use_sma': False, 'use_atr': False, 'use_adx': True, 'use_ema': False, 'use_spike': True, 'rsi_required': False, 'edge_k': 0.09474744402456436, 'edge_cap': 0.1443766128641193, 'bull_strategy': 'mean_reversion', 'bull_bb_std_mult': 3.247595561759803, 'bull_rsi_os': 22, 'bull_rsi_ob': 47, 'bull_adx_thresh': 17.21071525155481, 'bull_atr_min_pct': 0.0012422325968712584, 'bull_atr_max_pct': 0.12196433660368361, 'bull_tp_mult': 1.5105339189742553, 'bull_tsl_mult': 0.527363036677333, 'bull_time_stop': 184, 'bull_use_sma': False, 'bull_use_ema': True, 'bull_use_atr': True, 'bull_use_adx': False, 'bull_use_spike': False, 'bull_rsi_required': True, 'bear_strategy': 'breakout', 'bear_bb_std_mult': 2.7943115062686705, 'bear_rsi_os': 51, 'bear_rsi_ob': 76, 'bear_adx_thresh': 32.68659221230772, 'bear_atr_min_pct': 0.015718735069789585, 'bear_atr_max_pct': 0.031892891419742456, 'bear_tp_mult': 2.7079554762111786, 'bear_tsl_mult': 0.944493659725582, 'bear_time_stop': 202, 'bear_use_sma': True, 'bear_use_ema': True, 'bear_use_atr': False, 'bear_use_adx': False, 'bear_use_spike': False, 'bear_rsi_required': True, 'sideways_strategy': 'breakout', 'sideways_bb_std_mult': 0.8336006283378072, 'sideways_rsi_os': 55, 'sideways_rsi_ob': 87, 'sideways_adx_thresh': 19.939660330130057, 'sideways_atr_min_pct': 0.0023230643348777745, 'sideways_atr_max_pct': 0.048405325858113045, 'sideways_tp_mult': 1.054724881545298, 'sideways_tsl_mult': 0.3343950259499534, 'sideways_time_stop': 127, 'sideways_use_sma': False, 'sideways_use_ema': True, 'sideways_use_atr': True, 'sideways_use_adx': False, 'sideways_use_spike': True, 'sideways_rsi_required': False}.
[I 2025-08-30 18:55:25,798] Trial 231 finished with values: [-0.01807438487298263, 0.018015681132735797] and parameters: {'p_sma': 7, 'p_std': 19, 'p_atr': 10, 'p_adx': 19, 'rsi_period': 25, 'ema1': 25, 'ema2': 30, 'slip_atr_k': 0.03822032010520727, 'slip_spread_k': 0.7512692482634448, 'spread_hl_frac': 0.025189915281829414, 'bb_std_mult': 2.2910764699458173, 'rsi_os': 9, 'rsi_ob': 84, 'vol_spike': 0.24364354793106563, 'adx_thresh': 24.718457673677175, 'atr_min_pct': 0.024278640090009556, 'atr_max_pct': 0.0978587259463603, 'tp_mult': 2.2876506099620046, 'tsl_mult': 0.5289765179874356, 'strategy': 'mean_reversion', 'time_stop': 201, 'use_sma': False, 'use_atr': True, 'use_adx': True, 'use_ema': False, 'use_spike': False, 'rsi_required': False, 'edge_k': 1.3360913445673026, 'edge_cap': 0.14882636897099988, 'bull_strategy': 'mean_reversion', 'bull_bb_std_mult': 3.1611375313687597, 'bull_rsi_os': 38, 'bull_rsi_ob': 89, 'bull_adx_thresh': 17.41375108582612, 'bull_atr_min_pct': 0.000767255209617396, 'bull_atr_max_pct': 0.07684508029654433, 'bull_tp_mult': 2.6547836995595997, 'bull_tsl_mult': 0.7824645098900331, 'bull_time_stop': 42, 'bull_use_sma': False, 'bull_use_ema': True, 'bull_use_atr': True, 'bull_use_adx': False, 'bull_use_spike': False, 'bull_rsi_required': True, 'bear_strategy': 'breakout', 'bear_bb_std_mult': 0.8937326391179654, 'bear_rsi_os': 53, 'bear_rsi_ob': 49, 'bear_adx_thresh': 32.541209533685986, 'bear_atr_min_pct': 0.013837023340636615, 'bear_atr_max_pct': 0.038478147538370075, 'bear_tp_mult': 1.373674669661368, 'bear_tsl_mult': 0.8226040951529903, 'bear_time_stop': 202, 'bear_use_sma': True, 'bear_use_ema': False, 'bear_use_atr': False, 'bear_use_adx': False, 'bear_use_spike': False, 'bear_rsi_required': True, 'sideways_strategy': 'breakout', 'sideways_bb_std_mult': 0.7549128317867504, 'sideways_rsi_os': 37, 'sideways_rsi_ob': 83, 'sideways_adx_thresh': 19.843770063204904, 'sideways_atr_min_pct': 0.0020082123297734053, 'sideways_atr_max_pct': 0.14707348018939698, 'sideways_tp_mult': 2.4105325177008523, 'sideways_tsl_mult': 0.980883935630697, 'sideways_time_stop': 232, 'sideways_use_sma': True, 'sideways_use_ema': True, 'sideways_use_atr': True, 'sideways_use_adx': False, 'sideways_use_spike': False, 'sideways_rsi_required': True}.
[I 2025-08-30 18:55:26,249] Trial 232 finished with values: [-1000000000.0, 1000000000.0] and parameters: {'p_sma': 9, 'p_std': 15, 'p_atr': 24, 'p_adx': 23, 'rsi_period': 44, 'ema1': 25, 'ema2': 16, 'slip_atr_k': 0.07845125841559258, 'slip_spread_k': 0.08443012834574828, 'spread_hl_frac': 0.025159723230709204, 'bb_std_mult': 2.3137972130302784, 'rsi_os': 38, 'rsi_ob': 84, 'vol_spike': 0.21497360479258965, 'adx_thresh': 24.477138059556978, 'atr_min_pct': 0.006587107523704134, 'atr_max_pct': 0.1418524175664807, 'tp_mult': 2.2742712082089587, 'tsl_mult': 0.8240498306618368, 'strategy': 'mean_reversion', 'time_stop': 184, 'use_sma': False, 'use_atr': True, 'use_adx': True, 'use_ema': False, 'use_spike': True, 'rsi_required': False, 'edge_k': 0.9095822942353671, 'edge_cap': 0.15955431261407943, 'bull_strategy': 'mean_reversion', 'bull_bb_std_mult': 3.150697323159311, 'bull_rsi_os': 21, 'bull_rsi_ob': 46, 'bull_adx_thresh': 17.378968604998335, 'bull_atr_min_pct': 0.016623963161154453, 'bull_atr_max_pct': 0.07412200534553443, 'bull_tp_mult': 2.1855566199725582, 'bull_tsl_mult': 0.4055646648536524, 'bull_time_stop': 51, 'bull_use_sma': False, 'bull_use_ema': True, 'bull_use_atr': True, 'bull_use_adx': False, 'bull_use_spike': False, 'bull_rsi_required': True, 'bear_strategy': 'breakout', 'bear_bb_std_mult': 0.8838157326644211, 'bear_rsi_os': 53, 'bear_rsi_ob': 49, 'bear_adx_thresh': 32.24205123966835, 'bear_atr_min_pct': 0.024823483935043373, 'bear_atr_max_pct': 0.03899555138204078, 'bear_tp_mult': 2.4665412560904905, 'bear_tsl_mult': 0.19566200079135598, 'bear_time_stop': 205, 'bear_use_sma': False, 'bear_use_ema': True, 'bear_use_atr': False, 'bear_use_adx': False, 'bear_use_spike': False, 'bear_rsi_required': False, 'sideways_strategy': 'breakout', 'sideways_bb_std_mult': 3.1743810448241954, 'sideways_rsi_os': 37, 'sideways_rsi_ob': 86, 'sideways_adx_thresh': 21.410865915801814, 'sideways_atr_min_pct': 0.0023819991866736298, 'sideways_atr_max_pct': 0.1479600124890219, 'sideways_tp_mult': 2.564183016606205, 'sideways_tsl_mult': 0.3240074312179816, 'sideways_time_stop': 232, 'sideways_use_sma': False, 'sideways_use_ema': True, 'sideways_use_atr': True, 'sideways_use_adx': False, 'sideways_use_spike': False, 'sideways_rsi_required': True}.
[I 2025-08-30 18:55:26,466] Trial 233 finished with values: [-1000000000.0, 1000000000.0] and parameters: {'p_sma': 9, 'p_std': 19, 'p_atr': 24, 'p_adx': 27, 'rsi_period': 24, 'ema1': 26, 'ema2': 16, 'slip_atr_k': 0.15081104291676004, 'slip_spread_k': 0.8509425561822259, 'spread_hl_frac': 0.02436864257835119, 'bb_std_mult': 2.3021139864970053, 'rsi_os': 9, 'rsi_ob': 84, 'vol_spike': 0.03904905605394114, 'adx_thresh': 12.268896088401856, 'atr_min_pct': 0.006870256436695024, 'atr_max_pct': 0.08894624310727582, 'tp_mult': 2.298839985856627, 'tsl_mult': 0.8337256453274928, 'strategy': 'mean_reversion', 'time_stop': 180, 'use_sma': False, 'use_atr': True, 'use_adx': True, 'use_ema': False, 'use_spike': True, 'rsi_required': False, 'edge_k': 0.13788424723570203, 'edge_cap': 0.6692495646750639, 'bull_strategy': 'mean_reversion', 'bull_bb_std_mult': 3.1469163290191084, 'bull_rsi_os': 16, 'bull_rsi_ob': 88, 'bull_adx_thresh': 17.511993210626706, 'bull_atr_min_pct': 0.02456359735881479, 'bull_atr_max_pct': 0.0686569106103056, 'bull_tp_mult': 2.661166387732842, 'bull_tsl_mult': 0.4558744820582875, 'bull_time_stop': 172, 'bull_use_sma': False, 'bull_use_ema': True, 'bull_use_atr': True, 'bull_use_adx': False, 'bull_use_spike': False, 'bull_rsi_required': True, 'bear_strategy': 'breakout', 'bear_bb_std_mult': 0.9424039204022248, 'bear_rsi_os': 51, 'bear_rsi_ob': 63, 'bear_adx_thresh': 32.78692904035058, 'bear_atr_min_pct': 0.02377824650068726, 'bear_atr_max_pct': 0.021022948408793173, 'bear_tp_mult': 2.6137667579043224, 'bear_tsl_mult': 0.8279423857482577, 'bear_time_stop': 207, 'bear_use_sma': False, 'bear_use_ema': True, 'bear_use_atr': False, 'bear_use_adx': False, 'bear_use_spike': False, 'bear_rsi_required': False, 'sideways_strategy': 'breakout', 'sideways_bb_std_mult': 2.171618253738868, 'sideways_rsi_os': 36, 'sideways_rsi_ob': 60, 'sideways_adx_thresh': 21.588816218282464, 'sideways_atr_min_pct': 0.016274502917152454, 'sideways_atr_max_pct': 0.06535711727874374, 'sideways_tp_mult': 2.4225934047552866, 'sideways_tsl_mult': 0.1375578851468628, 'sideways_time_stop': 143, 'sideways_use_sma': False, 'sideways_use_ema': True, 'sideways_use_atr': True, 'sideways_use_adx': False, 'sideways_use_spike': False, 'sideways_rsi_required': True}.
