[I 2025-08-30 18:57:11,152] Trial 243 finished with values: [-0.06648617529347467, 0.06644461015042859] and parameters: {'p_sma': 40, 'p_std': 44, 'p_atr': 9, 'p_adx': 18, 'rsi_period': 22, 'ema1': 20, 'ema2': 31, 'slip_atr_k': 0.12401390295520379, 'slip_spread_k': 0.0008695445469452667, 'spread_hl_frac': 0.022792618684982106, 'bb_std_mult': 3.181270147671986, 'rsi_os': 46, 'rsi_ob': 81, 'vol_spike': 0.14955873640037992, 'adx_thresh': 32.68354638703378, 'atr_min_pct': 0.020504992541405358, 'atr_max_pct': 0.04764042989502652, 'tp_mult': 2.22763653540145, 'tsl_mult': 0.9995925072760095, 'strategy': 'breakout', 'time_stop': 189, 'use_sma': True, 'use_atr': True, 'use_adx': True, 'use_ema': True, 'use_spike': True, 'rsi_required': False, 'edge_k': 1.7926895566914052, 'edge_cap': 0.5190014127943615, 'bull_strategy': 'breakout', 'bull_bb_std_mult': 2.0413580690857245, 'bull_rsi_os': 22, 'bull_rsi_ob': 86, 'bull_adx_thresh': 26.888778052060907, 'bull_atr_min_pct': 0.012991499953464256, 'bull_atr_max_pct': 0.11907493395272317, 'bull_tp_mult': 2.6100737047679035, 'bull_tsl_mult': 0.5434226853531434, 'bull_time_stop': 186, 'bull_use_sma': True, 'bull_use_ema': False, 'bull_use_atr': False, 'bull_use_adx': False, 'bull_use_spike': True, 'bull_rsi_required': True, 'bear_strategy': 'breakout', 'bear_bb_std_mult': 1.2016133916420604, 'bear_rsi_os': 47, 'bear_rsi_ob': 77, 'bear_adx_thresh': 11.298265182219865, 'bear_atr_min_pct': 0.0020458843712683732, 'bear_atr_max_pct': 0.010136464999148137, 'bear_tp_mult': 2.7478986532466267, 'bear_tsl_mult': 0.8132669149079892, 'bear_time_stop': 199, 'bear_use_sma': True, 'bear_use_ema': True, 'bear_use_atr': True, 'bear_use_adx': True, 'bear_use_spike': True, 'bear_rsi_required': True, 'sideways_strategy': 'mean_reversion', 'sideways_bb_std_mult': 2.9728734369638126, 'sideways_rsi_os': 36, 'sideways_rsi_ob': 93, 'sideways_adx_thresh': 20.46140273105255, 'sideways_atr_min_pct': 0.006765549210509564, 'sideways_atr_max_pct': 0.14691983528163466, 'sideways_tp_mult': 1.0761648624243583, 'sideways_tsl_mult': 0.9497796212538083, 'sideways_time_stop': 150, 'sideways_use_sma': False, 'sideways_use_ema': True, 'sideways_use_atr': True, 'sideways_use_adx': True, 'sideways_use_spike': False, 'sideways_rsi_required': True}.
[I 2025-08-30 18:57:12,062] Trial 245 finished with values: [-1000000000.0, 1000000000.0] and parameters: {'p_sma': 23, 'p_std': 32, 'p_atr': 27, 'p_adx': 18, 'rsi_period': 22, 'ema1': 20, 'ema2': 56, 'slip_atr_k': 0.04851623588044403, 'slip_spread_k': 0.03531009586265582, 'spread_hl_frac': 0.011520697763084202, 'bb_std_mult': 2.146199783328066, 'rsi_os': 5, 'rsi_ob': 85, 'vol_spike': 0.26832211629842306, 'adx_thresh': 16.619043022388666, 'atr_min_pct': 0.02347223694046115, 'atr_max_pct': 0.0957949370458914, 'tp_mult': 1.9444610665173458, 'tsl_mult': 0.5451497735071964, 'strategy': 'mean_reversion', 'time_stop': 188, 'use_sma': False, 'use_atr': False, 'use_adx': True, 'use_ema': False, 'use_spike': True, 'rsi_required': False, 'edge_k': 0.10886590174239677, 'edge_cap': 0.4738747430315262, 'bull_strategy': 'mean_reversion', 'bull_bb_std_mult': 3.200630945878342, 'bull_rsi_os': 43, 'bull_rsi_ob': 47, 'bull_adx_thresh': 19.52908348970909, 'bull_atr_min_pct': 0.0017603402355582374, 'bull_atr_max_pct': 0.12214782565066483, 'bull_tp_mult': 1.075401896293012, 'bull_tsl_mult': 0.5646921356231264, 'bull_time_stop': 184, 'bull_use_sma': False, 'bull_use_ema': True, 'bull_use_atr': False, 'bull_use_adx': False, 'bull_use_spike': True, 'bull_rsi_required': True, 'bear_strategy': 'breakout', 'bear_bb_std_mult': 1.2013359814218634, 'bear_rsi_os': 50, 'bear_rsi_ob': 56, 'bear_adx_thresh': 18.35975937250693, 'bear_atr_min_pct': 0.015331348852067338, 'bear_atr_max_pct': 0.029905695431464145, 'bear_tp_mult': 2.6753094348912834, 'bear_tsl_mult': 0.8153827450066142, 'bear_time_stop': 257, 'bear_use_sma': True, 'bear_use_ema': True, 'bear_use_atr': False, 'bear_use_adx': False, 'bear_use_spike': True, 'bear_rsi_required': True, 'sideways_strategy': 'breakout', 'sideways_bb_std_mult': 2.920830286543431, 'sideways_rsi_os': 49, 'sideways_rsi_ob': 87, 'sideways_adx_thresh': 24.29493102623034, 'sideways_atr_min_pct': 0.017461610593825554, 'sideways_atr_max_pct': 0.047469230689912115, 'sideways_tp_mult': 1.0636322672552148, 'sideways_tsl_mult': 0.6896832349445279, 'sideways_time_stop': 262, 'sideways_use_sma': False, 'sideways_use_ema': True, 'sideways_use_atr': True, 'sideways_use_adx': True, 'sideways_use_spike': True, 'sideways_rsi_required': True}.
[I 2025-08-30 18:57:12,519] Trial 244 finished with values: [-0.02829671279597934, 0.02836027603414532] and parameters: {'p_sma': 8, 'p_std': 32, 'p_atr': 9, 'p_adx': 18, 'rsi_period': 22, 'ema1': 23, 'ema2': 32, 'slip_atr_k': 0.029533500212361757, 'slip_spread_k': 0.6832751549514605, 'spread_hl_frac': 0.02286371634016209, 'bb_std_mult': 2.1540021585026623, 'rsi_os': 25, 'rsi_ob': 85, 'vol_spike': 0.05251985332046702, 'adx_thresh': 15.617965085739867, 'atr_min_pct': 0.023541429969020464, 'atr_max_pct': 0.09608759579679714, 'tp_mult': 1.5752359999194603, 'tsl_mult': 0.4600908497113812, 'strategy': 'mean_reversion', 'time_stop': 258, 'use_sma': False, 'use_atr': False, 'use_adx': True, 'use_ema': False, 'use_spike': True, 'rsi_required': False, 'edge_k': 0.08708175450412209, 'edge_cap': 0.4778354421381115, 'bull_strategy': 'mean_reversion', 'bull_bb_std_mult': 3.064742647881247, 'bull_rsi_os': 51, 'bull_rsi_ob': 47, 'bull_adx_thresh': 18.12810538420966, 'bull_atr_min_pct': 0.0017157202703217916, 'bull_atr_max_pct': 0.12252321526388163, 'bull_tp_mult': 2.5208907207954026, 'bull_tsl_mult': 0.5688061663982059, 'bull_time_stop': 186, 'bull_use_sma': False, 'bull_use_ema': True, 'bull_use_atr': False, 'bull_use_adx': False, 'bull_use_spike': True, 'bull_rsi_required': True, 'bear_strategy': 'breakout', 'bear_bb_std_mult': 2.8961093776514515, 'bear_rsi_os': 50, 'bear_rsi_ob': 75, 'bear_adx_thresh': 18.51511173940505, 'bear_atr_min_pct': 0.0022717256765945083, 'bear_atr_max_pct': 0.02758237159801856, 'bear_tp_mult': 2.7496516454649393, 'bear_tsl_mult': 0.7392706572530633, 'bear_time_stop': 188, 'bear_use_sma': True, 'bear_use_ema': True, 'bear_use_atr': False, 'bear_use_adx': False, 'bear_use_spike': True, 'bear_rsi_required': True, 'sideways_strategy': 'breakout', 'sideways_bb_std_mult': 1.1071567899562793, 'sideways_rsi_os': 18, 'sideways_rsi_ob': 94, 'sideways_adx_thresh': 19.79035043614712, 'sideways_atr_min_pct': 0.0018794064255809354, 'sideways_atr_max_pct': 0.02565717651451021, 'sideways_tp_mult': 1.7133947638629672, 'sideways_tsl_mult': 0.9470146438116122, 'sideways_time_stop': 58, 'sideways_use_sma': False, 'sideways_use_ema': True, 'sideways_use_atr': True, 'sideways_use_adx': True, 'sideways_use_spike': True, 'sideways_rsi_required': True}.
[I 2025-08-30 18:57:12,642] Trial 246 finished with values: [-0.02817514701869528, 0.028046459946326024] and parameters: {'p_sma': 17, 'p_std': 43, 'p_atr': 27, 'p_adx': 7, 'rsi_period': 22, 'ema1': 20, 'ema2': 31, 'slip_atr_k': 0.20991698653198862, 'slip_spread_k': 0.028741009709082582, 'spread_hl_frac': 0.023818666195166618, 'bb_std_mult': 2.1509369317405853, 'rsi_os': 46, 'rsi_ob': 85, 'vol_spike': 0.19731729523732439, 'adx_thresh': 33.96132104559709, 'atr_min_pct': 0.025498564170271763, 'atr_max_pct': 0.12085384202653374, 'tp_mult': 2.359128380702138, 'tsl_mult': 0.8121574583897254, 'strategy': 'mean_reversion', 'time_stop': 200, 'use_sma': False, 'use_atr': False, 'use_adx': True, 'use_ema': False, 'use_spike': True, 'rsi_required': False, 'edge_k': 1.3180184071672147, 'edge_cap': 0.4769236781776549, 'bull_strategy': 'mean_reversion', 'bull_bb_std_mult': 3.1993071861022164, 'bull_rsi_os': 12, 'bull_rsi_ob': 83, 'bull_adx_thresh': 29.76310186540777, 'bull_atr_min_pct': 0.0017471632538637223, 'bull_atr_max_pct': 0.11968331351329713, 'bull_tp_mult': 2.301663931740914, 'bull_tsl_mult': 0.5419286752987229, 'bull_time_stop': 183, 'bull_use_sma': False, 'bull_use_ema': True, 'bull_use_atr': False, 'bull_use_adx': False, 'bull_use_spike': True, 'bull_rsi_required': True, 'bear_strategy': 'breakout', 'bear_bb_std_mult': 3.263353026545712, 'bear_rsi_os': 52, 'bear_rsi_ob': 60, 'bear_adx_thresh': 23.339306090146373, 'bear_atr_min_pct': 0.01387565005765194, 'bear_atr_max_pct': 0.028603958736204187, 'bear_tp_mult': 2.6684584400193985, 'bear_tsl_mult': 0.7380991080240639, 'bear_time_stop': 269, 'bear_use_sma': True, 'bear_use_ema': True, 'bear_use_atr': False, 'bear_use_adx': False, 'bear_use_spike': True, 'bear_rsi_required': True, 'sideways_strategy': 'mean_reversion', 'sideways_bb_std_mult': 2.0602220727361202, 'sideways_rsi_os': 35, 'sideways_rsi_ob': 59, 'sideways_adx_thresh': 19.800366942516643, 'sideways_atr_min_pct': 0.0018948684088669512, 'sideways_atr_max_pct': 0.07182164249993568, 'sideways_tp_mult': 1.717518345631021, 'sideways_tsl_mult': 0.558506390907347, 'sideways_time_stop': 276, 'sideways_use_sma': False, 'sideways_use_ema': False, 'sideways_use_atr': True, 'sideways_use_adx': True, 'sideways_use_spike': True, 'sideways_rsi_required': False}.
[I 2025-08-30 18:57:13,167] Trial 247 finished with values: [-1000000000.0, 1000000000.0] and parameters: {'p_sma': 17, 'p_std': 29, 'p_atr': 25, 'p_adx': 19, 'rsi_period': 22, 'ema1': 10, 'ema2': 43, 'slip_atr_k': 0.2131151268476053, 'slip_spread_k': 0.03368755291193934, 'spread_hl_frac': 0.02394115378833478, 'bb_std_mult': 1.7077488811063801, 'rsi_os': 52, 'rsi_ob': 83, 'vol_spike': 0.26132690392974006, 'adx_thresh': 28.48616003858556, 'atr_min_pct': 0.0016563645278969662, 'atr_max_pct': 0.09695832714124064, 'tp_mult': 1.945826803530918, 'tsl_mult': 0.4519488915915095, 'strategy': 'mean_reversion', 'time_stop': 41, 'use_sma': False, 'use_atr': False, 'use_adx': True, 'use_ema': False, 'use_spike': True, 'rsi_required': False, 'edge_k': 0.09341794312464173, 'edge_cap': 0.47256559870088655, 'bull_strategy': 'mean_reversion', 'bull_bb_std_mult': 3.1856993507001947, 'bull_rsi_os': 32, 'bull_rsi_ob': 47, 'bull_adx_thresh': 19.641417701553387, 'bull_atr_min_pct': 0.001892796699483103, 'bull_atr_max_pct': 0.12155237494646172, 'bull_tp_mult': 2.7234254356766536, 'bull_tsl_mult': 0.8829357630629786, 'bull_time_stop': 181, 'bull_use_sma': False, 'bull_use_ema': True, 'bull_use_atr': False, 'bull_use_adx': False, 'bull_use_spike': True, 'bull_rsi_required': True, 'bear_strategy': 'breakout', 'bear_bb_std_mult': 2.9053035071359345, 'bear_rsi_os': 50, 'bear_rsi_ob': 56, 'bear_adx_thresh': 34.24448330413402, 'bear_atr_min_pct': 0.013922296021750701, 'bear_atr_max_pct': 0.02900290620960993, 'bear_tp_mult': 1.2076535095270762, 'bear_tsl_mult': 0.738816927405754, 'bear_time_stop': 190, 'bear_use_sma': True, 'bear_use_ema': True, 'bear_use_atr': False, 'bear_use_adx': False, 'bear_use_spike': True, 'bear_rsi_required': True, 'sideways_strategy': 'breakout', 'sideways_bb_std_mult': 2.095697971889704, 'sideways_rsi_os': 35, 'sideways_rsi_ob': 67, 'sideways_adx_thresh': 19.75521383416373, 'sideways_atr_min_pct': 0.0020098736013186183, 'sideways_atr_max_pct': 0.06120936750196593, 'sideways_tp_mult': 1.4532064925812629, 'sideways_tsl_mult': 0.814322798002236, 'sideways_time_stop': 276, 'sideways_use_sma': False, 'sideways_use_ema': False, 'sideways_use_atr': True, 'sideways_use_adx': True, 'sideways_use_spike': True, 'sideways_rsi_required': False}.
[I 2025-08-30 18:57:13,643] Trial 251 finished with values: [-1000000000.0, 1000000000.0] and parameters: {'p_sma': 35, 'p_std': 31, 'p_atr': 9, 'p_adx': 24, 'rsi_period': 15, 'ema1': 27, 'ema2': 32, 'slip_atr_k': 0.07337933350952945, 'slip_spread_k': 0.6802055599536753, 'spread_hl_frac': 0.005192525127333116, 'bb_std_mult': 2.2459152577018013, 'rsi_os': 50, 'rsi_ob': 84, 'vol_spike': 0.022012084912914398, 'adx_thresh': 33.816228774816764, 'atr_min_pct': 0.0026356594242828487, 'atr_max_pct': 0.12084568606137629, 'tp_mult': 2.358434089701796, 'tsl_mult': 0.7979392463733957, 'strategy': 'mean_reversion', 'time_stop': 300, 'use_sma': False, 'use_atr': True, 'use_adx': True, 'use_ema': False, 'use_spike': True, 'rsi_required': False, 'edge_k': 0.04034985197907161, 'edge_cap': 0.4906246365042309, 'bull_strategy': 'mean_reversion', 'bull_bb_std_mult': 2.597932646445428, 'bull_rsi_os': 38, 'bull_rsi_ob': 45, 'bull_adx_thresh': 5.728748166335492, 'bull_atr_min_pct': 0.027971710404137227, 'bull_atr_max_pct': 0.1153771348317122, 'bull_tp_mult': 2.505022771267969, 'bull_tsl_mult': 0.5012853990800442, 'bull_time_stop': 176, 'bull_use_sma': False, 'bull_use_ema': True, 'bull_use_atr': True, 'bull_use_adx': False, 'bull_use_spike': False, 'bull_rsi_required': True, 'bear_strategy': 'breakout', 'bear_bb_std_mult': 1.554728422744502, 'bear_rsi_os': 52, 'bear_rsi_ob': 84, 'bear_adx_thresh': 17.72869114102538, 'bear_atr_min_pct': 0.014342825455202188, 'bear_atr_max_pct': 0.0375884891028011, 'bear_tp_mult': 2.4108967563662222, 'bear_tsl_mult': 0.5257579717241779, 'bear_time_stop': 300, 'bear_use_sma': True, 'bear_use_ema': True, 'bear_use_atr': False, 'bear_use_adx': False, 'bear_use_spike': False, 'bear_rsi_required': False, 'sideways_strategy': 'mean_reversion', 'sideways_bb_std_mult': 3.227377377276727, 'sideways_rsi_os': 17, 'sideways_rsi_ob': 89, 'sideways_adx_thresh': 7.665922549348, 'sideways_atr_min_pct': 0.0024836667028862907, 'sideways_atr_max_pct': 0.1497196799506969, 'sideways_tp_mult': 1.716126217694238, 'sideways_tsl_mult': 0.99915338171347, 'sideways_time_stop': 93, 'sideways_use_sma': False, 'sideways_use_ema': True, 'sideways_use_atr': True, 'sideways_use_adx': False, 'sideways_use_spike': False, 'sideways_rsi_required': False}.
[I 2025-08-30 18:57:44,459] Trial 249 finished with values: [-1000000000.0, 1000000000.0] and parameters: {'p_sma': 17, 'p_std': 29, 'p_atr': 8, 'p_adx': 7, 'rsi_period': 27, 'ema1': 10, 'ema2': 32, 'slip_atr_k': 0.21224101973650966, 'slip_spread_k': 0.6795913861399903, 'spread_hl_frac': 0.009904060022367543, 'bb_std_mult': 2.257632655250524, 'rsi_os': 24, 'rsi_ob': 84, 'vol_spike': 0.19657436584974153, 'adx_thresh': 21.48549577834273, 'atr_min_pct': 0.0016113713684691895, 'atr_max_pct': 0.09141994753145266, 'tp_mult': 2.3623280843146355, 'tsl_mult': 0.45516903522081975, 'strategy': 'mean_reversion', 'time_stop': 25, 'use_sma': False, 'use_atr': True, 'use_adx': True, 'use_ema': False, 'use_spike': True, 'rsi_required': False, 'edge_k': 1.3253364891600898, 'edge_cap': 0.3576812398485457, 'bull_strategy': 'mean_reversion', 'bull_bb_std_mult': 2.5817697871017224, 'bull_rsi_os': 38, 'bull_rsi_ob': 83, 'bull_adx_thresh': 29.28686392937523, 'bull_atr_min_pct': 0.002076620348547966, 'bull_atr_max_pct': 0.12277399043071532, 'bull_tp_mult': 2.50203258594973, 'bull_tsl_mult': 0.8830761205326265, 'bull_time_stop': 178, 'bull_use_sma': False, 'bull_use_ema': True, 'bull_use_atr': True, 'bull_use_adx': False, 'bull_use_spike': False, 'bull_rsi_required': True, 'bear_strategy': 'mean_reversion', 'bear_bb_std_mult': 2.888125579646493, 'bear_rsi_os': 52, 'bear_rsi_ob': 74, 'bear_adx_thresh': 10.030382485245521, 'bear_atr_min_pct': 0.013999526982062459, 'bear_atr_max_pct': 0.027637386961387442, 'bear_tp_mult': 2.6980187340162605, 'bear_tsl_mult': 0.7286186609854063, 'bear_time_stop': 96, 'bear_use_sma': True, 'bear_use_ema': True, 'bear_use_atr': False, 'bear_use_adx': False, 'bear_use_spike': False, 'bear_rsi_required': False, 'sideways_strategy': 'breakout', 'sideways_bb_std_mult': 3.2299452516767504, 'sideways_rsi_os': 18, 'sideways_rsi_ob': 59, 'sideways_adx_thresh': 19.990907126422158, 'sideways_atr_min_pct': 0.0019827661310386803, 'sideways_atr_max_pct': 0.14989286180126787, 'sideways_tp_mult': 1.719021955829208, 'sideways_tsl_mult': 0.815648977565714, 'sideways_time_stop': 103, 'sideways_use_sma': False, 'sideways_use_ema': False, 'sideways_use_atr': True, 'sideways_use_adx': False, 'sideways_use_spike': False, 'sideways_rsi_required': False}.
[I 2025-08-30 18:57:44,874] Trial 248 finished with values: [-1000000000.0, 1000000000.0] and parameters: {'p_sma': 7, 'p_std': 29, 'p_atr': 9, 'p_adx': 24, 'rsi_period': 59, 'ema1': 23, 'ema2': 43, 'slip_atr_k': 0.07246236018245023, 'slip_spread_k': 0.21171416268866347, 'spread_hl_frac': 0.02393641675367264, 'bb_std_mult': 1.6687490442187154, 'rsi_os': 35, 'rsi_ob': 83, 'vol_spike': 0.12776368680875663, 'adx_thresh': 15.271511813648562, 'atr_min_pct': 0.025636807218922097, 'atr_max_pct': 0.09105771443167619, 'tp_mult': 1.5800536274153043, 'tsl_mult': 0.8095274714042247, 'strategy': 'mean_reversion', 'time_stop': 259, 'use_sma': False, 'use_atr': True, 'use_adx': True, 'use_ema': False, 'use_spike': True, 'rsi_required': False, 'edge_k': 0.08875818350289691, 'edge_cap': 0.4800666732492674, 'bull_strategy': 'mean_reversion', 'bull_bb_std_mult': 1.3756025336928586, 'bull_rsi_os': 40, 'bull_rsi_ob': 45, 'bull_adx_thresh': 29.58349957302978, 'bull_atr_min_pct': 0.014979108673026346, 'bull_atr_max_pct': 0.11544701457548928, 'bull_tp_mult': 1.8760710406287127, 'bull_tsl_mult': 0.5010711323747151, 'bull_time_stop': 178, 'bull_use_sma': False, 'bull_use_ema': True, 'bull_use_atr': True, 'bull_use_adx': False, 'bull_use_spike': False, 'bull_rsi_required': True, 'bear_strategy': 'mean_reversion', 'bear_bb_std_mult': 0.6940087658371008, 'bear_rsi_os': 52, 'bear_rsi_ob': 75, 'bear_adx_thresh': 15.892657649759519, 'bear_atr_min_pct': 0.01388076113507835, 'bear_atr_max_pct': 0.037503675134957386, 'bear_tp_mult': 2.701082783446005, 'bear_tsl_mult': 0.7334206148381291, 'bear_time_stop': 187, 'bear_use_sma': True, 'bear_use_ema': True, 'bear_use_atr': False, 'bear_use_adx': False, 'bear_use_spike': False, 'bear_rsi_required': False, 'sideways_strategy': 'breakout', 'sideways_bb_std_mult': 2.0799851566321736, 'sideways_rsi_os': 17, 'sideways_rsi_ob': 83, 'sideways_adx_thresh': 19.888058778288713, 'sideways_atr_min_pct': 0.001931495678330817, 'sideways_atr_max_pct': 0.06111573256860051, 'sideways_tp_mult': 2.071006822784731, 'sideways_tsl_mult': 0.37134829666939745, 'sideways_time_stop': 274, 'sideways_use_sma': False, 'sideways_use_ema': False, 'sideways_use_atr': True, 'sideways_use_adx': False, 'sideways_use_spike': False, 'sideways_rsi_required': False}.
[I 2025-08-30 18:57:45,273] Trial 250 finished with values: [-1000000000.0, 1000000000.0] and parameters: {'p_sma': 7, 'p_std': 29, 'p_atr': 9, 'p_adx': 19, 'rsi_period': 84, 'ema1': 27, 'ema2': 52, 'slip_atr_k': 0.07242929693719806, 'slip_spread_k': 0.21349993647221083, 'spread_hl_frac': 0.004927585244377079, 'bb_std_mult': 3.5524087072127526, 'rsi_os': 24, 'rsi_ob': 53, 'vol_spike': 0.04812013601687885, 'adx_thresh': 14.108115632181292, 'atr_min_pct': 0.001363298732015579, 'atr_max_pct': 0.09031169724188266, 'tp_mult': 2.352672892940343, 'tsl_mult': 0.033097200181787856, 'strategy': 'mean_reversion', 'time_stop': 199, 'use_sma': False, 'use_atr': False, 'use_adx': True, 'use_ema': False, 'use_spike': True, 'rsi_required': False, 'edge_k': 0.07107908302447713, 'edge_cap': 0.8189770627884247, 'bull_strategy': 'mean_reversion', 'bull_bb_std_mult': 3.174897438909131, 'bull_rsi_os': 38, 'bull_rsi_ob': 45, 'bull_adx_thresh': 5.773691758696943, 'bull_atr_min_pct': 0.002269700573535394, 'bull_atr_max_pct': 0.11493716967952555, 'bull_tp_mult': 1.8304223213522328, 'bull_tsl_mult': 0.9685542735022374, 'bull_time_stop': 114, 'bull_use_sma': False, 'bull_use_ema': True, 'bull_use_atr': True, 'bull_use_adx': False, 'bull_use_spike': False, 'bull_rsi_required': True, 'bear_strategy': 'breakout', 'bear_bb_std_mult': 3.2601222623748645, 'bear_rsi_os': 52, 'bear_rsi_ob': 81, 'bear_adx_thresh': 34.0838674661102, 'bear_atr_min_pct': 0.013811425004042845, 'bear_atr_max_pct': 0.02823414081201527, 'bear_tp_mult': 1.2128657047281854, 'bear_tsl_mult': 0.34396529849154445, 'bear_time_stop': 97, 'bear_use_sma': True, 'bear_use_ema': True, 'bear_use_atr': False, 'bear_use_adx': False, 'bear_use_spike': False, 'bear_rsi_required': False, 'sideways_strategy': 'breakout', 'sideways_bb_std_mult': 3.2285441765298484, 'sideways_rsi_os': 18, 'sideways_rsi_ob': 82, 'sideways_adx_thresh': 19.880564566432298, 'sideways_atr_min_pct': 0.009584680355415032, 'sideways_atr_max_pct': 0.14993487452864962, 'sideways_tp_mult': 2.0552870119669744, 'sideways_tsl_mult': 0.5961933576498406, 'sideways_time_stop': 92, 'sideways_use_sma': False, 'sideways_use_ema': False, 'sideways_use_atr': True, 'sideways_use_adx': False, 'sideways_use_spike': True, 'sideways_rsi_required': False}.
