[I 2025-08-30 19:11:53,505] Trial 380 finished with values: [-1000000000.0, 1000000000.0] and parameters: {'p_sma': 40, 'p_std': 30, 'p_atr': 9, 'p_adx': 20, 'rsi_period': 26, 'ema1': 27, 'ema2': 34, 'slip_atr_k': 0.06457219207839202, 'slip_spread_k': 0.15413035487200036, 'spread_hl_frac': 0.008232385494124504, 'bb_std_mult': 2.7949700377562676, 'rsi_os': 52, 'rsi_ob': 86, 'vol_spike': 0.27990434025883354, 'adx_thresh': 32.904091084099704, 'atr_min_pct': 0.02256544550085676, 'atr_max_pct': 0.1423353309568095, 'tp_mult': 2.221220018140543, 'tsl_mult': 0.44724396875681693, 'strategy': 'mean_reversion', 'time_stop': 71, 'use_sma': False, 'use_atr': True, 'use_adx': True, 'use_ema': False, 'use_spike': True, 'rsi_required': False, 'edge_k': 1.2860866027120041, 'edge_cap': 0.589455643716174, 'bull_strategy': 'mean_reversion', 'bull_bb_std_mult': 2.870021248836262, 'bull_rsi_os': 32, 'bull_rsi_ob': 46, 'bull_adx_thresh': 17.560868142327205, 'bull_atr_min_pct': 0.014204912148723114, 'bull_atr_max_pct': 0.05847175076127913, 'bull_tp_mult': 2.692644530158851, 'bull_tsl_mult': 0.4805774164864234, 'bull_time_stop': 169, 'bull_use_sma': False, 'bull_use_ema': True, 'bull_use_atr': True, 'bull_use_adx': False, 'bull_use_spike': False, 'bull_rsi_required': True, 'bear_strategy': 'breakout', 'bear_bb_std_mult': 3.0626402992404476, 'bear_rsi_os': 46, 'bear_rsi_ob': 88, 'bear_adx_thresh': 15.917568765249957, 'bear_atr_min_pct': 0.005442097169801263, 'bear_atr_max_pct': 0.13015361558722302, 'bear_tp_mult': 2.491891464454009, 'bear_tsl_mult': 0.7705781021921968, 'bear_time_stop': 8, 'bear_use_sma': True, 'bear_use_ema': True, 'bear_use_atr': True, 'bear_use_adx': False, 'bear_use_spike': False, 'bear_rsi_required': True, 'sideways_strategy': 'breakout', 'sideways_bb_std_mult': 3.3003597880115274, 'sideways_rsi_os': 25, 'sideways_rsi_ob': 45, 'sideways_adx_thresh': 20.378662389746122, 'sideways_atr_min_pct': 0.0006732422068019804, 'sideways_atr_max_pct': 0.08450888940833523, 'sideways_tp_mult': 1.0647142026664391, 'sideways_tsl_mult': 0.9370462942669079, 'sideways_time_stop': 99, 'sideways_use_sma': False, 'sideways_use_ema': True, 'sideways_use_atr': True, 'sideways_use_adx': False, 'sideways_use_spike': False, 'sideways_rsi_required': True}.
[I 2025-08-30 19:12:23,947] Trial 379 finished with values: [-1000000000.0, 1000000000.0] and parameters: {'p_sma': 35, 'p_std': 48, 'p_atr': 29, 'p_adx': 20, 'rsi_period': 22, 'ema1': 27, 'ema2': 33, 'slip_atr_k': 0.24027565458211061, 'slip_spread_k': 0.6904981340483769, 'spread_hl_frac': 3.919809981386274e-05, 'bb_std_mult': 2.216971139619582, 'rsi_os': 49, 'rsi_ob': 81, 'vol_spike': 0.2794048755327918, 'adx_thresh': 21.35081875033288, 'atr_min_pct': 0.014909536620369554, 'atr_max_pct': 0.13922904109215717, 'tp_mult': 2.2296545636013843, 'tsl_mult': 0.42547945200696385, 'strategy': 'mean_reversion', 'time_stop': 259, 'use_sma': False, 'use_atr': True, 'use_adx': True, 'use_ema': False, 'use_spike': True, 'rsi_required': False, 'edge_k': 0.9662060840967264, 'edge_cap': 0.6666167620428445, 'bull_strategy': 'mean_reversion', 'bull_bb_std_mult': 3.229199795066302, 'bull_rsi_os': 15, 'bull_rsi_ob': 47, 'bull_adx_thresh': 18.794493664868124, 'bull_atr_min_pct': 0.0006252495526653879, 'bull_atr_max_pct': 0.11430914842649188, 'bull_tp_mult': 2.717339371313706, 'bull_tsl_mult': 0.5440088532247912, 'bull_time_stop': 136, 'bull_use_sma': False, 'bull_use_ema': True, 'bull_use_atr': True, 'bull_use_adx': False, 'bull_use_spike': False, 'bull_rsi_required': True, 'bear_strategy': 'breakout', 'bear_bb_std_mult': 3.0357920799006735, 'bear_rsi_os': 48, 'bear_rsi_ob': 55, 'bear_adx_thresh': 19.189384522670988, 'bear_atr_min_pct': 0.016466445402671257, 'bear_atr_max_pct': 0.029852734980530683, 'bear_tp_mult': 1.1843678458580738, 'bear_tsl_mult': 0.7547414075573198, 'bear_time_stop': 83, 'bear_use_sma': True, 'bear_use_ema': True, 'bear_use_atr': True, 'bear_use_adx': False, 'bear_use_spike': False, 'bear_rsi_required': True, 'sideways_strategy': 'breakout', 'sideways_bb_std_mult': 1.165834334521501, 'sideways_rsi_os': 37, 'sideways_rsi_ob': 58, 'sideways_adx_thresh': 20.77345204725498, 'sideways_atr_min_pct': 0.011371741430482203, 'sideways_atr_max_pct': 0.08444087365913172, 'sideways_tp_mult': 1.5086630886090762, 'sideways_tsl_mult': 0.6057654939628658, 'sideways_time_stop': 146, 'sideways_use_sma': False, 'sideways_use_ema': True, 'sideways_use_atr': True, 'sideways_use_adx': False, 'sideways_use_spike': False, 'sideways_rsi_required': True}.
[I 2025-08-30 19:12:24,497] Trial 378 finished with values: [-1000000000.0, 1000000000.0] and parameters: {'p_sma': 34, 'p_std': 30, 'p_atr': 29, 'p_adx': 20, 'rsi_period': 22, 'ema1': 27, 'ema2': 21, 'slip_atr_k': 0.1831088214890838, 'slip_spread_k': 0.6678164381487801, 'spread_hl_frac': 3.9385103161877766e-05, 'bb_std_mult': 1.2153937308426186, 'rsi_os': 49, 'rsi_ob': 66, 'vol_spike': 0.2799904743817097, 'adx_thresh': 9.60725855233037, 'atr_min_pct': 0.01644948209369206, 'atr_max_pct': 0.04993882258912838, 'tp_mult': 2.8752200546786106, 'tsl_mult': 0.4419309981202519, 'strategy': 'mean_reversion', 'time_stop': 148, 'use_sma': False, 'use_atr': True, 'use_adx': True, 'use_ema': False, 'use_spike': True, 'rsi_required': False, 'edge_k': 0.9614832702749702, 'edge_cap': 0.5112034405903811, 'bull_strategy': 'mean_reversion', 'bull_bb_std_mult': 3.2135515129037953, 'bull_rsi_os': 32, 'bull_rsi_ob': 59, 'bull_adx_thresh': 18.763799166378647, 'bull_atr_min_pct': 0.013160758102432094, 'bull_atr_max_pct': 0.11427234647500868, 'bull_tp_mult': 2.706079736689929, 'bull_tsl_mult': 0.5494072075791608, 'bull_time_stop': 269, 'bull_use_sma': False, 'bull_use_ema': True, 'bull_use_atr': True, 'bull_use_adx': False, 'bull_use_spike': False, 'bull_rsi_required': True, 'bear_strategy': 'breakout', 'bear_bb_std_mult': 3.0311553928360393, 'bear_rsi_os': 49, 'bear_rsi_ob': 55, 'bear_adx_thresh': 15.445698288073812, 'bear_atr_min_pct': 0.016353377617133503, 'bear_atr_max_pct': 0.03964764159074617, 'bear_tp_mult': 2.2134172476410483, 'bear_tsl_mult': 0.017442711809706135, 'bear_time_stop': 85, 'bear_use_sma': True, 'bear_use_ema': True, 'bear_use_atr': True, 'bear_use_adx': False, 'bear_use_spike': False, 'bear_rsi_required': True, 'sideways_strategy': 'breakout', 'sideways_bb_std_mult': 3.0938781296019098, 'sideways_rsi_os': 49, 'sideways_rsi_ob': 58, 'sideways_adx_thresh': 32.18276477327561, 'sideways_atr_min_pct': 0.011150897755326848, 'sideways_atr_max_pct': 0.08386411215042512, 'sideways_tp_mult': 1.0131673633532439, 'sideways_tsl_mult': 0.5981075170367048, 'sideways_time_stop': 148, 'sideways_use_sma': False, 'sideways_use_ema': True, 'sideways_use_atr': True, 'sideways_use_adx': False, 'sideways_use_spike': False, 'sideways_rsi_required': True}.
[I 2025-08-30 19:12:27,363] Trial 382 finished with values: [-0.09752109485688265, 0.09760255609695792] and parameters: {'p_sma': 20, 'p_std': 28, 'p_atr': 8, 'p_adx': 20, 'rsi_period': 20, 'ema1': 11, 'ema2': 47, 'slip_atr_k': 0.18315033569123051, 'slip_spread_k': 0.6601881074282133, 'spread_hl_frac': 0.022670799602249173, 'bb_std_mult': 3.5938542838628464, 'rsi_os': 46, 'rsi_ob': 64, 'vol_spike': 0.27214029567335063, 'adx_thresh': 33.55992517822879, 'atr_min_pct': 0.002280844424838885, 'atr_max_pct': 0.048887381922983114, 'tp_mult': 2.2303375258937357, 'tsl_mult': 0.5985854625957082, 'strategy': 'mean_reversion', 'time_stop': 113, 'use_sma': False, 'use_atr': True, 'use_adx': True, 'use_ema': False, 'use_spike': True, 'rsi_required': False, 'edge_k': 0.21486508915580269, 'edge_cap': 0.5355829971717986, 'bull_strategy': 'breakout', 'bull_bb_std_mult': 1.3163327371972362, 'bull_rsi_os': 29, 'bull_rsi_ob': 92, 'bull_adx_thresh': 18.812019664246776, 'bull_atr_min_pct': 0.0015034291258693715, 'bull_atr_max_pct': 0.1148769301680329, 'bull_tp_mult': 2.735467998100112, 'bull_tsl_mult': 0.7890684096440289, 'bull_time_stop': 134, 'bull_use_sma': False, 'bull_use_ema': False, 'bull_use_atr': True, 'bull_use_adx': False, 'bull_use_spike': False, 'bull_rsi_required': True, 'bear_strategy': 'mean_reversion', 'bear_bb_std_mult': 2.9256651522472352, 'bear_rsi_os': 16, 'bear_rsi_ob': 59, 'bear_adx_thresh': 18.963487173277578, 'bear_atr_min_pct': 0.026212997238661016, 'bear_atr_max_pct': 0.02931186357761814, 'bear_tp_mult': 2.78409279798489, 'bear_tsl_mult': 0.5956532976225762, 'bear_time_stop': 184, 'bear_use_sma': True, 'bear_use_ema': False, 'bear_use_atr': False, 'bear_use_adx': False, 'bear_use_spike': False, 'bear_rsi_required': True, 'sideways_strategy': 'breakout', 'sideways_bb_std_mult': 1.0764892284292118, 'sideways_rsi_os': 34, 'sideways_rsi_ob': 61, 'sideways_adx_thresh': 20.87510637616578, 'sideways_atr_min_pct': 0.0010820724850696738, 'sideways_atr_max_pct': 0.14602726145091025, 'sideways_tp_mult': 2.8577019933954997, 'sideways_tsl_mult': 0.9786933570211878, 'sideways_time_stop': 54, 'sideways_use_sma': False, 'sideways_use_ema': False, 'sideways_use_atr': False, 'sideways_use_adx': False, 'sideways_use_spike': False, 'sideways_rsi_required': False}.
[I 2025-08-30 19:12:27,566] Trial 381 finished with values: [-1000000000.0, 1000000000.0] and parameters: {'p_sma': 20, 'p_std': 29, 'p_atr': 9, 'p_adx': 20, 'rsi_period': 57, 'ema1': 27, 'ema2': 46, 'slip_atr_k': 0.2427482753875947, 'slip_spread_k': 0.33412594070412555, 'spread_hl_frac': 0.037528896985593765, 'bb_std_mult': 2.6131157906801183, 'rsi_os': 46, 'rsi_ob': 53, 'vol_spike': 0.2782175701130798, 'adx_thresh': 21.174692625392844, 'atr_min_pct': 0.028779965352857158, 'atr_max_pct': 0.048784532571422415, 'tp_mult': 1.920953659341927, 'tsl_mult': 0.4439651302627235, 'strategy': 'mean_reversion', 'time_stop': 208, 'use_sma': False, 'use_atr': True, 'use_adx': True, 'use_ema': False, 'use_spike': True, 'rsi_required': False, 'edge_k': 1.2768666727059996, 'edge_cap': 0.8216952278701086, 'bull_strategy': 'mean_reversion', 'bull_bb_std_mult': 1.29446093523203, 'bull_rsi_os': 29, 'bull_rsi_ob': 67, 'bull_adx_thresh': 18.793944346179593, 'bull_atr_min_pct': 0.011205126652246315, 'bull_atr_max_pct': 0.13819465703649095, 'bull_tp_mult': 2.7354223568759743, 'bull_tsl_mult': 0.7838037233122854, 'bull_time_stop': 168, 'bull_use_sma': False, 'bull_use_ema': False, 'bull_use_atr': True, 'bull_use_adx': False, 'bull_use_spike': False, 'bull_rsi_required': True, 'bear_strategy': 'mean_reversion', 'bear_bb_std_mult': 2.9164524532240317, 'bear_rsi_os': 8, 'bear_rsi_ob': 91, 'bear_adx_thresh': 15.614157811695454, 'bear_atr_min_pct': 0.002807901292770308, 'bear_atr_max_pct': 0.01939363700396793, 'bear_tp_mult': 1.3832033887030923, 'bear_tsl_mult': 0.020479696392775193, 'bear_time_stop': 183, 'bear_use_sma': True, 'bear_use_ema': True, 'bear_use_atr': True, 'bear_use_adx': False, 'bear_use_spike': False, 'bear_rsi_required': True, 'sideways_strategy': 'breakout', 'sideways_bb_std_mult': 3.4851561013399337, 'sideways_rsi_os': 34, 'sideways_rsi_ob': 85, 'sideways_adx_thresh': 20.496869508402998, 'sideways_atr_min_pct': 0.02940585311951257, 'sideways_atr_max_pct': 0.14016502041182144, 'sideways_tp_mult': 1.066175148355734, 'sideways_tsl_mult': 0.9366426185225526, 'sideways_time_stop': 159, 'sideways_use_sma': False, 'sideways_use_ema': False, 'sideways_use_atr': False, 'sideways_use_adx': False, 'sideways_use_spike': False, 'sideways_rsi_required': True}.
[I 2025-08-30 19:12:58,903] Trial 383 finished with values: [-1000000000.0, 1000000000.0] and parameters: {'p_sma': 56, 'p_std': 29, 'p_atr': 8, 'p_adx': 20, 'rsi_period': 25, 'ema1': 11, 'ema2': 47, 'slip_atr_k': 0.16902424341607014, 'slip_spread_k': 0.6446995902066069, 'spread_hl_frac': 0.03740174980279503, 'bb_std_mult': 2.4055955464929357, 'rsi_os': 41, 'rsi_ob': 84, 'vol_spike': 0.2709293207014784, 'adx_thresh': 22.368598738623085, 'atr_min_pct': 0.023882162120560425, 'atr_max_pct': 0.0983915824845184, 'tp_mult': 1.9157740262339087, 'tsl_mult': 0.8524492372408713, 'strategy': 'mean_reversion', 'time_stop': 184, 'use_sma': False, 'use_atr': True, 'use_adx': True, 'use_ema': True, 'use_spike': True, 'rsi_required': False, 'edge_k': 0.23569084209894975, 'edge_cap': 0.533263972043097, 'bull_strategy': 'breakout', 'bull_bb_std_mult': 2.258124755900018, 'bull_rsi_os': 27, 'bull_rsi_ob': 88, 'bull_adx_thresh': 16.437827524243556, 'bull_atr_min_pct': 0.004012558569755827, 'bull_atr_max_pct': 0.10903576084307681, 'bull_tp_mult': 2.7557531538617592, 'bull_tsl_mult': 0.783900052866279, 'bull_time_stop': 184, 'bull_use_sma': False, 'bull_use_ema': False, 'bull_use_atr': True, 'bull_use_adx': False, 'bull_use_spike': False, 'bull_rsi_required': True, 'bear_strategy': 'mean_reversion', 'bear_bb_std_mult': 1.3364830638765297, 'bear_rsi_os': 50, 'bear_rsi_ob': 91, 'bear_adx_thresh': 17.04897402519225, 'bear_atr_min_pct': 0.02611897845609995, 'bear_atr_max_pct': 0.019418508111487154, 'bear_tp_mult': 2.7895752816261012, 'bear_tsl_mult': 0.9136975965572524, 'bear_time_stop': 190, 'bear_use_sma': False, 'bear_use_ema': False, 'bear_use_atr': False, 'bear_use_adx': False, 'bear_use_spike': True, 'bear_rsi_required': False, 'sideways_strategy': 'breakout', 'sideways_bb_std_mult': 1.2947635657178194, 'sideways_rsi_os': 41, 'sideways_rsi_ob': 55, 'sideways_adx_thresh': 25.290521611973404, 'sideways_atr_min_pct': 0.010378033849743106, 'sideways_atr_max_pct': 0.03784992508445852, 'sideways_tp_mult': 2.925995334095734, 'sideways_tsl_mult': 0.49729321703988927, 'sideways_time_stop': 158, 'sideways_use_sma': False, 'sideways_use_ema': False, 'sideways_use_atr': False, 'sideways_use_adx': False, 'sideways_use_spike': False, 'sideways_rsi_required': False}.
[I 2025-08-30 19:12:59,446] Trial 384 finished with values: [-0.07704847928035963, 0.07730589769851462] and parameters: {'p_sma': 43, 'p_std': 37, 'p_atr': 8, 'p_adx': 20, 'rsi_period': 20, 'ema1': 11, 'ema2': 31, 'slip_atr_k': 0.07625717791342272, 'slip_spread_k': 0.13145329349100923, 'spread_hl_frac': 0.02120822954353368, 'bb_std_mult': 1.7924695591441986, 'rsi_os': 45, 'rsi_ob': 84, 'vol_spike': 0.006732988951488911, 'adx_thresh': 22.129887105099932, 'atr_min_pct': 0.024031077821284927, 'atr_max_pct': 0.0963799858814541, 'tp_mult': 1.9077671896321589, 'tsl_mult': 0.9744999824697325, 'strategy': 'mean_reversion', 'time_stop': 83, 'use_sma': False, 'use_atr': True, 'use_adx': False, 'use_ema': True, 'use_spike': True, 'rsi_required': False, 'edge_k': 0.18592037927197358, 'edge_cap': 0.09255241272711262, 'bull_strategy': 'breakout', 'bull_bb_std_mult': 2.099420959302267, 'bull_rsi_os': 18, 'bull_rsi_ob': 86, 'bull_adx_thresh': 19.392476469305155, 'bull_atr_min_pct': 0.0015918473617904396, 'bull_atr_max_pct': 0.1250182202199167, 'bull_tp_mult': 2.7398362559220883, 'bull_tsl_mult': 0.5909308469703868, 'bull_time_stop': 188, 'bull_use_sma': False, 'bull_use_ema': False, 'bull_use_atr': True, 'bull_use_adx': False, 'bull_use_spike': False, 'bull_rsi_required': True, 'bear_strategy': 'mean_reversion', 'bear_bb_std_mult': 2.902199449492384, 'bear_rsi_os': 16, 'bear_rsi_ob': 46, 'bear_adx_thresh': 17.072717010402798, 'bear_atr_min_pct': 0.026866407564132028, 'bear_atr_max_pct': 0.034044020422232875, 'bear_tp_mult': 2.811771932531763, 'bear_tsl_mult': 0.9167429275833907, 'bear_time_stop': 188, 'bear_use_sma': False, 'bear_use_ema': False, 'bear_use_atr': False, 'bear_use_adx': False, 'bear_use_spike': True, 'bear_rsi_required': False, 'sideways_strategy': 'breakout', 'sideways_bb_std_mult': 3.1935007780089313, 'sideways_rsi_os': 34, 'sideways_rsi_ob': 56, 'sideways_adx_thresh': 29.076850309016947, 'sideways_atr_min_pct': 0.0011492707077307568, 'sideways_atr_max_pct': 0.015587002206554526, 'sideways_tp_mult': 1.8368625224253097, 'sideways_tsl_mult': 0.7752719321768576, 'sideways_time_stop': 157, 'sideways_use_sma': False, 'sideways_use_ema': False, 'sideways_use_atr': False, 'sideways_use_adx': False, 'sideways_use_spike': False, 'sideways_rsi_required': False}.
[I 2025-08-30 19:13:00,466] Trial 385 finished with values: [-1000000000.0, 1000000000.0] and parameters: {'p_sma': 13, 'p_std': 37, 'p_atr': 9, 'p_adx': 12, 'rsi_period': 16, 'ema1': 14, 'ema2': 31, 'slip_atr_k': 0.13614265942979975, 'slip_spread_k': 0.1272409712356634, 'spread_hl_frac': 0.03676691189777017, 'bb_std_mult': 2.075657453408458, 'rsi_os': 27, 'rsi_ob': 72, 'vol_spike': 0.2560640737192321, 'adx_thresh': 8.879575148402623, 'atr_min_pct': 0.012467350327302068, 'atr_max_pct': 0.09801079119077832, 'tp_mult': 1.9076027822005344, 'tsl_mult': 0.8491075648838595, 'strategy': 'breakout', 'time_stop': 183, 'use_sma': True, 'use_atr': True, 'use_adx': False, 'use_ema': True, 'use_spike': True, 'rsi_required': True, 'edge_k': 0.17988336514637054, 'edge_cap': 0.09899685813185294, 'bull_strategy': 'breakout', 'bull_bb_std_mult': 3.3122818701369474, 'bull_rsi_os': 31, 'bull_rsi_ob': 89, 'bull_adx_thresh': 16.24148452452208, 'bull_atr_min_pct': 0.0019136874013789703, 'bull_atr_max_pct': 0.12422131594738664, 'bull_tp_mult': 2.7639984874194874, 'bull_tsl_mult': 0.595648813564674, 'bull_time_stop': 190, 'bull_use_sma': False, 'bull_use_ema': False, 'bull_use_atr': False, 'bull_use_adx': False, 'bull_use_spike': True, 'bull_rsi_required': True, 'bear_strategy': 'mean_reversion', 'bear_bb_std_mult': 2.822856075779984, 'bear_rsi_os': 51, 'bear_rsi_ob': 76, 'bear_adx_thresh': 17.10918670121635, 'bear_atr_min_pct': 0.015039933140941267, 'bear_atr_max_pct': 0.023492497759105904, 'bear_tp_mult': 2.6700007784579918, 'bear_tsl_mult': 0.9052836116299035, 'bear_time_stop': 188, 'bear_use_sma': False, 'bear_use_ema': True, 'bear_use_atr': False, 'bear_use_adx': True, 'bear_use_spike': True, 'bear_rsi_required': False, 'sideways_strategy': 'breakout', 'sideways_bb_std_mult': 2.2229061225124376, 'sideways_rsi_os': 35, 'sideways_rsi_ob': 91, 'sideways_adx_thresh': 20.401589954762557, 'sideways_atr_min_pct': 0.010217762911775275, 'sideways_atr_max_pct': 0.13939081449520013, 'sideways_tp_mult': 1.9399618207883753, 'sideways_tsl_mult': 0.9804368125585031, 'sideways_time_stop': 160, 'sideways_use_sma': False, 'sideways_use_ema': False, 'sideways_use_atr': False, 'sideways_use_adx': False, 'sideways_use_spike': True, 'sideways_rsi_required': True}.
[I 2025-08-30 19:13:00,990] Trial 386 finished with values: [-1000000000.0, 1000000000.0] and parameters: {'p_sma': 7, 'p_std': 32, 'p_atr': 18, 'p_adx': 20, 'rsi_period': 26, 'ema1': 14, 'ema2': 58, 'slip_atr_k': 0.14487314322207442, 'slip_spread_k': 0.37790388184574497, 'spread_hl_frac': 0.006870757135314692, 'bb_std_mult': 2.102993005847418, 'rsi_os': 16, 'rsi_ob': 60, 'vol_spike': 0.2550717955313653, 'adx_thresh': 8.712690928660171, 'atr_min_pct': 0.023840064578187183, 'atr_max_pct': 0.0982307144486472, 'tp_mult': 2.9964643480793662, 'tsl_mult': 0.8540180093086893, 'strategy': 'breakout', 'time_stop': 184, 'use_sma': True, 'use_atr': False, 'use_adx': False, 'use_ema': True, 'use_spike': False, 'rsi_required': True, 'edge_k': 0.761194106468567, 'edge_cap': 0.7436572711435301, 'bull_strategy': 'breakout', 'bull_bb_std_mult': 3.3056491131451273, 'bull_rsi_os': 34, 'bull_rsi_ob': 45, 'bull_adx_thresh': 19.52078719056029, 'bull_atr_min_pct': 0.0018382805436576001, 'bull_atr_max_pct': 0.1092191905960278, 'bull_tp_mult': 2.8026169247415282, 'bull_tsl_mult': 0.8633193469523626, 'bull_time_stop': 185, 'bull_use_sma': True, 'bull_use_ema': True, 'bull_use_atr': False, 'bull_use_adx': False, 'bull_use_spike': True, 'bull_rsi_required': False, 'bear_strategy': 'breakout', 'bear_bb_std_mult': 2.8397673956877494, 'bear_rsi_os': 10, 'bear_rsi_ob': 77, 'bear_adx_thresh': 16.95138319133091, 'bear_atr_min_pct': 0.015286335119235557, 'bear_atr_max_pct': 0.03693965975220963, 'bear_tp_mult': 1.882723568060658, 'bear_tsl_mult': 0.6978370449862394, 'bear_time_stop': 190, 'bear_use_sma': False, 'bear_use_ema': False, 'bear_use_atr': False, 'bear_use_adx': True, 'bear_use_spike': True, 'bear_rsi_required': False, 'sideways_strategy': 'breakout', 'sideways_bb_std_mult': 0.5012095596453343, 'sideways_rsi_os': 37, 'sideways_rsi_ob': 55, 'sideways_adx_thresh': 13.224102118480506, 'sideways_atr_min_pct': 0.010355966953789241, 'sideways_atr_max_pct': 0.11679530308784608, 'sideways_tp_mult': 1.1083200248432843, 'sideways_tsl_mult': 0.9824636343231294, 'sideways_time_stop': 157, 'sideways_use_sma': True, 'sideways_use_ema': True, 'sideways_use_atr': True, 'sideways_use_adx': True, 'sideways_use_spike': True, 'sideways_rsi_required': False}.
