[I 2025-08-30 19:46:37,373] Trial 675 finished with values: [-0.03008773721812774, 0.030003885566459155] and parameters: {'p_sma': 40, 'p_std': 33, 'p_atr': 15, 'p_adx': 7, 'rsi_period': 20, 'ema1': 26, 'ema2': 30, 'slip_atr_k': 0.09846188654615022, 'slip_spread_k': 0.19325929461864663, 'spread_hl_frac': 0.024787461014756637, 'bb_std_mult': 2.440167176353917, 'rsi_os': 43, 'rsi_ob': 84, 'vol_spike': 0.20691571706042367, 'adx_thresh': 17.31580081811871, 'atr_min_pct': 0.013071154028917007, 'atr_max_pct': 0.08787339033028999, 'tp_mult': 2.227545046074837, 'tsl_mult': 0.28783004922519667, 'strategy': 'mean_reversion', 'time_stop': 189, 'use_sma': True, 'use_atr': False, 'use_adx': True, 'use_ema': False, 'use_spike': True, 'rsi_required': False, 'edge_k': 0.2018097239447963, 'edge_cap': 0.5026367152577034, 'bull_strategy': 'mean_reversion', 'bull_bb_std_mult': 1.7963191578120088, 'bull_rsi_os': 32, 'bull_rsi_ob': 57, 'bull_adx_thresh': 7.443520739939826, 'bull_atr_min_pct': 0.02180459701284254, 'bull_atr_max_pct': 0.119924514476746, 'bull_tp_mult': 2.671626612050338, 'bull_tsl_mult': 0.5204741156354635, 'bull_time_stop': 169, 'bull_use_sma': False, 'bull_use_ema': True, 'bull_use_atr': True, 'bull_use_adx': False, 'bull_use_spike': True, 'bull_rsi_required': True, 'bear_strategy': 'breakout', 'bear_bb_std_mult': 1.8384301616437484, 'bear_rsi_os': 51, 'bear_rsi_ob': 76, 'bear_adx_thresh': 12.292388275777313, 'bear_atr_min_pct': 0.024527872845135926, 'bear_atr_max_pct': 0.03004411978529059, 'bear_tp_mult': 1.7142692026279813, 'bear_tsl_mult': 0.33016771244007415, 'bear_time_stop': 210, 'bear_use_sma': False, 'bear_use_ema': True, 'bear_use_atr': True, 'bear_use_adx': False, 'bear_use_spike': True, 'bear_rsi_required': True, 'sideways_strategy': 'breakout', 'sideways_bb_std_mult': 3.176703211885746, 'sideways_rsi_os': 30, 'sideways_rsi_ob': 92, 'sideways_adx_thresh': 34.669595308082506, 'sideways_atr_min_pct': 0.0017448783978832095, 'sideways_atr_max_pct': 0.02616503937280658, 'sideways_tp_mult': 1.2082878238472938, 'sideways_tsl_mult': 0.20813667662426505, 'sideways_time_stop': 70, 'sideways_use_sma': False, 'sideways_use_ema': False, 'sideways_use_atr': False, 'sideways_use_adx': False, 'sideways_use_spike': False, 'sideways_rsi_required': False}.
[I 2025-08-30 19:46:38,075] Trial 676 finished with values: [-1000000000.0, 1000000000.0] and parameters: {'p_sma': 20, 'p_std': 50, 'p_atr': 17, 'p_adx': 18, 'rsi_period': 29, 'ema1': 26, 'ema2': 35, 'slip_atr_k': 0.09833407069259653, 'slip_spread_k': 0.08325797427017616, 'spread_hl_frac': 0.02419122536371635, 'bb_std_mult': 1.6915937225651763, 'rsi_os': 36, 'rsi_ob': 84, 'vol_spike': 0.04583339350085787, 'adx_thresh': 6.455275156625143, 'atr_min_pct': 0.028892479906862865, 'atr_max_pct': 0.09553277605312809, 'tp_mult': 2.2411730793389824, 'tsl_mult': 0.8492439466324812, 'strategy': 'mean_reversion', 'time_stop': 210, 'use_sma': True, 'use_atr': True, 'use_adx': True, 'use_ema': False, 'use_spike': True, 'rsi_required': False, 'edge_k': 0.24421924010280782, 'edge_cap': 0.054882924825795265, 'bull_strategy': 'mean_reversion', 'bull_bb_std_mult': 3.1870085922520173, 'bull_rsi_os': 31, 'bull_rsi_ob': 64, 'bull_adx_thresh': 17.401966125881984, 'bull_atr_min_pct': 0.021834811446190663, 'bull_atr_max_pct': 0.044353133359359295, 'bull_tp_mult': 2.891899094108207, 'bull_tsl_mult': 0.13370359583313463, 'bull_time_stop': 171, 'bull_use_sma': False, 'bull_use_ema': True, 'bull_use_atr': True, 'bull_use_adx': False, 'bull_use_spike': True, 'bull_rsi_required': True, 'bear_strategy': 'breakout', 'bear_bb_std_mult': 2.5048222294926186, 'bear_rsi_os': 51, 'bear_rsi_ob': 76, 'bear_adx_thresh': 19.002094601354234, 'bear_atr_min_pct': 0.027271121838860955, 'bear_atr_max_pct': 0.02689198436130736, 'bear_tp_mult': 2.672341397664619, 'bear_tsl_mult': 0.32916237001743787, 'bear_time_stop': 209, 'bear_use_sma': True, 'bear_use_ema': True, 'bear_use_atr': True, 'bear_use_adx': False, 'bear_use_spike': False, 'bear_rsi_required': True, 'sideways_strategy': 'breakout', 'sideways_bb_std_mult': 2.8411339534302695, 'sideways_rsi_os': 16, 'sideways_rsi_ob': 59, 'sideways_adx_thresh': 20.955758748960733, 'sideways_atr_min_pct': 0.028374987452637737, 'sideways_atr_max_pct': 0.09029119636785257, 'sideways_tp_mult': 1.3829600358856307, 'sideways_tsl_mult': 0.9998636866710958, 'sideways_time_stop': 168, 'sideways_use_sma': False, 'sideways_use_ema': True, 'sideways_use_atr': True, 'sideways_use_adx': False, 'sideways_use_spike': False, 'sideways_rsi_required': True}.
[I 2025-08-30 19:47:09,538] Trial 678 finished with values: [-1000000000.0, 1000000000.0] and parameters: {'p_sma': 59, 'p_std': 32, 'p_atr': 11, 'p_adx': 17, 'rsi_period': 20, 'ema1': 5, 'ema2': 27, 'slip_atr_k': 0.09804697734887284, 'slip_spread_k': 0.08105348912006652, 'spread_hl_frac': 0.024759852257495215, 'bb_std_mult': 2.1951118816081077, 'rsi_os': 49, 'rsi_ob': 66, 'vol_spike': 0.25849371144700334, 'adx_thresh': 16.19272300159979, 'atr_min_pct': 0.016230489095466545, 'atr_max_pct': 0.03859763003599431, 'tp_mult': 2.2310531434122165, 'tsl_mult': 0.8530426525258452, 'strategy': 'mean_reversion', 'time_stop': 188, 'use_sma': True, 'use_atr': True, 'use_adx': True, 'use_ema': False, 'use_spike': True, 'rsi_required': False, 'edge_k': 0.17319792962743769, 'edge_cap': 0.4766425203928679, 'bull_strategy': 'breakout', 'bull_bb_std_mult': 3.2479340013694777, 'bull_rsi_os': 42, 'bull_rsi_ob': 47, 'bull_adx_thresh': 7.934501988331947, 'bull_atr_min_pct': 0.017970587305949054, 'bull_atr_max_pct': 0.12312673010709196, 'bull_tp_mult': 2.029084978930776, 'bull_tsl_mult': 0.5181303713309309, 'bull_time_stop': 186, 'bull_use_sma': False, 'bull_use_ema': True, 'bull_use_atr': True, 'bull_use_adx': False, 'bull_use_spike': False, 'bull_rsi_required': True, 'bear_strategy': 'breakout', 'bear_bb_std_mult': 0.653450224082426, 'bear_rsi_os': 51, 'bear_rsi_ob': 80, 'bear_adx_thresh': 19.06562081349392, 'bear_atr_min_pct': 0.01375455123609678, 'bear_atr_max_pct': 0.04335992438189408, 'bear_tp_mult': 2.219746606137674, 'bear_tsl_mult': 0.775032813524437, 'bear_time_stop': 193, 'bear_use_sma': True, 'bear_use_ema': True, 'bear_use_atr': False, 'bear_use_adx': False, 'bear_use_spike': False, 'bear_rsi_required': True, 'sideways_strategy': 'breakout', 'sideways_bb_std_mult': 2.8531725485524446, 'sideways_rsi_os': 16, 'sideways_rsi_ob': 80, 'sideways_adx_thresh': 20.059215224931823, 'sideways_atr_min_pct': 0.02799076638741866, 'sideways_atr_max_pct': 0.13878489695554455, 'sideways_tp_mult': 1.0960352702257838, 'sideways_tsl_mult': 0.20832565572576822, 'sideways_time_stop': 109, 'sideways_use_sma': False, 'sideways_use_ema': True, 'sideways_use_atr': False, 'sideways_use_adx': False, 'sideways_use_spike': False, 'sideways_rsi_required': True}.
[I 2025-08-30 19:47:09,912] Trial 677 finished with values: [-1000000000.0, 1000000000.0] and parameters: {'p_sma': 21, 'p_std': 48, 'p_atr': 25, 'p_adx': 21, 'rsi_period': 20, 'ema1': 25, 'ema2': 22, 'slip_atr_k': 0.0794208301346801, 'slip_spread_k': 0.08586317950070421, 'spread_hl_frac': 0.010467210893496082, 'bb_std_mult': 2.0848003242351303, 'rsi_os': 49, 'rsi_ob': 84, 'vol_spike': 0.009583201812353115, 'adx_thresh': 26.305196002789692, 'atr_min_pct': 0.016976162695692597, 'atr_max_pct': 0.0958312009400064, 'tp_mult': 2.227756402168342, 'tsl_mult': 0.2866757072581495, 'strategy': 'breakout', 'time_stop': 77, 'use_sma': True, 'use_atr': True, 'use_adx': True, 'use_ema': False, 'use_spike': True, 'rsi_required': False, 'edge_k': 0.23908627599585341, 'edge_cap': 0.0526169719225249, 'bull_strategy': 'breakout', 'bull_bb_std_mult': 1.3248344657260749, 'bull_rsi_os': 29, 'bull_rsi_ob': 65, 'bull_adx_thresh': 26.053430214432485, 'bull_atr_min_pct': 0.01768786920985499, 'bull_atr_max_pct': 0.1230571445427555, 'bull_tp_mult': 1.5660547031969756, 'bull_tsl_mult': 0.9514842050773125, 'bull_time_stop': 172, 'bull_use_sma': False, 'bull_use_ema': True, 'bull_use_atr': True, 'bull_use_adx': False, 'bull_use_spike': False, 'bull_rsi_required': True, 'bear_strategy': 'breakout', 'bear_bb_std_mult': 0.7384336448411994, 'bear_rsi_os': 14, 'bear_rsi_ob': 83, 'bear_adx_thresh': 7.185840841646712, 'bear_atr_min_pct': 0.002195392722422156, 'bear_atr_max_pct': 0.1327756672876779, 'bear_tp_mult': 1.484731568920293, 'bear_tsl_mult': 0.7726379318503573, 'bear_time_stop': 96, 'bear_use_sma': True, 'bear_use_ema': True, 'bear_use_atr': False, 'bear_use_adx': True, 'bear_use_spike': False, 'bear_rsi_required': True, 'sideways_strategy': 'breakout', 'sideways_bb_std_mult': 1.2497916665894082, 'sideways_rsi_os': 42, 'sideways_rsi_ob': 60, 'sideways_adx_thresh': 19.956132420114358, 'sideways_atr_min_pct': 0.003122702080110295, 'sideways_atr_max_pct': 0.09339865003102173, 'sideways_tp_mult': 1.2012716064625106, 'sideways_tsl_mult': 0.18274846101572223, 'sideways_time_stop': 5, 'sideways_use_sma': False, 'sideways_use_ema': True, 'sideways_use_atr': True, 'sideways_use_adx': False, 'sideways_use_spike': False, 'sideways_rsi_required': True}.
[I 2025-08-30 19:47:12,835] Trial 680 finished with values: [-0.026612991779638495, 0.026827503904942766] and parameters: {'p_sma': 46, 'p_std': 48, 'p_atr': 10, 'p_adx': 17, 'rsi_period': 24, 'ema1': 25, 'ema2': 27, 'slip_atr_k': 0.031739259657299526, 'slip_spread_k': 0.04137470367968116, 'spread_hl_frac': 0.023389285723594465, 'bb_std_mult': 2.079927843583397, 'rsi_os': 50, 'rsi_ob': 82, 'vol_spike': 0.2604751568103434, 'adx_thresh': 23.726819607476507, 'atr_min_pct': 0.01696205651387818, 'atr_max_pct': 0.07696842859241197, 'tp_mult': 2.46108205017701, 'tsl_mult': 0.3791912692438403, 'strategy': 'breakout', 'time_stop': 77, 'use_sma': False, 'use_atr': True, 'use_adx': True, 'use_ema': False, 'use_spike': True, 'rsi_required': False, 'edge_k': 0.1433966164388857, 'edge_cap': 0.48255156559927936, 'bull_strategy': 'breakout', 'bull_bb_std_mult': 3.2610257947446444, 'bull_rsi_os': 55, 'bull_rsi_ob': 47, 'bull_adx_thresh': 19.329970608954255, 'bull_atr_min_pct': 0.0024086045640292477, 'bull_atr_max_pct': 0.12312237267369609, 'bull_tp_mult': 2.7674573495847454, 'bull_tsl_mult': 0.5066866155114331, 'bull_time_stop': 185, 'bull_use_sma': False, 'bull_use_ema': True, 'bull_use_atr': True, 'bull_use_adx': True, 'bull_use_spike': False, 'bull_rsi_required': False, 'bear_strategy': 'breakout', 'bear_bb_std_mult': 2.840590600328595, 'bear_rsi_os': 24, 'bear_rsi_ob': 79, 'bear_adx_thresh': 18.661047833841156, 'bear_atr_min_pct': 0.013874481643747234, 'bear_atr_max_pct': 0.03510465676930356, 'bear_tp_mult': 1.4875852935145035, 'bear_tsl_mult': 0.7758596033716096, 'bear_time_stop': 96, 'bear_use_sma': True, 'bear_use_ema': True, 'bear_use_atr': False, 'bear_use_adx': True, 'bear_use_spike': False, 'bear_rsi_required': False, 'sideways_strategy': 'breakout', 'sideways_bb_std_mult': 3.2228668424718325, 'sideways_rsi_os': 35, 'sideways_rsi_ob': 60, 'sideways_adx_thresh': 19.756804183586556, 'sideways_atr_min_pct': 0.0029191724168092037, 'sideways_atr_max_pct': 0.13935489931195724, 'sideways_tp_mult': 2.932523159079848, 'sideways_tsl_mult': 0.9206367753889733, 'sideways_time_stop': 294, 'sideways_use_sma': False, 'sideways_use_ema': True, 'sideways_use_atr': True, 'sideways_use_adx': False, 'sideways_use_spike': False, 'sideways_rsi_required': True}.
[I 2025-08-30 19:47:12,913] Trial 679 finished with values: [-1000000000.0, 1000000000.0] and parameters: {'p_sma': 58, 'p_std': 58, 'p_atr': 23, 'p_adx': 17, 'rsi_period': 57, 'ema1': 5, 'ema2': 27, 'slip_atr_k': 0.1526473964837794, 'slip_spread_k': 0.5461153184128129, 'spread_hl_frac': 0.023401349449868606, 'bb_std_mult': 2.06551027288818, 'rsi_os': 50, 'rsi_ob': 54, 'vol_spike': 0.25710136994886207, 'adx_thresh': 23.894878134499546, 'atr_min_pct': 0.001930765612398945, 'atr_max_pct': 0.09578870453238852, 'tp_mult': 2.182994957270489, 'tsl_mult': 0.8517645196619533, 'strategy': 'breakout', 'time_stop': 75, 'use_sma': False, 'use_atr': True, 'use_adx': True, 'use_ema': False, 'use_spike': True, 'rsi_required': False, 'edge_k': 0.13366548196755682, 'edge_cap': 0.6449748904009798, 'bull_strategy': 'breakout', 'bull_bb_std_mult': 1.5423176864436063, 'bull_rsi_os': 31, 'bull_rsi_ob': 62, 'bull_adx_thresh': 9.570326646046736, 'bull_atr_min_pct': 0.017947317275783872, 'bull_atr_max_pct': 0.1242002637632386, 'bull_tp_mult': 1.2111610552277519, 'bull_tsl_mult': 0.500230761629885, 'bull_time_stop': 185, 'bull_use_sma': False, 'bull_use_ema': True, 'bull_use_atr': True, 'bull_use_adx': False, 'bull_use_spike': False, 'bull_rsi_required': True, 'bear_strategy': 'breakout', 'bear_bb_std_mult': 2.16303921190471, 'bear_rsi_os': 24, 'bear_rsi_ob': 82, 'bear_adx_thresh': 24.961175035838476, 'bear_atr_min_pct': 0.027304375953465077, 'bear_atr_max_pct': 0.13961771359793035, 'bear_tp_mult': 2.204016152304643, 'bear_tsl_mult': 0.7753701764171973, 'bear_time_stop': 114, 'bear_use_sma': True, 'bear_use_ema': True, 'bear_use_atr': False, 'bear_use_adx': True, 'bear_use_spike': False, 'bear_rsi_required': True, 'sideways_strategy': 'breakout', 'sideways_bb_std_mult': 3.244628246619513, 'sideways_rsi_os': 34, 'sideways_rsi_ob': 49, 'sideways_adx_thresh': 20.056611955643607, 'sideways_atr_min_pct': 0.01834020142800208, 'sideways_atr_max_pct': 0.06988710782410783, 'sideways_tp_mult': 2.940677762168578, 'sideways_tsl_mult': 0.9594410430936005, 'sideways_time_stop': 295, 'sideways_use_sma': False, 'sideways_use_ema': True, 'sideways_use_atr': True, 'sideways_use_adx': False, 'sideways_use_spike': False, 'sideways_rsi_required': True}.
[I 2025-08-30 19:47:13,635] Trial 681 finished with values: [-1000000000.0, 1000000000.0] and parameters: {'p_sma': 7, 'p_std': 29, 'p_atr': 10, 'p_adx': 23, 'rsi_period': 57, 'ema1': 25, 'ema2': 37, 'slip_atr_k': 0.04577067163430326, 'slip_spread_k': 0.03850563665299167, 'spread_hl_frac': 0.023192311088093078, 'bb_std_mult': 2.0722805340249013, 'rsi_os': 22, 'rsi_ob': 93, 'vol_spike': 0.010541675646371707, 'adx_thresh': 32.90264613104828, 'atr_min_pct': 0.02691849222492171, 'atr_max_pct': 0.011709493483234842, 'tp_mult': 2.1759912829155215, 'tsl_mult': 0.3940143234179026, 'strategy': 'breakout', 'time_stop': 120, 'use_sma': False, 'use_atr': True, 'use_adx': True, 'use_ema': False, 'use_spike': True, 'rsi_required': False, 'edge_k': 0.14900545876043042, 'edge_cap': 0.5791231569763036, 'bull_strategy': 'mean_reversion', 'bull_bb_std_mult': 3.043245639802874, 'bull_rsi_os': 30, 'bull_rsi_ob': 45, 'bull_adx_thresh': 20.77293888378202, 'bull_atr_min_pct': 0.0022352552155561808, 'bull_atr_max_pct': 0.11557628006038875, 'bull_tp_mult': 1.4187972401968485, 'bull_tsl_mult': 0.5046489797571976, 'bull_time_stop': 215, 'bull_use_sma': False, 'bull_use_ema': True, 'bull_use_atr': True, 'bull_use_adx': True, 'bull_use_spike': False, 'bull_rsi_required': False, 'bear_strategy': 'breakout', 'bear_bb_std_mult': 3.2052329874280767, 'bear_rsi_os': 49, 'bear_rsi_ob': 79, 'bear_adx_thresh': 29.429971542379597, 'bear_atr_min_pct': 0.01646540152917362, 'bear_atr_max_pct': 0.0350375020442323, 'bear_tp_mult': 2.5383132935246966, 'bear_tsl_mult': 0.7279180630507707, 'bear_time_stop': 113, 'bear_use_sma': True, 'bear_use_ema': True, 'bear_use_atr': False, 'bear_use_adx': True, 'bear_use_spike': False, 'bear_rsi_required': False, 'sideways_strategy': 'breakout', 'sideways_bb_std_mult': 3.211702194690396, 'sideways_rsi_os': 21, 'sideways_rsi_ob': 59, 'sideways_adx_thresh': 21.543763426562982, 'sideways_atr_min_pct': 0.0029023696573785987, 'sideways_atr_max_pct': 0.06980885153153642, 'sideways_tp_mult': 2.550832395562217, 'sideways_tsl_mult': 0.9245170224914946, 'sideways_time_stop': 292, 'sideways_use_sma': False, 'sideways_use_ema': True, 'sideways_use_atr': True, 'sideways_use_adx': True, 'sideways_use_spike': False, 'sideways_rsi_required': True}.
[I 2025-08-30 19:47:43,759] Trial 682 finished with values: [-1000000000.0, 1000000000.0] and parameters: {'p_sma': 7, 'p_std': 13, 'p_atr': 10, 'p_adx': 23, 'rsi_period': 25, 'ema1': 25, 'ema2': 59, 'slip_atr_k': 0.04608447703941558, 'slip_spread_k': 0.1301055556811754, 'spread_hl_frac': 0.0030634212902280883, 'bb_std_mult': 2.1287726501011344, 'rsi_os': 47, 'rsi_ob': 69, 'vol_spike': 0.24036214502109754, 'adx_thresh': 9.062813236212916, 'atr_min_pct': 0.0046484140310615474, 'atr_max_pct': 0.013179655651601715, 'tp_mult': 2.45334377270529, 'tsl_mult': 0.10085715378993709, 'strategy': 'mean_reversion', 'time_stop': 181, 'use_sma': False, 'use_atr': True, 'use_adx': True, 'use_ema': False, 'use_spike': True, 'rsi_required': False, 'edge_k': 0.1275168000753071, 'edge_cap': 0.5698418723596046, 'bull_strategy': 'mean_reversion', 'bull_bb_std_mult': 3.0526372898004546, 'bull_rsi_os': 31, 'bull_rsi_ob': 81, 'bull_adx_thresh': 13.52272184972473, 'bull_atr_min_pct': 0.00046717085234691943, 'bull_atr_max_pct': 0.11553067422548029, 'bull_tp_mult': 2.7731218432022278, 'bull_tsl_mult': 0.5020787531193037, 'bull_time_stop': 280, 'bull_use_sma': False, 'bull_use_ema': True, 'bull_use_atr': True, 'bull_use_adx': True, 'bull_use_spike': False, 'bull_rsi_required': False, 'bear_strategy': 'breakout', 'bear_bb_std_mult': 1.7538342008154575, 'bear_rsi_os': 42, 'bear_rsi_ob': 79, 'bear_adx_thresh': 14.163320571687471, 'bear_atr_min_pct': 0.012419704683244734, 'bear_atr_max_pct': 0.03584200012844037, 'bear_tp_mult': 2.9163730785066013, 'bear_tsl_mult': 0.7285206679589035, 'bear_time_stop': 201, 'bear_use_sma': True, 'bear_use_ema': True, 'bear_use_atr': False, 'bear_use_adx': False, 'bear_use_spike': False, 'bear_rsi_required': False, 'sideways_strategy': 'breakout', 'sideways_bb_std_mult': 3.5970924900023995, 'sideways_rsi_os': 35, 'sideways_rsi_ob': 62, 'sideways_adx_thresh': 21.416399419325863, 'sideways_atr_min_pct': 0.0028937601081313455, 'sideways_atr_max_pct': 0.1470520595404179, 'sideways_tp_mult': 1.0439864434598676, 'sideways_tsl_mult': 0.9160700894479009, 'sideways_time_stop': 290, 'sideways_use_sma': False, 'sideways_use_ema': True, 'sideways_use_atr': True, 'sideways_use_adx': True, 'sideways_use_spike': False, 'sideways_rsi_required': True}.
[I 2025-08-30 19:47:44,738] Trial 684 finished with values: [-1000000000.0, 1000000000.0] and parameters: {'p_sma': 7, 'p_std': 6, 'p_atr': 8, 'p_adx': 23, 'rsi_period': 25, 'ema1': 15, 'ema2': 58, 'slip_atr_k': 0.04844280671271081, 'slip_spread_k': 0.13605631487870914, 'spread_hl_frac': 0.006453969599443304, 'bb_std_mult': 2.9412959260206084, 'rsi_os': 5, 'rsi_ob': 95, 'vol_spike': 0.1756652890908188, 'adx_thresh': 8.882041358799432, 'atr_min_pct': 0.025901477581303907, 'atr_max_pct': 0.14551866941741065, 'tp_mult': 2.3119637550821355, 'tsl_mult': 0.13396566484861833, 'strategy': 'mean_reversion', 'time_stop': 122, 'use_sma': False, 'use_atr': True, 'use_adx': True, 'use_ema': False, 'use_spike': True, 'rsi_required': True, 'edge_k': 0.0823502936932606, 'edge_cap': 0.5786667844012381, 'bull_strategy': 'mean_reversion', 'bull_bb_std_mult': 3.0158300283224597, 'bull_rsi_os': 30, 'bull_rsi_ob': 45, 'bull_adx_thresh': 11.053037399350387, 'bull_atr_min_pct': 0.0031078148794511868, 'bull_atr_max_pct': 0.14676576584182804, 'bull_tp_mult': 2.6461372028652086, 'bull_tsl_mult': 0.6603434148533635, 'bull_time_stop': 179, 'bull_use_sma': False, 'bull_use_ema': True, 'bull_use_atr': False, 'bull_use_adx': True, 'bull_use_spike': False, 'bull_rsi_required': False, 'bear_strategy': 'breakout', 'bear_bb_std_mult': 3.1607099204241296, 'bear_rsi_os': 49, 'bear_rsi_ob': 73, 'bear_adx_thresh': 17.453080101519475, 'bear_atr_min_pct': 0.00809494638236843, 'bear_atr_max_pct': 0.06035969879673321, 'bear_tp_mult': 1.3896243784704, 'bear_tsl_mult': 0.4347300330790307, 'bear_time_stop': 269, 'bear_use_sma': True, 'bear_use_ema': False, 'bear_use_atr': False, 'bear_use_adx': False, 'bear_use_spike': False, 'bear_rsi_required': False, 'sideways_strategy': 'breakout', 'sideways_bb_std_mult': 3.1628895372279726, 'sideways_rsi_os': 36, 'sideways_rsi_ob': 59, 'sideways_adx_thresh': 21.766770090346043, 'sideways_atr_min_pct': 0.029937544143622354, 'sideways_atr_max_pct': 0.1444732000921519, 'sideways_tp_mult': 1.0452846841158148, 'sideways_tsl_mult': 0.9511936851385786, 'sideways_time_stop': 179, 'sideways_use_sma': False, 'sideways_use_ema': False, 'sideways_use_atr': True, 'sideways_use_adx': True, 'sideways_use_spike': True, 'sideways_rsi_required': False}.
