[I 2025-08-30 19:41:26,408] Trial 631 finished with values: [-0.06724247134024897, 0.06717853522442249] and parameters: {'p_sma': 10, 'p_std': 51, 'p_atr': 10, 'p_adx': 20, 'rsi_period': 25, 'ema1': 27, 'ema2': 35, 'slip_atr_k': 0.08220694773845812, 'slip_spread_k': 0.09784919945357734, 'spread_hl_frac': 0.02432462510757721, 'bb_std_mult': 1.9808931995076475, 'rsi_os': 50, 'rsi_ob': 46, 'vol_spike': 0.2751261078370848, 'adx_thresh': 32.76045648900824, 'atr_min_pct': 0.024194851937204408, 'atr_max_pct': 0.1329392746274437, 'tp_mult': 1.253432042378713, 'tsl_mult': 0.8605111053187463, 'strategy': 'breakout', 'time_stop': 233, 'use_sma': False, 'use_atr': True, 'use_adx': False, 'use_ema': False, 'use_spike': False, 'rsi_required': True, 'edge_k': 0.3215575110336214, 'edge_cap': 0.49262215924581315, 'bull_strategy': 'mean_reversion', 'bull_bb_std_mult': 3.1927589538502565, 'bull_rsi_os': 11, 'bull_rsi_ob': 47, 'bull_adx_thresh': 30.38775086200959, 'bull_atr_min_pct': 0.0017942387467809993, 'bull_atr_max_pct': 0.01370945706778022, 'bull_tp_mult': 2.792698619933231, 'bull_tsl_mult': 0.2631870218735255, 'bull_time_stop': 188, 'bull_use_sma': False, 'bull_use_ema': True, 'bull_use_atr': True, 'bull_use_adx': False, 'bull_use_spike': False, 'bull_rsi_required': True, 'bear_strategy': 'mean_reversion', 'bear_bb_std_mult': 2.7468356926018846, 'bear_rsi_os': 38, 'bear_rsi_ob': 79, 'bear_adx_thresh': 17.8533109946052, 'bear_atr_min_pct': 0.01818531325308725, 'bear_atr_max_pct': 0.022346692685160187, 'bear_tp_mult': 2.510208087050227, 'bear_tsl_mult': 0.7950684796918208, 'bear_time_stop': 295, 'bear_use_sma': True, 'bear_use_ema': True, 'bear_use_atr': False, 'bear_use_adx': True, 'bear_use_spike': False, 'bear_rsi_required': False, 'sideways_strategy': 'breakout', 'sideways_bb_std_mult': 3.0943805296932263, 'sideways_rsi_os': 41, 'sideways_rsi_ob': 90, 'sideways_adx_thresh': 20.512886827463976, 'sideways_atr_min_pct': 0.0004806560193419073, 'sideways_atr_max_pct': 0.1470481773937821, 'sideways_tp_mult': 1.0428618428574679, 'sideways_tsl_mult': 0.9970514895710317, 'sideways_time_stop': 158, 'sideways_use_sma': False, 'sideways_use_ema': True, 'sideways_use_atr': True, 'sideways_use_adx': False, 'sideways_use_spike': False, 'sideways_rsi_required': True}.
[I 2025-08-30 19:41:26,723] Trial 630 finished with values: [-1000000000.0, 1000000000.0] and parameters: {'p_sma': 10, 'p_std': 27, 'p_atr': 10, 'p_adx': 14, 'rsi_period': 38, 'ema1': 27, 'ema2': 53, 'slip_atr_k': 0.08386102160930799, 'slip_spread_k': 0.12085058619766498, 'spread_hl_frac': 0.024212475673553963, 'bb_std_mult': 1.7697385740867706, 'rsi_os': 50, 'rsi_ob': 70, 'vol_spike': 0.27255821992701795, 'adx_thresh': 30.702668507659403, 'atr_min_pct': 0.011997158170572885, 'atr_max_pct': 0.016500590751654873, 'tp_mult': 2.2236968347784196, 'tsl_mult': 0.7541061819401553, 'strategy': 'breakout', 'time_stop': 300, 'use_sma': False, 'use_atr': True, 'use_adx': False, 'use_ema': False, 'use_spike': False, 'rsi_required': False, 'edge_k': 0.1550421278864645, 'edge_cap': 0.8062917630817736, 'bull_strategy': 'mean_reversion', 'bull_bb_std_mult': 3.253824809367775, 'bull_rsi_os': 13, 'bull_rsi_ob': 47, 'bull_adx_thresh': 23.50031430999878, 'bull_atr_min_pct': 0.0019083512846748388, 'bull_atr_max_pct': 0.046478022870863334, 'bull_tp_mult': 1.996052408925427, 'bull_tsl_mult': 0.5370542558153977, 'bull_time_stop': 182, 'bull_use_sma': False, 'bull_use_ema': True, 'bull_use_atr': True, 'bull_use_adx': False, 'bull_use_spike': False, 'bull_rsi_required': True, 'bear_strategy': 'mean_reversion', 'bear_bb_std_mult': 2.955206702955747, 'bear_rsi_os': 47, 'bear_rsi_ob': 58, 'bear_adx_thresh': 17.638796722875306, 'bear_atr_min_pct': 0.029952764947344418, 'bear_atr_max_pct': 0.033980874208891114, 'bear_tp_mult': 2.5467992434611255, 'bear_tsl_mult': 0.7437415630173894, 'bear_time_stop': 198, 'bear_use_sma': True, 'bear_use_ema': True, 'bear_use_atr': False, 'bear_use_adx': True, 'bear_use_spike': False, 'bear_rsi_required': False, 'sideways_strategy': 'breakout', 'sideways_bb_std_mult': 0.863503186619577, 'sideways_rsi_os': 36, 'sideways_rsi_ob': 59, 'sideways_adx_thresh': 29.07420812051989, 'sideways_atr_min_pct': 0.00409623519723939, 'sideways_atr_max_pct': 0.14587962759628315, 'sideways_tp_mult': 1.1891050634217963, 'sideways_tsl_mult': 0.9972809779902235, 'sideways_time_stop': 159, 'sideways_use_sma': False, 'sideways_use_ema': True, 'sideways_use_atr': True, 'sideways_use_adx': False, 'sideways_use_spike': False, 'sideways_rsi_required': True}.
[I 2025-08-30 19:41:27,691] Trial 632 finished with values: [-1000000000.0, 1000000000.0] and parameters: {'p_sma': 10, 'p_std': 45, 'p_atr': 10, 'p_adx': 20, 'rsi_period': 38, 'ema1': 25, 'ema2': 36, 'slip_atr_k': 0.06772848845904011, 'slip_spread_k': 0.12369050084608466, 'spread_hl_frac': 0.02430230939063295, 'bb_std_mult': 3.364748955861871, 'rsi_os': 18, 'rsi_ob': 63, 'vol_spike': 0.2766633587462892, 'adx_thresh': 27.078523643139942, 'atr_min_pct': 0.02431826558196047, 'atr_max_pct': 0.12707647438351766, 'tp_mult': 2.229938488768048, 'tsl_mult': 0.857314434576916, 'strategy': 'breakout', 'time_stop': 240, 'use_sma': False, 'use_atr': True, 'use_adx': False, 'use_ema': False, 'use_spike': False, 'rsi_required': False, 'edge_k': 1.710271497493356, 'edge_cap': 0.9071010063058399, 'bull_strategy': 'mean_reversion', 'bull_bb_std_mult': 1.4307893115471078, 'bull_rsi_os': 54, 'bull_rsi_ob': 68, 'bull_adx_thresh': 30.350239952118876, 'bull_atr_min_pct': 0.0018983196679442736, 'bull_atr_max_pct': 0.11243338689944343, 'bull_tp_mult': 2.787174783731343, 'bull_tsl_mult': 0.07532162283848204, 'bull_time_stop': 188, 'bull_use_sma': False, 'bull_use_ema': True, 'bull_use_atr': True, 'bull_use_adx': False, 'bull_use_spike': False, 'bull_rsi_required': True, 'bear_strategy': 'mean_reversion', 'bear_bb_std_mult': 1.6853289998267298, 'bear_rsi_os': 52, 'bear_rsi_ob': 78, 'bear_adx_thresh': 17.5810660210392, 'bear_atr_min_pct': 0.018021639502970574, 'bear_atr_max_pct': 0.034389319227568084, 'bear_tp_mult': 2.9598125458923663, 'bear_tsl_mult': 0.7919502630946743, 'bear_time_stop': 293, 'bear_use_sma': True, 'bear_use_ema': True, 'bear_use_atr': False, 'bear_use_adx': True, 'bear_use_spike': False, 'bear_rsi_required': True, 'sideways_strategy': 'mean_reversion', 'sideways_bb_std_mult': 3.2007764800884795, 'sideways_rsi_os': 36, 'sideways_rsi_ob': 90, 'sideways_adx_thresh': 9.450681836699571, 'sideways_atr_min_pct': 0.0011538027121505913, 'sideways_atr_max_pct': 0.14621872509332282, 'sideways_tp_mult': 1.1623099566162947, 'sideways_tsl_mult': 0.08142542230844824, 'sideways_time_stop': 162, 'sideways_use_sma': True, 'sideways_use_ema': True, 'sideways_use_atr': True, 'sideways_use_adx': False, 'sideways_use_spike': False, 'sideways_rsi_required': True}.
[I 2025-08-30 19:42:03,089] Trial 633 finished with values: [-1000000000.0, 1000000000.0] and parameters: {'p_sma': 10, 'p_std': 43, 'p_atr': 10, 'p_adx': 20, 'rsi_period': 24, 'ema1': 27, 'ema2': 24, 'slip_atr_k': 0.06933007660752585, 'slip_spread_k': 0.12482379218334569, 'spread_hl_frac': 0.023865030031808777, 'bb_std_mult': 2.251022380321768, 'rsi_os': 18, 'rsi_ob': 70, 'vol_spike': 0.27338100825160794, 'adx_thresh': 11.950509373025518, 'atr_min_pct': 0.021357828918556067, 'atr_max_pct': 0.1266680517247706, 'tp_mult': 2.2400098293657034, 'tsl_mult': 0.8584543012241856, 'strategy': 'breakout', 'time_stop': 198, 'use_sma': False, 'use_atr': True, 'use_adx': False, 'use_ema': False, 'use_spike': True, 'rsi_required': False, 'edge_k': 1.7164185984417384, 'edge_cap': 0.4922647421715469, 'bull_strategy': 'mean_reversion', 'bull_bb_std_mult': 3.270964670473628, 'bull_rsi_os': 26, 'bull_rsi_ob': 68, 'bull_adx_thresh': 23.700399196309228, 'bull_atr_min_pct': 0.014662482086735313, 'bull_atr_max_pct': 0.07751097887779941, 'bull_tp_mult': 2.7931594740289323, 'bull_tsl_mult': 0.557847479001584, 'bull_time_stop': 188, 'bull_use_sma': False, 'bull_use_ema': True, 'bull_use_atr': True, 'bull_use_adx': False, 'bull_use_spike': False, 'bull_rsi_required': True, 'bear_strategy': 'mean_reversion', 'bear_bb_std_mult': 1.6940530892466723, 'bear_rsi_os': 47, 'bear_rsi_ob': 79, 'bear_adx_thresh': 16.11988695184874, 'bear_atr_min_pct': 0.007275494928237787, 'bear_atr_max_pct': 0.10904232880038828, 'bear_tp_mult': 2.7602557228250886, 'bear_tsl_mult': 0.7829319804251189, 'bear_time_stop': 164, 'bear_use_sma': False, 'bear_use_ema': True, 'bear_use_atr': False, 'bear_use_adx': True, 'bear_use_spike': False, 'bear_rsi_required': True, 'sideways_strategy': 'mean_reversion', 'sideways_bb_std_mult': 2.2996557800951574, 'sideways_rsi_os': 41, 'sideways_rsi_ob': 89, 'sideways_adx_thresh': 21.27852152531181, 'sideways_atr_min_pct': 0.0010893496091279268, 'sideways_atr_max_pct': 0.14744155347377028, 'sideways_tp_mult': 2.0981365327118238, 'sideways_tsl_mult': 0.09382799544960851, 'sideways_time_stop': 168, 'sideways_use_sma': True, 'sideways_use_ema': True, 'sideways_use_atr': True, 'sideways_use_adx': False, 'sideways_use_spike': False, 'sideways_rsi_required': True}.
[I 2025-08-30 19:42:03,315] Trial 636 finished with values: [-1000000000.0, 1000000000.0] and parameters: {'p_sma': 5, 'p_std': 43, 'p_atr': 7, 'p_adx': 13, 'rsi_period': 73, 'ema1': 26, 'ema2': 31, 'slip_atr_k': 0.07077018666215773, 'slip_spread_k': 0.1601883342511307, 'spread_hl_frac': 0.014171136176929399, 'bb_std_mult': 2.243988282631277, 'rsi_os': 33, 'rsi_ob': 82, 'vol_spike': 0.2571020294023014, 'adx_thresh': 5.021759350948045, 'atr_min_pct': 0.02100412675579743, 'atr_max_pct': 0.08920902352734322, 'tp_mult': 1.4257041645855435, 'tsl_mult': 0.4830123056906384, 'strategy': 'mean_reversion', 'time_stop': 197, 'use_sma': False, 'use_atr': False, 'use_adx': True, 'use_ema': False, 'use_spike': True, 'rsi_required': False, 'edge_k': 1.6008624299983756, 'edge_cap': 0.718140154267491, 'bull_strategy': 'mean_reversion', 'bull_bb_std_mult': 3.103876681409772, 'bull_rsi_os': 7, 'bull_rsi_ob': 55, 'bull_adx_thresh': 31.988275542414826, 'bull_atr_min_pct': 0.0007073219210602898, 'bull_atr_max_pct': 0.12202343936518951, 'bull_tp_mult': 2.6990112364446217, 'bull_tsl_mult': 0.5598585522835673, 'bull_time_stop': 165, 'bull_use_sma': True, 'bull_use_ema': False, 'bull_use_atr': True, 'bull_use_adx': False, 'bull_use_spike': False, 'bull_rsi_required': True, 'bear_strategy': 'breakout', 'bear_bb_std_mult': 2.8313608684816356, 'bear_rsi_os': 49, 'bear_rsi_ob': 74, 'bear_adx_thresh': 16.147690035778396, 'bear_atr_min_pct': 0.006913669700051807, 'bear_atr_max_pct': 0.028253090831598993, 'bear_tp_mult': 2.642292125997049, 'bear_tsl_mult': 0.30174281539115744, 'bear_time_stop': 109, 'bear_use_sma': False, 'bear_use_ema': True, 'bear_use_atr': False, 'bear_use_adx': False, 'bear_use_spike': False, 'bear_rsi_required': True, 'sideways_strategy': 'mean_reversion', 'sideways_bb_std_mult': 2.6815602421801374, 'sideways_rsi_os': 29, 'sideways_rsi_ob': 62, 'sideways_adx_thresh': 21.10408799875049, 'sideways_atr_min_pct': 0.01437309341452176, 'sideways_atr_max_pct': 0.14280307264334627, 'sideways_tp_mult': 1.4729199953543815, 'sideways_tsl_mult': 0.6212981926645732, 'sideways_time_stop': 12, 'sideways_use_sma': True, 'sideways_use_ema': True, 'sideways_use_atr': False, 'sideways_use_adx': False, 'sideways_use_spike': True, 'sideways_rsi_required': True}.
[I 2025-08-30 19:42:03,414] Trial 635 finished with values: [-1000000000.0, 1000000000.0] and parameters: {'p_sma': 5, 'p_std': 30, 'p_atr': 7, 'p_adx': 20, 'rsi_period': 23, 'ema1': 26, 'ema2': 24, 'slip_atr_k': 0.06914804561793886, 'slip_spread_k': 0.16407650073304947, 'spread_hl_frac': 0.02338685217911684, 'bb_std_mult': 2.252898595197594, 'rsi_os': 49, 'rsi_ob': 62, 'vol_spike': 0.24539425111653074, 'adx_thresh': 8.348874402184796, 'atr_min_pct': 0.014368294535221041, 'atr_max_pct': 0.06173473619805996, 'tp_mult': 1.5622352394636727, 'tsl_mult': 0.9314767737076115, 'strategy': 'mean_reversion', 'time_stop': 241, 'use_sma': False, 'use_atr': True, 'use_adx': True, 'use_ema': False, 'use_spike': True, 'rsi_required': False, 'edge_k': 0.6792075828108302, 'edge_cap': 0.40225903117073925, 'bull_strategy': 'mean_reversion', 'bull_bb_std_mult': 1.6084571390236164, 'bull_rsi_os': 50, 'bull_rsi_ob': 48, 'bull_adx_thresh': 14.383171851961231, 'bull_atr_min_pct': 0.000605778910534701, 'bull_atr_max_pct': 0.057594360324560716, 'bull_tp_mult': 2.7707634456192123, 'bull_tsl_mult': 0.5636070161867301, 'bull_time_stop': 202, 'bull_use_sma': False, 'bull_use_ema': False, 'bull_use_atr': True, 'bull_use_adx': False, 'bull_use_spike': False, 'bull_rsi_required': True, 'bear_strategy': 'breakout', 'bear_bb_std_mult': 2.315386311727259, 'bear_rsi_os': 52, 'bear_rsi_ob': 73, 'bear_adx_thresh': 16.217166079276595, 'bear_atr_min_pct': 0.015404632908192726, 'bear_atr_max_pct': 0.029090600366439175, 'bear_tp_mult': 2.647797944023829, 'bear_tsl_mult': 0.7757878189867308, 'bear_time_stop': 166, 'bear_use_sma': False, 'bear_use_ema': True, 'bear_use_atr': False, 'bear_use_adx': False, 'bear_use_spike': False, 'bear_rsi_required': True, 'sideways_strategy': 'mean_reversion', 'sideways_bb_std_mult': 3.329374210303375, 'sideways_rsi_os': 44, 'sideways_rsi_ob': 74, 'sideways_adx_thresh': 21.312910645638365, 'sideways_atr_min_pct': 0.014343071670731063, 'sideways_atr_max_pct': 0.09564356930368956, 'sideways_tp_mult': 1.0729191299624514, 'sideways_tsl_mult': 0.8491180319371765, 'sideways_time_stop': 198, 'sideways_use_sma': True, 'sideways_use_ema': True, 'sideways_use_atr': False, 'sideways_use_adx': False, 'sideways_use_spike': True, 'sideways_rsi_required': True}.
[I 2025-08-30 19:42:03,548] Trial 634 finished with values: [-1000000000.0, 1000000000.0] and parameters: {'p_sma': 7, 'p_std': 30, 'p_atr': 22, 'p_adx': 26, 'rsi_period': 23, 'ema1': 24, 'ema2': 24, 'slip_atr_k': 0.06966394219574902, 'slip_spread_k': 0.5184361122544309, 'spread_hl_frac': 0.002102898630993298, 'bb_std_mult': 2.2357877728789965, 'rsi_os': 18, 'rsi_ob': 82, 'vol_spike': 0.2564544510070029, 'adx_thresh': 33.37117478760114, 'atr_min_pct': 0.02099469292657196, 'atr_max_pct': 0.06362111855974566, 'tp_mult': 1.471932999750028, 'tsl_mult': 0.485409157062911, 'strategy': 'mean_reversion', 'time_stop': 199, 'use_sma': False, 'use_atr': True, 'use_adx': True, 'use_ema': False, 'use_spike': True, 'rsi_required': False, 'edge_k': 0.1717001808325329, 'edge_cap': 0.8043954438082713, 'bull_strategy': 'mean_reversion', 'bull_bb_std_mult': 2.917175916998355, 'bull_rsi_os': 24, 'bull_rsi_ob': 47, 'bull_adx_thresh': 23.697902798374617, 'bull_atr_min_pct': 0.014555011146686676, 'bull_atr_max_pct': 0.11171946766877991, 'bull_tp_mult': 2.418403324145057, 'bull_tsl_mult': 0.5358859631240132, 'bull_time_stop': 202, 'bull_use_sma': False, 'bull_use_ema': False, 'bull_use_atr': True, 'bull_use_adx': False, 'bull_use_spike': False, 'bull_rsi_required': True, 'bear_strategy': 'breakout', 'bear_bb_std_mult': 0.9307790647395591, 'bear_rsi_os': 45, 'bear_rsi_ob': 58, 'bear_adx_thresh': 16.48011336522441, 'bear_atr_min_pct': 0.007206563169394183, 'bear_atr_max_pct': 0.12364334630640432, 'bear_tp_mult': 2.6390134014698163, 'bear_tsl_mult': 0.7764948326345514, 'bear_time_stop': 151, 'bear_use_sma': False, 'bear_use_ema': True, 'bear_use_atr': False, 'bear_use_adx': False, 'bear_use_spike': False, 'bear_rsi_required': True, 'sideways_strategy': 'mean_reversion', 'sideways_bb_std_mult': 3.195664796141586, 'sideways_rsi_os': 37, 'sideways_rsi_ob': 62, 'sideways_adx_thresh': 21.268973182535305, 'sideways_atr_min_pct': 0.0012730101573004645, 'sideways_atr_max_pct': 0.14482123880078798, 'sideways_tp_mult': 2.105401252164019, 'sideways_tsl_mult': 0.9757628063510358, 'sideways_time_stop': 135, 'sideways_use_sma': True, 'sideways_use_ema': True, 'sideways_use_atr': False, 'sideways_use_adx': False, 'sideways_use_spike': True, 'sideways_rsi_required': True}.
[I 2025-08-30 19:42:37,736] Trial 639 finished with values: [-0.018843187057360433, 0.01879978974173393] and parameters: {'p_sma': 8, 'p_std': 35, 'p_atr': 22, 'p_adx': 26, 'rsi_period': 27, 'ema1': 21, 'ema2': 16, 'slip_atr_k': 0.1847636863040038, 'slip_spread_k': 0.4108154193817208, 'spread_hl_frac': 0.025967841596830552, 'bb_std_mult': 2.083204326558882, 'rsi_os': 46, 'rsi_ob': 93, 'vol_spike': 0.26716228157963035, 'adx_thresh': 32.97355860860859, 'atr_min_pct': 0.02207946069314371, 'atr_max_pct': 0.09066469270591221, 'tp_mult': 2.5128518485836944, 'tsl_mult': 0.8965424520640746, 'strategy': 'mean_reversion', 'time_stop': 188, 'use_sma': True, 'use_atr': True, 'use_adx': True, 'use_ema': False, 'use_spike': True, 'rsi_required': True, 'edge_k': 0.17478698916301716, 'edge_cap': 0.6396215065518449, 'bull_strategy': 'breakout', 'bull_bb_std_mult': 3.1035769853790587, 'bull_rsi_os': 24, 'bull_rsi_ob': 51, 'bull_adx_thresh': 19.252550548369218, 'bull_atr_min_pct': 0.0025709748337871844, 'bull_atr_max_pct': 0.11743652775835225, 'bull_tp_mult': 1.852928537823262, 'bull_tsl_mult': 0.998625796913849, 'bull_time_stop': 86, 'bull_use_sma': False, 'bull_use_ema': True, 'bull_use_atr': True, 'bull_use_adx': True, 'bull_use_spike': True, 'bull_rsi_required': False, 'bear_strategy': 'breakout', 'bear_bb_std_mult': 0.9074649862911135, 'bear_rsi_os': 54, 'bear_rsi_ob': 76, 'bear_adx_thresh': 31.814846566509154, 'bear_atr_min_pct': 0.012671254943584776, 'bear_atr_max_pct': 0.10437509883696793, 'bear_tp_mult': 1.7053659022724155, 'bear_tsl_mult': 0.7575715791299801, 'bear_time_stop': 239, 'bear_use_sma': True, 'bear_use_ema': False, 'bear_use_atr': False, 'bear_use_adx': False, 'bear_use_spike': True, 'bear_rsi_required': True, 'sideways_strategy': 'breakout', 'sideways_bb_std_mult': 2.881706050640134, 'sideways_rsi_os': 38, 'sideways_rsi_ob': 81, 'sideways_adx_thresh': 6.086598096119257, 'sideways_atr_min_pct': 0.0017877128087399664, 'sideways_atr_max_pct': 0.053551329948680074, 'sideways_tp_mult': 2.042266397244916, 'sideways_tsl_mult': 0.9735425076097928, 'sideways_time_stop': 55, 'sideways_use_sma': False, 'sideways_use_ema': False, 'sideways_use_atr': True, 'sideways_use_adx': False, 'sideways_use_spike': False, 'sideways_rsi_required': False}.
[I 2025-08-30 19:42:37,909] Trial 640 finished with values: [-0.06279416127808402, 0.06271532243922863] and parameters: {'p_sma': 52, 'p_std': 31, 'p_atr': 9, 'p_adx': 21, 'rsi_period': 27, 'ema1': 16, 'ema2': 34, 'slip_atr_k': 0.1374791602775258, 'slip_spread_k': 0.9537362221567417, 'spread_hl_frac': 0.021033293286974418, 'bb_std_mult': 2.0858876914161915, 'rsi_os': 47, 'rsi_ob': 81, 'vol_spike': 0.26497010424698225, 'adx_thresh': 25.67151813495403, 'atr_min_pct': 0.009336783477890348, 'atr_max_pct': 0.08584649057719722, 'tp_mult': 1.0757985700978405, 'tsl_mult': 0.8324849518783802, 'strategy': 'mean_reversion', 'time_stop': 187, 'use_sma': True, 'use_atr': False, 'use_adx': True, 'use_ema': False, 'use_spike': True, 'rsi_required': True, 'edge_k': 0.10029428287772528, 'edge_cap': 0.5350640421543921, 'bull_strategy': 'breakout', 'bull_bb_std_mult': 3.010034827594582, 'bull_rsi_os': 33, 'bull_rsi_ob': 45, 'bull_adx_thresh': 19.18600516822747, 'bull_atr_min_pct': 0.020051264633555797, 'bull_atr_max_pct': 0.08329920467665601, 'bull_tp_mult': 2.676220025493998, 'bull_tsl_mult': 0.48019701324446895, 'bull_time_stop': 136, 'bull_use_sma': True, 'bull_use_ema': True, 'bull_use_atr': True, 'bull_use_adx': True, 'bull_use_spike': True, 'bull_rsi_required': False, 'bear_strategy': 'breakout', 'bear_bb_std_mult': 2.897722255708426, 'bear_rsi_os': 27, 'bear_rsi_ob': 76, 'bear_adx_thresh': 17.19287015707704, 'bear_atr_min_pct': 0.0058773377361433475, 'bear_atr_max_pct': 0.03748029176395435, 'bear_tp_mult': 2.8356757192226905, 'bear_tsl_mult': 0.9957623038183883, 'bear_time_stop': 253, 'bear_use_sma': True, 'bear_use_ema': False, 'bear_use_atr': True, 'bear_use_adx': False, 'bear_use_spike': True, 'bear_rsi_required': True, 'sideways_strategy': 'breakout', 'sideways_bb_std_mult': 2.182480949630046, 'sideways_rsi_os': 51, 'sideways_rsi_ob': 56, 'sideways_adx_thresh': 20.23813686245617, 'sideways_atr_min_pct': 0.0020556217125992228, 'sideways_atr_max_pct': 0.14322328237125143, 'sideways_tp_mult': 2.999037182168973, 'sideways_tsl_mult': 0.9007627774140381, 'sideways_time_stop': 75, 'sideways_use_sma': False, 'sideways_use_ema': False, 'sideways_use_atr': True, 'sideways_use_adx': False, 'sideways_use_spike': False, 'sideways_rsi_required': False}.
