[I 2025-08-30 18:45:48,883] Trial 145 finished with values: [-1000000000.0, 1000000000.0] and parameters: {'p_sma': 5, 'p_std': 36, 'p_atr': 7, 'p_adx': 21, 'rsi_period': 54, 'ema1': 24, 'ema2': 32, 'slip_atr_k': 0.041272681392755944, 'slip_spread_k': 0.5427831565242096, 'spread_hl_frac': 0.021028909420475358, 'bb_std_mult': 2.058846503696601, 'rsi_os': 42, 'rsi_ob': 86, 'vol_spike': 0.24420734076011621, 'adx_thresh': 6.4715902809097265, 'atr_min_pct': 0.0233077374864016, 'atr_max_pct': 0.09395171236884797, 'tp_mult': 2.745358480509811, 'tsl_mult': 0.824266674942284, 'strategy': 'mean_reversion', 'time_stop': 172, 'use_sma': False, 'use_atr': True, 'use_adx': True, 'use_ema': False, 'use_spike': True, 'rsi_required': True, 'edge_k': 1.5333609349478723, 'edge_cap': 0.1987019398009422, 'bull_strategy': 'mean_reversion', 'bull_bb_std_mult': 2.3295292606069684, 'bull_rsi_os': 10, 'bull_rsi_ob': 81, 'bull_adx_thresh': 34.39306601309708, 'bull_atr_min_pct': 0.009309496080672684, 'bull_atr_max_pct': 0.1283701932536028, 'bull_tp_mult': 1.0277339144406712, 'bull_tsl_mult': 0.5211359103444018, 'bull_time_stop': 122, 'bull_use_sma': False, 'bull_use_ema': True, 'bull_use_atr': True, 'bull_use_adx': True, 'bull_use_spike': False, 'bull_rsi_required': True, 'bear_strategy': 'breakout', 'bear_bb_std_mult': 2.933334328839119, 'bear_rsi_os': 45, 'bear_rsi_ob': 80, 'bear_adx_thresh': 10.665339039814413, 'bear_atr_min_pct': 0.026985076315769036, 'bear_atr_max_pct': 0.03210569855589453, 'bear_tp_mult': 1.6493907656953517, 'bear_tsl_mult': 0.5791462276511414, 'bear_time_stop': 206, 'bear_use_sma': True, 'bear_use_ema': True, 'bear_use_atr': False, 'bear_use_adx': False, 'bear_use_spike': False, 'bear_rsi_required': True, 'sideways_strategy': 'breakout', 'sideways_bb_std_mult': 2.5172502528109533, 'sideways_rsi_os': 34, 'sideways_rsi_ob': 57, 'sideways_adx_thresh': 23.491606723655124, 'sideways_atr_min_pct': 0.020152463757253648, 'sideways_atr_max_pct': 0.14087713385032974, 'sideways_tp_mult': 1.9597321563416525, 'sideways_tsl_mult': 0.1915737699505981, 'sideways_time_stop': 76, 'sideways_use_sma': False, 'sideways_use_ema': False, 'sideways_use_atr': True, 'sideways_use_adx': True, 'sideways_use_spike': False, 'sideways_rsi_required': True}.
[I 2025-08-30 18:45:49,046] Trial 146 finished with values: [-1000000000.0, 1000000000.0] and parameters: {'p_sma': 5, 'p_std': 36, 'p_atr': 21, 'p_adx': 20, 'rsi_period': 61, 'ema1': 24, 'ema2': 32, 'slip_atr_k': 0.059123105331733254, 'slip_spread_k': 0.02797751769910546, 'spread_hl_frac': 0.01427319927212773, 'bb_std_mult': 2.1542771555485003, 'rsi_os': 49, 'rsi_ob': 77, 'vol_spike': 0.17550186261850292, 'adx_thresh': 34.93394446598041, 'atr_min_pct': 0.0034229559551939483, 'atr_max_pct': 0.014943120245012001, 'tp_mult': 2.1032003401121884, 'tsl_mult': 0.5501816315983464, 'strategy': 'mean_reversion', 'time_stop': 171, 'use_sma': False, 'use_atr': True, 'use_adx': True, 'use_ema': False, 'use_spike': True, 'rsi_required': False, 'edge_k': 0.05117863650835247, 'edge_cap': 0.5899924262209791, 'bull_strategy': 'mean_reversion', 'bull_bb_std_mult': 3.0883440961987474, 'bull_rsi_os': 33, 'bull_rsi_ob': 79, 'bull_adx_thresh': 16.51716764451628, 'bull_atr_min_pct': 0.0013581692140682607, 'bull_atr_max_pct': 0.13493697632755514, 'bull_tp_mult': 2.6793694854271983, 'bull_tsl_mult': 0.3884720648990524, 'bull_time_stop': 108, 'bull_use_sma': False, 'bull_use_ema': True, 'bull_use_atr': True, 'bull_use_adx': False, 'bull_use_spike': False, 'bull_rsi_required': True, 'bear_strategy': 'breakout', 'bear_bb_std_mult': 2.298887151817205, 'bear_rsi_os': 43, 'bear_rsi_ob': 77, 'bear_adx_thresh': 17.873213482540073, 'bear_atr_min_pct': 0.024343212655289305, 'bear_atr_max_pct': 0.1387291782491487, 'bear_tp_mult': 1.6411247446124833, 'bear_tsl_mult': 0.5716816057429126, 'bear_time_stop': 205, 'bear_use_sma': True, 'bear_use_ema': True, 'bear_use_atr': False, 'bear_use_adx': False, 'bear_use_spike': False, 'bear_rsi_required': True, 'sideways_strategy': 'breakout', 'sideways_bb_std_mult': 2.8748669798451103, 'sideways_rsi_os': 36, 'sideways_rsi_ob': 57, 'sideways_adx_thresh': 23.626409531147477, 'sideways_atr_min_pct': 0.02050924248300496, 'sideways_atr_max_pct': 0.14026324646060678, 'sideways_tp_mult': 1.1029075178280578, 'sideways_tsl_mult': 0.9284562812956934, 'sideways_time_stop': 140, 'sideways_use_sma': False, 'sideways_use_ema': False, 'sideways_use_atr': True, 'sideways_use_adx': True, 'sideways_use_spike': False, 'sideways_rsi_required': True}.
[I 2025-08-30 18:45:49,163] Trial 144 finished with values: [-0.027832294619084652, 0.027709702075255818] and parameters: {'p_sma': 7, 'p_std': 34, 'p_atr': 8, 'p_adx': 21, 'rsi_period': 19, 'ema1': 24, 'ema2': 32, 'slip_atr_k': 0.006434195702557016, 'slip_spread_k': 0.12916993849856725, 'spread_hl_frac': 0.00024419976369085064, 'bb_std_mult': 2.0400858052204804, 'rsi_os': 42, 'rsi_ob': 86, 'vol_spike': 0.012848644211647053, 'adx_thresh': 7.077045789107739, 'atr_min_pct': 0.023444820373029505, 'atr_max_pct': 0.14893733402153309, 'tp_mult': 2.170614674288829, 'tsl_mult': 0.825503003779443, 'strategy': 'mean_reversion', 'time_stop': 190, 'use_sma': True, 'use_atr': True, 'use_adx': True, 'use_ema': False, 'use_spike': True, 'rsi_required': False, 'edge_k': 0.1540478555538151, 'edge_cap': 0.30125931346442736, 'bull_strategy': 'mean_reversion', 'bull_bb_std_mult': 2.3267216009672875, 'bull_rsi_os': 35, 'bull_rsi_ob': 81, 'bull_adx_thresh': 8.093003797147475, 'bull_atr_min_pct': 0.001231077821815052, 'bull_atr_max_pct': 0.06377916387302124, 'bull_tp_mult': 1.2762212400716724, 'bull_tsl_mult': 0.5172798958949393, 'bull_time_stop': 196, 'bull_use_sma': False, 'bull_use_ema': True, 'bull_use_atr': True, 'bull_use_adx': False, 'bull_use_spike': False, 'bull_rsi_required': True, 'bear_strategy': 'mean_reversion', 'bear_bb_std_mult': 1.5486755956304954, 'bear_rsi_os': 50, 'bear_rsi_ob': 45, 'bear_adx_thresh': 9.230594641884371, 'bear_atr_min_pct': 0.013100725278886045, 'bear_atr_max_pct': 0.03316017614558847, 'bear_tp_mult': 1.6251327410784326, 'bear_tsl_mult': 0.6304109115885395, 'bear_time_stop': 59, 'bear_use_sma': True, 'bear_use_ema': False, 'bear_use_atr': False, 'bear_use_adx': False, 'bear_use_spike': False, 'bear_rsi_required': True, 'sideways_strategy': 'breakout', 'sideways_bb_std_mult': 2.876416843492246, 'sideways_rsi_os': 34, 'sideways_rsi_ob': 57, 'sideways_adx_thresh': 20.89386156356178, 'sideways_atr_min_pct': 0.001319413534547314, 'sideways_atr_max_pct': 0.13868043576512365, 'sideways_tp_mult': 1.5738265414332848, 'sideways_tsl_mult': 0.3481286478360778, 'sideways_time_stop': 140, 'sideways_use_sma': False, 'sideways_use_ema': False, 'sideways_use_atr': True, 'sideways_use_adx': True, 'sideways_use_spike': False, 'sideways_rsi_required': True}.
[I 2025-08-30 18:45:49,677] Trial 149 finished with values: [-1000000000.0, 1000000000.0] and parameters: {'p_sma': 7, 'p_std': 34, 'p_atr': 8, 'p_adx': 21, 'rsi_period': 19, 'ema1': 13, 'ema2': 15, 'slip_atr_k': 0.07608254242435514, 'slip_spread_k': 0.43346978806105374, 'spread_hl_frac': 0.024681820261741243, 'bb_std_mult': 2.305031558145286, 'rsi_os': 51, 'rsi_ob': 88, 'vol_spike': 0.01087970425513371, 'adx_thresh': 31.08248524662982, 'atr_min_pct': 0.011571059612244017, 'atr_max_pct': 0.10176571785402468, 'tp_mult': 2.3839700233496672, 'tsl_mult': 0.4610729411764788, 'strategy': 'mean_reversion', 'time_stop': 94, 'use_sma': False, 'use_atr': True, 'use_adx': True, 'use_ema': False, 'use_spike': True, 'rsi_required': False, 'edge_k': 0.15368048311858115, 'edge_cap': 0.4622007387469894, 'bull_strategy': 'mean_reversion', 'bull_bb_std_mult': 2.4751337098323978, 'bull_rsi_os': 35, 'bull_rsi_ob': 46, 'bull_adx_thresh': 8.6440805332666, 'bull_atr_min_pct': 0.0014978882898207882, 'bull_atr_max_pct': 0.08987206673906996, 'bull_tp_mult': 2.0345344414544906, 'bull_tsl_mult': 0.9203265570923378, 'bull_time_stop': 196, 'bull_use_sma': False, 'bull_use_ema': True, 'bull_use_atr': True, 'bull_use_adx': False, 'bull_use_spike': False, 'bull_rsi_required': True, 'bear_strategy': 'breakout', 'bear_bb_std_mult': 1.49656704604071, 'bear_rsi_os': 50, 'bear_rsi_ob': 58, 'bear_adx_thresh': 26.002303963605968, 'bear_atr_min_pct': 0.013397583038846785, 'bear_atr_max_pct': 0.12422671284447692, 'bear_tp_mult': 2.7850780534544524, 'bear_tsl_mult': 0.6230441719152364, 'bear_time_stop': 62, 'bear_use_sma': True, 'bear_use_ema': False, 'bear_use_atr': False, 'bear_use_adx': False, 'bear_use_spike': False, 'bear_rsi_required': True, 'sideways_strategy': 'mean_reversion', 'sideways_bb_std_mult': 3.4345092983114407, 'sideways_rsi_os': 40, 'sideways_rsi_ob': 62, 'sideways_adx_thresh': 21.026134978616764, 'sideways_atr_min_pct': 0.02613709919049693, 'sideways_atr_max_pct': 0.0452966959156126, 'sideways_tp_mult': 1.0106171526099437, 'sideways_tsl_mult': 0.5621831669298968, 'sideways_time_stop': 141, 'sideways_use_sma': False, 'sideways_use_ema': True, 'sideways_use_atr': True, 'sideways_use_adx': False, 'sideways_use_spike': False, 'sideways_rsi_required': True}.
[I 2025-08-30 18:45:49,709] Trial 148 finished with values: [-1000000000.0, 1000000000.0] and parameters: {'p_sma': 41, 'p_std': 6, 'p_atr': 21, 'p_adx': 13, 'rsi_period': 82, 'ema1': 13, 'ema2': 32, 'slip_atr_k': 0.060889861482344015, 'slip_spread_k': 0.4324011878456357, 'spread_hl_frac': 0.024483744233757335, 'bb_std_mult': 1.6252628152847903, 'rsi_os': 54, 'rsi_ob': 84, 'vol_spike': 0.1722044921027857, 'adx_thresh': 34.96380324084398, 'atr_min_pct': 0.003878587942233211, 'atr_max_pct': 0.01083598760664449, 'tp_mult': 1.558184762764207, 'tsl_mult': 0.6087836281060053, 'strategy': 'mean_reversion', 'time_stop': 59, 'use_sma': False, 'use_atr': True, 'use_adx': True, 'use_ema': False, 'use_spike': True, 'rsi_required': False, 'edge_k': 0.05093960764064949, 'edge_cap': 0.3049932513746939, 'bull_strategy': 'mean_reversion', 'bull_bb_std_mult': 3.0809611016338683, 'bull_rsi_os': 35, 'bull_rsi_ob': 46, 'bull_adx_thresh': 22.585254950716646, 'bull_atr_min_pct': 0.0014199759991615323, 'bull_atr_max_pct': 0.09498230427948404, 'bull_tp_mult': 2.8338169073930772, 'bull_tsl_mult': 0.5188794230131538, 'bull_time_stop': 269, 'bull_use_sma': False, 'bull_use_ema': True, 'bull_use_atr': True, 'bull_use_adx': False, 'bull_use_spike': False, 'bull_rsi_required': True, 'bear_strategy': 'breakout', 'bear_bb_std_mult': 2.2347751558494524, 'bear_rsi_os': 24, 'bear_rsi_ob': 59, 'bear_adx_thresh': 17.47548585886617, 'bear_atr_min_pct': 0.013435532801651558, 'bear_atr_max_pct': 0.12398430594251587, 'bear_tp_mult': 2.7623510033863816, 'bear_tsl_mult': 0.6323290875614802, 'bear_time_stop': 202, 'bear_use_sma': True, 'bear_use_ema': False, 'bear_use_atr': False, 'bear_use_adx': False, 'bear_use_spike': False, 'bear_rsi_required': True, 'sideways_strategy': 'mean_reversion', 'sideways_bb_std_mult': 2.8737039020876547, 'sideways_rsi_os': 40, 'sideways_rsi_ob': 57, 'sideways_adx_thresh': 20.830079365148862, 'sideways_atr_min_pct': 0.014192562742351367, 'sideways_atr_max_pct': 0.11994538145084546, 'sideways_tp_mult': 1.5787202124205062, 'sideways_tsl_mult': 0.9247347808632613, 'sideways_time_stop': 141, 'sideways_use_sma': False, 'sideways_use_ema': False, 'sideways_use_atr': True, 'sideways_use_adx': True, 'sideways_use_spike': False, 'sideways_rsi_required': True}.
[I 2025-08-30 18:45:49,839] Trial 150 finished with values: [-1000000000.0, 1000000000.0] and parameters: {'p_sma': 38, 'p_std': 48, 'p_atr': 9, 'p_adx': 16, 'rsi_period': 19, 'ema1': 21, 'ema2': 31, 'slip_atr_k': 0.06656978722416955, 'slip_spread_k': 0.13042754538105086, 'spread_hl_frac': 0.02423896670150894, 'bb_std_mult': 0.9175883431791989, 'rsi_os': 52, 'rsi_ob': 84, 'vol_spike': 0.2610316792192283, 'adx_thresh': 33.063430157099724, 'atr_min_pct': 0.0008886393574894114, 'atr_max_pct': 0.033917259810628514, 'tp_mult': 1.9266196862213951, 'tsl_mult': 0.7431984996275216, 'strategy': 'mean_reversion', 'time_stop': 78, 'use_sma': True, 'use_atr': True, 'use_adx': True, 'use_ema': False, 'use_spike': True, 'rsi_required': False, 'edge_k': 1.6160161250020266, 'edge_cap': 0.4584816370363264, 'bull_strategy': 'mean_reversion', 'bull_bb_std_mult': 2.4897626306691247, 'bull_rsi_os': 29, 'bull_rsi_ob': 59, 'bull_adx_thresh': 9.025033362292522, 'bull_atr_min_pct': 0.0008533779486359558, 'bull_atr_max_pct': 0.09339303949130351, 'bull_tp_mult': 2.839795171269042, 'bull_tsl_mult': 0.13978777920878066, 'bull_time_stop': 60, 'bull_use_sma': False, 'bull_use_ema': True, 'bull_use_atr': True, 'bull_use_adx': False, 'bull_use_spike': False, 'bull_rsi_required': True, 'bear_strategy': 'breakout', 'bear_bb_std_mult': 2.2005286100021912, 'bear_rsi_os': 18, 'bear_rsi_ob': 57, 'bear_adx_thresh': 18.50419021136992, 'bear_atr_min_pct': 0.027398539714977545, 'bear_atr_max_pct': 0.03949116654373814, 'bear_tp_mult': 2.8040475099661126, 'bear_tsl_mult': 0.6351575178041512, 'bear_time_stop': 198, 'bear_use_sma': True, 'bear_use_ema': False, 'bear_use_atr': False, 'bear_use_adx': False, 'bear_use_spike': False, 'bear_rsi_required': True, 'sideways_strategy': 'mean_reversion', 'sideways_bb_std_mult': 1.8162917454282137, 'sideways_rsi_os': 37, 'sideways_rsi_ob': 61, 'sideways_adx_thresh': 21.195045536616043, 'sideways_atr_min_pct': 0.024497379962506765, 'sideways_atr_max_pct': 0.14640503053499795, 'sideways_tp_mult': 2.991188759866032, 'sideways_tsl_mult': 0.5655911812349391, 'sideways_time_stop': 100, 'sideways_use_sma': False, 'sideways_use_ema': True, 'sideways_use_atr': True, 'sideways_use_adx': False, 'sideways_use_spike': False, 'sideways_rsi_required': True}.
[I 2025-08-30 18:46:19,566] Trial 147 finished with values: [-1000000000.0, 1000000000.0] and parameters: {'p_sma': 41, 'p_std': 36, 'p_atr': 21, 'p_adx': 14, 'rsi_period': 24, 'ema1': 24, 'ema2': 14, 'slip_atr_k': 0.03317883529602818, 'slip_spread_k': 0.6468895395907049, 'spread_hl_frac': 0.021517193008595753, 'bb_std_mult': 1.6115207564626224, 'rsi_os': 42, 'rsi_ob': 86, 'vol_spike': 0.004663901494094708, 'adx_thresh': 32.07942642399926, 'atr_min_pct': 0.0037694541034044484, 'atr_max_pct': 0.0942882919763277, 'tp_mult': 2.1619268183160414, 'tsl_mult': 0.82580607705547, 'strategy': 'mean_reversion', 'time_stop': 94, 'use_sma': False, 'use_atr': True, 'use_adx': True, 'use_ema': False, 'use_spike': True, 'rsi_required': False, 'edge_k': 0.16843054126687734, 'edge_cap': 0.6025200269172513, 'bull_strategy': 'mean_reversion', 'bull_bb_std_mult': 2.3645008222359545, 'bull_rsi_os': 33, 'bull_rsi_ob': 46, 'bull_adx_thresh': 8.388074139918572, 'bull_atr_min_pct': 0.00953327375693373, 'bull_atr_max_pct': 0.09340063030754696, 'bull_tp_mult': 2.832558834687051, 'bull_tsl_mult': 0.5205637785778378, 'bull_time_stop': 91, 'bull_use_sma': False, 'bull_use_ema': True, 'bull_use_atr': True, 'bull_use_adx': False, 'bull_use_spike': False, 'bull_rsi_required': True, 'bear_strategy': 'breakout', 'bear_bb_std_mult': 3.1687419769293697, 'bear_rsi_os': 23, 'bear_rsi_ob': 58, 'bear_adx_thresh': 25.757986095332946, 'bear_atr_min_pct': 0.02446133709113431, 'bear_atr_max_pct': 0.0338213217133083, 'bear_tp_mult': 2.8019062130647523, 'bear_tsl_mult': 0.6295945644428695, 'bear_time_stop': 204, 'bear_use_sma': True, 'bear_use_ema': False, 'bear_use_atr': False, 'bear_use_adx': False, 'bear_use_spike': False, 'bear_rsi_required': True, 'sideways_strategy': 'mean_reversion', 'sideways_bb_std_mult': 3.277283257162798, 'sideways_rsi_os': 36, 'sideways_rsi_ob': 55, 'sideways_adx_thresh': 23.23658074114362, 'sideways_atr_min_pct': 0.007052792289694751, 'sideways_atr_max_pct': 0.1412615458115732, 'sideways_tp_mult': 1.9461848268796575, 'sideways_tsl_mult': 0.9279171408950214, 'sideways_time_stop': 75, 'sideways_use_sma': False, 'sideways_use_ema': False, 'sideways_use_atr': True, 'sideways_use_adx': True, 'sideways_use_spike': False, 'sideways_rsi_required': True}.
[I 2025-08-30 18:46:21,793] Trial 151 finished with values: [-1000000000.0, 1000000000.0] and parameters: {'p_sma': 41, 'p_std': 49, 'p_atr': 9, 'p_adx': 20, 'rsi_period': 28, 'ema1': 17, 'ema2': 54, 'slip_atr_k': 0.03381149016728059, 'slip_spread_k': 0.0820902915921324, 'spread_hl_frac': 0.021991154541066815, 'bb_std_mult': 0.736611191551608, 'rsi_os': 46, 'rsi_ob': 84, 'vol_spike': 0.2797144239565482, 'adx_thresh': 32.19209744426853, 'atr_min_pct': 0.027353566198087823, 'atr_max_pct': 0.0403077805229984, 'tp_mult': 2.172665669192612, 'tsl_mult': 0.7466414863447195, 'strategy': 'mean_reversion', 'time_stop': 211, 'use_sma': True, 'use_atr': True, 'use_adx': False, 'use_ema': False, 'use_spike': True, 'rsi_required': False, 'edge_k': 1.6311818013699204, 'edge_cap': 0.5202505597948319, 'bull_strategy': 'mean_reversion', 'bull_bb_std_mult': 3.0328005559807774, 'bull_rsi_os': 29, 'bull_rsi_ob': 48, 'bull_adx_thresh': 15.727889900241017, 'bull_atr_min_pct': 0.0007677448840088951, 'bull_atr_max_pct': 0.09683649851861649, 'bull_tp_mult': 1.234418573191552, 'bull_tsl_mult': 0.13890897716373735, 'bull_time_stop': 88, 'bull_use_sma': False, 'bull_use_ema': True, 'bull_use_atr': True, 'bull_use_adx': False, 'bull_use_spike': False, 'bull_rsi_required': True, 'bear_strategy': 'breakout', 'bear_bb_std_mult': 1.9218021312807578, 'bear_rsi_os': 24, 'bear_rsi_ob': 78, 'bear_adx_thresh': 27.398215993431506, 'bear_atr_min_pct': 0.021898762362279566, 'bear_atr_max_pct': 0.023579223546207957, 'bear_tp_mult': 2.6622042442308285, 'bear_tsl_mult': 0.2061642770016177, 'bear_time_stop': 230, 'bear_use_sma': True, 'bear_use_ema': False, 'bear_use_atr': False, 'bear_use_adx': False, 'bear_use_spike': False, 'bear_rsi_required': True, 'sideways_strategy': 'mean_reversion', 'sideways_bb_std_mult': 3.2765728398785177, 'sideways_rsi_os': 37, 'sideways_rsi_ob': 55, 'sideways_adx_thresh': 20.64800932850159, 'sideways_atr_min_pct': 0.004512608685094005, 'sideways_atr_max_pct': 0.14991392138590004, 'sideways_tp_mult': 2.020916399298778, 'sideways_tsl_mult': 0.9106561594271619, 'sideways_time_stop': 96, 'sideways_use_sma': False, 'sideways_use_ema': True, 'sideways_use_atr': True, 'sideways_use_adx': False, 'sideways_use_spike': False, 'sideways_rsi_required': True}.
[I 2025-08-30 18:46:23,291] Trial 153 finished with values: [-1000000000.0, 1000000000.0] and parameters: {'p_sma': 10, 'p_std': 29, 'p_atr': 29, 'p_adx': 20, 'rsi_period': 74, 'ema1': 8, 'ema2': 39, 'slip_atr_k': 0.14933478201572936, 'slip_spread_k': 0.18333408574522064, 'spread_hl_frac': 0.02204215137275857, 'bb_std_mult': 3.117175842012787, 'rsi_os': 46, 'rsi_ob': 92, 'vol_spike': 0.20728788587759311, 'adx_thresh': 32.44525163058788, 'atr_min_pct': 0.027328089846207455, 'atr_max_pct': 0.04013884821497816, 'tp_mult': 2.1614356696078416, 'tsl_mult': 0.27808971822175965, 'strategy': 'mean_reversion', 'time_stop': 183, 'use_sma': False, 'use_atr': True, 'use_adx': False, 'use_ema': False, 'use_spike': True, 'rsi_required': False, 'edge_k': 1.7082070141146681, 'edge_cap': 0.5179321466230112, 'bull_strategy': 'breakout', 'bull_bb_std_mult': 3.0085017166989667, 'bull_rsi_os': 15, 'bull_rsi_ob': 50, 'bull_adx_thresh': 17.27396547879169, 'bull_atr_min_pct': 0.01197897341477118, 'bull_atr_max_pct': 0.10099529527617984, 'bull_tp_mult': 1.2447082289772056, 'bull_tsl_mult': 0.43270895308814505, 'bull_time_stop': 131, 'bull_use_sma': False, 'bull_use_ema': True, 'bull_use_atr': True, 'bull_use_adx': True, 'bull_use_spike': False, 'bull_rsi_required': False, 'bear_strategy': 'mean_reversion', 'bear_bb_std_mult': 1.9030511192123885, 'bear_rsi_os': 50, 'bear_rsi_ob': 79, 'bear_adx_thresh': 23.854091421716273, 'bear_atr_min_pct': 0.014460972335940115, 'bear_atr_max_pct': 0.025255459639690742, 'bear_tp_mult': 2.6569227577071026, 'bear_tsl_mult': 0.6795215447007383, 'bear_time_stop': 178, 'bear_use_sma': True, 'bear_use_ema': True, 'bear_use_atr': False, 'bear_use_adx': False, 'bear_use_spike': True, 'bear_rsi_required': True, 'sideways_strategy': 'breakout', 'sideways_bb_std_mult': 0.933424111189469, 'sideways_rsi_os': 35, 'sideways_rsi_ob': 93, 'sideways_adx_thresh': 6.924930374651547, 'sideways_atr_min_pct': 0.02782681480728702, 'sideways_atr_max_pct': 0.05824570995707655, 'sideways_tp_mult': 2.502220966544858, 'sideways_tsl_mult': 0.9521612937564926, 'sideways_time_stop': 88, 'sideways_use_sma': False, 'sideways_use_ema': True, 'sideways_use_atr': False, 'sideways_use_adx': False, 'sideways_use_spike': False, 'sideways_rsi_required': True}.
