[I 2025-08-30 19:29:47,726] Trial 532 finished with values: [-1000000000.0, 1000000000.0] and parameters: {'p_sma': 17, 'p_std': 47, 'p_atr': 25, 'p_adx': 22, 'rsi_period': 24, 'ema1': 25, 'ema2': 29, 'slip_atr_k': 0.1725239227683546, 'slip_spread_k': 0.20116486740025102, 'spread_hl_frac': 0.022902226333745907, 'bb_std_mult': 2.152859757085254, 'rsi_os': 41, 'rsi_ob': 81, 'vol_spike': 0.26080905531799375, 'adx_thresh': 33.796162627331505, 'atr_min_pct': 0.022693629768503625, 'atr_max_pct': 0.010162376031714979, 'tp_mult': 2.2844133691646396, 'tsl_mult': 0.7826869869529296, 'strategy': 'mean_reversion', 'time_stop': 193, 'use_sma': False, 'use_atr': True, 'use_adx': False, 'use_ema': False, 'use_spike': True, 'rsi_required': False, 'edge_k': 0.21708893217473524, 'edge_cap': 0.4728280250352464, 'bull_strategy': 'mean_reversion', 'bull_bb_std_mult': 3.304586693672538, 'bull_rsi_os': 20, 'bull_rsi_ob': 46, 'bull_adx_thresh': 19.024677994235052, 'bull_atr_min_pct': 0.0002690845029232516, 'bull_atr_max_pct': 0.020866628651994262, 'bull_tp_mult': 2.7095333659642105, 'bull_tsl_mult': 0.5641640022881538, 'bull_time_stop': 169, 'bull_use_sma': False, 'bull_use_ema': True, 'bull_use_atr': True, 'bull_use_adx': False, 'bull_use_spike': False, 'bull_rsi_required': True, 'bear_strategy': 'breakout', 'bear_bb_std_mult': 2.7168328279411087, 'bear_rsi_os': 49, 'bear_rsi_ob': 75, 'bear_adx_thresh': 18.10279960676194, 'bear_atr_min_pct': 0.016518139540777677, 'bear_atr_max_pct': 0.07022947053124763, 'bear_tp_mult': 2.709556383177134, 'bear_tsl_mult': 0.7501239107421531, 'bear_time_stop': 169, 'bear_use_sma': True, 'bear_use_ema': True, 'bear_use_atr': False, 'bear_use_adx': False, 'bear_use_spike': True, 'bear_rsi_required': True, 'sideways_strategy': 'breakout', 'sideways_bb_std_mult': 0.5970056195086417, 'sideways_rsi_os': 35, 'sideways_rsi_ob': 55, 'sideways_adx_thresh': 29.907533937583608, 'sideways_atr_min_pct': 0.0011360666391356722, 'sideways_atr_max_pct': 0.11761423844071925, 'sideways_tp_mult': 1.0556107873168468, 'sideways_tsl_mult': 0.8729631098797137, 'sideways_time_stop': 246, 'sideways_use_sma': False, 'sideways_use_ema': True, 'sideways_use_atr': True, 'sideways_use_adx': False, 'sideways_use_spike': False, 'sideways_rsi_required': False}.
[I 2025-08-30 19:29:47,728] Trial 534 finished with values: [-1000000000.0, 1000000000.0] and parameters: {'p_sma': 36, 'p_std': 26, 'p_atr': 10, 'p_adx': 11, 'rsi_period': 32, 'ema1': 26, 'ema2': 29, 'slip_atr_k': 0.013430015616855723, 'slip_spread_k': 0.1412010289397035, 'spread_hl_frac': 0.021944069541852552, 'bb_std_mult': 1.9319049690405115, 'rsi_os': 50, 'rsi_ob': 46, 'vol_spike': 0.07285386803829524, 'adx_thresh': 34.97005664456808, 'atr_min_pct': 0.022633975420572074, 'atr_max_pct': 0.14573147367243564, 'tp_mult': 2.386500704585244, 'tsl_mult': 0.021011089506825842, 'strategy': 'mean_reversion', 'time_stop': 184, 'use_sma': False, 'use_atr': True, 'use_adx': False, 'use_ema': False, 'use_spike': True, 'rsi_required': False, 'edge_k': 1.642462648793836, 'edge_cap': 0.7860493458937408, 'bull_strategy': 'mean_reversion', 'bull_bb_std_mult': 3.2971460438283526, 'bull_rsi_os': 30, 'bull_rsi_ob': 56, 'bull_adx_thresh': 8.985989008526795, 'bull_atr_min_pct': 0.0022885603001286344, 'bull_atr_max_pct': 0.11743067984480254, 'bull_tp_mult': 2.721984798266029, 'bull_tsl_mult': 0.9970232231946977, 'bull_time_stop': 171, 'bull_use_sma': False, 'bull_use_ema': True, 'bull_use_atr': True, 'bull_use_adx': False, 'bull_use_spike': False, 'bull_rsi_required': True, 'bear_strategy': 'mean_reversion', 'bear_bb_std_mult': 2.857183705626765, 'bear_rsi_os': 14, 'bear_rsi_ob': 75, 'bear_adx_thresh': 18.18682667183465, 'bear_atr_min_pct': 0.02918773220161392, 'bear_atr_max_pct': 0.03204470123986708, 'bear_tp_mult': 2.726926308462245, 'bear_tsl_mult': 0.7495266921983451, 'bear_time_stop': 267, 'bear_use_sma': True, 'bear_use_ema': True, 'bear_use_atr': False, 'bear_use_adx': False, 'bear_use_spike': False, 'bear_rsi_required': True, 'sideways_strategy': 'breakout', 'sideways_bb_std_mult': 2.287256365816546, 'sideways_rsi_os': 33, 'sideways_rsi_ob': 61, 'sideways_adx_thresh': 28.800979744549494, 'sideways_atr_min_pct': 0.009934192355024704, 'sideways_atr_max_pct': 0.1475031850070875, 'sideways_tp_mult': 1.1054235912621662, 'sideways_tsl_mult': 0.8724217215728102, 'sideways_time_stop': 133, 'sideways_use_sma': False, 'sideways_use_ema': True, 'sideways_use_atr': True, 'sideways_use_adx': False, 'sideways_use_spike': False, 'sideways_rsi_required': False}.
[I 2025-08-30 19:30:18,215] Trial 531 finished with values: [-1000000000.0, 1000000000.0] and parameters: {'p_sma': 38, 'p_std': 47, 'p_atr': 25, 'p_adx': 19, 'rsi_period': 24, 'ema1': 25, 'ema2': 23, 'slip_atr_k': 0.18519294808927173, 'slip_spread_k': 0.19154494248018925, 'spread_hl_frac': 0.019660913976228114, 'bb_std_mult': 2.1964886963327723, 'rsi_os': 47, 'rsi_ob': 81, 'vol_spike': 0.04839061627212758, 'adx_thresh': 19.474306072500084, 'atr_min_pct': 0.02657665333184182, 'atr_max_pct': 0.10448568882776153, 'tp_mult': 2.5752644488381318, 'tsl_mult': 0.7699699027597022, 'strategy': 'mean_reversion', 'time_stop': 194, 'use_sma': False, 'use_atr': True, 'use_adx': True, 'use_ema': False, 'use_spike': True, 'rsi_required': False, 'edge_k': 0.627717524953183, 'edge_cap': 0.4756235964140231, 'bull_strategy': 'mean_reversion', 'bull_bb_std_mult': 2.618028009959077, 'bull_rsi_os': 53, 'bull_rsi_ob': 45, 'bull_adx_thresh': 19.052415625180192, 'bull_atr_min_pct': 0.0030133899394970904, 'bull_atr_max_pct': 0.11537318594950768, 'bull_tp_mult': 2.7171053059785697, 'bull_tsl_mult': 0.4354733220402116, 'bull_time_stop': 171, 'bull_use_sma': False, 'bull_use_ema': True, 'bull_use_atr': True, 'bull_use_adx': False, 'bull_use_spike': False, 'bull_rsi_required': True, 'bear_strategy': 'breakout', 'bear_bb_std_mult': 2.872496185834228, 'bear_rsi_os': 54, 'bear_rsi_ob': 76, 'bear_adx_thresh': 17.996194473949497, 'bear_atr_min_pct': 0.014622843314893776, 'bear_atr_max_pct': 0.14132481603043887, 'bear_tp_mult': 2.7139833504995, 'bear_tsl_mult': 0.7565567019804136, 'bear_time_stop': 199, 'bear_use_sma': True, 'bear_use_ema': True, 'bear_use_atr': False, 'bear_use_adx': False, 'bear_use_spike': True, 'bear_rsi_required': True, 'sideways_strategy': 'breakout', 'sideways_bb_std_mult': 3.091700990529248, 'sideways_rsi_os': 6, 'sideways_rsi_ob': 61, 'sideways_adx_thresh': 8.026480553808415, 'sideways_atr_min_pct': 0.0012809683455978697, 'sideways_atr_max_pct': 0.1152777101980273, 'sideways_tp_mult': 2.9049415941909786, 'sideways_tsl_mult': 0.9713645125726823, 'sideways_time_stop': 135, 'sideways_use_sma': True, 'sideways_use_ema': True, 'sideways_use_atr': True, 'sideways_use_adx': False, 'sideways_use_spike': True, 'sideways_rsi_required': True}.
[I 2025-08-30 19:30:18,281] Trial 533 finished with values: [-0.08680261827591751, 0.08669768271949596] and parameters: {'p_sma': 17, 'p_std': 29, 'p_atr': 7, 'p_adx': 11, 'rsi_period': 24, 'ema1': 26, 'ema2': 22, 'slip_atr_k': 0.067568417825376, 'slip_spread_k': 0.14074373595380787, 'spread_hl_frac': 0.01987533505408222, 'bb_std_mult': 0.5892992824105057, 'rsi_os': 41, 'rsi_ob': 81, 'vol_spike': 0.26228470201028664, 'adx_thresh': 18.19112830431023, 'atr_min_pct': 0.020762503010440296, 'atr_max_pct': 0.1005392674545814, 'tp_mult': 2.2828268848056354, 'tsl_mult': 0.7857767464987595, 'strategy': 'mean_reversion', 'time_stop': 183, 'use_sma': False, 'use_atr': True, 'use_adx': False, 'use_ema': False, 'use_spike': True, 'rsi_required': False, 'edge_k': 1.8578075789157793, 'edge_cap': 0.7830741758316471, 'bull_strategy': 'mean_reversion', 'bull_bb_std_mult': 3.278606838869603, 'bull_rsi_os': 49, 'bull_rsi_ob': 56, 'bull_adx_thresh': 7.543602196244851, 'bull_atr_min_pct': 0.0030826714144952597, 'bull_atr_max_pct': 0.11764677313290191, 'bull_tp_mult': 2.7208828057457417, 'bull_tsl_mult': 0.19500668383904857, 'bull_time_stop': 172, 'bull_use_sma': False, 'bull_use_ema': True, 'bull_use_atr': True, 'bull_use_adx': False, 'bull_use_spike': False, 'bull_rsi_required': True, 'bear_strategy': 'mean_reversion', 'bear_bb_std_mult': 2.8654235152786685, 'bear_rsi_os': 27, 'bear_rsi_ob': 55, 'bear_adx_thresh': 6.623413365968476, 'bear_atr_min_pct': 0.014482092397077071, 'bear_atr_max_pct': 0.012656015651697522, 'bear_tp_mult': 2.71934637147106, 'bear_tsl_mult': 0.7551438709481214, 'bear_time_stop': 108, 'bear_use_sma': True, 'bear_use_ema': True, 'bear_use_atr': False, 'bear_use_adx': False, 'bear_use_spike': False, 'bear_rsi_required': True, 'sideways_strategy': 'breakout', 'sideways_bb_std_mult': 0.593310989755204, 'sideways_rsi_os': 38, 'sideways_rsi_ob': 63, 'sideways_adx_thresh': 19.894698456406363, 'sideways_atr_min_pct': 0.0009390185639063001, 'sideways_atr_max_pct': 0.09131640107548047, 'sideways_tp_mult': 1.9426489479473001, 'sideways_tsl_mult': 0.3645381055140909, 'sideways_time_stop': 31, 'sideways_use_sma': False, 'sideways_use_ema': True, 'sideways_use_atr': True, 'sideways_use_adx': False, 'sideways_use_spike': False, 'sideways_rsi_required': False}.
[I 2025-08-30 19:30:22,325] Trial 536 finished with values: [-1000000000.0, 1000000000.0] and parameters: {'p_sma': 45, 'p_std': 40, 'p_atr': 7, 'p_adx': 27, 'rsi_period': 65, 'ema1': 26, 'ema2': 25, 'slip_atr_k': 0.1986421649541169, 'slip_spread_k': 0.25833081287500853, 'spread_hl_frac': 0.024004074141218152, 'bb_std_mult': 2.1971924620153604, 'rsi_os': 47, 'rsi_ob': 77, 'vol_spike': 0.23208079992407454, 'adx_thresh': 27.052829584310086, 'atr_min_pct': 0.014196161676375428, 'atr_max_pct': 0.0264802549296604, 'tp_mult': 2.571475419337206, 'tsl_mult': 0.8853518300919819, 'strategy': 'mean_reversion', 'time_stop': 66, 'use_sma': False, 'use_atr': True, 'use_adx': True, 'use_ema': False, 'use_spike': True, 'rsi_required': False, 'edge_k': 0.6415343428743885, 'edge_cap': 0.29346538437335434, 'bull_strategy': 'mean_reversion', 'bull_bb_std_mult': 1.8174069134263684, 'bull_rsi_os': 51, 'bull_rsi_ob': 77, 'bull_adx_thresh': 28.08455477469312, 'bull_atr_min_pct': 0.022032771361571123, 'bull_atr_max_pct': 0.14003296415697264, 'bull_tp_mult': 2.7706015134686437, 'bull_tsl_mult': 0.33030131690444176, 'bull_time_stop': 181, 'bull_use_sma': True, 'bull_use_ema': True, 'bull_use_atr': True, 'bull_use_adx': False, 'bull_use_spike': False, 'bull_rsi_required': True, 'bear_strategy': 'breakout', 'bear_bb_std_mult': 2.874581108182846, 'bear_rsi_os': 9, 'bear_rsi_ob': 76, 'bear_adx_thresh': 22.894878891118548, 'bear_atr_min_pct': 0.007376129475321507, 'bear_atr_max_pct': 0.04217047045176697, 'bear_tp_mult': 2.619550127400213, 'bear_tsl_mult': 0.7785894664644571, 'bear_time_stop': 205, 'bear_use_sma': False, 'bear_use_ema': True, 'bear_use_atr': True, 'bear_use_adx': False, 'bear_use_spike': False, 'bear_rsi_required': True, 'sideways_strategy': 'breakout', 'sideways_bb_std_mult': 3.215133227528089, 'sideways_rsi_os': 37, 'sideways_rsi_ob': 63, 'sideways_adx_thresh': 20.19322373972744, 'sideways_atr_min_pct': 0.003851262678433514, 'sideways_atr_max_pct': 0.08720707116889138, 'sideways_tp_mult': 1.1104839786013727, 'sideways_tsl_mult': 0.9778051701997914, 'sideways_time_stop': 31, 'sideways_use_sma': False, 'sideways_use_ema': True, 'sideways_use_atr': True, 'sideways_use_adx': False, 'sideways_use_spike': False, 'sideways_rsi_required': True}.
[I 2025-08-30 19:30:22,689] Trial 535 finished with values: [-1000000000.0, 1000000000.0] and parameters: {'p_sma': 7, 'p_std': 33, 'p_atr': 23, 'p_adx': 19, 'rsi_period': 65, 'ema1': 26, 'ema2': 31, 'slip_atr_k': 0.1628834129410928, 'slip_spread_k': 0.13538937694494804, 'spread_hl_frac': 0.037575717127494634, 'bb_std_mult': 2.124041198276216, 'rsi_os': 7, 'rsi_ob': 91, 'vol_spike': 0.270128593043332, 'adx_thresh': 25.03916961021672, 'atr_min_pct': 0.02055810356626528, 'atr_max_pct': 0.10571517386561809, 'tp_mult': 1.8786462661043735, 'tsl_mult': 0.8803093041758965, 'strategy': 'mean_reversion', 'time_stop': 182, 'use_sma': False, 'use_atr': True, 'use_adx': True, 'use_ema': False, 'use_spike': True, 'rsi_required': False, 'edge_k': 1.6440692819256397, 'edge_cap': 0.9798505506935475, 'bull_strategy': 'mean_reversion', 'bull_bb_std_mult': 3.0650555849612315, 'bull_rsi_os': 30, 'bull_rsi_ob': 56, 'bull_adx_thresh': 18.74988657162854, 'bull_atr_min_pct': 0.00313207199881722, 'bull_atr_max_pct': 0.11744311205340895, 'bull_tp_mult': 2.760574160088172, 'bull_tsl_mult': 0.8103477245653351, 'bull_time_stop': 216, 'bull_use_sma': True, 'bull_use_ema': True, 'bull_use_atr': True, 'bull_use_adx': False, 'bull_use_spike': False, 'bull_rsi_required': True, 'bear_strategy': 'mean_reversion', 'bear_bb_std_mult': 2.8524578789875887, 'bear_rsi_os': 47, 'bear_rsi_ob': 76, 'bear_adx_thresh': 11.695153583296204, 'bear_atr_min_pct': 0.014510229704305336, 'bear_atr_max_pct': 0.042797439399374436, 'bear_tp_mult': 2.6316896780000567, 'bear_tsl_mult': 0.7794609790123885, 'bear_time_stop': 153, 'bear_use_sma': False, 'bear_use_ema': True, 'bear_use_atr': True, 'bear_use_adx': False, 'bear_use_spike': False, 'bear_rsi_required': True, 'sideways_strategy': 'breakout', 'sideways_bb_std_mult': 3.219925042559232, 'sideways_rsi_os': 38, 'sideways_rsi_ob': 61, 'sideways_adx_thresh': 20.0847998301444, 'sideways_atr_min_pct': 0.002163704715641468, 'sideways_atr_max_pct': 0.1283430506938054, 'sideways_tp_mult': 1.108025350634179, 'sideways_tsl_mult': 0.6087904033467877, 'sideways_time_stop': 28, 'sideways_use_sma': False, 'sideways_use_ema': True, 'sideways_use_atr': True, 'sideways_use_adx': False, 'sideways_use_spike': False, 'sideways_rsi_required': True}.
[I 2025-08-30 19:30:23,369] Trial 538 finished with values: [-1000000000.0, 1000000000.0] and parameters: {'p_sma': 30, 'p_std': 33, 'p_atr': 7, 'p_adx': 13, 'rsi_period': 27, 'ema1': 27, 'ema2': 31, 'slip_atr_k': 0.22085664368149344, 'slip_spread_k': 0.25971233588924764, 'spread_hl_frac': 0.02395864615520804, 'bb_std_mult': 1.1270724998645645, 'rsi_os': 53, 'rsi_ob': 85, 'vol_spike': 0.23195581588279723, 'adx_thresh': 33.42777548435588, 'atr_min_pct': 0.024682549535683714, 'atr_max_pct': 0.027532922247686185, 'tp_mult': 2.1639434426643183, 'tsl_mult': 0.08657892924841631, 'strategy': 'mean_reversion', 'time_stop': 175, 'use_sma': True, 'use_atr': False, 'use_adx': True, 'use_ema': True, 'use_spike': True, 'rsi_required': False, 'edge_k': 1.5572322335907067, 'edge_cap': 0.5549642883542675, 'bull_strategy': 'breakout', 'bull_bb_std_mult': 2.8651923562011485, 'bull_rsi_os': 23, 'bull_rsi_ob': 54, 'bull_adx_thresh': 14.14962174243714, 'bull_atr_min_pct': 0.009991572502872885, 'bull_atr_max_pct': 0.12512442830503506, 'bull_tp_mult': 2.7629853812199086, 'bull_tsl_mult': 0.5123051708579469, 'bull_time_stop': 181, 'bull_use_sma': True, 'bull_use_ema': True, 'bull_use_atr': True, 'bull_use_adx': False, 'bull_use_spike': False, 'bull_rsi_required': True, 'bear_strategy': 'breakout', 'bear_bb_std_mult': 3.0006976740728013, 'bear_rsi_os': 6, 'bear_rsi_ob': 77, 'bear_adx_thresh': 17.164415027551623, 'bear_atr_min_pct': 0.015638824434143394, 'bear_atr_max_pct': 0.04294852896036179, 'bear_tp_mult': 2.6562810428858836, 'bear_tsl_mult': 0.7253643203822124, 'bear_time_stop': 206, 'bear_use_sma': False, 'bear_use_ema': True, 'bear_use_atr': True, 'bear_use_adx': False, 'bear_use_spike': False, 'bear_rsi_required': False, 'sideways_strategy': 'mean_reversion', 'sideways_bb_std_mult': 1.529367957051949, 'sideways_rsi_os': 16, 'sideways_rsi_ob': 59, 'sideways_adx_thresh': 18.979204814160596, 'sideways_atr_min_pct': 0.002092713122445162, 'sideways_atr_max_pct': 0.06021760469105449, 'sideways_tp_mult': 2.9734204072914854, 'sideways_tsl_mult': 0.4021039863595864, 'sideways_time_stop': 198, 'sideways_use_sma': False, 'sideways_use_ema': False, 'sideways_use_atr': True, 'sideways_use_adx': True, 'sideways_use_spike': False, 'sideways_rsi_required': True}.
[I 2025-08-30 19:30:23,601] Trial 539 finished with values: [-1000000000.0, 1000000000.0] and parameters: {'p_sma': 26, 'p_std': 36, 'p_atr': 10, 'p_adx': 20, 'rsi_period': 28, 'ema1': 27, 'ema2': 31, 'slip_atr_k': 0.04973261184612966, 'slip_spread_k': 0.6707808115026448, 'spread_hl_frac': 0.024975973461423436, 'bb_std_mult': 2.1093623650070943, 'rsi_os': 51, 'rsi_ob': 91, 'vol_spike': 0.19112488250642337, 'adx_thresh': 33.23062321080508, 'atr_min_pct': 0.01691526708090907, 'atr_max_pct': 0.09479168375273617, 'tp_mult': 2.110963112118957, 'tsl_mult': 0.8233455664226029, 'strategy': 'mean_reversion', 'time_stop': 160, 'use_sma': True, 'use_atr': False, 'use_adx': True, 'use_ema': True, 'use_spike': False, 'rsi_required': False, 'edge_k': 0.07039157028947882, 'edge_cap': 0.4453656196945861, 'bull_strategy': 'breakout', 'bull_bb_std_mult': 2.204247470712897, 'bull_rsi_os': 31, 'bull_rsi_ob': 47, 'bull_adx_thresh': 15.490999400847748, 'bull_atr_min_pct': 0.009658994771298501, 'bull_atr_max_pct': 0.02546528877983955, 'bull_tp_mult': 2.369386057792182, 'bull_tsl_mult': 0.8108839313202651, 'bull_time_stop': 162, 'bull_use_sma': True, 'bull_use_ema': False, 'bull_use_atr': True, 'bull_use_adx': False, 'bull_use_spike': False, 'bull_rsi_required': False, 'bear_strategy': 'breakout', 'bear_bb_std_mult': 0.9149379076092985, 'bear_rsi_os': 30, 'bear_rsi_ob': 50, 'bear_adx_thresh': 17.21825414251154, 'bear_atr_min_pct': 0.015564436475673522, 'bear_atr_max_pct': 0.055028796576487043, 'bear_tp_mult': 2.2131219079367574, 'bear_tsl_mult': 0.8902625689640545, 'bear_time_stop': 191, 'bear_use_sma': False, 'bear_use_ema': False, 'bear_use_atr': True, 'bear_use_adx': False, 'bear_use_spike': False, 'bear_rsi_required': False, 'sideways_strategy': 'mean_reversion', 'sideways_bb_std_mult': 2.9401829810071254, 'sideways_rsi_os': 40, 'sideways_rsi_ob': 59, 'sideways_adx_thresh': 31.442030685780804, 'sideways_atr_min_pct': 0.002010406316238332, 'sideways_atr_max_pct': 0.06084367281976301, 'sideways_tp_mult': 2.1193520126152943, 'sideways_tsl_mult': 0.4913065794293559, 'sideways_time_stop': 168, 'sideways_use_sma': False, 'sideways_use_ema': False, 'sideways_use_atr': True, 'sideways_use_adx': True, 'sideways_use_spike': False, 'sideways_rsi_required': True}.
[I 2025-08-30 19:30:23,765] Trial 540 finished with values: [-1000000000.0, 1000000000.0] and parameters: {'p_sma': 6, 'p_std': 35, 'p_atr': 26, 'p_adx': 20, 'rsi_period': 22, 'ema1': 21, 'ema2': 41, 'slip_atr_k': 0.1911309053109703, 'slip_spread_k': 0.8632714260051079, 'spread_hl_frac': 0.035277390589201194, 'bb_std_mult': 2.37291302941004, 'rsi_os': 50, 'rsi_ob': 85, 'vol_spike': 0.2757161030395802, 'adx_thresh': 7.756449556770457, 'atr_min_pct': 0.02455494585220464, 'atr_max_pct': 0.05913600929533705, 'tp_mult': 2.1690822780326986, 'tsl_mult': 0.3914532182980147, 'strategy': 'mean_reversion', 'time_stop': 20, 'use_sma': True, 'use_atr': False, 'use_adx': True, 'use_ema': True, 'use_spike': False, 'rsi_required': False, 'edge_k': 0.10597044774993263, 'edge_cap': 0.43770782544733844, 'bull_strategy': 'breakout', 'bull_bb_std_mult': 2.9478371243121178, 'bull_rsi_os': 7, 'bull_rsi_ob': 86, 'bull_adx_thresh': 11.52634617101828, 'bull_atr_min_pct': 0.00990324351095434, 'bull_atr_max_pct': 0.03186310097423195, 'bull_tp_mult': 2.3750541675714847, 'bull_tsl_mult': 0.5140099511517693, 'bull_time_stop': 179, 'bull_use_sma': False, 'bull_use_ema': False, 'bull_use_atr': True, 'bull_use_adx': True, 'bull_use_spike': False, 'bull_rsi_required': False, 'bear_strategy': 'breakout', 'bear_bb_std_mult': 0.6229631277166374, 'bear_rsi_os': 30, 'bear_rsi_ob': 50, 'bear_adx_thresh': 26.583781796930793, 'bear_atr_min_pct': 0.01582656848470317, 'bear_atr_max_pct': 0.03135104201196433, 'bear_tp_mult': 2.6714512484880943, 'bear_tsl_mult': 0.9324989628493359, 'bear_time_stop': 192, 'bear_use_sma': True, 'bear_use_ema': False, 'bear_use_atr': False, 'bear_use_adx': False, 'bear_use_spike': False, 'bear_rsi_required': False, 'sideways_strategy': 'mean_reversion', 'sideways_bb_std_mult': 2.9387163098568045, 'sideways_rsi_os': 40, 'sideways_rsi_ob': 71, 'sideways_adx_thresh': 33.4038453446978, 'sideways_atr_min_pct': 0.0030470680985157073, 'sideways_atr_max_pct': 0.034175495451007176, 'sideways_tp_mult': 1.5480959680685684, 'sideways_tsl_mult': 0.999458293925353, 'sideways_time_stop': 168, 'sideways_use_sma': False, 'sideways_use_ema': False, 'sideways_use_atr': False, 'sideways_use_adx': True, 'sideways_use_spike': False, 'sideways_rsi_required': True}.
