[I 2025-08-30 19:02:21,320] Trial 297 finished with values: [-0.018159227232028785, 0.01820594561610305] and parameters: {'p_sma': 6, 'p_std': 32, 'p_atr': 8, 'p_adx': 30, 'rsi_period': 22, 'ema1': 23, 'ema2': 32, 'slip_atr_k': 0.07510691308364234, 'slip_spread_k': 0.4980892992424933, 'spread_hl_frac': 0.020811901432871566, 'bb_std_mult': 2.2029058529346637, 'rsi_os': 48, 'rsi_ob': 73, 'vol_spike': 0.06386181670275219, 'adx_thresh': 31.92380314648102, 'atr_min_pct': 0.023365664991398114, 'atr_max_pct': 0.09863895735866687, 'tp_mult': 2.2050178567417387, 'tsl_mult': 0.579964650028489, 'strategy': 'breakout', 'time_stop': 45, 'use_sma': True, 'use_atr': True, 'use_adx': True, 'use_ema': False, 'use_spike': False, 'rsi_required': True, 'edge_k': 1.3310967064290462, 'edge_cap': 0.5017307438916102, 'bull_strategy': 'mean_reversion', 'bull_bb_std_mult': 2.5241855738591035, 'bull_rsi_os': 29, 'bull_rsi_ob': 46, 'bull_adx_thresh': 16.97116023070327, 'bull_atr_min_pct': 0.0018882749685327448, 'bull_atr_max_pct': 0.11425118091636693, 'bull_tp_mult': 2.5333770741497013, 'bull_tsl_mult': 0.15643299106323144, 'bull_time_stop': 37, 'bull_use_sma': False, 'bull_use_ema': False, 'bull_use_atr': False, 'bull_use_adx': False, 'bull_use_spike': False, 'bull_rsi_required': True, 'bear_strategy': 'breakout', 'bear_bb_std_mult': 2.97560297130965, 'bear_rsi_os': 49, 'bear_rsi_ob': 59, 'bear_adx_thresh': 17.506063707000067, 'bear_atr_min_pct': 0.026413174362805318, 'bear_atr_max_pct': 0.03790318837949877, 'bear_tp_mult': 2.741653441339719, 'bear_tsl_mult': 0.6113610909845528, 'bear_time_stop': 207, 'bear_use_sma': True, 'bear_use_ema': False, 'bear_use_atr': False, 'bear_use_adx': True, 'bear_use_spike': False, 'bear_rsi_required': True, 'sideways_strategy': 'breakout', 'sideways_bb_std_mult': 1.0160660464564675, 'sideways_rsi_os': 35, 'sideways_rsi_ob': 59, 'sideways_adx_thresh': 23.278466022658492, 'sideways_atr_min_pct': 0.0014633537195267478, 'sideways_atr_max_pct': 0.14430516159798118, 'sideways_tp_mult': 2.218073293414614, 'sideways_tsl_mult': 0.11492306347924247, 'sideways_time_stop': 158, 'sideways_use_sma': True, 'sideways_use_ema': False, 'sideways_use_atr': True, 'sideways_use_adx': False, 'sideways_use_spike': True, 'sideways_rsi_required': True}.
[I 2025-08-30 19:02:21,623] Trial 298 finished with values: [-0.06264716132901427, 0.06260133352576071] and parameters: {'p_sma': 51, 'p_std': 32, 'p_atr': 8, 'p_adx': 22, 'rsi_period': 39, 'ema1': 23, 'ema2': 23, 'slip_atr_k': 0.07259618918157182, 'slip_spread_k': 0.7039280818480687, 'spread_hl_frac': 0.020964249812299832, 'bb_std_mult': 2.1927339227446967, 'rsi_os': 8, 'rsi_ob': 57, 'vol_spike': 0.061251081311467406, 'adx_thresh': 32.19618495649438, 'atr_min_pct': 0.015030910121097156, 'atr_max_pct': 0.09419289230166017, 'tp_mult': 2.2138276844029314, 'tsl_mult': 0.8132287217141352, 'strategy': 'breakout', 'time_stop': 226, 'use_sma': True, 'use_atr': True, 'use_adx': True, 'use_ema': False, 'use_spike': False, 'rsi_required': True, 'edge_k': 0.15711910587274666, 'edge_cap': 0.506764415627185, 'bull_strategy': 'mean_reversion', 'bull_bb_std_mult': 3.263732531150205, 'bull_rsi_os': 31, 'bull_rsi_ob': 46, 'bull_adx_thresh': 18.204413345455556, 'bull_atr_min_pct': 0.001767145120038657, 'bull_atr_max_pct': 0.12625972318931264, 'bull_tp_mult': 2.213030165020626, 'bull_tsl_mult': 0.7102678796410523, 'bull_time_stop': 133, 'bull_use_sma': False, 'bull_use_ema': False, 'bull_use_atr': True, 'bull_use_adx': False, 'bull_use_spike': False, 'bull_rsi_required': True, 'bear_strategy': 'breakout', 'bear_bb_std_mult': 2.933084443406522, 'bear_rsi_os': 49, 'bear_rsi_ob': 62, 'bear_adx_thresh': 17.554530653914593, 'bear_atr_min_pct': 0.016849160255109557, 'bear_atr_max_pct': 0.03853895187545381, 'bear_tp_mult': 2.4363132588179655, 'bear_tsl_mult': 0.7116100957409864, 'bear_time_stop': 211, 'bear_use_sma': True, 'bear_use_ema': False, 'bear_use_atr': False, 'bear_use_adx': True, 'bear_use_spike': False, 'bear_rsi_required': True, 'sideways_strategy': 'breakout', 'sideways_bb_std_mult': 1.2788018025588865, 'sideways_rsi_os': 37, 'sideways_rsi_ob': 59, 'sideways_adx_thresh': 5.004640888465893, 'sideways_atr_min_pct': 0.0018401865528734137, 'sideways_atr_max_pct': 0.11820980248098817, 'sideways_tp_mult': 2.2217313845132187, 'sideways_tsl_mult': 0.11608116035880095, 'sideways_time_stop': 156, 'sideways_use_sma': True, 'sideways_use_ema': False, 'sideways_use_atr': True, 'sideways_use_adx': False, 'sideways_use_spike': True, 'sideways_rsi_required': True}.
[I 2025-08-30 19:02:56,837] Trial 299 finished with values: [-0.03230831862143424, 0.03223547017084811] and parameters: {'p_sma': 50, 'p_std': 19, 'p_atr': 30, 'p_adx': 20, 'rsi_period': 47, 'ema1': 19, 'ema2': 55, 'slip_atr_k': 0.1191441521077206, 'slip_spread_k': 0.7202719809829576, 'spread_hl_frac': 0.03054811142861915, 'bb_std_mult': 1.0166765990395277, 'rsi_os': 21, 'rsi_ob': 86, 'vol_spike': 0.266858233345299, 'adx_thresh': 32.384361787599836, 'atr_min_pct': 0.023666570628977826, 'atr_max_pct': 0.09792320226282598, 'tp_mult': 2.19626030593905, 'tsl_mult': 0.879888544014748, 'strategy': 'breakout', 'time_stop': 92, 'use_sma': False, 'use_atr': True, 'use_adx': True, 'use_ema': False, 'use_spike': False, 'rsi_required': True, 'edge_k': 1.8723092691567609, 'edge_cap': 0.5698251619722133, 'bull_strategy': 'mean_reversion', 'bull_bb_std_mult': 1.9881686053229617, 'bull_rsi_os': 31, 'bull_rsi_ob': 95, 'bull_adx_thresh': 18.001568999885023, 'bull_atr_min_pct': 0.001495629368113089, 'bull_atr_max_pct': 0.1264549391396347, 'bull_tp_mult': 1.9160705878159057, 'bull_tsl_mult': 0.15717250849267234, 'bull_time_stop': 212, 'bull_use_sma': False, 'bull_use_ema': False, 'bull_use_atr': True, 'bull_use_adx': True, 'bull_use_spike': False, 'bull_rsi_required': False, 'bear_strategy': 'breakout', 'bear_bb_std_mult': 2.9435178708625016, 'bear_rsi_os': 26, 'bear_rsi_ob': 74, 'bear_adx_thresh': 29.821979442715257, 'bear_atr_min_pct': 0.014038677960614556, 'bear_atr_max_pct': 0.03736476685346315, 'bear_tp_mult': 2.4430402684985912, 'bear_tsl_mult': 0.7067872829039892, 'bear_time_stop': 186, 'bear_use_sma': True, 'bear_use_ema': False, 'bear_use_atr': False, 'bear_use_adx': True, 'bear_use_spike': False, 'bear_rsi_required': True, 'sideways_strategy': 'breakout', 'sideways_bb_std_mult': 1.0155245632643433, 'sideways_rsi_os': 15, 'sideways_rsi_ob': 94, 'sideways_adx_thresh': 33.968316651981034, 'sideways_atr_min_pct': 0.001868342845841566, 'sideways_atr_max_pct': 0.13933637101324045, 'sideways_tp_mult': 1.9776552838898214, 'sideways_tsl_mult': 0.8488310555894666, 'sideways_time_stop': 258, 'sideways_use_sma': True, 'sideways_use_ema': False, 'sideways_use_atr': True, 'sideways_use_adx': False, 'sideways_use_spike': True, 'sideways_rsi_required': True}.
[I 2025-08-30 19:02:57,772] Trial 301 finished with values: [-0.017024448135390058, 0.016907565837632556] and parameters: {'p_sma': 9, 'p_std': 32, 'p_atr': 8, 'p_adx': 20, 'rsi_period': 40, 'ema1': 22, 'ema2': 23, 'slip_atr_k': 0.07195500375651635, 'slip_spread_k': 0.15479233523388272, 'spread_hl_frac': 0.021015669338275575, 'bb_std_mult': 1.0484252713517992, 'rsi_os': 49, 'rsi_ob': 86, 'vol_spike': 0.2663436890043626, 'adx_thresh': 31.866752552436157, 'atr_min_pct': 0.023880526300220344, 'atr_max_pct': 0.08165074251200197, 'tp_mult': 2.382684581541183, 'tsl_mult': 0.7260870158078614, 'strategy': 'breakout', 'time_stop': 224, 'use_sma': False, 'use_atr': True, 'use_adx': True, 'use_ema': False, 'use_spike': True, 'rsi_required': False, 'edge_k': 1.3253789270003706, 'edge_cap': 0.5034909559297983, 'bull_strategy': 'mean_reversion', 'bull_bb_std_mult': 3.2558001160984515, 'bull_rsi_os': 29, 'bull_rsi_ob': 94, 'bull_adx_thresh': 18.22698284417671, 'bull_atr_min_pct': 0.009073632059227262, 'bull_atr_max_pct': 0.12674655170751717, 'bull_tp_mult': 2.63556749094664, 'bull_tsl_mult': 0.48252695031577036, 'bull_time_stop': 79, 'bull_use_sma': False, 'bull_use_ema': False, 'bull_use_atr': True, 'bull_use_adx': False, 'bull_use_spike': False, 'bull_rsi_required': True, 'bear_strategy': 'breakout', 'bear_bb_std_mult': 2.9469537020805263, 'bear_rsi_os': 29, 'bear_rsi_ob': 60, 'bear_adx_thresh': 20.16675485002733, 'bear_atr_min_pct': 0.013591457749022698, 'bear_atr_max_pct': 0.09358554570039224, 'bear_tp_mult': 2.1129840920181877, 'bear_tsl_mult': 0.8845812470591513, 'bear_time_stop': 211, 'bear_use_sma': True, 'bear_use_ema': True, 'bear_use_atr': False, 'bear_use_adx': True, 'bear_use_spike': False, 'bear_rsi_required': True, 'sideways_strategy': 'breakout', 'sideways_bb_std_mult': 1.2928061320142141, 'sideways_rsi_os': 39, 'sideways_rsi_ob': 94, 'sideways_adx_thresh': 20.19256844252487, 'sideways_atr_min_pct': 0.002248686611623155, 'sideways_atr_max_pct': 0.1499066626067642, 'sideways_tp_mult': 1.069384796880537, 'sideways_tsl_mult': 0.9545049621335718, 'sideways_time_stop': 252, 'sideways_use_sma': False, 'sideways_use_ema': False, 'sideways_use_atr': True, 'sideways_use_adx': False, 'sideways_use_spike': True, 'sideways_rsi_required': True}.
[I 2025-08-30 19:02:58,063] Trial 300 finished with values: [-0.022669237699834754, 0.022600718049435434] and parameters: {'p_sma': 13, 'p_std': 24, 'p_atr': 21, 'p_adx': 20, 'rsi_period': 40, 'ema1': 22, 'ema2': 23, 'slip_atr_k': 0.023492286653311836, 'slip_spread_k': 0.15622934338524946, 'spread_hl_frac': 0.0409112199002752, 'bb_std_mult': 0.7829125022726036, 'rsi_os': 49, 'rsi_ob': 86, 'vol_spike': 0.21896246918386475, 'adx_thresh': 5.644287011785607, 'atr_min_pct': 0.023869382497773758, 'atr_max_pct': 0.09832004075469558, 'tp_mult': 2.9353617179639704, 'tsl_mult': 0.8130401439966947, 'strategy': 'breakout', 'time_stop': 91, 'use_sma': False, 'use_atr': True, 'use_adx': True, 'use_ema': False, 'use_spike': True, 'rsi_required': True, 'edge_k': 0.7164498587866259, 'edge_cap': 0.500710402859373, 'bull_strategy': 'mean_reversion', 'bull_bb_std_mult': 1.8091889654587376, 'bull_rsi_os': 34, 'bull_rsi_ob': 78, 'bull_adx_thresh': 18.191918582223163, 'bull_atr_min_pct': 0.0007002373130520002, 'bull_atr_max_pct': 0.12701040700080932, 'bull_tp_mult': 2.1592989523458526, 'bull_tsl_mult': 0.475848941234657, 'bull_time_stop': 204, 'bull_use_sma': False, 'bull_use_ema': False, 'bull_use_atr': True, 'bull_use_adx': False, 'bull_use_spike': False, 'bull_rsi_required': True, 'bear_strategy': 'breakout', 'bear_bb_std_mult': 2.948337635422939, 'bear_rsi_os': 36, 'bear_rsi_ob': 92, 'bear_adx_thresh': 20.335661575530178, 'bear_atr_min_pct': 0.013431595997555865, 'bear_atr_max_pct': 0.1468633950828479, 'bear_tp_mult': 2.767149119861632, 'bear_tsl_mult': 0.6143179880782805, 'bear_time_stop': 274, 'bear_use_sma': True, 'bear_use_ema': True, 'bear_use_atr': False, 'bear_use_adx': True, 'bear_use_spike': False, 'bear_rsi_required': True, 'sideways_strategy': 'breakout', 'sideways_bb_std_mult': 3.0845941557237433, 'sideways_rsi_os': 36, 'sideways_rsi_ob': 94, 'sideways_adx_thresh': 20.091761272953917, 'sideways_atr_min_pct': 0.0021973585890223946, 'sideways_atr_max_pct': 0.11130068959216305, 'sideways_tp_mult': 2.4586099001787938, 'sideways_tsl_mult': 0.1281558168887923, 'sideways_time_stop': 5, 'sideways_use_sma': False, 'sideways_use_ema': False, 'sideways_use_atr': True, 'sideways_use_adx': False, 'sideways_use_spike': True, 'sideways_rsi_required': True}.
[I 2025-08-30 19:02:58,440] Trial 302 finished with values: [-1000000000.0, 1000000000.0] and parameters: {'p_sma': 6, 'p_std': 24, 'p_atr': 11, 'p_adx': 18, 'rsi_period': 22, 'ema1': 22, 'ema2': 32, 'slip_atr_k': 0.06595113842371027, 'slip_spread_k': 0.15637878618878964, 'spread_hl_frac': 0.046023805092289094, 'bb_std_mult': 2.566660249341005, 'rsi_os': 23, 'rsi_ob': 91, 'vol_spike': 0.2654581320809686, 'adx_thresh': 24.13518081372401, 'atr_min_pct': 0.023835339638941484, 'atr_max_pct': 0.08185035402995246, 'tp_mult': 2.185150088173197, 'tsl_mult': 0.9811057323794911, 'strategy': 'breakout', 'time_stop': 93, 'use_sma': False, 'use_atr': True, 'use_adx': True, 'use_ema': False, 'use_spike': True, 'rsi_required': False, 'edge_k': 1.3068881023401602, 'edge_cap': 0.4966095135771762, 'bull_strategy': 'mean_reversion', 'bull_bb_std_mult': 0.7645805597485842, 'bull_rsi_os': 34, 'bull_rsi_ob': 66, 'bull_adx_thresh': 6.637455105001131, 'bull_atr_min_pct': 0.002143478592693067, 'bull_atr_max_pct': 0.09736715922807743, 'bull_tp_mult': 2.1472521710504235, 'bull_tsl_mult': 0.47449201036719535, 'bull_time_stop': 94, 'bull_use_sma': False, 'bull_use_ema': False, 'bull_use_atr': True, 'bull_use_adx': False, 'bull_use_spike': False, 'bull_rsi_required': True, 'bear_strategy': 'breakout', 'bear_bb_std_mult': 2.976106238334123, 'bear_rsi_os': 35, 'bear_rsi_ob': 60, 'bear_adx_thresh': 15.96936623997379, 'bear_atr_min_pct': 0.01221541148938676, 'bear_atr_max_pct': 0.026601437116617173, 'bear_tp_mult': 2.784286311166752, 'bear_tsl_mult': 0.8840139437959255, 'bear_time_stop': 205, 'bear_use_sma': True, 'bear_use_ema': True, 'bear_use_atr': False, 'bear_use_adx': True, 'bear_use_spike': False, 'bear_rsi_required': True, 'sideways_strategy': 'breakout', 'sideways_bb_std_mult': 3.0857681845726144, 'sideways_rsi_os': 44, 'sideways_rsi_ob': 94, 'sideways_adx_thresh': 20.037924827432832, 'sideways_atr_min_pct': 0.002762616629338868, 'sideways_atr_max_pct': 0.1398025692482699, 'sideways_tp_mult': 2.0045215864654375, 'sideways_tsl_mult': 0.5114369659561079, 'sideways_time_stop': 154, 'sideways_use_sma': False, 'sideways_use_ema': True, 'sideways_use_atr': True, 'sideways_use_adx': False, 'sideways_use_spike': True, 'sideways_rsi_required': True}.
[I 2025-08-30 19:03:33,026] Trial 304 finished with values: [-1000000000.0, 1000000000.0] and parameters: {'p_sma': 6, 'p_std': 29, 'p_atr': 11, 'p_adx': 30, 'rsi_period': 32, 'ema1': 25, 'ema2': 32, 'slip_atr_k': 0.21793860365864132, 'slip_spread_k': 0.15854629181469396, 'spread_hl_frac': 0.033660245915883555, 'bb_std_mult': 1.9608587078236905, 'rsi_os': 50, 'rsi_ob': 86, 'vol_spike': 0.29339935005226, 'adx_thresh': 5.988715430794326, 'atr_min_pct': 0.024022295459402553, 'atr_max_pct': 0.09864540186951076, 'tp_mult': 2.385252810745711, 'tsl_mult': 0.875072841507966, 'strategy': 'breakout', 'time_stop': 181, 'use_sma': False, 'use_atr': False, 'use_adx': True, 'use_ema': False, 'use_spike': True, 'rsi_required': False, 'edge_k': 1.894887676156619, 'edge_cap': 0.5753670261197894, 'bull_strategy': 'mean_reversion', 'bull_bb_std_mult': 2.510338427494716, 'bull_rsi_os': 16, 'bull_rsi_ob': 88, 'bull_adx_thresh': 17.06785441616895, 'bull_atr_min_pct': 0.005549148118638587, 'bull_atr_max_pct': 0.046727164681111495, 'bull_tp_mult': 2.5392374689440063, 'bull_tsl_mult': 0.5738553381363382, 'bull_time_stop': 184, 'bull_use_sma': False, 'bull_use_ema': False, 'bull_use_atr': True, 'bull_use_adx': True, 'bull_use_spike': False, 'bull_rsi_required': False, 'bear_strategy': 'breakout', 'bear_bb_std_mult': 2.9559661717866024, 'bear_rsi_os': 52, 'bear_rsi_ob': 92, 'bear_adx_thresh': 17.761537145913945, 'bear_atr_min_pct': 0.006577015884620646, 'bear_atr_max_pct': 0.04385529972164156, 'bear_tp_mult': 2.8769369174763675, 'bear_tsl_mult': 0.6849305846506557, 'bear_time_stop': 187, 'bear_use_sma': True, 'bear_use_ema': True, 'bear_use_atr': False, 'bear_use_adx': True, 'bear_use_spike': False, 'bear_rsi_required': True, 'sideways_strategy': 'breakout', 'sideways_bb_std_mult': 0.9753645790325984, 'sideways_rsi_os': 33, 'sideways_rsi_ob': 94, 'sideways_adx_thresh': 20.144710740052627, 'sideways_atr_min_pct': 0.010468377362071585, 'sideways_atr_max_pct': 0.11011605157926484, 'sideways_tp_mult': 2.0226767223234616, 'sideways_tsl_mult': 0.8468832176614258, 'sideways_time_stop': 17, 'sideways_use_sma': False, 'sideways_use_ema': False, 'sideways_use_atr': True, 'sideways_use_adx': False, 'sideways_use_spike': True, 'sideways_rsi_required': True}.
[I 2025-08-30 19:03:33,935] Trial 305 finished with values: [-1000000000.0, 1000000000.0] and parameters: {'p_sma': 6, 'p_std': 31, 'p_atr': 11, 'p_adx': 20, 'rsi_period': 20, 'ema1': 25, 'ema2': 55, 'slip_atr_k': 0.1187154408214971, 'slip_spread_k': 0.15769549318421983, 'spread_hl_frac': 0.018300924658141867, 'bb_std_mult': 0.7954083850939309, 'rsi_os': 49, 'rsi_ob': 80, 'vol_spike': 0.2268916107873318, 'adx_thresh': 33.68848157539536, 'atr_min_pct': 0.025278674681011207, 'atr_max_pct': 0.09872589105147757, 'tp_mult': 2.9101324907333748, 'tsl_mult': 0.8837740891320147, 'strategy': 'breakout', 'time_stop': 45, 'use_sma': False, 'use_atr': False, 'use_adx': True, 'use_ema': False, 'use_spike': True, 'rsi_required': False, 'edge_k': 0.023768660075440276, 'edge_cap': 0.46109189235827686, 'bull_strategy': 'mean_reversion', 'bull_bb_std_mult': 0.7796238733736378, 'bull_rsi_os': 28, 'bull_rsi_ob': 94, 'bull_adx_thresh': 11.928553987583985, 'bull_atr_min_pct': 0.009110965698223568, 'bull_atr_max_pct': 0.09727484503877822, 'bull_tp_mult': 2.5178012213853314, 'bull_tsl_mult': 0.4713057781249214, 'bull_time_stop': 184, 'bull_use_sma': False, 'bull_use_ema': False, 'bull_use_atr': True, 'bull_use_adx': True, 'bull_use_spike': False, 'bull_rsi_required': False, 'bear_strategy': 'breakout', 'bear_bb_std_mult': 2.9755045289400863, 'bear_rsi_os': 28, 'bear_rsi_ob': 60, 'bear_adx_thresh': 15.893995601737501, 'bear_atr_min_pct': 0.01328476124821102, 'bear_atr_max_pct': 0.036344452212779245, 'bear_tp_mult': 1.537446433149547, 'bear_tsl_mult': 0.5755882884298513, 'bear_time_stop': 205, 'bear_use_sma': True, 'bear_use_ema': True, 'bear_use_atr': False, 'bear_use_adx': True, 'bear_use_spike': False, 'bear_rsi_required': True, 'sideways_strategy': 'breakout', 'sideways_bb_std_mult': 3.0902012379434955, 'sideways_rsi_os': 33, 'sideways_rsi_ob': 60, 'sideways_adx_thresh': 20.071768404720363, 'sideways_atr_min_pct': 0.002233443073769435, 'sideways_atr_max_pct': 0.07784014575381243, 'sideways_tp_mult': 1.9706199470973642, 'sideways_tsl_mult': 0.9561128998863857, 'sideways_time_stop': 268, 'sideways_use_sma': False, 'sideways_use_ema': False, 'sideways_use_atr': True, 'sideways_use_adx': False, 'sideways_use_spike': True, 'sideways_rsi_required': True}.
[I 2025-08-30 19:03:34,351] Trial 306 finished with values: [-1000000000.0, 1000000000.0] and parameters: {'p_sma': 9, 'p_std': 20, 'p_atr': 8, 'p_adx': 20, 'rsi_period': 63, 'ema1': 25, 'ema2': 30, 'slip_atr_k': 0.07569123093149098, 'slip_spread_k': 0.13579140923835134, 'spread_hl_frac': 0.030490104335436558, 'bb_std_mult': 2.042725568939452, 'rsi_os': 50, 'rsi_ob': 80, 'vol_spike': 0.22599359024603188, 'adx_thresh': 33.699797723346435, 'atr_min_pct': 0.02533663602847968, 'atr_max_pct': 0.09832440805465933, 'tp_mult': 2.348465748555805, 'tsl_mult': 0.8784589328811843, 'strategy': 'breakout', 'time_stop': 180, 'use_sma': False, 'use_atr': False, 'use_adx': True, 'use_ema': False, 'use_spike': True, 'rsi_required': False, 'edge_k': 1.8803784663974903, 'edge_cap': 0.4561469988144081, 'bull_strategy': 'mean_reversion', 'bull_bb_std_mult': 3.5152659809536, 'bull_rsi_os': 22, 'bull_rsi_ob': 78, 'bull_adx_thresh': 17.082460860763735, 'bull_atr_min_pct': 0.010627915200205788, 'bull_atr_max_pct': 0.11979455240181379, 'bull_tp_mult': 2.536150363887594, 'bull_tsl_mult': 0.9318037083138817, 'bull_time_stop': 184, 'bull_use_sma': True, 'bull_use_ema': True, 'bull_use_atr': True, 'bull_use_adx': True, 'bull_use_spike': False, 'bull_rsi_required': False, 'bear_strategy': 'breakout', 'bear_bb_std_mult': 2.9222922582220647, 'bear_rsi_os': 52, 'bear_rsi_ob': 82, 'bear_adx_thresh': 29.847544196339083, 'bear_atr_min_pct': 0.013245847611173547, 'bear_atr_max_pct': 0.11670464164628652, 'bear_tp_mult': 2.1135668955602473, 'bear_tsl_mult': 0.6973386353270117, 'bear_time_stop': 123, 'bear_use_sma': True, 'bear_use_ema': True, 'bear_use_atr': False, 'bear_use_adx': True, 'bear_use_spike': False, 'bear_rsi_required': False, 'sideways_strategy': 'breakout', 'sideways_bb_std_mult': 3.1140124871009265, 'sideways_rsi_os': 36, 'sideways_rsi_ob': 60, 'sideways_adx_thresh': 12.688862721263867, 'sideways_atr_min_pct': 0.002040571950426601, 'sideways_atr_max_pct': 0.14459724764910725, 'sideways_tp_mult': 2.46156807868252, 'sideways_tsl_mult': 0.9587490495515274, 'sideways_time_stop': 250, 'sideways_use_sma': False, 'sideways_use_ema': False, 'sideways_use_atr': True, 'sideways_use_adx': False, 'sideways_use_spike': True, 'sideways_rsi_required': True}.
