[I 2025-08-30 19:07:50,971] Trial 342 finished with values: [-1000000000.0, 1000000000.0] and parameters: {'p_sma': 6, 'p_std': 23, 'p_atr': 9, 'p_adx': 7, 'rsi_period': 80, 'ema1': 25, 'ema2': 19, 'slip_atr_k': 0.06700654652398022, 'slip_spread_k': 0.13980905515288233, 'spread_hl_frac': 0.00935375604315904, 'bb_std_mult': 1.9104402502257447, 'rsi_os': 51, 'rsi_ob': 72, 'vol_spike': 0.24550303524895872, 'adx_thresh': 5.55762359808932, 'atr_min_pct': 0.026927703149864528, 'atr_max_pct': 0.040250910981933376, 'tp_mult': 1.010636332977956, 'tsl_mult': 0.8003562135566974, 'strategy': 'breakout', 'time_stop': 122, 'use_sma': False, 'use_atr': True, 'use_adx': True, 'use_ema': False, 'use_spike': True, 'rsi_required': False, 'edge_k': 1.6309038730190428, 'edge_cap': 0.8686819325832822, 'bull_strategy': 'breakout', 'bull_bb_std_mult': 2.295322389521744, 'bull_rsi_os': 10, 'bull_rsi_ob': 47, 'bull_adx_thresh': 17.82478598884432, 'bull_atr_min_pct': 0.0002825356917881066, 'bull_atr_max_pct': 0.12106883785810672, 'bull_tp_mult': 2.766742415088581, 'bull_tsl_mult': 0.12181800144687371, 'bull_time_stop': 172, 'bull_use_sma': False, 'bull_use_ema': False, 'bull_use_atr': False, 'bull_use_adx': True, 'bull_use_spike': True, 'bull_rsi_required': True, 'bear_strategy': 'breakout', 'bear_bb_std_mult': 1.4955509261877915, 'bear_rsi_os': 14, 'bear_rsi_ob': 77, 'bear_adx_thresh': 23.29167845703274, 'bear_atr_min_pct': 0.021441559854280402, 'bear_atr_max_pct': 0.059322676948545205, 'bear_tp_mult': 1.7026352141113217, 'bear_tsl_mult': 0.0917626094003226, 'bear_time_stop': 181, 'bear_use_sma': True, 'bear_use_ema': True, 'bear_use_atr': False, 'bear_use_adx': True, 'bear_use_spike': False, 'bear_rsi_required': True, 'sideways_strategy': 'mean_reversion', 'sideways_bb_std_mult': 3.5774426596901026, 'sideways_rsi_os': 36, 'sideways_rsi_ob': 59, 'sideways_adx_thresh': 19.827841433789978, 'sideways_atr_min_pct': 0.005576480988902052, 'sideways_atr_max_pct': 0.12264057968275642, 'sideways_tp_mult': 1.041882447135087, 'sideways_tsl_mult': 0.9872047348751272, 'sideways_time_stop': 156, 'sideways_use_sma': False, 'sideways_use_ema': True, 'sideways_use_atr': True, 'sideways_use_adx': False, 'sideways_use_spike': True, 'sideways_rsi_required': True}.
[I 2025-08-30 19:07:51,476] Trial 343 finished with values: [-1000000000.0, 1000000000.0] and parameters: {'p_sma': 51, 'p_std': 39, 'p_atr': 27, 'p_adx': 21, 'rsi_period': 21, 'ema1': 17, 'ema2': 29, 'slip_atr_k': 0.06653928221343605, 'slip_spread_k': 0.14141034894500645, 'spread_hl_frac': 0.026579721705768243, 'bb_std_mult': 2.0034195397301806, 'rsi_os': 51, 'rsi_ob': 83, 'vol_spike': 0.24631403076801675, 'adx_thresh': 16.190016025237504, 'atr_min_pct': 0.02430618028634963, 'atr_max_pct': 0.08116008612291302, 'tp_mult': 1.202037581027766, 'tsl_mult': 0.813765376263029, 'strategy': 'mean_reversion', 'time_stop': 196, 'use_sma': False, 'use_atr': True, 'use_adx': True, 'use_ema': False, 'use_spike': True, 'rsi_required': False, 'edge_k': 0.19401536636691846, 'edge_cap': 0.2404512440109841, 'bull_strategy': 'mean_reversion', 'bull_bb_std_mult': 2.9289270228801763, 'bull_rsi_os': 30, 'bull_rsi_ob': 55, 'bull_adx_thresh': 17.649555967414482, 'bull_atr_min_pct': 0.018186313433137927, 'bull_atr_max_pct': 0.035212296131241126, 'bull_tp_mult': 1.5923475105906126, 'bull_tsl_mult': 0.8099331958964746, 'bull_time_stop': 174, 'bull_use_sma': False, 'bull_use_ema': True, 'bull_use_atr': False, 'bull_use_adx': True, 'bull_use_spike': True, 'bull_rsi_required': True, 'bear_strategy': 'mean_reversion', 'bear_bb_std_mult': 0.7674622215971008, 'bear_rsi_os': 36, 'bear_rsi_ob': 75, 'bear_adx_thresh': 21.064810002228512, 'bear_atr_min_pct': 0.021187828479107548, 'bear_atr_max_pct': 0.035252152438037934, 'bear_tp_mult': 2.669716009066148, 'bear_tsl_mult': 0.4362486010191939, 'bear_time_stop': 62, 'bear_use_sma': True, 'bear_use_ema': True, 'bear_use_atr': False, 'bear_use_adx': False, 'bear_use_spike': False, 'bear_rsi_required': True, 'sideways_strategy': 'breakout', 'sideways_bb_std_mult': 3.152295979464663, 'sideways_rsi_os': 36, 'sideways_rsi_ob': 59, 'sideways_adx_thresh': 22.743033823720943, 'sideways_atr_min_pct': 0.0011714585247847953, 'sideways_atr_max_pct': 0.09765714210006064, 'sideways_tp_mult': 1.271975877689869, 'sideways_tsl_mult': 0.9994689237771262, 'sideways_time_stop': 154, 'sideways_use_sma': False, 'sideways_use_ema': True, 'sideways_use_atr': False, 'sideways_use_adx': False, 'sideways_use_spike': False, 'sideways_rsi_required': True}.
[I 2025-08-30 19:07:51,506] Trial 344 finished with values: [-1000000000.0, 1000000000.0] and parameters: {'p_sma': 6, 'p_std': 30, 'p_atr': 9, 'p_adx': 7, 'rsi_period': 69, 'ema1': 17, 'ema2': 29, 'slip_atr_k': 0.06549191497496402, 'slip_spread_k': 0.10256667514449594, 'spread_hl_frac': 0.014031319141215241, 'bb_std_mult': 1.998895492970275, 'rsi_os': 50, 'rsi_ob': 51, 'vol_spike': 0.08068413235594023, 'adx_thresh': 10.241588407607946, 'atr_min_pct': 0.02303780445649071, 'atr_max_pct': 0.09293030147902069, 'tp_mult': 2.2698813707877368, 'tsl_mult': 0.8118559319775163, 'strategy': 'mean_reversion', 'time_stop': 195, 'use_sma': False, 'use_atr': True, 'use_adx': True, 'use_ema': False, 'use_spike': True, 'rsi_required': False, 'edge_k': 0.19768905391295521, 'edge_cap': 0.49940686761817427, 'bull_strategy': 'mean_reversion', 'bull_bb_std_mult': 2.6485221347431476, 'bull_rsi_os': 6, 'bull_rsi_ob': 47, 'bull_adx_thresh': 19.216349717080952, 'bull_atr_min_pct': 0.01781574645142073, 'bull_atr_max_pct': 0.1063063901236048, 'bull_tp_mult': 2.85199349243182, 'bull_tsl_mult': 0.12288291761705383, 'bull_time_stop': 166, 'bull_use_sma': False, 'bull_use_ema': True, 'bull_use_atr': False, 'bull_use_adx': True, 'bull_use_spike': True, 'bull_rsi_required': True, 'bear_strategy': 'mean_reversion', 'bear_bb_std_mult': 0.6970760367216249, 'bear_rsi_os': 52, 'bear_rsi_ob': 76, 'bear_adx_thresh': 14.988485134807492, 'bear_atr_min_pct': 0.011234905820426007, 'bear_atr_max_pct': 0.0352148840801015, 'bear_tp_mult': 2.659550974658831, 'bear_tsl_mult': 0.534027723841387, 'bear_time_stop': 231, 'bear_use_sma': False, 'bear_use_ema': True, 'bear_use_atr': False, 'bear_use_adx': False, 'bear_use_spike': False, 'bear_rsi_required': True, 'sideways_strategy': 'breakout', 'sideways_bb_std_mult': 3.5890155150462197, 'sideways_rsi_os': 34, 'sideways_rsi_ob': 46, 'sideways_adx_thresh': 19.556157799931505, 'sideways_atr_min_pct': 0.0013771206232964083, 'sideways_atr_max_pct': 0.058047970548637216, 'sideways_tp_mult': 1.259161080976126, 'sideways_tsl_mult': 0.9991030362498452, 'sideways_time_stop': 168, 'sideways_use_sma': False, 'sideways_use_ema': True, 'sideways_use_atr': False, 'sideways_use_adx': False, 'sideways_use_spike': False, 'sideways_rsi_required': True}.
[I 2025-08-30 19:07:51,656] Trial 346 finished with values: [-1000000000.0, 1000000000.0] and parameters: {'p_sma': 31, 'p_std': 47, 'p_atr': 9, 'p_adx': 21, 'rsi_period': 21, 'ema1': 26, 'ema2': 35, 'slip_atr_k': 0.0650254571830603, 'slip_spread_k': 0.09429084029222468, 'spread_hl_frac': 0.027070708111211275, 'bb_std_mult': 2.038253228136974, 'rsi_os': 50, 'rsi_ob': 59, 'vol_spike': 0.2667334327144922, 'adx_thresh': 15.852464347111676, 'atr_min_pct': 0.02310596950727696, 'atr_max_pct': 0.09376798563719448, 'tp_mult': 2.1997948105829987, 'tsl_mult': 0.8929683720861257, 'strategy': 'mean_reversion', 'time_stop': 194, 'use_sma': False, 'use_atr': True, 'use_adx': True, 'use_ema': True, 'use_spike': True, 'rsi_required': False, 'edge_k': 1.5136428971861258, 'edge_cap': 0.5003633225089233, 'bull_strategy': 'mean_reversion', 'bull_bb_std_mult': 2.9366973445836666, 'bull_rsi_os': 30, 'bull_rsi_ob': 48, 'bull_adx_thresh': 19.246645677980588, 'bull_atr_min_pct': 0.01806998565685169, 'bull_atr_max_pct': 0.10646776825828752, 'bull_tp_mult': 2.887416119207938, 'bull_tsl_mult': 0.5822864845575786, 'bull_time_stop': 234, 'bull_use_sma': False, 'bull_use_ema': True, 'bull_use_atr': True, 'bull_use_adx': True, 'bull_use_spike': False, 'bull_rsi_required': True, 'bear_strategy': 'mean_reversion', 'bear_bb_std_mult': 2.1674396529279965, 'bear_rsi_os': 36, 'bear_rsi_ob': 76, 'bear_adx_thresh': 21.412412856123012, 'bear_atr_min_pct': 0.006098577000296685, 'bear_atr_max_pct': 0.0348509673381019, 'bear_tp_mult': 2.671294163659756, 'bear_tsl_mult': 0.7609853471960017, 'bear_time_stop': 123, 'bear_use_sma': True, 'bear_use_ema': True, 'bear_use_atr': False, 'bear_use_adx': False, 'bear_use_spike': True, 'bear_rsi_required': True, 'sideways_strategy': 'breakout', 'sideways_bb_std_mult': 2.952006204763512, 'sideways_rsi_os': 5, 'sideways_rsi_ob': 64, 'sideways_adx_thresh': 26.38107528802028, 'sideways_atr_min_pct': 0.0013633966098551844, 'sideways_atr_max_pct': 0.06682470666048851, 'sideways_tp_mult': 1.2659285811668959, 'sideways_tsl_mult': 0.9998908017127045, 'sideways_time_stop': 170, 'sideways_use_sma': True, 'sideways_use_ema': True, 'sideways_use_atr': True, 'sideways_use_adx': True, 'sideways_use_spike': False, 'sideways_rsi_required': True}.
[I 2025-08-30 19:07:52,344] Trial 349 finished with values: [-1000000000.0, 1000000000.0] and parameters: {'p_sma': 9, 'p_std': 31, 'p_atr': 8, 'p_adx': 20, 'rsi_period': 30, 'ema1': 18, 'ema2': 31, 'slip_atr_k': 0.07921593866342357, 'slip_spread_k': 0.17312898233020468, 'spread_hl_frac': 0.023603593863777077, 'bb_std_mult': 2.522923046145735, 'rsi_os': 11, 'rsi_ob': 49, 'vol_spike': 0.20485618233535346, 'adx_thresh': 34.09492042979503, 'atr_min_pct': 0.02586836011406139, 'atr_max_pct': 0.05743794333363565, 'tp_mult': 2.31534199913298, 'tsl_mult': 0.7915070548664406, 'strategy': 'mean_reversion', 'time_stop': 182, 'use_sma': True, 'use_atr': True, 'use_adx': True, 'use_ema': True, 'use_spike': True, 'rsi_required': False, 'edge_k': 1.400324272715428, 'edge_cap': 0.5655541982216541, 'bull_strategy': 'mean_reversion', 'bull_bb_std_mult': 3.1292838410251522, 'bull_rsi_os': 14, 'bull_rsi_ob': 46, 'bull_adx_thresh': 18.56596735964578, 'bull_atr_min_pct': 0.001773288643584881, 'bull_atr_max_pct': 0.11150845419178398, 'bull_tp_mult': 1.7725762490629404, 'bull_tsl_mult': 0.3835272873012472, 'bull_time_stop': 143, 'bull_use_sma': False, 'bull_use_ema': True, 'bull_use_atr': True, 'bull_use_adx': False, 'bull_use_spike': False, 'bull_rsi_required': True, 'bear_strategy': 'breakout', 'bear_bb_std_mult': 0.9088699083567815, 'bear_rsi_os': 55, 'bear_rsi_ob': 76, 'bear_adx_thresh': 7.1426763039968915, 'bear_atr_min_pct': 0.015344146312225219, 'bear_atr_max_pct': 0.038730844195959, 'bear_tp_mult': 2.9368625678067537, 'bear_tsl_mult': 0.7895958234679001, 'bear_time_stop': 203, 'bear_use_sma': True, 'bear_use_ema': False, 'bear_use_atr': True, 'bear_use_adx': False, 'bear_use_spike': True, 'bear_rsi_required': False, 'sideways_strategy': 'breakout', 'sideways_bb_std_mult': 3.085893255700467, 'sideways_rsi_os': 43, 'sideways_rsi_ob': 89, 'sideways_adx_thresh': 28.544393205455627, 'sideways_atr_min_pct': 0.024943163852098674, 'sideways_atr_max_pct': 0.06334580213107152, 'sideways_tp_mult': 2.8944690654651586, 'sideways_tsl_mult': 0.6891259101782419, 'sideways_time_stop': 148, 'sideways_use_sma': False, 'sideways_use_ema': False, 'sideways_use_atr': True, 'sideways_use_adx': True, 'sideways_use_spike': False, 'sideways_rsi_required': True}.
[I 2025-08-30 19:08:17,292] Trial 345 finished with values: [-1000000000.0, 1000000000.0] and parameters: {'p_sma': 47, 'p_std': 30, 'p_atr': 9, 'p_adx': 20, 'rsi_period': 21, 'ema1': 17, 'ema2': 32, 'slip_atr_k': 0.06531979898294456, 'slip_spread_k': 0.097616415334113, 'spread_hl_frac': 0.026478348625307367, 'bb_std_mult': 1.7162931053483348, 'rsi_os': 11, 'rsi_ob': 62, 'vol_spike': 0.2672828815394832, 'adx_thresh': 12.55978671475908, 'atr_min_pct': 0.021177704842058116, 'atr_max_pct': 0.05699190844896212, 'tp_mult': 1.2385807126804145, 'tsl_mult': 0.8063990033831988, 'strategy': 'mean_reversion', 'time_stop': 19, 'use_sma': False, 'use_atr': True, 'use_adx': True, 'use_ema': False, 'use_spike': True, 'rsi_required': False, 'edge_k': 0.2062545814337733, 'edge_cap': 0.49958249250395026, 'bull_strategy': 'mean_reversion', 'bull_bb_std_mult': 2.9440130250541454, 'bull_rsi_os': 10, 'bull_rsi_ob': 84, 'bull_adx_thresh': 19.236161962328616, 'bull_atr_min_pct': 0.029407083615436008, 'bull_atr_max_pct': 0.1124088635386725, 'bull_tp_mult': 2.900605431403476, 'bull_tsl_mult': 0.7555884828517546, 'bull_time_stop': 255, 'bull_use_sma': False, 'bull_use_ema': True, 'bull_use_atr': False, 'bull_use_adx': True, 'bull_use_spike': True, 'bull_rsi_required': True, 'bear_strategy': 'mean_reversion', 'bear_bb_std_mult': 0.6545059034008878, 'bear_rsi_os': 55, 'bear_rsi_ob': 74, 'bear_adx_thresh': 17.297771883036894, 'bear_atr_min_pct': 0.015647755663704015, 'bear_atr_max_pct': 0.1000205355345127, 'bear_tp_mult': 2.6667386886213795, 'bear_tsl_mult': 0.09125897192679555, 'bear_time_stop': 63, 'bear_use_sma': True, 'bear_use_ema': True, 'bear_use_atr': False, 'bear_use_adx': False, 'bear_use_spike': True, 'bear_rsi_required': True, 'sideways_strategy': 'breakout', 'sideways_bb_std_mult': 2.9259297348254982, 'sideways_rsi_os': 34, 'sideways_rsi_ob': 75, 'sideways_adx_thresh': 22.62025455812621, 'sideways_atr_min_pct': 0.012906654584273832, 'sideways_atr_max_pct': 0.12187868604248703, 'sideways_tp_mult': 1.2660709311761422, 'sideways_tsl_mult': 0.9979566450802859, 'sideways_time_stop': 170, 'sideways_use_sma': False, 'sideways_use_ema': True, 'sideways_use_atr': True, 'sideways_use_adx': True, 'sideways_use_spike': False, 'sideways_rsi_required': True}.
[I 2025-08-30 19:08:21,251] Trial 347 finished with values: [-0.08239690122380983, 0.08230038057715726] and parameters: {'p_sma': 47, 'p_std': 11, 'p_atr': 9, 'p_adx': 14, 'rsi_period': 30, 'ema1': 26, 'ema2': 35, 'slip_atr_k': 0.06566419012403782, 'slip_spread_k': 0.1051276244209772, 'spread_hl_frac': 0.03294051454621625, 'bb_std_mult': 2.269205029039287, 'rsi_os': 28, 'rsi_ob': 91, 'vol_spike': 0.26714361089854854, 'adx_thresh': 34.54900402847483, 'atr_min_pct': 0.02306219574859251, 'atr_max_pct': 0.09282195462054586, 'tp_mult': 2.1691537571699855, 'tsl_mult': 0.9025517971992361, 'strategy': 'mean_reversion', 'time_stop': 193, 'use_sma': False, 'use_atr': True, 'use_adx': True, 'use_ema': True, 'use_spike': True, 'rsi_required': False, 'edge_k': 1.5171108233236286, 'edge_cap': 0.49970126258300357, 'bull_strategy': 'mean_reversion', 'bull_bb_std_mult': 3.147380585354187, 'bull_rsi_os': 6, 'bull_rsi_ob': 84, 'bull_adx_thresh': 19.163758287026145, 'bull_atr_min_pct': 0.02143074008743006, 'bull_atr_max_pct': 0.11312463008346002, 'bull_tp_mult': 1.2694730519775912, 'bull_tsl_mult': 0.5781999080658032, 'bull_time_stop': 242, 'bull_use_sma': False, 'bull_use_ema': True, 'bull_use_atr': True, 'bull_use_adx': False, 'bull_use_spike': False, 'bull_rsi_required': True, 'bear_strategy': 'mean_reversion', 'bear_bb_std_mult': 2.9423078072806117, 'bear_rsi_os': 31, 'bear_rsi_ob': 76, 'bear_adx_thresh': 16.80200405507784, 'bear_atr_min_pct': 0.015629762786570613, 'bear_atr_max_pct': 0.033158837770230334, 'bear_tp_mult': 2.6291894933264377, 'bear_tsl_mult': 0.11838700624186138, 'bear_time_stop': 220, 'bear_use_sma': True, 'bear_use_ema': True, 'bear_use_atr': True, 'bear_use_adx': False, 'bear_use_spike': True, 'bear_rsi_required': False, 'sideways_strategy': 'breakout', 'sideways_bb_std_mult': 1.3551614178726021, 'sideways_rsi_os': 42, 'sideways_rsi_ob': 61, 'sideways_adx_thresh': 21.305041891139606, 'sideways_atr_min_pct': 0.0014739419511131686, 'sideways_atr_max_pct': 0.05864262236026825, 'sideways_tp_mult': 2.676417196098491, 'sideways_tsl_mult': 0.3505687932345545, 'sideways_time_stop': 170, 'sideways_use_sma': True, 'sideways_use_ema': False, 'sideways_use_atr': True, 'sideways_use_adx': True, 'sideways_use_spike': False, 'sideways_rsi_required': True}.
[I 2025-08-30 19:08:21,429] Trial 348 finished with values: [-1000000000.0, 1000000000.0] and parameters: {'p_sma': 9, 'p_std': 11, 'p_atr': 8, 'p_adx': 20, 'rsi_period': 22, 'ema1': 13, 'ema2': 32, 'slip_atr_k': 0.08106906138280677, 'slip_spread_k': 0.1787248915033196, 'spread_hl_frac': 0.023265887427841886, 'bb_std_mult': 1.3959513574660836, 'rsi_os': 11, 'rsi_ob': 95, 'vol_spike': 0.20465223121027054, 'adx_thresh': 33.88861056315328, 'atr_min_pct': 0.02586300246873998, 'atr_max_pct': 0.10099365587439461, 'tp_mult': 1.744096039431466, 'tsl_mult': 0.7877988416974142, 'strategy': 'mean_reversion', 'time_stop': 181, 'use_sma': True, 'use_atr': True, 'use_adx': True, 'use_ema': True, 'use_spike': True, 'rsi_required': False, 'edge_k': 0.8457372669538281, 'edge_cap': 0.5680967240902728, 'bull_strategy': 'mean_reversion', 'bull_bb_std_mult': 3.1526109436910055, 'bull_rsi_os': 29, 'bull_rsi_ob': 90, 'bull_adx_thresh': 18.63447077196149, 'bull_atr_min_pct': 0.0017295419481227568, 'bull_atr_max_pct': 0.12620840248740817, 'bull_tp_mult': 2.166682078882128, 'bull_tsl_mult': 0.5769726062962452, 'bull_time_stop': 254, 'bull_use_sma': False, 'bull_use_ema': True, 'bull_use_atr': True, 'bull_use_adx': False, 'bull_use_spike': False, 'bull_rsi_required': True, 'bear_strategy': 'breakout', 'bear_bb_std_mult': 2.433546449859948, 'bear_rsi_os': 55, 'bear_rsi_ob': 74, 'bear_adx_thresh': 9.608181294984089, 'bear_atr_min_pct': 0.015603971718184282, 'bear_atr_max_pct': 0.07275225935748976, 'bear_tp_mult': 2.7099096411849817, 'bear_tsl_mult': 0.8075483126737171, 'bear_time_stop': 202, 'bear_use_sma': True, 'bear_use_ema': False, 'bear_use_atr': True, 'bear_use_adx': False, 'bear_use_spike': True, 'bear_rsi_required': False, 'sideways_strategy': 'breakout', 'sideways_bb_std_mult': 2.9507794764984157, 'sideways_rsi_os': 9, 'sideways_rsi_ob': 64, 'sideways_adx_thresh': 21.340270289994944, 'sideways_atr_min_pct': 0.013211748597340051, 'sideways_atr_max_pct': 0.1347873152855893, 'sideways_tp_mult': 1.1836132634987284, 'sideways_tsl_mult': 0.31545471480014975, 'sideways_time_stop': 148, 'sideways_use_sma': True, 'sideways_use_ema': False, 'sideways_use_atr': True, 'sideways_use_adx': True, 'sideways_use_spike': False, 'sideways_rsi_required': True}.
[I 2025-08-30 19:08:24,812] Trial 350 finished with values: [-1000000000.0, 1000000000.0] and parameters: {'p_sma': 46, 'p_std': 32, 'p_atr': 22, 'p_adx': 20, 'rsi_period': 18, 'ema1': 27, 'ema2': 32, 'slip_atr_k': 0.07026390562889231, 'slip_spread_k': 0.47966494147816935, 'spread_hl_frac': 0.024873756097391078, 'bb_std_mult': 1.38001013236605, 'rsi_os': 31, 'rsi_ob': 65, 'vol_spike': 0.27573626970971976, 'adx_thresh': 34.518253996569996, 'atr_min_pct': 0.02117800795074634, 'atr_max_pct': 0.10075315178354687, 'tp_mult': 2.163430808153579, 'tsl_mult': 0.5224319523009823, 'strategy': 'mean_reversion', 'time_stop': 183, 'use_sma': False, 'use_atr': False, 'use_adx': True, 'use_ema': False, 'use_spike': False, 'rsi_required': False, 'edge_k': 1.118003544547871, 'edge_cap': 0.5228476133371637, 'bull_strategy': 'mean_reversion', 'bull_bb_std_mult': 2.5365650200005394, 'bull_rsi_os': 40, 'bull_rsi_ob': 69, 'bull_adx_thresh': 12.67632076209896, 'bull_atr_min_pct': 0.0293632321690921, 'bull_atr_max_pct': 0.11383112767781495, 'bull_tp_mult': 1.2776184854344859, 'bull_tsl_mult': 0.07070136320951914, 'bull_time_stop': 59, 'bull_use_sma': False, 'bull_use_ema': True, 'bull_use_atr': True, 'bull_use_adx': False, 'bull_use_spike': False, 'bull_rsi_required': False, 'bear_strategy': 'breakout', 'bear_bb_std_mult': 1.0697077703674966, 'bear_rsi_os': 31, 'bear_rsi_ob': 77, 'bear_adx_thresh': 9.485663892536774, 'bear_atr_min_pct': 0.013514582104553054, 'bear_atr_max_pct': 0.045067035242872484, 'bear_tp_mult': 2.057455882288854, 'bear_tsl_mult': 0.8025786161707296, 'bear_time_stop': 220, 'bear_use_sma': True, 'bear_use_ema': True, 'bear_use_atr': False, 'bear_use_adx': False, 'bear_use_spike': False, 'bear_rsi_required': True, 'sideways_strategy': 'breakout', 'sideways_bb_std_mult': 3.1243959067562104, 'sideways_rsi_os': 9, 'sideways_rsi_ob': 61, 'sideways_adx_thresh': 21.287146485947083, 'sideways_atr_min_pct': 0.0025198529653693196, 'sideways_atr_max_pct': 0.1417639221406641, 'sideways_tp_mult': 2.9837838679376234, 'sideways_tsl_mult': 0.3471422696238238, 'sideways_time_stop': 25, 'sideways_use_sma': True, 'sideways_use_ema': False, 'sideways_use_atr': True, 'sideways_use_adx': False, 'sideways_use_spike': False, 'sideways_rsi_required': True}.
