[I 2025-08-30 19:16:26,389] Trial 414 finished with values: [-1000000000.0, 1000000000.0] and parameters: {'p_sma': 37, 'p_std': 39, 'p_atr': 8, 'p_adx': 22, 'rsi_period': 17, 'ema1': 26, 'ema2': 34, 'slip_atr_k': 0.21342677648410766, 'slip_spread_k': 0.1676788786940614, 'spread_hl_frac': 0.02455476432684901, 'bb_std_mult': 2.04227281708599, 'rsi_os': 50, 'rsi_ob': 83, 'vol_spike': 0.09806846536622207, 'adx_thresh': 31.332014198178484, 'atr_min_pct': 0.006449811856435625, 'atr_max_pct': 0.10050950355243872, 'tp_mult': 1.7261125301769173, 'tsl_mult': 0.8909710425384572, 'strategy': 'breakout', 'time_stop': 154, 'use_sma': False, 'use_atr': True, 'use_adx': True, 'use_ema': False, 'use_spike': True, 'rsi_required': False, 'edge_k': 1.2389967174613696, 'edge_cap': 0.4165521660229069, 'bull_strategy': 'mean_reversion', 'bull_bb_std_mult': 3.291021240402454, 'bull_rsi_os': 12, 'bull_rsi_ob': 48, 'bull_adx_thresh': 16.924481346720775, 'bull_atr_min_pct': 0.00013738500386413824, 'bull_atr_max_pct': 0.06257721631575477, 'bull_tp_mult': 1.995246280414653, 'bull_tsl_mult': 0.7075081059632213, 'bull_time_stop': 175, 'bull_use_sma': False, 'bull_use_ema': True, 'bull_use_atr': True, 'bull_use_adx': False, 'bull_use_spike': False, 'bull_rsi_required': True, 'bear_strategy': 'breakout', 'bear_bb_std_mult': 2.913143463898234, 'bear_rsi_os': 54, 'bear_rsi_ob': 73, 'bear_adx_thresh': 17.38860938773886, 'bear_atr_min_pct': 0.015352008245319381, 'bear_atr_max_pct': 0.03341709714116015, 'bear_tp_mult': 2.7594515462838154, 'bear_tsl_mult': 0.6372601891093188, 'bear_time_stop': 198, 'bear_use_sma': True, 'bear_use_ema': True, 'bear_use_atr': True, 'bear_use_adx': True, 'bear_use_spike': False, 'bear_rsi_required': True, 'sideways_strategy': 'breakout', 'sideways_bb_std_mult': 1.4139746175307348, 'sideways_rsi_os': 37, 'sideways_rsi_ob': 65, 'sideways_adx_thresh': 8.86448231109281, 'sideways_atr_min_pct': 0.02158812123878453, 'sideways_atr_max_pct': 0.14119605325326637, 'sideways_tp_mult': 1.102604754741478, 'sideways_tsl_mult': 0.9836312672377246, 'sideways_time_stop': 185, 'sideways_use_sma': False, 'sideways_use_ema': True, 'sideways_use_atr': False, 'sideways_use_adx': False, 'sideways_use_spike': True, 'sideways_rsi_required': True}.
[I 2025-08-30 19:16:26,663] Trial 416 finished with values: [-0.11514275095410342, 0.11513336653901755] and parameters: {'p_sma': 37, 'p_std': 31, 'p_atr': 12, 'p_adx': 21, 'rsi_period': 20, 'ema1': 26, 'ema2': 33, 'slip_atr_k': 0.06928140553764188, 'slip_spread_k': 0.5900127221582253, 'spread_hl_frac': 0.024097288937393765, 'bb_std_mult': 2.0715607938645824, 'rsi_os': 52, 'rsi_ob': 86, 'vol_spike': 0.10544423611198059, 'adx_thresh': 31.265497762984364, 'atr_min_pct': 0.000990959441247087, 'atr_max_pct': 0.12547031850383936, 'tp_mult': 2.2041988471281586, 'tsl_mult': 0.9520475377882014, 'strategy': 'breakout', 'time_stop': 182, 'use_sma': False, 'use_atr': True, 'use_adx': True, 'use_ema': True, 'use_spike': True, 'rsi_required': False, 'edge_k': 1.125807186162561, 'edge_cap': 0.4145229902741896, 'bull_strategy': 'mean_reversion', 'bull_bb_std_mult': 3.2660695305541814, 'bull_rsi_os': 11, 'bull_rsi_ob': 70, 'bull_adx_thresh': 11.423057361070315, 'bull_atr_min_pct': 5.277948329198562e-05, 'bull_atr_max_pct': 0.0874086400765164, 'bull_tp_mult': 2.8365459264378994, 'bull_tsl_mult': 0.5595135434094614, 'bull_time_stop': 174, 'bull_use_sma': False, 'bull_use_ema': True, 'bull_use_atr': False, 'bull_use_adx': False, 'bull_use_spike': True, 'bull_rsi_required': True, 'bear_strategy': 'breakout', 'bear_bb_std_mult': 0.836770567905323, 'bear_rsi_os': 52, 'bear_rsi_ob': 72, 'bear_adx_thresh': 27.16173018279755, 'bear_atr_min_pct': 0.015972485936911706, 'bear_atr_max_pct': 0.015318169669069237, 'bear_tp_mult': 2.7568556161435502, 'bear_tsl_mult': 0.6662864622018964, 'bear_time_stop': 198, 'bear_use_sma': True, 'bear_use_ema': False, 'bear_use_atr': True, 'bear_use_adx': True, 'bear_use_spike': False, 'bear_rsi_required': True, 'sideways_strategy': 'breakout', 'sideways_bb_std_mult': 3.3527903686258784, 'sideways_rsi_os': 37, 'sideways_rsi_ob': 66, 'sideways_adx_thresh': 9.016481207074682, 'sideways_atr_min_pct': 0.0007369675131277396, 'sideways_atr_max_pct': 0.1433331516175754, 'sideways_tp_mult': 2.5657652742280708, 'sideways_tsl_mult': 0.6440350257194453, 'sideways_time_stop': 181, 'sideways_use_sma': False, 'sideways_use_ema': True, 'sideways_use_atr': False, 'sideways_use_adx': False, 'sideways_use_spike': False, 'sideways_rsi_required': True}.
[I 2025-08-30 19:16:26,889] Trial 415 finished with values: [-1000000000.0, 1000000000.0] and parameters: {'p_sma': 6, 'p_std': 50, 'p_atr': 12, 'p_adx': 23, 'rsi_period': 20, 'ema1': 26, 'ema2': 37, 'slip_atr_k': 0.08357031350652017, 'slip_spread_k': 0.22118666340912713, 'spread_hl_frac': 0.04310295730151904, 'bb_std_mult': 1.6830758364759781, 'rsi_os': 52, 'rsi_ob': 83, 'vol_spike': 0.07865236725144281, 'adx_thresh': 31.293645995904914, 'atr_min_pct': 0.02439104541962018, 'atr_max_pct': 0.09484398528733844, 'tp_mult': 2.1866435364834023, 'tsl_mult': 0.943500482206648, 'strategy': 'breakout', 'time_stop': 192, 'use_sma': False, 'use_atr': True, 'use_adx': True, 'use_ema': True, 'use_spike': True, 'rsi_required': False, 'edge_k': 0.2238858228945374, 'edge_cap': 0.22133852397496923, 'bull_strategy': 'breakout', 'bull_bb_std_mult': 3.246082160088427, 'bull_rsi_os': 46, 'bull_rsi_ob': 82, 'bull_adx_thresh': 11.190488361559728, 'bull_atr_min_pct': 0.012173873897600013, 'bull_atr_max_pct': 0.1329057949481509, 'bull_tp_mult': 2.6494669616105724, 'bull_tsl_mult': 0.5642149464714519, 'bull_time_stop': 180, 'bull_use_sma': False, 'bull_use_ema': True, 'bull_use_atr': True, 'bull_use_adx': False, 'bull_use_spike': False, 'bull_rsi_required': True, 'bear_strategy': 'breakout', 'bear_bb_std_mult': 2.9079167778780803, 'bear_rsi_os': 52, 'bear_rsi_ob': 73, 'bear_adx_thresh': 17.64985264946369, 'bear_atr_min_pct': 0.02304753017895684, 'bear_atr_max_pct': 0.033779340577956715, 'bear_tp_mult': 2.7617244736299402, 'bear_tsl_mult': 0.6305785185523911, 'bear_time_stop': 199, 'bear_use_sma': True, 'bear_use_ema': True, 'bear_use_atr': True, 'bear_use_adx': True, 'bear_use_spike': False, 'bear_rsi_required': True, 'sideways_strategy': 'breakout', 'sideways_bb_std_mult': 3.3598091365003593, 'sideways_rsi_os': 37, 'sideways_rsi_ob': 65, 'sideways_adx_thresh': 9.111753481397434, 'sideways_atr_min_pct': 0.02735305027694051, 'sideways_atr_max_pct': 0.14277408631693833, 'sideways_tp_mult': 2.561964387221616, 'sideways_tsl_mult': 0.9856362360573777, 'sideways_time_stop': 182, 'sideways_use_sma': False, 'sideways_use_ema': True, 'sideways_use_atr': False, 'sideways_use_adx': False, 'sideways_use_spike': True, 'sideways_rsi_required': True}.
[I 2025-08-30 19:16:27,574] Trial 417 finished with values: [-1000000000.0, 1000000000.0] and parameters: {'p_sma': 6, 'p_std': 31, 'p_atr': 8, 'p_adx': 23, 'rsi_period': 14, 'ema1': 26, 'ema2': 50, 'slip_atr_k': 0.06799338164617923, 'slip_spread_k': 0.8126537330818029, 'spread_hl_frac': 0.009553207332060852, 'bb_std_mult': 2.0990136409597167, 'rsi_os': 52, 'rsi_ob': 83, 'vol_spike': 0.10143352890180063, 'adx_thresh': 10.544994292846157, 'atr_min_pct': 0.022893483438627852, 'atr_max_pct': 0.09494993396125724, 'tp_mult': 2.1884370997234943, 'tsl_mult': 0.8986332868966166, 'strategy': 'mean_reversion', 'time_stop': 180, 'use_sma': False, 'use_atr': True, 'use_adx': True, 'use_ema': True, 'use_spike': True, 'rsi_required': False, 'edge_k': 1.9874009239509063, 'edge_cap': 0.22487471718244867, 'bull_strategy': 'mean_reversion', 'bull_bb_std_mult': 3.1004800498579037, 'bull_rsi_os': 12, 'bull_rsi_ob': 48, 'bull_adx_thresh': 10.50833045327547, 'bull_atr_min_pct': 8.224476163184872e-06, 'bull_atr_max_pct': 0.048816806283384695, 'bull_tp_mult': 2.646230572724116, 'bull_tsl_mult': 0.5670405429681067, 'bull_time_stop': 176, 'bull_use_sma': False, 'bull_use_ema': True, 'bull_use_atr': False, 'bull_use_adx': False, 'bull_use_spike': True, 'bull_rsi_required': True, 'bear_strategy': 'breakout', 'bear_bb_std_mult': 2.957983077533716, 'bear_rsi_os': 53, 'bear_rsi_ob': 73, 'bear_adx_thresh': 17.371860751782485, 'bear_atr_min_pct': 0.013042981738127924, 'bear_atr_max_pct': 0.014546794228574939, 'bear_tp_mult': 2.7658419254604816, 'bear_tsl_mult': 0.8937454763967847, 'bear_time_stop': 199, 'bear_use_sma': True, 'bear_use_ema': False, 'bear_use_atr': True, 'bear_use_adx': False, 'bear_use_spike': True, 'bear_rsi_required': True, 'sideways_strategy': 'breakout', 'sideways_bb_std_mult': 0.9540384244154736, 'sideways_rsi_os': 37, 'sideways_rsi_ob': 70, 'sideways_adx_thresh': 20.8053604263014, 'sideways_atr_min_pct': 0.018455026851194795, 'sideways_atr_max_pct': 0.14423814071559157, 'sideways_tp_mult': 1.7016775834427658, 'sideways_tsl_mult': 0.9851468573913285, 'sideways_time_stop': 195, 'sideways_use_sma': True, 'sideways_use_ema': True, 'sideways_use_atr': True, 'sideways_use_adx': False, 'sideways_use_spike': False, 'sideways_rsi_required': True}.
[I 2025-08-30 19:17:01,353] Trial 420 finished with values: [-1000000000.0, 1000000000.0] and parameters: {'p_sma': 53, 'p_std': 18, 'p_atr': 10, 'p_adx': 19, 'rsi_period': 25, 'ema1': 7, 'ema2': 29, 'slip_atr_k': 0.07551266874688631, 'slip_spread_k': 0.610792851755433, 'spread_hl_frac': 0.035356880845635257, 'bb_std_mult': 2.7252610872546725, 'rsi_os': 15, 'rsi_ob': 81, 'vol_spike': 0.02699681114543752, 'adx_thresh': 34.301414661973226, 'atr_min_pct': 0.022569790387936765, 'atr_max_pct': 0.0968737924758914, 'tp_mult': 2.2465194719213293, 'tsl_mult': 0.8457485085043474, 'strategy': 'mean_reversion', 'time_stop': 180, 'use_sma': False, 'use_atr': True, 'use_adx': True, 'use_ema': False, 'use_spike': True, 'rsi_required': True, 'edge_k': 0.807936805185689, 'edge_cap': 0.5039939380783988, 'bull_strategy': 'mean_reversion', 'bull_bb_std_mult': 3.1148528727653306, 'bull_rsi_os': 32, 'bull_rsi_ob': 63, 'bull_adx_thresh': 29.058314528489547, 'bull_atr_min_pct': 0.028653330500967158, 'bull_atr_max_pct': 0.1128034443928579, 'bull_tp_mult': 2.782156762877402, 'bull_tsl_mult': 0.0013446031512463485, 'bull_time_stop': 206, 'bull_use_sma': True, 'bull_use_ema': True, 'bull_use_atr': False, 'bull_use_adx': True, 'bull_use_spike': True, 'bull_rsi_required': True, 'bear_strategy': 'breakout', 'bear_bb_std_mult': 2.096675288180852, 'bear_rsi_os': 15, 'bear_rsi_ob': 83, 'bear_adx_thresh': 19.519589085763283, 'bear_atr_min_pct': 0.012711399397440822, 'bear_atr_max_pct': 0.030229160385422574, 'bear_tp_mult': 2.933573540580593, 'bear_tsl_mult': 0.5905682296224519, 'bear_time_stop': 213, 'bear_use_sma': True, 'bear_use_ema': False, 'bear_use_atr': False, 'bear_use_adx': False, 'bear_use_spike': True, 'bear_rsi_required': False, 'sideways_strategy': 'breakout', 'sideways_bb_std_mult': 0.9555531510147786, 'sideways_rsi_os': 18, 'sideways_rsi_ob': 62, 'sideways_adx_thresh': 20.848247447744416, 'sideways_atr_min_pct': 0.0021946731360301345, 'sideways_atr_max_pct': 0.1481282813962276, 'sideways_tp_mult': 1.6950644074329129, 'sideways_tsl_mult': 0.15606754903055986, 'sideways_time_stop': 272, 'sideways_use_sma': True, 'sideways_use_ema': True, 'sideways_use_atr': True, 'sideways_use_adx': False, 'sideways_use_spike': False, 'sideways_rsi_required': False}.
[I 2025-08-30 19:17:01,932] Trial 418 finished with values: [-1000000000.0, 1000000000.0] and parameters: {'p_sma': 6, 'p_std': 45, 'p_atr': 21, 'p_adx': 23, 'rsi_period': 14, 'ema1': 26, 'ema2': 32, 'slip_atr_k': 0.08361448898395302, 'slip_spread_k': 0.589974387377544, 'spread_hl_frac': 0.04790888016023259, 'bb_std_mult': 2.1259147675376733, 'rsi_os': 15, 'rsi_ob': 86, 'vol_spike': 0.2422433393201014, 'adx_thresh': 5.439061797728128, 'atr_min_pct': 0.0034972107060736776, 'atr_max_pct': 0.1323971873457815, 'tp_mult': 1.114793866278056, 'tsl_mult': 0.8412522469195034, 'strategy': 'mean_reversion', 'time_stop': 180, 'use_sma': False, 'use_atr': True, 'use_adx': True, 'use_ema': True, 'use_spike': True, 'rsi_required': False, 'edge_k': 1.9954882673195604, 'edge_cap': 0.7896556085610343, 'bull_strategy': 'mean_reversion', 'bull_bb_std_mult': 3.0953947463903173, 'bull_rsi_os': 23, 'bull_rsi_ob': 50, 'bull_adx_thresh': 13.29795925678441, 'bull_atr_min_pct': 0.0014559651538244463, 'bull_atr_max_pct': 0.08800716885944196, 'bull_tp_mult': 2.777588591691464, 'bull_tsl_mult': 0.5635516125295366, 'bull_time_stop': 183, 'bull_use_sma': False, 'bull_use_ema': True, 'bull_use_atr': False, 'bull_use_adx': True, 'bull_use_spike': True, 'bull_rsi_required': True, 'bear_strategy': 'breakout', 'bear_bb_std_mult': 1.5901522309803942, 'bear_rsi_os': 17, 'bear_rsi_ob': 72, 'bear_adx_thresh': 19.646731137053404, 'bear_atr_min_pct': 0.019915298957992954, 'bear_atr_max_pct': 0.030356048782810723, 'bear_tp_mult': 2.7410516487554064, 'bear_tsl_mult': 0.6694598854536951, 'bear_time_stop': 225, 'bear_use_sma': True, 'bear_use_ema': False, 'bear_use_atr': False, 'bear_use_adx': False, 'bear_use_spike': True, 'bear_rsi_required': True, 'sideways_strategy': 'breakout', 'sideways_bb_std_mult': 3.321486808262673, 'sideways_rsi_os': 18, 'sideways_rsi_ob': 95, 'sideways_adx_thresh': 20.905927601140114, 'sideways_atr_min_pct': 0.0004786778867467865, 'sideways_atr_max_pct': 0.14317840695794368, 'sideways_tp_mult': 2.091922629466757, 'sideways_tsl_mult': 0.7981303151524817, 'sideways_time_stop': 169, 'sideways_use_sma': True, 'sideways_use_ema': True, 'sideways_use_atr': True, 'sideways_use_adx': False, 'sideways_use_spike': False, 'sideways_rsi_required': False}.
[I 2025-08-30 19:17:02,155] Trial 419 finished with values: [-1000000000.0, 1000000000.0] and parameters: {'p_sma': 6, 'p_std': 30, 'p_atr': 18, 'p_adx': 23, 'rsi_period': 26, 'ema1': 7, 'ema2': 37, 'slip_atr_k': 0.07421836772314877, 'slip_spread_k': 0.2206337242805565, 'spread_hl_frac': 0.014682455860329317, 'bb_std_mult': 2.656982689422307, 'rsi_os': 15, 'rsi_ob': 81, 'vol_spike': 0.2424326829985048, 'adx_thresh': 34.26146425897949, 'atr_min_pct': 0.0224408376155323, 'atr_max_pct': 0.0800660278789734, 'tp_mult': 1.0974968764739463, 'tsl_mult': 0.8435434099192782, 'strategy': 'mean_reversion', 'time_stop': 230, 'use_sma': False, 'use_atr': True, 'use_adx': True, 'use_ema': True, 'use_spike': True, 'rsi_required': False, 'edge_k': 0.15066863933808575, 'edge_cap': 0.5043524310333511, 'bull_strategy': 'breakout', 'bull_bb_std_mult': 3.1116656835769247, 'bull_rsi_os': 23, 'bull_rsi_ob': 63, 'bull_adx_thresh': 18.2457039077687, 'bull_atr_min_pct': 0.0015722555369303028, 'bull_atr_max_pct': 0.11178215141152194, 'bull_tp_mult': 2.667795682586994, 'bull_tsl_mult': 0.8310335243870057, 'bull_time_stop': 18, 'bull_use_sma': False, 'bull_use_ema': True, 'bull_use_atr': True, 'bull_use_adx': True, 'bull_use_spike': False, 'bull_rsi_required': True, 'bear_strategy': 'breakout', 'bear_bb_std_mult': 0.6202703897200526, 'bear_rsi_os': 52, 'bear_rsi_ob': 72, 'bear_adx_thresh': 12.988003565722279, 'bear_atr_min_pct': 0.004025914278961085, 'bear_atr_max_pct': 0.13487419641073758, 'bear_tp_mult': 2.3425695338118375, 'bear_tsl_mult': 0.4925711256751687, 'bear_time_stop': 235, 'bear_use_sma': True, 'bear_use_ema': True, 'bear_use_atr': False, 'bear_use_adx': False, 'bear_use_spike': True, 'bear_rsi_required': False, 'sideways_strategy': 'breakout', 'sideways_bb_std_mult': 3.139457711728051, 'sideways_rsi_os': 53, 'sideways_rsi_ob': 63, 'sideways_adx_thresh': 5.6549857497752765, 'sideways_atr_min_pct': 0.02750929124529365, 'sideways_atr_max_pct': 0.10054991243030542, 'sideways_tp_mult': 1.698759654153055, 'sideways_tsl_mult': 0.15873940122700247, 'sideways_time_stop': 171, 'sideways_use_sma': True, 'sideways_use_ema': True, 'sideways_use_atr': True, 'sideways_use_adx': False, 'sideways_use_spike': False, 'sideways_rsi_required': False}.
[I 2025-08-30 19:17:02,749] Trial 421 finished with values: [-1000000000.0, 1000000000.0] and parameters: {'p_sma': 16, 'p_std': 18, 'p_atr': 21, 'p_adx': 19, 'rsi_period': 11, 'ema1': 7, 'ema2': 29, 'slip_atr_k': 0.07572420876657208, 'slip_spread_k': 0.1319683054921405, 'spread_hl_frac': 0.022203545217253023, 'bb_std_mult': 2.7049380200866575, 'rsi_os': 25, 'rsi_ob': 81, 'vol_spike': 0.2531418593318764, 'adx_thresh': 34.40671927698183, 'atr_min_pct': 0.025550224159597068, 'atr_max_pct': 0.10641633614621533, 'tp_mult': 2.274213056374983, 'tsl_mult': 0.8418732210820523, 'strategy': 'mean_reversion', 'time_stop': 189, 'use_sma': False, 'use_atr': False, 'use_adx': True, 'use_ema': False, 'use_spike': False, 'rsi_required': True, 'edge_k': 0.17838590110989427, 'edge_cap': 0.504870445050139, 'bull_strategy': 'mean_reversion', 'bull_bb_std_mult': 3.085775765392804, 'bull_rsi_os': 31, 'bull_rsi_ob': 47, 'bull_adx_thresh': 29.042131965383852, 'bull_atr_min_pct': 0.007647274801289504, 'bull_atr_max_pct': 0.1112170231957213, 'bull_tp_mult': 1.224370098180626, 'bull_tsl_mult': 0.540127854874994, 'bull_time_stop': 167, 'bull_use_sma': True, 'bull_use_ema': True, 'bull_use_atr': True, 'bull_use_adx': True, 'bull_use_spike': False, 'bull_rsi_required': False, 'bear_strategy': 'breakout', 'bear_bb_std_mult': 2.2710879180727854, 'bear_rsi_os': 44, 'bear_rsi_ob': 80, 'bear_adx_thresh': 16.938145580320693, 'bear_atr_min_pct': 0.014984375228957323, 'bear_atr_max_pct': 0.12639748305280224, 'bear_tp_mult': 1.3461372001816558, 'bear_tsl_mult': 0.46001643380741764, 'bear_time_stop': 212, 'bear_use_sma': False, 'bear_use_ema': True, 'bear_use_atr': False, 'bear_use_adx': False, 'bear_use_spike': True, 'bear_rsi_required': False, 'sideways_strategy': 'breakout', 'sideways_bb_std_mult': 3.130261553417915, 'sideways_rsi_os': 14, 'sideways_rsi_ob': 62, 'sideways_adx_thresh': 5.976169917247402, 'sideways_atr_min_pct': 0.014731361985088313, 'sideways_atr_max_pct': 0.10083399304052824, 'sideways_tp_mult': 1.070478481860397, 'sideways_tsl_mult': 0.9632555427855749, 'sideways_time_stop': 171, 'sideways_use_sma': True, 'sideways_use_ema': True, 'sideways_use_atr': True, 'sideways_use_adx': False, 'sideways_use_spike': False, 'sideways_rsi_required': False}.
[I 2025-08-30 19:17:34,982] Trial 423 finished with values: [-1000000000.0, 1000000000.0] and parameters: {'p_sma': 22, 'p_std': 33, 'p_atr': 30, 'p_adx': 11, 'rsi_period': 21, 'ema1': 25, 'ema2': 31, 'slip_atr_k': 0.073107673673873, 'slip_spread_k': 0.1262334117753371, 'spread_hl_frac': 0.02215008489265051, 'bb_std_mult': 1.091626148330609, 'rsi_os': 8, 'rsi_ob': 85, 'vol_spike': 0.11655377944965845, 'adx_thresh': 18.52724836889272, 'atr_min_pct': 0.026084632125204798, 'atr_max_pct': 0.10612988745509969, 'tp_mult': 2.289403485202509, 'tsl_mult': 0.8730476794506901, 'strategy': 'mean_reversion', 'time_stop': 37, 'use_sma': False, 'use_atr': False, 'use_adx': False, 'use_ema': False, 'use_spike': False, 'rsi_required': False, 'edge_k': 0.15086237380808723, 'edge_cap': 0.17665498102722793, 'bull_strategy': 'breakout', 'bull_bb_std_mult': 1.4765194328828404, 'bull_rsi_os': 31, 'bull_rsi_ob': 75, 'bull_adx_thresh': 18.98151316537846, 'bull_atr_min_pct': 0.002794104149411728, 'bull_atr_max_pct': 0.12319347501633668, 'bull_tp_mult': 2.142579345832258, 'bull_tsl_mult': 0.251422362332092, 'bull_time_stop': 164, 'bull_use_sma': False, 'bull_use_ema': False, 'bull_use_atr': True, 'bull_use_adx': False, 'bull_use_spike': False, 'bull_rsi_required': False, 'bear_strategy': 'mean_reversion', 'bear_bb_std_mult': 3.0776758476542514, 'bear_rsi_os': 35, 'bear_rsi_ob': 86, 'bear_adx_thresh': 16.68099766684891, 'bear_atr_min_pct': 0.015046516025053568, 'bear_atr_max_pct': 0.11440871586120448, 'bear_tp_mult': 1.966918575733844, 'bear_tsl_mult': 0.8791227010117251, 'bear_time_stop': 204, 'bear_use_sma': False, 'bear_use_ema': True, 'bear_use_atr': False, 'bear_use_adx': False, 'bear_use_spike': False, 'bear_rsi_required': False, 'sideways_strategy': 'mean_reversion', 'sideways_bb_std_mult': 3.1485080480224004, 'sideways_rsi_os': 42, 'sideways_rsi_ob': 58, 'sideways_adx_thresh': 31.052356057463474, 'sideways_atr_min_pct': 0.002569500303539202, 'sideways_atr_max_pct': 0.0259559819982065, 'sideways_tp_mult': 2.409570138631619, 'sideways_tsl_mult': 0.9605200635131008, 'sideways_time_stop': 112, 'sideways_use_sma': False, 'sideways_use_ema': False, 'sideways_use_atr': True, 'sideways_use_adx': False, 'sideways_use_spike': False, 'sideways_rsi_required': True}.
