[I 2025-08-30 19:28:34,871] Trial 522 finished with values: [-1000000000.0, 1000000000.0] and parameters: {'p_sma': 8, 'p_std': 32, 'p_atr': 19, 'p_adx': 21, 'rsi_period': 48, 'ema1': 24, 'ema2': 54, 'slip_atr_k': 0.14650489738151887, 'slip_spread_k': 0.4877336184299549, 'spread_hl_frac': 0.033834584641738226, 'bb_std_mult': 3.3815946544353364, 'rsi_os': 49, 'rsi_ob': 83, 'vol_spike': 0.25257096643052407, 'adx_thresh': 34.40865113096493, 'atr_min_pct': 0.023675023443912604, 'atr_max_pct': 0.052423748882738055, 'tp_mult': 2.344012765970547, 'tsl_mult': 0.8278546347299317, 'strategy': 'mean_reversion', 'time_stop': 94, 'use_sma': False, 'use_atr': True, 'use_adx': True, 'use_ema': False, 'use_spike': True, 'rsi_required': False, 'edge_k': 1.8066200412305577, 'edge_cap': 0.33178640474589627, 'bull_strategy': 'mean_reversion', 'bull_bb_std_mult': 0.9655210411229689, 'bull_rsi_os': 31, 'bull_rsi_ob': 68, 'bull_adx_thresh': 17.925802349080495, 'bull_atr_min_pct': 0.0010440182338957147, 'bull_atr_max_pct': 0.11860606479333136, 'bull_tp_mult': 2.0670142246722554, 'bull_tsl_mult': 0.6560122300234105, 'bull_time_stop': 196, 'bull_use_sma': True, 'bull_use_ema': True, 'bull_use_atr': False, 'bull_use_adx': False, 'bull_use_spike': True, 'bull_rsi_required': True, 'bear_strategy': 'breakout', 'bear_bb_std_mult': 2.9075946613526042, 'bear_rsi_os': 50, 'bear_rsi_ob': 74, 'bear_adx_thresh': 18.561748203423168, 'bear_atr_min_pct': 0.013767612589163645, 'bear_atr_max_pct': 0.024160523556774872, 'bear_tp_mult': 2.732946836805715, 'bear_tsl_mult': 0.033557901220058695, 'bear_time_stop': 72, 'bear_use_sma': True, 'bear_use_ema': True, 'bear_use_atr': True, 'bear_use_adx': False, 'bear_use_spike': False, 'bear_rsi_required': True, 'sideways_strategy': 'breakout', 'sideways_bb_std_mult': 1.7783935357494816, 'sideways_rsi_os': 24, 'sideways_rsi_ob': 73, 'sideways_adx_thresh': 12.446295296877828, 'sideways_atr_min_pct': 0.0025745893335796435, 'sideways_atr_max_pct': 0.14041694529758236, 'sideways_tp_mult': 1.0140460873219743, 'sideways_tsl_mult': 0.9448300276372461, 'sideways_time_stop': 160, 'sideways_use_sma': False, 'sideways_use_ema': False, 'sideways_use_atr': False, 'sideways_use_adx': False, 'sideways_use_spike': False, 'sideways_rsi_required': True}.
[I 2025-08-30 19:29:10,212] Trial 524 finished with values: [-0.025970753677842517, 0.025889344762531023] and parameters: {'p_sma': 58, 'p_std': 12, 'p_atr': 10, 'p_adx': 26, 'rsi_period': 69, 'ema1': 24, 'ema2': 44, 'slip_atr_k': 0.07875239535563078, 'slip_spread_k': 0.7380439418759416, 'spread_hl_frac': 0.038984468795898786, 'bb_std_mult': 2.2891272845125634, 'rsi_os': 49, 'rsi_ob': 71, 'vol_spike': 0.27595980241156587, 'adx_thresh': 31.596435808532746, 'atr_min_pct': 0.02337941221759281, 'atr_max_pct': 0.08947792011895833, 'tp_mult': 1.2938733773480524, 'tsl_mult': 0.8036434073064777, 'strategy': 'mean_reversion', 'time_stop': 99, 'use_sma': False, 'use_atr': False, 'use_adx': False, 'use_ema': True, 'use_spike': True, 'rsi_required': False, 'edge_k': 0.15366422570330307, 'edge_cap': 0.5307596289329078, 'bull_strategy': 'mean_reversion', 'bull_bb_std_mult': 0.9630634593696747, 'bull_rsi_os': 33, 'bull_rsi_ob': 69, 'bull_adx_thresh': 17.768250031219466, 'bull_atr_min_pct': 0.02451250277897219, 'bull_atr_max_pct': 0.11526798128054072, 'bull_tp_mult': 1.451990881514385, 'bull_tsl_mult': 0.672306283369098, 'bull_time_stop': 246, 'bull_use_sma': False, 'bull_use_ema': False, 'bull_use_atr': False, 'bull_use_adx': False, 'bull_use_spike': True, 'bull_rsi_required': True, 'bear_strategy': 'breakout', 'bear_bb_std_mult': 2.9518505769530123, 'bear_rsi_os': 50, 'bear_rsi_ob': 93, 'bear_adx_thresh': 9.787250971401077, 'bear_atr_min_pct': 0.013818505812448487, 'bear_atr_max_pct': 0.027308444044935726, 'bear_tp_mult': 2.5327528881617716, 'bear_tsl_mult': 0.9793272211433615, 'bear_time_stop': 188, 'bear_use_sma': True, 'bear_use_ema': True, 'bear_use_atr': False, 'bear_use_adx': False, 'bear_use_spike': False, 'bear_rsi_required': False, 'sideways_strategy': 'breakout', 'sideways_bb_std_mult': 1.7785990151288327, 'sideways_rsi_os': 42, 'sideways_rsi_ob': 60, 'sideways_adx_thresh': 16.460018776749088, 'sideways_atr_min_pct': 0.002600019721000501, 'sideways_atr_max_pct': 0.138206166539179, 'sideways_tp_mult': 1.1994858346166237, 'sideways_tsl_mult': 0.9424454514365779, 'sideways_time_stop': 279, 'sideways_use_sma': False, 'sideways_use_ema': True, 'sideways_use_atr': False, 'sideways_use_adx': False, 'sideways_use_spike': False, 'sideways_rsi_required': False}.
[I 2025-08-30 19:29:10,225] Trial 523 finished with values: [-1000000000.0, 1000000000.0] and parameters: {'p_sma': 13, 'p_std': 60, 'p_atr': 19, 'p_adx': 20, 'rsi_period': 18, 'ema1': 27, 'ema2': 45, 'slip_atr_k': 0.1333974295808249, 'slip_spread_k': 0.054862487271520044, 'spread_hl_frac': 0.008728671291648022, 'bb_std_mult': 2.213245832595436, 'rsi_os': 49, 'rsi_ob': 83, 'vol_spike': 0.2552810875887918, 'adx_thresh': 32.20044180912904, 'atr_min_pct': 0.023006981823236197, 'atr_max_pct': 0.10104017724213495, 'tp_mult': 2.4693183334625504, 'tsl_mult': 0.30277587515793036, 'strategy': 'mean_reversion', 'time_stop': 205, 'use_sma': False, 'use_atr': False, 'use_adx': True, 'use_ema': True, 'use_spike': True, 'rsi_required': False, 'edge_k': 0.8718426367864448, 'edge_cap': 0.33434396271426264, 'bull_strategy': 'mean_reversion', 'bull_bb_std_mult': 0.9646476996386082, 'bull_rsi_os': 28, 'bull_rsi_ob': 80, 'bull_adx_thresh': 17.911144357302224, 'bull_atr_min_pct': 0.0012977845389646678, 'bull_atr_max_pct': 0.05986546121689718, 'bull_tp_mult': 2.103029148532615, 'bull_tsl_mult': 0.5047201020388522, 'bull_time_stop': 231, 'bull_use_sma': False, 'bull_use_ema': True, 'bull_use_atr': False, 'bull_use_adx': False, 'bull_use_spike': True, 'bull_rsi_required': True, 'bear_strategy': 'breakout', 'bear_bb_std_mult': 2.9587661576943436, 'bear_rsi_os': 51, 'bear_rsi_ob': 76, 'bear_adx_thresh': 9.759748769120487, 'bear_atr_min_pct': 0.013529984807781685, 'bear_atr_max_pct': 0.027030294572649525, 'bear_tp_mult': 1.657623428054765, 'bear_tsl_mult': 0.7115823737048407, 'bear_time_stop': 184, 'bear_use_sma': True, 'bear_use_ema': True, 'bear_use_atr': False, 'bear_use_adx': False, 'bear_use_spike': False, 'bear_rsi_required': False, 'sideways_strategy': 'breakout', 'sideways_bb_std_mult': 3.2771254806642283, 'sideways_rsi_os': 24, 'sideways_rsi_ob': 73, 'sideways_adx_thresh': 12.561309346560577, 'sideways_atr_min_pct': 0.012081803508398624, 'sideways_atr_max_pct': 0.13788038596755006, 'sideways_tp_mult': 1.1698657312093583, 'sideways_tsl_mult': 0.9436569796744283, 'sideways_time_stop': 159, 'sideways_use_sma': False, 'sideways_use_ema': True, 'sideways_use_atr': False, 'sideways_use_adx': False, 'sideways_use_spike': False, 'sideways_rsi_required': True}.
[I 2025-08-30 19:29:10,848] Trial 525 finished with values: [-1000000000.0, 1000000000.0] and parameters: {'p_sma': 6, 'p_std': 59, 'p_atr': 19, 'p_adx': 20, 'rsi_period': 46, 'ema1': 20, 'ema2': 31, 'slip_atr_k': 0.23653000871593677, 'slip_spread_k': 0.5424809441956276, 'spread_hl_frac': 0.023222772969777414, 'bb_std_mult': 2.27120592109699, 'rsi_os': 49, 'rsi_ob': 83, 'vol_spike': 0.15580220534781594, 'adx_thresh': 31.53866391807165, 'atr_min_pct': 0.02788007495689534, 'atr_max_pct': 0.08917716978553789, 'tp_mult': 2.141028087982579, 'tsl_mult': 0.2988486044345886, 'strategy': 'mean_reversion', 'time_stop': 204, 'use_sma': False, 'use_atr': False, 'use_adx': False, 'use_ema': True, 'use_spike': True, 'rsi_required': False, 'edge_k': 0.08483196678266752, 'edge_cap': 0.5303961751920224, 'bull_strategy': 'mean_reversion', 'bull_bb_std_mult': 1.905581975454632, 'bull_rsi_os': 6, 'bull_rsi_ob': 64, 'bull_adx_thresh': 17.923581252703496, 'bull_atr_min_pct': 0.0008118747190735437, 'bull_atr_max_pct': 0.06074288282093804, 'bull_tp_mult': 2.741623359498891, 'bull_tsl_mult': 0.058527961921887695, 'bull_time_stop': 197, 'bull_use_sma': False, 'bull_use_ema': False, 'bull_use_atr': False, 'bull_use_adx': False, 'bull_use_spike': True, 'bull_rsi_required': True, 'bear_strategy': 'breakout', 'bear_bb_std_mult': 2.9531285016935094, 'bear_rsi_os': 51, 'bear_rsi_ob': 74, 'bear_adx_thresh': 9.827935536229061, 'bear_atr_min_pct': 0.02479897123138061, 'bear_atr_max_pct': 0.02773989846075309, 'bear_tp_mult': 2.6174216839632507, 'bear_tsl_mult': 0.9670567991167371, 'bear_time_stop': 220, 'bear_use_sma': True, 'bear_use_ema': True, 'bear_use_atr': False, 'bear_use_adx': False, 'bear_use_spike': False, 'bear_rsi_required': False, 'sideways_strategy': 'breakout', 'sideways_bb_std_mult': 3.3070290924547936, 'sideways_rsi_os': 37, 'sideways_rsi_ob': 95, 'sideways_adx_thresh': 21.55736406891198, 'sideways_atr_min_pct': 0.002312258676548719, 'sideways_atr_max_pct': 0.13915816771165024, 'sideways_tp_mult': 1.106587414040951, 'sideways_tsl_mult': 0.9760679673545627, 'sideways_time_stop': 260, 'sideways_use_sma': False, 'sideways_use_ema': True, 'sideways_use_atr': False, 'sideways_use_adx': True, 'sideways_use_spike': False, 'sideways_rsi_required': False}.
[I 2025-08-30 19:29:11,037] Trial 526 finished with values: [-0.019178187431430738, 0.019074460582837] and parameters: {'p_sma': 26, 'p_std': 60, 'p_atr': 26, 'p_adx': 20, 'rsi_period': 17, 'ema1': 20, 'ema2': 45, 'slip_atr_k': 0.07723212126327181, 'slip_spread_k': 0.20422590750142633, 'spread_hl_frac': 0.023252913523945477, 'bb_std_mult': 2.3678780852530945, 'rsi_os': 6, 'rsi_ob': 77, 'vol_spike': 0.15378439314473336, 'adx_thresh': 32.16691600958167, 'atr_min_pct': 0.02298729908630741, 'atr_max_pct': 0.0890412011606683, 'tp_mult': 2.4743945108433434, 'tsl_mult': 0.3026691068648434, 'strategy': 'mean_reversion', 'time_stop': 206, 'use_sma': False, 'use_atr': False, 'use_adx': False, 'use_ema': True, 'use_spike': True, 'rsi_required': False, 'edge_k': 1.541739577329456, 'edge_cap': 0.9799742244187881, 'bull_strategy': 'mean_reversion', 'bull_bb_std_mult': 3.229614799253223, 'bull_rsi_os': 33, 'bull_rsi_ob': 77, 'bull_adx_thresh': 19.84941678861999, 'bull_atr_min_pct': 0.02321019580629588, 'bull_atr_max_pct': 0.11498939209464841, 'bull_tp_mult': 2.7335216102447397, 'bull_tsl_mult': 0.5087761359729119, 'bull_time_stop': 189, 'bull_use_sma': False, 'bull_use_ema': False, 'bull_use_atr': False, 'bull_use_adx': False, 'bull_use_spike': True, 'bull_rsi_required': True, 'bear_strategy': 'breakout', 'bear_bb_std_mult': 2.9521705527712703, 'bear_rsi_os': 51, 'bear_rsi_ob': 76, 'bear_adx_thresh': 19.35476681810831, 'bear_atr_min_pct': 0.016429172280017074, 'bear_atr_max_pct': 0.0548125095902173, 'bear_tp_mult': 2.6165553442122422, 'bear_tsl_mult': 0.07317622587299577, 'bear_time_stop': 189, 'bear_use_sma': True, 'bear_use_ema': True, 'bear_use_atr': False, 'bear_use_adx': False, 'bear_use_spike': False, 'bear_rsi_required': False, 'sideways_strategy': 'breakout', 'sideways_bb_std_mult': 3.311833872657015, 'sideways_rsi_os': 43, 'sideways_rsi_ob': 55, 'sideways_adx_thresh': 28.896311816908785, 'sideways_atr_min_pct': 0.0021601468188553415, 'sideways_atr_max_pct': 0.08129011640679405, 'sideways_tp_mult': 1.9489705916641022, 'sideways_tsl_mult': 0.9751596128662499, 'sideways_time_stop': 257, 'sideways_use_sma': True, 'sideways_use_ema': True, 'sideways_use_atr': False, 'sideways_use_adx': True, 'sideways_use_spike': False, 'sideways_rsi_required': False}.
[I 2025-08-30 19:29:45,785] Trial 530 finished with values: [-1000000000.0, 1000000000.0] and parameters: {'p_sma': 55, 'p_std': 30, 'p_atr': 9, 'p_adx': 9, 'rsi_period': 63, 'ema1': 26, 'ema2': 14, 'slip_atr_k': 0.07422903176016049, 'slip_spread_k': 0.32186071826745016, 'spread_hl_frac': 0.043440742237266725, 'bb_std_mult': 3.0737008346978705, 'rsi_os': 19, 'rsi_ob': 50, 'vol_spike': 0.26704514326337564, 'adx_thresh': 23.57906716178073, 'atr_min_pct': 0.022396720315229286, 'atr_max_pct': 0.09302417674910829, 'tp_mult': 2.689356792466682, 'tsl_mult': 0.4658187912043074, 'strategy': 'breakout', 'time_stop': 191, 'use_sma': False, 'use_atr': True, 'use_adx': True, 'use_ema': False, 'use_spike': True, 'rsi_required': False, 'edge_k': 1.3497409360438317, 'edge_cap': 0.49909285408724535, 'bull_strategy': 'mean_reversion', 'bull_bb_std_mult': 3.225173212304483, 'bull_rsi_os': 32, 'bull_rsi_ob': 46, 'bull_adx_thresh': 19.96014722362042, 'bull_atr_min_pct': 0.0066607563850084785, 'bull_atr_max_pct': 0.12709877635621403, 'bull_tp_mult': 2.673869148655479, 'bull_tsl_mult': 0.5901786645377766, 'bull_time_stop': 191, 'bull_use_sma': True, 'bull_use_ema': True, 'bull_use_atr': True, 'bull_use_adx': False, 'bull_use_spike': False, 'bull_rsi_required': False, 'bear_strategy': 'breakout', 'bear_bb_std_mult': 2.568907587783664, 'bear_rsi_os': 25, 'bear_rsi_ob': 76, 'bear_adx_thresh': 19.221175662211834, 'bear_atr_min_pct': 0.0055746959343213835, 'bear_atr_max_pct': 0.03818258672407488, 'bear_tp_mult': 2.6616642166807027, 'bear_tsl_mult': 0.15529933889952086, 'bear_time_stop': 211, 'bear_use_sma': True, 'bear_use_ema': True, 'bear_use_atr': False, 'bear_use_adx': True, 'bear_use_spike': True, 'bear_rsi_required': True, 'sideways_strategy': 'breakout', 'sideways_bb_std_mult': 3.1835980480062114, 'sideways_rsi_os': 28, 'sideways_rsi_ob': 93, 'sideways_adx_thresh': 18.354912370087057, 'sideways_atr_min_pct': 0.006681036530398287, 'sideways_atr_max_pct': 0.10932253194736305, 'sideways_tp_mult': 1.0666292875058436, 'sideways_tsl_mult': 0.9773813353863042, 'sideways_time_stop': 124, 'sideways_use_sma': True, 'sideways_use_ema': False, 'sideways_use_atr': True, 'sideways_use_adx': True, 'sideways_use_spike': True, 'sideways_rsi_required': True}.
[I 2025-08-30 19:29:46,271] Trial 528 finished with values: [-0.0201207085871411, 0.020047536060139398] and parameters: {'p_sma': 26, 'p_std': 30, 'p_atr': 24, 'p_adx': 20, 'rsi_period': 24, 'ema1': 25, 'ema2': 29, 'slip_atr_k': 0.0733894905184109, 'slip_spread_k': 0.2020190222883862, 'spread_hl_frac': 0.023153468124558006, 'bb_std_mult': 2.1932212355490743, 'rsi_os': 19, 'rsi_ob': 82, 'vol_spike': 0.2686304327495968, 'adx_thresh': 17.14492725827787, 'atr_min_pct': 0.027822024190826758, 'atr_max_pct': 0.1044945880198923, 'tp_mult': 1.8731222263612932, 'tsl_mult': 0.7645052041918241, 'strategy': 'breakout', 'time_stop': 192, 'use_sma': False, 'use_atr': True, 'use_adx': False, 'use_ema': False, 'use_spike': True, 'rsi_required': False, 'edge_k': 0.21332731587095127, 'edge_cap': 0.5012665414128447, 'bull_strategy': 'mean_reversion', 'bull_bb_std_mult': 3.2440550644352073, 'bull_rsi_os': 20, 'bull_rsi_ob': 64, 'bull_adx_thresh': 20.095813911085212, 'bull_atr_min_pct': 0.0005012501989467783, 'bull_atr_max_pct': 0.14156802473726748, 'bull_tp_mult': 2.725926725204716, 'bull_tsl_mult': 0.055444518719000635, 'bull_time_stop': 188, 'bull_use_sma': False, 'bull_use_ema': False, 'bull_use_atr': True, 'bull_use_adx': False, 'bull_use_spike': False, 'bull_rsi_required': False, 'bear_strategy': 'breakout', 'bear_bb_std_mult': 2.7228315329977635, 'bear_rsi_os': 14, 'bear_rsi_ob': 75, 'bear_adx_thresh': 19.27904268903414, 'bear_atr_min_pct': 0.0166675273303049, 'bear_atr_max_pct': 0.042185940921275596, 'bear_tp_mult': 2.219120539006817, 'bear_tsl_mult': 0.1555708866942236, 'bear_time_stop': 149, 'bear_use_sma': True, 'bear_use_ema': True, 'bear_use_atr': False, 'bear_use_adx': True, 'bear_use_spike': True, 'bear_rsi_required': True, 'sideways_strategy': 'breakout', 'sideways_bb_std_mult': 1.3779144390146585, 'sideways_rsi_os': 28, 'sideways_rsi_ob': 90, 'sideways_adx_thresh': 17.85381551861848, 'sideways_atr_min_pct': 0.0038691023488538535, 'sideways_atr_max_pct': 0.14717298535103251, 'sideways_tp_mult': 2.2531126293581876, 'sideways_tsl_mult': 0.9777737493139691, 'sideways_time_stop': 125, 'sideways_use_sma': True, 'sideways_use_ema': True, 'sideways_use_atr': True, 'sideways_use_adx': True, 'sideways_use_spike': True, 'sideways_rsi_required': False}.
[I 2025-08-30 19:29:46,533] Trial 527 finished with values: [-0.016677279949597335, 0.01660392223107968] and parameters: {'p_sma': 18, 'p_std': 30, 'p_atr': 24, 'p_adx': 20, 'rsi_period': 24, 'ema1': 20, 'ema2': 29, 'slip_atr_k': 0.0718356018642458, 'slip_spread_k': 0.20596515921311984, 'spread_hl_frac': 0.02306749327186964, 'bb_std_mult': 3.0640708436660096, 'rsi_os': 22, 'rsi_ob': 82, 'vol_spike': 0.2654467416867213, 'adx_thresh': 7.523333175513953, 'atr_min_pct': 0.02214489238321518, 'atr_max_pct': 0.09345068895391069, 'tp_mult': 2.1411542609056378, 'tsl_mult': 0.780156413232705, 'strategy': 'breakout', 'time_stop': 192, 'use_sma': False, 'use_atr': True, 'use_adx': False, 'use_ema': False, 'use_spike': True, 'rsi_required': False, 'edge_k': 0.22454718159947554, 'edge_cap': 0.7832075113637742, 'bull_strategy': 'mean_reversion', 'bull_bb_std_mult': 0.5045657125395417, 'bull_rsi_os': 8, 'bull_rsi_ob': 45, 'bull_adx_thresh': 19.885313715457432, 'bull_atr_min_pct': 3.249550551857015e-05, 'bull_atr_max_pct': 0.1250680343845349, 'bull_tp_mult': 2.681926726318735, 'bull_tsl_mult': 0.5799379840209912, 'bull_time_stop': 188, 'bull_use_sma': False, 'bull_use_ema': False, 'bull_use_atr': True, 'bull_use_adx': False, 'bull_use_spike': False, 'bull_rsi_required': False, 'bear_strategy': 'breakout', 'bear_bb_std_mult': 0.9146067411841454, 'bear_rsi_os': 54, 'bear_rsi_ob': 76, 'bear_adx_thresh': 34.99265948567699, 'bear_atr_min_pct': 0.02936520656885817, 'bear_atr_max_pct': 0.10846344450837239, 'bear_tp_mult': 2.633218428151595, 'bear_tsl_mult': 0.7470505350032756, 'bear_time_stop': 222, 'bear_use_sma': True, 'bear_use_ema': True, 'bear_use_atr': False, 'bear_use_adx': True, 'bear_use_spike': True, 'bear_rsi_required': True, 'sideways_strategy': 'breakout', 'sideways_bb_std_mult': 0.7784557488555484, 'sideways_rsi_os': 28, 'sideways_rsi_ob': 93, 'sideways_adx_thresh': 6.372348639634939, 'sideways_atr_min_pct': 0.003856315164609542, 'sideways_atr_max_pct': 0.14991052288271417, 'sideways_tp_mult': 1.0935223531515528, 'sideways_tsl_mult': 0.6893023842544772, 'sideways_time_stop': 33, 'sideways_use_sma': True, 'sideways_use_ema': True, 'sideways_use_atr': True, 'sideways_use_adx': True, 'sideways_use_spike': True, 'sideways_rsi_required': False}.
[I 2025-08-30 19:29:46,638] Trial 529 finished with values: [-1000000000.0, 1000000000.0] and parameters: {'p_sma': 23, 'p_std': 15, 'p_atr': 24, 'p_adx': 19, 'rsi_period': 24, 'ema1': 25, 'ema2': 14, 'slip_atr_k': 0.17298714627294462, 'slip_spread_k': 0.20229019707039037, 'spread_hl_frac': 0.0230231489745287, 'bb_std_mult': 3.101863145779863, 'rsi_os': 9, 'rsi_ob': 82, 'vol_spike': 0.2927118346900608, 'adx_thresh': 16.91445794619904, 'atr_min_pct': 0.007193506620544133, 'atr_max_pct': 0.09377823631970367, 'tp_mult': 2.656119606811039, 'tsl_mult': 0.46453574548878457, 'strategy': 'breakout', 'time_stop': 191, 'use_sma': False, 'use_atr': True, 'use_adx': True, 'use_ema': False, 'use_spike': True, 'rsi_required': False, 'edge_k': 0.21268964550079966, 'edge_cap': 0.4981574452329619, 'bull_strategy': 'mean_reversion', 'bull_bb_std_mult': 0.5035330631816726, 'bull_rsi_os': 32, 'bull_rsi_ob': 45, 'bull_adx_thresh': 19.178908963237316, 'bull_atr_min_pct': 0.006757530945457791, 'bull_atr_max_pct': 0.1266766833357518, 'bull_tp_mult': 2.681343654222669, 'bull_tsl_mult': 0.43214235069659435, 'bull_time_stop': 189, 'bull_use_sma': False, 'bull_use_ema': True, 'bull_use_atr': True, 'bull_use_adx': False, 'bull_use_spike': False, 'bull_rsi_required': False, 'bear_strategy': 'breakout', 'bear_bb_std_mult': 2.7366627817648084, 'bear_rsi_os': 54, 'bear_rsi_ob': 89, 'bear_adx_thresh': 13.083688523013368, 'bear_atr_min_pct': 0.016429548697911887, 'bear_atr_max_pct': 0.08689579004656714, 'bear_tp_mult': 2.476981267551247, 'bear_tsl_mult': 0.680735741569719, 'bear_time_stop': 201, 'bear_use_sma': True, 'bear_use_ema': True, 'bear_use_atr': False, 'bear_use_adx': True, 'bear_use_spike': True, 'bear_rsi_required': True, 'sideways_strategy': 'breakout', 'sideways_bb_std_mult': 0.7959044335021874, 'sideways_rsi_os': 6, 'sideways_rsi_ob': 56, 'sideways_adx_thresh': 15.295137538317933, 'sideways_atr_min_pct': 0.006763310391412869, 'sideways_atr_max_pct': 0.0808301332266141, 'sideways_tp_mult': 1.0614906307535563, 'sideways_tsl_mult': 0.9760776502372758, 'sideways_time_stop': 95, 'sideways_use_sma': True, 'sideways_use_ema': True, 'sideways_use_atr': True, 'sideways_use_adx': True, 'sideways_use_spike': True, 'sideways_rsi_required': True}.
