[I 2025-08-29 16:20:29,307] Trial 49 finished with values: [0.02381160107501845, 0.05068664664984497] and parameters: {'p_sma': 36, 'p_std': 23, 'p_atr': 25, 'p_adx': 30, 'rsi_period': 43, 'ema1': 9, 'ema2': 37, 'slip_atr_k': 0.005359777186958126, 'slip_spread_k': 0.7680876644002383, 'spread_hl_frac': 0.030332382355180376, 'bb_std_mult': 1.805687327242944, 'rsi_os': 55, 'rsi_ob': 85, 'vol_spike': 0.08063492531175391, 'adx_thresh': 17.48441069468445, 'atr_min_pct': 0.015155872094297671, 'atr_max_pct': 0.08150728875221684, 'tp_mult': 1.1695570489877396, 'tsl_mult': 0.00912282143360299, 'strategy': 'breakout', 'time_stop': 37, 'use_sma': False, 'use_atr': False, 'use_adx': True, 'use_ema': False, 'use_spike': True, 'rsi_required': True, 'edge_k': 0.911873874549827, 'edge_cap': 0.28851202153159766}.
Starting optimization (50 trials, n_jobs=1) | multi-objective=True
Saved trials CSV -> runs/SPOT_LONG_fee5e-4_slip4e-4_FIX/trials_metrics.csv
Saved Pareto plot -> runs/SPOT_LONG_fee5e-4_slip4e-4_FIX/pareto_return_vs_drawdown.png
Top-K under DD cap: [49] (agg='median')
=== Selected trial(s) ===
top_k=1 selected_trial_numbers=[49] primary=49
ret%_train=2.38% dd%_train=-5.07% trades=108
ret%_test=2.54% dd%_test=-0.40% pnl_test=507.76 trades_test=10
Dumped TEST trades -> runs/SPOT_LONG_fee5e-4_slip4e-4_FIX/test_trades.csv
WFO fold 1: OOS PnL=29.46 trades=3 win_rate=33.33% avg=9.819331 ret%=0.15% maxDD=-42.893395 maxDD%=-0.21%
WFO fold 2: OOS PnL=140.26 trades=1 win_rate=100.00% avg=140.255194 ret%=0.70% maxDD=0.000000 maxDD%=0.00%
WFO fold 3: OOS PnL=0.00 trades=0 win_rate=0.00% avg=0.000000 ret%=0.00% maxDD=0.000000 maxDD%=0.00%
WFO fold 4: OOS PnL=159.67 trades=5 win_rate=40.00% avg=31.933073 ret%=0.80% maxDD=-80.058874 maxDD%=-0.40%
WFO fold 5: OOS PnL=173.95 trades=1 win_rate=100.00% avg=173.951118 ret%=0.87% maxDD=0.000000 maxDD%=0.00%
WFO summary: meanPnL=100.67 stdPnL=71.59 meanWR=54.67% meanAvg=71.191743 meanRet%=0.50% worstDD=-80.058874 worstDD%=-0.40% folds=5 trades=10
Wrote runs/SPOT_LONG_fee5e-4_slip4e-4_FIX/strategy_profile.json
=== ECHO SELECTED PARAMS (JSON) ===
{
  "adx_thresh": 17.48441069468445,
  "aggregate_params": "median",
  "atr_max_pct": 0.08150728875221684,
  "atr_min_pct": 0.015155872094297671,
  "bar_priority": "stop_first",
  "bb_std_mult": 1.805687327242944,
  "cooldown_bars": 20,
  "daily_loss_limit_pct": 0.03,
  "edge_cap": 0.28851202153159766,
  "edge_k": 0.911873874549827,
  "ema1": 9,
  "ema2": 37,
  "embargo_bars": 0,
  "fee": 0.0005,
  "fill_timing": "next_open",
  "include_hours_set": null,
  "lockout_bars": 0,
  "max_consec_losses": 0,
  "max_notional_pct_equity": 1.0,
  "min_notional": 5.0,
  "ml_thresh": 0.0,
  "objective": "multi",
  "p_adx": 30,
  "p_atr": 25,
  "p_sma": 36,
  "p_std": 23,
  "participation_cap": 1.0,
  "price_step": 0.0001,
  "proba_temp": 1.0,
  "qty_step": 0.0001,
  "regime_adapt": false,
  "regime_band": 0.006,
  "regime_fast": 50,
  "regime_overrides": {
    "bear": {
      "adx": 20.0,
      "allowed_sides": [
        "long",
        "short"
      ],
      "atr_range": [
        0.0015,
        0.06
      ],
      "bb_std_mult": 1.2571599337995167,
      "mode": "breakout",
      "rsi_required": true,
      "time_stop_bars": 122,
      "tp_mult": 1.7149673432024581,
      "tsl_mult": 0.25,
      "use_adx": true,
      "use_atr": true
    },
    "bull": {
      "adx": 18.0,
      "allowed_sides": [
        "long",
        "short"
      ],
      "atr_range": [
        0.0008,
        0.06
      ],
      "bb_std_mult": 2.0169431746748376,
      "mode": "mean_reversion",
      "rsi_required": false,
      "time_stop_bars": 214,
      "tp_mult": 1.9194251920826044,
      "tsl_mult": 0.6891458682949287,
      "use_adx": true,
      "use_atr": true
    },
    "sideways": {
      "adx": 15.0,
      "allowed_sides": [
        "long",
        "short"
      ],
      "atr_range": [
        0.001,
        0.14
      ],
      "bb_std_mult": 1.5828092896467827,
      "mode": "breakout",
      "rsi_required": true,
      "time_stop_bars": 235,
      "tp_mult": 2.341879695778944,
      "tsl_mult": 0.651967765830165,
      "use_adx": true,
      "use_atr": true
    }
  },
  "regime_slow": 200,
  "risk_min_stop_frac": 0.001,
  "risk_per_trade": 0.01,
  "risk_stop_atr_mult": 1.0,
  "round_exits": true,
  "rsi_key": "rsi43",
  "rsi_ob": 85,
  "rsi_os": 55,
  "rsi_period": 43,
  "rsi_required": true,
  "select_top_k": 1,
  "session_end": 24,
  "session_start": 0,
  "sides": "long",
  "slip_atr_k": 0.005359777186958126,
  "slip_spread_k": 0.7680876644002383,
  "slippage": 0.0004,
  "spread_hl_frac": 0.030332382355180376,
  "start_equity": 20000.0,
  "stop_extra_slip": 0.0,
  "strategy": "breakout",
  "time_stop": 37,
  "tp_mult": 1.1695570489877396,
  "tsl_mult": 0.00912282143360299,
  "use_adx": true,
  "use_atr": false,
  "use_ema": false,
  "use_ml": false,
  "use_sma": false,
  "use_spike": true,
  "vol_spike": 0.08063492531175391,
  "wfo_folds": 5
}
Wrote runs/SPOT_LONG_fee5e-4_slip4e-4_FIX/best_params.pkl
