[I 2025-08-29 16:19:06,030] Trial 27 finished with values: [-0.004505230873108834, 0.004506146215383182] and parameters: {'p_sma': 23, 'p_std': 48, 'p_atr': 20, 'p_adx': 28, 'rsi_period': 45, 'ema1': 28, 'ema2': 22, 'slip_atr_k': 0.07610702348855096, 'slip_spread_k': 0.36397833190506795, 'spread_hl_frac': 0.00673117486913731, 'bb_std_mult': 2.2939485085273272, 'rsi_os': 15, 'rsi_ob': 67, 'vol_spike': 0.08929633714542484, 'adx_thresh': 27.1151884864737, 'atr_min_pct': 0.0032914811306733096, 'atr_max_pct': 0.044424315247981135, 'tp_mult': 2.4786501162919934, 'tsl_mult': 0.7941923509222739, 'strategy': 'breakout', 'time_stop': 257, 'use_sma': False, 'use_atr': False, 'use_adx': True, 'use_ema': False, 'use_spike': True, 'rsi_required': True, 'edge_k': 1.2524445810797915, 'edge_cap': 0.0539171169982832}.
[I 2025-08-29 16:19:10,076] Trial 28 finished with values: [-1000000000.0, 0.06378763489658267] and parameters: {'p_sma': 37, 'p_std': 28, 'p_atr': 13, 'p_adx': 20, 'rsi_period': 8, 'ema1': 30, 'ema2': 31, 'slip_atr_k': 0.10926026162627814, 'slip_spread_k': 0.48161420562440443, 'spread_hl_frac': 0.026697283710203346, 'bb_std_mult': 3.0344444614559825, 'rsi_os': 32, 'rsi_ob': 80, 'vol_spike': 0.0010438559313566964, 'adx_thresh': 20.769587418439848, 'atr_min_pct': 0.01173895812146658, 'atr_max_pct': 0.08436976546559058, 'tp_mult': 1.8527821080606335, 'tsl_mult': 0.5622314600754424, 'strategy': 'breakout', 'time_stop': 133, 'use_sma': False, 'use_atr': False, 'use_adx': True, 'use_ema': False, 'use_spike': True, 'rsi_required': True, 'edge_k': 0.9381588073840469, 'edge_cap': 0.15303358107027876}.
[I 2025-08-29 16:19:14,192] Trial 29 finished with values: [-1000000000.0, 1000000000.0] and parameters: {'p_sma': 42, 'p_std': 56, 'p_atr': 16, 'p_adx': 23, 'rsi_period': 62, 'ema1': 27, 'ema2': 24, 'slip_atr_k': 0.18485200752124598, 'slip_spread_k': 0.3313804546072022, 'spread_hl_frac': 0.042190423384779435, 'bb_std_mult': 0.665261019364593, 'rsi_os': 5, 'rsi_ob': 73, 'vol_spike': 0.11255663215890402, 'adx_thresh': 18.38964174863595, 'atr_min_pct': 0.008695979552362149, 'atr_max_pct': 0.09715609940018569, 'tp_mult': 2.74479930263131, 'tsl_mult': 0.20114821102543926, 'strategy': 'mean_reversion', 'time_stop': 298, 'use_sma': True, 'use_atr': True, 'use_adx': False, 'use_ema': True, 'use_spike': False, 'rsi_required': True, 'edge_k': 1.4654552905757574, 'edge_cap': 0.3214959728851726}.
[I 2025-08-29 16:19:18,244] Trial 30 finished with values: [-1000000000.0, 1000000000.0] and parameters: {'p_sma': 30, 'p_std': 40, 'p_atr': 17, 'p_adx': 16, 'rsi_period': 66, 'ema1': 23, 'ema2': 14, 'slip_atr_k': 0.07340801983765496, 'slip_spread_k': 0.11384059559321494, 'spread_hl_frac': 0.022195405473231213, 'bb_std_mult': 1.1458242773039313, 'rsi_os': 41, 'rsi_ob': 87, 'vol_spike': 0.023510036580187514, 'adx_thresh': 5.9318483829512, 'atr_min_pct': 0.016924743149016052, 'atr_max_pct': 0.06423244365687329, 'tp_mult': 2.3767076891263845, 'tsl_mult': 0.39809050721898126, 'strategy': 'mean_reversion', 'time_stop': 44, 'use_sma': True, 'use_atr': True, 'use_adx': False, 'use_ema': True, 'use_spike': False, 'rsi_required': False, 'edge_k': 1.817454363576298, 'edge_cap': 0.25572806049952945}.
[I 2025-08-29 16:19:22,298] Trial 31 finished with values: [-0.019348460659269207, 0.019330964880000384] and parameters: {'p_sma': 41, 'p_std': 47, 'p_atr': 21, 'p_adx': 28, 'rsi_period': 44, 'ema1': 28, 'ema2': 21, 'slip_atr_k': 0.07848599128179812, 'slip_spread_k': 0.38061977619778486, 'spread_hl_frac': 0.035074497379967255, 'bb_std_mult': 1.458027672920019, 'rsi_os': 19, 'rsi_ob': 70, 'vol_spike': 0.08452350127755476, 'adx_thresh': 26.11602502937579, 'atr_min_pct': 0.003626413079131606, 'atr_max_pct': 0.04661162440857454, 'tp_mult': 2.540373511194563, 'tsl_mult': 0.7965527370999367, 'strategy': 'breakout', 'time_stop': 179, 'use_sma': False, 'use_atr': False, 'use_adx': True, 'use_ema': False, 'use_spike': True, 'rsi_required': True, 'edge_k': 1.2807554344265277, 'edge_cap': 0.0668863641988292}.
[I 2025-08-29 16:19:26,492] Trial 32 finished with values: [-0.00011577069025692222, 0.0009855171461829128] and parameters: {'p_sma': 22, 'p_std': 35, 'p_atr': 30, 'p_adx': 28, 'rsi_period': 42, 'ema1': 28, 'ema2': 48, 'slip_atr_k': 0.1125446865974911, 'slip_spread_k': 0.2214845926330757, 'spread_hl_frac': 0.04031901645476135, 'bb_std_mult': 2.212594628828417, 'rsi_os': 51, 'rsi_ob': 81, 'vol_spike': 0.061512746134194676, 'adx_thresh': 23.102324494439834, 'atr_min_pct': 0.013428893638582122, 'atr_max_pct': 0.08456547030292981, 'tp_mult': 2.6008435615176753, 'tsl_mult': 0.5100848646326113, 'strategy': 'breakout', 'time_stop': 261, 'use_sma': False, 'use_atr': False, 'use_adx': True, 'use_ema': False, 'use_spike': True, 'rsi_required': True, 'edge_k': 0.02703285461769811, 'edge_cap': 0.050387797175257334}.
[I 2025-08-29 16:19:30,685] Trial 33 finished with values: [-0.0026033526288239406, 0.0027545379649361636] and parameters: {'p_sma': 13, 'p_std': 35, 'p_atr': 30, 'p_adx': 26, 'rsi_period': 25, 'ema1': 26, 'ema2': 48, 'slip_atr_k': 0.14334128272191132, 'slip_spread_k': 0.21328558784329946, 'spread_hl_frac': 0.04359318942480794, 'bb_std_mult': 2.40224865145139, 'rsi_os': 50, 'rsi_ob': 79, 'vol_spike': 0.0531305870069355, 'adx_thresh': 31.188932363999434, 'atr_min_pct': 0.01412477777164002, 'atr_max_pct': 0.0867435317675765, 'tp_mult': 2.7956293642696615, 'tsl_mult': 0.6204613302751697, 'strategy': 'breakout', 'time_stop': 276, 'use_sma': True, 'use_atr': False, 'use_adx': False, 'use_ema': True, 'use_spike': False, 'rsi_required': True, 'edge_k': 0.009909525943274069, 'edge_cap': 0.6702735137796193}.
[I 2025-08-29 16:19:30,712] Trial 34 finished with values: [-1000000000.0, 1000000000.0] and parameters: {'p_sma': 20, 'p_std': 33, 'p_atr': 30, 'p_adx': 26, 'rsi_period': 23, 'ema1': 26, 'ema2': 50, 'slip_atr_k': 0.14996589205311323, 'slip_spread_k': 0.6213399513485778, 'spread_hl_frac': 0.04178577281187392, 'bb_std_mult': 2.4176095342373016, 'rsi_os': 55, 'rsi_ob': 64, 'vol_spike': 0.050140004621381865, 'adx_thresh': 31.588175280857556, 'atr_min_pct': 0.014316599816402169, 'atr_max_pct': 0.10476421147871003, 'tp_mult': 1.4740615645799102, 'tsl_mult': 0.618745401224037, 'strategy': 'mean_reversion', 'time_stop': 266, 'use_sma': True, 'use_atr': False, 'use_adx': False, 'use_ema': True, 'use_spike': False, 'rsi_required': False, 'edge_k': 0.011336383839653092, 'edge_cap': 0.7202277853316611}.
[I 2025-08-29 16:19:34,909] Trial 35 finished with values: [-1000000000.0, 1000000000.0] and parameters: {'p_sma': 12, 'p_std': 32, 'p_atr': 26, 'p_adx': 29, 'rsi_period': 24, 'ema1': 23, 'ema2': 49, 'slip_atr_k': 0.11306667346393594, 'slip_spread_k': 0.8614797513094985, 'spread_hl_frac': 0.044267751032543594, 'bb_std_mult': 2.8902727544335627, 'rsi_os': 50, 'rsi_ob': 90, 'vol_spike': 0.07154257189546534, 'adx_thresh': 30.443524744700092, 'atr_min_pct': 0.012877323648303289, 'atr_max_pct': 0.08885296477742374, 'tp_mult': 1.7762727640731044, 'tsl_mult': 0.7096463595944824, 'strategy': 'breakout', 'time_stop': 273, 'use_sma': True, 'use_atr': False, 'use_adx': True, 'use_ema': True, 'use_spike': False, 'rsi_required': True, 'edge_k': 0.157143019024642, 'edge_cap': 0.11445601656350944}.
[I 2025-08-29 16:19:38,921] Trial 36 finished with values: [-1000000000.0, 1000000000.0] and parameters: {'p_sma': 12, 'p_std': 25, 'p_atr': 30, 'p_adx': 26, 'rsi_period': 34, 'ema1': 13, 'ema2': 39, 'slip_atr_k': 0.17121814528275373, 'slip_spread_k': 0.21290166530450969, 'spread_hl_frac': 0.038376915203102775, 'bb_std_mult': 1.8787866403955331, 'rsi_os': 52, 'rsi_ob': 77, 'vol_spike': 0.022709896507353576, 'adx_thresh': 23.837180933025103, 'atr_min_pct': 0.008066897026656967, 'atr_max_pct': 0.09036930062396926, 'tp_mult': 2.8393822811803417, 'tsl_mult': 0.5148991097490667, 'strategy': 'breakout', 'time_stop': 249, 'use_sma': False, 'use_atr': True, 'use_adx': False, 'use_ema': True, 'use_spike': False, 'rsi_required': False, 'edge_k': 0.2435805119916773, 'edge_cap': 0.17451970355099955}.
[I 2025-08-29 16:19:42,991] Trial 37 finished with values: [-1000000000.0, 0.4395960468535248] and parameters: {'p_sma': 23, 'p_std': 17, 'p_atr': 27, 'p_adx': 10, 'rsi_period': 53, 'ema1': 24, 'ema2': 60, 'slip_atr_k': 0.13975128047365415, 'slip_spread_k': 0.10047475501804355, 'spread_hl_frac': 0.03927101010401772, 'bb_std_mult': 2.180994481869865, 'rsi_os': 46, 'rsi_ob': 55, 'vol_spike': 0.13881807462888615, 'adx_thresh': 27.85567870968105, 'atr_min_pct': 0.017029563656739865, 'atr_max_pct': 0.12032174613425163, 'tp_mult': 1.6447375104237891, 'tsl_mult': 0.5981105590627392, 'strategy': 'mean_reversion', 'time_stop': 223, 'use_sma': True, 'use_atr': False, 'use_adx': False, 'use_ema': False, 'use_spike': True, 'rsi_required': False, 'edge_k': 0.5985145361996623, 'edge_cap': 0.839422635182842}.
[I 2025-08-29 16:19:47,382] Trial 38 finished with values: [-1000000000.0, 1000000000.0] and parameters: {'p_sma': 20, 'p_std': 35, 'p_atr': 28, 'p_adx': 15, 'rsi_period': 78, 'ema1': 20, 'ema2': 54, 'slip_atr_k': 0.020005878715772307, 'slip_spread_k': 0.513555751624006, 'spread_hl_frac': 0.049801260401868976, 'bb_std_mult': 2.5033793906555273, 'rsi_os': 44, 'rsi_ob': 74, 'vol_spike': 0.16621507034140062, 'adx_thresh': 7.568046730451627, 'atr_min_pct': 0.020143940485285155, 'atr_max_pct': 0.058023872870352586, 'tp_mult': 2.807119168807343, 'tsl_mult': 0.6663904066456666, 'strategy': 'breakout', 'time_stop': 276, 'use_sma': False, 'use_atr': False, 'use_adx': True, 'use_ema': True, 'use_spike': True, 'rsi_required': True, 'edge_k': 0.3515278332990337, 'edge_cap': 0.6620013976808891}.
[I 2025-08-29 16:19:51,451] Trial 39 finished with values: [-1000000000.0, 1000000000.0] and parameters: {'p_sma': 13, 'p_std': 12, 'p_atr': 26, 'p_adx': 24, 'rsi_period': 25, 'ema1': 10, 'ema2': 46, 'slip_atr_k': 0.16117042965067363, 'slip_spread_k': 0.22891205972930545, 'spread_hl_frac': 0.04350544970349032, 'bb_std_mult': 2.812897782200493, 'rsi_os': 49, 'rsi_ob': 83, 'vol_spike': 0.09933927547523022, 'adx_thresh': 11.710941520366799, 'atr_min_pct': 0.01017940628767585, 'atr_max_pct': 0.07095888417195297, 'tp_mult': 2.604405478492858, 'tsl_mult': 0.28953419723301344, 'strategy': 'mean_reversion', 'time_stop': 214, 'use_sma': True, 'use_atr': True, 'use_adx': False, 'use_ema': False, 'use_spike': False, 'rsi_required': False, 'edge_k': 0.5194748168819919, 'edge_cap': 0.1107965243188122}.
[I 2025-08-29 16:19:55,727] Trial 40 finished with values: [-1000000000.0, 1000000000.0] and parameters: {'p_sma': 26, 'p_std': 26, 'p_atr': 29, 'p_adx': 13, 'rsi_period': 39, 'ema1': 6, 'ema2': 39, 'slip_atr_k': 0.11868937929410124, 'slip_spread_k': 0.3080215774636471, 'spread_hl_frac': 0.03966121000239143, 'bb_std_mult': 2.137662282159359, 'rsi_os': 53, 'rsi_ob': 88, 'vol_spike': 0.0029656456120434604, 'adx_thresh': 16.226817370156727, 'atr_min_pct': 0.006693169466210095, 'atr_max_pct': 0.1304206843354184, 'tp_mult': 1.9565112919753793, 'tsl_mult': 0.5192276547700139, 'strategy': 'breakout', 'time_stop': 246, 'use_sma': False, 'use_atr': False, 'use_adx': True, 'use_ema': True, 'use_spike': True, 'rsi_required': True, 'edge_k': 0.7419022858008916, 'edge_cap': 0.9997274726023739}.
[I 2025-08-29 16:19:59,822] Trial 41 finished with values: [-0.01275219640431291, 0.01269732856091766] and parameters: {'p_sma': 15, 'p_std': 37, 'p_atr': 23, 'p_adx': 29, 'rsi_period': 15, 'ema1': 26, 'ema2': 56, 'slip_atr_k': 0.09054512937542526, 'slip_spread_k': 0.8747751248058626, 'spread_hl_frac': 0.032572259776296554, 'bb_std_mult': 2.367009581696362, 'rsi_os': 49, 'rsi_ob': 82, 'vol_spike': 0.05217079544255017, 'adx_thresh': 23.842309700908274, 'atr_min_pct': 0.013266399938896865, 'atr_max_pct': 0.08157752573991134, 'tp_mult': 1.3365516404083917, 'tsl_mult': 0.45164532233644267, 'strategy': 'breakout', 'time_stop': 286, 'use_sma': False, 'use_atr': False, 'use_adx': True, 'use_ema': False, 'use_spike': True, 'rsi_required': True, 'edge_k': 0.10665802553310122, 'edge_cap': 0.11136090511649605}.
[I 2025-08-29 16:20:03,957] Trial 42 finished with values: [-0.012874960311349604, 0.012896285811498563] and parameters: {'p_sma': 30, 'p_std': 33, 'p_atr': 29, 'p_adx': 27, 'rsi_period': 73, 'ema1': 29, 'ema2': 39, 'slip_atr_k': 0.13627966396614494, 'slip_spread_k': 0.42280964153838446, 'spread_hl_frac': 0.03487314544393403, 'bb_std_mult': 3.1155308701860416, 'rsi_os': 40, 'rsi_ob': 80, 'vol_spike': 0.20572310177843345, 'adx_thresh': 14.209075981388398, 'atr_min_pct': 0.015781451394050825, 'atr_max_pct': 0.10106253127821994, 'tp_mult': 2.2108837304811586, 'tsl_mult': 0.6184451667038624, 'strategy': 'mean_reversion', 'time_stop': 158, 'use_sma': False, 'use_atr': False, 'use_adx': True, 'use_ema': False, 'use_spike': True, 'rsi_required': True, 'edge_k': 0.2658842079587179, 'edge_cap': 0.7862130454937413}.
[I 2025-08-29 16:20:08,095] Trial 43 finished with values: [-1000000000.0, 1000000000.0] and parameters: {'p_sma': 51, 'p_std': 44, 'p_atr': 27, 'p_adx': 29, 'rsi_period': 15, 'ema1': 25, 'ema2': 53, 'slip_atr_k': 0.2185991948073882, 'slip_spread_k': 0.802148066445455, 'spread_hl_frac': 0.04672130147704979, 'bb_std_mult': 1.693838795315198, 'rsi_os': 22, 'rsi_ob': 78, 'vol_spike': 0.10417912443902155, 'adx_thresh': 20.15659973178797, 'atr_min_pct': 0.010421249495098973, 'atr_max_pct': 0.11063724282379883, 'tp_mult': 2.615288913437984, 'tsl_mult': 0.908704615327517, 'strategy': 'breakout', 'time_stop': 262, 'use_sma': False, 'use_atr': True, 'use_adx': True, 'use_ema': False, 'use_spike': False, 'rsi_required': False, 'edge_k': 0.3140370448785495, 'edge_cap': 0.4656506348194196}.
[I 2025-08-29 16:20:12,400] Trial 44 finished with values: [-1000000000.0, 0.08585916936727] and parameters: {'p_sma': 25, 'p_std': 29, 'p_atr': 20, 'p_adx': 21, 'rsi_period': 40, 'ema1': 14, 'ema2': 47, 'slip_atr_k': 0.06365469345667615, 'slip_spread_k': 0.1909271669918627, 'spread_hl_frac': 0.007011880505196574, 'bb_std_mult': 2.647916574491929, 'rsi_os': 13, 'rsi_ob': 63, 'vol_spike': 0.12937559737285292, 'adx_thresh': 25.77773068838464, 'atr_min_pct': 0.01895701744753074, 'atr_max_pct': 0.08630168424176651, 'tp_mult': 2.415242972028001, 'tsl_mult': 0.11502935818028326, 'strategy': 'breakout', 'time_stop': 39, 'use_sma': True, 'use_atr': False, 'use_adx': False, 'use_ema': True, 'use_spike': True, 'rsi_required': True, 'edge_k': 0.4588004543813786, 'edge_cap': 0.22466741397520018}.
[I 2025-08-29 16:20:12,426] Trial 45 finished with values: [-1000000000.0, 1000000000.0] and parameters: {'p_sma': 20, 'p_std': 31, 'p_atr': 25, 'p_adx': 25, 'rsi_period': 57, 'ema1': 27, 'ema2': 33, 'slip_atr_k': 0.04796900334878931, 'slip_spread_k': 0.92548448119364, 'spread_hl_frac': 0.03715135586526226, 'bb_std_mult': 2.1264852861981542, 'rsi_os': 51, 'rsi_ob': 72, 'vol_spike': 0.2760542223492775, 'adx_thresh': 9.011152466250172, 'atr_min_pct': 0.012774345567025228, 'atr_max_pct': 0.09343119862564464, 'tp_mult': 2.1603137629646114, 'tsl_mult': 0.4114848228379905, 'strategy': 'mean_reversion', 'time_stop': 284, 'use_sma': False, 'use_atr': False, 'use_adx': True, 'use_ema': False, 'use_spike': True, 'rsi_required': False, 'edge_k': 0.8245107001665757, 'edge_cap': 0.10197828356773209}.
[I 2025-08-29 16:20:16,329] Trial 46 finished with values: [-1000000000.0, 1000000000.0] and parameters: {'p_sma': 9, 'p_std': 6, 'p_atr': 22, 'p_adx': 27, 'rsi_period': 52, 'ema1': 7, 'ema2': 41, 'slip_atr_k': 0.09402119773531575, 'slip_spread_k': 0.10904709182751599, 'spread_hl_frac': 0.040742049165222234, 'bb_std_mult': 3.4909113124201374, 'rsi_os': 29, 'rsi_ob': 67, 'vol_spike': 0.07051697580900762, 'adx_thresh': 23.21899798035864, 'atr_min_pct': 0.02451902372679555, 'atr_max_pct': 0.05792176627052364, 'tp_mult': 2.3086829030849354, 'tsl_mult': 0.5597072906780702, 'strategy': 'breakout', 'time_stop': 300, 'use_sma': False, 'use_atr': True, 'use_adx': True, 'use_ema': False, 'use_spike': False, 'rsi_required': True, 'edge_k': 0.11450117951956708, 'edge_cap': 0.14108596280812252}.
[I 2025-08-29 16:20:20,537] Trial 47 finished with values: [-1000000000.0, 0.12437772587269981] and parameters: {'p_sma': 17, 'p_std': 41, 'p_atr': 30, 'p_adx': 9, 'rsi_period': 32, 'ema1': 16, 'ema2': 58, 'slip_atr_k': 0.12774813424094064, 'slip_spread_k': 0.5841216922061636, 'spread_hl_frac': 0.024719141309686454, 'bb_std_mult': 2.0222312482096143, 'rsi_os': 48, 'rsi_ob': 61, 'vol_spike': 0.03188828692163011, 'adx_thresh': 29.094907074724983, 'atr_min_pct': 0.007862947152059353, 'atr_max_pct': 0.07497814318892118, 'tp_mult': 1.0355091703669772, 'tsl_mult': 0.49295143902729033, 'strategy': 'breakout', 'time_stop': 237, 'use_sma': True, 'use_atr': False, 'use_adx': False, 'use_ema': False, 'use_spike': True, 'rsi_required': True, 'edge_k': 1.0471362946949159, 'edge_cap': 0.6803742923656488}.
[I 2025-08-29 16:20:24,908] Trial 48 finished with values: [-0.018658658330201305, 0.018692016337014974] and parameters: {'p_sma': 57, 'p_std': 16, 'p_atr': 28, 'p_adx': 17, 'rsi_period': 84, 'ema1': 29, 'ema2': 47, 'slip_atr_k': 0.15781028752822082, 'slip_spread_k': 0.05276128381306738, 'spread_hl_frac': 0.0175788203118882, 'bb_std_mult': 2.711536932949461, 'rsi_os': 35, 'rsi_ob': 53, 'vol_spike': 0.2575480331477874, 'adx_thresh': 31.716119313848196, 'atr_min_pct': 0.022227427774777812, 'atr_max_pct': 0.13492098791775772, 'tp_mult': 2.6129579364624256, 'tsl_mult': 0.7202094754908279, 'strategy': 'mean_reversion', 'time_stop': 91, 'use_sma': False, 'use_atr': False, 'use_adx': True, 'use_ema': True, 'use_spike': True, 'rsi_required': False, 'edge_k': 0.6283446501993651, 'edge_cap': 0.60085863236514}.
