2025-08-29 16:17:16,603 WARNING: DATA SANITY: Extreme jumps >20*ATR200: 42
[I 2025-08-29 16:17:16,613] A new study created in memory with name: no-name-b5e2b660-050b-4285-b17a-c761c427423b
[I 2025-08-29 16:17:20,679] Trial 0 finished with values: [-1000000000.0, 1000000000.0] and parameters: {'p_sma': 41, 'p_std': 58, 'p_atr': 16, 'p_adx': 22, 'rsi_period': 60, 'ema1': 8, 'ema2': 22, 'slip_atr_k': 0.06353926681517938, 'slip_spread_k': 0.4264416459815509, 'spread_hl_frac': 0.04195012735422831, 'bb_std_mult': 2.809604305322281, 'rsi_os': 24, 'rsi_ob': 58, 'vol_spike': 0.01600013757198381, 'adx_thresh': 18.106891413970676, 'atr_min_pct': 0.006269373456920137, 'atr_max_pct': 0.09321754249893166, 'tp_mult': 1.2068180203958287, 'tsl_mult': 0.22409353037573954, 'strategy': 'mean_reversion', 'time_stop': 67, 'use_sma': True, 'use_atr': True, 'use_adx': False, 'use_ema': True, 'use_spike': False, 'rsi_required': True, 'edge_k': 1.4423452896817954, 'edge_cap': 0.3118867740977832}.
[I 2025-08-29 16:17:20,682] Trial 1 finished with values: [-1000000000.0, 1000000000.0] and parameters: {'p_sma': 49, 'p_std': 12, 'p_atr': 16, 'p_adx': 22, 'rsi_period': 40, 'ema1': 9, 'ema2': 36, 'slip_atr_k': 0.15176032443559972, 'slip_spread_k': 0.5808057014839465, 'spread_hl_frac': 0.04105579841766894, 'bb_std_mult': 3.5534748400018867, 'rsi_os': 52, 'rsi_ob': 91, 'vol_spike': 0.10140786086837615, 'adx_thresh': 28.49732857082951, 'atr_min_pct': 0.02231204233425135, 'atr_max_pct': 0.09128196471476839, 'tp_mult': 1.871000482957065, 'tsl_mult': 0.6679279504024126, 'strategy': 'mean_reversion', 'time_stop': 277, 'use_sma': True, 'use_atr': False, 'use_adx': False, 'use_ema': True, 'use_spike': False, 'rsi_required': False, 'edge_k': 0.4533523630058236, 'edge_cap': 0.6363043383299269}.
[I 2025-08-29 16:17:24,692] Trial 2 finished with values: [-1000000000.0, 0.18616526556828777] and parameters: {'p_sma': 16, 'p_std': 32, 'p_atr': 29, 'p_adx': 30, 'rsi_period': 20, 'ema1': 24, 'ema2': 29, 'slip_atr_k': 0.16277677941706167, 'slip_spread_k': 0.7434635984156129, 'spread_hl_frac': 0.012388519338833531, 'bb_std_mult': 2.026117506986227, 'rsi_os': 26, 'rsi_ob': 59, 'vol_spike': 0.29600666320924496, 'adx_thresh': 15.183504921150584, 'atr_min_pct': 0.005991108308152722, 'atr_max_pct': 0.1260176589080769, 'tp_mult': 1.7316377461952048, 'tsl_mult': 0.7100250752101512, 'strategy': 'breakout', 'time_stop': 153, 'use_sma': True, 'use_atr': False, 'use_adx': False, 'use_ema': True, 'use_spike': False, 'rsi_required': True, 'edge_k': 1.1661309855239022, 'edge_cap': 0.7505680382344724}.
[I 2025-08-29 16:17:28,937] Trial 3 finished with values: [-1000000000.0, 1000000000.0] and parameters: {'p_sma': 48, 'p_std': 22, 'p_atr': 28, 'p_adx': 14, 'rsi_period': 28, 'ema1': 24, 'ema2': 59, 'slip_atr_k': 0.0008683713601067844, 'slip_spread_k': 0.9463218386522613, 'spread_hl_frac': 0.03292512626475963, 'bb_std_mult': 1.5857821703304251, 'rsi_os': 23, 'rsi_ob': 72, 'vol_spike': 0.27707682803172345, 'adx_thresh': 25.3379137857149, 'atr_min_pct': 0.009651167237020244, 'atr_max_pct': 0.05615448756461928, 'tp_mult': 1.3632971453075764, 'tsl_mult': 0.6473319108434636, 'strategy': 'breakout', 'time_stop': 169, 'use_sma': True, 'use_atr': True, 'use_adx': True, 'use_ema': True, 'use_spike': False, 'rsi_required': False, 'edge_k': 0.05621326444521313, 'edge_cap': 0.7399836484419289}.
[I 2025-08-29 16:17:32,888] Trial 4 finished with values: [-1000000000.0, 0.28030650229409143] and parameters: {'p_sma': 26, 'p_std': 9, 'p_atr': 20, 'p_adx': 16, 'rsi_period': 18, 'ema1': 12, 'ema2': 15, 'slip_atr_k': 0.16483755393662533, 'slip_spread_k': 0.7248845183870131, 'spread_hl_frac': 0.02253782544338262, 'bb_std_mult': 0.9382342032087658, 'rsi_os': 9, 'rsi_ob': 69, 'vol_spike': 0.18192532346201715, 'adx_thresh': 24.834185246301843, 'atr_min_pct': 0.00952085231238017, 'atr_max_pct': 0.11857203579439586, 'tp_mult': 1.2179457468347397, 'tsl_mult': 0.7270115838975055, 'strategy': 'mean_reversion', 'time_stop': 260, 'use_sma': True, 'use_atr': False, 'use_adx': False, 'use_ema': True, 'use_spike': False, 'rsi_required': False, 'edge_k': 0.3532104295321348, 'edge_cap': 0.13884479837031963}.
[I 2025-08-29 16:17:37,090] Trial 5 finished with values: [-1000000000.0, 1000000000.0] and parameters: {'p_sma': 23, 'p_std': 43, 'p_atr': 21, 'p_adx': 25, 'rsi_period': 76, 'ema1': 5, 'ema2': 35, 'slip_atr_k': 0.05378115097685515, 'slip_spread_k': 0.9752592082447512, 'spread_hl_frac': 0.038479918171278486, 'bb_std_mult': 2.209553319081348, 'rsi_os': 9, 'rsi_ob': 53, 'vol_spike': 0.21871458685521794, 'adx_thresh': 5.2348178777391485, 'atr_min_pct': 0.006553638036887911, 'atr_max_pct': 0.02099922600649674, 'tp_mult': 1.192165850335111, 'tsl_mult': 0.5723525771153978, 'strategy': 'mean_reversion', 'time_stop': 144, 'use_sma': False, 'use_atr': False, 'use_adx': False, 'use_ema': True, 'use_spike': False, 'rsi_required': False, 'edge_k': 0.6980181055645649, 'edge_cap': 0.8584593015706053}.
[I 2025-08-29 16:17:41,337] Trial 6 finished with values: [-1000000000.0, 1000000000.0] and parameters: {'p_sma': 60, 'p_std': 53, 'p_atr': 14, 'p_adx': 27, 'rsi_period': 40, 'ema1': 28, 'ema2': 11, 'slip_atr_k': 0.04224818478168155, 'slip_spread_k': 0.7022095851520817, 'spread_hl_frac': 0.02456139418862426, 'bb_std_mult': 3.5058232000179483, 'rsi_os': 42, 'rsi_ob': 59, 'vol_spike': 0.01217081931642393, 'adx_thresh': 9.716563599972089, 'atr_min_pct': 0.018514503372602898, 'atr_max_pct': 0.05586869997105982, 'tp_mult': 2.06286353259196, 'tsl_mult': 0.9417385256862351, 'strategy': 'mean_reversion', 'time_stop': 238, 'use_sma': False, 'use_atr': True, 'use_adx': True, 'use_ema': True, 'use_spike': True, 'rsi_required': False, 'edge_k': 0.8606068122334991, 'edge_cap': 0.28472471810534317}.
[I 2025-08-29 16:17:45,616] Trial 7 finished with values: [-1000000000.0, 1000000000.0] and parameters: {'p_sma': 39, 'p_std': 21, 'p_atr': 8, 'p_adx': 7, 'rsi_period': 19, 'ema1': 8, 'ema2': 12, 'slip_atr_k': 0.058649635044728116, 'slip_spread_k': 0.6655475903406601, 'spread_hl_frac': 0.012168029669115005, 'bb_std_mult': 3.299759218175726, 'rsi_os': 26, 'rsi_ob': 58, 'vol_spike': 0.12356093756183081, 'adx_thresh': 10.135567286599706, 'atr_min_pct': 0.027505899241811904, 'atr_max_pct': 0.11101670791642632, 'tp_mult': 1.05554206821091, 'tsl_mult': 0.1448774569326433, 'strategy': 'breakout', 'time_stop': 69, 'use_sma': False, 'use_atr': True, 'use_adx': False, 'use_ema': False, 'use_spike': True, 'rsi_required': False, 'edge_k': 1.6622000172985534, 'edge_cap': 0.910807249977821}.
[I 2025-08-29 16:17:49,626] Trial 8 finished with values: [-1000000000.0, 1000000000.0] and parameters: {'p_sma': 27, 'p_std': 36, 'p_atr': 28, 'p_adx': 20, 'rsi_period': 11, 'ema1': 5, 'ema2': 43, 'slip_atr_k': 0.043450521723270824, 'slip_spread_k': 0.7306106677776287, 'spread_hl_frac': 1.9140197891487356e-05, 'bb_std_mult': 2.6208206852705507, 'rsi_os': 26, 'rsi_ob': 93, 'vol_spike': 0.15672397483736783, 'adx_thresh': 24.3070683757013, 'atr_min_pct': 0.0052949910679460765, 'atr_max_pct': 0.04661482638573514, 'tp_mult': 2.2891771661960156, 'tsl_mult': 0.541268181422687, 'strategy': 'mean_reversion', 'time_stop': 68, 'use_sma': True, 'use_atr': True, 'use_adx': False, 'use_ema': False, 'use_spike': True, 'rsi_required': False, 'edge_k': 0.9785793822882702, 'edge_cap': 0.4202436123103864}.
[I 2025-08-29 16:17:53,804] Trial 9 finished with values: [-1000000000.0, 1000000000.0] and parameters: {'p_sma': 57, 'p_std': 5, 'p_atr': 9, 'p_adx': 8, 'rsi_period': 56, 'ema1': 11, 'ema2': 51, 'slip_atr_k': 0.12501888640575004, 'slip_spread_k': 0.5424723289477722, 'spread_hl_frac': 0.0027009775338120434, 'bb_std_mult': 2.5766010851124306, 'rsi_os': 8, 'rsi_ob': 64, 'vol_spike': 0.22087138014313148, 'adx_thresh': 15.705169004262368, 'atr_min_pct': 0.020467082004177437, 'atr_max_pct': 0.09702602578077699, 'tp_mult': 2.1749239476474918, 'tsl_mult': 0.07600471370022732, 'strategy': 'mean_reversion', 'time_stop': 73, 'use_sma': True, 'use_atr': False, 'use_adx': True, 'use_ema': True, 'use_spike': False, 'rsi_required': True, 'edge_k': 0.1931123171111646, 'edge_cap': 0.9381275261420204}.
[I 2025-08-29 16:17:58,194] Trial 10 finished with values: [-1000000000.0, 0.10760348300442613] and parameters: {'p_sma': 10, 'p_std': 28, 'p_atr': 24, 'p_adx': 30, 'rsi_period': 29, 'ema1': 18, 'ema2': 26, 'slip_atr_k': 0.2413970029657469, 'slip_spread_k': 0.1544295056578503, 'spread_hl_frac': 0.013695902469104982, 'bb_std_mult': 1.28221880176062, 'rsi_os': 36, 'rsi_ob': 48, 'vol_spike': 0.2968241632120335, 'adx_thresh': 32.95986688151531, 'atr_min_pct': 0.001626860190098129, 'atr_max_pct': 0.14083885359056825, 'tp_mult': 2.846983638872512, 'tsl_mult': 0.9999598225589232, 'strategy': 'breakout', 'time_stop': 8, 'use_sma': False, 'use_atr': False, 'use_adx': True, 'use_ema': False, 'use_spike': True, 'rsi_required': True, 'edge_k': 1.3006125466864817, 'edge_cap': 0.5688686506651492}.
[I 2025-08-29 16:18:02,574] Trial 11 finished with values: [-1000000000.0, 0.17983749065494964] and parameters: {'p_sma': 8, 'p_std': 30, 'p_atr': 24, 'p_adx': 30, 'rsi_period': 30, 'ema1': 18, 'ema2': 28, 'slip_atr_k': 0.24601398748930606, 'slip_spread_k': 0.055065088660628356, 'spread_hl_frac': 0.012115464831251609, 'bb_std_mult': 0.5429257198764487, 'rsi_os': 38, 'rsi_ob': 46, 'vol_spike': 0.29614948256442675, 'adx_thresh': 33.65433139160966, 'atr_min_pct': 0.0010948570140504096, 'atr_max_pct': 0.14284582697997497, 'tp_mult': 2.95344804488084, 'tsl_mult': 0.9928453812899863, 'strategy': 'breakout', 'time_stop': 6, 'use_sma': False, 'use_atr': False, 'use_adx': True, 'use_ema': False, 'use_spike': True, 'rsi_required': True, 'edge_k': 1.3771715845648802, 'edge_cap': 0.5575847125795866}.
[I 2025-08-29 16:18:06,904] Trial 12 finished with values: [-1000000000.0, 0.1489317208837936] and parameters: {'p_sma': 6, 'p_std': 24, 'p_atr': 24, 'p_adx': 30, 'rsi_period': 33, 'ema1': 18, 'ema2': 25, 'slip_atr_k': 0.24392828287376778, 'slip_spread_k': 0.057804009589237426, 'spread_hl_frac': 0.01425436770198545, 'bb_std_mult': 0.669037485000877, 'rsi_os': 38, 'rsi_ob': 48, 'vol_spike': 0.2530039480634583, 'adx_thresh': 33.31904518183225, 'atr_min_pct': 0.0006264801217596289, 'atr_max_pct': 0.1494959864823635, 'tp_mult': 2.9587465358420806, 'tsl_mult': 0.9992188983917065, 'strategy': 'breakout', 'time_stop': 6, 'use_sma': False, 'use_atr': False, 'use_adx': True, 'use_ema': False, 'use_spike': True, 'rsi_required': True, 'edge_k': 1.962538543509424, 'edge_cap': 0.5613116923754254}.
[I 2025-08-29 16:18:11,078] Trial 13 finished with values: [-1000000000.0, 0.19761684432557394] and parameters: {'p_sma': 6, 'p_std': 21, 'p_atr': 24, 'p_adx': 12, 'rsi_period': 84, 'ema1': 17, 'ema2': 22, 'slip_atr_k': 0.23032243134264546, 'slip_spread_k': 0.0043240641129626, 'spread_hl_frac': 0.019746102128280665, 'bb_std_mult': 1.387552175793901, 'rsi_os': 37, 'rsi_ob': 45, 'vol_spike': 0.24323208698524673, 'adx_thresh': 34.949170097048324, 'atr_min_pct': 0.014075674493832537, 'atr_max_pct': 0.14543600115386293, 'tp_mult': 2.9177502403362983, 'tsl_mult': 0.8392066329369847, 'strategy': 'breakout', 'time_stop': 9, 'use_sma': False, 'use_atr': False, 'use_adx': True, 'use_ema': False, 'use_spike': True, 'rsi_required': True, 'edge_k': 1.9771506905567646, 'edge_cap': 0.46666817336922173}.
[I 2025-08-29 16:18:15,100] Trial 14 finished with values: [-0.0025352977404807797, 0.002832186007422926] and parameters: {'p_sma': 16, 'p_std': 45, 'p_atr': 23, 'p_adx': 26, 'rsi_period': 53, 'ema1': 17, 'ema2': 22, 'slip_atr_k': 0.20579194098466813, 'slip_spread_k': 0.23706385502403407, 'spread_hl_frac': 0.03083003561837474, 'bb_std_mult': 1.3007905480515833, 'rsi_os': 50, 'rsi_ob': 77, 'vol_spike': 0.2559633061238584, 'adx_thresh': 30.30628878887876, 'atr_min_pct': 0.0009933318732706353, 'atr_max_pct': 0.015542087500884413, 'tp_mult': 2.562603238410529, 'tsl_mult': 0.35395163550846415, 'strategy': 'breakout', 'time_stop': 114, 'use_sma': False, 'use_atr': False, 'use_adx': True, 'use_ema': False, 'use_spike': True, 'rsi_required': True, 'edge_k': 1.9577526181776481, 'edge_cap': 0.060652417173786}.
[I 2025-08-29 16:18:19,523] Trial 15 finished with values: [-1000000000.0, 1000000000.0] and parameters: {'p_sma': 16, 'p_std': 44, 'p_atr': 12, 'p_adx': 25, 'rsi_period': 56, 'ema1': 15, 'ema2': 17, 'slip_atr_k': 0.2039256861716987, 'slip_spread_k': 0.27364226622869225, 'spread_hl_frac': 0.049062252935980544, 'bb_std_mult': 1.2810290676851177, 'rsi_os': 53, 'rsi_ob': 83, 'vol_spike': 0.06434343803211519, 'adx_thresh': 28.57574916893321, 'atr_min_pct': 0.0001443481619460337, 'atr_max_pct': 0.017761428246502644, 'tp_mult': 2.5543495930867146, 'tsl_mult': 0.3630122086426285, 'strategy': 'breakout', 'time_stop': 194, 'use_sma': False, 'use_atr': False, 'use_adx': True, 'use_ema': False, 'use_spike': True, 'rsi_required': True, 'edge_k': 1.6905138767157164, 'edge_cap': 0.06860011366013555}.
[I 2025-08-29 16:18:23,750] Trial 16 finished with values: [-1000000000.0, 1000000000.0] and parameters: {'p_sma': 18, 'p_std': 48, 'p_atr': 22, 'p_adx': 18, 'rsi_period': 67, 'ema1': 21, 'ema2': 36, 'slip_atr_k': 0.19166372840180107, 'slip_spread_k': 0.2551516991780019, 'spread_hl_frac': 0.03163621742028186, 'bb_std_mult': 1.8007266088283826, 'rsi_os': 45, 'rsi_ob': 78, 'vol_spike': 0.18435328921760985, 'adx_thresh': 29.931681294767348, 'atr_min_pct': 0.029304399608083183, 'atr_max_pct': 0.03688374589052679, 'tp_mult': 2.5388861896151798, 'tsl_mult': 0.33953642259356015, 'strategy': 'breakout', 'time_stop': 99, 'use_sma': False, 'use_atr': False, 'use_adx': True, 'use_ema': False, 'use_spike': True, 'rsi_required': True, 'edge_k': 1.6645278907624872, 'edge_cap': 0.22096439158350334}.
[I 2025-08-29 16:18:27,941] Trial 17 finished with values: [-6.509560536527292e-05, 0.002120168812519096] and parameters: {'p_sma': 36, 'p_std': 41, 'p_atr': 18, 'p_adx': 26, 'rsi_period': 46, 'ema1': 30, 'ema2': 19, 'slip_atr_k': 0.10640419169048866, 'slip_spread_k': 0.25466394164728695, 'spread_hl_frac': 0.031138312047964006, 'bb_std_mult': 1.0513762076404476, 'rsi_os': 47, 'rsi_ob': 81, 'vol_spike': 0.0619833144817144, 'adx_thresh': 21.338514784138876, 'atr_min_pct': 0.013188223942573027, 'atr_max_pct': 0.06850453014709074, 'tp_mult': 2.580654215222982, 'tsl_mult': 0.4066316769961024, 'strategy': 'breakout', 'time_stop': 212, 'use_sma': False, 'use_atr': False, 'use_adx': True, 'use_ema': False, 'use_spike': True, 'rsi_required': True, 'edge_k': 1.2808106491869977, 'edge_cap': 0.056811207950125564}.
[I 2025-08-29 16:18:32,210] Trial 18 finished with values: [-1000000000.0, 1000000000.0] and parameters: {'p_sma': 33, 'p_std': 38, 'p_atr': 18, 'p_adx': 26, 'rsi_period': 49, 'ema1': 29, 'ema2': 43, 'slip_atr_k': 0.10050881945791575, 'slip_spread_k': 0.3412714079498476, 'spread_hl_frac': 0.03053777617511788, 'bb_std_mult': 0.9178500571917776, 'rsi_os': 17, 'rsi_ob': 85, 'vol_spike': 0.057202965938325745, 'adx_thresh': 19.625044378268537, 'atr_min_pct': 0.014997018613952948, 'atr_max_pct': 0.06763928451519498, 'tp_mult': 2.4568669053035874, 'tsl_mult': 0.36717046412216525, 'strategy': 'breakout', 'time_stop': 228, 'use_sma': False, 'use_atr': True, 'use_adx': True, 'use_ema': False, 'use_spike': True, 'rsi_required': True, 'edge_k': 0.7030358445615987, 'edge_cap': 0.10615039621942438}.
[I 2025-08-29 16:18:36,296] Trial 19 finished with values: [-0.0070867346263779885, 0.00715676490457225] and parameters: {'p_sma': 34, 'p_std': 60, 'p_atr': 11, 'p_adx': 22, 'rsi_period': 47, 'ema1': 25, 'ema2': 19, 'slip_atr_k': 0.10319074917001082, 'slip_spread_k': 0.40011194293268826, 'spread_hl_frac': 0.0467454133025509, 'bb_std_mult': 0.9065045988258718, 'rsi_os': 47, 'rsi_ob': 76, 'vol_spike': 0.07305405215811014, 'adx_thresh': 22.096920348311986, 'atr_min_pct': 0.025102121908149304, 'atr_max_pct': 0.07676899592756839, 'tp_mult': 2.7033868707362236, 'tsl_mult': 0.4453024708639965, 'strategy': 'breakout', 'time_stop': 291, 'use_sma': False, 'use_atr': False, 'use_adx': True, 'use_ema': False, 'use_spike': True, 'rsi_required': True, 'edge_k': 1.1310897215600086, 'edge_cap': 0.19825402375169468}.
[I 2025-08-29 16:18:40,468] Trial 20 finished with values: [-1000000000.0, 1000000000.0] and parameters: {'p_sma': 45, 'p_std': 48, 'p_atr': 18, 'p_adx': 11, 'rsi_period': 70, 'ema1': 27, 'ema2': 31, 'slip_atr_k': 0.09210942333464787, 'slip_spread_k': 0.16141950203737218, 'spread_hl_frac': 0.0346796088956948, 'bb_std_mult': 1.6222126284565825, 'rsi_os': 32, 'rsi_ob': 85, 'vol_spike': 0.040585803320932506, 'adx_thresh': 12.466585487325524, 'atr_min_pct': 0.016462897293799298, 'atr_max_pct': 0.029748899031509866, 'tp_mult': 1.534166923343059, 'tsl_mult': 0.23891390500687443, 'strategy': 'breakout', 'time_stop': 201, 'use_sma': False, 'use_atr': False, 'use_adx': True, 'use_ema': False, 'use_spike': True, 'rsi_required': True, 'edge_k': 0.587833382255172, 'edge_cap': 0.053428997718744854}.
[I 2025-08-29 16:18:44,587] Trial 21 finished with values: [-0.0073538794238114935, 0.0075322686025914] and parameters: {'p_sma': 34, 'p_std': 39, 'p_atr': 12, 'p_adx': 23, 'rsi_period': 49, 'ema1': 30, 'ema2': 19, 'slip_atr_k': 0.12255136893833599, 'slip_spread_k': 0.45152773031209953, 'spread_hl_frac': 0.046115421174262976, 'bb_std_mult': 0.8366796873020156, 'rsi_os': 47, 'rsi_ob': 75, 'vol_spike': 0.08739370469260978, 'adx_thresh': 22.12274525988711, 'atr_min_pct': 0.011527787862850596, 'atr_max_pct': 0.07597764714739776, 'tp_mult': 2.694428085115959, 'tsl_mult': 0.43961268260766134, 'strategy': 'breakout', 'time_stop': 115, 'use_sma': False, 'use_atr': False, 'use_adx': True, 'use_ema': False, 'use_spike': True, 'rsi_required': True, 'edge_k': 1.09134458450457, 'edge_cap': 0.18681124805042018}.
[I 2025-08-29 16:18:48,743] Trial 22 finished with values: [-0.002732361070529432, 0.003119913224255584] and parameters: {'p_sma': 39, 'p_std': 57, 'p_atr': 11, 'p_adx': 28, 'rsi_period': 43, 'ema1': 26, 'ema2': 20, 'slip_atr_k': 0.08736045499811348, 'slip_spread_k': 0.36443430432266805, 'spread_hl_frac': 0.02823055650389007, 'bb_std_mult': 1.107321101560221, 'rsi_os': 49, 'rsi_ob': 80, 'vol_spike': 0.11720413139266707, 'adx_thresh': 22.121798858885622, 'atr_min_pct': 0.024498444500593033, 'atr_max_pct': 0.0796966209240581, 'tp_mult': 2.354773510826857, 'tsl_mult': 0.4630075218429123, 'strategy': 'breakout', 'time_stop': 283, 'use_sma': False, 'use_atr': False, 'use_adx': True, 'use_ema': False, 'use_spike': True, 'rsi_required': True, 'edge_k': 0.8844627296102556, 'edge_cap': 0.3175736014087322}.
[I 2025-08-29 16:18:53,125] Trial 23 finished with values: [-1000000000.0, 1000000000.0] and parameters: {'p_sma': 38, 'p_std': 52, 'p_atr': 15, 'p_adx': 27, 'rsi_period': 40, 'ema1': 26, 'ema2': 10, 'slip_atr_k': 0.13167649448242474, 'slip_spread_k': 0.16828583658312937, 'spread_hl_frac': 0.027787032672946882, 'bb_std_mult': 1.0728822284411512, 'rsi_os': 17, 'rsi_ob': 81, 'vol_spike': 0.11799908416854364, 'adx_thresh': 18.45499181578792, 'atr_min_pct': 0.025088658833670112, 'atr_max_pct': 0.10546954598298575, 'tp_mult': 2.351624014153726, 'tsl_mult': 0.2416595900559812, 'strategy': 'breakout', 'time_stop': 204, 'use_sma': False, 'use_atr': True, 'use_adx': True, 'use_ema': False, 'use_spike': True, 'rsi_required': True, 'edge_k': 1.520183515472369, 'edge_cap': 0.3479868597219813}.
[I 2025-08-29 16:18:57,264] Trial 24 finished with values: [-1000000000.0, 1000000000.0] and parameters: {'p_sma': 53, 'p_std': 42, 'p_atr': 10, 'p_adx': 28, 'rsi_period': 61, 'ema1': 30, 'ema2': 56, 'slip_atr_k': 0.08028537131657722, 'slip_spread_k': 0.28727296400369723, 'spread_hl_frac': 0.036589539575349744, 'bb_std_mult': 1.1609325299414512, 'rsi_os': 55, 'rsi_ob': 87, 'vol_spike': 0.0363273340066683, 'adx_thresh': 21.80996321920291, 'atr_min_pct': 0.011746700081061816, 'atr_max_pct': 0.011782764192610012, 'tp_mult': 2.708351351144721, 'tsl_mult': 0.4807861390841834, 'strategy': 'breakout', 'time_stop': 243, 'use_sma': False, 'use_atr': False, 'use_adx': True, 'use_ema': False, 'use_spike': True, 'rsi_required': True, 'edge_k': 1.7995827096732964, 'edge_cap': 0.1450578809364304}.
[I 2025-08-29 16:19:01,686] Trial 25 finished with values: [-1000000000.0, 1000000000.0] and parameters: {'p_sma': 29, 'p_std': 35, 'p_atr': 7, 'p_adx': 24, 'rsi_period': 36, 'ema1': 21, 'ema2': 16, 'slip_atr_k': 0.019410032759425044, 'slip_spread_k': 0.8413827543454426, 'spread_hl_frac': 0.019285820353715507, 'bb_std_mult': 1.52778933800553, 'rsi_os': 43, 'rsi_ob': 90, 'vol_spike': 0.14379145580382408, 'adx_thresh': 17.01545078739759, 'atr_min_pct': 0.01838951150342087, 'atr_max_pct': 0.0661282323887827, 'tp_mult': 2.2514825762000545, 'tsl_mult': 0.31110364507215543, 'strategy': 'breakout', 'time_stop': 174, 'use_sma': False, 'use_atr': False, 'use_adx': True, 'use_ema': False, 'use_spike': True, 'rsi_required': True, 'edge_k': 0.827524890308655, 'edge_cap': 0.2538771640511389}.
[I 2025-08-29 16:19:01,710] Trial 26 finished with values: [-1000000000.0, 1000000000.0] and parameters: {'p_sma': 45, 'p_std': 16, 'p_atr': 26, 'p_adx': 19, 'rsi_period': 53, 'ema1': 22, 'ema2': 44, 'slip_atr_k': 0.14385796488630428, 'slip_spread_k': 0.22168038136729287, 'spread_hl_frac': 0.02899601650396993, 'bb_std_mult': 1.9726000647999378, 'rsi_os': 50, 'rsi_ob': 95, 'vol_spike': 0.03875367231745756, 'adx_thresh': 13.783201012153993, 'atr_min_pct': 0.02218489581730302, 'atr_max_pct': 0.12865592438077866, 'tp_mult': 2.059646628161425, 'tsl_mult': 0.037224719372553505, 'strategy': 'mean_reversion', 'time_stop': 221, 'use_sma': True, 'use_atr': True, 'use_adx': False, 'use_ema': False, 'use_spike': False, 'rsi_required': False, 'edge_k': 0.41460254317882406, 'edge_cap': 0.3733204431435758}.
