[I 2025-08-29 17:13:42,807] Trial 242 finished with values: [-1000000000.0, 1000000000.0] and parameters: {'p_sma': 11, 'p_std': 24, 'p_atr': 19, 'p_adx': 9, 'rsi_period': 20, 'ema1': 14, 'ema2': 42, 'slip_atr_k': 0.04108266265018497, 'slip_spread_k': 0.1084976644260319, 'spread_hl_frac': 0.010495542032857276, 'bb_std_mult': 2.88255016096492, 'rsi_os': 11, 'rsi_ob': 73, 'vol_spike': 0.2733051692366303, 'adx_thresh': 19.101512581819062, 'atr_min_pct': 0.0022854904587399135, 'atr_max_pct': 0.1418460559548969, 'tp_mult': 2.7819776747339593, 'tsl_mult': 0.6126536004603526, 'strategy': 'mean_reversion', 'time_stop': 89, 'use_sma': True, 'use_atr': False, 'use_adx': True, 'use_ema': False, 'use_spike': True, 'rsi_required': True, 'edge_k': 0.23869276878102502, 'edge_cap': 0.16733257956673026}.
[I 2025-08-29 17:13:42,808] Trial 243 finished with values: [-1000000000.0, 1000000000.0] and parameters: {'p_sma': 11, 'p_std': 24, 'p_atr': 19, 'p_adx': 9, 'rsi_period': 20, 'ema1': 29, 'ema2': 42, 'slip_atr_k': 0.06635546778384394, 'slip_spread_k': 0.09300286313102835, 'spread_hl_frac': 0.006992110115770349, 'bb_std_mult': 3.5262460625417305, 'rsi_os': 11, 'rsi_ob': 72, 'vol_spike': 0.2707188559483502, 'adx_thresh': 19.380857923309073, 'atr_min_pct': 0.0021220369090118223, 'atr_max_pct': 0.14256944790141296, 'tp_mult': 2.7740888685395113, 'tsl_mult': 0.7190979229937311, 'strategy': 'mean_reversion', 'time_stop': 86, 'use_sma': True, 'use_atr': False, 'use_adx': True, 'use_ema': False, 'use_spike': True, 'rsi_required': True, 'edge_k': 0.23594188805682542, 'edge_cap': 0.1623958803088174}.
[I 2025-08-29 17:14:09,499] Trial 247 finished with values: [-1000000000.0, 1000000000.0] and parameters: {'p_sma': 12, 'p_std': 28, 'p_atr': 19, 'p_adx': 8, 'rsi_period': 17, 'ema1': 16, 'ema2': 47, 'slip_atr_k': 0.05859097247886868, 'slip_spread_k': 0.255379364332537, 'spread_hl_frac': 0.01214725721838844, 'bb_std_mult': 3.424530024336233, 'rsi_os': 11, 'rsi_ob': 78, 'vol_spike': 0.290654998427751, 'adx_thresh': 16.49899653668055, 'atr_min_pct': 0.00191997300123449, 'atr_max_pct': 0.13810716222402467, 'tp_mult': 2.199155313415345, 'tsl_mult': 0.673483151462339, 'strategy': 'breakout', 'time_stop': 102, 'use_sma': True, 'use_atr': False, 'use_adx': False, 'use_ema': False, 'use_spike': False, 'rsi_required': True, 'edge_k': 0.2765707324122987, 'edge_cap': 0.1144286958666467}.
[I 2025-08-29 17:14:09,665] Trial 248 finished with values: [-1000000000.0, 1000000000.0] and parameters: {'p_sma': 12, 'p_std': 29, 'p_atr': 19, 'p_adx': 10, 'rsi_period': 16, 'ema1': 6, 'ema2': 40, 'slip_atr_k': 0.05623361438541604, 'slip_spread_k': 0.1541350135848667, 'spread_hl_frac': 0.006135056956278369, 'bb_std_mult': 3.404568078033513, 'rsi_os': 11, 'rsi_ob': 78, 'vol_spike': 0.2812610615499024, 'adx_thresh': 18.467244141762137, 'atr_min_pct': 0.002027020084397343, 'atr_max_pct': 0.01625673999928022, 'tp_mult': 2.2157276141015783, 'tsl_mult': 0.6776796069705622, 'strategy': 'breakout', 'time_stop': 103, 'use_sma': True, 'use_atr': False, 'use_adx': False, 'use_ema': False, 'use_spike': False, 'rsi_required': True, 'edge_k': 0.2816412346786206, 'edge_cap': 0.11884068474835947}.
[I 2025-08-29 17:14:10,071] Trial 245 finished with values: [-1000000000.0, 1000000000.0] and parameters: {'p_sma': 26, 'p_std': 25, 'p_atr': 20, 'p_adx': 8, 'rsi_period': 20, 'ema1': 12, 'ema2': 50, 'slip_atr_k': 0.040193419165830094, 'slip_spread_k': 0.10121709877920021, 'spread_hl_frac': 0.01109639699257889, 'bb_std_mult': 3.5408663350535594, 'rsi_os': 11, 'rsi_ob': 80, 'vol_spike': 0.26947921331562064, 'adx_thresh': 19.131794530711623, 'atr_min_pct': 0.002426580034368542, 'atr_max_pct': 0.05082555956831815, 'tp_mult': 1.2995765044928964, 'tsl_mult': 0.6346397963455608, 'strategy': 'mean_reversion', 'time_stop': 102, 'use_sma': True, 'use_atr': False, 'use_adx': True, 'use_ema': False, 'use_spike': True, 'rsi_required': False, 'edge_k': 0.24517647136924675, 'edge_cap': 0.1637722170455428}.
[I 2025-08-29 17:14:10,152] Trial 246 finished with values: [-1000000000.0, 1000000000.0] and parameters: {'p_sma': 12, 'p_std': 29, 'p_atr': 19, 'p_adx': 8, 'rsi_period': 20, 'ema1': 6, 'ema2': 42, 'slip_atr_k': 0.055133576261536754, 'slip_spread_k': 0.10346284376163983, 'spread_hl_frac': 0.00621330665903752, 'bb_std_mult': 3.5206701143621677, 'rsi_os': 11, 'rsi_ob': 78, 'vol_spike': 0.2814357316221904, 'adx_thresh': 18.980995444826704, 'atr_min_pct': 0.0021609502166151677, 'atr_max_pct': 0.14117293312260137, 'tp_mult': 2.2184018100964393, 'tsl_mult': 0.674644359259736, 'strategy': 'mean_reversion', 'time_stop': 102, 'use_sma': True, 'use_atr': False, 'use_adx': True, 'use_ema': False, 'use_spike': True, 'rsi_required': True, 'edge_k': 0.2319488302581837, 'edge_cap': 0.1713783085164803}.
[I 2025-08-29 17:14:16,744] Trial 249 finished with values: [-1000000000.0, 1000000000.0] and parameters: {'p_sma': 9, 'p_std': 31, 'p_atr': 19, 'p_adx': 10, 'rsi_period': 15, 'ema1': 6, 'ema2': 50, 'slip_atr_k': 0.09769614017796638, 'slip_spread_k': 0.2853337882216802, 'spread_hl_frac': 0.005895753494268534, 'bb_std_mult': 3.327055799223685, 'rsi_os': 12, 'rsi_ob': 76, 'vol_spike': 0.2821126950242964, 'adx_thresh': 18.213190969625927, 'atr_min_pct': 0.0021568626373795335, 'atr_max_pct': 0.14015609651509642, 'tp_mult': 2.8321890379311534, 'tsl_mult': 0.9676112570869316, 'strategy': 'breakout', 'time_stop': 106, 'use_sma': False, 'use_atr': False, 'use_adx': False, 'use_ema': False, 'use_spike': False, 'rsi_required': False, 'edge_k': 0.3968125162148623, 'edge_cap': 0.1650876574241846}.
Starting optimization (250 trials, n_jobs=4) | multi-objective=True
Saved trials CSV -> runs/FUT_SHORT_fee1e-3_slip6e-4_robust/trials_metrics.csv
Saved Pareto plot -> runs/FUT_SHORT_fee1e-3_slip6e-4_robust/pareto_return_vs_drawdown.png
Top-K under DD cap: [237] (agg='median')
=== Selected trial(s) ===
top_k=1 selected_trial_numbers=[237] primary=237
ret%_train=0.01% dd%_train=-0.05% trades=74
ret%_test=-0.00% dd%_test=-0.02% pnl_test=-0.08 trades_test=16
WFO fold 1: OOS PnL=1.35 trades=1 win_rate=100.00% avg=1.345451 ret%=0.01% maxDD=0.000000 maxDD%=0.00%
WFO fold 2: OOS PnL=0.84 trades=9 win_rate=44.44% avg=0.093122 ret%=0.00% maxDD=-1.074324 maxDD%=-0.01%
WFO fold 3: OOS PnL=-1.39 trades=4 win_rate=25.00% avg=-0.346729 ret%=-0.01% maxDD=-1.832659 maxDD%=-0.01%
WFO fold 4: OOS PnL=0.00 trades=0 win_rate=0.00% avg=0.000000 ret%=0.00% maxDD=0.000000 maxDD%=0.00%
WFO fold 5: OOS PnL=-0.41 trades=1 win_rate=0.00% avg=-0.409179 ret%=-0.00% maxDD=0.000000 maxDD%=0.00%
WFO fold 6: OOS PnL=-0.47 trades=1 win_rate=0.00% avg=-0.472155 ret%=-0.00% maxDD=0.000000 maxDD%=0.00%
WFO summary: meanPnL=-0.01 stdPnL=0.90 meanWR=28.24% meanAvg=0.035085 meanRet%=-0.00% worstDD=-1.832659 worstDD%=-0.01% folds=6 trades=16
Wrote runs/FUT_SHORT_fee1e-3_slip6e-4_robust/strategy_profile.json
=== ECHO SELECTED PARAMS (JSON) ===
{
  "adx_thresh": 17.168656666454204,
  "aggregate_params": "median",
  "atr_max_pct": 0.14616925640893583,
  "atr_min_pct": 0.003157786624965315,
  "bar_priority": "stop_first",
  "bb_std_mult": 3.4718474186534936,
  "cooldown_bars": 60,
  "daily_loss_limit_pct": 0.03,
  "edge_cap": 0.13603858078692,
  "edge_k": 0.37330407258109427,
  "ema1": 21,
  "ema2": 44,
  "embargo_bars": 150,
  "fee": 0.001,
  "fill_timing": "next_open",
  "include_hours_set": "{13, 14, 15, 16, 17, 18, 19, 20, 22}",
  "lockout_bars": 150,
  "max_consec_losses": 3,
  "max_notional_pct_equity": 1.0,
  "min_notional": 5.0,
  "ml_thresh": 0.0,
  "objective": "multi",
  "p_adx": 9,
  "p_atr": 17,
  "p_sma": 10,
  "p_std": 27,
  "participation_cap": 1.0,
  "price_step": 0.0001,
  "proba_temp": 1.0,
  "qty_step": 0.0001,
  "regime_adapt": true,
  "regime_band": 0.006,
  "regime_fast": 50,
  "regime_overrides": {
    "bear": {
      "adx": 20.0,
      "allowed_sides": [
        "long",
        "short"
      ],
      "atr_range": [
        0.0015,
        0.06
      ],
      "bb_std_mult": 1.2571599337995167,
      "mode": "breakout",
      "rsi_required": true,
      "time_stop_bars": 122,
      "tp_mult": 1.7149673432024581,
      "tsl_mult": 0.25,
      "use_adx": true,
      "use_atr": true
    },
    "bull": {
      "adx": 18.0,
      "allowed_sides": [
        "long",
        "short"
      ],
      "atr_range": [
        0.0008,
        0.06
      ],
      "bb_std_mult": 2.0169431746748376,
      "mode": "mean_reversion",
      "rsi_required": false,
      "time_stop_bars": 214,
      "tp_mult": 1.9194251920826044,
      "tsl_mult": 0.6891458682949287,
      "use_adx": true,
      "use_atr": true
    },
    "sideways": {
      "adx": 15.0,
      "allowed_sides": [
        "long",
        "short"
      ],
      "atr_range": [
        0.001,
        0.14
      ],
      "bb_std_mult": 1.5828092896467827,
      "mode": "breakout",
      "rsi_required": true,
      "time_stop_bars": 235,
      "tp_mult": 2.341879695778944,
      "tsl_mult": 0.651967765830165,
      "use_adx": true,
      "use_atr": true
    }
  },
  "regime_slow": 200,
  "risk_min_stop_frac": 0.001,
  "risk_per_trade": 0.003,
  "risk_stop_atr_mult": 1.0,
  "round_exits": true,
  "rsi_key": "rsi18",
  "rsi_ob": 77,
  "rsi_os": 10,
  "rsi_period": 18,
  "rsi_required": true,
  "select_top_k": 1,
  "session_end": 24,
  "session_start": 0,
  "sides": "short",
  "slip_atr_k": 0.06368757978984287,
  "slip_spread_k": 0.22158685352392873,
  "slippage": 0.0006,
  "spread_hl_frac": 0.009456794620292884,
  "start_equity": 20000.0,
  "stop_extra_slip": 0.0,
  "strategy": "breakout",
  "time_stop": 96,
  "tp_mult": 2.721944486086275,
  "tsl_mult": 0.704446509545588,
  "use_adx": false,
  "use_atr": true,
  "use_ema": true,
  "use_ml": false,
  "use_sma": true,
  "use_spike": false,
  "vol_spike": 0.2775193570300866,
  "wfo_folds": 6
}
Wrote runs/FUT_SHORT_fee1e-3_slip6e-4_robust/best_params.pkl
