[I 2025-08-29 16:52:29,686] Trial 54 finished with values: [-1000000000.0, 1000000000.0] and parameters: {'p_sma': 49, 'p_std': 52, 'p_atr': 15, 'p_adx': 13, 'rsi_period': 11, 'ema1': 17, 'ema2': 12, 'slip_atr_k': 0.023359518659054394, 'slip_spread_k': 0.9088006719243664, 'spread_hl_frac': 0.004206577830091035, 'bb_std_mult': 1.381175431207979, 'rsi_os': 22, 'rsi_ob': 95, 'vol_spike': 0.08202599688675807, 'adx_thresh': 13.150072915445248, 'atr_min_pct': 0.0073667674459763945, 'atr_max_pct': 0.029649576710982964, 'tp_mult': 2.2602325474124347, 'tsl_mult': 0.00727575832988242, 'strategy': 'breakout', 'time_stop': 132, 'use_sma': True, 'use_atr': False, 'use_adx': False, 'use_ema': True, 'use_spike': False, 'rsi_required': True, 'edge_k': 0.15329977698372516, 'edge_cap': 0.261002586757724}.
[I 2025-08-29 16:52:30,231] Trial 56 finished with values: [-1000000000.0, 1000000000.0] and parameters: {'p_sma': 50, 'p_std': 51, 'p_atr': 15, 'p_adx': 10, 'rsi_period': 8, 'ema1': 17, 'ema2': 12, 'slip_atr_k': 0.015405702803939703, 'slip_spread_k': 0.8901243969028002, 'spread_hl_frac': 0.003776474504710822, 'bb_std_mult': 0.505493685141958, 'rsi_os': 21, 'rsi_ob': 86, 'vol_spike': 0.08448113767948613, 'adx_thresh': 5.090514172415437, 'atr_min_pct': 0.011653430258878716, 'atr_max_pct': 0.05913552305176692, 'tp_mult': 2.595571029165618, 'tsl_mult': 0.5497435693490855, 'strategy': 'breakout', 'time_stop': 186, 'use_sma': True, 'use_atr': False, 'use_adx': True, 'use_ema': False, 'use_spike': True, 'rsi_required': True, 'edge_k': 0.15860323292032058, 'edge_cap': 0.21086961114451855}.
[I 2025-08-29 16:52:30,341] Trial 55 finished with values: [-1000000000.0, 1000000000.0] and parameters: {'p_sma': 60, 'p_std': 54, 'p_atr': 15, 'p_adx': 9, 'rsi_period': 12, 'ema1': 5, 'ema2': 12, 'slip_atr_k': 0.018613842724347903, 'slip_spread_k': 0.9076633101800922, 'spread_hl_frac': 0.004516301254961419, 'bb_std_mult': 1.4206637472343617, 'rsi_os': 35, 'rsi_ob': 95, 'vol_spike': 0.08538018186157977, 'adx_thresh': 5.010952009021699, 'atr_min_pct': 0.0047915635749454935, 'atr_max_pct': 0.03142742477852243, 'tp_mult': 2.3137688374372476, 'tsl_mult': 0.5443546735124014, 'strategy': 'breakout', 'time_stop': 136, 'use_sma': True, 'use_atr': False, 'use_adx': True, 'use_ema': True, 'use_spike': False, 'rsi_required': True, 'edge_k': 0.3075058627510976, 'edge_cap': 0.13096959609401498}.
[I 2025-08-29 16:52:36,057] Trial 57 finished with values: [-1000000000.0, 1000000000.0] and parameters: {'p_sma': 50, 'p_std': 45, 'p_atr': 17, 'p_adx': 9, 'rsi_period': 13, 'ema1': 27, 'ema2': 10, 'slip_atr_k': 0.02746126446504113, 'slip_spread_k': 0.9380989149024559, 'spread_hl_frac': 0.010607771948417805, 'bb_std_mult': 0.9848134360264269, 'rsi_os': 21, 'rsi_ob': 86, 'vol_spike': 0.08601165256023013, 'adx_thresh': 16.71162553332101, 'atr_min_pct': 0.011459342529477261, 'atr_max_pct': 0.11700715354685862, 'tp_mult': 2.5385288751325525, 'tsl_mult': 0.4032501568467323, 'strategy': 'mean_reversion', 'time_stop': 103, 'use_sma': True, 'use_atr': False, 'use_adx': True, 'use_ema': False, 'use_spike': True, 'rsi_required': True, 'edge_k': 0.15441020504946773, 'edge_cap': 0.1995476840101289}.
[I 2025-08-29 16:52:59,177] Trial 59 finished with values: [-1000000000.0, 1000000000.0] and parameters: {'p_sma': 55, 'p_std': 45, 'p_atr': 20, 'p_adx': 9, 'rsi_period': 55, 'ema1': 28, 'ema2': 10, 'slip_atr_k': 0.028944822435458716, 'slip_spread_k': 0.5681011821501599, 'spread_hl_frac': 0.010119282132745927, 'bb_std_mult': 0.9575785648847379, 'rsi_os': 29, 'rsi_ob': 91, 'vol_spike': 0.020183999311312623, 'adx_thresh': 29.23009885838377, 'atr_min_pct': 0.004891653544285086, 'atr_max_pct': 0.11827195070019164, 'tp_mult': 2.8256209348494927, 'tsl_mult': 0.39804611167889575, 'strategy': 'mean_reversion', 'time_stop': 30, 'use_sma': False, 'use_atr': True, 'use_adx': True, 'use_ema': False, 'use_spike': False, 'rsi_required': True, 'edge_k': 0.05966859394591314, 'edge_cap': 0.15507262749038386}.
[I 2025-08-29 16:52:59,542] Trial 60 finished with values: [-1000000000.0, 1000000000.0] and parameters: {'p_sma': 27, 'p_std': 45, 'p_atr': 20, 'p_adx': 9, 'rsi_period': 55, 'ema1': 29, 'ema2': 10, 'slip_atr_k': 0.03078437811856472, 'slip_spread_k': 0.26750330904242636, 'spread_hl_frac': 0.010208062656273872, 'bb_std_mult': 0.8891626826896271, 'rsi_os': 29, 'rsi_ob': 91, 'vol_spike': 0.01815084958910884, 'adx_thresh': 16.455252290096016, 'atr_min_pct': 0.002102754129619883, 'atr_max_pct': 0.10426671081146288, 'tp_mult': 2.8021254771910624, 'tsl_mult': 0.3986508719539519, 'strategy': 'mean_reversion', 'time_stop': 5, 'use_sma': False, 'use_atr': True, 'use_adx': False, 'use_ema': False, 'use_spike': True, 'rsi_required': True, 'edge_k': 0.042243353349168816, 'edge_cap': 0.9994311718148476}.
[I 2025-08-29 16:52:59,875] Trial 58 finished with values: [-1000000000.0, 1000000000.0] and parameters: {'p_sma': 56, 'p_std': 41, 'p_atr': 20, 'p_adx': 9, 'rsi_period': 55, 'ema1': 29, 'ema2': 10, 'slip_atr_k': 0.012351679038627019, 'slip_spread_k': 0.5717156057840727, 'spread_hl_frac': 0.009039722748761189, 'bb_std_mult': 0.9753009374124644, 'rsi_os': 21, 'rsi_ob': 85, 'vol_spike': 0.16445551229129415, 'adx_thresh': 5.065372260161471, 'atr_min_pct': 0.0046822785952057785, 'atr_max_pct': 0.11686525544606474, 'tp_mult': 2.5629983572094246, 'tsl_mult': 0.41394019752960576, 'strategy': 'mean_reversion', 'time_stop': 106, 'use_sma': False, 'use_atr': True, 'use_adx': True, 'use_ema': False, 'use_spike': True, 'rsi_required': True, 'edge_k': 0.05989219931416491, 'edge_cap': 0.20529147144067172}.
[I 2025-08-29 16:53:03,078] Trial 61 finished with values: [-1000000000.0, 1000000000.0] and parameters: {'p_sma': 27, 'p_std': 41, 'p_atr': 20, 'p_adx': 14, 'rsi_period': 20, 'ema1': 28, 'ema2': 17, 'slip_atr_k': 0.03406875966260685, 'slip_spread_k': 0.543537995599306, 'spread_hl_frac': 0.009847651303468609, 'bb_std_mult': 1.7117485458591184, 'rsi_os': 29, 'rsi_ob': 84, 'vol_spike': 0.16142673984272943, 'adx_thresh': 15.55812199222601, 'atr_min_pct': 0.00238067266343075, 'atr_max_pct': 0.10171746918832883, 'tp_mult': 2.7088176915807454, 'tsl_mult': 0.22225057524858272, 'strategy': 'mean_reversion', 'time_stop': 165, 'use_sma': False, 'use_atr': True, 'use_adx': False, 'use_ema': False, 'use_spike': False, 'rsi_required': True, 'edge_k': 0.05276944511904807, 'edge_cap': 0.2895661630633499}.
[I 2025-08-29 16:53:28,683] Trial 62 finished with values: [-1000000000.0, 1000000000.0] and parameters: {'p_sma': 27, 'p_std': 42, 'p_atr': 12, 'p_adx': 12, 'rsi_period': 38, 'ema1': 21, 'ema2': 55, 'slip_atr_k': 0.01037746915782728, 'slip_spread_k': 0.589376276129967, 'spread_hl_frac': 0.007084619358535881, 'bb_std_mult': 1.779749364166401, 'rsi_os': 25, 'rsi_ob': 84, 'vol_spike': 0.16246912951622677, 'adx_thresh': 15.486871322245975, 'atr_min_pct': 0.01824227687510775, 'atr_max_pct': 0.09202251796044437, 'tp_mult': 2.754099717926107, 'tsl_mult': 0.24850407681305076, 'strategy': 'breakout', 'time_stop': 159, 'use_sma': False, 'use_atr': False, 'use_adx': False, 'use_ema': False, 'use_spike': False, 'rsi_required': True, 'edge_k': 1.7265305284792665, 'edge_cap': 0.28229248469229107}.
[I 2025-08-29 16:53:28,841] Trial 64 finished with values: [-1000000000.0, 1000000000.0] and parameters: {'p_sma': 36, 'p_std': 40, 'p_atr': 12, 'p_adx': 14, 'rsi_period': 50, 'ema1': 18, 'ema2': 55, 'slip_atr_k': 0.0013228113766882987, 'slip_spread_k': 0.8492926057991914, 'spread_hl_frac': 0.0011545088298236935, 'bb_std_mult': 1.7367600577004823, 'rsi_os': 25, 'rsi_ob': 48, 'vol_spike': 0.14603946508245225, 'adx_thresh': 15.376750460166962, 'atr_min_pct': 0.01752932936470192, 'atr_max_pct': 0.14553263799581034, 'tp_mult': 2.707681927970746, 'tsl_mult': 0.6617081110217258, 'strategy': 'breakout', 'time_stop': 146, 'use_sma': True, 'use_atr': False, 'use_adx': False, 'use_ema': False, 'use_spike': False, 'rsi_required': True, 'edge_k': 1.8569392193000969, 'edge_cap': 0.2959093491225027}.
[I 2025-08-29 16:53:28,971] Trial 63 finished with values: [-1000000000.0, 1000000000.0] and parameters: {'p_sma': 9, 'p_std': 41, 'p_atr': 12, 'p_adx': 15, 'rsi_period': 45, 'ema1': 22, 'ema2': 53, 'slip_atr_k': 0.00019834461971795928, 'slip_spread_k': 0.8522254140331218, 'spread_hl_frac': 0.0020099529987302857, 'bb_std_mult': 1.725636501368668, 'rsi_os': 26, 'rsi_ob': 84, 'vol_spike': 0.1671339341090485, 'adx_thresh': 15.347000911041293, 'atr_min_pct': 0.018392352746780857, 'atr_max_pct': 0.09321033137645156, 'tp_mult': 2.682990061731052, 'tsl_mult': 0.23368669930389452, 'strategy': 'breakout', 'time_stop': 153, 'use_sma': True, 'use_atr': False, 'use_adx': False, 'use_ema': False, 'use_spike': False, 'rsi_required': True, 'edge_k': 0.49409305983472696, 'edge_cap': 0.29698932095159214}.
[I 2025-08-29 16:53:30,768] Trial 65 finished with values: [-0.006287884576418712, 0.006498103638115216] and parameters: {'p_sma': 36, 'p_std': 57, 'p_atr': 17, 'p_adx': 11, 'rsi_period': 36, 'ema1': 18, 'ema2': 56, 'slip_atr_k': 0.003136781270315354, 'slip_spread_k': 0.823015134066573, 'spread_hl_frac': 0.012800208207607758, 'bb_std_mult': 0.6405956448947263, 'rsi_os': 26, 'rsi_ob': 76, 'vol_spike': 0.06035442800027903, 'adx_thresh': 11.330281802111815, 'atr_min_pct': 0.001197020284799545, 'atr_max_pct': 0.14624341375411512, 'tp_mult': 2.1542555876058564, 'tsl_mult': 0.6084201512690159, 'strategy': 'breakout', 'time_stop': 155, 'use_sma': True, 'use_atr': False, 'use_adx': False, 'use_ema': False, 'use_spike': False, 'rsi_required': True, 'edge_k': 0.42039828192119877, 'edge_cap': 0.4340597639591932}.
[I 2025-08-29 16:53:56,953] Trial 68 finished with values: [-1000000000.0, 1000000000.0] and parameters: {'p_sma': 21, 'p_std': 57, 'p_atr': 17, 'p_adx': 17, 'rsi_period': 36, 'ema1': 19, 'ema2': 15, 'slip_atr_k': 0.04300421531185521, 'slip_spread_k': 0.7145907078266518, 'spread_hl_frac': 0.012075940834187766, 'bb_std_mult': 0.6202961471910486, 'rsi_os': 19, 'rsi_ob': 79, 'vol_spike': 0.2282409894726106, 'adx_thresh': 10.868955949711678, 'atr_min_pct': 0.0007668622142674412, 'atr_max_pct': 0.13259625279106854, 'tp_mult': 2.353893241434176, 'tsl_mult': 0.13106686144284396, 'strategy': 'breakout', 'time_stop': 182, 'use_sma': True, 'use_atr': False, 'use_adx': False, 'use_ema': False, 'use_spike': False, 'rsi_required': True, 'edge_k': 1.3267673060067673, 'edge_cap': 0.3502922556507233}.
[I 2025-08-29 16:53:56,971] Trial 66 finished with values: [-1000000000.0, 1000000000.0] and parameters: {'p_sma': 31, 'p_std': 57, 'p_atr': 17, 'p_adx': 15, 'rsi_period': 48, 'ema1': 18, 'ema2': 14, 'slip_atr_k': 0.004049743380242685, 'slip_spread_k': 0.7151967840411362, 'spread_hl_frac': 0.011784976184406448, 'bb_std_mult': 0.7703838249729108, 'rsi_os': 19, 'rsi_ob': 51, 'vol_spike': 0.12178732649179727, 'adx_thresh': 11.272971669464015, 'atr_min_pct': 0.0008359488629222686, 'atr_max_pct': 0.13136035811391455, 'tp_mult': 2.3562996797197657, 'tsl_mult': 0.6388361934220633, 'strategy': 'breakout', 'time_stop': 147, 'use_sma': True, 'use_atr': False, 'use_adx': False, 'use_ema': False, 'use_spike': False, 'rsi_required': True, 'edge_k': 0.5143876669769141, 'edge_cap': 0.42942703208316796}.
[I 2025-08-29 16:53:57,338] Trial 67 finished with values: [-0.01816566525788421, 0.018165766989221194] and parameters: {'p_sma': 22, 'p_std': 57, 'p_atr': 17, 'p_adx': 15, 'rsi_period': 46, 'ema1': 11, 'ema2': 14, 'slip_atr_k': 0.051358154069914425, 'slip_spread_k': 0.7197715728452267, 'spread_hl_frac': 0.012238317576160734, 'bb_std_mult': 1.5692119889067841, 'rsi_os': 38, 'rsi_ob': 79, 'vol_spike': 0.12167616628546173, 'adx_thresh': 11.555783870992567, 'atr_min_pct': 0.0009096153543367214, 'atr_max_pct': 0.018208321939953746, 'tp_mult': 2.14665608794339, 'tsl_mult': 0.10693038212330269, 'strategy': 'breakout', 'time_stop': 178, 'use_sma': True, 'use_atr': False, 'use_adx': False, 'use_ema': False, 'use_spike': False, 'rsi_required': True, 'edge_k': 0.4520594648602648, 'edge_cap': 0.35142866997299405}.
[I 2025-08-29 16:53:58,005] Trial 69 finished with values: [-1000000000.0, 1000000000.0] and parameters: {'p_sma': 40, 'p_std': 57, 'p_atr': 17, 'p_adx': 11, 'rsi_period': 63, 'ema1': 19, 'ema2': 47, 'slip_atr_k': 0.05603699815944853, 'slip_spread_k': 0.37219789454389696, 'spread_hl_frac': 0.012346645675195887, 'bb_std_mult': 0.7693482856845797, 'rsi_os': 18, 'rsi_ob': 79, 'vol_spike': 0.063761825974857, 'adx_thresh': 10.714117494890168, 'atr_min_pct': 0.0008111385580238332, 'atr_max_pct': 0.13121685456842513, 'tp_mult': 2.366245489214931, 'tsl_mult': 0.08970544415944792, 'strategy': 'breakout', 'time_stop': 187, 'use_sma': True, 'use_atr': False, 'use_adx': False, 'use_ema': False, 'use_spike': False, 'rsi_required': True, 'edge_k': 1.502399857187128, 'edge_cap': 0.9199602502237555}.
[I 2025-08-29 16:54:24,707] Trial 70 finished with values: [-1000000000.0, 1000000000.0] and parameters: {'p_sma': 39, 'p_std': 37, 'p_atr': 19, 'p_adx': 11, 'rsi_period': 62, 'ema1': 10, 'ema2': 19, 'slip_atr_k': 0.008701577192761926, 'slip_spread_k': 0.40561892705740243, 'spread_hl_frac': 0.021897073558560978, 'bb_std_mult': 1.2613599607360335, 'rsi_os': 53, 'rsi_ob': 58, 'vol_spike': 0.06257336046305269, 'adx_thresh': 18.71613256550551, 'atr_min_pct': 0.023451966985111032, 'atr_max_pct': 0.06150519340589462, 'tp_mult': 2.459353893314984, 'tsl_mult': 0.7097332268365735, 'strategy': 'breakout', 'time_stop': 116, 'use_sma': True, 'use_atr': False, 'use_adx': False, 'use_ema': False, 'use_spike': False, 'rsi_required': True, 'edge_k': 0.4145988413200902, 'edge_cap': 0.7925137908901645}.
[I 2025-08-29 16:54:25,733] Trial 71 finished with values: [-1000000000.0, 1000000000.0] and parameters: {'p_sma': 40, 'p_std': 37, 'p_atr': 23, 'p_adx': 8, 'rsi_period': 64, 'ema1': 17, 'ema2': 20, 'slip_atr_k': 0.01073053818096591, 'slip_spread_k': 0.366736554451243, 'spread_hl_frac': 0.006528982229584329, 'bb_std_mult': 1.5366028363374322, 'rsi_os': 17, 'rsi_ob': 76, 'vol_spike': 0.05497166063389239, 'adx_thresh': 24.885708547474323, 'atr_min_pct': 0.002862489111181814, 'atr_max_pct': 0.08032136660847695, 'tp_mult': 2.4525460619078663, 'tsl_mult': 0.0788534887917473, 'strategy': 'breakout', 'time_stop': 70, 'use_sma': True, 'use_atr': False, 'use_adx': False, 'use_ema': False, 'use_spike': False, 'rsi_required': True, 'edge_k': 0.42340727184123356, 'edge_cap': 0.924341372256142}.
[I 2025-08-29 16:54:26,299] Trial 72 finished with values: [-1000000000.0, 1000000000.0] and parameters: {'p_sma': 39, 'p_std': 37, 'p_atr': 22, 'p_adx': 11, 'rsi_period': 64, 'ema1': 17, 'ema2': 47, 'slip_atr_k': 0.24766101697722814, 'slip_spread_k': 0.281898033112273, 'spread_hl_frac': 0.005973132255676097, 'bb_std_mult': 1.8908119475284075, 'rsi_os': 17, 'rsi_ob': 93, 'vol_spike': 0.10617668125781006, 'adx_thresh': 14.421986754816459, 'atr_min_pct': 0.023576675651077114, 'atr_max_pct': 0.08008566571292204, 'tp_mult': 2.99689473758914, 'tsl_mult': 0.7515670899448401, 'strategy': 'breakout', 'time_stop': 72, 'use_sma': True, 'use_atr': False, 'use_adx': False, 'use_ema': True, 'use_spike': False, 'rsi_required': True, 'edge_k': 1.5649261670240704, 'edge_cap': 0.6032655035171992}.
[I 2025-08-29 16:54:26,567] Trial 73 finished with values: [-0.016513265853551284, 0.01646745077480317] and parameters: {'p_sma': 33, 'p_std': 37, 'p_atr': 9, 'p_adx': 8, 'rsi_period': 70, 'ema1': 17, 'ema2': 20, 'slip_atr_k': 0.010622868421272288, 'slip_spread_k': 0.2252363317686482, 'spread_hl_frac': 0.022414524684175666, 'bb_std_mult': 1.2343166648457768, 'rsi_os': 53, 'rsi_ob': 76, 'vol_spike': 0.108201370353557, 'adx_thresh': 18.438469136499634, 'atr_min_pct': 0.0026173487982329396, 'atr_max_pct': 0.08192360082165753, 'tp_mult': 2.4348585939377902, 'tsl_mult': 0.5985469321282824, 'strategy': 'breakout', 'time_stop': 119, 'use_sma': True, 'use_atr': False, 'use_adx': False, 'use_ema': True, 'use_spike': True, 'rsi_required': True, 'edge_k': 0.3800887948093707, 'edge_cap': 0.6062919098758621}.
[I 2025-08-29 16:54:55,404] Trial 77 finished with values: [-1000000000.0, 1000000000.0] and parameters: {'p_sma': 30, 'p_std': 13, 'p_atr': 27, 'p_adx': 19, 'rsi_period': 58, 'ema1': 20, 'ema2': 27, 'slip_atr_k': 0.022793825037541914, 'slip_spread_k': 0.5110170633401946, 'spread_hl_frac': 0.008092179039651091, 'bb_std_mult': 0.5832035755997202, 'rsi_os': 43, 'rsi_ob': 62, 'vol_spike': 0.1445165023750593, 'adx_thresh': 32.817491946535924, 'atr_min_pct': 0.026821420920721466, 'atr_max_pct': 0.0447125890964173, 'tp_mult': 1.9793579632665899, 'tsl_mult': 0.17667857068015347, 'strategy': 'breakout', 'time_stop': 141, 'use_sma': True, 'use_atr': True, 'use_adx': True, 'use_ema': False, 'use_spike': True, 'rsi_required': True, 'edge_k': 0.2047844613302484, 'edge_cap': 0.16987706875347047}.
[I 2025-08-29 16:54:55,861] Trial 75 finished with values: [-1000000000.0, 1000000000.0] and parameters: {'p_sma': 43, 'p_std': 33, 'p_atr': 14, 'p_adx': 19, 'rsi_period': 58, 'ema1': 20, 'ema2': 28, 'slip_atr_k': 0.021983531440778477, 'slip_spread_k': 0.2877925890075639, 'spread_hl_frac': 0.031034045110817705, 'bb_std_mult': 1.2991089660549515, 'rsi_os': 23, 'rsi_ob': 92, 'vol_spike': 0.10603320968766976, 'adx_thresh': 14.151360764583686, 'atr_min_pct': 0.026617883318673107, 'atr_max_pct': 0.0759708110370304, 'tp_mult': 2.6296264960681355, 'tsl_mult': 0.7938161907945472, 'strategy': 'breakout', 'time_stop': 139, 'use_sma': True, 'use_atr': False, 'use_adx': True, 'use_ema': True, 'use_spike': True, 'rsi_required': True, 'edge_k': 0.1961706317751227, 'edge_cap': 0.16263947772682852}.
[I 2025-08-29 16:54:56,282] Trial 76 finished with values: [-1000000000.0, 1000000000.0] and parameters: {'p_sma': 33, 'p_std': 33, 'p_atr': 14, 'p_adx': 17, 'rsi_period': 53, 'ema1': 8, 'ema2': 28, 'slip_atr_k': 0.019400417373497306, 'slip_spread_k': 0.21942212689562593, 'spread_hl_frac': 0.03786851442920328, 'bb_std_mult': 2.2004983542549885, 'rsi_os': 43, 'rsi_ob': 88, 'vol_spike': 0.1441282386252815, 'adx_thresh': 8.806363824201842, 'atr_min_pct': 0.028048415942188203, 'atr_max_pct': 0.053161254067549596, 'tp_mult': 2.6198059921861256, 'tsl_mult': 0.7957891789867467, 'strategy': 'breakout', 'time_stop': 138, 'use_sma': True, 'use_atr': False, 'use_adx': True, 'use_ema': True, 'use_spike': True, 'rsi_required': True, 'edge_k': 0.17820161464451678, 'edge_cap': 0.15912340531630806}.
[I 2025-08-29 16:54:56,462] Trial 74 finished with values: [-1000000000.0, 1000000000.0] and parameters: {'p_sma': 30, 'p_std': 33, 'p_atr': 26, 'p_adx': 8, 'rsi_period': 58, 'ema1': 20, 'ema2': 46, 'slip_atr_k': 0.020502174018012572, 'slip_spread_k': 0.27541533777117433, 'spread_hl_frac': 0.005773463882841022, 'bb_std_mult': 1.0889378519807948, 'rsi_os': 23, 'rsi_ob': 76, 'vol_spike': 0.10537729195715272, 'adx_thresh': 14.22544589291311, 'atr_min_pct': 0.0029593411420193155, 'atr_max_pct': 0.04528917884017361, 'tp_mult': 2.9930805368363034, 'tsl_mult': 0.7804100951149922, 'strategy': 'breakout', 'time_stop': 74, 'use_sma': True, 'use_atr': False, 'use_adx': False, 'use_ema': True, 'use_spike': True, 'rsi_required': True, 'edge_k': 0.003883339868897183, 'edge_cap': 0.09014911627886091}.
[I 2025-08-29 16:55:23,967] Trial 81 finished with values: [-1000000000.0, 1000000000.0] and parameters: {'p_sma': 25, 'p_std': 49, 'p_atr': 30, 'p_adx': 25, 'rsi_period': 78, 'ema1': 7, 'ema2': 23, 'slip_atr_k': 0.03671507156198796, 'slip_spread_k': 0.6194278227742092, 'spread_hl_frac': 0.04722824173965459, 'bb_std_mult': 3.5793134778930478, 'rsi_os': 31, 'rsi_ob': 89, 'vol_spike': 0.12806942413268227, 'adx_thresh': 12.084119074657645, 'atr_min_pct': 0.0038258043228684147, 'atr_max_pct': 0.14981816673392062, 'tp_mult': 1.8731120745304024, 'tsl_mult': 0.8645024386099298, 'strategy': 'mean_reversion', 'time_stop': 126, 'use_sma': False, 'use_atr': True, 'use_adx': False, 'use_ema': False, 'use_spike': False, 'rsi_required': True, 'edge_k': 0.2786248706788961, 'edge_cap': 0.2447522408061372}.
[I 2025-08-29 16:55:24,136] Trial 80 finished with values: [-1000000000.0, 1000000000.0] and parameters: {'p_sma': 37, 'p_std': 50, 'p_atr': 19, 'p_adx': 12, 'rsi_period': 51, 'ema1': 15, 'ema2': 24, 'slip_atr_k': 0.20256604761695612, 'slip_spread_k': 0.6249332423606826, 'spread_hl_frac': 0.026306448124157274, 'bb_std_mult': 1.0780260747412431, 'rsi_os': 24, 'rsi_ob': 55, 'vol_spike': 0.12570134023494695, 'adx_thresh': 12.518726152940289, 'atr_min_pct': 0.0037171291147698716, 'atr_max_pct': 0.1486948504728185, 'tp_mult': 1.884620658684595, 'tsl_mult': 0.6741781248815994, 'strategy': 'mean_reversion', 'time_stop': 107, 'use_sma': False, 'use_atr': True, 'use_adx': False, 'use_ema': False, 'use_spike': False, 'rsi_required': True, 'edge_k': 0.9825449232709393, 'edge_cap': 0.08320101915386208}.
[I 2025-08-29 16:55:24,230] Trial 79 finished with values: [-0.00571210080611384, 0.005697484082467512] and parameters: {'p_sma': 36, 'p_std': 49, 'p_atr': 10, 'p_adx': 16, 'rsi_period': 17, 'ema1': 8, 'ema2': 24, 'slip_atr_k': 0.039035532253821184, 'slip_spread_k': 0.6162533933797648, 'spread_hl_frac': 0.00305201300617549, 'bb_std_mult': 1.0668166381710398, 'rsi_os': 27, 'rsi_ob': 88, 'vol_spike': 0.28096766795547795, 'adx_thresh': 8.760860352890694, 'atr_min_pct': 0.001823194864700436, 'atr_max_pct': 0.06663297570854695, 'tp_mult': 2.1773652274738695, 'tsl_mult': 0.35074328887728856, 'strategy': 'mean_reversion', 'time_stop': 93, 'use_sma': True, 'use_atr': True, 'use_adx': False, 'use_ema': False, 'use_spike': False, 'rsi_required': True, 'edge_k': 0.2807757459608564, 'edge_cap': 0.24919672734319281}.
