[I 2025-08-29 17:10:58,364] Trial 219 finished with values: [-1000000000.0, 1000000000.0] and parameters: {'p_sma': 54, 'p_std': 48, 'p_atr': 29, 'p_adx': 10, 'rsi_period': 21, 'ema1': 22, 'ema2': 39, 'slip_atr_k': 0.12275859048272618, 'slip_spread_k': 0.6549404819456952, 'spread_hl_frac': 0.02178045684125541, 'bb_std_mult': 0.8597985337940056, 'rsi_os': 13, 'rsi_ob': 45, 'vol_spike': 0.08220799641965872, 'adx_thresh': 10.015406447932193, 'atr_min_pct': 0.016792018510614265, 'atr_max_pct': 0.058098162663929635, 'tp_mult': 2.760410629073608, 'tsl_mult': 0.805957302190318, 'strategy': 'breakout', 'time_stop': 127, 'use_sma': True, 'use_atr': True, 'use_adx': True, 'use_ema': True, 'use_spike': False, 'rsi_required': True, 'edge_k': 0.48631885362204974, 'edge_cap': 0.19427196077350825}.
[I 2025-08-29 17:10:58,597] Trial 217 finished with values: [-1000000000.0, 1000000000.0] and parameters: {'p_sma': 14, 'p_std': 48, 'p_atr': 11, 'p_adx': 16, 'rsi_period': 72, 'ema1': 15, 'ema2': 39, 'slip_atr_k': 0.15586127579738812, 'slip_spread_k': 0.6164238643086075, 'spread_hl_frac': 0.008737533782737828, 'bb_std_mult': 0.8530931849761416, 'rsi_os': 42, 'rsi_ob': 82, 'vol_spike': 0.28619881277479464, 'adx_thresh': 9.762582501870147, 'atr_min_pct': 0.01109860282896932, 'atr_max_pct': 0.12840754164989762, 'tp_mult': 2.7633802907546103, 'tsl_mult': 0.8454479088286796, 'strategy': 'breakout', 'time_stop': 112, 'use_sma': True, 'use_atr': True, 'use_adx': False, 'use_ema': True, 'use_spike': False, 'rsi_required': True, 'edge_k': 1.750626728967982, 'edge_cap': 0.8569826708395745}.
[I 2025-08-29 17:10:58,756] Trial 218 finished with values: [-0.026113213388628154, 0.02609485277513487] and parameters: {'p_sma': 14, 'p_std': 50, 'p_atr': 23, 'p_adx': 30, 'rsi_period': 21, 'ema1': 15, 'ema2': 50, 'slip_atr_k': 0.15466270051549688, 'slip_spread_k': 0.6202991990319041, 'spread_hl_frac': 0.007946117772393351, 'bb_std_mult': 0.840979019672136, 'rsi_os': 47, 'rsi_ob': 62, 'vol_spike': 0.23046101471513117, 'adx_thresh': 10.05564679714849, 'atr_min_pct': 0.001323611228428219, 'atr_max_pct': 0.03312577663665419, 'tp_mult': 2.765343815055992, 'tsl_mult': 0.7706894272039309, 'strategy': 'breakout', 'time_stop': 128, 'use_sma': True, 'use_atr': True, 'use_adx': True, 'use_ema': True, 'use_spike': False, 'rsi_required': True, 'edge_k': 0.7017680820019314, 'edge_cap': 0.18515130038500563}.
[I 2025-08-29 17:10:58,848] Trial 216 finished with values: [-1000000000.0, 1000000000.0] and parameters: {'p_sma': 58, 'p_std': 48, 'p_atr': 11, 'p_adx': 12, 'rsi_period': 80, 'ema1': 15, 'ema2': 41, 'slip_atr_k': 0.15039811973606412, 'slip_spread_k': 0.6194330371279977, 'spread_hl_frac': 0.021614518718429752, 'bb_std_mult': 0.8490497024639647, 'rsi_os': 14, 'rsi_ob': 81, 'vol_spike': 0.2848533065567405, 'adx_thresh': 10.133961777677795, 'atr_min_pct': 1.180868648719996e-05, 'atr_max_pct': 0.02713311751243714, 'tp_mult': 2.8840538698869946, 'tsl_mult': 0.8455130005743816, 'strategy': 'breakout', 'time_stop': 111, 'use_sma': True, 'use_atr': True, 'use_adx': False, 'use_ema': True, 'use_spike': False, 'rsi_required': True, 'edge_k': 1.7356430867994541, 'edge_cap': 0.7745405452853847}.
[I 2025-08-29 17:11:25,168] Trial 222 finished with values: [-1000000000.0, 1000000000.0] and parameters: {'p_sma': 58, 'p_std': 16, 'p_atr': 7, 'p_adx': 18, 'rsi_period': 25, 'ema1': 26, 'ema2': 28, 'slip_atr_k': 0.058771157656441, 'slip_spread_k': 0.241442340429755, 'spread_hl_frac': 0.0289447478066781, 'bb_std_mult': 0.7123422864367867, 'rsi_os': 13, 'rsi_ob': 52, 'vol_spike': 0.26173138710511656, 'adx_thresh': 10.014405756379654, 'atr_min_pct': 0.02284412338755723, 'atr_max_pct': 0.13348777115310023, 'tp_mult': 2.8743285979033377, 'tsl_mult': 0.8125988848397941, 'strategy': 'breakout', 'time_stop': 67, 'use_sma': True, 'use_atr': False, 'use_adx': False, 'use_ema': False, 'use_spike': False, 'rsi_required': True, 'edge_k': 1.0176997998109083, 'edge_cap': 0.26909294026609937}.
[I 2025-08-29 17:11:25,168] Trial 220 finished with values: [-1000000000.0, 1000000000.0] and parameters: {'p_sma': 14, 'p_std': 16, 'p_atr': 8, 'p_adx': 16, 'rsi_period': 24, 'ema1': 13, 'ema2': 41, 'slip_atr_k': 0.15568920735654845, 'slip_spread_k': 0.6190974131512876, 'spread_hl_frac': 0.029601673723827947, 'bb_std_mult': 0.7045443646298809, 'rsi_os': 29, 'rsi_ob': 82, 'vol_spike': 0.23163394501941076, 'adx_thresh': 10.079030932068848, 'atr_min_pct': 0.011505373417559934, 'atr_max_pct': 0.022988265347531595, 'tp_mult': 2.875116387679255, 'tsl_mult': 0.131467520107225, 'strategy': 'breakout', 'time_stop': 121, 'use_sma': True, 'use_atr': True, 'use_adx': False, 'use_ema': False, 'use_spike': False, 'rsi_required': True, 'edge_k': 1.7185534574502421, 'edge_cap': 0.7774933049324391}.
[I 2025-08-29 17:11:25,184] Trial 221 finished with values: [-1000000000.0, 1000000000.0] and parameters: {'p_sma': 58, 'p_std': 47, 'p_atr': 23, 'p_adx': 19, 'rsi_period': 22, 'ema1': 13, 'ema2': 47, 'slip_atr_k': 0.17446676166881553, 'slip_spread_k': 0.19045614015746132, 'spread_hl_frac': 0.03618063255036132, 'bb_std_mult': 0.7085855550435661, 'rsi_os': 13, 'rsi_ob': 59, 'vol_spike': 0.2599509463687867, 'adx_thresh': 10.354172217725514, 'atr_min_pct': 0.0057265945156724975, 'atr_max_pct': 0.03207659910841289, 'tp_mult': 2.8647059933720227, 'tsl_mult': 0.9923555768056829, 'strategy': 'breakout', 'time_stop': 46, 'use_sma': True, 'use_atr': False, 'use_adx': False, 'use_ema': False, 'use_spike': False, 'rsi_required': True, 'edge_k': 0.4255668340524459, 'edge_cap': 0.27984301124311023}.
[I 2025-08-29 17:11:25,363] Trial 223 finished with values: [-1000000000.0, 1000000000.0] and parameters: {'p_sma': 12, 'p_std': 47, 'p_atr': 25, 'p_adx': 21, 'rsi_period': 24, 'ema1': 13, 'ema2': 27, 'slip_atr_k': 0.09768805685287074, 'slip_spread_k': 0.6465682565217232, 'spread_hl_frac': 0.005106966829367342, 'bb_std_mult': 2.959133093674042, 'rsi_os': 17, 'rsi_ob': 52, 'vol_spike': 0.2608785463689438, 'adx_thresh': 10.80361010573403, 'atr_min_pct': 0.012648478182458168, 'atr_max_pct': 0.13965085740782843, 'tp_mult': 1.4957681197123063, 'tsl_mult': 0.8186253567883769, 'strategy': 'breakout', 'time_stop': 121, 'use_sma': True, 'use_atr': False, 'use_adx': False, 'use_ema': False, 'use_spike': False, 'rsi_required': True, 'edge_k': 1.8304622551505374, 'edge_cap': 0.2748928957970114}.
[I 2025-08-29 17:11:52,378] Trial 225 finished with values: [-0.012301036355196415, 0.01241374109467307] and parameters: {'p_sma': 44, 'p_std': 11, 'p_atr': 18, 'p_adx': 11, 'rsi_period': 19, 'ema1': 7, 'ema2': 27, 'slip_atr_k': 0.04555253718434378, 'slip_spread_k': 0.5334276811621491, 'spread_hl_frac': 0.002685963716095005, 'bb_std_mult': 2.942221968265551, 'rsi_os': 17, 'rsi_ob': 91, 'vol_spike': 0.24867518399883576, 'adx_thresh': 11.011452285063093, 'atr_min_pct': 0.0006403440767493662, 'atr_max_pct': 0.13335659091500132, 'tp_mult': 2.2831815288165282, 'tsl_mult': 0.5842818965246644, 'strategy': 'breakout', 'time_stop': 219, 'use_sma': True, 'use_atr': False, 'use_adx': True, 'use_ema': False, 'use_spike': True, 'rsi_required': True, 'edge_k': 0.8876910294458683, 'edge_cap': 0.21725375463357222}.
[I 2025-08-29 17:11:52,624] Trial 226 finished with values: [-1000000000.0, 1000000000.0] and parameters: {'p_sma': 10, 'p_std': 11, 'p_atr': 18, 'p_adx': 25, 'rsi_period': 74, 'ema1': 7, 'ema2': 54, 'slip_atr_k': 0.049322284461838006, 'slip_spread_k': 0.26735388684899064, 'spread_hl_frac': 0.013237271198277428, 'bb_std_mult': 2.964445862405083, 'rsi_os': 16, 'rsi_ob': 91, 'vol_spike': 0.14964647271038042, 'adx_thresh': 30.74036766018788, 'atr_min_pct': 0.0005676460530447822, 'atr_max_pct': 0.13952433193650685, 'tp_mult': 2.8074450246966896, 'tsl_mult': 0.5781199308324682, 'strategy': 'breakout', 'time_stop': 134, 'use_sma': True, 'use_atr': False, 'use_adx': True, 'use_ema': False, 'use_spike': True, 'rsi_required': True, 'edge_k': 1.8397665080480705, 'edge_cap': 0.21646011951039934}.
[I 2025-08-29 17:11:52,843] Trial 224 finished with values: [-1000000000.0, 1000000000.0] and parameters: {'p_sma': 41, 'p_std': 46, 'p_atr': 25, 'p_adx': 22, 'rsi_period': 68, 'ema1': 7, 'ema2': 33, 'slip_atr_k': 0.14466714046862672, 'slip_spread_k': 0.6454142491678292, 'spread_hl_frac': 0.005502288959970111, 'bb_std_mult': 3.023320649277749, 'rsi_os': 16, 'rsi_ob': 91, 'vol_spike': 0.004896733838816253, 'adx_thresh': 30.675926007921603, 'atr_min_pct': 0.000620741253281547, 'atr_max_pct': 0.037931879916424445, 'tp_mult': 1.8408195047416198, 'tsl_mult': 0.8232532419382833, 'strategy': 'breakout', 'time_stop': 219, 'use_sma': True, 'use_atr': False, 'use_adx': True, 'use_ema': False, 'use_spike': True, 'rsi_required': True, 'edge_k': 1.8401928780086378, 'edge_cap': 0.2249444233487531}.
[I 2025-08-29 17:11:52,858] Trial 227 finished with values: [-1000000000.0, 1000000000.0] and parameters: {'p_sma': 52, 'p_std': 11, 'p_atr': 19, 'p_adx': 24, 'rsi_period': 75, 'ema1': 7, 'ema2': 36, 'slip_atr_k': 0.08659291850976691, 'slip_spread_k': 0.5318899909805943, 'spread_hl_frac': 0.0026353558088899696, 'bb_std_mult': 0.6062035348977255, 'rsi_os': 39, 'rsi_ob': 92, 'vol_spike': 0.14792944206115427, 'adx_thresh': 10.884890396530743, 'atr_min_pct': 0.02005807856140026, 'atr_max_pct': 0.13358852747770467, 'tp_mult': 1.844209018504468, 'tsl_mult': 0.8967893333981213, 'strategy': 'breakout', 'time_stop': 120, 'use_sma': True, 'use_atr': False, 'use_adx': True, 'use_ema': False, 'use_spike': True, 'rsi_required': True, 'edge_k': 0.8835147851357378, 'edge_cap': 0.21359274941657158}.
[I 2025-08-29 17:11:53,034] Trial 230 finished with values: [-1000000000.0, 1000000000.0] and parameters: {'p_sma': 16, 'p_std': 19, 'p_atr': 26, 'p_adx': 11, 'rsi_period': 27, 'ema1': 11, 'ema2': 48, 'slip_atr_k': 0.08481188092708788, 'slip_spread_k': 0.5816948895317832, 'spread_hl_frac': 0.049915612054142654, 'bb_std_mult': 1.4088063632070091, 'rsi_os': 52, 'rsi_ob': 92, 'vol_spike': 0.05075328058265585, 'adx_thresh': 21.28689154032851, 'atr_min_pct': 0.02031789426279404, 'atr_max_pct': 0.010145315843497427, 'tp_mult': 2.9555106162518667, 'tsl_mult': 0.22884988672978807, 'strategy': 'mean_reversion', 'time_stop': 119, 'use_sma': False, 'use_atr': False, 'use_adx': False, 'use_ema': False, 'use_spike': False, 'rsi_required': False, 'edge_k': 1.7870713889817091, 'edge_cap': 0.2368533618719724}.
[I 2025-08-29 17:12:19,600] Trial 229 finished with values: [-1000000000.0, 1000000000.0] and parameters: {'p_sma': 16, 'p_std': 7, 'p_atr': 28, 'p_adx': 11, 'rsi_period': 22, 'ema1': 11, 'ema2': 35, 'slip_atr_k': 0.14308404374765052, 'slip_spread_k': 0.8565604425798696, 'spread_hl_frac': 0.0009294368117998531, 'bb_std_mult': 0.601486228461006, 'rsi_os': 15, 'rsi_ob': 92, 'vol_spike': 0.052821879459994475, 'adx_thresh': 27.81453578764814, 'atr_min_pct': 0.02903561609376573, 'atr_max_pct': 0.06124202351053418, 'tp_mult': 1.7214009444860099, 'tsl_mult': 0.83096552808893, 'strategy': 'mean_reversion', 'time_stop': 210, 'use_sma': False, 'use_atr': False, 'use_adx': False, 'use_ema': False, 'use_spike': False, 'rsi_required': False, 'edge_k': 1.7514116501838821, 'edge_cap': 0.6588265780082504}.
[I 2025-08-29 17:12:19,983] Trial 228 finished with values: [-1000000000.0, 1000000000.0] and parameters: {'p_sma': 51, 'p_std': 46, 'p_atr': 19, 'p_adx': 25, 'rsi_period': 22, 'ema1': 11, 'ema2': 33, 'slip_atr_k': 0.14308139325699146, 'slip_spread_k': 0.046801053348995425, 'spread_hl_frac': 0.012921227818164963, 'bb_std_mult': 1.4474129913366673, 'rsi_os': 39, 'rsi_ob': 92, 'vol_spike': 0.15037466120270535, 'adx_thresh': 18.41267418468904, 'atr_min_pct': 0.01980484336494121, 'atr_max_pct': 0.1420701870779254, 'tp_mult': 2.8162675774331345, 'tsl_mult': 0.8264682792601936, 'strategy': 'breakout', 'time_stop': 168, 'use_sma': False, 'use_atr': False, 'use_adx': False, 'use_ema': False, 'use_spike': False, 'rsi_required': False, 'edge_k': 1.781477916123007, 'edge_cap': 0.23720874072848644}.
[I 2025-08-29 17:12:20,006] Trial 231 finished with values: [-1000000000.0, 1000000000.0] and parameters: {'p_sma': 17, 'p_std': 26, 'p_atr': 13, 'p_adx': 26, 'rsi_period': 22, 'ema1': 11, 'ema2': 48, 'slip_atr_k': 0.13654075340276164, 'slip_spread_k': 0.02081929001836136, 'spread_hl_frac': 0.01398187785396051, 'bb_std_mult': 1.7778221108636938, 'rsi_os': 14, 'rsi_ob': 92, 'vol_spike': 0.16970308593002784, 'adx_thresh': 18.22420709346796, 'atr_min_pct': 0.004126615287096616, 'atr_max_pct': 0.062383071278908186, 'tp_mult': 1.7049500261675783, 'tsl_mult': 0.794639045370963, 'strategy': 'mean_reversion', 'time_stop': 293, 'use_sma': False, 'use_atr': False, 'use_adx': False, 'use_ema': False, 'use_spike': False, 'rsi_required': False, 'edge_k': 1.7830326931265525, 'edge_cap': 0.24418904461963198}.
[I 2025-08-29 17:12:20,159] Trial 232 finished with values: [-1000000000.0, 1000000000.0] and parameters: {'p_sma': 12, 'p_std': 7, 'p_atr': 22, 'p_adx': 10, 'rsi_period': 62, 'ema1': 12, 'ema2': 43, 'slip_atr_k': 0.0698463455129191, 'slip_spread_k': 0.6819466737463203, 'spread_hl_frac': 0.011291773762637337, 'bb_std_mult': 3.159013447161348, 'rsi_os': 55, 'rsi_ob': 93, 'vol_spike': 0.21169692645237498, 'adx_thresh': 22.759234021540994, 'atr_min_pct': 0.028520433519312445, 'atr_max_pct': 0.14377213789938637, 'tp_mult': 2.807281647424879, 'tsl_mult': 0.854847788501874, 'strategy': 'breakout', 'time_stop': 290, 'use_sma': False, 'use_atr': False, 'use_adx': False, 'use_ema': False, 'use_spike': False, 'rsi_required': False, 'edge_k': 1.2350167530317404, 'edge_cap': 0.15528132878760642}.
[I 2025-08-29 17:12:46,237] Trial 233 finished with values: [-0.0045399080514756385, 0.004538146457940543] and parameters: {'p_sma': 12, 'p_std': 26, 'p_atr': 19, 'p_adx': 10, 'rsi_period': 20, 'ema1': 12, 'ema2': 44, 'slip_atr_k': 0.06696063235975247, 'slip_spread_k': 0.20690053689410126, 'spread_hl_frac': 0.007527005488627102, 'bb_std_mult': 3.519897632751343, 'rsi_os': 12, 'rsi_ob': 77, 'vol_spike': 0.27911369817614906, 'adx_thresh': 18.259128313629187, 'atr_min_pct': 0.001472980706072501, 'atr_max_pct': 0.13653173181841008, 'tp_mult': 2.8215498031242157, 'tsl_mult': 0.7981454818841378, 'strategy': 'breakout', 'time_stop': 108, 'use_sma': True, 'use_atr': False, 'use_adx': False, 'use_ema': False, 'use_spike': False, 'rsi_required': True, 'edge_k': 0.3027150425627262, 'edge_cap': 0.17460246669338642}.
[I 2025-08-29 17:12:46,634] Trial 235 finished with values: [-1000000000.0, 1000000000.0] and parameters: {'p_sma': 7, 'p_std': 45, 'p_atr': 22, 'p_adx': 10, 'rsi_period': 62, 'ema1': 12, 'ema2': 21, 'slip_atr_k': 0.13844334502827704, 'slip_spread_k': 0.36190120896068156, 'spread_hl_frac': 0.007565645077236142, 'bb_std_mult': 0.6701532312396524, 'rsi_os': 12, 'rsi_ob': 93, 'vol_spike': 0.21165486636882097, 'adx_thresh': 11.53501496648039, 'atr_min_pct': 0.0015693451637928608, 'atr_max_pct': 0.1359742899949844, 'tp_mult': 2.0404633041475426, 'tsl_mult': 0.8471465391494861, 'strategy': 'breakout', 'time_stop': 109, 'use_sma': True, 'use_atr': False, 'use_adx': False, 'use_ema': False, 'use_spike': False, 'rsi_required': True, 'edge_k': 1.9025258767017685, 'edge_cap': 0.19200152344717408}.
[I 2025-08-29 17:12:46,778] Trial 234 finished with values: [-1000000000.0, 1000000000.0] and parameters: {'p_sma': 7, 'p_std': 56, 'p_atr': 22, 'p_adx': 10, 'rsi_period': 20, 'ema1': 12, 'ema2': 52, 'slip_atr_k': 0.1364197598548505, 'slip_spread_k': 0.5995091515104253, 'spread_hl_frac': 0.009402344277131259, 'bb_std_mult': 3.2680803048411455, 'rsi_os': 14, 'rsi_ob': 93, 'vol_spike': 0.15824393163691505, 'adx_thresh': 11.50211350697645, 'atr_min_pct': 0.010276491575998636, 'atr_max_pct': 0.04218692556609746, 'tp_mult': 2.9331457335913647, 'tsl_mult': 0.7949852903392612, 'strategy': 'breakout', 'time_stop': 108, 'use_sma': True, 'use_atr': False, 'use_adx': False, 'use_ema': False, 'use_spike': False, 'rsi_required': True, 'edge_k': 1.6996001946620158, 'edge_cap': 0.19507907127513416}.
[I 2025-08-29 17:12:47,043] Trial 236 finished with values: [-1000000000.0, 1000000000.0] and parameters: {'p_sma': 7, 'p_std': 45, 'p_atr': 22, 'p_adx': 11, 'rsi_period': 19, 'ema1': 12, 'ema2': 22, 'slip_atr_k': 0.13860928621147364, 'slip_spread_k': 0.5967401102074924, 'spread_hl_frac': 0.003975268340826919, 'bb_std_mult': 3.224449088342551, 'rsi_os': 11, 'rsi_ob': 77, 'vol_spike': 0.28048176565579774, 'adx_thresh': 11.55457690732944, 'atr_min_pct': 0.0015682988013832934, 'atr_max_pct': 0.04687219365449314, 'tp_mult': 2.0474221471164555, 'tsl_mult': 0.8612126605259023, 'strategy': 'breakout', 'time_stop': 98, 'use_sma': True, 'use_atr': True, 'use_adx': False, 'use_ema': True, 'use_spike': False, 'rsi_required': True, 'edge_k': 0.6362885773214237, 'edge_cap': 0.19388200700065972}.
[I 2025-08-29 17:13:14,938] Trial 239 finished with values: [-1000000000.0, 1000000000.0] and parameters: {'p_sma': 10, 'p_std': 32, 'p_atr': 17, 'p_adx': 9, 'rsi_period': 18, 'ema1': 10, 'ema2': 47, 'slip_atr_k': 0.07797385185023989, 'slip_spread_k': 0.13294050645985603, 'spread_hl_frac': 0.008441012628331081, 'bb_std_mult': 3.3876265821020386, 'rsi_os': 10, 'rsi_ob': 76, 'vol_spike': 0.27698550590783083, 'adx_thresh': 17.185130777559298, 'atr_min_pct': 0.002772046116333195, 'atr_max_pct': 0.147801077411671, 'tp_mult': 2.7324632196195533, 'tsl_mult': 0.6526776417425447, 'strategy': 'breakout', 'time_stop': 98, 'use_sma': True, 'use_atr': True, 'use_adx': False, 'use_ema': True, 'use_spike': False, 'rsi_required': True, 'edge_k': 0.31419160096648924, 'edge_cap': 0.1513417780881278}.
[I 2025-08-29 17:13:15,175] Trial 237 finished with values: [-1000000000.0, 1000000000.0] and parameters: {'p_sma': 10, 'p_std': 27, 'p_atr': 17, 'p_adx': 9, 'rsi_period': 18, 'ema1': 21, 'ema2': 44, 'slip_atr_k': 0.06368757978984287, 'slip_spread_k': 0.22158685352392873, 'spread_hl_frac': 0.009456794620292884, 'bb_std_mult': 3.4718474186534936, 'rsi_os': 10, 'rsi_ob': 77, 'vol_spike': 0.2775193570300866, 'adx_thresh': 17.168656666454204, 'atr_min_pct': 0.003157786624965315, 'atr_max_pct': 0.14616925640893583, 'tp_mult': 2.721944486086275, 'tsl_mult': 0.704446509545588, 'strategy': 'breakout', 'time_stop': 96, 'use_sma': True, 'use_atr': True, 'use_adx': False, 'use_ema': True, 'use_spike': False, 'rsi_required': True, 'edge_k': 0.37330407258109427, 'edge_cap': 0.13603858078692}.
[I 2025-08-29 17:13:15,203] Trial 238 finished with values: [-1000000000.0, 1000000000.0] and parameters: {'p_sma': 10, 'p_std': 32, 'p_atr': 18, 'p_adx': 9, 'rsi_period': 19, 'ema1': 23, 'ema2': 44, 'slip_atr_k': 0.0751594682837854, 'slip_spread_k': 0.13192814119149696, 'spread_hl_frac': 0.008142914520529154, 'bb_std_mult': 3.2762594276045887, 'rsi_os': 10, 'rsi_ob': 77, 'vol_spike': 0.27642803256877996, 'adx_thresh': 17.387657041506944, 'atr_min_pct': 0.0025760227797915576, 'atr_max_pct': 0.14486143237792312, 'tp_mult': 2.7645001007219854, 'tsl_mult': 0.7341794088120606, 'strategy': 'breakout', 'time_stop': 91, 'use_sma': True, 'use_atr': True, 'use_adx': False, 'use_ema': True, 'use_spike': False, 'rsi_required': True, 'edge_k': 0.30151705316790434, 'edge_cap': 0.1469465236771335}.
[I 2025-08-29 17:13:15,378] Trial 240 finished with values: [-1000000000.0, 1000000000.0] and parameters: {'p_sma': 10, 'p_std': 23, 'p_atr': 18, 'p_adx': 9, 'rsi_period': 18, 'ema1': 23, 'ema2': 44, 'slip_atr_k': 0.06490440735602007, 'slip_spread_k': 0.21139718349670783, 'spread_hl_frac': 0.009109595539141587, 'bb_std_mult': 3.4652063797076695, 'rsi_os': 10, 'rsi_ob': 73, 'vol_spike': 0.2762366553825395, 'adx_thresh': 17.507132076511432, 'atr_min_pct': 0.0028802023736128717, 'atr_max_pct': 0.14587014869723536, 'tp_mult': 2.7316548398944067, 'tsl_mult': 0.7283406133615888, 'strategy': 'breakout', 'time_stop': 88, 'use_sma': True, 'use_atr': True, 'use_adx': False, 'use_ema': True, 'use_spike': False, 'rsi_required': True, 'edge_k': 0.3253702882251301, 'edge_cap': 0.14524844511084262}.
[I 2025-08-29 17:13:41,868] Trial 241 finished with values: [-1000000000.0, 1000000000.0] and parameters: {'p_sma': 11, 'p_std': 23, 'p_atr': 18, 'p_adx': 9, 'rsi_period': 20, 'ema1': 21, 'ema2': 44, 'slip_atr_k': 0.06770873758375107, 'slip_spread_k': 0.16837854678963343, 'spread_hl_frac': 0.007027005883029269, 'bb_std_mult': 3.513639088315121, 'rsi_os': 9, 'rsi_ob': 72, 'vol_spike': 0.2738478391495218, 'adx_thresh': 19.009553271048865, 'atr_min_pct': 0.0032668594004412817, 'atr_max_pct': 0.14418921769574544, 'tp_mult': 2.7746895940268255, 'tsl_mult': 0.7241997570367222, 'strategy': 'breakout', 'time_stop': 89, 'use_sma': True, 'use_atr': False, 'use_adx': False, 'use_ema': False, 'use_spike': False, 'rsi_required': True, 'edge_k': 0.36288427552975316, 'edge_cap': 0.13065027395327367}.
[I 2025-08-29 17:13:42,357] Trial 244 finished with values: [-0.007371734130589336, 0.007350986811894504] and parameters: {'p_sma': 25, 'p_std': 25, 'p_atr': 19, 'p_adx': 9, 'rsi_period': 20, 'ema1': 12, 'ema2': 46, 'slip_atr_k': 0.03962658856517845, 'slip_spread_k': 0.09822402108977452, 'spread_hl_frac': 0.006704811874746696, 'bb_std_mult': 3.068822027716577, 'rsi_os': 11, 'rsi_ob': 80, 'vol_spike': 0.2721792979750446, 'adx_thresh': 19.23606733364101, 'atr_min_pct': 0.0018184312861172559, 'atr_max_pct': 0.14263000089867514, 'tp_mult': 2.785146219095862, 'tsl_mult': 0.6158504644787952, 'strategy': 'mean_reversion', 'time_stop': 103, 'use_sma': True, 'use_atr': False, 'use_adx': True, 'use_ema': False, 'use_spike': True, 'rsi_required': True, 'edge_k': 0.24798753745726132, 'edge_cap': 0.16860324295636395}.
