2025-08-29 16:46:13,565 WARNING: DATA SANITY: Extreme jumps >20*ATR200: 42
[I 2025-08-29 16:46:13,575] A new study created in memory with name: no-name-27a115df-8736-47a0-8f41-4613aa649fab
[I 2025-08-29 16:46:42,732] Trial 0 finished with values: [-1000000000.0, 1000000000.0] and parameters: {'p_sma': 23, 'p_std': 47, 'p_atr': 14, 'p_adx': 27, 'rsi_period': 40, 'ema1': 6, 'ema2': 16, 'slip_atr_k': 0.03797441362498272, 'slip_spread_k': 0.36085043448809817, 'spread_hl_frac': 0.022620259290847294, 'bb_std_mult': 0.5376873860725195, 'rsi_os': 13, 'rsi_ob': 69, 'vol_spike': 0.04357442652375617, 'adx_thresh': 8.529048826689916, 'atr_min_pct': 0.00644304190364546, 'atr_max_pct': 0.1436829957554314, 'tp_mult': 2.3828135183036316, 'tsl_mult': 0.7366471158337905, 'strategy': 'mean_reversion', 'time_stop': 22, 'use_sma': False, 'use_atr': False, 'use_adx': True, 'use_ema': True, 'use_spike': False, 'rsi_required': True, 'edge_k': 0.16366748362758687, 'edge_cap': 0.5085420292834235}.
[I 2025-08-29 16:46:43,612] Trial 1 finished with values: [-1000000000.0, 1000000000.0] and parameters: {'p_sma': 18, 'p_std': 30, 'p_atr': 30, 'p_adx': 10, 'rsi_period': 19, 'ema1': 9, 'ema2': 40, 'slip_atr_k': 0.07016434470190777, 'slip_spread_k': 0.8224712532761403, 'spread_hl_frac': 0.03942282490124206, 'bb_std_mult': 0.8846857664007467, 'rsi_os': 33, 'rsi_ob': 50, 'vol_spike': 0.04794180045775663, 'adx_thresh': 28.59944420557865, 'atr_min_pct': 0.0250504765913752, 'atr_max_pct': 0.05487404569770933, 'tp_mult': 1.9595704475783797, 'tsl_mult': 0.3128617166386518, 'strategy': 'breakout', 'time_stop': 271, 'use_sma': False, 'use_atr': True, 'use_adx': False, 'use_ema': True, 'use_spike': True, 'rsi_required': True, 'edge_k': 0.9795162003303923, 'edge_cap': 0.8289439145946348}.
[I 2025-08-29 16:46:43,632] Trial 5 finished with values: [-1000000000.0, 1000000000.0] and parameters: {'p_sma': 12, 'p_std': 10, 'p_atr': 25, 'p_adx': 20, 'rsi_period': 66, 'ema1': 12, 'ema2': 58, 'slip_atr_k': 0.10022233154409063, 'slip_spread_k': 0.6739765888463279, 'spread_hl_frac': 0.002707465628870665, 'bb_std_mult': 3.4401346546556533, 'rsi_os': 54, 'rsi_ob': 49, 'vol_spike': 0.26143321825252747, 'adx_thresh': 30.630698611684792, 'atr_min_pct': 0.016353256466493542, 'atr_max_pct': 0.07040769393355117, 'tp_mult': 1.18287028846668, 'tsl_mult': 0.04524445626736129, 'strategy': 'mean_reversion', 'time_stop': 17, 'use_sma': False, 'use_atr': True, 'use_adx': True, 'use_ema': True, 'use_spike': True, 'rsi_required': True, 'edge_k': 0.9816104843015439, 'edge_cap': 0.9977924196304125}.
[I 2025-08-29 16:46:44,044] Trial 2 finished with values: [-1000000000.0, 1000000000.0] and parameters: {'p_sma': 37, 'p_std': 9, 'p_atr': 14, 'p_adx': 27, 'rsi_period': 8, 'ema1': 20, 'ema2': 49, 'slip_atr_k': 0.15454061123953178, 'slip_spread_k': 0.49665798777014625, 'spread_hl_frac': 0.002944219720734337, 'bb_std_mult': 2.068771301855455, 'rsi_os': 30, 'rsi_ob': 86, 'vol_spike': 0.020360007612828922, 'adx_thresh': 7.313133717987281, 'atr_min_pct': 0.011449485600184701, 'atr_max_pct': 0.0750810578935333, 'tp_mult': 2.219064803930393, 'tsl_mult': 0.6612504412240772, 'strategy': 'mean_reversion', 'time_stop': 199, 'use_sma': False, 'use_atr': True, 'use_adx': True, 'use_ema': True, 'use_spike': True, 'rsi_required': False, 'edge_k': 1.2592448167906765, 'edge_cap': 0.1655220863282998}.
[I 2025-08-29 16:46:44,225] Trial 3 finished with values: [-1000000000.0, 1000000000.0] and parameters: {'p_sma': 10, 'p_std': 58, 'p_atr': 23, 'p_adx': 8, 'rsi_period': 84, 'ema1': 26, 'ema2': 34, 'slip_atr_k': 0.08986808615429667, 'slip_spread_k': 0.31363296102932947, 'spread_hl_frac': 0.021195513518921367, 'bb_std_mult': 3.425448251331674, 'rsi_os': 31, 'rsi_ob': 94, 'vol_spike': 0.11221386355631714, 'adx_thresh': 24.44726374417989, 'atr_min_pct': 0.00780071848677759, 'atr_max_pct': 0.0581304284818982, 'tp_mult': 2.1921057055302655, 'tsl_mult': 0.20348337119120086, 'strategy': 'mean_reversion', 'time_stop': 203, 'use_sma': False, 'use_atr': True, 'use_adx': False, 'use_ema': True, 'use_spike': True, 'rsi_required': False, 'edge_k': 1.8879340714552775, 'edge_cap': 0.662190001160089}.
[I 2025-08-29 16:47:10,102] Trial 4 finished with values: [-1000000000.0, 1000000000.0] and parameters: {'p_sma': 32, 'p_std': 10, 'p_atr': 14, 'p_adx': 30, 'rsi_period': 45, 'ema1': 22, 'ema2': 11, 'slip_atr_k': 0.19570519633970915, 'slip_spread_k': 0.419586133188107, 'spread_hl_frac': 0.0203713087992165, 'bb_std_mult': 0.5123363443655857, 'rsi_os': 43, 'rsi_ob': 58, 'vol_spike': 0.17661008633007777, 'adx_thresh': 20.61640077598217, 'atr_min_pct': 0.010055988766067024, 'atr_max_pct': 0.02449891266453184, 'tp_mult': 2.7002458788458257, 'tsl_mult': 0.2999152627751954, 'strategy': 'mean_reversion', 'time_stop': 16, 'use_sma': False, 'use_atr': True, 'use_adx': True, 'use_ema': False, 'use_spike': False, 'rsi_required': False, 'edge_k': 1.0163137337389119, 'edge_cap': 0.2316770931798493}.
[I 2025-08-29 16:47:11,883] Trial 8 finished with values: [-1000000000.0, 1000000000.0] and parameters: {'p_sma': 55, 'p_std': 39, 'p_atr': 9, 'p_adx': 19, 'rsi_period': 31, 'ema1': 6, 'ema2': 48, 'slip_atr_k': 0.16237754271189853, 'slip_spread_k': 0.2699831402299788, 'spread_hl_frac': 0.009061388870669656, 'bb_std_mult': 1.6683815398401136, 'rsi_os': 17, 'rsi_ob': 85, 'vol_spike': 0.007506218421488541, 'adx_thresh': 23.340218270497896, 'atr_min_pct': 0.01306956933777512, 'atr_max_pct': 0.08729569420717039, 'tp_mult': 1.0736044933828344, 'tsl_mult': 0.11693289162631249, 'strategy': 'mean_reversion', 'time_stop': 112, 'use_sma': False, 'use_atr': True, 'use_adx': True, 'use_ema': False, 'use_spike': False, 'rsi_required': True, 'edge_k': 1.9062404758826823, 'edge_cap': 0.7421333978082746}.
[I 2025-08-29 16:47:11,935] Trial 10 finished with values: [-1000000000.0, 1000000000.0] and parameters: {'p_sma': 51, 'p_std': 38, 'p_atr': 29, 'p_adx': 8, 'rsi_period': 21, 'ema1': 30, 'ema2': 18, 'slip_atr_k': 0.17546829688093557, 'slip_spread_k': 0.5485403228101935, 'spread_hl_frac': 0.04371383143105942, 'bb_std_mult': 2.85091757674321, 'rsi_os': 55, 'rsi_ob': 90, 'vol_spike': 0.25828047739053733, 'adx_thresh': 30.92936052376787, 'atr_min_pct': 0.025850639994877817, 'atr_max_pct': 0.013163589783857378, 'tp_mult': 1.6822780350045679, 'tsl_mult': 0.501142752218819, 'strategy': 'mean_reversion', 'time_stop': 15, 'use_sma': False, 'use_atr': True, 'use_adx': False, 'use_ema': False, 'use_spike': True, 'rsi_required': True, 'edge_k': 1.9998618574473563, 'edge_cap': 0.9438955810800612}.
[I 2025-08-29 16:47:12,785] Trial 7 finished with values: [-1000000000.0, 1000000000.0] and parameters: {'p_sma': 51, 'p_std': 55, 'p_atr': 30, 'p_adx': 10, 'rsi_period': 33, 'ema1': 12, 'ema2': 36, 'slip_atr_k': 0.2060853376437718, 'slip_spread_k': 0.40573137272561943, 'spread_hl_frac': 0.035580364303671244, 'bb_std_mult': 0.647645916464209, 'rsi_os': 27, 'rsi_ob': 81, 'vol_spike': 0.2085945730761474, 'adx_thresh': 23.251136084154805, 'atr_min_pct': 0.013721528979521893, 'atr_max_pct': 0.11474915805592069, 'tp_mult': 2.693100046597684, 'tsl_mult': 0.8938911968860737, 'strategy': 'breakout', 'time_stop': 281, 'use_sma': False, 'use_atr': True, 'use_adx': True, 'use_ema': True, 'use_spike': False, 'rsi_required': True, 'edge_k': 1.6626661767892463, 'edge_cap': 0.9591549012321352}.
[I 2025-08-29 16:47:12,900] Trial 6 finished with values: [-1000000000.0, 1000000000.0] and parameters: {'p_sma': 18, 'p_std': 41, 'p_atr': 7, 'p_adx': 15, 'rsi_period': 76, 'ema1': 29, 'ema2': 30, 'slip_atr_k': 0.20979786119931165, 'slip_spread_k': 0.8975751986023253, 'spread_hl_frac': 0.03226786424590022, 'bb_std_mult': 1.0465529652587167, 'rsi_os': 20, 'rsi_ob': 85, 'vol_spike': 0.29927962303034655, 'adx_thresh': 14.088237823982885, 'atr_min_pct': 0.02047403307568361, 'atr_max_pct': 0.13687704238523526, 'tp_mult': 2.637361241150636, 'tsl_mult': 0.16717298400173597, 'strategy': 'breakout', 'time_stop': 17, 'use_sma': False, 'use_atr': False, 'use_adx': False, 'use_ema': True, 'use_spike': True, 'rsi_required': True, 'edge_k': 0.21820752428733758, 'edge_cap': 0.7935021269278644}.
[I 2025-08-29 16:47:38,138] Trial 9 finished with values: [-1000000000.0, 1000000000.0] and parameters: {'p_sma': 45, 'p_std': 39, 'p_atr': 8, 'p_adx': 19, 'rsi_period': 56, 'ema1': 15, 'ema2': 38, 'slip_atr_k': 0.21146911304033883, 'slip_spread_k': 0.30911134343312263, 'spread_hl_frac': 0.021550338937954994, 'bb_std_mult': 1.9718820821030685, 'rsi_os': 19, 'rsi_ob': 89, 'vol_spike': 0.039255476869344386, 'adx_thresh': 5.0752314703710155, 'atr_min_pct': 0.012599445470146714, 'atr_max_pct': 0.05855452181675208, 'tp_mult': 2.404427750460792, 'tsl_mult': 0.38700292011560045, 'strategy': 'mean_reversion', 'time_stop': 16, 'use_sma': True, 'use_atr': False, 'use_adx': False, 'use_ema': False, 'use_spike': True, 'rsi_required': False, 'edge_k': 1.990833311437077, 'edge_cap': 0.1696022773967215}.
[I 2025-08-29 16:47:40,298] Trial 11 finished with values: [-1000000000.0, 1000000000.0] and parameters: {'p_sma': 12, 'p_std': 10, 'p_atr': 22, 'p_adx': 25, 'rsi_period': 68, 'ema1': 23, 'ema2': 21, 'slip_atr_k': 0.17471366951183437, 'slip_spread_k': 0.07755026410169785, 'spread_hl_frac': 0.02768013382712399, 'bb_std_mult': 0.6010831542326054, 'rsi_os': 33, 'rsi_ob': 93, 'vol_spike': 0.090410913448095, 'adx_thresh': 12.112359510916079, 'atr_min_pct': 0.004206573801553695, 'atr_max_pct': 0.11211815198953853, 'tp_mult': 2.4309177392413237, 'tsl_mult': 0.14965938435144843, 'strategy': 'breakout', 'time_stop': 278, 'use_sma': False, 'use_atr': False, 'use_adx': True, 'use_ema': False, 'use_spike': True, 'rsi_required': True, 'edge_k': 0.3628027576810584, 'edge_cap': 0.6799653017761618}.
[I 2025-08-29 16:47:41,117] Trial 13 finished with values: [-0.00710401823858553, 0.007150926008170815] and parameters: {'p_sma': 32, 'p_std': 24, 'p_atr': 17, 'p_adx': 24, 'rsi_period': 56, 'ema1': 16, 'ema2': 21, 'slip_atr_k': 0.005451626413290875, 'slip_spread_k': 0.020210480734234204, 'spread_hl_frac': 0.01385631008337753, 'bb_std_mult': 1.607249527633651, 'rsi_os': 6, 'rsi_ob': 70, 'vol_spike': 0.09428765069050746, 'adx_thresh': 7.012974435722066, 'atr_min_pct': 0.0007071915996709095, 'atr_max_pct': 0.14954399093341808, 'tp_mult': 1.590116130065503, 'tsl_mult': 0.8686334936748803, 'strategy': 'breakout', 'time_stop': 93, 'use_sma': True, 'use_atr': False, 'use_adx': True, 'use_ema': False, 'use_spike': False, 'rsi_required': False, 'edge_k': 0.13970574272426003, 'edge_cap': 0.41346641042202936}.
[I 2025-08-29 16:47:41,215] Trial 12 finished with values: [-1000000000.0, 1000000000.0] and parameters: {'p_sma': 6, 'p_std': 16, 'p_atr': 27, 'p_adx': 12, 'rsi_period': 16, 'ema1': 29, 'ema2': 10, 'slip_atr_k': 0.07260215519045043, 'slip_spread_k': 0.8153111218683929, 'spread_hl_frac': 0.019229280078814272, 'bb_std_mult': 1.6468224291653268, 'rsi_os': 7, 'rsi_ob': 65, 'vol_spike': 0.18375491883817235, 'adx_thresh': 22.302432082000042, 'atr_min_pct': 0.007456667011296587, 'atr_max_pct': 0.04020436937721972, 'tp_mult': 2.0159479981256454, 'tsl_mult': 0.048145845958676214, 'strategy': 'mean_reversion', 'time_stop': 66, 'use_sma': True, 'use_atr': False, 'use_adx': True, 'use_ema': False, 'use_spike': False, 'rsi_required': False, 'edge_k': 1.7669114047181937, 'edge_cap': 0.5258692148902991}.
[I 2025-08-29 16:48:05,694] Trial 14 finished with values: [-0.006878194030387363, 0.0069295045987051085] and parameters: {'p_sma': 27, 'p_std': 23, 'p_atr': 18, 'p_adx': 24, 'rsi_period': 53, 'ema1': 7, 'ema2': 22, 'slip_atr_k': 0.004764860794913062, 'slip_spread_k': 0.09225014479869015, 'spread_hl_frac': 0.04893767331152185, 'bb_std_mult': 2.5938618519905012, 'rsi_os': 9, 'rsi_ob': 71, 'vol_spike': 0.11296303103255023, 'adx_thresh': 14.173352069749576, 'atr_min_pct': 0.0005519534516138808, 'atr_max_pct': 0.14428047301723412, 'tp_mult': 1.7290263059506745, 'tsl_mult': 0.9248732110508462, 'strategy': 'breakout', 'time_stop': 95, 'use_sma': True, 'use_atr': False, 'use_adx': False, 'use_ema': False, 'use_spike': False, 'rsi_required': False, 'edge_k': 0.03834538294569434, 'edge_cap': 0.3722158954393492}.
[I 2025-08-29 16:48:09,400] Trial 15 finished with values: [-1000000000.0, 1000000000.0] and parameters: {'p_sma': 26, 'p_std': 24, 'p_atr': 17, 'p_adx': 14, 'rsi_period': 8, 'ema1': 6, 'ema2': 55, 'slip_atr_k': 0.010802714445029851, 'slip_spread_k': 0.971771693767968, 'spread_hl_frac': 0.0471275017663665, 'bb_std_mult': 2.647747404185197, 'rsi_os': 9, 'rsi_ob': 71, 'vol_spike': 0.11363904613378281, 'adx_thresh': 15.153619886705565, 'atr_min_pct': 0.02918654947449049, 'atr_max_pct': 0.1485202302208431, 'tp_mult': 1.7475915847383132, 'tsl_mult': 0.9747528356280715, 'strategy': 'breakout', 'time_stop': 99, 'use_sma': True, 'use_atr': False, 'use_adx': False, 'use_ema': True, 'use_spike': False, 'rsi_required': False, 'edge_k': 0.6260652904601955, 'edge_cap': 0.450201999643528}.
[I 2025-08-29 16:48:09,929] Trial 17 finished with values: [-0.0070258847154706094, 0.0070682659898614955] and parameters: {'p_sma': 30, 'p_std': 24, 'p_atr': 16, 'p_adx': 23, 'rsi_period': 51, 'ema1': 17, 'ema2': 23, 'slip_atr_k': 2.5168078247719827e-05, 'slip_spread_k': 0.026097079338524096, 'spread_hl_frac': 0.011273364350826726, 'bb_std_mult': 2.6243349809516, 'rsi_os': 5, 'rsi_ob': 70, 'vol_spike': 0.11959296446738862, 'adx_thresh': 10.888681314499696, 'atr_min_pct': 1.1126148222709254e-05, 'atr_max_pct': 0.14961309770374265, 'tp_mult': 1.5068504283800532, 'tsl_mult': 0.9891295264120122, 'strategy': 'breakout', 'time_stop': 130, 'use_sma': True, 'use_atr': False, 'use_adx': True, 'use_ema': False, 'use_spike': False, 'rsi_required': False, 'edge_k': 0.03658766013394224, 'edge_cap': 0.40544846667021167}.
[I 2025-08-29 16:48:09,949] Trial 16 finished with values: [-0.007118005718906528, 0.0071601546722335156] and parameters: {'p_sma': 30, 'p_std': 23, 'p_atr': 16, 'p_adx': 23, 'rsi_period': 48, 'ema1': 18, 'ema2': 26, 'slip_atr_k': 0.002655619161440193, 'slip_spread_k': 0.00958121823621844, 'spread_hl_frac': 0.012456114408872287, 'bb_std_mult': 1.4689536494784403, 'rsi_os': 5, 'rsi_ob': 70, 'vol_spike': 0.12057921875851554, 'adx_thresh': 11.969510509313425, 'atr_min_pct': 3.0633614100604315e-05, 'atr_max_pct': 0.14679715650626343, 'tp_mult': 1.4991920228411857, 'tsl_mult': 0.977839481450261, 'strategy': 'breakout', 'time_stop': 94, 'use_sma': True, 'use_atr': False, 'use_adx': True, 'use_ema': False, 'use_spike': False, 'rsi_required': False, 'edge_k': 0.002690148807638293, 'edge_cap': 0.43439804195450216}.
[I 2025-08-29 16:48:32,577] Trial 18 finished with values: [-0.006624975677879008, 0.006676848868305504] and parameters: {'p_sma': 30, 'p_std': 24, 'p_atr': 18, 'p_adx': 22, 'rsi_period': 56, 'ema1': 16, 'ema2': 25, 'slip_atr_k': 0.006273916100626652, 'slip_spread_k': 0.03401645851551884, 'spread_hl_frac': 0.04665670169553773, 'bb_std_mult': 2.7289164872291676, 'rsi_os': 6, 'rsi_ob': 75, 'vol_spike': 0.1264157827457562, 'adx_thresh': 16.435899418515287, 'atr_min_pct': 0.00019763426424230065, 'atr_max_pct': 0.10071547703002817, 'tp_mult': 1.5436240737583076, 'tsl_mult': 0.9553161101396622, 'strategy': 'breakout', 'time_stop': 118, 'use_sma': True, 'use_atr': False, 'use_adx': False, 'use_ema': False, 'use_spike': False, 'rsi_required': False, 'edge_k': 0.5112911422575065, 'edge_cap': 0.32836782218302396}.
[I 2025-08-29 16:48:36,841] Trial 19 finished with values: [-0.02770576944144254, 0.027755466044627385] and parameters: {'p_sma': 38, 'p_std': 22, 'p_atr': 19, 'p_adx': 23, 'rsi_period': 55, 'ema1': 17, 'ema2': 26, 'slip_atr_k': 0.018539653943192375, 'slip_spread_k': 0.013711859790690228, 'spread_hl_frac': 0.04997469534011552, 'bb_std_mult': 2.8191656383917474, 'rsi_os': 40, 'rsi_ob': 75, 'vol_spike': 0.1545493711175926, 'adx_thresh': 19.01467654926704, 'atr_min_pct': 1.960721521611342e-05, 'atr_max_pct': 0.09801855495539243, 'tp_mult': 1.434113481451369, 'tsl_mult': 0.8197551863514101, 'strategy': 'breakout', 'time_stop': 149, 'use_sma': True, 'use_atr': False, 'use_adx': False, 'use_ema': False, 'use_spike': False, 'rsi_required': False, 'edge_k': 0.02410031965956296, 'edge_cap': 0.3699595915300543}.
[I 2025-08-29 16:48:37,495] Trial 21 finished with values: [-1000000000.0, 1000000000.0] and parameters: {'p_sma': 41, 'p_std': 17, 'p_atr': 20, 'p_adx': 22, 'rsi_period': 57, 'ema1': 10, 'ema2': 26, 'slip_atr_k': 0.24707089083927336, 'slip_spread_k': 0.15250839635747654, 'spread_hl_frac': 0.04956702248595673, 'bb_std_mult': 2.7000616566622186, 'rsi_os': 39, 'rsi_ob': 77, 'vol_spike': 0.1510287388429925, 'adx_thresh': 34.96044345941364, 'atr_min_pct': 0.017239669186504217, 'atr_max_pct': 0.09705012012094832, 'tp_mult': 1.4004482276091053, 'tsl_mult': 0.6273481306599495, 'strategy': 'breakout', 'time_stop': 153, 'use_sma': True, 'use_atr': False, 'use_adx': False, 'use_ema': False, 'use_spike': False, 'rsi_required': False, 'edge_k': 0.6543413659678569, 'edge_cap': 0.30134873285231}.
[I 2025-08-29 16:48:37,703] Trial 20 finished with values: [-0.034341723822880366, 0.03436373349678036] and parameters: {'p_sma': 38, 'p_std': 20, 'p_atr': 20, 'p_adx': 22, 'rsi_period': 53, 'ema1': 10, 'ema2': 29, 'slip_atr_k': 0.12837510246984987, 'slip_spread_k': 0.1430771676006774, 'spread_hl_frac': 0.04817343802216177, 'bb_std_mult': 2.699430011247052, 'rsi_os': 40, 'rsi_ob': 79, 'vol_spike': 0.1481008195745219, 'adx_thresh': 17.68850485129633, 'atr_min_pct': 5.250357834746949e-05, 'atr_max_pct': 0.10085149390422495, 'tp_mult': 1.4316235886927429, 'tsl_mult': 0.6192445154835455, 'strategy': 'breakout', 'time_stop': 145, 'use_sma': True, 'use_atr': False, 'use_adx': False, 'use_ema': False, 'use_spike': False, 'rsi_required': False, 'edge_k': 0.6049755286063577, 'edge_cap': 0.3171918066647885}.
[I 2025-08-29 16:48:58,689] Trial 22 finished with values: [-1000000000.0, 1000000000.0] and parameters: {'p_sma': 40, 'p_std': 17, 'p_atr': 21, 'p_adx': 16, 'rsi_period': 63, 'ema1': 12, 'ema2': 27, 'slip_atr_k': 0.11792065458306365, 'slip_spread_k': 0.17151672431369566, 'spread_hl_frac': 0.04995018667852832, 'bb_std_mult': 3.013693343055674, 'rsi_os': 13, 'rsi_ob': 78, 'vol_spike': 0.1632991378323652, 'adx_thresh': 34.65121453616196, 'atr_min_pct': 0.003707134611242108, 'atr_max_pct': 0.09596869600619748, 'tp_mult': 1.2969409342049483, 'tsl_mult': 0.7333295895703181, 'strategy': 'breakout', 'time_stop': 173, 'use_sma': True, 'use_atr': False, 'use_adx': False, 'use_ema': False, 'use_spike': False, 'rsi_required': False, 'edge_k': 0.5760168669511149, 'edge_cap': 0.059634834820300575}.
[I 2025-08-29 16:49:04,305] Trial 23 finished with values: [-1000000000.0, 1000000000.0] and parameters: {'p_sma': 41, 'p_std': 32, 'p_atr': 11, 'p_adx': 16, 'rsi_period': 65, 'ema1': 13, 'ema2': 30, 'slip_atr_k': 0.2364468780407195, 'slip_spread_k': 0.16786182989375198, 'spread_hl_frac': 0.02876140092435208, 'bb_std_mult': 3.130300463848022, 'rsi_os': 12, 'rsi_ob': 77, 'vol_spike': 0.07727834102257167, 'adx_thresh': 17.637867931255876, 'atr_min_pct': 0.003340187122014079, 'atr_max_pct': 0.12361633801618871, 'tp_mult': 1.3123125630941725, 'tsl_mult': 0.6861293235772601, 'strategy': 'breakout', 'time_stop': 179, 'use_sma': True, 'use_atr': False, 'use_adx': False, 'use_ema': False, 'use_spike': False, 'rsi_required': False, 'edge_k': 0.5879990172587125, 'edge_cap': 0.28820712879663746}.
[I 2025-08-29 16:49:04,941] Trial 24 finished with values: [-1000000000.0, 1000000000.0] and parameters: {'p_sma': 25, 'p_std': 32, 'p_atr': 21, 'p_adx': 16, 'rsi_period': 69, 'ema1': 25, 'ema2': 31, 'slip_atr_k': 0.13199582487299547, 'slip_spread_k': 0.17303391466106532, 'spread_hl_frac': 0.028634473103861833, 'bb_std_mult': 2.4366390345184628, 'rsi_os': 13, 'rsi_ob': 62, 'vol_spike': 0.07153172683309836, 'adx_thresh': 17.687739628186563, 'atr_min_pct': 0.0032014761216821, 'atr_max_pct': 0.12403153548503063, 'tp_mult': 2.9392703629980312, 'tsl_mult': 0.7859959399037313, 'strategy': 'breakout', 'time_stop': 145, 'use_sma': True, 'use_atr': False, 'use_adx': False, 'use_ema': False, 'use_spike': False, 'rsi_required': False, 'edge_k': 0.5863482423861359, 'edge_cap': 0.06845978342731734}.
[I 2025-08-29 16:49:05,035] Trial 25 finished with values: [-1000000000.0, 1000000000.0] and parameters: {'p_sma': 24, 'p_std': 30, 'p_atr': 11, 'p_adx': 15, 'rsi_period': 67, 'ema1': 25, 'ema2': 43, 'slip_atr_k': 0.046243691433295125, 'slip_spread_k': 0.21314543495355556, 'spread_hl_frac': 0.029716135438127553, 'bb_std_mult': 3.111473613844014, 'rsi_os': 13, 'rsi_ob': 59, 'vol_spike': 0.21565505913912134, 'adx_thresh': 16.47464192670749, 'atr_min_pct': 0.003867627688891317, 'atr_max_pct': 0.12642156398368806, 'tp_mult': 1.9104864972419104, 'tsl_mult': 0.7885814570202911, 'strategy': 'breakout', 'time_stop': 194, 'use_sma': True, 'use_atr': False, 'use_adx': False, 'use_ema': False, 'use_spike': False, 'rsi_required': False, 'edge_k': 0.45617161222058955, 'edge_cap': 0.0628543304984176}.
[I 2025-08-29 16:49:24,993] Trial 26 finished with values: [-1000000000.0, 1000000000.0] and parameters: {'p_sma': 24, 'p_std': 30, 'p_atr': 11, 'p_adx': 17, 'rsi_period': 72, 'ema1': 26, 'ema2': 43, 'slip_atr_k': 0.055650182265158735, 'slip_spread_k': 0.1748506147992337, 'spread_hl_frac': 0.04002290879609896, 'bb_std_mult': 2.3282259660339206, 'rsi_os': 11, 'rsi_ob': 55, 'vol_spike': 0.06883517340224252, 'adx_thresh': 15.66741448927542, 'atr_min_pct': 0.0030668737651859974, 'atr_max_pct': 0.12466391490694823, 'tp_mult': 2.9460354723623854, 'tsl_mult': 0.9974118325964233, 'strategy': 'breakout', 'time_stop': 62, 'use_sma': True, 'use_atr': False, 'use_adx': False, 'use_ema': False, 'use_spike': False, 'rsi_required': False, 'edge_k': 1.4328939589978011, 'edge_cap': 0.5820583456480438}.
