[I 2025-08-29 16:58:43,533] Trial 108 finished with values: [-0.017004679038390313, 0.017055598426501926] and parameters: {'p_sma': 30, 'p_std': 12, 'p_atr': 29, 'p_adx': 14, 'rsi_period': 49, 'ema1': 17, 'ema2': 14, 'slip_atr_k': 0.23813382973742658, 'slip_spread_k': 0.44597724505387, 'spread_hl_frac': 0.00330765859632053, 'bb_std_mult': 0.8407774339938333, 'rsi_os': 31, 'rsi_ob': 51, 'vol_spike': 0.15692179372994375, 'adx_thresh': 15.973361095144792, 'atr_min_pct': 0.0007500156578494676, 'atr_max_pct': 0.07837482210787405, 'tp_mult': 1.5155979181303656, 'tsl_mult': 0.3265692630073076, 'strategy': 'breakout', 'time_stop': 228, 'use_sma': True, 'use_atr': False, 'use_adx': False, 'use_ema': False, 'use_spike': False, 'rsi_required': True, 'edge_k': 1.6713423295057495, 'edge_cap': 0.8122486024886232}.
[I 2025-08-29 16:58:43,615] Trial 110 finished with values: [-0.0065955021195209795, 0.006718144701923364] and parameters: {'p_sma': 26, 'p_std': 12, 'p_atr': 13, 'p_adx': 15, 'rsi_period': 51, 'ema1': 17, 'ema2': 60, 'slip_atr_k': 0.08415478649546895, 'slip_spread_k': 0.39533577059906777, 'spread_hl_frac': 0.04326915743277966, 'bb_std_mult': 1.1453007636820183, 'rsi_os': 31, 'rsi_ob': 53, 'vol_spike': 0.1724852427002829, 'adx_thresh': 34.15679846960677, 'atr_min_pct': 0.0025414185980005962, 'atr_max_pct': 0.015879510233724678, 'tp_mult': 1.2488231154143719, 'tsl_mult': 0.5297111067192588, 'strategy': 'breakout', 'time_stop': 111, 'use_sma': True, 'use_atr': False, 'use_adx': True, 'use_ema': False, 'use_spike': False, 'rsi_required': True, 'edge_k': 0.03106208159796918, 'edge_cap': 0.1435749064335627}.
[I 2025-08-29 16:58:43,716] Trial 107 finished with values: [-0.009071160226349129, 0.009093567416106655] and parameters: {'p_sma': 34, 'p_std': 24, 'p_atr': 17, 'p_adx': 14, 'rsi_period': 48, 'ema1': 30, 'ema2': 53, 'slip_atr_k': 0.18388625361034056, 'slip_spread_k': 0.5834697288446679, 'spread_hl_frac': 0.04271597712756612, 'bb_std_mult': 0.796000694232654, 'rsi_os': 12, 'rsi_ob': 52, 'vol_spike': 0.19715236909398848, 'adx_thresh': 13.878950126532214, 'atr_min_pct': 0.0007761457265551126, 'atr_max_pct': 0.0786161999936013, 'tp_mult': 2.5384042813331718, 'tsl_mult': 0.7543190501278031, 'strategy': 'breakout', 'time_stop': 222, 'use_sma': True, 'use_atr': False, 'use_adx': False, 'use_ema': False, 'use_spike': False, 'rsi_required': True, 'edge_k': 0.03825585623675355, 'edge_cap': 0.7845369513632565}.
[I 2025-08-29 16:58:43,858] Trial 114 finished with values: [-1000000000.0, 1000000000.0] and parameters: {'p_sma': 26, 'p_std': 44, 'p_atr': 13, 'p_adx': 11, 'rsi_period': 52, 'ema1': 18, 'ema2': 35, 'slip_atr_k': 0.0008942677826801332, 'slip_spread_k': 0.9520804162991506, 'spread_hl_frac': 0.04570765627332603, 'bb_std_mult': 3.206105421343601, 'rsi_os': 20, 'rsi_ob': 67, 'vol_spike': 0.12772963149554165, 'adx_thresh': 34.05010280223904, 'atr_min_pct': 0.02511209721119466, 'atr_max_pct': 0.010749598556031817, 'tp_mult': 2.6596376587626542, 'tsl_mult': 0.8110786381398201, 'strategy': 'mean_reversion', 'time_stop': 242, 'use_sma': True, 'use_atr': True, 'use_adx': True, 'use_ema': True, 'use_spike': True, 'rsi_required': True, 'edge_k': 1.4213910526649332, 'edge_cap': 0.460929294348124}.
[I 2025-08-29 16:59:10,655] Trial 111 finished with values: [-1000000000.0, 1000000000.0] and parameters: {'p_sma': 18, 'p_std': 44, 'p_atr': 13, 'p_adx': 16, 'rsi_period': 47, 'ema1': 17, 'ema2': 58, 'slip_atr_k': 0.02715068345118128, 'slip_spread_k': 0.39152411065897946, 'spread_hl_frac': 0.0035331052421826354, 'bb_std_mult': 0.551039539461635, 'rsi_os': 31, 'rsi_ob': 94, 'vol_spike': 0.10064265044702117, 'adx_thresh': 33.94350506079235, 'atr_min_pct': 0.002379901513886199, 'atr_max_pct': 0.07466178571798371, 'tp_mult': 1.5213565232633464, 'tsl_mult': 0.42939598665218937, 'strategy': 'breakout', 'time_stop': 245, 'use_sma': True, 'use_atr': True, 'use_adx': True, 'use_ema': False, 'use_spike': False, 'rsi_required': True, 'edge_k': 0.034670510083310305, 'edge_cap': 0.6454760473710132}.
[I 2025-08-29 16:59:11,346] Trial 113 finished with values: [-1000000000.0, 1000000000.0] and parameters: {'p_sma': 26, 'p_std': 18, 'p_atr': 28, 'p_adx': 11, 'rsi_period': 47, 'ema1': 19, 'ema2': 58, 'slip_atr_k': 7.119341557193732e-05, 'slip_spread_k': 0.6769313916067373, 'spread_hl_frac': 0.026560001498016378, 'bb_std_mult': 0.5573346710135098, 'rsi_os': 20, 'rsi_ob': 67, 'vol_spike': 0.12669461631482687, 'adx_thresh': 13.362258019804841, 'atr_min_pct': 0.0026974566559355906, 'atr_max_pct': 0.06932904392683518, 'tp_mult': 2.2180171235799935, 'tsl_mult': 0.1922906121074105, 'strategy': 'mean_reversion', 'time_stop': 114, 'use_sma': True, 'use_atr': True, 'use_adx': True, 'use_ema': False, 'use_spike': True, 'rsi_required': True, 'edge_k': 0.03631418930061124, 'edge_cap': 0.4664716527334132}.
[I 2025-08-29 16:59:11,689] Trial 112 finished with values: [-1000000000.0, 1000000000.0] and parameters: {'p_sma': 33, 'p_std': 28, 'p_atr': 13, 'p_adx': 7, 'rsi_period': 81, 'ema1': 20, 'ema2': 52, 'slip_atr_k': 0.00040242192596478383, 'slip_spread_k': 0.14360121167063944, 'spread_hl_frac': 0.029772128263743657, 'bb_std_mult': 0.5521561650515271, 'rsi_os': 20, 'rsi_ob': 66, 'vol_spike': 0.10178386257132102, 'adx_thresh': 13.612604288087635, 'atr_min_pct': 0.002073548088979359, 'atr_max_pct': 0.073822474666946, 'tp_mult': 2.7413877850639414, 'tsl_mult': 0.3583810925839338, 'strategy': 'breakout', 'time_stop': 134, 'use_sma': True, 'use_atr': True, 'use_adx': True, 'use_ema': False, 'use_spike': True, 'rsi_required': True, 'edge_k': 1.0506778450794274, 'edge_cap': 0.7404139431579698}.
[I 2025-08-29 16:59:11,802] Trial 115 finished with values: [-1000000000.0, 1000000000.0] and parameters: {'p_sma': 33, 'p_std': 6, 'p_atr': 18, 'p_adx': 13, 'rsi_period': 60, 'ema1': 19, 'ema2': 18, 'slip_atr_k': 0.20196979674705545, 'slip_spread_k': 0.1245887447584263, 'spread_hl_frac': 0.03942890069159145, 'bb_std_mult': 2.0434110460389623, 'rsi_os': 24, 'rsi_ob': 64, 'vol_spike': 0.1029388941327677, 'adx_thresh': 15.014426279870268, 'atr_min_pct': 0.002406097937877396, 'atr_max_pct': 0.07420882254003336, 'tp_mult': 2.9339515326795533, 'tsl_mult': 0.5328849275714462, 'strategy': 'breakout', 'time_stop': 112, 'use_sma': True, 'use_atr': False, 'use_adx': True, 'use_ema': False, 'use_spike': False, 'rsi_required': True, 'edge_k': 0.03783501621890147, 'edge_cap': 0.24370279674918033}.
[I 2025-08-29 16:59:38,799] Trial 117 finished with values: [-0.008463782725718239, 0.008446120921339723] and parameters: {'p_sma': 32, 'p_std': 7, 'p_atr': 18, 'p_adx': 25, 'rsi_period': 74, 'ema1': 7, 'ema2': 18, 'slip_atr_k': 0.0967657777724053, 'slip_spread_k': 0.4926831264438011, 'spread_hl_frac': 0.020233876047877724, 'bb_std_mult': 0.9161692074300799, 'rsi_os': 16, 'rsi_ob': 91, 'vol_spike': 0.10118653215942158, 'adx_thresh': 14.536924190495666, 'atr_min_pct': 0.0014530865289425535, 'atr_max_pct': 0.06127649019259046, 'tp_mult': 2.7451982019913856, 'tsl_mult': 0.029550740344206072, 'strategy': 'breakout', 'time_stop': 135, 'use_sma': True, 'use_atr': False, 'use_adx': False, 'use_ema': False, 'use_spike': False, 'rsi_required': True, 'edge_k': 0.22775010701041037, 'edge_cap': 0.2419456394748779}.
[I 2025-08-29 16:59:39,378] Trial 116 finished with values: [-0.006358939673106634, 0.006465139429207801] and parameters: {'p_sma': 32, 'p_std': 17, 'p_atr': 26, 'p_adx': 15, 'rsi_period': 59, 'ema1': 19, 'ema2': 60, 'slip_atr_k': 0.004571437216766666, 'slip_spread_k': 0.2470077800567692, 'spread_hl_frac': 0.04849321799438708, 'bb_std_mult': 0.9403238834433222, 'rsi_os': 24, 'rsi_ob': 64, 'vol_spike': 0.21562060297881136, 'adx_thresh': 14.751953062459144, 'atr_min_pct': 0.0013172288873420875, 'atr_max_pct': 0.06856163877014049, 'tp_mult': 2.7304484820203214, 'tsl_mult': 0.531895577699681, 'strategy': 'breakout', 'time_stop': 115, 'use_sma': True, 'use_atr': False, 'use_adx': False, 'use_ema': False, 'use_spike': False, 'rsi_required': True, 'edge_k': 0.19947720050616416, 'edge_cap': 0.14437883593421275}.
[I 2025-08-29 16:59:39,600] Trial 118 finished with values: [-0.017945033458482085, 0.017935204558696606] and parameters: {'p_sma': 53, 'p_std': 42, 'p_atr': 18, 'p_adx': 25, 'rsi_period': 7, 'ema1': 19, 'ema2': 18, 'slip_atr_k': 0.008732471054313327, 'slip_spread_k': 0.19469051997205045, 'spread_hl_frac': 0.03885180128688911, 'bb_std_mult': 0.8973351563559359, 'rsi_os': 16, 'rsi_ob': 56, 'vol_spike': 0.2179887982340223, 'adx_thresh': 14.825622348364668, 'atr_min_pct': 0.0015096181245947886, 'atr_max_pct': 0.14210339920029494, 'tp_mult': 2.9419562434746767, 'tsl_mult': 0.5337648784668788, 'strategy': 'breakout', 'time_stop': 100, 'use_sma': True, 'use_atr': False, 'use_adx': False, 'use_ema': True, 'use_spike': False, 'rsi_required': True, 'edge_k': 0.5456913150516365, 'edge_cap': 0.2817184645668873}.
[I 2025-08-29 16:59:39,843] Trial 119 finished with values: [-1000000000.0, 1000000000.0] and parameters: {'p_sma': 58, 'p_std': 42, 'p_atr': 23, 'p_adx': 12, 'rsi_period': 51, 'ema1': 7, 'ema2': 16, 'slip_atr_k': 0.010824685572638746, 'slip_spread_k': 0.18772415387944047, 'spread_hl_frac': 0.0024698591589452407, 'bb_std_mult': 0.9434749052583847, 'rsi_os': 16, 'rsi_ob': 91, 'vol_spike': 0.21516549306638863, 'adx_thresh': 31.76620519342815, 'atr_min_pct': 0.0014153810342775568, 'atr_max_pct': 0.1117541022761948, 'tp_mult': 1.3660480743539767, 'tsl_mult': 0.04766792392399016, 'strategy': 'breakout', 'time_stop': 148, 'use_sma': False, 'use_atr': False, 'use_adx': False, 'use_ema': True, 'use_spike': False, 'rsi_required': True, 'edge_k': 0.19638950898747173, 'edge_cap': 0.1407214524958576}.
[I 2025-08-29 17:00:07,939] Trial 123 finished with values: [-0.012452332434325086, 0.012433199857034664] and parameters: {'p_sma': 48, 'p_std': 16, 'p_atr': 14, 'p_adx': 8, 'rsi_period': 29, 'ema1': 14, 'ema2': 15, 'slip_atr_k': 0.0870750980020652, 'slip_spread_k': 0.2450946436774153, 'spread_hl_frac': 0.0011564506211686274, 'bb_std_mult': 1.0704358609093394, 'rsi_os': 25, 'rsi_ob': 86, 'vol_spike': 0.030715646279231526, 'adx_thresh': 23.414053861908307, 'atr_min_pct': 0.00045067934005157154, 'atr_max_pct': 0.06855339693243878, 'tp_mult': 2.0346195969597023, 'tsl_mult': 0.8701865194789892, 'strategy': 'mean_reversion', 'time_stop': 8, 'use_sma': True, 'use_atr': False, 'use_adx': False, 'use_ema': False, 'use_spike': False, 'rsi_required': False, 'edge_k': 0.10477498335139958, 'edge_cap': 0.3319503453604087}.
[I 2025-08-29 17:00:09,491] Trial 121 finished with values: [-1000000000.0, 1000000000.0] and parameters: {'p_sma': 31, 'p_std': 42, 'p_atr': 23, 'p_adx': 15, 'rsi_period': 29, 'ema1': 14, 'ema2': 16, 'slip_atr_k': 0.010854630062110595, 'slip_spread_k': 0.24961036037434858, 'spread_hl_frac': 7.342829240743522e-05, 'bb_std_mult': 0.9342898737620031, 'rsi_os': 41, 'rsi_ob': 86, 'vol_spike': 0.17497446882091267, 'adx_thresh': 31.626638900560756, 'atr_min_pct': 0.010501159866128599, 'atr_max_pct': 0.017113883344596945, 'tp_mult': 1.370049151145317, 'tsl_mult': 0.2760809507525294, 'strategy': 'breakout', 'time_stop': 10, 'use_sma': False, 'use_atr': False, 'use_adx': False, 'use_ema': True, 'use_spike': False, 'rsi_required': True, 'edge_k': 0.5459453000459189, 'edge_cap': 0.1390262952471319}.
[I 2025-08-29 17:00:09,852] Trial 122 finished with values: [-1000000000.0, 1000000000.0] and parameters: {'p_sma': 31, 'p_std': 15, 'p_atr': 25, 'p_adx': 27, 'rsi_period': 51, 'ema1': 18, 'ema2': 15, 'slip_atr_k': 0.0332944924428072, 'slip_spread_k': 0.44232067328150665, 'spread_hl_frac': 0.013492099845415509, 'bb_std_mult': 1.0615869139694631, 'rsi_os': 22, 'rsi_ob': 89, 'vol_spike': 0.1105823518710953, 'adx_thresh': 31.752321869039847, 'atr_min_pct': 0.028704497424312535, 'atr_max_pct': 0.09978465749662149, 'tp_mult': 1.3835741732606541, 'tsl_mult': 0.6894667481577899, 'strategy': 'mean_reversion', 'time_stop': 86, 'use_sma': False, 'use_atr': False, 'use_adx': False, 'use_ema': True, 'use_spike': False, 'rsi_required': False, 'edge_k': 0.12063706192433148, 'edge_cap': 0.1401824158335674}.
[I 2025-08-29 17:00:10,104] Trial 120 finished with values: [-1000000000.0, 1000000000.0] and parameters: {'p_sma': 53, 'p_std': 52, 'p_atr': 26, 'p_adx': 27, 'rsi_period': 29, 'ema1': 27, 'ema2': 60, 'slip_atr_k': 0.0064753232463897895, 'slip_spread_k': 0.4426798408090917, 'spread_hl_frac': 0.0023390713261399994, 'bb_std_mult': 0.9426021715119092, 'rsi_os': 51, 'rsi_ob': 56, 'vol_spike': 0.02825320999465797, 'adx_thresh': 12.763528342656784, 'atr_min_pct': 0.004487031951540403, 'atr_max_pct': 0.14102479031856197, 'tp_mult': 1.7319780961906805, 'tsl_mult': 0.9343591550194035, 'strategy': 'breakout', 'time_stop': 147, 'use_sma': False, 'use_atr': False, 'use_adx': False, 'use_ema': True, 'use_spike': False, 'rsi_required': False, 'edge_k': 0.11540640013438577, 'edge_cap': 0.14223540779618613}.
[I 2025-08-29 17:00:37,299] Trial 124 finished with values: [-1000000000.0, 1000000000.0] and parameters: {'p_sma': 31, 'p_std': 11, 'p_atr': 26, 'p_adx': 15, 'rsi_period': 54, 'ema1': 18, 'ema2': 10, 'slip_atr_k': 0.006403691554477433, 'slip_spread_k': 0.44235929029686544, 'spread_hl_frac': 0.03451232958913397, 'bb_std_mult': 2.305612834291471, 'rsi_os': 51, 'rsi_ob': 71, 'vol_spike': 0.29068672971615006, 'adx_thresh': 12.655247348210017, 'atr_min_pct': 0.02876611666326267, 'atr_max_pct': 0.08825147120373875, 'tp_mult': 1.7299454611577432, 'tsl_mult': 0.28001165270776723, 'strategy': 'breakout', 'time_stop': 163, 'use_sma': False, 'use_atr': False, 'use_adx': False, 'use_ema': False, 'use_spike': False, 'rsi_required': True, 'edge_k': 0.08635607668555506, 'edge_cap': 0.8843337522691126}.
[I 2025-08-29 17:00:38,008] Trial 125 finished with values: [-1000000000.0, 1000000000.0] and parameters: {'p_sma': 44, 'p_std': 31, 'p_atr': 26, 'p_adx': 27, 'rsi_period': 34, 'ema1': 17, 'ema2': 45, 'slip_atr_k': 0.004634563832059586, 'slip_spread_k': 0.438745611591818, 'spread_hl_frac': 0.04912047305136586, 'bb_std_mult': 2.3395886405711335, 'rsi_os': 22, 'rsi_ob': 89, 'vol_spike': 0.11060510559975016, 'adx_thresh': 12.808542066306636, 'atr_min_pct': 0.016835988767526365, 'atr_max_pct': 0.12307410174427064, 'tp_mult': 1.84637188600658, 'tsl_mult': 0.6919047063720406, 'strategy': 'breakout', 'time_stop': 162, 'use_sma': True, 'use_atr': False, 'use_adx': False, 'use_ema': False, 'use_spike': True, 'rsi_required': False, 'edge_k': 1.5931397674556207, 'edge_cap': 0.49619114574402157}.
[I 2025-08-29 17:00:38,149] Trial 126 finished with values: [-1000000000.0, 1000000000.0] and parameters: {'p_sma': 38, 'p_std': 45, 'p_atr': 16, 'p_adx': 20, 'rsi_period': 54, 'ema1': 17, 'ema2': 13, 'slip_atr_k': 0.024918272439657156, 'slip_spread_k': 0.3814359925142386, 'spread_hl_frac': 0.0022002106642670803, 'bb_std_mult': 0.7256237046163492, 'rsi_os': 51, 'rsi_ob': 71, 'vol_spike': 0.11074238149757873, 'adx_thresh': 13.015363069052354, 'atr_min_pct': 0.02993666024114569, 'atr_max_pct': 0.08825733640408627, 'tp_mult': 2.4684021048922142, 'tsl_mult': 0.6300504650272646, 'strategy': 'breakout', 'time_stop': 160, 'use_sma': True, 'use_atr': False, 'use_adx': False, 'use_ema': False, 'use_spike': True, 'rsi_required': True, 'edge_k': 0.004795952040344512, 'edge_cap': 0.541070085030262}.
[I 2025-08-29 17:00:38,435] Trial 127 finished with values: [-1000000000.0, 1000000000.0] and parameters: {'p_sma': 38, 'p_std': 45, 'p_atr': 16, 'p_adx': 9, 'rsi_period': 54, 'ema1': 9, 'ema2': 13, 'slip_atr_k': 0.0189756882394011, 'slip_spread_k': 0.37784395882807337, 'spread_hl_frac': 0.01602474651301186, 'bb_std_mult': 2.3033162398657843, 'rsi_os': 28, 'rsi_ob': 89, 'vol_spike': 0.009852048337347846, 'adx_thresh': 11.771569754524503, 'atr_min_pct': 0.01880523644921398, 'atr_max_pct': 0.08862693096143806, 'tp_mult': 2.4656345066263468, 'tsl_mult': 0.6270654145187957, 'strategy': 'breakout', 'time_stop': 162, 'use_sma': True, 'use_atr': False, 'use_adx': False, 'use_ema': False, 'use_spike': True, 'rsi_required': True, 'edge_k': 1.5148870501144054, 'edge_cap': 0.3440113381454581}.
[I 2025-08-29 17:01:06,134] Trial 131 finished with values: [-1000000000.0, 1000000000.0] and parameters: {'p_sma': 29, 'p_std': 40, 'p_atr': 7, 'p_adx': 28, 'rsi_period': 57, 'ema1': 20, 'ema2': 49, 'slip_atr_k': 0.21676466202300726, 'slip_spread_k': 0.4844351426426343, 'spread_hl_frac': 0.03695612098710102, 'bb_std_mult': 1.128172860403067, 'rsi_os': 10, 'rsi_ob': 94, 'vol_spike': 0.1325025917091542, 'adx_thresh': 19.77637052153273, 'atr_min_pct': 0.0007507451830620602, 'atr_max_pct': 0.085301300817247, 'tp_mult': 2.6098832278781825, 'tsl_mult': 0.9029925047907079, 'strategy': 'mean_reversion', 'time_stop': 140, 'use_sma': True, 'use_atr': True, 'use_adx': True, 'use_ema': False, 'use_spike': False, 'rsi_required': True, 'edge_k': 0.18603013880090014, 'edge_cap': 0.05227460438277959}.
[I 2025-08-29 17:01:06,144] Trial 130 finished with values: [-0.008300136480812625, 0.008279255825344788] and parameters: {'p_sma': 29, 'p_std': 40, 'p_atr': 16, 'p_adx': 9, 'rsi_period': 26, 'ema1': 20, 'ema2': 12, 'slip_atr_k': 0.2305833721607029, 'slip_spread_k': 0.5564714647517648, 'spread_hl_frac': 0.01724576833196064, 'bb_std_mult': 2.48171614490646, 'rsi_os': 34, 'rsi_ob': 88, 'vol_spike': 0.13366743316839091, 'adx_thresh': 11.564179206341713, 'atr_min_pct': 0.0007517819418364286, 'atr_max_pct': 0.10468029735205213, 'tp_mult': 2.332991637290289, 'tsl_mult': 0.4793047815353276, 'strategy': 'mean_reversion', 'time_stop': 140, 'use_sma': True, 'use_atr': True, 'use_adx': True, 'use_ema': False, 'use_spike': False, 'rsi_required': True, 'edge_k': 1.4641110327371516, 'edge_cap': 0.3535117396605004}.
[I 2025-08-29 17:01:06,634] Trial 129 finished with values: [-1000000000.0, 1000000000.0] and parameters: {'p_sma': 29, 'p_std': 40, 'p_atr': 7, 'p_adx': 9, 'rsi_period': 54, 'ema1': 25, 'ema2': 13, 'slip_atr_k': 0.023977313546063687, 'slip_spread_k': 0.5574268135249217, 'spread_hl_frac': 0.01583171015019571, 'bb_std_mult': 0.7310312938330901, 'rsi_os': 10, 'rsi_ob': 88, 'vol_spike': 0.04746924581307531, 'adx_thresh': 11.546471258909747, 'atr_min_pct': 0.029939852126428163, 'atr_max_pct': 0.10552761719081723, 'tp_mult': 2.3329520563126724, 'tsl_mult': 0.4834044216502667, 'strategy': 'breakout', 'time_stop': 141, 'use_sma': True, 'use_atr': True, 'use_adx': False, 'use_ema': False, 'use_spike': True, 'rsi_required': True, 'edge_k': 0.0129073639166815, 'edge_cap': 0.09899136877870646}.
[I 2025-08-29 17:01:06,719] Trial 128 finished with values: [-0.010909584338348433, 0.010896119728786569] and parameters: {'p_sma': 29, 'p_std': 31, 'p_atr': 16, 'p_adx': 9, 'rsi_period': 26, 'ema1': 17, 'ema2': 13, 'slip_atr_k': 0.229705712971916, 'slip_spread_k': 0.30411988682730107, 'spread_hl_frac': 0.007947538856492464, 'bb_std_mult': 0.7084657562574888, 'rsi_os': 18, 'rsi_ob': 89, 'vol_spike': 0.24914498921120504, 'adx_thresh': 19.88542136752602, 'atr_min_pct': 0.000547534729383385, 'atr_max_pct': 0.10461652299609484, 'tp_mult': 2.342935722584974, 'tsl_mult': 0.478513861813592, 'strategy': 'breakout', 'time_stop': 140, 'use_sma': True, 'use_atr': True, 'use_adx': False, 'use_ema': False, 'use_spike': True, 'rsi_required': True, 'edge_k': 0.002714424175853651, 'edge_cap': 0.35093260992629854}.
[I 2025-08-29 17:01:34,070] Trial 133 finished with values: [-1000000000.0, 1000000000.0] and parameters: {'p_sma': 60, 'p_std': 55, 'p_atr': 15, 'p_adx': 11, 'rsi_period': 18, 'ema1': 15, 'ema2': 12, 'slip_atr_k': 0.07496090751942464, 'slip_spread_k': 0.2991575979257908, 'spread_hl_frac': 0.008205453131082414, 'bb_std_mult': 1.4485992435702046, 'rsi_os': 14, 'rsi_ob': 63, 'vol_spike': 0.2652586217321985, 'adx_thresh': 7.874884186074279, 'atr_min_pct': 0.005379541141759076, 'atr_max_pct': 0.06186015169974893, 'tp_mult': 2.863327114631522, 'tsl_mult': 0.8489720959077457, 'strategy': 'breakout', 'time_stop': 120, 'use_sma': True, 'use_atr': False, 'use_adx': False, 'use_ema': False, 'use_spike': False, 'rsi_required': True, 'edge_k': 1.774409263775154, 'edge_cap': 0.10321341388463101}.
[I 2025-08-29 17:01:34,352] Trial 134 finished with values: [-0.019223994363682273, 0.01925649722698621] and parameters: {'p_sma': 33, 'p_std': 47, 'p_atr': 14, 'p_adx': 30, 'rsi_period': 10, 'ema1': 12, 'ema2': 14, 'slip_atr_k': 0.01507631087532374, 'slip_spread_k': 0.5093348814107543, 'spread_hl_frac': 0.0015475999332341213, 'bb_std_mult': 0.8449805182529639, 'rsi_os': 12, 'rsi_ob': 86, 'vol_spike': 0.12282931061619601, 'adx_thresh': 16.00418820943432, 'atr_min_pct': 1.3845110514629146e-05, 'atr_max_pct': 0.04343112106689745, 'tp_mult': 1.9648773678246492, 'tsl_mult': 0.8193412318453889, 'strategy': 'breakout', 'time_stop': 119, 'use_sma': True, 'use_atr': False, 'use_adx': False, 'use_ema': False, 'use_spike': False, 'rsi_required': True, 'edge_k': 1.7876777773723158, 'edge_cap': 0.21138507763703496}.
[I 2025-08-29 17:01:34,550] Trial 135 finished with values: [-0.006017180684729784, 0.006046970789795857] and parameters: {'p_sma': 35, 'p_std': 47, 'p_atr': 15, 'p_adx': 17, 'rsi_period': 70, 'ema1': 12, 'ema2': 10, 'slip_atr_k': 0.07648495110544998, 'slip_spread_k': 0.03478452061161447, 'spread_hl_frac': 0.0009218203393903776, 'bb_std_mult': 1.9382919343492897, 'rsi_os': 12, 'rsi_ob': 63, 'vol_spike': 0.1195377238432041, 'adx_thresh': 8.144431121023871, 'atr_min_pct': 2.55840608762964e-06, 'atr_max_pct': 0.0759519631330381, 'tp_mult': 2.28154511978088, 'tsl_mult': 0.8413029928793908, 'strategy': 'breakout', 'time_stop': 119, 'use_sma': True, 'use_atr': False, 'use_adx': False, 'use_ema': False, 'use_spike': False, 'rsi_required': False, 'edge_k': 1.7602596267215538, 'edge_cap': 0.2545702185351828}.
