[I 2025-08-29 16:55:24,567] Trial 78 finished with values: [-1000000000.0, 1000000000.0] and parameters: {'p_sma': 42, 'p_std': 33, 'p_atr': 14, 'p_adx': 17, 'rsi_period': 77, 'ema1': 15, 'ema2': 17, 'slip_atr_k': 0.0002401073160350881, 'slip_spread_k': 0.6232186340508792, 'spread_hl_frac': 0.031584317187664274, 'bb_std_mult': 3.3460438840375177, 'rsi_os': 23, 'rsi_ob': 91, 'vol_spike': 0.28185242004784905, 'adx_thresh': 8.86652235542201, 'atr_min_pct': 0.0034887406403437734, 'atr_max_pct': 0.03380296175614822, 'tp_mult': 2.192707829073264, 'tsl_mult': 0.7987398195665412, 'strategy': 'mean_reversion', 'time_stop': 108, 'use_sma': True, 'use_atr': False, 'use_adx': True, 'use_ema': True, 'use_spike': False, 'rsi_required': True, 'edge_k': 0.007951593916435629, 'edge_cap': 0.22886900496138862}.
[I 2025-08-29 16:55:24,678] Trial 82 finished with values: [-1000000000.0, 1000000000.0] and parameters: {'p_sma': 36, 'p_std': 8, 'p_atr': 19, 'p_adx': 16, 'rsi_period': 50, 'ema1': 14, 'ema2': 16, 'slip_atr_k': 0.1225001638594966, 'slip_spread_k': 0.7897516507088922, 'spread_hl_frac': 0.00012295159073496612, 'bb_std_mult': 3.3379946129393567, 'rsi_os': 27, 'rsi_ob': 48, 'vol_spike': 0.036406224874508314, 'adx_thresh': 28.850510177220162, 'atr_min_pct': 0.0017948314920978637, 'atr_max_pct': 0.06501910108159423, 'tp_mult': 2.1756967569685597, 'tsl_mult': 0.360247977661132, 'strategy': 'mean_reversion', 'time_stop': 95, 'use_sma': True, 'use_atr': True, 'use_adx': False, 'use_ema': False, 'use_spike': False, 'rsi_required': True, 'edge_k': 1.9626134106143844, 'edge_cap': 0.5121406253458773}.
[I 2025-08-29 16:55:51,750] Trial 84 finished with values: [-0.0062548269411801805, 0.0063206089679875566] and parameters: {'p_sma': 35, 'p_std': 47, 'p_atr': 16, 'p_adx': 10, 'rsi_period': 49, 'ema1': 14, 'ema2': 16, 'slip_atr_k': 0.11793698851894903, 'slip_spread_k': 0.4333243701264738, 'spread_hl_frac': 0.002137146628860656, 'bb_std_mult': 0.8268722549435744, 'rsi_os': 27, 'rsi_ob': 88, 'vol_spike': 0.28096799059346456, 'adx_thresh': 16.650949237664694, 'atr_min_pct': 0.0017947884020033745, 'atr_max_pct': 0.06789831789545055, 'tp_mult': 2.18375956069252, 'tsl_mult': 0.8669752995516096, 'strategy': 'breakout', 'time_stop': 95, 'use_sma': True, 'use_atr': False, 'use_adx': False, 'use_ema': False, 'use_spike': False, 'rsi_required': True, 'edge_k': 0.08372991505883269, 'edge_cap': 0.22162051440604633}.
[I 2025-08-29 16:55:52,231] Trial 83 finished with values: [-0.035982625442319116, 0.03602673838211888] and parameters: {'p_sma': 36, 'p_std': 9, 'p_atr': 8, 'p_adx': 16, 'rsi_period': 35, 'ema1': 22, 'ema2': 16, 'slip_atr_k': 0.11652707974362084, 'slip_spread_k': 0.7940204396660147, 'spread_hl_frac': 0.0014715040950987492, 'bb_std_mult': 0.6707641492048961, 'rsi_os': 45, 'rsi_ob': 87, 'vol_spike': 0.03414693962646742, 'adx_thresh': 17.293049586173204, 'atr_min_pct': 0.0016864050709204832, 'atr_max_pct': 0.0647309629819315, 'tp_mult': 2.1726575069995624, 'tsl_mult': 0.272870324467151, 'strategy': 'breakout', 'time_stop': 262, 'use_sma': True, 'use_atr': False, 'use_adx': False, 'use_ema': False, 'use_spike': False, 'rsi_required': False, 'edge_k': 0.11508905286958854, 'edge_cap': 0.7011404300297287}.
[I 2025-08-29 16:55:52,243] Trial 85 finished with values: [-0.03641943883976584, 0.0363983546628286] and parameters: {'p_sma': 35, 'p_std': 47, 'p_atr': 8, 'p_adx': 10, 'rsi_period': 17, 'ema1': 18, 'ema2': 40, 'slip_atr_k': 0.1800408742014203, 'slip_spread_k': 0.053609116755334585, 'spread_hl_frac': 0.002273753405310462, 'bb_std_mult': 0.8497827584048511, 'rsi_os': 46, 'rsi_ob': 87, 'vol_spike': 0.03738629143176783, 'adx_thresh': 16.550760271455815, 'atr_min_pct': 0.0017260239514619192, 'atr_max_pct': 0.06675482749956238, 'tp_mult': 2.889216581270107, 'tsl_mult': 0.8618834642376807, 'strategy': 'breakout', 'time_stop': 95, 'use_sma': True, 'use_atr': False, 'use_adx': False, 'use_ema': False, 'use_spike': False, 'rsi_required': False, 'edge_k': 1.9406557878298667, 'edge_cap': 0.5239557565786134}.
[I 2025-08-29 16:55:52,375] Trial 86 finished with values: [-0.0072436381432693375, 0.007251065688704636] and parameters: {'p_sma': 35, 'p_std': 47, 'p_atr': 8, 'p_adx': 10, 'rsi_period': 49, 'ema1': 30, 'ema2': 14, 'slip_atr_k': 0.1812604667332533, 'slip_spread_k': 0.041413387075005026, 'spread_hl_frac': 0.002226000330209624, 'bb_std_mult': 0.826282990129388, 'rsi_os': 12, 'rsi_ob': 87, 'vol_spike': 0.19516964368979162, 'adx_thresh': 16.706536705732116, 'atr_min_pct': 0.000405270204986442, 'atr_max_pct': 0.07635402005051177, 'tp_mult': 2.511517487612616, 'tsl_mult': 0.5165256096329923, 'strategy': 'breakout', 'time_stop': 154, 'use_sma': True, 'use_atr': False, 'use_adx': False, 'use_ema': False, 'use_spike': False, 'rsi_required': False, 'edge_k': 0.7435040490032135, 'edge_cap': 0.26446721273222934}.
[I 2025-08-29 16:56:19,549] Trial 88 finished with values: [-1000000000.0, 1000000000.0] and parameters: {'p_sma': 8, 'p_std': 46, 'p_atr': 16, 'p_adx': 10, 'rsi_period': 44, 'ema1': 16, 'ema2': 13, 'slip_atr_k': 0.1705352543232718, 'slip_spread_k': 0.4973176744126884, 'spread_hl_frac': 0.002918002166173427, 'bb_std_mult': 0.8424324575195978, 'rsi_os': 20, 'rsi_ob': 90, 'vol_spike': 0.13767108008609655, 'adx_thresh': 10.002268836421983, 'atr_min_pct': 0.022191107274423007, 'atr_max_pct': 0.0765044953010298, 'tp_mult': 2.4952714093445216, 'tsl_mult': 0.5084538958310756, 'strategy': 'breakout', 'time_stop': 155, 'use_sma': False, 'use_atr': False, 'use_adx': False, 'use_ema': False, 'use_spike': False, 'rsi_required': True, 'edge_k': 0.9151034679959891, 'edge_cap': 0.26900301825769024}.
[I 2025-08-29 16:56:20,079] Trial 89 finished with values: [-1000000000.0, 1000000000.0] and parameters: {'p_sma': 8, 'p_std': 43, 'p_atr': 16, 'p_adx': 13, 'rsi_period': 45, 'ema1': 16, 'ema2': 58, 'slip_atr_k': 0.1361764894208074, 'slip_spread_k': 0.5102675508379352, 'spread_hl_frac': 0.002905690851814749, 'bb_std_mult': 2.5650764874617393, 'rsi_os': 14, 'rsi_ob': 90, 'vol_spike': 0.13857767659283454, 'adx_thresh': 13.721604840447956, 'atr_min_pct': 0.022549772070362926, 'atr_max_pct': 0.09023988241049763, 'tp_mult': 2.3071765217255384, 'tsl_mult': 0.4566540798496618, 'strategy': 'breakout', 'time_stop': 156, 'use_sma': False, 'use_atr': False, 'use_adx': False, 'use_ema': False, 'use_spike': False, 'rsi_required': True, 'edge_k': 0.7204384297388551, 'edge_cap': 0.26885942460744666}.
[I 2025-08-29 16:56:20,329] Trial 90 finished with values: [-1000000000.0, 1000000000.0] and parameters: {'p_sma': 32, 'p_std': 43, 'p_atr': 16, 'p_adx': 14, 'rsi_period': 45, 'ema1': 16, 'ema2': 13, 'slip_atr_k': 0.16047583223896444, 'slip_spread_k': 0.5127868162387024, 'spread_hl_frac': 0.0032227227400541424, 'bb_std_mult': 2.550417118066946, 'rsi_os': 19, 'rsi_ob': 90, 'vol_spike': 0.13772084758785605, 'adx_thresh': 33.00269978772247, 'atr_min_pct': 0.022043713414507837, 'atr_max_pct': 0.08951125591847156, 'tp_mult': 2.2939266677378454, 'tsl_mult': 0.9242083012100145, 'strategy': 'breakout', 'time_stop': 292, 'use_sma': False, 'use_atr': False, 'use_adx': False, 'use_ema': False, 'use_spike': False, 'rsi_required': True, 'edge_k': 0.9016397503549967, 'edge_cap': 0.3081626542400294}.
[I 2025-08-29 16:56:20,565] Trial 87 finished with values: [-1000000000.0, 1000000000.0] and parameters: {'p_sma': 35, 'p_std': 47, 'p_atr': 16, 'p_adx': 13, 'rsi_period': 16, 'ema1': 16, 'ema2': 14, 'slip_atr_k': 0.13426337265325033, 'slip_spread_k': 0.4319985001245936, 'spread_hl_frac': 0.0022077220615061496, 'bb_std_mult': 0.646968315029856, 'rsi_os': 46, 'rsi_ob': 90, 'vol_spike': 0.0924215795595972, 'adx_thresh': 10.126017180129235, 'atr_min_pct': 0.013216622473802892, 'atr_max_pct': 0.09074719232466905, 'tp_mult': 2.88150435113901, 'tsl_mult': 0.8596740402508234, 'strategy': 'breakout', 'time_stop': 257, 'use_sma': True, 'use_atr': False, 'use_adx': False, 'use_ema': False, 'use_spike': False, 'rsi_required': False, 'edge_k': 0.09113754859748681, 'edge_cap': 0.2663842571872469}.
[I 2025-08-29 16:56:48,724] Trial 91 finished with values: [-1000000000.0, 1000000000.0] and parameters: {'p_sma': 32, 'p_std': 43, 'p_atr': 16, 'p_adx': 13, 'rsi_period': 23, 'ema1': 19, 'ema2': 13, 'slip_atr_k': 0.23689385010384956, 'slip_spread_k': 0.42317377707604564, 'spread_hl_frac': 0.00030657509687851477, 'bb_std_mult': 1.1593887765473079, 'rsi_os': 14, 'rsi_ob': 89, 'vol_spike': 0.23664255881235985, 'adx_thresh': 22.34809797154534, 'atr_min_pct': 0.024676328517053238, 'atr_max_pct': 0.07251650631480093, 'tp_mult': 2.024550430614042, 'tsl_mult': 0.45192932433286215, 'strategy': 'breakout', 'time_stop': 199, 'use_sma': True, 'use_atr': True, 'use_adx': True, 'use_ema': False, 'use_spike': False, 'rsi_required': True, 'edge_k': 0.074168812073977, 'edge_cap': 0.32065262353684376}.
[I 2025-08-29 16:56:49,150] Trial 92 finished with values: [-1000000000.0, 1000000000.0] and parameters: {'p_sma': 31, 'p_std': 48, 'p_atr': 10, 'p_adx': 12, 'rsi_period': 73, 'ema1': 5, 'ema2': 11, 'slip_atr_k': 0.0069704279158759735, 'slip_spread_k': 0.42858935552477184, 'spread_hl_frac': 8.205880770254817e-05, 'bb_std_mult': 1.0064029958406433, 'rsi_os': 27, 'rsi_ob': 92, 'vol_spike': 0.09803998048745245, 'adx_thresh': 22.117913642381456, 'atr_min_pct': 0.013313482648863714, 'atr_max_pct': 0.06976321424001965, 'tp_mult': 2.773145862365175, 'tsl_mult': 0.9219957407228768, 'strategy': 'breakout', 'time_stop': 130, 'use_sma': True, 'use_atr': True, 'use_adx': True, 'use_ema': False, 'use_spike': True, 'rsi_required': True, 'edge_k': 1.2139139852236092, 'edge_cap': 0.3130779859844667}.
[I 2025-08-29 16:56:49,661] Trial 93 finished with values: [-1000000000.0, 1000000000.0] and parameters: {'p_sma': 28, 'p_std': 39, 'p_atr': 10, 'p_adx': 12, 'rsi_period': 40, 'ema1': 21, 'ema2': 11, 'slip_atr_k': 0.0067295203049514115, 'slip_spread_k': 0.40536939242324155, 'spread_hl_frac': 0.00048444948466290613, 'bb_std_mult': 0.9898047716648868, 'rsi_os': 27, 'rsi_ob': 93, 'vol_spike': 0.0925179666990972, 'adx_thresh': 22.19725500163916, 'atr_min_pct': 0.012619031512200826, 'atr_max_pct': 0.0717929401090871, 'tp_mult': 2.776342703369121, 'tsl_mult': 0.9678169994995377, 'strategy': 'mean_reversion', 'time_stop': 130, 'use_sma': True, 'use_atr': True, 'use_adx': True, 'use_ema': True, 'use_spike': True, 'rsi_required': True, 'edge_k': 1.2028609922064166, 'edge_cap': 0.2262644214217101}.
[I 2025-08-29 16:56:49,775] Trial 94 finished with values: [-1000000000.0, 1000000000.0] and parameters: {'p_sma': 28, 'p_std': 39, 'p_atr': 15, 'p_adx': 12, 'rsi_period': 40, 'ema1': 19, 'ema2': 11, 'slip_atr_k': 0.00736360155073576, 'slip_spread_k': 0.41105430755275124, 'spread_hl_frac': 0.0005991267575044721, 'bb_std_mult': 1.026794326413206, 'rsi_os': 49, 'rsi_ob': 92, 'vol_spike': 0.23497606972021523, 'adx_thresh': 22.438620253189104, 'atr_min_pct': 0.00015287453182183996, 'atr_max_pct': 0.0713158145813715, 'tp_mult': 2.576979410251707, 'tsl_mult': 0.9626200232068772, 'strategy': 'mean_reversion', 'time_stop': 130, 'use_sma': True, 'use_atr': True, 'use_adx': True, 'use_ema': True, 'use_spike': True, 'rsi_required': True, 'edge_k': 0.0756927603193287, 'edge_cap': 0.4257130957399424}.
[I 2025-08-29 16:57:18,330] Trial 98 finished with values: [-1000000000.0, 1000000000.0] and parameters: {'p_sma': 25, 'p_std': 44, 'p_atr': 18, 'p_adx': 27, 'rsi_period': 53, 'ema1': 26, 'ema2': 17, 'slip_atr_k': 0.0161295354912112, 'slip_spread_k': 0.47441365671976937, 'spread_hl_frac': 0.005248882272072676, 'bb_std_mult': 2.7688579434405067, 'rsi_os': 16, 'rsi_ob': 83, 'vol_spike': 0.11565234503711325, 'adx_thresh': 11.976657092345649, 'atr_min_pct': 0.008571372746692313, 'atr_max_pct': 0.08486104962723783, 'tp_mult': 2.6659853476986632, 'tsl_mult': 0.6486989364587374, 'strategy': 'breakout', 'time_stop': 121, 'use_sma': True, 'use_atr': False, 'use_adx': False, 'use_ema': False, 'use_spike': False, 'rsi_required': False, 'edge_k': 1.824920242187971, 'edge_cap': 0.3644539970239027}.
[I 2025-08-29 16:57:19,665] Trial 96 finished with values: [-1000000000.0, 1000000000.0] and parameters: {'p_sma': 29, 'p_std': 20, 'p_atr': 15, 'p_adx': 7, 'rsi_period': 54, 'ema1': 21, 'ema2': 11, 'slip_atr_k': 0.2176528025300865, 'slip_spread_k': 0.4817336116691985, 'spread_hl_frac': 0.005120988827127085, 'bb_std_mult': 0.9189150443596836, 'rsi_os': 41, 'rsi_ob': 83, 'vol_spike': 0.1172533808306746, 'adx_thresh': 12.3411609089135, 'atr_min_pct': 0.019638939644556777, 'atr_max_pct': 0.08230522056713181, 'tp_mult': 2.396918788896166, 'tsl_mult': 0.9804937805034377, 'strategy': 'mean_reversion', 'time_stop': 123, 'use_sma': True, 'use_atr': False, 'use_adx': False, 'use_ema': True, 'use_spike': True, 'rsi_required': True, 'edge_k': 0.26378476538428686, 'edge_cap': 0.42408100635850715}.
[I 2025-08-29 16:57:19,778] Trial 97 finished with values: [-1000000000.0, 1000000000.0] and parameters: {'p_sma': 53, 'p_std': 20, 'p_atr': 15, 'p_adx': 29, 'rsi_period': 30, 'ema1': 18, 'ema2': 11, 'slip_atr_k': 0.014527515016938983, 'slip_spread_k': 0.46711119583180505, 'spread_hl_frac': 0.005111868737308238, 'bb_std_mult': 3.4849114832004977, 'rsi_os': 49, 'rsi_ob': 88, 'vol_spike': 0.11388504370665141, 'adx_thresh': 14.764194666064618, 'atr_min_pct': 3.800592032213404e-05, 'atr_max_pct': 0.08278186002715908, 'tp_mult': 2.4164564324075872, 'tsl_mult': 0.6890562951957664, 'strategy': 'mean_reversion', 'time_stop': 28, 'use_sma': True, 'use_atr': False, 'use_adx': False, 'use_ema': True, 'use_spike': False, 'rsi_required': False, 'edge_k': 0.2638629370495556, 'edge_cap': 0.41817672328856903}.
[I 2025-08-29 16:57:19,926] Trial 95 finished with values: [-1000000000.0, 1000000000.0] and parameters: {'p_sma': 28, 'p_std': 39, 'p_atr': 15, 'p_adx': 29, 'rsi_period': 53, 'ema1': 5, 'ema2': 11, 'slip_atr_k': 0.005542531005151292, 'slip_spread_k': 0.469874475821863, 'spread_hl_frac': 0.005200503972184383, 'bb_std_mult': 1.0174829958861695, 'rsi_os': 26, 'rsi_ob': 93, 'vol_spike': 0.1211944191625346, 'adx_thresh': 12.249607145922997, 'atr_min_pct': 7.447216468085886e-06, 'atr_max_pct': 0.08469953930467204, 'tp_mult': 1.935144333775991, 'tsl_mult': 0.9676214737487128, 'strategy': 'mean_reversion', 'time_stop': 127, 'use_sma': True, 'use_atr': True, 'use_adx': True, 'use_ema': True, 'use_spike': True, 'rsi_required': True, 'edge_k': 1.2055399898389498, 'edge_cap': 0.22117010525498243}.
[I 2025-08-29 16:57:47,541] Trial 99 finished with values: [-1000000000.0, 1000000000.0] and parameters: {'p_sma': 47, 'p_std': 49, 'p_atr': 15, 'p_adx': 22, 'rsi_period': 56, 'ema1': 23, 'ema2': 15, 'slip_atr_k': 0.012907838272087486, 'slip_spread_k': 0.5364860468478666, 'spread_hl_frac': 0.004302021042670668, 'bb_std_mult': 0.6930490624204926, 'rsi_os': 33, 'rsi_ob': 60, 'vol_spike': 0.1155474227863431, 'adx_thresh': 29.896346765350334, 'atr_min_pct': 0.019995743631831587, 'atr_max_pct': 0.0817543882192705, 'tp_mult': 2.1269828713433148, 'tsl_mult': 0.7192533670011373, 'strategy': 'breakout', 'time_stop': 47, 'use_sma': False, 'use_atr': False, 'use_adx': False, 'use_ema': False, 'use_spike': False, 'rsi_required': True, 'edge_k': 0.13856531792697604, 'edge_cap': 0.1937559723067449}.
[I 2025-08-29 16:57:48,280] Trial 100 finished with values: [-1000000000.0, 1000000000.0] and parameters: {'p_sma': 23, 'p_std': 49, 'p_atr': 21, 'p_adx': 23, 'rsi_period': 56, 'ema1': 23, 'ema2': 31, 'slip_atr_k': 0.015561609487166003, 'slip_spread_k': 0.5301263965550815, 'spread_hl_frac': 0.03296790441834725, 'bb_std_mult': 0.6821686821968116, 'rsi_os': 21, 'rsi_ob': 88, 'vol_spike': 0.07467661885761559, 'adx_thresh': 29.933791019250368, 'atr_min_pct': 0.010575666426298428, 'atr_max_pct': 0.08722692899175506, 'tp_mult': 1.1563704294096906, 'tsl_mult': 0.7226960792061176, 'strategy': 'breakout', 'time_stop': 52, 'use_sma': False, 'use_atr': False, 'use_adx': False, 'use_ema': False, 'use_spike': False, 'rsi_required': False, 'edge_k': 0.16357582529030185, 'edge_cap': 0.19992329548440774}.
[I 2025-08-29 16:57:48,505] Trial 101 finished with values: [-1000000000.0, 1000000000.0] and parameters: {'p_sma': 5, 'p_std': 50, 'p_atr': 21, 'p_adx': 18, 'rsi_period': 56, 'ema1': 11, 'ema2': 44, 'slip_atr_k': 0.03975670298314109, 'slip_spread_k': 0.5276161601806478, 'spread_hl_frac': 0.023316975758601054, 'bb_std_mult': 2.1671940434158095, 'rsi_os': 55, 'rsi_ob': 85, 'vol_spike': 0.2771429502758623, 'adx_thresh': 6.181206669614495, 'atr_min_pct': 0.014585278309638332, 'atr_max_pct': 0.09669846262882877, 'tp_mult': 2.1324076757270936, 'tsl_mult': 0.5848026686347287, 'strategy': 'breakout', 'time_stop': 46, 'use_sma': False, 'use_atr': False, 'use_adx': False, 'use_ema': False, 'use_spike': False, 'rsi_required': True, 'edge_k': 1.025805609826816, 'edge_cap': 0.1869574933002287}.
[I 2025-08-29 16:57:48,633] Trial 102 finished with values: [-1000000000.0, 1000000000.0] and parameters: {'p_sma': 12, 'p_std': 50, 'p_atr': 21, 'p_adx': 18, 'rsi_period': 60, 'ema1': 24, 'ema2': 31, 'slip_atr_k': 0.061344511725369644, 'slip_spread_k': 0.5359201671651805, 'spread_hl_frac': 0.023572350478888913, 'bb_std_mult': 2.1896617990840714, 'rsi_os': 22, 'rsi_ob': 60, 'vol_spike': 0.07676755217730011, 'adx_thresh': 27.07461635329974, 'atr_min_pct': 0.01602963712866691, 'atr_max_pct': 0.09485932562359989, 'tp_mult': 1.1467031229707296, 'tsl_mult': 0.602425342095302, 'strategy': 'breakout', 'time_stop': 282, 'use_sma': False, 'use_atr': False, 'use_adx': False, 'use_ema': False, 'use_spike': False, 'rsi_required': True, 'edge_k': 0.14212970822964247, 'edge_cap': 0.18625359605636616}.
[I 2025-08-29 16:58:15,812] Trial 103 finished with values: [-1000000000.0, 1000000000.0] and parameters: {'p_sma': 11, 'p_std': 46, 'p_atr': 24, 'p_adx': 18, 'rsi_period': 67, 'ema1': 11, 'ema2': 31, 'slip_atr_k': 0.10934014886769193, 'slip_spread_k': 0.3482775776808583, 'spread_hl_frac': 0.0013365809281759148, 'bb_std_mult': 3.0568255281889534, 'rsi_os': 37, 'rsi_ob': 46, 'vol_spike': 0.2799734197523178, 'adx_thresh': 27.162348686880883, 'atr_min_pct': 0.006585723411134925, 'atr_max_pct': 0.09427911202000498, 'tp_mult': 1.0898579020327428, 'tsl_mult': 0.6093628244884021, 'strategy': 'breakout', 'time_stop': 171, 'use_sma': False, 'use_atr': False, 'use_adx': False, 'use_ema': False, 'use_spike': False, 'rsi_required': False, 'edge_k': 1.317180594962173, 'edge_cap': 0.9770519314063009}.
[I 2025-08-29 16:58:15,867] Trial 106 finished with values: [-0.01730512615105384, 0.01728654810826075] and parameters: {'p_sma': 57, 'p_std': 46, 'p_atr': 17, 'p_adx': 10, 'rsi_period': 48, 'ema1': 30, 'ema2': 41, 'slip_atr_k': 0.10613958468672208, 'slip_spread_k': 0.3367344442589214, 'spread_hl_frac': 0.0015442279000374424, 'bb_std_mult': 0.7881706261522007, 'rsi_os': 36, 'rsi_ob': 87, 'vol_spike': 0.19418254125540935, 'adx_thresh': 13.720177352248824, 'atr_min_pct': 0.0012004658606560015, 'atr_max_pct': 0.05618806727868797, 'tp_mult': 2.5149094251994883, 'tsl_mult': 0.7647811093442054, 'strategy': 'breakout', 'time_stop': 208, 'use_sma': True, 'use_atr': False, 'use_adx': False, 'use_ema': False, 'use_spike': False, 'rsi_required': False, 'edge_k': 0.6609046076751608, 'edge_cap': 0.8576530210868283}.
[I 2025-08-29 16:58:16,124] Trial 104 finished with values: [-0.005997963508651227, 0.0059856766383205185] and parameters: {'p_sma': 30, 'p_std': 46, 'p_atr': 17, 'p_adx': 18, 'rsi_period': 48, 'ema1': 30, 'ema2': 52, 'slip_atr_k': 0.10429015242704923, 'slip_spread_k': 0.3492089387411922, 'spread_hl_frac': 0.001713305608897354, 'bb_std_mult': 0.7950321895695639, 'rsi_os': 11, 'rsi_ob': 87, 'vol_spike': 0.2762346312160171, 'adx_thresh': 13.627055799203676, 'atr_min_pct': 0.0009744935465579481, 'atr_max_pct': 0.07764451734945138, 'tp_mult': 2.5169912584632574, 'tsl_mult': 0.6160358368762553, 'strategy': 'breakout', 'time_stop': 279, 'use_sma': True, 'use_atr': False, 'use_adx': False, 'use_ema': False, 'use_spike': False, 'rsi_required': True, 'edge_k': 1.059466835202679, 'edge_cap': 0.7729978072901723}.
[I 2025-08-29 16:58:16,208] Trial 105 finished with values: [-0.02154513625420773, 0.021571940221209656] and parameters: {'p_sma': 34, 'p_std': 46, 'p_atr': 17, 'p_adx': 10, 'rsi_period': 48, 'ema1': 18, 'ema2': 40, 'slip_atr_k': 0.18257623156015082, 'slip_spread_k': 0.3423254928134558, 'spread_hl_frac': 0.0015257004838792516, 'bb_std_mult': 0.796914338044938, 'rsi_os': 37, 'rsi_ob': 87, 'vol_spike': 0.20137036972365538, 'adx_thresh': 27.02829943882284, 'atr_min_pct': 0.0011024725161554534, 'atr_max_pct': 0.07787671491084448, 'tp_mult': 1.6803114568390471, 'tsl_mult': 0.7523076433930243, 'strategy': 'breakout', 'time_stop': 275, 'use_sma': True, 'use_atr': False, 'use_adx': False, 'use_ema': False, 'use_spike': False, 'rsi_required': False, 'edge_k': 0.7011439754985989, 'edge_cap': 0.8053860812844897}.
[I 2025-08-29 16:58:43,289] Trial 109 finished with values: [-1000000000.0, 1000000000.0] and parameters: {'p_sma': 30, 'p_std': 23, 'p_atr': 17, 'p_adx': 14, 'rsi_period': 51, 'ema1': 9, 'ema2': 12, 'slip_atr_k': 0.15207786562855807, 'slip_spread_k': 0.45253982179679164, 'spread_hl_frac': 0.04272267365328138, 'bb_std_mult': 1.1374995825894691, 'rsi_os': 18, 'rsi_ob': 52, 'vol_spike': 0.151682758280251, 'adx_thresh': 24.51847272820665, 'atr_min_pct': 0.0022054203221313915, 'atr_max_pct': 0.07819814722056226, 'tp_mult': 1.2507605123370364, 'tsl_mult': 0.0057745959412510706, 'strategy': 'breakout', 'time_stop': 144, 'use_sma': True, 'use_atr': False, 'use_adx': False, 'use_ema': False, 'use_spike': False, 'rsi_required': True, 'edge_k': 1.6751308936803384, 'edge_cap': 0.8148147889872267}.
