[I 2025-08-29 18:41:32,037] Trial 106 finished with values: [-1000000000.0, 1000000000.0] and parameters: {'p_sma': 35, 'p_std': 29, 'p_atr': 29, 'p_adx': 14, 'rsi_period': 48, 'ema1': 29, 'ema2': 19, 'slip_atr_k': 0.00364333114496947, 'slip_spread_k': 0.39881465501836033, 'spread_hl_frac': 0.023140230670366888, 'bb_std_mult': 1.4629675304312297, 'rsi_os': 37, 'rsi_ob': 69, 'vol_spike': 0.10322835107840625, 'adx_thresh': 17.178734268942243, 'atr_min_pct': 0.0021979583999266173, 'atr_max_pct': 0.08009575736349994, 'tp_mult': 2.5845543950225527, 'tsl_mult': 0.3857802667344679, 'strategy': 'mean_reversion', 'time_stop': 268, 'use_sma': True, 'use_atr': False, 'use_adx': False, 'use_ema': True, 'use_spike': True, 'rsi_required': False, 'edge_k': 1.5961652092627157, 'edge_cap': 0.7758846058213156}.
[I 2025-08-29 18:41:32,309] Trial 109 finished with values: [-1000000000.0, 1000000000.0] and parameters: {'p_sma': 21, 'p_std': 12, 'p_atr': 15, 'p_adx': 30, 'rsi_period': 81, 'ema1': 10, 'ema2': 56, 'slip_atr_k': 0.08683555896751817, 'slip_spread_k': 0.6380174092024153, 'spread_hl_frac': 0.023403767695535486, 'bb_std_mult': 1.7423724400045069, 'rsi_os': 38, 'rsi_ob': 69, 'vol_spike': 0.2381255809800875, 'adx_thresh': 28.712394308152597, 'atr_min_pct': 0.01953223301004609, 'atr_max_pct': 0.12422168393038252, 'tp_mult': 1.8869712208096914, 'tsl_mult': 0.5920367673718204, 'strategy': 'mean_reversion', 'time_stop': 183, 'use_sma': True, 'use_atr': False, 'use_adx': True, 'use_ema': True, 'use_spike': True, 'rsi_required': False, 'edge_k': 0.5640658988751044, 'edge_cap': 0.7928679022600023}.
[I 2025-08-29 18:41:32,387] Trial 111 finished with values: [-1000000000.0, 1000000000.0] and parameters: {'p_sma': 21, 'p_std': 9, 'p_atr': 15, 'p_adx': 11, 'rsi_period': 63, 'ema1': 5, 'ema2': 21, 'slip_atr_k': 0.0934239750356202, 'slip_spread_k': 0.39641530753410253, 'spread_hl_frac': 0.02309874309069732, 'bb_std_mult': 1.5566503044979076, 'rsi_os': 38, 'rsi_ob': 45, 'vol_spike': 0.23480858596093362, 'adx_thresh': 28.634184566072697, 'atr_min_pct': 0.013975267974115841, 'atr_max_pct': 0.010038115272446746, 'tp_mult': 1.3255423181092678, 'tsl_mult': 0.46296218480745954, 'strategy': 'mean_reversion', 'time_stop': 238, 'use_sma': True, 'use_atr': False, 'use_adx': True, 'use_ema': True, 'use_spike': False, 'rsi_required': False, 'edge_k': 0.545673881305369, 'edge_cap': 0.6777111123271317}.
[I 2025-08-29 18:42:00,830] Trial 110 finished with values: [-1000000000.0, 1000000000.0] and parameters: {'p_sma': 29, 'p_std': 29, 'p_atr': 27, 'p_adx': 10, 'rsi_period': 81, 'ema1': 5, 'ema2': 56, 'slip_atr_k': 0.09061775303721777, 'slip_spread_k': 0.13645845810903445, 'spread_hl_frac': 0.007540252313037172, 'bb_std_mult': 1.558995291258218, 'rsi_os': 41, 'rsi_ob': 64, 'vol_spike': 0.02684406918917015, 'adx_thresh': 16.977069413963292, 'atr_min_pct': 0.0025049254320645893, 'atr_max_pct': 0.06845421129085633, 'tp_mult': 1.916831954384304, 'tsl_mult': 0.5949416210276784, 'strategy': 'mean_reversion', 'time_stop': 185, 'use_sma': True, 'use_atr': False, 'use_adx': False, 'use_ema': True, 'use_spike': True, 'rsi_required': False, 'edge_k': 0.5527397616704008, 'edge_cap': 0.8043887699949581}.
[I 2025-08-29 18:42:01,321] Trial 113 finished with values: [-1000000000.0, 1000000000.0] and parameters: {'p_sma': 29, 'p_std': 9, 'p_atr': 27, 'p_adx': 20, 'rsi_period': 31, 'ema1': 14, 'ema2': 23, 'slip_atr_k': 0.03377855010608183, 'slip_spread_k': 0.1424295987317173, 'spread_hl_frac': 0.0350720773944577, 'bb_std_mult': 1.5888631651316032, 'rsi_os': 42, 'rsi_ob': 64, 'vol_spike': 0.0659764519294943, 'adx_thresh': 11.962827352404439, 'atr_min_pct': 0.014327212044120978, 'atr_max_pct': 0.06969454529689909, 'tp_mult': 1.535424542067755, 'tsl_mult': 0.4628855925564698, 'strategy': 'mean_reversion', 'time_stop': 101, 'use_sma': True, 'use_atr': True, 'use_adx': True, 'use_ema': True, 'use_spike': False, 'rsi_required': False, 'edge_k': 0.8907068878959843, 'edge_cap': 0.3138352061372752}.
[I 2025-08-29 18:42:01,505] Trial 112 finished with values: [-1000000000.0, 1000000000.0] and parameters: {'p_sma': 20, 'p_std': 12, 'p_atr': 27, 'p_adx': 13, 'rsi_period': 15, 'ema1': 10, 'ema2': 54, 'slip_atr_k': 0.034500619938485994, 'slip_spread_k': 0.17525331043482495, 'spread_hl_frac': 0.035242906875814654, 'bb_std_mult': 1.5365449641611815, 'rsi_os': 40, 'rsi_ob': 65, 'vol_spike': 0.06357224102884217, 'adx_thresh': 23.930646293908804, 'atr_min_pct': 0.014122786918877568, 'atr_max_pct': 0.06838121631231878, 'tp_mult': 1.750059242328639, 'tsl_mult': 0.45721765248075513, 'strategy': 'mean_reversion', 'time_stop': 240, 'use_sma': True, 'use_atr': False, 'use_adx': True, 'use_ema': True, 'use_spike': False, 'rsi_required': False, 'edge_k': 0.5459017645268964, 'edge_cap': 0.803474862675023}.
[I 2025-08-29 18:42:01,505] Trial 114 finished with values: [-1000000000.0, 1000000000.0] and parameters: {'p_sma': 12, 'p_std': 12, 'p_atr': 16, 'p_adx': 13, 'rsi_period': 41, 'ema1': 14, 'ema2': 23, 'slip_atr_k': 0.03554572688376012, 'slip_spread_k': 0.7813025478845459, 'spread_hl_frac': 0.034102006174635595, 'bb_std_mult': 2.3235197855683727, 'rsi_os': 41, 'rsi_ob': 64, 'vol_spike': 0.20973620202685125, 'adx_thresh': 13.382558629061798, 'atr_min_pct': 0.011322279818264102, 'atr_max_pct': 0.06888941229206921, 'tp_mult': 1.537800142763757, 'tsl_mult': 0.7602618737708523, 'strategy': 'mean_reversion', 'time_stop': 246, 'use_sma': True, 'use_atr': True, 'use_adx': True, 'use_ema': True, 'use_spike': False, 'rsi_required': False, 'edge_k': 1.0376347797744665, 'edge_cap': 0.3216486915016613}.
[I 2025-08-29 18:42:01,630] Trial 115 finished with values: [-1000000000.0, 1000000000.0] and parameters: {'p_sma': 15, 'p_std': 9, 'p_atr': 26, 'p_adx': 13, 'rsi_period': 41, 'ema1': 21, 'ema2': 46, 'slip_atr_k': 0.02305950813415104, 'slip_spread_k': 0.8504169118568833, 'spread_hl_frac': 0.036115739894648086, 'bb_std_mult': 2.6807678121000293, 'rsi_os': 54, 'rsi_ob': 71, 'vol_spike': 0.21175231105675482, 'adx_thresh': 23.8736412308049, 'atr_min_pct': 0.003982032093025471, 'atr_max_pct': 0.06104166369459356, 'tp_mult': 1.531797635318365, 'tsl_mult': 0.6502555632701031, 'strategy': 'mean_reversion', 'time_stop': 54, 'use_sma': True, 'use_atr': True, 'use_adx': True, 'use_ema': False, 'use_spike': False, 'rsi_required': False, 'edge_k': 0.4520895048803272, 'edge_cap': 0.4522786482419177}.
[I 2025-08-29 18:42:29,142] Trial 119 finished with values: [-1000000000.0, 1000000000.0] and parameters: {'p_sma': 50, 'p_std': 32, 'p_atr': 24, 'p_adx': 17, 'rsi_period': 22, 'ema1': 23, 'ema2': 30, 'slip_atr_k': 0.10829869912743094, 'slip_spread_k': 0.6975941139015922, 'spread_hl_frac': 0.006425730834066553, 'bb_std_mult': 1.3289840369540864, 'rsi_os': 29, 'rsi_ob': 93, 'vol_spike': 0.25095201066891987, 'adx_thresh': 33.79098703433709, 'atr_min_pct': 0.007325094676526795, 'atr_max_pct': 0.026697254336948972, 'tp_mult': 1.68551251237592, 'tsl_mult': 0.5508699425160477, 'strategy': 'breakout', 'time_stop': 277, 'use_sma': False, 'use_atr': False, 'use_adx': True, 'use_ema': False, 'use_spike': False, 'rsi_required': True, 'edge_k': 0.6545203670449768, 'edge_cap': 0.18529345668977587}.
[I 2025-08-29 18:42:29,142] Trial 116 finished with values: [-0.010554957639613338, 0.010659418706356507] and parameters: {'p_sma': 46, 'p_std': 13, 'p_atr': 26, 'p_adx': 13, 'rsi_period': 42, 'ema1': 16, 'ema2': 10, 'slip_atr_k': 0.20420930033337326, 'slip_spread_k': 0.9996032142555433, 'spread_hl_frac': 0.025411986725325, 'bb_std_mult': 2.4217103646643423, 'rsi_os': 31, 'rsi_ob': 71, 'vol_spike': 0.2081669809890063, 'adx_thresh': 21.507646638981445, 'atr_min_pct': 0.004182360458732803, 'atr_max_pct': 0.09176290089783323, 'tp_mult': 1.7777616011122948, 'tsl_mult': 0.748186511890931, 'strategy': 'breakout', 'time_stop': 172, 'use_sma': True, 'use_atr': False, 'use_adx': True, 'use_ema': False, 'use_spike': False, 'rsi_required': False, 'edge_k': 1.0111224359198463, 'edge_cap': 0.4657224666357713}.
[I 2025-08-29 18:42:29,242] Trial 118 finished with values: [-0.005217307408090899, 0.005258000609640559] and parameters: {'p_sma': 46, 'p_std': 26, 'p_atr': 26, 'p_adx': 24, 'rsi_period': 59, 'ema1': 23, 'ema2': 10, 'slip_atr_k': 0.20047165576776, 'slip_spread_k': 0.9107747690682697, 'spread_hl_frac': 0.03714802668668499, 'bb_std_mult': 2.669696274853132, 'rsi_os': 31, 'rsi_ob': 71, 'vol_spike': 0.11504552407257934, 'adx_thresh': 33.457470556176474, 'atr_min_pct': 0.0039246674415690935, 'atr_max_pct': 0.14262940084103665, 'tp_mult': 2.4630528049130693, 'tsl_mult': 0.029960419498234914, 'strategy': 'breakout', 'time_stop': 276, 'use_sma': False, 'use_atr': False, 'use_adx': True, 'use_ema': False, 'use_spike': False, 'rsi_required': True, 'edge_k': 0.660760169036053, 'edge_cap': 0.850512234207145}.
[I 2025-08-29 18:42:29,372] Trial 117 finished with values: [-0.012466088438755851, 0.01266744245064294] and parameters: {'p_sma': 50, 'p_std': 8, 'p_atr': 26, 'p_adx': 24, 'rsi_period': 21, 'ema1': 23, 'ema2': 10, 'slip_atr_k': 0.04421040181259343, 'slip_spread_k': 0.9734778938778248, 'spread_hl_frac': 0.025503973870214986, 'bb_std_mult': 2.7102715341500585, 'rsi_os': 31, 'rsi_ob': 71, 'vol_spike': 0.11923954986843609, 'adx_thresh': 21.750910940716462, 'atr_min_pct': 0.0036156540142845165, 'atr_max_pct': 0.09179685548524762, 'tp_mult': 2.481842978097479, 'tsl_mult': 0.3307319042491119, 'strategy': 'breakout', 'time_stop': 173, 'use_sma': False, 'use_atr': False, 'use_adx': True, 'use_ema': False, 'use_spike': False, 'rsi_required': True, 'edge_k': 0.44366433140322814, 'edge_cap': 0.2767792836223522}.
[I 2025-08-29 18:42:57,802] Trial 120 finished with values: [-0.0029665105304585992, 0.002968508984429577] and parameters: {'p_sma': 14, 'p_std': 5, 'p_atr': 28, 'p_adx': 24, 'rsi_period': 59, 'ema1': 11, 'ema2': 13, 'slip_atr_k': 0.014469169364763381, 'slip_spread_k': 0.9071747058938641, 'spread_hl_frac': 0.030128572369912277, 'bb_std_mult': 0.968387873107017, 'rsi_os': 27, 'rsi_ob': 52, 'vol_spike': 0.22136097956664672, 'adx_thresh': 18.47132503258476, 'atr_min_pct': 0.003326646994920947, 'atr_max_pct': 0.05296502560427038, 'tp_mult': 2.101483070706432, 'tsl_mult': 0.8582072599925579, 'strategy': 'mean_reversion', 'time_stop': 143, 'use_sma': False, 'use_atr': False, 'use_adx': False, 'use_ema': True, 'use_spike': False, 'rsi_required': True, 'edge_k': 1.3672818336714803, 'edge_cap': 0.7494373828155397}.
[I 2025-08-29 18:42:58,020] Trial 121 finished with values: [-1000000000.0, 1000000000.0] and parameters: {'p_sma': 14, 'p_std': 5, 'p_atr': 28, 'p_adx': 24, 'rsi_period': 29, 'ema1': 11, 'ema2': 17, 'slip_atr_k': 0.04376428755230879, 'slip_spread_k': 0.8330297211915221, 'spread_hl_frac': 0.042080857886229825, 'bb_std_mult': 0.8651485203121438, 'rsi_os': 20, 'rsi_ob': 66, 'vol_spike': 0.05149074736365346, 'adx_thresh': 27.2506749940963, 'atr_min_pct': 0.003502366169462056, 'atr_max_pct': 0.14651492871976218, 'tp_mult': 2.461018896181245, 'tsl_mult': 0.3261342128971234, 'strategy': 'mean_reversion', 'time_stop': 166, 'use_sma': False, 'use_atr': False, 'use_adx': False, 'use_ema': True, 'use_spike': False, 'rsi_required': True, 'edge_k': 1.1676245220644417, 'edge_cap': 0.3896181818968093}.
[I 2025-08-29 18:42:58,032] Trial 122 finished with values: [-1000000000.0, 1000000000.0] and parameters: {'p_sma': 5, 'p_std': 5, 'p_atr': 28, 'p_adx': 24, 'rsi_period': 33, 'ema1': 11, 'ema2': 17, 'slip_atr_k': 0.01263915750365667, 'slip_spread_k': 0.5476485661235151, 'spread_hl_frac': 0.01012974459137738, 'bb_std_mult': 0.811296292894446, 'rsi_os': 27, 'rsi_ob': 86, 'vol_spike': 0.04846037400586471, 'adx_thresh': 5.681164942402415, 'atr_min_pct': 0.02334013486066272, 'atr_max_pct': 0.03881319920959307, 'tp_mult': 2.181780994329185, 'tsl_mult': 0.8106562538826392, 'strategy': 'mean_reversion', 'time_stop': 86, 'use_sma': False, 'use_atr': False, 'use_adx': False, 'use_ema': True, 'use_spike': False, 'rsi_required': True, 'edge_k': 1.37838100474734, 'edge_cap': 0.4176301374015046}.
[I 2025-08-29 18:42:58,180] Trial 123 finished with values: [-1000000000.0, 1000000000.0] and parameters: {'p_sma': 5, 'p_std': 5, 'p_atr': 28, 'p_adx': 21, 'rsi_period': 51, 'ema1': 15, 'ema2': 17, 'slip_atr_k': 0.1544788082190865, 'slip_spread_k': 0.43797431214752747, 'spread_hl_frac': 0.009561734216833397, 'bb_std_mult': 0.8948502380438379, 'rsi_os': 27, 'rsi_ob': 87, 'vol_spike': 0.29111653714503893, 'adx_thresh': 5.813698467346892, 'atr_min_pct': 0.023006335174659002, 'atr_max_pct': 0.1495823735752595, 'tp_mult': 2.203338596654829, 'tsl_mult': 0.41550307706348333, 'strategy': 'mean_reversion', 'time_stop': 139, 'use_sma': True, 'use_atr': False, 'use_adx': False, 'use_ema': True, 'use_spike': False, 'rsi_required': False, 'edge_k': 1.2200699936644448, 'edge_cap': 0.7294936694529957}.
[I 2025-08-29 18:43:28,149] Trial 124 finished with values: [-0.003523278401497243, 0.0035637378446628297] and parameters: {'p_sma': 11, 'p_std': 5, 'p_atr': 28, 'p_adx': 21, 'rsi_period': 39, 'ema1': 11, 'ema2': 17, 'slip_atr_k': 0.014616565513315454, 'slip_spread_k': 0.4407964820771538, 'spread_hl_frac': 0.029998167743453708, 'bb_std_mult': 1.457589700678608, 'rsi_os': 27, 'rsi_ob': 86, 'vol_spike': 0.2206862461082877, 'adx_thresh': 20.48709742939201, 'atr_min_pct': 0.002705459666181609, 'atr_max_pct': 0.0519053948626206, 'tp_mult': 2.19352768072079, 'tsl_mult': 0.8482973172565046, 'strategy': 'mean_reversion', 'time_stop': 164, 'use_sma': True, 'use_atr': False, 'use_adx': False, 'use_ema': True, 'use_spike': False, 'rsi_required': False, 'edge_k': 1.3742026535803542, 'edge_cap': 0.6423604628705326}.
[I 2025-08-29 18:43:28,363] Trial 127 finished with values: [-1000000000.0, 1000000000.0] and parameters: {'p_sma': 11, 'p_std': 25, 'p_atr': 21, 'p_adx': 28, 'rsi_period': 37, 'ema1': 12, 'ema2': 13, 'slip_atr_k': 0.17891414327012709, 'slip_spread_k': 0.9080810538666371, 'spread_hl_frac': 0.030058121250999343, 'bb_std_mult': 2.8828804321280708, 'rsi_os': 25, 'rsi_ob': 53, 'vol_spike': 0.1981397978210808, 'adx_thresh': 33.267160537253915, 'atr_min_pct': 0.009085016216506233, 'atr_max_pct': 0.0852321924150712, 'tp_mult': 2.1026114037821086, 'tsl_mult': 0.9935512609209958, 'strategy': 'mean_reversion', 'time_stop': 197, 'use_sma': True, 'use_atr': True, 'use_adx': True, 'use_ema': True, 'use_spike': True, 'rsi_required': False, 'edge_k': 0.7529728601313961, 'edge_cap': 0.8599732549292737}.
[I 2025-08-29 18:43:28,642] Trial 126 finished with values: [-1000000000.0, 1000000000.0] and parameters: {'p_sma': 38, 'p_std': 60, 'p_atr': 17, 'p_adx': 25, 'rsi_period': 51, 'ema1': 9, 'ema2': 15, 'slip_atr_k': 0.15405481177771727, 'slip_spread_k': 0.2794067321635787, 'spread_hl_frac': 0.03039477232679235, 'bb_std_mult': 1.4159651946481147, 'rsi_os': 25, 'rsi_ob': 67, 'vol_spike': 0.29079230803646017, 'adx_thresh': 6.601587207510406, 'atr_min_pct': 0.002620552050823172, 'atr_max_pct': 0.05174751827336187, 'tp_mult': 2.0900630166284104, 'tsl_mult': 0.4159585307918158, 'strategy': 'mean_reversion', 'time_stop': 198, 'use_sma': True, 'use_atr': False, 'use_adx': True, 'use_ema': True, 'use_spike': True, 'rsi_required': False, 'edge_k': 0.7399129276223706, 'edge_cap': 0.8601152094662607}.
[I 2025-08-29 18:43:28,813] Trial 125 finished with values: [-1000000000.0, 1000000000.0] and parameters: {'p_sma': 11, 'p_std': 25, 'p_atr': 20, 'p_adx': 28, 'rsi_period': 38, 'ema1': 9, 'ema2': 13, 'slip_atr_k': 0.19660929388373877, 'slip_spread_k': 0.4414345012424205, 'spread_hl_frac': 0.044110473355020996, 'bb_std_mult': 2.817810746133976, 'rsi_os': 25, 'rsi_ob': 90, 'vol_spike': 0.22018617591135314, 'adx_thresh': 20.733279073167935, 'atr_min_pct': 0.0028976441771927566, 'atr_max_pct': 0.08509812635612325, 'tp_mult': 2.004141652779321, 'tsl_mult': 0.9974306656370024, 'strategy': 'mean_reversion', 'time_stop': 140, 'use_sma': True, 'use_atr': False, 'use_adx': True, 'use_ema': True, 'use_spike': True, 'rsi_required': False, 'edge_k': 0.7505046610501294, 'edge_cap': 0.6461104666739305}.
[I 2025-08-29 18:43:57,176] Trial 129 finished with values: [-1000000000.0, 1000000000.0] and parameters: {'p_sma': 17, 'p_std': 11, 'p_atr': 27, 'p_adx': 23, 'rsi_period': 39, 'ema1': 9, 'ema2': 15, 'slip_atr_k': 0.11803892157257716, 'slip_spread_k': 0.27668949948630706, 'spread_hl_frac': 0.04445184933896135, 'bb_std_mult': 0.6261203398836996, 'rsi_os': 24, 'rsi_ob': 68, 'vol_spike': 0.21900810674690557, 'adx_thresh': 20.823118882819593, 'atr_min_pct': 0.0026252913410233316, 'atr_max_pct': 0.14353753306294606, 'tp_mult': 2.0040483574545016, 'tsl_mult': 0.9241447849439406, 'strategy': 'mean_reversion', 'time_stop': 154, 'use_sma': True, 'use_atr': False, 'use_adx': True, 'use_ema': True, 'use_spike': False, 'rsi_required': False, 'edge_k': 0.0981512612296428, 'edge_cap': 0.7008410197273842}.
[I 2025-08-29 18:43:57,205] Trial 131 finished with values: [-1000000000.0, 1000000000.0] and parameters: {'p_sma': 7, 'p_std': 39, 'p_atr': 10, 'p_adx': 23, 'rsi_period': 39, 'ema1': 12, 'ema2': 12, 'slip_atr_k': 0.24025510842315362, 'slip_spread_k': 0.9479248033894412, 'spread_hl_frac': 0.03783487992319448, 'bb_std_mult': 0.6349309712726627, 'rsi_os': 24, 'rsi_ob': 68, 'vol_spike': 0.2247819511326548, 'adx_thresh': 25.832859562476997, 'atr_min_pct': 0.028086006297867207, 'atr_max_pct': 0.08083355983237692, 'tp_mult': 2.1340117313664386, 'tsl_mult': 0.8592659458732037, 'strategy': 'mean_reversion', 'time_stop': 16, 'use_sma': True, 'use_atr': True, 'use_adx': True, 'use_ema': True, 'use_spike': False, 'rsi_required': False, 'edge_k': 0.09417839663029093, 'edge_cap': 0.5553579888496689}.
[I 2025-08-29 18:43:57,340] Trial 130 finished with values: [-1000000000.0, 1000000000.0] and parameters: {'p_sma': 16, 'p_std': 8, 'p_atr': 10, 'p_adx': 23, 'rsi_period': 39, 'ema1': 18, 'ema2': 12, 'slip_atr_k': 0.241531972792279, 'slip_spread_k': 0.3380826889527789, 'spread_hl_frac': 0.04500845136604497, 'bb_std_mult': 1.496105620043328, 'rsi_os': 24, 'rsi_ob': 91, 'vol_spike': 0.22232035058651609, 'adx_thresh': 20.800051624003522, 'atr_min_pct': 0.028073807428794662, 'atr_max_pct': 0.0758172713211103, 'tp_mult': 2.1550057623836483, 'tsl_mult': 0.8977106436258055, 'strategy': 'mean_reversion', 'time_stop': 152, 'use_sma': True, 'use_atr': False, 'use_adx': True, 'use_ema': True, 'use_spike': False, 'rsi_required': False, 'edge_k': 0.600886756907186, 'edge_cap': 0.5122960060022063}.
[I 2025-08-29 18:43:57,492] Trial 128 finished with values: [-1000000000.0, 1000000000.0] and parameters: {'p_sma': 39, 'p_std': 11, 'p_atr': 14, 'p_adx': 21, 'rsi_period': 38, 'ema1': 12, 'ema2': 15, 'slip_atr_k': 0.18166760799364448, 'slip_spread_k': 0.28118570941013954, 'spread_hl_frac': 0.029743350219089637, 'bb_std_mult': 1.4129195703226254, 'rsi_os': 24, 'rsi_ob': 67, 'vol_spike': 0.22108100724646876, 'adx_thresh': 18.336006566884162, 'atr_min_pct': 0.00915408811889062, 'atr_max_pct': 0.14157402939827435, 'tp_mult': 2.084559112745043, 'tsl_mult': 0.03773782822605354, 'strategy': 'mean_reversion', 'time_stop': 12, 'use_sma': True, 'use_atr': True, 'use_adx': True, 'use_ema': True, 'use_spike': True, 'rsi_required': False, 'edge_k': 0.735807615172186, 'edge_cap': 0.8510430381431253}.
[I 2025-08-29 18:44:24,459] Trial 133 finished with values: [-1000000000.0, 1000000000.0] and parameters: {'p_sma': 15, 'p_std': 48, 'p_atr': 27, 'p_adx': 21, 'rsi_period': 43, 'ema1': 19, 'ema2': 42, 'slip_atr_k': 0.022163702893512684, 'slip_spread_k': 0.7947462830347158, 'spread_hl_frac': 0.011850146796303064, 'bb_std_mult': 1.4867380281830622, 'rsi_os': 18, 'rsi_ob': 73, 'vol_spike': 0.2299996951095955, 'adx_thresh': 10.099559374298536, 'atr_min_pct': 0.024467675055432375, 'atr_max_pct': 0.07533859819203292, 'tp_mult': 2.2551074338233397, 'tsl_mult': 0.6879568792758439, 'strategy': 'breakout', 'time_stop': 234, 'use_sma': True, 'use_atr': False, 'use_adx': True, 'use_ema': False, 'use_spike': False, 'rsi_required': False, 'edge_k': 0.5979997451972814, 'edge_cap': 0.5225017843822954}.
[I 2025-08-29 18:44:24,977] Trial 132 finished with values: [-1000000000.0, 1000000000.0] and parameters: {'p_sma': 14, 'p_std': 8, 'p_atr': 7, 'p_adx': 21, 'rsi_period': 43, 'ema1': 14, 'ema2': 41, 'slip_atr_k': 0.020084339091611173, 'slip_spread_k': 0.8023644297075065, 'spread_hl_frac': 0.047908894308574985, 'bb_std_mult': 2.042807243565375, 'rsi_os': 20, 'rsi_ob': 63, 'vol_spike': 0.010691040469697849, 'adx_thresh': 22.267317727147073, 'atr_min_pct': 0.01726771776656698, 'atr_max_pct': 0.07522721754487134, 'tp_mult': 2.2644734225169967, 'tsl_mult': 0.6763326743501312, 'strategy': 'breakout', 'time_stop': 235, 'use_sma': True, 'use_atr': False, 'use_adx': True, 'use_ema': False, 'use_spike': False, 'rsi_required': False, 'edge_k': 0.5203020981148674, 'edge_cap': 0.4400351102193036}.
[I 2025-08-29 18:44:25,183] Trial 135 finished with values: [-1000000000.0, 1000000000.0] and parameters: {'p_sma': 14, 'p_std': 48, 'p_atr': 27, 'p_adx': 22, 'rsi_period': 44, 'ema1': 6, 'ema2': 42, 'slip_atr_k': 0.020631541169668602, 'slip_spread_k': 0.1995973540490023, 'spread_hl_frac': 0.011118273560491623, 'bb_std_mult': 2.1152304050566464, 'rsi_os': 12, 'rsi_ob': 60, 'vol_spike': 0.2281547270115909, 'adx_thresh': 19.715686938891263, 'atr_min_pct': 0.024796066371234153, 'atr_max_pct': 0.11327142219427341, 'tp_mult': 2.2871444797369174, 'tsl_mult': 0.5121141854020702, 'strategy': 'breakout', 'time_stop': 222, 'use_sma': False, 'use_atr': False, 'use_adx': False, 'use_ema': False, 'use_spike': False, 'rsi_required': True, 'edge_k': 0.6725045058960749, 'edge_cap': 0.47230322593644286}.
