[I 2025-08-29 18:50:40,783] Trial 189 finished with values: [-1000000000.0, 1000000000.0] and parameters: {'p_sma': 58, 'p_std': 12, 'p_atr': 13, 'p_adx': 27, 'rsi_period': 62, 'ema1': 22, 'ema2': 10, 'slip_atr_k': 0.028996822746526707, 'slip_spread_k': 0.2643705322699726, 'spread_hl_frac': 0.015548049311778795, 'bb_std_mult': 0.7071498211009339, 'rsi_os': 22, 'rsi_ob': 45, 'vol_spike': 0.27900621219335825, 'adx_thresh': 7.223186122078788, 'atr_min_pct': 0.01815169028743559, 'atr_max_pct': 0.11432910992010095, 'tp_mult': 1.2118067900531462, 'tsl_mult': 0.3113216357540755, 'strategy': 'breakout', 'time_stop': 153, 'use_sma': False, 'use_atr': False, 'use_adx': True, 'use_ema': False, 'use_spike': False, 'rsi_required': True, 'edge_k': 1.867648136066629, 'edge_cap': 0.23584942642706214}.
[I 2025-08-29 18:50:41,085] Trial 191 finished with values: [-1000000000.0, 1000000000.0] and parameters: {'p_sma': 59, 'p_std': 12, 'p_atr': 13, 'p_adx': 30, 'rsi_period': 63, 'ema1': 28, 'ema2': 51, 'slip_atr_k': 0.18887642004853766, 'slip_spread_k': 0.24426655534503028, 'spread_hl_frac': 0.032920758698918993, 'bb_std_mult': 0.6877397881838083, 'rsi_os': 11, 'rsi_ob': 47, 'vol_spike': 0.14821899949079345, 'adx_thresh': 5.020154628545898, 'atr_min_pct': 0.022354922097753926, 'atr_max_pct': 0.11537114576534199, 'tp_mult': 1.299441648116209, 'tsl_mult': 0.12102648747501435, 'strategy': 'breakout', 'time_stop': 153, 'use_sma': False, 'use_atr': False, 'use_adx': True, 'use_ema': False, 'use_spike': False, 'rsi_required': True, 'edge_k': 1.892687354051868, 'edge_cap': 0.20332429692799792}.
[I 2025-08-29 18:50:41,377] Trial 192 finished with values: [-1000000000.0, 1000000000.0] and parameters: {'p_sma': 59, 'p_std': 12, 'p_atr': 13, 'p_adx': 29, 'rsi_period': 63, 'ema1': 30, 'ema2': 59, 'slip_atr_k': 0.026889556398678363, 'slip_spread_k': 0.05207128760025714, 'spread_hl_frac': 0.041685865979124215, 'bb_std_mult': 2.6247239668866937, 'rsi_os': 21, 'rsi_ob': 47, 'vol_spike': 0.2746629716615968, 'adx_thresh': 32.44526413889599, 'atr_min_pct': 0.008842222954910384, 'atr_max_pct': 0.11607640346251849, 'tp_mult': 1.1963591216849758, 'tsl_mult': 0.12693336375559658, 'strategy': 'breakout', 'time_stop': 142, 'use_sma': False, 'use_atr': False, 'use_adx': True, 'use_ema': False, 'use_spike': False, 'rsi_required': True, 'edge_k': 1.5623652996858048, 'edge_cap': 0.05269274663434965}.
[I 2025-08-29 18:50:41,377] Trial 190 finished with values: [-1000000000.0, 1000000000.0] and parameters: {'p_sma': 59, 'p_std': 10, 'p_atr': 13, 'p_adx': 11, 'rsi_period': 62, 'ema1': 16, 'ema2': 10, 'slip_atr_k': 0.025547028367542607, 'slip_spread_k': 0.17540826024429496, 'spread_hl_frac': 0.046656892867520464, 'bb_std_mult': 1.106730725698169, 'rsi_os': 22, 'rsi_ob': 48, 'vol_spike': 0.14710527169521737, 'adx_thresh': 34.99083696790331, 'atr_min_pct': 0.008636367171250516, 'atr_max_pct': 0.1324509256635705, 'tp_mult': 1.2253889844904016, 'tsl_mult': 0.3066258134257639, 'strategy': 'breakout', 'time_stop': 153, 'use_sma': False, 'use_atr': False, 'use_adx': True, 'use_ema': False, 'use_spike': False, 'rsi_required': True, 'edge_k': 1.8835915704957926, 'edge_cap': 0.8284424216052868}.
[I 2025-08-29 18:51:09,621] Trial 194 finished with values: [-1000000000.0, 1000000000.0] and parameters: {'p_sma': 56, 'p_std': 10, 'p_atr': 14, 'p_adx': 21, 'rsi_period': 59, 'ema1': 16, 'ema2': 37, 'slip_atr_k': 0.02384584311126062, 'slip_spread_k': 0.28271563523829524, 'spread_hl_frac': 0.03867991536950594, 'bb_std_mult': 3.272572461704268, 'rsi_os': 21, 'rsi_ob': 49, 'vol_spike': 0.17776704606448648, 'adx_thresh': 34.984645022815656, 'atr_min_pct': 0.008607427830240788, 'atr_max_pct': 0.01915532620761299, 'tp_mult': 1.2461168922522725, 'tsl_mult': 0.25462828340165417, 'strategy': 'breakout', 'time_stop': 140, 'use_sma': False, 'use_atr': False, 'use_adx': True, 'use_ema': False, 'use_spike': False, 'rsi_required': True, 'edge_k': 1.9646259892324378, 'edge_cap': 0.05192619744420104}.
[I 2025-08-29 18:51:10,181] Trial 196 finished with values: [-1000000000.0, 1000000000.0] and parameters: {'p_sma': 57, 'p_std': 47, 'p_atr': 22, 'p_adx': 21, 'rsi_period': 67, 'ema1': 25, 'ema2': 35, 'slip_atr_k': 0.24907300648087488, 'slip_spread_k': 0.2815055158069755, 'spread_hl_frac': 0.00576127909728286, 'bb_std_mult': 3.31303234879522, 'rsi_os': 18, 'rsi_ob': 49, 'vol_spike': 0.1784794704924583, 'adx_thresh': 9.764909174164735, 'atr_min_pct': 0.010772589105192933, 'atr_max_pct': 0.020636552384839912, 'tp_mult': 1.040957302865305, 'tsl_mult': 0.2359653447564983, 'strategy': 'breakout', 'time_stop': 148, 'use_sma': False, 'use_atr': False, 'use_adx': True, 'use_ema': False, 'use_spike': False, 'rsi_required': True, 'edge_k': 1.9880719839112315, 'edge_cap': 0.09258769005821897}.
[I 2025-08-29 18:51:10,340] Trial 193 finished with values: [-1000000000.0, 1000000000.0] and parameters: {'p_sma': 59, 'p_std': 37, 'p_atr': 14, 'p_adx': 11, 'rsi_period': 59, 'ema1': 28, 'ema2': 10, 'slip_atr_k': 0.1858143813491639, 'slip_spread_k': 0.17518898919110115, 'spread_hl_frac': 0.03924229472300061, 'bb_std_mult': 2.627208160742269, 'rsi_os': 18, 'rsi_ob': 49, 'vol_spike': 0.1464600407709183, 'adx_thresh': 9.502343256033797, 'atr_min_pct': 0.01355192304798594, 'atr_max_pct': 0.11016488055024239, 'tp_mult': 1.0389817791322025, 'tsl_mult': 0.1251297898768321, 'strategy': 'breakout', 'time_stop': 143, 'use_sma': False, 'use_atr': False, 'use_adx': True, 'use_ema': False, 'use_spike': False, 'rsi_required': True, 'edge_k': 1.8940740469994761, 'edge_cap': 0.05093568745164817}.
[I 2025-08-29 18:51:10,426] Trial 195 finished with values: [-1000000000.0, 1000000000.0] and parameters: {'p_sma': 56, 'p_std': 37, 'p_atr': 22, 'p_adx': 21, 'rsi_period': 59, 'ema1': 25, 'ema2': 12, 'slip_atr_k': 0.24938163401104527, 'slip_spread_k': 0.20778124093442424, 'spread_hl_frac': 0.01255778392555133, 'bb_std_mult': 3.499163959500219, 'rsi_os': 33, 'rsi_ob': 49, 'vol_spike': 0.1765734890987839, 'adx_thresh': 33.310520488059296, 'atr_min_pct': 0.012610490834681585, 'atr_max_pct': 0.11082381519495155, 'tp_mult': 1.0314043266376898, 'tsl_mult': 0.26186022935858494, 'strategy': 'breakout', 'time_stop': 126, 'use_sma': False, 'use_atr': False, 'use_adx': True, 'use_ema': False, 'use_spike': False, 'rsi_required': True, 'edge_k': 1.9580015092272984, 'edge_cap': 0.08383476523594716}.
[I 2025-08-29 18:51:39,475] Trial 197 finished with values: [-1000000000.0, 1000000000.0] and parameters: {'p_sma': 57, 'p_std': 49, 'p_atr': 22, 'p_adx': 21, 'rsi_period': 67, 'ema1': 15, 'ema2': 12, 'slip_atr_k': 0.017471047144552665, 'slip_spread_k': 0.20519917311257954, 'spread_hl_frac': 0.0055007996257366906, 'bb_std_mult': 2.2844539215033812, 'rsi_os': 33, 'rsi_ob': 49, 'vol_spike': 0.024496430101438343, 'adx_thresh': 10.675461036625853, 'atr_min_pct': 0.013851153259774103, 'atr_max_pct': 0.1115314613604534, 'tp_mult': 1.0220845932929166, 'tsl_mult': 0.3523432854542142, 'strategy': 'breakout', 'time_stop': 147, 'use_sma': False, 'use_atr': False, 'use_adx': False, 'use_ema': False, 'use_spike': False, 'rsi_required': True, 'edge_k': 1.985181694402379, 'edge_cap': 0.25730678593315187}.
[I 2025-08-29 18:51:39,679] Trial 198 finished with values: [-1000000000.0, 1000000000.0] and parameters: {'p_sma': 60, 'p_std': 57, 'p_atr': 16, 'p_adx': 21, 'rsi_period': 59, 'ema1': 15, 'ema2': 55, 'slip_atr_k': 0.10128448978518517, 'slip_spread_k': 0.20686455434676768, 'spread_hl_frac': 0.009078042946704293, 'bb_std_mult': 2.269330329991638, 'rsi_os': 8, 'rsi_ob': 47, 'vol_spike': 0.05731376772912268, 'adx_thresh': 33.382569521168264, 'atr_min_pct': 0.012391461040198068, 'atr_max_pct': 0.11205446214753775, 'tp_mult': 2.9311697260667087, 'tsl_mult': 0.2685012132132056, 'strategy': 'breakout', 'time_stop': 158, 'use_sma': False, 'use_atr': True, 'use_adx': False, 'use_ema': False, 'use_spike': False, 'rsi_required': True, 'edge_k': 1.3909601155008413, 'edge_cap': 0.886282660916165}.
[I 2025-08-29 18:51:40,105] Trial 200 finished with values: [-1000000000.0, 1000000000.0] and parameters: {'p_sma': 60, 'p_std': 50, 'p_atr': 14, 'p_adx': 22, 'rsi_period': 69, 'ema1': 21, 'ema2': 55, 'slip_atr_k': 0.16812937777939085, 'slip_spread_k': 0.23339504686144566, 'spread_hl_frac': 0.037105967294888326, 'bb_std_mult': 1.11965762464365, 'rsi_os': 39, 'rsi_ob': 47, 'vol_spike': 0.1557171297989649, 'adx_thresh': 32.671602896786965, 'atr_min_pct': 0.013868292672476395, 'atr_max_pct': 0.028254885716143284, 'tp_mult': 1.6640409238017118, 'tsl_mult': 0.3500656294662423, 'strategy': 'breakout', 'time_stop': 47, 'use_sma': False, 'use_atr': True, 'use_adx': False, 'use_ema': False, 'use_spike': True, 'rsi_required': True, 'edge_k': 1.401173993606932, 'edge_cap': 0.8975898203191202}.
[I 2025-08-29 18:51:40,272] Trial 199 finished with values: [-1000000000.0, 1000000000.0] and parameters: {'p_sma': 60, 'p_std': 15, 'p_atr': 17, 'p_adx': 15, 'rsi_period': 71, 'ema1': 21, 'ema2': 12, 'slip_atr_k': 0.14448009434724146, 'slip_spread_k': 0.2106503749768363, 'spread_hl_frac': 0.012208224463844465, 'bb_std_mult': 3.476207118149013, 'rsi_os': 33, 'rsi_ob': 47, 'vol_spike': 0.016941651668959612, 'adx_thresh': 33.3747505171613, 'atr_min_pct': 0.014544477718616982, 'atr_max_pct': 0.09989983467397619, 'tp_mult': 1.696072514461363, 'tsl_mult': 0.3371750160653165, 'strategy': 'breakout', 'time_stop': 50, 'use_sma': False, 'use_atr': True, 'use_adx': False, 'use_ema': False, 'use_spike': True, 'rsi_required': True, 'edge_k': 1.3864920212022227, 'edge_cap': 0.2825397221691588}.
[I 2025-08-29 18:51:40,442] Trial 203 finished with values: [-1000000000.0, 1000000000.0] and parameters: {'p_sma': 60, 'p_std': 13, 'p_atr': 8, 'p_adx': 17, 'rsi_period': 64, 'ema1': 17, 'ema2': 14, 'slip_atr_k': 0.13372789672488833, 'slip_spread_k': 0.11364435158774733, 'spread_hl_frac': 0.011133590883416672, 'bb_std_mult': 2.8107030839719322, 'rsi_os': 19, 'rsi_ob': 84, 'vol_spike': 0.03263396703818547, 'adx_thresh': 30.240017602299737, 'atr_min_pct': 0.027928434144539396, 'atr_max_pct': 0.025280941190908866, 'tp_mult': 1.2957077827128338, 'tsl_mult': 0.1448480377143851, 'strategy': 'breakout', 'time_stop': 108, 'use_sma': False, 'use_atr': False, 'use_adx': True, 'use_ema': False, 'use_spike': True, 'rsi_required': True, 'edge_k': 1.2460557619788275, 'edge_cap': 0.10762136069171263}.
[I 2025-08-29 18:52:09,454] Trial 204 finished with values: [-1000000000.0, 1000000000.0] and parameters: {'p_sma': 59, 'p_std': 13, 'p_atr': 9, 'p_adx': 8, 'rsi_period': 64, 'ema1': 16, 'ema2': 40, 'slip_atr_k': 0.13212784511214648, 'slip_spread_k': 0.08048098554831118, 'spread_hl_frac': 0.04931503050181212, 'bb_std_mult': 2.7520857609123315, 'rsi_os': 19, 'rsi_ob': 85, 'vol_spike': 0.13935131208259205, 'adx_thresh': 31.829235332769528, 'atr_min_pct': 0.015572025382419984, 'atr_max_pct': 0.13975725268569586, 'tp_mult': 1.128593093351697, 'tsl_mult': 0.20034991054672427, 'strategy': 'breakout', 'time_stop': 107, 'use_sma': False, 'use_atr': False, 'use_adx': True, 'use_ema': False, 'use_spike': False, 'rsi_required': True, 'edge_k': 1.247478550121118, 'edge_cap': 0.66482597624805}.
[I 2025-08-29 18:52:09,871] Trial 205 finished with values: [-1000000000.0, 1000000000.0] and parameters: {'p_sma': 37, 'p_std': 11, 'p_atr': 9, 'p_adx': 8, 'rsi_period': 65, 'ema1': 17, 'ema2': 57, 'slip_atr_k': 0.23660876591667945, 'slip_spread_k': 0.29778234595576675, 'spread_hl_frac': 0.04908385326357169, 'bb_std_mult': 1.0049054278828866, 'rsi_os': 20, 'rsi_ob': 80, 'vol_spike': 0.26136326816283634, 'adx_thresh': 12.235846936198211, 'atr_min_pct': 0.015706387034160756, 'atr_max_pct': 0.09717134816914122, 'tp_mult': 1.1004579205280567, 'tsl_mult': 0.15447272743893203, 'strategy': 'breakout', 'time_stop': 161, 'use_sma': False, 'use_atr': False, 'use_adx': True, 'use_ema': False, 'use_spike': False, 'rsi_required': True, 'edge_k': 1.321861873505377, 'edge_cap': 0.07959216375448601}.
[I 2025-08-29 18:52:10,057] Trial 201 finished with values: [-1000000000.0, 1000000000.0] and parameters: {'p_sma': 36, 'p_std': 57, 'p_atr': 17, 'p_adx': 22, 'rsi_period': 64, 'ema1': 16, 'ema2': 14, 'slip_atr_k': 0.2183673599368518, 'slip_spread_k': 0.23312829122901513, 'spread_hl_frac': 0.0369577412215939, 'bb_std_mult': 1.011017996006745, 'rsi_os': 19, 'rsi_ob': 47, 'vol_spike': 0.15628403656824644, 'adx_thresh': 12.192623509679859, 'atr_min_pct': 0.014402363787458936, 'atr_max_pct': 0.026168455895909035, 'tp_mult': 1.1376392607978536, 'tsl_mult': 0.20825150546197024, 'strategy': 'breakout', 'time_stop': 159, 'use_sma': False, 'use_atr': True, 'use_adx': False, 'use_ema': False, 'use_spike': True, 'rsi_required': True, 'edge_k': 1.7118101781625663, 'edge_cap': 0.1019939157479998}.
[I 2025-08-29 18:52:10,146] Trial 202 finished with values: [-1000000000.0, 1000000000.0] and parameters: {'p_sma': 36, 'p_std': 13, 'p_atr': 21, 'p_adx': 7, 'rsi_period': 65, 'ema1': 17, 'ema2': 14, 'slip_atr_k': 0.14212454497770757, 'slip_spread_k': 0.22785048861609034, 'spread_hl_frac': 0.007593378482599953, 'bb_std_mult': 1.1172443943482038, 'rsi_os': 19, 'rsi_ob': 50, 'vol_spike': 0.09804827326118928, 'adx_thresh': 12.41553327217499, 'atr_min_pct': 0.028410395272624157, 'atr_max_pct': 0.09728518640565752, 'tp_mult': 1.1281503060391251, 'tsl_mult': 0.2064744238769213, 'strategy': 'breakout', 'time_stop': 48, 'use_sma': False, 'use_atr': True, 'use_adx': True, 'use_ema': False, 'use_spike': True, 'rsi_required': True, 'edge_k': 1.7021696812086122, 'edge_cap': 0.1025694556095372}.
[I 2025-08-29 18:52:39,040] Trial 206 finished with values: [-1000000000.0, 1000000000.0] and parameters: {'p_sma': 36, 'p_std': 11, 'p_atr': 13, 'p_adx': 14, 'rsi_period': 62, 'ema1': 16, 'ema2': 43, 'slip_atr_k': 0.03167656121068974, 'slip_spread_k': 0.2450854094131853, 'spread_hl_frac': 0.007974956399623773, 'bb_std_mult': 2.3961290521017795, 'rsi_os': 52, 'rsi_ob': 88, 'vol_spike': 0.047555078122545544, 'adx_thresh': 32.44381148739221, 'atr_min_pct': 0.022839480654951935, 'atr_max_pct': 0.09806123289169609, 'tp_mult': 1.5608053375621613, 'tsl_mult': 0.036493460176913406, 'strategy': 'breakout', 'time_stop': 160, 'use_sma': False, 'use_atr': False, 'use_adx': True, 'use_ema': False, 'use_spike': False, 'rsi_required': True, 'edge_k': 1.7066875116330873, 'edge_cap': 0.07970982818965638}.
[I 2025-08-29 18:52:39,175] Trial 209 finished with values: [-1000000000.0, 1000000000.0] and parameters: {'p_sma': 59, 'p_std': 23, 'p_atr': 20, 'p_adx': 16, 'rsi_period': 62, 'ema1': 14, 'ema2': 13, 'slip_atr_k': 0.01817858468251834, 'slip_spread_k': 0.24976734231568176, 'spread_hl_frac': 0.03395029553879164, 'bb_std_mult': 2.404735896093305, 'rsi_os': 52, 'rsi_ob': 94, 'vol_spike': 0.0022467259890903424, 'adx_thresh': 32.57119248604305, 'atr_min_pct': 0.010663824997810156, 'atr_max_pct': 0.12347135172833848, 'tp_mult': 1.570392884262815, 'tsl_mult': 0.38119027508526526, 'strategy': 'breakout', 'time_stop': 65, 'use_sma': False, 'use_atr': False, 'use_adx': True, 'use_ema': False, 'use_spike': False, 'rsi_required': True, 'edge_k': 1.4930932522186882, 'edge_cap': 0.9212063878751972}.
[I 2025-08-29 18:52:39,426] Trial 207 finished with values: [-1000000000.0, 1000000000.0] and parameters: {'p_sma': 59, 'p_std': 22, 'p_atr': 20, 'p_adx': 22, 'rsi_period': 62, 'ema1': 16, 'ema2': 13, 'slip_atr_k': 0.01553746219475664, 'slip_spread_k': 0.3863653713783172, 'spread_hl_frac': 0.008257295077073998, 'bb_std_mult': 1.9783343738934402, 'rsi_os': 53, 'rsi_ob': 58, 'vol_spike': 0.15543501294598766, 'adx_thresh': 32.43368082627256, 'atr_min_pct': 0.025542628935447113, 'atr_max_pct': 0.0898731319649713, 'tp_mult': 1.8303184676067588, 'tsl_mult': 0.024554275090821698, 'strategy': 'breakout', 'time_stop': 149, 'use_sma': False, 'use_atr': False, 'use_adx': True, 'use_ema': False, 'use_spike': False, 'rsi_required': True, 'edge_k': 1.7021453472506518, 'edge_cap': 0.07930583670033382}.
[I 2025-08-29 18:52:39,551] Trial 208 finished with values: [-1000000000.0, 1000000000.0] and parameters: {'p_sma': 58, 'p_std': 9, 'p_atr': 13, 'p_adx': 9, 'rsi_period': 62, 'ema1': 18, 'ema2': 44, 'slip_atr_k': 0.015806173671595966, 'slip_spread_k': 0.005674289203555505, 'spread_hl_frac': 0.007587934215389219, 'bb_std_mult': 1.1507593807143357, 'rsi_os': 45, 'rsi_ob': 94, 'vol_spike': 0.10023025291641349, 'adx_thresh': 32.63354692543315, 'atr_min_pct': 0.02693402321771671, 'atr_max_pct': 0.12249568238154579, 'tp_mult': 1.561299363012988, 'tsl_mult': 0.3781963541458448, 'strategy': 'breakout', 'time_stop': 63, 'use_sma': False, 'use_atr': False, 'use_adx': True, 'use_ema': False, 'use_spike': False, 'rsi_required': True, 'edge_k': 1.8410759147672426, 'edge_cap': 0.07250549477214323}.
[I 2025-08-29 18:53:08,988] Trial 210 finished with values: [-1000000000.0, 1000000000.0] and parameters: {'p_sma': 59, 'p_std': 9, 'p_atr': 20, 'p_adx': 20, 'rsi_period': 63, 'ema1': 18, 'ema2': 30, 'slip_atr_k': 0.08520999562887388, 'slip_spread_k': 0.37250375940105795, 'spread_hl_frac': 0.028933481218544346, 'bb_std_mult': 1.9972980839442007, 'rsi_os': 21, 'rsi_ob': 93, 'vol_spike': 0.12341048457785547, 'adx_thresh': 13.449764869644522, 'atr_min_pct': 0.0075566300850500355, 'atr_max_pct': 0.013566392780337999, 'tp_mult': 2.7586097692450555, 'tsl_mult': 0.38861100422555533, 'strategy': 'breakout', 'time_stop': 148, 'use_sma': False, 'use_atr': False, 'use_adx': True, 'use_ema': False, 'use_spike': False, 'rsi_required': True, 'edge_k': 1.4975158205152588, 'edge_cap': 0.7170318674704611}.
[I 2025-08-29 18:53:09,117] Trial 212 finished with values: [-1000000000.0, 1000000000.0] and parameters: {'p_sma': 57, 'p_std': 9, 'p_atr': 12, 'p_adx': 10, 'rsi_period': 60, 'ema1': 18, 'ema2': 11, 'slip_atr_k': 0.1562830878237009, 'slip_spread_k': 0.2695514915009205, 'spread_hl_frac': 0.01851115356382041, 'bb_std_mult': 0.9376063493006794, 'rsi_os': 21, 'rsi_ob': 45, 'vol_spike': 0.08810147035884527, 'adx_thresh': 33.63259623842136, 'atr_min_pct': 0.007021763267987344, 'atr_max_pct': 0.1208202137235875, 'tp_mult': 1.2793645297391496, 'tsl_mult': 0.40192238035186956, 'strategy': 'breakout', 'time_stop': 81, 'use_sma': False, 'use_atr': False, 'use_adx': True, 'use_ema': False, 'use_spike': False, 'rsi_required': True, 'edge_k': 1.8295424870134678, 'edge_cap': 0.06816956619268556}.
[I 2025-08-29 18:53:09,241] Trial 211 finished with values: [-1000000000.0, 1000000000.0] and parameters: {'p_sma': 60, 'p_std': 9, 'p_atr': 12, 'p_adx': 20, 'rsi_period': 68, 'ema1': 15, 'ema2': 31, 'slip_atr_k': 0.09342274283727905, 'slip_spread_k': 0.3891908431954305, 'spread_hl_frac': 0.02108588864472737, 'bb_std_mult': 1.1487607499395573, 'rsi_os': 21, 'rsi_ob': 81, 'vol_spike': 0.0717187358628138, 'adx_thresh': 33.92680589010129, 'atr_min_pct': 0.02562891600686064, 'atr_max_pct': 0.1349277001740477, 'tp_mult': 1.2638982649832047, 'tsl_mult': 0.17496353359187897, 'strategy': 'breakout', 'time_stop': 29, 'use_sma': False, 'use_atr': False, 'use_adx': True, 'use_ema': False, 'use_spike': False, 'rsi_required': True, 'edge_k': 1.5675658969233957, 'edge_cap': 0.06639580009571827}.
[I 2025-08-29 18:53:09,388] Trial 213 finished with values: [-1000000000.0, 1000000000.0] and parameters: {'p_sma': 60, 'p_std': 10, 'p_atr': 12, 'p_adx': 20, 'rsi_period': 12, 'ema1': 15, 'ema2': 29, 'slip_atr_k': 0.022002016467640523, 'slip_spread_k': 0.26671005042194723, 'spread_hl_frac': 0.042631203002566856, 'bb_std_mult': 1.0778880703961398, 'rsi_os': 14, 'rsi_ob': 45, 'vol_spike': 0.0704581491414439, 'adx_thresh': 13.280533001209214, 'atr_min_pct': 0.007098698800382112, 'atr_max_pct': 0.04995236604818781, 'tp_mult': 2.526977090961355, 'tsl_mult': 0.43744516674145606, 'strategy': 'breakout', 'time_stop': 81, 'use_sma': False, 'use_atr': False, 'use_adx': True, 'use_ema': False, 'use_spike': False, 'rsi_required': True, 'edge_k': 1.5665864253253208, 'edge_cap': 0.05294690737926192}.
[I 2025-08-29 18:53:37,749] Trial 217 finished with values: [-1000000000.0, 1000000000.0] and parameters: {'p_sma': 60, 'p_std': 11, 'p_atr': 14, 'p_adx': 21, 'rsi_period': 66, 'ema1': 26, 'ema2': 11, 'slip_atr_k': 0.009479018053695457, 'slip_spread_k': 0.24220554087071625, 'spread_hl_frac': 0.031515761138271745, 'bb_std_mult': 3.1669054346788643, 'rsi_os': 20, 'rsi_ob': 48, 'vol_spike': 0.18604860201758147, 'adx_thresh': 33.025707960340014, 'atr_min_pct': 0.005316801180563752, 'atr_max_pct': 0.1445362245157048, 'tp_mult': 1.3266531730285887, 'tsl_mult': 0.23543583769340332, 'strategy': 'breakout', 'time_stop': 138, 'use_sma': False, 'use_atr': True, 'use_adx': False, 'use_ema': False, 'use_spike': False, 'rsi_required': True, 'edge_k': 1.7771180956689248, 'edge_cap': 0.7507530567603266}.
[I 2025-08-29 18:53:37,941] Trial 214 finished with values: [-1000000000.0, 1000000000.0] and parameters: {'p_sma': 60, 'p_std': 60, 'p_atr': 12, 'p_adx': 21, 'rsi_period': 66, 'ema1': 26, 'ema2': 24, 'slip_atr_k': 0.09531735053350349, 'slip_spread_k': 0.2774354834009677, 'spread_hl_frac': 0.01357751910529214, 'bb_std_mult': 1.0533845427751027, 'rsi_os': 14, 'rsi_ob': 48, 'vol_spike': 0.18432382908017808, 'adx_thresh': 33.052324751258304, 'atr_min_pct': 0.00545645082094094, 'atr_max_pct': 0.04995709394526407, 'tp_mult': 2.8761646094225277, 'tsl_mult': 0.2243750999049258, 'strategy': 'breakout', 'time_stop': 158, 'use_sma': False, 'use_atr': True, 'use_adx': True, 'use_ema': False, 'use_spike': False, 'rsi_required': True, 'edge_k': 1.1703840334805935, 'edge_cap': 0.050051217860417926}.
