[I 2025-08-29 18:57:02,174] Trial 242 finished with values: [-0.0082340123752207, 0.008248980585445617] and parameters: {'p_sma': 41, 'p_std': 8, 'p_atr': 15, 'p_adx': 17, 'rsi_period': 57, 'ema1': 8, 'ema2': 15, 'slip_atr_k': 0.025381803898374675, 'slip_spread_k': 0.25336425694999903, 'spread_hl_frac': 0.004762129699777877, 'bb_std_mult': 0.5545823722103941, 'rsi_os': 43, 'rsi_ob': 91, 'vol_spike': 0.15087503081152898, 'adx_thresh': 34.333666395128404, 'atr_min_pct': 0.0047478415226761585, 'atr_max_pct': 0.03386065906169203, 'tp_mult': 1.312631488859497, 'tsl_mult': 0.2194839808714404, 'strategy': 'breakout', 'time_stop': 37, 'use_sma': False, 'use_atr': True, 'use_adx': True, 'use_ema': False, 'use_spike': False, 'rsi_required': True, 'edge_k': 1.9275481289300904, 'edge_cap': 0.12492153498105107}.
[I 2025-08-29 18:57:02,250] Trial 243 finished with values: [-0.006139347915879223, 0.00637276869029543] and parameters: {'p_sma': 60, 'p_std': 8, 'p_atr': 14, 'p_adx': 21, 'rsi_period': 57, 'ema1': 8, 'ema2': 14, 'slip_atr_k': 0.02563641249063637, 'slip_spread_k': 0.25193600210076866, 'spread_hl_frac': 0.004840954128576618, 'bb_std_mult': 1.2862178214503008, 'rsi_os': 42, 'rsi_ob': 91, 'vol_spike': 0.15113397512817184, 'adx_thresh': 34.3860082798776, 'atr_min_pct': 0.00484270370265855, 'atr_max_pct': 0.03457117371411582, 'tp_mult': 1.2908007670907458, 'tsl_mult': 0.22200923391788233, 'strategy': 'breakout', 'time_stop': 135, 'use_sma': False, 'use_atr': True, 'use_adx': True, 'use_ema': False, 'use_spike': False, 'rsi_required': True, 'edge_k': 1.9201372178598255, 'edge_cap': 0.10656508247738414}.
[I 2025-08-29 18:57:02,337] Trial 245 finished with values: [-0.0006173497353396673, 0.0016238731392950276] and parameters: {'p_sma': 39, 'p_std': 8, 'p_atr': 15, 'p_adx': 17, 'rsi_period': 56, 'ema1': 8, 'ema2': 15, 'slip_atr_k': 0.02637435073422735, 'slip_spread_k': 0.2582864679239161, 'spread_hl_frac': 0.0060992335537312335, 'bb_std_mult': 0.5486525188885666, 'rsi_os': 20, 'rsi_ob': 89, 'vol_spike': 0.149710383584471, 'adx_thresh': 34.149779213120276, 'atr_min_pct': 0.004899554180122265, 'atr_max_pct': 0.03402088159191327, 'tp_mult': 1.3046022095988743, 'tsl_mult': 0.2224216030783478, 'strategy': 'breakout', 'time_stop': 135, 'use_sma': False, 'use_atr': True, 'use_adx': True, 'use_ema': False, 'use_spike': False, 'rsi_required': True, 'edge_k': 1.9478704967835472, 'edge_cap': 0.12739040146795283}.
[I 2025-08-29 18:57:29,654] Trial 246 finished with values: [-0.00027731271931630275, 0.0013851767382247685] and parameters: {'p_sma': 60, 'p_std': 10, 'p_atr': 15, 'p_adx': 12, 'rsi_period': 56, 'ema1': 8, 'ema2': 15, 'slip_atr_k': 0.03038856317563393, 'slip_spread_k': 0.2523658560870255, 'spread_hl_frac': 0.004710246612010676, 'bb_std_mult': 1.2697129985044704, 'rsi_os': 20, 'rsi_ob': 83, 'vol_spike': 0.15221980725005146, 'adx_thresh': 34.35467130376763, 'atr_min_pct': 0.004767888968036419, 'atr_max_pct': 0.03470736684446362, 'tp_mult': 1.2538623197690308, 'tsl_mult': 0.21755798687582456, 'strategy': 'breakout', 'time_stop': 135, 'use_sma': False, 'use_atr': False, 'use_adx': True, 'use_ema': False, 'use_spike': False, 'rsi_required': True, 'edge_k': 1.9193328026077352, 'edge_cap': 0.11196880135963973}.
[I 2025-08-29 18:57:29,770] Trial 249 finished with values: [-1000000000.0, 1000000000.0] and parameters: {'p_sma': 59, 'p_std': 10, 'p_atr': 15, 'p_adx': 20, 'rsi_period': 56, 'ema1': 7, 'ema2': 15, 'slip_atr_k': 0.06467148360815965, 'slip_spread_k': 0.29315190406124303, 'spread_hl_frac': 0.00571180059257408, 'bb_std_mult': 1.376760003651437, 'rsi_os': 20, 'rsi_ob': 90, 'vol_spike': 0.15463569446325123, 'adx_thresh': 34.16415477979631, 'atr_min_pct': 0.0063226010335049425, 'atr_max_pct': 0.037920503063626265, 'tp_mult': 1.2598951779640013, 'tsl_mult': 0.2700941025704725, 'strategy': 'breakout', 'time_stop': 150, 'use_sma': False, 'use_atr': False, 'use_adx': True, 'use_ema': False, 'use_spike': False, 'rsi_required': True, 'edge_k': 1.899019185403318, 'edge_cap': 0.09208288017229355}.
[I 2025-08-29 18:57:29,975] Trial 247 finished with values: [-1000000000.0, 1000000000.0] and parameters: {'p_sma': 60, 'p_std': 8, 'p_atr': 16, 'p_adx': 21, 'rsi_period': 57, 'ema1': 5, 'ema2': 15, 'slip_atr_k': 0.06496228562249051, 'slip_spread_k': 0.2606781703304336, 'spread_hl_frac': 0.005855618841956276, 'bb_std_mult': 1.2867805677918445, 'rsi_os': 20, 'rsi_ob': 88, 'vol_spike': 0.1551886607303551, 'adx_thresh': 33.98645948550343, 'atr_min_pct': 0.00496782295569765, 'atr_max_pct': 0.03710886928297511, 'tp_mult': 1.2430458218513458, 'tsl_mult': 0.1694064107538929, 'strategy': 'breakout', 'time_stop': 151, 'use_sma': False, 'use_atr': False, 'use_adx': True, 'use_ema': False, 'use_spike': False, 'rsi_required': True, 'edge_k': 1.9103734679663318, 'edge_cap': 0.10227063356162736}.
[I 2025-08-29 18:57:30,045] Trial 248 finished with values: [-0.0007526496718741615, 0.001998710668715607] and parameters: {'p_sma': 60, 'p_std': 10, 'p_atr': 15, 'p_adx': 22, 'rsi_period': 53, 'ema1': 6, 'ema2': 15, 'slip_atr_k': 0.03369754609845665, 'slip_spread_k': 0.2935873017788349, 'spread_hl_frac': 0.0062498623379122625, 'bb_std_mult': 0.7495886404920866, 'rsi_os': 20, 'rsi_ob': 83, 'vol_spike': 0.15538428535585092, 'adx_thresh': 34.007280623736435, 'atr_min_pct': 0.0037974667436005433, 'atr_max_pct': 0.030590598292023725, 'tp_mult': 1.2509752128481684, 'tsl_mult': 0.9463874592644793, 'strategy': 'breakout', 'time_stop': 149, 'use_sma': False, 'use_atr': False, 'use_adx': True, 'use_ema': False, 'use_spike': False, 'rsi_required': True, 'edge_k': 1.9010720692216294, 'edge_cap': 0.09341611669110544}.
[I 2025-08-29 18:57:57,856] Trial 251 finished with values: [-0.0002189845801482404, 0.0012974849706845469] and parameters: {'p_sma': 60, 'p_std': 10, 'p_atr': 14, 'p_adx': 12, 'rsi_period': 58, 'ema1': 8, 'ema2': 14, 'slip_atr_k': 0.03157836525759933, 'slip_spread_k': 0.27251909277769104, 'spread_hl_frac': 0.00655014050611237, 'bb_std_mult': 1.254541120242116, 'rsi_os': 20, 'rsi_ob': 92, 'vol_spike': 0.14352539716588988, 'adx_thresh': 33.8997481313369, 'atr_min_pct': 0.0050254865881462505, 'atr_max_pct': 0.030164617582081377, 'tp_mult': 1.3351527056109997, 'tsl_mult': 0.17097002854360865, 'strategy': 'breakout', 'time_stop': 144, 'use_sma': False, 'use_atr': False, 'use_adx': True, 'use_ema': False, 'use_spike': False, 'rsi_required': True, 'edge_k': 1.9588765885109416, 'edge_cap': 0.09484376274230444}.
[I 2025-08-29 18:57:57,868] Trial 252 finished with values: [-0.001571593247147729, 0.0028334791457741986] and parameters: {'p_sma': 60, 'p_std': 10, 'p_atr': 14, 'p_adx': 12, 'rsi_period': 56, 'ema1': 8, 'ema2': 14, 'slip_atr_k': 0.02153762313412512, 'slip_spread_k': 0.23783485913430424, 'spread_hl_frac': 0.003960908956032709, 'bb_std_mult': 1.220721728960848, 'rsi_os': 20, 'rsi_ob': 92, 'vol_spike': 0.14182286889001658, 'adx_thresh': 33.99890226047673, 'atr_min_pct': 0.003813150752674632, 'atr_max_pct': 0.03119159496692835, 'tp_mult': 1.3315835218382905, 'tsl_mult': 0.23785039149888776, 'strategy': 'breakout', 'time_stop': 142, 'use_sma': False, 'use_atr': False, 'use_adx': True, 'use_ema': False, 'use_spike': False, 'rsi_required': True, 'edge_k': 1.955773775368437, 'edge_cap': 0.09404893309568055}.
[I 2025-08-29 18:57:57,868] Trial 250 finished with values: [-1000000000.0, 1000000000.0] and parameters: {'p_sma': 59, 'p_std': 10, 'p_atr': 15, 'p_adx': 9, 'rsi_period': 56, 'ema1': 7, 'ema2': 15, 'slip_atr_k': 0.02986342542227386, 'slip_spread_k': 0.29191622555217045, 'spread_hl_frac': 0.005716096524021748, 'bb_std_mult': 1.2576398819844148, 'rsi_os': 20, 'rsi_ob': 90, 'vol_spike': 0.15607182969733122, 'adx_thresh': 34.018870717580675, 'atr_min_pct': 0.006462869617425787, 'atr_max_pct': 0.03026605906523948, 'tp_mult': 1.2640117654855942, 'tsl_mult': 0.26757026460565664, 'strategy': 'breakout', 'time_stop': 149, 'use_sma': False, 'use_atr': False, 'use_adx': True, 'use_ema': False, 'use_spike': False, 'rsi_required': True, 'edge_k': 1.9590771686204236, 'edge_cap': 0.09569721891673894}.
[I 2025-08-29 18:57:57,945] Trial 253 finished with values: [-0.0012785860919860559, 0.002436492790903502] and parameters: {'p_sma': 60, 'p_std': 10, 'p_atr': 14, 'p_adx': 12, 'rsi_period': 57, 'ema1': 8, 'ema2': 14, 'slip_atr_k': 0.03375715915322141, 'slip_spread_k': 0.27367014716834837, 'spread_hl_frac': 0.004266050059827087, 'bb_std_mult': 1.2357704896385888, 'rsi_os': 19, 'rsi_ob': 91, 'vol_spike': 0.14530882530268288, 'adx_thresh': 34.97320829188756, 'atr_min_pct': 0.004279355801930661, 'atr_max_pct': 0.03072797443939663, 'tp_mult': 1.3609840584884005, 'tsl_mult': 0.23861069486100867, 'strategy': 'breakout', 'time_stop': 285, 'use_sma': False, 'use_atr': False, 'use_adx': True, 'use_ema': False, 'use_spike': False, 'rsi_required': True, 'edge_k': 1.9652729723527647, 'edge_cap': 0.08981539065711448}.
[I 2025-08-29 18:58:25,225] Trial 255 finished with values: [-0.0007315114772440401, 0.0019586503974873084] and parameters: {'p_sma': 60, 'p_std': 10, 'p_atr': 14, 'p_adx': 22, 'rsi_period': 55, 'ema1': 8, 'ema2': 13, 'slip_atr_k': 0.02165198709824201, 'slip_spread_k': 0.5186858750629447, 'spread_hl_frac': 0.006645022189583412, 'bb_std_mult': 1.1989609252705151, 'rsi_os': 19, 'rsi_ob': 91, 'vol_spike': 0.1437362353308312, 'adx_thresh': 33.70802444842617, 'atr_min_pct': 0.003869742120121893, 'atr_max_pct': 0.030555789974798086, 'tp_mult': 1.278086910350844, 'tsl_mult': 0.23786368708059885, 'strategy': 'breakout', 'time_stop': 286, 'use_sma': False, 'use_atr': False, 'use_adx': True, 'use_ema': False, 'use_spike': False, 'rsi_required': True, 'edge_k': 1.9435098533405224, 'edge_cap': 0.14153696004299443}.
[I 2025-08-29 18:58:25,429] Trial 257 finished with values: [-0.0019536908049653245, 0.002665626765874913] and parameters: {'p_sma': 60, 'p_std': 10, 'p_atr': 14, 'p_adx': 22, 'rsi_period': 55, 'ema1': 8, 'ema2': 13, 'slip_atr_k': 0.11420936713042645, 'slip_spread_k': 0.9500100893696789, 'spread_hl_frac': 0.006510963575233019, 'bb_std_mult': 1.214700715848547, 'rsi_os': 19, 'rsi_ob': 92, 'vol_spike': 0.14186167303030167, 'adx_thresh': 33.70583802486027, 'atr_min_pct': 0.003915011099266762, 'atr_max_pct': 0.03160249708365043, 'tp_mult': 1.350909339615325, 'tsl_mult': 0.23002560833279412, 'strategy': 'breakout', 'time_stop': 141, 'use_sma': False, 'use_atr': False, 'use_adx': True, 'use_ema': False, 'use_spike': False, 'rsi_required': True, 'edge_k': 1.940225750743891, 'edge_cap': 0.1648631462211223}.
[I 2025-08-29 18:58:25,447] Trial 254 finished with values: [-0.0008414137051904191, 0.0021188615335083834] and parameters: {'p_sma': 60, 'p_std': 46, 'p_atr': 14, 'p_adx': 12, 'rsi_period': 55, 'ema1': 8, 'ema2': 49, 'slip_atr_k': 0.021599026817915867, 'slip_spread_k': 0.27110479092723977, 'spread_hl_frac': 0.0062873080022093145, 'bb_std_mult': 1.2102822110580853, 'rsi_os': 19, 'rsi_ob': 91, 'vol_spike': 0.14245238997962117, 'adx_thresh': 33.729862865707695, 'atr_min_pct': 0.003667534578504, 'atr_max_pct': 0.0312130938277517, 'tp_mult': 1.359327119799967, 'tsl_mult': 0.2464847771142872, 'strategy': 'breakout', 'time_stop': 144, 'use_sma': False, 'use_atr': False, 'use_adx': True, 'use_ema': False, 'use_spike': False, 'rsi_required': True, 'edge_k': 1.9434090696170438, 'edge_cap': 0.7801306805706396}.
[I 2025-08-29 18:58:25,513] Trial 256 finished with values: [0.00018017137064663125, 0.0011185057488114789] and parameters: {'p_sma': 60, 'p_std': 46, 'p_atr': 14, 'p_adx': 22, 'rsi_period': 56, 'ema1': 8, 'ema2': 13, 'slip_atr_k': 0.022213497039784674, 'slip_spread_k': 0.0658442961273259, 'spread_hl_frac': 0.0062498201301136, 'bb_std_mult': 1.2195764851843822, 'rsi_os': 19, 'rsi_ob': 92, 'vol_spike': 0.14444627312613292, 'adx_thresh': 33.66231587240543, 'atr_min_pct': 0.00361005738292932, 'atr_max_pct': 0.031205471226285718, 'tp_mult': 1.3713287123315785, 'tsl_mult': 0.237807014136179, 'strategy': 'breakout', 'time_stop': 89, 'use_sma': False, 'use_atr': False, 'use_adx': True, 'use_ema': False, 'use_spike': False, 'rsi_required': True, 'edge_k': 1.884856635926176, 'edge_cap': 0.7810951245328108}.
[I 2025-08-29 18:58:53,028] Trial 260 finished with values: [-0.0005991983186817151, 0.001684180541358224] and parameters: {'p_sma': 57, 'p_std': 8, 'p_atr': 15, 'p_adx': 20, 'rsi_period': 58, 'ema1': 9, 'ema2': 26, 'slip_atr_k': 0.03513534032855073, 'slip_spread_k': 0.27257640995698995, 'spread_hl_frac': 0.007661961026466343, 'bb_std_mult': 1.2763824628979161, 'rsi_os': 21, 'rsi_ob': 91, 'vol_spike': 0.159663436187826, 'adx_thresh': 34.55870256471573, 'atr_min_pct': 0.004644835591132786, 'atr_max_pct': 0.03648045433072982, 'tp_mult': 1.2615527309364034, 'tsl_mult': 0.21413175465141598, 'strategy': 'breakout', 'time_stop': 156, 'use_sma': False, 'use_atr': False, 'use_adx': True, 'use_ema': False, 'use_spike': False, 'rsi_required': True, 'edge_k': 1.9060646256110703, 'edge_cap': 0.6138165404808023}.
[I 2025-08-29 18:58:53,352] Trial 258 finished with values: [-0.0007019708067560471, 0.001962675582550202] and parameters: {'p_sma': 60, 'p_std': 10, 'p_atr': 14, 'p_adx': 12, 'rsi_period': 55, 'ema1': 8, 'ema2': 14, 'slip_atr_k': 0.03241986051865483, 'slip_spread_k': 0.9562315109412256, 'spread_hl_frac': 0.00682038830014394, 'bb_std_mult': 1.2132029253648342, 'rsi_os': 19, 'rsi_ob': 93, 'vol_spike': 0.14369637132177104, 'adx_thresh': 33.65590105395152, 'atr_min_pct': 0.004529088592643284, 'atr_max_pct': 0.03127276996055937, 'tp_mult': 1.371434667383886, 'tsl_mult': 0.21501284567769424, 'strategy': 'breakout', 'time_stop': 100, 'use_sma': False, 'use_atr': False, 'use_adx': True, 'use_ema': False, 'use_spike': False, 'rsi_required': True, 'edge_k': 1.8871893364637637, 'edge_cap': 0.6083219079051806}.
[I 2025-08-29 18:58:53,443] Trial 259 finished with values: [-0.0004874630221188836, 0.0017661693536464038] and parameters: {'p_sma': 59, 'p_std': 8, 'p_atr': 15, 'p_adx': 14, 'rsi_period': 58, 'ema1': 9, 'ema2': 26, 'slip_atr_k': 0.03368929351603579, 'slip_spread_k': 0.2780716234645579, 'spread_hl_frac': 0.007574095282453779, 'bb_std_mult': 1.2954657675791588, 'rsi_os': 21, 'rsi_ob': 91, 'vol_spike': 0.14817095792729923, 'adx_thresh': 34.666509495305206, 'atr_min_pct': 0.004676932919609627, 'atr_max_pct': 0.03576427166305563, 'tp_mult': 1.2699050428902647, 'tsl_mult': 0.9485503720569044, 'strategy': 'breakout', 'time_stop': 157, 'use_sma': False, 'use_atr': False, 'use_adx': True, 'use_ema': False, 'use_spike': False, 'rsi_required': True, 'edge_k': 1.8864514158959576, 'edge_cap': 0.6147289599119796}.
[I 2025-08-29 18:58:53,528] Trial 261 finished with values: [0.000278692548303594, 0.001106957042382847] and parameters: {'p_sma': 57, 'p_std': 45, 'p_atr': 15, 'p_adx': 23, 'rsi_period': 53, 'ema1': 9, 'ema2': 13, 'slip_atr_k': 0.03211416702119918, 'slip_spread_k': 0.1232770098230896, 'spread_hl_frac': 0.008532543921759003, 'bb_std_mult': 1.2710815473344814, 'rsi_os': 19, 'rsi_ob': 93, 'vol_spike': 0.1340177527714137, 'adx_thresh': 34.99601091175965, 'atr_min_pct': 0.00350814793616565, 'atr_max_pct': 0.028740065264436156, 'tp_mult': 1.3957956505114093, 'tsl_mult': 0.2514534799436467, 'strategy': 'breakout', 'time_stop': 58, 'use_sma': False, 'use_atr': False, 'use_adx': True, 'use_ema': False, 'use_spike': False, 'rsi_required': True, 'edge_k': 1.880723577472757, 'edge_cap': 0.8045898168759016}.
[I 2025-08-29 18:59:20,988] Trial 263 finished with values: [-1000000000.0, 1000000000.0] and parameters: {'p_sma': 59, 'p_std': 46, 'p_atr': 14, 'p_adx': 26, 'rsi_period': 53, 'ema1': 9, 'ema2': 14, 'slip_atr_k': 0.03428659609312002, 'slip_spread_k': 0.13763057920832306, 'spread_hl_frac': 0.0076778663906622415, 'bb_std_mult': 1.2681758073147749, 'rsi_os': 18, 'rsi_ob': 93, 'vol_spike': 0.13603473895558946, 'adx_thresh': 34.99283284564006, 'atr_min_pct': 0.0032098740218354576, 'atr_max_pct': 0.028489270590357958, 'tp_mult': 1.4068040149466952, 'tsl_mult': 0.28131414544142674, 'strategy': 'breakout', 'time_stop': 53, 'use_sma': False, 'use_atr': False, 'use_adx': True, 'use_ema': False, 'use_spike': False, 'rsi_required': True, 'edge_k': 1.9011629644129233, 'edge_cap': 0.7894126105916061}.
[I 2025-08-29 18:59:21,329] Trial 265 finished with values: [0.00011657255151487078, 0.0010796119096678294] and parameters: {'p_sma': 56, 'p_std': 45, 'p_atr': 16, 'p_adx': 26, 'rsi_period': 52, 'ema1': 6, 'ema2': 35, 'slip_atr_k': 0.038497331739234295, 'slip_spread_k': 0.07023936940471816, 'spread_hl_frac': 0.00916651112677251, 'bb_std_mult': 1.3199287147356107, 'rsi_os': 17, 'rsi_ob': 93, 'vol_spike': 0.13153450060561414, 'adx_thresh': 34.59606271626967, 'atr_min_pct': 0.0031257929891762306, 'atr_max_pct': 0.0243867384082544, 'tp_mult': 1.415838295447262, 'tsl_mult': 0.32773618962512574, 'strategy': 'breakout', 'time_stop': 87, 'use_sma': False, 'use_atr': True, 'use_adx': True, 'use_ema': False, 'use_spike': False, 'rsi_required': True, 'edge_k': 1.8844872679345213, 'edge_cap': 0.7815237529147836}.
[I 2025-08-29 18:59:21,348] Trial 262 finished with values: [0.00010721721238882154, 0.0012982745498628955] and parameters: {'p_sma': 57, 'p_std': 47, 'p_atr': 15, 'p_adx': 23, 'rsi_period': 53, 'ema1': 9, 'ema2': 13, 'slip_atr_k': 0.03381826810849081, 'slip_spread_k': 0.06300748301415743, 'spread_hl_frac': 0.007993397933029764, 'bb_std_mult': 1.2722475116532292, 'rsi_os': 19, 'rsi_ob': 92, 'vol_spike': 0.13204666087504358, 'adx_thresh': 34.77013177170759, 'atr_min_pct': 0.0033637075874574478, 'atr_max_pct': 0.02817654012741503, 'tp_mult': 1.4107431329820745, 'tsl_mult': 0.2512584712322962, 'strategy': 'breakout', 'time_stop': 100, 'use_sma': False, 'use_atr': False, 'use_adx': True, 'use_ema': False, 'use_spike': False, 'rsi_required': True, 'edge_k': 1.8776522981689912, 'edge_cap': 0.7400929996474626}.
[I 2025-08-29 18:59:21,468] Trial 264 finished with values: [0.0001401323484380157, 0.0012905094079452173] and parameters: {'p_sma': 59, 'p_std': 45, 'p_atr': 15, 'p_adx': 23, 'rsi_period': 53, 'ema1': 9, 'ema2': 16, 'slip_atr_k': 0.033569688351197266, 'slip_spread_k': 0.029936257737961526, 'spread_hl_frac': 0.007581262196817124, 'bb_std_mult': 1.279579502050255, 'rsi_os': 19, 'rsi_ob': 93, 'vol_spike': 0.13092994576480887, 'adx_thresh': 34.463264904199896, 'atr_min_pct': 0.003311675139015622, 'atr_max_pct': 0.029565339454785892, 'tp_mult': 1.4152022050521462, 'tsl_mult': 0.294370110564923, 'strategy': 'breakout', 'time_stop': 87, 'use_sma': False, 'use_atr': False, 'use_adx': True, 'use_ema': False, 'use_spike': False, 'rsi_required': True, 'edge_k': 1.882856821472064, 'edge_cap': 0.7861827081898084}.
[I 2025-08-29 18:59:48,831] Trial 269 finished with values: [-0.0005555660878017177, 0.0016612166691128555] and parameters: {'p_sma': 55, 'p_std': 45, 'p_atr': 16, 'p_adx': 23, 'rsi_period': 52, 'ema1': 9, 'ema2': 35, 'slip_atr_k': 0.041018393183591, 'slip_spread_k': 0.06855546485087766, 'spread_hl_frac': 0.009141640833414916, 'bb_std_mult': 1.352793136213152, 'rsi_os': 16, 'rsi_ob': 95, 'vol_spike': 0.12934624821988633, 'adx_thresh': 34.94786939804598, 'atr_min_pct': 0.0028666446363834574, 'atr_max_pct': 0.023185593492595788, 'tp_mult': 1.439074584831751, 'tsl_mult': 0.29346623692933027, 'strategy': 'breakout', 'time_stop': 91, 'use_sma': False, 'use_atr': True, 'use_adx': True, 'use_ema': False, 'use_spike': False, 'rsi_required': True, 'edge_k': 1.8832332174067086, 'edge_cap': 0.8059312291282206}.
[I 2025-08-29 18:59:49,185] Trial 268 finished with values: [-0.0008015182126152043, 0.0018590494210441568] and parameters: {'p_sma': 55, 'p_std': 45, 'p_atr': 16, 'p_adx': 23, 'rsi_period': 53, 'ema1': 9, 'ema2': 37, 'slip_atr_k': 0.04431570269667644, 'slip_spread_k': 0.03592739837232993, 'spread_hl_frac': 0.009277245268410582, 'bb_std_mult': 1.2820553189597348, 'rsi_os': 17, 'rsi_ob': 94, 'vol_spike': 0.13112604405035655, 'adx_thresh': 34.99150527921641, 'atr_min_pct': 0.0025092000738745723, 'atr_max_pct': 0.02384702563370262, 'tp_mult': 1.4441519501696476, 'tsl_mult': 0.2972683750949261, 'strategy': 'breakout', 'time_stop': 88, 'use_sma': False, 'use_atr': True, 'use_adx': True, 'use_ema': False, 'use_spike': False, 'rsi_required': True, 'edge_k': 1.877016253994259, 'edge_cap': 0.8090345599452079}.
[I 2025-08-29 18:59:49,321] Trial 266 finished with values: [-0.00018873132833652217, 0.0012571410617509902] and parameters: {'p_sma': 56, 'p_std': 46, 'p_atr': 16, 'p_adx': 25, 'rsi_period': 53, 'ema1': 6, 'ema2': 16, 'slip_atr_k': 0.04143143928152932, 'slip_spread_k': 0.060917202871157525, 'spread_hl_frac': 0.009389967802425804, 'bb_std_mult': 1.3267055756628041, 'rsi_os': 17, 'rsi_ob': 95, 'vol_spike': 0.12793621517057724, 'adx_thresh': 34.995120024890696, 'atr_min_pct': 0.003013842085722861, 'atr_max_pct': 0.022985682773152938, 'tp_mult': 1.433046823072754, 'tsl_mult': 0.3155923915156229, 'strategy': 'breakout', 'time_stop': 56, 'use_sma': False, 'use_atr': True, 'use_adx': True, 'use_ema': False, 'use_spike': False, 'rsi_required': True, 'edge_k': 1.8876522174649526, 'edge_cap': 0.808043475566399}.
[I 2025-08-29 18:59:49,410] Trial 267 finished with values: [-0.0006330072508977658, 0.0017308738067027657] and parameters: {'p_sma': 55, 'p_std': 45, 'p_atr': 16, 'p_adx': 23, 'rsi_period': 52, 'ema1': 9, 'ema2': 34, 'slip_atr_k': 0.04248420580738707, 'slip_spread_k': 0.06818647814368099, 'spread_hl_frac': 0.009459993959236317, 'bb_std_mult': 1.326526192458253, 'rsi_os': 16, 'rsi_ob': 95, 'vol_spike': 0.12938611323106505, 'adx_thresh': 34.920149278164324, 'atr_min_pct': 0.0028495630382007753, 'atr_max_pct': 0.023278261986528964, 'tp_mult': 1.4360381783905327, 'tsl_mult': 0.3259240596213068, 'strategy': 'breakout', 'time_stop': 89, 'use_sma': False, 'use_atr': True, 'use_adx': True, 'use_ema': False, 'use_spike': False, 'rsi_required': True, 'edge_k': 1.8863981249199164, 'edge_cap': 0.8134321434481123}.
