[I 2025-08-29 19:23:51,804] Trial 486 finished with values: [-0.0016276314496727062, 0.0018806647177908697] and parameters: {'p_sma': 15, 'p_std': 33, 'p_atr': 30, 'p_adx': 22, 'rsi_period': 49, 'ema1': 9, 'ema2': 20, 'slip_atr_k': 0.15177619875849097, 'slip_spread_k': 0.4890522781461375, 'spread_hl_frac': 0.0002470873797744619, 'bb_std_mult': 1.612978647745002, 'rsi_os': 18, 'rsi_ob': 94, 'vol_spike': 0.15311934008390884, 'adx_thresh': 30.009233429449225, 'atr_min_pct': 0.002599251181262806, 'atr_max_pct': 0.12007682057741118, 'tp_mult': 1.534363915899319, 'tsl_mult': 0.2962967004637515, 'strategy': 'breakout', 'time_stop': 52, 'use_sma': False, 'use_atr': False, 'use_adx': False, 'use_ema': False, 'use_spike': True, 'rsi_required': True, 'edge_k': 1.7429242729247896, 'edge_cap': 0.2138002988021397}.
[I 2025-08-29 19:23:52,214] Trial 487 finished with values: [-1000000000.0, 1000000000.0] and parameters: {'p_sma': 28, 'p_std': 46, 'p_atr': 18, 'p_adx': 16, 'rsi_period': 49, 'ema1': 8, 'ema2': 25, 'slip_atr_k': 0.12839819527263666, 'slip_spread_k': 0.0012596319979512583, 'spread_hl_frac': 0.011198319875873372, 'bb_std_mult': 2.328671441082876, 'rsi_os': 18, 'rsi_ob': 94, 'vol_spike': 0.24947991572272843, 'adx_thresh': 28.656706618818127, 'atr_min_pct': 0.029988891798979525, 'atr_max_pct': 0.11999156653866899, 'tp_mult': 1.6393074694124632, 'tsl_mult': 0.2953996641523978, 'strategy': 'breakout', 'time_stop': 260, 'use_sma': False, 'use_atr': False, 'use_adx': False, 'use_ema': True, 'use_spike': True, 'rsi_required': True, 'edge_k': 1.9700505678815525, 'edge_cap': 0.2192258624911318}.
[I 2025-08-29 19:23:52,395] Trial 489 finished with values: [-1000000000.0, 1000000000.0] and parameters: {'p_sma': 20, 'p_std': 60, 'p_atr': 18, 'p_adx': 22, 'rsi_period': 49, 'ema1': 8, 'ema2': 26, 'slip_atr_k': 0.12454804556810839, 'slip_spread_k': 0.052944717301561695, 'spread_hl_frac': 0.011138767763961919, 'bb_std_mult': 1.429071118051973, 'rsi_os': 55, 'rsi_ob': 93, 'vol_spike': 0.04467778313530936, 'adx_thresh': 33.418758828255015, 'atr_min_pct': 0.02929296073457945, 'atr_max_pct': 0.023523900667231618, 'tp_mult': 2.088945474369917, 'tsl_mult': 0.31404300818409336, 'strategy': 'breakout', 'time_stop': 52, 'use_sma': True, 'use_atr': False, 'use_adx': False, 'use_ema': True, 'use_spike': True, 'rsi_required': False, 'edge_k': 1.9240122709599052, 'edge_cap': 0.8545862263679788}.
[I 2025-08-29 19:24:19,929] Trial 492 finished with values: [-1000000000.0, 1000000000.0] and parameters: {'p_sma': 32, 'p_std': 47, 'p_atr': 19, 'p_adx': 23, 'rsi_period': 45, 'ema1': 11, 'ema2': 18, 'slip_atr_k': 0.03101550842867013, 'slip_spread_k': 0.01727445598096112, 'spread_hl_frac': 0.009882529451541007, 'bb_std_mult': 1.8852967388244346, 'rsi_os': 21, 'rsi_ob': 92, 'vol_spike': 0.14422096110703023, 'adx_thresh': 34.40294251195236, 'atr_min_pct': 0.02429993510764339, 'atr_max_pct': 0.0603108596904903, 'tp_mult': 1.7871496448743227, 'tsl_mult': 0.261053295542077, 'strategy': 'mean_reversion', 'time_stop': 64, 'use_sma': True, 'use_atr': False, 'use_adx': False, 'use_ema': False, 'use_spike': False, 'rsi_required': False, 'edge_k': 0.8841620903242683, 'edge_cap': 0.5038535299472439}.
[I 2025-08-29 19:24:20,142] Trial 488 finished with values: [-1000000000.0, 1000000000.0] and parameters: {'p_sma': 20, 'p_std': 26, 'p_atr': 26, 'p_adx': 22, 'rsi_period': 49, 'ema1': 9, 'ema2': 26, 'slip_atr_k': 0.15091207671531995, 'slip_spread_k': 0.045392862597548704, 'spread_hl_frac': 0.009826834968344897, 'bb_std_mult': 1.459535671094128, 'rsi_os': 18, 'rsi_ob': 93, 'vol_spike': 0.15362145633780167, 'adx_thresh': 29.815032380126127, 'atr_min_pct': 0.022828241184549597, 'atr_max_pct': 0.10595354668503254, 'tp_mult': 2.5653325557745412, 'tsl_mult': 0.4667541410914588, 'strategy': 'breakout', 'time_stop': 48, 'use_sma': True, 'use_atr': False, 'use_adx': False, 'use_ema': True, 'use_spike': True, 'rsi_required': False, 'edge_k': 0.33792687017294387, 'edge_cap': 0.668875462407432}.
[I 2025-08-29 19:24:20,418] Trial 491 finished with values: [-1000000000.0, 1000000000.0] and parameters: {'p_sma': 37, 'p_std': 47, 'p_atr': 19, 'p_adx': 13, 'rsi_period': 47, 'ema1': 22, 'ema2': 21, 'slip_atr_k': 0.031692550617718904, 'slip_spread_k': 0.42905515363274377, 'spread_hl_frac': 0.04276994014078127, 'bb_std_mult': 1.4335522017115847, 'rsi_os': 39, 'rsi_ob': 92, 'vol_spike': 0.043337804295508056, 'adx_thresh': 33.45518233464836, 'atr_min_pct': 8.481426747280162e-05, 'atr_max_pct': 0.02288397847449882, 'tp_mult': 2.0753208553610047, 'tsl_mult': 0.34753516708721466, 'strategy': 'mean_reversion', 'time_stop': 66, 'use_sma': True, 'use_atr': False, 'use_adx': False, 'use_ema': True, 'use_spike': False, 'rsi_required': False, 'edge_k': 1.1728916028229555, 'edge_cap': 0.638083770494092}.
[I 2025-08-29 19:24:20,582] Trial 490 finished with values: [-1000000000.0, 1000000000.0] and parameters: {'p_sma': 32, 'p_std': 46, 'p_atr': 18, 'p_adx': 23, 'rsi_period': 46, 'ema1': 8, 'ema2': 26, 'slip_atr_k': 0.12613261847177348, 'slip_spread_k': 0.04908281200785758, 'spread_hl_frac': 0.044767505217170336, 'bb_std_mult': 1.392291388418074, 'rsi_os': 55, 'rsi_ob': 92, 'vol_spike': 0.1442153165852956, 'adx_thresh': 32.2264477042575, 'atr_min_pct': 0.022873431466526907, 'atr_max_pct': 0.0591583774816275, 'tp_mult': 1.630457752769761, 'tsl_mult': 0.57297559464458, 'strategy': 'breakout', 'time_stop': 46, 'use_sma': True, 'use_atr': False, 'use_adx': False, 'use_ema': True, 'use_spike': True, 'rsi_required': False, 'edge_k': 1.9995836253613208, 'edge_cap': 0.39877361166093217}.
[I 2025-08-29 19:24:46,688] Trial 494 finished with values: [3.2167611869748924e-05, 0.0012688034969427307] and parameters: {'p_sma': 35, 'p_std': 43, 'p_atr': 19, 'p_adx': 23, 'rsi_period': 47, 'ema1': 30, 'ema2': 22, 'slip_atr_k': 0.029464086365265027, 'slip_spread_k': 0.0009749813742147363, 'spread_hl_frac': 0.008794651458622297, 'bb_std_mult': 1.3436907890480052, 'rsi_os': 20, 'rsi_ob': 72, 'vol_spike': 0.11327418186446202, 'adx_thresh': 17.11552933560067, 'atr_min_pct': 0.004447433029227994, 'atr_max_pct': 0.027078683257978783, 'tp_mult': 2.735246826916255, 'tsl_mult': 0.07777176243668632, 'strategy': 'breakout', 'time_stop': 96, 'use_sma': False, 'use_atr': False, 'use_adx': False, 'use_ema': False, 'use_spike': False, 'rsi_required': True, 'edge_k': 1.6278304672393347, 'edge_cap': 0.8930819257036444}.
[I 2025-08-29 19:24:47,011] Trial 496 finished with values: [-0.0035540473439201747, 0.003575492838692119] and parameters: {'p_sma': 13, 'p_std': 43, 'p_atr': 19, 'p_adx': 24, 'rsi_period': 51, 'ema1': 7, 'ema2': 49, 'slip_atr_k': 0.17370287297888184, 'slip_spread_k': 0.016730350562209922, 'spread_hl_frac': 0.033250014742352285, 'bb_std_mult': 2.4553780401822167, 'rsi_os': 49, 'rsi_ob': 53, 'vol_spike': 0.19399116704197425, 'adx_thresh': 33.929548393721355, 'atr_min_pct': 0.004133926725397056, 'atr_max_pct': 0.03988664994976011, 'tp_mult': 2.723134952154375, 'tsl_mult': 0.37056153952780896, 'strategy': 'breakout', 'time_stop': 96, 'use_sma': False, 'use_atr': True, 'use_adx': False, 'use_ema': False, 'use_spike': False, 'rsi_required': True, 'edge_k': 0.5728104209845706, 'edge_cap': 0.5346266246610932}.
[I 2025-08-29 19:24:47,011] Trial 495 finished with values: [-0.005490067941549048, 0.005578629608780128] and parameters: {'p_sma': 54, 'p_std': 46, 'p_atr': 21, 'p_adx': 23, 'rsi_period': 47, 'ema1': 7, 'ema2': 31, 'slip_atr_k': 0.1096499330092165, 'slip_spread_k': 0.01704124782945423, 'spread_hl_frac': 0.03499912129229099, 'bb_std_mult': 1.2171471301827332, 'rsi_os': 32, 'rsi_ob': 74, 'vol_spike': 0.191630792958122, 'adx_thresh': 17.006573350090818, 'atr_min_pct': 0.004059927260207307, 'atr_max_pct': 0.043676003744907335, 'tp_mult': 2.304832557474781, 'tsl_mult': 0.5631315572948529, 'strategy': 'breakout', 'time_stop': 58, 'use_sma': False, 'use_atr': False, 'use_adx': False, 'use_ema': False, 'use_spike': False, 'rsi_required': True, 'edge_k': 1.9992702154974231, 'edge_cap': 0.43598690111713256}.
[I 2025-08-29 19:24:47,080] Trial 493 finished with values: [-0.06543398794338351, 0.06544752487184484] and parameters: {'p_sma': 54, 'p_std': 43, 'p_atr': 19, 'p_adx': 24, 'rsi_period': 47, 'ema1': 9, 'ema2': 46, 'slip_atr_k': 0.02914717299164481, 'slip_spread_k': 0.42467312708180255, 'spread_hl_frac': 0.009832398960079324, 'bb_std_mult': 1.3784466223383978, 'rsi_os': 47, 'rsi_ob': 83, 'vol_spike': 0.13903250307026216, 'adx_thresh': 17.005156079798567, 'atr_min_pct': 0.0017674781394835903, 'atr_max_pct': 0.04971232598316953, 'tp_mult': 2.5588375162100556, 'tsl_mult': 0.9136803212220861, 'strategy': 'breakout', 'time_stop': 45, 'use_sma': False, 'use_atr': False, 'use_adx': False, 'use_ema': False, 'use_spike': False, 'rsi_required': True, 'edge_k': 1.9038261020606055, 'edge_cap': 0.885351093613089}.
[I 2025-08-29 19:25:06,736] Trial 499 finished with values: [-0.02119718239739088, 0.02117897645234004] and parameters: {'p_sma': 41, 'p_std': 15, 'p_atr': 9, 'p_adx': 23, 'rsi_period': 50, 'ema1': 9, 'ema2': 33, 'slip_atr_k': 0.02392229543226366, 'slip_spread_k': 0.016339901894711982, 'spread_hl_frac': 0.008626164242209251, 'bb_std_mult': 2.047755291561396, 'rsi_os': 20, 'rsi_ob': 66, 'vol_spike': 0.12299436976604669, 'adx_thresh': 34.44038459071042, 'atr_min_pct': 0.0012501272702191936, 'atr_max_pct': 0.02767416698202156, 'tp_mult': 1.702682495930515, 'tsl_mult': 0.07047755717268789, 'strategy': 'mean_reversion', 'time_stop': 7, 'use_sma': False, 'use_atr': False, 'use_adx': False, 'use_ema': False, 'use_spike': False, 'rsi_required': True, 'edge_k': 1.879312586426809, 'edge_cap': 0.8963515525209735}.
[I 2025-08-29 19:25:06,867] Trial 498 finished with values: [-0.004449280246768494, 0.004443260291291701] and parameters: {'p_sma': 47, 'p_std': 58, 'p_atr': 17, 'p_adx': 24, 'rsi_period': 48, 'ema1': 13, 'ema2': 29, 'slip_atr_k': 0.0842744654898328, 'slip_spread_k': 0.0011158955310821797, 'spread_hl_frac': 0.008875454709584263, 'bb_std_mult': 1.7147927554390943, 'rsi_os': 47, 'rsi_ob': 78, 'vol_spike': 0.24225735399558723, 'adx_thresh': 5.020563734183524, 'atr_min_pct': 0.0032133801631455392, 'atr_max_pct': 0.02760557146280706, 'tp_mult': 1.7254458124382046, 'tsl_mult': 0.9113236956486136, 'strategy': 'mean_reversion', 'time_stop': 129, 'use_sma': False, 'use_atr': False, 'use_adx': False, 'use_ema': False, 'use_spike': False, 'rsi_required': True, 'edge_k': 1.9147656491388643, 'edge_cap': 0.9504585249003342}.
[I 2025-08-29 19:25:06,947] Trial 497 finished with values: [-0.0048886259046933, 0.004974596218157864] and parameters: {'p_sma': 41, 'p_std': 18, 'p_atr': 21, 'p_adx': 24, 'rsi_period': 51, 'ema1': 7, 'ema2': 46, 'slip_atr_k': 0.0943673948068609, 'slip_spread_k': 0.01872110339530998, 'spread_hl_frac': 0.04905624697165798, 'bb_std_mult': 1.729330103325721, 'rsi_os': 52, 'rsi_ob': 93, 'vol_spike': 0.21833570199385116, 'adx_thresh': 33.962739818563705, 'atr_min_pct': 0.005501351080189437, 'atr_max_pct': 0.043164726287552024, 'tp_mult': 1.7248970409258484, 'tsl_mult': 0.17374814653941034, 'strategy': 'breakout', 'time_stop': 58, 'use_sma': False, 'use_atr': False, 'use_adx': False, 'use_ema': False, 'use_spike': False, 'rsi_required': True, 'edge_k': 0.5494326303132975, 'edge_cap': 0.1472825689664113}.
Starting optimization (500 trials, n_jobs=4) | multi-objective=True
Saved trials CSV -> runs/FUT_SHORT_fee1e-3_slip6e-4_robust_r2/trials_metrics.csv
Saved Pareto plot -> runs/FUT_SHORT_fee1e-3_slip6e-4_robust_r2/pareto_return_vs_drawdown.png
Top-K under DD cap: [165] (agg='median')
=== Selected trial(s) ===
top_k=1 selected_trial_numbers=[165] primary=165
ret%_train=0.10% dd%_train=-0.01% trades=26
ret%_test=0.08% dd%_test=-0.01% pnl_test=16.84 trades_test=19
Dumped TEST trades -> runs/FUT_SHORT_fee1e-3_slip6e-4_robust_r2/test_trades.csv
WFO fold 1: OOS PnL=0.00 trades=0 win_rate=0.00% avg=0.000000 ret%=0.00% maxDD=0.000000 maxDD%=0.00%
WFO fold 2: OOS PnL=5.79 trades=12 win_rate=50.00% avg=0.482760 ret%=0.03% maxDD=-2.198504 maxDD%=-0.01%
WFO fold 3: OOS PnL=0.00 trades=0 win_rate=0.00% avg=0.000000 ret%=0.00% maxDD=0.000000 maxDD%=0.00%
WFO fold 4: OOS PnL=12.12 trades=4 win_rate=50.00% avg=3.029803 ret%=0.06% maxDD=-1.418626 maxDD%=-0.01%
WFO fold 5: OOS PnL=0.00 trades=0 win_rate=0.00% avg=0.000000 ret%=0.00% maxDD=0.000000 maxDD%=0.00%
WFO fold 6: OOS PnL=-0.96 trades=2 win_rate=50.00% avg=-0.479179 ret%=-0.00% maxDD=-1.391409 maxDD%=-0.01%
WFO fold 7: OOS PnL=0.00 trades=0 win_rate=0.00% avg=0.000000 ret%=0.00% maxDD=0.000000 maxDD%=0.00%
WFO fold 8: OOS PnL=-0.11 trades=1 win_rate=0.00% avg=-0.114952 ret%=-0.00% maxDD=0.000000 maxDD%=0.00%
WFO summary: meanPnL=2.10 stdPnL=4.27 meanWR=18.75% meanAvg=0.364804 meanRet%=0.01% worstDD=-2.198504 worstDD%=-0.01% folds=8 trades=19
Wrote runs/FUT_SHORT_fee1e-3_slip6e-4_robust_r2/strategy_profile.json
=== ECHO SELECTED PARAMS (JSON) ===
{
  "adx_thresh": 31.882199061894454,
  "aggregate_params": "median",
  "atr_max_pct": 0.13217056797001286,
  "atr_min_pct": 0.008169467738309398,
  "bar_priority": "stop_first",
  "bb_std_mult": 0.9723550744255691,
  "cooldown_bars": 30,
  "daily_loss_limit_pct": 0.03,
  "edge_cap": 0.13825288421797666,
  "edge_k": 0.7585075454018133,
  "ema1": 15,
  "ema2": 48,
  "embargo_bars": 300,
  "fee": 0.001,
  "fill_timing": "next_open",
  "include_hours_set": null,
  "lockout_bars": 60,
  "max_consec_losses": 3,
  "max_notional_pct_equity": 1.0,
  "min_notional": 5.0,
  "ml_thresh": 0.0,
  "objective": "multi",
  "p_adx": 20,
  "p_atr": 14,
  "p_sma": 51,
  "p_std": 28,
  "participation_cap": 1.0,
  "price_step": 0.0001,
  "proba_temp": 1.0,
  "qty_step": 0.0001,
  "regime_adapt": true,
  "regime_band": 0.006,
  "regime_fast": 50,
  "regime_overrides": {
    "bear": {
      "adx": 20.0,
      "allowed_sides": [
        "long",
        "short"
      ],
      "atr_range": [
        0.0015,
        0.06
      ],
      "bb_std_mult": 1.2571599337995167,
      "mode": "breakout",
      "rsi_required": true,
      "time_stop_bars": 122,
      "tp_mult": 1.7149673432024581,
      "tsl_mult": 0.25,
      "use_adx": true,
      "use_atr": true
    },
    "bull": {
      "adx": 18.0,
      "allowed_sides": [
        "long",
        "short"
      ],
      "atr_range": [
        0.0008,
        0.06
      ],
      "bb_std_mult": 2.0169431746748376,
      "mode": "mean_reversion",
      "rsi_required": false,
      "time_stop_bars": 214,
      "tp_mult": 1.9194251920826044,
      "tsl_mult": 0.6891458682949287,
      "use_adx": true,
      "use_atr": true
    },
    "sideways": {
      "adx": 15.0,
      "allowed_sides": [
        "long",
        "short"
      ],
      "atr_range": [
        0.001,
        0.14
      ],
      "bb_std_mult": 1.5828092896467827,
      "mode": "breakout",
      "rsi_required": true,
      "time_stop_bars": 235,
      "tp_mult": 2.341879695778944,
      "tsl_mult": 0.651967765830165,
      "use_adx": true,
      "use_atr": true
    }
  },
  "regime_slow": 200,
  "risk_min_stop_frac": 0.001,
  "risk_per_trade": 0.003,
  "risk_stop_atr_mult": 1.0,
  "round_exits": true,
  "rsi_key": "rsi49",
  "rsi_ob": 50,
  "rsi_os": 19,
  "rsi_period": 49,
  "rsi_required": true,
  "select_top_k": 1,
  "session_end": 24,
  "session_start": 0,
  "sides": "short",
  "slip_atr_k": 0.008356481246567547,
  "slip_spread_k": 0.2973316160902215,
  "slippage": 0.0006,
  "spread_hl_frac": 0.001312483041840913,
  "start_equity": 20000.0,
  "stop_extra_slip": 0.0,
  "strategy": "breakout",
  "time_stop": 169,
  "tp_mult": 1.57819361949434,
  "tsl_mult": 0.4744296319088558,
  "use_adx": true,
  "use_atr": false,
  "use_ema": false,
  "use_ml": false,
  "use_sma": false,
  "use_spike": false,
  "vol_spike": 0.16074014448276125,
  "wfo_folds": 8
}
Wrote runs/FUT_SHORT_fee1e-3_slip6e-4_robust_r2/best_params.pkl
