[I 2025-08-29 19:08:47,495] Trial 350 finished with values: [-0.007138678945397214, 0.0071195399977136775] and parameters: {'p_sma': 50, 'p_std': 59, 'p_atr': 20, 'p_adx': 25, 'rsi_period': 33, 'ema1': 19, 'ema2': 21, 'slip_atr_k': 0.07093772588581185, 'slip_spread_k': 0.0017805479459280734, 'spread_hl_frac': 0.03486799950536747, 'bb_std_mult': 0.6383414485653702, 'rsi_os': 34, 'rsi_ob': 95, 'vol_spike': 0.14579088779578625, 'adx_thresh': 32.86124761090752, 'atr_min_pct': 0.0002162380109168669, 'atr_max_pct': 0.05790118655303322, 'tp_mult': 1.546572774303611, 'tsl_mult': 0.29844477037272926, 'strategy': 'mean_reversion', 'time_stop': 48, 'use_sma': True, 'use_atr': False, 'use_adx': False, 'use_ema': False, 'use_spike': False, 'rsi_required': True, 'edge_k': 1.9643512566920776, 'edge_cap': 0.6010804716838336}.
[I 2025-08-29 19:08:47,496] Trial 349 finished with values: [-1000000000.0, 1000000000.0] and parameters: {'p_sma': 26, 'p_std': 59, 'p_atr': 20, 'p_adx': 22, 'rsi_period': 32, 'ema1': 10, 'ema2': 21, 'slip_atr_k': 0.037549827614260345, 'slip_spread_k': 5.28436595580474e-05, 'spread_hl_frac': 0.008583137807253323, 'bb_std_mult': 3.523746365576983, 'rsi_os': 10, 'rsi_ob': 95, 'vol_spike': 0.144901044979071, 'adx_thresh': 7.514650074962985, 'atr_min_pct': 0.013398554190048373, 'atr_max_pct': 0.02891595349621795, 'tp_mult': 1.5898663219493274, 'tsl_mult': 0.6644298042785999, 'strategy': 'mean_reversion', 'time_stop': 49, 'use_sma': True, 'use_atr': False, 'use_adx': False, 'use_ema': False, 'use_spike': False, 'rsi_required': True, 'edge_k': 1.2141483555586645, 'edge_cap': 0.3181612637379596}.
[I 2025-08-29 19:08:47,671] Trial 353 finished with values: [-1000000000.0, 1000000000.0] and parameters: {'p_sma': 50, 'p_std': 47, 'p_atr': 21, 'p_adx': 23, 'rsi_period': 47, 'ema1': 10, 'ema2': 26, 'slip_atr_k': 0.025485503719934292, 'slip_spread_k': 0.35966466758493343, 'spread_hl_frac': 0.029154254266742407, 'bb_std_mult': 3.527287770595418, 'rsi_os': 15, 'rsi_ob': 94, 'vol_spike': 0.1402206270555765, 'adx_thresh': 32.99803400897064, 'atr_min_pct': 0.026154727730742656, 'atr_max_pct': 0.023581046558051946, 'tp_mult': 1.8499230344361552, 'tsl_mult': 0.3210919933516319, 'strategy': 'mean_reversion', 'time_stop': 49, 'use_sma': True, 'use_atr': False, 'use_adx': False, 'use_ema': False, 'use_spike': False, 'rsi_required': True, 'edge_k': 0.4545107249465632, 'edge_cap': 0.6253921792341843}.
[I 2025-08-29 19:09:13,477] Trial 354 finished with values: [-1000000000.0, 1000000000.0] and parameters: {'p_sma': 53, 'p_std': 47, 'p_atr': 19, 'p_adx': 23, 'rsi_period': 45, 'ema1': 19, 'ema2': 26, 'slip_atr_k': 0.026200701020571066, 'slip_spread_k': 0.00017961915294230834, 'spread_hl_frac': 0.007422198076020887, 'bb_std_mult': 0.6399585539921127, 'rsi_os': 34, 'rsi_ob': 95, 'vol_spike': 0.13898263849027404, 'adx_thresh': 7.327720508397427, 'atr_min_pct': 0.01505667665718865, 'atr_max_pct': 0.025723170842108862, 'tp_mult': 1.544141979428176, 'tsl_mult': 0.3223448566930217, 'strategy': 'breakout', 'time_stop': 50, 'use_sma': False, 'use_atr': False, 'use_adx': False, 'use_ema': False, 'use_spike': False, 'rsi_required': True, 'edge_k': 1.9541043498071906, 'edge_cap': 0.8833363134580768}.
[I 2025-08-29 19:09:13,550] Trial 356 finished with values: [-1000000000.0, 1000000000.0] and parameters: {'p_sma': 39, 'p_std': 47, 'p_atr': 19, 'p_adx': 23, 'rsi_period': 46, 'ema1': 9, 'ema2': 30, 'slip_atr_k': 0.10429839269159519, 'slip_spread_k': 0.8724688266011765, 'spread_hl_frac': 0.02785560056330295, 'bb_std_mult': 1.163867084257728, 'rsi_os': 15, 'rsi_ob': 56, 'vol_spike': 0.13775239852709975, 'adx_thresh': 9.115450057374128, 'atr_min_pct': 0.01757561407491373, 'atr_max_pct': 0.025198892346579634, 'tp_mult': 1.9753205935130793, 'tsl_mult': 0.31805654423050195, 'strategy': 'breakout', 'time_stop': 6, 'use_sma': False, 'use_atr': False, 'use_adx': False, 'use_ema': False, 'use_spike': False, 'rsi_required': True, 'edge_k': 1.9998302270339359, 'edge_cap': 0.8851805947583439}.
[I 2025-08-29 19:09:13,688] Trial 355 finished with values: [-1000000000.0, 1000000000.0] and parameters: {'p_sma': 6, 'p_std': 47, 'p_atr': 19, 'p_adx': 23, 'rsi_period': 46, 'ema1': 9, 'ema2': 31, 'slip_atr_k': 0.11857209802079652, 'slip_spread_k': 0.8729249283281175, 'spread_hl_frac': 0.008071781257090785, 'bb_std_mult': 1.1501512121002513, 'rsi_os': 18, 'rsi_ob': 94, 'vol_spike': 0.1268179307044162, 'adx_thresh': 8.716020686093334, 'atr_min_pct': 0.0029786539853804378, 'atr_max_pct': 0.02884611988481789, 'tp_mult': 1.8309404670835028, 'tsl_mult': 0.6580273679129304, 'strategy': 'breakout', 'time_stop': 18, 'use_sma': False, 'use_atr': False, 'use_adx': False, 'use_ema': False, 'use_spike': False, 'rsi_required': True, 'edge_k': 1.9190388570778414, 'edge_cap': 0.6263571221498166}.
[I 2025-08-29 19:09:13,885] Trial 357 finished with values: [-0.026634084971582705, 0.02667558582405886] and parameters: {'p_sma': 38, 'p_std': 47, 'p_atr': 24, 'p_adx': 23, 'rsi_period': 45, 'ema1': 9, 'ema2': 17, 'slip_atr_k': 0.2120915083741837, 'slip_spread_k': 0.4940552948356846, 'spread_hl_frac': 0.007387138709891411, 'bb_std_mult': 1.1636771581723384, 'rsi_os': 46, 'rsi_ob': 94, 'vol_spike': 0.12857450663326808, 'adx_thresh': 33.76611948014463, 'atr_min_pct': 0.0028198746487810063, 'atr_max_pct': 0.02692046017147843, 'tp_mult': 2.3706873518350724, 'tsl_mult': 0.31957139085688285, 'strategy': 'breakout', 'time_stop': 243, 'use_sma': False, 'use_atr': False, 'use_adx': False, 'use_ema': False, 'use_spike': False, 'rsi_required': True, 'edge_k': 1.9986571518595309, 'edge_cap': 0.18582938048070446}.
[I 2025-08-29 19:09:40,132] Trial 359 finished with values: [-1000000000.0, 1000000000.0] and parameters: {'p_sma': 47, 'p_std': 43, 'p_atr': 19, 'p_adx': 13, 'rsi_period': 75, 'ema1': 9, 'ema2': 23, 'slip_atr_k': 0.11977352211683415, 'slip_spread_k': 0.9318250094932105, 'spread_hl_frac': 0.03773138089384847, 'bb_std_mult': 3.161905743639924, 'rsi_os': 52, 'rsi_ob': 78, 'vol_spike': 0.0021644180893347076, 'adx_thresh': 5.533072788801185, 'atr_min_pct': 0.02159952493698017, 'atr_max_pct': 0.030153432522557304, 'tp_mult': 2.383510253062414, 'tsl_mult': 0.34103122109297723, 'strategy': 'breakout', 'time_stop': 68, 'use_sma': False, 'use_atr': False, 'use_adx': False, 'use_ema': False, 'use_spike': False, 'rsi_required': True, 'edge_k': 0.06534515090542925, 'edge_cap': 0.5327382143896682}.
[I 2025-08-29 19:09:40,362] Trial 358 finished with values: [-0.005182912231440628, 0.0052248411189727605] and parameters: {'p_sma': 36, 'p_std': 42, 'p_atr': 24, 'p_adx': 13, 'rsi_period': 48, 'ema1': 9, 'ema2': 24, 'slip_atr_k': 0.21339365361596707, 'slip_spread_k': 0.535030230207071, 'spread_hl_frac': 0.00977354814187123, 'bb_std_mult': 3.1086223159478417, 'rsi_os': 18, 'rsi_ob': 74, 'vol_spike': 0.26974966967886216, 'adx_thresh': 33.61559147187014, 'atr_min_pct': 0.0029401218246689832, 'atr_max_pct': 0.030165257557496508, 'tp_mult': 1.691510862129325, 'tsl_mult': 0.3438344704918873, 'strategy': 'breakout', 'time_stop': 70, 'use_sma': False, 'use_atr': False, 'use_adx': False, 'use_ema': False, 'use_spike': False, 'rsi_required': True, 'edge_k': 0.07686383208839442, 'edge_cap': 0.36352412785650745}.
[I 2025-08-29 19:09:40,784] Trial 360 finished with values: [-0.019356754076734206, 0.019424159938508344] and parameters: {'p_sma': 45, 'p_std': 43, 'p_atr': 30, 'p_adx': 16, 'rsi_period': 75, 'ema1': 10, 'ema2': 24, 'slip_atr_k': 0.19477368297228292, 'slip_spread_k': 0.7074742197796818, 'spread_hl_frac': 0.009817644154197228, 'bb_std_mult': 1.2522751138878734, 'rsi_os': 42, 'rsi_ob': 54, 'vol_spike': 0.2689821667904137, 'adx_thresh': 6.132468291488898, 'atr_min_pct': 0.003742199093908983, 'atr_max_pct': 0.06637047305803959, 'tp_mult': 2.482852903588772, 'tsl_mult': 0.783541140014725, 'strategy': 'breakout', 'time_stop': 70, 'use_sma': False, 'use_atr': False, 'use_adx': False, 'use_ema': True, 'use_spike': False, 'rsi_required': True, 'edge_k': 1.9590691444079769, 'edge_cap': 0.5265369129321718}.
[I 2025-08-29 19:09:40,903] Trial 361 finished with values: [-1000000000.0, 1000000000.0] and parameters: {'p_sma': 43, 'p_std': 36, 'p_atr': 18, 'p_adx': 13, 'rsi_period': 48, 'ema1': 8, 'ema2': 29, 'slip_atr_k': 0.05542829989723452, 'slip_spread_k': 0.6957698650126998, 'spread_hl_frac': 0.00969687472239088, 'bb_std_mult': 1.2965812551237388, 'rsi_os': 53, 'rsi_ob': 93, 'vol_spike': 0.08681027937291426, 'adx_thresh': 34.4451269103803, 'atr_min_pct': 0.010368981568696728, 'atr_max_pct': 0.06551781641994081, 'tp_mult': 2.844802461655904, 'tsl_mult': 0.33586391645963626, 'strategy': 'breakout', 'time_stop': 70, 'use_sma': False, 'use_atr': False, 'use_adx': False, 'use_ema': True, 'use_spike': False, 'rsi_required': False, 'edge_k': 1.912311256843539, 'edge_cap': 0.7587850531397449}.
[I 2025-08-29 19:10:08,402] Trial 362 finished with values: [-1000000000.0, 1000000000.0] and parameters: {'p_sma': 44, 'p_std': 36, 'p_atr': 18, 'p_adx': 27, 'rsi_period': 49, 'ema1': 8, 'ema2': 19, 'slip_atr_k': 0.031875596449683304, 'slip_spread_k': 0.7852260176201951, 'spread_hl_frac': 0.009687325285569249, 'bb_std_mult': 1.2915394517715384, 'rsi_os': 13, 'rsi_ob': 93, 'vol_spike': 0.13449670540250847, 'adx_thresh': 34.45414539403573, 'atr_min_pct': 0.02313231932932429, 'atr_max_pct': 0.06703022187126374, 'tp_mult': 1.6945065204748397, 'tsl_mult': 0.34627894066049536, 'strategy': 'breakout', 'time_stop': 56, 'use_sma': False, 'use_atr': True, 'use_adx': False, 'use_ema': True, 'use_spike': False, 'rsi_required': False, 'edge_k': 1.9229235955257888, 'edge_cap': 0.9583887630023813}.
[I 2025-08-29 19:10:08,596] Trial 365 finished with values: [-1000000000.0, 1000000000.0] and parameters: {'p_sma': 8, 'p_std': 44, 'p_atr': 7, 'p_adx': 26, 'rsi_period': 71, 'ema1': 8, 'ema2': 19, 'slip_atr_k': 0.030999571501023695, 'slip_spread_k': 0.7650092468139007, 'spread_hl_frac': 0.020081678000308776, 'bb_std_mult': 1.3525942757303948, 'rsi_os': 19, 'rsi_ob': 94, 'vol_spike': 0.01447331062959581, 'adx_thresh': 24.290966490582793, 'atr_min_pct': 0.012179905178994426, 'atr_max_pct': 0.13688821813953678, 'tp_mult': 2.0961405488878757, 'tsl_mult': 0.3683021949685099, 'strategy': 'breakout', 'time_stop': 56, 'use_sma': False, 'use_atr': True, 'use_adx': False, 'use_ema': False, 'use_spike': True, 'rsi_required': False, 'edge_k': 1.9599260587726546, 'edge_cap': 0.9551085040787091}.
[I 2025-08-29 19:10:09,020] Trial 364 finished with values: [-1000000000.0, 1000000000.0] and parameters: {'p_sma': 23, 'p_std': 44, 'p_atr': 18, 'p_adx': 27, 'rsi_period': 50, 'ema1': 20, 'ema2': 40, 'slip_atr_k': 0.03037768762705713, 'slip_spread_k': 0.788149094249154, 'spread_hl_frac': 0.02086569644316688, 'bb_std_mult': 1.347751474491518, 'rsi_os': 13, 'rsi_ob': 93, 'vol_spike': 0.024784662390096607, 'adx_thresh': 22.555962339635162, 'atr_min_pct': 0.023334964610412408, 'atr_max_pct': 0.0725621975592942, 'tp_mult': 2.224879927346549, 'tsl_mult': 0.30189669840398303, 'strategy': 'breakout', 'time_stop': 35, 'use_sma': False, 'use_atr': True, 'use_adx': False, 'use_ema': True, 'use_spike': True, 'rsi_required': False, 'edge_k': 1.4453861803076096, 'edge_cap': 0.954668815278867}.
[I 2025-08-29 19:10:09,078] Trial 363 finished with values: [-1000000000.0, 1000000000.0] and parameters: {'p_sma': 9, 'p_std': 44, 'p_atr': 18, 'p_adx': 26, 'rsi_period': 49, 'ema1': 10, 'ema2': 19, 'slip_atr_k': 0.08085339465657282, 'slip_spread_k': 0.034804451639945576, 'spread_hl_frac': 0.009309858004560813, 'bb_std_mult': 1.2580374951921505, 'rsi_os': 41, 'rsi_ob': 93, 'vol_spike': 0.07759702780620308, 'adx_thresh': 34.58173102663344, 'atr_min_pct': 0.010398536231829056, 'atr_max_pct': 0.019193457960282014, 'tp_mult': 2.1061751957253314, 'tsl_mult': 0.3682073619950102, 'strategy': 'breakout', 'time_stop': 34, 'use_sma': False, 'use_atr': True, 'use_adx': False, 'use_ema': True, 'use_spike': True, 'rsi_required': False, 'edge_k': 1.9194042562129232, 'edge_cap': 0.74795453243078}.
[I 2025-08-29 19:10:35,004] Trial 369 finished with values: [-0.003672649754464463, 0.0036522075414286447] and parameters: {'p_sma': 32, 'p_std': 46, 'p_atr': 19, 'p_adx': 24, 'rsi_period': 12, 'ema1': 9, 'ema2': 23, 'slip_atr_k': 0.04102383229271511, 'slip_spread_k': 0.8187689865406271, 'spread_hl_frac': 0.039684280815049884, 'bb_std_mult': 2.6272691311179517, 'rsi_os': 19, 'rsi_ob': 95, 'vol_spike': 0.2910057257820736, 'adx_thresh': 33.456051006317615, 'atr_min_pct': 0.0022483916475354417, 'atr_max_pct': 0.020891848986549444, 'tp_mult': 2.9243295607718425, 'tsl_mult': 0.2904949924671677, 'strategy': 'mean_reversion', 'time_stop': 63, 'use_sma': True, 'use_atr': False, 'use_adx': False, 'use_ema': False, 'use_spike': False, 'rsi_required': True, 'edge_k': 1.2623585189842759, 'edge_cap': 0.41417597469932443}.
[I 2025-08-29 19:10:35,278] Trial 368 finished with values: [-0.005088448937352608, 0.0050697075187977276] and parameters: {'p_sma': 37, 'p_std': 46, 'p_atr': 19, 'p_adx': 23, 'rsi_period': 21, 'ema1': 24, 'ema2': 32, 'slip_atr_k': 0.04819312738218636, 'slip_spread_k': 0.02641104323267742, 'spread_hl_frac': 0.010991638553408914, 'bb_std_mult': 1.2158078807997053, 'rsi_os': 19, 'rsi_ob': 95, 'vol_spike': 0.07649442693920283, 'adx_thresh': 33.46987144949022, 'atr_min_pct': 0.0015603718220096995, 'atr_max_pct': 0.019561014574338016, 'tp_mult': 2.022225789238934, 'tsl_mult': 0.685064877323634, 'strategy': 'mean_reversion', 'time_stop': 101, 'use_sma': True, 'use_atr': False, 'use_adx': False, 'use_ema': False, 'use_spike': False, 'rsi_required': True, 'edge_k': 1.9998054467476778, 'edge_cap': 0.4228916644429036}.
[I 2025-08-29 19:10:35,690] Trial 366 finished with values: [-0.006808551039689359, 0.006844017193318563] and parameters: {'p_sma': 48, 'p_std': 44, 'p_atr': 9, 'p_adx': 28, 'rsi_period': 71, 'ema1': 10, 'ema2': 32, 'slip_atr_k': 0.13070714518073304, 'slip_spread_k': 0.03302955867237711, 'spread_hl_frac': 0.007241882815623596, 'bb_std_mult': 2.240933293874288, 'rsi_os': 19, 'rsi_ob': 89, 'vol_spike': 0.1323648673614586, 'adx_thresh': 24.269885506212653, 'atr_min_pct': 0.0017423395064309545, 'atr_max_pct': 0.018856106599961897, 'tp_mult': 2.1013237130443434, 'tsl_mult': 0.2959691259633881, 'strategy': 'breakout', 'time_stop': 29, 'use_sma': False, 'use_atr': True, 'use_adx': False, 'use_ema': False, 'use_spike': True, 'rsi_required': True, 'edge_k': 1.2722111592113148, 'edge_cap': 0.4180793185464685}.
[I 2025-08-29 19:10:35,773] Trial 367 finished with values: [-0.0007377567658246598, 0.0016269629979727936] and parameters: {'p_sma': 34, 'p_std': 46, 'p_atr': 21, 'p_adx': 10, 'rsi_period': 43, 'ema1': 20, 'ema2': 32, 'slip_atr_k': 0.08018385403644573, 'slip_spread_k': 0.0848672412566334, 'spread_hl_frac': 0.036501972554832236, 'bb_std_mult': 2.624954431025457, 'rsi_os': 18, 'rsi_ob': 94, 'vol_spike': 0.07812299541642279, 'adx_thresh': 33.39702150997834, 'atr_min_pct': 0.004188197592869427, 'atr_max_pct': 0.0223751361279315, 'tp_mult': 1.6578095170377274, 'tsl_mult': 0.710791965696155, 'strategy': 'breakout', 'time_stop': 63, 'use_sma': False, 'use_atr': False, 'use_adx': False, 'use_ema': False, 'use_spike': True, 'rsi_required': True, 'edge_k': 1.9997442219807327, 'edge_cap': 0.41865697477110464}.
[I 2025-08-29 19:11:01,832] Trial 372 finished with values: [-1000000000.0, 1000000000.0] and parameters: {'p_sma': 51, 'p_std': 33, 'p_atr': 20, 'p_adx': 22, 'rsi_period': 83, 'ema1': 5, 'ema2': 45, 'slip_atr_k': 0.02462975720509499, 'slip_spread_k': 0.8495277735226996, 'spread_hl_frac': 0.017810276156516577, 'bb_std_mult': 2.1213715606362307, 'rsi_os': 16, 'rsi_ob': 94, 'vol_spike': 0.12391060992647132, 'adx_thresh': 32.651716883123704, 'atr_min_pct': 0.00402357966611617, 'atr_max_pct': 0.14053121977850758, 'tp_mult': 1.6681232544419244, 'tsl_mult': 0.3914452674374584, 'strategy': 'breakout', 'time_stop': 281, 'use_sma': False, 'use_atr': False, 'use_adx': False, 'use_ema': False, 'use_spike': False, 'rsi_required': True, 'edge_k': 1.9504009314603659, 'edge_cap': 0.8536270427661274}.
[I 2025-08-29 19:11:01,933] Trial 373 finished with values: [-0.0010793112176057384, 0.0018040915539942106] and parameters: {'p_sma': 19, 'p_std': 48, 'p_atr': 20, 'p_adx': 15, 'rsi_period': 47, 'ema1': 7, 'ema2': 54, 'slip_atr_k': 0.06149513264052624, 'slip_spread_k': 0.018065305034289738, 'spread_hl_frac': 0.008149039417379612, 'bb_std_mult': 2.7838697237179857, 'rsi_os': 16, 'rsi_ob': 85, 'vol_spike': 0.12461294794337743, 'adx_thresh': 11.459579558711695, 'atr_min_pct': 0.003739044507167645, 'atr_max_pct': 0.1407030380216827, 'tp_mult': 1.9500791757398361, 'tsl_mult': 0.31373575089390277, 'strategy': 'breakout', 'time_stop': 55, 'use_sma': False, 'use_atr': False, 'use_adx': False, 'use_ema': False, 'use_spike': False, 'rsi_required': True, 'edge_k': 1.958329545417538, 'edge_cap': 0.6571194440929573}.
[I 2025-08-29 19:11:02,021] Trial 371 finished with values: [-1000000000.0, 1000000000.0] and parameters: {'p_sma': 48, 'p_std': 45, 'p_atr': 20, 'p_adx': 28, 'rsi_period': 82, 'ema1': 5, 'ema2': 45, 'slip_atr_k': 0.2017347764581158, 'slip_spread_k': 0.7336714862706986, 'spread_hl_frac': 0.007455372097660345, 'bb_std_mult': 1.2152570032762562, 'rsi_os': 17, 'rsi_ob': 94, 'vol_spike': 0.1316532704132038, 'adx_thresh': 32.78760926158591, 'atr_min_pct': 0.003939959103180376, 'atr_max_pct': 0.05508297500190783, 'tp_mult': 1.6613929320743743, 'tsl_mult': 0.44583060222519244, 'strategy': 'breakout', 'time_stop': 61, 'use_sma': False, 'use_atr': False, 'use_adx': False, 'use_ema': False, 'use_spike': False, 'rsi_required': True, 'edge_k': 1.9599611475396297, 'edge_cap': 0.9022691941998178}.
[I 2025-08-29 19:11:02,224] Trial 370 finished with values: [-1000000000.0, 1000000000.0] and parameters: {'p_sma': 51, 'p_std': 46, 'p_atr': 20, 'p_adx': 24, 'rsi_period': 47, 'ema1': 24, 'ema2': 56, 'slip_atr_k': 0.12839506614107526, 'slip_spread_k': 0.08083539789575368, 'spread_hl_frac': 0.010782942017258206, 'bb_std_mult': 1.2074400319971434, 'rsi_os': 16, 'rsi_ob': 76, 'vol_spike': 0.12392033799669554, 'adx_thresh': 32.91839478174119, 'atr_min_pct': 0.0038678288351638446, 'atr_max_pct': 0.027751782496711664, 'tp_mult': 2.694812745627673, 'tsl_mult': 0.9303354858411896, 'strategy': 'breakout', 'time_stop': 228, 'use_sma': False, 'use_atr': False, 'use_adx': False, 'use_ema': False, 'use_spike': False, 'rsi_required': True, 'edge_k': 1.9971780072727012, 'edge_cap': 0.6577668266538054}.
[I 2025-08-29 19:11:28,386] Trial 376 finished with values: [-1000000000.0, 1000000000.0] and parameters: {'p_sma': 27, 'p_std': 53, 'p_atr': 19, 'p_adx': 24, 'rsi_period': 15, 'ema1': 11, 'ema2': 28, 'slip_atr_k': 0.14372456869519198, 'slip_spread_k': 0.04508450903060858, 'spread_hl_frac': 0.011148931164660328, 'bb_std_mult': 1.7212347298440938, 'rsi_os': 17, 'rsi_ob': 90, 'vol_spike': 0.1394360861598165, 'adx_thresh': 14.717557177389228, 'atr_min_pct': 0.019865310611898213, 'atr_max_pct': 0.03188267764180916, 'tp_mult': 1.865401857438624, 'tsl_mult': 0.3301628460200754, 'strategy': 'mean_reversion', 'time_stop': 229, 'use_sma': True, 'use_atr': False, 'use_adx': False, 'use_ema': False, 'use_spike': False, 'rsi_required': True, 'edge_k': 1.9280553529343822, 'edge_cap': 0.6921695097988882}.
[I 2025-08-29 19:11:28,618] Trial 375 finished with values: [-0.006358304468773168, 0.006375806141349459] and parameters: {'p_sma': 41, 'p_std': 19, 'p_atr': 19, 'p_adx': 24, 'rsi_period': 35, 'ema1': 9, 'ema2': 28, 'slip_atr_k': 0.09183577069157872, 'slip_spread_k': 0.0006307472143716657, 'spread_hl_frac': 0.012211417243476415, 'bb_std_mult': 1.2065721580043582, 'rsi_os': 17, 'rsi_ob': 90, 'vol_spike': 0.134023663363905, 'adx_thresh': 33.96058105669024, 'atr_min_pct': 0.003428699854483959, 'atr_max_pct': 0.04250567399390351, 'tp_mult': 2.3003404561782332, 'tsl_mult': 0.32541802716965346, 'strategy': 'mean_reversion', 'time_stop': 41, 'use_sma': True, 'use_atr': False, 'use_adx': False, 'use_ema': False, 'use_spike': False, 'rsi_required': True, 'edge_k': 0.3571550994782938, 'edge_cap': 0.3822203953779173}.
[I 2025-08-29 19:11:28,795] Trial 377 finished with values: [-1000000000.0, 1000000000.0] and parameters: {'p_sma': 40, 'p_std': 26, 'p_atr': 19, 'p_adx': 9, 'rsi_period': 50, 'ema1': 9, 'ema2': 26, 'slip_atr_k': 0.03997085816908408, 'slip_spread_k': 0.5662907937259354, 'spread_hl_frac': 0.012729445380135148, 'bb_std_mult': 1.148209776618687, 'rsi_os': 18, 'rsi_ob': 92, 'vol_spike': 0.14762311980828266, 'adx_thresh': 34.250334883548206, 'atr_min_pct': 0.029631175745499172, 'atr_max_pct': 0.03205142478142965, 'tp_mult': 1.8430037322779407, 'tsl_mult': 0.8296696752221377, 'strategy': 'mean_reversion', 'time_stop': 266, 'use_sma': True, 'use_atr': False, 'use_adx': False, 'use_ema': False, 'use_spike': False, 'rsi_required': True, 'edge_k': 1.8998721673108552, 'edge_cap': 0.4786149450143548}.
[I 2025-08-29 19:11:28,806] Trial 374 finished with values: [-0.0013244246527347459, 0.0019104758655394778] and parameters: {'p_sma': 41, 'p_std': 19, 'p_atr': 20, 'p_adx': 24, 'rsi_period': 47, 'ema1': 11, 'ema2': 54, 'slip_atr_k': 0.14475164489559922, 'slip_spread_k': 0.015231333853886808, 'spread_hl_frac': 0.04551562704155776, 'bb_std_mult': 1.2001363301698003, 'rsi_os': 17, 'rsi_ob': 79, 'vol_spike': 0.14849250530750452, 'adx_thresh': 34.21922025517637, 'atr_min_pct': 0.003535063120986004, 'atr_max_pct': 0.03155255412110992, 'tp_mult': 1.860223018438659, 'tsl_mult': 0.9284415603863547, 'strategy': 'breakout', 'time_stop': 266, 'use_sma': False, 'use_atr': False, 'use_adx': False, 'use_ema': False, 'use_spike': False, 'rsi_required': True, 'edge_k': 0.35650843784406494, 'edge_cap': 0.9022999182555597}.
