[I 2025-08-29 19:06:03,879] Trial 324 finished with values: [-0.005228474351694823, 0.0052487498202630975] and parameters: {'p_sma': 49, 'p_std': 44, 'p_atr': 19, 'p_adx': 23, 'rsi_period': 45, 'ema1': 23, 'ema2': 26, 'slip_atr_k': 0.18396314501990385, 'slip_spread_k': 0.025277963557793052, 'spread_hl_frac': 0.032437151430845024, 'bb_std_mult': 1.3129613458343865, 'rsi_os': 8, 'rsi_ob': 63, 'vol_spike': 0.04052915066015672, 'adx_thresh': 23.576641023753815, 'atr_min_pct': 0.002626632557749256, 'atr_max_pct': 0.021627604933966947, 'tp_mult': 1.7967527888615027, 'tsl_mult': 0.3634646418710634, 'strategy': 'breakout', 'time_stop': 63, 'use_sma': False, 'use_atr': False, 'use_adx': False, 'use_ema': True, 'use_spike': False, 'rsi_required': False, 'edge_k': 1.9332441267483254, 'edge_cap': 0.9816868244123085}.
[I 2025-08-29 19:06:04,060] Trial 327 finished with values: [-1000000000.0, 1000000000.0] and parameters: {'p_sma': 42, 'p_std': 28, 'p_atr': 21, 'p_adx': 24, 'rsi_period': 30, 'ema1': 8, 'ema2': 20, 'slip_atr_k': 0.18346579634873644, 'slip_spread_k': 0.040192794304110456, 'spread_hl_frac': 0.0327445884132647, 'bb_std_mult': 1.2362192468697324, 'rsi_os': 48, 'rsi_ob': 73, 'vol_spike': 0.1308538466388813, 'adx_thresh': 12.777159311939396, 'atr_min_pct': 0.0034711302968599704, 'atr_max_pct': 0.03476612767165234, 'tp_mult': 1.7998380519533828, 'tsl_mult': 0.3631588531922084, 'strategy': 'mean_reversion', 'time_stop': 13, 'use_sma': True, 'use_atr': False, 'use_adx': False, 'use_ema': True, 'use_spike': True, 'rsi_required': False, 'edge_k': 1.9985153756771634, 'edge_cap': 0.9942201188469115}.
[I 2025-08-29 19:06:04,531] Trial 326 finished with values: [-1000000000.0, 1000000000.0] and parameters: {'p_sma': 49, 'p_std': 45, 'p_atr': 21, 'p_adx': 10, 'rsi_period': 30, 'ema1': 23, 'ema2': 20, 'slip_atr_k': 0.21898117317593202, 'slip_spread_k': 0.041903877498795594, 'spread_hl_frac': 0.008644127749696928, 'bb_std_mult': 1.2375024592143002, 'rsi_os': 16, 'rsi_ob': 79, 'vol_spike': 0.1323217479470482, 'adx_thresh': 25.73499348255616, 'atr_min_pct': 0.002381578372160415, 'atr_max_pct': 0.022020545433101276, 'tp_mult': 2.408950780849761, 'tsl_mult': 0.3539018166399426, 'strategy': 'mean_reversion', 'time_stop': 61, 'use_sma': False, 'use_atr': False, 'use_adx': False, 'use_ema': True, 'use_spike': True, 'rsi_required': False, 'edge_k': 0.3222336576684516, 'edge_cap': 0.3754544260155858}.
[I 2025-08-29 19:06:04,647] Trial 325 finished with values: [-0.005199843962334638, 0.005241981089914036] and parameters: {'p_sma': 42, 'p_std': 44, 'p_atr': 19, 'p_adx': 25, 'rsi_period': 44, 'ema1': 9, 'ema2': 20, 'slip_atr_k': 0.23695967768342993, 'slip_spread_k': 0.043851618054213004, 'spread_hl_frac': 0.040236019089929964, 'bb_std_mult': 1.2498108273632818, 'rsi_os': 8, 'rsi_ob': 95, 'vol_spike': 0.13305721348810692, 'adx_thresh': 26.214423213490065, 'atr_min_pct': 0.002534822677950043, 'atr_max_pct': 0.02129435046568505, 'tp_mult': 2.821375776201519, 'tsl_mult': 0.3532760235417408, 'strategy': 'breakout', 'time_stop': 61, 'use_sma': False, 'use_atr': False, 'use_adx': False, 'use_ema': True, 'use_spike': True, 'rsi_required': False, 'edge_k': 0.3114534638293024, 'edge_cap': 0.9983709528217449}.
[I 2025-08-29 19:06:31,215] Trial 331 finished with values: [-1000000000.0, 1000000000.0] and parameters: {'p_sma': 51, 'p_std': 30, 'p_atr': 18, 'p_adx': 22, 'rsi_period': 10, 'ema1': 10, 'ema2': 23, 'slip_atr_k': 0.13629340986835706, 'slip_spread_k': 0.016893996068289563, 'spread_hl_frac': 0.00812134771643197, 'bb_std_mult': 1.174746605014059, 'rsi_os': 6, 'rsi_ob': 94, 'vol_spike': 0.27513938064552645, 'adx_thresh': 29.649275374133506, 'atr_min_pct': 0.009610202204142562, 'atr_max_pct': 0.0305418448388417, 'tp_mult': 1.6742868040488645, 'tsl_mult': 0.30750169089346957, 'strategy': 'breakout', 'time_stop': 50, 'use_sma': True, 'use_atr': False, 'use_adx': False, 'use_ema': False, 'use_spike': False, 'rsi_required': True, 'edge_k': 1.9616220559204287, 'edge_cap': 0.5281108307268149}.
[I 2025-08-29 19:06:31,225] Trial 330 finished with values: [-1000000000.0, 1000000000.0] and parameters: {'p_sma': 51, 'p_std': 47, 'p_atr': 18, 'p_adx': 7, 'rsi_period': 44, 'ema1': 10, 'ema2': 31, 'slip_atr_k': 0.16517755267511727, 'slip_spread_k': 0.04648817359768802, 'spread_hl_frac': 0.041585879506219725, 'bb_std_mult': 1.1669219595433717, 'rsi_os': 18, 'rsi_ob': 95, 'vol_spike': 0.1386082956331574, 'adx_thresh': 33.82997213162132, 'atr_min_pct': 0.02511212814463201, 'atr_max_pct': 0.03220082074033433, 'tp_mult': 1.7418313855207845, 'tsl_mult': 0.33237774616358423, 'strategy': 'breakout', 'time_stop': 51, 'use_sma': False, 'use_atr': False, 'use_adx': False, 'use_ema': False, 'use_spike': False, 'rsi_required': True, 'edge_k': 1.963741649981275, 'edge_cap': 0.6799079652678183}.
[I 2025-08-29 19:06:31,594] Trial 328 finished with values: [-1000000000.0, 1000000000.0] and parameters: {'p_sma': 7, 'p_std': 31, 'p_atr': 18, 'p_adx': 22, 'rsi_period': 44, 'ema1': 8, 'ema2': 22, 'slip_atr_k': 0.09967484645132527, 'slip_spread_k': 0.05382762293860431, 'spread_hl_frac': 0.04149797891370283, 'bb_std_mult': 1.2260451992056867, 'rsi_os': 32, 'rsi_ob': 95, 'vol_spike': 0.1350644388328454, 'adx_thresh': 12.976097866453717, 'atr_min_pct': 0.009470963581902414, 'atr_max_pct': 0.03532468506587223, 'tp_mult': 2.4344391057499113, 'tsl_mult': 0.34910105756081455, 'strategy': 'mean_reversion', 'time_stop': 49, 'use_sma': True, 'use_atr': False, 'use_adx': False, 'use_ema': False, 'use_spike': True, 'rsi_required': True, 'edge_k': 0.305642181015636, 'edge_cap': 0.9980811414123321}.
[I 2025-08-29 19:06:31,798] Trial 329 finished with values: [-1000000000.0, 1000000000.0] and parameters: {'p_sma': 43, 'p_std': 30, 'p_atr': 18, 'p_adx': 7, 'rsi_period': 20, 'ema1': 21, 'ema2': 22, 'slip_atr_k': 0.21871923498112933, 'slip_spread_k': 0.04753629929077335, 'spread_hl_frac': 0.02705431919829858, 'bb_std_mult': 1.186591218190838, 'rsi_os': 32, 'rsi_ob': 81, 'vol_spike': 0.13459580870984936, 'adx_thresh': 26.274900811510555, 'atr_min_pct': 0.01616879399464853, 'atr_max_pct': 0.032021160513421416, 'tp_mult': 2.417301920345875, 'tsl_mult': 0.33330310076397307, 'strategy': 'breakout', 'time_stop': 53, 'use_sma': False, 'use_atr': False, 'use_adx': False, 'use_ema': False, 'use_spike': True, 'rsi_required': True, 'edge_k': 1.9997218016244642, 'edge_cap': 0.5733043954573044}.
[I 2025-08-29 19:06:57,950] Trial 333 finished with values: [-0.013672412129608902, 0.013756380973681344] and parameters: {'p_sma': 37, 'p_std': 46, 'p_atr': 20, 'p_adx': 16, 'rsi_period': 80, 'ema1': 21, 'ema2': 22, 'slip_atr_k': 0.04940117199913962, 'slip_spread_k': 0.018875644329643042, 'spread_hl_frac': 0.04302953867455926, 'bb_std_mult': 1.3528082455117705, 'rsi_os': 45, 'rsi_ob': 81, 'vol_spike': 0.031031948218724556, 'adx_thresh': 34.16706045441042, 'atr_min_pct': 0.003554523426979243, 'atr_max_pct': 0.061055212657687055, 'tp_mult': 1.9148535037285872, 'tsl_mult': 0.3425744442979637, 'strategy': 'breakout', 'time_stop': 55, 'use_sma': False, 'use_atr': False, 'use_adx': False, 'use_ema': False, 'use_spike': False, 'rsi_required': True, 'edge_k': 0.11966795361132387, 'edge_cap': 0.2636367713437163}.
[I 2025-08-29 19:06:58,229] Trial 334 finished with values: [-0.001740886888244142, 0.0028929078263697484] and parameters: {'p_sma': 46, 'p_std': 24, 'p_atr': 20, 'p_adx': 11, 'rsi_period': 48, 'ema1': 22, 'ema2': 27, 'slip_atr_k': 0.03485081099115116, 'slip_spread_k': 0.013018733174706282, 'spread_hl_frac': 0.0077864929268354754, 'bb_std_mult': 1.299159933884101, 'rsi_os': 18, 'rsi_ob': 87, 'vol_spike': 0.12473236014767873, 'adx_thresh': 33.165660231842324, 'atr_min_pct': 0.003498821641142043, 'atr_max_pct': 0.02868187185889849, 'tp_mult': 1.9003016899344023, 'tsl_mult': 0.8201845395160342, 'strategy': 'breakout', 'time_stop': 55, 'use_sma': False, 'use_atr': False, 'use_adx': False, 'use_ema': False, 'use_spike': False, 'rsi_required': True, 'edge_k': 0.964811642509855, 'edge_cap': 0.568809825591923}.
[I 2025-08-29 19:06:58,393] Trial 332 finished with values: [-1000000000.0, 1000000000.0] and parameters: {'p_sma': 46, 'p_std': 48, 'p_atr': 20, 'p_adx': 22, 'rsi_period': 19, 'ema1': 21, 'ema2': 22, 'slip_atr_k': 0.09899133512736313, 'slip_spread_k': 0.02060294060511402, 'spread_hl_frac': 0.043176427838951884, 'bb_std_mult': 2.688376307317144, 'rsi_os': 16, 'rsi_ob': 76, 'vol_spike': 0.14412560922586753, 'adx_thresh': 11.102983999975764, 'atr_min_pct': 0.016267261806612275, 'atr_max_pct': 0.02872247610141127, 'tp_mult': 1.9199591392159117, 'tsl_mult': 0.9793609132761008, 'strategy': 'breakout', 'time_stop': 39, 'use_sma': False, 'use_atr': False, 'use_adx': False, 'use_ema': False, 'use_spike': False, 'rsi_required': True, 'edge_k': 1.9487480836289457, 'edge_cap': 0.28398682488530397}.
[I 2025-08-29 19:06:58,507] Trial 335 finished with values: [-0.014913209523919946, 0.014998462552064466] and parameters: {'p_sma': 37, 'p_std': 46, 'p_atr': 20, 'p_adx': 11, 'rsi_period': 48, 'ema1': 22, 'ema2': 19, 'slip_atr_k': 0.03347596969815283, 'slip_spread_k': 0.020337576965454157, 'spread_hl_frac': 0.00759660015264839, 'bb_std_mult': 1.3496283006934646, 'rsi_os': 44, 'rsi_ob': 87, 'vol_spike': 0.14434090485065867, 'adx_thresh': 33.31053047716239, 'atr_min_pct': 0.0033852654908279847, 'atr_max_pct': 0.06134359602221924, 'tp_mult': 2.7432329019128314, 'tsl_mult': 0.8850200367520608, 'strategy': 'breakout', 'time_stop': 26, 'use_sma': False, 'use_atr': False, 'use_adx': False, 'use_ema': False, 'use_spike': False, 'rsi_required': True, 'edge_k': 1.9268421702817868, 'edge_cap': 0.2630873478116938}.
[I 2025-08-29 19:07:24,818] Trial 337 finished with values: [-0.01297480995762268, 0.013102441529703081] and parameters: {'p_sma': 21, 'p_std': 55, 'p_atr': 19, 'p_adx': 30, 'rsi_period': 48, 'ema1': 9, 'ema2': 19, 'slip_atr_k': 0.11165676582580354, 'slip_spread_k': 0.020368966552760093, 'spread_hl_frac': 0.0115382722613229, 'bb_std_mult': 1.8101297314531979, 'rsi_os': 39, 'rsi_ob': 94, 'vol_spike': 0.1421557097318984, 'adx_thresh': 19.55913585420079, 'atr_min_pct': 0.0031243043930833008, 'atr_max_pct': 0.0276971103400284, 'tp_mult': 2.7607095560054025, 'tsl_mult': 0.9779798810493389, 'strategy': 'breakout', 'time_stop': 300, 'use_sma': False, 'use_atr': False, 'use_adx': False, 'use_ema': False, 'use_spike': False, 'rsi_required': True, 'edge_k': 1.9190681425816953, 'edge_cap': 0.5060575299747254}.
[I 2025-08-29 19:07:24,918] Trial 338 finished with values: [-0.0031850567306240807, 0.003241063627969775] and parameters: {'p_sma': 24, 'p_std': 46, 'p_atr': 19, 'p_adx': 14, 'rsi_period': 73, 'ema1': 11, 'ema2': 29, 'slip_atr_k': 0.026893504650210426, 'slip_spread_k': 0.0018837088488807305, 'spread_hl_frac': 0.011980249308904501, 'bb_std_mult': 2.755188611626041, 'rsi_os': 38, 'rsi_ob': 94, 'vol_spike': 0.06658889163003415, 'adx_thresh': 19.73779802248865, 'atr_min_pct': 0.0029221080498657973, 'atr_max_pct': 0.026272138529958553, 'tp_mult': 2.29039739081889, 'tsl_mult': 0.8934285899819783, 'strategy': 'mean_reversion', 'time_stop': 76, 'use_sma': True, 'use_atr': False, 'use_adx': False, 'use_ema': False, 'use_spike': False, 'rsi_required': True, 'edge_k': 1.9267274278114968, 'edge_cap': 0.6668435524239129}.
[I 2025-08-29 19:07:25,176] Trial 339 finished with values: [-0.004110581158508486, 0.004117196045457688] and parameters: {'p_sma': 22, 'p_std': 39, 'p_atr': 8, 'p_adx': 24, 'rsi_period': 73, 'ema1': 28, 'ema2': 27, 'slip_atr_k': 0.02778796142374749, 'slip_spread_k': 0.0018735004554854997, 'spread_hl_frac': 0.04791026986616016, 'bb_std_mult': 3.299930470390157, 'rsi_os': 38, 'rsi_ob': 61, 'vol_spike': 0.12230333247707548, 'adx_thresh': 34.09627602816242, 'atr_min_pct': 0.002997729465939546, 'atr_max_pct': 0.03724981731345301, 'tp_mult': 2.34062818273818, 'tsl_mult': 0.6421544858216746, 'strategy': 'mean_reversion', 'time_stop': 42, 'use_sma': True, 'use_atr': False, 'use_adx': False, 'use_ema': False, 'use_spike': False, 'rsi_required': True, 'edge_k': 1.930158190903119, 'edge_cap': 0.501746924389641}.
[I 2025-08-29 19:07:25,314] Trial 336 finished with values: [-1000000000.0, 1000000000.0] and parameters: {'p_sma': 45, 'p_std': 55, 'p_atr': 8, 'p_adx': 30, 'rsi_period': 49, 'ema1': 28, 'ema2': 27, 'slip_atr_k': 0.03320538218748864, 'slip_spread_k': 0.02257014599041618, 'spread_hl_frac': 0.007441298367765788, 'bb_std_mult': 1.3306496375362602, 'rsi_os': 38, 'rsi_ob': 86, 'vol_spike': 0.24475869174248566, 'adx_thresh': 19.83666705443227, 'atr_min_pct': 0.019003980988643487, 'atr_max_pct': 0.02832257740970885, 'tp_mult': 2.066183498232915, 'tsl_mult': 0.8837401408675754, 'strategy': 'breakout', 'time_stop': 38, 'use_sma': False, 'use_atr': False, 'use_adx': False, 'use_ema': False, 'use_spike': False, 'rsi_required': True, 'edge_k': 1.9367949985804676, 'edge_cap': 0.29829447902790307}.
[I 2025-08-29 19:07:52,106] Trial 340 finished with values: [-1000000000.0, 1000000000.0] and parameters: {'p_sma': 47, 'p_std': 48, 'p_atr': 19, 'p_adx': 23, 'rsi_period': 73, 'ema1': 11, 'ema2': 31, 'slip_atr_k': 0.02678755011180939, 'slip_spread_k': 0.0032604963040009497, 'spread_hl_frac': 0.04823387199642326, 'bb_std_mult': 1.3074652829271216, 'rsi_os': 36, 'rsi_ob': 93, 'vol_spike': 0.2377148092484252, 'adx_thresh': 16.697097343174246, 'atr_min_pct': 0.018932632297972492, 'atr_max_pct': 0.03799672855424176, 'tp_mult': 2.26015910975478, 'tsl_mult': 0.29487213645922594, 'strategy': 'mean_reversion', 'time_stop': 44, 'use_sma': True, 'use_atr': False, 'use_adx': False, 'use_ema': False, 'use_spike': False, 'rsi_required': True, 'edge_k': 1.9708847094516595, 'edge_cap': 0.6298082483257371}.
[I 2025-08-29 19:07:52,576] Trial 341 finished with values: [-1000000000.0, 1000000000.0] and parameters: {'p_sma': 29, 'p_std': 39, 'p_atr': 19, 'p_adx': 23, 'rsi_period': 50, 'ema1': 29, 'ema2': 24, 'slip_atr_k': 0.030079557771223914, 'slip_spread_k': 0.6693124860893649, 'spread_hl_frac': 0.01062566350372089, 'bb_std_mult': 1.4660217309601615, 'rsi_os': 36, 'rsi_ob': 62, 'vol_spike': 0.24325172551263996, 'adx_thresh': 16.740827828567852, 'atr_min_pct': 0.019033608206354115, 'atr_max_pct': 0.045433743789078045, 'tp_mult': 2.536124370764929, 'tsl_mult': 0.4165260943309095, 'strategy': 'breakout', 'time_stop': 43, 'use_sma': False, 'use_atr': False, 'use_adx': False, 'use_ema': True, 'use_spike': False, 'rsi_required': True, 'edge_k': 1.999560264542886, 'edge_cap': 0.22411138830065502}.
[I 2025-08-29 19:07:52,763] Trial 342 finished with values: [-1000000000.0, 1000000000.0] and parameters: {'p_sma': 31, 'p_std': 48, 'p_atr': 19, 'p_adx': 23, 'rsi_period': 50, 'ema1': 8, 'ema2': 51, 'slip_atr_k': 0.03240453366695994, 'slip_spread_k': 0.060649245512230165, 'spread_hl_frac': 0.009284403154529839, 'bb_std_mult': 2.922602501147949, 'rsi_os': 17, 'rsi_ob': 93, 'vol_spike': 0.1381008084751228, 'adx_thresh': 14.011896722492441, 'atr_min_pct': 0.0188517447019022, 'atr_max_pct': 0.03364009690246409, 'tp_mult': 2.0546017189120684, 'tsl_mult': 0.4092131813840195, 'strategy': 'breakout', 'time_stop': 44, 'use_sma': False, 'use_atr': False, 'use_adx': False, 'use_ema': True, 'use_spike': False, 'rsi_required': False, 'edge_k': 1.998872231556351, 'edge_cap': 0.9353558905846098}.
[I 2025-08-29 19:07:52,825] Trial 343 finished with values: [-1000000000.0, 1000000000.0] and parameters: {'p_sma': 31, 'p_std': 50, 'p_atr': 19, 'p_adx': 29, 'rsi_period': 50, 'ema1': 8, 'ema2': 24, 'slip_atr_k': 0.026766296967634082, 'slip_spread_k': 0.5948871616649168, 'spread_hl_frac': 0.01925044924481112, 'bb_std_mult': 1.4928824569468038, 'rsi_os': 17, 'rsi_ob': 93, 'vol_spike': 0.10388186234134758, 'adx_thresh': 34.3113990441957, 'atr_min_pct': 0.0022232109025209675, 'atr_max_pct': 0.034088885666152174, 'tp_mult': 1.7565014212767975, 'tsl_mult': 0.7566332565251723, 'strategy': 'breakout', 'time_stop': 210, 'use_sma': False, 'use_atr': False, 'use_adx': False, 'use_ema': True, 'use_spike': False, 'rsi_required': False, 'edge_k': 0.17186358387232636, 'edge_cap': 0.9372800700493182}.
[I 2025-08-29 19:07:53,037] Trial 347 finished with values: [-1000000000.0, 1000000000.0] and parameters: {'p_sma': 28, 'p_std': 45, 'p_atr': 18, 'p_adx': 8, 'rsi_period': 47, 'ema1': 9, 'ema2': 47, 'slip_atr_k': 0.15519982811089322, 'slip_spread_k': 0.9788607543258981, 'spread_hl_frac': 0.031068516612302782, 'bb_std_mult': 2.5567844424437323, 'rsi_os': 19, 'rsi_ob': 84, 'vol_spike': 0.1277644100414452, 'adx_thresh': 10.005180807495085, 'atr_min_pct': 0.028606327890231965, 'atr_max_pct': 0.024724677871568596, 'tp_mult': 2.895495616331236, 'tsl_mult': 0.31348074061442605, 'strategy': 'breakout', 'time_stop': 115, 'use_sma': False, 'use_atr': True, 'use_adx': False, 'use_ema': False, 'use_spike': True, 'rsi_required': True, 'edge_k': 1.030185745940823, 'edge_cap': 0.24116252146294787}.
[I 2025-08-29 19:08:20,101] Trial 348 finished with values: [-0.008333851237201428, 0.0086034022408761] and parameters: {'p_sma': 39, 'p_std': 21, 'p_atr': 10, 'p_adx': 24, 'rsi_period': 7, 'ema1': 9, 'ema2': 59, 'slip_atr_k': 0.04634662591430802, 'slip_spread_k': 0.032484408928148426, 'spread_hl_frac': 0.008858469510499916, 'bb_std_mult': 2.3070455917833947, 'rsi_os': 19, 'rsi_ob': 92, 'vol_spike': 0.11875432943002924, 'adx_thresh': 33.892546370866384, 'atr_min_pct': 0.0037133148997155886, 'atr_max_pct': 0.031178774817820717, 'tp_mult': 1.9905251067897443, 'tsl_mult': 0.3795535238885398, 'strategy': 'breakout', 'time_stop': 58, 'use_sma': False, 'use_atr': True, 'use_adx': False, 'use_ema': False, 'use_spike': True, 'rsi_required': True, 'edge_k': 1.9669680403246677, 'edge_cap': 0.6862620710292335}.
[I 2025-08-29 19:08:20,491] Trial 346 finished with values: [-1000000000.0, 1000000000.0] and parameters: {'p_sma': 26, 'p_std': 50, 'p_atr': 18, 'p_adx': 24, 'rsi_period': 17, 'ema1': 10, 'ema2': 57, 'slip_atr_k': 0.03922012817722412, 'slip_spread_k': 0.037814960546285414, 'spread_hl_frac': 0.031130597870961434, 'bb_std_mult': 2.3066292226797627, 'rsi_os': 19, 'rsi_ob': 92, 'vol_spike': 0.11733946518650679, 'adx_thresh': 9.834279575178474, 'atr_min_pct': 0.013321120071715242, 'atr_max_pct': 0.03054024255908652, 'tp_mult': 2.174922649774509, 'tsl_mult': 0.37727805769700296, 'strategy': 'breakout', 'time_stop': 115, 'use_sma': False, 'use_atr': True, 'use_adx': False, 'use_ema': False, 'use_spike': True, 'rsi_required': False, 'edge_k': 0.20266049272474274, 'edge_cap': 0.7478244317041103}.
[I 2025-08-29 19:08:20,725] Trial 344 finished with values: [-0.019675953030299898, 0.019655848887493735] and parameters: {'p_sma': 31, 'p_std': 45, 'p_atr': 18, 'p_adx': 25, 'rsi_period': 7, 'ema1': 9, 'ema2': 60, 'slip_atr_k': 0.17252205556637779, 'slip_spread_k': 0.036471510346809316, 'spread_hl_frac': 0.008779821031737528, 'bb_std_mult': 3.467369885516776, 'rsi_os': 17, 'rsi_ob': 92, 'vol_spike': 0.10511165753379759, 'adx_thresh': 34.202646937370616, 'atr_min_pct': 0.002084026101889595, 'atr_max_pct': 0.03357615806640833, 'tp_mult': 2.1664659054707207, 'tsl_mult': 0.4160163743454362, 'strategy': 'breakout', 'time_stop': 115, 'use_sma': False, 'use_atr': True, 'use_adx': False, 'use_ema': True, 'use_spike': True, 'rsi_required': False, 'edge_k': 1.9868212491657768, 'edge_cap': 0.9314460178487558}.
[I 2025-08-29 19:08:20,981] Trial 345 finished with values: [-1000000000.0, 1000000000.0] and parameters: {'p_sma': 42, 'p_std': 45, 'p_atr': 18, 'p_adx': 29, 'rsi_period': 50, 'ema1': 8, 'ema2': 21, 'slip_atr_k': 0.035778228438527855, 'slip_spread_k': 0.06127498138195052, 'spread_hl_frac': 0.008844968781468539, 'bb_std_mult': 2.8925438401423387, 'rsi_os': 17, 'rsi_ob': 92, 'vol_spike': 0.1030260691093215, 'adx_thresh': 34.099068290984405, 'atr_min_pct': 0.024529800706982668, 'atr_max_pct': 0.03435878837842805, 'tp_mult': 1.7534600958977187, 'tsl_mult': 0.7322151159009453, 'strategy': 'breakout', 'time_stop': 48, 'use_sma': False, 'use_atr': True, 'use_adx': False, 'use_ema': True, 'use_spike': True, 'rsi_required': False, 'edge_k': 0.18697645072586744, 'edge_cap': 0.9291835180055987}.
[I 2025-08-29 19:08:47,122] Trial 352 finished with values: [-0.004852801669398277, 0.004844234271844334] and parameters: {'p_sma': 20, 'p_std': 18, 'p_atr': 20, 'p_adx': 22, 'rsi_period': 32, 'ema1': 26, 'ema2': 43, 'slip_atr_k': 0.07194810610336533, 'slip_spread_k': 0.02100603755899129, 'spread_hl_frac': 0.01020957306110864, 'bb_std_mult': 3.0060801719750714, 'rsi_os': 10, 'rsi_ob': 59, 'vol_spike': 0.05461698858008919, 'adx_thresh': 33.386058601706964, 'atr_min_pct': 0.0038097893593363667, 'atr_max_pct': 0.01597789848946614, 'tp_mult': 1.5975005608996795, 'tsl_mult': 0.2927586513818928, 'strategy': 'mean_reversion', 'time_stop': 58, 'use_sma': True, 'use_atr': False, 'use_adx': False, 'use_ema': False, 'use_spike': False, 'rsi_required': True, 'edge_k': 0.016208569023102193, 'edge_cap': 0.7197818567598209}.
[I 2025-08-29 19:08:47,347] Trial 351 finished with values: [-0.09699461926221098, 0.09697965755601096] and parameters: {'p_sma': 42, 'p_std': 27, 'p_atr': 20, 'p_adx': 22, 'rsi_period': 48, 'ema1': 26, 'ema2': 21, 'slip_atr_k': 0.03583126900073744, 'slip_spread_k': 0.06207320918718398, 'spread_hl_frac': 0.03477177040571266, 'bb_std_mult': 1.2449044096445145, 'rsi_os': 16, 'rsi_ob': 59, 'vol_spike': 0.14502654015718622, 'adx_thresh': 18.552057885605528, 'atr_min_pct': 0.00034416255409318655, 'atr_max_pct': 0.022562874718342785, 'tp_mult': 2.6002669592600647, 'tsl_mult': 0.29452246866912163, 'strategy': 'mean_reversion', 'time_stop': 256, 'use_sma': True, 'use_atr': False, 'use_adx': False, 'use_ema': False, 'use_spike': False, 'rsi_required': True, 'edge_k': 1.206266289914708, 'edge_cap': 0.6996860020842472}.
