[I 2025-08-29 19:00:16,817] Trial 270 finished with values: [-0.000394959837754838, 0.0013919543590091591] and parameters: {'p_sma': 56, 'p_std': 46, 'p_atr': 16, 'p_adx': 23, 'rsi_period': 52, 'ema1': 9, 'ema2': 38, 'slip_atr_k': 0.0423084840025111, 'slip_spread_k': 0.056896739991663114, 'spread_hl_frac': 0.00885316087202557, 'bb_std_mult': 1.3101912402503468, 'rsi_os': 16, 'rsi_ob': 94, 'vol_spike': 0.1288390904118422, 'adx_thresh': 34.98480916872392, 'atr_min_pct': 0.0030884052543422103, 'atr_max_pct': 0.023850099021911184, 'tp_mult': 1.4476246039926493, 'tsl_mult': 0.2950626238333752, 'strategy': 'breakout', 'time_stop': 87, 'use_sma': False, 'use_atr': True, 'use_adx': True, 'use_ema': False, 'use_spike': False, 'rsi_required': True, 'edge_k': 1.883390968560195, 'edge_cap': 0.8123200507409348}.
[I 2025-08-29 19:00:17,377] Trial 273 finished with values: [-0.00025169351697551523, 0.0013515983812996929] and parameters: {'p_sma': 56, 'p_std': 44, 'p_atr': 16, 'p_adx': 25, 'rsi_period': 52, 'ema1': 9, 'ema2': 34, 'slip_atr_k': 0.0429016931317166, 'slip_spread_k': 0.036676196334897236, 'spread_hl_frac': 0.00890595876526886, 'bb_std_mult': 1.3310457436009024, 'rsi_os': 17, 'rsi_ob': 94, 'vol_spike': 0.13012656157280866, 'adx_thresh': 34.975270095092554, 'atr_min_pct': 0.0029344839549754025, 'atr_max_pct': 0.024052326279438044, 'tp_mult': 1.443470296305248, 'tsl_mult': 0.2898310211540639, 'strategy': 'breakout', 'time_stop': 87, 'use_sma': False, 'use_atr': True, 'use_adx': True, 'use_ema': False, 'use_spike': False, 'rsi_required': True, 'edge_k': 0.9889066611233921, 'edge_cap': 0.8093763090598228}.
[I 2025-08-29 19:00:17,649] Trial 271 finished with values: [-0.0011895990233596887, 0.0017900920097607376] and parameters: {'p_sma': 56, 'p_std': 46, 'p_atr': 16, 'p_adx': 23, 'rsi_period': 53, 'ema1': 6, 'ema2': 40, 'slip_atr_k': 0.04416096558096534, 'slip_spread_k': 0.03554104657224012, 'spread_hl_frac': 0.009246226929615228, 'bb_std_mult': 1.3251763763204831, 'rsi_os': 16, 'rsi_ob': 95, 'vol_spike': 0.13133725115125267, 'adx_thresh': 34.959552556950264, 'atr_min_pct': 0.0026598290561143595, 'atr_max_pct': 0.02211358675431762, 'tp_mult': 1.440011245163309, 'tsl_mult': 0.2887239008383577, 'strategy': 'breakout', 'time_stop': 88, 'use_sma': False, 'use_atr': True, 'use_adx': True, 'use_ema': False, 'use_spike': False, 'rsi_required': True, 'edge_k': 0.9828798309547155, 'edge_cap': 0.807856277200115}.
[I 2025-08-29 19:00:17,659] Trial 272 finished with values: [-0.00020124425122614031, 0.0013851839850157926] and parameters: {'p_sma': 56, 'p_std': 44, 'p_atr': 16, 'p_adx': 23, 'rsi_period': 52, 'ema1': 9, 'ema2': 46, 'slip_atr_k': 0.041587504329330366, 'slip_spread_k': 0.07813469556757191, 'spread_hl_frac': 0.009009590954118003, 'bb_std_mult': 1.3203414803942166, 'rsi_os': 16, 'rsi_ob': 94, 'vol_spike': 0.12985940029920712, 'adx_thresh': 34.79266472272689, 'atr_min_pct': 0.003189461687144574, 'atr_max_pct': 0.023652307250455494, 'tp_mult': 1.4416057530026127, 'tsl_mult': 0.2756315635066159, 'strategy': 'breakout', 'time_stop': 91, 'use_sma': False, 'use_atr': True, 'use_adx': True, 'use_ema': False, 'use_spike': False, 'rsi_required': True, 'edge_k': 1.8822452937024627, 'edge_cap': 0.8097462665286146}.
[I 2025-08-29 19:00:44,749] Trial 274 finished with values: [-0.00048729108926925946, 0.0016452718495084118] and parameters: {'p_sma': 56, 'p_std': 44, 'p_atr': 16, 'p_adx': 23, 'rsi_period': 51, 'ema1': 9, 'ema2': 35, 'slip_atr_k': 0.042502643944631324, 'slip_spread_k': 0.07204908014118085, 'spread_hl_frac': 0.009189260999444795, 'bb_std_mult': 1.3159715716572067, 'rsi_os': 16, 'rsi_ob': 95, 'vol_spike': 0.13162239238517554, 'adx_thresh': 34.856265300055306, 'atr_min_pct': 0.002827674512785589, 'atr_max_pct': 0.023692098193305134, 'tp_mult': 1.4227635250017303, 'tsl_mult': 0.29737642806756026, 'strategy': 'breakout', 'time_stop': 90, 'use_sma': False, 'use_atr': True, 'use_adx': True, 'use_ema': False, 'use_spike': False, 'rsi_required': True, 'edge_k': 0.2663321773637275, 'edge_cap': 0.8125075125167424}.
[I 2025-08-29 19:00:45,385] Trial 275 finished with values: [-0.0009678718457267754, 0.0017353253618599695] and parameters: {'p_sma': 56, 'p_std': 44, 'p_atr': 16, 'p_adx': 23, 'rsi_period': 52, 'ema1': 9, 'ema2': 34, 'slip_atr_k': 0.04457681986594029, 'slip_spread_k': 0.07281071866643513, 'spread_hl_frac': 0.008964496596560668, 'bb_std_mult': 1.3430577466188598, 'rsi_os': 15, 'rsi_ob': 94, 'vol_spike': 0.12991124438150528, 'adx_thresh': 34.64251941421536, 'atr_min_pct': 0.0026920707054365767, 'atr_max_pct': 0.02337017453208079, 'tp_mult': 1.44331119347929, 'tsl_mult': 0.2725731534408336, 'strategy': 'breakout', 'time_stop': 89, 'use_sma': False, 'use_atr': True, 'use_adx': True, 'use_ema': False, 'use_spike': False, 'rsi_required': True, 'edge_k': 0.1389202934528858, 'edge_cap': 0.813614212965886}.
[I 2025-08-29 19:00:45,507] Trial 277 finished with values: [-2.519562814451426e-05, 0.0011850393209147723] and parameters: {'p_sma': 55, 'p_std': 44, 'p_atr': 16, 'p_adx': 25, 'rsi_period': 52, 'ema1': 9, 'ema2': 35, 'slip_atr_k': 0.039973003985832464, 'slip_spread_k': 0.08514793067848156, 'spread_hl_frac': 0.00903069628349516, 'bb_std_mult': 1.369801265007473, 'rsi_os': 17, 'rsi_ob': 94, 'vol_spike': 0.12678820452428044, 'adx_thresh': 34.98458406584244, 'atr_min_pct': 0.003056812153915938, 'atr_max_pct': 0.023794766526483435, 'tp_mult': 1.4392875650612402, 'tsl_mult': 0.2987814015429294, 'strategy': 'breakout', 'time_stop': 75, 'use_sma': False, 'use_atr': True, 'use_adx': True, 'use_ema': False, 'use_spike': False, 'rsi_required': True, 'edge_k': 0.25469818145494494, 'edge_cap': 0.8374883763739565}.
[I 2025-08-29 19:00:45,665] Trial 276 finished with values: [-0.00017592976215274891, 0.0012740735534371697] and parameters: {'p_sma': 55, 'p_std': 44, 'p_atr': 16, 'p_adx': 25, 'rsi_period': 52, 'ema1': 9, 'ema2': 34, 'slip_atr_k': 0.04084624467279428, 'slip_spread_k': 0.06939191864275253, 'spread_hl_frac': 0.00912402888431009, 'bb_std_mult': 1.384886223725366, 'rsi_os': 17, 'rsi_ob': 94, 'vol_spike': 0.1271266145861284, 'adx_thresh': 34.82262517049652, 'atr_min_pct': 0.003017447128644081, 'atr_max_pct': 0.02448942061462376, 'tp_mult': 1.4303441147179872, 'tsl_mult': 0.30139357784175086, 'strategy': 'breakout', 'time_stop': 71, 'use_sma': False, 'use_atr': True, 'use_adx': True, 'use_ema': False, 'use_spike': False, 'rsi_required': True, 'edge_k': 1.1191012618127003, 'edge_cap': 0.8233095436859774}.
[I 2025-08-29 19:01:12,951] Trial 278 finished with values: [-0.00018407402867892664, 0.0012804874690661694] and parameters: {'p_sma': 56, 'p_std': 44, 'p_atr': 16, 'p_adx': 24, 'rsi_period': 51, 'ema1': 9, 'ema2': 36, 'slip_atr_k': 0.03918505873140332, 'slip_spread_k': 0.06768639292098266, 'spread_hl_frac': 0.0085792064744016, 'bb_std_mult': 1.369020920921731, 'rsi_os': 16, 'rsi_ob': 93, 'vol_spike': 0.1260979955457348, 'adx_thresh': 34.673283807621274, 'atr_min_pct': 0.0031459169634243103, 'atr_max_pct': 0.026033623346434904, 'tp_mult': 1.400803557666297, 'tsl_mult': 0.3125924991243109, 'strategy': 'breakout', 'time_stop': 58, 'use_sma': False, 'use_atr': True, 'use_adx': True, 'use_ema': False, 'use_spike': False, 'rsi_required': True, 'edge_k': 0.26215847142279725, 'edge_cap': 0.8336650720007658}.
[I 2025-08-29 19:01:13,137] Trial 279 finished with values: [2.3048913911472013e-05, 0.0012136127988578737] and parameters: {'p_sma': 56, 'p_std': 43, 'p_atr': 15, 'p_adx': 24, 'rsi_period': 51, 'ema1': 10, 'ema2': 36, 'slip_atr_k': 0.03745086472197348, 'slip_spread_k': 0.10641033177035765, 'spread_hl_frac': 0.010412742796897035, 'bb_std_mult': 1.3687908949288115, 'rsi_os': 17, 'rsi_ob': 93, 'vol_spike': 0.12266687982998742, 'adx_thresh': 34.786167153140724, 'atr_min_pct': 0.0032413892941403773, 'atr_max_pct': 0.02709367239023783, 'tp_mult': 1.4130650763036021, 'tsl_mult': 0.29444601934577436, 'strategy': 'breakout', 'time_stop': 59, 'use_sma': False, 'use_atr': True, 'use_adx': True, 'use_ema': False, 'use_spike': False, 'rsi_required': True, 'edge_k': 0.25991911111782784, 'edge_cap': 0.8310285985889488}.
[I 2025-08-29 19:01:13,463] Trial 280 finished with values: [-0.00017521062314440616, 0.0013007241340420438] and parameters: {'p_sma': 56, 'p_std': 45, 'p_atr': 15, 'p_adx': 24, 'rsi_period': 51, 'ema1': 10, 'ema2': 35, 'slip_atr_k': 0.036197020275624055, 'slip_spread_k': 0.09800023788476668, 'spread_hl_frac': 0.010436523907979008, 'bb_std_mult': 1.3695083165397623, 'rsi_os': 17, 'rsi_ob': 93, 'vol_spike': 0.12416799404110726, 'adx_thresh': 34.8023297019055, 'atr_min_pct': 0.003171715138090811, 'atr_max_pct': 0.026263623471567032, 'tp_mult': 1.406518645708228, 'tsl_mult': 0.3027174175595706, 'strategy': 'breakout', 'time_stop': 59, 'use_sma': False, 'use_atr': True, 'use_adx': True, 'use_ema': False, 'use_spike': False, 'rsi_required': True, 'edge_k': 1.1182949789830088, 'edge_cap': 0.8320044233513743}.
[I 2025-08-29 19:01:13,667] Trial 281 finished with values: [-0.00045038712788258994, 0.00154651709678463] and parameters: {'p_sma': 54, 'p_std': 43, 'p_atr': 15, 'p_adx': 24, 'rsi_period': 52, 'ema1': 9, 'ema2': 35, 'slip_atr_k': 0.03700404392990694, 'slip_spread_k': 0.11811036694628928, 'spread_hl_frac': 0.010075423079850397, 'bb_std_mult': 1.3837460130127377, 'rsi_os': 17, 'rsi_ob': 93, 'vol_spike': 0.12298341426135144, 'adx_thresh': 34.93531258878185, 'atr_min_pct': 0.00304325653057241, 'atr_max_pct': 0.028234320928774904, 'tp_mult': 1.4019513558482695, 'tsl_mult': 0.2641952891914636, 'strategy': 'breakout', 'time_stop': 60, 'use_sma': False, 'use_atr': True, 'use_adx': True, 'use_ema': False, 'use_spike': False, 'rsi_required': True, 'edge_k': 1.881384855428322, 'edge_cap': 0.8341942324948891}.
[I 2025-08-29 19:01:40,706] Trial 282 finished with values: [6.227828249061318e-05, 0.0012436075254888322] and parameters: {'p_sma': 56, 'p_std': 43, 'p_atr': 17, 'p_adx': 24, 'rsi_period': 51, 'ema1': 10, 'ema2': 38, 'slip_atr_k': 0.03935026143493196, 'slip_spread_k': 0.10890965416830085, 'spread_hl_frac': 0.010669499396441613, 'bb_std_mult': 1.3689409492451923, 'rsi_os': 17, 'rsi_ob': 93, 'vol_spike': 0.119970693013132, 'adx_thresh': 34.96537693744073, 'atr_min_pct': 0.003183319284995176, 'atr_max_pct': 0.019607884947500667, 'tp_mult': 1.4013503518019417, 'tsl_mult': 0.3023333065037131, 'strategy': 'breakout', 'time_stop': 58, 'use_sma': False, 'use_atr': True, 'use_adx': True, 'use_ema': False, 'use_spike': False, 'rsi_required': True, 'edge_k': 1.9991549082269258, 'edge_cap': 0.8299958230732968}.
[I 2025-08-29 19:01:41,015] Trial 283 finished with values: [-0.00037424645338923757, 0.001601768667281651] and parameters: {'p_sma': 56, 'p_std': 43, 'p_atr': 17, 'p_adx': 24, 'rsi_period': 51, 'ema1': 10, 'ema2': 35, 'slip_atr_k': 0.04006589706527777, 'slip_spread_k': 0.1113431759969048, 'spread_hl_frac': 0.010482305800948978, 'bb_std_mult': 1.3883685154516017, 'rsi_os': 17, 'rsi_ob': 93, 'vol_spike': 0.13459440690723234, 'adx_thresh': 34.96721449931667, 'atr_min_pct': 0.0028281577079399094, 'atr_max_pct': 0.026708166475031093, 'tp_mult': 1.407678434422494, 'tsl_mult': 0.269126016354064, 'strategy': 'breakout', 'time_stop': 59, 'use_sma': False, 'use_atr': True, 'use_adx': True, 'use_ema': False, 'use_spike': False, 'rsi_required': True, 'edge_k': 1.9998037580691443, 'edge_cap': 0.8470200496683953}.
[I 2025-08-29 19:01:41,443] Trial 285 finished with values: [-0.0029927472194163363, 0.0029641102816921365] and parameters: {'p_sma': 54, 'p_std': 43, 'p_atr': 17, 'p_adx': 24, 'rsi_period': 50, 'ema1': 10, 'ema2': 33, 'slip_atr_k': 0.0517088064032005, 'slip_spread_k': 0.10519181765850069, 'spread_hl_frac': 0.010122787802865924, 'bb_std_mult': 1.4256367765756677, 'rsi_os': 17, 'rsi_ob': 93, 'vol_spike': 0.12294210280653417, 'adx_thresh': 34.99623009779224, 'atr_min_pct': 0.0032884907244929333, 'atr_max_pct': 0.02618025057916559, 'tp_mult': 1.4169196642739732, 'tsl_mult': 0.26572139635971254, 'strategy': 'mean_reversion', 'time_stop': 59, 'use_sma': True, 'use_atr': True, 'use_adx': True, 'use_ema': False, 'use_spike': True, 'rsi_required': True, 'edge_k': 0.2492998770955085, 'edge_cap': 0.8413604071757008}.
[I 2025-08-29 19:01:41,791] Trial 284 finished with values: [0.00011602691009904298, 0.0010959520653868718] and parameters: {'p_sma': 56, 'p_std': 43, 'p_atr': 16, 'p_adx': 24, 'rsi_period': 52, 'ema1': 10, 'ema2': 36, 'slip_atr_k': 0.039295685432895265, 'slip_spread_k': 0.11865183556140169, 'spread_hl_frac': 0.010577816426912414, 'bb_std_mult': 1.3786824761507541, 'rsi_os': 17, 'rsi_ob': 93, 'vol_spike': 0.12355020913028804, 'adx_thresh': 34.99606916561548, 'atr_min_pct': 0.0033289343328047117, 'atr_max_pct': 0.028021433961205253, 'tp_mult': 1.398597949376063, 'tsl_mult': 0.979539229328134, 'strategy': 'breakout', 'time_stop': 57, 'use_sma': False, 'use_atr': True, 'use_adx': True, 'use_ema': False, 'use_spike': True, 'rsi_required': True, 'edge_k': 0.2863388243323579, 'edge_cap': 0.8301645757411957}.
[I 2025-08-29 19:02:10,552] Trial 287 finished with values: [-0.003184986628847808, 0.003172996351182753] and parameters: {'p_sma': 56, 'p_std': 47, 'p_atr': 17, 'p_adx': 24, 'rsi_period': 51, 'ema1': 10, 'ema2': 33, 'slip_atr_k': 0.05124721572330356, 'slip_spread_k': 0.09862304703612607, 'spread_hl_frac': 0.010581388288997377, 'bb_std_mult': 1.4154063692646883, 'rsi_os': 17, 'rsi_ob': 93, 'vol_spike': 0.12647771488177967, 'adx_thresh': 34.65797573331226, 'atr_min_pct': 0.003282614960283474, 'atr_max_pct': 0.026819452522328396, 'tp_mult': 1.4076306632144773, 'tsl_mult': 0.2624127530800501, 'strategy': 'mean_reversion', 'time_stop': 59, 'use_sma': True, 'use_atr': True, 'use_adx': True, 'use_ema': False, 'use_spike': True, 'rsi_required': False, 'edge_k': 1.0951859934163688, 'edge_cap': 0.8363838056183301}.
[I 2025-08-29 19:02:10,723] Trial 288 finished with values: [-0.00017493520373701443, 0.0013077606120787853] and parameters: {'p_sma': 56, 'p_std': 47, 'p_atr': 15, 'p_adx': 24, 'rsi_period': 51, 'ema1': 10, 'ema2': 37, 'slip_atr_k': 0.039054632709520275, 'slip_spread_k': 0.11389158680470522, 'spread_hl_frac': 0.010637049009692267, 'bb_std_mult': 1.425552640003388, 'rsi_os': 17, 'rsi_ob': 93, 'vol_spike': 0.12309928503856109, 'adx_thresh': 34.44810585631827, 'atr_min_pct': 0.0032520902867610247, 'atr_max_pct': 0.027448779559835934, 'tp_mult': 1.4082884364109625, 'tsl_mult': 0.3038669154673225, 'strategy': 'breakout', 'time_stop': 57, 'use_sma': False, 'use_atr': True, 'use_adx': True, 'use_ema': False, 'use_spike': True, 'rsi_required': False, 'edge_k': 1.0553523472173953, 'edge_cap': 0.8346062086032113}.
[I 2025-08-29 19:02:11,378] Trial 286 finished with values: [-0.0033315288798881904, 0.0033198512529859442] and parameters: {'p_sma': 56, 'p_std': 43, 'p_atr': 15, 'p_adx': 24, 'rsi_period': 51, 'ema1': 10, 'ema2': 37, 'slip_atr_k': 0.03827132064732644, 'slip_spread_k': 0.10054681434306484, 'spread_hl_frac': 0.008708177962925154, 'bb_std_mult': 1.4142759498835686, 'rsi_os': 17, 'rsi_ob': 93, 'vol_spike': 0.11984946369923032, 'adx_thresh': 34.58655733634627, 'atr_min_pct': 0.003384772542546291, 'atr_max_pct': 0.02638812252877716, 'tp_mult': 1.3971020050962413, 'tsl_mult': 0.26647093584313447, 'strategy': 'mean_reversion', 'time_stop': 57, 'use_sma': True, 'use_atr': True, 'use_adx': True, 'use_ema': False, 'use_spike': True, 'rsi_required': False, 'edge_k': 1.827641448254915, 'edge_cap': 0.8356658153306543}.
[I 2025-08-29 19:02:11,732] Trial 289 finished with values: [-1000000000.0, 1000000000.0] and parameters: {'p_sma': 56, 'p_std': 47, 'p_atr': 15, 'p_adx': 24, 'rsi_period': 51, 'ema1': 9, 'ema2': 36, 'slip_atr_k': 0.03812404118325023, 'slip_spread_k': 0.11649303911875655, 'spread_hl_frac': 0.008431876084102336, 'bb_std_mult': 1.4027660485736324, 'rsi_os': 17, 'rsi_ob': 93, 'vol_spike': 0.12308819776043887, 'adx_thresh': 17.60747453458378, 'atr_min_pct': 0.0032195417481298196, 'atr_max_pct': 0.026764308665962095, 'tp_mult': 1.381099603228193, 'tsl_mult': 0.7926874731081457, 'strategy': 'mean_reversion', 'time_stop': 58, 'use_sma': True, 'use_atr': True, 'use_adx': True, 'use_ema': True, 'use_spike': True, 'rsi_required': False, 'edge_k': 1.1128372532603767, 'edge_cap': 0.8369333518203337}.
[I 2025-08-29 19:02:40,909] Trial 293 finished with values: [-0.0014323595182950122, 0.002413539446914127] and parameters: {'p_sma': 57, 'p_std': 44, 'p_atr': 16, 'p_adx': 23, 'rsi_period': 53, 'ema1': 10, 'ema2': 46, 'slip_atr_k': 0.036834613389528446, 'slip_spread_k': 0.12533439195618534, 'spread_hl_frac': 0.011276045767377557, 'bb_std_mult': 1.3299321794876402, 'rsi_os': 18, 'rsi_ob': 94, 'vol_spike': 0.1359736258443143, 'adx_thresh': 34.93303269714284, 'atr_min_pct': 0.00206571739044861, 'atr_max_pct': 0.019831081923331793, 'tp_mult': 1.5019333862324882, 'tsl_mult': 0.27995410273943394, 'strategy': 'breakout', 'time_stop': 65, 'use_sma': False, 'use_atr': True, 'use_adx': True, 'use_ema': False, 'use_spike': False, 'rsi_required': True, 'edge_k': 0.39355221043050326, 'edge_cap': 0.7747620503186736}.
[I 2025-08-29 19:02:41,972] Trial 292 finished with values: [-0.006991183785536537, 0.006952723880298817] and parameters: {'p_sma': 57, 'p_std': 47, 'p_atr': 15, 'p_adx': 23, 'rsi_period': 53, 'ema1': 10, 'ema2': 36, 'slip_atr_k': 0.037375043268122105, 'slip_spread_k': 0.1285382604546504, 'spread_hl_frac': 0.01102975252131325, 'bb_std_mult': 1.380177001239201, 'rsi_os': 12, 'rsi_ob': 92, 'vol_spike': 0.1338152746017532, 'adx_thresh': 17.58216118217152, 'atr_min_pct': 0.001998365068735058, 'atr_max_pct': 0.019463700376304557, 'tp_mult': 1.5245733280394211, 'tsl_mult': 0.27450648540071537, 'strategy': 'breakout', 'time_stop': 68, 'use_sma': False, 'use_atr': True, 'use_adx': True, 'use_ema': True, 'use_spike': False, 'rsi_required': True, 'edge_k': 0.39355838154675515, 'edge_cap': 0.7870200620819802}.
[I 2025-08-29 19:02:42,230] Trial 291 finished with values: [-0.0026881002907477303, 0.002670248621123449] and parameters: {'p_sma': 57, 'p_std': 42, 'p_atr': 15, 'p_adx': 24, 'rsi_period': 53, 'ema1': 10, 'ema2': 36, 'slip_atr_k': 0.03782902571462823, 'slip_spread_k': 0.11538004090238094, 'spread_hl_frac': 0.010063972096612465, 'bb_std_mult': 1.3823717205900936, 'rsi_os': 9, 'rsi_ob': 93, 'vol_spike': 0.13682526899890088, 'adx_thresh': 34.52362888468181, 'atr_min_pct': 0.0021381749851804794, 'atr_max_pct': 0.028307637640258985, 'tp_mult': 1.3908305533979495, 'tsl_mult': 0.27662929866139335, 'strategy': 'breakout', 'time_stop': 67, 'use_sma': False, 'use_atr': True, 'use_adx': True, 'use_ema': True, 'use_spike': False, 'rsi_required': False, 'edge_k': 1.8345613022172693, 'edge_cap': 0.7755772849337541}.
[I 2025-08-29 19:02:42,354] Trial 290 finished with values: [-0.00213513471516813, 0.0021172156138171013] and parameters: {'p_sma': 57, 'p_std': 42, 'p_atr': 15, 'p_adx': 25, 'rsi_period': 53, 'ema1': 10, 'ema2': 37, 'slip_atr_k': 0.03770250702129993, 'slip_spread_k': 0.12994361641462499, 'spread_hl_frac': 0.01133559121495633, 'bb_std_mult': 1.4167389304684308, 'rsi_os': 11, 'rsi_ob': 93, 'vol_spike': 0.11338093691167486, 'adx_thresh': 34.472452927629405, 'atr_min_pct': 0.001981015022672774, 'atr_max_pct': 0.028213674501381656, 'tp_mult': 1.373391847148891, 'tsl_mult': 0.2775093944569165, 'strategy': 'breakout', 'time_stop': 68, 'use_sma': False, 'use_atr': True, 'use_adx': True, 'use_ema': True, 'use_spike': False, 'rsi_required': False, 'edge_k': 1.0511838679319705, 'edge_cap': 0.7837957646530704}.
[I 2025-08-29 19:03:11,099] Trial 297 finished with values: [0.00023359976580006325, 0.0010708856624755746] and parameters: {'p_sma': 54, 'p_std': 46, 'p_atr': 19, 'p_adx': 23, 'rsi_period': 49, 'ema1': 9, 'ema2': 16, 'slip_atr_k': 0.029683408273564558, 'slip_spread_k': 0.021006161174892846, 'spread_hl_frac': 0.00818496460324054, 'bb_std_mult': 1.262851539905021, 'rsi_os': 18, 'rsi_ob': 94, 'vol_spike': 0.13629718819834977, 'adx_thresh': 34.54986790765799, 'atr_min_pct': 0.0033071745152064686, 'atr_max_pct': 0.028487610966667923, 'tp_mult': 1.4618122289692714, 'tsl_mult': 0.3054439297182462, 'strategy': 'breakout', 'time_stop': 54, 'use_sma': False, 'use_atr': False, 'use_adx': False, 'use_ema': False, 'use_spike': False, 'rsi_required': True, 'edge_k': 1.9930017738246872, 'edge_cap': 0.7555392707196286}.
[I 2025-08-29 19:03:11,438] Trial 296 finished with values: [-0.0001083789879726682, 0.0013019451876950592] and parameters: {'p_sma': 54, 'p_std': 46, 'p_atr': 16, 'p_adx': 23, 'rsi_period': 49, 'ema1': 9, 'ema2': 60, 'slip_atr_k': 0.030672250487376682, 'slip_spread_k': 0.0605679509764209, 'spread_hl_frac': 0.008486932812735342, 'bb_std_mult': 1.28163550088981, 'rsi_os': 18, 'rsi_ob': 94, 'vol_spike': 0.1256183784074012, 'adx_thresh': 34.575411421881576, 'atr_min_pct': 0.0031871400069874182, 'atr_max_pct': 0.02935214246978156, 'tp_mult': 1.3995474019198468, 'tsl_mult': 0.31021649410845553, 'strategy': 'breakout', 'time_stop': 54, 'use_sma': False, 'use_atr': True, 'use_adx': False, 'use_ema': False, 'use_spike': False, 'rsi_required': True, 'edge_k': 0.3162817205063966, 'edge_cap': 0.7702893316347154}.
[I 2025-08-29 19:03:11,778] Trial 295 finished with values: [-0.00291362970636988, 0.0035509449406376493] and parameters: {'p_sma': 57, 'p_std': 46, 'p_atr': 15, 'p_adx': 25, 'rsi_period': 49, 'ema1': 9, 'ema2': 16, 'slip_atr_k': 0.0300230707767388, 'slip_spread_k': 0.021453675033203612, 'spread_hl_frac': 0.01029828121538107, 'bb_std_mult': 1.2702718289242723, 'rsi_os': 15, 'rsi_ob': 94, 'vol_spike': 0.136025759063794, 'adx_thresh': 14.116792445548262, 'atr_min_pct': 0.0031417619175272186, 'atr_max_pct': 0.027741061193277246, 'tp_mult': 1.4751749453104697, 'tsl_mult': 0.2643905948585088, 'strategy': 'breakout', 'time_stop': 50, 'use_sma': False, 'use_atr': True, 'use_adx': False, 'use_ema': False, 'use_spike': False, 'rsi_required': True, 'edge_k': 1.991892746419174, 'edge_cap': 0.7678251267779942}.
