[I 2025-08-29 19:20:39,701] Trial 456 finished with values: [-1000000000.0, 1000000000.0] and parameters: {'p_sma': 18, 'p_std': 46, 'p_atr': 18, 'p_adx': 12, 'rsi_period': 52, 'ema1': 10, 'ema2': 30, 'slip_atr_k': 0.21973640398418115, 'slip_spread_k': 0.05503829813323847, 'spread_hl_frac': 0.024675124015232832, 'bb_std_mult': 1.5122707788968928, 'rsi_os': 20, 'rsi_ob': 93, 'vol_spike': 0.1293550284796801, 'adx_thresh': 34.98553606729481, 'atr_min_pct': 0.019836489956608753, 'atr_max_pct': 0.07797768779132415, 'tp_mult': 1.1802587484514584, 'tsl_mult': 0.11412559728345867, 'strategy': 'breakout', 'time_stop': 300, 'use_sma': False, 'use_atr': False, 'use_adx': False, 'use_ema': False, 'use_spike': True, 'rsi_required': True, 'edge_k': 1.9979682444442235, 'edge_cap': 0.9232684382094271}.
[I 2025-08-29 19:21:06,346] Trial 463 finished with values: [-1000000000.0, 1000000000.0] and parameters: {'p_sma': 6, 'p_std': 23, 'p_atr': 8, 'p_adx': 24, 'rsi_period': 46, 'ema1': 9, 'ema2': 17, 'slip_atr_k': 0.11650493875982737, 'slip_spread_k': 0.03659008325755164, 'spread_hl_frac': 0.008951364448099918, 'bb_std_mult': 1.3324228635097315, 'rsi_os': 33, 'rsi_ob': 73, 'vol_spike': 0.14063847881203165, 'adx_thresh': 32.901841959417446, 'atr_min_pct': 0.013888696502405656, 'atr_max_pct': 0.03659407458721144, 'tp_mult': 1.7398325035173035, 'tsl_mult': 0.33320485638310265, 'strategy': 'mean_reversion', 'time_stop': 68, 'use_sma': True, 'use_atr': False, 'use_adx': False, 'use_ema': False, 'use_spike': False, 'rsi_required': False, 'edge_k': 1.9709279662959092, 'edge_cap': 0.5978700691740914}.
[I 2025-08-29 19:21:06,347] Trial 460 finished with values: [-1000000000.0, 1000000000.0] and parameters: {'p_sma': 6, 'p_std': 37, 'p_atr': 19, 'p_adx': 24, 'rsi_period': 52, 'ema1': 9, 'ema2': 17, 'slip_atr_k': 0.11604993970987845, 'slip_spread_k': 0.944036026146178, 'spread_hl_frac': 0.008945162836597794, 'bb_std_mult': 2.5762191603566507, 'rsi_os': 19, 'rsi_ob': 93, 'vol_spike': 0.14137194080479654, 'adx_thresh': 32.83657794654595, 'atr_min_pct': 0.004555033628801752, 'atr_max_pct': 0.1459039771120495, 'tp_mult': 2.1256306207063074, 'tsl_mult': 0.6555950738866863, 'strategy': 'mean_reversion', 'time_stop': 212, 'use_sma': True, 'use_atr': False, 'use_adx': False, 'use_ema': False, 'use_spike': False, 'rsi_required': False, 'edge_k': 1.5950731793422053, 'edge_cap': 0.6873697611156389}.
[I 2025-08-29 19:21:06,635] Trial 462 finished with values: [-1000000000.0, 1000000000.0] and parameters: {'p_sma': 42, 'p_std': 23, 'p_atr': 18, 'p_adx': 23, 'rsi_period': 45, 'ema1': 9, 'ema2': 16, 'slip_atr_k': 0.022744420350981908, 'slip_spread_k': 0.03846467127592395, 'spread_hl_frac': 0.010732193878718137, 'bb_std_mult': 2.594527818739755, 'rsi_os': 19, 'rsi_ob': 93, 'vol_spike': 0.14100199650359793, 'adx_thresh': 32.872023019382965, 'atr_min_pct': 0.011896463108548617, 'atr_max_pct': 0.11648788020170714, 'tp_mult': 1.74352530034098, 'tsl_mult': 0.33682881869885156, 'strategy': 'mean_reversion', 'time_stop': 234, 'use_sma': True, 'use_atr': False, 'use_adx': False, 'use_ema': False, 'use_spike': False, 'rsi_required': False, 'edge_k': 1.9966025917762038, 'edge_cap': 0.8237844765785456}.
[I 2025-08-29 19:21:06,635] Trial 461 finished with values: [-1000000000.0, 1000000000.0] and parameters: {'p_sma': 22, 'p_std': 31, 'p_atr': 18, 'p_adx': 24, 'rsi_period': 52, 'ema1': 26, 'ema2': 16, 'slip_atr_k': 0.02496182972711295, 'slip_spread_k': 0.0346628392884556, 'spread_hl_frac': 0.03944137274564245, 'bb_std_mult': 2.5618578413266118, 'rsi_os': 19, 'rsi_ob': 93, 'vol_spike': 0.142679406554085, 'adx_thresh': 32.61704925592183, 'atr_min_pct': 0.01780985542145323, 'atr_max_pct': 0.03562912022609695, 'tp_mult': 2.126770724170256, 'tsl_mult': 0.6496323791917329, 'strategy': 'mean_reversion', 'time_stop': 71, 'use_sma': True, 'use_atr': False, 'use_adx': False, 'use_ema': False, 'use_spike': False, 'rsi_required': False, 'edge_k': 1.9972711007195396, 'edge_cap': 0.690090583357507}.
[I 2025-08-29 19:21:33,402] Trial 466 finished with values: [-0.0033061413198857137, 0.0038356571577661605] and parameters: {'p_sma': 43, 'p_std': 42, 'p_atr': 27, 'p_adx': 25, 'rsi_period': 48, 'ema1': 25, 'ema2': 40, 'slip_atr_k': 0.02955322860750298, 'slip_spread_k': 0.6630696007580406, 'spread_hl_frac': 0.007713094911667364, 'bb_std_mult': 1.242272505363099, 'rsi_os': 28, 'rsi_ob': 95, 'vol_spike': 0.1541539230284974, 'adx_thresh': 34.4315391496216, 'atr_min_pct': 0.0023200263534201818, 'atr_max_pct': 0.023669478697722166, 'tp_mult': 1.8345484430288248, 'tsl_mult': 0.30454627523211436, 'strategy': 'breakout', 'time_stop': 47, 'use_sma': False, 'use_atr': True, 'use_adx': False, 'use_ema': False, 'use_spike': False, 'rsi_required': True, 'edge_k': 0.155273833854369, 'edge_cap': 0.8723445508011404}.
[I 2025-08-29 19:21:33,761] Trial 465 finished with values: [-0.008369667861800045, 0.008382377166792639] and parameters: {'p_sma': 43, 'p_std': 31, 'p_atr': 27, 'p_adx': 23, 'rsi_period': 45, 'ema1': 11, 'ema2': 48, 'slip_atr_k': 0.023696533955406676, 'slip_spread_k': 0.026624879521862453, 'spread_hl_frac': 0.010626751494975873, 'bb_std_mult': 3.281064801980097, 'rsi_os': 18, 'rsi_ob': 84, 'vol_spike': 0.0361315298208893, 'adx_thresh': 11.035177647842174, 'atr_min_pct': 0.002166678759331971, 'atr_max_pct': 0.12262439899495342, 'tp_mult': 1.61244788571525, 'tsl_mult': 0.3049356333851461, 'strategy': 'breakout', 'time_stop': 48, 'use_sma': False, 'use_atr': False, 'use_adx': False, 'use_ema': False, 'use_spike': False, 'rsi_required': True, 'edge_k': 1.9989605519809601, 'edge_cap': 0.823950731246968}.
[I 2025-08-29 19:21:33,981] Trial 467 finished with values: [-0.006951061053409702, 0.0070170321434269555] and parameters: {'p_sma': 43, 'p_std': 42, 'p_atr': 27, 'p_adx': 25, 'rsi_period': 48, 'ema1': 10, 'ema2': 40, 'slip_atr_k': 0.028471143326243595, 'slip_spread_k': 0.019224269035947206, 'spread_hl_frac': 0.01820881636036306, 'bb_std_mult': 1.2323969459032402, 'rsi_os': 13, 'rsi_ob': 95, 'vol_spike': 0.12615184094004264, 'adx_thresh': 11.163618759721443, 'atr_min_pct': 0.0022146894362686, 'atr_max_pct': 0.024272072689505528, 'tp_mult': 2.5182179215257436, 'tsl_mult': 0.9701012009804751, 'strategy': 'breakout', 'time_stop': 174, 'use_sma': False, 'use_atr': True, 'use_adx': False, 'use_ema': False, 'use_spike': False, 'rsi_required': True, 'edge_k': 1.2435744002111262, 'edge_cap': 0.8060537855561254}.
[I 2025-08-29 19:21:33,981] Trial 464 finished with values: [-1000000000.0, 1000000000.0] and parameters: {'p_sma': 43, 'p_std': 20, 'p_atr': 27, 'p_adx': 23, 'rsi_period': 79, 'ema1': 9, 'ema2': 48, 'slip_atr_k': 0.024405428665973554, 'slip_spread_k': 0.02338232536924188, 'spread_hl_frac': 0.0050349807936164725, 'bb_std_mult': 1.2378696036986911, 'rsi_os': 18, 'rsi_ob': 58, 'vol_spike': 0.0368186458779709, 'adx_thresh': 30.75632339743253, 'atr_min_pct': 0.011948443998229004, 'atr_max_pct': 0.025278149508175203, 'tp_mult': 1.8523503859006993, 'tsl_mult': 0.3425825495629106, 'strategy': 'breakout', 'time_stop': 109, 'use_sma': False, 'use_atr': False, 'use_adx': False, 'use_ema': False, 'use_spike': False, 'rsi_required': True, 'edge_k': 1.3598915631544475, 'edge_cap': 0.8218238518623828}.
[I 2025-08-29 19:22:02,512] Trial 468 finished with values: [-1000000000.0, 1000000000.0] and parameters: {'p_sma': 24, 'p_std': 48, 'p_atr': 19, 'p_adx': 18, 'rsi_period': 48, 'ema1': 10, 'ema2': 32, 'slip_atr_k': 0.1882061179095122, 'slip_spread_k': 0.022239366671687612, 'spread_hl_frac': 0.01634487050145971, 'bb_std_mult': 1.1484045703201897, 'rsi_os': 14, 'rsi_ob': 56, 'vol_spike': 0.12694827211203916, 'adx_thresh': 33.97902075722996, 'atr_min_pct': 0.0034860701027853978, 'atr_max_pct': 0.10823770927222048, 'tp_mult': 1.0195549322030826, 'tsl_mult': 0.3068843290189951, 'strategy': 'breakout', 'time_stop': 59, 'use_sma': False, 'use_atr': False, 'use_adx': False, 'use_ema': True, 'use_spike': False, 'rsi_required': True, 'edge_k': 0.39441261922800797, 'edge_cap': 0.794862329163447}.
[I 2025-08-29 19:22:03,166] Trial 469 finished with values: [-0.01622818988539676, 0.01633708488976524] and parameters: {'p_sma': 52, 'p_std': 20, 'p_atr': 19, 'p_adx': 18, 'rsi_period': 50, 'ema1': 10, 'ema2': 30, 'slip_atr_k': 0.028641516368088187, 'slip_spread_k': 0.02326550102280038, 'spread_hl_frac': 0.04120987224104142, 'bb_std_mult': 1.138781037991179, 'rsi_os': 50, 'rsi_ob': 57, 'vol_spike': 0.12607826059526558, 'adx_thresh': 34.479862615437135, 'atr_min_pct': 0.003615481740190756, 'atr_max_pct': 0.011208651194260996, 'tp_mult': 1.9687387833672834, 'tsl_mult': 0.9728245622453047, 'strategy': 'breakout', 'time_stop': 59, 'use_sma': False, 'use_atr': False, 'use_adx': False, 'use_ema': True, 'use_spike': False, 'rsi_required': True, 'edge_k': 0.48876626867882644, 'edge_cap': 0.8005246641895106}.
[I 2025-08-29 19:22:03,494] Trial 470 finished with values: [-0.0016551738542424088, 0.0016919900343354242] and parameters: {'p_sma': 52, 'p_std': 49, 'p_atr': 19, 'p_adx': 18, 'rsi_period': 50, 'ema1': 10, 'ema2': 55, 'slip_atr_k': 0.04002907729649037, 'slip_spread_k': 0.08131620756849457, 'spread_hl_frac': 0.008885120160836295, 'bb_std_mult': 1.1051270861839366, 'rsi_os': 11, 'rsi_ob': 68, 'vol_spike': 0.13562895803676153, 'adx_thresh': 33.43882805376093, 'atr_min_pct': 0.0035991839604932476, 'atr_max_pct': 0.02705396391280042, 'tp_mult': 1.9872144308377877, 'tsl_mult': 0.5935316305014986, 'strategy': 'breakout', 'time_stop': 270, 'use_sma': False, 'use_atr': False, 'use_adx': False, 'use_ema': True, 'use_spike': True, 'rsi_required': True, 'edge_k': 1.0219648404898392, 'edge_cap': 0.2438029056115158}.
[I 2025-08-29 19:22:03,602] Trial 471 finished with values: [-1000000000.0, 1000000000.0] and parameters: {'p_sma': 9, 'p_std': 49, 'p_atr': 19, 'p_adx': 18, 'rsi_period': 12, 'ema1': 10, 'ema2': 32, 'slip_atr_k': 0.14063054880922551, 'slip_spread_k': 0.08496068848564924, 'spread_hl_frac': 0.008662429385254035, 'bb_std_mult': 1.1070385579852537, 'rsi_os': 14, 'rsi_ob': 69, 'vol_spike': 0.2685776688603939, 'adx_thresh': 34.35848999201435, 'atr_min_pct': 0.026353526844978926, 'atr_max_pct': 0.06875202521437702, 'tp_mult': 1.9378267156114106, 'tsl_mult': 0.36252764624440126, 'strategy': 'breakout', 'time_stop': 58, 'use_sma': False, 'use_atr': False, 'use_adx': False, 'use_ema': True, 'use_spike': True, 'rsi_required': True, 'edge_k': 1.0058714814122651, 'edge_cap': 0.4677478600681345}.
[I 2025-08-29 19:22:29,861] Trial 475 finished with values: [-0.000917017613586868, 0.0017653837952836871] and parameters: {'p_sma': 30, 'p_std': 45, 'p_atr': 23, 'p_adx': 8, 'rsi_period': 72, 'ema1': 8, 'ema2': 36, 'slip_atr_k': 0.04684279426110216, 'slip_spread_k': 0.17234307841100527, 'spread_hl_frac': 0.006092236595909718, 'bb_std_mult': 1.309306178483529, 'rsi_os': 25, 'rsi_ob': 94, 'vol_spike': 0.1472149049902423, 'adx_thresh': 14.896092056169202, 'atr_min_pct': 0.00432331286405929, 'atr_max_pct': 0.08684552519619766, 'tp_mult': 2.9929207112539804, 'tsl_mult': 0.8720094556620555, 'strategy': 'breakout', 'time_stop': 205, 'use_sma': False, 'use_atr': True, 'use_adx': False, 'use_ema': False, 'use_spike': False, 'rsi_required': True, 'edge_k': 1.8581547031209253, 'edge_cap': 0.98227965871663}.
[I 2025-08-29 19:22:30,304] Trial 474 finished with values: [-1000000000.0, 1000000000.0] and parameters: {'p_sma': 30, 'p_std': 44, 'p_atr': 7, 'p_adx': 26, 'rsi_period': 75, 'ema1': 5, 'ema2': 60, 'slip_atr_k': 0.14065121651644083, 'slip_spread_k': 0.0675864324626978, 'spread_hl_frac': 0.0062539616127049195, 'bb_std_mult': 1.321339384285805, 'rsi_os': 25, 'rsi_ob': 63, 'vol_spike': 0.26614300789379153, 'adx_thresh': 9.510981859135743, 'atr_min_pct': 0.007580546581317942, 'atr_max_pct': 0.03065040900701045, 'tp_mult': 1.9204001477176014, 'tsl_mult': 0.8720390528423526, 'strategy': 'breakout', 'time_stop': 224, 'use_sma': False, 'use_atr': True, 'use_adx': False, 'use_ema': False, 'use_spike': False, 'rsi_required': True, 'edge_k': 1.852737229226185, 'edge_cap': 0.6637157005788309}.
[I 2025-08-29 19:22:30,748] Trial 472 finished with values: [-1000000000.0, 1000000000.0] and parameters: {'p_sma': 8, 'p_std': 51, 'p_atr': 7, 'p_adx': 23, 'rsi_period': 22, 'ema1': 19, 'ema2': 36, 'slip_atr_k': 0.23844702712133334, 'slip_spread_k': 0.17753246871799255, 'spread_hl_frac': 0.006178736711369894, 'bb_std_mult': 2.6868436638215405, 'rsi_os': 5, 'rsi_ob': 94, 'vol_spike': 0.1371270451141469, 'adx_thresh': 9.474979299418719, 'atr_min_pct': 0.004169523649396949, 'atr_max_pct': 0.07121559042695702, 'tp_mult': 2.6740292665291863, 'tsl_mult': 0.5020727685991205, 'strategy': 'breakout', 'time_stop': 204, 'use_sma': False, 'use_atr': False, 'use_adx': False, 'use_ema': True, 'use_spike': True, 'rsi_required': True, 'edge_k': 1.865914327442194, 'edge_cap': 0.77713209198538}.
[I 2025-08-29 19:22:30,827] Trial 473 finished with values: [-0.056620260469696926, 0.05664086107684513] and parameters: {'p_sma': 45, 'p_std': 49, 'p_atr': 7, 'p_adx': 15, 'rsi_period': 68, 'ema1': 29, 'ema2': 55, 'slip_atr_k': 0.2390600132300993, 'slip_spread_k': 0.06640388782253606, 'spread_hl_frac': 0.006374725573863336, 'bb_std_mult': 1.3235982215127824, 'rsi_os': 48, 'rsi_ob': 90, 'vol_spike': 0.1340880390978661, 'adx_thresh': 33.45267377409662, 'atr_min_pct': 0.0032089353836405226, 'atr_max_pct': 0.08708996393877445, 'tp_mult': 1.9188792011021827, 'tsl_mult': 0.3551271125299835, 'strategy': 'breakout', 'time_stop': 204, 'use_sma': False, 'use_atr': False, 'use_adx': False, 'use_ema': False, 'use_spike': True, 'rsi_required': True, 'edge_k': 1.0289286006532667, 'edge_cap': 0.768264130590609}.
[I 2025-08-29 19:22:57,514] Trial 479 finished with values: [-1000000000.0, 1000000000.0] and parameters: {'p_sma': 40, 'p_std': 47, 'p_atr': 28, 'p_adx': 22, 'rsi_period': 46, 'ema1': 9, 'ema2': 58, 'slip_atr_k': 0.034201351295530855, 'slip_spread_k': 0.8607755510627392, 'spread_hl_frac': 0.019444219746801245, 'bb_std_mult': 0.6737769680345649, 'rsi_os': 17, 'rsi_ob': 94, 'vol_spike': 0.015011123441334207, 'adx_thresh': 21.844379702535253, 'atr_min_pct': 0.011075366421418813, 'atr_max_pct': 0.026979448044639517, 'tp_mult': 1.8213132890412178, 'tsl_mult': 0.33085649912680537, 'strategy': 'mean_reversion', 'time_stop': 35, 'use_sma': True, 'use_atr': False, 'use_adx': False, 'use_ema': False, 'use_spike': False, 'rsi_required': False, 'edge_k': 1.9119196269215597, 'edge_cap': 0.27977676915020033}.
[I 2025-08-29 19:22:57,551] Trial 477 finished with values: [-1000000000.0, 1000000000.0] and parameters: {'p_sma': 39, 'p_std': 47, 'p_atr': 20, 'p_adx': 23, 'rsi_period': 22, 'ema1': 29, 'ema2': 58, 'slip_atr_k': 0.017638256852475276, 'slip_spread_k': 0.5223475351827362, 'spread_hl_frac': 0.003213805554085982, 'bb_std_mult': 2.65488317087059, 'rsi_os': 16, 'rsi_ob': 90, 'vol_spike': 0.13340791892857548, 'adx_thresh': 22.15644614793296, 'atr_min_pct': 0.015255515933080568, 'atr_max_pct': 0.030604106542556263, 'tp_mult': 2.2858572823774574, 'tsl_mult': 0.32992877651616215, 'strategy': 'mean_reversion', 'time_stop': 52, 'use_sma': True, 'use_atr': False, 'use_adx': False, 'use_ema': False, 'use_spike': False, 'rsi_required': False, 'edge_k': 1.4142943662880496, 'edge_cap': 0.773501868809798}.
[I 2025-08-29 19:22:57,644] Trial 478 finished with values: [-0.022587527262178497, 0.02256908336789301] and parameters: {'p_sma': 45, 'p_std': 35, 'p_atr': 21, 'p_adx': 19, 'rsi_period': 30, 'ema1': 9, 'ema2': 28, 'slip_atr_k': 0.018504231827492702, 'slip_spread_k': 0.8573373170639053, 'spread_hl_frac': 0.007786541413221403, 'bb_std_mult': 0.676940745117977, 'rsi_os': 17, 'rsi_ob': 92, 'vol_spike': 0.1326464577225004, 'adx_thresh': 13.27179764750628, 'atr_min_pct': 0.0006375852701034183, 'atr_max_pct': 0.02700715761199733, 'tp_mult': 2.238409938890003, 'tsl_mult': 0.32651986047928566, 'strategy': 'mean_reversion', 'time_stop': 37, 'use_sma': True, 'use_atr': False, 'use_adx': False, 'use_ema': False, 'use_spike': False, 'rsi_required': False, 'edge_k': 1.9151944272477661, 'edge_cap': 0.6127707749955601}.
[I 2025-08-29 19:22:57,733] Trial 476 finished with values: [-1000000000.0, 1000000000.0] and parameters: {'p_sma': 8, 'p_std': 44, 'p_atr': 28, 'p_adx': 15, 'rsi_period': 22, 'ema1': 9, 'ema2': 60, 'slip_atr_k': 0.22372168816968405, 'slip_spread_k': 0.8562057623084726, 'spread_hl_frac': 0.00777217866048004, 'bb_std_mult': 1.343840570595873, 'rsi_os': 16, 'rsi_ob': 63, 'vol_spike': 0.13459812511441663, 'adx_thresh': 34.96745742410906, 'atr_min_pct': 0.015346744449481876, 'atr_max_pct': 0.030538918989258392, 'tp_mult': 2.2519961279211147, 'tsl_mult': 0.49396419729909036, 'strategy': 'mean_reversion', 'time_stop': 41, 'use_sma': False, 'use_atr': False, 'use_adx': False, 'use_ema': False, 'use_spike': False, 'rsi_required': True, 'edge_k': 1.4039144430367205, 'edge_cap': 0.6117335254552518}.
[I 2025-08-29 19:23:23,821] Trial 481 finished with values: [-1000000000.0, 1000000000.0] and parameters: {'p_sma': 48, 'p_std': 40, 'p_atr': 20, 'p_adx': 19, 'rsi_period': 30, 'ema1': 23, 'ema2': 38, 'slip_atr_k': 0.15690549431601136, 'slip_spread_k': 0.5701530154639761, 'spread_hl_frac': 0.007656528276385693, 'bb_std_mult': 1.1888685080039518, 'rsi_os': 7, 'rsi_ob': 86, 'vol_spike': 0.07390943268029254, 'adx_thresh': 13.263783019206347, 'atr_min_pct': 0.020728758154121618, 'atr_max_pct': 0.03417278883938302, 'tp_mult': 1.1017555495884939, 'tsl_mult': 0.3942208285325999, 'strategy': 'breakout', 'time_stop': 40, 'use_sma': False, 'use_atr': True, 'use_adx': False, 'use_ema': False, 'use_spike': False, 'rsi_required': True, 'edge_k': 1.956583263289798, 'edge_cap': 0.6025585967842961}.
[I 2025-08-29 19:23:24,232] Trial 482 finished with values: [-1000000000.0, 1000000000.0] and parameters: {'p_sma': 50, 'p_std': 40, 'p_atr': 20, 'p_adx': 17, 'rsi_period': 43, 'ema1': 28, 'ema2': 24, 'slip_atr_k': 0.22500938408765897, 'slip_spread_k': 0.001431099072812204, 'spread_hl_frac': 0.03710784032652181, 'bb_std_mult': 1.2055660882840062, 'rsi_os': 30, 'rsi_ob': 95, 'vol_spike': 0.14596625117652196, 'adx_thresh': 6.8151670149630945, 'atr_min_pct': 0.026990199604844875, 'atr_max_pct': 0.13458528566497002, 'tp_mult': 1.4784443291111509, 'tsl_mult': 0.6274870235471762, 'strategy': 'breakout', 'time_stop': 253, 'use_sma': False, 'use_atr': True, 'use_adx': False, 'use_ema': False, 'use_spike': False, 'rsi_required': True, 'edge_k': 1.955352492491505, 'edge_cap': 0.35332085076457864}.
[I 2025-08-29 19:23:24,343] Trial 483 finished with values: [-1000000000.0, 1000000000.0] and parameters: {'p_sma': 17, 'p_std': 45, 'p_atr': 10, 'p_adx': 24, 'rsi_period': 43, 'ema1': 28, 'ema2': 38, 'slip_atr_k': 0.038615069938826636, 'slip_spread_k': 0.5789564890324661, 'spread_hl_frac': 0.009174462524946098, 'bb_std_mult': 1.2682781312450033, 'rsi_os': 22, 'rsi_ob': 95, 'vol_spike': 0.0026990534935404376, 'adx_thresh': 26.341489198193155, 'atr_min_pct': 0.027055999992918772, 'atr_max_pct': 0.0342192900653039, 'tp_mult': 1.584143658039305, 'tsl_mult': 0.39358392260329356, 'strategy': 'breakout', 'time_stop': 82, 'use_sma': False, 'use_atr': True, 'use_adx': False, 'use_ema': False, 'use_spike': False, 'rsi_required': True, 'edge_k': 1.951065237158799, 'edge_cap': 0.7149624312561297}.
[I 2025-08-29 19:23:24,408] Trial 480 finished with values: [-0.04291484246695165, 0.042955604265552706] and parameters: {'p_sma': 50, 'p_std': 45, 'p_atr': 20, 'p_adx': 19, 'rsi_period': 8, 'ema1': 23, 'ema2': 38, 'slip_atr_k': 0.22577641152298292, 'slip_spread_k': 0.3367552408986027, 'spread_hl_frac': 0.007742601056185605, 'bb_std_mult': 1.1799590660960395, 'rsi_os': 30, 'rsi_ob': 95, 'vol_spike': 0.0035574644968102143, 'adx_thresh': 24.81460169844781, 'atr_min_pct': 0.002704624415906668, 'atr_max_pct': 0.03486822828395761, 'tp_mult': 1.509955437596266, 'tsl_mult': 0.38984068527642435, 'strategy': 'breakout', 'time_stop': 40, 'use_sma': False, 'use_atr': True, 'use_adx': False, 'use_ema': False, 'use_spike': False, 'rsi_required': True, 'edge_k': 1.9428506816839, 'edge_cap': 0.7115421857965236}.
[I 2025-08-29 19:23:50,687] Trial 484 finished with values: [-0.0030950719098691293, 0.0033443689771854497] and parameters: {'p_sma': 50, 'p_std': 29, 'p_atr': 30, 'p_adx': 29, 'rsi_period': 42, 'ema1': 8, 'ema2': 24, 'slip_atr_k': 0.03984580857113321, 'slip_spread_k': 0.6289842803180067, 'spread_hl_frac': 0.012801041261567475, 'bb_std_mult': 1.2767181816904747, 'rsi_os': 18, 'rsi_ob': 95, 'vol_spike': 0.2933466592686132, 'adx_thresh': 20.042769317486847, 'atr_min_pct': 0.0028666028001984476, 'atr_max_pct': 0.019868759010971952, 'tp_mult': 1.5329241556787423, 'tsl_mult': 0.7912709426201348, 'strategy': 'breakout', 'time_stop': 80, 'use_sma': False, 'use_atr': False, 'use_adx': False, 'use_ema': False, 'use_spike': False, 'rsi_required': True, 'edge_k': 1.9676238754098063, 'edge_cap': 0.7123939954661498}.
[I 2025-08-29 19:23:51,423] Trial 485 finished with values: [-0.0009750226913364246, 0.0013261095915199884] and parameters: {'p_sma': 12, 'p_std': 33, 'p_atr': 19, 'p_adx': 23, 'rsi_period': 40, 'ema1': 26, 'ema2': 29, 'slip_atr_k': 0.1496371269994739, 'slip_spread_k': 0.6292115901873622, 'spread_hl_frac': 0.012977941045172293, 'bb_std_mult': 1.2721402575809893, 'rsi_os': 18, 'rsi_ob': 94, 'vol_spike': 0.004764541568935909, 'adx_thresh': 34.178455044166625, 'atr_min_pct': 0.0025422703247859465, 'atr_max_pct': 0.053611229157794774, 'tp_mult': 1.586539129001091, 'tsl_mult': 0.2936534334694359, 'strategy': 'breakout', 'time_stop': 27, 'use_sma': False, 'use_atr': False, 'use_adx': False, 'use_ema': False, 'use_spike': False, 'rsi_required': True, 'edge_k': 1.9603147984007105, 'edge_cap': 0.219842390831556}.
