[I 2025-08-29 19:03:12,022] Trial 294 finished with values: [-0.003368672969610409, 0.0035072174208955393] and parameters: {'p_sma': 57, 'p_std': 46, 'p_atr': 15, 'p_adx': 23, 'rsi_period': 54, 'ema1': 10, 'ema2': 16, 'slip_atr_k': 0.03076888818511193, 'slip_spread_k': 0.05047328117872488, 'spread_hl_frac': 0.008190707577073275, 'bb_std_mult': 1.27050764406085, 'rsi_os': 12, 'rsi_ob': 92, 'vol_spike': 0.13740531213180807, 'adx_thresh': 10.719384583803965, 'atr_min_pct': 0.0032545394126812064, 'atr_max_pct': 0.02882411901306524, 'tp_mult': 1.467846146937067, 'tsl_mult': 0.2596139273969822, 'strategy': 'breakout', 'time_stop': 70, 'use_sma': False, 'use_atr': True, 'use_adx': False, 'use_ema': True, 'use_spike': False, 'rsi_required': True, 'edge_k': 0.051257875988850565, 'edge_cap': 0.7932347937219106}.
[I 2025-08-29 19:03:39,885] Trial 300 finished with values: [0.00010080904716636141, 0.001072679317785653] and parameters: {'p_sma': 53, 'p_std': 48, 'p_atr': 19, 'p_adx': 23, 'rsi_period': 47, 'ema1': 9, 'ema2': 23, 'slip_atr_k': 0.02996648763174297, 'slip_spread_k': 0.007596509440538099, 'spread_hl_frac': 0.008387029613886158, 'bb_std_mult': 1.268371254551243, 'rsi_os': 18, 'rsi_ob': 95, 'vol_spike': 0.12614752110935734, 'adx_thresh': 34.1685202204177, 'atr_min_pct': 0.0033206233352958193, 'atr_max_pct': 0.025414980199218538, 'tp_mult': 1.86138777418403, 'tsl_mult': 0.31493602053252234, 'strategy': 'breakout', 'time_stop': 53, 'use_sma': False, 'use_atr': False, 'use_adx': False, 'use_ema': False, 'use_spike': False, 'rsi_required': True, 'edge_k': 1.9984515165439505, 'edge_cap': 0.7387863246820016}.
[I 2025-08-29 19:03:40,219] Trial 299 finished with values: [0.0002914269892106969, 0.0009823036194163708] and parameters: {'p_sma': 52, 'p_std': 48, 'p_atr': 19, 'p_adx': 23, 'rsi_period': 49, 'ema1': 9, 'ema2': 18, 'slip_atr_k': 0.030372788645239672, 'slip_spread_k': 0.014589679534542724, 'spread_hl_frac': 0.00852964609781079, 'bb_std_mult': 1.2699859929241362, 'rsi_os': 18, 'rsi_ob': 94, 'vol_spike': 0.13699604332119097, 'adx_thresh': 34.24774302349589, 'atr_min_pct': 0.0032861761578889164, 'atr_max_pct': 0.029137789224261194, 'tp_mult': 1.7940355476447172, 'tsl_mult': 0.30619317667451323, 'strategy': 'breakout', 'time_stop': 51, 'use_sma': False, 'use_atr': False, 'use_adx': False, 'use_ema': False, 'use_spike': False, 'rsi_required': True, 'edge_k': 1.989383230726536, 'edge_cap': 0.7439442003356643}.
[I 2025-08-29 19:03:40,395] Trial 301 finished with values: [-0.0009905544948087819, 0.0018281156930440435] and parameters: {'p_sma': 52, 'p_std': 48, 'p_atr': 19, 'p_adx': 23, 'rsi_period': 49, 'ema1': 9, 'ema2': 18, 'slip_atr_k': 0.0319961734358964, 'slip_spread_k': 0.0038662944487013844, 'spread_hl_frac': 0.008376434854340158, 'bb_std_mult': 1.2659523160622446, 'rsi_os': 18, 'rsi_ob': 95, 'vol_spike': 0.13917424597877073, 'adx_thresh': 34.28334479960911, 'atr_min_pct': 0.0024073935913074807, 'atr_max_pct': 0.02448036122137661, 'tp_mult': 1.8431086082754233, 'tsl_mult': 0.3102947417014479, 'strategy': 'breakout', 'time_stop': 45, 'use_sma': False, 'use_atr': False, 'use_adx': False, 'use_ema': False, 'use_spike': False, 'rsi_required': True, 'edge_k': 1.9939482206109562, 'edge_cap': 0.7325507284367188}.
[I 2025-08-29 19:03:40,506] Trial 298 finished with values: [0.0002950714598368709, 0.0009455791678801156] and parameters: {'p_sma': 44, 'p_std': 46, 'p_atr': 19, 'p_adx': 23, 'rsi_period': 48, 'ema1': 9, 'ema2': 23, 'slip_atr_k': 0.02992155452790253, 'slip_spread_k': 0.0017518658888183991, 'spread_hl_frac': 0.008461688352800074, 'bb_std_mult': 1.2564467487651427, 'rsi_os': 18, 'rsi_ob': 94, 'vol_spike': 0.136249854222655, 'adx_thresh': 34.261743816814494, 'atr_min_pct': 0.0033476006787619235, 'atr_max_pct': 0.028462287865084254, 'tp_mult': 1.7682584240112105, 'tsl_mult': 0.32123356929946717, 'strategy': 'breakout', 'time_stop': 52, 'use_sma': False, 'use_atr': False, 'use_adx': False, 'use_ema': False, 'use_spike': False, 'rsi_required': True, 'edge_k': 1.988668380798404, 'edge_cap': 0.7334190419127337}.
[I 2025-08-29 19:04:08,337] Trial 302 finished with values: [-0.0007675252729301141, 0.0016112696579285183] and parameters: {'p_sma': 52, 'p_std': 48, 'p_atr': 19, 'p_adx': 23, 'rsi_period': 48, 'ema1': 9, 'ema2': 18, 'slip_atr_k': 0.028956621652431, 'slip_spread_k': 0.0026586263629355122, 'spread_hl_frac': 0.00817952567879262, 'bb_std_mult': 1.2512935440576056, 'rsi_os': 18, 'rsi_ob': 94, 'vol_spike': 0.1380496787012246, 'adx_thresh': 34.37654414828774, 'atr_min_pct': 0.00254628157132074, 'atr_max_pct': 0.029234174018692247, 'tp_mult': 1.7712647305497051, 'tsl_mult': 0.3191297456338047, 'strategy': 'breakout', 'time_stop': 46, 'use_sma': False, 'use_atr': False, 'use_adx': False, 'use_ema': False, 'use_spike': False, 'rsi_required': True, 'edge_k': 1.99736949584899, 'edge_cap': 0.7349860887762073}.
[I 2025-08-29 19:04:09,557] Trial 305 finished with values: [-1000000000.0, 1000000000.0] and parameters: {'p_sma': 43, 'p_std': 49, 'p_atr': 19, 'p_adx': 23, 'rsi_period': 46, 'ema1': 9, 'ema2': 22, 'slip_atr_k': 0.159871122980156, 'slip_spread_k': 0.0007636618403763923, 'spread_hl_frac': 0.023898022903091898, 'bb_std_mult': 2.4595806147235915, 'rsi_os': 37, 'rsi_ob': 95, 'vol_spike': 0.11297263260028788, 'adx_thresh': 33.456515531785314, 'atr_min_pct': 0.028843251236629352, 'atr_max_pct': 0.02898609858152819, 'tp_mult': 1.950076146463671, 'tsl_mult': 0.3416067902562242, 'strategy': 'mean_reversion', 'time_stop': 51, 'use_sma': True, 'use_atr': False, 'use_adx': False, 'use_ema': True, 'use_spike': True, 'rsi_required': False, 'edge_k': 1.9993932318645316, 'edge_cap': 0.6758009552555628}.
[I 2025-08-29 19:04:09,998] Trial 303 finished with values: [-1000000000.0, 1000000000.0] and parameters: {'p_sma': 50, 'p_std': 49, 'p_atr': 19, 'p_adx': 23, 'rsi_period': 48, 'ema1': 9, 'ema2': 18, 'slip_atr_k': 0.028664338348420124, 'slip_spread_k': 0.0049379962399188956, 'spread_hl_frac': 0.024101192856383027, 'bb_std_mult': 3.0534028833206954, 'rsi_os': 18, 'rsi_ob': 95, 'vol_spike': 0.11014803808473285, 'adx_thresh': 16.335646282053975, 'atr_min_pct': 0.002404156097265835, 'atr_max_pct': 0.02927440541854389, 'tp_mult': 1.7752889196479127, 'tsl_mult': 0.3345371604693496, 'strategy': 'mean_reversion', 'time_stop': 52, 'use_sma': True, 'use_atr': False, 'use_adx': False, 'use_ema': True, 'use_spike': True, 'rsi_required': False, 'edge_k': 1.976395217933127, 'edge_cap': 0.7316229596366953}.
[I 2025-08-29 19:04:10,178] Trial 304 finished with values: [-1000000000.0, 1000000000.0] and parameters: {'p_sma': 44, 'p_std': 49, 'p_atr': 19, 'p_adx': 24, 'rsi_period': 47, 'ema1': 9, 'ema2': 18, 'slip_atr_k': 0.029550025947406848, 'slip_spread_k': 0.021666500195833768, 'spread_hl_frac': 0.04388667974165045, 'bb_std_mult': 3.591814373147251, 'rsi_os': 14, 'rsi_ob': 95, 'vol_spike': 0.13961414054637294, 'adx_thresh': 5.837359964758361, 'atr_min_pct': 0.027221458925821892, 'atr_max_pct': 0.029633094688873044, 'tp_mult': 1.9426080601784732, 'tsl_mult': 0.3417094497137358, 'strategy': 'mean_reversion', 'time_stop': 46, 'use_sma': True, 'use_atr': False, 'use_adx': False, 'use_ema': True, 'use_spike': True, 'rsi_required': False, 'edge_k': 1.991077784919273, 'edge_cap': 0.7149102655962317}.
[I 2025-08-29 19:04:10,326] Trial 306 finished with values: [-1000000000.0, 1000000000.0] and parameters: {'p_sma': 44, 'p_std': 49, 'p_atr': 18, 'p_adx': 23, 'rsi_period': 47, 'ema1': 9, 'ema2': 22, 'slip_atr_k': 0.2228546921650537, 'slip_spread_k': 0.023596784010580824, 'spread_hl_frac': 0.035768525338725855, 'bb_std_mult': 2.4708750721977224, 'rsi_os': 46, 'rsi_ob': 95, 'vol_spike': 0.2977467468305742, 'adx_thresh': 33.57470178405639, 'atr_min_pct': 0.019459302749897805, 'atr_max_pct': 0.017404071315320152, 'tp_mult': 1.9645212454598815, 'tsl_mult': 0.35365320904268016, 'strategy': 'mean_reversion', 'time_stop': 53, 'use_sma': True, 'use_atr': False, 'use_adx': False, 'use_ema': True, 'use_spike': True, 'rsi_required': False, 'edge_k': 1.9935577839672143, 'edge_cap': 0.5465222813979536}.
[I 2025-08-29 19:04:10,416] Trial 308 finished with values: [-1000000000.0, 1000000000.0] and parameters: {'p_sma': 28, 'p_std': 48, 'p_atr': 18, 'p_adx': 24, 'rsi_period': 46, 'ema1': 27, 'ema2': 23, 'slip_atr_k': 0.10687389364725683, 'slip_spread_k': 0.02652001017570537, 'spread_hl_frac': 0.008524069269927567, 'bb_std_mult': 1.1988859639067913, 'rsi_os': 14, 'rsi_ob': 94, 'vol_spike': 0.1285185309355958, 'adx_thresh': 33.501131066427114, 'atr_min_pct': 0.020318863250942364, 'atr_max_pct': 0.017977944621804715, 'tp_mult': 1.7077099485113454, 'tsl_mult': 0.3599468326118715, 'strategy': 'mean_reversion', 'time_stop': 44, 'use_sma': True, 'use_atr': False, 'use_adx': False, 'use_ema': True, 'use_spike': True, 'rsi_required': False, 'edge_k': 1.9966931730154849, 'edge_cap': 0.5518277316098904}.
[I 2025-08-29 19:04:10,453] Trial 309 finished with values: [-1000000000.0, 1000000000.0] and parameters: {'p_sma': 45, 'p_std': 47, 'p_atr': 18, 'p_adx': 23, 'rsi_period': 45, 'ema1': 27, 'ema2': 24, 'slip_atr_k': 0.08094237246927913, 'slip_spread_k': 0.027879172609397446, 'spread_hl_frac': 0.04613110682099286, 'bb_std_mult': 2.862951970863985, 'rsi_os': 54, 'rsi_ob': 94, 'vol_spike': 0.1319344842025818, 'adx_thresh': 33.20509377006873, 'atr_min_pct': 0.003457263420998584, 'atr_max_pct': 0.03290863259187904, 'tp_mult': 1.7024071236877738, 'tsl_mult': 0.3199959431130215, 'strategy': 'mean_reversion', 'time_stop': 52, 'use_sma': True, 'use_atr': False, 'use_adx': False, 'use_ema': False, 'use_spike': True, 'rsi_required': False, 'edge_k': 1.9627946949468291, 'edge_cap': 0.588075486116699}.
[I 2025-08-29 19:04:38,805] Trial 307 finished with values: [-1000000000.0, 1000000000.0] and parameters: {'p_sma': 44, 'p_std': 49, 'p_atr': 18, 'p_adx': 23, 'rsi_period': 47, 'ema1': 9, 'ema2': 23, 'slip_atr_k': 0.14945727260048167, 'slip_spread_k': 0.024884021933571414, 'spread_hl_frac': 0.008268150621166977, 'bb_std_mult': 2.538812276450698, 'rsi_os': 14, 'rsi_ob': 95, 'vol_spike': 0.12582660782009675, 'adx_thresh': 9.197014160896405, 'atr_min_pct': 0.020217435972387163, 'atr_max_pct': 0.03264396513613781, 'tp_mult': 1.705764316388161, 'tsl_mult': 0.35985714729946733, 'strategy': 'mean_reversion', 'time_stop': 53, 'use_sma': True, 'use_atr': False, 'use_adx': False, 'use_ema': True, 'use_spike': True, 'rsi_required': False, 'edge_k': 1.9673796086685351, 'edge_cap': 0.549796055956739}.
[I 2025-08-29 19:04:39,252] Trial 311 finished with values: [-0.007069575998057687, 0.007049214392320489] and parameters: {'p_sma': 47, 'p_std': 45, 'p_atr': 18, 'p_adx': 23, 'rsi_period': 45, 'ema1': 10, 'ema2': 25, 'slip_atr_k': 0.2296819798964191, 'slip_spread_k': 0.03269580093718153, 'spread_hl_frac': 0.007732364467366523, 'bb_std_mult': 1.1943541395270894, 'rsi_os': 17, 'rsi_ob': 94, 'vol_spike': 0.00874853567244363, 'adx_thresh': 11.771973660703637, 'atr_min_pct': 0.003318675160169069, 'atr_max_pct': 0.03245812419020359, 'tp_mult': 1.8178926280742562, 'tsl_mult': 0.3190253282423191, 'strategy': 'mean_reversion', 'time_stop': 35, 'use_sma': True, 'use_atr': False, 'use_adx': False, 'use_ema': False, 'use_spike': False, 'rsi_required': True, 'edge_k': 1.9535472478790366, 'edge_cap': 0.5833522121958256}.
[I 2025-08-29 19:04:39,442] Trial 310 finished with values: [-1000000000.0, 1000000000.0] and parameters: {'p_sma': 28, 'p_std': 47, 'p_atr': 18, 'p_adx': 24, 'rsi_period': 45, 'ema1': 24, 'ema2': 23, 'slip_atr_k': 0.14840014372636676, 'slip_spread_k': 0.03627111869253223, 'spread_hl_frac': 0.00817550526509285, 'bb_std_mult': 3.117674099690225, 'rsi_os': 17, 'rsi_ob': 94, 'vol_spike': 0.12635866250806466, 'adx_thresh': 28.269197614436017, 'atr_min_pct': 0.0034271439988516365, 'atr_max_pct': 0.021088770159107057, 'tp_mult': 1.7261363088879418, 'tsl_mult': 0.31353563156564845, 'strategy': 'mean_reversion', 'time_stop': 41, 'use_sma': True, 'use_atr': False, 'use_adx': False, 'use_ema': False, 'use_spike': True, 'rsi_required': True, 'edge_k': 1.9575046296987226, 'edge_cap': 0.5901513036542552}.
[I 2025-08-29 19:04:39,531] Trial 312 finished with values: [-0.0062899389018026275, 0.006335601964405961] and parameters: {'p_sma': 49, 'p_std': 45, 'p_atr': 20, 'p_adx': 23, 'rsi_period': 48, 'ema1': 10, 'ema2': 28, 'slip_atr_k': 0.1777773428764788, 'slip_spread_k': 0.04048890484392492, 'spread_hl_frac': 0.028400273122972282, 'bb_std_mult': 1.1926475361492925, 'rsi_os': 15, 'rsi_ob': 94, 'vol_spike': 0.25212298501673086, 'adx_thresh': 28.263711068458058, 'atr_min_pct': 0.0016428668597047132, 'atr_max_pct': 0.013464416323684933, 'tp_mult': 1.8815150815339015, 'tsl_mult': 0.3246503453668742, 'strategy': 'breakout', 'time_stop': 32, 'use_sma': False, 'use_atr': False, 'use_adx': False, 'use_ema': False, 'use_spike': False, 'rsi_required': True, 'edge_k': 0.9071800349391189, 'edge_cap': 0.9162260986662931}.
[I 2025-08-29 19:04:39,755] Trial 316 finished with values: [-1000000000.0, 1000000000.0] and parameters: {'p_sma': 38, 'p_std': 46, 'p_atr': 20, 'p_adx': 24, 'rsi_period': 49, 'ema1': 8, 'ema2': 20, 'slip_atr_k': 0.08839312217441078, 'slip_spread_k': 0.007032229156301226, 'spread_hl_frac': 0.03856310564714206, 'bb_std_mult': 1.7443836400992427, 'rsi_os': 40, 'rsi_ob': 92, 'vol_spike': 0.018889989616211078, 'adx_thresh': 33.50538406815384, 'atr_min_pct': 0.0264828364098377, 'atr_max_pct': 0.025492112686404656, 'tp_mult': 1.6394383811920048, 'tsl_mult': 0.34144200143289116, 'strategy': 'breakout', 'time_stop': 48, 'use_sma': False, 'use_atr': False, 'use_adx': False, 'use_ema': False, 'use_spike': False, 'rsi_required': True, 'edge_k': 1.950439745569092, 'edge_cap': 0.6555873931737092}.
[I 2025-08-29 19:04:39,852] Trial 317 finished with values: [-1000000000.0, 1000000000.0] and parameters: {'p_sma': 25, 'p_std': 46, 'p_atr': 19, 'p_adx': 15, 'rsi_period': 49, 'ema1': 9, 'ema2': 29, 'slip_atr_k': 0.19159781152533434, 'slip_spread_k': 0.00017055810042091997, 'spread_hl_frac': 0.03385071509563632, 'bb_std_mult': 3.4172849345114917, 'rsi_os': 6, 'rsi_ob': 92, 'vol_spike': 0.14032473441568039, 'adx_thresh': 14.768089438651241, 'atr_min_pct': 0.029444253294600098, 'atr_max_pct': 0.024457575336972556, 'tp_mult': 1.6425655324351134, 'tsl_mult': 0.36936771566287363, 'strategy': 'breakout', 'time_stop': 55, 'use_sma': False, 'use_atr': False, 'use_adx': False, 'use_ema': False, 'use_spike': False, 'rsi_required': True, 'edge_k': 1.9963054413803862, 'edge_cap': 0.8857570601012072}.
[I 2025-08-29 19:05:06,678] Trial 313 finished with values: [-0.006588840478124247, 0.006630944316273931] and parameters: {'p_sma': 47, 'p_std': 45, 'p_atr': 20, 'p_adx': 24, 'rsi_period': 49, 'ema1': 10, 'ema2': 20, 'slip_atr_k': 0.2056834255396811, 'slip_spread_k': 0.04780652652590561, 'spread_hl_frac': 0.007756921761085955, 'bb_std_mult': 3.2474927684793595, 'rsi_os': 17, 'rsi_ob': 94, 'vol_spike': 0.13592443057219003, 'adx_thresh': 28.1891094326278, 'atr_min_pct': 0.0015270775061905356, 'atr_max_pct': 0.026083698979946578, 'tp_mult': 1.6280380932771312, 'tsl_mult': 0.3240089451279122, 'strategy': 'breakout', 'time_stop': 33, 'use_sma': False, 'use_atr': False, 'use_adx': False, 'use_ema': False, 'use_spike': False, 'rsi_required': True, 'edge_k': 1.9615079523149426, 'edge_cap': 0.9031440141268403}.
[I 2025-08-29 19:05:06,971] Trial 314 finished with values: [-0.0014216095719608024, 0.0021822113875548644] and parameters: {'p_sma': 38, 'p_std': 46, 'p_atr': 20, 'p_adx': 24, 'rsi_period': 49, 'ema1': 25, 'ema2': 28, 'slip_atr_k': 0.028939345520952516, 'slip_spread_k': 0.004780193842368281, 'spread_hl_frac': 0.009573293027958086, 'bb_std_mult': 1.908153004988546, 'rsi_os': 15, 'rsi_ob': 92, 'vol_spike': 0.25438711912891276, 'adx_thresh': 33.71831238728181, 'atr_min_pct': 0.0017321628020319387, 'atr_max_pct': 0.026205532179046108, 'tp_mult': 1.5984738067297792, 'tsl_mult': 0.3334794030709757, 'strategy': 'breakout', 'time_stop': 43, 'use_sma': False, 'use_atr': False, 'use_adx': False, 'use_ema': False, 'use_spike': False, 'rsi_required': True, 'edge_k': 0.9024538291331237, 'edge_cap': 0.6513052605684287}.
[I 2025-08-29 19:05:07,269] Trial 315 finished with values: [-1000000000.0, 1000000000.0] and parameters: {'p_sma': 25, 'p_std': 45, 'p_atr': 20, 'p_adx': 23, 'rsi_period': 49, 'ema1': 25, 'ema2': 28, 'slip_atr_k': 0.17632664960697292, 'slip_spread_k': 0.004394138051616644, 'spread_hl_frac': 0.025099253239406146, 'bb_std_mult': 3.4079392815202776, 'rsi_os': 30, 'rsi_ob': 92, 'vol_spike': 0.26297895077924643, 'adx_thresh': 15.450749956988037, 'atr_min_pct': 0.022090437632151648, 'atr_max_pct': 0.02452618822824556, 'tp_mult': 1.6359979634405981, 'tsl_mult': 0.33323605433110914, 'strategy': 'breakout', 'time_stop': 56, 'use_sma': False, 'use_atr': False, 'use_adx': False, 'use_ema': False, 'use_spike': False, 'rsi_required': True, 'edge_k': 0.8983555904799514, 'edge_cap': 0.9128333755452209}.
[I 2025-08-29 19:05:07,846] Trial 318 finished with values: [-1000000000.0, 1000000000.0] and parameters: {'p_sma': 35, 'p_std': 47, 'p_atr': 19, 'p_adx': 23, 'rsi_period': 47, 'ema1': 30, 'ema2': 28, 'slip_atr_k': 0.20571539565978358, 'slip_spread_k': 0.0005084928591147307, 'spread_hl_frac': 0.009762421816018463, 'bb_std_mult': 2.3619221399578763, 'rsi_os': 30, 'rsi_ob': 93, 'vol_spike': 0.059508827932945374, 'adx_thresh': 27.387572738135162, 'atr_min_pct': 0.021195378347796758, 'atr_max_pct': 0.02559663371896354, 'tp_mult': 1.8511016442067054, 'tsl_mult': 0.30682894142748945, 'strategy': 'breakout', 'time_stop': 76, 'use_sma': False, 'use_atr': False, 'use_adx': False, 'use_ema': False, 'use_spike': False, 'rsi_required': True, 'edge_k': 1.9459315771339771, 'edge_cap': 0.6403272674443526}.
[I 2025-08-29 19:05:08,019] Trial 322 finished with values: [-1000000000.0, 1000000000.0] and parameters: {'p_sma': 34, 'p_std': 48, 'p_atr': 19, 'p_adx': 22, 'rsi_period': 46, 'ema1': 7, 'ema2': 24, 'slip_atr_k': 0.03301279922391442, 'slip_spread_k': 0.02158689572240198, 'spread_hl_frac': 0.009602773824568504, 'bb_std_mult': 2.0455822714585636, 'rsi_os': 18, 'rsi_ob': 57, 'vol_spike': 0.11921872804372073, 'adx_thresh': 24.65303992003887, 'atr_min_pct': 0.023536153787866446, 'atr_max_pct': 0.010241524678115718, 'tp_mult': 1.9142902030269413, 'tsl_mult': 0.30807360696445113, 'strategy': 'breakout', 'time_stop': 47, 'use_sma': False, 'use_atr': False, 'use_adx': False, 'use_ema': False, 'use_spike': False, 'rsi_required': True, 'edge_k': 1.9969455703971215, 'edge_cap': 0.7090967119390936}.
[I 2025-08-29 19:05:34,948] Trial 319 finished with values: [-1000000000.0, 1000000000.0] and parameters: {'p_sma': 35, 'p_std': 51, 'p_atr': 19, 'p_adx': 23, 'rsi_period': 47, 'ema1': 7, 'ema2': 25, 'slip_atr_k': 0.02810751421931879, 'slip_spread_k': 0.0013168935031229933, 'spread_hl_frac': 0.02574526654631307, 'bb_std_mult': 1.9178413819121525, 'rsi_os': 55, 'rsi_ob': 93, 'vol_spike': 0.14339937192402225, 'adx_thresh': 27.510188727760184, 'atr_min_pct': 0.011471903879033303, 'atr_max_pct': 0.027308525718338434, 'tp_mult': 1.991763210760406, 'tsl_mult': 0.3326707274411995, 'strategy': 'breakout', 'time_stop': 43, 'use_sma': False, 'use_atr': False, 'use_adx': False, 'use_ema': False, 'use_spike': False, 'rsi_required': True, 'edge_k': 1.297958570916914, 'edge_cap': 0.968775709179115}.
[I 2025-08-29 19:05:35,313] Trial 321 finished with values: [-1000000000.0, 1000000000.0] and parameters: {'p_sma': 34, 'p_std': 51, 'p_atr': 19, 'p_adx': 23, 'rsi_period': 47, 'ema1': 7, 'ema2': 25, 'slip_atr_k': 0.24362274676985907, 'slip_spread_k': 0.018125210467532803, 'spread_hl_frac': 0.04543643404522427, 'bb_std_mult': 1.3101299006073797, 'rsi_os': 18, 'rsi_ob': 57, 'vol_spike': 0.04368209930981291, 'adx_thresh': 33.01825952881981, 'atr_min_pct': 0.0179978757075926, 'atr_max_pct': 0.03938340343773436, 'tp_mult': 1.797156821046887, 'tsl_mult': 0.30463523355721794, 'strategy': 'breakout', 'time_stop': 64, 'use_sma': False, 'use_atr': False, 'use_adx': False, 'use_ema': False, 'use_spike': False, 'rsi_required': True, 'edge_k': 1.9445718891282426, 'edge_cap': 0.8701173824006441}.
[I 2025-08-29 19:05:35,452] Trial 320 finished with values: [-1000000000.0, 1000000000.0] and parameters: {'p_sma': 35, 'p_std': 47, 'p_atr': 19, 'p_adx': 23, 'rsi_period': 46, 'ema1': 30, 'ema2': 25, 'slip_atr_k': 0.2344579080903058, 'slip_spread_k': 0.0013189296411054506, 'spread_hl_frac': 0.00966690881598143, 'bb_std_mult': 2.0709945717139613, 'rsi_os': 18, 'rsi_ob': 93, 'vol_spike': 0.26099161616887556, 'adx_thresh': 15.681298019728423, 'atr_min_pct': 0.022375119733193158, 'atr_max_pct': 0.030723575872673603, 'tp_mult': 1.8699231595438204, 'tsl_mult': 0.30366925561771524, 'strategy': 'breakout', 'time_stop': 56, 'use_sma': False, 'use_atr': False, 'use_adx': False, 'use_ema': False, 'use_spike': False, 'rsi_required': True, 'edge_k': 1.33077793056604, 'edge_cap': 0.8656813760416857}.
[I 2025-08-29 19:05:35,946] Trial 323 finished with values: [-1000000000.0, 1000000000.0] and parameters: {'p_sma': 49, 'p_std': 44, 'p_atr': 19, 'p_adx': 13, 'rsi_period': 46, 'ema1': 9, 'ema2': 25, 'slip_atr_k': 0.2359583322073988, 'slip_spread_k': 0.022226660202398576, 'spread_hl_frac': 0.022408217377986865, 'bb_std_mult': 1.249299583863671, 'rsi_os': 16, 'rsi_ob': 95, 'vol_spike': 0.09299382724207762, 'adx_thresh': 33.922898386181465, 'atr_min_pct': 0.027635826237231216, 'atr_max_pct': 0.040576231906685224, 'tp_mult': 2.0167110686334495, 'tsl_mult': 0.9160131666287642, 'strategy': 'breakout', 'time_stop': 62, 'use_sma': False, 'use_atr': False, 'use_adx': False, 'use_ema': True, 'use_spike': False, 'rsi_required': False, 'edge_k': 1.9410715491154507, 'edge_cap': 0.9763134357560026}.
