[I 2025-08-29 19:17:54,648] Trial 432 finished with values: [-1000000000.0, 1000000000.0] and parameters: {'p_sma': 37, 'p_std': 47, 'p_atr': 18, 'p_adx': 23, 'rsi_period': 26, 'ema1': 12, 'ema2': 41, 'slip_atr_k': 0.03956120722202751, 'slip_spread_k': 0.7178418971216775, 'spread_hl_frac': 0.009548413670618348, 'bb_std_mult': 1.1108044039015126, 'rsi_os': 35, 'rsi_ob': 95, 'vol_spike': 0.2881672112721111, 'adx_thresh': 32.51683720139815, 'atr_min_pct': 0.01728696756390087, 'atr_max_pct': 0.025167763841305583, 'tp_mult': 1.6818064890831275, 'tsl_mult': 0.6864033986594712, 'strategy': 'breakout', 'time_stop': 49, 'use_sma': False, 'use_atr': True, 'use_adx': False, 'use_ema': True, 'use_spike': False, 'rsi_required': True, 'edge_k': 1.1927913818119225, 'edge_cap': 0.8452808857748221}.
[I 2025-08-29 19:17:55,213] Trial 434 finished with values: [-1000000000.0, 1000000000.0] and parameters: {'p_sma': 10, 'p_std': 47, 'p_atr': 17, 'p_adx': 15, 'rsi_period': 40, 'ema1': 12, 'ema2': 21, 'slip_atr_k': 0.04148083570937894, 'slip_spread_k': 0.9674959589009564, 'spread_hl_frac': 0.009380164323141621, 'bb_std_mult': 2.733906412299846, 'rsi_os': 18, 'rsi_ob': 76, 'vol_spike': 0.08485824936691086, 'adx_thresh': 11.888286645192986, 'atr_min_pct': 0.004174826928447475, 'atr_max_pct': 0.025925979330084198, 'tp_mult': 1.6590794926992847, 'tsl_mult': 0.3256173872912928, 'strategy': 'breakout', 'time_stop': 199, 'use_sma': False, 'use_atr': True, 'use_adx': False, 'use_ema': True, 'use_spike': True, 'rsi_required': True, 'edge_k': 0.03238527116292389, 'edge_cap': 0.43626603245223783}.
[I 2025-08-29 19:17:55,245] Trial 435 finished with values: [-1000000000.0, 1000000000.0] and parameters: {'p_sma': 50, 'p_std': 47, 'p_atr': 17, 'p_adx': 10, 'rsi_period': 49, 'ema1': 30, 'ema2': 25, 'slip_atr_k': 0.23215967382394087, 'slip_spread_k': 0.7150476627644939, 'spread_hl_frac': 0.009334763191242879, 'bb_std_mult': 1.1192645215121086, 'rsi_os': 18, 'rsi_ob': 75, 'vol_spike': 0.08738610757677938, 'adx_thresh': 32.337674528943516, 'atr_min_pct': 0.006745373739631364, 'atr_max_pct': 0.02525527416716751, 'tp_mult': 1.688689425089929, 'tsl_mult': 0.3477423769879644, 'strategy': 'breakout', 'time_stop': 197, 'use_sma': False, 'use_atr': True, 'use_adx': False, 'use_ema': True, 'use_spike': True, 'rsi_required': False, 'edge_k': 1.997305827485061, 'edge_cap': 0.8491744762580841}.
[I 2025-08-29 19:17:55,446] Trial 433 finished with values: [-0.016745187636402425, 0.01680215134548309] and parameters: {'p_sma': 40, 'p_std': 47, 'p_atr': 17, 'p_adx': 23, 'rsi_period': 28, 'ema1': 9, 'ema2': 21, 'slip_atr_k': 0.23180500304969193, 'slip_spread_k': 0.0023238292005610525, 'spread_hl_frac': 0.009818839882300432, 'bb_std_mult': 3.068850094380424, 'rsi_os': 35, 'rsi_ob': 95, 'vol_spike': 0.09733916769170314, 'adx_thresh': 29.03818505154465, 'atr_min_pct': 0.004188259988983649, 'atr_max_pct': 0.026046992403974085, 'tp_mult': 1.6677228476922015, 'tsl_mult': 0.68926737699824, 'strategy': 'breakout', 'time_stop': 53, 'use_sma': False, 'use_atr': True, 'use_adx': False, 'use_ema': True, 'use_spike': True, 'rsi_required': True, 'edge_k': 0.5311888019491549, 'edge_cap': 0.48838100353384795}.
[I 2025-08-29 19:18:21,835] Trial 438 finished with values: [-1000000000.0, 1000000000.0] and parameters: {'p_sma': 40, 'p_std': 58, 'p_atr': 19, 'p_adx': 26, 'rsi_period': 46, 'ema1': 7, 'ema2': 31, 'slip_atr_k': 0.16825289640089486, 'slip_spread_k': 0.044919564638784694, 'spread_hl_frac': 0.006901672563455344, 'bb_std_mult': 2.0994472262289934, 'rsi_os': 19, 'rsi_ob': 64, 'vol_spike': 0.21018597092308294, 'adx_thresh': 33.89809514095177, 'atr_min_pct': 0.003489528442385042, 'atr_max_pct': 0.056017365555349447, 'tp_mult': 2.0325028220650605, 'tsl_mult': 0.2990985862716879, 'strategy': 'breakout', 'time_stop': 279, 'use_sma': False, 'use_atr': False, 'use_adx': False, 'use_ema': False, 'use_spike': False, 'rsi_required': True, 'edge_k': 1.8677040446340614, 'edge_cap': 0.4912671018477001}.
[I 2025-08-29 19:18:22,105] Trial 439 finished with values: [-0.0025353773566978433, 0.0031568929728128517] and parameters: {'p_sma': 46, 'p_std': 43, 'p_atr': 18, 'p_adx': 25, 'rsi_period': 46, 'ema1': 24, 'ema2': 29, 'slip_atr_k': 0.09694702249528185, 'slip_spread_k': 0.4447050557219624, 'spread_hl_frac': 0.006978416329458513, 'bb_std_mult': 2.1059737926110413, 'rsi_os': 20, 'rsi_ob': 79, 'vol_spike': 0.13656883824281504, 'adx_thresh': 33.79730174104812, 'atr_min_pct': 0.0017437016363723798, 'atr_max_pct': 0.030116620374337755, 'tp_mult': 2.0248845639938895, 'tsl_mult': 0.8435329443062369, 'strategy': 'breakout', 'time_stop': 279, 'use_sma': True, 'use_atr': False, 'use_adx': False, 'use_ema': False, 'use_spike': False, 'rsi_required': False, 'edge_k': 1.9991615766218658, 'edge_cap': 0.3731709558465821}.
[I 2025-08-29 19:18:22,716] Trial 437 finished with values: [-1000000000.0, 1000000000.0] and parameters: {'p_sma': 46, 'p_std': 45, 'p_atr': 9, 'p_adx': 8, 'rsi_period': 49, 'ema1': 7, 'ema2': 31, 'slip_atr_k': 0.20862313071454142, 'slip_spread_k': 0.00106159089162591, 'spread_hl_frac': 0.007132460563161726, 'bb_std_mult': 1.3502202004950743, 'rsi_os': 19, 'rsi_ob': 79, 'vol_spike': 0.2121447316943521, 'adx_thresh': 25.650067984557367, 'atr_min_pct': 0.006865644043201318, 'atr_max_pct': 0.11377307107834694, 'tp_mult': 2.203336687745236, 'tsl_mult': 0.7150788675282085, 'strategy': 'breakout', 'time_stop': 73, 'use_sma': False, 'use_atr': False, 'use_adx': False, 'use_ema': False, 'use_spike': True, 'rsi_required': False, 'edge_k': 0.931626126696727, 'edge_cap': 0.5795127395817081}.
[I 2025-08-29 19:18:22,782] Trial 436 finished with values: [-0.0018960164472758834, 0.003073547477458791] and parameters: {'p_sma': 46, 'p_std': 45, 'p_atr': 11, 'p_adx': 23, 'rsi_period': 49, 'ema1': 24, 'ema2': 25, 'slip_atr_k': 0.022525908355396446, 'slip_spread_k': 0.04692528636725706, 'spread_hl_frac': 0.007120490018743203, 'bb_std_mult': 2.2291889166730083, 'rsi_os': 18, 'rsi_ob': 82, 'vol_spike': 0.20680703202735035, 'adx_thresh': 33.881505348145815, 'atr_min_pct': 0.0015149687068751535, 'atr_max_pct': 0.028280442820183216, 'tp_mult': 2.043506080965993, 'tsl_mult': 0.8365592699812392, 'strategy': 'breakout', 'time_stop': 58, 'use_sma': False, 'use_atr': True, 'use_adx': False, 'use_ema': False, 'use_spike': True, 'rsi_required': False, 'edge_k': 0.9293588808910198, 'edge_cap': 0.6531895826394529}.
[I 2025-08-29 19:18:48,830] Trial 441 finished with values: [-1000000000.0, 0.10934072744167997] and parameters: {'p_sma': 54, 'p_std': 21, 'p_atr': 26, 'p_adx': 16, 'rsi_period': 50, 'ema1': 8, 'ema2': 19, 'slip_atr_k': 0.20899100219155445, 'slip_spread_k': 0.3613489463715933, 'spread_hl_frac': 0.008191163187684501, 'bb_std_mult': 2.4273223319685826, 'rsi_os': 45, 'rsi_ob': 82, 'vol_spike': 0.12867593523843138, 'adx_thresh': 27.817971392646008, 'atr_min_pct': 0.0011779489103644347, 'atr_max_pct': 0.03816145395129145, 'tp_mult': 2.196642323526459, 'tsl_mult': 0.32110783747398786, 'strategy': 'breakout', 'time_stop': 38, 'use_sma': False, 'use_atr': False, 'use_adx': False, 'use_ema': False, 'use_spike': False, 'rsi_required': True, 'edge_k': 1.9997150487166222, 'edge_cap': 0.5759007501289038}.
[I 2025-08-29 19:18:49,010] Trial 442 finished with values: [-0.04203454717332611, 0.042082354023436463] and parameters: {'p_sma': 48, 'p_std': 45, 'p_atr': 11, 'p_adx': 14, 'rsi_period': 50, 'ema1': 8, 'ema2': 19, 'slip_atr_k': 0.1997843671976299, 'slip_spread_k': 0.025709209282454532, 'spread_hl_frac': 0.00827969914118158, 'bb_std_mult': 1.184077708024378, 'rsi_os': 53, 'rsi_ob': 54, 'vol_spike': 0.2556144718399885, 'adx_thresh': 33.27421805458381, 'atr_min_pct': 0.003376384234857857, 'atr_max_pct': 0.03324396425126045, 'tp_mult': 1.5588392321262559, 'tsl_mult': 0.3202881426422232, 'strategy': 'breakout', 'time_stop': 288, 'use_sma': False, 'use_atr': False, 'use_adx': False, 'use_ema': False, 'use_spike': False, 'rsi_required': True, 'edge_k': 1.9307746379418351, 'edge_cap': 0.6449181983827039}.
[I 2025-08-29 19:18:49,135] Trial 440 finished with values: [-1000000000.0, 1000000000.0] and parameters: {'p_sma': 54, 'p_std': 45, 'p_atr': 11, 'p_adx': 14, 'rsi_period': 49, 'ema1': 8, 'ema2': 19, 'slip_atr_k': 0.022983755413629847, 'slip_spread_k': 0.02254805947318351, 'spread_hl_frac': 0.00782935513040919, 'bb_std_mult': 2.2389186299024537, 'rsi_os': 17, 'rsi_ob': 80, 'vol_spike': 0.13618641967673467, 'adx_thresh': 33.035572613821714, 'atr_min_pct': 0.012948858715707327, 'atr_max_pct': 0.03321204041339297, 'tp_mult': 2.202825829918843, 'tsl_mult': 0.7144602858901186, 'strategy': 'breakout', 'time_stop': 289, 'use_sma': True, 'use_atr': False, 'use_adx': False, 'use_ema': False, 'use_spike': False, 'rsi_required': False, 'edge_k': 1.99911014854692, 'edge_cap': 0.5767946179111526}.
[I 2025-08-29 19:18:49,246] Trial 443 finished with values: [-1000000000.0, 1000000000.0] and parameters: {'p_sma': 32, 'p_std': 48, 'p_atr': 18, 'p_adx': 22, 'rsi_period': 44, 'ema1': 8, 'ema2': 19, 'slip_atr_k': 0.036079308260197104, 'slip_spread_k': 0.08600837081960588, 'spread_hl_frac': 0.008282512660660147, 'bb_std_mult': 2.956525447771635, 'rsi_os': 16, 'rsi_ob': 92, 'vol_spike': 0.25650739008263257, 'adx_thresh': 18.114000870142075, 'atr_min_pct': 0.028279047362044934, 'atr_max_pct': 0.032195209412686755, 'tp_mult': 1.5529264205562234, 'tsl_mult': 0.3203855256493955, 'strategy': 'breakout', 'time_stop': 61, 'use_sma': True, 'use_atr': False, 'use_adx': False, 'use_ema': False, 'use_spike': False, 'rsi_required': True, 'edge_k': 0.0022421551441280663, 'edge_cap': 0.7129350230458439}.
[I 2025-08-29 19:19:15,370] Trial 447 finished with values: [-0.009786201171041453, 0.00977180164547125] and parameters: {'p_sma': 38, 'p_std': 16, 'p_atr': 19, 'p_adx': 24, 'rsi_period': 31, 'ema1': 21, 'ema2': 26, 'slip_atr_k': 0.029436020073212034, 'slip_spread_k': 0.5566822771150802, 'spread_hl_frac': 0.02252970738213913, 'bb_std_mult': 1.2998530211529524, 'rsi_os': 12, 'rsi_ob': 93, 'vol_spike': 0.1418454737114675, 'adx_thresh': 34.36067439985837, 'atr_min_pct': 0.0022978566693666446, 'atr_max_pct': 0.08182584399300746, 'tp_mult': 2.7869932759256733, 'tsl_mult': 0.34981370383863, 'strategy': 'mean_reversion', 'time_stop': 42, 'use_sma': False, 'use_atr': False, 'use_adx': False, 'use_ema': False, 'use_spike': False, 'rsi_required': True, 'edge_k': 1.527305813573606, 'edge_cap': 0.7479539481497024}.
[I 2025-08-29 19:19:15,893] Trial 446 finished with values: [-0.004444065464546676, 0.004425686267874312] and parameters: {'p_sma': 33, 'p_std': 48, 'p_atr': 19, 'p_adx': 22, 'rsi_period': 44, 'ema1': 14, 'ema2': 50, 'slip_atr_k': 0.035450547366653706, 'slip_spread_k': 0.390857549396733, 'spread_hl_frac': 0.010263502474101804, 'bb_std_mult': 0.8408150257143501, 'rsi_os': 16, 'rsi_ob': 92, 'vol_spike': 0.05903879726287263, 'adx_thresh': 20.930540638496137, 'atr_min_pct': 0.0026449309158861267, 'atr_max_pct': 0.0206501159855488, 'tp_mult': 2.342688773893948, 'tsl_mult': 0.34797153743788634, 'strategy': 'mean_reversion', 'time_stop': 63, 'use_sma': True, 'use_atr': False, 'use_adx': False, 'use_ema': False, 'use_spike': False, 'rsi_required': True, 'edge_k': 1.9400026028015733, 'edge_cap': 0.7449970113253882}.
[I 2025-08-29 19:19:16,107] Trial 445 finished with values: [-1000000000.0, 1000000000.0] and parameters: {'p_sma': 23, 'p_std': 48, 'p_atr': 19, 'p_adx': 22, 'rsi_period': 38, 'ema1': 13, 'ema2': 23, 'slip_atr_k': 0.03260565805677967, 'slip_spread_k': 0.01978940985260685, 'spread_hl_frac': 0.04734072287491015, 'bb_std_mult': 2.9685669674069155, 'rsi_os': 17, 'rsi_ob': 92, 'vol_spike': 0.2765883189233542, 'adx_thresh': 34.42082906094643, 'atr_min_pct': 0.028258582242940738, 'atr_max_pct': 0.03168105962674334, 'tp_mult': 2.789254504084144, 'tsl_mult': 0.021053656072166194, 'strategy': 'breakout', 'time_stop': 63, 'use_sma': True, 'use_atr': False, 'use_adx': False, 'use_ema': False, 'use_spike': False, 'rsi_required': True, 'edge_k': 1.948695994201917, 'edge_cap': 0.7250099619929152}.
[I 2025-08-29 19:19:16,335] Trial 444 finished with values: [-1000000000.0, 1000000000.0] and parameters: {'p_sma': 38, 'p_std': 32, 'p_atr': 19, 'p_adx': 22, 'rsi_period': 37, 'ema1': 8, 'ema2': 23, 'slip_atr_k': 0.034826855460983755, 'slip_spread_k': 0.5490538960063871, 'spread_hl_frac': 0.023295448488596514, 'bb_std_mult': 3.3583298492769975, 'rsi_os': 17, 'rsi_ob': 92, 'vol_spike': 0.2794531672385059, 'adx_thresh': 33.29068701969028, 'atr_min_pct': 0.023788051908128188, 'atr_max_pct': 0.0325059502076721, 'tp_mult': 1.9434813131961841, 'tsl_mult': 0.3958804366496813, 'strategy': 'breakout', 'time_stop': 16, 'use_sma': True, 'use_atr': False, 'use_adx': False, 'use_ema': False, 'use_spike': False, 'rsi_required': True, 'edge_k': 1.9352155389930337, 'edge_cap': 0.7516596755372525}.
[I 2025-08-29 19:19:43,012] Trial 448 finished with values: [-1000000000.0, 1000000000.0] and parameters: {'p_sma': 34, 'p_std': 41, 'p_atr': 19, 'p_adx': 22, 'rsi_period': 38, 'ema1': 14, 'ema2': 22, 'slip_atr_k': 0.03421658619654255, 'slip_spread_k': 0.01651190672887606, 'spread_hl_frac': 0.010122916463246426, 'bb_std_mult': 0.580825323641692, 'rsi_os': 15, 'rsi_ob': 60, 'vol_spike': 0.23636427667518362, 'adx_thresh': 34.373986879295146, 'atr_min_pct': 0.00983483082866594, 'atr_max_pct': 0.02072068286253329, 'tp_mult': 2.3436906860532525, 'tsl_mult': 0.8132843017016294, 'strategy': 'breakout', 'time_stop': 55, 'use_sma': False, 'use_atr': False, 'use_adx': False, 'use_ema': False, 'use_spike': False, 'rsi_required': True, 'edge_k': 1.9521285506444297, 'edge_cap': 0.45089663455753487}.
[I 2025-08-29 19:19:43,448] Trial 451 finished with values: [-1000000000.0, 1000000000.0] and parameters: {'p_sma': 44, 'p_std': 43, 'p_atr': 30, 'p_adx': 23, 'rsi_period': 47, 'ema1': 18, 'ema2': 46, 'slip_atr_k': 0.027900888972130455, 'slip_spread_k': 0.03533726899195068, 'spread_hl_frac': 0.04591653943366851, 'bb_std_mult': 1.7721139298669202, 'rsi_os': 15, 'rsi_ob': 60, 'vol_spike': 0.11994107718374591, 'adx_thresh': 14.033542354269251, 'atr_min_pct': 0.021891611060118717, 'atr_max_pct': 0.02866854655679525, 'tp_mult': 2.084108399244398, 'tsl_mult': 0.29037105958975185, 'strategy': 'breakout', 'time_stop': 55, 'use_sma': False, 'use_atr': True, 'use_adx': False, 'use_ema': True, 'use_spike': False, 'rsi_required': True, 'edge_k': 1.8821989636286618, 'edge_cap': 0.5372041299295093}.
[I 2025-08-29 19:19:44,042] Trial 450 finished with values: [-1000000000.0, 1000000000.0] and parameters: {'p_sma': 34, 'p_std': 27, 'p_atr': 25, 'p_adx': 23, 'rsi_period': 47, 'ema1': 18, 'ema2': 16, 'slip_atr_k': 0.062131313153838116, 'slip_spread_k': 0.7998924659405714, 'spread_hl_frac': 0.03321001140705897, 'bb_std_mult': 0.5987376616401809, 'rsi_os': 9, 'rsi_ob': 94, 'vol_spike': 0.11863048838599997, 'adx_thresh': 9.013860931298685, 'atr_min_pct': 0.01000474660208377, 'atr_max_pct': 0.028541312686666893, 'tp_mult': 2.4341189318419927, 'tsl_mult': 0.2750833808360476, 'strategy': 'breakout', 'time_stop': 53, 'use_sma': False, 'use_atr': False, 'use_adx': False, 'use_ema': True, 'use_spike': False, 'rsi_required': True, 'edge_k': 1.9006836732166996, 'edge_cap': 0.5475530913108793}.
[I 2025-08-29 19:19:44,045] Trial 449 finished with values: [-0.004117786018747238, 0.0043632430922106126] and parameters: {'p_sma': 36, 'p_std': 44, 'p_atr': 25, 'p_adx': 23, 'rsi_period': 47, 'ema1': 11, 'ema2': 22, 'slip_atr_k': 0.060371447100663986, 'slip_spread_k': 0.8096387965766056, 'spread_hl_frac': 0.03079273447150193, 'bb_std_mult': 1.3919895449083128, 'rsi_os': 17, 'rsi_ob': 94, 'vol_spike': 0.11782881824581272, 'adx_thresh': 6.163938701359562, 'atr_min_pct': 0.0030993092951866787, 'atr_max_pct': 0.029162489954744682, 'tp_mult': 2.3842015112839805, 'tsl_mult': 0.2815992590825374, 'strategy': 'breakout', 'time_stop': 21, 'use_sma': False, 'use_atr': False, 'use_adx': False, 'use_ema': True, 'use_spike': False, 'rsi_required': True, 'edge_k': 1.9478171231911068, 'edge_cap': 0.6269439348546735}.
[I 2025-08-29 19:20:10,975] Trial 455 finished with values: [-1000000000.0, 1000000000.0] and parameters: {'p_sma': 14, 'p_std': 46, 'p_atr': 20, 'p_adx': 7, 'rsi_period': 9, 'ema1': 20, 'ema2': 27, 'slip_atr_k': 0.016985150904440662, 'slip_spread_k': 0.0008364757911601868, 'spread_hl_frac': 0.020566832942072268, 'bb_std_mult': 1.2374508794618324, 'rsi_os': 41, 'rsi_ob': 71, 'vol_spike': 0.13358951375303268, 'adx_thresh': 33.72975673511341, 'atr_min_pct': 0.016408474340654844, 'atr_max_pct': 0.1388236305489847, 'tp_mult': 1.8807643602262487, 'tsl_mult': 0.30596191273270856, 'strategy': 'mean_reversion', 'time_stop': 241, 'use_sma': False, 'use_atr': True, 'use_adx': False, 'use_ema': False, 'use_spike': True, 'rsi_required': False, 'edge_k': 0.4294080411882061, 'edge_cap': 0.3889264280771906}.
[I 2025-08-29 19:20:11,865] Trial 454 finished with values: [-1000000000.0, 1000000000.0] and parameters: {'p_sma': 41, 'p_std': 46, 'p_atr': 20, 'p_adx': 28, 'rsi_period': 51, 'ema1': 10, 'ema2': 27, 'slip_atr_k': 0.13417193858894935, 'slip_spread_k': 0.0017513047551123127, 'spread_hl_frac': 0.020751279413589188, 'bb_std_mult': 1.5185812165509418, 'rsi_os': 20, 'rsi_ob': 93, 'vol_spike': 0.1096635692083113, 'adx_thresh': 34.9741009322313, 'atr_min_pct': 0.008274927167607353, 'atr_max_pct': 0.07727092554893296, 'tp_mult': 1.180833527138113, 'tsl_mult': 0.15751894691137241, 'strategy': 'mean_reversion', 'time_stop': 104, 'use_sma': False, 'use_atr': True, 'use_adx': False, 'use_ema': False, 'use_spike': True, 'rsi_required': False, 'edge_k': 1.9628889035353045, 'edge_cap': 0.9294761512160375}.
[I 2025-08-29 19:20:12,149] Trial 452 finished with values: [-1000000000.0, 1000000000.0] and parameters: {'p_sma': 18, 'p_std': 44, 'p_atr': 20, 'p_adx': 28, 'rsi_period': 47, 'ema1': 20, 'ema2': 34, 'slip_atr_k': 0.06160380567392566, 'slip_spread_k': 0.0014550378022629574, 'spread_hl_frac': 0.02858956511350828, 'bb_std_mult': 1.3993758133337706, 'rsi_os': 20, 'rsi_ob': 94, 'vol_spike': 0.13148215320826057, 'adx_thresh': 33.89078514015773, 'atr_min_pct': 0.0036929681260953477, 'atr_max_pct': 0.028723494621090483, 'tp_mult': 2.8902233452761017, 'tsl_mult': 0.2805115761233846, 'strategy': 'breakout', 'time_stop': 43, 'use_sma': False, 'use_atr': True, 'use_adx': False, 'use_ema': True, 'use_spike': True, 'rsi_required': True, 'edge_k': 1.9065498402555832, 'edge_cap': 0.929742211318468}.
[I 2025-08-29 19:20:12,243] Trial 453 finished with values: [-0.012688706094598046, 0.012652091853221973] and parameters: {'p_sma': 49, 'p_std': 46, 'p_atr': 20, 'p_adx': 24, 'rsi_period': 20, 'ema1': 10, 'ema2': 43, 'slip_atr_k': 0.08958318812800528, 'slip_spread_k': 0.0017045746056564897, 'spread_hl_frac': 0.030214861149254722, 'bb_std_mult': 1.4219505270525448, 'rsi_os': 29, 'rsi_ob': 89, 'vol_spike': 0.22688653178003867, 'adx_thresh': 33.784636883146966, 'atr_min_pct': 0.0030972172860933697, 'atr_max_pct': 0.09912913765241274, 'tp_mult': 2.4389323538563534, 'tsl_mult': 0.28261531722301547, 'strategy': 'breakout', 'time_stop': 297, 'use_sma': False, 'use_atr': False, 'use_adx': False, 'use_ema': True, 'use_spike': True, 'rsi_required': True, 'edge_k': 1.2942972606531191, 'edge_cap': 0.32654043899812385}.
[I 2025-08-29 19:20:39,452] Trial 459 finished with values: [-1000000000.0, 1000000000.0] and parameters: {'p_sma': 29, 'p_std': 50, 'p_atr': 18, 'p_adx': 12, 'rsi_period': 48, 'ema1': 9, 'ema2': 29, 'slip_atr_k': 0.050231194723390646, 'slip_spread_k': 0.7637597286508397, 'spread_hl_frac': 0.026547478982525644, 'bb_std_mult': 1.2914934584837299, 'rsi_os': 18, 'rsi_ob': 66, 'vol_spike': 0.02776654227191795, 'adx_thresh': 22.64239401172344, 'atr_min_pct': 0.01985311729342696, 'atr_max_pct': 0.02331596842268128, 'tp_mult': 1.4828743503199524, 'tsl_mult': 0.11330016915467489, 'strategy': 'breakout', 'time_stop': 33, 'use_sma': False, 'use_atr': False, 'use_adx': False, 'use_ema': False, 'use_spike': False, 'rsi_required': True, 'edge_k': 1.1046158196722797, 'edge_cap': 0.8912632861080017}.
[I 2025-08-29 19:20:39,452] Trial 457 finished with values: [-0.003775017113573975, 0.003971400759585986] and parameters: {'p_sma': 49, 'p_std': 47, 'p_atr': 18, 'p_adx': 12, 'rsi_period': 42, 'ema1': 9, 'ema2': 34, 'slip_atr_k': 0.21639363980643583, 'slip_spread_k': 0.052479993685186674, 'spread_hl_frac': 0.026570196762246586, 'bb_std_mult': 1.1934501348310589, 'rsi_os': 19, 'rsi_ob': 89, 'vol_spike': 0.02759645096086956, 'adx_thresh': 27.04147530865119, 'atr_min_pct': 0.003889015507425827, 'atr_max_pct': 0.046872942512425, 'tp_mult': 1.057777386293416, 'tsl_mult': 0.36168614139102007, 'strategy': 'breakout', 'time_stop': 43, 'use_sma': False, 'use_atr': False, 'use_adx': False, 'use_ema': False, 'use_spike': False, 'rsi_required': True, 'edge_k': 1.0969584456389785, 'edge_cap': 0.9540431573341377}.
[I 2025-08-29 19:20:39,535] Trial 458 finished with values: [0.00019136888429804877, 0.0011902872586591535] and parameters: {'p_sma': 49, 'p_std': 49, 'p_atr': 18, 'p_adx': 24, 'rsi_period': 42, 'ema1': 9, 'ema2': 29, 'slip_atr_k': 0.02308798680412917, 'slip_spread_k': 0.05332550116738692, 'spread_hl_frac': 0.008864807897484525, 'bb_std_mult': 1.3178275335664067, 'rsi_os': 19, 'rsi_ob': 66, 'vol_spike': 0.14137551836064344, 'adx_thresh': 22.541000012235383, 'atr_min_pct': 0.004289260756922039, 'atr_max_pct': 0.023353259152891482, 'tp_mult': 2.131774792835871, 'tsl_mult': 0.3386085979682772, 'strategy': 'breakout', 'time_stop': 38, 'use_sma': False, 'use_atr': False, 'use_adx': False, 'use_ema': False, 'use_spike': False, 'rsi_required': True, 'edge_k': 1.119239844576218, 'edge_cap': 0.8030342421814163}.
