2025-08-29 18:29:03,447 WARNING: DATA SANITY: Extreme jumps >20*ATR200: 42
[I 2025-08-29 18:29:03,458] A new study created in memory with name: no-name-496bd27f-722d-4a62-8aa0-1769b4472c58
[I 2025-08-29 18:29:33,445] Trial 1 finished with values: [-1000000000.0, 1000000000.0] and parameters: {'p_sma': 37, 'p_std': 34, 'p_atr': 29, 'p_adx': 9, 'rsi_period': 80, 'ema1': 19, 'ema2': 16, 'slip_atr_k': 0.05282785165067869, 'slip_spread_k': 0.5034041039355558, 'spread_hl_frac': 0.008458527866210664, 'bb_std_mult': 2.6726467631467106, 'rsi_os': 39, 'rsi_ob': 65, 'vol_spike': 0.238723201652316, 'adx_thresh': 23.644650112088588, 'atr_min_pct': 0.01731514538173455, 'atr_max_pct': 0.09974461238655548, 'tp_mult': 1.5385640656667012, 'tsl_mult': 0.8716561496187144, 'strategy': 'breakout', 'time_stop': 169, 'use_sma': False, 'use_atr': True, 'use_adx': False, 'use_ema': True, 'use_spike': False, 'rsi_required': False, 'edge_k': 1.8604599630092522, 'edge_cap': 0.9544884704934028}.
[I 2025-08-29 18:29:33,643] Trial 2 finished with values: [-1000000000.0, 1000000000.0] and parameters: {'p_sma': 12, 'p_std': 20, 'p_atr': 10, 'p_adx': 14, 'rsi_period': 82, 'ema1': 10, 'ema2': 23, 'slip_atr_k': 0.1599599278732056, 'slip_spread_k': 0.6189436991854317, 'spread_hl_frac': 0.027923911837682187, 'bb_std_mult': 1.7306259021137935, 'rsi_os': 44, 'rsi_ob': 79, 'vol_spike': 0.1704573137969201, 'adx_thresh': 34.26485177020535, 'atr_min_pct': 0.016370761005545718, 'atr_max_pct': 0.11070754574213539, 'tp_mult': 1.778635211929069, 'tsl_mult': 0.07760317171992981, 'strategy': 'mean_reversion', 'time_stop': 48, 'use_sma': False, 'use_atr': False, 'use_adx': False, 'use_ema': False, 'use_spike': True, 'rsi_required': False, 'edge_k': 0.569738810498065, 'edge_cap': 0.06493979899515763}.
[I 2025-08-29 18:29:33,652] Trial 4 finished with values: [-1000000000.0, 1000000000.0] and parameters: {'p_sma': 38, 'p_std': 18, 'p_atr': 12, 'p_adx': 29, 'rsi_period': 13, 'ema1': 21, 'ema2': 17, 'slip_atr_k': 0.08440608767680247, 'slip_spread_k': 0.4981672918521275, 'spread_hl_frac': 0.04782505513819489, 'bb_std_mult': 1.066172923198313, 'rsi_os': 55, 'rsi_ob': 80, 'vol_spike': 0.16748479097541516, 'adx_thresh': 23.363504009354617, 'atr_min_pct': 0.013118439572495416, 'atr_max_pct': 0.07108174676984412, 'tp_mult': 2.017250245445528, 'tsl_mult': 0.34140043257495223, 'strategy': 'mean_reversion', 'time_stop': 181, 'use_sma': False, 'use_atr': False, 'use_adx': True, 'use_ema': False, 'use_spike': True, 'rsi_required': True, 'edge_k': 1.5070881378121455, 'edge_cap': 0.7587835995309876}.
[I 2025-08-29 18:29:33,851] Trial 0 finished with values: [-1000000000.0, 1000000000.0] and parameters: {'p_sma': 30, 'p_std': 43, 'p_atr': 26, 'p_adx': 29, 'rsi_period': 83, 'ema1': 30, 'ema2': 50, 'slip_atr_k': 0.21832252941354718, 'slip_spread_k': 0.009631363851249186, 'spread_hl_frac': 0.01878032760813741, 'bb_std_mult': 3.0060811161787244, 'rsi_os': 15, 'rsi_ob': 51, 'vol_spike': 0.24507399952397085, 'adx_thresh': 16.651129550675673, 'atr_min_pct': 0.012462002950237527, 'atr_max_pct': 0.03317281101223438, 'tp_mult': 1.9907039605398784, 'tsl_mult': 0.14004417204092678, 'strategy': 'breakout', 'time_stop': 145, 'use_sma': True, 'use_atr': False, 'use_adx': True, 'use_ema': False, 'use_spike': True, 'rsi_required': True, 'edge_k': 0.660689237808612, 'edge_cap': 0.3305960759729235}.
[I 2025-08-29 18:29:34,125] Trial 3 finished with values: [-1000000000.0, 1000000000.0] and parameters: {'p_sma': 24, 'p_std': 25, 'p_atr': 14, 'p_adx': 28, 'rsi_period': 18, 'ema1': 27, 'ema2': 58, 'slip_atr_k': 0.1205618959978817, 'slip_spread_k': 0.28104164529529463, 'spread_hl_frac': 0.031493858728122784, 'bb_std_mult': 2.9963092546389296, 'rsi_os': 36, 'rsi_ob': 66, 'vol_spike': 0.17997259239384805, 'adx_thresh': 29.65054088625243, 'atr_min_pct': 0.017890391742972894, 'atr_max_pct': 0.1041296600839009, 'tp_mult': 2.1191724779691943, 'tsl_mult': 0.8504058853395908, 'strategy': 'breakout', 'time_stop': 250, 'use_sma': True, 'use_atr': True, 'use_adx': True, 'use_ema': True, 'use_spike': True, 'rsi_required': True, 'edge_k': 0.3202775340632602, 'edge_cap': 0.49403722596541755}.
[I 2025-08-29 18:30:02,217] Trial 6 finished with values: [-1000000000.0, 1000000000.0] and parameters: {'p_sma': 20, 'p_std': 53, 'p_atr': 25, 'p_adx': 20, 'rsi_period': 68, 'ema1': 7, 'ema2': 49, 'slip_atr_k': 0.21715127349143643, 'slip_spread_k': 0.6870762379245361, 'spread_hl_frac': 0.01903183290325705, 'bb_std_mult': 0.6772035434833492, 'rsi_os': 42, 'rsi_ob': 65, 'vol_spike': 0.283459077148935, 'adx_thresh': 34.6579150901843, 'atr_min_pct': 0.028992773843968454, 'atr_max_pct': 0.14003468048536213, 'tp_mult': 2.02603977045576, 'tsl_mult': 0.30455762877620884, 'strategy': 'breakout', 'time_stop': 185, 'use_sma': False, 'use_atr': True, 'use_adx': False, 'use_ema': True, 'use_spike': False, 'rsi_required': False, 'edge_k': 1.0856249515789607, 'edge_cap': 0.38396414049482397}.
[I 2025-08-29 18:30:02,242] Trial 5 finished with values: [-1000000000.0, 0.12168800788008828] and parameters: {'p_sma': 55, 'p_std': 8, 'p_atr': 26, 'p_adx': 9, 'rsi_period': 7, 'ema1': 20, 'ema2': 55, 'slip_atr_k': 0.24394219790872904, 'slip_spread_k': 0.3192397016128351, 'spread_hl_frac': 0.01778669247820195, 'bb_std_mult': 1.3193738165059137, 'rsi_os': 41, 'rsi_ob': 85, 'vol_spike': 0.2991255105200223, 'adx_thresh': 9.499217091108427, 'atr_min_pct': 0.0016118057160737752, 'atr_max_pct': 0.07894538828783818, 'tp_mult': 2.7858173964099477, 'tsl_mult': 0.47598831060862146, 'strategy': 'breakout', 'time_stop': 188, 'use_sma': False, 'use_atr': True, 'use_adx': True, 'use_ema': False, 'use_spike': False, 'rsi_required': True, 'edge_k': 1.2077600066328782, 'edge_cap': 0.9814064161560541}.
[I 2025-08-29 18:30:02,245] Trial 9 finished with values: [-1000000000.0, 1000000000.0] and parameters: {'p_sma': 54, 'p_std': 29, 'p_atr': 10, 'p_adx': 24, 'rsi_period': 31, 'ema1': 7, 'ema2': 35, 'slip_atr_k': 0.015514984389097403, 'slip_spread_k': 0.8118525654238086, 'spread_hl_frac': 0.00921984987868953, 'bb_std_mult': 2.7867265884662724, 'rsi_os': 52, 'rsi_ob': 88, 'vol_spike': 0.16557141239298687, 'adx_thresh': 10.650996908509876, 'atr_min_pct': 0.015130321823790295, 'atr_max_pct': 0.04334676362790871, 'tp_mult': 1.7333974992749945, 'tsl_mult': 0.23820198015560712, 'strategy': 'mean_reversion', 'time_stop': 35, 'use_sma': True, 'use_atr': False, 'use_adx': False, 'use_ema': True, 'use_spike': False, 'rsi_required': True, 'edge_k': 0.5232334129655216, 'edge_cap': 0.24732140084188073}.
[I 2025-08-29 18:30:02,308] Trial 11 finished with values: [-1000000000.0, 1000000000.0] and parameters: {'p_sma': 13, 'p_std': 38, 'p_atr': 10, 'p_adx': 30, 'rsi_period': 14, 'ema1': 15, 'ema2': 52, 'slip_atr_k': 0.18518437661600404, 'slip_spread_k': 0.3263477327352722, 'spread_hl_frac': 0.0031078321097050225, 'bb_std_mult': 1.3994087115833596, 'rsi_os': 51, 'rsi_ob': 75, 'vol_spike': 0.2146350733645852, 'adx_thresh': 13.79570456539134, 'atr_min_pct': 0.015723144240802872, 'atr_max_pct': 0.05871006807476155, 'tp_mult': 2.4268324916454658, 'tsl_mult': 0.7859090984585935, 'strategy': 'mean_reversion', 'time_stop': 147, 'use_sma': True, 'use_atr': True, 'use_adx': False, 'use_ema': False, 'use_spike': True, 'rsi_required': True, 'edge_k': 0.3152123471737802, 'edge_cap': 0.4016657625762154}.
[I 2025-08-29 18:30:02,815] Trial 7 finished with values: [-1000000000.0, 1000000000.0] and parameters: {'p_sma': 59, 'p_std': 20, 'p_atr': 8, 'p_adx': 23, 'rsi_period': 7, 'ema1': 22, 'ema2': 20, 'slip_atr_k': 0.12879197825410837, 'slip_spread_k': 0.41961042326095277, 'spread_hl_frac': 0.013637476374265756, 'bb_std_mult': 3.572190401192019, 'rsi_os': 55, 'rsi_ob': 68, 'vol_spike': 0.16619034705523322, 'adx_thresh': 9.169572783678058, 'atr_min_pct': 0.01762386710789826, 'atr_max_pct': 0.05357948468453221, 'tp_mult': 2.4532708172954654, 'tsl_mult': 0.8359248626743383, 'strategy': 'breakout', 'time_stop': 292, 'use_sma': True, 'use_atr': False, 'use_adx': False, 'use_ema': True, 'use_spike': False, 'rsi_required': True, 'edge_k': 1.4417413056325552, 'edge_cap': 0.7893941865955905}.
[I 2025-08-29 18:30:02,932] Trial 8 finished with values: [-1000000000.0, 1000000000.0] and parameters: {'p_sma': 34, 'p_std': 27, 'p_atr': 29, 'p_adx': 12, 'rsi_period': 80, 'ema1': 18, 'ema2': 36, 'slip_atr_k': 0.17908629316707322, 'slip_spread_k': 0.8791501184764103, 'spread_hl_frac': 0.03882698889616837, 'bb_std_mult': 2.517993835597866, 'rsi_os': 45, 'rsi_ob': 75, 'vol_spike': 0.19584187300887493, 'adx_thresh': 23.595554827377633, 'atr_min_pct': 0.017508188670188517, 'atr_max_pct': 0.041477798581362926, 'tp_mult': 1.8044907516613227, 'tsl_mult': 0.1110701768092569, 'strategy': 'mean_reversion', 'time_stop': 169, 'use_sma': False, 'use_atr': True, 'use_adx': False, 'use_ema': True, 'use_spike': True, 'rsi_required': False, 'edge_k': 1.6260559557729688, 'edge_cap': 0.3539461442350304}.
[I 2025-08-29 18:30:31,244] Trial 10 finished with values: [-1000000000.0, 1000000000.0] and parameters: {'p_sma': 35, 'p_std': 43, 'p_atr': 10, 'p_adx': 21, 'rsi_period': 49, 'ema1': 12, 'ema2': 13, 'slip_atr_k': 0.06566534308416591, 'slip_spread_k': 0.3502698522923552, 'spread_hl_frac': 0.019478785908626534, 'bb_std_mult': 2.117549742270397, 'rsi_os': 33, 'rsi_ob': 54, 'vol_spike': 0.26044599277293756, 'adx_thresh': 15.92183378917882, 'atr_min_pct': 0.027189391342850328, 'atr_max_pct': 0.11655152671945491, 'tp_mult': 2.811632676155679, 'tsl_mult': 0.4957395221202521, 'strategy': 'mean_reversion', 'time_stop': 220, 'use_sma': True, 'use_atr': True, 'use_adx': True, 'use_ema': False, 'use_spike': True, 'rsi_required': False, 'edge_k': 1.433626836887357, 'edge_cap': 0.5383117011494786}.
[I 2025-08-29 18:30:31,300] Trial 14 finished with values: [-0.033677476159233666, 0.03365657859433749] and parameters: {'p_sma': 49, 'p_std': 6, 'p_atr': 22, 'p_adx': 7, 'rsi_period': 46, 'ema1': 30, 'ema2': 60, 'slip_atr_k': 0.24846488375013223, 'slip_spread_k': 0.003730846629818818, 'spread_hl_frac': 0.02050324404374227, 'bb_std_mult': 2.0525074872981857, 'rsi_os': 20, 'rsi_ob': 47, 'vol_spike': 0.037805185561958526, 'adx_thresh': 5.637281597308329, 'atr_min_pct': 0.00020735273755708404, 'atr_max_pct': 0.013155509349740607, 'tp_mult': 2.997794208740392, 'tsl_mult': 0.6176285932186756, 'strategy': 'breakout', 'time_stop': 105, 'use_sma': False, 'use_atr': True, 'use_adx': True, 'use_ema': False, 'use_spike': False, 'rsi_required': True, 'edge_k': 1.0441718370268285, 'edge_cap': 0.978078006639306}.
[I 2025-08-29 18:30:31,531] Trial 13 finished with values: [-0.03437883251649476, 0.034358466985674144] and parameters: {'p_sma': 48, 'p_std': 5, 'p_atr': 20, 'p_adx': 7, 'rsi_period': 43, 'ema1': 14, 'ema2': 39, 'slip_atr_k': 0.24705182078048232, 'slip_spread_k': 0.11434692492621612, 'spread_hl_frac': 0.039686997016571746, 'bb_std_mult': 2.1021357950367827, 'rsi_os': 20, 'rsi_ob': 92, 'vol_spike': 0.017958757031369843, 'adx_thresh': 5.180238519007755, 'atr_min_pct': 0.0008059469719541137, 'atr_max_pct': 0.017371486316525714, 'tp_mult': 2.8756356119817648, 'tsl_mult': 0.5797290825445927, 'strategy': 'breakout', 'time_stop': 91, 'use_sma': False, 'use_atr': True, 'use_adx': True, 'use_ema': False, 'use_spike': False, 'rsi_required': False, 'edge_k': 1.177151552893204, 'edge_cap': 0.715716097720394}.
[I 2025-08-29 18:30:31,679] Trial 12 finished with values: [-1000000000.0, 1000000000.0] and parameters: {'p_sma': 46, 'p_std': 36, 'p_atr': 19, 'p_adx': 21, 'rsi_period': 57, 'ema1': 9, 'ema2': 18, 'slip_atr_k': 0.1115161422508501, 'slip_spread_k': 0.11612547643506232, 'spread_hl_frac': 0.0006999552983140867, 'bb_std_mult': 2.4665752977760675, 'rsi_os': 35, 'rsi_ob': 94, 'vol_spike': 0.08576143889696355, 'adx_thresh': 25.78201260818085, 'atr_min_pct': 0.0005598159818375936, 'atr_max_pct': 0.12923276411167275, 'tp_mult': 2.0206491308506758, 'tsl_mult': 0.24123262284288105, 'strategy': 'mean_reversion', 'time_stop': 226, 'use_sma': True, 'use_atr': True, 'use_adx': False, 'use_ema': True, 'use_spike': True, 'rsi_required': False, 'edge_k': 1.2811052315092109, 'edge_cap': 0.49141891288154405}.
[I 2025-08-29 18:30:58,852] Trial 18 finished with values: [-1000000000.0, 1000000000.0] and parameters: {'p_sma': 47, 'p_std': 5, 'p_atr': 20, 'p_adx': 16, 'rsi_period': 34, 'ema1': 25, 'ema2': 43, 'slip_atr_k': 0.24318394141888316, 'slip_spread_k': 0.12701770881950014, 'spread_hl_frac': 0.03458239946108964, 'bb_std_mult': 1.9846894678808231, 'rsi_os': 22, 'rsi_ob': 46, 'vol_spike': 0.005796323598125333, 'adx_thresh': 6.4926757740568295, 'atr_min_pct': 0.005941276067736652, 'atr_max_pct': 0.01676614589720365, 'tp_mult': 2.955744166163438, 'tsl_mult': 0.6496207151554028, 'strategy': 'breakout', 'time_stop': 92, 'use_sma': False, 'use_atr': True, 'use_adx': True, 'use_ema': False, 'use_spike': False, 'rsi_required': True, 'edge_k': 0.8849257994558605, 'edge_cap': 0.8001955597531752}.
[I 2025-08-29 18:30:59,303] Trial 16 finished with values: [-0.03522248165346831, 0.03520194866588454] and parameters: {'p_sma': 48, 'p_std': 5, 'p_atr': 19, 'p_adx': 7, 'rsi_period': 49, 'ema1': 25, 'ema2': 60, 'slip_atr_k': 0.24799639548274302, 'slip_spread_k': 0.0010418607524388846, 'spread_hl_frac': 0.035105277268527114, 'bb_std_mult': 2.030738090279426, 'rsi_os': 21, 'rsi_ob': 45, 'vol_spike': 0.021189629367967595, 'adx_thresh': 5.039347477106558, 'atr_min_pct': 8.501124824913942e-05, 'atr_max_pct': 0.015770972505453895, 'tp_mult': 2.9646308583234093, 'tsl_mult': 0.6302178222952072, 'strategy': 'breakout', 'time_stop': 80, 'use_sma': False, 'use_atr': True, 'use_adx': True, 'use_ema': False, 'use_spike': False, 'rsi_required': True, 'edge_k': 0.9990911878179265, 'edge_cap': 0.9767148730178963}.
[I 2025-08-29 18:30:59,589] Trial 17 finished with values: [-0.03127217698649676, 0.03128311656217259] and parameters: {'p_sma': 45, 'p_std': 10, 'p_atr': 20, 'p_adx': 14, 'rsi_period': 50, 'ema1': 25, 'ema2': 41, 'slip_atr_k': 0.24606962361372128, 'slip_spread_k': 0.015560247261161595, 'spread_hl_frac': 0.03657315398862784, 'bb_std_mult': 2.0776516543227337, 'rsi_os': 21, 'rsi_ob': 46, 'vol_spike': 0.029939167594744413, 'adx_thresh': 7.054795703147089, 'atr_min_pct': 0.0006423429332521255, 'atr_max_pct': 0.012063653444192923, 'tp_mult': 2.99149870420892, 'tsl_mult': 0.6643433034768177, 'strategy': 'breakout', 'time_stop': 85, 'use_sma': False, 'use_atr': True, 'use_adx': True, 'use_ema': False, 'use_spike': False, 'rsi_required': True, 'edge_k': 0.8648554381406611, 'edge_cap': 0.8430137848729911}.
[I 2025-08-29 18:30:59,755] Trial 15 finished with values: [-0.031531861452106735, 0.03151083279012643] and parameters: {'p_sma': 48, 'p_std': 6, 'p_atr': 20, 'p_adx': 7, 'rsi_period': 47, 'ema1': 25, 'ema2': 60, 'slip_atr_k': 0.24687960126773884, 'slip_spread_k': 0.029856316524383208, 'spread_hl_frac': 0.036281623110398786, 'bb_std_mult': 1.9988205830662142, 'rsi_os': 21, 'rsi_ob': 47, 'vol_spike': 0.01911636230910334, 'adx_thresh': 6.067208661740501, 'atr_min_pct': 0.0011389543935105858, 'atr_max_pct': 0.022231034584898224, 'tp_mult': 2.906629289350766, 'tsl_mult': 0.6150248627492211, 'strategy': 'breakout', 'time_stop': 91, 'use_sma': False, 'use_atr': True, 'use_adx': True, 'use_ema': False, 'use_spike': False, 'rsi_required': True, 'edge_k': 1.0191102170508763, 'edge_cap': 0.9674638149642354}.
[I 2025-08-29 18:31:27,415] Trial 19 finished with values: [-1000000000.0, 1000000000.0] and parameters: {'p_sma': 45, 'p_std': 59, 'p_atr': 22, 'p_adx': 7, 'rsi_period': 37, 'ema1': 30, 'ema2': 29, 'slip_atr_k': 0.20594892862559808, 'slip_spread_k': 0.0027683809897748714, 'spread_hl_frac': 0.02544095661879002, 'bb_std_mult': 1.977355238264487, 'rsi_os': 8, 'rsi_ob': 57, 'vol_spike': 0.09797534417362239, 'adx_thresh': 18.129576858292435, 'atr_min_pct': 0.0057720727639786595, 'atr_max_pct': 0.012461709787425418, 'tp_mult': 1.1177458938486886, 'tsl_mult': 0.6516825566869529, 'strategy': 'breakout', 'time_stop': 98, 'use_sma': False, 'use_atr': True, 'use_adx': True, 'use_ema': False, 'use_spike': False, 'rsi_required': True, 'edge_k': 0.9214698035549749, 'edge_cap': 0.6668373363066633}.
[I 2025-08-29 18:31:27,427] Trial 20 finished with values: [-1000000000.0, 1000000000.0] and parameters: {'p_sma': 43, 'p_std': 60, 'p_atr': 22, 'p_adx': 17, 'rsi_period': 36, 'ema1': 30, 'ema2': 30, 'slip_atr_k': 0.2040826356610878, 'slip_spread_k': 0.11225456488108077, 'spread_hl_frac': 0.026865562462390004, 'bb_std_mult': 3.504208723422195, 'rsi_os': 7, 'rsi_ob': 57, 'vol_spike': 0.10761971056839385, 'adx_thresh': 16.876226216277725, 'atr_min_pct': 0.006387672826110467, 'atr_max_pct': 0.011677224371963524, 'tp_mult': 1.0295039403558208, 'tsl_mult': 0.6658344315563456, 'strategy': 'breakout', 'time_stop': 109, 'use_sma': False, 'use_atr': True, 'use_adx': True, 'use_ema': False, 'use_spike': False, 'rsi_required': True, 'edge_k': 0.8625809347881594, 'edge_cap': 0.6552557281498623}.
[I 2025-08-29 18:31:27,861] Trial 21 finished with values: [-1000000000.0, 1000000000.0] and parameters: {'p_sma': 6, 'p_std': 59, 'p_atr': 15, 'p_adx': 17, 'rsi_period': 61, 'ema1': 30, 'ema2': 26, 'slip_atr_k': 0.009996906431329958, 'slip_spread_k': 0.20120338411988822, 'spread_hl_frac': 0.048394372128670406, 'bb_std_mult': 3.5516539606478736, 'rsi_os': 6, 'rsi_ob': 58, 'vol_spike': 0.06968180498135296, 'adx_thresh': 19.15319667268505, 'atr_min_pct': 0.008283200979846663, 'atr_max_pct': 0.028910842473915288, 'tp_mult': 1.1310564529714169, 'tsl_mult': 0.9984481170733732, 'strategy': 'breakout', 'time_stop': 5, 'use_sma': False, 'use_atr': False, 'use_adx': True, 'use_ema': False, 'use_spike': False, 'rsi_required': True, 'edge_k': 0.8196043845832788, 'edge_cap': 0.6401886103146099}.
[I 2025-08-29 18:31:28,153] Trial 22 finished with values: [-1000000000.0, 1000000000.0] and parameters: {'p_sma': 41, 'p_std': 15, 'p_atr': 16, 'p_adx': 17, 'rsi_period': 64, 'ema1': 24, 'ema2': 29, 'slip_atr_k': 0.00974938086140903, 'slip_spread_k': 0.2053027356459598, 'spread_hl_frac': 0.046240496879473555, 'bb_std_mult': 3.5079566165975917, 'rsi_os': 5, 'rsi_ob': 58, 'vol_spike': 0.11648997137777241, 'adx_thresh': 19.20039622371672, 'atr_min_pct': 0.006286070138569763, 'atr_max_pct': 0.0291676445049598, 'tp_mult': 1.1608707534775586, 'tsl_mult': 0.975662566011947, 'strategy': 'breakout', 'time_stop': 5, 'use_sma': False, 'use_atr': False, 'use_adx': True, 'use_ema': False, 'use_spike': False, 'rsi_required': True, 'edge_k': 0.057125389381042724, 'edge_cap': 0.6085854310919353}.
[I 2025-08-29 18:31:55,461] Trial 24 finished with values: [-0.0029707209970700754, 0.003036849256020538] and parameters: {'p_sma': 6, 'p_std': 12, 'p_atr': 16, 'p_adx': 13, 'rsi_period': 60, 'ema1': 24, 'ema2': 43, 'slip_atr_k': 0.14963019818716525, 'slip_spread_k': 0.9937673742891207, 'spread_hl_frac': 0.04442664242824399, 'bb_std_mult': 1.6292704877278532, 'rsi_os': 26, 'rsi_ob': 50, 'vol_spike': 0.05532004837725972, 'adx_thresh': 20.362800540218792, 'atr_min_pct': 0.0036865166296249224, 'atr_max_pct': 0.031486448742075325, 'tp_mult': 2.6005042951163535, 'tsl_mult': 0.4360153123399072, 'strategy': 'breakout', 'time_stop': 59, 'use_sma': False, 'use_atr': False, 'use_adx': True, 'use_ema': False, 'use_spike': False, 'rsi_required': True, 'edge_k': 0.026975911829280497, 'edge_cap': 0.8857759192048504}.
[I 2025-08-29 18:31:55,765] Trial 25 finished with values: [-0.007411559613342056, 0.007515152496417954] and parameters: {'p_sma': 26, 'p_std': 12, 'p_atr': 16, 'p_adx': 13, 'rsi_period': 59, 'ema1': 23, 'ema2': 44, 'slip_atr_k': 0.1459748069366274, 'slip_spread_k': 0.9867671324664564, 'spread_hl_frac': 0.04257938843222232, 'bb_std_mult': 2.334840145288886, 'rsi_os': 27, 'rsi_ob': 50, 'vol_spike': 0.05085589544930402, 'adx_thresh': 12.970954311415802, 'atr_min_pct': 0.003945702634959627, 'atr_max_pct': 0.03110845573351919, 'tp_mult': 2.6701110078911987, 'tsl_mult': 0.7543956709821126, 'strategy': 'breakout', 'time_stop': 57, 'use_sma': False, 'use_atr': True, 'use_adx': True, 'use_ema': False, 'use_spike': False, 'rsi_required': True, 'edge_k': 0.673541777132356, 'edge_cap': 0.8798572570904994}.
[I 2025-08-29 18:31:55,972] Trial 23 finished with values: [-0.0023519422122806333, 0.0024516482634239275] and parameters: {'p_sma': 7, 'p_std': 13, 'p_atr': 15, 'p_adx': 14, 'rsi_period': 60, 'ema1': 24, 'ema2': 44, 'slip_atr_k': 0.14753612369545982, 'slip_spread_k': 0.21532929993787697, 'spread_hl_frac': 0.047064716400967384, 'bb_std_mult': 1.6754359147429068, 'rsi_os': 26, 'rsi_ob': 50, 'vol_spike': 0.05020876555688884, 'adx_thresh': 13.441543084385977, 'atr_min_pct': 0.004090137161568289, 'atr_max_pct': 0.03474471508329956, 'tp_mult': 2.6086566163056286, 'tsl_mult': 0.7538421981707085, 'strategy': 'breakout', 'time_stop': 9, 'use_sma': False, 'use_atr': False, 'use_adx': True, 'use_ema': False, 'use_spike': False, 'rsi_required': True, 'edge_k': 0.19397440345451555, 'edge_cap': 0.8757290722514665}.
[I 2025-08-29 18:31:56,201] Trial 26 finished with values: [-1000000000.0, 1000000000.0] and parameters: {'p_sma': 27, 'p_std': 14, 'p_atr': 17, 'p_adx': 13, 'rsi_period': 54, 'ema1': 27, 'ema2': 42, 'slip_atr_k': 0.14705094547136638, 'slip_spread_k': 0.9442467325500511, 'spread_hl_frac': 0.0411453793563616, 'bb_std_mult': 1.6720176217583549, 'rsi_os': 27, 'rsi_ob': 50, 'vol_spike': 0.04915075424327453, 'adx_thresh': 13.927896237131524, 'atr_min_pct': 0.02252709271198626, 'atr_max_pct': 0.030667754578073483, 'tp_mult': 2.6062629658210454, 'tsl_mult': 0.7469882173327489, 'strategy': 'breakout', 'time_stop': 128, 'use_sma': False, 'use_atr': True, 'use_adx': True, 'use_ema': False, 'use_spike': False, 'rsi_required': True, 'edge_k': 1.956084784124894, 'edge_cap': 0.8771817976096659}.
