[I 2025-08-29 18:53:38,081] Trial 216 finished with values: [-0.005595867547037003, 0.005760980187382377] and parameters: {'p_sma': 23, 'p_std': 11, 'p_atr': 14, 'p_adx': 21, 'rsi_period': 66, 'ema1': 16, 'ema2': 24, 'slip_atr_k': 0.023124463330589193, 'slip_spread_k': 0.2533713346526561, 'spread_hl_frac': 0.013618956364406777, 'bb_std_mult': 2.1790314342685813, 'rsi_os': 35, 'rsi_ob': 78, 'vol_spike': 0.18386131278202394, 'adx_thresh': 33.09223354611306, 'atr_min_pct': 0.004012558909311617, 'atr_max_pct': 0.14865640232259505, 'tp_mult': 2.657907914063303, 'tsl_mult': 0.2275487062877076, 'strategy': 'breakout', 'time_stop': 138, 'use_sma': False, 'use_atr': True, 'use_adx': True, 'use_ema': False, 'use_spike': False, 'rsi_required': True, 'edge_k': 1.7635681005447934, 'edge_cap': 0.050125602269550075}.
[I 2025-08-29 18:53:38,212] Trial 215 finished with values: [-0.0011954640467815025, 0.0017163350491246395] and parameters: {'p_sma': 60, 'p_std': 11, 'p_atr': 14, 'p_adx': 21, 'rsi_period': 13, 'ema1': 16, 'ema2': 11, 'slip_atr_k': 0.022510562816403595, 'slip_spread_k': 0.41399301164294167, 'spread_hl_frac': 0.009108060091872542, 'bb_std_mult': 2.176403314400246, 'rsi_os': 20, 'rsi_ob': 48, 'vol_spike': 0.18842621346454816, 'adx_thresh': 32.993430373663294, 'atr_min_pct': 0.005456553300232632, 'atr_max_pct': 0.05047624244879846, 'tp_mult': 2.6449521064779993, 'tsl_mult': 0.2208853268141148, 'strategy': 'breakout', 'time_stop': 141, 'use_sma': False, 'use_atr': True, 'use_adx': True, 'use_ema': False, 'use_spike': False, 'rsi_required': True, 'edge_k': 1.151717205467612, 'edge_cap': 0.05408817491310029}.
[I 2025-08-29 18:54:05,981] Trial 218 finished with values: [-0.0026300288747532763, 0.0030230544820342865] and parameters: {'p_sma': 58, 'p_std': 11, 'p_atr': 23, 'p_adx': 21, 'rsi_period': 24, 'ema1': 16, 'ema2': 12, 'slip_atr_k': 0.1241649654419262, 'slip_spread_k': 0.14970127105729875, 'spread_hl_frac': 0.013583387159836726, 'bb_std_mult': 1.0217709320738437, 'rsi_os': 18, 'rsi_ob': 50, 'vol_spike': 0.16575404056107004, 'adx_thresh': 28.930507567542627, 'atr_min_pct': 0.004121709088433791, 'atr_max_pct': 0.11821112006781179, 'tp_mult': 1.18673240317439, 'tsl_mult': 0.8429892484664261, 'strategy': 'breakout', 'time_stop': 41, 'use_sma': False, 'use_atr': True, 'use_adx': True, 'use_ema': False, 'use_spike': False, 'rsi_required': True, 'edge_k': 1.918357504551593, 'edge_cap': 0.05341788175576748}.
[I 2025-08-29 18:54:06,395] Trial 219 finished with values: [-0.000398287479597248, 0.0017549188299703742] and parameters: {'p_sma': 30, 'p_std': 11, 'p_atr': 13, 'p_adx': 21, 'rsi_period': 60, 'ema1': 16, 'ema2': 53, 'slip_atr_k': 0.03404222928807289, 'slip_spread_k': 0.4212197723106436, 'spread_hl_frac': 0.009167083954371475, 'bb_std_mult': 1.0094261210694209, 'rsi_os': 23, 'rsi_ob': 50, 'vol_spike': 0.16318955146079175, 'adx_thresh': 31.833094783471893, 'atr_min_pct': 0.004548759644593913, 'atr_max_pct': 0.1431153828409317, 'tp_mult': 2.662035408482799, 'tsl_mult': 0.3194515703356948, 'strategy': 'breakout', 'time_stop': 39, 'use_sma': False, 'use_atr': False, 'use_adx': True, 'use_ema': False, 'use_spike': True, 'rsi_required': True, 'edge_k': 1.4473695389791958, 'edge_cap': 0.05513385037202721}.
[I 2025-08-29 18:54:06,588] Trial 220 finished with values: [-1000000000.0, 1000000000.0] and parameters: {'p_sma': 23, 'p_std': 53, 'p_atr': 13, 'p_adx': 21, 'rsi_period': 60, 'ema1': 16, 'ema2': 53, 'slip_atr_k': 0.011818909820790912, 'slip_spread_k': 0.30252470245992713, 'spread_hl_frac': 0.04076863013756185, 'bb_std_mult': 0.9799132789559345, 'rsi_os': 18, 'rsi_ob': 50, 'vol_spike': 0.1630357545510117, 'adx_thresh': 6.588095502749402, 'atr_min_pct': 0.023929211577198573, 'atr_max_pct': 0.11832509451409876, 'tp_mult': 1.18594138745675, 'tsl_mult': 0.8747328680533981, 'strategy': 'breakout', 'time_stop': 126, 'use_sma': False, 'use_atr': False, 'use_adx': True, 'use_ema': False, 'use_spike': True, 'rsi_required': True, 'edge_k': 1.7997185165207175, 'edge_cap': 0.08893423440871734}.
[I 2025-08-29 18:54:06,894] Trial 221 finished with values: [-0.001664817265711882, 0.0024410948510728537] and parameters: {'p_sma': 55, 'p_std': 12, 'p_atr': 14, 'p_adx': 21, 'rsi_period': 60, 'ema1': 16, 'ema2': 53, 'slip_atr_k': 0.012122988244095002, 'slip_spread_k': 0.4109201901269235, 'spread_hl_frac': 0.0058695019237661504, 'bb_std_mult': 0.9813013140262125, 'rsi_os': 18, 'rsi_ob': 50, 'vol_spike': 0.16445836241024447, 'adx_thresh': 8.19230022709231, 'atr_min_pct': 0.004044896428763205, 'atr_max_pct': 0.14995672356648085, 'tp_mult': 2.981644567342027, 'tsl_mult': 0.24395475403848488, 'strategy': 'breakout', 'time_stop': 150, 'use_sma': False, 'use_atr': False, 'use_adx': False, 'use_ema': False, 'use_spike': True, 'rsi_required': True, 'edge_k': 1.809696552954129, 'edge_cap': 0.3354061984799901}.
[I 2025-08-29 18:54:34,607] Trial 224 finished with values: [-0.0017669516831462229, 0.002584326319238391] and parameters: {'p_sma': 40, 'p_std': 20, 'p_atr': 13, 'p_adx': 21, 'rsi_period': 26, 'ema1': 16, 'ema2': 12, 'slip_atr_k': 0.020520108159561144, 'slip_spread_k': 0.4687122361815633, 'spread_hl_frac': 0.005704814112401234, 'bb_std_mult': 1.0250304111094368, 'rsi_os': 23, 'rsi_ob': 77, 'vol_spike': 0.17145385679610978, 'adx_thresh': 31.860950108710142, 'atr_min_pct': 0.004001659065608464, 'atr_max_pct': 0.04256935763394734, 'tp_mult': 1.3142607470789351, 'tsl_mult': 0.2397401461206705, 'strategy': 'breakout', 'time_stop': 150, 'use_sma': False, 'use_atr': False, 'use_adx': False, 'use_ema': False, 'use_spike': False, 'rsi_required': True, 'edge_k': 1.8460076010377828, 'edge_cap': 0.05110876771112935}.
[I 2025-08-29 18:54:34,880] Trial 225 finished with values: [-0.0010743015488303698, 0.002109009459618185] and parameters: {'p_sma': 32, 'p_std': 12, 'p_atr': 23, 'p_adx': 21, 'rsi_period': 64, 'ema1': 14, 'ema2': 12, 'slip_atr_k': 0.020965691687401252, 'slip_spread_k': 0.2520026346392736, 'spread_hl_frac': 0.005441301950761155, 'bb_std_mult': 1.0313422608021068, 'rsi_os': 23, 'rsi_ob': 48, 'vol_spike': 0.17082523855980292, 'adx_thresh': 31.832213761864786, 'atr_min_pct': 0.0038204313855217257, 'atr_max_pct': 0.12656674094308834, 'tp_mult': 1.3172039795113586, 'tsl_mult': 0.23929070442868158, 'strategy': 'breakout', 'time_stop': 151, 'use_sma': False, 'use_atr': False, 'use_adx': False, 'use_ema': False, 'use_spike': False, 'rsi_required': True, 'edge_k': 1.848971837095952, 'edge_cap': 0.050845810405392926}.
[I 2025-08-29 18:54:35,251] Trial 223 finished with values: [-0.0012414125011258603, 0.002735189656886036] and parameters: {'p_sma': 40, 'p_std': 34, 'p_atr': 13, 'p_adx': 21, 'rsi_period': 60, 'ema1': 16, 'ema2': 13, 'slip_atr_k': 0.014560570833232096, 'slip_spread_k': 0.3008685125735197, 'spread_hl_frac': 0.005545694747865822, 'bb_std_mult': 2.964411574159796, 'rsi_os': 23, 'rsi_ob': 50, 'vol_spike': 0.16155491207693656, 'adx_thresh': 6.598439215155189, 'atr_min_pct': 0.004133274970484672, 'atr_max_pct': 0.14940746135316735, 'tp_mult': 1.3145248198141426, 'tsl_mult': 0.2444622906829598, 'strategy': 'breakout', 'time_stop': 127, 'use_sma': False, 'use_atr': False, 'use_adx': False, 'use_ema': False, 'use_spike': True, 'rsi_required': True, 'edge_k': 1.8558002316654068, 'edge_cap': 0.08951787976739406}.
[I 2025-08-29 18:54:35,419] Trial 222 finished with values: [-0.0015439092274982524, 0.001899506651031002] and parameters: {'p_sma': 40, 'p_std': 34, 'p_atr': 23, 'p_adx': 21, 'rsi_period': 25, 'ema1': 16, 'ema2': 13, 'slip_atr_k': 0.12468864655362497, 'slip_spread_k': 0.41194147578681173, 'spread_hl_frac': 0.005869501470483091, 'bb_std_mult': 2.159382505092555, 'rsi_os': 18, 'rsi_ob': 50, 'vol_spike': 0.16337700821112233, 'adx_thresh': 31.802761543190044, 'atr_min_pct': 0.004061523344894456, 'atr_max_pct': 0.14809171690630363, 'tp_mult': 1.3157708427738675, 'tsl_mult': 0.24199249905288195, 'strategy': 'breakout', 'time_stop': 124, 'use_sma': False, 'use_atr': False, 'use_adx': False, 'use_ema': False, 'use_spike': True, 'rsi_required': True, 'edge_k': 1.8454401511602252, 'edge_cap': 0.05066701331967944}.
[I 2025-08-29 18:55:02,957] Trial 227 finished with values: [-1000000000.0, 1000000000.0] and parameters: {'p_sma': 30, 'p_std': 35, 'p_atr': 16, 'p_adx': 21, 'rsi_period': 77, 'ema1': 17, 'ema2': 12, 'slip_atr_k': 0.019250643089538826, 'slip_spread_k': 0.41175655586872983, 'spread_hl_frac': 0.005557487463221565, 'bb_std_mult': 2.9712686579605965, 'rsi_os': 23, 'rsi_ob': 60, 'vol_spike': 0.1651265327622893, 'adx_thresh': 29.16833812117735, 'atr_min_pct': 0.004343373159474827, 'atr_max_pct': 0.041510780619523055, 'tp_mult': 2.9915643282303614, 'tsl_mult': 0.24578185185421839, 'strategy': 'breakout', 'time_stop': 155, 'use_sma': False, 'use_atr': False, 'use_adx': False, 'use_ema': False, 'use_spike': False, 'rsi_required': True, 'edge_k': 1.854558840350595, 'edge_cap': 0.6965400199940754}.
[I 2025-08-29 18:55:03,614] Trial 226 finished with values: [-0.001470268018242682, 0.0023739593703347864] and parameters: {'p_sma': 32, 'p_std': 12, 'p_atr': 13, 'p_adx': 21, 'rsi_period': 78, 'ema1': 16, 'ema2': 12, 'slip_atr_k': 0.022587625071467145, 'slip_spread_k': 0.2559278197332281, 'spread_hl_frac': 0.005752410321032703, 'bb_std_mult': 2.1941690198409374, 'rsi_os': 23, 'rsi_ob': 48, 'vol_spike': 0.17086794992911064, 'adx_thresh': 31.698636724632575, 'atr_min_pct': 0.004003015373577064, 'atr_max_pct': 0.08217049687261375, 'tp_mult': 1.325785333855141, 'tsl_mult': 0.24276383645506233, 'strategy': 'breakout', 'time_stop': 40, 'use_sma': False, 'use_atr': False, 'use_adx': False, 'use_ema': False, 'use_spike': False, 'rsi_required': True, 'edge_k': 1.8592300892076656, 'edge_cap': 0.05121663007790955}.
[I 2025-08-29 18:55:03,714] Trial 229 finished with values: [-1000000000.0, 1000000000.0] and parameters: {'p_sma': 58, 'p_std': 12, 'p_atr': 23, 'p_adx': 22, 'rsi_period': 64, 'ema1': 17, 'ema2': 12, 'slip_atr_k': 0.01906382284856349, 'slip_spread_k': 0.22452137830417224, 'spread_hl_frac': 0.005564270103356879, 'bb_std_mult': 1.0281275260378748, 'rsi_os': 23, 'rsi_ob': 60, 'vol_spike': 0.17199561984431633, 'adx_thresh': 28.808198918796144, 'atr_min_pct': 0.005344498567095119, 'atr_max_pct': 0.08244146419143616, 'tp_mult': 1.278743306690754, 'tsl_mult': 0.2451902936128497, 'strategy': 'breakout', 'time_stop': 154, 'use_sma': False, 'use_atr': False, 'use_adx': False, 'use_ema': False, 'use_spike': False, 'rsi_required': True, 'edge_k': 1.837166749972378, 'edge_cap': 0.6916449410675836}.
[I 2025-08-29 18:55:03,800] Trial 228 finished with values: [-1000000000.0, 1000000000.0] and parameters: {'p_sma': 30, 'p_std': 34, 'p_atr': 13, 'p_adx': 22, 'rsi_period': 64, 'ema1': 17, 'ema2': 12, 'slip_atr_k': 0.12511289521065438, 'slip_spread_k': 0.46384168178242247, 'spread_hl_frac': 0.005764815420538285, 'bb_std_mult': 1.029523027417388, 'rsi_os': 23, 'rsi_ob': 48, 'vol_spike': 0.17174690147909255, 'adx_thresh': 31.856212341219276, 'atr_min_pct': 0.004403003371436437, 'atr_max_pct': 0.10160151853548215, 'tp_mult': 1.3181598812639943, 'tsl_mult': 0.24846842787880766, 'strategy': 'breakout', 'time_stop': 151, 'use_sma': False, 'use_atr': False, 'use_adx': False, 'use_ema': False, 'use_spike': False, 'rsi_required': True, 'edge_k': 1.8635205459752444, 'edge_cap': 0.3462242059349828}.
[I 2025-08-29 18:55:36,546] Trial 231 finished with values: [-0.0024989328925490994, 0.0026342175379296833] and parameters: {'p_sma': 33, 'p_std': 12, 'p_atr': 23, 'p_adx': 27, 'rsi_period': 57, 'ema1': 16, 'ema2': 21, 'slip_atr_k': 0.014275117749193576, 'slip_spread_k': 0.2263797684761485, 'spread_hl_frac': 0.006928449060207382, 'bb_std_mult': 1.0920514192534012, 'rsi_os': 40, 'rsi_ob': 46, 'vol_spike': 0.17337159755591153, 'adx_thresh': 31.88937118245096, 'atr_min_pct': 0.005673233377759364, 'atr_max_pct': 0.09173682944777513, 'tp_mult': 1.3244261277858704, 'tsl_mult': 0.1954762415855312, 'strategy': 'breakout', 'time_stop': 165, 'use_sma': False, 'use_atr': False, 'use_adx': False, 'use_ema': False, 'use_spike': False, 'rsi_required': True, 'edge_k': 1.854039462786623, 'edge_cap': 0.0503067631304424}.
[I 2025-08-29 18:55:36,554] Trial 232 finished with values: [-0.0022972009936698123, 0.002758767579926849] and parameters: {'p_sma': 58, 'p_std': 14, 'p_atr': 13, 'p_adx': 28, 'rsi_period': 24, 'ema1': 16, 'ema2': 11, 'slip_atr_k': 0.011726311573978875, 'slip_spread_k': 0.18763897924514822, 'spread_hl_frac': 0.004230674959510329, 'bb_std_mult': 1.0926396883054756, 'rsi_os': 50, 'rsi_ob': 46, 'vol_spike': 0.16348718267102658, 'adx_thresh': 34.30138809838396, 'atr_min_pct': 0.00584910280214448, 'atr_max_pct': 0.12732970550412853, 'tp_mult': 1.317551340200078, 'tsl_mult': 0.19124350309602323, 'strategy': 'breakout', 'time_stop': 166, 'use_sma': False, 'use_atr': False, 'use_adx': True, 'use_ema': False, 'use_spike': True, 'rsi_required': True, 'edge_k': 1.7959904604509032, 'edge_cap': 0.3367763813265357}.
[I 2025-08-29 18:55:37,088] Trial 230 finished with values: [-0.004063184601755143, 0.004225916302924403] and parameters: {'p_sma': 58, 'p_std': 14, 'p_atr': 13, 'p_adx': 27, 'rsi_period': 24, 'ema1': 16, 'ema2': 11, 'slip_atr_k': 0.013814712952009766, 'slip_spread_k': 0.22583936149951409, 'spread_hl_frac': 0.007009845803932987, 'bb_std_mult': 1.0662122874076, 'rsi_os': 49, 'rsi_ob': 46, 'vol_spike': 0.17116533461971162, 'adx_thresh': 31.683768162321947, 'atr_min_pct': 0.005596548670901427, 'atr_max_pct': 0.12647542100540501, 'tp_mult': 1.3277152746373562, 'tsl_mult': 0.19692958334558905, 'strategy': 'breakout', 'time_stop': 148, 'use_sma': False, 'use_atr': False, 'use_adx': False, 'use_ema': False, 'use_spike': True, 'rsi_required': True, 'edge_k': 1.8519775430253922, 'edge_cap': 0.05076336247758996}.
[I 2025-08-29 18:55:37,237] Trial 233 finished with values: [-0.004312642497263708, 0.004472625074989404] and parameters: {'p_sma': 33, 'p_std': 12, 'p_atr': 13, 'p_adx': 29, 'rsi_period': 24, 'ema1': 16, 'ema2': 11, 'slip_atr_k': 0.014208794719250253, 'slip_spread_k': 0.2845250021075198, 'spread_hl_frac': 0.004504132755774198, 'bb_std_mult': 1.8594508309632256, 'rsi_os': 50, 'rsi_ob': 51, 'vol_spike': 0.16645505386274922, 'adx_thresh': 27.056773992481705, 'atr_min_pct': 0.005757379678605337, 'atr_max_pct': 0.1258738921655212, 'tp_mult': 1.2366856317774308, 'tsl_mult': 0.19644109571015145, 'strategy': 'breakout', 'time_stop': 164, 'use_sma': False, 'use_atr': False, 'use_adx': True, 'use_ema': False, 'use_spike': True, 'rsi_required': True, 'edge_k': 1.8029622724183554, 'edge_cap': 0.9443549266921868}.
[I 2025-08-29 18:56:05,234] Trial 236 finished with values: [-0.0005049414419999732, 0.0014014776742978746] and parameters: {'p_sma': 39, 'p_std': 12, 'p_atr': 13, 'p_adx': 28, 'rsi_period': 14, 'ema1': 15, 'ema2': 49, 'slip_atr_k': 0.012208895337846049, 'slip_spread_k': 0.28014549134638816, 'spread_hl_frac': 0.006805946331085759, 'bb_std_mult': 1.1113981063112846, 'rsi_os': 20, 'rsi_ob': 91, 'vol_spike': 0.2849071353267272, 'adx_thresh': 34.14514445856499, 'atr_min_pct': 0.004939517637242163, 'atr_max_pct': 0.0328149055688376, 'tp_mult': 1.2407564055958518, 'tsl_mult': 0.21311703367568952, 'strategy': 'breakout', 'time_stop': 144, 'use_sma': False, 'use_atr': False, 'use_adx': True, 'use_ema': False, 'use_spike': False, 'rsi_required': True, 'edge_k': 1.7964701736847275, 'edge_cap': 0.07029329909229048}.
[I 2025-08-29 18:56:05,955] Trial 237 finished with values: [-0.0003907780316385612, 0.0013377130579218144] and parameters: {'p_sma': 60, 'p_std': 10, 'p_atr': 19, 'p_adx': 21, 'rsi_period': 16, 'ema1': 8, 'ema2': 13, 'slip_atr_k': 0.02209526826558615, 'slip_spread_k': 0.25728824751551505, 'spread_hl_frac': 0.006056824192469314, 'bb_std_mult': 0.9330131905064258, 'rsi_os': 20, 'rsi_ob': 48, 'vol_spike': 0.16249861814569364, 'adx_thresh': 34.09888872681674, 'atr_min_pct': 0.004868876720156535, 'atr_max_pct': 0.08779321914587775, 'tp_mult': 1.3614775622558162, 'tsl_mult': 0.21858650667853563, 'strategy': 'breakout', 'time_stop': 144, 'use_sma': False, 'use_atr': False, 'use_adx': True, 'use_ema': False, 'use_spike': False, 'rsi_required': True, 'edge_k': 1.7952859923908187, 'edge_cap': 0.06771899074784515}.
[I 2025-08-29 18:56:06,111] Trial 234 finished with values: [-0.003447650951962755, 0.003607453248002186] and parameters: {'p_sma': 33, 'p_std': 12, 'p_atr': 13, 'p_adx': 21, 'rsi_period': 27, 'ema1': 16, 'ema2': 21, 'slip_atr_k': 0.011850746126828533, 'slip_spread_k': 0.5533022158259955, 'spread_hl_frac': 0.007073444157209089, 'bb_std_mult': 1.1026479604400619, 'rsi_os': 50, 'rsi_ob': 48, 'vol_spike': 0.16413353424207183, 'adx_thresh': 31.810885644250465, 'atr_min_pct': 0.005928534072553235, 'atr_max_pct': 0.12573318193985594, 'tp_mult': 1.3507316658297257, 'tsl_mult': 0.2033071977323667, 'strategy': 'breakout', 'time_stop': 142, 'use_sma': False, 'use_atr': False, 'use_adx': True, 'use_ema': False, 'use_spike': True, 'rsi_required': True, 'edge_k': 1.8009265111213644, 'edge_cap': 0.9428705597468995}.
[I 2025-08-29 18:56:06,198] Trial 235 finished with values: [-1000000000.0, 1000000000.0] and parameters: {'p_sma': 59, 'p_std': 12, 'p_atr': 13, 'p_adx': 21, 'rsi_period': 84, 'ema1': 7, 'ema2': 11, 'slip_atr_k': 0.013678348506013719, 'slip_spread_k': 0.27926994268887795, 'spread_hl_frac': 0.006893946136537361, 'bb_std_mult': 1.0856385578465277, 'rsi_os': 21, 'rsi_ob': 46, 'vol_spike': 0.16100696718636845, 'adx_thresh': 8.087712039009316, 'atr_min_pct': 0.005589068647233657, 'atr_max_pct': 0.12659569137425167, 'tp_mult': 1.3649263943065402, 'tsl_mult': 0.196567427863317, 'strategy': 'breakout', 'time_stop': 143, 'use_sma': False, 'use_atr': False, 'use_adx': True, 'use_ema': False, 'use_spike': True, 'rsi_required': True, 'edge_k': 1.8099692637677738, 'edge_cap': 0.05001143913920619}.
[I 2025-08-29 18:56:33,982] Trial 241 finished with values: [0.00020472023694817487, 0.001126894481694845] and parameters: {'p_sma': 60, 'p_std': 10, 'p_atr': 14, 'p_adx': 21, 'rsi_period': 57, 'ema1': 8, 'ema2': 13, 'slip_atr_k': 0.020039385462534594, 'slip_spread_k': 0.2553780389176583, 'spread_hl_frac': 0.005984697615450837, 'bb_std_mult': 1.1878332943123135, 'rsi_os': 20, 'rsi_ob': 91, 'vol_spike': 0.15782895351557508, 'adx_thresh': 33.70885716949765, 'atr_min_pct': 0.004776216776483753, 'atr_max_pct': 0.03359475336970862, 'tp_mult': 1.3051477900724424, 'tsl_mult': 0.21982779877774472, 'strategy': 'breakout', 'time_stop': 150, 'use_sma': False, 'use_atr': False, 'use_adx': True, 'use_ema': False, 'use_spike': False, 'rsi_required': True, 'edge_k': 1.9016482659844314, 'edge_cap': 0.07353878353958633}.
[I 2025-08-29 18:56:34,182] Trial 239 finished with values: [-0.00021947797014054693, 0.001470549474546699] and parameters: {'p_sma': 59, 'p_std': 10, 'p_atr': 13, 'p_adx': 12, 'rsi_period': 63, 'ema1': 7, 'ema2': 13, 'slip_atr_k': 0.01954471418958196, 'slip_spread_k': 0.25652157890485444, 'spread_hl_frac': 0.006498672963253088, 'bb_std_mult': 1.1642475972774082, 'rsi_os': 20, 'rsi_ob': 50, 'vol_spike': 0.16237397960894404, 'adx_thresh': 34.06093318806831, 'atr_min_pct': 0.004743287968832862, 'atr_max_pct': 0.09221831656405093, 'tp_mult': 1.354270094172904, 'tsl_mult': 0.2180995029622844, 'strategy': 'breakout', 'time_stop': 143, 'use_sma': False, 'use_atr': False, 'use_adx': True, 'use_ema': False, 'use_spike': False, 'rsi_required': True, 'edge_k': 1.9323393564507578, 'edge_cap': 0.07201959873223271}.
[I 2025-08-29 18:56:34,354] Trial 238 finished with values: [-0.0015979812856287134, 0.0027008509005304444] and parameters: {'p_sma': 41, 'p_std': 10, 'p_atr': 13, 'p_adx': 25, 'rsi_period': 27, 'ema1': 8, 'ema2': 21, 'slip_atr_k': 0.02212329937822093, 'slip_spread_k': 0.2572497895166603, 'spread_hl_frac': 0.006537632866527442, 'bb_std_mult': 1.1715788723512952, 'rsi_os': 20, 'rsi_ob': 91, 'vol_spike': 0.15911498663223664, 'adx_thresh': 33.7545316141661, 'atr_min_pct': 0.0037656631332046242, 'atr_max_pct': 0.08655044554597396, 'tp_mult': 1.3073718129038263, 'tsl_mult': 0.22127439691810458, 'strategy': 'breakout', 'time_stop': 143, 'use_sma': False, 'use_atr': False, 'use_adx': True, 'use_ema': False, 'use_spike': False, 'rsi_required': True, 'edge_k': 1.795294965124613, 'edge_cap': 0.07282093711647572}.
[I 2025-08-29 18:56:34,445] Trial 240 finished with values: [-0.001603119762637495, 0.0022045129110536675] and parameters: {'p_sma': 41, 'p_std': 10, 'p_atr': 14, 'p_adx': 9, 'rsi_period': 82, 'ema1': 15, 'ema2': 26, 'slip_atr_k': 0.02372038903823826, 'slip_spread_k': 0.25495698945168205, 'spread_hl_frac': 0.006440317578005207, 'bb_std_mult': 1.152103499927089, 'rsi_os': 20, 'rsi_ob': 49, 'vol_spike': 0.28715054263780604, 'adx_thresh': 34.22016376642955, 'atr_min_pct': 0.004592008118325144, 'atr_max_pct': 0.1055583609700404, 'tp_mult': 1.3057777507880954, 'tsl_mult': 0.21954400669596585, 'strategy': 'breakout', 'time_stop': 149, 'use_sma': False, 'use_atr': False, 'use_adx': True, 'use_ema': False, 'use_spike': False, 'rsi_required': True, 'edge_k': 1.9079508588285323, 'edge_cap': 0.7823137640550881}.
[I 2025-08-29 18:57:02,014] Trial 244 finished with values: [-0.006045343826948324, 0.0062627786277739865] and parameters: {'p_sma': 40, 'p_std': 9, 'p_atr': 15, 'p_adx': 21, 'rsi_period': 55, 'ema1': 8, 'ema2': 14, 'slip_atr_k': 0.025545521860675505, 'slip_spread_k': 0.2630935038233508, 'spread_hl_frac': 0.006166568700061363, 'bb_std_mult': 0.5852357080469881, 'rsi_os': 43, 'rsi_ob': 90, 'vol_spike': 0.149321396367245, 'adx_thresh': 34.46550705111279, 'atr_min_pct': 0.004857554081332897, 'atr_max_pct': 0.03351159902758079, 'tp_mult': 1.300399300700879, 'tsl_mult': 0.22076070002298598, 'strategy': 'breakout', 'time_stop': 21, 'use_sma': False, 'use_atr': True, 'use_adx': True, 'use_ema': False, 'use_spike': False, 'rsi_required': True, 'edge_k': 1.9296926933912983, 'edge_cap': 0.12460154169419176}.
