[I 2025-08-29 18:38:40,562] Trial 80 finished with values: [-1000000000.0, 1000000000.0] and parameters: {'p_sma': 34, 'p_std': 20, 'p_atr': 30, 'p_adx': 21, 'rsi_period': 61, 'ema1': 13, 'ema2': 12, 'slip_atr_k': 0.08121043223395814, 'slip_spread_k': 0.6539199497089666, 'spread_hl_frac': 0.02454752633536881, 'bb_std_mult': 3.411409369990043, 'rsi_os': 23, 'rsi_ob': 66, 'vol_spike': 0.20789365948475655, 'adx_thresh': 21.062624612464393, 'atr_min_pct': 0.0010404952557521406, 'atr_max_pct': 0.06975892410910776, 'tp_mult': 1.2200405023098586, 'tsl_mult': 0.42888113623768326, 'strategy': 'mean_reversion', 'time_stop': 118, 'use_sma': True, 'use_atr': False, 'use_adx': True, 'use_ema': True, 'use_spike': False, 'rsi_required': False, 'edge_k': 0.6410915877568076, 'edge_cap': 0.4705982936828911}.
[I 2025-08-29 18:38:40,740] Trial 81 finished with values: [-0.004787374751678897, 0.004766574673574596] and parameters: {'p_sma': 9, 'p_std': 7, 'p_atr': 24, 'p_adx': 16, 'rsi_period': 44, 'ema1': 13, 'ema2': 58, 'slip_atr_k': 0.13900255928177063, 'slip_spread_k': 0.37672617359973026, 'spread_hl_frac': 0.004059111937225506, 'bb_std_mult': 0.5193577203164792, 'rsi_os': 34, 'rsi_ob': 67, 'vol_spike': 0.24222562824915056, 'adx_thresh': 21.102105192582016, 'atr_min_pct': 0.0011335117732576422, 'atr_max_pct': 0.025733127347787592, 'tp_mult': 1.4659348174616498, 'tsl_mult': 0.3940504953752003, 'strategy': 'mean_reversion', 'time_stop': 119, 'use_sma': True, 'use_atr': True, 'use_adx': True, 'use_ema': True, 'use_spike': False, 'rsi_required': False, 'edge_k': 0.8223087074451292, 'edge_cap': 0.46751075652500573}.
[I 2025-08-29 18:38:40,753] Trial 82 finished with values: [-1000000000.0, 1000000000.0] and parameters: {'p_sma': 40, 'p_std': 13, 'p_atr': 21, 'p_adx': 17, 'rsi_period': 45, 'ema1': 28, 'ema2': 16, 'slip_atr_k': 0.07822420296726601, 'slip_spread_k': 0.36594331756801146, 'spread_hl_frac': 0.0026269063478218634, 'bb_std_mult': 1.5254331806646735, 'rsi_os': 34, 'rsi_ob': 66, 'vol_spike': 0.2409178039119631, 'adx_thresh': 7.54593833503538, 'atr_min_pct': 0.0010813714412953206, 'atr_max_pct': 0.056544935669172916, 'tp_mult': 1.4725388227431275, 'tsl_mult': 0.7757390287997628, 'strategy': 'mean_reversion', 'time_stop': 111, 'use_sma': True, 'use_atr': True, 'use_adx': True, 'use_ema': True, 'use_spike': False, 'rsi_required': False, 'edge_k': 0.8460666960207774, 'edge_cap': 0.5318294319777934}.
[I 2025-08-29 18:39:08,507] Trial 85 finished with values: [-1000000000.0, 1000000000.0] and parameters: {'p_sma': 17, 'p_std': 7, 'p_atr': 24, 'p_adx': 23, 'rsi_period': 68, 'ema1': 11, 'ema2': 22, 'slip_atr_k': 0.2148437291394944, 'slip_spread_k': 0.8046842345379844, 'spread_hl_frac': 0.012184098654425674, 'bb_std_mult': 1.924658714974023, 'rsi_os': 28, 'rsi_ob': 70, 'vol_spike': 0.24416770032732538, 'adx_thresh': 29.627449808130095, 'atr_min_pct': 0.01225748539964482, 'atr_max_pct': 0.06785513327007375, 'tp_mult': 1.47689849651734, 'tsl_mult': 0.7762166023806989, 'strategy': 'breakout', 'time_stop': 207, 'use_sma': False, 'use_atr': False, 'use_adx': True, 'use_ema': False, 'use_spike': False, 'rsi_required': True, 'edge_k': 0.4761708332960299, 'edge_cap': 0.5364564291008264}.
[I 2025-08-29 18:39:09,287] Trial 84 finished with values: [-0.014132627386496677, 0.01416134101783661] and parameters: {'p_sma': 13, 'p_std': 7, 'p_atr': 24, 'p_adx': 16, 'rsi_period': 32, 'ema1': 28, 'ema2': 13, 'slip_atr_k': 0.02575261291668025, 'slip_spread_k': 0.7901503108365212, 'spread_hl_frac': 0.024118737156871108, 'bb_std_mult': 1.8995357684096992, 'rsi_os': 15, 'rsi_ob': 70, 'vol_spike': 0.2422017761812101, 'adx_thresh': 23.69962470642536, 'atr_min_pct': 0.0008050081602315709, 'atr_max_pct': 0.07128017843943439, 'tp_mult': 2.5240543118332393, 'tsl_mult': 0.43400913095425764, 'strategy': 'breakout', 'time_stop': 122, 'use_sma': True, 'use_atr': False, 'use_adx': True, 'use_ema': True, 'use_spike': False, 'rsi_required': False, 'edge_k': 0.4844996819647772, 'edge_cap': 0.542615206297573}.
[I 2025-08-29 18:39:09,458] Trial 86 finished with values: [-1000000000.0, 1000000000.0] and parameters: {'p_sma': 13, 'p_std': 51, 'p_atr': 9, 'p_adx': 23, 'rsi_period': 67, 'ema1': 11, 'ema2': 22, 'slip_atr_k': 0.2140119573790552, 'slip_spread_k': 0.45789459445457215, 'spread_hl_frac': 0.03785442266588669, 'bb_std_mult': 1.9113552815076305, 'rsi_os': 15, 'rsi_ob': 70, 'vol_spike': 0.21386195976922195, 'adx_thresh': 29.320603216638016, 'atr_min_pct': 0.009212568162062972, 'atr_max_pct': 0.07447385541477683, 'tp_mult': 2.0672850855922618, 'tsl_mult': 0.677850566943212, 'strategy': 'breakout', 'time_stop': 204, 'use_sma': False, 'use_atr': False, 'use_adx': False, 'use_ema': False, 'use_spike': True, 'rsi_required': True, 'edge_k': 0.3468861280868912, 'edge_cap': 0.9368373628198363}.
[I 2025-08-29 18:39:09,469] Trial 87 finished with values: [-1000000000.0, 1000000000.0] and parameters: {'p_sma': 13, 'p_std': 10, 'p_atr': 28, 'p_adx': 23, 'rsi_period': 67, 'ema1': 11, 'ema2': 34, 'slip_atr_k': 0.024887708605686242, 'slip_spread_k': 0.813655208706318, 'spread_hl_frac': 0.012404361365819946, 'bb_std_mult': 1.379897245550058, 'rsi_os': 28, 'rsi_ob': 61, 'vol_spike': 0.19308090021815402, 'adx_thresh': 26.309567685682172, 'atr_min_pct': 0.012138395898470796, 'atr_max_pct': 0.07344668909378409, 'tp_mult': 2.495331638242549, 'tsl_mult': 0.6684773497083625, 'strategy': 'breakout', 'time_stop': 252, 'use_sma': False, 'use_atr': False, 'use_adx': False, 'use_ema': False, 'use_spike': True, 'rsi_required': True, 'edge_k': 0.3636920980723183, 'edge_cap': 0.054172305105984586}.
[I 2025-08-29 18:39:37,222] Trial 88 finished with values: [-1000000000.0, 1000000000.0] and parameters: {'p_sma': 13, 'p_std': 10, 'p_atr': 9, 'p_adx': 26, 'rsi_period': 52, 'ema1': 8, 'ema2': 32, 'slip_atr_k': 0.16540627621884113, 'slip_spread_k': 0.9620094189405154, 'spread_hl_frac': 0.01903305586682321, 'bb_std_mult': 1.744897128575968, 'rsi_os': 15, 'rsi_ob': 62, 'vol_spike': 0.1917986190962927, 'adx_thresh': 10.187799631274096, 'atr_min_pct': 0.021995898167518964, 'atr_max_pct': 0.07291243442869524, 'tp_mult': 2.0443610794438665, 'tsl_mult': 0.2530707901507132, 'strategy': 'breakout', 'time_stop': 159, 'use_sma': False, 'use_atr': False, 'use_adx': False, 'use_ema': False, 'use_spike': True, 'rsi_required': True, 'edge_k': 0.7165307816462911, 'edge_cap': 0.11644696962207479}.
[I 2025-08-29 18:39:37,322] Trial 89 finished with values: [-1000000000.0, 1000000000.0] and parameters: {'p_sma': 14, 'p_std': 10, 'p_atr': 15, 'p_adx': 26, 'rsi_period': 29, 'ema1': 10, 'ema2': 34, 'slip_atr_k': 0.1619613576385708, 'slip_spread_k': 0.4596328547072934, 'spread_hl_frac': 0.040136003230030394, 'bb_std_mult': 1.3697440152956843, 'rsi_os': 10, 'rsi_ob': 56, 'vol_spike': 0.21286070590296483, 'adx_thresh': 26.601026295704592, 'atr_min_pct': 0.021778252771180825, 'atr_max_pct': 0.07426675628211435, 'tp_mult': 2.0446307942250885, 'tsl_mult': 0.2661334732201164, 'strategy': 'breakout', 'time_stop': 254, 'use_sma': False, 'use_atr': False, 'use_adx': False, 'use_ema': False, 'use_spike': True, 'rsi_required': True, 'edge_k': 0.35759001855355727, 'edge_cap': 0.9423980911149739}.
[I 2025-08-29 18:39:37,347] Trial 90 finished with values: [-1000000000.0, 1000000000.0] and parameters: {'p_sma': 50, 'p_std': 10, 'p_atr': 28, 'p_adx': 26, 'rsi_period': 56, 'ema1': 8, 'ema2': 32, 'slip_atr_k': 0.1724599015932304, 'slip_spread_k': 0.5229555832386351, 'spread_hl_frac': 0.0147441446763251, 'bb_std_mult': 1.367377830775721, 'rsi_os': 9, 'rsi_ob': 62, 'vol_spike': 0.19269432253207253, 'adx_thresh': 26.38583340820017, 'atr_min_pct': 0.021476546204177202, 'atr_max_pct': 0.09076168388932387, 'tp_mult': 2.6393026798277535, 'tsl_mult': 0.854503280007656, 'strategy': 'mean_reversion', 'time_stop': 257, 'use_sma': False, 'use_atr': False, 'use_adx': False, 'use_ema': False, 'use_spike': True, 'rsi_required': True, 'edge_k': 0.5134473324556615, 'edge_cap': 0.10760896755761606}.
[I 2025-08-29 18:39:37,497] Trial 91 finished with values: [-1000000000.0, 1000000000.0] and parameters: {'p_sma': 15, 'p_std': 10, 'p_atr': 19, 'p_adx': 26, 'rsi_period': 56, 'ema1': 8, 'ema2': 16, 'slip_atr_k': 0.16114573555873646, 'slip_spread_k': 0.9700516136736599, 'spread_hl_frac': 0.0403075645822297, 'bb_std_mult': 1.7036375008776177, 'rsi_os': 10, 'rsi_ob': 80, 'vol_spike': 0.012530910387195338, 'adx_thresh': 19.277500699053878, 'atr_min_pct': 0.021888467983988302, 'atr_max_pct': 0.06266078622001794, 'tp_mult': 2.6490527188260167, 'tsl_mult': 0.24804306250636182, 'strategy': 'mean_reversion', 'time_stop': 159, 'use_sma': True, 'use_atr': False, 'use_adx': True, 'use_ema': True, 'use_spike': False, 'rsi_required': False, 'edge_k': 0.7001573434853472, 'edge_cap': 0.13559618304032295}.
[I 2025-08-29 18:40:05,724] Trial 94 finished with values: [-1000000000.0, 1000000000.0] and parameters: {'p_sma': 9, 'p_std': 6, 'p_atr': 18, 'p_adx': 18, 'rsi_period': 79, 'ema1': 12, 'ema2': 41, 'slip_atr_k': 0.039642578368833725, 'slip_spread_k': 0.6051299991328145, 'spread_hl_frac': 0.02628733613740867, 'bb_std_mult': 1.2668392119411538, 'rsi_os': 21, 'rsi_ob': 68, 'vol_spike': 0.22687379354292905, 'adx_thresh': 19.15150500708745, 'atr_min_pct': 0.003259568494498998, 'atr_max_pct': 0.062275781546313067, 'tp_mult': 2.8392660363722415, 'tsl_mult': 0.7274697064870241, 'strategy': 'mean_reversion', 'time_stop': 76, 'use_sma': True, 'use_atr': True, 'use_adx': True, 'use_ema': True, 'use_spike': False, 'rsi_required': False, 'edge_k': 0.6672101246666184, 'edge_cap': 0.4513450446887113}.
[I 2025-08-29 18:40:05,823] Trial 93 finished with values: [-1000000000.0, 1000000000.0] and parameters: {'p_sma': 17, 'p_std': 13, 'p_atr': 18, 'p_adx': 18, 'rsi_period': 56, 'ema1': 18, 'ema2': 17, 'slip_atr_k': 0.11087303955303607, 'slip_spread_k': 0.6053753039037214, 'spread_hl_frac': 0.014639231927742948, 'bb_std_mult': 1.2327493212858194, 'rsi_os': 21, 'rsi_ob': 76, 'vol_spike': 0.15956513488336668, 'adx_thresh': 19.199648539296632, 'atr_min_pct': 0.029961610291404265, 'atr_max_pct': 0.09039046772407124, 'tp_mult': 1.0769161770668148, 'tsl_mult': 0.7301905536746776, 'strategy': 'mean_reversion', 'time_stop': 271, 'use_sma': True, 'use_atr': True, 'use_adx': True, 'use_ema': True, 'use_spike': False, 'rsi_required': False, 'edge_k': 0.6822322646349342, 'edge_cap': 0.5943114222498258}.
[I 2025-08-29 18:40:05,975] Trial 92 finished with values: [-1000000000.0, 1000000000.0] and parameters: {'p_sma': 15, 'p_std': 16, 'p_atr': 18, 'p_adx': 18, 'rsi_period': 79, 'ema1': 21, 'ema2': 36, 'slip_atr_k': 0.03985124505931007, 'slip_spread_k': 0.6078925729382623, 'spread_hl_frac': 0.016750330080429386, 'bb_std_mult': 1.2274026896970072, 'rsi_os': 21, 'rsi_ob': 55, 'vol_spike': 0.2573264582969089, 'adx_thresh': 19.17255009417716, 'atr_min_pct': 0.024685424973373376, 'atr_max_pct': 0.0646708490023115, 'tp_mult': 2.8304022795488755, 'tsl_mult': 0.5352552419535554, 'strategy': 'mean_reversion', 'time_stop': 253, 'use_sma': True, 'use_atr': False, 'use_adx': True, 'use_ema': True, 'use_spike': False, 'rsi_required': False, 'edge_k': 0.4283534913890492, 'edge_cap': 0.602935249123542}.
[I 2025-08-29 18:40:05,976] Trial 95 finished with values: [-1000000000.0, 1000000000.0] and parameters: {'p_sma': 9, 'p_std': 47, 'p_atr': 26, 'p_adx': 18, 'rsi_period': 74, 'ema1': 12, 'ema2': 11, 'slip_atr_k': 0.1416795334299038, 'slip_spread_k': 0.7333872669687551, 'spread_hl_frac': 0.027398607976680037, 'bb_std_mult': 1.24742411746477, 'rsi_os': 21, 'rsi_ob': 68, 'vol_spike': 0.22779222918995543, 'adx_thresh': 16.491222309907446, 'atr_min_pct': 0.002974224177704894, 'atr_max_pct': 0.06593829272279648, 'tp_mult': 2.235113669590776, 'tsl_mult': 0.5222081140325601, 'strategy': 'mean_reversion', 'time_stop': 138, 'use_sma': True, 'use_atr': True, 'use_adx': True, 'use_ema': True, 'use_spike': False, 'rsi_required': False, 'edge_k': 1.3578433347008745, 'edge_cap': 0.4488221127468224}.
[I 2025-08-29 18:40:34,170] Trial 96 finished with values: [-1000000000.0, 1000000000.0] and parameters: {'p_sma': 43, 'p_std': 45, 'p_atr': 25, 'p_adx': 9, 'rsi_period': 39, 'ema1': 12, 'ema2': 11, 'slip_atr_k': 0.027910577983429396, 'slip_spread_k': 0.7568696721453527, 'spread_hl_frac': 0.027799762148298792, 'bb_std_mult': 0.507451462423788, 'rsi_os': 23, 'rsi_ob': 68, 'vol_spike': 0.21736918295056853, 'adx_thresh': 16.11211162073608, 'atr_min_pct': 0.0056743653503333194, 'atr_max_pct': 0.0776252506489953, 'tp_mult': 2.403556978789923, 'tsl_mult': 0.5264406597254238, 'strategy': 'mean_reversion', 'time_stop': 225, 'use_sma': True, 'use_atr': False, 'use_adx': True, 'use_ema': True, 'use_spike': False, 'rsi_required': False, 'edge_k': 0.7948419205603379, 'edge_cap': 0.48486949088909576}.
[I 2025-08-29 18:40:34,336] Trial 99 finished with values: [-1000000000.0, 1000000000.0] and parameters: {'p_sma': 60, 'p_std': 36, 'p_atr': 25, 'p_adx': 16, 'rsi_period': 25, 'ema1': 26, 'ema2': 14, 'slip_atr_k': 0.017077183259622347, 'slip_spread_k': 0.8333977831375581, 'spread_hl_frac': 0.0044164702364686646, 'bb_std_mult': 0.5121862524113485, 'rsi_os': 23, 'rsi_ob': 65, 'vol_spike': 0.1287864477064084, 'adx_thresh': 25.086184574366644, 'atr_min_pct': 0.00555669697815564, 'atr_max_pct': 0.08670864142244367, 'tp_mult': 2.40221814887884, 'tsl_mult': 0.6305136026914555, 'strategy': 'mean_reversion', 'time_stop': 281, 'use_sma': True, 'use_atr': False, 'use_adx': True, 'use_ema': True, 'use_spike': False, 'rsi_required': False, 'edge_k': 0.8026162413303499, 'edge_cap': 0.48709823223591}.
[I 2025-08-29 18:40:34,540] Trial 97 finished with values: [-1000000000.0, 1000000000.0] and parameters: {'p_sma': 19, 'p_std': 8, 'p_atr': 8, 'p_adx': 8, 'rsi_period': 36, 'ema1': 26, 'ema2': 14, 'slip_atr_k': 0.030503036397718904, 'slip_spread_k': 0.7428771623908432, 'spread_hl_frac': 0.0042517415473745865, 'bb_std_mult': 3.0510892866541295, 'rsi_os': 23, 'rsi_ob': 72, 'vol_spike': 0.21751026441121585, 'adx_thresh': 30.8368942554786, 'atr_min_pct': 0.005837383073870422, 'atr_max_pct': 0.08121131244405524, 'tp_mult': 2.417321440071914, 'tsl_mult': 0.5713687588087039, 'strategy': 'mean_reversion', 'time_stop': 225, 'use_sma': True, 'use_atr': False, 'use_adx': True, 'use_ema': True, 'use_spike': False, 'rsi_required': False, 'edge_k': 1.781781966296689, 'edge_cap': 0.5150350165963412}.
[I 2025-08-29 18:40:34,540] Trial 98 finished with values: [-1000000000.0, 1000000000.0] and parameters: {'p_sma': 44, 'p_std': 37, 'p_atr': 25, 'p_adx': 20, 'rsi_period': 22, 'ema1': 26, 'ema2': 14, 'slip_atr_k': 0.03031865101298938, 'slip_spread_k': 0.7523879136283464, 'spread_hl_frac': 0.028746259298226162, 'bb_std_mult': 3.060406448756031, 'rsi_os': 23, 'rsi_ob': 72, 'vol_spike': 0.12769700133453776, 'adx_thresh': 30.75847611676612, 'atr_min_pct': 0.005487245352063554, 'atr_max_pct': 0.08704343340544819, 'tp_mult': 2.3197960793742713, 'tsl_mult': 0.6305151411018024, 'strategy': 'mean_reversion', 'time_stop': 300, 'use_sma': True, 'use_atr': False, 'use_adx': True, 'use_ema': True, 'use_spike': False, 'rsi_required': False, 'edge_k': 0.798831408678645, 'edge_cap': 0.47804779559676125}.
[I 2025-08-29 18:40:34,650] Trial 100 finished with values: [-1000000000.0, 1000000000.0] and parameters: {'p_sma': 18, 'p_std': 53, 'p_atr': 28, 'p_adx': 16, 'rsi_period': 44, 'ema1': 24, 'ema2': 58, 'slip_atr_k': 0.016231845694082876, 'slip_spread_k': 0.31761062098989135, 'spread_hl_frac': 0.005246220448303189, 'bb_std_mult': 3.057528031948289, 'rsi_os': 51, 'rsi_ob': 72, 'vol_spike': 0.18106734814962533, 'adx_thresh': 24.956036418598966, 'atr_min_pct': 0.015777359960426753, 'atr_max_pct': 0.0796797956442417, 'tp_mult': 2.306579965644856, 'tsl_mult': 0.4884268014881064, 'strategy': 'mean_reversion', 'time_stop': 284, 'use_sma': True, 'use_atr': False, 'use_adx': True, 'use_ema': True, 'use_spike': False, 'rsi_required': False, 'edge_k': 1.7909274974393838, 'edge_cap': 0.4177492832898302}.
[I 2025-08-29 18:41:02,173] Trial 104 finished with values: [-1000000000.0, 1000000000.0] and parameters: {'p_sma': 12, 'p_std': 58, 'p_atr': 26, 'p_adx': 24, 'rsi_period': 60, 'ema1': 13, 'ema2': 51, 'slip_atr_k': 0.049132885342826824, 'slip_spread_k': 0.675046575272771, 'spread_hl_frac': 0.001536315025941818, 'bb_std_mult': 1.6294520456523711, 'rsi_os': 25, 'rsi_ob': 66, 'vol_spike': 0.08280613357257999, 'adx_thresh': 22.448202360920497, 'atr_min_pct': 0.004129643925083099, 'atr_max_pct': 0.11093712494046937, 'tp_mult': 1.879532424082078, 'tsl_mult': 0.9578877318833285, 'strategy': 'breakout', 'time_stop': 32, 'use_sma': False, 'use_atr': True, 'use_adx': True, 'use_ema': False, 'use_spike': False, 'rsi_required': True, 'edge_k': 0.6042824222341259, 'edge_cap': 0.35810583735748625}.
[I 2025-08-29 18:41:02,775] Trial 103 finished with values: [-0.08796532956076897, 0.08795296683263543] and parameters: {'p_sma': 16, 'p_std': 7, 'p_atr': 11, 'p_adx': 22, 'rsi_period': 27, 'ema1': 13, 'ema2': 12, 'slip_atr_k': 0.053583689127051096, 'slip_spread_k': 0.8881827637011077, 'spread_hl_frac': 0.0013507399428533753, 'bb_std_mult': 1.0872909319189428, 'rsi_os': 48, 'rsi_ob': 67, 'vol_spike': 0.1834750419101293, 'adx_thresh': 23.096913816881816, 'atr_min_pct': 0.0016290856767512268, 'atr_max_pct': 0.023180652079387888, 'tp_mult': 2.7178238627149414, 'tsl_mult': 0.21228505146822746, 'strategy': 'breakout', 'time_stop': 214, 'use_sma': False, 'use_atr': True, 'use_adx': True, 'use_ema': True, 'use_spike': False, 'rsi_required': True, 'edge_k': 0.6232176315538437, 'edge_cap': 0.2255664106553915}.
[I 2025-08-29 18:41:02,799] Trial 101 finished with values: [-1000000000.0, 1000000000.0] and parameters: {'p_sma': 19, 'p_std': 55, 'p_atr': 8, 'p_adx': 22, 'rsi_period': 48, 'ema1': 13, 'ema2': 58, 'slip_atr_k': 0.04975225504249796, 'slip_spread_k': 0.675350060097677, 'spread_hl_frac': 0.031842709137120465, 'bb_std_mult': 1.6294740227439422, 'rsi_os': 25, 'rsi_ob': 71, 'vol_spike': 0.10583114061669906, 'adx_thresh': 23.20526872737824, 'atr_min_pct': 0.0016998475015083125, 'atr_max_pct': 0.13471948616722335, 'tp_mult': 2.570249449607108, 'tsl_mult': 0.5707425193726234, 'strategy': 'mean_reversion', 'time_stop': 215, 'use_sma': True, 'use_atr': False, 'use_adx': True, 'use_ema': True, 'use_spike': False, 'rsi_required': False, 'edge_k': 1.8099163024950564, 'edge_cap': 0.5144826406296102}.
[I 2025-08-29 18:41:02,962] Trial 102 finished with values: [-0.042230640160209054, 0.042211461174946625] and parameters: {'p_sma': 16, 'p_std': 56, 'p_atr': 23, 'p_adx': 22, 'rsi_period': 44, 'ema1': 13, 'ema2': 50, 'slip_atr_k': 0.00466351955744293, 'slip_spread_k': 0.8844166075097268, 'spread_hl_frac': 0.03193250171126653, 'bb_std_mult': 1.0986122807905225, 'rsi_os': 47, 'rsi_ob': 67, 'vol_spike': 0.1838383418151305, 'adx_thresh': 14.246705461476285, 'atr_min_pct': 0.0016939666548310148, 'atr_max_pct': 0.1360888544342806, 'tp_mult': 2.5875201858401278, 'tsl_mult': 0.9651102716493094, 'strategy': 'breakout', 'time_stop': 199, 'use_sma': False, 'use_atr': True, 'use_adx': True, 'use_ema': True, 'use_spike': False, 'rsi_required': True, 'edge_k': 1.5789634876569087, 'edge_cap': 0.42666684249238884}.
[I 2025-08-29 18:41:03,073] Trial 108 finished with values: [-1000000000.0, 1000000000.0] and parameters: {'p_sma': 10, 'p_std': 6, 'p_atr': 29, 'p_adx': 25, 'rsi_period': 35, 'ema1': 29, 'ema2': 19, 'slip_atr_k': 0.22423404240305747, 'slip_spread_k': 0.5290796194280718, 'spread_hl_frac': 0.02134580114997338, 'bb_std_mult': 1.4597808462612565, 'rsi_os': 5, 'rsi_ob': 48, 'vol_spike': 0.039768718250218174, 'adx_thresh': 8.229636171304454, 'atr_min_pct': 0.0005090429931615748, 'atr_max_pct': 0.07647685378810308, 'tp_mult': 2.9600461977981007, 'tsl_mult': 0.8049396656979466, 'strategy': 'mean_reversion', 'time_stop': 268, 'use_sma': True, 'use_atr': False, 'use_adx': False, 'use_ema': False, 'use_spike': True, 'rsi_required': False, 'edge_k': 0.20311730172600356, 'edge_cap': 0.998604541538404}.
[I 2025-08-29 18:41:30,855] Trial 105 finished with values: [-0.028181992510462606, 0.028176304236734482] and parameters: {'p_sma': 17, 'p_std': 7, 'p_atr': 29, 'p_adx': 19, 'rsi_period': 12, 'ema1': 10, 'ema2': 19, 'slip_atr_k': 0.1377088580356009, 'slip_spread_k': 0.5115564565705133, 'spread_hl_frac': 0.021389088429641972, 'bb_std_mult': 1.797853741119026, 'rsi_os': 5, 'rsi_ob': 69, 'vol_spike': 0.10678616716503686, 'adx_thresh': 8.603387567777657, 'atr_min_pct': 0.0017058949455523893, 'atr_max_pct': 0.13521321974370293, 'tp_mult': 2.7153573647568043, 'tsl_mult': 0.15803438399421754, 'strategy': 'breakout', 'time_stop': 213, 'use_sma': False, 'use_atr': False, 'use_adx': True, 'use_ema': True, 'use_spike': False, 'rsi_required': True, 'edge_k': 0.7396165672461583, 'edge_cap': 0.9927976752408393}.
[I 2025-08-29 18:41:31,774] Trial 107 finished with values: [-0.04259026996605808, 0.04257735722267004] and parameters: {'p_sma': 35, 'p_std': 6, 'p_atr': 13, 'p_adx': 10, 'rsi_period': 84, 'ema1': 12, 'ema2': 19, 'slip_atr_k': 0.13805695183426916, 'slip_spread_k': 0.08811599479062754, 'spread_hl_frac': 0.007445469371966894, 'bb_std_mult': 1.789202597118352, 'rsi_os': 5, 'rsi_ob': 64, 'vol_spike': 0.03184450839115413, 'adx_thresh': 17.063961661804115, 'atr_min_pct': 0.0004704392001691753, 'atr_max_pct': 0.10030805349213819, 'tp_mult': 1.9054698981712461, 'tsl_mult': 0.15390548860941622, 'strategy': 'mean_reversion', 'time_stop': 271, 'use_sma': True, 'use_atr': False, 'use_adx': False, 'use_ema': False, 'use_spike': True, 'rsi_required': False, 'edge_k': 1.5910762457442722, 'edge_cap': 0.3853962450535014}.
