[I 2025-08-29 18:35:17,880] Trial 52 finished with values: [-1000000000.0, 1000000000.0] and parameters: {'p_sma': 38, 'p_std': 8, 'p_atr': 30, 'p_adx': 23, 'rsi_period': 41, 'ema1': 11, 'ema2': 11, 'slip_atr_k': 0.032921484955182136, 'slip_spread_k': 0.7667686006977126, 'spread_hl_frac': 0.014888867992400084, 'bb_std_mult': 1.4966611581537037, 'rsi_os': 45, 'rsi_ob': 64, 'vol_spike': 0.19060901463350483, 'adx_thresh': 25.503049257229033, 'atr_min_pct': 0.0024606139810598986, 'atr_max_pct': 0.07723093342241187, 'tp_mult': 2.152862799510549, 'tsl_mult': 0.5449464463062383, 'strategy': 'mean_reversion', 'time_stop': 212, 'use_sma': True, 'use_atr': False, 'use_adx': False, 'use_ema': True, 'use_spike': True, 'rsi_required': False, 'edge_k': 0.7513300937782089, 'edge_cap': 0.44211067381169145}.
[I 2025-08-29 18:35:45,754] Trial 55 finished with values: [-1000000000.0, 1000000000.0] and parameters: {'p_sma': 32, 'p_std': 8, 'p_atr': 28, 'p_adx': 24, 'rsi_period': 19, 'ema1': 9, 'ema2': 21, 'slip_atr_k': 0.028238657682592636, 'slip_spread_k': 0.5535425394727902, 'spread_hl_frac': 0.01576660031191107, 'bb_std_mult': 2.878333585313677, 'rsi_os': 45, 'rsi_ob': 77, 'vol_spike': 0.185758958461532, 'adx_thresh': 21.55632196095693, 'atr_min_pct': 0.0022722143212502437, 'atr_max_pct': 0.07669077245473903, 'tp_mult': 2.1174072834404503, 'tsl_mult': 0.29843165883134015, 'strategy': 'mean_reversion', 'time_stop': 205, 'use_sma': True, 'use_atr': False, 'use_adx': False, 'use_ema': True, 'use_spike': False, 'rsi_required': False, 'edge_k': 0.7750628223769782, 'edge_cap': 0.419818735826429}.
[I 2025-08-29 18:35:46,310] Trial 57 finished with values: [-1000000000.0, 1000000000.0] and parameters: {'p_sma': 37, 'p_std': 55, 'p_atr': 28, 'p_adx': 24, 'rsi_period': 17, 'ema1': 8, 'ema2': 16, 'slip_atr_k': 0.03709254094656829, 'slip_spread_k': 0.8466139692826664, 'spread_hl_frac': 0.005686778452413662, 'bb_std_mult': 1.1624257193497132, 'rsi_os': 49, 'rsi_ob': 69, 'vol_spike': 0.2329049098830242, 'adx_thresh': 22.62778049238033, 'atr_min_pct': 0.0019595126064780085, 'atr_max_pct': 0.10452443334766254, 'tp_mult': 2.36377746379673, 'tsl_mult': 0.3159475697158798, 'strategy': 'mean_reversion', 'time_stop': 244, 'use_sma': True, 'use_atr': True, 'use_adx': False, 'use_ema': True, 'use_spike': False, 'rsi_required': False, 'edge_k': 0.7799854296961232, 'edge_cap': 0.5747673337536149}.
[I 2025-08-29 18:35:46,396] Trial 56 finished with values: [-1000000000.0, 1000000000.0] and parameters: {'p_sma': 31, 'p_std': 8, 'p_atr': 28, 'p_adx': 24, 'rsi_period': 20, 'ema1': 10, 'ema2': 18, 'slip_atr_k': 0.03533270745692204, 'slip_spread_k': 0.8882455547417205, 'spread_hl_frac': 0.01093498241904259, 'bb_std_mult': 2.8929622854350985, 'rsi_os': 10, 'rsi_ob': 89, 'vol_spike': 0.18439930588088474, 'adx_thresh': 21.976919841956242, 'atr_min_pct': 0.0021208344531017673, 'atr_max_pct': 0.12498682059850746, 'tp_mult': 2.1406864831202492, 'tsl_mult': 0.1982007717475585, 'strategy': 'mean_reversion', 'time_stop': 245, 'use_sma': True, 'use_atr': False, 'use_adx': True, 'use_ema': True, 'use_spike': False, 'rsi_required': False, 'edge_k': 0.7232485874932426, 'edge_cap': 0.3368275572912175}.
[I 2025-08-29 18:35:46,484] Trial 58 finished with values: [-1000000000.0, 1000000000.0] and parameters: {'p_sma': 31, 'p_std': 7, 'p_atr': 27, 'p_adx': 25, 'rsi_period': 19, 'ema1': 9, 'ema2': 18, 'slip_atr_k': 0.00029723034385512395, 'slip_spread_k': 0.8629023167086769, 'spread_hl_frac': 0.005951591194279522, 'bb_std_mult': 1.1682716634002872, 'rsi_os': 24, 'rsi_ob': 69, 'vol_spike': 0.2976474005222946, 'adx_thresh': 22.40044166120023, 'atr_min_pct': 0.001727430093345392, 'atr_max_pct': 0.10826915088902316, 'tp_mult': 2.3663141860465307, 'tsl_mult': 0.2887941017335909, 'strategy': 'mean_reversion', 'time_stop': 239, 'use_sma': True, 'use_atr': True, 'use_adx': True, 'use_ema': True, 'use_spike': False, 'rsi_required': False, 'edge_k': 0.405052995373695, 'edge_cap': 0.3432356730243067}.
[I 2025-08-29 18:36:14,822] Trial 61 finished with values: [-1000000000.0, 1000000000.0] and parameters: {'p_sma': 53, 'p_std': 15, 'p_atr': 22, 'p_adx': 21, 'rsi_period': 8, 'ema1': 14, 'ema2': 25, 'slip_atr_k': 0.06885224877879777, 'slip_spread_k': 0.7115499732812127, 'spread_hl_frac': 0.007189718516812736, 'bb_std_mult': 3.2420879470008335, 'rsi_os': 24, 'rsi_ob': 95, 'vol_spike': 0.28165754551603017, 'adx_thresh': 24.46900629567005, 'atr_min_pct': 0.00486285293337963, 'atr_max_pct': 0.10486332434235485, 'tp_mult': 1.9871007822805442, 'tsl_mult': 0.4791709902039612, 'strategy': 'mean_reversion', 'time_stop': 176, 'use_sma': True, 'use_atr': True, 'use_adx': True, 'use_ema': True, 'use_spike': False, 'rsi_required': False, 'edge_k': 0.38264004999590806, 'edge_cap': 0.37483961947356226}.
[I 2025-08-29 18:36:14,927] Trial 59 finished with values: [-1000000000.0, 1000000000.0] and parameters: {'p_sma': 52, 'p_std': 56, 'p_atr': 27, 'p_adx': 20, 'rsi_period': 10, 'ema1': 14, 'ema2': 18, 'slip_atr_k': 0.06769363972171949, 'slip_spread_k': 0.8597274464385447, 'spread_hl_frac': 0.010915030677528841, 'bb_std_mult': 1.1274570858185746, 'rsi_os': 48, 'rsi_ob': 89, 'vol_spike': 0.2351725098507848, 'adx_thresh': 27.502627481968382, 'atr_min_pct': 0.005219191753850515, 'atr_max_pct': 0.10234846348021971, 'tp_mult': 2.3644648338189644, 'tsl_mult': 0.1453725358246386, 'strategy': 'mean_reversion', 'time_stop': 243, 'use_sma': True, 'use_atr': True, 'use_adx': True, 'use_ema': True, 'use_spike': False, 'rsi_required': False, 'edge_k': 1.2632170375673424, 'edge_cap': 0.35468412387553483}.
[I 2025-08-29 18:36:15,025] Trial 60 finished with values: [-1000000000.0, 1000000000.0] and parameters: {'p_sma': 31, 'p_std': 27, 'p_atr': 23, 'p_adx': 20, 'rsi_period': 11, 'ema1': 14, 'ema2': 19, 'slip_atr_k': 0.002017670851066005, 'slip_spread_k': 0.6945054716368539, 'spread_hl_frac': 0.011140093394044637, 'bb_std_mult': 3.238321362258381, 'rsi_os': 24, 'rsi_ob': 89, 'vol_spike': 0.29464141358637713, 'adx_thresh': 24.480705790565928, 'atr_min_pct': 0.0013966574459558386, 'atr_max_pct': 0.1302567090035372, 'tp_mult': 1.9550922406183435, 'tsl_mult': 0.1940549435765624, 'strategy': 'mean_reversion', 'time_stop': 170, 'use_sma': True, 'use_atr': True, 'use_adx': True, 'use_ema': True, 'use_spike': False, 'rsi_required': False, 'edge_k': 1.3149560300596446, 'edge_cap': 0.37318476886534757}.
[I 2025-08-29 18:36:15,197] Trial 62 finished with values: [-1000000000.0, 1000000000.0] and parameters: {'p_sma': 53, 'p_std': 27, 'p_atr': 23, 'p_adx': 29, 'rsi_period': 8, 'ema1': 14, 'ema2': 15, 'slip_atr_k': 0.0658879357980823, 'slip_spread_k': 0.7122988825668991, 'spread_hl_frac': 0.01755113176450795, 'bb_std_mult': 3.1864849929969994, 'rsi_os': 35, 'rsi_ob': 85, 'vol_spike': 0.1570403708004587, 'adx_thresh': 24.26455328238595, 'atr_min_pct': 0.006900017217417285, 'atr_max_pct': 0.0963087312160303, 'tp_mult': 1.9711508675159028, 'tsl_mult': 0.46184466236134375, 'strategy': 'mean_reversion', 'time_stop': 166, 'use_sma': True, 'use_atr': True, 'use_adx': True, 'use_ema': True, 'use_spike': False, 'rsi_required': False, 'edge_k': 1.2958715699384187, 'edge_cap': 0.49921598277620594}.
[I 2025-08-29 18:36:43,082] Trial 63 finished with values: [-1000000000.0, 1000000000.0] and parameters: {'p_sma': 21, 'p_std': 11, 'p_atr': 26, 'p_adx': 29, 'rsi_period': 31, 'ema1': 17, 'ema2': 14, 'slip_atr_k': 0.23091913138736025, 'slip_spread_k': 0.7122063736652964, 'spread_hl_frac': 0.017708574298191372, 'bb_std_mult': 2.591632340955111, 'rsi_os': 30, 'rsi_ob': 84, 'vol_spike': 0.17227088922010206, 'adx_thresh': 17.415456186323084, 'atr_min_pct': 0.0034452992488844883, 'atr_max_pct': 0.09711003332663919, 'tp_mult': 1.8244066406921156, 'tsl_mult': 0.3706720902800809, 'strategy': 'mean_reversion', 'time_stop': 158, 'use_sma': True, 'use_atr': False, 'use_adx': True, 'use_ema': True, 'use_spike': False, 'rsi_required': False, 'edge_k': 0.5501925309398873, 'edge_cap': 0.5022807802947994}.
[I 2025-08-29 18:36:43,298] Trial 65 finished with values: [-1000000000.0, 1000000000.0] and parameters: {'p_sma': 22, 'p_std': 11, 'p_atr': 26, 'p_adx': 29, 'rsi_period': 35, 'ema1': 17, 'ema2': 15, 'slip_atr_k': 0.020952410343370434, 'slip_spread_k': 0.7235619297254723, 'spread_hl_frac': 0.01773902275443118, 'bb_std_mult': 1.587558216225106, 'rsi_os': 30, 'rsi_ob': 82, 'vol_spike': 0.16792553103502958, 'adx_thresh': 17.990256639966816, 'atr_min_pct': 0.0036193398388917122, 'atr_max_pct': 0.09517290350532318, 'tp_mult': 1.7955056790881057, 'tsl_mult': 0.44564539975691847, 'strategy': 'mean_reversion', 'time_stop': 260, 'use_sma': True, 'use_atr': False, 'use_adx': True, 'use_ema': True, 'use_spike': False, 'rsi_required': False, 'edge_k': 0.5750816289637903, 'edge_cap': 0.5027125347024366}.
[I 2025-08-29 18:36:43,542] Trial 64 finished with values: [-1000000000.0, 1000000000.0] and parameters: {'p_sma': 20, 'p_std': 34, 'p_atr': 25, 'p_adx': 30, 'rsi_period': 33, 'ema1': 17, 'ema2': 15, 'slip_atr_k': 0.020520900238920173, 'slip_spread_k': 0.7167400950636375, 'spread_hl_frac': 0.017782221318130002, 'bb_std_mult': 2.5758127957285604, 'rsi_os': 29, 'rsi_ob': 83, 'vol_spike': 0.17227155032017039, 'adx_thresh': 18.19853671850386, 'atr_min_pct': 0.006916160071212087, 'atr_max_pct': 0.09425301674215815, 'tp_mult': 1.8642119457691635, 'tsl_mult': 0.693810014940755, 'strategy': 'mean_reversion', 'time_stop': 264, 'use_sma': True, 'use_atr': False, 'use_adx': True, 'use_ema': True, 'use_spike': False, 'rsi_required': False, 'edge_k': 0.5690362474852723, 'edge_cap': 0.488253662838171}.
[I 2025-08-29 18:36:43,668] Trial 66 finished with values: [-1000000000.0, 1000000000.0] and parameters: {'p_sma': 23, 'p_std': 11, 'p_atr': 26, 'p_adx': 22, 'rsi_period': 29, 'ema1': 17, 'ema2': 13, 'slip_atr_k': 0.01932534156513238, 'slip_spread_k': 0.928476484677601, 'spread_hl_frac': 0.0002889329823505572, 'bb_std_mult': 2.5561110221749352, 'rsi_os': 19, 'rsi_ob': 82, 'vol_spike': 0.1737561553918726, 'adx_thresh': 17.91910194762471, 'atr_min_pct': 0.0036433577242874363, 'atr_max_pct': 0.07247160597434807, 'tp_mult': 1.8138935585289864, 'tsl_mult': 0.6969581217543546, 'strategy': 'mean_reversion', 'time_stop': 259, 'use_sma': True, 'use_atr': False, 'use_adx': True, 'use_ema': True, 'use_spike': False, 'rsi_required': False, 'edge_k': 0.5860029802102854, 'edge_cap': 0.5667753127514273}.
[I 2025-08-29 18:37:11,834] Trial 68 finished with values: [-1000000000.0, 1000000000.0] and parameters: {'p_sma': 16, 'p_std': 14, 'p_atr': 25, 'p_adx': 18, 'rsi_period': 83, 'ema1': 7, 'ema2': 12, 'slip_atr_k': 0.04504470457905542, 'slip_spread_k': 0.9152022198433023, 'spread_hl_frac': 0.013182735927496522, 'bb_std_mult': 1.4205614891543448, 'rsi_os': 19, 'rsi_ob': 92, 'vol_spike': 0.2690229445019353, 'adx_thresh': 27.979519035563722, 'atr_min_pct': 0.016769868226079888, 'atr_max_pct': 0.0354209879553171, 'tp_mult': 1.2831582709058391, 'tsl_mult': 0.6147987941721744, 'strategy': 'mean_reversion', 'time_stop': 130, 'use_sma': True, 'use_atr': False, 'use_adx': True, 'use_ema': True, 'use_spike': False, 'rsi_required': False, 'edge_k': 0.958844890257962, 'edge_cap': 0.5643300286287182}.
[I 2025-08-29 18:37:12,382] Trial 69 finished with values: [-1000000000.0, 1000000000.0] and parameters: {'p_sma': 24, 'p_std': 5, 'p_atr': 25, 'p_adx': 25, 'rsi_period': 51, 'ema1': 7, 'ema2': 25, 'slip_atr_k': 0.03937249202278473, 'slip_spread_k': 0.9378647096409983, 'spread_hl_frac': 0.013765179594211646, 'bb_std_mult': 2.1734799676284076, 'rsi_os': 19, 'rsi_ob': 77, 'vol_spike': 0.2681284571155496, 'adx_thresh': 28.070251130940758, 'atr_min_pct': 1.7577602176119256e-05, 'atr_max_pct': 0.035580067827855714, 'tp_mult': 1.6642715192832613, 'tsl_mult': 0.6024730887289916, 'strategy': 'mean_reversion', 'time_stop': 233, 'use_sma': True, 'use_atr': False, 'use_adx': True, 'use_ema': True, 'use_spike': False, 'rsi_required': False, 'edge_k': 0.9458044476459293, 'edge_cap': 0.5672133504425553}.
[I 2025-08-29 18:37:12,388] Trial 67 finished with values: [-1000000000.0, 1000000000.0] and parameters: {'p_sma': 15, 'p_std': 34, 'p_atr': 26, 'p_adx': 22, 'rsi_period': 23, 'ema1': 11, 'ema2': 24, 'slip_atr_k': 0.04466954543205445, 'slip_spread_k': 0.9166286053303088, 'spread_hl_frac': 0.012708693541904835, 'bb_std_mult': 1.584890751850378, 'rsi_os': 41, 'rsi_ob': 82, 'vol_spike': 0.14457367227868817, 'adx_thresh': 20.28839961978892, 'atr_min_pct': 0.027241497403305205, 'atr_max_pct': 0.03616429543884113, 'tp_mult': 1.5669242063085722, 'tsl_mult': 0.7051796687438626, 'strategy': 'mean_reversion', 'time_stop': 189, 'use_sma': True, 'use_atr': False, 'use_adx': True, 'use_ema': True, 'use_spike': False, 'rsi_required': False, 'edge_k': 0.953345923076995, 'edge_cap': 0.3017365837973515}.
[I 2025-08-29 18:37:12,751] Trial 70 finished with values: [-1000000000.0, 1000000000.0] and parameters: {'p_sma': 25, 'p_std': 14, 'p_atr': 29, 'p_adx': 25, 'rsi_period': 23, 'ema1': 7, 'ema2': 25, 'slip_atr_k': 0.04592059065977684, 'slip_spread_k': 0.4758468599609652, 'spread_hl_frac': 0.013506224416346739, 'bb_std_mult': 2.2290782363862784, 'rsi_os': 22, 'rsi_ob': 92, 'vol_spike': 0.22307215452860085, 'adx_thresh': 20.190720648435526, 'atr_min_pct': 0.02679836319058388, 'atr_max_pct': 0.04863606980280124, 'tp_mult': 1.6058288527668145, 'tsl_mult': 0.5935399048252744, 'strategy': 'mean_reversion', 'time_stop': 130, 'use_sma': True, 'use_atr': False, 'use_adx': True, 'use_ema': True, 'use_spike': True, 'rsi_required': False, 'edge_k': 0.9209074098322099, 'edge_cap': 0.2977914952490571}.
[I 2025-08-29 18:37:41,959] Trial 72 finished with values: [-1000000000.0, 1000000000.0] and parameters: {'p_sma': 8, 'p_std': 6, 'p_atr': 29, 'p_adx': 8, 'rsi_period': 38, 'ema1': 10, 'ema2': 20, 'slip_atr_k': 0.012350383540569283, 'slip_spread_k': 0.8174571489596396, 'spread_hl_frac': 0.020070887642422278, 'bb_std_mult': 1.6824235708444477, 'rsi_os': 22, 'rsi_ob': 59, 'vol_spike': 0.2217322116308781, 'adx_thresh': 23.12500460313205, 'atr_min_pct': 0.018557819972699896, 'atr_max_pct': 0.04811811302323668, 'tp_mult': 2.067564062090313, 'tsl_mult': 0.5036261731111633, 'strategy': 'mean_reversion', 'time_stop': 197, 'use_sma': True, 'use_atr': True, 'use_adx': False, 'use_ema': True, 'use_spike': True, 'rsi_required': False, 'edge_k': 1.0997184128237867, 'edge_cap': 0.6191576598156884}.
[I 2025-08-29 18:37:42,085] Trial 71 finished with values: [-1000000000.0, 1000000000.0] and parameters: {'p_sma': 25, 'p_std': 5, 'p_atr': 29, 'p_adx': 21, 'rsi_period': 49, 'ema1': 11, 'ema2': 25, 'slip_atr_k': 0.008977890751028183, 'slip_spread_k': 0.4864633208835136, 'spread_hl_frac': 0.020589635909465637, 'bb_std_mult': 2.2120180907291003, 'rsi_os': 22, 'rsi_ob': 78, 'vol_spike': 0.224010528989127, 'adx_thresh': 20.095519922581175, 'atr_min_pct': 0.026234239873754724, 'atr_max_pct': 0.057019760897351404, 'tp_mult': 1.7261763176713187, 'tsl_mult': 0.5072452226352246, 'strategy': 'mean_reversion', 'time_stop': 189, 'use_sma': True, 'use_atr': False, 'use_adx': True, 'use_ema': True, 'use_spike': True, 'rsi_required': False, 'edge_k': 1.1286090378446711, 'edge_cap': 0.30269299725205234}.
[I 2025-08-29 18:37:42,200] Trial 74 finished with values: [-1000000000.0, 1000000000.0] and parameters: {'p_sma': 19, 'p_std': 43, 'p_atr': 28, 'p_adx': 28, 'rsi_period': 46, 'ema1': 15, 'ema2': 20, 'slip_atr_k': 0.009134146415287273, 'slip_spread_k': 0.05868745539040099, 'spread_hl_frac': 0.020089389844513958, 'bb_std_mult': 1.6587231085256036, 'rsi_os': 26, 'rsi_ob': 59, 'vol_spike': 0.24956423606711584, 'adx_thresh': 29.5156591680139, 'atr_min_pct': 0.01848405875666875, 'atr_max_pct': 0.08341616058564835, 'tp_mult': 1.72827277331449, 'tsl_mult': 0.356434866817244, 'strategy': 'mean_reversion', 'time_stop': 193, 'use_sma': True, 'use_atr': True, 'use_adx': False, 'use_ema': True, 'use_spike': True, 'rsi_required': False, 'edge_k': 1.45568715147413, 'edge_cap': 0.40220764218025584}.
[I 2025-08-29 18:37:42,281] Trial 73 finished with values: [-0.0023774524665697294, 0.0023603620432376196] and parameters: {'p_sma': 8, 'p_std': 20, 'p_atr': 29, 'p_adx': 8, 'rsi_period': 46, 'ema1': 15, 'ema2': 20, 'slip_atr_k': 0.07782326956153926, 'slip_spread_k': 0.45963523497375874, 'spread_hl_frac': 0.020279553326612437, 'bb_std_mult': 1.6881231392859029, 'rsi_os': 22, 'rsi_ob': 60, 'vol_spike': 0.20298401327423016, 'adx_thresh': 26.755785850865557, 'atr_min_pct': 0.0010057284082269835, 'atr_max_pct': 0.08416586080048566, 'tp_mult': 1.7360013930517069, 'tsl_mult': 0.5159586120213603, 'strategy': 'mean_reversion', 'time_stop': 193, 'use_sma': True, 'use_atr': True, 'use_adx': False, 'use_ema': True, 'use_spike': True, 'rsi_required': False, 'edge_k': 1.5476391725103118, 'edge_cap': 0.19070947365578433}.
[I 2025-08-29 18:37:42,410] Trial 77 finished with values: [-1000000000.0, 1000000000.0] and parameters: {'p_sma': 56, 'p_std': 41, 'p_atr': 27, 'p_adx': 27, 'rsi_period': 16, 'ema1': 5, 'ema2': 28, 'slip_atr_k': 0.23422665730894, 'slip_spread_k': 0.579052949015029, 'spread_hl_frac': 0.007947765029711945, 'bb_std_mult': 1.3327565847386986, 'rsi_os': 54, 'rsi_ob': 74, 'vol_spike': 0.20185316277188442, 'adx_thresh': 19.01619086675031, 'atr_min_pct': 0.014849383355222057, 'atr_max_pct': 0.08363252540020973, 'tp_mult': 2.195310720198628, 'tsl_mult': 0.6456427668461532, 'strategy': 'mean_reversion', 'time_stop': 147, 'use_sma': True, 'use_atr': False, 'use_adx': True, 'use_ema': True, 'use_spike': False, 'rsi_required': False, 'edge_k': 1.9607367918065863, 'edge_cap': 0.17948268961451286}.
[I 2025-08-29 18:38:10,624] Trial 76 finished with values: [-1000000000.0, 1000000000.0] and parameters: {'p_sma': 19, 'p_std': 42, 'p_atr': 27, 'p_adx': 28, 'rsi_period': 53, 'ema1': 15, 'ema2': 27, 'slip_atr_k': 0.059485679437365824, 'slip_spread_k': 0.05071384069904089, 'spread_hl_frac': 0.009233304136566305, 'bb_std_mult': 0.7822509494583669, 'rsi_os': 26, 'rsi_ob': 87, 'vol_spike': 0.20275139241604725, 'adx_thresh': 34.059128148367854, 'atr_min_pct': 0.004558162886936045, 'atr_max_pct': 0.08258164430346893, 'tp_mult': 1.923332955592703, 'tsl_mult': 0.341546429543876, 'strategy': 'mean_reversion', 'time_stop': 290, 'use_sma': True, 'use_atr': False, 'use_adx': False, 'use_ema': True, 'use_spike': False, 'rsi_required': False, 'edge_k': 1.9455223297461144, 'edge_cap': 0.3973121881525117}.
[I 2025-08-29 18:38:11,484] Trial 78 finished with values: [-1000000000.0, 1000000000.0] and parameters: {'p_sma': 57, 'p_std': 20, 'p_atr': 27, 'p_adx': 19, 'rsi_period': 61, 'ema1': 13, 'ema2': 10, 'slip_atr_k': 0.07624389243546784, 'slip_spread_k': 0.5672603449071268, 'spread_hl_frac': 0.008858124902206294, 'bb_std_mult': 2.415767245278217, 'rsi_os': 26, 'rsi_ob': 74, 'vol_spike': 0.20160071264300777, 'adx_thresh': 26.772729319042885, 'atr_min_pct': 0.005004677553677761, 'atr_max_pct': 0.08436330282572169, 'tp_mult': 1.0121613830653426, 'tsl_mult': 0.052677323434366485, 'strategy': 'mean_reversion', 'time_stop': 230, 'use_sma': True, 'use_atr': False, 'use_adx': True, 'use_ema': True, 'use_spike': False, 'rsi_required': False, 'edge_k': 0.6333003417929397, 'edge_cap': 0.6877527619477926}.
[I 2025-08-29 18:38:11,633] Trial 79 finished with values: [-1000000000.0, 1000000000.0] and parameters: {'p_sma': 27, 'p_std': 21, 'p_atr': 30, 'p_adx': 21, 'rsi_period': 73, 'ema1': 13, 'ema2': 58, 'slip_atr_k': 0.05976292596665196, 'slip_spread_k': 0.6615854824191177, 'spread_hl_frac': 0.016316450457283607, 'bb_std_mult': 3.3770448110440947, 'rsi_os': 26, 'rsi_ob': 71, 'vol_spike': 0.20787267569898082, 'adx_thresh': 34.75679392163257, 'atr_min_pct': 0.004815649884615862, 'atr_max_pct': 0.021971584966091126, 'tp_mult': 1.2106466564209266, 'tsl_mult': 0.10169333177056156, 'strategy': 'mean_reversion', 'time_stop': 232, 'use_sma': True, 'use_atr': False, 'use_adx': False, 'use_ema': True, 'use_spike': False, 'rsi_required': False, 'edge_k': 1.8772548262255888, 'edge_cap': 0.46599356883485044}.
[I 2025-08-29 18:38:11,863] Trial 75 finished with values: [-1000000000.0, 1000000000.0] and parameters: {'p_sma': 56, 'p_std': 40, 'p_atr': 27, 'p_adx': 27, 'rsi_period': 46, 'ema1': 15, 'ema2': 28, 'slip_atr_k': 0.07841563836911919, 'slip_spread_k': 0.5771071428564726, 'spread_hl_frac': 0.015294980790221409, 'bb_std_mult': 0.9962465472153774, 'rsi_os': 26, 'rsi_ob': 74, 'vol_spike': 0.2021971801658639, 'adx_thresh': 34.97810910248438, 'atr_min_pct': 0.004452034081639855, 'atr_max_pct': 0.05691652587220767, 'tp_mult': 2.1852549953803093, 'tsl_mult': 0.07312623976803567, 'strategy': 'mean_reversion', 'time_stop': 288, 'use_sma': True, 'use_atr': False, 'use_adx': True, 'use_ema': True, 'use_spike': True, 'rsi_required': False, 'edge_k': 1.5245220338094114, 'edge_cap': 0.40613386350447905}.
[I 2025-08-29 18:38:39,667] Trial 83 finished with values: [-0.027646854981467683, 0.027591039514317975] and parameters: {'p_sma': 41, 'p_std': 31, 'p_atr': 21, 'p_adx': 20, 'rsi_period': 14, 'ema1': 12, 'ema2': 17, 'slip_atr_k': 0.12011428093336195, 'slip_spread_k': 0.37771647499561295, 'spread_hl_frac': 0.003002457979305862, 'bb_std_mult': 1.5118679207299979, 'rsi_os': 34, 'rsi_ob': 67, 'vol_spike': 0.23102046217663774, 'adx_thresh': 21.07894317880758, 'atr_min_pct': 0.002828662667824211, 'atr_max_pct': 0.13178870716769145, 'tp_mult': 2.89067467739395, 'tsl_mult': 0.38643011565785956, 'strategy': 'mean_reversion', 'time_stop': 179, 'use_sma': True, 'use_atr': True, 'use_adx': True, 'use_ema': False, 'use_spike': False, 'rsi_required': False, 'edge_k': 0.8336304198896197, 'edge_cap': 0.43104877530521296}.
