[I 2025-08-31 03:09:17,331] Trial 44 finished with values: [-1000000000.0, 1000000000.0] and parameters: {'p_sma': 7, 'p_std': 60, 'p_atr': 27, 'p_adx': 22, 'rsi_period': 9, 'ema1': 14, 'ema2': 22, 'slip_atr_k': 0.016255048227083138, 'slip_spread_k': 0.5418059532422375, 'spread_hl_frac': 0.02131222201578248, 'bb_std_mult': 3.548838089527032, 'rsi_os': 39, 'rsi_ob': 86, 'vol_spike': 0.05983077946954225, 'adx_thresh': 9.332936679719937, 'atr_min_pct': 0.02140588692114799, 'atr_max_pct': 0.11521979368157556, 'tp_mult': 1.5662844846728643, 'tsl_mult': 0.6931414622445411, 'strategy': 'breakout', 'time_stop': 85, 'use_sma': False, 'use_atr': False, 'use_adx': False, 'use_ema': True, 'use_spike': True, 'rsi_required': False, 'edge_k': 0.9001995429231349, 'edge_cap': 0.9030161120345964, 'bull_strategy': 'breakout', 'bull_bb_std_mult': 1.0907185849143728, 'bull_rsi_os': 26, 'bull_rsi_ob': 73, 'bull_adx_thresh': 25.557792470645147, 'bull_atr_min_pct': 0.000546242800845918, 'bull_atr_max_pct': 0.05193492759521357, 'bull_tp_mult': 1.554625150257817, 'bull_tsl_mult': 0.11689606736805819, 'bull_time_stop': 65, 'bull_use_sma': False, 'bull_use_ema': False, 'bull_use_atr': True, 'bull_use_adx': False, 'bull_use_spike': False, 'bull_rsi_required': True, 'bear_strategy': 'breakout', 'bear_bb_std_mult': 2.0962380979537474, 'bear_rsi_os': 7, 'bear_rsi_ob': 90, 'bear_adx_thresh': 17.72595887469586, 'bear_atr_min_pct': 0.008548911091940187, 'bear_atr_max_pct': 0.021573280752765663, 'bear_tp_mult': 1.5736567307447853, 'bear_tsl_mult': 0.8697236238959645, 'bear_time_stop': 143, 'bear_use_sma': False, 'bear_use_ema': False, 'bear_use_atr': True, 'bear_use_adx': False, 'bear_use_spike': True, 'bear_rsi_required': False, 'sideways_strategy': 'mean_reversion', 'sideways_bb_std_mult': 1.2782135064857192, 'sideways_rsi_os': 32, 'sideways_rsi_ob': 56, 'sideways_adx_thresh': 22.77003656186807, 'sideways_atr_min_pct': 0.018492319513028856, 'sideways_atr_max_pct': 0.10255854790526307, 'sideways_tp_mult': 1.7516268645214208, 'sideways_tsl_mult': 0.7843632597297446, 'sideways_time_stop': 119, 'sideways_use_sma': False, 'sideways_use_ema': False, 'sideways_use_atr': True, 'sideways_use_adx': True, 'sideways_use_spike': True, 'sideways_rsi_required': False}.
[I 2025-08-31 03:09:50,686] Trial 49 finished with values: [-0.03625689127711629, 0.0362952927056429] and parameters: {'p_sma': 8, 'p_std': 35, 'p_atr': 23, 'p_adx': 28, 'rsi_period': 72, 'ema1': 30, 'ema2': 33, 'slip_atr_k': 0.22806437455850814, 'slip_spread_k': 0.3118521221537178, 'spread_hl_frac': 0.005190340340978528, 'bb_std_mult': 3.294002213067996, 'rsi_os': 44, 'rsi_ob': 64, 'vol_spike': 0.10413612011097172, 'adx_thresh': 32.357688321850546, 'atr_min_pct': 0.009898492484822826, 'atr_max_pct': 0.12882575934107662, 'tp_mult': 2.4418575580479516, 'tsl_mult': 0.20557955682116924, 'strategy': 'breakout', 'time_stop': 295, 'use_sma': False, 'use_atr': False, 'use_adx': True, 'use_ema': False, 'use_spike': False, 'rsi_required': False, 'edge_k': 0.6848431550519819, 'edge_cap': 0.697304041811656, 'bull_strategy': 'mean_reversion', 'bull_bb_std_mult': 3.4868543487729218, 'bull_rsi_os': 22, 'bull_rsi_ob': 66, 'bull_adx_thresh': 29.648823584792282, 'bull_atr_min_pct': 0.012968952779668554, 'bull_atr_max_pct': 0.07298557312651761, 'bull_tp_mult': 2.954436188528277, 'bull_tsl_mult': 0.8333384659094047, 'bull_time_stop': 259, 'bull_use_sma': False, 'bull_use_ema': False, 'bull_use_atr': True, 'bull_use_adx': False, 'bull_use_spike': False, 'bull_rsi_required': False, 'bear_strategy': 'mean_reversion', 'bear_bb_std_mult': 3.3818741987769676, 'bear_rsi_os': 12, 'bear_rsi_ob': 51, 'bear_adx_thresh': 25.48919935180466, 'bear_atr_min_pct': 0.015775121143525275, 'bear_atr_max_pct': 0.04998860232704886, 'bear_tp_mult': 2.101782510646493, 'bear_tsl_mult': 0.2534691377016509, 'bear_time_stop': 24, 'bear_use_sma': False, 'bear_use_ema': False, 'bear_use_atr': False, 'bear_use_adx': False, 'bear_use_spike': True, 'bear_rsi_required': False, 'sideways_strategy': 'breakout', 'sideways_bb_std_mult': 1.926364379902087, 'sideways_rsi_os': 53, 'sideways_rsi_ob': 90, 'sideways_adx_thresh': 8.132303220612126, 'sideways_atr_min_pct': 0.001404803071524526, 'sideways_atr_max_pct': 0.13166834029836985, 'sideways_tp_mult': 2.0381050069855142, 'sideways_tsl_mult': 0.9096007434801822, 'sideways_time_stop': 300, 'sideways_use_sma': True, 'sideways_use_ema': True, 'sideways_use_atr': False, 'sideways_use_adx': False, 'sideways_use_spike': True, 'sideways_rsi_required': True}.
[I 2025-08-31 03:09:50,848] Trial 47 finished with values: [-1000000000.0, 1000000000.0] and parameters: {'p_sma': 7, 'p_std': 60, 'p_atr': 28, 'p_adx': 28, 'rsi_period': 71, 'ema1': 19, 'ema2': 44, 'slip_atr_k': 0.24490747678983887, 'slip_spread_k': 0.5616162809555241, 'spread_hl_frac': 0.007057714801377565, 'bb_std_mult': 3.5636299235557685, 'rsi_os': 16, 'rsi_ob': 66, 'vol_spike': 0.0025024206121661285, 'adx_thresh': 31.8012598619726, 'atr_min_pct': 0.00958218529514095, 'atr_max_pct': 0.010762578628409444, 'tp_mult': 2.4086006981715844, 'tsl_mult': 0.17380132793659508, 'strategy': 'breakout', 'time_stop': 164, 'use_sma': False, 'use_atr': False, 'use_adx': True, 'use_ema': False, 'use_spike': False, 'rsi_required': False, 'edge_k': 0.9931650970119115, 'edge_cap': 0.08709497425051893, 'bull_strategy': 'mean_reversion', 'bull_bb_std_mult': 3.5392845774004824, 'bull_rsi_os': 26, 'bull_rsi_ob': 66, 'bull_adx_thresh': 25.391789311757137, 'bull_atr_min_pct': 0.0057572902591523385, 'bull_atr_max_pct': 0.04280235713182992, 'bull_tp_mult': 2.855277687094821, 'bull_tsl_mult': 0.8303959196037634, 'bull_time_stop': 216, 'bull_use_sma': False, 'bull_use_ema': False, 'bull_use_atr': True, 'bull_use_adx': False, 'bull_use_spike': False, 'bull_rsi_required': False, 'bear_strategy': 'mean_reversion', 'bear_bb_std_mult': 3.2894948238719497, 'bear_rsi_os': 7, 'bear_rsi_ob': 64, 'bear_adx_thresh': 17.82958914925258, 'bear_atr_min_pct': 0.02964136918503595, 'bear_atr_max_pct': 0.104391464579814, 'bear_tp_mult': 2.102699539225757, 'bear_tsl_mult': 0.6301810353222052, 'bear_time_stop': 267, 'bear_use_sma': False, 'bear_use_ema': False, 'bear_use_atr': False, 'bear_use_adx': False, 'bear_use_spike': True, 'bear_rsi_required': False, 'sideways_strategy': 'breakout', 'sideways_bb_std_mult': 0.7589025786777963, 'sideways_rsi_os': 42, 'sideways_rsi_ob': 82, 'sideways_adx_thresh': 5.026265675245455, 'sideways_atr_min_pct': 0.0012810776406103098, 'sideways_atr_max_pct': 0.09293342148593714, 'sideways_tp_mult': 1.8691419997128735, 'sideways_tsl_mult': 0.9235093610513133, 'sideways_time_stop': 20, 'sideways_use_sma': True, 'sideways_use_ema': True, 'sideways_use_atr': False, 'sideways_use_adx': True, 'sideways_use_spike': False, 'sideways_rsi_required': True}.
[I 2025-08-31 03:09:51,137] Trial 46 finished with values: [-1000000000.0, 1000000000.0] and parameters: {'p_sma': 8, 'p_std': 22, 'p_atr': 16, 'p_adx': 28, 'rsi_period': 72, 'ema1': 30, 'ema2': 22, 'slip_atr_k': 0.24736118404725577, 'slip_spread_k': 0.28951558035162217, 'spread_hl_frac': 0.0036288269499689524, 'bb_std_mult': 1.9922797879407181, 'rsi_os': 17, 'rsi_ob': 65, 'vol_spike': 0.17658590975859997, 'adx_thresh': 30.574495795987236, 'atr_min_pct': 0.014340587433932937, 'atr_max_pct': 0.09956344017185888, 'tp_mult': 2.4047633576308747, 'tsl_mult': 0.15430648290264964, 'strategy': 'breakout', 'time_stop': 134, 'use_sma': False, 'use_atr': False, 'use_adx': False, 'use_ema': False, 'use_spike': True, 'rsi_required': False, 'edge_k': 1.0446485618670283, 'edge_cap': 0.6722454773983483, 'bull_strategy': 'mean_reversion', 'bull_bb_std_mult': 1.8809492426971248, 'bull_rsi_os': 25, 'bull_rsi_ob': 66, 'bull_adx_thresh': 26.002387652537333, 'bull_atr_min_pct': 0.0006376344461468952, 'bull_atr_max_pct': 0.10857763139965092, 'bull_tp_mult': 2.4273735342098024, 'bull_tsl_mult': 0.8256408397544337, 'bull_time_stop': 75, 'bull_use_sma': False, 'bull_use_ema': False, 'bull_use_atr': True, 'bull_use_adx': False, 'bull_use_spike': False, 'bull_rsi_required': False, 'bear_strategy': 'mean_reversion', 'bear_bb_std_mult': 3.4108168482757355, 'bear_rsi_os': 7, 'bear_rsi_ob': 85, 'bear_adx_thresh': 18.00458286777465, 'bear_atr_min_pct': 0.009598914084243633, 'bear_atr_max_pct': 0.10124026181059577, 'bear_tp_mult': 2.4021116699965557, 'bear_tsl_mult': 0.09194074037334232, 'bear_time_stop': 101, 'bear_use_sma': True, 'bear_use_ema': False, 'bear_use_atr': True, 'bear_use_adx': False, 'bear_use_spike': True, 'bear_rsi_required': False, 'sideways_strategy': 'mean_reversion', 'sideways_bb_std_mult': 0.8089858346205463, 'sideways_rsi_os': 48, 'sideways_rsi_ob': 86, 'sideways_adx_thresh': 5.20092948458279, 'sideways_atr_min_pct': 0.0015419130662023914, 'sideways_atr_max_pct': 0.091537328089068, 'sideways_tp_mult': 2.5095733434223764, 'sideways_tsl_mult': 0.9311655166281716, 'sideways_time_stop': 120, 'sideways_use_sma': True, 'sideways_use_ema': True, 'sideways_use_atr': True, 'sideways_use_adx': False, 'sideways_use_spike': True, 'sideways_rsi_required': True}.
[I 2025-08-31 03:09:51,394] Trial 48 finished with values: [-1000000000.0, 1000000000.0] and parameters: {'p_sma': 8, 'p_std': 57, 'p_atr': 16, 'p_adx': 28, 'rsi_period': 72, 'ema1': 19, 'ema2': 33, 'slip_atr_k': 0.23215323334608445, 'slip_spread_k': 0.8749992370714157, 'spread_hl_frac': 0.003636588909883446, 'bb_std_mult': 3.2709700519594778, 'rsi_os': 45, 'rsi_ob': 66, 'vol_spike': 0.17483320759260196, 'adx_thresh': 19.9447469693448, 'atr_min_pct': 0.009471935474053181, 'atr_max_pct': 0.012775782361517551, 'tp_mult': 2.365205329980881, 'tsl_mult': 0.19308308295705018, 'strategy': 'breakout', 'time_stop': 166, 'use_sma': False, 'use_atr': False, 'use_adx': True, 'use_ema': False, 'use_spike': False, 'rsi_required': False, 'edge_k': 0.8830841844408177, 'edge_cap': 0.05620544132254829, 'bull_strategy': 'mean_reversion', 'bull_bb_std_mult': 3.460879794039844, 'bull_rsi_os': 17, 'bull_rsi_ob': 66, 'bull_adx_thresh': 29.442055424982932, 'bull_atr_min_pct': 0.005683744783471924, 'bull_atr_max_pct': 0.07095613627664478, 'bull_tp_mult': 2.753944848969004, 'bull_tsl_mult': 0.8184726238229107, 'bull_time_stop': 223, 'bull_use_sma': False, 'bull_use_ema': False, 'bull_use_atr': True, 'bull_use_adx': False, 'bull_use_spike': False, 'bull_rsi_required': False, 'bear_strategy': 'mean_reversion', 'bear_bb_std_mult': 3.108948202944497, 'bear_rsi_os': 12, 'bear_rsi_ob': 65, 'bear_adx_thresh': 23.635073499584568, 'bear_atr_min_pct': 0.01712754385858259, 'bear_atr_max_pct': 0.049494527222590026, 'bear_tp_mult': 2.6410712265614165, 'bear_tsl_mult': 0.6205208400352663, 'bear_time_stop': 105, 'bear_use_sma': False, 'bear_use_ema': False, 'bear_use_atr': False, 'bear_use_adx': False, 'bear_use_spike': True, 'bear_rsi_required': False, 'sideways_strategy': 'breakout', 'sideways_bb_std_mult': 0.7951250717482463, 'sideways_rsi_os': 54, 'sideways_rsi_ob': 90, 'sideways_adx_thresh': 31.518683181789953, 'sideways_atr_min_pct': 0.010436120469367769, 'sideways_atr_max_pct': 0.09461862339102574, 'sideways_tp_mult': 1.9474284048436732, 'sideways_tsl_mult': 0.9214523564563907, 'sideways_time_stop': 19, 'sideways_use_sma': True, 'sideways_use_ema': True, 'sideways_use_atr': False, 'sideways_use_adx': False, 'sideways_use_spike': True, 'sideways_rsi_required': True}.
[I 2025-08-31 03:09:51,737] Trial 51 finished with values: [-1000000000.0, 1000000000.0] and parameters: {'p_sma': 53, 'p_std': 23, 'p_atr': 23, 'p_adx': 13, 'rsi_period': 78, 'ema1': 22, 'ema2': 13, 'slip_atr_k': 0.03696664924586422, 'slip_spread_k': 0.31150109566184303, 'spread_hl_frac': 0.042893392606090285, 'bb_std_mult': 3.2358691603047314, 'rsi_os': 51, 'rsi_ob': 63, 'vol_spike': 0.17713169004065102, 'adx_thresh': 19.079198882058005, 'atr_min_pct': 0.005044086798512237, 'atr_max_pct': 0.12745669381091, 'tp_mult': 2.2280610723147993, 'tsl_mult': 0.4679760010427457, 'strategy': 'mean_reversion', 'time_stop': 131, 'use_sma': True, 'use_atr': False, 'use_adx': True, 'use_ema': False, 'use_spike': False, 'rsi_required': True, 'edge_k': 0.09727465387755696, 'edge_cap': 0.7223165993628288, 'bull_strategy': 'mean_reversion', 'bull_bb_std_mult': 2.55640951559149, 'bull_rsi_os': 16, 'bull_rsi_ob': 66, 'bull_adx_thresh': 29.82870738150735, 'bull_atr_min_pct': 0.01281531857570859, 'bull_atr_max_pct': 0.089876645738627, 'bull_tp_mult': 2.0321751530770147, 'bull_tsl_mult': 0.18525226653963606, 'bull_time_stop': 8, 'bull_use_sma': False, 'bull_use_ema': False, 'bull_use_atr': True, 'bull_use_adx': False, 'bull_use_spike': False, 'bull_rsi_required': False, 'bear_strategy': 'mean_reversion', 'bear_bb_std_mult': 3.465761729187755, 'bear_rsi_os': 18, 'bear_rsi_ob': 50, 'bear_adx_thresh': 25.17353071759854, 'bear_atr_min_pct': 0.006380471576266254, 'bear_atr_max_pct': 0.11469846857312122, 'bear_tp_mult': 2.6469892747694237, 'bear_tsl_mult': 0.28650212476343606, 'bear_time_stop': 24, 'bear_use_sma': True, 'bear_use_ema': False, 'bear_use_atr': False, 'bear_use_adx': True, 'bear_use_spike': True, 'bear_rsi_required': False, 'sideways_strategy': 'breakout', 'sideways_bb_std_mult': 1.9377912836341693, 'sideways_rsi_os': 52, 'sideways_rsi_ob': 74, 'sideways_adx_thresh': 32.13694014316756, 'sideways_atr_min_pct': 0.011092977796720485, 'sideways_atr_max_pct': 0.07383499723328901, 'sideways_tp_mult': 1.2803439178587877, 'sideways_tsl_mult': 0.16669958212698088, 'sideways_time_stop': 295, 'sideways_use_sma': True, 'sideways_use_ema': True, 'sideways_use_atr': False, 'sideways_use_adx': False, 'sideways_use_spike': True, 'sideways_rsi_required': True}.
[I 2025-08-31 03:10:24,753] Trial 53 finished with values: [-1000000000.0, 1000000000.0] and parameters: {'p_sma': 53, 'p_std': 35, 'p_atr': 23, 'p_adx': 13, 'rsi_period': 78, 'ema1': 22, 'ema2': 13, 'slip_atr_k': 0.19550621796834086, 'slip_spread_k': 0.31988520341041793, 'spread_hl_frac': 0.0428318499981004, 'bb_std_mult': 1.169607815112114, 'rsi_os': 21, 'rsi_ob': 51, 'vol_spike': 0.1325874935146547, 'adx_thresh': 25.375984257978473, 'atr_min_pct': 0.0046191691529590285, 'atr_max_pct': 0.07393022127982299, 'tp_mult': 2.1570823865908118, 'tsl_mult': 0.001923656284318842, 'strategy': 'mean_reversion', 'time_stop': 295, 'use_sma': True, 'use_atr': False, 'use_adx': True, 'use_ema': False, 'use_spike': False, 'rsi_required': True, 'edge_k': 0.1254288978122408, 'edge_cap': 0.15900134214658226, 'bull_strategy': 'breakout', 'bull_bb_std_mult': 2.9017481198601414, 'bull_rsi_os': 11, 'bull_rsi_ob': 83, 'bull_adx_thresh': 17.509561515279522, 'bull_atr_min_pct': 0.013000172190998971, 'bull_atr_max_pct': 0.08685217117808863, 'bull_tp_mult': 1.3406199312554832, 'bull_tsl_mult': 0.1977021695117634, 'bull_time_stop': 5, 'bull_use_sma': False, 'bull_use_ema': False, 'bull_use_atr': False, 'bull_use_adx': True, 'bull_use_spike': True, 'bull_rsi_required': True, 'bear_strategy': 'mean_reversion', 'bear_bb_std_mult': 1.928130787019447, 'bear_rsi_os': 18, 'bear_rsi_ob': 52, 'bear_adx_thresh': 25.276420112906628, 'bear_atr_min_pct': 0.012878239109880785, 'bear_atr_max_pct': 0.12590585407202606, 'bear_tp_mult': 1.7800065561773153, 'bear_tsl_mult': 0.35870691418776834, 'bear_time_stop': 36, 'bear_use_sma': False, 'bear_use_ema': False, 'bear_use_atr': False, 'bear_use_adx': True, 'bear_use_spike': True, 'bear_rsi_required': True, 'sideways_strategy': 'breakout', 'sideways_bb_std_mult': 1.9486990731924012, 'sideways_rsi_os': 51, 'sideways_rsi_ob': 76, 'sideways_adx_thresh': 22.762033900812703, 'sideways_atr_min_pct': 0.003987235930172044, 'sideways_atr_max_pct': 0.13018652192525085, 'sideways_tp_mult': 2.781042597137209, 'sideways_tsl_mult': 0.18221011044355417, 'sideways_time_stop': 297, 'sideways_use_sma': True, 'sideways_use_ema': True, 'sideways_use_atr': False, 'sideways_use_adx': False, 'sideways_use_spike': False, 'sideways_rsi_required': False}.
[I 2025-08-31 03:10:25,068] Trial 50 finished with values: [-1000000000.0, 1000000000.0] and parameters: {'p_sma': 55, 'p_std': 35, 'p_atr': 11, 'p_adx': 13, 'rsi_period': 72, 'ema1': 29, 'ema2': 13, 'slip_atr_k': 0.21978189076847282, 'slip_spread_k': 0.1449541907719361, 'spread_hl_frac': 5.7721542807698256e-05, 'bb_std_mult': 3.133766604743186, 'rsi_os': 8, 'rsi_ob': 49, 'vol_spike': 0.005050833946886046, 'adx_thresh': 34.06868113317374, 'atr_min_pct': 0.0080555514198522, 'atr_max_pct': 0.018975117605959553, 'tp_mult': 2.339101902443971, 'tsl_mult': 0.14811424473142848, 'strategy': 'breakout', 'time_stop': 164, 'use_sma': False, 'use_atr': False, 'use_adx': True, 'use_ema': False, 'use_spike': False, 'rsi_required': True, 'edge_k': 0.1312319889034271, 'edge_cap': 0.7204679199163487, 'bull_strategy': 'mean_reversion', 'bull_bb_std_mult': 2.8660185764487616, 'bull_rsi_os': 5, 'bull_rsi_ob': 66, 'bull_adx_thresh': 17.51202489906846, 'bull_atr_min_pct': 0.012485520449548305, 'bull_atr_max_pct': 0.07653044030376914, 'bull_tp_mult': 2.935503445729238, 'bull_tsl_mult': 0.8101938879015911, 'bull_time_stop': 244, 'bull_use_sma': False, 'bull_use_ema': False, 'bull_use_atr': True, 'bull_use_adx': False, 'bull_use_spike': False, 'bull_rsi_required': False, 'bear_strategy': 'mean_reversion', 'bear_bb_std_mult': 3.438536468387841, 'bear_rsi_os': 5, 'bear_rsi_ob': 52, 'bear_adx_thresh': 26.619351192688615, 'bear_atr_min_pct': 0.006220741409286324, 'bear_atr_max_pct': 0.09601023521654396, 'bear_tp_mult': 2.1250679181687673, 'bear_tsl_mult': 0.3862234406193399, 'bear_time_stop': 31, 'bear_use_sma': False, 'bear_use_ema': False, 'bear_use_atr': False, 'bear_use_adx': True, 'bear_use_spike': True, 'bear_rsi_required': False, 'sideways_strategy': 'breakout', 'sideways_bb_std_mult': 0.7641468323804961, 'sideways_rsi_os': 52, 'sideways_rsi_ob': 86, 'sideways_adx_thresh': 31.691063299842085, 'sideways_atr_min_pct': 0.01104721484327624, 'sideways_atr_max_pct': 0.08546547882086644, 'sideways_tp_mult': 1.9724600461078656, 'sideways_tsl_mult': 0.3444109278899973, 'sideways_time_stop': 15, 'sideways_use_sma': True, 'sideways_use_ema': True, 'sideways_use_atr': False, 'sideways_use_adx': False, 'sideways_use_spike': False, 'sideways_rsi_required': True}.
[I 2025-08-31 03:10:25,510] Trial 54 finished with values: [-1000000000.0, 1000000000.0] and parameters: {'p_sma': 28, 'p_std': 34, 'p_atr': 13, 'p_adx': 7, 'rsi_period': 30, 'ema1': 23, 'ema2': 21, 'slip_atr_k': 0.2047668410029291, 'slip_spread_k': 0.8207974154265993, 'spread_hl_frac': 0.04769007439601732, 'bb_std_mult': 0.942000782150006, 'rsi_os': 6, 'rsi_ob': 93, 'vol_spike': 0.1439843914984864, 'adx_thresh': 21.81852274681977, 'atr_min_pct': 0.028339690416051555, 'atr_max_pct': 0.03184478655344267, 'tp_mult': 2.891736749536969, 'tsl_mult': 0.5706132565651537, 'strategy': 'breakout', 'time_stop': 221, 'use_sma': False, 'use_atr': False, 'use_adx': True, 'use_ema': False, 'use_spike': False, 'rsi_required': False, 'edge_k': 0.7026890216016253, 'edge_cap': 0.15740982960725497, 'bull_strategy': 'breakout', 'bull_bb_std_mult': 2.8640234533117854, 'bull_rsi_os': 5, 'bull_rsi_ob': 83, 'bull_adx_thresh': 17.03584657423897, 'bull_atr_min_pct': 0.013027831605534647, 'bull_atr_max_pct': 0.02364370084005321, 'bull_tp_mult': 1.3403882883495437, 'bull_tsl_mult': 0.954641519381584, 'bull_time_stop': 252, 'bull_use_sma': False, 'bull_use_ema': False, 'bull_use_atr': True, 'bull_use_adx': True, 'bull_use_spike': True, 'bull_rsi_required': True, 'bear_strategy': 'mean_reversion', 'bear_bb_std_mult': 1.91111465519274, 'bear_rsi_os': 5, 'bear_rsi_ob': 82, 'bear_adx_thresh': 5.152784546741673, 'bear_atr_min_pct': 0.012770238084769549, 'bear_atr_max_pct': 0.03816399283063047, 'bear_tp_mult': 1.7710707117514892, 'bear_tsl_mult': 0.7702274709960888, 'bear_time_stop': 55, 'bear_use_sma': False, 'bear_use_ema': False, 'bear_use_atr': False, 'bear_use_adx': True, 'bear_use_spike': True, 'bear_rsi_required': True, 'sideways_strategy': 'breakout', 'sideways_bb_std_mult': 1.8114748629936905, 'sideways_rsi_os': 29, 'sideways_rsi_ob': 47, 'sideways_adx_thresh': 22.766288894111902, 'sideways_atr_min_pct': 0.004147136457662572, 'sideways_atr_max_pct': 0.084587134318617, 'sideways_tp_mult': 2.781811939585197, 'sideways_tsl_mult': 0.3025782043496674, 'sideways_time_stop': 70, 'sideways_use_sma': True, 'sideways_use_ema': True, 'sideways_use_atr': False, 'sideways_use_adx': True, 'sideways_use_spike': True, 'sideways_rsi_required': False}.
