[I 2025-08-31 03:12:03,409] Trial 63 finished with values: [-1000000000.0, 1000000000.0] and parameters: {'p_sma': 17, 'p_std': 15, 'p_atr': 25, 'p_adx': 14, 'rsi_period': 44, 'ema1': 18, 'ema2': 55, 'slip_atr_k': 0.10395094889937158, 'slip_spread_k': 0.511673368401509, 'spread_hl_frac': 0.015251073509343783, 'bb_std_mult': 1.0385380405516063, 'rsi_os': 45, 'rsi_ob': 88, 'vol_spike': 0.2069144764356502, 'adx_thresh': 10.698148545579464, 'atr_min_pct': 0.015868829543903958, 'atr_max_pct': 0.07328522045426619, 'tp_mult': 2.7322635794222063, 'tsl_mult': 0.07697062310702063, 'strategy': 'breakout', 'time_stop': 98, 'use_sma': False, 'use_atr': False, 'use_adx': True, 'use_ema': False, 'use_spike': False, 'rsi_required': False, 'edge_k': 0.19476926943902084, 'edge_cap': 0.7773205747609078, 'bull_strategy': 'breakout', 'bull_bb_std_mult': 1.6057731708577827, 'bull_rsi_os': 52, 'bull_rsi_ob': 62, 'bull_adx_thresh': 22.16458923286835, 'bull_atr_min_pct': 0.005103394204564, 'bull_atr_max_pct': 0.11407077324886258, 'bull_tp_mult': 1.5270318263074845, 'bull_tsl_mult': 0.29340006429822685, 'bull_time_stop': 150, 'bull_use_sma': True, 'bull_use_ema': True, 'bull_use_atr': True, 'bull_use_adx': False, 'bull_use_spike': False, 'bull_rsi_required': True, 'bear_strategy': 'mean_reversion', 'bear_bb_std_mult': 0.9691667328630831, 'bear_rsi_os': 26, 'bear_rsi_ob': 67, 'bear_adx_thresh': 14.519917547902956, 'bear_atr_min_pct': 0.026573847715250988, 'bear_atr_max_pct': 0.017897009823852086, 'bear_tp_mult': 1.4373720646636465, 'bear_tsl_mult': 0.9228118545475004, 'bear_time_stop': 204, 'bear_use_sma': False, 'bear_use_ema': False, 'bear_use_atr': False, 'bear_use_adx': False, 'bear_use_spike': False, 'bear_rsi_required': False, 'sideways_strategy': 'breakout', 'sideways_bb_std_mult': 3.1069636273633425, 'sideways_rsi_os': 33, 'sideways_rsi_ob': 80, 'sideways_adx_thresh': 25.50413477321649, 'sideways_atr_min_pct': 0.002542114524283338, 'sideways_atr_max_pct': 0.11503263748629719, 'sideways_tp_mult': 1.4473648535802561, 'sideways_tsl_mult': 0.8233650900295264, 'sideways_time_stop': 6, 'sideways_use_sma': True, 'sideways_use_ema': False, 'sideways_use_atr': False, 'sideways_use_adx': True, 'sideways_use_spike': True, 'sideways_rsi_required': False}.
[I 2025-08-31 03:12:04,392] Trial 64 finished with values: [-1000000000.0, 1000000000.0] and parameters: {'p_sma': 10, 'p_std': 17, 'p_atr': 15, 'p_adx': 12, 'rsi_period': 45, 'ema1': 18, 'ema2': 23, 'slip_atr_k': 0.04242975009656291, 'slip_spread_k': 0.5215910478330813, 'spread_hl_frac': 0.0428872479676801, 'bb_std_mult': 0.5213789845249477, 'rsi_os': 33, 'rsi_ob': 92, 'vol_spike': 0.22498959530299664, 'adx_thresh': 10.26709251144971, 'atr_min_pct': 0.021286828910859368, 'atr_max_pct': 0.09569980419733892, 'tp_mult': 2.918660950625932, 'tsl_mult': 0.5095639318361115, 'strategy': 'breakout', 'time_stop': 95, 'use_sma': False, 'use_atr': False, 'use_adx': True, 'use_ema': False, 'use_spike': False, 'rsi_required': False, 'edge_k': 0.35038447307906695, 'edge_cap': 0.7988660095363322, 'bull_strategy': 'breakout', 'bull_bb_std_mult': 2.146417889139376, 'bull_rsi_os': 18, 'bull_rsi_ob': 74, 'bull_adx_thresh': 33.48013527320923, 'bull_atr_min_pct': 0.007217011429277799, 'bull_atr_max_pct': 0.10890568246803112, 'bull_tp_mult': 1.644182853386823, 'bull_tsl_mult': 0.9995880081414368, 'bull_time_stop': 105, 'bull_use_sma': False, 'bull_use_ema': False, 'bull_use_atr': True, 'bull_use_adx': False, 'bull_use_spike': False, 'bull_rsi_required': True, 'bear_strategy': 'mean_reversion', 'bear_bb_std_mult': 0.9287646202523716, 'bear_rsi_os': 47, 'bear_rsi_ob': 85, 'bear_adx_thresh': 14.319568188782695, 'bear_atr_min_pct': 0.010527240112652216, 'bear_atr_max_pct': 0.016587147917639627, 'bear_tp_mult': 1.4267758406394215, 'bear_tsl_mult': 0.8938831294301642, 'bear_time_stop': 204, 'bear_use_sma': False, 'bear_use_ema': False, 'bear_use_atr': False, 'bear_use_adx': False, 'bear_use_spike': True, 'bear_rsi_required': False, 'sideways_strategy': 'breakout', 'sideways_bb_std_mult': 1.6560051918576144, 'sideways_rsi_os': 42, 'sideways_rsi_ob': 91, 'sideways_adx_thresh': 19.98773671521878, 'sideways_atr_min_pct': 0.002705149701490906, 'sideways_atr_max_pct': 0.09755028450603723, 'sideways_tp_mult': 1.5038117924514212, 'sideways_tsl_mult': 0.8821820147843976, 'sideways_time_stop': 6, 'sideways_use_sma': True, 'sideways_use_ema': True, 'sideways_use_atr': False, 'sideways_use_adx': True, 'sideways_use_spike': True, 'sideways_rsi_required': False}.
[I 2025-08-31 03:12:04,392] Trial 65 finished with values: [-1000000000.0, 1000000000.0] and parameters: {'p_sma': 11, 'p_std': 16, 'p_atr': 15, 'p_adx': 12, 'rsi_period': 45, 'ema1': 15, 'ema2': 24, 'slip_atr_k': 0.040646110248168, 'slip_spread_k': 0.5210027131014253, 'spread_hl_frac': 0.009583563720381591, 'bb_std_mult': 2.571545534271497, 'rsi_os': 12, 'rsi_ob': 91, 'vol_spike': 0.22834112320095817, 'adx_thresh': 25.78793914087359, 'atr_min_pct': 0.02405168764776788, 'atr_max_pct': 0.10364513377993168, 'tp_mult': 2.920267524233727, 'tsl_mult': 0.516629636512747, 'strategy': 'breakout', 'time_stop': 98, 'use_sma': False, 'use_atr': False, 'use_adx': True, 'use_ema': False, 'use_spike': False, 'rsi_required': False, 'edge_k': 0.40054742926872733, 'edge_cap': 0.05192728766011936, 'bull_strategy': 'breakout', 'bull_bb_std_mult': 2.589651477038861, 'bull_rsi_os': 14, 'bull_rsi_ob': 74, 'bull_adx_thresh': 19.6321448365651, 'bull_atr_min_pct': 0.004841002512190801, 'bull_atr_max_pct': 0.13661009807813312, 'bull_tp_mult': 1.6477331131468842, 'bull_tsl_mult': 0.896433547525324, 'bull_time_stop': 154, 'bull_use_sma': False, 'bull_use_ema': False, 'bull_use_atr': True, 'bull_use_adx': False, 'bull_use_spike': False, 'bull_rsi_required': True, 'bear_strategy': 'mean_reversion', 'bear_bb_std_mult': 1.223058889643202, 'bear_rsi_os': 16, 'bear_rsi_ob': 93, 'bear_adx_thresh': 16.7715267205084, 'bear_atr_min_pct': 0.010396313090371239, 'bear_atr_max_pct': 0.01669617499361365, 'bear_tp_mult': 1.3702702538148164, 'bear_tsl_mult': 0.998953332535036, 'bear_time_stop': 206, 'bear_use_sma': False, 'bear_use_ema': False, 'bear_use_atr': False, 'bear_use_adx': False, 'bear_use_spike': True, 'bear_rsi_required': False, 'sideways_strategy': 'breakout', 'sideways_bb_std_mult': 1.6845512122380761, 'sideways_rsi_os': 42, 'sideways_rsi_ob': 93, 'sideways_adx_thresh': 19.522521510884236, 'sideways_atr_min_pct': 0.002497576942841029, 'sideways_atr_max_pct': 0.09959226391967005, 'sideways_tp_mult': 2.7470634378187757, 'sideways_tsl_mult': 0.23964789522189955, 'sideways_time_stop': 51, 'sideways_use_sma': True, 'sideways_use_ema': True, 'sideways_use_atr': False, 'sideways_use_adx': True, 'sideways_use_spike': True, 'sideways_rsi_required': False}.
[I 2025-08-31 03:12:04,661] Trial 66 finished with values: [-1000000000.0, 1000000000.0] and parameters: {'p_sma': 9, 'p_std': 39, 'p_atr': 15, 'p_adx': 15, 'rsi_period': 34, 'ema1': 18, 'ema2': 23, 'slip_atr_k': 0.03944311310004171, 'slip_spread_k': 0.5133800216005763, 'spread_hl_frac': 0.04279225871661324, 'bb_std_mult': 0.519411164491825, 'rsi_os': 12, 'rsi_ob': 91, 'vol_spike': 0.22606838999055012, 'adx_thresh': 24.717446126748573, 'atr_min_pct': 0.02072757042299026, 'atr_max_pct': 0.04924950208160897, 'tp_mult': 2.7828868058736553, 'tsl_mult': 0.5037277035676361, 'strategy': 'breakout', 'time_stop': 274, 'use_sma': True, 'use_atr': False, 'use_adx': True, 'use_ema': False, 'use_spike': True, 'rsi_required': False, 'edge_k': 0.38547980035423035, 'edge_cap': 0.1768687124503511, 'bull_strategy': 'breakout', 'bull_bb_std_mult': 2.1332756068346015, 'bull_rsi_os': 18, 'bull_rsi_ob': 61, 'bull_adx_thresh': 19.811326176966112, 'bull_atr_min_pct': 0.005697678041799619, 'bull_atr_max_pct': 0.13841929746727233, 'bull_tp_mult': 1.6716633042075142, 'bull_tsl_mult': 0.2965120427098114, 'bull_time_stop': 85, 'bull_use_sma': False, 'bull_use_ema': False, 'bull_use_atr': True, 'bull_use_adx': False, 'bull_use_spike': False, 'bull_rsi_required': True, 'bear_strategy': 'mean_reversion', 'bear_bb_std_mult': 0.9171759919915832, 'bear_rsi_os': 15, 'bear_rsi_ob': 91, 'bear_adx_thresh': 16.6665939823556, 'bear_atr_min_pct': 0.02264163551121998, 'bear_atr_max_pct': 0.017151732943239968, 'bear_tp_mult': 1.3853146287508051, 'bear_tsl_mult': 0.8919643611611686, 'bear_time_stop': 58, 'bear_use_sma': False, 'bear_use_ema': False, 'bear_use_atr': False, 'bear_use_adx': False, 'bear_use_spike': True, 'bear_rsi_required': False, 'sideways_strategy': 'breakout', 'sideways_bb_std_mult': 1.6717459264633732, 'sideways_rsi_os': 33, 'sideways_rsi_ob': 66, 'sideways_adx_thresh': 25.700827193306264, 'sideways_atr_min_pct': 0.0026427326328273926, 'sideways_atr_max_pct': 0.09818042239518299, 'sideways_tp_mult': 1.4915299262905082, 'sideways_tsl_mult': 0.8881598971363716, 'sideways_time_stop': 54, 'sideways_use_sma': True, 'sideways_use_ema': True, 'sideways_use_atr': False, 'sideways_use_adx': True, 'sideways_use_spike': True, 'sideways_rsi_required': False}.
[I 2025-08-31 03:12:37,990] Trial 68 finished with values: [-1000000000.0, 1000000000.0] and parameters: {'p_sma': 33, 'p_std': 29, 'p_atr': 22, 'p_adx': 15, 'rsi_period': 53, 'ema1': 11, 'ema2': 60, 'slip_atr_k': 0.006254013064352552, 'slip_spread_k': 0.5835031626366365, 'spread_hl_frac': 0.03839486925023726, 'bb_std_mult': 0.7755096291183361, 'rsi_os': 28, 'rsi_ob': 95, 'vol_spike': 0.15653811939672357, 'adx_thresh': 24.61816734468165, 'atr_min_pct': 0.027511391024722366, 'atr_max_pct': 0.13312679248597714, 'tp_mult': 2.8049889434214497, 'tsl_mult': 0.6577678507102088, 'strategy': 'breakout', 'time_stop': 49, 'use_sma': True, 'use_atr': False, 'use_adx': True, 'use_ema': False, 'use_spike': True, 'rsi_required': False, 'edge_k': 0.5295814518171926, 'edge_cap': 0.2580727593792523, 'bull_strategy': 'breakout', 'bull_bb_std_mult': 1.9269008639880512, 'bull_rsi_os': 47, 'bull_rsi_ob': 69, 'bull_adx_thresh': 24.335484044269865, 'bull_atr_min_pct': 0.016046549053933733, 'bull_atr_max_pct': 0.1397338639983491, 'bull_tp_mult': 1.6893112561682688, 'bull_tsl_mult': 0.8539642845913428, 'bull_time_stop': 28, 'bull_use_sma': False, 'bull_use_ema': False, 'bull_use_atr': True, 'bull_use_adx': False, 'bull_use_spike': True, 'bull_rsi_required': False, 'bear_strategy': 'breakout', 'bear_bb_std_mult': 1.5371608326226647, 'bear_rsi_os': 9, 'bear_rsi_ob': 62, 'bear_adx_thresh': 16.748404055599867, 'bear_atr_min_pct': 0.022867505509927645, 'bear_atr_max_pct': 0.049334798010734246, 'bear_tp_mult': 2.031736658517204, 'bear_tsl_mult': 0.23049926937521475, 'bear_time_stop': 56, 'bear_use_sma': False, 'bear_use_ema': False, 'bear_use_atr': False, 'bear_use_adx': True, 'bear_use_spike': True, 'bear_rsi_required': True, 'sideways_strategy': 'mean_reversion', 'sideways_bb_std_mult': 1.8378821540653227, 'sideways_rsi_os': 34, 'sideways_rsi_ob': 53, 'sideways_adx_thresh': 21.898764624572284, 'sideways_atr_min_pct': 0.00642979243951081, 'sideways_atr_max_pct': 0.027252296788621178, 'sideways_tp_mult': 2.0342390440699765, 'sideways_tsl_mult': 0.697842927169845, 'sideways_time_stop': 202, 'sideways_use_sma': False, 'sideways_use_ema': True, 'sideways_use_atr': False, 'sideways_use_adx': True, 'sideways_use_spike': False, 'sideways_rsi_required': True}.
[I 2025-08-31 03:12:38,286] Trial 70 finished with values: [-1000000000.0, 1000000000.0] and parameters: {'p_sma': 41, 'p_std': 21, 'p_atr': 22, 'p_adx': 20, 'rsi_period': 52, 'ema1': 11, 'ema2': 18, 'slip_atr_k': 0.029443969009155524, 'slip_spread_k': 0.5866084105221906, 'spread_hl_frac': 0.021445676441243, 'bb_std_mult': 0.7970763251483837, 'rsi_os': 23, 'rsi_ob': 95, 'vol_spike': 0.15332276840800926, 'adx_thresh': 21.000979858370926, 'atr_min_pct': 0.022323352194248657, 'atr_max_pct': 0.13181729194866454, 'tp_mult': 2.8136341229557464, 'tsl_mult': 0.6512013699003381, 'strategy': 'breakout', 'time_stop': 113, 'use_sma': True, 'use_atr': False, 'use_adx': True, 'use_ema': False, 'use_spike': True, 'rsi_required': True, 'edge_k': 0.5283419706246619, 'edge_cap': 0.37785275733985324, 'bull_strategy': 'mean_reversion', 'bull_bb_std_mult': 1.9180734161837618, 'bull_rsi_os': 16, 'bull_rsi_ob': 58, 'bull_adx_thresh': 15.8060747148318, 'bull_atr_min_pct': 0.01927376832204943, 'bull_atr_max_pct': 0.1460313732149291, 'bull_tp_mult': 1.5737460626690767, 'bull_tsl_mult': 0.9198796752983154, 'bull_time_stop': 52, 'bull_use_sma': False, 'bull_use_ema': False, 'bull_use_atr': True, 'bull_use_adx': False, 'bull_use_spike': True, 'bull_rsi_required': False, 'bear_strategy': 'breakout', 'bear_bb_std_mult': 1.4880824720550796, 'bear_rsi_os': 9, 'bear_rsi_ob': 62, 'bear_adx_thresh': 18.63910295753425, 'bear_atr_min_pct': 0.005659892190589081, 'bear_atr_max_pct': 0.026725407702977252, 'bear_tp_mult': 1.6810972980449925, 'bear_tsl_mult': 0.957002970155177, 'bear_time_stop': 130, 'bear_use_sma': False, 'bear_use_ema': False, 'bear_use_atr': False, 'bear_use_adx': True, 'bear_use_spike': True, 'bear_rsi_required': True, 'sideways_strategy': 'mean_reversion', 'sideways_bb_std_mult': 1.8205781262821268, 'sideways_rsi_os': 44, 'sideways_rsi_ob': 50, 'sideways_adx_thresh': 21.897136351537153, 'sideways_atr_min_pct': 0.006341941908409941, 'sideways_atr_max_pct': 0.03823017232000608, 'sideways_tp_mult': 2.6514428038521367, 'sideways_tsl_mult': 0.6999802504568489, 'sideways_time_stop': 207, 'sideways_use_sma': False, 'sideways_use_ema': True, 'sideways_use_atr': False, 'sideways_use_adx': False, 'sideways_use_spike': False, 'sideways_rsi_required': True}.
[I 2025-08-31 03:12:38,491] Trial 69 finished with values: [-1000000000.0, 1000000000.0] and parameters: {'p_sma': 32, 'p_std': 39, 'p_atr': 22, 'p_adx': 9, 'rsi_period': 36, 'ema1': 11, 'ema2': 59, 'slip_atr_k': 0.026711618338596668, 'slip_spread_k': 0.4796141302781414, 'spread_hl_frac': 0.038126519389911254, 'bb_std_mult': 0.7671886701997966, 'rsi_os': 27, 'rsi_ob': 95, 'vol_spike': 0.148004591168096, 'adx_thresh': 24.58807728677237, 'atr_min_pct': 0.02996203459222677, 'atr_max_pct': 0.04381933008663451, 'tp_mult': 1.1958670787371157, 'tsl_mult': 0.6495935268380053, 'strategy': 'breakout', 'time_stop': 114, 'use_sma': True, 'use_atr': False, 'use_adx': True, 'use_ema': False, 'use_spike': True, 'rsi_required': False, 'edge_k': 0.5322159939090984, 'edge_cap': 0.6199910817677295, 'bull_strategy': 'breakout', 'bull_bb_std_mult': 2.245701976711553, 'bull_rsi_os': 47, 'bull_rsi_ob': 79, 'bull_adx_thresh': 24.007814874776955, 'bull_atr_min_pct': 0.01924382125817114, 'bull_atr_max_pct': 0.13997378711847744, 'bull_tp_mult': 1.5622950148130392, 'bull_tsl_mult': 0.8557705852227683, 'bull_time_stop': 55, 'bull_use_sma': False, 'bull_use_ema': False, 'bull_use_atr': True, 'bull_use_adx': False, 'bull_use_spike': True, 'bull_rsi_required': False, 'bear_strategy': 'breakout', 'bear_bb_std_mult': 1.492977494989418, 'bear_rsi_os': 9, 'bear_rsi_ob': 62, 'bear_adx_thresh': 19.16560043911035, 'bear_atr_min_pct': 0.005446943267786155, 'bear_atr_max_pct': 0.025918496542660784, 'bear_tp_mult': 2.045288136475441, 'bear_tsl_mult': 0.9554666925973718, 'bear_time_stop': 57, 'bear_use_sma': False, 'bear_use_ema': False, 'bear_use_atr': False, 'bear_use_adx': True, 'bear_use_spike': True, 'bear_rsi_required': True, 'sideways_strategy': 'mean_reversion', 'sideways_bb_std_mult': 3.4851034499538467, 'sideways_rsi_os': 34, 'sideways_rsi_ob': 65, 'sideways_adx_thresh': 23.438972246772643, 'sideways_atr_min_pct': 0.0071215590088015476, 'sideways_atr_max_pct': 0.14408978570506964, 'sideways_tp_mult': 2.0659309010833256, 'sideways_tsl_mult': 0.6116745375718641, 'sideways_time_stop': 41, 'sideways_use_sma': False, 'sideways_use_ema': True, 'sideways_use_atr': False, 'sideways_use_adx': True, 'sideways_use_spike': False, 'sideways_rsi_required': True}.
[I 2025-08-31 03:12:38,782] Trial 67 finished with values: [-1000000000.0, 1000000000.0] and parameters: {'p_sma': 10, 'p_std': 21, 'p_atr': 15, 'p_adx': 12, 'rsi_period': 26, 'ema1': 15, 'ema2': 49, 'slip_atr_k': 0.029499160935056196, 'slip_spread_k': 0.5878092497342602, 'spread_hl_frac': 0.042396708440256316, 'bb_std_mult': 3.4230040547680844, 'rsi_os': 13, 'rsi_ob': 77, 'vol_spike': 0.22041501504557925, 'adx_thresh': 24.852674400906906, 'atr_min_pct': 0.002032348431575376, 'atr_max_pct': 0.04671242471721556, 'tp_mult': 2.923959115297781, 'tsl_mult': 0.5075038513085057, 'strategy': 'breakout', 'time_stop': 94, 'use_sma': True, 'use_atr': False, 'use_adx': True, 'use_ema': False, 'use_spike': True, 'rsi_required': False, 'edge_k': 0.351795772371329, 'edge_cap': 0.05333971240672517, 'bull_strategy': 'breakout', 'bull_bb_std_mult': 1.9284853149279604, 'bull_rsi_os': 14, 'bull_rsi_ob': 58, 'bull_adx_thresh': 19.59142281640417, 'bull_atr_min_pct': 0.007554589123068428, 'bull_atr_max_pct': 0.13738571453111112, 'bull_tp_mult': 1.6702412707833618, 'bull_tsl_mult': 0.9042208094447323, 'bull_time_stop': 86, 'bull_use_sma': False, 'bull_use_ema': False, 'bull_use_atr': True, 'bull_use_adx': False, 'bull_use_spike': True, 'bull_rsi_required': True, 'bear_strategy': 'mean_reversion', 'bear_bb_std_mult': 1.2375247276113015, 'bear_rsi_os': 44, 'bear_rsi_ob': 79, 'bear_adx_thresh': 16.80684139250495, 'bear_atr_min_pct': 0.010603902106143532, 'bear_atr_max_pct': 0.048599329420243136, 'bear_tp_mult': 2.017554879546, 'bear_tsl_mult': 0.9950108363746147, 'bear_time_stop': 60, 'bear_use_sma': False, 'bear_use_ema': False, 'bear_use_atr': False, 'bear_use_adx': False, 'bear_use_spike': True, 'bear_rsi_required': True, 'sideways_strategy': 'breakout', 'sideways_bb_std_mult': 1.6968009454615027, 'sideways_rsi_os': 42, 'sideways_rsi_ob': 53, 'sideways_adx_thresh': 19.77812790272826, 'sideways_atr_min_pct': 0.002790510540130471, 'sideways_atr_max_pct': 0.04351387884899366, 'sideways_tp_mult': 2.732033842324565, 'sideways_tsl_mult': 0.2415296214526153, 'sideways_time_stop': 55, 'sideways_use_sma': True, 'sideways_use_ema': True, 'sideways_use_atr': False, 'sideways_use_adx': True, 'sideways_use_spike': True, 'sideways_rsi_required': True}.
[I 2025-08-31 03:12:39,104] Trial 71 finished with values: [-1000000000.0, 1000000000.0] and parameters: {'p_sma': 12, 'p_std': 12, 'p_atr': 7, 'p_adx': 24, 'rsi_period': 26, 'ema1': 19, 'ema2': 18, 'slip_atr_k': 0.029994323016014384, 'slip_spread_k': 0.4579215097405397, 'spread_hl_frac': 0.021293101478711492, 'bb_std_mult': 3.3894108238568177, 'rsi_os': 23, 'rsi_ob': 46, 'vol_spike': 0.2579501054779126, 'adx_thresh': 20.639845562916427, 'atr_min_pct': 0.029794131980498847, 'atr_max_pct': 0.14970818822812906, 'tp_mult': 2.0611855808012693, 'tsl_mult': 0.42201795784109697, 'strategy': 'mean_reversion', 'time_stop': 114, 'use_sma': False, 'use_atr': False, 'use_adx': True, 'use_ema': False, 'use_spike': False, 'rsi_required': True, 'edge_k': 0.03720040257106394, 'edge_cap': 0.39654099372623397, 'bull_strategy': 'mean_reversion', 'bull_bb_std_mult': 2.2767774952484126, 'bull_rsi_os': 23, 'bull_rsi_ob': 78, 'bull_adx_thresh': 16.572908053026694, 'bull_atr_min_pct': 0.019385529746050935, 'bull_atr_max_pct': 0.14549382522061152, 'bull_tp_mult': 1.557690331278179, 'bull_tsl_mult': 0.9194029491056471, 'bull_time_stop': 128, 'bull_use_sma': False, 'bull_use_ema': False, 'bull_use_atr': True, 'bull_use_adx': True, 'bull_use_spike': True, 'bull_rsi_required': True, 'bear_strategy': 'mean_reversion', 'bear_bb_std_mult': 2.303106312141609, 'bear_rsi_os': 43, 'bear_rsi_ob': 78, 'bear_adx_thresh': 19.10554822207882, 'bear_atr_min_pct': 0.005562566166732607, 'bear_atr_max_pct': 0.026587858259653492, 'bear_tp_mult': 1.5182887672935101, 'bear_tsl_mult': 0.9640453404551013, 'bear_time_stop': 126, 'bear_use_sma': False, 'bear_use_ema': False, 'bear_use_atr': False, 'bear_use_adx': False, 'bear_use_spike': True, 'bear_rsi_required': True, 'sideways_strategy': 'breakout', 'sideways_bb_std_mult': 3.4254799607645916, 'sideways_rsi_os': 30, 'sideways_rsi_ob': 70, 'sideways_adx_thresh': 17.38711501844514, 'sideways_atr_min_pct': 0.004625221765770073, 'sideways_atr_max_pct': 0.03518520894383744, 'sideways_tp_mult': 2.9323711334512286, 'sideways_tsl_mult': 0.007190777120753555, 'sideways_time_stop': 20, 'sideways_use_sma': True, 'sideways_use_ema': True, 'sideways_use_atr': False, 'sideways_use_adx': False, 'sideways_use_spike': True, 'sideways_rsi_required': True}.
