[I 2025-08-31 03:31:52,771] Trial 207 finished with values: [-1000000000.0, 1000000000.0] and parameters: {'p_sma': 8, 'p_std': 27, 'p_atr': 11, 'p_adx': 13, 'rsi_period': 10, 'ema1': 16, 'ema2': 18, 'slip_atr_k': 0.07712283142465212, 'slip_spread_k': 0.2670830561197479, 'spread_hl_frac': 0.001591953769208607, 'bb_std_mult': 1.89402681308309, 'rsi_os': 16, 'rsi_ob': 75, 'vol_spike': 0.11795536678599675, 'adx_thresh': 23.70370147668674, 'atr_min_pct': 0.005039274049668269, 'atr_max_pct': 0.14359917925038396, 'tp_mult': 1.711557621479929, 'tsl_mult': 0.4886040252441786, 'strategy': 'breakout', 'time_stop': 178, 'use_sma': True, 'use_atr': True, 'use_adx': True, 'use_ema': False, 'use_spike': False, 'rsi_required': True, 'edge_k': 0.13730775179747612, 'edge_cap': 0.12668678503527092, 'bull_strategy': 'breakout', 'bull_bb_std_mult': 1.5227585622753719, 'bull_rsi_os': 13, 'bull_rsi_ob': 74, 'bull_adx_thresh': 25.17508339336425, 'bull_atr_min_pct': 0.021981714388620604, 'bull_atr_max_pct': 0.09699402222271919, 'bull_tp_mult': 1.8978859799768397, 'bull_tsl_mult': 0.6201801947045851, 'bull_time_stop': 110, 'bull_use_sma': False, 'bull_use_ema': False, 'bull_use_atr': True, 'bull_use_adx': False, 'bull_use_spike': False, 'bull_rsi_required': True, 'bear_strategy': 'mean_reversion', 'bear_bb_std_mult': 2.2499636325666943, 'bear_rsi_os': 25, 'bear_rsi_ob': 85, 'bear_adx_thresh': 32.846942465359916, 'bear_atr_min_pct': 0.007524943009127458, 'bear_atr_max_pct': 0.11042603101153783, 'bear_tp_mult': 2.107479599518863, 'bear_tsl_mult': 0.951172928884708, 'bear_time_stop': 242, 'bear_use_sma': False, 'bear_use_ema': False, 'bear_use_atr': True, 'bear_use_adx': False, 'bear_use_spike': True, 'bear_rsi_required': True, 'sideways_strategy': 'breakout', 'sideways_bb_std_mult': 1.297470690132779, 'sideways_rsi_os': 37, 'sideways_rsi_ob': 79, 'sideways_adx_thresh': 5.694074411729875, 'sideways_atr_min_pct': 0.0030080394922298104, 'sideways_atr_max_pct': 0.11732868685367481, 'sideways_tp_mult': 2.747516265781436, 'sideways_tsl_mult': 0.48938505379401237, 'sideways_time_stop': 204, 'sideways_use_sma': True, 'sideways_use_ema': True, 'sideways_use_atr': False, 'sideways_use_adx': True, 'sideways_use_spike': True, 'sideways_rsi_required': False}.
[I 2025-08-31 03:31:52,795] Trial 206 finished with values: [-0.022949746655031467, 0.022855297883015175] and parameters: {'p_sma': 40, 'p_std': 23, 'p_atr': 11, 'p_adx': 21, 'rsi_period': 74, 'ema1': 16, 'ema2': 12, 'slip_atr_k': 0.07910034059602222, 'slip_spread_k': 0.26796079791951516, 'spread_hl_frac': 0.0028836704545678127, 'bb_std_mult': 1.2641199715926956, 'rsi_os': 15, 'rsi_ob': 62, 'vol_spike': 0.11612408208418545, 'adx_thresh': 23.384954380613387, 'atr_min_pct': 0.012244067938658261, 'atr_max_pct': 0.033922929567328404, 'tp_mult': 1.445137333260947, 'tsl_mult': 0.5284329933856545, 'strategy': 'breakout', 'time_stop': 24, 'use_sma': True, 'use_atr': True, 'use_adx': True, 'use_ema': False, 'use_spike': False, 'rsi_required': True, 'edge_k': 1.7242827501253397, 'edge_cap': 0.11770697324351645, 'bull_strategy': 'mean_reversion', 'bull_bb_std_mult': 1.4932689620651436, 'bull_rsi_os': 35, 'bull_rsi_ob': 75, 'bull_adx_thresh': 20.952371428905636, 'bull_atr_min_pct': 0.0005355239113807352, 'bull_atr_max_pct': 0.017898807645729847, 'bull_tp_mult': 2.5071781204048142, 'bull_tsl_mult': 0.4007185161971198, 'bull_time_stop': 111, 'bull_use_sma': False, 'bull_use_ema': False, 'bull_use_atr': True, 'bull_use_adx': False, 'bull_use_spike': False, 'bull_rsi_required': True, 'bear_strategy': 'mean_reversion', 'bear_bb_std_mult': 2.509625425622023, 'bear_rsi_os': 25, 'bear_rsi_ob': 83, 'bear_adx_thresh': 28.556561038732568, 'bear_atr_min_pct': 0.007662276456208782, 'bear_atr_max_pct': 0.12630685313401946, 'bear_tp_mult': 2.158791091362074, 'bear_tsl_mult': 0.9769337088830545, 'bear_time_stop': 95, 'bear_use_sma': False, 'bear_use_ema': True, 'bear_use_atr': False, 'bear_use_adx': False, 'bear_use_spike': True, 'bear_rsi_required': True, 'sideways_strategy': 'breakout', 'sideways_bb_std_mult': 1.0438105747011708, 'sideways_rsi_os': 25, 'sideways_rsi_ob': 95, 'sideways_adx_thresh': 5.96415764957824, 'sideways_atr_min_pct': 0.002938070198474036, 'sideways_atr_max_pct': 0.10025455512957593, 'sideways_tp_mult': 2.7078879914296246, 'sideways_tsl_mult': 0.4863062375117567, 'sideways_time_stop': 29, 'sideways_use_sma': True, 'sideways_use_ema': True, 'sideways_use_atr': False, 'sideways_use_adx': True, 'sideways_use_spike': True, 'sideways_rsi_required': False}.
[I 2025-08-31 03:31:53,386] Trial 209 finished with values: [-1000000000.0, 1000000000.0] and parameters: {'p_sma': 8, 'p_std': 27, 'p_atr': 28, 'p_adx': 28, 'rsi_period': 10, 'ema1': 16, 'ema2': 46, 'slip_atr_k': 0.07579509010281937, 'slip_spread_k': 0.2266530348126434, 'spread_hl_frac': 0.0029362658037175556, 'bb_std_mult': 1.887544147846646, 'rsi_os': 15, 'rsi_ob': 53, 'vol_spike': 0.10758428346827144, 'adx_thresh': 23.60753605506155, 'atr_min_pct': 0.015366394014246793, 'atr_max_pct': 0.1433966217900457, 'tp_mult': 1.5516097424711934, 'tsl_mult': 0.49287910487219916, 'strategy': 'breakout', 'time_stop': 241, 'use_sma': True, 'use_atr': True, 'use_adx': True, 'use_ema': False, 'use_spike': False, 'rsi_required': True, 'edge_k': 0.4085870039157381, 'edge_cap': 0.1271095429685959, 'bull_strategy': 'breakout', 'bull_bb_std_mult': 1.4569316035505753, 'bull_rsi_os': 9, 'bull_rsi_ob': 74, 'bull_adx_thresh': 21.071875061643826, 'bull_atr_min_pct': 5.441164464414165e-05, 'bull_atr_max_pct': 0.028668765894370427, 'bull_tp_mult': 1.559948639536783, 'bull_tsl_mult': 0.3135674897161196, 'bull_time_stop': 107, 'bull_use_sma': False, 'bull_use_ema': False, 'bull_use_atr': True, 'bull_use_adx': False, 'bull_use_spike': False, 'bull_rsi_required': True, 'bear_strategy': 'mean_reversion', 'bear_bb_std_mult': 2.2754561351446903, 'bear_rsi_os': 25, 'bear_rsi_ob': 63, 'bear_adx_thresh': 17.962618003319044, 'bear_atr_min_pct': 0.00774810994048357, 'bear_atr_max_pct': 0.11016159772292217, 'bear_tp_mult': 1.3455561940620966, 'bear_tsl_mult': 0.9512600754766116, 'bear_time_stop': 253, 'bear_use_sma': False, 'bear_use_ema': True, 'bear_use_atr': True, 'bear_use_adx': False, 'bear_use_spike': True, 'bear_rsi_required': True, 'sideways_strategy': 'breakout', 'sideways_bb_std_mult': 1.0248196971471735, 'sideways_rsi_os': 37, 'sideways_rsi_ob': 58, 'sideways_adx_thresh': 8.025235943115344, 'sideways_atr_min_pct': 0.006831202384412597, 'sideways_atr_max_pct': 0.11616565277408232, 'sideways_tp_mult': 2.5907177749900256, 'sideways_tsl_mult': 0.9109971178692358, 'sideways_time_stop': 288, 'sideways_use_sma': True, 'sideways_use_ema': True, 'sideways_use_atr': False, 'sideways_use_adx': True, 'sideways_use_spike': True, 'sideways_rsi_required': False}.
[I 2025-08-31 03:32:31,799] Trial 210 finished with values: [-1000000000.0, 1000000000.0] and parameters: {'p_sma': 12, 'p_std': 19, 'p_atr': 13, 'p_adx': 13, 'rsi_period': 40, 'ema1': 16, 'ema2': 38, 'slip_atr_k': 0.028643718958798046, 'slip_spread_k': 0.27335297120532814, 'spread_hl_frac': 0.0026944366808688415, 'bb_std_mult': 1.299759265227097, 'rsi_os': 15, 'rsi_ob': 65, 'vol_spike': 0.11077701091960039, 'adx_thresh': 25.418919937283157, 'atr_min_pct': 0.023961975835175394, 'atr_max_pct': 0.14053656655589528, 'tp_mult': 1.710551235229261, 'tsl_mult': 0.3264710532194943, 'strategy': 'mean_reversion', 'time_stop': 285, 'use_sma': True, 'use_atr': True, 'use_adx': True, 'use_ema': True, 'use_spike': False, 'rsi_required': True, 'edge_k': 0.12726329531340377, 'edge_cap': 0.07032055160630252, 'bull_strategy': 'mean_reversion', 'bull_bb_std_mult': 1.5303218991814929, 'bull_rsi_os': 12, 'bull_rsi_ob': 74, 'bull_adx_thresh': 20.617912897025462, 'bull_atr_min_pct': 0.026933494637772996, 'bull_atr_max_pct': 0.01922940702091848, 'bull_tp_mult': 2.5176225877119105, 'bull_tsl_mult': 0.8012201625374988, 'bull_time_stop': 265, 'bull_use_sma': False, 'bull_use_ema': True, 'bull_use_atr': False, 'bull_use_adx': False, 'bull_use_spike': False, 'bull_rsi_required': True, 'bear_strategy': 'mean_reversion', 'bear_bb_std_mult': 2.2705985966258067, 'bear_rsi_os': 23, 'bear_rsi_ob': 83, 'bear_adx_thresh': 8.971329121714307, 'bear_atr_min_pct': 0.018370051570164143, 'bear_atr_max_pct': 0.13687669898850305, 'bear_tp_mult': 2.580572727738905, 'bear_tsl_mult': 0.951627072606248, 'bear_time_stop': 169, 'bear_use_sma': False, 'bear_use_ema': True, 'bear_use_atr': False, 'bear_use_adx': False, 'bear_use_spike': True, 'bear_rsi_required': True, 'sideways_strategy': 'breakout', 'sideways_bb_std_mult': 1.635637324994826, 'sideways_rsi_os': 18, 'sideways_rsi_ob': 85, 'sideways_adx_thresh': 5.747918229905273, 'sideways_atr_min_pct': 0.0041456596292916825, 'sideways_atr_max_pct': 0.01700883125944465, 'sideways_tp_mult': 2.6070900253340756, 'sideways_tsl_mult': 0.5500436708894159, 'sideways_time_stop': 205, 'sideways_use_sma': True, 'sideways_use_ema': True, 'sideways_use_atr': True, 'sideways_use_adx': True, 'sideways_use_spike': True, 'sideways_rsi_required': False}.
[I 2025-08-31 03:32:32,661] Trial 212 finished with values: [-1000000000.0, 1000000000.0] and parameters: {'p_sma': 27, 'p_std': 22, 'p_atr': 13, 'p_adx': 13, 'rsi_period': 57, 'ema1': 24, 'ema2': 39, 'slip_atr_k': 0.038562365009639714, 'slip_spread_k': 0.6964360937446921, 'spread_hl_frac': 0.0029420093479867494, 'bb_std_mult': 2.1088866319889523, 'rsi_os': 13, 'rsi_ob': 62, 'vol_spike': 0.03836996488867962, 'adx_thresh': 25.408671604934604, 'atr_min_pct': 0.024152949683355174, 'atr_max_pct': 0.07949846561742219, 'tp_mult': 1.4446159202537452, 'tsl_mult': 0.3175023652210984, 'strategy': 'mean_reversion', 'time_stop': 208, 'use_sma': True, 'use_atr': True, 'use_adx': True, 'use_ema': True, 'use_spike': False, 'rsi_required': True, 'edge_k': 0.33074287547522674, 'edge_cap': 0.1076547230267148, 'bull_strategy': 'mean_reversion', 'bull_bb_std_mult': 1.192501471819558, 'bull_rsi_os': 14, 'bull_rsi_ob': 95, 'bull_adx_thresh': 20.841273990608546, 'bull_atr_min_pct': 0.0005016883647731058, 'bull_atr_max_pct': 0.02850387591336781, 'bull_tp_mult': 2.4180783178107244, 'bull_tsl_mult': 0.8036710629682635, 'bull_time_stop': 127, 'bull_use_sma': False, 'bull_use_ema': True, 'bull_use_atr': False, 'bull_use_adx': False, 'bull_use_spike': True, 'bull_rsi_required': True, 'bear_strategy': 'breakout', 'bear_bb_std_mult': 2.2248545067377052, 'bear_rsi_os': 23, 'bear_rsi_ob': 53, 'bear_adx_thresh': 15.849452204130127, 'bear_atr_min_pct': 0.018433749697723868, 'bear_atr_max_pct': 0.12218576576884863, 'bear_tp_mult': 2.0506965511612214, 'bear_tsl_mult': 0.9803185280687325, 'bear_time_stop': 197, 'bear_use_sma': True, 'bear_use_ema': True, 'bear_use_atr': False, 'bear_use_adx': True, 'bear_use_spike': True, 'bear_rsi_required': True, 'sideways_strategy': 'breakout', 'sideways_bb_std_mult': 2.278587955112808, 'sideways_rsi_os': 17, 'sideways_rsi_ob': 78, 'sideways_adx_thresh': 12.827495445452728, 'sideways_atr_min_pct': 0.0012306784648871754, 'sideways_atr_max_pct': 0.10382682455159581, 'sideways_tp_mult': 2.5898440932070765, 'sideways_tsl_mult': 0.3383490053021011, 'sideways_time_stop': 235, 'sideways_use_sma': False, 'sideways_use_ema': True, 'sideways_use_atr': True, 'sideways_use_adx': True, 'sideways_use_spike': True, 'sideways_rsi_required': False}.
[I 2025-08-31 03:32:32,679] Trial 211 finished with values: [-0.05221093809341959, 0.05227018007966793] and parameters: {'p_sma': 10, 'p_std': 23, 'p_atr': 13, 'p_adx': 13, 'rsi_period': 22, 'ema1': 24, 'ema2': 21, 'slip_atr_k': 0.02842471033377925, 'slip_spread_k': 0.24814486834834215, 'spread_hl_frac': 0.0027618329299413137, 'bb_std_mult': 3.498682233479613, 'rsi_os': 15, 'rsi_ob': 62, 'vol_spike': 0.11023290733453717, 'adx_thresh': 25.37979794189744, 'atr_min_pct': 0.012395027463731504, 'atr_max_pct': 0.14036539428826514, 'tp_mult': 1.1652727336283675, 'tsl_mult': 0.556930025983163, 'strategy': 'mean_reversion', 'time_stop': 26, 'use_sma': True, 'use_atr': True, 'use_adx': True, 'use_ema': True, 'use_spike': False, 'rsi_required': True, 'edge_k': 1.792796909507481, 'edge_cap': 0.09708581560548012, 'bull_strategy': 'mean_reversion', 'bull_bb_std_mult': 1.164227995456189, 'bull_rsi_os': 14, 'bull_rsi_ob': 92, 'bull_adx_thresh': 19.854631775681224, 'bull_atr_min_pct': 3.744632248029161e-05, 'bull_atr_max_pct': 0.02110133564828911, 'bull_tp_mult': 2.100394373430291, 'bull_tsl_mult': 0.4036796847462011, 'bull_time_stop': 126, 'bull_use_sma': False, 'bull_use_ema': True, 'bull_use_atr': False, 'bull_use_adx': False, 'bull_use_spike': True, 'bull_rsi_required': True, 'bear_strategy': 'breakout', 'bear_bb_std_mult': 2.231086040672658, 'bear_rsi_os': 23, 'bear_rsi_ob': 90, 'bear_adx_thresh': 34.26042343742312, 'bear_atr_min_pct': 0.01253153842069975, 'bear_atr_max_pct': 0.12702926856729035, 'bear_tp_mult': 2.052624377268691, 'bear_tsl_mult': 0.9695912443389074, 'bear_time_stop': 252, 'bear_use_sma': True, 'bear_use_ema': True, 'bear_use_atr': False, 'bear_use_adx': True, 'bear_use_spike': True, 'bear_rsi_required': True, 'sideways_strategy': 'breakout', 'sideways_bb_std_mult': 1.6187881445615324, 'sideways_rsi_os': 47, 'sideways_rsi_ob': 58, 'sideways_adx_thresh': 6.1917047377953445, 'sideways_atr_min_pct': 0.0013311145026406917, 'sideways_atr_max_pct': 0.10599400621293982, 'sideways_tp_mult': 2.58361555624138, 'sideways_tsl_mult': 0.3497027318517509, 'sideways_time_stop': 27, 'sideways_use_sma': False, 'sideways_use_ema': True, 'sideways_use_atr': True, 'sideways_use_adx': True, 'sideways_use_spike': True, 'sideways_rsi_required': False}.
[I 2025-08-31 03:32:32,899] Trial 213 finished with values: [-1000000000.0, 1000000000.0] and parameters: {'p_sma': 10, 'p_std': 23, 'p_atr': 13, 'p_adx': 13, 'rsi_period': 23, 'ema1': 20, 'ema2': 21, 'slip_atr_k': 0.2162194908364892, 'slip_spread_k': 0.24167164059337054, 'spread_hl_frac': 0.03065020149659157, 'bb_std_mult': 1.0774047829317985, 'rsi_os': 13, 'rsi_ob': 65, 'vol_spike': 0.11299954943083329, 'adx_thresh': 25.979418921523184, 'atr_min_pct': 0.024332649128871432, 'atr_max_pct': 0.13725160177897278, 'tp_mult': 1.6441422063944489, 'tsl_mult': 0.5145069423757904, 'strategy': 'mean_reversion', 'time_stop': 27, 'use_sma': True, 'use_atr': True, 'use_adx': True, 'use_ema': True, 'use_spike': False, 'rsi_required': True, 'edge_k': 1.7972743541028349, 'edge_cap': 0.0663269639639455, 'bull_strategy': 'mean_reversion', 'bull_bb_std_mult': 3.247689871154508, 'bull_rsi_os': 14, 'bull_rsi_ob': 92, 'bull_adx_thresh': 20.168558698369765, 'bull_atr_min_pct': 0.026650252952666438, 'bull_atr_max_pct': 0.022417838860679794, 'bull_tp_mult': 2.5109844802807135, 'bull_tsl_mult': 0.40337772600008104, 'bull_time_stop': 127, 'bull_use_sma': False, 'bull_use_ema': True, 'bull_use_atr': False, 'bull_use_adx': False, 'bull_use_spike': True, 'bull_rsi_required': True, 'bear_strategy': 'breakout', 'bear_bb_std_mult': 2.228334231275462, 'bear_rsi_os': 23, 'bear_rsi_ob': 53, 'bear_adx_thresh': 15.631606568250387, 'bear_atr_min_pct': 0.01916759359020912, 'bear_atr_max_pct': 0.1264710899513876, 'bear_tp_mult': 2.579826262820703, 'bear_tsl_mult': 0.9837429194137903, 'bear_time_stop': 197, 'bear_use_sma': True, 'bear_use_ema': False, 'bear_use_atr': False, 'bear_use_adx': True, 'bear_use_spike': True, 'bear_rsi_required': True, 'sideways_strategy': 'breakout', 'sideways_bb_std_mult': 1.6209000331430934, 'sideways_rsi_os': 17, 'sideways_rsi_ob': 77, 'sideways_adx_thresh': 6.286066967002895, 'sideways_atr_min_pct': 0.0012099989915281967, 'sideways_atr_max_pct': 0.05550864741244592, 'sideways_tp_mult': 2.8267487241027824, 'sideways_tsl_mult': 0.3477456205766848, 'sideways_time_stop': 18, 'sideways_use_sma': False, 'sideways_use_ema': True, 'sideways_use_atr': True, 'sideways_use_adx': True, 'sideways_use_spike': True, 'sideways_rsi_required': False}.
[I 2025-08-31 03:33:09,583] Trial 215 finished with values: [-1000000000.0, 1000000000.0] and parameters: {'p_sma': 7, 'p_std': 23, 'p_atr': 12, 'p_adx': 17, 'rsi_period': 74, 'ema1': 12, 'ema2': 21, 'slip_atr_k': 0.01957997009197335, 'slip_spread_k': 0.19925141364111248, 'spread_hl_frac': 0.0013709687976151915, 'bb_std_mult': 3.3423583722808035, 'rsi_os': 52, 'rsi_ob': 63, 'vol_spike': 0.12592897454084206, 'adx_thresh': 26.44354951008623, 'atr_min_pct': 0.001958058913702534, 'atr_max_pct': 0.032483241129757416, 'tp_mult': 1.6467805611852349, 'tsl_mult': 0.8477948335881947, 'strategy': 'breakout', 'time_stop': 22, 'use_sma': True, 'use_atr': True, 'use_adx': True, 'use_ema': False, 'use_spike': False, 'rsi_required': True, 'edge_k': 0.5499187721934983, 'edge_cap': 0.07202680512682874, 'bull_strategy': 'breakout', 'bull_bb_std_mult': 1.3294206068400296, 'bull_rsi_os': 15, 'bull_rsi_ob': 77, 'bull_adx_thresh': 18.487025791059107, 'bull_atr_min_pct': 0.029316385836179952, 'bull_atr_max_pct': 0.024671195271533455, 'bull_tp_mult': 1.5029088593454618, 'bull_tsl_mult': 0.7198195398620377, 'bull_time_stop': 119, 'bull_use_sma': True, 'bull_use_ema': False, 'bull_use_atr': True, 'bull_use_adx': False, 'bull_use_spike': False, 'bull_rsi_required': False, 'bear_strategy': 'mean_reversion', 'bear_bb_std_mult': 2.3616165769695576, 'bear_rsi_os': 21, 'bear_rsi_ob': 82, 'bear_adx_thresh': 17.156140592297294, 'bear_atr_min_pct': 0.008411006127738612, 'bear_atr_max_pct': 0.11943247500112653, 'bear_tp_mult': 2.130433306285456, 'bear_tsl_mult': 0.9250037405079775, 'bear_time_stop': 235, 'bear_use_sma': False, 'bear_use_ema': False, 'bear_use_atr': False, 'bear_use_adx': False, 'bear_use_spike': False, 'bear_rsi_required': True, 'sideways_strategy': 'mean_reversion', 'sideways_bb_std_mult': 1.553308267787759, 'sideways_rsi_os': 25, 'sideways_rsi_ob': 80, 'sideways_adx_thresh': 33.84023385598476, 'sideways_atr_min_pct': 0.026011168498714772, 'sideways_atr_max_pct': 0.05675520522568851, 'sideways_tp_mult': 2.6420239133070065, 'sideways_tsl_mult': 0.19544332006099885, 'sideways_time_stop': 49, 'sideways_use_sma': True, 'sideways_use_ema': False, 'sideways_use_atr': False, 'sideways_use_adx': False, 'sideways_use_spike': False, 'sideways_rsi_required': True}.
[I 2025-08-31 03:33:10,891] Trial 216 finished with values: [-1000000000.0, 1000000000.0] and parameters: {'p_sma': 49, 'p_std': 23, 'p_atr': 12, 'p_adx': 12, 'rsi_period': 74, 'ema1': 15, 'ema2': 21, 'slip_atr_k': 0.015006151793045323, 'slip_spread_k': 0.19925586616599195, 'spread_hl_frac': 0.0320415360025827, 'bb_std_mult': 3.2073674227152953, 'rsi_os': 14, 'rsi_ob': 63, 'vol_spike': 0.12626873539263392, 'adx_thresh': 18.267824795026943, 'atr_min_pct': 0.02281518368364552, 'atr_max_pct': 0.03171180760670292, 'tp_mult': 1.511451907018207, 'tsl_mult': 0.5237687008867132, 'strategy': 'breakout', 'time_stop': 23, 'use_sma': True, 'use_atr': True, 'use_adx': True, 'use_ema': False, 'use_spike': False, 'rsi_required': True, 'edge_k': 0.23409119552996963, 'edge_cap': 0.0664850660512338, 'bull_strategy': 'breakout', 'bull_bb_std_mult': 3.2688256055966693, 'bull_rsi_os': 15, 'bull_rsi_ob': 77, 'bull_adx_thresh': 18.487375230135328, 'bull_atr_min_pct': 0.013533566979617476, 'bull_atr_max_pct': 0.0219275692879477, 'bull_tp_mult': 1.5051023764667577, 'bull_tsl_mult': 0.14336472086094953, 'bull_time_stop': 130, 'bull_use_sma': True, 'bull_use_ema': False, 'bull_use_atr': True, 'bull_use_adx': False, 'bull_use_spike': False, 'bull_rsi_required': False, 'bear_strategy': 'mean_reversion', 'bear_bb_std_mult': 2.321983502289488, 'bear_rsi_os': 24, 'bear_rsi_ob': 82, 'bear_adx_thresh': 17.287595053005113, 'bear_atr_min_pct': 0.008417558059996706, 'bear_atr_max_pct': 0.12011484553822595, 'bear_tp_mult': 2.994534269400178, 'bear_tsl_mult': 0.9257683939631772, 'bear_time_stop': 183, 'bear_use_sma': False, 'bear_use_ema': False, 'bear_use_atr': False, 'bear_use_adx': False, 'bear_use_spike': False, 'bear_rsi_required': True, 'sideways_strategy': 'mean_reversion', 'sideways_bb_std_mult': 1.533411000881327, 'sideways_rsi_os': 5, 'sideways_rsi_ob': 80, 'sideways_adx_thresh': 6.294444998879728, 'sideways_atr_min_pct': 0.0027705556161101673, 'sideways_atr_max_pct': 0.01257114955498613, 'sideways_tp_mult': 2.0507131715234728, 'sideways_tsl_mult': 0.37402686840787147, 'sideways_time_stop': 49, 'sideways_use_sma': True, 'sideways_use_ema': False, 'sideways_use_atr': False, 'sideways_use_adx': False, 'sideways_use_spike': False, 'sideways_rsi_required': True}.
