[I 2025-08-31 03:04:50,460] Trial 11 finished with values: [-1000000000.0, 1000000000.0] and parameters: {'p_sma': 16, 'p_std': 5, 'p_atr': 21, 'p_adx': 25, 'rsi_period': 54, 'ema1': 18, 'ema2': 13, 'slip_atr_k': 0.06516171348001196, 'slip_spread_k': 0.3060823360785916, 'spread_hl_frac': 0.005888530971162065, 'bb_std_mult': 0.7173339433258504, 'rsi_os': 43, 'rsi_ob': 52, 'vol_spike': 0.034410270971697285, 'adx_thresh': 33.71838866352592, 'atr_min_pct': 0.022190543229024372, 'atr_max_pct': 0.03460576182453492, 'tp_mult': 2.4907309067557817, 'tsl_mult': 0.724526593291376, 'strategy': 'mean_reversion', 'time_stop': 70, 'use_sma': False, 'use_atr': False, 'use_adx': False, 'use_ema': False, 'use_spike': False, 'rsi_required': False, 'edge_k': 0.14518205768990833, 'edge_cap': 0.24176217494969035, 'bull_strategy': 'breakout', 'bull_bb_std_mult': 1.7534557517864409, 'bull_rsi_os': 7, 'bull_rsi_ob': 61, 'bull_adx_thresh': 26.8733105083083, 'bull_atr_min_pct': 0.02965565718872678, 'bull_atr_max_pct': 0.0775570073384087, 'bull_tp_mult': 1.7508138467285919, 'bull_tsl_mult': 0.30617531117806374, 'bull_time_stop': 268, 'bull_use_sma': False, 'bull_use_ema': False, 'bull_use_atr': True, 'bull_use_adx': False, 'bull_use_spike': False, 'bull_rsi_required': False, 'bear_strategy': 'mean_reversion', 'bear_bb_std_mult': 2.4106770241477515, 'bear_rsi_os': 23, 'bear_rsi_ob': 68, 'bear_adx_thresh': 32.854883970043524, 'bear_atr_min_pct': 0.0240360240755118, 'bear_atr_max_pct': 0.06237411689523488, 'bear_tp_mult': 2.4710280132471736, 'bear_tsl_mult': 0.29213684238424453, 'bear_time_stop': 15, 'bear_use_sma': True, 'bear_use_ema': False, 'bear_use_atr': True, 'bear_use_adx': False, 'bear_use_spike': True, 'bear_rsi_required': True, 'sideways_strategy': 'mean_reversion', 'sideways_bb_std_mult': 0.8143630465122299, 'sideways_rsi_os': 5, 'sideways_rsi_ob': 88, 'sideways_adx_thresh': 34.264496156177024, 'sideways_atr_min_pct': 0.01593468151940773, 'sideways_atr_max_pct': 0.027275166985940673, 'sideways_tp_mult': 2.848451436930535, 'sideways_tsl_mult': 0.338705445723008, 'sideways_time_stop': 125, 'sideways_use_sma': True, 'sideways_use_ema': False, 'sideways_use_atr': False, 'sideways_use_adx': True, 'sideways_use_spike': False, 'sideways_rsi_required': False}.
[I 2025-08-31 03:04:51,579] Trial 9 finished with values: [-1000000000.0, 1000000000.0] and parameters: {'p_sma': 39, 'p_std': 43, 'p_atr': 12, 'p_adx': 30, 'rsi_period': 24, 'ema1': 9, 'ema2': 44, 'slip_atr_k': 0.24750811464502895, 'slip_spread_k': 0.3403720440627863, 'spread_hl_frac': 0.001316215887503458, 'bb_std_mult': 2.168413340052113, 'rsi_os': 21, 'rsi_ob': 87, 'vol_spike': 0.09672658199740518, 'adx_thresh': 29.47213662986816, 'atr_min_pct': 0.0027837722886334235, 'atr_max_pct': 0.03940988646606293, 'tp_mult': 2.230887784612819, 'tsl_mult': 0.10891142161140155, 'strategy': 'breakout', 'time_stop': 261, 'use_sma': False, 'use_atr': True, 'use_adx': True, 'use_ema': False, 'use_spike': False, 'rsi_required': True, 'edge_k': 0.04534546318903332, 'edge_cap': 0.3480613193428471, 'bull_strategy': 'breakout', 'bull_bb_std_mult': 2.9308494951260555, 'bull_rsi_os': 11, 'bull_rsi_ob': 66, 'bull_adx_thresh': 9.463413482229008, 'bull_atr_min_pct': 0.012222528587351025, 'bull_atr_max_pct': 0.08179982654859405, 'bull_tp_mult': 2.9338666551214696, 'bull_tsl_mult': 0.2418007303956884, 'bull_time_stop': 224, 'bull_use_sma': True, 'bull_use_ema': False, 'bull_use_atr': False, 'bull_use_adx': False, 'bull_use_spike': True, 'bull_rsi_required': False, 'bear_strategy': 'mean_reversion', 'bear_bb_std_mult': 3.0765600480321216, 'bear_rsi_os': 49, 'bear_rsi_ob': 66, 'bear_adx_thresh': 13.224365509565079, 'bear_atr_min_pct': 0.015967017528120367, 'bear_atr_max_pct': 0.0729291147557213, 'bear_tp_mult': 2.0889770163043795, 'bear_tsl_mult': 0.18757311920676167, 'bear_time_stop': 65, 'bear_use_sma': False, 'bear_use_ema': False, 'bear_use_atr': True, 'bear_use_adx': True, 'bear_use_spike': False, 'bear_rsi_required': True, 'sideways_strategy': 'breakout', 'sideways_bb_std_mult': 3.1064114629531883, 'sideways_rsi_os': 6, 'sideways_rsi_ob': 81, 'sideways_adx_thresh': 32.54533193554912, 'sideways_atr_min_pct': 0.004760665256150689, 'sideways_atr_max_pct': 0.1252582780796167, 'sideways_tp_mult': 2.3746482668466684, 'sideways_tsl_mult': 0.45042097300257167, 'sideways_time_stop': 269, 'sideways_use_sma': True, 'sideways_use_ema': True, 'sideways_use_atr': True, 'sideways_use_adx': True, 'sideways_use_spike': True, 'sideways_rsi_required': False}.
[I 2025-08-31 03:04:52,473] Trial 10 finished with values: [-0.029538601758080762, 0.029644684207842522] and parameters: {'p_sma': 20, 'p_std': 28, 'p_atr': 10, 'p_adx': 28, 'rsi_period': 43, 'ema1': 14, 'ema2': 24, 'slip_atr_k': 0.06370255922788767, 'slip_spread_k': 0.2947443330433164, 'spread_hl_frac': 0.03628343805281122, 'bb_std_mult': 0.8800020038811112, 'rsi_os': 6, 'rsi_ob': 90, 'vol_spike': 0.1520470955786076, 'adx_thresh': 27.319075261998883, 'atr_min_pct': 0.01911728497446228, 'atr_max_pct': 0.07233246180656167, 'tp_mult': 2.0785295830985833, 'tsl_mult': 0.5523513500910022, 'strategy': 'breakout', 'time_stop': 33, 'use_sma': False, 'use_atr': False, 'use_adx': True, 'use_ema': False, 'use_spike': False, 'rsi_required': False, 'edge_k': 0.08864633000439648, 'edge_cap': 0.26459384686667897, 'bull_strategy': 'breakout', 'bull_bb_std_mult': 2.823003783413728, 'bull_rsi_os': 35, 'bull_rsi_ob': 74, 'bull_adx_thresh': 17.754588192936176, 'bull_atr_min_pct': 0.0037141382683676723, 'bull_atr_max_pct': 0.1493911533841316, 'bull_tp_mult': 1.3979503781009526, 'bull_tsl_mult': 0.5343958336030433, 'bull_time_stop': 5, 'bull_use_sma': False, 'bull_use_ema': False, 'bull_use_atr': True, 'bull_use_adx': False, 'bull_use_spike': False, 'bull_rsi_required': True, 'bear_strategy': 'mean_reversion', 'bear_bb_std_mult': 0.5414858279203622, 'bear_rsi_os': 5, 'bear_rsi_ob': 94, 'bear_adx_thresh': 26.164929722766896, 'bear_atr_min_pct': 0.025110546199386227, 'bear_atr_max_pct': 0.04940492854492394, 'bear_tp_mult': 1.1488989851951243, 'bear_tsl_mult': 0.7501114653030999, 'bear_time_stop': 169, 'bear_use_sma': False, 'bear_use_ema': False, 'bear_use_atr': False, 'bear_use_adx': False, 'bear_use_spike': True, 'bear_rsi_required': False, 'sideways_strategy': 'breakout', 'sideways_bb_std_mult': 3.5587456715155517, 'sideways_rsi_os': 40, 'sideways_rsi_ob': 49, 'sideways_adx_thresh': 31.96163862893202, 'sideways_atr_min_pct': 0.0011032789540968535, 'sideways_atr_max_pct': 0.09274073260301828, 'sideways_tp_mult': 2.1450667004909447, 'sideways_tsl_mult': 0.44120743787279293, 'sideways_time_stop': 25, 'sideways_use_sma': True, 'sideways_use_ema': True, 'sideways_use_atr': False, 'sideways_use_adx': True, 'sideways_use_spike': True, 'sideways_rsi_required': False}.
[I 2025-08-31 03:04:52,595] Trial 14 finished with values: [-1000000000.0, 1000000000.0] and parameters: {'p_sma': 59, 'p_std': 20, 'p_atr': 30, 'p_adx': 7, 'rsi_period': 42, 'ema1': 5, 'ema2': 10, 'slip_atr_k': 0.1407817650595172, 'slip_spread_k': 0.011636668436633135, 'spread_hl_frac': 0.04545241905754205, 'bb_std_mult': 2.756064756377882, 'rsi_os': 55, 'rsi_ob': 75, 'vol_spike': 0.1903623456291973, 'adx_thresh': 15.33647806985552, 'atr_min_pct': 0.028982785937128316, 'atr_max_pct': 0.14927349285239971, 'tp_mult': 1.1258386636603124, 'tsl_mult': 0.9890163219191699, 'strategy': 'mean_reversion', 'time_stop': 21, 'use_sma': True, 'use_atr': True, 'use_adx': True, 'use_ema': True, 'use_spike': False, 'rsi_required': True, 'edge_k': 0.5870545365595865, 'edge_cap': 0.6183398403488453, 'bull_strategy': 'mean_reversion', 'bull_bb_std_mult': 0.777538826778444, 'bull_rsi_os': 39, 'bull_rsi_ob': 46, 'bull_adx_thresh': 31.948973729103283, 'bull_atr_min_pct': 0.006402401570355411, 'bull_atr_max_pct': 0.14959362382613267, 'bull_tp_mult': 1.040543298083278, 'bull_tsl_mult': 0.019272220005885687, 'bull_time_stop': 151, 'bull_use_sma': True, 'bull_use_ema': True, 'bull_use_atr': False, 'bull_use_adx': True, 'bull_use_spike': False, 'bull_rsi_required': False, 'bear_strategy': 'mean_reversion', 'bear_bb_std_mult': 1.4178041368425798, 'bear_rsi_os': 8, 'bear_rsi_ob': 62, 'bear_adx_thresh': 6.455776116210933, 'bear_atr_min_pct': 0.001244702225270726, 'bear_atr_max_pct': 0.14822240727657238, 'bear_tp_mult': 1.7078252378025236, 'bear_tsl_mult': 0.915378235282803, 'bear_time_stop': 282, 'bear_use_sma': False, 'bear_use_ema': True, 'bear_use_atr': False, 'bear_use_adx': True, 'bear_use_spike': False, 'bear_rsi_required': False, 'sideways_strategy': 'breakout', 'sideways_bb_std_mult': 3.562933485055807, 'sideways_rsi_os': 22, 'sideways_rsi_ob': 46, 'sideways_adx_thresh': 7.0125617658334995, 'sideways_atr_min_pct': 0.029967814571472302, 'sideways_atr_max_pct': 0.05239082010918489, 'sideways_tp_mult': 1.0414041219314383, 'sideways_tsl_mult': 0.9605534111283118, 'sideways_time_stop': 8, 'sideways_use_sma': True, 'sideways_use_ema': True, 'sideways_use_atr': False, 'sideways_use_adx': False, 'sideways_use_spike': True, 'sideways_rsi_required': True}.
[I 2025-08-31 03:04:52,752] Trial 12 finished with values: [-1000000000.0, 1000000000.0] and parameters: {'p_sma': 41, 'p_std': 35, 'p_atr': 26, 'p_adx': 22, 'rsi_period': 51, 'ema1': 22, 'ema2': 30, 'slip_atr_k': 0.2127560103274816, 'slip_spread_k': 0.05855263930602561, 'spread_hl_frac': 0.027575897944934136, 'bb_std_mult': 2.285229589379406, 'rsi_os': 11, 'rsi_ob': 47, 'vol_spike': 0.1422603568165709, 'adx_thresh': 15.51187864939437, 'atr_min_pct': 0.006314399155401769, 'atr_max_pct': 0.041032501621959976, 'tp_mult': 2.4229080082237355, 'tsl_mult': 0.7017249127188558, 'strategy': 'breakout', 'time_stop': 29, 'use_sma': True, 'use_atr': False, 'use_adx': False, 'use_ema': False, 'use_spike': False, 'rsi_required': False, 'edge_k': 1.0124189138964954, 'edge_cap': 0.4625709881131913, 'bull_strategy': 'mean_reversion', 'bull_bb_std_mult': 2.4828980830289895, 'bull_rsi_os': 54, 'bull_rsi_ob': 90, 'bull_adx_thresh': 27.542914279154786, 'bull_atr_min_pct': 0.02811800848420312, 'bull_atr_max_pct': 0.03636371434355992, 'bull_tp_mult': 1.428273216722344, 'bull_tsl_mult': 0.5545356133129029, 'bull_time_stop': 27, 'bull_use_sma': True, 'bull_use_ema': True, 'bull_use_atr': False, 'bull_use_adx': True, 'bull_use_spike': True, 'bull_rsi_required': True, 'bear_strategy': 'mean_reversion', 'bear_bb_std_mult': 2.698264988461712, 'bear_rsi_os': 16, 'bear_rsi_ob': 59, 'bear_adx_thresh': 7.875769408796302, 'bear_atr_min_pct': 0.02761533934470693, 'bear_atr_max_pct': 0.11232762665781103, 'bear_tp_mult': 1.6933688164606497, 'bear_tsl_mult': 0.17393878389672046, 'bear_time_stop': 193, 'bear_use_sma': True, 'bear_use_ema': False, 'bear_use_atr': True, 'bear_use_adx': True, 'bear_use_spike': False, 'bear_rsi_required': True, 'sideways_strategy': 'breakout', 'sideways_bb_std_mult': 0.9418616822970817, 'sideways_rsi_os': 48, 'sideways_rsi_ob': 78, 'sideways_adx_thresh': 28.163453509325322, 'sideways_atr_min_pct': 0.012289734882575617, 'sideways_atr_max_pct': 0.1367816466162253, 'sideways_tp_mult': 1.6484810765408653, 'sideways_tsl_mult': 0.19700485181580096, 'sideways_time_stop': 195, 'sideways_use_sma': True, 'sideways_use_ema': True, 'sideways_use_atr': True, 'sideways_use_adx': False, 'sideways_use_spike': False, 'sideways_rsi_required': False}.
[I 2025-08-31 03:05:23,391] Trial 13 finished with values: [-1000000000.0, 1000000000.0] and parameters: {'p_sma': 59, 'p_std': 25, 'p_atr': 29, 'p_adx': 12, 'rsi_period': 33, 'ema1': 5, 'ema2': 58, 'slip_atr_k': 0.1529518365942384, 'slip_spread_k': 0.007518824186269146, 'spread_hl_frac': 0.037186298213738506, 'bb_std_mult': 1.5067971100446353, 'rsi_os': 54, 'rsi_ob': 45, 'vol_spike': 0.006526729543745689, 'adx_thresh': 16.08666837895759, 'atr_min_pct': 0.02889174644272716, 'atr_max_pct': 0.14555083366727406, 'tp_mult': 1.011662217800999, 'tsl_mult': 0.9899039094001276, 'strategy': 'breakout', 'time_stop': 105, 'use_sma': True, 'use_atr': False, 'use_adx': True, 'use_ema': False, 'use_spike': False, 'rsi_required': True, 'edge_k': 0.13190759096971827, 'edge_cap': 0.5826049465603986, 'bull_strategy': 'mean_reversion', 'bull_bb_std_mult': 2.455728755439501, 'bull_rsi_os': 41, 'bull_rsi_ob': 47, 'bull_adx_thresh': 34.44887730276791, 'bull_atr_min_pct': 0.010056386069728933, 'bull_atr_max_pct': 0.14485658504166465, 'bull_tp_mult': 1.710363783351194, 'bull_tsl_mult': 0.6637378672177163, 'bull_time_stop': 141, 'bull_use_sma': True, 'bull_use_ema': False, 'bull_use_atr': False, 'bull_use_adx': True, 'bull_use_spike': True, 'bull_rsi_required': False, 'bear_strategy': 'mean_reversion', 'bear_bb_std_mult': 1.5119404098780436, 'bear_rsi_os': 5, 'bear_rsi_ob': 79, 'bear_adx_thresh': 15.193032873250363, 'bear_atr_min_pct': 0.0018765858877252649, 'bear_atr_max_pct': 0.14930596770267307, 'bear_tp_mult': 1.8566861108744206, 'bear_tsl_mult': 0.8949728439272402, 'bear_time_stop': 297, 'bear_use_sma': False, 'bear_use_ema': False, 'bear_use_atr': True, 'bear_use_adx': True, 'bear_use_spike': False, 'bear_rsi_required': False, 'sideways_strategy': 'breakout', 'sideways_bb_std_mult': 1.697316342538493, 'sideways_rsi_os': 30, 'sideways_rsi_ob': 46, 'sideways_adx_thresh': 20.817629811449105, 'sideways_atr_min_pct': 0.01430414871479248, 'sideways_atr_max_pct': 0.04994200676935035, 'sideways_tp_mult': 1.1176818427334279, 'sideways_tsl_mult': 0.0006119269587486764, 'sideways_time_stop': 14, 'sideways_use_sma': True, 'sideways_use_ema': True, 'sideways_use_atr': False, 'sideways_use_adx': False, 'sideways_use_spike': True, 'sideways_rsi_required': True}.
[I 2025-08-31 03:05:25,288] Trial 15 finished with values: [-0.04759830168492862, 0.047515777428244206] and parameters: {'p_sma': 60, 'p_std': 25, 'p_atr': 30, 'p_adx': 13, 'rsi_period': 38, 'ema1': 6, 'ema2': 18, 'slip_atr_k': 0.006710527383086473, 'slip_spread_k': 0.06165362247275044, 'spread_hl_frac': 0.04116175029071913, 'bb_std_mult': 0.5161682219615924, 'rsi_os': 55, 'rsi_ob': 95, 'vol_spike': 0.18626581433236353, 'adx_thresh': 22.395753933003167, 'atr_min_pct': 0.029618373584959713, 'atr_max_pct': 0.10072045433457676, 'tp_mult': 1.0716046545862405, 'tsl_mult': 0.895000210417559, 'strategy': 'breakout', 'time_stop': 94, 'use_sma': False, 'use_atr': False, 'use_adx': True, 'use_ema': False, 'use_spike': False, 'rsi_required': False, 'edge_k': 0.39839254123964823, 'edge_cap': 0.5549354511194666, 'bull_strategy': 'breakout', 'bull_bb_std_mult': 2.3167276143729856, 'bull_rsi_os': 42, 'bull_rsi_ob': 75, 'bull_adx_thresh': 32.52422490039968, 'bull_atr_min_pct': 0.007679957215487152, 'bull_atr_max_pct': 0.13691286969617456, 'bull_tp_mult': 1.6298307771288107, 'bull_tsl_mult': 0.6120004536558717, 'bull_time_stop': 120, 'bull_use_sma': True, 'bull_use_ema': False, 'bull_use_atr': True, 'bull_use_adx': False, 'bull_use_spike': False, 'bull_rsi_required': True, 'bear_strategy': 'mean_reversion', 'bear_bb_std_mult': 1.5679318811944705, 'bear_rsi_os': 6, 'bear_rsi_ob': 82, 'bear_adx_thresh': 17.360691147346582, 'bear_atr_min_pct': 0.005116139905251588, 'bear_atr_max_pct': 0.0434928356323661, 'bear_tp_mult': 1.6523928982317466, 'bear_tsl_mult': 0.9013475715224221, 'bear_time_stop': 298, 'bear_use_sma': False, 'bear_use_ema': False, 'bear_use_atr': False, 'bear_use_adx': True, 'bear_use_spike': False, 'bear_rsi_required': False, 'sideways_strategy': 'breakout', 'sideways_bb_std_mult': 1.7889204831698868, 'sideways_rsi_os': 34, 'sideways_rsi_ob': 45, 'sideways_adx_thresh': 23.590725927489114, 'sideways_atr_min_pct': 6.383873320450284e-05, 'sideways_atr_max_pct': 0.05426342764353277, 'sideways_tp_mult': 1.0205963470228183, 'sideways_tsl_mult': 0.7254893460704902, 'sideways_time_stop': 7, 'sideways_use_sma': True, 'sideways_use_ema': True, 'sideways_use_atr': False, 'sideways_use_adx': False, 'sideways_use_spike': True, 'sideways_rsi_required': True}.
[I 2025-08-31 03:05:25,561] Trial 17 finished with values: [-0.01601330697092873, 0.015922366836319275] and parameters: {'p_sma': 8, 'p_std': 26, 'p_atr': 15, 'p_adx': 14, 'rsi_period': 68, 'ema1': 16, 'ema2': 20, 'slip_atr_k': 0.008229640063833477, 'slip_spread_k': 0.4766543436909201, 'spread_hl_frac': 0.03926250309162439, 'bb_std_mult': 0.514012141347955, 'rsi_os': 35, 'rsi_ob': 95, 'vol_spike': 0.18114481733599733, 'adx_thresh': 23.994104498948055, 'atr_min_pct': 0.02334829447625212, 'atr_max_pct': 0.10251884672461846, 'tp_mult': 2.9759400187613045, 'tsl_mult': 0.5849248616269018, 'strategy': 'breakout', 'time_stop': 95, 'use_sma': False, 'use_atr': False, 'use_adx': True, 'use_ema': False, 'use_spike': False, 'rsi_required': False, 'edge_k': 0.30427516377810593, 'edge_cap': 0.050465842838999075, 'bull_strategy': 'breakout', 'bull_bb_std_mult': 2.2574018500474136, 'bull_rsi_os': 18, 'bull_rsi_ob': 74, 'bull_adx_thresh': 19.014763141152926, 'bull_atr_min_pct': 0.0080328086655588, 'bull_atr_max_pct': 0.14686161604245765, 'bull_tp_mult': 1.6234518911572744, 'bull_tsl_mult': 0.9912959443105944, 'bull_time_stop': 112, 'bull_use_sma': False, 'bull_use_ema': False, 'bull_use_atr': True, 'bull_use_adx': False, 'bull_use_spike': False, 'bull_rsi_required': True, 'bear_strategy': 'mean_reversion', 'bear_bb_std_mult': 1.4936241070622451, 'bear_rsi_os': 5, 'bear_rsi_ob': 82, 'bear_adx_thresh': 17.893981818294876, 'bear_atr_min_pct': 0.00723507810514321, 'bear_atr_max_pct': 0.03953315275599681, 'bear_tp_mult': 1.6507029028321019, 'bear_tsl_mult': 0.9869711494671055, 'bear_time_stop': 131, 'bear_use_sma': False, 'bear_use_ema': False, 'bear_use_atr': False, 'bear_use_adx': False, 'bear_use_spike': True, 'bear_rsi_required': False, 'sideways_strategy': 'breakout', 'sideways_bb_std_mult': 1.6469601879864912, 'sideways_rsi_os': 39, 'sideways_rsi_ob': 49, 'sideways_adx_thresh': 22.476333378000685, 'sideways_atr_min_pct': 0.00045754601610254646, 'sideways_atr_max_pct': 0.0947941696114203, 'sideways_tp_mult': 2.984819080978813, 'sideways_tsl_mult': 0.7677369681591573, 'sideways_time_stop': 17, 'sideways_use_sma': True, 'sideways_use_ema': True, 'sideways_use_atr': False, 'sideways_use_adx': True, 'sideways_use_spike': True, 'sideways_rsi_required': False}.
[I 2025-08-31 03:05:25,995] Trial 16 finished with values: [-0.10393564361339691, 0.10387197192955254] and parameters: {'p_sma': 56, 'p_std': 27, 'p_atr': 15, 'p_adx': 13, 'rsi_period': 40, 'ema1': 18, 'ema2': 20, 'slip_atr_k': 0.013294939646676433, 'slip_spread_k': 0.06263839390940593, 'spread_hl_frac': 0.03829576176086586, 'bb_std_mult': 0.5659435715679513, 'rsi_os': 5, 'rsi_ob': 95, 'vol_spike': 0.17236163773429863, 'adx_thresh': 23.70739776262918, 'atr_min_pct': 0.024792852848457378, 'atr_max_pct': 0.10181512617147426, 'tp_mult': 2.958147990527776, 'tsl_mult': 0.647976726422814, 'strategy': 'breakout', 'time_stop': 99, 'use_sma': False, 'use_atr': False, 'use_adx': True, 'use_ema': False, 'use_spike': False, 'rsi_required': False, 'edge_k': 0.28389841037120056, 'edge_cap': 0.059213510458797, 'bull_strategy': 'breakout', 'bull_bb_std_mult': 2.3641807527095753, 'bull_rsi_os': 44, 'bull_rsi_ob': 74, 'bull_adx_thresh': 18.881047474604607, 'bull_atr_min_pct': 0.006683612510675926, 'bull_atr_max_pct': 0.14968682459379226, 'bull_tp_mult': 1.6744795737251972, 'bull_tsl_mult': 0.675108687241127, 'bull_time_stop': 122, 'bull_use_sma': False, 'bull_use_ema': False, 'bull_use_atr': True, 'bull_use_adx': False, 'bull_use_spike': False, 'bull_rsi_required': True, 'bear_strategy': 'mean_reversion', 'bear_bb_std_mult': 1.627864666604781, 'bear_rsi_os': 5, 'bear_rsi_ob': 83, 'bear_adx_thresh': 27.234460331541065, 'bear_atr_min_pct': 0.007700319966425925, 'bear_atr_max_pct': 0.0460259127914467, 'bear_tp_mult': 1.7210412852164678, 'bear_tsl_mult': 0.9689546035550661, 'bear_time_stop': 243, 'bear_use_sma': False, 'bear_use_ema': False, 'bear_use_atr': False, 'bear_use_adx': False, 'bear_use_spike': True, 'bear_rsi_required': False, 'sideways_strategy': 'breakout', 'sideways_bb_std_mult': 1.7818890090923347, 'sideways_rsi_os': 40, 'sideways_rsi_ob': 46, 'sideways_adx_thresh': 23.29874835368617, 'sideways_atr_min_pct': 2.903707268736566e-05, 'sideways_atr_max_pct': 0.09748861978356516, 'sideways_tp_mult': 2.9534672985559243, 'sideways_tsl_mult': 0.7485999424828284, 'sideways_time_stop': 12, 'sideways_use_sma': True, 'sideways_use_ema': True, 'sideways_use_atr': False, 'sideways_use_adx': True, 'sideways_use_spike': True, 'sideways_rsi_required': False}.
