[I 2025-08-31 03:20:18,812] Trial 126 finished with values: [-0.014545715930432745, 0.01466942790421474] and parameters: {'p_sma': 8, 'p_std': 23, 'p_atr': 12, 'p_adx': 13, 'rsi_period': 75, 'ema1': 16, 'ema2': 20, 'slip_atr_k': 0.023352899779414668, 'slip_spread_k': 0.21930128642541047, 'spread_hl_frac': 0.002117333429980831, 'bb_std_mult': 1.9733827886094495, 'rsi_os': 15, 'rsi_ob': 64, 'vol_spike': 0.11629373981017266, 'adx_thresh': 24.391141748663987, 'atr_min_pct': 0.023271064773334914, 'atr_max_pct': 0.1438711381462172, 'tp_mult': 1.5524570301499727, 'tsl_mult': 0.5200854574900708, 'strategy': 'breakout', 'time_stop': 28, 'use_sma': True, 'use_atr': True, 'use_adx': True, 'use_ema': False, 'use_spike': False, 'rsi_required': True, 'edge_k': 0.27834755883560536, 'edge_cap': 0.09928878342798829, 'bull_strategy': 'breakout', 'bull_bb_std_mult': 1.3448415893068084, 'bull_rsi_os': 15, 'bull_rsi_ob': 75, 'bull_adx_thresh': 19.700186797796277, 'bull_atr_min_pct': 0.0009283229561999444, 'bull_atr_max_pct': 0.024676708990336922, 'bull_tp_mult': 1.4964036443880262, 'bull_tsl_mult': 0.3448919107751779, 'bull_time_stop': 124, 'bull_use_sma': False, 'bull_use_ema': False, 'bull_use_atr': True, 'bull_use_adx': False, 'bull_use_spike': False, 'bull_rsi_required': True, 'bear_strategy': 'mean_reversion', 'bear_bb_std_mult': 2.252777508965891, 'bear_rsi_os': 23, 'bear_rsi_ob': 83, 'bear_adx_thresh': 17.147366064836568, 'bear_atr_min_pct': 0.00775654437028544, 'bear_atr_max_pct': 0.11804852322185179, 'bear_tp_mult': 2.1470781501442198, 'bear_tsl_mult': 0.9607603212864921, 'bear_time_stop': 251, 'bear_use_sma': False, 'bear_use_ema': False, 'bear_use_atr': False, 'bear_use_adx': False, 'bear_use_spike': True, 'bear_rsi_required': True, 'sideways_strategy': 'breakout', 'sideways_bb_std_mult': 1.5401485097690193, 'sideways_rsi_os': 38, 'sideways_rsi_ob': 80, 'sideways_adx_thresh': 6.035833713873597, 'sideways_atr_min_pct': 0.002195366570108598, 'sideways_atr_max_pct': 0.10994474107796154, 'sideways_tp_mult': 2.700412567669784, 'sideways_tsl_mult': 0.3414608687913415, 'sideways_time_stop': 34, 'sideways_use_sma': True, 'sideways_use_ema': True, 'sideways_use_atr': False, 'sideways_use_adx': True, 'sideways_use_spike': True, 'sideways_rsi_required': False}.
[I 2025-08-31 03:20:19,232] Trial 127 finished with values: [-1000000000.0, 1000000000.0] and parameters: {'p_sma': 28, 'p_std': 23, 'p_atr': 18, 'p_adx': 14, 'rsi_period': 82, 'ema1': 16, 'ema2': 42, 'slip_atr_k': 0.22577837403006862, 'slip_spread_k': 0.7463310439020634, 'spread_hl_frac': 0.04516605973975326, 'bb_std_mult': 0.6259314087934884, 'rsi_os': 14, 'rsi_ob': 56, 'vol_spike': 0.17734244395306753, 'adx_thresh': 33.412893775314835, 'atr_min_pct': 0.008623202396187312, 'atr_max_pct': 0.08863031203341622, 'tp_mult': 2.1029596619966595, 'tsl_mult': 0.5819624237394336, 'strategy': 'breakout', 'time_stop': 31, 'use_sma': True, 'use_atr': False, 'use_adx': True, 'use_ema': False, 'use_spike': True, 'rsi_required': False, 'edge_k': 0.2704120721317937, 'edge_cap': 0.09146199123678755, 'bull_strategy': 'breakout', 'bull_bb_std_mult': 2.7871491344452544, 'bull_rsi_os': 8, 'bull_rsi_ob': 75, 'bull_adx_thresh': 20.10118868006966, 'bull_atr_min_pct': 0.016837366439053737, 'bull_atr_max_pct': 0.05232656549774885, 'bull_tp_mult': 2.168834810599707, 'bull_tsl_mult': 0.9995886276819139, 'bull_time_stop': 101, 'bull_use_sma': True, 'bull_use_ema': False, 'bull_use_atr': False, 'bull_use_adx': True, 'bull_use_spike': False, 'bull_rsi_required': True, 'bear_strategy': 'mean_reversion', 'bear_bb_std_mult': 2.246299007103193, 'bear_rsi_os': 54, 'bear_rsi_ob': 84, 'bear_adx_thresh': 17.358094820333754, 'bear_atr_min_pct': 0.0050426573469887145, 'bear_atr_max_pct': 0.06311641277981761, 'bear_tp_mult': 2.138059885610579, 'bear_tsl_mult': 0.320849057051045, 'bear_time_stop': 22, 'bear_use_sma': False, 'bear_use_ema': False, 'bear_use_atr': True, 'bear_use_adx': False, 'bear_use_spike': False, 'bear_rsi_required': True, 'sideways_strategy': 'breakout', 'sideways_bb_std_mult': 2.1175205479834758, 'sideways_rsi_os': 11, 'sideways_rsi_ob': 49, 'sideways_adx_thresh': 32.92494038314814, 'sideways_atr_min_pct': 0.018177258127027945, 'sideways_atr_max_pct': 0.0973415234541833, 'sideways_tp_mult': 2.8120702191061584, 'sideways_tsl_mult': 0.3243186165339944, 'sideways_time_stop': 34, 'sideways_use_sma': True, 'sideways_use_ema': True, 'sideways_use_atr': False, 'sideways_use_adx': True, 'sideways_use_spike': True, 'sideways_rsi_required': False}.
[I 2025-08-31 03:20:19,362] Trial 128 finished with values: [-1000000000.0, 1000000000.0] and parameters: {'p_sma': 8, 'p_std': 28, 'p_atr': 18, 'p_adx': 14, 'rsi_period': 75, 'ema1': 15, 'ema2': 58, 'slip_atr_k': 0.16751082882672594, 'slip_spread_k': 0.7329065492488371, 'spread_hl_frac': 0.03615882072056205, 'bb_std_mult': 0.6341947596584361, 'rsi_os': 32, 'rsi_ob': 91, 'vol_spike': 0.06646799172997223, 'adx_thresh': 26.044200534478488, 'atr_min_pct': 0.008654342937164113, 'atr_max_pct': 0.13134018194456304, 'tp_mult': 2.192258137284072, 'tsl_mult': 0.5840149539792475, 'strategy': 'breakout', 'time_stop': 220, 'use_sma': True, 'use_atr': True, 'use_adx': True, 'use_ema': False, 'use_spike': True, 'rsi_required': True, 'edge_k': 0.27412859794494837, 'edge_cap': 0.4991729179024079, 'bull_strategy': 'mean_reversion', 'bull_bb_std_mult': 2.770161935265107, 'bull_rsi_os': 8, 'bull_rsi_ob': 51, 'bull_adx_thresh': 32.00119338442892, 'bull_atr_min_pct': 0.007860664264031248, 'bull_atr_max_pct': 0.1498251496801053, 'bull_tp_mult': 1.4815658595520702, 'bull_tsl_mult': 0.0007320682493469066, 'bull_time_stop': 125, 'bull_use_sma': True, 'bull_use_ema': True, 'bull_use_atr': False, 'bull_use_adx': True, 'bull_use_spike': False, 'bull_rsi_required': False, 'bear_strategy': 'breakout', 'bear_bb_std_mult': 2.268216223577171, 'bear_rsi_os': 54, 'bear_rsi_ob': 45, 'bear_adx_thresh': 16.58747753553778, 'bear_atr_min_pct': 0.0050994979148152805, 'bear_atr_max_pct': 0.11764722852166648, 'bear_tp_mult': 1.7654597961490934, 'bear_tsl_mult': 0.96104601848594, 'bear_time_stop': 19, 'bear_use_sma': False, 'bear_use_ema': False, 'bear_use_atr': True, 'bear_use_adx': True, 'bear_use_spike': False, 'bear_rsi_required': True, 'sideways_strategy': 'mean_reversion', 'sideways_bb_std_mult': 1.420336384712718, 'sideways_rsi_os': 38, 'sideways_rsi_ob': 80, 'sideways_adx_thresh': 19.145501246365765, 'sideways_atr_min_pct': 0.0023051531778031484, 'sideways_atr_max_pct': 0.09741387391745777, 'sideways_tp_mult': 2.091701320766282, 'sideways_tsl_mult': 0.34738420860747954, 'sideways_time_stop': 188, 'sideways_use_sma': False, 'sideways_use_ema': True, 'sideways_use_atr': False, 'sideways_use_adx': True, 'sideways_use_spike': True, 'sideways_rsi_required': False}.
[I 2025-08-31 03:20:19,463] Trial 129 finished with values: [-1000000000.0, 1000000000.0] and parameters: {'p_sma': 7, 'p_std': 28, 'p_atr': 21, 'p_adx': 14, 'rsi_period': 23, 'ema1': 18, 'ema2': 58, 'slip_atr_k': 0.017549280421707874, 'slip_spread_k': 0.4353278904755997, 'spread_hl_frac': 0.005806477865376587, 'bb_std_mult': 1.399709345236399, 'rsi_os': 37, 'rsi_ob': 55, 'vol_spike': 0.27813303795969657, 'adx_thresh': 26.21719893786422, 'atr_min_pct': 0.007915369713137799, 'atr_max_pct': 0.06521473183694859, 'tp_mult': 2.7240327739883448, 'tsl_mult': 0.5926222134446264, 'strategy': 'breakout', 'time_stop': 73, 'use_sma': True, 'use_atr': False, 'use_adx': True, 'use_ema': False, 'use_spike': True, 'rsi_required': False, 'edge_k': 1.4074943960408974, 'edge_cap': 0.05222757261588386, 'bull_strategy': 'breakout', 'bull_bb_std_mult': 2.1004714808935185, 'bull_rsi_os': 15, 'bull_rsi_ob': 68, 'bull_adx_thresh': 32.23690626663174, 'bull_atr_min_pct': 0.0008450126777853192, 'bull_atr_max_pct': 0.14714216135414826, 'bull_tp_mult': 2.152899692859444, 'bull_tsl_mult': 0.5426414300765148, 'bull_time_stop': 89, 'bull_use_sma': False, 'bull_use_ema': True, 'bull_use_atr': False, 'bull_use_adx': True, 'bull_use_spike': False, 'bull_rsi_required': False, 'bear_strategy': 'mean_reversion', 'bear_bb_std_mult': 1.541275855196608, 'bear_rsi_os': 19, 'bear_rsi_ob': 45, 'bear_adx_thresh': 17.39692694318569, 'bear_atr_min_pct': 0.007682410976208131, 'bear_atr_max_pct': 0.06400924689822696, 'bear_tp_mult': 1.547544659434235, 'bear_tsl_mult': 0.9584915989395454, 'bear_time_stop': 250, 'bear_use_sma': False, 'bear_use_ema': False, 'bear_use_atr': True, 'bear_use_adx': False, 'bear_use_spike': True, 'bear_rsi_required': True, 'sideways_strategy': 'breakout', 'sideways_bb_std_mult': 1.428575948588524, 'sideways_rsi_os': 38, 'sideways_rsi_ob': 49, 'sideways_adx_thresh': 19.058940290139496, 'sideways_atr_min_pct': 0.0021252513852672277, 'sideways_atr_max_pct': 0.09762899066840644, 'sideways_tp_mult': 2.995595332144347, 'sideways_tsl_mult': 0.4211848618776415, 'sideways_time_stop': 36, 'sideways_use_sma': True, 'sideways_use_ema': True, 'sideways_use_atr': False, 'sideways_use_adx': True, 'sideways_use_spike': True, 'sideways_rsi_required': False}.
[I 2025-08-31 03:20:51,221] Trial 132 finished with values: [-1000000000.0, 1000000000.0] and parameters: {'p_sma': 7, 'p_std': 16, 'p_atr': 11, 'p_adx': 12, 'rsi_period': 80, 'ema1': 8, 'ema2': 34, 'slip_atr_k': 0.04539527801992431, 'slip_spread_k': 0.14817001551403763, 'spread_hl_frac': 0.0014710108500738304, 'bb_std_mult': 1.7799680690605444, 'rsi_os': 7, 'rsi_ob': 64, 'vol_spike': 0.11171876620195853, 'adx_thresh': 28.869026912123644, 'atr_min_pct': 0.014120653561036686, 'atr_max_pct': 0.1427409666150704, 'tp_mult': 1.5642037509385176, 'tsl_mult': 0.5094011282518498, 'strategy': 'breakout', 'time_stop': 17, 'use_sma': True, 'use_atr': True, 'use_adx': False, 'use_ema': False, 'use_spike': False, 'rsi_required': True, 'edge_k': 1.378765165003261, 'edge_cap': 0.15066313434871553, 'bull_strategy': 'breakout', 'bull_bb_std_mult': 1.3797611642460539, 'bull_rsi_os': 11, 'bull_rsi_ob': 81, 'bull_adx_thresh': 20.878248030088862, 'bull_atr_min_pct': 0.002236116301581624, 'bull_atr_max_pct': 0.017772367605919485, 'bull_tp_mult': 1.452307977413869, 'bull_tsl_mult': 0.262146060860814, 'bull_time_stop': 144, 'bull_use_sma': False, 'bull_use_ema': True, 'bull_use_atr': True, 'bull_use_adx': False, 'bull_use_spike': False, 'bull_rsi_required': False, 'bear_strategy': 'mean_reversion', 'bear_bb_std_mult': 2.7523483960942614, 'bear_rsi_os': 24, 'bear_rsi_ob': 83, 'bear_adx_thresh': 14.202807440199024, 'bear_atr_min_pct': 0.0038399363074381977, 'bear_atr_max_pct': 0.13997306908155108, 'bear_tp_mult': 2.05588334196111, 'bear_tsl_mult': 0.8955977885694414, 'bear_time_stop': 249, 'bear_use_sma': False, 'bear_use_ema': True, 'bear_use_atr': False, 'bear_use_adx': False, 'bear_use_spike': True, 'bear_rsi_required': True, 'sideways_strategy': 'breakout', 'sideways_bb_std_mult': 2.6184257353969618, 'sideways_rsi_os': 37, 'sideways_rsi_ob': 78, 'sideways_adx_thresh': 5.793769893157302, 'sideways_atr_min_pct': 0.014161710785690104, 'sideways_atr_max_pct': 0.11035072473758155, 'sideways_tp_mult': 2.6642458210448248, 'sideways_tsl_mult': 0.4229988738354288, 'sideways_time_stop': 53, 'sideways_use_sma': True, 'sideways_use_ema': False, 'sideways_use_atr': False, 'sideways_use_adx': True, 'sideways_use_spike': False, 'sideways_rsi_required': False}.
[I 2025-08-31 03:20:51,687] Trial 133 finished with values: [-1000000000.0, 1000000000.0] and parameters: {'p_sma': 6, 'p_std': 14, 'p_atr': 11, 'p_adx': 12, 'rsi_period': 80, 'ema1': 12, 'ema2': 19, 'slip_atr_k': 0.0403842994506772, 'slip_spread_k': 0.14933658640525863, 'spread_hl_frac': 0.0014016653886745104, 'bb_std_mult': 1.7983230597802957, 'rsi_os': 22, 'rsi_ob': 65, 'vol_spike': 0.11288940558194482, 'adx_thresh': 29.579048813168814, 'atr_min_pct': 0.024663867897320134, 'atr_max_pct': 0.14251133727829177, 'tp_mult': 1.5257879784326003, 'tsl_mult': 0.49820251611978833, 'strategy': 'breakout', 'time_stop': 16, 'use_sma': True, 'use_atr': True, 'use_adx': False, 'use_ema': False, 'use_spike': False, 'rsi_required': True, 'edge_k': 1.151655327148345, 'edge_cap': 0.15172345357406536, 'bull_strategy': 'breakout', 'bull_bb_std_mult': 1.349159199415221, 'bull_rsi_os': 14, 'bull_rsi_ob': 81, 'bull_adx_thresh': 22.485078508093086, 'bull_atr_min_pct': 0.0009246201631787402, 'bull_atr_max_pct': 0.019749115449063034, 'bull_tp_mult': 1.4504432350645167, 'bull_tsl_mult': 0.3560990650713809, 'bull_time_stop': 132, 'bull_use_sma': False, 'bull_use_ema': False, 'bull_use_atr': True, 'bull_use_adx': False, 'bull_use_spike': False, 'bull_rsi_required': True, 'bear_strategy': 'mean_reversion', 'bear_bb_std_mult': 2.795448334834825, 'bear_rsi_os': 24, 'bear_rsi_ob': 83, 'bear_adx_thresh': 14.705270616888482, 'bear_atr_min_pct': 0.0283725357146224, 'bear_atr_max_pct': 0.13944734030033842, 'bear_tp_mult': 2.076607152034773, 'bear_tsl_mult': 0.8891964782898627, 'bear_time_stop': 262, 'bear_use_sma': False, 'bear_use_ema': True, 'bear_use_atr': False, 'bear_use_adx': False, 'bear_use_spike': True, 'bear_rsi_required': True, 'sideways_strategy': 'breakout', 'sideways_bb_std_mult': 2.652738102614094, 'sideways_rsi_os': 34, 'sideways_rsi_ob': 78, 'sideways_adx_thresh': 6.142289226325021, 'sideways_atr_min_pct': 0.0160441803569007, 'sideways_atr_max_pct': 0.10972243258030434, 'sideways_tp_mult': 2.5433203945714693, 'sideways_tsl_mult': 0.0980029539737145, 'sideways_time_stop': 54, 'sideways_use_sma': True, 'sideways_use_ema': False, 'sideways_use_atr': False, 'sideways_use_adx': True, 'sideways_use_spike': False, 'sideways_rsi_required': False}.
[I 2025-08-31 03:20:52,581] Trial 131 finished with values: [-1000000000.0, 1000000000.0] and parameters: {'p_sma': 5, 'p_std': 15, 'p_atr': 11, 'p_adx': 12, 'rsi_period': 76, 'ema1': 8, 'ema2': 21, 'slip_atr_k': 0.04410205850548651, 'slip_spread_k': 0.13651580927093632, 'spread_hl_frac': 0.000286315370376771, 'bb_std_mult': 1.7979691827688191, 'rsi_os': 6, 'rsi_ob': 64, 'vol_spike': 0.11333060015095829, 'adx_thresh': 30.001410155325626, 'atr_min_pct': 0.021739619444795365, 'atr_max_pct': 0.14388292249778578, 'tp_mult': 1.5570104325376728, 'tsl_mult': 0.44958648454861316, 'strategy': 'breakout', 'time_stop': 17, 'use_sma': True, 'use_atr': True, 'use_adx': True, 'use_ema': False, 'use_spike': True, 'rsi_required': True, 'edge_k': 1.3898671974368444, 'edge_cap': 0.5015868690335352, 'bull_strategy': 'breakout', 'bull_bb_std_mult': 1.306711432656083, 'bull_rsi_os': 10, 'bull_rsi_ob': 80, 'bull_adx_thresh': 20.690997404864962, 'bull_atr_min_pct': 0.0008706648291347024, 'bull_atr_max_pct': 0.01934981224041624, 'bull_tp_mult': 1.419706593668505, 'bull_tsl_mult': 0.2631803266926317, 'bull_time_stop': 141, 'bull_use_sma': False, 'bull_use_ema': True, 'bull_use_atr': False, 'bull_use_adx': False, 'bull_use_spike': False, 'bull_rsi_required': False, 'bear_strategy': 'mean_reversion', 'bear_bb_std_mult': 2.849205747453484, 'bear_rsi_os': 23, 'bear_rsi_ob': 85, 'bear_adx_thresh': 16.378266707011143, 'bear_atr_min_pct': 0.025371468385519333, 'bear_atr_max_pct': 0.14144824721813384, 'bear_tp_mult': 2.0833922311613198, 'bear_tsl_mult': 0.8810954416968922, 'bear_time_stop': 251, 'bear_use_sma': False, 'bear_use_ema': False, 'bear_use_atr': True, 'bear_use_adx': False, 'bear_use_spike': True, 'bear_rsi_required': True, 'sideways_strategy': 'breakout', 'sideways_bb_std_mult': 1.4110934608262768, 'sideways_rsi_os': 24, 'sideways_rsi_ob': 80, 'sideways_adx_thresh': 6.145725991017379, 'sideways_atr_min_pct': 0.014700794282537403, 'sideways_atr_max_pct': 0.10980985506065663, 'sideways_tp_mult': 2.5453698393370856, 'sideways_tsl_mult': 0.42508678470878464, 'sideways_time_stop': 52, 'sideways_use_sma': True, 'sideways_use_ema': True, 'sideways_use_atr': False, 'sideways_use_adx': True, 'sideways_use_spike': True, 'sideways_rsi_required': False}.
[I 2025-08-31 03:20:52,919] Trial 130 finished with values: [-1000000000.0, 1000000000.0] and parameters: {'p_sma': 7, 'p_std': 34, 'p_atr': 12, 'p_adx': 12, 'rsi_period': 80, 'ema1': 16, 'ema2': 58, 'slip_atr_k': 0.03316172243809877, 'slip_spread_k': 0.1489553046534388, 'spread_hl_frac': 0.001676082664536102, 'bb_std_mult': 1.9136129098210903, 'rsi_os': 21, 'rsi_ob': 63, 'vol_spike': 0.09652343486536827, 'adx_thresh': 33.04382563192652, 'atr_min_pct': 0.02569355009348328, 'atr_max_pct': 0.14345030553164137, 'tp_mult': 1.526583819858648, 'tsl_mult': 0.442315205802688, 'strategy': 'breakout', 'time_stop': 16, 'use_sma': True, 'use_atr': True, 'use_adx': True, 'use_ema': False, 'use_spike': True, 'rsi_required': True, 'edge_k': 0.2757250937661254, 'edge_cap': 0.15399485805041396, 'bull_strategy': 'breakout', 'bull_bb_std_mult': 1.3073367879230924, 'bull_rsi_os': 10, 'bull_rsi_ob': 75, 'bull_adx_thresh': 23.832957501454345, 'bull_atr_min_pct': 0.0006757213533107286, 'bull_atr_max_pct': 0.02174914040721533, 'bull_tp_mult': 1.4509817947774666, 'bull_tsl_mult': 0.4138207563954184, 'bull_time_stop': 139, 'bull_use_sma': False, 'bull_use_ema': True, 'bull_use_atr': False, 'bull_use_adx': True, 'bull_use_spike': False, 'bull_rsi_required': False, 'bear_strategy': 'mean_reversion', 'bear_bb_std_mult': 2.269213698028956, 'bear_rsi_os': 24, 'bear_rsi_ob': 84, 'bear_adx_thresh': 16.34972952132055, 'bear_atr_min_pct': 0.0038308415021423344, 'bear_atr_max_pct': 0.14046794171551452, 'bear_tp_mult': 2.0730122418684362, 'bear_tsl_mult': 0.8889350525706119, 'bear_time_stop': 249, 'bear_use_sma': False, 'bear_use_ema': False, 'bear_use_atr': True, 'bear_use_adx': False, 'bear_use_spike': True, 'bear_rsi_required': True, 'sideways_strategy': 'breakout', 'sideways_bb_std_mult': 1.4143831010479861, 'sideways_rsi_os': 37, 'sideways_rsi_ob': 79, 'sideways_adx_thresh': 5.963343976113085, 'sideways_atr_min_pct': 0.014091896650832712, 'sideways_atr_max_pct': 0.10977319157802441, 'sideways_tp_mult': 2.5356424868362577, 'sideways_tsl_mult': 0.34831851645611356, 'sideways_time_stop': 52, 'sideways_use_sma': True, 'sideways_use_ema': True, 'sideways_use_atr': False, 'sideways_use_adx': True, 'sideways_use_spike': True, 'sideways_rsi_required': False}.
[I 2025-08-31 03:21:26,349] Trial 134 finished with values: [-1000000000.0, 1000000000.0] and parameters: {'p_sma': 5, 'p_std': 14, 'p_atr': 12, 'p_adx': 12, 'rsi_period': 77, 'ema1': 23, 'ema2': 37, 'slip_atr_k': 0.034844873435891766, 'slip_spread_k': 0.23519380843401905, 'spread_hl_frac': 0.001985943413744048, 'bb_std_mult': 2.534425581888244, 'rsi_os': 11, 'rsi_ob': 67, 'vol_spike': 0.0934833180589393, 'adx_thresh': 9.856987007285664, 'atr_min_pct': 0.022131261171710267, 'atr_max_pct': 0.14234983072789398, 'tp_mult': 1.826018427045261, 'tsl_mult': 0.4466065726280132, 'strategy': 'breakout', 'time_stop': 20, 'use_sma': True, 'use_atr': True, 'use_adx': True, 'use_ema': False, 'use_spike': False, 'rsi_required': True, 'edge_k': 0.2134690692735891, 'edge_cap': 0.1226687209689397, 'bull_strategy': 'breakout', 'bull_bb_std_mult': 1.0675901250753923, 'bull_rsi_os': 14, 'bull_rsi_ob': 76, 'bull_adx_thresh': 19.535989850033907, 'bull_atr_min_pct': 0.0010591208120644406, 'bull_atr_max_pct': 0.02467116302867446, 'bull_tp_mult': 1.2939377920936104, 'bull_tsl_mult': 0.3179508971268033, 'bull_time_stop': 130, 'bull_use_sma': False, 'bull_use_ema': False, 'bull_use_atr': True, 'bull_use_adx': False, 'bull_use_spike': False, 'bull_rsi_required': True, 'bear_strategy': 'mean_reversion', 'bear_bb_std_mult': 2.842767673208555, 'bear_rsi_os': 21, 'bear_rsi_ob': 85, 'bear_adx_thresh': 14.846493875109935, 'bear_atr_min_pct': 0.009179730014471065, 'bear_atr_max_pct': 0.10898759520258591, 'bear_tp_mult': 2.281903428236606, 'bear_tsl_mult': 0.23004673770618206, 'bear_time_stop': 261, 'bear_use_sma': False, 'bear_use_ema': False, 'bear_use_atr': False, 'bear_use_adx': False, 'bear_use_spike': True, 'bear_rsi_required': True, 'sideways_strategy': 'breakout', 'sideways_bb_std_mult': 2.842750407893332, 'sideways_rsi_os': 33, 'sideways_rsi_ob': 80, 'sideways_adx_thresh': 6.51590589332886, 'sideways_atr_min_pct': 0.015762375896448397, 'sideways_atr_max_pct': 0.11545963354746008, 'sideways_tp_mult': 2.5530733023966263, 'sideways_tsl_mult': 0.27740954970025933, 'sideways_time_stop': 45, 'sideways_use_sma': True, 'sideways_use_ema': True, 'sideways_use_atr': False, 'sideways_use_adx': True, 'sideways_use_spike': True, 'sideways_rsi_required': False}.
