[I 2025-08-31 03:14:14,261] Trial 81 finished with values: [-1000000000.0, 1000000000.0] and parameters: {'p_sma': 38, 'p_std': 24, 'p_atr': 14, 'p_adx': 8, 'rsi_period': 16, 'ema1': 6, 'ema2': 11, 'slip_atr_k': 0.0005798172000561928, 'slip_spread_k': 0.9202957295478029, 'spread_hl_frac': 0.04648573811565227, 'bb_std_mult': 0.5957002800376294, 'rsi_os': 40, 'rsi_ob': 83, 'vol_spike': 0.19613023239320715, 'adx_thresh': 26.341247719252074, 'atr_min_pct': 0.01251635934018427, 'atr_max_pct': 0.08503857169824112, 'tp_mult': 1.7616331808741892, 'tsl_mult': 0.6053847339499518, 'strategy': 'breakout', 'time_stop': 206, 'use_sma': False, 'use_atr': False, 'use_adx': True, 'use_ema': False, 'use_spike': False, 'rsi_required': False, 'edge_k': 0.4377329136566675, 'edge_cap': 0.19738952937807788, 'bull_strategy': 'mean_reversion', 'bull_bb_std_mult': 1.4583895478720588, 'bull_rsi_os': 10, 'bull_rsi_ob': 68, 'bull_adx_thresh': 26.959547943226866, 'bull_atr_min_pct': 0.008192752728367723, 'bull_atr_max_pct': 0.01563798194333589, 'bull_tp_mult': 1.99668481446801, 'bull_tsl_mult': 0.9377564012280675, 'bull_time_stop': 115, 'bull_use_sma': False, 'bull_use_ema': False, 'bull_use_atr': True, 'bull_use_adx': False, 'bull_use_spike': False, 'bull_rsi_required': False, 'bear_strategy': 'breakout', 'bear_bb_std_mult': 2.6243216114257377, 'bear_rsi_os': 14, 'bear_rsi_ob': 76, 'bear_adx_thresh': 11.111727458385928, 'bear_atr_min_pct': 0.011642305240055571, 'bear_atr_max_pct': 0.054832610970747014, 'bear_tp_mult': 2.742669376413457, 'bear_tsl_mult': 0.8425394120379737, 'bear_time_stop': 45, 'bear_use_sma': False, 'bear_use_ema': False, 'bear_use_atr': True, 'bear_use_adx': False, 'bear_use_spike': True, 'bear_rsi_required': False, 'sideways_strategy': 'mean_reversion', 'sideways_bb_std_mult': 1.2971506833221143, 'sideways_rsi_os': 9, 'sideways_rsi_ob': 46, 'sideways_adx_thresh': 15.935789709366087, 'sideways_atr_min_pct': 0.02183502753060164, 'sideways_atr_max_pct': 0.048043114580937483, 'sideways_tp_mult': 1.7207629231490906, 'sideways_tsl_mult': 0.3846616658117305, 'sideways_time_stop': 283, 'sideways_use_sma': False, 'sideways_use_ema': False, 'sideways_use_atr': False, 'sideways_use_adx': False, 'sideways_use_spike': False, 'sideways_rsi_required': False}.
[I 2025-08-31 03:14:15,040] Trial 82 finished with values: [-1000000000.0, 1000000000.0] and parameters: {'p_sma': 37, 'p_std': 19, 'p_atr': 26, 'p_adx': 27, 'rsi_period': 59, 'ema1': 5, 'ema2': 35, 'slip_atr_k': 0.0025835547037664254, 'slip_spread_k': 0.7612390469063834, 'spread_hl_frac': 0.04624949320769548, 'bb_std_mult': 0.5816791626874415, 'rsi_os': 44, 'rsi_ob': 92, 'vol_spike': 0.19615692336037843, 'adx_thresh': 25.886988920381647, 'atr_min_pct': 0.0256665912399781, 'atr_max_pct': 0.08460551612048582, 'tp_mult': 1.8648102118021814, 'tsl_mult': 0.6735854753854165, 'strategy': 'breakout', 'time_stop': 55, 'use_sma': False, 'use_atr': False, 'use_adx': True, 'use_ema': False, 'use_spike': False, 'rsi_required': False, 'edge_k': 0.17186356692134933, 'edge_cap': 0.18498494553898118, 'bull_strategy': 'mean_reversion', 'bull_bb_std_mult': 2.7868598054324423, 'bull_rsi_os': 36, 'bull_rsi_ob': 81, 'bull_adx_thresh': 7.171701797032387, 'bull_atr_min_pct': 0.013668156347546563, 'bull_atr_max_pct': 0.12629574746247735, 'bull_tp_mult': 2.126442644412133, 'bull_tsl_mult': 0.36840858705124546, 'bull_time_stop': 296, 'bull_use_sma': False, 'bull_use_ema': False, 'bull_use_atr': True, 'bull_use_adx': False, 'bull_use_spike': False, 'bull_rsi_required': True, 'bear_strategy': 'mean_reversion', 'bear_bb_std_mult': 2.3379771824298734, 'bear_rsi_os': 24, 'bear_rsi_ob': 84, 'bear_adx_thresh': 20.482213913920464, 'bear_atr_min_pct': 0.020978491730066256, 'bear_atr_max_pct': 0.06921244806856967, 'bear_tp_mult': 1.180113740962271, 'bear_tsl_mult': 0.9457892044027907, 'bear_time_stop': 111, 'bear_use_sma': False, 'bear_use_ema': False, 'bear_use_atr': False, 'bear_use_adx': True, 'bear_use_spike': True, 'bear_rsi_required': False, 'sideways_strategy': 'breakout', 'sideways_bb_std_mult': 1.285703576228189, 'sideways_rsi_os': 39, 'sideways_rsi_ob': 48, 'sideways_adx_thresh': 22.207843255749083, 'sideways_atr_min_pct': 0.021497959660354626, 'sideways_atr_max_pct': 0.07121087771829306, 'sideways_tp_mult': 1.847794306716807, 'sideways_tsl_mult': 0.8498130410744955, 'sideways_time_stop': 12, 'sideways_use_sma': True, 'sideways_use_ema': True, 'sideways_use_atr': False, 'sideways_use_adx': False, 'sideways_use_spike': False, 'sideways_rsi_required': False}.
[I 2025-08-31 03:14:15,336] Trial 83 finished with values: [-1000000000.0, 1000000000.0] and parameters: {'p_sma': 38, 'p_std': 33, 'p_atr': 9, 'p_adx': 8, 'rsi_period': 59, 'ema1': 6, 'ema2': 52, 'slip_atr_k': 0.15123906512327512, 'slip_spread_k': 0.9609740848958086, 'spread_hl_frac': 0.04140269057841877, 'bb_std_mult': 0.5802750217440926, 'rsi_os': 40, 'rsi_ob': 91, 'vol_spike': 0.199017182165735, 'adx_thresh': 19.10182990327781, 'atr_min_pct': 0.027017755462376846, 'atr_max_pct': 0.09759377319078093, 'tp_mult': 2.6004083068385944, 'tsl_mult': 0.5894087719577847, 'strategy': 'breakout', 'time_stop': 210, 'use_sma': False, 'use_atr': False, 'use_adx': True, 'use_ema': False, 'use_spike': True, 'rsi_required': False, 'edge_k': 0.17701337032765835, 'edge_cap': 0.4863804362779816, 'bull_strategy': 'mean_reversion', 'bull_bb_std_mult': 2.083321796359695, 'bull_rsi_os': 43, 'bull_rsi_ob': 53, 'bull_adx_thresh': 27.543795939835732, 'bull_atr_min_pct': 0.008444604455792528, 'bull_atr_max_pct': 0.13458634258015906, 'bull_tp_mult': 2.7405532168782214, 'bull_tsl_mult': 0.7085840827894234, 'bull_time_stop': 210, 'bull_use_sma': True, 'bull_use_ema': False, 'bull_use_atr': True, 'bull_use_adx': False, 'bull_use_spike': False, 'bull_rsi_required': False, 'bear_strategy': 'breakout', 'bear_bb_std_mult': 3.082769233884223, 'bear_rsi_os': 34, 'bear_rsi_ob': 92, 'bear_adx_thresh': 34.84475584150046, 'bear_atr_min_pct': 0.0020716360178264018, 'bear_atr_max_pct': 0.06623497075348247, 'bear_tp_mult': 1.7313221914670276, 'bear_tsl_mult': 0.8356214185230182, 'bear_time_stop': 289, 'bear_use_sma': False, 'bear_use_ema': True, 'bear_use_atr': False, 'bear_use_adx': True, 'bear_use_spike': False, 'bear_rsi_required': False, 'sideways_strategy': 'mean_reversion', 'sideways_bb_std_mult': 2.0313362102445556, 'sideways_rsi_os': 40, 'sideways_rsi_ob': 82, 'sideways_adx_thresh': 15.520196761545428, 'sideways_atr_min_pct': 0.01740153935639754, 'sideways_atr_max_pct': 0.08198401238912079, 'sideways_tp_mult': 1.7875701510413013, 'sideways_tsl_mult': 0.5739214745039707, 'sideways_time_stop': 109, 'sideways_use_sma': False, 'sideways_use_ema': True, 'sideways_use_atr': False, 'sideways_use_adx': True, 'sideways_use_spike': False, 'sideways_rsi_required': False}.
[I 2025-08-31 03:14:15,424] Trial 84 finished with values: [-1000000000.0, 1000000000.0] and parameters: {'p_sma': 43, 'p_std': 26, 'p_atr': 12, 'p_adx': 26, 'rsi_period': 65, 'ema1': 6, 'ema2': 36, 'slip_atr_k': 0.00175169955748615, 'slip_spread_k': 0.02210807381858898, 'spread_hl_frac': 0.04122386452932367, 'bb_std_mult': 0.5036008656083749, 'rsi_os': 35, 'rsi_ob': 48, 'vol_spike': 0.19657874819326632, 'adx_thresh': 19.040426150335342, 'atr_min_pct': 0.02250885031317372, 'atr_max_pct': 0.08559468111947788, 'tp_mult': 1.935255085814739, 'tsl_mult': 0.7080365607778998, 'strategy': 'breakout', 'time_stop': 50, 'use_sma': False, 'use_atr': False, 'use_adx': True, 'use_ema': False, 'use_spike': True, 'rsi_required': False, 'edge_k': 1.5318532934810136, 'edge_cap': 0.1912504041283394, 'bull_strategy': 'mean_reversion', 'bull_bb_std_mult': 1.4765565630282163, 'bull_rsi_os': 44, 'bull_rsi_ob': 73, 'bull_adx_thresh': 26.77267961848108, 'bull_atr_min_pct': 0.014077120640948418, 'bull_atr_max_pct': 0.14192137808559588, 'bull_tp_mult': 2.742669882226705, 'bull_tsl_mult': 0.5134055346338152, 'bull_time_stop': 196, 'bull_use_sma': False, 'bull_use_ema': False, 'bull_use_atr': True, 'bull_use_adx': False, 'bull_use_spike': False, 'bull_rsi_required': False, 'bear_strategy': 'breakout', 'bear_bb_std_mult': 3.192022766614741, 'bear_rsi_os': 6, 'bear_rsi_ob': 83, 'bear_adx_thresh': 20.3463962331052, 'bear_atr_min_pct': 0.025614535734176564, 'bear_atr_max_pct': 0.06619244389060339, 'bear_tp_mult': 1.6626766867647207, 'bear_tsl_mult': 0.5324058507001481, 'bear_time_stop': 295, 'bear_use_sma': False, 'bear_use_ema': False, 'bear_use_atr': False, 'bear_use_adx': True, 'bear_use_spike': True, 'bear_rsi_required': False, 'sideways_strategy': 'mean_reversion', 'sideways_bb_std_mult': 1.4771015474558158, 'sideways_rsi_os': 41, 'sideways_rsi_ob': 83, 'sideways_adx_thresh': 15.37944987538127, 'sideways_atr_min_pct': 0.0001607108497328977, 'sideways_atr_max_pct': 0.09585476709010646, 'sideways_tp_mult': 1.6891582448005606, 'sideways_tsl_mult': 0.9503245556246651, 'sideways_time_stop': 159, 'sideways_use_sma': False, 'sideways_use_ema': True, 'sideways_use_atr': False, 'sideways_use_adx': True, 'sideways_use_spike': False, 'sideways_rsi_required': False}.
[I 2025-08-31 03:14:48,359] Trial 85 finished with values: [-0.10847494800915813, 0.1084426891697673] and parameters: {'p_sma': 50, 'p_std': 27, 'p_atr': 17, 'p_adx': 19, 'rsi_period': 38, 'ema1': 16, 'ema2': 19, 'slip_atr_k': 0.18204806199792184, 'slip_spread_k': 0.43449408288771457, 'spread_hl_frac': 0.04166443444849484, 'bb_std_mult': 0.5102615885590921, 'rsi_os': 35, 'rsi_ob': 92, 'vol_spike': 0.16627579314019464, 'adx_thresh': 19.14717598501234, 'atr_min_pct': 0.02209629151847474, 'atr_max_pct': 0.09958159579543391, 'tp_mult': 1.9536052178726162, 'tsl_mult': 0.6706150819216563, 'strategy': 'breakout', 'time_stop': 103, 'use_sma': True, 'use_atr': False, 'use_adx': False, 'use_ema': False, 'use_spike': True, 'rsi_required': True, 'edge_k': 0.3160727377400253, 'edge_cap': 0.1373646187798728, 'bull_strategy': 'mean_reversion', 'bull_bb_std_mult': 2.0725540239720615, 'bull_rsi_os': 43, 'bull_rsi_ob': 73, 'bull_adx_thresh': 7.506717157890707, 'bull_atr_min_pct': 0.009736026257476169, 'bull_atr_max_pct': 0.13452058051539934, 'bull_tp_mult': 1.611032366364544, 'bull_tsl_mult': 0.6962042940191575, 'bull_time_stop': 199, 'bull_use_sma': False, 'bull_use_ema': False, 'bull_use_atr': True, 'bull_use_adx': False, 'bull_use_spike': False, 'bull_rsi_required': True, 'bear_strategy': 'mean_reversion', 'bear_bb_std_mult': 3.0613017076983855, 'bear_rsi_os': 6, 'bear_rsi_ob': 83, 'bear_adx_thresh': 18.23355688434258, 'bear_atr_min_pct': 0.028186368016455413, 'bear_atr_max_pct': 0.0454760576867164, 'bear_tp_mult': 1.6608068155032054, 'bear_tsl_mult': 0.936909280500645, 'bear_time_stop': 290, 'bear_use_sma': False, 'bear_use_ema': False, 'bear_use_atr': False, 'bear_use_adx': True, 'bear_use_spike': True, 'bear_rsi_required': False, 'sideways_strategy': 'breakout', 'sideways_bb_std_mult': 1.4999140650099039, 'sideways_rsi_os': 39, 'sideways_rsi_ob': 82, 'sideways_adx_thresh': 22.455134355466594, 'sideways_atr_min_pct': 8.12055323695362e-05, 'sideways_atr_max_pct': 0.08178381664417635, 'sideways_tp_mult': 1.873734259272534, 'sideways_tsl_mult': 0.9669166554012609, 'sideways_time_stop': 13, 'sideways_use_sma': True, 'sideways_use_ema': True, 'sideways_use_atr': False, 'sideways_use_adx': True, 'sideways_use_spike': False, 'sideways_rsi_required': True}.
[I 2025-08-31 03:14:49,038] Trial 88 finished with values: [-1000000000.0, 1000000000.0] and parameters: {'p_sma': 9, 'p_std': 30, 'p_atr': 17, 'p_adx': 19, 'rsi_period': 74, 'ema1': 16, 'ema2': 56, 'slip_atr_k': 0.18551483913498776, 'slip_spread_k': 0.6319925260283208, 'spread_hl_frac': 0.035882126994076315, 'bb_std_mult': 2.6166134828050276, 'rsi_os': 55, 'rsi_ob': 94, 'vol_spike': 0.16878749821294978, 'adx_thresh': 23.771788631273964, 'atr_min_pct': 0.02188477699352893, 'atr_max_pct': 0.11072678997575609, 'tp_mult': 2.990216661905464, 'tsl_mult': 0.6348956724035031, 'strategy': 'breakout', 'time_stop': 238, 'use_sma': True, 'use_atr': True, 'use_adx': False, 'use_ema': False, 'use_spike': False, 'rsi_required': True, 'edge_k': 1.2982242732168352, 'edge_cap': 0.14058262957920287, 'bull_strategy': 'breakout', 'bull_bb_std_mult': 2.999858602750757, 'bull_rsi_os': 16, 'bull_rsi_ob': 76, 'bull_adx_thresh': 11.22724487458595, 'bull_atr_min_pct': 0.015655933772951623, 'bull_atr_max_pct': 0.042282089521918725, 'bull_tp_mult': 1.6111860720318492, 'bull_tsl_mult': 0.998766050513032, 'bull_time_stop': 147, 'bull_use_sma': False, 'bull_use_ema': False, 'bull_use_atr': True, 'bull_use_adx': True, 'bull_use_spike': True, 'bull_rsi_required': True, 'bear_strategy': 'mean_reversion', 'bear_bb_std_mult': 1.2946354946088943, 'bear_rsi_os': 6, 'bear_rsi_ob': 82, 'bear_adx_thresh': 7.267004708391468, 'bear_atr_min_pct': 0.02925036902560258, 'bear_atr_max_pct': 0.07813208221436502, 'bear_tp_mult': 1.8412757165982783, 'bear_tsl_mult': 0.9119958998673616, 'bear_time_stop': 69, 'bear_use_sma': False, 'bear_use_ema': False, 'bear_use_atr': False, 'bear_use_adx': False, 'bear_use_spike': True, 'bear_rsi_required': True, 'sideways_strategy': 'breakout', 'sideways_bb_std_mult': 1.6026979029525616, 'sideways_rsi_os': 38, 'sideways_rsi_ob': 78, 'sideways_adx_thresh': 26.62553030615252, 'sideways_atr_min_pct': 0.0009674093116959376, 'sideways_atr_max_pct': 0.09985394058129797, 'sideways_tp_mult': 1.033145246241826, 'sideways_tsl_mult': 0.7906337003642385, 'sideways_time_stop': 28, 'sideways_use_sma': True, 'sideways_use_ema': True, 'sideways_use_atr': False, 'sideways_use_adx': True, 'sideways_use_spike': True, 'sideways_rsi_required': True}.
[I 2025-08-31 03:14:49,375] Trial 86 finished with values: [-0.08898149398029509, 0.08891055044237088] and parameters: {'p_sma': 59, 'p_std': 27, 'p_atr': 17, 'p_adx': 29, 'rsi_period': 40, 'ema1': 16, 'ema2': 56, 'slip_atr_k': 0.15792501460320388, 'slip_spread_k': 0.4351063968117467, 'spread_hl_frac': 0.041402428242495265, 'bb_std_mult': 0.5180157957642666, 'rsi_os': 35, 'rsi_ob': 49, 'vol_spike': 0.2882801758546427, 'adx_thresh': 23.99731292428085, 'atr_min_pct': 0.02207763023794003, 'atr_max_pct': 0.09797083584115243, 'tp_mult': 2.066405676920358, 'tsl_mult': 0.5904048818716294, 'strategy': 'breakout', 'time_stop': 248, 'use_sma': True, 'use_atr': False, 'use_adx': False, 'use_ema': False, 'use_spike': True, 'rsi_required': True, 'edge_k': 0.298928559067524, 'edge_cap': 0.06897730562174992, 'bull_strategy': 'breakout', 'bull_bb_std_mult': 2.07212179644822, 'bull_rsi_os': 44, 'bull_rsi_ob': 72, 'bull_adx_thresh': 33.13245161112408, 'bull_atr_min_pct': 0.0014376122898229413, 'bull_atr_max_pct': 0.13586301790238223, 'bull_tp_mult': 1.5951550572862123, 'bull_tsl_mult': 0.6977769569044587, 'bull_time_stop': 210, 'bull_use_sma': False, 'bull_use_ema': False, 'bull_use_atr': True, 'bull_use_adx': False, 'bull_use_spike': False, 'bull_rsi_required': True, 'bear_strategy': 'mean_reversion', 'bear_bb_std_mult': 1.3031005458851657, 'bear_rsi_os': 6, 'bear_rsi_ob': 81, 'bear_adx_thresh': 17.57973372208127, 'bear_atr_min_pct': 0.0016714060625830328, 'bear_atr_max_pct': 0.07899507067450398, 'bear_tp_mult': 1.6753901356591716, 'bear_tsl_mult': 0.29212340548166726, 'bear_time_stop': 90, 'bear_use_sma': False, 'bear_use_ema': False, 'bear_use_atr': False, 'bear_use_adx': True, 'bear_use_spike': True, 'bear_rsi_required': True, 'sideways_strategy': 'breakout', 'sideways_bb_std_mult': 1.4505766550443306, 'sideways_rsi_os': 41, 'sideways_rsi_ob': 83, 'sideways_adx_thresh': 28.870628769836507, 'sideways_atr_min_pct': 0.00017832253873145855, 'sideways_atr_max_pct': 0.05801000354173924, 'sideways_tp_mult': 2.886201964862411, 'sideways_tsl_mult': 0.56430191809137, 'sideways_time_stop': 27, 'sideways_use_sma': True, 'sideways_use_ema': True, 'sideways_use_atr': False, 'sideways_use_adx': True, 'sideways_use_spike': True, 'sideways_rsi_required': True}.
[I 2025-08-31 03:14:49,529] Trial 87 finished with values: [-0.04562457184801827, 0.04556069639358751] and parameters: {'p_sma': 9, 'p_std': 26, 'p_atr': 17, 'p_adx': 29, 'rsi_period': 40, 'ema1': 16, 'ema2': 19, 'slip_atr_k': 0.05071702095343777, 'slip_spread_k': 0.6268361603179324, 'spread_hl_frac': 0.03508249522258803, 'bb_std_mult': 1.1580337734059833, 'rsi_os': 34, 'rsi_ob': 63, 'vol_spike': 0.16813240978539898, 'adx_thresh': 23.945433443732373, 'atr_min_pct': 0.02079550977646863, 'atr_max_pct': 0.11080550920237642, 'tp_mult': 2.9981325320713523, 'tsl_mult': 0.7139277874770383, 'strategy': 'breakout', 'time_stop': 197, 'use_sma': True, 'use_atr': True, 'use_adx': False, 'use_ema': False, 'use_spike': True, 'rsi_required': True, 'edge_k': 0.29918615231503687, 'edge_cap': 0.1395118711799162, 'bull_strategy': 'breakout', 'bull_bb_std_mult': 3.075219797015966, 'bull_rsi_os': 16, 'bull_rsi_ob': 73, 'bull_adx_thresh': 18.832929762642053, 'bull_atr_min_pct': 0.015334081819803936, 'bull_atr_max_pct': 0.14316190815663118, 'bull_tp_mult': 1.592129126286587, 'bull_tsl_mult': 0.5082170566688077, 'bull_time_stop': 83, 'bull_use_sma': False, 'bull_use_ema': False, 'bull_use_atr': True, 'bull_use_adx': True, 'bull_use_spike': True, 'bull_rsi_required': True, 'bear_strategy': 'mean_reversion', 'bear_bb_std_mult': 1.6018024448728554, 'bear_rsi_os': 6, 'bear_rsi_ob': 81, 'bear_adx_thresh': 18.23018626074392, 'bear_atr_min_pct': 0.014643984247263115, 'bear_atr_max_pct': 0.07938183285157602, 'bear_tp_mult': 1.813442895746924, 'bear_tsl_mult': 0.30539144430563925, 'bear_time_stop': 17, 'bear_use_sma': False, 'bear_use_ema': False, 'bear_use_atr': False, 'bear_use_adx': False, 'bear_use_spike': True, 'bear_rsi_required': True, 'sideways_strategy': 'breakout', 'sideways_bb_std_mult': 1.4987478025599672, 'sideways_rsi_os': 41, 'sideways_rsi_ob': 54, 'sideways_adx_thresh': 26.15081491035642, 'sideways_atr_min_pct': 0.00010470405571278514, 'sideways_atr_max_pct': 0.0968216766673347, 'sideways_tp_mult': 2.290929074070627, 'sideways_tsl_mult': 0.78972911839032, 'sideways_time_stop': 248, 'sideways_use_sma': True, 'sideways_use_ema': True, 'sideways_use_atr': False, 'sideways_use_adx': True, 'sideways_use_spike': True, 'sideways_rsi_required': True}.
[I 2025-08-31 03:15:23,417] Trial 92 finished with values: [-1000000000.0, 1000000000.0] and parameters: {'p_sma': 57, 'p_std': 8, 'p_atr': 15, 'p_adx': 14, 'rsi_period': 70, 'ema1': 25, 'ema2': 28, 'slip_atr_k': 0.08156422986271228, 'slip_spread_k': 0.5436310490184202, 'spread_hl_frac': 0.04420365680750045, 'bb_std_mult': 3.0702608208411815, 'rsi_os': 33, 'rsi_ob': 62, 'vol_spike': 0.04581055815352242, 'adx_thresh': 31.383332344176775, 'atr_min_pct': 0.007129167364743182, 'atr_max_pct': 0.1167947253698354, 'tp_mult': 2.8699772900627445, 'tsl_mult': 0.5321600582034561, 'strategy': 'mean_reversion', 'time_stop': 88, 'use_sma': False, 'use_atr': True, 'use_adx': True, 'use_ema': False, 'use_spike': False, 'rsi_required': False, 'edge_k': 1.4182281175415834, 'edge_cap': 0.2351171289732139, 'bull_strategy': 'breakout', 'bull_bb_std_mult': 1.8154638051008718, 'bull_rsi_os': 19, 'bull_rsi_ob': 85, 'bull_adx_thresh': 19.11990090653715, 'bull_atr_min_pct': 0.02839381064535236, 'bull_atr_max_pct': 0.14264848858636398, 'bull_tp_mult': 1.7196022501390458, 'bull_tsl_mult': 0.7940024256945507, 'bull_time_stop': 91, 'bull_use_sma': True, 'bull_use_ema': True, 'bull_use_atr': True, 'bull_use_adx': True, 'bull_use_spike': True, 'bull_rsi_required': True, 'bear_strategy': 'mean_reversion', 'bear_bb_std_mult': 1.6116856518008158, 'bear_rsi_os': 8, 'bear_rsi_ob': 81, 'bear_adx_thresh': 21.837630086340656, 'bear_atr_min_pct': 0.014877431996074011, 'bear_atr_max_pct': 0.14451017043260378, 'bear_tp_mult': 1.7496045540959908, 'bear_tsl_mult': 0.2256495645174475, 'bear_time_stop': 157, 'bear_use_sma': False, 'bear_use_ema': True, 'bear_use_atr': False, 'bear_use_adx': False, 'bear_use_spike': False, 'bear_rsi_required': False, 'sideways_strategy': 'breakout', 'sideways_bb_std_mult': 2.3916312707973546, 'sideways_rsi_os': 44, 'sideways_rsi_ob': 51, 'sideways_adx_thresh': 34.7178673738604, 'sideways_atr_min_pct': 0.02884446273901045, 'sideways_atr_max_pct': 0.11097874223460714, 'sideways_tp_mult': 2.56750315655632, 'sideways_tsl_mult': 0.7238041960785199, 'sideways_time_stop': 62, 'sideways_use_sma': True, 'sideways_use_ema': False, 'sideways_use_atr': False, 'sideways_use_adx': True, 'sideways_use_spike': True, 'sideways_rsi_required': False}.
