[I 2025-08-31 03:21:26,593] Trial 137 finished with values: [-1000000000.0, 1000000000.0] and parameters: {'p_sma': 10, 'p_std': 11, 'p_atr': 12, 'p_adx': 21, 'rsi_period': 78, 'ema1': 17, 'ema2': 23, 'slip_atr_k': 0.05283328582422411, 'slip_spread_k': 0.09952270665471882, 'spread_hl_frac': 0.0027407994622811404, 'bb_std_mult': 2.5326474419562395, 'rsi_os': 19, 'rsi_ob': 68, 'vol_spike': 0.12810841965960776, 'adx_thresh': 17.629591539237136, 'atr_min_pct': 0.022370288973299842, 'atr_max_pct': 0.14763062009122738, 'tp_mult': 1.8507714804147282, 'tsl_mult': 0.5244057690596018, 'strategy': 'breakout', 'time_stop': 24, 'use_sma': True, 'use_atr': True, 'use_adx': True, 'use_ema': True, 'use_spike': False, 'rsi_required': True, 'edge_k': 0.2143505456201108, 'edge_cap': 0.1224764999735771, 'bull_strategy': 'mean_reversion', 'bull_bb_std_mult': 1.100205634294816, 'bull_rsi_os': 15, 'bull_rsi_ob': 77, 'bull_adx_thresh': 19.358070654676666, 'bull_atr_min_pct': 0.0025638792748210407, 'bull_atr_max_pct': 0.027704087376566267, 'bull_tp_mult': 2.882794242529109, 'bull_tsl_mult': 0.317688844883976, 'bull_time_stop': 158, 'bull_use_sma': False, 'bull_use_ema': False, 'bull_use_atr': True, 'bull_use_adx': False, 'bull_use_spike': False, 'bull_rsi_required': True, 'bear_strategy': 'breakout', 'bear_bb_std_mult': 2.1798441302146934, 'bear_rsi_os': 21, 'bear_rsi_ob': 86, 'bear_adx_thresh': 28.242537607054228, 'bear_atr_min_pct': 0.010018927476257216, 'bear_atr_max_pct': 0.10833493475345268, 'bear_tp_mult': 2.294978742503173, 'bear_tsl_mult': 0.2510332483301093, 'bear_time_stop': 237, 'bear_use_sma': False, 'bear_use_ema': False, 'bear_use_atr': False, 'bear_use_adx': True, 'bear_use_spike': True, 'bear_rsi_required': True, 'sideways_strategy': 'mean_reversion', 'sideways_bb_std_mult': 1.2701920380486922, 'sideways_rsi_os': 39, 'sideways_rsi_ob': 74, 'sideways_adx_thresh': 6.687089653261757, 'sideways_atr_min_pct': 0.008606943935070964, 'sideways_atr_max_pct': 0.11615651907582351, 'sideways_tp_mult': 2.6272739103122893, 'sideways_tsl_mult': 0.2794386986412244, 'sideways_time_stop': 40, 'sideways_use_sma': False, 'sideways_use_ema': True, 'sideways_use_atr': False, 'sideways_use_adx': False, 'sideways_use_spike': True, 'sideways_rsi_required': False}.
[I 2025-08-31 03:21:26,599] Trial 135 finished with values: [-1000000000.0, 1000000000.0] and parameters: {'p_sma': 9, 'p_std': 10, 'p_atr': 12, 'p_adx': 13, 'rsi_period': 77, 'ema1': 21, 'ema2': 37, 'slip_atr_k': 0.03040868669149183, 'slip_spread_k': 0.10012381397134829, 'spread_hl_frac': 0.00250852205353379, 'bb_std_mult': 1.9174481614146184, 'rsi_os': 18, 'rsi_ob': 68, 'vol_spike': 0.1280258130507136, 'adx_thresh': 17.40444295562725, 'atr_min_pct': 0.025674079703306353, 'atr_max_pct': 0.13500156403109598, 'tp_mult': 1.8595571473087473, 'tsl_mult': 0.4379753794691278, 'strategy': 'breakout', 'time_stop': 23, 'use_sma': True, 'use_atr': True, 'use_adx': True, 'use_ema': False, 'use_spike': False, 'rsi_required': True, 'edge_k': 0.20315106819320264, 'edge_cap': 0.1236858922637752, 'bull_strategy': 'breakout', 'bull_bb_std_mult': 1.276630954411892, 'bull_rsi_os': 14, 'bull_rsi_ob': 77, 'bull_adx_thresh': 19.770343738261925, 'bull_atr_min_pct': 0.001893661163142821, 'bull_atr_max_pct': 0.02576800314867156, 'bull_tp_mult': 1.3106891557907794, 'bull_tsl_mult': 0.4285152996403362, 'bull_time_stop': 138, 'bull_use_sma': False, 'bull_use_ema': False, 'bull_use_atr': True, 'bull_use_adx': False, 'bull_use_spike': False, 'bull_rsi_required': True, 'bear_strategy': 'mean_reversion', 'bear_bb_std_mult': 2.920334906680022, 'bear_rsi_os': 22, 'bear_rsi_ob': 85, 'bear_adx_thresh': 15.831024821905489, 'bear_atr_min_pct': 0.02547830256806162, 'bear_atr_max_pct': 0.1270223896809991, 'bear_tp_mult': 2.276739823280968, 'bear_tsl_mult': 0.6819579310350692, 'bear_time_stop': 238, 'bear_use_sma': False, 'bear_use_ema': False, 'bear_use_atr': False, 'bear_use_adx': False, 'bear_use_spike': True, 'bear_rsi_required': True, 'sideways_strategy': 'breakout', 'sideways_bb_std_mult': 1.2398470642826283, 'sideways_rsi_os': 36, 'sideways_rsi_ob': 84, 'sideways_adx_thresh': 5.502910092844109, 'sideways_atr_min_pct': 0.009180969169860585, 'sideways_atr_max_pct': 0.11636465081097053, 'sideways_tp_mult': 2.438385742215823, 'sideways_tsl_mult': 0.36921470072359697, 'sideways_time_stop': 42, 'sideways_use_sma': True, 'sideways_use_ema': True, 'sideways_use_atr': False, 'sideways_use_adx': True, 'sideways_use_spike': True, 'sideways_rsi_required': False}.
[I 2025-08-31 03:21:26,838] Trial 136 finished with values: [-0.015911486822619225, 0.016027206523651347] and parameters: {'p_sma': 48, 'p_std': 34, 'p_atr': 12, 'p_adx': 13, 'rsi_period': 78, 'ema1': 14, 'ema2': 23, 'slip_atr_k': 0.032218441609906334, 'slip_spread_k': 0.232682787362108, 'spread_hl_frac': 0.0025233641807928258, 'bb_std_mult': 1.9337032335632922, 'rsi_os': 10, 'rsi_ob': 67, 'vol_spike': 0.09331627977062315, 'adx_thresh': 17.217674500820298, 'atr_min_pct': 0.025629411706605935, 'atr_max_pct': 0.1480085022170625, 'tp_mult': 1.7041053624905265, 'tsl_mult': 0.4574459345973782, 'strategy': 'breakout', 'time_stop': 25, 'use_sma': True, 'use_atr': True, 'use_adx': True, 'use_ema': False, 'use_spike': False, 'rsi_required': True, 'edge_k': 1.3059552610428962, 'edge_cap': 0.3337787485954655, 'bull_strategy': 'breakout', 'bull_bb_std_mult': 1.0590267691574653, 'bull_rsi_os': 14, 'bull_rsi_ob': 77, 'bull_adx_thresh': 19.769278242750424, 'bull_atr_min_pct': 1.9692878878233076e-05, 'bull_atr_max_pct': 0.02590474696784516, 'bull_tp_mult': 1.2921220729818528, 'bull_tsl_mult': 0.4540275161652074, 'bull_time_stop': 167, 'bull_use_sma': False, 'bull_use_ema': False, 'bull_use_atr': True, 'bull_use_adx': False, 'bull_use_spike': False, 'bull_rsi_required': True, 'bear_strategy': 'breakout', 'bear_bb_std_mult': 2.992883203407504, 'bear_rsi_os': 21, 'bear_rsi_ob': 84, 'bear_adx_thresh': 15.818156447324672, 'bear_atr_min_pct': 0.009070527765802283, 'bear_atr_max_pct': 0.12707661328589984, 'bear_tp_mult': 2.284232511878702, 'bear_tsl_mult': 0.44011089184411906, 'bear_time_stop': 238, 'bear_use_sma': False, 'bear_use_ema': False, 'bear_use_atr': False, 'bear_use_adx': False, 'bear_use_spike': True, 'bear_rsi_required': True, 'sideways_strategy': 'breakout', 'sideways_bb_std_mult': 1.229879571148083, 'sideways_rsi_os': 18, 'sideways_rsi_ob': 84, 'sideways_adx_thresh': 5.353949167159702, 'sideways_atr_min_pct': 0.010565654287076322, 'sideways_atr_max_pct': 0.11360525129933183, 'sideways_tp_mult': 2.447821617530042, 'sideways_tsl_mult': 0.2578997702961261, 'sideways_time_stop': 44, 'sideways_use_sma': False, 'sideways_use_ema': True, 'sideways_use_atr': False, 'sideways_use_adx': True, 'sideways_use_spike': True, 'sideways_rsi_required': False}.
[I 2025-08-31 03:22:01,346] Trial 141 finished with values: [-0.03977103140625515, 0.03970859575015652] and parameters: {'p_sma': 54, 'p_std': 8, 'p_atr': 10, 'p_adx': 10, 'rsi_period': 75, 'ema1': 14, 'ema2': 29, 'slip_atr_k': 0.1067556755598, 'slip_spread_k': 0.17909126699033356, 'spread_hl_frac': 0.005174795291453413, 'bb_std_mult': 2.002472722042919, 'rsi_os': 24, 'rsi_ob': 61, 'vol_spike': 0.1029588782489896, 'adx_thresh': 28.66918355327661, 'atr_min_pct': 0.01083524648166848, 'atr_max_pct': 0.13918079675571918, 'tp_mult': 1.235050211489014, 'tsl_mult': 0.47260278933161154, 'strategy': 'mean_reversion', 'time_stop': 36, 'use_sma': True, 'use_atr': True, 'use_adx': False, 'use_ema': True, 'use_spike': False, 'rsi_required': True, 'edge_k': 1.5274845842184517, 'edge_cap': 0.5437938749127991, 'bull_strategy': 'mean_reversion', 'bull_bb_std_mult': 1.4794293440421402, 'bull_rsi_os': 16, 'bull_rsi_ob': 84, 'bull_adx_thresh': 9.948657638286157, 'bull_atr_min_pct': 0.0014657247503666228, 'bull_atr_max_pct': 0.030769674273895556, 'bull_tp_mult': 1.3448258462507947, 'bull_tsl_mult': 0.4525741675015695, 'bull_time_stop': 226, 'bull_use_sma': True, 'bull_use_ema': False, 'bull_use_atr': True, 'bull_use_adx': False, 'bull_use_spike': False, 'bull_rsi_required': True, 'bear_strategy': 'breakout', 'bear_bb_std_mult': 3.024729907219114, 'bear_rsi_os': 32, 'bear_rsi_ob': 60, 'bear_adx_thresh': 12.683895184462871, 'bear_atr_min_pct': 0.0066376934884530454, 'bear_atr_max_pct': 0.12536318127629428, 'bear_tp_mult': 2.1913702441271963, 'bear_tsl_mult': 0.4415511863965472, 'bear_time_stop': 274, 'bear_use_sma': True, 'bear_use_ema': True, 'bear_use_atr': False, 'bear_use_adx': False, 'bear_use_spike': False, 'bear_rsi_required': True, 'sideways_strategy': 'mean_reversion', 'sideways_bb_std_mult': 1.4921562148623873, 'sideways_rsi_os': 40, 'sideways_rsi_ob': 65, 'sideways_adx_thresh': 9.559110348664749, 'sideways_atr_min_pct': 0.005958224413795661, 'sideways_atr_max_pct': 0.12276630411003468, 'sideways_tp_mult': 2.7133468341383855, 'sideways_tsl_mult': 0.3769094766167367, 'sideways_time_stop': 60, 'sideways_use_sma': False, 'sideways_use_ema': False, 'sideways_use_atr': True, 'sideways_use_adx': False, 'sideways_use_spike': False, 'sideways_rsi_required': True}.
[I 2025-08-31 03:22:02,101] Trial 138 finished with values: [-0.03428967977041397, 0.034674354278647616] and parameters: {'p_sma': 22, 'p_std': 7, 'p_atr': 10, 'p_adx': 13, 'rsi_period': 74, 'ema1': 14, 'ema2': 18, 'slip_atr_k': 0.1923979332517966, 'slip_spread_k': 0.05235095009330043, 'spread_hl_frac': 0.005195800316903126, 'bb_std_mult': 2.7122760927649856, 'rsi_os': 13, 'rsi_ob': 59, 'vol_spike': 0.1066254672213749, 'adx_thresh': 12.994599584373479, 'atr_min_pct': 0.011448748538573614, 'atr_max_pct': 0.1394839127910925, 'tp_mult': 1.218842774974713, 'tsl_mult': 0.49323722650240925, 'strategy': 'mean_reversion', 'time_stop': 39, 'use_sma': True, 'use_atr': True, 'use_adx': True, 'use_ema': False, 'use_spike': False, 'rsi_required': True, 'edge_k': 0.14506398901614334, 'edge_cap': 0.420487831449418, 'bull_strategy': 'breakout', 'bull_bb_std_mult': 1.6690819809971915, 'bull_rsi_os': 46, 'bull_rsi_ob': 84, 'bull_adx_thresh': 25.05398749492102, 'bull_atr_min_pct': 0.0002486884942838266, 'bull_atr_max_pct': 0.04776126900691137, 'bull_tp_mult': 1.5183692881093758, 'bull_tsl_mult': 0.3735374122036596, 'bull_time_stop': 171, 'bull_use_sma': True, 'bull_use_ema': False, 'bull_use_atr': True, 'bull_use_adx': False, 'bull_use_spike': True, 'bull_rsi_required': True, 'bear_strategy': 'breakout', 'bear_bb_std_mult': 3.0001205937107245, 'bear_rsi_os': 17, 'bear_rsi_ob': 82, 'bear_adx_thresh': 17.994962884213802, 'bear_atr_min_pct': 0.006616406675670532, 'bear_atr_max_pct': 0.1464846015252445, 'bear_tp_mult': 2.443840874082652, 'bear_tsl_mult': 0.5942041564751221, 'bear_time_stop': 231, 'bear_use_sma': True, 'bear_use_ema': True, 'bear_use_atr': False, 'bear_use_adx': False, 'bear_use_spike': False, 'bear_rsi_required': True, 'sideways_strategy': 'mean_reversion', 'sideways_bb_std_mult': 1.4775302367229002, 'sideways_rsi_os': 18, 'sideways_rsi_ob': 71, 'sideways_adx_thresh': 6.891566716274973, 'sideways_atr_min_pct': 0.007181186297836235, 'sideways_atr_max_pct': 0.11931166651402056, 'sideways_tp_mult': 2.7024690475942554, 'sideways_tsl_mult': 0.2502562616516646, 'sideways_time_stop': 58, 'sideways_use_sma': False, 'sideways_use_ema': False, 'sideways_use_atr': True, 'sideways_use_adx': True, 'sideways_use_spike': True, 'sideways_rsi_required': True}.
[I 2025-08-31 03:22:02,387] Trial 140 finished with values: [-1000000000.0, 1000000000.0] and parameters: {'p_sma': 52, 'p_std': 18, 'p_atr': 10, 'p_adx': 13, 'rsi_period': 74, 'ema1': 14, 'ema2': 53, 'slip_atr_k': 0.11225956345729562, 'slip_spread_k': 0.2886931679719736, 'spread_hl_frac': 0.005277448687731747, 'bb_std_mult': 2.716314597254345, 'rsi_os': 13, 'rsi_ob': 61, 'vol_spike': 0.10396809163064201, 'adx_thresh': 28.54672336163341, 'atr_min_pct': 0.023291285708218624, 'atr_max_pct': 0.1284958143089942, 'tp_mult': 1.7046759341974034, 'tsl_mult': 0.46290224924646567, 'strategy': 'mean_reversion', 'time_stop': 37, 'use_sma': True, 'use_atr': True, 'use_adx': True, 'use_ema': False, 'use_spike': False, 'rsi_required': True, 'edge_k': 0.14195019388359378, 'edge_cap': 0.21654800277749164, 'bull_strategy': 'breakout', 'bull_bb_std_mult': 1.481986867088666, 'bull_rsi_os': 12, 'bull_rsi_ob': 84, 'bull_adx_thresh': 30.1649951957841, 'bull_atr_min_pct': 0.003676496178625075, 'bull_atr_max_pct': 0.04669512028569117, 'bull_tp_mult': 1.242873695966606, 'bull_tsl_mult': 0.4559787281888873, 'bull_time_stop': 114, 'bull_use_sma': True, 'bull_use_ema': False, 'bull_use_atr': True, 'bull_use_adx': False, 'bull_use_spike': True, 'bull_rsi_required': True, 'bear_strategy': 'breakout', 'bear_bb_std_mult': 2.3767880231081073, 'bear_rsi_os': 32, 'bear_rsi_ob': 94, 'bear_adx_thresh': 16.836104924109964, 'bear_atr_min_pct': 0.00784124121643197, 'bear_atr_max_pct': 0.1458573303918947, 'bear_tp_mult': 1.9574882175792623, 'bear_tsl_mult': 0.9289173119026429, 'bear_time_stop': 272, 'bear_use_sma': True, 'bear_use_ema': True, 'bear_use_atr': False, 'bear_use_adx': False, 'bear_use_spike': False, 'bear_rsi_required': True, 'sideways_strategy': 'mean_reversion', 'sideways_bb_std_mult': 1.4784182435991973, 'sideways_rsi_os': 36, 'sideways_rsi_ob': 71, 'sideways_adx_thresh': 5.010284825207545, 'sideways_atr_min_pct': 0.007277620262080585, 'sideways_atr_max_pct': 0.12007699277944321, 'sideways_tp_mult': 2.7221847389643585, 'sideways_tsl_mult': 0.22070432672395934, 'sideways_time_stop': 59, 'sideways_use_sma': False, 'sideways_use_ema': False, 'sideways_use_atr': True, 'sideways_use_adx': True, 'sideways_use_spike': True, 'sideways_rsi_required': True}.
[I 2025-08-31 03:22:02,522] Trial 139 finished with values: [-0.022965525561717937, 0.023018561814849542] and parameters: {'p_sma': 12, 'p_std': 17, 'p_atr': 10, 'p_adx': 13, 'rsi_period': 73, 'ema1': 14, 'ema2': 18, 'slip_atr_k': 0.21175716873359557, 'slip_spread_k': 0.04892479877875244, 'spread_hl_frac': 0.005446833119884605, 'bb_std_mult': 2.6733492486186905, 'rsi_os': 10, 'rsi_ob': 61, 'vol_spike': 0.11849176293802162, 'adx_thresh': 12.796342554812533, 'atr_min_pct': 0.02349432237973885, 'atr_max_pct': 0.13982395733007916, 'tp_mult': 1.6974021224975289, 'tsl_mult': 0.4667409143824195, 'strategy': 'mean_reversion', 'time_stop': 38, 'use_sma': True, 'use_atr': True, 'use_adx': True, 'use_ema': False, 'use_spike': False, 'rsi_required': True, 'edge_k': 1.3291673387761307, 'edge_cap': 0.20596305423145078, 'bull_strategy': 'breakout', 'bull_bb_std_mult': 1.7141133550811827, 'bull_rsi_os': 13, 'bull_rsi_ob': 84, 'bull_adx_thresh': 24.917124803008555, 'bull_atr_min_pct': 0.00043748766463260185, 'bull_atr_max_pct': 0.031909500604384466, 'bull_tp_mult': 1.3494030787769506, 'bull_tsl_mult': 0.44897547523748393, 'bull_time_stop': 14, 'bull_use_sma': True, 'bull_use_ema': False, 'bull_use_atr': True, 'bull_use_adx': False, 'bull_use_spike': True, 'bull_rsi_required': True, 'bear_strategy': 'breakout', 'bear_bb_std_mult': 2.987601628671343, 'bear_rsi_os': 32, 'bear_rsi_ob': 94, 'bear_adx_thresh': 17.942478252265865, 'bear_atr_min_pct': 0.006608889673760197, 'bear_atr_max_pct': 0.10054049032929635, 'bear_tp_mult': 1.9909319083092973, 'bear_tsl_mult': 0.5832422962649935, 'bear_time_stop': 275, 'bear_use_sma': True, 'bear_use_ema': True, 'bear_use_atr': False, 'bear_use_adx': False, 'bear_use_spike': False, 'bear_rsi_required': True, 'sideways_strategy': 'mean_reversion', 'sideways_bb_std_mult': 1.4731064229185693, 'sideways_rsi_os': 18, 'sideways_rsi_ob': 65, 'sideways_adx_thresh': 5.032537501919201, 'sideways_atr_min_pct': 0.0129120956083518, 'sideways_atr_max_pct': 0.11869441972587183, 'sideways_tp_mult': 2.704943972584997, 'sideways_tsl_mult': 0.23419965762083017, 'sideways_time_stop': 266, 'sideways_use_sma': False, 'sideways_use_ema': False, 'sideways_use_atr': True, 'sideways_use_adx': True, 'sideways_use_spike': True, 'sideways_rsi_required': True}.
[I 2025-08-31 03:22:33,847] Trial 142 finished with values: [-0.01959312151562498, 0.01952365760333096] and parameters: {'p_sma': 22, 'p_std': 18, 'p_atr': 10, 'p_adx': 10, 'rsi_period': 73, 'ema1': 7, 'ema2': 20, 'slip_atr_k': 0.08548523040187689, 'slip_spread_k': 0.1713048346929194, 'spread_hl_frac': 0.004712564625145231, 'bb_std_mult': 2.2310621412486484, 'rsi_os': 10, 'rsi_ob': 64, 'vol_spike': 0.10149507887251932, 'adx_thresh': 28.908016680948684, 'atr_min_pct': 0.023153463105013917, 'atr_max_pct': 0.1399602260543363, 'tp_mult': 1.421938591461659, 'tsl_mult': 0.475082594707565, 'strategy': 'mean_reversion', 'time_stop': 35, 'use_sma': True, 'use_atr': True, 'use_adx': False, 'use_ema': True, 'use_spike': False, 'rsi_required': True, 'edge_k': 0.1488174756360831, 'edge_cap': 0.21566378351774473, 'bull_strategy': 'mean_reversion', 'bull_bb_std_mult': 1.1922382281187751, 'bull_rsi_os': 12, 'bull_rsi_ob': 84, 'bull_adx_thresh': 28.486804824469495, 'bull_atr_min_pct': 0.0016211988111327295, 'bull_atr_max_pct': 0.014336302182422565, 'bull_tp_mult': 1.3717356145237343, 'bull_tsl_mult': 0.37768403583711485, 'bull_time_stop': 227, 'bull_use_sma': True, 'bull_use_ema': False, 'bull_use_atr': True, 'bull_use_adx': False, 'bull_use_spike': False, 'bull_rsi_required': True, 'bear_strategy': 'breakout', 'bear_bb_std_mult': 1.6512604012981722, 'bear_rsi_os': 17, 'bear_rsi_ob': 91, 'bear_adx_thresh': 30.22895287480719, 'bear_atr_min_pct': 0.006621830109728992, 'bear_atr_max_pct': 0.1013396441392483, 'bear_tp_mult': 2.176512712320903, 'bear_tsl_mult': 0.5539715769758425, 'bear_time_stop': 273, 'bear_use_sma': True, 'bear_use_ema': True, 'bear_use_atr': False, 'bear_use_adx': False, 'bear_use_spike': False, 'bear_rsi_required': True, 'sideways_strategy': 'mean_reversion', 'sideways_bb_std_mult': 1.5848982879109736, 'sideways_rsi_os': 35, 'sideways_rsi_ob': 67, 'sideways_adx_thresh': 9.578161049969248, 'sideways_atr_min_pct': 0.0068781908037792265, 'sideways_atr_max_pct': 0.12181871833345301, 'sideways_tp_mult': 2.709057323614106, 'sideways_tsl_mult': 0.32127812044770937, 'sideways_time_stop': 263, 'sideways_use_sma': False, 'sideways_use_ema': False, 'sideways_use_atr': True, 'sideways_use_adx': False, 'sideways_use_spike': False, 'sideways_rsi_required': True}.
[I 2025-08-31 03:22:34,076] Trial 143 finished with values: [-0.02379881498199321, 0.023704876768984577] and parameters: {'p_sma': 48, 'p_std': 39, 'p_atr': 10, 'p_adx': 10, 'rsi_period': 75, 'ema1': 14, 'ema2': 14, 'slip_atr_k': 0.09017594660394787, 'slip_spread_k': 0.1781535984259736, 'spread_hl_frac': 0.005402496671333648, 'bb_std_mult': 1.9952457272526767, 'rsi_os': 24, 'rsi_ob': 66, 'vol_spike': 0.12213249582562023, 'adx_thresh': 28.7332821751794, 'atr_min_pct': 0.011066288931884945, 'atr_max_pct': 0.13960307373707767, 'tp_mult': 1.398290806256277, 'tsl_mult': 0.4655068649050755, 'strategy': 'mean_reversion', 'time_stop': 38, 'use_sma': True, 'use_atr': True, 'use_adx': False, 'use_ema': True, 'use_spike': False, 'rsi_required': True, 'edge_k': 1.6082155881122389, 'edge_cap': 0.3580331434509082, 'bull_strategy': 'mean_reversion', 'bull_bb_std_mult': 1.4669732798469644, 'bull_rsi_os': 12, 'bull_rsi_ob': 86, 'bull_adx_thresh': 24.818438331057802, 'bull_atr_min_pct': 0.0014219951515176946, 'bull_atr_max_pct': 0.03181879835547577, 'bull_tp_mult': 1.351898437975318, 'bull_tsl_mult': 0.3586262668043142, 'bull_time_stop': 228, 'bull_use_sma': True, 'bull_use_ema': False, 'bull_use_atr': True, 'bull_use_adx': False, 'bull_use_spike': False, 'bull_rsi_required': True, 'bear_strategy': 'breakout', 'bear_bb_std_mult': 3.3490901760492475, 'bear_rsi_os': 26, 'bear_rsi_ob': 82, 'bear_adx_thresh': 17.08195797448814, 'bear_atr_min_pct': 0.007770891678958197, 'bear_atr_max_pct': 0.10390805524410371, 'bear_tp_mult': 2.1794234495509075, 'bear_tsl_mult': 0.939875245049136, 'bear_time_stop': 243, 'bear_use_sma': True, 'bear_use_ema': True, 'bear_use_atr': False, 'bear_use_adx': False, 'bear_use_spike': False, 'bear_rsi_required': True, 'sideways_strategy': 'mean_reversion', 'sideways_bb_std_mult': 1.4946945468339798, 'sideways_rsi_os': 19, 'sideways_rsi_ob': 76, 'sideways_adx_thresh': 9.385018182284847, 'sideways_atr_min_pct': 0.005614797958065345, 'sideways_atr_max_pct': 0.11293060990210646, 'sideways_tp_mult': 2.6221958849313283, 'sideways_tsl_mult': 0.32230451262893106, 'sideways_time_stop': 65, 'sideways_use_sma': False, 'sideways_use_ema': False, 'sideways_use_atr': True, 'sideways_use_adx': False, 'sideways_use_spike': False, 'sideways_rsi_required': True}.
