[I 2025-08-31 03:18:40,316] Trial 114 finished with values: [-1000000000.0, 1000000000.0] and parameters: {'p_sma': 41, 'p_std': 25, 'p_atr': 24, 'p_adx': 15, 'rsi_period': 7, 'ema1': 20, 'ema2': 16, 'slip_atr_k': 0.0065900422530557725, 'slip_spread_k': 0.47691694509920274, 'spread_hl_frac': 0.0402813341715721, 'bb_std_mult': 3.465242008598181, 'rsi_os': 35, 'rsi_ob': 95, 'vol_spike': 0.18513833995843898, 'adx_thresh': 20.288115137550395, 'atr_min_pct': 0.021107557618526653, 'atr_max_pct': 0.11764787660130852, 'tp_mult': 2.9982448839194955, 'tsl_mult': 0.13521957758116215, 'strategy': 'breakout', 'time_stop': 112, 'use_sma': False, 'use_atr': False, 'use_adx': True, 'use_ema': False, 'use_spike': False, 'rsi_required': False, 'edge_k': 0.3515488254125153, 'edge_cap': 0.6811873155853094, 'bull_strategy': 'breakout', 'bull_bb_std_mult': 2.52613765570399, 'bull_rsi_os': 24, 'bull_rsi_ob': 71, 'bull_adx_thresh': 18.60065298349964, 'bull_atr_min_pct': 0.0259137862920064, 'bull_atr_max_pct': 0.036073454758301024, 'bull_tp_mult': 2.254268622731871, 'bull_tsl_mult': 0.9064475555910768, 'bull_time_stop': 109, 'bull_use_sma': False, 'bull_use_ema': False, 'bull_use_atr': True, 'bull_use_adx': False, 'bull_use_spike': False, 'bull_rsi_required': True, 'bear_strategy': 'mean_reversion', 'bear_bb_std_mult': 2.6364026721701412, 'bear_rsi_os': 6, 'bear_rsi_ob': 80, 'bear_adx_thresh': 9.100245424346465, 'bear_atr_min_pct': 0.008936460259978901, 'bear_atr_max_pct': 0.058609738992018406, 'bear_tp_mult': 2.596681899757815, 'bear_tsl_mult': 0.9963649577841998, 'bear_time_stop': 78, 'bear_use_sma': False, 'bear_use_ema': False, 'bear_use_atr': False, 'bear_use_adx': True, 'bear_use_spike': True, 'bear_rsi_required': False, 'sideways_strategy': 'breakout', 'sideways_bb_std_mult': 1.9966194917630407, 'sideways_rsi_os': 24, 'sideways_rsi_ob': 52, 'sideways_adx_thresh': 7.284960856956696, 'sideways_atr_min_pct': 0.003242098054666689, 'sideways_atr_max_pct': 0.08355104788399753, 'sideways_tp_mult': 1.597406710949221, 'sideways_tsl_mult': 0.7694538569760152, 'sideways_time_stop': 130, 'sideways_use_sma': True, 'sideways_use_ema': True, 'sideways_use_atr': False, 'sideways_use_adx': True, 'sideways_use_spike': True, 'sideways_rsi_required': False}.
[I 2025-08-31 03:19:12,177] Trial 120 finished with values: [-1000000000.0, 1000000000.0] and parameters: {'p_sma': 18, 'p_std': 20, 'p_atr': 24, 'p_adx': 23, 'rsi_period': 71, 'ema1': 20, 'ema2': 22, 'slip_atr_k': 0.05325204104234746, 'slip_spread_k': 0.3859180756183961, 'spread_hl_frac': 0.04051167390929282, 'bb_std_mult': 0.5002388394095068, 'rsi_os': 30, 'rsi_ob': 71, 'vol_spike': 0.1375584651910012, 'adx_thresh': 15.412880022323808, 'atr_min_pct': 0.005467191499709662, 'atr_max_pct': 0.10884160191854678, 'tp_mult': 2.879114262661214, 'tsl_mult': 0.4902778588698388, 'strategy': 'mean_reversion', 'time_stop': 108, 'use_sma': False, 'use_atr': False, 'use_adx': False, 'use_ema': True, 'use_spike': False, 'rsi_required': False, 'edge_k': 0.31352916298157807, 'edge_cap': 0.07359277693682395, 'bull_strategy': 'mean_reversion', 'bull_bb_std_mult': 2.4998603966099973, 'bull_rsi_os': 37, 'bull_rsi_ob': 74, 'bull_adx_thresh': 33.94950626444058, 'bull_atr_min_pct': 0.011781354594547282, 'bull_atr_max_pct': 0.032951647096386996, 'bull_tp_mult': 2.0560734518934063, 'bull_tsl_mult': 0.9820144479752477, 'bull_time_stop': 122, 'bull_use_sma': False, 'bull_use_ema': False, 'bull_use_atr': True, 'bull_use_adx': False, 'bull_use_spike': True, 'bull_rsi_required': True, 'bear_strategy': 'mean_reversion', 'bear_bb_std_mult': 1.9611950695837927, 'bear_rsi_os': 5, 'bear_rsi_ob': 78, 'bear_adx_thresh': 17.954288332713105, 'bear_atr_min_pct': 0.005994702676483396, 'bear_atr_max_pct': 0.029619937876180075, 'bear_tp_mult': 1.8815061157897683, 'bear_tsl_mult': 0.6334497037516696, 'bear_time_stop': 282, 'bear_use_sma': False, 'bear_use_ema': False, 'bear_use_atr': False, 'bear_use_adx': False, 'bear_use_spike': True, 'bear_rsi_required': False, 'sideways_strategy': 'breakout', 'sideways_bb_std_mult': 1.7540127627050124, 'sideways_rsi_os': 41, 'sideways_rsi_ob': 46, 'sideways_adx_thresh': 20.205679158305724, 'sideways_atr_min_pct': 0.007526909736396418, 'sideways_atr_max_pct': 0.0773809248910514, 'sideways_tp_mult': 2.936287598240617, 'sideways_tsl_mult': 0.8029576910930413, 'sideways_time_stop': 210, 'sideways_use_sma': True, 'sideways_use_ema': True, 'sideways_use_atr': False, 'sideways_use_adx': False, 'sideways_use_spike': False, 'sideways_rsi_required': True}.
[I 2025-08-31 03:19:12,328] Trial 121 finished with values: [-1000000000.0, 1000000000.0] and parameters: {'p_sma': 18, 'p_std': 20, 'p_atr': 10, 'p_adx': 11, 'rsi_period': 71, 'ema1': 13, 'ema2': 22, 'slip_atr_k': 0.14820834657045306, 'slip_spread_k': 0.02923718511169693, 'spread_hl_frac': 0.048430665599973194, 'bb_std_mult': 0.5036724458208343, 'rsi_os': 30, 'rsi_ob': 93, 'vol_spike': 0.2682439061504073, 'adx_thresh': 5.985156053143209, 'atr_min_pct': 0.022874268425380987, 'atr_max_pct': 0.09795099529441607, 'tp_mult': 2.8804382522554115, 'tsl_mult': 0.7165840060115253, 'strategy': 'mean_reversion', 'time_stop': 280, 'use_sma': False, 'use_atr': False, 'use_adx': False, 'use_ema': True, 'use_spike': False, 'rsi_required': False, 'edge_k': 0.309373016868031, 'edge_cap': 0.0682239566080988, 'bull_strategy': 'mean_reversion', 'bull_bb_std_mult': 2.6489863677826975, 'bull_rsi_os': 13, 'bull_rsi_ob': 74, 'bull_adx_thresh': 23.14015646674312, 'bull_atr_min_pct': 0.011690966188953433, 'bull_atr_max_pct': 0.040759522540573266, 'bull_tp_mult': 1.6313890622689458, 'bull_tsl_mult': 0.9794566890141287, 'bull_time_stop': 285, 'bull_use_sma': False, 'bull_use_ema': False, 'bull_use_atr': True, 'bull_use_adx': False, 'bull_use_spike': True, 'bull_rsi_required': True, 'bear_strategy': 'mean_reversion', 'bear_bb_std_mult': 1.8832168737825064, 'bear_rsi_os': 5, 'bear_rsi_ob': 69, 'bear_adx_thresh': 21.04992958708299, 'bear_atr_min_pct': 0.005713615520819483, 'bear_atr_max_pct': 0.03500810340912699, 'bear_tp_mult': 1.2659024455859507, 'bear_tsl_mult': 0.9227319933162108, 'bear_time_stop': 118, 'bear_use_sma': True, 'bear_use_ema': False, 'bear_use_atr': False, 'bear_use_adx': False, 'bear_use_spike': True, 'bear_rsi_required': False, 'sideways_strategy': 'breakout', 'sideways_bb_std_mult': 1.7705715596368052, 'sideways_rsi_os': 54, 'sideways_rsi_ob': 69, 'sideways_adx_thresh': 21.00761538171892, 'sideways_atr_min_pct': 0.026491615323586765, 'sideways_atr_max_pct': 0.09315639517385828, 'sideways_tp_mult': 1.0983683468309975, 'sideways_tsl_mult': 0.0377492931566451, 'sideways_time_stop': 94, 'sideways_use_sma': True, 'sideways_use_ema': True, 'sideways_use_atr': True, 'sideways_use_adx': False, 'sideways_use_spike': False, 'sideways_rsi_required': True}.
[I 2025-08-31 03:19:12,476] Trial 118 finished with values: [-1000000000.0, 1000000000.0] and parameters: {'p_sma': 18, 'p_std': 26, 'p_atr': 19, 'p_adx': 23, 'rsi_period': 16, 'ema1': 28, 'ema2': 18, 'slip_atr_k': 0.0070373249871172674, 'slip_spread_k': 0.48044143309348136, 'spread_hl_frac': 0.013090985224937098, 'bb_std_mult': 3.4360649664872187, 'rsi_os': 48, 'rsi_ob': 71, 'vol_spike': 0.19278846980406716, 'adx_thresh': 15.309667143237839, 'atr_min_pct': 0.022711789245121565, 'atr_max_pct': 0.1089924035233778, 'tp_mult': 2.8954971883724614, 'tsl_mult': 0.6321597185340688, 'strategy': 'mean_reversion', 'time_stop': 41, 'use_sma': False, 'use_atr': False, 'use_adx': True, 'use_ema': True, 'use_spike': False, 'rsi_required': False, 'edge_k': 0.5709692220146877, 'edge_cap': 0.6805438191638711, 'bull_strategy': 'breakout', 'bull_bb_std_mult': 2.5273793805226847, 'bull_rsi_os': 13, 'bull_rsi_ob': 74, 'bull_adx_thresh': 21.39295090015809, 'bull_atr_min_pct': 0.011928506495956804, 'bull_atr_max_pct': 0.040909605870585564, 'bull_tp_mult': 1.5818333556793662, 'bull_tsl_mult': 0.16137680632710855, 'bull_time_stop': 120, 'bull_use_sma': False, 'bull_use_ema': False, 'bull_use_atr': True, 'bull_use_adx': False, 'bull_use_spike': True, 'bull_rsi_required': True, 'bear_strategy': 'mean_reversion', 'bear_bb_std_mult': 0.5009925237656181, 'bear_rsi_os': 35, 'bear_rsi_ob': 78, 'bear_adx_thresh': 15.202226105575633, 'bear_atr_min_pct': 0.006188083860434852, 'bear_atr_max_pct': 0.043617870893985396, 'bear_tp_mult': 1.014281300633954, 'bear_tsl_mult': 0.9836484385516913, 'bear_time_stop': 117, 'bear_use_sma': True, 'bear_use_ema': False, 'bear_use_atr': False, 'bear_use_adx': True, 'bear_use_spike': True, 'bear_rsi_required': False, 'sideways_strategy': 'breakout', 'sideways_bb_std_mult': 1.752992815912209, 'sideways_rsi_os': 14, 'sideways_rsi_ob': 46, 'sideways_adx_thresh': 7.647616493435766, 'sideways_atr_min_pct': 0.0010268475521340134, 'sideways_atr_max_pct': 0.06526177924849143, 'sideways_tp_mult': 2.916806850653262, 'sideways_tsl_mult': 0.03933331637018478, 'sideways_time_stop': 7, 'sideways_use_sma': True, 'sideways_use_ema': True, 'sideways_use_atr': True, 'sideways_use_adx': False, 'sideways_use_spike': True, 'sideways_rsi_required': True}.
[I 2025-08-31 03:19:12,543] Trial 119 finished with values: [-1000000000.0, 1000000000.0] and parameters: {'p_sma': 18, 'p_std': 27, 'p_atr': 19, 'p_adx': 11, 'rsi_period': 57, 'ema1': 14, 'ema2': 17, 'slip_atr_k': 0.0013157955452836436, 'slip_spread_k': 0.4785022700585334, 'spread_hl_frac': 0.038807955823963736, 'bb_std_mult': 0.5507841109897051, 'rsi_os': 26, 'rsi_ob': 59, 'vol_spike': 0.2656269992079415, 'adx_thresh': 22.381114569696027, 'atr_min_pct': 0.0057359662890416364, 'atr_max_pct': 0.09823874307181897, 'tp_mult': 1.0621527434516194, 'tsl_mult': 0.6738156224398477, 'strategy': 'mean_reversion', 'time_stop': 111, 'use_sma': False, 'use_atr': False, 'use_adx': True, 'use_ema': True, 'use_spike': False, 'rsi_required': False, 'edge_k': 0.09060752268575945, 'edge_cap': 0.0751503901802262, 'bull_strategy': 'breakout', 'bull_bb_std_mult': 2.175297152320872, 'bull_rsi_os': 32, 'bull_rsi_ob': 72, 'bull_adx_thresh': 22.944902214158308, 'bull_atr_min_pct': 0.01212901742782184, 'bull_atr_max_pct': 0.1107089608649029, 'bull_tp_mult': 1.7141256329638699, 'bull_tsl_mult': 0.9804417153356473, 'bull_time_stop': 134, 'bull_use_sma': False, 'bull_use_ema': False, 'bull_use_atr': True, 'bull_use_adx': False, 'bull_use_spike': True, 'bull_rsi_required': True, 'bear_strategy': 'mean_reversion', 'bear_bb_std_mult': 1.8872124184884242, 'bear_rsi_os': 5, 'bear_rsi_ob': 78, 'bear_adx_thresh': 20.779145014144646, 'bear_atr_min_pct': 0.006154694315987725, 'bear_atr_max_pct': 0.035019038084951125, 'bear_tp_mult': 1.8689194310574424, 'bear_tsl_mult': 0.7644333058815647, 'bear_time_stop': 117, 'bear_use_sma': True, 'bear_use_ema': False, 'bear_use_atr': False, 'bear_use_adx': False, 'bear_use_spike': True, 'bear_rsi_required': False, 'sideways_strategy': 'breakout', 'sideways_bb_std_mult': 1.7658518795482805, 'sideways_rsi_os': 14, 'sideways_rsi_ob': 52, 'sideways_adx_thresh': 24.850975423632967, 'sideways_atr_min_pct': 0.009914385712888673, 'sideways_atr_max_pct': 0.06713300740794492, 'sideways_tp_mult': 1.0922318007968714, 'sideways_tsl_mult': 0.7227877806591735, 'sideways_time_stop': 135, 'sideways_use_sma': True, 'sideways_use_ema': True, 'sideways_use_atr': True, 'sideways_use_adx': False, 'sideways_use_spike': True, 'sideways_rsi_required': True}.
[I 2025-08-31 03:19:44,396] Trial 125 finished with values: [-0.1148334166871462, 0.11477447917931344] and parameters: {'p_sma': 45, 'p_std': 30, 'p_atr': 9, 'p_adx': 13, 'rsi_period': 66, 'ema1': 15, 'ema2': 11, 'slip_atr_k': 0.02744934226359938, 'slip_spread_k': 0.450279313865859, 'spread_hl_frac': 0.027222751729295933, 'bb_std_mult': 1.5618304633369664, 'rsi_os': 42, 'rsi_ob': 93, 'vol_spike': 0.16970821694975718, 'adx_thresh': 27.261084333232052, 'atr_min_pct': 0.024045499239894724, 'atr_max_pct': 0.1039510144466651, 'tp_mult': 2.8220049130581426, 'tsl_mult': 0.5586217340770915, 'strategy': 'breakout', 'time_stop': 78, 'use_sma': True, 'use_atr': True, 'use_adx': False, 'use_ema': False, 'use_spike': False, 'rsi_required': True, 'edge_k': 0.16704125214441853, 'edge_cap': 0.10111892390925467, 'bull_strategy': 'mean_reversion', 'bull_bb_std_mult': 2.329028100736531, 'bull_rsi_os': 20, 'bull_rsi_ob': 76, 'bull_adx_thresh': 6.225398614070247, 'bull_atr_min_pct': 0.029763289614905042, 'bull_atr_max_pct': 0.13929511225496768, 'bull_tp_mult': 2.4240195672658067, 'bull_tsl_mult': 0.9276180445942178, 'bull_time_stop': 40, 'bull_use_sma': True, 'bull_use_ema': False, 'bull_use_atr': True, 'bull_use_adx': False, 'bull_use_spike': False, 'bull_rsi_required': True, 'bear_strategy': 'breakout', 'bear_bb_std_mult': 1.389696531742234, 'bear_rsi_os': 7, 'bear_rsi_ob': 86, 'bear_adx_thresh': 19.05126438341953, 'bear_atr_min_pct': 0.007337470472022086, 'bear_atr_max_pct': 0.04721495918660607, 'bear_tp_mult': 1.6946223357132102, 'bear_tsl_mult': 0.03757774255144658, 'bear_time_stop': 34, 'bear_use_sma': False, 'bear_use_ema': True, 'bear_use_atr': False, 'bear_use_adx': False, 'bear_use_spike': False, 'bear_rsi_required': False, 'sideways_strategy': 'mean_reversion', 'sideways_bb_std_mult': 1.5397139952457992, 'sideways_rsi_os': 35, 'sideways_rsi_ob': 55, 'sideways_adx_thresh': 13.441205282604052, 'sideways_atr_min_pct': 1.3680880747844683e-05, 'sideways_atr_max_pct': 0.09187427944160752, 'sideways_tp_mult': 2.991910788840775, 'sideways_tsl_mult': 0.5365271880791755, 'sideways_time_stop': 10, 'sideways_use_sma': False, 'sideways_use_ema': False, 'sideways_use_atr': False, 'sideways_use_adx': True, 'sideways_use_spike': False, 'sideways_rsi_required': False}.
[I 2025-08-31 03:19:45,484] Trial 123 finished with values: [-1000000000.0, 1000000000.0] and parameters: {'p_sma': 9, 'p_std': 30, 'p_atr': 14, 'p_adx': 27, 'rsi_period': 66, 'ema1': 26, 'ema2': 20, 'slip_atr_k': 0.025618462464531422, 'slip_spread_k': 0.503724345127123, 'spread_hl_frac': 0.038961581146137354, 'bb_std_mult': 1.9951300325256542, 'rsi_os': 43, 'rsi_ob': 93, 'vol_spike': 0.16670237153537754, 'adx_thresh': 24.354850258676876, 'atr_min_pct': 0.024325801201011674, 'atr_max_pct': 0.10449976783365982, 'tp_mult': 1.0736424007723473, 'tsl_mult': 0.52173170687361, 'strategy': 'breakout', 'time_stop': 117, 'use_sma': False, 'use_atr': True, 'use_adx': True, 'use_ema': False, 'use_spike': False, 'rsi_required': True, 'edge_k': 0.3975847221038141, 'edge_cap': 0.27023877182941675, 'bull_strategy': 'breakout', 'bull_bb_std_mult': 3.582834803312659, 'bull_rsi_os': 33, 'bull_rsi_ob': 72, 'bull_adx_thresh': 13.806223514447428, 'bull_atr_min_pct': 0.014838885940769415, 'bull_atr_max_pct': 0.07326343813212893, 'bull_tp_mult': 1.7043894628836076, 'bull_tsl_mult': 0.3428478980030437, 'bull_time_stop': 41, 'bull_use_sma': False, 'bull_use_ema': False, 'bull_use_atr': True, 'bull_use_adx': False, 'bull_use_spike': False, 'bull_rsi_required': True, 'bear_strategy': 'mean_reversion', 'bear_bb_std_mult': 3.479672562095331, 'bear_rsi_os': 29, 'bear_rsi_ob': 89, 'bear_adx_thresh': 19.182371104332784, 'bear_atr_min_pct': 0.009649027562898064, 'bear_atr_max_pct': 0.1497783423541949, 'bear_tp_mult': 2.697845871739861, 'bear_tsl_mult': 0.855094140878234, 'bear_time_stop': 144, 'bear_use_sma': False, 'bear_use_ema': False, 'bear_use_atr': False, 'bear_use_adx': False, 'bear_use_spike': True, 'bear_rsi_required': False, 'sideways_strategy': 'breakout', 'sideways_bb_std_mult': 1.525045919735274, 'sideways_rsi_os': 34, 'sideways_rsi_ob': 47, 'sideways_adx_thresh': 17.968331741930644, 'sideways_atr_min_pct': 3.2478050087287355e-06, 'sideways_atr_max_pct': 0.14744428250947633, 'sideways_tp_mult': 2.9167299984983552, 'sideways_tsl_mult': 0.20491774508392224, 'sideways_time_stop': 235, 'sideways_use_sma': True, 'sideways_use_ema': True, 'sideways_use_atr': False, 'sideways_use_adx': True, 'sideways_use_spike': True, 'sideways_rsi_required': False}.
[I 2025-08-31 03:19:45,832] Trial 122 finished with values: [-0.05684319649842362, 0.05691349725447312] and parameters: {'p_sma': 45, 'p_std': 30, 'p_atr': 9, 'p_adx': 11, 'rsi_period': 66, 'ema1': 13, 'ema2': 20, 'slip_atr_k': 0.02582769806990952, 'slip_spread_k': 0.6686480693312843, 'spread_hl_frac': 0.044950787912020146, 'bb_std_mult': 1.5925796086874313, 'rsi_os': 43, 'rsi_ob': 93, 'vol_spike': 0.26800348200155366, 'adx_thresh': 27.334478912518485, 'atr_min_pct': 0.017024820627125896, 'atr_max_pct': 0.05405438659089157, 'tp_mult': 2.8158258134185745, 'tsl_mult': 0.557401101505701, 'strategy': 'mean_reversion', 'time_stop': 30, 'use_sma': False, 'use_atr': False, 'use_adx': True, 'use_ema': False, 'use_spike': False, 'rsi_required': False, 'edge_k': 0.565804869158079, 'edge_cap': 0.10151743660347749, 'bull_strategy': 'breakout', 'bull_bb_std_mult': 2.1886420303136704, 'bull_rsi_os': 13, 'bull_rsi_ob': 73, 'bull_adx_thresh': 16.066463021118636, 'bull_atr_min_pct': 0.002480638473221014, 'bull_atr_max_pct': 0.11137227911358, 'bull_tp_mult': 1.7270568751800255, 'bull_tsl_mult': 0.9395972799323068, 'bull_time_stop': 190, 'bull_use_sma': False, 'bull_use_ema': False, 'bull_use_atr': True, 'bull_use_adx': False, 'bull_use_spike': True, 'bull_rsi_required': True, 'bear_strategy': 'mean_reversion', 'bear_bb_std_mult': 0.5132628724717807, 'bear_rsi_os': 45, 'bear_rsi_ob': 69, 'bear_adx_thresh': 20.86943684240367, 'bear_atr_min_pct': 0.007346741726307608, 'bear_atr_max_pct': 0.07213197094457185, 'bear_tp_mult': 2.151056833341996, 'bear_tsl_mult': 0.9218727688927123, 'bear_time_stop': 116, 'bear_use_sma': True, 'bear_use_ema': False, 'bear_use_atr': False, 'bear_use_adx': False, 'bear_use_spike': True, 'bear_rsi_required': False, 'sideways_strategy': 'breakout', 'sideways_bb_std_mult': 1.532409878639901, 'sideways_rsi_os': 40, 'sideways_rsi_ob': 55, 'sideways_adx_thresh': 13.491453675879235, 'sideways_atr_min_pct': 0.0005405956459294553, 'sideways_atr_max_pct': 0.06433854460037147, 'sideways_tp_mult': 2.9059379325279338, 'sideways_tsl_mult': 0.7271291022339018, 'sideways_time_stop': 219, 'sideways_use_sma': True, 'sideways_use_ema': True, 'sideways_use_atr': True, 'sideways_use_adx': True, 'sideways_use_spike': True, 'sideways_rsi_required': False}.
[I 2025-08-31 03:19:45,927] Trial 124 finished with values: [-0.027476809977916683, 0.027534708445083992] and parameters: {'p_sma': 8, 'p_std': 30, 'p_atr': 21, 'p_adx': 13, 'rsi_period': 57, 'ema1': 14, 'ema2': 42, 'slip_atr_k': 0.02607161187536085, 'slip_spread_k': 0.4465956363195069, 'spread_hl_frac': 0.00570645761962962, 'bb_std_mult': 3.151722697198818, 'rsi_os': 36, 'rsi_ob': 56, 'vol_spike': 0.16718008973554438, 'adx_thresh': 24.31814636304287, 'atr_min_pct': 0.02556710033483282, 'atr_max_pct': 0.1050183612934089, 'tp_mult': 2.8432463050029737, 'tsl_mult': 0.5621694403887154, 'strategy': 'breakout', 'time_stop': 219, 'use_sma': True, 'use_atr': True, 'use_adx': True, 'use_ema': False, 'use_spike': False, 'rsi_required': True, 'edge_k': 0.15506097795845034, 'edge_cap': 0.09709948753372885, 'bull_strategy': 'breakout', 'bull_bb_std_mult': 2.184046755104752, 'bull_rsi_os': 20, 'bull_rsi_ob': 72, 'bull_adx_thresh': 5.92409492940244, 'bull_atr_min_pct': 0.0007691294774031417, 'bull_atr_max_pct': 0.11144625040249487, 'bull_tp_mult': 2.3795794022237997, 'bull_tsl_mult': 0.934532212002104, 'bull_time_stop': 126, 'bull_use_sma': True, 'bull_use_ema': False, 'bull_use_atr': True, 'bull_use_adx': False, 'bull_use_spike': False, 'bull_rsi_required': True, 'bear_strategy': 'mean_reversion', 'bear_bb_std_mult': 1.4168268302639737, 'bear_rsi_os': 55, 'bear_rsi_ob': 86, 'bear_adx_thresh': 19.041740527977346, 'bear_atr_min_pct': 0.007447589168963303, 'bear_atr_max_pct': 0.13898380164833227, 'bear_tp_mult': 1.7680004970395375, 'bear_tsl_mult': 0.7586663094409587, 'bear_time_stop': 17, 'bear_use_sma': False, 'bear_use_ema': False, 'bear_use_atr': False, 'bear_use_adx': False, 'bear_use_spike': False, 'bear_rsi_required': False, 'sideways_strategy': 'breakout', 'sideways_bb_std_mult': 1.566530833464976, 'sideways_rsi_os': 37, 'sideways_rsi_ob': 57, 'sideways_adx_thresh': 18.112574657553104, 'sideways_atr_min_pct': 8.334948510451746e-07, 'sideways_atr_max_pct': 0.0924714502105782, 'sideways_tp_mult': 2.6842079468716613, 'sideways_tsl_mult': 0.7252894285666257, 'sideways_time_stop': 31, 'sideways_use_sma': True, 'sideways_use_ema': True, 'sideways_use_atr': False, 'sideways_use_adx': True, 'sideways_use_spike': True, 'sideways_rsi_required': False}.
