[I 2025-08-31 03:10:25,634] Trial 52 finished with values: [-1000000000.0, 1000000000.0] and parameters: {'p_sma': 26, 'p_std': 55, 'p_atr': 11, 'p_adx': 13, 'rsi_period': 29, 'ema1': 23, 'ema2': 13, 'slip_atr_k': 0.21532560536158235, 'slip_spread_k': 0.8807913131586986, 'spread_hl_frac': 0.033158353536639415, 'bb_std_mult': 3.241264246357468, 'rsi_os': 5, 'rsi_ob': 55, 'vol_spike': 0.13547915277297579, 'adx_thresh': 34.84966156819617, 'atr_min_pct': 0.006445989301018423, 'atr_max_pct': 0.12748575913790205, 'tp_mult': 2.167773549006918, 'tsl_mult': 0.46449807389984316, 'strategy': 'mean_reversion', 'time_stop': 228, 'use_sma': True, 'use_atr': False, 'use_adx': True, 'use_ema': False, 'use_spike': False, 'rsi_required': True, 'edge_k': 0.1475438241971404, 'edge_cap': 0.14695574966231686, 'bull_strategy': 'mean_reversion', 'bull_bb_std_mult': 2.4862835957050433, 'bull_rsi_os': 6, 'bull_rsi_ob': 83, 'bull_adx_thresh': 29.317449853231707, 'bull_atr_min_pct': 0.012333459842199012, 'bull_atr_max_pct': 0.0750561552291374, 'bull_tp_mult': 1.3571110882524633, 'bull_tsl_mult': 0.2389474369659772, 'bull_time_stop': 266, 'bull_use_sma': False, 'bull_use_ema': False, 'bull_use_atr': True, 'bull_use_adx': False, 'bull_use_spike': True, 'bull_rsi_required': False, 'bear_strategy': 'mean_reversion', 'bear_bb_std_mult': 2.9820689913777096, 'bear_rsi_os': 18, 'bear_rsi_ob': 52, 'bear_adx_thresh': 23.791480347129927, 'bear_atr_min_pct': 0.01669620205079041, 'bear_atr_max_pct': 0.1215489342893952, 'bear_tp_mult': 2.615243805052695, 'bear_tsl_mult': 0.371160288860235, 'bear_time_stop': 27, 'bear_use_sma': False, 'bear_use_ema': False, 'bear_use_atr': False, 'bear_use_adx': True, 'bear_use_spike': True, 'bear_rsi_required': True, 'sideways_strategy': 'breakout', 'sideways_bb_std_mult': 1.9410954994515581, 'sideways_rsi_os': 55, 'sideways_rsi_ob': 47, 'sideways_adx_thresh': 31.8204047632191, 'sideways_atr_min_pct': 0.01093631857425987, 'sideways_atr_max_pct': 0.12764282801636004, 'sideways_tp_mult': 1.290471946941945, 'sideways_tsl_mult': 0.3035018418489164, 'sideways_time_stop': 73, 'sideways_use_sma': True, 'sideways_use_ema': True, 'sideways_use_atr': False, 'sideways_use_adx': False, 'sideways_use_spike': True, 'sideways_rsi_required': True}.
[I 2025-08-31 03:10:58,805] Trial 57 finished with values: [-0.025753266275715392, 0.02570092508030927] and parameters: {'p_sma': 13, 'p_std': 45, 'p_atr': 15, 'p_adx': 17, 'rsi_period': 56, 'ema1': 16, 'ema2': 48, 'slip_atr_k': 0.01116724560835055, 'slip_spread_k': 0.6651585946796206, 'spread_hl_frac': 0.03654530527182185, 'bb_std_mult': 2.6052499607158777, 'rsi_os': 34, 'rsi_ob': 69, 'vol_spike': 0.03181481309197687, 'adx_thresh': 28.249066829285255, 'atr_min_pct': 0.024823291006721444, 'atr_max_pct': 0.0987077802451424, 'tp_mult': 2.6740453710072534, 'tsl_mult': 0.5027691063710269, 'strategy': 'breakout', 'time_stop': 106, 'use_sma': False, 'use_atr': True, 'use_adx': True, 'use_ema': False, 'use_spike': False, 'rsi_required': False, 'edge_k': 1.7394097561018151, 'edge_cap': 0.0896106751955672, 'bull_strategy': 'breakout', 'bull_bb_std_mult': 2.342418641925786, 'bull_rsi_os': 22, 'bull_rsi_ob': 72, 'bull_adx_thresh': 18.91508127877172, 'bull_atr_min_pct': 0.015818230605521958, 'bull_atr_max_pct': 0.14911182640113596, 'bull_tp_mult': 1.8389335493238463, 'bull_tsl_mult': 0.30216831575644704, 'bull_time_stop': 104, 'bull_use_sma': True, 'bull_use_ema': True, 'bull_use_atr': True, 'bull_use_adx': False, 'bull_use_spike': False, 'bull_rsi_required': True, 'bear_strategy': 'mean_reversion', 'bear_bb_std_mult': 2.7714755551676826, 'bear_rsi_os': 12, 'bear_rsi_ob': 57, 'bear_adx_thresh': 19.931308469409267, 'bear_atr_min_pct': 0.015327922777942348, 'bear_atr_max_pct': 0.06198462111041732, 'bear_tp_mult': 1.599443042618779, 'bear_tsl_mult': 0.8678797342670376, 'bear_time_stop': 188, 'bear_use_sma': False, 'bear_use_ema': True, 'bear_use_atr': False, 'bear_use_adx': False, 'bear_use_spike': False, 'bear_rsi_required': False, 'sideways_strategy': 'breakout', 'sideways_bb_std_mult': 1.39098415594361, 'sideways_rsi_os': 37, 'sideways_rsi_ob': 47, 'sideways_adx_thresh': 19.892491702395155, 'sideways_atr_min_pct': 4.551377204295063e-05, 'sideways_atr_max_pct': 0.11410803423472249, 'sideways_tp_mult': 2.8832856775679403, 'sideways_tsl_mult': 0.9915698882829529, 'sideways_time_stop': 50, 'sideways_use_sma': True, 'sideways_use_ema': True, 'sideways_use_atr': False, 'sideways_use_adx': True, 'sideways_use_spike': True, 'sideways_rsi_required': False}.
[I 2025-08-31 03:10:58,945] Trial 55 finished with values: [-1000000000.0, 1000000000.0] and parameters: {'p_sma': 13, 'p_std': 42, 'p_atr': 13, 'p_adx': 7, 'rsi_period': 31, 'ema1': 16, 'ema2': 21, 'slip_atr_k': 0.011416542724471908, 'slip_spread_k': 0.15014931815508836, 'spread_hl_frac': 0.0472458617706024, 'bb_std_mult': 0.6674790616616011, 'rsi_os': 8, 'rsi_ob': 93, 'vol_spike': 0.10854967811651302, 'adx_thresh': 34.74399798287864, 'atr_min_pct': 0.025040046881934935, 'atr_max_pct': 0.028429836622254935, 'tp_mult': 2.8817619164865538, 'tsl_mult': 0.2684796140661766, 'strategy': 'breakout', 'time_stop': 107, 'use_sma': False, 'use_atr': False, 'use_adx': True, 'use_ema': False, 'use_spike': False, 'rsi_required': False, 'edge_k': 0.6905440694293696, 'edge_cap': 0.08559371759142675, 'bull_strategy': 'breakout', 'bull_bb_std_mult': 2.369973357282699, 'bull_rsi_os': 21, 'bull_rsi_ob': 49, 'bull_adx_thresh': 18.93355188380566, 'bull_atr_min_pct': 0.025964481738079845, 'bull_atr_max_pct': 0.028502493854492522, 'bull_tp_mult': 2.997060548436515, 'bull_tsl_mult': 0.9502653751320496, 'bull_time_stop': 270, 'bull_use_sma': False, 'bull_use_ema': False, 'bull_use_atr': True, 'bull_use_adx': False, 'bull_use_spike': False, 'bull_rsi_required': True, 'bear_strategy': 'mean_reversion', 'bear_bb_std_mult': 2.780530890524917, 'bear_rsi_os': 5, 'bear_rsi_ob': 57, 'bear_adx_thresh': 20.07721485813155, 'bear_atr_min_pct': 0.015947442470702393, 'bear_atr_max_pct': 0.03524740146277024, 'bear_tp_mult': 1.5865208094183905, 'bear_tsl_mult': 0.7808462713737777, 'bear_time_stop': 184, 'bear_use_sma': False, 'bear_use_ema': False, 'bear_use_atr': False, 'bear_use_adx': False, 'bear_use_spike': True, 'bear_rsi_required': False, 'sideways_strategy': 'breakout', 'sideways_bb_std_mult': 1.7175469934782426, 'sideways_rsi_os': 8, 'sideways_rsi_ob': 47, 'sideways_adx_thresh': 33.84438534183039, 'sideways_atr_min_pct': 0.000813705300276496, 'sideways_atr_max_pct': 0.08590450181654359, 'sideways_tp_mult': 2.8963531509287965, 'sideways_tsl_mult': 0.06939741176776099, 'sideways_time_stop': 69, 'sideways_use_sma': True, 'sideways_use_ema': True, 'sideways_use_atr': False, 'sideways_use_adx': True, 'sideways_use_spike': True, 'sideways_rsi_required': False}.
[I 2025-08-31 03:10:59,300] Trial 56 finished with values: [-1000000000.0, 1000000000.0] and parameters: {'p_sma': 14, 'p_std': 44, 'p_atr': 13, 'p_adx': 17, 'rsi_period': 55, 'ema1': 16, 'ema2': 20, 'slip_atr_k': 0.012162466131206686, 'slip_spread_k': 0.8130141431100377, 'spread_hl_frac': 0.03417444081819915, 'bb_std_mult': 0.9095567189957259, 'rsi_os': 36, 'rsi_ob': 54, 'vol_spike': 0.10009846465323238, 'adx_thresh': 22.139651029337706, 'atr_min_pct': 0.027825893711957317, 'atr_max_pct': 0.02930815787348308, 'tp_mult': 2.8955887355650005, 'tsl_mult': 0.7395342997049474, 'strategy': 'breakout', 'time_stop': 107, 'use_sma': False, 'use_atr': False, 'use_adx': True, 'use_ema': False, 'use_spike': False, 'rsi_required': False, 'edge_k': 0.6946440321410311, 'edge_cap': 0.09479049993250044, 'bull_strategy': 'breakout', 'bull_bb_std_mult': 2.370794890266176, 'bull_rsi_os': 21, 'bull_rsi_ob': 50, 'bull_adx_thresh': 34.75528418355801, 'bull_atr_min_pct': 0.016052572103028056, 'bull_atr_max_pct': 0.02836082265746518, 'bull_tp_mult': 1.8283741737301034, 'bull_tsl_mult': 0.9599498343316997, 'bull_time_stop': 110, 'bull_use_sma': True, 'bull_use_ema': True, 'bull_use_atr': True, 'bull_use_adx': False, 'bull_use_spike': False, 'bull_rsi_required': True, 'bear_strategy': 'mean_reversion', 'bear_bb_std_mult': 2.853059820692402, 'bear_rsi_os': 12, 'bear_rsi_ob': 82, 'bear_adx_thresh': 20.1148799222495, 'bear_atr_min_pct': 0.015521604086082861, 'bear_atr_max_pct': 0.0596620529131857, 'bear_tp_mult': 2.537217062016434, 'bear_tsl_mult': 0.8635165251657738, 'bear_time_stop': 5, 'bear_use_sma': False, 'bear_use_ema': False, 'bear_use_atr': False, 'bear_use_adx': False, 'bear_use_spike': False, 'bear_rsi_required': False, 'sideways_strategy': 'breakout', 'sideways_bb_std_mult': 1.4061252754990405, 'sideways_rsi_os': 46, 'sideways_rsi_ob': 47, 'sideways_adx_thresh': 8.818455089858194, 'sideways_atr_min_pct': 0.02237157254251308, 'sideways_atr_max_pct': 0.013377592492982926, 'sideways_tp_mult': 2.916026212266162, 'sideways_tsl_mult': 0.07146175235260638, 'sideways_time_stop': 260, 'sideways_use_sma': True, 'sideways_use_ema': True, 'sideways_use_atr': False, 'sideways_use_adx': True, 'sideways_use_spike': True, 'sideways_rsi_required': False}.
[I 2025-08-31 03:10:59,380] Trial 58 finished with values: [-1000000000.0, 1000000000.0] and parameters: {'p_sma': 14, 'p_std': 43, 'p_atr': 17, 'p_adx': 17, 'rsi_period': 67, 'ema1': 16, 'ema2': 47, 'slip_atr_k': 0.011079103008836796, 'slip_spread_k': 0.44808439529986893, 'spread_hl_frac': 0.024371902830517274, 'bb_std_mult': 0.6502242639296829, 'rsi_os': 34, 'rsi_ob': 95, 'vol_spike': 0.10576733947010272, 'adx_thresh': 16.61911171492292, 'atr_min_pct': 0.025279584024631478, 'atr_max_pct': 0.10063059420402715, 'tp_mult': 1.7970283210863345, 'tsl_mult': 0.7395751853402324, 'strategy': 'breakout', 'time_stop': 23, 'use_sma': False, 'use_atr': True, 'use_adx': True, 'use_ema': True, 'use_spike': False, 'rsi_required': False, 'edge_k': 0.5180027544628132, 'edge_cap': 0.09135469775971641, 'bull_strategy': 'breakout', 'bull_bb_std_mult': 2.336830332832152, 'bull_rsi_os': 21, 'bull_rsi_ob': 50, 'bull_adx_thresh': 18.852307179792344, 'bull_atr_min_pct': 0.026045670515275954, 'bull_atr_max_pct': 0.034310679939920145, 'bull_tp_mult': 1.8351088622471436, 'bull_tsl_mult': 0.9703077806023058, 'bull_time_stop': 110, 'bull_use_sma': True, 'bull_use_ema': True, 'bull_use_atr': False, 'bull_use_adx': False, 'bull_use_spike': False, 'bull_rsi_required': True, 'bear_strategy': 'mean_reversion', 'bear_bb_std_mult': 2.7258122675848115, 'bear_rsi_os': 13, 'bear_rsi_ob': 57, 'bear_adx_thresh': 11.930620176662208, 'bear_atr_min_pct': 0.015446614551131804, 'bear_atr_max_pct': 0.0618365590533337, 'bear_tp_mult': 1.6118297920392832, 'bear_tsl_mult': 0.8584504343893233, 'bear_time_stop': 192, 'bear_use_sma': False, 'bear_use_ema': True, 'bear_use_atr': True, 'bear_use_adx': False, 'bear_use_spike': False, 'bear_rsi_required': False, 'sideways_strategy': 'breakout', 'sideways_bb_std_mult': 1.3988834573974014, 'sideways_rsi_os': 37, 'sideways_rsi_ob': 52, 'sideways_adx_thresh': 9.90068264525811, 'sideways_atr_min_pct': 0.0007693135052310232, 'sideways_atr_max_pct': 0.039586581800409505, 'sideways_tp_mult': 2.900545813580668, 'sideways_tsl_mult': 0.10507927767552194, 'sideways_time_stop': 268, 'sideways_use_sma': True, 'sideways_use_ema': True, 'sideways_use_atr': False, 'sideways_use_adx': True, 'sideways_use_spike': True, 'sideways_rsi_required': False}.
[I 2025-08-31 03:11:30,757] Trial 62 finished with values: [-1000000000.0, 1000000000.0] and parameters: {'p_sma': 44, 'p_std': 28, 'p_atr': 19, 'p_adx': 14, 'rsi_period': 59, 'ema1': 13, 'ema2': 30, 'slip_atr_k': 0.1389757305662074, 'slip_spread_k': 0.6610353174228902, 'spread_hl_frac': 0.036915462110321186, 'bb_std_mult': 2.2994177543731698, 'rsi_os': 41, 'rsi_ob': 71, 'vol_spike': 0.03308960539105693, 'adx_thresh': 14.378397672070763, 'atr_min_pct': 0.0002640372549650178, 'atr_max_pct': 0.1205727919332313, 'tp_mult': 2.5703394189870683, 'tsl_mult': 0.8482763048774064, 'strategy': 'mean_reversion', 'time_stop': 69, 'use_sma': False, 'use_atr': True, 'use_adx': False, 'use_ema': True, 'use_spike': False, 'rsi_required': False, 'edge_k': 1.7294803645210193, 'edge_cap': 0.5247445498559251, 'bull_strategy': 'breakout', 'bull_bb_std_mult': 0.8774488264213998, 'bull_rsi_os': 28, 'bull_rsi_ob': 71, 'bull_adx_thresh': 14.30071233555029, 'bull_atr_min_pct': 0.008897118527591714, 'bull_atr_max_pct': 0.14518407213717008, 'bull_tp_mult': 1.133868905802653, 'bull_tsl_mult': 0.6025027256750245, 'bull_time_stop': 138, 'bull_use_sma': False, 'bull_use_ema': False, 'bull_use_atr': False, 'bull_use_adx': True, 'bull_use_spike': False, 'bull_rsi_required': True, 'bear_strategy': 'breakout', 'bear_bb_std_mult': 1.6903270672575605, 'bear_rsi_os': 36, 'bear_rsi_ob': 77, 'bear_adx_thresh': 8.514236412283706, 'bear_atr_min_pct': 0.002443406400666936, 'bear_atr_max_pct': 0.07192768063655582, 'bear_tp_mult': 1.2199431836918246, 'bear_tsl_mult': 0.9478850471556057, 'bear_time_stop': 274, 'bear_use_sma': True, 'bear_use_ema': True, 'bear_use_atr': True, 'bear_use_adx': False, 'bear_use_spike': True, 'bear_rsi_required': False, 'sideways_strategy': 'mean_reversion', 'sideways_bb_std_mult': 1.0103104483232013, 'sideways_rsi_os': 38, 'sideways_rsi_ob': 45, 'sideways_adx_thresh': 13.642368100605974, 'sideways_atr_min_pct': 0.01355704784114173, 'sideways_atr_max_pct': 0.06107104010840521, 'sideways_tp_mult': 1.591979641992502, 'sideways_tsl_mult': 0.9900997011407371, 'sideways_time_stop': 42, 'sideways_use_sma': False, 'sideways_use_ema': False, 'sideways_use_atr': True, 'sideways_use_adx': True, 'sideways_use_spike': False, 'sideways_rsi_required': False}.
[I 2025-08-31 03:11:31,148] Trial 61 finished with values: [-0.10400704814447781, 0.10393286496426858] and parameters: {'p_sma': 5, 'p_std': 26, 'p_atr': 19, 'p_adx': 14, 'rsi_period': 13, 'ema1': 7, 'ema2': 30, 'slip_atr_k': 0.1333345003075664, 'slip_spread_k': 0.6779391579061045, 'spread_hl_frac': 0.03862503322064698, 'bb_std_mult': 2.324634006254136, 'rsi_os': 41, 'rsi_ob': 89, 'vol_spike': 0.20581267524424054, 'adx_thresh': 28.150565333254793, 'atr_min_pct': 0.016058667713896503, 'atr_max_pct': 0.08668735260069399, 'tp_mult': 2.675512105878087, 'tsl_mult': 0.07049488966454248, 'strategy': 'mean_reversion', 'time_stop': 70, 'use_sma': False, 'use_atr': True, 'use_adx': False, 'use_ema': True, 'use_spike': False, 'rsi_required': False, 'edge_k': 1.8069402073646539, 'edge_cap': 0.5374809071022241, 'bull_strategy': 'breakout', 'bull_bb_std_mult': 0.8561291790006644, 'bull_rsi_os': 53, 'bull_rsi_ob': 72, 'bull_adx_thresh': 21.4900721996427, 'bull_atr_min_pct': 0.029376785330600286, 'bull_atr_max_pct': 0.12954947461373054, 'bull_tp_mult': 1.5124633770906668, 'bull_tsl_mult': 0.631678895951023, 'bull_time_stop': 139, 'bull_use_sma': False, 'bull_use_ema': False, 'bull_use_atr': False, 'bull_use_adx': True, 'bull_use_spike': False, 'bull_rsi_required': True, 'bear_strategy': 'breakout', 'bear_bb_std_mult': 1.7152919845128014, 'bear_rsi_os': 27, 'bear_rsi_ob': 67, 'bear_adx_thresh': 8.511217229934807, 'bear_atr_min_pct': 0.02665039981598242, 'bear_atr_max_pct': 0.14090986986188442, 'bear_tp_mult': 1.395288583502599, 'bear_tsl_mult': 0.9251921374258978, 'bear_time_stop': 269, 'bear_use_sma': True, 'bear_use_ema': True, 'bear_use_atr': True, 'bear_use_adx': False, 'bear_use_spike': True, 'bear_rsi_required': False, 'sideways_strategy': 'mean_reversion', 'sideways_bb_std_mult': 2.23269413387729, 'sideways_rsi_os': 38, 'sideways_rsi_ob': 59, 'sideways_adx_thresh': 14.172066623774588, 'sideways_atr_min_pct': 0.0001517964071886881, 'sideways_atr_max_pct': 0.11327861504117259, 'sideways_tp_mult': 1.1498804288242799, 'sideways_tsl_mult': 0.8217198250824977, 'sideways_time_stop': 141, 'sideways_use_sma': False, 'sideways_use_ema': False, 'sideways_use_atr': True, 'sideways_use_adx': True, 'sideways_use_spike': False, 'sideways_rsi_required': False}.
[I 2025-08-31 03:11:31,666] Trial 60 finished with values: [-1000000000.0, 1000000000.0] and parameters: {'p_sma': 5, 'p_std': 44, 'p_atr': 17, 'p_adx': 17, 'rsi_period': 57, 'ema1': 13, 'ema2': 31, 'slip_atr_k': 0.1393894225727016, 'slip_spread_k': 0.5064099252899019, 'spread_hl_frac': 0.03636161282259611, 'bb_std_mult': 2.2958172800736127, 'rsi_os': 34, 'rsi_ob': 69, 'vol_spike': 0.02984704858753623, 'adx_thresh': 7.7428308811328055, 'atr_min_pct': 0.021481149640132185, 'atr_max_pct': 0.09600788722094648, 'tp_mult': 2.514225326208755, 'tsl_mult': 0.5812661474304106, 'strategy': 'breakout', 'time_stop': 71, 'use_sma': False, 'use_atr': True, 'use_adx': False, 'use_ema': True, 'use_spike': False, 'rsi_required': False, 'edge_k': 0.3641873302736951, 'edge_cap': 0.7821221424509732, 'bull_strategy': 'breakout', 'bull_bb_std_mult': 2.324091365522977, 'bull_rsi_os': 28, 'bull_rsi_ob': 71, 'bull_adx_thresh': 14.533937823551803, 'bull_atr_min_pct': 0.007045607147867782, 'bull_atr_max_pct': 0.1497737923500152, 'bull_tp_mult': 1.1456227507771704, 'bull_tsl_mult': 0.6236102803838154, 'bull_time_stop': 108, 'bull_use_sma': True, 'bull_use_ema': True, 'bull_use_atr': False, 'bull_use_adx': False, 'bull_use_spike': False, 'bull_rsi_required': True, 'bear_strategy': 'mean_reversion', 'bear_bb_std_mult': 1.7357164843167856, 'bear_rsi_os': 26, 'bear_rsi_ob': 67, 'bear_adx_thresh': 12.107168655849327, 'bear_atr_min_pct': 0.027155370138633655, 'bear_atr_max_pct': 0.061878975452691234, 'bear_tp_mult': 1.612691364289312, 'bear_tsl_mult': 0.9240671603860797, 'bear_time_stop': 264, 'bear_use_sma': True, 'bear_use_ema': True, 'bear_use_atr': True, 'bear_use_adx': False, 'bear_use_spike': False, 'bear_rsi_required': False, 'sideways_strategy': 'breakout', 'sideways_bb_std_mult': 1.456494399144638, 'sideways_rsi_os': 37, 'sideways_rsi_ob': 52, 'sideways_adx_thresh': 8.717342587168062, 'sideways_atr_min_pct': 0.00021803621571832266, 'sideways_atr_max_pct': 0.01558768609224552, 'sideways_tp_mult': 1.1463718682426154, 'sideways_tsl_mult': 0.8169995945414379, 'sideways_time_stop': 143, 'sideways_use_sma': True, 'sideways_use_ema': False, 'sideways_use_atr': True, 'sideways_use_adx': True, 'sideways_use_spike': True, 'sideways_rsi_required': False}.
[I 2025-08-31 03:11:31,775] Trial 59 finished with values: [-0.024152586905472506, 0.024116316397275822] and parameters: {'p_sma': 13, 'p_std': 44, 'p_atr': 13, 'p_adx': 17, 'rsi_period': 58, 'ema1': 16, 'ema2': 31, 'slip_atr_k': 0.011034113208722083, 'slip_spread_k': 0.512412880188712, 'spread_hl_frac': 0.03656108526996918, 'bb_std_mult': 0.6739635092617325, 'rsi_os': 40, 'rsi_ob': 92, 'vol_spike': 0.01997962360976946, 'adx_thresh': 17.027589578098343, 'atr_min_pct': 0.027695091425447682, 'atr_max_pct': 0.04717593841926915, 'tp_mult': 2.578097906934529, 'tsl_mult': 0.7345546757489563, 'strategy': 'breakout', 'time_stop': 102, 'use_sma': False, 'use_atr': True, 'use_adx': True, 'use_ema': True, 'use_spike': False, 'rsi_required': False, 'edge_k': 0.5352598316729076, 'edge_cap': 0.09587140640078895, 'bull_strategy': 'breakout', 'bull_bb_std_mult': 2.337233740632708, 'bull_rsi_os': 28, 'bull_rsi_ob': 71, 'bull_adx_thresh': 18.68724955520515, 'bull_atr_min_pct': 0.01567325426675908, 'bull_atr_max_pct': 0.14508329304499068, 'bull_tp_mult': 1.112941259910741, 'bull_tsl_mult': 0.9106320029102297, 'bull_time_stop': 105, 'bull_use_sma': True, 'bull_use_ema': True, 'bull_use_atr': False, 'bull_use_adx': False, 'bull_use_spike': False, 'bull_rsi_required': True, 'bear_strategy': 'mean_reversion', 'bear_bb_std_mult': 2.7716989700755983, 'bear_rsi_os': 14, 'bear_rsi_ob': 67, 'bear_adx_thresh': 14.554489047423386, 'bear_atr_min_pct': 0.00232934807659444, 'bear_atr_max_pct': 0.05960135283913858, 'bear_tp_mult': 1.602486499325646, 'bear_tsl_mult': 0.9239283555904442, 'bear_time_stop': 266, 'bear_use_sma': False, 'bear_use_ema': True, 'bear_use_atr': True, 'bear_use_adx': False, 'bear_use_spike': False, 'bear_rsi_required': False, 'sideways_strategy': 'breakout', 'sideways_bb_std_mult': 1.6860092657821464, 'sideways_rsi_os': 37, 'sideways_rsi_ob': 45, 'sideways_adx_thresh': 8.417393087052636, 'sideways_atr_min_pct': 0.00012603292711383833, 'sideways_atr_max_pct': 0.013759913921745318, 'sideways_tp_mult': 2.9301034327077833, 'sideways_tsl_mult': 0.12028686253529913, 'sideways_time_stop': 148, 'sideways_use_sma': True, 'sideways_use_ema': False, 'sideways_use_atr': False, 'sideways_use_adx': True, 'sideways_use_spike': True, 'sideways_rsi_required': False}.
