[I 2025-08-31 03:15:23,735] Trial 91 finished with values: [-0.027746337888977513, 0.027711274897724292] and parameters: {'p_sma': 15, 'p_std': 29, 'p_atr': 11, 'p_adx': 14, 'rsi_period': 49, 'ema1': 25, 'ema2': 21, 'slip_atr_k': 0.04886605181733267, 'slip_spread_k': 0.3376505346270257, 'spread_hl_frac': 0.03455802638280049, 'bb_std_mult': 2.9895716314941585, 'rsi_os': 33, 'rsi_ob': 63, 'vol_spike': 0.21540907140065138, 'adx_thresh': 21.819147531678457, 'atr_min_pct': 0.018752066041933, 'atr_max_pct': 0.1172026823276752, 'tp_mult': 1.6809085663060421, 'tsl_mult': 0.5395891658951513, 'strategy': 'mean_reversion', 'time_stop': 86, 'use_sma': False, 'use_atr': True, 'use_adx': True, 'use_ema': False, 'use_spike': False, 'rsi_required': False, 'edge_k': 1.4172983352109836, 'edge_cap': 0.8587748273350889, 'bull_strategy': 'breakout', 'bull_bb_std_mult': 1.8153415068068228, 'bull_rsi_os': 20, 'bull_rsi_ob': 89, 'bull_adx_thresh': 22.18825768722078, 'bull_atr_min_pct': 0.00400418331458083, 'bull_atr_max_pct': 0.142017541190664, 'bull_tp_mult': 1.4009615303964744, 'bull_tsl_mult': 0.856612454942498, 'bull_time_stop': 83, 'bull_use_sma': True, 'bull_use_ema': True, 'bull_use_atr': True, 'bull_use_adx': True, 'bull_use_spike': True, 'bull_rsi_required': True, 'bear_strategy': 'mean_reversion', 'bear_bb_std_mult': 1.5921702705391878, 'bear_rsi_os': 51, 'bear_rsi_ob': 80, 'bear_adx_thresh': 16.18302583079793, 'bear_atr_min_pct': 0.014824165195367198, 'bear_atr_max_pct': 0.13607656779937177, 'bear_tp_mult': 1.8134867420539604, 'bear_tsl_mult': 0.03934986877430435, 'bear_time_stop': 158, 'bear_use_sma': False, 'bear_use_ema': True, 'bear_use_atr': False, 'bear_use_adx': False, 'bear_use_spike': False, 'bear_rsi_required': False, 'sideways_strategy': 'breakout', 'sideways_bb_std_mult': 1.7672717499577317, 'sideways_rsi_os': 45, 'sideways_rsi_ob': 54, 'sideways_adx_thresh': 11.508671097882914, 'sideways_atr_min_pct': 0.002077930863139439, 'sideways_atr_max_pct': 0.09358945697802826, 'sideways_tp_mult': 2.604345879271716, 'sideways_tsl_mult': 0.608862570311261, 'sideways_time_stop': 244, 'sideways_use_sma': True, 'sideways_use_ema': False, 'sideways_use_atr': False, 'sideways_use_adx': False, 'sideways_use_spike': True, 'sideways_rsi_required': False}.
[I 2025-08-31 03:15:24,172] Trial 90 finished with values: [-1000000000.0, 1000000000.0] and parameters: {'p_sma': 60, 'p_std': 29, 'p_atr': 11, 'p_adx': 14, 'rsi_period': 70, 'ema1': 28, 'ema2': 21, 'slip_atr_k': 0.0731082802847143, 'slip_spread_k': 0.4944667669934151, 'spread_hl_frac': 0.030695345136130717, 'bb_std_mult': 1.2213326685892931, 'rsi_os': 29, 'rsi_ob': 61, 'vol_spike': 0.2931847463599555, 'adx_thresh': 30.64207436707771, 'atr_min_pct': 0.01872421379815998, 'atr_max_pct': 0.10649159241891383, 'tp_mult': 2.286545643388294, 'tsl_mult': 0.5368048338814786, 'strategy': 'mean_reversion', 'time_stop': 184, 'use_sma': False, 'use_atr': False, 'use_adx': True, 'use_ema': False, 'use_spike': False, 'rsi_required': False, 'edge_k': 0.2952199745450477, 'edge_cap': 0.3385482057403192, 'bull_strategy': 'breakout', 'bull_bb_std_mult': 0.5237614320448738, 'bull_rsi_os': 17, 'bull_rsi_ob': 64, 'bull_adx_thresh': 13.145418965997132, 'bull_atr_min_pct': 0.006145517256292583, 'bull_atr_max_pct': 0.14224074364497566, 'bull_tp_mult': 2.5026413643243126, 'bull_tsl_mult': 0.9223359605051568, 'bull_time_stop': 83, 'bull_use_sma': True, 'bull_use_ema': False, 'bull_use_atr': True, 'bull_use_adx': True, 'bull_use_spike': True, 'bull_rsi_required': True, 'bear_strategy': 'mean_reversion', 'bear_bb_std_mult': 1.5998294847852472, 'bear_rsi_os': 5, 'bear_rsi_ob': 81, 'bear_adx_thresh': 17.23992756649249, 'bear_atr_min_pct': 0.014351339376293347, 'bear_atr_max_pct': 0.09223420186281106, 'bear_tp_mult': 1.8111843646990475, 'bear_tsl_mult': 0.26662462964478484, 'bear_time_stop': 152, 'bear_use_sma': False, 'bear_use_ema': False, 'bear_use_atr': False, 'bear_use_adx': False, 'bear_use_spike': False, 'bear_rsi_required': True, 'sideways_strategy': 'breakout', 'sideways_bb_std_mult': 1.7409798286264244, 'sideways_rsi_os': 43, 'sideways_rsi_ob': 54, 'sideways_adx_thresh': 12.240024251066075, 'sideways_atr_min_pct': 0.00937771830399434, 'sideways_atr_max_pct': 0.13878079005155736, 'sideways_tp_mult': 2.605794275212052, 'sideways_tsl_mult': 0.6275555960960555, 'sideways_time_stop': 62, 'sideways_use_sma': True, 'sideways_use_ema': True, 'sideways_use_atr': False, 'sideways_use_adx': True, 'sideways_use_spike': True, 'sideways_rsi_required': False}.
[I 2025-08-31 03:15:24,307] Trial 89 finished with values: [-0.05622262145161572, 0.05615157205014606] and parameters: {'p_sma': 58, 'p_std': 30, 'p_atr': 24, 'p_adx': 29, 'rsi_period': 73, 'ema1': 25, 'ema2': 21, 'slip_atr_k': 0.07187987014970657, 'slip_spread_k': 0.4910505462851656, 'spread_hl_frac': 0.03548883823413518, 'bb_std_mult': 1.1178017522684942, 'rsi_os': 55, 'rsi_ob': 62, 'vol_spike': 0.21483182480028862, 'adx_thresh': 21.72581293001346, 'atr_min_pct': 0.003279957307793683, 'atr_max_pct': 0.1446890029253155, 'tp_mult': 2.985657689951703, 'tsl_mult': 0.2219294765478621, 'strategy': 'breakout', 'time_stop': 247, 'use_sma': True, 'use_atr': True, 'use_adx': False, 'use_ema': False, 'use_spike': False, 'rsi_required': True, 'edge_k': 1.116391472731736, 'edge_cap': 0.23519291102095471, 'bull_strategy': 'breakout', 'bull_bb_std_mult': 3.014631948509962, 'bull_rsi_os': 16, 'bull_rsi_ob': 75, 'bull_adx_thresh': 10.770037988281654, 'bull_atr_min_pct': 0.001546374432404499, 'bull_atr_max_pct': 0.09327179947068347, 'bull_tp_mult': 2.545027866690322, 'bull_tsl_mult': 0.779284244036754, 'bull_time_stop': 149, 'bull_use_sma': False, 'bull_use_ema': False, 'bull_use_atr': True, 'bull_use_adx': True, 'bull_use_spike': True, 'bull_rsi_required': True, 'bear_strategy': 'mean_reversion', 'bear_bb_std_mult': 2.136577836972317, 'bear_rsi_os': 5, 'bear_rsi_ob': 82, 'bear_adx_thresh': 17.569270560754763, 'bear_atr_min_pct': 0.004137591678081412, 'bear_atr_max_pct': 0.13414413351809806, 'bear_tp_mult': 1.8314180344422333, 'bear_tsl_mult': 0.9038528946651964, 'bear_time_stop': 90, 'bear_use_sma': False, 'bear_use_ema': False, 'bear_use_atr': False, 'bear_use_adx': False, 'bear_use_spike': True, 'bear_rsi_required': True, 'sideways_strategy': 'breakout', 'sideways_bb_std_mult': 1.6122078913820521, 'sideways_rsi_os': 44, 'sideways_rsi_ob': 54, 'sideways_adx_thresh': 29.836887015614764, 'sideways_atr_min_pct': 0.0007856017884725178, 'sideways_atr_max_pct': 0.14107570552745202, 'sideways_tp_mult': 1.0353105863271828, 'sideways_tsl_mult': 0.7846723854320725, 'sideways_time_stop': 250, 'sideways_use_sma': True, 'sideways_use_ema': True, 'sideways_use_atr': False, 'sideways_use_adx': True, 'sideways_use_spike': True, 'sideways_rsi_required': True}.
[I 2025-08-31 03:15:57,654] Trial 94 finished with values: [-1000000000.0, 1000000000.0] and parameters: {'p_sma': 5, 'p_std': 53, 'p_atr': 20, 'p_adx': 15, 'rsi_period': 66, 'ema1': 17, 'ema2': 20, 'slip_atr_k': 0.012931646937860586, 'slip_spread_k': 0.33735380426987993, 'spread_hl_frac': 0.030783420541592867, 'bb_std_mult': 0.7143870690409764, 'rsi_os': 29, 'rsi_ob': 94, 'vol_spike': 0.21729105488106165, 'adx_thresh': 21.53143182370524, 'atr_min_pct': 0.020672821111992087, 'atr_max_pct': 0.10675398146143536, 'tp_mult': 2.9573284559195514, 'tsl_mult': 0.48106937640054637, 'strategy': 'breakout', 'time_stop': 199, 'use_sma': False, 'use_atr': False, 'use_adx': True, 'use_ema': True, 'use_spike': False, 'rsi_required': False, 'edge_k': 0.8026652809921067, 'edge_cap': 0.07350501391210759, 'bull_strategy': 'breakout', 'bull_bb_std_mult': 3.3223430511025356, 'bull_rsi_os': 22, 'bull_rsi_ob': 76, 'bull_adx_thresh': 12.485203633837369, 'bull_atr_min_pct': 0.0066143141493921935, 'bull_atr_max_pct': 0.0823319335759829, 'bull_tp_mult': 1.3760478503006288, 'bull_tsl_mult': 0.9341618931410388, 'bull_time_stop': 67, 'bull_use_sma': False, 'bull_use_ema': False, 'bull_use_atr': True, 'bull_use_adx': False, 'bull_use_spike': False, 'bull_rsi_required': True, 'bear_strategy': 'mean_reversion', 'bear_bb_std_mult': 3.5954031755870144, 'bear_rsi_os': 5, 'bear_rsi_ob': 84, 'bear_adx_thresh': 16.129261125589135, 'bear_atr_min_pct': 0.006961508534995042, 'bear_atr_max_pct': 0.1313747201658468, 'bear_tp_mult': 1.806435414219076, 'bear_tsl_mult': 0.9729240314644572, 'bear_time_stop': 18, 'bear_use_sma': False, 'bear_use_ema': False, 'bear_use_atr': False, 'bear_use_adx': False, 'bear_use_spike': True, 'bear_rsi_required': False, 'sideways_strategy': 'breakout', 'sideways_bb_std_mult': 1.739374683245212, 'sideways_rsi_os': 16, 'sideways_rsi_ob': 48, 'sideways_adx_thresh': 24.09238453599808, 'sideways_atr_min_pct': 0.023587880223964908, 'sideways_atr_max_pct': 0.09521079043470718, 'sideways_tp_mult': 2.771364708635225, 'sideways_tsl_mult': 0.7819939213991625, 'sideways_time_stop': 247, 'sideways_use_sma': True, 'sideways_use_ema': True, 'sideways_use_atr': False, 'sideways_use_adx': False, 'sideways_use_spike': True, 'sideways_rsi_required': False}.
[I 2025-08-31 03:15:58,027] Trial 93 finished with values: [-1000000000.0, 1000000000.0] and parameters: {'p_sma': 15, 'p_std': 37, 'p_atr': 20, 'p_adx': 11, 'rsi_period': 62, 'ema1': 21, 'ema2': 21, 'slip_atr_k': 0.010467974453385421, 'slip_spread_k': 0.28385910119819124, 'spread_hl_frac': 0.03485178331207271, 'bb_std_mult': 0.7212889622500364, 'rsi_os': 29, 'rsi_ob': 53, 'vol_spike': 0.2141121633386432, 'adx_thresh': 21.385642754528703, 'atr_min_pct': 0.018733352206850053, 'atr_max_pct': 0.10565793249112189, 'tp_mult': 2.7678139966082482, 'tsl_mult': 0.7603827145363422, 'strategy': 'breakout', 'time_stop': 195, 'use_sma': False, 'use_atr': False, 'use_adx': True, 'use_ema': True, 'use_spike': False, 'rsi_required': False, 'edge_k': 0.6231858992904108, 'edge_cap': 0.8562487562590219, 'bull_strategy': 'breakout', 'bull_bb_std_mult': 2.424460725051206, 'bull_rsi_os': 22, 'bull_rsi_ob': 88, 'bull_adx_thresh': 15.33666999674604, 'bull_atr_min_pct': 0.006160326561904382, 'bull_atr_max_pct': 0.06683382099589501, 'bull_tp_mult': 2.686214046686728, 'bull_tsl_mult': 0.8593776629606793, 'bull_time_stop': 17, 'bull_use_sma': False, 'bull_use_ema': False, 'bull_use_atr': True, 'bull_use_adx': False, 'bull_use_spike': False, 'bull_rsi_required': True, 'bear_strategy': 'mean_reversion', 'bear_bb_std_mult': 2.156308410721523, 'bear_rsi_os': 20, 'bear_rsi_ob': 85, 'bear_adx_thresh': 33.714600624419035, 'bear_atr_min_pct': 0.006832299036821657, 'bear_atr_max_pct': 0.0909173471870519, 'bear_tp_mult': 1.799919281046406, 'bear_tsl_mult': 0.9743656722711868, 'bear_time_stop': 148, 'bear_use_sma': True, 'bear_use_ema': False, 'bear_use_atr': False, 'bear_use_adx': False, 'bear_use_spike': True, 'bear_rsi_required': True, 'sideways_strategy': 'breakout', 'sideways_bb_std_mult': 1.5978652398260933, 'sideways_rsi_os': 26, 'sideways_rsi_ob': 54, 'sideways_adx_thresh': 33.49315771829595, 'sideways_atr_min_pct': 0.012144756776604648, 'sideways_atr_max_pct': 0.1327554173867561, 'sideways_tp_mult': 2.340699126980312, 'sideways_tsl_mult': 0.6765325921701615, 'sideways_time_stop': 247, 'sideways_use_sma': True, 'sideways_use_ema': True, 'sideways_use_atr': True, 'sideways_use_adx': False, 'sideways_use_spike': True, 'sideways_rsi_required': False}.
[I 2025-08-31 03:15:58,039] Trial 96 finished with values: [-1000000000.0, 1000000000.0] and parameters: {'p_sma': 6, 'p_std': 18, 'p_atr': 16, 'p_adx': 15, 'rsi_period': 22, 'ema1': 10, 'ema2': 15, 'slip_atr_k': 0.23084125204603498, 'slip_spread_k': 0.4017549808473805, 'spread_hl_frac': 0.016135288155195424, 'bb_std_mult': 1.0036615388808408, 'rsi_os': 32, 'rsi_ob': 94, 'vol_spike': 0.015294584942862816, 'adx_thresh': 32.54405739514322, 'atr_min_pct': 0.019980561835591788, 'atr_max_pct': 0.05849203308812713, 'tp_mult': 2.7629197900645717, 'tsl_mult': 0.4731461063964052, 'strategy': 'breakout', 'time_stop': 140, 'use_sma': False, 'use_atr': False, 'use_adx': True, 'use_ema': True, 'use_spike': False, 'rsi_required': False, 'edge_k': 0.7762192073769497, 'edge_cap': 0.633949197723853, 'bull_strategy': 'breakout', 'bull_bb_std_mult': 2.2179123880797094, 'bull_rsi_os': 22, 'bull_rsi_ob': 70, 'bull_adx_thresh': 15.206371347938187, 'bull_atr_min_pct': 0.010228616175451568, 'bull_atr_max_pct': 0.06961893435823285, 'bull_tp_mult': 2.80692834636044, 'bull_tsl_mult': 0.8856422248676836, 'bull_time_stop': 235, 'bull_use_sma': False, 'bull_use_ema': True, 'bull_use_atr': False, 'bull_use_adx': False, 'bull_use_spike': False, 'bull_rsi_required': False, 'bear_strategy': 'breakout', 'bear_bb_std_mult': 1.077234697952081, 'bear_rsi_os': 37, 'bear_rsi_ob': 80, 'bear_adx_thresh': 15.839209540085665, 'bear_atr_min_pct': 0.00720154026593344, 'bear_atr_max_pct': 0.021717107898092003, 'bear_tp_mult': 1.5827209404105071, 'bear_tsl_mult': 0.9854711391455053, 'bear_time_stop': 237, 'bear_use_sma': True, 'bear_use_ema': False, 'bear_use_atr': True, 'bear_use_adx': False, 'bear_use_spike': True, 'bear_rsi_required': False, 'sideways_strategy': 'breakout', 'sideways_bb_std_mult': 1.0924630451236461, 'sideways_rsi_os': 26, 'sideways_rsi_ob': 76, 'sideways_adx_thresh': 24.417712527071444, 'sideways_atr_min_pct': 0.0020136845253121587, 'sideways_atr_max_pct': 0.09508121312834876, 'sideways_tp_mult': 2.779459037378396, 'sideways_tsl_mult': 0.6701770556555005, 'sideways_time_stop': 5, 'sideways_use_sma': False, 'sideways_use_ema': True, 'sideways_use_atr': True, 'sideways_use_adx': False, 'sideways_use_spike': True, 'sideways_rsi_required': False}.
[I 2025-08-31 03:15:58,127] Trial 95 finished with values: [-1000000000.0, 1000000000.0] and parameters: {'p_sma': 6, 'p_std': 54, 'p_atr': 20, 'p_adx': 15, 'rsi_period': 48, 'ema1': 17, 'ema2': 15, 'slip_atr_k': 0.010846764069432158, 'slip_spread_k': 0.4899545704544686, 'spread_hl_frac': 0.03475899602684056, 'bb_std_mult': 0.7289886967194141, 'rsi_os': 38, 'rsi_ob': 94, 'vol_spike': 0.016208092593432977, 'adx_thresh': 21.614894462271856, 'atr_min_pct': 0.020107474546784403, 'atr_max_pct': 0.022530784835675263, 'tp_mult': 2.9651193016828965, 'tsl_mult': 0.21717897821937177, 'strategy': 'breakout', 'time_stop': 259, 'use_sma': False, 'use_atr': False, 'use_adx': True, 'use_ema': True, 'use_spike': False, 'rsi_required': False, 'edge_k': 0.6270074426155017, 'edge_cap': 0.07329333615888227, 'bull_strategy': 'breakout', 'bull_bb_std_mult': 3.405761244790088, 'bull_rsi_os': 22, 'bull_rsi_ob': 76, 'bull_adx_thresh': 17.550726056641494, 'bull_atr_min_pct': 0.004226187933877896, 'bull_atr_max_pct': 0.09455160968934925, 'bull_tp_mult': 2.6196523097069617, 'bull_tsl_mult': 0.26909357331980455, 'bull_time_stop': 135, 'bull_use_sma': False, 'bull_use_ema': False, 'bull_use_atr': False, 'bull_use_adx': False, 'bull_use_spike': False, 'bull_rsi_required': True, 'bear_strategy': 'mean_reversion', 'bear_bb_std_mult': 3.570427474544754, 'bear_rsi_os': 8, 'bear_rsi_ob': 84, 'bear_adx_thresh': 16.285807159316096, 'bear_atr_min_pct': 0.0068585894517646535, 'bear_atr_max_pct': 0.12995427141846191, 'bear_tp_mult': 1.5619587752924637, 'bear_tsl_mult': 0.9719914262943888, 'bear_time_stop': 234, 'bear_use_sma': True, 'bear_use_ema': False, 'bear_use_atr': False, 'bear_use_adx': False, 'bear_use_spike': True, 'bear_rsi_required': False, 'sideways_strategy': 'breakout', 'sideways_bb_std_mult': 1.8744459368538795, 'sideways_rsi_os': 5, 'sideways_rsi_ob': 75, 'sideways_adx_thresh': 24.101799369044556, 'sideways_atr_min_pct': 0.0019442294980274268, 'sideways_atr_max_pct': 0.09583645828405347, 'sideways_tp_mult': 1.2199455718013055, 'sideways_tsl_mult': 0.7797452751341968, 'sideways_time_stop': 46, 'sideways_use_sma': True, 'sideways_use_ema': True, 'sideways_use_atr': True, 'sideways_use_adx': False, 'sideways_use_spike': True, 'sideways_rsi_required': False}.
[I 2025-08-31 03:15:58,506] Trial 98 finished with values: [-1000000000.0, 1000000000.0] and parameters: {'p_sma': 11, 'p_std': 57, 'p_atr': 15, 'p_adx': 12, 'rsi_period': 64, 'ema1': 8, 'ema2': 51, 'slip_atr_k': 0.11533641226288399, 'slip_spread_k': 0.5517319781692206, 'spread_hl_frac': 0.03698203675204921, 'bb_std_mult': 2.1733253696415074, 'rsi_os': 20, 'rsi_ob': 45, 'vol_spike': 0.16047522106654588, 'adx_thresh': 8.08834035043223, 'atr_min_pct': 0.010903106164554203, 'atr_max_pct': 0.02171590803415986, 'tp_mult': 2.449993133743321, 'tsl_mult': 0.5617794595289117, 'strategy': 'mean_reversion', 'time_stop': 259, 'use_sma': False, 'use_atr': False, 'use_adx': True, 'use_ema': False, 'use_spike': True, 'rsi_required': False, 'edge_k': 1.6526322749611453, 'edge_cap': 0.05067123441463434, 'bull_strategy': 'breakout', 'bull_bb_std_mult': 1.995462245343429, 'bull_rsi_os': 55, 'bull_rsi_ob': 93, 'bull_adx_thresh': 22.151368775326787, 'bull_atr_min_pct': 0.0041890223632547186, 'bull_atr_max_pct': 0.10414111049680236, 'bull_tp_mult': 1.8527150661910106, 'bull_tsl_mult': 0.962612215272626, 'bull_time_stop': 105, 'bull_use_sma': False, 'bull_use_ema': True, 'bull_use_atr': False, 'bull_use_adx': False, 'bull_use_spike': False, 'bull_rsi_required': False, 'bear_strategy': 'mean_reversion', 'bear_bb_std_mult': 1.1260336875679515, 'bear_rsi_os': 51, 'bear_rsi_ob': 78, 'bear_adx_thresh': 29.20862174407607, 'bear_atr_min_pct': 0.024182032396492484, 'bear_atr_max_pct': 0.11394269555024131, 'bear_tp_mult': 1.6204216608263973, 'bear_tsl_mult': 0.6004619256513744, 'bear_time_stop': 121, 'bear_use_sma': False, 'bear_use_ema': True, 'bear_use_atr': True, 'bear_use_adx': False, 'bear_use_spike': True, 'bear_rsi_required': False, 'sideways_strategy': 'mean_reversion', 'sideways_bb_std_mult': 1.8693207655348796, 'sideways_rsi_os': 37, 'sideways_rsi_ob': 51, 'sideways_adx_thresh': 21.68376018574754, 'sideways_atr_min_pct': 0.001961428149361141, 'sideways_atr_max_pct': 0.10412472644870023, 'sideways_tp_mult': 1.3723256655531522, 'sideways_tsl_mult': 0.7097775704882855, 'sideways_time_stop': 46, 'sideways_use_sma': True, 'sideways_use_ema': False, 'sideways_use_atr': False, 'sideways_use_adx': True, 'sideways_use_spike': True, 'sideways_rsi_required': False}.
[I 2025-08-31 03:16:29,685] Trial 100 finished with values: [-1000000000.0, 1000000000.0] and parameters: {'p_sma': 11, 'p_std': 37, 'p_atr': 13, 'p_adx': 13, 'rsi_period': 66, 'ema1': 15, 'ema2': 23, 'slip_atr_k': 0.04687921986832588, 'slip_spread_k': 0.8443707711235056, 'spread_hl_frac': 0.03665908226330527, 'bb_std_mult': 0.8681019001781075, 'rsi_os': 34, 'rsi_ob': 90, 'vol_spike': 0.1249156296116756, 'adx_thresh': 28.030885232068897, 'atr_min_pct': 0.023108742127646107, 'atr_max_pct': 0.11189043100058581, 'tp_mult': 2.846393567203926, 'tsl_mult': 0.3954580091014892, 'strategy': 'mean_reversion', 'time_stop': 156, 'use_sma': False, 'use_atr': True, 'use_adx': False, 'use_ema': False, 'use_spike': True, 'rsi_required': True, 'edge_k': 1.24192542580853, 'edge_cap': 0.5813375753079616, 'bull_strategy': 'mean_reversion', 'bull_bb_std_mult': 2.01542939825062, 'bull_rsi_os': 55, 'bull_rsi_ob': 93, 'bull_adx_thresh': 21.766951792855664, 'bull_atr_min_pct': 0.024043951880294144, 'bull_atr_max_pct': 0.14469628012437707, 'bull_tp_mult': 1.4970331859177668, 'bull_tsl_mult': 0.9639409761635532, 'bull_time_stop': 104, 'bull_use_sma': True, 'bull_use_ema': True, 'bull_use_atr': True, 'bull_use_adx': False, 'bull_use_spike': False, 'bull_rsi_required': False, 'bear_strategy': 'breakout', 'bear_bb_std_mult': 0.7075135347585408, 'bear_rsi_os': 47, 'bear_rsi_ob': 77, 'bear_adx_thresh': 18.514583884864454, 'bear_atr_min_pct': 0.013182479607428209, 'bear_atr_max_pct': 0.11295420125468053, 'bear_tp_mult': 1.7305386591218894, 'bear_tsl_mult': 0.9334476915961532, 'bear_time_stop': 200, 'bear_use_sma': False, 'bear_use_ema': True, 'bear_use_atr': True, 'bear_use_adx': False, 'bear_use_spike': False, 'bear_rsi_required': False, 'sideways_strategy': 'mean_reversion', 'sideways_bb_std_mult': 1.3551618220215231, 'sideways_rsi_os': 35, 'sideways_rsi_ob': 89, 'sideways_adx_thresh': 6.192821676821227, 'sideways_atr_min_pct': 0.012962569728011492, 'sideways_atr_max_pct': 0.10540596337353295, 'sideways_tp_mult': 1.3736460345233374, 'sideways_tsl_mult': 0.8993427177760291, 'sideways_time_stop': 14, 'sideways_use_sma': False, 'sideways_use_ema': False, 'sideways_use_atr': False, 'sideways_use_adx': True, 'sideways_use_spike': True, 'sideways_rsi_required': False}.
