[I 2025-08-31 03:05:56,617] Trial 18 finished with values: [-0.040604769799174045, 0.040875178135767] and parameters: {'p_sma': 9, 'p_std': 10, 'p_atr': 14, 'p_adx': 29, 'rsi_period': 66, 'ema1': 17, 'ema2': 19, 'slip_atr_k': 0.010843003412843243, 'slip_spread_k': 0.4425535179068051, 'spread_hl_frac': 0.03969333089398662, 'bb_std_mult': 0.5311289945492033, 'rsi_os': 6, 'rsi_ob': 92, 'vol_spike': 0.18823365472326975, 'adx_thresh': 24.230938567557935, 'atr_min_pct': 0.02178646301830249, 'atr_max_pct': 0.09841825270398478, 'tp_mult': 2.9194225739663526, 'tsl_mult': 0.28920668683224743, 'strategy': 'breakout', 'time_stop': 89, 'use_sma': False, 'use_atr': False, 'use_adx': True, 'use_ema': False, 'use_spike': False, 'rsi_required': False, 'edge_k': 0.2954777080846672, 'edge_cap': 0.06252437078475631, 'bull_strategy': 'breakout', 'bull_bb_std_mult': 1.154266321311425, 'bull_rsi_os': 20, 'bull_rsi_ob': 76, 'bull_adx_thresh': 5.409609097824916, 'bull_atr_min_pct': 0.00013722726636928272, 'bull_atr_max_pct': 0.11963444536288356, 'bull_tp_mult': 1.7005870070300255, 'bull_tsl_mult': 0.9657918938724702, 'bull_time_stop': 101, 'bull_use_sma': False, 'bull_use_ema': False, 'bull_use_atr': True, 'bull_use_adx': False, 'bull_use_spike': False, 'bull_rsi_required': True, 'bear_strategy': 'mean_reversion', 'bear_bb_std_mult': 0.5191576922657355, 'bear_rsi_os': 35, 'bear_rsi_ob': 94, 'bear_adx_thresh': 27.446302695446796, 'bear_atr_min_pct': 0.006806059268299634, 'bear_atr_max_pct': 0.045054108918555436, 'bear_tp_mult': 1.046039301399116, 'bear_tsl_mult': 0.6067640931181402, 'bear_time_stop': 244, 'bear_use_sma': False, 'bear_use_ema': False, 'bear_use_atr': False, 'bear_use_adx': False, 'bear_use_spike': True, 'bear_rsi_required': False, 'sideways_strategy': 'breakout', 'sideways_bb_std_mult': 3.5708832234524968, 'sideways_rsi_os': 39, 'sideways_rsi_ob': 53, 'sideways_adx_thresh': 23.556582906385465, 'sideways_atr_min_pct': 0.00026146573823750715, 'sideways_atr_max_pct': 0.09785471837532103, 'sideways_tp_mult': 2.864096055786704, 'sideways_tsl_mult': 0.7545404119648981, 'sideways_time_stop': 68, 'sideways_use_sma': True, 'sideways_use_ema': True, 'sideways_use_atr': False, 'sideways_use_adx': True, 'sideways_use_spike': True, 'sideways_rsi_required': False}.
[I 2025-08-31 03:05:58,481] Trial 20 finished with values: [-1000000000.0, 1000000000.0] and parameters: {'p_sma': 5, 'p_std': 14, 'p_atr': 15, 'p_adx': 14, 'rsi_period': 69, 'ema1': 15, 'ema2': 22, 'slip_atr_k': 0.0064441728543766395, 'slip_spread_k': 0.5150905957559989, 'spread_hl_frac': 0.034272512982655046, 'bb_std_mult': 1.0212410850798312, 'rsi_os': 35, 'rsi_ob': 95, 'vol_spike': 0.21422076856385336, 'adx_thresh': 21.598560452537114, 'atr_min_pct': 0.023212518574142946, 'atr_max_pct': 0.10854061172495824, 'tp_mult': 2.977389896685618, 'tsl_mult': 0.6024478889937682, 'strategy': 'breakout', 'time_stop': 141, 'use_sma': False, 'use_atr': False, 'use_adx': True, 'use_ema': False, 'use_spike': False, 'rsi_required': False, 'edge_k': 0.7746101190818868, 'edge_cap': 0.07612106449028198, 'bull_strategy': 'breakout', 'bull_bb_std_mult': 1.0050456081471748, 'bull_rsi_os': 18, 'bull_rsi_ob': 73, 'bull_adx_thresh': 5.629315380514006, 'bull_atr_min_pct': 0.018096362067936862, 'bull_atr_max_pct': 0.11836858579136532, 'bull_tp_mult': 1.9254526688547398, 'bull_tsl_mult': 0.9427445685134759, 'bull_time_stop': 187, 'bull_use_sma': False, 'bull_use_ema': False, 'bull_use_atr': True, 'bull_use_adx': False, 'bull_use_spike': False, 'bull_rsi_required': True, 'bear_strategy': 'mean_reversion', 'bear_bb_std_mult': 1.7211723033771162, 'bear_rsi_os': 14, 'bear_rsi_ob': 74, 'bear_adx_thresh': 19.44553632627285, 'bear_atr_min_pct': 0.009423704683680721, 'bear_atr_max_pct': 0.014080971548211904, 'bear_tp_mult': 1.0360178207700346, 'bear_tsl_mult': 0.9993789999429876, 'bear_time_stop': 128, 'bear_use_sma': False, 'bear_use_ema': False, 'bear_use_atr': False, 'bear_use_adx': False, 'bear_use_spike': True, 'bear_rsi_required': False, 'sideways_strategy': 'breakout', 'sideways_bb_std_mult': 1.5193589627018362, 'sideways_rsi_os': 39, 'sideways_rsi_ob': 94, 'sideways_adx_thresh': 14.626130530752324, 'sideways_atr_min_pct': 0.0011079942204226746, 'sideways_atr_max_pct': 0.09584320981323242, 'sideways_tp_mult': 2.8952203904160223, 'sideways_tsl_mult': 0.7935094111356144, 'sideways_time_stop': 61, 'sideways_use_sma': True, 'sideways_use_ema': True, 'sideways_use_atr': False, 'sideways_use_adx': True, 'sideways_use_spike': True, 'sideways_rsi_required': False}.
[I 2025-08-31 03:05:58,644] Trial 19 finished with values: [-0.04643976286698148, 0.046431546556123415] and parameters: {'p_sma': 18, 'p_std': 11, 'p_atr': 15, 'p_adx': 30, 'rsi_period': 68, 'ema1': 14, 'ema2': 20, 'slip_atr_k': 0.04945482813039838, 'slip_spread_k': 0.44115819204476925, 'spread_hl_frac': 0.03994099085332427, 'bb_std_mult': 0.5620133051982461, 'rsi_os': 34, 'rsi_ob': 95, 'vol_spike': 0.19736878936617408, 'adx_thresh': 23.509081601357494, 'atr_min_pct': 0.02364926570662203, 'atr_max_pct': 0.1038366826386207, 'tp_mult': 2.9445971729411373, 'tsl_mult': 0.2374198745390283, 'strategy': 'breakout', 'time_stop': 7, 'use_sma': False, 'use_atr': False, 'use_adx': True, 'use_ema': False, 'use_spike': False, 'rsi_required': False, 'edge_k': 0.262863664086314, 'edge_cap': 0.05822645247652808, 'bull_strategy': 'breakout', 'bull_bb_std_mult': 1.235483304263988, 'bull_rsi_os': 21, 'bull_rsi_ob': 74, 'bull_adx_thresh': 5.353452997370972, 'bull_atr_min_pct': 8.797788060234228e-05, 'bull_atr_max_pct': 0.12210406869819922, 'bull_tp_mult': 1.6195648806666403, 'bull_tsl_mult': 0.9643979913634112, 'bull_time_stop': 114, 'bull_use_sma': False, 'bull_use_ema': False, 'bull_use_atr': True, 'bull_use_adx': False, 'bull_use_spike': False, 'bull_rsi_required': True, 'bear_strategy': 'mean_reversion', 'bear_bb_std_mult': 0.5360827554777787, 'bear_rsi_os': 12, 'bear_rsi_ob': 86, 'bear_adx_thresh': 19.164613272396636, 'bear_atr_min_pct': 0.019701382331252182, 'bear_atr_max_pct': 0.04447085893917904, 'bear_tp_mult': 1.0101217463181382, 'bear_tsl_mult': 0.6480534988645336, 'bear_time_stop': 243, 'bear_use_sma': False, 'bear_use_ema': False, 'bear_use_atr': False, 'bear_use_adx': False, 'bear_use_spike': True, 'bear_rsi_required': False, 'sideways_strategy': 'breakout', 'sideways_bb_std_mult': 2.7781752546655056, 'sideways_rsi_os': 41, 'sideways_rsi_ob': 92, 'sideways_adx_thresh': 20.1934197721039, 'sideways_atr_min_pct': 0.0018453728808522883, 'sideways_atr_max_pct': 0.09474203431028133, 'sideways_tp_mult': 2.8797115188613973, 'sideways_tsl_mult': 0.7457114174764438, 'sideways_time_stop': 188, 'sideways_use_sma': True, 'sideways_use_ema': True, 'sideways_use_atr': False, 'sideways_use_adx': True, 'sideways_use_spike': True, 'sideways_rsi_required': False}.
[I 2025-08-31 03:05:58,743] Trial 21 finished with values: [-1000000000.0, 1000000000.0] and parameters: {'p_sma': 5, 'p_std': 14, 'p_atr': 16, 'p_adx': 15, 'rsi_period': 69, 'ema1': 15, 'ema2': 37, 'slip_atr_k': 0.05193265138997111, 'slip_spread_k': 0.4698058050565369, 'spread_hl_frac': 0.01701414621179051, 'bb_std_mult': 0.9441597565215849, 'rsi_os': 34, 'rsi_ob': 88, 'vol_spike': 0.22183938244855558, 'adx_thresh': 18.408711315798183, 'atr_min_pct': 0.021649572138947883, 'atr_max_pct': 0.11729724730692126, 'tp_mult': 1.9188206099583718, 'tsl_mult': 0.264346196748292, 'strategy': 'mean_reversion', 'time_stop': 154, 'use_sma': False, 'use_atr': False, 'use_adx': True, 'use_ema': True, 'use_spike': False, 'rsi_required': False, 'edge_k': 0.7702725965841938, 'edge_cap': 0.06165521433629855, 'bull_strategy': 'breakout', 'bull_bb_std_mult': 1.3009883653803134, 'bull_rsi_os': 18, 'bull_rsi_ob': 70, 'bull_adx_thresh': 15.79585999108677, 'bull_atr_min_pct': 0.017391837255729032, 'bull_atr_max_pct': 0.11453360985146596, 'bull_tp_mult': 1.9171802424774969, 'bull_tsl_mult': 0.9838316864498678, 'bull_time_stop': 182, 'bull_use_sma': False, 'bull_use_ema': False, 'bull_use_atr': True, 'bull_use_adx': False, 'bull_use_spike': False, 'bull_rsi_required': True, 'bear_strategy': 'mean_reversion', 'bear_bb_std_mult': 1.8296286168940943, 'bear_rsi_os': 16, 'bear_rsi_ob': 73, 'bear_adx_thresh': 19.062824665730346, 'bear_atr_min_pct': 0.01107337533460902, 'bear_atr_max_pct': 0.012539545331806415, 'bear_tp_mult': 2.242059867290622, 'bear_tsl_mult': 0.6623762932704965, 'bear_time_stop': 113, 'bear_use_sma': False, 'bear_use_ema': True, 'bear_use_atr': False, 'bear_use_adx': False, 'bear_use_spike': True, 'bear_rsi_required': False, 'sideways_strategy': 'breakout', 'sideways_bb_std_mult': 1.3550303267407067, 'sideways_rsi_os': 20, 'sideways_rsi_ob': 72, 'sideways_adx_thresh': 16.56873467038055, 'sideways_atr_min_pct': 0.008037186167059944, 'sideways_atr_max_pct': 0.09118334697737743, 'sideways_tp_mult': 2.6752629249488407, 'sideways_tsl_mult': 0.8366849338688012, 'sideways_time_stop': 55, 'sideways_use_sma': True, 'sideways_use_ema': True, 'sideways_use_atr': False, 'sideways_use_adx': True, 'sideways_use_spike': True, 'sideways_rsi_required': False}.
[I 2025-08-31 03:06:30,909] Trial 22 finished with values: [-1000000000.0, 1000000000.0] and parameters: {'p_sma': 15, 'p_std': 17, 'p_atr': 17, 'p_adx': 15, 'rsi_period': 70, 'ema1': 14, 'ema2': 39, 'slip_atr_k': 0.04734808314087032, 'slip_spread_k': 0.4989451940985446, 'spread_hl_frac': 0.017453926293144323, 'bb_std_mult': 1.0748597060833234, 'rsi_os': 33, 'rsi_ob': 84, 'vol_spike': 0.22538916412509796, 'adx_thresh': 19.737300909147123, 'atr_min_pct': 0.024798199368655446, 'atr_max_pct': 0.11935712445663953, 'tp_mult': 1.9909746457476456, 'tsl_mult': 0.005078204244041817, 'strategy': 'mean_reversion', 'time_stop': 149, 'use_sma': False, 'use_atr': False, 'use_adx': True, 'use_ema': True, 'use_spike': False, 'rsi_required': False, 'edge_k': 0.80376277912249, 'edge_cap': 0.960439237487315, 'bull_strategy': 'breakout', 'bull_bb_std_mult': 1.3249112706519823, 'bull_rsi_os': 16, 'bull_rsi_ob': 69, 'bull_adx_thresh': 16.02548127024183, 'bull_atr_min_pct': 0.017808879208914677, 'bull_atr_max_pct': 0.1071816251534783, 'bull_tp_mult': 1.9328780443403026, 'bull_tsl_mult': 0.9552234887961106, 'bull_time_stop': 196, 'bull_use_sma': False, 'bull_use_ema': False, 'bull_use_atr': True, 'bull_use_adx': False, 'bull_use_spike': False, 'bull_rsi_required': True, 'bear_strategy': 'mean_reversion', 'bear_bb_std_mult': 1.9437635398881428, 'bear_rsi_os': 14, 'bear_rsi_ob': 74, 'bear_adx_thresh': 18.55913768104038, 'bear_atr_min_pct': 0.011793053629370224, 'bear_atr_max_pct': 0.011661200218034296, 'bear_tp_mult': 2.273935707681782, 'bear_tsl_mult': 0.8393901810129609, 'bear_time_stop': 128, 'bear_use_sma': False, 'bear_use_ema': True, 'bear_use_atr': False, 'bear_use_adx': False, 'bear_use_spike': True, 'bear_rsi_required': False, 'sideways_strategy': 'breakout', 'sideways_bb_std_mult': 1.3383614620792765, 'sideways_rsi_os': 19, 'sideways_rsi_ob': 95, 'sideways_adx_thresh': 14.946494890177082, 'sideways_atr_min_pct': 0.008663817026746302, 'sideways_atr_max_pct': 0.08666307866837225, 'sideways_tp_mult': 2.5692898153862536, 'sideways_tsl_mult': 0.8498550203869618, 'sideways_time_stop': 48, 'sideways_use_sma': True, 'sideways_use_ema': True, 'sideways_use_atr': False, 'sideways_use_adx': True, 'sideways_use_spike': True, 'sideways_rsi_required': False}.
[I 2025-08-31 03:06:31,347] Trial 23 finished with values: [-1000000000.0, 1000000000.0] and parameters: {'p_sma': 15, 'p_std': 19, 'p_atr': 17, 'p_adx': 15, 'rsi_period': 84, 'ema1': 20, 'ema2': 38, 'slip_atr_k': 0.052575246176960855, 'slip_spread_k': 0.47371403414857854, 'spread_hl_frac': 0.02094828759638204, 'bb_std_mult': 0.8616887786651148, 'rsi_os': 47, 'rsi_ob': 85, 'vol_spike': 0.14089953796883434, 'adx_thresh': 17.96244014249636, 'atr_min_pct': 0.026049575415416384, 'atr_max_pct': 0.0664719773721185, 'tp_mult': 1.911841284583047, 'tsl_mult': 0.7927735373892327, 'strategy': 'mean_reversion', 'time_stop': 179, 'use_sma': False, 'use_atr': False, 'use_adx': True, 'use_ema': True, 'use_spike': False, 'rsi_required': False, 'edge_k': 1.969890104587373, 'edge_cap': 0.9935754035336712, 'bull_strategy': 'breakout', 'bull_bb_std_mult': 1.3923400571467601, 'bull_rsi_os': 31, 'bull_rsi_ob': 69, 'bull_adx_thresh': 15.550477685774434, 'bull_atr_min_pct': 0.017104135504516893, 'bull_atr_max_pct': 0.10210379995853233, 'bull_tp_mult': 1.4130659985485448, 'bull_tsl_mult': 0.3858823289511084, 'bull_time_stop': 199, 'bull_use_sma': False, 'bull_use_ema': False, 'bull_use_atr': True, 'bull_use_adx': False, 'bull_use_spike': False, 'bull_rsi_required': True, 'bear_strategy': 'mean_reversion', 'bear_bb_std_mult': 1.0534898684878147, 'bear_rsi_os': 12, 'bear_rsi_ob': 87, 'bear_adx_thresh': 10.153034120584824, 'bear_atr_min_pct': 0.011687685892745305, 'bear_atr_max_pct': 0.029515239426934296, 'bear_tp_mult': 2.2638480328615818, 'bear_tsl_mult': 0.8206548632918504, 'bear_time_stop': 117, 'bear_use_sma': False, 'bear_use_ema': True, 'bear_use_atr': False, 'bear_use_adx': False, 'bear_use_spike': True, 'bear_rsi_required': False, 'sideways_strategy': 'breakout', 'sideways_bb_std_mult': 2.109713749875739, 'sideways_rsi_os': 18, 'sideways_rsi_ob': 73, 'sideways_adx_thresh': 18.550358182847766, 'sideways_atr_min_pct': 0.008133397671244328, 'sideways_atr_max_pct': 0.06737967114839061, 'sideways_tp_mult': 2.6227246752568507, 'sideways_tsl_mult': 0.877141001595361, 'sideways_time_stop': 166, 'sideways_use_sma': True, 'sideways_use_ema': True, 'sideways_use_atr': False, 'sideways_use_adx': True, 'sideways_use_spike': True, 'sideways_rsi_required': False}.
[I 2025-08-31 03:06:32,305] Trial 25 finished with values: [-1000000000.0, 1000000000.0] and parameters: {'p_sma': 10, 'p_std': 47, 'p_atr': 12, 'p_adx': 16, 'rsi_period': 80, 'ema1': 20, 'ema2': 15, 'slip_atr_k': 0.030258951313656468, 'slip_spread_k': 0.6107574041308977, 'spread_hl_frac': 0.044745522010186514, 'bb_std_mult': 1.672055875703333, 'rsi_os': 49, 'rsi_ob': 83, 'vol_spike': 0.16003594365882978, 'adx_thresh': 26.603629173982835, 'atr_min_pct': 0.01929845624764822, 'atr_max_pct': 0.06769477049979114, 'tp_mult': 2.739444789049325, 'tsl_mult': 0.7892566582313936, 'strategy': 'breakout', 'time_stop': 195, 'use_sma': False, 'use_atr': False, 'use_adx': True, 'use_ema': False, 'use_spike': False, 'rsi_required': False, 'edge_k': 1.3736854646203813, 'edge_cap': 0.971722654277839, 'bull_strategy': 'breakout', 'bull_bb_std_mult': 2.0539299229250525, 'bull_rsi_os': 30, 'bull_rsi_ob': 56, 'bull_adx_thresh': 20.006353290307626, 'bull_atr_min_pct': 0.0042085376934155126, 'bull_atr_max_pct': 0.12762700594559492, 'bull_tp_mult': 1.450494436687772, 'bull_tsl_mult': 0.8801123411207895, 'bull_time_stop': 88, 'bull_use_sma': False, 'bull_use_ema': False, 'bull_use_atr': True, 'bull_use_adx': False, 'bull_use_spike': False, 'bull_rsi_required': True, 'bear_strategy': 'mean_reversion', 'bear_bb_std_mult': 1.1059891485893274, 'bear_rsi_os': 31, 'bear_rsi_ob': 76, 'bear_adx_thresh': 10.328881369901511, 'bear_atr_min_pct': 0.004963340453103824, 'bear_atr_max_pct': 0.03147319471014875, 'bear_tp_mult': 1.4832503273469824, 'bear_tsl_mult': 0.8069390535268, 'bear_time_stop': 139, 'bear_use_sma': False, 'bear_use_ema': False, 'bear_use_atr': False, 'bear_use_adx': False, 'bear_use_spike': True, 'bear_rsi_required': False, 'sideways_strategy': 'breakout', 'sideways_bb_std_mult': 2.1228103747159883, 'sideways_rsi_os': 36, 'sideways_rsi_ob': 54, 'sideways_adx_thresh': 11.254343231908603, 'sideways_atr_min_pct': 0.009151440078614077, 'sideways_atr_max_pct': 0.062286515719215174, 'sideways_tp_mult': 2.686129543687804, 'sideways_tsl_mult': 0.593199331088306, 'sideways_time_stop': 33, 'sideways_use_sma': True, 'sideways_use_ema': True, 'sideways_use_atr': False, 'sideways_use_adx': True, 'sideways_use_spike': True, 'sideways_rsi_required': False}.
[I 2025-08-31 03:06:32,319] Trial 24 finished with values: [-1000000000.0, 1000000000.0] and parameters: {'p_sma': 10, 'p_std': 19, 'p_atr': 18, 'p_adx': 16, 'rsi_period': 66, 'ema1': 20, 'ema2': 37, 'slip_atr_k': 0.04667003164785291, 'slip_spread_k': 0.4806259353676793, 'spread_hl_frac': 0.04405294966808638, 'bb_std_mult': 1.6722997260856778, 'rsi_os': 47, 'rsi_ob': 89, 'vol_spike': 0.16245074569498683, 'adx_thresh': 26.997512235485022, 'atr_min_pct': 0.020020705135828168, 'atr_max_pct': 0.1261499568805334, 'tp_mult': 2.74174224426134, 'tsl_mult': 0.7836620683903186, 'strategy': 'mean_reversion', 'time_stop': 173, 'use_sma': False, 'use_atr': False, 'use_adx': True, 'use_ema': True, 'use_spike': False, 'rsi_required': False, 'edge_k': 1.872654918307381, 'edge_cap': 0.7104101388694393, 'bull_strategy': 'breakout', 'bull_bb_std_mult': 2.0253558751628256, 'bull_rsi_os': 30, 'bull_rsi_ob': 56, 'bull_adx_thresh': 16.89539439763871, 'bull_atr_min_pct': 0.018257940485180337, 'bull_atr_max_pct': 0.11609753164010386, 'bull_tp_mult': 1.9267796147951415, 'bull_tsl_mult': 0.9882115331002896, 'bull_time_stop': 187, 'bull_use_sma': False, 'bull_use_ema': False, 'bull_use_atr': True, 'bull_use_adx': False, 'bull_use_spike': False, 'bull_rsi_required': True, 'bear_strategy': 'mean_reversion', 'bear_bb_std_mult': 1.1299807141139593, 'bear_rsi_os': 33, 'bear_rsi_ob': 75, 'bear_adx_thresh': 10.134104907885499, 'bear_atr_min_pct': 0.004365226210765795, 'bear_atr_max_pct': 0.02669702919405771, 'bear_tp_mult': 1.4871413775496314, 'bear_tsl_mult': 0.8153443798101957, 'bear_time_stop': 118, 'bear_use_sma': False, 'bear_use_ema': True, 'bear_use_atr': False, 'bear_use_adx': False, 'bear_use_spike': True, 'bear_rsi_required': False, 'sideways_strategy': 'breakout', 'sideways_bb_std_mult': 2.113701526422338, 'sideways_rsi_os': 17, 'sideways_rsi_ob': 54, 'sideways_adx_thresh': 16.020466804263503, 'sideways_atr_min_pct': 0.008026137023514578, 'sideways_atr_max_pct': 0.06568553052360748, 'sideways_tp_mult': 2.617846029088434, 'sideways_tsl_mult': 0.8643868874837782, 'sideways_time_stop': 44, 'sideways_use_sma': True, 'sideways_use_ema': True, 'sideways_use_atr': False, 'sideways_use_adx': True, 'sideways_use_spike': True, 'sideways_rsi_required': False}.
[I 2025-08-31 03:07:03,271] Trial 26 finished with values: [-1000000000.0, 1000000000.0] and parameters: {'p_sma': 11, 'p_std': 6, 'p_atr': 12, 'p_adx': 16, 'rsi_period': 81, 'ema1': 20, 'ema2': 26, 'slip_atr_k': 0.0002720755393700938, 'slip_spread_k': 0.629448103429856, 'spread_hl_frac': 0.04486867046474966, 'bb_std_mult': 1.670094479242997, 'rsi_os': 48, 'rsi_ob': 90, 'vol_spike': 0.15899890727053423, 'adx_thresh': 26.434684871222476, 'atr_min_pct': 0.019858074542749248, 'atr_max_pct': 0.06052959107462675, 'tp_mult': 2.7481708489360694, 'tsl_mult': 0.7745462118616524, 'strategy': 'breakout', 'time_stop': 186, 'use_sma': False, 'use_atr': True, 'use_adx': True, 'use_ema': False, 'use_spike': False, 'rsi_required': False, 'edge_k': 1.9181015527075602, 'edge_cap': 0.21189500739424366, 'bull_strategy': 'breakout', 'bull_bb_std_mult': 2.091057244765488, 'bull_rsi_os': 30, 'bull_rsi_ob': 56, 'bull_adx_thresh': 19.770431004251428, 'bull_atr_min_pct': 0.0032313185903693545, 'bull_atr_max_pct': 0.13184159452977787, 'bull_tp_mult': 1.4445459832259653, 'bull_tsl_mult': 0.8724569628307546, 'bull_time_stop': 93, 'bull_use_sma': False, 'bull_use_ema': False, 'bull_use_atr': True, 'bull_use_adx': False, 'bull_use_spike': False, 'bull_rsi_required': True, 'bear_strategy': 'mean_reversion', 'bear_bb_std_mult': 1.0782849858414858, 'bear_rsi_os': 30, 'bear_rsi_ob': 88, 'bear_adx_thresh': 10.452338903619017, 'bear_atr_min_pct': 0.00430524853180933, 'bear_atr_max_pct': 0.032769643584699845, 'bear_tp_mult': 1.4817844448858728, 'bear_tsl_mult': 0.8195403583354298, 'bear_time_stop': 161, 'bear_use_sma': False, 'bear_use_ema': False, 'bear_use_atr': False, 'bear_use_adx': False, 'bear_use_spike': True, 'bear_rsi_required': False, 'sideways_strategy': 'mean_reversion', 'sideways_bb_std_mult': 2.1407546226080663, 'sideways_rsi_os': 36, 'sideways_rsi_ob': 54, 'sideways_adx_thresh': 11.443640727497474, 'sideways_atr_min_pct': 0.0032429242638841033, 'sideways_atr_max_pct': 0.07045037273330447, 'sideways_tp_mult': 2.7183052445491955, 'sideways_tsl_mult': 0.5516805358874771, 'sideways_time_stop': 99, 'sideways_use_sma': True, 'sideways_use_ema': True, 'sideways_use_atr': False, 'sideways_use_adx': True, 'sideways_use_spike': False, 'sideways_rsi_required': True}.
