[I 2025-08-31 03:26:35,325] Trial 172 finished with values: [-1000000000.0, 1000000000.0] and parameters: {'p_sma': 12, 'p_std': 19, 'p_atr': 27, 'p_adx': 22, 'rsi_period': 72, 'ema1': 18, 'ema2': 21, 'slip_atr_k': 0.02562831026569746, 'slip_spread_k': 0.2869409844748918, 'spread_hl_frac': 0.0012841047944621023, 'bb_std_mult': 3.157954285595726, 'rsi_os': 17, 'rsi_ob': 59, 'vol_spike': 0.11638471952529869, 'adx_thresh': 25.690977263277105, 'atr_min_pct': 0.018159100458190844, 'atr_max_pct': 0.13027252110800097, 'tp_mult': 1.5028624132506079, 'tsl_mult': 0.17057033046873732, 'strategy': 'mean_reversion', 'time_stop': 186, 'use_sma': True, 'use_atr': True, 'use_adx': True, 'use_ema': True, 'use_spike': False, 'rsi_required': True, 'edge_k': 1.9029576197447058, 'edge_cap': 0.3723774210803452, 'bull_strategy': 'breakout', 'bull_bb_std_mult': 1.427235377696602, 'bull_rsi_os': 6, 'bull_rsi_ob': 52, 'bull_adx_thresh': 8.541638225414943, 'bull_atr_min_pct': 9.334752507561203e-07, 'bull_atr_max_pct': 0.035694252784789327, 'bull_tp_mult': 1.5765398540896711, 'bull_tsl_mult': 0.4127286337351704, 'bull_time_stop': 135, 'bull_use_sma': True, 'bull_use_ema': True, 'bull_use_atr': False, 'bull_use_adx': False, 'bull_use_spike': False, 'bull_rsi_required': True, 'bear_strategy': 'mean_reversion', 'bear_bb_std_mult': 2.5083172485101946, 'bear_rsi_os': 21, 'bear_rsi_ob': 61, 'bear_adx_thresh': 16.196392133676177, 'bear_atr_min_pct': 0.008803354064981235, 'bear_atr_max_pct': 0.12475308304136233, 'bear_tp_mult': 2.943922243916273, 'bear_tsl_mult': 0.15382544544294896, 'bear_time_stop': 247, 'bear_use_sma': False, 'bear_use_ema': False, 'bear_use_atr': True, 'bear_use_adx': False, 'bear_use_spike': False, 'bear_rsi_required': True, 'sideways_strategy': 'mean_reversion', 'sideways_bb_std_mult': 2.3420023735030537, 'sideways_rsi_os': 42, 'sideways_rsi_ob': 79, 'sideways_adx_thresh': 5.945042539172845, 'sideways_atr_min_pct': 0.005038754113205334, 'sideways_atr_max_pct': 0.10433178500159873, 'sideways_tp_mult': 1.9075054425781734, 'sideways_tsl_mult': 0.44739217728518305, 'sideways_time_stop': 300, 'sideways_use_sma': True, 'sideways_use_ema': True, 'sideways_use_atr': True, 'sideways_use_adx': True, 'sideways_use_spike': True, 'sideways_rsi_required': True}.
[I 2025-08-31 03:26:35,547] Trial 171 finished with values: [-1000000000.0, 1000000000.0] and parameters: {'p_sma': 43, 'p_std': 56, 'p_atr': 21, 'p_adx': 14, 'rsi_period': 13, 'ema1': 18, 'ema2': 21, 'slip_atr_k': 0.025355619779675154, 'slip_spread_k': 0.27746882300968556, 'spread_hl_frac': 0.0012065416131306797, 'bb_std_mult': 2.0761616089584516, 'rsi_os': 17, 'rsi_ob': 60, 'vol_spike': 0.0884364429914232, 'adx_thresh': 25.569202474723387, 'atr_min_pct': 0.023827713517458937, 'atr_max_pct': 0.13020607677544688, 'tp_mult': 1.50592507408584, 'tsl_mult': 0.5658244594829355, 'strategy': 'mean_reversion', 'time_stop': 5, 'use_sma': True, 'use_atr': True, 'use_adx': True, 'use_ema': True, 'use_spike': False, 'rsi_required': True, 'edge_k': 1.9046547345121185, 'edge_cap': 0.6404974883711758, 'bull_strategy': 'breakout', 'bull_bb_std_mult': 1.0672703731541477, 'bull_rsi_os': 18, 'bull_rsi_ob': 52, 'bull_adx_thresh': 19.485448126367267, 'bull_atr_min_pct': 0.0019270149403444615, 'bull_atr_max_pct': 0.03440112354194932, 'bull_tp_mult': 1.5867003615095843, 'bull_tsl_mult': 0.2377984342786077, 'bull_time_stop': 178, 'bull_use_sma': True, 'bull_use_ema': True, 'bull_use_atr': False, 'bull_use_adx': False, 'bull_use_spike': False, 'bull_rsi_required': True, 'bear_strategy': 'mean_reversion', 'bear_bb_std_mult': 3.3689317606318987, 'bear_rsi_os': 48, 'bear_rsi_ob': 61, 'bear_adx_thresh': 16.37200269069693, 'bear_atr_min_pct': 0.006357005354409239, 'bear_atr_max_pct': 0.13239869556702466, 'bear_tp_mult': 2.247417736289605, 'bear_tsl_mult': 0.9516642302107408, 'bear_time_stop': 247, 'bear_use_sma': False, 'bear_use_ema': False, 'bear_use_atr': True, 'bear_use_adx': False, 'bear_use_spike': False, 'bear_rsi_required': True, 'sideways_strategy': 'mean_reversion', 'sideways_bb_std_mult': 2.3584398674096563, 'sideways_rsi_os': 42, 'sideways_rsi_ob': 79, 'sideways_adx_thresh': 16.49552990940228, 'sideways_atr_min_pct': 0.027614281123919296, 'sideways_atr_max_pct': 0.10332746233712874, 'sideways_tp_mult': 1.453696440950356, 'sideways_tsl_mult': 0.467345590853975, 'sideways_time_stop': 23, 'sideways_use_sma': True, 'sideways_use_ema': True, 'sideways_use_atr': True, 'sideways_use_adx': True, 'sideways_use_spike': True, 'sideways_rsi_required': True}.
[I 2025-08-31 03:26:35,784] Trial 173 finished with values: [-1000000000.0, 1000000000.0] and parameters: {'p_sma': 6, 'p_std': 56, 'p_atr': 22, 'p_adx': 22, 'rsi_period': 36, 'ema1': 18, 'ema2': 56, 'slip_atr_k': 0.027023816543755082, 'slip_spread_k': 0.6889443616799251, 'spread_hl_frac': 0.0014586198685800568, 'bb_std_mult': 1.9244405662026405, 'rsi_os': 16, 'rsi_ob': 59, 'vol_spike': 0.08945682171245986, 'adx_thresh': 26.50549943555717, 'atr_min_pct': 0.023933198733239288, 'atr_max_pct': 0.1321750138220533, 'tp_mult': 2.5284282944917735, 'tsl_mult': 0.08030891144673036, 'strategy': 'mean_reversion', 'time_stop': 21, 'use_sma': True, 'use_atr': True, 'use_adx': True, 'use_ema': True, 'use_spike': False, 'rsi_required': True, 'edge_k': 0.6659399741784175, 'edge_cap': 0.3769115391301846, 'bull_strategy': 'breakout', 'bull_bb_std_mult': 1.4005752388391126, 'bull_rsi_os': 12, 'bull_rsi_ob': 52, 'bull_adx_thresh': 8.475231649556436, 'bull_atr_min_pct': 9.908299346297097e-05, 'bull_atr_max_pct': 0.0346304770267333, 'bull_tp_mult': 1.5746650595455227, 'bull_tsl_mult': 0.32715242572025643, 'bull_time_stop': 62, 'bull_use_sma': True, 'bull_use_ema': True, 'bull_use_atr': False, 'bull_use_adx': False, 'bull_use_spike': False, 'bull_rsi_required': True, 'bear_strategy': 'mean_reversion', 'bear_bb_std_mult': 2.4996357750906726, 'bear_rsi_os': 21, 'bear_rsi_ob': 54, 'bear_adx_thresh': 16.533149139655507, 'bear_atr_min_pct': 0.008844998447338671, 'bear_atr_max_pct': 0.12418840262313577, 'bear_tp_mult': 2.4281962494947833, 'bear_tsl_mult': 0.15365783310113346, 'bear_time_stop': 246, 'bear_use_sma': False, 'bear_use_ema': False, 'bear_use_atr': True, 'bear_use_adx': False, 'bear_use_spike': False, 'bear_rsi_required': True, 'sideways_strategy': 'mean_reversion', 'sideways_bb_std_mult': 2.9172742012426807, 'sideways_rsi_os': 36, 'sideways_rsi_ob': 79, 'sideways_adx_thresh': 6.906699611071903, 'sideways_atr_min_pct': 0.003445379943130997, 'sideways_atr_max_pct': 0.10282105714669235, 'sideways_tp_mult': 1.900073597980485, 'sideways_tsl_mult': 0.44737079508903055, 'sideways_time_stop': 23, 'sideways_use_sma': True, 'sideways_use_ema': True, 'sideways_use_atr': True, 'sideways_use_adx': True, 'sideways_use_spike': True, 'sideways_rsi_required': True}.
[I 2025-08-31 03:26:36,002] Trial 174 finished with values: [-1000000000.0, 1000000000.0] and parameters: {'p_sma': 48, 'p_std': 44, 'p_atr': 21, 'p_adx': 18, 'rsi_period': 36, 'ema1': 15, 'ema2': 21, 'slip_atr_k': 0.1260637341784569, 'slip_spread_k': 0.28959333626712713, 'spread_hl_frac': 0.003130276300013706, 'bb_std_mult': 2.070881417656933, 'rsi_os': 16, 'rsi_ob': 47, 'vol_spike': 0.1146384721592126, 'adx_thresh': 31.986617347996287, 'atr_min_pct': 0.018128865164596865, 'atr_max_pct': 0.14176354147536852, 'tp_mult': 1.5421417422003434, 'tsl_mult': 0.5606987846661613, 'strategy': 'breakout', 'time_stop': 53, 'use_sma': True, 'use_atr': True, 'use_adx': True, 'use_ema': False, 'use_spike': False, 'rsi_required': True, 'edge_k': 1.4519047246946775, 'edge_cap': 0.1727435560197102, 'bull_strategy': 'breakout', 'bull_bb_std_mult': 1.0368323241275856, 'bull_rsi_os': 6, 'bull_rsi_ob': 75, 'bull_adx_thresh': 19.494900790404483, 'bull_atr_min_pct': 0.0018171888988930624, 'bull_atr_max_pct': 0.03584714203560843, 'bull_tp_mult': 1.5867779824573724, 'bull_tsl_mult': 0.3276192442186002, 'bull_time_stop': 214, 'bull_use_sma': True, 'bull_use_ema': True, 'bull_use_atr': False, 'bull_use_adx': False, 'bull_use_spike': False, 'bull_rsi_required': True, 'bear_strategy': 'mean_reversion', 'bear_bb_std_mult': 2.685504181780326, 'bear_rsi_os': 23, 'bear_rsi_ob': 82, 'bear_adx_thresh': 16.43679471975158, 'bear_atr_min_pct': 0.008664555434640309, 'bear_atr_max_pct': 0.13411421371074736, 'bear_tp_mult': 2.949790403583557, 'bear_tsl_mult': 0.3625260340534251, 'bear_time_stop': 239, 'bear_use_sma': False, 'bear_use_ema': False, 'bear_use_atr': False, 'bear_use_adx': False, 'bear_use_spike': False, 'bear_rsi_required': True, 'sideways_strategy': 'breakout', 'sideways_bb_std_mult': 1.6733835189102682, 'sideways_rsi_os': 37, 'sideways_rsi_ob': 79, 'sideways_adx_thresh': 16.6257648309649, 'sideways_atr_min_pct': 0.02829886329834095, 'sideways_atr_max_pct': 0.10312669842079236, 'sideways_tp_mult': 2.7959450642370047, 'sideways_tsl_mult': 0.33082629670059743, 'sideways_time_stop': 22, 'sideways_use_sma': True, 'sideways_use_ema': True, 'sideways_use_atr': False, 'sideways_use_adx': True, 'sideways_use_spike': True, 'sideways_rsi_required': True}.
[I 2025-08-31 03:27:10,609] Trial 178 finished with values: [-1000000000.0, 1000000000.0] and parameters: {'p_sma': 10, 'p_std': 26, 'p_atr': 12, 'p_adx': 14, 'rsi_period': 77, 'ema1': 28, 'ema2': 31, 'slip_atr_k': 0.015762814144792164, 'slip_spread_k': 0.9708441960184944, 'spread_hl_frac': 0.0105134771390037, 'bb_std_mult': 2.9022953994089358, 'rsi_os': 13, 'rsi_ob': 63, 'vol_spike': 0.1368155317034332, 'adx_thresh': 8.547800606482145, 'atr_min_pct': 0.023134047745631003, 'atr_max_pct': 0.1377786575909417, 'tp_mult': 1.776931214943417, 'tsl_mult': 0.5069157490479261, 'strategy': 'breakout', 'time_stop': 34, 'use_sma': True, 'use_atr': True, 'use_adx': True, 'use_ema': False, 'use_spike': False, 'rsi_required': True, 'edge_k': 0.44450860664858655, 'edge_cap': 0.2082416466257486, 'bull_strategy': 'breakout', 'bull_bb_std_mult': 1.509837898804805, 'bull_rsi_os': 16, 'bull_rsi_ob': 47, 'bull_adx_thresh': 21.21418929312639, 'bull_atr_min_pct': 0.02735883062063807, 'bull_atr_max_pct': 0.09055906031590467, 'bull_tp_mult': 2.461729677265147, 'bull_tsl_mult': 0.6706830506513565, 'bull_time_stop': 145, 'bull_use_sma': False, 'bull_use_ema': False, 'bull_use_atr': True, 'bull_use_adx': False, 'bull_use_spike': False, 'bull_rsi_required': True, 'bear_strategy': 'breakout', 'bear_bb_std_mult': 2.101037957671535, 'bear_rsi_os': 38, 'bear_rsi_ob': 80, 'bear_adx_thresh': 18.426757039229397, 'bear_atr_min_pct': 0.024647543652125563, 'bear_atr_max_pct': 0.09020340362043561, 'bear_tp_mult': 1.1513526319877077, 'bear_tsl_mult': 0.7057006198510589, 'bear_time_stop': 261, 'bear_use_sma': True, 'bear_use_ema': False, 'bear_use_atr': False, 'bear_use_adx': False, 'bear_use_spike': True, 'bear_rsi_required': True, 'sideways_strategy': 'breakout', 'sideways_bb_std_mult': 1.5444413066302747, 'sideways_rsi_os': 39, 'sideways_rsi_ob': 82, 'sideways_adx_thresh': 27.157935529733994, 'sideways_atr_min_pct': 0.02268688048464866, 'sideways_atr_max_pct': 0.11251627883708405, 'sideways_tp_mult': 1.78359593616698, 'sideways_tsl_mult': 0.410785113160807, 'sideways_time_stop': 98, 'sideways_use_sma': False, 'sideways_use_ema': True, 'sideways_use_atr': False, 'sideways_use_adx': True, 'sideways_use_spike': False, 'sideways_rsi_required': False}.
[I 2025-08-31 03:27:10,810] Trial 176 finished with values: [-1000000000.0, 1000000000.0] and parameters: {'p_sma': 14, 'p_std': 44, 'p_atr': 12, 'p_adx': 28, 'rsi_period': 84, 'ema1': 30, 'ema2': 16, 'slip_atr_k': 0.10137493629717419, 'slip_spread_k': 0.20910948828417528, 'spread_hl_frac': 0.003308005072739649, 'bb_std_mult': 1.9267482507360416, 'rsi_os': 14, 'rsi_ob': 76, 'vol_spike': 0.11223103489814806, 'adx_thresh': 31.591740842473968, 'atr_min_pct': 0.02403646691423903, 'atr_max_pct': 0.1420776276795413, 'tp_mult': 1.5542168497196835, 'tsl_mult': 0.510702383698621, 'strategy': 'breakout', 'time_stop': 50, 'use_sma': True, 'use_atr': True, 'use_adx': True, 'use_ema': False, 'use_spike': False, 'rsi_required': True, 'edge_k': 0.4422742206256979, 'edge_cap': 0.561976795295573, 'bull_strategy': 'breakout', 'bull_bb_std_mult': 1.3783209704262462, 'bull_rsi_os': 16, 'bull_rsi_ob': 75, 'bull_adx_thresh': 10.84835480703014, 'bull_atr_min_pct': 0.0012069294693243505, 'bull_atr_max_pct': 0.024910138639983155, 'bull_tp_mult': 2.8097459667629807, 'bull_tsl_mult': 0.328228294498401, 'bull_time_stop': 300, 'bull_use_sma': False, 'bull_use_ema': False, 'bull_use_atr': True, 'bull_use_adx': False, 'bull_use_spike': False, 'bull_rsi_required': True, 'bear_strategy': 'breakout', 'bear_bb_std_mult': 2.23246021107924, 'bear_rsi_os': 39, 'bear_rsi_ob': 82, 'bear_adx_thresh': 18.53786644536882, 'bear_atr_min_pct': 0.024349698856260846, 'bear_atr_max_pct': 0.08982483940932001, 'bear_tp_mult': 1.167441212974563, 'bear_tsl_mult': 0.36606779861337535, 'bear_time_stop': 279, 'bear_use_sma': False, 'bear_use_ema': False, 'bear_use_atr': False, 'bear_use_adx': False, 'bear_use_spike': True, 'bear_rsi_required': True, 'sideways_strategy': 'breakout', 'sideways_bb_std_mult': 3.5046726464027937, 'sideways_rsi_os': 37, 'sideways_rsi_ob': 67, 'sideways_adx_thresh': 27.188210738725935, 'sideways_atr_min_pct': 0.002536755426823006, 'sideways_atr_max_pct': 0.1118433473604294, 'sideways_tp_mult': 1.8258058154509231, 'sideways_tsl_mult': 0.3243905421271142, 'sideways_time_stop': 269, 'sideways_use_sma': False, 'sideways_use_ema': True, 'sideways_use_atr': False, 'sideways_use_adx': True, 'sideways_use_spike': False, 'sideways_rsi_required': False}.
[I 2025-08-31 03:27:11,194] Trial 177 finished with values: [-1000000000.0, 1000000000.0] and parameters: {'p_sma': 11, 'p_std': 26, 'p_atr': 10, 'p_adx': 14, 'rsi_period': 77, 'ema1': 28, 'ema2': 11, 'slip_atr_k': 0.12061449311946901, 'slip_spread_k': 0.21155604640775272, 'spread_hl_frac': 0.010523688798271764, 'bb_std_mult': 1.927593324481937, 'rsi_os': 13, 'rsi_ob': 47, 'vol_spike': 0.13647757289893922, 'adx_thresh': 31.343193552911657, 'atr_min_pct': 0.023235492267630782, 'atr_max_pct': 0.1422371792129593, 'tp_mult': 1.993931836569228, 'tsl_mult': 0.5204575743957741, 'strategy': 'breakout', 'time_stop': 48, 'use_sma': True, 'use_atr': True, 'use_adx': True, 'use_ema': False, 'use_spike': False, 'rsi_required': True, 'edge_k': 0.3102230257323758, 'edge_cap': 0.17192103243148804, 'bull_strategy': 'breakout', 'bull_bb_std_mult': 3.4814210427828014, 'bull_rsi_os': 49, 'bull_rsi_ob': 49, 'bull_adx_thresh': 21.210157818511416, 'bull_atr_min_pct': 0.0012557597716951257, 'bull_atr_max_pct': 0.10455381508922261, 'bull_tp_mult': 2.8077739100971324, 'bull_tsl_mult': 0.65488127820125, 'bull_time_stop': 151, 'bull_use_sma': False, 'bull_use_ema': False, 'bull_use_atr': True, 'bull_use_adx': False, 'bull_use_spike': False, 'bull_rsi_required': True, 'bear_strategy': 'breakout', 'bear_bb_std_mult': 2.257844547406972, 'bear_rsi_os': 38, 'bear_rsi_ob': 82, 'bear_adx_thresh': 18.27970585890304, 'bear_atr_min_pct': 0.02485078299209531, 'bear_atr_max_pct': 0.08890708362848501, 'bear_tp_mult': 2.151901127906, 'bear_tsl_mult': 0.3765260600774788, 'bear_time_stop': 237, 'bear_use_sma': True, 'bear_use_ema': False, 'bear_use_atr': False, 'bear_use_adx': False, 'bear_use_spike': True, 'bear_rsi_required': True, 'sideways_strategy': 'breakout', 'sideways_bb_std_mult': 1.687567605027845, 'sideways_rsi_os': 39, 'sideways_rsi_ob': 82, 'sideways_adx_thresh': 28.999430089198412, 'sideways_atr_min_pct': 0.029048997250117843, 'sideways_atr_max_pct': 0.11287832962138775, 'sideways_tp_mult': 1.7926768886920095, 'sideways_tsl_mult': 0.3143173760234551, 'sideways_time_stop': 99, 'sideways_use_sma': False, 'sideways_use_ema': True, 'sideways_use_atr': False, 'sideways_use_adx': True, 'sideways_use_spike': False, 'sideways_rsi_required': False}.
[I 2025-08-31 03:27:11,511] Trial 175 finished with values: [-1000000000.0, 1000000000.0] and parameters: {'p_sma': 10, 'p_std': 41, 'p_atr': 21, 'p_adx': 14, 'rsi_period': 37, 'ema1': 15, 'ema2': 55, 'slip_atr_k': 0.018935661491164775, 'slip_spread_k': 0.7903152238105644, 'spread_hl_frac': 0.0035141838052217605, 'bb_std_mult': 1.9298146339483677, 'rsi_os': 16, 'rsi_ob': 63, 'vol_spike': 0.10468615025325831, 'adx_thresh': 31.476092809367202, 'atr_min_pct': 0.023672416640867083, 'atr_max_pct': 0.14208217316999666, 'tp_mult': 2.535806216784994, 'tsl_mult': 0.5153327022193712, 'strategy': 'breakout', 'time_stop': 34, 'use_sma': True, 'use_atr': True, 'use_adx': True, 'use_ema': False, 'use_spike': False, 'rsi_required': True, 'edge_k': 0.3146174682067994, 'edge_cap': 0.6460100411257428, 'bull_strategy': 'breakout', 'bull_bb_std_mult': 1.049032037474841, 'bull_rsi_os': 11, 'bull_rsi_ob': 75, 'bull_adx_thresh': 19.48637987387022, 'bull_atr_min_pct': 0.0018454126640638025, 'bull_atr_max_pct': 0.015458207751504093, 'bull_tp_mult': 1.448489479037723, 'bull_tsl_mult': 0.3284300459642023, 'bull_time_stop': 209, 'bull_use_sma': False, 'bull_use_ema': False, 'bull_use_atr': True, 'bull_use_adx': False, 'bull_use_spike': False, 'bull_rsi_required': True, 'bear_strategy': 'breakout', 'bear_bb_std_mult': 2.0815635931820444, 'bear_rsi_os': 49, 'bear_rsi_ob': 82, 'bear_adx_thresh': 16.471684696297675, 'bear_atr_min_pct': 0.02899074416754778, 'bear_atr_max_pct': 0.11774452408279948, 'bear_tp_mult': 2.1400570627475646, 'bear_tsl_mult': 0.9395226414709431, 'bear_time_stop': 238, 'bear_use_sma': False, 'bear_use_ema': False, 'bear_use_atr': False, 'bear_use_adx': False, 'bear_use_spike': True, 'bear_rsi_required': True, 'sideways_strategy': 'breakout', 'sideways_bb_std_mult': 1.7015010276315323, 'sideways_rsi_os': 37, 'sideways_rsi_ob': 81, 'sideways_adx_thresh': 27.681911781472614, 'sideways_atr_min_pct': 0.02933782763473798, 'sideways_atr_max_pct': 0.11268236146832752, 'sideways_tp_mult': 1.4366169869757641, 'sideways_tsl_mult': 0.32299699766355294, 'sideways_time_stop': 25, 'sideways_use_sma': False, 'sideways_use_ema': True, 'sideways_use_atr': False, 'sideways_use_adx': True, 'sideways_use_spike': True, 'sideways_rsi_required': False}.
[I 2025-08-31 03:27:51,792] Trial 181 finished with values: [-1000000000.0, 1000000000.0] and parameters: {'p_sma': 5, 'p_std': 49, 'p_atr': 25, 'p_adx': 13, 'rsi_period': 73, 'ema1': 16, 'ema2': 19, 'slip_atr_k': 0.16449696735852132, 'slip_spread_k': 0.8310409075252319, 'spread_hl_frac': 5.1495425295819755e-05, 'bb_std_mult': 2.0197436123156196, 'rsi_os': 15, 'rsi_ob': 67, 'vol_spike': 0.10296773426414217, 'adx_thresh': 22.5584754833927, 'atr_min_pct': 0.025372493370400807, 'atr_max_pct': 0.047864457436017104, 'tp_mult': 2.251043290409062, 'tsl_mult': 0.5420545503015844, 'strategy': 'breakout', 'time_stop': 19, 'use_sma': True, 'use_atr': True, 'use_adx': False, 'use_ema': False, 'use_spike': True, 'rsi_required': True, 'edge_k': 0.9022582497609793, 'edge_cap': 0.3323706720613798, 'bull_strategy': 'mean_reversion', 'bull_bb_std_mult': 1.231471121095206, 'bull_rsi_os': 14, 'bull_rsi_ob': 94, 'bull_adx_thresh': 33.97344761967158, 'bull_atr_min_pct': 0.02069576860084393, 'bull_atr_max_pct': 0.10093077694977536, 'bull_tp_mult': 1.193799722830792, 'bull_tsl_mult': 0.5794792720039875, 'bull_time_stop': 200, 'bull_use_sma': False, 'bull_use_ema': False, 'bull_use_atr': True, 'bull_use_adx': True, 'bull_use_spike': False, 'bull_rsi_required': False, 'bear_strategy': 'mean_reversion', 'bear_bb_std_mult': 2.3882168808435953, 'bear_rsi_os': 26, 'bear_rsi_ob': 86, 'bear_adx_thresh': 17.447409990381896, 'bear_atr_min_pct': 0.007957497350216225, 'bear_atr_max_pct': 0.11813633269927806, 'bear_tp_mult': 2.1451586164122154, 'bear_tsl_mult': 0.9993826944444419, 'bear_time_stop': 269, 'bear_use_sma': False, 'bear_use_ema': True, 'bear_use_atr': False, 'bear_use_adx': False, 'bear_use_spike': True, 'bear_rsi_required': True, 'sideways_strategy': 'breakout', 'sideways_bb_std_mult': 2.4549083824210975, 'sideways_rsi_os': 51, 'sideways_rsi_ob': 61, 'sideways_adx_thresh': 5.937613908170272, 'sideways_atr_min_pct': 0.0017171860451154135, 'sideways_atr_max_pct': 0.11496032562444126, 'sideways_tp_mult': 2.6608919530747768, 'sideways_tsl_mult': 0.23333976844135218, 'sideways_time_stop': 126, 'sideways_use_sma': True, 'sideways_use_ema': False, 'sideways_use_atr': False, 'sideways_use_adx': False, 'sideways_use_spike': True, 'sideways_rsi_required': False}.
