[I 2025-08-31 03:25:22,088] Trial 163 finished with values: [-1000000000.0, 1000000000.0] and parameters: {'p_sma': 32, 'p_std': 21, 'p_atr': 13, 'p_adx': 13, 'rsi_period': 51, 'ema1': 17, 'ema2': 19, 'slip_atr_k': 0.08494772719703259, 'slip_spread_k': 0.1686587902057577, 'spread_hl_frac': 0.019687485637976468, 'bb_std_mult': 1.7147781172425636, 'rsi_os': 15, 'rsi_ob': 65, 'vol_spike': 0.044188396465724616, 'adx_thresh': 34.35218460400789, 'atr_min_pct': 0.01678934878719335, 'atr_max_pct': 0.1458634489118529, 'tp_mult': 2.297600546406447, 'tsl_mult': 0.5433317589654968, 'strategy': 'breakout', 'time_stop': 235, 'use_sma': True, 'use_atr': True, 'use_adx': True, 'use_ema': False, 'use_spike': True, 'rsi_required': True, 'edge_k': 0.07450133682531968, 'edge_cap': 0.40848208341066233, 'bull_strategy': 'mean_reversion', 'bull_bb_std_mult': 1.6722046639005659, 'bull_rsi_os': 37, 'bull_rsi_ob': 73, 'bull_adx_thresh': 18.12279554715558, 'bull_atr_min_pct': 0.025195293884730414, 'bull_atr_max_pct': 0.02257770805835344, 'bull_tp_mult': 2.5592655061539054, 'bull_tsl_mult': 0.7366446602375682, 'bull_time_stop': 255, 'bull_use_sma': False, 'bull_use_ema': False, 'bull_use_atr': True, 'bull_use_adx': True, 'bull_use_spike': False, 'bull_rsi_required': True, 'bear_strategy': 'mean_reversion', 'bear_bb_std_mult': 2.321772210512518, 'bear_rsi_os': 19, 'bear_rsi_ob': 88, 'bear_adx_thresh': 11.461276936695423, 'bear_atr_min_pct': 0.01630171666541447, 'bear_atr_max_pct': 0.10405660974096069, 'bear_tp_mult': 2.804037395150585, 'bear_tsl_mult': 0.957021705070623, 'bear_time_stop': 253, 'bear_use_sma': False, 'bear_use_ema': True, 'bear_use_atr': False, 'bear_use_adx': False, 'bear_use_spike': True, 'bear_rsi_required': True, 'sideways_strategy': 'breakout', 'sideways_bb_std_mult': 0.7160341759800626, 'sideways_rsi_os': 23, 'sideways_rsi_ob': 76, 'sideways_adx_thresh': 5.04441208974715, 'sideways_atr_min_pct': 0.011625711362316752, 'sideways_atr_max_pct': 0.07015788736162698, 'sideways_tp_mult': 2.703940720554462, 'sideways_tsl_mult': 0.339979359742588, 'sideways_time_stop': 39, 'sideways_use_sma': True, 'sideways_use_ema': False, 'sideways_use_atr': False, 'sideways_use_adx': False, 'sideways_use_spike': True, 'sideways_rsi_required': False}.
[I 2025-08-31 03:25:22,092] Trial 162 finished with values: [-1000000000.0, 1000000000.0] and parameters: {'p_sma': 13, 'p_std': 20, 'p_atr': 13, 'p_adx': 20, 'rsi_period': 51, 'ema1': 17, 'ema2': 50, 'slip_atr_k': 0.08480040243094898, 'slip_spread_k': 0.16398266504050185, 'spread_hl_frac': 0.006306936648154389, 'bb_std_mult': 2.228495402424609, 'rsi_os': 7, 'rsi_ob': 66, 'vol_spike': 0.10950846282737872, 'adx_thresh': 24.320690698977902, 'atr_min_pct': 0.022462487938546865, 'atr_max_pct': 0.14580435670612418, 'tp_mult': 1.6379847541305015, 'tsl_mult': 0.41045733288774433, 'strategy': 'breakout', 'time_stop': 25, 'use_sma': True, 'use_atr': True, 'use_adx': True, 'use_ema': False, 'use_spike': True, 'rsi_required': True, 'edge_k': 0.24761463656699234, 'edge_cap': 0.940125884360431, 'bull_strategy': 'mean_reversion', 'bull_bb_std_mult': 1.66369968321479, 'bull_rsi_os': 17, 'bull_rsi_ob': 55, 'bull_adx_thresh': 11.985351564397329, 'bull_atr_min_pct': 0.0012005934916364397, 'bull_atr_max_pct': 0.023370719326734016, 'bull_tp_mult': 2.3737641508948277, 'bull_tsl_mult': 0.3793031672186641, 'bull_time_stop': 251, 'bull_use_sma': False, 'bull_use_ema': False, 'bull_use_atr': True, 'bull_use_adx': True, 'bull_use_spike': False, 'bull_rsi_required': True, 'bear_strategy': 'mean_reversion', 'bear_bb_std_mult': 2.218510165265326, 'bear_rsi_os': 18, 'bear_rsi_ob': 91, 'bear_adx_thresh': 15.383984648617279, 'bear_atr_min_pct': 0.018874511739463837, 'bear_atr_max_pct': 0.10452537826030009, 'bear_tp_mult': 2.040316274680941, 'bear_tsl_mult': 0.9153478268586118, 'bear_time_stop': 252, 'bear_use_sma': True, 'bear_use_ema': True, 'bear_use_atr': False, 'bear_use_adx': False, 'bear_use_spike': True, 'bear_rsi_required': True, 'sideways_strategy': 'breakout', 'sideways_bb_std_mult': 0.5357836124132223, 'sideways_rsi_os': 35, 'sideways_rsi_ob': 85, 'sideways_adx_thresh': 8.321613084065264, 'sideways_atr_min_pct': 0.024247769719373535, 'sideways_atr_max_pct': 0.01045866082612322, 'sideways_tp_mult': 2.710879405542774, 'sideways_tsl_mult': 0.30077633090770195, 'sideways_time_stop': 24, 'sideways_use_sma': True, 'sideways_use_ema': False, 'sideways_use_atr': False, 'sideways_use_adx': False, 'sideways_use_spike': True, 'sideways_rsi_required': True}.
[I 2025-08-31 03:25:22,524] Trial 164 finished with values: [-1000000000.0, 1000000000.0] and parameters: {'p_sma': 32, 'p_std': 22, 'p_atr': 13, 'p_adx': 13, 'rsi_period': 75, 'ema1': 17, 'ema2': 51, 'slip_atr_k': 0.03607088829867527, 'slip_spread_k': 0.1666593247862757, 'spread_hl_frac': 0.004920411322772459, 'bb_std_mult': 1.726350643032974, 'rsi_os': 15, 'rsi_ob': 67, 'vol_spike': 0.04320538315657736, 'adx_thresh': 24.183730322674677, 'atr_min_pct': 0.022515214695945265, 'atr_max_pct': 0.14600913481242592, 'tp_mult': 1.5725994115053177, 'tsl_mult': 0.32705572672585626, 'strategy': 'breakout', 'time_stop': 234, 'use_sma': True, 'use_atr': True, 'use_adx': True, 'use_ema': False, 'use_spike': True, 'rsi_required': True, 'edge_k': 0.24278592762476714, 'edge_cap': 0.941869696555875, 'bull_strategy': 'mean_reversion', 'bull_bb_std_mult': 1.2986230290403253, 'bull_rsi_os': 15, 'bull_rsi_ob': 73, 'bull_adx_thresh': 34.90500700650763, 'bull_atr_min_pct': 0.028513023309206013, 'bull_atr_max_pct': 0.020603545417126626, 'bull_tp_mult': 1.088513528187645, 'bull_tsl_mult': 0.07071906248956633, 'bull_time_stop': 117, 'bull_use_sma': False, 'bull_use_ema': False, 'bull_use_atr': True, 'bull_use_adx': True, 'bull_use_spike': False, 'bull_rsi_required': True, 'bear_strategy': 'mean_reversion', 'bear_bb_std_mult': 2.3014378019585333, 'bear_rsi_os': 25, 'bear_rsi_ob': 73, 'bear_adx_thresh': 6.048226587426868, 'bear_atr_min_pct': 0.010206836948665714, 'bear_atr_max_pct': 0.12842328698164768, 'bear_tp_mult': 2.156004474175785, 'bear_tsl_mult': 0.9138699376871251, 'bear_time_stop': 231, 'bear_use_sma': False, 'bear_use_ema': True, 'bear_use_atr': False, 'bear_use_adx': False, 'bear_use_spike': True, 'bear_rsi_required': True, 'sideways_strategy': 'breakout', 'sideways_bb_std_mult': 1.4792006908532678, 'sideways_rsi_os': 39, 'sideways_rsi_ob': 76, 'sideways_adx_thresh': 6.309960414536195, 'sideways_atr_min_pct': 0.017033518490881396, 'sideways_atr_max_pct': 0.14279410771880763, 'sideways_tp_mult': 2.71081550884214, 'sideways_tsl_mult': 0.3445177155524193, 'sideways_time_stop': 38, 'sideways_use_sma': True, 'sideways_use_ema': False, 'sideways_use_atr': False, 'sideways_use_adx': False, 'sideways_use_spike': True, 'sideways_rsi_required': False}.
[I 2025-08-31 03:25:22,849] Trial 165 finished with values: [-1000000000.0, 1000000000.0] and parameters: {'p_sma': 8, 'p_std': 21, 'p_atr': 11, 'p_adx': 13, 'rsi_period': 50, 'ema1': 7, 'ema2': 49, 'slip_atr_k': 0.03797999582414707, 'slip_spread_k': 0.16391882879893777, 'spread_hl_frac': 0.00458103809479153, 'bb_std_mult': 2.215440097072725, 'rsi_os': 15, 'rsi_ob': 65, 'vol_spike': 0.10851316620533658, 'adx_thresh': 22.95951275166621, 'atr_min_pct': 0.01669436791491097, 'atr_max_pct': 0.14524323509959558, 'tp_mult': 1.6469947474335371, 'tsl_mult': 0.02281232899238922, 'strategy': 'breakout', 'time_stop': 41, 'use_sma': True, 'use_atr': True, 'use_adx': True, 'use_ema': False, 'use_spike': True, 'rsi_required': True, 'edge_k': 0.8322208194205325, 'edge_cap': 0.42368826838623413, 'bull_strategy': 'mean_reversion', 'bull_bb_std_mult': 1.6775852354616672, 'bull_rsi_os': 15, 'bull_rsi_ob': 74, 'bull_adx_thresh': 18.075508397379657, 'bull_atr_min_pct': 0.02521214633507221, 'bull_atr_max_pct': 0.029689244976767882, 'bull_tp_mult': 2.981668462402789, 'bull_tsl_mult': 0.3581840543964928, 'bull_time_stop': 245, 'bull_use_sma': False, 'bull_use_ema': False, 'bull_use_atr': True, 'bull_use_adx': True, 'bull_use_spike': False, 'bull_rsi_required': False, 'bear_strategy': 'mean_reversion', 'bear_bb_std_mult': 1.9597337629450502, 'bear_rsi_os': 25, 'bear_rsi_ob': 81, 'bear_adx_thresh': 11.39785790663405, 'bear_atr_min_pct': 0.010249340992202113, 'bear_atr_max_pct': 0.10460965113158961, 'bear_tp_mult': 2.8160671137330753, 'bear_tsl_mult': 0.9146414015000159, 'bear_time_stop': 254, 'bear_use_sma': True, 'bear_use_ema': True, 'bear_use_atr': False, 'bear_use_adx': False, 'bear_use_spike': True, 'bear_rsi_required': True, 'sideways_strategy': 'breakout', 'sideways_bb_std_mult': 3.339133448485832, 'sideways_rsi_os': 40, 'sideways_rsi_ob': 76, 'sideways_adx_thresh': 5.079595686682503, 'sideways_atr_min_pct': 0.013172226512098133, 'sideways_atr_max_pct': 0.10685866173719724, 'sideways_tp_mult': 1.2447538297672405, 'sideways_tsl_mult': 0.3378395545354855, 'sideways_time_stop': 37, 'sideways_use_sma': True, 'sideways_use_ema': False, 'sideways_use_atr': False, 'sideways_use_adx': False, 'sideways_use_spike': True, 'sideways_rsi_required': False}.
[I 2025-08-31 03:25:23,274] Trial 166 finished with values: [-1000000000.0, 1000000000.0] and parameters: {'p_sma': 51, 'p_std': 22, 'p_atr': 10, 'p_adx': 12, 'rsi_period': 74, 'ema1': 16, 'ema2': 48, 'slip_atr_k': 0.17778801926853094, 'slip_spread_k': 0.2321842207482704, 'spread_hl_frac': 0.004487253184007252, 'bb_std_mult': 1.8694595109826098, 'rsi_os': 14, 'rsi_ob': 51, 'vol_spike': 0.29905873164232294, 'adx_thresh': 23.303596484961126, 'atr_min_pct': 0.027322422956359442, 'atr_max_pct': 0.027277027869023314, 'tp_mult': 1.5827625240796688, 'tsl_mult': 0.12774406502565266, 'strategy': 'breakout', 'time_stop': 37, 'use_sma': True, 'use_atr': True, 'use_adx': False, 'use_ema': False, 'use_spike': False, 'rsi_required': True, 'edge_k': 0.8483827875379443, 'edge_cap': 0.18555372258166197, 'bull_strategy': 'breakout', 'bull_bb_std_mult': 1.3070094149720908, 'bull_rsi_os': 15, 'bull_rsi_ob': 74, 'bull_adx_thresh': 21.82442524958212, 'bull_atr_min_pct': 0.028546868587338983, 'bull_atr_max_pct': 0.019506235069564518, 'bull_tp_mult': 1.0677250480308065, 'bull_tsl_mult': 0.3117969297428924, 'bull_time_stop': 120, 'bull_use_sma': False, 'bull_use_ema': False, 'bull_use_atr': True, 'bull_use_adx': False, 'bull_use_spike': True, 'bull_rsi_required': False, 'bear_strategy': 'mean_reversion', 'bear_bb_std_mult': 2.1230489488420026, 'bear_rsi_os': 24, 'bear_rsi_ob': 64, 'bear_adx_thresh': 25.64826331730698, 'bear_atr_min_pct': 0.010250140998739075, 'bear_atr_max_pct': 0.1278184369367678, 'bear_tp_mult': 2.0970921635112574, 'bear_tsl_mult': 0.9849103621639882, 'bear_time_stop': 231, 'bear_use_sma': False, 'bear_use_ema': False, 'bear_use_atr': False, 'bear_use_adx': True, 'bear_use_spike': True, 'bear_rsi_required': True, 'sideways_strategy': 'breakout', 'sideways_bb_std_mult': 0.8490049623652403, 'sideways_rsi_os': 53, 'sideways_rsi_ob': 78, 'sideways_adx_thresh': 12.24968340408396, 'sideways_atr_min_pct': 0.0015137422785917506, 'sideways_atr_max_pct': 0.029564075039207785, 'sideways_tp_mult': 1.9901605912566624, 'sideways_tsl_mult': 0.38805501888346494, 'sideways_time_stop': 36, 'sideways_use_sma': True, 'sideways_use_ema': True, 'sideways_use_atr': False, 'sideways_use_adx': True, 'sideways_use_spike': True, 'sideways_rsi_required': False}.
[I 2025-08-31 03:25:58,038] Trial 168 finished with values: [-1000000000.0, 1000000000.0] and parameters: {'p_sma': 8, 'p_std': 21, 'p_atr': 11, 'p_adx': 12, 'rsi_period': 32, 'ema1': 26, 'ema2': 48, 'slip_atr_k': 0.025123227067286903, 'slip_spread_k': 0.23876597272126696, 'spread_hl_frac': 0.008304013538181367, 'bb_std_mult': 1.871668921926378, 'rsi_os': 17, 'rsi_ob': 51, 'vol_spike': 0.13057147233070893, 'adx_thresh': 23.28102483353627, 'atr_min_pct': 0.0001554368899056996, 'atr_max_pct': 0.13809748959946455, 'tp_mult': 1.6705231694342257, 'tsl_mult': 0.02131186015422326, 'strategy': 'mean_reversion', 'time_stop': 292, 'use_sma': True, 'use_atr': True, 'use_adx': False, 'use_ema': True, 'use_spike': False, 'rsi_required': True, 'edge_k': 0.13071954505823022, 'edge_cap': 0.2903349353560412, 'bull_strategy': 'breakout', 'bull_bb_std_mult': 1.1368726158008822, 'bull_rsi_os': 14, 'bull_rsi_ob': 76, 'bull_adx_thresh': 17.200788798238776, 'bull_atr_min_pct': 0.0009044066944648363, 'bull_atr_max_pct': 0.030162714309312864, 'bull_tp_mult': 2.9395655076174543, 'bull_tsl_mult': 0.348458773807091, 'bull_time_stop': 9, 'bull_use_sma': False, 'bull_use_ema': False, 'bull_use_atr': True, 'bull_use_adx': False, 'bull_use_spike': True, 'bull_rsi_required': False, 'bear_strategy': 'mean_reversion', 'bear_bb_std_mult': 1.9676287660073202, 'bear_rsi_os': 23, 'bear_rsi_ob': 58, 'bear_adx_thresh': 17.669873720672463, 'bear_atr_min_pct': 0.007149941427689712, 'bear_atr_max_pct': 0.11152826185157542, 'bear_tp_mult': 2.0962726249234525, 'bear_tsl_mult': 0.9862843925688864, 'bear_time_stop': 267, 'bear_use_sma': True, 'bear_use_ema': False, 'bear_use_atr': False, 'bear_use_adx': True, 'bear_use_spike': True, 'bear_rsi_required': True, 'sideways_strategy': 'breakout', 'sideways_bb_std_mult': 1.394426335413665, 'sideways_rsi_os': 28, 'sideways_rsi_ob': 80, 'sideways_adx_thresh': 6.79230227117224, 'sideways_atr_min_pct': 0.025978707386286763, 'sideways_atr_max_pct': 0.10778136814660036, 'sideways_tp_mult': 1.2240282662326418, 'sideways_tsl_mult': 0.38532813038790337, 'sideways_time_stop': 65, 'sideways_use_sma': True, 'sideways_use_ema': True, 'sideways_use_atr': True, 'sideways_use_adx': True, 'sideways_use_spike': True, 'sideways_rsi_required': False}.
[I 2025-08-31 03:25:58,057] Trial 167 finished with values: [-1000000000.0, 1000000000.0] and parameters: {'p_sma': 8, 'p_std': 52, 'p_atr': 11, 'p_adx': 12, 'rsi_period': 74, 'ema1': 16, 'ema2': 60, 'slip_atr_k': 0.14751836863271323, 'slip_spread_k': 0.3081934890935645, 'spread_hl_frac': 0.022752316970414518, 'bb_std_mult': 3.3420520750360856, 'rsi_os': 14, 'rsi_ob': 81, 'vol_spike': 0.12992209217692, 'adx_thresh': 23.61125379272361, 'atr_min_pct': 0.02183267275392735, 'atr_max_pct': 0.14389757658073357, 'tp_mult': 1.576927362588823, 'tsl_mult': 0.7616714408280667, 'strategy': 'breakout', 'time_stop': 266, 'use_sma': True, 'use_atr': True, 'use_adx': False, 'use_ema': False, 'use_spike': False, 'rsi_required': True, 'edge_k': 0.8606447312313152, 'edge_cap': 0.8265884474907921, 'bull_strategy': 'breakout', 'bull_bb_std_mult': 1.257334710767228, 'bull_rsi_os': 15, 'bull_rsi_ob': 86, 'bull_adx_thresh': 17.432250267360644, 'bull_atr_min_pct': 0.028246787916920906, 'bull_atr_max_pct': 0.01880331290140108, 'bull_tp_mult': 2.99120959257343, 'bull_tsl_mult': 0.3475373390808835, 'bull_time_stop': 243, 'bull_use_sma': False, 'bull_use_ema': False, 'bull_use_atr': True, 'bull_use_adx': False, 'bull_use_spike': True, 'bull_rsi_required': False, 'bear_strategy': 'mean_reversion', 'bear_bb_std_mult': 2.152973181211278, 'bear_rsi_os': 24, 'bear_rsi_ob': 58, 'bear_adx_thresh': 5.885318746017923, 'bear_atr_min_pct': 0.0072594988092794, 'bear_atr_max_pct': 0.11165065397589849, 'bear_tp_mult': 2.338666224530308, 'bear_tsl_mult': 0.9862633476716947, 'bear_time_stop': 227, 'bear_use_sma': False, 'bear_use_ema': False, 'bear_use_atr': False, 'bear_use_adx': True, 'bear_use_spike': True, 'bear_rsi_required': True, 'sideways_strategy': 'breakout', 'sideways_bb_std_mult': 1.4745799512916333, 'sideways_rsi_os': 29, 'sideways_rsi_ob': 78, 'sideways_adx_thresh': 6.126706699643758, 'sideways_atr_min_pct': 0.0015886432913520244, 'sideways_atr_max_pct': 0.10730342245624122, 'sideways_tp_mult': 1.968978476763852, 'sideways_tsl_mult': 0.38753881077342933, 'sideways_time_stop': 38, 'sideways_use_sma': True, 'sideways_use_ema': True, 'sideways_use_atr': False, 'sideways_use_adx': True, 'sideways_use_spike': True, 'sideways_rsi_required': False}.
[I 2025-08-31 03:25:58,370] Trial 169 finished with values: [-0.021883840624699946, 0.022264782464372235] and parameters: {'p_sma': 43, 'p_std': 55, 'p_atr': 10, 'p_adx': 12, 'rsi_period': 37, 'ema1': 16, 'ema2': 56, 'slip_atr_k': 0.02612703892335254, 'slip_spread_k': 0.23902268950186098, 'spread_hl_frac': 0.02274560535953439, 'bb_std_mult': 1.92469539201562, 'rsi_os': 17, 'rsi_ob': 82, 'vol_spike': 0.13229930707726842, 'adx_thresh': 23.812010791734185, 'atr_min_pct': 0.02139403135040576, 'atr_max_pct': 0.1326715309133687, 'tp_mult': 1.7036411762487573, 'tsl_mult': 0.17537313666815207, 'strategy': 'mean_reversion', 'time_stop': 51, 'use_sma': True, 'use_atr': True, 'use_adx': False, 'use_ema': True, 'use_spike': False, 'rsi_required': True, 'edge_k': 0.12349795891527476, 'edge_cap': 0.29374958454445294, 'bull_strategy': 'breakout', 'bull_bb_std_mult': 1.130354250987772, 'bull_rsi_os': 12, 'bull_rsi_ob': 74, 'bull_adx_thresh': 8.24873905943268, 'bull_atr_min_pct': 0.000570338366816646, 'bull_atr_max_pct': 0.10178097651517412, 'bull_tp_mult': 1.5826055254967646, 'bull_tsl_mult': 0.30559881752934315, 'bull_time_stop': 10, 'bull_use_sma': True, 'bull_use_ema': True, 'bull_use_atr': False, 'bull_use_adx': False, 'bull_use_spike': True, 'bull_rsi_required': False, 'bear_strategy': 'mean_reversion', 'bear_bb_std_mult': 2.50599490991831, 'bear_rsi_os': 23, 'bear_rsi_ob': 56, 'bear_adx_thresh': 17.690361648425355, 'bear_atr_min_pct': 0.007391606985471125, 'bear_atr_max_pct': 0.11096948940794465, 'bear_tp_mult': 2.338184443588628, 'bear_tsl_mult': 0.7013227200555384, 'bear_time_stop': 268, 'bear_use_sma': False, 'bear_use_ema': False, 'bear_use_atr': False, 'bear_use_adx': True, 'bear_use_spike': False, 'bear_rsi_required': True, 'sideways_strategy': 'breakout', 'sideways_bb_std_mult': 1.3620820407000094, 'sideways_rsi_os': 42, 'sideways_rsi_ob': 79, 'sideways_adx_thresh': 6.821994858237871, 'sideways_atr_min_pct': 0.003489734566649445, 'sideways_atr_max_pct': 0.10288428463404971, 'sideways_tp_mult': 1.441167046939463, 'sideways_tsl_mult': 0.467605028137178, 'sideways_time_stop': 270, 'sideways_use_sma': True, 'sideways_use_ema': True, 'sideways_use_atr': True, 'sideways_use_adx': True, 'sideways_use_spike': True, 'sideways_rsi_required': True}.
[I 2025-08-31 03:25:58,623] Trial 170 finished with values: [-1000000000.0, 1000000000.0] and parameters: {'p_sma': 6, 'p_std': 56, 'p_atr': 11, 'p_adx': 9, 'rsi_period': 54, 'ema1': 18, 'ema2': 23, 'slip_atr_k': 0.02662109514771456, 'slip_spread_k': 0.30952704645535334, 'spread_hl_frac': 0.0014503379066895875, 'bb_std_mult': 3.0407497984781213, 'rsi_os': 17, 'rsi_ob': 69, 'vol_spike': 0.1289882807194486, 'adx_thresh': 25.271062681455266, 'atr_min_pct': 0.021707194503266372, 'atr_max_pct': 0.034593646163813184, 'tp_mult': 1.7072981807703878, 'tsl_mult': 0.8717982909100193, 'strategy': 'mean_reversion', 'time_stop': 264, 'use_sma': True, 'use_atr': True, 'use_adx': True, 'use_ema': True, 'use_spike': False, 'rsi_required': True, 'edge_k': 0.6693353550617143, 'edge_cap': 0.8216153953704843, 'bull_strategy': 'breakout', 'bull_bb_std_mult': 1.1143322765755874, 'bull_rsi_os': 41, 'bull_rsi_ob': 76, 'bull_adx_thresh': 32.921307918181455, 'bull_atr_min_pct': 3.8284489533919126e-05, 'bull_atr_max_pct': 0.08661463941623343, 'bull_tp_mult': 1.5494194675025512, 'bull_tsl_mult': 0.41773626961036564, 'bull_time_stop': 229, 'bull_use_sma': True, 'bull_use_ema': True, 'bull_use_atr': False, 'bull_use_adx': False, 'bull_use_spike': True, 'bull_rsi_required': True, 'bear_strategy': 'mean_reversion', 'bear_bb_std_mult': 3.35753971708282, 'bear_rsi_os': 21, 'bear_rsi_ob': 59, 'bear_adx_thresh': 17.526070517686158, 'bear_atr_min_pct': 0.0074259180473382124, 'bear_atr_max_pct': 0.12477255263116979, 'bear_tp_mult': 2.472225027724977, 'bear_tsl_mult': 0.9479719994291604, 'bear_time_stop': 247, 'bear_use_sma': False, 'bear_use_ema': False, 'bear_use_atr': True, 'bear_use_adx': True, 'bear_use_spike': False, 'bear_rsi_required': True, 'sideways_strategy': 'mean_reversion', 'sideways_bb_std_mult': 1.35394813241449, 'sideways_rsi_os': 30, 'sideways_rsi_ob': 80, 'sideways_adx_thresh': 6.791544642377675, 'sideways_atr_min_pct': 0.0034704928410383596, 'sideways_atr_max_pct': 0.018402477281082893, 'sideways_tp_mult': 1.9281941448549467, 'sideways_tsl_mult': 0.2934300616083893, 'sideways_time_stop': 65, 'sideways_use_sma': True, 'sideways_use_ema': True, 'sideways_use_atr': True, 'sideways_use_adx': True, 'sideways_use_spike': True, 'sideways_rsi_required': True}.
