[I 2025-08-31 03:17:35,500] Trial 106 finished with values: [-1000000000.0, 1000000000.0] and parameters: {'p_sma': 34, 'p_std': 22, 'p_atr': 14, 'p_adx': 17, 'rsi_period': 61, 'ema1': 18, 'ema2': 19, 'slip_atr_k': 0.13068590358545243, 'slip_spread_k': 0.9068035383150232, 'spread_hl_frac': 0.03356637084594771, 'bb_std_mult': 0.603580651252503, 'rsi_os': 18, 'rsi_ob': 73, 'vol_spike': 0.25417402820697865, 'adx_thresh': 22.35167648997573, 'atr_min_pct': 0.0012152430664866994, 'atr_max_pct': 0.0952451819555555, 'tp_mult': 1.333372982047669, 'tsl_mult': 0.628573601555802, 'strategy': 'breakout', 'time_stop': 83, 'use_sma': False, 'use_atr': False, 'use_adx': True, 'use_ema': False, 'use_spike': False, 'rsi_required': False, 'edge_k': 0.4042521828439862, 'edge_cap': 0.161924959552116, 'bull_strategy': 'breakout', 'bull_bb_std_mult': 2.375964414489744, 'bull_rsi_os': 17, 'bull_rsi_ob': 64, 'bull_adx_thresh': 17.86331581529135, 'bull_atr_min_pct': 0.009188866717581432, 'bull_atr_max_pct': 0.13978223214554186, 'bull_tp_mult': 1.3067375303678805, 'bull_tsl_mult': 0.39066204599551757, 'bull_time_stop': 96, 'bull_use_sma': False, 'bull_use_ema': False, 'bull_use_atr': True, 'bull_use_adx': False, 'bull_use_spike': True, 'bull_rsi_required': True, 'bear_strategy': 'mean_reversion', 'bear_bb_std_mult': 2.911730805204874, 'bear_rsi_os': 8, 'bear_rsi_ob': 57, 'bear_adx_thresh': 17.19226990734524, 'bear_atr_min_pct': 0.0110336313017655, 'bear_atr_max_pct': 0.04050949359128566, 'bear_tp_mult': 1.6304944833911592, 'bear_tsl_mult': 0.13667336381505818, 'bear_time_stop': 164, 'bear_use_sma': False, 'bear_use_ema': False, 'bear_use_atr': False, 'bear_use_adx': False, 'bear_use_spike': True, 'bear_rsi_required': True, 'sideways_strategy': 'breakout', 'sideways_bb_std_mult': 2.983163292309929, 'sideways_rsi_os': 31, 'sideways_rsi_ob': 49, 'sideways_adx_thresh': 26.02907416558522, 'sideways_atr_min_pct': 0.025072313007271835, 'sideways_atr_max_pct': 0.1000315560554565, 'sideways_tp_mult': 2.8640824123143798, 'sideways_tsl_mult': 0.14592269768330668, 'sideways_time_stop': 104, 'sideways_use_sma': True, 'sideways_use_ema': True, 'sideways_use_atr': False, 'sideways_use_adx': True, 'sideways_use_spike': True, 'sideways_rsi_required': True}.
[I 2025-08-31 03:17:35,500] Trial 109 finished with values: [-1000000000.0, 1000000000.0] and parameters: {'p_sma': 13, 'p_std': 22, 'p_atr': 26, 'p_adx': 25, 'rsi_period': 73, 'ema1': 16, 'ema2': 46, 'slip_atr_k': 0.20113136862196124, 'slip_spread_k': 0.5280592375225382, 'spread_hl_frac': 0.011051299290898934, 'bb_std_mult': 0.5579539729388269, 'rsi_os': 33, 'rsi_ob': 73, 'vol_spike': 0.1472391440064228, 'adx_thresh': 25.262315526116105, 'atr_min_pct': 0.01539658869100672, 'atr_max_pct': 0.10128223606817421, 'tp_mult': 1.3581845510795119, 'tsl_mult': 0.5462637544364207, 'strategy': 'mean_reversion', 'time_stop': 88, 'use_sma': False, 'use_atr': False, 'use_adx': True, 'use_ema': True, 'use_spike': False, 'rsi_required': False, 'edge_k': 0.2535456224460394, 'edge_cap': 0.7498498088089804, 'bull_strategy': 'breakout', 'bull_bb_std_mult': 2.389231760256984, 'bull_rsi_os': 18, 'bull_rsi_ob': 78, 'bull_adx_thresh': 17.896326583309207, 'bull_atr_min_pct': 0.016642357931660336, 'bull_atr_max_pct': 0.1468675397995826, 'bull_tp_mult': 1.4048358084846795, 'bull_tsl_mult': 0.21378140020882308, 'bull_time_stop': 94, 'bull_use_sma': False, 'bull_use_ema': False, 'bull_use_atr': True, 'bull_use_adx': False, 'bull_use_spike': False, 'bull_rsi_required': True, 'bear_strategy': 'mean_reversion', 'bear_bb_std_mult': 1.0237709419819303, 'bear_rsi_os': 8, 'bear_rsi_ob': 81, 'bear_adx_thresh': 19.780382155804148, 'bear_atr_min_pct': 0.002727447585531678, 'bear_atr_max_pct': 0.08269919219674447, 'bear_tp_mult': 1.6367591299261603, 'bear_tsl_mult': 0.947742591868446, 'bear_time_stop': 108, 'bear_use_sma': True, 'bear_use_ema': False, 'bear_use_atr': False, 'bear_use_adx': False, 'bear_use_spike': True, 'bear_rsi_required': True, 'sideways_strategy': 'breakout', 'sideways_bb_std_mult': 2.478279163715102, 'sideways_rsi_os': 39, 'sideways_rsi_ob': 46, 'sideways_adx_thresh': 25.525690620891535, 'sideways_atr_min_pct': 0.020750805419265106, 'sideways_atr_max_pct': 0.055338842963920526, 'sideways_tp_mult': 2.2943663180322567, 'sideways_tsl_mult': 0.47513010819507634, 'sideways_time_stop': 78, 'sideways_use_sma': True, 'sideways_use_ema': True, 'sideways_use_atr': True, 'sideways_use_adx': False, 'sideways_use_spike': True, 'sideways_rsi_required': False}.
[I 2025-08-31 03:18:07,667] Trial 113 finished with values: [-1000000000.0, 1000000000.0] and parameters: {'p_sma': 14, 'p_std': 28, 'p_atr': 28, 'p_adx': 15, 'rsi_period': 67, 'ema1': 17, 'ema2': 24, 'slip_atr_k': 0.014578386395771692, 'slip_spread_k': 0.35620718743775703, 'spread_hl_frac': 0.043891552372877736, 'bb_std_mult': 0.8091973047669831, 'rsi_os': 53, 'rsi_ob': 92, 'vol_spike': 0.20266873528830748, 'adx_thresh': 11.326826410204736, 'atr_min_pct': 0.004413125286640477, 'atr_max_pct': 0.06872941273099074, 'tp_mult': 1.1140784307067269, 'tsl_mult': 0.9972477228927744, 'strategy': 'breakout', 'time_stop': 11, 'use_sma': True, 'use_atr': True, 'use_adx': False, 'use_ema': False, 'use_spike': True, 'rsi_required': True, 'edge_k': 0.8581086738797599, 'edge_cap': 0.05399219265011313, 'bull_strategy': 'mean_reversion', 'bull_bb_std_mult': 0.9745038405818249, 'bull_rsi_os': 27, 'bull_rsi_ob': 59, 'bull_adx_thresh': 19.37422915221043, 'bull_atr_min_pct': 0.007421951888675381, 'bull_atr_max_pct': 0.14335897961662686, 'bull_tp_mult': 1.6462217494909335, 'bull_tsl_mult': 0.48267019284159984, 'bull_time_stop': 260, 'bull_use_sma': True, 'bull_use_ema': False, 'bull_use_atr': False, 'bull_use_adx': False, 'bull_use_spike': False, 'bull_rsi_required': True, 'bear_strategy': 'mean_reversion', 'bear_bb_std_mult': 2.46441010520018, 'bear_rsi_os': 6, 'bear_rsi_ob': 59, 'bear_adx_thresh': 5.061400062238972, 'bear_atr_min_pct': 0.012198784323973918, 'bear_atr_max_pct': 0.09740698079044394, 'bear_tp_mult': 1.5382488442678435, 'bear_tsl_mult': 0.9073442623044103, 'bear_time_stop': 185, 'bear_use_sma': False, 'bear_use_ema': False, 'bear_use_atr': False, 'bear_use_adx': False, 'bear_use_spike': False, 'bear_rsi_required': False, 'sideways_strategy': 'breakout', 'sideways_bb_std_mult': 0.9070826451310166, 'sideways_rsi_os': 43, 'sideways_rsi_ob': 53, 'sideways_adx_thresh': 10.656756343512114, 'sideways_atr_min_pct': 0.022914775681614936, 'sideways_atr_max_pct': 0.023170524752608494, 'sideways_tp_mult': 2.9645219557594387, 'sideways_tsl_mult': 0.2725959215743049, 'sideways_time_stop': 277, 'sideways_use_sma': True, 'sideways_use_ema': True, 'sideways_use_atr': False, 'sideways_use_adx': True, 'sideways_use_spike': False, 'sideways_rsi_required': False}.
[I 2025-08-31 03:18:07,985] Trial 111 finished with values: [-1000000000.0, 1000000000.0] and parameters: {'p_sma': 13, 'p_std': 32, 'p_atr': 28, 'p_adx': 9, 'rsi_period': 69, 'ema1': 16, 'ema2': 26, 'slip_atr_k': 0.13090951702936815, 'slip_spread_k': 0.9999182654596803, 'spread_hl_frac': 0.04050231036793516, 'bb_std_mult': 2.94785055367136, 'rsi_os': 53, 'rsi_ob': 92, 'vol_spike': 0.2019933804802268, 'adx_thresh': 20.354547821235602, 'atr_min_pct': 0.021200995021921718, 'atr_max_pct': 0.10225654475956236, 'tp_mult': 1.4771463646682044, 'tsl_mult': 0.5984235724182309, 'strategy': 'breakout', 'time_stop': 175, 'use_sma': True, 'use_atr': True, 'use_adx': True, 'use_ema': False, 'use_spike': True, 'rsi_required': True, 'edge_k': 0.34777589052599345, 'edge_cap': 0.17259752428473124, 'bull_strategy': 'breakout', 'bull_bb_std_mult': 2.3049461140389687, 'bull_rsi_os': 24, 'bull_rsi_ob': 78, 'bull_adx_thresh': 18.52506105639171, 'bull_atr_min_pct': 0.010928127574487684, 'bull_atr_max_pct': 0.14324483890727113, 'bull_tp_mult': 1.3958736174355864, 'bull_tsl_mult': 0.48035970838757236, 'bull_time_stop': 109, 'bull_use_sma': True, 'bull_use_ema': False, 'bull_use_atr': False, 'bull_use_adx': False, 'bull_use_spike': False, 'bull_rsi_required': True, 'bear_strategy': 'mean_reversion', 'bear_bb_std_mult': 2.4706358501751, 'bear_rsi_os': 6, 'bear_rsi_ob': 81, 'bear_adx_thresh': 9.519521664023884, 'bear_atr_min_pct': 0.017870857561860607, 'bear_atr_max_pct': 0.059032745480375244, 'bear_tp_mult': 1.3380791226235025, 'bear_tsl_mult': 0.8774814241221299, 'bear_time_stop': 165, 'bear_use_sma': False, 'bear_use_ema': False, 'bear_use_atr': False, 'bear_use_adx': False, 'bear_use_spike': False, 'bear_rsi_required': False, 'sideways_strategy': 'breakout', 'sideways_bb_std_mult': 0.9081671574110028, 'sideways_rsi_os': 32, 'sideways_rsi_ob': 49, 'sideways_adx_thresh': 22.25804509077883, 'sideways_atr_min_pct': 0.020660742834225667, 'sideways_atr_max_pct': 0.08339390167781884, 'sideways_tp_mult': 2.1694325140102193, 'sideways_tsl_mult': 0.12973527354466374, 'sideways_time_stop': 278, 'sideways_use_sma': True, 'sideways_use_ema': True, 'sideways_use_atr': False, 'sideways_use_adx': True, 'sideways_use_spike': True, 'sideways_rsi_required': False}.
[I 2025-08-31 03:18:07,986] Trial 112 finished with values: [-1000000000.0, 1000000000.0] and parameters: {'p_sma': 41, 'p_std': 26, 'p_atr': 15, 'p_adx': 15, 'rsi_period': 11, 'ema1': 17, 'ema2': 24, 'slip_atr_k': 0.014266258812236685, 'slip_spread_k': 0.9948878373060166, 'spread_hl_frac': 0.04362312315462431, 'bb_std_mult': 0.8222681847463016, 'rsi_os': 50, 'rsi_ob': 92, 'vol_spike': 0.20523093954031807, 'adx_thresh': 11.359696649522112, 'atr_min_pct': 0.02655341026974105, 'atr_max_pct': 0.0714986999597258, 'tp_mult': 2.9965774568277266, 'tsl_mult': 0.10595058763317028, 'strategy': 'breakout', 'time_stop': 125, 'use_sma': True, 'use_atr': True, 'use_adx': False, 'use_ema': False, 'use_spike': True, 'rsi_required': True, 'edge_k': 1.72575520196651, 'edge_cap': 0.9941296056369902, 'bull_strategy': 'mean_reversion', 'bull_bb_std_mult': 0.941774395390031, 'bull_rsi_os': 50, 'bull_rsi_ob': 78, 'bull_adx_thresh': 19.29580690657833, 'bull_atr_min_pct': 0.026809873140999037, 'bull_atr_max_pct': 0.1292313868296049, 'bull_tp_mult': 2.28906024627118, 'bull_tsl_mult': 0.9060908586563572, 'bull_time_stop': 144, 'bull_use_sma': True, 'bull_use_ema': False, 'bull_use_atr': False, 'bull_use_adx': False, 'bull_use_spike': False, 'bull_rsi_required': True, 'bear_strategy': 'mean_reversion', 'bear_bb_std_mult': 1.1804753747727375, 'bear_rsi_os': 6, 'bear_rsi_ob': 64, 'bear_adx_thresh': 31.214107957307185, 'bear_atr_min_pct': 0.017831691997587648, 'bear_atr_max_pct': 0.05822564871091482, 'bear_tp_mult': 2.5585542273091333, 'bear_tsl_mult': 0.8023245979159066, 'bear_time_stop': 75, 'bear_use_sma': False, 'bear_use_ema': False, 'bear_use_atr': False, 'bear_use_adx': False, 'bear_use_spike': False, 'bear_rsi_required': False, 'sideways_strategy': 'breakout', 'sideways_bb_std_mult': 1.976843437417196, 'sideways_rsi_os': 7, 'sideways_rsi_ob': 92, 'sideways_adx_thresh': 10.264800743726889, 'sideways_atr_min_pct': 0.003266395299111128, 'sideways_atr_max_pct': 0.021337075843179495, 'sideways_tp_mult': 2.8148400660607686, 'sideways_tsl_mult': 0.8693763106676963, 'sideways_time_stop': 277, 'sideways_use_sma': True, 'sideways_use_ema': True, 'sideways_use_atr': False, 'sideways_use_adx': True, 'sideways_use_spike': False, 'sideways_rsi_required': False}.
[I 2025-08-31 03:18:08,108] Trial 110 finished with values: [-1000000000.0, 1000000000.0] and parameters: {'p_sma': 50, 'p_std': 28, 'p_atr': 27, 'p_adx': 15, 'rsi_period': 69, 'ema1': 16, 'ema2': 24, 'slip_atr_k': 0.23831718938536167, 'slip_spread_k': 0.5270214329208965, 'spread_hl_frac': 0.033664677480678334, 'bb_std_mult': 0.8201765133927723, 'rsi_os': 39, 'rsi_ob': 95, 'vol_spike': 0.15062234809611408, 'adx_thresh': 23.166221679931322, 'atr_min_pct': 0.02631600598231303, 'atr_max_pct': 0.09425569186895527, 'tp_mult': 1.3015710217610414, 'tsl_mult': 0.4465728601616498, 'strategy': 'breakout', 'time_stop': 87, 'use_sma': False, 'use_atr': False, 'use_adx': True, 'use_ema': False, 'use_spike': True, 'rsi_required': False, 'edge_k': 0.24194771409260865, 'edge_cap': 0.9754458391056686, 'bull_strategy': 'breakout', 'bull_bb_std_mult': 2.2783000590598137, 'bull_rsi_os': 50, 'bull_rsi_ob': 78, 'bull_adx_thresh': 8.684763684612067, 'bull_atr_min_pct': 0.01084921383914275, 'bull_atr_max_pct': 0.1440186603507081, 'bull_tp_mult': 2.307975167628235, 'bull_tsl_mult': 0.21830210431707509, 'bull_time_stop': 97, 'bull_use_sma': True, 'bull_use_ema': False, 'bull_use_atr': False, 'bull_use_adx': False, 'bull_use_spike': False, 'bull_rsi_required': True, 'bear_strategy': 'mean_reversion', 'bear_bb_std_mult': 2.6496079035448172, 'bear_rsi_os': 10, 'bear_rsi_ob': 80, 'bear_adx_thresh': 32.11407196249762, 'bear_atr_min_pct': 0.011238436559586576, 'bear_atr_max_pct': 0.09845275794689451, 'bear_tp_mult': 2.5169365342119123, 'bear_tsl_mult': 0.9471327042924744, 'bear_time_stop': 7, 'bear_use_sma': False, 'bear_use_ema': False, 'bear_use_atr': False, 'bear_use_adx': False, 'bear_use_spike': False, 'bear_rsi_required': True, 'sideways_strategy': 'breakout', 'sideways_bb_std_mult': 1.9934566764494153, 'sideways_rsi_os': 39, 'sideways_rsi_ob': 85, 'sideways_adx_thresh': 8.292452854317725, 'sideways_atr_min_pct': 0.028196981032252814, 'sideways_atr_max_pct': 0.020337926481017544, 'sideways_tp_mult': 2.307214835784088, 'sideways_tsl_mult': 0.13872288660536647, 'sideways_time_stop': 289, 'sideways_use_sma': True, 'sideways_use_ema': True, 'sideways_use_atr': False, 'sideways_use_adx': True, 'sideways_use_spike': True, 'sideways_rsi_required': False}.
[I 2025-08-31 03:18:39,349] Trial 116 finished with values: [-0.06683098845751756, 0.06676396985823868] and parameters: {'p_sma': 10, 'p_std': 25, 'p_atr': 16, 'p_adx': 16, 'rsi_period': 7, 'ema1': 19, 'ema2': 16, 'slip_atr_k': 0.008246296554469845, 'slip_spread_k': 0.6058621740809396, 'spread_hl_frac': 0.037631180741964136, 'bb_std_mult': 0.6508942452332851, 'rsi_os': 35, 'rsi_ob': 95, 'vol_spike': 0.18594944052366316, 'adx_thresh': 23.42852415896087, 'atr_min_pct': 0.025004370173163596, 'atr_max_pct': 0.11800852192246702, 'tp_mult': 1.215323200331847, 'tsl_mult': 0.299313915964689, 'strategy': 'breakout', 'time_stop': 96, 'use_sma': False, 'use_atr': False, 'use_adx': True, 'use_ema': False, 'use_spike': False, 'rsi_required': False, 'edge_k': 1.8334372297790353, 'edge_cap': 0.8289080209153912, 'bull_strategy': 'breakout', 'bull_bb_std_mult': 0.7631408002864832, 'bull_rsi_os': 19, 'bull_rsi_ob': 70, 'bull_adx_thresh': 28.423033375906414, 'bull_atr_min_pct': 0.013606425531131311, 'bull_atr_max_pct': 0.14683659787645176, 'bull_tp_mult': 1.5392325115638568, 'bull_tsl_mult': 0.6555809440491527, 'bull_time_stop': 33, 'bull_use_sma': False, 'bull_use_ema': True, 'bull_use_atr': True, 'bull_use_adx': True, 'bull_use_spike': False, 'bull_rsi_required': False, 'bear_strategy': 'breakout', 'bear_bb_std_mult': 0.883950987080871, 'bear_rsi_os': 10, 'bear_rsi_ob': 50, 'bear_adx_thresh': 24.296591695246548, 'bear_atr_min_pct': 0.008658791982084893, 'bear_atr_max_pct': 0.04091601642299085, 'bear_tp_mult': 2.322681116373064, 'bear_tsl_mult': 0.5274160489134283, 'bear_time_stop': 10, 'bear_use_sma': False, 'bear_use_ema': True, 'bear_use_atr': True, 'bear_use_adx': True, 'bear_use_spike': True, 'bear_rsi_required': False, 'sideways_strategy': 'mean_reversion', 'sideways_bb_std_mult': 1.6541947009739473, 'sideways_rsi_os': 36, 'sideways_rsi_ob': 87, 'sideways_adx_thresh': 8.74721211344897, 'sideways_atr_min_pct': 0.000654195368271996, 'sideways_atr_max_pct': 0.08787007350616374, 'sideways_tp_mult': 1.6094759758275576, 'sideways_tsl_mult': 0.764950722662087, 'sideways_time_stop': 17, 'sideways_use_sma': False, 'sideways_use_ema': False, 'sideways_use_atr': False, 'sideways_use_adx': True, 'sideways_use_spike': True, 'sideways_rsi_required': False}.
[I 2025-08-31 03:18:39,772] Trial 115 finished with values: [-1000000000.0, 1000000000.0] and parameters: {'p_sma': 53, 'p_std': 25, 'p_atr': 16, 'p_adx': 16, 'rsi_period': 64, 'ema1': 29, 'ema2': 32, 'slip_atr_k': 0.009943445659492164, 'slip_spread_k': 0.5679113725746398, 'spread_hl_frac': 0.013819439397984941, 'bb_std_mult': 2.617545560440933, 'rsi_os': 35, 'rsi_ob': 94, 'vol_spike': 0.18838182439555543, 'adx_thresh': 23.385736041968652, 'atr_min_pct': 0.009788216932576716, 'atr_max_pct': 0.014963973329365873, 'tp_mult': 2.9379065164784075, 'tsl_mult': 0.6291686295515071, 'strategy': 'breakout', 'time_stop': 96, 'use_sma': False, 'use_atr': False, 'use_adx': True, 'use_ema': False, 'use_spike': False, 'rsi_required': False, 'edge_k': 0.22687882633531148, 'edge_cap': 0.68079211438738, 'bull_strategy': 'breakout', 'bull_bb_std_mult': 2.2404291940900984, 'bull_rsi_os': 19, 'bull_rsi_ob': 70, 'bull_adx_thresh': 17.03133464093092, 'bull_atr_min_pct': 0.020531194734752855, 'bull_atr_max_pct': 0.0803301760579088, 'bull_tp_mult': 1.5468408389027843, 'bull_tsl_mult': 0.9457722416239691, 'bull_time_stop': 32, 'bull_use_sma': False, 'bull_use_ema': True, 'bull_use_atr': True, 'bull_use_adx': True, 'bull_use_spike': False, 'bull_rsi_required': False, 'bear_strategy': 'breakout', 'bear_bb_std_mult': 2.0750832926674168, 'bear_rsi_os': 10, 'bear_rsi_ob': 83, 'bear_adx_thresh': 15.447079126796572, 'bear_atr_min_pct': 0.008426981188467958, 'bear_atr_max_pct': 0.04401833454650106, 'bear_tp_mult': 1.4766863295440233, 'bear_tsl_mult': 0.9993317290611847, 'bear_time_stop': 101, 'bear_use_sma': False, 'bear_use_ema': True, 'bear_use_atr': True, 'bear_use_adx': True, 'bear_use_spike': True, 'bear_rsi_required': False, 'sideways_strategy': 'mean_reversion', 'sideways_bb_std_mult': 2.285421232737249, 'sideways_rsi_os': 28, 'sideways_rsi_ob': 87, 'sideways_adx_thresh': 7.889594404457732, 'sideways_atr_min_pct': 0.0011127605927209695, 'sideways_atr_max_pct': 0.08768696054271036, 'sideways_tp_mult': 1.5991083151839622, 'sideways_tsl_mult': 0.7623236383665817, 'sideways_time_stop': 18, 'sideways_use_sma': False, 'sideways_use_ema': False, 'sideways_use_atr': False, 'sideways_use_adx': True, 'sideways_use_spike': True, 'sideways_rsi_required': False}.
[I 2025-08-31 03:18:39,928] Trial 117 finished with values: [-1000000000.0, 1000000000.0] and parameters: {'p_sma': 6, 'p_std': 25, 'p_atr': 16, 'p_adx': 16, 'rsi_period': 15, 'ema1': 29, 'ema2': 17, 'slip_atr_k': 0.006960576178589619, 'slip_spread_k': 0.4266817323381685, 'spread_hl_frac': 0.03758900215253462, 'bb_std_mult': 0.5617917062376834, 'rsi_os': 26, 'rsi_ob': 84, 'vol_spike': 0.18570796392876476, 'adx_thresh': 23.411843206538904, 'atr_min_pct': 0.009608190015516566, 'atr_max_pct': 0.11650669990115145, 'tp_mult': 2.939994617857205, 'tsl_mult': 0.30303221035633765, 'strategy': 'breakout', 'time_stop': 95, 'use_sma': False, 'use_atr': False, 'use_adx': True, 'use_ema': True, 'use_spike': False, 'rsi_required': False, 'edge_k': 0.11367227376843467, 'edge_cap': 0.8712881252791551, 'bull_strategy': 'breakout', 'bull_bb_std_mult': 0.6926310846199992, 'bull_rsi_os': 19, 'bull_rsi_ob': 71, 'bull_adx_thresh': 21.192757989183814, 'bull_atr_min_pct': 0.01844161299296434, 'bull_atr_max_pct': 0.141062298100212, 'bull_tp_mult': 1.557156910378452, 'bull_tsl_mult': 0.15553790296101017, 'bull_time_stop': 134, 'bull_use_sma': False, 'bull_use_ema': True, 'bull_use_atr': True, 'bull_use_adx': True, 'bull_use_spike': False, 'bull_rsi_required': False, 'bear_strategy': 'breakout', 'bear_bb_std_mult': 3.207925291574463, 'bear_rsi_os': 35, 'bear_rsi_ob': 50, 'bear_adx_thresh': 6.087008249187162, 'bear_atr_min_pct': 0.008280589052713123, 'bear_atr_max_pct': 0.012759896913698124, 'bear_tp_mult': 1.081686133108804, 'bear_tsl_mult': 0.9791664400244432, 'bear_time_stop': 101, 'bear_use_sma': True, 'bear_use_ema': True, 'bear_use_atr': True, 'bear_use_adx': True, 'bear_use_spike': True, 'bear_rsi_required': False, 'sideways_strategy': 'mean_reversion', 'sideways_bb_std_mult': 1.6494801517670534, 'sideways_rsi_os': 14, 'sideways_rsi_ob': 88, 'sideways_adx_thresh': 24.80112158840843, 'sideways_atr_min_pct': 0.0012029566524516901, 'sideways_atr_max_pct': 0.1168681800949462, 'sideways_tp_mult': 2.9643077406498937, 'sideways_tsl_mult': 0.7680605708280926, 'sideways_time_stop': 18, 'sideways_use_sma': False, 'sideways_use_ema': False, 'sideways_use_atr': True, 'sideways_use_adx': False, 'sideways_use_spike': True, 'sideways_rsi_required': True}.
