[I 2025-08-31 03:33:10,950] Trial 217 finished with values: [-1000000000.0, 1000000000.0] and parameters: {'p_sma': 7, 'p_std': 24, 'p_atr': 12, 'p_adx': 12, 'rsi_period': 74, 'ema1': 15, 'ema2': 19, 'slip_atr_k': 0.1546088306508212, 'slip_spread_k': 0.20033477110747128, 'spread_hl_frac': 0.0016457758078888035, 'bb_std_mult': 2.257206099698155, 'rsi_os': 16, 'rsi_ob': 72, 'vol_spike': 0.12831237761706266, 'adx_thresh': 7.000633929020404, 'atr_min_pct': 0.02293878498426368, 'atr_max_pct': 0.030730524723961587, 'tp_mult': 1.5023196478954004, 'tsl_mult': 0.524919018146784, 'strategy': 'breakout', 'time_stop': 230, 'use_sma': True, 'use_atr': True, 'use_adx': False, 'use_ema': False, 'use_spike': False, 'rsi_required': True, 'edge_k': 1.0235468526372247, 'edge_cap': 0.0933087299032483, 'bull_strategy': 'breakout', 'bull_bb_std_mult': 1.3204679774143333, 'bull_rsi_os': 15, 'bull_rsi_ob': 75, 'bull_adx_thresh': 18.681641815839917, 'bull_atr_min_pct': 0.013128721842739912, 'bull_atr_max_pct': 0.024153343775190454, 'bull_tp_mult': 2.8821341403670426, 'bull_tsl_mult': 0.7287587545405942, 'bull_time_stop': 117, 'bull_use_sma': True, 'bull_use_ema': False, 'bull_use_atr': True, 'bull_use_adx': True, 'bull_use_spike': False, 'bull_rsi_required': False, 'bear_strategy': 'mean_reversion', 'bear_bb_std_mult': 2.3508055225435633, 'bear_rsi_os': 21, 'bear_rsi_ob': 83, 'bear_adx_thresh': 17.285223117642943, 'bear_atr_min_pct': 0.008607226539828788, 'bear_atr_max_pct': 0.014817601577871722, 'bear_tp_mult': 2.1340817271666936, 'bear_tsl_mult': 0.9300952470460468, 'bear_time_stop': 259, 'bear_use_sma': False, 'bear_use_ema': False, 'bear_use_atr': False, 'bear_use_adx': False, 'bear_use_spike': False, 'bear_rsi_required': True, 'sideways_strategy': 'mean_reversion', 'sideways_bb_std_mult': 1.5436642281315889, 'sideways_rsi_os': 25, 'sideways_rsi_ob': 80, 'sideways_adx_thresh': 5.315656219498564, 'sideways_atr_min_pct': 0.0029095325955068945, 'sideways_atr_max_pct': 0.14592669005517328, 'sideways_tp_mult': 2.08814332251458, 'sideways_tsl_mult': 0.38181034623312765, 'sideways_time_stop': 48, 'sideways_use_sma': True, 'sideways_use_ema': False, 'sideways_use_atr': False, 'sideways_use_adx': False, 'sideways_use_spike': False, 'sideways_rsi_required': True}.
[I 2025-08-31 03:33:11,259] Trial 214 finished with values: [-0.11350012946115406, 0.11359499722017655] and parameters: {'p_sma': 27, 'p_std': 23, 'p_atr': 12, 'p_adx': 8, 'rsi_period': 74, 'ema1': 15, 'ema2': 21, 'slip_atr_k': 0.015913985812679197, 'slip_spread_k': 0.24358655351045017, 'spread_hl_frac': 0.01179180427338682, 'bb_std_mult': 3.4907809964699372, 'rsi_os': 13, 'rsi_ob': 62, 'vol_spike': 0.11519801476114797, 'adx_thresh': 26.182607132242335, 'atr_min_pct': 0.012301226771837202, 'atr_max_pct': 0.08219671229058682, 'tp_mult': 1.6520977331411202, 'tsl_mult': 0.519518224937259, 'strategy': 'breakout', 'time_stop': 24, 'use_sma': True, 'use_atr': True, 'use_adx': True, 'use_ema': False, 'use_spike': False, 'rsi_required': True, 'edge_k': 0.7400914492453283, 'edge_cap': 0.1009492348627363, 'bull_strategy': 'breakout', 'bull_bb_std_mult': 1.3431325496349014, 'bull_rsi_os': 45, 'bull_rsi_ob': 90, 'bull_adx_thresh': 19.832352739523017, 'bull_atr_min_pct': 0.0006777040563571077, 'bull_atr_max_pct': 0.021922297502606783, 'bull_tp_mult': 2.899485982992303, 'bull_tsl_mult': 0.38928291947559945, 'bull_time_stop': 126, 'bull_use_sma': False, 'bull_use_ema': False, 'bull_use_atr': True, 'bull_use_adx': False, 'bull_use_spike': True, 'bull_rsi_required': True, 'bear_strategy': 'breakout', 'bear_bb_std_mult': 2.2201236034729037, 'bear_rsi_os': 23, 'bear_rsi_ob': 83, 'bear_adx_thresh': 17.150383532142882, 'bear_atr_min_pct': 0.008716383999717976, 'bear_atr_max_pct': 0.122656218385284, 'bear_tp_mult': 2.0756413429661627, 'bear_tsl_mult': 0.9718764973625004, 'bear_time_stop': 257, 'bear_use_sma': True, 'bear_use_ema': False, 'bear_use_atr': False, 'bear_use_adx': True, 'bear_use_spike': True, 'bear_rsi_required': True, 'sideways_strategy': 'breakout', 'sideways_bb_std_mult': 2.2367695507806142, 'sideways_rsi_os': 53, 'sideways_rsi_ob': 80, 'sideways_adx_thresh': 6.2522849466629715, 'sideways_atr_min_pct': 0.0011382470157850148, 'sideways_atr_max_pct': 0.10430054410734581, 'sideways_tp_mult': 2.058205098091013, 'sideways_tsl_mult': 0.34456616019231356, 'sideways_time_stop': 115, 'sideways_use_sma': False, 'sideways_use_ema': False, 'sideways_use_atr': False, 'sideways_use_adx': False, 'sideways_use_spike': False, 'sideways_rsi_required': False}.
[I 2025-08-31 03:33:45,735] Trial 218 finished with values: [-1000000000.0, 1000000000.0] and parameters: {'p_sma': 21, 'p_std': 25, 'p_atr': 11, 'p_adx': 7, 'rsi_period': 76, 'ema1': 15, 'ema2': 19, 'slip_atr_k': 0.016382568440361928, 'slip_spread_k': 0.9251988614160485, 'spread_hl_frac': 0.007899669820037536, 'bb_std_mult': 3.043932840222558, 'rsi_os': 27, 'rsi_ob': 64, 'vol_spike': 0.1293900459553493, 'adx_thresh': 18.375984799279315, 'atr_min_pct': 0.023440855960439974, 'atr_max_pct': 0.14906802811607586, 'tp_mult': 1.5133414369809153, 'tsl_mult': 0.5265235196018268, 'strategy': 'breakout', 'time_stop': 43, 'use_sma': True, 'use_atr': True, 'use_adx': False, 'use_ema': False, 'use_spike': True, 'rsi_required': True, 'edge_k': 0.22199004477971643, 'edge_cap': 0.09576505508873616, 'bull_strategy': 'breakout', 'bull_bb_std_mult': 1.381292349103758, 'bull_rsi_os': 17, 'bull_rsi_ob': 55, 'bull_adx_thresh': 6.700993338986107, 'bull_atr_min_pct': 0.013428827483458161, 'bull_atr_max_pct': 0.027403057240489883, 'bull_tp_mult': 2.8849042226243173, 'bull_tsl_mult': 0.3677305937462425, 'bull_time_stop': 27, 'bull_use_sma': False, 'bull_use_ema': False, 'bull_use_atr': True, 'bull_use_adx': True, 'bull_use_spike': False, 'bull_rsi_required': True, 'bear_strategy': 'mean_reversion', 'bear_bb_std_mult': 3.298987930047786, 'bear_rsi_os': 17, 'bear_rsi_ob': 83, 'bear_adx_thresh': 18.158000364766448, 'bear_atr_min_pct': 0.005430712204754339, 'bear_atr_max_pct': 0.11619502369643309, 'bear_tp_mult': 2.4668732044640636, 'bear_tsl_mult': 0.48528062383934173, 'bear_time_stop': 160, 'bear_use_sma': False, 'bear_use_ema': False, 'bear_use_atr': False, 'bear_use_adx': False, 'bear_use_spike': True, 'bear_rsi_required': True, 'sideways_strategy': 'breakout', 'sideways_bb_std_mult': 1.4878947697455085, 'sideways_rsi_os': 13, 'sideways_rsi_ob': 81, 'sideways_adx_thresh': 5.409058880715609, 'sideways_atr_min_pct': 0.015576631447706872, 'sideways_atr_max_pct': 0.11107646044868366, 'sideways_tp_mult': 2.054147676248029, 'sideways_tsl_mult': 0.397544616897616, 'sideways_time_stop': 37, 'sideways_use_sma': True, 'sideways_use_ema': False, 'sideways_use_atr': False, 'sideways_use_adx': False, 'sideways_use_spike': False, 'sideways_rsi_required': False}.
[I 2025-08-31 03:33:47,166] Trial 219 finished with values: [-1000000000.0, 1000000000.0] and parameters: {'p_sma': 11, 'p_std': 21, 'p_atr': 30, 'p_adx': 7, 'rsi_period': 71, 'ema1': 6, 'ema2': 19, 'slip_atr_k': 0.025557017244350957, 'slip_spread_k': 0.12441707296538551, 'spread_hl_frac': 0.00446981691562621, 'bb_std_mult': 3.012605303217006, 'rsi_os': 16, 'rsi_ob': 69, 'vol_spike': 0.05011112556404618, 'adx_thresh': 23.146280212045454, 'atr_min_pct': 0.02353804671451107, 'atr_max_pct': 0.14884588752078656, 'tp_mult': 2.2153516648801883, 'tsl_mult': 0.4544450599004573, 'strategy': 'breakout', 'time_stop': 44, 'use_sma': True, 'use_atr': True, 'use_adx': False, 'use_ema': False, 'use_spike': True, 'rsi_required': True, 'edge_k': 0.4783787359506337, 'edge_cap': 0.11076590740383221, 'bull_strategy': 'breakout', 'bull_bb_std_mult': 2.6550900489227547, 'bull_rsi_os': 35, 'bull_rsi_ob': 75, 'bull_adx_thresh': 7.047490810978545, 'bull_atr_min_pct': 0.002097462732044432, 'bull_atr_max_pct': 0.026814880682281737, 'bull_tp_mult': 1.13249319623751, 'bull_tsl_mult': 0.4908214235550078, 'bull_time_stop': 12, 'bull_use_sma': False, 'bull_use_ema': False, 'bull_use_atr': True, 'bull_use_adx': True, 'bull_use_spike': False, 'bull_rsi_required': True, 'bear_strategy': 'mean_reversion', 'bear_bb_std_mult': 2.1511136255890175, 'bear_rsi_os': 47, 'bear_rsi_ob': 84, 'bear_adx_thresh': 22.355017886108453, 'bear_atr_min_pct': 0.006315062996661305, 'bear_atr_max_pct': 0.11474403401986843, 'bear_tp_mult': 2.2252667586307027, 'bear_tsl_mult': 0.9531626999378141, 'bear_time_stop': 246, 'bear_use_sma': False, 'bear_use_ema': False, 'bear_use_atr': True, 'bear_use_adx': False, 'bear_use_spike': True, 'bear_rsi_required': True, 'sideways_strategy': 'breakout', 'sideways_bb_std_mult': 1.8999844743104286, 'sideways_rsi_os': 41, 'sideways_rsi_ob': 67, 'sideways_adx_thresh': 5.923859221698764, 'sideways_atr_min_pct': 0.007721870108136137, 'sideways_atr_max_pct': 0.11176926217148975, 'sideways_tp_mult': 2.785829905228677, 'sideways_tsl_mult': 0.4094228840322278, 'sideways_time_stop': 35, 'sideways_use_sma': True, 'sideways_use_ema': True, 'sideways_use_atr': False, 'sideways_use_adx': True, 'sideways_use_spike': True, 'sideways_rsi_required': False}.
[I 2025-08-31 03:33:47,385] Trial 221 finished with values: [-1000000000.0, 1000000000.0] and parameters: {'p_sma': 11, 'p_std': 54, 'p_atr': 30, 'p_adx': 14, 'rsi_period': 71, 'ema1': 6, 'ema2': 19, 'slip_atr_k': 0.02181006544850562, 'slip_spread_k': 0.9328121424377588, 'spread_hl_frac': 0.004077542487432023, 'bb_std_mult': 2.066289089939519, 'rsi_os': 12, 'rsi_ob': 64, 'vol_spike': 0.2604341332265911, 'adx_thresh': 24.82917593643852, 'atr_min_pct': 0.020680462193866347, 'atr_max_pct': 0.07404586306954362, 'tp_mult': 2.1946837808448003, 'tsl_mult': 0.40855825178603355, 'strategy': 'breakout', 'time_stop': 42, 'use_sma': True, 'use_atr': True, 'use_adx': False, 'use_ema': False, 'use_spike': True, 'rsi_required': True, 'edge_k': 0.2795700545341378, 'edge_cap': 0.9166415000965561, 'bull_strategy': 'breakout', 'bull_bb_std_mult': 1.4103707901497227, 'bull_rsi_os': 49, 'bull_rsi_ob': 56, 'bull_adx_thresh': 30.710078916680633, 'bull_atr_min_pct': 0.017762194143106542, 'bull_atr_max_pct': 0.02709035636068348, 'bull_tp_mult': 1.4176886442705874, 'bull_tsl_mult': 0.25517604844487046, 'bull_time_stop': 46, 'bull_use_sma': False, 'bull_use_ema': False, 'bull_use_atr': True, 'bull_use_adx': True, 'bull_use_spike': False, 'bull_rsi_required': True, 'bear_strategy': 'mean_reversion', 'bear_bb_std_mult': 2.149664356734804, 'bear_rsi_os': 47, 'bear_rsi_ob': 80, 'bear_adx_thresh': 18.496535094069095, 'bear_atr_min_pct': 0.017127906903993153, 'bear_atr_max_pct': 0.11565780989683305, 'bear_tp_mult': 2.667171122055985, 'bear_tsl_mult': 0.30596922312350383, 'bear_time_stop': 150, 'bear_use_sma': False, 'bear_use_ema': False, 'bear_use_atr': True, 'bear_use_adx': False, 'bear_use_spike': True, 'bear_rsi_required': True, 'sideways_strategy': 'breakout', 'sideways_bb_std_mult': 3.590013960858264, 'sideways_rsi_os': 49, 'sideways_rsi_ob': 67, 'sideways_adx_thresh': 7.025088608610696, 'sideways_atr_min_pct': 0.018802910378643713, 'sideways_atr_max_pct': 0.11066207325671074, 'sideways_tp_mult': 2.6875195846247704, 'sideways_tsl_mult': 0.037237915854169024, 'sideways_time_stop': 41, 'sideways_use_sma': True, 'sideways_use_ema': True, 'sideways_use_atr': False, 'sideways_use_adx': True, 'sideways_use_spike': True, 'sideways_rsi_required': False}.
[I 2025-08-31 03:33:47,491] Trial 220 finished with values: [-1000000000.0, 1000000000.0] and parameters: {'p_sma': 20, 'p_std': 25, 'p_atr': 11, 'p_adx': 7, 'rsi_period': 76, 'ema1': 6, 'ema2': 53, 'slip_atr_k': 0.034503512206612186, 'slip_spread_k': 0.17079175185362516, 'spread_hl_frac': 0.004351644104251328, 'bb_std_mult': 2.1717359038492736, 'rsi_os': 12, 'rsi_ob': 46, 'vol_spike': 0.09640028952675404, 'adx_thresh': 24.716536643267588, 'atr_min_pct': 0.008860469808815129, 'atr_max_pct': 0.07268074299515923, 'tp_mult': 2.184701333724232, 'tsl_mult': 0.3751118920841592, 'strategy': 'breakout', 'time_stop': 45, 'use_sma': True, 'use_atr': True, 'use_adx': False, 'use_ema': False, 'use_spike': True, 'rsi_required': True, 'edge_k': 1.2258984329221054, 'edge_cap': 0.11577038376968535, 'bull_strategy': 'breakout', 'bull_bb_std_mult': 1.4000226760546395, 'bull_rsi_os': 35, 'bull_rsi_ob': 55, 'bull_adx_thresh': 19.33178504212291, 'bull_atr_min_pct': 0.01446207708606743, 'bull_atr_max_pct': 0.02631165798667559, 'bull_tp_mult': 1.4261949198178163, 'bull_tsl_mult': 0.3653709164310665, 'bull_time_stop': 27, 'bull_use_sma': False, 'bull_use_ema': False, 'bull_use_atr': True, 'bull_use_adx': True, 'bull_use_spike': False, 'bull_rsi_required': True, 'bear_strategy': 'mean_reversion', 'bear_bb_std_mult': 2.1493601385588916, 'bear_rsi_os': 46, 'bear_rsi_ob': 81, 'bear_adx_thresh': 23.253725143793766, 'bear_atr_min_pct': 0.005511029952424975, 'bear_atr_max_pct': 0.11484217942016128, 'bear_tp_mult': 2.166701973755324, 'bear_tsl_mult': 0.3057746257095818, 'bear_time_stop': 158, 'bear_use_sma': False, 'bear_use_ema': False, 'bear_use_atr': True, 'bear_use_adx': False, 'bear_use_spike': True, 'bear_rsi_required': True, 'sideways_strategy': 'breakout', 'sideways_bb_std_mult': 1.4377342169880551, 'sideways_rsi_os': 13, 'sideways_rsi_ob': 78, 'sideways_adx_thresh': 6.967725440870979, 'sideways_atr_min_pct': 0.029940141889805986, 'sideways_atr_max_pct': 0.11002756726693218, 'sideways_tp_mult': 2.71465385261319, 'sideways_tsl_mult': 0.05824650796646158, 'sideways_time_stop': 35, 'sideways_use_sma': True, 'sideways_use_ema': True, 'sideways_use_atr': False, 'sideways_use_adx': True, 'sideways_use_spike': True, 'sideways_rsi_required': False}.
