[I 2025-08-31 03:30:26,844] Trial 199 finished with values: [-1000000000.0, 1000000000.0] and parameters: {'p_sma': 36, 'p_std': 20, 'p_atr': 8, 'p_adx': 23, 'rsi_period': 44, 'ema1': 17, 'ema2': 10, 'slip_atr_k': 0.022534706180740584, 'slip_spread_k': 0.008562554624936047, 'spread_hl_frac': 0.002244017314488265, 'bb_std_mult': 2.0498253395490633, 'rsi_os': 24, 'rsi_ob': 66, 'vol_spike': 0.12313990237319906, 'adx_thresh': 18.49298971973759, 'atr_min_pct': 0.023570165761706417, 'atr_max_pct': 0.02494175404296603, 'tp_mult': 2.5822943744573204, 'tsl_mult': 0.49668520935122645, 'strategy': 'breakout', 'time_stop': 32, 'use_sma': True, 'use_atr': True, 'use_adx': False, 'use_ema': False, 'use_spike': True, 'rsi_required': True, 'edge_k': 1.179820451564746, 'edge_cap': 0.08279255373980973, 'bull_strategy': 'breakout', 'bull_bb_std_mult': 1.3565106087614882, 'bull_rsi_os': 16, 'bull_rsi_ob': 77, 'bull_adx_thresh': 19.017113596278907, 'bull_atr_min_pct': 0.01626101904918699, 'bull_atr_max_pct': 0.025547333431539854, 'bull_tp_mult': 2.0334117881522107, 'bull_tsl_mult': 0.5244909266555882, 'bull_time_stop': 189, 'bull_use_sma': False, 'bull_use_ema': False, 'bull_use_atr': True, 'bull_use_adx': True, 'bull_use_spike': False, 'bull_rsi_required': True, 'bear_strategy': 'mean_reversion', 'bear_bb_std_mult': 1.9345832907572655, 'bear_rsi_os': 45, 'bear_rsi_ob': 81, 'bear_adx_thresh': 17.69609913991733, 'bear_atr_min_pct': 0.020967850633469894, 'bear_atr_max_pct': 0.08247444859235886, 'bear_tp_mult': 1.082304750785275, 'bear_tsl_mult': 0.7873668103077427, 'bear_time_stop': 250, 'bear_use_sma': True, 'bear_use_ema': False, 'bear_use_atr': False, 'bear_use_adx': False, 'bear_use_spike': True, 'bear_rsi_required': True, 'sideways_strategy': 'mean_reversion', 'sideways_bb_std_mult': 1.4564178417179574, 'sideways_rsi_os': 32, 'sideways_rsi_ob': 69, 'sideways_adx_thresh': 32.48291549729388, 'sideways_atr_min_pct': 0.017676401567116633, 'sideways_atr_max_pct': 0.07408015446455682, 'sideways_tp_mult': 2.386424631886454, 'sideways_tsl_mult': 0.3423605912789338, 'sideways_time_stop': 41, 'sideways_use_sma': True, 'sideways_use_ema': True, 'sideways_use_atr': True, 'sideways_use_adx': True, 'sideways_use_spike': True, 'sideways_rsi_required': False}.
[I 2025-08-31 03:30:27,344] Trial 198 finished with values: [-1000000000.0, 1000000000.0] and parameters: {'p_sma': 35, 'p_std': 25, 'p_atr': 8, 'p_adx': 14, 'rsi_period': 44, 'ema1': 17, 'ema2': 33, 'slip_atr_k': 0.019665626475557214, 'slip_spread_k': 0.20280318288238863, 'spread_hl_frac': 0.02585195299145901, 'bb_std_mult': 2.677212272027117, 'rsi_os': 24, 'rsi_ob': 57, 'vol_spike': 0.24866609176032312, 'adx_thresh': 19.67486470276383, 'atr_min_pct': 0.021969924362990154, 'atr_max_pct': 0.12379953241155889, 'tp_mult': 1.3689878008006087, 'tsl_mult': 0.5066831213397697, 'strategy': 'breakout', 'time_stop': 274, 'use_sma': True, 'use_atr': True, 'use_adx': False, 'use_ema': False, 'use_spike': True, 'rsi_required': True, 'edge_k': 1.5132836564362981, 'edge_cap': 0.15284338409651527, 'bull_strategy': 'breakout', 'bull_bb_std_mult': 3.1047515147851996, 'bull_rsi_os': 16, 'bull_rsi_ob': 67, 'bull_adx_thresh': 9.81638635219573, 'bull_atr_min_pct': 0.02348934480087414, 'bull_atr_max_pct': 0.025160098984645794, 'bull_tp_mult': 1.6397747156489695, 'bull_tsl_mult': 0.19445472131295222, 'bull_time_stop': 129, 'bull_use_sma': False, 'bull_use_ema': False, 'bull_use_atr': True, 'bull_use_adx': True, 'bull_use_spike': False, 'bull_rsi_required': True, 'bear_strategy': 'mean_reversion', 'bear_bb_std_mult': 2.706365793547019, 'bear_rsi_os': 52, 'bear_rsi_ob': 75, 'bear_adx_thresh': 21.666790822163872, 'bear_atr_min_pct': 0.015419142543613944, 'bear_atr_max_pct': 0.11644302006159019, 'bear_tp_mult': 1.086300141270887, 'bear_tsl_mult': 0.5108654605149219, 'bear_time_stop': 64, 'bear_use_sma': True, 'bear_use_ema': False, 'bear_use_atr': False, 'bear_use_adx': False, 'bear_use_spike': True, 'bear_rsi_required': True, 'sideways_strategy': 'mean_reversion', 'sideways_bb_std_mult': 1.5439298320811148, 'sideways_rsi_os': 39, 'sideways_rsi_ob': 82, 'sideways_adx_thresh': 7.317537277275333, 'sideways_atr_min_pct': 0.017591108698722137, 'sideways_atr_max_pct': 0.07375464572447558, 'sideways_tp_mult': 2.2511163900482645, 'sideways_tsl_mult': 0.31420602580155643, 'sideways_time_stop': 180, 'sideways_use_sma': True, 'sideways_use_ema': True, 'sideways_use_atr': True, 'sideways_use_adx': True, 'sideways_use_spike': True, 'sideways_rsi_required': False}.
[I 2025-08-31 03:30:27,375] Trial 200 finished with values: [-1000000000.0, 1000000000.0] and parameters: {'p_sma': 42, 'p_std': 33, 'p_atr': 11, 'p_adx': 24, 'rsi_period': 77, 'ema1': 17, 'ema2': 19, 'slip_atr_k': 0.020903047086052166, 'slip_spread_k': 0.7847725745833856, 'spread_hl_frac': 0.049755820613020856, 'bb_std_mult': 2.6929130104231906, 'rsi_os': 17, 'rsi_ob': 70, 'vol_spike': 0.012511989315952182, 'adx_thresh': 10.729830863768715, 'atr_min_pct': 0.022057240082161006, 'atr_max_pct': 0.0691106180141719, 'tp_mult': 1.6715571038068828, 'tsl_mult': 0.5712235679150243, 'strategy': 'breakout', 'time_stop': 190, 'use_sma': True, 'use_atr': True, 'use_adx': False, 'use_ema': False, 'use_spike': True, 'rsi_required': True, 'edge_k': 1.3331434860297076, 'edge_cap': 0.08585786230864638, 'bull_strategy': 'breakout', 'bull_bb_std_mult': 1.3735565575944828, 'bull_rsi_os': 15, 'bull_rsi_ob': 61, 'bull_adx_thresh': 19.12612822395995, 'bull_atr_min_pct': 0.002833054419285562, 'bull_atr_max_pct': 0.02510594650905558, 'bull_tp_mult': 1.6280698292106037, 'bull_tsl_mult': 0.7661700914532554, 'bull_time_stop': 187, 'bull_use_sma': False, 'bull_use_ema': False, 'bull_use_atr': True, 'bull_use_adx': True, 'bull_use_spike': False, 'bull_rsi_required': True, 'bear_strategy': 'mean_reversion', 'bear_bb_std_mult': 1.7227979693396862, 'bear_rsi_os': 14, 'bear_rsi_ob': 68, 'bear_adx_thresh': 17.65424805298362, 'bear_atr_min_pct': 0.013711718771672021, 'bear_atr_max_pct': 0.0694457223833027, 'bear_tp_mult': 2.164007524543841, 'bear_tsl_mult': 0.5471779048588076, 'bear_time_stop': 243, 'bear_use_sma': False, 'bear_use_ema': False, 'bear_use_atr': False, 'bear_use_adx': False, 'bear_use_spike': True, 'bear_rsi_required': True, 'sideways_strategy': 'mean_reversion', 'sideways_bb_std_mult': 2.8075140385372044, 'sideways_rsi_os': 39, 'sideways_rsi_ob': 82, 'sideways_adx_thresh': 7.33028348190461, 'sideways_atr_min_pct': 0.017410408122824073, 'sideways_atr_max_pct': 0.03551972791889795, 'sideways_tp_mult': 2.2474697846251837, 'sideways_tsl_mult': 0.997226746413467, 'sideways_time_stop': 87, 'sideways_use_sma': True, 'sideways_use_ema': True, 'sideways_use_atr': False, 'sideways_use_adx': True, 'sideways_use_spike': True, 'sideways_rsi_required': False}.
[I 2025-08-31 03:30:28,045] Trial 201 finished with values: [-1000000000.0, 1000000000.0] and parameters: {'p_sma': 46, 'p_std': 51, 'p_atr': 12, 'p_adx': 14, 'rsi_period': 77, 'ema1': 17, 'ema2': 23, 'slip_atr_k': 0.13553417312652488, 'slip_spread_k': 0.789221591010225, 'spread_hl_frac': 7.738502982589232e-05, 'bb_std_mult': 2.4093901498214714, 'rsi_os': 19, 'rsi_ob': 49, 'vol_spike': 0.010743818317551918, 'adx_thresh': 24.369236757194304, 'atr_min_pct': 0.022146306432642572, 'atr_max_pct': 0.025207276926032023, 'tp_mult': 1.8991801663753078, 'tsl_mult': 0.7346497506956126, 'strategy': 'breakout', 'time_stop': 31, 'use_sma': True, 'use_atr': True, 'use_adx': True, 'use_ema': False, 'use_spike': True, 'rsi_required': True, 'edge_k': 1.9885327749417643, 'edge_cap': 0.08915362415205498, 'bull_strategy': 'breakout', 'bull_bb_std_mult': 1.2481643331535313, 'bull_rsi_os': 15, 'bull_rsi_ob': 72, 'bull_adx_thresh': 19.12031361434774, 'bull_atr_min_pct': 0.016262604602521276, 'bull_atr_max_pct': 0.1231803535049765, 'bull_tp_mult': 1.6597487362394212, 'bull_tsl_mult': 0.08600235969523234, 'bull_time_stop': 69, 'bull_use_sma': False, 'bull_use_ema': False, 'bull_use_atr': True, 'bull_use_adx': True, 'bull_use_spike': False, 'bull_rsi_required': True, 'bear_strategy': 'mean_reversion', 'bear_bb_std_mult': 2.068577789859881, 'bear_rsi_os': 52, 'bear_rsi_ob': 68, 'bear_adx_thresh': 19.21972207746968, 'bear_atr_min_pct': 0.02364267409030476, 'bear_atr_max_pct': 0.08285592300373743, 'bear_tp_mult': 1.9925149938407627, 'bear_tsl_mult': 0.5786077275428625, 'bear_time_stop': 125, 'bear_use_sma': False, 'bear_use_ema': False, 'bear_use_atr': False, 'bear_use_adx': False, 'bear_use_spike': True, 'bear_rsi_required': True, 'sideways_strategy': 'breakout', 'sideways_bb_std_mult': 1.4254575541484509, 'sideways_rsi_os': 7, 'sideways_rsi_ob': 80, 'sideways_adx_thresh': 5.016278720118683, 'sideways_atr_min_pct': 0.002083410960271955, 'sideways_atr_max_pct': 0.036819738062794975, 'sideways_tp_mult': 2.6742857883235893, 'sideways_tsl_mult': 0.33398013658863346, 'sideways_time_stop': 42, 'sideways_use_sma': True, 'sideways_use_ema': True, 'sideways_use_atr': False, 'sideways_use_adx': True, 'sideways_use_spike': True, 'sideways_rsi_required': False}.
[I 2025-08-31 03:31:07,285] Trial 203 finished with values: [-1000000000.0, 1000000000.0] and parameters: {'p_sma': 6, 'p_std': 51, 'p_atr': 12, 'p_adx': 14, 'rsi_period': 72, 'ema1': 25, 'ema2': 23, 'slip_atr_k': 0.13507029808074694, 'slip_spread_k': 0.22663359637846972, 'spread_hl_frac': 0.00022160731063678254, 'bb_std_mult': 2.821592297861871, 'rsi_os': 14, 'rsi_ob': 64, 'vol_spike': 0.12343324542076141, 'adx_thresh': 24.483564944465808, 'atr_min_pct': 0.02310023345709712, 'atr_max_pct': 0.14739868401455652, 'tp_mult': 1.9087066576715825, 'tsl_mult': 0.527220723861602, 'strategy': 'breakout', 'time_stop': 33, 'use_sma': True, 'use_atr': True, 'use_adx': True, 'use_ema': False, 'use_spike': False, 'rsi_required': True, 'edge_k': 1.9898353126142778, 'edge_cap': 0.10895107716544289, 'bull_strategy': 'breakout', 'bull_bb_std_mult': 1.292875463840427, 'bull_rsi_os': 14, 'bull_rsi_ob': 72, 'bull_adx_thresh': 19.93424409933745, 'bull_atr_min_pct': 0.0010225643055389027, 'bull_atr_max_pct': 0.021709372972073038, 'bull_tp_mult': 2.2113637191870534, 'bull_tsl_mult': 0.33725671768476634, 'bull_time_stop': 118, 'bull_use_sma': False, 'bull_use_ema': False, 'bull_use_atr': True, 'bull_use_adx': False, 'bull_use_spike': False, 'bull_rsi_required': False, 'bear_strategy': 'mean_reversion', 'bear_bb_std_mult': 0.8138972672729403, 'bear_rsi_os': 28, 'bear_rsi_ob': 84, 'bear_adx_thresh': 19.087534082386924, 'bear_atr_min_pct': 0.023714048419472958, 'bear_atr_max_pct': 0.11582048782931822, 'bear_tp_mult': 2.193149716628978, 'bear_tsl_mult': 0.9050052238527223, 'bear_time_stop': 28, 'bear_use_sma': False, 'bear_use_ema': False, 'bear_use_atr': False, 'bear_use_adx': True, 'bear_use_spike': True, 'bear_rsi_required': True, 'sideways_strategy': 'breakout', 'sideways_bb_std_mult': 1.5692386477911031, 'sideways_rsi_os': 7, 'sideways_rsi_ob': 80, 'sideways_adx_thresh': 9.173141341218527, 'sideways_atr_min_pct': 0.002082391921752963, 'sideways_atr_max_pct': 0.11137085888012235, 'sideways_tp_mult': 1.1717159027043418, 'sideways_tsl_mult': 0.09519507583423337, 'sideways_time_stop': 33, 'sideways_use_sma': True, 'sideways_use_ema': True, 'sideways_use_atr': False, 'sideways_use_adx': True, 'sideways_use_spike': True, 'sideways_rsi_required': False}.
[I 2025-08-31 03:31:08,024] Trial 204 finished with values: [-1000000000.0, 1000000000.0] and parameters: {'p_sma': 6, 'p_std': 24, 'p_atr': 12, 'p_adx': 21, 'rsi_period': 73, 'ema1': 29, 'ema2': 23, 'slip_atr_k': 0.2353384808202764, 'slip_spread_k': 0.22434181245559268, 'spread_hl_frac': 0.000365135323046561, 'bb_std_mult': 1.7721982096219433, 'rsi_os': 11, 'rsi_ob': 64, 'vol_spike': 0.12460363910671926, 'adx_thresh': 24.274732084388503, 'atr_min_pct': 0.010247232189353968, 'atr_max_pct': 0.14745180926436652, 'tp_mult': 1.5831009216212302, 'tsl_mult': 0.532968726291729, 'strategy': 'breakout', 'time_stop': 33, 'use_sma': True, 'use_atr': True, 'use_adx': True, 'use_ema': False, 'use_spike': False, 'rsi_required': True, 'edge_k': 0.23941064688128968, 'edge_cap': 0.11572379794428336, 'bull_strategy': 'breakout', 'bull_bb_std_mult': 1.2525075564493267, 'bull_rsi_os': 27, 'bull_rsi_ob': 75, 'bull_adx_thresh': 5.312319365429287, 'bull_atr_min_pct': 0.000506342204024033, 'bull_atr_max_pct': 0.11443406636356179, 'bull_tp_mult': 2.5911134530880973, 'bull_tsl_mult': 0.33957284474748606, 'bull_time_stop': 118, 'bull_use_sma': False, 'bull_use_ema': False, 'bull_use_atr': True, 'bull_use_adx': False, 'bull_use_spike': False, 'bull_rsi_required': False, 'bear_strategy': 'mean_reversion', 'bear_bb_std_mult': 2.063510860641713, 'bear_rsi_os': 28, 'bear_rsi_ob': 84, 'bear_adx_thresh': 16.69074548365901, 'bear_atr_min_pct': 0.023301937313028945, 'bear_atr_max_pct': 0.11963419110620307, 'bear_tp_mult': 2.2008618934746997, 'bear_tsl_mult': 0.9028080254851334, 'bear_time_stop': 249, 'bear_use_sma': False, 'bear_use_ema': False, 'bear_use_atr': False, 'bear_use_adx': True, 'bear_use_spike': True, 'bear_rsi_required': True, 'sideways_strategy': 'breakout', 'sideways_bb_std_mult': 2.555496905819549, 'sideways_rsi_os': 7, 'sideways_rsi_ob': 95, 'sideways_adx_thresh': 9.422709337023802, 'sideways_atr_min_pct': 0.002148143094449894, 'sideways_atr_max_pct': 0.10057136399524554, 'sideways_tp_mult': 2.711126393885914, 'sideways_tsl_mult': 0.3773509491985715, 'sideways_time_stop': 33, 'sideways_use_sma': True, 'sideways_use_ema': True, 'sideways_use_atr': False, 'sideways_use_adx': True, 'sideways_use_spike': True, 'sideways_rsi_required': False}.
[I 2025-08-31 03:31:08,249] Trial 205 finished with values: [-0.018371332025708176, 0.01840969357172647] and parameters: {'p_sma': 40, 'p_std': 27, 'p_atr': 12, 'p_adx': 18, 'rsi_period': 72, 'ema1': 16, 'ema2': 38, 'slip_atr_k': 0.06856758295105944, 'slip_spread_k': 0.22660737790604668, 'spread_hl_frac': 0.0011697611783270103, 'bb_std_mult': 1.220694896458332, 'rsi_os': 15, 'rsi_ob': 64, 'vol_spike': 0.11401799774563075, 'adx_thresh': 25.27201065941257, 'atr_min_pct': 0.02414972202023276, 'atr_max_pct': 0.08202634384309274, 'tp_mult': 1.4555298265060777, 'tsl_mult': 0.5276398957968256, 'strategy': 'breakout', 'time_stop': 19, 'use_sma': True, 'use_atr': True, 'use_adx': True, 'use_ema': False, 'use_spike': False, 'rsi_required': True, 'edge_k': 0.09718196911062194, 'edge_cap': 0.11665287919186287, 'bull_strategy': 'breakout', 'bull_bb_std_mult': 1.495844097486175, 'bull_rsi_os': 27, 'bull_rsi_ob': 75, 'bull_adx_thresh': 19.882859547573982, 'bull_atr_min_pct': 0.0006643451306259738, 'bull_atr_max_pct': 0.02862886480066276, 'bull_tp_mult': 1.5035483702039056, 'bull_tsl_mult': 0.3343820616790788, 'bull_time_stop': 118, 'bull_use_sma': False, 'bull_use_ema': False, 'bull_use_atr': True, 'bull_use_adx': False, 'bull_use_spike': False, 'bull_rsi_required': False, 'bear_strategy': 'mean_reversion', 'bear_bb_std_mult': 2.2752794199460435, 'bear_rsi_os': 17, 'bear_rsi_ob': 84, 'bear_adx_thresh': 16.887959851771413, 'bear_atr_min_pct': 0.007594419377878824, 'bear_atr_max_pct': 0.1370565098826939, 'bear_tp_mult': 2.2074519812848297, 'bear_tsl_mult': 0.9500093423320447, 'bear_time_stop': 249, 'bear_use_sma': False, 'bear_use_ema': False, 'bear_use_atr': False, 'bear_use_adx': True, 'bear_use_spike': True, 'bear_rsi_required': True, 'sideways_strategy': 'breakout', 'sideways_bb_std_mult': 2.58898628784727, 'sideways_rsi_os': 37, 'sideways_rsi_ob': 79, 'sideways_adx_thresh': 9.327895187012308, 'sideways_atr_min_pct': 0.02999279896236475, 'sideways_atr_max_pct': 0.10050218332566163, 'sideways_tp_mult': 2.6928658490410666, 'sideways_tsl_mult': 0.37497761525851403, 'sideways_time_stop': 58, 'sideways_use_sma': True, 'sideways_use_ema': True, 'sideways_use_atr': False, 'sideways_use_adx': True, 'sideways_use_spike': True, 'sideways_rsi_required': False}.
[I 2025-08-31 03:31:08,506] Trial 202 finished with values: [-1000000000.0, 1000000000.0] and parameters: {'p_sma': 40, 'p_std': 52, 'p_atr': 11, 'p_adx': 24, 'rsi_period': 77, 'ema1': 16, 'ema2': 25, 'slip_atr_k': 0.17210261457525144, 'slip_spread_k': 0.7948233539095865, 'spread_hl_frac': 0.025911900218930414, 'bb_std_mult': 2.35913608172048, 'rsi_os': 17, 'rsi_ob': 57, 'vol_spike': 0.014500684934335817, 'adx_thresh': 19.643349916801338, 'atr_min_pct': 0.02197190824904179, 'atr_max_pct': 0.1471187771325903, 'tp_mult': 2.12442349541786, 'tsl_mult': 0.5773012153083221, 'strategy': 'breakout', 'time_stop': 189, 'use_sma': True, 'use_atr': True, 'use_adx': True, 'use_ema': False, 'use_spike': False, 'rsi_required': True, 'edge_k': 0.1015588397279994, 'edge_cap': 0.08376784669964642, 'bull_strategy': 'breakout', 'bull_bb_std_mult': 1.3057087140556543, 'bull_rsi_os': 13, 'bull_rsi_ob': 72, 'bull_adx_thresh': 5.168784686804804, 'bull_atr_min_pct': 0.01974538091191941, 'bull_atr_max_pct': 0.06255458083037833, 'bull_tp_mult': 1.4865936915306492, 'bull_tsl_mult': 0.6323550161752947, 'bull_time_stop': 170, 'bull_use_sma': False, 'bull_use_ema': False, 'bull_use_atr': True, 'bull_use_adx': False, 'bull_use_spike': False, 'bull_rsi_required': False, 'bear_strategy': 'mean_reversion', 'bear_bb_std_mult': 2.0611614705568506, 'bear_rsi_os': 28, 'bear_rsi_ob': 85, 'bear_adx_thresh': 17.00144780500396, 'bear_atr_min_pct': 0.02036199272259792, 'bear_atr_max_pct': 0.11607984499598624, 'bear_tp_mult': 2.15077655307427, 'bear_tsl_mult': 0.5794923440918895, 'bear_time_stop': 243, 'bear_use_sma': False, 'bear_use_ema': False, 'bear_use_atr': False, 'bear_use_adx': False, 'bear_use_spike': True, 'bear_rsi_required': True, 'sideways_strategy': 'breakout', 'sideways_bb_std_mult': 1.2875410410213821, 'sideways_rsi_os': 36, 'sideways_rsi_ob': 82, 'sideways_adx_thresh': 7.370048452326914, 'sideways_atr_min_pct': 0.0019944342047790906, 'sideways_atr_max_pct': 0.11076984473533635, 'sideways_tp_mult': 2.672416501878898, 'sideways_tsl_mult': 0.3186116025892736, 'sideways_time_stop': 107, 'sideways_use_sma': True, 'sideways_use_ema': True, 'sideways_use_atr': False, 'sideways_use_adx': True, 'sideways_use_spike': True, 'sideways_rsi_required': False}.
[I 2025-08-31 03:31:50,884] Trial 208 finished with values: [-1000000000.0, 1000000000.0] and parameters: {'p_sma': 57, 'p_std': 27, 'p_atr': 7, 'p_adx': 29, 'rsi_period': 78, 'ema1': 16, 'ema2': 42, 'slip_atr_k': 0.06707334556706482, 'slip_spread_k': 0.26342745699788384, 'spread_hl_frac': 0.027708425370254183, 'bb_std_mult': 1.9047427126893075, 'rsi_os': 48, 'rsi_ob': 66, 'vol_spike': 0.11616230359671557, 'adx_thresh': 23.545346609226865, 'atr_min_pct': 0.015346725387582907, 'atr_max_pct': 0.14342508630770573, 'tp_mult': 1.4673693384885227, 'tsl_mult': 0.8749869642400827, 'strategy': 'breakout', 'time_stop': 19, 'use_sma': True, 'use_atr': True, 'use_adx': True, 'use_ema': False, 'use_spike': False, 'rsi_required': True, 'edge_k': 1.7226876099838218, 'edge_cap': 0.12759355701454606, 'bull_strategy': 'breakout', 'bull_bb_std_mult': 1.4398031131827853, 'bull_rsi_os': 17, 'bull_rsi_ob': 74, 'bull_adx_thresh': 25.011729508139357, 'bull_atr_min_pct': 0.019844539662990865, 'bull_atr_max_pct': 0.07216777795291102, 'bull_tp_mult': 1.4834651392217675, 'bull_tsl_mult': 0.28230166169364057, 'bull_time_stop': 106, 'bull_use_sma': False, 'bull_use_ema': False, 'bull_use_atr': True, 'bull_use_adx': False, 'bull_use_spike': False, 'bull_rsi_required': True, 'bear_strategy': 'mean_reversion', 'bear_bb_std_mult': 2.2833085300851352, 'bear_rsi_os': 25, 'bear_rsi_ob': 85, 'bear_adx_thresh': 28.524276928805417, 'bear_atr_min_pct': 0.007541100553818047, 'bear_atr_max_pct': 0.07532734812642196, 'bear_tp_mult': 1.357900289495646, 'bear_tsl_mult': 0.39516090089120587, 'bear_time_stop': 94, 'bear_use_sma': False, 'bear_use_ema': False, 'bear_use_atr': True, 'bear_use_adx': False, 'bear_use_spike': True, 'bear_rsi_required': True, 'sideways_strategy': 'breakout', 'sideways_bb_std_mult': 1.3084669423679771, 'sideways_rsi_os': 37, 'sideways_rsi_ob': 79, 'sideways_adx_thresh': 7.986681101437535, 'sideways_atr_min_pct': 0.0028688422153089646, 'sideways_atr_max_pct': 0.11694098887936126, 'sideways_tp_mult': 2.749975876494206, 'sideways_tsl_mult': 0.303484934694919, 'sideways_time_stop': 291, 'sideways_use_sma': True, 'sideways_use_ema': True, 'sideways_use_atr': False, 'sideways_use_adx': True, 'sideways_use_spike': True, 'sideways_rsi_required': False}.
