[I 2025-08-31 03:23:42,359] Trial 152 finished with values: [-1000000000.0, 1000000000.0] and parameters: {'p_sma': 11, 'p_std': 23, 'p_atr': 13, 'p_adx': 30, 'rsi_period': 79, 'ema1': 16, 'ema2': 14, 'slip_atr_k': 0.09356381127183866, 'slip_spread_k': 0.2540075389745821, 'spread_hl_frac': 0.004293209463099695, 'bb_std_mult': 2.0572092837574827, 'rsi_os': 20, 'rsi_ob': 64, 'vol_spike': 0.12130085740996438, 'adx_thresh': 25.6290791011211, 'atr_min_pct': 0.013045457308936113, 'atr_max_pct': 0.14947021981054992, 'tp_mult': 1.4706111840021445, 'tsl_mult': 0.36377185881158647, 'strategy': 'breakout', 'time_stop': 30, 'use_sma': True, 'use_atr': True, 'use_adx': True, 'use_ema': False, 'use_spike': False, 'rsi_required': True, 'edge_k': 1.0158159132086166, 'edge_cap': 0.25588473231720793, 'bull_strategy': 'breakout', 'bull_bb_std_mult': 1.235759125039746, 'bull_rsi_os': 46, 'bull_rsi_ob': 62, 'bull_adx_thresh': 26.030125930064578, 'bull_atr_min_pct': 0.00039052050190874915, 'bull_atr_max_pct': 0.03710718918074138, 'bull_tp_mult': 1.5205929263910416, 'bull_tsl_mult': 0.3024808360477119, 'bull_time_stop': 127, 'bull_use_sma': True, 'bull_use_ema': True, 'bull_use_atr': False, 'bull_use_adx': False, 'bull_use_spike': False, 'bull_rsi_required': False, 'bear_strategy': 'mean_reversion', 'bear_bb_std_mult': 2.571115949228418, 'bear_rsi_os': 23, 'bear_rsi_ob': 84, 'bear_adx_thresh': 7.492729454518752, 'bear_atr_min_pct': 0.00765892614678745, 'bear_atr_max_pct': 0.12099447801415383, 'bear_tp_mult': 1.9915107484587768, 'bear_tsl_mult': 0.07100708066134959, 'bear_time_stop': 244, 'bear_use_sma': False, 'bear_use_ema': False, 'bear_use_atr': True, 'bear_use_adx': True, 'bear_use_spike': False, 'bear_rsi_required': True, 'sideways_strategy': 'mean_reversion', 'sideways_bb_std_mult': 3.2266482025946006, 'sideways_rsi_os': 38, 'sideways_rsi_ob': 77, 'sideways_adx_thresh': 5.6006928648417835, 'sideways_atr_min_pct': 0.0030593845407473168, 'sideways_atr_max_pct': 0.04833305239902645, 'sideways_tp_mult': 2.7480379995493327, 'sideways_tsl_mult': 0.3580805679269624, 'sideways_time_stop': 114, 'sideways_use_sma': True, 'sideways_use_ema': True, 'sideways_use_atr': False, 'sideways_use_adx': True, 'sideways_use_spike': True, 'sideways_rsi_required': False}.
[I 2025-08-31 03:24:14,736] Trial 157 finished with values: [-1000000000.0, 1000000000.0] and parameters: {'p_sma': 15, 'p_std': 58, 'p_atr': 12, 'p_adx': 13, 'rsi_period': 73, 'ema1': 15, 'ema2': 20, 'slip_atr_k': 0.2432351611823857, 'slip_spread_k': 0.21546766432741432, 'spread_hl_frac': 0.0007480172579793869, 'bb_std_mult': 1.845617705511778, 'rsi_os': 16, 'rsi_ob': 60, 'vol_spike': 0.14165052962648553, 'adx_thresh': 24.1183759464607, 'atr_min_pct': 0.02345375954456993, 'atr_max_pct': 0.1351564822188885, 'tp_mult': 1.5238776039466349, 'tsl_mult': 0.9572911779083966, 'strategy': 'breakout', 'time_stop': 55, 'use_sma': True, 'use_atr': True, 'use_adx': False, 'use_ema': False, 'use_spike': True, 'rsi_required': True, 'edge_k': 0.16545065263949355, 'edge_cap': 0.45253411821982836, 'bull_strategy': 'breakout', 'bull_bb_std_mult': 1.5776474141528094, 'bull_rsi_os': 51, 'bull_rsi_ob': 75, 'bull_adx_thresh': 20.760305648223365, 'bull_atr_min_pct': 0.002699168569946018, 'bull_atr_max_pct': 0.010853409944601843, 'bull_tp_mult': 1.40367459766847, 'bull_tsl_mult': 0.3368752405852619, 'bull_time_stop': 273, 'bull_use_sma': False, 'bull_use_ema': False, 'bull_use_atr': True, 'bull_use_adx': True, 'bull_use_spike': True, 'bull_rsi_required': True, 'bear_strategy': 'mean_reversion', 'bear_bb_std_mult': 2.3577331266282164, 'bear_rsi_os': 20, 'bear_rsi_ob': 87, 'bear_adx_thresh': 17.072500485846067, 'bear_atr_min_pct': 0.00857164548286243, 'bear_atr_max_pct': 0.11066055435154115, 'bear_tp_mult': 2.11574579078533, 'bear_tsl_mult': 0.6015832242398225, 'bear_time_stop': 255, 'bear_use_sma': False, 'bear_use_ema': True, 'bear_use_atr': False, 'bear_use_adx': False, 'bear_use_spike': True, 'bear_rsi_required': True, 'sideways_strategy': 'breakout', 'sideways_bb_std_mult': 2.184539702781769, 'sideways_rsi_os': 50, 'sideways_rsi_ob': 79, 'sideways_adx_thresh': 9.405963123870904, 'sideways_atr_min_pct': 0.0038813203140842735, 'sideways_atr_max_pct': 0.13577755488755583, 'sideways_tp_mult': 2.6339822758320643, 'sideways_tsl_mult': 0.4002763777688033, 'sideways_time_stop': 44, 'sideways_use_sma': True, 'sideways_use_ema': False, 'sideways_use_atr': False, 'sideways_use_adx': True, 'sideways_use_spike': True, 'sideways_rsi_required': False}.
[I 2025-08-31 03:24:14,838] Trial 156 finished with values: [-1000000000.0, 1000000000.0] and parameters: {'p_sma': 15, 'p_std': 21, 'p_atr': 12, 'p_adx': 30, 'rsi_period': 82, 'ema1': 15, 'ema2': 20, 'slip_atr_k': 0.09494757333431522, 'slip_spread_k': 0.2178406495839282, 'spread_hl_frac': 0.0009373381807864247, 'bb_std_mult': 2.055404617686256, 'rsi_os': 5, 'rsi_ob': 63, 'vol_spike': 0.14144665643679397, 'adx_thresh': 25.71697878607051, 'atr_min_pct': 0.0038586666447190197, 'atr_max_pct': 0.13637335357861288, 'tp_mult': 1.5274949082961804, 'tsl_mult': 0.5160516657849088, 'strategy': 'breakout', 'time_stop': 35, 'use_sma': True, 'use_atr': True, 'use_adx': False, 'use_ema': False, 'use_spike': True, 'rsi_required': True, 'edge_k': 1.2989700808045919, 'edge_cap': 0.20067359639923654, 'bull_strategy': 'breakout', 'bull_bb_std_mult': 1.570969845775552, 'bull_rsi_os': 46, 'bull_rsi_ob': 63, 'bull_adx_thresh': 20.585702433220852, 'bull_atr_min_pct': 0.0011475116518864948, 'bull_atr_max_pct': 0.011530239116797458, 'bull_tp_mult': 1.415515812738, 'bull_tsl_mult': 0.325279552412562, 'bull_time_stop': 273, 'bull_use_sma': False, 'bull_use_ema': False, 'bull_use_atr': True, 'bull_use_adx': True, 'bull_use_spike': True, 'bull_rsi_required': True, 'bear_strategy': 'mean_reversion', 'bear_bb_std_mult': 2.197140056132544, 'bear_rsi_os': 20, 'bear_rsi_ob': 80, 'bear_adx_thresh': 16.97902449054594, 'bear_atr_min_pct': 0.02348443487154456, 'bear_atr_max_pct': 0.11842362779280415, 'bear_tp_mult': 2.12891668545316, 'bear_tsl_mult': 0.5972394187858276, 'bear_time_stop': 258, 'bear_use_sma': False, 'bear_use_ema': True, 'bear_use_atr': False, 'bear_use_adx': False, 'bear_use_spike': True, 'bear_rsi_required': True, 'sideways_strategy': 'breakout', 'sideways_bb_std_mult': 1.6871729834876596, 'sideways_rsi_os': 47, 'sideways_rsi_ob': 79, 'sideways_adx_thresh': 6.574822928301034, 'sideways_atr_min_pct': 0.004381775020278323, 'sideways_atr_max_pct': 0.044300091816317694, 'sideways_tp_mult': 2.635756961682917, 'sideways_tsl_mult': 0.3615987517023385, 'sideways_time_stop': 41, 'sideways_use_sma': True, 'sideways_use_ema': False, 'sideways_use_atr': False, 'sideways_use_adx': True, 'sideways_use_spike': True, 'sideways_rsi_required': False}.
[I 2025-08-31 03:24:15,503] Trial 154 finished with values: [-1000000000.0, 1000000000.0] and parameters: {'p_sma': 16, 'p_std': 23, 'p_atr': 12, 'p_adx': 27, 'rsi_period': 78, 'ema1': 16, 'ema2': 20, 'slip_atr_k': 0.031432120888363585, 'slip_spread_k': 0.2535306741469638, 'spread_hl_frac': 0.0035097262865342385, 'bb_std_mult': 1.9839144595718725, 'rsi_os': 20, 'rsi_ob': 64, 'vol_spike': 0.12301038124898152, 'adx_thresh': 24.79309918887327, 'atr_min_pct': 0.02307711285084651, 'atr_max_pct': 0.14749746343853723, 'tp_mult': 1.470671557787746, 'tsl_mult': 0.5291381872161973, 'strategy': 'breakout', 'time_stop': 30, 'use_sma': True, 'use_atr': True, 'use_adx': True, 'use_ema': False, 'use_spike': False, 'rsi_required': True, 'edge_k': 0.47432901366946995, 'edge_cap': 0.2647710106346593, 'bull_strategy': 'breakout', 'bull_bb_std_mult': 1.2014233509556993, 'bull_rsi_os': 29, 'bull_rsi_ob': 45, 'bull_adx_thresh': 19.95104662298923, 'bull_atr_min_pct': 0.002647520340703516, 'bull_atr_max_pct': 0.012832088207614377, 'bull_tp_mult': 1.5093015295927827, 'bull_tsl_mult': 0.28730536416396674, 'bull_time_stop': 125, 'bull_use_sma': True, 'bull_use_ema': True, 'bull_use_atr': False, 'bull_use_adx': False, 'bull_use_spike': False, 'bull_rsi_required': True, 'bear_strategy': 'mean_reversion', 'bear_bb_std_mult': 2.02855203214241, 'bear_rsi_os': 22, 'bear_rsi_ob': 84, 'bear_adx_thresh': 17.96756000577872, 'bear_atr_min_pct': 0.008474094253667653, 'bear_atr_max_pct': 0.12095312616629789, 'bear_tp_mult': 2.218691024333118, 'bear_tsl_mult': 0.975167611614742, 'bear_time_stop': 262, 'bear_use_sma': False, 'bear_use_ema': False, 'bear_use_atr': True, 'bear_use_adx': False, 'bear_use_spike': False, 'bear_rsi_required': True, 'sideways_strategy': 'mean_reversion', 'sideways_bb_std_mult': 1.6144850560751303, 'sideways_rsi_os': 38, 'sideways_rsi_ob': 81, 'sideways_adx_thresh': 5.482618955963809, 'sideways_atr_min_pct': 0.0028812560860321523, 'sideways_atr_max_pct': 0.12838080930818563, 'sideways_tp_mult': 2.7601903265452012, 'sideways_tsl_mult': 0.3616987928015364, 'sideways_time_stop': 198, 'sideways_use_sma': True, 'sideways_use_ema': True, 'sideways_use_atr': False, 'sideways_use_adx': True, 'sideways_use_spike': True, 'sideways_rsi_required': False}.
[I 2025-08-31 03:24:15,782] Trial 155 finished with values: [-1000000000.0, 1000000000.0] and parameters: {'p_sma': 16, 'p_std': 23, 'p_atr': 12, 'p_adx': 30, 'rsi_period': 73, 'ema1': 15, 'ema2': 18, 'slip_atr_k': 0.09289245868919159, 'slip_spread_k': 0.2623836872542759, 'spread_hl_frac': 0.0006811252285607288, 'bb_std_mult': 2.014384374378689, 'rsi_os': 11, 'rsi_ob': 62, 'vol_spike': 0.12253239224460823, 'adx_thresh': 24.97493838361775, 'atr_min_pct': 0.011783418561533109, 'atr_max_pct': 0.13518690216801676, 'tp_mult': 1.5110405030745733, 'tsl_mult': 0.5367916970361553, 'strategy': 'breakout', 'time_stop': 28, 'use_sma': True, 'use_atr': True, 'use_adx': False, 'use_ema': False, 'use_spike': False, 'rsi_required': True, 'edge_k': 0.36480500448806447, 'edge_cap': 0.19522334601868835, 'bull_strategy': 'breakout', 'bull_bb_std_mult': 1.5609864680028034, 'bull_rsi_os': 16, 'bull_rsi_ob': 75, 'bull_adx_thresh': 20.058537418383146, 'bull_atr_min_pct': 0.002741782754771581, 'bull_atr_max_pct': 0.013276378621843346, 'bull_tp_mult': 1.5040341510185917, 'bull_tsl_mult': 0.3359637572174252, 'bull_time_stop': 130, 'bull_use_sma': False, 'bull_use_ema': False, 'bull_use_atr': True, 'bull_use_adx': False, 'bull_use_spike': True, 'bull_rsi_required': True, 'bear_strategy': 'mean_reversion', 'bear_bb_std_mult': 2.0354586413204987, 'bear_rsi_os': 23, 'bear_rsi_ob': 83, 'bear_adx_thresh': 17.042594623830258, 'bear_atr_min_pct': 0.0076631603527790885, 'bear_atr_max_pct': 0.12043793616674518, 'bear_tp_mult': 2.12057405808083, 'bear_tsl_mult': 0.5029816783958312, 'bear_time_stop': 260, 'bear_use_sma': False, 'bear_use_ema': False, 'bear_use_atr': False, 'bear_use_adx': False, 'bear_use_spike': True, 'bear_rsi_required': True, 'sideways_strategy': 'breakout', 'sideways_bb_std_mult': 3.182708046378992, 'sideways_rsi_os': 37, 'sideways_rsi_ob': 81, 'sideways_adx_thresh': 6.56333104016296, 'sideways_atr_min_pct': 0.004038840542727771, 'sideways_atr_max_pct': 0.136673086349672, 'sideways_tp_mult': 2.642029508434688, 'sideways_tsl_mult': 0.3675348654793428, 'sideways_time_stop': 48, 'sideways_use_sma': True, 'sideways_use_ema': True, 'sideways_use_atr': False, 'sideways_use_adx': True, 'sideways_use_spike': True, 'sideways_rsi_required': False}.
[I 2025-08-31 03:24:48,225] Trial 158 finished with values: [-1000000000.0, 1000000000.0] and parameters: {'p_sma': 10, 'p_std': 24, 'p_atr': 12, 'p_adx': 11, 'rsi_period': 76, 'ema1': 5, 'ema2': 39, 'slip_atr_k': 0.01674405812018405, 'slip_spread_k': 0.20184834656229125, 'spread_hl_frac': 0.0025873258849559936, 'bb_std_mult': 1.9596142700994814, 'rsi_os': 13, 'rsi_ob': 62, 'vol_spike': 0.11782035828517923, 'adx_thresh': 6.995089101842357, 'atr_min_pct': 0.02817509267974503, 'atr_max_pct': 0.14059975306346348, 'tp_mult': 1.3994391176421455, 'tsl_mult': 0.26624149367114447, 'strategy': 'breakout', 'time_stop': 12, 'use_sma': True, 'use_atr': True, 'use_adx': True, 'use_ema': False, 'use_spike': False, 'rsi_required': True, 'edge_k': 0.9501067264407527, 'edge_cap': 0.1720698545092949, 'bull_strategy': 'breakout', 'bull_bb_std_mult': 1.346592038997152, 'bull_rsi_os': 53, 'bull_rsi_ob': 77, 'bull_adx_thresh': 18.87156774142085, 'bull_atr_min_pct': 0.02217912533957256, 'bull_atr_max_pct': 0.028023189845269664, 'bull_tp_mult': 2.6697644394170776, 'bull_tsl_mult': 0.3922454863382368, 'bull_time_stop': 114, 'bull_use_sma': False, 'bull_use_ema': False, 'bull_use_atr': True, 'bull_use_adx': False, 'bull_use_spike': False, 'bull_rsi_required': True, 'bear_strategy': 'breakout', 'bear_bb_std_mult': 2.454629028849177, 'bear_rsi_os': 27, 'bear_rsi_ob': 83, 'bear_adx_thresh': 15.922242033987645, 'bear_atr_min_pct': 0.00802678798010945, 'bear_atr_max_pct': 0.113669251174615, 'bear_tp_mult': 2.2143282958731003, 'bear_tsl_mult': 0.9725738478802383, 'bear_time_stop': 230, 'bear_use_sma': False, 'bear_use_ema': False, 'bear_use_atr': False, 'bear_use_adx': False, 'bear_use_spike': True, 'bear_rsi_required': True, 'sideways_strategy': 'breakout', 'sideways_bb_std_mult': 1.5766923618260433, 'sideways_rsi_os': 6, 'sideways_rsi_ob': 83, 'sideways_adx_thresh': 7.516825577487327, 'sideways_atr_min_pct': 0.002327215958200072, 'sideways_atr_max_pct': 0.11839783752479091, 'sideways_tp_mult': 2.4512779690775224, 'sideways_tsl_mult': 0.3044230435907824, 'sideways_time_stop': 199, 'sideways_use_sma': False, 'sideways_use_ema': True, 'sideways_use_atr': False, 'sideways_use_adx': True, 'sideways_use_spike': False, 'sideways_rsi_required': False}.
[I 2025-08-31 03:24:48,424] Trial 160 finished with values: [-1000000000.0, 1000000000.0] and parameters: {'p_sma': 20, 'p_std': 24, 'p_atr': 11, 'p_adx': 11, 'rsi_period': 20, 'ema1': 7, 'ema2': 18, 'slip_atr_k': 0.019955673786071132, 'slip_spread_k': 0.1902178143140571, 'spread_hl_frac': 0.0023313589958061432, 'bb_std_mult': 2.1316262329871005, 'rsi_os': 12, 'rsi_ob': 62, 'vol_spike': 0.09896967195205542, 'adx_thresh': 7.630599102097552, 'atr_min_pct': 0.02475731147762316, 'atr_max_pct': 0.13995445942145143, 'tp_mult': 1.593956301290795, 'tsl_mult': 0.5041812974711501, 'strategy': 'mean_reversion', 'time_stop': 11, 'use_sma': True, 'use_atr': True, 'use_adx': True, 'use_ema': True, 'use_spike': False, 'rsi_required': True, 'edge_k': 0.3677110515490436, 'edge_cap': 0.21762700999551315, 'bull_strategy': 'breakout', 'bull_bb_std_mult': 1.517883275299535, 'bull_rsi_os': 53, 'bull_rsi_ob': 57, 'bull_adx_thresh': 18.91624033558635, 'bull_atr_min_pct': 0.022529345170626356, 'bull_atr_max_pct': 0.02658334599147128, 'bull_tp_mult': 1.4674549990918608, 'bull_tsl_mult': 0.35317539645255736, 'bull_time_stop': 112, 'bull_use_sma': False, 'bull_use_ema': False, 'bull_use_atr': True, 'bull_use_adx': False, 'bull_use_spike': False, 'bull_rsi_required': True, 'bear_strategy': 'breakout', 'bear_bb_std_mult': 2.432478878595102, 'bear_rsi_os': 25, 'bear_rsi_ob': 66, 'bear_adx_thresh': 15.776513621012652, 'bear_atr_min_pct': 0.009309139155893594, 'bear_atr_max_pct': 0.11514388162611351, 'bear_tp_mult': 2.005956021425709, 'bear_tsl_mult': 0.9394686192214482, 'bear_time_stop': 242, 'bear_use_sma': False, 'bear_use_ema': False, 'bear_use_atr': False, 'bear_use_adx': False, 'bear_use_spike': True, 'bear_rsi_required': True, 'sideways_strategy': 'breakout', 'sideways_bb_std_mult': 3.4242762799084328, 'sideways_rsi_os': 11, 'sideways_rsi_ob': 83, 'sideways_adx_thresh': 7.642342762896659, 'sideways_atr_min_pct': 0.002183073051676081, 'sideways_atr_max_pct': 0.11871018975740641, 'sideways_tp_mult': 2.595201407131506, 'sideways_tsl_mult': 0.26245064696571274, 'sideways_time_stop': 28, 'sideways_use_sma': False, 'sideways_use_ema': True, 'sideways_use_atr': True, 'sideways_use_adx': True, 'sideways_use_spike': False, 'sideways_rsi_required': True}.
[I 2025-08-31 03:24:48,428] Trial 161 finished with values: [-1000000000.0, 1000000000.0] and parameters: {'p_sma': 35, 'p_std': 20, 'p_atr': 7, 'p_adx': 7, 'rsi_period': 28, 'ema1': 5, 'ema2': 22, 'slip_atr_k': 0.022092675136283612, 'slip_spread_k': 0.20033547260227275, 'spread_hl_frac': 0.002459059612756277, 'bb_std_mult': 2.102475292859542, 'rsi_os': 23, 'rsi_ob': 66, 'vol_spike': 0.09909777795333295, 'adx_thresh': 9.067839816520708, 'atr_min_pct': 0.024561482857138283, 'atr_max_pct': 0.1406268050460025, 'tp_mult': 1.626091371165323, 'tsl_mult': 0.24911635095772933, 'strategy': 'mean_reversion', 'time_stop': 10, 'use_sma': True, 'use_atr': True, 'use_adx': True, 'use_ema': True, 'use_spike': False, 'rsi_required': True, 'edge_k': 0.9553870194586889, 'edge_cap': 0.22524316004198414, 'bull_strategy': 'mean_reversion', 'bull_bb_std_mult': 1.3562707437767227, 'bull_rsi_os': 17, 'bull_rsi_ob': 77, 'bull_adx_thresh': 18.94737537255181, 'bull_atr_min_pct': 0.022843216480909374, 'bull_atr_max_pct': 0.026399642201623795, 'bull_tp_mult': 2.690037688568006, 'bull_tsl_mult': 0.3864804749811739, 'bull_time_stop': 112, 'bull_use_sma': False, 'bull_use_ema': False, 'bull_use_atr': True, 'bull_use_adx': False, 'bull_use_spike': False, 'bull_rsi_required': True, 'bear_strategy': 'breakout', 'bear_bb_std_mult': 2.421581921519772, 'bear_rsi_os': 26, 'bear_rsi_ob': 66, 'bear_adx_thresh': 15.463194481197196, 'bear_atr_min_pct': 0.009406964278936603, 'bear_atr_max_pct': 0.11544458195420768, 'bear_tp_mult': 2.026319625017522, 'bear_tsl_mult': 0.9371115590936219, 'bear_time_stop': 241, 'bear_use_sma': True, 'bear_use_ema': False, 'bear_use_atr': False, 'bear_use_adx': False, 'bear_use_spike': True, 'bear_rsi_required': True, 'sideways_strategy': 'breakout', 'sideways_bb_std_mult': 1.1570197839995982, 'sideways_rsi_os': 35, 'sideways_rsi_ob': 82, 'sideways_adx_thresh': 8.368109564383373, 'sideways_atr_min_pct': 0.024273434383349994, 'sideways_atr_max_pct': 0.12092226652014561, 'sideways_tp_mult': 2.584394772483388, 'sideways_tsl_mult': 0.3084403106080482, 'sideways_time_stop': 29, 'sideways_use_sma': False, 'sideways_use_ema': True, 'sideways_use_atr': True, 'sideways_use_adx': False, 'sideways_use_spike': False, 'sideways_rsi_required': True}.
[I 2025-08-31 03:24:48,659] Trial 159 finished with values: [-1000000000.0, 1000000000.0] and parameters: {'p_sma': 39, 'p_std': 24, 'p_atr': 12, 'p_adx': 11, 'rsi_period': 76, 'ema1': 17, 'ema2': 18, 'slip_atr_k': 0.06666454812187211, 'slip_spread_k': 0.19307740187308225, 'spread_hl_frac': 0.0025420022594389072, 'bb_std_mult': 2.000318983835248, 'rsi_os': 12, 'rsi_ob': 62, 'vol_spike': 0.09781799234874473, 'adx_thresh': 24.699434679248807, 'atr_min_pct': 0.024617334486034044, 'atr_max_pct': 0.14572888526229474, 'tp_mult': 1.3961293140997504, 'tsl_mult': 0.25051713624687144, 'strategy': 'breakout', 'time_stop': 24, 'use_sma': True, 'use_atr': True, 'use_adx': True, 'use_ema': False, 'use_spike': False, 'rsi_required': True, 'edge_k': 0.3429805701052583, 'edge_cap': 0.9526768172691715, 'bull_strategy': 'breakout', 'bull_bb_std_mult': 1.3622017260283064, 'bull_rsi_os': 17, 'bull_rsi_ob': 77, 'bull_adx_thresh': 20.13231630643898, 'bull_atr_min_pct': 0.002222403289309234, 'bull_atr_max_pct': 0.022660782420087837, 'bull_tp_mult': 1.4802140227578084, 'bull_tsl_mult': 0.3965260175363502, 'bull_time_stop': 115, 'bull_use_sma': False, 'bull_use_ema': False, 'bull_use_atr': True, 'bull_use_adx': False, 'bull_use_spike': False, 'bull_rsi_required': True, 'bear_strategy': 'breakout', 'bear_bb_std_mult': 2.4275640227123714, 'bear_rsi_os': 27, 'bear_rsi_ob': 66, 'bear_adx_thresh': 23.44410918947782, 'bear_atr_min_pct': 0.009451956361813181, 'bear_atr_max_pct': 0.11497590053248757, 'bear_tp_mult': 2.202203417167795, 'bear_tsl_mult': 0.9638234091762231, 'bear_time_stop': 246, 'bear_use_sma': False, 'bear_use_ema': False, 'bear_use_atr': False, 'bear_use_adx': False, 'bear_use_spike': True, 'bear_rsi_required': True, 'sideways_strategy': 'breakout', 'sideways_bb_std_mult': 1.5585018412363434, 'sideways_rsi_os': 35, 'sideways_rsi_ob': 83, 'sideways_adx_thresh': 7.7230936381713144, 'sideways_atr_min_pct': 0.011470901826981246, 'sideways_atr_max_pct': 0.1291796842901729, 'sideways_tp_mult': 2.70634029544362, 'sideways_tsl_mult': 0.2551231574391134, 'sideways_time_stop': 196, 'sideways_use_sma': False, 'sideways_use_ema': True, 'sideways_use_atr': False, 'sideways_use_adx': True, 'sideways_use_spike': False, 'sideways_rsi_required': False}.
