[I 2025-08-31 03:16:29,991] Trial 101 finished with values: [-0.04972624679793902, 0.04956132618133078] and parameters: {'p_sma': 29, 'p_std': 41, 'p_atr': 18, 'p_adx': 13, 'rsi_period': 82, 'ema1': 15, 'ema2': 40, 'slip_atr_k': 0.023008716497466983, 'slip_spread_k': 0.20646246259234513, 'spread_hl_frac': 0.026399581790234446, 'bb_std_mult': 2.062153853363654, 'rsi_os': 15, 'rsi_ob': 90, 'vol_spike': 0.07286866007073743, 'adx_thresh': 13.934660363722053, 'atr_min_pct': 0.02354976813829471, 'atr_max_pct': 0.11152547328787424, 'tp_mult': 2.8402573555894426, 'tsl_mult': 0.8125312473718113, 'strategy': 'breakout', 'time_stop': 65, 'use_sma': True, 'use_atr': True, 'use_adx': False, 'use_ema': False, 'use_spike': False, 'rsi_required': True, 'edge_k': 1.229811265568904, 'edge_cap': 0.09423893320383524, 'bull_strategy': 'mean_reversion', 'bull_bb_std_mult': 2.302350746857927, 'bull_rsi_os': 20, 'bull_rsi_ob': 54, 'bull_adx_thresh': 6.2434191435525435, 'bull_atr_min_pct': 0.01739710411634786, 'bull_atr_max_pct': 0.05400684264954979, 'bull_tp_mult': 1.4955429850232167, 'bull_tsl_mult': 0.007952094735282855, 'bull_time_stop': 124, 'bull_use_sma': True, 'bull_use_ema': False, 'bull_use_atr': True, 'bull_use_adx': False, 'bull_use_spike': False, 'bull_rsi_required': True, 'bear_strategy': 'breakout', 'bear_bb_std_mult': 0.7368914270982505, 'bear_rsi_os': 55, 'bear_rsi_ob': 86, 'bear_adx_thresh': 18.553015189186766, 'bear_atr_min_pct': 0.0003353062048998025, 'bear_atr_max_pct': 0.045952766789180595, 'bear_tp_mult': 1.7176142866542945, 'bear_tsl_mult': 0.3313643090406526, 'bear_time_stop': 196, 'bear_use_sma': False, 'bear_use_ema': True, 'bear_use_atr': False, 'bear_use_adx': True, 'bear_use_spike': False, 'bear_rsi_required': False, 'sideways_strategy': 'mean_reversion', 'sideways_bb_std_mult': 1.5530999364358218, 'sideways_rsi_os': 35, 'sideways_rsi_ob': 57, 'sideways_adx_thresh': 23.144599318069698, 'sideways_atr_min_pct': 0.018208003678772722, 'sideways_atr_max_pct': 0.09259795889465659, 'sideways_tp_mult': 2.6893486955050543, 'sideways_tsl_mult': 0.8377545811586321, 'sideways_time_stop': 11, 'sideways_use_sma': False, 'sideways_use_ema': False, 'sideways_use_atr': False, 'sideways_use_adx': True, 'sideways_use_spike': False, 'sideways_rsi_required': False}.
[I 2025-08-31 03:16:30,032] Trial 99 finished with values: [-1000000000.0, 1000000000.0] and parameters: {'p_sma': 11, 'p_std': 36, 'p_atr': 13, 'p_adx': 13, 'rsi_period': 80, 'ema1': 15, 'ema2': 49, 'slip_atr_k': 0.023442914912667104, 'slip_spread_k': 0.5462448095113954, 'spread_hl_frac': 0.018539651610710122, 'bb_std_mult': 2.1127862149480534, 'rsi_os': 9, 'rsi_ob': 90, 'vol_spike': 0.1611958048426528, 'adx_thresh': 24.05706440891656, 'atr_min_pct': 0.02365456234119878, 'atr_max_pct': 0.08828961801148105, 'tp_mult': 2.4571882289510647, 'tsl_mult': 0.38960162219101613, 'strategy': 'mean_reversion', 'time_stop': 65, 'use_sma': False, 'use_atr': True, 'use_adx': False, 'use_ema': False, 'use_spike': True, 'rsi_required': True, 'edge_k': 1.6555487148489674, 'edge_cap': 0.5747674709960345, 'bull_strategy': 'mean_reversion', 'bull_bb_std_mult': 1.9906150342990823, 'bull_rsi_os': 32, 'bull_rsi_ob': 93, 'bull_adx_thresh': 21.90402659235709, 'bull_atr_min_pct': 0.024156109968834726, 'bull_atr_max_pct': 0.05746020356143626, 'bull_tp_mult': 1.7729773793183021, 'bull_tsl_mult': 0.9592884988027266, 'bull_time_stop': 121, 'bull_use_sma': True, 'bull_use_ema': True, 'bull_use_atr': True, 'bull_use_adx': False, 'bull_use_spike': False, 'bull_rsi_required': False, 'bear_strategy': 'breakout', 'bear_bb_std_mult': 0.7114368449848947, 'bear_rsi_os': 33, 'bear_rsi_ob': 77, 'bear_adx_thresh': 18.657332089414595, 'bear_atr_min_pct': 0.0004968463389062993, 'bear_atr_max_pct': 0.05235965414131123, 'bear_tp_mult': 1.7190210320802999, 'bear_tsl_mult': 0.032594234228384755, 'bear_time_stop': 137, 'bear_use_sma': False, 'bear_use_ema': True, 'bear_use_atr': True, 'bear_use_adx': False, 'bear_use_spike': False, 'bear_rsi_required': False, 'sideways_strategy': 'mean_reversion', 'sideways_bb_std_mult': 1.346499419912293, 'sideways_rsi_os': 37, 'sideways_rsi_ob': 48, 'sideways_adx_thresh': 21.427362664073385, 'sideways_atr_min_pct': 0.018821823805698377, 'sideways_atr_max_pct': 0.10529190102992197, 'sideways_tp_mult': 1.3819583036602965, 'sideways_tsl_mult': 0.706244802084053, 'sideways_time_stop': 27, 'sideways_use_sma': False, 'sideways_use_ema': False, 'sideways_use_atr': False, 'sideways_use_adx': True, 'sideways_use_spike': True, 'sideways_rsi_required': False}.
[I 2025-08-31 03:16:30,177] Trial 97 finished with values: [-0.09143121081667227, 0.09151382176219448] and parameters: {'p_sma': 25, 'p_std': 52, 'p_atr': 13, 'p_adx': 13, 'rsi_period': 48, 'ema1': 10, 'ema2': 15, 'slip_atr_k': 0.1201427869627941, 'slip_spread_k': 0.5431423369522675, 'spread_hl_frac': 0.015507323658979185, 'bb_std_mult': 0.956898282128074, 'rsi_os': 38, 'rsi_ob': 53, 'vol_spike': 0.07510541378223207, 'adx_thresh': 28.08851871699503, 'atr_min_pct': 0.019743644089005627, 'atr_max_pct': 0.06149744467020882, 'tp_mult': 2.4660698833881103, 'tsl_mult': 0.3897978471496715, 'strategy': 'breakout', 'time_stop': 65, 'use_sma': False, 'use_atr': False, 'use_adx': True, 'use_ema': False, 'use_spike': False, 'rsi_required': False, 'edge_k': 1.973200029689849, 'edge_cap': 0.6020944927255178, 'bull_strategy': 'breakout', 'bull_bb_std_mult': 2.1719694547509723, 'bull_rsi_os': 55, 'bull_rsi_ob': 69, 'bull_adx_thresh': 20.248752607636877, 'bull_atr_min_pct': 0.003937861690666129, 'bull_atr_max_pct': 0.06908119308363371, 'bull_tp_mult': 1.8940411336081646, 'bull_tsl_mult': 0.8768712662139221, 'bull_time_stop': 236, 'bull_use_sma': False, 'bull_use_ema': True, 'bull_use_atr': False, 'bull_use_adx': False, 'bull_use_spike': False, 'bull_rsi_required': False, 'bear_strategy': 'breakout', 'bear_bb_std_mult': 1.4234023402860527, 'bear_rsi_os': 51, 'bear_rsi_ob': 86, 'bear_adx_thresh': 18.6361450472444, 'bear_atr_min_pct': 0.0002809102212896729, 'bear_atr_max_pct': 0.021930712756769347, 'bear_tp_mult': 1.5783718387604098, 'bear_tsl_mult': 0.3329217470999747, 'bear_time_stop': 134, 'bear_use_sma': True, 'bear_use_ema': True, 'bear_use_atr': True, 'bear_use_adx': False, 'bear_use_spike': True, 'bear_rsi_required': False, 'sideways_strategy': 'mean_reversion', 'sideways_bb_std_mult': 1.082457450265243, 'sideways_rsi_os': 26, 'sideways_rsi_ob': 51, 'sideways_adx_thresh': 23.000721265663937, 'sideways_atr_min_pct': 0.0017914472737841512, 'sideways_atr_max_pct': 0.1313726937897411, 'sideways_tp_mult': 1.3635864108906695, 'sideways_tsl_mult': 0.6853766239095752, 'sideways_time_stop': 13, 'sideways_use_sma': False, 'sideways_use_ema': False, 'sideways_use_atr': True, 'sideways_use_adx': True, 'sideways_use_spike': True, 'sideways_rsi_required': False}.
[I 2025-08-31 03:17:01,976] Trial 105 finished with values: [-1000000000.0, 1000000000.0] and parameters: {'p_sma': 9, 'p_std': 25, 'p_atr': 30, 'p_adx': 14, 'rsi_period': 76, 'ema1': 13, 'ema2': 18, 'slip_atr_k': 0.09953833896256625, 'slip_spread_k': 0.4648158934660827, 'spread_hl_frac': 0.0038959516765938104, 'bb_std_mult': 1.3888524593997418, 'rsi_os': 36, 'rsi_ob': 68, 'vol_spike': 0.18937147868303109, 'adx_thresh': 16.578075880090154, 'atr_min_pct': 0.025191222758433763, 'atr_max_pct': 0.03748334031098903, 'tp_mult': 2.895349504332221, 'tsl_mult': 0.04819112569730677, 'strategy': 'breakout', 'time_stop': 103, 'use_sma': True, 'use_atr': False, 'use_adx': True, 'use_ema': False, 'use_spike': False, 'rsi_required': False, 'edge_k': 0.945443033541788, 'edge_cap': 0.1318578153643519, 'bull_strategy': 'breakout', 'bull_bb_std_mult': 3.1529609142934225, 'bull_rsi_os': 15, 'bull_rsi_ob': 72, 'bull_adx_thresh': 18.90806955445154, 'bull_atr_min_pct': 0.015357750382957638, 'bull_atr_max_pct': 0.0484811964764569, 'bull_tp_mult': 1.699567807833685, 'bull_tsl_mult': 0.9990794075836561, 'bull_time_stop': 80, 'bull_use_sma': False, 'bull_use_ema': False, 'bull_use_atr': True, 'bull_use_adx': True, 'bull_use_spike': True, 'bull_rsi_required': True, 'bear_strategy': 'mean_reversion', 'bear_bb_std_mult': 1.7910985023351143, 'bear_rsi_os': 40, 'bear_rsi_ob': 48, 'bear_adx_thresh': 25.944691117804222, 'bear_atr_min_pct': 0.021986420706887416, 'bear_atr_max_pct': 0.02879943638925004, 'bear_tp_mult': 2.8728787375756726, 'bear_tsl_mult': 0.17448037982733783, 'bear_time_stop': 215, 'bear_use_sma': False, 'bear_use_ema': False, 'bear_use_atr': False, 'bear_use_adx': True, 'bear_use_spike': True, 'bear_rsi_required': False, 'sideways_strategy': 'breakout', 'sideways_bb_std_mult': 1.7888217130617612, 'sideways_rsi_os': 38, 'sideways_rsi_ob': 60, 'sideways_adx_thresh': 19.389501582300706, 'sideways_atr_min_pct': 0.0008654087176342835, 'sideways_atr_max_pct': 0.12412157416293326, 'sideways_tp_mult': 2.951134513538472, 'sideways_tsl_mult': 0.7395473850959305, 'sideways_time_stop': 25, 'sideways_use_sma': True, 'sideways_use_ema': True, 'sideways_use_atr': False, 'sideways_use_adx': True, 'sideways_use_spike': False, 'sideways_rsi_required': True}.
[I 2025-08-31 03:17:02,135] Trial 102 finished with values: [-0.05347680815711864, 0.053533848728683685] and parameters: {'p_sma': 30, 'p_std': 48, 'p_atr': 30, 'p_adx': 17, 'rsi_period': 62, 'ema1': 15, 'ema2': 40, 'slip_atr_k': 0.021312010107973758, 'slip_spread_k': 0.18684058714743634, 'spread_hl_frac': 0.004466140144365548, 'bb_std_mult': 0.6178241045100255, 'rsi_os': 16, 'rsi_ob': 78, 'vol_spike': 0.23472532626214995, 'adx_thresh': 14.212949279503718, 'atr_min_pct': 0.023844485913044243, 'atr_max_pct': 0.12334280335424574, 'tp_mult': 1.6712478899043992, 'tsl_mult': 0.8165576662470789, 'strategy': 'breakout', 'time_stop': 102, 'use_sma': True, 'use_atr': False, 'use_adx': True, 'use_ema': False, 'use_spike': False, 'rsi_required': False, 'edge_k': 0.0015740984535717595, 'edge_cap': 0.09287707697977318, 'bull_strategy': 'breakout', 'bull_bb_std_mult': 2.141806534347065, 'bull_rsi_os': 20, 'bull_rsi_ob': 54, 'bull_adx_thresh': 20.547096743156537, 'bull_atr_min_pct': 2.1314183679448095e-05, 'bull_atr_max_pct': 0.11850360089427217, 'bull_tp_mult': 1.7865006846821017, 'bull_tsl_mult': 0.5819487957405453, 'bull_time_stop': 158, 'bull_use_sma': False, 'bull_use_ema': False, 'bull_use_atr': True, 'bull_use_adx': True, 'bull_use_spike': True, 'bull_rsi_required': True, 'bear_strategy': 'mean_reversion', 'bear_bb_std_mult': 1.7833791129080838, 'bear_rsi_os': 31, 'bear_rsi_ob': 48, 'bear_adx_thresh': 13.690799216716854, 'bear_atr_min_pct': 0.000860066439746612, 'bear_atr_max_pct': 0.05110422413506473, 'bear_tp_mult': 2.871622673140752, 'bear_tsl_mult': 0.407696778438182, 'bear_time_stop': 134, 'bear_use_sma': False, 'bear_use_ema': False, 'bear_use_atr': False, 'bear_use_adx': True, 'bear_use_spike': True, 'bear_rsi_required': False, 'sideways_strategy': 'breakout', 'sideways_bb_std_mult': 1.193316133045656, 'sideways_rsi_os': 46, 'sideways_rsi_ob': 58, 'sideways_adx_thresh': 23.20023354159348, 'sideways_atr_min_pct': 0.01927779076455237, 'sideways_atr_max_pct': 0.03331152973806113, 'sideways_tp_mult': 2.442689487555661, 'sideways_tsl_mult': 0.8401954205479898, 'sideways_time_stop': 25, 'sideways_use_sma': True, 'sideways_use_ema': True, 'sideways_use_atr': False, 'sideways_use_adx': True, 'sideways_use_spike': False, 'sideways_rsi_required': True}.
[I 2025-08-31 03:17:02,568] Trial 104 finished with values: [-0.049331448254564925, 0.04928309920730096] and parameters: {'p_sma': 25, 'p_std': 25, 'p_atr': 14, 'p_adx': 14, 'rsi_period': 71, 'ema1': 18, 'ema2': 18, 'slip_atr_k': 0.007500349361571422, 'slip_spread_k': 0.41962139336740134, 'spread_hl_frac': 0.0028111785836798277, 'bb_std_mult': 0.627905023119813, 'rsi_os': 18, 'rsi_ob': 78, 'vol_spike': 0.18670126765174616, 'adx_thresh': 22.24537287903506, 'atr_min_pct': 0.0012713317876334469, 'atr_max_pct': 0.06354122535575515, 'tp_mult': 1.6914012641546017, 'tsl_mult': 0.631422317000267, 'strategy': 'breakout', 'time_stop': 103, 'use_sma': False, 'use_atr': False, 'use_adx': True, 'use_ema': False, 'use_spike': False, 'rsi_required': False, 'edge_k': 0.40974851977680904, 'edge_cap': 0.6593415541357509, 'bull_strategy': 'breakout', 'bull_bb_std_mult': 2.544214510640551, 'bull_rsi_os': 15, 'bull_rsi_ob': 72, 'bull_adx_thresh': 20.174973358644124, 'bull_atr_min_pct': 9.306214093172602e-06, 'bull_atr_max_pct': 0.1395983808604465, 'bull_tp_mult': 1.3011540488280269, 'bull_tsl_mult': 0.9980838264982991, 'bull_time_stop': 158, 'bull_use_sma': False, 'bull_use_ema': False, 'bull_use_atr': True, 'bull_use_adx': True, 'bull_use_spike': True, 'bull_rsi_required': True, 'bear_strategy': 'mean_reversion', 'bear_bb_std_mult': 2.9398041371853223, 'bear_rsi_os': 29, 'bear_rsi_ob': 55, 'bear_adx_thresh': 13.269976874852926, 'bear_atr_min_pct': 0.00894270048937525, 'bear_atr_max_pct': 0.041412549916307016, 'bear_tp_mult': 1.0126532020911374, 'bear_tsl_mult': 0.18116079124755857, 'bear_time_stop': 256, 'bear_use_sma': False, 'bear_use_ema': False, 'bear_use_atr': False, 'bear_use_adx': True, 'bear_use_spike': True, 'bear_rsi_required': False, 'sideways_strategy': 'breakout', 'sideways_bb_std_mult': 3.006317675207017, 'sideways_rsi_os': 41, 'sideways_rsi_ob': 72, 'sideways_adx_thresh': 19.33174358439625, 'sideways_atr_min_pct': 0.0009149140150625471, 'sideways_atr_max_pct': 0.03175289910483573, 'sideways_tp_mult': 2.8809898975449126, 'sideways_tsl_mult': 0.7333036271035531, 'sideways_time_stop': 213, 'sideways_use_sma': True, 'sideways_use_ema': True, 'sideways_use_atr': False, 'sideways_use_adx': True, 'sideways_use_spike': True, 'sideways_rsi_required': True}.
[I 2025-08-31 03:17:02,579] Trial 103 finished with values: [-1000000000.0, 1000000000.0] and parameters: {'p_sma': 26, 'p_std': 5, 'p_atr': 16, 'p_adx': 14, 'rsi_period': 61, 'ema1': 18, 'ema2': 19, 'slip_atr_k': 0.03518107745332892, 'slip_spread_k': 0.4634577635764966, 'spread_hl_frac': 0.01911654131869154, 'bb_std_mult': 2.3837472777444444, 'rsi_os': 9, 'rsi_ob': 87, 'vol_spike': 0.2550528630418153, 'adx_thresh': 24.050953872550448, 'atr_min_pct': 0.028926720773494737, 'atr_max_pct': 0.07807410689238803, 'tp_mult': 1.651490026724254, 'tsl_mult': 0.041049956403662324, 'strategy': 'breakout', 'time_stop': 108, 'use_sma': False, 'use_atr': False, 'use_adx': True, 'use_ema': False, 'use_spike': False, 'rsi_required': False, 'edge_k': 1.9250870622156633, 'edge_cap': 0.13451146120201957, 'bull_strategy': 'breakout', 'bull_bb_std_mult': 2.558616576172021, 'bull_rsi_os': 15, 'bull_rsi_ob': 47, 'bull_adx_thresh': 20.260575095320192, 'bull_atr_min_pct': 0.009138504006663151, 'bull_atr_max_pct': 0.06014635239162232, 'bull_tp_mult': 1.7811254790568058, 'bull_tsl_mult': 0.0847941300338993, 'bull_time_stop': 281, 'bull_use_sma': False, 'bull_use_ema': False, 'bull_use_atr': True, 'bull_use_adx': True, 'bull_use_spike': True, 'bull_rsi_required': True, 'bear_strategy': 'mean_reversion', 'bear_bb_std_mult': 2.3878505795198333, 'bear_rsi_os': 28, 'bear_rsi_ob': 47, 'bear_adx_thresh': 13.235642486410118, 'bear_atr_min_pct': 0.009893599225395417, 'bear_atr_max_pct': 0.051545729980091624, 'bear_tp_mult': 1.4378790925737874, 'bear_tsl_mult': 0.4064960168949059, 'bear_time_stop': 215, 'bear_use_sma': False, 'bear_use_ema': False, 'bear_use_atr': False, 'bear_use_adx': False, 'bear_use_spike': True, 'bear_rsi_required': False, 'sideways_strategy': 'breakout', 'sideways_bb_std_mult': 3.008384250287942, 'sideways_rsi_os': 49, 'sideways_rsi_ob': 72, 'sideways_adx_thresh': 30.86161260683343, 'sideways_atr_min_pct': 0.025047890047869587, 'sideways_atr_max_pct': 0.125129978792834, 'sideways_tp_mult': 2.888629395093965, 'sideways_tsl_mult': 0.7375814374871649, 'sideways_time_stop': 32, 'sideways_use_sma': True, 'sideways_use_ema': True, 'sideways_use_atr': False, 'sideways_use_adx': True, 'sideways_use_spike': True, 'sideways_rsi_required': True}.
[I 2025-08-31 03:17:35,161] Trial 108 finished with values: [-1000000000.0, 1000000000.0] and parameters: {'p_sma': 8, 'p_std': 22, 'p_atr': 15, 'p_adx': 12, 'rsi_period': 73, 'ema1': 30, 'ema2': 22, 'slip_atr_k': 0.20452962642701722, 'slip_spread_k': 0.8978137142304581, 'spread_hl_frac': 0.009236667732599145, 'bb_std_mult': 0.6672808030028322, 'rsi_os': 33, 'rsi_ob': 74, 'vol_spike': 0.17478735968625558, 'adx_thresh': 25.181674968545128, 'atr_min_pct': 0.014945157301171621, 'atr_max_pct': 0.10102635861894403, 'tp_mult': 2.9185875029251855, 'tsl_mult': 0.9060430348090219, 'strategy': 'mean_reversion', 'time_stop': 90, 'use_sma': False, 'use_atr': False, 'use_adx': True, 'use_ema': True, 'use_spike': False, 'rsi_required': False, 'edge_k': 0.4880015476194084, 'edge_cap': 0.4372503801538885, 'bull_strategy': 'breakout', 'bull_bb_std_mult': 2.3956831517434347, 'bull_rsi_os': 17, 'bull_rsi_ob': 74, 'bull_adx_thresh': 17.632376590884007, 'bull_atr_min_pct': 0.005017101205213622, 'bull_atr_max_pct': 0.14746150362773452, 'bull_tp_mult': 1.0870987081010086, 'bull_tsl_mult': 0.40344043541590674, 'bull_time_stop': 117, 'bull_use_sma': False, 'bull_use_ema': False, 'bull_use_atr': True, 'bull_use_adx': False, 'bull_use_spike': False, 'bull_rsi_required': True, 'bear_strategy': 'mean_reversion', 'bear_bb_std_mult': 1.013713741055844, 'bear_rsi_os': 8, 'bear_rsi_ob': 75, 'bear_adx_thresh': 19.71996941064677, 'bear_atr_min_pct': 0.004714934270983946, 'bear_atr_max_pct': 0.1196853904909485, 'bear_tp_mult': 1.6342218577491856, 'bear_tsl_mult': 0.1370223864397454, 'bear_time_stop': 65, 'bear_use_sma': True, 'bear_use_ema': False, 'bear_use_atr': False, 'bear_use_adx': False, 'bear_use_spike': True, 'bear_rsi_required': True, 'sideways_strategy': 'breakout', 'sideways_bb_std_mult': 0.6677939582216617, 'sideways_rsi_os': 20, 'sideways_rsi_ob': 95, 'sideways_adx_thresh': 25.50466957804921, 'sideways_atr_min_pct': 0.005555151907588223, 'sideways_atr_max_pct': 0.10081973843213017, 'sideways_tp_mult': 2.94935176634985, 'sideways_tsl_mult': 0.8152501640855324, 'sideways_time_stop': 149, 'sideways_use_sma': True, 'sideways_use_ema': True, 'sideways_use_atr': True, 'sideways_use_adx': False, 'sideways_use_spike': True, 'sideways_rsi_required': False}.
[I 2025-08-31 03:17:35,476] Trial 107 finished with values: [-1000000000.0, 1000000000.0] and parameters: {'p_sma': 8, 'p_std': 22, 'p_atr': 14, 'p_adx': 14, 'rsi_period': 71, 'ema1': 24, 'ema2': 47, 'slip_atr_k': 0.03562251315765194, 'slip_spread_k': 0.4137035930104498, 'spread_hl_frac': 0.008899068826471276, 'bb_std_mult': 2.3935542660184157, 'rsi_os': 33, 'rsi_ob': 95, 'vol_spike': 0.17452911432925197, 'adx_thresh': 25.275531303271578, 'atr_min_pct': 0.0013915206742796619, 'atr_max_pct': 0.09453415918775733, 'tp_mult': 1.3307077477194822, 'tsl_mult': 0.8935455915171802, 'strategy': 'breakout', 'time_stop': 86, 'use_sma': False, 'use_atr': False, 'use_adx': True, 'use_ema': False, 'use_spike': False, 'rsi_required': False, 'edge_k': 0.40529592988788055, 'edge_cap': 0.7407115680046509, 'bull_strategy': 'breakout', 'bull_bb_std_mult': 2.266037903501654, 'bull_rsi_os': 17, 'bull_rsi_ob': 48, 'bull_adx_thresh': 8.756269440973947, 'bull_atr_min_pct': 0.009305878058697804, 'bull_atr_max_pct': 0.13818995215648117, 'bull_tp_mult': 1.1708776559750738, 'bull_tsl_mult': 0.981697723458144, 'bull_time_stop': 115, 'bull_use_sma': False, 'bull_use_ema': False, 'bull_use_atr': True, 'bull_use_adx': False, 'bull_use_spike': False, 'bull_rsi_required': True, 'bear_strategy': 'mean_reversion', 'bear_bb_std_mult': 1.0074817030433714, 'bear_rsi_os': 9, 'bear_rsi_ob': 54, 'bear_adx_thresh': 27.70503301082831, 'bear_atr_min_pct': 0.016877728866671823, 'bear_atr_max_pct': 0.10880500849311758, 'bear_tp_mult': 1.4564465017496309, 'bear_tsl_mult': 0.9510392751755236, 'bear_time_stop': 255, 'bear_use_sma': False, 'bear_use_ema': False, 'bear_use_atr': False, 'bear_use_adx': False, 'bear_use_spike': True, 'bear_rsi_required': True, 'sideways_strategy': 'breakout', 'sideways_bb_std_mult': 2.99374754368578, 'sideways_rsi_os': 41, 'sideways_rsi_ob': 72, 'sideways_adx_thresh': 25.822927493628292, 'sideways_atr_min_pct': 0.025307898129243125, 'sideways_atr_max_pct': 0.05396329920866205, 'sideways_tp_mult': 2.874205226243118, 'sideways_tsl_mult': 0.8154959374346153, 'sideways_time_stop': 82, 'sideways_use_sma': True, 'sideways_use_ema': True, 'sideways_use_atr': False, 'sideways_use_adx': True, 'sideways_use_spike': True, 'sideways_rsi_required': False}.
