[I 2025-08-31 03:22:34,971] Trial 145 finished with values: [-0.02201403619137743, 0.021918812649487994] and parameters: {'p_sma': 22, 'p_std': 18, 'p_atr': 11, 'p_adx': 13, 'rsi_period': 75, 'ema1': 17, 'ema2': 22, 'slip_atr_k': 0.08922278600172098, 'slip_spread_k': 0.17803774881731319, 'spread_hl_frac': 0.007510828453090184, 'bb_std_mult': 2.0146891754254206, 'rsi_os': 24, 'rsi_ob': 66, 'vol_spike': 0.11783748910845307, 'adx_thresh': 26.67038740921963, 'atr_min_pct': 0.011759109285624538, 'atr_max_pct': 0.1396238337777488, 'tp_mult': 2.0012435380521763, 'tsl_mult': 0.4938253617773168, 'strategy': 'mean_reversion', 'time_stop': 43, 'use_sma': True, 'use_atr': True, 'use_adx': False, 'use_ema': True, 'use_spike': False, 'rsi_required': True, 'edge_k': 1.6062398132352849, 'edge_cap': 0.37595852802240337, 'bull_strategy': 'mean_reversion', 'bull_bb_std_mult': 1.4376170605202956, 'bull_rsi_os': 16, 'bull_rsi_ob': 79, 'bull_adx_thresh': 18.71348967849571, 'bull_atr_min_pct': 0.001285972492851728, 'bull_atr_max_pct': 0.012600913472731247, 'bull_tp_mult': 1.3868350088750563, 'bull_tsl_mult': 0.3752879221175124, 'bull_time_stop': 251, 'bull_use_sma': False, 'bull_use_ema': False, 'bull_use_atr': True, 'bull_use_adx': False, 'bull_use_spike': False, 'bull_rsi_required': True, 'bear_strategy': 'mean_reversion', 'bear_bb_std_mult': 2.577084131372362, 'bear_rsi_os': 15, 'bear_rsi_ob': 82, 'bear_adx_thresh': 18.157247432746264, 'bear_atr_min_pct': 0.008362713263299569, 'bear_atr_max_pct': 0.11763564074237433, 'bear_tp_mult': 2.183267362068721, 'bear_tsl_mult': 0.4398585315348188, 'bear_time_stop': 230, 'bear_use_sma': True, 'bear_use_ema': False, 'bear_use_atr': False, 'bear_use_adx': False, 'bear_use_spike': True, 'bear_rsi_required': True, 'sideways_strategy': 'breakout', 'sideways_bb_std_mult': 1.6252331654180034, 'sideways_rsi_os': 18, 'sideways_rsi_ob': 67, 'sideways_adx_thresh': 7.160784453609331, 'sideways_atr_min_pct': 0.005284248701794194, 'sideways_atr_max_pct': 0.1225707703230431, 'sideways_tp_mult': 2.6586533439884557, 'sideways_tsl_mult': 0.3776632289362791, 'sideways_time_stop': 181, 'sideways_use_sma': True, 'sideways_use_ema': True, 'sideways_use_atr': True, 'sideways_use_adx': False, 'sideways_use_spike': False, 'sideways_rsi_required': False}.
[I 2025-08-31 03:22:34,982] Trial 144 finished with values: [-0.019486083259813713, 0.019395026952100616] and parameters: {'p_sma': 21, 'p_std': 20, 'p_atr': 11, 'p_adx': 13, 'rsi_period': 75, 'ema1': 17, 'ema2': 20, 'slip_atr_k': 0.021280821107242016, 'slip_spread_k': 0.1880606347061873, 'spread_hl_frac': 0.004967949889744125, 'bb_std_mult': 1.9785077358649916, 'rsi_os': 10, 'rsi_ob': 64, 'vol_spike': 0.12025804899544705, 'adx_thresh': 19.635592399651184, 'atr_min_pct': 0.02323690545821879, 'atr_max_pct': 0.13890582087731432, 'tp_mult': 1.4006284808140037, 'tsl_mult': 0.49691832308515343, 'strategy': 'mean_reversion', 'time_stop': 32, 'use_sma': True, 'use_atr': True, 'use_adx': False, 'use_ema': True, 'use_spike': False, 'rsi_required': True, 'edge_k': 1.0333987271001102, 'edge_cap': 0.34444912193226584, 'bull_strategy': 'mean_reversion', 'bull_bb_std_mult': 1.1977959120078123, 'bull_rsi_os': 46, 'bull_rsi_ob': 60, 'bull_adx_thresh': 24.858937221600534, 'bull_atr_min_pct': 0.001438214958142604, 'bull_atr_max_pct': 0.02902548913609921, 'bull_tp_mult': 1.3492358280485401, 'bull_tsl_mult': 0.3689313404741218, 'bull_time_stop': 245, 'bull_use_sma': False, 'bull_use_ema': False, 'bull_use_atr': True, 'bull_use_adx': False, 'bull_use_spike': False, 'bull_rsi_required': True, 'bear_strategy': 'mean_reversion', 'bear_bb_std_mult': 1.6696387705477767, 'bear_rsi_os': 15, 'bear_rsi_ob': 82, 'bear_adx_thresh': 12.661188046243364, 'bear_atr_min_pct': 0.006412872910683569, 'bear_atr_max_pct': 0.10134435333307634, 'bear_tp_mult': 2.1949421652544148, 'bear_tsl_mult': 0.4349334779338008, 'bear_time_stop': 232, 'bear_use_sma': True, 'bear_use_ema': False, 'bear_use_atr': False, 'bear_use_adx': False, 'bear_use_spike': True, 'bear_rsi_required': True, 'sideways_strategy': 'breakout', 'sideways_bb_std_mult': 1.6318982305467875, 'sideways_rsi_os': 40, 'sideways_rsi_ob': 67, 'sideways_adx_thresh': 7.247404774706955, 'sideways_atr_min_pct': 0.004309668217873548, 'sideways_atr_max_pct': 0.11339805182190882, 'sideways_tp_mult': 2.689395012228264, 'sideways_tsl_mult': 0.3182277168940238, 'sideways_time_stop': 196, 'sideways_use_sma': True, 'sideways_use_ema': True, 'sideways_use_atr': True, 'sideways_use_adx': False, 'sideways_use_spike': False, 'sideways_rsi_required': False}.
[I 2025-08-31 03:23:08,883] Trial 149 finished with values: [-1000000000.0, 1000000000.0] and parameters: {'p_sma': 22, 'p_std': 21, 'p_atr': 12, 'p_adx': 25, 'rsi_period': 42, 'ema1': 17, 'ema2': 21, 'slip_atr_k': 0.2116597085693594, 'slip_spread_k': 0.22536076235082808, 'spread_hl_frac': 0.00026649182927894195, 'bb_std_mult': 2.1273233365391007, 'rsi_os': 9, 'rsi_ob': 66, 'vol_spike': 0.13261862577091127, 'adx_thresh': 5.088764834677711, 'atr_min_pct': 0.02380983826305388, 'atr_max_pct': 0.14654144001938132, 'tp_mult': 1.6005548482183785, 'tsl_mult': 0.4895687201410491, 'strategy': 'breakout', 'time_stop': 44, 'use_sma': True, 'use_atr': True, 'use_adx': True, 'use_ema': False, 'use_spike': False, 'rsi_required': True, 'edge_k': 1.0665139155366752, 'edge_cap': 0.24103384659011778, 'bull_strategy': 'breakout', 'bull_bb_std_mult': 1.4092335223422185, 'bull_rsi_os': 13, 'bull_rsi_ob': 89, 'bull_adx_thresh': 21.38205059453636, 'bull_atr_min_pct': 0.0019248259271534666, 'bull_atr_max_pct': 0.022020263463345565, 'bull_tp_mult': 1.5189440951482893, 'bull_tsl_mult': 0.36939862443727606, 'bull_time_stop': 167, 'bull_use_sma': False, 'bull_use_ema': False, 'bull_use_atr': True, 'bull_use_adx': False, 'bull_use_spike': False, 'bull_rsi_required': True, 'bear_strategy': 'mean_reversion', 'bear_bb_std_mult': 2.1139927277725183, 'bear_rsi_os': 25, 'bear_rsi_ob': 82, 'bear_adx_thresh': 33.51978352817443, 'bear_atr_min_pct': 0.020045522306924978, 'bear_atr_max_pct': 0.11721611097675183, 'bear_tp_mult': 2.1746209709183364, 'bear_tsl_mult': 0.5561918424959525, 'bear_time_stop': 230, 'bear_use_sma': False, 'bear_use_ema': False, 'bear_use_atr': False, 'bear_use_adx': True, 'bear_use_spike': True, 'bear_rsi_required': True, 'sideways_strategy': 'breakout', 'sideways_bb_std_mult': 1.3442330983670103, 'sideways_rsi_os': 20, 'sideways_rsi_ob': 77, 'sideways_adx_thresh': 7.20398134848055, 'sideways_atr_min_pct': 0.003874955334371248, 'sideways_atr_max_pct': 0.13332737041404946, 'sideways_tp_mult': 2.604616797982894, 'sideways_tsl_mult': 0.32392396176697263, 'sideways_time_stop': 32, 'sideways_use_sma': True, 'sideways_use_ema': True, 'sideways_use_atr': False, 'sideways_use_adx': True, 'sideways_use_spike': True, 'sideways_rsi_required': False}.
[I 2025-08-31 03:23:09,511] Trial 147 finished with values: [-1000000000.0, 1000000000.0] and parameters: {'p_sma': 12, 'p_std': 18, 'p_atr': 11, 'p_adx': 13, 'rsi_period': 42, 'ema1': 9, 'ema2': 22, 'slip_atr_k': 0.19228814515771803, 'slip_spread_k': 0.22380873528898262, 'spread_hl_frac': 0.006782936913640189, 'bb_std_mult': 2.2305811632448047, 'rsi_os': 15, 'rsi_ob': 66, 'vol_spike': 0.1159120813133873, 'adx_thresh': 12.732772535527506, 'atr_min_pct': 0.010652685875748765, 'atr_max_pct': 0.13813950359757277, 'tp_mult': 1.615675876780698, 'tsl_mult': 0.48353449234852397, 'strategy': 'mean_reversion', 'time_stop': 44, 'use_sma': True, 'use_atr': True, 'use_adx': True, 'use_ema': True, 'use_spike': False, 'rsi_required': True, 'edge_k': 1.5982609237525747, 'edge_cap': 0.32401616771558106, 'bull_strategy': 'mean_reversion', 'bull_bb_std_mult': 1.433573023989346, 'bull_rsi_os': 13, 'bull_rsi_ob': 79, 'bull_adx_thresh': 24.777395251305332, 'bull_atr_min_pct': 0.0016709965572801772, 'bull_atr_max_pct': 0.031478294308825296, 'bull_tp_mult': 1.3542017273478786, 'bull_tsl_mult': 0.3661888043792349, 'bull_time_stop': 19, 'bull_use_sma': False, 'bull_use_ema': False, 'bull_use_atr': True, 'bull_use_adx': False, 'bull_use_spike': False, 'bull_rsi_required': True, 'bear_strategy': 'breakout', 'bear_bb_std_mult': 1.6717902504997078, 'bear_rsi_os': 25, 'bear_rsi_ob': 82, 'bear_adx_thresh': 26.38471999576341, 'bear_atr_min_pct': 0.006707229705452202, 'bear_atr_max_pct': 0.12393365608137809, 'bear_tp_mult': 2.1800542691049904, 'bear_tsl_mult': 0.7269975886449417, 'bear_time_stop': 278, 'bear_use_sma': True, 'bear_use_ema': False, 'bear_use_atr': False, 'bear_use_adx': False, 'bear_use_spike': True, 'bear_rsi_required': True, 'sideways_strategy': 'breakout', 'sideways_bb_std_mult': 0.9794479760515638, 'sideways_rsi_os': 17, 'sideways_rsi_ob': 81, 'sideways_adx_thresh': 7.000488192307601, 'sideways_atr_min_pct': 0.004562333740181072, 'sideways_atr_max_pct': 0.11294570697989087, 'sideways_tp_mult': 2.6854024323838264, 'sideways_tsl_mult': 0.3301000363797967, 'sideways_time_stop': 261, 'sideways_use_sma': False, 'sideways_use_ema': True, 'sideways_use_atr': True, 'sideways_use_adx': False, 'sideways_use_spike': False, 'sideways_rsi_required': False}.
[I 2025-08-31 03:23:09,511] Trial 148 finished with values: [-0.021764621452237454, 0.022229115008646223] and parameters: {'p_sma': 48, 'p_std': 21, 'p_atr': 12, 'p_adx': 13, 'rsi_period': 74, 'ema1': 17, 'ema2': 21, 'slip_atr_k': 0.08687641240226177, 'slip_spread_k': 0.219287512086026, 'spread_hl_frac': 0.007224767922750312, 'bb_std_mult': 1.8703015520340671, 'rsi_os': 10, 'rsi_ob': 64, 'vol_spike': 0.11608094603571553, 'adx_thresh': 24.987540747390966, 'atr_min_pct': 0.022990616246574492, 'atr_max_pct': 0.14676679580574487, 'tp_mult': 1.6147059734722236, 'tsl_mult': 0.4945966219657034, 'strategy': 'breakout', 'time_stop': 46, 'use_sma': True, 'use_atr': True, 'use_adx': True, 'use_ema': False, 'use_spike': False, 'rsi_required': True, 'edge_k': 1.088499723225232, 'edge_cap': 0.2525918451530424, 'bull_strategy': 'breakout', 'bull_bb_std_mult': 1.2323838456241887, 'bull_rsi_os': 13, 'bull_rsi_ob': 89, 'bull_adx_thresh': 25.1929017452637, 'bull_atr_min_pct': 0.001880300257289504, 'bull_atr_max_pct': 0.013751298763920887, 'bull_tp_mult': 1.5016050468105, 'bull_tsl_mult': 0.3779093191430528, 'bull_time_stop': 245, 'bull_use_sma': False, 'bull_use_ema': False, 'bull_use_atr': True, 'bull_use_adx': False, 'bull_use_spike': False, 'bull_rsi_required': True, 'bear_strategy': 'mean_reversion', 'bear_bb_std_mult': 2.510873339567521, 'bear_rsi_os': 25, 'bear_rsi_ob': 83, 'bear_adx_thresh': 30.14518606037859, 'bear_atr_min_pct': 0.00832712377426778, 'bear_atr_max_pct': 0.11679249978547285, 'bear_tp_mult': 2.143370495200068, 'bear_tsl_mult': 0.7064359241203987, 'bear_time_stop': 260, 'bear_use_sma': False, 'bear_use_ema': False, 'bear_use_atr': False, 'bear_use_adx': True, 'bear_use_spike': True, 'bear_rsi_required': True, 'sideways_strategy': 'breakout', 'sideways_bb_std_mult': 1.6022346314292883, 'sideways_rsi_os': 50, 'sideways_rsi_ob': 77, 'sideways_adx_thresh': 7.094641923493957, 'sideways_atr_min_pct': 0.0038706900067625605, 'sideways_atr_max_pct': 0.13461448381944344, 'sideways_tp_mult': 2.5918181322098475, 'sideways_tsl_mult': 0.32319624546921794, 'sideways_time_stop': 261, 'sideways_use_sma': True, 'sideways_use_ema': True, 'sideways_use_atr': False, 'sideways_use_adx': True, 'sideways_use_spike': True, 'sideways_rsi_required': False}.
[I 2025-08-31 03:23:09,524] Trial 146 finished with values: [-1000000000.0, 1000000000.0] and parameters: {'p_sma': 22, 'p_std': 19, 'p_atr': 11, 'p_adx': 10, 'rsi_period': 75, 'ema1': 17, 'ema2': 29, 'slip_atr_k': 0.021505572694056244, 'slip_spread_k': 0.18022830497114567, 'spread_hl_frac': 0.00702825815220208, 'bb_std_mult': 1.8730129323917726, 'rsi_os': 10, 'rsi_ob': 65, 'vol_spike': 0.11932728466923026, 'adx_thresh': 26.728668693820374, 'atr_min_pct': 0.006557362670966196, 'atr_max_pct': 0.14019538565814801, 'tp_mult': 1.4238262511447886, 'tsl_mult': 0.48896342904714485, 'strategy': 'mean_reversion', 'time_stop': 47, 'use_sma': True, 'use_atr': True, 'use_adx': True, 'use_ema': True, 'use_spike': False, 'rsi_required': True, 'edge_k': 0.3388815911471091, 'edge_cap': 0.3555733511731052, 'bull_strategy': 'mean_reversion', 'bull_bb_std_mult': 1.420123956858137, 'bull_rsi_os': 13, 'bull_rsi_ob': 89, 'bull_adx_thresh': 28.483633129518307, 'bull_atr_min_pct': 0.0015754595223125417, 'bull_atr_max_pct': 0.03206022888919196, 'bull_tp_mult': 1.3514994879173385, 'bull_tsl_mult': 0.36841143914588537, 'bull_time_stop': 19, 'bull_use_sma': False, 'bull_use_ema': False, 'bull_use_atr': True, 'bull_use_adx': False, 'bull_use_spike': False, 'bull_rsi_required': True, 'bear_strategy': 'mean_reversion', 'bear_bb_std_mult': 3.0145140856680945, 'bear_rsi_os': 16, 'bear_rsi_ob': 82, 'bear_adx_thresh': 33.81140561742364, 'bear_atr_min_pct': 0.0067035563712402445, 'bear_atr_max_pct': 0.11694054572752191, 'bear_tp_mult': 2.1717146442716277, 'bear_tsl_mult': 0.9388691316577321, 'bear_time_stop': 243, 'bear_use_sma': True, 'bear_use_ema': False, 'bear_use_atr': False, 'bear_use_adx': False, 'bear_use_spike': True, 'bear_rsi_required': True, 'sideways_strategy': 'breakout', 'sideways_bb_std_mult': 1.5821532424564884, 'sideways_rsi_os': 19, 'sideways_rsi_ob': 65, 'sideways_adx_thresh': 7.134099319223317, 'sideways_atr_min_pct': 0.005513503352287282, 'sideways_atr_max_pct': 0.11292013159281442, 'sideways_tp_mult': 2.671179629096783, 'sideways_tsl_mult': 0.31934274425730713, 'sideways_time_stop': 32, 'sideways_use_sma': True, 'sideways_use_ema': True, 'sideways_use_atr': True, 'sideways_use_adx': False, 'sideways_use_spike': False, 'sideways_rsi_required': False}.
[I 2025-08-31 03:23:41,476] Trial 150 finished with values: [-0.01851661874505539, 0.018420646254597273] and parameters: {'p_sma': 16, 'p_std': 23, 'p_atr': 13, 'p_adx': 13, 'rsi_period': 74, 'ema1': 15, 'ema2': 50, 'slip_atr_k': 0.08897169933345739, 'slip_spread_k': 0.26827520621088624, 'spread_hl_frac': 0.007088768261579198, 'bb_std_mult': 2.2352698493811434, 'rsi_os': 15, 'rsi_ob': 64, 'vol_spike': 0.1218317614690014, 'adx_thresh': 26.734476705417407, 'atr_min_pct': 0.022852793639866212, 'atr_max_pct': 0.13742848633882981, 'tp_mult': 1.4631117411385441, 'tsl_mult': 0.3642675988215631, 'strategy': 'breakout', 'time_stop': 31, 'use_sma': True, 'use_atr': True, 'use_adx': True, 'use_ema': False, 'use_spike': False, 'rsi_required': True, 'edge_k': 1.6022035199568425, 'edge_cap': 0.34537114786975054, 'bull_strategy': 'mean_reversion', 'bull_bb_std_mult': 1.2214828968113958, 'bull_rsi_os': 52, 'bull_rsi_ob': 60, 'bull_adx_thresh': 18.318961605987717, 'bull_atr_min_pct': 0.0002891384784469732, 'bull_atr_max_pct': 0.014671762196794225, 'bull_tp_mult': 1.396349816891766, 'bull_tsl_mult': 0.2902810405526364, 'bull_time_stop': 128, 'bull_use_sma': False, 'bull_use_ema': False, 'bull_use_atr': True, 'bull_use_adx': False, 'bull_use_spike': False, 'bull_rsi_required': True, 'bear_strategy': 'mean_reversion', 'bear_bb_std_mult': 2.5564671380488297, 'bear_rsi_os': 22, 'bear_rsi_ob': 82, 'bear_adx_thresh': 7.1332798650846385, 'bear_atr_min_pct': 0.008025762100901694, 'bear_atr_max_pct': 0.12360194573793051, 'bear_tp_mult': 2.229231512979133, 'bear_tsl_mult': 0.9386233253621206, 'bear_time_stop': 245, 'bear_use_sma': False, 'bear_use_ema': False, 'bear_use_atr': False, 'bear_use_adx': False, 'bear_use_spike': True, 'bear_rsi_required': True, 'sideways_strategy': 'breakout', 'sideways_bb_std_mult': 1.5980627745290639, 'sideways_rsi_os': 18, 'sideways_rsi_ob': 81, 'sideways_adx_thresh': 7.0005851086602195, 'sideways_atr_min_pct': 0.004563509573373151, 'sideways_atr_max_pct': 0.12931595173587412, 'sideways_tp_mult': 2.6860447187872034, 'sideways_tsl_mult': 0.359133967142164, 'sideways_time_stop': 47, 'sideways_use_sma': True, 'sideways_use_ema': True, 'sideways_use_atr': False, 'sideways_use_adx': False, 'sideways_use_spike': False, 'sideways_rsi_required': False}.
[I 2025-08-31 03:23:41,976] Trial 151 finished with values: [-1000000000.0, 1000000000.0] and parameters: {'p_sma': 48, 'p_std': 23, 'p_atr': 13, 'p_adx': 27, 'rsi_period': 79, 'ema1': 24, 'ema2': 43, 'slip_atr_k': 0.16010248201414795, 'slip_spread_k': 0.2663918772913681, 'spread_hl_frac': 0.0036037987451274294, 'bb_std_mult': 1.9525215080824707, 'rsi_os': 20, 'rsi_ob': 64, 'vol_spike': 0.10777312603634978, 'adx_thresh': 24.670340961535615, 'atr_min_pct': 0.022978506295748012, 'atr_max_pct': 0.1492284901903296, 'tp_mult': 1.4729666292463544, 'tsl_mult': 0.3552105316018084, 'strategy': 'breakout', 'time_stop': 29, 'use_sma': True, 'use_atr': True, 'use_adx': True, 'use_ema': False, 'use_spike': False, 'rsi_required': True, 'edge_k': 1.7685686148777515, 'edge_cap': 0.2655296015436329, 'bull_strategy': 'breakout', 'bull_bb_std_mult': 1.210911778799456, 'bull_rsi_os': 29, 'bull_rsi_ob': 60, 'bull_adx_thresh': 18.426486261908032, 'bull_atr_min_pct': 0.00031508457634868664, 'bull_atr_max_pct': 0.03842106487748602, 'bull_tp_mult': 2.0974345649853343, 'bull_tsl_mult': 0.28699222560823556, 'bull_time_stop': 123, 'bull_use_sma': True, 'bull_use_ema': True, 'bull_use_atr': False, 'bull_use_adx': False, 'bull_use_spike': False, 'bull_rsi_required': False, 'bear_strategy': 'mean_reversion', 'bear_bb_std_mult': 2.5717655385511247, 'bear_rsi_os': 22, 'bear_rsi_ob': 84, 'bear_adx_thresh': 17.92479343844157, 'bear_atr_min_pct': 0.00825676084437293, 'bear_atr_max_pct': 0.12244959781254502, 'bear_tp_mult': 2.2315767354902594, 'bear_tsl_mult': 0.6561754649987795, 'bear_time_stop': 266, 'bear_use_sma': False, 'bear_use_ema': False, 'bear_use_atr': True, 'bear_use_adx': True, 'bear_use_spike': False, 'bear_rsi_required': True, 'sideways_strategy': 'mean_reversion', 'sideways_bb_std_mult': 1.6239246277468196, 'sideways_rsi_os': 38, 'sideways_rsi_ob': 77, 'sideways_adx_thresh': 5.465354528863369, 'sideways_atr_min_pct': 0.002954561992987334, 'sideways_atr_max_pct': 0.1263221444618106, 'sideways_tp_mult': 2.747341724487109, 'sideways_tsl_mult': 0.29659781947362013, 'sideways_time_stop': 159, 'sideways_use_sma': True, 'sideways_use_ema': True, 'sideways_use_atr': False, 'sideways_use_adx': True, 'sideways_use_spike': True, 'sideways_rsi_required': False}.
[I 2025-08-31 03:23:42,189] Trial 153 finished with values: [-1000000000.0, 1000000000.0] and parameters: {'p_sma': 56, 'p_std': 23, 'p_atr': 13, 'p_adx': 13, 'rsi_period': 34, 'ema1': 16, 'ema2': 45, 'slip_atr_k': 0.030771438560803218, 'slip_spread_k': 0.25765411720186776, 'spread_hl_frac': 0.0035325388631113467, 'bb_std_mult': 1.7214320373526626, 'rsi_os': 20, 'rsi_ob': 64, 'vol_spike': 0.12291071292746114, 'adx_thresh': 24.851294362998555, 'atr_min_pct': 0.011545884440846957, 'atr_max_pct': 0.1487059995982963, 'tp_mult': 1.4636515116008793, 'tsl_mult': 0.5397526483013952, 'strategy': 'breakout', 'time_stop': 30, 'use_sma': True, 'use_atr': True, 'use_adx': True, 'use_ema': False, 'use_spike': False, 'rsi_required': True, 'edge_k': 0.7400225347604213, 'edge_cap': 0.2610247135204379, 'bull_strategy': 'breakout', 'bull_bb_std_mult': 1.1972688850022593, 'bull_rsi_os': 47, 'bull_rsi_ob': 45, 'bull_adx_thresh': 31.056229404574662, 'bull_atr_min_pct': 0.0003145198025492277, 'bull_atr_max_pct': 0.015865746316380762, 'bull_tp_mult': 1.5065357295903574, 'bull_tsl_mult': 0.28771148075188946, 'bull_time_stop': 127, 'bull_use_sma': True, 'bull_use_ema': True, 'bull_use_atr': False, 'bull_use_adx': False, 'bull_use_spike': False, 'bull_rsi_required': False, 'bear_strategy': 'mean_reversion', 'bear_bb_std_mult': 2.023812954693925, 'bear_rsi_os': 22, 'bear_rsi_ob': 84, 'bear_adx_thresh': 29.945190321776103, 'bear_atr_min_pct': 0.021458529454809014, 'bear_atr_max_pct': 0.12140608400430769, 'bear_tp_mult': 2.2363319692443566, 'bear_tsl_mult': 0.20130863729861892, 'bear_time_stop': 265, 'bear_use_sma': False, 'bear_use_ema': False, 'bear_use_atr': True, 'bear_use_adx': True, 'bear_use_spike': False, 'bear_rsi_required': True, 'sideways_strategy': 'mean_reversion', 'sideways_bb_std_mult': 1.629214579757406, 'sideways_rsi_os': 38, 'sideways_rsi_ob': 81, 'sideways_adx_thresh': 5.454920645733051, 'sideways_atr_min_pct': 0.0027730026569337527, 'sideways_atr_max_pct': 0.12614942813160196, 'sideways_tp_mult': 2.745161348896751, 'sideways_tsl_mult': 0.39750324926895153, 'sideways_time_stop': 181, 'sideways_use_sma': True, 'sideways_use_ema': True, 'sideways_use_atr': False, 'sideways_use_adx': True, 'sideways_use_spike': True, 'sideways_rsi_required': False}.
