[I 2025-08-31 03:07:03,543] Trial 28 finished with values: [-1000000000.0, 1000000000.0] and parameters: {'p_sma': 22, 'p_std': 6, 'p_atr': 20, 'p_adx': 11, 'rsi_period': 60, 'ema1': 8, 'ema2': 24, 'slip_atr_k': 0.020301051368395828, 'slip_spread_k': 0.18924322683017003, 'spread_hl_frac': 0.0316884802496177, 'bb_std_mult': 0.8416536962325704, 'rsi_os': 29, 'rsi_ob': 76, 'vol_spike': 0.12359569907479825, 'adx_thresh': 5.1816210428218135, 'atr_min_pct': 0.0007182432804490584, 'atr_max_pct': 0.13702950082638476, 'tp_mult': 2.832869943576574, 'tsl_mult': 0.5536001564378688, 'strategy': 'breakout', 'time_stop': 121, 'use_sma': False, 'use_atr': True, 'use_adx': True, 'use_ema': False, 'use_spike': True, 'rsi_required': False, 'edge_k': 1.1966354880176495, 'edge_cap': 0.2016598284710854, 'bull_strategy': 'breakout', 'bull_bb_std_mult': 2.684133801954586, 'bull_rsi_os': 12, 'bull_rsi_ob': 79, 'bull_adx_thresh': 21.06173059264746, 'bull_atr_min_pct': 0.002177586156415677, 'bull_atr_max_pct': 0.13400802062589032, 'bull_tp_mult': 1.0312654162581363, 'bull_tsl_mult': 0.7582579431324185, 'bull_time_stop': 100, 'bull_use_sma': False, 'bull_use_ema': True, 'bull_use_atr': True, 'bull_use_adx': False, 'bull_use_spike': False, 'bull_rsi_required': False, 'bear_strategy': 'breakout', 'bear_bb_std_mult': 2.1191202747732962, 'bear_rsi_os': 21, 'bear_rsi_ob': 88, 'bear_adx_thresh': 15.84266835069252, 'bear_atr_min_pct': 0.0031219222928427163, 'bear_atr_max_pct': 0.05315336991233834, 'bear_tp_mult': 1.9831838937599362, 'bear_tsl_mult': 0.971305269502744, 'bear_time_stop': 171, 'bear_use_sma': False, 'bear_use_ema': False, 'bear_use_atr': False, 'bear_use_adx': False, 'bear_use_spike': True, 'bear_rsi_required': False, 'sideways_strategy': 'mean_reversion', 'sideways_bb_std_mult': 2.5395412035598146, 'sideways_rsi_os': 43, 'sideways_rsi_ob': 52, 'sideways_adx_thresh': 20.798572473830585, 'sideways_atr_min_pct': 0.002475657726352402, 'sideways_atr_max_pct': 0.010246625706014492, 'sideways_tp_mult': 2.3882489919343852, 'sideways_tsl_mult': 0.6481722449286693, 'sideways_time_stop': 92, 'sideways_use_sma': False, 'sideways_use_ema': True, 'sideways_use_atr': False, 'sideways_use_adx': False, 'sideways_use_spike': False, 'sideways_rsi_required': True}.
[I 2025-08-31 03:07:03,907] Trial 27 finished with values: [-1000000000.0, 1000000000.0] and parameters: {'p_sma': 10, 'p_std': 6, 'p_atr': 12, 'p_adx': 11, 'rsi_period': 62, 'ema1': 9, 'ema2': 15, 'slip_atr_k': 9.209243285896243e-05, 'slip_spread_k': 0.6061531702253375, 'spread_hl_frac': 0.04596998435024541, 'bb_std_mult': 1.6695029733954991, 'rsi_os': 47, 'rsi_ob': 90, 'vol_spike': 0.16406608290621874, 'adx_thresh': 27.19270214138201, 'atr_min_pct': 0.01906791138899562, 'atr_max_pct': 0.1400176569751501, 'tp_mult': 2.7745319840834903, 'tsl_mult': 0.5343126034061816, 'strategy': 'breakout', 'time_stop': 119, 'use_sma': False, 'use_atr': True, 'use_adx': True, 'use_ema': False, 'use_spike': False, 'rsi_required': False, 'edge_k': 1.3282000810064458, 'edge_cap': 0.20708761198217643, 'bull_strategy': 'breakout', 'bull_bb_std_mult': 2.0319421878003383, 'bull_rsi_os': 26, 'bull_rsi_ob': 56, 'bull_adx_thresh': 20.47149414444691, 'bull_atr_min_pct': 0.0031766451098960806, 'bull_atr_max_pct': 0.13290035716240273, 'bull_tp_mult': 1.50935379819049, 'bull_tsl_mult': 0.8790000730547624, 'bull_time_stop': 95, 'bull_use_sma': False, 'bull_use_ema': False, 'bull_use_atr': True, 'bull_use_adx': False, 'bull_use_spike': False, 'bull_rsi_required': True, 'bear_strategy': 'mean_reversion', 'bear_bb_std_mult': 1.1890854015738013, 'bear_rsi_os': 31, 'bear_rsi_ob': 77, 'bear_adx_thresh': 15.619190934283484, 'bear_atr_min_pct': 0.004525864584226488, 'bear_atr_max_pct': 0.035933650391174056, 'bear_tp_mult': 1.9623910859282458, 'bear_tsl_mult': 0.9711923027261807, 'bear_time_stop': 163, 'bear_use_sma': False, 'bear_use_ema': False, 'bear_use_atr': False, 'bear_use_adx': False, 'bear_use_spike': True, 'bear_rsi_required': False, 'sideways_strategy': 'mean_reversion', 'sideways_bb_std_mult': 2.0095961588673736, 'sideways_rsi_os': 35, 'sideways_rsi_ob': 52, 'sideways_adx_thresh': 21.38976613319965, 'sideways_atr_min_pct': 0.0025265662474514604, 'sideways_atr_max_pct': 0.1484785859607368, 'sideways_tp_mult': 2.738818870168814, 'sideways_tsl_mult': 0.6002454114928842, 'sideways_time_stop': 91, 'sideways_use_sma': True, 'sideways_use_ema': True, 'sideways_use_atr': False, 'sideways_use_adx': True, 'sideways_use_spike': False, 'sideways_rsi_required': True}.
[I 2025-08-31 03:07:03,981] Trial 29 finished with values: [-1000000000.0, 1000000000.0] and parameters: {'p_sma': 12, 'p_std': 6, 'p_atr': 20, 'p_adx': 11, 'rsi_period': 49, 'ema1': 9, 'ema2': 25, 'slip_atr_k': 0.001366924439220647, 'slip_spread_k': 0.2402164272933898, 'spread_hl_frac': 0.04975648427052364, 'bb_std_mult': 0.8030912710274323, 'rsi_os': 28, 'rsi_ob': 91, 'vol_spike': 0.11892530337538956, 'adx_thresh': 12.072271788698913, 'atr_min_pct': 0.010921537488947662, 'atr_max_pct': 0.1371378995895408, 'tp_mult': 2.8229232787842005, 'tsl_mult': 0.5423124289390502, 'strategy': 'breakout', 'time_stop': 116, 'use_sma': False, 'use_atr': True, 'use_adx': True, 'use_ema': False, 'use_spike': True, 'rsi_required': False, 'edge_k': 1.1628246823690085, 'edge_cap': 0.2234381420774143, 'bull_strategy': 'breakout', 'bull_bb_std_mult': 2.6768322886400506, 'bull_rsi_os': 13, 'bull_rsi_ob': 80, 'bull_adx_thresh': 20.891792863320045, 'bull_atr_min_pct': 0.002383081982430986, 'bull_atr_max_pct': 0.0980806313903525, 'bull_tp_mult': 1.0218174459117741, 'bull_tsl_mult': 0.7776149419477937, 'bull_time_stop': 93, 'bull_use_sma': False, 'bull_use_ema': True, 'bull_use_atr': True, 'bull_use_adx': False, 'bull_use_spike': False, 'bull_rsi_required': False, 'bear_strategy': 'breakout', 'bear_bb_std_mult': 0.7374095270630293, 'bear_rsi_os': 21, 'bear_rsi_ob': 95, 'bear_adx_thresh': 16.21843728450697, 'bear_atr_min_pct': 0.003288177297821524, 'bear_atr_max_pct': 0.05568771286468954, 'bear_tp_mult': 2.8949085504462424, 'bear_tsl_mult': 0.9975941562680705, 'bear_time_stop': 167, 'bear_use_sma': False, 'bear_use_ema': False, 'bear_use_atr': False, 'bear_use_adx': False, 'bear_use_spike': True, 'bear_rsi_required': False, 'sideways_strategy': 'mean_reversion', 'sideways_bb_std_mult': 2.430742096456379, 'sideways_rsi_os': 44, 'sideways_rsi_ob': 51, 'sideways_adx_thresh': 21.51601984328658, 'sideways_atr_min_pct': 0.0035497851016993123, 'sideways_atr_max_pct': 0.039481726030708826, 'sideways_tp_mult': 2.9943410338774785, 'sideways_tsl_mult': 0.45049940572203695, 'sideways_time_stop': 86, 'sideways_use_sma': False, 'sideways_use_ema': True, 'sideways_use_atr': False, 'sideways_use_adx': False, 'sideways_use_spike': False, 'sideways_rsi_required': True}.
[I 2025-08-31 03:07:36,847] Trial 33 finished with values: [-1000000000.0, 1000000000.0] and parameters: {'p_sma': 46, 'p_std': 32, 'p_atr': 7, 'p_adx': 26, 'rsi_period': 75, 'ema1': 12, 'ema2': 54, 'slip_atr_k': 0.07759917136175234, 'slip_spread_k': 0.37319487452309286, 'spread_hl_frac': 0.0356619206380244, 'bb_std_mult': 1.270439058536624, 'rsi_os': 38, 'rsi_ob': 70, 'vol_spike': 0.24350211878047776, 'adx_thresh': 24.69624197264321, 'atr_min_pct': 0.02670944842821001, 'atr_max_pct': 0.09292193134903867, 'tp_mult': 2.623368131529504, 'tsl_mult': 0.4484673240566791, 'strategy': 'breakout', 'time_stop': 58, 'use_sma': True, 'use_atr': False, 'use_adx': False, 'use_ema': False, 'use_spike': True, 'rsi_required': True, 'edge_k': 1.573854472671926, 'edge_cap': 0.47501935363679826, 'bull_strategy': 'mean_reversion', 'bull_bb_std_mult': 1.5635296903741278, 'bull_rsi_os': 23, 'bull_rsi_ob': 87, 'bull_adx_thresh': 22.31379185259388, 'bull_atr_min_pct': 0.010451478494068224, 'bull_atr_max_pct': 0.14033892433540765, 'bull_tp_mult': 2.2192756542740737, 'bull_tsl_mult': 0.7143834033925615, 'bull_time_stop': 164, 'bull_use_sma': True, 'bull_use_ema': False, 'bull_use_atr': False, 'bull_use_adx': True, 'bull_use_spike': True, 'bull_rsi_required': False, 'bear_strategy': 'breakout', 'bear_bb_std_mult': 0.8471722059014488, 'bear_rsi_os': 39, 'bear_rsi_ob': 60, 'bear_adx_thresh': 21.89754979516587, 'bear_atr_min_pct': 0.006889826981410848, 'bear_atr_max_pct': 0.0667771092505199, 'bear_tp_mult': 1.8275458525212114, 'bear_tsl_mult': 0.5579961767481241, 'bear_time_stop': 96, 'bear_use_sma': True, 'bear_use_ema': False, 'bear_use_atr': True, 'bear_use_adx': True, 'bear_use_spike': False, 'bear_rsi_required': True, 'sideways_strategy': 'breakout', 'sideways_bb_std_mult': 0.5500956514292024, 'sideways_rsi_os': 26, 'sideways_rsi_ob': 59, 'sideways_adx_thresh': 26.917560051698963, 'sideways_atr_min_pct': 0.029778379682348068, 'sideways_atr_max_pct': 0.11046042961419446, 'sideways_tp_mult': 2.361621255937169, 'sideways_tsl_mult': 0.9170426236040169, 'sideways_time_stop': 30, 'sideways_use_sma': False, 'sideways_use_ema': False, 'sideways_use_atr': True, 'sideways_use_adx': True, 'sideways_use_spike': True, 'sideways_rsi_required': False}.
[I 2025-08-31 03:07:37,469] Trial 30 finished with values: [-1000000000.0, 1000000000.0] and parameters: {'p_sma': 23, 'p_std': 31, 'p_atr': 21, 'p_adx': 11, 'rsi_period': 61, 'ema1': 10, 'ema2': 16, 'slip_atr_k': 0.023057991444634385, 'slip_spread_k': 0.2090210647147009, 'spread_hl_frac': 0.03149027497470566, 'bb_std_mult': 0.7409401295327389, 'rsi_os': 30, 'rsi_ob': 75, 'vol_spike': 0.2460807599638852, 'adx_thresh': 12.710041108914549, 'atr_min_pct': 0.02646940669964295, 'atr_max_pct': 0.13862921378304124, 'tp_mult': 2.8445827133881236, 'tsl_mult': 0.5252644500156243, 'strategy': 'breakout', 'time_stop': 247, 'use_sma': False, 'use_atr': True, 'use_adx': True, 'use_ema': False, 'use_spike': True, 'rsi_required': False, 'edge_k': 1.193809337806071, 'edge_cap': 0.18304078821684297, 'bull_strategy': 'breakout', 'bull_bb_std_mult': 1.9815460998369008, 'bull_rsi_os': 14, 'bull_rsi_ob': 80, 'bull_adx_thresh': 12.930510732139458, 'bull_atr_min_pct': 0.010536416354602413, 'bull_atr_max_pct': 0.13668152858520127, 'bull_tp_mult': 2.137863607601917, 'bull_tsl_mult': 0.7539715272379315, 'bull_time_stop': 163, 'bull_use_sma': False, 'bull_use_ema': True, 'bull_use_atr': True, 'bull_use_adx': False, 'bull_use_spike': False, 'bull_rsi_required': False, 'bear_strategy': 'breakout', 'bear_bb_std_mult': 0.7887417303128245, 'bear_rsi_os': 22, 'bear_rsi_ob': 95, 'bear_adx_thresh': 15.58736204935451, 'bear_atr_min_pct': 0.00033934065140844155, 'bear_atr_max_pct': 0.055122385886727465, 'bear_tp_mult': 1.886995685696322, 'bear_tsl_mult': 0.9256234268007519, 'bear_time_stop': 40, 'bear_use_sma': False, 'bear_use_ema': False, 'bear_use_atr': False, 'bear_use_adx': False, 'bear_use_spike': True, 'bear_rsi_required': False, 'sideways_strategy': 'mean_reversion', 'sideways_bb_std_mult': 2.518850634072789, 'sideways_rsi_os': 45, 'sideways_rsi_ob': 50, 'sideways_adx_thresh': 21.266243703407664, 'sideways_atr_min_pct': 0.029406772463500448, 'sideways_atr_max_pct': 0.14985245732496374, 'sideways_tp_mult': 2.983938205164696, 'sideways_tsl_mult': 0.45163968048682424, 'sideways_time_stop': 86, 'sideways_use_sma': False, 'sideways_use_ema': True, 'sideways_use_atr': False, 'sideways_use_adx': False, 'sideways_use_spike': False, 'sideways_rsi_required': True}.
[I 2025-08-31 03:07:37,957] Trial 32 finished with values: [-0.056287649181732236, 0.0561389146557414] and parameters: {'p_sma': 47, 'p_std': 31, 'p_atr': 9, 'p_adx': 10, 'rsi_period': 50, 'ema1': 12, 'ema2': 53, 'slip_atr_k': 0.09214205744335088, 'slip_spread_k': 0.3798047029071623, 'spread_hl_frac': 0.035011958653543576, 'bb_std_mult': 1.2945608213756725, 'rsi_os': 36, 'rsi_ob': 60, 'vol_spike': 0.24746384672045563, 'adx_thresh': 12.540415658772579, 'atr_min_pct': 0.011595156637093087, 'atr_max_pct': 0.08966572380048743, 'tp_mult': 2.6320603840827266, 'tsl_mult': 0.4167324467343481, 'strategy': 'breakout', 'time_stop': 59, 'use_sma': True, 'use_atr': False, 'use_adx': False, 'use_ema': False, 'use_spike': True, 'rsi_required': True, 'edge_k': 0.33987105306428017, 'edge_cap': 0.4395821651343649, 'bull_strategy': 'mean_reversion', 'bull_bb_std_mult': 1.5363300018178325, 'bull_rsi_os': 15, 'bull_rsi_ob': 88, 'bull_adx_thresh': 12.10668606157775, 'bull_atr_min_pct': 0.009832406953663395, 'bull_atr_max_pct': 0.09888682780999473, 'bull_tp_mult': 2.2326161819662294, 'bull_tsl_mult': 0.04537952031605036, 'bull_time_stop': 139, 'bull_use_sma': True, 'bull_use_ema': False, 'bull_use_atr': False, 'bull_use_adx': True, 'bull_use_spike': False, 'bull_rsi_required': False, 'bear_strategy': 'breakout', 'bear_bb_std_mult': 0.7857262866228754, 'bear_rsi_os': 41, 'bear_rsi_ob': 94, 'bear_adx_thresh': 22.665022954996036, 'bear_atr_min_pct': 0.00022624999226528685, 'bear_atr_max_pct': 0.06637907401444532, 'bear_tp_mult': 2.9517691291211055, 'bear_tsl_mult': 0.5672688569905879, 'bear_time_stop': 98, 'bear_use_sma': False, 'bear_use_ema': False, 'bear_use_atr': False, 'bear_use_adx': True, 'bear_use_spike': False, 'bear_rsi_required': False, 'sideways_strategy': 'breakout', 'sideways_bb_std_mult': 0.5439379331563039, 'sideways_rsi_os': 27, 'sideways_rsi_ob': 61, 'sideways_adx_thresh': 26.401684730652956, 'sideways_atr_min_pct': 0.006152042162918914, 'sideways_atr_max_pct': 0.10922309284735776, 'sideways_tp_mult': 2.9635199697676824, 'sideways_tsl_mult': 0.4157595458039498, 'sideways_time_stop': 30, 'sideways_use_sma': False, 'sideways_use_ema': True, 'sideways_use_atr': False, 'sideways_use_adx': True, 'sideways_use_spike': True, 'sideways_rsi_required': False}.
[I 2025-08-31 03:07:38,108] Trial 31 finished with values: [-1000000000.0, 1000000000.0] and parameters: {'p_sma': 23, 'p_std': 31, 'p_atr': 10, 'p_adx': 10, 'rsi_period': 75, 'ema1': 12, 'ema2': 16, 'slip_atr_k': 0.07367107557624276, 'slip_spread_k': 0.3646629660021782, 'spread_hl_frac': 0.04958525029104878, 'bb_std_mult': 0.7504536742016494, 'rsi_os': 25, 'rsi_ob': 91, 'vol_spike': 0.2400608676771299, 'adx_thresh': 13.33732037923652, 'atr_min_pct': 0.026464615986114923, 'atr_max_pct': 0.094638156745797, 'tp_mult': 2.8581162677446343, 'tsl_mult': 0.4844748793683087, 'strategy': 'breakout', 'time_stop': 62, 'use_sma': False, 'use_atr': False, 'use_adx': True, 'use_ema': False, 'use_spike': False, 'rsi_required': False, 'edge_k': 0.0017981519117290512, 'edge_cap': 0.4116394570682016, 'bull_strategy': 'breakout', 'bull_bb_std_mult': 2.6912104647628645, 'bull_rsi_os': 24, 'bull_rsi_ob': 86, 'bull_adx_thresh': 11.676273659062103, 'bull_atr_min_pct': 0.010819424074922326, 'bull_atr_max_pct': 0.09669679584122393, 'bull_tp_mult': 2.2009356413338015, 'bull_tsl_mult': 0.7389771463678252, 'bull_time_stop': 166, 'bull_use_sma': False, 'bull_use_ema': False, 'bull_use_atr': True, 'bull_use_adx': False, 'bull_use_spike': False, 'bull_rsi_required': True, 'bear_strategy': 'mean_reversion', 'bear_bb_std_mult': 0.8086404855614591, 'bear_rsi_os': 38, 'bear_rsi_ob': 55, 'bear_adx_thresh': 20.970036294521407, 'bear_atr_min_pct': 0.007152671521072948, 'bear_atr_max_pct': 0.1342057464782394, 'bear_tp_mult': 1.9595250236455084, 'bear_tsl_mult': 0.3714113182384111, 'bear_time_stop': 210, 'bear_use_sma': False, 'bear_use_ema': False, 'bear_use_atr': False, 'bear_use_adx': False, 'bear_use_spike': True, 'bear_rsi_required': False, 'sideways_strategy': 'breakout', 'sideways_bb_std_mult': 1.597947147595999, 'sideways_rsi_os': 24, 'sideways_rsi_ob': 63, 'sideways_adx_thresh': 27.30469596087864, 'sideways_atr_min_pct': 0.005164220301351528, 'sideways_atr_max_pct': 0.12098553484064171, 'sideways_tp_mult': 2.997209226962092, 'sideways_tsl_mult': 0.45354471310636707, 'sideways_time_stop': 29, 'sideways_use_sma': True, 'sideways_use_ema': True, 'sideways_use_atr': False, 'sideways_use_adx': True, 'sideways_use_spike': True, 'sideways_rsi_required': False}.
[I 2025-08-31 03:08:10,143] Trial 36 finished with values: [-1000000000.0, 1000000000.0] and parameters: {'p_sma': 21, 'p_std': 23, 'p_atr': 14, 'p_adx': 8, 'rsi_period': 74, 'ema1': 17, 'ema2': 10, 'slip_atr_k': 0.03317225315539382, 'slip_spread_k': 0.41547423655859206, 'spread_hl_frac': 0.0407936063137407, 'bb_std_mult': 0.5108828802488445, 'rsi_os': 42, 'rsi_ob': 93, 'vol_spike': 0.19145667742738687, 'adx_thresh': 23.5128645991698, 'atr_min_pct': 0.023138235487652592, 'atr_max_pct': 0.08114475039937019, 'tp_mult': 2.9951549836025366, 'tsl_mult': 0.3406576510267417, 'strategy': 'mean_reversion', 'time_stop': 298, 'use_sma': True, 'use_atr': False, 'use_adx': True, 'use_ema': False, 'use_spike': False, 'rsi_required': True, 'edge_k': 0.5901600688720081, 'edge_cap': 0.13002459632450902, 'bull_strategy': 'mean_reversion', 'bull_bb_std_mult': 3.1680502707067246, 'bull_rsi_os': 20, 'bull_rsi_ob': 95, 'bull_adx_thresh': 17.96234021456371, 'bull_atr_min_pct': 0.014535119978941153, 'bull_atr_max_pct': 0.010213396660449375, 'bull_tp_mult': 1.240436257955826, 'bull_tsl_mult': 0.9388633601940793, 'bull_time_stop': 118, 'bull_use_sma': False, 'bull_use_ema': False, 'bull_use_atr': True, 'bull_use_adx': False, 'bull_use_spike': True, 'bull_rsi_required': True, 'bear_strategy': 'mean_reversion', 'bear_bb_std_mult': 0.5258300883334824, 'bear_rsi_os': 10, 'bear_rsi_ob': 85, 'bear_adx_thresh': 21.018303254012146, 'bear_atr_min_pct': 0.01798636852502739, 'bear_atr_max_pct': 0.0417314587422115, 'bear_tp_mult': 1.0483399603942472, 'bear_tsl_mult': 0.7077511406277127, 'bear_time_stop': 235, 'bear_use_sma': False, 'bear_use_ema': False, 'bear_use_atr': False, 'bear_use_adx': False, 'bear_use_spike': True, 'bear_rsi_required': False, 'sideways_strategy': 'breakout', 'sideways_bb_std_mult': 1.5261013134038506, 'sideways_rsi_os': 13, 'sideways_rsi_ob': 49, 'sideways_adx_thresh': 18.19436963364443, 'sideways_atr_min_pct': 0.016517812132914506, 'sideways_atr_max_pct': 0.12120239122109319, 'sideways_tp_mult': 2.812139914121134, 'sideways_tsl_mult': 0.7668524157313233, 'sideways_time_stop': 168, 'sideways_use_sma': True, 'sideways_use_ema': False, 'sideways_use_atr': False, 'sideways_use_adx': True, 'sideways_use_spike': True, 'sideways_rsi_required': False}.
[I 2025-08-31 03:08:10,813] Trial 37 finished with values: [-1000000000.0, 1000000000.0] and parameters: {'p_sma': 8, 'p_std': 10, 'p_atr': 14, 'p_adx': 20, 'rsi_period': 18, 'ema1': 17, 'ema2': 19, 'slip_atr_k': 0.12365546954789337, 'slip_spread_k': 0.4246121138301556, 'spread_hl_frac': 0.04016079486024553, 'bb_std_mult': 0.5897921935935984, 'rsi_os': 42, 'rsi_ob': 93, 'vol_spike': 0.18922096662076823, 'adx_thresh': 23.648023338483085, 'atr_min_pct': 0.023504795557635804, 'atr_max_pct': 0.08226712200037836, 'tp_mult': 2.993914155478748, 'tsl_mult': 0.3344468467116609, 'strategy': 'mean_reversion', 'time_stop': 222, 'use_sma': True, 'use_atr': False, 'use_adx': False, 'use_ema': False, 'use_spike': False, 'rsi_required': True, 'edge_k': 0.6021156146874898, 'edge_cap': 0.11208234032263699, 'bull_strategy': 'mean_reversion', 'bull_bb_std_mult': 3.2238331861169054, 'bull_rsi_os': 19, 'bull_rsi_ob': 95, 'bull_adx_thresh': 18.261881225794493, 'bull_atr_min_pct': 0.014727466885998942, 'bull_atr_max_pct': 0.1253657910492168, 'bull_tp_mult': 1.2306021523176698, 'bull_tsl_mult': 0.8859565947935701, 'bull_time_stop': 128, 'bull_use_sma': False, 'bull_use_ema': False, 'bull_use_atr': True, 'bull_use_adx': False, 'bull_use_spike': True, 'bull_rsi_required': True, 'bear_strategy': 'mean_reversion', 'bear_bb_std_mult': 3.2885981655914858, 'bear_rsi_os': 10, 'bear_rsi_ob': 69, 'bear_adx_thresh': 26.96143172079923, 'bear_atr_min_pct': 0.01962658526412506, 'bear_atr_max_pct': 0.041855470591037267, 'bear_tp_mult': 1.1222971651575067, 'bear_tsl_mult': 0.6685500470591748, 'bear_time_stop': 246, 'bear_use_sma': True, 'bear_use_ema': True, 'bear_use_atr': False, 'bear_use_adx': False, 'bear_use_spike': True, 'bear_rsi_required': True, 'sideways_strategy': 'breakout', 'sideways_bb_std_mult': 1.9011962504495978, 'sideways_rsi_os': 13, 'sideways_rsi_ob': 49, 'sideways_adx_thresh': 18.549467685333827, 'sideways_atr_min_pct': 0.0015651740032058825, 'sideways_atr_max_pct': 0.08608561864246804, 'sideways_tp_mult': 2.826957265943402, 'sideways_tsl_mult': 0.6927634453818796, 'sideways_time_stop': 72, 'sideways_use_sma': True, 'sideways_use_ema': False, 'sideways_use_atr': True, 'sideways_use_adx': True, 'sideways_use_spike': True, 'sideways_rsi_required': False}.
