[I 2025-08-31 03:29:10,671] Trial 190 finished with values: [-1000000000.0, 1000000000.0] and parameters: {'p_sma': 8, 'p_std': 39, 'p_atr': 13, 'p_adx': 19, 'rsi_period': 79, 'ema1': 16, 'ema2': 35, 'slip_atr_k': 0.187081735304154, 'slip_spread_k': 0.24300456664843106, 'spread_hl_frac': 0.014288119137388295, 'bb_std_mult': 3.570920041943209, 'rsi_os': 14, 'rsi_ob': 85, 'vol_spike': 0.2352150630487474, 'adx_thresh': 25.06324982825369, 'atr_min_pct': 0.02434306774342525, 'atr_max_pct': 0.13436985135344698, 'tp_mult': 2.3447148886800835, 'tsl_mult': 0.5469915007763915, 'strategy': 'breakout', 'time_stop': 254, 'use_sma': True, 'use_atr': True, 'use_adx': True, 'use_ema': False, 'use_spike': False, 'rsi_required': True, 'edge_k': 1.610322919793715, 'edge_cap': 0.8797094384199973, 'bull_strategy': 'breakout', 'bull_bb_std_mult': 3.3883498820769753, 'bull_rsi_os': 18, 'bull_rsi_ob': 76, 'bull_adx_thresh': 19.815735648919542, 'bull_atr_min_pct': 0.0033665254631724084, 'bull_atr_max_pct': 0.0782043108952802, 'bull_tp_mult': 1.0100103996329204, 'bull_tsl_mult': 0.35204252351487625, 'bull_time_stop': 124, 'bull_use_sma': True, 'bull_use_ema': True, 'bull_use_atr': False, 'bull_use_adx': False, 'bull_use_spike': False, 'bull_rsi_required': False, 'bear_strategy': 'mean_reversion', 'bear_bb_std_mult': 2.187313274597966, 'bear_rsi_os': 19, 'bear_rsi_ob': 83, 'bear_adx_thresh': 9.803470944133451, 'bear_atr_min_pct': 0.02231027985273977, 'bear_atr_max_pct': 0.12175572315248713, 'bear_tp_mult': 1.2346832049437146, 'bear_tsl_mult': 0.9632289210176318, 'bear_time_stop': 40, 'bear_use_sma': False, 'bear_use_ema': False, 'bear_use_atr': True, 'bear_use_adx': True, 'bear_use_spike': False, 'bear_rsi_required': True, 'sideways_strategy': 'breakout', 'sideways_bb_std_mult': 1.6254357370807808, 'sideways_rsi_os': 21, 'sideways_rsi_ob': 93, 'sideways_adx_thresh': 5.651579905074254, 'sideways_atr_min_pct': 0.02179054891159745, 'sideways_atr_max_pct': 0.04174995261266262, 'sideways_tp_mult': 2.1804593184331202, 'sideways_tsl_mult': 0.16750966220701657, 'sideways_time_stop': 240, 'sideways_use_sma': True, 'sideways_use_ema': True, 'sideways_use_atr': True, 'sideways_use_adx': True, 'sideways_use_spike': True, 'sideways_rsi_required': True}.
[I 2025-08-31 03:29:10,812] Trial 188 finished with values: [-1000000000.0, 1000000000.0] and parameters: {'p_sma': 9, 'p_std': 39, 'p_atr': 29, 'p_adx': 12, 'rsi_period': 76, 'ema1': 27, 'ema2': 22, 'slip_atr_k': 0.18781444167075145, 'slip_spread_k': 0.23809954736380656, 'spread_hl_frac': 0.017203910387528623, 'bb_std_mult': 1.632595933629117, 'rsi_os': 14, 'rsi_ob': 61, 'vol_spike': 0.07911926196502037, 'adx_thresh': 13.31975900981888, 'atr_min_pct': 0.0030680365841199344, 'atr_max_pct': 0.1451259264504825, 'tp_mult': 1.6095806885481165, 'tsl_mult': 0.20987517371942238, 'strategy': 'breakout', 'time_stop': 25, 'use_sma': True, 'use_atr': True, 'use_adx': True, 'use_ema': False, 'use_spike': False, 'rsi_required': True, 'edge_k': 0.18744897020146217, 'edge_cap': 0.1051569333441869, 'bull_strategy': 'breakout', 'bull_bb_std_mult': 1.4591784660835714, 'bull_rsi_os': 38, 'bull_rsi_ob': 76, 'bull_adx_thresh': 14.57824849476247, 'bull_atr_min_pct': 0.0013468056793665968, 'bull_atr_max_pct': 0.017077697299016342, 'bull_tp_mult': 1.5329778195346622, 'bull_tsl_mult': 0.3506156544303554, 'bull_time_stop': 288, 'bull_use_sma': False, 'bull_use_ema': False, 'bull_use_atr': True, 'bull_use_adx': False, 'bull_use_spike': False, 'bull_rsi_required': True, 'bear_strategy': 'mean_reversion', 'bear_bb_std_mult': 2.3056248754404836, 'bear_rsi_os': 23, 'bear_rsi_ob': 83, 'bear_adx_thresh': 9.992981576273499, 'bear_atr_min_pct': 0.007993233616634465, 'bear_atr_max_pct': 0.11286408910279802, 'bear_tp_mult': 2.1150379135886, 'bear_tsl_mult': 0.9665524812228358, 'bear_time_stop': 289, 'bear_use_sma': False, 'bear_use_ema': False, 'bear_use_atr': True, 'bear_use_adx': False, 'bear_use_spike': True, 'bear_rsi_required': True, 'sideways_strategy': 'breakout', 'sideways_bb_std_mult': 1.5860889880791686, 'sideways_rsi_os': 36, 'sideways_rsi_ob': 81, 'sideways_adx_thresh': 34.688626516676194, 'sideways_atr_min_pct': 0.02191338325879022, 'sideways_atr_max_pct': 0.11790045093229602, 'sideways_tp_mult': 2.1552417852361496, 'sideways_tsl_mult': 0.28530727236234915, 'sideways_time_stop': 157, 'sideways_use_sma': True, 'sideways_use_ema': True, 'sideways_use_atr': False, 'sideways_use_adx': True, 'sideways_use_spike': True, 'sideways_rsi_required': False}.
[I 2025-08-31 03:29:11,067] Trial 191 finished with values: [-1000000000.0, 1000000000.0] and parameters: {'p_sma': 9, 'p_std': 47, 'p_atr': 9, 'p_adx': 20, 'rsi_period': 79, 'ema1': 16, 'ema2': 35, 'slip_atr_k': 0.013084620442743325, 'slip_spread_k': 0.6431907873805623, 'spread_hl_frac': 0.02284065603996625, 'bb_std_mult': 2.1100746017020886, 'rsi_os': 50, 'rsi_ob': 82, 'vol_spike': 0.07979938031439074, 'adx_thresh': 13.33668060370901, 'atr_min_pct': 0.007205258991631009, 'atr_max_pct': 0.057655858946065744, 'tp_mult': 1.4949544373271806, 'tsl_mult': 0.9210351340138339, 'strategy': 'breakout', 'time_stop': 17, 'use_sma': True, 'use_atr': True, 'use_adx': True, 'use_ema': False, 'use_spike': False, 'rsi_required': True, 'edge_k': 0.27424322319059796, 'edge_cap': 0.5244030437745782, 'bull_strategy': 'breakout', 'bull_bb_std_mult': 0.8708813300735962, 'bull_rsi_os': 18, 'bull_rsi_ob': 76, 'bull_adx_thresh': 26.525246878849202, 'bull_atr_min_pct': 0.0021999452748582282, 'bull_atr_max_pct': 0.028651630255000785, 'bull_tp_mult': 1.5327223382638808, 'bull_tsl_mult': 0.3574752246712777, 'bull_time_stop': 124, 'bull_use_sma': True, 'bull_use_ema': True, 'bull_use_atr': False, 'bull_use_adx': False, 'bull_use_spike': True, 'bull_rsi_required': False, 'bear_strategy': 'breakout', 'bear_bb_std_mult': 2.170409473490051, 'bear_rsi_os': 19, 'bear_rsi_ob': 79, 'bear_adx_thresh': 27.99666086226078, 'bear_atr_min_pct': 0.008136360322741131, 'bear_atr_max_pct': 0.10131731291289796, 'bear_tp_mult': 2.2690259008323306, 'bear_tsl_mult': 0.7583117077308474, 'bear_time_stop': 299, 'bear_use_sma': False, 'bear_use_ema': False, 'bear_use_atr': True, 'bear_use_adx': True, 'bear_use_spike': False, 'bear_rsi_required': True, 'sideways_strategy': 'breakout', 'sideways_bb_std_mult': 1.591668829041566, 'sideways_rsi_os': 45, 'sideways_rsi_ob': 74, 'sideways_adx_thresh': 11.077136663284397, 'sideways_atr_min_pct': 0.003406725737625644, 'sideways_atr_max_pct': 0.044440196043533546, 'sideways_tp_mult': 2.1631916679185306, 'sideways_tsl_mult': 0.27906519040709293, 'sideways_time_stop': 255, 'sideways_use_sma': False, 'sideways_use_ema': True, 'sideways_use_atr': True, 'sideways_use_adx': True, 'sideways_use_spike': True, 'sideways_rsi_required': True}.
[I 2025-08-31 03:29:11,524] Trial 194 finished with values: [-1000000000.0, 1000000000.0] and parameters: {'p_sma': 11, 'p_std': 22, 'p_atr': 23, 'p_adx': 13, 'rsi_period': 17, 'ema1': 15, 'ema2': 20, 'slip_atr_k': 0.1998281394940098, 'slip_spread_k': 0.18146866018664465, 'spread_hl_frac': 0.019961445287928606, 'bb_std_mult': 1.9796453140924937, 'rsi_os': 50, 'rsi_ob': 79, 'vol_spike': 0.05979000327570684, 'adx_thresh': 24.64790448995036, 'atr_min_pct': 0.023242583224029417, 'atr_max_pct': 0.051249482368522586, 'tp_mult': 1.539802996982732, 'tsl_mult': 0.48270061134448683, 'strategy': 'mean_reversion', 'time_stop': 216, 'use_sma': True, 'use_atr': True, 'use_adx': True, 'use_ema': True, 'use_spike': False, 'rsi_required': True, 'edge_k': 1.541138741473143, 'edge_cap': 0.47237997428078093, 'bull_strategy': 'mean_reversion', 'bull_bb_std_mult': 0.6671097895781068, 'bull_rsi_os': 14, 'bull_rsi_ob': 74, 'bull_adx_thresh': 29.278509807297088, 'bull_atr_min_pct': 0.00141867846920718, 'bull_atr_max_pct': 0.031468000392846265, 'bull_tp_mult': 1.4426617312928574, 'bull_tsl_mult': 0.37955569169898107, 'bull_time_stop': 135, 'bull_use_sma': True, 'bull_use_ema': True, 'bull_use_atr': False, 'bull_use_adx': False, 'bull_use_spike': True, 'bull_rsi_required': True, 'bear_strategy': 'breakout', 'bear_bb_std_mult': 3.516449293580109, 'bear_rsi_os': 20, 'bear_rsi_ob': 56, 'bear_adx_thresh': 6.889361209309863, 'bear_atr_min_pct': 0.006659434422378723, 'bear_atr_max_pct': 0.12385792620615375, 'bear_tp_mult': 2.3677450687183765, 'bear_tsl_mult': 0.9283311868583778, 'bear_time_stop': 274, 'bear_use_sma': False, 'bear_use_ema': True, 'bear_use_atr': False, 'bear_use_adx': False, 'bear_use_spike': False, 'bear_rsi_required': True, 'sideways_strategy': 'breakout', 'sideways_bb_std_mult': 1.3680142746240151, 'sideways_rsi_os': 16, 'sideways_rsi_ob': 78, 'sideways_adx_thresh': 6.51160207437257, 'sideways_atr_min_pct': 0.0032503935427683588, 'sideways_atr_max_pct': 0.12271860118048962, 'sideways_tp_mult': 2.7326928324198105, 'sideways_tsl_mult': 0.6186506203462157, 'sideways_time_stop': 135, 'sideways_use_sma': False, 'sideways_use_ema': False, 'sideways_use_atr': False, 'sideways_use_adx': False, 'sideways_use_spike': False, 'sideways_rsi_required': True}.
[I 2025-08-31 03:29:48,734] Trial 192 finished with values: [-1000000000.0, 1000000000.0] and parameters: {'p_sma': 9, 'p_std': 22, 'p_atr': 23, 'p_adx': 19, 'rsi_period': 28, 'ema1': 15, 'ema2': 20, 'slip_atr_k': 0.014102225426359666, 'slip_spread_k': 0.18721762121698535, 'spread_hl_frac': 0.020080532440615535, 'bb_std_mult': 1.9771869577987902, 'rsi_os': 13, 'rsi_ob': 82, 'vol_spike': 0.08089854351616127, 'adx_thresh': 24.873095952337167, 'atr_min_pct': 0.014580036876321244, 'atr_max_pct': 0.1337502738713433, 'tp_mult': 2.3634707790972813, 'tsl_mult': 0.5241369322845295, 'strategy': 'breakout', 'time_stop': 39, 'use_sma': True, 'use_atr': True, 'use_adx': True, 'use_ema': False, 'use_spike': False, 'rsi_required': True, 'edge_k': 0.38613296383518786, 'edge_cap': 0.6024914633863476, 'bull_strategy': 'mean_reversion', 'bull_bb_std_mult': 0.8557871574572142, 'bull_rsi_os': 41, 'bull_rsi_ob': 87, 'bull_adx_thresh': 6.1364176525416365, 'bull_atr_min_pct': 0.018549710466179745, 'bull_atr_max_pct': 0.049799060203774774, 'bull_tp_mult': 1.4492518860901604, 'bull_tsl_mult': 0.04393391347000958, 'bull_time_stop': 139, 'bull_use_sma': True, 'bull_use_ema': True, 'bull_use_atr': False, 'bull_use_adx': False, 'bull_use_spike': True, 'bull_rsi_required': False, 'bear_strategy': 'breakout', 'bear_bb_std_mult': 2.1946977325422248, 'bear_rsi_os': 19, 'bear_rsi_ob': 47, 'bear_adx_thresh': 27.15363386516403, 'bear_atr_min_pct': 0.007005555442346423, 'bear_atr_max_pct': 0.09988680395638522, 'bear_tp_mult': 2.1218041116507265, 'bear_tsl_mult': 0.2623028286627477, 'bear_time_stop': 298, 'bear_use_sma': False, 'bear_use_ema': False, 'bear_use_atr': False, 'bear_use_adx': True, 'bear_use_spike': False, 'bear_rsi_required': True, 'sideways_strategy': 'breakout', 'sideways_bb_std_mult': 1.3776428871068451, 'sideways_rsi_os': 10, 'sideways_rsi_ob': 77, 'sideways_adx_thresh': 34.50835352086863, 'sideways_atr_min_pct': 0.0036244432308723358, 'sideways_atr_max_pct': 0.05078454110300486, 'sideways_tp_mult': 2.6181736304119214, 'sideways_tsl_mult': 0.942590695658835, 'sideways_time_stop': 167, 'sideways_use_sma': False, 'sideways_use_ema': True, 'sideways_use_atr': False, 'sideways_use_adx': True, 'sideways_use_spike': False, 'sideways_rsi_required': True}.
[I 2025-08-31 03:29:49,394] Trial 193 finished with values: [-0.0611873475911483, 0.06116274997320527] and parameters: {'p_sma': 24, 'p_std': 7, 'p_atr': 23, 'p_adx': 13, 'rsi_period': 25, 'ema1': 15, 'ema2': 20, 'slip_atr_k': 0.14317887161798148, 'slip_spread_k': 0.6481222897622234, 'spread_hl_frac': 0.02235377091280369, 'bb_std_mult': 1.977192671005501, 'rsi_os': 16, 'rsi_ob': 63, 'vol_spike': 0.28666397492342455, 'adx_thresh': 6.12956214074925, 'atr_min_pct': 0.00711267877845091, 'atr_max_pct': 0.13899843160119732, 'tp_mult': 1.5508510138521767, 'tsl_mult': 0.8176902282443571, 'strategy': 'mean_reversion', 'time_stop': 38, 'use_sma': True, 'use_atr': True, 'use_adx': True, 'use_ema': True, 'use_spike': False, 'rsi_required': True, 'edge_k': 0.37110073657477416, 'edge_cap': 0.13220372969390123, 'bull_strategy': 'mean_reversion', 'bull_bb_std_mult': 0.6876309225172412, 'bull_rsi_os': 42, 'bull_rsi_ob': 82, 'bull_adx_thresh': 27.456347197978722, 'bull_atr_min_pct': 0.0016774123712926972, 'bull_atr_max_pct': 0.06577639522001155, 'bull_tp_mult': 1.4424522227462357, 'bull_tsl_mult': 0.1130509624879823, 'bull_time_stop': 138, 'bull_use_sma': True, 'bull_use_ema': True, 'bull_use_atr': False, 'bull_use_adx': False, 'bull_use_spike': True, 'bull_rsi_required': True, 'bear_strategy': 'breakout', 'bear_bb_std_mult': 2.1543698065157932, 'bear_rsi_os': 24, 'bear_rsi_ob': 95, 'bear_adx_thresh': 12.506308395455648, 'bear_atr_min_pct': 0.007208325503961218, 'bear_atr_max_pct': 0.09533135431889715, 'bear_tp_mult': 2.242899075093109, 'bear_tsl_mult': 0.27749616577446246, 'bear_time_stop': 269, 'bear_use_sma': False, 'bear_use_ema': True, 'bear_use_atr': False, 'bear_use_adx': False, 'bear_use_spike': False, 'bear_rsi_required': True, 'sideways_strategy': 'breakout', 'sideways_bb_std_mult': 0.5926107407810246, 'sideways_rsi_os': 38, 'sideways_rsi_ob': 64, 'sideways_adx_thresh': 6.7216353200888275, 'sideways_atr_min_pct': 0.0014188893869533075, 'sideways_atr_max_pct': 0.12172365764942768, 'sideways_tp_mult': 1.5402326043065557, 'sideways_tsl_mult': 0.5221291917411899, 'sideways_time_stop': 216, 'sideways_use_sma': False, 'sideways_use_ema': False, 'sideways_use_atr': False, 'sideways_use_adx': False, 'sideways_use_spike': False, 'sideways_rsi_required': True}.
[I 2025-08-31 03:29:49,621] Trial 195 finished with values: [-0.1343290968670613, 0.1342472715505467] and parameters: {'p_sma': 60, 'p_std': 7, 'p_atr': 12, 'p_adx': 13, 'rsi_period': 18, 'ema1': 21, 'ema2': 21, 'slip_atr_k': 0.10825848390428497, 'slip_spread_k': 0.18185802751725882, 'spread_hl_frac': 0.0038376542668998384, 'bb_std_mult': 1.984396574863026, 'rsi_os': 12, 'rsi_ob': 64, 'vol_spike': 0.05798935746627509, 'adx_thresh': 16.84454847008391, 'atr_min_pct': 0.02149630926781841, 'atr_max_pct': 0.05153194616210293, 'tp_mult': 1.264725261945324, 'tsl_mult': 0.8116146709276149, 'strategy': 'mean_reversion', 'time_stop': 136, 'use_sma': True, 'use_atr': True, 'use_adx': True, 'use_ema': True, 'use_spike': False, 'rsi_required': True, 'edge_k': 1.8451713247444959, 'edge_cap': 0.4713680703222648, 'bull_strategy': 'mean_reversion', 'bull_bb_std_mult': 1.1635521669257867, 'bull_rsi_os': 25, 'bull_rsi_ob': 59, 'bull_adx_thresh': 5.993287315200096, 'bull_atr_min_pct': 0.0015341158809533337, 'bull_atr_max_pct': 0.03225496025657821, 'bull_tp_mult': 2.3400247452354366, 'bull_tsl_mult': 0.3796672748142874, 'bull_time_stop': 138, 'bull_use_sma': True, 'bull_use_ema': False, 'bull_use_atr': True, 'bull_use_adx': False, 'bull_use_spike': True, 'bull_rsi_required': True, 'bear_strategy': 'breakout', 'bear_bb_std_mult': 3.483786317970072, 'bear_rsi_os': 24, 'bear_rsi_ob': 81, 'bear_adx_thresh': 30.833422621143313, 'bear_atr_min_pct': 0.006653854637493805, 'bear_atr_max_pct': 0.12180922246678133, 'bear_tp_mult': 2.0691850804084213, 'bear_tsl_mult': 0.9339475141098663, 'bear_time_stop': 262, 'bear_use_sma': False, 'bear_use_ema': True, 'bear_use_atr': False, 'bear_use_adx': False, 'bear_use_spike': False, 'bear_rsi_required': True, 'sideways_strategy': 'breakout', 'sideways_bb_std_mult': 1.3729564633812212, 'sideways_rsi_os': 38, 'sideways_rsi_ob': 80, 'sideways_adx_thresh': 6.439594462263787, 'sideways_atr_min_pct': 0.0010447603668922907, 'sideways_atr_max_pct': 0.025837980758522137, 'sideways_tp_mult': 1.5396920135633705, 'sideways_tsl_mult': 0.9419916791785425, 'sideways_time_stop': 30, 'sideways_use_sma': False, 'sideways_use_ema': False, 'sideways_use_atr': False, 'sideways_use_adx': False, 'sideways_use_spike': False, 'sideways_rsi_required': True}.
[I 2025-08-31 03:29:50,646] Trial 196 finished with values: [-0.02607433541996851, 0.02603733004061448] and parameters: {'p_sma': 54, 'p_std': 7, 'p_atr': 10, 'p_adx': 21, 'rsi_period': 24, 'ema1': 21, 'ema2': 20, 'slip_atr_k': 0.019305644887609497, 'slip_spread_k': 0.7904243015480564, 'spread_hl_frac': 0.02521664872700481, 'bb_std_mult': 2.0388806641718777, 'rsi_os': 12, 'rsi_ob': 63, 'vol_spike': 0.007954875550001156, 'adx_thresh': 19.517108536363736, 'atr_min_pct': 0.02115567403729276, 'atr_max_pct': 0.13913549210377868, 'tp_mult': 2.648417716261142, 'tsl_mult': 0.8271057106592177, 'strategy': 'mean_reversion', 'time_stop': 34, 'use_sma': True, 'use_atr': True, 'use_adx': True, 'use_ema': True, 'use_spike': False, 'rsi_required': True, 'edge_k': 1.9864096435979786, 'edge_cap': 0.1419816040253833, 'bull_strategy': 'mean_reversion', 'bull_bb_std_mult': 1.1657350982565067, 'bull_rsi_os': 27, 'bull_rsi_ob': 59, 'bull_adx_thresh': 10.268103744125275, 'bull_atr_min_pct': 0.0016254238288220578, 'bull_atr_max_pct': 0.11648162808108053, 'bull_tp_mult': 2.3322287148596397, 'bull_tsl_mult': 0.6290424186753563, 'bull_time_stop': 131, 'bull_use_sma': False, 'bull_use_ema': False, 'bull_use_atr': True, 'bull_use_adx': True, 'bull_use_spike': False, 'bull_rsi_required': True, 'bear_strategy': 'breakout', 'bear_bb_std_mult': 2.0447865351133485, 'bear_rsi_os': 24, 'bear_rsi_ob': 81, 'bear_adx_thresh': 12.537878070998593, 'bear_atr_min_pct': 0.007115779706277368, 'bear_atr_max_pct': 0.08179832401552893, 'bear_tp_mult': 2.062660684051954, 'bear_tsl_mult': 0.9076447717203532, 'bear_time_stop': 260, 'bear_use_sma': False, 'bear_use_ema': False, 'bear_use_atr': False, 'bear_use_adx': False, 'bear_use_spike': True, 'bear_rsi_required': True, 'sideways_strategy': 'mean_reversion', 'sideways_bb_std_mult': 1.4525669691660437, 'sideways_rsi_os': 38, 'sideways_rsi_ob': 80, 'sideways_adx_thresh': 9.601141790611413, 'sideways_atr_min_pct': 0.001178442647090893, 'sideways_atr_max_pct': 0.1112318772910247, 'sideways_tp_mult': 2.7080348641069794, 'sideways_tsl_mult': 0.33743245362638075, 'sideways_time_stop': 166, 'sideways_use_sma': False, 'sideways_use_ema': True, 'sideways_use_atr': False, 'sideways_use_adx': True, 'sideways_use_spike': False, 'sideways_rsi_required': False}.
[I 2025-08-31 03:29:51,101] Trial 197 finished with values: [-1000000000.0, 1000000000.0] and parameters: {'p_sma': 37, 'p_std': 9, 'p_atr': 10, 'p_adx': 26, 'rsi_period': 20, 'ema1': 14, 'ema2': 20, 'slip_atr_k': 0.02155262758257149, 'slip_spread_k': 0.20725840840261714, 'spread_hl_frac': 0.0037537481180478696, 'bb_std_mult': 2.0389284318237726, 'rsi_os': 16, 'rsi_ob': 63, 'vol_spike': 0.247911839719557, 'adx_thresh': 9.753092715496244, 'atr_min_pct': 0.021463050205141686, 'atr_max_pct': 0.010462767603284198, 'tp_mult': 2.6578727714929764, 'tsl_mult': 0.8147171127961612, 'strategy': 'mean_reversion', 'time_stop': 300, 'use_sma': True, 'use_atr': True, 'use_adx': False, 'use_ema': True, 'use_spike': True, 'rsi_required': True, 'edge_k': 1.3375569026631366, 'edge_cap': 0.15072568532034664, 'bull_strategy': 'breakout', 'bull_bb_std_mult': 1.3834478515404507, 'bull_rsi_os': 16, 'bull_rsi_ob': 58, 'bull_adx_thresh': 27.903891754278373, 'bull_atr_min_pct': 0.0014881825950815754, 'bull_atr_max_pct': 0.05872831152380931, 'bull_tp_mult': 1.3651293539171196, 'bull_tsl_mult': 0.752875624934434, 'bull_time_stop': 130, 'bull_use_sma': False, 'bull_use_ema': False, 'bull_use_atr': True, 'bull_use_adx': True, 'bull_use_spike': False, 'bull_rsi_required': True, 'bear_strategy': 'mean_reversion', 'bear_bb_std_mult': 1.7588898285534178, 'bear_rsi_os': 45, 'bear_rsi_ob': 95, 'bear_adx_thresh': 12.846283202248914, 'bear_atr_min_pct': 0.015241713188470653, 'bear_atr_max_pct': 0.1199661556176708, 'bear_tp_mult': 2.245875853233573, 'bear_tsl_mult': 0.019980143408108664, 'bear_time_stop': 260, 'bear_use_sma': False, 'bear_use_ema': False, 'bear_use_atr': False, 'bear_use_adx': False, 'bear_use_spike': True, 'bear_rsi_required': True, 'sideways_strategy': 'mean_reversion', 'sideways_bb_std_mult': 2.0828877247233986, 'sideways_rsi_os': 39, 'sideways_rsi_ob': 63, 'sideways_adx_thresh': 32.9074304871685, 'sideways_atr_min_pct': 0.012555297264570123, 'sideways_atr_max_pct': 0.11466475900320039, 'sideways_tp_mult': 2.381538264297798, 'sideways_tsl_mult': 0.9964090128021694, 'sideways_time_stop': 217, 'sideways_use_sma': True, 'sideways_use_ema': False, 'sideways_use_atr': False, 'sideways_use_adx': False, 'sideways_use_spike': False, 'sideways_rsi_required': False}.
