[I 2025-08-31 03:12:39,131] Trial 73 finished with values: [-1000000000.0, 1000000000.0] and parameters: {'p_sma': 16, 'p_std': 12, 'p_atr': 13, 'p_adx': 10, 'rsi_period': 26, 'ema1': 21, 'ema2': 17, 'slip_atr_k': 0.05943702116057159, 'slip_spread_k': 0.35570095179324024, 'spread_hl_frac': 0.023888917562398877, 'bb_std_mult': 0.6984989845355014, 'rsi_os': 52, 'rsi_ob': 73, 'vol_spike': 0.02226364766679209, 'adx_thresh': 6.1343893714754625, 'atr_min_pct': 0.0022968323326904017, 'atr_max_pct': 0.11323859715491147, 'tp_mult': 2.687947323237599, 'tsl_mult': 0.9618460959018865, 'strategy': 'mean_reversion', 'time_stop': 128, 'use_sma': False, 'use_atr': True, 'use_adx': False, 'use_ema': False, 'use_spike': False, 'rsi_required': True, 'edge_k': 0.30560231716555103, 'edge_cap': 0.11581672340328535, 'bull_strategy': 'mean_reversion', 'bull_bb_std_mult': 2.4732929050763985, 'bull_rsi_os': 23, 'bull_rsi_ob': 68, 'bull_adx_thresh': 16.695522167675477, 'bull_atr_min_pct': 0.01122891960490578, 'bull_atr_max_pct': 0.13041681799023516, 'bull_tp_mult': 2.2950319642910366, 'bull_tsl_mult': 0.5611509402168979, 'bull_time_stop': 127, 'bull_use_sma': True, 'bull_use_ema': True, 'bull_use_atr': True, 'bull_use_adx': True, 'bull_use_spike': False, 'bull_rsi_required': True, 'bear_strategy': 'mean_reversion', 'bear_bb_std_mult': 0.6481753460787232, 'bear_rsi_os': 50, 'bear_rsi_ob': 72, 'bear_adx_thresh': 28.848554345111598, 'bear_atr_min_pct': 0.00804446168364859, 'bear_atr_max_pct': 0.04895695345492186, 'bear_tp_mult': 1.895203355433703, 'bear_tsl_mult': 0.9993606125056321, 'bear_time_stop': 225, 'bear_use_sma': False, 'bear_use_ema': True, 'bear_use_atr': False, 'bear_use_adx': False, 'bear_use_spike': False, 'bear_rsi_required': False, 'sideways_strategy': 'breakout', 'sideways_bb_std_mult': 2.6329286251676076, 'sideways_rsi_os': 16, 'sideways_rsi_ob': 63, 'sideways_adx_thresh': 17.380171179378838, 'sideways_atr_min_pct': 0.004918785935925979, 'sideways_atr_max_pct': 0.07822528441143682, 'sideways_tp_mult': 2.937586079050653, 'sideways_tsl_mult': 0.5003617193996522, 'sideways_time_stop': 22, 'sideways_use_sma': True, 'sideways_use_ema': True, 'sideways_use_atr': False, 'sideways_use_adx': True, 'sideways_use_spike': True, 'sideways_rsi_required': False}.
[I 2025-08-31 03:13:08,976] Trial 72 finished with values: [-1000000000.0, 1000000000.0] and parameters: {'p_sma': 12, 'p_std': 12, 'p_atr': 8, 'p_adx': 24, 'rsi_period': 63, 'ema1': 15, 'ema2': 44, 'slip_atr_k': 0.0599344637645762, 'slip_spread_k': 0.46404067142771477, 'spread_hl_frac': 0.03271087931802196, 'bb_std_mult': 1.5365604145624137, 'rsi_os': 38, 'rsi_ob': 57, 'vol_spike': 0.16990726473232487, 'adx_thresh': 17.66426662414589, 'atr_min_pct': 0.019209537694376357, 'atr_max_pct': 0.04296207116887148, 'tp_mult': 1.1247322508309283, 'tsl_mult': 0.4286859367258269, 'strategy': 'mean_reversion', 'time_stop': 91, 'use_sma': False, 'use_atr': True, 'use_adx': True, 'use_ema': False, 'use_spike': False, 'rsi_required': False, 'edge_k': 0.06932464196525864, 'edge_cap': 0.11142265477491153, 'bull_strategy': 'breakout', 'bull_bb_std_mult': 0.6068592732170923, 'bull_rsi_os': 40, 'bull_rsi_ob': 79, 'bull_adx_thresh': 31.044518485316654, 'bull_atr_min_pct': 0.009360176795566964, 'bull_atr_max_pct': 0.13226271937495154, 'bull_tp_mult': 1.4294223730515023, 'bull_tsl_mult': 0.13617464704815524, 'bull_time_stop': 131, 'bull_use_sma': False, 'bull_use_ema': True, 'bull_use_atr': True, 'bull_use_adx': True, 'bull_use_spike': False, 'bull_rsi_required': True, 'bear_strategy': 'mean_reversion', 'bear_bb_std_mult': 0.6405581813165755, 'bear_rsi_os': 42, 'bear_rsi_ob': 79, 'bear_adx_thresh': 19.56667432600779, 'bear_atr_min_pct': 0.007914716843919836, 'bear_atr_max_pct': 0.074666376408723, 'bear_tp_mult': 1.5273521306316198, 'bear_tsl_mult': 0.9686236048499874, 'bear_time_stop': 154, 'bear_use_sma': False, 'bear_use_ema': False, 'bear_use_atr': False, 'bear_use_adx': False, 'bear_use_spike': True, 'bear_rsi_required': False, 'sideways_strategy': 'breakout', 'sideways_bb_std_mult': 3.5657303145465917, 'sideways_rsi_os': 46, 'sideways_rsi_ob': 62, 'sideways_adx_thresh': 17.442524226009997, 'sideways_atr_min_pct': 0.014985934312834799, 'sideways_atr_max_pct': 0.0757243054510867, 'sideways_tp_mult': 2.921731620884046, 'sideways_tsl_mult': 0.015395579382441793, 'sideways_time_stop': 21, 'sideways_use_sma': True, 'sideways_use_ema': True, 'sideways_use_atr': False, 'sideways_use_adx': True, 'sideways_use_spike': True, 'sideways_rsi_required': False}.
[I 2025-08-31 03:13:10,175] Trial 74 finished with values: [-1000000000.0, 1000000000.0] and parameters: {'p_sma': 12, 'p_std': 12, 'p_atr': 8, 'p_adx': 24, 'rsi_period': 68, 'ema1': 19, 'ema2': 17, 'slip_atr_k': 0.08876211610707185, 'slip_spread_k': 0.4452070116354242, 'spread_hl_frac': 0.02480764642248206, 'bb_std_mult': 0.6790590641523286, 'rsi_os': 37, 'rsi_ob': 93, 'vol_spike': 0.08521045432387744, 'adx_thresh': 27.63182591189787, 'atr_min_pct': 0.024286103326398443, 'atr_max_pct': 0.11373148596368457, 'tp_mult': 1.0102430774404432, 'tsl_mult': 0.5709688776713602, 'strategy': 'mean_reversion', 'time_stop': 123, 'use_sma': False, 'use_atr': True, 'use_adx': True, 'use_ema': False, 'use_spike': False, 'rsi_required': True, 'edge_k': 0.050656708899927905, 'edge_cap': 0.10686453689892107, 'bull_strategy': 'breakout', 'bull_bb_std_mult': 1.1665954385973785, 'bull_rsi_os': 39, 'bull_rsi_ob': 91, 'bull_adx_thresh': 16.298879407375118, 'bull_atr_min_pct': 0.011574389903262195, 'bull_atr_max_pct': 0.14601969147009491, 'bull_tp_mult': 1.473337399065185, 'bull_tsl_mult': 0.9808700227295762, 'bull_time_stop': 128, 'bull_use_sma': True, 'bull_use_ema': True, 'bull_use_atr': True, 'bull_use_adx': True, 'bull_use_spike': False, 'bull_rsi_required': True, 'bear_strategy': 'mean_reversion', 'bear_bb_std_mult': 0.5819270355881581, 'bear_rsi_os': 11, 'bear_rsi_ob': 74, 'bear_adx_thresh': 22.79344888824752, 'bear_atr_min_pct': 0.0012588118625339768, 'bear_atr_max_pct': 0.03716116471367308, 'bear_tp_mult': 1.5186296850115153, 'bear_tsl_mult': 0.10869846748033096, 'bear_time_stop': 222, 'bear_use_sma': False, 'bear_use_ema': True, 'bear_use_atr': False, 'bear_use_adx': False, 'bear_use_spike': False, 'bear_rsi_required': False, 'sideways_strategy': 'breakout', 'sideways_bb_std_mult': 2.232345250653823, 'sideways_rsi_os': 22, 'sideways_rsi_ob': 70, 'sideways_adx_thresh': 20.70044654260067, 'sideways_atr_min_pct': 0.0018382157575747224, 'sideways_atr_max_pct': 0.0896940930156185, 'sideways_tp_mult': 2.9336376362318823, 'sideways_tsl_mult': 0.508205821067998, 'sideways_time_stop': 20, 'sideways_use_sma': True, 'sideways_use_ema': True, 'sideways_use_atr': False, 'sideways_use_adx': True, 'sideways_use_spike': True, 'sideways_rsi_required': False}.
[I 2025-08-31 03:13:11,200] Trial 75 finished with values: [-1000000000.0, 1000000000.0] and parameters: {'p_sma': 6, 'p_std': 46, 'p_atr': 16, 'p_adx': 10, 'rsi_period': 68, 'ema1': 14, 'ema2': 15, 'slip_atr_k': 0.020425831739309248, 'slip_spread_k': 0.09432920142207785, 'spread_hl_frac': 0.023860045398580606, 'bb_std_mult': 1.4989333132604046, 'rsi_os': 36, 'rsi_ob': 58, 'vol_spike': 0.08392927819631159, 'adx_thresh': 22.684454954362835, 'atr_min_pct': 0.024571753639335656, 'atr_max_pct': 0.10398477005648629, 'tp_mult': 2.6918126427910196, 'tsl_mult': 0.9346972449186688, 'strategy': 'mean_reversion', 'time_stop': 122, 'use_sma': False, 'use_atr': True, 'use_adx': False, 'use_ema': True, 'use_spike': False, 'rsi_required': False, 'edge_k': 0.26061318926304744, 'edge_cap': 0.11087295025313168, 'bull_strategy': 'breakout', 'bull_bb_std_mult': 2.437886280756989, 'bull_rsi_os': 39, 'bull_rsi_ob': 75, 'bull_adx_thresh': 9.537196252011787, 'bull_atr_min_pct': 0.0017069082515401741, 'bull_atr_max_pct': 0.14908829097881016, 'bull_tp_mult': 1.8694185862951291, 'bull_tsl_mult': 0.9791955088194737, 'bull_time_stop': 98, 'bull_use_sma': True, 'bull_use_ema': True, 'bull_use_atr': True, 'bull_use_adx': False, 'bull_use_spike': False, 'bull_rsi_required': True, 'bear_strategy': 'mean_reversion', 'bear_bb_std_mult': 0.5584120355882234, 'bear_rsi_os': 11, 'bear_rsi_ob': 72, 'bear_adx_thresh': 14.910379444587406, 'bear_atr_min_pct': 0.00785918321889405, 'bear_atr_max_pct': 0.03814209885351024, 'bear_tp_mult': 2.222878475431344, 'bear_tsl_mult': 0.8809684926378961, 'bear_time_stop': 224, 'bear_use_sma': False, 'bear_use_ema': True, 'bear_use_atr': False, 'bear_use_adx': False, 'bear_use_spike': False, 'bear_rsi_required': False, 'sideways_strategy': 'breakout', 'sideways_bb_std_mult': 2.73615809011855, 'sideways_rsi_os': 40, 'sideways_rsi_ob': 50, 'sideways_adx_thresh': 20.581253578917227, 'sideways_atr_min_pct': 0.015186360257885391, 'sideways_atr_max_pct': 0.09037204124606694, 'sideways_tp_mult': 2.9915298177904437, 'sideways_tsl_mult': 0.7382571243771546, 'sideways_time_stop': 172, 'sideways_use_sma': True, 'sideways_use_ema': True, 'sideways_use_atr': False, 'sideways_use_adx': True, 'sideways_use_spike': True, 'sideways_rsi_required': False}.
[I 2025-08-31 03:13:11,373] Trial 76 finished with values: [-1000000000.0, 1000000000.0] and parameters: {'p_sma': 7, 'p_std': 46, 'p_atr': 29, 'p_adx': 21, 'rsi_period': 68, 'ema1': 13, 'ema2': 44, 'slip_atr_k': 0.016895175647583492, 'slip_spread_k': 0.08856667116172512, 'spread_hl_frac': 0.03233912943047055, 'bb_std_mult': 1.8218307049436366, 'rsi_os': 37, 'rsi_ob': 89, 'vol_spike': 0.08699828331583236, 'adx_thresh': 22.8558535590014, 'atr_min_pct': 0.025777159128610706, 'atr_max_pct': 0.09109256831193988, 'tp_mult': 2.949296440186665, 'tsl_mult': 0.556593536843323, 'strategy': 'breakout', 'time_stop': 144, 'use_sma': False, 'use_atr': False, 'use_adx': True, 'use_ema': True, 'use_spike': False, 'rsi_required': False, 'edge_k': 0.2105654184199363, 'edge_cap': 0.08529682456529444, 'bull_strategy': 'breakout', 'bull_bb_std_mult': 1.1731847670122124, 'bull_rsi_os': 40, 'bull_rsi_ob': 91, 'bull_adx_thresh': 30.79684289755358, 'bull_atr_min_pct': 0.011461655987463933, 'bull_atr_max_pct': 0.14879459997297825, 'bull_tp_mult': 1.466195515195972, 'bull_tsl_mult': 0.11257530734296839, 'bull_time_stop': 173, 'bull_use_sma': False, 'bull_use_ema': True, 'bull_use_atr': False, 'bull_use_adx': False, 'bull_use_spike': False, 'bull_rsi_required': True, 'bear_strategy': 'mean_reversion', 'bear_bb_std_mult': 2.008140466270109, 'bear_rsi_os': 11, 'bear_rsi_ob': 87, 'bear_adx_thresh': 22.83774394499579, 'bear_atr_min_pct': 0.0036026687536359504, 'bear_atr_max_pct': 0.032414990021945006, 'bear_tp_mult': 2.337942037089635, 'bear_tsl_mult': 0.08656658190900401, 'bear_time_stop': 176, 'bear_use_sma': True, 'bear_use_ema': False, 'bear_use_atr': False, 'bear_use_adx': False, 'bear_use_spike': True, 'bear_rsi_required': False, 'sideways_strategy': 'breakout', 'sideways_bb_std_mult': 3.1340159817052156, 'sideways_rsi_os': 22, 'sideways_rsi_ob': 48, 'sideways_adx_thresh': 20.58979296463348, 'sideways_atr_min_pct': 0.001688331341768977, 'sideways_atr_max_pct': 0.08893916819041024, 'sideways_tp_mult': 2.994983010588712, 'sideways_tsl_mult': 0.7526860510150797, 'sideways_time_stop': 36, 'sideways_use_sma': True, 'sideways_use_ema': True, 'sideways_use_atr': True, 'sideways_use_adx': True, 'sideways_use_spike': True, 'sideways_rsi_required': False}.
[I 2025-08-31 03:13:42,317] Trial 78 finished with values: [-1000000000.0, 1000000000.0] and parameters: {'p_sma': 7, 'p_std': 8, 'p_atr': 29, 'p_adx': 16, 'rsi_period': 84, 'ema1': 14, 'ema2': 25, 'slip_atr_k': 0.01769630112943027, 'slip_spread_k': 0.38339737723042805, 'spread_hl_frac': 0.039488212302346004, 'bb_std_mult': 1.7788961904617921, 'rsi_os': 31, 'rsi_ob': 89, 'vol_spike': 0.18145896061261904, 'adx_thresh': 22.916136726193745, 'atr_min_pct': 0.022850326181393765, 'atr_max_pct': 0.1034777911709912, 'tp_mult': 1.4405867646722603, 'tsl_mult': 0.2969924235351393, 'strategy': 'breakout', 'time_stop': 286, 'use_sma': False, 'use_atr': False, 'use_adx': False, 'use_ema': True, 'use_spike': False, 'rsi_required': False, 'edge_k': 0.2418211621070615, 'edge_cap': 0.9098489937962817, 'bull_strategy': 'breakout', 'bull_bb_std_mult': 1.6549952795012661, 'bull_rsi_os': 19, 'bull_rsi_ob': 75, 'bull_adx_thresh': 18.295370789874454, 'bull_atr_min_pct': 0.003131367205115079, 'bull_atr_max_pct': 0.14957226052100667, 'bull_tp_mult': 1.7411316766286091, 'bull_tsl_mult': 0.040091780730829085, 'bull_time_stop': 101, 'bull_use_sma': False, 'bull_use_ema': False, 'bull_use_atr': False, 'bull_use_adx': False, 'bull_use_spike': False, 'bull_rsi_required': True, 'bear_strategy': 'mean_reversion', 'bear_bb_std_mult': 1.8493505312743321, 'bear_rsi_os': 7, 'bear_rsi_ob': 87, 'bear_adx_thresh': 15.222497142760698, 'bear_atr_min_pct': 0.01899059184676215, 'bear_atr_max_pct': 0.03159513643106976, 'bear_tp_mult': 2.9951217854179397, 'bear_tsl_mult': 0.4382766687350787, 'bear_time_stop': 176, 'bear_use_sma': True, 'bear_use_ema': False, 'bear_use_atr': True, 'bear_use_adx': False, 'bear_use_spike': True, 'bear_rsi_required': False, 'sideways_strategy': 'breakout', 'sideways_bb_std_mult': 3.2925120758777355, 'sideways_rsi_os': 36, 'sideways_rsi_ob': 50, 'sideways_adx_thresh': 23.67903285647648, 'sideways_atr_min_pct': 0.025342714392445568, 'sideways_atr_max_pct': 0.10704922972987899, 'sideways_tp_mult': 2.9985188672276673, 'sideways_tsl_mult': 0.7511820542119492, 'sideways_time_stop': 37, 'sideways_use_sma': True, 'sideways_use_ema': False, 'sideways_use_atr': True, 'sideways_use_adx': True, 'sideways_use_spike': True, 'sideways_rsi_required': False}.
[I 2025-08-31 03:13:42,432] Trial 80 finished with values: [-1000000000.0, 1000000000.0] and parameters: {'p_sma': 9, 'p_std': 24, 'p_atr': 14, 'p_adx': 16, 'rsi_period': 78, 'ema1': 17, 'ema2': 41, 'slip_atr_k': 0.006642081295930873, 'slip_spread_k': 0.25364105925327673, 'spread_hl_frac': 0.039567232634379355, 'bb_std_mult': 2.18248424438436, 'rsi_os': 32, 'rsi_ob': 94, 'vol_spike': 0.18057782530893912, 'adx_thresh': 26.906960330026486, 'atr_min_pct': 0.023368116916180785, 'atr_max_pct': 0.12136135184895552, 'tp_mult': 2.850970406941139, 'tsl_mult': 0.6155501648943111, 'strategy': 'breakout', 'time_stop': 76, 'use_sma': False, 'use_atr': False, 'use_adx': True, 'use_ema': False, 'use_spike': False, 'rsi_required': False, 'edge_k': 0.4466407752784268, 'edge_cap': 0.9299705430236036, 'bull_strategy': 'breakout', 'bull_bb_std_mult': 1.655976621818803, 'bull_rsi_os': 12, 'bull_rsi_ob': 45, 'bull_adx_thresh': 21.03511713921354, 'bull_atr_min_pct': 0.003002481853518711, 'bull_atr_max_pct': 0.01603343266813123, 'bull_tp_mult': 1.994415789411418, 'bull_tsl_mult': 0.32978818048762426, 'bull_time_stop': 114, 'bull_use_sma': False, 'bull_use_ema': False, 'bull_use_atr': False, 'bull_use_adx': False, 'bull_use_spike': False, 'bull_rsi_required': False, 'bear_strategy': 'breakout', 'bear_bb_std_mult': 2.5432086933085434, 'bear_rsi_os': 7, 'bear_rsi_ob': 89, 'bear_adx_thresh': 11.163262703259193, 'bear_atr_min_pct': 0.012162639801495644, 'bear_atr_max_pct': 0.057325699792401784, 'bear_tp_mult': 1.9245957160014244, 'bear_tsl_mult': 0.4840108744763218, 'bear_time_stop': 46, 'bear_use_sma': True, 'bear_use_ema': False, 'bear_use_atr': True, 'bear_use_adx': False, 'bear_use_spike': True, 'bear_rsi_required': False, 'sideways_strategy': 'mean_reversion', 'sideways_bb_std_mult': 3.246098633010912, 'sideways_rsi_os': 9, 'sideways_rsi_ob': 45, 'sideways_adx_thresh': 23.878917655107113, 'sideways_atr_min_pct': 0.003443953118950252, 'sideways_atr_max_pct': 0.022403296565687313, 'sideways_tp_mult': 2.854794775104453, 'sideways_tsl_mult': 0.39597526252699033, 'sideways_time_stop': 182, 'sideways_use_sma': False, 'sideways_use_ema': False, 'sideways_use_atr': True, 'sideways_use_adx': False, 'sideways_use_spike': True, 'sideways_rsi_required': False}.
[I 2025-08-31 03:13:42,573] Trial 79 finished with values: [-1000000000.0, 1000000000.0] and parameters: {'p_sma': 48, 'p_std': 24, 'p_atr': 14, 'p_adx': 16, 'rsi_period': 77, 'ema1': 17, 'ema2': 25, 'slip_atr_k': 0.004698634913467753, 'slip_spread_k': 0.7656253170128056, 'spread_hl_frac': 0.03939348368051565, 'bb_std_mult': 0.8652960351201404, 'rsi_os': 31, 'rsi_ob': 88, 'vol_spike': 0.18230983748190394, 'adx_thresh': 26.233640914992275, 'atr_min_pct': 0.013013294005896176, 'atr_max_pct': 0.09217965098550404, 'tp_mult': 1.7419963514513617, 'tsl_mult': 0.8408476715410279, 'strategy': 'breakout', 'time_stop': 77, 'use_sma': False, 'use_atr': False, 'use_adx': True, 'use_ema': True, 'use_spike': False, 'rsi_required': False, 'edge_k': 0.43498431769861945, 'edge_cap': 0.9035121250193332, 'bull_strategy': 'breakout', 'bull_bb_std_mult': 2.587524796099946, 'bull_rsi_os': 12, 'bull_rsi_ob': 81, 'bull_adx_thresh': 18.23760864910793, 'bull_atr_min_pct': 0.003487513249227553, 'bull_atr_max_pct': 0.010403308141477191, 'bull_tp_mult': 1.7649271575356638, 'bull_tsl_mult': 0.9409125219409507, 'bull_time_stop': 177, 'bull_use_sma': False, 'bull_use_ema': False, 'bull_use_atr': False, 'bull_use_adx': False, 'bull_use_spike': False, 'bull_rsi_required': True, 'bear_strategy': 'mean_reversion', 'bear_bb_std_mult': 2.3271505991613686, 'bear_rsi_os': 7, 'bear_rsi_ob': 87, 'bear_adx_thresh': 31.879400992375757, 'bear_atr_min_pct': 0.018890020210093714, 'bear_atr_max_pct': 0.010376095955148754, 'bear_tp_mult': 2.7635368230550634, 'bear_tsl_mult': 0.46986416260675007, 'bear_time_stop': 177, 'bear_use_sma': True, 'bear_use_ema': False, 'bear_use_atr': True, 'bear_use_adx': False, 'bear_use_spike': True, 'bear_rsi_required': False, 'sideways_strategy': 'breakout', 'sideways_bb_std_mult': 3.125958523120664, 'sideways_rsi_os': 36, 'sideways_rsi_ob': 45, 'sideways_adx_thresh': 27.777761101581632, 'sideways_atr_min_pct': 0.003673999677530957, 'sideways_atr_max_pct': 0.10685295407428393, 'sideways_tp_mult': 2.8549098621697566, 'sideways_tsl_mult': 0.8549469768338843, 'sideways_time_stop': 38, 'sideways_use_sma': True, 'sideways_use_ema': False, 'sideways_use_atr': True, 'sideways_use_adx': False, 'sideways_use_spike': True, 'sideways_rsi_required': False}.
[I 2025-08-31 03:13:42,870] Trial 77 finished with values: [-1000000000.0, 1000000000.0] and parameters: {'p_sma': 7, 'p_std': 46, 'p_atr': 16, 'p_adx': 21, 'rsi_period': 68, 'ema1': 14, 'ema2': 20, 'slip_atr_k': 0.018334161046920344, 'slip_spread_k': 0.3973581537618377, 'spread_hl_frac': 0.03919005428874962, 'bb_std_mult': 0.641698131360844, 'rsi_os': 37, 'rsi_ob': 93, 'vol_spike': 0.18355318607028695, 'adx_thresh': 22.873246004490966, 'atr_min_pct': 0.02435792031121163, 'atr_max_pct': 0.09074820450948198, 'tp_mult': 2.939840708177549, 'tsl_mult': 0.5765322616201354, 'strategy': 'breakout', 'time_stop': 78, 'use_sma': False, 'use_atr': False, 'use_adx': True, 'use_ema': True, 'use_spike': False, 'rsi_required': False, 'edge_k': 0.201741768182844, 'edge_cap': 0.07024339514785385, 'bull_strategy': 'breakout', 'bull_bb_std_mult': 1.241998271770409, 'bull_rsi_os': 11, 'bull_rsi_ob': 91, 'bull_adx_thresh': 20.642041394385664, 'bull_atr_min_pct': 0.0030770723118985124, 'bull_atr_max_pct': 0.14961090326792767, 'bull_tp_mult': 1.9753589285733204, 'bull_tsl_mult': 0.9716749629784159, 'bull_time_stop': 294, 'bull_use_sma': True, 'bull_use_ema': False, 'bull_use_atr': False, 'bull_use_adx': False, 'bull_use_spike': False, 'bull_rsi_required': True, 'bear_strategy': 'mean_reversion', 'bear_bb_std_mult': 2.015707700545789, 'bear_rsi_os': 11, 'bear_rsi_ob': 88, 'bear_adx_thresh': 22.68334719740067, 'bear_atr_min_pct': 0.003338882425587381, 'bear_atr_max_pct': 0.03347698304028341, 'bear_tp_mult': 2.1976491644641127, 'bear_tsl_mult': 0.467673523457534, 'bear_time_stop': 256, 'bear_use_sma': True, 'bear_use_ema': True, 'bear_use_atr': True, 'bear_use_adx': False, 'bear_use_spike': False, 'bear_rsi_required': False, 'sideways_strategy': 'breakout', 'sideways_bb_std_mult': 0.6533303914867983, 'sideways_rsi_os': 9, 'sideways_rsi_ob': 50, 'sideways_adx_thresh': 20.776488147380086, 'sideways_atr_min_pct': 0.0014075739528531706, 'sideways_atr_max_pct': 0.09043345008166455, 'sideways_tp_mult': 2.8362133534856873, 'sideways_tsl_mult': 0.7645615793369505, 'sideways_time_stop': 173, 'sideways_use_sma': True, 'sideways_use_ema': True, 'sideways_use_atr': True, 'sideways_use_adx': True, 'sideways_use_spike': True, 'sideways_rsi_required': False}.
