[I 2025-08-30 15:35:46,060] Trial 506 finished with values: [-1000000000.0, 1000000000.0] and parameters: {'p_sma': 9, 'p_std': 15, 'p_atr': 14, 'p_adx': 25, 'rsi_period': 11, 'ema1': 23, 'ema2': 39, 'slip_atr_k': 0.046967124226864, 'slip_spread_k': 0.6661280917185268, 'spread_hl_frac': 0.039272061522695724, 'bb_std_mult': 0.6767794882410927, 'rsi_os': 27, 'rsi_ob': 70, 'vol_spike': 0.2214749540847296, 'adx_thresh': 18.380743297404262, 'atr_min_pct': 0.024184489198567145, 'atr_max_pct': 0.13321614006894855, 'tp_mult': 1.5198624597325374, 'tsl_mult': 0.3294792312967199, 'strategy': 'breakout', 'time_stop': 94, 'use_sma': False, 'use_atr': False, 'use_adx': True, 'use_ema': False, 'use_spike': False, 'rsi_required': False, 'edge_k': 0.6304023000392167, 'edge_cap': 0.9405389588025662, 'bull_strategy': 'breakout', 'bull_bb_std_mult': 1.6688006337018026, 'bull_rsi_os': 49, 'bull_rsi_ob': 88, 'bull_adx_thresh': 8.90575766214639, 'bull_atr_min_pct': 0.01941506609601556, 'bull_atr_max_pct': 0.0965872239772385, 'bull_tp_mult': 2.5024151257677265, 'bull_tsl_mult': 0.8605983311204702, 'bull_time_stop': 213, 'bull_use_sma': True, 'bull_use_ema': True, 'bull_use_atr': False, 'bull_use_adx': True, 'bull_use_spike': True, 'bull_rsi_required': False, 'bear_strategy': 'mean_reversion', 'bear_bb_std_mult': 1.678507725616122, 'bear_rsi_os': 51, 'bear_rsi_ob': 94, 'bear_adx_thresh': 15.224337691410483, 'bear_atr_min_pct': 0.019536945036515277, 'bear_atr_max_pct': 0.11316455713409689, 'bear_tp_mult': 1.532426546752129, 'bear_tsl_mult': 0.878083773531527, 'bear_time_stop': 214, 'bear_use_sma': True, 'bear_use_ema': False, 'bear_use_atr': True, 'bear_use_adx': False, 'bear_use_spike': True, 'bear_rsi_required': True, 'sideways_strategy': 'mean_reversion', 'sideways_bb_std_mult': 1.4560654186765447, 'sideways_rsi_os': 15, 'sideways_rsi_ob': 79, 'sideways_adx_thresh': 5.461727559419121, 'sideways_atr_min_pct': 0.02011148763809582, 'sideways_atr_max_pct': 0.06358768588681955, 'sideways_tp_mult': 1.7182958966312005, 'sideways_tsl_mult': 0.375044438879185, 'sideways_time_stop': 129, 'sideways_use_sma': True, 'sideways_use_ema': False, 'sideways_use_atr': False, 'sideways_use_adx': False, 'sideways_use_spike': False, 'sideways_rsi_required': True}.
[I 2025-08-30 15:35:47,871] Trial 503 finished with values: [-1000000000.0, 1000000000.0] and parameters: {'p_sma': 9, 'p_std': 21, 'p_atr': 28, 'p_adx': 25, 'rsi_period': 7, 'ema1': 23, 'ema2': 22, 'slip_atr_k': 0.003828640535093878, 'slip_spread_k': 0.6571963443617471, 'spread_hl_frac': 0.007931576440006066, 'bb_std_mult': 0.6949296043913779, 'rsi_os': 27, 'rsi_ob': 70, 'vol_spike': 0.20232127360814298, 'adx_thresh': 32.95162426129524, 'atr_min_pct': 0.02452946692001317, 'atr_max_pct': 0.11141547231974674, 'tp_mult': 1.2076001186205838, 'tsl_mult': 0.3176778655008972, 'strategy': 'breakout', 'time_stop': 158, 'use_sma': False, 'use_atr': False, 'use_adx': True, 'use_ema': True, 'use_spike': False, 'rsi_required': False, 'edge_k': 0.6301379082654198, 'edge_cap': 0.9627345649642128, 'bull_strategy': 'breakout', 'bull_bb_std_mult': 1.6751559032173726, 'bull_rsi_os': 48, 'bull_rsi_ob': 87, 'bull_adx_thresh': 10.008817575805551, 'bull_atr_min_pct': 0.01959068370514241, 'bull_atr_max_pct': 0.102058735363512, 'bull_tp_mult': 2.4883676814859808, 'bull_tsl_mult': 0.8950845830099524, 'bull_time_stop': 61, 'bull_use_sma': False, 'bull_use_ema': True, 'bull_use_atr': True, 'bull_use_adx': True, 'bull_use_spike': True, 'bull_rsi_required': False, 'bear_strategy': 'mean_reversion', 'bear_bb_std_mult': 1.6809112300130291, 'bear_rsi_os': 52, 'bear_rsi_ob': 77, 'bear_adx_thresh': 15.331680536069138, 'bear_atr_min_pct': 0.006487903384707044, 'bear_atr_max_pct': 0.10299682335670833, 'bear_tp_mult': 2.682854115224708, 'bear_tsl_mult': 0.8183576682583049, 'bear_time_stop': 97, 'bear_use_sma': True, 'bear_use_ema': False, 'bear_use_atr': True, 'bear_use_adx': True, 'bear_use_spike': True, 'bear_rsi_required': True, 'sideways_strategy': 'mean_reversion', 'sideways_bb_std_mult': 1.4430911502096058, 'sideways_rsi_os': 15, 'sideways_rsi_ob': 79, 'sideways_adx_thresh': 5.1952425573063135, 'sideways_atr_min_pct': 0.01886509424230724, 'sideways_atr_max_pct': 0.07061981953189667, 'sideways_tp_mult': 1.2502749159142685, 'sideways_tsl_mult': 0.5619548481979235, 'sideways_time_stop': 123, 'sideways_use_sma': True, 'sideways_use_ema': False, 'sideways_use_atr': False, 'sideways_use_adx': True, 'sideways_use_spike': True, 'sideways_rsi_required': False}.
[I 2025-08-30 15:35:49,144] Trial 504 finished with values: [-1000000000.0, 1000000000.0] and parameters: {'p_sma': 9, 'p_std': 58, 'p_atr': 14, 'p_adx': 25, 'rsi_period': 12, 'ema1': 23, 'ema2': 26, 'slip_atr_k': 0.004537171984080135, 'slip_spread_k': 0.6533059819877515, 'spread_hl_frac': 0.020283946141464733, 'bb_std_mult': 0.6670313897102553, 'rsi_os': 27, 'rsi_ob': 65, 'vol_spike': 0.21130798813190868, 'adx_thresh': 8.93816213704692, 'atr_min_pct': 0.006373117499207366, 'atr_max_pct': 0.1074303077013292, 'tp_mult': 1.359792434418442, 'tsl_mult': 0.2681608023838946, 'strategy': 'breakout', 'time_stop': 35, 'use_sma': False, 'use_atr': False, 'use_adx': True, 'use_ema': False, 'use_spike': False, 'rsi_required': False, 'edge_k': 0.6298576386367217, 'edge_cap': 0.9660925663280757, 'bull_strategy': 'breakout', 'bull_bb_std_mult': 1.6787464040074531, 'bull_rsi_os': 48, 'bull_rsi_ob': 87, 'bull_adx_thresh': 8.913171809064535, 'bull_atr_min_pct': 0.019566135996276282, 'bull_atr_max_pct': 0.0973376612593253, 'bull_tp_mult': 2.50407531930301, 'bull_tsl_mult': 0.8640283783939415, 'bull_time_stop': 53, 'bull_use_sma': True, 'bull_use_ema': True, 'bull_use_atr': True, 'bull_use_adx': True, 'bull_use_spike': True, 'bull_rsi_required': False, 'bear_strategy': 'mean_reversion', 'bear_bb_std_mult': 1.813765544262625, 'bear_rsi_os': 9, 'bear_rsi_ob': 76, 'bear_adx_thresh': 15.206046043799557, 'bear_atr_min_pct': 0.0029162220729849466, 'bear_atr_max_pct': 0.05279265186012621, 'bear_tp_mult': 1.5268589968362067, 'bear_tsl_mult': 0.8968242912824377, 'bear_time_stop': 99, 'bear_use_sma': True, 'bear_use_ema': False, 'bear_use_atr': True, 'bear_use_adx': False, 'bear_use_spike': True, 'bear_rsi_required': True, 'sideways_strategy': 'mean_reversion', 'sideways_bb_std_mult': 1.441683945669481, 'sideways_rsi_os': 18, 'sideways_rsi_ob': 83, 'sideways_adx_thresh': 11.685417957459785, 'sideways_atr_min_pct': 0.01899794011975495, 'sideways_atr_max_pct': 0.06329315937115404, 'sideways_tp_mult': 1.5847170127225398, 'sideways_tsl_mult': 0.36719381586358796, 'sideways_time_stop': 128, 'sideways_use_sma': True, 'sideways_use_ema': False, 'sideways_use_atr': False, 'sideways_use_adx': False, 'sideways_use_spike': True, 'sideways_rsi_required': True}.
[I 2025-08-30 15:36:36,680] Trial 510 finished with values: [-1000000000.0, 1000000000.0] and parameters: {'p_sma': 7, 'p_std': 20, 'p_atr': 12, 'p_adx': 24, 'rsi_period': 10, 'ema1': 24, 'ema2': 12, 'slip_atr_k': 0.1835635856005097, 'slip_spread_k': 0.4392588463876607, 'spread_hl_frac': 0.031540385842750984, 'bb_std_mult': 0.6188885528779141, 'rsi_os': 28, 'rsi_ob': 86, 'vol_spike': 0.22119791034517136, 'adx_thresh': 26.803745306494477, 'atr_min_pct': 0.011690073169553276, 'atr_max_pct': 0.11488943180746185, 'tp_mult': 2.9187109128808473, 'tsl_mult': 0.35437756016488425, 'strategy': 'breakout', 'time_stop': 155, 'use_sma': False, 'use_atr': False, 'use_adx': True, 'use_ema': False, 'use_spike': False, 'rsi_required': True, 'edge_k': 0.9283591122921054, 'edge_cap': 0.9422045968036353, 'bull_strategy': 'breakout', 'bull_bb_std_mult': 1.5205633766554771, 'bull_rsi_os': 50, 'bull_rsi_ob': 84, 'bull_adx_thresh': 9.834972735981584, 'bull_atr_min_pct': 0.0205107192973024, 'bull_atr_max_pct': 0.10474670581324512, 'bull_tp_mult': 1.489453447003942, 'bull_tsl_mult': 0.4687491513269477, 'bull_time_stop': 56, 'bull_use_sma': True, 'bull_use_ema': False, 'bull_use_atr': True, 'bull_use_adx': True, 'bull_use_spike': True, 'bull_rsi_required': False, 'bear_strategy': 'mean_reversion', 'bear_bb_std_mult': 1.9373900134121795, 'bear_rsi_os': 26, 'bear_rsi_ob': 75, 'bear_adx_thresh': 16.63427578421748, 'bear_atr_min_pct': 0.008634439384371716, 'bear_atr_max_pct': 0.10852336022380274, 'bear_tp_mult': 1.1372837976106709, 'bear_tsl_mult': 0.854162850868912, 'bear_time_stop': 40, 'bear_use_sma': True, 'bear_use_ema': True, 'bear_use_atr': True, 'bear_use_adx': True, 'bear_use_spike': True, 'bear_rsi_required': True, 'sideways_strategy': 'mean_reversion', 'sideways_bb_std_mult': 3.1528096163190207, 'sideways_rsi_os': 11, 'sideways_rsi_ob': 80, 'sideways_adx_thresh': 10.773063205983162, 'sideways_atr_min_pct': 0.019983679378109357, 'sideways_atr_max_pct': 0.07173040715755592, 'sideways_tp_mult': 1.5266068585061627, 'sideways_tsl_mult': 0.039157748343034815, 'sideways_time_stop': 235, 'sideways_use_sma': True, 'sideways_use_ema': False, 'sideways_use_atr': True, 'sideways_use_adx': True, 'sideways_use_spike': True, 'sideways_rsi_required': True}.
[I 2025-08-30 15:36:38,668] Trial 507 finished with values: [-1000000000.0, 1000000000.0] and parameters: {'p_sma': 7, 'p_std': 53, 'p_atr': 14, 'p_adx': 25, 'rsi_period': 12, 'ema1': 23, 'ema2': 37, 'slip_atr_k': 0.1762960892450263, 'slip_spread_k': 0.6670637268760387, 'spread_hl_frac': 0.0073742217962240375, 'bb_std_mult': 0.6495893797888893, 'rsi_os': 28, 'rsi_ob': 88, 'vol_spike': 0.22092230245526787, 'adx_thresh': 9.716712492078297, 'atr_min_pct': 0.021883563372530026, 'atr_max_pct': 0.11035027953265118, 'tp_mult': 1.3759636586032418, 'tsl_mult': 0.3502910370726809, 'strategy': 'breakout', 'time_stop': 109, 'use_sma': False, 'use_atr': False, 'use_adx': True, 'use_ema': False, 'use_spike': False, 'rsi_required': False, 'edge_k': 1.9882916646783457, 'edge_cap': 0.9390649625879015, 'bull_strategy': 'breakout', 'bull_bb_std_mult': 1.6855243247861187, 'bull_rsi_os': 9, 'bull_rsi_ob': 87, 'bull_adx_thresh': 8.796393004239555, 'bull_atr_min_pct': 0.02047578866258074, 'bull_atr_max_pct': 0.10389522053366398, 'bull_tp_mult': 2.558336743809995, 'bull_tsl_mult': 0.8384296466841755, 'bull_time_stop': 55, 'bull_use_sma': True, 'bull_use_ema': True, 'bull_use_atr': True, 'bull_use_adx': True, 'bull_use_spike': True, 'bull_rsi_required': False, 'bear_strategy': 'mean_reversion', 'bear_bb_std_mult': 1.7975523669305995, 'bear_rsi_os': 26, 'bear_rsi_ob': 75, 'bear_adx_thresh': 14.907328649621054, 'bear_atr_min_pct': 0.019112727952459788, 'bear_atr_max_pct': 0.10254193176035685, 'bear_tp_mult': 2.699062078087091, 'bear_tsl_mult': 0.8861504126012464, 'bear_time_stop': 91, 'bear_use_sma': True, 'bear_use_ema': False, 'bear_use_atr': True, 'bear_use_adx': False, 'bear_use_spike': True, 'bear_rsi_required': True, 'sideways_strategy': 'mean_reversion', 'sideways_bb_std_mult': 3.1493035557023794, 'sideways_rsi_os': 5, 'sideways_rsi_ob': 79, 'sideways_adx_thresh': 10.690371333229507, 'sideways_atr_min_pct': 0.019904351422894297, 'sideways_atr_max_pct': 0.0712336023360112, 'sideways_tp_mult': 1.7124241052418585, 'sideways_tsl_mult': 0.3711665506120665, 'sideways_time_stop': 57, 'sideways_use_sma': True, 'sideways_use_ema': False, 'sideways_use_atr': False, 'sideways_use_adx': True, 'sideways_use_spike': True, 'sideways_rsi_required': True}.
[I 2025-08-30 15:36:38,669] Trial 508 finished with values: [-1000000000.0, 1000000000.0] and parameters: {'p_sma': 6, 'p_std': 21, 'p_atr': 12, 'p_adx': 25, 'rsi_period': 10, 'ema1': 24, 'ema2': 37, 'slip_atr_k': 0.1376476484590369, 'slip_spread_k': 0.7275557993934826, 'spread_hl_frac': 0.008005294276350487, 'bb_std_mult': 0.6316726817427917, 'rsi_os': 30, 'rsi_ob': 60, 'vol_spike': 0.20159770839684837, 'adx_thresh': 10.216581102345488, 'atr_min_pct': 0.006383675324528148, 'atr_max_pct': 0.044727643495784536, 'tp_mult': 1.3395283274448406, 'tsl_mult': 0.2577750514737034, 'strategy': 'breakout', 'time_stop': 159, 'use_sma': False, 'use_atr': False, 'use_adx': True, 'use_ema': False, 'use_spike': False, 'rsi_required': True, 'edge_k': 0.5823931489754207, 'edge_cap': 0.928415205065466, 'bull_strategy': 'breakout', 'bull_bb_std_mult': 3.4610842497393626, 'bull_rsi_os': 50, 'bull_rsi_ob': 84, 'bull_adx_thresh': 9.739136127220595, 'bull_atr_min_pct': 0.020481808587968133, 'bull_atr_max_pct': 0.07104709292203167, 'bull_tp_mult': 2.0460467356010117, 'bull_tsl_mult': 0.5689826561237933, 'bull_time_stop': 52, 'bull_use_sma': True, 'bull_use_ema': True, 'bull_use_atr': True, 'bull_use_adx': True, 'bull_use_spike': True, 'bull_rsi_required': False, 'bear_strategy': 'mean_reversion', 'bear_bb_std_mult': 1.7919063469385603, 'bear_rsi_os': 5, 'bear_rsi_ob': 75, 'bear_adx_thresh': 16.378628486234447, 'bear_atr_min_pct': 0.0015142035869396054, 'bear_atr_max_pct': 0.10818930819077135, 'bear_tp_mult': 1.4705131712999902, 'bear_tsl_mult': 0.851793034027749, 'bear_time_stop': 40, 'bear_use_sma': True, 'bear_use_ema': False, 'bear_use_atr': True, 'bear_use_adx': True, 'bear_use_spike': True, 'bear_rsi_required': True, 'sideways_strategy': 'mean_reversion', 'sideways_bb_std_mult': 3.1584682688015806, 'sideways_rsi_os': 13, 'sideways_rsi_ob': 75, 'sideways_adx_thresh': 15.74400063049113, 'sideways_atr_min_pct': 0.019248297000282442, 'sideways_atr_max_pct': 0.07156780751782471, 'sideways_tp_mult': 1.5172356213984182, 'sideways_tsl_mult': 0.7008207785357153, 'sideways_time_stop': 235, 'sideways_use_sma': True, 'sideways_use_ema': False, 'sideways_use_atr': True, 'sideways_use_adx': True, 'sideways_use_spike': True, 'sideways_rsi_required': True}.
[I 2025-08-30 15:36:39,675] Trial 509 finished with values: [-1000000000.0, 1000000000.0] and parameters: {'p_sma': 6, 'p_std': 20, 'p_atr': 12, 'p_adx': 25, 'rsi_period': 11, 'ema1': 24, 'ema2': 25, 'slip_atr_k': 0.15221905857412535, 'slip_spread_k': 0.42131668001034134, 'spread_hl_frac': 0.00896341207197367, 'bb_std_mult': 0.6069450338320881, 'rsi_os': 29, 'rsi_ob': 60, 'vol_spike': 0.03603707159821937, 'adx_thresh': 20.911657379550494, 'atr_min_pct': 0.006361706677569645, 'atr_max_pct': 0.04438835777194181, 'tp_mult': 1.3749660593704232, 'tsl_mult': 0.2805205403862773, 'strategy': 'breakout', 'time_stop': 204, 'use_sma': False, 'use_atr': False, 'use_adx': True, 'use_ema': False, 'use_spike': False, 'rsi_required': True, 'edge_k': 0.5777640291191117, 'edge_cap': 0.9321010228703045, 'bull_strategy': 'breakout', 'bull_bb_std_mult': 1.505550516446185, 'bull_rsi_os': 50, 'bull_rsi_ob': 84, 'bull_adx_thresh': 9.687124544882888, 'bull_atr_min_pct': 0.02038698743920428, 'bull_atr_max_pct': 0.10519562448659267, 'bull_tp_mult': 2.2475417498598382, 'bull_tsl_mult': 0.5718374824169575, 'bull_time_stop': 53, 'bull_use_sma': True, 'bull_use_ema': True, 'bull_use_atr': True, 'bull_use_adx': True, 'bull_use_spike': True, 'bull_rsi_required': False, 'bear_strategy': 'mean_reversion', 'bear_bb_std_mult': 1.7844123459444658, 'bear_rsi_os': 10, 'bear_rsi_ob': 75, 'bear_adx_thresh': 16.44569929757041, 'bear_atr_min_pct': 0.0014133793438363103, 'bear_atr_max_pct': 0.10816330899523507, 'bear_tp_mult': 1.42991755309854, 'bear_tsl_mult': 0.8392628636134971, 'bear_time_stop': 37, 'bear_use_sma': True, 'bear_use_ema': False, 'bear_use_atr': True, 'bear_use_adx': True, 'bear_use_spike': True, 'bear_rsi_required': True, 'sideways_strategy': 'mean_reversion', 'sideways_bb_std_mult': 3.1623330702172954, 'sideways_rsi_os': 13, 'sideways_rsi_ob': 75, 'sideways_adx_thresh': 10.543004429193058, 'sideways_atr_min_pct': 0.019825097881094923, 'sideways_atr_max_pct': 0.07164643119612835, 'sideways_tp_mult': 1.6023163213276597, 'sideways_tsl_mult': 0.4325686421209606, 'sideways_time_stop': 233, 'sideways_use_sma': True, 'sideways_use_ema': False, 'sideways_use_atr': True, 'sideways_use_adx': True, 'sideways_use_spike': True, 'sideways_rsi_required': True}.
[I 2025-08-30 15:37:22,319] Trial 514 finished with values: [-1000000000.0, 1000000000.0] and parameters: {'p_sma': 8, 'p_std': 22, 'p_atr': 11, 'p_adx': 16, 'rsi_period': 8, 'ema1': 24, 'ema2': 39, 'slip_atr_k': 0.06201215504911388, 'slip_spread_k': 0.6944136041804251, 'spread_hl_frac': 0.012144796507264072, 'bb_std_mult': 0.7735081249518917, 'rsi_os': 26, 'rsi_ob': 84, 'vol_spike': 0.2177778722382121, 'adx_thresh': 28.19052018564193, 'atr_min_pct': 0.0059344461119466615, 'atr_max_pct': 0.0645070186402809, 'tp_mult': 1.5544559413971841, 'tsl_mult': 0.3932899484638611, 'strategy': 'breakout', 'time_stop': 164, 'use_sma': True, 'use_atr': False, 'use_adx': False, 'use_ema': False, 'use_spike': False, 'rsi_required': False, 'edge_k': 0.5495699493671107, 'edge_cap': 0.9752299696922797, 'bull_strategy': 'mean_reversion', 'bull_bb_std_mult': 1.6099770256225288, 'bull_rsi_os': 49, 'bull_rsi_ob': 86, 'bull_adx_thresh': 24.64241612600113, 'bull_atr_min_pct': 0.019107860124831115, 'bull_atr_max_pct': 0.10750382625592331, 'bull_tp_mult': 2.59324511480918, 'bull_tsl_mult': 0.8223629462508443, 'bull_time_stop': 225, 'bull_use_sma': True, 'bull_use_ema': False, 'bull_use_atr': False, 'bull_use_adx': True, 'bull_use_spike': False, 'bull_rsi_required': True, 'bear_strategy': 'breakout', 'bear_bb_std_mult': 1.9191596512754625, 'bear_rsi_os': 24, 'bear_rsi_ob': 53, 'bear_adx_thresh': 14.571978921022113, 'bear_atr_min_pct': 0.002349145847461462, 'bear_atr_max_pct': 0.11255731607478854, 'bear_tp_mult': 2.5935443005170673, 'bear_tsl_mult': 0.8674036120017953, 'bear_time_stop': 91, 'bear_use_sma': False, 'bear_use_ema': True, 'bear_use_atr': True, 'bear_use_adx': True, 'bear_use_spike': False, 'bear_rsi_required': False, 'sideways_strategy': 'mean_reversion', 'sideways_bb_std_mult': 2.615229437036692, 'sideways_rsi_os': 19, 'sideways_rsi_ob': 80, 'sideways_adx_thresh': 11.924948033969311, 'sideways_atr_min_pct': 0.017971330062526936, 'sideways_atr_max_pct': 0.06685696496218675, 'sideways_tp_mult': 2.6536857576600528, 'sideways_tsl_mult': 0.39518854737436393, 'sideways_time_stop': 140, 'sideways_use_sma': True, 'sideways_use_ema': False, 'sideways_use_atr': True, 'sideways_use_adx': True, 'sideways_use_spike': False, 'sideways_rsi_required': True}.
[I 2025-08-30 15:37:23,586] Trial 513 finished with values: [-1000000000.0, 1000000000.0] and parameters: {'p_sma': 8, 'p_std': 23, 'p_atr': 11, 'p_adx': 19, 'rsi_period': 9, 'ema1': 24, 'ema2': 20, 'slip_atr_k': 0.19632485931930393, 'slip_spread_k': 0.6918429643313007, 'spread_hl_frac': 0.03455881465729519, 'bb_std_mult': 0.7644477014597055, 'rsi_os': 29, 'rsi_ob': 84, 'vol_spike': 0.22667339025199132, 'adx_thresh': 8.693903716728068, 'atr_min_pct': 0.005883025087389372, 'atr_max_pct': 0.14111112627332698, 'tp_mult': 1.552429219246683, 'tsl_mult': 0.3917865131121566, 'strategy': 'breakout', 'time_stop': 155, 'use_sma': True, 'use_atr': False, 'use_adx': False, 'use_ema': False, 'use_spike': False, 'rsi_required': False, 'edge_k': 0.7296318999641531, 'edge_cap': 0.9736977025133292, 'bull_strategy': 'mean_reversion', 'bull_bb_std_mult': 1.5969043604705226, 'bull_rsi_os': 51, 'bull_rsi_ob': 86, 'bull_adx_thresh': 10.82613036828779, 'bull_atr_min_pct': 0.019218310516635577, 'bull_atr_max_pct': 0.1078205109098971, 'bull_tp_mult': 2.2774906235427808, 'bull_tsl_mult': 0.5396318333025624, 'bull_time_stop': 289, 'bull_use_sma': True, 'bull_use_ema': True, 'bull_use_atr': False, 'bull_use_adx': True, 'bull_use_spike': False, 'bull_rsi_required': True, 'bear_strategy': 'breakout', 'bear_bb_std_mult': 1.887178680258567, 'bear_rsi_os': 44, 'bear_rsi_ob': 76, 'bear_adx_thresh': 14.60051265727559, 'bear_atr_min_pct': 0.002231324244621981, 'bear_atr_max_pct': 0.03375397717792128, 'bear_tp_mult': 2.5808537059718986, 'bear_tsl_mult': 0.8680916382368017, 'bear_time_stop': 81, 'bear_use_sma': False, 'bear_use_ema': False, 'bear_use_atr': True, 'bear_use_adx': True, 'bear_use_spike': False, 'bear_rsi_required': False, 'sideways_strategy': 'mean_reversion', 'sideways_bb_std_mult': 2.5712944366859256, 'sideways_rsi_os': 8, 'sideways_rsi_ob': 76, 'sideways_adx_thresh': 12.978073437902811, 'sideways_atr_min_pct': 0.020235949968928323, 'sideways_atr_max_pct': 0.06623872636458118, 'sideways_tp_mult': 1.7882970665486548, 'sideways_tsl_mult': 0.4407781014848802, 'sideways_time_stop': 290, 'sideways_use_sma': True, 'sideways_use_ema': False, 'sideways_use_atr': True, 'sideways_use_adx': True, 'sideways_use_spike': False, 'sideways_rsi_required': True}.
