[I 2025-08-30 16:11:41,022] Trial 684 finished with values: [-1000000000.0, 1000000000.0] and parameters: {'p_sma': 10, 'p_std': 23, 'p_atr': 26, 'p_adx': 26, 'rsi_period': 62, 'ema1': 5, 'ema2': 36, 'slip_atr_k': 0.0062417050636213575, 'slip_spread_k': 0.6857024041942335, 'spread_hl_frac': 0.007759364276347814, 'bb_std_mult': 0.5224794126143306, 'rsi_os': 27, 'rsi_ob': 86, 'vol_spike': 0.22692216744518717, 'adx_thresh': 8.945071010107126, 'atr_min_pct': 0.007065533367090747, 'atr_max_pct': 0.11585460485674637, 'tp_mult': 1.2739670351472174, 'tsl_mult': 0.6434176312154944, 'strategy': 'breakout', 'time_stop': 163, 'use_sma': False, 'use_atr': False, 'use_adx': True, 'use_ema': False, 'use_spike': False, 'rsi_required': False, 'edge_k': 0.61104273856435, 'edge_cap': 0.619745925338023, 'bull_strategy': 'breakout', 'bull_bb_std_mult': 0.8323115259969089, 'bull_rsi_os': 52, 'bull_rsi_ob': 85, 'bull_adx_thresh': 14.413685345277464, 'bull_atr_min_pct': 0.016617939643066838, 'bull_atr_max_pct': 0.10243948176155748, 'bull_tp_mult': 1.826601187225151, 'bull_tsl_mult': 0.28649652231556916, 'bull_time_stop': 74, 'bull_use_sma': True, 'bull_use_ema': True, 'bull_use_atr': True, 'bull_use_adx': True, 'bull_use_spike': True, 'bull_rsi_required': True, 'bear_strategy': 'mean_reversion', 'bear_bb_std_mult': 1.5041863827602744, 'bear_rsi_os': 26, 'bear_rsi_ob': 79, 'bear_adx_thresh': 16.443600895813358, 'bear_atr_min_pct': 0.0025658755795216937, 'bear_atr_max_pct': 0.10877301994883215, 'bear_tp_mult': 2.6800548350125406, 'bear_tsl_mult': 0.36219274243368715, 'bear_time_stop': 233, 'bear_use_sma': True, 'bear_use_ema': False, 'bear_use_atr': True, 'bear_use_adx': True, 'bear_use_spike': False, 'bear_rsi_required': False, 'sideways_strategy': 'breakout', 'sideways_bb_std_mult': 3.2348002507583553, 'sideways_rsi_os': 9, 'sideways_rsi_ob': 80, 'sideways_adx_thresh': 11.003473352057178, 'sideways_atr_min_pct': 0.01988597993694823, 'sideways_atr_max_pct': 0.06579908989866604, 'sideways_tp_mult': 1.5394303926002662, 'sideways_tsl_mult': 0.3947177275225677, 'sideways_time_stop': 122, 'sideways_use_sma': True, 'sideways_use_ema': False, 'sideways_use_atr': True, 'sideways_use_adx': True, 'sideways_use_spike': False, 'sideways_rsi_required': True}.
[I 2025-08-30 16:11:41,269] Trial 682 finished with values: [-1000000000.0, 1000000000.0] and parameters: {'p_sma': 6, 'p_std': 25, 'p_atr': 26, 'p_adx': 10, 'rsi_period': 13, 'ema1': 28, 'ema2': 38, 'slip_atr_k': 0.060200500891555625, 'slip_spread_k': 0.9950894911090317, 'spread_hl_frac': 0.008730078549143306, 'bb_std_mult': 0.5346032040685887, 'rsi_os': 27, 'rsi_ob': 64, 'vol_spike': 0.06930716249970727, 'adx_thresh': 9.018869094361085, 'atr_min_pct': 0.016344883829858665, 'atr_max_pct': 0.05623784127771232, 'tp_mult': 1.5280300471257335, 'tsl_mult': 0.3261997325804392, 'strategy': 'breakout', 'time_stop': 180, 'use_sma': True, 'use_atr': True, 'use_adx': False, 'use_ema': False, 'use_spike': True, 'rsi_required': False, 'edge_k': 0.8880574179342292, 'edge_cap': 0.9631075754585182, 'bull_strategy': 'breakout', 'bull_bb_std_mult': 1.6942942345606804, 'bull_rsi_os': 39, 'bull_rsi_ob': 88, 'bull_adx_thresh': 8.347435264899921, 'bull_atr_min_pct': 0.01443574518321256, 'bull_atr_max_pct': 0.10354161368026123, 'bull_tp_mult': 2.6963979798158553, 'bull_tsl_mult': 0.8969581466277192, 'bull_time_stop': 300, 'bull_use_sma': True, 'bull_use_ema': True, 'bull_use_atr': True, 'bull_use_adx': True, 'bull_use_spike': True, 'bull_rsi_required': False, 'bear_strategy': 'mean_reversion', 'bear_bb_std_mult': 2.211193926330914, 'bear_rsi_os': 32, 'bear_rsi_ob': 94, 'bear_adx_thresh': 12.610742621545626, 'bear_atr_min_pct': 0.0025481014679232727, 'bear_atr_max_pct': 0.10896640820137353, 'bear_tp_mult': 2.688756093180834, 'bear_tsl_mult': 0.7725240314049395, 'bear_time_stop': 92, 'bear_use_sma': True, 'bear_use_ema': False, 'bear_use_atr': False, 'bear_use_adx': True, 'bear_use_spike': True, 'bear_rsi_required': True, 'sideways_strategy': 'mean_reversion', 'sideways_bb_std_mult': 3.1194052943953543, 'sideways_rsi_os': 26, 'sideways_rsi_ob': 78, 'sideways_adx_thresh': 10.369191948852372, 'sideways_atr_min_pct': 0.019881463267025928, 'sideways_atr_max_pct': 0.07190344618039676, 'sideways_tp_mult': 1.5406136057184059, 'sideways_tsl_mult': 0.36402680384289393, 'sideways_time_stop': 122, 'sideways_use_sma': True, 'sideways_use_ema': False, 'sideways_use_atr': True, 'sideways_use_adx': False, 'sideways_use_spike': True, 'sideways_rsi_required': True}.
[I 2025-08-30 16:12:30,631] Trial 687 finished with values: [-1000000000.0, 1000000000.0] and parameters: {'p_sma': 47, 'p_std': 60, 'p_atr': 9, 'p_adx': 26, 'rsi_period': 79, 'ema1': 26, 'ema2': 42, 'slip_atr_k': 0.05607746012767703, 'slip_spread_k': 0.16101959622680245, 'spread_hl_frac': 0.007876954084657191, 'bb_std_mult': 0.6184864671492835, 'rsi_os': 27, 'rsi_ob': 81, 'vol_spike': 0.15027382901641712, 'adx_thresh': 22.711373105645357, 'atr_min_pct': 0.027768907637154356, 'atr_max_pct': 0.11635092619352842, 'tp_mult': 1.588026168915728, 'tsl_mult': 0.3720348419757018, 'strategy': 'mean_reversion', 'time_stop': 136, 'use_sma': False, 'use_atr': False, 'use_adx': True, 'use_ema': True, 'use_spike': False, 'rsi_required': False, 'edge_k': 1.2638557268809494, 'edge_cap': 0.9246887140158031, 'bull_strategy': 'mean_reversion', 'bull_bb_std_mult': 1.6306823451084298, 'bull_rsi_os': 6, 'bull_rsi_ob': 88, 'bull_adx_thresh': 27.263725010559284, 'bull_atr_min_pct': 0.01947600582753549, 'bull_atr_max_pct': 0.10493043067954341, 'bull_tp_mult': 2.642848572973098, 'bull_tsl_mult': 0.905942657275179, 'bull_time_stop': 215, 'bull_use_sma': False, 'bull_use_ema': True, 'bull_use_atr': False, 'bull_use_adx': True, 'bull_use_spike': False, 'bull_rsi_required': False, 'bear_strategy': 'breakout', 'bear_bb_std_mult': 2.243577708829206, 'bear_rsi_os': 32, 'bear_rsi_ob': 58, 'bear_adx_thresh': 12.864139231908005, 'bear_atr_min_pct': 0.0026397701201977147, 'bear_atr_max_pct': 0.11605423851272907, 'bear_tp_mult': 2.7106936289279453, 'bear_tsl_mult': 0.34355482614221045, 'bear_time_stop': 89, 'bear_use_sma': False, 'bear_use_ema': False, 'bear_use_atr': True, 'bear_use_adx': True, 'bear_use_spike': True, 'bear_rsi_required': True, 'sideways_strategy': 'mean_reversion', 'sideways_bb_std_mult': 2.8921727374191533, 'sideways_rsi_os': 16, 'sideways_rsi_ob': 79, 'sideways_adx_thresh': 31.486471259638847, 'sideways_atr_min_pct': 0.020674284792460192, 'sideways_atr_max_pct': 0.06728980748410968, 'sideways_tp_mult': 1.451743599466018, 'sideways_tsl_mult': 0.28216553785194065, 'sideways_time_stop': 222, 'sideways_use_sma': True, 'sideways_use_ema': False, 'sideways_use_atr': True, 'sideways_use_adx': True, 'sideways_use_spike': True, 'sideways_rsi_required': True}.
[I 2025-08-30 16:12:31,202] Trial 686 finished with values: [-1000000000.0, 1000000000.0] and parameters: {'p_sma': 9, 'p_std': 23, 'p_atr': 24, 'p_adx': 26, 'rsi_period': 12, 'ema1': 5, 'ema2': 42, 'slip_atr_k': 0.05608806273744836, 'slip_spread_k': 0.6842522000245332, 'spread_hl_frac': 0.0077633841136482765, 'bb_std_mult': 1.1143152815942263, 'rsi_os': 27, 'rsi_ob': 86, 'vol_spike': 0.19416513988969095, 'adx_thresh': 17.32913662349493, 'atr_min_pct': 0.0072937652791443906, 'atr_max_pct': 0.10436711074619479, 'tp_mult': 1.3469775956448553, 'tsl_mult': 0.36439902309389255, 'strategy': 'mean_reversion', 'time_stop': 136, 'use_sma': False, 'use_atr': False, 'use_adx': True, 'use_ema': False, 'use_spike': False, 'rsi_required': False, 'edge_k': 1.4048953384318068, 'edge_cap': 0.924822831465915, 'bull_strategy': 'breakout', 'bull_bb_std_mult': 3.3168094895953724, 'bull_rsi_os': 51, 'bull_rsi_ob': 67, 'bull_adx_thresh': 12.622354506395757, 'bull_atr_min_pct': 0.01949257200802481, 'bull_atr_max_pct': 0.06794672820198686, 'bull_tp_mult': 2.613401004014219, 'bull_tsl_mult': 0.8295551870126154, 'bull_time_stop': 254, 'bull_use_sma': False, 'bull_use_ema': True, 'bull_use_atr': True, 'bull_use_adx': True, 'bull_use_spike': True, 'bull_rsi_required': False, 'bear_strategy': 'mean_reversion', 'bear_bb_std_mult': 1.5831178407251607, 'bear_rsi_os': 28, 'bear_rsi_ob': 76, 'bear_adx_thresh': 22.405824598177347, 'bear_atr_min_pct': 0.0025354363012201667, 'bear_atr_max_pct': 0.07357029000558822, 'bear_tp_mult': 2.145571129861321, 'bear_tsl_mult': 0.8093730158874229, 'bear_time_stop': 234, 'bear_use_sma': True, 'bear_use_ema': False, 'bear_use_atr': True, 'bear_use_adx': True, 'bear_use_spike': True, 'bear_rsi_required': True, 'sideways_strategy': 'mean_reversion', 'sideways_bb_std_mult': 3.136736694760736, 'sideways_rsi_os': 16, 'sideways_rsi_ob': 45, 'sideways_adx_thresh': 11.144226458902258, 'sideways_atr_min_pct': 0.014531949519625486, 'sideways_atr_max_pct': 0.06587755051719214, 'sideways_tp_mult': 1.5616727355982383, 'sideways_tsl_mult': 0.35964881222086215, 'sideways_time_stop': 128, 'sideways_use_sma': True, 'sideways_use_ema': False, 'sideways_use_atr': True, 'sideways_use_adx': True, 'sideways_use_spike': True, 'sideways_rsi_required': True}.
[I 2025-08-30 16:12:32,042] Trial 689 finished with values: [-1000000000.0, 1000000000.0] and parameters: {'p_sma': 9, 'p_std': 19, 'p_atr': 28, 'p_adx': 28, 'rsi_period': 7, 'ema1': 6, 'ema2': 42, 'slip_atr_k': 0.0003940454302887833, 'slip_spread_k': 0.5560395495171024, 'spread_hl_frac': 0.005807132604462779, 'bb_std_mult': 2.486833933901324, 'rsi_os': 26, 'rsi_ob': 74, 'vol_spike': 0.18758570229000104, 'adx_thresh': 19.028107051873622, 'atr_min_pct': 0.006426623638183895, 'atr_max_pct': 0.10494905090639357, 'tp_mult': 1.5783361367210804, 'tsl_mult': 0.3594290568465956, 'strategy': 'mean_reversion', 'time_stop': 155, 'use_sma': False, 'use_atr': False, 'use_adx': True, 'use_ema': True, 'use_spike': False, 'rsi_required': False, 'edge_k': 1.5249665758162378, 'edge_cap': 0.9236212150409481, 'bull_strategy': 'mean_reversion', 'bull_bb_std_mult': 1.5934682382976708, 'bull_rsi_os': 48, 'bull_rsi_ob': 77, 'bull_adx_thresh': 25.28246369782544, 'bull_atr_min_pct': 0.01945936432704821, 'bull_atr_max_pct': 0.07084677732769178, 'bull_tp_mult': 2.6226244602660325, 'bull_tsl_mult': 0.865061640088686, 'bull_time_stop': 266, 'bull_use_sma': False, 'bull_use_ema': False, 'bull_use_atr': False, 'bull_use_adx': True, 'bull_use_spike': False, 'bull_rsi_required': False, 'bear_strategy': 'breakout', 'bear_bb_std_mult': 2.662313354880978, 'bear_rsi_os': 25, 'bear_rsi_ob': 76, 'bear_adx_thresh': 14.164160375493207, 'bear_atr_min_pct': 0.003760624374223923, 'bear_atr_max_pct': 0.07132972454349693, 'bear_tp_mult': 2.731104048367705, 'bear_tsl_mult': 0.15247159410014316, 'bear_time_stop': 300, 'bear_use_sma': False, 'bear_use_ema': True, 'bear_use_atr': True, 'bear_use_adx': False, 'bear_use_spike': True, 'bear_rsi_required': True, 'sideways_strategy': 'mean_reversion', 'sideways_bb_std_mult': 3.364335632168567, 'sideways_rsi_os': 29, 'sideways_rsi_ob': 79, 'sideways_adx_thresh': 8.843516952262435, 'sideways_atr_min_pct': 0.004459539217971157, 'sideways_atr_max_pct': 0.06633925410887188, 'sideways_tp_mult': 1.3484446371731627, 'sideways_tsl_mult': 0.7550953583008251, 'sideways_time_stop': 135, 'sideways_use_sma': False, 'sideways_use_ema': True, 'sideways_use_atr': False, 'sideways_use_adx': True, 'sideways_use_spike': True, 'sideways_rsi_required': True}.
[I 2025-08-30 16:12:32,313] Trial 688 finished with values: [-1000000000.0, 1000000000.0] and parameters: {'p_sma': 48, 'p_std': 12, 'p_atr': 12, 'p_adx': 25, 'rsi_period': 80, 'ema1': 26, 'ema2': 35, 'slip_atr_k': 0.06823794074192742, 'slip_spread_k': 0.7150649010043671, 'spread_hl_frac': 0.00637801841859415, 'bb_std_mult': 2.227662158882339, 'rsi_os': 11, 'rsi_ob': 85, 'vol_spike': 0.2996418985165494, 'adx_thresh': 7.374451508536261, 'atr_min_pct': 0.006290556721886274, 'atr_max_pct': 0.10751813127240395, 'tp_mult': 1.353217875937452, 'tsl_mult': 0.37407551181578297, 'strategy': 'mean_reversion', 'time_stop': 167, 'use_sma': False, 'use_atr': False, 'use_adx': True, 'use_ema': True, 'use_spike': False, 'rsi_required': False, 'edge_k': 1.2702307661951233, 'edge_cap': 0.9201095809289066, 'bull_strategy': 'mean_reversion', 'bull_bb_std_mult': 3.323959671002636, 'bull_rsi_os': 48, 'bull_rsi_ob': 88, 'bull_adx_thresh': 8.11198453732916, 'bull_atr_min_pct': 0.019259261506680354, 'bull_atr_max_pct': 0.06898399087077235, 'bull_tp_mult': 2.6523722411597146, 'bull_tsl_mult': 0.7291449630673562, 'bull_time_stop': 51, 'bull_use_sma': False, 'bull_use_ema': True, 'bull_use_atr': False, 'bull_use_adx': True, 'bull_use_spike': False, 'bull_rsi_required': False, 'bear_strategy': 'breakout', 'bear_bb_std_mult': 2.2105919809707326, 'bear_rsi_os': 50, 'bear_rsi_ob': 58, 'bear_adx_thresh': 15.320193829132176, 'bear_atr_min_pct': 0.015841767229220153, 'bear_atr_max_pct': 0.11492396942142305, 'bear_tp_mult': 2.608996667672751, 'bear_tsl_mult': 0.7706088209522358, 'bear_time_stop': 90, 'bear_use_sma': False, 'bear_use_ema': False, 'bear_use_atr': True, 'bear_use_adx': True, 'bear_use_spike': True, 'bear_rsi_required': True, 'sideways_strategy': 'mean_reversion', 'sideways_bb_std_mult': 3.1620464547003957, 'sideways_rsi_os': 6, 'sideways_rsi_ob': 78, 'sideways_adx_thresh': 28.77699166312473, 'sideways_atr_min_pct': 0.018490676341404243, 'sideways_atr_max_pct': 0.062026451984793264, 'sideways_tp_mult': 1.3738006685120605, 'sideways_tsl_mult': 0.43388634928661984, 'sideways_time_stop': 113, 'sideways_use_sma': True, 'sideways_use_ema': True, 'sideways_use_atr': True, 'sideways_use_adx': True, 'sideways_use_spike': True, 'sideways_rsi_required': True}.
[I 2025-08-30 16:13:25,848] Trial 693 finished with values: [-1000000000.0, 1000000000.0] and parameters: {'p_sma': 23, 'p_std': 21, 'p_atr': 10, 'p_adx': 18, 'rsi_period': 9, 'ema1': 27, 'ema2': 34, 'slip_atr_k': 0.11777795824444802, 'slip_spread_k': 0.6476531569410079, 'spread_hl_frac': 0.006561197984590366, 'bb_std_mult': 2.6641576185782574, 'rsi_os': 25, 'rsi_ob': 46, 'vol_spike': 0.2145433353813483, 'adx_thresh': 22.041177173636665, 'atr_min_pct': 0.006686484520192501, 'atr_max_pct': 0.11014024301388733, 'tp_mult': 1.5102370995744625, 'tsl_mult': 0.3068656878765064, 'strategy': 'breakout', 'time_stop': 161, 'use_sma': False, 'use_atr': False, 'use_adx': True, 'use_ema': False, 'use_spike': False, 'rsi_required': True, 'edge_k': 0.7081485151752376, 'edge_cap': 0.37347349194441737, 'bull_strategy': 'breakout', 'bull_bb_std_mult': 3.005839340690068, 'bull_rsi_os': 51, 'bull_rsi_ob': 90, 'bull_adx_thresh': 10.134845957212196, 'bull_atr_min_pct': 0.020362449371182628, 'bull_atr_max_pct': 0.1404105184169159, 'bull_tp_mult': 2.503965768006553, 'bull_tsl_mult': 0.9315652265174964, 'bull_time_stop': 192, 'bull_use_sma': True, 'bull_use_ema': False, 'bull_use_atr': True, 'bull_use_adx': True, 'bull_use_spike': True, 'bull_rsi_required': True, 'bear_strategy': 'mean_reversion', 'bear_bb_std_mult': 1.1658613616772726, 'bear_rsi_os': 28, 'bear_rsi_ob': 77, 'bear_adx_thresh': 26.401246528320144, 'bear_atr_min_pct': 0.012097536212769006, 'bear_atr_max_pct': 0.11191800628446248, 'bear_tp_mult': 2.543202197198208, 'bear_tsl_mult': 0.8601647995316437, 'bear_time_stop': 139, 'bear_use_sma': True, 'bear_use_ema': True, 'bear_use_atr': True, 'bear_use_adx': False, 'bear_use_spike': True, 'bear_rsi_required': True, 'sideways_strategy': 'breakout', 'sideways_bb_std_mult': 3.0272720053831543, 'sideways_rsi_os': 39, 'sideways_rsi_ob': 77, 'sideways_adx_thresh': 9.746305357491508, 'sideways_atr_min_pct': 0.01491836243566517, 'sideways_atr_max_pct': 0.0771594923250132, 'sideways_tp_mult': 1.228869404047267, 'sideways_tsl_mult': 0.4188026136323519, 'sideways_time_stop': 129, 'sideways_use_sma': False, 'sideways_use_ema': False, 'sideways_use_atr': False, 'sideways_use_adx': True, 'sideways_use_spike': True, 'sideways_rsi_required': False}.
[I 2025-08-30 16:13:26,698] Trial 690 finished with values: [-1000000000.0, 1000000000.0] and parameters: {'p_sma': 9, 'p_std': 46, 'p_atr': 24, 'p_adx': 28, 'rsi_period': 7, 'ema1': 6, 'ema2': 34, 'slip_atr_k': 0.12877649012589718, 'slip_spread_k': 0.7142985754729752, 'spread_hl_frac': 0.00630052257636432, 'bb_std_mult': 2.019826207901389, 'rsi_os': 25, 'rsi_ob': 87, 'vol_spike': 0.2136818956501874, 'adx_thresh': 17.35908636754374, 'atr_min_pct': 0.006450632385865999, 'atr_max_pct': 0.1074980091337859, 'tp_mult': 1.204825289114424, 'tsl_mult': 0.35596768451895017, 'strategy': 'mean_reversion', 'time_stop': 211, 'use_sma': False, 'use_atr': False, 'use_adx': True, 'use_ema': False, 'use_spike': False, 'rsi_required': False, 'edge_k': 1.4156095453357982, 'edge_cap': 0.9711260716881596, 'bull_strategy': 'breakout', 'bull_bb_std_mult': 1.4785077909903759, 'bull_rsi_os': 48, 'bull_rsi_ob': 67, 'bull_adx_thresh': 10.391564751628216, 'bull_atr_min_pct': 0.019311605522353694, 'bull_atr_max_pct': 0.034052209409334434, 'bull_tp_mult': 2.4982462487157173, 'bull_tsl_mult': 0.49233569299975893, 'bull_time_stop': 190, 'bull_use_sma': False, 'bull_use_ema': False, 'bull_use_atr': True, 'bull_use_adx': True, 'bull_use_spike': True, 'bull_rsi_required': False, 'bear_strategy': 'mean_reversion', 'bear_bb_std_mult': 1.3569046979666304, 'bear_rsi_os': 28, 'bear_rsi_ob': 77, 'bear_adx_thresh': 14.09115186591077, 'bear_atr_min_pct': 0.003923628992646113, 'bear_atr_max_pct': 0.1125073275975621, 'bear_tp_mult': 2.6189676445076375, 'bear_tsl_mult': 0.14084101989520226, 'bear_time_stop': 112, 'bear_use_sma': False, 'bear_use_ema': True, 'bear_use_atr': True, 'bear_use_adx': False, 'bear_use_spike': True, 'bear_rsi_required': True, 'sideways_strategy': 'mean_reversion', 'sideways_bb_std_mult': 2.830313304046512, 'sideways_rsi_os': 51, 'sideways_rsi_ob': 92, 'sideways_adx_thresh': 13.810182454977905, 'sideways_atr_min_pct': 0.018429694829288374, 'sideways_atr_max_pct': 0.02589845382251918, 'sideways_tp_mult': 1.3565842890237998, 'sideways_tsl_mult': 0.4438821268431435, 'sideways_time_stop': 112, 'sideways_use_sma': False, 'sideways_use_ema': True, 'sideways_use_atr': False, 'sideways_use_adx': True, 'sideways_use_spike': True, 'sideways_rsi_required': False}.
[I 2025-08-30 16:13:27,020] Trial 692 finished with values: [-0.0003074303363796993, 0.0030043772628034287] and parameters: {'p_sma': 8, 'p_std': 14, 'p_atr': 12, 'p_adx': 25, 'rsi_period': 8, 'ema1': 22, 'ema2': 35, 'slip_atr_k': 0.0001366256149487476, 'slip_spread_k': 0.7137577451513714, 'spread_hl_frac': 0.019347446745132064, 'bb_std_mult': 1.305692951264322, 'rsi_os': 24, 'rsi_ob': 55, 'vol_spike': 0.21655210906864802, 'adx_thresh': 7.901310308754782, 'atr_min_pct': 0.005535679953202877, 'atr_max_pct': 0.10954125585439271, 'tp_mult': 1.1943078589183134, 'tsl_mult': 0.2605819744859087, 'strategy': 'breakout', 'time_stop': 82, 'use_sma': False, 'use_atr': False, 'use_adx': True, 'use_ema': False, 'use_spike': False, 'rsi_required': True, 'edge_k': 0.6492450429977916, 'edge_cap': 0.744619758324364, 'bull_strategy': 'breakout', 'bull_bb_std_mult': 1.3374865389368842, 'bull_rsi_os': 50, 'bull_rsi_ob': 87, 'bull_adx_thresh': 10.552361259288801, 'bull_atr_min_pct': 0.008501717651694902, 'bull_atr_max_pct': 0.14134691297801874, 'bull_tp_mult': 2.499033803752104, 'bull_tsl_mult': 0.9387921418115935, 'bull_time_stop': 52, 'bull_use_sma': True, 'bull_use_ema': True, 'bull_use_atr': True, 'bull_use_adx': True, 'bull_use_spike': True, 'bull_rsi_required': True, 'bear_strategy': 'mean_reversion', 'bear_bb_std_mult': 2.6037600196426425, 'bear_rsi_os': 23, 'bear_rsi_ob': 91, 'bear_adx_thresh': 15.346121925799597, 'bear_atr_min_pct': 0.003912230253146422, 'bear_atr_max_pct': 0.11294033231610585, 'bear_tp_mult': 2.594612811320736, 'bear_tsl_mult': 0.8595597331812933, 'bear_time_stop': 141, 'bear_use_sma': True, 'bear_use_ema': False, 'bear_use_atr': True, 'bear_use_adx': True, 'bear_use_spike': True, 'bear_rsi_required': True, 'sideways_strategy': 'breakout', 'sideways_bb_std_mult': 3.1901270268971635, 'sideways_rsi_os': 8, 'sideways_rsi_ob': 76, 'sideways_adx_thresh': 16.044314249844927, 'sideways_atr_min_pct': 0.00239462841978102, 'sideways_atr_max_pct': 0.07868957847240517, 'sideways_tp_mult': 1.7060296395929266, 'sideways_tsl_mult': 0.43675008783969405, 'sideways_time_stop': 112, 'sideways_use_sma': False, 'sideways_use_ema': True, 'sideways_use_atr': True, 'sideways_use_adx': True, 'sideways_use_spike': True, 'sideways_rsi_required': False}.
