[I 2025-08-30 14:25:25,912] Trial 38 finished with values: [-1000000000.0, 1000000000.0] and parameters: {'p_sma': 44, 'p_std': 8, 'p_atr': 12, 'p_adx': 15, 'rsi_period': 78, 'ema1': 25, 'ema2': 23, 'slip_atr_k': 0.07477032658240716, 'slip_spread_k': 0.7511093496746437, 'spread_hl_frac': 0.02145795898239881, 'bb_std_mult': 2.496193335655423, 'rsi_os': 21, 'rsi_ob': 66, 'vol_spike': 0.24551143686005006, 'adx_thresh': 18.548210426092727, 'atr_min_pct': 0.005211878294621513, 'atr_max_pct': 0.03496792907141581, 'tp_mult': 2.3124404061697477, 'tsl_mult': 0.4341955276257321, 'strategy': 'breakout', 'time_stop': 148, 'use_sma': True, 'use_atr': False, 'use_adx': True, 'use_ema': True, 'use_spike': False, 'rsi_required': True, 'edge_k': 1.093068358521649, 'edge_cap': 0.09228826234094428, 'bull_strategy': 'mean_reversion', 'bull_bb_std_mult': 0.5126212322309842, 'bull_rsi_os': 31, 'bull_rsi_ob': 85, 'bull_adx_thresh': 33.47184370545984, 'bull_atr_min_pct': 0.006171504286133986, 'bull_atr_max_pct': 0.026162828521328868, 'bull_tp_mult': 1.6852764895633725, 'bull_tsl_mult': 0.9045787518343706, 'bull_time_stop': 270, 'bull_use_sma': True, 'bull_use_ema': False, 'bull_use_atr': True, 'bull_use_adx': True, 'bull_use_spike': False, 'bull_rsi_required': True, 'bear_strategy': 'breakout', 'bear_bb_std_mult': 0.9199688422232832, 'bear_rsi_os': 47, 'bear_rsi_ob': 87, 'bear_adx_thresh': 24.94209830203569, 'bear_atr_min_pct': 0.017486862575192004, 'bear_atr_max_pct': 0.048209857995383694, 'bear_tp_mult': 1.6026034120037858, 'bear_tsl_mult': 0.7852100261826105, 'bear_time_stop': 260, 'bear_use_sma': False, 'bear_use_ema': False, 'bear_use_atr': True, 'bear_use_adx': False, 'bear_use_spike': False, 'bear_rsi_required': True, 'sideways_strategy': 'mean_reversion', 'sideways_bb_std_mult': 3.5976342857618535, 'sideways_rsi_os': 8, 'sideways_rsi_ob': 81, 'sideways_adx_thresh': 8.987739456046071, 'sideways_atr_min_pct': 0.012778415191412292, 'sideways_atr_max_pct': 0.04216578050139503, 'sideways_tp_mult': 2.5232337024986293, 'sideways_tsl_mult': 0.2220184153549225, 'sideways_time_stop': 120, 'sideways_use_sma': True, 'sideways_use_ema': False, 'sideways_use_atr': True, 'sideways_use_adx': False, 'sideways_use_spike': False, 'sideways_rsi_required': False}.
[I 2025-08-30 14:25:26,640] Trial 36 finished with values: [-1000000000.0, 1000000000.0] and parameters: {'p_sma': 46, 'p_std': 25, 'p_atr': 13, 'p_adx': 15, 'rsi_period': 53, 'ema1': 25, 'ema2': 46, 'slip_atr_k': 0.07742693368944817, 'slip_spread_k': 0.8486423248098347, 'spread_hl_frac': 0.02821140060284048, 'bb_std_mult': 3.1489216407649323, 'rsi_os': 21, 'rsi_ob': 67, 'vol_spike': 0.21621783639553616, 'adx_thresh': 32.928996522921274, 'atr_min_pct': 0.002392585993933003, 'atr_max_pct': 0.03299064318138463, 'tp_mult': 2.7648486791745555, 'tsl_mult': 0.39672140076185236, 'strategy': 'breakout', 'time_stop': 134, 'use_sma': True, 'use_atr': False, 'use_adx': False, 'use_ema': True, 'use_spike': False, 'rsi_required': True, 'edge_k': 1.8106992730919427, 'edge_cap': 0.05285583183414544, 'bull_strategy': 'mean_reversion', 'bull_bb_std_mult': 0.5458887724807447, 'bull_rsi_os': 8, 'bull_rsi_ob': 85, 'bull_adx_thresh': 33.01571843997778, 'bull_atr_min_pct': 0.006154074962527384, 'bull_atr_max_pct': 0.020204244405407766, 'bull_tp_mult': 1.9481971737741215, 'bull_tsl_mult': 0.5406253804684573, 'bull_time_stop': 77, 'bull_use_sma': True, 'bull_use_ema': False, 'bull_use_atr': True, 'bull_use_adx': False, 'bull_use_spike': False, 'bull_rsi_required': True, 'bear_strategy': 'breakout', 'bear_bb_std_mult': 2.367575151686052, 'bear_rsi_os': 12, 'bear_rsi_ob': 84, 'bear_adx_thresh': 24.474932460689118, 'bear_atr_min_pct': 0.016802550577057287, 'bear_atr_max_pct': 0.04821255045661099, 'bear_tp_mult': 1.6364998150187406, 'bear_tsl_mult': 0.778204196432533, 'bear_time_stop': 255, 'bear_use_sma': True, 'bear_use_ema': True, 'bear_use_atr': False, 'bear_use_adx': False, 'bear_use_spike': False, 'bear_rsi_required': False, 'sideways_strategy': 'breakout', 'sideways_bb_std_mult': 2.519012729048404, 'sideways_rsi_os': 15, 'sideways_rsi_ob': 81, 'sideways_adx_thresh': 8.935396400758249, 'sideways_atr_min_pct': 0.028032925148115152, 'sideways_atr_max_pct': 0.04078490410167341, 'sideways_tp_mult': 2.451365812143159, 'sideways_tsl_mult': 0.2547916799344321, 'sideways_time_stop': 110, 'sideways_use_sma': True, 'sideways_use_ema': False, 'sideways_use_atr': True, 'sideways_use_adx': True, 'sideways_use_spike': False, 'sideways_rsi_required': False}.
[I 2025-08-30 14:25:26,765] Trial 39 finished with values: [-1000000000.0, 1000000000.0] and parameters: {'p_sma': 12, 'p_std': 8, 'p_atr': 13, 'p_adx': 14, 'rsi_period': 26, 'ema1': 19, 'ema2': 36, 'slip_atr_k': 0.08098225652598999, 'slip_spread_k': 0.8631889148208611, 'spread_hl_frac': 0.027110711886504983, 'bb_std_mult': 3.128112111747151, 'rsi_os': 21, 'rsi_ob': 69, 'vol_spike': 0.24797570613987946, 'adx_thresh': 18.00377100369753, 'atr_min_pct': 0.004395192506336983, 'atr_max_pct': 0.03621526933519077, 'tp_mult': 2.772664641399299, 'tsl_mult': 0.3841523685793179, 'strategy': 'breakout', 'time_stop': 114, 'use_sma': True, 'use_atr': False, 'use_adx': True, 'use_ema': True, 'use_spike': False, 'rsi_required': False, 'edge_k': 0.7029703029646642, 'edge_cap': 0.33589836512989485, 'bull_strategy': 'mean_reversion', 'bull_bb_std_mult': 0.5655158508075707, 'bull_rsi_os': 32, 'bull_rsi_ob': 52, 'bull_adx_thresh': 10.806567465989293, 'bull_atr_min_pct': 0.006367780369515019, 'bull_atr_max_pct': 0.025282717640382788, 'bull_tp_mult': 2.095566683168795, 'bull_tsl_mult': 0.5360683177525609, 'bull_time_stop': 263, 'bull_use_sma': True, 'bull_use_ema': False, 'bull_use_atr': True, 'bull_use_adx': False, 'bull_use_spike': True, 'bull_rsi_required': True, 'bear_strategy': 'breakout', 'bear_bb_std_mult': 1.0201337554388221, 'bear_rsi_os': 12, 'bear_rsi_ob': 85, 'bear_adx_thresh': 23.472781504477304, 'bear_atr_min_pct': 0.016506603855127013, 'bear_atr_max_pct': 0.09093373752707731, 'bear_tp_mult': 1.6257866203893832, 'bear_tsl_mult': 0.7564340193671559, 'bear_time_stop': 261, 'bear_use_sma': False, 'bear_use_ema': True, 'bear_use_atr': False, 'bear_use_adx': False, 'bear_use_spike': True, 'bear_rsi_required': True, 'sideways_strategy': 'mean_reversion', 'sideways_bb_std_mult': 2.6771792828069163, 'sideways_rsi_os': 8, 'sideways_rsi_ob': 80, 'sideways_adx_thresh': 23.861681074698478, 'sideways_atr_min_pct': 0.010985390378370624, 'sideways_atr_max_pct': 0.042538112822612155, 'sideways_tp_mult': 2.4761440612482404, 'sideways_tsl_mult': 0.24643028346113421, 'sideways_time_stop': 123, 'sideways_use_sma': True, 'sideways_use_ema': False, 'sideways_use_atr': True, 'sideways_use_adx': False, 'sideways_use_spike': False, 'sideways_rsi_required': False}.
[I 2025-08-30 14:25:26,927] Trial 37 finished with values: [-1000000000.0, 1000000000.0] and parameters: {'p_sma': 45, 'p_std': 25, 'p_atr': 14, 'p_adx': 15, 'rsi_period': 54, 'ema1': 27, 'ema2': 47, 'slip_atr_k': 0.07624317367338519, 'slip_spread_k': 0.7300527117911969, 'spread_hl_frac': 0.028069459253751403, 'bb_std_mult': 3.079089001156545, 'rsi_os': 22, 'rsi_ob': 68, 'vol_spike': 0.22227896819339762, 'adx_thresh': 32.46891144453963, 'atr_min_pct': 0.002750790780481779, 'atr_max_pct': 0.03656178509652101, 'tp_mult': 2.690358794719075, 'tsl_mult': 0.32840964345817747, 'strategy': 'breakout', 'time_stop': 101, 'use_sma': True, 'use_atr': False, 'use_adx': False, 'use_ema': True, 'use_spike': False, 'rsi_required': True, 'edge_k': 0.6256944009324574, 'edge_cap': 0.07154467686293642, 'bull_strategy': 'mean_reversion', 'bull_bb_std_mult': 0.5146279013793579, 'bull_rsi_os': 5, 'bull_rsi_ob': 85, 'bull_adx_thresh': 33.41969205698725, 'bull_atr_min_pct': 0.006256944520720904, 'bull_atr_max_pct': 0.0487463508469213, 'bull_tp_mult': 1.8832410322827866, 'bull_tsl_mult': 0.8963482751429749, 'bull_time_stop': 72, 'bull_use_sma': True, 'bull_use_ema': False, 'bull_use_atr': True, 'bull_use_adx': False, 'bull_use_spike': False, 'bull_rsi_required': True, 'bear_strategy': 'breakout', 'bear_bb_std_mult': 1.0158039879927077, 'bear_rsi_os': 46, 'bear_rsi_ob': 93, 'bear_adx_thresh': 27.405871023589896, 'bear_atr_min_pct': 0.01725425013592107, 'bear_atr_max_pct': 0.04908709069241603, 'bear_tp_mult': 1.6594632134533216, 'bear_tsl_mult': 0.7771210579880224, 'bear_time_stop': 206, 'bear_use_sma': True, 'bear_use_ema': True, 'bear_use_atr': False, 'bear_use_adx': False, 'bear_use_spike': False, 'bear_rsi_required': False, 'sideways_strategy': 'breakout', 'sideways_bb_std_mult': 2.53394127952135, 'sideways_rsi_os': 8, 'sideways_rsi_ob': 81, 'sideways_adx_thresh': 8.307881401842074, 'sideways_atr_min_pct': 0.028193026180127295, 'sideways_atr_max_pct': 0.04074953066148708, 'sideways_tp_mult': 2.468509990599181, 'sideways_tsl_mult': 0.23657609927544748, 'sideways_time_stop': 121, 'sideways_use_sma': True, 'sideways_use_ema': False, 'sideways_use_atr': True, 'sideways_use_adx': True, 'sideways_use_spike': False, 'sideways_rsi_required': False}.
[I 2025-08-30 14:25:27,172] Trial 43 finished with values: [-1000000000.0, 1000000000.0] and parameters: {'p_sma': 59, 'p_std': 17, 'p_atr': 22, 'p_adx': 11, 'rsi_period': 66, 'ema1': 7, 'ema2': 50, 'slip_atr_k': 0.1884544091972093, 'slip_spread_k': 0.5283034904105158, 'spread_hl_frac': 0.01596348514953623, 'bb_std_mult': 1.4534690180386995, 'rsi_os': 31, 'rsi_ob': 45, 'vol_spike': 0.14898682341605285, 'adx_thresh': 34.826560014394246, 'atr_min_pct': 0.0013865607217934375, 'atr_max_pct': 0.14889929362231363, 'tp_mult': 1.594382863702891, 'tsl_mult': 0.5962893510431972, 'strategy': 'mean_reversion', 'time_stop': 292, 'use_sma': False, 'use_atr': True, 'use_adx': True, 'use_ema': False, 'use_spike': True, 'rsi_required': False, 'edge_k': 1.2740562497815011, 'edge_cap': 0.18819006585666165, 'bull_strategy': 'breakout', 'bull_bb_std_mult': 3.053823077303636, 'bull_rsi_os': 41, 'bull_rsi_ob': 67, 'bull_adx_thresh': 25.850101195524786, 'bull_atr_min_pct': 0.0020946878138567377, 'bull_atr_max_pct': 0.07784595313258627, 'bull_tp_mult': 1.136097192470377, 'bull_tsl_mult': 0.7561813309236546, 'bull_time_stop': 170, 'bull_use_sma': False, 'bull_use_ema': True, 'bull_use_atr': False, 'bull_use_adx': True, 'bull_use_spike': True, 'bull_rsi_required': False, 'bear_strategy': 'mean_reversion', 'bear_bb_std_mult': 1.9994124240405098, 'bear_rsi_os': 22, 'bear_rsi_ob': 92, 'bear_adx_thresh': 32.96269395736014, 'bear_atr_min_pct': 0.028469375312567463, 'bear_atr_max_pct': 0.025687148919630753, 'bear_tp_mult': 2.675086081950745, 'bear_tsl_mult': 0.2788982323468317, 'bear_time_stop': 153, 'bear_use_sma': False, 'bear_use_ema': False, 'bear_use_atr': True, 'bear_use_adx': True, 'bear_use_spike': True, 'bear_rsi_required': True, 'sideways_strategy': 'mean_reversion', 'sideways_bb_std_mult': 3.3861685792602425, 'sideways_rsi_os': 27, 'sideways_rsi_ob': 55, 'sideways_adx_thresh': 26.63053014249702, 'sideways_atr_min_pct': 0.01884315787425217, 'sideways_atr_max_pct': 0.020759618792934233, 'sideways_tp_mult': 1.9089453830895726, 'sideways_tsl_mult': 0.34404553035150504, 'sideways_time_stop': 43, 'sideways_use_sma': False, 'sideways_use_ema': True, 'sideways_use_atr': False, 'sideways_use_adx': False, 'sideways_use_spike': True, 'sideways_rsi_required': True}.
[I 2025-08-30 14:25:57,186] Trial 40 finished with values: [-1000000000.0, 1000000000.0] and parameters: {'p_sma': 60, 'p_std': 8, 'p_atr': 17, 'p_adx': 11, 'rsi_period': 22, 'ema1': 19, 'ema2': 37, 'slip_atr_k': 0.18916274911955194, 'slip_spread_k': 0.8542978320459871, 'spread_hl_frac': 0.02770827271508649, 'bb_std_mult': 3.3265497077511292, 'rsi_os': 32, 'rsi_ob': 45, 'vol_spike': 0.2078343975457072, 'adx_thresh': 32.85188586296332, 'atr_min_pct': 0.0019036312139906718, 'atr_max_pct': 0.08020797682447858, 'tp_mult': 2.744253011780582, 'tsl_mult': 0.31864752953729525, 'strategy': 'breakout', 'time_stop': 109, 'use_sma': False, 'use_atr': False, 'use_adx': False, 'use_ema': False, 'use_spike': True, 'rsi_required': False, 'edge_k': 0.6073118007547702, 'edge_cap': 0.20838669065209608, 'bull_strategy': 'mean_reversion', 'bull_bb_std_mult': 0.5076761968172974, 'bull_rsi_os': 5, 'bull_rsi_ob': 73, 'bull_adx_thresh': 25.460908625600965, 'bull_atr_min_pct': 0.008519304602058186, 'bull_atr_max_pct': 0.04459282943556697, 'bull_tp_mult': 2.0518167369711464, 'bull_tsl_mult': 0.5137383473787409, 'bull_time_stop': 82, 'bull_use_sma': True, 'bull_use_ema': False, 'bull_use_atr': False, 'bull_use_adx': False, 'bull_use_spike': True, 'bull_rsi_required': True, 'bear_strategy': 'breakout', 'bear_bb_std_mult': 1.0376953629867693, 'bear_rsi_os': 12, 'bear_rsi_ob': 92, 'bear_adx_thresh': 23.440727273578, 'bear_atr_min_pct': 0.027880086238230496, 'bear_atr_max_pct': 0.02760105752602745, 'bear_tp_mult': 1.625821677731744, 'bear_tsl_mult': 0.7556163204430345, 'bear_time_stop': 201, 'bear_use_sma': True, 'bear_use_ema': True, 'bear_use_atr': False, 'bear_use_adx': False, 'bear_use_spike': True, 'bear_rsi_required': True, 'sideways_strategy': 'breakout', 'sideways_bb_std_mult': 2.6070873861469703, 'sideways_rsi_os': 12, 'sideways_rsi_ob': 45, 'sideways_adx_thresh': 24.170731549626627, 'sideways_atr_min_pct': 0.019904629034591614, 'sideways_atr_max_pct': 0.02201841099428573, 'sideways_tp_mult': 1.9256340343867477, 'sideways_tsl_mult': 0.08014657813349192, 'sideways_time_stop': 50, 'sideways_use_sma': True, 'sideways_use_ema': False, 'sideways_use_atr': True, 'sideways_use_adx': False, 'sideways_use_spike': False, 'sideways_rsi_required': True}.
[I 2025-08-30 14:25:57,505] Trial 41 finished with values: [-1000000000.0, 1000000000.0] and parameters: {'p_sma': 12, 'p_std': 8, 'p_atr': 22, 'p_adx': 11, 'rsi_period': 26, 'ema1': 7, 'ema2': 38, 'slip_atr_k': 0.18805602636325136, 'slip_spread_k': 0.9176080701745981, 'spread_hl_frac': 0.01549263811516064, 'bb_std_mult': 1.4583522539108147, 'rsi_os': 43, 'rsi_ob': 76, 'vol_spike': 0.14860862051500254, 'adx_thresh': 34.923827299441236, 'atr_min_pct': 0.004938062045163895, 'atr_max_pct': 0.07754210761400218, 'tp_mult': 1.9979649274935087, 'tsl_mult': 0.6026496847678992, 'strategy': 'breakout', 'time_stop': 86, 'use_sma': False, 'use_atr': True, 'use_adx': True, 'use_ema': False, 'use_spike': True, 'rsi_required': False, 'edge_k': 1.270497318092807, 'edge_cap': 0.2320149172606771, 'bull_strategy': 'mean_reversion', 'bull_bb_std_mult': 1.1871764925331332, 'bull_rsi_os': 54, 'bull_rsi_ob': 67, 'bull_adx_thresh': 26.133451808723045, 'bull_atr_min_pct': 0.00871044918146856, 'bull_atr_max_pct': 0.0472981606191101, 'bull_tp_mult': 2.121795039885042, 'bull_tsl_mult': 0.7610788098272762, 'bull_time_stop': 160, 'bull_use_sma': False, 'bull_use_ema': False, 'bull_use_atr': False, 'bull_use_adx': False, 'bull_use_spike': True, 'bull_rsi_required': False, 'bear_strategy': 'breakout', 'bear_bb_std_mult': 1.0568044394759841, 'bear_rsi_os': 22, 'bear_rsi_ob': 93, 'bear_adx_thresh': 32.98255726327933, 'bear_atr_min_pct': 0.02882200079286632, 'bear_atr_max_pct': 0.026344382449328616, 'bear_tp_mult': 1.0200147721341088, 'bear_tsl_mult': 0.5024763806490687, 'bear_time_stop': 295, 'bear_use_sma': False, 'bear_use_ema': True, 'bear_use_atr': False, 'bear_use_adx': False, 'bear_use_spike': True, 'bear_rsi_required': True, 'sideways_strategy': 'mean_reversion', 'sideways_bb_std_mult': 2.7318774227301033, 'sideways_rsi_os': 27, 'sideways_rsi_ob': 51, 'sideways_adx_thresh': 24.783478197793084, 'sideways_atr_min_pct': 0.018359222770430537, 'sideways_atr_max_pct': 0.022203041268934562, 'sideways_tp_mult': 1.8997449418531427, 'sideways_tsl_mult': 0.34503647617126704, 'sideways_time_stop': 58, 'sideways_use_sma': False, 'sideways_use_ema': False, 'sideways_use_atr': False, 'sideways_use_adx': False, 'sideways_use_spike': False, 'sideways_rsi_required': True}.
[I 2025-08-30 14:25:57,874] Trial 42 finished with values: [-0.02051863965280154, 0.020561373207106874] and parameters: {'p_sma': 32, 'p_std': 17, 'p_atr': 22, 'p_adx': 11, 'rsi_period': 46, 'ema1': 6, 'ema2': 52, 'slip_atr_k': 0.1937526953355535, 'slip_spread_k': 0.5381695497083571, 'spread_hl_frac': 0.04903572004091349, 'bb_std_mult': 1.442856795663323, 'rsi_os': 33, 'rsi_ob': 59, 'vol_spike': 0.10026156628149564, 'adx_thresh': 34.961673440541276, 'atr_min_pct': 0.0013910420959845572, 'atr_max_pct': 0.07969891560763362, 'tp_mult': 1.5169131762766677, 'tsl_mult': 0.6520079274861119, 'strategy': 'mean_reversion', 'time_stop': 224, 'use_sma': False, 'use_atr': True, 'use_adx': True, 'use_ema': False, 'use_spike': True, 'rsi_required': False, 'edge_k': 1.2067656847920318, 'edge_cap': 0.20207123264637417, 'bull_strategy': 'breakout', 'bull_bb_std_mult': 2.977579603889427, 'bull_rsi_os': 55, 'bull_rsi_ob': 70, 'bull_adx_thresh': 26.196671029690464, 'bull_atr_min_pct': 0.002070909916007929, 'bull_atr_max_pct': 0.04622999027183141, 'bull_tp_mult': 1.1358577052393142, 'bull_tsl_mult': 0.7612383117388755, 'bull_time_stop': 54, 'bull_use_sma': False, 'bull_use_ema': False, 'bull_use_atr': False, 'bull_use_adx': True, 'bull_use_spike': True, 'bull_rsi_required': False, 'bear_strategy': 'mean_reversion', 'bear_bb_std_mult': 1.9828864473590742, 'bear_rsi_os': 22, 'bear_rsi_ob': 92, 'bear_adx_thresh': 33.46946920931665, 'bear_atr_min_pct': 0.028757254714269063, 'bear_atr_max_pct': 0.026491079580340873, 'bear_tp_mult': 1.0572968552724396, 'bear_tsl_mult': 0.26422667951924994, 'bear_time_stop': 197, 'bear_use_sma': True, 'bear_use_ema': True, 'bear_use_atr': False, 'bear_use_adx': False, 'bear_use_spike': True, 'bear_rsi_required': True, 'sideways_strategy': 'mean_reversion', 'sideways_bb_std_mult': 3.427910197854352, 'sideways_rsi_os': 13, 'sideways_rsi_ob': 45, 'sideways_adx_thresh': 30.112536705636664, 'sideways_atr_min_pct': 0.00021683911103534577, 'sideways_atr_max_pct': 0.024309811518346748, 'sideways_tp_mult': 2.0035038017782463, 'sideways_tsl_mult': 0.34176274581048627, 'sideways_time_stop': 58, 'sideways_use_sma': False, 'sideways_use_ema': False, 'sideways_use_atr': False, 'sideways_use_adx': False, 'sideways_use_spike': True, 'sideways_rsi_required': True}.
[I 2025-08-30 14:25:58,411] Trial 44 finished with values: [-0.019224498931892375, 0.019188388571950755] and parameters: {'p_sma': 34, 'p_std': 7, 'p_atr': 18, 'p_adx': 7, 'rsi_period': 46, 'ema1': 18, 'ema2': 38, 'slip_atr_k': 0.001975772977055132, 'slip_spread_k': 0.9896448890190608, 'spread_hl_frac': 0.011985429882142155, 'bb_std_mult': 0.7182050982446523, 'rsi_os': 10, 'rsi_ob': 77, 'vol_spike': 0.18671200868037635, 'adx_thresh': 34.754866791912, 'atr_min_pct': 0.0043939465776386966, 'atr_max_pct': 0.010217044253883745, 'tp_mult': 2.442838436619831, 'tsl_mult': 0.7185612542026809, 'strategy': 'breakout', 'time_stop': 22, 'use_sma': False, 'use_atr': False, 'use_adx': True, 'use_ema': True, 'use_spike': True, 'rsi_required': False, 'edge_k': 0.23665035488868402, 'edge_cap': 0.3421847058200455, 'bull_strategy': 'mean_reversion', 'bull_bb_std_mult': 0.8993110179183499, 'bull_rsi_os': 26, 'bull_rsi_ob': 81, 'bull_adx_thresh': 30.354075304104327, 'bull_atr_min_pct': 0.0009216901625285041, 'bull_atr_max_pct': 0.01971654400570602, 'bull_tp_mult': 1.119346312445039, 'bull_tsl_mult': 0.7685405434514672, 'bull_time_stop': 18, 'bull_use_sma': False, 'bull_use_ema': False, 'bull_use_atr': False, 'bull_use_adx': False, 'bull_use_spike': True, 'bull_rsi_required': False, 'bear_strategy': 'breakout', 'bear_bb_std_mult': 1.4537878819828765, 'bear_rsi_os': 18, 'bear_rsi_ob': 45, 'bear_adx_thresh': 8.706067766893858, 'bear_atr_min_pct': 0.010405280283759085, 'bear_atr_max_pct': 0.13548879785397003, 'bear_tp_mult': 1.750514837930664, 'bear_tsl_mult': 0.6930091791264007, 'bear_time_stop': 188, 'bear_use_sma': True, 'bear_use_ema': True, 'bear_use_atr': False, 'bear_use_adx': False, 'bear_use_spike': True, 'bear_rsi_required': True, 'sideways_strategy': 'breakout', 'sideways_bb_std_mult': 3.5119523971506794, 'sideways_rsi_os': 5, 'sideways_rsi_ob': 49, 'sideways_adx_thresh': 29.924000592201658, 'sideways_atr_min_pct': 0.029695409152386876, 'sideways_atr_max_pct': 0.01040373515186602, 'sideways_tp_mult': 2.868149646610749, 'sideways_tsl_mult': 0.08243907657819095, 'sideways_time_stop': 211, 'sideways_use_sma': True, 'sideways_use_ema': True, 'sideways_use_atr': False, 'sideways_use_adx': False, 'sideways_use_spike': False, 'sideways_rsi_required': True}.
