[I 2025-08-30 16:18:52,585] Trial 718 finished with values: [-1000000000.0, 1000000000.0] and parameters: {'p_sma': 49, 'p_std': 57, 'p_atr': 28, 'p_adx': 15, 'rsi_period': 22, 'ema1': 15, 'ema2': 31, 'slip_atr_k': 0.0076682086714153, 'slip_spread_k': 0.4395604056903847, 'spread_hl_frac': 0.02686194396064874, 'bb_std_mult': 1.1745537243196713, 'rsi_os': 43, 'rsi_ob': 95, 'vol_spike': 0.22758054542592895, 'adx_thresh': 8.646441639836784, 'atr_min_pct': 0.006835244459021887, 'atr_max_pct': 0.04133683417035471, 'tp_mult': 1.4812527404557376, 'tsl_mult': 0.0167136566937226, 'strategy': 'breakout', 'time_stop': 101, 'use_sma': True, 'use_atr': False, 'use_adx': True, 'use_ema': False, 'use_spike': False, 'rsi_required': True, 'edge_k': 0.4365339992241077, 'edge_cap': 0.6787608087160745, 'bull_strategy': 'breakout', 'bull_bb_std_mult': 2.0794845041608783, 'bull_rsi_os': 8, 'bull_rsi_ob': 91, 'bull_adx_thresh': 5.089265294762534, 'bull_atr_min_pct': 0.012271653519249935, 'bull_atr_max_pct': 0.11643794211558804, 'bull_tp_mult': 2.533127582736175, 'bull_tsl_mult': 0.9077721176595058, 'bull_time_stop': 160, 'bull_use_sma': True, 'bull_use_ema': True, 'bull_use_atr': True, 'bull_use_adx': True, 'bull_use_spike': True, 'bull_rsi_required': False, 'bear_strategy': 'mean_reversion', 'bear_bb_std_mult': 0.8696047794722594, 'bear_rsi_os': 22, 'bear_rsi_ob': 76, 'bear_adx_thresh': 16.047120599403524, 'bear_atr_min_pct': 0.001978500003768852, 'bear_atr_max_pct': 0.11827095705876917, 'bear_tp_mult': 2.5984862617202804, 'bear_tsl_mult': 0.4452904292943058, 'bear_time_stop': 95, 'bear_use_sma': True, 'bear_use_ema': False, 'bear_use_atr': True, 'bear_use_adx': True, 'bear_use_spike': True, 'bear_rsi_required': False, 'sideways_strategy': 'mean_reversion', 'sideways_bb_std_mult': 2.299611848113961, 'sideways_rsi_os': 15, 'sideways_rsi_ob': 76, 'sideways_adx_thresh': 9.956618907310224, 'sideways_atr_min_pct': 0.018843252841243857, 'sideways_atr_max_pct': 0.13837286868924742, 'sideways_tp_mult': 1.6692271522430921, 'sideways_tsl_mult': 0.254031767136608, 'sideways_time_stop': 182, 'sideways_use_sma': True, 'sideways_use_ema': False, 'sideways_use_atr': True, 'sideways_use_adx': True, 'sideways_use_spike': True, 'sideways_rsi_required': True}.
[I 2025-08-30 16:18:52,829] Trial 720 finished with values: [-1000000000.0, 1000000000.0] and parameters: {'p_sma': 59, 'p_std': 40, 'p_atr': 10, 'p_adx': 24, 'rsi_period': 32, 'ema1': 22, 'ema2': 54, 'slip_atr_k': 0.0040594822350433785, 'slip_spread_k': 0.6358658683044993, 'spread_hl_frac': 0.007869259148550559, 'bb_std_mult': 0.5522502874572455, 'rsi_os': 28, 'rsi_ob': 87, 'vol_spike': 0.0817900028169348, 'adx_thresh': 33.4266599061354, 'atr_min_pct': 0.02502384344548687, 'atr_max_pct': 0.1164713871213385, 'tp_mult': 1.4889953136483656, 'tsl_mult': 0.35154539566672394, 'strategy': 'breakout', 'time_stop': 153, 'use_sma': False, 'use_atr': False, 'use_adx': True, 'use_ema': False, 'use_spike': False, 'rsi_required': True, 'edge_k': 1.7365140650855206, 'edge_cap': 0.6364192524505319, 'bull_strategy': 'breakout', 'bull_bb_std_mult': 1.3592160186578357, 'bull_rsi_os': 8, 'bull_rsi_ob': 84, 'bull_adx_thresh': 10.120663395085606, 'bull_atr_min_pct': 0.019163367820363986, 'bull_atr_max_pct': 0.13536395530728856, 'bull_tp_mult': 2.921140600312421, 'bull_tsl_mult': 0.905082121358536, 'bull_time_stop': 57, 'bull_use_sma': True, 'bull_use_ema': True, 'bull_use_atr': True, 'bull_use_adx': True, 'bull_use_spike': True, 'bull_rsi_required': False, 'bear_strategy': 'mean_reversion', 'bear_bb_std_mult': 2.1647671050195703, 'bear_rsi_os': 6, 'bear_rsi_ob': 54, 'bear_adx_thresh': 16.23681607563021, 'bear_atr_min_pct': 0.004099736060930354, 'bear_atr_max_pct': 0.11071478062228472, 'bear_tp_mult': 2.7120985941788427, 'bear_tsl_mult': 0.8319265320013429, 'bear_time_stop': 120, 'bear_use_sma': True, 'bear_use_ema': False, 'bear_use_atr': True, 'bear_use_adx': True, 'bear_use_spike': True, 'bear_rsi_required': False, 'sideways_strategy': 'mean_reversion', 'sideways_bb_std_mult': 3.1527061019555482, 'sideways_rsi_os': 8, 'sideways_rsi_ob': 76, 'sideways_adx_thresh': 33.07606561882797, 'sideways_atr_min_pct': 0.018768761723184944, 'sideways_atr_max_pct': 0.07229320007318382, 'sideways_tp_mult': 1.1600750612155175, 'sideways_tsl_mult': 0.25323528311237975, 'sideways_time_stop': 215, 'sideways_use_sma': True, 'sideways_use_ema': False, 'sideways_use_atr': True, 'sideways_use_adx': True, 'sideways_use_spike': True, 'sideways_rsi_required': True}.
[I 2025-08-30 16:19:38,807] Trial 722 finished with values: [-1000000000.0, 1000000000.0] and parameters: {'p_sma': 6, 'p_std': 21, 'p_atr': 28, 'p_adx': 24, 'rsi_period': 22, 'ema1': 23, 'ema2': 37, 'slip_atr_k': 0.12415198292158564, 'slip_spread_k': 0.20443746889448905, 'spread_hl_frac': 0.009713917068856028, 'bb_std_mult': 0.7453713069779049, 'rsi_os': 30, 'rsi_ob': 95, 'vol_spike': 0.22827472753540484, 'adx_thresh': 27.243101069750377, 'atr_min_pct': 0.024952299035228803, 'atr_max_pct': 0.07833661928418652, 'tp_mult': 1.488836341698196, 'tsl_mult': 0.02016035971482416, 'strategy': 'breakout', 'time_stop': 163, 'use_sma': False, 'use_atr': False, 'use_adx': True, 'use_ema': True, 'use_spike': False, 'rsi_required': False, 'edge_k': 0.552402353299032, 'edge_cap': 0.937128664537521, 'bull_strategy': 'mean_reversion', 'bull_bb_std_mult': 1.9828322181225768, 'bull_rsi_os': 8, 'bull_rsi_ob': 88, 'bull_adx_thresh': 9.43412641515254, 'bull_atr_min_pct': 0.020721454691657305, 'bull_atr_max_pct': 0.05708301132772009, 'bull_tp_mult': 2.4424023615613044, 'bull_tsl_mult': 0.8867191907780229, 'bull_time_stop': 106, 'bull_use_sma': True, 'bull_use_ema': True, 'bull_use_atr': False, 'bull_use_adx': True, 'bull_use_spike': False, 'bull_rsi_required': True, 'bear_strategy': 'breakout', 'bear_bb_std_mult': 2.2529998759071437, 'bear_rsi_os': 39, 'bear_rsi_ob': 74, 'bear_adx_thresh': 9.42008645158894, 'bear_atr_min_pct': 0.024560233762820082, 'bear_atr_max_pct': 0.10318311443274789, 'bear_tp_mult': 1.1980375585038923, 'bear_tsl_mult': 0.8301176297960629, 'bear_time_stop': 119, 'bear_use_sma': True, 'bear_use_ema': False, 'bear_use_atr': True, 'bear_use_adx': True, 'bear_use_spike': True, 'bear_rsi_required': True, 'sideways_strategy': 'breakout', 'sideways_bb_std_mult': 3.149820939164248, 'sideways_rsi_os': 7, 'sideways_rsi_ob': 91, 'sideways_adx_thresh': 11.97886176497954, 'sideways_atr_min_pct': 0.018866883164078307, 'sideways_atr_max_pct': 0.06775823496211633, 'sideways_tp_mult': 1.1509626368667862, 'sideways_tsl_mult': 0.2536330124060522, 'sideways_time_stop': 120, 'sideways_use_sma': False, 'sideways_use_ema': True, 'sideways_use_atr': True, 'sideways_use_adx': True, 'sideways_use_spike': True, 'sideways_rsi_required': True}.
[I 2025-08-30 16:19:40,333] Trial 723 finished with values: [-1000000000.0, 1000000000.0] and parameters: {'p_sma': 6, 'p_std': 21, 'p_atr': 15, 'p_adx': 24, 'rsi_period': 77, 'ema1': 23, 'ema2': 37, 'slip_atr_k': 0.24163304779864136, 'slip_spread_k': 0.7445705857158864, 'spread_hl_frac': 0.009387179010669136, 'bb_std_mult': 0.7297038717081171, 'rsi_os': 53, 'rsi_ob': 90, 'vol_spike': 0.2288288708528876, 'adx_thresh': 8.074255343703372, 'atr_min_pct': 0.007885921530498578, 'atr_max_pct': 0.06702780422246878, 'tp_mult': 1.4769970932821281, 'tsl_mult': 0.026992519798047676, 'strategy': 'breakout', 'time_stop': 129, 'use_sma': False, 'use_atr': False, 'use_adx': True, 'use_ema': True, 'use_spike': False, 'rsi_required': False, 'edge_k': 1.6767943913890133, 'edge_cap': 0.9351058278374192, 'bull_strategy': 'mean_reversion', 'bull_bb_std_mult': 3.3947104789448583, 'bull_rsi_os': 7, 'bull_rsi_ob': 78, 'bull_adx_thresh': 10.958055938555505, 'bull_atr_min_pct': 0.013846765516622738, 'bull_atr_max_pct': 0.09860054647728914, 'bull_tp_mult': 2.9181865280922015, 'bull_tsl_mult': 0.8221426319607934, 'bull_time_stop': 68, 'bull_use_sma': True, 'bull_use_ema': True, 'bull_use_atr': False, 'bull_use_adx': True, 'bull_use_spike': False, 'bull_rsi_required': True, 'bear_strategy': 'breakout', 'bear_bb_std_mult': 2.8241582370174307, 'bear_rsi_os': 39, 'bear_rsi_ob': 74, 'bear_adx_thresh': 9.488904789289155, 'bear_atr_min_pct': 0.0027813765378999844, 'bear_atr_max_pct': 0.10239038862164779, 'bear_tp_mult': 2.699786038940169, 'bear_tsl_mult': 0.8256563635943331, 'bear_time_stop': 218, 'bear_use_sma': True, 'bear_use_ema': False, 'bear_use_atr': True, 'bear_use_adx': True, 'bear_use_spike': True, 'bear_rsi_required': True, 'sideways_strategy': 'breakout', 'sideways_bb_std_mult': 2.330989869052903, 'sideways_rsi_os': 8, 'sideways_rsi_ob': 91, 'sideways_adx_thresh': 10.099474100984056, 'sideways_atr_min_pct': 0.01915805927829409, 'sideways_atr_max_pct': 0.06766267185133126, 'sideways_tp_mult': 1.1552289599770031, 'sideways_tsl_mult': 0.3511064593602877, 'sideways_time_stop': 121, 'sideways_use_sma': False, 'sideways_use_ema': True, 'sideways_use_atr': True, 'sideways_use_adx': True, 'sideways_use_spike': True, 'sideways_rsi_required': True}.
[I 2025-08-30 16:19:41,113] Trial 724 finished with values: [-1000000000.0, 1000000000.0] and parameters: {'p_sma': 51, 'p_std': 21, 'p_atr': 11, 'p_adx': 14, 'rsi_period': 45, 'ema1': 26, 'ema2': 37, 'slip_atr_k': 0.00011025460574853169, 'slip_spread_k': 0.7546187014770627, 'spread_hl_frac': 0.014709916139152358, 'bb_std_mult': 0.7631322848857638, 'rsi_os': 50, 'rsi_ob': 52, 'vol_spike': 0.05165965923448414, 'adx_thresh': 33.26546126312668, 'atr_min_pct': 0.006009815208075217, 'atr_max_pct': 0.06211274462353747, 'tp_mult': 1.5952673632950682, 'tsl_mult': 0.35931526205053016, 'strategy': 'breakout', 'time_stop': 130, 'use_sma': False, 'use_atr': False, 'use_adx': True, 'use_ema': True, 'use_spike': False, 'rsi_required': False, 'edge_k': 0.9967646630797857, 'edge_cap': 0.4005980594912676, 'bull_strategy': 'mean_reversion', 'bull_bb_std_mult': 1.6212642326073958, 'bull_rsi_os': 32, 'bull_rsi_ob': 88, 'bull_adx_thresh': 11.150283304516275, 'bull_atr_min_pct': 0.027359280808919275, 'bull_atr_max_pct': 0.045960812800121674, 'bull_tp_mult': 2.425260913238883, 'bull_tsl_mult': 0.8326808173208183, 'bull_time_stop': 53, 'bull_use_sma': True, 'bull_use_ema': False, 'bull_use_atr': False, 'bull_use_adx': True, 'bull_use_spike': False, 'bull_rsi_required': True, 'bear_strategy': 'breakout', 'bear_bb_std_mult': 2.910312115862912, 'bear_rsi_os': 6, 'bear_rsi_ob': 74, 'bear_adx_thresh': 9.325659243800136, 'bear_atr_min_pct': 0.0027670350211732543, 'bear_atr_max_pct': 0.04554022394387241, 'bear_tp_mult': 1.8707103675077346, 'bear_tsl_mult': 0.8225807554474197, 'bear_time_stop': 83, 'bear_use_sma': True, 'bear_use_ema': True, 'bear_use_atr': True, 'bear_use_adx': False, 'bear_use_spike': True, 'bear_rsi_required': True, 'sideways_strategy': 'breakout', 'sideways_bb_std_mult': 3.246122064728468, 'sideways_rsi_os': 48, 'sideways_rsi_ob': 93, 'sideways_adx_thresh': 11.871107292666295, 'sideways_atr_min_pct': 0.005965467020531946, 'sideways_atr_max_pct': 0.06697642965080668, 'sideways_tp_mult': 1.5099987840454248, 'sideways_tsl_mult': 0.4426662463325534, 'sideways_time_stop': 120, 'sideways_use_sma': False, 'sideways_use_ema': True, 'sideways_use_atr': False, 'sideways_use_adx': True, 'sideways_use_spike': True, 'sideways_rsi_required': True}.
[I 2025-08-30 16:19:41,127] Trial 725 finished with values: [-1000000000.0, 1000000000.0] and parameters: {'p_sma': 6, 'p_std': 18, 'p_atr': 11, 'p_adx': 14, 'rsi_period': 77, 'ema1': 23, 'ema2': 37, 'slip_atr_k': 0.2422568780345901, 'slip_spread_k': 0.2068374720455618, 'spread_hl_frac': 0.009209851821682826, 'bb_std_mult': 0.7551064494478262, 'rsi_os': 27, 'rsi_ob': 90, 'vol_spike': 0.21691776228940401, 'adx_thresh': 9.778657091731027, 'atr_min_pct': 0.006089017924222303, 'atr_max_pct': 0.06806223124098769, 'tp_mult': 1.5959756265184886, 'tsl_mult': 0.3681229403826046, 'strategy': 'mean_reversion', 'time_stop': 139, 'use_sma': False, 'use_atr': False, 'use_adx': True, 'use_ema': True, 'use_spike': False, 'rsi_required': False, 'edge_k': 0.5463786771284396, 'edge_cap': 0.9366991931978251, 'bull_strategy': 'mean_reversion', 'bull_bb_std_mult': 1.9477525492386085, 'bull_rsi_os': 37, 'bull_rsi_ob': 82, 'bull_adx_thresh': 11.193944007508243, 'bull_atr_min_pct': 0.020846417956474114, 'bull_atr_max_pct': 0.0564826584488922, 'bull_tp_mult': 2.4453798209446167, 'bull_tsl_mult': 0.8226870466910727, 'bull_time_stop': 67, 'bull_use_sma': False, 'bull_use_ema': False, 'bull_use_atr': False, 'bull_use_adx': True, 'bull_use_spike': False, 'bull_rsi_required': True, 'bear_strategy': 'breakout', 'bear_bb_std_mult': 2.8286865223048583, 'bear_rsi_os': 26, 'bear_rsi_ob': 74, 'bear_adx_thresh': 15.11920748065787, 'bear_atr_min_pct': 0.002858123673287886, 'bear_atr_max_pct': 0.11402593167932865, 'bear_tp_mult': 1.3567231817387349, 'bear_tsl_mult': 0.868581685752392, 'bear_time_stop': 21, 'bear_use_sma': False, 'bear_use_ema': True, 'bear_use_atr': True, 'bear_use_adx': False, 'bear_use_spike': True, 'bear_rsi_required': True, 'sideways_strategy': 'breakout', 'sideways_bb_std_mult': 3.057666971029112, 'sideways_rsi_os': 27, 'sideways_rsi_ob': 89, 'sideways_adx_thresh': 11.963906052214195, 'sideways_atr_min_pct': 0.018101604035051774, 'sideways_atr_max_pct': 0.0666340580816938, 'sideways_tp_mult': 1.4315114984642385, 'sideways_tsl_mult': 0.42281324226298506, 'sideways_time_stop': 121, 'sideways_use_sma': False, 'sideways_use_ema': True, 'sideways_use_atr': False, 'sideways_use_adx': True, 'sideways_use_spike': True, 'sideways_rsi_required': False}.
[I 2025-08-30 16:20:24,418] Trial 728 finished with values: [-1000000000.0, 1000000000.0] and parameters: {'p_sma': 10, 'p_std': 17, 'p_atr': 23, 'p_adx': 25, 'rsi_period': 58, 'ema1': 28, 'ema2': 39, 'slip_atr_k': 0.10755974012959839, 'slip_spread_k': 0.715766049474158, 'spread_hl_frac': 0.00611008668346663, 'bb_std_mult': 2.1938224916731506, 'rsi_os': 27, 'rsi_ob': 89, 'vol_spike': 0.0361169463425066, 'adx_thresh': 28.01324970068248, 'atr_min_pct': 0.005387770024643219, 'atr_max_pct': 0.12122247728012586, 'tp_mult': 1.6750309746029186, 'tsl_mult': 0.29975793331817313, 'strategy': 'mean_reversion', 'time_stop': 139, 'use_sma': True, 'use_atr': False, 'use_adx': True, 'use_ema': False, 'use_spike': False, 'rsi_required': False, 'edge_k': 0.651394251746605, 'edge_cap': 0.9574917232577711, 'bull_strategy': 'breakout', 'bull_bb_std_mult': 1.4764811004813725, 'bull_rsi_os': 49, 'bull_rsi_ob': 89, 'bull_adx_thresh': 19.87441042580588, 'bull_atr_min_pct': 0.02012493974535625, 'bull_atr_max_pct': 0.10031063075518559, 'bull_tp_mult': 1.7615335999141386, 'bull_tsl_mult': 0.873029118302272, 'bull_time_stop': 223, 'bull_use_sma': False, 'bull_use_ema': False, 'bull_use_atr': True, 'bull_use_adx': False, 'bull_use_spike': True, 'bull_rsi_required': False, 'bear_strategy': 'mean_reversion', 'bear_bb_std_mult': 1.5298869498558858, 'bear_rsi_os': 23, 'bear_rsi_ob': 72, 'bear_adx_thresh': 15.255598836643195, 'bear_atr_min_pct': 0.009219917721691506, 'bear_atr_max_pct': 0.11508083599165067, 'bear_tp_mult': 1.5170698361000148, 'bear_tsl_mult': 0.8659804207860891, 'bear_time_stop': 105, 'bear_use_sma': False, 'bear_use_ema': True, 'bear_use_atr': True, 'bear_use_adx': False, 'bear_use_spike': False, 'bear_rsi_required': True, 'sideways_strategy': 'mean_reversion', 'sideways_bb_std_mult': 3.0678869396274786, 'sideways_rsi_os': 50, 'sideways_rsi_ob': 81, 'sideways_adx_thresh': 10.81033327769197, 'sideways_atr_min_pct': 0.017862298593849205, 'sideways_atr_max_pct': 0.07509717241583348, 'sideways_tp_mult': 1.291484736492214, 'sideways_tsl_mult': 0.8815866789740185, 'sideways_time_stop': 291, 'sideways_use_sma': True, 'sideways_use_ema': False, 'sideways_use_atr': False, 'sideways_use_adx': True, 'sideways_use_spike': False, 'sideways_rsi_required': False}.
[I 2025-08-30 16:20:24,972] Trial 726 finished with values: [-1000000000.0, 1000000000.0] and parameters: {'p_sma': 9, 'p_std': 18, 'p_atr': 11, 'p_adx': 25, 'rsi_period': 77, 'ema1': 26, 'ema2': 20, 'slip_atr_k': 0.244264198274449, 'slip_spread_k': 0.7674621238723154, 'spread_hl_frac': 0.006349910238252008, 'bb_std_mult': 0.7027424974261232, 'rsi_os': 15, 'rsi_ob': 89, 'vol_spike': 0.21667186203648336, 'adx_thresh': 7.85948704257331, 'atr_min_pct': 0.007868013503374306, 'atr_max_pct': 0.061653341072015026, 'tp_mult': 1.6830598762756455, 'tsl_mult': 0.36776672631354645, 'strategy': 'mean_reversion', 'time_stop': 139, 'use_sma': False, 'use_atr': False, 'use_adx': True, 'use_ema': True, 'use_spike': False, 'rsi_required': False, 'edge_k': 0.9914699716416546, 'edge_cap': 0.9627817330146367, 'bull_strategy': 'mean_reversion', 'bull_bb_std_mult': 1.459274014803541, 'bull_rsi_os': 37, 'bull_rsi_ob': 89, 'bull_adx_thresh': 10.842699533808586, 'bull_atr_min_pct': 0.017547257177389204, 'bull_atr_max_pct': 0.09827041178053185, 'bull_tp_mult': 2.626811946625984, 'bull_tsl_mult': 0.8272364878553151, 'bull_time_stop': 225, 'bull_use_sma': False, 'bull_use_ema': False, 'bull_use_atr': False, 'bull_use_adx': False, 'bull_use_spike': False, 'bull_rsi_required': False, 'bear_strategy': 'breakout', 'bear_bb_std_mult': 2.8102870084816773, 'bear_rsi_os': 8, 'bear_rsi_ob': 75, 'bear_adx_thresh': 15.085674869961036, 'bear_atr_min_pct': 0.008851222566882554, 'bear_atr_max_pct': 0.11587920385319128, 'bear_tp_mult': 2.6631370810870703, 'bear_tsl_mult': 0.8680017427081289, 'bear_time_stop': 58, 'bear_use_sma': False, 'bear_use_ema': True, 'bear_use_atr': True, 'bear_use_adx': False, 'bear_use_spike': False, 'bear_rsi_required': True, 'sideways_strategy': 'mean_reversion', 'sideways_bb_std_mult': 3.2552111286408327, 'sideways_rsi_os': 17, 'sideways_rsi_ob': 78, 'sideways_adx_thresh': 10.932230846435589, 'sideways_atr_min_pct': 0.017841259784147738, 'sideways_atr_max_pct': 0.06687396367551823, 'sideways_tp_mult': 1.4327099601176687, 'sideways_tsl_mult': 0.4213025665915189, 'sideways_time_stop': 117, 'sideways_use_sma': True, 'sideways_use_ema': False, 'sideways_use_atr': False, 'sideways_use_adx': True, 'sideways_use_spike': False, 'sideways_rsi_required': False}.
[I 2025-08-30 16:20:24,998] Trial 727 finished with values: [-1000000000.0, 1000000000.0] and parameters: {'p_sma': 9, 'p_std': 17, 'p_atr': 11, 'p_adx': 25, 'rsi_period': 9, 'ema1': 26, 'ema2': 39, 'slip_atr_k': 0.10855383502500422, 'slip_spread_k': 0.7235090104096683, 'spread_hl_frac': 0.005998026689763953, 'bb_std_mult': 1.7631019953014262, 'rsi_os': 27, 'rsi_ob': 89, 'vol_spike': 0.014409364160022697, 'adx_thresh': 9.803358531498574, 'atr_min_pct': 0.0062632055244250424, 'atr_max_pct': 0.03444443505765239, 'tp_mult': 2.7504189488292736, 'tsl_mult': 0.2919063843895337, 'strategy': 'mean_reversion', 'time_stop': 204, 'use_sma': False, 'use_atr': False, 'use_adx': True, 'use_ema': False, 'use_spike': False, 'rsi_required': False, 'edge_k': 0.7355681317605849, 'edge_cap': 0.9618755704678852, 'bull_strategy': 'breakout', 'bull_bb_std_mult': 1.5146611200797466, 'bull_rsi_os': 5, 'bull_rsi_ob': 89, 'bull_adx_thresh': 11.100514360357872, 'bull_atr_min_pct': 0.017512370658262857, 'bull_atr_max_pct': 0.10991431932620502, 'bull_tp_mult': 2.5327449821221464, 'bull_tsl_mult': 0.9364557437053272, 'bull_time_stop': 81, 'bull_use_sma': False, 'bull_use_ema': False, 'bull_use_atr': True, 'bull_use_adx': False, 'bull_use_spike': True, 'bull_rsi_required': False, 'bear_strategy': 'mean_reversion', 'bear_bb_std_mult': 1.5346509785397202, 'bear_rsi_os': 24, 'bear_rsi_ob': 46, 'bear_adx_thresh': 15.07656115335841, 'bear_atr_min_pct': 0.008793718027350718, 'bear_atr_max_pct': 0.1155187149165429, 'bear_tp_mult': 2.1785276060825027, 'bear_tsl_mult': 0.873437789138317, 'bear_time_stop': 60, 'bear_use_sma': False, 'bear_use_ema': True, 'bear_use_atr': True, 'bear_use_adx': False, 'bear_use_spike': False, 'bear_rsi_required': True, 'sideways_strategy': 'mean_reversion', 'sideways_bb_std_mult': 3.5055793360155785, 'sideways_rsi_os': 27, 'sideways_rsi_ob': 60, 'sideways_adx_thresh': 10.79742636264525, 'sideways_atr_min_pct': 0.006003473021694867, 'sideways_atr_max_pct': 0.14994045349943863, 'sideways_tp_mult': 1.4295430585463358, 'sideways_tsl_mult': 0.4568814793222525, 'sideways_time_stop': 130, 'sideways_use_sma': True, 'sideways_use_ema': False, 'sideways_use_atr': False, 'sideways_use_adx': True, 'sideways_use_spike': False, 'sideways_rsi_required': False}.
