[I 2025-08-30 15:03:27,497] Trial 342 finished with values: [-1000000000.0, 1000000000.0] and parameters: {'p_sma': 7, 'p_std': 33, 'p_atr': 30, 'p_adx': 30, 'rsi_period': 40, 'ema1': 10, 'ema2': 51, 'slip_atr_k': 0.21174335630870497, 'slip_spread_k': 0.2961427583312015, 'spread_hl_frac': 0.01660985097366033, 'bb_std_mult': 2.8724672780195197, 'rsi_os': 53, 'rsi_ob': 94, 'vol_spike': 0.2693785655141364, 'adx_thresh': 5.196870638004542, 'atr_min_pct': 0.019588417973023926, 'atr_max_pct': 0.10562683134327458, 'tp_mult': 2.920743324408692, 'tsl_mult': 0.4507175664729475, 'strategy': 'breakout', 'time_stop': 118, 'use_sma': False, 'use_atr': False, 'use_adx': True, 'use_ema': False, 'use_spike': False, 'rsi_required': False, 'edge_k': 0.23768456898486706, 'edge_cap': 0.8174737387828356, 'bull_strategy': 'breakout', 'bull_bb_std_mult': 2.336252521651399, 'bull_rsi_os': 53, 'bull_rsi_ob': 75, 'bull_adx_thresh': 32.0008666854169, 'bull_atr_min_pct': 0.02989231233929815, 'bull_atr_max_pct': 0.09469704569087947, 'bull_tp_mult': 1.108655137573819, 'bull_tsl_mult': 0.6342575296849275, 'bull_time_stop': 40, 'bull_use_sma': True, 'bull_use_ema': True, 'bull_use_atr': True, 'bull_use_adx': False, 'bull_use_spike': True, 'bull_rsi_required': False, 'bear_strategy': 'mean_reversion', 'bear_bb_std_mult': 3.164996785562736, 'bear_rsi_os': 23, 'bear_rsi_ob': 83, 'bear_adx_thresh': 6.00072136674305, 'bear_atr_min_pct': 0.005071720234157327, 'bear_atr_max_pct': 0.02908959144525854, 'bear_tp_mult': 1.4994353683420147, 'bear_tsl_mult': 0.6710642488663265, 'bear_time_stop': 252, 'bear_use_sma': True, 'bear_use_ema': False, 'bear_use_atr': True, 'bear_use_adx': True, 'bear_use_spike': True, 'bear_rsi_required': True, 'sideways_strategy': 'mean_reversion', 'sideways_bb_std_mult': 3.006627061740881, 'sideways_rsi_os': 35, 'sideways_rsi_ob': 78, 'sideways_adx_thresh': 17.229816441662646, 'sideways_atr_min_pct': 0.02321485026672423, 'sideways_atr_max_pct': 0.12243485209988617, 'sideways_tp_mult': 2.3765734069356026, 'sideways_tsl_mult': 0.4225279659859319, 'sideways_time_stop': 62, 'sideways_use_sma': True, 'sideways_use_ema': False, 'sideways_use_atr': True, 'sideways_use_adx': True, 'sideways_use_spike': True, 'sideways_rsi_required': True}.
[I 2025-08-30 15:03:27,620] Trial 344 finished with values: [-1000000000.0, 1000000000.0] and parameters: {'p_sma': 39, 'p_std': 40, 'p_atr': 17, 'p_adx': 30, 'rsi_period': 54, 'ema1': 6, 'ema2': 51, 'slip_atr_k': 0.23163649498921451, 'slip_spread_k': 0.7979358862619539, 'spread_hl_frac': 0.015451039911037218, 'bb_std_mult': 2.8788384503675055, 'rsi_os': 6, 'rsi_ob': 90, 'vol_spike': 0.23667527112110973, 'adx_thresh': 13.071548945463249, 'atr_min_pct': 0.010233150142786564, 'atr_max_pct': 0.10040219533963642, 'tp_mult': 2.439785292897625, 'tsl_mult': 0.9763919091014774, 'strategy': 'breakout', 'time_stop': 140, 'use_sma': False, 'use_atr': False, 'use_adx': True, 'use_ema': False, 'use_spike': False, 'rsi_required': False, 'edge_k': 1.5938117533247804, 'edge_cap': 0.8240942471494409, 'bull_strategy': 'breakout', 'bull_bb_std_mult': 1.4735926878649772, 'bull_rsi_os': 7, 'bull_rsi_ob': 75, 'bull_adx_thresh': 33.73117547181193, 'bull_atr_min_pct': 0.00011509299155329703, 'bull_atr_max_pct': 0.09136364650138822, 'bull_tp_mult': 1.0693668455292153, 'bull_tsl_mult': 0.040245710121594336, 'bull_time_stop': 140, 'bull_use_sma': True, 'bull_use_ema': True, 'bull_use_atr': True, 'bull_use_adx': False, 'bull_use_spike': True, 'bull_rsi_required': False, 'bear_strategy': 'mean_reversion', 'bear_bb_std_mult': 1.5196313066518956, 'bear_rsi_os': 23, 'bear_rsi_ob': 75, 'bear_adx_thresh': 16.091352242567524, 'bear_atr_min_pct': 0.02758057508170052, 'bear_atr_max_pct': 0.07585942969670181, 'bear_tp_mult': 2.9543577222490125, 'bear_tsl_mult': 0.1513175414556427, 'bear_time_stop': 252, 'bear_use_sma': True, 'bear_use_ema': False, 'bear_use_atr': True, 'bear_use_adx': True, 'bear_use_spike': True, 'bear_rsi_required': True, 'sideways_strategy': 'mean_reversion', 'sideways_bb_std_mult': 1.1747553512444802, 'sideways_rsi_os': 35, 'sideways_rsi_ob': 55, 'sideways_adx_thresh': 32.040324095295205, 'sideways_atr_min_pct': 0.008269105629876223, 'sideways_atr_max_pct': 0.08966833260911633, 'sideways_tp_mult': 2.3857330465559268, 'sideways_tsl_mult': 0.5908097800356219, 'sideways_time_stop': 94, 'sideways_use_sma': True, 'sideways_use_ema': False, 'sideways_use_atr': True, 'sideways_use_adx': True, 'sideways_use_spike': True, 'sideways_rsi_required': True}.
[I 2025-08-30 15:03:27,774] Trial 341 finished with values: [-0.005924333894785194, 0.006566193783689248] and parameters: {'p_sma': 41, 'p_std': 40, 'p_atr': 30, 'p_adx': 30, 'rsi_period': 56, 'ema1': 21, 'ema2': 51, 'slip_atr_k': 0.00011595228972759164, 'slip_spread_k': 0.2714082162233602, 'spread_hl_frac': 0.0031296057150299404, 'bb_std_mult': 2.9674480731240838, 'rsi_os': 7, 'rsi_ob': 89, 'vol_spike': 0.2443779984099852, 'adx_thresh': 12.05665956090648, 'atr_min_pct': 0.005563987321827677, 'atr_max_pct': 0.10460842885668334, 'tp_mult': 2.6714506286723845, 'tsl_mult': 0.3241373512694102, 'strategy': 'breakout', 'time_stop': 120, 'use_sma': False, 'use_atr': False, 'use_adx': True, 'use_ema': False, 'use_spike': False, 'rsi_required': False, 'edge_k': 1.1880915397645104, 'edge_cap': 0.7323666757738709, 'bull_strategy': 'breakout', 'bull_bb_std_mult': 2.3502873040912147, 'bull_rsi_os': 54, 'bull_rsi_ob': 60, 'bull_adx_thresh': 32.12830097591506, 'bull_atr_min_pct': 2.2230047807349804e-06, 'bull_atr_max_pct': 0.12674226940472366, 'bull_tp_mult': 1.1141441284650058, 'bull_tsl_mult': 0.6319355744001256, 'bull_time_stop': 139, 'bull_use_sma': True, 'bull_use_ema': True, 'bull_use_atr': True, 'bull_use_adx': False, 'bull_use_spike': True, 'bull_rsi_required': False, 'bear_strategy': 'mean_reversion', 'bear_bb_std_mult': 3.1786164091386317, 'bear_rsi_os': 23, 'bear_rsi_ob': 83, 'bear_adx_thresh': 16.454275719006613, 'bear_atr_min_pct': 0.0008808547220133019, 'bear_atr_max_pct': 0.07558917336842251, 'bear_tp_mult': 1.0841598936541046, 'bear_tsl_mult': 0.43544550205477445, 'bear_time_stop': 63, 'bear_use_sma': True, 'bear_use_ema': False, 'bear_use_atr': True, 'bear_use_adx': True, 'bear_use_spike': True, 'bear_rsi_required': True, 'sideways_strategy': 'mean_reversion', 'sideways_bb_std_mult': 1.0571098990591687, 'sideways_rsi_os': 54, 'sideways_rsi_ob': 57, 'sideways_adx_thresh': 17.186377350825403, 'sideways_atr_min_pct': 0.0035650920181452724, 'sideways_atr_max_pct': 0.08945157239256692, 'sideways_tp_mult': 2.387849663641235, 'sideways_tsl_mult': 0.960187694915579, 'sideways_time_stop': 249, 'sideways_use_sma': True, 'sideways_use_ema': False, 'sideways_use_atr': True, 'sideways_use_adx': True, 'sideways_use_spike': True, 'sideways_rsi_required': True}.
[I 2025-08-30 15:04:00,828] Trial 348 finished with values: [-1000000000.0, 1000000000.0] and parameters: {'p_sma': 16, 'p_std': 22, 'p_atr': 17, 'p_adx': 30, 'rsi_period': 83, 'ema1': 7, 'ema2': 12, 'slip_atr_k': 0.23917269308298555, 'slip_spread_k': 0.26640434029484367, 'spread_hl_frac': 0.0008617954900048685, 'bb_std_mult': 2.7433909349995647, 'rsi_os': 8, 'rsi_ob': 90, 'vol_spike': 0.2435748699142194, 'adx_thresh': 11.006598431622253, 'atr_min_pct': 0.026220261400484873, 'atr_max_pct': 0.09983091602644335, 'tp_mult': 1.3991063242353186, 'tsl_mult': 0.26397866238367845, 'strategy': 'breakout', 'time_stop': 39, 'use_sma': False, 'use_atr': False, 'use_adx': True, 'use_ema': False, 'use_spike': False, 'rsi_required': False, 'edge_k': 0.17694737556090415, 'edge_cap': 0.7339661565796411, 'bull_strategy': 'breakout', 'bull_bb_std_mult': 2.4325850765244788, 'bull_rsi_os': 30, 'bull_rsi_ob': 64, 'bull_adx_thresh': 33.70282607258632, 'bull_atr_min_pct': 0.0005733989971379758, 'bull_atr_max_pct': 0.09000398960322406, 'bull_tp_mult': 1.846970935615556, 'bull_tsl_mult': 0.1800503247537203, 'bull_time_stop': 204, 'bull_use_sma': True, 'bull_use_ema': True, 'bull_use_atr': True, 'bull_use_adx': False, 'bull_use_spike': True, 'bull_rsi_required': False, 'bear_strategy': 'mean_reversion', 'bear_bb_std_mult': 2.6001132041942614, 'bear_rsi_os': 49, 'bear_rsi_ob': 78, 'bear_adx_thresh': 19.069652759676966, 'bear_atr_min_pct': 0.025481782937962362, 'bear_atr_max_pct': 0.019355092200777968, 'bear_tp_mult': 2.9102312414486784, 'bear_tsl_mult': 0.39817808324651427, 'bear_time_stop': 60, 'bear_use_sma': True, 'bear_use_ema': False, 'bear_use_atr': True, 'bear_use_adx': True, 'bear_use_spike': True, 'bear_rsi_required': True, 'sideways_strategy': 'mean_reversion', 'sideways_bb_std_mult': 1.2250958822520899, 'sideways_rsi_os': 17, 'sideways_rsi_ob': 86, 'sideways_adx_thresh': 19.45182903312004, 'sideways_atr_min_pct': 0.023994364170533213, 'sideways_atr_max_pct': 0.11427911301408392, 'sideways_tp_mult': 1.3128956727925565, 'sideways_tsl_mult': 0.9763660764294149, 'sideways_time_stop': 293, 'sideways_use_sma': True, 'sideways_use_ema': False, 'sideways_use_atr': True, 'sideways_use_adx': True, 'sideways_use_spike': True, 'sideways_rsi_required': True}.
[I 2025-08-30 15:04:01,117] Trial 345 finished with values: [-1000000000.0, 1000000000.0] and parameters: {'p_sma': 41, 'p_std': 40, 'p_atr': 17, 'p_adx': 30, 'rsi_period': 56, 'ema1': 11, 'ema2': 51, 'slip_atr_k': 0.022912514555878352, 'slip_spread_k': 0.7944275337273647, 'spread_hl_frac': 0.014747045105253324, 'bb_std_mult': 2.870804431582244, 'rsi_os': 7, 'rsi_ob': 90, 'vol_spike': 0.24184017474027453, 'adx_thresh': 10.895973797353582, 'atr_min_pct': 0.004010696611656775, 'atr_max_pct': 0.10021944816357727, 'tp_mult': 1.5641647515732422, 'tsl_mult': 0.44267345759243676, 'strategy': 'breakout', 'time_stop': 80, 'use_sma': False, 'use_atr': False, 'use_adx': True, 'use_ema': False, 'use_spike': False, 'rsi_required': False, 'edge_k': 1.592151245897163, 'edge_cap': 0.8238680867037678, 'bull_strategy': 'breakout', 'bull_bb_std_mult': 2.6045555999959356, 'bull_rsi_os': 7, 'bull_rsi_ob': 75, 'bull_adx_thresh': 33.78807077222603, 'bull_atr_min_pct': 0.00019852089486788836, 'bull_atr_max_pct': 0.09108826870077276, 'bull_tp_mult': 1.0610461123073245, 'bull_tsl_mult': 0.516764859733312, 'bull_time_stop': 38, 'bull_use_sma': True, 'bull_use_ema': True, 'bull_use_atr': True, 'bull_use_adx': False, 'bull_use_spike': True, 'bull_rsi_required': False, 'bear_strategy': 'mean_reversion', 'bear_bb_std_mult': 2.0672543733836686, 'bear_rsi_os': 23, 'bear_rsi_ob': 78, 'bear_adx_thresh': 18.729533606433993, 'bear_atr_min_pct': 0.001163093937717144, 'bear_atr_max_pct': 0.028013702750201888, 'bear_tp_mult': 2.9506563005706523, 'bear_tsl_mult': 0.395301671787993, 'bear_time_stop': 218, 'bear_use_sma': True, 'bear_use_ema': False, 'bear_use_atr': True, 'bear_use_adx': True, 'bear_use_spike': True, 'bear_rsi_required': True, 'sideways_strategy': 'mean_reversion', 'sideways_bb_std_mult': 1.1973103514932184, 'sideways_rsi_os': 38, 'sideways_rsi_ob': 55, 'sideways_adx_thresh': 17.422889532051776, 'sideways_atr_min_pct': 0.009440645755679853, 'sideways_atr_max_pct': 0.038612523526089536, 'sideways_tp_mult': 1.3133966021161947, 'sideways_tsl_mult': 0.4262818047560435, 'sideways_time_stop': 78, 'sideways_use_sma': True, 'sideways_use_ema': False, 'sideways_use_atr': True, 'sideways_use_adx': True, 'sideways_use_spike': True, 'sideways_rsi_required': True}.
[I 2025-08-30 15:04:01,235] Trial 347 finished with values: [-0.01102583725445494, 0.011091633360520263] and parameters: {'p_sma': 41, 'p_std': 54, 'p_atr': 17, 'p_adx': 30, 'rsi_period': 72, 'ema1': 11, 'ema2': 12, 'slip_atr_k': 0.024739052178864625, 'slip_spread_k': 0.2717557343359921, 'spread_hl_frac': 0.03284411895659625, 'bb_std_mult': 3.0325410487148736, 'rsi_os': 8, 'rsi_ob': 90, 'vol_spike': 0.24320586069150754, 'adx_thresh': 10.848846234447642, 'atr_min_pct': 0.0041363667923200835, 'atr_max_pct': 0.0991637095199617, 'tp_mult': 1.882122169433928, 'tsl_mult': 0.35747256137711414, 'strategy': 'breakout', 'time_stop': 207, 'use_sma': False, 'use_atr': False, 'use_adx': True, 'use_ema': False, 'use_spike': False, 'rsi_required': False, 'edge_k': 0.16411493196935234, 'edge_cap': 0.7438964307997817, 'bull_strategy': 'breakout', 'bull_bb_std_mult': 2.6293980960109358, 'bull_rsi_os': 30, 'bull_rsi_ob': 94, 'bull_adx_thresh': 34.096422115215674, 'bull_atr_min_pct': 2.8346876444614586e-05, 'bull_atr_max_pct': 0.11974860805100974, 'bull_tp_mult': 2.763044559148032, 'bull_tsl_mult': 0.13348842131338529, 'bull_time_stop': 127, 'bull_use_sma': True, 'bull_use_ema': True, 'bull_use_atr': True, 'bull_use_adx': False, 'bull_use_spike': True, 'bull_rsi_required': False, 'bear_strategy': 'mean_reversion', 'bear_bb_std_mult': 1.7361318295521109, 'bear_rsi_os': 54, 'bear_rsi_ob': 78, 'bear_adx_thresh': 10.995071142242663, 'bear_atr_min_pct': 0.003912025521909236, 'bear_atr_max_pct': 0.019203316632256058, 'bear_tp_mult': 2.8966725512229523, 'bear_tsl_mult': 0.6488718655623666, 'bear_time_stop': 267, 'bear_use_sma': True, 'bear_use_ema': False, 'bear_use_atr': True, 'bear_use_adx': True, 'bear_use_spike': True, 'bear_rsi_required': True, 'sideways_strategy': 'mean_reversion', 'sideways_bb_std_mult': 1.224414301026329, 'sideways_rsi_os': 38, 'sideways_rsi_ob': 57, 'sideways_adx_thresh': 31.353144684365116, 'sideways_atr_min_pct': 0.025704123508137142, 'sideways_atr_max_pct': 0.11318672525055373, 'sideways_tp_mult': 1.3163058647446855, 'sideways_tsl_mult': 0.9605834143071461, 'sideways_time_stop': 80, 'sideways_use_sma': True, 'sideways_use_ema': False, 'sideways_use_atr': True, 'sideways_use_adx': True, 'sideways_use_spike': True, 'sideways_rsi_required': True}.
[I 2025-08-30 15:04:01,342] Trial 346 finished with values: [-1000000000.0, 1000000000.0] and parameters: {'p_sma': 41, 'p_std': 40, 'p_atr': 25, 'p_adx': 21, 'rsi_period': 83, 'ema1': 11, 'ema2': 50, 'slip_atr_k': 0.049419749631538404, 'slip_spread_k': 0.3006805401730209, 'spread_hl_frac': 8.631595527237791e-05, 'bb_std_mult': 3.0469232383993825, 'rsi_os': 28, 'rsi_ob': 90, 'vol_spike': 0.24172983901890316, 'adx_thresh': 13.058897197084846, 'atr_min_pct': 0.004105072763104242, 'atr_max_pct': 0.09993051572162558, 'tp_mult': 2.439568752140003, 'tsl_mult': 0.5068600282193357, 'strategy': 'breakout', 'time_stop': 268, 'use_sma': False, 'use_atr': False, 'use_adx': True, 'use_ema': False, 'use_spike': False, 'rsi_required': False, 'edge_k': 1.1740799044984433, 'edge_cap': 0.741513478712037, 'bull_strategy': 'breakout', 'bull_bb_std_mult': 2.4387762073384622, 'bull_rsi_os': 54, 'bull_rsi_ob': 94, 'bull_adx_thresh': 33.89155042486357, 'bull_atr_min_pct': 8.706047731124643e-06, 'bull_atr_max_pct': 0.09123186171665996, 'bull_tp_mult': 1.5114060540968215, 'bull_tsl_mult': 0.04132035578193616, 'bull_time_stop': 128, 'bull_use_sma': True, 'bull_use_ema': True, 'bull_use_atr': True, 'bull_use_adx': False, 'bull_use_spike': True, 'bull_rsi_required': False, 'bear_strategy': 'mean_reversion', 'bear_bb_std_mult': 2.582599152513791, 'bear_rsi_os': 23, 'bear_rsi_ob': 82, 'bear_adx_thresh': 16.186719150558876, 'bear_atr_min_pct': 0.025571460254595352, 'bear_atr_max_pct': 0.019940399279541665, 'bear_tp_mult': 2.951205222845494, 'bear_tsl_mult': 0.6242379372738909, 'bear_time_stop': 75, 'bear_use_sma': True, 'bear_use_ema': False, 'bear_use_atr': True, 'bear_use_adx': True, 'bear_use_spike': True, 'bear_rsi_required': True, 'sideways_strategy': 'mean_reversion', 'sideways_bb_std_mult': 1.2070907451363238, 'sideways_rsi_os': 38, 'sideways_rsi_ob': 95, 'sideways_adx_thresh': 13.113085194366729, 'sideways_atr_min_pct': 0.025740225729601572, 'sideways_atr_max_pct': 0.08991847206649148, 'sideways_tp_mult': 2.335522320040855, 'sideways_tsl_mult': 0.2636286496028494, 'sideways_time_stop': 278, 'sideways_use_sma': True, 'sideways_use_ema': False, 'sideways_use_atr': True, 'sideways_use_adx': True, 'sideways_use_spike': True, 'sideways_rsi_required': True}.
[I 2025-08-30 15:04:34,494] Trial 351 finished with values: [-1000000000.0, 1000000000.0] and parameters: {'p_sma': 22, 'p_std': 36, 'p_atr': 16, 'p_adx': 29, 'rsi_period': 50, 'ema1': 10, 'ema2': 22, 'slip_atr_k': 0.004992179563357527, 'slip_spread_k': 0.30456673334259443, 'spread_hl_frac': 0.02426125679496253, 'bb_std_mult': 3.052038125754216, 'rsi_os': 46, 'rsi_ob': 62, 'vol_spike': 0.23356071635620482, 'adx_thresh': 12.44909701936086, 'atr_min_pct': 0.013220150212237061, 'atr_max_pct': 0.14448714005887942, 'tp_mult': 2.5394716403469073, 'tsl_mult': 0.5079998052860153, 'strategy': 'breakout', 'time_stop': 271, 'use_sma': False, 'use_atr': False, 'use_adx': True, 'use_ema': False, 'use_spike': False, 'rsi_required': False, 'edge_k': 1.2019902342356996, 'edge_cap': 0.8067986111045772, 'bull_strategy': 'breakout', 'bull_bb_std_mult': 2.489245073791522, 'bull_rsi_os': 54, 'bull_rsi_ob': 60, 'bull_adx_thresh': 32.9695235354462, 'bull_atr_min_pct': 1.2211708761398511e-05, 'bull_atr_max_pct': 0.08418800610740766, 'bull_tp_mult': 1.0538384038889672, 'bull_tsl_mult': 0.1525098155062481, 'bull_time_stop': 259, 'bull_use_sma': True, 'bull_use_ema': True, 'bull_use_atr': True, 'bull_use_adx': False, 'bull_use_spike': True, 'bull_rsi_required': False, 'bear_strategy': 'mean_reversion', 'bear_bb_std_mult': 1.9401345357334585, 'bear_rsi_os': 26, 'bear_rsi_ob': 82, 'bear_adx_thresh': 20.91339611542326, 'bear_atr_min_pct': 0.01607056866856209, 'bear_atr_max_pct': 0.014268812396369129, 'bear_tp_mult': 2.574801821736437, 'bear_tsl_mult': 0.028587655950783053, 'bear_time_stop': 74, 'bear_use_sma': True, 'bear_use_ema': False, 'bear_use_atr': True, 'bear_use_adx': True, 'bear_use_spike': True, 'bear_rsi_required': True, 'sideways_strategy': 'mean_reversion', 'sideways_bb_std_mult': 1.4230022578956356, 'sideways_rsi_os': 25, 'sideways_rsi_ob': 59, 'sideways_adx_thresh': 33.124263249026576, 'sideways_atr_min_pct': 0.02332371524821196, 'sideways_atr_max_pct': 0.09846383031988588, 'sideways_tp_mult': 2.3355817821083624, 'sideways_tsl_mult': 0.6405654049370484, 'sideways_time_stop': 41, 'sideways_use_sma': True, 'sideways_use_ema': False, 'sideways_use_atr': True, 'sideways_use_adx': True, 'sideways_use_spike': True, 'sideways_rsi_required': True}.
[I 2025-08-30 15:04:34,878] Trial 352 finished with values: [-0.007520134144306523, 0.007569891937975169] and parameters: {'p_sma': 43, 'p_std': 36, 'p_atr': 16, 'p_adx': 28, 'rsi_period': 50, 'ema1': 20, 'ema2': 48, 'slip_atr_k': 0.004892173982069065, 'slip_spread_k': 0.8562218551857514, 'spread_hl_frac': 0.024504554095779278, 'bb_std_mult': 1.815787740171167, 'rsi_os': 7, 'rsi_ob': 45, 'vol_spike': 0.23243912346439044, 'adx_thresh': 12.354217310000209, 'atr_min_pct': 0.004690380804681879, 'atr_max_pct': 0.11122751114149425, 'tp_mult': 1.2613724814928964, 'tsl_mult': 0.4903162559380664, 'strategy': 'breakout', 'time_stop': 267, 'use_sma': False, 'use_atr': False, 'use_adx': True, 'use_ema': False, 'use_spike': False, 'rsi_required': False, 'edge_k': 0.39379914549689854, 'edge_cap': 0.8036820404702474, 'bull_strategy': 'breakout', 'bull_bb_std_mult': 2.226155491177072, 'bull_rsi_os': 53, 'bull_rsi_ob': 63, 'bull_adx_thresh': 32.8203427794086, 'bull_atr_min_pct': 0.0006776915794660977, 'bull_atr_max_pct': 0.08490686224175428, 'bull_tp_mult': 1.980788238756053, 'bull_tsl_mult': 0.7287093987709998, 'bull_time_stop': 64, 'bull_use_sma': True, 'bull_use_ema': True, 'bull_use_atr': True, 'bull_use_adx': False, 'bull_use_spike': True, 'bull_rsi_required': False, 'bear_strategy': 'mean_reversion', 'bear_bb_std_mult': 3.1863549060921588, 'bear_rsi_os': 26, 'bear_rsi_ob': 84, 'bear_adx_thresh': 17.003980118142003, 'bear_atr_min_pct': 0.0006083956963606908, 'bear_atr_max_pct': 0.08525484644024098, 'bear_tp_mult': 2.627343636716183, 'bear_tsl_mult': 0.18418014050510406, 'bear_time_stop': 227, 'bear_use_sma': True, 'bear_use_ema': False, 'bear_use_atr': True, 'bear_use_adx': True, 'bear_use_spike': True, 'bear_rsi_required': True, 'sideways_strategy': 'mean_reversion', 'sideways_bb_std_mult': 1.094278761320374, 'sideways_rsi_os': 37, 'sideways_rsi_ob': 81, 'sideways_adx_thresh': 33.09907349353826, 'sideways_atr_min_pct': 0.023277472568106555, 'sideways_atr_max_pct': 0.09802778127110119, 'sideways_tp_mult': 2.418719794814082, 'sideways_tsl_mult': 0.6919662046553603, 'sideways_time_stop': 92, 'sideways_use_sma': True, 'sideways_use_ema': False, 'sideways_use_atr': True, 'sideways_use_adx': True, 'sideways_use_spike': True, 'sideways_rsi_required': True}.
