[I 2025-08-30 14:30:44,287] Trial 83 finished with values: [-1000000000.0, 1000000000.0] and parameters: {'p_sma': 29, 'p_std': 9, 'p_atr': 17, 'p_adx': 8, 'rsi_period': 80, 'ema1': 28, 'ema2': 42, 'slip_atr_k': 0.09056065736676985, 'slip_spread_k': 0.9125272663476984, 'spread_hl_frac': 0.017801251892550246, 'bb_std_mult': 1.7168849798395729, 'rsi_os': 14, 'rsi_ob': 89, 'vol_spike': 0.19476619808639134, 'adx_thresh': 32.671909855073125, 'atr_min_pct': 0.002091684677666043, 'atr_max_pct': 0.025172455961578168, 'tp_mult': 2.9926666270966127, 'tsl_mult': 0.543165627479261, 'strategy': 'mean_reversion', 'time_stop': 262, 'use_sma': False, 'use_atr': True, 'use_adx': False, 'use_ema': True, 'use_spike': True, 'rsi_required': True, 'edge_k': 1.79249624005494, 'edge_cap': 0.4607053088957318, 'bull_strategy': 'mean_reversion', 'bull_bb_std_mult': 2.292145113310356, 'bull_rsi_os': 9, 'bull_rsi_ob': 95, 'bull_adx_thresh': 32.94914912110863, 'bull_atr_min_pct': 0.0032424340871372356, 'bull_atr_max_pct': 0.05369109459653307, 'bull_tp_mult': 2.488915350534234, 'bull_tsl_mult': 0.48503626776689357, 'bull_time_stop': 176, 'bull_use_sma': False, 'bull_use_ema': False, 'bull_use_atr': False, 'bull_use_adx': True, 'bull_use_spike': False, 'bull_rsi_required': False, 'bear_strategy': 'breakout', 'bear_bb_std_mult': 3.038548911137109, 'bear_rsi_os': 21, 'bear_rsi_ob': 91, 'bear_adx_thresh': 29.891066303593885, 'bear_atr_min_pct': 0.011847826743590622, 'bear_atr_max_pct': 0.020873732209743187, 'bear_tp_mult': 2.4838106991884876, 'bear_tsl_mult': 0.34401820013249435, 'bear_time_stop': 214, 'bear_use_sma': False, 'bear_use_ema': True, 'bear_use_atr': False, 'bear_use_adx': False, 'bear_use_spike': True, 'bear_rsi_required': True, 'sideways_strategy': 'mean_reversion', 'sideways_bb_std_mult': 1.4050481203819205, 'sideways_rsi_os': 45, 'sideways_rsi_ob': 76, 'sideways_adx_thresh': 5.047258315520969, 'sideways_atr_min_pct': 0.010938365152887913, 'sideways_atr_max_pct': 0.012751567482612108, 'sideways_tp_mult': 2.8127876550615576, 'sideways_tsl_mult': 0.00018211399151375068, 'sideways_time_stop': 161, 'sideways_use_sma': False, 'sideways_use_ema': True, 'sideways_use_atr': False, 'sideways_use_adx': False, 'sideways_use_spike': False, 'sideways_rsi_required': True}.
[I 2025-08-30 14:30:44,469] Trial 81 finished with values: [-1000000000.0, 1000000000.0] and parameters: {'p_sma': 9, 'p_std': 6, 'p_atr': 17, 'p_adx': 26, 'rsi_period': 68, 'ema1': 28, 'ema2': 40, 'slip_atr_k': 0.08898031757416947, 'slip_spread_k': 0.6586768495868522, 'spread_hl_frac': 0.016646875760910115, 'bb_std_mult': 2.1843498095302154, 'rsi_os': 5, 'rsi_ob': 65, 'vol_spike': 0.19468602906044158, 'adx_thresh': 20.65594705129214, 'atr_min_pct': 0.008304733860206567, 'atr_max_pct': 0.1487801838662754, 'tp_mult': 2.160493351598849, 'tsl_mult': 0.5595243254705264, 'strategy': 'mean_reversion', 'time_stop': 68, 'use_sma': False, 'use_atr': True, 'use_adx': False, 'use_ema': True, 'use_spike': False, 'rsi_required': True, 'edge_k': 1.996588774484641, 'edge_cap': 0.25468170291047865, 'bull_strategy': 'mean_reversion', 'bull_bb_std_mult': 0.7586591885915164, 'bull_rsi_os': 31, 'bull_rsi_ob': 60, 'bull_adx_thresh': 24.491487131014807, 'bull_atr_min_pct': 0.01603341726923092, 'bull_atr_max_pct': 0.0556198652616171, 'bull_tp_mult': 1.0474694233969697, 'bull_tsl_mult': 0.47022431945359594, 'bull_time_stop': 209, 'bull_use_sma': False, 'bull_use_ema': True, 'bull_use_atr': False, 'bull_use_adx': True, 'bull_use_spike': False, 'bull_rsi_required': False, 'bear_strategy': 'breakout', 'bear_bb_std_mult': 3.069203225253922, 'bear_rsi_os': 21, 'bear_rsi_ob': 91, 'bear_adx_thresh': 30.187166891906287, 'bear_atr_min_pct': 0.009528329238210983, 'bear_atr_max_pct': 0.14669612833612797, 'bear_tp_mult': 1.7022383926454703, 'bear_tsl_mult': 0.30971223583221663, 'bear_time_stop': 215, 'bear_use_sma': True, 'bear_use_ema': True, 'bear_use_atr': False, 'bear_use_adx': False, 'bear_use_spike': True, 'bear_rsi_required': False, 'sideways_strategy': 'breakout', 'sideways_bb_std_mult': 3.3459526673951334, 'sideways_rsi_os': 44, 'sideways_rsi_ob': 82, 'sideways_adx_thresh': 6.710006626981311, 'sideways_atr_min_pct': 0.012164272024370246, 'sideways_atr_max_pct': 0.12616829644175442, 'sideways_tp_mult': 2.8161094608187316, 'sideways_tsl_mult': 0.0018854359354609426, 'sideways_time_stop': 195, 'sideways_use_sma': False, 'sideways_use_ema': True, 'sideways_use_atr': False, 'sideways_use_adx': False, 'sideways_use_spike': False, 'sideways_rsi_required': False}.
[I 2025-08-30 14:30:44,676] Trial 82 finished with values: [-1000000000.0, 1000000000.0] and parameters: {'p_sma': 30, 'p_std': 6, 'p_atr': 12, 'p_adx': 17, 'rsi_period': 29, 'ema1': 29, 'ema2': 40, 'slip_atr_k': 0.07502269751854188, 'slip_spread_k': 0.6953730602586543, 'spread_hl_frac': 0.006152206365226225, 'bb_std_mult': 2.8612491445877364, 'rsi_os': 29, 'rsi_ob': 80, 'vol_spike': 0.194693497685532, 'adx_thresh': 19.710159857471123, 'atr_min_pct': 0.0018743069325398327, 'atr_max_pct': 0.08437371825796647, 'tp_mult': 2.353273406608164, 'tsl_mult': 0.2678950556956854, 'strategy': 'mean_reversion', 'time_stop': 262, 'use_sma': False, 'use_atr': True, 'use_adx': False, 'use_ema': True, 'use_spike': False, 'rsi_required': True, 'edge_k': 1.6051241111069352, 'edge_cap': 0.2550296658585235, 'bull_strategy': 'mean_reversion', 'bull_bb_std_mult': 2.3056603799287423, 'bull_rsi_os': 27, 'bull_rsi_ob': 95, 'bull_adx_thresh': 32.90790013863405, 'bull_atr_min_pct': 0.02283200307963127, 'bull_atr_max_pct': 0.05483267456017637, 'bull_tp_mult': 2.958344167485454, 'bull_tsl_mult': 0.4878532114653532, 'bull_time_stop': 207, 'bull_use_sma': False, 'bull_use_ema': False, 'bull_use_atr': False, 'bull_use_adx': True, 'bull_use_spike': False, 'bull_rsi_required': False, 'bear_strategy': 'breakout', 'bear_bb_std_mult': 3.0392923213502216, 'bear_rsi_os': 21, 'bear_rsi_ob': 91, 'bear_adx_thresh': 12.177996465999781, 'bear_atr_min_pct': 0.024221208492216206, 'bear_atr_max_pct': 0.14631647720256746, 'bear_tp_mult': 2.4648306816212733, 'bear_tsl_mult': 0.33172457246875214, 'bear_time_stop': 101, 'bear_use_sma': False, 'bear_use_ema': True, 'bear_use_atr': False, 'bear_use_adx': False, 'bear_use_spike': True, 'bear_rsi_required': True, 'sideways_strategy': 'breakout', 'sideways_bb_std_mult': 2.811810860604011, 'sideways_rsi_os': 32, 'sideways_rsi_ob': 83, 'sideways_adx_thresh': 5.029809155305807, 'sideways_atr_min_pct': 0.012057985868190749, 'sideways_atr_max_pct': 0.14967658178139548, 'sideways_tp_mult': 2.823568135809504, 'sideways_tsl_mult': 0.001389190856287352, 'sideways_time_stop': 195, 'sideways_use_sma': False, 'sideways_use_ema': True, 'sideways_use_atr': False, 'sideways_use_adx': False, 'sideways_use_spike': False, 'sideways_rsi_required': True}.
[I 2025-08-30 14:31:15,619] Trial 84 finished with values: [-0.032036870062001954, 0.031994290204353536] and parameters: {'p_sma': 30, 'p_std': 9, 'p_atr': 10, 'p_adx': 8, 'rsi_period': 73, 'ema1': 26, 'ema2': 39, 'slip_atr_k': 0.1744843028960899, 'slip_spread_k': 0.5989244328646017, 'spread_hl_frac': 0.01640523726176207, 'bb_std_mult': 0.6539445313432768, 'rsi_os': 16, 'rsi_ob': 80, 'vol_spike': 0.19629604207695345, 'adx_thresh': 19.484146621577995, 'atr_min_pct': 0.016012202595218454, 'atr_max_pct': 0.09522091912067418, 'tp_mult': 1.0190818338498908, 'tsl_mult': 0.0387457334946837, 'strategy': 'mean_reversion', 'time_stop': 265, 'use_sma': False, 'use_atr': False, 'use_adx': False, 'use_ema': True, 'use_spike': True, 'rsi_required': True, 'edge_k': 1.7739345426967121, 'edge_cap': 0.4714931318240145, 'bull_strategy': 'mean_reversion', 'bull_bb_std_mult': 2.127961102545041, 'bull_rsi_os': 27, 'bull_rsi_ob': 61, 'bull_adx_thresh': 32.79816247139439, 'bull_atr_min_pct': 3.947525122376637e-05, 'bull_atr_max_pct': 0.07307743006440608, 'bull_tp_mult': 1.044242445357078, 'bull_tsl_mult': 0.2633754963117748, 'bull_time_stop': 43, 'bull_use_sma': False, 'bull_use_ema': False, 'bull_use_atr': False, 'bull_use_adx': False, 'bull_use_spike': False, 'bull_rsi_required': False, 'bear_strategy': 'breakout', 'bear_bb_std_mult': 2.9673693154930083, 'bear_rsi_os': 25, 'bear_rsi_ob': 93, 'bear_adx_thresh': 18.537298474028148, 'bear_atr_min_pct': 0.008263246687702975, 'bear_atr_max_pct': 0.14958895049291984, 'bear_tp_mult': 1.8718822264587875, 'bear_tsl_mult': 0.3071582219470137, 'bear_time_stop': 94, 'bear_use_sma': False, 'bear_use_ema': True, 'bear_use_atr': False, 'bear_use_adx': False, 'bear_use_spike': True, 'bear_rsi_required': True, 'sideways_strategy': 'breakout', 'sideways_bb_std_mult': 3.182743003172898, 'sideways_rsi_os': 33, 'sideways_rsi_ob': 82, 'sideways_adx_thresh': 6.543934323459183, 'sideways_atr_min_pct': 0.009694902130620079, 'sideways_atr_max_pct': 0.012498784141044677, 'sideways_tp_mult': 2.9954848174522533, 'sideways_tsl_mult': 0.008859726511383136, 'sideways_time_stop': 193, 'sideways_use_sma': True, 'sideways_use_ema': True, 'sideways_use_atr': False, 'sideways_use_adx': False, 'sideways_use_spike': False, 'sideways_rsi_required': True}.
[I 2025-08-30 14:31:15,952] Trial 86 finished with values: [-1000000000.0, 1000000000.0] and parameters: {'p_sma': 31, 'p_std': 5, 'p_atr': 24, 'p_adx': 18, 'rsi_period': 73, 'ema1': 14, 'ema2': 37, 'slip_atr_k': 0.07426401919499817, 'slip_spread_k': 0.5007020219233607, 'spread_hl_frac': 0.022673472593799752, 'bb_std_mult': 0.6013424950641335, 'rsi_os': 13, 'rsi_ob': 80, 'vol_spike': 0.17379130988195834, 'adx_thresh': 17.60347629640438, 'atr_min_pct': 0.015658040586556607, 'atr_max_pct': 0.08655816072608509, 'tp_mult': 2.361426493140801, 'tsl_mult': 0.18998431944494953, 'strategy': 'breakout', 'time_stop': 128, 'use_sma': False, 'use_atr': False, 'use_adx': True, 'use_ema': True, 'use_spike': False, 'rsi_required': True, 'edge_k': 0.772277310171848, 'edge_cap': 0.5409839769402753, 'bull_strategy': 'breakout', 'bull_bb_std_mult': 3.4380201219162148, 'bull_rsi_os': 27, 'bull_rsi_ob': 84, 'bull_adx_thresh': 32.72452683775985, 'bull_atr_min_pct': 0.022446196892889514, 'bull_atr_max_pct': 0.017000375727064386, 'bull_tp_mult': 1.0140393900750233, 'bull_tsl_mult': 0.2579409133519245, 'bull_time_stop': 65, 'bull_use_sma': False, 'bull_use_ema': False, 'bull_use_atr': False, 'bull_use_adx': False, 'bull_use_spike': True, 'bull_rsi_required': False, 'bear_strategy': 'mean_reversion', 'bear_bb_std_mult': 3.336589681184963, 'bear_rsi_os': 24, 'bear_rsi_ob': 93, 'bear_adx_thresh': 5.116972041220164, 'bear_atr_min_pct': 0.023139506817003705, 'bear_atr_max_pct': 0.14096129289898754, 'bear_tp_mult': 2.6613580418628464, 'bear_tsl_mult': 0.8777539012304802, 'bear_time_stop': 231, 'bear_use_sma': True, 'bear_use_ema': True, 'bear_use_atr': True, 'bear_use_adx': False, 'bear_use_spike': True, 'bear_rsi_required': False, 'sideways_strategy': 'breakout', 'sideways_bb_std_mult': 3.1592490865053504, 'sideways_rsi_os': 39, 'sideways_rsi_ob': 87, 'sideways_adx_thresh': 28.207719620376196, 'sideways_atr_min_pct': 0.007015664215552903, 'sideways_atr_max_pct': 0.06215701946623339, 'sideways_tp_mult': 2.999859331063491, 'sideways_tsl_mult': 0.7863431104885155, 'sideways_time_stop': 11, 'sideways_use_sma': True, 'sideways_use_ema': True, 'sideways_use_atr': True, 'sideways_use_adx': False, 'sideways_use_spike': False, 'sideways_rsi_required': False}.
[I 2025-08-30 14:31:15,978] Trial 87 finished with values: [-0.02842711406992382, 0.028371719508804346] and parameters: {'p_sma': 56, 'p_std': 9, 'p_atr': 10, 'p_adx': 9, 'rsi_period': 51, 'ema1': 14, 'ema2': 37, 'slip_atr_k': 0.07295563281419812, 'slip_spread_k': 0.5953785873754612, 'spread_hl_frac': 0.015349164083796153, 'bb_std_mult': 0.6032039200221858, 'rsi_os': 16, 'rsi_ob': 81, 'vol_spike': 0.17128035860162935, 'adx_thresh': 17.88953204278861, 'atr_min_pct': 0.00017420114758701433, 'atr_max_pct': 0.014379062542128354, 'tp_mult': 2.5077935556424134, 'tsl_mult': 0.19519822298683576, 'strategy': 'breakout', 'time_stop': 5, 'use_sma': False, 'use_atr': False, 'use_adx': True, 'use_ema': True, 'use_spike': False, 'rsi_required': True, 'edge_k': 1.0046208087509774, 'edge_cap': 0.40759948734934576, 'bull_strategy': 'breakout', 'bull_bb_std_mult': 3.427512845734241, 'bull_rsi_os': 22, 'bull_rsi_ob': 84, 'bull_adx_thresh': 7.579812095995624, 'bull_atr_min_pct': 0.00027976553299856007, 'bull_atr_max_pct': 0.017426418156367654, 'bull_tp_mult': 1.1723318157409692, 'bull_tsl_mult': 0.5635388459318491, 'bull_time_stop': 61, 'bull_use_sma': False, 'bull_use_ema': True, 'bull_use_atr': False, 'bull_use_adx': False, 'bull_use_spike': True, 'bull_rsi_required': False, 'bear_strategy': 'mean_reversion', 'bear_bb_std_mult': 2.7824106988314714, 'bear_rsi_os': 17, 'bear_rsi_ob': 93, 'bear_adx_thresh': 18.830464703986898, 'bear_atr_min_pct': 0.008034032787119979, 'bear_atr_max_pct': 0.14196357576013305, 'bear_tp_mult': 1.584446944471698, 'bear_tsl_mult': 0.8922481930641374, 'bear_time_stop': 201, 'bear_use_sma': True, 'bear_use_ema': True, 'bear_use_atr': True, 'bear_use_adx': False, 'bear_use_spike': True, 'bear_rsi_required': False, 'sideways_strategy': 'breakout', 'sideways_bb_std_mult': 3.172508513630151, 'sideways_rsi_os': 14, 'sideways_rsi_ob': 80, 'sideways_adx_thresh': 6.266597400217116, 'sideways_atr_min_pct': 0.006553591508581031, 'sideways_atr_max_pct': 0.10229834094459818, 'sideways_tp_mult': 2.904710324469439, 'sideways_tsl_mult': 0.7682193046691805, 'sideways_time_stop': 205, 'sideways_use_sma': True, 'sideways_use_ema': True, 'sideways_use_atr': True, 'sideways_use_adx': False, 'sideways_use_spike': False, 'sideways_rsi_required': False}.
[I 2025-08-30 14:31:16,103] Trial 85 finished with values: [-0.018816434836462004, 0.018749472292933937] and parameters: {'p_sma': 22, 'p_std': 6, 'p_atr': 23, 'p_adx': 10, 'rsi_period': 51, 'ema1': 14, 'ema2': 39, 'slip_atr_k': 0.07295566004379009, 'slip_spread_k': 0.5939372350774477, 'spread_hl_frac': 0.022733725459590428, 'bb_std_mult': 0.5903467235709907, 'rsi_os': 17, 'rsi_ob': 81, 'vol_spike': 0.2156524905269736, 'adx_thresh': 33.12251239632802, 'atr_min_pct': 0.017903297925594013, 'atr_max_pct': 0.08534815156227958, 'tp_mult': 2.4945531908955516, 'tsl_mult': 0.18370910782103786, 'strategy': 'mean_reversion', 'time_stop': 35, 'use_sma': False, 'use_atr': False, 'use_adx': True, 'use_ema': True, 'use_spike': False, 'rsi_required': True, 'edge_k': 0.7737400555397553, 'edge_cap': 0.37116913390260625, 'bull_strategy': 'mean_reversion', 'bull_bb_std_mult': 2.127587214869087, 'bull_rsi_os': 28, 'bull_rsi_ob': 67, 'bull_adx_thresh': 32.725214381764204, 'bull_atr_min_pct': 3.895814626420904e-05, 'bull_atr_max_pct': 0.07272425540045571, 'bull_tp_mult': 1.0174150447707613, 'bull_tsl_mult': 0.22686650527050828, 'bull_time_stop': 44, 'bull_use_sma': False, 'bull_use_ema': True, 'bull_use_atr': False, 'bull_use_adx': False, 'bull_use_spike': False, 'bull_rsi_required': False, 'bear_strategy': 'breakout', 'bear_bb_std_mult': 1.5980522560377104, 'bear_rsi_os': 7, 'bear_rsi_ob': 93, 'bear_adx_thresh': 18.457667623677096, 'bear_atr_min_pct': 0.007542528526957287, 'bear_atr_max_pct': 0.04185713704792435, 'bear_tp_mult': 1.8865827227923693, 'bear_tsl_mult': 0.8867884827901931, 'bear_time_stop': 205, 'bear_use_sma': True, 'bear_use_ema': True, 'bear_use_atr': False, 'bear_use_adx': False, 'bear_use_spike': True, 'bear_rsi_required': False, 'sideways_strategy': 'breakout', 'sideways_bb_std_mult': 2.817249561951439, 'sideways_rsi_os': 33, 'sideways_rsi_ob': 86, 'sideways_adx_thresh': 6.61714663031446, 'sideways_atr_min_pct': 0.006428901136460373, 'sideways_atr_max_pct': 0.1196500448033184, 'sideways_tp_mult': 2.9930952759526748, 'sideways_tsl_mult': 0.7859024981864523, 'sideways_time_stop': 191, 'sideways_use_sma': True, 'sideways_use_ema': True, 'sideways_use_atr': True, 'sideways_use_adx': False, 'sideways_use_spike': False, 'sideways_rsi_required': False}.
[I 2025-08-30 14:31:47,865] Trial 91 finished with values: [-1000000000.0, 1000000000.0] and parameters: {'p_sma': 21, 'p_std': 40, 'p_atr': 21, 'p_adx': 21, 'rsi_period': 59, 'ema1': 12, 'ema2': 46, 'slip_atr_k': 0.05919615183219816, 'slip_spread_k': 0.08825054918787745, 'spread_hl_frac': 0.020659824686406487, 'bb_std_mult': 2.6930689041216356, 'rsi_os': 38, 'rsi_ob': 87, 'vol_spike': 0.2263994193819874, 'adx_thresh': 9.169847755582813, 'atr_min_pct': 0.010570945157110809, 'atr_max_pct': 0.02513588009030602, 'tp_mult': 2.0455956021775243, 'tsl_mult': 0.49202711305194574, 'strategy': 'breakout', 'time_stop': 231, 'use_sma': True, 'use_atr': False, 'use_adx': False, 'use_ema': False, 'use_spike': True, 'rsi_required': False, 'edge_k': 0.33576768113410704, 'edge_cap': 0.3085117205460781, 'bull_strategy': 'mean_reversion', 'bull_bb_std_mult': 0.5284254102778484, 'bull_rsi_os': 19, 'bull_rsi_ob': 87, 'bull_adx_thresh': 15.677987011207861, 'bull_atr_min_pct': 0.029965646115677397, 'bull_atr_max_pct': 0.029645360292664066, 'bull_tp_mult': 1.99356559178443, 'bull_tsl_mult': 0.9636583990777335, 'bull_time_stop': 261, 'bull_use_sma': True, 'bull_use_ema': True, 'bull_use_atr': False, 'bull_use_adx': False, 'bull_use_spike': False, 'bull_rsi_required': False, 'bear_strategy': 'breakout', 'bear_bb_std_mult': 2.282168796106772, 'bear_rsi_os': 35, 'bear_rsi_ob': 70, 'bear_adx_thresh': 34.96662563212507, 'bear_atr_min_pct': 0.0034273141085710964, 'bear_atr_max_pct': 0.07846116371652084, 'bear_tp_mult': 2.8839759197590817, 'bear_tsl_mult': 0.6311363487862344, 'bear_time_stop': 137, 'bear_use_sma': True, 'bear_use_ema': False, 'bear_use_atr': False, 'bear_use_adx': True, 'bear_use_spike': False, 'bear_rsi_required': False, 'sideways_strategy': 'mean_reversion', 'sideways_bb_std_mult': 0.5999238659085981, 'sideways_rsi_os': 9, 'sideways_rsi_ob': 85, 'sideways_adx_thresh': 9.798528524658195, 'sideways_atr_min_pct': 0.02983957582866937, 'sideways_atr_max_pct': 0.010096605665008886, 'sideways_tp_mult': 1.3175591855136912, 'sideways_tsl_mult': 0.06786998878066167, 'sideways_time_stop': 179, 'sideways_use_sma': True, 'sideways_use_ema': True, 'sideways_use_atr': True, 'sideways_use_adx': False, 'sideways_use_spike': True, 'sideways_rsi_required': False}.
[I 2025-08-30 14:31:48,312] Trial 90 finished with values: [-1000000000.0, 1000000000.0] and parameters: {'p_sma': 34, 'p_std': 44, 'p_atr': 21, 'p_adx': 21, 'rsi_period': 51, 'ema1': 10, 'ema2': 36, 'slip_atr_k': 0.059701814542289164, 'slip_spread_k': 0.08295284090749505, 'spread_hl_frac': 0.0011958360199984946, 'bb_std_mult': 2.75577402196552, 'rsi_os': 38, 'rsi_ob': 55, 'vol_spike': 0.21541753295671107, 'adx_thresh': 9.831021204995052, 'atr_min_pct': 0.010055777034687057, 'atr_max_pct': 0.1160364718514759, 'tp_mult': 2.0334933862430997, 'tsl_mult': 0.9972528748748497, 'strategy': 'breakout', 'time_stop': 42, 'use_sma': True, 'use_atr': False, 'use_adx': False, 'use_ema': False, 'use_spike': True, 'rsi_required': False, 'edge_k': 1.1766391400308072, 'edge_cap': 0.31258828674479816, 'bull_strategy': 'mean_reversion', 'bull_bb_std_mult': 0.5345434752941829, 'bull_rsi_os': 19, 'bull_rsi_ob': 69, 'bull_adx_thresh': 33.73241936251145, 'bull_atr_min_pct': 0.003308625962088623, 'bull_atr_max_pct': 0.030658337788965234, 'bull_tp_mult': 1.415662823716849, 'bull_tsl_mult': 0.9361312130581871, 'bull_time_stop': 273, 'bull_use_sma': True, 'bull_use_ema': True, 'bull_use_atr': False, 'bull_use_adx': False, 'bull_use_spike': False, 'bull_rsi_required': False, 'bear_strategy': 'breakout', 'bear_bb_std_mult': 1.7444071806695904, 'bear_rsi_os': 35, 'bear_rsi_ob': 95, 'bear_adx_thresh': 34.947275507576386, 'bear_atr_min_pct': 0.005421804865944043, 'bear_atr_max_pct': 0.07962869600683234, 'bear_tp_mult': 2.9079441800145363, 'bear_tsl_mult': 0.40715031869584, 'bear_time_stop': 22, 'bear_use_sma': True, 'bear_use_ema': False, 'bear_use_atr': False, 'bear_use_adx': True, 'bear_use_spike': True, 'bear_rsi_required': False, 'sideways_strategy': 'mean_reversion', 'sideways_bb_std_mult': 3.4351903305971248, 'sideways_rsi_os': 9, 'sideways_rsi_ob': 86, 'sideways_adx_thresh': 9.774375729165966, 'sideways_atr_min_pct': 0.029960646496354663, 'sideways_atr_max_pct': 0.028619821742205405, 'sideways_tp_mult': 1.3620182138451415, 'sideways_tsl_mult': 0.08495182621341957, 'sideways_time_stop': 134, 'sideways_use_sma': True, 'sideways_use_ema': True, 'sideways_use_atr': True, 'sideways_use_adx': False, 'sideways_use_spike': True, 'sideways_rsi_required': False}.
