[I 2025-08-30 15:16:29,590] Trial 413 finished with values: [-1000000000.0, 1000000000.0] and parameters: {'p_sma': 15, 'p_std': 24, 'p_atr': 11, 'p_adx': 26, 'rsi_period': 46, 'ema1': 21, 'ema2': 36, 'slip_atr_k': 0.005184565527848734, 'slip_spread_k': 0.7326596396522812, 'spread_hl_frac': 0.007322689113890346, 'bb_std_mult': 3.2522315244539026, 'rsi_os': 23, 'rsi_ob': 63, 'vol_spike': 0.20099004214044208, 'adx_thresh': 8.532700175380212, 'atr_min_pct': 0.009230575460777733, 'atr_max_pct': 0.11071376825515768, 'tp_mult': 1.586317824201639, 'tsl_mult': 0.7541497541698601, 'strategy': 'breakout', 'time_stop': 142, 'use_sma': False, 'use_atr': False, 'use_adx': True, 'use_ema': False, 'use_spike': False, 'rsi_required': False, 'edge_k': 0.5392702376108545, 'edge_cap': 0.9671502851563519, 'bull_strategy': 'breakout', 'bull_bb_std_mult': 1.760965930681589, 'bull_rsi_os': 37, 'bull_rsi_ob': 89, 'bull_adx_thresh': 11.184078861957447, 'bull_atr_min_pct': 0.014464630105499482, 'bull_atr_max_pct': 0.10935209597325815, 'bull_tp_mult': 2.586813890171858, 'bull_tsl_mult': 0.6186272107241826, 'bull_time_stop': 43, 'bull_use_sma': True, 'bull_use_ema': True, 'bull_use_atr': True, 'bull_use_adx': False, 'bull_use_spike': True, 'bull_rsi_required': False, 'bear_strategy': 'mean_reversion', 'bear_bb_std_mult': 2.1499643363339676, 'bear_rsi_os': 28, 'bear_rsi_ob': 72, 'bear_adx_thresh': 9.519135137633493, 'bear_atr_min_pct': 0.004868635649121102, 'bear_atr_max_pct': 0.11546920102011107, 'bear_tp_mult': 2.6783712643114, 'bear_tsl_mult': 0.1313635299356516, 'bear_time_stop': 91, 'bear_use_sma': True, 'bear_use_ema': False, 'bear_use_atr': True, 'bear_use_adx': True, 'bear_use_spike': True, 'bear_rsi_required': True, 'sideways_strategy': 'mean_reversion', 'sideways_bb_std_mult': 3.194379258360667, 'sideways_rsi_os': 32, 'sideways_rsi_ob': 51, 'sideways_adx_thresh': 10.148795245823353, 'sideways_atr_min_pct': 0.013454949918820819, 'sideways_atr_max_pct': 0.0850178732095885, 'sideways_tp_mult': 2.0354285585234577, 'sideways_tsl_mult': 0.3578096832682921, 'sideways_time_stop': 122, 'sideways_use_sma': True, 'sideways_use_ema': False, 'sideways_use_atr': True, 'sideways_use_adx': True, 'sideways_use_spike': True, 'sideways_rsi_required': True}.
[I 2025-08-30 15:16:30,595] Trial 416 finished with values: [-1000000000.0, 1000000000.0] and parameters: {'p_sma': 13, 'p_std': 24, 'p_atr': 12, 'p_adx': 26, 'rsi_period': 49, 'ema1': 23, 'ema2': 37, 'slip_atr_k': 0.007990019428348654, 'slip_spread_k': 0.6708235009125136, 'spread_hl_frac': 0.007083911267202262, 'bb_std_mult': 1.754453558059232, 'rsi_os': 23, 'rsi_ob': 52, 'vol_spike': 0.2620794682365559, 'adx_thresh': 8.351003647251067, 'atr_min_pct': 0.007349925848783071, 'atr_max_pct': 0.11394348132686968, 'tp_mult': 1.6066502071011324, 'tsl_mult': 0.9914341922516817, 'strategy': 'breakout', 'time_stop': 133, 'use_sma': False, 'use_atr': False, 'use_adx': True, 'use_ema': False, 'use_spike': False, 'rsi_required': False, 'edge_k': 0.6966241152710012, 'edge_cap': 0.2980009808007364, 'bull_strategy': 'breakout', 'bull_bb_std_mult': 1.6353822428497506, 'bull_rsi_os': 25, 'bull_rsi_ob': 89, 'bull_adx_thresh': 9.90501751651748, 'bull_atr_min_pct': 0.012361092875129284, 'bull_atr_max_pct': 0.11765764149504035, 'bull_tp_mult': 2.5006617249014287, 'bull_tsl_mult': 0.9385294376518533, 'bull_time_stop': 33, 'bull_use_sma': True, 'bull_use_ema': True, 'bull_use_atr': True, 'bull_use_adx': False, 'bull_use_spike': True, 'bull_rsi_required': False, 'bear_strategy': 'mean_reversion', 'bear_bb_std_mult': 1.4625306947057508, 'bear_rsi_os': 31, 'bear_rsi_ob': 70, 'bear_adx_thresh': 12.510733264585602, 'bear_atr_min_pct': 0.0031572569996450267, 'bear_atr_max_pct': 0.09248958631286852, 'bear_tp_mult': 2.538559393197553, 'bear_tsl_mult': 0.16134741994645657, 'bear_time_stop': 93, 'bear_use_sma': True, 'bear_use_ema': False, 'bear_use_atr': True, 'bear_use_adx': True, 'bear_use_spike': True, 'bear_rsi_required': True, 'sideways_strategy': 'mean_reversion', 'sideways_bb_std_mult': 3.331400909893352, 'sideways_rsi_os': 30, 'sideways_rsi_ob': 51, 'sideways_adx_thresh': 9.959114526582999, 'sideways_atr_min_pct': 0.00951106741441633, 'sideways_atr_max_pct': 0.08480917546838897, 'sideways_tp_mult': 2.1450453438674395, 'sideways_tsl_mult': 0.36659863072745924, 'sideways_time_stop': 138, 'sideways_use_sma': True, 'sideways_use_ema': False, 'sideways_use_atr': True, 'sideways_use_adx': True, 'sideways_use_spike': True, 'sideways_rsi_required': True}.
[I 2025-08-30 15:16:30,966] Trial 415 finished with values: [-1000000000.0, 1000000000.0] and parameters: {'p_sma': 18, 'p_std': 24, 'p_atr': 11, 'p_adx': 26, 'rsi_period': 44, 'ema1': 23, 'ema2': 38, 'slip_atr_k': 0.00828427166980519, 'slip_spread_k': 0.6961114394059613, 'spread_hl_frac': 0.007208490271162672, 'bb_std_mult': 1.7366122221734357, 'rsi_os': 23, 'rsi_ob': 87, 'vol_spike': 0.2631409699324465, 'adx_thresh': 8.301349668437567, 'atr_min_pct': 0.007785142972403037, 'atr_max_pct': 0.11393514902478921, 'tp_mult': 1.6283168817502085, 'tsl_mult': 0.5401894130440603, 'strategy': 'breakout', 'time_stop': 134, 'use_sma': False, 'use_atr': False, 'use_adx': True, 'use_ema': False, 'use_spike': False, 'rsi_required': False, 'edge_k': 0.6987903642684768, 'edge_cap': 0.9556460977354236, 'bull_strategy': 'breakout', 'bull_bb_std_mult': 1.3600698306829213, 'bull_rsi_os': 31, 'bull_rsi_ob': 89, 'bull_adx_thresh': 11.942579400808876, 'bull_atr_min_pct': 0.014763335131872649, 'bull_atr_max_pct': 0.12431021032038612, 'bull_tp_mult': 2.7394169109377366, 'bull_tsl_mult': 0.7706067380253265, 'bull_time_stop': 33, 'bull_use_sma': True, 'bull_use_ema': True, 'bull_use_atr': True, 'bull_use_adx': False, 'bull_use_spike': True, 'bull_rsi_required': False, 'bear_strategy': 'mean_reversion', 'bear_bb_std_mult': 2.1276345819302094, 'bear_rsi_os': 10, 'bear_rsi_ob': 72, 'bear_adx_thresh': 11.595633676691994, 'bear_atr_min_pct': 0.003570407083260135, 'bear_atr_max_pct': 0.09110441706905006, 'bear_tp_mult': 2.55483685681656, 'bear_tsl_mult': 0.5859133158306524, 'bear_time_stop': 95, 'bear_use_sma': True, 'bear_use_ema': False, 'bear_use_atr': True, 'bear_use_adx': True, 'bear_use_spike': True, 'bear_rsi_required': True, 'sideways_strategy': 'mean_reversion', 'sideways_bb_std_mult': 3.3211765256279038, 'sideways_rsi_os': 30, 'sideways_rsi_ob': 51, 'sideways_adx_thresh': 9.225597796286744, 'sideways_atr_min_pct': 0.009723573256092336, 'sideways_atr_max_pct': 0.08523291607959098, 'sideways_tp_mult': 2.2203452077653263, 'sideways_tsl_mult': 0.3685096066191972, 'sideways_time_stop': 121, 'sideways_use_sma': True, 'sideways_use_ema': False, 'sideways_use_atr': True, 'sideways_use_adx': True, 'sideways_use_spike': True, 'sideways_rsi_required': True}.
[I 2025-08-30 15:17:20,922] Trial 419 finished with values: [-1000000000.0, 1000000000.0] and parameters: {'p_sma': 18, 'p_std': 27, 'p_atr': 11, 'p_adx': 25, 'rsi_period': 56, 'ema1': 25, 'ema2': 38, 'slip_atr_k': 0.0002956801772514105, 'slip_spread_k': 0.6989741097548231, 'spread_hl_frac': 0.006318836420489294, 'bb_std_mult': 3.1496133847018717, 'rsi_os': 25, 'rsi_ob': 87, 'vol_spike': 0.16417322918554184, 'adx_thresh': 8.150784988630157, 'atr_min_pct': 0.0063755838837802874, 'atr_max_pct': 0.11703199268406599, 'tp_mult': 1.782875252677264, 'tsl_mult': 0.28295375270583584, 'strategy': 'mean_reversion', 'time_stop': 149, 'use_sma': False, 'use_atr': False, 'use_adx': True, 'use_ema': False, 'use_spike': True, 'rsi_required': False, 'edge_k': 0.5037643942133112, 'edge_cap': 0.6620921178040973, 'bull_strategy': 'breakout', 'bull_bb_std_mult': 1.3928099710575113, 'bull_rsi_os': 19, 'bull_rsi_ob': 91, 'bull_adx_thresh': 11.843727003998444, 'bull_atr_min_pct': 0.022543173341758878, 'bull_atr_max_pct': 0.11639150176434603, 'bull_tp_mult': 2.7212727059435493, 'bull_tsl_mult': 0.8973837766639308, 'bull_time_stop': 65, 'bull_use_sma': True, 'bull_use_ema': True, 'bull_use_atr': True, 'bull_use_adx': False, 'bull_use_spike': True, 'bull_rsi_required': False, 'bear_strategy': 'mean_reversion', 'bear_bb_std_mult': 1.1635981830937894, 'bear_rsi_os': 14, 'bear_rsi_ob': 72, 'bear_adx_thresh': 13.598885147961635, 'bear_atr_min_pct': 0.0022026835228886564, 'bear_atr_max_pct': 0.06055507577464208, 'bear_tp_mult': 2.402601337568366, 'bear_tsl_mult': 0.4590147345629707, 'bear_time_stop': 103, 'bear_use_sma': True, 'bear_use_ema': False, 'bear_use_atr': True, 'bear_use_adx': True, 'bear_use_spike': True, 'bear_rsi_required': True, 'sideways_strategy': 'mean_reversion', 'sideways_bb_std_mult': 3.454211019840984, 'sideways_rsi_os': 31, 'sideways_rsi_ob': 49, 'sideways_adx_thresh': 12.66759243381067, 'sideways_atr_min_pct': 0.027323974729215942, 'sideways_atr_max_pct': 0.08205630619681142, 'sideways_tp_mult': 2.1160599591071647, 'sideways_tsl_mult': 0.3366149275349908, 'sideways_time_stop': 118, 'sideways_use_sma': True, 'sideways_use_ema': False, 'sideways_use_atr': True, 'sideways_use_adx': True, 'sideways_use_spike': True, 'sideways_rsi_required': True}.
[I 2025-08-30 15:17:21,434] Trial 417 finished with values: [-1000000000.0, 1000000000.0] and parameters: {'p_sma': 13, 'p_std': 26, 'p_atr': 12, 'p_adx': 25, 'rsi_period': 56, 'ema1': 23, 'ema2': 37, 'slip_atr_k': 0.008263783506818376, 'slip_spread_k': 0.665197203773111, 'spread_hl_frac': 0.006966584968534368, 'bb_std_mult': 1.7591884754458438, 'rsi_os': 24, 'rsi_ob': 87, 'vol_spike': 0.11789164298056669, 'adx_thresh': 8.382180138314386, 'atr_min_pct': 0.0078587957917528, 'atr_max_pct': 0.11657631974937681, 'tp_mult': 1.8094240382481386, 'tsl_mult': 0.3236433471572896, 'strategy': 'mean_reversion', 'time_stop': 147, 'use_sma': False, 'use_atr': False, 'use_adx': True, 'use_ema': False, 'use_spike': True, 'rsi_required': False, 'edge_k': 0.5127355462336969, 'edge_cap': 0.6572132114967584, 'bull_strategy': 'breakout', 'bull_bb_std_mult': 1.3619593843174895, 'bull_rsi_os': 8, 'bull_rsi_ob': 91, 'bull_adx_thresh': 12.033220980261037, 'bull_atr_min_pct': 0.015604808074188866, 'bull_atr_max_pct': 0.11522285689188284, 'bull_tp_mult': 2.7210714482374234, 'bull_tsl_mult': 0.9361667039519309, 'bull_time_stop': 68, 'bull_use_sma': True, 'bull_use_ema': True, 'bull_use_atr': True, 'bull_use_adx': False, 'bull_use_spike': True, 'bull_rsi_required': False, 'bear_strategy': 'mean_reversion', 'bear_bb_std_mult': 1.4713906631517881, 'bear_rsi_os': 31, 'bear_rsi_ob': 70, 'bear_adx_thresh': 12.628442883713676, 'bear_atr_min_pct': 0.0032312798607047866, 'bear_atr_max_pct': 0.07084051727190557, 'bear_tp_mult': 2.51641908792825, 'bear_tsl_mult': 0.2541892132985979, 'bear_time_stop': 101, 'bear_use_sma': True, 'bear_use_ema': False, 'bear_use_atr': True, 'bear_use_adx': True, 'bear_use_spike': True, 'bear_rsi_required': True, 'sideways_strategy': 'mean_reversion', 'sideways_bb_std_mult': 3.316196486701087, 'sideways_rsi_os': 30, 'sideways_rsi_ob': 50, 'sideways_adx_thresh': 12.543662457078367, 'sideways_atr_min_pct': 0.027234929579594537, 'sideways_atr_max_pct': 0.08233777229673696, 'sideways_tp_mult': 2.110871888137699, 'sideways_tsl_mult': 0.33587989987100714, 'sideways_time_stop': 143, 'sideways_use_sma': True, 'sideways_use_ema': False, 'sideways_use_atr': True, 'sideways_use_adx': True, 'sideways_use_spike': True, 'sideways_rsi_required': True}.
[I 2025-08-30 15:17:22,615] Trial 418 finished with values: [-1000000000.0, 1000000000.0] and parameters: {'p_sma': 18, 'p_std': 25, 'p_atr': 12, 'p_adx': 26, 'rsi_period': 57, 'ema1': 23, 'ema2': 37, 'slip_atr_k': 0.008356737542244193, 'slip_spread_k': 0.664158900345097, 'spread_hl_frac': 0.022493434993991743, 'bb_std_mult': 1.7557816269372084, 'rsi_os': 24, 'rsi_ob': 53, 'vol_spike': 0.1655916257963939, 'adx_thresh': 8.094939856541139, 'atr_min_pct': 0.007658607086448366, 'atr_max_pct': 0.11445781639306192, 'tp_mult': 1.7924252217475738, 'tsl_mult': 0.9912803959011203, 'strategy': 'mean_reversion', 'time_stop': 133, 'use_sma': False, 'use_atr': False, 'use_adx': True, 'use_ema': False, 'use_spike': True, 'rsi_required': False, 'edge_k': 0.4909602688158618, 'edge_cap': 0.6687242679696279, 'bull_strategy': 'breakout', 'bull_bb_std_mult': 1.3935622138979955, 'bull_rsi_os': 25, 'bull_rsi_ob': 89, 'bull_adx_thresh': 12.026954297572704, 'bull_atr_min_pct': 0.010440998167978393, 'bull_atr_max_pct': 0.11588798006248956, 'bull_tp_mult': 2.7376239334131283, 'bull_tsl_mult': 0.07124535796862225, 'bull_time_stop': 66, 'bull_use_sma': True, 'bull_use_ema': True, 'bull_use_atr': True, 'bull_use_adx': False, 'bull_use_spike': True, 'bull_rsi_required': False, 'bear_strategy': 'mean_reversion', 'bear_bb_std_mult': 1.1959801772346976, 'bear_rsi_os': 31, 'bear_rsi_ob': 70, 'bear_adx_thresh': 12.636338089930852, 'bear_atr_min_pct': 0.003005292812158729, 'bear_atr_max_pct': 0.09334256297003005, 'bear_tp_mult': 2.56955416265041, 'bear_tsl_mult': 0.6111920141418442, 'bear_time_stop': 98, 'bear_use_sma': True, 'bear_use_ema': False, 'bear_use_atr': True, 'bear_use_adx': True, 'bear_use_spike': True, 'bear_rsi_required': True, 'sideways_strategy': 'mean_reversion', 'sideways_bb_std_mult': 3.2968460043096046, 'sideways_rsi_os': 30, 'sideways_rsi_ob': 49, 'sideways_adx_thresh': 11.232376800413514, 'sideways_atr_min_pct': 0.01684469642621145, 'sideways_atr_max_pct': 0.08234240680917172, 'sideways_tp_mult': 2.1345949725417492, 'sideways_tsl_mult': 0.3353078850167283, 'sideways_time_stop': 140, 'sideways_use_sma': True, 'sideways_use_ema': False, 'sideways_use_atr': True, 'sideways_use_adx': True, 'sideways_use_spike': True, 'sideways_rsi_required': True}.
[I 2025-08-30 15:17:22,971] Trial 420 finished with values: [-1000000000.0, 1000000000.0] and parameters: {'p_sma': 18, 'p_std': 27, 'p_atr': 11, 'p_adx': 25, 'rsi_period': 33, 'ema1': 25, 'ema2': 35, 'slip_atr_k': 0.003841155840665804, 'slip_spread_k': 0.6290641359579645, 'spread_hl_frac': 0.02305030365003829, 'bb_std_mult': 1.241399538764373, 'rsi_os': 25, 'rsi_ob': 86, 'vol_spike': 0.2735825961411105, 'adx_thresh': 7.482003527235737, 'atr_min_pct': 0.0066405336244673725, 'atr_max_pct': 0.11697577976337174, 'tp_mult': 1.731169767841016, 'tsl_mult': 0.39300955847102237, 'strategy': 'mean_reversion', 'time_stop': 146, 'use_sma': False, 'use_atr': False, 'use_adx': True, 'use_ema': False, 'use_spike': True, 'rsi_required': False, 'edge_k': 0.4889808364307989, 'edge_cap': 0.2650250283124599, 'bull_strategy': 'breakout', 'bull_bb_std_mult': 1.5510508947604038, 'bull_rsi_os': 35, 'bull_rsi_ob': 91, 'bull_adx_thresh': 12.636323173694699, 'bull_atr_min_pct': 0.009894148858172165, 'bull_atr_max_pct': 0.11729447827409262, 'bull_tp_mult': 2.580542360904844, 'bull_tsl_mult': 0.9440006888814142, 'bull_time_stop': 67, 'bull_use_sma': True, 'bull_use_ema': True, 'bull_use_atr': True, 'bull_use_adx': False, 'bull_use_spike': True, 'bull_rsi_required': False, 'bear_strategy': 'mean_reversion', 'bear_bb_std_mult': 1.1822226026977087, 'bear_rsi_os': 12, 'bear_rsi_ob': 69, 'bear_adx_thresh': 13.935058391275465, 'bear_atr_min_pct': 0.002351054452996885, 'bear_atr_max_pct': 0.0954441827504348, 'bear_tp_mult': 2.5102725820233434, 'bear_tsl_mult': 0.6039969925867477, 'bear_time_stop': 79, 'bear_use_sma': True, 'bear_use_ema': False, 'bear_use_atr': True, 'bear_use_adx': True, 'bear_use_spike': True, 'bear_rsi_required': True, 'sideways_strategy': 'mean_reversion', 'sideways_bb_std_mult': 3.4698613785020567, 'sideways_rsi_os': 28, 'sideways_rsi_ob': 50, 'sideways_adx_thresh': 11.083769590357065, 'sideways_atr_min_pct': 0.016839045610717113, 'sideways_atr_max_pct': 0.04054962637883171, 'sideways_tp_mult': 2.1011526476041626, 'sideways_tsl_mult': 0.3334519740422253, 'sideways_time_stop': 117, 'sideways_use_sma': True, 'sideways_use_ema': True, 'sideways_use_atr': True, 'sideways_use_adx': True, 'sideways_use_spike': True, 'sideways_rsi_required': True}.
[I 2025-08-30 15:18:11,467] Trial 422 finished with values: [-1000000000.0, 1000000000.0] and parameters: {'p_sma': 16, 'p_std': 30, 'p_atr': 10, 'p_adx': 25, 'rsi_period': 7, 'ema1': 28, 'ema2': 35, 'slip_atr_k': 8.29679260441413e-05, 'slip_spread_k': 0.6327261457975045, 'spread_hl_frac': 0.003919457497507174, 'bb_std_mult': 1.2472709069565946, 'rsi_os': 22, 'rsi_ob': 86, 'vol_spike': 0.2720794814737007, 'adx_thresh': 9.270253451396227, 'atr_min_pct': 0.009665121817159042, 'atr_max_pct': 0.11265473274441819, 'tp_mult': 1.7326024770719897, 'tsl_mult': 0.38826632220519147, 'strategy': 'breakout', 'time_stop': 157, 'use_sma': False, 'use_atr': True, 'use_adx': True, 'use_ema': True, 'use_spike': False, 'rsi_required': False, 'edge_k': 0.5884426567348993, 'edge_cap': 0.26038313723594214, 'bull_strategy': 'breakout', 'bull_bb_std_mult': 1.5474623086554369, 'bull_rsi_os': 47, 'bull_rsi_ob': 90, 'bull_adx_thresh': 12.691660346051794, 'bull_atr_min_pct': 0.007776601906056326, 'bull_atr_max_pct': 0.1041783032480974, 'bull_tp_mult': 2.5704949447055054, 'bull_tsl_mult': 0.8816119273490027, 'bull_time_stop': 22, 'bull_use_sma': True, 'bull_use_ema': True, 'bull_use_atr': True, 'bull_use_adx': True, 'bull_use_spike': True, 'bull_rsi_required': False, 'bear_strategy': 'mean_reversion', 'bear_bb_std_mult': 1.8135313498054562, 'bear_rsi_os': 12, 'bear_rsi_ob': 69, 'bear_adx_thresh': 15.619224917189474, 'bear_atr_min_pct': 0.0037620479447058597, 'bear_atr_max_pct': 0.09525453342449722, 'bear_tp_mult': 2.6813953717908334, 'bear_tsl_mult': 0.6133604947292693, 'bear_time_stop': 103, 'bear_use_sma': True, 'bear_use_ema': False, 'bear_use_atr': True, 'bear_use_adx': True, 'bear_use_spike': True, 'bear_rsi_required': True, 'sideways_strategy': 'mean_reversion', 'sideways_bb_std_mult': 3.2517080885915157, 'sideways_rsi_os': 28, 'sideways_rsi_ob': 52, 'sideways_adx_thresh': 11.003659638133087, 'sideways_atr_min_pct': 0.01769004659118724, 'sideways_atr_max_pct': 0.08512982438202044, 'sideways_tp_mult': 2.158525794689905, 'sideways_tsl_mult': 0.3869555916685412, 'sideways_time_stop': 109, 'sideways_use_sma': False, 'sideways_use_ema': True, 'sideways_use_atr': True, 'sideways_use_adx': True, 'sideways_use_spike': True, 'sideways_rsi_required': True}.
[I 2025-08-30 15:18:12,015] Trial 421 finished with values: [-1000000000.0, 1000000000.0] and parameters: {'p_sma': 16, 'p_std': 30, 'p_atr': 10, 'p_adx': 25, 'rsi_period': 38, 'ema1': 28, 'ema2': 37, 'slip_atr_k': 0.00040382855463909947, 'slip_spread_k': 0.7744636275301784, 'spread_hl_frac': 0.03803190708417853, 'bb_std_mult': 2.206473359641989, 'rsi_os': 22, 'rsi_ob': 86, 'vol_spike': 0.27297913872421514, 'adx_thresh': 8.98025241659239, 'atr_min_pct': 0.0070622644082797194, 'atr_max_pct': 0.12602841972714518, 'tp_mult': 1.7224074756311454, 'tsl_mult': 0.5133322767913646, 'strategy': 'breakout', 'time_stop': 121, 'use_sma': False, 'use_atr': True, 'use_adx': True, 'use_ema': True, 'use_spike': False, 'rsi_required': False, 'edge_k': 0.5807562623789825, 'edge_cap': 0.19875085392004527, 'bull_strategy': 'breakout', 'bull_bb_std_mult': 1.5726020708262456, 'bull_rsi_os': 35, 'bull_rsi_ob': 90, 'bull_adx_thresh': 12.343664812261778, 'bull_atr_min_pct': 0.007569342052725073, 'bull_atr_max_pct': 0.103988503129711, 'bull_tp_mult': 2.568881229605271, 'bull_tsl_mult': 0.6841469426670261, 'bull_time_stop': 22, 'bull_use_sma': True, 'bull_use_ema': True, 'bull_use_atr': True, 'bull_use_adx': True, 'bull_use_spike': True, 'bull_rsi_required': False, 'bear_strategy': 'mean_reversion', 'bear_bb_std_mult': 1.7056009252971975, 'bear_rsi_os': 12, 'bear_rsi_ob': 73, 'bear_adx_thresh': 13.259496512718052, 'bear_atr_min_pct': 0.0038135046266470156, 'bear_atr_max_pct': 0.09572295578057402, 'bear_tp_mult': 2.668033140326888, 'bear_tsl_mult': 0.6135639112056195, 'bear_time_stop': 81, 'bear_use_sma': True, 'bear_use_ema': False, 'bear_use_atr': True, 'bear_use_adx': True, 'bear_use_spike': True, 'bear_rsi_required': True, 'sideways_strategy': 'mean_reversion', 'sideways_bb_std_mult': 3.268186765580553, 'sideways_rsi_os': 28, 'sideways_rsi_ob': 52, 'sideways_adx_thresh': 11.182101600858829, 'sideways_atr_min_pct': 0.016729221760724975, 'sideways_atr_max_pct': 0.04230767373116159, 'sideways_tp_mult': 2.155087428994295, 'sideways_tsl_mult': 0.32491810853930286, 'sideways_time_stop': 113, 'sideways_use_sma': False, 'sideways_use_ema': True, 'sideways_use_atr': True, 'sideways_use_adx': True, 'sideways_use_spike': True, 'sideways_rsi_required': True}.
