[I 2025-08-30 16:39:18,043] Trial 827 finished with values: [-1000000000.0, 1000000000.0] and parameters: {'p_sma': 8, 'p_std': 15, 'p_atr': 11, 'p_adx': 19, 'rsi_period': 14, 'ema1': 23, 'ema2': 37, 'slip_atr_k': 0.07929356581809321, 'slip_spread_k': 0.7264931847371717, 'spread_hl_frac': 0.00652875316939525, 'bb_std_mult': 3.440252138245999, 'rsi_os': 27, 'rsi_ob': 52, 'vol_spike': 0.07439740377800715, 'adx_thresh': 8.085853273469592, 'atr_min_pct': 0.009152361480254348, 'atr_max_pct': 0.05353343191715594, 'tp_mult': 1.9231447592279278, 'tsl_mult': 0.23589386203101465, 'strategy': 'breakout', 'time_stop': 145, 'use_sma': False, 'use_atr': False, 'use_adx': False, 'use_ema': False, 'use_spike': False, 'rsi_required': False, 'edge_k': 1.4297652865242365, 'edge_cap': 0.24351409645862204, 'bull_strategy': 'breakout', 'bull_bb_std_mult': 1.5591889915763109, 'bull_rsi_os': 51, 'bull_rsi_ob': 63, 'bull_adx_thresh': 24.431417774596163, 'bull_atr_min_pct': 0.026688487518806103, 'bull_atr_max_pct': 0.09922640716135193, 'bull_tp_mult': 2.6118818937187136, 'bull_tsl_mult': 0.9454218407088371, 'bull_time_stop': 61, 'bull_use_sma': True, 'bull_use_ema': True, 'bull_use_atr': True, 'bull_use_adx': True, 'bull_use_spike': True, 'bull_rsi_required': True, 'bear_strategy': 'mean_reversion', 'bear_bb_std_mult': 2.7012490926792943, 'bear_rsi_os': 26, 'bear_rsi_ob': 76, 'bear_adx_thresh': 14.23250895457674, 'bear_atr_min_pct': 0.00570886618663205, 'bear_atr_max_pct': 0.10439275036756117, 'bear_tp_mult': 2.751929311616102, 'bear_tsl_mult': 0.16518535343650903, 'bear_time_stop': 49, 'bear_use_sma': True, 'bear_use_ema': False, 'bear_use_atr': True, 'bear_use_adx': True, 'bear_use_spike': True, 'bear_rsi_required': True, 'sideways_strategy': 'breakout', 'sideways_bb_std_mult': 0.7459742177029198, 'sideways_rsi_os': 8, 'sideways_rsi_ob': 81, 'sideways_adx_thresh': 11.920582984018896, 'sideways_atr_min_pct': 0.018999360299329512, 'sideways_atr_max_pct': 0.07639267630828198, 'sideways_tp_mult': 1.5018270495334942, 'sideways_tsl_mult': 0.5201044413373481, 'sideways_time_stop': 120, 'sideways_use_sma': False, 'sideways_use_ema': False, 'sideways_use_atr': True, 'sideways_use_adx': True, 'sideways_use_spike': True, 'sideways_rsi_required': True}.
[I 2025-08-30 16:39:19,559] Trial 831 finished with values: [-1000000000.0, 1000000000.0] and parameters: {'p_sma': 6, 'p_std': 49, 'p_atr': 11, 'p_adx': 25, 'rsi_period': 7, 'ema1': 27, 'ema2': 18, 'slip_atr_k': 0.0038062331045843117, 'slip_spread_k': 0.7210946180209578, 'spread_hl_frac': 0.006500336151719751, 'bb_std_mult': 1.2016556855329357, 'rsi_os': 26, 'rsi_ob': 45, 'vol_spike': 0.03549681858643265, 'adx_thresh': 34.002512180505065, 'atr_min_pct': 7.228996395110786e-05, 'atr_max_pct': 0.11248881131501899, 'tp_mult': 1.6350483054395322, 'tsl_mult': 0.6567320061114255, 'strategy': 'mean_reversion', 'time_stop': 153, 'use_sma': True, 'use_atr': False, 'use_adx': True, 'use_ema': True, 'use_spike': False, 'rsi_required': True, 'edge_k': 0.9624393541615464, 'edge_cap': 0.21788681590879877, 'bull_strategy': 'mean_reversion', 'bull_bb_std_mult': 0.6544550900558699, 'bull_rsi_os': 50, 'bull_rsi_ob': 76, 'bull_adx_thresh': 24.07740212941054, 'bull_atr_min_pct': 0.014053899728726, 'bull_atr_max_pct': 0.07707554657857134, 'bull_tp_mult': 2.617036669618574, 'bull_tsl_mult': 0.854548507976132, 'bull_time_stop': 184, 'bull_use_sma': False, 'bull_use_ema': True, 'bull_use_atr': True, 'bull_use_adx': False, 'bull_use_spike': False, 'bull_rsi_required': False, 'bear_strategy': 'breakout', 'bear_bb_std_mult': 1.408774602431409, 'bear_rsi_os': 26, 'bear_rsi_ob': 72, 'bear_adx_thresh': 15.499271326397956, 'bear_atr_min_pct': 0.003462733099678591, 'bear_atr_max_pct': 0.10867218553653178, 'bear_tp_mult': 2.628809177287417, 'bear_tsl_mult': 0.1664061783490956, 'bear_time_stop': 287, 'bear_use_sma': False, 'bear_use_ema': False, 'bear_use_atr': True, 'bear_use_adx': True, 'bear_use_spike': False, 'bear_rsi_required': False, 'sideways_strategy': 'mean_reversion', 'sideways_bb_std_mult': 3.2668766079957194, 'sideways_rsi_os': 9, 'sideways_rsi_ob': 79, 'sideways_adx_thresh': 9.94228791538598, 'sideways_atr_min_pct': 0.0206776847248895, 'sideways_atr_max_pct': 0.11055483100121336, 'sideways_tp_mult': 1.3948670805017667, 'sideways_tsl_mult': 0.02800971247070899, 'sideways_time_stop': 133, 'sideways_use_sma': True, 'sideways_use_ema': True, 'sideways_use_atr': True, 'sideways_use_adx': True, 'sideways_use_spike': False, 'sideways_rsi_required': True}.
[I 2025-08-30 16:39:19,573] Trial 832 finished with values: [-1000000000.0, 1000000000.0] and parameters: {'p_sma': 6, 'p_std': 18, 'p_atr': 10, 'p_adx': 25, 'rsi_period': 23, 'ema1': 27, 'ema2': 45, 'slip_atr_k': 0.004249280577988423, 'slip_spread_k': 0.3640378859407972, 'spread_hl_frac': 0.0050474101532986225, 'bb_std_mult': 0.7877333612564819, 'rsi_os': 29, 'rsi_ob': 47, 'vol_spike': 0.22155286648019024, 'adx_thresh': 28.431022991583518, 'atr_min_pct': 0.0064722913554934, 'atr_max_pct': 0.11633789082302856, 'tp_mult': 1.4624731813470913, 'tsl_mult': 0.4161570448183297, 'strategy': 'mean_reversion', 'time_stop': 245, 'use_sma': True, 'use_atr': False, 'use_adx': True, 'use_ema': True, 'use_spike': False, 'rsi_required': True, 'edge_k': 0.5365274430555698, 'edge_cap': 0.9998877911725979, 'bull_strategy': 'mean_reversion', 'bull_bb_std_mult': 1.6758734062207925, 'bull_rsi_os': 48, 'bull_rsi_ob': 89, 'bull_adx_thresh': 26.10280525160293, 'bull_atr_min_pct': 0.014083130648605263, 'bull_atr_max_pct': 0.10579175026833054, 'bull_tp_mult': 1.509356971846865, 'bull_tsl_mult': 0.8671632446597684, 'bull_time_stop': 49, 'bull_use_sma': False, 'bull_use_ema': True, 'bull_use_atr': True, 'bull_use_adx': False, 'bull_use_spike': False, 'bull_rsi_required': False, 'bear_strategy': 'breakout', 'bear_bb_std_mult': 1.4864259041309362, 'bear_rsi_os': 28, 'bear_rsi_ob': 72, 'bear_adx_thresh': 15.68384258860645, 'bear_atr_min_pct': 0.0032943743649306817, 'bear_atr_max_pct': 0.1105113561722472, 'bear_tp_mult': 2.6888499661939242, 'bear_tsl_mult': 0.8916466323952736, 'bear_time_stop': 165, 'bear_use_sma': False, 'bear_use_ema': False, 'bear_use_atr': True, 'bear_use_adx': True, 'bear_use_spike': False, 'bear_rsi_required': False, 'sideways_strategy': 'mean_reversion', 'sideways_bb_std_mult': 3.2643658650098843, 'sideways_rsi_os': 9, 'sideways_rsi_ob': 68, 'sideways_adx_thresh': 10.249155563051005, 'sideways_atr_min_pct': 0.002825682207348086, 'sideways_atr_max_pct': 0.07032975233634958, 'sideways_tp_mult': 1.1956266393818717, 'sideways_tsl_mult': 0.7568525224064142, 'sideways_time_stop': 132, 'sideways_use_sma': True, 'sideways_use_ema': True, 'sideways_use_atr': True, 'sideways_use_adx': True, 'sideways_use_spike': False, 'sideways_rsi_required': True}.
[I 2025-08-30 16:40:00,684] Trial 829 finished with values: [-1000000000.0, 1000000000.0] and parameters: {'p_sma': 6, 'p_std': 43, 'p_atr': 10, 'p_adx': 19, 'rsi_period': 7, 'ema1': 27, 'ema2': 10, 'slip_atr_k': 9.36482279932966e-06, 'slip_spread_k': 0.6506881721074281, 'spread_hl_frac': 0.006468007459988433, 'bb_std_mult': 0.78056923517609, 'rsi_os': 26, 'rsi_ob': 52, 'vol_spike': 0.22780130400533008, 'adx_thresh': 6.931092831865777, 'atr_min_pct': 0.006576993919763903, 'atr_max_pct': 0.11916281698923122, 'tp_mult': 1.9321257963282268, 'tsl_mult': 0.09171406886242928, 'strategy': 'mean_reversion', 'time_stop': 153, 'use_sma': True, 'use_atr': False, 'use_adx': True, 'use_ema': False, 'use_spike': False, 'rsi_required': False, 'edge_k': 1.4196465172691444, 'edge_cap': 0.2140381754772684, 'bull_strategy': 'breakout', 'bull_bb_std_mult': 1.5929912418908838, 'bull_rsi_os': 27, 'bull_rsi_ob': 93, 'bull_adx_thresh': 8.936119618074263, 'bull_atr_min_pct': 0.004057004426870715, 'bull_atr_max_pct': 0.012371983367493206, 'bull_tp_mult': 1.7349089918842222, 'bull_tsl_mult': 0.940344404508456, 'bull_time_stop': 61, 'bull_use_sma': False, 'bull_use_ema': True, 'bull_use_atr': True, 'bull_use_adx': True, 'bull_use_spike': True, 'bull_rsi_required': True, 'bear_strategy': 'mean_reversion', 'bear_bb_std_mult': 2.7247567236380306, 'bear_rsi_os': 28, 'bear_rsi_ob': 76, 'bear_adx_thresh': 13.879797345871129, 'bear_atr_min_pct': 0.0029627696980339007, 'bear_atr_max_pct': 0.10500957195384895, 'bear_tp_mult': 2.6518713113901917, 'bear_tsl_mult': 0.16686805983104885, 'bear_time_stop': 49, 'bear_use_sma': False, 'bear_use_ema': False, 'bear_use_atr': True, 'bear_use_adx': True, 'bear_use_spike': True, 'bear_rsi_required': True, 'sideways_strategy': 'breakout', 'sideways_bb_std_mult': 2.7846247237229207, 'sideways_rsi_os': 7, 'sideways_rsi_ob': 79, 'sideways_adx_thresh': 10.027870247171982, 'sideways_atr_min_pct': 0.018965876841710364, 'sideways_atr_max_pct': 0.10847951959196833, 'sideways_tp_mult': 1.3990148082373215, 'sideways_tsl_mult': 0.40799956180863084, 'sideways_time_stop': 214, 'sideways_use_sma': True, 'sideways_use_ema': False, 'sideways_use_atr': True, 'sideways_use_adx': True, 'sideways_use_spike': True, 'sideways_rsi_required': True}.
[I 2025-08-30 16:40:01,496] Trial 830 finished with values: [-0.030106252284456403, 0.03015555692601425] and parameters: {'p_sma': 18, 'p_std': 25, 'p_atr': 10, 'p_adx': 23, 'rsi_period': 7, 'ema1': 19, 'ema2': 10, 'slip_atr_k': 0.004811095689016346, 'slip_spread_k': 0.646330082929519, 'spread_hl_frac': 0.009779401685016783, 'bb_std_mult': 1.4052036656681806, 'rsi_os': 29, 'rsi_ob': 87, 'vol_spike': 0.2222724081294744, 'adx_thresh': 28.132925050759148, 'atr_min_pct': 0.006379875700553445, 'atr_max_pct': 0.11755872389012233, 'tp_mult': 1.4524215459824898, 'tsl_mult': 0.41576542771691866, 'strategy': 'mean_reversion', 'time_stop': 153, 'use_sma': True, 'use_atr': False, 'use_adx': True, 'use_ema': True, 'use_spike': False, 'rsi_required': True, 'edge_k': 0.6032505799872365, 'edge_cap': 0.9886113017913117, 'bull_strategy': 'mean_reversion', 'bull_bb_std_mult': 3.0609157879788653, 'bull_rsi_os': 50, 'bull_rsi_ob': 76, 'bull_adx_thresh': 10.463026354502349, 'bull_atr_min_pct': 0.004325703571063171, 'bull_atr_max_pct': 0.10625160863956809, 'bull_tp_mult': 2.5314868104179533, 'bull_tsl_mult': 0.8582036463462036, 'bull_time_stop': 48, 'bull_use_sma': False, 'bull_use_ema': True, 'bull_use_atr': True, 'bull_use_adx': True, 'bull_use_spike': False, 'bull_rsi_required': False, 'bear_strategy': 'breakout', 'bear_bb_std_mult': 2.1943752843355777, 'bear_rsi_os': 28, 'bear_rsi_ob': 76, 'bear_adx_thresh': 15.975086646154237, 'bear_atr_min_pct': 0.0005801749943909582, 'bear_atr_max_pct': 0.1040492062860926, 'bear_tp_mult': 1.4307910654700957, 'bear_tsl_mult': 0.9591976132108707, 'bear_time_stop': 286, 'bear_use_sma': False, 'bear_use_ema': False, 'bear_use_atr': True, 'bear_use_adx': True, 'bear_use_spike': False, 'bear_rsi_required': False, 'sideways_strategy': 'mean_reversion', 'sideways_bb_std_mult': 2.253152826424981, 'sideways_rsi_os': 9, 'sideways_rsi_ob': 68, 'sideways_adx_thresh': 9.9762609592308, 'sideways_atr_min_pct': 0.020728303984548013, 'sideways_atr_max_pct': 0.11302382694497035, 'sideways_tp_mult': 1.5963120063596348, 'sideways_tsl_mult': 0.32722930257668315, 'sideways_time_stop': 211, 'sideways_use_sma': True, 'sideways_use_ema': False, 'sideways_use_atr': True, 'sideways_use_adx': True, 'sideways_use_spike': False, 'sideways_rsi_required': True}.
[I 2025-08-30 16:40:03,854] Trial 833 finished with values: [-1000000000.0, 1000000000.0] and parameters: {'p_sma': 14, 'p_std': 27, 'p_atr': 22, 'p_adx': 23, 'rsi_period': 9, 'ema1': 6, 'ema2': 43, 'slip_atr_k': 0.16892301228004752, 'slip_spread_k': 0.8240381563181134, 'spread_hl_frac': 0.004924535121783306, 'bb_std_mult': 1.4161390818587225, 'rsi_os': 25, 'rsi_ob': 84, 'vol_spike': 0.2220410766979908, 'adx_thresh': 10.07766363629792, 'atr_min_pct': 0.006411778895067867, 'atr_max_pct': 0.10571879629604168, 'tp_mult': 2.8700982321749646, 'tsl_mult': 0.3595360688280005, 'strategy': 'mean_reversion', 'time_stop': 42, 'use_sma': True, 'use_atr': False, 'use_adx': True, 'use_ema': False, 'use_spike': False, 'rsi_required': False, 'edge_k': 0.5218911246510275, 'edge_cap': 0.9995973550404579, 'bull_strategy': 'mean_reversion', 'bull_bb_std_mult': 3.052254144786598, 'bull_rsi_os': 48, 'bull_rsi_ob': 89, 'bull_adx_thresh': 8.997256864569934, 'bull_atr_min_pct': 0.006545038929282085, 'bull_atr_max_pct': 0.05035174690026159, 'bull_tp_mult': 2.5664672599292677, 'bull_tsl_mult': 0.8769475564447461, 'bull_time_stop': 49, 'bull_use_sma': False, 'bull_use_ema': True, 'bull_use_atr': True, 'bull_use_adx': True, 'bull_use_spike': True, 'bull_rsi_required': False, 'bear_strategy': 'breakout', 'bear_bb_std_mult': 1.801922858434469, 'bear_rsi_os': 28, 'bear_rsi_ob': 47, 'bear_adx_thresh': 27.314968715192855, 'bear_atr_min_pct': 0.022741619245019783, 'bear_atr_max_pct': 0.11662617125965186, 'bear_tp_mult': 2.3745200776231203, 'bear_tsl_mult': 0.893367087171376, 'bear_time_stop': 86, 'bear_use_sma': False, 'bear_use_ema': False, 'bear_use_atr': True, 'bear_use_adx': True, 'bear_use_spike': True, 'bear_rsi_required': True, 'sideways_strategy': 'mean_reversion', 'sideways_bb_std_mult': 2.7913731475869272, 'sideways_rsi_os': 45, 'sideways_rsi_ob': 47, 'sideways_adx_thresh': 28.377521634369675, 'sideways_atr_min_pct': 0.019822038133536463, 'sideways_atr_max_pct': 0.10758649311801272, 'sideways_tp_mult': 1.2320103923417531, 'sideways_tsl_mult': 0.891260331473064, 'sideways_time_stop': 148, 'sideways_use_sma': True, 'sideways_use_ema': False, 'sideways_use_atr': True, 'sideways_use_adx': True, 'sideways_use_spike': True, 'sideways_rsi_required': True}.
[I 2025-08-30 16:40:04,223] Trial 834 finished with values: [-0.052202766054523786, 0.05216075015691261] and parameters: {'p_sma': 49, 'p_std': 25, 'p_atr': 29, 'p_adx': 26, 'rsi_period': 9, 'ema1': 6, 'ema2': 55, 'slip_atr_k': 7.865833066411345e-05, 'slip_spread_k': 0.643673465434011, 'spread_hl_frac': 0.008548589104640611, 'bb_std_mult': 1.3953156946777172, 'rsi_os': 28, 'rsi_ob': 86, 'vol_spike': 0.2046010470374965, 'adx_thresh': 9.808513754940963, 'atr_min_pct': 0.006401263937771881, 'atr_max_pct': 0.10481411684287861, 'tp_mult': 1.556511597057641, 'tsl_mult': 0.09097994955055311, 'strategy': 'breakout', 'time_stop': 154, 'use_sma': False, 'use_atr': False, 'use_adx': True, 'use_ema': False, 'use_spike': False, 'rsi_required': False, 'edge_k': 0.6318032333940808, 'edge_cap': 0.4943953109415066, 'bull_strategy': 'breakout', 'bull_bb_std_mult': 1.7690244137730977, 'bull_rsi_os': 44, 'bull_rsi_ob': 87, 'bull_adx_thresh': 9.978138504736954, 'bull_atr_min_pct': 0.0045132388751150734, 'bull_atr_max_pct': 0.10556705450559313, 'bull_tp_mult': 2.5547157525095545, 'bull_tsl_mult': 0.9028189121434749, 'bull_time_stop': 37, 'bull_use_sma': True, 'bull_use_ema': True, 'bull_use_atr': False, 'bull_use_adx': True, 'bull_use_spike': True, 'bull_rsi_required': False, 'bear_strategy': 'mean_reversion', 'bear_bb_std_mult': 1.7695177814739118, 'bear_rsi_os': 28, 'bear_rsi_ob': 73, 'bear_adx_thresh': 16.33865742634271, 'bear_atr_min_pct': 0.0009737993202242959, 'bear_atr_max_pct': 0.116644183060707, 'bear_tp_mult': 2.4008735235520873, 'bear_tsl_mult': 0.8378862343521746, 'bear_time_stop': 86, 'bear_use_sma': True, 'bear_use_ema': False, 'bear_use_atr': True, 'bear_use_adx': True, 'bear_use_spike': True, 'bear_rsi_required': True, 'sideways_strategy': 'mean_reversion', 'sideways_bb_std_mult': 3.183511100919336, 'sideways_rsi_os': 11, 'sideways_rsi_ob': 47, 'sideways_adx_thresh': 5.613575617276711, 'sideways_atr_min_pct': 0.000439645936688729, 'sideways_atr_max_pct': 0.03476462283389339, 'sideways_tp_mult': 1.236866427198722, 'sideways_tsl_mult': 0.3296049182368228, 'sideways_time_stop': 148, 'sideways_use_sma': True, 'sideways_use_ema': False, 'sideways_use_atr': True, 'sideways_use_adx': True, 'sideways_use_spike': True, 'sideways_rsi_required': True}.
[I 2025-08-30 16:40:53,788] Trial 837 finished with values: [-1000000000.0, 1000000000.0] and parameters: {'p_sma': 34, 'p_std': 11, 'p_atr': 12, 'p_adx': 27, 'rsi_period': 12, 'ema1': 24, 'ema2': 38, 'slip_atr_k': 0.22136612248630705, 'slip_spread_k': 0.7512768614659071, 'spread_hl_frac': 0.008209794495769532, 'bb_std_mult': 0.5040713822308867, 'rsi_os': 47, 'rsi_ob': 86, 'vol_spike': 0.20672632904493354, 'adx_thresh': 8.688409523805356, 'atr_min_pct': 0.005162992756461122, 'atr_max_pct': 0.058707946626645226, 'tp_mult': 1.5273595759028238, 'tsl_mult': 0.8630968496710103, 'strategy': 'breakout', 'time_stop': 167, 'use_sma': False, 'use_atr': False, 'use_adx': True, 'use_ema': False, 'use_spike': False, 'rsi_required': False, 'edge_k': 0.5592516018654362, 'edge_cap': 0.9633761914405999, 'bull_strategy': 'breakout', 'bull_bb_std_mult': 2.317629286495375, 'bull_rsi_os': 47, 'bull_rsi_ob': 58, 'bull_adx_thresh': 9.977758685485275, 'bull_atr_min_pct': 0.019462961060231376, 'bull_atr_max_pct': 0.10164335400215826, 'bull_tp_mult': 2.649238394541223, 'bull_tsl_mult': 0.6502663548064992, 'bull_time_stop': 37, 'bull_use_sma': True, 'bull_use_ema': False, 'bull_use_atr': False, 'bull_use_adx': True, 'bull_use_spike': True, 'bull_rsi_required': False, 'bear_strategy': 'mean_reversion', 'bear_bb_std_mult': 0.6440126318245198, 'bear_rsi_os': 25, 'bear_rsi_ob': 80, 'bear_adx_thresh': 24.61088413455654, 'bear_atr_min_pct': 0.004148337641746578, 'bear_atr_max_pct': 0.10885526183570654, 'bear_tp_mult': 1.9506768630822149, 'bear_tsl_mult': 0.048526385059073196, 'bear_time_stop': 111, 'bear_use_sma': True, 'bear_use_ema': True, 'bear_use_atr': True, 'bear_use_adx': False, 'bear_use_spike': True, 'bear_rsi_required': True, 'sideways_strategy': 'mean_reversion', 'sideways_bb_std_mult': 3.1800910344290094, 'sideways_rsi_os': 11, 'sideways_rsi_ob': 78, 'sideways_adx_thresh': 10.697498885786247, 'sideways_atr_min_pct': 0.01777262315279739, 'sideways_atr_max_pct': 0.06656765579904166, 'sideways_tp_mult': 1.4562729385330424, 'sideways_tsl_mult': 0.3665070792041796, 'sideways_time_stop': 162, 'sideways_use_sma': True, 'sideways_use_ema': False, 'sideways_use_atr': False, 'sideways_use_adx': True, 'sideways_use_spike': True, 'sideways_rsi_required': True}.
[I 2025-08-30 16:40:54,285] Trial 835 finished with values: [-0.017314587988765395, 0.017287546762244185] and parameters: {'p_sma': 12, 'p_std': 11, 'p_atr': 12, 'p_adx': 23, 'rsi_period': 9, 'ema1': 30, 'ema2': 26, 'slip_atr_k': 0.1680527539483642, 'slip_spread_k': 0.752814503123912, 'spread_hl_frac': 0.009442000296795466, 'bb_std_mult': 1.4754688712693036, 'rsi_os': 25, 'rsi_ob': 86, 'vol_spike': 0.20352342031146015, 'adx_thresh': 9.955685471433062, 'atr_min_pct': 0.006167032153948667, 'atr_max_pct': 0.10623948583839699, 'tp_mult': 1.6440320864677447, 'tsl_mult': 0.3582070364481432, 'strategy': 'breakout', 'time_stop': 205, 'use_sma': False, 'use_atr': False, 'use_adx': True, 'use_ema': False, 'use_spike': False, 'rsi_required': False, 'edge_k': 0.6007401696352105, 'edge_cap': 0.9677140322462947, 'bull_strategy': 'breakout', 'bull_bb_std_mult': 1.739288886785764, 'bull_rsi_os': 44, 'bull_rsi_ob': 87, 'bull_adx_thresh': 27.72537262004901, 'bull_atr_min_pct': 0.00692491766352357, 'bull_atr_max_pct': 0.1072826614863866, 'bull_tp_mult': 2.5253442349549045, 'bull_tsl_mult': 0.15733457818429913, 'bull_time_stop': 55, 'bull_use_sma': True, 'bull_use_ema': False, 'bull_use_atr': False, 'bull_use_adx': True, 'bull_use_spike': True, 'bull_rsi_required': False, 'bear_strategy': 'mean_reversion', 'bear_bb_std_mult': 1.0342590890329169, 'bear_rsi_os': 32, 'bear_rsi_ob': 73, 'bear_adx_thresh': 24.685140030722586, 'bear_atr_min_pct': 0.0007543384278167864, 'bear_atr_max_pct': 0.10979778187803566, 'bear_tp_mult': 1.2512941359281011, 'bear_tsl_mult': 0.838956243630074, 'bear_time_stop': 299, 'bear_use_sma': True, 'bear_use_ema': True, 'bear_use_atr': True, 'bear_use_adx': False, 'bear_use_spike': True, 'bear_rsi_required': True, 'sideways_strategy': 'mean_reversion', 'sideways_bb_std_mult': 3.1802090317391163, 'sideways_rsi_os': 55, 'sideways_rsi_ob': 78, 'sideways_adx_thresh': 24.793347735373587, 'sideways_atr_min_pct': 0.004050300127094042, 'sideways_atr_max_pct': 0.033926508949454114, 'sideways_tp_mult': 1.2684038853613653, 'sideways_tsl_mult': 0.8921700028611965, 'sideways_time_stop': 144, 'sideways_use_sma': True, 'sideways_use_ema': False, 'sideways_use_atr': False, 'sideways_use_adx': True, 'sideways_use_spike': True, 'sideways_rsi_required': True}.
