[I 2025-08-30 15:41:41,576] Trial 531 finished with values: [-1000000000.0, 1000000000.0] and parameters: {'p_sma': 57, 'p_std': 20, 'p_atr': 13, 'p_adx': 25, 'rsi_period': 10, 'ema1': 23, 'ema2': 16, 'slip_atr_k': 0.10872873253940671, 'slip_spread_k': 0.7408352110057429, 'spread_hl_frac': 0.043507097567363526, 'bb_std_mult': 0.5524550831217167, 'rsi_os': 31, 'rsi_ob': 87, 'vol_spike': 0.21837890682412966, 'adx_thresh': 26.19198841128896, 'atr_min_pct': 0.026791306566954783, 'atr_max_pct': 0.0570899024320603, 'tp_mult': 1.5568507788265544, 'tsl_mult': 0.8970218786279776, 'strategy': 'breakout', 'time_stop': 29, 'use_sma': True, 'use_atr': False, 'use_adx': False, 'use_ema': False, 'use_spike': False, 'rsi_required': False, 'edge_k': 0.6056469855254306, 'edge_cap': 0.9993094139846491, 'bull_strategy': 'breakout', 'bull_bb_std_mult': 1.525988585943727, 'bull_rsi_os': 7, 'bull_rsi_ob': 87, 'bull_adx_thresh': 8.350637194088156, 'bull_atr_min_pct': 0.020787691307244345, 'bull_atr_max_pct': 0.1496948982267317, 'bull_tp_mult': 2.523787182302385, 'bull_tsl_mult': 0.8811796782872474, 'bull_time_stop': 262, 'bull_use_sma': True, 'bull_use_ema': True, 'bull_use_atr': True, 'bull_use_adx': True, 'bull_use_spike': True, 'bull_rsi_required': False, 'bear_strategy': 'mean_reversion', 'bear_bb_std_mult': 1.7724893056190352, 'bear_rsi_os': 23, 'bear_rsi_ob': 49, 'bear_adx_thresh': 14.248404058218247, 'bear_atr_min_pct': 0.009179375357987258, 'bear_atr_max_pct': 0.06305648610789151, 'bear_tp_mult': 2.698939714976596, 'bear_tsl_mult': 0.8154615898566678, 'bear_time_stop': 97, 'bear_use_sma': True, 'bear_use_ema': False, 'bear_use_atr': True, 'bear_use_adx': True, 'bear_use_spike': True, 'bear_rsi_required': True, 'sideways_strategy': 'mean_reversion', 'sideways_bb_std_mult': 2.994479280265427, 'sideways_rsi_os': 13, 'sideways_rsi_ob': 82, 'sideways_adx_thresh': 27.974416962688153, 'sideways_atr_min_pct': 0.02066248134890327, 'sideways_atr_max_pct': 0.06443843380037306, 'sideways_tp_mult': 1.304994298675531, 'sideways_tsl_mult': 0.3855340117096776, 'sideways_time_stop': 9, 'sideways_use_sma': True, 'sideways_use_ema': False, 'sideways_use_atr': True, 'sideways_use_adx': False, 'sideways_use_spike': True, 'sideways_rsi_required': True}.
[I 2025-08-30 15:41:43,001] Trial 532 finished with values: [-1000000000.0, 1000000000.0] and parameters: {'p_sma': 6, 'p_std': 20, 'p_atr': 11, 'p_adx': 24, 'rsi_period': 82, 'ema1': 23, 'ema2': 43, 'slip_atr_k': 0.008882032195601576, 'slip_spread_k': 0.6031668609305099, 'spread_hl_frac': 0.035377016596089064, 'bb_std_mult': 0.5045835954040214, 'rsi_os': 39, 'rsi_ob': 45, 'vol_spike': 0.21845518065803088, 'adx_thresh': 5.462979729576059, 'atr_min_pct': 0.00611253713631678, 'atr_max_pct': 0.11364484363985249, 'tp_mult': 1.4808845508084103, 'tsl_mult': 0.7344526620909969, 'strategy': 'breakout', 'time_stop': 29, 'use_sma': True, 'use_atr': False, 'use_adx': False, 'use_ema': False, 'use_spike': False, 'rsi_required': False, 'edge_k': 0.6085935443493521, 'edge_cap': 0.951211912282859, 'bull_strategy': 'breakout', 'bull_bb_std_mult': 1.044772569169336, 'bull_rsi_os': 17, 'bull_rsi_ob': 87, 'bull_adx_thresh': 9.475786825197039, 'bull_atr_min_pct': 0.02072074733915885, 'bull_atr_max_pct': 0.11045924969692032, 'bull_tp_mult': 2.558352084381266, 'bull_tsl_mult': 0.868893779649799, 'bull_time_stop': 195, 'bull_use_sma': True, 'bull_use_ema': True, 'bull_use_atr': True, 'bull_use_adx': True, 'bull_use_spike': True, 'bull_rsi_required': False, 'bear_strategy': 'mean_reversion', 'bear_bb_std_mult': 1.7860098719970914, 'bear_rsi_os': 24, 'bear_rsi_ob': 78, 'bear_adx_thresh': 14.002406618299911, 'bear_atr_min_pct': 0.0036972132248176094, 'bear_atr_max_pct': 0.11360808765860338, 'bear_tp_mult': 2.7033527379125943, 'bear_tsl_mult': 0.8358616172177123, 'bear_time_stop': 101, 'bear_use_sma': True, 'bear_use_ema': False, 'bear_use_atr': True, 'bear_use_adx': True, 'bear_use_spike': True, 'bear_rsi_required': True, 'sideways_strategy': 'mean_reversion', 'sideways_bb_std_mult': 3.249583790028359, 'sideways_rsi_os': 18, 'sideways_rsi_ob': 80, 'sideways_adx_thresh': 11.593617848982387, 'sideways_atr_min_pct': 0.020521662605893557, 'sideways_atr_max_pct': 0.07256860334019735, 'sideways_tp_mult': 1.3264434269442171, 'sideways_tsl_mult': 0.38273198680477494, 'sideways_time_stop': 120, 'sideways_use_sma': True, 'sideways_use_ema': False, 'sideways_use_atr': True, 'sideways_use_adx': False, 'sideways_use_spike': True, 'sideways_rsi_required': True}.
[I 2025-08-30 15:41:43,554] Trial 533 finished with values: [-1000000000.0, 1000000000.0] and parameters: {'p_sma': 6, 'p_std': 20, 'p_atr': 30, 'p_adx': 25, 'rsi_period': 10, 'ema1': 23, 'ema2': 43, 'slip_atr_k': 0.24186465036046906, 'slip_spread_k': 0.7328959233722437, 'spread_hl_frac': 0.030372839918061854, 'bb_std_mult': 0.5001774256527157, 'rsi_os': 55, 'rsi_ob': 87, 'vol_spike': 0.05842661133937066, 'adx_thresh': 5.259743531448503, 'atr_min_pct': 0.027225809975766985, 'atr_max_pct': 0.11392926047271149, 'tp_mult': 1.51312580155801, 'tsl_mult': 0.3523528978873641, 'strategy': 'breakout', 'time_stop': 29, 'use_sma': True, 'use_atr': False, 'use_adx': False, 'use_ema': False, 'use_spike': False, 'rsi_required': False, 'edge_k': 0.8462082129468271, 'edge_cap': 0.9388693249510782, 'bull_strategy': 'breakout', 'bull_bb_std_mult': 1.519735577988301, 'bull_rsi_os': 48, 'bull_rsi_ob': 87, 'bull_adx_thresh': 6.002283076573438, 'bull_atr_min_pct': 0.019605286669750806, 'bull_atr_max_pct': 0.10719872376718616, 'bull_tp_mult': 2.514562526927727, 'bull_tsl_mult': 0.8787145007958415, 'bull_time_stop': 198, 'bull_use_sma': True, 'bull_use_ema': True, 'bull_use_atr': True, 'bull_use_adx': True, 'bull_use_spike': True, 'bull_rsi_required': False, 'bear_strategy': 'mean_reversion', 'bear_bb_std_mult': 1.973435580612086, 'bear_rsi_os': 16, 'bear_rsi_ob': 76, 'bear_adx_thresh': 13.97357020358622, 'bear_atr_min_pct': 0.01716252305172944, 'bear_atr_max_pct': 0.11486778750350075, 'bear_tp_mult': 1.235006729684604, 'bear_tsl_mult': 0.40446757445790416, 'bear_time_stop': 101, 'bear_use_sma': True, 'bear_use_ema': False, 'bear_use_atr': True, 'bear_use_adx': True, 'bear_use_spike': True, 'bear_rsi_required': True, 'sideways_strategy': 'mean_reversion', 'sideways_bb_std_mult': 1.6821543850979315, 'sideways_rsi_os': 18, 'sideways_rsi_ob': 77, 'sideways_adx_thresh': 28.09074794032972, 'sideways_atr_min_pct': 0.0012277710765757725, 'sideways_atr_max_pct': 0.0645151702407048, 'sideways_tp_mult': 1.8421019916743036, 'sideways_tsl_mult': 0.3749917897011489, 'sideways_time_stop': 120, 'sideways_use_sma': True, 'sideways_use_ema': False, 'sideways_use_atr': True, 'sideways_use_adx': False, 'sideways_use_spike': True, 'sideways_rsi_required': True}.
[I 2025-08-30 15:41:44,407] Trial 534 finished with values: [-1000000000.0, 1000000000.0] and parameters: {'p_sma': 6, 'p_std': 42, 'p_atr': 22, 'p_adx': 25, 'rsi_period': 34, 'ema1': 30, 'ema2': 36, 'slip_atr_k': 0.11336765953581228, 'slip_spread_k': 0.7315987426851388, 'spread_hl_frac': 0.006136218188653955, 'bb_std_mult': 0.5104863111518552, 'rsi_os': 27, 'rsi_ob': 87, 'vol_spike': 0.2172514205055508, 'adx_thresh': 10.241037623827399, 'atr_min_pct': 0.006112496885079684, 'atr_max_pct': 0.11393714611010354, 'tp_mult': 1.504752553883182, 'tsl_mult': 0.3512604126884675, 'strategy': 'breakout', 'time_stop': 114, 'use_sma': True, 'use_atr': False, 'use_adx': False, 'use_ema': False, 'use_spike': True, 'rsi_required': False, 'edge_k': 0.5972306650286308, 'edge_cap': 0.9434789699345093, 'bull_strategy': 'breakout', 'bull_bb_std_mult': 1.5094635501433753, 'bull_rsi_os': 11, 'bull_rsi_ob': 87, 'bull_adx_thresh': 9.702160312598233, 'bull_atr_min_pct': 0.029058400356673886, 'bull_atr_max_pct': 0.10569234797886722, 'bull_tp_mult': 2.1398850685820583, 'bull_tsl_mult': 0.8784514009615797, 'bull_time_stop': 59, 'bull_use_sma': True, 'bull_use_ema': True, 'bull_use_atr': True, 'bull_use_adx': True, 'bull_use_spike': True, 'bull_rsi_required': False, 'bear_strategy': 'mean_reversion', 'bear_bb_std_mult': 1.96188117883547, 'bear_rsi_os': 24, 'bear_rsi_ob': 76, 'bear_adx_thresh': 20.635508808404875, 'bear_atr_min_pct': 0.015393200315214971, 'bear_atr_max_pct': 0.11247877084085435, 'bear_tp_mult': 2.6872759970680256, 'bear_tsl_mult': 0.40539526472808013, 'bear_time_stop': 97, 'bear_use_sma': True, 'bear_use_ema': False, 'bear_use_atr': True, 'bear_use_adx': True, 'bear_use_spike': True, 'bear_rsi_required': True, 'sideways_strategy': 'mean_reversion', 'sideways_bb_std_mult': 3.2520464061104093, 'sideways_rsi_os': 20, 'sideways_rsi_ob': 84, 'sideways_adx_thresh': 32.581910770652975, 'sideways_atr_min_pct': 0.020539370197646498, 'sideways_atr_max_pct': 0.06480093911229669, 'sideways_tp_mult': 1.5498925481100208, 'sideways_tsl_mult': 0.3881046742362644, 'sideways_time_stop': 126, 'sideways_use_sma': True, 'sideways_use_ema': False, 'sideways_use_atr': True, 'sideways_use_adx': False, 'sideways_use_spike': True, 'sideways_rsi_required': True}.
[I 2025-08-30 15:41:45,771] Trial 535 finished with values: [-1000000000.0, 1000000000.0] and parameters: {'p_sma': 8, 'p_std': 24, 'p_atr': 11, 'p_adx': 24, 'rsi_period': 9, 'ema1': 30, 'ema2': 43, 'slip_atr_k': 0.11732315425177739, 'slip_spread_k': 0.7127720846627692, 'spread_hl_frac': 0.006611100700949602, 'bb_std_mult': 1.5132592554353206, 'rsi_os': 27, 'rsi_ob': 49, 'vol_spike': 0.22746856075420185, 'adx_thresh': 18.873575766810873, 'atr_min_pct': 0.015183202323814694, 'atr_max_pct': 0.11357396581607432, 'tp_mult': 1.49496703292874, 'tsl_mult': 0.35020976914700624, 'strategy': 'mean_reversion', 'time_stop': 114, 'use_sma': True, 'use_atr': False, 'use_adx': True, 'use_ema': True, 'use_spike': True, 'rsi_required': False, 'edge_k': 0.5246664339123635, 'edge_cap': 0.9367890997116473, 'bull_strategy': 'mean_reversion', 'bull_bb_std_mult': 2.226015495402571, 'bull_rsi_os': 15, 'bull_rsi_ob': 89, 'bull_adx_thresh': 5.852070217405151, 'bull_atr_min_pct': 0.01955728306775168, 'bull_atr_max_pct': 0.10563765793673771, 'bull_tp_mult': 2.5565148866250653, 'bull_tsl_mult': 0.8759231097022919, 'bull_time_stop': 195, 'bull_use_sma': False, 'bull_use_ema': True, 'bull_use_atr': False, 'bull_use_adx': True, 'bull_use_spike': False, 'bull_rsi_required': False, 'bear_strategy': 'breakout', 'bear_bb_std_mult': 1.9506907404344827, 'bear_rsi_os': 26, 'bear_rsi_ob': 76, 'bear_adx_thresh': 20.607014836545513, 'bear_atr_min_pct': 0.0016821340582901445, 'bear_atr_max_pct': 0.11404068315116424, 'bear_tp_mult': 2.6857517106500324, 'bear_tsl_mult': 0.09103739154473989, 'bear_time_stop': 50, 'bear_use_sma': True, 'bear_use_ema': False, 'bear_use_atr': True, 'bear_use_adx': True, 'bear_use_spike': False, 'bear_rsi_required': True, 'sideways_strategy': 'mean_reversion', 'sideways_bb_std_mult': 2.685252945917425, 'sideways_rsi_os': 8, 'sideways_rsi_ob': 85, 'sideways_adx_thresh': 10.678365795759749, 'sideways_atr_min_pct': 0.001224191654989307, 'sideways_atr_max_pct': 0.037501125240770955, 'sideways_tp_mult': 1.4833051110634292, 'sideways_tsl_mult': 0.5232896226864682, 'sideways_time_stop': 198, 'sideways_use_sma': True, 'sideways_use_ema': False, 'sideways_use_atr': True, 'sideways_use_adx': False, 'sideways_use_spike': False, 'sideways_rsi_required': True}.
[I 2025-08-30 15:41:46,031] Trial 536 finished with values: [-1000000000.0, 1000000000.0] and parameters: {'p_sma': 8, 'p_std': 24, 'p_atr': 13, 'p_adx': 26, 'rsi_period': 9, 'ema1': 24, 'ema2': 36, 'slip_atr_k': 0.004750757964233596, 'slip_spread_k': 0.021486278493075328, 'spread_hl_frac': 0.028509715958786996, 'bb_std_mult': 2.4824144682053735, 'rsi_os': 27, 'rsi_ob': 49, 'vol_spike': 0.22886368806484608, 'adx_thresh': 31.705089578566465, 'atr_min_pct': 0.006780171352619661, 'atr_max_pct': 0.10638950181802048, 'tp_mult': 2.869040625867073, 'tsl_mult': 0.38602603253735496, 'strategy': 'mean_reversion', 'time_stop': 5, 'use_sma': False, 'use_atr': False, 'use_adx': True, 'use_ema': True, 'use_spike': True, 'rsi_required': True, 'edge_k': 0.5291262978858138, 'edge_cap': 0.08820743320377927, 'bull_strategy': 'mean_reversion', 'bull_bb_std_mult': 1.6499077308223873, 'bull_rsi_os': 49, 'bull_rsi_ob': 56, 'bull_adx_thresh': 9.749133331592093, 'bull_atr_min_pct': 0.019644026568907375, 'bull_atr_max_pct': 0.010680149854282048, 'bull_tp_mult': 2.581563501255039, 'bull_tsl_mult': 0.8329595890114233, 'bull_time_stop': 63, 'bull_use_sma': False, 'bull_use_ema': True, 'bull_use_atr': False, 'bull_use_adx': True, 'bull_use_spike': False, 'bull_rsi_required': True, 'bear_strategy': 'breakout', 'bear_bb_std_mult': 1.9316440992182886, 'bear_rsi_os': 53, 'bear_rsi_ob': 77, 'bear_adx_thresh': 16.108225551735472, 'bear_atr_min_pct': 0.015046954124933168, 'bear_atr_max_pct': 0.05573581709814204, 'bear_tp_mult': 2.6756198350429288, 'bear_tsl_mult': 0.8762021732276538, 'bear_time_stop': 86, 'bear_use_sma': True, 'bear_use_ema': False, 'bear_use_atr': True, 'bear_use_adx': True, 'bear_use_spike': False, 'bear_rsi_required': False, 'sideways_strategy': 'breakout', 'sideways_bb_std_mult': 3.046891433273922, 'sideways_rsi_os': 20, 'sideways_rsi_ob': 85, 'sideways_adx_thresh': 10.523923711124622, 'sideways_atr_min_pct': 0.018758018204836073, 'sideways_atr_max_pct': 0.11992517659705798, 'sideways_tp_mult': 1.543779315511945, 'sideways_tsl_mult': 0.7118341943551765, 'sideways_time_stop': 141, 'sideways_use_sma': False, 'sideways_use_ema': True, 'sideways_use_atr': True, 'sideways_use_adx': True, 'sideways_use_spike': False, 'sideways_rsi_required': True}.
[I 2025-08-30 15:42:43,299] Trial 539 finished with values: [-1000000000.0, 1000000000.0] and parameters: {'p_sma': 8, 'p_std': 22, 'p_atr': 13, 'p_adx': 12, 'rsi_period': 8, 'ema1': 24, 'ema2': 39, 'slip_atr_k': 0.006429602574867886, 'slip_spread_k': 0.674173643908479, 'spread_hl_frac': 0.008238130710680011, 'bb_std_mult': 0.761777798462608, 'rsi_os': 28, 'rsi_ob': 75, 'vol_spike': 0.20324595655765687, 'adx_thresh': 31.342536127893027, 'atr_min_pct': 0.020128014164871973, 'atr_max_pct': 0.10599841670618264, 'tp_mult': 1.5597562036282635, 'tsl_mult': 0.3773258290591055, 'strategy': 'mean_reversion', 'time_stop': 163, 'use_sma': False, 'use_atr': True, 'use_adx': True, 'use_ema': True, 'use_spike': False, 'rsi_required': True, 'edge_k': 1.4267723159840455, 'edge_cap': 0.05115868000831797, 'bull_strategy': 'mean_reversion', 'bull_bb_std_mult': 1.644463552649586, 'bull_rsi_os': 49, 'bull_rsi_ob': 58, 'bull_adx_thresh': 10.886192300003813, 'bull_atr_min_pct': 0.019792116078158978, 'bull_atr_max_pct': 0.0964407682188994, 'bull_tp_mult': 2.620491682853328, 'bull_tsl_mult': 0.8313024799048917, 'bull_time_stop': 64, 'bull_use_sma': False, 'bull_use_ema': False, 'bull_use_atr': False, 'bull_use_adx': True, 'bull_use_spike': False, 'bull_rsi_required': True, 'bear_strategy': 'breakout', 'bear_bb_std_mult': 1.9276580086220152, 'bear_rsi_os': 26, 'bear_rsi_ob': 75, 'bear_adx_thresh': 19.478444604499494, 'bear_atr_min_pct': 0.002472115049491951, 'bear_atr_max_pct': 0.10253017395327449, 'bear_tp_mult': 2.634197265899989, 'bear_tsl_mult': 0.8652607628492979, 'bear_time_stop': 89, 'bear_use_sma': False, 'bear_use_ema': True, 'bear_use_atr': False, 'bear_use_adx': False, 'bear_use_spike': False, 'bear_rsi_required': False, 'sideways_strategy': 'breakout', 'sideways_bb_std_mult': 3.1266099476752753, 'sideways_rsi_os': 10, 'sideways_rsi_ob': 95, 'sideways_adx_thresh': 12.36006904255805, 'sideways_atr_min_pct': 0.018879365040025124, 'sideways_atr_max_pct': 0.07301467218926667, 'sideways_tp_mult': 1.4039101129072693, 'sideways_tsl_mult': 0.35143927561609106, 'sideways_time_stop': 141, 'sideways_use_sma': False, 'sideways_use_ema': True, 'sideways_use_atr': True, 'sideways_use_adx': True, 'sideways_use_spike': False, 'sideways_rsi_required': False}.
[I 2025-08-30 15:42:44,209] Trial 540 finished with values: [-1000000000.0, 1000000000.0] and parameters: {'p_sma': 5, 'p_std': 22, 'p_atr': 24, 'p_adx': 26, 'rsi_period': 71, 'ema1': 7, 'ema2': 38, 'slip_atr_k': 0.005141960459995108, 'slip_spread_k': 0.8282141944337291, 'spread_hl_frac': 0.006869089812127335, 'bb_std_mult': 0.6280771840667292, 'rsi_os': 29, 'rsi_ob': 51, 'vol_spike': 0.016010632790683182, 'adx_thresh': 7.958639265839134, 'atr_min_pct': 0.006741891889401479, 'atr_max_pct': 0.11663379962684087, 'tp_mult': 2.7927793657699596, 'tsl_mult': 0.4029110089852767, 'strategy': 'breakout', 'time_stop': 164, 'use_sma': False, 'use_atr': True, 'use_adx': True, 'use_ema': False, 'use_spike': False, 'rsi_required': True, 'edge_k': 1.4876548073772626, 'edge_cap': 0.20339119682328932, 'bull_strategy': 'breakout', 'bull_bb_std_mult': 2.1322016453489794, 'bull_rsi_os': 51, 'bull_rsi_ob': 53, 'bull_adx_thresh': 15.318029785201588, 'bull_atr_min_pct': 0.018547354739635265, 'bull_atr_max_pct': 0.1017570467095694, 'bull_tp_mult': 2.6228384075412725, 'bull_tsl_mult': 0.8961082831244256, 'bull_time_stop': 187, 'bull_use_sma': True, 'bull_use_ema': False, 'bull_use_atr': True, 'bull_use_adx': True, 'bull_use_spike': True, 'bull_rsi_required': True, 'bear_strategy': 'mean_reversion', 'bear_bb_std_mult': 1.8971816207710868, 'bear_rsi_os': 26, 'bear_rsi_ob': 75, 'bear_adx_thresh': 14.776528472601148, 'bear_atr_min_pct': 0.002509533747145191, 'bear_atr_max_pct': 0.10239850410116456, 'bear_tp_mult': 2.6272575193657386, 'bear_tsl_mult': 0.8588385177505379, 'bear_time_stop': 88, 'bear_use_sma': False, 'bear_use_ema': True, 'bear_use_atr': False, 'bear_use_adx': False, 'bear_use_spike': True, 'bear_rsi_required': False, 'sideways_strategy': 'mean_reversion', 'sideways_bb_std_mult': 3.1348304434789065, 'sideways_rsi_os': 14, 'sideways_rsi_ob': 92, 'sideways_adx_thresh': 9.652148741918829, 'sideways_atr_min_pct': 0.019324216654851428, 'sideways_atr_max_pct': 0.1352642503464315, 'sideways_tp_mult': 1.4178966441124352, 'sideways_tsl_mult': 0.3442755765092695, 'sideways_time_stop': 261, 'sideways_use_sma': True, 'sideways_use_ema': False, 'sideways_use_atr': True, 'sideways_use_adx': True, 'sideways_use_spike': True, 'sideways_rsi_required': False}.
[I 2025-08-30 15:42:44,995] Trial 537 finished with values: [-1000000000.0, 1000000000.0] and parameters: {'p_sma': 8, 'p_std': 22, 'p_atr': 13, 'p_adx': 26, 'rsi_period': 84, 'ema1': 30, 'ema2': 36, 'slip_atr_k': 0.0565287474336357, 'slip_spread_k': 0.024188596759265435, 'spread_hl_frac': 0.006665771543343564, 'bb_std_mult': 0.6311203562653617, 'rsi_os': 27, 'rsi_ob': 85, 'vol_spike': 0.2281557116878755, 'adx_thresh': 31.50531399416535, 'atr_min_pct': 0.020397011729109946, 'atr_max_pct': 0.12560136378732983, 'tp_mult': 1.0917639512668158, 'tsl_mult': 0.7034272618105442, 'strategy': 'mean_reversion', 'time_stop': 61, 'use_sma': False, 'use_atr': False, 'use_adx': True, 'use_ema': True, 'use_spike': True, 'rsi_required': True, 'edge_k': 0.5242666392992724, 'edge_cap': 0.05626253359237399, 'bull_strategy': 'mean_reversion', 'bull_bb_std_mult': 1.6597432501460485, 'bull_rsi_os': 51, 'bull_rsi_ob': 53, 'bull_adx_thresh': 10.019002035255442, 'bull_atr_min_pct': 0.028796484877693804, 'bull_atr_max_pct': 0.10540212624084928, 'bull_tp_mult': 2.5754780501009376, 'bull_tsl_mult': 0.8349845612962887, 'bull_time_stop': 57, 'bull_use_sma': False, 'bull_use_ema': True, 'bull_use_atr': False, 'bull_use_adx': True, 'bull_use_spike': False, 'bull_rsi_required': True, 'bear_strategy': 'breakout', 'bear_bb_std_mult': 1.9621875209939843, 'bear_rsi_os': 26, 'bear_rsi_ob': 77, 'bear_adx_thresh': 15.842027426493814, 'bear_atr_min_pct': 0.015416448611625952, 'bear_atr_max_pct': 0.11138167572833461, 'bear_tp_mult': 2.6826308522669104, 'bear_tsl_mult': 0.9505649383902811, 'bear_time_stop': 93, 'bear_use_sma': True, 'bear_use_ema': False, 'bear_use_atr': True, 'bear_use_adx': True, 'bear_use_spike': False, 'bear_rsi_required': False, 'sideways_strategy': 'breakout', 'sideways_bb_std_mult': 3.1360771033083985, 'sideways_rsi_os': 20, 'sideways_rsi_ob': 92, 'sideways_adx_thresh': 32.71159022796843, 'sideways_atr_min_pct': 0.019738607215664696, 'sideways_atr_max_pct': 0.11787165608084091, 'sideways_tp_mult': 1.0989471211974549, 'sideways_tsl_mult': 0.3983510331954433, 'sideways_time_stop': 134, 'sideways_use_sma': False, 'sideways_use_ema': True, 'sideways_use_atr': True, 'sideways_use_adx': True, 'sideways_use_spike': False, 'sideways_rsi_required': True}.
