[I 2025-08-30 16:15:49,467] Trial 702 finished with values: [-1000000000.0, 1000000000.0] and parameters: {'p_sma': 7, 'p_std': 22, 'p_atr': 25, 'p_adx': 26, 'rsi_period': 11, 'ema1': 19, 'ema2': 36, 'slip_atr_k': 0.00400708484393996, 'slip_spread_k': 0.779037185363842, 'spread_hl_frac': 0.004298042308283316, 'bb_std_mult': 0.5899038957401821, 'rsi_os': 41, 'rsi_ob': 80, 'vol_spike': 0.21598729098169858, 'adx_thresh': 9.34086672002135, 'atr_min_pct': 0.005358027462161196, 'atr_max_pct': 0.050262132729175485, 'tp_mult': 1.1298110860895187, 'tsl_mult': 0.8081411301642278, 'strategy': 'breakout', 'time_stop': 16, 'use_sma': True, 'use_atr': True, 'use_adx': False, 'use_ema': True, 'use_spike': True, 'rsi_required': False, 'edge_k': 1.0473775434881771, 'edge_cap': 0.5879436825397993, 'bull_strategy': 'mean_reversion', 'bull_bb_std_mult': 3.116568024841185, 'bull_rsi_os': 50, 'bull_rsi_ob': 88, 'bull_adx_thresh': 26.61888468962171, 'bull_atr_min_pct': 0.008426847315169815, 'bull_atr_max_pct': 0.10799596145480753, 'bull_tp_mult': 2.5960272504227517, 'bull_tsl_mult': 0.2552655634172685, 'bull_time_stop': 46, 'bull_use_sma': True, 'bull_use_ema': True, 'bull_use_atr': False, 'bull_use_adx': True, 'bull_use_spike': False, 'bull_rsi_required': False, 'bear_strategy': 'breakout', 'bear_bb_std_mult': 2.748120158323945, 'bear_rsi_os': 11, 'bear_rsi_ob': 48, 'bear_adx_thresh': 20.573514109403128, 'bear_atr_min_pct': 0.005954328044429583, 'bear_atr_max_pct': 0.027835707357820948, 'bear_tp_mult': 1.1523558388066135, 'bear_tsl_mult': 0.8634697524652443, 'bear_time_stop': 130, 'bear_use_sma': True, 'bear_use_ema': False, 'bear_use_atr': False, 'bear_use_adx': True, 'bear_use_spike': True, 'bear_rsi_required': True, 'sideways_strategy': 'mean_reversion', 'sideways_bb_std_mult': 3.170476288604343, 'sideways_rsi_os': 44, 'sideways_rsi_ob': 79, 'sideways_adx_thresh': 9.406059727529165, 'sideways_atr_min_pct': 0.016222592361047374, 'sideways_atr_max_pct': 0.06916501010139907, 'sideways_tp_mult': 1.182558456762801, 'sideways_tsl_mult': 0.040593832437551214, 'sideways_time_stop': 149, 'sideways_use_sma': True, 'sideways_use_ema': False, 'sideways_use_atr': True, 'sideways_use_adx': False, 'sideways_use_spike': True, 'sideways_rsi_required': True}.
[I 2025-08-30 16:15:50,462] Trial 703 finished with values: [-1000000000.0, 1000000000.0] and parameters: {'p_sma': 7, 'p_std': 22, 'p_atr': 11, 'p_adx': 26, 'rsi_period': 10, 'ema1': 25, 'ema2': 55, 'slip_atr_k': 0.004066545410498264, 'slip_spread_k': 0.7958026571066926, 'spread_hl_frac': 0.005170652243380511, 'bb_std_mult': 1.9524986547875829, 'rsi_os': 51, 'rsi_ob': 69, 'vol_spike': 0.20555693278248138, 'adx_thresh': 9.283507412091296, 'atr_min_pct': 0.005746103654532684, 'atr_max_pct': 0.11406850938148984, 'tp_mult': 1.044085413766353, 'tsl_mult': 0.8112821135587304, 'strategy': 'breakout', 'time_stop': 87, 'use_sma': False, 'use_atr': False, 'use_adx': True, 'use_ema': True, 'use_spike': False, 'rsi_required': False, 'edge_k': 1.9592558988373185, 'edge_cap': 0.5759476631794544, 'bull_strategy': 'mean_reversion', 'bull_bb_std_mult': 1.870581276797117, 'bull_rsi_os': 20, 'bull_rsi_ob': 88, 'bull_adx_thresh': 9.265008997694782, 'bull_atr_min_pct': 0.01874247045795759, 'bull_atr_max_pct': 0.10848380226630941, 'bull_tp_mult': 2.786541777448239, 'bull_tsl_mult': 0.44597452228451623, 'bull_time_stop': 46, 'bull_use_sma': True, 'bull_use_ema': True, 'bull_use_atr': False, 'bull_use_adx': True, 'bull_use_spike': False, 'bull_rsi_required': False, 'bear_strategy': 'breakout', 'bear_bb_std_mult': 1.0805288862628202, 'bear_rsi_os': 37, 'bear_rsi_ob': 48, 'bear_adx_thresh': 14.796905042137974, 'bear_atr_min_pct': 0.006120626121905793, 'bear_atr_max_pct': 0.11721439028834299, 'bear_tp_mult': 1.1541625187040465, 'bear_tsl_mult': 0.8681738140692219, 'bear_time_stop': 131, 'bear_use_sma': True, 'bear_use_ema': False, 'bear_use_atr': True, 'bear_use_adx': True, 'bear_use_spike': True, 'bear_rsi_required': True, 'sideways_strategy': 'mean_reversion', 'sideways_bb_std_mult': 3.168317527374856, 'sideways_rsi_os': 6, 'sideways_rsi_ob': 78, 'sideways_adx_thresh': 30.798097635288606, 'sideways_atr_min_pct': 0.016432052014379157, 'sideways_atr_max_pct': 0.06244712285327345, 'sideways_tp_mult': 1.4456620437240675, 'sideways_tsl_mult': 0.40459574573649376, 'sideways_time_stop': 252, 'sideways_use_sma': True, 'sideways_use_ema': False, 'sideways_use_atr': True, 'sideways_use_adx': True, 'sideways_use_spike': True, 'sideways_rsi_required': True}.
[I 2025-08-30 16:15:51,485] Trial 705 finished with values: [-1000000000.0, 1000000000.0] and parameters: {'p_sma': 11, 'p_std': 20, 'p_atr': 22, 'p_adx': 26, 'rsi_period': 9, 'ema1': 18, 'ema2': 40, 'slip_atr_k': 0.04086531417153787, 'slip_spread_k': 0.6958019854994408, 'spread_hl_frac': 0.004341401588548777, 'bb_std_mult': 1.2791761955103522, 'rsi_os': 55, 'rsi_ob': 85, 'vol_spike': 0.20490154913020672, 'adx_thresh': 9.577729628999515, 'atr_min_pct': 0.005829072380271365, 'atr_max_pct': 0.11159124550304209, 'tp_mult': 1.4421675383371024, 'tsl_mult': 0.3062071457621026, 'strategy': 'breakout', 'time_stop': 34, 'use_sma': False, 'use_atr': True, 'use_adx': False, 'use_ema': True, 'use_spike': True, 'rsi_required': False, 'edge_k': 0.5329251682533573, 'edge_cap': 0.10454842259646596, 'bull_strategy': 'mean_reversion', 'bull_bb_std_mult': 1.8727753161289977, 'bull_rsi_os': 46, 'bull_rsi_ob': 89, 'bull_adx_thresh': 12.100320125021733, 'bull_atr_min_pct': 0.018707271871728385, 'bull_atr_max_pct': 0.11994210375624603, 'bull_tp_mult': 2.1700491098383563, 'bull_tsl_mult': 0.11547278801010097, 'bull_time_stop': 50, 'bull_use_sma': True, 'bull_use_ema': False, 'bull_use_atr': False, 'bull_use_adx': True, 'bull_use_spike': False, 'bull_rsi_required': True, 'bear_strategy': 'breakout', 'bear_bb_std_mult': 2.4264734749777532, 'bear_rsi_os': 21, 'bear_rsi_ob': 67, 'bear_adx_thresh': 14.616545402907763, 'bear_atr_min_pct': 0.003118974179618017, 'bear_atr_max_pct': 0.13845378662824356, 'bear_tp_mult': 1.0601032932341579, 'bear_tsl_mult': 0.8521628326743892, 'bear_time_stop': 132, 'bear_use_sma': True, 'bear_use_ema': True, 'bear_use_atr': False, 'bear_use_adx': False, 'bear_use_spike': True, 'bear_rsi_required': True, 'sideways_strategy': 'breakout', 'sideways_bb_std_mult': 0.5844720129315364, 'sideways_rsi_os': 28, 'sideways_rsi_ob': 78, 'sideways_adx_thresh': 12.54044030458174, 'sideways_atr_min_pct': 0.018952391830503047, 'sideways_atr_max_pct': 0.10278150114107619, 'sideways_tp_mult': 1.4874032201732195, 'sideways_tsl_mult': 0.41783477928974977, 'sideways_time_stop': 130, 'sideways_use_sma': False, 'sideways_use_ema': True, 'sideways_use_atr': False, 'sideways_use_adx': False, 'sideways_use_spike': True, 'sideways_rsi_required': True}.
[I 2025-08-30 16:15:51,939] Trial 704 finished with values: [-1000000000.0, 1000000000.0] and parameters: {'p_sma': 25, 'p_std': 19, 'p_atr': 12, 'p_adx': 26, 'rsi_period': 10, 'ema1': 17, 'ema2': 37, 'slip_atr_k': 0.004260068597727001, 'slip_spread_k': 0.6912051566531413, 'spread_hl_frac': 0.0054201440124281575, 'bb_std_mult': 1.9626327952991824, 'rsi_os': 39, 'rsi_ob': 85, 'vol_spike': 0.17563197786556073, 'adx_thresh': 7.407724289745803, 'atr_min_pct': 0.022355752695423545, 'atr_max_pct': 0.12366947636394049, 'tp_mult': 1.4533541878317333, 'tsl_mult': 0.6731485277615481, 'strategy': 'breakout', 'time_stop': 147, 'use_sma': False, 'use_atr': False, 'use_adx': True, 'use_ema': True, 'use_spike': False, 'rsi_required': False, 'edge_k': 0.5441802549798048, 'edge_cap': 0.18609793344789732, 'bull_strategy': 'mean_reversion', 'bull_bb_std_mult': 1.678881144178261, 'bull_rsi_os': 45, 'bull_rsi_ob': 88, 'bull_adx_thresh': 11.945630379207651, 'bull_atr_min_pct': 0.018420245181276575, 'bull_atr_max_pct': 0.10714841163065286, 'bull_tp_mult': 2.791257080959196, 'bull_tsl_mult': 0.9341382372288034, 'bull_time_stop': 48, 'bull_use_sma': True, 'bull_use_ema': False, 'bull_use_atr': False, 'bull_use_adx': True, 'bull_use_spike': False, 'bull_rsi_required': True, 'bear_strategy': 'breakout', 'bear_bb_std_mult': 2.3907662303463653, 'bear_rsi_os': 46, 'bear_rsi_ob': 71, 'bear_adx_thresh': 17.189218951124335, 'bear_atr_min_pct': 0.004721194978532543, 'bear_atr_max_pct': 0.11218652372140436, 'bear_tp_mult': 1.1510206611810707, 'bear_tsl_mult': 0.20959092865496964, 'bear_time_stop': 89, 'bear_use_sma': True, 'bear_use_ema': True, 'bear_use_atr': True, 'bear_use_adx': False, 'bear_use_spike': True, 'bear_rsi_required': True, 'sideways_strategy': 'breakout', 'sideways_bb_std_mult': 3.001105425464034, 'sideways_rsi_os': 53, 'sideways_rsi_ob': 85, 'sideways_adx_thresh': 21.09412288839023, 'sideways_atr_min_pct': 0.021872487273899205, 'sideways_atr_max_pct': 0.06341731573444646, 'sideways_tp_mult': 1.3081277122599235, 'sideways_tsl_mult': 0.16825890466859128, 'sideways_time_stop': 250, 'sideways_use_sma': False, 'sideways_use_ema': True, 'sideways_use_atr': False, 'sideways_use_adx': True, 'sideways_use_spike': True, 'sideways_rsi_required': True}.
[I 2025-08-30 16:16:37,747] Trial 707 finished with values: [-1000000000.0, 1000000000.0] and parameters: {'p_sma': 26, 'p_std': 26, 'p_atr': 12, 'p_adx': 26, 'rsi_period': 14, 'ema1': 17, 'ema2': 40, 'slip_atr_k': 0.04139903849146234, 'slip_spread_k': 0.6965572532982515, 'spread_hl_frac': 0.008655329873820254, 'bb_std_mult': 0.8151449918550717, 'rsi_os': 24, 'rsi_ob': 89, 'vol_spike': 0.1979870446322295, 'adx_thresh': 7.610322045191178, 'atr_min_pct': 0.006123180286096264, 'atr_max_pct': 0.1112058634589061, 'tp_mult': 1.6271524417234444, 'tsl_mult': 0.9458396936541841, 'strategy': 'mean_reversion', 'time_stop': 82, 'use_sma': False, 'use_atr': False, 'use_adx': True, 'use_ema': False, 'use_spike': False, 'rsi_required': True, 'edge_k': 0.6654215381186814, 'edge_cap': 0.10216128357232779, 'bull_strategy': 'breakout', 'bull_bb_std_mult': 1.6643575615340065, 'bull_rsi_os': 47, 'bull_rsi_ob': 89, 'bull_adx_thresh': 12.177369829995898, 'bull_atr_min_pct': 0.024689570037825813, 'bull_atr_max_pct': 0.14976205149188737, 'bull_tp_mult': 2.718672363001092, 'bull_tsl_mult': 0.6592163974728469, 'bull_time_stop': 5, 'bull_use_sma': False, 'bull_use_ema': False, 'bull_use_atr': True, 'bull_use_adx': True, 'bull_use_spike': True, 'bull_rsi_required': True, 'bear_strategy': 'mean_reversion', 'bear_bb_std_mult': 1.607679448086883, 'bear_rsi_os': 27, 'bear_rsi_ob': 68, 'bear_adx_thresh': 13.678728237696113, 'bear_atr_min_pct': 0.0213409689944558, 'bear_atr_max_pct': 0.11234094499764197, 'bear_tp_mult': 1.0714159817127609, 'bear_tsl_mult': 0.8362379651566789, 'bear_time_stop': 88, 'bear_use_sma': False, 'bear_use_ema': True, 'bear_use_atr': True, 'bear_use_adx': False, 'bear_use_spike': False, 'bear_rsi_required': False, 'sideways_strategy': 'breakout', 'sideways_bb_std_mult': 0.5802855477397422, 'sideways_rsi_os': 10, 'sideways_rsi_ob': 77, 'sideways_adx_thresh': 10.700623612972924, 'sideways_atr_min_pct': 0.021774368870857964, 'sideways_atr_max_pct': 0.07422249036220713, 'sideways_tp_mult': 1.4878298062918178, 'sideways_tsl_mult': 0.17156584923953583, 'sideways_time_stop': 200, 'sideways_use_sma': False, 'sideways_use_ema': True, 'sideways_use_atr': False, 'sideways_use_adx': True, 'sideways_use_spike': False, 'sideways_rsi_required': False}.
[I 2025-08-30 16:16:38,151] Trial 708 finished with values: [-1000000000.0, 1000000000.0] and parameters: {'p_sma': 52, 'p_std': 13, 'p_atr': 10, 'p_adx': 23, 'rsi_period': 9, 'ema1': 29, 'ema2': 26, 'slip_atr_k': 0.0003696653860792848, 'slip_spread_k': 0.6960110134269273, 'spread_hl_frac': 0.042145312042274896, 'bb_std_mult': 2.565298671243885, 'rsi_os': 45, 'rsi_ob': 88, 'vol_spike': 0.19893836407115864, 'adx_thresh': 7.428918705948424, 'atr_min_pct': 0.0077502358428551315, 'atr_max_pct': 0.12365450114348088, 'tp_mult': 1.6117108094185622, 'tsl_mult': 0.6713339407244074, 'strategy': 'mean_reversion', 'time_stop': 81, 'use_sma': False, 'use_atr': False, 'use_adx': True, 'use_ema': False, 'use_spike': False, 'rsi_required': True, 'edge_k': 0.6722239384809248, 'edge_cap': 0.9536823950485711, 'bull_strategy': 'breakout', 'bull_bb_std_mult': 1.6788972497951056, 'bull_rsi_os': 47, 'bull_rsi_ob': 89, 'bull_adx_thresh': 7.693023051004141, 'bull_atr_min_pct': 0.010196341304455549, 'bull_atr_max_pct': 0.01815997195525689, 'bull_tp_mult': 2.7027792579022374, 'bull_tsl_mult': 0.22739022000417647, 'bull_time_stop': 54, 'bull_use_sma': False, 'bull_use_ema': False, 'bull_use_atr': True, 'bull_use_adx': True, 'bull_use_spike': True, 'bull_rsi_required': True, 'bear_strategy': 'mean_reversion', 'bear_bb_std_mult': 1.6237600190703865, 'bear_rsi_os': 14, 'bear_rsi_ob': 71, 'bear_adx_thresh': 13.450055440075435, 'bear_atr_min_pct': 0.0013444567695401598, 'bear_atr_max_pct': 0.11211507564315544, 'bear_tp_mult': 2.750312989137165, 'bear_tsl_mult': 0.20317317932885942, 'bear_time_stop': 87, 'bear_use_sma': False, 'bear_use_ema': True, 'bear_use_atr': True, 'bear_use_adx': False, 'bear_use_spike': False, 'bear_rsi_required': False, 'sideways_strategy': 'breakout', 'sideways_bb_std_mult': 3.2982366398025578, 'sideways_rsi_os': 53, 'sideways_rsi_ob': 77, 'sideways_adx_thresh': 21.01355925646529, 'sideways_atr_min_pct': 0.01968398711267226, 'sideways_atr_max_pct': 0.06474610552327376, 'sideways_tp_mult': 1.2110667309908167, 'sideways_tsl_mult': 0.36316196056354, 'sideways_time_stop': 112, 'sideways_use_sma': False, 'sideways_use_ema': True, 'sideways_use_atr': False, 'sideways_use_adx': True, 'sideways_use_spike': False, 'sideways_rsi_required': False}.
[I 2025-08-30 16:16:38,402] Trial 706 finished with values: [-1000000000.0, 1000000000.0] and parameters: {'p_sma': 11, 'p_std': 20, 'p_atr': 12, 'p_adx': 26, 'rsi_period': 14, 'ema1': 25, 'ema2': 17, 'slip_atr_k': 0.1581083652440427, 'slip_spread_k': 0.6954108078079569, 'spread_hl_frac': 0.005416007403246232, 'bb_std_mult': 0.6068662732589477, 'rsi_os': 24, 'rsi_ob': 85, 'vol_spike': 0.20757017643202144, 'adx_thresh': 6.981930991529019, 'atr_min_pct': 0.020627745253376163, 'atr_max_pct': 0.037449705569739214, 'tp_mult': 1.4554473349779276, 'tsl_mult': 0.2388028458955066, 'strategy': 'mean_reversion', 'time_stop': 147, 'use_sma': False, 'use_atr': False, 'use_adx': True, 'use_ema': True, 'use_spike': False, 'rsi_required': False, 'edge_k': 0.5220717533044327, 'edge_cap': 0.9430184994703753, 'bull_strategy': 'mean_reversion', 'bull_bb_std_mult': 1.8661219970393836, 'bull_rsi_os': 45, 'bull_rsi_ob': 64, 'bull_adx_thresh': 12.284467653812019, 'bull_atr_min_pct': 0.018141752217247252, 'bull_atr_max_pct': 0.14991678821449728, 'bull_tp_mult': 2.6740874104151717, 'bull_tsl_mult': 0.8598892681870032, 'bull_time_stop': 53, 'bull_use_sma': False, 'bull_use_ema': False, 'bull_use_atr': False, 'bull_use_adx': True, 'bull_use_spike': False, 'bull_rsi_required': True, 'bear_strategy': 'breakout', 'bear_bb_std_mult': 2.443969852692413, 'bear_rsi_os': 37, 'bear_rsi_ob': 78, 'bear_adx_thresh': 14.624860401163598, 'bear_atr_min_pct': 0.021060604495491006, 'bear_atr_max_pct': 0.052565568347344396, 'bear_tp_mult': 2.7353522142410767, 'bear_tsl_mult': 0.8449868098000666, 'bear_time_stop': 90, 'bear_use_sma': False, 'bear_use_ema': True, 'bear_use_atr': True, 'bear_use_adx': False, 'bear_use_spike': False, 'bear_rsi_required': True, 'sideways_strategy': 'breakout', 'sideways_bb_std_mult': 3.2986560756315693, 'sideways_rsi_os': 19, 'sideways_rsi_ob': 78, 'sideways_adx_thresh': 12.410259395327913, 'sideways_atr_min_pct': 0.019850351004812555, 'sideways_atr_max_pct': 0.06440269008831105, 'sideways_tp_mult': 1.2060601808952343, 'sideways_tsl_mult': 0.4093511815476954, 'sideways_time_stop': 206, 'sideways_use_sma': False, 'sideways_use_ema': True, 'sideways_use_atr': False, 'sideways_use_adx': True, 'sideways_use_spike': False, 'sideways_rsi_required': False}.
[I 2025-08-30 16:16:38,727] Trial 709 finished with values: [-1000000000.0, 1000000000.0] and parameters: {'p_sma': 5, 'p_std': 26, 'p_atr': 15, 'p_adx': 23, 'rsi_period': 13, 'ema1': 25, 'ema2': 35, 'slip_atr_k': 0.016454071705672327, 'slip_spread_k': 0.7067620080780662, 'spread_hl_frac': 0.04213282245385117, 'bb_std_mult': 0.8342774117706706, 'rsi_os': 24, 'rsi_ob': 55, 'vol_spike': 0.02659086899126456, 'adx_thresh': 19.78144381597405, 'atr_min_pct': 0.00984238192854817, 'atr_max_pct': 0.14994560629957138, 'tp_mult': 2.9970684675173622, 'tsl_mult': 0.375317063725001, 'strategy': 'mean_reversion', 'time_stop': 118, 'use_sma': False, 'use_atr': False, 'use_adx': True, 'use_ema': False, 'use_spike': False, 'rsi_required': True, 'edge_k': 0.6860009920498809, 'edge_cap': 0.8716556440134199, 'bull_strategy': 'breakout', 'bull_bb_std_mult': 1.6276524056471893, 'bull_rsi_os': 22, 'bull_rsi_ob': 90, 'bull_adx_thresh': 23.833613260616982, 'bull_atr_min_pct': 0.010377659697104406, 'bull_atr_max_pct': 0.1013290395715476, 'bull_tp_mult': 2.709575415802652, 'bull_tsl_mult': 0.6622349984604731, 'bull_time_stop': 181, 'bull_use_sma': False, 'bull_use_ema': True, 'bull_use_atr': True, 'bull_use_adx': True, 'bull_use_spike': True, 'bull_rsi_required': False, 'bear_strategy': 'mean_reversion', 'bear_bb_std_mult': 1.530708452901364, 'bear_rsi_os': 27, 'bear_rsi_ob': 74, 'bear_adx_thresh': 13.573764481540811, 'bear_atr_min_pct': 0.0028923800609625587, 'bear_atr_max_pct': 0.10257125242375274, 'bear_tp_mult': 2.7303077994272873, 'bear_tsl_mult': 0.4931951762650435, 'bear_time_stop': 81, 'bear_use_sma': False, 'bear_use_ema': False, 'bear_use_atr': True, 'bear_use_adx': True, 'bear_use_spike': False, 'bear_rsi_required': False, 'sideways_strategy': 'mean_reversion', 'sideways_bb_std_mult': 3.3168707023079644, 'sideways_rsi_os': 29, 'sideways_rsi_ob': 72, 'sideways_adx_thresh': 10.456004063430568, 'sideways_atr_min_pct': 0.01966227163410718, 'sideways_atr_max_pct': 0.07391419772763501, 'sideways_tp_mult': 1.2409474597102563, 'sideways_tsl_mult': 0.36989544824038667, 'sideways_time_stop': 111, 'sideways_use_sma': True, 'sideways_use_ema': False, 'sideways_use_atr': True, 'sideways_use_adx': True, 'sideways_use_spike': False, 'sideways_rsi_required': False}.
[I 2025-08-30 16:17:24,337] Trial 710 finished with values: [-1000000000.0, 1000000000.0] and parameters: {'p_sma': 5, 'p_std': 16, 'p_atr': 12, 'p_adx': 23, 'rsi_period': 36, 'ema1': 26, 'ema2': 26, 'slip_atr_k': 8.272444888486082e-05, 'slip_spread_k': 0.7202702840273174, 'spread_hl_frac': 0.02337847607766245, 'bb_std_mult': 0.6115706999903942, 'rsi_os': 48, 'rsi_ob': 88, 'vol_spike': 0.23676220206795132, 'adx_thresh': 6.48331591873427, 'atr_min_pct': 0.009688762958040994, 'atr_max_pct': 0.11723212909861656, 'tp_mult': 1.5206640601729762, 'tsl_mult': 0.3875399052188642, 'strategy': 'mean_reversion', 'time_stop': 167, 'use_sma': False, 'use_atr': False, 'use_adx': True, 'use_ema': False, 'use_spike': False, 'rsi_required': False, 'edge_k': 0.6119709183905617, 'edge_cap': 0.9489171989520497, 'bull_strategy': 'breakout', 'bull_bb_std_mult': 1.5438809888014988, 'bull_rsi_os': 26, 'bull_rsi_ob': 53, 'bull_adx_thresh': 23.288908947516354, 'bull_atr_min_pct': 0.004618122305257599, 'bull_atr_max_pct': 0.13013878765436768, 'bull_tp_mult': 2.3103827715368066, 'bull_tsl_mult': 0.22173813599571712, 'bull_time_stop': 63, 'bull_use_sma': False, 'bull_use_ema': True, 'bull_use_atr': True, 'bull_use_adx': True, 'bull_use_spike': True, 'bull_rsi_required': False, 'bear_strategy': 'mean_reversion', 'bear_bb_std_mult': 1.1178328065893965, 'bear_rsi_os': 27, 'bear_rsi_ob': 78, 'bear_adx_thresh': 27.670854090287378, 'bear_atr_min_pct': 0.006997422081334527, 'bear_atr_max_pct': 0.10620101235055057, 'bear_tp_mult': 2.7485819622698537, 'bear_tsl_mult': 0.8030886548327671, 'bear_time_stop': 224, 'bear_use_sma': False, 'bear_use_ema': False, 'bear_use_atr': True, 'bear_use_adx': True, 'bear_use_spike': False, 'bear_rsi_required': True, 'sideways_strategy': 'mean_reversion', 'sideways_bb_std_mult': 2.4166363397727406, 'sideways_rsi_os': 18, 'sideways_rsi_ob': 74, 'sideways_adx_thresh': 11.320247601256494, 'sideways_atr_min_pct': 0.020191595933049825, 'sideways_atr_max_pct': 0.059282725277305826, 'sideways_tp_mult': 1.22601918667725, 'sideways_tsl_mult': 0.3711494957649298, 'sideways_time_stop': 112, 'sideways_use_sma': True, 'sideways_use_ema': False, 'sideways_use_atr': True, 'sideways_use_adx': True, 'sideways_use_spike': False, 'sideways_rsi_required': False}.
