[I 2025-08-30 15:28:07,082] Trial 466 finished with values: [-0.0035038047982542952, 0.007410406592264632] and parameters: {'p_sma': 11, 'p_std': 21, 'p_atr': 12, 'p_adx': 24, 'rsi_period': 8, 'ema1': 25, 'ema2': 35, 'slip_atr_k': 0.005651606107920753, 'slip_spread_k': 0.7380286428595368, 'spread_hl_frac': 0.008185337569631449, 'bb_std_mult': 0.5722781455850878, 'rsi_os': 22, 'rsi_ob': 86, 'vol_spike': 0.22288061927240996, 'adx_thresh': 8.753075404866436, 'atr_min_pct': 0.006848465062673963, 'atr_max_pct': 0.11016899553873415, 'tp_mult': 1.6006288736953371, 'tsl_mult': 0.377968621908767, 'strategy': 'breakout', 'time_stop': 154, 'use_sma': False, 'use_atr': False, 'use_adx': True, 'use_ema': False, 'use_spike': False, 'rsi_required': False, 'edge_k': 0.6244119419384948, 'edge_cap': 0.9797981031954162, 'bull_strategy': 'breakout', 'bull_bb_std_mult': 1.7608076852545342, 'bull_rsi_os': 48, 'bull_rsi_ob': 93, 'bull_adx_thresh': 7.894278283317667, 'bull_atr_min_pct': 0.019874598130076717, 'bull_atr_max_pct': 0.09896671965159361, 'bull_tp_mult': 2.6065523167549953, 'bull_tsl_mult': 0.8799635890736346, 'bull_time_stop': 51, 'bull_use_sma': True, 'bull_use_ema': True, 'bull_use_atr': True, 'bull_use_adx': True, 'bull_use_spike': True, 'bull_rsi_required': False, 'bear_strategy': 'mean_reversion', 'bear_bb_std_mult': 2.0978681050594234, 'bear_rsi_os': 28, 'bear_rsi_ob': 74, 'bear_adx_thresh': 16.88548831685569, 'bear_atr_min_pct': 0.0026854538163647865, 'bear_atr_max_pct': 0.10403965378420545, 'bear_tp_mult': 2.6680380713664866, 'bear_tsl_mult': 0.8632699021990599, 'bear_time_stop': 110, 'bear_use_sma': True, 'bear_use_ema': False, 'bear_use_atr': True, 'bear_use_adx': True, 'bear_use_spike': True, 'bear_rsi_required': True, 'sideways_strategy': 'mean_reversion', 'sideways_bb_std_mult': 3.1408797450294204, 'sideways_rsi_os': 30, 'sideways_rsi_ob': 77, 'sideways_adx_thresh': 11.436358307757736, 'sideways_atr_min_pct': 0.02032653169543857, 'sideways_atr_max_pct': 0.0789003424264091, 'sideways_tp_mult': 2.2041590148744636, 'sideways_tsl_mult': 0.35376290355491585, 'sideways_time_stop': 133, 'sideways_use_sma': True, 'sideways_use_ema': False, 'sideways_use_atr': True, 'sideways_use_adx': True, 'sideways_use_spike': True, 'sideways_rsi_required': True}.
[I 2025-08-30 15:28:55,220] Trial 472 finished with values: [-1000000000.0, 1000000000.0] and parameters: {'p_sma': 13, 'p_std': 20, 'p_atr': 13, 'p_adx': 24, 'rsi_period': 11, 'ema1': 26, 'ema2': 35, 'slip_atr_k': 0.012145339530995766, 'slip_spread_k': 0.7576393505640828, 'spread_hl_frac': 0.006476758784256678, 'bb_std_mult': 0.6961637502734574, 'rsi_os': 23, 'rsi_ob': 85, 'vol_spike': 0.20330511650158595, 'adx_thresh': 8.040919381525589, 'atr_min_pct': 0.006832891579472824, 'atr_max_pct': 0.11075500778335762, 'tp_mult': 1.5900072913715562, 'tsl_mult': 0.3984802049452294, 'strategy': 'breakout', 'time_stop': 153, 'use_sma': False, 'use_atr': False, 'use_adx': True, 'use_ema': False, 'use_spike': False, 'rsi_required': False, 'edge_k': 0.5544942358745035, 'edge_cap': 0.9835505175704554, 'bull_strategy': 'breakout', 'bull_bb_std_mult': 1.6827315620110146, 'bull_rsi_os': 46, 'bull_rsi_ob': 89, 'bull_adx_thresh': 7.927769534318969, 'bull_atr_min_pct': 0.018024018599224093, 'bull_atr_max_pct': 0.09910190254717349, 'bull_tp_mult': 2.6591017916713087, 'bull_tsl_mult': 0.8877579526492877, 'bull_time_stop': 49, 'bull_use_sma': True, 'bull_use_ema': True, 'bull_use_atr': True, 'bull_use_adx': True, 'bull_use_spike': True, 'bull_rsi_required': False, 'bear_strategy': 'mean_reversion', 'bear_bb_std_mult': 1.976624401276397, 'bear_rsi_os': 27, 'bear_rsi_ob': 74, 'bear_adx_thresh': 17.431563890054385, 'bear_atr_min_pct': 0.003358395247087236, 'bear_atr_max_pct': 0.10952764241134375, 'bear_tp_mult': 2.67690204322298, 'bear_tsl_mult': 0.915036364444325, 'bear_time_stop': 126, 'bear_use_sma': True, 'bear_use_ema': False, 'bear_use_atr': True, 'bear_use_adx': True, 'bear_use_spike': True, 'bear_rsi_required': True, 'sideways_strategy': 'mean_reversion', 'sideways_bb_std_mult': 3.125238166192336, 'sideways_rsi_os': 31, 'sideways_rsi_ob': 77, 'sideways_adx_thresh': 10.963860970965655, 'sideways_atr_min_pct': 0.021396820457473112, 'sideways_atr_max_pct': 0.0662827428578588, 'sideways_tp_mult': 1.8917679586503833, 'sideways_tsl_mult': 0.3593535994015542, 'sideways_time_stop': 139, 'sideways_use_sma': True, 'sideways_use_ema': False, 'sideways_use_atr': True, 'sideways_use_adx': True, 'sideways_use_spike': True, 'sideways_rsi_required': True}.
[I 2025-08-30 15:28:55,582] Trial 469 finished with values: [-1000000000.0, 1000000000.0] and parameters: {'p_sma': 9, 'p_std': 20, 'p_atr': 13, 'p_adx': 24, 'rsi_period': 11, 'ema1': 26, 'ema2': 35, 'slip_atr_k': 0.01142531253932252, 'slip_spread_k': 0.7824211616113719, 'spread_hl_frac': 0.006530029342430772, 'bb_std_mult': 0.6911964210248676, 'rsi_os': 25, 'rsi_ob': 85, 'vol_spike': 0.20432006174905137, 'adx_thresh': 8.101260816373278, 'atr_min_pct': 0.006952022639842234, 'atr_max_pct': 0.10868688828267281, 'tp_mult': 1.5915868810110494, 'tsl_mult': 0.41086974177123475, 'strategy': 'breakout', 'time_stop': 153, 'use_sma': False, 'use_atr': False, 'use_adx': True, 'use_ema': False, 'use_spike': False, 'rsi_required': False, 'edge_k': 0.6037888213270894, 'edge_cap': 0.9790844550739427, 'bull_strategy': 'breakout', 'bull_bb_std_mult': 1.7657089664569754, 'bull_rsi_os': 46, 'bull_rsi_ob': 89, 'bull_adx_thresh': 7.835507068988187, 'bull_atr_min_pct': 0.018485210918435094, 'bull_atr_max_pct': 0.09893133348601371, 'bull_tp_mult': 2.609974841081886, 'bull_tsl_mult': 0.8899397173679388, 'bull_time_stop': 37, 'bull_use_sma': True, 'bull_use_ema': True, 'bull_use_atr': True, 'bull_use_adx': True, 'bull_use_spike': True, 'bull_rsi_required': False, 'bear_strategy': 'mean_reversion', 'bear_bb_std_mult': 1.9741560155435411, 'bear_rsi_os': 27, 'bear_rsi_ob': 74, 'bear_adx_thresh': 16.834909904439456, 'bear_atr_min_pct': 0.00389095647685907, 'bear_atr_max_pct': 0.10628704219774998, 'bear_tp_mult': 2.7340623178594154, 'bear_tsl_mult': 0.8364989387978501, 'bear_time_stop': 121, 'bear_use_sma': True, 'bear_use_ema': False, 'bear_use_atr': True, 'bear_use_adx': True, 'bear_use_spike': True, 'bear_rsi_required': True, 'sideways_strategy': 'mean_reversion', 'sideways_bb_std_mult': 3.025477968418039, 'sideways_rsi_os': 31, 'sideways_rsi_ob': 78, 'sideways_adx_thresh': 10.206070387293677, 'sideways_atr_min_pct': 0.021474072832292003, 'sideways_atr_max_pct': 0.07867825068296681, 'sideways_tp_mult': 2.201117881364965, 'sideways_tsl_mult': 0.35434165490703556, 'sideways_time_stop': 138, 'sideways_use_sma': True, 'sideways_use_ema': False, 'sideways_use_atr': True, 'sideways_use_adx': True, 'sideways_use_spike': True, 'sideways_rsi_required': True}.
[I 2025-08-30 15:28:55,948] Trial 471 finished with values: [-1000000000.0, 1000000000.0] and parameters: {'p_sma': 13, 'p_std': 19, 'p_atr': 13, 'p_adx': 24, 'rsi_period': 11, 'ema1': 26, 'ema2': 35, 'slip_atr_k': 0.012083033779575592, 'slip_spread_k': 0.7823489734191543, 'spread_hl_frac': 0.0065311590121847245, 'bb_std_mult': 0.699505726885036, 'rsi_os': 25, 'rsi_ob': 85, 'vol_spike': 0.2046817863861879, 'adx_thresh': 8.042336390858303, 'atr_min_pct': 0.006907940339952562, 'atr_max_pct': 0.10827918208022587, 'tp_mult': 1.6010366003278946, 'tsl_mult': 0.41128678533130414, 'strategy': 'breakout', 'time_stop': 146, 'use_sma': False, 'use_atr': False, 'use_adx': True, 'use_ema': False, 'use_spike': False, 'rsi_required': False, 'edge_k': 0.5641800143380412, 'edge_cap': 0.9754004894359948, 'bull_strategy': 'breakout', 'bull_bb_std_mult': 1.779786912378072, 'bull_rsi_os': 46, 'bull_rsi_ob': 89, 'bull_adx_thresh': 7.912704901791231, 'bull_atr_min_pct': 0.018732645595750236, 'bull_atr_max_pct': 0.0975919079891008, 'bull_tp_mult': 2.793705576090355, 'bull_tsl_mult': 0.8485194977075503, 'bull_time_stop': 49, 'bull_use_sma': True, 'bull_use_ema': True, 'bull_use_atr': True, 'bull_use_adx': True, 'bull_use_spike': True, 'bull_rsi_required': False, 'bear_strategy': 'mean_reversion', 'bear_bb_std_mult': 1.9803887280100836, 'bear_rsi_os': 27, 'bear_rsi_ob': 74, 'bear_adx_thresh': 17.25629656220056, 'bear_atr_min_pct': 0.0036440441673313783, 'bear_atr_max_pct': 0.10649070803723036, 'bear_tp_mult': 2.7293736686679706, 'bear_tsl_mult': 0.9115384936555351, 'bear_time_stop': 113, 'bear_use_sma': True, 'bear_use_ema': False, 'bear_use_atr': True, 'bear_use_adx': True, 'bear_use_spike': True, 'bear_rsi_required': True, 'sideways_strategy': 'mean_reversion', 'sideways_bb_std_mult': 3.1072773272344527, 'sideways_rsi_os': 31, 'sideways_rsi_ob': 78, 'sideways_adx_thresh': 11.132679129440406, 'sideways_atr_min_pct': 0.0213384899614361, 'sideways_atr_max_pct': 0.07877619719385859, 'sideways_tp_mult': 1.8908794281776775, 'sideways_tsl_mult': 0.3595653288204098, 'sideways_time_stop': 137, 'sideways_use_sma': True, 'sideways_use_ema': False, 'sideways_use_atr': True, 'sideways_use_adx': True, 'sideways_use_spike': True, 'sideways_rsi_required': True}.
[I 2025-08-30 15:28:56,249] Trial 470 finished with values: [-0.0011103687222208114, 0.004988695177866445] and parameters: {'p_sma': 11, 'p_std': 19, 'p_atr': 11, 'p_adx': 24, 'rsi_period': 8, 'ema1': 26, 'ema2': 33, 'slip_atr_k': 0.0038713856057326305, 'slip_spread_k': 0.7212768778077394, 'spread_hl_frac': 0.00648118311615994, 'bb_std_mult': 0.5759112541245519, 'rsi_os': 23, 'rsi_ob': 86, 'vol_spike': 0.22301009169485084, 'adx_thresh': 8.01636190336939, 'atr_min_pct': 0.008520565349494138, 'atr_max_pct': 0.1091324146281101, 'tp_mult': 1.5958293781450696, 'tsl_mult': 0.38445401238251514, 'strategy': 'breakout', 'time_stop': 147, 'use_sma': False, 'use_atr': False, 'use_adx': True, 'use_ema': False, 'use_spike': False, 'rsi_required': False, 'edge_k': 0.6098349676321988, 'edge_cap': 0.9807154621215421, 'bull_strategy': 'breakout', 'bull_bb_std_mult': 1.7620279702322517, 'bull_rsi_os': 49, 'bull_rsi_ob': 91, 'bull_adx_thresh': 9.659635348297284, 'bull_atr_min_pct': 0.018424865945592006, 'bull_atr_max_pct': 0.09964338494362839, 'bull_tp_mult': 2.626109972715082, 'bull_tsl_mult': 0.8849057553664744, 'bull_time_stop': 59, 'bull_use_sma': True, 'bull_use_ema': True, 'bull_use_atr': True, 'bull_use_adx': True, 'bull_use_spike': True, 'bull_rsi_required': False, 'bear_strategy': 'mean_reversion', 'bear_bb_std_mult': 2.1319209647430077, 'bear_rsi_os': 27, 'bear_rsi_ob': 74, 'bear_adx_thresh': 16.88300757058922, 'bear_atr_min_pct': 0.0029177119355876025, 'bear_atr_max_pct': 0.10357260346086648, 'bear_tp_mult': 2.670103899145205, 'bear_tsl_mult': 0.9197427208493258, 'bear_time_stop': 109, 'bear_use_sma': True, 'bear_use_ema': False, 'bear_use_atr': True, 'bear_use_adx': True, 'bear_use_spike': True, 'bear_rsi_required': True, 'sideways_strategy': 'mean_reversion', 'sideways_bb_std_mult': 3.1409473250577893, 'sideways_rsi_os': 30, 'sideways_rsi_ob': 79, 'sideways_adx_thresh': 11.52722162999374, 'sideways_atr_min_pct': 0.020638153908695788, 'sideways_atr_max_pct': 0.07806316938240826, 'sideways_tp_mult': 2.20761783980901, 'sideways_tsl_mult': 0.3845867679648676, 'sideways_time_stop': 133, 'sideways_use_sma': True, 'sideways_use_ema': False, 'sideways_use_atr': True, 'sideways_use_adx': True, 'sideways_use_spike': True, 'sideways_rsi_required': True}.
[I 2025-08-30 15:29:43,148] Trial 476 finished with values: [-0.0024790594592716264, 0.006869940134972907] and parameters: {'p_sma': 11, 'p_std': 23, 'p_atr': 11, 'p_adx': 23, 'rsi_period': 8, 'ema1': 25, 'ema2': 34, 'slip_atr_k': 0.0033097837303093457, 'slip_spread_k': 0.7118712524646955, 'spread_hl_frac': 0.004579197676781909, 'bb_std_mult': 0.5873748009125364, 'rsi_os': 24, 'rsi_ob': 87, 'vol_spike': 0.22290179336517874, 'adx_thresh': 6.1266977314878615, 'atr_min_pct': 0.008114671279122937, 'atr_max_pct': 0.1178606062588827, 'tp_mult': 1.500161652639746, 'tsl_mult': 0.3375042060618564, 'strategy': 'breakout', 'time_stop': 159, 'use_sma': False, 'use_atr': False, 'use_adx': True, 'use_ema': False, 'use_spike': False, 'rsi_required': False, 'edge_k': 0.6086367763060323, 'edge_cap': 0.9548821675382705, 'bull_strategy': 'breakout', 'bull_bb_std_mult': 1.9278520700324366, 'bull_rsi_os': 48, 'bull_rsi_ob': 92, 'bull_adx_thresh': 9.622767269416007, 'bull_atr_min_pct': 0.01993602509763238, 'bull_atr_max_pct': 0.10196745301921531, 'bull_tp_mult': 2.6427628264497653, 'bull_tsl_mult': 0.8724656189207097, 'bull_time_stop': 60, 'bull_use_sma': True, 'bull_use_ema': True, 'bull_use_atr': True, 'bull_use_adx': True, 'bull_use_spike': True, 'bull_rsi_required': False, 'bear_strategy': 'mean_reversion', 'bear_bb_std_mult': 2.096301679292348, 'bear_rsi_os': 29, 'bear_rsi_ob': 72, 'bear_adx_thresh': 16.258296297512747, 'bear_atr_min_pct': 0.002753717919301204, 'bear_atr_max_pct': 0.1040738945014353, 'bear_tp_mult': 2.7766436457844477, 'bear_tsl_mult': 0.8566095548556748, 'bear_time_stop': 103, 'bear_use_sma': True, 'bear_use_ema': False, 'bear_use_atr': True, 'bear_use_adx': True, 'bear_use_spike': True, 'bear_rsi_required': True, 'sideways_strategy': 'mean_reversion', 'sideways_bb_std_mult': 3.1732656576242406, 'sideways_rsi_os': 30, 'sideways_rsi_ob': 80, 'sideways_adx_thresh': 10.250021303942493, 'sideways_atr_min_pct': 0.020441354704465866, 'sideways_atr_max_pct': 0.07027431070148282, 'sideways_tp_mult': 1.995580034943088, 'sideways_tsl_mult': 0.4170902739890949, 'sideways_time_stop': 129, 'sideways_use_sma': True, 'sideways_use_ema': False, 'sideways_use_atr': True, 'sideways_use_adx': True, 'sideways_use_spike': True, 'sideways_rsi_required': True}.
[I 2025-08-30 15:29:43,700] Trial 475 finished with values: [-0.0065078416533528305, 0.00884906303422806] and parameters: {'p_sma': 11, 'p_std': 23, 'p_atr': 11, 'p_adx': 23, 'rsi_period': 7, 'ema1': 25, 'ema2': 34, 'slip_atr_k': 0.0039006375622440918, 'slip_spread_k': 0.7159840904558059, 'spread_hl_frac': 0.008139165732509559, 'bb_std_mult': 0.5011627792304107, 'rsi_os': 24, 'rsi_ob': 87, 'vol_spike': 0.2222425187200882, 'adx_thresh': 7.366597177827962, 'atr_min_pct': 0.008635619384074802, 'atr_max_pct': 0.11724685537128678, 'tp_mult': 1.4866822358824476, 'tsl_mult': 0.33155825338990563, 'strategy': 'breakout', 'time_stop': 161, 'use_sma': False, 'use_atr': False, 'use_adx': True, 'use_ema': False, 'use_spike': False, 'rsi_required': False, 'edge_k': 0.6204332449850225, 'edge_cap': 0.9995337260915923, 'bull_strategy': 'breakout', 'bull_bb_std_mult': 1.8920803652776927, 'bull_rsi_os': 48, 'bull_rsi_ob': 91, 'bull_adx_thresh': 6.703574397944054, 'bull_atr_min_pct': 0.018367040366313, 'bull_atr_max_pct': 0.10247173487119898, 'bull_tp_mult': 2.6933755503277546, 'bull_tsl_mult': 0.8776523036270797, 'bull_time_stop': 29, 'bull_use_sma': True, 'bull_use_ema': True, 'bull_use_atr': True, 'bull_use_adx': True, 'bull_use_spike': True, 'bull_rsi_required': False, 'bear_strategy': 'mean_reversion', 'bear_bb_std_mult': 2.093346132276619, 'bear_rsi_os': 28, 'bear_rsi_ob': 72, 'bear_adx_thresh': 16.069283430719825, 'bear_atr_min_pct': 0.0027710967153366716, 'bear_atr_max_pct': 0.1043027571534131, 'bear_tp_mult': 2.6656856703692546, 'bear_tsl_mult': 0.8632905198219388, 'bear_time_stop': 102, 'bear_use_sma': True, 'bear_use_ema': False, 'bear_use_atr': True, 'bear_use_adx': True, 'bear_use_spike': True, 'bear_rsi_required': True, 'sideways_strategy': 'mean_reversion', 'sideways_bb_std_mult': 3.1658167453293755, 'sideways_rsi_os': 30, 'sideways_rsi_ob': 80, 'sideways_adx_thresh': 10.070910777329706, 'sideways_atr_min_pct': 0.020446875434544088, 'sideways_atr_max_pct': 0.07062169933817014, 'sideways_tp_mult': 2.0232450542918063, 'sideways_tsl_mult': 0.2856092585853269, 'sideways_time_stop': 151, 'sideways_use_sma': True, 'sideways_use_ema': False, 'sideways_use_atr': True, 'sideways_use_adx': True, 'sideways_use_spike': True, 'sideways_rsi_required': True}.
[I 2025-08-30 15:29:45,132] Trial 473 finished with values: [-1000000000.0, 1000000000.0] and parameters: {'p_sma': 11, 'p_std': 19, 'p_atr': 11, 'p_adx': 23, 'rsi_period': 8, 'ema1': 25, 'ema2': 34, 'slip_atr_k': 3.778591466521079e-05, 'slip_spread_k': 0.727206952896104, 'spread_hl_frac': 0.008570364338902431, 'bb_std_mult': 0.592109582909444, 'rsi_os': 25, 'rsi_ob': 50, 'vol_spike': 0.21486170081494713, 'adx_thresh': 7.342785611217084, 'atr_min_pct': 0.00687410168210901, 'atr_max_pct': 0.119797299772908, 'tp_mult': 1.60513872423079, 'tsl_mult': 0.3379625948041834, 'strategy': 'breakout', 'time_stop': 145, 'use_sma': False, 'use_atr': False, 'use_adx': True, 'use_ema': False, 'use_spike': False, 'rsi_required': False, 'edge_k': 0.6143732512872931, 'edge_cap': 0.9615505662520407, 'bull_strategy': 'breakout', 'bull_bb_std_mult': 1.762895198223546, 'bull_rsi_os': 48, 'bull_rsi_ob': 92, 'bull_adx_thresh': 8.337569176839596, 'bull_atr_min_pct': 0.018501292443995454, 'bull_atr_max_pct': 0.10250784478170029, 'bull_tp_mult': 2.611970422720361, 'bull_tsl_mult': 0.8546839753043513, 'bull_time_stop': 37, 'bull_use_sma': True, 'bull_use_ema': True, 'bull_use_atr': True, 'bull_use_adx': True, 'bull_use_spike': True, 'bull_rsi_required': False, 'bear_strategy': 'mean_reversion', 'bear_bb_std_mult': 2.0837842546022696, 'bear_rsi_os': 28, 'bear_rsi_ob': 73, 'bear_adx_thresh': 15.923525764358127, 'bear_atr_min_pct': 0.0037104437202041454, 'bear_atr_max_pct': 0.10509138123980384, 'bear_tp_mult': 2.7423010483744803, 'bear_tsl_mult': 0.8281762681050028, 'bear_time_stop': 114, 'bear_use_sma': True, 'bear_use_ema': False, 'bear_use_atr': True, 'bear_use_adx': True, 'bear_use_spike': True, 'bear_rsi_required': True, 'sideways_strategy': 'mean_reversion', 'sideways_bb_std_mult': 3.103455170682393, 'sideways_rsi_os': 30, 'sideways_rsi_ob': 80, 'sideways_adx_thresh': 10.086465543695075, 'sideways_atr_min_pct': 0.020768432007463075, 'sideways_atr_max_pct': 0.07803908046709286, 'sideways_tp_mult': 1.1240877614141556, 'sideways_tsl_mult': 0.4193199765034256, 'sideways_time_stop': 151, 'sideways_use_sma': True, 'sideways_use_ema': False, 'sideways_use_atr': True, 'sideways_use_adx': True, 'sideways_use_spike': True, 'sideways_rsi_required': True}.
[I 2025-08-30 15:29:45,134] Trial 474 finished with values: [-0.0018849309267862102, 0.0068925317426483225] and parameters: {'p_sma': 10, 'p_std': 23, 'p_atr': 11, 'p_adx': 24, 'rsi_period': 8, 'ema1': 25, 'ema2': 34, 'slip_atr_k': 0.00048354116992457407, 'slip_spread_k': 0.7087155033216637, 'spread_hl_frac': 0.008315939413930579, 'bb_std_mult': 0.5961940210174792, 'rsi_os': 23, 'rsi_ob': 87, 'vol_spike': 0.2235815321109541, 'adx_thresh': 9.494987802874272, 'atr_min_pct': 0.008406633097545569, 'atr_max_pct': 0.1169133307468018, 'tp_mult': 1.4744489027594132, 'tsl_mult': 0.33421073272578045, 'strategy': 'breakout', 'time_stop': 144, 'use_sma': False, 'use_atr': False, 'use_adx': True, 'use_ema': False, 'use_spike': False, 'rsi_required': False, 'edge_k': 0.5624823443302883, 'edge_cap': 0.9995110874348633, 'bull_strategy': 'breakout', 'bull_bb_std_mult': 1.8907572617778032, 'bull_rsi_os': 48, 'bull_rsi_ob': 92, 'bull_adx_thresh': 9.702267585030492, 'bull_atr_min_pct': 0.018557621186853373, 'bull_atr_max_pct': 0.10284827214589079, 'bull_tp_mult': 2.7722842375950534, 'bull_tsl_mult': 0.8492297148665986, 'bull_time_stop': 29, 'bull_use_sma': True, 'bull_use_ema': True, 'bull_use_atr': True, 'bull_use_adx': True, 'bull_use_spike': True, 'bull_rsi_required': False, 'bear_strategy': 'mean_reversion', 'bear_bb_std_mult': 2.0965526934775385, 'bear_rsi_os': 28, 'bear_rsi_ob': 72, 'bear_adx_thresh': 15.716119390500157, 'bear_atr_min_pct': 0.0027215442816288, 'bear_atr_max_pct': 0.10291060030321778, 'bear_tp_mult': 2.7274001954729346, 'bear_tsl_mult': 0.8677660759627625, 'bear_time_stop': 110, 'bear_use_sma': True, 'bear_use_ema': False, 'bear_use_atr': True, 'bear_use_adx': True, 'bear_use_spike': True, 'bear_rsi_required': True, 'sideways_strategy': 'mean_reversion', 'sideways_bb_std_mult': 3.1136405383564267, 'sideways_rsi_os': 30, 'sideways_rsi_ob': 80, 'sideways_adx_thresh': 10.20977667177619, 'sideways_atr_min_pct': 0.020175907109061707, 'sideways_atr_max_pct': 0.07030670431943048, 'sideways_tp_mult': 2.023104917124377, 'sideways_tsl_mult': 0.38250918190555677, 'sideways_time_stop': 129, 'sideways_use_sma': True, 'sideways_use_ema': False, 'sideways_use_atr': True, 'sideways_use_adx': True, 'sideways_use_spike': True, 'sideways_rsi_required': True}.
