[I 2025-08-30 15:59:58,688] Trial 621 finished with values: [-1000000000.0, 1000000000.0] and parameters: {'p_sma': 8, 'p_std': 22, 'p_atr': 12, 'p_adx': 20, 'rsi_period': 8, 'ema1': 6, 'ema2': 36, 'slip_atr_k': 7.403899328104597e-05, 'slip_spread_k': 0.7053013684284585, 'spread_hl_frac': 0.007351133461775461, 'bb_std_mult': 0.5005254472481513, 'rsi_os': 25, 'rsi_ob': 88, 'vol_spike': 0.20688292179709328, 'adx_thresh': 10.432062502028415, 'atr_min_pct': 0.01562515993829378, 'atr_max_pct': 0.1087248541521771, 'tp_mult': 1.438673858575055, 'tsl_mult': 0.24550281015899983, 'strategy': 'breakout', 'time_stop': 85, 'use_sma': True, 'use_atr': True, 'use_adx': False, 'use_ema': False, 'use_spike': False, 'rsi_required': False, 'edge_k': 0.6857292411659316, 'edge_cap': 0.9585658742772908, 'bull_strategy': 'breakout', 'bull_bb_std_mult': 1.6942101855202987, 'bull_rsi_os': 49, 'bull_rsi_ob': 89, 'bull_adx_thresh': 18.386366581296016, 'bull_atr_min_pct': 0.00968463285837166, 'bull_atr_max_pct': 0.14339890357782242, 'bull_tp_mult': 2.563162907281867, 'bull_tsl_mult': 0.7400688829894082, 'bull_time_stop': 40, 'bull_use_sma': False, 'bull_use_ema': True, 'bull_use_atr': False, 'bull_use_adx': True, 'bull_use_spike': False, 'bull_rsi_required': False, 'bear_strategy': 'mean_reversion', 'bear_bb_std_mult': 2.054056538188768, 'bear_rsi_os': 26, 'bear_rsi_ob': 75, 'bear_adx_thresh': 16.754256910134465, 'bear_atr_min_pct': 0.016952110956232638, 'bear_atr_max_pct': 0.08993461630765028, 'bear_tp_mult': 1.7591094590112686, 'bear_tsl_mult': 0.8395975389231187, 'bear_time_stop': 90, 'bear_use_sma': True, 'bear_use_ema': False, 'bear_use_atr': False, 'bear_use_adx': False, 'bear_use_spike': False, 'bear_rsi_required': True, 'sideways_strategy': 'mean_reversion', 'sideways_bb_std_mult': 2.9092147869594984, 'sideways_rsi_os': 9, 'sideways_rsi_ob': 69, 'sideways_adx_thresh': 12.955798593013132, 'sideways_atr_min_pct': 0.02005274376966877, 'sideways_atr_max_pct': 0.06793491447619468, 'sideways_tp_mult': 1.2039708717532054, 'sideways_tsl_mult': 0.3283039405905247, 'sideways_time_stop': 115, 'sideways_use_sma': True, 'sideways_use_ema': False, 'sideways_use_atr': False, 'sideways_use_adx': False, 'sideways_use_spike': False, 'sideways_rsi_required': True}.
[I 2025-08-30 15:59:59,925] Trial 622 finished with values: [-1000000000.0, 1000000000.0] and parameters: {'p_sma': 26, 'p_std': 21, 'p_atr': 13, 'p_adx': 27, 'rsi_period': 64, 'ema1': 27, 'ema2': 36, 'slip_atr_k': 0.12884946760945012, 'slip_spread_k': 0.19905099856259878, 'spread_hl_frac': 0.008608416263618255, 'bb_std_mult': 0.7437909930344195, 'rsi_os': 27, 'rsi_ob': 87, 'vol_spike': 0.20653085639921406, 'adx_thresh': 20.49965157339437, 'atr_min_pct': 0.01561874663810366, 'atr_max_pct': 0.10912098011057678, 'tp_mult': 1.4516921403718748, 'tsl_mult': 0.38239252549248876, 'strategy': 'breakout', 'time_stop': 163, 'use_sma': True, 'use_atr': True, 'use_adx': False, 'use_ema': False, 'use_spike': False, 'rsi_required': False, 'edge_k': 0.5535514294998937, 'edge_cap': 0.36191152274203997, 'bull_strategy': 'breakout', 'bull_bb_std_mult': 2.090422970442825, 'bull_rsi_os': 45, 'bull_rsi_ob': 91, 'bull_adx_thresh': 18.45173001263579, 'bull_atr_min_pct': 0.01969079341859346, 'bull_atr_max_pct': 0.11548605090616129, 'bull_tp_mult': 2.552246716888695, 'bull_tsl_mult': 0.8693079659490122, 'bull_time_stop': 294, 'bull_use_sma': False, 'bull_use_ema': True, 'bull_use_atr': False, 'bull_use_adx': True, 'bull_use_spike': False, 'bull_rsi_required': False, 'bear_strategy': 'mean_reversion', 'bear_bb_std_mult': 1.9369696547440842, 'bear_rsi_os': 26, 'bear_rsi_ob': 75, 'bear_adx_thresh': 16.72984659625883, 'bear_atr_min_pct': 0.002006944366201119, 'bear_atr_max_pct': 0.07982191048895662, 'bear_tp_mult': 2.5215275791254257, 'bear_tsl_mult': 0.030206301257683532, 'bear_time_stop': 54, 'bear_use_sma': True, 'bear_use_ema': False, 'bear_use_atr': False, 'bear_use_adx': False, 'bear_use_spike': False, 'bear_rsi_required': True, 'sideways_strategy': 'mean_reversion', 'sideways_bb_std_mult': 1.7105914880051656, 'sideways_rsi_os': 25, 'sideways_rsi_ob': 69, 'sideways_adx_thresh': 10.118738405718357, 'sideways_atr_min_pct': 0.02983134681260432, 'sideways_atr_max_pct': 0.06701099195338275, 'sideways_tp_mult': 1.3300788856865342, 'sideways_tsl_mult': 0.7168927489937675, 'sideways_time_stop': 114, 'sideways_use_sma': True, 'sideways_use_ema': False, 'sideways_use_atr': False, 'sideways_use_adx': False, 'sideways_use_spike': False, 'sideways_rsi_required': True}.
[I 2025-08-30 16:00:01,511] Trial 623 finished with values: [-0.03559006875262016, 0.03556857537873938] and parameters: {'p_sma': 29, 'p_std': 21, 'p_atr': 30, 'p_adx': 23, 'rsi_period': 64, 'ema1': 21, 'ema2': 36, 'slip_atr_k': 0.11048905755781656, 'slip_spread_k': 0.7031008060633012, 'spread_hl_frac': 0.009755977737090108, 'bb_std_mult': 0.5952595537044494, 'rsi_os': 27, 'rsi_ob': 75, 'vol_spike': 0.07047025319252116, 'adx_thresh': 7.107707292451233, 'atr_min_pct': 0.0130413283707809, 'atr_max_pct': 0.1106271532974613, 'tp_mult': 1.583564153765605, 'tsl_mult': 0.37555196760891335, 'strategy': 'breakout', 'time_stop': 145, 'use_sma': False, 'use_atr': True, 'use_adx': False, 'use_ema': False, 'use_spike': True, 'rsi_required': False, 'edge_k': 1.9956617413703674, 'edge_cap': 0.8769519121576022, 'bull_strategy': 'breakout', 'bull_bb_std_mult': 1.6911480109644068, 'bull_rsi_os': 23, 'bull_rsi_ob': 94, 'bull_adx_thresh': 9.306559768583252, 'bull_atr_min_pct': 0.019543670702325246, 'bull_atr_max_pct': 0.11533110052722942, 'bull_tp_mult': 2.5611983058850303, 'bull_tsl_mult': 0.8704184136607437, 'bull_time_stop': 255, 'bull_use_sma': False, 'bull_use_ema': True, 'bull_use_atr': False, 'bull_use_adx': True, 'bull_use_spike': False, 'bull_rsi_required': False, 'bear_strategy': 'mean_reversion', 'bear_bb_std_mult': 0.8651447024507288, 'bear_rsi_os': 26, 'bear_rsi_ob': 76, 'bear_adx_thresh': 16.681971502380218, 'bear_atr_min_pct': 0.016782322852441228, 'bear_atr_max_pct': 0.11631252883935563, 'bear_tp_mult': 1.0365984756605329, 'bear_tsl_mult': 0.030634559644783954, 'bear_time_stop': 86, 'bear_use_sma': True, 'bear_use_ema': False, 'bear_use_atr': True, 'bear_use_adx': False, 'bear_use_spike': False, 'bear_rsi_required': True, 'sideways_strategy': 'mean_reversion', 'sideways_bb_std_mult': 3.18657141668508, 'sideways_rsi_os': 50, 'sideways_rsi_ob': 76, 'sideways_adx_thresh': 9.871618789933597, 'sideways_atr_min_pct': 0.0018071239539327634, 'sideways_atr_max_pct': 0.07495149743534202, 'sideways_tp_mult': 1.2377479066547643, 'sideways_tsl_mult': 0.4569385317755407, 'sideways_time_stop': 133, 'sideways_use_sma': True, 'sideways_use_ema': False, 'sideways_use_atr': False, 'sideways_use_adx': True, 'sideways_use_spike': False, 'sideways_rsi_required': True}.
[I 2025-08-30 16:00:02,296] Trial 624 finished with values: [-1000000000.0, 1000000000.0] and parameters: {'p_sma': 8, 'p_std': 19, 'p_atr': 23, 'p_adx': 23, 'rsi_period': 13, 'ema1': 21, 'ema2': 36, 'slip_atr_k': 0.1688654855918032, 'slip_spread_k': 0.04502194078670241, 'spread_hl_frac': 0.0091710543120925, 'bb_std_mult': 0.5894841823498691, 'rsi_os': 27, 'rsi_ob': 87, 'vol_spike': 0.21046942108328656, 'adx_thresh': 10.616334266987996, 'atr_min_pct': 0.013281869935011379, 'atr_max_pct': 0.10872264072097688, 'tp_mult': 2.721192424099887, 'tsl_mult': 0.3581491901427999, 'strategy': 'mean_reversion', 'time_stop': 175, 'use_sma': False, 'use_atr': False, 'use_adx': True, 'use_ema': False, 'use_spike': True, 'rsi_required': False, 'edge_k': 0.8090180898765541, 'edge_cap': 0.35613077956936773, 'bull_strategy': 'breakout', 'bull_bb_std_mult': 3.4477939015171373, 'bull_rsi_os': 45, 'bull_rsi_ob': 90, 'bull_adx_thresh': 17.732130222827692, 'bull_atr_min_pct': 0.019758771083685366, 'bull_atr_max_pct': 0.10091317254700015, 'bull_tp_mult': 2.689152384384366, 'bull_tsl_mult': 0.09677685320680635, 'bull_time_stop': 191, 'bull_use_sma': False, 'bull_use_ema': True, 'bull_use_atr': True, 'bull_use_adx': True, 'bull_use_spike': True, 'bull_rsi_required': False, 'bear_strategy': 'mean_reversion', 'bear_bb_std_mult': 2.4601242950523106, 'bear_rsi_os': 25, 'bear_rsi_ob': 76, 'bear_adx_thresh': 14.668134964220839, 'bear_atr_min_pct': 0.004556123352618595, 'bear_atr_max_pct': 0.11689151602453728, 'bear_tp_mult': 2.724442243891398, 'bear_tsl_mult': 0.842551712106868, 'bear_time_stop': 54, 'bear_use_sma': True, 'bear_use_ema': False, 'bear_use_atr': True, 'bear_use_adx': True, 'bear_use_spike': True, 'bear_rsi_required': True, 'sideways_strategy': 'mean_reversion', 'sideways_bb_std_mult': 2.490682840653563, 'sideways_rsi_os': 9, 'sideways_rsi_ob': 82, 'sideways_adx_thresh': 10.134476557073137, 'sideways_atr_min_pct': 0.005890235312936644, 'sideways_atr_max_pct': 0.06740681060302296, 'sideways_tp_mult': 1.3744023794592188, 'sideways_tsl_mult': 0.45654393583895825, 'sideways_time_stop': 139, 'sideways_use_sma': True, 'sideways_use_ema': False, 'sideways_use_atr': True, 'sideways_use_adx': True, 'sideways_use_spike': True, 'sideways_rsi_required': False}.
[I 2025-08-30 16:00:48,119] Trial 627 finished with values: [-1000000000.0, 1000000000.0] and parameters: {'p_sma': 9, 'p_std': 25, 'p_atr': 11, 'p_adx': 27, 'rsi_period': 13, 'ema1': 27, 'ema2': 40, 'slip_atr_k': 0.16693793969929732, 'slip_spread_k': 0.7302046443743319, 'spread_hl_frac': 0.0389817255369554, 'bb_std_mult': 1.803515784457494, 'rsi_os': 27, 'rsi_ob': 87, 'vol_spike': 0.16946129238768165, 'adx_thresh': 22.382149988568287, 'atr_min_pct': 0.005620864123087207, 'atr_max_pct': 0.11539004820775865, 'tp_mult': 1.5084314777975856, 'tsl_mult': 0.35474465835140695, 'strategy': 'mean_reversion', 'time_stop': 10, 'use_sma': False, 'use_atr': False, 'use_adx': True, 'use_ema': True, 'use_spike': True, 'rsi_required': True, 'edge_k': 0.5966042082630187, 'edge_cap': 0.9263877204787415, 'bull_strategy': 'mean_reversion', 'bull_bb_std_mult': 1.5427492850098412, 'bull_rsi_os': 52, 'bull_rsi_ob': 85, 'bull_adx_thresh': 26.997085254050585, 'bull_atr_min_pct': 0.020566864069324925, 'bull_atr_max_pct': 0.1021543227451511, 'bull_tp_mult': 2.3035946092473436, 'bull_tsl_mult': 0.9200287377176813, 'bull_time_stop': 63, 'bull_use_sma': True, 'bull_use_ema': True, 'bull_use_atr': True, 'bull_use_adx': True, 'bull_use_spike': True, 'bull_rsi_required': True, 'bear_strategy': 'breakout', 'bear_bb_std_mult': 1.8466761776035623, 'bear_rsi_os': 40, 'bear_rsi_ob': 93, 'bear_adx_thresh': 23.439771910757916, 'bear_atr_min_pct': 0.0024646650347278703, 'bear_atr_max_pct': 0.11212937135894897, 'bear_tp_mult': 2.323069782370611, 'bear_tsl_mult': 0.29697045564848956, 'bear_time_stop': 137, 'bear_use_sma': True, 'bear_use_ema': False, 'bear_use_atr': True, 'bear_use_adx': True, 'bear_use_spike': True, 'bear_rsi_required': False, 'sideways_strategy': 'mean_reversion', 'sideways_bb_std_mult': 2.4680230275132136, 'sideways_rsi_os': 22, 'sideways_rsi_ob': 79, 'sideways_adx_thresh': 9.18865513486589, 'sideways_atr_min_pct': 0.006421687755857398, 'sideways_atr_max_pct': 0.0762660507478265, 'sideways_tp_mult': 1.376351832537614, 'sideways_tsl_mult': 0.40898671254200203, 'sideways_time_stop': 243, 'sideways_use_sma': True, 'sideways_use_ema': False, 'sideways_use_atr': True, 'sideways_use_adx': True, 'sideways_use_spike': True, 'sideways_rsi_required': False}.
[I 2025-08-30 16:00:48,565] Trial 628 finished with values: [-1000000000.0, 1000000000.0] and parameters: {'p_sma': 9, 'p_std': 23, 'p_atr': 11, 'p_adx': 27, 'rsi_period': 72, 'ema1': 20, 'ema2': 37, 'slip_atr_k': 0.010877176241309199, 'slip_spread_k': 0.7268611908855716, 'spread_hl_frac': 0.010569339025929329, 'bb_std_mult': 1.7060922733280817, 'rsi_os': 28, 'rsi_ob': 52, 'vol_spike': 0.1999412729422097, 'adx_thresh': 8.363856289308512, 'atr_min_pct': 0.005550652697548985, 'atr_max_pct': 0.01963185584220522, 'tp_mult': 1.5177970257715394, 'tsl_mult': 0.32659723476488894, 'strategy': 'mean_reversion', 'time_stop': 151, 'use_sma': False, 'use_atr': False, 'use_adx': True, 'use_ema': True, 'use_spike': False, 'rsi_required': True, 'edge_k': 1.2981223438309328, 'edge_cap': 0.9358335336991828, 'bull_strategy': 'mean_reversion', 'bull_bb_std_mult': 1.5474611156836087, 'bull_rsi_os': 21, 'bull_rsi_ob': 45, 'bull_adx_thresh': 7.977633299560253, 'bull_atr_min_pct': 0.027440508790363402, 'bull_atr_max_pct': 0.10572202296563084, 'bull_tp_mult': 2.638756839306378, 'bull_tsl_mult': 0.7993810931893564, 'bull_time_stop': 66, 'bull_use_sma': True, 'bull_use_ema': True, 'bull_use_atr': True, 'bull_use_adx': True, 'bull_use_spike': True, 'bull_rsi_required': True, 'bear_strategy': 'breakout', 'bear_bb_std_mult': 1.8830169357248392, 'bear_rsi_os': 54, 'bear_rsi_ob': 77, 'bear_adx_thresh': 30.062414142772987, 'bear_atr_min_pct': 0.002238324856054071, 'bear_atr_max_pct': 0.11197149747141184, 'bear_tp_mult': 2.659472170596007, 'bear_tsl_mult': 0.7997847468436515, 'bear_time_stop': 222, 'bear_use_sma': False, 'bear_use_ema': False, 'bear_use_atr': True, 'bear_use_adx': True, 'bear_use_spike': True, 'bear_rsi_required': False, 'sideways_strategy': 'mean_reversion', 'sideways_bb_std_mult': 3.1389712570528334, 'sideways_rsi_os': 20, 'sideways_rsi_ob': 79, 'sideways_adx_thresh': 31.080947555122016, 'sideways_atr_min_pct': 0.006798328138363429, 'sideways_atr_max_pct': 0.0761190813934143, 'sideways_tp_mult': 1.3428882861840723, 'sideways_tsl_mult': 0.34128368189665137, 'sideways_time_stop': 211, 'sideways_use_sma': True, 'sideways_use_ema': False, 'sideways_use_atr': True, 'sideways_use_adx': True, 'sideways_use_spike': True, 'sideways_rsi_required': False}.
[I 2025-08-30 16:00:48,946] Trial 626 finished with values: [-1000000000.0, 1000000000.0] and parameters: {'p_sma': 9, 'p_std': 25, 'p_atr': 11, 'p_adx': 27, 'rsi_period': 13, 'ema1': 20, 'ema2': 37, 'slip_atr_k': 0.11287497966359125, 'slip_spread_k': 0.6607124870318382, 'spread_hl_frac': 0.03893448419067802, 'bb_std_mult': 0.8662039218696438, 'rsi_os': 27, 'rsi_ob': 56, 'vol_spike': 0.16738476465164578, 'adx_thresh': 7.200903617657937, 'atr_min_pct': 0.01298953425815377, 'atr_max_pct': 0.11715198535833504, 'tp_mult': 1.622942863730019, 'tsl_mult': 0.35674564417816496, 'strategy': 'mean_reversion', 'time_stop': 147, 'use_sma': False, 'use_atr': False, 'use_adx': True, 'use_ema': True, 'use_spike': True, 'rsi_required': True, 'edge_k': 0.808639489167003, 'edge_cap': 0.9265954293541366, 'bull_strategy': 'mean_reversion', 'bull_bb_std_mult': 3.42720515272009, 'bull_rsi_os': 21, 'bull_rsi_ob': 65, 'bull_adx_thresh': 9.5304731845181, 'bull_atr_min_pct': 0.02024850542522091, 'bull_atr_max_pct': 0.13336797400039824, 'bull_tp_mult': 2.5039068421251414, 'bull_tsl_mult': 0.09769960697867758, 'bull_time_stop': 63, 'bull_use_sma': True, 'bull_use_ema': True, 'bull_use_atr': True, 'bull_use_adx': True, 'bull_use_spike': True, 'bull_rsi_required': True, 'bear_strategy': 'breakout', 'bear_bb_std_mult': 2.4827045431564403, 'bear_rsi_os': 28, 'bear_rsi_ob': 77, 'bear_adx_thresh': 14.794322039996459, 'bear_atr_min_pct': 0.0025574088699591682, 'bear_atr_max_pct': 0.11610758858021744, 'bear_tp_mult': 2.720684212507812, 'bear_tsl_mult': 0.8495269635411019, 'bear_time_stop': 84, 'bear_use_sma': True, 'bear_use_ema': False, 'bear_use_atr': True, 'bear_use_adx': True, 'bear_use_spike': True, 'bear_rsi_required': False, 'sideways_strategy': 'mean_reversion', 'sideways_bb_std_mult': 1.3829496823858656, 'sideways_rsi_os': 5, 'sideways_rsi_ob': 76, 'sideways_adx_thresh': 7.679212746286891, 'sideways_atr_min_pct': 0.01395054894380838, 'sideways_atr_max_pct': 0.07503392287744692, 'sideways_tp_mult': 1.4088304025371048, 'sideways_tsl_mult': 0.47422532760906133, 'sideways_time_stop': 134, 'sideways_use_sma': True, 'sideways_use_ema': False, 'sideways_use_atr': True, 'sideways_use_adx': True, 'sideways_use_spike': True, 'sideways_rsi_required': False}.
[I 2025-08-30 16:00:49,316] Trial 625 finished with values: [-1000000000.0, 1000000000.0] and parameters: {'p_sma': 32, 'p_std': 21, 'p_atr': 13, 'p_adx': 27, 'rsi_period': 13, 'ema1': 21, 'ema2': 29, 'slip_atr_k': 0.23888098362782784, 'slip_spread_k': 0.18726318438349643, 'spread_hl_frac': 0.009423619170087813, 'bb_std_mult': 0.8644938319877815, 'rsi_os': 27, 'rsi_ob': 56, 'vol_spike': 0.1693984832755522, 'adx_thresh': 20.56805197891925, 'atr_min_pct': 0.0056129957164298755, 'atr_max_pct': 0.01955263193994832, 'tp_mult': 2.6188217477477984, 'tsl_mult': 0.35708879892151413, 'strategy': 'mean_reversion', 'time_stop': 146, 'use_sma': False, 'use_atr': False, 'use_adx': True, 'use_ema': True, 'use_spike': True, 'rsi_required': True, 'edge_k': 0.5854561742381639, 'edge_cap': 0.8823613665973568, 'bull_strategy': 'mean_reversion', 'bull_bb_std_mult': 1.5439542308764067, 'bull_rsi_os': 52, 'bull_rsi_ob': 45, 'bull_adx_thresh': 9.322817226513012, 'bull_atr_min_pct': 0.02639461902713256, 'bull_atr_max_pct': 0.10165298203473747, 'bull_tp_mult': 2.654470190473303, 'bull_tsl_mult': 0.2186464234357649, 'bull_time_stop': 63, 'bull_use_sma': True, 'bull_use_ema': True, 'bull_use_atr': True, 'bull_use_adx': True, 'bull_use_spike': True, 'bull_rsi_required': False, 'bear_strategy': 'breakout', 'bear_bb_std_mult': 2.617755121493233, 'bear_rsi_os': 25, 'bear_rsi_ob': 76, 'bear_adx_thresh': 30.14642338348299, 'bear_atr_min_pct': 0.0020121248532534784, 'bear_atr_max_pct': 0.028467606344591403, 'bear_tp_mult': 2.7249994485515603, 'bear_tsl_mult': 0.29408334212698983, 'bear_time_stop': 99, 'bear_use_sma': True, 'bear_use_ema': False, 'bear_use_atr': True, 'bear_use_adx': True, 'bear_use_spike': True, 'bear_rsi_required': False, 'sideways_strategy': 'mean_reversion', 'sideways_bb_std_mult': 1.3897053689192607, 'sideways_rsi_os': 20, 'sideways_rsi_ob': 76, 'sideways_adx_thresh': 10.063248049255947, 'sideways_atr_min_pct': 0.017625747314732654, 'sideways_atr_max_pct': 0.07612736654071477, 'sideways_tp_mult': 1.4111921151055493, 'sideways_tsl_mult': 0.4120880964576015, 'sideways_time_stop': 21, 'sideways_use_sma': True, 'sideways_use_ema': False, 'sideways_use_atr': True, 'sideways_use_adx': True, 'sideways_use_spike': True, 'sideways_rsi_required': False}.
[I 2025-08-30 16:01:33,189] Trial 629 finished with values: [-0.015692428348861198, 0.01623833713164024] and parameters: {'p_sma': 6, 'p_std': 23, 'p_atr': 10, 'p_adx': 12, 'rsi_period': 11, 'ema1': 20, 'ema2': 37, 'slip_atr_k': 0.00923194259086037, 'slip_spread_k': 0.64773724463381, 'spread_hl_frac': 0.010957990126054593, 'bb_std_mult': 0.8499149852973351, 'rsi_os': 28, 'rsi_ob': 83, 'vol_spike': 0.14474814005644712, 'adx_thresh': 8.199011487768711, 'atr_min_pct': 0.007375234254768285, 'atr_max_pct': 0.015689610183879266, 'tp_mult': 1.4949430543711273, 'tsl_mult': 0.31946846113480964, 'strategy': 'breakout', 'time_stop': 149, 'use_sma': False, 'use_atr': False, 'use_adx': True, 'use_ema': True, 'use_spike': False, 'rsi_required': True, 'edge_k': 0.007940475435285532, 'edge_cap': 0.9803622764806722, 'bull_strategy': 'mean_reversion', 'bull_bb_std_mult': 3.29591823908858, 'bull_rsi_os': 33, 'bull_rsi_ob': 65, 'bull_adx_thresh': 8.065053198559832, 'bull_atr_min_pct': 0.0073829107761953115, 'bull_atr_max_pct': 0.10557308137241608, 'bull_tp_mult': 2.631614391137097, 'bull_tsl_mult': 0.8542936164998528, 'bull_time_stop': 58, 'bull_use_sma': True, 'bull_use_ema': True, 'bull_use_atr': True, 'bull_use_adx': True, 'bull_use_spike': True, 'bull_rsi_required': False, 'bear_strategy': 'breakout', 'bear_bb_std_mult': 1.8951901704221632, 'bear_rsi_os': 28, 'bear_rsi_ob': 48, 'bear_adx_thresh': 13.627953034969863, 'bear_atr_min_pct': 0.0019015504870639735, 'bear_atr_max_pct': 0.1117942142542715, 'bear_tp_mult': 2.657720233180342, 'bear_tsl_mult': 0.39117888779717414, 'bear_time_stop': 97, 'bear_use_sma': False, 'bear_use_ema': False, 'bear_use_atr': True, 'bear_use_adx': True, 'bear_use_spike': True, 'bear_rsi_required': False, 'sideways_strategy': 'mean_reversion', 'sideways_bb_std_mult': 3.1748844746095375, 'sideways_rsi_os': 5, 'sideways_rsi_ob': 79, 'sideways_adx_thresh': 33.58690718047514, 'sideways_atr_min_pct': 0.01846334776740931, 'sideways_atr_max_pct': 0.07071077780429179, 'sideways_tp_mult': 1.4179668203423297, 'sideways_tsl_mult': 0.41792072801990143, 'sideways_time_stop': 130, 'sideways_use_sma': True, 'sideways_use_ema': False, 'sideways_use_atr': True, 'sideways_use_adx': True, 'sideways_use_spike': True, 'sideways_rsi_required': True}.
