[I 2025-08-30 15:58:23,788] Trial 613 finished with values: [-1000000000.0, 1000000000.0] and parameters: {'p_sma': 10, 'p_std': 48, 'p_atr': 10, 'p_adx': 24, 'rsi_period': 41, 'ema1': 29, 'ema2': 38, 'slip_atr_k': 0.06897274324605067, 'slip_spread_k': 0.7623435535882186, 'spread_hl_frac': 0.008271555424326622, 'bb_std_mult': 2.5831568095499855, 'rsi_os': 31, 'rsi_ob': 86, 'vol_spike': 0.21415120284845626, 'adx_thresh': 29.613273680415062, 'atr_min_pct': 0.0071979987780741005, 'atr_max_pct': 0.14259417242042594, 'tp_mult': 1.5672107959747918, 'tsl_mult': 0.312031437549549, 'strategy': 'breakout', 'time_stop': 49, 'use_sma': False, 'use_atr': False, 'use_adx': True, 'use_ema': False, 'use_spike': False, 'rsi_required': False, 'edge_k': 0.6389793732581988, 'edge_cap': 0.9179008387286363, 'bull_strategy': 'breakout', 'bull_bb_std_mult': 1.0450561638705136, 'bull_rsi_os': 52, 'bull_rsi_ob': 88, 'bull_adx_thresh': 10.001057829577968, 'bull_atr_min_pct': 0.01838860605363916, 'bull_atr_max_pct': 0.1003692543144473, 'bull_tp_mult': 1.7828452225936307, 'bull_tsl_mult': 0.0002907228382761362, 'bull_time_stop': 272, 'bull_use_sma': True, 'bull_use_ema': False, 'bull_use_atr': False, 'bull_use_adx': True, 'bull_use_spike': True, 'bull_rsi_required': False, 'bear_strategy': 'mean_reversion', 'bear_bb_std_mult': 2.6949350226081585, 'bear_rsi_os': 52, 'bear_rsi_ob': 78, 'bear_adx_thresh': 33.82154139422467, 'bear_atr_min_pct': 0.00288540106199183, 'bear_atr_max_pct': 0.10932759689105882, 'bear_tp_mult': 2.7821735966462997, 'bear_tsl_mult': 0.8751558627425678, 'bear_time_stop': 105, 'bear_use_sma': True, 'bear_use_ema': True, 'bear_use_atr': True, 'bear_use_adx': True, 'bear_use_spike': False, 'bear_rsi_required': True, 'sideways_strategy': 'breakout', 'sideways_bb_std_mult': 1.567651541476798, 'sideways_rsi_os': 21, 'sideways_rsi_ob': 79, 'sideways_adx_thresh': 11.151348119935115, 'sideways_atr_min_pct': 0.020765797806934896, 'sideways_atr_max_pct': 0.07220930370584307, 'sideways_tp_mult': 1.0154999744873665, 'sideways_tsl_mult': 0.38487946422441943, 'sideways_time_stop': 126, 'sideways_use_sma': False, 'sideways_use_ema': True, 'sideways_use_atr': True, 'sideways_use_adx': True, 'sideways_use_spike': False, 'sideways_rsi_required': False}.
[I 2025-08-30 15:58:24,182] Trial 612 finished with values: [-1000000000.0, 1000000000.0] and parameters: {'p_sma': 10, 'p_std': 18, 'p_atr': 11, 'p_adx': 26, 'rsi_period': 10, 'ema1': 12, 'ema2': 38, 'slip_atr_k': 0.05756170939150233, 'slip_spread_k': 0.7442529959223436, 'spread_hl_frac': 0.02850670810001001, 'bb_std_mult': 0.5664253016335423, 'rsi_os': 26, 'rsi_ob': 65, 'vol_spike': 0.0470286879438009, 'adx_thresh': 26.06782561789904, 'atr_min_pct': 0.0175851567665141, 'atr_max_pct': 0.04660950485920323, 'tp_mult': 1.2841784125135003, 'tsl_mult': 0.3150266620374902, 'strategy': 'mean_reversion', 'time_stop': 55, 'use_sma': False, 'use_atr': False, 'use_adx': True, 'use_ema': False, 'use_spike': False, 'rsi_required': False, 'edge_k': 0.6406402663897317, 'edge_cap': 0.24614262280198446, 'bull_strategy': 'breakout', 'bull_bb_std_mult': 1.625736328984448, 'bull_rsi_os': 38, 'bull_rsi_ob': 60, 'bull_adx_thresh': 10.761438497888955, 'bull_atr_min_pct': 0.0184656951931906, 'bull_atr_max_pct': 0.10136754703744427, 'bull_tp_mult': 2.577930444431478, 'bull_tsl_mult': 0.8859281633458789, 'bull_time_stop': 51, 'bull_use_sma': True, 'bull_use_ema': False, 'bull_use_atr': True, 'bull_use_adx': True, 'bull_use_spike': True, 'bull_rsi_required': False, 'bear_strategy': 'mean_reversion', 'bear_bb_std_mult': 1.4233931976051397, 'bear_rsi_os': 45, 'bear_rsi_ob': 78, 'bear_adx_thresh': 15.856302492681547, 'bear_atr_min_pct': 0.0074979954576393755, 'bear_atr_max_pct': 0.10950312379293363, 'bear_tp_mult': 2.7761267242139467, 'bear_tsl_mult': 0.35993475480513054, 'bear_time_stop': 17, 'bear_use_sma': True, 'bear_use_ema': True, 'bear_use_atr': True, 'bear_use_adx': True, 'bear_use_spike': True, 'bear_rsi_required': True, 'sideways_strategy': 'breakout', 'sideways_bb_std_mult': 3.0026568051586375, 'sideways_rsi_os': 18, 'sideways_rsi_ob': 80, 'sideways_adx_thresh': 11.069521355020735, 'sideways_atr_min_pct': 0.020813481693447777, 'sideways_atr_max_pct': 0.07256704814211275, 'sideways_tp_mult': 1.0358950414302428, 'sideways_tsl_mult': 0.3855879166845264, 'sideways_time_stop': 121, 'sideways_use_sma': False, 'sideways_use_ema': True, 'sideways_use_atr': True, 'sideways_use_adx': True, 'sideways_use_spike': True, 'sideways_rsi_required': False}.
[I 2025-08-30 15:58:25,104] Trial 611 finished with values: [-1000000000.0, 1000000000.0] and parameters: {'p_sma': 10, 'p_std': 18, 'p_atr': 11, 'p_adx': 26, 'rsi_period': 10, 'ema1': 12, 'ema2': 38, 'slip_atr_k': 0.17948789861382342, 'slip_spread_k': 0.7695737783420803, 'spread_hl_frac': 0.043047792497201254, 'bb_std_mult': 0.6413405532587308, 'rsi_os': 26, 'rsi_ob': 86, 'vol_spike': 0.21609020651388863, 'adx_thresh': 7.948255399234023, 'atr_min_pct': 0.017882286731796142, 'atr_max_pct': 0.11390282568616976, 'tp_mult': 1.5227208341942773, 'tsl_mult': 0.34210297298593395, 'strategy': 'breakout', 'time_stop': 53, 'use_sma': False, 'use_atr': False, 'use_adx': True, 'use_ema': False, 'use_spike': True, 'rsi_required': False, 'edge_k': 0.6298648323887146, 'edge_cap': 0.9653822075267076, 'bull_strategy': 'breakout', 'bull_bb_std_mult': 1.6033871012045857, 'bull_rsi_os': 38, 'bull_rsi_ob': 86, 'bull_adx_thresh': 10.656862633221523, 'bull_atr_min_pct': 0.018526941050614004, 'bull_atr_max_pct': 0.13863321611652837, 'bull_tp_mult': 2.5816163168192707, 'bull_tsl_mult': 0.8952662401365045, 'bull_time_stop': 274, 'bull_use_sma': True, 'bull_use_ema': False, 'bull_use_atr': True, 'bull_use_adx': True, 'bull_use_spike': True, 'bull_rsi_required': False, 'bear_strategy': 'mean_reversion', 'bear_bb_std_mult': 2.6963742789709326, 'bear_rsi_os': 27, 'bear_rsi_ob': 73, 'bear_adx_thresh': 15.492304394317852, 'bear_atr_min_pct': 0.0007262629733194731, 'bear_atr_max_pct': 0.10961434866541807, 'bear_tp_mult': 2.691529652246563, 'bear_tsl_mult': 0.1888764739574314, 'bear_time_stop': 107, 'bear_use_sma': True, 'bear_use_ema': True, 'bear_use_atr': True, 'bear_use_adx': True, 'bear_use_spike': True, 'bear_rsi_required': True, 'sideways_strategy': 'breakout', 'sideways_bb_std_mult': 3.290278784511698, 'sideways_rsi_os': 7, 'sideways_rsi_ob': 78, 'sideways_adx_thresh': 8.51155185671831, 'sideways_atr_min_pct': 0.021485078805204658, 'sideways_atr_max_pct': 0.02804858091113984, 'sideways_tp_mult': 2.7190944497119593, 'sideways_tsl_mult': 0.5405692655151728, 'sideways_time_stop': 122, 'sideways_use_sma': False, 'sideways_use_ema': True, 'sideways_use_atr': True, 'sideways_use_adx': True, 'sideways_use_spike': True, 'sideways_rsi_required': True}.
[I 2025-08-30 15:58:26,007] Trial 616 finished with values: [-1000000000.0, 1000000000.0] and parameters: {'p_sma': 7, 'p_std': 24, 'p_atr': 12, 'p_adx': 21, 'rsi_period': 9, 'ema1': 24, 'ema2': 41, 'slip_atr_k': 0.004264993270246667, 'slip_spread_k': 0.45863118327933455, 'spread_hl_frac': 0.005959302650957459, 'bb_std_mult': 0.5605143893930417, 'rsi_os': 27, 'rsi_ob': 45, 'vol_spike': 0.2308802392835489, 'adx_thresh': 7.865057792721384, 'atr_min_pct': 0.006544451298365451, 'atr_max_pct': 0.11935253762082661, 'tp_mult': 1.5344357115641758, 'tsl_mult': 0.36007760127445704, 'strategy': 'mean_reversion', 'time_stop': 159, 'use_sma': False, 'use_atr': False, 'use_adx': True, 'use_ema': False, 'use_spike': False, 'rsi_required': False, 'edge_k': 0.13194498523599807, 'edge_cap': 0.9699859578351044, 'bull_strategy': 'breakout', 'bull_bb_std_mult': 0.7284906446463215, 'bull_rsi_os': 48, 'bull_rsi_ob': 86, 'bull_adx_thresh': 10.610876226053263, 'bull_atr_min_pct': 0.020967856305413927, 'bull_atr_max_pct': 0.10581520553410143, 'bull_tp_mult': 1.6027577948988303, 'bull_tsl_mult': 0.8795827581487711, 'bull_time_stop': 52, 'bull_use_sma': True, 'bull_use_ema': True, 'bull_use_atr': True, 'bull_use_adx': True, 'bull_use_spike': True, 'bull_rsi_required': False, 'bear_strategy': 'mean_reversion', 'bear_bb_std_mult': 1.7816500835270557, 'bear_rsi_os': 25, 'bear_rsi_ob': 74, 'bear_adx_thresh': 32.826274550685056, 'bear_atr_min_pct': 0.002311638669912831, 'bear_atr_max_pct': 0.10960342063567735, 'bear_tp_mult': 2.705242904662077, 'bear_tsl_mult': 0.8944934860034432, 'bear_time_stop': 96, 'bear_use_sma': False, 'bear_use_ema': False, 'bear_use_atr': True, 'bear_use_adx': True, 'bear_use_spike': True, 'bear_rsi_required': True, 'sideways_strategy': 'mean_reversion', 'sideways_bb_std_mult': 2.8417747511478306, 'sideways_rsi_os': 53, 'sideways_rsi_ob': 94, 'sideways_adx_thresh': 23.714713238031713, 'sideways_atr_min_pct': 0.018957300668946252, 'sideways_atr_max_pct': 0.12451554612603064, 'sideways_tp_mult': 1.608364183371882, 'sideways_tsl_mult': 0.3648042882891629, 'sideways_time_stop': 129, 'sideways_use_sma': True, 'sideways_use_ema': False, 'sideways_use_atr': True, 'sideways_use_adx': True, 'sideways_use_spike': True, 'sideways_rsi_required': True}.
[I 2025-08-30 15:58:26,214] Trial 615 finished with values: [-1000000000.0, 1000000000.0] and parameters: {'p_sma': 9, 'p_std': 23, 'p_atr': 11, 'p_adx': 26, 'rsi_period': 77, 'ema1': 25, 'ema2': 41, 'slip_atr_k': 0.20197782433409428, 'slip_spread_k': 0.6775102120954032, 'spread_hl_frac': 0.006039032097174777, 'bb_std_mult': 0.7247168919743802, 'rsi_os': 31, 'rsi_ob': 45, 'vol_spike': 0.006643978472284068, 'adx_thresh': 29.663278863374615, 'atr_min_pct': 0.025360038867600423, 'atr_max_pct': 0.010060955291712637, 'tp_mult': 1.4511946699275393, 'tsl_mult': 0.030310055923295443, 'strategy': 'breakout', 'time_stop': 158, 'use_sma': False, 'use_atr': False, 'use_adx': True, 'use_ema': False, 'use_spike': False, 'rsi_required': False, 'edge_k': 0.5618076617683441, 'edge_cap': 0.9999984773131729, 'bull_strategy': 'breakout', 'bull_bb_std_mult': 1.817683482910074, 'bull_rsi_os': 48, 'bull_rsi_ob': 86, 'bull_adx_thresh': 10.081428636614536, 'bull_atr_min_pct': 0.020789664016717193, 'bull_atr_max_pct': 0.11065900223174292, 'bull_tp_mult': 2.890592368662726, 'bull_tsl_mult': 0.8831097320810408, 'bull_time_stop': 52, 'bull_use_sma': True, 'bull_use_ema': False, 'bull_use_atr': True, 'bull_use_adx': True, 'bull_use_spike': True, 'bull_rsi_required': False, 'bear_strategy': 'mean_reversion', 'bear_bb_std_mult': 0.7231556678806565, 'bear_rsi_os': 52, 'bear_rsi_ob': 74, 'bear_adx_thresh': 22.455046879755958, 'bear_atr_min_pct': 0.020582619885027097, 'bear_atr_max_pct': 0.03707202793269152, 'bear_tp_mult': 2.775957220003143, 'bear_tsl_mult': 0.8991608500227429, 'bear_time_stop': 72, 'bear_use_sma': True, 'bear_use_ema': True, 'bear_use_atr': True, 'bear_use_adx': True, 'bear_use_spike': True, 'bear_rsi_required': True, 'sideways_strategy': 'mean_reversion', 'sideways_bb_std_mult': 3.2386184401838225, 'sideways_rsi_os': 11, 'sideways_rsi_ob': 73, 'sideways_adx_thresh': 12.142549402572003, 'sideways_atr_min_pct': 0.020563913114332994, 'sideways_atr_max_pct': 0.07266084824829107, 'sideways_tp_mult': 1.0245286877369488, 'sideways_tsl_mult': 0.37709779324528103, 'sideways_time_stop': 129, 'sideways_use_sma': False, 'sideways_use_ema': False, 'sideways_use_atr': True, 'sideways_use_adx': True, 'sideways_use_spike': True, 'sideways_rsi_required': True}.
[I 2025-08-30 15:59:10,701] Trial 617 finished with values: [-1000000000.0, 1000000000.0] and parameters: {'p_sma': 7, 'p_std': 54, 'p_atr': 27, 'p_adx': 23, 'rsi_period': 8, 'ema1': 24, 'ema2': 23, 'slip_atr_k': 2.1285841716600943e-05, 'slip_spread_k': 0.6201847155989746, 'spread_hl_frac': 0.006004218037098045, 'bb_std_mult': 0.693106622238971, 'rsi_os': 28, 'rsi_ob': 48, 'vol_spike': 0.21944457462501318, 'adx_thresh': 32.27115447440655, 'atr_min_pct': 0.006582405399339654, 'atr_max_pct': 0.11363953980229621, 'tp_mult': 1.0541872810368074, 'tsl_mult': 0.8137483198855283, 'strategy': 'breakout', 'time_stop': 70, 'use_sma': False, 'use_atr': False, 'use_adx': True, 'use_ema': False, 'use_spike': False, 'rsi_required': False, 'edge_k': 0.9011226361616187, 'edge_cap': 0.3260018058104788, 'bull_strategy': 'breakout', 'bull_bb_std_mult': 1.4245812305104562, 'bull_rsi_os': 26, 'bull_rsi_ob': 86, 'bull_adx_thresh': 5.320439675763378, 'bull_atr_min_pct': 0.020898714570063922, 'bull_atr_max_pct': 0.11060469108096721, 'bull_tp_mult': 1.6314846128635485, 'bull_tsl_mult': 0.9170835589394833, 'bull_time_stop': 202, 'bull_use_sma': True, 'bull_use_ema': True, 'bull_use_atr': True, 'bull_use_adx': True, 'bull_use_spike': True, 'bull_rsi_required': False, 'bear_strategy': 'mean_reversion', 'bear_bb_std_mult': 1.8089733228437077, 'bear_rsi_os': 22, 'bear_rsi_ob': 74, 'bear_adx_thresh': 15.042748640905108, 'bear_atr_min_pct': 0.020487812212137555, 'bear_atr_max_pct': 0.10431348909104102, 'bear_tp_mult': 2.618768210456592, 'bear_tsl_mult': 0.9066362535703621, 'bear_time_stop': 98, 'bear_use_sma': False, 'bear_use_ema': False, 'bear_use_atr': True, 'bear_use_adx': True, 'bear_use_spike': True, 'bear_rsi_required': True, 'sideways_strategy': 'mean_reversion', 'sideways_bb_std_mult': 3.246221672385394, 'sideways_rsi_os': 11, 'sideways_rsi_ob': 84, 'sideways_adx_thresh': 28.510555484383264, 'sideways_atr_min_pct': 0.019132897310423773, 'sideways_atr_max_pct': 0.12095125522777234, 'sideways_tp_mult': 1.8259292479124531, 'sideways_tsl_mult': 0.3596105602929354, 'sideways_time_stop': 277, 'sideways_use_sma': True, 'sideways_use_ema': False, 'sideways_use_atr': True, 'sideways_use_adx': True, 'sideways_use_spike': True, 'sideways_rsi_required': True}.
[I 2025-08-30 15:59:11,844] Trial 618 finished with values: [-0.0041423963604880765, 0.006894889075283814] and parameters: {'p_sma': 8, 'p_std': 23, 'p_atr': 27, 'p_adx': 25, 'rsi_period': 8, 'ema1': 22, 'ema2': 36, 'slip_atr_k': 0.004031210790569707, 'slip_spread_k': 0.6834274630924018, 'spread_hl_frac': 0.0059377468262643285, 'bb_std_mult': 0.7269924886624255, 'rsi_os': 28, 'rsi_ob': 88, 'vol_spike': 0.00519958740351284, 'adx_thresh': 20.498855776369332, 'atr_min_pct': 0.022157753615494047, 'atr_max_pct': 0.11865047953874659, 'tp_mult': 1.4332637319920711, 'tsl_mult': 0.6420861466211424, 'strategy': 'breakout', 'time_stop': 162, 'use_sma': False, 'use_atr': False, 'use_adx': True, 'use_ema': False, 'use_spike': False, 'rsi_required': False, 'edge_k': 0.564908541940761, 'edge_cap': 0.33063576474243433, 'bull_strategy': 'breakout', 'bull_bb_std_mult': 2.094925138170557, 'bull_rsi_os': 48, 'bull_rsi_ob': 86, 'bull_adx_thresh': 8.737604032362075, 'bull_atr_min_pct': 0.020630001629776955, 'bull_atr_max_pct': 0.11051982349216365, 'bull_tp_mult': 2.8896793686073763, 'bull_tsl_mult': 0.9181779960708698, 'bull_time_stop': 40, 'bull_use_sma': True, 'bull_use_ema': True, 'bull_use_atr': True, 'bull_use_adx': True, 'bull_use_spike': True, 'bull_rsi_required': False, 'bear_strategy': 'mean_reversion', 'bear_bb_std_mult': 2.050098734962633, 'bear_rsi_os': 25, 'bear_rsi_ob': 75, 'bear_adx_thresh': 16.686876141505422, 'bear_atr_min_pct': 0.001997347578451127, 'bear_atr_max_pct': 0.1048899074035118, 'bear_tp_mult': 2.5229468009415803, 'bear_tsl_mult': 0.0270305633426568, 'bear_time_stop': 96, 'bear_use_sma': False, 'bear_use_ema': False, 'bear_use_atr': True, 'bear_use_adx': True, 'bear_use_spike': True, 'bear_rsi_required': True, 'sideways_strategy': 'mean_reversion', 'sideways_bb_std_mult': 1.715972364513746, 'sideways_rsi_os': 9, 'sideways_rsi_ob': 94, 'sideways_adx_thresh': 12.404940305150593, 'sideways_atr_min_pct': 0.018846031007158315, 'sideways_atr_max_pct': 0.06620039144831943, 'sideways_tp_mult': 1.6026797090968883, 'sideways_tsl_mult': 0.3617268250234635, 'sideways_time_stop': 130, 'sideways_use_sma': True, 'sideways_use_ema': False, 'sideways_use_atr': True, 'sideways_use_adx': True, 'sideways_use_spike': True, 'sideways_rsi_required': True}.
[I 2025-08-30 15:59:13,775] Trial 619 finished with values: [-1000000000.0, 1000000000.0] and parameters: {'p_sma': 7, 'p_std': 22, 'p_atr': 12, 'p_adx': 20, 'rsi_period': 69, 'ema1': 7, 'ema2': 23, 'slip_atr_k': 0.00038233499607305923, 'slip_spread_k': 0.6787338935822782, 'spread_hl_frac': 0.007384982967176944, 'bb_std_mult': 0.7395372919651094, 'rsi_os': 25, 'rsi_ob': 59, 'vol_spike': 0.20664541173836287, 'adx_thresh': 32.44304919004654, 'atr_min_pct': 0.006458799004352108, 'atr_max_pct': 0.12905547522675573, 'tp_mult': 1.431055911948484, 'tsl_mult': 0.37891605078265145, 'strategy': 'breakout', 'time_stop': 37, 'use_sma': True, 'use_atr': True, 'use_adx': False, 'use_ema': False, 'use_spike': False, 'rsi_required': False, 'edge_k': 0.5528507147996461, 'edge_cap': 0.9564552730757426, 'bull_strategy': 'breakout', 'bull_bb_std_mult': 1.4357835035647577, 'bull_rsi_os': 47, 'bull_rsi_ob': 72, 'bull_adx_thresh': 8.701213880586389, 'bull_atr_min_pct': 0.009699255868605407, 'bull_atr_max_pct': 0.09421757008928709, 'bull_tp_mult': 2.5529533079040605, 'bull_tsl_mult': 0.9099065843220372, 'bull_time_stop': 290, 'bull_use_sma': True, 'bull_use_ema': True, 'bull_use_atr': True, 'bull_use_adx': True, 'bull_use_spike': True, 'bull_rsi_required': False, 'bear_strategy': 'mean_reversion', 'bear_bb_std_mult': 2.06021718731416, 'bear_rsi_os': 37, 'bear_rsi_ob': 75, 'bear_adx_thresh': 16.18792213138516, 'bear_atr_min_pct': 0.008169245260382277, 'bear_atr_max_pct': 0.09037671659934084, 'bear_tp_mult': 2.6151974541161236, 'bear_tsl_mult': 0.9661989000444127, 'bear_time_stop': 70, 'bear_use_sma': True, 'bear_use_ema': False, 'bear_use_atr': False, 'bear_use_adx': False, 'bear_use_spike': True, 'bear_rsi_required': True, 'sideways_strategy': 'mean_reversion', 'sideways_bb_std_mult': 1.695208776201458, 'sideways_rsi_os': 8, 'sideways_rsi_ob': 90, 'sideways_adx_thresh': 12.36746036837846, 'sideways_atr_min_pct': 0.0200109510654831, 'sideways_atr_max_pct': 0.14497141974986166, 'sideways_tp_mult': 1.8063420419138556, 'sideways_tsl_mult': 0.3160726279137467, 'sideways_time_stop': 116, 'sideways_use_sma': True, 'sideways_use_ema': False, 'sideways_use_atr': False, 'sideways_use_adx': False, 'sideways_use_spike': True, 'sideways_rsi_required': True}.
[I 2025-08-30 15:59:14,124] Trial 620 finished with values: [-1000000000.0, 1000000000.0] and parameters: {'p_sma': 30, 'p_std': 22, 'p_atr': 30, 'p_adx': 20, 'rsi_period': 8, 'ema1': 7, 'ema2': 36, 'slip_atr_k': 0.00019077002178856723, 'slip_spread_k': 0.6938292729294294, 'spread_hl_frac': 0.007601330317563656, 'bb_std_mult': 0.7151254331880703, 'rsi_os': 28, 'rsi_ob': 87, 'vol_spike': 0.19670039357968785, 'adx_thresh': 9.151558896541886, 'atr_min_pct': 0.022167949787358317, 'atr_max_pct': 0.024993177608973155, 'tp_mult': 1.4412080394257833, 'tsl_mult': 0.9981698277454514, 'strategy': 'breakout', 'time_stop': 42, 'use_sma': True, 'use_atr': True, 'use_adx': False, 'use_ema': False, 'use_spike': False, 'rsi_required': False, 'edge_k': 0.6746684651996979, 'edge_cap': 0.32794513327232244, 'bull_strategy': 'breakout', 'bull_bb_std_mult': 1.6887531192161502, 'bull_rsi_os': 25, 'bull_rsi_ob': 89, 'bull_adx_thresh': 5.495531103446105, 'bull_atr_min_pct': 0.009748282843511898, 'bull_atr_max_pct': 0.10712457874680156, 'bull_tp_mult': 1.8950403005343193, 'bull_tsl_mult': 0.7515275705713345, 'bull_time_stop': 40, 'bull_use_sma': False, 'bull_use_ema': True, 'bull_use_atr': False, 'bull_use_adx': True, 'bull_use_spike': False, 'bull_rsi_required': False, 'bear_strategy': 'mean_reversion', 'bear_bb_std_mult': 1.1227038028113978, 'bear_rsi_os': 27, 'bear_rsi_ob': 75, 'bear_adx_thresh': 16.489714708112306, 'bear_atr_min_pct': 0.01709555567442224, 'bear_atr_max_pct': 0.10443005094908132, 'bear_tp_mult': 2.5236061918106385, 'bear_tsl_mult': 0.32750080826609973, 'bear_time_stop': 90, 'bear_use_sma': False, 'bear_use_ema': False, 'bear_use_atr': False, 'bear_use_adx': False, 'bear_use_spike': False, 'bear_rsi_required': True, 'sideways_strategy': 'mean_reversion', 'sideways_bb_std_mult': 3.0690946764784672, 'sideways_rsi_os': 50, 'sideways_rsi_ob': 69, 'sideways_adx_thresh': 6.5346400612004985, 'sideways_atr_min_pct': 0.019161134850787034, 'sideways_atr_max_pct': 0.11947621114328302, 'sideways_tp_mult': 1.8126087348234763, 'sideways_tsl_mult': 0.021752019798023436, 'sideways_time_stop': 188, 'sideways_use_sma': True, 'sideways_use_ema': False, 'sideways_use_atr': False, 'sideways_use_adx': False, 'sideways_use_spike': False, 'sideways_rsi_required': True}.
