[I 2025-08-30 16:10:03,220] Trial 677 finished with values: [-1000000000.0, 1000000000.0] and parameters: {'p_sma': 8, 'p_std': 22, 'p_atr': 13, 'p_adx': 24, 'rsi_period': 72, 'ema1': 26, 'ema2': 57, 'slip_atr_k': 0.2037127902232145, 'slip_spread_k': 0.6003805845565611, 'spread_hl_frac': 0.025931416351766504, 'bb_std_mult': 0.7073427774899681, 'rsi_os': 15, 'rsi_ob': 66, 'vol_spike': 0.23290458230155775, 'adx_thresh': 7.792694114275606, 'atr_min_pct': 0.023866276159225062, 'atr_max_pct': 0.11214312998626447, 'tp_mult': 1.449404555765749, 'tsl_mult': 0.3302471599460544, 'strategy': 'mean_reversion', 'time_stop': 110, 'use_sma': False, 'use_atr': False, 'use_adx': True, 'use_ema': True, 'use_spike': False, 'rsi_required': False, 'edge_k': 0.5110758358602554, 'edge_cap': 0.9844154676652548, 'bull_strategy': 'mean_reversion', 'bull_bb_std_mult': 1.7966643208557709, 'bull_rsi_os': 49, 'bull_rsi_ob': 90, 'bull_adx_thresh': 19.26840501936166, 'bull_atr_min_pct': 0.018697228570679233, 'bull_atr_max_pct': 0.030096048260650696, 'bull_tp_mult': 1.482496850714891, 'bull_tsl_mult': 0.8803287740781546, 'bull_time_stop': 68, 'bull_use_sma': False, 'bull_use_ema': False, 'bull_use_atr': False, 'bull_use_adx': True, 'bull_use_spike': False, 'bull_rsi_required': False, 'bear_strategy': 'breakout', 'bear_bb_std_mult': 1.3010402361361644, 'bear_rsi_os': 24, 'bear_rsi_ob': 69, 'bear_adx_thresh': 15.072914553137686, 'bear_atr_min_pct': 0.023963507965927704, 'bear_atr_max_pct': 0.13631109432734076, 'bear_tp_mult': 1.0124213269376114, 'bear_tsl_mult': 0.8213656707440753, 'bear_time_stop': 154, 'bear_use_sma': False, 'bear_use_ema': True, 'bear_use_atr': True, 'bear_use_adx': True, 'bear_use_spike': True, 'bear_rsi_required': True, 'sideways_strategy': 'mean_reversion', 'sideways_bb_std_mult': 0.5079114257789084, 'sideways_rsi_os': 49, 'sideways_rsi_ob': 78, 'sideways_adx_thresh': 27.62904677440786, 'sideways_atr_min_pct': 0.019234538261405528, 'sideways_atr_max_pct': 0.036723668710140274, 'sideways_tp_mult': 1.3161738762415842, 'sideways_tsl_mult': 0.7016312165750983, 'sideways_time_stop': 162, 'sideways_use_sma': True, 'sideways_use_ema': False, 'sideways_use_atr': True, 'sideways_use_adx': True, 'sideways_use_spike': True, 'sideways_rsi_required': False}.
[I 2025-08-30 16:10:03,677] Trial 676 finished with values: [-1000000000.0, 1000000000.0] and parameters: {'p_sma': 8, 'p_std': 20, 'p_atr': 13, 'p_adx': 24, 'rsi_period': 70, 'ema1': 26, 'ema2': 44, 'slip_atr_k': 1.8615960622609653e-05, 'slip_spread_k': 0.7652656933387034, 'spread_hl_frac': 0.004459799738709932, 'bb_std_mult': 0.7030166276484674, 'rsi_os': 12, 'rsi_ob': 66, 'vol_spike': 0.2114596056504757, 'adx_thresh': 21.000828855739936, 'atr_min_pct': 0.02176928875394399, 'atr_max_pct': 0.1127890509502911, 'tp_mult': 1.4373375700323918, 'tsl_mult': 0.862690496447144, 'strategy': 'mean_reversion', 'time_stop': 157, 'use_sma': False, 'use_atr': False, 'use_adx': True, 'use_ema': True, 'use_spike': False, 'rsi_required': False, 'edge_k': 0.5612478586902107, 'edge_cap': 0.9842360135197843, 'bull_strategy': 'mean_reversion', 'bull_bb_std_mult': 1.5953352028189913, 'bull_rsi_os': 49, 'bull_rsi_ob': 89, 'bull_adx_thresh': 15.815403172940162, 'bull_atr_min_pct': 0.022255080206286807, 'bull_atr_max_pct': 0.09574979606572126, 'bull_tp_mult': 1.4782258100008931, 'bull_tsl_mult': 0.1992169229115598, 'bull_time_stop': 64, 'bull_use_sma': False, 'bull_use_ema': True, 'bull_use_atr': False, 'bull_use_adx': True, 'bull_use_spike': False, 'bull_rsi_required': True, 'bear_strategy': 'breakout', 'bear_bb_std_mult': 1.3154405293909772, 'bear_rsi_os': 43, 'bear_rsi_ob': 74, 'bear_adx_thresh': 14.904572416077851, 'bear_atr_min_pct': 0.012788521335897364, 'bear_atr_max_pct': 0.04347771336589046, 'bear_tp_mult': 2.6294611434382302, 'bear_tsl_mult': 0.24758675625941284, 'bear_time_stop': 32, 'bear_use_sma': False, 'bear_use_ema': False, 'bear_use_atr': True, 'bear_use_adx': True, 'bear_use_spike': True, 'bear_rsi_required': True, 'sideways_strategy': 'mean_reversion', 'sideways_bb_std_mult': 3.03193566829845, 'sideways_rsi_os': 5, 'sideways_rsi_ob': 79, 'sideways_adx_thresh': 7.478239572762396, 'sideways_atr_min_pct': 0.01098392850399668, 'sideways_atr_max_pct': 0.06932168968289502, 'sideways_tp_mult': 1.1760285620407247, 'sideways_tsl_mult': 0.008666884096603211, 'sideways_time_stop': 125, 'sideways_use_sma': True, 'sideways_use_ema': False, 'sideways_use_atr': True, 'sideways_use_adx': True, 'sideways_use_spike': True, 'sideways_rsi_required': False}.
[I 2025-08-30 16:10:04,365] Trial 674 finished with values: [-1000000000.0, 1000000000.0] and parameters: {'p_sma': 10, 'p_std': 20, 'p_atr': 12, 'p_adx': 24, 'rsi_period': 10, 'ema1': 20, 'ema2': 57, 'slip_atr_k': 0.010544710992584425, 'slip_spread_k': 0.9748998993741511, 'spread_hl_frac': 0.03700023078054364, 'bb_std_mult': 1.865204903148748, 'rsi_os': 28, 'rsi_ob': 89, 'vol_spike': 0.23398500771216305, 'adx_thresh': 21.136869848652914, 'atr_min_pct': 0.023953903965614302, 'atr_max_pct': 0.12165449704116608, 'tp_mult': 2.665432531261027, 'tsl_mult': 0.9213295888916211, 'strategy': 'breakout', 'time_stop': 159, 'use_sma': False, 'use_atr': False, 'use_adx': True, 'use_ema': False, 'use_spike': False, 'rsi_required': False, 'edge_k': 0.5602449271350184, 'edge_cap': 0.9988497112745316, 'bull_strategy': 'breakout', 'bull_bb_std_mult': 1.7783252046211635, 'bull_rsi_os': 49, 'bull_rsi_ob': 61, 'bull_adx_thresh': 17.235122472189467, 'bull_atr_min_pct': 0.01863195560868113, 'bull_atr_max_pct': 0.0965045507912988, 'bull_tp_mult': 1.394508433781149, 'bull_tsl_mult': 0.04429806542176773, 'bull_time_stop': 65, 'bull_use_sma': True, 'bull_use_ema': True, 'bull_use_atr': True, 'bull_use_adx': True, 'bull_use_spike': True, 'bull_rsi_required': False, 'bear_strategy': 'mean_reversion', 'bear_bb_std_mult': 2.5170708325198445, 'bear_rsi_os': 24, 'bear_rsi_ob': 74, 'bear_adx_thresh': 33.43522102527549, 'bear_atr_min_pct': 0.010940900356775602, 'bear_atr_max_pct': 0.0964474872728143, 'bear_tp_mult': 2.637706813383337, 'bear_tsl_mult': 0.8393981145737638, 'bear_time_stop': 195, 'bear_use_sma': True, 'bear_use_ema': False, 'bear_use_atr': True, 'bear_use_adx': False, 'bear_use_spike': True, 'bear_rsi_required': True, 'sideways_strategy': 'mean_reversion', 'sideways_bb_std_mult': 0.5010599874175574, 'sideways_rsi_os': 55, 'sideways_rsi_ob': 84, 'sideways_adx_thresh': 11.263502788787799, 'sideways_atr_min_pct': 0.019194097779224026, 'sideways_atr_max_pct': 0.06955797686379905, 'sideways_tp_mult': 1.1208135550523404, 'sideways_tsl_mult': 0.3055000400700198, 'sideways_time_stop': 272, 'sideways_use_sma': True, 'sideways_use_ema': False, 'sideways_use_atr': True, 'sideways_use_adx': True, 'sideways_use_spike': True, 'sideways_rsi_required': True}.
[I 2025-08-30 16:10:50,566] Trial 681 finished with values: [-1000000000.0, 1000000000.0] and parameters: {'p_sma': 6, 'p_std': 10, 'p_atr': 11, 'p_adx': 21, 'rsi_period': 9, 'ema1': 27, 'ema2': 38, 'slip_atr_k': 0.21059936259281986, 'slip_spread_k': 0.9001071618445344, 'spread_hl_frac': 0.027976254018186042, 'bb_std_mult': 0.6379599777938975, 'rsi_os': 29, 'rsi_ob': 88, 'vol_spike': 0.19846822898736477, 'adx_thresh': 9.567967767877224, 'atr_min_pct': 0.005702388090450775, 'atr_max_pct': 0.12797487148127204, 'tp_mult': 1.8971776064716999, 'tsl_mult': 0.05107103938767976, 'strategy': 'breakout', 'time_stop': 151, 'use_sma': True, 'use_atr': True, 'use_adx': False, 'use_ema': False, 'use_spike': True, 'rsi_required': True, 'edge_k': 0.6815862724409607, 'edge_cap': 0.26701460953265277, 'bull_strategy': 'breakout', 'bull_bb_std_mult': 1.7422144935764332, 'bull_rsi_os': 47, 'bull_rsi_ob': 58, 'bull_adx_thresh': 9.722592827925835, 'bull_atr_min_pct': 0.019889769000365723, 'bull_atr_max_pct': 0.09954124714446572, 'bull_tp_mult': 2.377873767342473, 'bull_tsl_mult': 0.7858012167973111, 'bull_time_stop': 54, 'bull_use_sma': True, 'bull_use_ema': False, 'bull_use_atr': True, 'bull_use_adx': True, 'bull_use_spike': True, 'bull_rsi_required': False, 'bear_strategy': 'mean_reversion', 'bear_bb_std_mult': 1.0710399035378582, 'bear_rsi_os': 25, 'bear_rsi_ob': 76, 'bear_adx_thresh': 30.6381211601323, 'bear_atr_min_pct': 0.0020044941193707254, 'bear_atr_max_pct': 0.11101926984205153, 'bear_tp_mult': 2.6805369430351753, 'bear_tsl_mult': 0.9724609340076413, 'bear_time_stop': 122, 'bear_use_sma': True, 'bear_use_ema': True, 'bear_use_atr': False, 'bear_use_adx': True, 'bear_use_spike': True, 'bear_rsi_required': False, 'sideways_strategy': 'mean_reversion', 'sideways_bb_std_mult': 1.5262116301146622, 'sideways_rsi_os': 24, 'sideways_rsi_ob': 81, 'sideways_adx_thresh': 14.382320824086971, 'sideways_atr_min_pct': 0.020619904884941438, 'sideways_atr_max_pct': 0.058031833026806395, 'sideways_tp_mult': 1.1022213176268278, 'sideways_tsl_mult': 0.33750001148677783, 'sideways_time_stop': 49, 'sideways_use_sma': False, 'sideways_use_ema': False, 'sideways_use_atr': True, 'sideways_use_adx': False, 'sideways_use_spike': True, 'sideways_rsi_required': True}.
[I 2025-08-30 16:10:51,057] Trial 679 finished with values: [-0.05834985718814567, 0.05838489342040305] and parameters: {'p_sma': 33, 'p_std': 43, 'p_atr': 8, 'p_adx': 10, 'rsi_period': 10, 'ema1': 20, 'ema2': 39, 'slip_atr_k': 0.17316283397316, 'slip_spread_k': 0.7144540695815306, 'spread_hl_frac': 0.008667135911954843, 'bb_std_mult': 0.6330843117002539, 'rsi_os': 29, 'rsi_ob': 89, 'vol_spike': 0.21201334854076506, 'adx_thresh': 9.700797161353124, 'atr_min_pct': 0.005872445262884402, 'atr_max_pct': 0.10961585127568484, 'tp_mult': 1.5284972112095494, 'tsl_mult': 0.04170627874152033, 'strategy': 'breakout', 'time_stop': 151, 'use_sma': True, 'use_atr': True, 'use_adx': False, 'use_ema': False, 'use_spike': True, 'rsi_required': True, 'edge_k': 1.144738258486358, 'edge_cap': 0.6863193536500086, 'bull_strategy': 'breakout', 'bull_bb_std_mult': 1.7367768478621806, 'bull_rsi_os': 14, 'bull_rsi_ob': 89, 'bull_adx_thresh': 9.78291918219429, 'bull_atr_min_pct': 0.01338282194953282, 'bull_atr_max_pct': 0.10434904832854726, 'bull_tp_mult': 2.6865719263797034, 'bull_tsl_mult': 0.9028488725929655, 'bull_time_stop': 54, 'bull_use_sma': True, 'bull_use_ema': True, 'bull_use_atr': True, 'bull_use_adx': True, 'bull_use_spike': True, 'bull_rsi_required': False, 'bear_strategy': 'mean_reversion', 'bear_bb_std_mult': 2.427653034352614, 'bear_rsi_os': 47, 'bear_rsi_ob': 74, 'bear_adx_thresh': 8.960440517366957, 'bear_atr_min_pct': 0.001767718768121497, 'bear_atr_max_pct': 0.08551570560556408, 'bear_tp_mult': 1.7750013950435994, 'bear_tsl_mult': 0.8389829354447019, 'bear_time_stop': 34, 'bear_use_sma': True, 'bear_use_ema': False, 'bear_use_atr': False, 'bear_use_adx': True, 'bear_use_spike': True, 'bear_rsi_required': True, 'sideways_strategy': 'mean_reversion', 'sideways_bb_std_mult': 1.8656310234658222, 'sideways_rsi_os': 24, 'sideways_rsi_ob': 90, 'sideways_adx_thresh': 10.562326050472754, 'sideways_atr_min_pct': 0.011252577836204973, 'sideways_atr_max_pct': 0.06915130021292831, 'sideways_tp_mult': 1.154543527289972, 'sideways_tsl_mult': 0.3389295750605283, 'sideways_time_stop': 125, 'sideways_use_sma': True, 'sideways_use_ema': False, 'sideways_use_atr': True, 'sideways_use_adx': False, 'sideways_use_spike': True, 'sideways_rsi_required': True}.
[I 2025-08-30 16:10:51,534] Trial 678 finished with values: [-1000000000.0, 1000000000.0] and parameters: {'p_sma': 6, 'p_std': 22, 'p_atr': 11, 'p_adx': 21, 'rsi_period': 71, 'ema1': 20, 'ema2': 39, 'slip_atr_k': 0.013560806225998303, 'slip_spread_k': 0.6203113178055899, 'spread_hl_frac': 0.00892573837827387, 'bb_std_mult': 0.6609058061969614, 'rsi_os': 29, 'rsi_ob': 66, 'vol_spike': 0.20874955142631316, 'adx_thresh': 7.932296964271717, 'atr_min_pct': 0.0216694240929632, 'atr_max_pct': 0.1118617663963704, 'tp_mult': 2.69616131523593, 'tsl_mult': 0.3328572165092773, 'strategy': 'breakout', 'time_stop': 5, 'use_sma': True, 'use_atr': True, 'use_adx': False, 'use_ema': False, 'use_spike': True, 'rsi_required': False, 'edge_k': 1.1470646660891617, 'edge_cap': 0.9993021654241613, 'bull_strategy': 'breakout', 'bull_bb_std_mult': 1.7873719114711397, 'bull_rsi_os': 47, 'bull_rsi_ob': 90, 'bull_adx_thresh': 17.26322536694348, 'bull_atr_min_pct': 0.01990998591320301, 'bull_atr_max_pct': 0.09964710614799194, 'bull_tp_mult': 2.572498914279748, 'bull_tsl_mult': 0.0365328974605888, 'bull_time_stop': 201, 'bull_use_sma': True, 'bull_use_ema': False, 'bull_use_atr': True, 'bull_use_adx': True, 'bull_use_spike': True, 'bull_rsi_required': False, 'bear_strategy': 'mean_reversion', 'bear_bb_std_mult': 1.3090579192722616, 'bear_rsi_os': 43, 'bear_rsi_ob': 74, 'bear_adx_thresh': 14.809733612689366, 'bear_atr_min_pct': 0.001968984369962388, 'bear_atr_max_pct': 0.10828107472745363, 'bear_tp_mult': 2.640427456675717, 'bear_tsl_mult': 0.9854287170182319, 'bear_time_stop': 151, 'bear_use_sma': True, 'bear_use_ema': True, 'bear_use_atr': False, 'bear_use_adx': True, 'bear_use_spike': True, 'bear_rsi_required': True, 'sideways_strategy': 'mean_reversion', 'sideways_bb_std_mult': 1.5309266048100687, 'sideways_rsi_os': 26, 'sideways_rsi_ob': 78, 'sideways_adx_thresh': 14.454456804419841, 'sideways_atr_min_pct': 0.0015856227820095058, 'sideways_atr_max_pct': 0.05544609340144846, 'sideways_tp_mult': 1.1012889331746325, 'sideways_tsl_mult': 0.33812885399682546, 'sideways_time_stop': 48, 'sideways_use_sma': True, 'sideways_use_ema': False, 'sideways_use_atr': True, 'sideways_use_adx': False, 'sideways_use_spike': True, 'sideways_rsi_required': False}.
[I 2025-08-30 16:10:52,148] Trial 680 finished with values: [-1000000000.0, 1000000000.0] and parameters: {'p_sma': 10, 'p_std': 41, 'p_atr': 11, 'p_adx': 21, 'rsi_period': 10, 'ema1': 22, 'ema2': 39, 'slip_atr_k': 0.2112048901225222, 'slip_spread_k': 0.493322837147368, 'spread_hl_frac': 0.010039742117986701, 'bb_std_mult': 1.8254302418665225, 'rsi_os': 29, 'rsi_ob': 64, 'vol_spike': 0.29314646473772343, 'adx_thresh': 9.662255980930746, 'atr_min_pct': 0.0054851939389463705, 'atr_max_pct': 0.10745401563460319, 'tp_mult': 2.6904067521289217, 'tsl_mult': 0.33067863836007844, 'strategy': 'breakout', 'time_stop': 151, 'use_sma': True, 'use_atr': True, 'use_adx': False, 'use_ema': False, 'use_spike': True, 'rsi_required': True, 'edge_k': 0.6082148364414673, 'edge_cap': 0.9995951199747376, 'bull_strategy': 'breakout', 'bull_bb_std_mult': 1.725537999696264, 'bull_rsi_os': 17, 'bull_rsi_ob': 75, 'bull_adx_thresh': 9.68620592905073, 'bull_atr_min_pct': 0.01987499029365588, 'bull_atr_max_pct': 0.09902197873783132, 'bull_tp_mult': 2.5743382885315773, 'bull_tsl_mult': 0.1412932025633255, 'bull_time_stop': 74, 'bull_use_sma': True, 'bull_use_ema': True, 'bull_use_atr': True, 'bull_use_adx': True, 'bull_use_spike': True, 'bull_rsi_required': False, 'bear_strategy': 'mean_reversion', 'bear_bb_std_mult': 2.5041527754569417, 'bear_rsi_os': 53, 'bear_rsi_ob': 76, 'bear_adx_thresh': 30.832520230478682, 'bear_atr_min_pct': 0.0017278789495375258, 'bear_atr_max_pct': 0.08675017490884518, 'bear_tp_mult': 2.6925402141818546, 'bear_tsl_mult': 0.9828893194399059, 'bear_time_stop': 200, 'bear_use_sma': True, 'bear_use_ema': False, 'bear_use_atr': False, 'bear_use_adx': True, 'bear_use_spike': True, 'bear_rsi_required': False, 'sideways_strategy': 'mean_reversion', 'sideways_bb_std_mult': 3.1202189689199997, 'sideways_rsi_os': 24, 'sideways_rsi_ob': 80, 'sideways_adx_thresh': 10.90316609492271, 'sideways_atr_min_pct': 0.01993094151174853, 'sideways_atr_max_pct': 0.07217262231209971, 'sideways_tp_mult': 1.1300330068504598, 'sideways_tsl_mult': 0.34448412135091416, 'sideways_time_stop': 121, 'sideways_use_sma': True, 'sideways_use_ema': False, 'sideways_use_atr': True, 'sideways_use_adx': False, 'sideways_use_spike': True, 'sideways_rsi_required': True}.
[I 2025-08-30 16:11:40,372] Trial 685 finished with values: [-1000000000.0, 1000000000.0] and parameters: {'p_sma': 7, 'p_std': 25, 'p_atr': 12, 'p_adx': 13, 'rsi_period': 33, 'ema1': 28, 'ema2': 36, 'slip_atr_k': 0.005358886637673601, 'slip_spread_k': 0.6759797063323093, 'spread_hl_frac': 0.03391996930695853, 'bb_std_mult': 0.5421806878655377, 'rsi_os': 44, 'rsi_ob': 87, 'vol_spike': 0.06761397292897349, 'adx_thresh': 8.988339982360282, 'atr_min_pct': 0.011028202274515012, 'atr_max_pct': 0.11597862832619983, 'tp_mult': 1.2718404302642856, 'tsl_mult': 0.40570931961649975, 'strategy': 'breakout', 'time_stop': 163, 'use_sma': False, 'use_atr': False, 'use_adx': True, 'use_ema': False, 'use_spike': False, 'rsi_required': False, 'edge_k': 0.48215886398779195, 'edge_cap': 0.9523593554491803, 'bull_strategy': 'breakout', 'bull_bb_std_mult': 0.8273398691850702, 'bull_rsi_os': 52, 'bull_rsi_ob': 85, 'bull_adx_thresh': 21.28429170536121, 'bull_atr_min_pct': 0.020523322435270393, 'bull_atr_max_pct': 0.10807379285337201, 'bull_tp_mult': 2.536410271705588, 'bull_tsl_mult': 0.2862108239020303, 'bull_time_stop': 35, 'bull_use_sma': True, 'bull_use_ema': True, 'bull_use_atr': True, 'bull_use_adx': True, 'bull_use_spike': True, 'bull_rsi_required': True, 'bear_strategy': 'mean_reversion', 'bear_bb_std_mult': 1.5050500534157214, 'bear_rsi_os': 26, 'bear_rsi_ob': 79, 'bear_adx_thresh': 16.31870362576498, 'bear_atr_min_pct': 0.01409018588102029, 'bear_atr_max_pct': 0.1085407276077805, 'bear_tp_mult': 2.7979639472532916, 'bear_tsl_mult': 0.9052409964011391, 'bear_time_stop': 95, 'bear_use_sma': True, 'bear_use_ema': False, 'bear_use_atr': True, 'bear_use_adx': True, 'bear_use_spike': False, 'bear_rsi_required': True, 'sideways_strategy': 'breakout', 'sideways_bb_std_mult': 3.251196902500458, 'sideways_rsi_os': 10, 'sideways_rsi_ob': 73, 'sideways_adx_thresh': 10.07445187171779, 'sideways_atr_min_pct': 0.021605592111859372, 'sideways_atr_max_pct': 0.13135609045602864, 'sideways_tp_mult': 1.4813725356459524, 'sideways_tsl_mult': 0.39221187546460123, 'sideways_time_stop': 135, 'sideways_use_sma': False, 'sideways_use_ema': False, 'sideways_use_atr': True, 'sideways_use_adx': True, 'sideways_use_spike': False, 'sideways_rsi_required': True}.
[I 2025-08-30 16:11:40,767] Trial 683 finished with values: [-0.0061109716504436085, 0.006111556572738177] and parameters: {'p_sma': 6, 'p_std': 22, 'p_atr': 11, 'p_adx': 13, 'rsi_period': 12, 'ema1': 22, 'ema2': 19, 'slip_atr_k': 0.014173233808659147, 'slip_spread_k': 0.49210252681733657, 'spread_hl_frac': 0.03287684010913192, 'bb_std_mult': 0.5458688856599329, 'rsi_os': 27, 'rsi_ob': 86, 'vol_spike': 0.20780427698213708, 'adx_thresh': 8.932494394552583, 'atr_min_pct': 0.007168118798261385, 'atr_max_pct': 0.05644440391162801, 'tp_mult': 1.28514170211141, 'tsl_mult': 0.40620446182930103, 'strategy': 'breakout', 'time_stop': 184, 'use_sma': False, 'use_atr': False, 'use_adx': True, 'use_ema': False, 'use_spike': False, 'rsi_required': False, 'edge_k': 0.42912272726987843, 'edge_cap': 0.9527708857944973, 'bull_strategy': 'breakout', 'bull_bb_std_mult': 0.801973694861214, 'bull_rsi_os': 52, 'bull_rsi_ob': 94, 'bull_adx_thresh': 8.47736066173608, 'bull_atr_min_pct': 0.020475714092122017, 'bull_atr_max_pct': 0.10147906252649731, 'bull_tp_mult': 2.571373471183701, 'bull_tsl_mult': 0.8313922804271248, 'bull_time_stop': 73, 'bull_use_sma': True, 'bull_use_ema': True, 'bull_use_atr': True, 'bull_use_adx': True, 'bull_use_spike': True, 'bull_rsi_required': False, 'bear_strategy': 'mean_reversion', 'bear_bb_std_mult': 1.2531707391476552, 'bear_rsi_os': 26, 'bear_rsi_ob': 51, 'bear_adx_thresh': 16.466354226467075, 'bear_atr_min_pct': 0.014133961318889126, 'bear_atr_max_pct': 0.10859354524805717, 'bear_tp_mult': 2.6834884635587626, 'bear_tsl_mult': 0.8670360749853732, 'bear_time_stop': 78, 'bear_use_sma': True, 'bear_use_ema': False, 'bear_use_atr': True, 'bear_use_adx': True, 'bear_use_spike': False, 'bear_rsi_required': False, 'sideways_strategy': 'mean_reversion', 'sideways_bb_std_mult': 3.115588193035466, 'sideways_rsi_os': 26, 'sideways_rsi_ob': 86, 'sideways_adx_thresh': 10.160205331134458, 'sideways_atr_min_pct': 0.0016304481747690582, 'sideways_atr_max_pct': 0.07220226918007136, 'sideways_tp_mult': 1.530937689809561, 'sideways_tsl_mult': 0.35883395431283527, 'sideways_time_stop': 121, 'sideways_use_sma': True, 'sideways_use_ema': False, 'sideways_use_atr': True, 'sideways_use_adx': True, 'sideways_use_spike': False, 'sideways_rsi_required': True}.
