[I 2025-08-30 14:44:33,323] Trial 199 finished with values: [-1000000000.0, 1000000000.0] and parameters: {'p_sma': 39, 'p_std': 6, 'p_atr': 17, 'p_adx': 30, 'rsi_period': 17, 'ema1': 25, 'ema2': 33, 'slip_atr_k': 0.08099491242328968, 'slip_spread_k': 0.5319688936353393, 'spread_hl_frac': 0.006438341717081148, 'bb_std_mult': 3.4184611961298677, 'rsi_os': 34, 'rsi_ob': 72, 'vol_spike': 0.14494496250989083, 'adx_thresh': 31.381740824696976, 'atr_min_pct': 0.02999908968212872, 'atr_max_pct': 0.026488356491868963, 'tp_mult': 2.0526548687998405, 'tsl_mult': 0.18114039239906737, 'strategy': 'mean_reversion', 'time_stop': 294, 'use_sma': True, 'use_atr': True, 'use_adx': True, 'use_ema': False, 'use_spike': True, 'rsi_required': False, 'edge_k': 1.8632849921078096, 'edge_cap': 0.379314865829795, 'bull_strategy': 'breakout', 'bull_bb_std_mult': 3.4392757354760675, 'bull_rsi_os': 9, 'bull_rsi_ob': 80, 'bull_adx_thresh': 19.89254188832502, 'bull_atr_min_pct': 0.0062134927178973745, 'bull_atr_max_pct': 0.019146352038979485, 'bull_tp_mult': 2.141076125873525, 'bull_tsl_mult': 0.28030751631641243, 'bull_time_stop': 99, 'bull_use_sma': True, 'bull_use_ema': False, 'bull_use_atr': True, 'bull_use_adx': True, 'bull_use_spike': False, 'bull_rsi_required': True, 'bear_strategy': 'mean_reversion', 'bear_bb_std_mult': 3.3774329908335776, 'bear_rsi_os': 17, 'bear_rsi_ob': 68, 'bear_adx_thresh': 30.935258538125083, 'bear_atr_min_pct': 0.009365583858420328, 'bear_atr_max_pct': 0.14658444624395367, 'bear_tp_mult': 1.9640062295277534, 'bear_tsl_mult': 0.7750368868502668, 'bear_time_stop': 299, 'bear_use_sma': False, 'bear_use_ema': True, 'bear_use_atr': False, 'bear_use_adx': True, 'bear_use_spike': True, 'bear_rsi_required': False, 'sideways_strategy': 'mean_reversion', 'sideways_bb_std_mult': 1.721806235476272, 'sideways_rsi_os': 51, 'sideways_rsi_ob': 54, 'sideways_adx_thresh': 10.393105028266689, 'sideways_atr_min_pct': 0.009267796860865301, 'sideways_atr_max_pct': 0.09269323913463845, 'sideways_tp_mult': 2.7839325215649025, 'sideways_tsl_mult': 0.09309552239254448, 'sideways_time_stop': 34, 'sideways_use_sma': False, 'sideways_use_ema': False, 'sideways_use_atr': False, 'sideways_use_adx': True, 'sideways_use_spike': False, 'sideways_rsi_required': False}.
[I 2025-08-30 14:44:33,392] Trial 201 finished with values: [-1000000000.0, 1000000000.0] and parameters: {'p_sma': 39, 'p_std': 34, 'p_atr': 25, 'p_adx': 7, 'rsi_period': 17, 'ema1': 17, 'ema2': 33, 'slip_atr_k': 0.16970710743939915, 'slip_spread_k': 0.7697803606909477, 'spread_hl_frac': 0.006210909631414609, 'bb_std_mult': 3.40333403367117, 'rsi_os': 34, 'rsi_ob': 49, 'vol_spike': 0.037898969228606465, 'adx_thresh': 18.098254452451606, 'atr_min_pct': 0.029665963126495342, 'atr_max_pct': 0.07986398731849785, 'tp_mult': 1.6849190512400498, 'tsl_mult': 0.940184611005308, 'strategy': 'mean_reversion', 'time_stop': 194, 'use_sma': True, 'use_atr': False, 'use_adx': True, 'use_ema': False, 'use_spike': True, 'rsi_required': False, 'edge_k': 1.8772450900713524, 'edge_cap': 0.8778161270823642, 'bull_strategy': 'mean_reversion', 'bull_bb_std_mult': 2.9750556065137834, 'bull_rsi_os': 36, 'bull_rsi_ob': 50, 'bull_adx_thresh': 6.822856184731897, 'bull_atr_min_pct': 0.009429558783191662, 'bull_atr_max_pct': 0.01921087871587064, 'bull_tp_mult': 1.2875385583674703, 'bull_tsl_mult': 0.28586516662096395, 'bull_time_stop': 98, 'bull_use_sma': True, 'bull_use_ema': False, 'bull_use_atr': False, 'bull_use_adx': True, 'bull_use_spike': False, 'bull_rsi_required': True, 'bear_strategy': 'breakout', 'bear_bb_std_mult': 1.0060283466934543, 'bear_rsi_os': 17, 'bear_rsi_ob': 68, 'bear_adx_thresh': 30.761640457585425, 'bear_atr_min_pct': 0.015303211138511241, 'bear_atr_max_pct': 0.023249646867812626, 'bear_tp_mult': 1.9421401167274164, 'bear_tsl_mult': 0.7586983572435115, 'bear_time_stop': 170, 'bear_use_sma': False, 'bear_use_ema': True, 'bear_use_atr': False, 'bear_use_adx': True, 'bear_use_spike': True, 'bear_rsi_required': False, 'sideways_strategy': 'mean_reversion', 'sideways_bb_std_mult': 1.8548438895748784, 'sideways_rsi_os': 49, 'sideways_rsi_ob': 56, 'sideways_adx_thresh': 24.18384056997028, 'sideways_atr_min_pct': 0.007897499934515705, 'sideways_atr_max_pct': 0.06560462887871923, 'sideways_tp_mult': 1.924626951150849, 'sideways_tsl_mult': 0.6979342784433419, 'sideways_time_stop': 173, 'sideways_use_sma': True, 'sideways_use_ema': False, 'sideways_use_atr': False, 'sideways_use_adx': False, 'sideways_use_spike': False, 'sideways_rsi_required': False}.
[I 2025-08-30 14:44:33,913] Trial 202 finished with values: [-1000000000.0, 1000000000.0] and parameters: {'p_sma': 39, 'p_std': 29, 'p_atr': 8, 'p_adx': 7, 'rsi_period': 53, 'ema1': 17, 'ema2': 30, 'slip_atr_k': 0.1718913720574988, 'slip_spread_k': 0.5775343065599026, 'spread_hl_frac': 0.04436422553125065, 'bb_std_mult': 3.387045469845402, 'rsi_os': 44, 'rsi_ob': 49, 'vol_spike': 0.01567473456159285, 'adx_thresh': 23.12778373628729, 'atr_min_pct': 0.016283555061844437, 'atr_max_pct': 0.07861547058120591, 'tp_mult': 1.541637560100015, 'tsl_mult': 0.14525655127663362, 'strategy': 'mean_reversion', 'time_stop': 300, 'use_sma': True, 'use_atr': False, 'use_adx': False, 'use_ema': False, 'use_spike': True, 'rsi_required': True, 'edge_k': 0.6483174583813218, 'edge_cap': 0.3127172217282891, 'bull_strategy': 'mean_reversion', 'bull_bb_std_mult': 0.7246871796545474, 'bull_rsi_os': 55, 'bull_rsi_ob': 50, 'bull_adx_thresh': 10.10563872486093, 'bull_atr_min_pct': 0.019710489312864576, 'bull_atr_max_pct': 0.020560341444380455, 'bull_tp_mult': 2.624058335752582, 'bull_tsl_mult': 0.4970692199082178, 'bull_time_stop': 35, 'bull_use_sma': False, 'bull_use_ema': True, 'bull_use_atr': False, 'bull_use_adx': False, 'bull_use_spike': True, 'bull_rsi_required': False, 'bear_strategy': 'breakout', 'bear_bb_std_mult': 2.2448878107150323, 'bear_rsi_os': 41, 'bear_rsi_ob': 65, 'bear_adx_thresh': 26.10951743852266, 'bear_atr_min_pct': 0.015272328310173701, 'bear_atr_max_pct': 0.053444217398105766, 'bear_tp_mult': 2.0358297577321234, 'bear_tsl_mult': 0.6461431161510753, 'bear_time_stop': 139, 'bear_use_sma': False, 'bear_use_ema': True, 'bear_use_atr': False, 'bear_use_adx': False, 'bear_use_spike': False, 'bear_rsi_required': True, 'sideways_strategy': 'mean_reversion', 'sideways_bb_std_mult': 1.490490121059471, 'sideways_rsi_os': 19, 'sideways_rsi_ob': 62, 'sideways_adx_thresh': 24.15988038095031, 'sideways_atr_min_pct': 0.0020528998915776368, 'sideways_atr_max_pct': 0.013032876319208023, 'sideways_tp_mult': 1.932000364020575, 'sideways_tsl_mult': 0.1304665909648203, 'sideways_time_stop': 156, 'sideways_use_sma': True, 'sideways_use_ema': True, 'sideways_use_atr': False, 'sideways_use_adx': False, 'sideways_use_spike': True, 'sideways_rsi_required': True}.
[I 2025-08-30 14:44:33,967] Trial 203 finished with values: [-1000000000.0, 1000000000.0] and parameters: {'p_sma': 42, 'p_std': 8, 'p_atr': 26, 'p_adx': 9, 'rsi_period': 13, 'ema1': 17, 'ema2': 30, 'slip_atr_k': 0.04697373145838696, 'slip_spread_k': 0.9635790560308257, 'spread_hl_frac': 0.04429327008201145, 'bb_std_mult': 3.447409424932105, 'rsi_os': 51, 'rsi_ob': 65, 'vol_spike': 0.05918139342578022, 'adx_thresh': 12.18905033724468, 'atr_min_pct': 0.01226705708254966, 'atr_max_pct': 0.06143509608466989, 'tp_mult': 1.2959731117779807, 'tsl_mult': 0.8277862881873139, 'strategy': 'mean_reversion', 'time_stop': 104, 'use_sma': True, 'use_atr': True, 'use_adx': False, 'use_ema': True, 'use_spike': True, 'rsi_required': True, 'edge_k': 1.1092574424589605, 'edge_cap': 0.48434981467791516, 'bull_strategy': 'mean_reversion', 'bull_bb_std_mult': 0.6052098352553936, 'bull_rsi_os': 41, 'bull_rsi_ob': 91, 'bull_adx_thresh': 26.404777639612266, 'bull_atr_min_pct': 0.005576095705765007, 'bull_atr_max_pct': 0.026063547760050845, 'bull_tp_mult': 1.272969914081988, 'bull_tsl_mult': 0.4984844997599972, 'bull_time_stop': 165, 'bull_use_sma': False, 'bull_use_ema': True, 'bull_use_atr': False, 'bull_use_adx': False, 'bull_use_spike': True, 'bull_rsi_required': False, 'bear_strategy': 'breakout', 'bear_bb_std_mult': 2.509513629244662, 'bear_rsi_os': 18, 'bear_rsi_ob': 65, 'bear_adx_thresh': 9.233814972139436, 'bear_atr_min_pct': 0.006308931836224298, 'bear_atr_max_pct': 0.05588368202835021, 'bear_tp_mult': 2.0481009821367824, 'bear_tsl_mult': 0.8789971946131059, 'bear_time_stop': 140, 'bear_use_sma': False, 'bear_use_ema': True, 'bear_use_atr': False, 'bear_use_adx': False, 'bear_use_spike': False, 'bear_rsi_required': True, 'sideways_strategy': 'breakout', 'sideways_bb_std_mult': 1.2062628322846165, 'sideways_rsi_os': 46, 'sideways_rsi_ob': 62, 'sideways_adx_thresh': 13.710638718815492, 'sideways_atr_min_pct': 0.01895547866673881, 'sideways_atr_max_pct': 0.012706589471731797, 'sideways_tp_mult': 1.5404558765542677, 'sideways_tsl_mult': 0.12548472306581246, 'sideways_time_stop': 20, 'sideways_use_sma': False, 'sideways_use_ema': True, 'sideways_use_atr': False, 'sideways_use_adx': False, 'sideways_use_spike': True, 'sideways_rsi_required': True}.
[I 2025-08-30 14:44:38,509] Trial 205 finished with values: [-1000000000.0, 1000000000.0] and parameters: {'p_sma': 47, 'p_std': 7, 'p_atr': 18, 'p_adx': 21, 'rsi_period': 61, 'ema1': 20, 'ema2': 56, 'slip_atr_k': 0.09731617105894136, 'slip_spread_k': 0.5389336617016874, 'spread_hl_frac': 0.003811936826747287, 'bb_std_mult': 3.556090204952967, 'rsi_os': 18, 'rsi_ob': 45, 'vol_spike': 0.16007107109272883, 'adx_thresh': 29.569182174539375, 'atr_min_pct': 0.010781195737682443, 'atr_max_pct': 0.032446002009620646, 'tp_mult': 2.4627714367412, 'tsl_mult': 0.5717388199207998, 'strategy': 'mean_reversion', 'time_stop': 300, 'use_sma': True, 'use_atr': True, 'use_adx': False, 'use_ema': True, 'use_spike': True, 'rsi_required': True, 'edge_k': 1.780771256288493, 'edge_cap': 0.20419058120202532, 'bull_strategy': 'mean_reversion', 'bull_bb_std_mult': 1.794627808080424, 'bull_rsi_os': 28, 'bull_rsi_ob': 84, 'bull_adx_thresh': 25.19884795474231, 'bull_atr_min_pct': 0.0007183573879439077, 'bull_atr_max_pct': 0.1352891843892995, 'bull_tp_mult': 1.3604527489793747, 'bull_tsl_mult': 0.3525676232040432, 'bull_time_stop': 84, 'bull_use_sma': False, 'bull_use_ema': False, 'bull_use_atr': False, 'bull_use_adx': True, 'bull_use_spike': False, 'bull_rsi_required': False, 'bear_strategy': 'breakout', 'bear_bb_std_mult': 1.9831000816735467, 'bear_rsi_os': 19, 'bear_rsi_ob': 67, 'bear_adx_thresh': 32.81738402975991, 'bear_atr_min_pct': 0.013938413067820945, 'bear_atr_max_pct': 0.14461319066326234, 'bear_tp_mult': 1.9324070413136556, 'bear_tsl_mult': 0.7467017617878684, 'bear_time_stop': 185, 'bear_use_sma': False, 'bear_use_ema': True, 'bear_use_atr': False, 'bear_use_adx': False, 'bear_use_spike': False, 'bear_rsi_required': False, 'sideways_strategy': 'breakout', 'sideways_bb_std_mult': 2.558665412216528, 'sideways_rsi_os': 46, 'sideways_rsi_ob': 70, 'sideways_adx_thresh': 25.46640345432517, 'sideways_atr_min_pct': 0.024002462507210096, 'sideways_atr_max_pct': 0.07427751270480529, 'sideways_tp_mult': 2.764044091277179, 'sideways_tsl_mult': 0.0884009642922691, 'sideways_time_stop': 98, 'sideways_use_sma': False, 'sideways_use_ema': True, 'sideways_use_atr': False, 'sideways_use_adx': False, 'sideways_use_spike': False, 'sideways_rsi_required': False}.
[I 2025-08-30 14:44:52,479] Trial 200 finished with values: [-0.04927583790324752, 0.04924443978795051] and parameters: {'p_sma': 39, 'p_std': 32, 'p_atr': 26, 'p_adx': 9, 'rsi_period': 17, 'ema1': 16, 'ema2': 33, 'slip_atr_k': 0.07995813055406961, 'slip_spread_k': 0.0645625328492041, 'spread_hl_frac': 0.007443989758224332, 'bb_std_mult': 3.4074511569288113, 'rsi_os': 42, 'rsi_ob': 64, 'vol_spike': 0.14666774193963966, 'adx_thresh': 31.307881962832766, 'atr_min_pct': 0.0297912482259639, 'atr_max_pct': 0.03267162272729386, 'tp_mult': 2.053502800066931, 'tsl_mult': 0.9438246278026245, 'strategy': 'mean_reversion', 'time_stop': 296, 'use_sma': True, 'use_atr': True, 'use_adx': True, 'use_ema': False, 'use_spike': True, 'rsi_required': False, 'edge_k': 1.8852943900166732, 'edge_cap': 0.3139270664583667, 'bull_strategy': 'breakout', 'bull_bb_std_mult': 3.4359531223868354, 'bull_rsi_os': 54, 'bull_rsi_ob': 84, 'bull_adx_thresh': 19.347046688503436, 'bull_atr_min_pct': 1.2626437972054413e-05, 'bull_atr_max_pct': 0.0190635970884991, 'bull_tp_mult': 1.8573564649939227, 'bull_tsl_mult': 0.3602056091525183, 'bull_time_stop': 99, 'bull_use_sma': True, 'bull_use_ema': False, 'bull_use_atr': True, 'bull_use_adx': True, 'bull_use_spike': False, 'bull_rsi_required': True, 'bear_strategy': 'mean_reversion', 'bear_bb_std_mult': 1.9883676956796454, 'bear_rsi_os': 17, 'bear_rsi_ob': 65, 'bear_adx_thresh': 26.11880014106046, 'bear_atr_min_pct': 0.006189310409441016, 'bear_atr_max_pct': 0.14587420050144692, 'bear_tp_mult': 1.9624182790755242, 'bear_tsl_mult': 0.7559290751814122, 'bear_time_stop': 169, 'bear_use_sma': False, 'bear_use_ema': True, 'bear_use_atr': False, 'bear_use_adx': True, 'bear_use_spike': True, 'bear_rsi_required': False, 'sideways_strategy': 'mean_reversion', 'sideways_bb_std_mult': 0.5966746134060701, 'sideways_rsi_os': 49, 'sideways_rsi_ob': 89, 'sideways_adx_thresh': 24.415772651534077, 'sideways_atr_min_pct': 0.0016999002040415552, 'sideways_atr_max_pct': 0.04691085002183729, 'sideways_tp_mult': 1.256853702570444, 'sideways_tsl_mult': 0.8637501304768533, 'sideways_time_stop': 172, 'sideways_use_sma': False, 'sideways_use_ema': False, 'sideways_use_atr': False, 'sideways_use_adx': True, 'sideways_use_spike': False, 'sideways_rsi_required': False}.
[I 2025-08-30 14:44:53,632] Trial 198 finished with values: [-1000000000.0, 1000000000.0] and parameters: {'p_sma': 39, 'p_std': 6, 'p_atr': 18, 'p_adx': 13, 'rsi_period': 25, 'ema1': 22, 'ema2': 33, 'slip_atr_k': 0.08018319374944947, 'slip_spread_k': 0.9645907785622344, 'spread_hl_frac': 0.006752740374510884, 'bb_std_mult': 3.3973017686471443, 'rsi_os': 34, 'rsi_ob': 71, 'vol_spike': 0.0015573107679008047, 'adx_thresh': 29.845726349250967, 'atr_min_pct': 0.007889826927344041, 'atr_max_pct': 0.032179818531564985, 'tp_mult': 2.0580952257651517, 'tsl_mult': 0.6612462304124129, 'strategy': 'mean_reversion', 'time_stop': 294, 'use_sma': True, 'use_atr': True, 'use_adx': True, 'use_ema': True, 'use_spike': True, 'rsi_required': False, 'edge_k': 1.8640568143591152, 'edge_cap': 0.8787256983497247, 'bull_strategy': 'breakout', 'bull_bb_std_mult': 2.0127130204175074, 'bull_rsi_os': 11, 'bull_rsi_ob': 81, 'bull_adx_thresh': 20.61909562862158, 'bull_atr_min_pct': 0.015389032422699041, 'bull_atr_max_pct': 0.021689859352222708, 'bull_tp_mult': 2.444958130120014, 'bull_tsl_mult': 0.49288784193151747, 'bull_time_stop': 106, 'bull_use_sma': False, 'bull_use_ema': False, 'bull_use_atr': True, 'bull_use_adx': True, 'bull_use_spike': False, 'bull_rsi_required': True, 'bear_strategy': 'mean_reversion', 'bear_bb_std_mult': 2.549265113477976, 'bear_rsi_os': 29, 'bear_rsi_ob': 68, 'bear_adx_thresh': 28.372858959956478, 'bear_atr_min_pct': 0.011779359042128939, 'bear_atr_max_pct': 0.14483185959708464, 'bear_tp_mult': 1.9684666890653428, 'bear_tsl_mult': 0.7671284524745807, 'bear_time_stop': 41, 'bear_use_sma': False, 'bear_use_ema': True, 'bear_use_atr': False, 'bear_use_adx': True, 'bear_use_spike': True, 'bear_rsi_required': False, 'sideways_strategy': 'breakout', 'sideways_bb_std_mult': 1.7239205788141603, 'sideways_rsi_os': 31, 'sideways_rsi_ob': 93, 'sideways_adx_thresh': 25.16184538380244, 'sideways_atr_min_pct': 0.020968315725888746, 'sideways_atr_max_pct': 0.09282867078819572, 'sideways_tp_mult': 1.2444503550768342, 'sideways_tsl_mult': 0.09773973597941751, 'sideways_time_stop': 270, 'sideways_use_sma': False, 'sideways_use_ema': True, 'sideways_use_atr': False, 'sideways_use_adx': True, 'sideways_use_spike': False, 'sideways_rsi_required': False}.
[I 2025-08-30 14:44:59,905] Trial 204 finished with values: [-0.024313021022634884, 0.02435188020842829] and parameters: {'p_sma': 52, 'p_std': 8, 'p_atr': 18, 'p_adx': 13, 'rsi_period': 15, 'ema1': 17, 'ema2': 34, 'slip_atr_k': 0.09579937887496182, 'slip_spread_k': 0.05821061070011441, 'spread_hl_frac': 0.03451328854790098, 'bb_std_mult': 3.5959761643621784, 'rsi_os': 18, 'rsi_ob': 61, 'vol_spike': 0.05539977909361879, 'adx_thresh': 29.80201950340933, 'atr_min_pct': 0.029046847381143086, 'atr_max_pct': 0.030588807296040257, 'tp_mult': 2.8661985343721406, 'tsl_mult': 0.12424751456397734, 'strategy': 'mean_reversion', 'time_stop': 295, 'use_sma': True, 'use_atr': True, 'use_adx': False, 'use_ema': True, 'use_spike': True, 'rsi_required': True, 'edge_k': 1.106894421125261, 'edge_cap': 0.4825713112063513, 'bull_strategy': 'mean_reversion', 'bull_bb_std_mult': 0.5855014424322276, 'bull_rsi_os': 42, 'bull_rsi_ob': 78, 'bull_adx_thresh': 18.97526535170223, 'bull_atr_min_pct': 0.00012595689079217091, 'bull_atr_max_pct': 0.026258383700858173, 'bull_tp_mult': 1.2708027881085036, 'bull_tsl_mult': 0.3599214434806503, 'bull_time_stop': 294, 'bull_use_sma': False, 'bull_use_ema': False, 'bull_use_atr': False, 'bull_use_adx': True, 'bull_use_spike': False, 'bull_rsi_required': False, 'bear_strategy': 'breakout', 'bear_bb_std_mult': 2.3688774211741856, 'bear_rsi_os': 28, 'bear_rsi_ob': 65, 'bear_adx_thresh': 9.075629865887157, 'bear_atr_min_pct': 0.01898768299414184, 'bear_atr_max_pct': 0.14073736676705517, 'bear_tp_mult': 1.8466749676474288, 'bear_tsl_mult': 0.8739162260434763, 'bear_time_stop': 189, 'bear_use_sma': False, 'bear_use_ema': True, 'bear_use_atr': False, 'bear_use_adx': False, 'bear_use_spike': False, 'bear_rsi_required': False, 'sideways_strategy': 'breakout', 'sideways_bb_std_mult': 2.0938230381045453, 'sideways_rsi_os': 46, 'sideways_rsi_ob': 75, 'sideways_adx_thresh': 25.180062236898504, 'sideways_atr_min_pct': 0.018850379850189072, 'sideways_atr_max_pct': 0.014887693469424562, 'sideways_tp_mult': 2.2133936911262366, 'sideways_tsl_mult': 0.8676893579235406, 'sideways_time_stop': 171, 'sideways_use_sma': False, 'sideways_use_ema': True, 'sideways_use_atr': False, 'sideways_use_adx': False, 'sideways_use_spike': False, 'sideways_rsi_required': False}.
[I 2025-08-30 14:45:01,333] Trial 208 finished with values: [-1000000000.0, 1000000000.0] and parameters: {'p_sma': 36, 'p_std': 9, 'p_atr': 15, 'p_adx': 24, 'rsi_period': 57, 'ema1': 7, 'ema2': 48, 'slip_atr_k': 0.09064776521322696, 'slip_spread_k': 0.18735425745784146, 'spread_hl_frac': 0.02909242906285158, 'bb_std_mult': 3.490456276561379, 'rsi_os': 24, 'rsi_ob': 81, 'vol_spike': 0.04734408276679951, 'adx_thresh': 15.333526029931367, 'atr_min_pct': 0.029106491933418854, 'atr_max_pct': 0.01982789852294043, 'tp_mult': 2.782577274132744, 'tsl_mult': 0.23771243678232096, 'strategy': 'breakout', 'time_stop': 275, 'use_sma': False, 'use_atr': True, 'use_adx': False, 'use_ema': True, 'use_spike': False, 'rsi_required': True, 'edge_k': 1.950469701873502, 'edge_cap': 0.5300461999636404, 'bull_strategy': 'mean_reversion', 'bull_bb_std_mult': 1.6200623172387076, 'bull_rsi_os': 43, 'bull_rsi_ob': 78, 'bull_adx_thresh': 23.74390043957587, 'bull_atr_min_pct': 0.01161022542033227, 'bull_atr_max_pct': 0.026445054055727064, 'bull_tp_mult': 1.4335447693728023, 'bull_tsl_mult': 0.32558368803699445, 'bull_time_stop': 181, 'bull_use_sma': False, 'bull_use_ema': False, 'bull_use_atr': False, 'bull_use_adx': True, 'bull_use_spike': False, 'bull_rsi_required': False, 'bear_strategy': 'breakout', 'bear_bb_std_mult': 1.1561335059007822, 'bear_rsi_os': 21, 'bear_rsi_ob': 62, 'bear_adx_thresh': 11.417822541037953, 'bear_atr_min_pct': 0.0013286307021112293, 'bear_atr_max_pct': 0.029031788235952143, 'bear_tp_mult': 1.7806403128377217, 'bear_tsl_mult': 0.4754224434689292, 'bear_time_stop': 280, 'bear_use_sma': True, 'bear_use_ema': False, 'bear_use_atr': True, 'bear_use_adx': False, 'bear_use_spike': False, 'bear_rsi_required': False, 'sideways_strategy': 'breakout', 'sideways_bb_std_mult': 2.9659678788687365, 'sideways_rsi_os': 50, 'sideways_rsi_ob': 75, 'sideways_adx_thresh': 25.95960530763561, 'sideways_atr_min_pct': 0.016900103893654234, 'sideways_atr_max_pct': 0.015577412939440137, 'sideways_tp_mult': 2.2150400461575277, 'sideways_tsl_mult': 0.5758199040239653, 'sideways_time_stop': 253, 'sideways_use_sma': False, 'sideways_use_ema': True, 'sideways_use_atr': True, 'sideways_use_adx': False, 'sideways_use_spike': False, 'sideways_rsi_required': False}.
