[I 2025-08-30 14:35:29,448] Trial 117 finished with values: [-1000000000.0, 1000000000.0] and parameters: {'p_sma': 58, 'p_std': 55, 'p_atr': 20, 'p_adx': 7, 'rsi_period': 15, 'ema1': 15, 'ema2': 32, 'slip_atr_k': 0.06907383044663767, 'slip_spread_k': 0.9556708520891044, 'spread_hl_frac': 0.04528310935397397, 'bb_std_mult': 3.4326860550270175, 'rsi_os': 17, 'rsi_ob': 61, 'vol_spike': 0.0950855600957541, 'adx_thresh': 24.92158424534062, 'atr_min_pct': 0.02918415472841466, 'atr_max_pct': 0.061483140093097494, 'tp_mult': 1.4829279753982338, 'tsl_mult': 0.11384157486096175, 'strategy': 'mean_reversion', 'time_stop': 269, 'use_sma': True, 'use_atr': True, 'use_adx': True, 'use_ema': True, 'use_spike': True, 'rsi_required': True, 'edge_k': 1.6941582650573106, 'edge_cap': 0.6170732862337407, 'bull_strategy': 'mean_reversion', 'bull_bb_std_mult': 2.6254628930513624, 'bull_rsi_os': 40, 'bull_rsi_ob': 68, 'bull_adx_thresh': 19.988881612074717, 'bull_atr_min_pct': 0.023671263575320418, 'bull_atr_max_pct': 0.024581227234190713, 'bull_tp_mult': 2.0334060468078303, 'bull_tsl_mult': 0.2294964714987986, 'bull_time_stop': 246, 'bull_use_sma': False, 'bull_use_ema': False, 'bull_use_atr': False, 'bull_use_adx': True, 'bull_use_spike': False, 'bull_rsi_required': False, 'bear_strategy': 'breakout', 'bear_bb_std_mult': 0.5894677224264862, 'bear_rsi_os': 22, 'bear_rsi_ob': 54, 'bear_adx_thresh': 24.567548553032225, 'bear_atr_min_pct': 0.011865172884385372, 'bear_atr_max_pct': 0.11562306948575449, 'bear_tp_mult': 1.9053614422776446, 'bear_tsl_mult': 0.8622290704740845, 'bear_time_stop': 70, 'bear_use_sma': False, 'bear_use_ema': True, 'bear_use_atr': False, 'bear_use_adx': False, 'bear_use_spike': False, 'bear_rsi_required': False, 'sideways_strategy': 'breakout', 'sideways_bb_std_mult': 2.044538336605776, 'sideways_rsi_os': 51, 'sideways_rsi_ob': 69, 'sideways_adx_thresh': 23.81256185737325, 'sideways_atr_min_pct': 0.019420581318426226, 'sideways_atr_max_pct': 0.018918190782899736, 'sideways_tp_mult': 2.387781542541167, 'sideways_tsl_mult': 0.6619862645293133, 'sideways_time_stop': 154, 'sideways_use_sma': False, 'sideways_use_ema': True, 'sideways_use_atr': False, 'sideways_use_adx': False, 'sideways_use_spike': False, 'sideways_rsi_required': False}.
[I 2025-08-30 14:35:29,595] Trial 118 finished with values: [-1000000000.0, 1000000000.0] and parameters: {'p_sma': 17, 'p_std': 5, 'p_atr': 20, 'p_adx': 24, 'rsi_period': 14, 'ema1': 15, 'ema2': 32, 'slip_atr_k': 0.07108499986882051, 'slip_spread_k': 0.4817761176315459, 'spread_hl_frac': 0.0417193753355271, 'bb_std_mult': 2.576210406422407, 'rsi_os': 17, 'rsi_ob': 73, 'vol_spike': 0.019695881956979855, 'adx_thresh': 21.543994551961628, 'atr_min_pct': 0.028813994214169664, 'atr_max_pct': 0.053864750323184885, 'tp_mult': 1.4929448730501618, 'tsl_mult': 0.12222422584484476, 'strategy': 'mean_reversion', 'time_stop': 300, 'use_sma': True, 'use_atr': True, 'use_adx': True, 'use_ema': True, 'use_spike': True, 'rsi_required': True, 'edge_k': 1.683872168902984, 'edge_cap': 0.8965300067083188, 'bull_strategy': 'mean_reversion', 'bull_bb_std_mult': 2.400689320858026, 'bull_rsi_os': 37, 'bull_rsi_ob': 74, 'bull_adx_thresh': 20.09396995272987, 'bull_atr_min_pct': 0.013077270651401298, 'bull_atr_max_pct': 0.10976391618951818, 'bull_tp_mult': 1.7054136509429219, 'bull_tsl_mult': 0.280658478209761, 'bull_time_stop': 142, 'bull_use_sma': True, 'bull_use_ema': False, 'bull_use_atr': False, 'bull_use_adx': True, 'bull_use_spike': False, 'bull_rsi_required': False, 'bear_strategy': 'breakout', 'bear_bb_std_mult': 0.5641776770783438, 'bear_rsi_os': 20, 'bear_rsi_ob': 78, 'bear_adx_thresh': 24.266808783242137, 'bear_atr_min_pct': 0.00891437146039185, 'bear_atr_max_pct': 0.11617697063445831, 'bear_tp_mult': 1.928438089348467, 'bear_tsl_mult': 0.7117325469719229, 'bear_time_stop': 102, 'bear_use_sma': False, 'bear_use_ema': True, 'bear_use_atr': False, 'bear_use_adx': False, 'bear_use_spike': False, 'bear_rsi_required': False, 'sideways_strategy': 'breakout', 'sideways_bb_std_mult': 2.0536011544247605, 'sideways_rsi_os': 45, 'sideways_rsi_ob': 61, 'sideways_adx_thresh': 29.096541006995732, 'sideways_atr_min_pct': 0.01933102973261697, 'sideways_atr_max_pct': 0.018584967785776306, 'sideways_tp_mult': 2.849088997653892, 'sideways_tsl_mult': 0.45861846958549435, 'sideways_time_stop': 274, 'sideways_use_sma': False, 'sideways_use_ema': True, 'sideways_use_atr': False, 'sideways_use_adx': False, 'sideways_use_spike': False, 'sideways_rsi_required': False}.
[I 2025-08-30 14:35:29,890] Trial 119 finished with values: [-0.022955951743532155, 0.023175088347931715] and parameters: {'p_sma': 14, 'p_std': 8, 'p_atr': 18, 'p_adx': 24, 'rsi_period': 24, 'ema1': 15, 'ema2': 33, 'slip_atr_k': 0.0710028499067002, 'slip_spread_k': 0.5365235154840484, 'spread_hl_frac': 0.04127043903972982, 'bb_std_mult': 2.102230883288766, 'rsi_os': 40, 'rsi_ob': 66, 'vol_spike': 0.016919553617931016, 'adx_thresh': 21.437828587006848, 'atr_min_pct': 0.028928740842277242, 'atr_max_pct': 0.060815823815807336, 'tp_mult': 2.122630479051356, 'tsl_mult': 0.12005434962830719, 'strategy': 'mean_reversion', 'time_stop': 291, 'use_sma': True, 'use_atr': True, 'use_adx': False, 'use_ema': True, 'use_spike': True, 'rsi_required': True, 'edge_k': 0.8607735098604897, 'edge_cap': 0.8871466361949493, 'bull_strategy': 'mean_reversion', 'bull_bb_std_mult': 2.6294044485568935, 'bull_rsi_os': 40, 'bull_rsi_ob': 73, 'bull_adx_thresh': 20.95217655972189, 'bull_atr_min_pct': 0.013364134249815168, 'bull_atr_max_pct': 0.022847244964715963, 'bull_tp_mult': 1.707355015384327, 'bull_tsl_mult': 0.2268810691874491, 'bull_time_stop': 139, 'bull_use_sma': True, 'bull_use_ema': False, 'bull_use_atr': False, 'bull_use_adx': True, 'bull_use_spike': False, 'bull_rsi_required': False, 'bear_strategy': 'breakout', 'bear_bb_std_mult': 0.5623843424030357, 'bear_rsi_os': 20, 'bear_rsi_ob': 63, 'bear_adx_thresh': 18.23059078268938, 'bear_atr_min_pct': 0.008756439553069885, 'bear_atr_max_pct': 0.05382483683444587, 'bear_tp_mult': 2.0860845982450704, 'bear_tsl_mult': 0.7044244692023542, 'bear_time_stop': 245, 'bear_use_sma': False, 'bear_use_ema': True, 'bear_use_atr': False, 'bear_use_adx': False, 'bear_use_spike': False, 'bear_rsi_required': False, 'sideways_strategy': 'breakout', 'sideways_bb_std_mult': 2.0302340530486096, 'sideways_rsi_os': 51, 'sideways_rsi_ob': 62, 'sideways_adx_thresh': 29.35341515373493, 'sideways_atr_min_pct': 0.0013240019404784763, 'sideways_atr_max_pct': 0.06103654861743764, 'sideways_tp_mult': 2.8460104631011256, 'sideways_tsl_mult': 0.14486937383870593, 'sideways_time_stop': 274, 'sideways_use_sma': False, 'sideways_use_ema': True, 'sideways_use_atr': False, 'sideways_use_adx': False, 'sideways_use_spike': False, 'sideways_rsi_required': False}.
[I 2025-08-30 14:35:29,963] Trial 120 finished with values: [-1000000000.0, 1000000000.0] and parameters: {'p_sma': 27, 'p_std': 55, 'p_atr': 18, 'p_adx': 24, 'rsi_period': 31, 'ema1': 16, 'ema2': 33, 'slip_atr_k': 0.07088977511639075, 'slip_spread_k': 0.24601466832691332, 'spread_hl_frac': 0.041352568610270056, 'bb_std_mult': 2.9339329896403608, 'rsi_os': 45, 'rsi_ob': 51, 'vol_spike': 0.057071552198845285, 'adx_thresh': 21.102506872355153, 'atr_min_pct': 0.029030434998655725, 'atr_max_pct': 0.05383998029841472, 'tp_mult': 1.489016549380716, 'tsl_mult': 0.6816102873618266, 'strategy': 'mean_reversion', 'time_stop': 29, 'use_sma': True, 'use_atr': True, 'use_adx': False, 'use_ema': True, 'use_spike': True, 'rsi_required': True, 'edge_k': 1.8400729860178582, 'edge_cap': 0.6161992294510984, 'bull_strategy': 'mean_reversion', 'bull_bb_std_mult': 2.6320436691853417, 'bull_rsi_os': 40, 'bull_rsi_ob': 58, 'bull_adx_thresh': 21.098000925214677, 'bull_atr_min_pct': 0.02834404455448841, 'bull_atr_max_pct': 0.022117531056861657, 'bull_tp_mult': 2.707617235551597, 'bull_tsl_mult': 0.23576980300110234, 'bull_time_stop': 89, 'bull_use_sma': True, 'bull_use_ema': False, 'bull_use_atr': False, 'bull_use_adx': True, 'bull_use_spike': False, 'bull_rsi_required': False, 'bear_strategy': 'breakout', 'bear_bb_std_mult': 0.5753035182884955, 'bear_rsi_os': 38, 'bear_rsi_ob': 78, 'bear_adx_thresh': 24.708262917633157, 'bear_atr_min_pct': 0.013430280140012124, 'bear_atr_max_pct': 0.09770705759620865, 'bear_tp_mult': 2.0973572005130556, 'bear_tsl_mult': 0.7020846616988589, 'bear_time_stop': 254, 'bear_use_sma': False, 'bear_use_ema': True, 'bear_use_atr': False, 'bear_use_adx': False, 'bear_use_spike': False, 'bear_rsi_required': False, 'sideways_strategy': 'breakout', 'sideways_bb_std_mult': 2.0514749687666405, 'sideways_rsi_os': 51, 'sideways_rsi_ob': 61, 'sideways_adx_thresh': 26.095102659877764, 'sideways_atr_min_pct': 0.023309728973014126, 'sideways_atr_max_pct': 0.014400562916241576, 'sideways_tp_mult': 2.8427612098945336, 'sideways_tsl_mult': 0.31653505561651396, 'sideways_time_stop': 186, 'sideways_use_sma': False, 'sideways_use_ema': True, 'sideways_use_atr': False, 'sideways_use_adx': False, 'sideways_use_spike': False, 'sideways_rsi_required': False}.
[I 2025-08-30 14:36:01,035] Trial 122 finished with values: [-1000000000.0, 1000000000.0] and parameters: {'p_sma': 39, 'p_std': 8, 'p_atr': 18, 'p_adx': 8, 'rsi_period': 25, 'ema1': 20, 'ema2': 33, 'slip_atr_k': 0.13384551903892633, 'slip_spread_k': 0.5380662350957126, 'spread_hl_frac': 0.047676645306073843, 'bb_std_mult': 2.382875009173378, 'rsi_os': 46, 'rsi_ob': 66, 'vol_spike': 0.058250597110827904, 'adx_thresh': 21.986436406058935, 'atr_min_pct': 0.025630499908404634, 'atr_max_pct': 0.06970600436180047, 'tp_mult': 2.829310846491696, 'tsl_mult': 0.7244568990132793, 'strategy': 'mean_reversion', 'time_stop': 52, 'use_sma': True, 'use_atr': True, 'use_adx': False, 'use_ema': True, 'use_spike': True, 'rsi_required': True, 'edge_k': 1.9075608008766527, 'edge_cap': 0.5563055358380955, 'bull_strategy': 'mean_reversion', 'bull_bb_std_mult': 0.6331578031638364, 'bull_rsi_os': 53, 'bull_rsi_ob': 81, 'bull_adx_thresh': 20.95086879024456, 'bull_atr_min_pct': 0.028167321724102957, 'bull_atr_max_pct': 0.023175251524323603, 'bull_tp_mult': 2.847555997103739, 'bull_tsl_mult': 0.3691960523147776, 'bull_time_stop': 90, 'bull_use_sma': True, 'bull_use_ema': False, 'bull_use_atr': False, 'bull_use_adx': True, 'bull_use_spike': False, 'bull_rsi_required': False, 'bear_strategy': 'breakout', 'bear_bb_std_mult': 1.3565218615890529, 'bear_rsi_os': 29, 'bear_rsi_ob': 66, 'bear_adx_thresh': 19.474691059842506, 'bear_atr_min_pct': 0.013666698396539643, 'bear_atr_max_pct': 0.09629760178558508, 'bear_tp_mult': 2.1160879824193928, 'bear_tsl_mult': 0.38137007324799727, 'bear_time_stop': 252, 'bear_use_sma': False, 'bear_use_ema': True, 'bear_use_atr': False, 'bear_use_adx': False, 'bear_use_spike': False, 'bear_rsi_required': False, 'sideways_strategy': 'breakout', 'sideways_bb_std_mult': 1.665885679258837, 'sideways_rsi_os': 49, 'sideways_rsi_ob': 94, 'sideways_adx_thresh': 26.224131802388616, 'sideways_atr_min_pct': 0.02327512954856046, 'sideways_atr_max_pct': 0.013704187589491485, 'sideways_tp_mult': 1.0150187403308768, 'sideways_tsl_mult': 0.1412769734058816, 'sideways_time_stop': 185, 'sideways_use_sma': False, 'sideways_use_ema': True, 'sideways_use_atr': False, 'sideways_use_adx': False, 'sideways_use_spike': False, 'sideways_rsi_required': False}.
[I 2025-08-30 14:36:01,340] Trial 123 finished with values: [-1000000000.0, 1000000000.0] and parameters: {'p_sma': 50, 'p_std': 24, 'p_atr': 17, 'p_adx': 8, 'rsi_period': 7, 'ema1': 20, 'ema2': 35, 'slip_atr_k': 0.13703445650254586, 'slip_spread_k': 0.981492458223912, 'spread_hl_frac': 0.04810543189123877, 'bb_std_mult': 1.961288997964183, 'rsi_os': 49, 'rsi_ob': 77, 'vol_spike': 0.07125413737469805, 'adx_thresh': 27.768822338688235, 'atr_min_pct': 0.017566286280955825, 'atr_max_pct': 0.06674992505214404, 'tp_mult': 2.2262394299719332, 'tsl_mult': 0.29484719800422304, 'strategy': 'mean_reversion', 'time_stop': 292, 'use_sma': True, 'use_atr': True, 'use_adx': False, 'use_ema': False, 'use_spike': True, 'rsi_required': True, 'edge_k': 1.6271036527854248, 'edge_cap': 0.9715989500033468, 'bull_strategy': 'mean_reversion', 'bull_bb_std_mult': 0.909923602203025, 'bull_rsi_os': 52, 'bull_rsi_ob': 81, 'bull_adx_thresh': 16.64330054358178, 'bull_atr_min_pct': 0.012128644086358173, 'bull_atr_max_pct': 0.13461736784436637, 'bull_tp_mult': 1.7936363355589942, 'bull_tsl_mult': 0.38151232126768575, 'bull_time_stop': 296, 'bull_use_sma': False, 'bull_use_ema': False, 'bull_use_atr': False, 'bull_use_adx': True, 'bull_use_spike': True, 'bull_rsi_required': False, 'bear_strategy': 'breakout', 'bear_bb_std_mult': 3.1979069384950574, 'bear_rsi_os': 18, 'bear_rsi_ob': 58, 'bear_adx_thresh': 19.32336552588213, 'bear_atr_min_pct': 0.02988839653269645, 'bear_atr_max_pct': 0.14416779341109304, 'bear_tp_mult': 2.02406938915372, 'bear_tsl_mult': 0.7713960579449747, 'bear_time_stop': 123, 'bear_use_sma': False, 'bear_use_ema': True, 'bear_use_atr': False, 'bear_use_adx': False, 'bear_use_spike': False, 'bear_rsi_required': True, 'sideways_strategy': 'breakout', 'sideways_bb_std_mult': 1.7365840573036655, 'sideways_rsi_os': 48, 'sideways_rsi_ob': 65, 'sideways_adx_thresh': 19.253024455351078, 'sideways_atr_min_pct': 0.02241704789327457, 'sideways_atr_max_pct': 0.01033500330620886, 'sideways_tp_mult': 2.9594215791032634, 'sideways_tsl_mult': 0.09117727631522013, 'sideways_time_stop': 178, 'sideways_use_sma': False, 'sideways_use_ema': True, 'sideways_use_atr': False, 'sideways_use_adx': False, 'sideways_use_spike': False, 'sideways_rsi_required': True}.
[I 2025-08-30 14:36:01,447] Trial 124 finished with values: [-1000000000.0, 1000000000.0] and parameters: {'p_sma': 38, 'p_std': 24, 'p_atr': 17, 'p_adx': 28, 'rsi_period': 27, 'ema1': 17, 'ema2': 51, 'slip_atr_k': 0.08099059689272271, 'slip_spread_k': 0.4158592221280786, 'spread_hl_frac': 0.0484452174155408, 'bb_std_mult': 1.9727391326609003, 'rsi_os': 49, 'rsi_ob': 77, 'vol_spike': 0.1305986681430771, 'adx_thresh': 27.84417179010964, 'atr_min_pct': 0.025601161621907037, 'atr_max_pct': 0.1359755984359347, 'tp_mult': 2.2457705036756543, 'tsl_mult': 0.7421631891987202, 'strategy': 'mean_reversion', 'time_stop': 290, 'use_sma': True, 'use_atr': True, 'use_adx': False, 'use_ema': False, 'use_spike': True, 'rsi_required': True, 'edge_k': 1.9088583234982297, 'edge_cap': 0.3480744045761985, 'bull_strategy': 'mean_reversion', 'bull_bb_std_mult': 0.6132488283530587, 'bull_rsi_os': 52, 'bull_rsi_ob': 81, 'bull_adx_thresh': 16.713984441802516, 'bull_atr_min_pct': 0.015269984289556648, 'bull_atr_max_pct': 0.04965088590732291, 'bull_tp_mult': 1.8992809222325169, 'bull_tsl_mult': 0.3731400061198321, 'bull_time_stop': 298, 'bull_use_sma': False, 'bull_use_ema': False, 'bull_use_atr': False, 'bull_use_adx': True, 'bull_use_spike': True, 'bull_rsi_required': False, 'bear_strategy': 'breakout', 'bear_bb_std_mult': 1.3502914579600105, 'bear_rsi_os': 18, 'bear_rsi_ob': 59, 'bear_adx_thresh': 19.348159639347926, 'bear_atr_min_pct': 0.029996556707942837, 'bear_atr_max_pct': 0.147064890272226, 'bear_tp_mult': 1.8513596407432897, 'bear_tsl_mult': 0.7751921519498909, 'bear_time_stop': 46, 'bear_use_sma': False, 'bear_use_ema': True, 'bear_use_atr': False, 'bear_use_adx': False, 'bear_use_spike': False, 'bear_rsi_required': True, 'sideways_strategy': 'breakout', 'sideways_bb_std_mult': 1.7138050300427938, 'sideways_rsi_os': 48, 'sideways_rsi_ob': 48, 'sideways_adx_thresh': 21.906960012646405, 'sideways_atr_min_pct': 0.0224752858015355, 'sideways_atr_max_pct': 0.012475651576608723, 'sideways_tp_mult': 1.8604542638491761, 'sideways_tsl_mult': 0.09558482984278299, 'sideways_time_stop': 115, 'sideways_use_sma': False, 'sideways_use_ema': True, 'sideways_use_atr': False, 'sideways_use_adx': False, 'sideways_use_spike': False, 'sideways_rsi_required': True}.
[I 2025-08-30 14:36:01,617] Trial 121 finished with values: [-0.02295043261228602, 0.022899441610104224] and parameters: {'p_sma': 39, 'p_std': 8, 'p_atr': 18, 'p_adx': 28, 'rsi_period': 27, 'ema1': 19, 'ema2': 24, 'slip_atr_k': 0.0805572951610131, 'slip_spread_k': 0.4096327077633605, 'spread_hl_frac': 0.04109803363076969, 'bb_std_mult': 2.3173854743537365, 'rsi_os': 47, 'rsi_ob': 66, 'vol_spike': 0.27352328676997884, 'adx_thresh': 21.763479223510572, 'atr_min_pct': 0.017817515385098952, 'atr_max_pct': 0.10143863586115433, 'tp_mult': 2.83420880796227, 'tsl_mult': 0.6853985883436121, 'strategy': 'mean_reversion', 'time_stop': 30, 'use_sma': True, 'use_atr': True, 'use_adx': False, 'use_ema': True, 'use_spike': True, 'rsi_required': True, 'edge_k': 1.6366473306638971, 'edge_cap': 0.6948155316759888, 'bull_strategy': 'mean_reversion', 'bull_bb_std_mult': 0.616737750630401, 'bull_rsi_os': 46, 'bull_rsi_ob': 73, 'bull_adx_thresh': 20.641782044671885, 'bull_atr_min_pct': 0.01537744836993991, 'bull_atr_max_pct': 0.1109157611377048, 'bull_tp_mult': 1.707802433271019, 'bull_tsl_mult': 0.3693154754985674, 'bull_time_stop': 90, 'bull_use_sma': True, 'bull_use_ema': False, 'bull_use_atr': False, 'bull_use_adx': True, 'bull_use_spike': False, 'bull_rsi_required': False, 'bear_strategy': 'breakout', 'bear_bb_std_mult': 3.1843668427069045, 'bear_rsi_os': 18, 'bear_rsi_ob': 66, 'bear_adx_thresh': 19.380171389292922, 'bear_atr_min_pct': 0.013538811781536554, 'bear_atr_max_pct': 0.09548543701891683, 'bear_tp_mult': 2.099138307949145, 'bear_tsl_mult': 0.7076504230586758, 'bear_time_stop': 101, 'bear_use_sma': False, 'bear_use_ema': True, 'bear_use_atr': False, 'bear_use_adx': False, 'bear_use_spike': False, 'bear_rsi_required': False, 'sideways_strategy': 'breakout', 'sideways_bb_std_mult': 1.664245678737577, 'sideways_rsi_os': 49, 'sideways_rsi_ob': 61, 'sideways_adx_thresh': 26.025678869974737, 'sideways_atr_min_pct': 0.0016891287202573987, 'sideways_atr_max_pct': 0.06214358997443963, 'sideways_tp_mult': 2.8469238219320303, 'sideways_tsl_mult': 0.14357993912381, 'sideways_time_stop': 186, 'sideways_use_sma': False, 'sideways_use_ema': True, 'sideways_use_atr': False, 'sideways_use_adx': False, 'sideways_use_spike': False, 'sideways_rsi_required': False}.
[I 2025-08-30 14:36:33,386] Trial 125 finished with values: [-1000000000.0, 1000000000.0] and parameters: {'p_sma': 42, 'p_std': 10, 'p_atr': 22, 'p_adx': 30, 'rsi_period': 8, 'ema1': 6, 'ema2': 35, 'slip_atr_k': 0.08247413204121898, 'slip_spread_k': 0.9938717670258248, 'spread_hl_frac': 0.04857133039287559, 'bb_std_mult': 2.7794732437559087, 'rsi_os': 21, 'rsi_ob': 79, 'vol_spike': 0.10459990623941386, 'adx_thresh': 18.85263358529121, 'atr_min_pct': 0.026940598848552495, 'atr_max_pct': 0.07437731776235813, 'tp_mult': 2.255338748345949, 'tsl_mult': 0.09398322950374388, 'strategy': 'mean_reversion', 'time_stop': 292, 'use_sma': True, 'use_atr': True, 'use_adx': False, 'use_ema': False, 'use_spike': True, 'rsi_required': True, 'edge_k': 1.7500473501478604, 'edge_cap': 0.42800237723405804, 'bull_strategy': 'mean_reversion', 'bull_bb_std_mult': 2.044773553758184, 'bull_rsi_os': 46, 'bull_rsi_ob': 81, 'bull_adx_thresh': 24.040637809632383, 'bull_atr_min_pct': 0.00711652387295131, 'bull_atr_max_pct': 0.07515904599586037, 'bull_tp_mult': 1.8717309344491602, 'bull_tsl_mult': 0.3942238803677423, 'bull_time_stop': 100, 'bull_use_sma': False, 'bull_use_ema': False, 'bull_use_atr': False, 'bull_use_adx': True, 'bull_use_spike': True, 'bull_rsi_required': False, 'bear_strategy': 'breakout', 'bear_bb_std_mult': 2.445752120040138, 'bear_rsi_os': 18, 'bear_rsi_ob': 59, 'bear_adx_thresh': 12.391819059536498, 'bear_atr_min_pct': 0.024265409110879547, 'bear_atr_max_pct': 0.14607611947631546, 'bear_tp_mult': 2.667093229324598, 'bear_tsl_mult': 0.04446394453600916, 'bear_time_stop': 122, 'bear_use_sma': False, 'bear_use_ema': False, 'bear_use_atr': False, 'bear_use_adx': True, 'bear_use_spike': False, 'bear_rsi_required': True, 'sideways_strategy': 'mean_reversion', 'sideways_bb_std_mult': 1.8041804659835288, 'sideways_rsi_os': 26, 'sideways_rsi_ob': 71, 'sideways_adx_thresh': 20.915211156558826, 'sideways_atr_min_pct': 0.016787663316840958, 'sideways_atr_max_pct': 0.010491571497063631, 'sideways_tp_mult': 1.4551703305562715, 'sideways_tsl_mult': 0.11300635478037513, 'sideways_time_stop': 176, 'sideways_use_sma': False, 'sideways_use_ema': True, 'sideways_use_atr': False, 'sideways_use_adx': False, 'sideways_use_spike': False, 'sideways_rsi_required': True}.
