[I 2025-08-30 14:31:48,565] Trial 88 finished with values: [-1000000000.0, 1000000000.0] and parameters: {'p_sma': 56, 'p_std': 41, 'p_atr': 23, 'p_adx': 10, 'rsi_period': 58, 'ema1': 14, 'ema2': 37, 'slip_atr_k': 0.05898564478931889, 'slip_spread_k': 0.38982475234182545, 'spread_hl_frac': 0.022767086262593564, 'bb_std_mult': 0.593849082237595, 'rsi_os': 13, 'rsi_ob': 84, 'vol_spike': 0.17208955291051878, 'adx_thresh': 33.13110627670031, 'atr_min_pct': 0.0006808016369564325, 'atr_max_pct': 0.014869464976507105, 'tp_mult': 2.4853983816583796, 'tsl_mult': 0.3759253788662429, 'strategy': 'breakout', 'time_stop': 44, 'use_sma': False, 'use_atr': False, 'use_adx': True, 'use_ema': False, 'use_spike': False, 'rsi_required': True, 'edge_k': 1.14840183699333, 'edge_cap': 0.37603379620169963, 'bull_strategy': 'breakout', 'bull_bb_std_mult': 3.1673545057198718, 'bull_rsi_os': 22, 'bull_rsi_ob': 84, 'bull_adx_thresh': 15.628181791287766, 'bull_atr_min_pct': 0.007959689486470668, 'bull_atr_max_pct': 0.017667592005274346, 'bull_tp_mult': 1.1744456252956754, 'bull_tsl_mult': 0.5581465876760707, 'bull_time_stop': 145, 'bull_use_sma': False, 'bull_use_ema': True, 'bull_use_atr': False, 'bull_use_adx': False, 'bull_use_spike': True, 'bull_rsi_required': False, 'bear_strategy': 'mean_reversion', 'bear_bb_std_mult': 1.7530672910226277, 'bear_rsi_os': 17, 'bear_rsi_ob': 95, 'bear_adx_thresh': 34.98114157365164, 'bear_atr_min_pct': 0.005702694347714634, 'bear_atr_max_pct': 0.03828973714222941, 'bear_tp_mult': 1.367591551030873, 'bear_tsl_mult': 0.8874613652880676, 'bear_time_stop': 142, 'bear_use_sma': True, 'bear_use_ema': True, 'bear_use_atr': True, 'bear_use_adx': False, 'bear_use_spike': True, 'bear_rsi_required': False, 'sideways_strategy': 'mean_reversion', 'sideways_bb_std_mult': 3.446748473691074, 'sideways_rsi_os': 14, 'sideways_rsi_ob': 79, 'sideways_adx_thresh': 26.83310813311713, 'sideways_atr_min_pct': 0.02994843192641716, 'sideways_atr_max_pct': 0.021563162625216632, 'sideways_tp_mult': 1.320406596053727, 'sideways_tsl_mult': 0.07125351016884379, 'sideways_time_stop': 133, 'sideways_use_sma': True, 'sideways_use_ema': True, 'sideways_use_atr': True, 'sideways_use_adx': False, 'sideways_use_spike': True, 'sideways_rsi_required': False}.
[I 2025-08-30 14:31:48,582] Trial 89 finished with values: [-1000000000.0, 1000000000.0] and parameters: {'p_sma': 21, 'p_std': 9, 'p_atr': 23, 'p_adx': 9, 'rsi_period': 51, 'ema1': 10, 'ema2': 34, 'slip_atr_k': 0.057484130301848034, 'slip_spread_k': 0.0632396409161991, 'spread_hl_frac': 0.015000310899542743, 'bb_std_mult': 2.614332098691707, 'rsi_os': 11, 'rsi_ob': 47, 'vol_spike': 0.21608298549972654, 'adx_thresh': 33.14145096759318, 'atr_min_pct': 0.00019031473067479613, 'atr_max_pct': 0.014313821105450123, 'tp_mult': 2.5111239435667487, 'tsl_mult': 0.3570901317664078, 'strategy': 'breakout', 'time_stop': 232, 'use_sma': False, 'use_atr': False, 'use_adx': True, 'use_ema': False, 'use_spike': False, 'rsi_required': False, 'edge_k': 0.6214980498620502, 'edge_cap': 0.3669943992575618, 'bull_strategy': 'breakout', 'bull_bb_std_mult': 3.118108351679707, 'bull_rsi_os': 22, 'bull_rsi_ob': 87, 'bull_adx_thresh': 15.69674431756521, 'bull_atr_min_pct': 0.02973151712849382, 'bull_atr_max_pct': 0.031100919666039693, 'bull_tp_mult': 1.4258759795764004, 'bull_tsl_mult': 0.9433894546627899, 'bull_time_stop': 253, 'bull_use_sma': True, 'bull_use_ema': True, 'bull_use_atr': False, 'bull_use_adx': False, 'bull_use_spike': False, 'bull_rsi_required': False, 'bear_strategy': 'mean_reversion', 'bear_bb_std_mult': 2.7481742044407853, 'bear_rsi_os': 17, 'bear_rsi_ob': 95, 'bear_adx_thresh': 34.882590436178035, 'bear_atr_min_pct': 0.005779674512493765, 'bear_atr_max_pct': 0.14078375699823015, 'bear_tp_mult': 1.5894682286893218, 'bear_tsl_mult': 0.5354399417561253, 'bear_time_stop': 199, 'bear_use_sma': True, 'bear_use_ema': False, 'bear_use_atr': True, 'bear_use_adx': True, 'bear_use_spike': True, 'bear_rsi_required': False, 'sideways_strategy': 'mean_reversion', 'sideways_bb_std_mult': 0.6585585366601485, 'sideways_rsi_os': 9, 'sideways_rsi_ob': 85, 'sideways_adx_thresh': 6.967686979106167, 'sideways_atr_min_pct': 0.02487238576508221, 'sideways_atr_max_pct': 0.10199752698173586, 'sideways_tp_mult': 2.8950434535590337, 'sideways_tsl_mult': 0.08532108142559183, 'sideways_time_stop': 131, 'sideways_use_sma': True, 'sideways_use_ema': True, 'sideways_use_atr': True, 'sideways_use_adx': False, 'sideways_use_spike': True, 'sideways_rsi_required': False}.
[I 2025-08-30 14:32:19,504] Trial 95 finished with values: [-1000000000.0, 1000000000.0] and parameters: {'p_sma': 36, 'p_std': 13, 'p_atr': 19, 'p_adx': 8, 'rsi_period': 66, 'ema1': 12, 'ema2': 42, 'slip_atr_k': 0.24859515829599915, 'slip_spread_k': 0.3457397028269813, 'spread_hl_frac': 0.04565531075239233, 'bb_std_mult': 3.0129992092723734, 'rsi_os': 50, 'rsi_ob': 86, 'vol_spike': 0.06471395339239368, 'adx_thresh': 34.32904007610837, 'atr_min_pct': 0.026086009231240968, 'atr_max_pct': 0.039107813826808696, 'tp_mult': 2.196572796448869, 'tsl_mult': 0.0719101872179917, 'strategy': 'breakout', 'time_stop': 140, 'use_sma': False, 'use_atr': False, 'use_adx': False, 'use_ema': True, 'use_spike': True, 'rsi_required': True, 'edge_k': 1.887543819100717, 'edge_cap': 0.40381606823602084, 'bull_strategy': 'mean_reversion', 'bull_bb_std_mult': 2.8257001311374017, 'bull_rsi_os': 7, 'bull_rsi_ob': 82, 'bull_adx_thresh': 31.16382324916486, 'bull_atr_min_pct': 0.002173048327803437, 'bull_atr_max_pct': 0.013292625044206068, 'bull_tp_mult': 1.0863917641544554, 'bull_tsl_mult': 0.3922520825260764, 'bull_time_stop': 74, 'bull_use_sma': False, 'bull_use_ema': True, 'bull_use_atr': True, 'bull_use_adx': False, 'bull_use_spike': True, 'bull_rsi_required': True, 'bear_strategy': 'breakout', 'bear_bb_std_mult': 0.6344578622936798, 'bear_rsi_os': 23, 'bear_rsi_ob': 88, 'bear_adx_thresh': 33.33126354168759, 'bear_atr_min_pct': 0.021396041584940184, 'bear_atr_max_pct': 0.03385981668770554, 'bear_tp_mult': 2.071590471076631, 'bear_tsl_mult': 0.6883922406351892, 'bear_time_stop': 170, 'bear_use_sma': False, 'bear_use_ema': True, 'bear_use_atr': False, 'bear_use_adx': False, 'bear_use_spike': True, 'bear_rsi_required': True, 'sideways_strategy': 'breakout', 'sideways_bb_std_mult': 3.5540419959716143, 'sideways_rsi_os': 7, 'sideways_rsi_ob': 82, 'sideways_adx_thresh': 8.356011095527675, 'sideways_atr_min_pct': 0.02854786198831632, 'sideways_atr_max_pct': 0.013796828510015033, 'sideways_tp_mult': 1.5461610891780881, 'sideways_tsl_mult': 0.045746859413519324, 'sideways_time_stop': 207, 'sideways_use_sma': True, 'sideways_use_ema': False, 'sideways_use_atr': True, 'sideways_use_adx': True, 'sideways_use_spike': False, 'sideways_rsi_required': True}.
[I 2025-08-30 14:32:19,604] Trial 93 finished with values: [-1000000000.0, 1000000000.0] and parameters: {'p_sma': 36, 'p_std': 13, 'p_atr': 19, 'p_adx': 10, 'rsi_period': 10, 'ema1': 20, 'ema2': 34, 'slip_atr_k': 0.10566416547985871, 'slip_spread_k': 0.48211172216569287, 'spread_hl_frac': 0.018507942066874356, 'bb_std_mult': 1.0048069069978185, 'rsi_os': 54, 'rsi_ob': 84, 'vol_spike': 0.003267859350258112, 'adx_thresh': 34.21538413863502, 'atr_min_pct': 0.020928817486581687, 'atr_max_pct': 0.03841196180560852, 'tp_mult': 2.207094654022415, 'tsl_mult': 0.06411226034876077, 'strategy': 'breakout', 'time_stop': 202, 'use_sma': False, 'use_atr': False, 'use_adx': False, 'use_ema': True, 'use_spike': False, 'rsi_required': True, 'edge_k': 0.5660062028627368, 'edge_cap': 0.5842167852899164, 'bull_strategy': 'breakout', 'bull_bb_std_mult': 3.1752109301611955, 'bull_rsi_os': 31, 'bull_rsi_ob': 82, 'bull_adx_thresh': 30.92394995503693, 'bull_atr_min_pct': 0.00768936041385252, 'bull_atr_max_pct': 0.013613986549082783, 'bull_tp_mult': 1.7502281866425289, 'bull_tsl_mult': 0.8443330595010984, 'bull_time_stop': 157, 'bull_use_sma': False, 'bull_use_ema': True, 'bull_use_atr': True, 'bull_use_adx': False, 'bull_use_spike': True, 'bull_rsi_required': True, 'bear_strategy': 'mean_reversion', 'bear_bb_std_mult': 0.6073782357799922, 'bear_rsi_os': 17, 'bear_rsi_ob': 86, 'bear_adx_thresh': 33.70492184466076, 'bear_atr_min_pct': 0.021269404306639563, 'bear_atr_max_pct': 0.05347864176031342, 'bear_tp_mult': 2.0667390220048505, 'bear_tsl_mult': 0.5402227371930106, 'bear_time_stop': 170, 'bear_use_sma': True, 'bear_use_ema': True, 'bear_use_atr': True, 'bear_use_adx': False, 'bear_use_spike': True, 'bear_rsi_required': True, 'sideways_strategy': 'breakout', 'sideways_bb_std_mult': 3.2814684737644484, 'sideways_rsi_os': 37, 'sideways_rsi_ob': 80, 'sideways_adx_thresh': 8.308297227466838, 'sideways_atr_min_pct': 0.025098224187307373, 'sideways_atr_max_pct': 0.01974460243498622, 'sideways_tp_mult': 2.5531759069462834, 'sideways_tsl_mult': 0.047201098884266976, 'sideways_time_stop': 238, 'sideways_use_sma': True, 'sideways_use_ema': False, 'sideways_use_atr': True, 'sideways_use_adx': True, 'sideways_use_spike': False, 'sideways_rsi_required': True}.
[I 2025-08-30 14:32:19,729] Trial 94 finished with values: [-0.026331154975374527, 0.026302029520303152] and parameters: {'p_sma': 35, 'p_std': 13, 'p_atr': 26, 'p_adx': 9, 'rsi_period': 39, 'ema1': 15, 'ema2': 34, 'slip_atr_k': 0.1198464519806833, 'slip_spread_k': 0.5469222311823039, 'spread_hl_frac': 0.035070869837052834, 'bb_std_mult': 1.5803093515865994, 'rsi_os': 11, 'rsi_ob': 86, 'vol_spike': 0.06662138706649161, 'adx_thresh': 34.42765893478609, 'atr_min_pct': 0.002763791245303084, 'atr_max_pct': 0.02154328956862193, 'tp_mult': 2.650456575870683, 'tsl_mult': 0.08359777593223976, 'strategy': 'breakout', 'time_stop': 201, 'use_sma': False, 'use_atr': False, 'use_adx': False, 'use_ema': True, 'use_spike': False, 'rsi_required': False, 'edge_k': 1.8761250086937094, 'edge_cap': 0.41382914704193324, 'bull_strategy': 'breakout', 'bull_bb_std_mult': 1.74092221373447, 'bull_rsi_os': 31, 'bull_rsi_ob': 82, 'bull_adx_thresh': 31.470634662196503, 'bull_atr_min_pct': 0.0008774823073274934, 'bull_atr_max_pct': 0.013412555777027104, 'bull_tp_mult': 2.167999307846788, 'bull_tsl_mult': 0.371312974572925, 'bull_time_stop': 194, 'bull_use_sma': False, 'bull_use_ema': True, 'bull_use_atr': True, 'bull_use_adx': False, 'bull_use_spike': True, 'bull_rsi_required': True, 'bear_strategy': 'mean_reversion', 'bear_bb_std_mult': 0.6171801214410494, 'bear_rsi_os': 27, 'bear_rsi_ob': 89, 'bear_adx_thresh': 33.24217148466374, 'bear_atr_min_pct': 0.02123855048160498, 'bear_atr_max_pct': 0.1405381928788605, 'bear_tp_mult': 2.0593169391206314, 'bear_tsl_mult': 0.5315581579212064, 'bear_time_stop': 170, 'bear_use_sma': True, 'bear_use_ema': True, 'bear_use_atr': False, 'bear_use_adx': False, 'bear_use_spike': True, 'bear_rsi_required': True, 'sideways_strategy': 'breakout', 'sideways_bb_std_mult': 3.593142380038017, 'sideways_rsi_os': 7, 'sideways_rsi_ob': 80, 'sideways_adx_thresh': 8.422906191375032, 'sideways_atr_min_pct': 0.027942225907671692, 'sideways_atr_max_pct': 0.14098005399665858, 'sideways_tp_mult': 2.907605561056808, 'sideways_tsl_mult': 0.15946810805323214, 'sideways_time_stop': 211, 'sideways_use_sma': True, 'sideways_use_ema': False, 'sideways_use_atr': True, 'sideways_use_adx': True, 'sideways_use_spike': False, 'sideways_rsi_required': True}.
[I 2025-08-30 14:32:19,809] Trial 92 finished with values: [-1000000000.0, 1000000000.0] and parameters: {'p_sma': 34, 'p_std': 27, 'p_atr': 19, 'p_adx': 10, 'rsi_period': 39, 'ema1': 10, 'ema2': 49, 'slip_atr_k': 0.12097063755456981, 'slip_spread_k': 0.3924833265166154, 'spread_hl_frac': 0.018259769282345416, 'bb_std_mult': 1.3473934932698206, 'rsi_os': 11, 'rsi_ob': 84, 'vol_spike': 0.06288168222149336, 'adx_thresh': 34.30439509249148, 'atr_min_pct': 0.0029797505755503207, 'atr_max_pct': 0.11329343898640638, 'tp_mult': 2.1768811855879475, 'tsl_mult': 0.06154852717411435, 'strategy': 'breakout', 'time_stop': 203, 'use_sma': False, 'use_atr': False, 'use_adx': False, 'use_ema': False, 'use_spike': False, 'rsi_required': False, 'edge_k': 1.881630225001117, 'edge_cap': 0.6734310788204154, 'bull_strategy': 'breakout', 'bull_bb_std_mult': 0.970175320851757, 'bull_rsi_os': 31, 'bull_rsi_ob': 72, 'bull_adx_thresh': 31.208633400130847, 'bull_atr_min_pct': 0.007330056004128958, 'bull_atr_max_pct': 0.013698445570920145, 'bull_tp_mult': 1.7286970331275613, 'bull_tsl_mult': 0.7286493096161084, 'bull_time_stop': 161, 'bull_use_sma': False, 'bull_use_ema': True, 'bull_use_atr': True, 'bull_use_adx': False, 'bull_use_spike': False, 'bull_rsi_required': True, 'bear_strategy': 'mean_reversion', 'bear_bb_std_mult': 1.7524946491170643, 'bear_rsi_os': 18, 'bear_rsi_ob': 95, 'bear_adx_thresh': 14.724351529741842, 'bear_atr_min_pct': 0.021020411879019842, 'bear_atr_max_pct': 0.14040345816902952, 'bear_tp_mult': 1.7892682920804264, 'bear_tsl_mult': 0.6896430606013246, 'bear_time_stop': 167, 'bear_use_sma': True, 'bear_use_ema': False, 'bear_use_atr': True, 'bear_use_adx': True, 'bear_use_spike': True, 'bear_rsi_required': False, 'sideways_strategy': 'mean_reversion', 'sideways_bb_std_mult': 3.4244853344458717, 'sideways_rsi_os': 11, 'sideways_rsi_ob': 80, 'sideways_adx_thresh': 8.401658034713474, 'sideways_atr_min_pct': 0.028355566324432053, 'sideways_atr_max_pct': 0.028416741231635387, 'sideways_tp_mult': 2.5338815941316573, 'sideways_tsl_mult': 0.1565422007642574, 'sideways_time_stop': 130, 'sideways_use_sma': True, 'sideways_use_ema': False, 'sideways_use_atr': True, 'sideways_use_adx': True, 'sideways_use_spike': True, 'sideways_rsi_required': False}.
[I 2025-08-30 14:32:20,132] Trial 96 finished with values: [-1000000000.0, 1000000000.0] and parameters: {'p_sma': 37, 'p_std': 37, 'p_atr': 9, 'p_adx': 9, 'rsi_period': 39, 'ema1': 13, 'ema2': 49, 'slip_atr_k': 0.11856779241729087, 'slip_spread_k': 0.5504474075350315, 'spread_hl_frac': 0.01838918085690144, 'bb_std_mult': 0.5008426327618485, 'rsi_os': 20, 'rsi_ob': 84, 'vol_spike': 0.20096313731037613, 'adx_thresh': 34.42585303638346, 'atr_min_pct': 0.02326909185244467, 'atr_max_pct': 0.021191181953714357, 'tp_mult': 1.3352988744797547, 'tsl_mult': 0.028984014865898064, 'strategy': 'breakout', 'time_stop': 200, 'use_sma': False, 'use_atr': False, 'use_adx': False, 'use_ema': True, 'use_spike': False, 'rsi_required': True, 'edge_k': 0.5401750401214072, 'edge_cap': 0.22511495120956787, 'bull_strategy': 'mean_reversion', 'bull_bb_std_mult': 0.9487951494287877, 'bull_rsi_os': 30, 'bull_rsi_ob': 55, 'bull_adx_thresh': 33.62109478872272, 'bull_atr_min_pct': 0.0010870592513475513, 'bull_atr_max_pct': 0.010350351589055923, 'bull_tp_mult': 2.3981233340508905, 'bull_tsl_mult': 0.8421202273778926, 'bull_time_stop': 221, 'bull_use_sma': False, 'bull_use_ema': True, 'bull_use_atr': True, 'bull_use_adx': True, 'bull_use_spike': False, 'bull_rsi_required': True, 'bear_strategy': 'breakout', 'bear_bb_std_mult': 1.9194477611637848, 'bear_rsi_os': 27, 'bear_rsi_ob': 74, 'bear_adx_thresh': 21.232843242342014, 'bear_atr_min_pct': 0.01312497250363292, 'bear_atr_max_pct': 0.13782177140901142, 'bear_tp_mult': 1.479069167063675, 'bear_tsl_mult': 0.5685998348536305, 'bear_time_stop': 184, 'bear_use_sma': True, 'bear_use_ema': True, 'bear_use_atr': False, 'bear_use_adx': False, 'bear_use_spike': False, 'bear_rsi_required': False, 'sideways_strategy': 'breakout', 'sideways_bb_std_mult': 3.3023152270258676, 'sideways_rsi_os': 11, 'sideways_rsi_ob': 80, 'sideways_adx_thresh': 5.660410216012197, 'sideways_atr_min_pct': 0.0036740572902987188, 'sideways_atr_max_pct': 0.08558396950541773, 'sideways_tp_mult': 2.0888563543460266, 'sideways_tsl_mult': 0.1639374807681614, 'sideways_time_stop': 106, 'sideways_use_sma': True, 'sideways_use_ema': True, 'sideways_use_atr': True, 'sideways_use_adx': False, 'sideways_use_spike': False, 'sideways_rsi_required': False}.
[I 2025-08-30 14:32:50,727] Trial 99 finished with values: [-1000000000.0, 1000000000.0] and parameters: {'p_sma': 39, 'p_std': 21, 'p_atr': 8, 'p_adx': 29, 'rsi_period': 48, 'ema1': 13, 'ema2': 11, 'slip_atr_k': 0.08071846175664818, 'slip_spread_k': 0.6507797024504625, 'spread_hl_frac': 0.047902507382627205, 'bb_std_mult': 2.3673191695716773, 'rsi_os': 18, 'rsi_ob': 90, 'vol_spike': 0.08372181594665846, 'adx_thresh': 25.427303484515434, 'atr_min_pct': 0.029541577797272435, 'atr_max_pct': 0.033416090828107786, 'tp_mult': 2.106185271636319, 'tsl_mult': 0.03190621894781836, 'strategy': 'breakout', 'time_stop': 218, 'use_sma': True, 'use_atr': True, 'use_adx': False, 'use_ema': True, 'use_spike': True, 'rsi_required': True, 'edge_k': 1.8205597464604786, 'edge_cap': 0.32422720110668757, 'bull_strategy': 'mean_reversion', 'bull_bb_std_mult': 0.702383059420606, 'bull_rsi_os': 41, 'bull_rsi_ob': 89, 'bull_adx_thresh': 20.360795659814748, 'bull_atr_min_pct': 0.009812781927115221, 'bull_atr_max_pct': 0.021228177362581396, 'bull_tp_mult': 1.298403013834364, 'bull_tsl_mult': 0.8932009145830221, 'bull_time_stop': 83, 'bull_use_sma': False, 'bull_use_ema': False, 'bull_use_atr': False, 'bull_use_adx': True, 'bull_use_spike': False, 'bull_rsi_required': False, 'bear_strategy': 'breakout', 'bear_bb_std_mult': 0.7971395140577562, 'bear_rsi_os': 19, 'bear_rsi_ob': 64, 'bear_adx_thresh': 23.064203062534023, 'bear_atr_min_pct': 0.011517940364959315, 'bear_atr_max_pct': 0.14656263057631388, 'bear_tp_mult': 1.9522350420119785, 'bear_tsl_mult': 0.7676431908600158, 'bear_time_stop': 185, 'bear_use_sma': False, 'bear_use_ema': True, 'bear_use_atr': False, 'bear_use_adx': False, 'bear_use_spike': False, 'bear_rsi_required': False, 'sideways_strategy': 'breakout', 'sideways_bb_std_mult': 1.558687132382396, 'sideways_rsi_os': 19, 'sideways_rsi_ob': 84, 'sideways_adx_thresh': 31.84321317204455, 'sideways_atr_min_pct': 0.02305923241926298, 'sideways_atr_max_pct': 0.0841531143206701, 'sideways_tp_mult': 2.109348594254011, 'sideways_tsl_mult': 0.8406891440247755, 'sideways_time_stop': 36, 'sideways_use_sma': False, 'sideways_use_ema': True, 'sideways_use_atr': False, 'sideways_use_adx': False, 'sideways_use_spike': False, 'sideways_rsi_required': False}.
[I 2025-08-30 14:32:50,905] Trial 97 finished with values: [-1000000000.0, 1000000000.0] and parameters: {'p_sma': 35, 'p_std': 58, 'p_atr': 8, 'p_adx': 9, 'rsi_period': 34, 'ema1': 11, 'ema2': 28, 'slip_atr_k': 0.12140487401777876, 'slip_spread_k': 0.5540243999408266, 'spread_hl_frac': 0.035700093585189836, 'bb_std_mult': 3.2550611081764105, 'rsi_os': 20, 'rsi_ob': 90, 'vol_spike': 0.2041698428552368, 'adx_thresh': 32.40413811896506, 'atr_min_pct': 0.02927142212068983, 'atr_max_pct': 0.03308214487908011, 'tp_mult': 2.432165793304418, 'tsl_mult': 0.026927982574120046, 'strategy': 'breakout', 'time_stop': 122, 'use_sma': False, 'use_atr': True, 'use_adx': False, 'use_ema': True, 'use_spike': False, 'rsi_required': False, 'edge_k': 1.8501959881945211, 'edge_cap': 0.2168437174554619, 'bull_strategy': 'mean_reversion', 'bull_bb_std_mult': 1.7550256007948648, 'bull_rsi_os': 41, 'bull_rsi_ob': 90, 'bull_adx_thresh': 33.53580769224587, 'bull_atr_min_pct': 0.009820902805252388, 'bull_atr_max_pct': 0.010007774612716399, 'bull_tp_mult': 1.1110570670611146, 'bull_tsl_mult': 0.7409699489243713, 'bull_time_stop': 82, 'bull_use_sma': False, 'bull_use_ema': False, 'bull_use_atr': False, 'bull_use_adx': True, 'bull_use_spike': False, 'bull_rsi_required': True, 'bear_strategy': 'breakout', 'bear_bb_std_mult': 1.1076170761236166, 'bear_rsi_os': 19, 'bear_rsi_ob': 74, 'bear_adx_thresh': 20.957197565563764, 'bear_atr_min_pct': 0.01615184877671562, 'bear_atr_max_pct': 0.13465151111985585, 'bear_tp_mult': 1.478240121186259, 'bear_tsl_mult': 0.7586671533890267, 'bear_time_stop': 187, 'bear_use_sma': True, 'bear_use_ema': True, 'bear_use_atr': False, 'bear_use_adx': False, 'bear_use_spike': False, 'bear_rsi_required': False, 'sideways_strategy': 'breakout', 'sideways_bb_std_mult': 1.0966050973716401, 'sideways_rsi_os': 47, 'sideways_rsi_ob': 76, 'sideways_adx_thresh': 32.09690914345957, 'sideways_atr_min_pct': 0.027915856057436524, 'sideways_atr_max_pct': 0.02387904773666395, 'sideways_tp_mult': 2.922963266539699, 'sideways_tsl_mult': 0.9657257321552362, 'sideways_time_stop': 174, 'sideways_use_sma': False, 'sideways_use_ema': True, 'sideways_use_atr': True, 'sideways_use_adx': False, 'sideways_use_spike': False, 'sideways_rsi_required': False}.
