[I 2025-08-30 16:27:19,111] Trial 764 finished with values: [-0.006028296321400228, 0.006574975092127903] and parameters: {'p_sma': 53, 'p_std': 25, 'p_atr': 20, 'p_adx': 9, 'rsi_period': 10, 'ema1': 19, 'ema2': 38, 'slip_atr_k': 0.004337803617329698, 'slip_spread_k': 0.7280599675315289, 'spread_hl_frac': 0.0060756839929619975, 'bb_std_mult': 2.5307741704657394, 'rsi_os': 20, 'rsi_ob': 70, 'vol_spike': 0.27495005061915023, 'adx_thresh': 9.306783652583643, 'atr_min_pct': 0.00587479653388313, 'atr_max_pct': 0.010011026415813709, 'tp_mult': 1.5988581000973634, 'tsl_mult': 0.7917442830677679, 'strategy': 'breakout', 'time_stop': 142, 'use_sma': False, 'use_atr': False, 'use_adx': True, 'use_ema': False, 'use_spike': False, 'rsi_required': False, 'edge_k': 1.1778187231134212, 'edge_cap': 0.6147403698572883, 'bull_strategy': 'breakout', 'bull_bb_std_mult': 1.8177470427683555, 'bull_rsi_os': 49, 'bull_rsi_ob': 92, 'bull_adx_thresh': 9.25630983310212, 'bull_atr_min_pct': 0.019847095699216905, 'bull_atr_max_pct': 0.10369860555105313, 'bull_tp_mult': 1.4065917204078122, 'bull_tsl_mult': 0.6295597912310391, 'bull_time_stop': 148, 'bull_use_sma': True, 'bull_use_ema': True, 'bull_use_atr': True, 'bull_use_adx': False, 'bull_use_spike': False, 'bull_rsi_required': False, 'bear_strategy': 'mean_reversion', 'bear_bb_std_mult': 1.6994296697338327, 'bear_rsi_os': 26, 'bear_rsi_ob': 73, 'bear_adx_thresh': 16.293691615803866, 'bear_atr_min_pct': 0.0029081715902289145, 'bear_atr_max_pct': 0.06286142266832752, 'bear_tp_mult': 2.5586938710430935, 'bear_tsl_mult': 0.18691920490770958, 'bear_time_stop': 105, 'bear_use_sma': True, 'bear_use_ema': False, 'bear_use_atr': True, 'bear_use_adx': True, 'bear_use_spike': False, 'bear_rsi_required': True, 'sideways_strategy': 'mean_reversion', 'sideways_bb_std_mult': 2.2363875309807515, 'sideways_rsi_os': 5, 'sideways_rsi_ob': 81, 'sideways_adx_thresh': 11.08192338760478, 'sideways_atr_min_pct': 0.012000460712976536, 'sideways_atr_max_pct': 0.03806525321471463, 'sideways_tp_mult': 1.4392978595933263, 'sideways_tsl_mult': 0.5738953920240658, 'sideways_time_stop': 125, 'sideways_use_sma': True, 'sideways_use_ema': False, 'sideways_use_atr': False, 'sideways_use_adx': True, 'sideways_use_spike': True, 'sideways_rsi_required': True}.
[I 2025-08-30 16:27:19,118] Trial 766 finished with values: [-1000000000.0, 1000000000.0] and parameters: {'p_sma': 5, 'p_std': 23, 'p_atr': 11, 'p_adx': 9, 'rsi_period': 15, 'ema1': 16, 'ema2': 38, 'slip_atr_k': 0.01520724431473659, 'slip_spread_k': 0.9765858794251319, 'spread_hl_frac': 0.005743995301258572, 'bb_std_mult': 0.6809613816194777, 'rsi_os': 26, 'rsi_ob': 84, 'vol_spike': 0.14795121961907026, 'adx_thresh': 6.239053025711215, 'atr_min_pct': 0.027652668745946643, 'atr_max_pct': 0.04322776186654027, 'tp_mult': 2.800084977253994, 'tsl_mult': 0.6454313403845762, 'strategy': 'breakout', 'time_stop': 181, 'use_sma': False, 'use_atr': False, 'use_adx': True, 'use_ema': False, 'use_spike': False, 'rsi_required': True, 'edge_k': 1.1943758502543227, 'edge_cap': 0.6983585486747574, 'bull_strategy': 'breakout', 'bull_bb_std_mult': 1.175759235504746, 'bull_rsi_os': 49, 'bull_rsi_ob': 59, 'bull_adx_thresh': 25.425363607463005, 'bull_atr_min_pct': 0.023941744394637494, 'bull_atr_max_pct': 0.10894197743160187, 'bull_tp_mult': 2.557749497630273, 'bull_tsl_mult': 0.5206413196871266, 'bull_time_stop': 47, 'bull_use_sma': True, 'bull_use_ema': True, 'bull_use_atr': True, 'bull_use_adx': False, 'bull_use_spike': False, 'bull_rsi_required': False, 'bear_strategy': 'mean_reversion', 'bear_bb_std_mult': 1.6622320070207977, 'bear_rsi_os': 26, 'bear_rsi_ob': 74, 'bear_adx_thresh': 17.65123242342798, 'bear_atr_min_pct': 0.003284156966364546, 'bear_atr_max_pct': 0.0610314149859104, 'bear_tp_mult': 2.727757727184958, 'bear_tsl_mult': 0.8858757145718846, 'bear_time_stop': 96, 'bear_use_sma': True, 'bear_use_ema': False, 'bear_use_atr': True, 'bear_use_adx': True, 'bear_use_spike': True, 'bear_rsi_required': False, 'sideways_strategy': 'mean_reversion', 'sideways_bb_std_mult': 3.2382081889758334, 'sideways_rsi_os': 13, 'sideways_rsi_ob': 86, 'sideways_adx_thresh': 11.7788101947725, 'sideways_atr_min_pct': 0.012049099329844357, 'sideways_atr_max_pct': 0.06580163448857393, 'sideways_tp_mult': 1.245601873837619, 'sideways_tsl_mult': 0.31646423488052133, 'sideways_time_stop': 131, 'sideways_use_sma': True, 'sideways_use_ema': False, 'sideways_use_atr': True, 'sideways_use_adx': True, 'sideways_use_spike': True, 'sideways_rsi_required': True}.
[I 2025-08-30 16:27:19,404] Trial 767 finished with values: [-1000000000.0, 1000000000.0] and parameters: {'p_sma': 54, 'p_std': 23, 'p_atr': 11, 'p_adx': 16, 'rsi_period': 11, 'ema1': 22, 'ema2': 59, 'slip_atr_k': 5.388166697911748e-05, 'slip_spread_k': 0.6564162836047139, 'spread_hl_frac': 0.00604336926057721, 'bb_std_mult': 0.6889112873123026, 'rsi_os': 29, 'rsi_ob': 89, 'vol_spike': 0.2752635007571508, 'adx_thresh': 19.547280006368805, 'atr_min_pct': 0.005947827237913983, 'atr_max_pct': 0.12048860057286473, 'tp_mult': 1.612176833179336, 'tsl_mult': 0.6344862241285415, 'strategy': 'breakout', 'time_stop': 212, 'use_sma': False, 'use_atr': False, 'use_adx': True, 'use_ema': False, 'use_spike': False, 'rsi_required': True, 'edge_k': 0.6078336984131876, 'edge_cap': 0.34842900139867033, 'bull_strategy': 'breakout', 'bull_bb_std_mult': 0.9540669561584121, 'bull_rsi_os': 46, 'bull_rsi_ob': 90, 'bull_adx_thresh': 25.432232982741375, 'bull_atr_min_pct': 0.01910488494563679, 'bull_atr_max_pct': 0.11041402917755697, 'bull_tp_mult': 2.554896133216275, 'bull_tsl_mult': 0.941161647530917, 'bull_time_stop': 246, 'bull_use_sma': True, 'bull_use_ema': True, 'bull_use_atr': True, 'bull_use_adx': False, 'bull_use_spike': False, 'bull_rsi_required': False, 'bear_strategy': 'mean_reversion', 'bear_bb_std_mult': 1.7177406322032642, 'bear_rsi_os': 26, 'bear_rsi_ob': 74, 'bear_adx_thresh': 33.90421471589433, 'bear_atr_min_pct': 0.0033272015797124028, 'bear_atr_max_pct': 0.11926724622705566, 'bear_tp_mult': 1.7689225673846318, 'bear_tsl_mult': 0.8966114378721288, 'bear_time_stop': 27, 'bear_use_sma': True, 'bear_use_ema': False, 'bear_use_atr': True, 'bear_use_adx': True, 'bear_use_spike': True, 'bear_rsi_required': False, 'sideways_strategy': 'mean_reversion', 'sideways_bb_std_mult': 3.2645667984263578, 'sideways_rsi_os': 55, 'sideways_rsi_ob': 81, 'sideways_adx_thresh': 10.836053713235296, 'sideways_atr_min_pct': 0.02003833448611768, 'sideways_atr_max_pct': 0.07515763672534057, 'sideways_tp_mult': 1.4508635138110682, 'sideways_tsl_mult': 0.3119887964428896, 'sideways_time_stop': 132, 'sideways_use_sma': True, 'sideways_use_ema': False, 'sideways_use_atr': True, 'sideways_use_adx': True, 'sideways_use_spike': True, 'sideways_rsi_required': True}.
[I 2025-08-30 16:28:08,449] Trial 771 finished with values: [-1000000000.0, 1000000000.0] and parameters: {'p_sma': 56, 'p_std': 56, 'p_atr': 30, 'p_adx': 26, 'rsi_period': 19, 'ema1': 5, 'ema2': 14, 'slip_atr_k': 0.013733909580291331, 'slip_spread_k': 0.7052588771558903, 'spread_hl_frac': 0.007396366326753405, 'bb_std_mult': 1.6651970714210056, 'rsi_os': 45, 'rsi_ob': 86, 'vol_spike': 0.028286566754837844, 'adx_thresh': 26.785128457213247, 'atr_min_pct': 0.006606303682971703, 'atr_max_pct': 0.11424055313792529, 'tp_mult': 1.4235785731948427, 'tsl_mult': 0.20775810579668502, 'strategy': 'mean_reversion', 'time_stop': 164, 'use_sma': False, 'use_atr': True, 'use_adx': False, 'use_ema': True, 'use_spike': True, 'rsi_required': False, 'edge_k': 0.47836411605997525, 'edge_cap': 0.5606853106608167, 'bull_strategy': 'mean_reversion', 'bull_bb_std_mult': 1.5963803082933825, 'bull_rsi_os': 47, 'bull_rsi_ob': 88, 'bull_adx_thresh': 10.643619027460574, 'bull_atr_min_pct': 0.015610262073273342, 'bull_atr_max_pct': 0.09858127196200239, 'bull_tp_mult': 2.9564219702876473, 'bull_tsl_mult': 0.8661645980041518, 'bull_time_stop': 79, 'bull_use_sma': False, 'bull_use_ema': True, 'bull_use_atr': False, 'bull_use_adx': True, 'bull_use_spike': True, 'bull_rsi_required': False, 'bear_strategy': 'breakout', 'bear_bb_std_mult': 2.15471581669661, 'bear_rsi_os': 28, 'bear_rsi_ob': 77, 'bear_adx_thresh': 26.57140785143824, 'bear_atr_min_pct': 0.022323978281486544, 'bear_atr_max_pct': 0.11522227600766645, 'bear_tp_mult': 1.8957485076336709, 'bear_tsl_mult': 0.022481298762998314, 'bear_time_stop': 80, 'bear_use_sma': True, 'bear_use_ema': False, 'bear_use_atr': False, 'bear_use_adx': True, 'bear_use_spike': True, 'bear_rsi_required': True, 'sideways_strategy': 'mean_reversion', 'sideways_bb_std_mult': 3.1487071171095664, 'sideways_rsi_os': 29, 'sideways_rsi_ob': 79, 'sideways_adx_thresh': 9.332883901092822, 'sideways_atr_min_pct': 0.02099967712645005, 'sideways_atr_max_pct': 0.07127441259659054, 'sideways_tp_mult': 1.0956287673212253, 'sideways_tsl_mult': 0.19822704711178274, 'sideways_time_stop': 220, 'sideways_use_sma': True, 'sideways_use_ema': False, 'sideways_use_atr': True, 'sideways_use_adx': False, 'sideways_use_spike': True, 'sideways_rsi_required': False}.
[I 2025-08-30 16:28:10,269] Trial 768 finished with values: [-1000000000.0, 1000000000.0] and parameters: {'p_sma': 6, 'p_std': 10, 'p_atr': 12, 'p_adx': 9, 'rsi_period': 7, 'ema1': 16, 'ema2': 34, 'slip_atr_k': 0.0136026186035813, 'slip_spread_k': 0.6999057384370119, 'spread_hl_frac': 0.0071458717599666545, 'bb_std_mult': 0.6775322090494174, 'rsi_os': 29, 'rsi_ob': 84, 'vol_spike': 0.209420349493395, 'adx_thresh': 7.8993325010781605, 'atr_min_pct': 0.027228389995131923, 'atr_max_pct': 0.044467608198961915, 'tp_mult': 1.866674454203133, 'tsl_mult': 0.35533784061688606, 'strategy': 'breakout', 'time_stop': 164, 'use_sma': False, 'use_atr': False, 'use_adx': True, 'use_ema': True, 'use_spike': False, 'rsi_required': True, 'edge_k': 0.5903170347094611, 'edge_cap': 0.3467786769770822, 'bull_strategy': 'mean_reversion', 'bull_bb_std_mult': 1.817696469058236, 'bull_rsi_os': 17, 'bull_rsi_ob': 60, 'bull_adx_thresh': 9.473550996187013, 'bull_atr_min_pct': 0.005223718496912704, 'bull_atr_max_pct': 0.10913984199270603, 'bull_tp_mult': 2.480610237956548, 'bull_tsl_mult': 0.8739704656945494, 'bull_time_stop': 244, 'bull_use_sma': True, 'bull_use_ema': True, 'bull_use_atr': False, 'bull_use_adx': False, 'bull_use_spike': False, 'bull_rsi_required': False, 'bear_strategy': 'breakout', 'bear_bb_std_mult': 1.6997161936092673, 'bear_rsi_os': 29, 'bear_rsi_ob': 74, 'bear_adx_thresh': 17.27441318300633, 'bear_atr_min_pct': 0.0033729006236702325, 'bear_atr_max_pct': 0.1154429434484962, 'bear_tp_mult': 1.9195813790898015, 'bear_tsl_mult': 0.8920718278666337, 'bear_time_stop': 115, 'bear_use_sma': True, 'bear_use_ema': False, 'bear_use_atr': True, 'bear_use_adx': True, 'bear_use_spike': True, 'bear_rsi_required': True, 'sideways_strategy': 'mean_reversion', 'sideways_bb_std_mult': 3.2170386029600886, 'sideways_rsi_os': 39, 'sideways_rsi_ob': 79, 'sideways_adx_thresh': 11.709990631564061, 'sideways_atr_min_pct': 0.020092152961785147, 'sideways_atr_max_pct': 0.07169647855732808, 'sideways_tp_mult': 1.1097847844875912, 'sideways_tsl_mult': 0.6830789201793139, 'sideways_time_stop': 136, 'sideways_use_sma': True, 'sideways_use_ema': False, 'sideways_use_atr': True, 'sideways_use_adx': True, 'sideways_use_spike': True, 'sideways_rsi_required': True}.
[I 2025-08-30 16:28:11,112] Trial 770 finished with values: [-1000000000.0, 1000000000.0] and parameters: {'p_sma': 19, 'p_std': 12, 'p_atr': 12, 'p_adx': 26, 'rsi_period': 20, 'ema1': 22, 'ema2': 37, 'slip_atr_k': 0.0509120754277161, 'slip_spread_k': 0.6923785551211463, 'spread_hl_frac': 0.007509475226329894, 'bb_std_mult': 0.6915886835417049, 'rsi_os': 29, 'rsi_ob': 89, 'vol_spike': 0.20826620189039585, 'adx_thresh': 19.90229735524966, 'atr_min_pct': 0.006919959767128633, 'atr_max_pct': 0.11989635993488099, 'tp_mult': 1.8501266915405585, 'tsl_mult': 0.35573446645764534, 'strategy': 'breakout', 'time_stop': 162, 'use_sma': False, 'use_atr': False, 'use_adx': False, 'use_ema': True, 'use_spike': True, 'rsi_required': False, 'edge_k': 0.4864921791654598, 'edge_cap': 0.5599485948484657, 'bull_strategy': 'mean_reversion', 'bull_bb_std_mult': 0.7558595501378258, 'bull_rsi_os': 50, 'bull_rsi_ob': 77, 'bull_adx_thresh': 11.40370545849396, 'bull_atr_min_pct': 0.023055937575728137, 'bull_atr_max_pct': 0.05263249889201546, 'bull_tp_mult': 2.4647992866970445, 'bull_tsl_mult': 0.8727115706224254, 'bull_time_stop': 248, 'bull_use_sma': True, 'bull_use_ema': True, 'bull_use_atr': False, 'bull_use_adx': True, 'bull_use_spike': True, 'bull_rsi_required': False, 'bear_strategy': 'breakout', 'bear_bb_std_mult': 2.2042354856566755, 'bear_rsi_os': 28, 'bear_rsi_ob': 77, 'bear_adx_thresh': 26.234217577731794, 'bear_atr_min_pct': 0.013595468297452395, 'bear_atr_max_pct': 0.11413359942417728, 'bear_tp_mult': 2.780861162087406, 'bear_tsl_mult': 0.12530392665362805, 'bear_time_stop': 92, 'bear_use_sma': True, 'bear_use_ema': False, 'bear_use_atr': True, 'bear_use_adx': True, 'bear_use_spike': True, 'bear_rsi_required': True, 'sideways_strategy': 'mean_reversion', 'sideways_bb_std_mult': 1.9233169272729287, 'sideways_rsi_os': 48, 'sideways_rsi_ob': 79, 'sideways_adx_thresh': 9.515452122662257, 'sideways_atr_min_pct': 0.020820406201519003, 'sideways_atr_max_pct': 0.07081318161520055, 'sideways_tp_mult': 1.0858858830820552, 'sideways_tsl_mult': 0.6759108187977679, 'sideways_time_stop': 139, 'sideways_use_sma': True, 'sideways_use_ema': False, 'sideways_use_atr': True, 'sideways_use_adx': True, 'sideways_use_spike': True, 'sideways_rsi_required': True}.
[I 2025-08-30 16:28:11,461] Trial 769 finished with values: [-1000000000.0, 1000000000.0] and parameters: {'p_sma': 19, 'p_std': 23, 'p_atr': 12, 'p_adx': 26, 'rsi_period': 20, 'ema1': 5, 'ema2': 37, 'slip_atr_k': 0.0732206011173477, 'slip_spread_k': 0.7053100291467316, 'spread_hl_frac': 0.00721206761059422, 'bb_std_mult': 1.890957647926601, 'rsi_os': 29, 'rsi_ob': 94, 'vol_spike': 0.21038461107211753, 'adx_thresh': 20.00314253094903, 'atr_min_pct': 0.006741670780036318, 'atr_max_pct': 0.12014815464599647, 'tp_mult': 1.7086337046589133, 'tsl_mult': 0.25107898248481897, 'strategy': 'breakout', 'time_stop': 164, 'use_sma': False, 'use_atr': False, 'use_adx': False, 'use_ema': True, 'use_spike': True, 'rsi_required': False, 'edge_k': 0.759820122270869, 'edge_cap': 0.9257743652153512, 'bull_strategy': 'mean_reversion', 'bull_bb_std_mult': 0.7512046868093907, 'bull_rsi_os': 50, 'bull_rsi_ob': 88, 'bull_adx_thresh': 13.221795971377684, 'bull_atr_min_pct': 0.018059444775214678, 'bull_atr_max_pct': 0.03924731472720147, 'bull_tp_mult': 2.4793328763136024, 'bull_tsl_mult': 0.8683792761729842, 'bull_time_stop': 246, 'bull_use_sma': True, 'bull_use_ema': True, 'bull_use_atr': False, 'bull_use_adx': True, 'bull_use_spike': True, 'bull_rsi_required': False, 'bear_strategy': 'breakout', 'bear_bb_std_mult': 2.213535043302859, 'bear_rsi_os': 29, 'bear_rsi_ob': 77, 'bear_adx_thresh': 34.417180752804256, 'bear_atr_min_pct': 0.018961866684987012, 'bear_atr_max_pct': 0.11460387798506612, 'bear_tp_mult': 1.2830970012472618, 'bear_tsl_mult': 0.8051322597942863, 'bear_time_stop': 79, 'bear_use_sma': True, 'bear_use_ema': False, 'bear_use_atr': True, 'bear_use_adx': True, 'bear_use_spike': True, 'bear_rsi_required': True, 'sideways_strategy': 'mean_reversion', 'sideways_bb_std_mult': 2.8462721281914685, 'sideways_rsi_os': 19, 'sideways_rsi_ob': 79, 'sideways_adx_thresh': 6.430325202201082, 'sideways_atr_min_pct': 0.020007040311255178, 'sideways_atr_max_pct': 0.1221971488901673, 'sideways_tp_mult': 1.3874880367450702, 'sideways_tsl_mult': 0.19422710996275566, 'sideways_time_stop': 138, 'sideways_use_sma': True, 'sideways_use_ema': False, 'sideways_use_atr': True, 'sideways_use_adx': True, 'sideways_use_spike': True, 'sideways_rsi_required': True}.
[I 2025-08-30 16:28:57,992] Trial 774 finished with values: [-0.01049810834835152, 0.010443799291149351] and parameters: {'p_sma': 8, 'p_std': 20, 'p_atr': 29, 'p_adx': 25, 'rsi_period': 9, 'ema1': 26, 'ema2': 36, 'slip_atr_k': 0.03517240160378894, 'slip_spread_k': 0.7407307743626695, 'spread_hl_frac': 0.04600516978345093, 'bb_std_mult': 1.8806164499981828, 'rsi_os': 27, 'rsi_ob': 88, 'vol_spike': 0.1948245550550116, 'adx_thresh': 17.98599592079779, 'atr_min_pct': 0.004498573318432468, 'atr_max_pct': 0.08006600753902894, 'tp_mult': 1.3171863316207386, 'tsl_mult': 0.30938775723291106, 'strategy': 'breakout', 'time_stop': 149, 'use_sma': False, 'use_atr': True, 'use_adx': True, 'use_ema': False, 'use_spike': False, 'rsi_required': False, 'edge_k': 1.7640098957702812, 'edge_cap': 0.955769925423632, 'bull_strategy': 'breakout', 'bull_bb_std_mult': 1.723257559030018, 'bull_rsi_os': 48, 'bull_rsi_ob': 86, 'bull_adx_thresh': 13.184970103052283, 'bull_atr_min_pct': 0.01826053492739956, 'bull_atr_max_pct': 0.10172633123989061, 'bull_tp_mult': 2.5926409811790356, 'bull_tsl_mult': 0.20499200977308185, 'bull_time_stop': 43, 'bull_use_sma': True, 'bull_use_ema': False, 'bull_use_atr': True, 'bull_use_adx': True, 'bull_use_spike': True, 'bull_rsi_required': False, 'bear_strategy': 'mean_reversion', 'bear_bb_std_mult': 2.0045586415656116, 'bear_rsi_os': 23, 'bear_rsi_ob': 68, 'bear_adx_thresh': 15.677056729866877, 'bear_atr_min_pct': 0.011399120056218124, 'bear_atr_max_pct': 0.10625582934391839, 'bear_tp_mult': 2.626134117907528, 'bear_tsl_mult': 0.8106100478421006, 'bear_time_stop': 99, 'bear_use_sma': False, 'bear_use_ema': True, 'bear_use_atr': True, 'bear_use_adx': False, 'bear_use_spike': True, 'bear_rsi_required': True, 'sideways_strategy': 'mean_reversion', 'sideways_bb_std_mult': 2.477091462775324, 'sideways_rsi_os': 10, 'sideways_rsi_ob': 76, 'sideways_adx_thresh': 10.385653458879368, 'sideways_atr_min_pct': 0.000885989273034727, 'sideways_atr_max_pct': 0.06834762996481689, 'sideways_tp_mult': 1.3308456613514772, 'sideways_tsl_mult': 0.396989403000074, 'sideways_time_stop': 117, 'sideways_use_sma': True, 'sideways_use_ema': False, 'sideways_use_atr': False, 'sideways_use_adx': True, 'sideways_use_spike': False, 'sideways_rsi_required': True}.
[I 2025-08-30 16:28:57,983] Trial 772 finished with values: [-1000000000.0, 1000000000.0] and parameters: {'p_sma': 6, 'p_std': 20, 'p_atr': 14, 'p_adx': 26, 'rsi_period': 31, 'ema1': 26, 'ema2': 44, 'slip_atr_k': 0.05248121276321788, 'slip_spread_k': 0.7408625780734956, 'spread_hl_frac': 0.00750850087817739, 'bb_std_mult': 1.870562073689287, 'rsi_os': 28, 'rsi_ob': 88, 'vol_spike': 0.21012451079868574, 'adx_thresh': 7.8389303129820735, 'atr_min_pct': 0.0071262520545088, 'atr_max_pct': 0.10485484293289196, 'tp_mult': 1.862577212011351, 'tsl_mult': 0.3404281437524425, 'strategy': 'breakout', 'time_stop': 149, 'use_sma': False, 'use_atr': False, 'use_adx': True, 'use_ema': True, 'use_spike': False, 'rsi_required': False, 'edge_k': 0.7527057065723524, 'edge_cap': 0.93170930544117, 'bull_strategy': 'mean_reversion', 'bull_bb_std_mult': 1.2456095479947478, 'bull_rsi_os': 50, 'bull_rsi_ob': 45, 'bull_adx_thresh': 9.167689235774901, 'bull_atr_min_pct': 0.0171020174502543, 'bull_atr_max_pct': 0.10163177078300445, 'bull_tp_mult': 2.618287512745745, 'bull_tsl_mult': 0.8761793951477507, 'bull_time_stop': 42, 'bull_use_sma': True, 'bull_use_ema': True, 'bull_use_atr': False, 'bull_use_adx': True, 'bull_use_spike': True, 'bull_rsi_required': False, 'bear_strategy': 'breakout', 'bear_bb_std_mult': 2.270286562526895, 'bear_rsi_os': 51, 'bear_rsi_ob': 91, 'bear_adx_thresh': 17.107345233679162, 'bear_atr_min_pct': 0.002168679447138456, 'bear_atr_max_pct': 0.13903033798520714, 'bear_tp_mult': 2.7599275438686, 'bear_tsl_mult': 0.8065298758601652, 'bear_time_stop': 99, 'bear_use_sma': False, 'bear_use_ema': False, 'bear_use_atr': True, 'bear_use_adx': True, 'bear_use_spike': True, 'bear_rsi_required': True, 'sideways_strategy': 'mean_reversion', 'sideways_bb_std_mult': 3.1404337227297128, 'sideways_rsi_os': 10, 'sideways_rsi_ob': 45, 'sideways_adx_thresh': 25.184998369863226, 'sideways_atr_min_pct': 0.01965130803887135, 'sideways_atr_max_pct': 0.0678418047082081, 'sideways_tp_mult': 1.733824703549278, 'sideways_tsl_mult': 0.39713777410566337, 'sideways_time_stop': 186, 'sideways_use_sma': True, 'sideways_use_ema': False, 'sideways_use_atr': True, 'sideways_use_adx': True, 'sideways_use_spike': False, 'sideways_rsi_required': True}.
