[I 2025-08-30 16:37:38,362] Trial 820 finished with values: [-1000000000.0, 1000000000.0] and parameters: {'p_sma': 10, 'p_std': 51, 'p_atr': 12, 'p_adx': 25, 'rsi_period': 11, 'ema1': 25, 'ema2': 39, 'slip_atr_k': 0.06816904529501068, 'slip_spread_k': 0.7818362270044894, 'spread_hl_frac': 0.011145644559496452, 'bb_std_mult': 0.6487803323044753, 'rsi_os': 39, 'rsi_ob': 89, 'vol_spike': 0.21524585058014814, 'adx_thresh': 9.160113228526633, 'atr_min_pct': 0.021320523683164266, 'atr_max_pct': 0.1029802038396941, 'tp_mult': 1.2433258047011098, 'tsl_mult': 0.3429195860249598, 'strategy': 'breakout', 'time_stop': 12, 'use_sma': False, 'use_atr': False, 'use_adx': True, 'use_ema': True, 'use_spike': False, 'rsi_required': True, 'edge_k': 0.09764654759967695, 'edge_cap': 0.8743316477696714, 'bull_strategy': 'mean_reversion', 'bull_bb_std_mult': 1.4956467717964856, 'bull_rsi_os': 38, 'bull_rsi_ob': 89, 'bull_adx_thresh': 11.73427432993457, 'bull_atr_min_pct': 0.010678395326208106, 'bull_atr_max_pct': 0.11061544483005084, 'bull_tp_mult': 2.700777912165632, 'bull_tsl_mult': 0.9183174625147625, 'bull_time_stop': 47, 'bull_use_sma': True, 'bull_use_ema': False, 'bull_use_atr': True, 'bull_use_adx': True, 'bull_use_spike': False, 'bull_rsi_required': False, 'bear_strategy': 'breakout', 'bear_bb_std_mult': 0.5653409258208488, 'bear_rsi_os': 55, 'bear_rsi_ob': 53, 'bear_adx_thresh': 14.975955476184854, 'bear_atr_min_pct': 0.02428783159918113, 'bear_atr_max_pct': 0.06463229135326946, 'bear_tp_mult': 2.5889008601094803, 'bear_tsl_mult': 0.8229228583928522, 'bear_time_stop': 90, 'bear_use_sma': False, 'bear_use_ema': True, 'bear_use_atr': True, 'bear_use_adx': False, 'bear_use_spike': False, 'bear_rsi_required': True, 'sideways_strategy': 'mean_reversion', 'sideways_bb_std_mult': 2.9815668027080733, 'sideways_rsi_os': 26, 'sideways_rsi_ob': 65, 'sideways_adx_thresh': 9.50487713648043, 'sideways_atr_min_pct': 0.01136572732854408, 'sideways_atr_max_pct': 0.06599455530530429, 'sideways_tp_mult': 1.4390084828849794, 'sideways_tsl_mult': 0.11602560248280552, 'sideways_time_stop': 128, 'sideways_use_sma': True, 'sideways_use_ema': False, 'sideways_use_atr': False, 'sideways_use_adx': True, 'sideways_use_spike': False, 'sideways_rsi_required': True}.
[I 2025-08-30 16:37:38,626] Trial 817 finished with values: [-1000000000.0, 1000000000.0] and parameters: {'p_sma': 52, 'p_std': 20, 'p_atr': 9, 'p_adx': 25, 'rsi_period': 36, 'ema1': 20, 'ema2': 39, 'slip_atr_k': 0.17470727403320724, 'slip_spread_k': 0.7147696383903065, 'spread_hl_frac': 0.007571062655681777, 'bb_std_mult': 1.794929014711377, 'rsi_os': 42, 'rsi_ob': 57, 'vol_spike': 0.062177504417991566, 'adx_thresh': 9.35163213150844, 'atr_min_pct': 0.007278107619742501, 'atr_max_pct': 0.03472886244862207, 'tp_mult': 1.5714234323208531, 'tsl_mult': 0.9071107322544362, 'strategy': 'breakout', 'time_stop': 16, 'use_sma': False, 'use_atr': False, 'use_adx': True, 'use_ema': False, 'use_spike': False, 'rsi_required': False, 'edge_k': 0.06771117588802422, 'edge_cap': 0.7436667550422796, 'bull_strategy': 'breakout', 'bull_bb_std_mult': 2.021293418478166, 'bull_rsi_os': 14, 'bull_rsi_ob': 91, 'bull_adx_thresh': 8.374637779374783, 'bull_atr_min_pct': 0.020831876655218247, 'bull_atr_max_pct': 0.10291866101789694, 'bull_tp_mult': 2.484469021830123, 'bull_tsl_mult': 0.5357609522744283, 'bull_time_stop': 229, 'bull_use_sma': True, 'bull_use_ema': False, 'bull_use_atr': True, 'bull_use_adx': False, 'bull_use_spike': True, 'bull_rsi_required': False, 'bear_strategy': 'mean_reversion', 'bear_bb_std_mult': 1.713435186327476, 'bear_rsi_os': 26, 'bear_rsi_ob': 90, 'bear_adx_thresh': 17.06207062867339, 'bear_atr_min_pct': 0.004667621411996617, 'bear_atr_max_pct': 0.08838928566503618, 'bear_tp_mult': 2.5355196938121582, 'bear_tsl_mult': 0.8136163901715854, 'bear_time_stop': 89, 'bear_use_sma': True, 'bear_use_ema': True, 'bear_use_atr': True, 'bear_use_adx': False, 'bear_use_spike': True, 'bear_rsi_required': False, 'sideways_strategy': 'mean_reversion', 'sideways_bb_std_mult': 2.9673687150214696, 'sideways_rsi_os': 5, 'sideways_rsi_ob': 77, 'sideways_adx_thresh': 11.098243278671262, 'sideways_atr_min_pct': 0.025424251534245747, 'sideways_atr_max_pct': 0.06191203487374304, 'sideways_tp_mult': 1.2677944014340723, 'sideways_tsl_mult': 0.38090960342712776, 'sideways_time_stop': 128, 'sideways_use_sma': True, 'sideways_use_ema': False, 'sideways_use_atr': False, 'sideways_use_adx': True, 'sideways_use_spike': True, 'sideways_rsi_required': True}.
[I 2025-08-30 16:38:28,489] Trial 822 finished with values: [-1000000000.0, 1000000000.0] and parameters: {'p_sma': 6, 'p_std': 22, 'p_atr': 13, 'p_adx': 25, 'rsi_period': 11, 'ema1': 21, 'ema2': 30, 'slip_atr_k': 0.007707570175608994, 'slip_spread_k': 0.5105602482143979, 'spread_hl_frac': 0.010936540125127597, 'bb_std_mult': 1.7813745020222316, 'rsi_os': 30, 'rsi_ob': 85, 'vol_spike': 0.21600094160989058, 'adx_thresh': 9.130919602315695, 'atr_min_pct': 0.005342767706211405, 'atr_max_pct': 0.10976454680387665, 'tp_mult': 1.3333631103847596, 'tsl_mult': 0.3447453364000239, 'strategy': 'breakout', 'time_stop': 176, 'use_sma': False, 'use_atr': True, 'use_adx': True, 'use_ema': False, 'use_spike': True, 'rsi_required': True, 'edge_k': 1.2364842068650574, 'edge_cap': 0.9728001869323516, 'bull_strategy': 'breakout', 'bull_bb_std_mult': 1.6932938905659711, 'bull_rsi_os': 34, 'bull_rsi_ob': 68, 'bull_adx_thresh': 9.672876756071158, 'bull_atr_min_pct': 0.020111821193473642, 'bull_atr_max_pct': 0.10396393096968166, 'bull_tp_mult': 2.5812574405010884, 'bull_tsl_mult': 0.06179563942910754, 'bull_time_stop': 254, 'bull_use_sma': True, 'bull_use_ema': True, 'bull_use_atr': False, 'bull_use_adx': True, 'bull_use_spike': True, 'bull_rsi_required': False, 'bear_strategy': 'mean_reversion', 'bear_bb_std_mult': 1.727706567065492, 'bear_rsi_os': 13, 'bear_rsi_ob': 78, 'bear_adx_thresh': 15.148422856265757, 'bear_atr_min_pct': 0.0020666879463778973, 'bear_atr_max_pct': 0.10117280045994294, 'bear_tp_mult': 2.7138357424118436, 'bear_tsl_mult': 0.8599037563597025, 'bear_time_stop': 97, 'bear_use_sma': True, 'bear_use_ema': False, 'bear_use_atr': False, 'bear_use_adx': True, 'bear_use_spike': True, 'bear_rsi_required': True, 'sideways_strategy': 'mean_reversion', 'sideways_bb_std_mult': 2.3598335289403805, 'sideways_rsi_os': 50, 'sideways_rsi_ob': 61, 'sideways_adx_thresh': 10.991134020991604, 'sideways_atr_min_pct': 0.025733942261535254, 'sideways_atr_max_pct': 0.13262809427118305, 'sideways_tp_mult': 1.1687437965083842, 'sideways_tsl_mult': 0.5677482118967487, 'sideways_time_stop': 146, 'sideways_use_sma': True, 'sideways_use_ema': False, 'sideways_use_atr': True, 'sideways_use_adx': False, 'sideways_use_spike': True, 'sideways_rsi_required': False}.
[I 2025-08-30 16:38:29,083] Trial 823 finished with values: [-1000000000.0, 1000000000.0] and parameters: {'p_sma': 52, 'p_std': 22, 'p_atr': 13, 'p_adx': 26, 'rsi_period': 47, 'ema1': 21, 'ema2': 30, 'slip_atr_k': 0.008910211506537848, 'slip_spread_k': 0.6934710937097655, 'spread_hl_frac': 0.02611308371578674, 'bb_std_mult': 0.5972793546741024, 'rsi_os': 19, 'rsi_ob': 85, 'vol_spike': 0.18740566498537553, 'adx_thresh': 27.35144790642879, 'atr_min_pct': 0.012059395157183139, 'atr_max_pct': 0.1083007596124859, 'tp_mult': 2.227245478557202, 'tsl_mult': 0.3052980032140952, 'strategy': 'breakout', 'time_stop': 114, 'use_sma': False, 'use_atr': True, 'use_adx': True, 'use_ema': False, 'use_spike': True, 'rsi_required': False, 'edge_k': 0.6523824613725319, 'edge_cap': 0.9674468080237602, 'bull_strategy': 'breakout', 'bull_bb_std_mult': 1.8374721399789933, 'bull_rsi_os': 48, 'bull_rsi_ob': 84, 'bull_adx_thresh': 26.877177120566152, 'bull_atr_min_pct': 0.019873605549610946, 'bull_atr_max_pct': 0.10273113930765189, 'bull_tp_mult': 2.582327842278958, 'bull_tsl_mult': 0.808573154931929, 'bull_time_stop': 82, 'bull_use_sma': True, 'bull_use_ema': True, 'bull_use_atr': False, 'bull_use_adx': True, 'bull_use_spike': True, 'bull_rsi_required': False, 'bear_strategy': 'mean_reversion', 'bear_bb_std_mult': 1.6988089766495877, 'bear_rsi_os': 11, 'bear_rsi_ob': 78, 'bear_adx_thresh': 12.789294441269513, 'bear_atr_min_pct': 0.001746341565742478, 'bear_atr_max_pct': 0.0870521606120221, 'bear_tp_mult': 2.7229670811302285, 'bear_tsl_mult': 0.8540465299911434, 'bear_time_stop': 96, 'bear_use_sma': True, 'bear_use_ema': False, 'bear_use_atr': False, 'bear_use_adx': True, 'bear_use_spike': True, 'bear_rsi_required': True, 'sideways_strategy': 'mean_reversion', 'sideways_bb_std_mult': 3.0723501222222085, 'sideways_rsi_os': 23, 'sideways_rsi_ob': 80, 'sideways_adx_thresh': 10.98188948727298, 'sideways_atr_min_pct': 0.020070988792186363, 'sideways_atr_max_pct': 0.06981204601639572, 'sideways_tp_mult': 2.8903769784089524, 'sideways_tsl_mult': 0.3484708251927609, 'sideways_time_stop': 192, 'sideways_use_sma': True, 'sideways_use_ema': False, 'sideways_use_atr': True, 'sideways_use_adx': False, 'sideways_use_spike': True, 'sideways_rsi_required': False}.
[I 2025-08-30 16:38:29,215] Trial 821 finished with values: [-1000000000.0, 1000000000.0] and parameters: {'p_sma': 51, 'p_std': 19, 'p_atr': 12, 'p_adx': 25, 'rsi_period': 58, 'ema1': 29, 'ema2': 39, 'slip_atr_k': 0.06738989631690435, 'slip_spread_k': 0.5165727965988725, 'spread_hl_frac': 0.03599782260708621, 'bb_std_mult': 1.697231044866059, 'rsi_os': 42, 'rsi_ob': 88, 'vol_spike': 0.06401460087769227, 'adx_thresh': 31.883673572711878, 'atr_min_pct': 0.01805585258876209, 'atr_max_pct': 0.10833987402755252, 'tp_mult': 1.6941350420820522, 'tsl_mult': 0.39239879749261913, 'strategy': 'breakout', 'time_stop': 215, 'use_sma': False, 'use_atr': True, 'use_adx': True, 'use_ema': False, 'use_spike': True, 'rsi_required': False, 'edge_k': 1.0163496021134777, 'edge_cap': 0.914354362201588, 'bull_strategy': 'breakout', 'bull_bb_std_mult': 1.9612567534661312, 'bull_rsi_os': 38, 'bull_rsi_ob': 90, 'bull_adx_thresh': 11.696706405922786, 'bull_atr_min_pct': 0.019131416878810308, 'bull_atr_max_pct': 0.10416917831810181, 'bull_tp_mult': 2.7012263893005115, 'bull_tsl_mult': 0.404511948106506, 'bull_time_stop': 70, 'bull_use_sma': True, 'bull_use_ema': True, 'bull_use_atr': True, 'bull_use_adx': True, 'bull_use_spike': True, 'bull_rsi_required': False, 'bear_strategy': 'mean_reversion', 'bear_bb_std_mult': 2.0880791626682584, 'bear_rsi_os': 16, 'bear_rsi_ob': 69, 'bear_adx_thresh': 15.259254782332347, 'bear_atr_min_pct': 0.0024095415571582755, 'bear_atr_max_pct': 0.09196196132674951, 'bear_tp_mult': 2.6385471935425047, 'bear_tsl_mult': 0.522249841173531, 'bear_time_stop': 23, 'bear_use_sma': True, 'bear_use_ema': False, 'bear_use_atr': False, 'bear_use_adx': True, 'bear_use_spike': True, 'bear_rsi_required': True, 'sideways_strategy': 'mean_reversion', 'sideways_bb_std_mult': 2.947596954232096, 'sideways_rsi_os': 13, 'sideways_rsi_ob': 61, 'sideways_adx_thresh': 8.415865269476843, 'sideways_atr_min_pct': 0.02585230724535379, 'sideways_atr_max_pct': 0.11919637431811572, 'sideways_tp_mult': 1.851226611365444, 'sideways_tsl_mult': 0.30672496939615607, 'sideways_time_stop': 190, 'sideways_use_sma': True, 'sideways_use_ema': False, 'sideways_use_atr': True, 'sideways_use_adx': False, 'sideways_use_spike': True, 'sideways_rsi_required': False}.
[I 2025-08-30 16:38:29,218] Trial 824 finished with values: [-1000000000.0, 1000000000.0] and parameters: {'p_sma': 55, 'p_std': 22, 'p_atr': 13, 'p_adx': 18, 'rsi_period': 47, 'ema1': 21, 'ema2': 40, 'slip_atr_k': 0.008229826756473222, 'slip_spread_k': 0.6892595517998997, 'spread_hl_frac': 0.03614054546824738, 'bb_std_mult': 0.6039972573940424, 'rsi_os': 30, 'rsi_ob': 85, 'vol_spike': 0.19558218922009166, 'adx_thresh': 6.287887315839448, 'atr_min_pct': 0.018210587879654558, 'atr_max_pct': 0.11001550002387864, 'tp_mult': 1.364247974857083, 'tsl_mult': 0.9807884562915704, 'strategy': 'breakout', 'time_stop': 171, 'use_sma': False, 'use_atr': True, 'use_adx': False, 'use_ema': False, 'use_spike': True, 'rsi_required': False, 'edge_k': 1.6020913444839766, 'edge_cap': 0.29307362562368455, 'bull_strategy': 'breakout', 'bull_bb_std_mult': 1.9038752467504436, 'bull_rsi_os': 49, 'bull_rsi_ob': 67, 'bull_adx_thresh': 9.432786494723159, 'bull_atr_min_pct': 0.019868178057441465, 'bull_atr_max_pct': 0.023791215659216068, 'bull_tp_mult': 2.185819182559624, 'bull_tsl_mult': 0.2682506870215413, 'bull_time_stop': 25, 'bull_use_sma': True, 'bull_use_ema': True, 'bull_use_atr': False, 'bull_use_adx': True, 'bull_use_spike': True, 'bull_rsi_required': False, 'bear_strategy': 'mean_reversion', 'bear_bb_std_mult': 2.082304355413286, 'bear_rsi_os': 20, 'bear_rsi_ob': 69, 'bear_adx_thresh': 12.651143807574888, 'bear_atr_min_pct': 0.0020202560825875017, 'bear_atr_max_pct': 0.07900297703346396, 'bear_tp_mult': 1.7165421557207405, 'bear_tsl_mult': 0.9299771584110103, 'bear_time_stop': 96, 'bear_use_sma': True, 'bear_use_ema': False, 'bear_use_atr': False, 'bear_use_adx': True, 'bear_use_spike': True, 'bear_rsi_required': True, 'sideways_strategy': 'mean_reversion', 'sideways_bb_std_mult': 0.6377821338368106, 'sideways_rsi_os': 40, 'sideways_rsi_ob': 80, 'sideways_adx_thresh': 12.461619231397655, 'sideways_atr_min_pct': 0.02189822329126637, 'sideways_atr_max_pct': 0.11806290734704297, 'sideways_tp_mult': 1.6874103423353697, 'sideways_tsl_mult': 0.35179266132825404, 'sideways_time_stop': 189, 'sideways_use_sma': False, 'sideways_use_ema': False, 'sideways_use_atr': True, 'sideways_use_adx': False, 'sideways_use_spike': True, 'sideways_rsi_required': False}.
[I 2025-08-30 16:39:16,808] Trial 825 finished with values: [-1000000000.0, 1000000000.0] and parameters: {'p_sma': 8, 'p_std': 22, 'p_atr': 11, 'p_adx': 26, 'rsi_period': 10, 'ema1': 23, 'ema2': 37, 'slip_atr_k': 0.09697879207083557, 'slip_spread_k': 0.688290429301959, 'spread_hl_frac': 0.03641361413299231, 'bb_std_mult': 0.587047119963915, 'rsi_os': 27, 'rsi_ob': 77, 'vol_spike': 0.18781082302882013, 'adx_thresh': 7.983785233245454, 'atr_min_pct': 0.026607320193351613, 'atr_max_pct': 0.029329730507690534, 'tp_mult': 1.538653535135068, 'tsl_mult': 0.24171352952694397, 'strategy': 'breakout', 'time_stop': 170, 'use_sma': False, 'use_atr': True, 'use_adx': False, 'use_ema': False, 'use_spike': True, 'rsi_required': False, 'edge_k': 1.9998313832033752, 'edge_cap': 0.2520596907332605, 'bull_strategy': 'breakout', 'bull_bb_std_mult': 1.9586083228233098, 'bull_rsi_os': 20, 'bull_rsi_ob': 85, 'bull_adx_thresh': 7.423445498247945, 'bull_atr_min_pct': 0.019068267691542302, 'bull_atr_max_pct': 0.09964613853057193, 'bull_tp_mult': 2.1818813239767607, 'bull_tsl_mult': 0.8873414334630053, 'bull_time_stop': 80, 'bull_use_sma': True, 'bull_use_ema': True, 'bull_use_atr': True, 'bull_use_adx': True, 'bull_use_spike': True, 'bull_rsi_required': False, 'bear_strategy': 'mean_reversion', 'bear_bb_std_mult': 2.069169033908787, 'bear_rsi_os': 24, 'bear_rsi_ob': 69, 'bear_adx_thresh': 12.758898106281595, 'bear_atr_min_pct': 0.005591004395784791, 'bear_atr_max_pct': 0.1252833766050196, 'bear_tp_mult': 2.026341794824455, 'bear_tsl_mult': 0.5222527398096316, 'bear_time_stop': 37, 'bear_use_sma': True, 'bear_use_ema': False, 'bear_use_atr': False, 'bear_use_adx': True, 'bear_use_spike': True, 'bear_rsi_required': True, 'sideways_strategy': 'mean_reversion', 'sideways_bb_std_mult': 3.0871443740600695, 'sideways_rsi_os': 20, 'sideways_rsi_ob': 92, 'sideways_adx_thresh': 12.165912262124774, 'sideways_atr_min_pct': 0.01989755669715947, 'sideways_atr_max_pct': 0.07075096176408047, 'sideways_tp_mult': 1.8620657651651704, 'sideways_tsl_mult': 0.5244071075113819, 'sideways_time_stop': 120, 'sideways_use_sma': False, 'sideways_use_ema': False, 'sideways_use_atr': True, 'sideways_use_adx': False, 'sideways_use_spike': True, 'sideways_rsi_required': False}.
[I 2025-08-30 16:39:17,235] Trial 828 finished with values: [-1000000000.0, 1000000000.0] and parameters: {'p_sma': 8, 'p_std': 42, 'p_atr': 26, 'p_adx': 19, 'rsi_period': 42, 'ema1': 23, 'ema2': 60, 'slip_atr_k': 0.013782579675080993, 'slip_spread_k': 0.7264451430101422, 'spread_hl_frac': 0.04544439180807135, 'bb_std_mult': 0.7138911611838425, 'rsi_os': 24, 'rsi_ob': 51, 'vol_spike': 0.22759034947258447, 'adx_thresh': 29.976653407216315, 'atr_min_pct': 0.008700290508929787, 'atr_max_pct': 0.12054804494522856, 'tp_mult': 2.795787679945061, 'tsl_mult': 0.6920051366758373, 'strategy': 'breakout', 'time_stop': 147, 'use_sma': False, 'use_atr': False, 'use_adx': False, 'use_ema': False, 'use_spike': False, 'rsi_required': False, 'edge_k': 1.4165933895963445, 'edge_cap': 0.2417093261161939, 'bull_strategy': 'breakout', 'bull_bb_std_mult': 1.5910777126890714, 'bull_rsi_os': 51, 'bull_rsi_ob': 93, 'bull_adx_thresh': 10.972377564177405, 'bull_atr_min_pct': 0.016357930198917923, 'bull_atr_max_pct': 0.10074092125455841, 'bull_tp_mult': 2.6099697487852755, 'bull_tsl_mult': 0.4950267792028834, 'bull_time_stop': 61, 'bull_use_sma': True, 'bull_use_ema': True, 'bull_use_atr': True, 'bull_use_adx': True, 'bull_use_spike': True, 'bull_rsi_required': True, 'bear_strategy': 'mean_reversion', 'bear_bb_std_mult': 0.7173037899728134, 'bear_rsi_os': 24, 'bear_rsi_ob': 60, 'bear_adx_thresh': 14.114546404119872, 'bear_atr_min_pct': 0.0029998045444349173, 'bear_atr_max_pct': 0.04360001593230654, 'bear_tp_mult': 2.0210199834116045, 'bear_tsl_mult': 0.7900647450992422, 'bear_time_stop': 50, 'bear_use_sma': True, 'bear_use_ema': False, 'bear_use_atr': True, 'bear_use_adx': True, 'bear_use_spike': True, 'bear_rsi_required': True, 'sideways_strategy': 'breakout', 'sideways_bb_std_mult': 2.065109327358701, 'sideways_rsi_os': 19, 'sideways_rsi_ob': 81, 'sideways_adx_thresh': 11.926031734387376, 'sideways_atr_min_pct': 0.019337882365034254, 'sideways_atr_max_pct': 0.08033613878783417, 'sideways_tp_mult': 1.5106919161141035, 'sideways_tsl_mult': 0.40925027378828777, 'sideways_time_stop': 121, 'sideways_use_sma': False, 'sideways_use_ema': False, 'sideways_use_atr': True, 'sideways_use_adx': True, 'sideways_use_spike': True, 'sideways_rsi_required': True}.
[I 2025-08-30 16:39:17,816] Trial 826 finished with values: [-1000000000.0, 1000000000.0] and parameters: {'p_sma': 8, 'p_std': 30, 'p_atr': 14, 'p_adx': 19, 'rsi_period': 29, 'ema1': 23, 'ema2': 10, 'slip_atr_k': 0.003888607009407394, 'slip_spread_k': 0.6850511909152286, 'spread_hl_frac': 0.01353908257547128, 'bb_std_mult': 0.7128081140833038, 'rsi_os': 24, 'rsi_ob': 87, 'vol_spike': 0.2895134630557218, 'adx_thresh': 7.054751867134673, 'atr_min_pct': 0.0036980144028806988, 'atr_max_pct': 0.11822216244783541, 'tp_mult': 2.8134929131722686, 'tsl_mult': 0.7048539938606557, 'strategy': 'breakout', 'time_stop': 124, 'use_sma': False, 'use_atr': False, 'use_adx': False, 'use_ema': False, 'use_spike': False, 'rsi_required': False, 'edge_k': 0.591954035663535, 'edge_cap': 0.6678782388617103, 'bull_strategy': 'breakout', 'bull_bb_std_mult': 1.5701170618266072, 'bull_rsi_os': 49, 'bull_rsi_ob': 93, 'bull_adx_thresh': 10.833291960310724, 'bull_atr_min_pct': 0.02149506963301931, 'bull_atr_max_pct': 0.11802207618310533, 'bull_tp_mult': 2.7656428428371704, 'bull_tsl_mult': 0.2979420076498206, 'bull_time_stop': 195, 'bull_use_sma': True, 'bull_use_ema': True, 'bull_use_atr': True, 'bull_use_adx': True, 'bull_use_spike': True, 'bull_rsi_required': True, 'bear_strategy': 'mean_reversion', 'bear_bb_std_mult': 2.17099236539273, 'bear_rsi_os': 24, 'bear_rsi_ob': 75, 'bear_adx_thresh': 14.077733860073566, 'bear_atr_min_pct': 0.019381422760253147, 'bear_atr_max_pct': 0.10433546902258874, 'bear_tp_mult': 2.0302783506475452, 'bear_tsl_mult': 0.14552280524716005, 'bear_time_stop': 97, 'bear_use_sma': True, 'bear_use_ema': False, 'bear_use_atr': True, 'bear_use_adx': True, 'bear_use_spike': True, 'bear_rsi_required': True, 'sideways_strategy': 'breakout', 'sideways_bb_std_mult': 2.6575876996350623, 'sideways_rsi_os': 40, 'sideways_rsi_ob': 81, 'sideways_adx_thresh': 12.508327903102874, 'sideways_atr_min_pct': 0.021828863131407368, 'sideways_atr_max_pct': 0.07629527420695523, 'sideways_tp_mult': 1.4874347054014754, 'sideways_tsl_mult': 0.4122927122880683, 'sideways_time_stop': 122, 'sideways_use_sma': False, 'sideways_use_ema': False, 'sideways_use_atr': True, 'sideways_use_adx': True, 'sideways_use_spike': True, 'sideways_rsi_required': True}.
