[I 2025-08-30 16:46:53,233] Trial 865 finished with values: [-1000000000.0, 1000000000.0] and parameters: {'p_sma': 8, 'p_std': 19, 'p_atr': 9, 'p_adx': 24, 'rsi_period': 10, 'ema1': 23, 'ema2': 38, 'slip_atr_k': 0.012837655577568415, 'slip_spread_k': 0.7025823713770991, 'spread_hl_frac': 0.007421413910370857, 'bb_std_mult': 0.7345670562871125, 'rsi_os': 41, 'rsi_ob': 88, 'vol_spike': 0.2381603682324585, 'adx_thresh': 25.98533422292261, 'atr_min_pct': 0.02618709669725759, 'atr_max_pct': 0.11862996809849048, 'tp_mult': 1.6551349168647236, 'tsl_mult': 0.0007024090099909674, 'strategy': 'breakout', 'time_stop': 35, 'use_sma': True, 'use_atr': False, 'use_adx': False, 'use_ema': False, 'use_spike': False, 'rsi_required': True, 'edge_k': 1.3728700889061967, 'edge_cap': 0.9999437611245788, 'bull_strategy': 'breakout', 'bull_bb_std_mult': 2.3701081318569206, 'bull_rsi_os': 33, 'bull_rsi_ob': 91, 'bull_adx_thresh': 8.98160599522749, 'bull_atr_min_pct': 0.02853093747505924, 'bull_atr_max_pct': 0.13808461991691698, 'bull_tp_mult': 2.518292325555578, 'bull_tsl_mult': 0.8406262129553292, 'bull_time_stop': 5, 'bull_use_sma': False, 'bull_use_ema': True, 'bull_use_atr': True, 'bull_use_adx': True, 'bull_use_spike': True, 'bull_rsi_required': True, 'bear_strategy': 'mean_reversion', 'bear_bb_std_mult': 1.72651798357749, 'bear_rsi_os': 52, 'bear_rsi_ob': 76, 'bear_adx_thresh': 16.09669635597739, 'bear_atr_min_pct': 0.02371311863526007, 'bear_atr_max_pct': 0.10846267247180515, 'bear_tp_mult': 2.633782575627155, 'bear_tsl_mult': 0.8539132267820898, 'bear_time_stop': 111, 'bear_use_sma': True, 'bear_use_ema': False, 'bear_use_atr': True, 'bear_use_adx': True, 'bear_use_spike': True, 'bear_rsi_required': False, 'sideways_strategy': 'breakout', 'sideways_bb_std_mult': 3.295973964224046, 'sideways_rsi_os': 53, 'sideways_rsi_ob': 70, 'sideways_adx_thresh': 10.400930658408583, 'sideways_atr_min_pct': 0.012671063441384372, 'sideways_atr_max_pct': 0.10507584119685039, 'sideways_tp_mult': 1.5624960993996013, 'sideways_tsl_mult': 0.49865411382067226, 'sideways_time_stop': 133, 'sideways_use_sma': False, 'sideways_use_ema': False, 'sideways_use_atr': True, 'sideways_use_adx': True, 'sideways_use_spike': True, 'sideways_rsi_required': False}.
[I 2025-08-30 16:46:53,971] Trial 864 finished with values: [-1000000000.0, 1000000000.0] and parameters: {'p_sma': 8, 'p_std': 53, 'p_atr': 13, 'p_adx': 24, 'rsi_period': 71, 'ema1': 23, 'ema2': 38, 'slip_atr_k': 0.04130899521290697, 'slip_spread_k': 0.16380868364200518, 'spread_hl_frac': 0.03096810800090415, 'bb_std_mult': 0.7196458266314794, 'rsi_os': 40, 'rsi_ob': 69, 'vol_spike': 0.21906683366007146, 'adx_thresh': 26.71963965566516, 'atr_min_pct': 0.028119835655048296, 'atr_max_pct': 0.11938532649327134, 'tp_mult': 1.0600150050895918, 'tsl_mult': 0.9587671430806073, 'strategy': 'breakout', 'time_stop': 155, 'use_sma': True, 'use_atr': False, 'use_adx': False, 'use_ema': False, 'use_spike': False, 'rsi_required': True, 'edge_k': 1.7969687863162274, 'edge_cap': 0.9737742754851576, 'bull_strategy': 'breakout', 'bull_bb_std_mult': 1.6023863175680486, 'bull_rsi_os': 51, 'bull_rsi_ob': 91, 'bull_adx_thresh': 8.528808247191147, 'bull_atr_min_pct': 0.019869300236393952, 'bull_atr_max_pct': 0.1052222605728729, 'bull_tp_mult': 1.9048851542273657, 'bull_tsl_mult': 0.8518256473373725, 'bull_time_stop': 45, 'bull_use_sma': False, 'bull_use_ema': True, 'bull_use_atr': True, 'bull_use_adx': True, 'bull_use_spike': True, 'bull_rsi_required': True, 'bear_strategy': 'mean_reversion', 'bear_bb_std_mult': 1.4330365552953113, 'bear_rsi_os': 25, 'bear_rsi_ob': 76, 'bear_adx_thresh': 16.48776006880806, 'bear_atr_min_pct': 0.002019552704974855, 'bear_atr_max_pct': 0.11997177293542072, 'bear_tp_mult': 1.0108197929786553, 'bear_tsl_mult': 0.24370030562293588, 'bear_time_stop': 112, 'bear_use_sma': True, 'bear_use_ema': False, 'bear_use_atr': True, 'bear_use_adx': True, 'bear_use_spike': True, 'bear_rsi_required': False, 'sideways_strategy': 'breakout', 'sideways_bb_std_mult': 3.29564623780216, 'sideways_rsi_os': 46, 'sideways_rsi_ob': 73, 'sideways_adx_thresh': 33.899660423449, 'sideways_atr_min_pct': 0.019705437403110582, 'sideways_atr_max_pct': 0.01745998305715793, 'sideways_tp_mult': 1.3960264786643495, 'sideways_tsl_mult': 0.3246004437094138, 'sideways_time_stop': 134, 'sideways_use_sma': False, 'sideways_use_ema': False, 'sideways_use_atr': True, 'sideways_use_adx': True, 'sideways_use_spike': True, 'sideways_rsi_required': False}.
[I 2025-08-30 16:46:53,985] Trial 867 finished with values: [-1000000000.0, 1000000000.0] and parameters: {'p_sma': 8, 'p_std': 20, 'p_atr': 23, 'p_adx': 26, 'rsi_period': 71, 'ema1': 17, 'ema2': 36, 'slip_atr_k': 0.013361145738294574, 'slip_spread_k': 0.7039657060229941, 'spread_hl_frac': 0.005541364939233669, 'bb_std_mult': 0.7088071741160982, 'rsi_os': 29, 'rsi_ob': 67, 'vol_spike': 0.2192759608549146, 'adx_thresh': 16.222528062486756, 'atr_min_pct': 0.007646891917464644, 'atr_max_pct': 0.14743490229767856, 'tp_mult': 1.2976780170285962, 'tsl_mult': 0.33714761017669603, 'strategy': 'breakout', 'time_stop': 229, 'use_sma': True, 'use_atr': False, 'use_adx': False, 'use_ema': False, 'use_spike': False, 'rsi_required': True, 'edge_k': 0.5433930153268575, 'edge_cap': 0.9865914119416301, 'bull_strategy': 'breakout', 'bull_bb_std_mult': 1.587237017463048, 'bull_rsi_os': 48, 'bull_rsi_ob': 66, 'bull_adx_thresh': 8.87834499502529, 'bull_atr_min_pct': 0.02920512770797365, 'bull_atr_max_pct': 0.07108708944078992, 'bull_tp_mult': 2.837488942972934, 'bull_tsl_mult': 0.5128205817052272, 'bull_time_stop': 45, 'bull_use_sma': False, 'bull_use_ema': True, 'bull_use_atr': True, 'bull_use_adx': False, 'bull_use_spike': True, 'bull_rsi_required': True, 'bear_strategy': 'mean_reversion', 'bear_bb_std_mult': 2.182480081842768, 'bear_rsi_os': 47, 'bear_rsi_ob': 78, 'bear_adx_thresh': 16.625253129912384, 'bear_atr_min_pct': 0.004969082104204647, 'bear_atr_max_pct': 0.08084293916187173, 'bear_tp_mult': 2.637452085406637, 'bear_tsl_mult': 0.2506473280977443, 'bear_time_stop': 99, 'bear_use_sma': True, 'bear_use_ema': False, 'bear_use_atr': True, 'bear_use_adx': True, 'bear_use_spike': True, 'bear_rsi_required': False, 'sideways_strategy': 'breakout', 'sideways_bb_std_mult': 0.8902836231028459, 'sideways_rsi_os': 16, 'sideways_rsi_ob': 77, 'sideways_adx_thresh': 14.914354637634506, 'sideways_atr_min_pct': 0.012659743904940148, 'sideways_atr_max_pct': 0.017492180818160882, 'sideways_tp_mult': 1.4180226790851929, 'sideways_tsl_mult': 0.39275114935996613, 'sideways_time_stop': 120, 'sideways_use_sma': False, 'sideways_use_ema': False, 'sideways_use_atr': True, 'sideways_use_adx': True, 'sideways_use_spike': True, 'sideways_rsi_required': True}.
[I 2025-08-30 16:46:54,239] Trial 866 finished with values: [-1000000000.0, 1000000000.0] and parameters: {'p_sma': 8, 'p_std': 48, 'p_atr': 13, 'p_adx': 26, 'rsi_period': 10, 'ema1': 29, 'ema2': 21, 'slip_atr_k': 0.18402202885703373, 'slip_spread_k': 0.7016220179572131, 'spread_hl_frac': 0.03098824232136191, 'bb_std_mult': 2.0886009296476344, 'rsi_os': 29, 'rsi_ob': 87, 'vol_spike': 0.2406121738770594, 'adx_thresh': 26.27138325420635, 'atr_min_pct': 0.028738497220730512, 'atr_max_pct': 0.0509296580290442, 'tp_mult': 2.0410291018657234, 'tsl_mult': 0.3396635437536669, 'strategy': 'breakout', 'time_stop': 148, 'use_sma': True, 'use_atr': False, 'use_adx': True, 'use_ema': False, 'use_spike': False, 'rsi_required': True, 'edge_k': 1.3643403007222656, 'edge_cap': 0.9844692920665659, 'bull_strategy': 'breakout', 'bull_bb_std_mult': 2.3811228023730657, 'bull_rsi_os': 51, 'bull_rsi_ob': 86, 'bull_adx_thresh': 8.73085930650478, 'bull_atr_min_pct': 0.02861200461176063, 'bull_atr_max_pct': 0.07191362462658607, 'bull_tp_mult': 1.47756240887737, 'bull_tsl_mult': 0.8917750283075898, 'bull_time_stop': 44, 'bull_use_sma': False, 'bull_use_ema': True, 'bull_use_atr': True, 'bull_use_adx': True, 'bull_use_spike': True, 'bull_rsi_required': True, 'bear_strategy': 'mean_reversion', 'bear_bb_std_mult': 1.4298731375591485, 'bear_rsi_os': 25, 'bear_rsi_ob': 76, 'bear_adx_thresh': 16.608525386453213, 'bear_atr_min_pct': 0.005044551008461524, 'bear_atr_max_pct': 0.10852225997518228, 'bear_tp_mult': 1.7451311374260985, 'bear_tsl_mult': 0.7626821623181622, 'bear_time_stop': 153, 'bear_use_sma': True, 'bear_use_ema': False, 'bear_use_atr': True, 'bear_use_adx': True, 'bear_use_spike': True, 'bear_rsi_required': False, 'sideways_strategy': 'breakout', 'sideways_bb_std_mult': 3.22271063596909, 'sideways_rsi_os': 30, 'sideways_rsi_ob': 77, 'sideways_adx_thresh': 6.370928058116732, 'sideways_atr_min_pct': 0.019687054662657726, 'sideways_atr_max_pct': 0.07336145342491183, 'sideways_tp_mult': 2.6343684578385016, 'sideways_tsl_mult': 0.4030630964186951, 'sideways_time_stop': 127, 'sideways_use_sma': False, 'sideways_use_ema': True, 'sideways_use_atr': True, 'sideways_use_adx': True, 'sideways_use_spike': True, 'sideways_rsi_required': False}.
[I 2025-08-30 16:47:40,851] Trial 871 finished with values: [-1000000000.0, 1000000000.0] and parameters: {'p_sma': 6, 'p_std': 24, 'p_atr': 23, 'p_adx': 13, 'rsi_period': 68, 'ema1': 16, 'ema2': 17, 'slip_atr_k': 0.006714338476623169, 'slip_spread_k': 0.7356021956832854, 'spread_hl_frac': 0.049432681052426444, 'bb_std_mult': 0.6277114658404799, 'rsi_os': 25, 'rsi_ob': 89, 'vol_spike': 0.1566908250740837, 'adx_thresh': 8.616551600445826, 'atr_min_pct': 0.02460440304480893, 'atr_max_pct': 0.14233239436718204, 'tp_mult': 1.4710655840266422, 'tsl_mult': 0.43816896148658724, 'strategy': 'mean_reversion', 'time_stop': 200, 'use_sma': False, 'use_atr': True, 'use_adx': True, 'use_ema': True, 'use_spike': True, 'rsi_required': False, 'edge_k': 0.6643332414587833, 'edge_cap': 0.862273842743976, 'bull_strategy': 'mean_reversion', 'bull_bb_std_mult': 1.532958660749598, 'bull_rsi_os': 39, 'bull_rsi_ob': 80, 'bull_adx_thresh': 12.223110257099119, 'bull_atr_min_pct': 0.010009081225919318, 'bull_atr_max_pct': 0.09276926812477257, 'bull_tp_mult': 2.642999435310771, 'bull_tsl_mult': 0.9326833969587452, 'bull_time_stop': 73, 'bull_use_sma': True, 'bull_use_ema': True, 'bull_use_atr': True, 'bull_use_adx': False, 'bull_use_spike': False, 'bull_rsi_required': False, 'bear_strategy': 'breakout', 'bear_bb_std_mult': 2.3838213677015148, 'bear_rsi_os': 22, 'bear_rsi_ob': 74, 'bear_adx_thresh': 14.866779348967217, 'bear_atr_min_pct': 0.02514092965693243, 'bear_atr_max_pct': 0.06082786894097209, 'bear_tp_mult': 2.690080031557058, 'bear_tsl_mult': 0.6944801240958621, 'bear_time_stop': 102, 'bear_use_sma': False, 'bear_use_ema': False, 'bear_use_atr': False, 'bear_use_adx': True, 'bear_use_spike': False, 'bear_rsi_required': True, 'sideways_strategy': 'mean_reversion', 'sideways_bb_std_mult': 2.9981288599745524, 'sideways_rsi_os': 20, 'sideways_rsi_ob': 60, 'sideways_adx_thresh': 10.972251240373307, 'sideways_atr_min_pct': 0.02084753771556174, 'sideways_atr_max_pct': 0.06797001253717137, 'sideways_tp_mult': 1.7822806470652266, 'sideways_tsl_mult': 0.3946792094684249, 'sideways_time_stop': 245, 'sideways_use_sma': True, 'sideways_use_ema': False, 'sideways_use_atr': True, 'sideways_use_adx': False, 'sideways_use_spike': False, 'sideways_rsi_required': True}.
[I 2025-08-30 16:47:41,385] Trial 868 finished with values: [-1000000000.0, 1000000000.0] and parameters: {'p_sma': 8, 'p_std': 16, 'p_atr': 23, 'p_adx': 26, 'rsi_period': 10, 'ema1': 24, 'ema2': 36, 'slip_atr_k': 0.03989762212964405, 'slip_spread_k': 0.1048468408891412, 'spread_hl_frac': 0.005470222352816315, 'bb_std_mult': 0.6977212225910082, 'rsi_os': 25, 'rsi_ob': 87, 'vol_spike': 0.2190709909174905, 'adx_thresh': 9.2905115466359, 'atr_min_pct': 0.0049219384808498, 'atr_max_pct': 0.10730635593149969, 'tp_mult': 1.472845979990296, 'tsl_mult': 0.3387202983760403, 'strategy': 'mean_reversion', 'time_stop': 175, 'use_sma': True, 'use_atr': False, 'use_adx': True, 'use_ema': False, 'use_spike': False, 'rsi_required': False, 'edge_k': 0.5365992793941473, 'edge_cap': 0.981661540626387, 'bull_strategy': 'breakout', 'bull_bb_std_mult': 1.6337389971419602, 'bull_rsi_os': 48, 'bull_rsi_ob': 59, 'bull_adx_thresh': 8.97196487950132, 'bull_atr_min_pct': 0.0036689202858119184, 'bull_atr_max_pct': 0.06077935441895763, 'bull_tp_mult': 2.8428456094223558, 'bull_tsl_mult': 0.9286599275775627, 'bull_time_stop': 47, 'bull_use_sma': False, 'bull_use_ema': True, 'bull_use_atr': True, 'bull_use_adx': False, 'bull_use_spike': True, 'bull_rsi_required': True, 'bear_strategy': 'mean_reversion', 'bear_bb_std_mult': 2.38557422215824, 'bear_rsi_os': 25, 'bear_rsi_ob': 78, 'bear_adx_thresh': 16.65609506693025, 'bear_atr_min_pct': 0.0032291419199775174, 'bear_atr_max_pct': 0.11446902638411786, 'bear_tp_mult': 2.683128357323132, 'bear_tsl_mult': 0.7682750329956167, 'bear_time_stop': 99, 'bear_use_sma': False, 'bear_use_ema': False, 'bear_use_atr': True, 'bear_use_adx': True, 'bear_use_spike': True, 'bear_rsi_required': True, 'sideways_strategy': 'breakout', 'sideways_bb_std_mult': 3.1956702054246864, 'sideways_rsi_os': 16, 'sideways_rsi_ob': 81, 'sideways_adx_thresh': 11.022313860879267, 'sideways_atr_min_pct': 0.007313543074050347, 'sideways_atr_max_pct': 0.07415092552122846, 'sideways_tp_mult': 1.429054873877853, 'sideways_tsl_mult': 0.0558611111808312, 'sideways_time_stop': 118, 'sideways_use_sma': True, 'sideways_use_ema': False, 'sideways_use_atr': True, 'sideways_use_adx': True, 'sideways_use_spike': True, 'sideways_rsi_required': True}.
[I 2025-08-30 16:47:42,209] Trial 869 finished with values: [-1000000000.0, 1000000000.0] and parameters: {'p_sma': 6, 'p_std': 24, 'p_atr': 13, 'p_adx': 13, 'rsi_period': 10, 'ema1': 24, 'ema2': 16, 'slip_atr_k': 0.005074610032627829, 'slip_spread_k': 0.7946121819965567, 'spread_hl_frac': 0.006204723195117881, 'bb_std_mult': 0.6305134005640425, 'rsi_os': 25, 'rsi_ob': 87, 'vol_spike': 0.15338525187108912, 'adx_thresh': 5.047145813105557, 'atr_min_pct': 0.004982341293937632, 'atr_max_pct': 0.10781028363943955, 'tp_mult': 1.4761754384863564, 'tsl_mult': 0.34712509768569766, 'strategy': 'mean_reversion', 'time_stop': 177, 'use_sma': False, 'use_atr': False, 'use_adx': True, 'use_ema': True, 'use_spike': False, 'rsi_required': False, 'edge_k': 1.6202466290386186, 'edge_cap': 0.9352778417694262, 'bull_strategy': 'mean_reversion', 'bull_bb_std_mult': 1.7139380355695217, 'bull_rsi_os': 12, 'bull_rsi_ob': 80, 'bull_adx_thresh': 9.540329960043188, 'bull_atr_min_pct': 0.02045280176566694, 'bull_atr_max_pct': 0.05924790125843418, 'bull_tp_mult': 2.3320392727877115, 'bull_tsl_mult': 0.08146271390866966, 'bull_time_stop': 259, 'bull_use_sma': True, 'bull_use_ema': True, 'bull_use_atr': True, 'bull_use_adx': False, 'bull_use_spike': False, 'bull_rsi_required': False, 'bear_strategy': 'breakout', 'bear_bb_std_mult': 1.756538512074933, 'bear_rsi_os': 29, 'bear_rsi_ob': 74, 'bear_adx_thresh': 23.678370688312516, 'bear_atr_min_pct': 0.0031359781156527467, 'bear_atr_max_pct': 0.10249794354662997, 'bear_tp_mult': 1.7792769039219922, 'bear_tsl_mult': 0.7609380840796919, 'bear_time_stop': 56, 'bear_use_sma': False, 'bear_use_ema': False, 'bear_use_atr': True, 'bear_use_adx': True, 'bear_use_spike': False, 'bear_rsi_required': True, 'sideways_strategy': 'mean_reversion', 'sideways_bb_std_mult': 1.2860525712556845, 'sideways_rsi_os': 20, 'sideways_rsi_ob': 81, 'sideways_adx_thresh': 29.158225017715285, 'sideways_atr_min_pct': 0.018475589583917516, 'sideways_atr_max_pct': 0.07347578959236979, 'sideways_tp_mult': 1.2536128923364818, 'sideways_tsl_mult': 0.6678694930082759, 'sideways_time_stop': 168, 'sideways_use_sma': True, 'sideways_use_ema': True, 'sideways_use_atr': True, 'sideways_use_adx': True, 'sideways_use_spike': False, 'sideways_rsi_required': True}.
[I 2025-08-30 16:47:42,429] Trial 870 finished with values: [-1000000000.0, 1000000000.0] and parameters: {'p_sma': 6, 'p_std': 57, 'p_atr': 24, 'p_adx': 26, 'rsi_period': 10, 'ema1': 24, 'ema2': 39, 'slip_atr_k': 0.0074621590810712984, 'slip_spread_k': 0.7242018796996301, 'spread_hl_frac': 0.015226028850759382, 'bb_std_mult': 0.6436903470993736, 'rsi_os': 25, 'rsi_ob': 65, 'vol_spike': 0.15525309609972623, 'adx_thresh': 8.626553418952332, 'atr_min_pct': 0.00462540229504894, 'atr_max_pct': 0.08470146915693716, 'tp_mult': 1.7240170713579595, 'tsl_mult': 0.6118732854248395, 'strategy': 'mean_reversion', 'time_stop': 147, 'use_sma': False, 'use_atr': False, 'use_adx': True, 'use_ema': True, 'use_spike': False, 'rsi_required': False, 'edge_k': 1.627398667765003, 'edge_cap': 0.935242970230419, 'bull_strategy': 'mean_reversion', 'bull_bb_std_mult': 1.6978975728432464, 'bull_rsi_os': 21, 'bull_rsi_ob': 86, 'bull_adx_thresh': 12.137915234355908, 'bull_atr_min_pct': 0.022106562742417055, 'bull_atr_max_pct': 0.026681862888438317, 'bull_tp_mult': 2.297768661575565, 'bull_tsl_mult': 0.9270931224501002, 'bull_time_stop': 263, 'bull_use_sma': True, 'bull_use_ema': True, 'bull_use_atr': True, 'bull_use_adx': False, 'bull_use_spike': False, 'bull_rsi_required': False, 'bear_strategy': 'breakout', 'bear_bb_std_mult': 1.681205145065759, 'bear_rsi_os': 23, 'bear_rsi_ob': 74, 'bear_adx_thresh': 11.181357377594788, 'bear_atr_min_pct': 0.003084254512456079, 'bear_atr_max_pct': 0.08458439418364436, 'bear_tp_mult': 1.8157732937261974, 'bear_tsl_mult': 0.43560220977213493, 'bear_time_stop': 274, 'bear_use_sma': False, 'bear_use_ema': False, 'bear_use_atr': True, 'bear_use_adx': True, 'bear_use_spike': False, 'bear_rsi_required': True, 'sideways_strategy': 'mean_reversion', 'sideways_bb_std_mult': 3.2245564383440355, 'sideways_rsi_os': 6, 'sideways_rsi_ob': 81, 'sideways_adx_thresh': 13.777180076883804, 'sideways_atr_min_pct': 0.014400189259346044, 'sideways_atr_max_pct': 0.14788703233925968, 'sideways_tp_mult': 1.615341063965175, 'sideways_tsl_mult': 0.39558541910748557, 'sideways_time_stop': 127, 'sideways_use_sma': True, 'sideways_use_ema': True, 'sideways_use_atr': True, 'sideways_use_adx': True, 'sideways_use_spike': False, 'sideways_rsi_required': True}.
[I 2025-08-30 16:48:36,882] Trial 873 finished with values: [-1000000000.0, 1000000000.0] and parameters: {'p_sma': 23, 'p_std': 38, 'p_atr': 12, 'p_adx': 7, 'rsi_period': 43, 'ema1': 25, 'ema2': 39, 'slip_atr_k': 0.13639083280650083, 'slip_spread_k': 0.8964024095595717, 'spread_hl_frac': 0.006768207349655147, 'bb_std_mult': 0.6053325136140054, 'rsi_os': 27, 'rsi_ob': 85, 'vol_spike': 0.2086346191940451, 'adx_thresh': 8.012405838701023, 'atr_min_pct': 0.015689039821183907, 'atr_max_pct': 0.11175784024501607, 'tp_mult': 1.5535756713903601, 'tsl_mult': 0.3703070097147171, 'strategy': 'breakout', 'time_stop': 186, 'use_sma': False, 'use_atr': False, 'use_adx': True, 'use_ema': True, 'use_spike': False, 'rsi_required': False, 'edge_k': 0.5840618839210603, 'edge_cap': 0.9356637749823211, 'bull_strategy': 'mean_reversion', 'bull_bb_std_mult': 1.6717508171608464, 'bull_rsi_os': 49, 'bull_rsi_ob': 89, 'bull_adx_thresh': 31.38372580439657, 'bull_atr_min_pct': 0.023537498525541982, 'bull_atr_max_pct': 0.0968121131141487, 'bull_tp_mult': 1.9638522823023477, 'bull_tsl_mult': 0.2238486863713054, 'bull_time_stop': 60, 'bull_use_sma': True, 'bull_use_ema': True, 'bull_use_atr': False, 'bull_use_adx': True, 'bull_use_spike': False, 'bull_rsi_required': False, 'bear_strategy': 'breakout', 'bear_bb_std_mult': 3.379570961798336, 'bear_rsi_os': 29, 'bear_rsi_ob': 73, 'bear_adx_thresh': 30.678214596100567, 'bear_atr_min_pct': 0.002957365601155053, 'bear_atr_max_pct': 0.08390746500555048, 'bear_tp_mult': 2.537452550072882, 'bear_tsl_mult': 0.9363109965921643, 'bear_time_stop': 56, 'bear_use_sma': True, 'bear_use_ema': False, 'bear_use_atr': True, 'bear_use_adx': True, 'bear_use_spike': False, 'bear_rsi_required': True, 'sideways_strategy': 'mean_reversion', 'sideways_bb_std_mult': 2.851013026729672, 'sideways_rsi_os': 6, 'sideways_rsi_ob': 88, 'sideways_adx_thresh': 9.610699437086947, 'sideways_atr_min_pct': 0.01880894698715439, 'sideways_atr_max_pct': 0.14755359823840647, 'sideways_tp_mult': 1.6398488223925274, 'sideways_tsl_mult': 0.3582100162391638, 'sideways_time_stop': 55, 'sideways_use_sma': True, 'sideways_use_ema': False, 'sideways_use_atr': True, 'sideways_use_adx': True, 'sideways_use_spike': False, 'sideways_rsi_required': True}.
