[I 2025-08-30 14:29:42,171] Trial 75 finished with values: [-0.013811178096587384, 0.013751433909808711] and parameters: {'p_sma': 21, 'p_std': 6, 'p_atr': 9, 'p_adx': 30, 'rsi_period': 38, 'ema1': 24, 'ema2': 22, 'slip_atr_k': 0.08413268247650757, 'slip_spread_k': 0.3401662961342007, 'spread_hl_frac': 0.029944035865747357, 'bb_std_mult': 0.510192191402319, 'rsi_os': 24, 'rsi_ob': 83, 'vol_spike': 0.19427539847669226, 'adx_thresh': 21.11134708202646, 'atr_min_pct': 0.002337451638825439, 'atr_max_pct': 0.039571300647176566, 'tp_mult': 2.6002213204647675, 'tsl_mult': 0.09819327180996221, 'strategy': 'breakout', 'time_stop': 214, 'use_sma': True, 'use_atr': False, 'use_adx': False, 'use_ema': True, 'use_spike': False, 'rsi_required': True, 'edge_k': 1.7237567047485831, 'edge_cap': 0.25971826604675075, 'bull_strategy': 'mean_reversion', 'bull_bb_std_mult': 0.7640990376244408, 'bull_rsi_os': 27, 'bull_rsi_ob': 87, 'bull_adx_thresh': 20.516655751349212, 'bull_atr_min_pct': 0.0014521656743729883, 'bull_atr_max_pct': 0.01585908944039658, 'bull_tp_mult': 1.0529453175386845, 'bull_tsl_mult': 0.4830513950925405, 'bull_time_stop': 78, 'bull_use_sma': False, 'bull_use_ema': True, 'bull_use_atr': True, 'bull_use_adx': False, 'bull_use_spike': False, 'bull_rsi_required': False, 'bear_strategy': 'breakout', 'bear_bb_std_mult': 1.1357955908151411, 'bear_rsi_os': 21, 'bear_rsi_ob': 91, 'bear_adx_thresh': 34.25815304385418, 'bear_atr_min_pct': 0.013844629081188546, 'bear_atr_max_pct': 0.06646057727378354, 'bear_tp_mult': 1.9584603973322405, 'bear_tsl_mult': 0.5966219184385699, 'bear_time_stop': 97, 'bear_use_sma': True, 'bear_use_ema': True, 'bear_use_atr': False, 'bear_use_adx': False, 'bear_use_spike': False, 'bear_rsi_required': False, 'sideways_strategy': 'breakout', 'sideways_bb_std_mult': 3.322464487489055, 'sideways_rsi_os': 24, 'sideways_rsi_ob': 77, 'sideways_adx_thresh': 7.478909184920909, 'sideways_atr_min_pct': 0.029084970898525155, 'sideways_atr_max_pct': 0.01695102892342487, 'sideways_tp_mult': 2.7628310324668752, 'sideways_tsl_mult': 0.7313034264019682, 'sideways_time_stop': 222, 'sideways_use_sma': True, 'sideways_use_ema': False, 'sideways_use_atr': True, 'sideways_use_adx': False, 'sideways_use_spike': False, 'sideways_rsi_required': False}.
[I 2025-08-30 14:29:42,182] Trial 74 finished with values: [-0.017191178819878417, 0.017145033006496748] and parameters: {'p_sma': 21, 'p_std': 6, 'p_atr': 10, 'p_adx': 17, 'rsi_period': 38, 'ema1': 29, 'ema2': 39, 'slip_atr_k': 0.17591748160439474, 'slip_spread_k': 0.7051533965568455, 'spread_hl_frac': 0.0064087041466717835, 'bb_std_mult': 0.5131991483455369, 'rsi_os': 24, 'rsi_ob': 84, 'vol_spike': 0.19805777430798113, 'adx_thresh': 22.69267253068811, 'atr_min_pct': 0.015322241866308024, 'atr_max_pct': 0.07191075493219375, 'tp_mult': 2.5867448219391704, 'tsl_mult': 0.09306126798889518, 'strategy': 'breakout', 'time_stop': 22, 'use_sma': True, 'use_atr': False, 'use_adx': False, 'use_ema': True, 'use_spike': False, 'rsi_required': True, 'edge_k': 1.6979896177698173, 'edge_cap': 0.24974214235736614, 'bull_strategy': 'mean_reversion', 'bull_bb_std_mult': 0.7657230434007058, 'bull_rsi_os': 27, 'bull_rsi_ob': 63, 'bull_adx_thresh': 32.56852681674324, 'bull_atr_min_pct': 0.0012377324462814919, 'bull_atr_max_pct': 0.10404589489982001, 'bull_tp_mult': 1.7437672960452288, 'bull_tsl_mult': 0.26719876180410673, 'bull_time_stop': 248, 'bull_use_sma': False, 'bull_use_ema': True, 'bull_use_atr': True, 'bull_use_adx': False, 'bull_use_spike': False, 'bull_rsi_required': False, 'bear_strategy': 'breakout', 'bear_bb_std_mult': 1.1842171215895994, 'bear_rsi_os': 20, 'bear_rsi_ob': 56, 'bear_adx_thresh': 11.778709216223056, 'bear_atr_min_pct': 0.013095512640477074, 'bear_atr_max_pct': 0.1456636298133024, 'bear_tp_mult': 1.727029615734376, 'bear_tsl_mult': 0.8089237687238211, 'bear_time_stop': 126, 'bear_use_sma': True, 'bear_use_ema': True, 'bear_use_atr': False, 'bear_use_adx': False, 'bear_use_spike': False, 'bear_rsi_required': False, 'sideways_strategy': 'breakout', 'sideways_bb_std_mult': 3.323789568641755, 'sideways_rsi_os': 10, 'sideways_rsi_ob': 83, 'sideways_adx_thresh': 7.535418740564436, 'sideways_atr_min_pct': 0.029271148449973968, 'sideways_atr_max_pct': 0.015864179509547452, 'sideways_tp_mult': 2.7297259175413493, 'sideways_tsl_mult': 0.5393607394959178, 'sideways_time_stop': 217, 'sideways_use_sma': True, 'sideways_use_ema': False, 'sideways_use_atr': True, 'sideways_use_adx': False, 'sideways_use_spike': False, 'sideways_rsi_required': False}.
[I 2025-08-30 14:29:42,330] Trial 73 finished with values: [-1000000000.0, 1000000000.0] and parameters: {'p_sma': 15, 'p_std': 29, 'p_atr': 9, 'p_adx': 13, 'rsi_period': 63, 'ema1': 24, 'ema2': 44, 'slip_atr_k': 0.10036286070804823, 'slip_spread_k': 0.3610668323488663, 'spread_hl_frac': 0.022891508089627914, 'bb_std_mult': 0.5208409592786104, 'rsi_os': 19, 'rsi_ob': 72, 'vol_spike': 0.23879738289971914, 'adx_thresh': 28.24322775675216, 'atr_min_pct': 0.002483417654779755, 'atr_max_pct': 0.0407066169868141, 'tp_mult': 2.596027132863906, 'tsl_mult': 0.08874614403866535, 'strategy': 'breakout', 'time_stop': 235, 'use_sma': True, 'use_atr': False, 'use_adx': False, 'use_ema': True, 'use_spike': False, 'rsi_required': True, 'edge_k': 1.9407895143184724, 'edge_cap': 0.6037682779944465, 'bull_strategy': 'mean_reversion', 'bull_bb_std_mult': 0.6148292987722839, 'bull_rsi_os': 47, 'bull_rsi_ob': 87, 'bull_adx_thresh': 20.46960276608957, 'bull_atr_min_pct': 0.003967630610343006, 'bull_atr_max_pct': 0.10210292867346799, 'bull_tp_mult': 1.2641953895805809, 'bull_tsl_mult': 0.8064746077309011, 'bull_time_stop': 76, 'bull_use_sma': True, 'bull_use_ema': True, 'bull_use_atr': True, 'bull_use_adx': False, 'bull_use_spike': False, 'bull_rsi_required': True, 'bear_strategy': 'breakout', 'bear_bb_std_mult': 1.1769643017722724, 'bear_rsi_os': 51, 'bear_rsi_ob': 58, 'bear_adx_thresh': 31.614672333333445, 'bear_atr_min_pct': 0.013747316286851486, 'bear_atr_max_pct': 0.060179646509335286, 'bear_tp_mult': 1.688201819817733, 'bear_tsl_mult': 0.8087800509891585, 'bear_time_stop': 78, 'bear_use_sma': True, 'bear_use_ema': True, 'bear_use_atr': True, 'bear_use_adx': True, 'bear_use_spike': False, 'bear_rsi_required': False, 'sideways_strategy': 'breakout', 'sideways_bb_std_mult': 1.746869051126807, 'sideways_rsi_os': 24, 'sideways_rsi_ob': 83, 'sideways_adx_thresh': 5.59584065226311, 'sideways_atr_min_pct': 0.0278193972168144, 'sideways_atr_max_pct': 0.037337531260171274, 'sideways_tp_mult': 2.7405481752847756, 'sideways_tsl_mult': 0.03461161039713771, 'sideways_time_stop': 234, 'sideways_use_sma': True, 'sideways_use_ema': False, 'sideways_use_atr': True, 'sideways_use_adx': False, 'sideways_use_spike': True, 'sideways_rsi_required': False}.
[I 2025-08-30 14:29:42,466] Trial 72 finished with values: [-1000000000.0, 1000000000.0] and parameters: {'p_sma': 38, 'p_std': 31, 'p_atr': 15, 'p_adx': 13, 'rsi_period': 63, 'ema1': 23, 'ema2': 35, 'slip_atr_k': 0.0991214724874718, 'slip_spread_k': 0.8104094670107921, 'spread_hl_frac': 0.02572211916190779, 'bb_std_mult': 0.5130950328224656, 'rsi_os': 45, 'rsi_ob': 72, 'vol_spike': 0.2029810258635471, 'adx_thresh': 30.497300159959202, 'atr_min_pct': 0.016703639525859904, 'atr_max_pct': 0.07207465279216162, 'tp_mult': 2.5804659593556165, 'tsl_mult': 6.523393788911494e-05, 'strategy': 'breakout', 'time_stop': 238, 'use_sma': True, 'use_atr': False, 'use_adx': False, 'use_ema': True, 'use_spike': False, 'rsi_required': True, 'edge_k': 1.9415477762229976, 'edge_cap': 0.1499932189349188, 'bull_strategy': 'mean_reversion', 'bull_bb_std_mult': 0.6207013755115154, 'bull_rsi_os': 46, 'bull_rsi_ob': 79, 'bull_adx_thresh': 34.09817957225397, 'bull_atr_min_pct': 0.001268448899763599, 'bull_atr_max_pct': 0.11584423816493791, 'bull_tp_mult': 1.225977631861875, 'bull_tsl_mult': 0.8074565294775233, 'bull_time_stop': 72, 'bull_use_sma': True, 'bull_use_ema': True, 'bull_use_atr': True, 'bull_use_adx': False, 'bull_use_spike': False, 'bull_rsi_required': True, 'bear_strategy': 'breakout', 'bear_bb_std_mult': 0.9247970128411767, 'bear_rsi_os': 49, 'bear_rsi_ob': 57, 'bear_adx_thresh': 32.046438659926956, 'bear_atr_min_pct': 0.013401047824798885, 'bear_atr_max_pct': 0.06826645926022308, 'bear_tp_mult': 1.1687585145913353, 'bear_tsl_mult': 0.809538582248955, 'bear_time_stop': 79, 'bear_use_sma': True, 'bear_use_ema': False, 'bear_use_atr': True, 'bear_use_adx': True, 'bear_use_spike': False, 'bear_rsi_required': False, 'sideways_strategy': 'breakout', 'sideways_bb_std_mult': 1.7958327591610608, 'sideways_rsi_os': 22, 'sideways_rsi_ob': 74, 'sideways_adx_thresh': 5.724439034405938, 'sideways_atr_min_pct': 0.02900671075801031, 'sideways_atr_max_pct': 0.03539731309996406, 'sideways_tp_mult': 2.67950784356016, 'sideways_tsl_mult': 0.2846557935695502, 'sideways_time_stop': 183, 'sideways_use_sma': True, 'sideways_use_ema': True, 'sideways_use_atr': True, 'sideways_use_adx': False, 'sideways_use_spike': True, 'sideways_rsi_required': False}.
[I 2025-08-30 14:30:12,086] Trial 79 finished with values: [-1000000000.0, 1000000000.0] and parameters: {'p_sma': 41, 'p_std': 11, 'p_atr': 29, 'p_adx': 30, 'rsi_period': 55, 'ema1': 13, 'ema2': 58, 'slip_atr_k': 0.08343085357066704, 'slip_spread_k': 0.23122499583874523, 'spread_hl_frac': 0.019873830930473478, 'bb_std_mult': 0.9217720014235702, 'rsi_os': 24, 'rsi_ob': 83, 'vol_spike': 0.1760623892216418, 'adx_thresh': 30.856571035574493, 'atr_min_pct': 0.0006207967189908838, 'atr_max_pct': 0.017652819204829463, 'tp_mult': 2.373547944912245, 'tsl_mult': 0.11209020935307056, 'strategy': 'breakout', 'time_stop': 217, 'use_sma': False, 'use_atr': False, 'use_adx': False, 'use_ema': True, 'use_spike': False, 'rsi_required': True, 'edge_k': 1.7072288037200791, 'edge_cap': 0.685239242279889, 'bull_strategy': 'mean_reversion', 'bull_bb_std_mult': 1.5507684246543862, 'bull_rsi_os': 12, 'bull_rsi_ob': 64, 'bull_adx_thresh': 16.9579315318111, 'bull_atr_min_pct': 0.018917795560628243, 'bull_atr_max_pct': 0.015823941921972895, 'bull_tp_mult': 1.8262926392283736, 'bull_tsl_mult': 0.06347743672708939, 'bull_time_stop': 33, 'bull_use_sma': False, 'bull_use_ema': True, 'bull_use_atr': True, 'bull_use_adx': False, 'bull_use_spike': False, 'bull_rsi_required': False, 'bear_strategy': 'breakout', 'bear_bb_std_mult': 1.8474709138963457, 'bear_rsi_os': 23, 'bear_rsi_ob': 94, 'bear_adx_thresh': 10.941926562847009, 'bear_atr_min_pct': 0.0015118737997404774, 'bear_atr_max_pct': 0.09004136796974647, 'bear_tp_mult': 1.9729891197553742, 'bear_tsl_mult': 0.593318982212214, 'bear_time_stop': 173, 'bear_use_sma': False, 'bear_use_ema': True, 'bear_use_atr': False, 'bear_use_adx': False, 'bear_use_spike': False, 'bear_rsi_required': False, 'sideways_strategy': 'breakout', 'sideways_bb_std_mult': 2.2988720294189435, 'sideways_rsi_os': 11, 'sideways_rsi_ob': 79, 'sideways_adx_thresh': 7.808987512235251, 'sideways_atr_min_pct': 0.026151284571265532, 'sideways_atr_max_pct': 0.015351027977800174, 'sideways_tp_mult': 1.1543107696349573, 'sideways_tsl_mult': 0.49986481400079, 'sideways_time_stop': 26, 'sideways_use_sma': True, 'sideways_use_ema': False, 'sideways_use_atr': True, 'sideways_use_adx': True, 'sideways_use_spike': False, 'sideways_rsi_required': False}.
[I 2025-08-30 14:30:12,995] Trial 78 finished with values: [-1000000000.0, 1000000000.0] and parameters: {'p_sma': 41, 'p_std': 11, 'p_atr': 28, 'p_adx': 10, 'rsi_period': 54, 'ema1': 11, 'ema2': 27, 'slip_atr_k': 0.08521879625633577, 'slip_spread_k': 0.7220345635812859, 'spread_hl_frac': 0.01872669518815994, 'bb_std_mult': 3.5190233138752287, 'rsi_os': 15, 'rsi_ob': 83, 'vol_spike': 0.22329904683253715, 'adx_thresh': 30.792396099446826, 'atr_min_pct': 0.012896799956006995, 'atr_max_pct': 0.017787445661210616, 'tp_mult': 2.258442257500502, 'tsl_mult': 0.1294148324908191, 'strategy': 'breakout', 'time_stop': 214, 'use_sma': True, 'use_atr': False, 'use_adx': False, 'use_ema': True, 'use_spike': False, 'rsi_required': True, 'edge_k': 1.3614774320285978, 'edge_cap': 0.14683442519043605, 'bull_strategy': 'mean_reversion', 'bull_bb_std_mult': 1.5393054364794998, 'bull_rsi_os': 34, 'bull_rsi_ob': 64, 'bull_adx_thresh': 34.89258516225123, 'bull_atr_min_pct': 0.0014992948823451054, 'bull_atr_max_pct': 0.13272075525028315, 'bull_tp_mult': 1.833264579593039, 'bull_tsl_mult': 0.8714055017725646, 'bull_time_stop': 104, 'bull_use_sma': False, 'bull_use_ema': True, 'bull_use_atr': True, 'bull_use_adx': False, 'bull_use_spike': False, 'bull_rsi_required': False, 'bear_strategy': 'breakout', 'bear_bb_std_mult': 2.15756452058855, 'bear_rsi_os': 20, 'bear_rsi_ob': 94, 'bear_adx_thresh': 34.16328213088338, 'bear_atr_min_pct': 0.001503175805772708, 'bear_atr_max_pct': 0.0922631384194629, 'bear_tp_mult': 1.816996411964477, 'bear_tsl_mult': 0.6024487071306407, 'bear_time_stop': 123, 'bear_use_sma': True, 'bear_use_ema': True, 'bear_use_atr': False, 'bear_use_adx': False, 'bear_use_spike': False, 'bear_rsi_required': False, 'sideways_strategy': 'breakout', 'sideways_bb_std_mult': 3.264289405382099, 'sideways_rsi_os': 10, 'sideways_rsi_ob': 78, 'sideways_adx_thresh': 7.895571530978067, 'sideways_atr_min_pct': 0.029130197302101958, 'sideways_atr_max_pct': 0.018913061409943317, 'sideways_tp_mult': 1.2085125399456724, 'sideways_tsl_mult': 0.48255818292392605, 'sideways_time_stop': 224, 'sideways_use_sma': True, 'sideways_use_ema': False, 'sideways_use_atr': True, 'sideways_use_adx': True, 'sideways_use_spike': False, 'sideways_rsi_required': False}.
[I 2025-08-30 14:30:13,165] Trial 77 finished with values: [-1000000000.0, 1000000000.0] and parameters: {'p_sma': 41, 'p_std': 11, 'p_atr': 28, 'p_adx': 26, 'rsi_period': 68, 'ema1': 23, 'ema2': 44, 'slip_atr_k': 0.08498703388213442, 'slip_spread_k': 0.38002181202528357, 'spread_hl_frac': 0.019255178178429193, 'bb_std_mult': 2.2036402320981807, 'rsi_os': 19, 'rsi_ob': 83, 'vol_spike': 0.2378164435773026, 'adx_thresh': 22.589410950561643, 'atr_min_pct': 0.00831446809413917, 'atr_max_pct': 0.13841364686123597, 'tp_mult': 2.5572769209417316, 'tsl_mult': 0.10601733185470043, 'strategy': 'breakout', 'time_stop': 232, 'use_sma': True, 'use_atr': False, 'use_adx': False, 'use_ema': True, 'use_spike': False, 'rsi_required': True, 'edge_k': 1.6813093930766199, 'edge_cap': 0.12762040056822876, 'bull_strategy': 'mean_reversion', 'bull_bb_std_mult': 0.7284983780952696, 'bull_rsi_os': 46, 'bull_rsi_ob': 86, 'bull_adx_thresh': 34.811486492905495, 'bull_atr_min_pct': 0.0014759753078100203, 'bull_atr_max_pct': 0.1045042745709382, 'bull_tp_mult': 1.0498924970054846, 'bull_tsl_mult': 0.06355503885924096, 'bull_time_stop': 78, 'bull_use_sma': False, 'bull_use_ema': True, 'bull_use_atr': True, 'bull_use_adx': False, 'bull_use_spike': False, 'bull_rsi_required': False, 'bear_strategy': 'breakout', 'bear_bb_std_mult': 1.187457957530883, 'bear_rsi_os': 51, 'bear_rsi_ob': 55, 'bear_adx_thresh': 34.14790864757698, 'bear_atr_min_pct': 0.00916536010020212, 'bear_atr_max_pct': 0.06455302593262646, 'bear_tp_mult': 1.6935533242664296, 'bear_tsl_mult': 0.4653692863354022, 'bear_time_stop': 125, 'bear_use_sma': True, 'bear_use_ema': True, 'bear_use_atr': False, 'bear_use_adx': False, 'bear_use_spike': False, 'bear_rsi_required': False, 'sideways_strategy': 'breakout', 'sideways_bb_std_mult': 2.296760672016609, 'sideways_rsi_os': 22, 'sideways_rsi_ob': 78, 'sideways_adx_thresh': 7.4470314868283864, 'sideways_atr_min_pct': 0.026292723155504218, 'sideways_atr_max_pct': 0.01739540357406474, 'sideways_tp_mult': 2.7313035165118453, 'sideways_tsl_mult': 0.7138803905550589, 'sideways_time_stop': 222, 'sideways_use_sma': True, 'sideways_use_ema': False, 'sideways_use_atr': True, 'sideways_use_adx': True, 'sideways_use_spike': True, 'sideways_rsi_required': False}.
[I 2025-08-30 14:30:13,333] Trial 76 finished with values: [-0.015901787747190643, 0.015866753146333457] and parameters: {'p_sma': 28, 'p_std': 11, 'p_atr': 9, 'p_adx': 30, 'rsi_period': 68, 'ema1': 28, 'ema2': 45, 'slip_atr_k': 0.08443383778945775, 'slip_spread_k': 0.36938683652888865, 'spread_hl_frac': 0.02303656431683505, 'bb_std_mult': 2.16467094286763, 'rsi_os': 19, 'rsi_ob': 83, 'vol_spike': 0.1977756877438015, 'adx_thresh': 30.729193788038884, 'atr_min_pct': 0.0021359261991208732, 'atr_max_pct': 0.017112637352375486, 'tp_mult': 1.0214116297303377, 'tsl_mult': 0.10549647719181464, 'strategy': 'breakout', 'time_stop': 233, 'use_sma': True, 'use_atr': False, 'use_adx': False, 'use_ema': True, 'use_spike': False, 'rsi_required': True, 'edge_k': 1.9992554636943611, 'edge_cap': 0.12686329781937855, 'bull_strategy': 'mean_reversion', 'bull_bb_std_mult': 0.7675834040018306, 'bull_rsi_os': 46, 'bull_rsi_ob': 87, 'bull_adx_thresh': 17.27305123633809, 'bull_atr_min_pct': 0.0013336752029487848, 'bull_atr_max_pct': 0.13120792424025887, 'bull_tp_mult': 1.759949671221809, 'bull_tsl_mult': 0.269182335567504, 'bull_time_stop': 103, 'bull_use_sma': False, 'bull_use_ema': True, 'bull_use_atr': True, 'bull_use_adx': False, 'bull_use_spike': False, 'bull_rsi_required': False, 'bear_strategy': 'breakout', 'bear_bb_std_mult': 3.1070972957126335, 'bear_rsi_os': 21, 'bear_rsi_ob': 94, 'bear_adx_thresh': 34.25910467631865, 'bear_atr_min_pct': 0.013147270317624263, 'bear_atr_max_pct': 0.09152324128939579, 'bear_tp_mult': 1.6867650312414448, 'bear_tsl_mult': 0.5821862870377, 'bear_time_stop': 124, 'bear_use_sma': True, 'bear_use_ema': True, 'bear_use_atr': False, 'bear_use_adx': False, 'bear_use_spike': False, 'bear_rsi_required': False, 'sideways_strategy': 'breakout', 'sideways_bb_std_mult': 2.3594703554401653, 'sideways_rsi_os': 45, 'sideways_rsi_ob': 83, 'sideways_adx_thresh': 7.430387901732936, 'sideways_atr_min_pct': 0.028911667065597398, 'sideways_atr_max_pct': 0.014451298989736888, 'sideways_tp_mult': 2.7164096728099403, 'sideways_tsl_mult': 0.7534202976344075, 'sideways_time_stop': 225, 'sideways_use_sma': True, 'sideways_use_ema': False, 'sideways_use_atr': True, 'sideways_use_adx': True, 'sideways_use_spike': True, 'sideways_rsi_required': False}.
[I 2025-08-30 14:30:42,516] Trial 80 finished with values: [-1000000000.0, 1000000000.0] and parameters: {'p_sma': 10, 'p_std': 6, 'p_atr': 12, 'p_adx': 26, 'rsi_period': 39, 'ema1': 29, 'ema2': 22, 'slip_atr_k': 0.08886163427044512, 'slip_spread_k': 0.6928733957504235, 'spread_hl_frac': 0.029952499012351613, 'bb_std_mult': 1.7051284293132625, 'rsi_os': 14, 'rsi_ob': 64, 'vol_spike': 0.19369195750379684, 'adx_thresh': 22.21224394162549, 'atr_min_pct': 0.0019026133623042984, 'atr_max_pct': 0.018213224991522125, 'tp_mult': 2.2578879833748684, 'tsl_mult': 0.12754740558914945, 'strategy': 'breakout', 'time_stop': 70, 'use_sma': False, 'use_atr': True, 'use_adx': False, 'use_ema': True, 'use_spike': False, 'rsi_required': True, 'edge_k': 1.5904111012549005, 'edge_cap': 0.2547560021255001, 'bull_strategy': 'mean_reversion', 'bull_bb_std_mult': 0.7472083511620181, 'bull_rsi_os': 34, 'bull_rsi_ob': 93, 'bull_adx_thresh': 34.70590716467396, 'bull_atr_min_pct': 0.0013567599544579438, 'bull_atr_max_pct': 0.05344658197342869, 'bull_tp_mult': 2.9862004844982692, 'bull_tsl_mult': 0.8731998801668124, 'bull_time_stop': 103, 'bull_use_sma': False, 'bull_use_ema': True, 'bull_use_atr': False, 'bull_use_adx': True, 'bull_use_spike': False, 'bull_rsi_required': False, 'bear_strategy': 'breakout', 'bear_bb_std_mult': 2.174341740962729, 'bear_rsi_os': 21, 'bear_rsi_ob': 91, 'bear_adx_thresh': 34.27939303199957, 'bear_atr_min_pct': 0.003967699003086619, 'bear_atr_max_pct': 0.14708235844352083, 'bear_tp_mult': 2.2164336108236116, 'bear_tsl_mult': 0.451805761813253, 'bear_time_stop': 216, 'bear_use_sma': True, 'bear_use_ema': True, 'bear_use_atr': False, 'bear_use_adx': False, 'bear_use_spike': True, 'bear_rsi_required': False, 'sideways_strategy': 'breakout', 'sideways_bb_std_mult': 3.3417730588373056, 'sideways_rsi_os': 9, 'sideways_rsi_ob': 77, 'sideways_adx_thresh': 5.030425756096744, 'sideways_atr_min_pct': 0.02884850119161423, 'sideways_atr_max_pct': 0.01646877274710765, 'sideways_tp_mult': 2.7973790150673614, 'sideways_tsl_mult': 0.5449465554478895, 'sideways_time_stop': 219, 'sideways_use_sma': False, 'sideways_use_ema': False, 'sideways_use_atr': False, 'sideways_use_adx': True, 'sideways_use_spike': False, 'sideways_rsi_required': False}.
