[I 2025-08-30 14:32:51,326] Trial 98 finished with values: [-1000000000.0, 1000000000.0] and parameters: {'p_sma': 39, 'p_std': 57, 'p_atr': 9, 'p_adx': 7, 'rsi_period': 20, 'ema1': 13, 'ema2': 38, 'slip_atr_k': 0.03289546754345931, 'slip_spread_k': 0.024341798157824945, 'spread_hl_frac': 0.020166997784478013, 'bb_std_mult': 0.500169682574405, 'rsi_os': 22, 'rsi_ob': 90, 'vol_spike': 0.20413929550711302, 'adx_thresh': 32.14993975141857, 'atr_min_pct': 0.029307194767009877, 'atr_max_pct': 0.12324168728751922, 'tp_mult': 2.1040486710149233, 'tsl_mult': 0.03175267645137804, 'strategy': 'breakout', 'time_stop': 218, 'use_sma': True, 'use_atr': True, 'use_adx': False, 'use_ema': True, 'use_spike': True, 'rsi_required': True, 'edge_k': 1.7155912268045022, 'edge_cap': 0.4528063096613948, 'bull_strategy': 'mean_reversion', 'bull_bb_std_mult': 0.6939405550119907, 'bull_rsi_os': 41, 'bull_rsi_ob': 77, 'bull_adx_thresh': 33.476746657919335, 'bull_atr_min_pct': 0.011617529950438393, 'bull_atr_max_pct': 0.06168881474427107, 'bull_tp_mult': 1.2940432569521647, 'bull_tsl_mult': 0.6047795124165805, 'bull_time_stop': 82, 'bull_use_sma': False, 'bull_use_ema': False, 'bull_use_atr': False, 'bull_use_adx': True, 'bull_use_spike': False, 'bull_rsi_required': False, 'bear_strategy': 'breakout', 'bear_bb_std_mult': 1.0934361653359304, 'bear_rsi_os': 19, 'bear_rsi_ob': 65, 'bear_adx_thresh': 21.697742552935658, 'bear_atr_min_pct': 0.014332435815974006, 'bear_atr_max_pct': 0.13520549067744153, 'bear_tp_mult': 1.4705668995879144, 'bear_tsl_mult': 0.5782620674120416, 'bear_time_stop': 182, 'bear_use_sma': False, 'bear_use_ema': True, 'bear_use_atr': False, 'bear_use_adx': False, 'bear_use_spike': False, 'bear_rsi_required': False, 'sideways_strategy': 'breakout', 'sideways_bb_std_mult': 3.02100190597469, 'sideways_rsi_os': 5, 'sideways_rsi_ob': 84, 'sideways_adx_thresh': 5.780995539160001, 'sideways_atr_min_pct': 0.004178337176039491, 'sideways_atr_max_pct': 0.08614869574147554, 'sideways_tp_mult': 2.123101448884687, 'sideways_tsl_mult': 0.11198269893027066, 'sideways_time_stop': 253, 'sideways_use_sma': False, 'sideways_use_ema': True, 'sideways_use_atr': False, 'sideways_use_adx': False, 'sideways_use_spike': False, 'sideways_rsi_required': False}.
[I 2025-08-30 14:32:51,470] Trial 100 finished with values: [-0.011148761794226858, 0.011132331790270409] and parameters: {'p_sma': 39, 'p_std': 7, 'p_atr': 15, 'p_adx': 8, 'rsi_period': 19, 'ema1': 16, 'ema2': 32, 'slip_atr_k': 0.08165296474634187, 'slip_spread_k': 0.5225285164007909, 'spread_hl_frac': 0.04760391550518109, 'bb_std_mult': 3.595266677337353, 'rsi_os': 18, 'rsi_ob': 77, 'vol_spike': 0.08406059788929773, 'adx_thresh': 25.12770871060397, 'atr_min_pct': 0.029620607852070033, 'atr_max_pct': 0.033111880958783854, 'tp_mult': 2.125298896082151, 'tsl_mult': 0.09999721931049538, 'strategy': 'mean_reversion', 'time_stop': 299, 'use_sma': True, 'use_atr': True, 'use_adx': False, 'use_ema': True, 'use_spike': True, 'rsi_required': True, 'edge_k': 1.8177196951941383, 'edge_cap': 0.48404196971883573, 'bull_strategy': 'mean_reversion', 'bull_bb_std_mult': 0.5019794515487204, 'bull_rsi_os': 41, 'bull_rsi_ob': 80, 'bull_adx_thresh': 19.90369494711524, 'bull_atr_min_pct': 0.0028074599251061254, 'bull_atr_max_pct': 0.02212871075801789, 'bull_tp_mult': 1.3030586281605099, 'bull_tsl_mult': 0.3262171473383305, 'bull_time_stop': 97, 'bull_use_sma': False, 'bull_use_ema': False, 'bull_use_atr': False, 'bull_use_adx': True, 'bull_use_spike': False, 'bull_rsi_required': False, 'bear_strategy': 'breakout', 'bear_bb_std_mult': 0.8111640728401401, 'bear_rsi_os': 19, 'bear_rsi_ob': 65, 'bear_adx_thresh': 32.72692201630994, 'bear_atr_min_pct': 0.011609431307663867, 'bear_atr_max_pct': 0.1459846981398833, 'bear_tp_mult': 1.9681837888662654, 'bear_tsl_mult': 0.7649346602132437, 'bear_time_stop': 151, 'bear_use_sma': False, 'bear_use_ema': True, 'bear_use_atr': False, 'bear_use_adx': False, 'bear_use_spike': False, 'bear_rsi_required': False, 'sideways_strategy': 'breakout', 'sideways_bb_std_mult': 1.978240565340813, 'sideways_rsi_os': 47, 'sideways_rsi_ob': 66, 'sideways_adx_thresh': 25.697690608363715, 'sideways_atr_min_pct': 0.023370210782824384, 'sideways_atr_max_pct': 0.014297845752509643, 'sideways_tp_mult': 2.8596405753738963, 'sideways_tsl_mult': 0.12308590876270586, 'sideways_time_stop': 172, 'sideways_use_sma': False, 'sideways_use_ema': True, 'sideways_use_atr': False, 'sideways_use_adx': False, 'sideways_use_spike': False, 'sideways_rsi_required': False}.
[I 2025-08-30 14:33:22,525] Trial 103 finished with values: [-1000000000.0, 1000000000.0] and parameters: {'p_sma': 32, 'p_std': 7, 'p_atr': 16, 'p_adx': 11, 'rsi_period': 76, 'ema1': 12, 'ema2': 21, 'slip_atr_k': 0.04274516875462166, 'slip_spread_k': 0.8991457069381465, 'spread_hl_frac': 0.02470593040432378, 'bb_std_mult': 0.6919325084648305, 'rsi_os': 9, 'rsi_ob': 78, 'vol_spike': 0.16541097322143605, 'adx_thresh': 14.163688965725967, 'atr_min_pct': 0.0009011835727520725, 'atr_max_pct': 0.012351644741381576, 'tp_mult': 1.6299393096617385, 'tsl_mult': 0.09321333684841461, 'strategy': 'mean_reversion', 'time_stop': 210, 'use_sma': False, 'use_atr': False, 'use_adx': True, 'use_ema': False, 'use_spike': False, 'rsi_required': True, 'edge_k': 1.650266424443747, 'edge_cap': 0.7149003746208189, 'bull_strategy': 'mean_reversion', 'bull_bb_std_mult': 0.5725552171305358, 'bull_rsi_os': 26, 'bull_rsi_ob': 86, 'bull_adx_thresh': 6.354813348524978, 'bull_atr_min_pct': 0.005514591964649817, 'bull_atr_max_pct': 0.13943519014593908, 'bull_tp_mult': 2.347292682379307, 'bull_tsl_mult': 0.2878540556936906, 'bull_time_stop': 48, 'bull_use_sma': True, 'bull_use_ema': True, 'bull_use_atr': False, 'bull_use_adx': False, 'bull_use_spike': False, 'bull_rsi_required': False, 'bear_strategy': 'breakout', 'bear_bb_std_mult': 2.617655988601911, 'bear_rsi_os': 42, 'bear_rsi_ob': 49, 'bear_adx_thresh': 25.657666359088815, 'bear_atr_min_pct': 0.026839241017690765, 'bear_atr_max_pct': 0.14465542469575782, 'bear_tp_mult': 1.6477711441037317, 'bear_tsl_mult': 0.6358436246993597, 'bear_time_stop': 153, 'bear_use_sma': True, 'bear_use_ema': True, 'bear_use_atr': False, 'bear_use_adx': False, 'bear_use_spike': True, 'bear_rsi_required': False, 'sideways_strategy': 'mean_reversion', 'sideways_bb_std_mult': 2.3756153522531767, 'sideways_rsi_os': 52, 'sideways_rsi_ob': 59, 'sideways_adx_thresh': 7.176050248470096, 'sideways_atr_min_pct': 0.027179971033031207, 'sideways_atr_max_pct': 0.0946097647320161, 'sideways_tp_mult': 1.6158837973950502, 'sideways_tsl_mult': 0.12438321611654618, 'sideways_time_stop': 297, 'sideways_use_sma': True, 'sideways_use_ema': True, 'sideways_use_atr': True, 'sideways_use_adx': False, 'sideways_use_spike': False, 'sideways_rsi_required': False}.
[I 2025-08-30 14:33:22,826] Trial 101 finished with values: [-1000000000.0, 1000000000.0] and parameters: {'p_sma': 43, 'p_std': 57, 'p_atr': 13, 'p_adx': 8, 'rsi_period': 22, 'ema1': 11, 'ema2': 38, 'slip_atr_k': 0.14880966361212727, 'slip_spread_k': 0.7484970932860276, 'spread_hl_frac': 0.02510078657957869, 'bb_std_mult': 2.0709322882170142, 'rsi_os': 15, 'rsi_ob': 77, 'vol_spike': 0.02730233528402022, 'adx_thresh': 32.379623375116665, 'atr_min_pct': 0.012791443156747899, 'atr_max_pct': 0.1454379781138041, 'tp_mult': 1.5764117201956243, 'tsl_mult': 0.09651853218373313, 'strategy': 'mean_reversion', 'time_stop': 89, 'use_sma': False, 'use_atr': True, 'use_adx': False, 'use_ema': True, 'use_spike': True, 'rsi_required': True, 'edge_k': 1.7273350890749086, 'edge_cap': 0.45793170829047036, 'bull_strategy': 'mean_reversion', 'bull_bb_std_mult': 0.8000566678449386, 'bull_rsi_os': 26, 'bull_rsi_ob': 77, 'bull_adx_thresh': 34.323045063903486, 'bull_atr_min_pct': 0.01438952072430131, 'bull_atr_max_pct': 0.0968909896940737, 'bull_tp_mult': 2.3165103500764905, 'bull_tsl_mult': 0.6319293629433491, 'bull_time_stop': 57, 'bull_use_sma': True, 'bull_use_ema': False, 'bull_use_atr': False, 'bull_use_adx': False, 'bull_use_spike': False, 'bull_rsi_required': False, 'bear_strategy': 'breakout', 'bear_bb_std_mult': 2.6022456234041234, 'bear_rsi_os': 13, 'bear_rsi_ob': 48, 'bear_adx_thresh': 25.81546456562258, 'bear_atr_min_pct': 0.01614303121571105, 'bear_atr_max_pct': 0.13433847744064661, 'bear_tp_mult': 1.6710336777262824, 'bear_tsl_mult': 0.6394592822915481, 'bear_time_stop': 151, 'bear_use_sma': True, 'bear_use_ema': True, 'bear_use_atr': False, 'bear_use_adx': False, 'bear_use_spike': True, 'bear_rsi_required': False, 'sideways_strategy': 'breakout', 'sideways_bb_std_mult': 3.0370799050259376, 'sideways_rsi_os': 55, 'sideways_rsi_ob': 66, 'sideways_adx_thresh': 25.481639070449653, 'sideways_atr_min_pct': 0.027387692460882015, 'sideways_atr_max_pct': 0.015132688364093608, 'sideways_tp_mult': 2.853950362362939, 'sideways_tsl_mult': 0.12158506386654612, 'sideways_time_stop': 172, 'sideways_use_sma': False, 'sideways_use_ema': True, 'sideways_use_atr': True, 'sideways_use_adx': False, 'sideways_use_spike': False, 'sideways_rsi_required': False}.
[I 2025-08-30 14:33:23,188] Trial 102 finished with values: [-1000000000.0, 1000000000.0] and parameters: {'p_sma': 52, 'p_std': 7, 'p_atr': 13, 'p_adx': 11, 'rsi_period': 63, 'ema1': 16, 'ema2': 40, 'slip_atr_k': 0.04377968657665833, 'slip_spread_k': 0.14983658241627557, 'spread_hl_frac': 0.03349956931356869, 'bb_std_mult': 0.763448315585402, 'rsi_os': 15, 'rsi_ob': 82, 'vol_spike': 0.23305120530599435, 'adx_thresh': 14.749904687946309, 'atr_min_pct': 0.012525406030241838, 'atr_max_pct': 0.12540884846339823, 'tp_mult': 2.8942285739110014, 'tsl_mult': 0.6362917946232096, 'strategy': 'mean_reversion', 'time_stop': 188, 'use_sma': True, 'use_atr': False, 'use_adx': False, 'use_ema': True, 'use_spike': True, 'rsi_required': True, 'edge_k': 1.365521519707249, 'edge_cap': 0.8049075641064249, 'bull_strategy': 'mean_reversion', 'bull_bb_std_mult': 0.7959641249399934, 'bull_rsi_os': 26, 'bull_rsi_ob': 86, 'bull_adx_thresh': 34.26802971600756, 'bull_atr_min_pct': 0.0054013847119679425, 'bull_atr_max_pct': 0.0630057663747759, 'bull_tp_mult': 1.1660872951215833, 'bull_tsl_mult': 0.30305309635877575, 'bull_time_stop': 58, 'bull_use_sma': True, 'bull_use_ema': True, 'bull_use_atr': False, 'bull_use_adx': False, 'bull_use_spike': False, 'bull_rsi_required': False, 'bear_strategy': 'breakout', 'bear_bb_std_mult': 2.664682103523536, 'bear_rsi_os': 42, 'bear_rsi_ob': 61, 'bear_adx_thresh': 25.647409226740766, 'bear_atr_min_pct': 0.004592150181522401, 'bear_atr_max_pct': 0.14355464493290118, 'bear_tp_mult': 1.6634628878018816, 'bear_tsl_mult': 0.09216196195565174, 'bear_time_stop': 150, 'bear_use_sma': False, 'bear_use_ema': True, 'bear_use_atr': False, 'bear_use_adx': False, 'bear_use_spike': True, 'bear_rsi_required': False, 'sideways_strategy': 'breakout', 'sideways_bb_std_mult': 2.4058524866430795, 'sideways_rsi_os': 55, 'sideways_rsi_ob': 59, 'sideways_adx_thresh': 6.0075466635729, 'sideways_atr_min_pct': 0.027406962719086585, 'sideways_atr_max_pct': 0.09676582457889635, 'sideways_tp_mult': 2.2768833317959514, 'sideways_tsl_mult': 0.6086169660290857, 'sideways_time_stop': 290, 'sideways_use_sma': True, 'sideways_use_ema': True, 'sideways_use_atr': False, 'sideways_use_adx': False, 'sideways_use_spike': False, 'sideways_rsi_required': False}.
[I 2025-08-30 14:33:23,397] Trial 104 finished with values: [-1000000000.0, 1000000000.0] and parameters: {'p_sma': 46, 'p_std': 7, 'p_atr': 15, 'p_adx': 14, 'rsi_period': 24, 'ema1': 16, 'ema2': 32, 'slip_atr_k': 0.23071981664066216, 'slip_spread_k': 0.47151229213121987, 'spread_hl_frac': 0.04666060233068629, 'bb_std_mult': 3.4263948478815722, 'rsi_os': 18, 'rsi_ob': 70, 'vol_spike': 0.029257568237182244, 'adx_thresh': 24.115330717747508, 'atr_min_pct': 0.028324350384388304, 'atr_max_pct': 0.04203162916120349, 'tp_mult': 1.9225663456808824, 'tsl_mult': 0.14025121266287321, 'strategy': 'mean_reversion', 'time_stop': 299, 'use_sma': True, 'use_atr': True, 'use_adx': True, 'use_ema': False, 'use_spike': True, 'rsi_required': True, 'edge_k': 1.3801321136690514, 'edge_cap': 0.4837237851167912, 'bull_strategy': 'mean_reversion', 'bull_bb_std_mult': 0.5850982096346271, 'bull_rsi_os': 43, 'bull_rsi_ob': 76, 'bull_adx_thresh': 19.31195579389735, 'bull_atr_min_pct': 0.014060241842343432, 'bull_atr_max_pct': 0.03385301371730558, 'bull_tp_mult': 1.5508469620832452, 'bull_tsl_mult': 0.308035753374437, 'bull_time_stop': 108, 'bull_use_sma': True, 'bull_use_ema': False, 'bull_use_atr': False, 'bull_use_adx': True, 'bull_use_spike': False, 'bull_rsi_required': False, 'bear_strategy': 'breakout', 'bear_bb_std_mult': 0.7134629108565178, 'bear_rsi_os': 11, 'bear_rsi_ob': 61, 'bear_adx_thresh': 25.56640333386756, 'bear_atr_min_pct': 0.012447072410029335, 'bear_atr_max_pct': 0.04268600231412766, 'bear_tp_mult': 1.960872842952416, 'bear_tsl_mult': 0.8211500011135577, 'bear_time_stop': 151, 'bear_use_sma': False, 'bear_use_ema': True, 'bear_use_atr': False, 'bear_use_adx': False, 'bear_use_spike': False, 'bear_rsi_required': False, 'sideways_strategy': 'mean_reversion', 'sideways_bb_std_mult': 1.9663360124839633, 'sideways_rsi_os': 52, 'sideways_rsi_ob': 66, 'sideways_adx_thresh': 25.31176086476673, 'sideways_atr_min_pct': 0.02105141916052396, 'sideways_atr_max_pct': 0.07827907793410382, 'sideways_tp_mult': 2.6643319904820952, 'sideways_tsl_mult': 0.19565994526633868, 'sideways_time_stop': 157, 'sideways_use_sma': False, 'sideways_use_ema': True, 'sideways_use_atr': False, 'sideways_use_adx': False, 'sideways_use_spike': False, 'sideways_rsi_required': False}.
[I 2025-08-30 14:33:55,811] Trial 105 finished with values: [-1000000000.0, 1000000000.0] and parameters: {'p_sma': 43, 'p_std': 17, 'p_atr': 13, 'p_adx': 14, 'rsi_period': 11, 'ema1': 16, 'ema2': 30, 'slip_atr_k': 0.22582714444072877, 'slip_spread_k': 0.5189987951470598, 'spread_hl_frac': 0.046521246100571144, 'bb_std_mult': 3.225866603644533, 'rsi_os': 23, 'rsi_ob': 70, 'vol_spike': 0.04124211607484462, 'adx_thresh': 24.145205911250333, 'atr_min_pct': 0.028267413955677997, 'atr_max_pct': 0.04324142140227725, 'tp_mult': 1.920118599037448, 'tsl_mult': 0.9342611656289566, 'strategy': 'mean_reversion', 'time_stop': 295, 'use_sma': True, 'use_atr': True, 'use_adx': False, 'use_ema': True, 'use_spike': True, 'rsi_required': True, 'edge_k': 1.3678053191134742, 'edge_cap': 0.4827863914518204, 'bull_strategy': 'mean_reversion', 'bull_bb_std_mult': 0.8128582669653646, 'bull_rsi_os': 39, 'bull_rsi_ob': 80, 'bull_adx_thresh': 18.69789283074499, 'bull_atr_min_pct': 0.01913420408755605, 'bull_atr_max_pct': 0.036293926250601856, 'bull_tp_mult': 1.536579952309394, 'bull_tsl_mult': 0.3431307708776901, 'bull_time_stop': 109, 'bull_use_sma': False, 'bull_use_ema': False, 'bull_use_atr': False, 'bull_use_adx': True, 'bull_use_spike': True, 'bull_rsi_required': False, 'bear_strategy': 'breakout', 'bear_bb_std_mult': 0.7064164523031792, 'bear_rsi_os': 13, 'bear_rsi_ob': 61, 'bear_adx_thresh': 16.36444232092646, 'bear_atr_min_pct': 0.012461604282502986, 'bear_atr_max_pct': 0.13063687054828566, 'bear_tp_mult': 2.201506679534846, 'bear_tsl_mult': 0.7935280758003392, 'bear_time_stop': 145, 'bear_use_sma': False, 'bear_use_ema': False, 'bear_use_atr': False, 'bear_use_adx': False, 'bear_use_spike': False, 'bear_rsi_required': False, 'sideways_strategy': 'breakout', 'sideways_bb_std_mult': 1.965187490080799, 'sideways_rsi_os': 47, 'sideways_rsi_ob': 66, 'sideways_adx_thresh': 25.489054495382284, 'sideways_atr_min_pct': 0.020782376253182234, 'sideways_atr_max_pct': 0.1296268258212196, 'sideways_tp_mult': 2.6815925698289513, 'sideways_tsl_mult': 0.22025507485675122, 'sideways_time_stop': 163, 'sideways_use_sma': False, 'sideways_use_ema': True, 'sideways_use_atr': False, 'sideways_use_adx': False, 'sideways_use_spike': False, 'sideways_rsi_required': False}.
[I 2025-08-30 14:33:55,921] Trial 106 finished with values: [-1000000000.0, 1000000000.0] and parameters: {'p_sma': 46, 'p_std': 19, 'p_atr': 15, 'p_adx': 14, 'rsi_period': 10, 'ema1': 16, 'ema2': 30, 'slip_atr_k': 0.07880921464955201, 'slip_spread_k': 0.5147687226539372, 'spread_hl_frac': 0.04789719504315314, 'bb_std_mult': 3.5684554790005043, 'rsi_os': 22, 'rsi_ob': 70, 'vol_spike': 0.07687097226978096, 'adx_thresh': 27.071843745448238, 'atr_min_pct': 0.028410699263448153, 'atr_max_pct': 0.04836418032314703, 'tp_mult': 1.920369566256468, 'tsl_mult': 0.21226380608925238, 'strategy': 'mean_reversion', 'time_stop': 298, 'use_sma': True, 'use_atr': True, 'use_adx': False, 'use_ema': True, 'use_spike': True, 'rsi_required': True, 'edge_k': 0.6820790634665126, 'edge_cap': 0.5431108718341828, 'bull_strategy': 'mean_reversion', 'bull_bb_std_mult': 0.515834054108442, 'bull_rsi_os': 43, 'bull_rsi_ob': 80, 'bull_adx_thresh': 19.05709154595597, 'bull_atr_min_pct': 0.0163850913029375, 'bull_atr_max_pct': 0.036312448669357275, 'bull_tp_mult': 1.535915536199805, 'bull_tsl_mult': 0.30949777128454287, 'bull_time_stop': 98, 'bull_use_sma': False, 'bull_use_ema': False, 'bull_use_atr': False, 'bull_use_adx': True, 'bull_use_spike': True, 'bull_rsi_required': False, 'bear_strategy': 'breakout', 'bear_bb_std_mult': 0.7285619462565471, 'bear_rsi_os': 10, 'bear_rsi_ob': 61, 'bear_adx_thresh': 22.575601940352364, 'bear_atr_min_pct': 0.012534884979192005, 'bear_atr_max_pct': 0.07161684269677458, 'bear_tp_mult': 2.2228814072540763, 'bear_tsl_mult': 0.78897767426573, 'bear_time_stop': 118, 'bear_use_sma': False, 'bear_use_ema': False, 'bear_use_atr': False, 'bear_use_adx': True, 'bear_use_spike': False, 'bear_rsi_required': True, 'sideways_strategy': 'breakout', 'sideways_bb_std_mult': 1.9840760308457965, 'sideways_rsi_os': 48, 'sideways_rsi_ob': 66, 'sideways_adx_thresh': 24.852474687037308, 'sideways_atr_min_pct': 0.014198988350193497, 'sideways_atr_max_pct': 0.022498280772190148, 'sideways_tp_mult': 2.647213394073561, 'sideways_tsl_mult': 0.18298063109106436, 'sideways_time_stop': 161, 'sideways_use_sma': False, 'sideways_use_ema': True, 'sideways_use_atr': False, 'sideways_use_adx': False, 'sideways_use_spike': False, 'sideways_rsi_required': True}.
[I 2025-08-30 14:33:56,017] Trial 107 finished with values: [-1000000000.0, 1000000000.0] and parameters: {'p_sma': 46, 'p_std': 52, 'p_atr': 15, 'p_adx': 14, 'rsi_period': 11, 'ema1': 18, 'ema2': 30, 'slip_atr_k': 0.1774083472987693, 'slip_spread_k': 0.5156175865880861, 'spread_hl_frac': 0.04715535743639185, 'bb_std_mult': 3.5962389692768486, 'rsi_os': 22, 'rsi_ob': 68, 'vol_spike': 0.0760744542905516, 'adx_thresh': 24.25772943003334, 'atr_min_pct': 0.028270964313513204, 'atr_max_pct': 0.045518832560027506, 'tp_mult': 1.9259822523616998, 'tsl_mult': 0.13417673390007565, 'strategy': 'mean_reversion', 'time_stop': 298, 'use_sma': True, 'use_atr': True, 'use_adx': True, 'use_ema': True, 'use_spike': True, 'rsi_required': True, 'edge_k': 0.9938659017381838, 'edge_cap': 0.5230358376439342, 'bull_strategy': 'mean_reversion', 'bull_bb_std_mult': 0.5751817384090878, 'bull_rsi_os': 39, 'bull_rsi_ob': 75, 'bull_adx_thresh': 19.373764778451715, 'bull_atr_min_pct': 0.01787827677999978, 'bull_atr_max_pct': 0.03536525789401953, 'bull_tp_mult': 1.5316922237036417, 'bull_tsl_mult': 0.33376429226127463, 'bull_time_stop': 106, 'bull_use_sma': False, 'bull_use_ema': False, 'bull_use_atr': False, 'bull_use_adx': True, 'bull_use_spike': True, 'bull_rsi_required': False, 'bear_strategy': 'breakout', 'bear_bb_std_mult': 0.7207757654750987, 'bear_rsi_os': 15, 'bear_rsi_ob': 60, 'bear_adx_thresh': 22.58838987011869, 'bear_atr_min_pct': 0.01275870988251737, 'bear_atr_max_pct': 0.12171767567187114, 'bear_tp_mult': 2.184919294458546, 'bear_tsl_mult': 0.8247658511549922, 'bear_time_stop': 300, 'bear_use_sma': False, 'bear_use_ema': False, 'bear_use_atr': False, 'bear_use_adx': True, 'bear_use_spike': False, 'bear_rsi_required': True, 'sideways_strategy': 'breakout', 'sideways_bb_std_mult': 1.9668069868050757, 'sideways_rsi_os': 47, 'sideways_rsi_ob': 67, 'sideways_adx_thresh': 24.801498236222667, 'sideways_atr_min_pct': 0.021020460507046104, 'sideways_atr_max_pct': 0.07898007726532448, 'sideways_tp_mult': 2.6572409707918, 'sideways_tsl_mult': 0.19239242731213357, 'sideways_time_stop': 160, 'sideways_use_sma': False, 'sideways_use_ema': True, 'sideways_use_atr': False, 'sideways_use_adx': False, 'sideways_use_spike': False, 'sideways_rsi_required': True}.
