[I 2025-08-30 15:56:54,122] Trial 601 finished with values: [-1000000000.0, 1000000000.0] and parameters: {'p_sma': 8, 'p_std': 51, 'p_atr': 9, 'p_adx': 16, 'rsi_period': 12, 'ema1': 24, 'ema2': 37, 'slip_atr_k': 0.1416017202907421, 'slip_spread_k': 0.6972034542249177, 'spread_hl_frac': 0.01163977568161116, 'bb_std_mult': 1.9199785036630166, 'rsi_os': 29, 'rsi_ob': 61, 'vol_spike': 0.22347609733156384, 'adx_thresh': 9.633852741780087, 'atr_min_pct': 0.00531949203611938, 'atr_max_pct': 0.11613217315620698, 'tp_mult': 2.7946018463998583, 'tsl_mult': 0.3914490663087102, 'strategy': 'breakout', 'time_stop': 143, 'use_sma': True, 'use_atr': True, 'use_adx': False, 'use_ema': False, 'use_spike': False, 'rsi_required': False, 'edge_k': 0.5473701943971633, 'edge_cap': 0.985492408960687, 'bull_strategy': 'breakout', 'bull_bb_std_mult': 1.499375182845057, 'bull_rsi_os': 12, 'bull_rsi_ob': 74, 'bull_adx_thresh': 8.953216380120143, 'bull_atr_min_pct': 0.02011253675260046, 'bull_atr_max_pct': 0.09730344778183977, 'bull_tp_mult': 2.4813965332885353, 'bull_tsl_mult': 0.8516912821671688, 'bull_time_stop': 61, 'bull_use_sma': False, 'bull_use_ema': True, 'bull_use_atr': True, 'bull_use_adx': True, 'bull_use_spike': False, 'bull_rsi_required': False, 'bear_strategy': 'mean_reversion', 'bear_bb_std_mult': 0.605332240070306, 'bear_rsi_os': 26, 'bear_rsi_ob': 76, 'bear_adx_thresh': 14.190932545261118, 'bear_atr_min_pct': 0.0037975778050900635, 'bear_atr_max_pct': 0.11421213029962225, 'bear_tp_mult': 2.6443422085799417, 'bear_tsl_mult': 0.8248131608464151, 'bear_time_stop': 165, 'bear_use_sma': False, 'bear_use_ema': False, 'bear_use_atr': False, 'bear_use_adx': False, 'bear_use_spike': True, 'bear_rsi_required': True, 'sideways_strategy': 'mean_reversion', 'sideways_bb_std_mult': 2.5959533285257677, 'sideways_rsi_os': 16, 'sideways_rsi_ob': 81, 'sideways_adx_thresh': 10.562858139470116, 'sideways_atr_min_pct': 0.019693726722249193, 'sideways_atr_max_pct': 0.057681273416218266, 'sideways_tp_mult': 1.6529873658277836, 'sideways_tsl_mult': 0.2960058396791073, 'sideways_time_stop': 5, 'sideways_use_sma': True, 'sideways_use_ema': False, 'sideways_use_atr': False, 'sideways_use_adx': False, 'sideways_use_spike': True, 'sideways_rsi_required': True}.
[I 2025-08-30 15:56:54,826] Trial 602 finished with values: [-1000000000.0, 1000000000.0] and parameters: {'p_sma': 8, 'p_std': 46, 'p_atr': 13, 'p_adx': 15, 'rsi_period': 35, 'ema1': 24, 'ema2': 27, 'slip_atr_k': 0.14319718153168073, 'slip_spread_k': 0.697667975507518, 'spread_hl_frac': 0.006776603812906373, 'bb_std_mult': 0.6842920120139033, 'rsi_os': 28, 'rsi_ob': 89, 'vol_spike': 0.2203840381683764, 'adx_thresh': 5.042232803968018, 'atr_min_pct': 0.005935978180349475, 'atr_max_pct': 0.12382578791147175, 'tp_mult': 1.6183215789345753, 'tsl_mult': 0.38962848318011156, 'strategy': 'breakout', 'time_stop': 219, 'use_sma': True, 'use_atr': True, 'use_adx': False, 'use_ema': False, 'use_spike': False, 'rsi_required': False, 'edge_k': 1.1107048069815961, 'edge_cap': 0.10427065104490746, 'bull_strategy': 'breakout', 'bull_bb_std_mult': 1.7204849328950895, 'bull_rsi_os': 50, 'bull_rsi_ob': 74, 'bull_adx_thresh': 27.847973529238185, 'bull_atr_min_pct': 0.02008189090734993, 'bull_atr_max_pct': 0.09689053001650043, 'bull_tp_mult': 2.5267814070108727, 'bull_tsl_mult': 0.8279110833265498, 'bull_time_stop': 58, 'bull_use_sma': False, 'bull_use_ema': True, 'bull_use_atr': True, 'bull_use_adx': True, 'bull_use_spike': False, 'bull_rsi_required': False, 'bear_strategy': 'mean_reversion', 'bear_bb_std_mult': 1.9176154680289033, 'bear_rsi_os': 24, 'bear_rsi_ob': 76, 'bear_adx_thresh': 25.8369179067336, 'bear_atr_min_pct': 0.003531488103570465, 'bear_atr_max_pct': 0.1137555045232431, 'bear_tp_mult': 2.118690081804175, 'bear_tsl_mult': 0.7976444979791527, 'bear_time_stop': 34, 'bear_use_sma': True, 'bear_use_ema': False, 'bear_use_atr': False, 'bear_use_adx': False, 'bear_use_spike': True, 'bear_rsi_required': True, 'sideways_strategy': 'mean_reversion', 'sideways_bb_std_mult': 3.122286296759871, 'sideways_rsi_os': 51, 'sideways_rsi_ob': 77, 'sideways_adx_thresh': 11.877458593412433, 'sideways_atr_min_pct': 0.010792077027620941, 'sideways_atr_max_pct': 0.07010478934562725, 'sideways_tp_mult': 1.441526982892145, 'sideways_tsl_mult': 0.6871890828455511, 'sideways_time_stop': 135, 'sideways_use_sma': True, 'sideways_use_ema': False, 'sideways_use_atr': False, 'sideways_use_adx': False, 'sideways_use_spike': True, 'sideways_rsi_required': True}.
[I 2025-08-30 15:56:55,110] Trial 605 finished with values: [-0.019235063919925022, 0.01936587383086724] and parameters: {'p_sma': 11, 'p_std': 19, 'p_atr': 21, 'p_adx': 25, 'rsi_period': 9, 'ema1': 21, 'ema2': 35, 'slip_atr_k': 0.007993839009552146, 'slip_spread_k': 0.7158567486365252, 'spread_hl_frac': 0.0047622550183656805, 'bb_std_mult': 0.500557265337059, 'rsi_os': 30, 'rsi_ob': 47, 'vol_spike': 0.2067584209411942, 'adx_thresh': 9.823771414861977, 'atr_min_pct': 0.00599548727790383, 'atr_max_pct': 0.12311015823686736, 'tp_mult': 1.4978379512836657, 'tsl_mult': 0.39550730914978954, 'strategy': 'breakout', 'time_stop': 217, 'use_sma': False, 'use_atr': False, 'use_adx': True, 'use_ema': True, 'use_spike': False, 'rsi_required': True, 'edge_k': 1.4533439184626376, 'edge_cap': 0.943314804113764, 'bull_strategy': 'mean_reversion', 'bull_bb_std_mult': 1.5298686619481119, 'bull_rsi_os': 50, 'bull_rsi_ob': 87, 'bull_adx_thresh': 6.325132753182162, 'bull_atr_min_pct': 0.019297099668334435, 'bull_atr_max_pct': 0.0684123064045129, 'bull_tp_mult': 2.4255694656544793, 'bull_tsl_mult': 0.8511479688736454, 'bull_time_stop': 77, 'bull_use_sma': False, 'bull_use_ema': True, 'bull_use_atr': True, 'bull_use_adx': True, 'bull_use_spike': False, 'bull_rsi_required': False, 'bear_strategy': 'breakout', 'bear_bb_std_mult': 1.8426043615055188, 'bear_rsi_os': 43, 'bear_rsi_ob': 55, 'bear_adx_thresh': 14.808482691849775, 'bear_atr_min_pct': 0.0022701034436295735, 'bear_atr_max_pct': 0.1006371583855841, 'bear_tp_mult': 2.6438842404803795, 'bear_tsl_mult': 0.8634063552005959, 'bear_time_stop': 168, 'bear_use_sma': True, 'bear_use_ema': False, 'bear_use_atr': True, 'bear_use_adx': True, 'bear_use_spike': True, 'bear_rsi_required': False, 'sideways_strategy': 'mean_reversion', 'sideways_bb_std_mult': 2.2866009925881814, 'sideways_rsi_os': 28, 'sideways_rsi_ob': 81, 'sideways_adx_thresh': 11.312801878780192, 'sideways_atr_min_pct': 0.019712553247019184, 'sideways_atr_max_pct': 0.0699944102418065, 'sideways_tp_mult': 2.5286375075379635, 'sideways_tsl_mult': 0.4893664970226921, 'sideways_time_stop': 136, 'sideways_use_sma': True, 'sideways_use_ema': False, 'sideways_use_atr': True, 'sideways_use_adx': True, 'sideways_use_spike': True, 'sideways_rsi_required': True}.
[I 2025-08-30 15:56:56,304] Trial 608 finished with values: [-1000000000.0, 1000000000.0] and parameters: {'p_sma': 26, 'p_std': 20, 'p_atr': 14, 'p_adx': 13, 'rsi_period': 10, 'ema1': 27, 'ema2': 35, 'slip_atr_k': 0.00806662066865594, 'slip_spread_k': 0.6349104387516447, 'spread_hl_frac': 0.005153872404841268, 'bb_std_mult': 2.245825751648543, 'rsi_os': 53, 'rsi_ob': 85, 'vol_spike': 0.1412551835696007, 'adx_thresh': 8.727803984402472, 'atr_min_pct': 0.007413113864478948, 'atr_max_pct': 0.11012927795971872, 'tp_mult': 1.8798138938430993, 'tsl_mult': 0.9322932312969543, 'strategy': 'mean_reversion', 'time_stop': 159, 'use_sma': False, 'use_atr': False, 'use_adx': True, 'use_ema': True, 'use_spike': True, 'rsi_required': True, 'edge_k': 0.5913311814329207, 'edge_cap': 0.9464498765540283, 'bull_strategy': 'mean_reversion', 'bull_bb_std_mult': 1.6559168788591343, 'bull_rsi_os': 7, 'bull_rsi_ob': 87, 'bull_adx_thresh': 9.54000893390825, 'bull_atr_min_pct': 0.01918687583594579, 'bull_atr_max_pct': 0.10420137457939856, 'bull_tp_mult': 2.606080816820704, 'bull_tsl_mult': 0.8535150024762839, 'bull_time_stop': 76, 'bull_use_sma': True, 'bull_use_ema': True, 'bull_use_atr': True, 'bull_use_adx': True, 'bull_use_spike': True, 'bull_rsi_required': True, 'bear_strategy': 'breakout', 'bear_bb_std_mult': 2.264682986522121, 'bear_rsi_os': 26, 'bear_rsi_ob': 54, 'bear_adx_thresh': 14.857834216513561, 'bear_atr_min_pct': 0.013473135926324598, 'bear_atr_max_pct': 0.10028460342850648, 'bear_tp_mult': 1.6145420483698971, 'bear_tsl_mult': 0.8653287777526831, 'bear_time_stop': 198, 'bear_use_sma': True, 'bear_use_ema': False, 'bear_use_atr': True, 'bear_use_adx': True, 'bear_use_spike': True, 'bear_rsi_required': False, 'sideways_strategy': 'mean_reversion', 'sideways_bb_std_mult': 2.270465299535906, 'sideways_rsi_os': 27, 'sideways_rsi_ob': 78, 'sideways_adx_thresh': 14.144240603510594, 'sideways_atr_min_pct': 0.019165740912812514, 'sideways_atr_max_pct': 0.06321004870387455, 'sideways_tp_mult': 1.566474474313555, 'sideways_tsl_mult': 0.4006868695970339, 'sideways_time_stop': 248, 'sideways_use_sma': True, 'sideways_use_ema': False, 'sideways_use_atr': True, 'sideways_use_adx': True, 'sideways_use_spike': True, 'sideways_rsi_required': True}.
[I 2025-08-30 15:57:35,342] Trial 606 finished with values: [-1000000000.0, 1000000000.0] and parameters: {'p_sma': 7, 'p_std': 20, 'p_atr': 12, 'p_adx': 13, 'rsi_period': 34, 'ema1': 23, 'ema2': 37, 'slip_atr_k': 0.14263523599506917, 'slip_spread_k': 0.8823168621548877, 'spread_hl_frac': 0.004937710478147429, 'bb_std_mult': 0.614020938780865, 'rsi_os': 50, 'rsi_ob': 63, 'vol_spike': 0.2139217632907138, 'adx_thresh': 8.820824022371067, 'atr_min_pct': 0.005955540619734363, 'atr_max_pct': 0.11160628309032418, 'tp_mult': 1.4953531334635943, 'tsl_mult': 0.3455716965778637, 'strategy': 'breakout', 'time_stop': 198, 'use_sma': False, 'use_atr': False, 'use_adx': True, 'use_ema': True, 'use_spike': False, 'rsi_required': True, 'edge_k': 0.4943520750462017, 'edge_cap': 0.9399977075089481, 'bull_strategy': 'mean_reversion', 'bull_bb_std_mult': 3.1161692922538364, 'bull_rsi_os': 13, 'bull_rsi_ob': 87, 'bull_adx_thresh': 25.83792602165879, 'bull_atr_min_pct': 0.019149651077872858, 'bull_atr_max_pct': 0.10320952027739388, 'bull_tp_mult': 2.428897598853572, 'bull_tsl_mult': 0.861595935303451, 'bull_time_stop': 62, 'bull_use_sma': True, 'bull_use_ema': True, 'bull_use_atr': True, 'bull_use_adx': True, 'bull_use_spike': True, 'bull_rsi_required': True, 'bear_strategy': 'breakout', 'bear_bb_std_mult': 1.8358310444060186, 'bear_rsi_os': 24, 'bear_rsi_ob': 77, 'bear_adx_thresh': 25.677309455305664, 'bear_atr_min_pct': 0.0031204397064996956, 'bear_atr_max_pct': 0.1001701836981807, 'bear_tp_mult': 2.653351449254288, 'bear_tsl_mult': 0.8574594352541959, 'bear_time_stop': 5, 'bear_use_sma': True, 'bear_use_ema': False, 'bear_use_atr': True, 'bear_use_adx': True, 'bear_use_spike': True, 'bear_rsi_required': False, 'sideways_strategy': 'mean_reversion', 'sideways_bb_std_mult': 3.1782223363822144, 'sideways_rsi_os': 55, 'sideways_rsi_ob': 81, 'sideways_adx_thresh': 9.730182978063507, 'sideways_atr_min_pct': 0.01968711920038247, 'sideways_atr_max_pct': 0.06275663050034097, 'sideways_tp_mult': 1.4336709417516496, 'sideways_tsl_mult': 0.681292897298421, 'sideways_time_stop': 130, 'sideways_use_sma': True, 'sideways_use_ema': False, 'sideways_use_atr': True, 'sideways_use_adx': True, 'sideways_use_spike': True, 'sideways_rsi_required': True}.
[I 2025-08-30 15:57:36,294] Trial 607 finished with values: [-1000000000.0, 1000000000.0] and parameters: {'p_sma': 11, 'p_std': 20, 'p_atr': 21, 'p_adx': 19, 'rsi_period': 35, 'ema1': 23, 'ema2': 14, 'slip_atr_k': 0.0069807256345199, 'slip_spread_k': 0.7304966122815073, 'spread_hl_frac': 0.004943122339774028, 'bb_std_mult': 0.6361214422857749, 'rsi_os': 26, 'rsi_ob': 85, 'vol_spike': 0.2137164316711581, 'adx_thresh': 8.817084475699081, 'atr_min_pct': 0.006050686852519011, 'atr_max_pct': 0.05359561301821167, 'tp_mult': 1.5048924731743651, 'tsl_mult': 0.3408720374581259, 'strategy': 'breakout', 'time_stop': 24, 'use_sma': False, 'use_atr': False, 'use_adx': True, 'use_ema': True, 'use_spike': True, 'rsi_required': True, 'edge_k': 0.5858042416808635, 'edge_cap': 0.9446009831578884, 'bull_strategy': 'mean_reversion', 'bull_bb_std_mult': 1.7290930155596675, 'bull_rsi_os': 50, 'bull_rsi_ob': 87, 'bull_adx_thresh': 25.81564119600538, 'bull_atr_min_pct': 0.019279232885341373, 'bull_atr_max_pct': 0.10375824295523398, 'bull_tp_mult': 2.6055318939405017, 'bull_tsl_mult': 0.40857210838632874, 'bull_time_stop': 220, 'bull_use_sma': True, 'bull_use_ema': True, 'bull_use_atr': True, 'bull_use_adx': True, 'bull_use_spike': True, 'bull_rsi_required': True, 'bear_strategy': 'breakout', 'bear_bb_std_mult': 2.278721777958873, 'bear_rsi_os': 24, 'bear_rsi_ob': 73, 'bear_adx_thresh': 15.560424534293062, 'bear_atr_min_pct': 0.004462042189680317, 'bear_atr_max_pct': 0.10092998620628678, 'bear_tp_mult': 2.676201972264918, 'bear_tsl_mult': 0.8598372507048573, 'bear_time_stop': 62, 'bear_use_sma': True, 'bear_use_ema': False, 'bear_use_atr': True, 'bear_use_adx': True, 'bear_use_spike': True, 'bear_rsi_required': False, 'sideways_strategy': 'mean_reversion', 'sideways_bb_std_mult': 3.292341488345145, 'sideways_rsi_os': 28, 'sideways_rsi_ob': 78, 'sideways_adx_thresh': 8.551037061188158, 'sideways_atr_min_pct': 0.009315560934504872, 'sideways_atr_max_pct': 0.028058429744760117, 'sideways_tp_mult': 1.2151260339166274, 'sideways_tsl_mult': 0.4101157396735272, 'sideways_time_stop': 121, 'sideways_use_sma': True, 'sideways_use_ema': False, 'sideways_use_atr': True, 'sideways_use_adx': True, 'sideways_use_spike': True, 'sideways_rsi_required': True}.
[I 2025-08-30 15:57:36,671] Trial 609 finished with values: [-1000000000.0, 1000000000.0] and parameters: {'p_sma': 48, 'p_std': 20, 'p_atr': 12, 'p_adx': 11, 'rsi_period': 10, 'ema1': 23, 'ema2': 17, 'slip_atr_k': 0.008315216723457568, 'slip_spread_k': 0.8713780879197391, 'spread_hl_frac': 0.025450603270090962, 'bb_std_mult': 0.6390954817475979, 'rsi_os': 26, 'rsi_ob': 63, 'vol_spike': 0.048133975726989464, 'adx_thresh': 8.765463421882624, 'atr_min_pct': 0.01788784572869549, 'atr_max_pct': 0.05409819894029107, 'tp_mult': 1.8622783625890198, 'tsl_mult': 0.32797620660813, 'strategy': 'mean_reversion', 'time_stop': 97, 'use_sma': False, 'use_atr': False, 'use_adx': True, 'use_ema': True, 'use_spike': True, 'rsi_required': True, 'edge_k': 0.4986671229779816, 'edge_cap': 0.25335365580613683, 'bull_strategy': 'mean_reversion', 'bull_bb_std_mult': 1.642243129006658, 'bull_rsi_os': 46, 'bull_rsi_ob': 61, 'bull_adx_thresh': 9.546113207522682, 'bull_atr_min_pct': 0.018792922076390245, 'bull_atr_max_pct': 0.10394338153473709, 'bull_tp_mult': 2.607213383244523, 'bull_tsl_mult': 0.5218577204033414, 'bull_time_stop': 220, 'bull_use_sma': True, 'bull_use_ema': True, 'bull_use_atr': True, 'bull_use_adx': True, 'bull_use_spike': True, 'bull_rsi_required': True, 'bear_strategy': 'breakout', 'bear_bb_std_mult': 1.6765734944962607, 'bear_rsi_os': 45, 'bear_rsi_ob': 73, 'bear_adx_thresh': 15.621451935666178, 'bear_atr_min_pct': 0.013289532388587195, 'bear_atr_max_pct': 0.07267093860292059, 'bear_tp_mult': 1.1288034056737555, 'bear_tsl_mult': 0.9399806463873551, 'bear_time_stop': 103, 'bear_use_sma': True, 'bear_use_ema': False, 'bear_use_atr': True, 'bear_use_adx': True, 'bear_use_spike': True, 'bear_rsi_required': False, 'sideways_strategy': 'mean_reversion', 'sideways_bb_std_mult': 3.1725154209832676, 'sideways_rsi_os': 18, 'sideways_rsi_ob': 78, 'sideways_adx_thresh': 9.747364582226, 'sideways_atr_min_pct': 0.021446626311713565, 'sideways_atr_max_pct': 0.063173848802731, 'sideways_tp_mult': 2.711924495588139, 'sideways_tsl_mult': 0.40801239522016014, 'sideways_time_stop': 120, 'sideways_use_sma': True, 'sideways_use_ema': False, 'sideways_use_atr': True, 'sideways_use_adx': True, 'sideways_use_spike': True, 'sideways_rsi_required': True}.
[I 2025-08-30 15:57:38,129] Trial 610 finished with values: [-1000000000.0, 1000000000.0] and parameters: {'p_sma': 35, 'p_std': 18, 'p_atr': 12, 'p_adx': 24, 'rsi_period': 81, 'ema1': 23, 'ema2': 25, 'slip_atr_k': 0.0048554622353540805, 'slip_spread_k': 0.7400025408048234, 'spread_hl_frac': 0.008162802105248822, 'bb_std_mult': 0.6295661380691485, 'rsi_os': 26, 'rsi_ob': 81, 'vol_spike': 0.2156171360741667, 'adx_thresh': 28.450691932830132, 'atr_min_pct': 0.007208435335550182, 'atr_max_pct': 0.012328648010424464, 'tp_mult': 1.5768017592325523, 'tsl_mult': 0.3447484251214432, 'strategy': 'breakout', 'time_stop': 186, 'use_sma': False, 'use_atr': False, 'use_adx': True, 'use_ema': False, 'use_spike': False, 'rsi_required': False, 'edge_k': 0.48484159194881105, 'edge_cap': 0.9108488381475841, 'bull_strategy': 'breakout', 'bull_bb_std_mult': 3.2301287171317794, 'bull_rsi_os': 52, 'bull_rsi_ob': 88, 'bull_adx_thresh': 25.996340637053947, 'bull_atr_min_pct': 0.01830120097510714, 'bull_atr_max_pct': 0.028985772624259394, 'bull_tp_mult': 2.594924358775109, 'bull_tsl_mult': 0.8912255116657236, 'bull_time_stop': 52, 'bull_use_sma': True, 'bull_use_ema': True, 'bull_use_atr': True, 'bull_use_adx': True, 'bull_use_spike': True, 'bull_rsi_required': True, 'bear_strategy': 'mean_reversion', 'bear_bb_std_mult': 1.6791435314518621, 'bear_rsi_os': 28, 'bear_rsi_ob': 92, 'bear_adx_thresh': 15.775577490448951, 'bear_atr_min_pct': 0.002938946418299082, 'bear_atr_max_pct': 0.1093850841114758, 'bear_tp_mult': 2.687010590574337, 'bear_tsl_mult': 0.9354562749399331, 'bear_time_stop': 106, 'bear_use_sma': True, 'bear_use_ema': False, 'bear_use_atr': True, 'bear_use_adx': True, 'bear_use_spike': True, 'bear_rsi_required': True, 'sideways_strategy': 'breakout', 'sideways_bb_std_mult': 3.281609868446539, 'sideways_rsi_os': 7, 'sideways_rsi_ob': 75, 'sideways_adx_thresh': 8.414946762436143, 'sideways_atr_min_pct': 0.009397461141183571, 'sideways_atr_max_pct': 0.06740694707902849, 'sideways_tp_mult': 2.718243787593269, 'sideways_tsl_mult': 0.6352146190127733, 'sideways_time_stop': 122, 'sideways_use_sma': True, 'sideways_use_ema': True, 'sideways_use_atr': True, 'sideways_use_adx': True, 'sideways_use_spike': True, 'sideways_rsi_required': True}.
[I 2025-08-30 15:58:22,814] Trial 614 finished with values: [-1000000000.0, 1000000000.0] and parameters: {'p_sma': 10, 'p_std': 48, 'p_atr': 28, 'p_adx': 22, 'rsi_period': 10, 'ema1': 26, 'ema2': 12, 'slip_atr_k': 0.1759803513950659, 'slip_spread_k': 0.7186171124166947, 'spread_hl_frac': 0.03489514271046451, 'bb_std_mult': 2.6779753769883374, 'rsi_os': 32, 'rsi_ob': 86, 'vol_spike': 0.20255678300720523, 'adx_thresh': 7.898423111614343, 'atr_min_pct': 0.02740897766873525, 'atr_max_pct': 0.14141306517368332, 'tp_mult': 1.9271644176833034, 'tsl_mult': 0.29958206941970517, 'strategy': 'breakout', 'time_stop': 152, 'use_sma': False, 'use_atr': False, 'use_adx': True, 'use_ema': False, 'use_spike': False, 'rsi_required': False, 'edge_k': 0.6308182991745935, 'edge_cap': 0.9693516746721433, 'bull_strategy': 'breakout', 'bull_bb_std_mult': 1.5948949661982228, 'bull_rsi_os': 10, 'bull_rsi_ob': 89, 'bull_adx_thresh': 24.125704556803328, 'bull_atr_min_pct': 0.014205440108034349, 'bull_atr_max_pct': 0.09999272757473622, 'bull_tp_mult': 1.78016097907988, 'bull_tsl_mult': 0.9133716739359462, 'bull_time_stop': 44, 'bull_use_sma': True, 'bull_use_ema': False, 'bull_use_atr': False, 'bull_use_adx': True, 'bull_use_spike': True, 'bull_rsi_required': False, 'bear_strategy': 'mean_reversion', 'bear_bb_std_mult': 1.864010396179939, 'bear_rsi_os': 16, 'bear_rsi_ob': 78, 'bear_adx_thresh': 13.738060225656115, 'bear_atr_min_pct': 0.0007068390200120917, 'bear_atr_max_pct': 0.10649731696239505, 'bear_tp_mult': 2.738907644388602, 'bear_tsl_mult': 0.23231049054565478, 'bear_time_stop': 17, 'bear_use_sma': True, 'bear_use_ema': True, 'bear_use_atr': True, 'bear_use_adx': True, 'bear_use_spike': False, 'bear_rsi_required': True, 'sideways_strategy': 'breakout', 'sideways_bb_std_mult': 3.0184584534470162, 'sideways_rsi_os': 14, 'sideways_rsi_ob': 80, 'sideways_adx_thresh': 11.247186469273228, 'sideways_atr_min_pct': 0.021045315476532753, 'sideways_atr_max_pct': 0.0733892490642783, 'sideways_tp_mult': 1.8778612816225704, 'sideways_tsl_mult': 0.4378906608762316, 'sideways_time_stop': 144, 'sideways_use_sma': False, 'sideways_use_ema': True, 'sideways_use_atr': True, 'sideways_use_adx': True, 'sideways_use_spike': False, 'sideways_rsi_required': False}.
