[I 2025-08-30 14:38:41,426] Trial 144 finished with values: [-0.0467600142654947, 0.04686350942897182] and parameters: {'p_sma': 60, 'p_std': 6, 'p_atr': 29, 'p_adx': 25, 'rsi_period': 18, 'ema1': 5, 'ema2': 31, 'slip_atr_k': 0.0746724145082273, 'slip_spread_k': 0.5086155874367412, 'spread_hl_frac': 0.04703363453619775, 'bb_std_mult': 2.130736074759776, 'rsi_os': 30, 'rsi_ob': 78, 'vol_spike': 0.1106845196434385, 'adx_thresh': 17.276311282371466, 'atr_min_pct': 0.019014845878290113, 'atr_max_pct': 0.08298498688868125, 'tp_mult': 1.9639667730388455, 'tsl_mult': 0.10852015283056637, 'strategy': 'mean_reversion', 'time_stop': 77, 'use_sma': True, 'use_atr': True, 'use_adx': False, 'use_ema': True, 'use_spike': True, 'rsi_required': False, 'edge_k': 0.012810775272056651, 'edge_cap': 0.27413758227961166, 'bull_strategy': 'mean_reversion', 'bull_bb_std_mult': 2.5347323960204853, 'bull_rsi_os': 12, 'bull_rsi_ob': 77, 'bull_adx_thresh': 29.161761836401627, 'bull_atr_min_pct': 0.017334989812555726, 'bull_atr_max_pct': 0.05930483049249055, 'bull_tp_mult': 1.2258612411876548, 'bull_tsl_mult': 0.3603135784298799, 'bull_time_stop': 231, 'bull_use_sma': False, 'bull_use_ema': False, 'bull_use_atr': False, 'bull_use_adx': True, 'bull_use_spike': False, 'bull_rsi_required': True, 'bear_strategy': 'breakout', 'bear_bb_std_mult': 1.228964055760882, 'bear_rsi_os': 44, 'bear_rsi_ob': 62, 'bear_adx_thresh': 8.08597455494534, 'bear_atr_min_pct': 1.3216463832118469e-05, 'bear_atr_max_pct': 0.1427413093924642, 'bear_tp_mult': 1.0510911728432224, 'bear_tsl_mult': 0.7973140707811182, 'bear_time_stop': 159, 'bear_use_sma': False, 'bear_use_ema': False, 'bear_use_atr': False, 'bear_use_adx': True, 'bear_use_spike': False, 'bear_rsi_required': False, 'sideways_strategy': 'mean_reversion', 'sideways_bb_std_mult': 1.2554945883540363, 'sideways_rsi_os': 49, 'sideways_rsi_ob': 72, 'sideways_adx_thresh': 19.28695612217787, 'sideways_atr_min_pct': 0.00544022746762699, 'sideways_atr_max_pct': 0.14551953749579438, 'sideways_tp_mult': 1.1847799570381858, 'sideways_tsl_mult': 0.07037696447537378, 'sideways_time_stop': 102, 'sideways_use_sma': False, 'sideways_use_ema': False, 'sideways_use_atr': False, 'sideways_use_adx': False, 'sideways_use_spike': False, 'sideways_rsi_required': False}.
[I 2025-08-30 14:38:42,054] Trial 146 finished with values: [-1000000000.0, 1000000000.0] and parameters: {'p_sma': 24, 'p_std': 9, 'p_atr': 14, 'p_adx': 7, 'rsi_period': 21, 'ema1': 15, 'ema2': 31, 'slip_atr_k': 0.07832789836348354, 'slip_spread_k': 0.5008132520238601, 'spread_hl_frac': 0.046691789440207625, 'bb_std_mult': 2.671267325320795, 'rsi_os': 31, 'rsi_ob': 78, 'vol_spike': 0.08726452010372208, 'adx_thresh': 23.57572334677507, 'atr_min_pct': 0.0189394881414335, 'atr_max_pct': 0.0776867220969232, 'tp_mult': 1.674839657163132, 'tsl_mult': 0.05681299839895354, 'strategy': 'mean_reversion', 'time_stop': 113, 'use_sma': True, 'use_atr': True, 'use_adx': False, 'use_ema': True, 'use_spike': True, 'rsi_required': False, 'edge_k': 1.0597929153104448, 'edge_cap': 0.10906346942280676, 'bull_strategy': 'breakout', 'bull_bb_std_mult': 0.5035154236368427, 'bull_rsi_os': 35, 'bull_rsi_ob': 77, 'bull_adx_thresh': 17.356084298715256, 'bull_atr_min_pct': 0.016336944812666815, 'bull_atr_max_pct': 0.06537815960699875, 'bull_tp_mult': 1.2569770990735463, 'bull_tsl_mult': 0.30325834337192553, 'bull_time_stop': 125, 'bull_use_sma': False, 'bull_use_ema': False, 'bull_use_atr': False, 'bull_use_adx': True, 'bull_use_spike': False, 'bull_rsi_required': True, 'bear_strategy': 'mean_reversion', 'bear_bb_std_mult': 1.1178508983411086, 'bear_rsi_os': 17, 'bear_rsi_ob': 62, 'bear_adx_thresh': 17.460791151744356, 'bear_atr_min_pct': 0.012818376652231723, 'bear_atr_max_pct': 0.011376367390485753, 'bear_tp_mult': 1.9909313791626317, 'bear_tsl_mult': 0.8073997084681256, 'bear_time_stop': 162, 'bear_use_sma': False, 'bear_use_ema': True, 'bear_use_atr': False, 'bear_use_adx': False, 'bear_use_spike': False, 'bear_rsi_required': False, 'sideways_strategy': 'mean_reversion', 'sideways_bb_std_mult': 1.2850055856430922, 'sideways_rsi_os': 49, 'sideways_rsi_ob': 52, 'sideways_adx_thresh': 29.973133644378816, 'sideways_atr_min_pct': 0.0053162174610178435, 'sideways_atr_max_pct': 0.01253517925338366, 'sideways_tp_mult': 2.9601050383246603, 'sideways_tsl_mult': 0.08004927754868282, 'sideways_time_stop': 126, 'sideways_use_sma': False, 'sideways_use_ema': False, 'sideways_use_atr': False, 'sideways_use_adx': True, 'sideways_use_spike': True, 'sideways_rsi_required': False}.
[I 2025-08-30 14:38:42,187] Trial 145 finished with values: [-1000000000.0, 1000000000.0] and parameters: {'p_sma': 23, 'p_std': 9, 'p_atr': 14, 'p_adx': 25, 'rsi_period': 17, 'ema1': 15, 'ema2': 47, 'slip_atr_k': 0.2382368840499038, 'slip_spread_k': 0.4966260611469071, 'spread_hl_frac': 0.04720041019068379, 'bb_std_mult': 3.5290852590617754, 'rsi_os': 18, 'rsi_ob': 78, 'vol_spike': 0.08388779105847567, 'adx_thresh': 22.828436674028392, 'atr_min_pct': 0.0187782297623648, 'atr_max_pct': 0.029280991558816718, 'tp_mult': 1.972920101126634, 'tsl_mult': 0.0612028766914651, 'strategy': 'mean_reversion', 'time_stop': 293, 'use_sma': True, 'use_atr': True, 'use_adx': False, 'use_ema': True, 'use_spike': True, 'rsi_required': False, 'edge_k': 1.9405737182764586, 'edge_cap': 0.1228895036081043, 'bull_strategy': 'mean_reversion', 'bull_bb_std_mult': 2.740761206444742, 'bull_rsi_os': 13, 'bull_rsi_ob': 82, 'bull_adx_thresh': 10.77782067556951, 'bull_atr_min_pct': 0.01980599002156942, 'bull_atr_max_pct': 0.03241362202457645, 'bull_tp_mult': 1.2095617195905433, 'bull_tsl_mult': 0.16614351893099122, 'bull_time_stop': 106, 'bull_use_sma': False, 'bull_use_ema': False, 'bull_use_atr': False, 'bull_use_adx': True, 'bull_use_spike': False, 'bull_rsi_required': True, 'bear_strategy': 'breakout', 'bear_bb_std_mult': 1.2057161731846464, 'bear_rsi_os': 39, 'bear_rsi_ob': 84, 'bear_adx_thresh': 28.83259695480945, 'bear_atr_min_pct': 0.028286686712137344, 'bear_atr_max_pct': 0.13200863747034208, 'bear_tp_mult': 1.0353224106544865, 'bear_tsl_mult': 0.8035383962719542, 'bear_time_stop': 284, 'bear_use_sma': False, 'bear_use_ema': False, 'bear_use_atr': False, 'bear_use_adx': True, 'bear_use_spike': False, 'bear_rsi_required': False, 'sideways_strategy': 'mean_reversion', 'sideways_bb_std_mult': 1.0159003345050366, 'sideways_rsi_os': 49, 'sideways_rsi_ob': 72, 'sideways_adx_thresh': 22.855125369422908, 'sideways_atr_min_pct': 0.020386052374467098, 'sideways_atr_max_pct': 0.10439635005643114, 'sideways_tp_mult': 2.953979164150058, 'sideways_tsl_mult': 0.4488297746277924, 'sideways_time_stop': 156, 'sideways_use_sma': False, 'sideways_use_ema': False, 'sideways_use_atr': False, 'sideways_use_adx': False, 'sideways_use_spike': True, 'sideways_rsi_required': False}.
[I 2025-08-30 14:38:42,620] Trial 147 finished with values: [-1000000000.0, 1000000000.0] and parameters: {'p_sma': 25, 'p_std': 6, 'p_atr': 15, 'p_adx': 22, 'rsi_period': 17, 'ema1': 5, 'ema2': 47, 'slip_atr_k': 0.07933185181314611, 'slip_spread_k': 0.7917154712015482, 'spread_hl_frac': 0.04643357385831243, 'bb_std_mult': 2.137264360743855, 'rsi_os': 27, 'rsi_ob': 78, 'vol_spike': 0.2786787358181215, 'adx_thresh': 23.38093627732982, 'atr_min_pct': 0.007580893568329929, 'atr_max_pct': 0.028503177268349163, 'tp_mult': 2.150941780335816, 'tsl_mult': 0.05426261165968861, 'strategy': 'mean_reversion', 'time_stop': 110, 'use_sma': True, 'use_atr': True, 'use_adx': False, 'use_ema': True, 'use_spike': True, 'rsi_required': False, 'edge_k': 1.734806306586689, 'edge_cap': 0.10430475912957848, 'bull_strategy': 'breakout', 'bull_bb_std_mult': 0.5559770567888463, 'bull_rsi_os': 13, 'bull_rsi_ob': 77, 'bull_adx_thresh': 29.102160907489676, 'bull_atr_min_pct': 0.01249241040290923, 'bull_atr_max_pct': 0.08845183343356228, 'bull_tp_mult': 1.2226929103305564, 'bull_tsl_mult': 0.028667992972068734, 'bull_time_stop': 232, 'bull_use_sma': False, 'bull_use_ema': False, 'bull_use_atr': False, 'bull_use_adx': True, 'bull_use_spike': False, 'bull_rsi_required': True, 'bear_strategy': 'mean_reversion', 'bear_bb_std_mult': 1.1280807404990338, 'bear_rsi_os': 40, 'bear_rsi_ob': 62, 'bear_adx_thresh': 17.234490207512277, 'bear_atr_min_pct': 0.02755073142578761, 'bear_atr_max_pct': 0.011186712060968662, 'bear_tp_mult': 1.933813221355085, 'bear_tsl_mult': 0.8025957362198461, 'bear_time_stop': 207, 'bear_use_sma': False, 'bear_use_ema': False, 'bear_use_atr': True, 'bear_use_adx': True, 'bear_use_spike': False, 'bear_rsi_required': False, 'sideways_strategy': 'breakout', 'sideways_bb_std_mult': 2.814767071421969, 'sideways_rsi_os': 20, 'sideways_rsi_ob': 91, 'sideways_adx_thresh': 34.86318112415306, 'sideways_atr_min_pct': 0.02017048218686508, 'sideways_atr_max_pct': 0.011560981828958834, 'sideways_tp_mult': 2.969191133540318, 'sideways_tsl_mult': 0.07260111444399832, 'sideways_time_stop': 182, 'sideways_use_sma': False, 'sideways_use_ema': True, 'sideways_use_atr': False, 'sideways_use_adx': True, 'sideways_use_spike': True, 'sideways_rsi_required': False}.
[I 2025-08-30 14:38:43,002] Trial 149 finished with values: [-1000000000.0, 1000000000.0] and parameters: {'p_sma': 54, 'p_std': 33, 'p_atr': 15, 'p_adx': 22, 'rsi_period': 35, 'ema1': 25, 'ema2': 36, 'slip_atr_k': 0.19770325922307513, 'slip_spread_k': 0.5537451833655677, 'spread_hl_frac': 0.009652670053017521, 'bb_std_mult': 2.9211783427053946, 'rsi_os': 27, 'rsi_ob': 50, 'vol_spike': 0.2650203617905603, 'adx_thresh': 22.713900093081634, 'atr_min_pct': 0.02852856736340196, 'atr_max_pct': 0.028657629413900276, 'tp_mult': 2.1299292932196994, 'tsl_mult': 0.9336004045180096, 'strategy': 'mean_reversion', 'time_stop': 286, 'use_sma': True, 'use_atr': True, 'use_adx': True, 'use_ema': True, 'use_spike': True, 'rsi_required': True, 'edge_k': 1.2364234587794414, 'edge_cap': 0.3690169385543854, 'bull_strategy': 'breakout', 'bull_bb_std_mult': 2.408923049717382, 'bull_rsi_os': 44, 'bull_rsi_ob': 82, 'bull_adx_thresh': 22.53493004659329, 'bull_atr_min_pct': 0.008342168821674264, 'bull_atr_max_pct': 0.08638672472418964, 'bull_tp_mult': 1.4319211844850737, 'bull_tsl_mult': 0.33989370467946733, 'bull_time_stop': 116, 'bull_use_sma': False, 'bull_use_ema': False, 'bull_use_atr': False, 'bull_use_adx': True, 'bull_use_spike': False, 'bull_rsi_required': False, 'bear_strategy': 'mean_reversion', 'bear_bb_std_mult': 0.6518811335082897, 'bear_rsi_os': 17, 'bear_rsi_ob': 57, 'bear_adx_thresh': 30.302023492740773, 'bear_atr_min_pct': 0.02573192549471784, 'bear_atr_max_pct': 0.06895035193795016, 'bear_tp_mult': 1.360609143702233, 'bear_tsl_mult': 0.8352940501483237, 'bear_time_stop': 60, 'bear_use_sma': False, 'bear_use_ema': True, 'bear_use_atr': True, 'bear_use_adx': False, 'bear_use_spike': False, 'bear_rsi_required': False, 'sideways_strategy': 'breakout', 'sideways_bb_std_mult': 0.97040011178182, 'sideways_rsi_os': 38, 'sideways_rsi_ob': 91, 'sideways_adx_thresh': 34.916908680580065, 'sideways_atr_min_pct': 0.020133534147421507, 'sideways_atr_max_pct': 0.02062585071318196, 'sideways_tp_mult': 2.399583115410632, 'sideways_tsl_mult': 0.11004694801066309, 'sideways_time_stop': 172, 'sideways_use_sma': False, 'sideways_use_ema': True, 'sideways_use_atr': False, 'sideways_use_adx': False, 'sideways_use_spike': True, 'sideways_rsi_required': False}.
[I 2025-08-30 14:39:13,701] Trial 151 finished with values: [-1000000000.0, 1000000000.0] and parameters: {'p_sma': 48, 'p_std': 21, 'p_atr': 16, 'p_adx': 9, 'rsi_period': 9, 'ema1': 18, 'ema2': 36, 'slip_atr_k': 0.1957898110197171, 'slip_spread_k': 0.5551098076439569, 'spread_hl_frac': 0.04861413315458513, 'bb_std_mult': 1.2855445343549148, 'rsi_os': 13, 'rsi_ob': 51, 'vol_spike': 0.25496548279543746, 'adx_thresh': 30.162805187702347, 'atr_min_pct': 0.020087577391236955, 'atr_max_pct': 0.14133718656916658, 'tp_mult': 1.8094755214540938, 'tsl_mult': 0.133015882802695, 'strategy': 'mean_reversion', 'time_stop': 286, 'use_sma': True, 'use_atr': True, 'use_adx': True, 'use_ema': True, 'use_spike': True, 'rsi_required': True, 'edge_k': 1.863948966546213, 'edge_cap': 0.5230271858273214, 'bull_strategy': 'mean_reversion', 'bull_bb_std_mult': 2.4222218396195703, 'bull_rsi_os': 45, 'bull_rsi_ob': 70, 'bull_adx_thresh': 18.52207991828424, 'bull_atr_min_pct': 0.022794592000688813, 'bull_atr_max_pct': 0.1265866553616647, 'bull_tp_mult': 1.4102409866874506, 'bull_tsl_mult': 0.5184818196450309, 'bull_time_stop': 118, 'bull_use_sma': False, 'bull_use_ema': False, 'bull_use_atr': True, 'bull_use_adx': True, 'bull_use_spike': False, 'bull_rsi_required': False, 'bear_strategy': 'breakout', 'bear_bb_std_mult': 2.2765946948625757, 'bear_rsi_os': 36, 'bear_rsi_ob': 57, 'bear_adx_thresh': 5.776633702807951, 'bear_atr_min_pct': 0.012175279586679365, 'bear_atr_max_pct': 0.14394243346380045, 'bear_tp_mult': 2.4464685310654004, 'bear_tsl_mult': 0.6636078478338918, 'bear_time_stop': 127, 'bear_use_sma': False, 'bear_use_ema': True, 'bear_use_atr': True, 'bear_use_adx': False, 'bear_use_spike': False, 'bear_rsi_required': False, 'sideways_strategy': 'breakout', 'sideways_bb_std_mult': 2.0138601273294774, 'sideways_rsi_os': 31, 'sideways_rsi_ob': 67, 'sideways_adx_thresh': 27.14720866932982, 'sideways_atr_min_pct': 0.01668997482370547, 'sideways_atr_max_pct': 0.01950831638389984, 'sideways_tp_mult': 2.4338099264195456, 'sideways_tsl_mult': 0.12842263041825078, 'sideways_time_stop': 172, 'sideways_use_sma': False, 'sideways_use_ema': True, 'sideways_use_atr': False, 'sideways_use_adx': False, 'sideways_use_spike': False, 'sideways_rsi_required': False}.
[I 2025-08-30 14:39:14,329] Trial 150 finished with values: [-1000000000.0, 1000000000.0] and parameters: {'p_sma': 51, 'p_std': 59, 'p_atr': 15, 'p_adx': 22, 'rsi_period': 35, 'ema1': 30, 'ema2': 33, 'slip_atr_k': 0.0836057487623712, 'slip_spread_k': 0.5416056700033174, 'spread_hl_frac': 0.04889987430417227, 'bb_std_mult': 2.9522988623090214, 'rsi_os': 27, 'rsi_ob': 63, 'vol_spike': 0.07212286100381618, 'adx_thresh': 31.102393059422383, 'atr_min_pct': 0.011377013198265465, 'atr_max_pct': 0.03097501021991685, 'tp_mult': 1.783879549559203, 'tsl_mult': 0.13305604553530498, 'strategy': 'mean_reversion', 'time_stop': 154, 'use_sma': True, 'use_atr': True, 'use_adx': True, 'use_ema': True, 'use_spike': True, 'rsi_required': True, 'edge_k': 1.2233391937460978, 'edge_cap': 0.5126441812415836, 'bull_strategy': 'breakout', 'bull_bb_std_mult': 2.364287459368582, 'bull_rsi_os': 45, 'bull_rsi_ob': 65, 'bull_adx_thresh': 16.235415133413213, 'bull_atr_min_pct': 0.008171800970852575, 'bull_atr_max_pct': 0.14402100220918626, 'bull_tp_mult': 1.4176809530338124, 'bull_tsl_mult': 0.3403324549671726, 'bull_time_stop': 8, 'bull_use_sma': False, 'bull_use_ema': False, 'bull_use_atr': True, 'bull_use_adx': True, 'bull_use_spike': False, 'bull_rsi_required': False, 'bear_strategy': 'mean_reversion', 'bear_bb_std_mult': 0.6584323364275684, 'bear_rsi_os': 22, 'bear_rsi_ob': 65, 'bear_adx_thresh': 13.141398776928721, 'bear_atr_min_pct': 0.026860982900765253, 'bear_atr_max_pct': 0.14517876630325224, 'bear_tp_mult': 1.4069491692301757, 'bear_tsl_mult': 0.2580948131168467, 'bear_time_stop': 207, 'bear_use_sma': False, 'bear_use_ema': True, 'bear_use_atr': True, 'bear_use_adx': False, 'bear_use_spike': False, 'bear_rsi_required': False, 'sideways_strategy': 'breakout', 'sideways_bb_std_mult': 2.8105547714668004, 'sideways_rsi_os': 28, 'sideways_rsi_ob': 91, 'sideways_adx_thresh': 28.088031227018575, 'sideways_atr_min_pct': 0.01986363411234162, 'sideways_atr_max_pct': 0.02038727516693325, 'sideways_tp_mult': 2.8978161520890255, 'sideways_tsl_mult': 0.12314939276281185, 'sideways_time_stop': 150, 'sideways_use_sma': False, 'sideways_use_ema': True, 'sideways_use_atr': False, 'sideways_use_adx': True, 'sideways_use_spike': False, 'sideways_rsi_required': False}.
[I 2025-08-30 14:39:14,572] Trial 148 finished with values: [-1000000000.0, 1000000000.0] and parameters: {'p_sma': 25, 'p_std': 9, 'p_atr': 15, 'p_adx': 7, 'rsi_period': 9, 'ema1': 15, 'ema2': 36, 'slip_atr_k': 0.2414219706590334, 'slip_spread_k': 0.2786641884760102, 'spread_hl_frac': 0.04618125980776412, 'bb_std_mult': 2.4205012018714367, 'rsi_os': 14, 'rsi_ob': 74, 'vol_spike': 0.2751521405326991, 'adx_thresh': 22.478032254391998, 'atr_min_pct': 0.028427759091361596, 'atr_max_pct': 0.14134198362243675, 'tp_mult': 1.80394746761792, 'tsl_mult': 0.1333291899722696, 'strategy': 'mean_reversion', 'time_stop': 110, 'use_sma': True, 'use_atr': True, 'use_adx': True, 'use_ema': True, 'use_spike': True, 'rsi_required': False, 'edge_k': 1.8544592332257677, 'edge_cap': 0.5180268046128377, 'bull_strategy': 'breakout', 'bull_bb_std_mult': 0.5470153589807116, 'bull_rsi_os': 6, 'bull_rsi_ob': 92, 'bull_adx_thresh': 14.71940559414736, 'bull_atr_min_pct': 0.016679612271093255, 'bull_atr_max_pct': 0.03104350895303954, 'bull_tp_mult': 1.2731053423787928, 'bull_tsl_mult': 0.29926178930500663, 'bull_time_stop': 8, 'bull_use_sma': False, 'bull_use_ema': False, 'bull_use_atr': False, 'bull_use_adx': True, 'bull_use_spike': False, 'bull_rsi_required': True, 'bear_strategy': 'mean_reversion', 'bear_bb_std_mult': 1.1080368083283394, 'bear_rsi_os': 17, 'bear_rsi_ob': 84, 'bear_adx_thresh': 17.317507530274757, 'bear_atr_min_pct': 0.027892073037954702, 'bear_atr_max_pct': 0.01130066516090962, 'bear_tp_mult': 2.5619513407424286, 'bear_tsl_mult': 0.8368735435746426, 'bear_time_stop': 289, 'bear_use_sma': False, 'bear_use_ema': True, 'bear_use_atr': True, 'bear_use_adx': False, 'bear_use_spike': False, 'bear_rsi_required': False, 'sideways_strategy': 'breakout', 'sideways_bb_std_mult': 2.002975625828749, 'sideways_rsi_os': 38, 'sideways_rsi_ob': 92, 'sideways_adx_thresh': 32.52175361014724, 'sideways_atr_min_pct': 0.01693550215916117, 'sideways_atr_max_pct': 0.11005418538807728, 'sideways_tp_mult': 2.9595277279272385, 'sideways_tsl_mult': 0.5771790379667894, 'sideways_time_stop': 171, 'sideways_use_sma': False, 'sideways_use_ema': True, 'sideways_use_atr': False, 'sideways_use_adx': True, 'sideways_use_spike': True, 'sideways_rsi_required': False}.
[I 2025-08-30 14:39:14,796] Trial 152 finished with values: [-1000000000.0, 1000000000.0] and parameters: {'p_sma': 28, 'p_std': 42, 'p_atr': 25, 'p_adx': 15, 'rsi_period': 44, 'ema1': 16, 'ema2': 30, 'slip_atr_k': 0.02955620831027156, 'slip_spread_k': 0.2794962383694358, 'spread_hl_frac': 0.04997914616503973, 'bb_std_mult': 2.272253779180728, 'rsi_os': 24, 'rsi_ob': 74, 'vol_spike': 0.2512800119017027, 'adx_thresh': 10.812164304377372, 'atr_min_pct': 0.028680744609565965, 'atr_max_pct': 0.13048580834646328, 'tp_mult': 1.1603616079458394, 'tsl_mult': 0.134349607967733, 'strategy': 'mean_reversion', 'time_stop': 155, 'use_sma': True, 'use_atr': True, 'use_adx': True, 'use_ema': True, 'use_spike': True, 'rsi_required': True, 'edge_k': 1.8707993975837036, 'edge_cap': 0.5303504822517106, 'bull_strategy': 'mean_reversion', 'bull_bb_std_mult': 0.6456375067118154, 'bull_rsi_os': 36, 'bull_rsi_ob': 66, 'bull_adx_thresh': 6.14382626522805, 'bull_atr_min_pct': 0.02277262030355269, 'bull_atr_max_pct': 0.14280617989083555, 'bull_tp_mult': 1.3150302285053561, 'bull_tsl_mult': 0.995323301860064, 'bull_time_stop': 93, 'bull_use_sma': False, 'bull_use_ema': False, 'bull_use_atr': True, 'bull_use_adx': True, 'bull_use_spike': True, 'bull_rsi_required': False, 'bear_strategy': 'breakout', 'bear_bb_std_mult': 2.10880218426931, 'bear_rsi_os': 20, 'bear_rsi_ob': 65, 'bear_adx_thresh': 6.20410388067017, 'bear_atr_min_pct': 0.019276506533529483, 'bear_atr_max_pct': 0.14368604544329058, 'bear_tp_mult': 2.596745536520241, 'bear_tsl_mult': 0.678301160149872, 'bear_time_stop': 111, 'bear_use_sma': False, 'bear_use_ema': True, 'bear_use_atr': False, 'bear_use_adx': False, 'bear_use_spike': False, 'bear_rsi_required': True, 'sideways_strategy': 'breakout', 'sideways_bb_std_mult': 2.03039278883932, 'sideways_rsi_os': 23, 'sideways_rsi_ob': 67, 'sideways_adx_thresh': 11.57072814950451, 'sideways_atr_min_pct': 0.011567151336759994, 'sideways_atr_max_pct': 0.016622764859134654, 'sideways_tp_mult': 1.6661814705465505, 'sideways_tsl_mult': 0.1295864315418053, 'sideways_time_stop': 149, 'sideways_use_sma': False, 'sideways_use_ema': True, 'sideways_use_atr': False, 'sideways_use_adx': False, 'sideways_use_spike': False, 'sideways_rsi_required': True}.
