[I 2025-08-30 15:42:45,814] Trial 538 finished with values: [-1000000000.0, 1000000000.0] and parameters: {'p_sma': 8, 'p_std': 22, 'p_atr': 13, 'p_adx': 12, 'rsi_period': 84, 'ema1': 24, 'ema2': 39, 'slip_atr_k': 0.0051812561668976445, 'slip_spread_k': 0.38048993899795475, 'spread_hl_frac': 0.006840162923095437, 'bb_std_mult': 0.6334004565807054, 'rsi_os': 49, 'rsi_ob': 51, 'vol_spike': 0.22672938330945527, 'adx_thresh': 8.014070116024744, 'atr_min_pct': 0.015543604409726082, 'atr_max_pct': 0.12534119082875983, 'tp_mult': 1.5672469871263928, 'tsl_mult': 0.7096391880009727, 'strategy': 'mean_reversion', 'time_stop': 161, 'use_sma': False, 'use_atr': True, 'use_adx': True, 'use_ema': True, 'use_spike': True, 'rsi_required': True, 'edge_k': 0.5376294223243618, 'edge_cap': 0.07734300180658316, 'bull_strategy': 'mean_reversion', 'bull_bb_std_mult': 1.6543378225324805, 'bull_rsi_os': 49, 'bull_rsi_ob': 89, 'bull_adx_thresh': 15.185615416208464, 'bull_atr_min_pct': 0.019663511428535705, 'bull_atr_max_pct': 0.011298470140265554, 'bull_tp_mult': 2.579679469972385, 'bull_tsl_mult': 0.8372964840149082, 'bull_time_stop': 65, 'bull_use_sma': False, 'bull_use_ema': False, 'bull_use_atr': False, 'bull_use_adx': True, 'bull_use_spike': False, 'bull_rsi_required': True, 'bear_strategy': 'breakout', 'bear_bb_std_mult': 1.9365886914931354, 'bear_rsi_os': 11, 'bear_rsi_ob': 46, 'bear_adx_thresh': 15.922062526116905, 'bear_atr_min_pct': 0.0023121593330325263, 'bear_atr_max_pct': 0.05419009921368169, 'bear_tp_mult': 2.6259545696879987, 'bear_tsl_mult': 0.9516340928297713, 'bear_time_stop': 86, 'bear_use_sma': True, 'bear_use_ema': True, 'bear_use_atr': False, 'bear_use_adx': False, 'bear_use_spike': False, 'bear_rsi_required': False, 'sideways_strategy': 'breakout', 'sideways_bb_std_mult': 3.1082778605520747, 'sideways_rsi_os': 23, 'sideways_rsi_ob': 73, 'sideways_adx_thresh': 12.478619838014247, 'sideways_atr_min_pct': 0.019642063761012598, 'sideways_atr_max_pct': 0.03836317290287349, 'sideways_tp_mult': 2.6950798898756267, 'sideways_tsl_mult': 0.5318854530507597, 'sideways_time_stop': 266, 'sideways_use_sma': False, 'sideways_use_ema': True, 'sideways_use_atr': True, 'sideways_use_adx': True, 'sideways_use_spike': False, 'sideways_rsi_required': True}.
[I 2025-08-30 15:43:41,365] Trial 541 finished with values: [-1000000000.0, 1000000000.0] and parameters: {'p_sma': 60, 'p_std': 22, 'p_atr': 12, 'p_adx': 26, 'rsi_period': 12, 'ema1': 19, 'ema2': 38, 'slip_atr_k': 0.004373401228834362, 'slip_spread_k': 0.3722236570370927, 'spread_hl_frac': 0.021070028929203993, 'bb_std_mult': 0.6333032970794251, 'rsi_os': 30, 'rsi_ob': 85, 'vol_spike': 0.013456287218915786, 'adx_thresh': 8.268093785652054, 'atr_min_pct': 0.010539172457390009, 'atr_max_pct': 0.12568148456012104, 'tp_mult': 1.3092796320947224, 'tsl_mult': 0.4086017738620141, 'strategy': 'breakout', 'time_stop': 160, 'use_sma': False, 'use_atr': False, 'use_adx': True, 'use_ema': False, 'use_spike': False, 'rsi_required': False, 'edge_k': 0.5595541443006836, 'edge_cap': 0.9716355183326427, 'bull_strategy': 'breakout', 'bull_bb_std_mult': 1.5876545927137586, 'bull_rsi_os': 51, 'bull_rsi_ob': 89, 'bull_adx_thresh': 28.090887509905265, 'bull_atr_min_pct': 0.018634454667879958, 'bull_atr_max_pct': 0.10115043551970436, 'bull_tp_mult': 2.5023192879263267, 'bull_tsl_mult': 0.9016538147186091, 'bull_time_stop': 184, 'bull_use_sma': True, 'bull_use_ema': False, 'bull_use_atr': True, 'bull_use_adx': True, 'bull_use_spike': True, 'bull_rsi_required': False, 'bear_strategy': 'mean_reversion', 'bear_bb_std_mult': 1.6991412934082062, 'bear_rsi_os': 11, 'bear_rsi_ob': 95, 'bear_adx_thresh': 24.408804259171703, 'bear_atr_min_pct': 0.002306296621404168, 'bear_atr_max_pct': 0.11021720661786631, 'bear_tp_mult': 1.2724930878289709, 'bear_tsl_mult': 0.8631714329294531, 'bear_time_stop': 94, 'bear_use_sma': True, 'bear_use_ema': True, 'bear_use_atr': True, 'bear_use_adx': True, 'bear_use_spike': True, 'bear_rsi_required': True, 'sideways_strategy': 'mean_reversion', 'sideways_bb_std_mult': 3.187509781593799, 'sideways_rsi_os': 16, 'sideways_rsi_ob': 72, 'sideways_adx_thresh': 11.204205755689486, 'sideways_atr_min_pct': 0.020079469652052383, 'sideways_atr_max_pct': 0.10755635583784988, 'sideways_tp_mult': 1.7342765006334582, 'sideways_tsl_mult': 0.3422034310662698, 'sideways_time_stop': 261, 'sideways_use_sma': True, 'sideways_use_ema': False, 'sideways_use_atr': True, 'sideways_use_adx': True, 'sideways_use_spike': True, 'sideways_rsi_required': True}.
[I 2025-08-30 15:43:41,825] Trial 543 finished with values: [-0.006916353704203737, 0.008304882323669363] and parameters: {'p_sma': 9, 'p_std': 18, 'p_atr': 12, 'p_adx': 24, 'rsi_period': 11, 'ema1': 25, 'ema2': 24, 'slip_atr_k': 0.009602206561907358, 'slip_spread_k': 0.38174290946488554, 'spread_hl_frac': 0.021304248664436858, 'bb_std_mult': 0.6976682601532713, 'rsi_os': 48, 'rsi_ob': 80, 'vol_spike': 0.19533293764153226, 'adx_thresh': 8.372644963260628, 'atr_min_pct': 0.024968145814964354, 'atr_max_pct': 0.10945058203109048, 'tp_mult': 2.942189636700458, 'tsl_mult': 0.3221493872904579, 'strategy': 'breakout', 'time_stop': 50, 'use_sma': False, 'use_atr': False, 'use_adx': True, 'use_ema': False, 'use_spike': False, 'rsi_required': False, 'edge_k': 0.5681990779945021, 'edge_cap': 0.9705947539723627, 'bull_strategy': 'breakout', 'bull_bb_std_mult': 2.0430198466024216, 'bull_rsi_os': 48, 'bull_rsi_ob': 89, 'bull_adx_thresh': 8.41177211215621, 'bull_atr_min_pct': 0.02014611489873465, 'bull_atr_max_pct': 0.05796010298124693, 'bull_tp_mult': 2.5010667612083073, 'bull_tsl_mult': 0.506969304353942, 'bull_time_stop': 244, 'bull_use_sma': True, 'bull_use_ema': True, 'bull_use_atr': True, 'bull_use_adx': True, 'bull_use_spike': True, 'bull_rsi_required': False, 'bear_strategy': 'mean_reversion', 'bear_bb_std_mult': 1.7129326440305315, 'bear_rsi_os': 25, 'bear_rsi_ob': 46, 'bear_adx_thresh': 16.36890953725381, 'bear_atr_min_pct': 0.0018230092411224913, 'bear_atr_max_pct': 0.1067346540774598, 'bear_tp_mult': 2.730964750103336, 'bear_tsl_mult': 0.7873631282626863, 'bear_time_stop': 103, 'bear_use_sma': True, 'bear_use_ema': False, 'bear_use_atr': True, 'bear_use_adx': True, 'bear_use_spike': True, 'bear_rsi_required': True, 'sideways_strategy': 'mean_reversion', 'sideways_bb_std_mult': 3.1934711845981463, 'sideways_rsi_os': 23, 'sideways_rsi_ob': 80, 'sideways_adx_thresh': 11.299024350151173, 'sideways_atr_min_pct': 0.006651817521355527, 'sideways_atr_max_pct': 0.07038906139614787, 'sideways_tp_mult': 1.9911651605419056, 'sideways_tsl_mult': 0.40417552837598036, 'sideways_time_stop': 225, 'sideways_use_sma': True, 'sideways_use_ema': False, 'sideways_use_atr': False, 'sideways_use_adx': True, 'sideways_use_spike': True, 'sideways_rsi_required': True}.
[I 2025-08-30 15:43:42,458] Trial 542 finished with values: [-1000000000.0, 1000000000.0] and parameters: {'p_sma': 9, 'p_std': 21, 'p_atr': 12, 'p_adx': 24, 'rsi_period': 12, 'ema1': 22, 'ema2': 37, 'slip_atr_k': 0.00988398035858208, 'slip_spread_k': 0.6861279981962596, 'spread_hl_frac': 0.006315346382212978, 'bb_std_mult': 2.005901513353787, 'rsi_os': 48, 'rsi_ob': 85, 'vol_spike': 0.19547352212039662, 'adx_thresh': 8.379677665830558, 'atr_min_pct': 0.01042356368861953, 'atr_max_pct': 0.10989096577455865, 'tp_mult': 2.94286202992853, 'tsl_mult': 0.6999657289889087, 'strategy': 'breakout', 'time_stop': 42, 'use_sma': False, 'use_atr': False, 'use_adx': True, 'use_ema': False, 'use_spike': False, 'rsi_required': False, 'edge_k': 0.5767351573469006, 'edge_cap': 0.9693823590545879, 'bull_strategy': 'breakout', 'bull_bb_std_mult': 2.01630456746229, 'bull_rsi_os': 48, 'bull_rsi_ob': 89, 'bull_adx_thresh': 8.369193015179107, 'bull_atr_min_pct': 0.02123009362537628, 'bull_atr_max_pct': 0.10283788104140786, 'bull_tp_mult': 2.426485747618038, 'bull_tsl_mult': 0.5050286260711428, 'bull_time_stop': 57, 'bull_use_sma': True, 'bull_use_ema': True, 'bull_use_atr': True, 'bull_use_adx': True, 'bull_use_spike': True, 'bull_rsi_required': False, 'bear_strategy': 'mean_reversion', 'bear_bb_std_mult': 1.7401349622300275, 'bear_rsi_os': 25, 'bear_rsi_ob': 74, 'bear_adx_thresh': 24.100782615930186, 'bear_atr_min_pct': 0.003546914733704472, 'bear_atr_max_pct': 0.044624894659499, 'bear_tp_mult': 1.2773021802400875, 'bear_tsl_mult': 0.7907376257609133, 'bear_time_stop': 22, 'bear_use_sma': True, 'bear_use_ema': False, 'bear_use_atr': True, 'bear_use_adx': True, 'bear_use_spike': True, 'bear_rsi_required': True, 'sideways_strategy': 'mean_reversion', 'sideways_bb_std_mult': 3.170501222522142, 'sideways_rsi_os': 12, 'sideways_rsi_ob': 80, 'sideways_adx_thresh': 10.869082317558803, 'sideways_atr_min_pct': 0.019871643311773046, 'sideways_atr_max_pct': 0.06970792843325954, 'sideways_tp_mult': 1.123865492784095, 'sideways_tsl_mult': 0.40260856022594, 'sideways_time_stop': 224, 'sideways_use_sma': True, 'sideways_use_ema': False, 'sideways_use_atr': False, 'sideways_use_adx': True, 'sideways_use_spike': True, 'sideways_rsi_required': True}.
[I 2025-08-30 15:43:42,945] Trial 544 finished with values: [-1000000000.0, 1000000000.0] and parameters: {'p_sma': 9, 'p_std': 18, 'p_atr': 12, 'p_adx': 25, 'rsi_period': 12, 'ema1': 25, 'ema2': 37, 'slip_atr_k': 0.0001394465342293357, 'slip_spread_k': 0.7044659141213214, 'spread_hl_frac': 0.008050568414531032, 'bb_std_mult': 0.7513129180626706, 'rsi_os': 31, 'rsi_ob': 59, 'vol_spike': 0.19535534160501444, 'adx_thresh': 9.681474025007354, 'atr_min_pct': 0.005397084930227387, 'atr_max_pct': 0.06548570470972878, 'tp_mult': 1.3191649237089225, 'tsl_mult': 0.1929576861087841, 'strategy': 'breakout', 'time_stop': 89, 'use_sma': False, 'use_atr': False, 'use_adx': True, 'use_ema': False, 'use_spike': False, 'rsi_required': False, 'edge_k': 0.9906594683562613, 'edge_cap': 0.9701739953529016, 'bull_strategy': 'breakout', 'bull_bb_std_mult': 2.017236993372867, 'bull_rsi_os': 47, 'bull_rsi_ob': 55, 'bull_adx_thresh': 26.631539293632102, 'bull_atr_min_pct': 0.027012760623618255, 'bull_atr_max_pct': 0.10097373694794315, 'bull_tp_mult': 2.847411987280403, 'bull_tsl_mult': 0.8579153544358281, 'bull_time_stop': 46, 'bull_use_sma': True, 'bull_use_ema': True, 'bull_use_atr': True, 'bull_use_adx': True, 'bull_use_spike': True, 'bull_rsi_required': False, 'bear_strategy': 'mean_reversion', 'bear_bb_std_mult': 1.8338390729463279, 'bear_rsi_os': 46, 'bear_rsi_ob': 74, 'bear_adx_thresh': 22.91925709942577, 'bear_atr_min_pct': 0.007750047167888624, 'bear_atr_max_pct': 0.0443474489863784, 'bear_tp_mult': 2.7322961688038783, 'bear_tsl_mult': 0.37204672784517956, 'bear_time_stop': 221, 'bear_use_sma': True, 'bear_use_ema': False, 'bear_use_atr': True, 'bear_use_adx': True, 'bear_use_spike': True, 'bear_rsi_required': True, 'sideways_strategy': 'mean_reversion', 'sideways_bb_std_mult': 3.1917680890514224, 'sideways_rsi_os': 8, 'sideways_rsi_ob': 81, 'sideways_adx_thresh': 11.078259926935011, 'sideways_atr_min_pct': 0.017985097776528097, 'sideways_atr_max_pct': 0.10872994868234533, 'sideways_tp_mult': 1.0718659550914693, 'sideways_tsl_mult': 0.3662140372382643, 'sideways_time_stop': 127, 'sideways_use_sma': True, 'sideways_use_ema': False, 'sideways_use_atr': False, 'sideways_use_adx': True, 'sideways_use_spike': True, 'sideways_rsi_required': True}.
[I 2025-08-30 15:44:50,884] Trial 546 finished with values: [-1000000000.0, 1000000000.0] and parameters: {'p_sma': 10, 'p_std': 52, 'p_atr': 11, 'p_adx': 25, 'rsi_period': 12, 'ema1': 23, 'ema2': 37, 'slip_atr_k': 0.00025919504466837397, 'slip_spread_k': 0.6985700189651775, 'spread_hl_frac': 0.02513716058001517, 'bb_std_mult': 1.9978811441879836, 'rsi_os': 31, 'rsi_ob': 89, 'vol_spike': 0.21241933435649046, 'adx_thresh': 21.34214181959934, 'atr_min_pct': 0.005337918698040794, 'atr_max_pct': 0.14603065795968417, 'tp_mult': 1.4620100791597646, 'tsl_mult': 0.18666452675582357, 'strategy': 'breakout', 'time_stop': 168, 'use_sma': False, 'use_atr': False, 'use_adx': True, 'use_ema': False, 'use_spike': False, 'rsi_required': False, 'edge_k': 0.5936249455313299, 'edge_cap': 0.9852574087116786, 'bull_strategy': 'breakout', 'bull_bb_std_mult': 1.5599967247622364, 'bull_rsi_os': 47, 'bull_rsi_ob': 86, 'bull_adx_thresh': 26.52531660034783, 'bull_atr_min_pct': 0.0178634258375852, 'bull_atr_max_pct': 0.09755049706188111, 'bull_tp_mult': 2.3623033803142874, 'bull_tsl_mult': 0.6854357793391828, 'bull_time_stop': 46, 'bull_use_sma': True, 'bull_use_ema': True, 'bull_use_atr': True, 'bull_use_adx': True, 'bull_use_spike': True, 'bull_rsi_required': False, 'bear_strategy': 'mean_reversion', 'bear_bb_std_mult': 1.8176281916057642, 'bear_rsi_os': 13, 'bear_rsi_ob': 74, 'bear_adx_thresh': 15.085735575176695, 'bear_atr_min_pct': 0.003232943624987483, 'bear_atr_max_pct': 0.036306200482557664, 'bear_tp_mult': 1.1122294356429592, 'bear_tsl_mult': 0.37999440734490164, 'bear_time_stop': 21, 'bear_use_sma': True, 'bear_use_ema': False, 'bear_use_atr': True, 'bear_use_adx': True, 'bear_use_spike': True, 'bear_rsi_required': True, 'sideways_strategy': 'mean_reversion', 'sideways_bb_std_mult': 3.047031992368649, 'sideways_rsi_os': 12, 'sideways_rsi_ob': 77, 'sideways_adx_thresh': 10.052288948882765, 'sideways_atr_min_pct': 0.018346206239621018, 'sideways_atr_max_pct': 0.06669285357098316, 'sideways_tp_mult': 1.1123965884328064, 'sideways_tsl_mult': 0.3683169392717797, 'sideways_time_stop': 127, 'sideways_use_sma': True, 'sideways_use_ema': False, 'sideways_use_atr': False, 'sideways_use_adx': True, 'sideways_use_spike': True, 'sideways_rsi_required': False}.
[I 2025-08-30 15:44:51,403] Trial 545 finished with values: [-1000000000.0, 1000000000.0] and parameters: {'p_sma': 10, 'p_std': 57, 'p_atr': 12, 'p_adx': 24, 'rsi_period': 41, 'ema1': 25, 'ema2': 37, 'slip_atr_k': 0.00011943151155780545, 'slip_spread_k': 0.6949414946371755, 'spread_hl_frac': 0.008169752586490291, 'bb_std_mult': 0.7208120330807485, 'rsi_os': 53, 'rsi_ob': 89, 'vol_spike': 0.21389832945808757, 'adx_thresh': 9.351532629981333, 'atr_min_pct': 0.005185002307281246, 'atr_max_pct': 0.0516527757829203, 'tp_mult': 1.464766245260186, 'tsl_mult': 0.8322137760161276, 'strategy': 'breakout', 'time_stop': 219, 'use_sma': False, 'use_atr': False, 'use_adx': True, 'use_ema': False, 'use_spike': False, 'rsi_required': False, 'edge_k': 0.5895091643192857, 'edge_cap': 0.9684750683040093, 'bull_strategy': 'breakout', 'bull_bb_std_mult': 1.5664708351822676, 'bull_rsi_os': 30, 'bull_rsi_ob': 86, 'bull_adx_thresh': 11.110884222756402, 'bull_atr_min_pct': 0.02032828806175782, 'bull_atr_max_pct': 0.06946726155119429, 'bull_tp_mult': 1.9731243751633354, 'bull_tsl_mult': 0.8559434577055695, 'bull_time_stop': 244, 'bull_use_sma': True, 'bull_use_ema': True, 'bull_use_atr': True, 'bull_use_adx': True, 'bull_use_spike': True, 'bull_rsi_required': False, 'bear_strategy': 'mean_reversion', 'bear_bb_std_mult': 1.830219543695978, 'bear_rsi_os': 48, 'bear_rsi_ob': 74, 'bear_adx_thresh': 15.05694622087244, 'bear_atr_min_pct': 0.0035514182731862416, 'bear_atr_max_pct': 0.10689393151844652, 'bear_tp_mult': 2.742566156832779, 'bear_tsl_mult': 0.7865373942794229, 'bear_time_stop': 210, 'bear_use_sma': True, 'bear_use_ema': False, 'bear_use_atr': True, 'bear_use_adx': True, 'bear_use_spike': True, 'bear_rsi_required': True, 'sideways_strategy': 'mean_reversion', 'sideways_bb_std_mult': 3.06374335239666, 'sideways_rsi_os': 12, 'sideways_rsi_ob': 81, 'sideways_adx_thresh': 10.364702812211975, 'sideways_atr_min_pct': 0.020567348188061944, 'sideways_atr_max_pct': 0.07049537483988313, 'sideways_tp_mult': 1.9689753772211267, 'sideways_tsl_mult': 0.7436788466793498, 'sideways_time_stop': 244, 'sideways_use_sma': True, 'sideways_use_ema': False, 'sideways_use_atr': False, 'sideways_use_adx': True, 'sideways_use_spike': True, 'sideways_rsi_required': True}.
[I 2025-08-30 15:44:51,947] Trial 547 finished with values: [-1000000000.0, 1000000000.0] and parameters: {'p_sma': 10, 'p_std': 57, 'p_atr': 11, 'p_adx': 25, 'rsi_period': 78, 'ema1': 24, 'ema2': 18, 'slip_atr_k': 0.17225829623362113, 'slip_spread_k': 0.712312921435663, 'spread_hl_frac': 0.011585289860065377, 'bb_std_mult': 0.742846184758956, 'rsi_os': 31, 'rsi_ob': 89, 'vol_spike': 0.21337531737215445, 'adx_thresh': 21.446502537554295, 'atr_min_pct': 0.0052994421700009045, 'atr_max_pct': 0.05149648782804786, 'tp_mult': 1.012129427086709, 'tsl_mult': 0.32145510819884177, 'strategy': 'breakout', 'time_stop': 168, 'use_sma': False, 'use_atr': False, 'use_adx': True, 'use_ema': False, 'use_spike': False, 'rsi_required': False, 'edge_k': 0.9221116776551799, 'edge_cap': 0.9849296950632473, 'bull_strategy': 'breakout', 'bull_bb_std_mult': 1.4387717650628953, 'bull_rsi_os': 47, 'bull_rsi_ob': 86, 'bull_adx_thresh': 10.5500297869673, 'bull_atr_min_pct': 0.01777830964404001, 'bull_atr_max_pct': 0.09797377232174306, 'bull_tp_mult': 1.6439181581073359, 'bull_tsl_mult': 0.6697408687750153, 'bull_time_stop': 218, 'bull_use_sma': True, 'bull_use_ema': True, 'bull_use_atr': True, 'bull_use_adx': True, 'bull_use_spike': True, 'bull_rsi_required': False, 'bear_strategy': 'mean_reversion', 'bear_bb_std_mult': 1.8336589725893688, 'bear_rsi_os': 27, 'bear_rsi_ob': 78, 'bear_adx_thresh': 15.093868269782229, 'bear_atr_min_pct': 0.003269459016754371, 'bear_atr_max_pct': 0.09839245248812836, 'bear_tp_mult': 2.5700594958395637, 'bear_tsl_mult': 0.8832007253717898, 'bear_time_stop': 95, 'bear_use_sma': False, 'bear_use_ema': False, 'bear_use_atr': True, 'bear_use_adx': True, 'bear_use_spike': True, 'bear_rsi_required': True, 'sideways_strategy': 'mean_reversion', 'sideways_bb_std_mult': 3.2579556405911427, 'sideways_rsi_os': 10, 'sideways_rsi_ob': 81, 'sideways_adx_thresh': 6.2129616919795705, 'sideways_atr_min_pct': 0.020518437964892135, 'sideways_atr_max_pct': 0.0660285178046846, 'sideways_tp_mult': 1.2803953780860582, 'sideways_tsl_mult': 0.37537553679790053, 'sideways_time_stop': 300, 'sideways_use_sma': True, 'sideways_use_ema': False, 'sideways_use_atr': True, 'sideways_use_adx': True, 'sideways_use_spike': True, 'sideways_rsi_required': False}.
[I 2025-08-30 15:44:52,191] Trial 548 finished with values: [-0.00953942248448858, 0.009440497699647294] and parameters: {'p_sma': 34, 'p_std': 53, 'p_atr': 11, 'p_adx': 16, 'rsi_period': 9, 'ema1': 6, 'ema2': 13, 'slip_atr_k': 0.0121945465294552, 'slip_spread_k': 0.9578113661990342, 'spread_hl_frac': 0.016709503091466064, 'bb_std_mult': 0.5930555981403199, 'rsi_os': 42, 'rsi_ob': 88, 'vol_spike': 0.21308831446120932, 'adx_thresh': 28.881477309362463, 'atr_min_pct': 0.0053247701828047275, 'atr_max_pct': 0.1473142243102239, 'tp_mult': 1.4647719482332993, 'tsl_mult': 0.32923559195682245, 'strategy': 'breakout', 'time_stop': 157, 'use_sma': False, 'use_atr': False, 'use_adx': True, 'use_ema': False, 'use_spike': False, 'rsi_required': False, 'edge_k': 0.6062043607784653, 'edge_cap': 0.9092392455713263, 'bull_strategy': 'breakout', 'bull_bb_std_mult': 0.8051780003004543, 'bull_rsi_os': 50, 'bull_rsi_ob': 88, 'bull_adx_thresh': 10.62317069822451, 'bull_atr_min_pct': 0.01788538876994644, 'bull_atr_max_pct': 0.1086376149022164, 'bull_tp_mult': 1.9115720172523623, 'bull_tsl_mult': 0.9012921294609313, 'bull_time_stop': 55, 'bull_use_sma': True, 'bull_use_ema': True, 'bull_use_atr': True, 'bull_use_adx': True, 'bull_use_spike': True, 'bull_rsi_required': False, 'bear_strategy': 'mean_reversion', 'bear_bb_std_mult': 1.8713054730970213, 'bear_rsi_os': 42, 'bear_rsi_ob': 78, 'bear_adx_thresh': 15.060250195143144, 'bear_atr_min_pct': 0.0032658455282415727, 'bear_atr_max_pct': 0.10760047571242155, 'bear_tp_mult': 2.735017930639678, 'bear_tsl_mult': 0.8444218949746898, 'bear_time_stop': 95, 'bear_use_sma': False, 'bear_use_ema': False, 'bear_use_atr': True, 'bear_use_adx': True, 'bear_use_spike': True, 'bear_rsi_required': True, 'sideways_strategy': 'mean_reversion', 'sideways_bb_std_mult': 3.2806874072382253, 'sideways_rsi_os': 21, 'sideways_rsi_ob': 94, 'sideways_adx_thresh': 9.592216833834364, 'sideways_atr_min_pct': 0.020685513287524784, 'sideways_atr_max_pct': 0.06744924300465788, 'sideways_tp_mult': 1.7648425280792865, 'sideways_tsl_mult': 0.36769914802021375, 'sideways_time_stop': 132, 'sideways_use_sma': True, 'sideways_use_ema': False, 'sideways_use_atr': True, 'sideways_use_adx': True, 'sideways_use_spike': True, 'sideways_rsi_required': False}.
