[I 2025-08-30 16:42:42,322] Trial 844 finished with values: [-1000000000.0, 1000000000.0] and parameters: {'p_sma': 5, 'p_std': 19, 'p_atr': 13, 'p_adx': 24, 'rsi_period': 10, 'ema1': 22, 'ema2': 36, 'slip_atr_k': 0.01829393266695737, 'slip_spread_k': 0.7167113374874677, 'spread_hl_frac': 0.003909078085929029, 'bb_std_mult': 0.5927286296889223, 'rsi_os': 31, 'rsi_ob': 87, 'vol_spike': 0.21665329042825482, 'adx_thresh': 9.015149188891202, 'atr_min_pct': 0.019824683274357328, 'atr_max_pct': 0.11207646450704283, 'tp_mult': 1.5055125120448647, 'tsl_mult': 0.34397015924815133, 'strategy': 'breakout', 'time_stop': 78, 'use_sma': False, 'use_atr': True, 'use_adx': False, 'use_ema': False, 'use_spike': True, 'rsi_required': False, 'edge_k': 0.49683610190742306, 'edge_cap': 0.705430056244943, 'bull_strategy': 'breakout', 'bull_bb_std_mult': 1.4947070155473217, 'bull_rsi_os': 49, 'bull_rsi_ob': 73, 'bull_adx_thresh': 21.406513791871205, 'bull_atr_min_pct': 0.018749507824096567, 'bull_atr_max_pct': 0.07046533921240321, 'bull_tp_mult': 1.6552114863967393, 'bull_tsl_mult': 0.32450764156320555, 'bull_time_stop': 289, 'bull_use_sma': True, 'bull_use_ema': True, 'bull_use_atr': True, 'bull_use_adx': True, 'bull_use_spike': True, 'bull_rsi_required': True, 'bear_strategy': 'mean_reversion', 'bear_bb_std_mult': 1.6428285806969873, 'bear_rsi_os': 27, 'bear_rsi_ob': 75, 'bear_adx_thresh': 33.259821520142424, 'bear_atr_min_pct': 0.0018899450818518774, 'bear_atr_max_pct': 0.07087140681446151, 'bear_tp_mult': 2.6167716024723586, 'bear_tsl_mult': 0.789918255853836, 'bear_time_stop': 210, 'bear_use_sma': True, 'bear_use_ema': False, 'bear_use_atr': False, 'bear_use_adx': True, 'bear_use_spike': True, 'bear_rsi_required': True, 'sideways_strategy': 'breakout', 'sideways_bb_std_mult': 3.433085281898907, 'sideways_rsi_os': 30, 'sideways_rsi_ob': 76, 'sideways_adx_thresh': 26.200584908713026, 'sideways_atr_min_pct': 0.021300257776256836, 'sideways_atr_max_pct': 0.04487095035022451, 'sideways_tp_mult': 1.5319540974936372, 'sideways_tsl_mult': 0.395511721028814, 'sideways_time_stop': 43, 'sideways_use_sma': False, 'sideways_use_ema': False, 'sideways_use_atr': True, 'sideways_use_adx': False, 'sideways_use_spike': True, 'sideways_rsi_required': False}.
[I 2025-08-30 16:43:32,303] Trial 849 finished with values: [-0.005055325708886782, 0.005259204233525646] and parameters: {'p_sma': 5, 'p_std': 29, 'p_atr': 13, 'p_adx': 26, 'rsi_period': 8, 'ema1': 24, 'ema2': 36, 'slip_atr_k': 0.00010704008749803907, 'slip_spread_k': 0.7065698411500123, 'spread_hl_frac': 0.025213691775951796, 'bb_std_mult': 2.24596635677432, 'rsi_os': 29, 'rsi_ob': 63, 'vol_spike': 0.217906598470933, 'adx_thresh': 30.616650468294935, 'atr_min_pct': 0.020828016036412104, 'atr_max_pct': 0.11033419393169015, 'tp_mult': 1.708305168765155, 'tsl_mult': 0.2626538158973615, 'strategy': 'mean_reversion', 'time_stop': 140, 'use_sma': True, 'use_atr': False, 'use_adx': True, 'use_ema': True, 'use_spike': False, 'rsi_required': True, 'edge_k': 0.6328344047725107, 'edge_cap': 0.9823017133504024, 'bull_strategy': 'breakout', 'bull_bb_std_mult': 1.5391184390983383, 'bull_rsi_os': 46, 'bull_rsi_ob': 88, 'bull_adx_thresh': 15.153596720926515, 'bull_atr_min_pct': 0.020089868216476722, 'bull_atr_max_pct': 0.10286748839617936, 'bull_tp_mult': 1.5627644473877917, 'bull_tsl_mult': 0.8153086760669731, 'bull_time_stop': 216, 'bull_use_sma': False, 'bull_use_ema': True, 'bull_use_atr': True, 'bull_use_adx': True, 'bull_use_spike': False, 'bull_rsi_required': False, 'bear_strategy': 'mean_reversion', 'bear_bb_std_mult': 3.402437020467322, 'bear_rsi_os': 41, 'bear_rsi_ob': 74, 'bear_adx_thresh': 29.452378126482245, 'bear_atr_min_pct': 0.0018264833198300293, 'bear_atr_max_pct': 0.056939184422056255, 'bear_tp_mult': 1.0434223488616143, 'bear_tsl_mult': 0.691039668038215, 'bear_time_stop': 208, 'bear_use_sma': False, 'bear_use_ema': False, 'bear_use_atr': True, 'bear_use_adx': True, 'bear_use_spike': True, 'bear_rsi_required': False, 'sideways_strategy': 'mean_reversion', 'sideways_bb_std_mult': 1.9240947207582406, 'sideways_rsi_os': 51, 'sideways_rsi_ob': 80, 'sideways_adx_thresh': 21.046121104543694, 'sideways_atr_min_pct': 0.002076892139507248, 'sideways_atr_max_pct': 0.02253306260760673, 'sideways_tp_mult': 1.9613738407635246, 'sideways_tsl_mult': 0.3906771590928189, 'sideways_time_stop': 132, 'sideways_use_sma': True, 'sideways_use_ema': False, 'sideways_use_atr': True, 'sideways_use_adx': True, 'sideways_use_spike': False, 'sideways_rsi_required': False}.
[I 2025-08-30 16:43:32,609] Trial 847 finished with values: [-1000000000.0, 1000000000.0] and parameters: {'p_sma': 32, 'p_std': 21, 'p_atr': 27, 'p_adx': 26, 'rsi_period': 65, 'ema1': 7, 'ema2': 36, 'slip_atr_k': 0.03386687307175082, 'slip_spread_k': 0.4252586428190429, 'spread_hl_frac': 0.004712712540435768, 'bb_std_mult': 0.9301292305344815, 'rsi_os': 31, 'rsi_ob': 75, 'vol_spike': 0.04753433833714811, 'adx_thresh': 30.61956604529504, 'atr_min_pct': 0.005904137312935268, 'atr_max_pct': 0.081490325679298, 'tp_mult': 1.573372290587942, 'tsl_mult': 0.1779573258530971, 'strategy': 'breakout', 'time_stop': 142, 'use_sma': False, 'use_atr': False, 'use_adx': False, 'use_ema': False, 'use_spike': False, 'rsi_required': True, 'edge_k': 0.5204609046341815, 'edge_cap': 0.9317175563930431, 'bull_strategy': 'mean_reversion', 'bull_bb_std_mult': 1.6567586497903126, 'bull_rsi_os': 50, 'bull_rsi_ob': 51, 'bull_adx_thresh': 21.528186135957853, 'bull_atr_min_pct': 0.01575203231618919, 'bull_atr_max_pct': 0.10270080751737944, 'bull_tp_mult': 1.6502763437708188, 'bull_tsl_mult': 0.0030178306310451597, 'bull_time_stop': 42, 'bull_use_sma': True, 'bull_use_ema': True, 'bull_use_atr': True, 'bull_use_adx': True, 'bull_use_spike': True, 'bull_rsi_required': True, 'bear_strategy': 'breakout', 'bear_bb_std_mult': 2.0372056451940708, 'bear_rsi_os': 26, 'bear_rsi_ob': 77, 'bear_adx_thresh': 33.52212339941076, 'bear_atr_min_pct': 0.011582190699051871, 'bear_atr_max_pct': 0.1058844589130284, 'bear_tp_mult': 2.108284984476809, 'bear_tsl_mult': 0.4533198540640329, 'bear_time_stop': 213, 'bear_use_sma': True, 'bear_use_ema': False, 'bear_use_atr': True, 'bear_use_adx': True, 'bear_use_spike': False, 'bear_rsi_required': False, 'sideways_strategy': 'breakout', 'sideways_bb_std_mult': 3.0376262969926766, 'sideways_rsi_os': 51, 'sideways_rsi_ob': 80, 'sideways_adx_thresh': 11.505271385757089, 'sideways_atr_min_pct': 0.021416022901989136, 'sideways_atr_max_pct': 0.06899039755822688, 'sideways_tp_mult': 1.3135948675337408, 'sideways_tsl_mult': 0.3472799421635811, 'sideways_time_stop': 131, 'sideways_use_sma': False, 'sideways_use_ema': False, 'sideways_use_atr': True, 'sideways_use_adx': True, 'sideways_use_spike': True, 'sideways_rsi_required': True}.
[I 2025-08-30 16:43:33,205] Trial 850 finished with values: [-0.009312992968740996, 0.009318190932138305] and parameters: {'p_sma': 46, 'p_std': 21, 'p_atr': 15, 'p_adx': 26, 'rsi_period': 33, 'ema1': 24, 'ema2': 37, 'slip_atr_k': 0.006307719295009882, 'slip_spread_k': 0.6826246454153764, 'spread_hl_frac': 0.005795079775069125, 'bb_std_mult': 0.7457383530340721, 'rsi_os': 29, 'rsi_ob': 84, 'vol_spike': 0.22090183212856412, 'adx_thresh': 8.239850040602555, 'atr_min_pct': 0.005647714451555527, 'atr_max_pct': 0.10966903842847266, 'tp_mult': 1.8122981577859074, 'tsl_mult': 0.04557029878679675, 'strategy': 'mean_reversion', 'time_stop': 143, 'use_sma': True, 'use_atr': False, 'use_adx': True, 'use_ema': True, 'use_spike': False, 'rsi_required': True, 'edge_k': 0.6325985581921467, 'edge_cap': 0.9829158391138855, 'bull_strategy': 'breakout', 'bull_bb_std_mult': 1.6177342988239127, 'bull_rsi_os': 10, 'bull_rsi_ob': 71, 'bull_adx_thresh': 16.196736994574003, 'bull_atr_min_pct': 0.020158109155196415, 'bull_atr_max_pct': 0.05510635034211992, 'bull_tp_mult': 2.56304927321503, 'bull_tsl_mult': 0.4418091545340844, 'bull_time_stop': 159, 'bull_use_sma': False, 'bull_use_ema': True, 'bull_use_atr': True, 'bull_use_adx': True, 'bull_use_spike': False, 'bull_rsi_required': False, 'bear_strategy': 'mean_reversion', 'bear_bb_std_mult': 2.0320159187058247, 'bear_rsi_os': 41, 'bear_rsi_ob': 87, 'bear_adx_thresh': 17.90465807244174, 'bear_atr_min_pct': 0.003400086217081064, 'bear_atr_max_pct': 0.05761843879166507, 'bear_tp_mult': 2.828054868530719, 'bear_tsl_mult': 0.20509288440982043, 'bear_time_stop': 89, 'bear_use_sma': False, 'bear_use_ema': False, 'bear_use_atr': True, 'bear_use_adx': True, 'bear_use_spike': True, 'bear_rsi_required': False, 'sideways_strategy': 'mean_reversion', 'sideways_bb_std_mult': 1.9227447073248016, 'sideways_rsi_os': 34, 'sideways_rsi_ob': 80, 'sideways_adx_thresh': 13.101737051169119, 'sideways_atr_min_pct': 0.01947052264428859, 'sideways_atr_max_pct': 0.07779166283389786, 'sideways_tp_mult': 1.055747363319337, 'sideways_tsl_mult': 0.34846389259334964, 'sideways_time_stop': 132, 'sideways_use_sma': True, 'sideways_use_ema': False, 'sideways_use_atr': True, 'sideways_use_adx': True, 'sideways_use_spike': False, 'sideways_rsi_required': True}.
[I 2025-08-30 16:43:33,218] Trial 848 finished with values: [-1000000000.0, 1000000000.0] and parameters: {'p_sma': 5, 'p_std': 21, 'p_atr': 15, 'p_adx': 20, 'rsi_period': 32, 'ema1': 24, 'ema2': 38, 'slip_atr_k': 0.017706983150586147, 'slip_spread_k': 0.41904675649217893, 'spread_hl_frac': 0.025030297412253263, 'bb_std_mult': 0.5699515442670261, 'rsi_os': 55, 'rsi_ob': 64, 'vol_spike': 0.05016683318547503, 'adx_thresh': 11.215022930507315, 'atr_min_pct': 0.005767017958563546, 'atr_max_pct': 0.10963141222214516, 'tp_mult': 1.793229871028219, 'tsl_mult': 0.1738471120922503, 'strategy': 'breakout', 'time_stop': 139, 'use_sma': True, 'use_atr': False, 'use_adx': False, 'use_ema': False, 'use_spike': False, 'rsi_required': True, 'edge_k': 0.6243129371823679, 'edge_cap': 0.8985164731042057, 'bull_strategy': 'breakout', 'bull_bb_std_mult': 1.6801750810020846, 'bull_rsi_os': 50, 'bull_rsi_ob': 89, 'bull_adx_thresh': 21.204454630769778, 'bull_atr_min_pct': 0.02009451514680614, 'bull_atr_max_pct': 0.10295593346583543, 'bull_tp_mult': 2.5320414168911722, 'bull_tsl_mult': 0.8139780368617355, 'bull_time_stop': 161, 'bull_use_sma': False, 'bull_use_ema': True, 'bull_use_atr': True, 'bull_use_adx': True, 'bull_use_spike': True, 'bull_rsi_required': False, 'bear_strategy': 'mean_reversion', 'bear_bb_std_mult': 1.6438154394179068, 'bear_rsi_os': 15, 'bear_rsi_ob': 77, 'bear_adx_thresh': 17.89339122300717, 'bear_atr_min_pct': 0.0018018698931897485, 'bear_atr_max_pct': 0.10699063467466041, 'bear_tp_mult': 1.6104079582137008, 'bear_tsl_mult': 0.20109795678421516, 'bear_time_stop': 67, 'bear_use_sma': True, 'bear_use_ema': False, 'bear_use_atr': True, 'bear_use_adx': True, 'bear_use_spike': True, 'bear_rsi_required': False, 'sideways_strategy': 'mean_reversion', 'sideways_bb_std_mult': 3.1065423648959394, 'sideways_rsi_os': 13, 'sideways_rsi_ob': 80, 'sideways_adx_thresh': 13.025808066461297, 'sideways_atr_min_pct': 0.02141618583353487, 'sideways_atr_max_pct': 0.07612161368934484, 'sideways_tp_mult': 1.1020680467862611, 'sideways_tsl_mult': 0.39465872139394054, 'sideways_time_stop': 125, 'sideways_use_sma': True, 'sideways_use_ema': False, 'sideways_use_atr': True, 'sideways_use_adx': True, 'sideways_use_spike': True, 'sideways_rsi_required': False}.
[I 2025-08-30 16:43:34,847] Trial 851 finished with values: [-1000000000.0, 1000000000.0] and parameters: {'p_sma': 7, 'p_std': 21, 'p_atr': 15, 'p_adx': 26, 'rsi_period': 33, 'ema1': 24, 'ema2': 37, 'slip_atr_k': 0.005306204529147641, 'slip_spread_k': 0.4260088057209625, 'spread_hl_frac': 0.024964490664358404, 'bb_std_mult': 0.5926241341027008, 'rsi_os': 55, 'rsi_ob': 84, 'vol_spike': 0.04861491475179719, 'adx_thresh': 8.180341405293468, 'atr_min_pct': 0.005273392326365464, 'atr_max_pct': 0.11582886800239063, 'tp_mult': 1.559249109008616, 'tsl_mult': 0.3606585216078242, 'strategy': 'mean_reversion', 'time_stop': 25, 'use_sma': True, 'use_atr': False, 'use_adx': True, 'use_ema': True, 'use_spike': False, 'rsi_required': True, 'edge_k': 0.613325778519385, 'edge_cap': 0.8851823084832334, 'bull_strategy': 'breakout', 'bull_bb_std_mult': 1.6525022891937096, 'bull_rsi_os': 29, 'bull_rsi_ob': 88, 'bull_adx_thresh': 15.177315598705778, 'bull_atr_min_pct': 0.015329995288922964, 'bull_atr_max_pct': 0.10363200917883052, 'bull_tp_mult': 1.5603227888013085, 'bull_tsl_mult': 0.8185932619639945, 'bull_time_stop': 216, 'bull_use_sma': False, 'bull_use_ema': True, 'bull_use_atr': True, 'bull_use_adx': True, 'bull_use_spike': False, 'bull_rsi_required': False, 'bear_strategy': 'mean_reversion', 'bear_bb_std_mult': 2.0377607577608376, 'bear_rsi_os': 5, 'bear_rsi_ob': 74, 'bear_adx_thresh': 19.87848040348138, 'bear_atr_min_pct': 0.008139336757993231, 'bear_atr_max_pct': 0.10694986611015868, 'bear_tp_mult': 2.675215865236646, 'bear_tsl_mult': 0.21952593656338798, 'bear_time_stop': 241, 'bear_use_sma': False, 'bear_use_ema': False, 'bear_use_atr': True, 'bear_use_adx': True, 'bear_use_spike': True, 'bear_rsi_required': False, 'sideways_strategy': 'mean_reversion', 'sideways_bb_std_mult': 1.6624724370375006, 'sideways_rsi_os': 38, 'sideways_rsi_ob': 82, 'sideways_adx_thresh': 11.589710480094402, 'sideways_atr_min_pct': 0.001877481290928705, 'sideways_atr_max_pct': 0.07420313353283894, 'sideways_tp_mult': 1.7171859307511461, 'sideways_tsl_mult': 0.3428869363676209, 'sideways_time_stop': 125, 'sideways_use_sma': True, 'sideways_use_ema': False, 'sideways_use_atr': True, 'sideways_use_adx': True, 'sideways_use_spike': False, 'sideways_rsi_required': True}.
[I 2025-08-30 16:44:23,373] Trial 852 finished with values: [-1000000000.0, 1000000000.0] and parameters: {'p_sma': 7, 'p_std': 29, 'p_atr': 13, 'p_adx': 20, 'rsi_period': 74, 'ema1': 17, 'ema2': 58, 'slip_atr_k': 0.005482553492510338, 'slip_spread_k': 0.684596860842693, 'spread_hl_frac': 0.005948432274598003, 'bb_std_mult': 1.034424045291621, 'rsi_os': 26, 'rsi_ob': 79, 'vol_spike': 0.013297291877519934, 'adx_thresh': 8.21221948380202, 'atr_min_pct': 0.02057596767825529, 'atr_max_pct': 0.02465062648431534, 'tp_mult': 2.560666381317532, 'tsl_mult': 0.21137138668523497, 'strategy': 'mean_reversion', 'time_stop': 149, 'use_sma': True, 'use_atr': False, 'use_adx': True, 'use_ema': True, 'use_spike': False, 'rsi_required': False, 'edge_k': 0.6361131039194865, 'edge_cap': 0.8879075369505337, 'bull_strategy': 'breakout', 'bull_bb_std_mult': 1.555987552835231, 'bull_rsi_os': 6, 'bull_rsi_ob': 46, 'bull_adx_thresh': 7.829485406408294, 'bull_atr_min_pct': 0.020049717512532105, 'bull_atr_max_pct': 0.09299857270434995, 'bull_tp_mult': 1.5690820578913665, 'bull_tsl_mult': 0.819030742075513, 'bull_time_stop': 160, 'bull_use_sma': False, 'bull_use_ema': True, 'bull_use_atr': True, 'bull_use_adx': True, 'bull_use_spike': False, 'bull_rsi_required': False, 'bear_strategy': 'mean_reversion', 'bear_bb_std_mult': 2.860949880630452, 'bear_rsi_os': 5, 'bear_rsi_ob': 87, 'bear_adx_thresh': 17.86442854558676, 'bear_atr_min_pct': 0.02188967567125641, 'bear_atr_max_pct': 0.05650957523189999, 'bear_tp_mult': 1.0463749309507482, 'bear_tsl_mult': 0.2176496289247502, 'bear_time_stop': 239, 'bear_use_sma': False, 'bear_use_ema': False, 'bear_use_atr': True, 'bear_use_adx': True, 'bear_use_spike': True, 'bear_rsi_required': True, 'sideways_strategy': 'mean_reversion', 'sideways_bb_std_mult': 1.7887755074477187, 'sideways_rsi_os': 34, 'sideways_rsi_ob': 82, 'sideways_adx_thresh': 13.056923866259172, 'sideways_atr_min_pct': 0.019503135549191787, 'sideways_atr_max_pct': 0.0745780296068414, 'sideways_tp_mult': 1.083904969526062, 'sideways_tsl_mult': 0.3011398827058914, 'sideways_time_stop': 123, 'sideways_use_sma': True, 'sideways_use_ema': False, 'sideways_use_atr': True, 'sideways_use_adx': True, 'sideways_use_spike': False, 'sideways_rsi_required': True}.
[I 2025-08-30 16:44:24,144] Trial 853 finished with values: [-1000000000.0, 1000000000.0] and parameters: {'p_sma': 10, 'p_std': 27, 'p_atr': 7, 'p_adx': 15, 'rsi_period': 8, 'ema1': 25, 'ema2': 37, 'slip_atr_k': 0.20858124908863757, 'slip_spread_k': 0.9623037991588161, 'spread_hl_frac': 0.007082470966190309, 'bb_std_mult': 2.2458357151552355, 'rsi_os': 26, 'rsi_ob': 90, 'vol_spike': 0.012017815115664077, 'adx_thresh': 6.46679841651955, 'atr_min_pct': 0.007738617921482314, 'atr_max_pct': 0.11588435389196503, 'tp_mult': 1.1283920825194431, 'tsl_mult': 0.3626145484601397, 'strategy': 'mean_reversion', 'time_stop': 177, 'use_sma': False, 'use_atr': False, 'use_adx': True, 'use_ema': True, 'use_spike': False, 'rsi_required': False, 'edge_k': 1.8414364159961398, 'edge_cap': 0.9520070558261563, 'bull_strategy': 'breakout', 'bull_bb_std_mult': 1.28356577084699, 'bull_rsi_os': 46, 'bull_rsi_ob': 69, 'bull_adx_thresh': 8.672983479766403, 'bull_atr_min_pct': 0.021722077477872585, 'bull_atr_max_pct': 0.14440061518676417, 'bull_tp_mult': 2.4493543209239563, 'bull_tsl_mult': 0.030267345463026285, 'bull_time_stop': 217, 'bull_use_sma': True, 'bull_use_ema': True, 'bull_use_atr': False, 'bull_use_adx': True, 'bull_use_spike': False, 'bull_rsi_required': False, 'bear_strategy': 'mean_reversion', 'bear_bb_std_mult': 1.8146084076910922, 'bear_rsi_os': 12, 'bear_rsi_ob': 45, 'bear_adx_thresh': 14.980331531342355, 'bear_atr_min_pct': 0.010751303749015832, 'bear_atr_max_pct': 0.03900651679415436, 'bear_tp_mult': 2.67126090487114, 'bear_tsl_mult': 0.12457114071556002, 'bear_time_stop': 84, 'bear_use_sma': False, 'bear_use_ema': False, 'bear_use_atr': True, 'bear_use_adx': True, 'bear_use_spike': True, 'bear_rsi_required': True, 'sideways_strategy': 'mean_reversion', 'sideways_bb_std_mult': 1.7750018931792286, 'sideways_rsi_os': 38, 'sideways_rsi_ob': 94, 'sideways_adx_thresh': 11.126048585597609, 'sideways_atr_min_pct': 0.018620114863508896, 'sideways_atr_max_pct': 0.08035923226124661, 'sideways_tp_mult': 1.698888167819125, 'sideways_tsl_mult': 0.3022412863307037, 'sideways_time_stop': 107, 'sideways_use_sma': True, 'sideways_use_ema': False, 'sideways_use_atr': True, 'sideways_use_adx': True, 'sideways_use_spike': False, 'sideways_rsi_required': True}.
[I 2025-08-30 16:44:25,232] Trial 854 finished with values: [-0.018218725174754424, 0.018179835076149002] and parameters: {'p_sma': 7, 'p_std': 30, 'p_atr': 12, 'p_adx': 25, 'rsi_period': 8, 'ema1': 25, 'ema2': 37, 'slip_atr_k': 0.20930125330737398, 'slip_spread_k': 0.7335387581944284, 'spread_hl_frac': 0.033404058768893324, 'bb_std_mult': 2.22432968559428, 'rsi_os': 26, 'rsi_ob': 90, 'vol_spike': 0.21303942342084128, 'adx_thresh': 24.864094266064527, 'atr_min_pct': 0.013647341481314459, 'atr_max_pct': 0.11545889962209206, 'tp_mult': 1.4626568907991129, 'tsl_mult': 0.36015961781508277, 'strategy': 'mean_reversion', 'time_stop': 150, 'use_sma': False, 'use_atr': False, 'use_adx': True, 'use_ema': True, 'use_spike': False, 'rsi_required': False, 'edge_k': 0.7857572240366919, 'edge_cap': 0.9559810378727015, 'bull_strategy': 'breakout', 'bull_bb_std_mult': 3.466908447122254, 'bull_rsi_os': 46, 'bull_rsi_ob': 69, 'bull_adx_thresh': 7.890669379703707, 'bull_atr_min_pct': 0.02563649446175323, 'bull_atr_max_pct': 0.10915568163481099, 'bull_tp_mult': 1.7982671113150377, 'bull_tsl_mult': 0.8687414264937071, 'bull_time_stop': 92, 'bull_use_sma': True, 'bull_use_ema': True, 'bull_use_atr': False, 'bull_use_adx': True, 'bull_use_spike': False, 'bull_rsi_required': False, 'bear_strategy': 'mean_reversion', 'bear_bb_std_mult': 2.6402998536079885, 'bear_rsi_os': 24, 'bear_rsi_ob': 49, 'bear_adx_thresh': 29.58715047845748, 'bear_atr_min_pct': 0.02222491964549369, 'bear_atr_max_pct': 0.03879320136399876, 'bear_tp_mult': 2.6554343210847935, 'bear_tsl_mult': 0.0766651574556006, 'bear_time_stop': 82, 'bear_use_sma': False, 'bear_use_ema': False, 'bear_use_atr': True, 'bear_use_adx': True, 'bear_use_spike': True, 'bear_rsi_required': True, 'sideways_strategy': 'mean_reversion', 'sideways_bb_std_mult': 3.2570361363925997, 'sideways_rsi_os': 25, 'sideways_rsi_ob': 82, 'sideways_adx_thresh': 21.17004986093979, 'sideways_atr_min_pct': 0.0015693857913219294, 'sideways_atr_max_pct': 0.0656071985466954, 'sideways_tp_mult': 1.9579277672533177, 'sideways_tsl_mult': 0.1386216386107929, 'sideways_time_stop': 115, 'sideways_use_sma': True, 'sideways_use_ema': False, 'sideways_use_atr': True, 'sideways_use_adx': True, 'sideways_use_spike': False, 'sideways_rsi_required': True}.
