[I 2025-08-30 15:49:59,663] Trial 567 finished with values: [-0.03893088260509392, 0.038921092472379626] and parameters: {'p_sma': 10, 'p_std': 24, 'p_atr': 9, 'p_adx': 26, 'rsi_period': 9, 'ema1': 24, 'ema2': 40, 'slip_atr_k': 0.18290044514067993, 'slip_spread_k': 0.6517707324233546, 'spread_hl_frac': 0.009414981674541637, 'bb_std_mult': 0.6533698730952857, 'rsi_os': 25, 'rsi_ob': 88, 'vol_spike': 0.0646532807581836, 'adx_thresh': 7.584470413769384, 'atr_min_pct': 0.021756232167629938, 'atr_max_pct': 0.12081917704415679, 'tp_mult': 1.488571322264512, 'tsl_mult': 0.3481921638980394, 'strategy': 'breakout', 'time_stop': 57, 'use_sma': False, 'use_atr': False, 'use_adx': True, 'use_ema': False, 'use_spike': False, 'rsi_required': False, 'edge_k': 1.2829826373201634, 'edge_cap': 0.3906532302339782, 'bull_strategy': 'breakout', 'bull_bb_std_mult': 1.5524648974330482, 'bull_rsi_os': 26, 'bull_rsi_ob': 86, 'bull_adx_thresh': 9.09881919088363, 'bull_atr_min_pct': 0.02272487806027397, 'bull_atr_max_pct': 0.10510623919886819, 'bull_tp_mult': 2.315337678117173, 'bull_tsl_mult': 0.481218532683988, 'bull_time_stop': 179, 'bull_use_sma': True, 'bull_use_ema': True, 'bull_use_atr': True, 'bull_use_adx': True, 'bull_use_spike': True, 'bull_rsi_required': True, 'bear_strategy': 'mean_reversion', 'bear_bb_std_mult': 1.8920912036215045, 'bear_rsi_os': 25, 'bear_rsi_ob': 73, 'bear_adx_thresh': 14.413943287924686, 'bear_atr_min_pct': 0.0013185909169511163, 'bear_atr_max_pct': 0.11151638504217237, 'bear_tp_mult': 2.66902589256005, 'bear_tsl_mult': 0.8965588450434117, 'bear_time_stop': 83, 'bear_use_sma': False, 'bear_use_ema': False, 'bear_use_atr': True, 'bear_use_adx': False, 'bear_use_spike': True, 'bear_rsi_required': True, 'sideways_strategy': 'mean_reversion', 'sideways_bb_std_mult': 3.1391654827327016, 'sideways_rsi_os': 15, 'sideways_rsi_ob': 76, 'sideways_adx_thresh': 9.237922567002176, 'sideways_atr_min_pct': 0.019282551139063665, 'sideways_atr_max_pct': 0.07384929446082884, 'sideways_tp_mult': 1.2496448636539295, 'sideways_tsl_mult': 0.42978762928966147, 'sideways_time_stop': 129, 'sideways_use_sma': True, 'sideways_use_ema': False, 'sideways_use_atr': True, 'sideways_use_adx': True, 'sideways_use_spike': True, 'sideways_rsi_required': True}.
[I 2025-08-30 15:50:00,419] Trial 565 finished with values: [-1000000000.0, 1000000000.0] and parameters: {'p_sma': 8, 'p_std': 19, 'p_atr': 29, 'p_adx': 26, 'rsi_period': 43, 'ema1': 23, 'ema2': 37, 'slip_atr_k': 0.00821194973823198, 'slip_spread_k': 0.6585773898080122, 'spread_hl_frac': 0.014752777227467394, 'bb_std_mult': 1.0050946858014338, 'rsi_os': 36, 'rsi_ob': 68, 'vol_spike': 0.20914891090919055, 'adx_thresh': 7.5108569894288255, 'atr_min_pct': 0.000736543320802148, 'atr_max_pct': 0.11224218288376578, 'tp_mult': 1.5213585576698532, 'tsl_mult': 0.3483398232955844, 'strategy': 'breakout', 'time_stop': 15, 'use_sma': True, 'use_atr': True, 'use_adx': False, 'use_ema': False, 'use_spike': False, 'rsi_required': False, 'edge_k': 0.9618064856080869, 'edge_cap': 0.3905112478919116, 'bull_strategy': 'breakout', 'bull_bb_std_mult': 0.8731926043293621, 'bull_rsi_os': 51, 'bull_rsi_ob': 89, 'bull_adx_thresh': 8.657466879661097, 'bull_atr_min_pct': 0.01701040419416825, 'bull_atr_max_pct': 0.05889005275012621, 'bull_tp_mult': 2.5872037587955448, 'bull_tsl_mult': 0.7639139426921528, 'bull_time_stop': 45, 'bull_use_sma': True, 'bull_use_ema': True, 'bull_use_atr': True, 'bull_use_adx': True, 'bull_use_spike': True, 'bull_rsi_required': True, 'bear_strategy': 'mean_reversion', 'bear_bb_std_mult': 1.6289878773322106, 'bear_rsi_os': 7, 'bear_rsi_ob': 52, 'bear_adx_thresh': 15.812301292456151, 'bear_atr_min_pct': 0.004063349293969128, 'bear_atr_max_pct': 0.11547749576102583, 'bear_tp_mult': 2.669639244983105, 'bear_tsl_mult': 0.8673221643402574, 'bear_time_stop': 86, 'bear_use_sma': True, 'bear_use_ema': False, 'bear_use_atr': False, 'bear_use_adx': False, 'bear_use_spike': True, 'bear_rsi_required': True, 'sideways_strategy': 'mean_reversion', 'sideways_bb_std_mult': 1.8012748654015565, 'sideways_rsi_os': 11, 'sideways_rsi_ob': 74, 'sideways_adx_thresh': 14.824389711170646, 'sideways_atr_min_pct': 0.0182985431273192, 'sideways_atr_max_pct': 0.07458489983560052, 'sideways_tp_mult': 1.6908604015192916, 'sideways_tsl_mult': 0.03291934083561049, 'sideways_time_stop': 119, 'sideways_use_sma': True, 'sideways_use_ema': False, 'sideways_use_atr': False, 'sideways_use_adx': False, 'sideways_use_spike': True, 'sideways_rsi_required': True}.
[I 2025-08-30 15:50:44,842] Trial 570 finished with values: [-1000000000.0, 1000000000.0] and parameters: {'p_sma': 6, 'p_std': 12, 'p_atr': 30, 'p_adx': 25, 'rsi_period': 11, 'ema1': 24, 'ema2': 58, 'slip_atr_k': 0.007646579768659034, 'slip_spread_k': 0.7017164031345082, 'spread_hl_frac': 0.03280480483994091, 'bb_std_mult': 0.5971424006159536, 'rsi_os': 26, 'rsi_ob': 68, 'vol_spike': 0.2083705077068588, 'adx_thresh': 7.704727280027932, 'atr_min_pct': 0.012808139624344746, 'atr_max_pct': 0.013943895216319488, 'tp_mult': 1.2399543534961457, 'tsl_mult': 0.3434555245649339, 'strategy': 'mean_reversion', 'time_stop': 155, 'use_sma': False, 'use_atr': False, 'use_adx': True, 'use_ema': False, 'use_spike': True, 'rsi_required': False, 'edge_k': 0.7916895692180139, 'edge_cap': 0.9732121957985767, 'bull_strategy': 'breakout', 'bull_bb_std_mult': 1.2978105974884346, 'bull_rsi_os': 46, 'bull_rsi_ob': 87, 'bull_adx_thresh': 10.526358993002455, 'bull_atr_min_pct': 0.02187519383334463, 'bull_atr_max_pct': 0.10385230313596822, 'bull_tp_mult': 2.504996147414578, 'bull_tsl_mult': 0.8483614441359789, 'bull_time_stop': 177, 'bull_use_sma': False, 'bull_use_ema': True, 'bull_use_atr': False, 'bull_use_adx': True, 'bull_use_spike': True, 'bull_rsi_required': False, 'bear_strategy': 'mean_reversion', 'bear_bb_std_mult': 1.9517209579489736, 'bear_rsi_os': 44, 'bear_rsi_ob': 77, 'bear_adx_thresh': 16.971229153892494, 'bear_atr_min_pct': 0.005098653880050221, 'bear_atr_max_pct': 0.11350320372728664, 'bear_tp_mult': 2.6182658399981573, 'bear_tsl_mult': 0.8427318456234727, 'bear_time_stop': 105, 'bear_use_sma': True, 'bear_use_ema': False, 'bear_use_atr': True, 'bear_use_adx': True, 'bear_use_spike': False, 'bear_rsi_required': True, 'sideways_strategy': 'mean_reversion', 'sideways_bb_std_mult': 3.2848242458946526, 'sideways_rsi_os': 24, 'sideways_rsi_ob': 74, 'sideways_adx_thresh': 12.028199449450033, 'sideways_atr_min_pct': 0.020785125502312016, 'sideways_atr_max_pct': 0.07104514948677094, 'sideways_tp_mult': 1.8994651491368861, 'sideways_tsl_mult': 0.4650417261640294, 'sideways_time_stop': 140, 'sideways_use_sma': True, 'sideways_use_ema': False, 'sideways_use_atr': True, 'sideways_use_adx': True, 'sideways_use_spike': False, 'sideways_rsi_required': True}.
[I 2025-08-30 15:50:45,534] Trial 571 finished with values: [-1000000000.0, 1000000000.0] and parameters: {'p_sma': 6, 'p_std': 20, 'p_atr': 26, 'p_adx': 25, 'rsi_period': 76, 'ema1': 24, 'ema2': 23, 'slip_atr_k': 0.006892745999543982, 'slip_spread_k': 0.9948156520495777, 'spread_hl_frac': 0.014317900974544884, 'bb_std_mult': 0.629329402981309, 'rsi_os': 35, 'rsi_ob': 68, 'vol_spike': 0.21611172723274932, 'adx_thresh': 6.536407084049058, 'atr_min_pct': 0.006929849849655413, 'atr_max_pct': 0.10913434598980476, 'tp_mult': 1.240005801473012, 'tsl_mult': 0.3739109249146718, 'strategy': 'mean_reversion', 'time_stop': 172, 'use_sma': False, 'use_atr': False, 'use_adx': True, 'use_ema': False, 'use_spike': True, 'rsi_required': True, 'edge_k': 0.5492677164734601, 'edge_cap': 0.964805877934773, 'bull_strategy': 'breakout', 'bull_bb_std_mult': 1.2984941792980154, 'bull_rsi_os': 46, 'bull_rsi_ob': 87, 'bull_adx_thresh': 10.662245851435108, 'bull_atr_min_pct': 0.016857217898173855, 'bull_atr_max_pct': 0.058278535352484506, 'bull_tp_mult': 1.7406210600064307, 'bull_tsl_mult': 0.23404844559944432, 'bull_time_stop': 79, 'bull_use_sma': False, 'bull_use_ema': True, 'bull_use_atr': False, 'bull_use_adx': True, 'bull_use_spike': True, 'bull_rsi_required': False, 'bear_strategy': 'mean_reversion', 'bear_bb_std_mult': 1.7473084493599849, 'bear_rsi_os': 39, 'bear_rsi_ob': 77, 'bear_adx_thresh': 16.921323895546795, 'bear_atr_min_pct': 0.003044714125660295, 'bear_atr_max_pct': 0.10924181642662259, 'bear_tp_mult': 2.6399729919706543, 'bear_tsl_mult': 0.8311577141638813, 'bear_time_stop': 97, 'bear_use_sma': True, 'bear_use_ema': False, 'bear_use_atr': True, 'bear_use_adx': True, 'bear_use_spike': False, 'bear_rsi_required': False, 'sideways_strategy': 'mean_reversion', 'sideways_bb_std_mult': 1.7896197701339691, 'sideways_rsi_os': 25, 'sideways_rsi_ob': 78, 'sideways_adx_thresh': 23.261522930826395, 'sideways_atr_min_pct': 0.02078633528509987, 'sideways_atr_max_pct': 0.1303453963544342, 'sideways_tp_mult': 2.6569061996325587, 'sideways_tsl_mult': 0.36859395133463085, 'sideways_time_stop': 142, 'sideways_use_sma': True, 'sideways_use_ema': False, 'sideways_use_atr': True, 'sideways_use_adx': True, 'sideways_use_spike': False, 'sideways_rsi_required': True}.
[I 2025-08-30 15:50:47,078] Trial 569 finished with values: [-1000000000.0, 1000000000.0] and parameters: {'p_sma': 31, 'p_std': 24, 'p_atr': 11, 'p_adx': 13, 'rsi_period': 11, 'ema1': 25, 'ema2': 37, 'slip_atr_k': 0.00872618905412973, 'slip_spread_k': 0.8542602408257118, 'spread_hl_frac': 0.0062531468897075865, 'bb_std_mult': 0.6351623860650243, 'rsi_os': 26, 'rsi_ob': 87, 'vol_spike': 0.21495329528324378, 'adx_thresh': 7.37456677691784, 'atr_min_pct': 0.006923680596049101, 'atr_max_pct': 0.10973278292303681, 'tp_mult': 2.7020800544260952, 'tsl_mult': 0.3655692054109047, 'strategy': 'breakout', 'time_stop': 143, 'use_sma': False, 'use_atr': False, 'use_adx': True, 'use_ema': False, 'use_spike': True, 'rsi_required': False, 'edge_k': 0.564759180769767, 'edge_cap': 0.22162038804470174, 'bull_strategy': 'breakout', 'bull_bb_std_mult': 1.6386852424787646, 'bull_rsi_os': 46, 'bull_rsi_ob': 90, 'bull_adx_thresh': 8.791455218028045, 'bull_atr_min_pct': 0.01704494375510914, 'bull_atr_max_pct': 0.07406413148257311, 'bull_tp_mult': 2.5257234350972615, 'bull_tsl_mult': 0.8804005977327397, 'bull_time_stop': 48, 'bull_use_sma': True, 'bull_use_ema': True, 'bull_use_atr': True, 'bull_use_adx': True, 'bull_use_spike': True, 'bull_rsi_required': False, 'bear_strategy': 'mean_reversion', 'bear_bb_std_mult': 1.8081513258181185, 'bear_rsi_os': 25, 'bear_rsi_ob': 77, 'bear_adx_thresh': 15.744705062681062, 'bear_atr_min_pct': 0.0050840649851562544, 'bear_atr_max_pct': 0.11405431239557312, 'bear_tp_mult': 2.6168978914506797, 'bear_tsl_mult': 0.8403638795874332, 'bear_time_stop': 185, 'bear_use_sma': True, 'bear_use_ema': False, 'bear_use_atr': True, 'bear_use_adx': False, 'bear_use_spike': True, 'bear_rsi_required': True, 'sideways_strategy': 'mean_reversion', 'sideways_bb_std_mult': 3.2863320352667427, 'sideways_rsi_os': 15, 'sideways_rsi_ob': 71, 'sideways_adx_thresh': 28.87438255456303, 'sideways_atr_min_pct': 0.020280706929324273, 'sideways_atr_max_pct': 0.07416823770978462, 'sideways_tp_mult': 1.8923821005813986, 'sideways_tsl_mult': 0.6135687223104793, 'sideways_time_stop': 281, 'sideways_use_sma': True, 'sideways_use_ema': False, 'sideways_use_atr': True, 'sideways_use_adx': True, 'sideways_use_spike': True, 'sideways_rsi_required': True}.
[I 2025-08-30 15:50:47,600] Trial 572 finished with values: [-1000000000.0, 1000000000.0] and parameters: {'p_sma': 35, 'p_std': 55, 'p_atr': 26, 'p_adx': 25, 'rsi_period': 11, 'ema1': 25, 'ema2': 59, 'slip_atr_k': 0.004824341273719626, 'slip_spread_k': 0.40693211031586907, 'spread_hl_frac': 0.006005702282918886, 'bb_std_mult': 0.597342462517759, 'rsi_os': 26, 'rsi_ob': 78, 'vol_spike': 0.21503249313627157, 'adx_thresh': 10.47154643651764, 'atr_min_pct': 0.007034432025223194, 'atr_max_pct': 0.10973886407246905, 'tp_mult': 1.554584677176644, 'tsl_mult': 0.3734837760786435, 'strategy': 'mean_reversion', 'time_stop': 153, 'use_sma': False, 'use_atr': False, 'use_adx': True, 'use_ema': False, 'use_spike': True, 'rsi_required': True, 'edge_k': 0.5809671999409172, 'edge_cap': 0.22269032662085264, 'bull_strategy': 'breakout', 'bull_bb_std_mult': 1.6409180574535118, 'bull_rsi_os': 19, 'bull_rsi_ob': 87, 'bull_adx_thresh': 10.707505112439035, 'bull_atr_min_pct': 0.02117248497115297, 'bull_atr_max_pct': 0.11025125827294865, 'bull_tp_mult': 2.505861044762799, 'bull_tsl_mult': 0.906391325263161, 'bull_time_stop': 56, 'bull_use_sma': False, 'bull_use_ema': False, 'bull_use_atr': False, 'bull_use_adx': True, 'bull_use_spike': True, 'bull_rsi_required': False, 'bear_strategy': 'mean_reversion', 'bear_bb_std_mult': 1.9634937920652231, 'bear_rsi_os': 26, 'bear_rsi_ob': 56, 'bear_adx_thresh': 17.107465600168133, 'bear_atr_min_pct': 0.00518951149973912, 'bear_atr_max_pct': 0.10832408451666455, 'bear_tp_mult': 2.619987070901873, 'bear_tsl_mult': 0.8329487668693488, 'bear_time_stop': 185, 'bear_use_sma': True, 'bear_use_ema': True, 'bear_use_atr': True, 'bear_use_adx': True, 'bear_use_spike': False, 'bear_rsi_required': False, 'sideways_strategy': 'breakout', 'sideways_bb_std_mult': 3.278366240764095, 'sideways_rsi_os': 19, 'sideways_rsi_ob': 71, 'sideways_adx_thresh': 11.954633393219657, 'sideways_atr_min_pct': 0.02039280783292156, 'sideways_atr_max_pct': 0.0702900202354537, 'sideways_tp_mult': 1.8013538828464537, 'sideways_tsl_mult': 0.6044763671203233, 'sideways_time_stop': 139, 'sideways_use_sma': False, 'sideways_use_ema': True, 'sideways_use_atr': True, 'sideways_use_adx': True, 'sideways_use_spike': False, 'sideways_rsi_required': True}.
[I 2025-08-30 15:51:32,299] Trial 575 finished with values: [-1000000000.0, 1000000000.0] and parameters: {'p_sma': 21, 'p_std': 55, 'p_atr': 10, 'p_adx': 19, 'rsi_period': 80, 'ema1': 22, 'ema2': 13, 'slip_atr_k': 0.003696380405022886, 'slip_spread_k': 0.7372253158475898, 'spread_hl_frac': 0.00550990923029997, 'bb_std_mult': 0.7334838719799147, 'rsi_os': 29, 'rsi_ob': 83, 'vol_spike': 0.05485579943850148, 'adx_thresh': 10.000768100739121, 'atr_min_pct': 0.006299221447906353, 'atr_max_pct': 0.040968813613181186, 'tp_mult': 2.65212001873038, 'tsl_mult': 0.3065027242082239, 'strategy': 'breakout', 'time_stop': 152, 'use_sma': False, 'use_atr': False, 'use_adx': True, 'use_ema': True, 'use_spike': False, 'rsi_required': True, 'edge_k': 1.9509891638535874, 'edge_cap': 0.933163798345566, 'bull_strategy': 'mean_reversion', 'bull_bb_std_mult': 2.270084338122907, 'bull_rsi_os': 50, 'bull_rsi_ob': 87, 'bull_adx_thresh': 16.39795184942972, 'bull_atr_min_pct': 0.0211719989829812, 'bull_atr_max_pct': 0.11270791052057035, 'bull_tp_mult': 2.5933966835850155, 'bull_tsl_mult': 0.4554419352297774, 'bull_time_stop': 57, 'bull_use_sma': True, 'bull_use_ema': False, 'bull_use_atr': True, 'bull_use_adx': True, 'bull_use_spike': False, 'bull_rsi_required': False, 'bear_strategy': 'breakout', 'bear_bb_std_mult': 1.8170619983685168, 'bear_rsi_os': 26, 'bear_rsi_ob': 75, 'bear_adx_thresh': 18.321116793404826, 'bear_atr_min_pct': 0.008484255193384988, 'bear_atr_max_pct': 0.10129682418466979, 'bear_tp_mult': 2.730621001624135, 'bear_tsl_mult': 0.8075406772053525, 'bear_time_stop': 94, 'bear_use_sma': True, 'bear_use_ema': True, 'bear_use_atr': True, 'bear_use_adx': True, 'bear_use_spike': True, 'bear_rsi_required': False, 'sideways_strategy': 'breakout', 'sideways_bb_std_mult': 2.791486377699118, 'sideways_rsi_os': 19, 'sideways_rsi_ob': 81, 'sideways_adx_thresh': 10.160558864549031, 'sideways_atr_min_pct': 0.006143074224849197, 'sideways_atr_max_pct': 0.06838459339520883, 'sideways_tp_mult': 1.4092168202695534, 'sideways_tsl_mult': 0.3575050593689766, 'sideways_time_stop': 125, 'sideways_use_sma': False, 'sideways_use_ema': True, 'sideways_use_atr': True, 'sideways_use_adx': True, 'sideways_use_spike': True, 'sideways_rsi_required': False}.
[I 2025-08-30 15:51:33,073] Trial 574 finished with values: [-1000000000.0, 1000000000.0] and parameters: {'p_sma': 21, 'p_std': 17, 'p_atr': 22, 'p_adx': 25, 'rsi_period': 11, 'ema1': 25, 'ema2': 37, 'slip_atr_k': 0.16318702982314942, 'slip_spread_k': 0.8605226365185453, 'spread_hl_frac': 0.005915856939572221, 'bb_std_mult': 2.0609169733701815, 'rsi_os': 32, 'rsi_ob': 78, 'vol_spike': 0.21613278103695824, 'adx_thresh': 23.864133559196077, 'atr_min_pct': 0.02275545172965906, 'atr_max_pct': 0.042387599942329185, 'tp_mult': 1.5591611483086898, 'tsl_mult': 0.3110936963724307, 'strategy': 'breakout', 'time_stop': 145, 'use_sma': False, 'use_atr': False, 'use_adx': True, 'use_ema': True, 'use_spike': False, 'rsi_required': True, 'edge_k': 0.5900655645970271, 'edge_cap': 0.9376170240264203, 'bull_strategy': 'mean_reversion', 'bull_bb_std_mult': 1.6376769161248064, 'bull_rsi_os': 50, 'bull_rsi_ob': 95, 'bull_adx_thresh': 16.349010440967703, 'bull_atr_min_pct': 0.01971207832272914, 'bull_atr_max_pct': 0.1118786766823761, 'bull_tp_mult': 2.5972626476976197, 'bull_tsl_mult': 0.9091635508892966, 'bull_time_stop': 51, 'bull_use_sma': True, 'bull_use_ema': False, 'bull_use_atr': True, 'bull_use_adx': True, 'bull_use_spike': False, 'bull_rsi_required': False, 'bear_strategy': 'breakout', 'bear_bb_std_mult': 1.8199685685720748, 'bear_rsi_os': 26, 'bear_rsi_ob': 75, 'bear_adx_thresh': 16.268293634686383, 'bear_atr_min_pct': 0.0020271636048961733, 'bear_atr_max_pct': 0.10847560458473685, 'bear_tp_mult': 2.7797136235935596, 'bear_tsl_mult': 0.1739658361822331, 'bear_time_stop': 206, 'bear_use_sma': True, 'bear_use_ema': True, 'bear_use_atr': True, 'bear_use_adx': True, 'bear_use_spike': True, 'bear_rsi_required': False, 'sideways_strategy': 'breakout', 'sideways_bb_std_mult': 1.638098646141358, 'sideways_rsi_os': 19, 'sideways_rsi_ob': 71, 'sideways_adx_thresh': 31.9799242817588, 'sideways_atr_min_pct': 0.010217976379873659, 'sideways_atr_max_pct': 0.06763032039110319, 'sideways_tp_mult': 1.8197246634080035, 'sideways_tsl_mult': 0.35583935003936884, 'sideways_time_stop': 134, 'sideways_use_sma': False, 'sideways_use_ema': True, 'sideways_use_atr': True, 'sideways_use_adx': True, 'sideways_use_spike': True, 'sideways_rsi_required': False}.
[I 2025-08-30 15:51:33,092] Trial 576 finished with values: [-1000000000.0, 1000000000.0] and parameters: {'p_sma': 21, 'p_std': 17, 'p_atr': 10, 'p_adx': 26, 'rsi_period': 64, 'ema1': 5, 'ema2': 38, 'slip_atr_k': 0.014312310858141278, 'slip_spread_k': 0.7292824393576046, 'spread_hl_frac': 0.005751096288593061, 'bb_std_mult': 0.9034563506435722, 'rsi_os': 29, 'rsi_ob': 47, 'vol_spike': 0.1994248060739546, 'adx_thresh': 9.84175345921971, 'atr_min_pct': 0.005719904032246477, 'atr_max_pct': 0.11370180269122465, 'tp_mult': 1.1755736038018472, 'tsl_mult': 0.3103908231628869, 'strategy': 'breakout', 'time_stop': 159, 'use_sma': False, 'use_atr': False, 'use_adx': True, 'use_ema': True, 'use_spike': False, 'rsi_required': False, 'edge_k': 1.2089137701195094, 'edge_cap': 0.9002576937062176, 'bull_strategy': 'mean_reversion', 'bull_bb_std_mult': 1.1914673055099674, 'bull_rsi_os': 50, 'bull_rsi_ob': 89, 'bull_adx_thresh': 15.877045543186206, 'bull_atr_min_pct': 0.01958114494740835, 'bull_atr_max_pct': 0.11313897282074714, 'bull_tp_mult': 2.0615408718281736, 'bull_tsl_mult': 0.4605747477035877, 'bull_time_stop': 270, 'bull_use_sma': True, 'bull_use_ema': False, 'bull_use_atr': True, 'bull_use_adx': True, 'bull_use_spike': False, 'bull_rsi_required': False, 'bear_strategy': 'breakout', 'bear_bb_std_mult': 1.8188371682683744, 'bear_rsi_os': 26, 'bear_rsi_ob': 74, 'bear_adx_thresh': 16.427843006503426, 'bear_atr_min_pct': 0.0021064260393517656, 'bear_atr_max_pct': 0.10205230366835301, 'bear_tp_mult': 1.212046504271394, 'bear_tsl_mult': 0.06685347363687194, 'bear_time_stop': 92, 'bear_use_sma': True, 'bear_use_ema': True, 'bear_use_atr': True, 'bear_use_adx': True, 'bear_use_spike': True, 'bear_rsi_required': True, 'sideways_strategy': 'breakout', 'sideways_bb_std_mult': 2.7572831096421364, 'sideways_rsi_os': 7, 'sideways_rsi_ob': 81, 'sideways_adx_thresh': 10.404146390953095, 'sideways_atr_min_pct': 0.019526109441373025, 'sideways_atr_max_pct': 0.06707869730381763, 'sideways_tp_mult': 1.431385043157414, 'sideways_tsl_mult': 0.3508254361532346, 'sideways_time_stop': 50, 'sideways_use_sma': False, 'sideways_use_ema': True, 'sideways_use_atr': True, 'sideways_use_adx': True, 'sideways_use_spike': True, 'sideways_rsi_required': False}.
