[I 2025-08-30 14:55:46,760] Trial 288 finished with values: [-0.00718843487906029, 0.007178949816855832] and parameters: {'p_sma': 42, 'p_std': 32, 'p_atr': 18, 'p_adx': 29, 'rsi_period': 55, 'ema1': 10, 'ema2': 52, 'slip_atr_k': 0.031090897074187884, 'slip_spread_k': 0.24865540426005722, 'spread_hl_frac': 0.0030194377847844326, 'bb_std_mult': 3.1161361963489242, 'rsi_os': 5, 'rsi_ob': 91, 'vol_spike': 0.2836934757468186, 'adx_thresh': 15.018726673404885, 'atr_min_pct': 0.002981503274449514, 'atr_max_pct': 0.08910144265712303, 'tp_mult': 2.391927046759015, 'tsl_mult': 0.5165945043476718, 'strategy': 'breakout', 'time_stop': 261, 'use_sma': False, 'use_atr': False, 'use_adx': True, 'use_ema': False, 'use_spike': False, 'rsi_required': False, 'edge_k': 0.2725877011383222, 'edge_cap': 0.8402332970070044, 'bull_strategy': 'breakout', 'bull_bb_std_mult': 2.4686791194581694, 'bull_rsi_os': 50, 'bull_rsi_ob': 50, 'bull_adx_thresh': 28.93091513708844, 'bull_atr_min_pct': 0.0011248166414906278, 'bull_atr_max_pct': 0.08052715688472094, 'bull_tp_mult': 1.016114107544227, 'bull_tsl_mult': 0.95176765318484, 'bull_time_stop': 124, 'bull_use_sma': True, 'bull_use_ema': True, 'bull_use_atr': True, 'bull_use_adx': False, 'bull_use_spike': True, 'bull_rsi_required': False, 'bear_strategy': 'mean_reversion', 'bear_bb_std_mult': 3.0143097411652913, 'bear_rsi_os': 30, 'bear_rsi_ob': 84, 'bear_adx_thresh': 5.729526873480701, 'bear_atr_min_pct': 0.029607551953207734, 'bear_atr_max_pct': 0.010329535501132931, 'bear_tp_mult': 2.8181937606130254, 'bear_tsl_mult': 0.6285391691267962, 'bear_time_stop': 262, 'bear_use_sma': True, 'bear_use_ema': False, 'bear_use_atr': True, 'bear_use_adx': True, 'bear_use_spike': True, 'bear_rsi_required': True, 'sideways_strategy': 'mean_reversion', 'sideways_bb_std_mult': 1.118433188024222, 'sideways_rsi_os': 37, 'sideways_rsi_ob': 57, 'sideways_adx_thresh': 18.15089801104174, 'sideways_atr_min_pct': 0.02256697159831024, 'sideways_atr_max_pct': 0.08767212255502499, 'sideways_tp_mult': 2.3026777425444074, 'sideways_tsl_mult': 0.9225507655667534, 'sideways_time_stop': 102, 'sideways_use_sma': True, 'sideways_use_ema': False, 'sideways_use_atr': True, 'sideways_use_adx': True, 'sideways_use_spike': True, 'sideways_rsi_required': True}.
[I 2025-08-30 14:56:17,838] Trial 289 finished with values: [-0.007040421501791405, 0.007075271496950705] and parameters: {'p_sma': 42, 'p_std': 32, 'p_atr': 18, 'p_adx': 29, 'rsi_period': 55, 'ema1': 10, 'ema2': 52, 'slip_atr_k': 0.02763218752819226, 'slip_spread_k': 0.25630717340908665, 'spread_hl_frac': 0.002975116726895661, 'bb_std_mult': 3.1157868692713366, 'rsi_os': 5, 'rsi_ob': 91, 'vol_spike': 0.2838656364031046, 'adx_thresh': 14.937602203151368, 'atr_min_pct': 0.004173123464215699, 'atr_max_pct': 0.0895103545241329, 'tp_mult': 2.401335006134778, 'tsl_mult': 0.5539885138173644, 'strategy': 'breakout', 'time_stop': 260, 'use_sma': False, 'use_atr': False, 'use_adx': True, 'use_ema': False, 'use_spike': False, 'rsi_required': False, 'edge_k': 0.28165575492431083, 'edge_cap': 0.840246743970991, 'bull_strategy': 'breakout', 'bull_bb_std_mult': 2.481386962683348, 'bull_rsi_os': 50, 'bull_rsi_ob': 50, 'bull_adx_thresh': 29.779916108460462, 'bull_atr_min_pct': 0.0009140958822286099, 'bull_atr_max_pct': 0.08052910471238114, 'bull_tp_mult': 1.0108777873811747, 'bull_tsl_mult': 0.9581865278199052, 'bull_time_stop': 121, 'bull_use_sma': True, 'bull_use_ema': True, 'bull_use_atr': True, 'bull_use_adx': False, 'bull_use_spike': True, 'bull_rsi_required': False, 'bear_strategy': 'mean_reversion', 'bear_bb_std_mult': 3.0637444194926857, 'bear_rsi_os': 30, 'bear_rsi_ob': 83, 'bear_adx_thresh': 5.678045710548872, 'bear_atr_min_pct': 0.029975542051636408, 'bear_atr_max_pct': 0.011173993120742796, 'bear_tp_mult': 2.819082040150102, 'bear_tsl_mult': 0.5828024321606506, 'bear_time_stop': 262, 'bear_use_sma': True, 'bear_use_ema': False, 'bear_use_atr': True, 'bear_use_adx': True, 'bear_use_spike': True, 'bear_rsi_required': True, 'sideways_strategy': 'mean_reversion', 'sideways_bb_std_mult': 1.123751240298095, 'sideways_rsi_os': 35, 'sideways_rsi_ob': 57, 'sideways_adx_thresh': 18.281175438666633, 'sideways_atr_min_pct': 0.0225588899126588, 'sideways_atr_max_pct': 0.08756262182013211, 'sideways_tp_mult': 2.2925071752998245, 'sideways_tsl_mult': 0.9159787498654858, 'sideways_time_stop': 101, 'sideways_use_sma': True, 'sideways_use_ema': False, 'sideways_use_atr': True, 'sideways_use_adx': True, 'sideways_use_spike': True, 'sideways_rsi_required': True}.
[I 2025-08-30 14:56:18,063] Trial 292 finished with values: [-0.0065801874802349225, 0.006616186572494257] and parameters: {'p_sma': 42, 'p_std': 32, 'p_atr': 18, 'p_adx': 29, 'rsi_period': 55, 'ema1': 10, 'ema2': 53, 'slip_atr_k': 0.027093521499613207, 'slip_spread_k': 0.23756354807588112, 'spread_hl_frac': 0.0032769141807103483, 'bb_std_mult': 3.107574761039983, 'rsi_os': 5, 'rsi_ob': 91, 'vol_spike': 0.2828697840207516, 'adx_thresh': 15.09591655260803, 'atr_min_pct': 0.00539919521441583, 'atr_max_pct': 0.09088494888627018, 'tp_mult': 2.4017055802625826, 'tsl_mult': 0.51642292122981, 'strategy': 'breakout', 'time_stop': 258, 'use_sma': False, 'use_atr': False, 'use_adx': True, 'use_ema': False, 'use_spike': False, 'rsi_required': False, 'edge_k': 0.18853247772219636, 'edge_cap': 0.8416933591791902, 'bull_strategy': 'breakout', 'bull_bb_std_mult': 2.4828939465854183, 'bull_rsi_os': 50, 'bull_rsi_ob': 50, 'bull_adx_thresh': 29.775806878136738, 'bull_atr_min_pct': 0.0011981067614527698, 'bull_atr_max_pct': 0.0799132330473174, 'bull_tp_mult': 1.0147258561211459, 'bull_tsl_mult': 0.9544379103111268, 'bull_time_stop': 121, 'bull_use_sma': True, 'bull_use_ema': True, 'bull_use_atr': True, 'bull_use_adx': False, 'bull_use_spike': True, 'bull_rsi_required': True, 'bear_strategy': 'mean_reversion', 'bear_bb_std_mult': 3.0495088783319275, 'bear_rsi_os': 30, 'bear_rsi_ob': 84, 'bear_adx_thresh': 5.721620571528611, 'bear_atr_min_pct': 0.029763366388270467, 'bear_atr_max_pct': 0.010020641334707002, 'bear_tp_mult': 2.8251441011789344, 'bear_tsl_mult': 0.6219663461436188, 'bear_time_stop': 262, 'bear_use_sma': True, 'bear_use_ema': False, 'bear_use_atr': True, 'bear_use_adx': True, 'bear_use_spike': True, 'bear_rsi_required': True, 'sideways_strategy': 'mean_reversion', 'sideways_bb_std_mult': 1.1966139770873045, 'sideways_rsi_os': 35, 'sideways_rsi_ob': 57, 'sideways_adx_thresh': 18.183885061950193, 'sideways_atr_min_pct': 0.022665260402166543, 'sideways_atr_max_pct': 0.08744586823163893, 'sideways_tp_mult': 2.3028570789188616, 'sideways_tsl_mult': 0.9435540563596483, 'sideways_time_stop': 103, 'sideways_use_sma': True, 'sideways_use_ema': False, 'sideways_use_atr': True, 'sideways_use_adx': True, 'sideways_use_spike': True, 'sideways_rsi_required': True}.
[I 2025-08-30 14:56:18,253] Trial 290 finished with values: [-0.006695517092872971, 0.0067304870900415275] and parameters: {'p_sma': 42, 'p_std': 32, 'p_atr': 18, 'p_adx': 29, 'rsi_period': 55, 'ema1': 10, 'ema2': 52, 'slip_atr_k': 0.027227422010194333, 'slip_spread_k': 0.24668245933247465, 'spread_hl_frac': 0.002686077729255845, 'bb_std_mult': 3.1084092653884334, 'rsi_os': 5, 'rsi_ob': 91, 'vol_spike': 0.2827292114450348, 'adx_thresh': 15.014126125156729, 'atr_min_pct': 0.005584428403996278, 'atr_max_pct': 0.08962186658020732, 'tp_mult': 2.399240819699585, 'tsl_mult': 0.49941090513622377, 'strategy': 'breakout', 'time_stop': 261, 'use_sma': False, 'use_atr': False, 'use_adx': True, 'use_ema': False, 'use_spike': False, 'rsi_required': False, 'edge_k': 0.27761077298453474, 'edge_cap': 0.8421702242854697, 'bull_strategy': 'breakout', 'bull_bb_std_mult': 2.6122284504250337, 'bull_rsi_os': 50, 'bull_rsi_ob': 50, 'bull_adx_thresh': 29.970532694647083, 'bull_atr_min_pct': 0.0010859353908403882, 'bull_atr_max_pct': 0.08064404330810669, 'bull_tp_mult': 1.0184796650145678, 'bull_tsl_mult': 0.9585318378976498, 'bull_time_stop': 121, 'bull_use_sma': True, 'bull_use_ema': True, 'bull_use_atr': True, 'bull_use_adx': False, 'bull_use_spike': True, 'bull_rsi_required': False, 'bear_strategy': 'mean_reversion', 'bear_bb_std_mult': 3.0419917324029373, 'bear_rsi_os': 30, 'bear_rsi_ob': 83, 'bear_adx_thresh': 5.676683501245678, 'bear_atr_min_pct': 0.02991186614387334, 'bear_atr_max_pct': 0.010354092721822526, 'bear_tp_mult': 2.8244761665714764, 'bear_tsl_mult': 0.6284765737844211, 'bear_time_stop': 262, 'bear_use_sma': True, 'bear_use_ema': False, 'bear_use_atr': True, 'bear_use_adx': True, 'bear_use_spike': True, 'bear_rsi_required': True, 'sideways_strategy': 'mean_reversion', 'sideways_bb_std_mult': 1.1277657395403253, 'sideways_rsi_os': 35, 'sideways_rsi_ob': 57, 'sideways_adx_thresh': 18.213767247360604, 'sideways_atr_min_pct': 0.022551394728182274, 'sideways_atr_max_pct': 0.08643847571794602, 'sideways_tp_mult': 2.3045004123404356, 'sideways_tsl_mult': 0.9123233905047533, 'sideways_time_stop': 103, 'sideways_use_sma': True, 'sideways_use_ema': False, 'sideways_use_atr': True, 'sideways_use_adx': True, 'sideways_use_spike': True, 'sideways_rsi_required': True}.
[I 2025-08-30 14:56:18,253] Trial 291 finished with values: [-0.006879974974472347, 0.0069148876063162175] and parameters: {'p_sma': 42, 'p_std': 32, 'p_atr': 18, 'p_adx': 29, 'rsi_period': 55, 'ema1': 10, 'ema2': 52, 'slip_atr_k': 0.027431561104343763, 'slip_spread_k': 0.23438111113076665, 'spread_hl_frac': 0.0029814945781510825, 'bb_std_mult': 3.1049752735638383, 'rsi_os': 5, 'rsi_ob': 91, 'vol_spike': 0.2819489280481983, 'adx_thresh': 15.107810236825648, 'atr_min_pct': 0.005437514403426977, 'atr_max_pct': 0.08875766443021918, 'tp_mult': 2.4061283912254616, 'tsl_mult': 0.5601080138007006, 'strategy': 'breakout', 'time_stop': 260, 'use_sma': False, 'use_atr': False, 'use_adx': True, 'use_ema': False, 'use_spike': False, 'rsi_required': False, 'edge_k': 0.2903852057573914, 'edge_cap': 0.8431153723603187, 'bull_strategy': 'breakout', 'bull_bb_std_mult': 2.6183855922536647, 'bull_rsi_os': 50, 'bull_rsi_ob': 50, 'bull_adx_thresh': 29.720544417283598, 'bull_atr_min_pct': 0.0010848723748915535, 'bull_atr_max_pct': 0.08055911235569546, 'bull_tp_mult': 1.0224224258541357, 'bull_tsl_mult': 0.9534705670954619, 'bull_time_stop': 124, 'bull_use_sma': True, 'bull_use_ema': True, 'bull_use_atr': True, 'bull_use_adx': False, 'bull_use_spike': True, 'bull_rsi_required': True, 'bear_strategy': 'mean_reversion', 'bear_bb_std_mult': 3.0114759098288144, 'bear_rsi_os': 30, 'bear_rsi_ob': 83, 'bear_adx_thresh': 5.748476258495221, 'bear_atr_min_pct': 0.02968811880053256, 'bear_atr_max_pct': 0.010173738897998236, 'bear_tp_mult': 2.8266509499754675, 'bear_tsl_mult': 0.6232666440621333, 'bear_time_stop': 260, 'bear_use_sma': True, 'bear_use_ema': False, 'bear_use_atr': True, 'bear_use_adx': True, 'bear_use_spike': True, 'bear_rsi_required': True, 'sideways_strategy': 'mean_reversion', 'sideways_bb_std_mult': 1.1708190517517587, 'sideways_rsi_os': 35, 'sideways_rsi_ob': 57, 'sideways_adx_thresh': 18.246818946272196, 'sideways_atr_min_pct': 0.0223351658038189, 'sideways_atr_max_pct': 0.08676830901666163, 'sideways_tp_mult': 2.2924374584467686, 'sideways_tsl_mult': 0.9149786643317922, 'sideways_time_stop': 103, 'sideways_use_sma': True, 'sideways_use_ema': False, 'sideways_use_atr': True, 'sideways_use_adx': True, 'sideways_use_spike': True, 'sideways_rsi_required': True}.
[I 2025-08-30 14:56:49,709] Trial 296 finished with values: [-0.007201124715070173, 0.007192772151449793] and parameters: {'p_sma': 42, 'p_std': 32, 'p_atr': 18, 'p_adx': 29, 'rsi_period': 55, 'ema1': 10, 'ema2': 53, 'slip_atr_k': 0.02262915433982163, 'slip_spread_k': 0.25335957946234344, 'spread_hl_frac': 0.00251420110563921, 'bb_std_mult': 3.0978595390480193, 'rsi_os': 5, 'rsi_ob': 93, 'vol_spike': 0.295146419732912, 'adx_thresh': 15.18303329362575, 'atr_min_pct': 0.005299423007850393, 'atr_max_pct': 0.090198507605195, 'tp_mult': 2.4303273163288663, 'tsl_mult': 0.5676344738132716, 'strategy': 'breakout', 'time_stop': 264, 'use_sma': False, 'use_atr': False, 'use_adx': True, 'use_ema': False, 'use_spike': False, 'rsi_required': False, 'edge_k': 0.2827637505726378, 'edge_cap': 0.8371125267135257, 'bull_strategy': 'breakout', 'bull_bb_std_mult': 2.5959374979983036, 'bull_rsi_os': 50, 'bull_rsi_ob': 50, 'bull_adx_thresh': 28.784356457140316, 'bull_atr_min_pct': 0.0009311187745097895, 'bull_atr_max_pct': 0.0800652249582354, 'bull_tp_mult': 1.0106575226214412, 'bull_tsl_mult': 0.9600827292917731, 'bull_time_stop': 120, 'bull_use_sma': True, 'bull_use_ema': True, 'bull_use_atr': True, 'bull_use_adx': False, 'bull_use_spike': True, 'bull_rsi_required': True, 'bear_strategy': 'mean_reversion', 'bear_bb_std_mult': 3.241925905754533, 'bear_rsi_os': 30, 'bear_rsi_ob': 83, 'bear_adx_thresh': 5.816573116055984, 'bear_atr_min_pct': 0.029977445887266745, 'bear_atr_max_pct': 0.010073760421547676, 'bear_tp_mult': 2.813561506096079, 'bear_tsl_mult': 0.6303879344211449, 'bear_time_stop': 252, 'bear_use_sma': True, 'bear_use_ema': False, 'bear_use_atr': True, 'bear_use_adx': True, 'bear_use_spike': True, 'bear_rsi_required': True, 'sideways_strategy': 'mean_reversion', 'sideways_bb_std_mult': 1.202010416096392, 'sideways_rsi_os': 35, 'sideways_rsi_ob': 57, 'sideways_adx_thresh': 17.95075697847956, 'sideways_atr_min_pct': 0.022833541054345756, 'sideways_atr_max_pct': 0.08777486377845607, 'sideways_tp_mult': 2.2621285727401306, 'sideways_tsl_mult': 0.9440762071503238, 'sideways_time_stop': 92, 'sideways_use_sma': True, 'sideways_use_ema': False, 'sideways_use_atr': True, 'sideways_use_adx': True, 'sideways_use_spike': True, 'sideways_rsi_required': True}.
[I 2025-08-30 14:56:49,905] Trial 294 finished with values: [-0.006968334827853528, 0.006957444643021844] and parameters: {'p_sma': 42, 'p_std': 32, 'p_atr': 18, 'p_adx': 29, 'rsi_period': 55, 'ema1': 10, 'ema2': 53, 'slip_atr_k': 0.020458215186070147, 'slip_spread_k': 0.2657327867279405, 'spread_hl_frac': 0.002801387697937245, 'bb_std_mult': 3.1169918525900484, 'rsi_os': 5, 'rsi_ob': 91, 'vol_spike': 0.2853816138152424, 'adx_thresh': 14.803581560720652, 'atr_min_pct': 0.004330108108893485, 'atr_max_pct': 0.0903804413526297, 'tp_mult': 2.451804669518552, 'tsl_mult': 0.5528432837042663, 'strategy': 'breakout', 'time_stop': 262, 'use_sma': False, 'use_atr': False, 'use_adx': True, 'use_ema': False, 'use_spike': False, 'rsi_required': False, 'edge_k': 0.2635678561453214, 'edge_cap': 0.8397478853114761, 'bull_strategy': 'breakout', 'bull_bb_std_mult': 2.4842589220571005, 'bull_rsi_os': 50, 'bull_rsi_ob': 50, 'bull_adx_thresh': 29.135696299828144, 'bull_atr_min_pct': 0.0009647349228009726, 'bull_atr_max_pct': 0.08076944797761398, 'bull_tp_mult': 1.0188494551386187, 'bull_tsl_mult': 0.9509399710860857, 'bull_time_stop': 121, 'bull_use_sma': True, 'bull_use_ema': True, 'bull_use_atr': True, 'bull_use_adx': False, 'bull_use_spike': True, 'bull_rsi_required': True, 'bear_strategy': 'mean_reversion', 'bear_bb_std_mult': 3.0111618369074513, 'bear_rsi_os': 30, 'bear_rsi_ob': 83, 'bear_adx_thresh': 5.708989746350723, 'bear_atr_min_pct': 0.029968437869194786, 'bear_atr_max_pct': 0.010977930616764957, 'bear_tp_mult': 2.8288350657466275, 'bear_tsl_mult': 0.6225463893156613, 'bear_time_stop': 253, 'bear_use_sma': True, 'bear_use_ema': False, 'bear_use_atr': True, 'bear_use_adx': True, 'bear_use_spike': True, 'bear_rsi_required': True, 'sideways_strategy': 'mean_reversion', 'sideways_bb_std_mult': 1.1811996865802112, 'sideways_rsi_os': 36, 'sideways_rsi_ob': 57, 'sideways_adx_thresh': 17.968756590874065, 'sideways_atr_min_pct': 0.02282986003714457, 'sideways_atr_max_pct': 0.08712356457011505, 'sideways_tp_mult': 2.291583634446945, 'sideways_tsl_mult': 0.9399881011925783, 'sideways_time_stop': 103, 'sideways_use_sma': True, 'sideways_use_ema': False, 'sideways_use_atr': True, 'sideways_use_adx': True, 'sideways_use_spike': True, 'sideways_rsi_required': True}.
[I 2025-08-30 14:56:50,311] Trial 293 finished with values: [-0.006537956997210825, 0.006573725823521962] and parameters: {'p_sma': 42, 'p_std': 32, 'p_atr': 18, 'p_adx': 29, 'rsi_period': 55, 'ema1': 10, 'ema2': 52, 'slip_atr_k': 0.028206386596067085, 'slip_spread_k': 0.2420671111783483, 'spread_hl_frac': 0.003192119306727893, 'bb_std_mult': 3.0928042739813897, 'rsi_os': 5, 'rsi_ob': 93, 'vol_spike': 0.28313787306487986, 'adx_thresh': 15.021949756186713, 'atr_min_pct': 0.004515334455014931, 'atr_max_pct': 0.08948851632694683, 'tp_mult': 2.3855240612066595, 'tsl_mult': 0.5175417228240602, 'strategy': 'breakout', 'time_stop': 266, 'use_sma': False, 'use_atr': False, 'use_adx': True, 'use_ema': False, 'use_spike': False, 'rsi_required': False, 'edge_k': 0.28663924843384125, 'edge_cap': 0.8434215083459221, 'bull_strategy': 'breakout', 'bull_bb_std_mult': 2.619675817953276, 'bull_rsi_os': 50, 'bull_rsi_ob': 50, 'bull_adx_thresh': 29.862034955242585, 'bull_atr_min_pct': 0.0011917513758603704, 'bull_atr_max_pct': 0.07956035293003726, 'bull_tp_mult': 1.0150231435979462, 'bull_tsl_mult': 0.9229492973309973, 'bull_time_stop': 122, 'bull_use_sma': True, 'bull_use_ema': True, 'bull_use_atr': True, 'bull_use_adx': False, 'bull_use_spike': True, 'bull_rsi_required': True, 'bear_strategy': 'mean_reversion', 'bear_bb_std_mult': 3.0396807951146974, 'bear_rsi_os': 30, 'bear_rsi_ob': 84, 'bear_adx_thresh': 5.7352994106149175, 'bear_atr_min_pct': 0.02997076438420593, 'bear_atr_max_pct': 0.010706724587032493, 'bear_tp_mult': 2.817729938446064, 'bear_tsl_mult': 0.6240163362653438, 'bear_time_stop': 262, 'bear_use_sma': True, 'bear_use_ema': False, 'bear_use_atr': True, 'bear_use_adx': True, 'bear_use_spike': True, 'bear_rsi_required': True, 'sideways_strategy': 'mean_reversion', 'sideways_bb_std_mult': 1.1881774778136842, 'sideways_rsi_os': 35, 'sideways_rsi_ob': 57, 'sideways_adx_thresh': 18.262628902648334, 'sideways_atr_min_pct': 0.02266067876365095, 'sideways_atr_max_pct': 0.08766039201313708, 'sideways_tp_mult': 2.3127014499025, 'sideways_tsl_mult': 0.9149449889332587, 'sideways_time_stop': 102, 'sideways_use_sma': True, 'sideways_use_ema': False, 'sideways_use_atr': True, 'sideways_use_adx': True, 'sideways_use_spike': True, 'sideways_rsi_required': True}.
[I 2025-08-30 14:56:50,406] Trial 295 finished with values: [-0.0074357781799261335, 0.007427042251276449] and parameters: {'p_sma': 42, 'p_std': 32, 'p_atr': 18, 'p_adx': 29, 'rsi_period': 55, 'ema1': 10, 'ema2': 53, 'slip_atr_k': 0.025559518983867862, 'slip_spread_k': 0.2524342471875126, 'spread_hl_frac': 0.0025508132111599835, 'bb_std_mult': 3.1127371084896076, 'rsi_os': 5, 'rsi_ob': 93, 'vol_spike': 0.2922637783098302, 'adx_thresh': 14.641795643635225, 'atr_min_pct': 0.005566994070340036, 'atr_max_pct': 0.09058451633785304, 'tp_mult': 2.4326830576211362, 'tsl_mult': 0.513190249843126, 'strategy': 'breakout', 'time_stop': 264, 'use_sma': False, 'use_atr': False, 'use_adx': True, 'use_ema': False, 'use_spike': False, 'rsi_required': False, 'edge_k': 0.1968689760920258, 'edge_cap': 0.8340394758923778, 'bull_strategy': 'breakout', 'bull_bb_std_mult': 2.626677208032626, 'bull_rsi_os': 50, 'bull_rsi_ob': 50, 'bull_adx_thresh': 28.768815727141604, 'bull_atr_min_pct': 0.0006871201911292793, 'bull_atr_max_pct': 0.08013854503895187, 'bull_tp_mult': 1.0184260167719184, 'bull_tsl_mult': 0.9555661957081057, 'bull_time_stop': 119, 'bull_use_sma': True, 'bull_use_ema': True, 'bull_use_atr': True, 'bull_use_adx': False, 'bull_use_spike': True, 'bull_rsi_required': True, 'bear_strategy': 'mean_reversion', 'bear_bb_std_mult': 2.997630076907099, 'bear_rsi_os': 30, 'bear_rsi_ob': 83, 'bear_adx_thresh': 5.679751905461923, 'bear_atr_min_pct': 0.029974663803813122, 'bear_atr_max_pct': 0.010027967729442124, 'bear_tp_mult': 2.811243419896901, 'bear_tsl_mult': 0.6163772239356566, 'bear_time_stop': 249, 'bear_use_sma': True, 'bear_use_ema': False, 'bear_use_atr': True, 'bear_use_adx': True, 'bear_use_spike': True, 'bear_rsi_required': True, 'sideways_strategy': 'mean_reversion', 'sideways_bb_std_mult': 1.2015423892248407, 'sideways_rsi_os': 35, 'sideways_rsi_ob': 57, 'sideways_adx_thresh': 17.91038298020383, 'sideways_atr_min_pct': 0.022649264655897373, 'sideways_atr_max_pct': 0.08711243699510902, 'sideways_tp_mult': 2.2638399999878973, 'sideways_tsl_mult': 0.9408893904368004, 'sideways_time_stop': 92, 'sideways_use_sma': True, 'sideways_use_ema': False, 'sideways_use_atr': True, 'sideways_use_adx': True, 'sideways_use_spike': True, 'sideways_rsi_required': True}.
