[I 2025-08-30 15:14:54,384] Trial 407 finished with values: [-1000000000.0, 1000000000.0] and parameters: {'p_sma': 14, 'p_std': 26, 'p_atr': 13, 'p_adx': 25, 'rsi_period': 10, 'ema1': 27, 'ema2': 40, 'slip_atr_k': 0.0011950017273639872, 'slip_spread_k': 0.6453413185882478, 'spread_hl_frac': 0.004887245258502142, 'bb_std_mult': 3.1451977795736155, 'rsi_os': 24, 'rsi_ob': 87, 'vol_spike': 0.14877751340791512, 'adx_thresh': 6.76268605726609, 'atr_min_pct': 0.008103855474500217, 'atr_max_pct': 0.11392770457444568, 'tp_mult': 1.8011853408808822, 'tsl_mult': 0.5516124950585439, 'strategy': 'breakout', 'time_stop': 152, 'use_sma': False, 'use_atr': False, 'use_adx': True, 'use_ema': False, 'use_spike': False, 'rsi_required': False, 'edge_k': 0.5022641751229903, 'edge_cap': 0.6835696979822888, 'bull_strategy': 'breakout', 'bull_bb_std_mult': 1.670830435451631, 'bull_rsi_os': 48, 'bull_rsi_ob': 86, 'bull_adx_thresh': 10.441035431970061, 'bull_atr_min_pct': 0.010815897829034065, 'bull_atr_max_pct': 0.10595305422140269, 'bull_tp_mult': 2.6884104527846016, 'bull_tsl_mult': 0.4798372309622578, 'bull_time_stop': 27, 'bull_use_sma': True, 'bull_use_ema': True, 'bull_use_atr': True, 'bull_use_adx': False, 'bull_use_spike': True, 'bull_rsi_required': False, 'bear_strategy': 'mean_reversion', 'bear_bb_std_mult': 1.793885561792317, 'bear_rsi_os': 31, 'bear_rsi_ob': 74, 'bear_adx_thresh': 11.32601800136066, 'bear_atr_min_pct': 0.004152689509509684, 'bear_atr_max_pct': 0.12303421792437555, 'bear_tp_mult': 1.759978346936181, 'bear_tsl_mult': 0.6097306645124959, 'bear_time_stop': 101, 'bear_use_sma': True, 'bear_use_ema': False, 'bear_use_atr': True, 'bear_use_adx': True, 'bear_use_spike': True, 'bear_rsi_required': True, 'sideways_strategy': 'mean_reversion', 'sideways_bb_std_mult': 3.1958388811417184, 'sideways_rsi_os': 31, 'sideways_rsi_ob': 52, 'sideways_adx_thresh': 11.885684546563061, 'sideways_atr_min_pct': 0.028835841980523188, 'sideways_atr_max_pct': 0.08353517259624527, 'sideways_tp_mult': 2.1848394269986513, 'sideways_tsl_mult': 0.44662544821961814, 'sideways_time_stop': 130, 'sideways_use_sma': True, 'sideways_use_ema': False, 'sideways_use_atr': True, 'sideways_use_adx': True, 'sideways_use_spike': True, 'sideways_rsi_required': True}.
[I 2025-08-30 15:14:54,386] Trial 405 finished with values: [-0.0072843742137450596, 0.008165055754965355] and parameters: {'p_sma': 17, 'p_std': 26, 'p_atr': 12, 'p_adx': 26, 'rsi_period': 10, 'ema1': 28, 'ema2': 39, 'slip_atr_k': 8.346425021221455e-05, 'slip_spread_k': 0.6445693101446455, 'spread_hl_frac': 0.005646228342133475, 'bb_std_mult': 3.2552327371453, 'rsi_os': 21, 'rsi_ob': 86, 'vol_spike': 0.15821452726462482, 'adx_thresh': 8.952669006408938, 'atr_min_pct': 0.006611653252783928, 'atr_max_pct': 0.11299236407562455, 'tp_mult': 1.746777929356049, 'tsl_mult': 0.7130577312241477, 'strategy': 'breakout', 'time_stop': 138, 'use_sma': False, 'use_atr': False, 'use_adx': True, 'use_ema': False, 'use_spike': False, 'rsi_required': False, 'edge_k': 0.5940861410170395, 'edge_cap': 0.6294067444172852, 'bull_strategy': 'breakout', 'bull_bb_std_mult': 1.5854675062131807, 'bull_rsi_os': 21, 'bull_rsi_ob': 87, 'bull_adx_thresh': 12.314456910260766, 'bull_atr_min_pct': 0.011751441888573178, 'bull_atr_max_pct': 0.11187367755319022, 'bull_tp_mult': 2.520363508939516, 'bull_tsl_mult': 0.8729273904662191, 'bull_time_stop': 54, 'bull_use_sma': True, 'bull_use_ema': True, 'bull_use_atr': True, 'bull_use_adx': False, 'bull_use_spike': True, 'bull_rsi_required': False, 'bear_strategy': 'mean_reversion', 'bear_bb_std_mult': 2.062633558072482, 'bear_rsi_os': 48, 'bear_rsi_ob': 75, 'bear_adx_thresh': 13.731274756245357, 'bear_atr_min_pct': 0.002946167376275711, 'bear_atr_max_pct': 0.11106588955497998, 'bear_tp_mult': 2.6266991793759753, 'bear_tsl_mult': 0.5694325700662163, 'bear_time_stop': 75, 'bear_use_sma': True, 'bear_use_ema': False, 'bear_use_atr': True, 'bear_use_adx': True, 'bear_use_spike': True, 'bear_rsi_required': True, 'sideways_strategy': 'mean_reversion', 'sideways_bb_std_mult': 3.3629666190813996, 'sideways_rsi_os': 31, 'sideways_rsi_ob': 51, 'sideways_adx_thresh': 11.991998055426874, 'sideways_atr_min_pct': 0.028695520797618376, 'sideways_atr_max_pct': 0.08393417638512261, 'sideways_tp_mult': 2.1865064091582993, 'sideways_tsl_mult': 0.4455924331917872, 'sideways_time_stop': 127, 'sideways_use_sma': True, 'sideways_use_ema': False, 'sideways_use_atr': True, 'sideways_use_adx': True, 'sideways_use_spike': True, 'sideways_rsi_required': True}.
[I 2025-08-30 15:14:54,817] Trial 408 finished with values: [-1000000000.0, 1000000000.0] and parameters: {'p_sma': 14, 'p_std': 26, 'p_atr': 8, 'p_adx': 25, 'rsi_period': 54, 'ema1': 27, 'ema2': 39, 'slip_atr_k': 1.0941910434980866e-05, 'slip_spread_k': 0.6492559492664972, 'spread_hl_frac': 0.005087724999094586, 'bb_std_mult': 3.151803980220652, 'rsi_os': 21, 'rsi_ob': 87, 'vol_spike': 0.15946750340262678, 'adx_thresh': 6.465047290154878, 'atr_min_pct': 0.008254460858716478, 'atr_max_pct': 0.11359717530541062, 'tp_mult': 1.7678399881464268, 'tsl_mult': 0.5516851844431678, 'strategy': 'breakout', 'time_stop': 139, 'use_sma': False, 'use_atr': False, 'use_adx': True, 'use_ema': False, 'use_spike': False, 'rsi_required': False, 'edge_k': 0.6754940844004776, 'edge_cap': 0.6968159846500331, 'bull_strategy': 'breakout', 'bull_bb_std_mult': 1.670943035026181, 'bull_rsi_os': 31, 'bull_rsi_ob': 86, 'bull_adx_thresh': 12.039765672695989, 'bull_atr_min_pct': 0.011590176169986458, 'bull_atr_max_pct': 0.10643648659623799, 'bull_tp_mult': 2.697161707613146, 'bull_tsl_mult': 0.5571180830062405, 'bull_time_stop': 23, 'bull_use_sma': True, 'bull_use_ema': True, 'bull_use_atr': True, 'bull_use_adx': False, 'bull_use_spike': True, 'bull_rsi_required': False, 'bear_strategy': 'mean_reversion', 'bear_bb_std_mult': 2.0336473544870866, 'bear_rsi_os': 31, 'bear_rsi_ob': 74, 'bear_adx_thresh': 11.176407218396475, 'bear_atr_min_pct': 0.004173357336235659, 'bear_atr_max_pct': 0.13361170800364122, 'bear_tp_mult': 2.457461389465076, 'bear_tsl_mult': 0.6107615224913473, 'bear_time_stop': 73, 'bear_use_sma': True, 'bear_use_ema': False, 'bear_use_atr': True, 'bear_use_adx': True, 'bear_use_spike': True, 'bear_rsi_required': True, 'sideways_strategy': 'mean_reversion', 'sideways_bb_std_mult': 3.1441428093082937, 'sideways_rsi_os': 31, 'sideways_rsi_ob': 52, 'sideways_adx_thresh': 11.79952433669505, 'sideways_atr_min_pct': 0.016244136057838292, 'sideways_atr_max_pct': 0.08458211614548346, 'sideways_tp_mult': 2.193897221876832, 'sideways_tsl_mult': 0.5181241118326043, 'sideways_time_stop': 126, 'sideways_use_sma': True, 'sideways_use_ema': False, 'sideways_use_atr': True, 'sideways_use_adx': True, 'sideways_use_spike': True, 'sideways_rsi_required': True}.
[I 2025-08-30 15:14:55,137] Trial 406 finished with values: [-0.0022392818371023138, 0.003783253710631872] and parameters: {'p_sma': 15, 'p_std': 26, 'p_atr': 12, 'p_adx': 26, 'rsi_period': 11, 'ema1': 22, 'ema2': 36, 'slip_atr_k': 0.004882757735259726, 'slip_spread_k': 0.6580497627767871, 'spread_hl_frac': 0.005276799680752589, 'bb_std_mult': 3.1543891320351984, 'rsi_os': 24, 'rsi_ob': 86, 'vol_spike': 0.15568060727251692, 'adx_thresh': 8.892790572211096, 'atr_min_pct': 0.0079745915526443, 'atr_max_pct': 0.11173208966860784, 'tp_mult': 1.6134403211891135, 'tsl_mult': 0.367540840266379, 'strategy': 'breakout', 'time_stop': 152, 'use_sma': False, 'use_atr': False, 'use_adx': True, 'use_ema': False, 'use_spike': False, 'rsi_required': False, 'edge_k': 0.6821171807204722, 'edge_cap': 0.9595972449366572, 'bull_strategy': 'breakout', 'bull_bb_std_mult': 1.650048205633188, 'bull_rsi_os': 25, 'bull_rsi_ob': 92, 'bull_adx_thresh': 12.184144203855075, 'bull_atr_min_pct': 0.014561084129982495, 'bull_atr_max_pct': 0.1047828770333627, 'bull_tp_mult': 2.6954982542176937, 'bull_tsl_mult': 0.8998092331821567, 'bull_time_stop': 28, 'bull_use_sma': True, 'bull_use_ema': True, 'bull_use_atr': True, 'bull_use_adx': False, 'bull_use_spike': True, 'bull_rsi_required': False, 'bear_strategy': 'mean_reversion', 'bear_bb_std_mult': 2.035560296819905, 'bear_rsi_os': 31, 'bear_rsi_ob': 74, 'bear_adx_thresh': 11.51175644586797, 'bear_atr_min_pct': 0.0032347182949769497, 'bear_atr_max_pct': 0.13284292358748817, 'bear_tp_mult': 2.4467118043913354, 'bear_tsl_mult': 0.29153571952985186, 'bear_time_stop': 76, 'bear_use_sma': True, 'bear_use_ema': False, 'bear_use_atr': True, 'bear_use_adx': True, 'bear_use_spike': True, 'bear_rsi_required': True, 'sideways_strategy': 'mean_reversion', 'sideways_bb_std_mult': 3.182034604120572, 'sideways_rsi_os': 31, 'sideways_rsi_ob': 51, 'sideways_adx_thresh': 11.683841282992095, 'sideways_atr_min_pct': 0.01432812056453558, 'sideways_atr_max_pct': 0.08287070935333882, 'sideways_tp_mult': 2.1899323393370747, 'sideways_tsl_mult': 0.36965979988456393, 'sideways_time_stop': 129, 'sideways_use_sma': True, 'sideways_use_ema': False, 'sideways_use_atr': True, 'sideways_use_adx': True, 'sideways_use_spike': True, 'sideways_rsi_required': True}.
[I 2025-08-30 15:15:40,561] Trial 411 finished with values: [-1000000000.0, 1000000000.0] and parameters: {'p_sma': 15, 'p_std': 29, 'p_atr': 9, 'p_adx': 27, 'rsi_period': 53, 'ema1': 22, 'ema2': 36, 'slip_atr_k': 0.0051490969377946515, 'slip_spread_k': 0.7333616728292822, 'spread_hl_frac': 0.004965668315181707, 'bb_std_mult': 3.147636650142758, 'rsi_os': 27, 'rsi_ob': 88, 'vol_spike': 0.13313481582493006, 'adx_thresh': 7.489854488679322, 'atr_min_pct': 0.007986127184246815, 'atr_max_pct': 0.12129764351865878, 'tp_mult': 1.6693539875908667, 'tsl_mult': 0.5271009835792514, 'strategy': 'mean_reversion', 'time_stop': 150, 'use_sma': False, 'use_atr': False, 'use_adx': True, 'use_ema': False, 'use_spike': False, 'rsi_required': False, 'edge_k': 0.6514502559451063, 'edge_cap': 0.8840002360059108, 'bull_strategy': 'breakout', 'bull_bb_std_mult': 1.4702116471404683, 'bull_rsi_os': 48, 'bull_rsi_ob': 91, 'bull_adx_thresh': 11.409267231125625, 'bull_atr_min_pct': 0.01760596519117273, 'bull_atr_max_pct': 0.12621991832313714, 'bull_tp_mult': 2.6258639361115903, 'bull_tsl_mult': 0.9148080309473302, 'bull_time_stop': 71, 'bull_use_sma': True, 'bull_use_ema': True, 'bull_use_atr': True, 'bull_use_adx': False, 'bull_use_spike': True, 'bull_rsi_required': False, 'bear_strategy': 'mean_reversion', 'bear_bb_std_mult': 1.6058850684592993, 'bear_rsi_os': 28, 'bear_rsi_ob': 76, 'bear_adx_thresh': 11.844089765517884, 'bear_atr_min_pct': 0.001618611600930238, 'bear_atr_max_pct': 0.08680096599798048, 'bear_tp_mult': 2.139017637355588, 'bear_tsl_mult': 0.37397198818591176, 'bear_time_stop': 84, 'bear_use_sma': True, 'bear_use_ema': False, 'bear_use_atr': True, 'bear_use_adx': True, 'bear_use_spike': True, 'bear_rsi_required': True, 'sideways_strategy': 'mean_reversion', 'sideways_bb_std_mult': 3.5317273762420416, 'sideways_rsi_os': 29, 'sideways_rsi_ob': 48, 'sideways_adx_thresh': 7.641399028246019, 'sideways_atr_min_pct': 0.01211480446721426, 'sideways_atr_max_pct': 0.08023487242564298, 'sideways_tp_mult': 2.16921844618124, 'sideways_tsl_mult': 0.26712565122228116, 'sideways_time_stop': 109, 'sideways_use_sma': True, 'sideways_use_ema': False, 'sideways_use_atr': True, 'sideways_use_adx': True, 'sideways_use_spike': True, 'sideways_rsi_required': True}.
[I 2025-08-30 15:15:41,701] Trial 410 finished with values: [-1000000000.0, 1000000000.0] and parameters: {'p_sma': 15, 'p_std': 29, 'p_atr': 8, 'p_adx': 27, 'rsi_period': 73, 'ema1': 29, 'ema2': 36, 'slip_atr_k': 0.0001113156348778292, 'slip_spread_k': 0.7369696140971133, 'spread_hl_frac': 0.005048292970942369, 'bb_std_mult': 3.1498658264056734, 'rsi_os': 24, 'rsi_ob': 88, 'vol_spike': 0.1899953799347243, 'adx_thresh': 7.128195881233328, 'atr_min_pct': 0.008614722140433045, 'atr_max_pct': 0.11992319846491459, 'tp_mult': 1.6779155742243477, 'tsl_mult': 0.7571760054769474, 'strategy': 'breakout', 'time_stop': 140, 'use_sma': False, 'use_atr': False, 'use_adx': True, 'use_ema': False, 'use_spike': False, 'rsi_required': False, 'edge_k': 0.5725550432200376, 'edge_cap': 0.6943470734879832, 'bull_strategy': 'breakout', 'bull_bb_std_mult': 1.754053437112968, 'bull_rsi_os': 37, 'bull_rsi_ob': 88, 'bull_adx_thresh': 11.253846118086985, 'bull_atr_min_pct': 0.005574619773274871, 'bull_atr_max_pct': 0.14007513930376486, 'bull_tp_mult': 2.6290825045301527, 'bull_tsl_mult': 0.4438840281277901, 'bull_time_stop': 76, 'bull_use_sma': True, 'bull_use_ema': True, 'bull_use_atr': True, 'bull_use_adx': False, 'bull_use_spike': True, 'bull_rsi_required': False, 'bear_strategy': 'mean_reversion', 'bear_bb_std_mult': 1.6361701588329969, 'bear_rsi_os': 28, 'bear_rsi_ob': 76, 'bear_adx_thresh': 14.370631031385281, 'bear_atr_min_pct': 0.001543406413073961, 'bear_atr_max_pct': 0.11485255443367369, 'bear_tp_mult': 2.4674338351403478, 'bear_tsl_mult': 0.2736379383113623, 'bear_time_stop': 87, 'bear_use_sma': True, 'bear_use_ema': False, 'bear_use_atr': True, 'bear_use_adx': True, 'bear_use_spike': True, 'bear_rsi_required': True, 'sideways_strategy': 'mean_reversion', 'sideways_bb_std_mult': 3.492033176821307, 'sideways_rsi_os': 32, 'sideways_rsi_ob': 48, 'sideways_adx_thresh': 11.314512690838427, 'sideways_atr_min_pct': 0.00011905074174247549, 'sideways_atr_max_pct': 0.08054881150243107, 'sideways_tp_mult': 2.046629766589638, 'sideways_tsl_mult': 0.6009110987794299, 'sideways_time_stop': 110, 'sideways_use_sma': True, 'sideways_use_ema': False, 'sideways_use_atr': True, 'sideways_use_adx': True, 'sideways_use_spike': True, 'sideways_rsi_required': True}.
[I 2025-08-30 15:15:42,238] Trial 412 finished with values: [-1000000000.0, 1000000000.0] and parameters: {'p_sma': 15, 'p_std': 24, 'p_atr': 11, 'p_adx': 27, 'rsi_period': 46, 'ema1': 22, 'ema2': 36, 'slip_atr_k': 0.006301160360953543, 'slip_spread_k': 0.7258863367235299, 'spread_hl_frac': 0.005073091848255861, 'bb_std_mult': 3.2408695813382105, 'rsi_os': 23, 'rsi_ob': 88, 'vol_spike': 0.1745754455935109, 'adx_thresh': 7.524625772480154, 'atr_min_pct': 0.009002347623614754, 'atr_max_pct': 0.11073476771398945, 'tp_mult': 1.5842715148480322, 'tsl_mult': 0.770495447558281, 'strategy': 'breakout', 'time_stop': 154, 'use_sma': False, 'use_atr': False, 'use_adx': True, 'use_ema': False, 'use_spike': False, 'rsi_required': False, 'edge_k': 0.6398099616024868, 'edge_cap': 0.9515839578151456, 'bull_strategy': 'breakout', 'bull_bb_std_mult': 1.4844017977239412, 'bull_rsi_os': 9, 'bull_rsi_ob': 91, 'bull_adx_thresh': 11.167894022385738, 'bull_atr_min_pct': 0.012841206778388448, 'bull_atr_max_pct': 0.1102584041496626, 'bull_tp_mult': 2.6244680167449856, 'bull_tsl_mult': 0.443903919162871, 'bull_time_stop': 41, 'bull_use_sma': True, 'bull_use_ema': True, 'bull_use_atr': True, 'bull_use_adx': False, 'bull_use_spike': True, 'bull_rsi_required': False, 'bear_strategy': 'mean_reversion', 'bear_bb_std_mult': 1.8714064694220687, 'bear_rsi_os': 28, 'bear_rsi_ob': 71, 'bear_adx_thresh': 14.464932134819305, 'bear_atr_min_pct': 0.0048602759162460225, 'bear_atr_max_pct': 0.1156625421715454, 'bear_tp_mult': 2.69183920405228, 'bear_tsl_mult': 0.28848433835407056, 'bear_time_stop': 88, 'bear_use_sma': True, 'bear_use_ema': False, 'bear_use_atr': True, 'bear_use_adx': True, 'bear_use_spike': True, 'bear_rsi_required': True, 'sideways_strategy': 'mean_reversion', 'sideways_bb_std_mult': 3.186902792363815, 'sideways_rsi_os': 32, 'sideways_rsi_ob': 48, 'sideways_adx_thresh': 10.008081334435479, 'sideways_atr_min_pct': 0.013404113439224548, 'sideways_atr_max_pct': 0.07945881783668869, 'sideways_tp_mult': 2.0261490163071123, 'sideways_tsl_mult': 0.3538744552522539, 'sideways_time_stop': 107, 'sideways_use_sma': True, 'sideways_use_ema': False, 'sideways_use_atr': True, 'sideways_use_adx': True, 'sideways_use_spike': True, 'sideways_rsi_required': True}.
[I 2025-08-30 15:15:43,071] Trial 409 finished with values: [-1000000000.0, 1000000000.0] and parameters: {'p_sma': 15, 'p_std': 29, 'p_atr': 10, 'p_adx': 27, 'rsi_period': 54, 'ema1': 22, 'ema2': 36, 'slip_atr_k': 0.0049066651724355885, 'slip_spread_k': 0.7370211837344612, 'spread_hl_frac': 0.004963903705353058, 'bb_std_mult': 1.4790001264853987, 'rsi_os': 23, 'rsi_ob': 88, 'vol_spike': 0.19259651110837142, 'adx_thresh': 6.524137341851439, 'atr_min_pct': 0.008650426855683378, 'atr_max_pct': 0.12037253077182705, 'tp_mult': 1.6641496213316784, 'tsl_mult': 0.8776081573691235, 'strategy': 'breakout', 'time_stop': 140, 'use_sma': False, 'use_atr': False, 'use_adx': True, 'use_ema': False, 'use_spike': False, 'rsi_required': False, 'edge_k': 0.6418510087486344, 'edge_cap': 0.7026871466068546, 'bull_strategy': 'breakout', 'bull_bb_std_mult': 1.453058402649479, 'bull_rsi_os': 31, 'bull_rsi_ob': 88, 'bull_adx_thresh': 11.089920461152321, 'bull_atr_min_pct': 0.014737366779836902, 'bull_atr_max_pct': 0.14346155762331825, 'bull_tp_mult': 2.6400880955565, 'bull_tsl_mult': 0.9132937901363838, 'bull_time_stop': 73, 'bull_use_sma': True, 'bull_use_ema': True, 'bull_use_atr': True, 'bull_use_adx': False, 'bull_use_spike': True, 'bull_rsi_required': False, 'bear_strategy': 'mean_reversion', 'bear_bb_std_mult': 1.6120094375494527, 'bear_rsi_os': 28, 'bear_rsi_ob': 76, 'bear_adx_thresh': 14.630943945686358, 'bear_atr_min_pct': 0.0039055697304169416, 'bear_atr_max_pct': 0.13279164385104886, 'bear_tp_mult': 2.4826747989132416, 'bear_tsl_mult': 0.27992383180582214, 'bear_time_stop': 90, 'bear_use_sma': True, 'bear_use_ema': False, 'bear_use_atr': True, 'bear_use_adx': True, 'bear_use_spike': True, 'bear_rsi_required': True, 'sideways_strategy': 'mean_reversion', 'sideways_bb_std_mult': 3.1303949062339886, 'sideways_rsi_os': 29, 'sideways_rsi_ob': 52, 'sideways_adx_thresh': 9.035016518671414, 'sideways_atr_min_pct': 0.013060819895869477, 'sideways_atr_max_pct': 0.07837331802914904, 'sideways_tp_mult': 2.020627996348827, 'sideways_tsl_mult': 0.3153861111880629, 'sideways_time_stop': 109, 'sideways_use_sma': True, 'sideways_use_ema': False, 'sideways_use_atr': True, 'sideways_use_adx': True, 'sideways_use_spike': True, 'sideways_rsi_required': True}.
[I 2025-08-30 15:16:28,977] Trial 414 finished with values: [-1000000000.0, 1000000000.0] and parameters: {'p_sma': 13, 'p_std': 27, 'p_atr': 11, 'p_adx': 26, 'rsi_period': 46, 'ema1': 25, 'ema2': 38, 'slip_atr_k': 0.007703915646346111, 'slip_spread_k': 0.7790149164717219, 'spread_hl_frac': 0.006309401387855797, 'bb_std_mult': 3.244787318960289, 'rsi_os': 23, 'rsi_ob': 86, 'vol_spike': 0.20535293441245345, 'adx_thresh': 8.285179359808643, 'atr_min_pct': 0.007635634539672617, 'atr_max_pct': 0.11015316408703024, 'tp_mult': 1.6144124413835383, 'tsl_mult': 0.847999257286002, 'strategy': 'breakout', 'time_stop': 134, 'use_sma': False, 'use_atr': False, 'use_adx': True, 'use_ema': False, 'use_spike': False, 'rsi_required': False, 'edge_k': 0.6804759129440214, 'edge_cap': 0.9057069662965906, 'bull_strategy': 'breakout', 'bull_bb_std_mult': 1.6309344029231139, 'bull_rsi_os': 27, 'bull_rsi_ob': 89, 'bull_adx_thresh': 10.055737137721204, 'bull_atr_min_pct': 0.012902495608179236, 'bull_atr_max_pct': 0.11057640909124364, 'bull_tp_mult': 2.4942950672813224, 'bull_tsl_mult': 0.705413092249034, 'bull_time_stop': 31, 'bull_use_sma': True, 'bull_use_ema': True, 'bull_use_atr': True, 'bull_use_adx': False, 'bull_use_spike': True, 'bull_rsi_required': False, 'bear_strategy': 'mean_reversion', 'bear_bb_std_mult': 2.1114349545113758, 'bear_rsi_os': 29, 'bear_rsi_ob': 71, 'bear_adx_thresh': 11.686945017484899, 'bear_atr_min_pct': 0.004758016195631473, 'bear_atr_max_pct': 0.10097120772802635, 'bear_tp_mult': 2.6598233567111524, 'bear_tsl_mult': 0.5905117676840549, 'bear_time_stop': 93, 'bear_use_sma': True, 'bear_use_ema': False, 'bear_use_atr': True, 'bear_use_adx': True, 'bear_use_spike': True, 'bear_rsi_required': True, 'sideways_strategy': 'mean_reversion', 'sideways_bb_std_mult': 3.191057460040368, 'sideways_rsi_os': 30, 'sideways_rsi_ob': 51, 'sideways_adx_thresh': 9.03840947695228, 'sideways_atr_min_pct': 0.013007562575482318, 'sideways_atr_max_pct': 0.07767084474658303, 'sideways_tp_mult': 2.21551365014567, 'sideways_tsl_mult': 0.35545330963400984, 'sideways_time_stop': 122, 'sideways_use_sma': True, 'sideways_use_ema': False, 'sideways_use_atr': True, 'sideways_use_adx': True, 'sideways_use_spike': True, 'sideways_rsi_required': True}.
