[I 2025-08-30 14:37:38,611] Trial 136 finished with values: [-1000000000.0, 1000000000.0] and parameters: {'p_sma': 7, 'p_std': 27, 'p_atr': 13, 'p_adx': 9, 'rsi_period': 23, 'ema1': 17, 'ema2': 17, 'slip_atr_k': 0.00973373959241794, 'slip_spread_k': 0.12997620514828057, 'spread_hl_frac': 0.04441366331263217, 'bb_std_mult': 3.1442087493295143, 'rsi_os': 16, 'rsi_ob': 94, 'vol_spike': 0.007556431485812809, 'adx_thresh': 12.513687684166067, 'atr_min_pct': 0.02995788134356134, 'atr_max_pct': 0.09208276977962271, 'tp_mult': 2.0525872410890518, 'tsl_mult': 0.07525928599727069, 'strategy': 'mean_reversion', 'time_stop': 300, 'use_sma': True, 'use_atr': True, 'use_adx': False, 'use_ema': False, 'use_spike': True, 'rsi_required': True, 'edge_k': 1.7887637894239052, 'edge_cap': 0.05454620894767176, 'bull_strategy': 'mean_reversion', 'bull_bb_std_mult': 0.7594668999146175, 'bull_rsi_os': 33, 'bull_rsi_ob': 45, 'bull_adx_thresh': 12.148070134625081, 'bull_atr_min_pct': 0.02007887786078316, 'bull_atr_max_pct': 0.03875883425352564, 'bull_tp_mult': 1.3573482820955998, 'bull_tsl_mult': 0.10511612337644233, 'bull_time_stop': 166, 'bull_use_sma': False, 'bull_use_ema': False, 'bull_use_atr': False, 'bull_use_adx': True, 'bull_use_spike': True, 'bull_rsi_required': False, 'bear_strategy': 'breakout', 'bear_bb_std_mult': 1.6014899520342405, 'bear_rsi_os': 21, 'bear_rsi_ob': 80, 'bear_adx_thresh': 20.47307995455274, 'bear_atr_min_pct': 0.01836238164983707, 'bear_atr_max_pct': 0.14994741238278925, 'bear_tp_mult': 1.9589840409953696, 'bear_tsl_mult': 0.8052439420262629, 'bear_time_stop': 195, 'bear_use_sma': False, 'bear_use_ema': True, 'bear_use_atr': False, 'bear_use_adx': False, 'bear_use_spike': False, 'bear_rsi_required': True, 'sideways_strategy': 'breakout', 'sideways_bb_std_mult': 0.7581522709773343, 'sideways_rsi_os': 44, 'sideways_rsi_ob': 70, 'sideways_adx_thresh': 17.068519362492953, 'sideways_atr_min_pct': 0.0219991651352124, 'sideways_atr_max_pct': 0.02866799381127036, 'sideways_tp_mult': 2.7956394779722755, 'sideways_tsl_mult': 0.1681938026421994, 'sideways_time_stop': 139, 'sideways_use_sma': False, 'sideways_use_ema': True, 'sideways_use_atr': False, 'sideways_use_adx': False, 'sideways_use_spike': False, 'sideways_rsi_required': True}.
[I 2025-08-30 14:37:38,894] Trial 135 finished with values: [-1000000000.0, 1000000000.0] and parameters: {'p_sma': 10, 'p_std': 37, 'p_atr': 22, 'p_adx': 8, 'rsi_period': 23, 'ema1': 24, 'ema2': 19, 'slip_atr_k': 0.08755822968912658, 'slip_spread_k': 0.8175814218885491, 'spread_hl_frac': 0.038472587998386716, 'bb_std_mult': 3.3586490439776524, 'rsi_os': 16, 'rsi_ob': 76, 'vol_spike': 0.006839328590007049, 'adx_thresh': 29.086234234629554, 'atr_min_pct': 0.029960450116613694, 'atr_max_pct': 0.09184441818770868, 'tp_mult': 2.188130546091565, 'tsl_mult': 0.6412362439464425, 'strategy': 'mean_reversion', 'time_stop': 173, 'use_sma': True, 'use_atr': True, 'use_adx': False, 'use_ema': False, 'use_spike': True, 'rsi_required': True, 'edge_k': 1.817189364262998, 'edge_cap': 0.572595601306245, 'bull_strategy': 'mean_reversion', 'bull_bb_std_mult': 0.6880974602348724, 'bull_rsi_os': 49, 'bull_rsi_ob': 79, 'bull_adx_thresh': 12.066053487465403, 'bull_atr_min_pct': 0.004334615515840409, 'bull_atr_max_pct': 0.018530619599289054, 'bull_tp_mult': 2.539266633631577, 'bull_tsl_mult': 0.1154624198942183, 'bull_time_stop': 180, 'bull_use_sma': False, 'bull_use_ema': False, 'bull_use_atr': True, 'bull_use_adx': True, 'bull_use_spike': True, 'bull_rsi_required': False, 'bear_strategy': 'breakout', 'bear_bb_std_mult': 0.9275621136503229, 'bear_rsi_os': 21, 'bear_rsi_ob': 64, 'bear_adx_thresh': 30.869116647528084, 'bear_atr_min_pct': 0.009549745349734316, 'bear_atr_max_pct': 0.06038929054701249, 'bear_tp_mult': 2.042249627332345, 'bear_tsl_mult': 0.735984320106335, 'bear_time_stop': 175, 'bear_use_sma': False, 'bear_use_ema': True, 'bear_use_atr': False, 'bear_use_adx': False, 'bear_use_spike': False, 'bear_rsi_required': True, 'sideways_strategy': 'breakout', 'sideways_bb_std_mult': 0.8183036017685226, 'sideways_rsi_os': 44, 'sideways_rsi_ob': 56, 'sideways_adx_thresh': 30.278656974045308, 'sideways_atr_min_pct': 0.021725213134668984, 'sideways_atr_max_pct': 0.12079370257467031, 'sideways_tp_mult': 2.2658153409534316, 'sideways_tsl_mult': 0.8387041600799287, 'sideways_time_stop': 26, 'sideways_use_sma': False, 'sideways_use_ema': True, 'sideways_use_atr': False, 'sideways_use_adx': False, 'sideways_use_spike': False, 'sideways_rsi_required': True}.
[I 2025-08-30 14:37:39,082] Trial 137 finished with values: [-1000000000.0, 1000000000.0] and parameters: {'p_sma': 11, 'p_std': 7, 'p_atr': 13, 'p_adx': 9, 'rsi_period': 42, 'ema1': 14, 'ema2': 15, 'slip_atr_k': 0.0871051404118057, 'slip_spread_k': 0.8197485059896019, 'spread_hl_frac': 0.0024311441651960405, 'bb_std_mult': 2.5543546890322064, 'rsi_os': 16, 'rsi_ob': 57, 'vol_spike': 0.12485994953665455, 'adx_thresh': 28.980355877908085, 'atr_min_pct': 0.02992511478500247, 'atr_max_pct': 0.03420268079163817, 'tp_mult': 2.308177536999754, 'tsl_mult': 0.6378452337405176, 'strategy': 'mean_reversion', 'time_stop': 255, 'use_sma': True, 'use_atr': True, 'use_adx': False, 'use_ema': False, 'use_spike': True, 'rsi_required': True, 'edge_k': 1.815565753035228, 'edge_cap': 0.7393725024745943, 'bull_strategy': 'mean_reversion', 'bull_bb_std_mult': 2.990786909861127, 'bull_rsi_os': 33, 'bull_rsi_ob': 50, 'bull_adx_thresh': 27.010720518880582, 'bull_atr_min_pct': 0.010283602043932433, 'bull_atr_max_pct': 0.12328304706990195, 'bull_tp_mult': 1.354604637920274, 'bull_tsl_mult': 0.4093592938011247, 'bull_time_stop': 150, 'bull_use_sma': True, 'bull_use_ema': False, 'bull_use_atr': False, 'bull_use_adx': True, 'bull_use_spike': True, 'bull_rsi_required': False, 'bear_strategy': 'breakout', 'bear_bb_std_mult': 3.399957196661017, 'bear_rsi_os': 7, 'bear_rsi_ob': 46, 'bear_adx_thresh': 11.563244353083975, 'bear_atr_min_pct': 0.00958124299585197, 'bear_atr_max_pct': 0.14998917980744772, 'bear_tp_mult': 1.963071573498435, 'bear_tsl_mult': 0.11702390076966035, 'bear_time_stop': 176, 'bear_use_sma': False, 'bear_use_ema': True, 'bear_use_atr': False, 'bear_use_adx': False, 'bear_use_spike': False, 'bear_rsi_required': True, 'sideways_strategy': 'breakout', 'sideways_bb_std_mult': 1.9256559765289263, 'sideways_rsi_os': 44, 'sideways_rsi_ob': 45, 'sideways_adx_thresh': 16.743105347676472, 'sideways_atr_min_pct': 0.021743031515329966, 'sideways_atr_max_pct': 0.0290068036920604, 'sideways_tp_mult': 1.602408617025102, 'sideways_tsl_mult': 0.9363588903873261, 'sideways_time_stop': 139, 'sideways_use_sma': False, 'sideways_use_ema': True, 'sideways_use_atr': False, 'sideways_use_adx': False, 'sideways_use_spike': False, 'sideways_rsi_required': True}.
[I 2025-08-30 14:37:39,436] Trial 138 finished with values: [-1000000000.0, 1000000000.0] and parameters: {'p_sma': 11, 'p_std': 7, 'p_atr': 28, 'p_adx': 12, 'rsi_period': 80, 'ema1': 17, 'ema2': 34, 'slip_atr_k': 0.08702083603677924, 'slip_spread_k': 0.8285263904065742, 'spread_hl_frac': 0.04454342415248405, 'bb_std_mult': 1.1901307904777267, 'rsi_os': 43, 'rsi_ob': 47, 'vol_spike': 0.29921433569006634, 'adx_thresh': 26.327697889872155, 'atr_min_pct': 0.029814087988651223, 'atr_max_pct': 0.03468922566922544, 'tp_mult': 2.2944640385246475, 'tsl_mult': 0.6321475902550764, 'strategy': 'mean_reversion', 'time_stop': 144, 'use_sma': True, 'use_atr': True, 'use_adx': False, 'use_ema': False, 'use_spike': True, 'rsi_required': True, 'edge_k': 1.8026905433139186, 'edge_cap': 0.051923078174891224, 'bull_strategy': 'mean_reversion', 'bull_bb_std_mult': 0.7656224851465658, 'bull_rsi_os': 55, 'bull_rsi_ob': 80, 'bull_adx_thresh': 19.934350448139213, 'bull_atr_min_pct': 0.021486819798779547, 'bull_atr_max_pct': 0.0397341056170409, 'bull_tp_mult': 1.3522270913538033, 'bull_tsl_mult': 0.4541866526320227, 'bull_time_stop': 17, 'bull_use_sma': True, 'bull_use_ema': False, 'bull_use_atr': False, 'bull_use_adx': True, 'bull_use_spike': True, 'bull_rsi_required': False, 'bear_strategy': 'breakout', 'bear_bb_std_mult': 1.5560828037301835, 'bear_rsi_os': 20, 'bear_rsi_ob': 50, 'bear_adx_thresh': 26.63594948956906, 'bear_atr_min_pct': 0.009635415601256019, 'bear_atr_max_pct': 0.14997554216649017, 'bear_tp_mult': 2.01090855985887, 'bear_tsl_mult': 0.7461653959666683, 'bear_time_stop': 195, 'bear_use_sma': False, 'bear_use_ema': True, 'bear_use_atr': False, 'bear_use_adx': False, 'bear_use_spike': False, 'bear_rsi_required': True, 'sideways_strategy': 'breakout', 'sideways_bb_std_mult': 1.9545712328614058, 'sideways_rsi_os': 47, 'sideways_rsi_ob': 57, 'sideways_adx_thresh': 17.056198703684128, 'sideways_atr_min_pct': 0.014663947890802312, 'sideways_atr_max_pct': 0.030124508581721658, 'sideways_tp_mult': 2.882106240652914, 'sideways_tsl_mult': 0.9272955563309544, 'sideways_time_stop': 37, 'sideways_use_sma': False, 'sideways_use_ema': True, 'sideways_use_atr': False, 'sideways_use_adx': False, 'sideways_use_spike': False, 'sideways_rsi_required': True}.
[I 2025-08-30 14:37:39,444] Trial 140 finished with values: [-1000000000.0, 1000000000.0] and parameters: {'p_sma': 35, 'p_std': 16, 'p_atr': 19, 'p_adx': 10, 'rsi_period': 42, 'ema1': 14, 'ema2': 28, 'slip_atr_k': 0.14986127014726386, 'slip_spread_k': 0.5374653939647472, 'spread_hl_frac': 0.002424637077708725, 'bb_std_mult': 1.203816090628699, 'rsi_os': 55, 'rsi_ob': 81, 'vol_spike': 0.03274112075765381, 'adx_thresh': 16.147865093559435, 'atr_min_pct': 0.02941041383063238, 'atr_max_pct': 0.034017966450411136, 'tp_mult': 2.9523360161284096, 'tsl_mult': 0.7976703750126829, 'strategy': 'mean_reversion', 'time_stop': 295, 'use_sma': True, 'use_atr': True, 'use_adx': False, 'use_ema': True, 'use_spike': True, 'rsi_required': True, 'edge_k': 0.7313534490490596, 'edge_cap': 0.18375820720654495, 'bull_strategy': 'mean_reversion', 'bull_bb_std_mult': 2.1490638292401645, 'bull_rsi_os': 42, 'bull_rsi_ob': 79, 'bull_adx_thresh': 26.74447441937593, 'bull_atr_min_pct': 0.021575849447107248, 'bull_atr_max_pct': 0.04528320474183703, 'bull_tp_mult': 2.0727494927624686, 'bull_tsl_mult': 0.40809465644849297, 'bull_time_stop': 80, 'bull_use_sma': True, 'bull_use_ema': False, 'bull_use_atr': False, 'bull_use_adx': True, 'bull_use_spike': False, 'bull_rsi_required': False, 'bear_strategy': 'breakout', 'bear_bb_std_mult': 0.7817521914982171, 'bear_rsi_os': 7, 'bear_rsi_ob': 56, 'bear_adx_thresh': 26.631129157142034, 'bear_atr_min_pct': 0.022200624856830685, 'bear_atr_max_pct': 0.1395819988510135, 'bear_tp_mult': 1.8228755397809564, 'bear_tsl_mult': 0.10465985738760814, 'bear_time_stop': 231, 'bear_use_sma': False, 'bear_use_ema': True, 'bear_use_atr': False, 'bear_use_adx': False, 'bear_use_spike': False, 'bear_rsi_required': False, 'sideways_strategy': 'breakout', 'sideways_bb_std_mult': 1.9413854892117939, 'sideways_rsi_os': 50, 'sideways_rsi_ob': 58, 'sideways_adx_thresh': 24.364578150150066, 'sideways_atr_min_pct': 0.010950469642551846, 'sideways_atr_max_pct': 0.05423464756819391, 'sideways_tp_mult': 1.578956969454763, 'sideways_tsl_mult': 0.6382057943831976, 'sideways_time_stop': 191, 'sideways_use_sma': False, 'sideways_use_ema': True, 'sideways_use_atr': False, 'sideways_use_adx': False, 'sideways_use_spike': False, 'sideways_rsi_required': False}.
[I 2025-08-30 14:38:09,280] Trial 141 finished with values: [-1000000000.0, 1000000000.0] and parameters: {'p_sma': 21, 'p_std': 8, 'p_atr': 19, 'p_adx': 10, 'rsi_period': 81, 'ema1': 27, 'ema2': 28, 'slip_atr_k': 0.09999694291795325, 'slip_spread_k': 0.3297586718533738, 'spread_hl_frac': 0.006146026323758023, 'bb_std_mult': 1.1834271703340042, 'rsi_os': 19, 'rsi_ob': 77, 'vol_spike': 0.035050037183822935, 'adx_thresh': 16.192522990632824, 'atr_min_pct': 0.02433173088847504, 'atr_max_pct': 0.03435327704304873, 'tp_mult': 2.9467148059617396, 'tsl_mult': 0.7845963139273315, 'strategy': 'mean_reversion', 'time_stop': 141, 'use_sma': True, 'use_atr': True, 'use_adx': False, 'use_ema': True, 'use_spike': True, 'rsi_required': True, 'edge_k': 0.9167746977484292, 'edge_cap': 0.47114486815438, 'bull_strategy': 'mean_reversion', 'bull_bb_std_mult': 0.5718912189567951, 'bull_rsi_os': 42, 'bull_rsi_ob': 80, 'bull_adx_thresh': 8.736936867728732, 'bull_atr_min_pct': 0.005729328135710721, 'bull_atr_max_pct': 0.04477273521431557, 'bull_tp_mult': 1.299554068431875, 'bull_tsl_mult': 0.24519323297426415, 'bull_time_stop': 79, 'bull_use_sma': True, 'bull_use_ema': False, 'bull_use_atr': False, 'bull_use_adx': True, 'bull_use_spike': False, 'bull_rsi_required': False, 'bear_strategy': 'breakout', 'bear_bb_std_mult': 0.7796578702162071, 'bear_rsi_os': 19, 'bear_rsi_ob': 50, 'bear_adx_thresh': 26.544887664118143, 'bear_atr_min_pct': 0.011478580705492831, 'bear_atr_max_pct': 0.016926430153893723, 'bear_tp_mult': 1.7936284654802803, 'bear_tsl_mult': 0.7539757188089704, 'bear_time_stop': 165, 'bear_use_sma': False, 'bear_use_ema': True, 'bear_use_atr': False, 'bear_use_adx': False, 'bear_use_spike': False, 'bear_rsi_required': False, 'sideways_strategy': 'breakout', 'sideways_bb_std_mult': 2.2584986542643826, 'sideways_rsi_os': 47, 'sideways_rsi_ob': 63, 'sideways_adx_thresh': 12.897352811889476, 'sideways_atr_min_pct': 0.007517540939313362, 'sideways_atr_max_pct': 0.016500042717374222, 'sideways_tp_mult': 2.697084547864779, 'sideways_tsl_mult': 0.031214865156847293, 'sideways_time_stop': 198, 'sideways_use_sma': False, 'sideways_use_ema': True, 'sideways_use_atr': False, 'sideways_use_adx': False, 'sideways_use_spike': False, 'sideways_rsi_required': False}.
[I 2025-08-30 14:38:09,320] Trial 139 finished with values: [-1000000000.0, 1000000000.0] and parameters: {'p_sma': 35, 'p_std': 7, 'p_atr': 29, 'p_adx': 12, 'rsi_period': 81, 'ema1': 24, 'ema2': 34, 'slip_atr_k': 0.08958299677205077, 'slip_spread_k': 0.32328996748648076, 'spread_hl_frac': 0.037852838479123754, 'bb_std_mult': 2.565060309434439, 'rsi_os': 19, 'rsi_ob': 57, 'vol_spike': 0.12404596768730974, 'adx_thresh': 24.83966168522476, 'atr_min_pct': 0.02954297289608747, 'atr_max_pct': 0.034204797086856004, 'tp_mult': 2.3261301590455044, 'tsl_mult': 0.511263023449946, 'strategy': 'mean_reversion', 'time_stop': 254, 'use_sma': True, 'use_atr': True, 'use_adx': False, 'use_ema': True, 'use_spike': True, 'rsi_required': True, 'edge_k': 0.9217819468317696, 'edge_cap': 0.4777893892204439, 'bull_strategy': 'mean_reversion', 'bull_bb_std_mult': 1.634178951225973, 'bull_rsi_os': 42, 'bull_rsi_ob': 79, 'bull_adx_thresh': 19.7830568393703, 'bull_atr_min_pct': 0.02098027176702302, 'bull_atr_max_pct': 0.05974706846615144, 'bull_tp_mult': 1.7891117026079433, 'bull_tsl_mult': 0.25117280622661003, 'bull_time_stop': 186, 'bull_use_sma': True, 'bull_use_ema': False, 'bull_use_atr': False, 'bull_use_adx': True, 'bull_use_spike': False, 'bull_rsi_required': False, 'bear_strategy': 'breakout', 'bear_bb_std_mult': 0.77844347555982, 'bear_rsi_os': 19, 'bear_rsi_ob': 52, 'bear_adx_thresh': 16.508925737186193, 'bear_atr_min_pct': 0.011396906687924029, 'bear_atr_max_pct': 0.14180562818805545, 'bear_tp_mult': 1.8076850234364292, 'bear_tsl_mult': 0.7540630106023827, 'bear_time_stop': 175, 'bear_use_sma': False, 'bear_use_ema': True, 'bear_use_atr': False, 'bear_use_adx': False, 'bear_use_spike': False, 'bear_rsi_required': False, 'sideways_strategy': 'breakout', 'sideways_bb_std_mult': 2.498632404019828, 'sideways_rsi_os': 47, 'sideways_rsi_ob': 58, 'sideways_adx_thresh': 26.7481537517837, 'sideways_atr_min_pct': 0.02545148937378264, 'sideways_atr_max_pct': 0.05465260950548112, 'sideways_tp_mult': 2.2502745236944914, 'sideways_tsl_mult': 0.5300612218431414, 'sideways_time_stop': 101, 'sideways_use_sma': False, 'sideways_use_ema': True, 'sideways_use_atr': False, 'sideways_use_adx': False, 'sideways_use_spike': False, 'sideways_rsi_required': False}.
[I 2025-08-30 14:38:10,876] Trial 143 finished with values: [-1000000000.0, 1000000000.0] and parameters: {'p_sma': 22, 'p_std': 9, 'p_atr': 30, 'p_adx': 25, 'rsi_period': 47, 'ema1': 8, 'ema2': 11, 'slip_atr_k': 0.09965814093072003, 'slip_spread_k': 0.199493489575994, 'spread_hl_frac': 0.04897877292250879, 'bb_std_mult': 3.4984979716688445, 'rsi_os': 18, 'rsi_ob': 78, 'vol_spike': 0.11262770134566485, 'adx_thresh': 17.06391842108423, 'atr_min_pct': 0.014978787474757142, 'atr_max_pct': 0.02385752524306558, 'tp_mult': 1.969226338618994, 'tsl_mult': 0.10058159484203485, 'strategy': 'mean_reversion', 'time_stop': 288, 'use_sma': True, 'use_atr': True, 'use_adx': False, 'use_ema': True, 'use_spike': True, 'rsi_required': True, 'edge_k': 1.931598766310171, 'edge_cap': 0.46462096854219626, 'bull_strategy': 'mean_reversion', 'bull_bb_std_mult': 1.2152963287937042, 'bull_rsi_os': 38, 'bull_rsi_ob': 53, 'bull_adx_thresh': 8.336107412782741, 'bull_atr_min_pct': 0.010911079736696328, 'bull_atr_max_pct': 0.08206735249720798, 'bull_tp_mult': 2.9152442769978784, 'bull_tsl_mult': 0.25345856188990723, 'bull_time_stop': 106, 'bull_use_sma': False, 'bull_use_ema': False, 'bull_use_atr': False, 'bull_use_adx': True, 'bull_use_spike': False, 'bull_rsi_required': False, 'bear_strategy': 'breakout', 'bear_bb_std_mult': 0.5024411872317786, 'bear_rsi_os': 14, 'bear_rsi_ob': 52, 'bear_adx_thresh': 31.22170421109409, 'bear_atr_min_pct': 0.011429428647002561, 'bear_atr_max_pct': 0.01983265442334748, 'bear_tp_mult': 2.141188010072195, 'bear_tsl_mult': 0.761494315701883, 'bear_time_stop': 13, 'bear_use_sma': False, 'bear_use_ema': False, 'bear_use_atr': False, 'bear_use_adx': True, 'bear_use_spike': False, 'bear_rsi_required': False, 'sideways_strategy': 'mean_reversion', 'sideways_bb_std_mult': 0.5158949400459432, 'sideways_rsi_os': 42, 'sideways_rsi_ob': 64, 'sideways_adx_thresh': 17.828148619120448, 'sideways_atr_min_pct': 0.007316816372294036, 'sideways_atr_max_pct': 0.1272259769033368, 'sideways_tp_mult': 2.709002045351562, 'sideways_tsl_mult': 0.8929767342332375, 'sideways_time_stop': 5, 'sideways_use_sma': False, 'sideways_use_ema': False, 'sideways_use_atr': False, 'sideways_use_adx': False, 'sideways_use_spike': False, 'sideways_rsi_required': False}.
[I 2025-08-30 14:38:11,034] Trial 142 finished with values: [-1000000000.0, 1000000000.0] and parameters: {'p_sma': 23, 'p_std': 16, 'p_atr': 19, 'p_adx': 10, 'rsi_period': 46, 'ema1': 27, 'ema2': 28, 'slip_atr_k': 0.07668911946683461, 'slip_spread_k': 0.0011799545420891344, 'spread_hl_frac': 0.047256076307506195, 'bb_std_mult': 2.665612566054075, 'rsi_os': 19, 'rsi_ob': 81, 'vol_spike': 0.034976191959818964, 'adx_thresh': 24.891656717864972, 'atr_min_pct': 0.009446361687250816, 'atr_max_pct': 0.08275873401298967, 'tp_mult': 1.9762598599600065, 'tsl_mult': 0.15486849153581694, 'strategy': 'mean_reversion', 'time_stop': 294, 'use_sma': True, 'use_atr': True, 'use_adx': False, 'use_ema': True, 'use_spike': True, 'rsi_required': True, 'edge_k': 0.005763873878964043, 'edge_cap': 0.18677160474777277, 'bull_strategy': 'mean_reversion', 'bull_bb_std_mult': 2.7417920096404735, 'bull_rsi_os': 38, 'bull_rsi_ob': 79, 'bull_adx_thresh': 10.785059548904384, 'bull_atr_min_pct': 0.024431165908119945, 'bull_atr_max_pct': 0.06003981707576628, 'bull_tp_mult': 2.0914800289584816, 'bull_tsl_mult': 0.15708739659903487, 'bull_time_stop': 105, 'bull_use_sma': False, 'bull_use_ema': False, 'bull_use_atr': False, 'bull_use_adx': True, 'bull_use_spike': False, 'bull_rsi_required': False, 'bear_strategy': 'breakout', 'bear_bb_std_mult': 0.7894037390795307, 'bear_rsi_os': 19, 'bear_rsi_ob': 52, 'bear_adx_thresh': 16.234430923837767, 'bear_atr_min_pct': 0.022656280862592006, 'bear_atr_max_pct': 0.018713404964836318, 'bear_tp_mult': 2.9885289823168035, 'bear_tsl_mult': 0.768970989057762, 'bear_time_stop': 26, 'bear_use_sma': False, 'bear_use_ema': True, 'bear_use_atr': False, 'bear_use_adx': False, 'bear_use_spike': False, 'bear_rsi_required': False, 'sideways_strategy': 'mean_reversion', 'sideways_bb_std_mult': 1.3036717709050523, 'sideways_rsi_os': 49, 'sideways_rsi_ob': 64, 'sideways_adx_thresh': 17.87349972972069, 'sideways_atr_min_pct': 0.01068007818241902, 'sideways_atr_max_pct': 0.14532041848797006, 'sideways_tp_mult': 1.1977820139394781, 'sideways_tsl_mult': 0.8784560303271112, 'sideways_time_stop': 197, 'sideways_use_sma': False, 'sideways_use_ema': False, 'sideways_use_atr': False, 'sideways_use_adx': False, 'sideways_use_spike': False, 'sideways_rsi_required': False}.
