[I 2025-08-30 15:23:52,306] Trial 450 finished with values: [-1000000000.0, 1000000000.0] and parameters: {'p_sma': 10, 'p_std': 18, 'p_atr': 13, 'p_adx': 23, 'rsi_period': 9, 'ema1': 24, 'ema2': 34, 'slip_atr_k': 0.01111234756240359, 'slip_spread_k': 0.7225053095718583, 'spread_hl_frac': 0.007527647171703119, 'bb_std_mult': 0.7458277524859557, 'rsi_os': 24, 'rsi_ob': 86, 'vol_spike': 0.20732099644558166, 'adx_thresh': 8.921642327497716, 'atr_min_pct': 0.007451456438712581, 'atr_max_pct': 0.11260774906380246, 'tp_mult': 1.5249310296497187, 'tsl_mult': 0.35056981794951086, 'strategy': 'breakout', 'time_stop': 150, 'use_sma': False, 'use_atr': False, 'use_adx': True, 'use_ema': False, 'use_spike': False, 'rsi_required': False, 'edge_k': 0.5900343020579141, 'edge_cap': 0.980038906403607, 'bull_strategy': 'breakout', 'bull_bb_std_mult': 1.8256799574063707, 'bull_rsi_os': 48, 'bull_rsi_ob': 87, 'bull_adx_thresh': 7.455234847210199, 'bull_atr_min_pct': 0.019299265795442316, 'bull_atr_max_pct': 0.10377292946640417, 'bull_tp_mult': 2.697245485357917, 'bull_tsl_mult': 0.8257502677645123, 'bull_time_stop': 42, 'bull_use_sma': True, 'bull_use_ema': True, 'bull_use_atr': True, 'bull_use_adx': True, 'bull_use_spike': True, 'bull_rsi_required': False, 'bear_strategy': 'mean_reversion', 'bear_bb_std_mult': 2.0367055282811117, 'bear_rsi_os': 26, 'bear_rsi_ob': 73, 'bear_adx_thresh': 16.442571831372764, 'bear_atr_min_pct': 0.004392858193583386, 'bear_atr_max_pct': 0.10850951374472952, 'bear_tp_mult': 2.7040970197481458, 'bear_tsl_mult': 0.8527456673145691, 'bear_time_stop': 117, 'bear_use_sma': True, 'bear_use_ema': False, 'bear_use_atr': True, 'bear_use_adx': True, 'bear_use_spike': True, 'bear_rsi_required': True, 'sideways_strategy': 'mean_reversion', 'sideways_bb_std_mult': 2.980850091177876, 'sideways_rsi_os': 33, 'sideways_rsi_ob': 79, 'sideways_adx_thresh': 10.635490722138112, 'sideways_atr_min_pct': 0.021132749285383546, 'sideways_atr_max_pct': 0.07475340299943897, 'sideways_tp_mult': 2.1718579267694897, 'sideways_tsl_mult': 0.40044799679377346, 'sideways_time_stop': 136, 'sideways_use_sma': True, 'sideways_use_ema': False, 'sideways_use_atr': True, 'sideways_use_adx': True, 'sideways_use_spike': True, 'sideways_rsi_required': True}.
[I 2025-08-30 15:23:52,585] Trial 449 finished with values: [-1000000000.0, 1000000000.0] and parameters: {'p_sma': 11, 'p_std': 20, 'p_atr': 13, 'p_adx': 23, 'rsi_period': 9, 'ema1': 24, 'ema2': 34, 'slip_atr_k': 0.010789957810687551, 'slip_spread_k': 0.7399939421652885, 'spread_hl_frac': 0.007472075639546105, 'bb_std_mult': 0.6664818852204009, 'rsi_os': 22, 'rsi_ob': 87, 'vol_spike': 0.20888974539512986, 'adx_thresh': 9.65600455183042, 'atr_min_pct': 0.008132237062648217, 'atr_max_pct': 0.12279745783391535, 'tp_mult': 1.5321223072849308, 'tsl_mult': 0.3516177095802542, 'strategy': 'breakout', 'time_stop': 159, 'use_sma': False, 'use_atr': False, 'use_adx': True, 'use_ema': False, 'use_spike': False, 'rsi_required': False, 'edge_k': 0.48334554881334035, 'edge_cap': 0.9945679716931083, 'bull_strategy': 'breakout', 'bull_bb_std_mult': 1.8411015772680996, 'bull_rsi_os': 47, 'bull_rsi_ob': 87, 'bull_adx_thresh': 8.310898688448216, 'bull_atr_min_pct': 0.018865454314734714, 'bull_atr_max_pct': 0.1010483469898215, 'bull_tp_mult': 2.768823689271784, 'bull_tsl_mult': 0.8178858786321411, 'bull_time_stop': 42, 'bull_use_sma': True, 'bull_use_ema': True, 'bull_use_atr': True, 'bull_use_adx': True, 'bull_use_spike': True, 'bull_rsi_required': False, 'bear_strategy': 'mean_reversion', 'bear_bb_std_mult': 2.007326615094158, 'bear_rsi_os': 27, 'bear_rsi_ob': 73, 'bear_adx_thresh': 15.799177859668992, 'bear_atr_min_pct': 0.004476295168855675, 'bear_atr_max_pct': 0.10738764815621901, 'bear_tp_mult': 2.7054949750918795, 'bear_tsl_mult': 0.8759939092292554, 'bear_time_stop': 117, 'bear_use_sma': True, 'bear_use_ema': False, 'bear_use_atr': True, 'bear_use_adx': True, 'bear_use_spike': True, 'bear_rsi_required': True, 'sideways_strategy': 'mean_reversion', 'sideways_bb_std_mult': 3.031799188889046, 'sideways_rsi_os': 33, 'sideways_rsi_ob': 80, 'sideways_adx_thresh': 10.687905172550202, 'sideways_atr_min_pct': 0.0208425038043009, 'sideways_atr_max_pct': 0.07629992888707224, 'sideways_tp_mult': 2.187638685774836, 'sideways_tsl_mult': 0.4006038677148832, 'sideways_time_stop': 149, 'sideways_use_sma': True, 'sideways_use_ema': False, 'sideways_use_atr': True, 'sideways_use_adx': True, 'sideways_use_spike': True, 'sideways_rsi_required': True}.
[I 2025-08-30 15:23:52,801] Trial 452 finished with values: [-1000000000.0, 1000000000.0] and parameters: {'p_sma': 10, 'p_std': 18, 'p_atr': 12, 'p_adx': 23, 'rsi_period': 8, 'ema1': 24, 'ema2': 34, 'slip_atr_k': 0.0050339289934300206, 'slip_spread_k': 0.7213426631989872, 'spread_hl_frac': 0.006767245539734525, 'bb_std_mult': 0.736665487776763, 'rsi_os': 24, 'rsi_ob': 86, 'vol_spike': 0.20941513454389168, 'adx_thresh': 9.005252285229094, 'atr_min_pct': 0.0071388849949807365, 'atr_max_pct': 0.11879912064231028, 'tp_mult': 1.4421862025331127, 'tsl_mult': 0.4015568434922682, 'strategy': 'breakout', 'time_stop': 152, 'use_sma': False, 'use_atr': False, 'use_adx': True, 'use_ema': False, 'use_spike': False, 'rsi_required': False, 'edge_k': 0.57250333291471, 'edge_cap': 0.9821596068838253, 'bull_strategy': 'breakout', 'bull_bb_std_mult': 1.7885869640330725, 'bull_rsi_os': 48, 'bull_rsi_ob': 88, 'bull_adx_thresh': 7.1206446469876, 'bull_atr_min_pct': 0.017896946903696174, 'bull_atr_max_pct': 0.10446423431112482, 'bull_tp_mult': 2.732021743853831, 'bull_tsl_mult': 0.8452116810672341, 'bull_time_stop': 44, 'bull_use_sma': True, 'bull_use_ema': True, 'bull_use_atr': True, 'bull_use_adx': True, 'bull_use_spike': True, 'bull_rsi_required': False, 'bear_strategy': 'mean_reversion', 'bear_bb_std_mult': 2.038019828097066, 'bear_rsi_os': 27, 'bear_rsi_ob': 73, 'bear_adx_thresh': 16.50614016397964, 'bear_atr_min_pct': 0.004135453675826202, 'bear_atr_max_pct': 0.11002817000857645, 'bear_tp_mult': 2.7075868721313943, 'bear_tsl_mult': 0.8430263290241649, 'bear_time_stop': 124, 'bear_use_sma': True, 'bear_use_ema': False, 'bear_use_atr': True, 'bear_use_adx': True, 'bear_use_spike': True, 'bear_rsi_required': True, 'sideways_strategy': 'mean_reversion', 'sideways_bb_std_mult': 2.9726286510741304, 'sideways_rsi_os': 33, 'sideways_rsi_ob': 80, 'sideways_adx_thresh': 9.913471920640363, 'sideways_atr_min_pct': 0.020817132705667988, 'sideways_atr_max_pct': 0.0696272288553553, 'sideways_tp_mult': 2.1877438107089064, 'sideways_tsl_mult': 0.37098025409154306, 'sideways_time_stop': 138, 'sideways_use_sma': True, 'sideways_use_ema': False, 'sideways_use_atr': True, 'sideways_use_adx': True, 'sideways_use_spike': True, 'sideways_rsi_required': True}.
[I 2025-08-30 15:24:52,220] Trial 454 finished with values: [-0.004581812351737047, 0.00758063088645374] and parameters: {'p_sma': 12, 'p_std': 22, 'p_atr': 12, 'p_adx': 25, 'rsi_period': 7, 'ema1': 26, 'ema2': 34, 'slip_atr_k': 0.004856310620513809, 'slip_spread_k': 0.7591767941388647, 'spread_hl_frac': 0.00710468847239384, 'bb_std_mult': 0.540148187190943, 'rsi_os': 23, 'rsi_ob': 88, 'vol_spike': 0.2223484783608269, 'adx_thresh': 8.848589234093419, 'atr_min_pct': 0.007012210469577345, 'atr_max_pct': 0.11873989920928982, 'tp_mult': 1.475117364614881, 'tsl_mult': 0.40682201947633145, 'strategy': 'breakout', 'time_stop': 153, 'use_sma': False, 'use_atr': False, 'use_adx': True, 'use_ema': False, 'use_spike': False, 'rsi_required': False, 'edge_k': 0.5121151042719795, 'edge_cap': 0.9800405613909824, 'bull_strategy': 'breakout', 'bull_bb_std_mult': 1.7607712208441197, 'bull_rsi_os': 48, 'bull_rsi_ob': 89, 'bull_adx_thresh': 8.80242233670783, 'bull_atr_min_pct': 0.018080601840957937, 'bull_atr_max_pct': 0.09890546933868717, 'bull_tp_mult': 2.7603370241700844, 'bull_tsl_mult': 0.8491231747036052, 'bull_time_stop': 47, 'bull_use_sma': True, 'bull_use_ema': True, 'bull_use_atr': True, 'bull_use_adx': True, 'bull_use_spike': True, 'bull_rsi_required': False, 'bear_strategy': 'mean_reversion', 'bear_bb_std_mult': 2.057630644226655, 'bear_rsi_os': 27, 'bear_rsi_ob': 73, 'bear_adx_thresh': 17.493581786497245, 'bear_atr_min_pct': 0.0032548614040053725, 'bear_atr_max_pct': 0.10515598853177086, 'bear_tp_mult': 2.7685868332498615, 'bear_tsl_mult': 0.8871654541287222, 'bear_time_stop': 112, 'bear_use_sma': True, 'bear_use_ema': False, 'bear_use_atr': True, 'bear_use_adx': True, 'bear_use_spike': True, 'bear_rsi_required': True, 'sideways_strategy': 'mean_reversion', 'sideways_bb_std_mult': 3.100159137743937, 'sideways_rsi_os': 32, 'sideways_rsi_ob': 78, 'sideways_adx_thresh': 11.476872584652744, 'sideways_atr_min_pct': 0.02059923822754369, 'sideways_atr_max_pct': 0.06908601877814, 'sideways_tp_mult': 2.0771010833042256, 'sideways_tsl_mult': 0.371751212262244, 'sideways_time_stop': 145, 'sideways_use_sma': True, 'sideways_use_ema': False, 'sideways_use_atr': True, 'sideways_use_adx': True, 'sideways_use_spike': True, 'sideways_rsi_required': True}.
[I 2025-08-30 15:24:53,080] Trial 456 finished with values: [-0.0031776221928832005, 0.006610196023582424] and parameters: {'p_sma': 12, 'p_std': 21, 'p_atr': 12, 'p_adx': 24, 'rsi_period': 7, 'ema1': 26, 'ema2': 35, 'slip_atr_k': 0.004635955775510687, 'slip_spread_k': 0.7581928967719324, 'spread_hl_frac': 0.006616667874995039, 'bb_std_mult': 0.5854936845085124, 'rsi_os': 23, 'rsi_ob': 85, 'vol_spike': 0.2238071300458977, 'adx_thresh': 8.228068970703546, 'atr_min_pct': 0.009431978301540602, 'atr_max_pct': 0.11771135344128221, 'tp_mult': 1.575617872359788, 'tsl_mult': 0.31864892234823583, 'strategy': 'breakout', 'time_stop': 150, 'use_sma': False, 'use_atr': False, 'use_adx': True, 'use_ema': False, 'use_spike': False, 'rsi_required': False, 'edge_k': 0.5103146988435863, 'edge_cap': 0.9728814529989935, 'bull_strategy': 'breakout', 'bull_bb_std_mult': 1.7111068727478917, 'bull_rsi_os': 46, 'bull_rsi_ob': 89, 'bull_adx_thresh': 8.76389500254115, 'bull_atr_min_pct': 0.018410322560153427, 'bull_atr_max_pct': 0.09960386149746184, 'bull_tp_mult': 2.6413493852080374, 'bull_tsl_mult': 0.8078406321609629, 'bull_time_stop': 29, 'bull_use_sma': True, 'bull_use_ema': True, 'bull_use_atr': True, 'bull_use_adx': True, 'bull_use_spike': True, 'bull_rsi_required': False, 'bear_strategy': 'mean_reversion', 'bear_bb_std_mult': 1.9259475883086654, 'bear_rsi_os': 28, 'bear_rsi_ob': 74, 'bear_adx_thresh': 15.398293932045002, 'bear_atr_min_pct': 0.0033267009577303856, 'bear_atr_max_pct': 0.1053890271596053, 'bear_tp_mult': 2.7588069852677055, 'bear_tsl_mult': 0.8755671728151766, 'bear_time_stop': 112, 'bear_use_sma': True, 'bear_use_ema': False, 'bear_use_atr': True, 'bear_use_adx': True, 'bear_use_spike': True, 'bear_rsi_required': True, 'sideways_strategy': 'mean_reversion', 'sideways_bb_std_mult': 3.075608932856502, 'sideways_rsi_os': 32, 'sideways_rsi_ob': 78, 'sideways_adx_thresh': 11.395156172994358, 'sideways_atr_min_pct': 0.02049937430419423, 'sideways_atr_max_pct': 0.07713434929882312, 'sideways_tp_mult': 2.061706902631673, 'sideways_tsl_mult': 0.3663226412533603, 'sideways_time_stop': 144, 'sideways_use_sma': True, 'sideways_use_ema': False, 'sideways_use_atr': True, 'sideways_use_adx': True, 'sideways_use_spike': True, 'sideways_rsi_required': True}.
[I 2025-08-30 15:24:53,107] Trial 453 finished with values: [-1000000000.0, 1000000000.0] and parameters: {'p_sma': 10, 'p_std': 17, 'p_atr': 12, 'p_adx': 23, 'rsi_period': 7, 'ema1': 26, 'ema2': 34, 'slip_atr_k': 0.004584181085509923, 'slip_spread_k': 0.7212743245558711, 'spread_hl_frac': 0.006461498162550917, 'bb_std_mult': 0.5849843948004294, 'rsi_os': 23, 'rsi_ob': 85, 'vol_spike': 0.21156141707659123, 'adx_thresh': 9.071634983318017, 'atr_min_pct': 0.00965525614584646, 'atr_max_pct': 0.1176854618652237, 'tp_mult': 1.448202954603368, 'tsl_mult': 0.40151168290901856, 'strategy': 'breakout', 'time_stop': 151, 'use_sma': False, 'use_atr': False, 'use_adx': True, 'use_ema': False, 'use_spike': False, 'rsi_required': False, 'edge_k': 0.570887783151024, 'edge_cap': 0.9796444277942455, 'bull_strategy': 'breakout', 'bull_bb_std_mult': 1.7303039433248166, 'bull_rsi_os': 48, 'bull_rsi_ob': 87, 'bull_adx_thresh': 7.403062489033728, 'bull_atr_min_pct': 0.018264438865524382, 'bull_atr_max_pct': 0.09930331786259468, 'bull_tp_mult': 2.758528636370957, 'bull_tsl_mult': 0.8417878668926931, 'bull_time_stop': 46, 'bull_use_sma': True, 'bull_use_ema': True, 'bull_use_atr': True, 'bull_use_adx': True, 'bull_use_spike': True, 'bull_rsi_required': False, 'bear_strategy': 'mean_reversion', 'bear_bb_std_mult': 2.071519684943167, 'bear_rsi_os': 27, 'bear_rsi_ob': 73, 'bear_adx_thresh': 17.28327257429755, 'bear_atr_min_pct': 0.0035963438086831514, 'bear_atr_max_pct': 0.1049597016037873, 'bear_tp_mult': 2.694055958767266, 'bear_tsl_mult': 0.8436058691340941, 'bear_time_stop': 113, 'bear_use_sma': True, 'bear_use_ema': False, 'bear_use_atr': True, 'bear_use_adx': True, 'bear_use_spike': True, 'bear_rsi_required': True, 'sideways_strategy': 'mean_reversion', 'sideways_bb_std_mult': 3.0684034544312904, 'sideways_rsi_os': 33, 'sideways_rsi_ob': 78, 'sideways_adx_thresh': 10.857251344946146, 'sideways_atr_min_pct': 0.020743572829889784, 'sideways_atr_max_pct': 0.07026164312735131, 'sideways_tp_mult': 2.052703142394035, 'sideways_tsl_mult': 0.3723153459779492, 'sideways_time_stop': 136, 'sideways_use_sma': True, 'sideways_use_ema': False, 'sideways_use_atr': True, 'sideways_use_adx': True, 'sideways_use_spike': True, 'sideways_rsi_required': True}.
[I 2025-08-30 15:24:53,581] Trial 455 finished with values: [-1000000000.0, 1000000000.0] and parameters: {'p_sma': 12, 'p_std': 21, 'p_atr': 12, 'p_adx': 22, 'rsi_period': 11, 'ema1': 26, 'ema2': 35, 'slip_atr_k': 0.004856731984196088, 'slip_spread_k': 0.763269364882199, 'spread_hl_frac': 0.006103613756871822, 'bb_std_mult': 0.6164531108607499, 'rsi_os': 23, 'rsi_ob': 85, 'vol_spike': 0.22032727164651514, 'adx_thresh': 8.135204478106427, 'atr_min_pct': 0.009667847128285022, 'atr_max_pct': 0.11649708340896335, 'tp_mult': 1.5784958238310751, 'tsl_mult': 0.38669804484253006, 'strategy': 'breakout', 'time_stop': 148, 'use_sma': False, 'use_atr': False, 'use_adx': True, 'use_ema': False, 'use_spike': False, 'rsi_required': False, 'edge_k': 0.6547060596792783, 'edge_cap': 0.9584637058772421, 'bull_strategy': 'breakout', 'bull_bb_std_mult': 1.720456459208292, 'bull_rsi_os': 46, 'bull_rsi_ob': 89, 'bull_adx_thresh': 7.40540899737613, 'bull_atr_min_pct': 0.01817795584487986, 'bull_atr_max_pct': 0.09799783942282687, 'bull_tp_mult': 2.6553359535436605, 'bull_tsl_mult': 0.8375926954345252, 'bull_time_stop': 30, 'bull_use_sma': True, 'bull_use_ema': True, 'bull_use_atr': True, 'bull_use_adx': True, 'bull_use_spike': True, 'bull_rsi_required': False, 'bear_strategy': 'mean_reversion', 'bear_bb_std_mult': 2.046892776625593, 'bear_rsi_os': 28, 'bear_rsi_ob': 72, 'bear_adx_thresh': 17.54281095112641, 'bear_atr_min_pct': 0.0033882000019422958, 'bear_atr_max_pct': 0.10518504403153957, 'bear_tp_mult': 2.7575722852114186, 'bear_tsl_mult': 0.8372449490320073, 'bear_time_stop': 112, 'bear_use_sma': True, 'bear_use_ema': False, 'bear_use_atr': True, 'bear_use_adx': True, 'bear_use_spike': True, 'bear_rsi_required': True, 'sideways_strategy': 'mean_reversion', 'sideways_bb_std_mult': 3.072720443705113, 'sideways_rsi_os': 32, 'sideways_rsi_ob': 78, 'sideways_adx_thresh': 11.338235845164792, 'sideways_atr_min_pct': 0.021366445007544203, 'sideways_atr_max_pct': 0.07650514252410219, 'sideways_tp_mult': 2.074713433097898, 'sideways_tsl_mult': 0.36837169741044784, 'sideways_time_stop': 132, 'sideways_use_sma': True, 'sideways_use_ema': False, 'sideways_use_atr': True, 'sideways_use_adx': True, 'sideways_use_spike': True, 'sideways_rsi_required': True}.
[I 2025-08-30 15:25:45,853] Trial 458 finished with values: [-1000000000.0, 1000000000.0] and parameters: {'p_sma': 12, 'p_std': 21, 'p_atr': 12, 'p_adx': 24, 'rsi_period': 11, 'ema1': 26, 'ema2': 35, 'slip_atr_k': 0.00024154761874041258, 'slip_spread_k': 0.7656637737392511, 'spread_hl_frac': 0.006615905421460405, 'bb_std_mult': 0.5415978121115705, 'rsi_os': 23, 'rsi_ob': 88, 'vol_spike': 0.2235646045716875, 'adx_thresh': 8.251467320217142, 'atr_min_pct': 0.0068646192209979124, 'atr_max_pct': 0.11074384841192375, 'tp_mult': 1.5747215384933255, 'tsl_mult': 0.32660695143145346, 'strategy': 'breakout', 'time_stop': 147, 'use_sma': False, 'use_atr': False, 'use_adx': True, 'use_ema': False, 'use_spike': False, 'rsi_required': False, 'edge_k': 0.6596435357183776, 'edge_cap': 0.9655068094204077, 'bull_strategy': 'breakout', 'bull_bb_std_mult': 1.7121647286406068, 'bull_rsi_os': 47, 'bull_rsi_ob': 90, 'bull_adx_thresh': 9.075927611706906, 'bull_atr_min_pct': 0.020206741842500382, 'bull_atr_max_pct': 0.10180769252694966, 'bull_tp_mult': 2.647535282971163, 'bull_tsl_mult': 0.8610213433499607, 'bull_time_stop': 30, 'bull_use_sma': True, 'bull_use_ema': True, 'bull_use_atr': True, 'bull_use_adx': True, 'bull_use_spike': True, 'bull_rsi_required': False, 'bear_strategy': 'mean_reversion', 'bear_bb_std_mult': 1.9574938682820064, 'bear_rsi_os': 28, 'bear_rsi_ob': 74, 'bear_adx_thresh': 15.195937344385323, 'bear_atr_min_pct': 0.0031471441817086583, 'bear_atr_max_pct': 0.1128855767534691, 'bear_tp_mult': 2.772080980581805, 'bear_tsl_mult': 0.8821944861948997, 'bear_time_stop': 105, 'bear_use_sma': True, 'bear_use_ema': False, 'bear_use_atr': True, 'bear_use_adx': True, 'bear_use_spike': True, 'bear_rsi_required': True, 'sideways_strategy': 'mean_reversion', 'sideways_bb_std_mult': 3.0568157258031996, 'sideways_rsi_os': 32, 'sideways_rsi_ob': 78, 'sideways_adx_thresh': 9.811001399346392, 'sideways_atr_min_pct': 0.021262328741764668, 'sideways_atr_max_pct': 0.07719257099804405, 'sideways_tp_mult': 2.0845781872351155, 'sideways_tsl_mult': 0.42313039731808727, 'sideways_time_stop': 141, 'sideways_use_sma': True, 'sideways_use_ema': False, 'sideways_use_atr': True, 'sideways_use_adx': True, 'sideways_use_spike': True, 'sideways_rsi_required': True}.
[I 2025-08-30 15:25:45,875] Trial 459 finished with values: [-0.0014477555485730154, 0.005199237726403633] and parameters: {'p_sma': 13, 'p_std': 21, 'p_atr': 12, 'p_adx': 24, 'rsi_period': 11, 'ema1': 26, 'ema2': 35, 'slip_atr_k': 2.962053210143773e-05, 'slip_spread_k': 0.7634367023507241, 'spread_hl_frac': 0.006156843774711838, 'bb_std_mult': 0.5484613245339212, 'rsi_os': 23, 'rsi_ob': 88, 'vol_spike': 0.22308480056066704, 'adx_thresh': 8.283363345853468, 'atr_min_pct': 0.00752204724062147, 'atr_max_pct': 0.11061767495722853, 'tp_mult': 1.570849644651993, 'tsl_mult': 0.31696773596124433, 'strategy': 'breakout', 'time_stop': 148, 'use_sma': False, 'use_atr': False, 'use_adx': True, 'use_ema': False, 'use_spike': False, 'rsi_required': False, 'edge_k': 0.5148887454917572, 'edge_cap': 0.9479761766952582, 'bull_strategy': 'breakout', 'bull_bb_std_mult': 1.6606408348214179, 'bull_rsi_os': 46, 'bull_rsi_ob': 90, 'bull_adx_thresh': 9.351842968774516, 'bull_atr_min_pct': 0.019708041569042534, 'bull_atr_max_pct': 0.09869487923217937, 'bull_tp_mult': 2.632773318503324, 'bull_tsl_mult': 0.8600122959890955, 'bull_time_stop': 30, 'bull_use_sma': True, 'bull_use_ema': True, 'bull_use_atr': True, 'bull_use_adx': True, 'bull_use_spike': True, 'bull_rsi_required': False, 'bear_strategy': 'mean_reversion', 'bear_bb_std_mult': 1.9064772351375305, 'bear_rsi_os': 28, 'bear_rsi_ob': 74, 'bear_adx_thresh': 15.436721300141942, 'bear_atr_min_pct': 0.0031344461298168174, 'bear_atr_max_pct': 0.10495783252490597, 'bear_tp_mult': 2.7739506809472037, 'bear_tsl_mult': 0.8877720927233714, 'bear_time_stop': 102, 'bear_use_sma': True, 'bear_use_ema': False, 'bear_use_atr': True, 'bear_use_adx': True, 'bear_use_spike': True, 'bear_rsi_required': True, 'sideways_strategy': 'mean_reversion', 'sideways_bb_std_mult': 3.0819024984206767, 'sideways_rsi_os': 32, 'sideways_rsi_ob': 78, 'sideways_adx_thresh': 9.383743974239042, 'sideways_atr_min_pct': 0.02012449190655135, 'sideways_atr_max_pct': 0.07411369311029935, 'sideways_tp_mult': 2.0769135742148523, 'sideways_tsl_mult': 0.4213876396674214, 'sideways_time_stop': 131, 'sideways_use_sma': True, 'sideways_use_ema': False, 'sideways_use_atr': True, 'sideways_use_adx': True, 'sideways_use_spike': True, 'sideways_rsi_required': True}.
