[I 2025-08-30 14:45:07,515] Trial 206 finished with values: [-1000000000.0, 1000000000.0] and parameters: {'p_sma': 37, 'p_std': 9, 'p_atr': 15, 'p_adx': 8, 'rsi_period': 19, 'ema1': 16, 'ema2': 34, 'slip_atr_k': 0.08615185172910271, 'slip_spread_k': 0.055564975067549705, 'spread_hl_frac': 0.029434033347361874, 'bb_std_mult': 3.4819318711881455, 'rsi_os': 42, 'rsi_ob': 81, 'vol_spike': 0.11892614076593686, 'adx_thresh': 28.61151691405498, 'atr_min_pct': 0.029255837854604706, 'atr_max_pct': 0.10806033488629552, 'tp_mult': 2.1099251457999473, 'tsl_mult': 0.13302275181798312, 'strategy': 'mean_reversion', 'time_stop': 295, 'use_sma': True, 'use_atr': True, 'use_adx': False, 'use_ema': True, 'use_spike': True, 'rsi_required': True, 'edge_k': 1.8372829108015847, 'edge_cap': 0.7747779306571886, 'bull_strategy': 'mean_reversion', 'bull_bb_std_mult': 0.5005160237542654, 'bull_rsi_os': 43, 'bull_rsi_ob': 80, 'bull_adx_thresh': 23.85880913518249, 'bull_atr_min_pct': 0.025995750377803252, 'bull_atr_max_pct': 0.018820787888085555, 'bull_tp_mult': 2.4412930757779594, 'bull_tsl_mult': 0.31542681546229484, 'bull_time_stop': 114, 'bull_use_sma': False, 'bull_use_ema': False, 'bull_use_atr': False, 'bull_use_adx': True, 'bull_use_spike': False, 'bull_rsi_required': False, 'bear_strategy': 'breakout', 'bear_bb_std_mult': 2.345899742818963, 'bear_rsi_os': 29, 'bear_rsi_ob': 62, 'bear_adx_thresh': 32.22981127643721, 'bear_atr_min_pct': 0.02541926938080996, 'bear_atr_max_pct': 0.14064246992369975, 'bear_tp_mult': 1.8869631107202993, 'bear_tsl_mult': 0.787216263907957, 'bear_time_stop': 201, 'bear_use_sma': False, 'bear_use_ema': True, 'bear_use_atr': False, 'bear_use_adx': False, 'bear_use_spike': False, 'bear_rsi_required': False, 'sideways_strategy': 'breakout', 'sideways_bb_std_mult': 2.140246530290707, 'sideways_rsi_os': 29, 'sideways_rsi_ob': 75, 'sideways_adx_thresh': 26.048325631901665, 'sideways_atr_min_pct': 0.019767470495781904, 'sideways_atr_max_pct': 0.015360072582630457, 'sideways_tp_mult': 2.488450862863424, 'sideways_tsl_mult': 0.17829472275335917, 'sideways_time_stop': 269, 'sideways_use_sma': False, 'sideways_use_ema': True, 'sideways_use_atr': False, 'sideways_use_adx': False, 'sideways_use_spike': False, 'sideways_rsi_required': False}.
[I 2025-08-30 14:45:24,228] Trial 207 finished with values: [-1000000000.0, 1000000000.0] and parameters: {'p_sma': 36, 'p_std': 36, 'p_atr': 15, 'p_adx': 8, 'rsi_period': 75, 'ema1': 16, 'ema2': 34, 'slip_atr_k': 0.09038474870011508, 'slip_spread_k': 0.19815575436555022, 'spread_hl_frac': 0.0016220131371330118, 'bb_std_mult': 3.5948705976986997, 'rsi_os': 10, 'rsi_ob': 81, 'vol_spike': 0.126937978828279, 'adx_thresh': 16.64369853933369, 'atr_min_pct': 0.029015351661901934, 'atr_max_pct': 0.1067139563154218, 'tp_mult': 2.8683243767549778, 'tsl_mult': 0.6603956212440276, 'strategy': 'breakout', 'time_stop': 31, 'use_sma': True, 'use_atr': True, 'use_adx': False, 'use_ema': True, 'use_spike': False, 'rsi_required': True, 'edge_k': 1.9399956338468989, 'edge_cap': 0.6550996896262017, 'bull_strategy': 'mean_reversion', 'bull_bb_std_mult': 0.5566391131004014, 'bull_rsi_os': 45, 'bull_rsi_ob': 78, 'bull_adx_thresh': 24.339985388680272, 'bull_atr_min_pct': 0.026471139242677945, 'bull_atr_max_pct': 0.026011822227457335, 'bull_tp_mult': 1.3298211684616406, 'bull_tsl_mult': 0.32206972615573914, 'bull_time_stop': 131, 'bull_use_sma': False, 'bull_use_ema': False, 'bull_use_atr': False, 'bull_use_adx': True, 'bull_use_spike': False, 'bull_rsi_required': False, 'bear_strategy': 'breakout', 'bear_bb_std_mult': 1.8645010194386216, 'bear_rsi_os': 22, 'bear_rsi_ob': 67, 'bear_adx_thresh': 11.5411578177898, 'bear_atr_min_pct': 0.01921723788569542, 'bear_atr_max_pct': 0.0779207895434707, 'bear_tp_mult': 1.841139002929755, 'bear_tsl_mult': 0.47344446127285106, 'bear_time_stop': 197, 'bear_use_sma': False, 'bear_use_ema': True, 'bear_use_atr': False, 'bear_use_adx': False, 'bear_use_spike': False, 'bear_rsi_required': False, 'sideways_strategy': 'breakout', 'sideways_bb_std_mult': 2.1262211025479023, 'sideways_rsi_os': 47, 'sideways_rsi_ob': 73, 'sideways_adx_thresh': 9.323147499393391, 'sideways_atr_min_pct': 0.02195071708498287, 'sideways_atr_max_pct': 0.015526687683870003, 'sideways_tp_mult': 2.223351461688764, 'sideways_tsl_mult': 0.1867564204003932, 'sideways_time_stop': 177, 'sideways_use_sma': False, 'sideways_use_ema': True, 'sideways_use_atr': False, 'sideways_use_adx': False, 'sideways_use_spike': False, 'sideways_rsi_required': False}.
[I 2025-08-30 14:45:31,789] Trial 209 finished with values: [-1000000000.0, 1000000000.0] and parameters: {'p_sma': 37, 'p_std': 9, 'p_atr': 15, 'p_adx': 8, 'rsi_period': 19, 'ema1': 16, 'ema2': 31, 'slip_atr_k': 0.0898894081385027, 'slip_spread_k': 0.17928311404593333, 'spread_hl_frac': 0.04852171702090097, 'bb_std_mult': 3.488889164608463, 'rsi_os': 32, 'rsi_ob': 81, 'vol_spike': 0.04716798780426014, 'adx_thresh': 28.367505826884585, 'atr_min_pct': 0.028334635059178374, 'atr_max_pct': 0.10939702908451875, 'tp_mult': 2.774587829328183, 'tsl_mult': 0.0922324136924932, 'strategy': 'breakout', 'time_stop': 273, 'use_sma': False, 'use_atr': False, 'use_adx': False, 'use_ema': True, 'use_spike': False, 'rsi_required': True, 'edge_k': 1.8277719378282749, 'edge_cap': 0.7308476952486296, 'bull_strategy': 'mean_reversion', 'bull_bb_std_mult': 0.5033558458488447, 'bull_rsi_os': 45, 'bull_rsi_ob': 80, 'bull_adx_thresh': 24.075060530910008, 'bull_atr_min_pct': 0.022274570165322465, 'bull_atr_max_pct': 0.016332405036102653, 'bull_tp_mult': 1.441006593221185, 'bull_tsl_mult': 0.3305686296380281, 'bull_time_stop': 114, 'bull_use_sma': False, 'bull_use_ema': False, 'bull_use_atr': False, 'bull_use_adx': False, 'bull_use_spike': False, 'bull_rsi_required': False, 'bear_strategy': 'breakout', 'bear_bb_std_mult': 1.0886329086196311, 'bear_rsi_os': 22, 'bear_rsi_ob': 62, 'bear_adx_thresh': 11.393482839659969, 'bear_atr_min_pct': 0.025813679161110388, 'bear_atr_max_pct': 0.09340392281331528, 'bear_tp_mult': 1.9016704560892073, 'bear_tsl_mult': 0.48387723804903815, 'bear_time_stop': 199, 'bear_use_sma': True, 'bear_use_ema': False, 'bear_use_atr': True, 'bear_use_adx': False, 'bear_use_spike': False, 'bear_rsi_required': False, 'sideways_strategy': 'breakout', 'sideways_bb_std_mult': 1.8410093550948028, 'sideways_rsi_os': 28, 'sideways_rsi_ob': 73, 'sideways_adx_thresh': 26.161013487157305, 'sideways_atr_min_pct': 0.028361694788406038, 'sideways_atr_max_pct': 0.016806113891744176, 'sideways_tp_mult': 2.8330022454447334, 'sideways_tsl_mult': 0.1860665222492856, 'sideways_time_stop': 190, 'sideways_use_sma': True, 'sideways_use_ema': True, 'sideways_use_atr': True, 'sideways_use_adx': False, 'sideways_use_spike': False, 'sideways_rsi_required': True}.
[I 2025-08-30 14:45:34,288] Trial 210 finished with values: [-1000000000.0, 1000000000.0] and parameters: {'p_sma': 50, 'p_std': 7, 'p_atr': 16, 'p_adx': 8, 'rsi_period': 74, 'ema1': 28, 'ema2': 42, 'slip_atr_k': 0.08681912175919045, 'slip_spread_k': 0.3091191773958025, 'spread_hl_frac': 0.045970193563778065, 'bb_std_mult': 1.0233202967660653, 'rsi_os': 20, 'rsi_ob': 69, 'vol_spike': 0.2720794226036902, 'adx_thresh': 22.489011062767652, 'atr_min_pct': 0.028376470437140932, 'atr_max_pct': 0.10699722797264687, 'tp_mult': 2.1015916151452756, 'tsl_mult': 0.7334284880103474, 'strategy': 'mean_reversion', 'time_stop': 286, 'use_sma': True, 'use_atr': False, 'use_adx': False, 'use_ema': True, 'use_spike': True, 'rsi_required': True, 'edge_k': 1.8310482797492287, 'edge_cap': 0.7250199001101758, 'bull_strategy': 'mean_reversion', 'bull_bb_std_mult': 0.5046251906787943, 'bull_rsi_os': 45, 'bull_rsi_ob': 80, 'bull_adx_thresh': 28.082134611346987, 'bull_atr_min_pct': 0.006567625301928644, 'bull_atr_max_pct': 0.01768844714682597, 'bull_tp_mult': 1.3278725325335836, 'bull_tsl_mult': 0.753365868108087, 'bull_time_stop': 94, 'bull_use_sma': False, 'bull_use_ema': True, 'bull_use_atr': False, 'bull_use_adx': False, 'bull_use_spike': True, 'bull_rsi_required': False, 'bear_strategy': 'breakout', 'bear_bb_std_mult': 2.0989241927438824, 'bear_rsi_os': 8, 'bear_rsi_ob': 65, 'bear_adx_thresh': 32.1896158698325, 'bear_atr_min_pct': 0.003074851041768606, 'bear_atr_max_pct': 0.09338521930979553, 'bear_tp_mult': 1.2516704348916337, 'bear_tsl_mult': 0.7996800842594811, 'bear_time_stop': 200, 'bear_use_sma': False, 'bear_use_ema': True, 'bear_use_atr': False, 'bear_use_adx': False, 'bear_use_spike': False, 'bear_rsi_required': True, 'sideways_strategy': 'breakout', 'sideways_bb_std_mult': 0.7681267910163512, 'sideways_rsi_os': 29, 'sideways_rsi_ob': 65, 'sideways_adx_thresh': 27.550948996063156, 'sideways_atr_min_pct': 0.02476871418760914, 'sideways_atr_max_pct': 0.10571311367047861, 'sideways_tp_mult': 2.808449001812346, 'sideways_tsl_mult': 0.17759318313175504, 'sideways_time_stop': 190, 'sideways_use_sma': True, 'sideways_use_ema': False, 'sideways_use_atr': False, 'sideways_use_adx': False, 'sideways_use_spike': True, 'sideways_rsi_required': True}.
[I 2025-08-30 14:45:38,377] Trial 211 finished with values: [-1000000000.0, 1000000000.0] and parameters: {'p_sma': 40, 'p_std': 23, 'p_atr': 14, 'p_adx': 8, 'rsi_period': 64, 'ema1': 24, 'ema2': 42, 'slip_atr_k': 0.07554903734749181, 'slip_spread_k': 0.6097113006112375, 'spread_hl_frac': 0.04981489028038898, 'bb_std_mult': 3.541195154266401, 'rsi_os': 15, 'rsi_ob': 69, 'vol_spike': 0.06629564796126147, 'adx_thresh': 25.997713985827065, 'atr_min_pct': 0.028328416399248622, 'atr_max_pct': 0.03602355244400406, 'tp_mult': 2.1761677264057075, 'tsl_mult': 0.723360892884672, 'strategy': 'breakout', 'time_stop': 286, 'use_sma': True, 'use_atr': False, 'use_adx': False, 'use_ema': True, 'use_spike': False, 'rsi_required': True, 'edge_k': 1.755435008424825, 'edge_cap': 0.6520097698536695, 'bull_strategy': 'mean_reversion', 'bull_bb_std_mult': 0.5614365774719008, 'bull_rsi_os': 45, 'bull_rsi_ob': 73, 'bull_adx_thresh': 28.70410932310396, 'bull_atr_min_pct': 0.003911546970001616, 'bull_atr_max_pct': 0.015881181351982077, 'bull_tp_mult': 1.7383101598542772, 'bull_tsl_mult': 0.22498305593288143, 'bull_time_stop': 94, 'bull_use_sma': True, 'bull_use_ema': True, 'bull_use_atr': False, 'bull_use_adx': False, 'bull_use_spike': True, 'bull_rsi_required': False, 'bear_strategy': 'breakout', 'bear_bb_std_mult': 1.8302995584331723, 'bear_rsi_os': 11, 'bear_rsi_ob': 67, 'bear_adx_thresh': 34.332820825441146, 'bear_atr_min_pct': 0.016657837350057592, 'bear_atr_max_pct': 0.06120190378406616, 'bear_tp_mult': 1.1346458001463462, 'bear_tsl_mult': 0.9982201985377701, 'bear_time_stop': 66, 'bear_use_sma': False, 'bear_use_ema': False, 'bear_use_atr': False, 'bear_use_adx': False, 'bear_use_spike': False, 'bear_rsi_required': True, 'sideways_strategy': 'breakout', 'sideways_bb_std_mult': 1.8500483323986374, 'sideways_rsi_os': 16, 'sideways_rsi_ob': 65, 'sideways_adx_thresh': 26.96481620262456, 'sideways_atr_min_pct': 0.027504625528490218, 'sideways_atr_max_pct': 0.018408863301902043, 'sideways_tp_mult': 2.831033406170608, 'sideways_tsl_mult': 0.1161539547668307, 'sideways_time_stop': 177, 'sideways_use_sma': True, 'sideways_use_ema': False, 'sideways_use_atr': True, 'sideways_use_adx': False, 'sideways_use_spike': True, 'sideways_rsi_required': True}.
[I 2025-08-30 14:45:55,393] Trial 212 finished with values: [-1000000000.0, 1000000000.0] and parameters: {'p_sma': 50, 'p_std': 47, 'p_atr': 16, 'p_adx': 19, 'rsi_period': 66, 'ema1': 29, 'ema2': 42, 'slip_atr_k': 0.20167171728252636, 'slip_spread_k': 0.6102126554407592, 'spread_hl_frac': 0.045669857708481844, 'bb_std_mult': 3.5391476646236546, 'rsi_os': 15, 'rsi_ob': 83, 'vol_spike': 0.2722345537072556, 'adx_thresh': 22.293145835204687, 'atr_min_pct': 0.028151151974061456, 'atr_max_pct': 0.03550431429991564, 'tp_mult': 1.6016618354919834, 'tsl_mult': 0.7334131836614515, 'strategy': 'mean_reversion', 'time_stop': 133, 'use_sma': False, 'use_atr': False, 'use_adx': False, 'use_ema': True, 'use_spike': True, 'rsi_required': True, 'edge_k': 1.7459373572250052, 'edge_cap': 0.3335521329402882, 'bull_strategy': 'mean_reversion', 'bull_bb_std_mult': 1.2752483935476406, 'bull_rsi_os': 40, 'bull_rsi_ob': 73, 'bull_adx_thresh': 8.18666525795531, 'bull_atr_min_pct': 0.007612200204024426, 'bull_atr_max_pct': 0.02204982901232885, 'bull_tp_mult': 2.9938081752320165, 'bull_tsl_mult': 0.609686918027903, 'bull_time_stop': 16, 'bull_use_sma': True, 'bull_use_ema': True, 'bull_use_atr': False, 'bull_use_adx': False, 'bull_use_spike': True, 'bull_rsi_required': False, 'bear_strategy': 'breakout', 'bear_bb_std_mult': 1.0484034172387544, 'bear_rsi_os': 18, 'bear_rsi_ob': 64, 'bear_adx_thresh': 34.15383426279362, 'bear_atr_min_pct': 0.012490809107142942, 'bear_atr_max_pct': 0.09337725195075908, 'bear_tp_mult': 2.018258861627179, 'bear_tsl_mult': 0.5597504424539532, 'bear_time_stop': 115, 'bear_use_sma': True, 'bear_use_ema': False, 'bear_use_atr': True, 'bear_use_adx': False, 'bear_use_spike': False, 'bear_rsi_required': True, 'sideways_strategy': 'breakout', 'sideways_bb_std_mult': 1.3315222535580413, 'sideways_rsi_os': 49, 'sideways_rsi_ob': 65, 'sideways_adx_thresh': 31.66063227469062, 'sideways_atr_min_pct': 0.02846127263983323, 'sideways_atr_max_pct': 0.01910275721073634, 'sideways_tp_mult': 1.1475299655886757, 'sideways_tsl_mult': 0.11679401919229478, 'sideways_time_stop': 12, 'sideways_use_sma': True, 'sideways_use_ema': False, 'sideways_use_atr': True, 'sideways_use_adx': False, 'sideways_use_spike': True, 'sideways_rsi_required': True}.
[I 2025-08-30 14:46:04,401] Trial 213 finished with values: [-1000000000.0, 1000000000.0] and parameters: {'p_sma': 40, 'p_std': 58, 'p_atr': 22, 'p_adx': 7, 'rsi_period': 21, 'ema1': 29, 'ema2': 39, 'slip_atr_k': 0.13594193924205544, 'slip_spread_k': 0.8428793501774594, 'spread_hl_frac': 0.04605634437382815, 'bb_std_mult': 3.5310481649102683, 'rsi_os': 15, 'rsi_ob': 69, 'vol_spike': 0.06517486109532224, 'adx_thresh': 17.52281022403853, 'atr_min_pct': 0.027504064643575712, 'atr_max_pct': 0.05214777114535018, 'tp_mult': 2.1691200435539244, 'tsl_mult': 0.09600886702797164, 'strategy': 'mean_reversion', 'time_stop': 286, 'use_sma': True, 'use_atr': False, 'use_adx': False, 'use_ema': True, 'use_spike': True, 'rsi_required': True, 'edge_k': 1.7637562735968122, 'edge_cap': 0.3303374721274053, 'bull_strategy': 'mean_reversion', 'bull_bb_std_mult': 2.573296945235463, 'bull_rsi_os': 40, 'bull_rsi_ob': 56, 'bull_adx_thresh': 5.826109456297122, 'bull_atr_min_pct': 0.008722168804035382, 'bull_atr_max_pct': 0.02301268440465648, 'bull_tp_mult': 1.19602985076797, 'bull_tsl_mult': 0.8842770805143078, 'bull_time_stop': 93, 'bull_use_sma': True, 'bull_use_ema': True, 'bull_use_atr': False, 'bull_use_adx': False, 'bull_use_spike': True, 'bull_rsi_required': False, 'bear_strategy': 'breakout', 'bear_bb_std_mult': 1.6511988649326566, 'bear_rsi_os': 9, 'bear_rsi_ob': 64, 'bear_adx_thresh': 34.256249910038676, 'bear_atr_min_pct': 0.016622186942831876, 'bear_atr_max_pct': 0.06908558603088563, 'bear_tp_mult': 1.1402481772369022, 'bear_tsl_mult': 0.7207924113772248, 'bear_time_stop': 28, 'bear_use_sma': False, 'bear_use_ema': True, 'bear_use_atr': False, 'bear_use_adx': False, 'bear_use_spike': False, 'bear_rsi_required': True, 'sideways_strategy': 'breakout', 'sideways_bb_std_mult': 1.9803744001140748, 'sideways_rsi_os': 15, 'sideways_rsi_ob': 65, 'sideways_adx_thresh': 20.459148732279463, 'sideways_atr_min_pct': 0.02773337911718226, 'sideways_atr_max_pct': 0.10394585535732372, 'sideways_tp_mult': 2.9807675648550687, 'sideways_tsl_mult': 0.24189413961770223, 'sideways_time_stop': 285, 'sideways_use_sma': True, 'sideways_use_ema': False, 'sideways_use_atr': False, 'sideways_use_adx': False, 'sideways_use_spike': True, 'sideways_rsi_required': True}.
[I 2025-08-30 14:46:06,694] Trial 214 finished with values: [-1000000000.0, 1000000000.0] and parameters: {'p_sma': 53, 'p_std': 20, 'p_atr': 22, 'p_adx': 19, 'rsi_period': 65, 'ema1': 8, 'ema2': 53, 'slip_atr_k': 0.07406170296203107, 'slip_spread_k': 0.47431754938398096, 'spread_hl_frac': 0.011908905010479798, 'bb_std_mult': 3.555677594900073, 'rsi_os': 18, 'rsi_ob': 61, 'vol_spike': 0.08062736523407531, 'adx_thresh': 10.407888637737816, 'atr_min_pct': 0.02998028967994257, 'atr_max_pct': 0.03005451790684524, 'tp_mult': 1.6360255305030988, 'tsl_mult': 0.8957782726037349, 'strategy': 'mean_reversion', 'time_stop': 86, 'use_sma': True, 'use_atr': True, 'use_adx': False, 'use_ema': True, 'use_spike': True, 'rsi_required': True, 'edge_k': 1.7218222452801828, 'edge_cap': 0.501018276858355, 'bull_strategy': 'mean_reversion', 'bull_bb_std_mult': 2.580614111167722, 'bull_rsi_os': 40, 'bull_rsi_ob': 70, 'bull_adx_thresh': 18.901020116120097, 'bull_atr_min_pct': 0.0038298727457309533, 'bull_atr_max_pct': 0.023622017075189114, 'bull_tp_mult': 1.2674007088067638, 'bull_tsl_mult': 0.08621483670717883, 'bull_time_stop': 22, 'bull_use_sma': True, 'bull_use_ema': False, 'bull_use_atr': False, 'bull_use_adx': True, 'bull_use_spike': False, 'bull_rsi_required': False, 'bear_strategy': 'breakout', 'bear_bb_std_mult': 0.6181240792127682, 'bear_rsi_os': 18, 'bear_rsi_ob': 65, 'bear_adx_thresh': 33.15072952963434, 'bear_atr_min_pct': 0.012620973133862595, 'bear_atr_max_pct': 0.08171702662349885, 'bear_tp_mult': 2.005697366063107, 'bear_tsl_mult': 0.6736279745246833, 'bear_time_stop': 113, 'bear_use_sma': False, 'bear_use_ema': True, 'bear_use_atr': False, 'bear_use_adx': False, 'bear_use_spike': False, 'bear_rsi_required': False, 'sideways_strategy': 'breakout', 'sideways_bb_std_mult': 1.342640001205969, 'sideways_rsi_os': 15, 'sideways_rsi_ob': 68, 'sideways_adx_thresh': 11.996004649119909, 'sideways_atr_min_pct': 0.02452430538715118, 'sideways_atr_max_pct': 0.01912102161640343, 'sideways_tp_mult': 1.1546804900967482, 'sideways_tsl_mult': 0.11431150721009783, 'sideways_time_stop': 166, 'sideways_use_sma': False, 'sideways_use_ema': True, 'sideways_use_atr': False, 'sideways_use_adx': False, 'sideways_use_spike': False, 'sideways_rsi_required': False}.
[I 2025-08-30 14:46:10,428] Trial 215 finished with values: [-1000000000.0, 1000000000.0] and parameters: {'p_sma': 38, 'p_std': 26, 'p_atr': 16, 'p_adx': 9, 'rsi_period': 15, 'ema1': 9, 'ema2': 31, 'slip_atr_k': 0.09604672891287187, 'slip_spread_k': 0.48186332744215565, 'spread_hl_frac': 0.03487524488354768, 'bb_std_mult': 0.8865460898630968, 'rsi_os': 18, 'rsi_ob': 73, 'vol_spike': 0.08156719438992686, 'adx_thresh': 10.726149898010418, 'atr_min_pct': 0.029398585951519136, 'atr_max_pct': 0.07561067433086878, 'tp_mult': 1.6131427515022512, 'tsl_mult': 0.904918698415109, 'strategy': 'mean_reversion', 'time_stop': 300, 'use_sma': True, 'use_atr': True, 'use_adx': False, 'use_ema': False, 'use_spike': True, 'rsi_required': True, 'edge_k': 1.79869392934026, 'edge_cap': 0.4975906392887413, 'bull_strategy': 'mean_reversion', 'bull_bb_std_mult': 0.597441933474871, 'bull_rsi_os': 41, 'bull_rsi_ob': 56, 'bull_adx_thresh': 19.016296610084282, 'bull_atr_min_pct': 0.010212400678830101, 'bull_atr_max_pct': 0.022232655816461364, 'bull_tp_mult': 1.2669153924615906, 'bull_tsl_mult': 0.35834349186340786, 'bull_time_stop': 89, 'bull_use_sma': False, 'bull_use_ema': False, 'bull_use_atr': False, 'bull_use_adx': True, 'bull_use_spike': False, 'bull_rsi_required': False, 'bear_strategy': 'breakout', 'bear_bb_std_mult': 2.754650413693641, 'bear_rsi_os': 19, 'bear_rsi_ob': 64, 'bear_adx_thresh': 27.842841408731836, 'bear_atr_min_pct': 0.012580956625507036, 'bear_atr_max_pct': 0.08716951220216956, 'bear_tp_mult': 2.0094566565959235, 'bear_tsl_mult': 0.6645114822809464, 'bear_time_stop': 158, 'bear_use_sma': False, 'bear_use_ema': True, 'bear_use_atr': False, 'bear_use_adx': False, 'bear_use_spike': False, 'bear_rsi_required': False, 'sideways_strategy': 'mean_reversion', 'sideways_bb_std_mult': 1.982064349662551, 'sideways_rsi_os': 47, 'sideways_rsi_ob': 68, 'sideways_adx_thresh': 12.058112530651902, 'sideways_atr_min_pct': 0.023440800280965356, 'sideways_atr_max_pct': 0.01307019538617291, 'sideways_tp_mult': 2.8799952154729263, 'sideways_tsl_mult': 0.13318576251712444, 'sideways_time_stop': 53, 'sideways_use_sma': False, 'sideways_use_ema': True, 'sideways_use_atr': False, 'sideways_use_adx': False, 'sideways_use_spike': False, 'sideways_rsi_required': False}.
