[I 2025-08-30 14:22:15,282] Trial 11 finished with values: [-1000000000.0, 1000000000.0] and parameters: {'p_sma': 50, 'p_std': 50, 'p_atr': 13, 'p_adx': 16, 'rsi_period': 82, 'ema1': 15, 'ema2': 55, 'slip_atr_k': 0.23471228829101906, 'slip_spread_k': 0.5809902497292324, 'spread_hl_frac': 0.02491532722956451, 'bb_std_mult': 2.647916850656083, 'rsi_os': 28, 'rsi_ob': 63, 'vol_spike': 0.1255528044736112, 'adx_thresh': 13.966605244863983, 'atr_min_pct': 0.02660032695457283, 'atr_max_pct': 0.14208131957521972, 'tp_mult': 2.9153142277525976, 'tsl_mult': 0.8109487560890157, 'strategy': 'mean_reversion', 'time_stop': 276, 'use_sma': False, 'use_atr': False, 'use_adx': True, 'use_ema': False, 'use_spike': False, 'rsi_required': True, 'edge_k': 1.4276569689974556, 'edge_cap': 0.252772629479492, 'bull_strategy': 'breakout', 'bull_bb_std_mult': 3.3399653221243812, 'bull_rsi_os': 8, 'bull_rsi_ob': 92, 'bull_adx_thresh': 7.792250446199861, 'bull_atr_min_pct': 0.02457759652052075, 'bull_atr_max_pct': 0.08411875149879883, 'bull_tp_mult': 2.6680501919855835, 'bull_tsl_mult': 0.5210512163516021, 'bull_time_stop': 216, 'bull_use_sma': False, 'bull_use_ema': True, 'bull_use_atr': False, 'bull_use_adx': True, 'bull_use_spike': False, 'bull_rsi_required': False, 'bear_strategy': 'mean_reversion', 'bear_bb_std_mult': 2.3029508792213296, 'bear_rsi_os': 52, 'bear_rsi_ob': 82, 'bear_adx_thresh': 29.51951338902739, 'bear_atr_min_pct': 0.023354765536059106, 'bear_atr_max_pct': 0.036741243379197513, 'bear_tp_mult': 1.5689271883513893, 'bear_tsl_mult': 0.05269545278365573, 'bear_time_stop': 14, 'bear_use_sma': True, 'bear_use_ema': False, 'bear_use_atr': True, 'bear_use_adx': False, 'bear_use_spike': True, 'bear_rsi_required': True, 'sideways_strategy': 'breakout', 'sideways_bb_std_mult': 2.468397233071089, 'sideways_rsi_os': 13, 'sideways_rsi_ob': 68, 'sideways_adx_thresh': 11.021309968769884, 'sideways_atr_min_pct': 0.015992607150913773, 'sideways_atr_max_pct': 0.017090461357086893, 'sideways_tp_mult': 1.4169999604399188, 'sideways_tsl_mult': 0.43046482560427435, 'sideways_time_stop': 159, 'sideways_use_sma': False, 'sideways_use_ema': False, 'sideways_use_atr': True, 'sideways_use_adx': False, 'sideways_use_spike': False, 'sideways_rsi_required': True}.
[I 2025-08-30 14:22:15,575] Trial 8 finished with values: [-1000000000.0, 1000000000.0] and parameters: {'p_sma': 13, 'p_std': 15, 'p_atr': 12, 'p_adx': 22, 'rsi_period': 21, 'ema1': 17, 'ema2': 27, 'slip_atr_k': 0.2145629985548197, 'slip_spread_k': 0.9574937871915118, 'spread_hl_frac': 0.03706221967042341, 'bb_std_mult': 1.5812984537571497, 'rsi_os': 10, 'rsi_ob': 70, 'vol_spike': 0.08991273516716584, 'adx_thresh': 24.05521172622148, 'atr_min_pct': 0.029348504951033156, 'atr_max_pct': 0.09724074134576861, 'tp_mult': 2.4011161031113977, 'tsl_mult': 0.6762842417691157, 'strategy': 'mean_reversion', 'time_stop': 160, 'use_sma': False, 'use_atr': True, 'use_adx': True, 'use_ema': True, 'use_spike': True, 'rsi_required': False, 'edge_k': 1.2097520906504584, 'edge_cap': 0.18427885035704694, 'bull_strategy': 'mean_reversion', 'bull_bb_std_mult': 1.6611560099617393, 'bull_rsi_os': 19, 'bull_rsi_ob': 74, 'bull_adx_thresh': 27.226727305086282, 'bull_atr_min_pct': 0.0206876164228433, 'bull_atr_max_pct': 0.13699789088692502, 'bull_tp_mult': 2.60362446700007, 'bull_tsl_mult': 0.30592597877873606, 'bull_time_stop': 6, 'bull_use_sma': False, 'bull_use_ema': True, 'bull_use_atr': False, 'bull_use_adx': True, 'bull_use_spike': False, 'bull_rsi_required': False, 'bear_strategy': 'mean_reversion', 'bear_bb_std_mult': 3.4978924875472, 'bear_rsi_os': 55, 'bear_rsi_ob': 70, 'bear_adx_thresh': 16.62564646667576, 'bear_atr_min_pct': 0.015638741694294054, 'bear_atr_max_pct': 0.08455310422770333, 'bear_tp_mult': 2.3342721299601474, 'bear_tsl_mult': 0.2393815758089498, 'bear_time_stop': 136, 'bear_use_sma': False, 'bear_use_ema': False, 'bear_use_atr': False, 'bear_use_adx': True, 'bear_use_spike': True, 'bear_rsi_required': True, 'sideways_strategy': 'mean_reversion', 'sideways_bb_std_mult': 1.3858429619456216, 'sideways_rsi_os': 32, 'sideways_rsi_ob': 87, 'sideways_adx_thresh': 31.84625535760066, 'sideways_atr_min_pct': 0.010307501701816981, 'sideways_atr_max_pct': 0.04519634597252131, 'sideways_tp_mult': 2.879923397279623, 'sideways_tsl_mult': 0.9499613267867152, 'sideways_time_stop': 69, 'sideways_use_sma': True, 'sideways_use_ema': True, 'sideways_use_atr': True, 'sideways_use_adx': True, 'sideways_use_spike': False, 'sideways_rsi_required': True}.
[I 2025-08-30 14:22:16,501] Trial 9 finished with values: [-1000000000.0, 1000000000.0] and parameters: {'p_sma': 51, 'p_std': 8, 'p_atr': 7, 'p_adx': 25, 'rsi_period': 49, 'ema1': 19, 'ema2': 14, 'slip_atr_k': 0.1690182746309549, 'slip_spread_k': 0.8420709525345783, 'spread_hl_frac': 0.007811583450413124, 'bb_std_mult': 2.2152710328148792, 'rsi_os': 37, 'rsi_ob': 61, 'vol_spike': 0.13838322241222334, 'adx_thresh': 11.617900751854872, 'atr_min_pct': 0.012105806918198788, 'atr_max_pct': 0.10084039860377336, 'tp_mult': 1.2122730362365322, 'tsl_mult': 0.30780620981637963, 'strategy': 'mean_reversion', 'time_stop': 99, 'use_sma': False, 'use_atr': True, 'use_adx': True, 'use_ema': False, 'use_spike': False, 'rsi_required': False, 'edge_k': 0.2573135053604976, 'edge_cap': 0.8905558861899926, 'bull_strategy': 'breakout', 'bull_bb_std_mult': 2.416474938521174, 'bull_rsi_os': 45, 'bull_rsi_ob': 78, 'bull_adx_thresh': 8.643696497813032, 'bull_atr_min_pct': 0.02911232801917015, 'bull_atr_max_pct': 0.03724719721617151, 'bull_tp_mult': 2.7689649170291926, 'bull_tsl_mult': 0.0759000061541435, 'bull_time_stop': 13, 'bull_use_sma': True, 'bull_use_ema': False, 'bull_use_atr': True, 'bull_use_adx': False, 'bull_use_spike': True, 'bull_rsi_required': True, 'bear_strategy': 'breakout', 'bear_bb_std_mult': 2.077399388591236, 'bear_rsi_os': 9, 'bear_rsi_ob': 82, 'bear_adx_thresh': 15.397405548079446, 'bear_atr_min_pct': 0.024872545152913136, 'bear_atr_max_pct': 0.09886815608497997, 'bear_tp_mult': 1.10955846976703, 'bear_tsl_mult': 0.14131563585721763, 'bear_time_stop': 189, 'bear_use_sma': False, 'bear_use_ema': True, 'bear_use_atr': False, 'bear_use_adx': True, 'bear_use_spike': True, 'bear_rsi_required': False, 'sideways_strategy': 'mean_reversion', 'sideways_bb_std_mult': 3.451520564013302, 'sideways_rsi_os': 31, 'sideways_rsi_ob': 65, 'sideways_adx_thresh': 27.714396609901026, 'sideways_atr_min_pct': 0.01913301824511594, 'sideways_atr_max_pct': 0.12280228653720446, 'sideways_tp_mult': 1.4030851506760793, 'sideways_tsl_mult': 0.8903826307878134, 'sideways_time_stop': 93, 'sideways_use_sma': False, 'sideways_use_ema': True, 'sideways_use_atr': False, 'sideways_use_adx': False, 'sideways_use_spike': True, 'sideways_rsi_required': True}.
[I 2025-08-30 14:22:16,925] Trial 12 finished with values: [-0.012477609979879012, 0.012507751356139685] and parameters: {'p_sma': 16, 'p_std': 8, 'p_atr': 11, 'p_adx': 27, 'rsi_period': 17, 'ema1': 5, 'ema2': 59, 'slip_atr_k': 0.05611074185916065, 'slip_spread_k': 0.21847849424983057, 'spread_hl_frac': 0.004457595284116301, 'bb_std_mult': 1.2695947769740292, 'rsi_os': 46, 'rsi_ob': 55, 'vol_spike': 0.25325977242231495, 'adx_thresh': 7.1596741383839415, 'atr_min_pct': 0.029316213424828066, 'atr_max_pct': 0.04555781315773197, 'tp_mult': 2.956155733847196, 'tsl_mult': 0.30103920043090404, 'strategy': 'mean_reversion', 'time_stop': 265, 'use_sma': False, 'use_atr': True, 'use_adx': False, 'use_ema': False, 'use_spike': True, 'rsi_required': False, 'edge_k': 0.2698932592241159, 'edge_cap': 0.9037106783410661, 'bull_strategy': 'breakout', 'bull_bb_std_mult': 1.4486350836221522, 'bull_rsi_os': 20, 'bull_rsi_ob': 85, 'bull_adx_thresh': 29.138039082365484, 'bull_atr_min_pct': 0.00025669695079241994, 'bull_atr_max_pct': 0.13315486810848562, 'bull_tp_mult': 2.7705330508567427, 'bull_tsl_mult': 0.2357273250605465, 'bull_time_stop': 104, 'bull_use_sma': True, 'bull_use_ema': True, 'bull_use_atr': True, 'bull_use_adx': False, 'bull_use_spike': True, 'bull_rsi_required': True, 'bear_strategy': 'mean_reversion', 'bear_bb_std_mult': 3.2273803389335574, 'bear_rsi_os': 30, 'bear_rsi_ob': 80, 'bear_adx_thresh': 13.734938526219079, 'bear_atr_min_pct': 0.02932148973697793, 'bear_atr_max_pct': 0.03863357879191289, 'bear_tp_mult': 1.9084826423649206, 'bear_tsl_mult': 0.6676758741331895, 'bear_time_stop': 72, 'bear_use_sma': False, 'bear_use_ema': True, 'bear_use_atr': False, 'bear_use_adx': False, 'bear_use_spike': True, 'bear_rsi_required': True, 'sideways_strategy': 'breakout', 'sideways_bb_std_mult': 0.610594132111751, 'sideways_rsi_os': 6, 'sideways_rsi_ob': 62, 'sideways_adx_thresh': 25.21621921845047, 'sideways_atr_min_pct': 0.023586234830712698, 'sideways_atr_max_pct': 0.08261662036682045, 'sideways_tp_mult': 1.4005547839387003, 'sideways_tsl_mult': 0.22381885071015062, 'sideways_time_stop': 269, 'sideways_use_sma': False, 'sideways_use_ema': True, 'sideways_use_atr': False, 'sideways_use_adx': False, 'sideways_use_spike': False, 'sideways_rsi_required': True}.
[I 2025-08-30 14:22:17,097] Trial 16 finished with values: [-1000000000.0, 1000000000.0] and parameters: {'p_sma': 17, 'p_std': 33, 'p_atr': 14, 'p_adx': 30, 'rsi_period': 53, 'ema1': 10, 'ema2': 58, 'slip_atr_k': 0.008380020034151878, 'slip_spread_k': 0.0046731307282515955, 'spread_hl_frac': 0.00018289118598631415, 'bb_std_mult': 0.5035427876593571, 'rsi_os': 55, 'rsi_ob': 83, 'vol_spike': 0.2982617683485925, 'adx_thresh': 6.517925148743039, 'atr_min_pct': 0.021463064091596866, 'atr_max_pct': 0.014774284179236749, 'tp_mult': 2.9836971551788336, 'tsl_mult': 0.4239270159432566, 'strategy': 'breakout', 'time_stop': 232, 'use_sma': False, 'use_atr': True, 'use_adx': False, 'use_ema': False, 'use_spike': True, 'rsi_required': False, 'edge_k': 1.9144489231164683, 'edge_cap': 0.46317579214310917, 'bull_strategy': 'breakout', 'bull_bb_std_mult': 1.6343553492228085, 'bull_rsi_os': 26, 'bull_rsi_ob': 84, 'bull_adx_thresh': 33.15147305412632, 'bull_atr_min_pct': 0.00013741030978584203, 'bull_atr_max_pct': 0.11249950694274924, 'bull_tp_mult': 2.368367499012964, 'bull_tsl_mult': 0.3653429953478534, 'bull_time_stop': 101, 'bull_use_sma': True, 'bull_use_ema': True, 'bull_use_atr': True, 'bull_use_adx': False, 'bull_use_spike': False, 'bull_rsi_required': True, 'bear_strategy': 'mean_reversion', 'bear_bb_std_mult': 2.724374265701669, 'bear_rsi_os': 19, 'bear_rsi_ob': 91, 'bear_adx_thresh': 34.45781313691708, 'bear_atr_min_pct': 0.009335330704042279, 'bear_atr_max_pct': 0.014973605895910957, 'bear_tp_mult': 1.8428187340355666, 'bear_tsl_mult': 0.6715138306554066, 'bear_time_stop': 113, 'bear_use_sma': False, 'bear_use_ema': True, 'bear_use_atr': False, 'bear_use_adx': False, 'bear_use_spike': True, 'bear_rsi_required': False, 'sideways_strategy': 'breakout', 'sideways_bb_std_mult': 0.5110395958474536, 'sideways_rsi_os': 6, 'sideways_rsi_ob': 79, 'sideways_adx_thresh': 17.27692388160523, 'sideways_atr_min_pct': 0.029784569712958835, 'sideways_atr_max_pct': 0.066522716984452, 'sideways_tp_mult': 1.022193028982137, 'sideways_tsl_mult': 0.09430590908371445, 'sideways_time_stop': 299, 'sideways_use_sma': False, 'sideways_use_ema': True, 'sideways_use_atr': True, 'sideways_use_adx': False, 'sideways_use_spike': False, 'sideways_rsi_required': True}.
[I 2025-08-30 14:22:46,107] Trial 14 finished with values: [-0.031459457824349224, 0.0314434722430968] and parameters: {'p_sma': 35, 'p_std': 6, 'p_atr': 18, 'p_adx': 7, 'rsi_period': 58, 'ema1': 22, 'ema2': 38, 'slip_atr_k': 0.15794050031756707, 'slip_spread_k': 0.5602111761213614, 'spread_hl_frac': 0.012798849982364642, 'bb_std_mult': 2.617038213496477, 'rsi_os': 14, 'rsi_ob': 88, 'vol_spike': 0.193645425412427, 'adx_thresh': 34.47028725575265, 'atr_min_pct': 0.008208705735775415, 'atr_max_pct': 0.010491325119957637, 'tp_mult': 2.4482006698176235, 'tsl_mult': 0.32845086215903174, 'strategy': 'breakout', 'time_stop': 11, 'use_sma': False, 'use_atr': False, 'use_adx': True, 'use_ema': True, 'use_spike': False, 'rsi_required': False, 'edge_k': 0.010327763118231366, 'edge_cap': 0.35731766401142967, 'bull_strategy': 'mean_reversion', 'bull_bb_std_mult': 0.5756000296065079, 'bull_rsi_os': 27, 'bull_rsi_ob': 83, 'bull_adx_thresh': 34.74623675898981, 'bull_atr_min_pct': 0.0006781898310635692, 'bull_atr_max_pct': 0.024151276570838348, 'bull_tp_mult': 1.028655797986512, 'bull_tsl_mult': 0.7852236117290297, 'bull_time_stop': 21, 'bull_use_sma': False, 'bull_use_ema': False, 'bull_use_atr': False, 'bull_use_adx': False, 'bull_use_spike': False, 'bull_rsi_required': False, 'bear_strategy': 'breakout', 'bear_bb_std_mult': 1.4847430265555706, 'bear_rsi_os': 20, 'bear_rsi_ob': 95, 'bear_adx_thresh': 5.636140276897898, 'bear_atr_min_pct': 0.010021093923430755, 'bear_atr_max_pct': 0.10929063231440549, 'bear_tp_mult': 1.7316504130695476, 'bear_tsl_mult': 0.6877436563727015, 'bear_time_stop': 193, 'bear_use_sma': True, 'bear_use_ema': True, 'bear_use_atr': False, 'bear_use_adx': False, 'bear_use_spike': True, 'bear_rsi_required': False, 'sideways_strategy': 'breakout', 'sideways_bb_std_mult': 3.5854067574498454, 'sideways_rsi_os': 5, 'sideways_rsi_ob': 81, 'sideways_adx_thresh': 17.463613951958767, 'sideways_atr_min_pct': 0.029837465889317457, 'sideways_atr_max_pct': 0.012402528058781507, 'sideways_tp_mult': 2.899835403214343, 'sideways_tsl_mult': 0.677844556160139, 'sideways_time_stop': 205, 'sideways_use_sma': True, 'sideways_use_ema': True, 'sideways_use_atr': True, 'sideways_use_adx': False, 'sideways_use_spike': False, 'sideways_rsi_required': True}.
[I 2025-08-30 14:22:46,945] Trial 13 finished with values: [-0.01392059072688967, 0.01388337893799156] and parameters: {'p_sma': 7, 'p_std': 5, 'p_atr': 7, 'p_adx': 9, 'rsi_period': 62, 'ema1': 11, 'ema2': 36, 'slip_atr_k': 0.15931106925496716, 'slip_spread_k': 0.7056119390927407, 'spread_hl_frac': 0.03298336307862264, 'bb_std_mult': 2.4142029814756016, 'rsi_os': 9, 'rsi_ob': 82, 'vol_spike': 0.19963675702119735, 'adx_thresh': 34.69892496011818, 'atr_min_pct': 0.012528830622286881, 'atr_max_pct': 0.018250922570251262, 'tp_mult': 2.499672867325659, 'tsl_mult': 0.6664647567413476, 'strategy': 'breakout', 'time_stop': 206, 'use_sma': False, 'use_atr': False, 'use_adx': True, 'use_ema': True, 'use_spike': False, 'rsi_required': False, 'edge_k': 1.9709840619946193, 'edge_cap': 0.3492128677769333, 'bull_strategy': 'mean_reversion', 'bull_bb_std_mult': 1.6074912197777391, 'bull_rsi_os': 23, 'bull_rsi_ob': 81, 'bull_adx_thresh': 31.848246919471663, 'bull_atr_min_pct': 9.793413366708525e-05, 'bull_atr_max_pct': 0.12298898892515972, 'bull_tp_mult': 1.1521814826604109, 'bull_tsl_mult': 0.3894005908049206, 'bull_time_stop': 7, 'bull_use_sma': False, 'bull_use_ema': True, 'bull_use_atr': True, 'bull_use_adx': False, 'bull_use_spike': False, 'bull_rsi_required': True, 'bear_strategy': 'breakout', 'bear_bb_std_mult': 1.3752618867821427, 'bear_rsi_os': 20, 'bear_rsi_ob': 90, 'bear_adx_thresh': 33.485562906730024, 'bear_atr_min_pct': 0.010599636499016974, 'bear_atr_max_pct': 0.08981927736427603, 'bear_tp_mult': 1.730562635763698, 'bear_tsl_mult': 0.6867050404538089, 'bear_time_stop': 177, 'bear_use_sma': True, 'bear_use_ema': True, 'bear_use_atr': False, 'bear_use_adx': False, 'bear_use_spike': True, 'bear_rsi_required': False, 'sideways_strategy': 'breakout', 'sideways_bb_std_mult': 3.3084614224309, 'sideways_rsi_os': 6, 'sideways_rsi_ob': 87, 'sideways_adx_thresh': 17.184485482227974, 'sideways_atr_min_pct': 0.02995479730446859, 'sideways_atr_max_pct': 0.04702162826169548, 'sideways_tp_mult': 2.953038591948149, 'sideways_tsl_mult': 0.03017775991508037, 'sideways_time_stop': 46, 'sideways_use_sma': True, 'sideways_use_ema': True, 'sideways_use_atr': True, 'sideways_use_adx': False, 'sideways_use_spike': False, 'sideways_rsi_required': True}.
[I 2025-08-30 14:22:47,248] Trial 18 finished with values: [-1000000000.0, 1000000000.0] and parameters: {'p_sma': 19, 'p_std': 30, 'p_atr': 10, 'p_adx': 27, 'rsi_period': 8, 'ema1': 11, 'ema2': 60, 'slip_atr_k': 0.06078241401552506, 'slip_spread_k': 0.3724771644419308, 'spread_hl_frac': 0.018294853699449578, 'bb_std_mult': 0.7141558879412897, 'rsi_os': 55, 'rsi_ob': 78, 'vol_spike': 0.1985969333546128, 'adx_thresh': 10.587672046273177, 'atr_min_pct': 0.02178903458145304, 'atr_max_pct': 0.04100244174313616, 'tp_mult': 2.667431440545056, 'tsl_mult': 0.5241344203048823, 'strategy': 'mean_reversion', 'time_stop': 237, 'use_sma': True, 'use_atr': True, 'use_adx': False, 'use_ema': False, 'use_spike': True, 'rsi_required': True, 'edge_k': 0.032476090427353776, 'edge_cap': 0.861699925652779, 'bull_strategy': 'breakout', 'bull_bb_std_mult': 1.1312484188345748, 'bull_rsi_os': 33, 'bull_rsi_ob': 61, 'bull_adx_thresh': 23.26917444987314, 'bull_atr_min_pct': 0.007442568658910275, 'bull_atr_max_pct': 0.1047576269022732, 'bull_tp_mult': 2.435052170789069, 'bull_tsl_mult': 0.25995073442530425, 'bull_time_stop': 102, 'bull_use_sma': True, 'bull_use_ema': True, 'bull_use_atr': True, 'bull_use_adx': False, 'bull_use_spike': True, 'bull_rsi_required': True, 'bear_strategy': 'mean_reversion', 'bear_bb_std_mult': 2.859514826357643, 'bear_rsi_os': 41, 'bear_rsi_ob': 80, 'bear_adx_thresh': 17.615933558032197, 'bear_atr_min_pct': 0.0200525522646885, 'bear_atr_max_pct': 0.06301798455852836, 'bear_tp_mult': 2.1062610671240547, 'bear_tsl_mult': 0.7450005949224285, 'bear_time_stop': 85, 'bear_use_sma': False, 'bear_use_ema': True, 'bear_use_atr': False, 'bear_use_adx': False, 'bear_use_spike': True, 'bear_rsi_required': False, 'sideways_strategy': 'breakout', 'sideways_bb_std_mult': 1.6524548137485344, 'sideways_rsi_os': 52, 'sideways_rsi_ob': 91, 'sideways_adx_thresh': 6.643322629895996, 'sideways_atr_min_pct': 0.014088337861185286, 'sideways_atr_max_pct': 0.11460367170483071, 'sideways_tp_mult': 1.6572562690787809, 'sideways_tsl_mult': 0.10882922680956414, 'sideways_time_stop': 286, 'sideways_use_sma': False, 'sideways_use_ema': True, 'sideways_use_atr': False, 'sideways_use_adx': False, 'sideways_use_spike': False, 'sideways_rsi_required': False}.
[I 2025-08-30 14:22:47,537] Trial 15 finished with values: [-0.01211227127143466, 0.012057709792808876] and parameters: {'p_sma': 36, 'p_std': 6, 'p_atr': 17, 'p_adx': 8, 'rsi_period': 56, 'ema1': 12, 'ema2': 38, 'slip_atr_k': 0.08284370869647742, 'slip_spread_k': 0.5837965962059161, 'spread_hl_frac': 0.01863351751029737, 'bb_std_mult': 0.5029581872168898, 'rsi_os': 14, 'rsi_ob': 83, 'vol_spike': 0.1998101148737116, 'adx_thresh': 34.73981450313864, 'atr_min_pct': 0.00011412293193815114, 'atr_max_pct': 0.017171099186188463, 'tp_mult': 2.2601982066824067, 'tsl_mult': 0.02446682499383246, 'strategy': 'breakout', 'time_stop': 227, 'use_sma': False, 'use_atr': False, 'use_adx': False, 'use_ema': True, 'use_spike': False, 'rsi_required': True, 'edge_k': 1.8479206158154429, 'edge_cap': 0.38133133615775516, 'bull_strategy': 'mean_reversion', 'bull_bb_std_mult': 0.5017633073156021, 'bull_rsi_os': 26, 'bull_rsi_ob': 84, 'bull_adx_thresh': 34.91046476304742, 'bull_atr_min_pct': 0.0011122689934664205, 'bull_atr_max_pct': 0.011370529150639408, 'bull_tp_mult': 1.0159862528817665, 'bull_tsl_mult': 0.799586103146423, 'bull_time_stop': 70, 'bull_use_sma': False, 'bull_use_ema': True, 'bull_use_atr': False, 'bull_use_adx': False, 'bull_use_spike': False, 'bull_rsi_required': False, 'bear_strategy': 'breakout', 'bear_bb_std_mult': 1.4649414259737465, 'bear_rsi_os': 20, 'bear_rsi_ob': 94, 'bear_adx_thresh': 34.56504240559033, 'bear_atr_min_pct': 0.009434577209745552, 'bear_atr_max_pct': 0.14965785596635442, 'bear_tp_mult': 1.7359448065432994, 'bear_tsl_mult': 0.7002679891674664, 'bear_time_stop': 177, 'bear_use_sma': True, 'bear_use_ema': True, 'bear_use_atr': False, 'bear_use_adx': False, 'bear_use_spike': True, 'bear_rsi_required': False, 'sideways_strategy': 'breakout', 'sideways_bb_std_mult': 3.473001933644433, 'sideways_rsi_os': 7, 'sideways_rsi_ob': 81, 'sideways_adx_thresh': 5.193303713693201, 'sideways_atr_min_pct': 0.029478852549825366, 'sideways_atr_max_pct': 0.010646339314997423, 'sideways_tp_mult': 2.9752663704589617, 'sideways_tsl_mult': 0.05125660408164656, 'sideways_time_stop': 201, 'sideways_use_sma': True, 'sideways_use_ema': True, 'sideways_use_atr': True, 'sideways_use_adx': False, 'sideways_use_spike': False, 'sideways_rsi_required': False}.
