[I 2025-08-30 15:37:24,516] Trial 512 finished with values: [-1000000000.0, 1000000000.0] and parameters: {'p_sma': 8, 'p_std': 60, 'p_atr': 11, 'p_adx': 19, 'rsi_period': 8, 'ema1': 24, 'ema2': 20, 'slip_atr_k': 0.1561938388604757, 'slip_spread_k': 0.42562955604142616, 'spread_hl_frac': 0.03405059442458994, 'bb_std_mult': 0.5962136877220866, 'rsi_os': 29, 'rsi_ob': 87, 'vol_spike': 0.2264791537452822, 'adx_thresh': 8.596931764542669, 'atr_min_pct': 0.0058360062120601935, 'atr_max_pct': 0.11219292961689242, 'tp_mult': 1.5442916123570054, 'tsl_mult': 0.38296619074281635, 'strategy': 'breakout', 'time_stop': 201, 'use_sma': True, 'use_atr': False, 'use_adx': False, 'use_ema': False, 'use_spike': False, 'rsi_required': False, 'edge_k': 0.5601450647196232, 'edge_cap': 0.9740918899658475, 'bull_strategy': 'mean_reversion', 'bull_bb_std_mult': 1.5084756263304082, 'bull_rsi_os': 51, 'bull_rsi_ob': 86, 'bull_adx_thresh': 5.020339742006163, 'bull_atr_min_pct': 0.019373241088786203, 'bull_atr_max_pct': 0.1073834248946346, 'bull_tp_mult': 2.009835936478539, 'bull_tsl_mult': 0.1682499499229233, 'bull_time_stop': 285, 'bull_use_sma': True, 'bull_use_ema': True, 'bull_use_atr': False, 'bull_use_adx': True, 'bull_use_spike': False, 'bull_rsi_required': True, 'bear_strategy': 'breakout', 'bear_bb_std_mult': 1.907533354070205, 'bear_rsi_os': 43, 'bear_rsi_ob': 53, 'bear_adx_thresh': 21.45490650168875, 'bear_atr_min_pct': 0.002085114771152496, 'bear_atr_max_pct': 0.11261787320950781, 'bear_tp_mult': 2.588468237821041, 'bear_tsl_mult': 0.8344129660523167, 'bear_time_stop': 78, 'bear_use_sma': False, 'bear_use_ema': False, 'bear_use_atr': True, 'bear_use_adx': True, 'bear_use_spike': False, 'bear_rsi_required': False, 'sideways_strategy': 'mean_reversion', 'sideways_bb_std_mult': 3.2381580849188545, 'sideways_rsi_os': 19, 'sideways_rsi_ob': 76, 'sideways_adx_thresh': 31.576980683945933, 'sideways_atr_min_pct': 0.02005793156004156, 'sideways_atr_max_pct': 0.0672536138528625, 'sideways_tp_mult': 1.4271867121837296, 'sideways_tsl_mult': 0.43887659481625235, 'sideways_time_stop': 207, 'sideways_use_sma': True, 'sideways_use_ema': False, 'sideways_use_atr': True, 'sideways_use_adx': True, 'sideways_use_spike': False, 'sideways_rsi_required': True}.
[I 2025-08-30 15:37:25,650] Trial 511 finished with values: [-1000000000.0, 1000000000.0] and parameters: {'p_sma': 6, 'p_std': 19, 'p_atr': 11, 'p_adx': 25, 'rsi_period': 11, 'ema1': 24, 'ema2': 37, 'slip_atr_k': 0.005582609312763949, 'slip_spread_k': 0.7289409650669004, 'spread_hl_frac': 0.009055105157956642, 'bb_std_mult': 0.6012540755604041, 'rsi_os': 30, 'rsi_ob': 88, 'vol_spike': 0.2176956926173269, 'adx_thresh': 9.764822409081717, 'atr_min_pct': 0.006363140928315444, 'atr_max_pct': 0.015582615984844214, 'tp_mult': 1.554855744153689, 'tsl_mult': 0.39696409414683087, 'strategy': 'breakout', 'time_stop': 204, 'use_sma': True, 'use_atr': False, 'use_adx': False, 'use_ema': False, 'use_spike': False, 'rsi_required': False, 'edge_k': 0.5660786611770224, 'edge_cap': 0.928712909749803, 'bull_strategy': 'breakout', 'bull_bb_std_mult': 1.582374533452893, 'bull_rsi_os': 9, 'bull_rsi_ob': 86, 'bull_adx_thresh': 9.651417736290764, 'bull_atr_min_pct': 0.020713563085976102, 'bull_atr_max_pct': 0.10551303165954784, 'bull_tp_mult': 2.546373069364689, 'bull_tsl_mult': 0.5328916129708052, 'bull_time_stop': 248, 'bull_use_sma': True, 'bull_use_ema': True, 'bull_use_atr': True, 'bull_use_adx': True, 'bull_use_spike': True, 'bull_rsi_required': False, 'bear_strategy': 'mean_reversion', 'bear_bb_std_mult': 1.7978564545298583, 'bear_rsi_os': 24, 'bear_rsi_ob': 50, 'bear_adx_thresh': 14.582977236862817, 'bear_atr_min_pct': 0.0021346210491385476, 'bear_atr_max_pct': 0.11215782755352242, 'bear_tp_mult': 2.5964228726712077, 'bear_tsl_mult': 0.8430923953311452, 'bear_time_stop': 78, 'bear_use_sma': True, 'bear_use_ema': False, 'bear_use_atr': True, 'bear_use_adx': True, 'bear_use_spike': True, 'bear_rsi_required': True, 'sideways_strategy': 'mean_reversion', 'sideways_bb_std_mult': 3.210130181213081, 'sideways_rsi_os': 5, 'sideways_rsi_ob': 80, 'sideways_adx_thresh': 15.605985180535296, 'sideways_atr_min_pct': 0.020096097028471368, 'sideways_atr_max_pct': 0.06891564940885946, 'sideways_tp_mult': 1.778737911539587, 'sideways_tsl_mult': 0.44897558026657364, 'sideways_time_stop': 140, 'sideways_use_sma': True, 'sideways_use_ema': False, 'sideways_use_atr': True, 'sideways_use_adx': True, 'sideways_use_spike': True, 'sideways_rsi_required': True}.
[I 2025-08-30 15:38:09,826] Trial 515 finished with values: [-1000000000.0, 1000000000.0] and parameters: {'p_sma': 8, 'p_std': 17, 'p_atr': 13, 'p_adx': 24, 'rsi_period': 14, 'ema1': 22, 'ema2': 37, 'slip_atr_k': 0.10277240536906931, 'slip_spread_k': 0.725347212990503, 'spread_hl_frac': 0.014173223633979324, 'bb_std_mult': 0.7458565045153858, 'rsi_os': 26, 'rsi_ob': 87, 'vol_spike': 0.20822793359879938, 'adx_thresh': 8.62017665750607, 'atr_min_pct': 0.01312695697412948, 'atr_max_pct': 0.11261178247892618, 'tp_mult': 1.4596655637561453, 'tsl_mult': 0.3713756506508442, 'strategy': 'breakout', 'time_stop': 155, 'use_sma': True, 'use_atr': False, 'use_adx': False, 'use_ema': False, 'use_spike': False, 'rsi_required': False, 'edge_k': 0.7900724124187462, 'edge_cap': 0.1370333989818412, 'bull_strategy': 'breakout', 'bull_bb_std_mult': 1.5910285408969351, 'bull_rsi_os': 51, 'bull_rsi_ob': 88, 'bull_adx_thresh': 10.820011933872824, 'bull_atr_min_pct': 0.019191173183433562, 'bull_atr_max_pct': 0.10051434257834577, 'bull_tp_mult': 2.5478534043124164, 'bull_tsl_mult': 0.876232120887864, 'bull_time_stop': 71, 'bull_use_sma': True, 'bull_use_ema': True, 'bull_use_atr': True, 'bull_use_adx': True, 'bull_use_spike': True, 'bull_rsi_required': False, 'bear_strategy': 'mean_reversion', 'bear_bb_std_mult': 1.93462243462401, 'bear_rsi_os': 14, 'bear_rsi_ob': 47, 'bear_adx_thresh': 13.875763234516047, 'bear_atr_min_pct': 0.002012168653073415, 'bear_atr_max_pct': 0.032483252478699653, 'bear_tp_mult': 2.6121763517657, 'bear_tsl_mult': 0.7970724712794707, 'bear_time_stop': 84, 'bear_use_sma': True, 'bear_use_ema': False, 'bear_use_atr': True, 'bear_use_adx': True, 'bear_use_spike': True, 'bear_rsi_required': True, 'sideways_strategy': 'mean_reversion', 'sideways_bb_std_mult': 2.5401303584413446, 'sideways_rsi_os': 6, 'sideways_rsi_ob': 81, 'sideways_adx_thresh': 31.301145545886918, 'sideways_atr_min_pct': 0.020305075510842024, 'sideways_atr_max_pct': 0.06828962239758941, 'sideways_tp_mult': 1.0182591380815014, 'sideways_tsl_mult': 0.45533102194419556, 'sideways_time_stop': 136, 'sideways_use_sma': True, 'sideways_use_ema': False, 'sideways_use_atr': True, 'sideways_use_adx': False, 'sideways_use_spike': True, 'sideways_rsi_required': True}.
[I 2025-08-30 15:38:11,255] Trial 516 finished with values: [-1000000000.0, 1000000000.0] and parameters: {'p_sma': 9, 'p_std': 16, 'p_atr': 13, 'p_adx': 24, 'rsi_period': 8, 'ema1': 22, 'ema2': 42, 'slip_atr_k': 0.005248840852755036, 'slip_spread_k': 0.7247127719360432, 'spread_hl_frac': 0.007152328264128292, 'bb_std_mult': 0.5832883798586177, 'rsi_os': 30, 'rsi_ob': 95, 'vol_spike': 0.20857952858551632, 'adx_thresh': 9.567073150723314, 'atr_min_pct': 0.01794875006765841, 'atr_max_pct': 0.11201792329781116, 'tp_mult': 1.4646692541329291, 'tsl_mult': 0.3418360163559449, 'strategy': 'mean_reversion', 'time_stop': 161, 'use_sma': False, 'use_atr': False, 'use_adx': True, 'use_ema': False, 'use_spike': False, 'rsi_required': False, 'edge_k': 0.5396956959190102, 'edge_cap': 0.95867309533344, 'bull_strategy': 'breakout', 'bull_bb_std_mult': 3.267709735818576, 'bull_rsi_os': 48, 'bull_rsi_ob': 88, 'bull_adx_thresh': 9.270592591913694, 'bull_atr_min_pct': 0.021007305641994718, 'bull_atr_max_pct': 0.10080973863871616, 'bull_tp_mult': 2.5472726123870904, 'bull_tsl_mult': 0.16816320448775246, 'bull_time_stop': 48, 'bull_use_sma': True, 'bull_use_ema': True, 'bull_use_atr': True, 'bull_use_adx': True, 'bull_use_spike': True, 'bull_rsi_required': False, 'bear_strategy': 'mean_reversion', 'bear_bb_std_mult': 1.9217094784880067, 'bear_rsi_os': 23, 'bear_rsi_ob': 74, 'bear_adx_thresh': 15.971488037301219, 'bear_atr_min_pct': 0.01830021514544527, 'bear_atr_max_pct': 0.11191036724869333, 'bear_tp_mult': 1.047558517194994, 'bear_tsl_mult': 0.8002458864508708, 'bear_time_stop': 81, 'bear_use_sma': True, 'bear_use_ema': False, 'bear_use_atr': True, 'bear_use_adx': True, 'bear_use_spike': True, 'bear_rsi_required': True, 'sideways_strategy': 'mean_reversion', 'sideways_bb_std_mult': 2.7878051036435068, 'sideways_rsi_os': 22, 'sideways_rsi_ob': 78, 'sideways_adx_thresh': 29.482091643228976, 'sideways_atr_min_pct': 0.019442277279064467, 'sideways_atr_max_pct': 0.06826792458345414, 'sideways_tp_mult': 1.0821122794544062, 'sideways_tsl_mult': 0.3929871170903139, 'sideways_time_stop': 207, 'sideways_use_sma': True, 'sideways_use_ema': False, 'sideways_use_atr': True, 'sideways_use_adx': False, 'sideways_use_spike': True, 'sideways_rsi_required': True}.
[I 2025-08-30 15:38:12,763] Trial 517 finished with values: [-1000000000.0, 1000000000.0] and parameters: {'p_sma': 7, 'p_std': 19, 'p_atr': 13, 'p_adx': 14, 'rsi_period': 14, 'ema1': 23, 'ema2': 37, 'slip_atr_k': 0.166484068201169, 'slip_spread_k': 0.71655197398305, 'spread_hl_frac': 0.007293499510488154, 'bb_std_mult': 0.5635060921214364, 'rsi_os': 26, 'rsi_ob': 86, 'vol_spike': 0.20875529659994754, 'adx_thresh': 9.482262928480093, 'atr_min_pct': 0.01824381720725279, 'atr_max_pct': 0.1173142698629428, 'tp_mult': 1.4568600558666545, 'tsl_mult': 0.36320085084910736, 'strategy': 'mean_reversion', 'time_stop': 75, 'use_sma': False, 'use_atr': False, 'use_adx': True, 'use_ema': False, 'use_spike': False, 'rsi_required': False, 'edge_k': 0.09677552237033549, 'edge_cap': 0.9509554565297664, 'bull_strategy': 'breakout', 'bull_bb_std_mult': 3.196526695100485, 'bull_rsi_os': 49, 'bull_rsi_ob': 88, 'bull_adx_thresh': 27.70374166260882, 'bull_atr_min_pct': 0.019956337908779636, 'bull_atr_max_pct': 0.09951127017965726, 'bull_tp_mult': 1.7024784565112312, 'bull_tsl_mult': 0.4077035660005437, 'bull_time_stop': 251, 'bull_use_sma': True, 'bull_use_ema': True, 'bull_use_atr': True, 'bull_use_adx': True, 'bull_use_spike': True, 'bull_rsi_required': False, 'bear_strategy': 'mean_reversion', 'bear_bb_std_mult': 1.729701601075354, 'bear_rsi_os': 14, 'bear_rsi_ob': 92, 'bear_adx_thresh': 16.190260571172615, 'bear_atr_min_pct': 0.014367459926601697, 'bear_atr_max_pct': 0.04805481442369452, 'bear_tp_mult': 2.630075083562769, 'bear_tsl_mult': 0.9258584261926774, 'bear_time_stop': 226, 'bear_use_sma': True, 'bear_use_ema': False, 'bear_use_atr': True, 'bear_use_adx': True, 'bear_use_spike': True, 'bear_rsi_required': True, 'sideways_strategy': 'mean_reversion', 'sideways_bb_std_mult': 3.2526592043734626, 'sideways_rsi_os': 7, 'sideways_rsi_ob': 81, 'sideways_adx_thresh': 29.643368849183, 'sideways_atr_min_pct': 0.018404717909388486, 'sideways_atr_max_pct': 0.0701268787902271, 'sideways_tp_mult': 1.9052028749404557, 'sideways_tsl_mult': 0.3931195684357558, 'sideways_time_stop': 136, 'sideways_use_sma': True, 'sideways_use_ema': False, 'sideways_use_atr': True, 'sideways_use_adx': False, 'sideways_use_spike': True, 'sideways_rsi_required': True}.
[I 2025-08-30 15:38:13,572] Trial 518 finished with values: [-1000000000.0, 1000000000.0] and parameters: {'p_sma': 7, 'p_std': 22, 'p_atr': 22, 'p_adx': 14, 'rsi_period': 13, 'ema1': 5, 'ema2': 38, 'slip_atr_k': 0.2064271894717736, 'slip_spread_k': 0.7112232481662772, 'spread_hl_frac': 0.007342341833097845, 'bb_std_mult': 0.70774476920144, 'rsi_os': 33, 'rsi_ob': 86, 'vol_spike': 0.208070011879839, 'adx_thresh': 9.583878570254594, 'atr_min_pct': 0.005475262581715741, 'atr_max_pct': 0.11491957632127876, 'tp_mult': 1.4554901054580114, 'tsl_mult': 0.36576346641375357, 'strategy': 'mean_reversion', 'time_stop': 161, 'use_sma': False, 'use_atr': False, 'use_adx': True, 'use_ema': False, 'use_spike': True, 'rsi_required': False, 'edge_k': 1.6383416151089947, 'edge_cap': 0.9487819998242817, 'bull_strategy': 'breakout', 'bull_bb_std_mult': 1.71416623899844, 'bull_rsi_os': 48, 'bull_rsi_ob': 88, 'bull_adx_thresh': 10.870800693314624, 'bull_atr_min_pct': 0.021103657172980562, 'bull_atr_max_pct': 0.09948688196043005, 'bull_tp_mult': 1.6794312727182505, 'bull_tsl_mult': 0.6457138279861284, 'bull_time_stop': 62, 'bull_use_sma': True, 'bull_use_ema': False, 'bull_use_atr': True, 'bull_use_adx': True, 'bull_use_spike': True, 'bull_rsi_required': False, 'bear_strategy': 'mean_reversion', 'bear_bb_std_mult': 1.9365677300607254, 'bear_rsi_os': 49, 'bear_rsi_ob': 74, 'bear_adx_thresh': 18.53060633115353, 'bear_atr_min_pct': 0.018350656811598132, 'bear_atr_max_pct': 0.04848587231950187, 'bear_tp_mult': 2.6471119318861875, 'bear_tsl_mult': 0.8136592454877023, 'bear_time_stop': 98, 'bear_use_sma': True, 'bear_use_ema': True, 'bear_use_atr': True, 'bear_use_adx': True, 'bear_use_spike': True, 'bear_rsi_required': True, 'sideways_strategy': 'breakout', 'sideways_bb_std_mult': 3.0724728251098026, 'sideways_rsi_os': 22, 'sideways_rsi_ob': 87, 'sideways_adx_thresh': 10.171878233601406, 'sideways_atr_min_pct': 0.019443453342443927, 'sideways_atr_max_pct': 0.06882655876932912, 'sideways_tp_mult': 1.934023372920684, 'sideways_tsl_mult': 0.38705690336372034, 'sideways_time_stop': 273, 'sideways_use_sma': False, 'sideways_use_ema': True, 'sideways_use_atr': True, 'sideways_use_adx': False, 'sideways_use_spike': True, 'sideways_rsi_required': True}.
[I 2025-08-30 15:38:59,303] Trial 520 finished with values: [-1000000000.0, 1000000000.0] and parameters: {'p_sma': 10, 'p_std': 50, 'p_atr': 12, 'p_adx': 12, 'rsi_period': 66, 'ema1': 23, 'ema2': 38, 'slip_atr_k': 0.20612442553258126, 'slip_spread_k': 0.6777151094613969, 'spread_hl_frac': 0.007663465686938905, 'bb_std_mult': 0.7061820090036097, 'rsi_os': 26, 'rsi_ob': 86, 'vol_spike': 0.0001893381405839445, 'adx_thresh': 34.09921543250228, 'atr_min_pct': 0.006594341667084077, 'atr_max_pct': 0.1171534015013556, 'tp_mult': 1.4937380740782005, 'tsl_mult': 0.3635424705410502, 'strategy': 'mean_reversion', 'time_stop': 168, 'use_sma': False, 'use_atr': True, 'use_adx': True, 'use_ema': True, 'use_spike': True, 'rsi_required': True, 'edge_k': 0.6000096279493469, 'edge_cap': 0.17509963973395698, 'bull_strategy': 'breakout', 'bull_bb_std_mult': 1.3062001431290233, 'bull_rsi_os': 49, 'bull_rsi_ob': 88, 'bull_adx_thresh': 8.66306100945733, 'bull_atr_min_pct': 0.02002964855781558, 'bull_atr_max_pct': 0.09890463232035551, 'bull_tp_mult': 2.5972040227952533, 'bull_tsl_mult': 0.9023505070310344, 'bull_time_stop': 61, 'bull_use_sma': False, 'bull_use_ema': False, 'bull_use_atr': True, 'bull_use_adx': True, 'bull_use_spike': True, 'bull_rsi_required': False, 'bear_strategy': 'mean_reversion', 'bear_bb_std_mult': 1.7198713533056873, 'bear_rsi_os': 26, 'bear_rsi_ob': 76, 'bear_adx_thresh': 26.741108156967222, 'bear_atr_min_pct': 0.014444216685117353, 'bear_atr_max_pct': 0.04108803487959019, 'bear_tp_mult': 2.647349370450791, 'bear_tsl_mult': 0.9295973334839529, 'bear_time_stop': 228, 'bear_use_sma': True, 'bear_use_ema': True, 'bear_use_atr': False, 'bear_use_adx': False, 'bear_use_spike': True, 'bear_rsi_required': True, 'sideways_strategy': 'breakout', 'sideways_bb_std_mult': 3.0619327423661455, 'sideways_rsi_os': 16, 'sideways_rsi_ob': 78, 'sideways_adx_thresh': 34.95541520179067, 'sideways_atr_min_pct': 0.018328668552758262, 'sideways_atr_max_pct': 0.11113197347929155, 'sideways_tp_mult': 1.9275133938371787, 'sideways_tsl_mult': 0.5848189527220898, 'sideways_time_stop': 46, 'sideways_use_sma': False, 'sideways_use_ema': True, 'sideways_use_atr': True, 'sideways_use_adx': True, 'sideways_use_spike': True, 'sideways_rsi_required': False}.
[I 2025-08-30 15:39:00,777] Trial 522 finished with values: [-1000000000.0, 1000000000.0] and parameters: {'p_sma': 10, 'p_std': 24, 'p_atr': 25, 'p_adx': 24, 'rsi_period': 9, 'ema1': 18, 'ema2': 40, 'slip_atr_k': 0.007532121102053458, 'slip_spread_k': 0.6847125242948563, 'spread_hl_frac': 0.026538301433082313, 'bb_std_mult': 1.942673775586888, 'rsi_os': 28, 'rsi_ob': 89, 'vol_spike': 0.05083801956217329, 'adx_thresh': 10.464387618062762, 'atr_min_pct': 0.006532251363145969, 'atr_max_pct': 0.1072276042947655, 'tp_mult': 1.5123494070328738, 'tsl_mult': 0.01657568323741343, 'strategy': 'breakout', 'time_stop': 102, 'use_sma': False, 'use_atr': True, 'use_adx': True, 'use_ema': True, 'use_spike': False, 'rsi_required': True, 'edge_k': 1.0179109792528847, 'edge_cap': 0.9812523119109511, 'bull_strategy': 'breakout', 'bull_bb_std_mult': 1.127946023473955, 'bull_rsi_os': 49, 'bull_rsi_ob': 89, 'bull_adx_thresh': 8.6634868169036, 'bull_atr_min_pct': 0.020077218574947046, 'bull_atr_max_pct': 0.1037751941893741, 'bull_tp_mult': 2.6019750110646727, 'bull_tsl_mult': 0.9022103250116242, 'bull_time_stop': 206, 'bull_use_sma': False, 'bull_use_ema': False, 'bull_use_atr': True, 'bull_use_adx': True, 'bull_use_spike': True, 'bull_rsi_required': False, 'bear_strategy': 'mean_reversion', 'bear_bb_std_mult': 1.8393822933585111, 'bear_rsi_os': 26, 'bear_rsi_ob': 76, 'bear_adx_thresh': 26.357277775018172, 'bear_atr_min_pct': 0.0029694689962811178, 'bear_atr_max_pct': 0.10361512375394122, 'bear_tp_mult': 1.3479839752956995, 'bear_tsl_mult': 0.04138099146395091, 'bear_time_stop': 193, 'bear_use_sma': True, 'bear_use_ema': True, 'bear_use_atr': False, 'bear_use_adx': False, 'bear_use_spike': True, 'bear_rsi_required': True, 'sideways_strategy': 'breakout', 'sideways_bb_std_mult': 1.7373096728982556, 'sideways_rsi_os': 10, 'sideways_rsi_ob': 77, 'sideways_adx_thresh': 11.143737268507703, 'sideways_atr_min_pct': 0.018362800790926528, 'sideways_atr_max_pct': 0.05960849535548249, 'sideways_tp_mult': 1.638356674409349, 'sideways_tsl_mult': 0.00013360461697720094, 'sideways_time_stop': 128, 'sideways_use_sma': False, 'sideways_use_ema': True, 'sideways_use_atr': False, 'sideways_use_adx': True, 'sideways_use_spike': True, 'sideways_rsi_required': False}.
[I 2025-08-30 15:39:02,296] Trial 519 finished with values: [-1000000000.0, 1000000000.0] and parameters: {'p_sma': 10, 'p_std': 22, 'p_atr': 29, 'p_adx': 14, 'rsi_period': 62, 'ema1': 23, 'ema2': 38, 'slip_atr_k': 0.007544608789403072, 'slip_spread_k': 0.04924159739580525, 'spread_hl_frac': 0.007473366059666495, 'bb_std_mult': 0.7073849942551851, 'rsi_os': 26, 'rsi_ob': 86, 'vol_spike': 0.21249188116561557, 'adx_thresh': 34.398841881882724, 'atr_min_pct': 0.006616543300515869, 'atr_max_pct': 0.11601294803135127, 'tp_mult': 1.5069080636846073, 'tsl_mult': 0.3694693550040276, 'strategy': 'mean_reversion', 'time_stop': 170, 'use_sma': False, 'use_atr': True, 'use_adx': True, 'use_ema': True, 'use_spike': True, 'rsi_required': True, 'edge_k': 0.08301846213416475, 'edge_cap': 0.17356808390844214, 'bull_strategy': 'breakout', 'bull_bb_std_mult': 1.4160711826686208, 'bull_rsi_os': 49, 'bull_rsi_ob': 88, 'bull_adx_thresh': 16.91168677875833, 'bull_atr_min_pct': 0.020113937947996853, 'bull_atr_max_pct': 0.09866589494898617, 'bull_tp_mult': 1.712196583516786, 'bull_tsl_mult': 0.02762547302008722, 'bull_time_stop': 206, 'bull_use_sma': False, 'bull_use_ema': False, 'bull_use_atr': True, 'bull_use_adx': True, 'bull_use_spike': True, 'bull_rsi_required': False, 'bear_strategy': 'mean_reversion', 'bear_bb_std_mult': 1.7150086144805483, 'bear_rsi_os': 26, 'bear_rsi_ob': 55, 'bear_adx_thresh': 26.184109045893813, 'bear_atr_min_pct': 0.0030336102209528384, 'bear_atr_max_pct': 0.10312124485406285, 'bear_tp_mult': 2.6609518636518628, 'bear_tsl_mult': 0.8796804655902876, 'bear_time_stop': 194, 'bear_use_sma': True, 'bear_use_ema': True, 'bear_use_atr': False, 'bear_use_adx': False, 'bear_use_spike': True, 'bear_rsi_required': True, 'sideways_strategy': 'breakout', 'sideways_bb_std_mult': 2.3943780843095235, 'sideways_rsi_os': 16, 'sideways_rsi_ob': 78, 'sideways_adx_thresh': 11.02478569365964, 'sideways_atr_min_pct': 0.00538406060543428, 'sideways_atr_max_pct': 0.05891890268676349, 'sideways_tp_mult': 1.2306333555777562, 'sideways_tsl_mult': 0.411689020724257, 'sideways_time_stop': 273, 'sideways_use_sma': False, 'sideways_use_ema': True, 'sideways_use_atr': True, 'sideways_use_adx': True, 'sideways_use_spike': True, 'sideways_rsi_required': False}.
