[I 2025-08-30 14:58:26,242] Trial 308 finished with values: [-1000000000.0, 1000000000.0] and parameters: {'p_sma': 13, 'p_std': 36, 'p_atr': 17, 'p_adx': 30, 'rsi_period': 51, 'ema1': 9, 'ema2': 50, 'slip_atr_k': 0.01588735577346903, 'slip_spread_k': 0.3340078467354067, 'spread_hl_frac': 0.0002548833124426213, 'bb_std_mult': 2.9336060527395866, 'rsi_os': 6, 'rsi_ob': 89, 'vol_spike': 0.26181499996955004, 'adx_thresh': 12.913296130715956, 'atr_min_pct': 0.0062012106948825035, 'atr_max_pct': 0.09425865458935379, 'tp_mult': 2.5159413168424476, 'tsl_mult': 0.4534545935323825, 'strategy': 'breakout', 'time_stop': 273, 'use_sma': False, 'use_atr': False, 'use_adx': True, 'use_ema': False, 'use_spike': False, 'rsi_required': False, 'edge_k': 0.2211453959895318, 'edge_cap': 0.7784779042820973, 'bull_strategy': 'breakout', 'bull_bb_std_mult': 2.4951001671277964, 'bull_rsi_os': 53, 'bull_rsi_ob': 61, 'bull_adx_thresh': 25.87933218570704, 'bull_atr_min_pct': 0.0013374354853380736, 'bull_atr_max_pct': 0.08617492684923787, 'bull_tp_mult': 1.0764301555667481, 'bull_tsl_mult': 0.9964633962073445, 'bull_time_stop': 132, 'bull_use_sma': True, 'bull_use_ema': True, 'bull_use_atr': True, 'bull_use_adx': False, 'bull_use_spike': True, 'bull_rsi_required': False, 'bear_strategy': 'mean_reversion', 'bear_bb_std_mult': 3.1006602521639333, 'bear_rsi_os': 26, 'bear_rsi_ob': 81, 'bear_adx_thresh': 5.071573713275073, 'bear_atr_min_pct': 0.02916700734290316, 'bear_atr_max_pct': 0.017384208532521053, 'bear_tp_mult': 2.9554813408155622, 'bear_tsl_mult': 0.6176274971963374, 'bear_time_stop': 241, 'bear_use_sma': True, 'bear_use_ema': False, 'bear_use_atr': True, 'bear_use_adx': True, 'bear_use_spike': True, 'bear_rsi_required': True, 'sideways_strategy': 'mean_reversion', 'sideways_bb_std_mult': 1.1832264508516237, 'sideways_rsi_os': 38, 'sideways_rsi_ob': 58, 'sideways_adx_thresh': 19.081745636281994, 'sideways_atr_min_pct': 0.02401006426480399, 'sideways_atr_max_pct': 0.09539460855218923, 'sideways_tp_mult': 2.4324488090027367, 'sideways_tsl_mult': 0.981315461682618, 'sideways_time_stop': 97, 'sideways_use_sma': True, 'sideways_use_ema': False, 'sideways_use_atr': True, 'sideways_use_adx': True, 'sideways_use_spike': True, 'sideways_rsi_required': True}.
[I 2025-08-30 14:58:26,268] Trial 307 finished with values: [-1000000000.0, 1000000000.0] and parameters: {'p_sma': 17, 'p_std': 35, 'p_atr': 18, 'p_adx': 30, 'rsi_period': 50, 'ema1': 9, 'ema2': 50, 'slip_atr_k': 0.013663783841166064, 'slip_spread_k': 0.33747590159258, 'spread_hl_frac': 3.524222516798517e-05, 'bb_std_mult': 2.898522217714558, 'rsi_os': 6, 'rsi_ob': 89, 'vol_spike': 0.24504126659678452, 'adx_thresh': 13.761539905601145, 'atr_min_pct': 0.006029203179029688, 'atr_max_pct': 0.09730045301793994, 'tp_mult': 2.4947339517157445, 'tsl_mult': 0.47476825979866777, 'strategy': 'breakout', 'time_stop': 270, 'use_sma': False, 'use_atr': False, 'use_adx': True, 'use_ema': False, 'use_spike': False, 'rsi_required': False, 'edge_k': 0.2156758720047736, 'edge_cap': 0.784721187049719, 'bull_strategy': 'breakout', 'bull_bb_std_mult': 2.4835228342712745, 'bull_rsi_os': 53, 'bull_rsi_ob': 61, 'bull_adx_thresh': 25.88592396939664, 'bull_atr_min_pct': 0.001568429171544612, 'bull_atr_max_pct': 0.08560457945989212, 'bull_tp_mult': 1.0676626237210831, 'bull_tsl_mult': 0.9841534594920636, 'bull_time_stop': 132, 'bull_use_sma': True, 'bull_use_ema': True, 'bull_use_atr': True, 'bull_use_adx': False, 'bull_use_spike': True, 'bull_rsi_required': False, 'bear_strategy': 'mean_reversion', 'bear_bb_std_mult': 3.0689983368253886, 'bear_rsi_os': 27, 'bear_rsi_ob': 82, 'bear_adx_thresh': 5.004800248332953, 'bear_atr_min_pct': 0.02164107914958939, 'bear_atr_max_pct': 0.056742163956162675, 'bear_tp_mult': 2.9448536340988363, 'bear_tsl_mult': 0.6171506370826382, 'bear_time_stop': 241, 'bear_use_sma': True, 'bear_use_ema': False, 'bear_use_atr': True, 'bear_use_adx': True, 'bear_use_spike': True, 'bear_rsi_required': True, 'sideways_strategy': 'mean_reversion', 'sideways_bb_std_mult': 1.2444086949839714, 'sideways_rsi_os': 38, 'sideways_rsi_ob': 58, 'sideways_adx_thresh': 18.969429523485392, 'sideways_atr_min_pct': 0.024080612234340867, 'sideways_atr_max_pct': 0.09415259445830189, 'sideways_tp_mult': 2.4307841918325317, 'sideways_tsl_mult': 0.9836770358431088, 'sideways_time_stop': 100, 'sideways_use_sma': True, 'sideways_use_ema': False, 'sideways_use_atr': True, 'sideways_use_adx': True, 'sideways_use_spike': True, 'sideways_rsi_required': True}.
[I 2025-08-30 14:58:26,365] Trial 305 finished with values: [-1000000000.0, 1000000000.0] and parameters: {'p_sma': 12, 'p_std': 30, 'p_atr': 18, 'p_adx': 29, 'rsi_period': 59, 'ema1': 9, 'ema2': 51, 'slip_atr_k': 0.0251140753042183, 'slip_spread_k': 0.2171414377296188, 'spread_hl_frac': 0.0040536624851891445, 'bb_std_mult': 3.0098963090467308, 'rsi_os': 6, 'rsi_ob': 92, 'vol_spike': 0.27974234649696916, 'adx_thresh': 14.38657704280591, 'atr_min_pct': 0.02411405040306401, 'atr_max_pct': 0.08694051641210766, 'tp_mult': 2.4881378029455767, 'tsl_mult': 0.8050635935182557, 'strategy': 'breakout', 'time_stop': 257, 'use_sma': False, 'use_atr': False, 'use_adx': True, 'use_ema': False, 'use_spike': False, 'rsi_required': False, 'edge_k': 0.20420854472419298, 'edge_cap': 0.7809060885675272, 'bull_strategy': 'breakout', 'bull_bb_std_mult': 2.6660060832806685, 'bull_rsi_os': 48, 'bull_rsi_ob': 48, 'bull_adx_thresh': 29.37825377169666, 'bull_atr_min_pct': 0.0016165832865930123, 'bull_atr_max_pct': 0.08547700931993987, 'bull_tp_mult': 1.0477400885625787, 'bull_tsl_mult': 0.9255489341451594, 'bull_time_stop': 132, 'bull_use_sma': True, 'bull_use_ema': True, 'bull_use_atr': True, 'bull_use_adx': False, 'bull_use_spike': True, 'bull_rsi_required': False, 'bear_strategy': 'mean_reversion', 'bear_bb_std_mult': 3.309578810075531, 'bear_rsi_os': 31, 'bear_rsi_ob': 85, 'bear_adx_thresh': 5.319979367473836, 'bear_atr_min_pct': 0.02947450252689646, 'bear_atr_max_pct': 0.017190078141275544, 'bear_tp_mult': 2.898959584196198, 'bear_tsl_mult': 0.5913327055744303, 'bear_time_stop': 257, 'bear_use_sma': True, 'bear_use_ema': False, 'bear_use_atr': True, 'bear_use_adx': True, 'bear_use_spike': True, 'bear_rsi_required': True, 'sideways_strategy': 'mean_reversion', 'sideways_bb_std_mult': 1.1631424766723013, 'sideways_rsi_os': 34, 'sideways_rsi_ob': 54, 'sideways_adx_thresh': 18.68786386701379, 'sideways_atr_min_pct': 0.021909998094455832, 'sideways_atr_max_pct': 0.08571231875143652, 'sideways_tp_mult': 2.3650862811347033, 'sideways_tsl_mult': 0.9029062660973504, 'sideways_time_stop': 80, 'sideways_use_sma': True, 'sideways_use_ema': False, 'sideways_use_atr': True, 'sideways_use_adx': True, 'sideways_use_spike': True, 'sideways_rsi_required': True}.
[I 2025-08-30 14:58:57,498] Trial 311 finished with values: [-0.005290233925566601, 0.00557462858495147] and parameters: {'p_sma': 41, 'p_std': 35, 'p_atr': 17, 'p_adx': 30, 'rsi_period': 52, 'ema1': 10, 'ema2': 49, 'slip_atr_k': 0.019590031084884205, 'slip_spread_k': 0.29021672621541544, 'spread_hl_frac': 0.0013837588867819583, 'bb_std_mult': 2.982267820938689, 'rsi_os': 7, 'rsi_ob': 90, 'vol_spike': 0.2391811598656764, 'adx_thresh': 12.223345362321158, 'atr_min_pct': 0.004719785509288017, 'atr_max_pct': 0.09979123355406724, 'tp_mult': 2.4523706558226475, 'tsl_mult': 0.4897845658754629, 'strategy': 'breakout', 'time_stop': 264, 'use_sma': False, 'use_atr': False, 'use_adx': True, 'use_ema': False, 'use_spike': False, 'rsi_required': False, 'edge_k': 0.31900000245297205, 'edge_cap': 0.7983870481362544, 'bull_strategy': 'breakout', 'bull_bb_std_mult': 2.536137133374058, 'bull_rsi_os': 54, 'bull_rsi_ob': 68, 'bull_adx_thresh': 32.98643408315521, 'bull_atr_min_pct': 0.0003460102037505146, 'bull_atr_max_pct': 0.08875464654780524, 'bull_tp_mult': 1.0610529703807967, 'bull_tsl_mult': 0.9814624832298477, 'bull_time_stop': 131, 'bull_use_sma': True, 'bull_use_ema': True, 'bull_use_atr': True, 'bull_use_adx': False, 'bull_use_spike': True, 'bull_rsi_required': False, 'bear_strategy': 'mean_reversion', 'bear_bb_std_mult': 3.1645109749607863, 'bear_rsi_os': 25, 'bear_rsi_ob': 82, 'bear_adx_thresh': 6.122174036124138, 'bear_atr_min_pct': 0.028905912770562616, 'bear_atr_max_pct': 0.0172058485190997, 'bear_tp_mult': 2.957643509844785, 'bear_tsl_mult': 0.6504264444092998, 'bear_time_stop': 257, 'bear_use_sma': True, 'bear_use_ema': False, 'bear_use_atr': True, 'bear_use_adx': True, 'bear_use_spike': True, 'bear_rsi_required': True, 'sideways_strategy': 'mean_reversion', 'sideways_bb_std_mult': 1.0953698681902422, 'sideways_rsi_os': 36, 'sideways_rsi_ob': 56, 'sideways_adx_thresh': 19.237261708441526, 'sideways_atr_min_pct': 0.023579331314204435, 'sideways_atr_max_pct': 0.09362085045439815, 'sideways_tp_mult': 2.379512417884066, 'sideways_tsl_mult': 0.9926643065476548, 'sideways_time_stop': 89, 'sideways_use_sma': True, 'sideways_use_ema': False, 'sideways_use_atr': True, 'sideways_use_adx': True, 'sideways_use_spike': True, 'sideways_rsi_required': True}.
[I 2025-08-30 14:58:57,518] Trial 309 finished with values: [-1000000000.0, 1000000000.0] and parameters: {'p_sma': 17, 'p_std': 35, 'p_atr': 17, 'p_adx': 30, 'rsi_period': 52, 'ema1': 9, 'ema2': 50, 'slip_atr_k': 0.011420341380289705, 'slip_spread_k': 0.3070968496849301, 'spread_hl_frac': 0.0016120520569625424, 'bb_std_mult': 2.9575425848802404, 'rsi_os': 7, 'rsi_ob': 90, 'vol_spike': 0.2572649289072575, 'adx_thresh': 13.991425845464693, 'atr_min_pct': 0.004920443110951584, 'atr_max_pct': 0.09766774476988285, 'tp_mult': 2.5355018754516, 'tsl_mult': 0.47835171975743207, 'strategy': 'breakout', 'time_stop': 273, 'use_sma': False, 'use_atr': False, 'use_adx': True, 'use_ema': False, 'use_spike': False, 'rsi_required': False, 'edge_k': 0.33051493851036534, 'edge_cap': 0.7841639542560865, 'bull_strategy': 'breakout', 'bull_bb_std_mult': 2.385679799144047, 'bull_rsi_os': 53, 'bull_rsi_ob': 69, 'bull_adx_thresh': 32.426521020583145, 'bull_atr_min_pct': 0.0015173563491547011, 'bull_atr_max_pct': 0.08813100660776721, 'bull_tp_mult': 1.0620531542839893, 'bull_tsl_mult': 0.9860001276745232, 'bull_time_stop': 133, 'bull_use_sma': True, 'bull_use_ema': True, 'bull_use_atr': True, 'bull_use_adx': False, 'bull_use_spike': True, 'bull_rsi_required': False, 'bear_strategy': 'mean_reversion', 'bear_bb_std_mult': 3.1241602490388014, 'bear_rsi_os': 26, 'bear_rsi_ob': 81, 'bear_adx_thresh': 6.130620130898721, 'bear_atr_min_pct': 0.029366225588726765, 'bear_atr_max_pct': 0.018362663705915428, 'bear_tp_mult': 2.960377427199076, 'bear_tsl_mult': 0.6343655493912729, 'bear_time_stop': 245, 'bear_use_sma': True, 'bear_use_ema': False, 'bear_use_atr': True, 'bear_use_adx': True, 'bear_use_spike': True, 'bear_rsi_required': True, 'sideways_strategy': 'mean_reversion', 'sideways_bb_std_mult': 1.194373056459579, 'sideways_rsi_os': 38, 'sideways_rsi_ob': 58, 'sideways_adx_thresh': 19.11239316207386, 'sideways_atr_min_pct': 0.023951400956952813, 'sideways_atr_max_pct': 0.09315185457838746, 'sideways_tp_mult': 2.424917104364148, 'sideways_tsl_mult': 0.9938303239540145, 'sideways_time_stop': 97, 'sideways_use_sma': True, 'sideways_use_ema': False, 'sideways_use_atr': True, 'sideways_use_adx': True, 'sideways_use_spike': True, 'sideways_rsi_required': True}.
[I 2025-08-30 14:58:57,755] Trial 312 finished with values: [-0.005358278791814719, 0.005622755051335633] and parameters: {'p_sma': 41, 'p_std': 35, 'p_atr': 17, 'p_adx': 30, 'rsi_period': 48, 'ema1': 10, 'ema2': 50, 'slip_atr_k': 0.02059188004666712, 'slip_spread_k': 0.3043962776009178, 'spread_hl_frac': 0.0014232674528569308, 'bb_std_mult': 2.847971209418971, 'rsi_os': 7, 'rsi_ob': 90, 'vol_spike': 0.2682358372133502, 'adx_thresh': 13.825515888666581, 'atr_min_pct': 0.004892942847578333, 'atr_max_pct': 0.09894295406565999, 'tp_mult': 2.440100163309291, 'tsl_mult': 0.4881360518785071, 'strategy': 'breakout', 'time_stop': 264, 'use_sma': False, 'use_atr': False, 'use_adx': True, 'use_ema': False, 'use_spike': False, 'rsi_required': False, 'edge_k': 0.3276659940369189, 'edge_cap': 0.8040894226053753, 'bull_strategy': 'breakout', 'bull_bb_std_mult': 2.3695562293604353, 'bull_rsi_os': 54, 'bull_rsi_ob': 58, 'bull_adx_thresh': 33.07996908122391, 'bull_atr_min_pct': 0.00035527208867076627, 'bull_atr_max_pct': 0.09028562369917853, 'bull_tp_mult': 1.0583549397946643, 'bull_tsl_mult': 0.9816645543878741, 'bull_time_stop': 136, 'bull_use_sma': True, 'bull_use_ema': True, 'bull_use_atr': True, 'bull_use_adx': False, 'bull_use_spike': True, 'bull_rsi_required': False, 'bear_strategy': 'mean_reversion', 'bear_bb_std_mult': 3.156183451984855, 'bear_rsi_os': 26, 'bear_rsi_ob': 82, 'bear_adx_thresh': 5.711671208045808, 'bear_atr_min_pct': 0.028966624714740156, 'bear_atr_max_pct': 0.021834939652111016, 'bear_tp_mult': 2.9508795715631564, 'bear_tsl_mult': 0.6280271541309371, 'bear_time_stop': 249, 'bear_use_sma': True, 'bear_use_ema': False, 'bear_use_atr': True, 'bear_use_adx': True, 'bear_use_spike': True, 'bear_rsi_required': True, 'sideways_strategy': 'mean_reversion', 'sideways_bb_std_mult': 1.0580198624941024, 'sideways_rsi_os': 36, 'sideways_rsi_ob': 56, 'sideways_adx_thresh': 17.53958774869315, 'sideways_atr_min_pct': 0.02337695675484883, 'sideways_atr_max_pct': 0.09841908249348641, 'sideways_tp_mult': 2.392459725316973, 'sideways_tsl_mult': 0.9940194288050771, 'sideways_time_stop': 92, 'sideways_use_sma': True, 'sideways_use_ema': False, 'sideways_use_atr': True, 'sideways_use_adx': True, 'sideways_use_spike': True, 'sideways_rsi_required': True}.
[I 2025-08-30 14:58:57,847] Trial 310 finished with values: [-0.008758200919700698, 0.0088086113363306] and parameters: {'p_sma': 41, 'p_std': 35, 'p_atr': 17, 'p_adx': 30, 'rsi_period': 48, 'ema1': 11, 'ema2': 51, 'slip_atr_k': 0.020413252082221653, 'slip_spread_k': 0.033702537860808734, 'spread_hl_frac': 0.0011805974723064657, 'bb_std_mult': 2.867089060939172, 'rsi_os': 7, 'rsi_ob': 90, 'vol_spike': 0.24077866049062113, 'adx_thresh': 13.90142318938261, 'atr_min_pct': 0.005239955268534532, 'atr_max_pct': 0.09882287556541075, 'tp_mult': 2.4814531325184572, 'tsl_mult': 0.47453711350292177, 'strategy': 'breakout', 'time_stop': 264, 'use_sma': False, 'use_atr': False, 'use_adx': True, 'use_ema': False, 'use_spike': False, 'rsi_required': False, 'edge_k': 0.3287564329196069, 'edge_cap': 0.7999980619937049, 'bull_strategy': 'breakout', 'bull_bb_std_mult': 2.369818834060528, 'bull_rsi_os': 54, 'bull_rsi_ob': 59, 'bull_adx_thresh': 12.652168655581457, 'bull_atr_min_pct': 0.00193260783907921, 'bull_atr_max_pct': 0.08996804212095724, 'bull_tp_mult': 1.0573085553456105, 'bull_tsl_mult': 0.9827388184856418, 'bull_time_stop': 131, 'bull_use_sma': True, 'bull_use_ema': True, 'bull_use_atr': True, 'bull_use_adx': False, 'bull_use_spike': True, 'bull_rsi_required': False, 'bear_strategy': 'mean_reversion', 'bear_bb_std_mult': 3.1607319484611285, 'bear_rsi_os': 27, 'bear_rsi_ob': 82, 'bear_adx_thresh': 6.10855951892914, 'bear_atr_min_pct': 0.029079513626623102, 'bear_atr_max_pct': 0.020660792357694656, 'bear_tp_mult': 2.9622520707712043, 'bear_tsl_mult': 0.6071383784204472, 'bear_time_stop': 256, 'bear_use_sma': True, 'bear_use_ema': False, 'bear_use_atr': True, 'bear_use_adx': True, 'bear_use_spike': True, 'bear_rsi_required': True, 'sideways_strategy': 'mean_reversion', 'sideways_bb_std_mult': 1.2098042134397242, 'sideways_rsi_os': 34, 'sideways_rsi_ob': 55, 'sideways_adx_thresh': 19.16453662700587, 'sideways_atr_min_pct': 0.023460753487662203, 'sideways_atr_max_pct': 0.09358638099531395, 'sideways_tp_mult': 2.4046537296399877, 'sideways_tsl_mult': 0.9840901073904113, 'sideways_time_stop': 90, 'sideways_use_sma': True, 'sideways_use_ema': False, 'sideways_use_atr': True, 'sideways_use_adx': True, 'sideways_use_spike': True, 'sideways_rsi_required': True}.
[I 2025-08-30 14:59:28,950] Trial 314 finished with values: [-1000000000.0, 1000000000.0] and parameters: {'p_sma': 40, 'p_std': 37, 'p_atr': 17, 'p_adx': 30, 'rsi_period': 49, 'ema1': 11, 'ema2': 49, 'slip_atr_k': 0.006640057018229648, 'slip_spread_k': 0.38370056318938256, 'spread_hl_frac': 0.0006020208888749994, 'bb_std_mult': 2.8234111066160725, 'rsi_os': 7, 'rsi_ob': 90, 'vol_spike': 0.21306425000714915, 'adx_thresh': 12.240644481936485, 'atr_min_pct': 0.005427225405469149, 'atr_max_pct': 0.10255140498634747, 'tp_mult': 2.5629750334738675, 'tsl_mult': 0.4394917751679655, 'strategy': 'breakout', 'time_stop': 263, 'use_sma': False, 'use_atr': False, 'use_adx': True, 'use_ema': False, 'use_spike': False, 'rsi_required': False, 'edge_k': 0.340954805615519, 'edge_cap': 0.799997061850704, 'bull_strategy': 'breakout', 'bull_bb_std_mult': 2.3646097369638497, 'bull_rsi_os': 54, 'bull_rsi_ob': 66, 'bull_adx_thresh': 33.12520921716455, 'bull_atr_min_pct': 1.1392012001858534e-05, 'bull_atr_max_pct': 0.08999144909337985, 'bull_tp_mult': 1.080790807487985, 'bull_tsl_mult': 0.9843579869385352, 'bull_time_stop': 240, 'bull_use_sma': True, 'bull_use_ema': True, 'bull_use_atr': True, 'bull_use_adx': False, 'bull_use_spike': True, 'bull_rsi_required': True, 'bear_strategy': 'mean_reversion', 'bear_bb_std_mult': 3.193903032310683, 'bear_rsi_os': 25, 'bear_rsi_ob': 79, 'bear_adx_thresh': 6.235894393029793, 'bear_atr_min_pct': 0.020636166570954437, 'bear_atr_max_pct': 0.04999403106674029, 'bear_tp_mult': 2.9658040019203127, 'bear_tsl_mult': 0.6537642942845888, 'bear_time_stop': 255, 'bear_use_sma': True, 'bear_use_ema': False, 'bear_use_atr': True, 'bear_use_adx': True, 'bear_use_spike': True, 'bear_rsi_required': True, 'sideways_strategy': 'mean_reversion', 'sideways_bb_std_mult': 1.0812750191800524, 'sideways_rsi_os': 34, 'sideways_rsi_ob': 53, 'sideways_adx_thresh': 19.47208960891239, 'sideways_atr_min_pct': 0.023577723749245463, 'sideways_atr_max_pct': 0.09937581292278896, 'sideways_tp_mult': 2.011309358675533, 'sideways_tsl_mult': 0.9954835311705632, 'sideways_time_stop': 73, 'sideways_use_sma': True, 'sideways_use_ema': False, 'sideways_use_atr': True, 'sideways_use_adx': True, 'sideways_use_spike': True, 'sideways_rsi_required': True}.
[I 2025-08-30 14:59:28,979] Trial 316 finished with values: [-0.006704694220181384, 0.006728315018811168] and parameters: {'p_sma': 49, 'p_std': 37, 'p_atr': 17, 'p_adx': 30, 'rsi_period': 52, 'ema1': 11, 'ema2': 49, 'slip_atr_k': 0.017488215560504734, 'slip_spread_k': 0.30031606505670877, 'spread_hl_frac': 0.0009698119878753949, 'bb_std_mult': 2.9691120714553674, 'rsi_os': 7, 'rsi_ob': 88, 'vol_spike': 0.2310589410499293, 'adx_thresh': 11.638190647564176, 'atr_min_pct': 0.004683789999353524, 'atr_max_pct': 0.10330585549096725, 'tp_mult': 2.4748793889803156, 'tsl_mult': 0.4864668828103606, 'strategy': 'breakout', 'time_stop': 265, 'use_sma': False, 'use_atr': False, 'use_adx': True, 'use_ema': False, 'use_spike': False, 'rsi_required': False, 'edge_k': 0.3140184401246429, 'edge_cap': 0.761353151193018, 'bull_strategy': 'breakout', 'bull_bb_std_mult': 2.5431523424254356, 'bull_rsi_os': 55, 'bull_rsi_ob': 68, 'bull_adx_thresh': 34.95102861584668, 'bull_atr_min_pct': 0.00013467677028275126, 'bull_atr_max_pct': 0.09328271740556927, 'bull_tp_mult': 1.1040452447886435, 'bull_tsl_mult': 0.9763733862875241, 'bull_time_stop': 238, 'bull_use_sma': True, 'bull_use_ema': True, 'bull_use_atr': True, 'bull_use_adx': False, 'bull_use_spike': True, 'bull_rsi_required': True, 'bear_strategy': 'mean_reversion', 'bear_bb_std_mult': 3.2036324147198227, 'bear_rsi_os': 24, 'bear_rsi_ob': 78, 'bear_adx_thresh': 6.631050212748885, 'bear_atr_min_pct': 0.025155128289638392, 'bear_atr_max_pct': 0.02307974580333498, 'bear_tp_mult': 2.961971596507817, 'bear_tsl_mult': 0.6484748199262023, 'bear_time_stop': 256, 'bear_use_sma': True, 'bear_use_ema': False, 'bear_use_atr': True, 'bear_use_adx': True, 'bear_use_spike': True, 'bear_rsi_required': True, 'sideways_strategy': 'mean_reversion', 'sideways_bb_std_mult': 1.0819308967051275, 'sideways_rsi_os': 35, 'sideways_rsi_ob': 53, 'sideways_adx_thresh': 19.583336063375505, 'sideways_atr_min_pct': 0.02460665053839882, 'sideways_atr_max_pct': 0.09830583280240585, 'sideways_tp_mult': 2.4689253042804538, 'sideways_tsl_mult': 0.9950327183636148, 'sideways_time_stop': 75, 'sideways_use_sma': True, 'sideways_use_ema': False, 'sideways_use_atr': True, 'sideways_use_adx': True, 'sideways_use_spike': True, 'sideways_rsi_required': True}.
