[I 2025-08-30 15:46:06,757] Trial 550 finished with values: [-1000000000.0, 1000000000.0] and parameters: {'p_sma': 51, 'p_std': 50, 'p_atr': 11, 'p_adx': 21, 'rsi_period': 39, 'ema1': 6, 'ema2': 41, 'slip_atr_k': 0.01298937256958829, 'slip_spread_k': 0.953564171066434, 'spread_hl_frac': 0.016781957974367198, 'bb_std_mult': 1.6432007310696628, 'rsi_os': 42, 'rsi_ob': 88, 'vol_spike': 0.22008949418480592, 'adx_thresh': 25.578940030235916, 'atr_min_pct': 0.02341489540707905, 'atr_max_pct': 0.11902244629210046, 'tp_mult': 1.542902546824533, 'tsl_mult': 0.3256046534120768, 'strategy': 'breakout', 'time_stop': 151, 'use_sma': True, 'use_atr': True, 'use_adx': False, 'use_ema': False, 'use_spike': False, 'rsi_required': False, 'edge_k': 0.7467116325978606, 'edge_cap': 0.9956796479008864, 'bull_strategy': 'breakout', 'bull_bb_std_mult': 1.464891435357009, 'bull_rsi_os': 50, 'bull_rsi_ob': 85, 'bull_adx_thresh': 9.040613107909866, 'bull_atr_min_pct': 0.021423331194260955, 'bull_atr_max_pct': 0.10686301497922918, 'bull_tp_mult': 1.8304532413451515, 'bull_tsl_mult': 0.8976562041457018, 'bull_time_stop': 53, 'bull_use_sma': True, 'bull_use_ema': True, 'bull_use_atr': True, 'bull_use_adx': True, 'bull_use_spike': True, 'bull_rsi_required': False, 'bear_strategy': 'mean_reversion', 'bear_bb_std_mult': 1.8843140982713278, 'bear_rsi_os': 27, 'bear_rsi_ob': 78, 'bear_adx_thresh': 16.441964871011432, 'bear_atr_min_pct': 0.013783908652984064, 'bear_atr_max_pct': 0.11631515922852749, 'bear_tp_mult': 2.6425587988515735, 'bear_tsl_mult': 0.8832119494252635, 'bear_time_stop': 94, 'bear_use_sma': False, 'bear_use_ema': False, 'bear_use_atr': False, 'bear_use_adx': False, 'bear_use_spike': True, 'bear_rsi_required': True, 'sideways_strategy': 'mean_reversion', 'sideways_bb_std_mult': 3.272313875721875, 'sideways_rsi_os': 22, 'sideways_rsi_ob': 78, 'sideways_adx_thresh': 9.543937626832651, 'sideways_atr_min_pct': 0.019063114911273382, 'sideways_atr_max_pct': 0.07279701605686446, 'sideways_tp_mult': 2.5781406727670637, 'sideways_tsl_mult': 0.42846116449726107, 'sideways_time_stop': 287, 'sideways_use_sma': True, 'sideways_use_ema': False, 'sideways_use_atr': True, 'sideways_use_adx': False, 'sideways_use_spike': True, 'sideways_rsi_required': False}.
[I 2025-08-30 15:46:06,766] Trial 551 finished with values: [-1000000000.0, 1000000000.0] and parameters: {'p_sma': 51, 'p_std': 23, 'p_atr': 24, 'p_adx': 21, 'rsi_period': 39, 'ema1': 23, 'ema2': 36, 'slip_atr_k': 0.06545801012627253, 'slip_spread_k': 0.9571258121554478, 'spread_hl_frac': 0.02796757926199052, 'bb_std_mult': 1.6675858074598344, 'rsi_os': 26, 'rsi_ob': 56, 'vol_spike': 0.11536273942375962, 'adx_thresh': 10.298769894477635, 'atr_min_pct': 0.023329412353950203, 'atr_max_pct': 0.11193985536407194, 'tp_mult': 1.5239824258180117, 'tsl_mult': 0.37225056961132913, 'strategy': 'breakout', 'time_stop': 150, 'use_sma': True, 'use_atr': True, 'use_adx': False, 'use_ema': False, 'use_spike': False, 'rsi_required': False, 'edge_k': 0.4426800427350456, 'edge_cap': 0.9277278804673896, 'bull_strategy': 'breakout', 'bull_bb_std_mult': 3.0850664409005257, 'bull_rsi_os': 50, 'bull_rsi_ob': 88, 'bull_adx_thresh': 6.87934481784702, 'bull_atr_min_pct': 0.019041344893107635, 'bull_atr_max_pct': 0.1073597826868389, 'bull_tp_mult': 1.473434538542602, 'bull_tsl_mult': 0.8999215777142537, 'bull_time_stop': 53, 'bull_use_sma': True, 'bull_use_ema': True, 'bull_use_atr': True, 'bull_use_adx': True, 'bull_use_spike': True, 'bull_rsi_required': False, 'bear_strategy': 'mean_reversion', 'bear_bb_std_mult': 1.8830279860540706, 'bear_rsi_os': 27, 'bear_rsi_ob': 61, 'bear_adx_thresh': 16.384757423856048, 'bear_atr_min_pct': 0.0027492333402569635, 'bear_atr_max_pct': 0.12066714163687364, 'bear_tp_mult': 2.663901721222378, 'bear_tsl_mult': 0.1412257849726608, 'bear_time_stop': 83, 'bear_use_sma': False, 'bear_use_ema': False, 'bear_use_atr': False, 'bear_use_adx': False, 'bear_use_spike': True, 'bear_rsi_required': True, 'sideways_strategy': 'mean_reversion', 'sideways_bb_std_mult': 0.6822145268594653, 'sideways_rsi_os': 9, 'sideways_rsi_ob': 78, 'sideways_adx_thresh': 13.942535761109143, 'sideways_atr_min_pct': 0.01881887044292622, 'sideways_atr_max_pct': 0.0728618241872242, 'sideways_tp_mult': 2.555708640341234, 'sideways_tsl_mult': 0.6724258236393446, 'sideways_time_stop': 154, 'sideways_use_sma': True, 'sideways_use_ema': False, 'sideways_use_atr': True, 'sideways_use_adx': False, 'sideways_use_spike': True, 'sideways_rsi_required': True}.
[I 2025-08-30 15:46:07,953] Trial 549 finished with values: [-0.008242200753814877, 0.008679131926752869] and parameters: {'p_sma': 50, 'p_std': 21, 'p_atr': 11, 'p_adx': 16, 'rsi_period': 8, 'ema1': 24, 'ema2': 28, 'slip_atr_k': 0.012418379455695999, 'slip_spread_k': 0.7180093958464399, 'spread_hl_frac': 0.010492319171898846, 'bb_std_mult': 1.4223602890715505, 'rsi_os': 54, 'rsi_ob': 88, 'vol_spike': 0.2147572158501653, 'adx_thresh': 10.1059953974433, 'atr_min_pct': 0.006162373754424011, 'atr_max_pct': 0.11124126211325903, 'tp_mult': 1.0223917097928925, 'tsl_mult': 0.3264554841015563, 'strategy': 'breakout', 'time_stop': 157, 'use_sma': False, 'use_atr': False, 'use_adx': True, 'use_ema': False, 'use_spike': False, 'rsi_required': False, 'edge_k': 1.3895085962947291, 'edge_cap': 0.916063914027049, 'bull_strategy': 'breakout', 'bull_bb_std_mult': 1.4491886000832515, 'bull_rsi_os': 5, 'bull_rsi_ob': 88, 'bull_adx_thresh': 9.097347644560184, 'bull_atr_min_pct': 0.01916833944733614, 'bull_atr_max_pct': 0.10835472181467456, 'bull_tp_mult': 2.545280341970701, 'bull_tsl_mult': 0.8968037637387329, 'bull_time_stop': 53, 'bull_use_sma': True, 'bull_use_ema': True, 'bull_use_atr': True, 'bull_use_adx': True, 'bull_use_spike': True, 'bull_rsi_required': False, 'bear_strategy': 'mean_reversion', 'bear_bb_std_mult': 1.8749002557181609, 'bear_rsi_os': 42, 'bear_rsi_ob': 78, 'bear_adx_thresh': 15.116088057617706, 'bear_atr_min_pct': 0.004269822155999484, 'bear_atr_max_pct': 0.09845356763864196, 'bear_tp_mult': 2.5474186435028257, 'bear_tsl_mult': 0.9991362969854913, 'bear_time_stop': 96, 'bear_use_sma': False, 'bear_use_ema': False, 'bear_use_atr': True, 'bear_use_adx': False, 'bear_use_spike': True, 'bear_rsi_required': True, 'sideways_strategy': 'mean_reversion', 'sideways_bb_std_mult': 1.5036197577036416, 'sideways_rsi_os': 21, 'sideways_rsi_ob': 78, 'sideways_adx_thresh': 10.407023888702847, 'sideways_atr_min_pct': 0.020687282071749063, 'sideways_atr_max_pct': 0.11549925168647178, 'sideways_tp_mult': 2.577064149555559, 'sideways_tsl_mult': 0.49772402015413003, 'sideways_time_stop': 133, 'sideways_use_sma': True, 'sideways_use_ema': False, 'sideways_use_atr': True, 'sideways_use_adx': True, 'sideways_use_spike': True, 'sideways_rsi_required': True}.
[I 2025-08-30 15:46:09,001] Trial 552 finished with values: [-1000000000.0, 1000000000.0] and parameters: {'p_sma': 7, 'p_std': 49, 'p_atr': 27, 'p_adx': 25, 'rsi_period': 7, 'ema1': 24, 'ema2': 28, 'slip_atr_k': 0.1310337062799526, 'slip_spread_k': 0.7616294741142994, 'spread_hl_frac': 0.01013107575253817, 'bb_std_mult': 0.5757837591351194, 'rsi_os': 26, 'rsi_ob': 86, 'vol_spike': 0.11488310956192962, 'adx_thresh': 27.732827634452754, 'atr_min_pct': 0.006695685467506294, 'atr_max_pct': 0.11892094925476411, 'tp_mult': 1.5517271493886593, 'tsl_mult': 0.361703529178056, 'strategy': 'breakout', 'time_stop': 150, 'use_sma': True, 'use_atr': True, 'use_adx': False, 'use_ema': False, 'use_spike': False, 'rsi_required': False, 'edge_k': 0.5174718015934355, 'edge_cap': 0.9222319484789542, 'bull_strategy': 'breakout', 'bull_bb_std_mult': 1.7834580963073534, 'bull_rsi_os': 32, 'bull_rsi_ob': 88, 'bull_adx_thresh': 9.678463256420937, 'bull_atr_min_pct': 0.019163050468928387, 'bull_atr_max_pct': 0.10430379206680064, 'bull_tp_mult': 1.8192643148489924, 'bull_tsl_mult': 0.8790561855464875, 'bull_time_stop': 51, 'bull_use_sma': True, 'bull_use_ema': True, 'bull_use_atr': True, 'bull_use_adx': True, 'bull_use_spike': True, 'bull_rsi_required': False, 'bear_strategy': 'mean_reversion', 'bear_bb_std_mult': 2.6351601290389235, 'bear_rsi_os': 27, 'bear_rsi_ob': 75, 'bear_adx_thresh': 21.942891861833424, 'bear_atr_min_pct': 0.020319862841689768, 'bear_atr_max_pct': 0.12037476530640767, 'bear_tp_mult': 2.6631400244057017, 'bear_tsl_mult': 0.4520884913662542, 'bear_time_stop': 82, 'bear_use_sma': True, 'bear_use_ema': False, 'bear_use_atr': False, 'bear_use_adx': False, 'bear_use_spike': True, 'bear_rsi_required': True, 'sideways_strategy': 'mean_reversion', 'sideways_bb_std_mult': 1.5076825598083043, 'sideways_rsi_os': 9, 'sideways_rsi_ob': 76, 'sideways_adx_thresh': 10.442257048020707, 'sideways_atr_min_pct': 0.01895442616102852, 'sideways_atr_max_pct': 0.07256763593869292, 'sideways_tp_mult': 1.8672633041155984, 'sideways_tsl_mult': 0.2022547937624279, 'sideways_time_stop': 61, 'sideways_use_sma': True, 'sideways_use_ema': True, 'sideways_use_atr': True, 'sideways_use_adx': False, 'sideways_use_spike': True, 'sideways_rsi_required': True}.
[I 2025-08-30 15:47:14,245] Trial 556 finished with values: [-1000000000.0, 1000000000.0] and parameters: {'p_sma': 30, 'p_std': 41, 'p_atr': 12, 'p_adx': 25, 'rsi_period': 73, 'ema1': 23, 'ema2': 19, 'slip_atr_k': 0.23562185501873095, 'slip_spread_k': 0.7414002375200558, 'spread_hl_frac': 0.005957267560113987, 'bb_std_mult': 0.6730713223947701, 'rsi_os': 28, 'rsi_ob': 86, 'vol_spike': 0.20561462116227677, 'adx_thresh': 7.5941871099044365, 'atr_min_pct': 0.011820249675462663, 'atr_max_pct': 0.1158759403981913, 'tp_mult': 1.606018899001114, 'tsl_mult': 0.2729684204276933, 'strategy': 'mean_reversion', 'time_stop': 159, 'use_sma': False, 'use_atr': False, 'use_adx': True, 'use_ema': True, 'use_spike': True, 'rsi_required': True, 'edge_k': 0.4620223588228725, 'edge_cap': 0.9618708792586159, 'bull_strategy': 'mean_reversion', 'bull_bb_std_mult': 1.5997531361166752, 'bull_rsi_os': 20, 'bull_rsi_ob': 57, 'bull_adx_thresh': 9.92505024089657, 'bull_atr_min_pct': 0.026073873125296968, 'bull_atr_max_pct': 0.102273737264094, 'bull_tp_mult': 2.632271360099164, 'bull_tsl_mult': 0.38954678842918866, 'bull_time_stop': 72, 'bull_use_sma': False, 'bull_use_ema': False, 'bull_use_atr': False, 'bull_use_adx': True, 'bull_use_spike': False, 'bull_rsi_required': True, 'bear_strategy': 'breakout', 'bear_bb_std_mult': 2.854705842217929, 'bear_rsi_os': 24, 'bear_rsi_ob': 93, 'bear_adx_thresh': 28.511140743551124, 'bear_atr_min_pct': 0.01625311992534525, 'bear_atr_max_pct': 0.11168115779169294, 'bear_tp_mult': 1.7389738791742937, 'bear_tsl_mult': 0.9088552326598223, 'bear_time_stop': 104, 'bear_use_sma': True, 'bear_use_ema': True, 'bear_use_atr': True, 'bear_use_adx': True, 'bear_use_spike': False, 'bear_rsi_required': False, 'sideways_strategy': 'breakout', 'sideways_bb_std_mult': 2.4954481240835986, 'sideways_rsi_os': 17, 'sideways_rsi_ob': 79, 'sideways_adx_thresh': 12.020637738866053, 'sideways_atr_min_pct': 0.01959310511036777, 'sideways_atr_max_pct': 0.056151124852204186, 'sideways_tp_mult': 1.0444996496008443, 'sideways_tsl_mult': 0.3970932008101866, 'sideways_time_stop': 124, 'sideways_use_sma': False, 'sideways_use_ema': True, 'sideways_use_atr': True, 'sideways_use_adx': True, 'sideways_use_spike': False, 'sideways_rsi_required': True}.
[I 2025-08-30 15:47:14,287] Trial 555 finished with values: [-1000000000.0, 1000000000.0] and parameters: {'p_sma': 7, 'p_std': 19, 'p_atr': 28, 'p_adx': 25, 'rsi_period': 7, 'ema1': 24, 'ema2': 38, 'slip_atr_k': 0.00500593623321654, 'slip_spread_k': 0.4554828878836218, 'spread_hl_frac': 0.007194106925986812, 'bb_std_mult': 0.5785717571254881, 'rsi_os': 28, 'rsi_ob': 67, 'vol_spike': 0.2029635148297373, 'adx_thresh': 30.076331593675285, 'atr_min_pct': 0.025751365972352114, 'atr_max_pct': 0.11633273002356455, 'tp_mult': 1.5722690324808517, 'tsl_mult': 0.27986307567857216, 'strategy': 'mean_reversion', 'time_stop': 174, 'use_sma': False, 'use_atr': False, 'use_adx': True, 'use_ema': True, 'use_spike': True, 'rsi_required': True, 'edge_k': 0.515136667291594, 'edge_cap': 0.15837093104207806, 'bull_strategy': 'mean_reversion', 'bull_bb_std_mult': 1.6180214140923956, 'bull_rsi_os': 24, 'bull_rsi_ob': 88, 'bull_adx_thresh': 9.611862748812813, 'bull_atr_min_pct': 0.025607084124944057, 'bull_atr_max_pct': 0.10359059237703996, 'bull_tp_mult': 2.6357737646996267, 'bull_tsl_mult': 0.2005542568682372, 'bull_time_stop': 73, 'bull_use_sma': False, 'bull_use_ema': False, 'bull_use_atr': False, 'bull_use_adx': True, 'bull_use_spike': False, 'bull_rsi_required': False, 'bear_strategy': 'breakout', 'bear_bb_std_mult': 1.7603511803210412, 'bear_rsi_os': 46, 'bear_rsi_ob': 92, 'bear_adx_thresh': 15.677584733654795, 'bear_atr_min_pct': 0.0018419629271038632, 'bear_atr_max_pct': 0.06866262721839798, 'bear_tp_mult': 2.5962016880544883, 'bear_tsl_mult': 0.9114774025483048, 'bear_time_stop': 103, 'bear_use_sma': True, 'bear_use_ema': True, 'bear_use_atr': True, 'bear_use_adx': True, 'bear_use_spike': False, 'bear_rsi_required': False, 'sideways_strategy': 'breakout', 'sideways_bb_std_mult': 3.084168568019147, 'sideways_rsi_os': 7, 'sideways_rsi_ob': 77, 'sideways_adx_thresh': 13.225820186666501, 'sideways_atr_min_pct': 0.019666650890326254, 'sideways_atr_max_pct': 0.14199696215002153, 'sideways_tp_mult': 1.0103687868802176, 'sideways_tsl_mult': 0.34145171650772177, 'sideways_time_stop': 146, 'sideways_use_sma': False, 'sideways_use_ema': True, 'sideways_use_atr': True, 'sideways_use_adx': True, 'sideways_use_spike': False, 'sideways_rsi_required': True}.
[I 2025-08-30 15:47:15,038] Trial 553 finished with values: [-1000000000.0, 1000000000.0] and parameters: {'p_sma': 7, 'p_std': 21, 'p_atr': 14, 'p_adx': 25, 'rsi_period': 7, 'ema1': 24, 'ema2': 19, 'slip_atr_k': 0.2257213813169299, 'slip_spread_k': 0.7637891513019989, 'spread_hl_frac': 0.010443227962186595, 'bb_std_mult': 0.5599895112865904, 'rsi_os': 28, 'rsi_ob': 86, 'vol_spike': 0.20442837715232387, 'adx_thresh': 27.619457840235267, 'atr_min_pct': 0.0060786486841247775, 'atr_max_pct': 0.11581203287623232, 'tp_mult': 1.5858806487875292, 'tsl_mult': 0.3499999437459347, 'strategy': 'mean_reversion', 'time_stop': 159, 'use_sma': False, 'use_atr': False, 'use_adx': True, 'use_ema': False, 'use_spike': True, 'rsi_required': False, 'edge_k': 1.3811526083463779, 'edge_cap': 0.3658798610875348, 'bull_strategy': 'breakout', 'bull_bb_std_mult': 1.6001669009799817, 'bull_rsi_os': 32, 'bull_rsi_ob': 88, 'bull_adx_thresh': 9.870652861102625, 'bull_atr_min_pct': 0.019115466546746333, 'bull_atr_max_pct': 0.10179469597071103, 'bull_tp_mult': 2.6336808637568088, 'bull_tsl_mult': 0.6141050708648318, 'bull_time_stop': 67, 'bull_use_sma': False, 'bull_use_ema': False, 'bull_use_atr': True, 'bull_use_adx': True, 'bull_use_spike': True, 'bull_rsi_required': False, 'bear_strategy': 'mean_reversion', 'bear_bb_std_mult': 2.003802375237882, 'bear_rsi_os': 24, 'bear_rsi_ob': 75, 'bear_adx_thresh': 28.501053874230003, 'bear_atr_min_pct': 0.021316468411705272, 'bear_atr_max_pct': 0.05897861716692926, 'bear_tp_mult': 1.5735235184843792, 'bear_tsl_mult': 0.8134917808974622, 'bear_time_stop': 101, 'bear_use_sma': True, 'bear_use_ema': True, 'bear_use_atr': True, 'bear_use_adx': True, 'bear_use_spike': True, 'bear_rsi_required': True, 'sideways_strategy': 'breakout', 'sideways_bb_std_mult': 3.0858802342234934, 'sideways_rsi_os': 52, 'sideways_rsi_ob': 79, 'sideways_adx_thresh': 10.486795179804103, 'sideways_atr_min_pct': 0.019696332095717736, 'sideways_atr_max_pct': 0.14194941722888849, 'sideways_tp_mult': 1.4848377650984597, 'sideways_tsl_mult': 0.3372620569260621, 'sideways_time_stop': 27, 'sideways_use_sma': False, 'sideways_use_ema': True, 'sideways_use_atr': True, 'sideways_use_adx': True, 'sideways_use_spike': True, 'sideways_rsi_required': True}.
[I 2025-08-30 15:47:16,748] Trial 554 finished with values: [-0.05415000278608406, 0.05409051945961846] and parameters: {'p_sma': 7, 'p_std': 21, 'p_atr': 12, 'p_adx': 25, 'rsi_period': 7, 'ema1': 24, 'ema2': 38, 'slip_atr_k': 0.19053101628310687, 'slip_spread_k': 0.763961173682987, 'spread_hl_frac': 0.005857165537977236, 'bb_std_mult': 2.301655492523895, 'rsi_os': 28, 'rsi_ob': 67, 'vol_spike': 0.20458495126533383, 'adx_thresh': 27.77846785715207, 'atr_min_pct': 0.006849565918124245, 'atr_max_pct': 0.11616301541183127, 'tp_mult': 1.603934925326999, 'tsl_mult': 0.28089494757982275, 'strategy': 'mean_reversion', 'time_stop': 158, 'use_sma': False, 'use_atr': False, 'use_adx': True, 'use_ema': False, 'use_spike': True, 'rsi_required': False, 'edge_k': 0.5096815901059006, 'edge_cap': 0.3057556052551482, 'bull_strategy': 'breakout', 'bull_bb_std_mult': 1.7741084001460203, 'bull_rsi_os': 48, 'bull_rsi_ob': 88, 'bull_adx_thresh': 9.692622465321191, 'bull_atr_min_pct': 0.019168813746252695, 'bull_atr_max_pct': 0.053155244716616354, 'bull_tp_mult': 2.6295722644340644, 'bull_tsl_mult': 0.18887860669020207, 'bull_time_stop': 69, 'bull_use_sma': False, 'bull_use_ema': False, 'bull_use_atr': True, 'bull_use_adx': True, 'bull_use_spike': True, 'bull_rsi_required': False, 'bear_strategy': 'mean_reversion', 'bear_bb_std_mult': 2.0118566468590453, 'bear_rsi_os': 24, 'bear_rsi_ob': 75, 'bear_adx_thresh': 22.01564728567235, 'bear_atr_min_pct': 0.021328599910539772, 'bear_atr_max_pct': 0.07087476060822913, 'bear_tp_mult': 2.596084314853636, 'bear_tsl_mult': 0.8479126024025819, 'bear_time_stop': 172, 'bear_use_sma': True, 'bear_use_ema': True, 'bear_use_atr': True, 'bear_use_adx': True, 'bear_use_spike': True, 'bear_rsi_required': True, 'sideways_strategy': 'breakout', 'sideways_bb_std_mult': 3.0770992134880455, 'sideways_rsi_os': 14, 'sideways_rsi_ob': 79, 'sideways_adx_thresh': 13.247414770851933, 'sideways_atr_min_pct': 4.723020079133375e-05, 'sideways_atr_max_pct': 0.06136314846473041, 'sideways_tp_mult': 1.487967627745832, 'sideways_tsl_mult': 0.19859606159197357, 'sideways_time_stop': 146, 'sideways_use_sma': False, 'sideways_use_ema': True, 'sideways_use_atr': True, 'sideways_use_adx': True, 'sideways_use_spike': True, 'sideways_rsi_required': True}.
[I 2025-08-30 15:48:12,117] Trial 560 finished with values: [-0.009276084648070504, 0.009328451075153147] and parameters: {'p_sma': 5, 'p_std': 23, 'p_atr': 13, 'p_adx': 26, 'rsi_period': 14, 'ema1': 25, 'ema2': 56, 'slip_atr_k': 0.00533674190566071, 'slip_spread_k': 0.6863176752870055, 'spread_hl_frac': 0.008053057071247377, 'bb_std_mult': 2.1740362385032106, 'rsi_os': 26, 'rsi_ob': 82, 'vol_spike': 0.2219564011740255, 'adx_thresh': 9.319818637877004, 'atr_min_pct': 0.006062935354034307, 'atr_max_pct': 0.10731664038410241, 'tp_mult': 1.4199935327593172, 'tsl_mult': 0.9654129193647008, 'strategy': 'breakout', 'time_stop': 209, 'use_sma': False, 'use_atr': False, 'use_adx': True, 'use_ema': False, 'use_spike': False, 'rsi_required': False, 'edge_k': 1.0499906968115569, 'edge_cap': 0.9479545264995377, 'bull_strategy': 'breakout', 'bull_bb_std_mult': 1.69707692800353, 'bull_rsi_os': 10, 'bull_rsi_ob': 90, 'bull_adx_thresh': 11.169971015789606, 'bull_atr_min_pct': 0.020350434903616276, 'bull_atr_max_pct': 0.13613904721356462, 'bull_tp_mult': 2.465655396050789, 'bull_tsl_mult': 0.8059471555842315, 'bull_time_stop': 166, 'bull_use_sma': True, 'bull_use_ema': True, 'bull_use_atr': True, 'bull_use_adx': True, 'bull_use_spike': True, 'bull_rsi_required': True, 'bear_strategy': 'mean_reversion', 'bear_bb_std_mult': 1.7609381993302193, 'bear_rsi_os': 55, 'bear_rsi_ob': 76, 'bear_adx_thresh': 27.156961985314098, 'bear_atr_min_pct': 0.0005530084398911793, 'bear_atr_max_pct': 0.10966732161768594, 'bear_tp_mult': 1.177631401181035, 'bear_tsl_mult': 0.8436877530944148, 'bear_time_stop': 87, 'bear_use_sma': True, 'bear_use_ema': False, 'bear_use_atr': True, 'bear_use_adx': True, 'bear_use_spike': True, 'bear_rsi_required': True, 'sideways_strategy': 'mean_reversion', 'sideways_bb_std_mult': 3.215182879601203, 'sideways_rsi_os': 6, 'sideways_rsi_ob': 87, 'sideways_adx_thresh': 16.375480730293564, 'sideways_atr_min_pct': 0.00863089901811145, 'sideways_atr_max_pct': 0.02694754476400913, 'sideways_tp_mult': 1.1956298038370052, 'sideways_tsl_mult': 0.6534851836065533, 'sideways_time_stop': 136, 'sideways_use_sma': True, 'sideways_use_ema': False, 'sideways_use_atr': True, 'sideways_use_adx': True, 'sideways_use_spike': True, 'sideways_rsi_required': True}.
