[I 2025-08-30 14:47:27,923] Trial 225 finished with values: [-1000000000.0, 1000000000.0] and parameters: {'p_sma': 41, 'p_std': 41, 'p_atr': 23, 'p_adx': 10, 'rsi_period': 21, 'ema1': 15, 'ema2': 32, 'slip_atr_k': 0.2208966678705411, 'slip_spread_k': 0.10594393391517709, 'spread_hl_frac': 0.04799124055267896, 'bb_std_mult': 3.5969385063590473, 'rsi_os': 17, 'rsi_ob': 56, 'vol_spike': 0.08583518204690865, 'adx_thresh': 23.92452767585646, 'atr_min_pct': 0.02932409912327968, 'atr_max_pct': 0.11747806108616221, 'tp_mult': 1.4529206330427984, 'tsl_mult': 0.28273990173605745, 'strategy': 'mean_reversion', 'time_stop': 295, 'use_sma': True, 'use_atr': True, 'use_adx': False, 'use_ema': True, 'use_spike': True, 'rsi_required': True, 'edge_k': 1.808258825955709, 'edge_cap': 0.4839546419066634, 'bull_strategy': 'mean_reversion', 'bull_bb_std_mult': 1.8830068263978412, 'bull_rsi_os': 41, 'bull_rsi_ob': 65, 'bull_adx_thresh': 20.933990954633728, 'bull_atr_min_pct': 0.0026888736141579645, 'bull_atr_max_pct': 0.08922506657138987, 'bull_tp_mult': 1.2885342041420533, 'bull_tsl_mult': 0.3116373965585826, 'bull_time_stop': 84, 'bull_use_sma': False, 'bull_use_ema': False, 'bull_use_atr': False, 'bull_use_adx': True, 'bull_use_spike': False, 'bull_rsi_required': False, 'bear_strategy': 'breakout', 'bear_bb_std_mult': 1.2199583905317346, 'bear_rsi_os': 21, 'bear_rsi_ob': 63, 'bear_adx_thresh': 10.501977590076498, 'bear_atr_min_pct': 0.009931563738758347, 'bear_atr_max_pct': 0.14339949751274594, 'bear_tp_mult': 1.9255626180433811, 'bear_tsl_mult': 0.8098755724362688, 'bear_time_stop': 188, 'bear_use_sma': False, 'bear_use_ema': False, 'bear_use_atr': False, 'bear_use_adx': False, 'bear_use_spike': False, 'bear_rsi_required': False, 'sideways_strategy': 'breakout', 'sideways_bb_std_mult': 2.668261842230206, 'sideways_rsi_os': 12, 'sideways_rsi_ob': 66, 'sideways_adx_thresh': 15.220222537381643, 'sideways_atr_min_pct': 0.025468443019754275, 'sideways_atr_max_pct': 0.1296474777356597, 'sideways_tp_mult': 1.6984982952385603, 'sideways_tsl_mult': 0.5147247477274163, 'sideways_time_stop': 176, 'sideways_use_sma': False, 'sideways_use_ema': True, 'sideways_use_atr': True, 'sideways_use_adx': False, 'sideways_use_spike': False, 'sideways_rsi_required': False}.
[I 2025-08-30 14:47:37,184] Trial 226 finished with values: [-0.017192860793427633, 0.01723856758058118] and parameters: {'p_sma': 41, 'p_std': 7, 'p_atr': 23, 'p_adx': 20, 'rsi_period': 79, 'ema1': 15, 'ema2': 35, 'slip_atr_k': 0.20801946878506913, 'slip_spread_k': 0.11076535310974123, 'spread_hl_frac': 0.048289496370235545, 'bb_std_mult': 3.596332684546253, 'rsi_os': 40, 'rsi_ob': 87, 'vol_spike': 0.08957455152874674, 'adx_thresh': 24.443053974561145, 'atr_min_pct': 0.018299868938169022, 'atr_max_pct': 0.09935309251179796, 'tp_mult': 2.1174811966673883, 'tsl_mult': 0.09006053758929154, 'strategy': 'mean_reversion', 'time_stop': 248, 'use_sma': True, 'use_atr': True, 'use_adx': False, 'use_ema': True, 'use_spike': True, 'rsi_required': True, 'edge_k': 1.312765697253406, 'edge_cap': 0.4767136258537436, 'bull_strategy': 'mean_reversion', 'bull_bb_std_mult': 2.1765935003562866, 'bull_rsi_os': 41, 'bull_rsi_ob': 83, 'bull_adx_thresh': 20.537305213175443, 'bull_atr_min_pct': 0.0022592336520990807, 'bull_atr_max_pct': 0.026920552555757003, 'bull_tp_mult': 1.3009275548408286, 'bull_tsl_mult': 0.2819198942224904, 'bull_time_stop': 84, 'bull_use_sma': False, 'bull_use_ema': False, 'bull_use_atr': False, 'bull_use_adx': True, 'bull_use_spike': False, 'bull_rsi_required': False, 'bear_strategy': 'breakout', 'bear_bb_std_mult': 3.454782277788362, 'bear_rsi_os': 32, 'bear_rsi_ob': 63, 'bear_adx_thresh': 29.12853294926564, 'bear_atr_min_pct': 0.02906516891821027, 'bear_atr_max_pct': 0.14264772970700387, 'bear_tp_mult': 1.3341015973929249, 'bear_tsl_mult': 0.8164035434885443, 'bear_time_stop': 12, 'bear_use_sma': False, 'bear_use_ema': False, 'bear_use_atr': False, 'bear_use_adx': False, 'bear_use_spike': False, 'bear_rsi_required': False, 'sideways_strategy': 'breakout', 'sideways_bb_std_mult': 2.0485920894440484, 'sideways_rsi_os': 46, 'sideways_rsi_ob': 67, 'sideways_adx_thresh': 25.549137717764363, 'sideways_atr_min_pct': 0.026873172923419078, 'sideways_atr_max_pct': 0.11078386549390692, 'sideways_tp_mult': 2.362060534331014, 'sideways_tsl_mult': 0.09937963368606134, 'sideways_time_stop': 174, 'sideways_use_sma': False, 'sideways_use_ema': True, 'sideways_use_atr': True, 'sideways_use_adx': False, 'sideways_use_spike': False, 'sideways_rsi_required': False}.
[I 2025-08-30 14:47:40,335] Trial 227 finished with values: [-1000000000.0, 1000000000.0] and parameters: {'p_sma': 40, 'p_std': 7, 'p_atr': 10, 'p_adx': 20, 'rsi_period': 21, 'ema1': 15, 'ema2': 35, 'slip_atr_k': 0.07814199755522758, 'slip_spread_k': 0.8860864046437438, 'spread_hl_frac': 0.04886532503797698, 'bb_std_mult': 3.5174314028993146, 'rsi_os': 40, 'rsi_ob': 89, 'vol_spike': 0.08498543045491855, 'adx_thresh': 24.18968003431843, 'atr_min_pct': 0.029448161366697985, 'atr_max_pct': 0.12337270779504268, 'tp_mult': 2.108174838973088, 'tsl_mult': 0.09191444230848281, 'strategy': 'mean_reversion', 'time_stop': 46, 'use_sma': True, 'use_atr': True, 'use_adx': False, 'use_ema': True, 'use_spike': True, 'rsi_required': True, 'edge_k': 0.8863251327510681, 'edge_cap': 0.5490916677143465, 'bull_strategy': 'mean_reversion', 'bull_bb_std_mult': 1.8978050508491437, 'bull_rsi_os': 41, 'bull_rsi_ob': 64, 'bull_adx_thresh': 21.341531329003303, 'bull_atr_min_pct': 0.0019362720690981518, 'bull_atr_max_pct': 0.10932182298009595, 'bull_tp_mult': 1.6923455613628993, 'bull_tsl_mult': 0.7107530405112064, 'bull_time_stop': 108, 'bull_use_sma': False, 'bull_use_ema': True, 'bull_use_atr': False, 'bull_use_adx': True, 'bull_use_spike': True, 'bull_rsi_required': False, 'bear_strategy': 'breakout', 'bear_bb_std_mult': 1.1922995739606195, 'bear_rsi_os': 21, 'bear_rsi_ob': 86, 'bear_adx_thresh': 10.233150465281778, 'bear_atr_min_pct': 0.00995974753094619, 'bear_atr_max_pct': 0.14328593830903308, 'bear_tp_mult': 1.930129301290844, 'bear_tsl_mult': 0.5233276970359699, 'bear_time_stop': 151, 'bear_use_sma': False, 'bear_use_ema': False, 'bear_use_atr': False, 'bear_use_adx': False, 'bear_use_spike': False, 'bear_rsi_required': True, 'sideways_strategy': 'breakout', 'sideways_bb_std_mult': 1.9977088402529373, 'sideways_rsi_os': 20, 'sideways_rsi_ob': 67, 'sideways_adx_thresh': 25.789160047208902, 'sideways_atr_min_pct': 0.014842547606029164, 'sideways_atr_max_pct': 0.034591336916288254, 'sideways_tp_mult': 2.880865680820758, 'sideways_tsl_mult': 0.09348690933128934, 'sideways_time_stop': 44, 'sideways_use_sma': False, 'sideways_use_ema': True, 'sideways_use_atr': True, 'sideways_use_adx': False, 'sideways_use_spike': True, 'sideways_rsi_required': False}.
[I 2025-08-30 14:47:52,119] Trial 228 finished with values: [-1000000000.0, 1000000000.0] and parameters: {'p_sma': 45, 'p_std': 5, 'p_atr': 21, 'p_adx': 20, 'rsi_period': 23, 'ema1': 14, 'ema2': 45, 'slip_atr_k': 0.2442180477226503, 'slip_spread_k': 0.10715072171093093, 'spread_hl_frac': 0.009918369369968224, 'bb_std_mult': 3.5981467428626592, 'rsi_os': 12, 'rsi_ob': 85, 'vol_spike': 0.08728659282958942, 'adx_thresh': 14.673633551043386, 'atr_min_pct': 0.0031928875383024254, 'atr_max_pct': 0.06866895516317739, 'tp_mult': 2.139937366965756, 'tsl_mult': 0.5838519183766234, 'strategy': 'mean_reversion', 'time_stop': 226, 'use_sma': True, 'use_atr': True, 'use_adx': False, 'use_ema': True, 'use_spike': True, 'rsi_required': True, 'edge_k': 1.1786931099250122, 'edge_cap': 0.541668321726562, 'bull_strategy': 'mean_reversion', 'bull_bb_std_mult': 2.8491083165186217, 'bull_rsi_os': 43, 'bull_rsi_ob': 54, 'bull_adx_thresh': 21.277415704119626, 'bull_atr_min_pct': 0.0021450341877350164, 'bull_atr_max_pct': 0.040208839091367285, 'bull_tp_mult': 1.2918056146426813, 'bull_tsl_mult': 0.8446867987366544, 'bull_time_stop': 157, 'bull_use_sma': False, 'bull_use_ema': True, 'bull_use_atr': False, 'bull_use_adx': True, 'bull_use_spike': True, 'bull_rsi_required': False, 'bear_strategy': 'breakout', 'bear_bb_std_mult': 3.457257051393612, 'bear_rsi_os': 39, 'bear_rsi_ob': 89, 'bear_adx_thresh': 5.112639753082759, 'bear_atr_min_pct': 0.02744878703494671, 'bear_atr_max_pct': 0.14748260177750128, 'bear_tp_mult': 2.703854454290921, 'bear_tsl_mult': 0.5189338269892689, 'bear_time_stop': 292, 'bear_use_sma': False, 'bear_use_ema': False, 'bear_use_atr': False, 'bear_use_adx': False, 'bear_use_spike': False, 'bear_rsi_required': True, 'sideways_strategy': 'breakout', 'sideways_bb_std_mult': 1.0577548616887276, 'sideways_rsi_os': 44, 'sideways_rsi_ob': 67, 'sideways_adx_thresh': 23.482114509255517, 'sideways_atr_min_pct': 0.014798377305559324, 'sideways_atr_max_pct': 0.10837849107411272, 'sideways_tp_mult': 2.9750715589754213, 'sideways_tsl_mult': 0.8154382910903736, 'sideways_time_stop': 121, 'sideways_use_sma': False, 'sideways_use_ema': False, 'sideways_use_atr': True, 'sideways_use_adx': False, 'sideways_use_spike': True, 'sideways_rsi_required': False}.
[I 2025-08-30 14:48:00,943] Trial 229 finished with values: [-0.01243940187176873, 0.012501100296802502] and parameters: {'p_sma': 45, 'p_std': 5, 'p_atr': 20, 'p_adx': 8, 'rsi_period': 24, 'ema1': 14, 'ema2': 44, 'slip_atr_k': 0.10797749165642184, 'slip_spread_k': 0.1268234057678831, 'spread_hl_frac': 0.011159810270582266, 'bb_std_mult': 3.5131462568294167, 'rsi_os': 12, 'rsi_ob': 85, 'vol_spike': 0.08753516988157298, 'adx_thresh': 15.855798395864493, 'atr_min_pct': 0.0033958782140677234, 'atr_max_pct': 0.07061600057197748, 'tp_mult': 2.1236916860336743, 'tsl_mult': 0.6161969935895839, 'strategy': 'breakout', 'time_stop': 226, 'use_sma': True, 'use_atr': True, 'use_adx': False, 'use_ema': True, 'use_spike': True, 'rsi_required': True, 'edge_k': 0.9686936695533814, 'edge_cap': 0.42394799375599374, 'bull_strategy': 'mean_reversion', 'bull_bb_std_mult': 2.8136587792024907, 'bull_rsi_os': 43, 'bull_rsi_ob': 54, 'bull_adx_thresh': 21.334757260716067, 'bull_atr_min_pct': 0.001916608790047597, 'bull_atr_max_pct': 0.041116560405637825, 'bull_tp_mult': 1.2350311740820028, 'bull_tsl_mult': 0.8363026850848532, 'bull_time_stop': 156, 'bull_use_sma': True, 'bull_use_ema': True, 'bull_use_atr': False, 'bull_use_adx': True, 'bull_use_spike': True, 'bull_rsi_required': False, 'bear_strategy': 'breakout', 'bear_bb_std_mult': 3.4636031776942446, 'bear_rsi_os': 38, 'bear_rsi_ob': 89, 'bear_adx_thresh': 5.128891161024621, 'bear_atr_min_pct': 0.02894141641895153, 'bear_atr_max_pct': 0.14959425126371328, 'bear_tp_mult': 2.7147924914135677, 'bear_tsl_mult': 0.5163200015801317, 'bear_time_stop': 289, 'bear_use_sma': False, 'bear_use_ema': False, 'bear_use_atr': False, 'bear_use_adx': False, 'bear_use_spike': False, 'bear_rsi_required': True, 'sideways_strategy': 'breakout', 'sideways_bb_std_mult': 1.0052684200730881, 'sideways_rsi_os': 44, 'sideways_rsi_ob': 67, 'sideways_adx_thresh': 24.502526846207708, 'sideways_atr_min_pct': 0.014823764008097554, 'sideways_atr_max_pct': 0.021582604151714646, 'sideways_tp_mult': 2.995598189568088, 'sideways_tsl_mult': 0.8093854739832915, 'sideways_time_stop': 123, 'sideways_use_sma': False, 'sideways_use_ema': False, 'sideways_use_atr': True, 'sideways_use_adx': False, 'sideways_use_spike': True, 'sideways_rsi_required': False}.
[I 2025-08-30 14:48:10,022] Trial 230 finished with values: [-0.01141440988958331, 0.011490797850779385] and parameters: {'p_sma': 45, 'p_std': 5, 'p_atr': 20, 'p_adx': 20, 'rsi_period': 23, 'ema1': 14, 'ema2': 45, 'slip_atr_k': 0.10785242970401222, 'slip_spread_k': 0.12168130430715263, 'spread_hl_frac': 0.00970058005991007, 'bb_std_mult': 3.4997568510778523, 'rsi_os': 13, 'rsi_ob': 85, 'vol_spike': 0.08968543108666688, 'adx_thresh': 15.826582423548311, 'atr_min_pct': 0.0033086912577128414, 'atr_max_pct': 0.0699941124147533, 'tp_mult': 2.1112695197105995, 'tsl_mult': 0.5443225133955429, 'strategy': 'breakout', 'time_stop': 224, 'use_sma': True, 'use_atr': True, 'use_adx': False, 'use_ema': True, 'use_spike': False, 'rsi_required': True, 'edge_k': 0.9663486829278949, 'edge_cap': 0.5097149713352845, 'bull_strategy': 'mean_reversion', 'bull_bb_std_mult': 2.831559740317835, 'bull_rsi_os': 5, 'bull_rsi_ob': 54, 'bull_adx_thresh': 13.527115055242447, 'bull_atr_min_pct': 0.0017936892324295238, 'bull_atr_max_pct': 0.04254113406747665, 'bull_tp_mult': 1.2303159673747832, 'bull_tsl_mult': 0.8561718038097763, 'bull_time_stop': 157, 'bull_use_sma': False, 'bull_use_ema': True, 'bull_use_atr': False, 'bull_use_adx': True, 'bull_use_spike': True, 'bull_rsi_required': False, 'bear_strategy': 'breakout', 'bear_bb_std_mult': 3.4549990502770926, 'bear_rsi_os': 38, 'bear_rsi_ob': 89, 'bear_adx_thresh': 5.025874571813067, 'bear_atr_min_pct': 0.02912730561029348, 'bear_atr_max_pct': 0.14938240185206253, 'bear_tp_mult': 2.7198055931388403, 'bear_tsl_mult': 0.5337057282105495, 'bear_time_stop': 274, 'bear_use_sma': False, 'bear_use_ema': False, 'bear_use_atr': False, 'bear_use_adx': False, 'bear_use_spike': False, 'bear_rsi_required': True, 'sideways_strategy': 'breakout', 'sideways_bb_std_mult': 1.0194523252574466, 'sideways_rsi_os': 45, 'sideways_rsi_ob': 64, 'sideways_adx_thresh': 23.811863529834078, 'sideways_atr_min_pct': 0.015095704125026378, 'sideways_atr_max_pct': 0.02193321814874552, 'sideways_tp_mult': 2.9964346576596856, 'sideways_tsl_mult': 0.8103880123640231, 'sideways_time_stop': 120, 'sideways_use_sma': False, 'sideways_use_ema': False, 'sideways_use_atr': True, 'sideways_use_adx': False, 'sideways_use_spike': True, 'sideways_rsi_required': False}.
[I 2025-08-30 14:48:13,056] Trial 231 finished with values: [-0.016301847186311003, 0.016355593332981852] and parameters: {'p_sma': 47, 'p_std': 5, 'p_atr': 20, 'p_adx': 8, 'rsi_period': 24, 'ema1': 14, 'ema2': 44, 'slip_atr_k': 0.11078751530961828, 'slip_spread_k': 0.11665217640115873, 'spread_hl_frac': 0.009823341991916527, 'bb_std_mult': 1.1102528111346885, 'rsi_os': 12, 'rsi_ob': 85, 'vol_spike': 0.09057328197966572, 'adx_thresh': 15.634159719814498, 'atr_min_pct': 0.0033575048434026943, 'atr_max_pct': 0.06898374049487288, 'tp_mult': 2.1464313273301916, 'tsl_mult': 0.6233268125935192, 'strategy': 'breakout', 'time_stop': 227, 'use_sma': True, 'use_atr': False, 'use_adx': False, 'use_ema': True, 'use_spike': False, 'rsi_required': True, 'edge_k': 0.3599938646382981, 'edge_cap': 0.5158887012455814, 'bull_strategy': 'mean_reversion', 'bull_bb_std_mult': 2.8222396633017164, 'bull_rsi_os': 5, 'bull_rsi_ob': 54, 'bull_adx_thresh': 13.398896331015402, 'bull_atr_min_pct': 0.002219295845705779, 'bull_atr_max_pct': 0.03890427651932799, 'bull_tp_mult': 1.2295346590031397, 'bull_tsl_mult': 0.8595432406233584, 'bull_time_stop': 155, 'bull_use_sma': False, 'bull_use_ema': False, 'bull_use_atr': False, 'bull_use_adx': True, 'bull_use_spike': False, 'bull_rsi_required': False, 'bear_strategy': 'breakout', 'bear_bb_std_mult': 3.439180648862732, 'bear_rsi_os': 39, 'bear_rsi_ob': 89, 'bear_adx_thresh': 5.149020299172286, 'bear_atr_min_pct': 0.029175905634146564, 'bear_atr_max_pct': 0.1498359908332551, 'bear_tp_mult': 2.537507709981961, 'bear_tsl_mult': 0.513422545659225, 'bear_time_stop': 273, 'bear_use_sma': False, 'bear_use_ema': True, 'bear_use_atr': False, 'bear_use_adx': False, 'bear_use_spike': False, 'bear_rsi_required': False, 'sideways_strategy': 'breakout', 'sideways_bb_std_mult': 1.065868192734498, 'sideways_rsi_os': 44, 'sideways_rsi_ob': 64, 'sideways_adx_thresh': 23.07407714151943, 'sideways_atr_min_pct': 0.00682960748439305, 'sideways_atr_max_pct': 0.02120140344695625, 'sideways_tp_mult': 2.978095561490887, 'sideways_tsl_mult': 0.8082432791874591, 'sideways_time_stop': 107, 'sideways_use_sma': True, 'sideways_use_ema': False, 'sideways_use_atr': False, 'sideways_use_adx': False, 'sideways_use_spike': True, 'sideways_rsi_required': False}.
[I 2025-08-30 14:48:24,656] Trial 232 finished with values: [-0.015243941464274435, 0.01517406919274247] and parameters: {'p_sma': 29, 'p_std': 5, 'p_atr': 20, 'p_adx': 8, 'rsi_period': 24, 'ema1': 14, 'ema2': 45, 'slip_atr_k': 0.09220431782293824, 'slip_spread_k': 0.13684211015534833, 'spread_hl_frac': 0.008363625856364174, 'bb_std_mult': 1.2727696757315652, 'rsi_os': 13, 'rsi_ob': 85, 'vol_spike': 0.0921744253219739, 'adx_thresh': 19.359674497092673, 'atr_min_pct': 0.0034553866699580677, 'atr_max_pct': 0.07072569648594587, 'tp_mult': 2.168302913273973, 'tsl_mult': 0.6213192657808866, 'strategy': 'breakout', 'time_stop': 237, 'use_sma': True, 'use_atr': False, 'use_adx': False, 'use_ema': False, 'use_spike': False, 'rsi_required': True, 'edge_k': 1.700768560711637, 'edge_cap': 0.47813597894632137, 'bull_strategy': 'mean_reversion', 'bull_bb_std_mult': 2.788473214508741, 'bull_rsi_os': 44, 'bull_rsi_ob': 54, 'bull_adx_thresh': 13.890022851223833, 'bull_atr_min_pct': 0.002840159653159159, 'bull_atr_max_pct': 0.037898604179342536, 'bull_tp_mult': 1.2305793082938699, 'bull_tsl_mult': 0.8583161567003642, 'bull_time_stop': 153, 'bull_use_sma': True, 'bull_use_ema': False, 'bull_use_atr': False, 'bull_use_adx': False, 'bull_use_spike': False, 'bull_rsi_required': False, 'bear_strategy': 'breakout', 'bear_bb_std_mult': 3.458739293055484, 'bear_rsi_os': 32, 'bear_rsi_ob': 88, 'bear_adx_thresh': 6.448422097135047, 'bear_atr_min_pct': 0.02367594864259264, 'bear_atr_max_pct': 0.14885225068940705, 'bear_tp_mult': 2.8096531612976348, 'bear_tsl_mult': 0.5445601202660658, 'bear_time_stop': 265, 'bear_use_sma': False, 'bear_use_ema': True, 'bear_use_atr': False, 'bear_use_adx': False, 'bear_use_spike': False, 'bear_rsi_required': False, 'sideways_strategy': 'mean_reversion', 'sideways_bb_std_mult': 0.9091713454631547, 'sideways_rsi_os': 44, 'sideways_rsi_ob': 64, 'sideways_adx_thresh': 22.73521392873893, 'sideways_atr_min_pct': 0.016349760548241093, 'sideways_atr_max_pct': 0.08459424971552289, 'sideways_tp_mult': 2.999250990597706, 'sideways_tsl_mult': 0.8047690872884982, 'sideways_time_stop': 85, 'sideways_use_sma': True, 'sideways_use_ema': True, 'sideways_use_atr': False, 'sideways_use_adx': False, 'sideways_use_spike': False, 'sideways_rsi_required': True}.
[I 2025-08-30 14:48:32,622] Trial 233 finished with values: [-0.008077522616171118, 0.008130540263722959] and parameters: {'p_sma': 43, 'p_std': 5, 'p_atr': 20, 'p_adx': 8, 'rsi_period': 24, 'ema1': 14, 'ema2': 45, 'slip_atr_k': 0.029888862544062728, 'slip_spread_k': 0.13035172938556144, 'spread_hl_frac': 0.008427205380194482, 'bb_std_mult': 3.493347240653369, 'rsi_os': 10, 'rsi_ob': 85, 'vol_spike': 0.09070485766684856, 'adx_thresh': 16.011678829351197, 'atr_min_pct': 0.0035602776308042185, 'atr_max_pct': 0.07095393809527285, 'tp_mult': 2.1649516019568718, 'tsl_mult': 0.6240273564428103, 'strategy': 'breakout', 'time_stop': 237, 'use_sma': True, 'use_atr': False, 'use_adx': False, 'use_ema': False, 'use_spike': False, 'rsi_required': True, 'edge_k': 0.3672866422976582, 'edge_cap': 0.5096977822131445, 'bull_strategy': 'mean_reversion', 'bull_bb_std_mult': 2.7953821601824043, 'bull_rsi_os': 43, 'bull_rsi_ob': 48, 'bull_adx_thresh': 21.873321712553054, 'bull_atr_min_pct': 0.0029454585230408027, 'bull_atr_max_pct': 0.04302127422939875, 'bull_tp_mult': 1.2314536748265033, 'bull_tsl_mult': 0.9059462635633421, 'bull_time_stop': 147, 'bull_use_sma': False, 'bull_use_ema': False, 'bull_use_atr': False, 'bull_use_adx': False, 'bull_use_spike': False, 'bull_rsi_required': False, 'bear_strategy': 'breakout', 'bear_bb_std_mult': 3.4624367356596, 'bear_rsi_os': 35, 'bear_rsi_ob': 88, 'bear_adx_thresh': 6.4061769064438225, 'bear_atr_min_pct': 0.028832522342144073, 'bear_atr_max_pct': 0.14922199479879286, 'bear_tp_mult': 2.8210650709651013, 'bear_tsl_mult': 0.5461123947206795, 'bear_time_stop': 288, 'bear_use_sma': False, 'bear_use_ema': True, 'bear_use_atr': False, 'bear_use_adx': False, 'bear_use_spike': False, 'bear_rsi_required': False, 'sideways_strategy': 'mean_reversion', 'sideways_bb_std_mult': 0.9220502978676437, 'sideways_rsi_os': 42, 'sideways_rsi_ob': 64, 'sideways_adx_thresh': 22.315503978373066, 'sideways_atr_min_pct': 0.019394510959227385, 'sideways_atr_max_pct': 0.07646063134035454, 'sideways_tp_mult': 2.9978550926154344, 'sideways_tsl_mult': 0.8003404869804027, 'sideways_time_stop': 107, 'sideways_use_sma': True, 'sideways_use_ema': False, 'sideways_use_atr': False, 'sideways_use_adx': False, 'sideways_use_spike': False, 'sideways_rsi_required': True}.
