[I 2025-08-30 15:19:50,705] Trial 432 finished with values: [-1000000000.0, 1000000000.0] and parameters: {'p_sma': 17, 'p_std': 27, 'p_atr': 11, 'p_adx': 26, 'rsi_period': 53, 'ema1': 29, 'ema2': 38, 'slip_atr_k': 0.1308087825072307, 'slip_spread_k': 0.8016374543206622, 'spread_hl_frac': 0.015964637323240105, 'bb_std_mult': 3.199691732798787, 'rsi_os': 24, 'rsi_ob': 48, 'vol_spike': 0.19510908874068225, 'adx_thresh': 8.95773653794667, 'atr_min_pct': 0.008887318883344235, 'atr_max_pct': 0.11919032102763104, 'tp_mult': 1.7643724072989138, 'tsl_mult': 0.546642694628013, 'strategy': 'breakout', 'time_stop': 125, 'use_sma': False, 'use_atr': False, 'use_adx': True, 'use_ema': False, 'use_spike': True, 'rsi_required': False, 'edge_k': 0.6247223261034738, 'edge_cap': 0.5855950870261916, 'bull_strategy': 'breakout', 'bull_bb_std_mult': 1.4749828707865174, 'bull_rsi_os': 15, 'bull_rsi_ob': 91, 'bull_adx_thresh': 10.444502329270053, 'bull_atr_min_pct': 0.016020137351772566, 'bull_atr_max_pct': 0.11240890457716404, 'bull_tp_mult': 2.6042130834783563, 'bull_tsl_mult': 0.10822076557520921, 'bull_time_stop': 48, 'bull_use_sma': True, 'bull_use_ema': True, 'bull_use_atr': True, 'bull_use_adx': False, 'bull_use_spike': True, 'bull_rsi_required': False, 'bear_strategy': 'mean_reversion', 'bear_bb_std_mult': 1.5108653726335253, 'bear_rsi_os': 29, 'bear_rsi_ob': 74, 'bear_adx_thresh': 9.966794693483877, 'bear_atr_min_pct': 0.0020130282165289042, 'bear_atr_max_pct': 0.08301974906795573, 'bear_tp_mult': 2.352335816484854, 'bear_tsl_mult': 0.5833757707172906, 'bear_time_stop': 70, 'bear_use_sma': True, 'bear_use_ema': False, 'bear_use_atr': True, 'bear_use_adx': True, 'bear_use_spike': True, 'bear_rsi_required': True, 'sideways_strategy': 'mean_reversion', 'sideways_bb_std_mult': 3.2118618575756797, 'sideways_rsi_os': 31, 'sideways_rsi_ob': 47, 'sideways_adx_thresh': 9.019003832264605, 'sideways_atr_min_pct': 0.006920534280715882, 'sideways_atr_max_pct': 0.08596860445713846, 'sideways_tp_mult': 2.2252020136678494, 'sideways_tsl_mult': 0.3819751345374178, 'sideways_time_stop': 49, 'sideways_use_sma': True, 'sideways_use_ema': False, 'sideways_use_atr': True, 'sideways_use_adx': True, 'sideways_use_spike': True, 'sideways_rsi_required': True}.
[I 2025-08-30 15:20:35,814] Trial 433 finished with values: [-1000000000.0, 1000000000.0] and parameters: {'p_sma': 15, 'p_std': 25, 'p_atr': 11, 'p_adx': 26, 'rsi_period': 12, 'ema1': 29, 'ema2': 37, 'slip_atr_k': 0.009488267695531356, 'slip_spread_k': 0.768353926051194, 'spread_hl_frac': 0.005532658502588415, 'bb_std_mult': 3.089690039025138, 'rsi_os': 25, 'rsi_ob': 62, 'vol_spike': 0.20932698902790176, 'adx_thresh': 7.854556897251945, 'atr_min_pct': 0.008865532593723123, 'atr_max_pct': 0.11745506027108206, 'tp_mult': 1.7509157814964587, 'tsl_mult': 0.3382844079143662, 'strategy': 'mean_reversion', 'time_stop': 136, 'use_sma': False, 'use_atr': False, 'use_adx': True, 'use_ema': False, 'use_spike': False, 'rsi_required': False, 'edge_k': 0.6272948882923085, 'edge_cap': 0.2334845297260031, 'bull_strategy': 'breakout', 'bull_bb_std_mult': 1.6077091093018745, 'bull_rsi_os': 22, 'bull_rsi_ob': 91, 'bull_adx_thresh': 10.674579362645247, 'bull_atr_min_pct': 0.016291494320212742, 'bull_atr_max_pct': 0.11122744362848087, 'bull_tp_mult': 2.698512097202173, 'bull_tsl_mult': 0.24841270381599256, 'bull_time_stop': 45, 'bull_use_sma': True, 'bull_use_ema': True, 'bull_use_atr': True, 'bull_use_adx': False, 'bull_use_spike': True, 'bull_rsi_required': False, 'bear_strategy': 'mean_reversion', 'bear_bb_std_mult': 1.267533696216145, 'bear_rsi_os': 8, 'bear_rsi_ob': 74, 'bear_adx_thresh': 16.85461309900595, 'bear_atr_min_pct': 0.0010548449805441612, 'bear_atr_max_pct': 0.08167861044839075, 'bear_tp_mult': 2.372820949880134, 'bear_tsl_mult': 0.5726034025918633, 'bear_time_stop': 96, 'bear_use_sma': True, 'bear_use_ema': False, 'bear_use_atr': True, 'bear_use_adx': True, 'bear_use_spike': True, 'bear_rsi_required': True, 'sideways_strategy': 'mean_reversion', 'sideways_bb_std_mult': 3.228141809212742, 'sideways_rsi_os': 31, 'sideways_rsi_ob': 51, 'sideways_adx_thresh': 8.416731703371246, 'sideways_atr_min_pct': 0.025979917938061384, 'sideways_atr_max_pct': 0.07964039915201548, 'sideways_tp_mult': 2.227865491239607, 'sideways_tsl_mult': 0.30448185794383903, 'sideways_time_stop': 15, 'sideways_use_sma': True, 'sideways_use_ema': False, 'sideways_use_atr': True, 'sideways_use_adx': True, 'sideways_use_spike': True, 'sideways_rsi_required': False}.
[I 2025-08-30 15:20:36,102] Trial 434 finished with values: [-0.006491315647197959, 0.008644259134878225] and parameters: {'p_sma': 17, 'p_std': 25, 'p_atr': 12, 'p_adx': 26, 'rsi_period': 9, 'ema1': 24, 'ema2': 37, 'slip_atr_k': 9.805776091381885e-05, 'slip_spread_k': 0.6598504583953433, 'spread_hl_frac': 0.01816058045881307, 'bb_std_mult': 2.6163981382948553, 'rsi_os': 25, 'rsi_ob': 55, 'vol_spike': 0.2006809615722566, 'adx_thresh': 7.571302088175613, 'atr_min_pct': 0.009079073083325175, 'atr_max_pct': 0.11884510157637401, 'tp_mult': 1.551756617694509, 'tsl_mult': 0.5481814658025753, 'strategy': 'mean_reversion', 'time_stop': 133, 'use_sma': False, 'use_atr': False, 'use_adx': True, 'use_ema': False, 'use_spike': False, 'rsi_required': False, 'edge_k': 0.5378109254643408, 'edge_cap': 0.9985504323321172, 'bull_strategy': 'breakout', 'bull_bb_std_mult': 1.6076403461258997, 'bull_rsi_os': 38, 'bull_rsi_ob': 91, 'bull_adx_thresh': 8.633664898675669, 'bull_atr_min_pct': 0.023642506618817158, 'bull_atr_max_pct': 0.11171404339287469, 'bull_tp_mult': 2.683769444192135, 'bull_tsl_mult': 0.10567636978079303, 'bull_time_stop': 43, 'bull_use_sma': True, 'bull_use_ema': True, 'bull_use_atr': True, 'bull_use_adx': False, 'bull_use_spike': True, 'bull_rsi_required': False, 'bear_strategy': 'mean_reversion', 'bear_bb_std_mult': 1.2558112104687396, 'bear_rsi_os': 29, 'bear_rsi_ob': 73, 'bear_adx_thresh': 10.041359848210528, 'bear_atr_min_pct': 0.003231370658457758, 'bear_atr_max_pct': 0.08324687309753621, 'bear_tp_mult': 2.7186223373277474, 'bear_tsl_mult': 0.5799651890030617, 'bear_time_stop': 98, 'bear_use_sma': True, 'bear_use_ema': False, 'bear_use_atr': True, 'bear_use_adx': True, 'bear_use_spike': True, 'bear_rsi_required': True, 'sideways_strategy': 'mean_reversion', 'sideways_bb_std_mult': 3.302141596885371, 'sideways_rsi_os': 31, 'sideways_rsi_ob': 49, 'sideways_adx_thresh': 9.783775161856674, 'sideways_atr_min_pct': 0.02609008331316284, 'sideways_atr_max_pct': 0.13181660129344788, 'sideways_tp_mult': 2.105041318850588, 'sideways_tsl_mult': 0.3473192437731994, 'sideways_time_stop': 255, 'sideways_use_sma': True, 'sideways_use_ema': False, 'sideways_use_atr': True, 'sideways_use_adx': True, 'sideways_use_spike': True, 'sideways_rsi_required': True}.
[I 2025-08-30 15:20:36,413] Trial 435 finished with values: [-0.026733863055796836, 0.026851902220709944] and parameters: {'p_sma': 17, 'p_std': 30, 'p_atr': 12, 'p_adx': 27, 'rsi_period': 12, 'ema1': 25, 'ema2': 36, 'slip_atr_k': 0.009947457301434585, 'slip_spread_k': 0.7697141517811017, 'spread_hl_frac': 0.017871211452123767, 'bb_std_mult': 3.115884944129864, 'rsi_os': 25, 'rsi_ob': 88, 'vol_spike': 0.007615272895263259, 'adx_thresh': 7.818431767929761, 'atr_min_pct': 0.008805188695670702, 'atr_max_pct': 0.11821808315529037, 'tp_mult': 1.6331791922267782, 'tsl_mult': 0.7913812833386031, 'strategy': 'mean_reversion', 'time_stop': 137, 'use_sma': False, 'use_atr': False, 'use_adx': True, 'use_ema': False, 'use_spike': True, 'rsi_required': False, 'edge_k': 0.5254761069905917, 'edge_cap': 0.240160240081852, 'bull_strategy': 'breakout', 'bull_bb_std_mult': 1.6028152619877178, 'bull_rsi_os': 22, 'bull_rsi_ob': 91, 'bull_adx_thresh': 10.338522295460095, 'bull_atr_min_pct': 0.005321082381923902, 'bull_atr_max_pct': 0.10697493313262998, 'bull_tp_mult': 2.609811888602074, 'bull_tsl_mult': 0.7204649959374344, 'bull_time_stop': 44, 'bull_use_sma': True, 'bull_use_ema': True, 'bull_use_atr': True, 'bull_use_adx': False, 'bull_use_spike': True, 'bull_rsi_required': False, 'bear_strategy': 'mean_reversion', 'bear_bb_std_mult': 2.3859699193959676, 'bear_rsi_os': 29, 'bear_rsi_ob': 78, 'bear_adx_thresh': 10.124465865519968, 'bear_atr_min_pct': 0.0010126278078540201, 'bear_atr_max_pct': 0.10051073168483521, 'bear_tp_mult': 2.394248581641855, 'bear_tsl_mult': 0.9827610754851952, 'bear_time_stop': 98, 'bear_use_sma': True, 'bear_use_ema': False, 'bear_use_atr': True, 'bear_use_adx': True, 'bear_use_spike': True, 'bear_rsi_required': True, 'sideways_strategy': 'mean_reversion', 'sideways_bb_std_mult': 3.3332501567359, 'sideways_rsi_os': 31, 'sideways_rsi_ob': 49, 'sideways_adx_thresh': 9.52818613462439, 'sideways_atr_min_pct': 0.027881598000049093, 'sideways_atr_max_pct': 0.14974679323587792, 'sideways_tp_mult': 2.104429466096513, 'sideways_tsl_mult': 0.3783392156546874, 'sideways_time_stop': 116, 'sideways_use_sma': True, 'sideways_use_ema': False, 'sideways_use_atr': True, 'sideways_use_adx': True, 'sideways_use_spike': True, 'sideways_rsi_required': True}.
[I 2025-08-30 15:20:36,591] Trial 436 finished with values: [-1000000000.0, 1000000000.0] and parameters: {'p_sma': 15, 'p_std': 31, 'p_atr': 12, 'p_adx': 27, 'rsi_period': 12, 'ema1': 25, 'ema2': 37, 'slip_atr_k': 0.007615931620433464, 'slip_spread_k': 0.6594059144295186, 'spread_hl_frac': 0.018096735338555346, 'bb_std_mult': 3.1110007080170887, 'rsi_os': 25, 'rsi_ob': 88, 'vol_spike': 0.13444946953713927, 'adx_thresh': 7.752446923045562, 'atr_min_pct': 0.023714801560808463, 'atr_max_pct': 0.11540067190256595, 'tp_mult': 1.663709207352082, 'tsl_mult': 0.3479122578395911, 'strategy': 'mean_reversion', 'time_stop': 137, 'use_sma': False, 'use_atr': False, 'use_adx': True, 'use_ema': False, 'use_spike': False, 'rsi_required': False, 'edge_k': 0.5335006993853423, 'edge_cap': 0.8872368322639768, 'bull_strategy': 'breakout', 'bull_bb_std_mult': 1.5799905994586791, 'bull_rsi_os': 22, 'bull_rsi_ob': 89, 'bull_adx_thresh': 14.032985629793087, 'bull_atr_min_pct': 0.009027508601006606, 'bull_atr_max_pct': 0.10829959874530071, 'bull_tp_mult': 2.524930549354927, 'bull_tsl_mult': 0.944379295163372, 'bull_time_stop': 46, 'bull_use_sma': True, 'bull_use_ema': True, 'bull_use_atr': True, 'bull_use_adx': False, 'bull_use_spike': True, 'bull_rsi_required': False, 'bear_strategy': 'mean_reversion', 'bear_bb_std_mult': 1.3054695329975567, 'bear_rsi_os': 50, 'bear_rsi_ob': 78, 'bear_adx_thresh': 13.02378813461037, 'bear_atr_min_pct': 0.005387019035798116, 'bear_atr_max_pct': 0.10037686593754391, 'bear_tp_mult': 2.489720001215778, 'bear_tsl_mult': 0.24326764291510417, 'bear_time_stop': 98, 'bear_use_sma': True, 'bear_use_ema': False, 'bear_use_atr': True, 'bear_use_adx': True, 'bear_use_spike': True, 'bear_rsi_required': True, 'sideways_strategy': 'mean_reversion', 'sideways_bb_std_mult': 3.2831803946764477, 'sideways_rsi_os': 32, 'sideways_rsi_ob': 49, 'sideways_adx_thresh': 9.72596884921919, 'sideways_atr_min_pct': 0.015760478613015386, 'sideways_atr_max_pct': 0.045323026879918925, 'sideways_tp_mult': 2.097308445392794, 'sideways_tsl_mult': 0.34398104289924564, 'sideways_time_stop': 280, 'sideways_use_sma': True, 'sideways_use_ema': False, 'sideways_use_atr': True, 'sideways_use_adx': True, 'sideways_use_spike': True, 'sideways_rsi_required': True}.
[I 2025-08-30 15:21:24,538] Trial 438 finished with values: [-1000000000.0, 1000000000.0] and parameters: {'p_sma': 19, 'p_std': 31, 'p_atr': 12, 'p_adx': 27, 'rsi_period': 13, 'ema1': 25, 'ema2': 35, 'slip_atr_k': 0.14733269066909077, 'slip_spread_k': 0.7354970795182774, 'spread_hl_frac': 0.005723920247013474, 'bb_std_mult': 2.6015681755519537, 'rsi_os': 23, 'rsi_ob': 88, 'vol_spike': 0.21561738184950724, 'adx_thresh': 7.639905365300849, 'atr_min_pct': 0.007982316764832565, 'atr_max_pct': 0.11488389261900382, 'tp_mult': 1.6364175606634275, 'tsl_mult': 0.8014925603717535, 'strategy': 'breakout', 'time_stop': 150, 'use_sma': False, 'use_atr': False, 'use_adx': True, 'use_ema': False, 'use_spike': False, 'rsi_required': False, 'edge_k': 0.5322935287284096, 'edge_cap': 0.8892224225822326, 'bull_strategy': 'breakout', 'bull_bb_std_mult': 1.7204679559616638, 'bull_rsi_os': 37, 'bull_rsi_ob': 89, 'bull_adx_thresh': 14.14961655818339, 'bull_atr_min_pct': 0.024839008628163364, 'bull_atr_max_pct': 0.10155219148425652, 'bull_tp_mult': 2.4512044670338486, 'bull_tsl_mult': 0.8717145465288829, 'bull_time_stop': 40, 'bull_use_sma': True, 'bull_use_ema': True, 'bull_use_atr': True, 'bull_use_adx': False, 'bull_use_spike': True, 'bull_rsi_required': False, 'bear_strategy': 'mean_reversion', 'bear_bb_std_mult': 1.8957908359512503, 'bear_rsi_os': 27, 'bear_rsi_ob': 71, 'bear_adx_thresh': 13.332626822408079, 'bear_atr_min_pct': 0.0032545896112992274, 'bear_atr_max_pct': 0.10115049851207791, 'bear_tp_mult': 2.745539287381802, 'bear_tsl_mult': 0.25484105964419357, 'bear_time_stop': 98, 'bear_use_sma': True, 'bear_use_ema': False, 'bear_use_atr': True, 'bear_use_adx': True, 'bear_use_spike': True, 'bear_rsi_required': True, 'sideways_strategy': 'mean_reversion', 'sideways_bb_std_mult': 3.1230036104132344, 'sideways_rsi_os': 32, 'sideways_rsi_ob': 49, 'sideways_adx_thresh': 13.539151546316432, 'sideways_atr_min_pct': 0.015396569076438101, 'sideways_atr_max_pct': 0.08217578267960295, 'sideways_tp_mult': 2.1127011696234246, 'sideways_tsl_mult': 0.35011560099696587, 'sideways_time_stop': 120, 'sideways_use_sma': True, 'sideways_use_ema': False, 'sideways_use_atr': True, 'sideways_use_adx': True, 'sideways_use_spike': True, 'sideways_rsi_required': True}.
[I 2025-08-30 15:21:25,184] Trial 437 finished with values: [-1000000000.0, 1000000000.0] and parameters: {'p_sma': 19, 'p_std': 31, 'p_atr': 12, 'p_adx': 27, 'rsi_period': 51, 'ema1': 26, 'ema2': 36, 'slip_atr_k': 2.9817003523079305e-05, 'slip_spread_k': 0.6669959416259612, 'spread_hl_frac': 0.03338885320342548, 'bb_std_mult': 0.5675947049360575, 'rsi_os': 23, 'rsi_ob': 87, 'vol_spike': 0.007671539242054826, 'adx_thresh': 7.830802668166608, 'atr_min_pct': 0.006374727261945399, 'atr_max_pct': 0.11506569687390733, 'tp_mult': 1.643325159120238, 'tsl_mult': 0.8148650745190624, 'strategy': 'mean_reversion', 'time_stop': 151, 'use_sma': False, 'use_atr': False, 'use_adx': True, 'use_ema': False, 'use_spike': False, 'rsi_required': False, 'edge_k': 0.532497840970226, 'edge_cap': 0.7250190380383952, 'bull_strategy': 'breakout', 'bull_bb_std_mult': 1.7333856507636496, 'bull_rsi_os': 27, 'bull_rsi_ob': 89, 'bull_adx_thresh': 13.299145012205543, 'bull_atr_min_pct': 0.0050221962627625075, 'bull_atr_max_pct': 0.10809360751266996, 'bull_tp_mult': 2.4808990302509426, 'bull_tsl_mult': 0.7237757118215093, 'bull_time_stop': 39, 'bull_use_sma': True, 'bull_use_ema': True, 'bull_use_atr': True, 'bull_use_adx': True, 'bull_use_spike': True, 'bull_rsi_required': False, 'bear_strategy': 'mean_reversion', 'bear_bb_std_mult': 0.5111489833070005, 'bear_rsi_os': 50, 'bear_rsi_ob': 56, 'bear_adx_thresh': 13.134852325994746, 'bear_atr_min_pct': 0.005477480649156768, 'bear_atr_max_pct': 0.1013971074236937, 'bear_tp_mult': 2.414913835602316, 'bear_tsl_mult': 0.9751595117111224, 'bear_time_stop': 105, 'bear_use_sma': True, 'bear_use_ema': False, 'bear_use_atr': True, 'bear_use_adx': True, 'bear_use_spike': True, 'bear_rsi_required': True, 'sideways_strategy': 'mean_reversion', 'sideways_bb_std_mult': 3.1301979119856442, 'sideways_rsi_os': 32, 'sideways_rsi_ob': 49, 'sideways_adx_thresh': 9.6622043605737, 'sideways_atr_min_pct': 0.0158376980704096, 'sideways_atr_max_pct': 0.08262148077424832, 'sideways_tp_mult': 2.1096723145922516, 'sideways_tsl_mult': 0.34819738201543887, 'sideways_time_stop': 108, 'sideways_use_sma': True, 'sideways_use_ema': False, 'sideways_use_atr': True, 'sideways_use_adx': True, 'sideways_use_spike': True, 'sideways_rsi_required': True}.
[I 2025-08-30 15:21:25,891] Trial 440 finished with values: [-0.0009362838962573283, 0.003720520137447625] and parameters: {'p_sma': 12, 'p_std': 21, 'p_atr': 12, 'p_adx': 24, 'rsi_period': 9, 'ema1': 25, 'ema2': 35, 'slip_atr_k': 0.003177508917990743, 'slip_spread_k': 0.7362123499001242, 'spread_hl_frac': 0.006073316933423037, 'bb_std_mult': 0.6436010406819199, 'rsi_os': 23, 'rsi_ob': 87, 'vol_spike': 0.21756397814034434, 'adx_thresh': 8.534032632570277, 'atr_min_pct': 0.007652451779752285, 'atr_max_pct': 0.11380502275582072, 'tp_mult': 1.561853799020806, 'tsl_mult': 0.3672996817951608, 'strategy': 'breakout', 'time_stop': 151, 'use_sma': False, 'use_atr': False, 'use_adx': True, 'use_ema': False, 'use_spike': False, 'rsi_required': False, 'edge_k': 0.558988401929243, 'edge_cap': 0.9986854512830291, 'bull_strategy': 'breakout', 'bull_bb_std_mult': 1.7038915398389225, 'bull_rsi_os': 47, 'bull_rsi_ob': 90, 'bull_adx_thresh': 8.594484372216499, 'bull_atr_min_pct': 0.01867893670636934, 'bull_atr_max_pct': 0.10211210438051926, 'bull_tp_mult': 2.6708806358726616, 'bull_tsl_mult': 0.8807715037647488, 'bull_time_stop': 39, 'bull_use_sma': True, 'bull_use_ema': True, 'bull_use_atr': True, 'bull_use_adx': True, 'bull_use_spike': True, 'bull_rsi_required': False, 'bear_strategy': 'mean_reversion', 'bear_bb_std_mult': 2.0077628864604997, 'bear_rsi_os': 27, 'bear_rsi_ob': 73, 'bear_adx_thresh': 16.10750289404731, 'bear_atr_min_pct': 0.003176108129907265, 'bear_atr_max_pct': 0.10824634151097501, 'bear_tp_mult': 2.718951104072077, 'bear_tsl_mult': 0.8599511108886058, 'bear_time_stop': 107, 'bear_use_sma': True, 'bear_use_ema': False, 'bear_use_atr': True, 'bear_use_adx': True, 'bear_use_spike': True, 'bear_rsi_required': True, 'sideways_strategy': 'mean_reversion', 'sideways_bb_std_mult': 3.075375520329041, 'sideways_rsi_os': 32, 'sideways_rsi_ob': 79, 'sideways_adx_thresh': 10.356288500681943, 'sideways_atr_min_pct': 0.021086971023428786, 'sideways_atr_max_pct': 0.07674713476282016, 'sideways_tp_mult': 2.1518664837701356, 'sideways_tsl_mult': 0.36549756149250684, 'sideways_time_stop': 134, 'sideways_use_sma': True, 'sideways_use_ema': False, 'sideways_use_atr': True, 'sideways_use_adx': True, 'sideways_use_spike': True, 'sideways_rsi_required': True}.
[I 2025-08-30 15:21:26,423] Trial 439 finished with values: [-1000000000.0, 1000000000.0] and parameters: {'p_sma': 15, 'p_std': 31, 'p_atr': 12, 'p_adx': 24, 'rsi_period': 51, 'ema1': 25, 'ema2': 35, 'slip_atr_k': 0.00010554792852559072, 'slip_spread_k': 0.6658842832301831, 'spread_hl_frac': 0.005784727088238285, 'bb_std_mult': 3.273245739627154, 'rsi_os': 23, 'rsi_ob': 87, 'vol_spike': 0.21758984960504046, 'adx_thresh': 8.396435404966285, 'atr_min_pct': 0.00785883588214878, 'atr_max_pct': 0.055005599210523975, 'tp_mult': 1.647238205247176, 'tsl_mult': 0.9268310982340779, 'strategy': 'breakout', 'time_stop': 131, 'use_sma': False, 'use_atr': False, 'use_adx': True, 'use_ema': False, 'use_spike': False, 'rsi_required': False, 'edge_k': 0.5523236917583974, 'edge_cap': 0.8839372059576627, 'bull_strategy': 'breakout', 'bull_bb_std_mult': 1.7427727443745467, 'bull_rsi_os': 47, 'bull_rsi_ob': 90, 'bull_adx_thresh': 14.297314995234476, 'bull_atr_min_pct': 0.024656436484399826, 'bull_atr_max_pct': 0.10090808305454615, 'bull_tp_mult': 2.441615581462797, 'bull_tsl_mult': 0.873559367174716, 'bull_time_stop': 39, 'bull_use_sma': True, 'bull_use_ema': True, 'bull_use_atr': True, 'bull_use_adx': True, 'bull_use_spike': True, 'bull_rsi_required': False, 'bear_strategy': 'mean_reversion', 'bear_bb_std_mult': 2.4867112881288422, 'bear_rsi_os': 28, 'bear_rsi_ob': 71, 'bear_adx_thresh': 13.069697842901675, 'bear_atr_min_pct': 0.0030899381534699438, 'bear_atr_max_pct': 0.13555988788701648, 'bear_tp_mult': 2.752006997096077, 'bear_tsl_mult': 0.2326021126188514, 'bear_time_stop': 88, 'bear_use_sma': True, 'bear_use_ema': False, 'bear_use_atr': True, 'bear_use_adx': True, 'bear_use_spike': True, 'bear_rsi_required': True, 'sideways_strategy': 'mean_reversion', 'sideways_bb_std_mult': 3.129065233285143, 'sideways_rsi_os': 27, 'sideways_rsi_ob': 79, 'sideways_adx_thresh': 13.383534913516808, 'sideways_atr_min_pct': 0.01604867796494543, 'sideways_atr_max_pct': 0.08244233078160501, 'sideways_tp_mult': 2.12836121991184, 'sideways_tsl_mult': 0.3452477718728361, 'sideways_time_stop': 122, 'sideways_use_sma': True, 'sideways_use_ema': False, 'sideways_use_atr': True, 'sideways_use_adx': True, 'sideways_use_spike': True, 'sideways_rsi_required': True}.
