[I 2025-08-30 16:44:25,591] Trial 855 finished with values: [-1000000000.0, 1000000000.0] and parameters: {'p_sma': 29, 'p_std': 29, 'p_atr': 20, 'p_adx': 15, 'rsi_period': 57, 'ema1': 25, 'ema2': 58, 'slip_atr_k': 0.08613010832617257, 'slip_spread_k': 0.9700988943557916, 'spread_hl_frac': 0.006573964855610364, 'bb_std_mult': 0.6358774644499492, 'rsi_os': 11, 'rsi_ob': 86, 'vol_spike': 0.11208356427730909, 'adx_thresh': 9.504846836042514, 'atr_min_pct': 0.01633232145672491, 'atr_max_pct': 0.024806427655243504, 'tp_mult': 2.67515906731073, 'tsl_mult': 0.2647301849092185, 'strategy': 'breakout', 'time_stop': 6, 'use_sma': False, 'use_atr': False, 'use_adx': True, 'use_ema': False, 'use_spike': False, 'rsi_required': False, 'edge_k': 0.5741812616562091, 'edge_cap': 0.9513876596347071, 'bull_strategy': 'breakout', 'bull_bb_std_mult': 3.160832419287061, 'bull_rsi_os': 52, 'bull_rsi_ob': 61, 'bull_adx_thresh': 8.06301632306303, 'bull_atr_min_pct': 0.007570280322321766, 'bull_atr_max_pct': 0.14454285105588952, 'bull_tp_mult': 1.4026898111023396, 'bull_tsl_mult': 0.873227429539551, 'bull_time_stop': 49, 'bull_use_sma': True, 'bull_use_ema': False, 'bull_use_atr': False, 'bull_use_adx': True, 'bull_use_spike': True, 'bull_rsi_required': False, 'bear_strategy': 'mean_reversion', 'bear_bb_std_mult': 1.2065584061259553, 'bear_rsi_os': 24, 'bear_rsi_ob': 49, 'bear_adx_thresh': 8.88635690227996, 'bear_atr_min_pct': 0.0037938005887024184, 'bear_atr_max_pct': 0.10137728883672167, 'bear_tp_mult': 2.708500375235413, 'bear_tsl_mult': 0.3976245444966845, 'bear_time_stop': 82, 'bear_use_sma': True, 'bear_use_ema': True, 'bear_use_atr': True, 'bear_use_adx': False, 'bear_use_spike': True, 'bear_rsi_required': True, 'sideways_strategy': 'mean_reversion', 'sideways_bb_std_mult': 3.2394018164621974, 'sideways_rsi_os': 14, 'sideways_rsi_ob': 75, 'sideways_adx_thresh': 9.739622766569266, 'sideways_atr_min_pct': 0.02802750945961829, 'sideways_atr_max_pct': 0.0714562648964827, 'sideways_tp_mult': 1.962820996913997, 'sideways_tsl_mult': 0.37810705214621504, 'sideways_time_stop': 106, 'sideways_use_sma': True, 'sideways_use_ema': False, 'sideways_use_atr': False, 'sideways_use_adx': True, 'sideways_use_spike': True, 'sideways_rsi_required': True}.
[I 2025-08-30 16:45:12,844] Trial 857 finished with values: [-1000000000.0, 1000000000.0] and parameters: {'p_sma': 8, 'p_std': 29, 'p_atr': 12, 'p_adx': 25, 'rsi_period': 8, 'ema1': 13, 'ema2': 40, 'slip_atr_k': 0.15129758278812247, 'slip_spread_k': 0.735282741075049, 'spread_hl_frac': 0.03348250965728529, 'bb_std_mult': 0.8257760296002734, 'rsi_os': 24, 'rsi_ob': 73, 'vol_spike': 0.10878243964894677, 'adx_thresh': 13.945266004375945, 'atr_min_pct': 0.006837467233467494, 'atr_max_pct': 0.06534081971008611, 'tp_mult': 2.629569333652282, 'tsl_mult': 0.2626061275989248, 'strategy': 'breakout', 'time_stop': 168, 'use_sma': False, 'use_atr': True, 'use_adx': True, 'use_ema': False, 'use_spike': True, 'rsi_required': False, 'edge_k': 0.7752339039778405, 'edge_cap': 0.9550717330968753, 'bull_strategy': 'mean_reversion', 'bull_bb_std_mult': 1.5402876963120191, 'bull_rsi_os': 48, 'bull_rsi_ob': 58, 'bull_adx_thresh': 9.821654235821002, 'bull_atr_min_pct': 0.01782403568515197, 'bull_atr_max_pct': 0.09904578005333708, 'bull_tp_mult': 2.6221733722972718, 'bull_tsl_mult': 0.878736681632754, 'bull_time_stop': 299, 'bull_use_sma': True, 'bull_use_ema': False, 'bull_use_atr': False, 'bull_use_adx': False, 'bull_use_spike': True, 'bull_rsi_required': False, 'bear_strategy': 'breakout', 'bear_bb_std_mult': 1.5194262568764647, 'bear_rsi_os': 50, 'bear_rsi_ob': 56, 'bear_adx_thresh': 13.438144167745978, 'bear_atr_min_pct': 0.018673277050867926, 'bear_atr_max_pct': 0.12201012790067615, 'bear_tp_mult': 2.7900479188579372, 'bear_tsl_mult': 0.01894101295517897, 'bear_time_stop': 227, 'bear_use_sma': True, 'bear_use_ema': True, 'bear_use_atr': False, 'bear_use_adx': False, 'bear_use_spike': False, 'bear_rsi_required': True, 'sideways_strategy': 'mean_reversion', 'sideways_bb_std_mult': 3.2573432300791563, 'sideways_rsi_os': 47, 'sideways_rsi_ob': 78, 'sideways_adx_thresh': 21.024936341356135, 'sideways_atr_min_pct': 0.020345102010056758, 'sideways_atr_max_pct': 0.06647922419067896, 'sideways_tp_mult': 1.171798789584169, 'sideways_tsl_mult': 0.37024985774375646, 'sideways_time_stop': 108, 'sideways_use_sma': True, 'sideways_use_ema': False, 'sideways_use_atr': False, 'sideways_use_adx': False, 'sideways_use_spike': True, 'sideways_rsi_required': True}.
[I 2025-08-30 16:45:12,838] Trial 859 finished with values: [-1000000000.0, 1000000000.0] and parameters: {'p_sma': 17, 'p_std': 18, 'p_atr': 29, 'p_adx': 25, 'rsi_period': 83, 'ema1': 26, 'ema2': 31, 'slip_atr_k': 0.00940632881363629, 'slip_spread_k': 0.7100779262966072, 'spread_hl_frac': 0.018887740744745713, 'bb_std_mult': 2.7652642288522933, 'rsi_os': 13, 'rsi_ob': 70, 'vol_spike': 0.029384803081523747, 'adx_thresh': 7.515884733039217, 'atr_min_pct': 0.00685269864113772, 'atr_max_pct': 0.1217067025775642, 'tp_mult': 1.428209485057632, 'tsl_mult': 0.390568306191865, 'strategy': 'breakout', 'time_stop': 167, 'use_sma': False, 'use_atr': True, 'use_adx': True, 'use_ema': False, 'use_spike': True, 'rsi_required': False, 'edge_k': 1.3249384362765417, 'edge_cap': 0.14500395519815745, 'bull_strategy': 'mean_reversion', 'bull_bb_std_mult': 1.8264063555156969, 'bull_rsi_os': 48, 'bull_rsi_ob': 85, 'bull_adx_thresh': 13.962483351928126, 'bull_atr_min_pct': 0.01917073736488866, 'bull_atr_max_pct': 0.09897996754331549, 'bull_tp_mult': 2.6117449399054977, 'bull_tsl_mult': 0.7864148401372884, 'bull_time_stop': 63, 'bull_use_sma': True, 'bull_use_ema': False, 'bull_use_atr': True, 'bull_use_adx': False, 'bull_use_spike': True, 'bull_rsi_required': False, 'bear_strategy': 'breakout', 'bear_bb_std_mult': 2.230302313496655, 'bear_rsi_os': 21, 'bear_rsi_ob': 73, 'bear_adx_thresh': 13.480731880536363, 'bear_atr_min_pct': 0.014889321740824411, 'bear_atr_max_pct': 0.034712461138435714, 'bear_tp_mult': 2.791297034655695, 'bear_tsl_mult': 0.8471142647273593, 'bear_time_stop': 95, 'bear_use_sma': True, 'bear_use_ema': True, 'bear_use_atr': False, 'bear_use_adx': False, 'bear_use_spike': False, 'bear_rsi_required': True, 'sideways_strategy': 'mean_reversion', 'sideways_bb_std_mult': 3.1466324338499287, 'sideways_rsi_os': 44, 'sideways_rsi_ob': 52, 'sideways_adx_thresh': 8.847788300093708, 'sideways_atr_min_pct': 0.020301021142651695, 'sideways_atr_max_pct': 0.023552995125887335, 'sideways_tp_mult': 1.1731008037549775, 'sideways_tsl_mult': 0.3670993910127183, 'sideways_time_stop': 155, 'sideways_use_sma': True, 'sideways_use_ema': True, 'sideways_use_atr': False, 'sideways_use_adx': False, 'sideways_use_spike': True, 'sideways_rsi_required': False}.
[I 2025-08-30 16:45:13,488] Trial 856 finished with values: [-1000000000.0, 1000000000.0] and parameters: {'p_sma': 17, 'p_std': 15, 'p_atr': 12, 'p_adx': 25, 'rsi_period': 8, 'ema1': 26, 'ema2': 39, 'slip_atr_k': 0.00026790464891429644, 'slip_spread_k': 0.7310177974943695, 'spread_hl_frac': 0.033282319347557376, 'bb_std_mult': 0.8822310050453201, 'rsi_os': 28, 'rsi_ob': 73, 'vol_spike': 0.21187204669877652, 'adx_thresh': 6.808506473182804, 'atr_min_pct': 0.01161875755223839, 'atr_max_pct': 0.03737799057911152, 'tp_mult': 1.3926312099447706, 'tsl_mult': 0.39597055856790225, 'strategy': 'breakout', 'time_stop': 167, 'use_sma': False, 'use_atr': True, 'use_adx': True, 'use_ema': False, 'use_spike': True, 'rsi_required': False, 'edge_k': 0.5719275193371137, 'edge_cap': 0.9569104745186535, 'bull_strategy': 'breakout', 'bull_bb_std_mult': 1.8462870248421117, 'bull_rsi_os': 52, 'bull_rsi_ob': 85, 'bull_adx_thresh': 19.50063643149397, 'bull_atr_min_pct': 0.02528306982338177, 'bull_atr_max_pct': 0.10864297246092071, 'bull_tp_mult': 1.380772631764839, 'bull_tsl_mult': 0.8785807240434649, 'bull_time_stop': 111, 'bull_use_sma': True, 'bull_use_ema': False, 'bull_use_atr': False, 'bull_use_adx': True, 'bull_use_spike': True, 'bull_rsi_required': False, 'bear_strategy': 'mean_reversion', 'bear_bb_std_mult': 1.80976394147949, 'bear_rsi_os': 49, 'bear_rsi_ob': 74, 'bear_adx_thresh': 29.672716961369467, 'bear_atr_min_pct': 0.0038128495265209996, 'bear_atr_max_pct': 0.13436963234881832, 'bear_tp_mult': 2.222435196411494, 'bear_tsl_mult': 0.3850786176911752, 'bear_time_stop': 82, 'bear_use_sma': True, 'bear_use_ema': True, 'bear_use_atr': False, 'bear_use_adx': False, 'bear_use_spike': True, 'bear_rsi_required': True, 'sideways_strategy': 'mean_reversion', 'sideways_bb_std_mult': 3.1414678862196723, 'sideways_rsi_os': 48, 'sideways_rsi_ob': 46, 'sideways_adx_thresh': 8.838190207108433, 'sideways_atr_min_pct': 0.02815334254815028, 'sideways_atr_max_pct': 0.06512295117578656, 'sideways_tp_mult': 1.1594183557170699, 'sideways_tsl_mult': 0.37792004181504857, 'sideways_time_stop': 116, 'sideways_use_sma': True, 'sideways_use_ema': False, 'sideways_use_atr': False, 'sideways_use_adx': False, 'sideways_use_spike': True, 'sideways_rsi_required': True}.
[I 2025-08-30 16:45:13,968] Trial 858 finished with values: [-1000000000.0, 1000000000.0] and parameters: {'p_sma': 29, 'p_std': 29, 'p_atr': 20, 'p_adx': 25, 'rsi_period': 40, 'ema1': 26, 'ema2': 31, 'slip_atr_k': 0.20196249146207812, 'slip_spread_k': 0.03122189647748147, 'spread_hl_frac': 0.00956428447631369, 'bb_std_mult': 0.5451244575809718, 'rsi_os': 28, 'rsi_ob': 86, 'vol_spike': 0.10953404322613204, 'adx_thresh': 34.44382434912256, 'atr_min_pct': 0.0019528017723059055, 'atr_max_pct': 0.11304392961537295, 'tp_mult': 1.393276798889926, 'tsl_mult': 0.39867763741365764, 'strategy': 'breakout', 'time_stop': 166, 'use_sma': False, 'use_atr': True, 'use_adx': True, 'use_ema': False, 'use_spike': True, 'rsi_required': False, 'edge_k': 0.571404441622039, 'edge_cap': 0.5886636176798825, 'bull_strategy': 'mean_reversion', 'bull_bb_std_mult': 1.8428489329390108, 'bull_rsi_os': 42, 'bull_rsi_ob': 85, 'bull_adx_thresh': 9.924853030270313, 'bull_atr_min_pct': 0.018012415929498506, 'bull_atr_max_pct': 0.0998796996776565, 'bull_tp_mult': 2.607493574290886, 'bull_tsl_mult': 0.5921173802974429, 'bull_time_stop': 274, 'bull_use_sma': True, 'bull_use_ema': False, 'bull_use_atr': True, 'bull_use_adx': False, 'bull_use_spike': True, 'bull_rsi_required': False, 'bear_strategy': 'breakout', 'bear_bb_std_mult': 1.5426812617250494, 'bear_rsi_os': 7, 'bear_rsi_ob': 93, 'bear_adx_thresh': 13.548385028183176, 'bear_atr_min_pct': 0.018800163648805913, 'bear_atr_max_pct': 0.09441564351050474, 'bear_tp_mult': 2.2337756816902914, 'bear_tsl_mult': 0.39471218853650186, 'bear_time_stop': 95, 'bear_use_sma': True, 'bear_use_ema': True, 'bear_use_atr': False, 'bear_use_adx': False, 'bear_use_spike': False, 'bear_rsi_required': True, 'sideways_strategy': 'mean_reversion', 'sideways_bb_std_mult': 3.14959395209991, 'sideways_rsi_os': 23, 'sideways_rsi_ob': 85, 'sideways_adx_thresh': 17.31746091628352, 'sideways_atr_min_pct': 0.02032822415229364, 'sideways_atr_max_pct': 0.060856957747580195, 'sideways_tp_mult': 1.0100495192084615, 'sideways_tsl_mult': 0.36643697657741386, 'sideways_time_stop': 109, 'sideways_use_sma': True, 'sideways_use_ema': True, 'sideways_use_atr': False, 'sideways_use_adx': False, 'sideways_use_spike': True, 'sideways_rsi_required': True}.
[I 2025-08-30 16:46:02,089] Trial 861 finished with values: [-1000000000.0, 1000000000.0] and parameters: {'p_sma': 10, 'p_std': 23, 'p_atr': 11, 'p_adx': 25, 'rsi_period': 80, 'ema1': 22, 'ema2': 15, 'slip_atr_k': 0.00037363845098382985, 'slip_spread_k': 0.6727296719990079, 'spread_hl_frac': 0.00833900596417637, 'bb_std_mult': 0.5583871875018697, 'rsi_os': 28, 'rsi_ob': 93, 'vol_spike': 0.22735051768720377, 'adx_thresh': 22.802579675088452, 'atr_min_pct': 0.001803206381860118, 'atr_max_pct': 0.03778676836591912, 'tp_mult': 1.3746699471406354, 'tsl_mult': 0.30049057571955795, 'strategy': 'breakout', 'time_stop': 156, 'use_sma': False, 'use_atr': False, 'use_adx': True, 'use_ema': False, 'use_spike': False, 'rsi_required': False, 'edge_k': 0.41443611239711753, 'edge_cap': 0.9793454029067226, 'bull_strategy': 'breakout', 'bull_bb_std_mult': 2.9512264823535164, 'bull_rsi_os': 35, 'bull_rsi_ob': 88, 'bull_adx_thresh': 11.1554262110763, 'bull_atr_min_pct': 0.021071921539457004, 'bull_atr_max_pct': 0.10733026550215197, 'bull_tp_mult': 2.5719295394525865, 'bull_tsl_mult': 0.8917458518250182, 'bull_time_stop': 201, 'bull_use_sma': True, 'bull_use_ema': True, 'bull_use_atr': True, 'bull_use_adx': True, 'bull_use_spike': True, 'bull_rsi_required': False, 'bear_strategy': 'mean_reversion', 'bear_bb_std_mult': 1.9720030081688327, 'bear_rsi_os': 37, 'bear_rsi_ob': 59, 'bear_adx_thresh': 15.497273541836707, 'bear_atr_min_pct': 0.0012978587522365801, 'bear_atr_max_pct': 0.09402835597397133, 'bear_tp_mult': 2.597725513057566, 'bear_tsl_mult': 0.7292554934965461, 'bear_time_stop': 93, 'bear_use_sma': True, 'bear_use_ema': False, 'bear_use_atr': True, 'bear_use_adx': True, 'bear_use_spike': True, 'bear_rsi_required': True, 'sideways_strategy': 'mean_reversion', 'sideways_bb_std_mult': 3.1274141834901674, 'sideways_rsi_os': 18, 'sideways_rsi_ob': 79, 'sideways_adx_thresh': 17.337030570162945, 'sideways_atr_min_pct': 0.01867257743618631, 'sideways_atr_max_pct': 0.07027316120031964, 'sideways_tp_mult': 1.46269474757058, 'sideways_tsl_mult': 0.4246588214656403, 'sideways_time_stop': 300, 'sideways_use_sma': True, 'sideways_use_ema': False, 'sideways_use_atr': True, 'sideways_use_adx': True, 'sideways_use_spike': True, 'sideways_rsi_required': True}.
[I 2025-08-30 16:46:02,098] Trial 860 finished with values: [-0.008441542987391193, 0.008907230127374486] and parameters: {'p_sma': 10, 'p_std': 22, 'p_atr': 11, 'p_adx': 25, 'rsi_period': 40, 'ema1': 22, 'ema2': 35, 'slip_atr_k': 5.382227668805569e-05, 'slip_spread_k': 0.7657573619457204, 'spread_hl_frac': 0.028255442355858387, 'bb_std_mult': 0.5462395097350088, 'rsi_os': 38, 'rsi_ob': 93, 'vol_spike': 0.22693164750603315, 'adx_thresh': 9.613922434154174, 'atr_min_pct': 0.023866969952667218, 'atr_max_pct': 0.03960493348777123, 'tp_mult': 1.5390998183096196, 'tsl_mult': 0.9229424960108719, 'strategy': 'breakout', 'time_stop': 158, 'use_sma': False, 'use_atr': False, 'use_adx': True, 'use_ema': False, 'use_spike': False, 'rsi_required': False, 'edge_k': 1.0610968485380456, 'edge_cap': 0.6335987300343908, 'bull_strategy': 'breakout', 'bull_bb_std_mult': 2.746612616155602, 'bull_rsi_os': 42, 'bull_rsi_ob': 88, 'bull_adx_thresh': 24.9398959685353, 'bull_atr_min_pct': 0.019507493351854477, 'bull_atr_max_pct': 0.04475870032005188, 'bull_tp_mult': 2.5776376101147136, 'bull_tsl_mult': 0.8505979916657829, 'bull_time_stop': 275, 'bull_use_sma': True, 'bull_use_ema': True, 'bull_use_atr': True, 'bull_use_adx': True, 'bull_use_spike': True, 'bull_rsi_required': False, 'bear_strategy': 'mean_reversion', 'bear_bb_std_mult': 1.845737718158731, 'bear_rsi_os': 37, 'bear_rsi_ob': 95, 'bear_adx_thresh': 15.789611636002205, 'bear_atr_min_pct': 0.0012563628750693811, 'bear_atr_max_pct': 0.11202346748089377, 'bear_tp_mult': 2.731450744391433, 'bear_tsl_mult': 0.8870289606453822, 'bear_time_stop': 92, 'bear_use_sma': True, 'bear_use_ema': False, 'bear_use_atr': True, 'bear_use_adx': True, 'bear_use_spike': True, 'bear_rsi_required': True, 'sideways_strategy': 'mean_reversion', 'sideways_bb_std_mult': 3.131334675748049, 'sideways_rsi_os': 18, 'sideways_rsi_ob': 79, 'sideways_adx_thresh': 17.22390414709608, 'sideways_atr_min_pct': 0.029960564426842057, 'sideways_atr_max_pct': 0.07061032266832543, 'sideways_tp_mult': 1.3393848156740626, 'sideways_tsl_mult': 0.4187413446977322, 'sideways_time_stop': 141, 'sideways_use_sma': True, 'sideways_use_ema': False, 'sideways_use_atr': True, 'sideways_use_adx': True, 'sideways_use_spike': True, 'sideways_rsi_required': True}.
[I 2025-08-30 16:46:02,447] Trial 863 finished with values: [-1000000000.0, 1000000000.0] and parameters: {'p_sma': 10, 'p_std': 50, 'p_atr': 28, 'p_adx': 24, 'rsi_period': 80, 'ema1': 22, 'ema2': 35, 'slip_atr_k': 0.07445109813661696, 'slip_spread_k': 0.6670973999583877, 'spread_hl_frac': 0.007953581349031047, 'bb_std_mult': 0.6274053596384456, 'rsi_os': 34, 'rsi_ob': 88, 'vol_spike': 0.22798900706877223, 'adx_thresh': 10.256947384623302, 'atr_min_pct': 0.00611683320212157, 'atr_max_pct': 0.04019044136478875, 'tp_mult': 1.058023317066777, 'tsl_mult': 0.9638022306212102, 'strategy': 'breakout', 'time_stop': 156, 'use_sma': False, 'use_atr': False, 'use_adx': False, 'use_ema': False, 'use_spike': False, 'rsi_required': False, 'edge_k': 0.44602688875423335, 'edge_cap': 0.9215031239870287, 'bull_strategy': 'breakout', 'bull_bb_std_mult': 2.734098389556227, 'bull_rsi_os': 49, 'bull_rsi_ob': 88, 'bull_adx_thresh': 10.878538835571254, 'bull_atr_min_pct': 0.019509264316971198, 'bull_atr_max_pct': 0.10535135408039425, 'bull_tp_mult': 2.567247265273939, 'bull_tsl_mult': 0.8496591755403927, 'bull_time_stop': 29, 'bull_use_sma': True, 'bull_use_ema': True, 'bull_use_atr': True, 'bull_use_adx': True, 'bull_use_spike': True, 'bull_rsi_required': False, 'bear_strategy': 'mean_reversion', 'bear_bb_std_mult': 0.8474650369777676, 'bear_rsi_os': 36, 'bear_rsi_ob': 76, 'bear_adx_thresh': 15.63017248373209, 'bear_atr_min_pct': 0.001549343971923037, 'bear_atr_max_pct': 0.07409130691275662, 'bear_tp_mult': 2.7360276693597845, 'bear_tsl_mult': 0.7304603013356052, 'bear_time_stop': 110, 'bear_use_sma': True, 'bear_use_ema': False, 'bear_use_atr': True, 'bear_use_adx': True, 'bear_use_spike': True, 'bear_rsi_required': True, 'sideways_strategy': 'mean_reversion', 'sideways_bb_std_mult': 3.327258055363516, 'sideways_rsi_os': 19, 'sideways_rsi_ob': 79, 'sideways_adx_thresh': 10.34926018096609, 'sideways_atr_min_pct': 0.016669583575099622, 'sideways_atr_max_pct': 0.07056104054406168, 'sideways_tp_mult': 1.3444024480996335, 'sideways_tsl_mult': 0.4184544032003926, 'sideways_time_stop': 133, 'sideways_use_sma': False, 'sideways_use_ema': False, 'sideways_use_atr': True, 'sideways_use_adx': True, 'sideways_use_spike': True, 'sideways_rsi_required': False}.
[I 2025-08-30 16:46:02,857] Trial 862 finished with values: [-0.04479535626553921, 0.04487055710497648] and parameters: {'p_sma': 10, 'p_std': 23, 'p_atr': 11, 'p_adx': 24, 'rsi_period': 15, 'ema1': 22, 'ema2': 19, 'slip_atr_k': 0.12501930776532394, 'slip_spread_k': 0.03718241134210276, 'spread_hl_frac': 0.008336567474379032, 'bb_std_mult': 2.6424381254100946, 'rsi_os': 28, 'rsi_ob': 86, 'vol_spike': 0.23947791080085026, 'adx_thresh': 10.680807444071178, 'atr_min_pct': 0.02858025019908273, 'atr_max_pct': 0.11289562102458453, 'tp_mult': 1.6445292878306432, 'tsl_mult': 0.7258759647296221, 'strategy': 'breakout', 'time_stop': 156, 'use_sma': False, 'use_atr': False, 'use_adx': True, 'use_ema': False, 'use_spike': False, 'rsi_required': False, 'edge_k': 0.41039558945473575, 'edge_cap': 0.9727176596013708, 'bull_strategy': 'breakout', 'bull_bb_std_mult': 1.425191825214188, 'bull_rsi_os': 51, 'bull_rsi_ob': 88, 'bull_adx_thresh': 9.71438043725185, 'bull_atr_min_pct': 0.01964065112095696, 'bull_atr_max_pct': 0.10549835291121859, 'bull_tp_mult': 2.5573403467724005, 'bull_tsl_mult': 0.5864893867697306, 'bull_time_stop': 28, 'bull_use_sma': True, 'bull_use_ema': True, 'bull_use_atr': True, 'bull_use_adx': True, 'bull_use_spike': True, 'bull_rsi_required': False, 'bear_strategy': 'mean_reversion', 'bear_bb_std_mult': 1.4318335260585648, 'bear_rsi_os': 52, 'bear_rsi_ob': 76, 'bear_adx_thresh': 15.744871662351883, 'bear_atr_min_pct': 0.0013693302154925901, 'bear_atr_max_pct': 0.11228662937764566, 'bear_tp_mult': 2.722820388091517, 'bear_tsl_mult': 0.8921838439261119, 'bear_time_stop': 91, 'bear_use_sma': True, 'bear_use_ema': False, 'bear_use_atr': True, 'bear_use_adx': True, 'bear_use_spike': True, 'bear_rsi_required': True, 'sideways_strategy': 'mean_reversion', 'sideways_bb_std_mult': 3.315595190514409, 'sideways_rsi_os': 54, 'sideways_rsi_ob': 69, 'sideways_adx_thresh': 6.270622003791647, 'sideways_atr_min_pct': 0.019111240567613923, 'sideways_atr_max_pct': 0.07049166108016813, 'sideways_tp_mult': 1.361922012839945, 'sideways_tsl_mult': 0.2721355276290347, 'sideways_time_stop': 199, 'sideways_use_sma': True, 'sideways_use_ema': True, 'sideways_use_atr': True, 'sideways_use_adx': True, 'sideways_use_spike': True, 'sideways_rsi_required': False}.
