[I 2025-08-30 14:42:24,500] Trial 180 finished with values: [-1000000000.0, 1000000000.0] and parameters: {'p_sma': 6, 'p_std': 8, 'p_atr': 16, 'p_adx': 9, 'rsi_period': 18, 'ema1': 16, 'ema2': 18, 'slip_atr_k': 0.15314535437455787, 'slip_spread_k': 0.4917980457579222, 'spread_hl_frac': 0.047205423303556183, 'bb_std_mult': 2.5093540304041717, 'rsi_os': 47, 'rsi_ob': 85, 'vol_spike': 0.29106109452884227, 'adx_thresh': 20.686175555843512, 'atr_min_pct': 0.02030352287861454, 'atr_max_pct': 0.057216533022324156, 'tp_mult': 2.706800363942209, 'tsl_mult': 0.7018075976531964, 'strategy': 'mean_reversion', 'time_stop': 80, 'use_sma': False, 'use_atr': True, 'use_adx': True, 'use_ema': True, 'use_spike': False, 'rsi_required': False, 'edge_k': 1.4492291098236358, 'edge_cap': 0.4102672086015053, 'bull_strategy': 'mean_reversion', 'bull_bb_std_mult': 0.5652423260843074, 'bull_rsi_os': 43, 'bull_rsi_ob': 55, 'bull_adx_thresh': 16.435726200950587, 'bull_atr_min_pct': 0.01774492388375316, 'bull_atr_max_pct': 0.01256545358568524, 'bull_tp_mult': 2.3829727496757545, 'bull_tsl_mult': 0.0876891098135838, 'bull_time_stop': 77, 'bull_use_sma': False, 'bull_use_ema': False, 'bull_use_atr': False, 'bull_use_adx': True, 'bull_use_spike': False, 'bull_rsi_required': True, 'bear_strategy': 'breakout', 'bear_bb_std_mult': 0.9087811555039774, 'bear_rsi_os': 32, 'bear_rsi_ob': 60, 'bear_adx_thresh': 33.49548353647054, 'bear_atr_min_pct': 0.012524272707342767, 'bear_atr_max_pct': 0.14248511051881152, 'bear_tp_mult': 1.211909812836074, 'bear_tsl_mult': 0.0676297250454223, 'bear_time_stop': 235, 'bear_use_sma': True, 'bear_use_ema': False, 'bear_use_atr': False, 'bear_use_adx': False, 'bear_use_spike': False, 'bear_rsi_required': False, 'sideways_strategy': 'breakout', 'sideways_bb_std_mult': 2.6083003209002573, 'sideways_rsi_os': 13, 'sideways_rsi_ob': 63, 'sideways_adx_thresh': 14.491480252900473, 'sideways_atr_min_pct': 0.003857036945695223, 'sideways_atr_max_pct': 0.11623974217651757, 'sideways_tp_mult': 1.4227699817396542, 'sideways_tsl_mult': 0.14052226102792148, 'sideways_time_stop': 181, 'sideways_use_sma': False, 'sideways_use_ema': True, 'sideways_use_atr': False, 'sideways_use_adx': False, 'sideways_use_spike': False, 'sideways_rsi_required': False}.
[I 2025-08-30 14:42:24,878] Trial 181 finished with values: [-1000000000.0, 1000000000.0] and parameters: {'p_sma': 5, 'p_std': 5, 'p_atr': 30, 'p_adx': 20, 'rsi_period': 77, 'ema1': 8, 'ema2': 10, 'slip_atr_k': 0.1595441917270699, 'slip_spread_k': 0.4919139171091151, 'spread_hl_frac': 0.04642550586326397, 'bb_std_mult': 3.583850678649234, 'rsi_os': 39, 'rsi_ob': 69, 'vol_spike': 0.18562871390565416, 'adx_thresh': 25.72482978620811, 'atr_min_pct': 0.02794429877918302, 'atr_max_pct': 0.09595134073343595, 'tp_mult': 1.3615533271253595, 'tsl_mult': 0.11736713507816215, 'strategy': 'mean_reversion', 'time_stop': 169, 'use_sma': False, 'use_atr': False, 'use_adx': True, 'use_ema': True, 'use_spike': False, 'rsi_required': False, 'edge_k': 1.817365155023666, 'edge_cap': 0.6843621491211631, 'bull_strategy': 'mean_reversion', 'bull_bb_std_mult': 0.5555109205050535, 'bull_rsi_os': 39, 'bull_rsi_ob': 76, 'bull_adx_thresh': 20.415991168655726, 'bull_atr_min_pct': 0.024955068679556564, 'bull_atr_max_pct': 0.018954085269513234, 'bull_tp_mult': 2.89685145845188, 'bull_tsl_mult': 0.4329989305198266, 'bull_time_stop': 75, 'bull_use_sma': False, 'bull_use_ema': False, 'bull_use_atr': False, 'bull_use_adx': True, 'bull_use_spike': True, 'bull_rsi_required': True, 'bear_strategy': 'breakout', 'bear_bb_std_mult': 0.9624563238418592, 'bear_rsi_os': 37, 'bear_rsi_ob': 53, 'bear_adx_thresh': 33.478327829233926, 'bear_atr_min_pct': 0.012725447389951669, 'bear_atr_max_pct': 0.13798868329018385, 'bear_tp_mult': 2.714727220491103, 'bear_tsl_mult': 0.2808591681068142, 'bear_time_stop': 102, 'bear_use_sma': True, 'bear_use_ema': True, 'bear_use_atr': False, 'bear_use_adx': False, 'bear_use_spike': False, 'bear_rsi_required': True, 'sideways_strategy': 'breakout', 'sideways_bb_std_mult': 1.6162765315223324, 'sideways_rsi_os': 43, 'sideways_rsi_ob': 63, 'sideways_adx_thresh': 15.79722520439104, 'sideways_atr_min_pct': 0.02647199557758412, 'sideways_atr_max_pct': 0.11669988667900762, 'sideways_tp_mult': 1.3906842370358499, 'sideways_tsl_mult': 0.1389665879495617, 'sideways_time_stop': 229, 'sideways_use_sma': True, 'sideways_use_ema': True, 'sideways_use_atr': False, 'sideways_use_adx': False, 'sideways_use_spike': True, 'sideways_rsi_required': True}.
[I 2025-08-30 14:42:56,256] Trial 185 finished with values: [-1000000000.0, 1000000000.0] and parameters: {'p_sma': 38, 'p_std': 7, 'p_atr': 14, 'p_adx': 8, 'rsi_period': 20, 'ema1': 28, 'ema2': 34, 'slip_atr_k': 0.14255120770931165, 'slip_spread_k': 0.5572026335652377, 'spread_hl_frac': 0.04788870046372366, 'bb_std_mult': 3.5327939786545874, 'rsi_os': 19, 'rsi_ob': 77, 'vol_spike': 0.25974726862064756, 'adx_thresh': 24.377658811244608, 'atr_min_pct': 0.02936391297139127, 'atr_max_pct': 0.11453000605075195, 'tp_mult': 2.190136202751695, 'tsl_mult': 0.7594907978379868, 'strategy': 'mean_reversion', 'time_stop': 134, 'use_sma': True, 'use_atr': False, 'use_adx': False, 'use_ema': False, 'use_spike': True, 'rsi_required': True, 'edge_k': 0.1385707720036039, 'edge_cap': 0.6024086782417319, 'bull_strategy': 'breakout', 'bull_bb_std_mult': 0.6571020328746446, 'bull_rsi_os': 41, 'bull_rsi_ob': 68, 'bull_adx_thresh': 19.71441642654461, 'bull_atr_min_pct': 0.02766984595712451, 'bull_atr_max_pct': 0.07789475923639104, 'bull_tp_mult': 1.3431164242231186, 'bull_tsl_mult': 0.34630650011243697, 'bull_time_stop': 44, 'bull_use_sma': False, 'bull_use_ema': False, 'bull_use_atr': True, 'bull_use_adx': True, 'bull_use_spike': False, 'bull_rsi_required': False, 'bear_strategy': 'mean_reversion', 'bear_bb_std_mult': 0.752028260194193, 'bear_rsi_os': 18, 'bear_rsi_ob': 66, 'bear_adx_thresh': 31.60812898327103, 'bear_atr_min_pct': 0.0035847575647071136, 'bear_atr_max_pct': 0.14173725605196788, 'bear_tp_mult': 1.8940784040514682, 'bear_tsl_mult': 0.7619562145433456, 'bear_time_stop': 180, 'bear_use_sma': False, 'bear_use_ema': True, 'bear_use_atr': False, 'bear_use_adx': False, 'bear_use_spike': True, 'bear_rsi_required': False, 'sideways_strategy': 'mean_reversion', 'sideways_bb_std_mult': 2.027667688378944, 'sideways_rsi_os': 21, 'sideways_rsi_ob': 55, 'sideways_adx_thresh': 13.142431379182867, 'sideways_atr_min_pct': 0.023857313572450165, 'sideways_atr_max_pct': 0.12532784656076396, 'sideways_tp_mult': 2.1623323500015568, 'sideways_tsl_mult': 0.08367973998381636, 'sideways_time_stop': 168, 'sideways_use_sma': True, 'sideways_use_ema': False, 'sideways_use_atr': False, 'sideways_use_adx': True, 'sideways_use_spike': False, 'sideways_rsi_required': False}.
[I 2025-08-30 14:42:56,419] Trial 183 finished with values: [-1000000000.0, 1000000000.0] and parameters: {'p_sma': 38, 'p_std': 39, 'p_atr': 7, 'p_adx': 23, 'rsi_period': 77, 'ema1': 16, 'ema2': 49, 'slip_atr_k': 0.22569578849866012, 'slip_spread_k': 0.5682329066515329, 'spread_hl_frac': 0.04890824499518956, 'bb_std_mult': 3.538935592950981, 'rsi_os': 19, 'rsi_ob': 77, 'vol_spike': 0.08120951698871225, 'adx_thresh': 24.553977956172297, 'atr_min_pct': 0.006439483104856387, 'atr_max_pct': 0.035074748957213936, 'tp_mult': 2.17659207521334, 'tsl_mult': 0.21434443773073758, 'strategy': 'mean_reversion', 'time_stop': 299, 'use_sma': True, 'use_atr': False, 'use_adx': False, 'use_ema': False, 'use_spike': True, 'rsi_required': True, 'edge_k': 1.3277422656576694, 'edge_cap': 0.2771085041724505, 'bull_strategy': 'breakout', 'bull_bb_std_mult': 0.6582826524001153, 'bull_rsi_os': 39, 'bull_rsi_ob': 81, 'bull_adx_thresh': 7.420541834621563, 'bull_atr_min_pct': 0.02517079741594347, 'bull_atr_max_pct': 0.0768107195468007, 'bull_tp_mult': 1.3187319437832454, 'bull_tsl_mult': 0.2971095704701999, 'bull_time_stop': 103, 'bull_use_sma': False, 'bull_use_ema': False, 'bull_use_atr': True, 'bull_use_adx': True, 'bull_use_spike': True, 'bull_rsi_required': False, 'bear_strategy': 'mean_reversion', 'bear_bb_std_mult': 0.7665652510272928, 'bear_rsi_os': 18, 'bear_rsi_ob': 66, 'bear_adx_thresh': 31.642109452658826, 'bear_atr_min_pct': 0.023272032442389685, 'bear_atr_max_pct': 0.1234528673654213, 'bear_tp_mult': 1.9743188406211167, 'bear_tsl_mult': 0.8488081298208389, 'bear_time_stop': 248, 'bear_use_sma': False, 'bear_use_ema': True, 'bear_use_atr': False, 'bear_use_adx': False, 'bear_use_spike': True, 'bear_rsi_required': True, 'sideways_strategy': 'mean_reversion', 'sideways_bb_std_mult': 2.034819197406204, 'sideways_rsi_os': 26, 'sideways_rsi_ob': 67, 'sideways_adx_thresh': 12.67414024457372, 'sideways_atr_min_pct': 0.026513516435579695, 'sideways_atr_max_pct': 0.018877971451482525, 'sideways_tp_mult': 1.360561736992966, 'sideways_tsl_mult': 0.3608275471590713, 'sideways_time_stop': 168, 'sideways_use_sma': True, 'sideways_use_ema': False, 'sideways_use_atr': False, 'sideways_use_adx': True, 'sideways_use_spike': True, 'sideways_rsi_required': True}.
[I 2025-08-30 14:42:56,802] Trial 184 finished with values: [-1000000000.0, 1000000000.0] and parameters: {'p_sma': 13, 'p_std': 7, 'p_atr': 7, 'p_adx': 21, 'rsi_period': 77, 'ema1': 16, 'ema2': 25, 'slip_atr_k': 0.023862459681452036, 'slip_spread_k': 0.5601613915017548, 'spread_hl_frac': 0.04609975483737805, 'bb_std_mult': 3.476360060421394, 'rsi_os': 19, 'rsi_ob': 75, 'vol_spike': 0.16681879210549588, 'adx_thresh': 25.545910598483285, 'atr_min_pct': 0.005315713930458791, 'atr_max_pct': 0.09579909220846478, 'tp_mult': 1.3748085832995849, 'tsl_mult': 0.15011373618023177, 'strategy': 'mean_reversion', 'time_stop': 49, 'use_sma': True, 'use_atr': False, 'use_adx': False, 'use_ema': False, 'use_spike': True, 'rsi_required': True, 'edge_k': 1.8298555414417377, 'edge_cap': 0.43545002668009636, 'bull_strategy': 'breakout', 'bull_bb_std_mult': 0.6563526761428972, 'bull_rsi_os': 16, 'bull_rsi_ob': 94, 'bull_adx_thresh': 9.560802514951897, 'bull_atr_min_pct': 0.025082758948919773, 'bull_atr_max_pct': 0.021655500265278224, 'bull_tp_mult': 2.9154881249922204, 'bull_tsl_mult': 0.34577731854396315, 'bull_time_stop': 101, 'bull_use_sma': False, 'bull_use_ema': False, 'bull_use_atr': True, 'bull_use_adx': True, 'bull_use_spike': True, 'bull_rsi_required': False, 'bear_strategy': 'mean_reversion', 'bear_bb_std_mult': 0.7979042641552863, 'bear_rsi_os': 52, 'bear_rsi_ob': 64, 'bear_adx_thresh': 31.380749648752662, 'bear_atr_min_pct': 0.02346059503317749, 'bear_atr_max_pct': 0.1428364998157604, 'bear_tp_mult': 2.0163087607590207, 'bear_tsl_mult': 0.8492290322595974, 'bear_time_stop': 130, 'bear_use_sma': False, 'bear_use_ema': True, 'bear_use_atr': False, 'bear_use_adx': False, 'bear_use_spike': True, 'bear_rsi_required': True, 'sideways_strategy': 'mean_reversion', 'sideways_bb_std_mult': 2.034818205867946, 'sideways_rsi_os': 36, 'sideways_rsi_ob': 76, 'sideways_adx_thresh': 25.775788496012485, 'sideways_atr_min_pct': 0.02513714763972285, 'sideways_atr_max_pct': 0.0186521396632224, 'sideways_tp_mult': 2.82232307297138, 'sideways_tsl_mult': 0.5207307275058242, 'sideways_time_stop': 169, 'sideways_use_sma': True, 'sideways_use_ema': False, 'sideways_use_atr': False, 'sideways_use_adx': True, 'sideways_use_spike': True, 'sideways_rsi_required': True}.
[I 2025-08-30 14:42:56,802] Trial 182 finished with values: [-1000000000.0, 1000000000.0] and parameters: {'p_sma': 5, 'p_std': 60, 'p_atr': 16, 'p_adx': 11, 'rsi_period': 70, 'ema1': 16, 'ema2': 18, 'slip_atr_k': 0.023070983771473888, 'slip_spread_k': 0.11008549941183227, 'spread_hl_frac': 0.046296935009568295, 'bb_std_mult': 3.575585163760149, 'rsi_os': 19, 'rsi_ob': 73, 'vol_spike': 0.18653850091411836, 'adx_thresh': 20.64167635326912, 'atr_min_pct': 0.027990481243884202, 'atr_max_pct': 0.1461299088276799, 'tp_mult': 2.2027935053350074, 'tsl_mult': 0.37812737262194673, 'strategy': 'mean_reversion', 'time_stop': 168, 'use_sma': False, 'use_atr': False, 'use_adx': True, 'use_ema': False, 'use_spike': False, 'rsi_required': False, 'edge_k': 0.16677388504541513, 'edge_cap': 0.4488663236217603, 'bull_strategy': 'mean_reversion', 'bull_bb_std_mult': 0.5660722737576332, 'bull_rsi_os': 39, 'bull_rsi_ob': 76, 'bull_adx_thresh': 16.28542818798239, 'bull_atr_min_pct': 0.007748577097533533, 'bull_atr_max_pct': 0.06968227203607512, 'bull_tp_mult': 1.329468880545702, 'bull_tsl_mult': 0.300406741092445, 'bull_time_stop': 73, 'bull_use_sma': False, 'bull_use_ema': False, 'bull_use_atr': False, 'bull_use_adx': True, 'bull_use_spike': True, 'bull_rsi_required': True, 'bear_strategy': 'breakout', 'bear_bb_std_mult': 0.8895555178680397, 'bear_rsi_os': 10, 'bear_rsi_ob': 64, 'bear_adx_thresh': 31.55626279237592, 'bear_atr_min_pct': 0.014721201269732184, 'bear_atr_max_pct': 0.13767199366792024, 'bear_tp_mult': 1.8904063937815976, 'bear_tsl_mult': 0.138522646235211, 'bear_time_stop': 177, 'bear_use_sma': True, 'bear_use_ema': True, 'bear_use_atr': False, 'bear_use_adx': False, 'bear_use_spike': False, 'bear_rsi_required': True, 'sideways_strategy': 'mean_reversion', 'sideways_bb_std_mult': 2.0135219019345465, 'sideways_rsi_os': 43, 'sideways_rsi_ob': 63, 'sideways_adx_thresh': 15.915132822753138, 'sideways_atr_min_pct': 0.025134094506209452, 'sideways_atr_max_pct': 0.03895596540314782, 'sideways_tp_mult': 1.099891714487078, 'sideways_tsl_mult': 0.20714780878441497, 'sideways_time_stop': 168, 'sideways_use_sma': True, 'sideways_use_ema': False, 'sideways_use_atr': False, 'sideways_use_adx': False, 'sideways_use_spike': True, 'sideways_rsi_required': True}.
[I 2025-08-30 14:43:29,297] Trial 187 finished with values: [-1000000000.0, 1000000000.0] and parameters: {'p_sma': 40, 'p_std': 14, 'p_atr': 15, 'p_adx': 16, 'rsi_period': 84, 'ema1': 23, 'ema2': 25, 'slip_atr_k': 0.07179062873270156, 'slip_spread_k': 0.468009707138983, 'spread_hl_frac': 0.0004122775682609339, 'bb_std_mult': 3.473376020674659, 'rsi_os': 45, 'rsi_ob': 75, 'vol_spike': 0.11201454545534886, 'adx_thresh': 30.53162202219732, 'atr_min_pct': 0.009668504096473681, 'atr_max_pct': 0.02346518683138411, 'tp_mult': 1.21379529086466, 'tsl_mult': 0.08018713839606348, 'strategy': 'mean_reversion', 'time_stop': 300, 'use_sma': True, 'use_atr': True, 'use_adx': False, 'use_ema': True, 'use_spike': True, 'rsi_required': True, 'edge_k': 0.8139892444562135, 'edge_cap': 0.4420839086526359, 'bull_strategy': 'mean_reversion', 'bull_bb_std_mult': 0.5007936048771598, 'bull_rsi_os': 16, 'bull_rsi_ob': 79, 'bull_adx_thresh': 5.1384547309467035, 'bull_atr_min_pct': 0.020506671395949694, 'bull_atr_max_pct': 0.0373296737999329, 'bull_tp_mult': 1.294106924619176, 'bull_tsl_mult': 0.3086286330949215, 'bull_time_stop': 198, 'bull_use_sma': True, 'bull_use_ema': True, 'bull_use_atr': False, 'bull_use_adx': False, 'bull_use_spike': False, 'bull_rsi_required': False, 'bear_strategy': 'breakout', 'bear_bb_std_mult': 0.8294655525264525, 'bear_rsi_os': 52, 'bear_rsi_ob': 64, 'bear_adx_thresh': 32.32136026943599, 'bear_atr_min_pct': 0.004399118196187027, 'bear_atr_max_pct': 0.07222382529750447, 'bear_tp_mult': 2.008342646455731, 'bear_tsl_mult': 0.7313234629762122, 'bear_time_stop': 141, 'bear_use_sma': False, 'bear_use_ema': True, 'bear_use_atr': False, 'bear_use_adx': False, 'bear_use_spike': False, 'bear_rsi_required': False, 'sideways_strategy': 'breakout', 'sideways_bb_std_mult': 2.1612712912126857, 'sideways_rsi_os': 45, 'sideways_rsi_ob': 46, 'sideways_adx_thresh': 25.569815247964574, 'sideways_atr_min_pct': 0.012687890187029814, 'sideways_atr_max_pct': 0.021291716400662637, 'sideways_tp_mult': 2.819592263243426, 'sideways_tsl_mult': 0.4274664138530352, 'sideways_time_stop': 175, 'sideways_use_sma': False, 'sideways_use_ema': True, 'sideways_use_atr': False, 'sideways_use_adx': False, 'sideways_use_spike': False, 'sideways_rsi_required': False}.
[I 2025-08-30 14:43:29,505] Trial 189 finished with values: [-1000000000.0, 1000000000.0] and parameters: {'p_sma': 43, 'p_std': 14, 'p_atr': 14, 'p_adx': 16, 'rsi_period': 17, 'ema1': 23, 'ema2': 45, 'slip_atr_k': 0.08731298466577952, 'slip_spread_k': 0.5368961379858519, 'spread_hl_frac': 0.023580349396342327, 'bb_std_mult': 3.480968119345857, 'rsi_os': 16, 'rsi_ob': 77, 'vol_spike': 0.13746728698381078, 'adx_thresh': 13.579734207050219, 'atr_min_pct': 0.029229385937486953, 'atr_max_pct': 0.029510711974050065, 'tp_mult': 2.093174814449487, 'tsl_mult': 0.07544835162724184, 'strategy': 'mean_reversion', 'time_stop': 300, 'use_sma': True, 'use_atr': True, 'use_adx': False, 'use_ema': True, 'use_spike': True, 'rsi_required': True, 'edge_k': 0.818924416508946, 'edge_cap': 0.3610018080684838, 'bull_strategy': 'mean_reversion', 'bull_bb_std_mult': 3.362013163679228, 'bull_rsi_os': 44, 'bull_rsi_ob': 63, 'bull_adx_thresh': 21.428400620492535, 'bull_atr_min_pct': 0.02051823088004212, 'bull_atr_max_pct': 0.06438551376561713, 'bull_tp_mult': 1.2348907160741844, 'bull_tsl_mult': 0.1334571217233982, 'bull_time_stop': 112, 'bull_use_sma': True, 'bull_use_ema': True, 'bull_use_atr': False, 'bull_use_adx': False, 'bull_use_spike': False, 'bull_rsi_required': False, 'bear_strategy': 'breakout', 'bear_bb_std_mult': 3.119573490093449, 'bear_rsi_os': 6, 'bear_rsi_ob': 64, 'bear_adx_thresh': 27.167601245355243, 'bear_atr_min_pct': 0.01767404596056617, 'bear_atr_max_pct': 0.10910345870775878, 'bear_tp_mult': 2.3581745246760852, 'bear_tsl_mult': 0.7389266783409267, 'bear_time_stop': 55, 'bear_use_sma': False, 'bear_use_ema': True, 'bear_use_atr': False, 'bear_use_adx': True, 'bear_use_spike': False, 'bear_rsi_required': False, 'sideways_strategy': 'breakout', 'sideways_bb_std_mult': 1.828261487498626, 'sideways_rsi_os': 45, 'sideways_rsi_ob': 68, 'sideways_adx_thresh': 33.89187486437477, 'sideways_atr_min_pct': 0.021226220591522238, 'sideways_atr_max_pct': 0.05177590558753246, 'sideways_tp_mult': 2.7487019385024984, 'sideways_tsl_mult': 0.7754087320945677, 'sideways_time_stop': 241, 'sideways_use_sma': False, 'sideways_use_ema': True, 'sideways_use_atr': False, 'sideways_use_adx': False, 'sideways_use_spike': False, 'sideways_rsi_required': False}.
[I 2025-08-30 14:43:29,505] Trial 188 finished with values: [-1000000000.0, 1000000000.0] and parameters: {'p_sma': 36, 'p_std': 9, 'p_atr': 23, 'p_adx': 16, 'rsi_period': 14, 'ema1': 18, 'ema2': 32, 'slip_atr_k': 0.08686360812543023, 'slip_spread_k': 0.5364150821682432, 'spread_hl_frac': 0.026888212432548655, 'bb_std_mult': 3.4551800768568874, 'rsi_os': 16, 'rsi_ob': 77, 'vol_spike': 0.10983315538613594, 'adx_thresh': 13.253799824672326, 'atr_min_pct': 0.00996152366937004, 'atr_max_pct': 0.029747679257970346, 'tp_mult': 1.2267940319805355, 'tsl_mult': 0.07542754476519153, 'strategy': 'mean_reversion', 'time_stop': 181, 'use_sma': True, 'use_atr': True, 'use_adx': False, 'use_ema': True, 'use_spike': True, 'rsi_required': True, 'edge_k': 1.899734428037623, 'edge_cap': 0.8635504960458948, 'bull_strategy': 'mean_reversion', 'bull_bb_std_mult': 3.205575910036115, 'bull_rsi_os': 44, 'bull_rsi_ob': 79, 'bull_adx_thresh': 27.456060573560137, 'bull_atr_min_pct': 0.0017749127062694973, 'bull_atr_max_pct': 0.10102452951356383, 'bull_tp_mult': 1.2291202274998034, 'bull_tsl_mult': 0.2667772317145813, 'bull_time_stop': 196, 'bull_use_sma': True, 'bull_use_ema': True, 'bull_use_atr': False, 'bull_use_adx': False, 'bull_use_spike': False, 'bull_rsi_required': False, 'bear_strategy': 'breakout', 'bear_bb_std_mult': 3.1337326484100583, 'bear_rsi_os': 47, 'bear_rsi_ob': 64, 'bear_adx_thresh': 27.37525102895232, 'bear_atr_min_pct': 0.008433171430676028, 'bear_atr_max_pct': 0.109976060010052, 'bear_tp_mult': 2.344980865692034, 'bear_tsl_mult': 0.6140247954303895, 'bear_time_stop': 19, 'bear_use_sma': False, 'bear_use_ema': True, 'bear_use_atr': False, 'bear_use_adx': True, 'bear_use_spike': False, 'bear_rsi_required': False, 'sideways_strategy': 'breakout', 'sideways_bb_std_mult': 0.6826329743713784, 'sideways_rsi_os': 45, 'sideways_rsi_ob': 46, 'sideways_adx_thresh': 27.731485089991864, 'sideways_atr_min_pct': 0.013896942475146114, 'sideways_atr_max_pct': 0.021945542344416258, 'sideways_tp_mult': 2.724812250127274, 'sideways_tsl_mult': 0.5558583103728625, 'sideways_time_stop': 176, 'sideways_use_sma': False, 'sideways_use_ema': True, 'sideways_use_atr': False, 'sideways_use_adx': False, 'sideways_use_spike': False, 'sideways_rsi_required': False}.
