[I 2025-08-30 16:25:42,949] Trial 756 finished with values: [-1000000000.0, 1000000000.0] and parameters: {'p_sma': 20, 'p_std': 54, 'p_atr': 25, 'p_adx': 25, 'rsi_period': 42, 'ema1': 23, 'ema2': 40, 'slip_atr_k': 0.00874552199267871, 'slip_spread_k': 0.7659510056360611, 'spread_hl_frac': 0.009115865639067924, 'bb_std_mult': 2.3315487999816717, 'rsi_os': 16, 'rsi_ob': 86, 'vol_spike': 0.23562270282951192, 'adx_thresh': 8.530131960774371, 'atr_min_pct': 0.02339665495936415, 'atr_max_pct': 0.052306841895794653, 'tp_mult': 1.0851300411190627, 'tsl_mult': 0.3794055555092755, 'strategy': 'breakout', 'time_stop': 171, 'use_sma': False, 'use_atr': False, 'use_adx': True, 'use_ema': True, 'use_spike': False, 'rsi_required': False, 'edge_k': 0.5561759402811709, 'edge_cap': 0.9383057159569461, 'bull_strategy': 'mean_reversion', 'bull_bb_std_mult': 1.6673043071625264, 'bull_rsi_os': 49, 'bull_rsi_ob': 75, 'bull_adx_thresh': 14.451731094485325, 'bull_atr_min_pct': 0.01658542124967845, 'bull_atr_max_pct': 0.10134672268455387, 'bull_tp_mult': 1.9312384097747821, 'bull_tsl_mult': 0.8709395768201916, 'bull_time_stop': 264, 'bull_use_sma': True, 'bull_use_ema': False, 'bull_use_atr': False, 'bull_use_adx': True, 'bull_use_spike': True, 'bull_rsi_required': False, 'bear_strategy': 'breakout', 'bear_bb_std_mult': 1.7083869588531158, 'bear_rsi_os': 10, 'bear_rsi_ob': 70, 'bear_adx_thresh': 14.659638246054095, 'bear_atr_min_pct': 0.001473161868583563, 'bear_atr_max_pct': 0.08353990250218839, 'bear_tp_mult': 2.6483997238488737, 'bear_tsl_mult': 0.8615465854506809, 'bear_time_stop': 86, 'bear_use_sma': True, 'bear_use_ema': True, 'bear_use_atr': True, 'bear_use_adx': False, 'bear_use_spike': True, 'bear_rsi_required': True, 'sideways_strategy': 'mean_reversion', 'sideways_bb_std_mult': 3.094369149086155, 'sideways_rsi_os': 28, 'sideways_rsi_ob': 78, 'sideways_adx_thresh': 30.191265417083248, 'sideways_atr_min_pct': 0.01916035454287778, 'sideways_atr_max_pct': 0.07411748588610975, 'sideways_tp_mult': 1.191447671515971, 'sideways_tsl_mult': 0.41482206327186805, 'sideways_time_stop': 25, 'sideways_use_sma': True, 'sideways_use_ema': False, 'sideways_use_atr': True, 'sideways_use_adx': True, 'sideways_use_spike': True, 'sideways_rsi_required': True}.
[I 2025-08-30 16:25:43,457] Trial 755 finished with values: [-1000000000.0, 1000000000.0] and parameters: {'p_sma': 6, 'p_std': 21, 'p_atr': 12, 'p_adx': 25, 'rsi_period': 9, 'ema1': 27, 'ema2': 39, 'slip_atr_k': 0.007897146359358202, 'slip_spread_k': 0.7640502534388497, 'spread_hl_frac': 0.013975035840706636, 'bb_std_mult': 2.320748379143451, 'rsi_os': 24, 'rsi_ob': 85, 'vol_spike': 0.2183087491010353, 'adx_thresh': 8.574700090897366, 'atr_min_pct': 0.023075269958036847, 'atr_max_pct': 0.11452383151896962, 'tp_mult': 1.5420433525582489, 'tsl_mult': 0.8803598873991128, 'strategy': 'breakout', 'time_stop': 105, 'use_sma': False, 'use_atr': True, 'use_adx': False, 'use_ema': False, 'use_spike': True, 'rsi_required': False, 'edge_k': 1.5478532475199434, 'edge_cap': 0.9986178656464831, 'bull_strategy': 'breakout', 'bull_bb_std_mult': 1.6472523835295458, 'bull_rsi_os': 25, 'bull_rsi_ob': 89, 'bull_adx_thresh': 6.952513235429942, 'bull_atr_min_pct': 0.0188257312775537, 'bull_atr_max_pct': 0.12135622947874859, 'bull_tp_mult': 1.9245388598434832, 'bull_tsl_mult': 0.12875929969862832, 'bull_time_stop': 258, 'bull_use_sma': True, 'bull_use_ema': False, 'bull_use_atr': True, 'bull_use_adx': True, 'bull_use_spike': True, 'bull_rsi_required': False, 'bear_strategy': 'mean_reversion', 'bear_bb_std_mult': 2.026981263919475, 'bear_rsi_os': 44, 'bear_rsi_ob': 76, 'bear_adx_thresh': 14.061400169278897, 'bear_atr_min_pct': 0.0017290383733243753, 'bear_atr_max_pct': 0.03059625232724234, 'bear_tp_mult': 2.3873344591098222, 'bear_tsl_mult': 0.38173504337977904, 'bear_time_stop': 86, 'bear_use_sma': True, 'bear_use_ema': True, 'bear_use_atr': False, 'bear_use_adx': False, 'bear_use_spike': True, 'bear_rsi_required': True, 'sideways_strategy': 'mean_reversion', 'sideways_bb_std_mult': 3.0931175618270457, 'sideways_rsi_os': 18, 'sideways_rsi_ob': 78, 'sideways_adx_thresh': 10.067225076982782, 'sideways_atr_min_pct': 0.028616951650078472, 'sideways_atr_max_pct': 0.04762485013155147, 'sideways_tp_mult': 1.195903651233495, 'sideways_tsl_mult': 0.08659719254539189, 'sideways_time_stop': 21, 'sideways_use_sma': True, 'sideways_use_ema': False, 'sideways_use_atr': True, 'sideways_use_adx': False, 'sideways_use_spike': True, 'sideways_rsi_required': True}.
[I 2025-08-30 16:25:44,110] Trial 758 finished with values: [-1000000000.0, 1000000000.0] and parameters: {'p_sma': 24, 'p_std': 14, 'p_atr': 12, 'p_adx': 25, 'rsi_period': 11, 'ema1': 27, 'ema2': 34, 'slip_atr_k': 0.2327439982301362, 'slip_spread_k': 0.7598872295115611, 'spread_hl_frac': 0.00871993708648407, 'bb_std_mult': 2.681525776512518, 'rsi_os': 34, 'rsi_ob': 46, 'vol_spike': 0.2365323039304425, 'adx_thresh': 30.18127749117959, 'atr_min_pct': 0.008058111253258466, 'atr_max_pct': 0.1432465265584732, 'tp_mult': 1.3680298606896475, 'tsl_mult': 0.07592277053670665, 'strategy': 'breakout', 'time_stop': 170, 'use_sma': False, 'use_atr': False, 'use_adx': True, 'use_ema': False, 'use_spike': False, 'rsi_required': False, 'edge_k': 0.544531008542274, 'edge_cap': 0.9466716940335431, 'bull_strategy': 'breakout', 'bull_bb_std_mult': 1.64073737212339, 'bull_rsi_os': 49, 'bull_rsi_ob': 89, 'bull_adx_thresh': 24.575369645673643, 'bull_atr_min_pct': 0.02209174175797981, 'bull_atr_max_pct': 0.12263156639505737, 'bull_tp_mult': 2.1972429204197503, 'bull_tsl_mult': 0.727841318052335, 'bull_time_stop': 270, 'bull_use_sma': True, 'bull_use_ema': False, 'bull_use_atr': True, 'bull_use_adx': True, 'bull_use_spike': True, 'bull_rsi_required': True, 'bear_strategy': 'mean_reversion', 'bear_bb_std_mult': 0.5850550229036608, 'bear_rsi_os': 10, 'bear_rsi_ob': 76, 'bear_adx_thresh': 10.325228665488563, 'bear_atr_min_pct': 0.00242759984396536, 'bear_atr_max_pct': 0.08183252772403986, 'bear_tp_mult': 2.655651158534317, 'bear_tsl_mult': 0.8406674513990602, 'bear_time_stop': 184, 'bear_use_sma': True, 'bear_use_ema': True, 'bear_use_atr': True, 'bear_use_adx': False, 'bear_use_spike': True, 'bear_rsi_required': True, 'sideways_strategy': 'breakout', 'sideways_bb_std_mult': 3.089367441728463, 'sideways_rsi_os': 9, 'sideways_rsi_ob': 60, 'sideways_adx_thresh': 9.69636099014941, 'sideways_atr_min_pct': 0.01934213399263111, 'sideways_atr_max_pct': 0.030184997443209294, 'sideways_tp_mult': 1.1990249235598887, 'sideways_tsl_mult': 0.43307664207785673, 'sideways_time_stop': 5, 'sideways_use_sma': False, 'sideways_use_ema': True, 'sideways_use_atr': True, 'sideways_use_adx': True, 'sideways_use_spike': True, 'sideways_rsi_required': True}.
[I 2025-08-30 16:25:45,273] Trial 760 finished with values: [-1000000000.0, 1000000000.0] and parameters: {'p_sma': 27, 'p_std': 21, 'p_atr': 23, 'p_adx': 24, 'rsi_period': 60, 'ema1': 28, 'ema2': 39, 'slip_atr_k': 0.2154353340835927, 'slip_spread_k': 0.678350002141122, 'spread_hl_frac': 0.02217605495382856, 'bb_std_mult': 0.5407794385929228, 'rsi_os': 54, 'rsi_ob': 46, 'vol_spike': 0.04106475907219165, 'adx_thresh': 9.992721907698026, 'atr_min_pct': 0.008583483438759223, 'atr_max_pct': 0.11147943426380344, 'tp_mult': 1.4998940580981184, 'tsl_mult': 0.06717228641943312, 'strategy': 'mean_reversion', 'time_stop': 157, 'use_sma': True, 'use_atr': False, 'use_adx': True, 'use_ema': False, 'use_spike': False, 'rsi_required': False, 'edge_k': 1.5514438067017486, 'edge_cap': 0.9744086000337812, 'bull_strategy': 'breakout', 'bull_bb_std_mult': 1.4992122701626818, 'bull_rsi_os': 33, 'bull_rsi_ob': 89, 'bull_adx_thresh': 8.130608869185725, 'bull_atr_min_pct': 0.020352495541745622, 'bull_atr_max_pct': 0.12026680682297411, 'bull_tp_mult': 1.8083926888360882, 'bull_tsl_mult': 0.8495568462117646, 'bull_time_stop': 177, 'bull_use_sma': False, 'bull_use_ema': True, 'bull_use_atr': True, 'bull_use_adx': True, 'bull_use_spike': True, 'bull_rsi_required': True, 'bear_strategy': 'mean_reversion', 'bear_bb_std_mult': 1.4571412633057004, 'bear_rsi_os': 45, 'bear_rsi_ob': 45, 'bear_adx_thresh': 13.203813959498525, 'bear_atr_min_pct': 0.002391641482832101, 'bear_atr_max_pct': 0.1081071168012509, 'bear_tp_mult': 2.6784987390054487, 'bear_tsl_mult': 0.8343492396950254, 'bear_time_stop': 102, 'bear_use_sma': False, 'bear_use_ema': False, 'bear_use_atr': True, 'bear_use_adx': True, 'bear_use_spike': True, 'bear_rsi_required': True, 'sideways_strategy': 'breakout', 'sideways_bb_std_mult': 3.014094905465724, 'sideways_rsi_os': 18, 'sideways_rsi_ob': 71, 'sideways_adx_thresh': 32.85692187055788, 'sideways_atr_min_pct': 0.017111308675495027, 'sideways_atr_max_pct': 0.028567547346526438, 'sideways_tp_mult': 1.413917101558941, 'sideways_tsl_mult': 0.37755044221106876, 'sideways_time_stop': 144, 'sideways_use_sma': False, 'sideways_use_ema': True, 'sideways_use_atr': True, 'sideways_use_adx': True, 'sideways_use_spike': False, 'sideways_rsi_required': False}.
[I 2025-08-30 16:26:30,445] Trial 761 finished with values: [-1000000000.0, 1000000000.0] and parameters: {'p_sma': 10, 'p_std': 59, 'p_atr': 13, 'p_adx': 24, 'rsi_period': 14, 'ema1': 27, 'ema2': 22, 'slip_atr_k': 0.005065826924173891, 'slip_spread_k': 0.7178751914031394, 'spread_hl_frac': 0.01834017984675919, 'bb_std_mult': 0.5445785326838053, 'rsi_os': 26, 'rsi_ob': 67, 'vol_spike': 0.0445387925345645, 'adx_thresh': 10.05162490699377, 'atr_min_pct': 0.008202023954974894, 'atr_max_pct': 0.11059167834932858, 'tp_mult': 2.8457822094285494, 'tsl_mult': 0.40771087555761637, 'strategy': 'mean_reversion', 'time_stop': 22, 'use_sma': True, 'use_atr': False, 'use_adx': True, 'use_ema': False, 'use_spike': False, 'rsi_required': False, 'edge_k': 0.5121202111009779, 'edge_cap': 0.9731522096503097, 'bull_strategy': 'breakout', 'bull_bb_std_mult': 1.48748216003825, 'bull_rsi_os': 52, 'bull_rsi_ob': 88, 'bull_adx_thresh': 8.668823301558216, 'bull_atr_min_pct': 0.02196568976219277, 'bull_atr_max_pct': 0.03591652625482864, 'bull_tp_mult': 2.685377822616085, 'bull_tsl_mult': 0.8433596091193872, 'bull_time_stop': 204, 'bull_use_sma': False, 'bull_use_ema': True, 'bull_use_atr': True, 'bull_use_adx': True, 'bull_use_spike': True, 'bull_rsi_required': True, 'bear_strategy': 'mean_reversion', 'bear_bb_std_mult': 1.582765497603009, 'bear_rsi_os': 31, 'bear_rsi_ob': 78, 'bear_adx_thresh': 13.131308725472776, 'bear_atr_min_pct': 0.01966931463449823, 'bear_atr_max_pct': 0.10870158663381975, 'bear_tp_mult': 2.672511782497537, 'bear_tsl_mult': 0.04838814104901645, 'bear_time_stop': 184, 'bear_use_sma': False, 'bear_use_ema': False, 'bear_use_atr': True, 'bear_use_adx': True, 'bear_use_spike': False, 'bear_rsi_required': True, 'sideways_strategy': 'breakout', 'sideways_bb_std_mult': 3.022976675081729, 'sideways_rsi_os': 20, 'sideways_rsi_ob': 74, 'sideways_adx_thresh': 7.607092755024057, 'sideways_atr_min_pct': 0.02178725689933482, 'sideways_atr_max_pct': 0.05569589646116621, 'sideways_tp_mult': 1.5602879118303736, 'sideways_tsl_mult': 0.5131625929586145, 'sideways_time_stop': 144, 'sideways_use_sma': False, 'sideways_use_ema': True, 'sideways_use_atr': True, 'sideways_use_adx': True, 'sideways_use_spike': False, 'sideways_rsi_required': False}.
[I 2025-08-30 16:26:31,174] Trial 763 finished with values: [-1000000000.0, 1000000000.0] and parameters: {'p_sma': 9, 'p_std': 50, 'p_atr': 13, 'p_adx': 13, 'rsi_period': 10, 'ema1': 8, 'ema2': 22, 'slip_atr_k': 0.005899848199108584, 'slip_spread_k': 0.41780771616847556, 'spread_hl_frac': 0.007253194998063189, 'bb_std_mult': 1.4784571256924046, 'rsi_os': 27, 'rsi_ob': 87, 'vol_spike': 0.0606743055917003, 'adx_thresh': 9.472770909360383, 'atr_min_pct': 0.021073121677132038, 'atr_max_pct': 0.03089637358481387, 'tp_mult': 1.1771717111337232, 'tsl_mult': 0.7852477345700326, 'strategy': 'breakout', 'time_stop': 143, 'use_sma': True, 'use_atr': False, 'use_adx': True, 'use_ema': False, 'use_spike': False, 'rsi_required': False, 'edge_k': 0.8317405003293833, 'edge_cap': 0.6497693490930494, 'bull_strategy': 'breakout', 'bull_bb_std_mult': 1.4902485753311074, 'bull_rsi_os': 9, 'bull_rsi_ob': 92, 'bull_adx_thresh': 21.24994046461934, 'bull_atr_min_pct': 0.019784804013267612, 'bull_atr_max_pct': 0.10459586444414411, 'bull_tp_mult': 2.670256897808967, 'bull_tsl_mult': 0.8962815145458516, 'bull_time_stop': 198, 'bull_use_sma': True, 'bull_use_ema': True, 'bull_use_atr': True, 'bull_use_adx': False, 'bull_use_spike': True, 'bull_rsi_required': False, 'bear_strategy': 'mean_reversion', 'bear_bb_std_mult': 0.7330054042564935, 'bear_rsi_os': 31, 'bear_rsi_ob': 60, 'bear_adx_thresh': 16.39683187434352, 'bear_atr_min_pct': 0.012114733989858562, 'bear_atr_max_pct': 0.10974072468923306, 'bear_tp_mult': 2.1057671703825798, 'bear_tsl_mult': 0.5110637030615817, 'bear_time_stop': 172, 'bear_use_sma': True, 'bear_use_ema': False, 'bear_use_atr': True, 'bear_use_adx': True, 'bear_use_spike': False, 'bear_rsi_required': True, 'sideways_strategy': 'mean_reversion', 'sideways_bb_std_mult': 2.655395419256221, 'sideways_rsi_os': 25, 'sideways_rsi_ob': 72, 'sideways_adx_thresh': 7.667999862662434, 'sideways_atr_min_pct': 0.02636295541056822, 'sideways_atr_max_pct': 0.07298429866781696, 'sideways_tp_mult': 1.5699784930437863, 'sideways_tsl_mult': 0.7498365514298325, 'sideways_time_stop': 125, 'sideways_use_sma': True, 'sideways_use_ema': False, 'sideways_use_atr': False, 'sideways_use_adx': True, 'sideways_use_spike': True, 'sideways_rsi_required': True}.
[I 2025-08-30 16:26:32,017] Trial 762 finished with values: [-1000000000.0, 1000000000.0] and parameters: {'p_sma': 10, 'p_std': 25, 'p_atr': 20, 'p_adx': 13, 'rsi_period': 34, 'ema1': 23, 'ema2': 29, 'slip_atr_k': 0.2142510391344352, 'slip_spread_k': 0.6837046699793341, 'spread_hl_frac': 0.032069750116822136, 'bb_std_mult': 0.5492837731447675, 'rsi_os': 20, 'rsi_ob': 87, 'vol_spike': 0.2283636784547181, 'adx_thresh': 10.021666578286885, 'atr_min_pct': 0.0073160969299472176, 'atr_max_pct': 0.11187896968042438, 'tp_mult': 2.9487660338867694, 'tsl_mult': 0.4065682087212447, 'strategy': 'mean_reversion', 'time_stop': 156, 'use_sma': True, 'use_atr': False, 'use_adx': True, 'use_ema': False, 'use_spike': False, 'rsi_required': False, 'edge_k': 1.3777113101185552, 'edge_cap': 0.3720094123108014, 'bull_strategy': 'breakout', 'bull_bb_std_mult': 3.5378264498119685, 'bull_rsi_os': 48, 'bull_rsi_ob': 92, 'bull_adx_thresh': 8.450432980480583, 'bull_atr_min_pct': 0.020100950920094257, 'bull_atr_max_pct': 0.035971398525025955, 'bull_tp_mult': 2.6761106275020525, 'bull_tsl_mult': 0.8969454911531932, 'bull_time_stop': 56, 'bull_use_sma': False, 'bull_use_ema': True, 'bull_use_atr': True, 'bull_use_adx': True, 'bull_use_spike': True, 'bull_rsi_required': True, 'bear_strategy': 'mean_reversion', 'bear_bb_std_mult': 1.5049255885206247, 'bear_rsi_os': 23, 'bear_rsi_ob': 73, 'bear_adx_thresh': 15.221410335580103, 'bear_atr_min_pct': 0.0028227988694225353, 'bear_atr_max_pct': 0.10932158202902512, 'bear_tp_mult': 2.562318283229906, 'bear_tsl_mult': 0.9218481088952231, 'bear_time_stop': 103, 'bear_use_sma': False, 'bear_use_ema': False, 'bear_use_atr': True, 'bear_use_adx': True, 'bear_use_spike': False, 'bear_rsi_required': True, 'sideways_strategy': 'breakout', 'sideways_bb_std_mult': 3.2434127085482203, 'sideways_rsi_os': 7, 'sideways_rsi_ob': 73, 'sideways_adx_thresh': 10.903686500405847, 'sideways_atr_min_pct': 0.018628027074537947, 'sideways_atr_max_pct': 0.13318024601974382, 'sideways_tp_mult': 2.670958224329035, 'sideways_tsl_mult': 0.36829195854358, 'sideways_time_stop': 145, 'sideways_use_sma': False, 'sideways_use_ema': True, 'sideways_use_atr': False, 'sideways_use_adx': True, 'sideways_use_spike': False, 'sideways_rsi_required': False}.
[I 2025-08-30 16:26:32,765] Trial 759 finished with values: [-1000000000.0, 1000000000.0] and parameters: {'p_sma': 10, 'p_std': 60, 'p_atr': 27, 'p_adx': 24, 'rsi_period': 14, 'ema1': 27, 'ema2': 40, 'slip_atr_k': 0.0055298252607524434, 'slip_spread_k': 0.7721864334934351, 'spread_hl_frac': 0.025257482455266274, 'bb_std_mult': 0.5485525842136161, 'rsi_os': 36, 'rsi_ob': 85, 'vol_spike': 0.23306311828874005, 'adx_thresh': 8.432933107442222, 'atr_min_pct': 0.008244259831813702, 'atr_max_pct': 0.12886273149842756, 'tp_mult': 2.9454085129023877, 'tsl_mult': 0.06332163043745254, 'strategy': 'breakout', 'time_stop': 157, 'use_sma': True, 'use_atr': False, 'use_adx': True, 'use_ema': False, 'use_spike': False, 'rsi_required': False, 'edge_k': 0.42453816480543755, 'edge_cap': 0.6162897168957433, 'bull_strategy': 'breakout', 'bull_bb_std_mult': 1.6350527223693194, 'bull_rsi_os': 52, 'bull_rsi_ob': 89, 'bull_adx_thresh': 7.203067078217305, 'bull_atr_min_pct': 0.02009776313309676, 'bull_atr_max_pct': 0.12105680657869139, 'bull_tp_mult': 1.9527764628878599, 'bull_tsl_mult': 0.6304371811262126, 'bull_time_stop': 149, 'bull_use_sma': True, 'bull_use_ema': False, 'bull_use_atr': True, 'bull_use_adx': True, 'bull_use_spike': True, 'bull_rsi_required': True, 'bear_strategy': 'mean_reversion', 'bear_bb_std_mult': 0.5128015298429851, 'bear_rsi_os': 7, 'bear_rsi_ob': 70, 'bear_adx_thresh': 14.983913870280881, 'bear_atr_min_pct': 0.002531085210032888, 'bear_atr_max_pct': 0.10853264135587601, 'bear_tp_mult': 2.672785932044348, 'bear_tsl_mult': 0.8323165171655168, 'bear_time_stop': 84, 'bear_use_sma': True, 'bear_use_ema': True, 'bear_use_atr': True, 'bear_use_adx': False, 'bear_use_spike': True, 'bear_rsi_required': True, 'sideways_strategy': 'breakout', 'sideways_bb_std_mult': 3.0519238661227592, 'sideways_rsi_os': 17, 'sideways_rsi_ob': 88, 'sideways_adx_thresh': 5.749943074071979, 'sideways_atr_min_pct': 0.01894874688406707, 'sideways_atr_max_pct': 0.11026997354884549, 'sideways_tp_mult': 1.5881318462930785, 'sideways_tsl_mult': 0.4193609099262201, 'sideways_time_stop': 210, 'sideways_use_sma': False, 'sideways_use_ema': True, 'sideways_use_atr': True, 'sideways_use_adx': True, 'sideways_use_spike': True, 'sideways_rsi_required': True}.
[I 2025-08-30 16:27:17,481] Trial 765 finished with values: [-1000000000.0, 1000000000.0] and parameters: {'p_sma': 18, 'p_std': 18, 'p_atr': 11, 'p_adx': 24, 'rsi_period': 34, 'ema1': 7, 'ema2': 17, 'slip_atr_k': 0.0043606321933068876, 'slip_spread_k': 0.6571274162333149, 'spread_hl_frac': 0.005836904799542983, 'bb_std_mult': 0.9423337183644582, 'rsi_os': 47, 'rsi_ob': 89, 'vol_spike': 0.23057833706262104, 'adx_thresh': 19.00109975290707, 'atr_min_pct': 0.006050947693112473, 'atr_max_pct': 0.1286744425496612, 'tp_mult': 1.4922942073995116, 'tsl_mult': 0.998963245532994, 'strategy': 'breakout', 'time_stop': 156, 'use_sma': False, 'use_atr': False, 'use_adx': True, 'use_ema': False, 'use_spike': False, 'rsi_required': True, 'edge_k': 0.5926865196250225, 'edge_cap': 0.619431749251122, 'bull_strategy': 'breakout', 'bull_bb_std_mult': 0.9454035848047657, 'bull_rsi_os': 46, 'bull_rsi_ob': 90, 'bull_adx_thresh': 16.185191895708787, 'bull_atr_min_pct': 0.019124813107239465, 'bull_atr_max_pct': 0.0934840913290378, 'bull_tp_mult': 2.563286499157074, 'bull_tsl_mult': 0.9196589907856446, 'bull_time_stop': 57, 'bull_use_sma': True, 'bull_use_ema': True, 'bull_use_atr': True, 'bull_use_adx': True, 'bull_use_spike': False, 'bull_rsi_required': False, 'bear_strategy': 'mean_reversion', 'bear_bb_std_mult': 2.1198881280251953, 'bear_rsi_os': 26, 'bear_rsi_ob': 73, 'bear_adx_thresh': 15.128359538542366, 'bear_atr_min_pct': 0.002857936073149256, 'bear_atr_max_pct': 0.11827528609203439, 'bear_tp_mult': 2.5707583885123353, 'bear_tsl_mult': 0.9097485819871218, 'bear_time_stop': 47, 'bear_use_sma': True, 'bear_use_ema': False, 'bear_use_atr': True, 'bear_use_adx': True, 'bear_use_spike': True, 'bear_rsi_required': False, 'sideways_strategy': 'mean_reversion', 'sideways_bb_std_mult': 3.2734094860255634, 'sideways_rsi_os': 49, 'sideways_rsi_ob': 81, 'sideways_adx_thresh': 10.820672266749234, 'sideways_atr_min_pct': 0.018972305320859677, 'sideways_atr_max_pct': 0.07637387613473919, 'sideways_tp_mult': 2.649025933150119, 'sideways_tsl_mult': 0.36371269928329847, 'sideways_time_stop': 132, 'sideways_use_sma': True, 'sideways_use_ema': False, 'sideways_use_atr': True, 'sideways_use_adx': True, 'sideways_use_spike': True, 'sideways_rsi_required': True}.
