[I 2025-08-30 15:18:12,783] Trial 423 finished with values: [-1000000000.0, 1000000000.0] and parameters: {'p_sma': 16, 'p_std': 28, 'p_atr': 10, 'p_adx': 25, 'rsi_period': 49, 'ema1': 24, 'ema2': 35, 'slip_atr_k': 0.003972799799266655, 'slip_spread_k': 0.6173186424843936, 'spread_hl_frac': 0.004171926369726775, 'bb_std_mult': 1.6004436254510988, 'rsi_os': 22, 'rsi_ob': 68, 'vol_spike': 0.27670691535842773, 'adx_thresh': 7.384816236713888, 'atr_min_pct': 0.006934974522073358, 'atr_max_pct': 0.1121566164802604, 'tp_mult': 1.7256678129849012, 'tsl_mult': 0.5181786920234088, 'strategy': 'breakout', 'time_stop': 156, 'use_sma': False, 'use_atr': True, 'use_adx': True, 'use_ema': True, 'use_spike': False, 'rsi_required': False, 'edge_k': 0.5751364889054347, 'edge_cap': 0.2691466073123377, 'bull_strategy': 'breakout', 'bull_bb_std_mult': 1.5521049841817682, 'bull_rsi_os': 35, 'bull_rsi_ob': 90, 'bull_adx_thresh': 12.710007561722648, 'bull_atr_min_pct': 0.006143374422529208, 'bull_atr_max_pct': 0.10466349625982481, 'bull_tp_mult': 2.573808955230044, 'bull_tsl_mult': 0.6597389470161297, 'bull_time_stop': 23, 'bull_use_sma': True, 'bull_use_ema': True, 'bull_use_atr': True, 'bull_use_adx': True, 'bull_use_spike': True, 'bull_rsi_required': False, 'bear_strategy': 'mean_reversion', 'bear_bb_std_mult': 1.8105207191506834, 'bear_rsi_os': 27, 'bear_rsi_ob': 69, 'bear_adx_thresh': 10.78255305451185, 'bear_atr_min_pct': 0.00378253072959907, 'bear_atr_max_pct': 0.10443839762540695, 'bear_tp_mult': 2.6872583480917127, 'bear_tsl_mult': 0.0034879583538703907, 'bear_time_stop': 78, 'bear_use_sma': True, 'bear_use_ema': False, 'bear_use_atr': True, 'bear_use_adx': True, 'bear_use_spike': True, 'bear_rsi_required': True, 'sideways_strategy': 'mean_reversion', 'sideways_bb_std_mult': 3.081180607798136, 'sideways_rsi_os': 32, 'sideways_rsi_ob': 52, 'sideways_adx_thresh': 7.967910318174871, 'sideways_atr_min_pct': 0.017759060937809643, 'sideways_atr_max_pct': 0.048884446529211756, 'sideways_tp_mult': 2.180443381374651, 'sideways_tsl_mult': 0.324624549029852, 'sideways_time_stop': 112, 'sideways_use_sma': False, 'sideways_use_ema': True, 'sideways_use_atr': True, 'sideways_use_adx': True, 'sideways_use_spike': True, 'sideways_rsi_required': True}.
[I 2025-08-30 15:18:12,792] Trial 424 finished with values: [-1000000000.0, 1000000000.0] and parameters: {'p_sma': 16, 'p_std': 30, 'p_atr': 10, 'p_adx': 26, 'rsi_period': 49, 'ema1': 28, 'ema2': 39, 'slip_atr_k': 0.004069746712932462, 'slip_spread_k': 0.7083300708057079, 'spread_hl_frac': 0.004213062600768231, 'bb_std_mult': 2.119417853747861, 'rsi_os': 22, 'rsi_ob': 86, 'vol_spike': 0.12534402587707716, 'adx_thresh': 7.038667792983487, 'atr_min_pct': 0.006994296760376026, 'atr_max_pct': 0.12413156851767009, 'tp_mult': 1.7030042765870934, 'tsl_mult': 0.5247803584081786, 'strategy': 'breakout', 'time_stop': 156, 'use_sma': False, 'use_atr': True, 'use_adx': True, 'use_ema': True, 'use_spike': False, 'rsi_required': False, 'edge_k': 0.5798507736653422, 'edge_cap': 0.7164405718576091, 'bull_strategy': 'breakout', 'bull_bb_std_mult': 1.5367556881185545, 'bull_rsi_os': 16, 'bull_rsi_ob': 90, 'bull_adx_thresh': 13.091643918872297, 'bull_atr_min_pct': 0.025364363132596955, 'bull_atr_max_pct': 0.1284175971439023, 'bull_tp_mult': 2.5437961552538875, 'bull_tsl_mult': 0.5098204421387711, 'bull_time_stop': 21, 'bull_use_sma': True, 'bull_use_ema': True, 'bull_use_atr': True, 'bull_use_adx': True, 'bull_use_spike': True, 'bull_rsi_required': True, 'bear_strategy': 'mean_reversion', 'bear_bb_std_mult': 2.298297495483074, 'bear_rsi_os': 27, 'bear_rsi_ob': 69, 'bear_adx_thresh': 10.763223785520923, 'bear_atr_min_pct': 0.003641633160238176, 'bear_atr_max_pct': 0.12501129326111807, 'bear_tp_mult': 2.3611693395691007, 'bear_tsl_mult': 0.6178486353047192, 'bear_time_stop': 106, 'bear_use_sma': True, 'bear_use_ema': False, 'bear_use_atr': True, 'bear_use_adx': True, 'bear_use_spike': True, 'bear_rsi_required': True, 'sideways_strategy': 'breakout', 'sideways_bb_std_mult': 3.2592128249210948, 'sideways_rsi_os': 32, 'sideways_rsi_ob': 52, 'sideways_adx_thresh': 8.15467931139904, 'sideways_atr_min_pct': 0.010658608290629736, 'sideways_atr_max_pct': 0.05581400460936465, 'sideways_tp_mult': 2.175628687068897, 'sideways_tsl_mult': 0.38492005446612765, 'sideways_time_stop': 298, 'sideways_use_sma': False, 'sideways_use_ema': True, 'sideways_use_atr': True, 'sideways_use_adx': True, 'sideways_use_spike': True, 'sideways_rsi_required': True}.
[I 2025-08-30 15:19:00,895] Trial 426 finished with values: [-0.005103077695677527, 0.006118363479462676] and parameters: {'p_sma': 14, 'p_std': 30, 'p_atr': 11, 'p_adx': 27, 'rsi_period': 12, 'ema1': 27, 'ema2': 40, 'slip_atr_k': 0.0038289255112092637, 'slip_spread_k': 0.6964636293425734, 'spread_hl_frac': 0.004417192055361399, 'bb_std_mult': 0.7541808677688386, 'rsi_os': 21, 'rsi_ob': 67, 'vol_spike': 0.1474946694698097, 'adx_thresh': 7.583660867325643, 'atr_min_pct': 0.008268737829269495, 'atr_max_pct': 0.10945622682337593, 'tp_mult': 1.6948392637464382, 'tsl_mult': 0.5703465944259469, 'strategy': 'breakout', 'time_stop': 142, 'use_sma': False, 'use_atr': False, 'use_adx': True, 'use_ema': False, 'use_spike': False, 'rsi_required': False, 'edge_k': 0.5504870503733043, 'edge_cap': 0.7176621280439647, 'bull_strategy': 'breakout', 'bull_bb_std_mult': 1.6866813035316948, 'bull_rsi_os': 16, 'bull_rsi_ob': 92, 'bull_adx_thresh': 10.42751080695739, 'bull_atr_min_pct': 0.01966842208017281, 'bull_atr_max_pct': 0.12833494467484177, 'bull_tp_mult': 2.6679836838764093, 'bull_tsl_mult': 0.9167616934268363, 'bull_time_stop': 59, 'bull_use_sma': True, 'bull_use_ema': True, 'bull_use_atr': True, 'bull_use_adx': False, 'bull_use_spike': True, 'bull_rsi_required': True, 'bear_strategy': 'mean_reversion', 'bear_bb_std_mult': 2.317195407515072, 'bear_rsi_os': 27, 'bear_rsi_ob': 71, 'bear_adx_thresh': 9.29862722608102, 'bear_atr_min_pct': 0.0029400803344908195, 'bear_atr_max_pct': 0.1278045079939418, 'bear_tp_mult': 2.270461037468084, 'bear_tsl_mult': 0.299495333983786, 'bear_time_stop': 106, 'bear_use_sma': True, 'bear_use_ema': False, 'bear_use_atr': True, 'bear_use_adx': True, 'bear_use_spike': True, 'bear_rsi_required': True, 'sideways_strategy': 'breakout', 'sideways_bb_std_mult': 3.070722836397583, 'sideways_rsi_os': 32, 'sideways_rsi_ob': 51, 'sideways_adx_thresh': 8.3102453846292, 'sideways_atr_min_pct': 0.010821051371556027, 'sideways_atr_max_pct': 0.08601522292699006, 'sideways_tp_mult': 2.1929193149164896, 'sideways_tsl_mult': 0.3862852552793335, 'sideways_time_stop': 130, 'sideways_use_sma': True, 'sideways_use_ema': False, 'sideways_use_atr': True, 'sideways_use_adx': True, 'sideways_use_spike': True, 'sideways_rsi_required': False}.
[I 2025-08-30 15:19:00,910] Trial 428 finished with values: [-1000000000.0, 1000000000.0] and parameters: {'p_sma': 19, 'p_std': 26, 'p_atr': 11, 'p_adx': 27, 'rsi_period': 64, 'ema1': 27, 'ema2': 39, 'slip_atr_k': 0.008684905962379426, 'slip_spread_k': 0.6873258113971629, 'spread_hl_frac': 0.00592068426090057, 'bb_std_mult': 3.1507667469202345, 'rsi_os': 21, 'rsi_ob': 67, 'vol_spike': 0.14024706477318893, 'adx_thresh': 6.564241984524713, 'atr_min_pct': 0.00829071567014747, 'atr_max_pct': 0.11115289703005071, 'tp_mult': 1.6622635187980337, 'tsl_mult': 0.5724571699659784, 'strategy': 'breakout', 'time_stop': 142, 'use_sma': False, 'use_atr': False, 'use_adx': True, 'use_ema': False, 'use_spike': False, 'rsi_required': False, 'edge_k': 0.5415542396232409, 'edge_cap': 0.6154653792249727, 'bull_strategy': 'breakout', 'bull_bb_std_mult': 1.6493968256415004, 'bull_rsi_os': 24, 'bull_rsi_ob': 92, 'bull_adx_thresh': 13.520068538171248, 'bull_atr_min_pct': 0.018125203843207427, 'bull_atr_max_pct': 0.12161471112247643, 'bull_tp_mult': 2.6460659231929093, 'bull_tsl_mult': 0.8139876602399776, 'bull_time_stop': 12, 'bull_use_sma': True, 'bull_use_ema': True, 'bull_use_atr': True, 'bull_use_adx': False, 'bull_use_spike': True, 'bull_rsi_required': True, 'bear_strategy': 'mean_reversion', 'bear_bb_std_mult': 1.0527927411179472, 'bear_rsi_os': 29, 'bear_rsi_ob': 71, 'bear_adx_thresh': 9.310156829138784, 'bear_atr_min_pct': 0.002787724272062318, 'bear_atr_max_pct': 0.12118623219739189, 'bear_tp_mult': 2.4415060496496954, 'bear_tsl_mult': 0.9417416369592865, 'bear_time_stop': 116, 'bear_use_sma': True, 'bear_use_ema': False, 'bear_use_atr': True, 'bear_use_adx': True, 'bear_use_spike': True, 'bear_rsi_required': True, 'sideways_strategy': 'breakout', 'sideways_bb_std_mult': 3.357213058172202, 'sideways_rsi_os': 31, 'sideways_rsi_ob': 50, 'sideways_adx_thresh': 10.066174286392993, 'sideways_atr_min_pct': 0.01472811204916573, 'sideways_atr_max_pct': 0.08202287047298447, 'sideways_tp_mult': 2.0638176668595665, 'sideways_tsl_mult': 0.3564485467324528, 'sideways_time_stop': 38, 'sideways_use_sma': True, 'sideways_use_ema': False, 'sideways_use_atr': True, 'sideways_use_adx': True, 'sideways_use_spike': True, 'sideways_rsi_required': False}.
[I 2025-08-30 15:19:01,793] Trial 425 finished with values: [-1000000000.0, 1000000000.0] and parameters: {'p_sma': 14, 'p_std': 28, 'p_atr': 10, 'p_adx': 26, 'rsi_period': 50, 'ema1': 20, 'ema2': 40, 'slip_atr_k': 0.004375022638558429, 'slip_spread_k': 0.7097982651545047, 'spread_hl_frac': 0.03811722250829278, 'bb_std_mult': 2.225128027293402, 'rsi_os': 22, 'rsi_ob': 86, 'vol_spike': 0.17519240626480204, 'adx_thresh': 7.23926946459786, 'atr_min_pct': 0.007202147605575674, 'atr_max_pct': 0.10902168460836598, 'tp_mult': 1.6906112582613957, 'tsl_mult': 0.5181643817193532, 'strategy': 'breakout', 'time_stop': 142, 'use_sma': False, 'use_atr': True, 'use_adx': True, 'use_ema': True, 'use_spike': False, 'rsi_required': False, 'edge_k': 0.5596979909791406, 'edge_cap': 0.6443686038091258, 'bull_strategy': 'breakout', 'bull_bb_std_mult': 1.5138308322404814, 'bull_rsi_os': 17, 'bull_rsi_ob': 93, 'bull_adx_thresh': 10.659178493229499, 'bull_atr_min_pct': 0.00629335636284614, 'bull_atr_max_pct': 0.12236054595648058, 'bull_tp_mult': 2.527565046402355, 'bull_tsl_mult': 0.2173737523452976, 'bull_time_stop': 18, 'bull_use_sma': True, 'bull_use_ema': True, 'bull_use_atr': True, 'bull_use_adx': False, 'bull_use_spike': True, 'bull_rsi_required': True, 'bear_strategy': 'mean_reversion', 'bear_bb_std_mult': 1.069631148484092, 'bear_rsi_os': 27, 'bear_rsi_ob': 73, 'bear_adx_thresh': 10.948922109531203, 'bear_atr_min_pct': 0.004062565951667572, 'bear_atr_max_pct': 0.10505746029957437, 'bear_tp_mult': 2.643840849940325, 'bear_tsl_mult': 0.30393189228603684, 'bear_time_stop': 82, 'bear_use_sma': True, 'bear_use_ema': False, 'bear_use_atr': True, 'bear_use_adx': True, 'bear_use_spike': True, 'bear_rsi_required': True, 'sideways_strategy': 'breakout', 'sideways_bb_std_mult': 3.4114657886401045, 'sideways_rsi_os': 32, 'sideways_rsi_ob': 52, 'sideways_adx_thresh': 7.1206571905111335, 'sideways_atr_min_pct': 0.02947455537135922, 'sideways_atr_max_pct': 0.05985499082782053, 'sideways_tp_mult': 2.19662416549883, 'sideways_tsl_mult': 0.3192625198525632, 'sideways_time_stop': 267, 'sideways_use_sma': False, 'sideways_use_ema': False, 'sideways_use_atr': True, 'sideways_use_adx': True, 'sideways_use_spike': True, 'sideways_rsi_required': True}.
[I 2025-08-30 15:19:01,802] Trial 427 finished with values: [-0.0357718147972792, 0.035543048041012916] and parameters: {'p_sma': 14, 'p_std': 22, 'p_atr': 11, 'p_adx': 27, 'rsi_period': 52, 'ema1': 27, 'ema2': 39, 'slip_atr_k': 0.1739036643008337, 'slip_spread_k': 0.6836267334358535, 'spread_hl_frac': 0.04243730124619523, 'bb_std_mult': 2.3561224997397265, 'rsi_os': 21, 'rsi_ob': 88, 'vol_spike': 0.17791583841425426, 'adx_thresh': 6.408126371276426, 'atr_min_pct': 0.00832329706522723, 'atr_max_pct': 0.04706190245224043, 'tp_mult': 1.681499255431568, 'tsl_mult': 0.5740586191442452, 'strategy': 'breakout', 'time_stop': 142, 'use_sma': False, 'use_atr': False, 'use_adx': True, 'use_ema': False, 'use_spike': False, 'rsi_required': False, 'edge_k': 0.5434317373171212, 'edge_cap': 0.3516547948642575, 'bull_strategy': 'breakout', 'bull_bb_std_mult': 1.686034264637866, 'bull_rsi_os': 33, 'bull_rsi_ob': 92, 'bull_adx_thresh': 13.525955798980059, 'bull_atr_min_pct': 0.01965882473248089, 'bull_atr_max_pct': 0.12237025340676767, 'bull_tp_mult': 2.643743414170061, 'bull_tsl_mult': 0.9181674494766178, 'bull_time_stop': 56, 'bull_use_sma': True, 'bull_use_ema': True, 'bull_use_atr': True, 'bull_use_adx': False, 'bull_use_spike': True, 'bull_rsi_required': True, 'bear_strategy': 'mean_reversion', 'bear_bb_std_mult': 2.2114419999089865, 'bear_rsi_os': 45, 'bear_rsi_ob': 72, 'bear_adx_thresh': 9.222816933285513, 'bear_atr_min_pct': 0.002917434657442773, 'bear_atr_max_pct': 0.1298173081675349, 'bear_tp_mult': 2.2891736884094334, 'bear_tsl_mult': 0.33257465704897793, 'bear_time_stop': 116, 'bear_use_sma': True, 'bear_use_ema': False, 'bear_use_atr': True, 'bear_use_adx': True, 'bear_use_spike': True, 'bear_rsi_required': True, 'sideways_strategy': 'breakout', 'sideways_bb_std_mult': 3.3647826128926055, 'sideways_rsi_os': 31, 'sideways_rsi_ob': 50, 'sideways_adx_thresh': 7.018806273896924, 'sideways_atr_min_pct': 0.014445133384042913, 'sideways_atr_max_pct': 0.0778065643608132, 'sideways_tp_mult': 2.0615758368993693, 'sideways_tsl_mult': 0.3542582797206571, 'sideways_time_stop': 109, 'sideways_use_sma': True, 'sideways_use_ema': False, 'sideways_use_atr': True, 'sideways_use_adx': True, 'sideways_use_spike': True, 'sideways_rsi_required': False}.
[I 2025-08-30 15:19:49,636] Trial 431 finished with values: [-0.04616853893637285, 0.04615206697813159] and parameters: {'p_sma': 17, 'p_std': 27, 'p_atr': 11, 'p_adx': 26, 'rsi_period': 53, 'ema1': 19, 'ema2': 38, 'slip_atr_k': 0.13379150007664195, 'slip_spread_k': 0.8098094122777739, 'spread_hl_frac': 0.013095614118649634, 'bb_std_mult': 3.2032254068226704, 'rsi_os': 24, 'rsi_ob': 46, 'vol_spike': 0.15445506438111098, 'adx_thresh': 9.306384913874874, 'atr_min_pct': 0.006542688070932333, 'atr_max_pct': 0.10879800366785417, 'tp_mult': 1.8301590993014554, 'tsl_mult': 0.20261128554415808, 'strategy': 'breakout', 'time_stop': 123, 'use_sma': False, 'use_atr': False, 'use_adx': True, 'use_ema': False, 'use_spike': True, 'rsi_required': False, 'edge_k': 0.6179824061167161, 'edge_cap': 0.5854143039932561, 'bull_strategy': 'breakout', 'bull_bb_std_mult': 1.4595229565798005, 'bull_rsi_os': 13, 'bull_rsi_ob': 88, 'bull_adx_thresh': 9.314096248357815, 'bull_atr_min_pct': 0.021830697329692478, 'bull_atr_max_pct': 0.10032609513735796, 'bull_tp_mult': 2.5966965067966736, 'bull_tsl_mult': 0.9057961060832489, 'bull_time_stop': 49, 'bull_use_sma': True, 'bull_use_ema': True, 'bull_use_atr': True, 'bull_use_adx': False, 'bull_use_spike': True, 'bull_rsi_required': False, 'bear_strategy': 'mean_reversion', 'bear_bb_std_mult': 1.5267057327491544, 'bear_rsi_os': 54, 'bear_rsi_ob': 74, 'bear_adx_thresh': 11.824670803608686, 'bear_atr_min_pct': 0.0019925230000382085, 'bear_atr_max_pct': 0.0742926625772747, 'bear_tp_mult': 2.6053052932902334, 'bear_tsl_mult': 0.5890057835404384, 'bear_time_stop': 71, 'bear_use_sma': True, 'bear_use_ema': False, 'bear_use_atr': True, 'bear_use_adx': True, 'bear_use_spike': True, 'bear_rsi_required': True, 'sideways_strategy': 'mean_reversion', 'sideways_bb_std_mult': 3.2356060127482564, 'sideways_rsi_os': 29, 'sideways_rsi_ob': 47, 'sideways_adx_thresh': 8.805233010130795, 'sideways_atr_min_pct': 0.011624144982535493, 'sideways_atr_max_pct': 0.08621866128390354, 'sideways_tp_mult': 2.2210303054859915, 'sideways_tsl_mult': 0.37562353501713686, 'sideways_time_stop': 213, 'sideways_use_sma': True, 'sideways_use_ema': False, 'sideways_use_atr': True, 'sideways_use_adx': True, 'sideways_use_spike': True, 'sideways_rsi_required': True}.
[I 2025-08-30 15:19:50,473] Trial 429 finished with values: [-0.023210772853280992, 0.023322105456152077] and parameters: {'p_sma': 14, 'p_std': 28, 'p_atr': 11, 'p_adx': 26, 'rsi_period': 52, 'ema1': 21, 'ema2': 40, 'slip_atr_k': 0.0044171198390746125, 'slip_spread_k': 0.7116531327732072, 'spread_hl_frac': 0.013526867839803565, 'bb_std_mult': 3.2662024182543177, 'rsi_os': 24, 'rsi_ob': 48, 'vol_spike': 0.14667108368901707, 'adx_thresh': 9.207600464682294, 'atr_min_pct': 0.006334222564615288, 'atr_max_pct': 0.10912300695086738, 'tp_mult': 1.7545317866106196, 'tsl_mult': 0.5483524116977084, 'strategy': 'breakout', 'time_stop': 124, 'use_sma': False, 'use_atr': False, 'use_adx': True, 'use_ema': False, 'use_spike': False, 'rsi_required': False, 'edge_k': 0.6231260539850931, 'edge_cap': 0.6321773782530443, 'bull_strategy': 'breakout', 'bull_bb_std_mult': 1.4871922611058574, 'bull_rsi_os': 15, 'bull_rsi_ob': 92, 'bull_adx_thresh': 10.470689938598294, 'bull_atr_min_pct': 0.026652986085877427, 'bull_atr_max_pct': 0.12392229659182136, 'bull_tp_mult': 2.661240062345831, 'bull_tsl_mult': 0.20906307185236722, 'bull_time_stop': 50, 'bull_use_sma': True, 'bull_use_ema': True, 'bull_use_atr': True, 'bull_use_adx': False, 'bull_use_spike': True, 'bull_rsi_required': False, 'bear_strategy': 'mean_reversion', 'bear_bb_std_mult': 2.2044234709485506, 'bear_rsi_os': 54, 'bear_rsi_ob': 93, 'bear_adx_thresh': 11.892271013614415, 'bear_atr_min_pct': 0.0017725249485478485, 'bear_atr_max_pct': 0.12980819203094518, 'bear_tp_mult': 2.6435416619726895, 'bear_tsl_mult': 0.5913576178578884, 'bear_time_stop': 85, 'bear_use_sma': True, 'bear_use_ema': False, 'bear_use_atr': True, 'bear_use_adx': True, 'bear_use_spike': True, 'bear_rsi_required': True, 'sideways_strategy': 'mean_reversion', 'sideways_bb_std_mult': 3.414789653869947, 'sideways_rsi_os': 29, 'sideways_rsi_ob': 51, 'sideways_adx_thresh': 8.524319118142182, 'sideways_atr_min_pct': 0.008880329038892574, 'sideways_atr_max_pct': 0.035349691561478346, 'sideways_tp_mult': 2.220191492919284, 'sideways_tsl_mult': 0.31071351397160724, 'sideways_time_stop': 127, 'sideways_use_sma': True, 'sideways_use_ema': False, 'sideways_use_atr': True, 'sideways_use_adx': True, 'sideways_use_spike': True, 'sideways_rsi_required': False}.
[I 2025-08-30 15:19:50,474] Trial 430 finished with values: [-1000000000.0, 1000000000.0] and parameters: {'p_sma': 14, 'p_std': 28, 'p_atr': 11, 'p_adx': 26, 'rsi_period': 11, 'ema1': 21, 'ema2': 38, 'slip_atr_k': 0.00035650234441800635, 'slip_spread_k': 0.7117610560465067, 'spread_hl_frac': 0.016009715970244344, 'bb_std_mult': 3.2073934015388663, 'rsi_os': 24, 'rsi_ob': 62, 'vol_spike': 0.15238708701467896, 'adx_thresh': 9.173503985034017, 'atr_min_pct': 0.0075621835672930295, 'atr_max_pct': 0.10859709411448042, 'tp_mult': 1.8435187748013533, 'tsl_mult': 0.9518916346344923, 'strategy': 'breakout', 'time_stop': 122, 'use_sma': False, 'use_atr': False, 'use_adx': True, 'use_ema': False, 'use_spike': False, 'rsi_required': False, 'edge_k': 0.6001463406105675, 'edge_cap': 0.6469230040554905, 'bull_strategy': 'breakout', 'bull_bb_std_mult': 1.483020203484193, 'bull_rsi_os': 13, 'bull_rsi_ob': 92, 'bull_adx_thresh': 9.40100354250553, 'bull_atr_min_pct': 0.016433201541186993, 'bull_atr_max_pct': 0.11184674371453351, 'bull_tp_mult': 2.6739458434003955, 'bull_tsl_mult': 0.24110576798649508, 'bull_time_stop': 56, 'bull_use_sma': True, 'bull_use_ema': True, 'bull_use_atr': True, 'bull_use_adx': False, 'bull_use_spike': True, 'bull_rsi_required': False, 'bear_strategy': 'mean_reversion', 'bear_bb_std_mult': 1.2451223414210735, 'bear_rsi_os': 55, 'bear_rsi_ob': 72, 'bear_adx_thresh': 16.805459298210735, 'bear_atr_min_pct': 0.004475631171321328, 'bear_atr_max_pct': 0.0848684471044213, 'bear_tp_mult': 2.259209497137265, 'bear_tsl_mult': 0.30575142510793263, 'bear_time_stop': 70, 'bear_use_sma': True, 'bear_use_ema': False, 'bear_use_atr': True, 'bear_use_adx': True, 'bear_use_spike': True, 'bear_rsi_required': True, 'sideways_strategy': 'mean_reversion', 'sideways_bb_std_mult': 3.4362318587414933, 'sideways_rsi_os': 31, 'sideways_rsi_ob': 51, 'sideways_adx_thresh': 7.050650702801391, 'sideways_atr_min_pct': 0.026147811516224764, 'sideways_atr_max_pct': 0.06177146258015341, 'sideways_tp_mult': 2.2321151190618145, 'sideways_tsl_mult': 0.30835927907145794, 'sideways_time_stop': 130, 'sideways_use_sma': True, 'sideways_use_ema': False, 'sideways_use_atr': True, 'sideways_use_adx': True, 'sideways_use_spike': True, 'sideways_rsi_required': False}.
