[I 2025-08-30 16:04:28,984] Trial 645 finished with values: [-0.0040174342211596326, 0.005617345149897136] and parameters: {'p_sma': 11, 'p_std': 22, 'p_atr': 10, 'p_adx': 26, 'rsi_period': 11, 'ema1': 26, 'ema2': 24, 'slip_atr_k': 0.00013472117592782794, 'slip_spread_k': 0.39563057042524524, 'spread_hl_frac': 0.04162744454518802, 'bb_std_mult': 2.2961038479885714, 'rsi_os': 26, 'rsi_ob': 86, 'vol_spike': 0.15843965658556455, 'adx_thresh': 8.580948534974882, 'atr_min_pct': 0.016818617845935024, 'atr_max_pct': 0.11702816738704629, 'tp_mult': 1.641837343111958, 'tsl_mult': 0.9495854571865687, 'strategy': 'breakout', 'time_stop': 138, 'use_sma': False, 'use_atr': False, 'use_adx': True, 'use_ema': False, 'use_spike': False, 'rsi_required': False, 'edge_k': 0.6096543134523367, 'edge_cap': 0.9821873345434509, 'bull_strategy': 'breakout', 'bull_bb_std_mult': 1.7431739531393977, 'bull_rsi_os': 50, 'bull_rsi_ob': 91, 'bull_adx_thresh': 9.211230068941436, 'bull_atr_min_pct': 0.01887664374020675, 'bull_atr_max_pct': 0.10339623785014418, 'bull_tp_mult': 1.3995681849168382, 'bull_tsl_mult': 0.8728890409513097, 'bull_time_stop': 53, 'bull_use_sma': True, 'bull_use_ema': True, 'bull_use_atr': True, 'bull_use_adx': True, 'bull_use_spike': True, 'bull_rsi_required': False, 'bear_strategy': 'mean_reversion', 'bear_bb_std_mult': 2.019649240971853, 'bear_rsi_os': 27, 'bear_rsi_ob': 58, 'bear_adx_thresh': 16.100345665982218, 'bear_atr_min_pct': 0.0041923260290143, 'bear_atr_max_pct': 0.06703069509650285, 'bear_tp_mult': 1.2336764299638574, 'bear_tsl_mult': 0.8784115181452832, 'bear_time_stop': 161, 'bear_use_sma': True, 'bear_use_ema': False, 'bear_use_atr': True, 'bear_use_adx': True, 'bear_use_spike': True, 'bear_rsi_required': True, 'sideways_strategy': 'mean_reversion', 'sideways_bb_std_mult': 0.7100721883239993, 'sideways_rsi_os': 54, 'sideways_rsi_ob': 77, 'sideways_adx_thresh': 30.096742875077652, 'sideways_atr_min_pct': 0.0026808158744082884, 'sideways_atr_max_pct': 0.025577055702277224, 'sideways_tp_mult': 1.5797108632137802, 'sideways_tsl_mult': 0.3711771504410972, 'sideways_time_stop': 124, 'sideways_use_sma': True, 'sideways_use_ema': False, 'sideways_use_atr': True, 'sideways_use_adx': True, 'sideways_use_spike': True, 'sideways_rsi_required': True}.
[I 2025-08-30 16:05:15,878] Trial 652 finished with values: [-1000000000.0, 1000000000.0] and parameters: {'p_sma': 6, 'p_std': 21, 'p_atr': 10, 'p_adx': 25, 'rsi_period': 11, 'ema1': 28, 'ema2': 25, 'slip_atr_k': 0.13496048395270185, 'slip_spread_k': 0.6324727313123424, 'spread_hl_frac': 0.03579145363607791, 'bb_std_mult': 0.6210022080004374, 'rsi_os': 27, 'rsi_ob': 88, 'vol_spike': 0.22838986763792832, 'adx_thresh': 29.055302198974267, 'atr_min_pct': 0.024848843538137162, 'atr_max_pct': 0.11211991308789071, 'tp_mult': 2.7567101058794803, 'tsl_mult': 0.40823223368755723, 'strategy': 'breakout', 'time_stop': 147, 'use_sma': True, 'use_atr': True, 'use_adx': True, 'use_ema': True, 'use_spike': False, 'rsi_required': True, 'edge_k': 0.6197949268869061, 'edge_cap': 0.9165300649356388, 'bull_strategy': 'mean_reversion', 'bull_bb_std_mult': 1.686450143942972, 'bull_rsi_os': 48, 'bull_rsi_ob': 89, 'bull_adx_thresh': 10.407781446108013, 'bull_atr_min_pct': 0.012646526582894472, 'bull_atr_max_pct': 0.013234936720887491, 'bull_tp_mult': 2.5425614550605156, 'bull_tsl_mult': 0.8646840816406555, 'bull_time_stop': 39, 'bull_use_sma': True, 'bull_use_ema': False, 'bull_use_atr': False, 'bull_use_adx': True, 'bull_use_spike': False, 'bull_rsi_required': False, 'bear_strategy': 'breakout', 'bear_bb_std_mult': 1.4369944853662, 'bear_rsi_os': 25, 'bear_rsi_ob': 47, 'bear_adx_thresh': 15.328674712250315, 'bear_atr_min_pct': 0.004062270613799631, 'bear_atr_max_pct': 0.11418602657129595, 'bear_tp_mult': 2.6590484289207166, 'bear_tsl_mult': 0.916464185550284, 'bear_time_stop': 26, 'bear_use_sma': False, 'bear_use_ema': True, 'bear_use_atr': False, 'bear_use_adx': True, 'bear_use_spike': False, 'bear_rsi_required': False, 'sideways_strategy': 'breakout', 'sideways_bb_std_mult': 1.6132215798027332, 'sideways_rsi_os': 28, 'sideways_rsi_ob': 95, 'sideways_adx_thresh': 10.955232718587572, 'sideways_atr_min_pct': 0.020352231957621935, 'sideways_atr_max_pct': 0.050632484301191244, 'sideways_tp_mult': 1.3047417854748717, 'sideways_tsl_mult': 0.3410770750411479, 'sideways_time_stop': 117, 'sideways_use_sma': False, 'sideways_use_ema': True, 'sideways_use_atr': True, 'sideways_use_adx': False, 'sideways_use_spike': False, 'sideways_rsi_required': False}.
[I 2025-08-30 16:05:16,323] Trial 651 finished with values: [-1000000000.0, 1000000000.0] and parameters: {'p_sma': 5, 'p_std': 39, 'p_atr': 13, 'p_adx': 15, 'rsi_period': 11, 'ema1': 21, 'ema2': 35, 'slip_atr_k': 0.0004398602372019322, 'slip_spread_k': 0.8387732158055551, 'spread_hl_frac': 0.02447563553313721, 'bb_std_mult': 1.6148033454833628, 'rsi_os': 25, 'rsi_ob': 88, 'vol_spike': 0.2581874428388942, 'adx_thresh': 8.60180330617888, 'atr_min_pct': 0.023050923908232365, 'atr_max_pct': 0.11299046684682047, 'tp_mult': 1.534976216716302, 'tsl_mult': 0.40654281296527395, 'strategy': 'breakout', 'time_stop': 77, 'use_sma': True, 'use_atr': True, 'use_adx': True, 'use_ema': False, 'use_spike': False, 'rsi_required': False, 'edge_k': 0.5302023056158044, 'edge_cap': 0.920135648075852, 'bull_strategy': 'breakout', 'bull_bb_std_mult': 1.6030834562348004, 'bull_rsi_os': 31, 'bull_rsi_ob': 89, 'bull_adx_thresh': 10.325452161480728, 'bull_atr_min_pct': 0.0188349291527866, 'bull_atr_max_pct': 0.01392210112708317, 'bull_tp_mult': 2.0520749465758916, 'bull_tsl_mult': 0.8740400448716394, 'bull_time_stop': 184, 'bull_use_sma': True, 'bull_use_ema': False, 'bull_use_atr': True, 'bull_use_adx': True, 'bull_use_spike': True, 'bull_rsi_required': False, 'bear_strategy': 'mean_reversion', 'bear_bb_std_mult': 2.035578046217044, 'bear_rsi_os': 25, 'bear_rsi_ob': 76, 'bear_adx_thresh': 15.568612391461397, 'bear_atr_min_pct': 0.0027138195447702247, 'bear_atr_max_pct': 0.11410379983820287, 'bear_tp_mult': 1.2487931666321748, 'bear_tsl_mult': 0.4270185722324923, 'bear_time_stop': 94, 'bear_use_sma': False, 'bear_use_ema': True, 'bear_use_atr': False, 'bear_use_adx': True, 'bear_use_spike': True, 'bear_rsi_required': True, 'sideways_strategy': 'breakout', 'sideways_bb_std_mult': 1.623422323284064, 'sideways_rsi_os': 28, 'sideways_rsi_ob': 79, 'sideways_adx_thresh': 29.724985623274648, 'sideways_atr_min_pct': 0.020369149950579927, 'sideways_atr_max_pct': 0.05134705821936498, 'sideways_tp_mult': 1.4556893408736253, 'sideways_tsl_mult': 0.35224840078338, 'sideways_time_stop': 133, 'sideways_use_sma': False, 'sideways_use_ema': True, 'sideways_use_atr': True, 'sideways_use_adx': False, 'sideways_use_spike': True, 'sideways_rsi_required': False}.
[I 2025-08-30 16:05:17,083] Trial 649 finished with values: [-0.005869649559681944, 0.007220894151099339] and parameters: {'p_sma': 56, 'p_std': 39, 'p_atr': 10, 'p_adx': 17, 'rsi_period': 11, 'ema1': 21, 'ema2': 18, 'slip_atr_k': 0.004701027494639021, 'slip_spread_k': 0.018997378618348104, 'spread_hl_frac': 0.005389556713933902, 'bb_std_mult': 0.7685320143210175, 'rsi_os': 38, 'rsi_ob': 79, 'vol_spike': 0.11258009642935393, 'adx_thresh': 7.626930488660935, 'atr_min_pct': 0.018901867340104277, 'atr_max_pct': 0.11091812794775069, 'tp_mult': 1.5331086909858438, 'tsl_mult': 0.36589870023830556, 'strategy': 'breakout', 'time_stop': 159, 'use_sma': False, 'use_atr': False, 'use_adx': True, 'use_ema': False, 'use_spike': False, 'rsi_required': False, 'edge_k': 1.3499723073079495, 'edge_cap': 0.9992724142103813, 'bull_strategy': 'breakout', 'bull_bb_std_mult': 1.579487274927439, 'bull_rsi_os': 48, 'bull_rsi_ob': 82, 'bull_adx_thresh': 7.335716483126474, 'bull_atr_min_pct': 0.01887282812684502, 'bull_atr_max_pct': 0.10859015920047678, 'bull_tp_mult': 1.4360634096183647, 'bull_tsl_mult': 0.8603689252024705, 'bull_time_stop': 41, 'bull_use_sma': True, 'bull_use_ema': True, 'bull_use_atr': True, 'bull_use_adx': True, 'bull_use_spike': True, 'bull_rsi_required': False, 'bear_strategy': 'mean_reversion', 'bear_bb_std_mult': 1.905333726472753, 'bear_rsi_os': 26, 'bear_rsi_ob': 74, 'bear_adx_thresh': 14.992703164014564, 'bear_atr_min_pct': 0.002755250327721327, 'bear_atr_max_pct': 0.11413070336278439, 'bear_tp_mult': 2.702924816769015, 'bear_tsl_mult': 0.9074885856590296, 'bear_time_stop': 92, 'bear_use_sma': True, 'bear_use_ema': False, 'bear_use_atr': True, 'bear_use_adx': True, 'bear_use_spike': True, 'bear_rsi_required': True, 'sideways_strategy': 'breakout', 'sideways_bb_std_mult': 3.1424586031923254, 'sideways_rsi_os': 23, 'sideways_rsi_ob': 77, 'sideways_adx_thresh': 10.78264041663694, 'sideways_atr_min_pct': 0.020034927342318386, 'sideways_atr_max_pct': 0.031867313782001624, 'sideways_tp_mult': 1.380070616862376, 'sideways_tsl_mult': 0.38274846070455704, 'sideways_time_stop': 140, 'sideways_use_sma': True, 'sideways_use_ema': True, 'sideways_use_atr': True, 'sideways_use_adx': True, 'sideways_use_spike': True, 'sideways_rsi_required': True}.
[I 2025-08-30 16:05:17,329] Trial 650 finished with values: [-1000000000.0, 1000000000.0] and parameters: {'p_sma': 5, 'p_std': 23, 'p_atr': 27, 'p_adx': 15, 'rsi_period': 11, 'ema1': 21, 'ema2': 35, 'slip_atr_k': 0.0004542815076289763, 'slip_spread_k': 0.6664802472868335, 'spread_hl_frac': 0.024499622535613004, 'bb_std_mult': 0.6096799778623555, 'rsi_os': 38, 'rsi_ob': 88, 'vol_spike': 0.2119538997148357, 'adx_thresh': 33.19434053704933, 'atr_min_pct': 0.018421366243512913, 'atr_max_pct': 0.11281661676053456, 'tp_mult': 1.538458918901934, 'tsl_mult': 0.36773813983801373, 'strategy': 'breakout', 'time_stop': 179, 'use_sma': True, 'use_atr': True, 'use_adx': True, 'use_ema': False, 'use_spike': False, 'rsi_required': False, 'edge_k': 0.5416850994436784, 'edge_cap': 0.9545557589260106, 'bull_strategy': 'breakout', 'bull_bb_std_mult': 1.6761163228579863, 'bull_rsi_os': 31, 'bull_rsi_ob': 89, 'bull_adx_thresh': 28.525910548842358, 'bull_atr_min_pct': 0.019035864828710506, 'bull_atr_max_pct': 0.10308340920585236, 'bull_tp_mult': 2.542243606698687, 'bull_tsl_mult': 0.8716086922987228, 'bull_time_stop': 66, 'bull_use_sma': True, 'bull_use_ema': False, 'bull_use_atr': True, 'bull_use_adx': True, 'bull_use_spike': True, 'bull_rsi_required': False, 'bear_strategy': 'mean_reversion', 'bear_bb_std_mult': 1.9867185233521034, 'bear_rsi_os': 25, 'bear_rsi_ob': 76, 'bear_adx_thresh': 15.256027958273085, 'bear_atr_min_pct': 0.018746696228256393, 'bear_atr_max_pct': 0.11383233365005367, 'bear_tp_mult': 2.663718569818259, 'bear_tsl_mult': 0.4250414244285515, 'bear_time_stop': 93, 'bear_use_sma': False, 'bear_use_ema': True, 'bear_use_atr': False, 'bear_use_adx': True, 'bear_use_spike': True, 'bear_rsi_required': True, 'sideways_strategy': 'breakout', 'sideways_bb_std_mult': 2.7163969870260094, 'sideways_rsi_os': 10, 'sideways_rsi_ob': 79, 'sideways_adx_thresh': 12.197564359044868, 'sideways_atr_min_pct': 0.020274702439141444, 'sideways_atr_max_pct': 0.04488714615152644, 'sideways_tp_mult': 1.4547012928282528, 'sideways_tsl_mult': 0.3517017552693675, 'sideways_time_stop': 116, 'sideways_use_sma': False, 'sideways_use_ema': True, 'sideways_use_atr': True, 'sideways_use_adx': False, 'sideways_use_spike': True, 'sideways_rsi_required': False}.
[I 2025-08-30 16:06:03,284] Trial 656 finished with values: [-1000000000.0, 1000000000.0] and parameters: {'p_sma': 11, 'p_std': 21, 'p_atr': 12, 'p_adx': 25, 'rsi_period': 66, 'ema1': 27, 'ema2': 39, 'slip_atr_k': 0.10055686351303161, 'slip_spread_k': 0.7473173619516146, 'spread_hl_frac': 0.008228696272743375, 'bb_std_mult': 0.6938992415226048, 'rsi_os': 28, 'rsi_ob': 86, 'vol_spike': 0.05615012262298266, 'adx_thresh': 23.995292245172326, 'atr_min_pct': 0.005819771779862348, 'atr_max_pct': 0.03925472621788944, 'tp_mult': 1.4808883061917864, 'tsl_mult': 0.3143488519051131, 'strategy': 'mean_reversion', 'time_stop': 166, 'use_sma': False, 'use_atr': False, 'use_adx': False, 'use_ema': True, 'use_spike': True, 'rsi_required': True, 'edge_k': 0.47469864402923034, 'edge_cap': 0.9705633139301576, 'bull_strategy': 'mean_reversion', 'bull_bb_std_mult': 1.4654688189164027, 'bull_rsi_os': 50, 'bull_rsi_ob': 59, 'bull_adx_thresh': 6.503468082684066, 'bull_atr_min_pct': 0.016085100839240248, 'bull_atr_max_pct': 0.051112115231027655, 'bull_tp_mult': 2.6981600332312787, 'bull_tsl_mult': 0.9062201274966817, 'bull_time_stop': 250, 'bull_use_sma': False, 'bull_use_ema': True, 'bull_use_atr': False, 'bull_use_adx': True, 'bull_use_spike': False, 'bull_rsi_required': True, 'bear_strategy': 'breakout', 'bear_bb_std_mult': 2.229687310963036, 'bear_rsi_os': 24, 'bear_rsi_ob': 77, 'bear_adx_thresh': 17.22332357004294, 'bear_atr_min_pct': 0.0017671827711239567, 'bear_atr_max_pct': 0.13183531982884517, 'bear_tp_mult': 2.727961501977201, 'bear_tsl_mult': 0.17206579946988176, 'bear_time_stop': 62, 'bear_use_sma': True, 'bear_use_ema': False, 'bear_use_atr': True, 'bear_use_adx': True, 'bear_use_spike': False, 'bear_rsi_required': False, 'sideways_strategy': 'mean_reversion', 'sideways_bb_std_mult': 0.7120591418129882, 'sideways_rsi_os': 21, 'sideways_rsi_ob': 78, 'sideways_adx_thresh': 32.25385390362056, 'sideways_atr_min_pct': 0.0009638516574783478, 'sideways_atr_max_pct': 0.13314663939690663, 'sideways_tp_mult': 1.2148814845766522, 'sideways_tsl_mult': 0.06627847896530958, 'sideways_time_stop': 124, 'sideways_use_sma': True, 'sideways_use_ema': False, 'sideways_use_atr': True, 'sideways_use_adx': True, 'sideways_use_spike': False, 'sideways_rsi_required': True}.
[I 2025-08-30 16:06:04,854] Trial 655 finished with values: [-1000000000.0, 1000000000.0] and parameters: {'p_sma': 10, 'p_std': 45, 'p_atr': 12, 'p_adx': 25, 'rsi_period': 66, 'ema1': 27, 'ema2': 39, 'slip_atr_k': 0.00960413454369414, 'slip_spread_k': 0.7533630513387987, 'spread_hl_frac': 0.0077115950191176345, 'bb_std_mult': 0.6804301909151674, 'rsi_os': 28, 'rsi_ob': 86, 'vol_spike': 0.058884233656301105, 'adx_thresh': 24.07424133041639, 'atr_min_pct': 0.005944322549280125, 'atr_max_pct': 0.06644065414211656, 'tp_mult': 1.474705662578442, 'tsl_mult': 0.3190651309158557, 'strategy': 'mean_reversion', 'time_stop': 166, 'use_sma': False, 'use_atr': False, 'use_adx': False, 'use_ema': False, 'use_spike': True, 'rsi_required': False, 'edge_k': 0.4887168768967304, 'edge_cap': 0.9656719347849483, 'bull_strategy': 'breakout', 'bull_bb_std_mult': 1.4691190207971294, 'bull_rsi_os': 50, 'bull_rsi_ob': 71, 'bull_adx_thresh': 10.132310937476726, 'bull_atr_min_pct': 0.011741952273083485, 'bull_atr_max_pct': 0.10329666660703954, 'bull_tp_mult': 1.7298564330852437, 'bull_tsl_mult': 0.558832028844415, 'bull_time_stop': 61, 'bull_use_sma': False, 'bull_use_ema': True, 'bull_use_atr': True, 'bull_use_adx': True, 'bull_use_spike': True, 'bull_rsi_required': True, 'bear_strategy': 'mean_reversion', 'bear_bb_std_mult': 1.487411045506222, 'bear_rsi_os': 12, 'bear_rsi_ob': 91, 'bear_adx_thresh': 27.198157667689852, 'bear_atr_min_pct': 0.0015363914466705799, 'bear_atr_max_pct': 0.11021071096171695, 'bear_tp_mult': 2.6075944303577048, 'bear_tsl_mult': 0.7891068065251141, 'bear_time_stop': 86, 'bear_use_sma': True, 'bear_use_ema': False, 'bear_use_atr': True, 'bear_use_adx': True, 'bear_use_spike': True, 'bear_rsi_required': True, 'sideways_strategy': 'mean_reversion', 'sideways_bb_std_mult': 0.7185446996408444, 'sideways_rsi_os': 15, 'sideways_rsi_ob': 91, 'sideways_adx_thresh': 9.772566976305741, 'sideways_atr_min_pct': 0.02168329972703587, 'sideways_atr_max_pct': 0.024001949911462428, 'sideways_tp_mult': 1.2195283606187037, 'sideways_tsl_mult': 0.4380914066126387, 'sideways_time_stop': 115, 'sideways_use_sma': True, 'sideways_use_ema': False, 'sideways_use_atr': True, 'sideways_use_adx': True, 'sideways_use_spike': True, 'sideways_rsi_required': True}.
[I 2025-08-30 16:06:05,865] Trial 654 finished with values: [-0.015943114792557167, 0.015899018965907227] and parameters: {'p_sma': 11, 'p_std': 24, 'p_atr': 27, 'p_adx': 25, 'rsi_period': 9, 'ema1': 27, 'ema2': 54, 'slip_atr_k': 0.008526603098373331, 'slip_spread_k': 0.662620298955337, 'spread_hl_frac': 0.008242183209319708, 'bb_std_mult': 1.2416496482933495, 'rsi_os': 38, 'rsi_ob': 72, 'vol_spike': 0.1570509753010279, 'adx_thresh': 10.757130430931019, 'atr_min_pct': 0.02577246687340442, 'atr_max_pct': 0.048995800654424604, 'tp_mult': 1.476821767806643, 'tsl_mult': 0.36228364938215013, 'strategy': 'breakout', 'time_stop': 162, 'use_sma': False, 'use_atr': False, 'use_adx': False, 'use_ema': False, 'use_spike': True, 'rsi_required': False, 'edge_k': 1.3495082307578146, 'edge_cap': 0.09078476726128903, 'bull_strategy': 'breakout', 'bull_bb_std_mult': 1.5554062745435175, 'bull_rsi_os': 50, 'bull_rsi_ob': 87, 'bull_adx_thresh': 6.6497099788891845, 'bull_atr_min_pct': 0.015821549109315585, 'bull_atr_max_pct': 0.10284016493645234, 'bull_tp_mult': 1.685889684267738, 'bull_tsl_mult': 0.2426084570380881, 'bull_time_stop': 261, 'bull_use_sma': True, 'bull_use_ema': True, 'bull_use_atr': True, 'bull_use_adx': True, 'bull_use_spike': True, 'bull_rsi_required': True, 'bear_strategy': 'mean_reversion', 'bear_bb_std_mult': 1.4844931047142502, 'bear_rsi_os': 26, 'bear_rsi_ob': 74, 'bear_adx_thresh': 14.175808515291235, 'bear_atr_min_pct': 0.022803403037827512, 'bear_atr_max_pct': 0.12064398728256961, 'bear_tp_mult': 2.7072061099731353, 'bear_tsl_mult': 0.7973277279531199, 'bear_time_stop': 211, 'bear_use_sma': True, 'bear_use_ema': False, 'bear_use_atr': True, 'bear_use_adx': True, 'bear_use_spike': True, 'bear_rsi_required': True, 'sideways_strategy': 'mean_reversion', 'sideways_bb_std_mult': 3.124876395968016, 'sideways_rsi_os': 10, 'sideways_rsi_ob': 78, 'sideways_adx_thresh': 12.08753350092389, 'sideways_atr_min_pct': 0.0006828572520200457, 'sideways_atr_max_pct': 0.07094281676068873, 'sideways_tp_mult': 1.5737721943517808, 'sideways_tsl_mult': 0.06530680501165387, 'sideways_time_stop': 116, 'sideways_use_sma': True, 'sideways_use_ema': False, 'sideways_use_atr': True, 'sideways_use_adx': True, 'sideways_use_spike': True, 'sideways_rsi_required': True}.
[I 2025-08-30 16:06:06,285] Trial 653 finished with values: [-1000000000.0, 1000000000.0] and parameters: {'p_sma': 11, 'p_std': 47, 'p_atr': 29, 'p_adx': 25, 'rsi_period': 9, 'ema1': 21, 'ema2': 35, 'slip_atr_k': 0.008606278920979416, 'slip_spread_k': 0.6703677888055769, 'spread_hl_frac': 0.008421696146334822, 'bb_std_mult': 0.6737942388698076, 'rsi_os': 54, 'rsi_ob': 86, 'vol_spike': 0.1583064984270697, 'adx_thresh': 24.12655099020529, 'atr_min_pct': 0.005823822180607673, 'atr_max_pct': 0.14521246434554339, 'tp_mult': 1.5302543308282908, 'tsl_mult': 0.3604042482535208, 'strategy': 'breakout', 'time_stop': 158, 'use_sma': False, 'use_atr': False, 'use_adx': True, 'use_ema': False, 'use_spike': False, 'rsi_required': False, 'edge_k': 0.5200208654392523, 'edge_cap': 0.9639445973248363, 'bull_strategy': 'breakout', 'bull_bb_std_mult': 1.5557695629989845, 'bull_rsi_os': 49, 'bull_rsi_ob': 89, 'bull_adx_thresh': 7.259098631058369, 'bull_atr_min_pct': 0.005829482220285124, 'bull_atr_max_pct': 0.10294522034943143, 'bull_tp_mult': 2.997871606084673, 'bull_tsl_mult': 0.8734603266633404, 'bull_time_stop': 68, 'bull_use_sma': True, 'bull_use_ema': True, 'bull_use_atr': True, 'bull_use_adx': True, 'bull_use_spike': True, 'bull_rsi_required': True, 'bear_strategy': 'mean_reversion', 'bear_bb_std_mult': 2.2359782761344724, 'bear_rsi_os': 21, 'bear_rsi_ob': 76, 'bear_adx_thresh': 26.91942607033876, 'bear_atr_min_pct': 0.001791060731523993, 'bear_atr_max_pct': 0.11175537665408433, 'bear_tp_mult': 1.2354282474100045, 'bear_tsl_mult': 0.08517388394232589, 'bear_time_stop': 93, 'bear_use_sma': True, 'bear_use_ema': False, 'bear_use_atr': True, 'bear_use_adx': True, 'bear_use_spike': True, 'bear_rsi_required': True, 'sideways_strategy': 'mean_reversion', 'sideways_bb_std_mult': 3.1350199306021804, 'sideways_rsi_os': 22, 'sideways_rsi_ob': 79, 'sideways_adx_thresh': 30.06086233247004, 'sideways_atr_min_pct': 0.027748336562180856, 'sideways_atr_max_pct': 0.1270145815651724, 'sideways_tp_mult': 1.2020505256939464, 'sideways_tsl_mult': 0.06855129313457115, 'sideways_time_stop': 115, 'sideways_use_sma': True, 'sideways_use_ema': True, 'sideways_use_atr': True, 'sideways_use_adx': True, 'sideways_use_spike': True, 'sideways_rsi_required': True}.
