[I 2025-08-30 14:57:22,260] Trial 298 finished with values: [-0.00693997184121764, 0.006931722828847226] and parameters: {'p_sma': 42, 'p_std': 33, 'p_atr': 18, 'p_adx': 29, 'rsi_period': 54, 'ema1': 9, 'ema2': 53, 'slip_atr_k': 0.02191532954734686, 'slip_spread_k': 0.26504138957720375, 'spread_hl_frac': 0.0021797796597956345, 'bb_std_mult': 3.0872362323219233, 'rsi_os': 5, 'rsi_ob': 93, 'vol_spike': 0.2969732532419504, 'adx_thresh': 15.111299200934482, 'atr_min_pct': 0.005002432881941321, 'atr_max_pct': 0.0922667620205535, 'tp_mult': 2.4134036663156273, 'tsl_mult': 0.504806977060065, 'strategy': 'breakout', 'time_stop': 264, 'use_sma': False, 'use_atr': False, 'use_adx': True, 'use_ema': False, 'use_spike': False, 'rsi_required': False, 'edge_k': 0.2959493184397667, 'edge_cap': 0.8382859268483509, 'bull_strategy': 'breakout', 'bull_bb_std_mult': 2.609789203415805, 'bull_rsi_os': 51, 'bull_rsi_ob': 50, 'bull_adx_thresh': 29.39693231287475, 'bull_atr_min_pct': 0.0006819708512841244, 'bull_atr_max_pct': 0.08274395398740586, 'bull_tp_mult': 1.0140932042860649, 'bull_tsl_mult': 0.9943806364392319, 'bull_time_stop': 118, 'bull_use_sma': True, 'bull_use_ema': True, 'bull_use_atr': True, 'bull_use_adx': False, 'bull_use_spike': True, 'bull_rsi_required': True, 'bear_strategy': 'mean_reversion', 'bear_bb_std_mult': 3.2279933489768844, 'bear_rsi_os': 29, 'bear_rsi_ob': 84, 'bear_adx_thresh': 5.762726306142385, 'bear_atr_min_pct': 0.02992100901884024, 'bear_atr_max_pct': 0.010216741828705125, 'bear_tp_mult': 2.9056099717342305, 'bear_tsl_mult': 0.5994295154675795, 'bear_time_stop': 255, 'bear_use_sma': True, 'bear_use_ema': False, 'bear_use_atr': True, 'bear_use_adx': True, 'bear_use_spike': True, 'bear_rsi_required': True, 'sideways_strategy': 'mean_reversion', 'sideways_bb_std_mult': 1.1226774003838915, 'sideways_rsi_os': 36, 'sideways_rsi_ob': 56, 'sideways_adx_thresh': 17.92492771509471, 'sideways_atr_min_pct': 0.022879010445721822, 'sideways_atr_max_pct': 0.08991787309359912, 'sideways_tp_mult': 2.26518130907875, 'sideways_tsl_mult': 0.9398926679901531, 'sideways_time_stop': 91, 'sideways_use_sma': True, 'sideways_use_ema': False, 'sideways_use_atr': True, 'sideways_use_adx': True, 'sideways_use_spike': True, 'sideways_rsi_required': True}.
[I 2025-08-30 14:57:22,878] Trial 299 finished with values: [-0.0074132905380938086, 0.00742704249893381] and parameters: {'p_sma': 41, 'p_std': 34, 'p_atr': 18, 'p_adx': 29, 'rsi_period': 54, 'ema1': 9, 'ema2': 53, 'slip_atr_k': 0.023725994884088657, 'slip_spread_k': 0.24902440640738346, 'spread_hl_frac': 0.0026375967072597185, 'bb_std_mult': 3.08872615076537, 'rsi_os': 5, 'rsi_ob': 93, 'vol_spike': 0.29609972305230625, 'adx_thresh': 14.707070488645773, 'atr_min_pct': 0.004221161304067753, 'atr_max_pct': 0.0936302072490544, 'tp_mult': 2.4251083203399855, 'tsl_mult': 0.5076277848687955, 'strategy': 'breakout', 'time_stop': 260, 'use_sma': False, 'use_atr': False, 'use_adx': True, 'use_ema': False, 'use_spike': False, 'rsi_required': False, 'edge_k': 0.2983799109873017, 'edge_cap': 0.8426221829424907, 'bull_strategy': 'breakout', 'bull_bb_std_mult': 2.6008061784348886, 'bull_rsi_os': 51, 'bull_rsi_ob': 51, 'bull_adx_thresh': 28.78932793702733, 'bull_atr_min_pct': 0.0007201682144787035, 'bull_atr_max_pct': 0.08255307369752993, 'bull_tp_mult': 1.0116564409508932, 'bull_tsl_mult': 0.9945748606897666, 'bull_time_stop': 117, 'bull_use_sma': True, 'bull_use_ema': True, 'bull_use_atr': True, 'bull_use_adx': False, 'bull_use_spike': True, 'bull_rsi_required': True, 'bear_strategy': 'mean_reversion', 'bear_bb_std_mult': 3.2333174956633894, 'bear_rsi_os': 29, 'bear_rsi_ob': 83, 'bear_adx_thresh': 5.55086670830593, 'bear_atr_min_pct': 0.029934861080073528, 'bear_atr_max_pct': 0.011093052185830735, 'bear_tp_mult': 2.8067361701158857, 'bear_tsl_mult': 0.6030061455428032, 'bear_time_stop': 252, 'bear_use_sma': True, 'bear_use_ema': False, 'bear_use_atr': True, 'bear_use_adx': True, 'bear_use_spike': True, 'bear_rsi_required': True, 'sideways_strategy': 'mean_reversion', 'sideways_bb_std_mult': 1.1128345484306974, 'sideways_rsi_os': 37, 'sideways_rsi_ob': 56, 'sideways_adx_thresh': 18.21356223450104, 'sideways_atr_min_pct': 0.022927126706921003, 'sideways_atr_max_pct': 0.09018834672881113, 'sideways_tp_mult': 2.264590483069877, 'sideways_tsl_mult': 0.9411673140351202, 'sideways_time_stop': 92, 'sideways_use_sma': True, 'sideways_use_ema': False, 'sideways_use_atr': True, 'sideways_use_adx': True, 'sideways_use_spike': True, 'sideways_rsi_required': True}.
[I 2025-08-30 14:57:23,116] Trial 297 finished with values: [-0.007066236029602102, 0.007102268253531687] and parameters: {'p_sma': 42, 'p_std': 34, 'p_atr': 18, 'p_adx': 29, 'rsi_period': 54, 'ema1': 10, 'ema2': 53, 'slip_atr_k': 0.02212578647106086, 'slip_spread_k': 0.2723479714034319, 'spread_hl_frac': 0.002003899754187988, 'bb_std_mult': 3.0995393382476704, 'rsi_os': 5, 'rsi_ob': 93, 'vol_spike': 0.29572220999497745, 'adx_thresh': 14.73197751470272, 'atr_min_pct': 0.005677427836020852, 'atr_max_pct': 0.0915980224703476, 'tp_mult': 2.408203577630919, 'tsl_mult': 0.5083791576328899, 'strategy': 'breakout', 'time_stop': 267, 'use_sma': False, 'use_atr': False, 'use_adx': True, 'use_ema': False, 'use_spike': False, 'rsi_required': False, 'edge_k': 0.2802006079094989, 'edge_cap': 0.8155108080496001, 'bull_strategy': 'breakout', 'bull_bb_std_mult': 2.613346750160314, 'bull_rsi_os': 51, 'bull_rsi_ob': 49, 'bull_adx_thresh': 29.434709922738534, 'bull_atr_min_pct': 0.0005130447031119394, 'bull_atr_max_pct': 0.08231041083570115, 'bull_tp_mult': 1.0139858712363612, 'bull_tsl_mult': 0.9218673276082999, 'bull_time_stop': 118, 'bull_use_sma': True, 'bull_use_ema': True, 'bull_use_atr': True, 'bull_use_adx': False, 'bull_use_spike': True, 'bull_rsi_required': True, 'bear_strategy': 'mean_reversion', 'bear_bb_std_mult': 3.288108933969134, 'bear_rsi_os': 29, 'bear_rsi_ob': 83, 'bear_adx_thresh': 5.7137638637970305, 'bear_atr_min_pct': 0.02956299595258606, 'bear_atr_max_pct': 0.010498876355498676, 'bear_tp_mult': 2.9007147060725704, 'bear_tsl_mult': 0.578323001666877, 'bear_time_stop': 250, 'bear_use_sma': True, 'bear_use_ema': False, 'bear_use_atr': True, 'bear_use_adx': True, 'bear_use_spike': True, 'bear_rsi_required': True, 'sideways_strategy': 'mean_reversion', 'sideways_bb_std_mult': 1.1301723816654716, 'sideways_rsi_os': 37, 'sideways_rsi_ob': 56, 'sideways_adx_thresh': 18.3235468180119, 'sideways_atr_min_pct': 0.022950053853470556, 'sideways_atr_max_pct': 0.09084961477730243, 'sideways_tp_mult': 2.25528337947974, 'sideways_tsl_mult': 0.9281032539385901, 'sideways_time_stop': 91, 'sideways_use_sma': True, 'sideways_use_ema': False, 'sideways_use_atr': True, 'sideways_use_adx': True, 'sideways_use_spike': True, 'sideways_rsi_required': True}.
[I 2025-08-30 14:57:23,131] Trial 300 finished with values: [-0.011493952189279066, 0.01157395252538463] and parameters: {'p_sma': 60, 'p_std': 34, 'p_atr': 18, 'p_adx': 30, 'rsi_period': 53, 'ema1': 9, 'ema2': 53, 'slip_atr_k': 0.02263823350648393, 'slip_spread_k': 0.2677981954881861, 'spread_hl_frac': 0.0011958603426489578, 'bb_std_mult': 3.03693786898392, 'rsi_os': 5, 'rsi_ob': 90, 'vol_spike': 0.2958367229879525, 'adx_thresh': 15.134543362446973, 'atr_min_pct': 0.005151787507695747, 'atr_max_pct': 0.09450386982954166, 'tp_mult': 2.4048489245890403, 'tsl_mult': 0.49980741973420495, 'strategy': 'breakout', 'time_stop': 268, 'use_sma': False, 'use_atr': False, 'use_adx': True, 'use_ema': False, 'use_spike': False, 'rsi_required': False, 'edge_k': 0.28511548760210637, 'edge_cap': 0.8112097975080765, 'bull_strategy': 'breakout', 'bull_bb_std_mult': 2.5837225089076328, 'bull_rsi_os': 51, 'bull_rsi_ob': 51, 'bull_adx_thresh': 29.05215268216935, 'bull_atr_min_pct': 0.0010942308700121427, 'bull_atr_max_pct': 0.08321048698581668, 'bull_tp_mult': 1.0419255437477637, 'bull_tsl_mult': 0.9231790354435327, 'bull_time_stop': 124, 'bull_use_sma': True, 'bull_use_ema': True, 'bull_use_atr': True, 'bull_use_adx': False, 'bull_use_spike': True, 'bull_rsi_required': True, 'bear_strategy': 'mean_reversion', 'bear_bb_std_mult': 3.2389644721289828, 'bear_rsi_os': 28, 'bear_rsi_ob': 84, 'bear_adx_thresh': 5.605356955158968, 'bear_atr_min_pct': 0.029565706221591714, 'bear_atr_max_pct': 0.012744891940007644, 'bear_tp_mult': 2.9347976913727676, 'bear_tsl_mult': 0.5842285454710748, 'bear_time_stop': 254, 'bear_use_sma': True, 'bear_use_ema': False, 'bear_use_atr': True, 'bear_use_adx': True, 'bear_use_spike': True, 'bear_rsi_required': True, 'sideways_strategy': 'mean_reversion', 'sideways_bb_std_mult': 1.1182391000981946, 'sideways_rsi_os': 37, 'sideways_rsi_ob': 56, 'sideways_adx_thresh': 18.36815326299259, 'sideways_atr_min_pct': 0.02301515166075871, 'sideways_atr_max_pct': 0.0910680060758165, 'sideways_tp_mult': 2.276185711643081, 'sideways_tsl_mult': 0.9595185654202001, 'sideways_time_stop': 102, 'sideways_use_sma': True, 'sideways_use_ema': False, 'sideways_use_atr': True, 'sideways_use_adx': True, 'sideways_use_spike': True, 'sideways_rsi_required': True}.
[I 2025-08-30 14:57:54,425] Trial 302 finished with values: [-0.009004845207137846, 0.009055750559598414] and parameters: {'p_sma': 55, 'p_std': 33, 'p_atr': 18, 'p_adx': 30, 'rsi_period': 57, 'ema1': 10, 'ema2': 51, 'slip_atr_k': 0.022226479227758333, 'slip_spread_k': 0.2840568691691561, 'spread_hl_frac': 0.0012849072717219523, 'bb_std_mult': 2.987445932849183, 'rsi_os': 5, 'rsi_ob': 90, 'vol_spike': 0.2860474429903747, 'adx_thresh': 14.036761773498252, 'atr_min_pct': 0.004919242209489071, 'atr_max_pct': 0.08632847081640481, 'tp_mult': 2.3925454907089603, 'tsl_mult': 0.5524003773189227, 'strategy': 'breakout', 'time_stop': 268, 'use_sma': False, 'use_atr': False, 'use_adx': True, 'use_ema': False, 'use_spike': False, 'rsi_required': False, 'edge_k': 0.29980986431350043, 'edge_cap': 0.809700998713487, 'bull_strategy': 'breakout', 'bull_bb_std_mult': 2.534964439573651, 'bull_rsi_os': 52, 'bull_rsi_ob': 49, 'bull_adx_thresh': 28.178305127670647, 'bull_atr_min_pct': 0.0014734649600504494, 'bull_atr_max_pct': 0.0759725175959223, 'bull_tp_mult': 1.0480090818100494, 'bull_tsl_mult': 0.9227631807394688, 'bull_time_stop': 126, 'bull_use_sma': True, 'bull_use_ema': True, 'bull_use_atr': True, 'bull_use_adx': False, 'bull_use_spike': True, 'bull_rsi_required': False, 'bear_strategy': 'mean_reversion', 'bear_bb_std_mult': 3.1605181987492963, 'bear_rsi_os': 28, 'bear_rsi_ob': 85, 'bear_adx_thresh': 5.70430982911292, 'bear_atr_min_pct': 0.02944063126917503, 'bear_atr_max_pct': 0.01285379341802813, 'bear_tp_mult': 2.9064686351937707, 'bear_tsl_mult': 0.5744637321841951, 'bear_time_stop': 265, 'bear_use_sma': True, 'bear_use_ema': False, 'bear_use_atr': True, 'bear_use_adx': True, 'bear_use_spike': True, 'bear_rsi_required': True, 'sideways_strategy': 'mean_reversion', 'sideways_bb_std_mult': 1.1198346364227003, 'sideways_rsi_os': 36, 'sideways_rsi_ob': 55, 'sideways_adx_thresh': 17.229211156411996, 'sideways_atr_min_pct': 0.021611880454412653, 'sideways_atr_max_pct': 0.0911795752022534, 'sideways_tp_mult': 2.182426667467605, 'sideways_tsl_mult': 0.9606293989921707, 'sideways_time_stop': 100, 'sideways_use_sma': True, 'sideways_use_ema': False, 'sideways_use_atr': True, 'sideways_use_adx': True, 'sideways_use_spike': True, 'sideways_rsi_required': True}.
[I 2025-08-30 14:57:54,749] Trial 301 finished with values: [-0.005966923798245816, 0.006021652902545248] and parameters: {'p_sma': 42, 'p_std': 34, 'p_atr': 18, 'p_adx': 30, 'rsi_period': 53, 'ema1': 10, 'ema2': 51, 'slip_atr_k': 0.023642086244146633, 'slip_spread_k': 0.27110798199848063, 'spread_hl_frac': 0.001523579115980288, 'bb_std_mult': 3.006748910072721, 'rsi_os': 5, 'rsi_ob': 90, 'vol_spike': 0.2779958643916382, 'adx_thresh': 14.214615809547844, 'atr_min_pct': 0.0046647098710994594, 'atr_max_pct': 0.09368699334570513, 'tp_mult': 2.39837471396796, 'tsl_mult': 0.5019067480159314, 'strategy': 'breakout', 'time_stop': 267, 'use_sma': False, 'use_atr': False, 'use_adx': True, 'use_ema': False, 'use_spike': False, 'rsi_required': False, 'edge_k': 0.2995403528756388, 'edge_cap': 0.8065416930284227, 'bull_strategy': 'breakout', 'bull_bb_std_mult': 2.553066653745703, 'bull_rsi_os': 52, 'bull_rsi_ob': 51, 'bull_adx_thresh': 29.050205889356, 'bull_atr_min_pct': 0.0014295330624351725, 'bull_atr_max_pct': 0.08379065421785267, 'bull_tp_mult': 1.0383097550594602, 'bull_tsl_mult': 0.993838286066912, 'bull_time_stop': 128, 'bull_use_sma': True, 'bull_use_ema': True, 'bull_use_atr': True, 'bull_use_adx': False, 'bull_use_spike': True, 'bull_rsi_required': False, 'bear_strategy': 'mean_reversion', 'bear_bb_std_mult': 3.177999752547347, 'bear_rsi_os': 28, 'bear_rsi_ob': 84, 'bear_adx_thresh': 5.5753008055929145, 'bear_atr_min_pct': 0.02960489927926151, 'bear_atr_max_pct': 0.012709248729592278, 'bear_tp_mult': 2.940324354992445, 'bear_tsl_mult': 0.6012748063563199, 'bear_time_stop': 254, 'bear_use_sma': True, 'bear_use_ema': False, 'bear_use_atr': True, 'bear_use_adx': True, 'bear_use_spike': True, 'bear_rsi_required': True, 'sideways_strategy': 'mean_reversion', 'sideways_bb_std_mult': 1.1124832333015746, 'sideways_rsi_os': 37, 'sideways_rsi_ob': 57, 'sideways_adx_thresh': 18.442778273003867, 'sideways_atr_min_pct': 0.023009698361265735, 'sideways_atr_max_pct': 0.09079634687055162, 'sideways_tp_mult': 2.3636105377030976, 'sideways_tsl_mult': 0.9760970138392371, 'sideways_time_stop': 101, 'sideways_use_sma': True, 'sideways_use_ema': False, 'sideways_use_atr': True, 'sideways_use_adx': True, 'sideways_use_spike': True, 'sideways_rsi_required': True}.
[I 2025-08-30 14:57:55,139] Trial 303 finished with values: [-1000000000.0, 1000000000.0] and parameters: {'p_sma': 27, 'p_std': 33, 'p_atr': 18, 'p_adx': 30, 'rsi_period': 58, 'ema1': 11, 'ema2': 51, 'slip_atr_k': 0.015298926313292587, 'slip_spread_k': 0.21653617533338537, 'spread_hl_frac': 0.004341535738317873, 'bb_std_mult': 3.0053310150686516, 'rsi_os': 6, 'rsi_ob': 89, 'vol_spike': 0.2874642395634726, 'adx_thresh': 14.416034772637113, 'atr_min_pct': 0.0040775551888980535, 'atr_max_pct': 0.08568395764329462, 'tp_mult': 2.397095429398624, 'tsl_mult': 0.5582704794669533, 'strategy': 'breakout', 'time_stop': 269, 'use_sma': False, 'use_atr': False, 'use_adx': True, 'use_ema': False, 'use_spike': False, 'rsi_required': False, 'edge_k': 0.3095146490634846, 'edge_cap': 0.7933567904199988, 'bull_strategy': 'breakout', 'bull_bb_std_mult': 2.6720065167535356, 'bull_rsi_os': 52, 'bull_rsi_ob': 49, 'bull_adx_thresh': 29.486810142320472, 'bull_atr_min_pct': 0.0017934390199572162, 'bull_atr_max_pct': 0.07539236985226581, 'bull_tp_mult': 1.0545686862229073, 'bull_tsl_mult': 0.9211333899569734, 'bull_time_stop': 127, 'bull_use_sma': True, 'bull_use_ema': True, 'bull_use_atr': True, 'bull_use_adx': False, 'bull_use_spike': True, 'bull_rsi_required': False, 'bear_strategy': 'mean_reversion', 'bear_bb_std_mult': 3.172214796495586, 'bear_rsi_os': 28, 'bear_rsi_ob': 85, 'bear_adx_thresh': 5.187288354554336, 'bear_atr_min_pct': 0.029340228796411558, 'bear_atr_max_pct': 0.021984649593317855, 'bear_tp_mult': 2.9074219262159917, 'bear_tsl_mult': 0.5856787785497861, 'bear_time_stop': 266, 'bear_use_sma': True, 'bear_use_ema': False, 'bear_use_atr': True, 'bear_use_adx': True, 'bear_use_spike': True, 'bear_rsi_required': True, 'sideways_strategy': 'mean_reversion', 'sideways_bb_std_mult': 1.1504606529326773, 'sideways_rsi_os': 36, 'sideways_rsi_ob': 55, 'sideways_adx_thresh': 17.377563154672472, 'sideways_atr_min_pct': 0.021587742203833048, 'sideways_atr_max_pct': 0.0900708360437057, 'sideways_tp_mult': 2.363825588532415, 'sideways_tsl_mult': 0.9762787835333917, 'sideways_time_stop': 79, 'sideways_use_sma': True, 'sideways_use_ema': False, 'sideways_use_atr': True, 'sideways_use_adx': True, 'sideways_use_spike': True, 'sideways_rsi_required': True}.
[I 2025-08-30 14:57:55,292] Trial 304 finished with values: [-0.006011824707677804, 0.006059327942384515] and parameters: {'p_sma': 42, 'p_std': 30, 'p_atr': 18, 'p_adx': 30, 'rsi_period': 58, 'ema1': 11, 'ema2': 51, 'slip_atr_k': 0.01463969943330272, 'slip_spread_k': 0.22272253400721082, 'spread_hl_frac': 0.001717243059638556, 'bb_std_mult': 3.0020108975368647, 'rsi_os': 6, 'rsi_ob': 89, 'vol_spike': 0.2785499357353199, 'adx_thresh': 14.376774484432987, 'atr_min_pct': 0.004367446458985227, 'atr_max_pct': 0.08615810802344805, 'tp_mult': 2.5072454792298338, 'tsl_mult': 0.5540191232365121, 'strategy': 'breakout', 'time_stop': 261, 'use_sma': False, 'use_atr': False, 'use_adx': True, 'use_ema': False, 'use_spike': False, 'rsi_required': False, 'edge_k': 0.21559452732322715, 'edge_cap': 0.7888601975912795, 'bull_strategy': 'breakout', 'bull_bb_std_mult': 2.6630650425810116, 'bull_rsi_os': 52, 'bull_rsi_ob': 49, 'bull_adx_thresh': 29.59339248995029, 'bull_atr_min_pct': 0.0015967214882516396, 'bull_atr_max_pct': 0.07647432181245158, 'bull_tp_mult': 1.053750564580248, 'bull_tsl_mult': 0.9316011000667845, 'bull_time_stop': 130, 'bull_use_sma': True, 'bull_use_ema': True, 'bull_use_atr': True, 'bull_use_adx': False, 'bull_use_spike': True, 'bull_rsi_required': False, 'bear_strategy': 'mean_reversion', 'bear_bb_std_mult': 3.307752898889844, 'bear_rsi_os': 28, 'bear_rsi_ob': 85, 'bear_adx_thresh': 5.109914832861126, 'bear_atr_min_pct': 0.02934106064884344, 'bear_atr_max_pct': 0.013511182323080224, 'bear_tp_mult': 2.899431789702518, 'bear_tsl_mult': 0.5983562885231365, 'bear_time_stop': 267, 'bear_use_sma': True, 'bear_use_ema': False, 'bear_use_atr': True, 'bear_use_adx': True, 'bear_use_spike': True, 'bear_rsi_required': True, 'sideways_strategy': 'mean_reversion', 'sideways_bb_std_mult': 1.1487443257858394, 'sideways_rsi_os': 36, 'sideways_rsi_ob': 55, 'sideways_adx_thresh': 19.109721475081937, 'sideways_atr_min_pct': 0.02180083389079502, 'sideways_atr_max_pct': 0.08500030120244403, 'sideways_tp_mult': 2.376966637851185, 'sideways_tsl_mult': 0.8954552581652089, 'sideways_time_stop': 100, 'sideways_use_sma': True, 'sideways_use_ema': False, 'sideways_use_atr': True, 'sideways_use_adx': True, 'sideways_use_spike': True, 'sideways_rsi_required': True}.
[I 2025-08-30 14:58:25,837] Trial 306 finished with values: [-1000000000.0, 1000000000.0] and parameters: {'p_sma': 12, 'p_std': 36, 'p_atr': 18, 'p_adx': 30, 'rsi_period': 50, 'ema1': 9, 'ema2': 50, 'slip_atr_k': 0.015017144259704893, 'slip_spread_k': 0.3661456062239066, 'spread_hl_frac': 0.00015083668304530576, 'bb_std_mult': 2.918621692224421, 'rsi_os': 6, 'rsi_ob': 89, 'vol_spike': 0.24687632314960273, 'adx_thresh': 12.772160390748887, 'atr_min_pct': 0.006190846414289135, 'atr_max_pct': 0.0972703169898934, 'tp_mult': 2.493916126491415, 'tsl_mult': 0.46584786972458425, 'strategy': 'breakout', 'time_stop': 273, 'use_sma': False, 'use_atr': False, 'use_adx': True, 'use_ema': False, 'use_spike': False, 'rsi_required': False, 'edge_k': 0.22289159825405902, 'edge_cap': 0.7834691493380381, 'bull_strategy': 'breakout', 'bull_bb_std_mult': 2.471164169892928, 'bull_rsi_os': 53, 'bull_rsi_ob': 61, 'bull_adx_thresh': 26.287275406468925, 'bull_atr_min_pct': 0.0016535316239700507, 'bull_atr_max_pct': 0.08618578329522253, 'bull_tp_mult': 1.068921557848444, 'bull_tsl_mult': 0.9998759402057593, 'bull_time_stop': 131, 'bull_use_sma': True, 'bull_use_ema': True, 'bull_use_atr': True, 'bull_use_adx': False, 'bull_use_spike': True, 'bull_rsi_required': False, 'bear_strategy': 'mean_reversion', 'bear_bb_std_mult': 3.0793282391858323, 'bear_rsi_os': 27, 'bear_rsi_ob': 81, 'bear_adx_thresh': 5.073837283691885, 'bear_atr_min_pct': 0.02262948013496209, 'bear_atr_max_pct': 0.03251642949895891, 'bear_tp_mult': 2.962748915099918, 'bear_tsl_mult': 0.618093802113337, 'bear_time_stop': 241, 'bear_use_sma': True, 'bear_use_ema': False, 'bear_use_atr': True, 'bear_use_adx': True, 'bear_use_spike': True, 'bear_rsi_required': True, 'sideways_strategy': 'mean_reversion', 'sideways_bb_std_mult': 1.2655041120249961, 'sideways_rsi_os': 37, 'sideways_rsi_ob': 54, 'sideways_adx_thresh': 18.856839424351218, 'sideways_atr_min_pct': 0.023966758494985266, 'sideways_atr_max_pct': 0.09523904368017365, 'sideways_tp_mult': 2.0532923876386513, 'sideways_tsl_mult': 0.9821532801732884, 'sideways_time_stop': 82, 'sideways_use_sma': True, 'sideways_use_ema': False, 'sideways_use_atr': True, 'sideways_use_adx': True, 'sideways_use_spike': True, 'sideways_rsi_required': True}.
