[I 2025-08-30 15:51:33,424] Trial 573 finished with values: [-1000000000.0, 1000000000.0] and parameters: {'p_sma': 21, 'p_std': 20, 'p_atr': 22, 'p_adx': 25, 'rsi_period': 11, 'ema1': 22, 'ema2': 37, 'slip_atr_k': 0.13691809145447692, 'slip_spread_k': 0.736669380178909, 'spread_hl_frac': 0.006063191844803711, 'bb_std_mult': 2.0627419614252904, 'rsi_os': 35, 'rsi_ob': 86, 'vol_spike': 0.023509702670043847, 'adx_thresh': 9.915191886299347, 'atr_min_pct': 0.006973794892255679, 'atr_max_pct': 0.10908095573276859, 'tp_mult': 1.9861210869715364, 'tsl_mult': 0.3014379523835433, 'strategy': 'mean_reversion', 'time_stop': 172, 'use_sma': False, 'use_atr': False, 'use_adx': True, 'use_ema': False, 'use_spike': True, 'rsi_required': True, 'edge_k': 1.571605463726056, 'edge_cap': 0.8997519316045354, 'bull_strategy': 'breakout', 'bull_bb_std_mult': 1.641222840572683, 'bull_rsi_os': 19, 'bull_rsi_ob': 87, 'bull_adx_thresh': 10.02082322303345, 'bull_atr_min_pct': 0.019799993674305308, 'bull_atr_max_pct': 0.09953148903168695, 'bull_tp_mult': 2.9297290048081837, 'bull_tsl_mult': 0.890637524222953, 'bull_time_stop': 50, 'bull_use_sma': True, 'bull_use_ema': False, 'bull_use_atr': True, 'bull_use_adx': True, 'bull_use_spike': True, 'bull_rsi_required': False, 'bear_strategy': 'mean_reversion', 'bear_bb_std_mult': 1.7598706205996222, 'bear_rsi_os': 38, 'bear_rsi_ob': 75, 'bear_adx_thresh': 19.917959004601126, 'bear_atr_min_pct': 0.0029514950181607023, 'bear_atr_max_pct': 0.10754675337971868, 'bear_tp_mult': 2.7780597350520724, 'bear_tsl_mult': 0.8431257053373767, 'bear_time_stop': 97, 'bear_use_sma': True, 'bear_use_ema': True, 'bear_use_atr': True, 'bear_use_adx': True, 'bear_use_spike': True, 'bear_rsi_required': False, 'sideways_strategy': 'breakout', 'sideways_bb_std_mult': 3.155304778477432, 'sideways_rsi_os': 19, 'sideways_rsi_ob': 78, 'sideways_adx_thresh': 29.088591362729982, 'sideways_atr_min_pct': 0.020137834684392043, 'sideways_atr_max_pct': 0.12865264471689994, 'sideways_tp_mult': 2.6703755719497666, 'sideways_tsl_mult': 0.6043044628970162, 'sideways_time_stop': 54, 'sideways_use_sma': False, 'sideways_use_ema': True, 'sideways_use_atr': True, 'sideways_use_adx': True, 'sideways_use_spike': True, 'sideways_rsi_required': False}.
[I 2025-08-30 15:52:24,091] Trial 577 finished with values: [-1000000000.0, 1000000000.0] and parameters: {'p_sma': 7, 'p_std': 23, 'p_atr': 7, 'p_adx': 17, 'rsi_period': 32, 'ema1': 5, 'ema2': 38, 'slip_atr_k': 0.014055991106334638, 'slip_spread_k': 0.7059795690330555, 'spread_hl_frac': 0.029925283445897524, 'bb_std_mult': 0.8993098658014758, 'rsi_os': 44, 'rsi_ob': 86, 'vol_spike': 0.2250335717843435, 'adx_thresh': 34.998709387039455, 'atr_min_pct': 0.005641710545744041, 'atr_max_pct': 0.11190836738108915, 'tp_mult': 1.446120830425719, 'tsl_mult': 0.3965234120715635, 'strategy': 'breakout', 'time_stop': 163, 'use_sma': True, 'use_atr': False, 'use_adx': True, 'use_ema': False, 'use_spike': False, 'rsi_required': False, 'edge_k': 1.3391047868796173, 'edge_cap': 0.9557762256252836, 'bull_strategy': 'breakout', 'bull_bb_std_mult': 1.4929882954970077, 'bull_rsi_os': 48, 'bull_rsi_ob': 95, 'bull_adx_thresh': 9.528343993852607, 'bull_atr_min_pct': 0.01973902165719369, 'bull_atr_max_pct': 0.09914465995546161, 'bull_tp_mult': 2.659523334142818, 'bull_tsl_mult': 0.7096789007568726, 'bull_time_stop': 258, 'bull_use_sma': True, 'bull_use_ema': True, 'bull_use_atr': True, 'bull_use_adx': True, 'bull_use_spike': True, 'bull_rsi_required': False, 'bear_strategy': 'mean_reversion', 'bear_bb_std_mult': 1.8849771639290078, 'bear_rsi_os': 15, 'bear_rsi_ob': 74, 'bear_adx_thresh': 16.388629440560752, 'bear_atr_min_pct': 0.0020840580985753486, 'bear_atr_max_pct': 0.1111740839325881, 'bear_tp_mult': 2.765793914271516, 'bear_tsl_mult': 0.8466156305745116, 'bear_time_stop': 90, 'bear_use_sma': True, 'bear_use_ema': False, 'bear_use_atr': True, 'bear_use_adx': True, 'bear_use_spike': True, 'bear_rsi_required': True, 'sideways_strategy': 'mean_reversion', 'sideways_bb_std_mult': 3.1288889876139048, 'sideways_rsi_os': 53, 'sideways_rsi_ob': 80, 'sideways_adx_thresh': 10.728580548108946, 'sideways_atr_min_pct': 0.007412322868504418, 'sideways_atr_max_pct': 0.06691010016616938, 'sideways_tp_mult': 1.2839277664580377, 'sideways_tsl_mult': 0.39897937987879306, 'sideways_time_stop': 44, 'sideways_use_sma': True, 'sideways_use_ema': False, 'sideways_use_atr': True, 'sideways_use_adx': False, 'sideways_use_spike': True, 'sideways_rsi_required': False}.
[I 2025-08-30 15:52:24,391] Trial 578 finished with values: [-1000000000.0, 1000000000.0] and parameters: {'p_sma': 9, 'p_std': 23, 'p_atr': 7, 'p_adx': 17, 'rsi_period': 8, 'ema1': 24, 'ema2': 35, 'slip_atr_k': 0.004433502033125341, 'slip_spread_k': 0.6971452947407192, 'spread_hl_frac': 0.006944789732491361, 'bb_std_mult': 0.5424634000747645, 'rsi_os': 43, 'rsi_ob': 95, 'vol_spike': 0.22670463484140232, 'adx_thresh': 19.658890556986723, 'atr_min_pct': 0.005764175309176283, 'atr_max_pct': 0.11790781883973117, 'tp_mult': 2.002127479578155, 'tsl_mult': 0.6561426344836593, 'strategy': 'breakout', 'time_stop': 164, 'use_sma': True, 'use_atr': False, 'use_adx': True, 'use_ema': False, 'use_spike': False, 'rsi_required': False, 'edge_k': 1.5930242678949849, 'edge_cap': 0.2852660533439433, 'bull_strategy': 'breakout', 'bull_bb_std_mult': 1.4671877595805285, 'bull_rsi_os': 16, 'bull_rsi_ob': 88, 'bull_adx_thresh': 9.687980301346222, 'bull_atr_min_pct': 0.023867669063879896, 'bull_atr_max_pct': 0.09852523070964009, 'bull_tp_mult': 2.6542555584326304, 'bull_tsl_mult': 0.8865256743396217, 'bull_time_stop': 64, 'bull_use_sma': True, 'bull_use_ema': True, 'bull_use_atr': True, 'bull_use_adx': True, 'bull_use_spike': True, 'bull_rsi_required': True, 'bear_strategy': 'mean_reversion', 'bear_bb_std_mult': 1.8809424156151107, 'bear_rsi_os': 9, 'bear_rsi_ob': 74, 'bear_adx_thresh': 25.020235217275175, 'bear_atr_min_pct': 0.02337115836946685, 'bear_atr_max_pct': 0.0778537234166083, 'bear_tp_mult': 2.6969367995292695, 'bear_tsl_mult': 0.11891097342624868, 'bear_time_stop': 143, 'bear_use_sma': False, 'bear_use_ema': False, 'bear_use_atr': True, 'bear_use_adx': True, 'bear_use_spike': True, 'bear_rsi_required': True, 'sideways_strategy': 'mean_reversion', 'sideways_bb_std_mult': 0.6375185229968965, 'sideways_rsi_os': 23, 'sideways_rsi_ob': 79, 'sideways_adx_thresh': 11.015057284898734, 'sideways_atr_min_pct': 0.01993193225187953, 'sideways_atr_max_pct': 0.06398514764627297, 'sideways_tp_mult': 1.3462537697888886, 'sideways_tsl_mult': 0.40097304322148614, 'sideways_time_stop': 124, 'sideways_use_sma': True, 'sideways_use_ema': False, 'sideways_use_atr': True, 'sideways_use_adx': False, 'sideways_use_spike': True, 'sideways_rsi_required': True}.
[I 2025-08-30 15:52:24,851] Trial 579 finished with values: [-0.012883893674103142, 0.012900112830358043] and parameters: {'p_sma': 53, 'p_std': 23, 'p_atr': 13, 'p_adx': 25, 'rsi_period': 8, 'ema1': 24, 'ema2': 35, 'slip_atr_k': 0.00024079786181566498, 'slip_spread_k': 0.7918611020860485, 'spread_hl_frac': 0.03959400526770268, 'bb_std_mult': 0.5021739970839333, 'rsi_os': 47, 'rsi_ob': 95, 'vol_spike': 0.22503969190348816, 'adx_thresh': 8.166335123129043, 'atr_min_pct': 0.005621703558820673, 'atr_max_pct': 0.1148745034099169, 'tp_mult': 1.4397292789957854, 'tsl_mult': 0.0036568355652457085, 'strategy': 'breakout', 'time_stop': 108, 'use_sma': True, 'use_atr': False, 'use_adx': True, 'use_ema': False, 'use_spike': False, 'rsi_required': False, 'edge_k': 1.1537317789667256, 'edge_cap': 0.28646963862774605, 'bull_strategy': 'breakout', 'bull_bb_std_mult': 1.778205842749506, 'bull_rsi_os': 16, 'bull_rsi_ob': 52, 'bull_adx_thresh': 9.470203119294574, 'bull_atr_min_pct': 0.024111428210221605, 'bull_atr_max_pct': 0.1421989725421844, 'bull_tp_mult': 2.6453321402460865, 'bull_tsl_mult': 0.7063604376663695, 'bull_time_stop': 43, 'bull_use_sma': True, 'bull_use_ema': True, 'bull_use_atr': True, 'bull_use_adx': True, 'bull_use_spike': True, 'bull_rsi_required': True, 'bear_strategy': 'mean_reversion', 'bear_bb_std_mult': 1.8983981470265987, 'bear_rsi_os': 38, 'bear_rsi_ob': 74, 'bear_adx_thresh': 15.168987874117215, 'bear_atr_min_pct': 0.003296644226911317, 'bear_atr_max_pct': 0.1114084764436007, 'bear_tp_mult': 2.6797363120014124, 'bear_tsl_mult': 0.846608100255487, 'bear_time_stop': 100, 'bear_use_sma': False, 'bear_use_ema': False, 'bear_use_atr': True, 'bear_use_adx': True, 'bear_use_spike': True, 'bear_rsi_required': True, 'sideways_strategy': 'mean_reversion', 'sideways_bb_std_mult': 3.163358513330382, 'sideways_rsi_os': 5, 'sideways_rsi_ob': 79, 'sideways_adx_thresh': 33.89681003199527, 'sideways_atr_min_pct': 0.0050607477801935755, 'sideways_atr_max_pct': 0.033789154217231165, 'sideways_tp_mult': 1.752095769549257, 'sideways_tsl_mult': 0.39742876703102703, 'sideways_time_stop': 126, 'sideways_use_sma': True, 'sideways_use_ema': False, 'sideways_use_atr': True, 'sideways_use_adx': False, 'sideways_use_spike': True, 'sideways_rsi_required': True}.
[I 2025-08-30 15:52:25,734] Trial 580 finished with values: [-0.06206896092589509, 0.06201907005087509] and parameters: {'p_sma': 53, 'p_std': 23, 'p_atr': 13, 'p_adx': 25, 'rsi_period': 32, 'ema1': 24, 'ema2': 21, 'slip_atr_k': 0.10402328663887307, 'slip_spread_k': 0.8081614753975127, 'spread_hl_frac': 0.009204930404926707, 'bb_std_mult': 0.5526257339722782, 'rsi_os': 43, 'rsi_ob': 89, 'vol_spike': 0.2264145771260437, 'adx_thresh': 8.228881413741975, 'atr_min_pct': 0.005549668267492552, 'atr_max_pct': 0.134305694352868, 'tp_mult': 1.4275424631646307, 'tsl_mult': 0.6601671965410553, 'strategy': 'breakout', 'time_stop': 161, 'use_sma': True, 'use_atr': False, 'use_adx': False, 'use_ema': False, 'use_spike': False, 'rsi_required': False, 'edge_k': 0.44298757956997714, 'edge_cap': 0.28408216321150187, 'bull_strategy': 'breakout', 'bull_bb_std_mult': 1.404165852192087, 'bull_rsi_os': 28, 'bull_rsi_ob': 52, 'bull_adx_thresh': 9.608769945102711, 'bull_atr_min_pct': 0.01383551307813558, 'bull_atr_max_pct': 0.032291612376783844, 'bull_tp_mult': 2.661273988863824, 'bull_tsl_mult': 0.8426678053863382, 'bull_time_stop': 65, 'bull_use_sma': True, 'bull_use_ema': True, 'bull_use_atr': True, 'bull_use_adx': True, 'bull_use_spike': True, 'bull_rsi_required': True, 'bear_strategy': 'mean_reversion', 'bear_bb_std_mult': 1.911096149654559, 'bear_rsi_os': 53, 'bear_rsi_ob': 74, 'bear_adx_thresh': 15.317665982194256, 'bear_atr_min_pct': 0.0011022571805521435, 'bear_atr_max_pct': 0.11156057033514004, 'bear_tp_mult': 2.694751891749338, 'bear_tsl_mult': 0.9217660959722106, 'bear_time_stop': 101, 'bear_use_sma': False, 'bear_use_ema': False, 'bear_use_atr': True, 'bear_use_adx': True, 'bear_use_spike': True, 'bear_rsi_required': True, 'sideways_strategy': 'mean_reversion', 'sideways_bb_std_mult': 3.209071019922911, 'sideways_rsi_os': 13, 'sideways_rsi_ob': 80, 'sideways_adx_thresh': 10.94199460183575, 'sideways_atr_min_pct': 0.005080098833607154, 'sideways_atr_max_pct': 0.034953280919314655, 'sideways_tp_mult': 1.7425067661263816, 'sideways_tsl_mult': 0.4073597566779239, 'sideways_time_stop': 214, 'sideways_use_sma': True, 'sideways_use_ema': False, 'sideways_use_atr': False, 'sideways_use_adx': False, 'sideways_use_spike': True, 'sideways_rsi_required': True}.
[I 2025-08-30 15:53:10,479] Trial 583 finished with values: [-1000000000.0, 1000000000.0] and parameters: {'p_sma': 33, 'p_std': 21, 'p_atr': 12, 'p_adx': 24, 'rsi_period': 70, 'ema1': 24, 'ema2': 42, 'slip_atr_k': 0.10499742852245858, 'slip_spread_k': 0.6859189555951077, 'spread_hl_frac': 0.008863198953315839, 'bb_std_mult': 1.559821647692584, 'rsi_os': 14, 'rsi_ob': 54, 'vol_spike': 0.2096466328437023, 'adx_thresh': 26.772847613033267, 'atr_min_pct': 0.02123028418882131, 'atr_max_pct': 0.11488821000848716, 'tp_mult': 1.5219666991567329, 'tsl_mult': 0.3341175482548438, 'strategy': 'breakout', 'time_stop': 92, 'use_sma': False, 'use_atr': True, 'use_adx': False, 'use_ema': False, 'use_spike': False, 'rsi_required': False, 'edge_k': 0.4483205710046301, 'edge_cap': 0.9790728215599194, 'bull_strategy': 'breakout', 'bull_bb_std_mult': 1.3677751185663882, 'bull_rsi_os': 29, 'bull_rsi_ob': 86, 'bull_adx_thresh': 24.820085722118975, 'bull_atr_min_pct': 0.01883236431442072, 'bull_atr_max_pct': 0.10264598548890486, 'bull_tp_mult': 2.5517697307599145, 'bull_tsl_mult': 0.5870208562329055, 'bull_time_stop': 56, 'bull_use_sma': False, 'bull_use_ema': True, 'bull_use_atr': False, 'bull_use_adx': True, 'bull_use_spike': True, 'bull_rsi_required': False, 'bear_strategy': 'mean_reversion', 'bear_bb_std_mult': 1.7219832157968633, 'bear_rsi_os': 27, 'bear_rsi_ob': 76, 'bear_adx_thresh': 13.736804584647064, 'bear_atr_min_pct': 0.004234134050413471, 'bear_atr_max_pct': 0.04073451243515111, 'bear_tp_mult': 2.5409544969573004, 'bear_tsl_mult': 0.15284415107009447, 'bear_time_stop': 105, 'bear_use_sma': True, 'bear_use_ema': False, 'bear_use_atr': False, 'bear_use_adx': True, 'bear_use_spike': False, 'bear_rsi_required': True, 'sideways_strategy': 'mean_reversion', 'sideways_bb_std_mult': 3.213403411244784, 'sideways_rsi_os': 13, 'sideways_rsi_ob': 80, 'sideways_adx_thresh': 9.991270860542107, 'sideways_atr_min_pct': 0.003865511747264771, 'sideways_atr_max_pct': 0.070445041495256, 'sideways_tp_mult': 1.997805683316888, 'sideways_tsl_mult': 0.3806497565548236, 'sideways_time_stop': 133, 'sideways_use_sma': True, 'sideways_use_ema': False, 'sideways_use_atr': False, 'sideways_use_adx': True, 'sideways_use_spike': False, 'sideways_rsi_required': True}.
[I 2025-08-30 15:53:11,689] Trial 584 finished with values: [-1000000000.0, 1000000000.0] and parameters: {'p_sma': 10, 'p_std': 14, 'p_atr': 11, 'p_adx': 24, 'rsi_period': 13, 'ema1': 20, 'ema2': 41, 'slip_atr_k': 0.24914599344266486, 'slip_spread_k': 0.6843860949186477, 'spread_hl_frac': 0.008732332235207415, 'bb_std_mult': 0.7104413592077086, 'rsi_os': 27, 'rsi_ob': 65, 'vol_spike': 0.2077185105412707, 'adx_thresh': 9.183198982483518, 'atr_min_pct': 0.02644073522116538, 'atr_max_pct': 0.06673948545821803, 'tp_mult': 1.5080790697987791, 'tsl_mult': 0.22428150928638046, 'strategy': 'breakout', 'time_stop': 184, 'use_sma': False, 'use_atr': True, 'use_adx': False, 'use_ema': False, 'use_spike': False, 'rsi_required': False, 'edge_k': 1.5218121285713915, 'edge_cap': 0.9807664554288442, 'bull_strategy': 'breakout', 'bull_bb_std_mult': 1.7530420188170155, 'bull_rsi_os': 29, 'bull_rsi_ob': 86, 'bull_adx_thresh': 10.235041199587394, 'bull_atr_min_pct': 0.018338146168155173, 'bull_atr_max_pct': 0.03693345941935302, 'bull_tp_mult': 1.5623495986694953, 'bull_tsl_mult': 0.5879384599274903, 'bull_time_stop': 56, 'bull_use_sma': False, 'bull_use_ema': True, 'bull_use_atr': False, 'bull_use_adx': True, 'bull_use_spike': True, 'bull_rsi_required': False, 'bear_strategy': 'mean_reversion', 'bear_bb_std_mult': 2.5188657056204597, 'bear_rsi_os': 27, 'bear_rsi_ob': 76, 'bear_adx_thresh': 27.61683897413119, 'bear_atr_min_pct': 0.02245872084159825, 'bear_atr_max_pct': 0.04057809820128226, 'bear_tp_mult': 1.3729732803856367, 'bear_tsl_mult': 0.8161891659558236, 'bear_time_stop': 217, 'bear_use_sma': True, 'bear_use_ema': False, 'bear_use_atr': False, 'bear_use_adx': False, 'bear_use_spike': False, 'bear_rsi_required': True, 'sideways_strategy': 'mean_reversion', 'sideways_bb_std_mult': 3.081565545550904, 'sideways_rsi_os': 9, 'sideways_rsi_ob': 78, 'sideways_adx_thresh': 9.957442820140741, 'sideways_atr_min_pct': 0.0081033855728983, 'sideways_atr_max_pct': 0.07104145818182996, 'sideways_tp_mult': 1.1928871599166166, 'sideways_tsl_mult': 0.3774339962589792, 'sideways_time_stop': 133, 'sideways_use_sma': True, 'sideways_use_ema': False, 'sideways_use_atr': False, 'sideways_use_adx': True, 'sideways_use_spike': False, 'sideways_rsi_required': True}.
[I 2025-08-30 15:53:11,882] Trial 581 finished with values: [-1000000000.0, 1000000000.0] and parameters: {'p_sma': 9, 'p_std': 15, 'p_atr': 13, 'p_adx': 22, 'rsi_period': 37, 'ema1': 24, 'ema2': 35, 'slip_atr_k': 0.00047210776402151666, 'slip_spread_k': 0.6841089350593141, 'spread_hl_frac': 0.012707326000351165, 'bb_std_mult': 0.7172460737948626, 'rsi_os': 27, 'rsi_ob': 89, 'vol_spike': 0.18908898809626895, 'adx_thresh': 19.433217380238503, 'atr_min_pct': 0.026348158864315727, 'atr_max_pct': 0.11820215363983362, 'tp_mult': 1.6169460465767966, 'tsl_mult': 0.22754250993360375, 'strategy': 'breakout', 'time_stop': 159, 'use_sma': True, 'use_atr': True, 'use_adx': False, 'use_ema': False, 'use_spike': False, 'rsi_required': False, 'edge_k': 0.6382973693176598, 'edge_cap': 0.9817622910810356, 'bull_strategy': 'breakout', 'bull_bb_std_mult': 1.757482203600838, 'bull_rsi_os': 48, 'bull_rsi_ob': 89, 'bull_adx_thresh': 24.779359020942568, 'bull_atr_min_pct': 0.024292191945083388, 'bull_atr_max_pct': 0.03348980268718027, 'bull_tp_mult': 2.6578899265910816, 'bull_tsl_mult': 0.8438127205614129, 'bull_time_stop': 63, 'bull_use_sma': False, 'bull_use_ema': True, 'bull_use_atr': True, 'bull_use_adx': True, 'bull_use_spike': True, 'bull_rsi_required': True, 'bear_strategy': 'mean_reversion', 'bear_bb_std_mult': 1.7050122942544335, 'bear_rsi_os': 10, 'bear_rsi_ob': 94, 'bear_adx_thresh': 15.251236786734554, 'bear_atr_min_pct': 0.023309261656434224, 'bear_atr_max_pct': 0.11109750561144585, 'bear_tp_mult': 2.6925459644286787, 'bear_tsl_mult': 0.8630622095801594, 'bear_time_stop': 100, 'bear_use_sma': False, 'bear_use_ema': False, 'bear_use_atr': False, 'bear_use_adx': True, 'bear_use_spike': True, 'bear_rsi_required': True, 'sideways_strategy': 'mean_reversion', 'sideways_bb_std_mult': 0.6394102339518217, 'sideways_rsi_os': 5, 'sideways_rsi_ob': 79, 'sideways_adx_thresh': 8.796887854910873, 'sideways_atr_min_pct': 0.018672775640428598, 'sideways_atr_max_pct': 0.05347032553986113, 'sideways_tp_mult': 1.7604444697800625, 'sideways_tsl_mult': 0.3892373737541866, 'sideways_time_stop': 124, 'sideways_use_sma': True, 'sideways_use_ema': False, 'sideways_use_atr': False, 'sideways_use_adx': False, 'sideways_use_spike': True, 'sideways_rsi_required': True}.
[I 2025-08-30 15:53:12,122] Trial 582 finished with values: [-0.012121626016175058, 0.012178238416536088] and parameters: {'p_sma': 54, 'p_std': 21, 'p_atr': 11, 'p_adx': 25, 'rsi_period': 13, 'ema1': 24, 'ema2': 21, 'slip_atr_k': 0.0024736961039117113, 'slip_spread_k': 0.7915390872778071, 'spread_hl_frac': 0.008865505399740365, 'bb_std_mult': 1.5477875970506825, 'rsi_os': 47, 'rsi_ob': 54, 'vol_spike': 0.1877141045945613, 'adx_thresh': 30.65007671181204, 'atr_min_pct': 0.021094765591993928, 'atr_max_pct': 0.13532101009326694, 'tp_mult': 2.901555067379709, 'tsl_mult': 0.8490041320180903, 'strategy': 'breakout', 'time_stop': 149, 'use_sma': False, 'use_atr': True, 'use_adx': False, 'use_ema': False, 'use_spike': False, 'rsi_required': False, 'edge_k': 0.46540847172359906, 'edge_cap': 0.9728703090218371, 'bull_strategy': 'breakout', 'bull_bb_std_mult': 1.8035652147761987, 'bull_rsi_os': 28, 'bull_rsi_ob': 52, 'bull_adx_thresh': 9.095983160687918, 'bull_atr_min_pct': 0.02796921610527628, 'bull_atr_max_pct': 0.10275537629331584, 'bull_tp_mult': 2.153924932965401, 'bull_tsl_mult': 0.8661717990536925, 'bull_time_stop': 42, 'bull_use_sma': False, 'bull_use_ema': True, 'bull_use_atr': False, 'bull_use_adx': True, 'bull_use_spike': True, 'bull_rsi_required': False, 'bear_strategy': 'mean_reversion', 'bear_bb_std_mult': 2.5692248967983136, 'bear_rsi_os': 51, 'bear_rsi_ob': 76, 'bear_adx_thresh': 15.353959830189151, 'bear_atr_min_pct': 0.0032783535511029006, 'bear_atr_max_pct': 0.11049266004439096, 'bear_tp_mult': 2.195678559412407, 'bear_tsl_mult': 0.8566008597592795, 'bear_time_stop': 104, 'bear_use_sma': False, 'bear_use_ema': False, 'bear_use_atr': False, 'bear_use_adx': True, 'bear_use_spike': False, 'bear_rsi_required': True, 'sideways_strategy': 'mean_reversion', 'sideways_bb_std_mult': 3.205350444974451, 'sideways_rsi_os': 8, 'sideways_rsi_ob': 80, 'sideways_adx_thresh': 9.986457186546872, 'sideways_atr_min_pct': 0.00335856290417378, 'sideways_atr_max_pct': 0.07069853063656653, 'sideways_tp_mult': 1.7432795807911179, 'sideways_tsl_mult': 0.3776044491763112, 'sideways_time_stop': 132, 'sideways_use_sma': True, 'sideways_use_ema': False, 'sideways_use_atr': False, 'sideways_use_adx': True, 'sideways_use_spike': False, 'sideways_rsi_required': True}.
