[I 2025-08-30 16:08:26,632] Trial 668 finished with values: [-1000000000.0, 1000000000.0] and parameters: {'p_sma': 7, 'p_std': 56, 'p_atr': 11, 'p_adx': 25, 'rsi_period': 41, 'ema1': 29, 'ema2': 21, 'slip_atr_k': 0.1504414211985567, 'slip_spread_k': 0.6460755933143653, 'spread_hl_frac': 0.009350421500293901, 'bb_std_mult': 2.320033295355154, 'rsi_os': 28, 'rsi_ob': 76, 'vol_spike': 0.000254487808407311, 'adx_thresh': 8.508001219378457, 'atr_min_pct': 0.004921146464888748, 'atr_max_pct': 0.11000542177342508, 'tp_mult': 1.497048539369088, 'tsl_mult': 0.37832200952645256, 'strategy': 'breakout', 'time_stop': 198, 'use_sma': False, 'use_atr': False, 'use_adx': False, 'use_ema': False, 'use_spike': True, 'rsi_required': True, 'edge_k': 0.4478024790118853, 'edge_cap': 0.6038445489359686, 'bull_strategy': 'breakout', 'bull_bb_std_mult': 0.9479419075430302, 'bull_rsi_os': 50, 'bull_rsi_ob': 86, 'bull_adx_thresh': 10.771494127959496, 'bull_atr_min_pct': 0.020940991779224333, 'bull_atr_max_pct': 0.13803684897922747, 'bull_tp_mult': 2.5219952973744295, 'bull_tsl_mult': 0.9267601393363365, 'bull_time_stop': 50, 'bull_use_sma': True, 'bull_use_ema': True, 'bull_use_atr': False, 'bull_use_adx': True, 'bull_use_spike': False, 'bull_rsi_required': False, 'bear_strategy': 'mean_reversion', 'bear_bb_std_mult': 1.1853953800488304, 'bear_rsi_os': 44, 'bear_rsi_ob': 78, 'bear_adx_thresh': 28.073610765241476, 'bear_atr_min_pct': 0.004161029132192788, 'bear_atr_max_pct': 0.10991337927053801, 'bear_tp_mult': 2.063819352899301, 'bear_tsl_mult': 0.8730553005828262, 'bear_time_stop': 96, 'bear_use_sma': True, 'bear_use_ema': False, 'bear_use_atr': True, 'bear_use_adx': True, 'bear_use_spike': False, 'bear_rsi_required': False, 'sideways_strategy': 'breakout', 'sideways_bb_std_mult': 2.543937795607366, 'sideways_rsi_os': 11, 'sideways_rsi_ob': 77, 'sideways_adx_thresh': 23.15059429690169, 'sideways_atr_min_pct': 0.02105409980583129, 'sideways_atr_max_pct': 0.14383393378975395, 'sideways_tp_mult': 1.4116446569983025, 'sideways_tsl_mult': 0.3646896631443976, 'sideways_time_stop': 139, 'sideways_use_sma': True, 'sideways_use_ema': False, 'sideways_use_atr': True, 'sideways_use_adx': True, 'sideways_use_spike': False, 'sideways_rsi_required': True}.
[I 2025-08-30 16:08:27,107] Trial 665 finished with values: [-1000000000.0, 1000000000.0] and parameters: {'p_sma': 36, 'p_std': 55, 'p_atr': 12, 'p_adx': 26, 'rsi_period': 30, 'ema1': 8, 'ema2': 15, 'slip_atr_k': 0.15264506065553968, 'slip_spread_k': 0.36404487490153714, 'spread_hl_frac': 0.04010313480888242, 'bb_std_mult': 0.7953302985754209, 'rsi_os': 26, 'rsi_ob': 76, 'vol_spike': 0.2029775959447267, 'adx_thresh': 30.391313904280896, 'atr_min_pct': 0.007738118913714372, 'atr_max_pct': 0.11450322960857234, 'tp_mult': 1.811558797546438, 'tsl_mult': 0.3766012336060027, 'strategy': 'breakout', 'time_stop': 195, 'use_sma': False, 'use_atr': False, 'use_adx': True, 'use_ema': False, 'use_spike': False, 'rsi_required': False, 'edge_k': 0.6264069457782424, 'edge_cap': 0.9488933743972847, 'bull_strategy': 'breakout', 'bull_bb_std_mult': 1.6534782020048955, 'bull_rsi_os': 24, 'bull_rsi_ob': 68, 'bull_adx_thresh': 10.789174748798475, 'bull_atr_min_pct': 0.023373202223069628, 'bull_atr_max_pct': 0.10581303327830163, 'bull_tp_mult': 2.5727836440418628, 'bull_tsl_mult': 0.9220207886212994, 'bull_time_stop': 282, 'bull_use_sma': True, 'bull_use_ema': True, 'bull_use_atr': True, 'bull_use_adx': True, 'bull_use_spike': True, 'bull_rsi_required': False, 'bear_strategy': 'mean_reversion', 'bear_bb_std_mult': 2.157178406659475, 'bear_rsi_os': 27, 'bear_rsi_ob': 95, 'bear_adx_thresh': 16.883466082309404, 'bear_atr_min_pct': 0.0009772141250604443, 'bear_atr_max_pct': 0.10495305970103237, 'bear_tp_mult': 2.054271892893498, 'bear_tsl_mult': 0.8821995002240608, 'bear_time_stop': 87, 'bear_use_sma': True, 'bear_use_ema': False, 'bear_use_atr': True, 'bear_use_adx': True, 'bear_use_spike': True, 'bear_rsi_required': True, 'sideways_strategy': 'breakout', 'sideways_bb_std_mult': 2.128820789560619, 'sideways_rsi_os': 17, 'sideways_rsi_ob': 75, 'sideways_adx_thresh': 23.98914689269146, 'sideways_atr_min_pct': 0.021130705735085263, 'sideways_atr_max_pct': 0.07132249577545988, 'sideways_tp_mult': 1.4137598210210478, 'sideways_tsl_mult': 0.40751483275062084, 'sideways_time_stop': 68, 'sideways_use_sma': False, 'sideways_use_ema': False, 'sideways_use_atr': True, 'sideways_use_adx': True, 'sideways_use_spike': True, 'sideways_rsi_required': True}.
[I 2025-08-30 16:08:27,707] Trial 666 finished with values: [-1000000000.0, 1000000000.0] and parameters: {'p_sma': 20, 'p_std': 17, 'p_atr': 11, 'p_adx': 19, 'rsi_period': 45, 'ema1': 22, 'ema2': 21, 'slip_atr_k': 0.04670110559344187, 'slip_spread_k': 0.42270802039701655, 'spread_hl_frac': 0.029841266715497604, 'bb_std_mult': 2.624774416203947, 'rsi_os': 27, 'rsi_ob': 89, 'vol_spike': 0.22525352756480202, 'adx_thresh': 8.340804003098837, 'atr_min_pct': 0.004853681241409932, 'atr_max_pct': 0.11516723483073012, 'tp_mult': 1.5205286614606115, 'tsl_mult': 0.9776300526030692, 'strategy': 'breakout', 'time_stop': 143, 'use_sma': True, 'use_atr': False, 'use_adx': False, 'use_ema': False, 'use_spike': True, 'rsi_required': False, 'edge_k': 1.2222266848516967, 'edge_cap': 0.38610097108935404, 'bull_strategy': 'breakout', 'bull_bb_std_mult': 1.5232645476253477, 'bull_rsi_os': 24, 'bull_rsi_ob': 53, 'bull_adx_thresh': 8.945018978040475, 'bull_atr_min_pct': 0.02090527445189421, 'bull_atr_max_pct': 0.07373672394803509, 'bull_tp_mult': 2.5203190966392466, 'bull_tsl_mult': 0.9177104966459863, 'bull_time_stop': 48, 'bull_use_sma': True, 'bull_use_ema': True, 'bull_use_atr': True, 'bull_use_adx': True, 'bull_use_spike': True, 'bull_rsi_required': False, 'bear_strategy': 'mean_reversion', 'bear_bb_std_mult': 2.153559531219457, 'bear_rsi_os': 51, 'bear_rsi_ob': 77, 'bear_adx_thresh': 21.546901761906458, 'bear_atr_min_pct': 0.00469346002739457, 'bear_atr_max_pct': 0.10569596143657421, 'bear_tp_mult': 2.0424962739195704, 'bear_tsl_mult': 0.4679244054873271, 'bear_time_stop': 86, 'bear_use_sma': True, 'bear_use_ema': False, 'bear_use_atr': True, 'bear_use_adx': True, 'bear_use_spike': True, 'bear_rsi_required': True, 'sideways_strategy': 'breakout', 'sideways_bb_std_mult': 3.187496369292396, 'sideways_rsi_os': 20, 'sideways_rsi_ob': 79, 'sideways_adx_thresh': 12.88747186398394, 'sideways_atr_min_pct': 0.019650863159881977, 'sideways_atr_max_pct': 0.11042455204756421, 'sideways_tp_mult': 1.4104648703710025, 'sideways_tsl_mult': 0.4125051010465041, 'sideways_time_stop': 240, 'sideways_use_sma': True, 'sideways_use_ema': False, 'sideways_use_atr': True, 'sideways_use_adx': False, 'sideways_use_spike': True, 'sideways_rsi_required': True}.
[I 2025-08-30 16:08:28,643] Trial 669 finished with values: [-1000000000.0, 1000000000.0] and parameters: {'p_sma': 36, 'p_std': 52, 'p_atr': 23, 'p_adx': 25, 'rsi_period': 40, 'ema1': 29, 'ema2': 29, 'slip_atr_k': 0.004788212921948665, 'slip_spread_k': 0.6931588424944749, 'spread_hl_frac': 0.04999038371821594, 'bb_std_mult': 0.5883250830214009, 'rsi_os': 25, 'rsi_ob': 84, 'vol_spike': 0.2201803612076378, 'adx_thresh': 8.578421031666702, 'atr_min_pct': 0.006246038727720541, 'atr_max_pct': 0.11001981086152055, 'tp_mult': 2.5813865452651195, 'tsl_mult': 0.6888734430318302, 'strategy': 'breakout', 'time_stop': 143, 'use_sma': False, 'use_atr': False, 'use_adx': True, 'use_ema': False, 'use_spike': False, 'rsi_required': True, 'edge_k': 1.0935069813751297, 'edge_cap': 0.9591427767957529, 'bull_strategy': 'breakout', 'bull_bb_std_mult': 1.3779447899530717, 'bull_rsi_os': 47, 'bull_rsi_ob': 86, 'bull_adx_thresh': 9.02251550308001, 'bull_atr_min_pct': 0.02883057518585668, 'bull_atr_max_pct': 0.11000060248247992, 'bull_tp_mult': 2.6251184819642996, 'bull_tsl_mult': 0.8453688649296769, 'bull_time_stop': 47, 'bull_use_sma': True, 'bull_use_ema': True, 'bull_use_atr': True, 'bull_use_adx': True, 'bull_use_spike': True, 'bull_rsi_required': False, 'bear_strategy': 'mean_reversion', 'bear_bb_std_mult': 2.299559142884129, 'bear_rsi_os': 17, 'bear_rsi_ob': 61, 'bear_adx_thresh': 21.426198771167225, 'bear_atr_min_pct': 0.00425749703471809, 'bear_atr_max_pct': 0.06500082720273763, 'bear_tp_mult': 2.7591608584271508, 'bear_tsl_mult': 0.892512650564696, 'bear_time_stop': 96, 'bear_use_sma': True, 'bear_use_ema': False, 'bear_use_atr': True, 'bear_use_adx': True, 'bear_use_spike': False, 'bear_rsi_required': False, 'sideways_strategy': 'breakout', 'sideways_bb_std_mult': 3.4006484911427854, 'sideways_rsi_os': 20, 'sideways_rsi_ob': 77, 'sideways_adx_thresh': 21.51284787469686, 'sideways_atr_min_pct': 0.01810543734995583, 'sideways_atr_max_pct': 0.14834815799623877, 'sideways_tp_mult': 1.6334691417240337, 'sideways_tsl_mult': 0.3781382315443542, 'sideways_time_stop': 141, 'sideways_use_sma': True, 'sideways_use_ema': True, 'sideways_use_atr': False, 'sideways_use_adx': True, 'sideways_use_spike': False, 'sideways_rsi_required': True}.
[I 2025-08-30 16:09:16,964] Trial 672 finished with values: [-1000000000.0, 1000000000.0] and parameters: {'p_sma': 9, 'p_std': 18, 'p_atr': 12, 'p_adx': 25, 'rsi_period': 38, 'ema1': 26, 'ema2': 40, 'slip_atr_k': 0.0044613246558277975, 'slip_spread_k': 0.6915250125921382, 'spread_hl_frac': 0.00618197582395939, 'bb_std_mult': 0.5653502764541161, 'rsi_os': 25, 'rsi_ob': 84, 'vol_spike': 0.21942475760883057, 'adx_thresh': 34.127302170573365, 'atr_min_pct': 0.006220644821042235, 'atr_max_pct': 0.04442804920622105, 'tp_mult': 1.6526473616688249, 'tsl_mult': 0.31368937076975345, 'strategy': 'breakout', 'time_stop': 93, 'use_sma': False, 'use_atr': False, 'use_adx': True, 'use_ema': False, 'use_spike': False, 'rsi_required': True, 'edge_k': 1.7146922078654336, 'edge_cap': 0.1283656546063054, 'bull_strategy': 'breakout', 'bull_bb_std_mult': 1.4129302041790155, 'bull_rsi_os': 10, 'bull_rsi_ob': 87, 'bull_adx_thresh': 9.08984427749114, 'bull_atr_min_pct': 0.01927139140767064, 'bull_atr_max_pct': 0.10046688222921535, 'bull_tp_mult': 2.6703030381288575, 'bull_tsl_mult': 0.8456153762302266, 'bull_time_stop': 85, 'bull_use_sma': True, 'bull_use_ema': True, 'bull_use_atr': True, 'bull_use_adx': True, 'bull_use_spike': True, 'bull_rsi_required': True, 'bear_strategy': 'mean_reversion', 'bear_bb_std_mult': 2.3122907211611397, 'bear_rsi_os': 33, 'bear_rsi_ob': 86, 'bear_adx_thresh': 15.82585893983536, 'bear_atr_min_pct': 0.0032281182506193, 'bear_atr_max_pct': 0.06599998110821538, 'bear_tp_mult': 2.7534359218637894, 'bear_tsl_mult': 0.8086600306141208, 'bear_time_stop': 179, 'bear_use_sma': True, 'bear_use_ema': False, 'bear_use_atr': True, 'bear_use_adx': False, 'bear_use_spike': False, 'bear_rsi_required': False, 'sideways_strategy': 'mean_reversion', 'sideways_bb_std_mult': 2.6254052471685596, 'sideways_rsi_os': 19, 'sideways_rsi_ob': 47, 'sideways_adx_thresh': 11.746330007804666, 'sideways_atr_min_pct': 0.012077724559551245, 'sideways_atr_max_pct': 0.07506376550887837, 'sideways_tp_mult': 1.260459918754297, 'sideways_tsl_mult': 0.38169898431605176, 'sideways_time_stop': 143, 'sideways_use_sma': True, 'sideways_use_ema': True, 'sideways_use_atr': False, 'sideways_use_adx': True, 'sideways_use_spike': False, 'sideways_rsi_required': True}.
[I 2025-08-30 16:09:17,641] Trial 670 finished with values: [-1000000000.0, 1000000000.0] and parameters: {'p_sma': 20, 'p_std': 23, 'p_atr': 12, 'p_adx': 25, 'rsi_period': 12, 'ema1': 18, 'ema2': 33, 'slip_atr_k': 0.2344720099053963, 'slip_spread_k': 0.9388114667933696, 'spread_hl_frac': 0.03761626799275192, 'bb_std_mult': 0.5897501411840823, 'rsi_os': 49, 'rsi_ob': 62, 'vol_spike': 0.21883911427718708, 'adx_thresh': 34.05281716860696, 'atr_min_pct': 0.006438147207879583, 'atr_max_pct': 0.02674075397157801, 'tp_mult': 1.8175715983051248, 'tsl_mult': 0.28850267629421467, 'strategy': 'breakout', 'time_stop': 142, 'use_sma': False, 'use_atr': False, 'use_adx': True, 'use_ema': False, 'use_spike': False, 'rsi_required': False, 'edge_k': 0.6279578142099239, 'edge_cap': 0.13116316273981887, 'bull_strategy': 'breakout', 'bull_bb_std_mult': 1.5129846081853073, 'bull_rsi_os': 10, 'bull_rsi_ob': 86, 'bull_adx_thresh': 9.047955414261219, 'bull_atr_min_pct': 0.02882288413931928, 'bull_atr_max_pct': 0.10539725637665866, 'bull_tp_mult': 2.87498501778106, 'bull_tsl_mult': 0.8528544737910206, 'bull_time_stop': 45, 'bull_use_sma': True, 'bull_use_ema': True, 'bull_use_atr': True, 'bull_use_adx': True, 'bull_use_spike': True, 'bull_rsi_required': False, 'bear_strategy': 'mean_reversion', 'bear_bb_std_mult': 2.562525938233294, 'bear_rsi_os': 16, 'bear_rsi_ob': 60, 'bear_adx_thresh': 15.419196275510249, 'bear_atr_min_pct': 0.010899812380970132, 'bear_atr_max_pct': 0.09657473072133606, 'bear_tp_mult': 2.751570713729526, 'bear_tsl_mult': 0.8823967350825599, 'bear_time_stop': 178, 'bear_use_sma': True, 'bear_use_ema': False, 'bear_use_atr': True, 'bear_use_adx': False, 'bear_use_spike': True, 'bear_rsi_required': True, 'sideways_strategy': 'mean_reversion', 'sideways_bb_std_mult': 3.098280336051611, 'sideways_rsi_os': 17, 'sideways_rsi_ob': 87, 'sideways_adx_thresh': 11.598871298319652, 'sideways_atr_min_pct': 0.018038134291613956, 'sideways_atr_max_pct': 0.0747524538376475, 'sideways_tp_mult': 1.6381604527065625, 'sideways_tsl_mult': 0.3765796076496651, 'sideways_time_stop': 67, 'sideways_use_sma': True, 'sideways_use_ema': True, 'sideways_use_atr': False, 'sideways_use_adx': True, 'sideways_use_spike': True, 'sideways_rsi_required': True}.
[I 2025-08-30 16:09:18,586] Trial 671 finished with values: [-1000000000.0, 1000000000.0] and parameters: {'p_sma': 28, 'p_std': 18, 'p_atr': 12, 'p_adx': 25, 'rsi_period': 68, 'ema1': 22, 'ema2': 24, 'slip_atr_k': 0.0054509272573497625, 'slip_spread_k': 0.06593897416969385, 'spread_hl_frac': 0.005081872230865137, 'bb_std_mult': 0.5819249777941685, 'rsi_os': 25, 'rsi_ob': 51, 'vol_spike': 0.21942083130339535, 'adx_thresh': 10.369872628092166, 'atr_min_pct': 0.001598832103647748, 'atr_max_pct': 0.12086405704150222, 'tp_mult': 2.847926627628969, 'tsl_mult': 0.2948155699855519, 'strategy': 'breakout', 'time_stop': 128, 'use_sma': False, 'use_atr': False, 'use_adx': True, 'use_ema': False, 'use_spike': False, 'rsi_required': False, 'edge_k': 0.13068644843297073, 'edge_cap': 0.9625299063658855, 'bull_strategy': 'breakout', 'bull_bb_std_mult': 1.5188684377859003, 'bull_rsi_os': 48, 'bull_rsi_ob': 83, 'bull_adx_thresh': 8.96482488221753, 'bull_atr_min_pct': 0.004267204308090376, 'bull_atr_max_pct': 0.11076706364867098, 'bull_tp_mult': 2.6335113878307057, 'bull_tsl_mult': 0.8532907717477664, 'bull_time_stop': 45, 'bull_use_sma': True, 'bull_use_ema': True, 'bull_use_atr': True, 'bull_use_adx': True, 'bull_use_spike': True, 'bull_rsi_required': False, 'bear_strategy': 'mean_reversion', 'bear_bb_std_mult': 2.3126134695823706, 'bear_rsi_os': 25, 'bear_rsi_ob': 61, 'bear_adx_thresh': 15.770772295121793, 'bear_atr_min_pct': 0.003149702015668693, 'bear_atr_max_pct': 0.1114446208095245, 'bear_tp_mult': 2.576388542049596, 'bear_tsl_mult': 0.8499258056151616, 'bear_time_stop': 102, 'bear_use_sma': True, 'bear_use_ema': False, 'bear_use_atr': True, 'bear_use_adx': False, 'bear_use_spike': False, 'bear_rsi_required': True, 'sideways_strategy': 'mean_reversion', 'sideways_bb_std_mult': 1.7581342479819657, 'sideways_rsi_os': 20, 'sideways_rsi_ob': 47, 'sideways_adx_thresh': 12.287221326008481, 'sideways_atr_min_pct': 0.019669206760577238, 'sideways_atr_max_pct': 0.076516374832931, 'sideways_tp_mult': 1.65305485172825, 'sideways_tsl_mult': 0.3064441646880865, 'sideways_time_stop': 143, 'sideways_use_sma': True, 'sideways_use_ema': True, 'sideways_use_atr': False, 'sideways_use_adx': True, 'sideways_use_spike': False, 'sideways_rsi_required': True}.
[I 2025-08-30 16:09:19,351] Trial 673 finished with values: [-1000000000.0, 1000000000.0] and parameters: {'p_sma': 9, 'p_std': 20, 'p_atr': 12, 'p_adx': 25, 'rsi_period': 75, 'ema1': 20, 'ema2': 16, 'slip_atr_k': 0.005316171704861537, 'slip_spread_k': 0.7582914857270637, 'spread_hl_frac': 0.005322893212794477, 'bb_std_mult': 2.0913851166930124, 'rsi_os': 49, 'rsi_ob': 58, 'vol_spike': 0.2137879995602093, 'adx_thresh': 10.432314283054641, 'atr_min_pct': 0.00670723415001037, 'atr_max_pct': 0.13703045380749218, 'tp_mult': 1.5605997343236884, 'tsl_mult': 0.7941194820977281, 'strategy': 'breakout', 'time_stop': 95, 'use_sma': False, 'use_atr': False, 'use_adx': True, 'use_ema': False, 'use_spike': False, 'rsi_required': False, 'edge_k': 0.5524549080424526, 'edge_cap': 0.4600129936140109, 'bull_strategy': 'breakout', 'bull_bb_std_mult': 3.178486838228312, 'bull_rsi_os': 49, 'bull_rsi_ob': 87, 'bull_adx_thresh': 8.034770534729196, 'bull_atr_min_pct': 0.022557721739574894, 'bull_atr_max_pct': 0.10204675581011638, 'bull_tp_mult': 2.611014371794097, 'bull_tsl_mult': 0.8907824634931676, 'bull_time_stop': 41, 'bull_use_sma': True, 'bull_use_ema': True, 'bull_use_atr': True, 'bull_use_adx': True, 'bull_use_spike': True, 'bull_rsi_required': True, 'bear_strategy': 'mean_reversion', 'bear_bb_std_mult': 1.5988829547868049, 'bear_rsi_os': 22, 'bear_rsi_ob': 55, 'bear_adx_thresh': 15.722387539577575, 'bear_atr_min_pct': 0.0031005403298976428, 'bear_atr_max_pct': 0.09565613902163629, 'bear_tp_mult': 2.5795178662926768, 'bear_tsl_mult': 0.8550079061268634, 'bear_time_stop': 67, 'bear_use_sma': True, 'bear_use_ema': False, 'bear_use_atr': True, 'bear_use_adx': False, 'bear_use_spike': True, 'bear_rsi_required': True, 'sideways_strategy': 'mean_reversion', 'sideways_bb_std_mult': 3.0343530961583145, 'sideways_rsi_os': 27, 'sideways_rsi_ob': 88, 'sideways_adx_thresh': 12.053217971734716, 'sideways_atr_min_pct': 0.019133092844705265, 'sideways_atr_max_pct': 0.07490669927363329, 'sideways_tp_mult': 1.2985415723989888, 'sideways_tsl_mult': 0.017272271561263597, 'sideways_time_stop': 258, 'sideways_use_sma': True, 'sideways_use_ema': True, 'sideways_use_atr': False, 'sideways_use_adx': True, 'sideways_use_spike': True, 'sideways_rsi_required': True}.
[I 2025-08-30 16:10:02,911] Trial 675 finished with values: [-1000000000.0, 1000000000.0] and parameters: {'p_sma': 8, 'p_std': 20, 'p_atr': 13, 'p_adx': 25, 'rsi_period': 75, 'ema1': 28, 'ema2': 43, 'slip_atr_k': 0.009855956574980215, 'slip_spread_k': 0.7535578356179292, 'spread_hl_frac': 0.004162953129227544, 'bb_std_mult': 0.7048075337650422, 'rsi_os': 28, 'rsi_ob': 58, 'vol_spike': 0.23233917162691334, 'adx_thresh': 10.757289390526084, 'atr_min_pct': 0.0017411635930846305, 'atr_max_pct': 0.11272822862516325, 'tp_mult': 1.4543534928932162, 'tsl_mult': 0.34682373332378763, 'strategy': 'mean_reversion', 'time_stop': 156, 'use_sma': False, 'use_atr': False, 'use_adx': True, 'use_ema': True, 'use_spike': False, 'rsi_required': False, 'edge_k': 0.5297344433951232, 'edge_cap': 0.9062662950617197, 'bull_strategy': 'mean_reversion', 'bull_bb_std_mult': 1.5947410818190106, 'bull_rsi_os': 49, 'bull_rsi_ob': 61, 'bull_adx_thresh': 11.49041016809526, 'bull_atr_min_pct': 0.01859188045769024, 'bull_atr_max_pct': 0.09664893041874292, 'bull_tp_mult': 2.6138178256499476, 'bull_tsl_mult': 0.8762209896219405, 'bull_time_stop': 65, 'bull_use_sma': False, 'bull_use_ema': True, 'bull_use_atr': False, 'bull_use_adx': True, 'bull_use_spike': False, 'bull_rsi_required': False, 'bear_strategy': 'breakout', 'bear_bb_std_mult': 1.4186387985490596, 'bear_rsi_os': 41, 'bear_rsi_ob': 73, 'bear_adx_thresh': 33.20753680992866, 'bear_atr_min_pct': 0.0030856495182185226, 'bear_atr_max_pct': 0.11731393211412038, 'bear_tp_mult': 2.291589342203884, 'bear_tsl_mult': 0.8525581155656848, 'bear_time_stop': 102, 'bear_use_sma': False, 'bear_use_ema': False, 'bear_use_atr': True, 'bear_use_adx': True, 'bear_use_spike': True, 'bear_rsi_required': True, 'sideways_strategy': 'mean_reversion', 'sideways_bb_std_mult': 0.503144297370091, 'sideways_rsi_os': 12, 'sideways_rsi_ob': 80, 'sideways_adx_thresh': 26.72171949465279, 'sideways_atr_min_pct': 0.019227940268901157, 'sideways_atr_max_pct': 0.06287617018579116, 'sideways_tp_mult': 1.3197066679912852, 'sideways_tsl_mult': 0.7034098472523119, 'sideways_time_stop': 272, 'sideways_use_sma': True, 'sideways_use_ema': False, 'sideways_use_atr': True, 'sideways_use_adx': True, 'sideways_use_spike': True, 'sideways_rsi_required': False}.
