[I 2025-08-30 16:03:04,560] Trial 638 finished with values: [-1000000000.0, 1000000000.0] and parameters: {'p_sma': 7, 'p_std': 19, 'p_atr': 13, 'p_adx': 24, 'rsi_period': 60, 'ema1': 22, 'ema2': 40, 'slip_atr_k': 0.21947160361614587, 'slip_spread_k': 0.7144306549275935, 'spread_hl_frac': 0.008240383479905425, 'bb_std_mult': 1.3782673906306702, 'rsi_os': 27, 'rsi_ob': 89, 'vol_spike': 0.2669454146604353, 'adx_thresh': 9.999672006576946, 'atr_min_pct': 0.006408362689222354, 'atr_max_pct': 0.10447130140539637, 'tp_mult': 1.4049161449494216, 'tsl_mult': 0.8891549368433628, 'strategy': 'breakout', 'time_stop': 153, 'use_sma': False, 'use_atr': False, 'use_adx': True, 'use_ema': False, 'use_spike': False, 'rsi_required': False, 'edge_k': 0.564359084305817, 'edge_cap': 0.8977510190946072, 'bull_strategy': 'breakout', 'bull_bb_std_mult': 1.659587767976752, 'bull_rsi_os': 51, 'bull_rsi_ob': 85, 'bull_adx_thresh': 8.74572210047212, 'bull_atr_min_pct': 0.02033978408815377, 'bull_atr_max_pct': 0.06509144015798916, 'bull_tp_mult': 2.2093085910504606, 'bull_tsl_mult': 0.4290553622467387, 'bull_time_stop': 47, 'bull_use_sma': True, 'bull_use_ema': False, 'bull_use_atr': True, 'bull_use_adx': True, 'bull_use_spike': True, 'bull_rsi_required': True, 'bear_strategy': 'mean_reversion', 'bear_bb_std_mult': 1.8546379173913614, 'bear_rsi_os': 29, 'bear_rsi_ob': 75, 'bear_adx_thresh': 18.40215262963712, 'bear_atr_min_pct': 0.0029921137874399442, 'bear_atr_max_pct': 0.055475760982761115, 'bear_tp_mult': 1.3408235846485883, 'bear_tsl_mult': 0.7437601637508924, 'bear_time_stop': 146, 'bear_use_sma': True, 'bear_use_ema': True, 'bear_use_atr': True, 'bear_use_adx': True, 'bear_use_spike': True, 'bear_rsi_required': True, 'sideways_strategy': 'mean_reversion', 'sideways_bb_std_mult': 3.0744603984448604, 'sideways_rsi_os': 43, 'sideways_rsi_ob': 80, 'sideways_adx_thresh': 11.540236623432799, 'sideways_atr_min_pct': 0.0041860815879867525, 'sideways_atr_max_pct': 0.039636583726427, 'sideways_tp_mult': 1.240972845253492, 'sideways_tsl_mult': 0.34796925463997247, 'sideways_time_stop': 142, 'sideways_use_sma': True, 'sideways_use_ema': False, 'sideways_use_atr': False, 'sideways_use_adx': True, 'sideways_use_spike': True, 'sideways_rsi_required': True}.
[I 2025-08-30 16:03:04,761] Trial 639 finished with values: [-1000000000.0, 1000000000.0] and parameters: {'p_sma': 7, 'p_std': 43, 'p_atr': 8, 'p_adx': 24, 'rsi_period': 8, 'ema1': 22, 'ema2': 58, 'slip_atr_k': 0.013945178028912673, 'slip_spread_k': 0.71355387584148, 'spread_hl_frac': 0.006453946175036968, 'bb_std_mult': 0.5649234459323982, 'rsi_os': 27, 'rsi_ob': 89, 'vol_spike': 0.21832933394275642, 'adx_thresh': 10.012860279409875, 'atr_min_pct': 0.010007831603048686, 'atr_max_pct': 0.10528596276011151, 'tp_mult': 1.9558820611514078, 'tsl_mult': 0.20364534111286064, 'strategy': 'breakout', 'time_stop': 155, 'use_sma': False, 'use_atr': True, 'use_adx': False, 'use_ema': False, 'use_spike': False, 'rsi_required': False, 'edge_k': 1.4951389177816554, 'edge_cap': 0.4209971247631985, 'bull_strategy': 'breakout', 'bull_bb_std_mult': 1.2559074186395311, 'bull_rsi_os': 51, 'bull_rsi_ob': 84, 'bull_adx_thresh': 8.516686915079747, 'bull_atr_min_pct': 0.020181388559732238, 'bull_atr_max_pct': 0.0640509940046996, 'bull_tp_mult': 2.5359641323519626, 'bull_tsl_mult': 0.8415836913791676, 'bull_time_stop': 172, 'bull_use_sma': True, 'bull_use_ema': True, 'bull_use_atr': True, 'bull_use_adx': True, 'bull_use_spike': True, 'bull_rsi_required': True, 'bear_strategy': 'mean_reversion', 'bear_bb_std_mult': 0.5274261181263304, 'bear_rsi_os': 28, 'bear_rsi_ob': 75, 'bear_adx_thresh': 24.86430862930169, 'bear_atr_min_pct': 0.0011426102813665371, 'bear_atr_max_pct': 0.05505529147565763, 'bear_tp_mult': 2.673224812911431, 'bear_tsl_mult': 0.05672209558411534, 'bear_time_stop': 77, 'bear_use_sma': True, 'bear_use_ema': False, 'bear_use_atr': True, 'bear_use_adx': False, 'bear_use_spike': True, 'bear_rsi_required': True, 'sideways_strategy': 'mean_reversion', 'sideways_bb_std_mult': 3.068623564753982, 'sideways_rsi_os': 26, 'sideways_rsi_ob': 45, 'sideways_adx_thresh': 16.808322721368963, 'sideways_atr_min_pct': 0.012651647334840983, 'sideways_atr_max_pct': 0.10535096349180136, 'sideways_tp_mult': 1.2577347968996735, 'sideways_tsl_mult': 0.5806302055952619, 'sideways_time_stop': 283, 'sideways_use_sma': True, 'sideways_use_ema': False, 'sideways_use_atr': False, 'sideways_use_adx': True, 'sideways_use_spike': True, 'sideways_rsi_required': True}.
[I 2025-08-30 16:03:46,369] Trial 644 finished with values: [-1000000000.0, 1000000000.0] and parameters: {'p_sma': 27, 'p_std': 53, 'p_atr': 14, 'p_adx': 22, 'rsi_period': 82, 'ema1': 26, 'ema2': 37, 'slip_atr_k': 0.004639595576885984, 'slip_spread_k': 0.7368661374101753, 'spread_hl_frac': 0.031414827997336685, 'bb_std_mult': 2.4188777953747054, 'rsi_os': 29, 'rsi_ob': 86, 'vol_spike': 0.21132443358510597, 'adx_thresh': 6.068871583011106, 'atr_min_pct': 0.019771014604093577, 'atr_max_pct': 0.13838557233942983, 'tp_mult': 1.1751800375785766, 'tsl_mult': 0.4240090404688106, 'strategy': 'mean_reversion', 'time_stop': 104, 'use_sma': True, 'use_atr': False, 'use_adx': True, 'use_ema': True, 'use_spike': True, 'rsi_required': True, 'edge_k': 1.6211324293879272, 'edge_cap': 0.06815569839396701, 'bull_strategy': 'mean_reversion', 'bull_bb_std_mult': 1.0822526417578289, 'bull_rsi_os': 49, 'bull_rsi_ob': 88, 'bull_adx_thresh': 10.851267848830092, 'bull_atr_min_pct': 0.01953238155239291, 'bull_atr_max_pct': 0.03808967072432935, 'bull_tp_mult': 1.8676755383143975, 'bull_tsl_mult': 0.9184111517438859, 'bull_time_stop': 53, 'bull_use_sma': False, 'bull_use_ema': True, 'bull_use_atr': False, 'bull_use_adx': True, 'bull_use_spike': False, 'bull_rsi_required': False, 'bear_strategy': 'breakout', 'bear_bb_std_mult': 1.7314049647214538, 'bear_rsi_os': 48, 'bear_rsi_ob': 77, 'bear_adx_thresh': 15.412661836061744, 'bear_atr_min_pct': 0.0037353573620031253, 'bear_atr_max_pct': 0.10374016902280037, 'bear_tp_mult': 2.7523544715633537, 'bear_tsl_mult': 0.8213169181928662, 'bear_time_stop': 84, 'bear_use_sma': False, 'bear_use_ema': False, 'bear_use_atr': False, 'bear_use_adx': True, 'bear_use_spike': False, 'bear_rsi_required': False, 'sideways_strategy': 'mean_reversion', 'sideways_bb_std_mult': 3.2418254048332233, 'sideways_rsi_os': 18, 'sideways_rsi_ob': 83, 'sideways_adx_thresh': 9.179241383213592, 'sideways_atr_min_pct': 0.021034059115166096, 'sideways_atr_max_pct': 0.0679360099156558, 'sideways_tp_mult': 1.1278692321219177, 'sideways_tsl_mult': 0.3670518208903815, 'sideways_time_stop': 127, 'sideways_use_sma': True, 'sideways_use_ema': False, 'sideways_use_atr': True, 'sideways_use_adx': False, 'sideways_use_spike': False, 'sideways_rsi_required': False}.
[I 2025-08-30 16:03:46,946] Trial 642 finished with values: [-1000000000.0, 1000000000.0] and parameters: {'p_sma': 11, 'p_std': 17, 'p_atr': 13, 'p_adx': 22, 'rsi_period': 82, 'ema1': 26, 'ema2': 37, 'slip_atr_k': 0.01073091987669116, 'slip_spread_k': 0.4087228903321599, 'spread_hl_frac': 0.03080575967729277, 'bb_std_mult': 0.6757238775111837, 'rsi_os': 29, 'rsi_ob': 74, 'vol_spike': 0.03692421750640125, 'adx_thresh': 8.458135058735726, 'atr_min_pct': 0.004975901644477335, 'atr_max_pct': 0.11689156292751685, 'tp_mult': 1.3513784529546102, 'tsl_mult': 0.43400815738299886, 'strategy': 'breakout', 'time_stop': 138, 'use_sma': False, 'use_atr': False, 'use_adx': True, 'use_ema': False, 'use_spike': False, 'rsi_required': False, 'edge_k': 0.7607876559956885, 'edge_cap': 0.4205133056356367, 'bull_strategy': 'breakout', 'bull_bb_std_mult': 1.7543642182764565, 'bull_rsi_os': 30, 'bull_rsi_ob': 85, 'bull_adx_thresh': 30.580067269710195, 'bull_atr_min_pct': 0.019400463661119846, 'bull_atr_max_pct': 0.05537355446134273, 'bull_tp_mult': 2.5862855611823337, 'bull_tsl_mult': 0.8331654374116129, 'bull_time_stop': 52, 'bull_use_sma': True, 'bull_use_ema': True, 'bull_use_atr': True, 'bull_use_adx': True, 'bull_use_spike': True, 'bull_rsi_required': False, 'bear_strategy': 'mean_reversion', 'bear_bb_std_mult': 2.879299498465612, 'bear_rsi_os': 5, 'bear_rsi_ob': 50, 'bear_adx_thresh': 24.52236439789116, 'bear_atr_min_pct': 0.019951103220354715, 'bear_atr_max_pct': 0.06867341165731175, 'bear_tp_mult': 1.8733421087138, 'bear_tsl_mult': 0.8145096899210933, 'bear_time_stop': 205, 'bear_use_sma': True, 'bear_use_ema': False, 'bear_use_atr': True, 'bear_use_adx': False, 'bear_use_spike': True, 'bear_rsi_required': True, 'sideways_strategy': 'mean_reversion', 'sideways_bb_std_mult': 3.451291787521164, 'sideways_rsi_os': 18, 'sideways_rsi_ob': 83, 'sideways_adx_thresh': 9.17564356415355, 'sideways_atr_min_pct': 0.0204594552768066, 'sideways_atr_max_pct': 0.06828211648363766, 'sideways_tp_mult': 1.53874645781613, 'sideways_tsl_mult': 0.2656430274471221, 'sideways_time_stop': 285, 'sideways_use_sma': True, 'sideways_use_ema': False, 'sideways_use_atr': False, 'sideways_use_adx': True, 'sideways_use_spike': True, 'sideways_rsi_required': True}.
[I 2025-08-30 16:03:47,251] Trial 643 finished with values: [-1000000000.0, 1000000000.0] and parameters: {'p_sma': 34, 'p_std': 21, 'p_atr': 14, 'p_adx': 11, 'rsi_period': 7, 'ema1': 26, 'ema2': 37, 'slip_atr_k': 0.013758046317015191, 'slip_spread_k': 0.7413527551658913, 'spread_hl_frac': 0.020534241758477175, 'bb_std_mult': 2.7512255697189016, 'rsi_os': 29, 'rsi_ob': 87, 'vol_spike': 0.21840656351901033, 'adx_thresh': 5.926866019908495, 'atr_min_pct': 0.01999819462269865, 'atr_max_pct': 0.11640009079849034, 'tp_mult': 1.5232731263906407, 'tsl_mult': 0.33424289434030063, 'strategy': 'breakout', 'time_stop': 139, 'use_sma': True, 'use_atr': True, 'use_adx': False, 'use_ema': False, 'use_spike': True, 'rsi_required': False, 'edge_k': 0.6098260105146112, 'edge_cap': 0.9414924360213605, 'bull_strategy': 'breakout', 'bull_bb_std_mult': 1.744370217084406, 'bull_rsi_os': 49, 'bull_rsi_ob': 63, 'bull_adx_thresh': 10.939403770645525, 'bull_atr_min_pct': 0.006556646446497156, 'bull_atr_max_pct': 0.1188054812696281, 'bull_tp_mult': 2.582116558778906, 'bull_tsl_mult': 0.9198248351899667, 'bull_time_stop': 52, 'bull_use_sma': True, 'bull_use_ema': True, 'bull_use_atr': True, 'bull_use_adx': True, 'bull_use_spike': True, 'bull_rsi_required': False, 'bear_strategy': 'mean_reversion', 'bear_bb_std_mult': 1.7453826510920418, 'bear_rsi_os': 10, 'bear_rsi_ob': 50, 'bear_adx_thresh': 14.372192971429886, 'bear_atr_min_pct': 0.019794213217138697, 'bear_atr_max_pct': 0.04691386065348305, 'bear_tp_mult': 2.7350663993020223, 'bear_tsl_mult': 0.8759608175620046, 'bear_time_stop': 79, 'bear_use_sma': True, 'bear_use_ema': False, 'bear_use_atr': False, 'bear_use_adx': False, 'bear_use_spike': True, 'bear_rsi_required': True, 'sideways_strategy': 'mean_reversion', 'sideways_bb_std_mult': 3.2411480774182526, 'sideways_rsi_os': 52, 'sideways_rsi_ob': 83, 'sideways_adx_thresh': 9.083406777884976, 'sideways_atr_min_pct': 0.02925026230241701, 'sideways_atr_max_pct': 0.06793140182332152, 'sideways_tp_mult': 1.1207977712094555, 'sideways_tsl_mult': 0.3678235804139108, 'sideways_time_stop': 124, 'sideways_use_sma': True, 'sideways_use_ema': False, 'sideways_use_atr': True, 'sideways_use_adx': False, 'sideways_use_spike': True, 'sideways_rsi_required': False}.
[I 2025-08-30 16:03:47,473] Trial 641 finished with values: [-1000000000.0, 1000000000.0] and parameters: {'p_sma': 60, 'p_std': 22, 'p_atr': 14, 'p_adx': 22, 'rsi_period': 82, 'ema1': 26, 'ema2': 30, 'slip_atr_k': 0.06321425635110753, 'slip_spread_k': 0.3959079832953386, 'spread_hl_frac': 0.032077526761028284, 'bb_std_mult': 1.3590526269512007, 'rsi_os': 29, 'rsi_ob': 86, 'vol_spike': 0.13656215802721117, 'adx_thresh': 27.160605160066204, 'atr_min_pct': 0.005109102564241124, 'atr_max_pct': 0.11734064658014462, 'tp_mult': 1.627620382135579, 'tsl_mult': 0.9478214936324016, 'strategy': 'breakout', 'time_stop': 156, 'use_sma': False, 'use_atr': False, 'use_adx': True, 'use_ema': False, 'use_spike': False, 'rsi_required': False, 'edge_k': 1.6158047035579761, 'edge_cap': 0.8989473509721073, 'bull_strategy': 'breakout', 'bull_bb_std_mult': 1.8350704074864692, 'bull_rsi_os': 50, 'bull_rsi_ob': 63, 'bull_adx_thresh': 8.58723913952134, 'bull_atr_min_pct': 0.019582325628375256, 'bull_atr_max_pct': 0.038922463983297705, 'bull_tp_mult': 2.9479130096553154, 'bull_tsl_mult': 0.1777198676759119, 'bull_time_stop': 53, 'bull_use_sma': True, 'bull_use_ema': True, 'bull_use_atr': True, 'bull_use_adx': True, 'bull_use_spike': True, 'bull_rsi_required': False, 'bear_strategy': 'mean_reversion', 'bear_bb_std_mult': 1.7250520876199122, 'bear_rsi_os': 5, 'bear_rsi_ob': 74, 'bear_adx_thresh': 24.86447778116664, 'bear_atr_min_pct': 0.01616439888015632, 'bear_atr_max_pct': 0.05683506780157364, 'bear_tp_mult': 1.653732424713581, 'bear_tsl_mult': 0.8763688477983521, 'bear_time_stop': 173, 'bear_use_sma': True, 'bear_use_ema': False, 'bear_use_atr': True, 'bear_use_adx': False, 'bear_use_spike': True, 'bear_rsi_required': True, 'sideways_strategy': 'mean_reversion', 'sideways_bb_std_mult': 3.431737464178021, 'sideways_rsi_os': 18, 'sideways_rsi_ob': 78, 'sideways_adx_thresh': 10.274524847917354, 'sideways_atr_min_pct': 0.018701086092568035, 'sideways_atr_max_pct': 0.06867861678548495, 'sideways_tp_mult': 1.5447726957651984, 'sideways_tsl_mult': 0.5844203060324902, 'sideways_time_stop': 285, 'sideways_use_sma': True, 'sideways_use_ema': False, 'sideways_use_atr': False, 'sideways_use_adx': True, 'sideways_use_spike': True, 'sideways_rsi_required': True}.
[I 2025-08-30 16:04:27,401] Trial 648 finished with values: [-0.03151379403956234, 0.03163916614717108] and parameters: {'p_sma': 9, 'p_std': 24, 'p_atr': 11, 'p_adx': 26, 'rsi_period': 11, 'ema1': 22, 'ema2': 38, 'slip_atr_k': 0.12188600223852021, 'slip_spread_k': 0.44460481731949825, 'spread_hl_frac': 0.006811837942257792, 'bb_std_mult': 0.5036791392174502, 'rsi_os': 46, 'rsi_ob': 82, 'vol_spike': 0.20275911841184807, 'adx_thresh': 9.065517092397457, 'atr_min_pct': 0.006956675730790313, 'atr_max_pct': 0.0818536654097375, 'tp_mult': 1.4730900686528137, 'tsl_mult': 0.2585555992548257, 'strategy': 'mean_reversion', 'time_stop': 167, 'use_sma': False, 'use_atr': False, 'use_adx': True, 'use_ema': True, 'use_spike': False, 'rsi_required': True, 'edge_k': 0.6699707158743909, 'edge_cap': 0.9824859721038603, 'bull_strategy': 'mean_reversion', 'bull_bb_std_mult': 1.4959994361619997, 'bull_rsi_os': 46, 'bull_rsi_ob': 91, 'bull_adx_thresh': 9.300242830540473, 'bull_atr_min_pct': 0.027009513785072478, 'bull_atr_max_pct': 0.09875491632018236, 'bull_tp_mult': 2.3450570222252725, 'bull_tsl_mult': 0.6277592989789491, 'bull_time_stop': 210, 'bull_use_sma': False, 'bull_use_ema': True, 'bull_use_atr': False, 'bull_use_adx': True, 'bull_use_spike': False, 'bull_rsi_required': False, 'bear_strategy': 'breakout', 'bear_bb_std_mult': 0.7945652720748178, 'bear_rsi_os': 27, 'bear_rsi_ob': 67, 'bear_adx_thresh': 15.91193926829001, 'bear_atr_min_pct': 0.0013761399741161768, 'bear_atr_max_pct': 0.0620689118316759, 'bear_tp_mult': 2.555782740152832, 'bear_tsl_mult': 0.8525205172104198, 'bear_time_stop': 159, 'bear_use_sma': False, 'bear_use_ema': False, 'bear_use_atr': True, 'bear_use_adx': True, 'bear_use_spike': False, 'bear_rsi_required': False, 'sideways_strategy': 'mean_reversion', 'sideways_bb_std_mult': 2.954636290107377, 'sideways_rsi_os': 12, 'sideways_rsi_ob': 77, 'sideways_adx_thresh': 13.61193707963762, 'sideways_atr_min_pct': 0.002829248375399985, 'sideways_atr_max_pct': 0.07360946885444047, 'sideways_tp_mult': 1.334984178275924, 'sideways_tsl_mult': 0.3210352230167928, 'sideways_time_stop': 295, 'sideways_use_sma': True, 'sideways_use_ema': False, 'sideways_use_atr': True, 'sideways_use_adx': True, 'sideways_use_spike': False, 'sideways_rsi_required': True}.
[I 2025-08-30 16:04:28,166] Trial 647 finished with values: [-1000000000.0, 1000000000.0] and parameters: {'p_sma': 9, 'p_std': 23, 'p_atr': 11, 'p_adx': 17, 'rsi_period': 78, 'ema1': 22, 'ema2': 18, 'slip_atr_k': 0.004776241504859269, 'slip_spread_k': 0.6909802287027362, 'spread_hl_frac': 0.0064700172800217105, 'bb_std_mult': 0.7736484327463641, 'rsi_os': 26, 'rsi_ob': 53, 'vol_spike': 0.19242395871507173, 'adx_thresh': 7.6031226494451545, 'atr_min_pct': 0.020570125612553503, 'atr_max_pct': 0.1320515396191994, 'tp_mult': 1.619380894079485, 'tsl_mult': 0.2907062916806028, 'strategy': 'mean_reversion', 'time_stop': 157, 'use_sma': False, 'use_atr': False, 'use_adx': True, 'use_ema': False, 'use_spike': False, 'rsi_required': False, 'edge_k': 0.6590482142654549, 'edge_cap': 0.9811928562156015, 'bull_strategy': 'breakout', 'bull_bb_std_mult': 1.8299305840975595, 'bull_rsi_os': 46, 'bull_rsi_ob': 87, 'bull_adx_thresh': 9.148554041506511, 'bull_atr_min_pct': 0.02139086143185558, 'bull_atr_max_pct': 0.09802906229921664, 'bull_tp_mult': 1.4246590128089889, 'bull_tsl_mult': 0.16871832000757292, 'bull_time_stop': 208, 'bull_use_sma': False, 'bull_use_ema': True, 'bull_use_atr': True, 'bull_use_adx': True, 'bull_use_spike': True, 'bull_rsi_required': False, 'bear_strategy': 'mean_reversion', 'bear_bb_std_mult': 1.929998262332781, 'bear_rsi_os': 26, 'bear_rsi_ob': 58, 'bear_adx_thresh': 16.20153224375721, 'bear_atr_min_pct': 0.018069077167698365, 'bear_atr_max_pct': 0.12802258729422597, 'bear_tp_mult': 2.623985149755267, 'bear_tsl_mult': 0.215685291103843, 'bear_time_stop': 108, 'bear_use_sma': True, 'bear_use_ema': False, 'bear_use_atr': True, 'bear_use_adx': True, 'bear_use_spike': True, 'bear_rsi_required': True, 'sideways_strategy': 'mean_reversion', 'sideways_bb_std_mult': 2.9439419922482184, 'sideways_rsi_os': 54, 'sideways_rsi_ob': 93, 'sideways_adx_thresh': 10.276853993129693, 'sideways_atr_min_pct': 0.018699090020927, 'sideways_atr_max_pct': 0.07334986420715023, 'sideways_tp_mult': 1.3504292474257884, 'sideways_tsl_mult': 0.3839887732561587, 'sideways_time_stop': 138, 'sideways_use_sma': True, 'sideways_use_ema': False, 'sideways_use_atr': True, 'sideways_use_adx': True, 'sideways_use_spike': True, 'sideways_rsi_required': True}.
[I 2025-08-30 16:04:28,200] Trial 646 finished with values: [-1000000000.0, 1000000000.0] and parameters: {'p_sma': 9, 'p_std': 22, 'p_atr': 11, 'p_adx': 11, 'rsi_period': 7, 'ema1': 26, 'ema2': 38, 'slip_atr_k': 0.004587911296485939, 'slip_spread_k': 0.6734132995133033, 'spread_hl_frac': 0.004307848427743009, 'bb_std_mult': 2.7466331634094194, 'rsi_os': 46, 'rsi_ob': 84, 'vol_spike': 0.2192788418462621, 'adx_thresh': 7.768536519214022, 'atr_min_pct': 0.016673207744019036, 'atr_max_pct': 0.11001101081921044, 'tp_mult': 1.6326220216596816, 'tsl_mult': 0.3369946979587878, 'strategy': 'breakout', 'time_stop': 115, 'use_sma': False, 'use_atr': False, 'use_adx': False, 'use_ema': False, 'use_spike': True, 'rsi_required': False, 'edge_k': 0.6728962092752134, 'edge_cap': 0.999821790423433, 'bull_strategy': 'breakout', 'bull_bb_std_mult': 3.0523978398124543, 'bull_rsi_os': 46, 'bull_rsi_ob': 87, 'bull_adx_thresh': 9.30913329108602, 'bull_atr_min_pct': 0.006659306403871145, 'bull_atr_max_pct': 0.09837918224391416, 'bull_tp_mult': 2.612582385009202, 'bull_tsl_mult': 0.6525584284718193, 'bull_time_stop': 81, 'bull_use_sma': True, 'bull_use_ema': True, 'bull_use_atr': True, 'bull_use_adx': True, 'bull_use_spike': True, 'bull_rsi_required': False, 'bear_strategy': 'mean_reversion', 'bear_bb_std_mult': 2.14856797336963, 'bear_rsi_os': 27, 'bear_rsi_ob': 53, 'bear_adx_thresh': 14.608851536448862, 'bear_atr_min_pct': 0.004486355979631049, 'bear_atr_max_pct': 0.03133539903933971, 'bear_tp_mult': 2.7003070916982925, 'bear_tsl_mult': 0.871234749343764, 'bear_time_stop': 92, 'bear_use_sma': True, 'bear_use_ema': False, 'bear_use_atr': True, 'bear_use_adx': True, 'bear_use_spike': True, 'bear_rsi_required': True, 'sideways_strategy': 'mean_reversion', 'sideways_bb_std_mult': 2.973387395613889, 'sideways_rsi_os': 12, 'sideways_rsi_ob': 77, 'sideways_adx_thresh': 10.400420721963732, 'sideways_atr_min_pct': 0.018601452849139357, 'sideways_atr_max_pct': 0.03170551765123372, 'sideways_tp_mult': 1.389872468952555, 'sideways_tsl_mult': 0.31771906987493137, 'sideways_time_stop': 122, 'sideways_use_sma': True, 'sideways_use_ema': False, 'sideways_use_atr': True, 'sideways_use_adx': True, 'sideways_use_spike': True, 'sideways_rsi_required': True}.
