[I 2025-08-30 16:36:01,985] Trial 811 finished with values: [-0.005974896147233455, 0.0059659709605844454] and parameters: {'p_sma': 28, 'p_std': 23, 'p_atr': 21, 'p_adx': 26, 'rsi_period': 9, 'ema1': 15, 'ema2': 35, 'slip_atr_k': 0.004914033945888688, 'slip_spread_k': 0.8451501414160967, 'spread_hl_frac': 0.009147006632646237, 'bb_std_mult': 0.7195529793870008, 'rsi_os': 26, 'rsi_ob': 68, 'vol_spike': 0.20918370119981564, 'adx_thresh': 5.752210619713675, 'atr_min_pct': 0.00572440921569217, 'atr_max_pct': 0.013915910456622563, 'tp_mult': 1.5040867017014956, 'tsl_mult': 0.283932894783939, 'strategy': 'mean_reversion', 'time_stop': 158, 'use_sma': True, 'use_atr': False, 'use_adx': True, 'use_ema': False, 'use_spike': False, 'rsi_required': True, 'edge_k': 0.8450318786901456, 'edge_cap': 0.41919691502364864, 'bull_strategy': 'breakout', 'bull_bb_std_mult': 2.217771433841014, 'bull_rsi_os': 30, 'bull_rsi_ob': 94, 'bull_adx_thresh': 19.683159700339335, 'bull_atr_min_pct': 0.022698283082992855, 'bull_atr_max_pct': 0.059353376886036695, 'bull_tp_mult': 2.654429150692677, 'bull_tsl_mult': 0.6990217517542878, 'bull_time_stop': 61, 'bull_use_sma': False, 'bull_use_ema': True, 'bull_use_atr': False, 'bull_use_adx': True, 'bull_use_spike': True, 'bull_rsi_required': True, 'bear_strategy': 'mean_reversion', 'bear_bb_std_mult': 1.2822194683444015, 'bear_rsi_os': 30, 'bear_rsi_ob': 76, 'bear_adx_thresh': 28.865891511075873, 'bear_atr_min_pct': 0.002561739450266668, 'bear_atr_max_pct': 0.11333626262459125, 'bear_tp_mult': 2.6546561831988855, 'bear_tsl_mult': 0.7638058113878787, 'bear_time_stop': 107, 'bear_use_sma': True, 'bear_use_ema': False, 'bear_use_atr': True, 'bear_use_adx': True, 'bear_use_spike': False, 'bear_rsi_required': True, 'sideways_strategy': 'breakout', 'sideways_bb_std_mult': 1.6102273583174422, 'sideways_rsi_os': 18, 'sideways_rsi_ob': 75, 'sideways_adx_thresh': 10.237335578877655, 'sideways_atr_min_pct': 0.015932347219562763, 'sideways_atr_max_pct': 0.07310287613321595, 'sideways_tp_mult': 1.3252148378231023, 'sideways_tsl_mult': 0.6164638622376469, 'sideways_time_stop': 72, 'sideways_use_sma': True, 'sideways_use_ema': False, 'sideways_use_atr': True, 'sideways_use_adx': True, 'sideways_use_spike': False, 'sideways_rsi_required': True}.
[I 2025-08-30 16:36:02,398] Trial 810 finished with values: [-1000000000.0, 1000000000.0] and parameters: {'p_sma': 25, 'p_std': 23, 'p_atr': 19, 'p_adx': 24, 'rsi_period': 67, 'ema1': 22, 'ema2': 35, 'slip_atr_k': 0.004136150751053601, 'slip_spread_k': 0.6687038962089134, 'spread_hl_frac': 0.04331050705612006, 'bb_std_mult': 1.6205545841470932, 'rsi_os': 10, 'rsi_ob': 86, 'vol_spike': 0.21327575992536849, 'adx_thresh': 22.009036406611607, 'atr_min_pct': 0.005991887947200987, 'atr_max_pct': 0.11432629772876368, 'tp_mult': 1.4728990784922391, 'tsl_mult': 0.28929847039079243, 'strategy': 'mean_reversion', 'time_stop': 161, 'use_sma': True, 'use_atr': False, 'use_adx': True, 'use_ema': False, 'use_spike': False, 'rsi_required': False, 'edge_k': 1.1233744786882665, 'edge_cap': 0.9649600637430229, 'bull_strategy': 'breakout', 'bull_bb_std_mult': 1.5772089775084792, 'bull_rsi_os': 24, 'bull_rsi_ob': 88, 'bull_adx_thresh': 30.453993484873195, 'bull_atr_min_pct': 0.022857456079059497, 'bull_atr_max_pct': 0.0630508225027244, 'bull_tp_mult': 2.881054921395233, 'bull_tsl_mult': 0.8624028983936084, 'bull_time_stop': 49, 'bull_use_sma': False, 'bull_use_ema': True, 'bull_use_atr': False, 'bull_use_adx': True, 'bull_use_spike': True, 'bull_rsi_required': True, 'bear_strategy': 'mean_reversion', 'bear_bb_std_mult': 1.9511846378571838, 'bear_rsi_os': 30, 'bear_rsi_ob': 74, 'bear_adx_thresh': 16.516343411522453, 'bear_atr_min_pct': 0.0036170904648118616, 'bear_atr_max_pct': 0.11355120924254893, 'bear_tp_mult': 2.7592499162698214, 'bear_tsl_mult': 0.3007810072318077, 'bear_time_stop': 100, 'bear_use_sma': True, 'bear_use_ema': False, 'bear_use_atr': True, 'bear_use_adx': True, 'bear_use_spike': True, 'bear_rsi_required': True, 'sideways_strategy': 'breakout', 'sideways_bb_std_mult': 3.1480241260563426, 'sideways_rsi_os': 20, 'sideways_rsi_ob': 74, 'sideways_adx_thresh': 21.80688006113173, 'sideways_atr_min_pct': 0.009212527984245381, 'sideways_atr_max_pct': 0.07324227233415735, 'sideways_tp_mult': 2.5858168061578795, 'sideways_tsl_mult': 0.35171124758442074, 'sideways_time_stop': 65, 'sideways_use_sma': True, 'sideways_use_ema': False, 'sideways_use_atr': True, 'sideways_use_adx': True, 'sideways_use_spike': True, 'sideways_rsi_required': True}.
[I 2025-08-30 16:36:02,845] Trial 812 finished with values: [-1000000000.0, 1000000000.0] and parameters: {'p_sma': 7, 'p_std': 56, 'p_atr': 27, 'p_adx': 10, 'rsi_period': 81, 'ema1': 23, 'ema2': 35, 'slip_atr_k': 0.23692736610501408, 'slip_spread_k': 0.6669594458538288, 'spread_hl_frac': 0.005644179653999303, 'bb_std_mult': 0.7928284150186153, 'rsi_os': 28, 'rsi_ob': 88, 'vol_spike': 0.20982886444747503, 'adx_thresh': 21.53537579494062, 'atr_min_pct': 0.0045988137347646825, 'atr_max_pct': 0.13945794356812335, 'tp_mult': 1.5104106446241647, 'tsl_mult': 0.8225423930360372, 'strategy': 'mean_reversion', 'time_stop': 282, 'use_sma': True, 'use_atr': False, 'use_adx': True, 'use_ema': False, 'use_spike': False, 'rsi_required': False, 'edge_k': 0.7186479553435616, 'edge_cap': 0.942899860951602, 'bull_strategy': 'breakout', 'bull_bb_std_mult': 2.2206156318508747, 'bull_rsi_os': 48, 'bull_rsi_ob': 75, 'bull_adx_thresh': 10.25010143568072, 'bull_atr_min_pct': 0.018229972249709236, 'bull_atr_max_pct': 0.1469682537996424, 'bull_tp_mult': 2.4205325184386557, 'bull_tsl_mult': 0.6954411137558144, 'bull_time_stop': 19, 'bull_use_sma': False, 'bull_use_ema': True, 'bull_use_atr': True, 'bull_use_adx': True, 'bull_use_spike': True, 'bull_rsi_required': True, 'bear_strategy': 'mean_reversion', 'bear_bb_std_mult': 1.620856072802173, 'bear_rsi_os': 23, 'bear_rsi_ob': 92, 'bear_adx_thresh': 14.42097046138991, 'bear_atr_min_pct': 0.02079386277548249, 'bear_atr_max_pct': 0.114028657806783, 'bear_tp_mult': 2.658081448650747, 'bear_tsl_mult': 0.8772754203174572, 'bear_time_stop': 106, 'bear_use_sma': True, 'bear_use_ema': False, 'bear_use_atr': True, 'bear_use_adx': True, 'bear_use_spike': True, 'bear_rsi_required': True, 'sideways_strategy': 'breakout', 'sideways_bb_std_mult': 3.337661605845003, 'sideways_rsi_os': 47, 'sideways_rsi_ob': 79, 'sideways_adx_thresh': 10.44898905095099, 'sideways_atr_min_pct': 0.02030518807742623, 'sideways_atr_max_pct': 0.0739250982948068, 'sideways_tp_mult': 1.3406149436115125, 'sideways_tsl_mult': 0.35841684061831514, 'sideways_time_stop': 224, 'sideways_use_sma': True, 'sideways_use_ema': True, 'sideways_use_atr': True, 'sideways_use_adx': True, 'sideways_use_spike': True, 'sideways_rsi_required': True}.
[I 2025-08-30 16:36:51,452] Trial 813 finished with values: [-1000000000.0, 1000000000.0] and parameters: {'p_sma': 7, 'p_std': 56, 'p_atr': 30, 'p_adx': 24, 'rsi_period': 9, 'ema1': 12, 'ema2': 36, 'slip_atr_k': 0.23489866830852896, 'slip_spread_k': 0.18652088760198365, 'spread_hl_frac': 0.043002255565293496, 'bb_std_mult': 2.3984625920037583, 'rsi_os': 12, 'rsi_ob': 62, 'vol_spike': 0.2056892456705634, 'adx_thresh': 21.6125007115413, 'atr_min_pct': 0.004809929585373145, 'atr_max_pct': 0.014044066735335162, 'tp_mult': 1.5108040281235946, 'tsl_mult': 0.3323219834267543, 'strategy': 'mean_reversion', 'time_stop': 149, 'use_sma': True, 'use_atr': False, 'use_adx': True, 'use_ema': False, 'use_spike': False, 'rsi_required': False, 'edge_k': 0.8854151842118451, 'edge_cap': 0.9396533931138142, 'bull_strategy': 'breakout', 'bull_bb_std_mult': 1.607696406094481, 'bull_rsi_os': 28, 'bull_rsi_ob': 88, 'bull_adx_thresh': 10.290529053693346, 'bull_atr_min_pct': 0.012863242675034657, 'bull_atr_max_pct': 0.1471908688890431, 'bull_tp_mult': 2.6494067511766914, 'bull_tsl_mult': 0.7014323459666107, 'bull_time_stop': 103, 'bull_use_sma': False, 'bull_use_ema': True, 'bull_use_atr': True, 'bull_use_adx': True, 'bull_use_spike': True, 'bull_rsi_required': False, 'bear_strategy': 'mean_reversion', 'bear_bb_std_mult': 2.941242114642076, 'bear_rsi_os': 23, 'bear_rsi_ob': 76, 'bear_adx_thresh': 14.86595921108667, 'bear_atr_min_pct': 0.012394886035105085, 'bear_atr_max_pct': 0.02547164020511184, 'bear_tp_mult': 2.6850563680770856, 'bear_tsl_mult': 0.8740138635760717, 'bear_time_stop': 106, 'bear_use_sma': True, 'bear_use_ema': False, 'bear_use_atr': True, 'bear_use_adx': True, 'bear_use_spike': True, 'bear_rsi_required': True, 'sideways_strategy': 'mean_reversion', 'sideways_bb_std_mult': 3.1316530303649173, 'sideways_rsi_os': 12, 'sideways_rsi_ob': 82, 'sideways_adx_thresh': 10.578514746845128, 'sideways_atr_min_pct': 0.0054652124458905126, 'sideways_atr_max_pct': 0.0731657851250016, 'sideways_tp_mult': 1.3237659107250601, 'sideways_tsl_mult': 0.6350234480685495, 'sideways_time_stop': 203, 'sideways_use_sma': True, 'sideways_use_ema': True, 'sideways_use_atr': True, 'sideways_use_adx': True, 'sideways_use_spike': True, 'sideways_rsi_required': True}.
[I 2025-08-30 16:36:52,408] Trial 815 finished with values: [-1000000000.0, 1000000000.0] and parameters: {'p_sma': 7, 'p_std': 20, 'p_atr': 8, 'p_adx': 10, 'rsi_period': 36, 'ema1': 24, 'ema2': 13, 'slip_atr_k': 3.663602230782653e-06, 'slip_spread_k': 0.18907258738669097, 'spread_hl_frac': 0.005578263063296306, 'bb_std_mult': 2.4543217628609146, 'rsi_os': 54, 'rsi_ob': 74, 'vol_spike': 0.23617913772264332, 'adx_thresh': 9.620936862091577, 'atr_min_pct': 0.004586699787230024, 'atr_max_pct': 0.14619265500033124, 'tp_mult': 1.5754556594239757, 'tsl_mult': 0.8979312921249769, 'strategy': 'breakout', 'time_stop': 31, 'use_sma': False, 'use_atr': False, 'use_adx': True, 'use_ema': False, 'use_spike': False, 'rsi_required': False, 'edge_k': 0.7200770952685281, 'edge_cap': 0.7460834404956836, 'bull_strategy': 'breakout', 'bull_bb_std_mult': 1.6376847228496438, 'bull_rsi_os': 25, 'bull_rsi_ob': 91, 'bull_adx_thresh': 10.126233982027248, 'bull_atr_min_pct': 0.01839234074420568, 'bull_atr_max_pct': 0.09556765863569029, 'bull_tp_mult': 2.43272325154999, 'bull_tsl_mult': 0.5375288226767282, 'bull_time_stop': 100, 'bull_use_sma': True, 'bull_use_ema': True, 'bull_use_atr': True, 'bull_use_adx': False, 'bull_use_spike': True, 'bull_rsi_required': False, 'bear_strategy': 'mean_reversion', 'bear_bb_std_mult': 1.6248669198621917, 'bear_rsi_os': 35, 'bear_rsi_ob': 55, 'bear_adx_thresh': 30.148834275212714, 'bear_atr_min_pct': 0.017880497177865825, 'bear_atr_max_pct': 0.026218519015584696, 'bear_tp_mult': 2.666376400469616, 'bear_tsl_mult': 0.8767763166662148, 'bear_time_stop': 78, 'bear_use_sma': True, 'bear_use_ema': False, 'bear_use_atr': True, 'bear_use_adx': True, 'bear_use_spike': True, 'bear_rsi_required': False, 'sideways_strategy': 'mean_reversion', 'sideways_bb_std_mult': 3.337201728160611, 'sideways_rsi_os': 25, 'sideways_rsi_ob': 53, 'sideways_adx_thresh': 32.683689557032494, 'sideways_atr_min_pct': 0.005020791929865952, 'sideways_atr_max_pct': 0.07704825987990799, 'sideways_tp_mult': 1.4077746483326583, 'sideways_tsl_mult': 0.38235399878185844, 'sideways_time_stop': 113, 'sideways_use_sma': True, 'sideways_use_ema': True, 'sideways_use_atr': True, 'sideways_use_adx': True, 'sideways_use_spike': True, 'sideways_rsi_required': True}.
[I 2025-08-30 16:36:52,612] Trial 814 finished with values: [-1000000000.0, 1000000000.0] and parameters: {'p_sma': 25, 'p_std': 58, 'p_atr': 8, 'p_adx': 24, 'rsi_period': 8, 'ema1': 24, 'ema2': 36, 'slip_atr_k': 0.19081254551765603, 'slip_spread_k': 0.3981810109679855, 'spread_hl_frac': 0.005763769072991569, 'bb_std_mult': 2.447856156241445, 'rsi_os': 10, 'rsi_ob': 57, 'vol_spike': 0.2666379580062269, 'adx_thresh': 18.662565342036263, 'atr_min_pct': 0.0073800368858297355, 'atr_max_pct': 0.13750476773301512, 'tp_mult': 1.5666121100985402, 'tsl_mult': 0.3859340113244353, 'strategy': 'mean_reversion', 'time_stop': 59, 'use_sma': False, 'use_atr': False, 'use_adx': True, 'use_ema': False, 'use_spike': False, 'rsi_required': False, 'edge_k': 0.05242170074783048, 'edge_cap': 0.9465681433827495, 'bull_strategy': 'breakout', 'bull_bb_std_mult': 1.5915855668086245, 'bull_rsi_os': 12, 'bull_rsi_ob': 88, 'bull_adx_thresh': 8.437987258563073, 'bull_atr_min_pct': 0.01861706828250672, 'bull_atr_max_pct': 0.09531810750324335, 'bull_tp_mult': 2.4929049774666563, 'bull_tsl_mult': 0.8992076200800622, 'bull_time_stop': 209, 'bull_use_sma': False, 'bull_use_ema': True, 'bull_use_atr': True, 'bull_use_adx': False, 'bull_use_spike': True, 'bull_rsi_required': False, 'bear_strategy': 'mean_reversion', 'bear_bb_std_mult': 1.360491578673822, 'bear_rsi_os': 22, 'bear_rsi_ob': 92, 'bear_adx_thresh': 17.884407966535246, 'bear_atr_min_pct': 0.01281016341316241, 'bear_atr_max_pct': 0.11012813789969073, 'bear_tp_mult': 1.5569255984764456, 'bear_tsl_mult': 0.4829015062280105, 'bear_time_stop': 75, 'bear_use_sma': True, 'bear_use_ema': False, 'bear_use_atr': True, 'bear_use_adx': True, 'bear_use_spike': True, 'bear_rsi_required': True, 'sideways_strategy': 'mean_reversion', 'sideways_bb_std_mult': 3.14322800532104, 'sideways_rsi_os': 5, 'sideways_rsi_ob': 53, 'sideways_adx_thresh': 32.445829024548715, 'sideways_atr_min_pct': 0.027543658383435074, 'sideways_atr_max_pct': 0.07263416060373687, 'sideways_tp_mult': 1.350323731269613, 'sideways_tsl_mult': 0.15425938148523916, 'sideways_time_stop': 114, 'sideways_use_sma': True, 'sideways_use_ema': True, 'sideways_use_atr': True, 'sideways_use_adx': True, 'sideways_use_spike': True, 'sideways_rsi_required': True}.
[I 2025-08-30 16:36:53,180] Trial 816 finished with values: [-1000000000.0, 1000000000.0] and parameters: {'p_sma': 8, 'p_std': 20, 'p_atr': 24, 'p_adx': 24, 'rsi_period': 8, 'ema1': 20, 'ema2': 36, 'slip_atr_k': 0.11247384235111921, 'slip_spread_k': 0.34359113822725895, 'spread_hl_frac': 0.007413733296596888, 'bb_std_mult': 0.501803765578382, 'rsi_os': 28, 'rsi_ob': 53, 'vol_spike': 0.22329067621377488, 'adx_thresh': 18.56405476422097, 'atr_min_pct': 0.007356277170981987, 'atr_max_pct': 0.033685585557318036, 'tp_mult': 2.0797682978472847, 'tsl_mult': 0.3291971674605038, 'strategy': 'breakout', 'time_stop': 62, 'use_sma': False, 'use_atr': False, 'use_adx': True, 'use_ema': False, 'use_spike': False, 'rsi_required': False, 'edge_k': 0.4629721187690584, 'edge_cap': 0.7428793348426787, 'bull_strategy': 'breakout', 'bull_bb_std_mult': 1.654562811903419, 'bull_rsi_os': 14, 'bull_rsi_ob': 88, 'bull_adx_thresh': 8.317629881495032, 'bull_atr_min_pct': 0.012856870891536094, 'bull_atr_max_pct': 0.09528485787856796, 'bull_tp_mult': 2.49408655275455, 'bull_tsl_mult': 0.8348587373102233, 'bull_time_stop': 239, 'bull_use_sma': True, 'bull_use_ema': False, 'bull_use_atr': True, 'bull_use_adx': False, 'bull_use_spike': True, 'bull_rsi_required': False, 'bear_strategy': 'mean_reversion', 'bear_bb_std_mult': 2.926509740197586, 'bear_rsi_os': 26, 'bear_rsi_ob': 75, 'bear_adx_thresh': 10.428448378831114, 'bear_atr_min_pct': 0.013905218887319017, 'bear_atr_max_pct': 0.13189750853399546, 'bear_tp_mult': 2.53714055212369, 'bear_tsl_mult': 0.4803237300691863, 'bear_time_stop': 76, 'bear_use_sma': True, 'bear_use_ema': True, 'bear_use_atr': True, 'bear_use_adx': False, 'bear_use_spike': True, 'bear_rsi_required': False, 'sideways_strategy': 'mean_reversion', 'sideways_bb_std_mult': 1.8536441869982712, 'sideways_rsi_os': 12, 'sideways_rsi_ob': 77, 'sideways_adx_thresh': 32.33209938303653, 'sideways_atr_min_pct': 0.01948342157783469, 'sideways_atr_max_pct': 0.06329097437129119, 'sideways_tp_mult': 1.5699912546656596, 'sideways_tsl_mult': 0.3848118526516293, 'sideways_time_stop': 116, 'sideways_use_sma': True, 'sideways_use_ema': True, 'sideways_use_atr': False, 'sideways_use_adx': True, 'sideways_use_spike': True, 'sideways_rsi_required': True}.
[I 2025-08-30 16:37:37,708] Trial 819 finished with values: [-1000000000.0, 1000000000.0] and parameters: {'p_sma': 10, 'p_std': 28, 'p_atr': 12, 'p_adx': 16, 'rsi_period': 39, 'ema1': 25, 'ema2': 38, 'slip_atr_k': 0.018420755259161915, 'slip_spread_k': 0.714329539738261, 'spread_hl_frac': 0.007805230718071609, 'bb_std_mult': 0.6431577704871594, 'rsi_os': 49, 'rsi_ob': 89, 'vol_spike': 0.00033864027416755094, 'adx_thresh': 15.888607756178176, 'atr_min_pct': 0.016770356271776102, 'atr_max_pct': 0.11840444064018249, 'tp_mult': 2.7209641199135914, 'tsl_mult': 0.1508286842319267, 'strategy': 'breakout', 'time_stop': 74, 'use_sma': False, 'use_atr': False, 'use_adx': True, 'use_ema': True, 'use_spike': False, 'rsi_required': True, 'edge_k': 0.4665901983993892, 'edge_cap': 0.6515318372250348, 'bull_strategy': 'mean_reversion', 'bull_bb_std_mult': 0.890849999159969, 'bull_rsi_os': 46, 'bull_rsi_ob': 87, 'bull_adx_thresh': 16.764735496023253, 'bull_atr_min_pct': 0.020955017134686924, 'bull_atr_max_pct': 0.10989618219638009, 'bull_tp_mult': 2.9929833700347204, 'bull_tsl_mult': 0.830568125714008, 'bull_time_stop': 228, 'bull_use_sma': True, 'bull_use_ema': False, 'bull_use_atr': True, 'bull_use_adx': True, 'bull_use_spike': False, 'bull_rsi_required': False, 'bear_strategy': 'breakout', 'bear_bb_std_mult': 0.9316653316013084, 'bear_rsi_os': 26, 'bear_rsi_ob': 74, 'bear_adx_thresh': 17.04415928551017, 'bear_atr_min_pct': 0.004575957025208226, 'bear_atr_max_pct': 0.11757151832138574, 'bear_tp_mult': 2.581093594463181, 'bear_tsl_mult': 0.8127448201377727, 'bear_time_stop': 176, 'bear_use_sma': False, 'bear_use_ema': True, 'bear_use_atr': True, 'bear_use_adx': False, 'bear_use_spike': False, 'bear_rsi_required': False, 'sideways_strategy': 'mean_reversion', 'sideways_bb_std_mult': 3.215529949947333, 'sideways_rsi_os': 26, 'sideways_rsi_ob': 77, 'sideways_adx_thresh': 34.283691347262646, 'sideways_atr_min_pct': 0.01953584761699062, 'sideways_atr_max_pct': 0.06359287660728531, 'sideways_tp_mult': 1.0550225119617334, 'sideways_tsl_mult': 0.38921620456275724, 'sideways_time_stop': 128, 'sideways_use_sma': True, 'sideways_use_ema': False, 'sideways_use_atr': False, 'sideways_use_adx': True, 'sideways_use_spike': False, 'sideways_rsi_required': True}.
[I 2025-08-30 16:37:38,042] Trial 818 finished with values: [-1000000000.0, 1000000000.0] and parameters: {'p_sma': 10, 'p_std': 58, 'p_atr': 12, 'p_adx': 16, 'rsi_period': 63, 'ema1': 26, 'ema2': 38, 'slip_atr_k': 0.11182171362790559, 'slip_spread_k': 0.7838957925049046, 'spread_hl_frac': 0.00745587499405213, 'bb_std_mult': 0.650047934240197, 'rsi_os': 28, 'rsi_ob': 89, 'vol_spike': 0.2687627457702274, 'adx_thresh': 18.374736088168124, 'atr_min_pct': 0.007337951560456938, 'atr_max_pct': 0.07592906110663414, 'tp_mult': 1.0868909140139724, 'tsl_mult': 0.38802337973742346, 'strategy': 'breakout', 'time_stop': 213, 'use_sma': False, 'use_atr': False, 'use_adx': True, 'use_ema': True, 'use_spike': False, 'rsi_required': False, 'edge_k': 0.07352696416872861, 'edge_cap': 0.9125430046940017, 'bull_strategy': 'mean_reversion', 'bull_bb_std_mult': 1.500371686763585, 'bull_rsi_os': 38, 'bull_rsi_ob': 87, 'bull_adx_thresh': 11.438733872533133, 'bull_atr_min_pct': 0.0193338594456702, 'bull_atr_max_pct': 0.11016758739507479, 'bull_tp_mult': 2.487981166965096, 'bull_tsl_mult': 0.24240645058944693, 'bull_time_stop': 70, 'bull_use_sma': True, 'bull_use_ema': False, 'bull_use_atr': True, 'bull_use_adx': False, 'bull_use_spike': False, 'bull_rsi_required': False, 'bear_strategy': 'breakout', 'bear_bb_std_mult': 0.9269156967912875, 'bear_rsi_os': 42, 'bear_rsi_ob': 74, 'bear_adx_thresh': 23.250892410191778, 'bear_atr_min_pct': 0.00245169221013209, 'bear_atr_max_pct': 0.03171352125937253, 'bear_tp_mult': 2.583848639509393, 'bear_tsl_mult': 0.8136095892464241, 'bear_time_stop': 90, 'bear_use_sma': False, 'bear_use_ema': True, 'bear_use_atr': True, 'bear_use_adx': False, 'bear_use_spike': False, 'bear_rsi_required': True, 'sideways_strategy': 'mean_reversion', 'sideways_bb_std_mult': 2.8957175411176013, 'sideways_rsi_os': 15, 'sideways_rsi_ob': 77, 'sideways_adx_thresh': 9.33885298935088, 'sideways_atr_min_pct': 0.010704653565654785, 'sideways_atr_max_pct': 0.1453954998840868, 'sideways_tp_mult': 2.5035247999106343, 'sideways_tsl_mult': 0.38489029201877634, 'sideways_time_stop': 128, 'sideways_use_sma': True, 'sideways_use_ema': False, 'sideways_use_atr': False, 'sideways_use_adx': True, 'sideways_use_spike': False, 'sideways_rsi_required': True}.
