[I 2025-08-30 14:52:25,434] Trial 261 finished with values: [-1000000000.0, 1000000000.0] and parameters: {'p_sma': 46, 'p_std': 51, 'p_atr': 19, 'p_adx': 27, 'rsi_period': 27, 'ema1': 13, 'ema2': 47, 'slip_atr_k': 0.009592644554340146, 'slip_spread_k': 0.177779966934499, 'spread_hl_frac': 0.007237758401947721, 'bb_std_mult': 3.3593656298883845, 'rsi_os': 6, 'rsi_ob': 83, 'vol_spike': 0.10084808747201411, 'adx_thresh': 17.900525967410005, 'atr_min_pct': 0.0023236333524886323, 'atr_max_pct': 0.08009589546346364, 'tp_mult': 2.3192668597657273, 'tsl_mult': 0.5628100552127145, 'strategy': 'breakout', 'time_stop': 239, 'use_sma': False, 'use_atr': False, 'use_adx': True, 'use_ema': False, 'use_spike': False, 'rsi_required': False, 'edge_k': 0.3066633866569419, 'edge_cap': 0.5439330118408255, 'bull_strategy': 'breakout', 'bull_bb_std_mult': 3.0391326725471903, 'bull_rsi_os': 46, 'bull_rsi_ob': 47, 'bull_adx_thresh': 25.276545738892047, 'bull_atr_min_pct': 0.004544937147868864, 'bull_atr_max_pct': 0.04855566236974375, 'bull_tp_mult': 1.1342584317419986, 'bull_tsl_mult': 0.8889570678186999, 'bull_time_stop': 176, 'bull_use_sma': True, 'bull_use_ema': True, 'bull_use_atr': False, 'bull_use_adx': False, 'bull_use_spike': True, 'bull_rsi_required': True, 'bear_strategy': 'mean_reversion', 'bear_bb_std_mult': 3.5865453734966906, 'bear_rsi_os': 34, 'bear_rsi_ob': 86, 'bear_adx_thresh': 8.03382308361682, 'bear_atr_min_pct': 0.028593839356767937, 'bear_atr_max_pct': 0.015093964196893673, 'bear_tp_mult': 2.999967448140627, 'bear_tsl_mult': 0.5304172290001671, 'bear_time_stop': 282, 'bear_use_sma': True, 'bear_use_ema': False, 'bear_use_atr': True, 'bear_use_adx': False, 'bear_use_spike': True, 'bear_rsi_required': True, 'sideways_strategy': 'mean_reversion', 'sideways_bb_std_mult': 0.8361417470463921, 'sideways_rsi_os': 42, 'sideways_rsi_ob': 62, 'sideways_adx_thresh': 19.90180274964406, 'sideways_atr_min_pct': 0.020724278420315496, 'sideways_atr_max_pct': 0.08180162575863821, 'sideways_tp_mult': 2.9531521450575764, 'sideways_tsl_mult': 0.8427306860432989, 'sideways_time_stop': 125, 'sideways_use_sma': True, 'sideways_use_ema': False, 'sideways_use_atr': False, 'sideways_use_adx': False, 'sideways_use_spike': True, 'sideways_rsi_required': True}.
[I 2025-08-30 14:52:32,787] Trial 262 finished with values: [-1000000000.0, 1000000000.0] and parameters: {'p_sma': 43, 'p_std': 7, 'p_atr': 19, 'p_adx': 27, 'rsi_period': 28, 'ema1': 13, 'ema2': 47, 'slip_atr_k': 0.012453666155329054, 'slip_spread_k': 0.17281342944577582, 'spread_hl_frac': 0.006782704655149991, 'bb_std_mult': 3.3574193326793034, 'rsi_os': 6, 'rsi_ob': 82, 'vol_spike': 0.10152340036762367, 'adx_thresh': 17.813497477002297, 'atr_min_pct': 0.00246854695953127, 'atr_max_pct': 0.08258715318813717, 'tp_mult': 2.3011576500796713, 'tsl_mult': 0.566240476551474, 'strategy': 'breakout', 'time_stop': 241, 'use_sma': False, 'use_atr': False, 'use_adx': True, 'use_ema': False, 'use_spike': False, 'rsi_required': False, 'edge_k': 0.3377348288099896, 'edge_cap': 0.5418032922539499, 'bull_strategy': 'breakout', 'bull_bb_std_mult': 3.047981971082706, 'bull_rsi_os': 46, 'bull_rsi_ob': 46, 'bull_adx_thresh': 25.182507037231094, 'bull_atr_min_pct': 0.0045766628054182195, 'bull_atr_max_pct': 0.06171766210535115, 'bull_tp_mult': 1.1349132900377734, 'bull_tsl_mult': 0.886749558750837, 'bull_time_stop': 136, 'bull_use_sma': True, 'bull_use_ema': True, 'bull_use_atr': False, 'bull_use_adx': False, 'bull_use_spike': True, 'bull_rsi_required': True, 'bear_strategy': 'mean_reversion', 'bear_bb_std_mult': 3.5900865879312107, 'bear_rsi_os': 34, 'bear_rsi_ob': 88, 'bear_adx_thresh': 6.971626128918833, 'bear_atr_min_pct': 0.028546318237912795, 'bear_atr_max_pct': 0.013828979964966272, 'bear_tp_mult': 2.995749331015956, 'bear_tsl_mult': 0.5242115332729408, 'bear_time_stop': 288, 'bear_use_sma': True, 'bear_use_ema': False, 'bear_use_atr': True, 'bear_use_adx': False, 'bear_use_spike': True, 'bear_rsi_required': True, 'sideways_strategy': 'mean_reversion', 'sideways_bb_std_mult': 0.8355490711793744, 'sideways_rsi_os': 43, 'sideways_rsi_ob': 61, 'sideways_adx_thresh': 19.91671206616263, 'sideways_atr_min_pct': 0.02097595318305394, 'sideways_atr_max_pct': 0.08025115360332494, 'sideways_tp_mult': 2.9990321820942696, 'sideways_tsl_mult': 0.8372174520571433, 'sideways_time_stop': 113, 'sideways_use_sma': True, 'sideways_use_ema': False, 'sideways_use_atr': True, 'sideways_use_adx': False, 'sideways_use_spike': True, 'sideways_rsi_required': True}.
[I 2025-08-30 14:52:33,074] Trial 263 finished with values: [-1000000000.0, 1000000000.0] and parameters: {'p_sma': 43, 'p_std': 18, 'p_atr': 19, 'p_adx': 26, 'rsi_period': 27, 'ema1': 13, 'ema2': 46, 'slip_atr_k': 0.012337079955277842, 'slip_spread_k': 0.21249588487787385, 'spread_hl_frac': 0.006105572554357955, 'bb_std_mult': 3.3094488443515275, 'rsi_os': 6, 'rsi_ob': 82, 'vol_spike': 0.10137019437381466, 'adx_thresh': 16.067217649337984, 'atr_min_pct': 0.0026034415238966814, 'atr_max_pct': 0.08631390233006628, 'tp_mult': 2.296285301700891, 'tsl_mult': 0.570015375413724, 'strategy': 'breakout', 'time_stop': 240, 'use_sma': False, 'use_atr': False, 'use_adx': True, 'use_ema': False, 'use_spike': False, 'rsi_required': False, 'edge_k': 0.37883575486665727, 'edge_cap': 0.5443606683505648, 'bull_strategy': 'breakout', 'bull_bb_std_mult': 2.8652985458664086, 'bull_rsi_os': 45, 'bull_rsi_ob': 47, 'bull_adx_thresh': 30.713669930025404, 'bull_atr_min_pct': 0.004543460923113724, 'bull_atr_max_pct': 0.049394767493620644, 'bull_tp_mult': 1.145484393657846, 'bull_tsl_mult': 0.9056957996822146, 'bull_time_stop': 134, 'bull_use_sma': True, 'bull_use_ema': True, 'bull_use_atr': False, 'bull_use_adx': False, 'bull_use_spike': True, 'bull_rsi_required': True, 'bear_strategy': 'mean_reversion', 'bear_bb_std_mult': 3.510691782285568, 'bear_rsi_os': 33, 'bear_rsi_ob': 88, 'bear_adx_thresh': 6.904059339071068, 'bear_atr_min_pct': 0.029973572187730595, 'bear_atr_max_pct': 0.013332208987242787, 'bear_tp_mult': 2.862646312322584, 'bear_tsl_mult': 0.5287800961295344, 'bear_time_stop': 287, 'bear_use_sma': True, 'bear_use_ema': False, 'bear_use_atr': True, 'bear_use_adx': False, 'bear_use_spike': True, 'bear_rsi_required': True, 'sideways_strategy': 'mean_reversion', 'sideways_bb_std_mult': 0.8401875892099782, 'sideways_rsi_os': 41, 'sideways_rsi_ob': 61, 'sideways_adx_thresh': 19.720383896319557, 'sideways_atr_min_pct': 0.020672275058897446, 'sideways_atr_max_pct': 0.08034255168496071, 'sideways_tp_mult': 2.991843544565436, 'sideways_tsl_mult': 0.8877988514564992, 'sideways_time_stop': 112, 'sideways_use_sma': True, 'sideways_use_ema': False, 'sideways_use_atr': True, 'sideways_use_adx': False, 'sideways_use_spike': True, 'sideways_rsi_required': True}.
[I 2025-08-30 14:52:33,814] Trial 264 finished with values: [-1000000000.0, 1000000000.0] and parameters: {'p_sma': 43, 'p_std': 19, 'p_atr': 19, 'p_adx': 26, 'rsi_period': 28, 'ema1': 13, 'ema2': 47, 'slip_atr_k': 0.024695267029303806, 'slip_spread_k': 0.1775864382965685, 'spread_hl_frac': 0.006634786589395148, 'bb_std_mult': 3.347409412141997, 'rsi_os': 8, 'rsi_ob': 84, 'vol_spike': 0.0985770457713186, 'adx_thresh': 16.04812236629829, 'atr_min_pct': 0.0022331653694702283, 'atr_max_pct': 0.0803475846504907, 'tp_mult': 2.301273082973453, 'tsl_mult': 0.5758258317188157, 'strategy': 'breakout', 'time_stop': 240, 'use_sma': False, 'use_atr': False, 'use_adx': True, 'use_ema': False, 'use_spike': False, 'rsi_required': False, 'edge_k': 0.3799307237714981, 'edge_cap': 0.5344951894957952, 'bull_strategy': 'breakout', 'bull_bb_std_mult': 2.879561164796489, 'bull_rsi_os': 45, 'bull_rsi_ob': 47, 'bull_adx_thresh': 30.319948490654916, 'bull_atr_min_pct': 0.004737623269182179, 'bull_atr_max_pct': 0.05019019254757663, 'bull_tp_mult': 1.1494989247274339, 'bull_tsl_mult': 0.9025937210217081, 'bull_time_stop': 171, 'bull_use_sma': True, 'bull_use_ema': True, 'bull_use_atr': False, 'bull_use_adx': False, 'bull_use_spike': True, 'bull_rsi_required': False, 'bear_strategy': 'mean_reversion', 'bear_bb_std_mult': 3.506377990222197, 'bear_rsi_os': 34, 'bear_rsi_ob': 88, 'bear_adx_thresh': 6.985959267323309, 'bear_atr_min_pct': 0.029601748726745782, 'bear_atr_max_pct': 0.01197997877312379, 'bear_tp_mult': 2.8963227171147357, 'bear_tsl_mult': 0.5251298614230812, 'bear_time_stop': 273, 'bear_use_sma': True, 'bear_use_ema': False, 'bear_use_atr': True, 'bear_use_adx': False, 'bear_use_spike': True, 'bear_rsi_required': True, 'sideways_strategy': 'mean_reversion', 'sideways_bb_std_mult': 0.7863984365282418, 'sideways_rsi_os': 41, 'sideways_rsi_ob': 61, 'sideways_adx_thresh': 19.91358567369176, 'sideways_atr_min_pct': 0.021922591505178855, 'sideways_atr_max_pct': 0.07732482322473036, 'sideways_tp_mult': 2.994142644171903, 'sideways_tsl_mult': 0.8946019975722231, 'sideways_time_stop': 113, 'sideways_use_sma': True, 'sideways_use_ema': False, 'sideways_use_atr': True, 'sideways_use_adx': False, 'sideways_use_spike': True, 'sideways_rsi_required': True}.
[I 2025-08-30 14:53:03,643] Trial 265 finished with values: [-0.006336886051504731, 0.006381767058744628] and parameters: {'p_sma': 43, 'p_std': 31, 'p_atr': 19, 'p_adx': 26, 'rsi_period': 26, 'ema1': 11, 'ema2': 47, 'slip_atr_k': 0.024935363033575676, 'slip_spread_k': 0.1681371951580103, 'spread_hl_frac': 0.006087614094078556, 'bb_std_mult': 3.310916397363375, 'rsi_os': 8, 'rsi_ob': 82, 'vol_spike': 0.2818241533172923, 'adx_thresh': 16.18811730204435, 'atr_min_pct': 0.0026545794049885885, 'atr_max_pct': 0.07821718206221015, 'tp_mult': 2.291987670365819, 'tsl_mult': 0.5777699980390885, 'strategy': 'breakout', 'time_stop': 240, 'use_sma': False, 'use_atr': False, 'use_adx': True, 'use_ema': False, 'use_spike': False, 'rsi_required': False, 'edge_k': 0.3903455860722647, 'edge_cap': 0.5351193901094491, 'bull_strategy': 'breakout', 'bull_bb_std_mult': 2.8536443661755357, 'bull_rsi_os': 48, 'bull_rsi_ob': 47, 'bull_adx_thresh': 30.125686373731064, 'bull_atr_min_pct': 0.0016810091455149326, 'bull_atr_max_pct': 0.060079088566125774, 'bull_tp_mult': 1.1552815715415818, 'bull_tsl_mult': 0.9074487541683839, 'bull_time_stop': 122, 'bull_use_sma': True, 'bull_use_ema': True, 'bull_use_atr': False, 'bull_use_adx': False, 'bull_use_spike': True, 'bull_rsi_required': False, 'bear_strategy': 'mean_reversion', 'bear_bb_std_mult': 3.528953617163578, 'bear_rsi_os': 33, 'bear_rsi_ob': 88, 'bear_adx_thresh': 7.0263880212665475, 'bear_atr_min_pct': 0.029950326073760747, 'bear_atr_max_pct': 0.012616956222606043, 'bear_tp_mult': 2.8780048236408473, 'bear_tsl_mult': 0.5278440265303878, 'bear_time_stop': 274, 'bear_use_sma': True, 'bear_use_ema': False, 'bear_use_atr': True, 'bear_use_adx': False, 'bear_use_spike': True, 'bear_rsi_required': True, 'sideways_strategy': 'mean_reversion', 'sideways_bb_std_mult': 0.9278739146040854, 'sideways_rsi_os': 40, 'sideways_rsi_ob': 61, 'sideways_adx_thresh': 20.264845375726637, 'sideways_atr_min_pct': 0.022150091396210485, 'sideways_atr_max_pct': 0.07719873189627244, 'sideways_tp_mult': 2.9974353385850483, 'sideways_tsl_mult': 0.8891990273048376, 'sideways_time_stop': 113, 'sideways_use_sma': True, 'sideways_use_ema': False, 'sideways_use_atr': True, 'sideways_use_adx': False, 'sideways_use_spike': True, 'sideways_rsi_required': True}.
[I 2025-08-30 14:53:06,414] Trial 266 finished with values: [-1000000000.0, 1000000000.0] and parameters: {'p_sma': 44, 'p_std': 16, 'p_atr': 19, 'p_adx': 26, 'rsi_period': 26, 'ema1': 11, 'ema2': 46, 'slip_atr_k': 0.006814329285080887, 'slip_spread_k': 0.2048270395181328, 'spread_hl_frac': 0.005730693246749919, 'bb_std_mult': 3.3082123414240288, 'rsi_os': 8, 'rsi_ob': 84, 'vol_spike': 0.0995773944137996, 'adx_thresh': 16.23906396022906, 'atr_min_pct': 0.0020466721685477272, 'atr_max_pct': 0.07722577924170006, 'tp_mult': 2.2907898099876602, 'tsl_mult': 0.5346453832929223, 'strategy': 'breakout', 'time_stop': 237, 'use_sma': False, 'use_atr': False, 'use_adx': True, 'use_ema': False, 'use_spike': False, 'rsi_required': False, 'edge_k': 0.378273372600515, 'edge_cap': 0.5422738279851512, 'bull_strategy': 'breakout', 'bull_bb_std_mult': 2.852096708234252, 'bull_rsi_os': 14, 'bull_rsi_ob': 47, 'bull_adx_thresh': 30.60403125180738, 'bull_atr_min_pct': 0.002905783595736932, 'bull_atr_max_pct': 0.06766951686234612, 'bull_tp_mult': 1.1925710864342138, 'bull_tsl_mult': 0.8349872485564901, 'bull_time_stop': 133, 'bull_use_sma': True, 'bull_use_ema': True, 'bull_use_atr': False, 'bull_use_adx': False, 'bull_use_spike': True, 'bull_rsi_required': False, 'bear_strategy': 'mean_reversion', 'bear_bb_std_mult': 3.5124079931850307, 'bear_rsi_os': 33, 'bear_rsi_ob': 89, 'bear_adx_thresh': 7.497239686225539, 'bear_atr_min_pct': 0.029759770624059056, 'bear_atr_max_pct': 0.018261562713012235, 'bear_tp_mult': 2.875664962843596, 'bear_tsl_mult': 0.5285737345150836, 'bear_time_stop': 271, 'bear_use_sma': True, 'bear_use_ema': False, 'bear_use_atr': True, 'bear_use_adx': False, 'bear_use_spike': True, 'bear_rsi_required': True, 'sideways_strategy': 'mean_reversion', 'sideways_bb_std_mult': 0.7717341450175271, 'sideways_rsi_os': 40, 'sideways_rsi_ob': 62, 'sideways_adx_thresh': 20.48857802569557, 'sideways_atr_min_pct': 0.019727487328286466, 'sideways_atr_max_pct': 0.07802383024885097, 'sideways_tp_mult': 2.996160173628817, 'sideways_tsl_mult': 0.8814173745230413, 'sideways_time_stop': 112, 'sideways_use_sma': True, 'sideways_use_ema': False, 'sideways_use_atr': True, 'sideways_use_adx': False, 'sideways_use_spike': False, 'sideways_rsi_required': True}.
[I 2025-08-30 14:53:06,889] Trial 267 finished with values: [-1000000000.0, 1000000000.0] and parameters: {'p_sma': 44, 'p_std': 6, 'p_atr': 19, 'p_adx': 28, 'rsi_period': 26, 'ema1': 11, 'ema2': 47, 'slip_atr_k': 0.02434742133191528, 'slip_spread_k': 0.13362892369002305, 'spread_hl_frac': 0.008935778605127311, 'bb_std_mult': 3.4250660563074105, 'rsi_os': 8, 'rsi_ob': 84, 'vol_spike': 0.0976810342785172, 'adx_thresh': 16.243989261529922, 'atr_min_pct': 0.0020977647530739697, 'atr_max_pct': 0.07871998267056265, 'tp_mult': 2.247031414602776, 'tsl_mult': 0.5315042618211341, 'strategy': 'breakout', 'time_stop': 227, 'use_sma': False, 'use_atr': False, 'use_adx': True, 'use_ema': False, 'use_spike': False, 'rsi_required': False, 'edge_k': 0.4796675169540093, 'edge_cap': 0.5336496919462967, 'bull_strategy': 'breakout', 'bull_bb_std_mult': 2.8804385597775135, 'bull_rsi_os': 14, 'bull_rsi_ob': 46, 'bull_adx_thresh': 31.750070803808505, 'bull_atr_min_pct': 0.0029385773626457935, 'bull_atr_max_pct': 0.06745251373844041, 'bull_tp_mult': 1.1546612215064715, 'bull_tsl_mult': 0.8374817150157254, 'bull_time_stop': 171, 'bull_use_sma': True, 'bull_use_ema': True, 'bull_use_atr': False, 'bull_use_adx': False, 'bull_use_spike': True, 'bull_rsi_required': False, 'bear_strategy': 'mean_reversion', 'bear_bb_std_mult': 3.496691090839065, 'bear_rsi_os': 34, 'bear_rsi_ob': 89, 'bear_adx_thresh': 7.728916295571697, 'bear_atr_min_pct': 0.027732814439022112, 'bear_atr_max_pct': 0.018071274266221786, 'bear_tp_mult': 2.9116918105010754, 'bear_tsl_mult': 0.5385434392664805, 'bear_time_stop': 272, 'bear_use_sma': True, 'bear_use_ema': False, 'bear_use_atr': True, 'bear_use_adx': False, 'bear_use_spike': True, 'bear_rsi_required': True, 'sideways_strategy': 'mean_reversion', 'sideways_bb_std_mult': 0.9293936406526488, 'sideways_rsi_os': 39, 'sideways_rsi_ob': 62, 'sideways_adx_thresh': 20.55327215379731, 'sideways_atr_min_pct': 0.022149760630210097, 'sideways_atr_max_pct': 0.07630086407179727, 'sideways_tp_mult': 2.997703072851439, 'sideways_tsl_mult': 0.8567450701564319, 'sideways_time_stop': 133, 'sideways_use_sma': True, 'sideways_use_ema': False, 'sideways_use_atr': False, 'sideways_use_adx': False, 'sideways_use_spike': False, 'sideways_rsi_required': True}.
[I 2025-08-30 14:53:07,073] Trial 268 finished with values: [-1000000000.0, 1000000000.0] and parameters: {'p_sma': 44, 'p_std': 48, 'p_atr': 18, 'p_adx': 28, 'rsi_period': 31, 'ema1': 11, 'ema2': 46, 'slip_atr_k': 0.005505664582244538, 'slip_spread_k': 0.1319890675601621, 'spread_hl_frac': 0.005696330284300468, 'bb_std_mult': 3.414237365168897, 'rsi_os': 8, 'rsi_ob': 86, 'vol_spike': 0.22224689197559105, 'adx_thresh': 16.244871185097086, 'atr_min_pct': 0.0028960662242736883, 'atr_max_pct': 0.07829852103001547, 'tp_mult': 2.366152159061452, 'tsl_mult': 0.5235234253909946, 'strategy': 'breakout', 'time_stop': 228, 'use_sma': False, 'use_atr': False, 'use_adx': True, 'use_ema': False, 'use_spike': False, 'rsi_required': False, 'edge_k': 0.3891923083911519, 'edge_cap': 0.5400799767280794, 'bull_strategy': 'breakout', 'bull_bb_std_mult': 2.8725182018742785, 'bull_rsi_os': 18, 'bull_rsi_ob': 46, 'bull_adx_thresh': 29.492787707698767, 'bull_atr_min_pct': 0.0027728816729567425, 'bull_atr_max_pct': 0.06672262526518731, 'bull_tp_mult': 1.1870504664852233, 'bull_tsl_mult': 0.8681842606217418, 'bull_time_stop': 190, 'bull_use_sma': True, 'bull_use_ema': True, 'bull_use_atr': False, 'bull_use_adx': False, 'bull_use_spike': True, 'bull_rsi_required': False, 'bear_strategy': 'mean_reversion', 'bear_bb_std_mult': 3.5155200146371604, 'bear_rsi_os': 33, 'bear_rsi_ob': 87, 'bear_adx_thresh': 7.687783633016165, 'bear_atr_min_pct': 0.02755342384907122, 'bear_atr_max_pct': 0.01904561437587694, 'bear_tp_mult': 2.9263813160233347, 'bear_tsl_mult': 0.5404322166399462, 'bear_time_stop': 274, 'bear_use_sma': True, 'bear_use_ema': False, 'bear_use_atr': True, 'bear_use_adx': False, 'bear_use_spike': True, 'bear_rsi_required': True, 'sideways_strategy': 'mean_reversion', 'sideways_bb_std_mult': 0.9247704441941321, 'sideways_rsi_os': 39, 'sideways_rsi_ob': 62, 'sideways_adx_thresh': 20.645023292576386, 'sideways_atr_min_pct': 0.019724737690119322, 'sideways_atr_max_pct': 0.07036384206905921, 'sideways_tp_mult': 2.9566205290684753, 'sideways_tsl_mult': 0.8266524739289351, 'sideways_time_stop': 134, 'sideways_use_sma': True, 'sideways_use_ema': False, 'sideways_use_atr': False, 'sideways_use_adx': False, 'sideways_use_spike': False, 'sideways_rsi_required': True}.
[I 2025-08-30 14:53:39,112] Trial 269 finished with values: [-0.00634194662215537, 0.006386104065610235] and parameters: {'p_sma': 42, 'p_std': 32, 'p_atr': 19, 'p_adx': 29, 'rsi_period': 31, 'ema1': 10, 'ema2': 57, 'slip_atr_k': 0.027673989039204826, 'slip_spread_k': 0.23166745845515904, 'spread_hl_frac': 0.0033727080487798472, 'bb_std_mult': 3.180476195724557, 'rsi_os': 8, 'rsi_ob': 91, 'vol_spike': 0.2824475722798263, 'adx_thresh': 15.084789106903582, 'atr_min_pct': 0.0032422738096001638, 'atr_max_pct': 0.08505851874152019, 'tp_mult': 2.3914442798663726, 'tsl_mult': 0.5295278163278458, 'strategy': 'breakout', 'time_stop': 261, 'use_sma': False, 'use_atr': False, 'use_adx': True, 'use_ema': False, 'use_spike': False, 'rsi_required': False, 'edge_k': 0.4827147713273208, 'edge_cap': 0.5335529693956143, 'bull_strategy': 'breakout', 'bull_bb_std_mult': 2.845165843329345, 'bull_rsi_os': 51, 'bull_rsi_ob': 46, 'bull_adx_thresh': 29.58114183703698, 'bull_atr_min_pct': 0.0013650133486288413, 'bull_atr_max_pct': 0.0673861049437023, 'bull_tp_mult': 1.0246727683951762, 'bull_tsl_mult': 0.9171036028675834, 'bull_time_stop': 121, 'bull_use_sma': True, 'bull_use_ema': True, 'bull_use_atr': False, 'bull_use_adx': False, 'bull_use_spike': True, 'bull_rsi_required': False, 'bear_strategy': 'mean_reversion', 'bear_bb_std_mult': 3.353765671271613, 'bear_rsi_os': 31, 'bear_rsi_ob': 89, 'bear_adx_thresh': 5.88599494431285, 'bear_atr_min_pct': 0.029938739522601225, 'bear_atr_max_pct': 0.010049189072766248, 'bear_tp_mult': 2.924714180336701, 'bear_tsl_mult': 0.4870278346847467, 'bear_time_stop': 263, 'bear_use_sma': True, 'bear_use_ema': False, 'bear_use_atr': True, 'bear_use_adx': False, 'bear_use_spike': True, 'bear_rsi_required': True, 'sideways_strategy': 'mean_reversion', 'sideways_bb_std_mult': 0.9514212896229617, 'sideways_rsi_os': 39, 'sideways_rsi_ob': 59, 'sideways_adx_thresh': 19.25612060817061, 'sideways_atr_min_pct': 0.022460473634527394, 'sideways_atr_max_pct': 0.08258717005855819, 'sideways_tp_mult': 2.075743590419054, 'sideways_tsl_mult': 0.9077575182971905, 'sideways_time_stop': 104, 'sideways_use_sma': True, 'sideways_use_ema': False, 'sideways_use_atr': True, 'sideways_use_adx': False, 'sideways_use_spike': True, 'sideways_rsi_required': True}.
