[I 2025-08-30 15:09:03,988] Trial 377 finished with values: [-1000000000.0, 1000000000.0] and parameters: {'p_sma': 39, 'p_std': 36, 'p_atr': 9, 'p_adx': 17, 'rsi_period': 69, 'ema1': 6, 'ema2': 57, 'slip_atr_k': 0.015434747746200466, 'slip_spread_k': 0.27347397945617347, 'spread_hl_frac': 0.00463449785026823, 'bb_std_mult': 2.4262450392330437, 'rsi_os': 35, 'rsi_ob': 46, 'vol_spike': 0.2511640695956189, 'adx_thresh': 10.256574914573081, 'atr_min_pct': 0.009275073845143558, 'atr_max_pct': 0.13052570555972956, 'tp_mult': 2.4940200305280027, 'tsl_mult': 0.45111971932866224, 'strategy': 'breakout', 'time_stop': 258, 'use_sma': False, 'use_atr': False, 'use_adx': True, 'use_ema': False, 'use_spike': False, 'rsi_required': False, 'edge_k': 0.12315871385747945, 'edge_cap': 0.8080386031604165, 'bull_strategy': 'breakout', 'bull_bb_std_mult': 2.4429944109171613, 'bull_rsi_os': 28, 'bull_rsi_ob': 62, 'bull_adx_thresh': 32.946733374195496, 'bull_atr_min_pct': 0.016946055289749275, 'bull_atr_max_pct': 0.1354097833460397, 'bull_tp_mult': 2.880797197549806, 'bull_tsl_mult': 0.9783354751947403, 'bull_time_stop': 68, 'bull_use_sma': True, 'bull_use_ema': True, 'bull_use_atr': True, 'bull_use_adx': False, 'bull_use_spike': True, 'bull_rsi_required': False, 'bear_strategy': 'mean_reversion', 'bear_bb_std_mult': 1.6071866077805081, 'bear_rsi_os': 46, 'bear_rsi_ob': 58, 'bear_adx_thresh': 22.501735729752234, 'bear_atr_min_pct': 0.025746820176534204, 'bear_atr_max_pct': 0.017032888824780074, 'bear_tp_mult': 2.9633380456935576, 'bear_tsl_mult': 0.6106770495749276, 'bear_time_stop': 66, 'bear_use_sma': True, 'bear_use_ema': False, 'bear_use_atr': True, 'bear_use_adx': True, 'bear_use_spike': True, 'bear_rsi_required': True, 'sideways_strategy': 'mean_reversion', 'sideways_bb_std_mult': 1.5540150956674375, 'sideways_rsi_os': 54, 'sideways_rsi_ob': 94, 'sideways_adx_thresh': 29.17858000136338, 'sideways_atr_min_pct': 0.022107347371755758, 'sideways_atr_max_pct': 0.09509620682155265, 'sideways_tp_mult': 1.9605786879513447, 'sideways_tsl_mult': 0.9731461297300628, 'sideways_time_stop': 89, 'sideways_use_sma': True, 'sideways_use_ema': False, 'sideways_use_atr': True, 'sideways_use_adx': True, 'sideways_use_spike': True, 'sideways_rsi_required': True}.
[I 2025-08-30 15:09:04,530] Trial 380 finished with values: [-1000000000.0, 1000000000.0] and parameters: {'p_sma': 38, 'p_std': 36, 'p_atr': 17, 'p_adx': 30, 'rsi_period': 42, 'ema1': 5, 'ema2': 49, 'slip_atr_k': 0.024844970544802746, 'slip_spread_k': 0.9259348338709241, 'spread_hl_frac': 0.004712926014753107, 'bb_std_mult': 0.706963836542646, 'rsi_os': 7, 'rsi_ob': 92, 'vol_spike': 0.25275648965940467, 'adx_thresh': 10.341103516303892, 'atr_min_pct': 0.0040235566094414185, 'atr_max_pct': 0.13009888538764103, 'tp_mult': 1.3035845455347062, 'tsl_mult': 0.4699602407224578, 'strategy': 'breakout', 'time_stop': 84, 'use_sma': False, 'use_atr': False, 'use_adx': True, 'use_ema': False, 'use_spike': False, 'rsi_required': False, 'edge_k': 0.8330773526879515, 'edge_cap': 0.6716108943461309, 'bull_strategy': 'breakout', 'bull_bb_std_mult': 2.4289055745994856, 'bull_rsi_os': 54, 'bull_rsi_ob': 67, 'bull_adx_thresh': 33.418917034895784, 'bull_atr_min_pct': 0.020159793402847445, 'bull_atr_max_pct': 0.08603527942625387, 'bull_tp_mult': 1.0647597948984344, 'bull_tsl_mult': 0.019627227200665787, 'bull_time_stop': 231, 'bull_use_sma': True, 'bull_use_ema': True, 'bull_use_atr': True, 'bull_use_adx': False, 'bull_use_spike': True, 'bull_rsi_required': True, 'bear_strategy': 'mean_reversion', 'bear_bb_std_mult': 2.3253054527930983, 'bear_rsi_os': 26, 'bear_rsi_ob': 54, 'bear_adx_thresh': 19.8357394586885, 'bear_atr_min_pct': 0.02492650823697523, 'bear_atr_max_pct': 0.015599333235559244, 'bear_tp_mult': 1.3120552981412108, 'bear_tsl_mult': 0.606956435318288, 'bear_time_stop': 256, 'bear_use_sma': True, 'bear_use_ema': False, 'bear_use_atr': True, 'bear_use_adx': True, 'bear_use_spike': True, 'bear_rsi_required': True, 'sideways_strategy': 'mean_reversion', 'sideways_bb_std_mult': 1.60699218080647, 'sideways_rsi_os': 37, 'sideways_rsi_ob': 76, 'sideways_adx_thresh': 19.755861497909127, 'sideways_atr_min_pct': 0.02207725213089266, 'sideways_atr_max_pct': 0.09451017488905221, 'sideways_tp_mult': 1.9707048260961821, 'sideways_tsl_mult': 0.9681788754527084, 'sideways_time_stop': 85, 'sideways_use_sma': True, 'sideways_use_ema': False, 'sideways_use_atr': True, 'sideways_use_adx': True, 'sideways_use_spike': True, 'sideways_rsi_required': True}.
[I 2025-08-30 15:09:04,530] Trial 379 finished with values: [-1000000000.0, 1000000000.0] and parameters: {'p_sma': 39, 'p_std': 34, 'p_atr': 17, 'p_adx': 21, 'rsi_period': 42, 'ema1': 9, 'ema2': 48, 'slip_atr_k': 0.015985306154011232, 'slip_spread_k': 0.9947936163060815, 'spread_hl_frac': 0.02718605714586059, 'bb_std_mult': 2.5376149387953566, 'rsi_os': 28, 'rsi_ob': 90, 'vol_spike': 0.2495583203871761, 'adx_thresh': 12.473669676881066, 'atr_min_pct': 0.012487390963233834, 'atr_max_pct': 0.10159949782342143, 'tp_mult': 2.8299182834201297, 'tsl_mult': 0.46340927654142433, 'strategy': 'breakout', 'time_stop': 53, 'use_sma': False, 'use_atr': False, 'use_adx': True, 'use_ema': False, 'use_spike': False, 'rsi_required': False, 'edge_k': 0.35541760481135737, 'edge_cap': 0.6714322393051422, 'bull_strategy': 'breakout', 'bull_bb_std_mult': 2.3217621740224486, 'bull_rsi_os': 28, 'bull_rsi_ob': 62, 'bull_adx_thresh': 33.37050108956415, 'bull_atr_min_pct': 0.0019372499544574226, 'bull_atr_max_pct': 0.13502861477144518, 'bull_tp_mult': 1.0730165842538815, 'bull_tsl_mult': 0.9783486377338297, 'bull_time_stop': 234, 'bull_use_sma': True, 'bull_use_ema': True, 'bull_use_atr': True, 'bull_use_adx': False, 'bull_use_spike': True, 'bull_rsi_required': True, 'bear_strategy': 'mean_reversion', 'bear_bb_std_mult': 3.0650055181061333, 'bear_rsi_os': 26, 'bear_rsi_ob': 82, 'bear_adx_thresh': 7.264118041130676, 'bear_atr_min_pct': 0.02586200370850405, 'bear_atr_max_pct': 0.0791855370423733, 'bear_tp_mult': 2.954886514378912, 'bear_tsl_mult': 0.6820448014189535, 'bear_time_stop': 65, 'bear_use_sma': True, 'bear_use_ema': False, 'bear_use_atr': True, 'bear_use_adx': True, 'bear_use_spike': True, 'bear_rsi_required': True, 'sideways_strategy': 'mean_reversion', 'sideways_bb_std_mult': 1.5822138702779611, 'sideways_rsi_os': 54, 'sideways_rsi_ob': 54, 'sideways_adx_thresh': 13.498858371945916, 'sideways_atr_min_pct': 0.011150053405605076, 'sideways_atr_max_pct': 0.0899739405281075, 'sideways_tp_mult': 1.968285804932142, 'sideways_tsl_mult': 0.9756822366880347, 'sideways_time_stop': 86, 'sideways_use_sma': True, 'sideways_use_ema': False, 'sideways_use_atr': True, 'sideways_use_adx': True, 'sideways_use_spike': True, 'sideways_rsi_required': True}.
[I 2025-08-30 15:09:52,541] Trial 384 finished with values: [-0.005087037167143205, 0.005044364460192037] and parameters: {'p_sma': 18, 'p_std': 33, 'p_atr': 17, 'p_adx': 29, 'rsi_period': 52, 'ema1': 29, 'ema2': 38, 'slip_atr_k': 0.000125735617810558, 'slip_spread_k': 0.8926192471244645, 'spread_hl_frac': 0.002940644842936097, 'bb_std_mult': 3.15331244384739, 'rsi_os': 23, 'rsi_ob': 89, 'vol_spike': 0.2190345387862364, 'adx_thresh': 10.892654859394295, 'atr_min_pct': 0.006071942479587216, 'atr_max_pct': 0.10117695622376485, 'tp_mult': 1.7704029925137907, 'tsl_mult': 0.5102550041219637, 'strategy': 'breakout', 'time_stop': 172, 'use_sma': False, 'use_atr': False, 'use_adx': True, 'use_ema': False, 'use_spike': False, 'rsi_required': False, 'edge_k': 0.5947909122187287, 'edge_cap': 0.750834635215355, 'bull_strategy': 'breakout', 'bull_bb_std_mult': 1.6476375087923196, 'bull_rsi_os': 52, 'bull_rsi_ob': 86, 'bull_adx_thresh': 15.627706733344185, 'bull_atr_min_pct': 0.0011396145872589612, 'bull_atr_max_pct': 0.09049820960237169, 'bull_tp_mult': 2.554764150448562, 'bull_tsl_mult': 0.9491123514393234, 'bull_time_stop': 126, 'bull_use_sma': True, 'bull_use_ema': True, 'bull_use_atr': True, 'bull_use_adx': False, 'bull_use_spike': True, 'bull_rsi_required': False, 'bear_strategy': 'mean_reversion', 'bear_bb_std_mult': 3.1582100511095477, 'bear_rsi_os': 28, 'bear_rsi_ob': 75, 'bear_adx_thresh': 6.114327899183721, 'bear_atr_min_pct': 0.0034903028318876116, 'bear_atr_max_pct': 0.10988966739276508, 'bear_tp_mult': 2.894542184986239, 'bear_tsl_mult': 0.6453593617383893, 'bear_time_stop': 97, 'bear_use_sma': True, 'bear_use_ema': False, 'bear_use_atr': True, 'bear_use_adx': True, 'bear_use_spike': True, 'bear_rsi_required': True, 'sideways_strategy': 'mean_reversion', 'sideways_bb_std_mult': 3.147816249258585, 'sideways_rsi_os': 35, 'sideways_rsi_ob': 54, 'sideways_adx_thresh': 9.839253754676196, 'sideways_atr_min_pct': 0.022930484839957806, 'sideways_atr_max_pct': 0.09162304106117847, 'sideways_tp_mult': 2.336083793782994, 'sideways_tsl_mult': 0.3462020463521419, 'sideways_time_stop': 95, 'sideways_use_sma': True, 'sideways_use_ema': False, 'sideways_use_atr': True, 'sideways_use_adx': True, 'sideways_use_spike': True, 'sideways_rsi_required': True}.
[I 2025-08-30 15:09:53,432] Trial 383 finished with values: [-0.017648133315668946, 0.017612461298901042] and parameters: {'p_sma': 40, 'p_std': 33, 'p_atr': 26, 'p_adx': 29, 'rsi_period': 67, 'ema1': 21, 'ema2': 27, 'slip_atr_k': 0.14001722178400955, 'slip_spread_k': 0.2975208322629251, 'spread_hl_frac': 0.002830032735288903, 'bb_std_mult': 1.8768747192036916, 'rsi_os': 37, 'rsi_ob': 89, 'vol_spike': 0.23863944528495973, 'adx_thresh': 11.011606224870784, 'atr_min_pct': 0.004980038301159119, 'atr_max_pct': 0.10032450665346192, 'tp_mult': 1.7170777478817727, 'tsl_mult': 0.25109137210819393, 'strategy': 'breakout', 'time_stop': 272, 'use_sma': False, 'use_atr': False, 'use_adx': True, 'use_ema': False, 'use_spike': False, 'rsi_required': False, 'edge_k': 0.2736636659480849, 'edge_cap': 0.06397048558742646, 'bull_strategy': 'breakout', 'bull_bb_std_mult': 2.62843807081503, 'bull_rsi_os': 32, 'bull_rsi_ob': 70, 'bull_adx_thresh': 15.14320679535615, 'bull_atr_min_pct': 0.001170458408182249, 'bull_atr_max_pct': 0.09042775354113304, 'bull_tp_mult': 1.611529648219744, 'bull_tsl_mult': 0.4201433942216567, 'bull_time_stop': 126, 'bull_use_sma': True, 'bull_use_ema': True, 'bull_use_atr': True, 'bull_use_adx': False, 'bull_use_spike': True, 'bull_rsi_required': False, 'bear_strategy': 'mean_reversion', 'bear_bb_std_mult': 3.159259409689288, 'bear_rsi_os': 22, 'bear_rsi_ob': 83, 'bear_adx_thresh': 6.114977703650058, 'bear_atr_min_pct': 0.024088918723251803, 'bear_atr_max_pct': 0.014146359619330648, 'bear_tp_mult': 2.9169721605137946, 'bear_tsl_mult': 0.6334641118315086, 'bear_time_stop': 264, 'bear_use_sma': True, 'bear_use_ema': False, 'bear_use_atr': True, 'bear_use_adx': True, 'bear_use_spike': True, 'bear_rsi_required': True, 'sideways_strategy': 'mean_reversion', 'sideways_bb_std_mult': 0.6296267986336641, 'sideways_rsi_os': 11, 'sideways_rsi_ob': 54, 'sideways_adx_thresh': 32.3927765143261, 'sideways_atr_min_pct': 0.0021081224133558275, 'sideways_atr_max_pct': 0.125983817625466, 'sideways_tp_mult': 2.3306512945141953, 'sideways_tsl_mult': 0.6702144004467518, 'sideways_time_stop': 222, 'sideways_use_sma': True, 'sideways_use_ema': False, 'sideways_use_atr': True, 'sideways_use_adx': True, 'sideways_use_spike': True, 'sideways_rsi_required': True}.
[I 2025-08-30 15:09:54,058] Trial 382 finished with values: [-1000000000.0, 1000000000.0] and parameters: {'p_sma': 40, 'p_std': 34, 'p_atr': 17, 'p_adx': 14, 'rsi_period': 75, 'ema1': 7, 'ema2': 49, 'slip_atr_k': 0.025434746951375348, 'slip_spread_k': 0.2987342338350463, 'spread_hl_frac': 0.00282361761838749, 'bb_std_mult': 1.8790643595987424, 'rsi_os': 7, 'rsi_ob': 90, 'vol_spike': 0.21990580067232596, 'adx_thresh': 10.70676621488386, 'atr_min_pct': 0.004014193688691127, 'atr_max_pct': 0.10135704783950283, 'tp_mult': 1.7499516811213376, 'tsl_mult': 0.5096300839433218, 'strategy': 'breakout', 'time_stop': 277, 'use_sma': False, 'use_atr': False, 'use_adx': True, 'use_ema': False, 'use_spike': False, 'rsi_required': False, 'edge_k': 0.3448711851983061, 'edge_cap': 0.14605189049596923, 'bull_strategy': 'breakout', 'bull_bb_std_mult': 2.6204323165995724, 'bull_rsi_os': 54, 'bull_rsi_ob': 86, 'bull_adx_thresh': 6.297945633772137, 'bull_atr_min_pct': 0.012980433516919616, 'bull_atr_max_pct': 0.08537904397169015, 'bull_tp_mult': 1.6092173687023241, 'bull_tsl_mult': 0.9400182190515632, 'bull_time_stop': 125, 'bull_use_sma': True, 'bull_use_ema': True, 'bull_use_atr': True, 'bull_use_adx': False, 'bull_use_spike': True, 'bull_rsi_required': True, 'bear_strategy': 'mean_reversion', 'bear_bb_std_mult': 3.163804304063808, 'bear_rsi_os': 22, 'bear_rsi_ob': 54, 'bear_adx_thresh': 14.19962494807633, 'bear_atr_min_pct': 0.015642470610618305, 'bear_atr_max_pct': 0.1092470318457428, 'bear_tp_mult': 1.3019884126932515, 'bear_tsl_mult': 0.052997177109198046, 'bear_time_stop': 81, 'bear_use_sma': True, 'bear_use_ema': False, 'bear_use_atr': True, 'bear_use_adx': True, 'bear_use_spike': True, 'bear_rsi_required': True, 'sideways_strategy': 'mean_reversion', 'sideways_bb_std_mult': 3.2337899118147675, 'sideways_rsi_os': 37, 'sideways_rsi_ob': 54, 'sideways_adx_thresh': 16.659326513020137, 'sideways_atr_min_pct': 0.023124084477255315, 'sideways_atr_max_pct': 0.14103112015161137, 'sideways_tp_mult': 1.4025963956095442, 'sideways_tsl_mult': 0.6601884476558559, 'sideways_time_stop': 96, 'sideways_use_sma': True, 'sideways_use_ema': False, 'sideways_use_atr': True, 'sideways_use_adx': True, 'sideways_use_spike': True, 'sideways_rsi_required': True}.
[I 2025-08-30 15:09:54,091] Trial 381 finished with values: [-1000000000.0, 1000000000.0] and parameters: {'p_sma': 39, 'p_std': 34, 'p_atr': 26, 'p_adx': 30, 'rsi_period': 53, 'ema1': 9, 'ema2': 27, 'slip_atr_k': 0.1532901455920236, 'slip_spread_k': 0.30645774949016347, 'spread_hl_frac': 0.027394045844272588, 'bb_std_mult': 2.533747240102816, 'rsi_os': 37, 'rsi_ob': 90, 'vol_spike': 0.2502909793326411, 'adx_thresh': 11.094777929972915, 'atr_min_pct': 0.003814186427204357, 'atr_max_pct': 0.1007341358518581, 'tp_mult': 2.493842592278058, 'tsl_mult': 0.5138170996580945, 'strategy': 'breakout', 'time_stop': 270, 'use_sma': False, 'use_atr': False, 'use_adx': True, 'use_ema': False, 'use_spike': False, 'rsi_required': False, 'edge_k': 0.3519060737686397, 'edge_cap': 0.09681419524072848, 'bull_strategy': 'breakout', 'bull_bb_std_mult': 3.2564642546538507, 'bull_rsi_os': 54, 'bull_rsi_ob': 70, 'bull_adx_thresh': 34.04840469943068, 'bull_atr_min_pct': 0.011240023261485963, 'bull_atr_max_pct': 0.0900449893896312, 'bull_tp_mult': 1.1347058879665277, 'bull_tsl_mult': 0.42089256922177687, 'bull_time_stop': 26, 'bull_use_sma': True, 'bull_use_ema': True, 'bull_use_atr': True, 'bull_use_adx': False, 'bull_use_spike': True, 'bull_rsi_required': True, 'bear_strategy': 'mean_reversion', 'bear_bb_std_mult': 2.4931846928948054, 'bear_rsi_os': 28, 'bear_rsi_ob': 83, 'bear_adx_thresh': 5.06047800752519, 'bear_atr_min_pct': 0.026022095093913927, 'bear_atr_max_pct': 0.014289543035229248, 'bear_tp_mult': 2.953996127235072, 'bear_tsl_mult': 0.9613854878234127, 'bear_time_stop': 67, 'bear_use_sma': True, 'bear_use_ema': False, 'bear_use_atr': True, 'bear_use_adx': True, 'bear_use_spike': True, 'bear_rsi_required': True, 'sideways_strategy': 'mean_reversion', 'sideways_bb_std_mult': 3.2425143870954356, 'sideways_rsi_os': 37, 'sideways_rsi_ob': 46, 'sideways_adx_thresh': 19.481520678706588, 'sideways_atr_min_pct': 0.02227562005689747, 'sideways_atr_max_pct': 0.09409622026500614, 'sideways_tp_mult': 1.2204470214771495, 'sideways_tsl_mult': 0.9635922401743158, 'sideways_time_stop': 94, 'sideways_use_sma': True, 'sideways_use_ema': False, 'sideways_use_atr': True, 'sideways_use_adx': True, 'sideways_use_spike': True, 'sideways_rsi_required': True}.
[I 2025-08-30 15:10:44,428] Trial 387 finished with values: [-1000000000.0, 1000000000.0] and parameters: {'p_sma': 15, 'p_std': 29, 'p_atr': 17, 'p_adx': 28, 'rsi_period': 79, 'ema1': 28, 'ema2': 38, 'slip_atr_k': 0.0001779647894461457, 'slip_spread_k': 0.7777099649198739, 'spread_hl_frac': 0.00433970512475867, 'bb_std_mult': 3.1747829291523595, 'rsi_os': 25, 'rsi_ob': 87, 'vol_spike': 0.2099616697074347, 'adx_thresh': 9.91856925091113, 'atr_min_pct': 0.008419531194034546, 'atr_max_pct': 0.11012830767350693, 'tp_mult': 1.777443899993282, 'tsl_mult': 0.5219135775961238, 'strategy': 'breakout', 'time_stop': 191, 'use_sma': False, 'use_atr': False, 'use_adx': True, 'use_ema': False, 'use_spike': False, 'rsi_required': False, 'edge_k': 0.6180768517133034, 'edge_cap': 0.7143441862885926, 'bull_strategy': 'breakout', 'bull_bb_std_mult': 1.6600329853972389, 'bull_rsi_os': 51, 'bull_rsi_ob': 91, 'bull_adx_thresh': 14.58582813394778, 'bull_atr_min_pct': 0.0019551233432972045, 'bull_atr_max_pct': 0.09883898559141026, 'bull_tp_mult': 2.5607256513623606, 'bull_tsl_mult': 0.9301374635976354, 'bull_time_stop': 112, 'bull_use_sma': True, 'bull_use_ema': True, 'bull_use_atr': True, 'bull_use_adx': False, 'bull_use_spike': True, 'bull_rsi_required': False, 'bear_strategy': 'mean_reversion', 'bear_bb_std_mult': 2.8344607635480066, 'bear_rsi_os': 28, 'bear_rsi_ob': 75, 'bear_adx_thresh': 6.220351163950119, 'bear_atr_min_pct': 0.0028690546182449555, 'bear_atr_max_pct': 0.10275465795396713, 'bear_tp_mult': 2.8697363594695955, 'bear_tsl_mult': 0.6494076213199977, 'bear_time_stop': 98, 'bear_use_sma': True, 'bear_use_ema': False, 'bear_use_atr': True, 'bear_use_adx': True, 'bear_use_spike': True, 'bear_rsi_required': True, 'sideways_strategy': 'mean_reversion', 'sideways_bb_std_mult': 3.389608382639098, 'sideways_rsi_os': 32, 'sideways_rsi_ob': 53, 'sideways_adx_thresh': 11.483957180212185, 'sideways_atr_min_pct': 0.021513259808002776, 'sideways_atr_max_pct': 0.08891857515679318, 'sideways_tp_mult': 2.2309243717594875, 'sideways_tsl_mult': 0.2780219323916836, 'sideways_time_stop': 99, 'sideways_use_sma': True, 'sideways_use_ema': False, 'sideways_use_atr': True, 'sideways_use_adx': True, 'sideways_use_spike': True, 'sideways_rsi_required': True}.
[I 2025-08-30 15:10:45,830] Trial 388 finished with values: [-1000000000.0, 1000000000.0] and parameters: {'p_sma': 18, 'p_std': 30, 'p_atr': 17, 'p_adx': 28, 'rsi_period': 79, 'ema1': 29, 'ema2': 38, 'slip_atr_k': 0.000447417222703958, 'slip_spread_k': 0.8845413194360063, 'spread_hl_frac': 0.004381190943400264, 'bb_std_mult': 3.1878998631472077, 'rsi_os': 22, 'rsi_ob': 87, 'vol_spike': 0.21093982302217135, 'adx_thresh': 9.2153276892879, 'atr_min_pct': 0.007798647612398191, 'atr_max_pct': 0.10935588273033997, 'tp_mult': 1.7760387448586412, 'tsl_mult': 0.5413073879760996, 'strategy': 'breakout', 'time_stop': 171, 'use_sma': False, 'use_atr': False, 'use_adx': True, 'use_ema': False, 'use_spike': False, 'rsi_required': False, 'edge_k': 0.5927316998191102, 'edge_cap': 0.7075846575932898, 'bull_strategy': 'breakout', 'bull_bb_std_mult': 1.6403402171023174, 'bull_rsi_os': 51, 'bull_rsi_ob': 95, 'bull_adx_thresh': 12.362962253152574, 'bull_atr_min_pct': 0.002208944099467901, 'bull_atr_max_pct': 0.09211969498508589, 'bull_tp_mult': 2.559921163363456, 'bull_tsl_mult': 0.9296949870863412, 'bull_time_stop': 120, 'bull_use_sma': True, 'bull_use_ema': True, 'bull_use_atr': True, 'bull_use_adx': False, 'bull_use_spike': True, 'bull_rsi_required': False, 'bear_strategy': 'mean_reversion', 'bear_bb_std_mult': 1.881515341307649, 'bear_rsi_os': 28, 'bear_rsi_ob': 75, 'bear_adx_thresh': 6.280412097493974, 'bear_atr_min_pct': 0.004196975470113584, 'bear_atr_max_pct': 0.12090251210286432, 'bear_tp_mult': 2.87048357667383, 'bear_tsl_mult': 0.6387941832607157, 'bear_time_stop': 108, 'bear_use_sma': True, 'bear_use_ema': False, 'bear_use_atr': True, 'bear_use_adx': True, 'bear_use_spike': True, 'bear_rsi_required': True, 'sideways_strategy': 'mean_reversion', 'sideways_bb_std_mult': 3.3960282010828813, 'sideways_rsi_os': 33, 'sideways_rsi_ob': 51, 'sideways_adx_thresh': 12.234550567195981, 'sideways_atr_min_pct': 0.02245961707631216, 'sideways_atr_max_pct': 0.08876373106846246, 'sideways_tp_mult': 2.2088491771552192, 'sideways_tsl_mult': 0.33682271794495433, 'sideways_time_stop': 99, 'sideways_use_sma': True, 'sideways_use_ema': False, 'sideways_use_atr': True, 'sideways_use_adx': True, 'sideways_use_spike': True, 'sideways_rsi_required': True}.
