[I 2025-08-30 16:28:59,145] Trial 773 finished with values: [-1000000000.0, 1000000000.0] and parameters: {'p_sma': 35, 'p_std': 20, 'p_atr': 12, 'p_adx': 25, 'rsi_period': 8, 'ema1': 26, 'ema2': 56, 'slip_atr_k': 0.1782012302234423, 'slip_spread_k': 0.737610845128737, 'spread_hl_frac': 0.03378569422158939, 'bb_std_mult': 1.8791480194952472, 'rsi_os': 26, 'rsi_ob': 88, 'vol_spike': 0.07313587452869082, 'adx_thresh': 7.898805023591528, 'atr_min_pct': 0.007400559411319352, 'atr_max_pct': 0.10538464141755483, 'tp_mult': 1.4798800866706388, 'tsl_mult': 0.34403429294026955, 'strategy': 'breakout', 'time_stop': 151, 'use_sma': False, 'use_atr': False, 'use_adx': True, 'use_ema': False, 'use_spike': False, 'rsi_required': False, 'edge_k': 1.7545097745488551, 'edge_cap': 0.954992604328549, 'bull_strategy': 'breakout', 'bull_bb_std_mult': 1.7111766957263, 'bull_rsi_os': 11, 'bull_rsi_ob': 86, 'bull_adx_thresh': 27.35347271827955, 'bull_atr_min_pct': 0.006942013616095921, 'bull_atr_max_pct': 0.0534430450296149, 'bull_tp_mult': 2.016480250054932, 'bull_tsl_mult': 0.9081974502357134, 'bull_time_stop': 46, 'bull_use_sma': True, 'bull_use_ema': True, 'bull_use_atr': True, 'bull_use_adx': True, 'bull_use_spike': True, 'bull_rsi_required': False, 'bear_strategy': 'mean_reversion', 'bear_bb_std_mult': 1.612386062837703, 'bear_rsi_os': 33, 'bear_rsi_ob': 63, 'bear_adx_thresh': 15.994167156371573, 'bear_atr_min_pct': 0.004712244668597737, 'bear_atr_max_pct': 0.06740282761103791, 'bear_tp_mult': 2.7928736998322012, 'bear_tsl_mult': 0.7992065772975878, 'bear_time_stop': 97, 'bear_use_sma': False, 'bear_use_ema': False, 'bear_use_atr': True, 'bear_use_adx': True, 'bear_use_spike': True, 'bear_rsi_required': True, 'sideways_strategy': 'mean_reversion', 'sideways_bb_std_mult': 1.9870295864934253, 'sideways_rsi_os': 24, 'sideways_rsi_ob': 77, 'sideways_adx_thresh': 10.444869096278126, 'sideways_atr_min_pct': 0.02072214390315151, 'sideways_atr_max_pct': 0.0678823167709115, 'sideways_tp_mult': 1.7260749848847048, 'sideways_tsl_mult': 0.3946978281865441, 'sideways_time_stop': 165, 'sideways_use_sma': True, 'sideways_use_ema': False, 'sideways_use_atr': True, 'sideways_use_adx': True, 'sideways_use_spike': False, 'sideways_rsi_required': True}.
[I 2025-08-30 16:28:59,494] Trial 775 finished with values: [-1000000000.0, 1000000000.0] and parameters: {'p_sma': 8, 'p_std': 20, 'p_atr': 13, 'p_adx': 22, 'rsi_period': 31, 'ema1': 21, 'ema2': 44, 'slip_atr_k': 0.17970034034295973, 'slip_spread_k': 0.7317006903171233, 'spread_hl_frac': 0.005096134255496059, 'bb_std_mult': 0.5953944362367679, 'rsi_os': 27, 'rsi_ob': 88, 'vol_spike': 0.22257365100912477, 'adx_thresh': 8.95477495872293, 'atr_min_pct': 0.004370422732084521, 'atr_max_pct': 0.13294760796445873, 'tp_mult': 1.5039788260856402, 'tsl_mult': 0.33802106713628943, 'strategy': 'mean_reversion', 'time_stop': 149, 'use_sma': False, 'use_atr': True, 'use_adx': True, 'use_ema': False, 'use_spike': False, 'rsi_required': False, 'edge_k': 0.5393708388659744, 'edge_cap': 0.4398841817223903, 'bull_strategy': 'breakout', 'bull_bb_std_mult': 1.7116555894602388, 'bull_rsi_os': 48, 'bull_rsi_ob': 46, 'bull_adx_thresh': 9.014287431785545, 'bull_atr_min_pct': 0.020527369340585088, 'bull_atr_max_pct': 0.14115925851490854, 'bull_tp_mult': 1.7080847987030816, 'bull_tsl_mult': 0.8950500019004483, 'bull_time_stop': 45, 'bull_use_sma': False, 'bull_use_ema': False, 'bull_use_atr': True, 'bull_use_adx': True, 'bull_use_spike': True, 'bull_rsi_required': False, 'bear_strategy': 'mean_reversion', 'bear_bb_std_mult': 1.4735133149124333, 'bear_rsi_os': 36, 'bear_rsi_ob': 68, 'bear_adx_thresh': 31.61149240755114, 'bear_atr_min_pct': 0.0021173050002074646, 'bear_atr_max_pct': 0.0350925710430857, 'bear_tp_mult': 2.7247692380772035, 'bear_tsl_mult': 0.8594924014199744, 'bear_time_stop': 99, 'bear_use_sma': False, 'bear_use_ema': True, 'bear_use_atr': False, 'bear_use_adx': False, 'bear_use_spike': True, 'bear_rsi_required': True, 'sideways_strategy': 'mean_reversion', 'sideways_bb_std_mult': 2.553531957932754, 'sideways_rsi_os': 10, 'sideways_rsi_ob': 76, 'sideways_adx_thresh': 26.45138499410514, 'sideways_atr_min_pct': 0.01951541374832907, 'sideways_atr_max_pct': 0.06184343423393098, 'sideways_tp_mult': 2.7422167897600116, 'sideways_tsl_mult': 0.3946140894487242, 'sideways_time_stop': 234, 'sideways_use_sma': True, 'sideways_use_ema': False, 'sideways_use_atr': False, 'sideways_use_adx': False, 'sideways_use_spike': False, 'sideways_rsi_required': False}.
[I 2025-08-30 16:29:45,050] Trial 777 finished with values: [-1000000000.0, 1000000000.0] and parameters: {'p_sma': 9, 'p_std': 21, 'p_atr': 8, 'p_adx': 23, 'rsi_period': 8, 'ema1': 21, 'ema2': 36, 'slip_atr_k': 0.155440158788565, 'slip_spread_k': 0.37465230654513626, 'spread_hl_frac': 0.044152974713144014, 'bb_std_mult': 0.5902825049923973, 'rsi_os': 14, 'rsi_ob': 55, 'vol_spike': 0.2238867241255941, 'adx_thresh': 8.956174569595444, 'atr_min_pct': 0.00759496620277994, 'atr_max_pct': 0.13327997204256753, 'tp_mult': 1.4979780675654377, 'tsl_mult': 0.3758746747725178, 'strategy': 'mean_reversion', 'time_stop': 155, 'use_sma': False, 'use_atr': False, 'use_adx': True, 'use_ema': False, 'use_spike': False, 'rsi_required': False, 'edge_k': 1.0540384171826067, 'edge_cap': 0.27034890562294706, 'bull_strategy': 'breakout', 'bull_bb_std_mult': 1.6014017734545944, 'bull_rsi_os': 28, 'bull_rsi_ob': 78, 'bull_adx_thresh': 28.14151860788461, 'bull_atr_min_pct': 0.029359984651983247, 'bull_atr_max_pct': 0.10638329286746906, 'bull_tp_mult': 2.0036899303527327, 'bull_tsl_mult': 0.18099489578938593, 'bull_time_stop': 97, 'bull_use_sma': False, 'bull_use_ema': True, 'bull_use_atr': True, 'bull_use_adx': True, 'bull_use_spike': True, 'bull_rsi_required': True, 'bear_strategy': 'mean_reversion', 'bear_bb_std_mult': 0.6480076765653939, 'bear_rsi_os': 25, 'bear_rsi_ob': 50, 'bear_adx_thresh': 16.10008565217059, 'bear_atr_min_pct': 0.003955134251673965, 'bear_atr_max_pct': 0.09363755305212688, 'bear_tp_mult': 2.4410116399689077, 'bear_tsl_mult': 0.8651077506487664, 'bear_time_stop': 279, 'bear_use_sma': True, 'bear_use_ema': False, 'bear_use_atr': False, 'bear_use_adx': True, 'bear_use_spike': False, 'bear_rsi_required': False, 'sideways_strategy': 'breakout', 'sideways_bb_std_mult': 3.209114097849316, 'sideways_rsi_os': 24, 'sideways_rsi_ob': 77, 'sideways_adx_thresh': 10.320346752434473, 'sideways_atr_min_pct': 0.01295354755626838, 'sideways_atr_max_pct': 0.07387299986878892, 'sideways_tp_mult': 1.477379610850072, 'sideways_tsl_mult': 0.38698307017811256, 'sideways_time_stop': 236, 'sideways_use_sma': False, 'sideways_use_ema': True, 'sideways_use_atr': True, 'sideways_use_adx': False, 'sideways_use_spike': True, 'sideways_rsi_required': False}.
[I 2025-08-30 16:29:45,664] Trial 776 finished with values: [-1000000000.0, 1000000000.0] and parameters: {'p_sma': 9, 'p_std': 22, 'p_atr': 13, 'p_adx': 23, 'rsi_period': 8, 'ema1': 23, 'ema2': 36, 'slip_atr_k': 2.8081345152808357e-06, 'slip_spread_k': 0.5906174303849512, 'spread_hl_frac': 0.005089864218262756, 'bb_std_mult': 0.6193004575887779, 'rsi_os': 14, 'rsi_ob': 65, 'vol_spike': 0.2567359581800791, 'adx_thresh': 9.067436480047284, 'atr_min_pct': 0.00632963918065442, 'atr_max_pct': 0.023472297073841596, 'tp_mult': 1.4901084787567123, 'tsl_mult': 0.14032840554253911, 'strategy': 'mean_reversion', 'time_stop': 155, 'use_sma': False, 'use_atr': False, 'use_adx': True, 'use_ema': False, 'use_spike': False, 'rsi_required': False, 'edge_k': 0.5348159132006576, 'edge_cap': 0.2643697467028484, 'bull_strategy': 'breakout', 'bull_bb_std_mult': 3.22310932524869, 'bull_rsi_os': 39, 'bull_rsi_ob': 78, 'bull_adx_thresh': 9.952384755422031, 'bull_atr_min_pct': 0.020670941036526887, 'bull_atr_max_pct': 0.030327052015102697, 'bull_tp_mult': 2.5242375935491372, 'bull_tsl_mult': 0.9086358875732946, 'bull_time_stop': 54, 'bull_use_sma': False, 'bull_use_ema': True, 'bull_use_atr': True, 'bull_use_adx': True, 'bull_use_spike': True, 'bull_rsi_required': True, 'bear_strategy': 'mean_reversion', 'bear_bb_std_mult': 1.48693506736225, 'bear_rsi_os': 41, 'bear_rsi_ob': 63, 'bear_adx_thresh': 11.818710455924968, 'bear_atr_min_pct': 0.004095330545865869, 'bear_atr_max_pct': 0.06829692748035238, 'bear_tp_mult': 1.6758782273250472, 'bear_tsl_mult': 0.33587947860586076, 'bear_time_stop': 238, 'bear_use_sma': True, 'bear_use_ema': False, 'bear_use_atr': False, 'bear_use_adx': True, 'bear_use_spike': False, 'bear_rsi_required': False, 'sideways_strategy': 'breakout', 'sideways_bb_std_mult': 2.0133637975591614, 'sideways_rsi_os': 24, 'sideways_rsi_ob': 77, 'sideways_adx_thresh': 17.187721296010356, 'sideways_atr_min_pct': 0.013505362756218426, 'sideways_atr_max_pct': 0.1020567516686326, 'sideways_tp_mult': 1.6652088380170866, 'sideways_tsl_mult': 0.38539291572648243, 'sideways_time_stop': 233, 'sideways_use_sma': False, 'sideways_use_ema': True, 'sideways_use_atr': True, 'sideways_use_adx': False, 'sideways_use_spike': True, 'sideways_rsi_required': False}.
[I 2025-08-30 16:29:45,873] Trial 778 finished with values: [-1000000000.0, 1000000000.0] and parameters: {'p_sma': 9, 'p_std': 22, 'p_atr': 24, 'p_adx': 18, 'rsi_period': 62, 'ema1': 21, 'ema2': 36, 'slip_atr_k': 9.455920734113236e-05, 'slip_spread_k': 0.623919595159238, 'spread_hl_frac': 0.005146391829386692, 'bb_std_mult': 0.6008201185984664, 'rsi_os': 25, 'rsi_ob': 55, 'vol_spike': 0.2242499234884064, 'adx_thresh': 28.83147215412773, 'atr_min_pct': 0.006443076490298554, 'atr_max_pct': 0.020689287000013594, 'tp_mult': 1.5735572364910884, 'tsl_mult': 0.4348750201117062, 'strategy': 'mean_reversion', 'time_stop': 135, 'use_sma': False, 'use_atr': True, 'use_adx': True, 'use_ema': False, 'use_spike': False, 'rsi_required': False, 'edge_k': 0.5292543791820358, 'edge_cap': 0.27680242006952877, 'bull_strategy': 'breakout', 'bull_bb_std_mult': 2.7110447071575465, 'bull_rsi_os': 13, 'bull_rsi_ob': 55, 'bull_adx_thresh': 20.315560871105244, 'bull_atr_min_pct': 0.020473238972230676, 'bull_atr_max_pct': 0.030602001994063113, 'bull_tp_mult': 2.631032941970735, 'bull_tsl_mult': 0.8395957433624474, 'bull_time_stop': 67, 'bull_use_sma': False, 'bull_use_ema': False, 'bull_use_atr': True, 'bull_use_adx': True, 'bull_use_spike': True, 'bull_rsi_required': True, 'bear_strategy': 'mean_reversion', 'bear_bb_std_mult': 1.4595470471130332, 'bear_rsi_os': 25, 'bear_rsi_ob': 80, 'bear_adx_thresh': 12.039944536057655, 'bear_atr_min_pct': 0.0037815892816278262, 'bear_atr_max_pct': 0.12266285181600106, 'bear_tp_mult': 1.6240215745493585, 'bear_tsl_mult': 0.8642779082909928, 'bear_time_stop': 280, 'bear_use_sma': True, 'bear_use_ema': True, 'bear_use_atr': False, 'bear_use_adx': False, 'bear_use_spike': False, 'bear_rsi_required': False, 'sideways_strategy': 'breakout', 'sideways_bb_std_mult': 3.1236262144192923, 'sideways_rsi_os': 26, 'sideways_rsi_ob': 80, 'sideways_adx_thresh': 12.156452291922015, 'sideways_atr_min_pct': 0.01828917951816392, 'sideways_atr_max_pct': 0.10256997508004373, 'sideways_tp_mult': 1.2445919820233458, 'sideways_tsl_mult': 0.27552439733668116, 'sideways_time_stop': 237, 'sideways_use_sma': False, 'sideways_use_ema': True, 'sideways_use_atr': False, 'sideways_use_adx': False, 'sideways_use_spike': True, 'sideways_rsi_required': False}.
[I 2025-08-30 16:29:46,278] Trial 779 finished with values: [-1000000000.0, 1000000000.0] and parameters: {'p_sma': 9, 'p_std': 22, 'p_atr': 13, 'p_adx': 25, 'rsi_period': 13, 'ema1': 23, 'ema2': 38, 'slip_atr_k': 0.00019355611557642734, 'slip_spread_k': 0.6827911505648753, 'spread_hl_frac': 0.0045807076177823165, 'bb_std_mult': 2.770794145125309, 'rsi_os': 24, 'rsi_ob': 63, 'vol_spike': 0.25563340197767487, 'adx_thresh': 9.34393739413032, 'atr_min_pct': 0.006070706299134672, 'atr_max_pct': 0.11743654620097685, 'tp_mult': 1.5529650509121748, 'tsl_mult': 0.435974412877261, 'strategy': 'mean_reversion', 'time_stop': 158, 'use_sma': True, 'use_atr': False, 'use_adx': True, 'use_ema': False, 'use_spike': False, 'rsi_required': False, 'edge_k': 1.931230645388825, 'edge_cap': 0.2684442854043846, 'bull_strategy': 'breakout', 'bull_bb_std_mult': 1.5902954222832246, 'bull_rsi_os': 45, 'bull_rsi_ob': 87, 'bull_adx_thresh': 20.424955029754518, 'bull_atr_min_pct': 0.013447804081881967, 'bull_atr_max_pct': 0.10616914736179248, 'bull_tp_mult': 2.51799182524065, 'bull_tsl_mult': 0.4630447580726767, 'bull_time_stop': 187, 'bull_use_sma': False, 'bull_use_ema': True, 'bull_use_atr': True, 'bull_use_adx': True, 'bull_use_spike': True, 'bull_rsi_required': True, 'bear_strategy': 'mean_reversion', 'bear_bb_std_mult': 1.984631393446533, 'bear_rsi_os': 25, 'bear_rsi_ob': 95, 'bear_adx_thresh': 19.538141404215196, 'bear_atr_min_pct': 0.003903221434636354, 'bear_atr_max_pct': 0.11145423450195044, 'bear_tp_mult': 1.6737713293892715, 'bear_tsl_mult': 0.8741443191315088, 'bear_time_stop': 201, 'bear_use_sma': True, 'bear_use_ema': False, 'bear_use_atr': False, 'bear_use_adx': True, 'bear_use_spike': False, 'bear_rsi_required': False, 'sideways_strategy': 'breakout', 'sideways_bb_std_mult': 3.2093148990653284, 'sideways_rsi_os': 27, 'sideways_rsi_ob': 53, 'sideways_adx_thresh': 28.806905657820373, 'sideways_atr_min_pct': 0.01820925550888006, 'sideways_atr_max_pct': 0.0739420019941674, 'sideways_tp_mult': 1.6497985403725934, 'sideways_tsl_mult': 0.45289617503471863, 'sideways_time_stop': 108, 'sideways_use_sma': False, 'sideways_use_ema': True, 'sideways_use_atr': True, 'sideways_use_adx': False, 'sideways_use_spike': True, 'sideways_rsi_required': False}.
[I 2025-08-30 16:30:33,491] Trial 783 finished with values: [-1000000000.0, 1000000000.0] and parameters: {'p_sma': 7, 'p_std': 18, 'p_atr': 22, 'p_adx': 24, 'rsi_period': 10, 'ema1': 18, 'ema2': 38, 'slip_atr_k': 0.20556513505768534, 'slip_spread_k': 0.7241579156961143, 'spread_hl_frac': 0.008421285824560594, 'bb_std_mult': 0.7440048796521097, 'rsi_os': 28, 'rsi_ob': 71, 'vol_spike': 0.21679309626735493, 'adx_thresh': 31.01417391518502, 'atr_min_pct': 0.0012760698505859484, 'atr_max_pct': 0.08395114224377503, 'tp_mult': 1.4479597758600251, 'tsl_mult': 0.36973487267449323, 'strategy': 'breakout', 'time_stop': 126, 'use_sma': True, 'use_atr': False, 'use_adx': False, 'use_ema': False, 'use_spike': True, 'rsi_required': True, 'edge_k': 0.6622637054751683, 'edge_cap': 0.9813712262003393, 'bull_strategy': 'breakout', 'bull_bb_std_mult': 1.552424761792645, 'bull_rsi_os': 51, 'bull_rsi_ob': 84, 'bull_adx_thresh': 10.61312886122877, 'bull_atr_min_pct': 0.01867714346917283, 'bull_atr_max_pct': 0.09727775777200894, 'bull_tp_mult': 2.725264595171899, 'bull_tsl_mult': 0.6788661574169974, 'bull_time_stop': 58, 'bull_use_sma': True, 'bull_use_ema': True, 'bull_use_atr': True, 'bull_use_adx': False, 'bull_use_spike': True, 'bull_rsi_required': False, 'bear_strategy': 'mean_reversion', 'bear_bb_std_mult': 2.0876278756395594, 'bear_rsi_os': 38, 'bear_rsi_ob': 75, 'bear_adx_thresh': 14.650797537091627, 'bear_atr_min_pct': 0.02333459724539292, 'bear_atr_max_pct': 0.10610178582582776, 'bear_tp_mult': 1.8493645933229421, 'bear_tsl_mult': 0.8418043960857929, 'bear_time_stop': 228, 'bear_use_sma': True, 'bear_use_ema': False, 'bear_use_atr': True, 'bear_use_adx': True, 'bear_use_spike': True, 'bear_rsi_required': True, 'sideways_strategy': 'mean_reversion', 'sideways_bb_std_mult': 3.2926067430379584, 'sideways_rsi_os': 13, 'sideways_rsi_ob': 78, 'sideways_adx_thresh': 11.237208731420239, 'sideways_atr_min_pct': 0.019443549176004115, 'sideways_atr_max_pct': 0.03271217028392029, 'sideways_tp_mult': 1.7728608041247735, 'sideways_tsl_mult': 0.3565487464074498, 'sideways_time_stop': 53, 'sideways_use_sma': True, 'sideways_use_ema': False, 'sideways_use_atr': True, 'sideways_use_adx': True, 'sideways_use_spike': True, 'sideways_rsi_required': True}.
[I 2025-08-30 16:30:34,177] Trial 781 finished with values: [-1000000000.0, 1000000000.0] and parameters: {'p_sma': 11, 'p_std': 18, 'p_atr': 11, 'p_adx': 25, 'rsi_period': 37, 'ema1': 23, 'ema2': 38, 'slip_atr_k': 7.636886769194916e-05, 'slip_spread_k': 0.03651324015734114, 'spread_hl_frac': 0.027764227274982903, 'bb_std_mult': 0.7306003483193046, 'rsi_os': 28, 'rsi_ob': 72, 'vol_spike': 0.21612704111399655, 'adx_thresh': 23.486610302187334, 'atr_min_pct': 0.005876843649577615, 'atr_max_pct': 0.11470173836470098, 'tp_mult': 2.274634723495273, 'tsl_mult': 0.37692762957787956, 'strategy': 'breakout', 'time_stop': 145, 'use_sma': True, 'use_atr': False, 'use_adx': False, 'use_ema': False, 'use_spike': True, 'rsi_required': True, 'edge_k': 0.5761475480126313, 'edge_cap': 0.9799376952195278, 'bull_strategy': 'breakout', 'bull_bb_std_mult': 1.5903007885396745, 'bull_rsi_os': 51, 'bull_rsi_ob': 64, 'bull_adx_thresh': 10.425651068277691, 'bull_atr_min_pct': 0.018813051681637324, 'bull_atr_max_pct': 0.09658374034865407, 'bull_tp_mult': 1.3690281820019234, 'bull_tsl_mult': 0.9289921705553423, 'bull_time_stop': 215, 'bull_use_sma': True, 'bull_use_ema': True, 'bull_use_atr': True, 'bull_use_adx': False, 'bull_use_spike': True, 'bull_rsi_required': False, 'bear_strategy': 'mean_reversion', 'bear_bb_std_mult': 1.9811479229729048, 'bear_rsi_os': 24, 'bear_rsi_ob': 49, 'bear_adx_thresh': 14.475590410890103, 'bear_atr_min_pct': 0.002138413335853194, 'bear_atr_max_pct': 0.04804026216687494, 'bear_tp_mult': 2.1988157338033387, 'bear_tsl_mult': 0.07799863759809572, 'bear_time_stop': 87, 'bear_use_sma': True, 'bear_use_ema': False, 'bear_use_atr': True, 'bear_use_adx': True, 'bear_use_spike': True, 'bear_rsi_required': True, 'sideways_strategy': 'mean_reversion', 'sideways_bb_std_mult': 3.3088796117968395, 'sideways_rsi_os': 16, 'sideways_rsi_ob': 83, 'sideways_adx_thresh': 9.000193576780418, 'sideways_atr_min_pct': 0.0034559659609365388, 'sideways_atr_max_pct': 0.06569812544534481, 'sideways_tp_mult': 1.7699058069370914, 'sideways_tsl_mult': 0.3595683496612558, 'sideways_time_stop': 124, 'sideways_use_sma': True, 'sideways_use_ema': False, 'sideways_use_atr': True, 'sideways_use_adx': True, 'sideways_use_spike': True, 'sideways_rsi_required': True}.
[I 2025-08-30 16:30:34,496] Trial 780 finished with values: [-1000000000.0, 1000000000.0] and parameters: {'p_sma': 11, 'p_std': 22, 'p_atr': 10, 'p_adx': 25, 'rsi_period': 47, 'ema1': 18, 'ema2': 33, 'slip_atr_k': 0.1169011130326375, 'slip_spread_k': 0.6271581424478885, 'spread_hl_frac': 0.012171298609370796, 'bb_std_mult': 0.753826203996385, 'rsi_os': 37, 'rsi_ob': 86, 'vol_spike': 0.21617225178676508, 'adx_thresh': 9.426975781375386, 'atr_min_pct': 0.00630928918941144, 'atr_max_pct': 0.11265984733673276, 'tp_mult': 1.55805905590871, 'tsl_mult': 0.37058414451295846, 'strategy': 'breakout', 'time_stop': 160, 'use_sma': True, 'use_atr': False, 'use_adx': True, 'use_ema': False, 'use_spike': False, 'rsi_required': True, 'edge_k': 0.6870787986643219, 'edge_cap': 0.9796046927855856, 'bull_strategy': 'breakout', 'bull_bb_std_mult': 3.1462085178204977, 'bull_rsi_os': 51, 'bull_rsi_ob': 87, 'bull_adx_thresh': 9.850356507852156, 'bull_atr_min_pct': 0.01341745254207457, 'bull_atr_max_pct': 0.02930059657401083, 'bull_tp_mult': 2.5307546946264097, 'bull_tsl_mult': 0.4546795699745643, 'bull_time_stop': 52, 'bull_use_sma': True, 'bull_use_ema': True, 'bull_use_atr': True, 'bull_use_adx': False, 'bull_use_spike': True, 'bull_rsi_required': False, 'bear_strategy': 'mean_reversion', 'bear_bb_std_mult': 2.0185835200090505, 'bear_rsi_os': 27, 'bear_rsi_ob': 75, 'bear_adx_thresh': 11.747401644173378, 'bear_atr_min_pct': 0.0020969088045102065, 'bear_atr_max_pct': 0.047785468616297934, 'bear_tp_mult': 2.705556275208083, 'bear_tsl_mult': 0.8304756193975801, 'bear_time_stop': 89, 'bear_use_sma': True, 'bear_use_ema': False, 'bear_use_atr': True, 'bear_use_adx': True, 'bear_use_spike': False, 'bear_rsi_required': False, 'sideways_strategy': 'mean_reversion', 'sideways_bb_std_mult': 3.1304505433723873, 'sideways_rsi_os': 27, 'sideways_rsi_ob': 80, 'sideways_adx_thresh': 13.862776359393767, 'sideways_atr_min_pct': 0.018199123522339558, 'sideways_atr_max_pct': 0.06482569298446933, 'sideways_tp_mult': 1.6381876363027381, 'sideways_tsl_mult': 0.46298244372698516, 'sideways_time_stop': 110, 'sideways_use_sma': True, 'sideways_use_ema': False, 'sideways_use_atr': True, 'sideways_use_adx': True, 'sideways_use_spike': True, 'sideways_rsi_required': True}.
