[I 2025-08-30 16:01:34,297] Trial 632 finished with values: [-1000000000.0, 1000000000.0] and parameters: {'p_sma': 5, 'p_std': 16, 'p_atr': 15, 'p_adx': 23, 'rsi_period': 10, 'ema1': 22, 'ema2': 38, 'slip_atr_k': 0.19614821688588108, 'slip_spread_k': 0.7197543990582786, 'spread_hl_frac': 0.027231010997622443, 'bb_std_mult': 0.6720576382943128, 'rsi_os': 28, 'rsi_ob': 83, 'vol_spike': 0.2322698374513931, 'adx_thresh': 9.754324737636924, 'atr_min_pct': 0.007557486266152352, 'atr_max_pct': 0.1130507831743228, 'tp_mult': 1.5526931503652033, 'tsl_mult': 0.40931453501521997, 'strategy': 'breakout', 'time_stop': 162, 'use_sma': False, 'use_atr': False, 'use_adx': True, 'use_ema': False, 'use_spike': False, 'rsi_required': False, 'edge_k': 1.6772162523827232, 'edge_cap': 0.9723624919036081, 'bull_strategy': 'breakout', 'bull_bb_std_mult': 1.6272660679346211, 'bull_rsi_os': 33, 'bull_rsi_ob': 88, 'bull_adx_thresh': 11.776946375330645, 'bull_atr_min_pct': 0.01759375108454279, 'bull_atr_max_pct': 0.10639789604736485, 'bull_tp_mult': 2.617908018239886, 'bull_tsl_mult': 0.6775919203008371, 'bull_time_stop': 56, 'bull_use_sma': True, 'bull_use_ema': False, 'bull_use_atr': True, 'bull_use_adx': True, 'bull_use_spike': True, 'bull_rsi_required': False, 'bear_strategy': 'mean_reversion', 'bear_bb_std_mult': 1.956942273168346, 'bear_rsi_os': 23, 'bear_rsi_ob': 79, 'bear_adx_thresh': 13.590932508405874, 'bear_atr_min_pct': 0.003525882164075296, 'bear_atr_max_pct': 0.1074803026652484, 'bear_tp_mult': 2.62787838749513, 'bear_tsl_mult': 0.39065862428004994, 'bear_time_stop': 94, 'bear_use_sma': False, 'bear_use_ema': True, 'bear_use_atr': True, 'bear_use_adx': True, 'bear_use_spike': True, 'bear_rsi_required': True, 'sideways_strategy': 'breakout', 'sideways_bb_std_mult': 3.1679596848597558, 'sideways_rsi_os': 23, 'sideways_rsi_ob': 88, 'sideways_adx_thresh': 33.527035402231505, 'sideways_atr_min_pct': 0.019717788904262158, 'sideways_atr_max_pct': 0.07148445744098891, 'sideways_tp_mult': 1.5109484900589292, 'sideways_tsl_mult': 0.6522793982685546, 'sideways_time_stop': 128, 'sideways_use_sma': False, 'sideways_use_ema': True, 'sideways_use_atr': True, 'sideways_use_adx': True, 'sideways_use_spike': True, 'sideways_rsi_required': True}.
[I 2025-08-30 16:01:34,924] Trial 631 finished with values: [-1000000000.0, 1000000000.0] and parameters: {'p_sma': 6, 'p_std': 58, 'p_atr': 25, 'p_adx': 12, 'rsi_period': 10, 'ema1': 21, 'ema2': 60, 'slip_atr_k': 0.24341972430174852, 'slip_spread_k': 0.6887625129726221, 'spread_hl_frac': 0.017454123876165243, 'bb_std_mult': 1.148725346428042, 'rsi_os': 28, 'rsi_ob': 85, 'vol_spike': 0.14467849136940264, 'adx_thresh': 18.736449579024388, 'atr_min_pct': 0.007662165009427236, 'atr_max_pct': 0.11475809434661068, 'tp_mult': 1.4841500359565336, 'tsl_mult': 0.6407554686409032, 'strategy': 'breakout', 'time_stop': 163, 'use_sma': False, 'use_atr': False, 'use_adx': True, 'use_ema': False, 'use_spike': False, 'rsi_required': False, 'edge_k': 0.5908024018855008, 'edge_cap': 0.9856370391528091, 'bull_strategy': 'breakout', 'bull_bb_std_mult': 1.1641679585496436, 'bull_rsi_os': 47, 'bull_rsi_ob': 90, 'bull_adx_thresh': 11.52825983697904, 'bull_atr_min_pct': 0.017371628938915428, 'bull_atr_max_pct': 0.12897474449029867, 'bull_tp_mult': 2.631735430559294, 'bull_tsl_mult': 0.39878950069578717, 'bull_time_stop': 57, 'bull_use_sma': True, 'bull_use_ema': False, 'bull_use_atr': True, 'bull_use_adx': True, 'bull_use_spike': True, 'bull_rsi_required': False, 'bear_strategy': 'mean_reversion', 'bear_bb_std_mult': 1.964315731778473, 'bear_rsi_os': 23, 'bear_rsi_ob': 74, 'bear_adx_thresh': 8.597554717422627, 'bear_atr_min_pct': 0.014781113576586265, 'bear_atr_max_pct': 0.10702372009468251, 'bear_tp_mult': 2.6145042218752903, 'bear_tsl_mult': 0.4476314434773597, 'bear_time_stop': 99, 'bear_use_sma': True, 'bear_use_ema': True, 'bear_use_atr': True, 'bear_use_adx': True, 'bear_use_spike': True, 'bear_rsi_required': True, 'sideways_strategy': 'breakout', 'sideways_bb_std_mult': 3.206917348831076, 'sideways_rsi_os': 27, 'sideways_rsi_ob': 80, 'sideways_adx_thresh': 34.33158457115619, 'sideways_atr_min_pct': 0.028362331056736544, 'sideways_atr_max_pct': 0.06494588046958844, 'sideways_tp_mult': 1.492829623050118, 'sideways_tsl_mult': 0.42176004764444247, 'sideways_time_stop': 40, 'sideways_use_sma': False, 'sideways_use_ema': True, 'sideways_use_atr': True, 'sideways_use_adx': True, 'sideways_use_spike': True, 'sideways_rsi_required': True}.
[I 2025-08-30 16:01:34,933] Trial 630 finished with values: [-1000000000.0, 1000000000.0] and parameters: {'p_sma': 47, 'p_std': 12, 'p_atr': 15, 'p_adx': 12, 'rsi_period': 11, 'ema1': 21, 'ema2': 11, 'slip_atr_k': 0.007869670076683327, 'slip_spread_k': 0.8258514288581564, 'spread_hl_frac': 0.018314094144758486, 'bb_std_mult': 2.520823897575795, 'rsi_os': 28, 'rsi_ob': 56, 'vol_spike': 0.2322797604281684, 'adx_thresh': 7.441408262631824, 'atr_min_pct': 0.007222729938847519, 'atr_max_pct': 0.05964399632977595, 'tp_mult': 2.6406508732729868, 'tsl_mult': 0.28665703944997006, 'strategy': 'breakout', 'time_stop': 163, 'use_sma': False, 'use_atr': False, 'use_adx': True, 'use_ema': False, 'use_spike': False, 'rsi_required': False, 'edge_k': 1.190907125612641, 'edge_cap': 0.9992974761265714, 'bull_strategy': 'breakout', 'bull_bb_std_mult': 1.4829434621524382, 'bull_rsi_os': 36, 'bull_rsi_ob': 90, 'bull_adx_thresh': 9.505484225451001, 'bull_atr_min_pct': 0.013181286959544318, 'bull_atr_max_pct': 0.13349418034715888, 'bull_tp_mult': 2.500909901766746, 'bull_tsl_mult': 0.6066853497440702, 'bull_time_stop': 57, 'bull_use_sma': True, 'bull_use_ema': True, 'bull_use_atr': True, 'bull_use_adx': True, 'bull_use_spike': True, 'bull_rsi_required': False, 'bear_strategy': 'mean_reversion', 'bear_bb_std_mult': 2.358072585007268, 'bear_rsi_os': 23, 'bear_rsi_ob': 72, 'bear_adx_thresh': 13.53375291270676, 'bear_atr_min_pct': 0.009168228587491903, 'bear_atr_max_pct': 0.1069454331029154, 'bear_tp_mult': 2.6971859682097987, 'bear_tsl_mult': 0.852426204701184, 'bear_time_stop': 99, 'bear_use_sma': True, 'bear_use_ema': False, 'bear_use_atr': True, 'bear_use_adx': True, 'bear_use_spike': True, 'bear_rsi_required': True, 'sideways_strategy': 'breakout', 'sideways_bb_std_mult': 3.17472515394172, 'sideways_rsi_os': 6, 'sideways_rsi_ob': 86, 'sideways_adx_thresh': 33.59153645222997, 'sideways_atr_min_pct': 0.013950671026971256, 'sideways_atr_max_pct': 0.07162584421183776, 'sideways_tp_mult': 1.46338859372369, 'sideways_tsl_mult': 0.42865266514788025, 'sideways_time_stop': 254, 'sideways_use_sma': False, 'sideways_use_ema': True, 'sideways_use_atr': True, 'sideways_use_adx': True, 'sideways_use_spike': True, 'sideways_rsi_required': True}.
[I 2025-08-30 16:02:18,543] Trial 636 finished with values: [-1000000000.0, 1000000000.0] and parameters: {'p_sma': 7, 'p_std': 20, 'p_atr': 12, 'p_adx': 14, 'rsi_period': 8, 'ema1': 27, 'ema2': 35, 'slip_atr_k': 0.004487253398758009, 'slip_spread_k': 0.7826684125138068, 'spread_hl_frac': 0.01310659499970505, 'bb_std_mult': 0.9479335853865836, 'rsi_os': 26, 'rsi_ob': 88, 'vol_spike': 0.01972373436708172, 'adx_thresh': 9.264925371753288, 'atr_min_pct': 0.010723681220789923, 'atr_max_pct': 0.11143521759272311, 'tp_mult': 1.577587479223043, 'tsl_mult': 0.34225842469736356, 'strategy': 'breakout', 'time_stop': 209, 'use_sma': True, 'use_atr': False, 'use_adx': True, 'use_ema': False, 'use_spike': False, 'rsi_required': False, 'edge_k': 0.9953872132334771, 'edge_cap': 0.15853628904941175, 'bull_strategy': 'breakout', 'bull_bb_std_mult': 1.5882914640352968, 'bull_rsi_os': 5, 'bull_rsi_ob': 76, 'bull_adx_thresh': 10.074196862095286, 'bull_atr_min_pct': 0.018985476731928443, 'bull_atr_max_pct': 0.09500748988853226, 'bull_tp_mult': 2.11639956485081, 'bull_tsl_mult': 0.8941658714019712, 'bull_time_stop': 44, 'bull_use_sma': True, 'bull_use_ema': True, 'bull_use_atr': False, 'bull_use_adx': True, 'bull_use_spike': False, 'bull_rsi_required': False, 'bear_strategy': 'mean_reversion', 'bear_bb_std_mult': 2.7808913714409025, 'bear_rsi_os': 25, 'bear_rsi_ob': 70, 'bear_adx_thresh': 15.277943129304687, 'bear_atr_min_pct': 0.006733361352306915, 'bear_atr_max_pct': 0.03496169497556324, 'bear_tp_mult': 1.172716999473689, 'bear_tsl_mult': 0.8789918269651779, 'bear_time_stop': 189, 'bear_use_sma': True, 'bear_use_ema': False, 'bear_use_atr': False, 'bear_use_adx': True, 'bear_use_spike': False, 'bear_rsi_required': True, 'sideways_strategy': 'mean_reversion', 'sideways_bb_std_mult': 3.596797305991974, 'sideways_rsi_os': 13, 'sideways_rsi_ob': 81, 'sideways_adx_thresh': 10.832004297283168, 'sideways_atr_min_pct': 0.02030836129534355, 'sideways_atr_max_pct': 0.0603924672812396, 'sideways_tp_mult': 1.2968977923802019, 'sideways_tsl_mult': 0.8821516590170243, 'sideways_time_stop': 149, 'sideways_use_sma': True, 'sideways_use_ema': False, 'sideways_use_atr': True, 'sideways_use_adx': False, 'sideways_use_spike': False, 'sideways_rsi_required': True}.
[I 2025-08-30 16:02:19,311] Trial 635 finished with values: [-1000000000.0, 1000000000.0] and parameters: {'p_sma': 49, 'p_std': 20, 'p_atr': 12, 'p_adx': 26, 'rsi_period': 9, 'ema1': 27, 'ema2': 35, 'slip_atr_k': 0.1865169646286725, 'slip_spread_k': 0.7789819908974511, 'spread_hl_frac': 0.0057859077010833735, 'bb_std_mult': 0.9848204311967521, 'rsi_os': 26, 'rsi_ob': 88, 'vol_spike': 0.2242921687386236, 'adx_thresh': 23.456951538733264, 'atr_min_pct': 0.006298400127219506, 'atr_max_pct': 0.12112350447384164, 'tp_mult': 2.8954970180644315, 'tsl_mult': 0.7266653244018619, 'strategy': 'breakout', 'time_stop': 173, 'use_sma': True, 'use_atr': False, 'use_adx': True, 'use_ema': False, 'use_spike': False, 'rsi_required': False, 'edge_k': 0.5139132893526681, 'edge_cap': 0.9539877330702636, 'bull_strategy': 'breakout', 'bull_bb_std_mult': 2.2797051103338597, 'bull_rsi_os': 47, 'bull_rsi_ob': 91, 'bull_adx_thresh': 10.013554654686194, 'bull_atr_min_pct': 0.025265134570627276, 'bull_atr_max_pct': 0.0951663118927655, 'bull_tp_mult': 2.668762275013157, 'bull_tsl_mult': 0.8945287615623778, 'bull_time_stop': 47, 'bull_use_sma': True, 'bull_use_ema': True, 'bull_use_atr': False, 'bull_use_adx': True, 'bull_use_spike': False, 'bull_rsi_required': False, 'bear_strategy': 'mean_reversion', 'bear_bb_std_mult': 1.7937032170155436, 'bear_rsi_os': 27, 'bear_rsi_ob': 70, 'bear_adx_thresh': 19.97658654860523, 'bear_atr_min_pct': 0.0056507475558349625, 'bear_atr_max_pct': 0.09775137220370647, 'bear_tp_mult': 1.5416238137217029, 'bear_tsl_mult': 0.12670448617176033, 'bear_time_stop': 229, 'bear_use_sma': True, 'bear_use_ema': False, 'bear_use_atr': False, 'bear_use_adx': True, 'bear_use_spike': False, 'bear_rsi_required': True, 'sideways_strategy': 'mean_reversion', 'sideways_bb_std_mult': 3.345206409357832, 'sideways_rsi_os': 14, 'sideways_rsi_ob': 81, 'sideways_adx_thresh': 10.734362308758255, 'sideways_atr_min_pct': 0.02174017619605936, 'sideways_atr_max_pct': 0.069085773738104, 'sideways_tp_mult': 1.315144890849017, 'sideways_tsl_mult': 0.3940169755921177, 'sideways_time_stop': 218, 'sideways_use_sma': True, 'sideways_use_ema': False, 'sideways_use_atr': True, 'sideways_use_adx': False, 'sideways_use_spike': False, 'sideways_rsi_required': True}.
[I 2025-08-30 16:02:19,740] Trial 634 finished with values: [-1000000000.0, 1000000000.0] and parameters: {'p_sma': 22, 'p_std': 20, 'p_atr': 12, 'p_adx': 14, 'rsi_period': 9, 'ema1': 27, 'ema2': 40, 'slip_atr_k': 0.004752856547746731, 'slip_spread_k': 0.6806694469424953, 'spread_hl_frac': 0.015316112381339436, 'bb_std_mult': 0.9830791385358328, 'rsi_os': 26, 'rsi_ob': 85, 'vol_spike': 0.2244434590484476, 'adx_thresh': 9.304546092705518, 'atr_min_pct': 0.006336734087468049, 'atr_max_pct': 0.11352028211226783, 'tp_mult': 1.4096175663119899, 'tsl_mult': 0.9063913171787996, 'strategy': 'breakout', 'time_stop': 172, 'use_sma': False, 'use_atr': False, 'use_adx': True, 'use_ema': False, 'use_spike': False, 'rsi_required': False, 'edge_k': 0.9429591344590156, 'edge_cap': 0.15390003249726625, 'bull_strategy': 'breakout', 'bull_bb_std_mult': 2.2305853671236755, 'bull_rsi_os': 36, 'bull_rsi_ob': 90, 'bull_adx_thresh': 23.488153821091725, 'bull_atr_min_pct': 0.0222746012305636, 'bull_atr_max_pct': 0.1098469553927803, 'bull_tp_mult': 2.4655462692158245, 'bull_tsl_mult': 0.37869857652164085, 'bull_time_stop': 163, 'bull_use_sma': True, 'bull_use_ema': False, 'bull_use_atr': True, 'bull_use_adx': True, 'bull_use_spike': True, 'bull_rsi_required': False, 'bear_strategy': 'mean_reversion', 'bear_bb_std_mult': 1.5496554820403872, 'bear_rsi_os': 29, 'bear_rsi_ob': 72, 'bear_adx_thresh': 20.13075720891764, 'bear_atr_min_pct': 0.014843686484740732, 'bear_atr_max_pct': 0.1238078830298324, 'bear_tp_mult': 2.1700475202470226, 'bear_tsl_mult': 0.27359579514120386, 'bear_time_stop': 102, 'bear_use_sma': True, 'bear_use_ema': True, 'bear_use_atr': True, 'bear_use_adx': True, 'bear_use_spike': True, 'bear_rsi_required': True, 'sideways_strategy': 'breakout', 'sideways_bb_std_mult': 3.355895633955325, 'sideways_rsi_os': 43, 'sideways_rsi_ob': 80, 'sideways_adx_thresh': 15.474721313985242, 'sideways_atr_min_pct': 0.019488352922946314, 'sideways_atr_max_pct': 0.06114252996280224, 'sideways_tp_mult': 1.474546124766238, 'sideways_tsl_mult': 0.21364082568630477, 'sideways_time_stop': 266, 'sideways_use_sma': False, 'sideways_use_ema': True, 'sideways_use_atr': True, 'sideways_use_adx': True, 'sideways_use_spike': True, 'sideways_rsi_required': True}.
[I 2025-08-30 16:02:20,022] Trial 633 finished with values: [-1000000000.0, 1000000000.0] and parameters: {'p_sma': 7, 'p_std': 20, 'p_atr': 12, 'p_adx': 24, 'rsi_period': 9, 'ema1': 28, 'ema2': 11, 'slip_atr_k': 0.19463425748709928, 'slip_spread_k': 0.10136147379228078, 'spread_hl_frac': 0.01360411317542111, 'bb_std_mult': 0.6374554058001951, 'rsi_os': 28, 'rsi_ob': 85, 'vol_spike': 0.022200606894704655, 'adx_thresh': 9.92437227232524, 'atr_min_pct': 0.0006704642947511531, 'atr_max_pct': 0.0599879566972117, 'tp_mult': 1.566800140910858, 'tsl_mult': 0.8892679717034051, 'strategy': 'breakout', 'time_stop': 162, 'use_sma': False, 'use_atr': False, 'use_adx': True, 'use_ema': False, 'use_spike': False, 'rsi_required': False, 'edge_k': 0.9524338088126076, 'edge_cap': 0.9608137772099502, 'bull_strategy': 'breakout', 'bull_bb_std_mult': 1.6234862133116394, 'bull_rsi_os': 47, 'bull_rsi_ob': 88, 'bull_adx_thresh': 11.629512979961243, 'bull_atr_min_pct': 0.025065840216985266, 'bull_atr_max_pct': 0.06530931662894042, 'bull_tp_mult': 2.4971777376673012, 'bull_tsl_mult': 0.8967574049830568, 'bull_time_stop': 47, 'bull_use_sma': True, 'bull_use_ema': False, 'bull_use_atr': True, 'bull_use_adx': True, 'bull_use_spike': True, 'bull_rsi_required': False, 'bear_strategy': 'mean_reversion', 'bear_bb_std_mult': 1.3272573035111066, 'bear_rsi_os': 24, 'bear_rsi_ob': 72, 'bear_adx_thresh': 32.25371849002263, 'bear_atr_min_pct': 0.02199891052173864, 'bear_atr_max_pct': 0.10678757305871008, 'bear_tp_mult': 2.5961393795002596, 'bear_tsl_mult': 0.27379456191640117, 'bear_time_stop': 92, 'bear_use_sma': True, 'bear_use_ema': True, 'bear_use_atr': True, 'bear_use_adx': True, 'bear_use_spike': True, 'bear_rsi_required': True, 'sideways_strategy': 'breakout', 'sideways_bb_std_mult': 3.0609750441693615, 'sideways_rsi_os': 14, 'sideways_rsi_ob': 80, 'sideways_adx_thresh': 34.37086637344157, 'sideways_atr_min_pct': 0.01961831545030145, 'sideways_atr_max_pct': 0.10632015537397047, 'sideways_tp_mult': 1.2616567050851808, 'sideways_tsl_mult': 0.3916996988972386, 'sideways_time_stop': 149, 'sideways_use_sma': False, 'sideways_use_ema': True, 'sideways_use_atr': True, 'sideways_use_adx': True, 'sideways_use_spike': True, 'sideways_rsi_required': True}.
[I 2025-08-30 16:03:04,324] Trial 637 finished with values: [-1000000000.0, 1000000000.0] and parameters: {'p_sma': 8, 'p_std': 19, 'p_atr': 9, 'p_adx': 24, 'rsi_period': 44, 'ema1': 28, 'ema2': 39, 'slip_atr_k': 0.1883481895883023, 'slip_spread_k': 0.09357921382765672, 'spread_hl_frac': 0.02302877413743772, 'bb_std_mult': 0.5632362258608843, 'rsi_os': 26, 'rsi_ob': 69, 'vol_spike': 0.2235992834253742, 'adx_thresh': 17.707163663515907, 'atr_min_pct': 0.006196015806880534, 'atr_max_pct': 0.12004711327124917, 'tp_mult': 1.3283959129373049, 'tsl_mult': 0.20082698007387156, 'strategy': 'breakout', 'time_stop': 153, 'use_sma': False, 'use_atr': False, 'use_adx': True, 'use_ema': False, 'use_spike': False, 'rsi_required': False, 'edge_k': 0.5352521514829433, 'edge_cap': 0.9609691689720696, 'bull_strategy': 'breakout', 'bull_bb_std_mult': 1.3663470166178528, 'bull_rsi_os': 51, 'bull_rsi_ob': 57, 'bull_adx_thresh': 10.040091355081387, 'bull_atr_min_pct': 0.020278503854362837, 'bull_atr_max_pct': 0.07703416139337238, 'bull_tp_mult': 2.6683503609478163, 'bull_tsl_mult': 0.4268959036298667, 'bull_time_stop': 226, 'bull_use_sma': True, 'bull_use_ema': True, 'bull_use_atr': True, 'bull_use_adx': True, 'bull_use_spike': True, 'bull_rsi_required': True, 'bear_strategy': 'mean_reversion', 'bear_bb_std_mult': 1.7938123586757218, 'bear_rsi_os': 29, 'bear_rsi_ob': 72, 'bear_adx_thresh': 16.180329858456286, 'bear_atr_min_pct': 0.021958930723662996, 'bear_atr_max_pct': 0.11154688445408532, 'bear_tp_mult': 1.4962886284835888, 'bear_tsl_mult': 0.8322448645241597, 'bear_time_stop': 129, 'bear_use_sma': True, 'bear_use_ema': False, 'bear_use_atr': True, 'bear_use_adx': True, 'bear_use_spike': True, 'bear_rsi_required': True, 'sideways_strategy': 'mean_reversion', 'sideways_bb_std_mult': 3.0630012277778613, 'sideways_rsi_os': 25, 'sideways_rsi_ob': 80, 'sideways_adx_thresh': 11.606101742858172, 'sideways_atr_min_pct': 0.019274280273452037, 'sideways_atr_max_pct': 0.040659895658486614, 'sideways_tp_mult': 1.2484962478065207, 'sideways_tsl_mult': 0.3904660911143013, 'sideways_time_stop': 57, 'sideways_use_sma': True, 'sideways_use_ema': False, 'sideways_use_atr': True, 'sideways_use_adx': True, 'sideways_use_spike': True, 'sideways_rsi_required': True}.
[I 2025-08-30 16:03:04,333] Trial 640 finished with values: [-1000000000.0, 1000000000.0] and parameters: {'p_sma': 8, 'p_std': 19, 'p_atr': 24, 'p_adx': 24, 'rsi_period': 60, 'ema1': 22, 'ema2': 38, 'slip_atr_k': 0.2169200817347644, 'slip_spread_k': 0.7151653796906504, 'spread_hl_frac': 0.02221335997854842, 'bb_std_mult': 0.5639101653054741, 'rsi_os': 27, 'rsi_ob': 89, 'vol_spike': 0.21518884033095115, 'adx_thresh': 8.207270294306541, 'atr_min_pct': 0.00670027798895852, 'atr_max_pct': 0.10515255527914989, 'tp_mult': 2.9681786781670385, 'tsl_mult': 0.3817826990204611, 'strategy': 'breakout', 'time_stop': 189, 'use_sma': False, 'use_atr': True, 'use_adx': False, 'use_ema': False, 'use_spike': False, 'rsi_required': False, 'edge_k': 0.4558505088209771, 'edge_cap': 0.44668802941100993, 'bull_strategy': 'breakout', 'bull_bb_std_mult': 0.773511319940188, 'bull_rsi_os': 51, 'bull_rsi_ob': 86, 'bull_adx_thresh': 8.72364189666258, 'bull_atr_min_pct': 0.02042242895196187, 'bull_atr_max_pct': 0.07674595172481008, 'bull_tp_mult': 2.559993707024036, 'bull_tsl_mult': 0.8674977917126345, 'bull_time_stop': 172, 'bull_use_sma': False, 'bull_use_ema': True, 'bull_use_atr': True, 'bull_use_adx': True, 'bull_use_spike': True, 'bull_rsi_required': True, 'bear_strategy': 'mean_reversion', 'bear_bb_std_mult': 1.854361009558797, 'bear_rsi_os': 8, 'bear_rsi_ob': 75, 'bear_adx_thresh': 18.233986989972223, 'bear_atr_min_pct': 0.0029598698025251, 'bear_atr_max_pct': 0.049944320952551066, 'bear_tp_mult': 2.6706804403872257, 'bear_tsl_mult': 0.7554988122272626, 'bear_time_stop': 88, 'bear_use_sma': False, 'bear_use_ema': False, 'bear_use_atr': True, 'bear_use_adx': False, 'bear_use_spike': True, 'bear_rsi_required': True, 'sideways_strategy': 'mean_reversion', 'sideways_bb_std_mult': 3.1174186754154194, 'sideways_rsi_os': 16, 'sideways_rsi_ob': 78, 'sideways_adx_thresh': 11.62499076357443, 'sideways_atr_min_pct': 0.017980849119708084, 'sideways_atr_max_pct': 0.06624051602836467, 'sideways_tp_mult': 1.1735701975280919, 'sideways_tsl_mult': 0.3471066850801952, 'sideways_time_stop': 194, 'sideways_use_sma': True, 'sideways_use_ema': False, 'sideways_use_atr': False, 'sideways_use_adx': True, 'sideways_use_spike': True, 'sideways_rsi_required': True}.
