[I 2025-08-30 15:34:09,438] Trial 495 finished with values: [-1000000000.0, 1000000000.0] and parameters: {'p_sma': 8, 'p_std': 18, 'p_atr': 12, 'p_adx': 25, 'rsi_period': 10, 'ema1': 24, 'ema2': 38, 'slip_atr_k': 0.1257815680810431, 'slip_spread_k': 0.7041006339568924, 'spread_hl_frac': 0.02941709143273722, 'bb_std_mult': 0.6326589095660635, 'rsi_os': 27, 'rsi_ob': 56, 'vol_spike': 0.21752527764070134, 'adx_thresh': 20.173947936396946, 'atr_min_pct': 0.013734904397693518, 'atr_max_pct': 0.06299311012876861, 'tp_mult': 1.4890925187073725, 'tsl_mult': 0.380635410671167, 'strategy': 'mean_reversion', 'time_stop': 170, 'use_sma': True, 'use_atr': True, 'use_adx': False, 'use_ema': True, 'use_spike': True, 'rsi_required': True, 'edge_k': 0.8781235425110198, 'edge_cap': 0.9662629398113681, 'bull_strategy': 'mean_reversion', 'bull_bb_std_mult': 1.6204289769039966, 'bull_rsi_os': 51, 'bull_rsi_ob': 87, 'bull_adx_thresh': 9.455642744857835, 'bull_atr_min_pct': 0.020150851018106666, 'bull_atr_max_pct': 0.1090166247423512, 'bull_tp_mult': 2.5829275105101726, 'bull_tsl_mult': 0.8777764625237445, 'bull_time_stop': 54, 'bull_use_sma': False, 'bull_use_ema': False, 'bull_use_atr': True, 'bull_use_adx': True, 'bull_use_spike': False, 'bull_rsi_required': True, 'bear_strategy': 'breakout', 'bear_bb_std_mult': 1.709783194712229, 'bear_rsi_os': 45, 'bear_rsi_ob': 75, 'bear_adx_thresh': 14.177295777776358, 'bear_atr_min_pct': 0.0019862340420296674, 'bear_atr_max_pct': 0.11037529855588969, 'bear_tp_mult': 2.6552554946171942, 'bear_tsl_mult': 0.8712468257666003, 'bear_time_stop': 94, 'bear_use_sma': False, 'bear_use_ema': True, 'bear_use_atr': False, 'bear_use_adx': True, 'bear_use_spike': False, 'bear_rsi_required': False, 'sideways_strategy': 'breakout', 'sideways_bb_std_mult': 3.2297675452201533, 'sideways_rsi_os': 21, 'sideways_rsi_ob': 77, 'sideways_adx_thresh': 11.39936617576473, 'sideways_atr_min_pct': 0.01972479324436131, 'sideways_atr_max_pct': 0.06924677501218694, 'sideways_tp_mult': 1.0890688183544888, 'sideways_tsl_mult': 0.4108431385393343, 'sideways_time_stop': 133, 'sideways_use_sma': False, 'sideways_use_ema': True, 'sideways_use_atr': True, 'sideways_use_adx': True, 'sideways_use_spike': True, 'sideways_rsi_required': False}.
[I 2025-08-30 15:34:10,462] Trial 497 finished with values: [-1000000000.0, 1000000000.0] and parameters: {'p_sma': 8, 'p_std': 20, 'p_atr': 12, 'p_adx': 25, 'rsi_period': 9, 'ema1': 24, 'ema2': 14, 'slip_atr_k': 0.1870363306442384, 'slip_spread_k': 0.7187182365883061, 'spread_hl_frac': 0.010673161966156391, 'bb_std_mult': 0.7299169436058877, 'rsi_os': 31, 'rsi_ob': 72, 'vol_spike': 0.198037603719942, 'adx_thresh': 33.576902875120425, 'atr_min_pct': 0.00020268600032050978, 'atr_max_pct': 0.12805410567563494, 'tp_mult': 1.4561441688155086, 'tsl_mult': 0.35819739198263933, 'strategy': 'mean_reversion', 'time_stop': 166, 'use_sma': True, 'use_atr': True, 'use_adx': True, 'use_ema': True, 'use_spike': True, 'rsi_required': False, 'edge_k': 1.457107803822983, 'edge_cap': 0.9135715070698014, 'bull_strategy': 'mean_reversion', 'bull_bb_std_mult': 2.1809173785520857, 'bull_rsi_os': 51, 'bull_rsi_ob': 87, 'bull_adx_thresh': 8.911233737048194, 'bull_atr_min_pct': 0.021602874271557874, 'bull_atr_max_pct': 0.14604343034952633, 'bull_tp_mult': 2.578848584178661, 'bull_tsl_mult': 0.831595404341362, 'bull_time_stop': 66, 'bull_use_sma': False, 'bull_use_ema': True, 'bull_use_atr': True, 'bull_use_adx': True, 'bull_use_spike': False, 'bull_rsi_required': True, 'bear_strategy': 'breakout', 'bear_bb_std_mult': 1.8889478537320556, 'bear_rsi_os': 40, 'bear_rsi_ob': 75, 'bear_adx_thresh': 14.17867237938764, 'bear_atr_min_pct': 0.002254208192018825, 'bear_atr_max_pct': 0.11035866511479796, 'bear_tp_mult': 2.577845109088948, 'bear_tsl_mult': 0.8451209004868214, 'bear_time_stop': 84, 'bear_use_sma': True, 'bear_use_ema': False, 'bear_use_atr': False, 'bear_use_adx': True, 'bear_use_spike': True, 'bear_rsi_required': False, 'sideways_strategy': 'breakout', 'sideways_bb_std_mult': 3.2268163058768287, 'sideways_rsi_os': 21, 'sideways_rsi_ob': 81, 'sideways_adx_thresh': 11.43130395117581, 'sideways_atr_min_pct': 0.019855943504281517, 'sideways_atr_max_pct': 0.0698474339847221, 'sideways_tp_mult': 1.6696441790193843, 'sideways_tsl_mult': 0.39509383086293665, 'sideways_time_stop': 135, 'sideways_use_sma': False, 'sideways_use_ema': True, 'sideways_use_atr': True, 'sideways_use_adx': True, 'sideways_use_spike': True, 'sideways_rsi_required': False}.
[I 2025-08-30 15:34:11,067] Trial 494 finished with values: [-1000000000.0, 1000000000.0] and parameters: {'p_sma': 8, 'p_std': 18, 'p_atr': 23, 'p_adx': 25, 'rsi_period': 9, 'ema1': 24, 'ema2': 15, 'slip_atr_k': 0.00043421900932010774, 'slip_spread_k': 0.7025909453436439, 'spread_hl_frac': 0.029070380739527016, 'bb_std_mult': 0.751894044075025, 'rsi_os': 27, 'rsi_ob': 57, 'vol_spike': 0.21673314881370775, 'adx_thresh': 20.102769355508972, 'atr_min_pct': 7.8332360689444e-06, 'atr_max_pct': 0.012936403278265826, 'tp_mult': 1.492449976841872, 'tsl_mult': 0.38523786494646073, 'strategy': 'mean_reversion', 'time_stop': 169, 'use_sma': True, 'use_atr': True, 'use_adx': False, 'use_ema': True, 'use_spike': True, 'rsi_required': True, 'edge_k': 1.25270039054495, 'edge_cap': 0.9563247456096052, 'bull_strategy': 'mean_reversion', 'bull_bb_std_mult': 0.8411572148460573, 'bull_rsi_os': 49, 'bull_rsi_ob': 87, 'bull_adx_thresh': 9.305447757263442, 'bull_atr_min_pct': 0.019891348297166638, 'bull_atr_max_pct': 0.1090197368988515, 'bull_tp_mult': 2.578954875970711, 'bull_tsl_mult': 0.8647919936427976, 'bull_time_stop': 55, 'bull_use_sma': False, 'bull_use_ema': False, 'bull_use_atr': True, 'bull_use_adx': True, 'bull_use_spike': False, 'bull_rsi_required': True, 'bear_strategy': 'breakout', 'bear_bb_std_mult': 1.7617052542305347, 'bear_rsi_os': 6, 'bear_rsi_ob': 75, 'bear_adx_thresh': 15.442343187149836, 'bear_atr_min_pct': 0.0018846386465657637, 'bear_atr_max_pct': 0.1106956742740861, 'bear_tp_mult': 2.650266415723603, 'bear_tsl_mult': 0.8503632105288434, 'bear_time_stop': 96, 'bear_use_sma': False, 'bear_use_ema': True, 'bear_use_atr': False, 'bear_use_adx': True, 'bear_use_spike': False, 'bear_rsi_required': False, 'sideways_strategy': 'breakout', 'sideways_bb_std_mult': 3.2044703398264196, 'sideways_rsi_os': 23, 'sideways_rsi_ob': 81, 'sideways_adx_thresh': 11.558962053080517, 'sideways_atr_min_pct': 0.0195482478183323, 'sideways_atr_max_pct': 0.0676621605079664, 'sideways_tp_mult': 1.199382486139212, 'sideways_tsl_mult': 0.40248441631338744, 'sideways_time_stop': 132, 'sideways_use_sma': False, 'sideways_use_ema': True, 'sideways_use_atr': True, 'sideways_use_adx': True, 'sideways_use_spike': True, 'sideways_rsi_required': False}.
[I 2025-08-30 15:34:12,110] Trial 498 finished with values: [-1000000000.0, 1000000000.0] and parameters: {'p_sma': 8, 'p_std': 20, 'p_atr': 12, 'p_adx': 15, 'rsi_period': 9, 'ema1': 24, 'ema2': 37, 'slip_atr_k': 0.10029349022904828, 'slip_spread_k': 0.7201125661431977, 'spread_hl_frac': 0.03707309490302969, 'bb_std_mult': 0.5062792410253214, 'rsi_os': 31, 'rsi_ob': 53, 'vol_spike': 0.2131901696886076, 'adx_thresh': 32.40553747469839, 'atr_min_pct': 0.02610995502860116, 'atr_max_pct': 0.021267998839735923, 'tp_mult': 1.466720711018878, 'tsl_mult': 0.36033630985436904, 'strategy': 'mean_reversion', 'time_stop': 163, 'use_sma': False, 'use_atr': True, 'use_adx': True, 'use_ema': True, 'use_spike': True, 'rsi_required': False, 'edge_k': 1.2383289852969517, 'edge_cap': 0.9176266028890874, 'bull_strategy': 'breakout', 'bull_bb_std_mult': 1.6298049420401735, 'bull_rsi_os': 51, 'bull_rsi_ob': 87, 'bull_adx_thresh': 10.429023639900883, 'bull_atr_min_pct': 0.021454772123542055, 'bull_atr_max_pct': 0.10911955431351776, 'bull_tp_mult': 2.5847100107461514, 'bull_tsl_mult': 0.8924118056054454, 'bull_time_stop': 64, 'bull_use_sma': False, 'bull_use_ema': True, 'bull_use_atr': True, 'bull_use_adx': True, 'bull_use_spike': False, 'bull_rsi_required': False, 'bear_strategy': 'mean_reversion', 'bear_bb_std_mult': 1.8589334153859887, 'bear_rsi_os': 40, 'bear_rsi_ob': 77, 'bear_adx_thresh': 15.676479731958336, 'bear_atr_min_pct': 0.002195443894476025, 'bear_atr_max_pct': 0.11826213665232686, 'bear_tp_mult': 2.575804258732192, 'bear_tsl_mult': 0.8775579245157703, 'bear_time_stop': 87, 'bear_use_sma': True, 'bear_use_ema': False, 'bear_use_atr': False, 'bear_use_adx': True, 'bear_use_spike': True, 'bear_rsi_required': False, 'sideways_strategy': 'breakout', 'sideways_bb_std_mult': 3.0958477960025905, 'sideways_rsi_os': 21, 'sideways_rsi_ob': 77, 'sideways_adx_thresh': 11.373608274177057, 'sideways_atr_min_pct': 0.0196715382729321, 'sideways_atr_max_pct': 0.06965917025347038, 'sideways_tp_mult': 1.8302038326455456, 'sideways_tsl_mult': 0.3922820207458478, 'sideways_time_stop': 122, 'sideways_use_sma': False, 'sideways_use_ema': True, 'sideways_use_atr': True, 'sideways_use_adx': True, 'sideways_use_spike': True, 'sideways_rsi_required': False}.
[I 2025-08-30 15:34:53,658] Trial 502 finished with values: [-1000000000.0, 1000000000.0] and parameters: {'p_sma': 5, 'p_std': 48, 'p_atr': 13, 'p_adx': 25, 'rsi_period': 8, 'ema1': 24, 'ema2': 37, 'slip_atr_k': 0.14380164253906944, 'slip_spread_k': 0.8411819867057637, 'spread_hl_frac': 0.0216847659645436, 'bb_std_mult': 0.8954408107089871, 'rsi_os': 32, 'rsi_ob': 50, 'vol_spike': 0.22687464009322164, 'adx_thresh': 8.909644035165096, 'atr_min_pct': 0.015025938021605031, 'atr_max_pct': 0.04872494878873983, 'tp_mult': 1.4141141666738042, 'tsl_mult': 0.3045570916991663, 'strategy': 'breakout', 'time_stop': 46, 'use_sma': False, 'use_atr': True, 'use_adx': True, 'use_ema': True, 'use_spike': True, 'rsi_required': False, 'edge_k': 1.5393675231365453, 'edge_cap': 0.9637210316457051, 'bull_strategy': 'breakout', 'bull_bb_std_mult': 1.5573603221662824, 'bull_rsi_os': 6, 'bull_rsi_ob': 88, 'bull_adx_thresh': 10.39803455347042, 'bull_atr_min_pct': 0.01923246038615571, 'bull_atr_max_pct': 0.1018796169837064, 'bull_tp_mult': 2.4571393222389974, 'bull_tsl_mult': 0.8898607135182999, 'bull_time_stop': 51, 'bull_use_sma': False, 'bull_use_ema': True, 'bull_use_atr': True, 'bull_use_adx': True, 'bull_use_spike': True, 'bull_rsi_required': False, 'bear_strategy': 'mean_reversion', 'bear_bb_std_mult': 1.8555697547945051, 'bear_rsi_os': 15, 'bear_rsi_ob': 77, 'bear_adx_thresh': 15.932545126703582, 'bear_atr_min_pct': 0.016712777504790506, 'bear_atr_max_pct': 0.10763878487891909, 'bear_tp_mult': 1.1864150326078367, 'bear_tsl_mult': 0.8274417642822616, 'bear_time_stop': 78, 'bear_use_sma': True, 'bear_use_ema': False, 'bear_use_atr': False, 'bear_use_adx': True, 'bear_use_spike': True, 'bear_rsi_required': True, 'sideways_strategy': 'mean_reversion', 'sideways_bb_std_mult': 3.092502391563176, 'sideways_rsi_os': 9, 'sideways_rsi_ob': 78, 'sideways_adx_thresh': 11.0504480151748, 'sideways_atr_min_pct': 0.01885861013917776, 'sideways_atr_max_pct': 0.06074679080622606, 'sideways_tp_mult': 1.7494155686956492, 'sideways_tsl_mult': 0.37564925304423674, 'sideways_time_stop': 123, 'sideways_use_sma': True, 'sideways_use_ema': False, 'sideways_use_atr': True, 'sideways_use_adx': True, 'sideways_use_spike': True, 'sideways_rsi_required': True}.
[I 2025-08-30 15:34:55,775] Trial 501 finished with values: [-1000000000.0, 1000000000.0] and parameters: {'p_sma': 5, 'p_std': 47, 'p_atr': 25, 'p_adx': 15, 'rsi_period': 7, 'ema1': 24, 'ema2': 18, 'slip_atr_k': 0.0004982416829247037, 'slip_spread_k': 0.39439707425178505, 'spread_hl_frac': 0.008020875415939386, 'bb_std_mult': 0.5067580030327958, 'rsi_os': 30, 'rsi_ob': 50, 'vol_spike': 0.22657996540928088, 'adx_thresh': 30.352251166904644, 'atr_min_pct': 0.019771804389874248, 'atr_max_pct': 0.020805123133014164, 'tp_mult': 1.5172098455342307, 'tsl_mult': 0.3146506237239376, 'strategy': 'breakout', 'time_stop': 160, 'use_sma': False, 'use_atr': True, 'use_adx': True, 'use_ema': True, 'use_spike': True, 'rsi_required': False, 'edge_k': 0.6153929780452143, 'edge_cap': 0.9601053780463122, 'bull_strategy': 'breakout', 'bull_bb_std_mult': 1.5735186851622691, 'bull_rsi_os': 48, 'bull_rsi_ob': 88, 'bull_adx_thresh': 10.026239340863084, 'bull_atr_min_pct': 0.021336455374667967, 'bull_atr_max_pct': 0.10133378523037762, 'bull_tp_mult': 2.3953535467805644, 'bull_tsl_mult': 0.8932581808203842, 'bull_time_stop': 62, 'bull_use_sma': False, 'bull_use_ema': True, 'bull_use_atr': True, 'bull_use_adx': True, 'bull_use_spike': True, 'bull_rsi_required': False, 'bear_strategy': 'mean_reversion', 'bear_bb_std_mult': 1.8566220529971955, 'bear_rsi_os': 25, 'bear_rsi_ob': 77, 'bear_adx_thresh': 15.783690877863668, 'bear_atr_min_pct': 0.017783378380088193, 'bear_atr_max_pct': 0.11784655133215365, 'bear_tp_mult': 2.6737072319983497, 'bear_tsl_mult': 0.8251036273700444, 'bear_time_stop': 88, 'bear_use_sma': True, 'bear_use_ema': False, 'bear_use_atr': False, 'bear_use_adx': True, 'bear_use_spike': True, 'bear_rsi_required': True, 'sideways_strategy': 'breakout', 'sideways_bb_std_mult': 2.4285623493187565, 'sideways_rsi_os': 25, 'sideways_rsi_ob': 78, 'sideways_adx_thresh': 11.007672977265337, 'sideways_atr_min_pct': 0.018679964309396037, 'sideways_atr_max_pct': 0.06979382747049306, 'sideways_tp_mult': 1.272279139348178, 'sideways_tsl_mult': 0.3828792240479565, 'sideways_time_stop': 121, 'sideways_use_sma': False, 'sideways_use_ema': True, 'sideways_use_atr': True, 'sideways_use_adx': True, 'sideways_use_spike': True, 'sideways_rsi_required': False}.
[I 2025-08-30 15:34:57,024] Trial 499 finished with values: [-1000000000.0, 1000000000.0] and parameters: {'p_sma': 9, 'p_std': 21, 'p_atr': 13, 'p_adx': 15, 'rsi_period': 9, 'ema1': 24, 'ema2': 22, 'slip_atr_k': 2.6740692395793673e-05, 'slip_spread_k': 0.9160270799766494, 'spread_hl_frac': 0.010628717202051056, 'bb_std_mult': 0.8678663423923098, 'rsi_os': 32, 'rsi_ob': 71, 'vol_spike': 0.20190843237330444, 'adx_thresh': 8.858726218184767, 'atr_min_pct': 8.970314705046036e-05, 'atr_max_pct': 0.12744058899734162, 'tp_mult': 1.4255382910063061, 'tsl_mult': 0.35853290341172234, 'strategy': 'mean_reversion', 'time_stop': 166, 'use_sma': False, 'use_atr': True, 'use_adx': True, 'use_ema': True, 'use_spike': True, 'rsi_required': False, 'edge_k': 1.2887049855223123, 'edge_cap': 0.9162667131969003, 'bull_strategy': 'breakout', 'bull_bb_std_mult': 2.0618595273032283, 'bull_rsi_os': 48, 'bull_rsi_ob': 87, 'bull_adx_thresh': 8.780602435237498, 'bull_atr_min_pct': 0.021169073577289716, 'bull_atr_max_pct': 0.1455493975725693, 'bull_tp_mult': 2.4716517816047734, 'bull_tsl_mult': 0.897143348749211, 'bull_time_stop': 52, 'bull_use_sma': False, 'bull_use_ema': True, 'bull_use_atr': True, 'bull_use_adx': True, 'bull_use_spike': True, 'bull_rsi_required': False, 'bear_strategy': 'mean_reversion', 'bear_bb_std_mult': 1.861011135989896, 'bear_rsi_os': 40, 'bear_rsi_ob': 77, 'bear_adx_thresh': 15.951968391522444, 'bear_atr_min_pct': 0.00667283513297145, 'bear_atr_max_pct': 0.11861399555313722, 'bear_tp_mult': 2.679297260666103, 'bear_tsl_mult': 0.8048742184353367, 'bear_time_stop': 87, 'bear_use_sma': True, 'bear_use_ema': False, 'bear_use_atr': False, 'bear_use_adx': True, 'bear_use_spike': True, 'bear_rsi_required': True, 'sideways_strategy': 'breakout', 'sideways_bb_std_mult': 3.1040551009677424, 'sideways_rsi_os': 9, 'sideways_rsi_ob': 78, 'sideways_adx_thresh': 11.393095442950845, 'sideways_atr_min_pct': 0.019857774461412986, 'sideways_atr_max_pct': 0.06994270560127469, 'sideways_tp_mult': 1.2816553777930038, 'sideways_tsl_mult': 0.6252819542788508, 'sideways_time_stop': 136, 'sideways_use_sma': False, 'sideways_use_ema': True, 'sideways_use_atr': True, 'sideways_use_adx': True, 'sideways_use_spike': True, 'sideways_rsi_required': False}.
[I 2025-08-30 15:34:58,875] Trial 500 finished with values: [-0.021252526136046113, 0.02112820931856305] and parameters: {'p_sma': 5, 'p_std': 22, 'p_atr': 13, 'p_adx': 11, 'rsi_period': 7, 'ema1': 24, 'ema2': 22, 'slip_atr_k': 1.8162808753655036e-05, 'slip_spread_k': 0.902173931355485, 'spread_hl_frac': 0.03688713791402026, 'bb_std_mult': 0.5148521556996812, 'rsi_os': 32, 'rsi_ob': 47, 'vol_spike': 0.2127527300170162, 'adx_thresh': 9.181850062565978, 'atr_min_pct': 0.019427121274938834, 'atr_max_pct': 0.04817262128657663, 'tp_mult': 1.2025701507221593, 'tsl_mult': 0.3155277526716594, 'strategy': 'breakout', 'time_stop': 158, 'use_sma': False, 'use_atr': True, 'use_adx': True, 'use_ema': True, 'use_spike': True, 'rsi_required': False, 'edge_k': 1.550468081571753, 'edge_cap': 0.9631185441657163, 'bull_strategy': 'breakout', 'bull_bb_std_mult': 1.5523772386984567, 'bull_rsi_os': 48, 'bull_rsi_ob': 87, 'bull_adx_thresh': 10.369115277783497, 'bull_atr_min_pct': 0.019731201114113073, 'bull_atr_max_pct': 0.10140964821697177, 'bull_tp_mult': 2.4724654523419054, 'bull_tsl_mult': 0.8836686651462042, 'bull_time_stop': 63, 'bull_use_sma': False, 'bull_use_ema': True, 'bull_use_atr': True, 'bull_use_adx': True, 'bull_use_spike': True, 'bull_rsi_required': False, 'bear_strategy': 'mean_reversion', 'bear_bb_std_mult': 1.852374353609358, 'bear_rsi_os': 25, 'bear_rsi_ob': 77, 'bear_adx_thresh': 15.471723774413443, 'bear_atr_min_pct': 0.0003065128863192091, 'bear_atr_max_pct': 0.11811546966393965, 'bear_tp_mult': 2.6750565531597816, 'bear_tsl_mult': 0.794262797665625, 'bear_time_stop': 98, 'bear_use_sma': True, 'bear_use_ema': False, 'bear_use_atr': False, 'bear_use_adx': True, 'bear_use_spike': True, 'bear_rsi_required': True, 'sideways_strategy': 'breakout', 'sideways_bb_std_mult': 3.0949456913614917, 'sideways_rsi_os': 25, 'sideways_rsi_ob': 83, 'sideways_adx_thresh': 10.796655451432953, 'sideways_atr_min_pct': 0.018937896157540914, 'sideways_atr_max_pct': 0.06302701840357808, 'sideways_tp_mult': 1.5962954321670741, 'sideways_tsl_mult': 0.6196154094854824, 'sideways_time_stop': 122, 'sideways_use_sma': False, 'sideways_use_ema': True, 'sideways_use_atr': True, 'sideways_use_adx': True, 'sideways_use_spike': True, 'sideways_rsi_required': False}.
[I 2025-08-30 15:35:44,829] Trial 505 finished with values: [-1000000000.0, 1000000000.0] and parameters: {'p_sma': 9, 'p_std': 22, 'p_atr': 12, 'p_adx': 25, 'rsi_period': 14, 'ema1': 23, 'ema2': 40, 'slip_atr_k': 0.04952657975453223, 'slip_spread_k': 0.6524639624843064, 'spread_hl_frac': 0.04272023401155359, 'bb_std_mult': 0.6841150949127702, 'rsi_os': 27, 'rsi_ob': 68, 'vol_spike': 0.21209445655992876, 'adx_thresh': 29.253811738304016, 'atr_min_pct': 0.0231637027718564, 'atr_max_pct': 0.1075581475881262, 'tp_mult': 1.5170193639502962, 'tsl_mult': 0.3301927563379267, 'strategy': 'breakout', 'time_stop': 35, 'use_sma': False, 'use_atr': False, 'use_adx': True, 'use_ema': False, 'use_spike': False, 'rsi_required': False, 'edge_k': 1.3552402473671545, 'edge_cap': 0.9657633181209367, 'bull_strategy': 'breakout', 'bull_bb_std_mult': 1.6497566774789862, 'bull_rsi_os': 49, 'bull_rsi_ob': 88, 'bull_adx_thresh': 10.554209344654085, 'bull_atr_min_pct': 0.01947167822941755, 'bull_atr_max_pct': 0.09727223761885435, 'bull_tp_mult': 1.9438938584984091, 'bull_tsl_mult': 0.8619236544128499, 'bull_time_stop': 70, 'bull_use_sma': True, 'bull_use_ema': True, 'bull_use_atr': False, 'bull_use_adx': True, 'bull_use_spike': True, 'bull_rsi_required': False, 'bear_strategy': 'mean_reversion', 'bear_bb_std_mult': 1.6672698944234765, 'bear_rsi_os': 25, 'bear_rsi_ob': 76, 'bear_adx_thresh': 15.22316153651151, 'bear_atr_min_pct': 0.0030940495517725983, 'bear_atr_max_pct': 0.0577505658984218, 'bear_tp_mult': 2.6802949001857095, 'bear_tsl_mult': 0.9039874425659487, 'bear_time_stop': 99, 'bear_use_sma': True, 'bear_use_ema': False, 'bear_use_atr': True, 'bear_use_adx': False, 'bear_use_spike': True, 'bear_rsi_required': True, 'sideways_strategy': 'mean_reversion', 'sideways_bb_std_mult': 3.137489558688536, 'sideways_rsi_os': 15, 'sideways_rsi_ob': 79, 'sideways_adx_thresh': 5.0345866475788, 'sideways_atr_min_pct': 0.018903176113908664, 'sideways_atr_max_pct': 0.06519657773158523, 'sideways_tp_mult': 1.1421744360006874, 'sideways_tsl_mult': 0.5585732080345192, 'sideways_time_stop': 124, 'sideways_use_sma': True, 'sideways_use_ema': False, 'sideways_use_atr': False, 'sideways_use_adx': False, 'sideways_use_spike': False, 'sideways_rsi_required': True}.
