[I 2025-08-30 15:00:33,997] Trial 322 finished with values: [-0.008116520543403172, 0.008167123859428868] and parameters: {'p_sma': 49, 'p_std': 34, 'p_atr': 16, 'p_adx': 30, 'rsi_period': 50, 'ema1': 10, 'ema2': 49, 'slip_atr_k': 0.016801303199772317, 'slip_spread_k': 0.31152258120561366, 'spread_hl_frac': 0.00024925357582251603, 'bb_std_mult': 3.0111772603847657, 'rsi_os': 25, 'rsi_ob': 89, 'vol_spike': 0.24935001392816786, 'adx_thresh': 10.183180816030381, 'atr_min_pct': 0.005969149044940489, 'atr_max_pct': 0.10040409948772894, 'tp_mult': 2.573760955116582, 'tsl_mult': 0.43763005058596965, 'strategy': 'breakout', 'time_stop': 65, 'use_sma': False, 'use_atr': False, 'use_adx': True, 'use_ema': False, 'use_spike': False, 'rsi_required': False, 'edge_k': 0.7122211605322046, 'edge_cap': 0.8194627015265303, 'bull_strategy': 'breakout', 'bull_bb_std_mult': 2.4207559999854915, 'bull_rsi_os': 53, 'bull_rsi_ob': 69, 'bull_adx_thresh': 31.551247433488832, 'bull_atr_min_pct': 0.0003908618109491701, 'bull_atr_max_pct': 0.09814298962816834, 'bull_tp_mult': 1.106820090769751, 'bull_tsl_mult': 0.9918172734067455, 'bull_time_stop': 134, 'bull_use_sma': True, 'bull_use_ema': True, 'bull_use_atr': True, 'bull_use_adx': False, 'bull_use_spike': True, 'bull_rsi_required': False, 'bear_strategy': 'mean_reversion', 'bear_bb_std_mult': 3.268359151665557, 'bear_rsi_os': 26, 'bear_rsi_ob': 82, 'bear_adx_thresh': 14.9127948108327, 'bear_atr_min_pct': 0.025432565962848146, 'bear_atr_max_pct': 0.021087122653121647, 'bear_tp_mult': 1.0100102969345124, 'bear_tsl_mult': 0.6824915475106214, 'bear_time_stop': 266, 'bear_use_sma': True, 'bear_use_ema': False, 'bear_use_atr': True, 'bear_use_adx': True, 'bear_use_spike': True, 'bear_rsi_required': True, 'sideways_strategy': 'mean_reversion', 'sideways_bb_std_mult': 1.238578834812133, 'sideways_rsi_os': 37, 'sideways_rsi_ob': 55, 'sideways_adx_thresh': 19.791606711004803, 'sideways_atr_min_pct': 0.023797382314595977, 'sideways_atr_max_pct': 0.09599875207357036, 'sideways_tp_mult': 2.4011186795501667, 'sideways_tsl_mult': 0.9997391876219872, 'sideways_time_stop': 84, 'sideways_use_sma': True, 'sideways_use_ema': False, 'sideways_use_atr': True, 'sideways_use_adx': True, 'sideways_use_spike': True, 'sideways_rsi_required': True}.
[I 2025-08-30 15:01:08,924] Trial 326 finished with values: [-1000000000.0, 1000000000.0] and parameters: {'p_sma': 26, 'p_std': 36, 'p_atr': 29, 'p_adx': 30, 'rsi_period': 51, 'ema1': 5, 'ema2': 48, 'slip_atr_k': 0.1657856744402727, 'slip_spread_k': 0.2930634693054613, 'spread_hl_frac': 0.0010813326939830624, 'bb_std_mult': 3.032137814424836, 'rsi_os': 32, 'rsi_ob': 90, 'vol_spike': 0.2049476501293086, 'adx_thresh': 12.185700345814517, 'atr_min_pct': 0.005696719335366553, 'atr_max_pct': 0.098576543954853, 'tp_mult': 2.5841699806973097, 'tsl_mult': 0.47317378862171333, 'strategy': 'breakout', 'time_stop': 275, 'use_sma': False, 'use_atr': False, 'use_adx': True, 'use_ema': False, 'use_spike': False, 'rsi_required': False, 'edge_k': 0.26324781829225463, 'edge_cap': 0.7992026603841477, 'bull_strategy': 'breakout', 'bull_bb_std_mult': 2.5234131995539255, 'bull_rsi_os': 54, 'bull_rsi_ob': 63, 'bull_adx_thresh': 32.60841893758572, 'bull_atr_min_pct': 0.000579755553476263, 'bull_atr_max_pct': 0.09202801255396384, 'bull_tp_mult': 2.582044194733498, 'bull_tsl_mult': 0.967043708629069, 'bull_time_stop': 136, 'bull_use_sma': True, 'bull_use_ema': True, 'bull_use_atr': True, 'bull_use_adx': False, 'bull_use_spike': True, 'bull_rsi_required': False, 'bear_strategy': 'mean_reversion', 'bear_bb_std_mult': 3.034271472078371, 'bear_rsi_os': 23, 'bear_rsi_ob': 82, 'bear_adx_thresh': 15.158702298613719, 'bear_atr_min_pct': 0.026111041627044678, 'bear_atr_max_pct': 0.020031011432359393, 'bear_tp_mult': 1.1845223373620222, 'bear_tsl_mult': 0.6580709262975619, 'bear_time_stop': 267, 'bear_use_sma': True, 'bear_use_ema': False, 'bear_use_atr': True, 'bear_use_adx': True, 'bear_use_spike': True, 'bear_rsi_required': True, 'sideways_strategy': 'mean_reversion', 'sideways_bb_std_mult': 1.0613814969524125, 'sideways_rsi_os': 33, 'sideways_rsi_ob': 56, 'sideways_adx_thresh': 19.007403574506927, 'sideways_atr_min_pct': 0.023424320617611627, 'sideways_atr_max_pct': 0.09326180755757074, 'sideways_tp_mult': 2.409858193382895, 'sideways_tsl_mult': 0.9736792019797079, 'sideways_time_stop': 80, 'sideways_use_sma': True, 'sideways_use_ema': False, 'sideways_use_atr': True, 'sideways_use_adx': True, 'sideways_use_spike': True, 'sideways_rsi_required': True}.
[I 2025-08-30 15:01:09,393] Trial 327 finished with values: [-1000000000.0, 1000000000.0] and parameters: {'p_sma': 20, 'p_std': 36, 'p_atr': 17, 'p_adx': 30, 'rsi_period': 50, 'ema1': 11, 'ema2': 48, 'slip_atr_k': 0.015974032726009956, 'slip_spread_k': 0.2905829102537868, 'spread_hl_frac': 0.0017495650407908492, 'bb_std_mult': 2.9078690032804153, 'rsi_os': 38, 'rsi_ob': 90, 'vol_spike': 0.24000069852143333, 'adx_thresh': 12.356917927080454, 'atr_min_pct': 0.008736670912596027, 'atr_max_pct': 0.09963555052435934, 'tp_mult': 2.6149357091070007, 'tsl_mult': 0.4941078518802409, 'strategy': 'breakout', 'time_stop': 274, 'use_sma': False, 'use_atr': False, 'use_adx': True, 'use_ema': False, 'use_spike': False, 'rsi_required': False, 'edge_k': 0.24651534204224823, 'edge_cap': 0.7975530540204755, 'bull_strategy': 'breakout', 'bull_bb_std_mult': 2.512962935967592, 'bull_rsi_os': 54, 'bull_rsi_ob': 71, 'bull_adx_thresh': 32.64169356731916, 'bull_atr_min_pct': 0.00046464553227241773, 'bull_atr_max_pct': 0.09145858938084771, 'bull_tp_mult': 2.937200487331721, 'bull_tsl_mult': 0.9653593098038625, 'bull_time_stop': 221, 'bull_use_sma': True, 'bull_use_ema': True, 'bull_use_atr': True, 'bull_use_adx': False, 'bull_use_spike': True, 'bull_rsi_required': False, 'bear_strategy': 'mean_reversion', 'bear_bb_std_mult': 3.0404353620502382, 'bear_rsi_os': 26, 'bear_rsi_ob': 82, 'bear_adx_thresh': 15.159055466917042, 'bear_atr_min_pct': 0.02617489728778582, 'bear_atr_max_pct': 0.01889128207167973, 'bear_tp_mult': 2.9303466603860855, 'bear_tsl_mult': 0.6601293618109445, 'bear_time_stop': 267, 'bear_use_sma': True, 'bear_use_ema': False, 'bear_use_atr': True, 'bear_use_adx': True, 'bear_use_spike': True, 'bear_rsi_required': True, 'sideways_strategy': 'mean_reversion', 'sideways_bb_std_mult': 1.54686326077874, 'sideways_rsi_os': 36, 'sideways_rsi_ob': 56, 'sideways_adx_thresh': 19.124208402155187, 'sideways_atr_min_pct': 0.023564608939411643, 'sideways_atr_max_pct': 0.09161517218860546, 'sideways_tp_mult': 2.401292847468527, 'sideways_tsl_mult': 0.9582774423875481, 'sideways_time_stop': 80, 'sideways_use_sma': True, 'sideways_use_ema': False, 'sideways_use_atr': True, 'sideways_use_adx': True, 'sideways_use_spike': True, 'sideways_rsi_required': True}.
[I 2025-08-30 15:01:09,544] Trial 328 finished with values: [-1000000000.0, 1000000000.0] and parameters: {'p_sma': 25, 'p_std': 36, 'p_atr': 29, 'p_adx': 30, 'rsi_period': 51, 'ema1': 11, 'ema2': 48, 'slip_atr_k': 0.01224766121648185, 'slip_spread_k': 0.28599433029394783, 'spread_hl_frac': 0.002110810560435062, 'bb_std_mult': 2.9128101980870964, 'rsi_os': 31, 'rsi_ob': 91, 'vol_spike': 0.267829911302803, 'adx_thresh': 12.532026698146522, 'atr_min_pct': 0.006820506889061537, 'atr_max_pct': 0.09822836456606561, 'tp_mult': 2.453689687605758, 'tsl_mult': 0.4958107204253075, 'strategy': 'breakout', 'time_stop': 276, 'use_sma': False, 'use_atr': False, 'use_adx': True, 'use_ema': False, 'use_spike': False, 'rsi_required': False, 'edge_k': 1.0195963358345066, 'edge_cap': 0.7974911454841938, 'bull_strategy': 'breakout', 'bull_bb_std_mult': 2.5236453678981365, 'bull_rsi_os': 54, 'bull_rsi_ob': 62, 'bull_adx_thresh': 32.4682545115658, 'bull_atr_min_pct': 0.0003780320973923851, 'bull_atr_max_pct': 0.09212228982235769, 'bull_tp_mult': 2.1398492724959115, 'bull_tsl_mult': 0.9622484522707069, 'bull_time_stop': 228, 'bull_use_sma': True, 'bull_use_ema': True, 'bull_use_atr': True, 'bull_use_adx': False, 'bull_use_spike': True, 'bull_rsi_required': False, 'bear_strategy': 'mean_reversion', 'bear_bb_std_mult': 3.0523196967064736, 'bear_rsi_os': 24, 'bear_rsi_ob': 80, 'bear_adx_thresh': 6.412353405293979, 'bear_atr_min_pct': 0.02688347127184705, 'bear_atr_max_pct': 0.01792023085698421, 'bear_tp_mult': 2.9245820269038667, 'bear_tsl_mult': 0.6622976162254315, 'bear_time_stop': 238, 'bear_use_sma': True, 'bear_use_ema': False, 'bear_use_atr': True, 'bear_use_adx': True, 'bear_use_spike': True, 'bear_rsi_required': True, 'sideways_strategy': 'mean_reversion', 'sideways_bb_std_mult': 3.2068514831511283, 'sideways_rsi_os': 34, 'sideways_rsi_ob': 56, 'sideways_adx_thresh': 19.247924819906885, 'sideways_atr_min_pct': 0.023385742211595742, 'sideways_atr_max_pct': 0.10211172107920559, 'sideways_tp_mult': 2.3576928535536634, 'sideways_tsl_mult': 0.9678506972843542, 'sideways_time_stop': 79, 'sideways_use_sma': True, 'sideways_use_ema': False, 'sideways_use_atr': True, 'sideways_use_adx': True, 'sideways_use_spike': True, 'sideways_rsi_required': True}.
[I 2025-08-30 15:01:09,728] Trial 325 finished with values: [-1000000000.0, 1000000000.0] and parameters: {'p_sma': 25, 'p_std': 34, 'p_atr': 29, 'p_adx': 30, 'rsi_period': 51, 'ema1': 10, 'ema2': 49, 'slip_atr_k': 0.017409840597625507, 'slip_spread_k': 0.2816631650946872, 'spread_hl_frac': 0.0006133480728219048, 'bb_std_mult': 3.0290489962142426, 'rsi_os': 38, 'rsi_ob': 89, 'vol_spike': 0.2050443261023872, 'adx_thresh': 10.386973650051793, 'atr_min_pct': 0.007047849940705689, 'atr_max_pct': 0.09934666134564532, 'tp_mult': 2.5729146575043607, 'tsl_mult': 0.5024982636106897, 'strategy': 'breakout', 'time_stop': 274, 'use_sma': False, 'use_atr': False, 'use_adx': True, 'use_ema': False, 'use_spike': False, 'rsi_required': False, 'edge_k': 0.2624666957902213, 'edge_cap': 0.7938018098115343, 'bull_strategy': 'breakout', 'bull_bb_std_mult': 2.427518656183544, 'bull_rsi_os': 54, 'bull_rsi_ob': 67, 'bull_adx_thresh': 32.364126087087826, 'bull_atr_min_pct': 0.0004704375344895614, 'bull_atr_max_pct': 0.09973443122460572, 'bull_tp_mult': 2.953547556524068, 'bull_tsl_mult': 0.9691029427382111, 'bull_time_stop': 136, 'bull_use_sma': True, 'bull_use_ema': True, 'bull_use_atr': True, 'bull_use_adx': False, 'bull_use_spike': True, 'bull_rsi_required': False, 'bear_strategy': 'mean_reversion', 'bear_bb_std_mult': 3.079379099812697, 'bear_rsi_os': 24, 'bear_rsi_ob': 82, 'bear_adx_thresh': 14.992422678589964, 'bear_atr_min_pct': 0.025877859811309304, 'bear_atr_max_pct': 0.0205547175250314, 'bear_tp_mult': 1.0117367300384772, 'bear_tsl_mult': 0.6632596916199901, 'bear_time_stop': 246, 'bear_use_sma': True, 'bear_use_ema': False, 'bear_use_atr': True, 'bear_use_adx': True, 'bear_use_spike': True, 'bear_rsi_required': True, 'sideways_strategy': 'mean_reversion', 'sideways_bb_std_mult': 0.5276674424274239, 'sideways_rsi_os': 36, 'sideways_rsi_ob': 56, 'sideways_adx_thresh': 19.180291765269125, 'sideways_atr_min_pct': 0.023609594985840362, 'sideways_atr_max_pct': 0.09177289605396147, 'sideways_tp_mult': 2.4054281840560945, 'sideways_tsl_mult': 0.9733652071882098, 'sideways_time_stop': 84, 'sideways_use_sma': True, 'sideways_use_ema': False, 'sideways_use_atr': True, 'sideways_use_adx': True, 'sideways_use_spike': True, 'sideways_rsi_required': True}.
[I 2025-08-30 15:01:42,896] Trial 332 finished with values: [-1000000000.0, 1000000000.0] and parameters: {'p_sma': 40, 'p_std': 35, 'p_atr': 24, 'p_adx': 29, 'rsi_period': 53, 'ema1': 25, 'ema2': 50, 'slip_atr_k': 0.11564390612244035, 'slip_spread_k': 0.34315846986517673, 'spread_hl_frac': 0.028061514422276754, 'bb_std_mult': 2.8192929537782074, 'rsi_os': 36, 'rsi_ob': 92, 'vol_spike': 0.2357789492661676, 'adx_thresh': 11.719002266042002, 'atr_min_pct': 0.004510660899151717, 'atr_max_pct': 0.0955001627503426, 'tp_mult': 1.1148789354155488, 'tsl_mult': 0.4628685957576477, 'strategy': 'breakout', 'time_stop': 255, 'use_sma': False, 'use_atr': False, 'use_adx': True, 'use_ema': False, 'use_spike': False, 'rsi_required': False, 'edge_k': 0.37002765842317514, 'edge_cap': 0.8106428141188081, 'bull_strategy': 'breakout', 'bull_bb_std_mult': 2.6093806509671937, 'bull_rsi_os': 55, 'bull_rsi_ob': 74, 'bull_adx_thresh': 33.82788725686638, 'bull_atr_min_pct': 0.027512637758732285, 'bull_atr_max_pct': 0.09021164229231425, 'bull_tp_mult': 1.91509674357452, 'bull_tsl_mult': 0.9765146788150042, 'bull_time_stop': 126, 'bull_use_sma': True, 'bull_use_ema': True, 'bull_use_atr': True, 'bull_use_adx': False, 'bull_use_spike': True, 'bull_rsi_required': False, 'bear_strategy': 'mean_reversion', 'bear_bb_std_mult': 3.1209828260681167, 'bear_rsi_os': 26, 'bear_rsi_ob': 80, 'bear_adx_thresh': 6.236162226470087, 'bear_atr_min_pct': 0.027456183288010843, 'bear_atr_max_pct': 0.016758716062259642, 'bear_tp_mult': 2.2985376311878944, 'bear_tsl_mult': 0.635673493964682, 'bear_time_stop': 235, 'bear_use_sma': True, 'bear_use_ema': False, 'bear_use_atr': True, 'bear_use_adx': True, 'bear_use_spike': True, 'bear_rsi_required': True, 'sideways_strategy': 'mean_reversion', 'sideways_bb_std_mult': 1.158814947206411, 'sideways_rsi_os': 35, 'sideways_rsi_ob': 51, 'sideways_adx_thresh': 14.249266081773033, 'sideways_atr_min_pct': 0.025164714303264404, 'sideways_atr_max_pct': 0.0932030725697015, 'sideways_tp_mult': 2.3573282060597407, 'sideways_tsl_mult': 0.9812535956688605, 'sideways_time_stop': 87, 'sideways_use_sma': True, 'sideways_use_ema': False, 'sideways_use_atr': True, 'sideways_use_adx': True, 'sideways_use_spike': True, 'sideways_rsi_required': True}.
[I 2025-08-30 15:01:43,347] Trial 329 finished with values: [-1000000000.0, 1000000000.0] and parameters: {'p_sma': 19, 'p_std': 35, 'p_atr': 16, 'p_adx': 30, 'rsi_period': 53, 'ema1': 11, 'ema2': 50, 'slip_atr_k': 0.19988015680031684, 'slip_spread_k': 0.28297843409954404, 'spread_hl_frac': 0.002128697183522694, 'bb_std_mult': 2.9089214128890624, 'rsi_os': 36, 'rsi_ob': 92, 'vol_spike': 0.24006242430435448, 'adx_thresh': 12.586638635865777, 'atr_min_pct': 0.022559290303618112, 'atr_max_pct': 0.09602744922827798, 'tp_mult': 2.4529986503315055, 'tsl_mult': 0.4996281860049072, 'strategy': 'breakout', 'time_stop': 276, 'use_sma': False, 'use_atr': False, 'use_adx': True, 'use_ema': False, 'use_spike': False, 'rsi_required': False, 'edge_k': 0.3651116807835144, 'edge_cap': 0.7934041272365484, 'bull_strategy': 'breakout', 'bull_bb_std_mult': 2.5544246251027274, 'bull_rsi_os': 55, 'bull_rsi_ob': 74, 'bull_adx_thresh': 33.809684926142566, 'bull_atr_min_pct': 1.5886322364661173e-05, 'bull_atr_max_pct': 0.08814593975739898, 'bull_tp_mult': 1.05025010088781, 'bull_tsl_mult': 0.966793144674419, 'bull_time_stop': 219, 'bull_use_sma': True, 'bull_use_ema': True, 'bull_use_atr': True, 'bull_use_adx': False, 'bull_use_spike': True, 'bull_rsi_required': False, 'bear_strategy': 'mean_reversion', 'bear_bb_std_mult': 3.0931215817821243, 'bear_rsi_os': 24, 'bear_rsi_ob': 80, 'bear_adx_thresh': 6.307391696610169, 'bear_atr_min_pct': 0.027198723295872137, 'bear_atr_max_pct': 0.01749981569748897, 'bear_tp_mult': 2.997194557539866, 'bear_tsl_mult': 0.6478210846416642, 'bear_time_stop': 261, 'bear_use_sma': True, 'bear_use_ema': False, 'bear_use_atr': True, 'bear_use_adx': True, 'bear_use_spike': True, 'bear_rsi_required': True, 'sideways_strategy': 'mean_reversion', 'sideways_bb_std_mult': 2.5451328805160154, 'sideways_rsi_os': 36, 'sideways_rsi_ob': 56, 'sideways_adx_thresh': 14.433799519895732, 'sideways_atr_min_pct': 0.010382970770333379, 'sideways_atr_max_pct': 0.09280666450759503, 'sideways_tp_mult': 2.3583461574306375, 'sideways_tsl_mult': 0.9585308724667067, 'sideways_time_stop': 88, 'sideways_use_sma': True, 'sideways_use_ema': False, 'sideways_use_atr': True, 'sideways_use_adx': True, 'sideways_use_spike': True, 'sideways_rsi_required': True}.
[I 2025-08-30 15:01:43,555] Trial 330 finished with values: [-1000000000.0, 1000000000.0] and parameters: {'p_sma': 40, 'p_std': 35, 'p_atr': 16, 'p_adx': 30, 'rsi_period': 53, 'ema1': 27, 'ema2': 50, 'slip_atr_k': 0.02004752813039611, 'slip_spread_k': 0.2842149386046175, 'spread_hl_frac': 0.0020318706409202685, 'bb_std_mult': 2.932027115652387, 'rsi_os': 8, 'rsi_ob': 91, 'vol_spike': 0.2543074279431582, 'adx_thresh': 12.658769324815543, 'atr_min_pct': 0.02266053067944167, 'atr_max_pct': 0.09629566966676666, 'tp_mult': 2.997137975023204, 'tsl_mult': 0.5253537095571228, 'strategy': 'breakout', 'time_stop': 254, 'use_sma': False, 'use_atr': False, 'use_adx': True, 'use_ema': False, 'use_spike': False, 'rsi_required': False, 'edge_k': 0.3749818120240826, 'edge_cap': 0.7839120626978447, 'bull_strategy': 'breakout', 'bull_bb_std_mult': 2.547956555515663, 'bull_rsi_os': 55, 'bull_rsi_ob': 65, 'bull_adx_thresh': 33.74175186691886, 'bull_atr_min_pct': 4.6526869048348876e-05, 'bull_atr_max_pct': 0.08784121535131105, 'bull_tp_mult': 2.091109679961277, 'bull_tsl_mult': 0.9642893179326896, 'bull_time_stop': 127, 'bull_use_sma': True, 'bull_use_ema': True, 'bull_use_atr': True, 'bull_use_adx': False, 'bull_use_spike': True, 'bull_rsi_required': False, 'bear_strategy': 'mean_reversion', 'bear_bb_std_mult': 3.105880408030964, 'bear_rsi_os': 24, 'bear_rsi_ob': 80, 'bear_adx_thresh': 9.731358767826881, 'bear_atr_min_pct': 0.026392933226203393, 'bear_atr_max_pct': 0.017683988815275536, 'bear_tp_mult': 2.92340710344397, 'bear_tsl_mult': 0.6374130373435386, 'bear_time_stop': 235, 'bear_use_sma': True, 'bear_use_ema': False, 'bear_use_atr': True, 'bear_use_adx': True, 'bear_use_spike': True, 'bear_rsi_required': True, 'sideways_strategy': 'mean_reversion', 'sideways_bb_std_mult': 2.8658695471916302, 'sideways_rsi_os': 34, 'sideways_rsi_ob': 47, 'sideways_adx_thresh': 14.233426416378842, 'sideways_atr_min_pct': 0.024178240928064275, 'sideways_atr_max_pct': 0.10319668524611741, 'sideways_tp_mult': 2.5185206564963543, 'sideways_tsl_mult': 0.9751095263019229, 'sideways_time_stop': 89, 'sideways_use_sma': True, 'sideways_use_ema': False, 'sideways_use_atr': True, 'sideways_use_adx': True, 'sideways_use_spike': True, 'sideways_rsi_required': True}.
[I 2025-08-30 15:01:43,705] Trial 331 finished with values: [-1000000000.0, 1000000000.0] and parameters: {'p_sma': 40, 'p_std': 35, 'p_atr': 16, 'p_adx': 30, 'rsi_period': 52, 'ema1': 25, 'ema2': 20, 'slip_atr_k': 0.1292740229134541, 'slip_spread_k': 0.34914828359407557, 'spread_hl_frac': 0.0009322977923811703, 'bb_std_mult': 2.783654946020341, 'rsi_os': 50, 'rsi_ob': 92, 'vol_spike': 0.2247912578831427, 'adx_thresh': 11.42549677381761, 'atr_min_pct': 0.0047353002816385385, 'atr_max_pct': 0.09580399081528641, 'tp_mult': 2.9907000293311414, 'tsl_mult': 0.4610288818232397, 'strategy': 'breakout', 'time_stop': 256, 'use_sma': False, 'use_atr': False, 'use_adx': True, 'use_ema': False, 'use_spike': False, 'rsi_required': False, 'edge_k': 0.3674507142223978, 'edge_cap': 0.7733236383880052, 'bull_strategy': 'breakout', 'bull_bb_std_mult': 1.128451232973267, 'bull_rsi_os': 55, 'bull_rsi_ob': 64, 'bull_adx_thresh': 33.408291603795874, 'bull_atr_min_pct': 0.0007137974060795105, 'bull_atr_max_pct': 0.08852553224871522, 'bull_tp_mult': 1.8024662766307369, 'bull_tsl_mult': 0.9743083502192508, 'bull_time_stop': 276, 'bull_use_sma': True, 'bull_use_ema': True, 'bull_use_atr': True, 'bull_use_adx': False, 'bull_use_spike': True, 'bull_rsi_required': False, 'bear_strategy': 'mean_reversion', 'bear_bb_std_mult': 3.1468255735298065, 'bear_rsi_os': 25, 'bear_rsi_ob': 80, 'bear_adx_thresh': 6.8772934539579405, 'bear_atr_min_pct': 0.026327706501031944, 'bear_atr_max_pct': 0.01618431842496583, 'bear_tp_mult': 2.997023740160706, 'bear_tsl_mult': 0.6356689143435826, 'bear_time_stop': 260, 'bear_use_sma': True, 'bear_use_ema': False, 'bear_use_atr': True, 'bear_use_adx': True, 'bear_use_spike': True, 'bear_rsi_required': True, 'sideways_strategy': 'mean_reversion', 'sideways_bb_std_mult': 1.3403378493251406, 'sideways_rsi_os': 36, 'sideways_rsi_ob': 54, 'sideways_adx_thresh': 20.150377260931336, 'sideways_atr_min_pct': 0.025225249371829777, 'sideways_atr_max_pct': 0.09266131310352814, 'sideways_tp_mult': 2.5069210379360465, 'sideways_tsl_mult': 0.9775370969988622, 'sideways_time_stop': 87, 'sideways_use_sma': True, 'sideways_use_ema': False, 'sideways_use_atr': True, 'sideways_use_adx': True, 'sideways_use_spike': True, 'sideways_rsi_required': True}.
