[I 2025-08-30 16:24:14,782] Trial 748 finished with values: [-1000000000.0, 1000000000.0] and parameters: {'p_sma': 8, 'p_std': 19, 'p_atr': 12, 'p_adx': 25, 'rsi_period': 7, 'ema1': 25, 'ema2': 58, 'slip_atr_k': 0.0927410366778473, 'slip_spread_k': 0.9414591467095377, 'spread_hl_frac': 0.0303061853120803, 'bb_std_mult': 0.8051264109593926, 'rsi_os': 26, 'rsi_ob': 87, 'vol_spike': 0.21101385437039147, 'adx_thresh': 31.335734852174646, 'atr_min_pct': 0.01859684254831839, 'atr_max_pct': 0.10971433780441182, 'tp_mult': 1.465501778559575, 'tsl_mult': 0.2255394660472605, 'strategy': 'mean_reversion', 'time_stop': 281, 'use_sma': True, 'use_atr': False, 'use_adx': True, 'use_ema': False, 'use_spike': False, 'rsi_required': False, 'edge_k': 0.9250364424628259, 'edge_cap': 0.4633005572816043, 'bull_strategy': 'breakout', 'bull_bb_std_mult': 1.5669446938417413, 'bull_rsi_os': 48, 'bull_rsi_ob': 90, 'bull_adx_thresh': 18.814051094914543, 'bull_atr_min_pct': 0.02012516912772361, 'bull_atr_max_pct': 0.07532893919049997, 'bull_tp_mult': 2.536762789560874, 'bull_tsl_mult': 0.7950219044276983, 'bull_time_stop': 62, 'bull_use_sma': False, 'bull_use_ema': True, 'bull_use_atr': True, 'bull_use_adx': False, 'bull_use_spike': True, 'bull_rsi_required': False, 'bear_strategy': 'mean_reversion', 'bear_bb_std_mult': 1.5900309557892336, 'bear_rsi_os': 17, 'bear_rsi_ob': 73, 'bear_adx_thresh': 15.481370430967544, 'bear_atr_min_pct': 0.003408146575957791, 'bear_atr_max_pct': 0.1125750758622264, 'bear_tp_mult': 1.998343136145393, 'bear_tsl_mult': 0.8166284850148807, 'bear_time_stop': 106, 'bear_use_sma': False, 'bear_use_ema': False, 'bear_use_atr': True, 'bear_use_adx': True, 'bear_use_spike': True, 'bear_rsi_required': True, 'sideways_strategy': 'mean_reversion', 'sideways_bb_std_mult': 3.180000114057215, 'sideways_rsi_os': 14, 'sideways_rsi_ob': 80, 'sideways_adx_thresh': 11.580637765751826, 'sideways_atr_min_pct': 0.0052182761988104395, 'sideways_atr_max_pct': 0.115252979129229, 'sideways_tp_mult': 1.250712118755902, 'sideways_tsl_mult': 0.33870104956488384, 'sideways_time_stop': 229, 'sideways_use_sma': True, 'sideways_use_ema': False, 'sideways_use_atr': True, 'sideways_use_adx': True, 'sideways_use_spike': True, 'sideways_rsi_required': False}.
[I 2025-08-30 16:24:15,833] Trial 750 finished with values: [-1000000000.0, 1000000000.0] and parameters: {'p_sma': 33, 'p_std': 19, 'p_atr': 12, 'p_adx': 25, 'rsi_period': 7, 'ema1': 16, 'ema2': 36, 'slip_atr_k': 0.22364120840924684, 'slip_spread_k': 0.9457387517755087, 'spread_hl_frac': 0.030023627232347576, 'bb_std_mult': 0.8108096412359567, 'rsi_os': 28, 'rsi_ob': 53, 'vol_spike': 0.007379299811365897, 'adx_thresh': 32.751914443155464, 'atr_min_pct': 0.018634713887842595, 'atr_max_pct': 0.10826790242316646, 'tp_mult': 1.4473336513333177, 'tsl_mult': 0.36463111403190923, 'strategy': 'breakout', 'time_stop': 145, 'use_sma': False, 'use_atr': False, 'use_adx': True, 'use_ema': False, 'use_spike': False, 'rsi_required': False, 'edge_k': 0.6543869759854781, 'edge_cap': 0.9507973929838522, 'bull_strategy': 'breakout', 'bull_bb_std_mult': 3.487189325606555, 'bull_rsi_os': 48, 'bull_rsi_ob': 91, 'bull_adx_thresh': 10.347050413807809, 'bull_atr_min_pct': 0.021266923640912705, 'bull_atr_max_pct': 0.10925450122918326, 'bull_tp_mult': 2.5363446409863837, 'bull_tsl_mult': 0.8420605778601167, 'bull_time_stop': 286, 'bull_use_sma': True, 'bull_use_ema': True, 'bull_use_atr': True, 'bull_use_adx': False, 'bull_use_spike': True, 'bull_rsi_required': False, 'bear_strategy': 'mean_reversion', 'bear_bb_std_mult': 1.588352802883798, 'bear_rsi_os': 17, 'bear_rsi_ob': 75, 'bear_adx_thresh': 22.83051994551058, 'bear_atr_min_pct': 0.003243593537702323, 'bear_atr_max_pct': 0.10639995801687349, 'bear_tp_mult': 1.9827835097189161, 'bear_tsl_mult': 0.7787436881198759, 'bear_time_stop': 110, 'bear_use_sma': False, 'bear_use_ema': False, 'bear_use_atr': True, 'bear_use_adx': True, 'bear_use_spike': False, 'bear_rsi_required': True, 'sideways_strategy': 'mean_reversion', 'sideways_bb_std_mult': 3.1667665668689846, 'sideways_rsi_os': 22, 'sideways_rsi_ob': 77, 'sideways_adx_thresh': 29.418110993789846, 'sideways_atr_min_pct': 0.006931191153462812, 'sideways_atr_max_pct': 0.06385180588833449, 'sideways_tp_mult': 2.5997719765849325, 'sideways_tsl_mult': 0.3362944348562306, 'sideways_time_stop': 117, 'sideways_use_sma': True, 'sideways_use_ema': False, 'sideways_use_atr': True, 'sideways_use_adx': True, 'sideways_use_spike': False, 'sideways_rsi_required': True}.
[I 2025-08-30 16:24:16,683] Trial 749 finished with values: [-0.03133581989167089, 0.031208526540392537] and parameters: {'p_sma': 7, 'p_std': 19, 'p_atr': 22, 'p_adx': 10, 'rsi_period': 8, 'ema1': 15, 'ema2': 36, 'slip_atr_k': 0.08973671751620488, 'slip_spread_k': 0.7012249151797334, 'spread_hl_frac': 0.0054070735118461515, 'bb_std_mult': 0.7912640907250786, 'rsi_os': 28, 'rsi_ob': 88, 'vol_spike': 0.21462507111941617, 'adx_thresh': 10.644086946159504, 'atr_min_pct': 0.006202254331114203, 'atr_max_pct': 0.1084282952014223, 'tp_mult': 1.2241974121181247, 'tsl_mult': 0.3698039939174764, 'strategy': 'mean_reversion', 'time_stop': 39, 'use_sma': True, 'use_atr': False, 'use_adx': True, 'use_ema': False, 'use_spike': False, 'rsi_required': False, 'edge_k': 0.658299931560232, 'edge_cap': 0.9117178722034834, 'bull_strategy': 'breakout', 'bull_bb_std_mult': 2.9938680080659474, 'bull_rsi_os': 48, 'bull_rsi_ob': 95, 'bull_adx_thresh': 10.325254279587046, 'bull_atr_min_pct': 0.02115795898107348, 'bull_atr_max_pct': 0.016086813117056897, 'bull_tp_mult': 2.854291497950593, 'bull_tsl_mult': 0.8907010320960996, 'bull_time_stop': 62, 'bull_use_sma': False, 'bull_use_ema': True, 'bull_use_atr': True, 'bull_use_adx': False, 'bull_use_spike': True, 'bull_rsi_required': False, 'bear_strategy': 'mean_reversion', 'bear_bb_std_mult': 1.547588478257924, 'bear_rsi_os': 27, 'bear_rsi_ob': 72, 'bear_adx_thresh': 14.663148858944203, 'bear_atr_min_pct': 0.0009422851337943545, 'bear_atr_max_pct': 0.04248928354679139, 'bear_tp_mult': 2.7395192711952125, 'bear_tsl_mult': 0.783321106037644, 'bear_time_stop': 99, 'bear_use_sma': False, 'bear_use_ema': False, 'bear_use_atr': True, 'bear_use_adx': True, 'bear_use_spike': False, 'bear_rsi_required': True, 'sideways_strategy': 'mean_reversion', 'sideways_bb_std_mult': 3.179303072979789, 'sideways_rsi_os': 15, 'sideways_rsi_ob': 80, 'sideways_adx_thresh': 34.89162676461836, 'sideways_atr_min_pct': 0.010560826048521852, 'sideways_atr_max_pct': 0.06889967729122624, 'sideways_tp_mult': 1.2866341399384205, 'sideways_tsl_mult': 0.3523250629107788, 'sideways_time_stop': 44, 'sideways_use_sma': True, 'sideways_use_ema': False, 'sideways_use_atr': True, 'sideways_use_adx': True, 'sideways_use_spike': False, 'sideways_rsi_required': False}.
[I 2025-08-30 16:24:16,942] Trial 747 finished with values: [-1000000000.0, 1000000000.0] and parameters: {'p_sma': 8, 'p_std': 48, 'p_atr': 10, 'p_adx': 12, 'rsi_period': 7, 'ema1': 21, 'ema2': 36, 'slip_atr_k': 0.0052274515621399545, 'slip_spread_k': 0.8860027495816333, 'spread_hl_frac': 0.006757912338809401, 'bb_std_mult': 0.8102716737592605, 'rsi_os': 28, 'rsi_ob': 88, 'vol_spike': 0.007788768185065298, 'adx_thresh': 11.047917554052962, 'atr_min_pct': 0.01600144196112804, 'atr_max_pct': 0.1100731964453298, 'tp_mult': 1.4545977343117824, 'tsl_mult': 0.31942569917382424, 'strategy': 'breakout', 'time_stop': 246, 'use_sma': False, 'use_atr': False, 'use_adx': True, 'use_ema': False, 'use_spike': False, 'rsi_required': False, 'edge_k': 0.6349095821390716, 'edge_cap': 0.9110771088093466, 'bull_strategy': 'breakout', 'bull_bb_std_mult': 2.979225910036143, 'bull_rsi_os': 40, 'bull_rsi_ob': 86, 'bull_adx_thresh': 9.236547952151668, 'bull_atr_min_pct': 0.021228732693223576, 'bull_atr_max_pct': 0.07488050666732841, 'bull_tp_mult': 2.362713175378833, 'bull_tsl_mult': 0.916642923172979, 'bull_time_stop': 62, 'bull_use_sma': True, 'bull_use_ema': True, 'bull_use_atr': True, 'bull_use_adx': False, 'bull_use_spike': True, 'bull_rsi_required': False, 'bear_strategy': 'mean_reversion', 'bear_bb_std_mult': 2.0307108433071583, 'bear_rsi_os': 35, 'bear_rsi_ob': 90, 'bear_adx_thresh': 15.712569022816771, 'bear_atr_min_pct': 0.023801223637137006, 'bear_atr_max_pct': 0.1129412244031629, 'bear_tp_mult': 2.7520584507533714, 'bear_tsl_mult': 0.8196153623037685, 'bear_time_stop': 13, 'bear_use_sma': True, 'bear_use_ema': False, 'bear_use_atr': True, 'bear_use_adx': True, 'bear_use_spike': True, 'bear_rsi_required': True, 'sideways_strategy': 'mean_reversion', 'sideways_bb_std_mult': 3.171367133884889, 'sideways_rsi_os': 22, 'sideways_rsi_ob': 80, 'sideways_adx_thresh': 11.418684648135926, 'sideways_atr_min_pct': 0.006939348483606616, 'sideways_atr_max_pct': 0.06983740254554423, 'sideways_tp_mult': 1.2924230149133038, 'sideways_tsl_mult': 0.3421838776259059, 'sideways_time_stop': 277, 'sideways_use_sma': True, 'sideways_use_ema': False, 'sideways_use_atr': True, 'sideways_use_adx': True, 'sideways_use_spike': True, 'sideways_rsi_required': True}.
[I 2025-08-30 16:24:57,364] Trial 754 finished with values: [-1000000000.0, 1000000000.0] and parameters: {'p_sma': 12, 'p_std': 22, 'p_atr': 11, 'p_adx': 26, 'rsi_period': 11, 'ema1': 25, 'ema2': 38, 'slip_atr_k': 0.0172959683604278, 'slip_spread_k': 0.3881754270883916, 'spread_hl_frac': 0.01012249861735575, 'bb_std_mult': 0.6458028127417625, 'rsi_os': 42, 'rsi_ob': 86, 'vol_spike': 0.22037687991677252, 'adx_thresh': 5.573385612850469, 'atr_min_pct': 0.007490779105505031, 'atr_max_pct': 0.11265410967392742, 'tp_mult': 1.7778902545423745, 'tsl_mult': 0.694965898382525, 'strategy': 'breakout', 'time_stop': 222, 'use_sma': False, 'use_atr': True, 'use_adx': False, 'use_ema': True, 'use_spike': True, 'rsi_required': True, 'edge_k': 0.4938881924305113, 'edge_cap': 0.969966366257872, 'bull_strategy': 'mean_reversion', 'bull_bb_std_mult': 1.4231344180210195, 'bull_rsi_os': 50, 'bull_rsi_ob': 85, 'bull_adx_thresh': 9.68828300195615, 'bull_atr_min_pct': 0.019416297359871607, 'bull_atr_max_pct': 0.09998009682007354, 'bull_tp_mult': 2.6218415039650593, 'bull_tsl_mult': 0.05986824316972139, 'bull_time_stop': 71, 'bull_use_sma': True, 'bull_use_ema': True, 'bull_use_atr': False, 'bull_use_adx': True, 'bull_use_spike': False, 'bull_rsi_required': False, 'bear_strategy': 'breakout', 'bear_bb_std_mult': 2.1384592538289477, 'bear_rsi_os': 25, 'bear_rsi_ob': 75, 'bear_adx_thresh': 17.142236988669843, 'bear_atr_min_pct': 0.013040245571081308, 'bear_atr_max_pct': 0.08880705753713047, 'bear_tp_mult': 2.5938014696567446, 'bear_tsl_mult': 0.9393452110350277, 'bear_time_stop': 91, 'bear_use_sma': True, 'bear_use_ema': False, 'bear_use_atr': False, 'bear_use_adx': True, 'bear_use_spike': True, 'bear_rsi_required': False, 'sideways_strategy': 'mean_reversion', 'sideways_bb_std_mult': 0.6674328967123149, 'sideways_rsi_os': 45, 'sideways_rsi_ob': 48, 'sideways_adx_thresh': 10.418059783606974, 'sideways_atr_min_pct': 0.02020504708821925, 'sideways_atr_max_pct': 0.10633906416659106, 'sideways_tp_mult': 1.498189665333535, 'sideways_tsl_mult': 0.7773623452064371, 'sideways_time_stop': 125, 'sideways_use_sma': True, 'sideways_use_ema': False, 'sideways_use_atr': False, 'sideways_use_adx': False, 'sideways_use_spike': True, 'sideways_rsi_required': True}.
[I 2025-08-30 16:24:58,171] Trial 751 finished with values: [-0.021683581801800522, 0.0216164729561091] and parameters: {'p_sma': 7, 'p_std': 20, 'p_atr': 10, 'p_adx': 27, 'rsi_period': 9, 'ema1': 25, 'ema2': 36, 'slip_atr_k': 0.13974623186455706, 'slip_spread_k': 0.08055949929321066, 'spread_hl_frac': 0.01080609807464062, 'bb_std_mult': 0.6418195082096881, 'rsi_os': 24, 'rsi_ob': 75, 'vol_spike': 0.21828586229460653, 'adx_thresh': 7.214334541956658, 'atr_min_pct': 0.014997393255883345, 'atr_max_pct': 0.10808721217617465, 'tp_mult': 1.538363526622246, 'tsl_mult': 0.87399139885458, 'strategy': 'breakout', 'time_stop': 106, 'use_sma': False, 'use_atr': True, 'use_adx': False, 'use_ema': False, 'use_spike': True, 'rsi_required': False, 'edge_k': 0.6321458051782874, 'edge_cap': 0.9669088308751462, 'bull_strategy': 'breakout', 'bull_bb_std_mult': 3.0775688530435668, 'bull_rsi_os': 22, 'bull_rsi_ob': 85, 'bull_adx_thresh': 10.424382109124226, 'bull_atr_min_pct': 0.021064280670152532, 'bull_atr_max_pct': 0.1269465307053525, 'bull_tp_mult': 2.5421818990362466, 'bull_tsl_mult': 0.9333418355129083, 'bull_time_stop': 49, 'bull_use_sma': True, 'bull_use_ema': True, 'bull_use_atr': True, 'bull_use_adx': True, 'bull_use_spike': True, 'bull_rsi_required': False, 'bear_strategy': 'mean_reversion', 'bear_bb_std_mult': 2.129699173634263, 'bear_rsi_os': 27, 'bear_rsi_ob': 75, 'bear_adx_thresh': 22.72463289387045, 'bear_atr_min_pct': 0.0006150352374805971, 'bear_atr_max_pct': 0.1341499590776139, 'bear_tp_mult': 2.7647570708861195, 'bear_tsl_mult': 0.785176392064892, 'bear_time_stop': 14, 'bear_use_sma': True, 'bear_use_ema': False, 'bear_use_atr': False, 'bear_use_adx': True, 'bear_use_spike': False, 'bear_rsi_required': True, 'sideways_strategy': 'mean_reversion', 'sideways_bb_std_mult': 1.4536799775315752, 'sideways_rsi_os': 22, 'sideways_rsi_ob': 77, 'sideways_adx_thresh': 27.17308611009652, 'sideways_atr_min_pct': 0.020276961301802485, 'sideways_atr_max_pct': 0.06487856560060552, 'sideways_tp_mult': 1.513311445331683, 'sideways_tsl_mult': 0.3495981008625468, 'sideways_time_stop': 117, 'sideways_use_sma': True, 'sideways_use_ema': False, 'sideways_use_atr': True, 'sideways_use_adx': False, 'sideways_use_spike': False, 'sideways_rsi_required': True}.
[I 2025-08-30 16:24:58,866] Trial 752 finished with values: [-0.03459727251207145, 0.03475853097803738] and parameters: {'p_sma': 7, 'p_std': 20, 'p_atr': 14, 'p_adx': 27, 'rsi_period': 9, 'ema1': 25, 'ema2': 39, 'slip_atr_k': 0.17052977231110433, 'slip_spread_k': 0.8915431632032166, 'spread_hl_frac': 0.010288674077095576, 'bb_std_mult': 1.2195728847231715, 'rsi_os': 30, 'rsi_ob': 88, 'vol_spike': 0.21780783000528325, 'adx_thresh': 7.43826603134316, 'atr_min_pct': 0.023109726814825104, 'atr_max_pct': 0.026750630775043957, 'tp_mult': 1.5432031888480024, 'tsl_mult': 0.37966060002776836, 'strategy': 'breakout', 'time_stop': 107, 'use_sma': False, 'use_atr': True, 'use_adx': False, 'use_ema': False, 'use_spike': True, 'rsi_required': False, 'edge_k': 0.6259583108297384, 'edge_cap': 0.21029747777951419, 'bull_strategy': 'mean_reversion', 'bull_bb_std_mult': 1.3990520186180189, 'bull_rsi_os': 40, 'bull_rsi_ob': 95, 'bull_adx_thresh': 9.862406513759565, 'bull_atr_min_pct': 0.019412057351956113, 'bull_atr_max_pct': 0.12752053380843423, 'bull_tp_mult': 2.6218052123193676, 'bull_tsl_mult': 0.12698347816005273, 'bull_time_stop': 71, 'bull_use_sma': True, 'bull_use_ema': True, 'bull_use_atr': True, 'bull_use_adx': True, 'bull_use_spike': True, 'bull_rsi_required': False, 'bear_strategy': 'breakout', 'bear_bb_std_mult': 2.0468108792400157, 'bear_rsi_os': 27, 'bear_rsi_ob': 72, 'bear_adx_thresh': 14.725481172654952, 'bear_atr_min_pct': 0.0007629922685431709, 'bear_atr_max_pct': 0.1023387450557482, 'bear_tp_mult': 2.5998776387918148, 'bear_tsl_mult': 0.8771876951469192, 'bear_time_stop': 92, 'bear_use_sma': True, 'bear_use_ema': False, 'bear_use_atr': False, 'bear_use_adx': True, 'bear_use_spike': True, 'bear_rsi_required': True, 'sideways_strategy': 'mean_reversion', 'sideways_bb_std_mult': 3.266283417789346, 'sideways_rsi_os': 15, 'sideways_rsi_ob': 79, 'sideways_adx_thresh': 11.273689259496484, 'sideways_atr_min_pct': 0.028396997249123382, 'sideways_atr_max_pct': 0.06893552636705867, 'sideways_tp_mult': 1.5111393515804274, 'sideways_tsl_mult': 0.09401163945188706, 'sideways_time_stop': 279, 'sideways_use_sma': True, 'sideways_use_ema': False, 'sideways_use_atr': True, 'sideways_use_adx': False, 'sideways_use_spike': True, 'sideways_rsi_required': True}.
[I 2025-08-30 16:24:59,100] Trial 753 finished with values: [-0.022614473812560543, 0.02267111453774824] and parameters: {'p_sma': 12, 'p_std': 22, 'p_atr': 25, 'p_adx': 26, 'rsi_period': 9, 'ema1': 25, 'ema2': 38, 'slip_atr_k': 0.008999869861040056, 'slip_spread_k': 0.08174952686271625, 'spread_hl_frac': 0.010066797914268774, 'bb_std_mult': 0.6203921226791329, 'rsi_os': 25, 'rsi_ob': 86, 'vol_spike': 0.16310646919801972, 'adx_thresh': 7.2262483061113425, 'atr_min_pct': 0.015149056185903297, 'atr_max_pct': 0.12159373215048169, 'tp_mult': 1.5361499417338444, 'tsl_mult': 0.9150698593661954, 'strategy': 'breakout', 'time_stop': 222, 'use_sma': False, 'use_atr': True, 'use_adx': False, 'use_ema': True, 'use_spike': True, 'rsi_required': True, 'edge_k': 0.6097996052798258, 'edge_cap': 0.9998025728537198, 'bull_strategy': 'mean_reversion', 'bull_bb_std_mult': 1.0561768913773282, 'bull_rsi_os': 50, 'bull_rsi_ob': 85, 'bull_adx_thresh': 9.776752483693029, 'bull_atr_min_pct': 0.01959277833864543, 'bull_atr_max_pct': 0.12620399910946947, 'bull_tp_mult': 2.6217248448722383, 'bull_tsl_mult': 0.8703638651625332, 'bull_time_stop': 50, 'bull_use_sma': True, 'bull_use_ema': True, 'bull_use_atr': False, 'bull_use_adx': True, 'bull_use_spike': False, 'bull_rsi_required': False, 'bear_strategy': 'breakout', 'bear_bb_std_mult': 2.0299166380791096, 'bear_rsi_os': 12, 'bear_rsi_ob': 75, 'bear_adx_thresh': 13.880245261878187, 'bear_atr_min_pct': 0.0016147750672945566, 'bear_atr_max_pct': 0.10441172371612946, 'bear_tp_mult': 2.6122916775049374, 'bear_tsl_mult': 0.9978544539499056, 'bear_time_stop': 94, 'bear_use_sma': True, 'bear_use_ema': False, 'bear_use_atr': False, 'bear_use_adx': True, 'bear_use_spike': True, 'bear_rsi_required': False, 'sideways_strategy': 'mean_reversion', 'sideways_bb_std_mult': 0.7701251272704965, 'sideways_rsi_os': 28, 'sideways_rsi_ob': 65, 'sideways_adx_thresh': 27.13464080006067, 'sideways_atr_min_pct': 0.02046584018253806, 'sideways_atr_max_pct': 0.04904274512900769, 'sideways_tp_mult': 1.1925784877823575, 'sideways_tsl_mult': 0.08965880746125915, 'sideways_time_stop': 23, 'sideways_use_sma': True, 'sideways_use_ema': False, 'sideways_use_atr': False, 'sideways_use_adx': False, 'sideways_use_spike': True, 'sideways_rsi_required': True}.
[I 2025-08-30 16:25:41,365] Trial 757 finished with values: [-1000000000.0, 1000000000.0] and parameters: {'p_sma': 23, 'p_std': 24, 'p_atr': 12, 'p_adx': 25, 'rsi_period': 40, 'ema1': 22, 'ema2': 25, 'slip_atr_k': 0.09963959345957643, 'slip_spread_k': 0.7883917910955458, 'spread_hl_frac': 0.008828147444185388, 'bb_std_mult': 2.28106911891543, 'rsi_os': 12, 'rsi_ob': 87, 'vol_spike': 0.16312824932551814, 'adx_thresh': 8.998076344693683, 'atr_min_pct': 0.006473209395374099, 'atr_max_pct': 0.11396342630176125, 'tp_mult': 1.5776438174285912, 'tsl_mult': 0.3317926528967324, 'strategy': 'breakout', 'time_stop': 169, 'use_sma': False, 'use_atr': False, 'use_adx': True, 'use_ema': True, 'use_spike': False, 'rsi_required': True, 'edge_k': 0.5444291854202367, 'edge_cap': 0.945964790224404, 'bull_strategy': 'breakout', 'bull_bb_std_mult': 2.2401883455187748, 'bull_rsi_os': 50, 'bull_rsi_ob': 69, 'bull_adx_thresh': 14.700716750232107, 'bull_atr_min_pct': 0.01881592981907109, 'bull_atr_max_pct': 0.09902521086338735, 'bull_tp_mult': 2.4955393625796383, 'bull_tsl_mult': 0.3346583791731029, 'bull_time_stop': 270, 'bull_use_sma': True, 'bull_use_ema': False, 'bull_use_atr': False, 'bull_use_adx': True, 'bull_use_spike': False, 'bull_rsi_required': False, 'bear_strategy': 'mean_reversion', 'bear_bb_std_mult': 2.188876779561763, 'bear_rsi_os': 25, 'bear_rsi_ob': 76, 'bear_adx_thresh': 16.19653172779835, 'bear_atr_min_pct': 0.0016526806078866593, 'bear_atr_max_pct': 0.1039823135683176, 'bear_tp_mult': 2.6470083076034356, 'bear_tsl_mult': 0.8572128065015145, 'bear_time_stop': 207, 'bear_use_sma': True, 'bear_use_ema': True, 'bear_use_atr': True, 'bear_use_adx': False, 'bear_use_spike': True, 'bear_rsi_required': False, 'sideways_strategy': 'mean_reversion', 'sideways_bb_std_mult': 3.0956233140794187, 'sideways_rsi_os': 54, 'sideways_rsi_ob': 78, 'sideways_adx_thresh': 10.092077606380283, 'sideways_atr_min_pct': 0.01954430311559314, 'sideways_atr_max_pct': 0.0471797416090514, 'sideways_tp_mult': 1.6271537593657037, 'sideways_tsl_mult': 0.4370990441769667, 'sideways_time_stop': 8, 'sideways_use_sma': True, 'sideways_use_ema': False, 'sideways_use_atr': True, 'sideways_use_adx': True, 'sideways_use_spike': True, 'sideways_rsi_required': True}.
