[I 2025-08-30 16:17:24,391] Trial 711 finished with values: [-1000000000.0, 1000000000.0] and parameters: {'p_sma': 10, 'p_std': 16, 'p_atr': 12, 'p_adx': 25, 'rsi_period': 13, 'ema1': 25, 'ema2': 36, 'slip_atr_k': 0.01506325075894889, 'slip_spread_k': 0.0447992730733362, 'spread_hl_frac': 0.03491304572754442, 'bb_std_mult': 0.6344751349579169, 'rsi_os': 25, 'rsi_ob': 61, 'vol_spike': 0.21005725391403868, 'adx_thresh': 10.316655177010427, 'atr_min_pct': 0.00956730647227817, 'atr_max_pct': 0.08249979968101662, 'tp_mult': 2.996800988213397, 'tsl_mult': 0.3875559770455328, 'strategy': 'breakout', 'time_stop': 118, 'use_sma': False, 'use_atr': False, 'use_adx': True, 'use_ema': False, 'use_spike': False, 'rsi_required': False, 'edge_k': 1.583501463757625, 'edge_cap': 0.9859677500618957, 'bull_strategy': 'breakout', 'bull_bb_std_mult': 1.5645381287984277, 'bull_rsi_os': 26, 'bull_rsi_ob': 60, 'bull_adx_thresh': 23.284752558099104, 'bull_atr_min_pct': 0.020703349996456615, 'bull_atr_max_pct': 0.10090815422530738, 'bull_tp_mult': 2.651728716964506, 'bull_tsl_mult': 0.8567536840362275, 'bull_time_stop': 28, 'bull_use_sma': True, 'bull_use_ema': True, 'bull_use_atr': True, 'bull_use_adx': True, 'bull_use_spike': True, 'bull_rsi_required': False, 'bear_strategy': 'mean_reversion', 'bear_bb_std_mult': 1.2332415038199118, 'bear_rsi_os': 27, 'bear_rsi_ob': 74, 'bear_adx_thresh': 27.83347935224348, 'bear_atr_min_pct': 0.007881826279823749, 'bear_atr_max_pct': 0.09979997699150712, 'bear_tp_mult': 1.820250293684312, 'bear_tsl_mult': 0.8062883954037564, 'bear_time_stop': 105, 'bear_use_sma': True, 'bear_use_ema': False, 'bear_use_atr': True, 'bear_use_adx': True, 'bear_use_spike': True, 'bear_rsi_required': True, 'sideways_strategy': 'mean_reversion', 'sideways_bb_std_mult': 2.4104269604577486, 'sideways_rsi_os': 11, 'sideways_rsi_ob': 95, 'sideways_adx_thresh': 11.404920109189884, 'sideways_atr_min_pct': 0.019992528560427984, 'sideways_atr_max_pct': 0.1293286374911925, 'sideways_tp_mult': 1.3972323158682314, 'sideways_tsl_mult': 0.5351066318403968, 'sideways_time_stop': 129, 'sideways_use_sma': True, 'sideways_use_ema': False, 'sideways_use_atr': True, 'sideways_use_adx': True, 'sideways_use_spike': True, 'sideways_rsi_required': True}.
[I 2025-08-30 16:17:24,964] Trial 712 finished with values: [-1000000000.0, 1000000000.0] and parameters: {'p_sma': 5, 'p_std': 53, 'p_atr': 12, 'p_adx': 25, 'rsi_period': 8, 'ema1': 25, 'ema2': 36, 'slip_atr_k': 0.18155228961358327, 'slip_spread_k': 0.7271169749175124, 'spread_hl_frac': 0.028796120497862503, 'bb_std_mult': 0.6342280839030887, 'rsi_os': 26, 'rsi_ob': 61, 'vol_spike': 0.21088192267304987, 'adx_thresh': 10.926071093526467, 'atr_min_pct': 0.004696796042693845, 'atr_max_pct': 0.13138155943294172, 'tp_mult': 1.519087037398638, 'tsl_mult': 0.38154768074053064, 'strategy': 'breakout', 'time_stop': 119, 'use_sma': False, 'use_atr': False, 'use_adx': False, 'use_ema': False, 'use_spike': False, 'rsi_required': False, 'edge_k': 0.600034459060313, 'edge_cap': 0.8716622097798935, 'bull_strategy': 'breakout', 'bull_bb_std_mult': 1.5956425681332915, 'bull_rsi_os': 13, 'bull_rsi_ob': 86, 'bull_adx_thresh': 23.541308823271734, 'bull_atr_min_pct': 0.020122812562694947, 'bull_atr_max_pct': 0.13057710459759675, 'bull_tp_mult': 2.2925396367826396, 'bull_tsl_mult': 0.8609930294191639, 'bull_time_stop': 64, 'bull_use_sma': True, 'bull_use_ema': True, 'bull_use_atr': True, 'bull_use_adx': True, 'bull_use_spike': True, 'bull_rsi_required': False, 'bear_strategy': 'mean_reversion', 'bear_bb_std_mult': 1.2341723078758768, 'bear_rsi_os': 27, 'bear_rsi_ob': 76, 'bear_adx_thresh': 27.811433889681297, 'bear_atr_min_pct': 0.007095128699093095, 'bear_atr_max_pct': 0.10552311829328924, 'bear_tp_mult': 1.6325828482526565, 'bear_tsl_mult': 0.4948466242714469, 'bear_time_stop': 104, 'bear_use_sma': True, 'bear_use_ema': False, 'bear_use_atr': True, 'bear_use_adx': True, 'bear_use_spike': True, 'bear_rsi_required': True, 'sideways_strategy': 'mean_reversion', 'sideways_bb_std_mult': 3.0909927994360267, 'sideways_rsi_os': 11, 'sideways_rsi_ob': 68, 'sideways_adx_thresh': 11.345570483873974, 'sideways_atr_min_pct': 0.020567761817718647, 'sideways_atr_max_pct': 0.05337552002862019, 'sideways_tp_mult': 1.2624498262746744, 'sideways_tsl_mult': 0.37412586688105387, 'sideways_time_stop': 137, 'sideways_use_sma': True, 'sideways_use_ema': False, 'sideways_use_atr': True, 'sideways_use_adx': True, 'sideways_use_spike': True, 'sideways_rsi_required': True}.
[I 2025-08-30 16:17:25,181] Trial 713 finished with values: [-1000000000.0, 1000000000.0] and parameters: {'p_sma': 10, 'p_std': 23, 'p_atr': 12, 'p_adx': 25, 'rsi_period': 7, 'ema1': 12, 'ema2': 36, 'slip_atr_k': 0.0001224880198160021, 'slip_spread_k': 0.7245936153569644, 'spread_hl_frac': 0.02134724701078024, 'bb_std_mult': 0.6478958609361414, 'rsi_os': 26, 'rsi_ob': 61, 'vol_spike': 0.22885994823505162, 'adx_thresh': 10.183724900092036, 'atr_min_pct': 0.0007733067535805726, 'atr_max_pct': 0.0724729306274249, 'tp_mult': 1.5227968761074224, 'tsl_mult': 0.34672888994218326, 'strategy': 'breakout', 'time_stop': 226, 'use_sma': False, 'use_atr': True, 'use_adx': False, 'use_ema': False, 'use_spike': True, 'rsi_required': False, 'edge_k': 0.6143666749186698, 'edge_cap': 0.43444149587663616, 'bull_strategy': 'breakout', 'bull_bb_std_mult': 1.4246300635688431, 'bull_rsi_os': 48, 'bull_rsi_ob': 86, 'bull_adx_thresh': 8.575008271458083, 'bull_atr_min_pct': 0.01114055129808895, 'bull_atr_max_pct': 0.10401820551293559, 'bull_tp_mult': 1.5222810889551504, 'bull_tsl_mult': 0.6076759336568796, 'bull_time_stop': 27, 'bull_use_sma': True, 'bull_use_ema': True, 'bull_use_atr': True, 'bull_use_adx': True, 'bull_use_spike': True, 'bull_rsi_required': False, 'bear_strategy': 'mean_reversion', 'bear_bb_std_mult': 2.5664268646233275, 'bear_rsi_os': 29, 'bear_rsi_ob': 92, 'bear_adx_thresh': 15.536949557421805, 'bear_atr_min_pct': 0.007294885239045248, 'bear_atr_max_pct': 0.10758419578426111, 'bear_tp_mult': 2.5845702277502287, 'bear_tsl_mult': 0.8044334183515509, 'bear_time_stop': 160, 'bear_use_sma': True, 'bear_use_ema': False, 'bear_use_atr': False, 'bear_use_adx': True, 'bear_use_spike': True, 'bear_rsi_required': True, 'sideways_strategy': 'mean_reversion', 'sideways_bb_std_mult': 1.3439612791884885, 'sideways_rsi_os': 11, 'sideways_rsi_ob': 80, 'sideways_adx_thresh': 11.482082434664298, 'sideways_atr_min_pct': 0.0024508623277725086, 'sideways_atr_max_pct': 0.042598755637919775, 'sideways_tp_mult': 1.3941774543715801, 'sideways_tsl_mult': 0.5383112477217826, 'sideways_time_stop': 138, 'sideways_use_sma': True, 'sideways_use_ema': False, 'sideways_use_atr': True, 'sideways_use_adx': False, 'sideways_use_spike': True, 'sideways_rsi_required': True}.
[I 2025-08-30 16:18:06,563] Trial 715 finished with values: [-1000000000.0, 1000000000.0] and parameters: {'p_sma': 9, 'p_std': 24, 'p_atr': 13, 'p_adx': 25, 'rsi_period': 84, 'ema1': 12, 'ema2': 38, 'slip_atr_k': 0.008111300473252673, 'slip_spread_k': 0.6699198183576323, 'spread_hl_frac': 0.011199096169319082, 'bb_std_mult': 0.6776609474161784, 'rsi_os': 26, 'rsi_ob': 86, 'vol_spike': 0.21463821924462512, 'adx_thresh': 18.252936178834968, 'atr_min_pct': 0.004823414081805197, 'atr_max_pct': 0.04710302672430544, 'tp_mult': 1.546314706782386, 'tsl_mult': 0.14011210697302517, 'strategy': 'breakout', 'time_stop': 161, 'use_sma': False, 'use_atr': True, 'use_adx': False, 'use_ema': False, 'use_spike': True, 'rsi_required': False, 'edge_k': 0.04767814924726366, 'edge_cap': 0.9763138339971544, 'bull_strategy': 'breakout', 'bull_bb_std_mult': 1.116944511080311, 'bull_rsi_os': 11, 'bull_rsi_ob': 70, 'bull_adx_thresh': 20.680952383413477, 'bull_atr_min_pct': 0.020280082131270118, 'bull_atr_max_pct': 0.10511686987062256, 'bull_tp_mult': 1.5994668950165178, 'bull_tsl_mult': 0.6118217340675306, 'bull_time_stop': 291, 'bull_use_sma': True, 'bull_use_ema': True, 'bull_use_atr': True, 'bull_use_adx': True, 'bull_use_spike': True, 'bull_rsi_required': False, 'bear_strategy': 'mean_reversion', 'bear_bb_std_mult': 0.6673289501069233, 'bear_rsi_os': 55, 'bear_rsi_ob': 56, 'bear_adx_thresh': 8.355690596108673, 'bear_atr_min_pct': 0.017541591035115697, 'bear_atr_max_pct': 0.10759398180329402, 'bear_tp_mult': 2.787583145166632, 'bear_tsl_mult': 0.9524054991213307, 'bear_time_stop': 100, 'bear_use_sma': True, 'bear_use_ema': False, 'bear_use_atr': False, 'bear_use_adx': True, 'bear_use_spike': True, 'bear_rsi_required': True, 'sideways_strategy': 'mean_reversion', 'sideways_bb_std_mult': 2.732647910270922, 'sideways_rsi_os': 21, 'sideways_rsi_ob': 80, 'sideways_adx_thresh': 10.743471690635218, 'sideways_atr_min_pct': 0.0022601897965021777, 'sideways_atr_max_pct': 0.04366444894828022, 'sideways_tp_mult': 1.3290121108034874, 'sideways_tsl_mult': 0.3250369319364903, 'sideways_time_stop': 135, 'sideways_use_sma': True, 'sideways_use_ema': False, 'sideways_use_atr': True, 'sideways_use_adx': False, 'sideways_use_spike': True, 'sideways_rsi_required': True}.
[I 2025-08-30 16:18:08,010] Trial 717 finished with values: [-0.014706822827584953, 0.014749630187665033] and parameters: {'p_sma': 28, 'p_std': 24, 'p_atr': 13, 'p_adx': 15, 'rsi_period': 10, 'ema1': 7, 'ema2': 10, 'slip_atr_k': 0.008304200188017443, 'slip_spread_k': 0.6672799409445369, 'spread_hl_frac': 0.007041034364253372, 'bb_std_mult': 0.501924573245864, 'rsi_os': 43, 'rsi_ob': 86, 'vol_spike': 0.2620158209828478, 'adx_thresh': 8.73717871801075, 'atr_min_pct': 0.0067454995088797355, 'atr_max_pct': 0.11029296557788418, 'tp_mult': 1.5589952056621852, 'tsl_mult': 0.3219793952240432, 'strategy': 'breakout', 'time_stop': 176, 'use_sma': True, 'use_atr': True, 'use_adx': True, 'use_ema': False, 'use_spike': True, 'rsi_required': False, 'edge_k': 0.491275682109763, 'edge_cap': 0.7149778532754613, 'bull_strategy': 'breakout', 'bull_bb_std_mult': 2.0743048979548497, 'bull_rsi_os': 16, 'bull_rsi_ob': 91, 'bull_adx_thresh': 28.355035866743584, 'bull_atr_min_pct': 0.0124285371508374, 'bull_atr_max_pct': 0.11687580028891749, 'bull_tp_mult': 1.895610303797218, 'bull_tsl_mult': 0.3828616783698373, 'bull_time_stop': 166, 'bull_use_sma': True, 'bull_use_ema': True, 'bull_use_atr': True, 'bull_use_adx': True, 'bull_use_spike': True, 'bull_rsi_required': False, 'bear_strategy': 'mean_reversion', 'bear_bb_std_mult': 1.0131077247023084, 'bear_rsi_os': 34, 'bear_rsi_ob': 56, 'bear_adx_thresh': 31.96909760467531, 'bear_atr_min_pct': 0.0019523845022114757, 'bear_atr_max_pct': 0.11889728334157196, 'bear_tp_mult': 2.6131594437361745, 'bear_tsl_mult': 0.06568305449344991, 'bear_time_stop': 277, 'bear_use_sma': True, 'bear_use_ema': False, 'bear_use_atr': False, 'bear_use_adx': True, 'bear_use_spike': True, 'bear_rsi_required': True, 'sideways_strategy': 'mean_reversion', 'sideways_bb_std_mult': 2.706227752507, 'sideways_rsi_os': 14, 'sideways_rsi_ob': 79, 'sideways_adx_thresh': 10.366920769664041, 'sideways_atr_min_pct': 0.008844067293993733, 'sideways_atr_max_pct': 0.07790750250568357, 'sideways_tp_mult': 1.0575572531157942, 'sideways_tsl_mult': 0.39112031948356607, 'sideways_time_stop': 180, 'sideways_use_sma': True, 'sideways_use_ema': False, 'sideways_use_atr': True, 'sideways_use_adx': False, 'sideways_use_spike': True, 'sideways_rsi_required': True}.
[I 2025-08-30 16:18:08,323] Trial 716 finished with values: [-1000000000.0, 1000000000.0] and parameters: {'p_sma': 34, 'p_std': 24, 'p_atr': 13, 'p_adx': 25, 'rsi_period': 84, 'ema1': 23, 'ema2': 38, 'slip_atr_k': 0.009164347103726475, 'slip_spread_k': 0.6695811825240899, 'spread_hl_frac': 0.020910412437711683, 'bb_std_mult': 1.5962211859233486, 'rsi_os': 28, 'rsi_ob': 86, 'vol_spike': 0.2628610369436087, 'adx_thresh': 8.721101570597337, 'atr_min_pct': 0.0006512032692017576, 'atr_max_pct': 0.11003824544613418, 'tp_mult': 2.914245959678899, 'tsl_mult': 0.3228355977591879, 'strategy': 'breakout', 'time_stop': 175, 'use_sma': False, 'use_atr': True, 'use_adx': False, 'use_ema': False, 'use_spike': True, 'rsi_required': False, 'edge_k': 0.4569052421918025, 'edge_cap': 0.9820458965889304, 'bull_strategy': 'breakout', 'bull_bb_std_mult': 1.304446792293303, 'bull_rsi_os': 15, 'bull_rsi_ob': 87, 'bull_adx_thresh': 8.720694946661126, 'bull_atr_min_pct': 0.019776733520052395, 'bull_atr_max_pct': 0.10437358458530746, 'bull_tp_mult': 1.5278822693503158, 'bull_tsl_mult': 0.6057580714053404, 'bull_time_stop': 161, 'bull_use_sma': True, 'bull_use_ema': True, 'bull_use_atr': True, 'bull_use_adx': True, 'bull_use_spike': True, 'bull_rsi_required': False, 'bear_strategy': 'mean_reversion', 'bear_bb_std_mult': 2.566474033089553, 'bear_rsi_os': 22, 'bear_rsi_ob': 53, 'bear_adx_thresh': 15.540089635849808, 'bear_atr_min_pct': 0.0021540911200949933, 'bear_atr_max_pct': 0.10950431472901308, 'bear_tp_mult': 2.4253017907205296, 'bear_tsl_mult': 0.9050932062256989, 'bear_time_stop': 41, 'bear_use_sma': True, 'bear_use_ema': False, 'bear_use_atr': False, 'bear_use_adx': True, 'bear_use_spike': True, 'bear_rsi_required': True, 'sideways_strategy': 'mean_reversion', 'sideways_bb_std_mult': 3.0977858686194, 'sideways_rsi_os': 22, 'sideways_rsi_ob': 80, 'sideways_adx_thresh': 15.377177087089734, 'sideways_atr_min_pct': 0.021083101483804087, 'sideways_atr_max_pct': 0.07761812732548812, 'sideways_tp_mult': 1.052662154286985, 'sideways_tsl_mult': 0.3145585047666508, 'sideways_time_stop': 127, 'sideways_use_sma': True, 'sideways_use_ema': False, 'sideways_use_atr': True, 'sideways_use_adx': False, 'sideways_use_spike': True, 'sideways_rsi_required': True}.
[I 2025-08-30 16:18:08,515] Trial 714 finished with values: [-0.01549053928449906, 0.015518819358068855] and parameters: {'p_sma': 60, 'p_std': 58, 'p_atr': 13, 'p_adx': 15, 'rsi_period': 7, 'ema1': 12, 'ema2': 38, 'slip_atr_k': 0.009558815592675922, 'slip_spread_k': 0.6730880736428774, 'spread_hl_frac': 0.007032010777655168, 'bb_std_mult': 0.5534939987625223, 'rsi_os': 26, 'rsi_ob': 86, 'vol_spike': 0.11775056682161464, 'adx_thresh': 8.684076587176996, 'atr_min_pct': 0.004710968962411484, 'atr_max_pct': 0.11003922287542114, 'tp_mult': 1.5377136475579447, 'tsl_mult': 0.32088709130207427, 'strategy': 'breakout', 'time_stop': 175, 'use_sma': False, 'use_atr': True, 'use_adx': False, 'use_ema': False, 'use_spike': True, 'rsi_required': False, 'edge_k': 0.46989550981063316, 'edge_cap': 0.9785054234872924, 'bull_strategy': 'breakout', 'bull_bb_std_mult': 3.255384008218174, 'bull_rsi_os': 48, 'bull_rsi_ob': 86, 'bull_adx_thresh': 8.61270546222629, 'bull_atr_min_pct': 0.011371824141010128, 'bull_atr_max_pct': 0.10451843602004982, 'bull_tp_mult': 2.231192372704236, 'bull_tsl_mult': 0.38332325101851794, 'bull_time_stop': 60, 'bull_use_sma': True, 'bull_use_ema': True, 'bull_use_atr': True, 'bull_use_adx': True, 'bull_use_spike': True, 'bull_rsi_required': False, 'bear_strategy': 'mean_reversion', 'bear_bb_std_mult': 2.5819459008962964, 'bear_rsi_os': 29, 'bear_rsi_ob': 76, 'bear_adx_thresh': 18.84784489197025, 'bear_atr_min_pct': 0.0020855186612118437, 'bear_atr_max_pct': 0.033300473512545975, 'bear_tp_mult': 2.3356621468678918, 'bear_tsl_mult': 0.9065111372525778, 'bear_time_stop': 41, 'bear_use_sma': True, 'bear_use_ema': False, 'bear_use_atr': False, 'bear_use_adx': True, 'bear_use_spike': True, 'bear_rsi_required': True, 'sideways_strategy': 'mean_reversion', 'sideways_bb_std_mult': 1.334824143326994, 'sideways_rsi_os': 21, 'sideways_rsi_ob': 80, 'sideways_adx_thresh': 15.248952689514581, 'sideways_atr_min_pct': 0.008731480907298288, 'sideways_atr_max_pct': 0.07218320834238273, 'sideways_tp_mult': 1.3760795971922002, 'sideways_tsl_mult': 0.32956402464373935, 'sideways_time_stop': 136, 'sideways_use_sma': True, 'sideways_use_ema': False, 'sideways_use_atr': True, 'sideways_use_adx': False, 'sideways_use_spike': True, 'sideways_rsi_required': True}.
[I 2025-08-30 16:18:52,048] Trial 719 finished with values: [-1000000000.0, 1000000000.0] and parameters: {'p_sma': 8, 'p_std': 40, 'p_atr': 14, 'p_adx': 17, 'rsi_period': 12, 'ema1': 22, 'ema2': 28, 'slip_atr_k': 0.0761529083089603, 'slip_spread_k': 0.014337452150513963, 'spread_hl_frac': 0.026815807140370386, 'bb_std_mult': 1.0446469523901238, 'rsi_os': 28, 'rsi_ob': 87, 'vol_spike': 0.11765700487921696, 'adx_thresh': 8.82140011796336, 'atr_min_pct': 0.00730637724891678, 'atr_max_pct': 0.013649993593379553, 'tp_mult': 1.8460491951245415, 'tsl_mult': 0.3306511867290302, 'strategy': 'breakout', 'time_stop': 155, 'use_sma': False, 'use_atr': False, 'use_adx': True, 'use_ema': False, 'use_spike': False, 'rsi_required': True, 'edge_k': 0.002016814675066536, 'edge_cap': 0.8952235614538064, 'bull_strategy': 'breakout', 'bull_bb_std_mult': 1.7103131952801418, 'bull_rsi_os': 15, 'bull_rsi_ob': 57, 'bull_adx_thresh': 10.187147725864902, 'bull_atr_min_pct': 0.019647722114146487, 'bull_atr_max_pct': 0.04996138433817056, 'bull_tp_mult': 2.598163981184701, 'bull_tsl_mult': 0.9059293236549194, 'bull_time_stop': 56, 'bull_use_sma': True, 'bull_use_ema': True, 'bull_use_atr': True, 'bull_use_adx': True, 'bull_use_spike': True, 'bull_rsi_required': False, 'bear_strategy': 'mean_reversion', 'bear_bb_std_mult': 1.4425458541938012, 'bear_rsi_os': 26, 'bear_rsi_ob': 76, 'bear_adx_thresh': 28.815132496918604, 'bear_atr_min_pct': 0.003561826210835671, 'bear_atr_max_pct': 0.11407029999102979, 'bear_tp_mult': 2.335888782669683, 'bear_tsl_mult': 0.8966751750478921, 'bear_time_stop': 145, 'bear_use_sma': True, 'bear_use_ema': False, 'bear_use_atr': True, 'bear_use_adx': True, 'bear_use_spike': True, 'bear_rsi_required': False, 'sideways_strategy': 'mean_reversion', 'sideways_bb_std_mult': 3.3953461827740234, 'sideways_rsi_os': 39, 'sideways_rsi_ob': 76, 'sideways_adx_thresh': 28.174909714540533, 'sideways_atr_min_pct': 0.020949915659639294, 'sideways_atr_max_pct': 0.07200443926245233, 'sideways_tp_mult': 1.362543056535301, 'sideways_tsl_mult': 0.22868385897526844, 'sideways_time_stop': 126, 'sideways_use_sma': True, 'sideways_use_ema': False, 'sideways_use_atr': True, 'sideways_use_adx': True, 'sideways_use_spike': True, 'sideways_rsi_required': True}.
[I 2025-08-30 16:18:52,096] Trial 721 finished with values: [-1000000000.0, 1000000000.0] and parameters: {'p_sma': 55, 'p_std': 42, 'p_atr': 14, 'p_adx': 11, 'rsi_period': 9, 'ema1': 27, 'ema2': 33, 'slip_atr_k': 0.1342589600198752, 'slip_spread_k': 0.009544980905734468, 'spread_hl_frac': 0.017355475465342773, 'bb_std_mult': 2.4404813820020648, 'rsi_os': 29, 'rsi_ob': 87, 'vol_spike': 0.08067393782294975, 'adx_thresh': 5.069026003326567, 'atr_min_pct': 0.0072695440988346785, 'atr_max_pct': 0.1145686098387713, 'tp_mult': 1.4019139654408665, 'tsl_mult': 0.35525134769613764, 'strategy': 'breakout', 'time_stop': 154, 'use_sma': True, 'use_atr': False, 'use_adx': True, 'use_ema': False, 'use_spike': False, 'rsi_required': True, 'edge_k': 0.15474639725122807, 'edge_cap': 0.6770255505256422, 'bull_strategy': 'breakout', 'bull_bb_std_mult': 2.2966323462091607, 'bull_rsi_os': 51, 'bull_rsi_ob': 90, 'bull_adx_thresh': 13.074153925433079, 'bull_atr_min_pct': 0.01911730420327007, 'bull_atr_max_pct': 0.09767352585679305, 'bull_tp_mult': 2.605933887612038, 'bull_tsl_mult': 0.9008598712586025, 'bull_time_stop': 278, 'bull_use_sma': True, 'bull_use_ema': True, 'bull_use_atr': True, 'bull_use_adx': True, 'bull_use_spike': True, 'bull_rsi_required': False, 'bear_strategy': 'mean_reversion', 'bear_bb_std_mult': 0.8728431092342603, 'bear_rsi_os': 25, 'bear_rsi_ob': 77, 'bear_adx_thresh': 16.301760678567174, 'bear_atr_min_pct': 0.0037844363249502897, 'bear_atr_max_pct': 0.11053293365436362, 'bear_tp_mult': 2.6970205142705983, 'bear_tsl_mult': 0.44431345815645584, 'bear_time_stop': 97, 'bear_use_sma': True, 'bear_use_ema': False, 'bear_use_atr': True, 'bear_use_adx': True, 'bear_use_spike': True, 'bear_rsi_required': False, 'sideways_strategy': 'mean_reversion', 'sideways_bb_std_mult': 3.0025791637396564, 'sideways_rsi_os': 5, 'sideways_rsi_ob': 79, 'sideways_adx_thresh': 13.31332667390459, 'sideways_atr_min_pct': 0.007698976977051244, 'sideways_atr_max_pct': 0.13633288522070452, 'sideways_tp_mult': 1.6713696786269037, 'sideways_tsl_mult': 0.21281301330508423, 'sideways_time_stop': 16, 'sideways_use_sma': True, 'sideways_use_ema': False, 'sideways_use_atr': True, 'sideways_use_adx': True, 'sideways_use_spike': True, 'sideways_rsi_required': True}.
