[I 2025-08-30 15:25:46,563] Trial 460 finished with values: [-0.0013658645630335586, 0.0043788058392122695] and parameters: {'p_sma': 12, 'p_std': 22, 'p_atr': 12, 'p_adx': 24, 'rsi_period': 10, 'ema1': 26, 'ema2': 36, 'slip_atr_k': 0.006961344563920692, 'slip_spread_k': 0.7592467562456682, 'spread_hl_frac': 0.006215861120331924, 'bb_std_mult': 0.7835430336014717, 'rsi_os': 25, 'rsi_ob': 87, 'vol_spike': 0.2238782321420861, 'adx_thresh': 7.297237724162273, 'atr_min_pct': 0.007484717661231615, 'atr_max_pct': 0.10939736230634085, 'tp_mult': 1.5865859191989473, 'tsl_mult': 0.32138706763825575, 'strategy': 'breakout', 'time_stop': 147, 'use_sma': False, 'use_atr': False, 'use_adx': True, 'use_ema': False, 'use_spike': False, 'rsi_required': False, 'edge_k': 0.51378130494983, 'edge_cap': 0.9606867029979794, 'bull_strategy': 'breakout', 'bull_bb_std_mult': 1.6541995509591136, 'bull_rsi_os': 48, 'bull_rsi_ob': 91, 'bull_adx_thresh': 9.118349405068479, 'bull_atr_min_pct': 0.01990575053649377, 'bull_atr_max_pct': 0.1018507553642414, 'bull_tp_mult': 2.6316633019735014, 'bull_tsl_mult': 0.867843348185897, 'bull_time_stop': 32, 'bull_use_sma': True, 'bull_use_ema': True, 'bull_use_atr': True, 'bull_use_adx': True, 'bull_use_spike': True, 'bull_rsi_required': False, 'bear_strategy': 'mean_reversion', 'bear_bb_std_mult': 1.950319828078414, 'bear_rsi_os': 28, 'bear_rsi_ob': 74, 'bear_adx_thresh': 15.377674007022069, 'bear_atr_min_pct': 0.0030690389151795307, 'bear_atr_max_pct': 0.11285533720205367, 'bear_tp_mult': 2.7752470910454283, 'bear_tsl_mult': 0.8930505490158521, 'bear_time_stop': 104, 'bear_use_sma': True, 'bear_use_ema': False, 'bear_use_atr': True, 'bear_use_adx': True, 'bear_use_spike': True, 'bear_rsi_required': True, 'sideways_strategy': 'mean_reversion', 'sideways_bb_std_mult': 3.0961812952245347, 'sideways_rsi_os': 32, 'sideways_rsi_ob': 77, 'sideways_adx_thresh': 9.464917610905434, 'sideways_atr_min_pct': 0.020031276203793715, 'sideways_atr_max_pct': 0.07373335845085961, 'sideways_tp_mult': 2.094093914472152, 'sideways_tsl_mult': 0.3335295977746642, 'sideways_time_stop': 128, 'sideways_use_sma': True, 'sideways_use_ema': False, 'sideways_use_atr': True, 'sideways_use_adx': True, 'sideways_use_spike': True, 'sideways_rsi_required': True}.
[I 2025-08-30 15:25:47,180] Trial 457 finished with values: [-0.005436036915205111, 0.00711717985238474] and parameters: {'p_sma': 12, 'p_std': 20, 'p_atr': 12, 'p_adx': 24, 'rsi_period': 7, 'ema1': 26, 'ema2': 35, 'slip_atr_k': 0.004448381162841973, 'slip_spread_k': 0.7510817988389173, 'spread_hl_frac': 0.006203990847484422, 'bb_std_mult': 0.8072075441804147, 'rsi_os': 23, 'rsi_ob': 85, 'vol_spike': 0.22356701048150682, 'adx_thresh': 8.241783935669163, 'atr_min_pct': 0.007447791268521939, 'atr_max_pct': 0.116227394867018, 'tp_mult': 1.580776040075567, 'tsl_mult': 0.3139529874488939, 'strategy': 'breakout', 'time_stop': 149, 'use_sma': False, 'use_atr': False, 'use_adx': True, 'use_ema': False, 'use_spike': False, 'rsi_required': False, 'edge_k': 0.6670264514832912, 'edge_cap': 0.9591211766644724, 'bull_strategy': 'breakout', 'bull_bb_std_mult': 1.7037376104084663, 'bull_rsi_os': 46, 'bull_rsi_ob': 89, 'bull_adx_thresh': 8.794493797899682, 'bull_atr_min_pct': 0.018213020685020988, 'bull_atr_max_pct': 0.09879160599698601, 'bull_tp_mult': 2.6433334934369994, 'bull_tsl_mult': 0.8549626253073681, 'bull_time_stop': 29, 'bull_use_sma': True, 'bull_use_ema': True, 'bull_use_atr': True, 'bull_use_adx': True, 'bull_use_spike': True, 'bull_rsi_required': False, 'bear_strategy': 'mean_reversion', 'bear_bb_std_mult': 2.0755113763349025, 'bear_rsi_os': 28, 'bear_rsi_ob': 74, 'bear_adx_thresh': 17.489928515448945, 'bear_atr_min_pct': 0.0031368112640701687, 'bear_atr_max_pct': 0.10492042872806091, 'bear_tp_mult': 2.7715782095792365, 'bear_tsl_mult': 0.8951975883231144, 'bear_time_stop': 111, 'bear_use_sma': True, 'bear_use_ema': False, 'bear_use_atr': True, 'bear_use_adx': True, 'bear_use_spike': True, 'bear_rsi_required': True, 'sideways_strategy': 'mean_reversion', 'sideways_bb_std_mult': 3.0823607186137467, 'sideways_rsi_os': 32, 'sideways_rsi_ob': 78, 'sideways_adx_thresh': 11.30311917965716, 'sideways_atr_min_pct': 0.020241420380443527, 'sideways_atr_max_pct': 0.07731472484098566, 'sideways_tp_mult': 2.0530293283669576, 'sideways_tsl_mult': 0.42161933658977646, 'sideways_time_stop': 142, 'sideways_use_sma': True, 'sideways_use_ema': False, 'sideways_use_atr': True, 'sideways_use_adx': True, 'sideways_use_spike': True, 'sideways_rsi_required': True}.
[I 2025-08-30 15:26:51,751] Trial 461 finished with values: [-0.009943548424033333, 0.010126129203082578] and parameters: {'p_sma': 13, 'p_std': 22, 'p_atr': 12, 'p_adx': 24, 'rsi_period': 10, 'ema1': 25, 'ema2': 36, 'slip_atr_k': 0.007102362867037744, 'slip_spread_k': 0.7022194396310052, 'spread_hl_frac': 0.005173200182754223, 'bb_std_mult': 0.7540934708047857, 'rsi_os': 21, 'rsi_ob': 88, 'vol_spike': 0.21530784874612802, 'adx_thresh': 7.068292922557099, 'atr_min_pct': 0.00758622603032765, 'atr_max_pct': 0.1145759747314094, 'tp_mult': 1.4878161939297905, 'tsl_mult': 0.3110176504867652, 'strategy': 'breakout', 'time_stop': 166, 'use_sma': False, 'use_atr': False, 'use_adx': True, 'use_ema': False, 'use_spike': False, 'rsi_required': False, 'edge_k': 0.5012198345500668, 'edge_cap': 0.9404669182561863, 'bull_strategy': 'breakout', 'bull_bb_std_mult': 1.6526080250832855, 'bull_rsi_os': 47, 'bull_rsi_ob': 90, 'bull_adx_thresh': 9.029227230683308, 'bull_atr_min_pct': 0.01749628775471939, 'bull_atr_max_pct': 0.10539776707703515, 'bull_tp_mult': 2.6302038621650228, 'bull_tsl_mult': 0.8669355466033956, 'bull_time_stop': 52, 'bull_use_sma': True, 'bull_use_ema': True, 'bull_use_atr': True, 'bull_use_adx': True, 'bull_use_spike': True, 'bull_rsi_required': False, 'bear_strategy': 'mean_reversion', 'bear_bb_std_mult': 1.9261116819247328, 'bear_rsi_os': 26, 'bear_rsi_ob': 71, 'bear_adx_thresh': 15.615224864669655, 'bear_atr_min_pct': 0.0019281349884485055, 'bear_atr_max_pct': 0.11245909679104438, 'bear_tp_mult': 2.768438646942345, 'bear_tsl_mult': 0.8838101575413793, 'bear_time_stop': 103, 'bear_use_sma': True, 'bear_use_ema': False, 'bear_use_atr': True, 'bear_use_adx': True, 'bear_use_spike': True, 'bear_rsi_required': True, 'sideways_strategy': 'mean_reversion', 'sideways_bb_std_mult': 2.9405541841278597, 'sideways_rsi_os': 32, 'sideways_rsi_ob': 81, 'sideways_adx_thresh': 9.315757541747995, 'sideways_atr_min_pct': 0.020073503157439734, 'sideways_atr_max_pct': 0.07286377011144889, 'sideways_tp_mult': 2.131111575892921, 'sideways_tsl_mult': 0.32599479565955364, 'sideways_time_stop': 145, 'sideways_use_sma': True, 'sideways_use_ema': False, 'sideways_use_atr': True, 'sideways_use_adx': True, 'sideways_use_spike': True, 'sideways_rsi_required': True}.
[I 2025-08-30 15:26:53,389] Trial 463 finished with values: [-0.011449795872112145, 0.01168717215703591] and parameters: {'p_sma': 12, 'p_std': 22, 'p_atr': 12, 'p_adx': 24, 'rsi_period': 10, 'ema1': 25, 'ema2': 36, 'slip_atr_k': 0.007172281675062504, 'slip_spread_k': 0.7006582833695404, 'spread_hl_frac': 0.005123051527508415, 'bb_std_mult': 0.7951866806955108, 'rsi_os': 21, 'rsi_ob': 88, 'vol_spike': 0.22210448411676953, 'adx_thresh': 8.578933703624081, 'atr_min_pct': 0.007606501012597099, 'atr_max_pct': 0.11464042936322659, 'tp_mult': 1.4795660930776269, 'tsl_mult': 0.3064963282456799, 'strategy': 'breakout', 'time_stop': 156, 'use_sma': False, 'use_atr': False, 'use_adx': True, 'use_ema': False, 'use_spike': False, 'rsi_required': False, 'edge_k': 0.5007084657981435, 'edge_cap': 0.9692148598864218, 'bull_strategy': 'breakout', 'bull_bb_std_mult': 1.6634416691869445, 'bull_rsi_os': 47, 'bull_rsi_ob': 90, 'bull_adx_thresh': 9.234819178807056, 'bull_atr_min_pct': 0.017370517120150194, 'bull_atr_max_pct': 0.10623203937534217, 'bull_tp_mult': 2.727864039520328, 'bull_tsl_mult': 0.8663279869887565, 'bull_time_stop': 34, 'bull_use_sma': True, 'bull_use_ema': True, 'bull_use_atr': True, 'bull_use_adx': True, 'bull_use_spike': True, 'bull_rsi_required': False, 'bear_strategy': 'mean_reversion', 'bear_bb_std_mult': 1.9150814836528263, 'bear_rsi_os': 26, 'bear_rsi_ob': 71, 'bear_adx_thresh': 15.39530936561989, 'bear_atr_min_pct': 0.001779348070514243, 'bear_atr_max_pct': 0.1120070431941882, 'bear_tp_mult': 2.7753388502709404, 'bear_tsl_mult': 0.8874910088403187, 'bear_time_stop': 100, 'bear_use_sma': True, 'bear_use_ema': False, 'bear_use_atr': True, 'bear_use_adx': True, 'bear_use_spike': True, 'bear_rsi_required': True, 'sideways_strategy': 'mean_reversion', 'sideways_bb_std_mult': 3.0767060944403593, 'sideways_rsi_os': 32, 'sideways_rsi_ob': 79, 'sideways_adx_thresh': 9.227025184586065, 'sideways_atr_min_pct': 0.02166545211102722, 'sideways_atr_max_pct': 0.07365239724722697, 'sideways_tp_mult': 2.1419076531189765, 'sideways_tsl_mult': 0.32654138063324145, 'sideways_time_stop': 130, 'sideways_use_sma': True, 'sideways_use_ema': False, 'sideways_use_atr': True, 'sideways_use_adx': True, 'sideways_use_spike': True, 'sideways_rsi_required': True}.
[I 2025-08-30 15:26:54,678] Trial 464 finished with values: [-0.01568574929219102, 0.016292635896696005] and parameters: {'p_sma': 12, 'p_std': 22, 'p_atr': 12, 'p_adx': 24, 'rsi_period': 7, 'ema1': 25, 'ema2': 36, 'slip_atr_k': 0.0077215946358888815, 'slip_spread_k': 0.7519852277674012, 'spread_hl_frac': 0.005392635229214404, 'bb_std_mult': 0.8000524542782698, 'rsi_os': 21, 'rsi_ob': 88, 'vol_spike': 0.21483146762023994, 'adx_thresh': 8.535985180523628, 'atr_min_pct': 0.007600291076299501, 'atr_max_pct': 0.1140604943619581, 'tp_mult': 1.506797992278209, 'tsl_mult': 0.3744709297576182, 'strategy': 'breakout', 'time_stop': 156, 'use_sma': False, 'use_atr': False, 'use_adx': True, 'use_ema': False, 'use_spike': False, 'rsi_required': False, 'edge_k': 0.5209929036232549, 'edge_cap': 0.9755793345352495, 'bull_strategy': 'breakout', 'bull_bb_std_mult': 1.6634786928057925, 'bull_rsi_os': 47, 'bull_rsi_ob': 93, 'bull_adx_thresh': 8.927523117250109, 'bull_atr_min_pct': 0.019765966703562482, 'bull_atr_max_pct': 0.10605385774229135, 'bull_tp_mult': 2.7326227353858794, 'bull_tsl_mult': 0.869347031349311, 'bull_time_stop': 34, 'bull_use_sma': True, 'bull_use_ema': True, 'bull_use_atr': True, 'bull_use_adx': True, 'bull_use_spike': True, 'bull_rsi_required': False, 'bear_strategy': 'mean_reversion', 'bear_bb_std_mult': 1.9051470649105908, 'bear_rsi_os': 26, 'bear_rsi_ob': 71, 'bear_adx_thresh': 15.333200780678869, 'bear_atr_min_pct': 0.001947751675278564, 'bear_atr_max_pct': 0.11231582059112946, 'bear_tp_mult': 2.7571525833596153, 'bear_tsl_mult': 0.8957536289275547, 'bear_time_stop': 103, 'bear_use_sma': True, 'bear_use_ema': False, 'bear_use_atr': True, 'bear_use_adx': True, 'bear_use_spike': True, 'bear_rsi_required': True, 'sideways_strategy': 'mean_reversion', 'sideways_bb_std_mult': 2.9424247263381877, 'sideways_rsi_os': 32, 'sideways_rsi_ob': 77, 'sideways_adx_thresh': 9.13795096173422, 'sideways_atr_min_pct': 0.020262158355251643, 'sideways_atr_max_pct': 0.07371794082726943, 'sideways_tp_mult': 2.144871035915467, 'sideways_tsl_mult': 0.3282852534977637, 'sideways_time_stop': 143, 'sideways_use_sma': True, 'sideways_use_ema': False, 'sideways_use_atr': True, 'sideways_use_adx': True, 'sideways_use_spike': True, 'sideways_rsi_required': True}.
[I 2025-08-30 15:26:55,604] Trial 462 finished with values: [-0.014017602823720887, 0.014148871646232885] and parameters: {'p_sma': 12, 'p_std': 22, 'p_atr': 12, 'p_adx': 24, 'rsi_period': 10, 'ema1': 25, 'ema2': 36, 'slip_atr_k': 0.006757901309226513, 'slip_spread_k': 0.7465568089916252, 'spread_hl_frac': 0.005321052212265009, 'bb_std_mult': 0.8092647588435837, 'rsi_os': 21, 'rsi_ob': 88, 'vol_spike': 0.2147118310960777, 'adx_thresh': 6.894135685319297, 'atr_min_pct': 0.007667305887777612, 'atr_max_pct': 0.11432328431819597, 'tp_mult': 1.5814902373008908, 'tsl_mult': 0.31593295274305766, 'strategy': 'breakout', 'time_stop': 166, 'use_sma': False, 'use_atr': False, 'use_adx': True, 'use_ema': False, 'use_spike': False, 'rsi_required': False, 'edge_k': 0.5079347238138093, 'edge_cap': 0.9481806865961397, 'bull_strategy': 'breakout', 'bull_bb_std_mult': 1.7812555527041956, 'bull_rsi_os': 47, 'bull_rsi_ob': 93, 'bull_adx_thresh': 9.094095576153709, 'bull_atr_min_pct': 0.01768132613370451, 'bull_atr_max_pct': 0.10508179517759854, 'bull_tp_mult': 2.7255193239411373, 'bull_tsl_mult': 0.8644391909865032, 'bull_time_stop': 51, 'bull_use_sma': True, 'bull_use_ema': True, 'bull_use_atr': True, 'bull_use_adx': True, 'bull_use_spike': True, 'bull_rsi_required': False, 'bear_strategy': 'mean_reversion', 'bear_bb_std_mult': 1.9152400164437113, 'bear_rsi_os': 26, 'bear_rsi_ob': 74, 'bear_adx_thresh': 15.142572127907439, 'bear_atr_min_pct': 0.0016676677776761798, 'bear_atr_max_pct': 0.11323791004500353, 'bear_tp_mult': 2.761234889475274, 'bear_tsl_mult': 0.8900040244192176, 'bear_time_stop': 109, 'bear_use_sma': True, 'bear_use_ema': False, 'bear_use_atr': True, 'bear_use_adx': True, 'bear_use_spike': True, 'bear_rsi_required': True, 'sideways_strategy': 'mean_reversion', 'sideways_bb_std_mult': 2.923396824367076, 'sideways_rsi_os': 32, 'sideways_rsi_ob': 81, 'sideways_adx_thresh': 9.37382662475645, 'sideways_atr_min_pct': 0.01996071045797556, 'sideways_atr_max_pct': 0.0735983139595474, 'sideways_tp_mult': 2.1424348669004893, 'sideways_tsl_mult': 0.3286683169053047, 'sideways_time_stop': 130, 'sideways_use_sma': True, 'sideways_use_ema': False, 'sideways_use_atr': True, 'sideways_use_adx': True, 'sideways_use_spike': True, 'sideways_rsi_required': True}.
[I 2025-08-30 15:28:05,593] Trial 467 finished with values: [-0.005269877171418247, 0.007867678176242891] and parameters: {'p_sma': 9, 'p_std': 20, 'p_atr': 11, 'p_adx': 24, 'rsi_period': 7, 'ema1': 26, 'ema2': 33, 'slip_atr_k': 0.00015738418956834322, 'slip_spread_k': 0.7482083806707815, 'spread_hl_frac': 0.008354725784371535, 'bb_std_mult': 0.6762326292919169, 'rsi_os': 22, 'rsi_ob': 85, 'vol_spike': 0.22132106065958748, 'adx_thresh': 8.13460901324373, 'atr_min_pct': 0.008538621154899324, 'atr_max_pct': 0.10862269984696404, 'tp_mult': 1.5915333910952734, 'tsl_mult': 0.4137129364420194, 'strategy': 'breakout', 'time_stop': 146, 'use_sma': False, 'use_atr': False, 'use_adx': True, 'use_ema': False, 'use_spike': False, 'rsi_required': False, 'edge_k': 0.6115381099037097, 'edge_cap': 0.9823745516228394, 'bull_strategy': 'breakout', 'bull_bb_std_mult': 1.9324801426495768, 'bull_rsi_os': 48, 'bull_rsi_ob': 92, 'bull_adx_thresh': 8.20207700616875, 'bull_atr_min_pct': 0.018553948460754015, 'bull_atr_max_pct': 0.09843082199006258, 'bull_tp_mult': 2.631210726732211, 'bull_tsl_mult': 0.8889589746618649, 'bull_time_stop': 60, 'bull_use_sma': True, 'bull_use_ema': True, 'bull_use_atr': True, 'bull_use_adx': True, 'bull_use_spike': True, 'bull_rsi_required': False, 'bear_strategy': 'mean_reversion', 'bear_bb_std_mult': 2.1024005497601705, 'bear_rsi_os': 28, 'bear_rsi_ob': 74, 'bear_adx_thresh': 16.854337031258446, 'bear_atr_min_pct': 0.002685334266699613, 'bear_atr_max_pct': 0.10545459284069139, 'bear_tp_mult': 2.678326021339579, 'bear_tsl_mult': 0.9221420760209327, 'bear_time_stop': 110, 'bear_use_sma': True, 'bear_use_ema': False, 'bear_use_atr': True, 'bear_use_adx': True, 'bear_use_spike': True, 'bear_rsi_required': True, 'sideways_strategy': 'mean_reversion', 'sideways_bb_std_mult': 3.108994475513199, 'sideways_rsi_os': 30, 'sideways_rsi_ob': 79, 'sideways_adx_thresh': 11.561036326872607, 'sideways_atr_min_pct': 0.020405145859319438, 'sideways_atr_max_pct': 0.0768155948775262, 'sideways_tp_mult': 2.202889300144126, 'sideways_tsl_mult': 0.3870117878524964, 'sideways_time_stop': 131, 'sideways_use_sma': True, 'sideways_use_ema': False, 'sideways_use_atr': True, 'sideways_use_adx': True, 'sideways_use_spike': True, 'sideways_rsi_required': True}.
[I 2025-08-30 15:28:05,621] Trial 465 finished with values: [-0.0012513764326856913, 0.005849389554894467] and parameters: {'p_sma': 11, 'p_std': 22, 'p_atr': 13, 'p_adx': 24, 'rsi_period': 8, 'ema1': 25, 'ema2': 36, 'slip_atr_k': 0.007543140779620123, 'slip_spread_k': 0.7443017404252946, 'spread_hl_frac': 0.006065225491807909, 'bb_std_mult': 0.6950357557111128, 'rsi_os': 22, 'rsi_ob': 88, 'vol_spike': 0.22314149460873053, 'adx_thresh': 8.68022859799243, 'atr_min_pct': 0.007459178086791368, 'atr_max_pct': 0.10865677459222256, 'tp_mult': 1.5821600282454291, 'tsl_mult': 0.3774096031314334, 'strategy': 'breakout', 'time_stop': 153, 'use_sma': False, 'use_atr': False, 'use_adx': True, 'use_ema': False, 'use_spike': False, 'rsi_required': False, 'edge_k': 0.5294530005875975, 'edge_cap': 0.9731356443049712, 'bull_strategy': 'breakout', 'bull_bb_std_mult': 1.6524391256274331, 'bull_rsi_os': 48, 'bull_rsi_ob': 92, 'bull_adx_thresh': 9.756426111955, 'bull_atr_min_pct': 0.019550633731486695, 'bull_atr_max_pct': 0.10616953912367705, 'bull_tp_mult': 2.7282562100562173, 'bull_tsl_mult': 0.8786770043715508, 'bull_time_stop': 35, 'bull_use_sma': True, 'bull_use_ema': True, 'bull_use_atr': True, 'bull_use_adx': True, 'bull_use_spike': True, 'bull_rsi_required': False, 'bear_strategy': 'mean_reversion', 'bear_bb_std_mult': 1.9290845326701416, 'bear_rsi_os': 27, 'bear_rsi_ob': 74, 'bear_adx_thresh': 16.8796665563327, 'bear_atr_min_pct': 0.0028150090968700283, 'bear_atr_max_pct': 0.1040154852228887, 'bear_tp_mult': 2.7772993376234347, 'bear_tsl_mult': 0.9006992642016868, 'bear_time_stop': 111, 'bear_use_sma': True, 'bear_use_ema': False, 'bear_use_atr': True, 'bear_use_adx': True, 'bear_use_spike': True, 'bear_rsi_required': True, 'sideways_strategy': 'mean_reversion', 'sideways_bb_std_mult': 3.1155069636145334, 'sideways_rsi_os': 31, 'sideways_rsi_ob': 77, 'sideways_adx_thresh': 11.126795794759266, 'sideways_atr_min_pct': 0.020351114907254175, 'sideways_atr_max_pct': 0.07843105657730413, 'sideways_tp_mult': 2.1466745762132535, 'sideways_tsl_mult': 0.3892697473680435, 'sideways_time_stop': 129, 'sideways_use_sma': True, 'sideways_use_ema': False, 'sideways_use_atr': True, 'sideways_use_adx': True, 'sideways_use_spike': True, 'sideways_rsi_required': True}.
[I 2025-08-30 15:28:07,045] Trial 468 finished with values: [-0.00971435784010699, 0.011603717073548145] and parameters: {'p_sma': 13, 'p_std': 21, 'p_atr': 11, 'p_adx': 24, 'rsi_period': 7, 'ema1': 26, 'ema2': 33, 'slip_atr_k': 0.0041569147181653434, 'slip_spread_k': 0.7230508692533186, 'spread_hl_frac': 0.008134977942185831, 'bb_std_mult': 0.5601911538359714, 'rsi_os': 22, 'rsi_ob': 86, 'vol_spike': 0.22308028688585077, 'adx_thresh': 8.950938691029314, 'atr_min_pct': 0.008576406619599354, 'atr_max_pct': 0.1106460168997225, 'tp_mult': 1.588173500862695, 'tsl_mult': 0.364908613872276, 'strategy': 'breakout', 'time_stop': 145, 'use_sma': False, 'use_atr': False, 'use_adx': True, 'use_ema': False, 'use_spike': False, 'rsi_required': False, 'edge_k': 0.6100838724956403, 'edge_cap': 0.9971047213837771, 'bull_strategy': 'breakout', 'bull_bb_std_mult': 1.7137752259131718, 'bull_rsi_os': 49, 'bull_rsi_ob': 91, 'bull_adx_thresh': 9.717550868778469, 'bull_atr_min_pct': 0.019530126982514762, 'bull_atr_max_pct': 0.10106676571395636, 'bull_tp_mult': 2.6240108390584265, 'bull_tsl_mult': 0.8852884785383118, 'bull_time_stop': 58, 'bull_use_sma': True, 'bull_use_ema': True, 'bull_use_atr': True, 'bull_use_adx': True, 'bull_use_spike': True, 'bull_rsi_required': False, 'bear_strategy': 'mean_reversion', 'bear_bb_std_mult': 2.094847185538138, 'bear_rsi_os': 28, 'bear_rsi_ob': 75, 'bear_adx_thresh': 16.73630153309829, 'bear_atr_min_pct': 0.0026279178121688253, 'bear_atr_max_pct': 0.10447080780730095, 'bear_tp_mult': 2.6625252511106132, 'bear_tsl_mult': 0.8574798431919085, 'bear_time_stop': 109, 'bear_use_sma': True, 'bear_use_ema': False, 'bear_use_atr': True, 'bear_use_adx': True, 'bear_use_spike': True, 'bear_rsi_required': True, 'sideways_strategy': 'mean_reversion', 'sideways_bb_std_mult': 3.148495599957314, 'sideways_rsi_os': 30, 'sideways_rsi_ob': 79, 'sideways_adx_thresh': 11.771144006094971, 'sideways_atr_min_pct': 0.02056843824989883, 'sideways_atr_max_pct': 0.07815593571597339, 'sideways_tp_mult': 2.195975349620931, 'sideways_tsl_mult': 0.3841262995635537, 'sideways_time_stop': 133, 'sideways_use_sma': True, 'sideways_use_ema': False, 'sideways_use_atr': True, 'sideways_use_adx': True, 'sideways_use_spike': True, 'sideways_rsi_required': True}.
