[I 2025-08-30 15:02:18,463] Trial 334 finished with values: [-1000000000.0, 1000000000.0] and parameters: {'p_sma': 40, 'p_std': 35, 'p_atr': 8, 'p_adx': 18, 'rsi_period': 52, 'ema1': 9, 'ema2': 19, 'slip_atr_k': 0.020546474065756423, 'slip_spread_k': 0.3245024061161059, 'spread_hl_frac': 0.0010071452932829917, 'bb_std_mult': 3.0417603268695883, 'rsi_os': 8, 'rsi_ob': 91, 'vol_spike': 0.2590123013334324, 'adx_thresh': 11.046212833135414, 'atr_min_pct': 0.014144637750359922, 'atr_max_pct': 0.11115955434551673, 'tp_mult': 1.7483345827515595, 'tsl_mult': 0.5214955929746965, 'strategy': 'breakout', 'time_stop': 158, 'use_sma': False, 'use_atr': False, 'use_adx': True, 'use_ema': False, 'use_spike': False, 'rsi_required': False, 'edge_k': 0.3095396169319109, 'edge_cap': 0.8626406288557028, 'bull_strategy': 'breakout', 'bull_bb_std_mult': 3.2191256642278736, 'bull_rsi_os': 52, 'bull_rsi_ob': 71, 'bull_adx_thresh': 33.3014554697169, 'bull_atr_min_pct': 0.02321590312292874, 'bull_atr_max_pct': 0.08774897326587075, 'bull_tp_mult': 2.5200067137330424, 'bull_tsl_mult': 0.5484665079335889, 'bull_time_stop': 131, 'bull_use_sma': True, 'bull_use_ema': True, 'bull_use_atr': True, 'bull_use_adx': False, 'bull_use_spike': True, 'bull_rsi_required': True, 'bear_strategy': 'mean_reversion', 'bear_bb_std_mult': 2.4515186226018755, 'bear_rsi_os': 25, 'bear_rsi_ob': 81, 'bear_adx_thresh': 13.524578855217536, 'bear_atr_min_pct': 0.02653171588932873, 'bear_atr_max_pct': 0.022147409586443075, 'bear_tp_mult': 2.476898810782458, 'bear_tsl_mult': 0.6339814229302438, 'bear_time_stop': 90, 'bear_use_sma': True, 'bear_use_ema': False, 'bear_use_atr': True, 'bear_use_adx': True, 'bear_use_spike': True, 'bear_rsi_required': True, 'sideways_strategy': 'mean_reversion', 'sideways_bb_std_mult': 1.0408761996843368, 'sideways_rsi_os': 32, 'sideways_rsi_ob': 54, 'sideways_adx_thresh': 20.07600061379333, 'sideways_atr_min_pct': 0.024356599950187272, 'sideways_atr_max_pct': 0.09575072619049453, 'sideways_tp_mult': 2.5154185508167646, 'sideways_tsl_mult': 0.9998836691072811, 'sideways_time_stop': 31, 'sideways_use_sma': True, 'sideways_use_ema': False, 'sideways_use_atr': True, 'sideways_use_adx': True, 'sideways_use_spike': True, 'sideways_rsi_required': True}.
[I 2025-08-30 15:02:18,973] Trial 336 finished with values: [-0.014058507930397868, 0.014088873215295722] and parameters: {'p_sma': 59, 'p_std': 38, 'p_atr': 8, 'p_adx': 29, 'rsi_period': 47, 'ema1': 9, 'ema2': 49, 'slip_atr_k': 0.14041434180881876, 'slip_spread_k': 0.31920708031399136, 'spread_hl_frac': 0.030639178549639476, 'bb_std_mult': 3.02843408200162, 'rsi_os': 8, 'rsi_ob': 58, 'vol_spike': 0.2129030908388203, 'adx_thresh': 11.735241243795462, 'atr_min_pct': 0.014667608549799569, 'atr_max_pct': 0.10279313761536295, 'tp_mult': 2.4471499051831724, 'tsl_mult': 0.4742981670760119, 'strategy': 'breakout', 'time_stop': 260, 'use_sma': False, 'use_atr': False, 'use_adx': True, 'use_ema': False, 'use_spike': False, 'rsi_required': False, 'edge_k': 0.14325155328135963, 'edge_cap': 0.8606169467676343, 'bull_strategy': 'breakout', 'bull_bb_std_mult': 3.5166128399858807, 'bull_rsi_os': 53, 'bull_rsi_ob': 57, 'bull_adx_thresh': 33.00409729922544, 'bull_atr_min_pct': 0.0009657901131959089, 'bull_atr_max_pct': 0.08569396760264102, 'bull_tp_mult': 1.0500520308918764, 'bull_tsl_mult': 0.9998314790077205, 'bull_time_stop': 237, 'bull_use_sma': True, 'bull_use_ema': True, 'bull_use_atr': True, 'bull_use_adx': False, 'bull_use_spike': True, 'bull_rsi_required': True, 'bear_strategy': 'mean_reversion', 'bear_bb_std_mult': 3.2537759308741077, 'bear_rsi_os': 25, 'bear_rsi_ob': 81, 'bear_adx_thresh': 6.919997214549574, 'bear_atr_min_pct': 0.02357390824352701, 'bear_atr_max_pct': 0.02184730015525929, 'bear_tp_mult': 1.27226419432488, 'bear_tsl_mult': 0.6905623757395275, 'bear_time_stop': 258, 'bear_use_sma': True, 'bear_use_ema': False, 'bear_use_atr': True, 'bear_use_adx': True, 'bear_use_spike': True, 'bear_rsi_required': True, 'sideways_strategy': 'mean_reversion', 'sideways_bb_std_mult': 2.448411752722759, 'sideways_rsi_os': 26, 'sideways_rsi_ob': 52, 'sideways_adx_thresh': 18.648927777768037, 'sideways_atr_min_pct': 0.024330021494817937, 'sideways_atr_max_pct': 0.09544676187862736, 'sideways_tp_mult': 2.335490824483632, 'sideways_tsl_mult': 0.9966112605180184, 'sideways_time_stop': 71, 'sideways_use_sma': True, 'sideways_use_ema': False, 'sideways_use_atr': True, 'sideways_use_adx': True, 'sideways_use_spike': True, 'sideways_rsi_required': True}.
[I 2025-08-30 15:02:19,136] Trial 335 finished with values: [-1000000000.0, 1000000000.0] and parameters: {'p_sma': 59, 'p_std': 37, 'p_atr': 8, 'p_adx': 29, 'rsi_period': 48, 'ema1': 9, 'ema2': 48, 'slip_atr_k': 0.17996225356784282, 'slip_spread_k': 0.3182298812834264, 'spread_hl_frac': 0.030584491040460147, 'bb_std_mult': 0.9510462251329839, 'rsi_os': 51, 'rsi_ob': 51, 'vol_spike': 0.22842711828650902, 'adx_thresh': 11.370911454801897, 'atr_min_pct': 0.016615899622054862, 'atr_max_pct': 0.10243147896133817, 'tp_mult': 2.4884698101327203, 'tsl_mult': 0.4759703387043245, 'strategy': 'breakout', 'time_stop': 259, 'use_sma': False, 'use_atr': False, 'use_adx': True, 'use_ema': False, 'use_spike': False, 'rsi_required': False, 'edge_k': 0.30978741261688914, 'edge_cap': 0.7670150836667696, 'bull_strategy': 'breakout', 'bull_bb_std_mult': 3.5042212960116212, 'bull_rsi_os': 52, 'bull_rsi_ob': 72, 'bull_adx_thresh': 32.999082182353675, 'bull_atr_min_pct': 0.023257743295653915, 'bull_atr_max_pct': 0.08530892304769395, 'bull_tp_mult': 1.8062083215759024, 'bull_tsl_mult': 0.0626301824267646, 'bull_time_stop': 129, 'bull_use_sma': True, 'bull_use_ema': True, 'bull_use_atr': True, 'bull_use_adx': False, 'bull_use_spike': True, 'bull_rsi_required': True, 'bear_strategy': 'mean_reversion', 'bear_bb_std_mult': 2.9049096395022507, 'bear_rsi_os': 25, 'bear_rsi_ob': 81, 'bear_adx_thresh': 6.222052291970488, 'bear_atr_min_pct': 0.023744587876344873, 'bear_atr_max_pct': 0.015867834945904203, 'bear_tp_mult': 2.98539099890393, 'bear_tsl_mult': 0.29137217717392533, 'bear_time_stop': 89, 'bear_use_sma': True, 'bear_use_ema': False, 'bear_use_atr': True, 'bear_use_adx': True, 'bear_use_spike': True, 'bear_rsi_required': True, 'sideways_strategy': 'mean_reversion', 'sideways_bb_std_mult': 2.7558123961973386, 'sideways_rsi_os': 32, 'sideways_rsi_ob': 54, 'sideways_adx_thresh': 9.446220550619762, 'sideways_atr_min_pct': 0.02444740899149005, 'sideways_atr_max_pct': 0.09435851133700428, 'sideways_tp_mult': 2.4980799205448814, 'sideways_tsl_mult': 0.9960603568477999, 'sideways_time_stop': 92, 'sideways_use_sma': True, 'sideways_use_ema': False, 'sideways_use_atr': True, 'sideways_use_adx': True, 'sideways_use_spike': True, 'sideways_rsi_required': True}.
[I 2025-08-30 15:02:19,234] Trial 333 finished with values: [-1000000000.0, 1000000000.0] and parameters: {'p_sma': 40, 'p_std': 35, 'p_atr': 16, 'p_adx': 30, 'rsi_period': 52, 'ema1': 9, 'ema2': 50, 'slip_atr_k': 0.20051258994214366, 'slip_spread_k': 0.331022761776831, 'spread_hl_frac': 0.0033545286663121685, 'bb_std_mult': 2.974657460807386, 'rsi_os': 50, 'rsi_ob': 91, 'vol_spike': 0.25494071392434586, 'adx_thresh': 12.77422709765458, 'atr_min_pct': 0.014288286500372862, 'atr_max_pct': 0.09557389643674967, 'tp_mult': 2.985506381817292, 'tsl_mult': 0.5225316273648014, 'strategy': 'breakout', 'time_stop': 8, 'use_sma': False, 'use_atr': False, 'use_adx': True, 'use_ema': False, 'use_spike': False, 'rsi_required': False, 'edge_k': 0.3473805854674125, 'edge_cap': 0.7834875133683199, 'bull_strategy': 'breakout', 'bull_bb_std_mult': 1.7040407998313793, 'bull_rsi_os': 52, 'bull_rsi_ob': 71, 'bull_adx_thresh': 32.887123346343785, 'bull_atr_min_pct': 0.000954309208970344, 'bull_atr_max_pct': 0.08774518874169583, 'bull_tp_mult': 1.053372735036337, 'bull_tsl_mult': 0.9994667539977736, 'bull_time_stop': 50, 'bull_use_sma': True, 'bull_use_ema': True, 'bull_use_atr': True, 'bull_use_adx': False, 'bull_use_spike': True, 'bull_rsi_required': True, 'bear_strategy': 'mean_reversion', 'bear_bb_std_mult': 3.251809882103466, 'bear_rsi_os': 25, 'bear_rsi_ob': 81, 'bear_adx_thresh': 6.9639554052951, 'bear_atr_min_pct': 0.026547084573537147, 'bear_atr_max_pct': 0.022959456386068777, 'bear_tp_mult': 2.439168831368771, 'bear_tsl_mult': 0.6372708019118047, 'bear_time_stop': 86, 'bear_use_sma': True, 'bear_use_ema': False, 'bear_use_atr': True, 'bear_use_adx': True, 'bear_use_spike': True, 'bear_rsi_required': True, 'sideways_strategy': 'mean_reversion', 'sideways_bb_std_mult': 1.3388870794121077, 'sideways_rsi_os': 37, 'sideways_rsi_ob': 52, 'sideways_adx_thresh': 18.60908001882999, 'sideways_atr_min_pct': 0.01156442426275822, 'sideways_atr_max_pct': 0.09403196646919783, 'sideways_tp_mult': 2.4699631916561677, 'sideways_tsl_mult': 0.9797090490189467, 'sideways_time_stop': 89, 'sideways_use_sma': True, 'sideways_use_ema': False, 'sideways_use_atr': True, 'sideways_use_adx': True, 'sideways_use_spike': True, 'sideways_rsi_required': True}.
[I 2025-08-30 15:02:53,083] Trial 337 finished with values: [-1000000000.0, 1000000000.0] and parameters: {'p_sma': 41, 'p_std': 37, 'p_atr': 17, 'p_adx': 29, 'rsi_period': 47, 'ema1': 30, 'ema2': 23, 'slip_atr_k': 0.18041091581600613, 'slip_spread_k': 0.2653735075665293, 'spread_hl_frac': 0.004048234452206617, 'bb_std_mult': 0.943159039627889, 'rsi_os': 7, 'rsi_ob': 53, 'vol_spike': 0.1918486897137956, 'adx_thresh': 12.984377513323038, 'atr_min_pct': 0.016630389012814245, 'atr_max_pct': 0.10174272892825965, 'tp_mult': 2.486298899462463, 'tsl_mult': 0.4755202269058145, 'strategy': 'breakout', 'time_stop': 73, 'use_sma': False, 'use_atr': False, 'use_adx': True, 'use_ema': False, 'use_spike': False, 'rsi_required': False, 'edge_k': 1.5478862441655115, 'edge_cap': 0.08265230456557121, 'bull_strategy': 'breakout', 'bull_bb_std_mult': 3.5608087473080916, 'bull_rsi_os': 52, 'bull_rsi_ob': 57, 'bull_adx_thresh': 32.984003557227126, 'bull_atr_min_pct': 0.001120913407876583, 'bull_atr_max_pct': 0.08544033095402644, 'bull_tp_mult': 1.5747535846493366, 'bull_tsl_mult': 0.9975236359747339, 'bull_time_stop': 30, 'bull_use_sma': True, 'bull_use_ema': True, 'bull_use_atr': True, 'bull_use_adx': False, 'bull_use_spike': True, 'bull_rsi_required': True, 'bear_strategy': 'mean_reversion', 'bear_bb_std_mult': 3.239087771041322, 'bear_rsi_os': 27, 'bear_rsi_ob': 83, 'bear_adx_thresh': 6.744282318523526, 'bear_atr_min_pct': 0.024386121479464444, 'bear_atr_max_pct': 0.02245769117682049, 'bear_tp_mult': 2.9367819458717626, 'bear_tsl_mult': 0.69354289779089, 'bear_time_stop': 257, 'bear_use_sma': True, 'bear_use_ema': False, 'bear_use_atr': True, 'bear_use_adx': True, 'bear_use_spike': True, 'bear_rsi_required': True, 'sideways_strategy': 'mean_reversion', 'sideways_bb_std_mult': 3.497968217293213, 'sideways_rsi_os': 37, 'sideways_rsi_ob': 88, 'sideways_adx_thresh': 18.675091155792177, 'sideways_atr_min_pct': 0.012216023071622163, 'sideways_atr_max_pct': 0.09523129504439265, 'sideways_tp_mult': 2.443492758213203, 'sideways_tsl_mult': 0.9993417949354633, 'sideways_time_stop': 234, 'sideways_use_sma': True, 'sideways_use_ema': False, 'sideways_use_atr': True, 'sideways_use_adx': True, 'sideways_use_spike': True, 'sideways_rsi_required': True}.
[I 2025-08-30 15:02:53,578] Trial 339 finished with values: [-1000000000.0, 1000000000.0] and parameters: {'p_sma': 54, 'p_std': 34, 'p_atr': 17, 'p_adx': 14, 'rsi_period': 50, 'ema1': 22, 'ema2': 48, 'slip_atr_k': 0.0021069331648465688, 'slip_spread_k': 0.267493311248428, 'spread_hl_frac': 0.021207781541014204, 'bb_std_mult': 1.3114159210844456, 'rsi_os': 7, 'rsi_ob': 89, 'vol_spike': 0.2449608317361784, 'adx_thresh': 11.97156855561846, 'atr_min_pct': 0.005362375734878303, 'atr_max_pct': 0.10738947989241539, 'tp_mult': 2.5212008706439333, 'tsl_mult': 0.40679272520363235, 'strategy': 'breakout', 'time_stop': 98, 'use_sma': False, 'use_atr': False, 'use_adx': True, 'use_ema': False, 'use_spike': False, 'rsi_required': False, 'edge_k': 1.4005110884738388, 'edge_cap': 0.7234399108026811, 'bull_strategy': 'breakout', 'bull_bb_std_mult': 1.5696006477971123, 'bull_rsi_os': 54, 'bull_rsi_ob': 60, 'bull_adx_thresh': 32.020660447009924, 'bull_atr_min_pct': 0.018308530639123338, 'bull_atr_max_pct': 0.1466321125188526, 'bull_tp_mult': 1.1091419917539085, 'bull_tsl_mult': 0.9516794088045085, 'bull_time_stop': 135, 'bull_use_sma': True, 'bull_use_ema': True, 'bull_use_atr': True, 'bull_use_adx': False, 'bull_use_spike': True, 'bull_rsi_required': False, 'bear_strategy': 'mean_reversion', 'bear_bb_std_mult': 3.184494483151849, 'bear_rsi_os': 27, 'bear_rsi_ob': 83, 'bear_adx_thresh': 6.4111977379697445, 'bear_atr_min_pct': 0.022419235776332733, 'bear_atr_max_pct': 0.11417045625000741, 'bear_tp_mult': 2.8997118333937157, 'bear_tsl_mult': 0.3527339676059674, 'bear_time_stop': 247, 'bear_use_sma': True, 'bear_use_ema': False, 'bear_use_atr': True, 'bear_use_adx': True, 'bear_use_spike': True, 'bear_rsi_required': True, 'sideways_strategy': 'mean_reversion', 'sideways_bb_std_mult': 1.0555034556068237, 'sideways_rsi_os': 55, 'sideways_rsi_ob': 88, 'sideways_adx_thresh': 34.05965393344457, 'sideways_atr_min_pct': 0.023291181609982566, 'sideways_atr_max_pct': 0.10049181394100745, 'sideways_tp_mult': 2.4380781863038563, 'sideways_tsl_mult': 0.9528465531220436, 'sideways_time_stop': 249, 'sideways_use_sma': True, 'sideways_use_ema': False, 'sideways_use_atr': True, 'sideways_use_adx': True, 'sideways_use_spike': True, 'sideways_rsi_required': True}.
[I 2025-08-30 15:02:53,781] Trial 340 finished with values: [-0.00660546594220035, 0.0066591101027218755] and parameters: {'p_sma': 41, 'p_std': 34, 'p_atr': 17, 'p_adx': 29, 'rsi_period': 56, 'ema1': 10, 'ema2': 48, 'slip_atr_k': 0.005082980521652939, 'slip_spread_k': 0.26597722601619167, 'spread_hl_frac': 0.015593602734630778, 'bb_std_mult': 2.865642073862156, 'rsi_os': 7, 'rsi_ob': 89, 'vol_spike': 0.24544644559782736, 'adx_thresh': 12.101353902139541, 'atr_min_pct': 0.02071352759135746, 'atr_max_pct': 0.10104550844644909, 'tp_mult': 2.690762275905838, 'tsl_mult': 0.4535128556097033, 'strategy': 'breakout', 'time_stop': 269, 'use_sma': False, 'use_atr': False, 'use_adx': True, 'use_ema': False, 'use_spike': False, 'rsi_required': False, 'edge_k': 1.4122133785981505, 'edge_cap': 0.8035107706714776, 'bull_strategy': 'breakout', 'bull_bb_std_mult': 2.63484739176526, 'bull_rsi_os': 54, 'bull_rsi_ob': 94, 'bull_adx_thresh': 31.96714647567887, 'bull_atr_min_pct': 0.0008392256890098831, 'bull_atr_max_pct': 0.09508804299521097, 'bull_tp_mult': 1.5731237784969951, 'bull_tsl_mult': 0.12126933527197636, 'bull_time_stop': 38, 'bull_use_sma': True, 'bull_use_ema': True, 'bull_use_atr': True, 'bull_use_adx': False, 'bull_use_spike': True, 'bull_rsi_required': False, 'bear_strategy': 'mean_reversion', 'bear_bb_std_mult': 3.1714738158860736, 'bear_rsi_os': 27, 'bear_rsi_ob': 83, 'bear_adx_thresh': 16.04344717889609, 'bear_atr_min_pct': 0.015967849501814024, 'bear_atr_max_pct': 0.0753273310413697, 'bear_tp_mult': 2.919679371226223, 'bear_tsl_mult': 0.35350508516551205, 'bear_time_stop': 247, 'bear_use_sma': True, 'bear_use_ema': False, 'bear_use_atr': True, 'bear_use_adx': True, 'bear_use_spike': True, 'bear_rsi_required': True, 'sideways_strategy': 'mean_reversion', 'sideways_bb_std_mult': 1.0685632316901246, 'sideways_rsi_os': 55, 'sideways_rsi_ob': 57, 'sideways_adx_thresh': 34.14578435362476, 'sideways_atr_min_pct': 0.02331593345153217, 'sideways_atr_max_pct': 0.09014513969405923, 'sideways_tp_mult': 2.385076500421385, 'sideways_tsl_mult': 0.9558292563205639, 'sideways_time_stop': 39, 'sideways_use_sma': True, 'sideways_use_ema': False, 'sideways_use_atr': True, 'sideways_use_adx': True, 'sideways_use_spike': True, 'sideways_rsi_required': True}.
[I 2025-08-30 15:02:53,906] Trial 338 finished with values: [-1000000000.0, 1000000000.0] and parameters: {'p_sma': 30, 'p_std': 37, 'p_atr': 17, 'p_adx': 29, 'rsi_period': 48, 'ema1': 21, 'ema2': 48, 'slip_atr_k': 0.01342911710869439, 'slip_spread_k': 0.7292409573539504, 'spread_hl_frac': 0.003522224170189643, 'bb_std_mult': 2.9751145002432526, 'rsi_os': 55, 'rsi_ob': 89, 'vol_spike': 0.22840642518224472, 'adx_thresh': 12.01755185656118, 'atr_min_pct': 0.02053618936541636, 'atr_max_pct': 0.10549947803832928, 'tp_mult': 2.678196092733729, 'tsl_mult': 0.3176574318840473, 'strategy': 'breakout', 'time_stop': 118, 'use_sma': False, 'use_atr': False, 'use_adx': True, 'use_ema': False, 'use_spike': False, 'rsi_required': False, 'edge_k': 0.3061653778222395, 'edge_cap': 0.7715283690308389, 'bull_strategy': 'breakout', 'bull_bb_std_mult': 1.7111140329857866, 'bull_rsi_os': 52, 'bull_rsi_ob': 66, 'bull_adx_thresh': 32.01386038217595, 'bull_atr_min_pct': 0.0009368238991578351, 'bull_atr_max_pct': 0.09583499815289834, 'bull_tp_mult': 1.1115879425731194, 'bull_tsl_mult': 0.9514680568255924, 'bull_time_stop': 250, 'bull_use_sma': True, 'bull_use_ema': True, 'bull_use_atr': True, 'bull_use_adx': False, 'bull_use_spike': True, 'bull_rsi_required': False, 'bear_strategy': 'mean_reversion', 'bear_bb_std_mult': 2.9047011375691096, 'bear_rsi_os': 27, 'bear_rsi_ob': 83, 'bear_adx_thresh': 6.249195771261633, 'bear_atr_min_pct': 0.02490987501376297, 'bear_atr_max_pct': 0.11261029422980628, 'bear_tp_mult': 1.0902488860149535, 'bear_tsl_mult': 0.35127743046765847, 'bear_time_stop': 244, 'bear_use_sma': True, 'bear_use_ema': False, 'bear_use_atr': True, 'bear_use_adx': True, 'bear_use_spike': True, 'bear_rsi_required': True, 'sideways_strategy': 'mean_reversion', 'sideways_bb_std_mult': 1.058870939954578, 'sideways_rsi_os': 33, 'sideways_rsi_ob': 57, 'sideways_adx_thresh': 34.48842585169747, 'sideways_atr_min_pct': 0.0032032756430691485, 'sideways_atr_max_pct': 0.1228261590254422, 'sideways_tp_mult': 2.4561291541945764, 'sideways_tsl_mult': 0.953319649854794, 'sideways_time_stop': 247, 'sideways_use_sma': True, 'sideways_use_ema': False, 'sideways_use_atr': True, 'sideways_use_adx': True, 'sideways_use_spike': True, 'sideways_rsi_required': True}.
[I 2025-08-30 15:03:27,332] Trial 343 finished with values: [-1000000000.0, 1000000000.0] and parameters: {'p_sma': 39, 'p_std': 37, 'p_atr': 28, 'p_adx': 30, 'rsi_period': 56, 'ema1': 10, 'ema2': 49, 'slip_atr_k': 0.010857277575861843, 'slip_spread_k': 0.7260470424747191, 'spread_hl_frac': 0.0019253141604468533, 'bb_std_mult': 2.967418292423672, 'rsi_os': 6, 'rsi_ob': 48, 'vol_spike': 0.235439936248347, 'adx_thresh': 12.040206333366466, 'atr_min_pct': 0.01016897223805487, 'atr_max_pct': 0.133301101974882, 'tp_mult': 2.43905140409396, 'tsl_mult': 0.9688273891445756, 'strategy': 'breakout', 'time_stop': 187, 'use_sma': False, 'use_atr': False, 'use_adx': True, 'use_ema': False, 'use_spike': False, 'rsi_required': False, 'edge_k': 0.6666677711818629, 'edge_cap': 0.9478425118825176, 'bull_strategy': 'breakout', 'bull_bb_std_mult': 2.3588078828716386, 'bull_rsi_os': 54, 'bull_rsi_ob': 66, 'bull_adx_thresh': 32.018192609646945, 'bull_atr_min_pct': 0.02199394519787734, 'bull_atr_max_pct': 0.09548093453094075, 'bull_tp_mult': 1.1091308236293285, 'bull_tsl_mult': 0.628300333136122, 'bull_time_stop': 137, 'bull_use_sma': True, 'bull_use_ema': True, 'bull_use_atr': True, 'bull_use_adx': False, 'bull_use_spike': True, 'bull_rsi_required': False, 'bear_strategy': 'mean_reversion', 'bear_bb_std_mult': 2.688335620233145, 'bear_rsi_os': 23, 'bear_rsi_ob': 83, 'bear_adx_thresh': 5.994577275970772, 'bear_atr_min_pct': 0.00522781260321172, 'bear_atr_max_pct': 0.07591258029979606, 'bear_tp_mult': 1.4506033838021533, 'bear_tsl_mult': 0.6641096873680461, 'bear_time_stop': 48, 'bear_use_sma': True, 'bear_use_ema': False, 'bear_use_atr': True, 'bear_use_adx': True, 'bear_use_spike': True, 'bear_rsi_required': True, 'sideways_strategy': 'mean_reversion', 'sideways_bb_std_mult': 3.0335470461558396, 'sideways_rsi_os': 35, 'sideways_rsi_ob': 78, 'sideways_adx_thresh': 19.762390711536842, 'sideways_atr_min_pct': 0.008444860971059707, 'sideways_atr_max_pct': 0.12243884823249346, 'sideways_tp_mult': 2.393435609202917, 'sideways_tsl_mult': 0.3229385871438618, 'sideways_time_stop': 12, 'sideways_use_sma': True, 'sideways_use_ema': False, 'sideways_use_atr': True, 'sideways_use_adx': True, 'sideways_use_spike': True, 'sideways_rsi_required': True}.
