[I 2025-08-30 14:43:29,601] Trial 186 finished with values: [-1000000000.0, 1000000000.0] and parameters: {'p_sma': 58, 'p_std': 39, 'p_atr': 7, 'p_adx': 16, 'rsi_period': 71, 'ema1': 18, 'ema2': 25, 'slip_atr_k': 0.22820769234612776, 'slip_spread_k': 0.3589535929616873, 'spread_hl_frac': 0.04896196070466319, 'bb_std_mult': 3.4808790745637013, 'rsi_os': 21, 'rsi_ob': 77, 'vol_spike': 0.13558908518635737, 'adx_thresh': 9.308648364796204, 'atr_min_pct': 0.02245797637932727, 'atr_max_pct': 0.035767493085396625, 'tp_mult': 2.2223368618203723, 'tsl_mult': 0.37945446957834117, 'strategy': 'mean_reversion', 'time_stop': 184, 'use_sma': True, 'use_atr': True, 'use_adx': False, 'use_ema': True, 'use_spike': True, 'rsi_required': True, 'edge_k': 0.815679317071916, 'edge_cap': 0.4412697843324015, 'bull_strategy': 'mean_reversion', 'bull_bb_std_mult': 0.6595029412715672, 'bull_rsi_os': 16, 'bull_rsi_ob': 79, 'bull_adx_thresh': 21.34601378431036, 'bull_atr_min_pct': 0.0016812266816929908, 'bull_atr_max_pct': 0.07075236431698866, 'bull_tp_mult': 1.309343235656911, 'bull_tsl_mult': 0.30892925246584135, 'bull_time_stop': 202, 'bull_use_sma': True, 'bull_use_ema': True, 'bull_use_atr': False, 'bull_use_adx': False, 'bull_use_spike': True, 'bull_rsi_required': False, 'bear_strategy': 'breakout', 'bear_bb_std_mult': 0.8217189739246467, 'bear_rsi_os': 6, 'bear_rsi_ob': 64, 'bear_adx_thresh': 27.126619368598018, 'bear_atr_min_pct': 0.00456562073151121, 'bear_atr_max_pct': 0.12044073327049795, 'bear_tp_mult': 2.329571697132499, 'bear_tsl_mult': 0.12988561216828282, 'bear_time_stop': 130, 'bear_use_sma': False, 'bear_use_ema': True, 'bear_use_atr': False, 'bear_use_adx': False, 'bear_use_spike': False, 'bear_rsi_required': True, 'sideways_strategy': 'breakout', 'sideways_bb_std_mult': 1.999480511510332, 'sideways_rsi_os': 36, 'sideways_rsi_ob': 67, 'sideways_adx_thresh': 25.79888942300476, 'sideways_atr_min_pct': 0.006242976682394, 'sideways_atr_max_pct': 0.14962052772735981, 'sideways_tp_mult': 2.8208163884525077, 'sideways_tsl_mult': 0.06084326533240419, 'sideways_time_stop': 174, 'sideways_use_sma': False, 'sideways_use_ema': True, 'sideways_use_atr': False, 'sideways_use_adx': False, 'sideways_use_spike': True, 'sideways_rsi_required': True}.
[I 2025-08-30 14:44:00,052] Trial 190 finished with values: [-1000000000.0, 1000000000.0] and parameters: {'p_sma': 58, 'p_std': 10, 'p_atr': 21, 'p_adx': 9, 'rsi_period': 20, 'ema1': 15, 'ema2': 31, 'slip_atr_k': 0.07738547559507591, 'slip_spread_k': 0.44864165721490556, 'spread_hl_frac': 0.04727178199720993, 'bb_std_mult': 3.5989315136253537, 'rsi_os': 18, 'rsi_ob': 79, 'vol_spike': 0.0903387204785903, 'adx_thresh': 11.633714423935807, 'atr_min_pct': 0.02885648689953696, 'atr_max_pct': 0.03729492440321047, 'tp_mult': 2.142940172269537, 'tsl_mult': 0.04637056106535074, 'strategy': 'breakout', 'time_stop': 282, 'use_sma': False, 'use_atr': True, 'use_adx': False, 'use_ema': True, 'use_spike': False, 'rsi_required': True, 'edge_k': 0.5717710122054569, 'edge_cap': 0.16093006662090864, 'bull_strategy': 'mean_reversion', 'bull_bb_std_mult': 3.1004949835136006, 'bull_rsi_os': 40, 'bull_rsi_ob': 72, 'bull_adx_thresh': 17.513002518422372, 'bull_atr_min_pct': 0.012574371938617915, 'bull_atr_max_pct': 0.030032533682422157, 'bull_tp_mult': 2.2295318138883715, 'bull_tsl_mult': 0.9207601263575131, 'bull_time_stop': 84, 'bull_use_sma': False, 'bull_use_ema': False, 'bull_use_atr': False, 'bull_use_adx': True, 'bull_use_spike': False, 'bull_rsi_required': False, 'bear_strategy': 'breakout', 'bear_bb_std_mult': 0.68929080856801, 'bear_rsi_os': 23, 'bear_rsi_ob': 66, 'bear_adx_thresh': 29.857697694532334, 'bear_atr_min_pct': 0.010584501806593328, 'bear_atr_max_pct': 0.14990704129121948, 'bear_tp_mult': 2.8174018790390636, 'bear_tsl_mult': 0.824693735559416, 'bear_time_stop': 73, 'bear_use_sma': True, 'bear_use_ema': False, 'bear_use_atr': True, 'bear_use_adx': False, 'bear_use_spike': False, 'bear_rsi_required': False, 'sideways_strategy': 'breakout', 'sideways_bb_std_mult': 1.943996827292593, 'sideways_rsi_os': 48, 'sideways_rsi_ob': 87, 'sideways_adx_thresh': 28.627621484510076, 'sideways_atr_min_pct': 0.02929355796132145, 'sideways_atr_max_pct': 0.010028909058008996, 'sideways_tp_mult': 2.9118138236488695, 'sideways_tsl_mult': 0.6417531057458198, 'sideways_time_stop': 183, 'sideways_use_sma': False, 'sideways_use_ema': True, 'sideways_use_atr': True, 'sideways_use_adx': False, 'sideways_use_spike': False, 'sideways_rsi_required': False}.
[I 2025-08-30 14:44:00,542] Trial 192 finished with values: [-1000000000.0, 1000000000.0] and parameters: {'p_sma': 57, 'p_std': 10, 'p_atr': 28, 'p_adx': 26, 'rsi_period': 20, 'ema1': 15, 'ema2': 51, 'slip_atr_k': 0.12590842728923898, 'slip_spread_k': 0.24566071242242982, 'spread_hl_frac': 0.047432158047541396, 'bb_std_mult': 3.597004462947257, 'rsi_os': 37, 'rsi_ob': 79, 'vol_spike': 0.08966287579822471, 'adx_thresh': 9.021631847802544, 'atr_min_pct': 0.028849826135258192, 'atr_max_pct': 0.0326025208378012, 'tp_mult': 2.134808764304366, 'tsl_mult': 0.44712215169297986, 'strategy': 'breakout', 'time_stop': 282, 'use_sma': False, 'use_atr': True, 'use_adx': False, 'use_ema': True, 'use_spike': False, 'rsi_required': True, 'edge_k': 1.0462479260674171, 'edge_cap': 0.23766216788001354, 'bull_strategy': 'mean_reversion', 'bull_bb_std_mult': 1.2025945350050176, 'bull_rsi_os': 40, 'bull_rsi_ob': 72, 'bull_adx_thresh': 17.880049544854522, 'bull_atr_min_pct': 0.012223048150046767, 'bull_atr_max_pct': 0.02984717610462405, 'bull_tp_mult': 2.31273936034174, 'bull_tsl_mult': 0.5356646977405799, 'bull_time_stop': 90, 'bull_use_sma': False, 'bull_use_ema': False, 'bull_use_atr': False, 'bull_use_adx': True, 'bull_use_spike': False, 'bull_rsi_required': False, 'bear_strategy': 'breakout', 'bear_bb_std_mult': 0.6871447670956591, 'bear_rsi_os': 21, 'bear_rsi_ob': 66, 'bear_adx_thresh': 29.77771443556215, 'bear_atr_min_pct': 0.010513840583230101, 'bear_atr_max_pct': 0.1291172250562793, 'bear_tp_mult': 2.076662986845818, 'bear_tsl_mult': 0.8214989631472209, 'bear_time_stop': 163, 'bear_use_sma': True, 'bear_use_ema': False, 'bear_use_atr': True, 'bear_use_adx': False, 'bear_use_spike': False, 'bear_rsi_required': False, 'sideways_strategy': 'breakout', 'sideways_bb_std_mult': 2.4458654006555753, 'sideways_rsi_os': 48, 'sideways_rsi_ob': 59, 'sideways_adx_thresh': 26.574352445344413, 'sideways_atr_min_pct': 0.017524712347866574, 'sideways_atr_max_pct': 0.015887053575144843, 'sideways_tp_mult': 2.9195225097442585, 'sideways_tsl_mult': 0.05869654943750072, 'sideways_time_stop': 182, 'sideways_use_sma': False, 'sideways_use_ema': True, 'sideways_use_atr': True, 'sideways_use_adx': False, 'sideways_use_spike': False, 'sideways_rsi_required': False}.
[I 2025-08-30 14:44:00,799] Trial 193 finished with values: [-1000000000.0, 1000000000.0] and parameters: {'p_sma': 9, 'p_std': 10, 'p_atr': 21, 'p_adx': 26, 'rsi_period': 20, 'ema1': 15, 'ema2': 51, 'slip_atr_k': 0.10429363457359207, 'slip_spread_k': 0.6682362624825009, 'spread_hl_frac': 0.04724365949822758, 'bb_std_mult': 3.599440695741112, 'rsi_os': 29, 'rsi_ob': 79, 'vol_spike': 0.099352007904037, 'adx_thresh': 7.3015397943847695, 'atr_min_pct': 0.02879236163973845, 'atr_max_pct': 0.03873872284708489, 'tp_mult': 2.1432278054247016, 'tsl_mult': 0.043664745830496586, 'strategy': 'breakout', 'time_stop': 281, 'use_sma': False, 'use_atr': True, 'use_adx': False, 'use_ema': True, 'use_spike': False, 'rsi_required': True, 'edge_k': 1.0569257879774447, 'edge_cap': 0.5457504302620706, 'bull_strategy': 'mean_reversion', 'bull_bb_std_mult': 3.1160249843850614, 'bull_rsi_os': 42, 'bull_rsi_ob': 89, 'bull_adx_thresh': 17.805575775307798, 'bull_atr_min_pct': 0.010651220872270065, 'bull_atr_max_pct': 0.030093534191942446, 'bull_tp_mult': 2.217564380125308, 'bull_tsl_mult': 0.7804015910852677, 'bull_time_stop': 254, 'bull_use_sma': False, 'bull_use_ema': False, 'bull_use_atr': False, 'bull_use_adx': True, 'bull_use_spike': False, 'bull_rsi_required': False, 'bear_strategy': 'breakout', 'bear_bb_std_mult': 0.6818683506363125, 'bear_rsi_os': 15, 'bear_rsi_ob': 66, 'bear_adx_thresh': 29.78010192479004, 'bear_atr_min_pct': 0.010478774324488927, 'bear_atr_max_pct': 0.14931265083103545, 'bear_tp_mult': 1.5483373886979785, 'bear_tsl_mult': 0.6983209610273616, 'bear_time_stop': 163, 'bear_use_sma': True, 'bear_use_ema': False, 'bear_use_atr': True, 'bear_use_adx': False, 'bear_use_spike': False, 'bear_rsi_required': False, 'sideways_strategy': 'breakout', 'sideways_bb_std_mult': 2.273381959061773, 'sideways_rsi_os': 48, 'sideways_rsi_ob': 71, 'sideways_adx_thresh': 26.531072558330095, 'sideways_atr_min_pct': 0.02911620008287206, 'sideways_atr_max_pct': 0.05819386876706932, 'sideways_tp_mult': 2.929908841992098, 'sideways_tsl_mult': 0.33602528807547827, 'sideways_time_stop': 184, 'sideways_use_sma': False, 'sideways_use_ema': True, 'sideways_use_atr': True, 'sideways_use_adx': False, 'sideways_use_spike': False, 'sideways_rsi_required': False}.
[I 2025-08-30 14:44:00,963] Trial 191 finished with values: [-1000000000.0, 1000000000.0] and parameters: {'p_sma': 56, 'p_std': 18, 'p_atr': 9, 'p_adx': 15, 'rsi_period': 20, 'ema1': 15, 'ema2': 31, 'slip_atr_k': 0.12563334383198946, 'slip_spread_k': 0.7027183110904666, 'spread_hl_frac': 0.013620990394078717, 'bb_std_mult': 3.5237088281067663, 'rsi_os': 21, 'rsi_ob': 79, 'vol_spike': 0.0679702105987614, 'adx_thresh': 21.524800464244333, 'atr_min_pct': 0.014527983291371163, 'atr_max_pct': 0.03587461820651993, 'tp_mult': 2.1349065867526558, 'tsl_mult': 0.018509766287002016, 'strategy': 'breakout', 'time_stop': 292, 'use_sma': False, 'use_atr': True, 'use_adx': False, 'use_ema': True, 'use_spike': False, 'rsi_required': True, 'edge_k': 0.466314233373197, 'edge_cap': 0.24384106246569845, 'bull_strategy': 'mean_reversion', 'bull_bb_std_mult': 3.0963598429556627, 'bull_rsi_os': 20, 'bull_rsi_ob': 60, 'bull_adx_thresh': 17.832577892368043, 'bull_atr_min_pct': 0.012107935698398742, 'bull_atr_max_pct': 0.12981084512862348, 'bull_tp_mult': 2.2868197646902044, 'bull_tsl_mult': 0.7727963498238803, 'bull_time_stop': 256, 'bull_use_sma': False, 'bull_use_ema': False, 'bull_use_atr': False, 'bull_use_adx': True, 'bull_use_spike': False, 'bull_rsi_required': False, 'bear_strategy': 'breakout', 'bear_bb_std_mult': 0.6790331943908339, 'bear_rsi_os': 23, 'bear_rsi_ob': 66, 'bear_adx_thresh': 29.430466698435048, 'bear_atr_min_pct': 0.010592091622620765, 'bear_atr_max_pct': 0.1497473183480856, 'bear_tp_mult': 2.413572767770956, 'bear_tsl_mult': 0.31434929597824485, 'bear_time_stop': 149, 'bear_use_sma': True, 'bear_use_ema': False, 'bear_use_atr': True, 'bear_use_adx': False, 'bear_use_spike': False, 'bear_rsi_required': False, 'sideways_strategy': 'breakout', 'sideways_bb_std_mult': 1.959427074995197, 'sideways_rsi_os': 48, 'sideways_rsi_ob': 59, 'sideways_adx_thresh': 26.450027943060377, 'sideways_atr_min_pct': 0.017890928919699046, 'sideways_atr_max_pct': 0.010007503008230733, 'sideways_tp_mult': 2.9051120127778947, 'sideways_tsl_mult': 0.11414010032467121, 'sideways_time_stop': 184, 'sideways_use_sma': False, 'sideways_use_ema': True, 'sideways_use_atr': True, 'sideways_use_adx': False, 'sideways_use_spike': False, 'sideways_rsi_required': False}.
[I 2025-08-30 14:44:32,224] Trial 194 finished with values: [-1000000000.0, 1000000000.0] and parameters: {'p_sma': 19, 'p_std': 53, 'p_atr': 13, 'p_adx': 8, 'rsi_period': 21, 'ema1': 15, 'ema2': 32, 'slip_atr_k': 0.07079062334579021, 'slip_spread_k': 0.5087517882746582, 'spread_hl_frac': 0.047507708065015745, 'bb_std_mult': 3.533151043995208, 'rsi_os': 29, 'rsi_ob': 83, 'vol_spike': 0.15290424341678122, 'adx_thresh': 7.844756097940362, 'atr_min_pct': 0.029425855358010136, 'atr_max_pct': 0.07246336415236078, 'tp_mult': 2.547207901181709, 'tsl_mult': 0.11284610695541608, 'strategy': 'mean_reversion', 'time_stop': 291, 'use_sma': True, 'use_atr': True, 'use_adx': False, 'use_ema': True, 'use_spike': True, 'rsi_required': True, 'edge_k': 1.776488460602637, 'edge_cap': 0.5775368154154359, 'bull_strategy': 'mean_reversion', 'bull_bb_std_mult': 0.5534927823218132, 'bull_rsi_os': 20, 'bull_rsi_ob': 89, 'bull_adx_thresh': 29.953093496145108, 'bull_atr_min_pct': 0.013438885869372206, 'bull_atr_max_pct': 0.0231335843164237, 'bull_tp_mult': 2.2897756226592896, 'bull_tsl_mult': 0.9580575699913558, 'bull_time_stop': 90, 'bull_use_sma': False, 'bull_use_ema': False, 'bull_use_atr': False, 'bull_use_adx': True, 'bull_use_spike': False, 'bull_rsi_required': False, 'bear_strategy': 'breakout', 'bear_bb_std_mult': 0.5606891081591185, 'bear_rsi_os': 20, 'bear_rsi_ob': 63, 'bear_adx_thresh': 18.20277713145368, 'bear_atr_min_pct': 0.007130369327005327, 'bear_atr_max_pct': 0.09985638832847613, 'bear_tp_mult': 2.088956494954345, 'bear_tsl_mult': 0.7020528853207171, 'bear_time_stop': 163, 'bear_use_sma': False, 'bear_use_ema': True, 'bear_use_atr': False, 'bear_use_adx': False, 'bear_use_spike': False, 'bear_rsi_required': False, 'sideways_strategy': 'breakout', 'sideways_bb_std_mult': 2.0802376411381616, 'sideways_rsi_os': 47, 'sideways_rsi_ob': 64, 'sideways_adx_thresh': 29.377050092576823, 'sideways_atr_min_pct': 0.01791464513937565, 'sideways_atr_max_pct': 0.016180254283622054, 'sideways_tp_mult': 2.8463077962825087, 'sideways_tsl_mult': 0.14713697284598168, 'sideways_time_stop': 181, 'sideways_use_sma': False, 'sideways_use_ema': True, 'sideways_use_atr': False, 'sideways_use_adx': False, 'sideways_use_spike': False, 'sideways_rsi_required': False}.
[I 2025-08-30 14:44:32,702] Trial 195 finished with values: [-1000000000.0, 1000000000.0] and parameters: {'p_sma': 14, 'p_std': 8, 'p_atr': 13, 'p_adx': 8, 'rsi_period': 25, 'ema1': 16, 'ema2': 32, 'slip_atr_k': 0.07117553311384983, 'slip_spread_k': 0.5103113937501064, 'spread_hl_frac': 0.049021755944955586, 'bb_std_mult': 3.5183714826360477, 'rsi_os': 7, 'rsi_ob': 67, 'vol_spike': 0.2331606951486791, 'adx_thresh': 21.288926979875377, 'atr_min_pct': 0.007460399334181994, 'atr_max_pct': 0.03953244321545225, 'tp_mult': 2.0889000753088967, 'tsl_mult': 0.1039066904871887, 'strategy': 'mean_reversion', 'time_stop': 291, 'use_sma': True, 'use_atr': True, 'use_adx': False, 'use_ema': True, 'use_spike': True, 'rsi_required': True, 'edge_k': 0.7494142339430865, 'edge_cap': 0.4717178792979474, 'bull_strategy': 'mean_reversion', 'bull_bb_std_mult': 0.5004493565131575, 'bull_rsi_os': 20, 'bull_rsi_ob': 58, 'bull_adx_thresh': 20.613457205394962, 'bull_atr_min_pct': 0.010861391330131035, 'bull_atr_max_pct': 0.023932001408165787, 'bull_tp_mult': 1.208427238086377, 'bull_tsl_mult': 0.3379930492323875, 'bull_time_stop': 106, 'bull_use_sma': False, 'bull_use_ema': False, 'bull_use_atr': False, 'bull_use_adx': True, 'bull_use_spike': False, 'bull_rsi_required': False, 'bear_strategy': 'breakout', 'bear_bb_std_mult': 0.5537107351496864, 'bear_rsi_os': 20, 'bear_rsi_ob': 63, 'bear_adx_thresh': 34.41825197605262, 'bear_atr_min_pct': 0.0073605621413926564, 'bear_atr_max_pct': 0.14420022966170215, 'bear_tp_mult': 1.5405014194322935, 'bear_tsl_mult': 0.7056953973855608, 'bear_time_stop': 148, 'bear_use_sma': False, 'bear_use_ema': True, 'bear_use_atr': False, 'bear_use_adx': False, 'bear_use_spike': False, 'bear_rsi_required': False, 'sideways_strategy': 'breakout', 'sideways_bb_std_mult': 1.93567188587775, 'sideways_rsi_os': 24, 'sideways_rsi_ob': 65, 'sideways_adx_thresh': 25.02693228369273, 'sideways_atr_min_pct': 0.015603943762574271, 'sideways_atr_max_pct': 0.042641399457793945, 'sideways_tp_mult': 2.859443129896196, 'sideways_tsl_mult': 0.10533202085801963, 'sideways_time_stop': 164, 'sideways_use_sma': False, 'sideways_use_ema': True, 'sideways_use_atr': False, 'sideways_use_adx': False, 'sideways_use_spike': False, 'sideways_rsi_required': False}.
[I 2025-08-30 14:44:32,792] Trial 196 finished with values: [-1000000000.0, 1000000000.0] and parameters: {'p_sma': 20, 'p_std': 6, 'p_atr': 13, 'p_adx': 8, 'rsi_period': 25, 'ema1': 16, 'ema2': 32, 'slip_atr_k': 0.07194702491715511, 'slip_spread_k': 0.5055364209976341, 'spread_hl_frac': 0.021844386466826037, 'bb_std_mult': 3.526920898657063, 'rsi_os': 17, 'rsi_ob': 86, 'vol_spike': 0.012580073650588483, 'adx_thresh': 21.863154628289955, 'atr_min_pct': 0.008808054674495892, 'atr_max_pct': 0.027423843112506188, 'tp_mult': 1.0986673298450356, 'tsl_mult': 0.5221801204613674, 'strategy': 'mean_reversion', 'time_stop': 292, 'use_sma': True, 'use_atr': True, 'use_adx': False, 'use_ema': True, 'use_spike': True, 'rsi_required': True, 'edge_k': 0.47422436773651366, 'edge_cap': 0.5835419708431399, 'bull_strategy': 'breakout', 'bull_bb_std_mult': 1.3967338430213179, 'bull_rsi_os': 10, 'bull_rsi_ob': 81, 'bull_adx_thresh': 20.516344587726373, 'bull_atr_min_pct': 0.015406138566449927, 'bull_atr_max_pct': 0.0218310977481462, 'bull_tp_mult': 1.4048208487738834, 'bull_tsl_mult': 0.6406077553083346, 'bull_time_stop': 106, 'bull_use_sma': False, 'bull_use_ema': False, 'bull_use_atr': True, 'bull_use_adx': True, 'bull_use_spike': False, 'bull_rsi_required': False, 'bear_strategy': 'mean_reversion', 'bear_bb_std_mult': 0.6015185525044635, 'bear_rsi_os': 20, 'bear_rsi_ob': 63, 'bear_adx_thresh': 18.093123828049105, 'bear_atr_min_pct': 0.0090730399414171, 'bear_atr_max_pct': 0.037312456606698026, 'bear_tp_mult': 1.9708518096038858, 'bear_tsl_mult': 0.7790702888057911, 'bear_time_stop': 151, 'bear_use_sma': False, 'bear_use_ema': True, 'bear_use_atr': False, 'bear_use_adx': False, 'bear_use_spike': False, 'bear_rsi_required': False, 'sideways_strategy': 'breakout', 'sideways_bb_std_mult': 1.9414883608125892, 'sideways_rsi_os': 51, 'sideways_rsi_ob': 93, 'sideways_adx_thresh': 10.403172270002393, 'sideways_atr_min_pct': 0.020614074792380678, 'sideways_atr_max_pct': 0.04382896472627806, 'sideways_tp_mult': 2.869776728028351, 'sideways_tsl_mult': 0.15113440857741628, 'sideways_time_stop': 278, 'sideways_use_sma': False, 'sideways_use_ema': True, 'sideways_use_atr': False, 'sideways_use_adx': True, 'sideways_use_spike': False, 'sideways_rsi_required': False}.
[I 2025-08-30 14:44:32,882] Trial 197 finished with values: [-1000000000.0, 1000000000.0] and parameters: {'p_sma': 15, 'p_std': 6, 'p_atr': 11, 'p_adx': 18, 'rsi_period': 24, 'ema1': 16, 'ema2': 32, 'slip_atr_k': 0.08124551771222727, 'slip_spread_k': 0.5109807538443369, 'spread_hl_frac': 0.010661724425323517, 'bb_std_mult': 3.526885023164497, 'rsi_os': 17, 'rsi_ob': 67, 'vol_spike': 0.001329998706107005, 'adx_thresh': 27.069261923902904, 'atr_min_pct': 0.029971606523570362, 'atr_max_pct': 0.032119809933566904, 'tp_mult': 2.076330726986219, 'tsl_mult': 0.10357749541596037, 'strategy': 'mean_reversion', 'time_stop': 293, 'use_sma': True, 'use_atr': True, 'use_adx': True, 'use_ema': True, 'use_spike': True, 'rsi_required': False, 'edge_k': 0.8617658829469779, 'edge_cap': 0.5795813538468894, 'bull_strategy': 'breakout', 'bull_bb_std_mult': 2.5135902185466255, 'bull_rsi_os': 10, 'bull_rsi_ob': 81, 'bull_adx_thresh': 19.755341938762324, 'bull_atr_min_pct': 0.013474491242457923, 'bull_atr_max_pct': 0.023456977392616134, 'bull_tp_mult': 1.3957210450518422, 'bull_tsl_mult': 0.0058285548156686295, 'bull_time_stop': 104, 'bull_use_sma': False, 'bull_use_ema': False, 'bull_use_atr': True, 'bull_use_adx': True, 'bull_use_spike': False, 'bull_rsi_required': True, 'bear_strategy': 'mean_reversion', 'bear_bb_std_mult': 0.5539778250101859, 'bear_rsi_os': 20, 'bear_rsi_ob': 63, 'bear_adx_thresh': 28.566609130864325, 'bear_atr_min_pct': 0.011990809784762744, 'bear_atr_max_pct': 0.10137196533441556, 'bear_tp_mult': 1.9765080691338646, 'bear_tsl_mult': 0.2548489259436987, 'bear_time_stop': 243, 'bear_use_sma': False, 'bear_use_ema': True, 'bear_use_atr': False, 'bear_use_adx': True, 'bear_use_spike': True, 'bear_rsi_required': False, 'sideways_strategy': 'breakout', 'sideways_bb_std_mult': 0.601738186845574, 'sideways_rsi_os': 31, 'sideways_rsi_ob': 93, 'sideways_adx_thresh': 10.832489356864935, 'sideways_atr_min_pct': 0.015820618325484998, 'sideways_atr_max_pct': 0.04777346055083383, 'sideways_tp_mult': 2.8586512720911736, 'sideways_tsl_mult': 0.14818591143420506, 'sideways_time_stop': 163, 'sideways_use_sma': False, 'sideways_use_ema': True, 'sideways_use_atr': False, 'sideways_use_adx': True, 'sideways_use_spike': False, 'sideways_rsi_required': False}.
