[I 2025-08-30 15:30:34,033] Trial 479 finished with values: [-1000000000.0, 1000000000.0] and parameters: {'p_sma': 10, 'p_std': 21, 'p_atr': 12, 'p_adx': 24, 'rsi_period': 13, 'ema1': 25, 'ema2': 33, 'slip_atr_k': 0.005204702522839557, 'slip_spread_k': 0.6928723439324498, 'spread_hl_frac': 0.004612169769205433, 'bb_std_mult': 0.5652337711754296, 'rsi_os': 23, 'rsi_ob': 87, 'vol_spike': 0.21357546079470635, 'adx_thresh': 6.091515534723179, 'atr_min_pct': 0.00820377404715878, 'atr_max_pct': 0.11124597190135628, 'tp_mult': 1.5561515016636003, 'tsl_mult': 0.3771926573282472, 'strategy': 'breakout', 'time_stop': 150, 'use_sma': False, 'use_atr': False, 'use_adx': True, 'use_ema': False, 'use_spike': False, 'rsi_required': False, 'edge_k': 0.5483982071018659, 'edge_cap': 0.9447795312164402, 'bull_strategy': 'breakout', 'bull_bb_std_mult': 1.9386797399716043, 'bull_rsi_os': 49, 'bull_rsi_ob': 92, 'bull_adx_thresh': 9.624087433342435, 'bull_atr_min_pct': 0.020302411877983994, 'bull_atr_max_pct': 0.10765069364252389, 'bull_tp_mult': 2.647858677266094, 'bull_tsl_mult': 0.8888430617965951, 'bull_time_stop': 45, 'bull_use_sma': True, 'bull_use_ema': True, 'bull_use_atr': True, 'bull_use_adx': True, 'bull_use_spike': True, 'bull_rsi_required': False, 'bear_strategy': 'mean_reversion', 'bear_bb_std_mult': 1.8856313976798607, 'bear_rsi_os': 29, 'bear_rsi_ob': 72, 'bear_adx_thresh': 14.788300372012417, 'bear_atr_min_pct': 0.0048346034845524275, 'bear_atr_max_pct': 0.10965678468644194, 'bear_tp_mult': 2.7869997581330783, 'bear_tsl_mult': 0.8722067154467362, 'bear_time_stop': 104, 'bear_use_sma': True, 'bear_use_ema': False, 'bear_use_atr': True, 'bear_use_adx': True, 'bear_use_spike': True, 'bear_rsi_required': True, 'sideways_strategy': 'mean_reversion', 'sideways_bb_std_mult': 3.0148795929105083, 'sideways_rsi_os': 29, 'sideways_rsi_ob': 82, 'sideways_adx_thresh': 11.350346708225485, 'sideways_atr_min_pct': 0.020581585185198523, 'sideways_atr_max_pct': 0.07555888745040852, 'sideways_tp_mult': 2.0949115239637077, 'sideways_tsl_mult': 0.38439617001838117, 'sideways_time_stop': 131, 'sideways_use_sma': True, 'sideways_use_ema': False, 'sideways_use_atr': True, 'sideways_use_adx': True, 'sideways_use_spike': True, 'sideways_rsi_required': True}.
[I 2025-08-30 15:30:35,250] Trial 480 finished with values: [-0.0043938343974541105, 0.0070184253660458915] and parameters: {'p_sma': 13, 'p_std': 22, 'p_atr': 12, 'p_adx': 24, 'rsi_period': 8, 'ema1': 25, 'ema2': 36, 'slip_atr_k': 0.004417428317627821, 'slip_spread_k': 0.6946564965407304, 'spread_hl_frac': 0.0047057645119322564, 'bb_std_mult': 0.5491594344401547, 'rsi_os': 23, 'rsi_ob': 87, 'vol_spike': 0.213665812369964, 'adx_thresh': 8.879068305114387, 'atr_min_pct': 0.008297499642423253, 'atr_max_pct': 0.11211671982701166, 'tp_mult': 1.562845831978019, 'tsl_mult': 0.3801089659654808, 'strategy': 'breakout', 'time_stop': 141, 'use_sma': False, 'use_atr': False, 'use_adx': True, 'use_ema': False, 'use_spike': False, 'rsi_required': False, 'edge_k': 0.5546588998633523, 'edge_cap': 0.9476015615515185, 'bull_strategy': 'breakout', 'bull_bb_std_mult': 1.6138672859452825, 'bull_rsi_os': 49, 'bull_rsi_ob': 92, 'bull_adx_thresh': 9.705235962593234, 'bull_atr_min_pct': 0.019796670767559164, 'bull_atr_max_pct': 0.10829303664683104, 'bull_tp_mult': 2.644561884752667, 'bull_tsl_mult': 0.8841633938414233, 'bull_time_stop': 46, 'bull_use_sma': True, 'bull_use_ema': True, 'bull_use_atr': True, 'bull_use_adx': True, 'bull_use_spike': True, 'bull_rsi_required': False, 'bear_strategy': 'mean_reversion', 'bear_bb_std_mult': 1.857711045340631, 'bear_rsi_os': 29, 'bear_rsi_ob': 72, 'bear_adx_thresh': 14.776980906241432, 'bear_atr_min_pct': 0.0029122433960083495, 'bear_atr_max_pct': 0.11039405090862187, 'bear_tp_mult': 2.785425461375231, 'bear_tsl_mult': 0.8534244406999212, 'bear_time_stop': 104, 'bear_use_sma': True, 'bear_use_ema': False, 'bear_use_atr': True, 'bear_use_adx': True, 'bear_use_spike': True, 'bear_rsi_required': True, 'sideways_strategy': 'mean_reversion', 'sideways_bb_std_mult': 3.0114092228507734, 'sideways_rsi_os': 29, 'sideways_rsi_ob': 79, 'sideways_adx_thresh': 11.653732749855514, 'sideways_atr_min_pct': 0.020043993698748278, 'sideways_atr_max_pct': 0.07923000706174603, 'sideways_tp_mult': 2.2444064867157705, 'sideways_tsl_mult': 0.3889462076243191, 'sideways_time_stop': 130, 'sideways_use_sma': True, 'sideways_use_ema': False, 'sideways_use_atr': True, 'sideways_use_adx': True, 'sideways_use_spike': True, 'sideways_rsi_required': True}.
[I 2025-08-30 15:30:35,257] Trial 477 finished with values: [-0.0009584337702488455, 0.005651597936888112] and parameters: {'p_sma': 10, 'p_std': 21, 'p_atr': 11, 'p_adx': 25, 'rsi_period': 8, 'ema1': 25, 'ema2': 34, 'slip_atr_k': 6.363181871224186e-05, 'slip_spread_k': 0.7394315010302716, 'spread_hl_frac': 0.005908876650367159, 'bb_std_mult': 0.5970710279156556, 'rsi_os': 22, 'rsi_ob': 87, 'vol_spike': 0.21530790881012324, 'adx_thresh': 9.266737105119287, 'atr_min_pct': 0.008090595651898852, 'atr_max_pct': 0.12058753678719254, 'tp_mult': 1.5587901339214898, 'tsl_mult': 0.3858590218781052, 'strategy': 'breakout', 'time_stop': 143, 'use_sma': False, 'use_atr': False, 'use_adx': True, 'use_ema': False, 'use_spike': False, 'rsi_required': False, 'edge_k': 0.7305100751136071, 'edge_cap': 0.9539322970977084, 'bull_strategy': 'breakout', 'bull_bb_std_mult': 1.6144719202683762, 'bull_rsi_os': 49, 'bull_rsi_ob': 92, 'bull_adx_thresh': 9.706259071114815, 'bull_atr_min_pct': 0.019943976095632275, 'bull_atr_max_pct': 0.10261304529686543, 'bull_tp_mult': 2.632428154846166, 'bull_tsl_mult': 0.8540309582837633, 'bull_time_stop': 60, 'bull_use_sma': True, 'bull_use_ema': True, 'bull_use_atr': True, 'bull_use_adx': True, 'bull_use_spike': True, 'bull_rsi_required': False, 'bear_strategy': 'mean_reversion', 'bear_bb_std_mult': 2.1205542520426786, 'bear_rsi_os': 29, 'bear_rsi_ob': 73, 'bear_adx_thresh': 14.740225882972293, 'bear_atr_min_pct': 0.0027855222866947733, 'bear_atr_max_pct': 0.10892197476629042, 'bear_tp_mult': 2.722663638245103, 'bear_tsl_mult': 0.8498878643214951, 'bear_time_stop': 108, 'bear_use_sma': True, 'bear_use_ema': False, 'bear_use_atr': True, 'bear_use_adx': True, 'bear_use_spike': True, 'bear_rsi_required': True, 'sideways_strategy': 'mean_reversion', 'sideways_bb_std_mult': 3.097855035346073, 'sideways_rsi_os': 29, 'sideways_rsi_ob': 82, 'sideways_adx_thresh': 10.333598663517472, 'sideways_atr_min_pct': 0.020147156124963938, 'sideways_atr_max_pct': 0.07589932311309691, 'sideways_tp_mult': 2.2455712957414997, 'sideways_tsl_mult': 0.4180073805970788, 'sideways_time_stop': 132, 'sideways_use_sma': True, 'sideways_use_ema': False, 'sideways_use_atr': True, 'sideways_use_adx': True, 'sideways_use_spike': True, 'sideways_rsi_required': True}.
[I 2025-08-30 15:30:36,018] Trial 478 finished with values: [-0.0009631021439178156, 0.0060417583172511025] and parameters: {'p_sma': 10, 'p_std': 21, 'p_atr': 11, 'p_adx': 25, 'rsi_period': 8, 'ema1': 25, 'ema2': 33, 'slip_atr_k': 0.003700929840507642, 'slip_spread_k': 0.7349024462520144, 'spread_hl_frac': 0.004523539416494255, 'bb_std_mult': 0.6097541176581533, 'rsi_os': 23, 'rsi_ob': 87, 'vol_spike': 0.21403790687510754, 'adx_thresh': 8.850778673832181, 'atr_min_pct': 0.008068222906369372, 'atr_max_pct': 0.12045585385870716, 'tp_mult': 1.5496794207265572, 'tsl_mult': 0.38208525856389375, 'strategy': 'breakout', 'time_stop': 145, 'use_sma': False, 'use_atr': False, 'use_adx': True, 'use_ema': False, 'use_spike': False, 'rsi_required': False, 'edge_k': 0.5558342493121654, 'edge_cap': 0.9472947941159521, 'bull_strategy': 'breakout', 'bull_bb_std_mult': 1.6210513311027306, 'bull_rsi_os': 49, 'bull_rsi_ob': 92, 'bull_adx_thresh': 9.775539826101067, 'bull_atr_min_pct': 0.019975540902746256, 'bull_atr_max_pct': 0.10174521138324955, 'bull_tp_mult': 2.637460448353063, 'bull_tsl_mult': 0.8921265823685396, 'bull_time_stop': 37, 'bull_use_sma': True, 'bull_use_ema': True, 'bull_use_atr': True, 'bull_use_adx': True, 'bull_use_spike': True, 'bull_rsi_required': False, 'bear_strategy': 'mean_reversion', 'bear_bb_std_mult': 2.142954542691903, 'bear_rsi_os': 29, 'bear_rsi_ob': 75, 'bear_adx_thresh': 14.827963775337816, 'bear_atr_min_pct': 0.0027600824227387083, 'bear_atr_max_pct': 0.10922869547639737, 'bear_tp_mult': 2.7868930548973383, 'bear_tsl_mult': 0.8670172811683456, 'bear_time_stop': 111, 'bear_use_sma': True, 'bear_use_ema': False, 'bear_use_atr': True, 'bear_use_adx': True, 'bear_use_spike': True, 'bear_rsi_required': True, 'sideways_strategy': 'mean_reversion', 'sideways_bb_std_mult': 3.0068031846549004, 'sideways_rsi_os': 29, 'sideways_rsi_ob': 79, 'sideways_adx_thresh': 11.419634811314502, 'sideways_atr_min_pct': 0.01996850415923522, 'sideways_atr_max_pct': 0.07546480706948365, 'sideways_tp_mult': 2.0946362910358816, 'sideways_tsl_mult': 0.3839956181864452, 'sideways_time_stop': 130, 'sideways_use_sma': True, 'sideways_use_ema': False, 'sideways_use_atr': True, 'sideways_use_adx': True, 'sideways_use_spike': True, 'sideways_rsi_required': True}.
[I 2025-08-30 15:31:30,701] Trial 484 finished with values: [-0.024938880892377502, 0.024876230691892307] and parameters: {'p_sma': 8, 'p_std': 22, 'p_atr': 11, 'p_adx': 25, 'rsi_period': 8, 'ema1': 24, 'ema2': 37, 'slip_atr_k': 0.2443674560485486, 'slip_spread_k': 0.7121474453771387, 'spread_hl_frac': 0.006962210681407183, 'bb_std_mult': 0.67787611433639, 'rsi_os': 20, 'rsi_ob': 87, 'vol_spike': 0.21233971982020572, 'adx_thresh': 9.989256224910383, 'atr_min_pct': 0.009187609421920784, 'atr_max_pct': 0.11257363238990041, 'tp_mult': 1.416067469402109, 'tsl_mult': 0.35379262195750405, 'strategy': 'breakout', 'time_stop': 157, 'use_sma': False, 'use_atr': False, 'use_adx': True, 'use_ema': False, 'use_spike': False, 'rsi_required': False, 'edge_k': 0.5854153954564655, 'edge_cap': 0.9787123855213679, 'bull_strategy': 'breakout', 'bull_bb_std_mult': 1.6369440446766437, 'bull_rsi_os': 49, 'bull_rsi_ob': 88, 'bull_adx_thresh': 9.642341708647615, 'bull_atr_min_pct': 0.01951628451739766, 'bull_atr_max_pct': 0.10331554231528287, 'bull_tp_mult': 2.7488682927394787, 'bull_tsl_mult': 0.8841035261669661, 'bull_time_stop': 32, 'bull_use_sma': True, 'bull_use_ema': True, 'bull_use_atr': True, 'bull_use_adx': True, 'bull_use_spike': True, 'bull_rsi_required': False, 'bear_strategy': 'mean_reversion', 'bear_bb_std_mult': 1.8513948411357966, 'bear_rsi_os': 26, 'bear_rsi_ob': 72, 'bear_adx_thresh': 15.814697773395253, 'bear_atr_min_pct': 0.00264468003525884, 'bear_atr_max_pct': 0.10884500623052394, 'bear_tp_mult': 2.684064005084127, 'bear_tsl_mult': 0.8472321307023633, 'bear_time_stop': 93, 'bear_use_sma': True, 'bear_use_ema': False, 'bear_use_atr': True, 'bear_use_adx': True, 'bear_use_spike': True, 'bear_rsi_required': True, 'sideways_strategy': 'mean_reversion', 'sideways_bb_std_mult': 2.846223350547108, 'sideways_rsi_os': 33, 'sideways_rsi_ob': 76, 'sideways_adx_thresh': 10.729739794631447, 'sideways_atr_min_pct': 0.019916777251089094, 'sideways_atr_max_pct': 0.07169573584372102, 'sideways_tp_mult': 2.2400995241742137, 'sideways_tsl_mult': 0.3789127537388114, 'sideways_time_stop': 129, 'sideways_use_sma': True, 'sideways_use_ema': False, 'sideways_use_atr': True, 'sideways_use_adx': True, 'sideways_use_spike': True, 'sideways_rsi_required': True}.
[I 2025-08-30 15:31:30,704] Trial 483 finished with values: [-0.006868076503877774, 0.01052005145302919] and parameters: {'p_sma': 9, 'p_std': 22, 'p_atr': 12, 'p_adx': 25, 'rsi_period': 8, 'ema1': 24, 'ema2': 37, 'slip_atr_k': 0.05979262616077029, 'slip_spread_k': 0.7069130944894169, 'spread_hl_frac': 0.0072439281192799194, 'bb_std_mult': 0.6201586769328736, 'rsi_os': 22, 'rsi_ob': 87, 'vol_spike': 0.21376326928627296, 'adx_thresh': 31.999213930737106, 'atr_min_pct': 0.008158548119321114, 'atr_max_pct': 0.11243839524546184, 'tp_mult': 1.5317074012407126, 'tsl_mult': 0.346735007156485, 'strategy': 'breakout', 'time_stop': 156, 'use_sma': False, 'use_atr': False, 'use_adx': True, 'use_ema': False, 'use_spike': False, 'rsi_required': False, 'edge_k': 0.5765132490674298, 'edge_cap': 0.9829483897656126, 'bull_strategy': 'breakout', 'bull_bb_std_mult': 1.6222588729277565, 'bull_rsi_os': 49, 'bull_rsi_ob': 88, 'bull_adx_thresh': 9.63919370042285, 'bull_atr_min_pct': 0.019205200690326045, 'bull_atr_max_pct': 0.10367860428643556, 'bull_tp_mult': 2.7593143385918038, 'bull_tsl_mult': 0.8722741779007288, 'bull_time_stop': 48, 'bull_use_sma': True, 'bull_use_ema': True, 'bull_use_atr': True, 'bull_use_adx': True, 'bull_use_spike': True, 'bull_rsi_required': False, 'bear_strategy': 'mean_reversion', 'bear_bb_std_mult': 2.128550841733448, 'bear_rsi_os': 26, 'bear_rsi_ob': 75, 'bear_adx_thresh': 15.664569658748688, 'bear_atr_min_pct': 0.0026669634198235193, 'bear_atr_max_pct': 0.10958565157354651, 'bear_tp_mult': 2.632660685399263, 'bear_tsl_mult': 0.84389410148267, 'bear_time_stop': 92, 'bear_use_sma': True, 'bear_use_ema': False, 'bear_use_atr': True, 'bear_use_adx': True, 'bear_use_spike': True, 'bear_rsi_required': True, 'sideways_strategy': 'mean_reversion', 'sideways_bb_std_mult': 2.872485746971975, 'sideways_rsi_os': 33, 'sideways_rsi_ob': 76, 'sideways_adx_thresh': 10.810899624611901, 'sideways_atr_min_pct': 0.019785014024352288, 'sideways_atr_max_pct': 0.07125913525791047, 'sideways_tp_mult': 2.238459948334705, 'sideways_tsl_mult': 0.3837742825181579, 'sideways_time_stop': 128, 'sideways_use_sma': True, 'sideways_use_ema': False, 'sideways_use_atr': True, 'sideways_use_adx': True, 'sideways_use_spike': True, 'sideways_rsi_required': True}.
[I 2025-08-30 15:31:30,716] Trial 482 finished with values: [0.001590257746842294, 0.0028924624043773204] and parameters: {'p_sma': 8, 'p_std': 21, 'p_atr': 12, 'p_adx': 25, 'rsi_period': 9, 'ema1': 24, 'ema2': 37, 'slip_atr_k': 0.00023769177032378073, 'slip_spread_k': 0.7084578445583244, 'spread_hl_frac': 0.007029358327512716, 'bb_std_mult': 0.6244325575148123, 'rsi_os': 27, 'rsi_ob': 87, 'vol_spike': 0.21626326661298173, 'adx_thresh': 8.807958988444964, 'atr_min_pct': 0.006299529098566271, 'atr_max_pct': 0.11294520243970059, 'tp_mult': 1.5147321420141067, 'tsl_mult': 0.3546402148752088, 'strategy': 'breakout', 'time_stop': 157, 'use_sma': False, 'use_atr': False, 'use_adx': True, 'use_ema': False, 'use_spike': False, 'rsi_required': False, 'edge_k': 0.5800353787328694, 'edge_cap': 0.969087049880602, 'bull_strategy': 'breakout', 'bull_bb_std_mult': 1.6226363694452597, 'bull_rsi_os': 49, 'bull_rsi_ob': 88, 'bull_adx_thresh': 9.574282950625644, 'bull_atr_min_pct': 0.01964786464232032, 'bull_atr_max_pct': 0.10319333567000238, 'bull_tp_mult': 2.5840734838419555, 'bull_tsl_mult': 0.8798821479363559, 'bull_time_stop': 54, 'bull_use_sma': True, 'bull_use_ema': True, 'bull_use_atr': True, 'bull_use_adx': True, 'bull_use_spike': True, 'bull_rsi_required': False, 'bear_strategy': 'mean_reversion', 'bear_bb_std_mult': 1.8640934346898852, 'bear_rsi_os': 26, 'bear_rsi_ob': 75, 'bear_adx_thresh': 15.516650918145405, 'bear_atr_min_pct': 0.0026573440452226363, 'bear_atr_max_pct': 0.10970917004076071, 'bear_tp_mult': 2.676402913374347, 'bear_tsl_mult': 0.8531484592163388, 'bear_time_stop': 94, 'bear_use_sma': True, 'bear_use_ema': False, 'bear_use_atr': True, 'bear_use_adx': True, 'bear_use_spike': True, 'bear_rsi_required': True, 'sideways_strategy': 'mean_reversion', 'sideways_bb_std_mult': 3.158366686018786, 'sideways_rsi_os': 16, 'sideways_rsi_ob': 79, 'sideways_adx_thresh': 10.830523801675854, 'sideways_atr_min_pct': 0.019775095303540168, 'sideways_atr_max_pct': 0.07054055137952639, 'sideways_tp_mult': 1.3626347694730927, 'sideways_tsl_mult': 0.3816725301907739, 'sideways_time_stop': 128, 'sideways_use_sma': True, 'sideways_use_ema': False, 'sideways_use_atr': True, 'sideways_use_adx': True, 'sideways_use_spike': True, 'sideways_rsi_required': True}.
[I 2025-08-30 15:31:31,715] Trial 481 finished with values: [-0.0029357102886832243, 0.005970336926573422] and parameters: {'p_sma': 9, 'p_std': 21, 'p_atr': 11, 'p_adx': 25, 'rsi_period': 9, 'ema1': 24, 'ema2': 37, 'slip_atr_k': 0.0047495608209983334, 'slip_spread_k': 0.7078947459214094, 'spread_hl_frac': 0.005818175737936472, 'bb_std_mult': 0.6410406558474573, 'rsi_os': 27, 'rsi_ob': 86, 'vol_spike': 0.2258515425358752, 'adx_thresh': 8.824088203115286, 'atr_min_pct': 0.008193683202851033, 'atr_max_pct': 0.11627236759971443, 'tp_mult': 1.5128149533744484, 'tsl_mult': 0.3509459391181527, 'strategy': 'breakout', 'time_stop': 143, 'use_sma': False, 'use_atr': False, 'use_adx': True, 'use_ema': False, 'use_spike': False, 'rsi_required': False, 'edge_k': 0.5740033956643419, 'edge_cap': 0.9997419762121995, 'bull_strategy': 'breakout', 'bull_bb_std_mult': 1.610512442853073, 'bull_rsi_os': 46, 'bull_rsi_ob': 88, 'bull_adx_thresh': 9.626650314427502, 'bull_atr_min_pct': 0.019424508714608626, 'bull_atr_max_pct': 0.10386974014437751, 'bull_tp_mult': 2.5931616918615568, 'bull_tsl_mult': 0.849879286483199, 'bull_time_stop': 58, 'bull_use_sma': True, 'bull_use_ema': True, 'bull_use_atr': True, 'bull_use_adx': True, 'bull_use_spike': True, 'bull_rsi_required': False, 'bear_strategy': 'mean_reversion', 'bear_bb_std_mult': 2.1347065496939868, 'bear_rsi_os': 29, 'bear_rsi_ob': 72, 'bear_adx_thresh': 15.724313985740226, 'bear_atr_min_pct': 0.0028033926634288345, 'bear_atr_max_pct': 0.10925817505762776, 'bear_tp_mult': 2.6872817525735258, 'bear_tsl_mult': 0.8448103220105968, 'bear_time_stop': 93, 'bear_use_sma': True, 'bear_use_ema': False, 'bear_use_atr': True, 'bear_use_adx': True, 'bear_use_spike': True, 'bear_rsi_required': True, 'sideways_strategy': 'mean_reversion', 'sideways_bb_std_mult': 2.843373971399108, 'sideways_rsi_os': 31, 'sideways_rsi_ob': 76, 'sideways_adx_thresh': 10.730681779085575, 'sideways_atr_min_pct': 0.01970550189435204, 'sideways_atr_max_pct': 0.07911532846326123, 'sideways_tp_mult': 2.2327519776674016, 'sideways_tsl_mult': 0.34295569046544055, 'sideways_time_stop': 128, 'sideways_use_sma': True, 'sideways_use_ema': False, 'sideways_use_atr': True, 'sideways_use_adx': True, 'sideways_use_spike': True, 'sideways_rsi_required': True}.
[I 2025-08-30 15:32:23,256] Trial 487 finished with values: [-1000000000.0, 1000000000.0] and parameters: {'p_sma': 6, 'p_std': 21, 'p_atr': 13, 'p_adx': 25, 'rsi_period': 9, 'ema1': 22, 'ema2': 24, 'slip_atr_k': 0.23157946888347622, 'slip_spread_k': 0.6831951535487453, 'spread_hl_frac': 0.009190255329131591, 'bb_std_mult': 0.5491262792846039, 'rsi_os': 29, 'rsi_ob': 64, 'vol_spike': 0.20755621795004703, 'adx_thresh': 9.832251410877804, 'atr_min_pct': 0.006339892595199667, 'atr_max_pct': 0.14363283225948542, 'tp_mult': 1.4573512752564637, 'tsl_mult': 0.29318820307975435, 'strategy': 'mean_reversion', 'time_stop': 170, 'use_sma': True, 'use_atr': True, 'use_adx': False, 'use_ema': True, 'use_spike': True, 'rsi_required': True, 'edge_k': 0.7299932479346624, 'edge_cap': 0.9198840491683892, 'bull_strategy': 'mean_reversion', 'bull_bb_std_mult': 1.590677643808473, 'bull_rsi_os': 49, 'bull_rsi_ob': 85, 'bull_adx_thresh': 9.962110169278834, 'bull_atr_min_pct': 0.02042567310408256, 'bull_atr_max_pct': 0.10668265735858548, 'bull_tp_mult': 2.5136888216718867, 'bull_tsl_mult': 0.8416457537841332, 'bull_time_stop': 61, 'bull_use_sma': False, 'bull_use_ema': False, 'bull_use_atr': True, 'bull_use_adx': True, 'bull_use_spike': False, 'bull_rsi_required': True, 'bear_strategy': 'breakout', 'bear_bb_std_mult': 1.8135057881625625, 'bear_rsi_os': 25, 'bear_rsi_ob': 76, 'bear_adx_thresh': 14.694193346839162, 'bear_atr_min_pct': 0.0014254616415261326, 'bear_atr_max_pct': 0.11576384180727192, 'bear_tp_mult': 2.6008450871192297, 'bear_tsl_mult': 0.8199605821116308, 'bear_time_stop': 90, 'bear_use_sma': False, 'bear_use_ema': True, 'bear_use_atr': False, 'bear_use_adx': True, 'bear_use_spike': False, 'bear_rsi_required': False, 'sideways_strategy': 'breakout', 'sideways_bb_std_mult': 3.1315801777822583, 'sideways_rsi_os': 14, 'sideways_rsi_ob': 82, 'sideways_adx_thresh': 12.00937635311358, 'sideways_atr_min_pct': 0.019079185547600304, 'sideways_atr_max_pct': 0.06414866133552914, 'sideways_tp_mult': 1.8055108489197644, 'sideways_tsl_mult': 0.4385387582875552, 'sideways_time_stop': 130, 'sideways_use_sma': False, 'sideways_use_ema': True, 'sideways_use_atr': False, 'sideways_use_adx': True, 'sideways_use_spike': False, 'sideways_rsi_required': False}.
