[I 2025-08-30 14:26:30,190] Trial 46 finished with values: [-0.039349088858632086, 0.039279725473681075] and parameters: {'p_sma': 33, 'p_std': 5, 'p_atr': 18, 'p_adx': 8, 'rsi_period': 14, 'ema1': 21, 'ema2': 24, 'slip_atr_k': 0.24174714484188772, 'slip_spread_k': 0.4154638059736321, 'spread_hl_frac': 0.0493240508144101, 'bb_std_mult': 2.4545418179601133, 'rsi_os': 9, 'rsi_ob': 62, 'vol_spike': 0.18624068500427193, 'adx_thresh': 16.03801846662174, 'atr_min_pct': 0.00705383177490951, 'atr_max_pct': 0.010895626775673559, 'tp_mult': 2.4453658817797033, 'tsl_mult': 0.7100543957804906, 'strategy': 'mean_reversion', 'time_stop': 224, 'use_sma': False, 'use_atr': False, 'use_adx': True, 'use_ema': True, 'use_spike': False, 'rsi_required': True, 'edge_k': 0.33336189409705197, 'edge_cap': 0.3419573694095732, 'bull_strategy': 'breakout', 'bull_bb_std_mult': 0.8735912076908274, 'bull_rsi_os': 26, 'bull_rsi_ob': 81, 'bull_adx_thresh': 30.757577426508504, 'bull_atr_min_pct': 0.00045596998176264045, 'bull_atr_max_pct': 0.02140786532780787, 'bull_tp_mult': 1.1192537786726104, 'bull_tsl_mult': 0.766925766897151, 'bull_time_stop': 21, 'bull_use_sma': False, 'bull_use_ema': True, 'bull_use_atr': False, 'bull_use_adx': False, 'bull_use_spike': False, 'bull_rsi_required': False, 'bear_strategy': 'mean_reversion', 'bear_bb_std_mult': 3.2647396061097522, 'bear_rsi_os': 19, 'bear_rsi_ob': 95, 'bear_adx_thresh': 8.51030628219413, 'bear_atr_min_pct': 0.002532021740613924, 'bear_atr_max_pct': 0.13694768881585212, 'bear_tp_mult': 1.748702950655455, 'bear_tsl_mult': 0.6949557474537247, 'bear_time_stop': 190, 'bear_use_sma': True, 'bear_use_ema': True, 'bear_use_atr': False, 'bear_use_adx': False, 'bear_use_spike': True, 'bear_rsi_required': False, 'sideways_strategy': 'breakout', 'sideways_bb_std_mult': 3.506410789753855, 'sideways_rsi_os': 5, 'sideways_rsi_ob': 68, 'sideways_adx_thresh': 29.77987517394373, 'sideways_atr_min_pct': 0.029835952234059066, 'sideways_atr_max_pct': 0.012618564894589734, 'sideways_tp_mult': 2.8778337880822016, 'sideways_tsl_mult': 0.11260854954502289, 'sideways_time_stop': 214, 'sideways_use_sma': True, 'sideways_use_ema': True, 'sideways_use_atr': False, 'sideways_use_adx': False, 'sideways_use_spike': False, 'sideways_rsi_required': True}.
[I 2025-08-30 14:26:30,499] Trial 45 finished with values: [-0.023361838523818568, 0.023395719679533508] and parameters: {'p_sma': 33, 'p_std': 5, 'p_atr': 18, 'p_adx': 7, 'rsi_period': 57, 'ema1': 7, 'ema2': 39, 'slip_atr_k': 0.000463458964612945, 'slip_spread_k': 0.5664264034025241, 'spread_hl_frac': 0.012762737846433257, 'bb_std_mult': 0.7265982329637408, 'rsi_os': 43, 'rsi_ob': 61, 'vol_spike': 0.18595970156792502, 'adx_thresh': 34.999258524725036, 'atr_min_pct': 0.006783195566760539, 'atr_max_pct': 0.05814329753475635, 'tp_mult': 2.4676167843684667, 'tsl_mult': 0.15428545407664876, 'strategy': 'mean_reversion', 'time_stop': 14, 'use_sma': False, 'use_atr': True, 'use_adx': True, 'use_ema': True, 'use_spike': False, 'rsi_required': False, 'edge_k': 0.278852905948226, 'edge_cap': 0.33848425272991367, 'bull_strategy': 'mean_reversion', 'bull_bb_std_mult': 0.9338913467393857, 'bull_rsi_os': 53, 'bull_rsi_ob': 81, 'bull_adx_thresh': 34.88127447775348, 'bull_atr_min_pct': 0.0005574866242595626, 'bull_atr_max_pct': 0.019410681790381128, 'bull_tp_mult': 1.1327085141428404, 'bull_tsl_mult': 0.7815586415129462, 'bull_time_stop': 28, 'bull_use_sma': False, 'bull_use_ema': False, 'bull_use_atr': False, 'bull_use_adx': False, 'bull_use_spike': False, 'bull_rsi_required': False, 'bear_strategy': 'breakout', 'bear_bb_std_mult': 1.5074426042856464, 'bear_rsi_os': 19, 'bear_rsi_ob': 95, 'bear_adx_thresh': 32.85953973718909, 'bear_atr_min_pct': 0.0030971454327885922, 'bear_atr_max_pct': 0.13793934170811128, 'bear_tp_mult': 1.759203248457489, 'bear_tsl_mult': 0.0013128445284600887, 'bear_time_stop': 190, 'bear_use_sma': True, 'bear_use_ema': True, 'bear_use_atr': False, 'bear_use_adx': False, 'bear_use_spike': True, 'bear_rsi_required': False, 'sideways_strategy': 'breakout', 'sideways_bb_std_mult': 3.5092079140559362, 'sideways_rsi_os': 5, 'sideways_rsi_ob': 66, 'sideways_adx_thresh': 16.422139339376976, 'sideways_atr_min_pct': 0.02980045590390675, 'sideways_atr_max_pct': 0.01409335365225851, 'sideways_tp_mult': 2.8336366149574093, 'sideways_tsl_mult': 0.6594073430375688, 'sideways_time_stop': 263, 'sideways_use_sma': False, 'sideways_use_ema': True, 'sideways_use_atr': False, 'sideways_use_adx': False, 'sideways_use_spike': False, 'sideways_rsi_required': True}.
[I 2025-08-30 14:26:30,603] Trial 48 finished with values: [-0.012811153701514755, 0.0127846603479203] and parameters: {'p_sma': 33, 'p_std': 15, 'p_atr': 30, 'p_adx': 8, 'rsi_period': 15, 'ema1': 17, 'ema2': 41, 'slip_atr_k': 0.24588815038436396, 'slip_spread_k': 0.41108689612987537, 'spread_hl_frac': 0.011455483309640264, 'bb_std_mult': 0.6971516201519197, 'rsi_os': 28, 'rsi_ob': 59, 'vol_spike': 0.18277762933755015, 'adx_thresh': 13.59565988027268, 'atr_min_pct': 0.0002319272097680656, 'atr_max_pct': 0.011121159844835166, 'tp_mult': 2.2973798826811924, 'tsl_mult': 0.691091587442261, 'strategy': 'mean_reversion', 'time_stop': 224, 'use_sma': False, 'use_atr': True, 'use_adx': False, 'use_ema': True, 'use_spike': False, 'rsi_required': True, 'edge_k': 1.8027596472479828, 'edge_cap': 0.6139274595989138, 'bull_strategy': 'breakout', 'bull_bb_std_mult': 0.6866183110606121, 'bull_rsi_os': 52, 'bull_rsi_ob': 82, 'bull_adx_thresh': 30.76095233057553, 'bull_atr_min_pct': 0.02049405571809805, 'bull_atr_max_pct': 0.018171705533878955, 'bull_tp_mult': 1.1069203901267368, 'bull_tsl_mult': 0.7971710332098766, 'bull_time_stop': 55, 'bull_use_sma': False, 'bull_use_ema': True, 'bull_use_atr': False, 'bull_use_adx': True, 'bull_use_spike': False, 'bull_rsi_required': False, 'bear_strategy': 'mean_reversion', 'bear_bb_std_mult': 3.1933191359914783, 'bear_rsi_os': 17, 'bear_rsi_ob': 73, 'bear_adx_thresh': 7.242736689539067, 'bear_atr_min_pct': 0.002624495194595536, 'bear_atr_max_pct': 0.13761776798903677, 'bear_tp_mult': 1.5113727219264586, 'bear_tsl_mult': 0.002713875443796976, 'bear_time_stop': 187, 'bear_use_sma': True, 'bear_use_ema': True, 'bear_use_atr': False, 'bear_use_adx': True, 'bear_use_spike': True, 'bear_rsi_required': False, 'sideways_strategy': 'breakout', 'sideways_bb_std_mult': 3.429895893752488, 'sideways_rsi_os': 13, 'sideways_rsi_ob': 66, 'sideways_adx_thresh': 15.682397334912427, 'sideways_atr_min_pct': 0.0026523162815371443, 'sideways_atr_max_pct': 0.12739499475611754, 'sideways_tp_mult': 2.861179713854152, 'sideways_tsl_mult': 0.12285036800588967, 'sideways_time_stop': 272, 'sideways_use_sma': True, 'sideways_use_ema': True, 'sideways_use_atr': False, 'sideways_use_adx': False, 'sideways_use_spike': True, 'sideways_rsi_required': False}.
[I 2025-08-30 14:26:30,680] Trial 47 finished with values: [-1000000000.0, 1000000000.0] and parameters: {'p_sma': 53, 'p_std': 21, 'p_atr': 18, 'p_adx': 8, 'rsi_period': 46, 'ema1': 17, 'ema2': 25, 'slip_atr_k': 0.2332708722203236, 'slip_spread_k': 0.4252939171460768, 'spread_hl_frac': 0.003896026197833689, 'bb_std_mult': 0.7452062414444606, 'rsi_os': 9, 'rsi_ob': 58, 'vol_spike': 0.09619350240630428, 'adx_thresh': 23.417630065106326, 'atr_min_pct': 1.1608303143439416e-05, 'atr_max_pct': 0.05571446444855009, 'tp_mult': 2.297788056225264, 'tsl_mult': 0.16916517543677073, 'strategy': 'mean_reversion', 'time_stop': 222, 'use_sma': False, 'use_atr': True, 'use_adx': True, 'use_ema': True, 'use_spike': False, 'rsi_required': True, 'edge_k': 0.23442605722266474, 'edge_cap': 0.642329694022685, 'bull_strategy': 'breakout', 'bull_bb_std_mult': 3.363578689397851, 'bull_rsi_os': 25, 'bull_rsi_ob': 82, 'bull_adx_thresh': 28.56061538383273, 'bull_atr_min_pct': 0.027081528748910327, 'bull_atr_max_pct': 0.02055272019475133, 'bull_tp_mult': 1.1492112094839309, 'bull_tsl_mult': 0.6492779765673794, 'bull_time_stop': 25, 'bull_use_sma': False, 'bull_use_ema': True, 'bull_use_atr': False, 'bull_use_adx': True, 'bull_use_spike': False, 'bull_rsi_required': False, 'bear_strategy': 'mean_reversion', 'bear_bb_std_mult': 0.7713129032463422, 'bear_rsi_os': 18, 'bear_rsi_ob': 45, 'bear_adx_thresh': 19.046953403800263, 'bear_atr_min_pct': 0.002800392534970912, 'bear_atr_max_pct': 0.1372727967578277, 'bear_tp_mult': 1.762794643106202, 'bear_tsl_mult': 0.016370496129415713, 'bear_time_stop': 240, 'bear_use_sma': True, 'bear_use_ema': True, 'bear_use_atr': True, 'bear_use_adx': True, 'bear_use_spike': True, 'bear_rsi_required': False, 'sideways_strategy': 'breakout', 'sideways_bb_std_mult': 3.461337801308934, 'sideways_rsi_os': 13, 'sideways_rsi_ob': 71, 'sideways_adx_thresh': 34.07937982014541, 'sideways_atr_min_pct': 0.0024734336239827844, 'sideways_atr_max_pct': 0.08836467654688465, 'sideways_tp_mult': 2.8688064950197125, 'sideways_tsl_mult': 0.057794462857342785, 'sideways_time_stop': 78, 'sideways_use_sma': False, 'sideways_use_ema': True, 'sideways_use_atr': False, 'sideways_use_adx': False, 'sideways_use_spike': True, 'sideways_rsi_required': False}.
[I 2025-08-30 14:27:03,824] Trial 49 finished with values: [-1000000000.0, 1000000000.0] and parameters: {'p_sma': 32, 'p_std': 35, 'p_atr': 29, 'p_adx': 21, 'rsi_period': 36, 'ema1': 17, 'ema2': 39, 'slip_atr_k': 0.005724908146494387, 'slip_spread_k': 0.3006792851177399, 'spread_hl_frac': 0.012153057398413186, 'bb_std_mult': 0.7168473878689307, 'rsi_os': 28, 'rsi_ob': 82, 'vol_spike': 0.28398692871538955, 'adx_thresh': 28.156512452061083, 'atr_min_pct': 0.00013217821500726389, 'atr_max_pct': 0.02186280212493623, 'tp_mult': 2.148602040880097, 'tsl_mult': 0.2809170194986083, 'strategy': 'mean_reversion', 'time_stop': 226, 'use_sma': False, 'use_atr': True, 'use_adx': False, 'use_ema': True, 'use_spike': False, 'rsi_required': True, 'edge_k': 1.06270105879603, 'edge_cap': 0.6428502812109843, 'bull_strategy': 'breakout', 'bull_bb_std_mult': 3.304697905792297, 'bull_rsi_os': 51, 'bull_rsi_ob': 74, 'bull_adx_thresh': 27.760357906888096, 'bull_atr_min_pct': 0.026910353699713438, 'bull_atr_max_pct': 0.015680463827931937, 'bull_tp_mult': 1.107268447684939, 'bull_tsl_mult': 0.14193127202574352, 'bull_time_stop': 55, 'bull_use_sma': False, 'bull_use_ema': True, 'bull_use_atr': False, 'bull_use_adx': True, 'bull_use_spike': False, 'bull_rsi_required': False, 'bear_strategy': 'mean_reversion', 'bear_bb_std_mult': 2.0443737305950114, 'bear_rsi_os': 25, 'bear_rsi_ob': 73, 'bear_adx_thresh': 30.81104709943877, 'bear_atr_min_pct': 0.008804964699453686, 'bear_atr_max_pct': 0.1451078917639641, 'bear_tp_mult': 1.5218236850692184, 'bear_tsl_mult': 0.8445613557174138, 'bear_time_stop': 240, 'bear_use_sma': True, 'bear_use_ema': False, 'bear_use_atr': True, 'bear_use_adx': True, 'bear_use_spike': True, 'bear_rsi_required': True, 'sideways_strategy': 'breakout', 'sideways_bb_std_mult': 0.9243502629548432, 'sideways_rsi_os': 12, 'sideways_rsi_ob': 64, 'sideways_adx_thresh': 15.796000508919471, 'sideways_atr_min_pct': 0.017355429227776935, 'sideways_atr_max_pct': 0.09269360993184306, 'sideways_tp_mult': 2.0916092052816126, 'sideways_tsl_mult': 0.05936869648616571, 'sideways_time_stop': 259, 'sideways_use_sma': False, 'sideways_use_ema': True, 'sideways_use_atr': True, 'sideways_use_adx': False, 'sideways_use_spike': True, 'sideways_rsi_required': False}.
[I 2025-08-30 14:27:04,000] Trial 52 finished with values: [-1000000000.0, 1000000000.0] and parameters: {'p_sma': 36, 'p_std': 35, 'p_atr': 7, 'p_adx': 23, 'rsi_period': 65, 'ema1': 12, 'ema2': 41, 'slip_atr_k': 0.10428287578751216, 'slip_spread_k': 0.3014918556222537, 'spread_hl_frac': 0.021390953625004396, 'bb_std_mult': 0.6129992244476307, 'rsi_os': 35, 'rsi_ob': 82, 'vol_spike': 0.1189667996422041, 'adx_thresh': 31.40104918794346, 'atr_min_pct': 0.001424529146304681, 'atr_max_pct': 0.04378360705657487, 'tp_mult': 2.162369475161626, 'tsl_mult': 0.7540280856494941, 'strategy': 'breakout', 'time_stop': 193, 'use_sma': False, 'use_atr': False, 'use_adx': False, 'use_ema': False, 'use_spike': True, 'rsi_required': True, 'edge_k': 1.8162920013537511, 'edge_cap': 0.742075236695614, 'bull_strategy': 'mean_reversion', 'bull_bb_std_mult': 2.251816247277477, 'bull_rsi_os': 50, 'bull_rsi_ob': 75, 'bull_adx_thresh': 27.72408036863311, 'bull_atr_min_pct': 0.020486224371093147, 'bull_atr_max_pct': 0.030069642322159508, 'bull_tp_mult': 1.3428739091149042, 'bull_tsl_mult': 0.11000522773689692, 'bull_time_stop': 52, 'bull_use_sma': False, 'bull_use_ema': True, 'bull_use_atr': True, 'bull_use_adx': False, 'bull_use_spike': False, 'bull_rsi_required': False, 'bear_strategy': 'breakout', 'bear_bb_std_mult': 2.383122031375064, 'bear_rsi_os': 5, 'bear_rsi_ob': 73, 'bear_adx_thresh': 13.633013818442507, 'bear_atr_min_pct': 0.022687697687500268, 'bear_atr_max_pct': 0.14361959649333605, 'bear_tp_mult': 1.2870028997746599, 'bear_tsl_mult': 0.14053082864148514, 'bear_time_stop': 148, 'bear_use_sma': False, 'bear_use_ema': False, 'bear_use_atr': True, 'bear_use_adx': True, 'bear_use_spike': True, 'bear_rsi_required': True, 'sideways_strategy': 'breakout', 'sideways_bb_std_mult': 0.8519079770353597, 'sideways_rsi_os': 50, 'sideways_rsi_ob': 64, 'sideways_adx_thresh': 12.377926267686542, 'sideways_atr_min_pct': 0.008296573170729644, 'sideways_atr_max_pct': 0.0740475270656015, 'sideways_tp_mult': 2.3381400165003225, 'sideways_tsl_mult': 0.4111612981173587, 'sideways_time_stop': 143, 'sideways_use_sma': True, 'sideways_use_ema': True, 'sideways_use_atr': True, 'sideways_use_adx': True, 'sideways_use_spike': False, 'sideways_rsi_required': False}.
[I 2025-08-30 14:27:04,134] Trial 51 finished with values: [-1000000000.0, 1000000000.0] and parameters: {'p_sma': 36, 'p_std': 35, 'p_atr': 7, 'p_adx': 9, 'rsi_period': 36, 'ema1': 12, 'ema2': 41, 'slip_atr_k': 0.11222859681757354, 'slip_spread_k': 0.26149470373021927, 'spread_hl_frac': 0.02192944299512061, 'bb_std_mult': 0.6216903067635633, 'rsi_os': 47, 'rsi_ob': 82, 'vol_spike': 0.29222315931357, 'adx_thresh': 12.726721272979908, 'atr_min_pct': 0.0040455608038733664, 'atr_max_pct': 0.050784034232631864, 'tp_mult': 2.324127833713624, 'tsl_mult': 0.7801412686689972, 'strategy': 'breakout', 'time_stop': 196, 'use_sma': False, 'use_atr': False, 'use_adx': False, 'use_ema': True, 'use_spike': False, 'rsi_required': True, 'edge_k': 1.8059745627313004, 'edge_cap': 0.6278942206921844, 'bull_strategy': 'breakout', 'bull_bb_std_mult': 0.6584488255950509, 'bull_rsi_os': 51, 'bull_rsi_ob': 91, 'bull_adx_thresh': 28.35317270354777, 'bull_atr_min_pct': 0.027482848991194422, 'bull_atr_max_pct': 0.013261551349698837, 'bull_tp_mult': 1.327668242861158, 'bull_tsl_mult': 0.6110542090408587, 'bull_time_stop': 52, 'bull_use_sma': False, 'bull_use_ema': True, 'bull_use_atr': False, 'bull_use_adx': True, 'bull_use_spike': False, 'bull_rsi_required': False, 'bear_strategy': 'mean_reversion', 'bear_bb_std_mult': 0.6919239728812526, 'bear_rsi_os': 5, 'bear_rsi_ob': 46, 'bear_adx_thresh': 31.02061703267801, 'bear_atr_min_pct': 0.026319399007530483, 'bear_atr_max_pct': 0.14391782762413804, 'bear_tp_mult': 2.264822770484402, 'bear_tsl_mult': 0.8481951945438788, 'bear_time_stop': 152, 'bear_use_sma': False, 'bear_use_ema': False, 'bear_use_atr': True, 'bear_use_adx': True, 'bear_use_spike': True, 'bear_rsi_required': False, 'sideways_strategy': 'breakout', 'sideways_bb_std_mult': 0.696015128519597, 'sideways_rsi_os': 50, 'sideways_rsi_ob': 71, 'sideways_adx_thresh': 12.47729450956005, 'sideways_atr_min_pct': 0.00829116961214979, 'sideways_atr_max_pct': 0.09128532799014377, 'sideways_tp_mult': 1.244470823111408, 'sideways_tsl_mult': 0.05700087562850252, 'sideways_time_stop': 89, 'sideways_use_sma': True, 'sideways_use_ema': True, 'sideways_use_atr': True, 'sideways_use_adx': False, 'sideways_use_spike': True, 'sideways_rsi_required': False}.
[I 2025-08-30 14:27:04,329] Trial 50 finished with values: [-1000000000.0, 1000000000.0] and parameters: {'p_sma': 38, 'p_std': 15, 'p_atr': 30, 'p_adx': 20, 'rsi_period': 46, 'ema1': 18, 'ema2': 54, 'slip_atr_k': 0.10977775907009797, 'slip_spread_k': 0.98841622593469, 'spread_hl_frac': 0.02047773701600225, 'bb_std_mult': 0.6102791953669554, 'rsi_os': 27, 'rsi_ob': 58, 'vol_spike': 0.28855852087950057, 'adx_thresh': 24.472799537615053, 'atr_min_pct': 0.0009638159241860201, 'atr_max_pct': 0.051226593957174264, 'tp_mult': 2.3081619384435967, 'tsl_mult': 0.772317857216306, 'strategy': 'mean_reversion', 'time_stop': 223, 'use_sma': False, 'use_atr': False, 'use_adx': False, 'use_ema': False, 'use_spike': True, 'rsi_required': True, 'edge_k': 1.8579503516291447, 'edge_cap': 0.6379971500258752, 'bull_strategy': 'breakout', 'bull_bb_std_mult': 2.6881381532212356, 'bull_rsi_os': 17, 'bull_rsi_ob': 75, 'bull_adx_thresh': 28.29533093756575, 'bull_atr_min_pct': 0.027557536209906662, 'bull_atr_max_pct': 0.030236583926424955, 'bull_tp_mult': 1.369472714589631, 'bull_tsl_mult': 0.6363123370336452, 'bull_time_stop': 53, 'bull_use_sma': False, 'bull_use_ema': True, 'bull_use_atr': False, 'bull_use_adx': True, 'bull_use_spike': False, 'bull_rsi_required': False, 'bear_strategy': 'mean_reversion', 'bear_bb_std_mult': 2.1785929135134605, 'bear_rsi_os': 36, 'bear_rsi_ob': 45, 'bear_adx_thresh': 30.47138291109784, 'bear_atr_min_pct': 0.010852520090308976, 'bear_atr_max_pct': 0.14402098187541218, 'bear_tp_mult': 1.2770153627094973, 'bear_tsl_mult': 0.8398708960085105, 'bear_time_stop': 33, 'bear_use_sma': True, 'bear_use_ema': False, 'bear_use_atr': True, 'bear_use_adx': True, 'bear_use_spike': True, 'bear_rsi_required': True, 'sideways_strategy': 'mean_reversion', 'sideways_bb_std_mult': 1.0489080420262193, 'sideways_rsi_os': 49, 'sideways_rsi_ob': 72, 'sideways_adx_thresh': 34.530654174024335, 'sideways_atr_min_pct': 0.0016569305341839324, 'sideways_atr_max_pct': 0.09986346144037894, 'sideways_tp_mult': 1.0803028344831944, 'sideways_tsl_mult': 0.40497214690335376, 'sideways_time_stop': 93, 'sideways_use_sma': True, 'sideways_use_ema': True, 'sideways_use_atr': True, 'sideways_use_adx': False, 'sideways_use_spike': True, 'sideways_rsi_required': False}.
[I 2025-08-30 14:27:04,608] Trial 55 finished with values: [-1000000000.0, 1000000000.0] and parameters: {'p_sma': 24, 'p_std': 15, 'p_atr': 25, 'p_adx': 17, 'rsi_period': 56, 'ema1': 15, 'ema2': 34, 'slip_atr_k': 0.050628830996523225, 'slip_spread_k': 0.5112253298172933, 'spread_hl_frac': 0.01727354664562402, 'bb_std_mult': 2.885117903497849, 'rsi_os': 40, 'rsi_ob': 85, 'vol_spike': 0.1363685373685196, 'adx_thresh': 33.74388116520483, 'atr_min_pct': 0.024459862438833337, 'atr_max_pct': 0.011232616055194482, 'tp_mult': 1.3662524596052528, 'tsl_mult': 0.05439524080221375, 'strategy': 'breakout', 'time_stop': 241, 'use_sma': False, 'use_atr': False, 'use_adx': False, 'use_ema': False, 'use_spike': True, 'rsi_required': False, 'edge_k': 1.5420034057843037, 'edge_cap': 0.5161946452526665, 'bull_strategy': 'mean_reversion', 'bull_bb_std_mult': 1.8429899911215826, 'bull_rsi_os': 43, 'bull_rsi_ob': 51, 'bull_adx_thresh': 30.965810740755067, 'bull_atr_min_pct': 0.002409508106934662, 'bull_atr_max_pct': 0.13186618556515328, 'bull_tp_mult': 2.6397920829591177, 'bull_tsl_mult': 0.17707835463005517, 'bull_time_stop': 227, 'bull_use_sma': True, 'bull_use_ema': True, 'bull_use_atr': False, 'bull_use_adx': False, 'bull_use_spike': True, 'bull_rsi_required': True, 'bear_strategy': 'breakout', 'bear_bb_std_mult': 2.9562659156379567, 'bear_rsi_os': 26, 'bear_rsi_ob': 67, 'bear_adx_thresh': 33.44283541101528, 'bear_atr_min_pct': 0.02016965513043454, 'bear_atr_max_pct': 0.13215139186447777, 'bear_tp_mult': 2.010006251059681, 'bear_tsl_mult': 0.7122067959180765, 'bear_time_stop': 39, 'bear_use_sma': True, 'bear_use_ema': True, 'bear_use_atr': False, 'bear_use_adx': False, 'bear_use_spike': True, 'bear_rsi_required': False, 'sideways_strategy': 'mean_reversion', 'sideways_bb_std_mult': 2.981819043824565, 'sideways_rsi_os': 8, 'sideways_rsi_ob': 88, 'sideways_adx_thresh': 30.468713460220954, 'sideways_atr_min_pct': 0.0003643359429567807, 'sideways_atr_max_pct': 0.016929593993571388, 'sideways_tp_mult': 1.0552273371290375, 'sideways_tsl_mult': 0.13922922201745613, 'sideways_time_stop': 211, 'sideways_use_sma': True, 'sideways_use_ema': True, 'sideways_use_atr': True, 'sideways_use_adx': False, 'sideways_use_spike': False, 'sideways_rsi_required': True}.
