[I 2025-08-30 15:12:30,082] Trial 394 finished with values: [-1000000000.0, 1000000000.0] and parameters: {'p_sma': 16, 'p_std': 28, 'p_atr': 11, 'p_adx': 25, 'rsi_period': 52, 'ema1': 25, 'ema2': 36, 'slip_atr_k': 0.0017682895286735096, 'slip_spread_k': 0.7156221356247608, 'spread_hl_frac': 0.005632200944172952, 'bb_std_mult': 3.173995091051006, 'rsi_os': 23, 'rsi_ob': 87, 'vol_spike': 0.1978121926529164, 'adx_thresh': 7.88492929243531, 'atr_min_pct': 0.007264465584912386, 'atr_max_pct': 0.1161667676424491, 'tp_mult': 1.6462516848699953, 'tsl_mult': 0.5329088630064219, 'strategy': 'breakout', 'time_stop': 134, 'use_sma': False, 'use_atr': False, 'use_adx': True, 'use_ema': False, 'use_spike': False, 'rsi_required': False, 'edge_k': 0.5602486643796423, 'edge_cap': 0.9284154948481571, 'bull_strategy': 'breakout', 'bull_bb_std_mult': 1.504341020251544, 'bull_rsi_os': 34, 'bull_rsi_ob': 89, 'bull_adx_thresh': 11.51687196618072, 'bull_atr_min_pct': 0.006942120938243199, 'bull_atr_max_pct': 0.11417207702940979, 'bull_tp_mult': 2.613517558685092, 'bull_tsl_mult': 0.9319429199079818, 'bull_time_stop': 48, 'bull_use_sma': True, 'bull_use_ema': True, 'bull_use_atr': True, 'bull_use_adx': False, 'bull_use_spike': True, 'bull_rsi_required': False, 'bear_strategy': 'mean_reversion', 'bear_bb_std_mult': 1.3894546672985582, 'bear_rsi_os': 28, 'bear_rsi_ob': 76, 'bear_adx_thresh': 12.099382598510653, 'bear_atr_min_pct': 0.003411056710794646, 'bear_atr_max_pct': 0.1182993699746796, 'bear_tp_mult': 2.2768470408002677, 'bear_tsl_mult': 0.5979328746294061, 'bear_time_stop': 93, 'bear_use_sma': True, 'bear_use_ema': False, 'bear_use_atr': True, 'bear_use_adx': True, 'bear_use_spike': True, 'bear_rsi_required': True, 'sideways_strategy': 'mean_reversion', 'sideways_bb_std_mult': 3.2559679339721996, 'sideways_rsi_os': 29, 'sideways_rsi_ob': 51, 'sideways_adx_thresh': 9.633437178066021, 'sideways_atr_min_pct': 0.017230401684431067, 'sideways_atr_max_pct': 0.08104134413483385, 'sideways_tp_mult': 2.0813562273734196, 'sideways_tsl_mult': 0.24344440546097224, 'sideways_time_stop': 113, 'sideways_use_sma': True, 'sideways_use_ema': False, 'sideways_use_atr': True, 'sideways_use_adx': True, 'sideways_use_spike': True, 'sideways_rsi_required': True}.
[I 2025-08-30 15:13:18,960] Trial 400 finished with values: [-1000000000.0, 1000000000.0] and parameters: {'p_sma': 15, 'p_std': 27, 'p_atr': 10, 'p_adx': 26, 'rsi_period': 50, 'ema1': 24, 'ema2': 38, 'slip_atr_k': 0.005225421836829503, 'slip_spread_k': 0.6707579358890156, 'spread_hl_frac': 0.0067365682600031345, 'bb_std_mult': 3.210636291596816, 'rsi_os': 25, 'rsi_ob': 86, 'vol_spike': 0.15229427115092187, 'adx_thresh': 7.634663885531807, 'atr_min_pct': 0.007887893244313627, 'atr_max_pct': 0.12103656605702616, 'tp_mult': 1.7182307395195977, 'tsl_mult': 0.5664703440607708, 'strategy': 'breakout', 'time_stop': 146, 'use_sma': False, 'use_atr': False, 'use_adx': True, 'use_ema': False, 'use_spike': False, 'rsi_required': False, 'edge_k': 0.529592729521239, 'edge_cap': 0.6834294560228349, 'bull_strategy': 'breakout', 'bull_bb_std_mult': 1.6114122058053104, 'bull_rsi_os': 36, 'bull_rsi_ob': 90, 'bull_adx_thresh': 10.660964421149027, 'bull_atr_min_pct': 0.013855636201333973, 'bull_atr_max_pct': 0.11796977117886116, 'bull_tp_mult': 2.6601819950195615, 'bull_tsl_mult': 0.9322216686000296, 'bull_time_stop': 63, 'bull_use_sma': True, 'bull_use_ema': True, 'bull_use_atr': True, 'bull_use_adx': False, 'bull_use_spike': True, 'bull_rsi_required': True, 'bear_strategy': 'mean_reversion', 'bear_bb_std_mult': 1.2719568238464218, 'bear_rsi_os': 29, 'bear_rsi_ob': 77, 'bear_adx_thresh': 10.998997430633802, 'bear_atr_min_pct': 0.00248838486975242, 'bear_atr_max_pct': 0.09772547414765098, 'bear_tp_mult': 2.5178695386453187, 'bear_tsl_mult': 0.5949324964074847, 'bear_time_stop': 120, 'bear_use_sma': True, 'bear_use_ema': False, 'bear_use_atr': True, 'bear_use_adx': True, 'bear_use_spike': True, 'bear_rsi_required': True, 'sideways_strategy': 'mean_reversion', 'sideways_bb_std_mult': 3.4463928915337445, 'sideways_rsi_os': 28, 'sideways_rsi_ob': 49, 'sideways_adx_thresh': 8.56663595495889, 'sideways_atr_min_pct': 0.02668182672177584, 'sideways_atr_max_pct': 0.08063608306609706, 'sideways_tp_mult': 2.111874058094506, 'sideways_tsl_mult': 0.46279358406136595, 'sideways_time_stop': 116, 'sideways_use_sma': True, 'sideways_use_ema': False, 'sideways_use_atr': True, 'sideways_use_adx': True, 'sideways_use_spike': True, 'sideways_rsi_required': True}.
[I 2025-08-30 15:13:19,341] Trial 399 finished with values: [-1000000000.0, 1000000000.0] and parameters: {'p_sma': 17, 'p_std': 29, 'p_atr': 10, 'p_adx': 26, 'rsi_period': 51, 'ema1': 24, 'ema2': 38, 'slip_atr_k': 0.005633946247512533, 'slip_spread_k': 0.6822724739533799, 'spread_hl_frac': 0.006018044543285596, 'bb_std_mult': 3.2515470068954984, 'rsi_os': 24, 'rsi_ob': 86, 'vol_spike': 0.1990338158587299, 'adx_thresh': 7.678917285588821, 'atr_min_pct': 0.007524702059581637, 'atr_max_pct': 0.11759406727422508, 'tp_mult': 1.7076004623853969, 'tsl_mult': 0.5633349256610463, 'strategy': 'breakout', 'time_stop': 145, 'use_sma': False, 'use_atr': False, 'use_adx': True, 'use_ema': False, 'use_spike': False, 'rsi_required': False, 'edge_k': 0.533058366623641, 'edge_cap': 0.9259932012393235, 'bull_strategy': 'breakout', 'bull_bb_std_mult': 1.4647247023343206, 'bull_rsi_os': 29, 'bull_rsi_ob': 90, 'bull_adx_thresh': 12.292777037807427, 'bull_atr_min_pct': 0.013629843039691539, 'bull_atr_max_pct': 0.11911759103993012, 'bull_tp_mult': 2.660167763789732, 'bull_tsl_mult': 0.9377919042491152, 'bull_time_stop': 59, 'bull_use_sma': True, 'bull_use_ema': True, 'bull_use_atr': True, 'bull_use_adx': False, 'bull_use_spike': True, 'bull_rsi_required': True, 'bear_strategy': 'mean_reversion', 'bear_bb_std_mult': 1.270951137104006, 'bear_rsi_os': 28, 'bear_rsi_ob': 77, 'bear_adx_thresh': 12.536440716014955, 'bear_atr_min_pct': 0.0021491231187267578, 'bear_atr_max_pct': 0.09890113237781027, 'bear_tp_mult': 2.313339560645064, 'bear_tsl_mult': 0.5976971124595665, 'bear_time_stop': 56, 'bear_use_sma': True, 'bear_use_ema': False, 'bear_use_atr': True, 'bear_use_adx': True, 'bear_use_spike': True, 'bear_rsi_required': True, 'sideways_strategy': 'mean_reversion', 'sideways_bb_std_mult': 3.3119643049598473, 'sideways_rsi_os': 28, 'sideways_rsi_ob': 51, 'sideways_adx_thresh': 10.997978952609662, 'sideways_atr_min_pct': 0.013833900665807392, 'sideways_atr_max_pct': 0.08029150125128279, 'sideways_tp_mult': 2.0890242088485786, 'sideways_tsl_mult': 0.4087269969721279, 'sideways_time_stop': 114, 'sideways_use_sma': True, 'sideways_use_ema': False, 'sideways_use_atr': True, 'sideways_use_adx': True, 'sideways_use_spike': True, 'sideways_rsi_required': True}.
[I 2025-08-30 15:13:19,805] Trial 397 finished with values: [-1000000000.0, 1000000000.0] and parameters: {'p_sma': 16, 'p_std': 28, 'p_atr': 11, 'p_adx': 25, 'rsi_period': 51, 'ema1': 24, 'ema2': 37, 'slip_atr_k': 0.004625466016867085, 'slip_spread_k': 0.6930634919671065, 'spread_hl_frac': 0.006379477821222707, 'bb_std_mult': 3.2327509491442408, 'rsi_os': 26, 'rsi_ob': 86, 'vol_spike': 0.17077552845986188, 'adx_thresh': 7.86076186966303, 'atr_min_pct': 0.00713159318103826, 'atr_max_pct': 0.1157710183210535, 'tp_mult': 1.6480859085131225, 'tsl_mult': 0.5615170199892553, 'strategy': 'breakout', 'time_stop': 146, 'use_sma': False, 'use_atr': False, 'use_adx': True, 'use_ema': False, 'use_spike': False, 'rsi_required': False, 'edge_k': 0.5368625553824324, 'edge_cap': 0.9283572948572496, 'bull_strategy': 'breakout', 'bull_bb_std_mult': 1.5198455424253055, 'bull_rsi_os': 34, 'bull_rsi_ob': 90, 'bull_adx_thresh': 11.352448018425639, 'bull_atr_min_pct': 0.007109863797234825, 'bull_atr_max_pct': 0.1139646458996724, 'bull_tp_mult': 2.608728919954369, 'bull_tsl_mult': 0.8949978945956146, 'bull_time_stop': 35, 'bull_use_sma': True, 'bull_use_ema': True, 'bull_use_atr': True, 'bull_use_adx': False, 'bull_use_spike': True, 'bull_rsi_required': True, 'bear_strategy': 'mean_reversion', 'bear_bb_std_mult': 1.3704008362012288, 'bear_rsi_os': 29, 'bear_rsi_ob': 77, 'bear_adx_thresh': 12.11433636371247, 'bear_atr_min_pct': 0.003407899533831725, 'bear_atr_max_pct': 0.10390108875872074, 'bear_tp_mult': 2.1776438776940283, 'bear_tsl_mult': 0.5968907326824556, 'bear_time_stop': 54, 'bear_use_sma': True, 'bear_use_ema': False, 'bear_use_atr': True, 'bear_use_adx': True, 'bear_use_spike': True, 'bear_rsi_required': True, 'sideways_strategy': 'mean_reversion', 'sideways_bb_std_mult': 3.282010065116932, 'sideways_rsi_os': 30, 'sideways_rsi_ob': 50, 'sideways_adx_thresh': 8.867338576203906, 'sideways_atr_min_pct': 0.015650292641219886, 'sideways_atr_max_pct': 0.08027170136163554, 'sideways_tp_mult': 2.0801518847910376, 'sideways_tsl_mult': 0.4078259504110198, 'sideways_time_stop': 118, 'sideways_use_sma': True, 'sideways_use_ema': False, 'sideways_use_atr': True, 'sideways_use_adx': True, 'sideways_use_spike': True, 'sideways_rsi_required': True}.
[I 2025-08-30 15:13:20,158] Trial 398 finished with values: [-1000000000.0, 1000000000.0] and parameters: {'p_sma': 16, 'p_std': 27, 'p_atr': 10, 'p_adx': 25, 'rsi_period': 49, 'ema1': 24, 'ema2': 36, 'slip_atr_k': 0.006252126246022926, 'slip_spread_k': 0.6819017141760775, 'spread_hl_frac': 0.006604494077150048, 'bb_std_mult': 3.2231617852438736, 'rsi_os': 26, 'rsi_ob': 86, 'vol_spike': 0.18034414992630143, 'adx_thresh': 8.019758830011613, 'atr_min_pct': 0.007195485417487886, 'atr_max_pct': 0.11679930946862038, 'tp_mult': 1.7174705399156365, 'tsl_mult': 0.5640965828419731, 'strategy': 'breakout', 'time_stop': 144, 'use_sma': False, 'use_atr': False, 'use_adx': True, 'use_ema': False, 'use_spike': False, 'rsi_required': False, 'edge_k': 0.5571543037768785, 'edge_cap': 0.6562010330004925, 'bull_strategy': 'breakout', 'bull_bb_std_mult': 1.5802304570485382, 'bull_rsi_os': 36, 'bull_rsi_ob': 90, 'bull_adx_thresh': 10.858120906617959, 'bull_atr_min_pct': 0.00666368169046829, 'bull_atr_max_pct': 0.11329017159770441, 'bull_tp_mult': 2.656593053247296, 'bull_tsl_mult': 0.9294248948341255, 'bull_time_stop': 7, 'bull_use_sma': True, 'bull_use_ema': True, 'bull_use_atr': True, 'bull_use_adx': False, 'bull_use_spike': True, 'bull_rsi_required': True, 'bear_strategy': 'mean_reversion', 'bear_bb_std_mult': 1.3371167630257874, 'bear_rsi_os': 29, 'bear_rsi_ob': 77, 'bear_adx_thresh': 12.951145334385494, 'bear_atr_min_pct': 0.002426001811940729, 'bear_atr_max_pct': 0.11897415822855356, 'bear_tp_mult': 2.5596605608794643, 'bear_tsl_mult': 0.5977923563238938, 'bear_time_stop': 58, 'bear_use_sma': True, 'bear_use_ema': False, 'bear_use_atr': True, 'bear_use_adx': True, 'bear_use_spike': True, 'bear_rsi_required': True, 'sideways_strategy': 'mean_reversion', 'sideways_bb_std_mult': 3.295318818321749, 'sideways_rsi_os': 29, 'sideways_rsi_ob': 50, 'sideways_adx_thresh': 8.5984270416459, 'sideways_atr_min_pct': 0.026490946466911296, 'sideways_atr_max_pct': 0.07987709502472903, 'sideways_tp_mult': 2.077510857697155, 'sideways_tsl_mult': 0.40735337224136947, 'sideways_time_stop': 115, 'sideways_use_sma': True, 'sideways_use_ema': False, 'sideways_use_atr': True, 'sideways_use_adx': True, 'sideways_use_spike': True, 'sideways_rsi_required': True}.
[I 2025-08-30 15:14:03,633] Trial 404 finished with values: [-1000000000.0, 1000000000.0] and parameters: {'p_sma': 18, 'p_std': 30, 'p_atr': 12, 'p_adx': 26, 'rsi_period': 71, 'ema1': 26, 'ema2': 38, 'slip_atr_k': 0.006987657915497815, 'slip_spread_k': 0.7584055316496512, 'spread_hl_frac': 0.004870489122253066, 'bb_std_mult': 3.1557572896231236, 'rsi_os': 22, 'rsi_ob': 87, 'vol_spike': 0.13953487109066998, 'adx_thresh': 8.774546378201835, 'atr_min_pct': 0.00847759998115304, 'atr_max_pct': 0.11072278265318916, 'tp_mult': 1.6785975624245848, 'tsl_mult': 0.5297048962121698, 'strategy': 'breakout', 'time_stop': 128, 'use_sma': False, 'use_atr': False, 'use_adx': True, 'use_ema': False, 'use_spike': False, 'rsi_required': False, 'edge_k': 0.5912755647369444, 'edge_cap': 0.6039958055270659, 'bull_strategy': 'breakout', 'bull_bb_std_mult': 1.4164924001026118, 'bull_rsi_os': 24, 'bull_rsi_ob': 92, 'bull_adx_thresh': 13.089433317853315, 'bull_atr_min_pct': 0.009541896113154386, 'bull_atr_max_pct': 0.12807346553462787, 'bull_tp_mult': 2.5561715745289324, 'bull_tsl_mult': 0.18935190301100152, 'bull_time_stop': 19, 'bull_use_sma': True, 'bull_use_ema': True, 'bull_use_atr': True, 'bull_use_adx': False, 'bull_use_spike': True, 'bull_rsi_required': False, 'bear_strategy': 'mean_reversion', 'bear_bb_std_mult': 1.945201651134389, 'bear_rsi_os': 29, 'bear_rsi_ob': 74, 'bear_adx_thresh': 10.272273149267624, 'bear_atr_min_pct': 0.0039943575370635495, 'bear_atr_max_pct': 0.08348667090214898, 'bear_tp_mult': 2.334853461877688, 'bear_tsl_mult': 0.5765484685333682, 'bear_time_stop': 108, 'bear_use_sma': True, 'bear_use_ema': False, 'bear_use_atr': True, 'bear_use_adx': True, 'bear_use_spike': True, 'bear_rsi_required': True, 'sideways_strategy': 'mean_reversion', 'sideways_bb_std_mult': 3.3836723699330045, 'sideways_rsi_os': 30, 'sideways_rsi_ob': 49, 'sideways_adx_thresh': 10.599521021741566, 'sideways_atr_min_pct': 0.029833790810426825, 'sideways_atr_max_pct': 0.0844566173421934, 'sideways_tp_mult': 2.1242180024708857, 'sideways_tsl_mult': 0.5403991120842891, 'sideways_time_stop': 110, 'sideways_use_sma': True, 'sideways_use_ema': False, 'sideways_use_atr': True, 'sideways_use_adx': True, 'sideways_use_spike': True, 'sideways_rsi_required': True}.
[I 2025-08-30 15:14:05,255] Trial 403 finished with values: [-0.015545989539669791, 0.015585868187869343] and parameters: {'p_sma': 17, 'p_std': 30, 'p_atr': 7, 'p_adx': 26, 'rsi_period': 59, 'ema1': 26, 'ema2': 39, 'slip_atr_k': 0.005899116655107356, 'slip_spread_k': 0.7523691536431929, 'spread_hl_frac': 0.005183224414559538, 'bb_std_mult': 3.2500042596482133, 'rsi_os': 22, 'rsi_ob': 86, 'vol_spike': 0.1834197560671106, 'adx_thresh': 8.503448163069848, 'atr_min_pct': 0.006805131294940981, 'atr_max_pct': 0.11195472307504564, 'tp_mult': 1.7348343628619471, 'tsl_mult': 0.5346061275291969, 'strategy': 'breakout', 'time_stop': 130, 'use_sma': False, 'use_atr': False, 'use_adx': True, 'use_ema': False, 'use_spike': False, 'rsi_required': False, 'edge_k': 0.6087403528350489, 'edge_cap': 0.6041336658967335, 'bull_strategy': 'breakout', 'bull_bb_std_mult': 1.5887630997592432, 'bull_rsi_os': 21, 'bull_rsi_ob': 87, 'bull_adx_thresh': 12.798923080443986, 'bull_atr_min_pct': 0.008624861758974825, 'bull_atr_max_pct': 0.12131410016483213, 'bull_tp_mult': 2.5482707794225763, 'bull_tsl_mult': 0.9267726587363283, 'bull_time_stop': 5, 'bull_use_sma': True, 'bull_use_ema': True, 'bull_use_atr': True, 'bull_use_adx': False, 'bull_use_spike': True, 'bull_rsi_required': False, 'bear_strategy': 'mean_reversion', 'bear_bb_std_mult': 1.9492494225175163, 'bear_rsi_os': 48, 'bear_rsi_ob': 75, 'bear_adx_thresh': 10.359155384928714, 'bear_atr_min_pct': 0.0026223465299786506, 'bear_atr_max_pct': 0.1110098201032489, 'bear_tp_mult': 2.622178137142413, 'bear_tsl_mult': 0.566689916629681, 'bear_time_stop': 111, 'bear_use_sma': True, 'bear_use_ema': False, 'bear_use_atr': True, 'bear_use_adx': True, 'bear_use_spike': True, 'bear_rsi_required': True, 'sideways_strategy': 'mean_reversion', 'sideways_bb_std_mult': 3.404404590814878, 'sideways_rsi_os': 31, 'sideways_rsi_ob': 49, 'sideways_adx_thresh': 10.610295701480357, 'sideways_atr_min_pct': 0.028098543204666378, 'sideways_atr_max_pct': 0.08373171376266865, 'sideways_tp_mult': 2.1355249455460568, 'sideways_tsl_mult': 0.22156069546833285, 'sideways_time_stop': 111, 'sideways_use_sma': True, 'sideways_use_ema': False, 'sideways_use_atr': True, 'sideways_use_adx': True, 'sideways_use_spike': True, 'sideways_rsi_required': True}.
[I 2025-08-30 15:14:07,127] Trial 401 finished with values: [-1000000000.0, 1000000000.0] and parameters: {'p_sma': 17, 'p_std': 29, 'p_atr': 12, 'p_adx': 26, 'rsi_period': 40, 'ema1': 26, 'ema2': 37, 'slip_atr_k': 0.005578485030391224, 'slip_spread_k': 0.7563620417633805, 'spread_hl_frac': 0.006373713139662762, 'bb_std_mult': 3.150205852277379, 'rsi_os': 26, 'rsi_ob': 87, 'vol_spike': 0.18551525778922184, 'adx_thresh': 8.738565366836113, 'atr_min_pct': 0.006843264801753494, 'atr_max_pct': 0.11800712726690554, 'tp_mult': 1.715190687971773, 'tsl_mult': 0.5629390346210393, 'strategy': 'breakout', 'time_stop': 130, 'use_sma': False, 'use_atr': False, 'use_adx': True, 'use_ema': False, 'use_spike': False, 'rsi_required': False, 'edge_k': 0.5048158090432923, 'edge_cap': 0.5948098677865482, 'bull_strategy': 'breakout', 'bull_bb_std_mult': 1.4445465503775088, 'bull_rsi_os': 29, 'bull_rsi_ob': 92, 'bull_adx_thresh': 12.230265263033877, 'bull_atr_min_pct': 0.00883726643633222, 'bull_atr_max_pct': 0.12041643787699459, 'bull_tp_mult': 2.5492879324024806, 'bull_tsl_mult': 0.9357992191810923, 'bull_time_stop': 53, 'bull_use_sma': True, 'bull_use_ema': True, 'bull_use_atr': True, 'bull_use_adx': False, 'bull_use_spike': True, 'bull_rsi_required': True, 'bear_strategy': 'mean_reversion', 'bear_bb_std_mult': 1.544152324144319, 'bear_rsi_os': 29, 'bear_rsi_ob': 77, 'bear_adx_thresh': 10.274310796429551, 'bear_atr_min_pct': 0.0029798792820979266, 'bear_atr_max_pct': 0.11171857162374627, 'bear_tp_mult': 2.6046075390107863, 'bear_tsl_mult': 0.5704540358063688, 'bear_time_stop': 112, 'bear_use_sma': True, 'bear_use_ema': False, 'bear_use_atr': True, 'bear_use_adx': True, 'bear_use_spike': True, 'bear_rsi_required': True, 'sideways_strategy': 'mean_reversion', 'sideways_bb_std_mult': 3.362469257608748, 'sideways_rsi_os': 31, 'sideways_rsi_ob': 51, 'sideways_adx_thresh': 10.664305556207312, 'sideways_atr_min_pct': 0.014170807378651213, 'sideways_atr_max_pct': 0.07867223044934847, 'sideways_tp_mult': 2.1220426713104676, 'sideways_tsl_mult': 0.22080737605636797, 'sideways_time_stop': 116, 'sideways_use_sma': True, 'sideways_use_ema': False, 'sideways_use_atr': True, 'sideways_use_adx': True, 'sideways_use_spike': True, 'sideways_rsi_required': True}.
[I 2025-08-30 15:14:07,128] Trial 402 finished with values: [-1000000000.0, 1000000000.0] and parameters: {'p_sma': 17, 'p_std': 30, 'p_atr': 7, 'p_adx': 26, 'rsi_period': 59, 'ema1': 26, 'ema2': 37, 'slip_atr_k': 0.007015288624227406, 'slip_spread_k': 0.7530910089008707, 'spread_hl_frac': 0.006493254055038816, 'bb_std_mult': 3.249400061705759, 'rsi_os': 26, 'rsi_ob': 86, 'vol_spike': 0.18078496788424708, 'adx_thresh': 8.894564499060339, 'atr_min_pct': 0.006744574534159826, 'atr_max_pct': 0.11215555666620747, 'tp_mult': 1.6137139654560797, 'tsl_mult': 0.36449435246023487, 'strategy': 'breakout', 'time_stop': 128, 'use_sma': False, 'use_atr': False, 'use_adx': True, 'use_ema': False, 'use_spike': False, 'rsi_required': False, 'edge_k': 0.5943698872915603, 'edge_cap': 0.638081369805268, 'bull_strategy': 'breakout', 'bull_bb_std_mult': 1.584670599207742, 'bull_rsi_os': 26, 'bull_rsi_ob': 92, 'bull_adx_thresh': 12.932067859741448, 'bull_atr_min_pct': 0.005229922706057663, 'bull_atr_max_pct': 0.12154270268495038, 'bull_tp_mult': 2.577512646261144, 'bull_tsl_mult': 0.8924367394290224, 'bull_time_stop': 6, 'bull_use_sma': True, 'bull_use_ema': True, 'bull_use_atr': True, 'bull_use_adx': False, 'bull_use_spike': True, 'bull_rsi_required': False, 'bear_strategy': 'mean_reversion', 'bear_bb_std_mult': 1.342336403265909, 'bear_rsi_os': 29, 'bear_rsi_ob': 75, 'bear_adx_thresh': 13.1516955861277, 'bear_atr_min_pct': 0.0027556065980341464, 'bear_atr_max_pct': 0.11154576786569585, 'bear_tp_mult': 2.5762053934855516, 'bear_tsl_mult': 0.5727551880833304, 'bear_time_stop': 112, 'bear_use_sma': True, 'bear_use_ema': False, 'bear_use_atr': True, 'bear_use_adx': True, 'bear_use_spike': True, 'bear_rsi_required': True, 'sideways_strategy': 'mean_reversion', 'sideways_bb_std_mult': 3.378628769343342, 'sideways_rsi_os': 30, 'sideways_rsi_ob': 50, 'sideways_adx_thresh': 10.460821773523422, 'sideways_atr_min_pct': 0.010216260824010524, 'sideways_atr_max_pct': 0.08303332840455671, 'sideways_tp_mult': 2.1460547820383273, 'sideways_tsl_mult': 0.37462745555864263, 'sideways_time_stop': 116, 'sideways_use_sma': True, 'sideways_use_ema': False, 'sideways_use_atr': True, 'sideways_use_adx': True, 'sideways_use_spike': True, 'sideways_rsi_required': True}.
