[I 2025-08-30 14:27:36,190] Trial 56 finished with values: [-1000000000.0, 1000000000.0] and parameters: {'p_sma': 30, 'p_std': 10, 'p_atr': 25, 'p_adx': 9, 'rsi_period': 56, 'ema1': 15, 'ema2': 33, 'slip_atr_k': 0.051756589890256416, 'slip_spread_k': 0.5277272569856466, 'spread_hl_frac': 0.03490104788442827, 'bb_std_mult': 2.866545045812685, 'rsi_os': 41, 'rsi_ob': 85, 'vol_spike': 0.13103014320715922, 'adx_thresh': 33.740247116925175, 'atr_min_pct': 0.024684955181255675, 'atr_max_pct': 0.0930255499775433, 'tp_mult': 1.4133461196389838, 'tsl_mult': 0.8831444458059573, 'strategy': 'breakout', 'time_stop': 76, 'use_sma': True, 'use_atr': True, 'use_adx': False, 'use_ema': False, 'use_spike': True, 'rsi_required': False, 'edge_k': 1.596198725464237, 'edge_cap': 0.4340496171028201, 'bull_strategy': 'mean_reversion', 'bull_bb_std_mult': 1.806977675678927, 'bull_rsi_os': 11, 'bull_rsi_ob': 90, 'bull_adx_thresh': 21.66105543990526, 'bull_atr_min_pct': 0.004899213981948796, 'bull_atr_max_pct': 0.010345414713783451, 'bull_tp_mult': 2.544799910902446, 'bull_tsl_mult': 0.3300905636825838, 'bull_time_stop': 300, 'bull_use_sma': True, 'bull_use_ema': True, 'bull_use_atr': True, 'bull_use_adx': False, 'bull_use_spike': True, 'bull_rsi_required': True, 'bear_strategy': 'breakout', 'bear_bb_std_mult': 1.9172821671851257, 'bear_rsi_os': 9, 'bear_rsi_ob': 87, 'bear_adx_thresh': 28.57713723224439, 'bear_atr_min_pct': 0.02002075256917072, 'bear_atr_max_pct': 0.1303485846904064, 'bear_tp_mult': 2.024113397261648, 'bear_tsl_mult': 0.651055544063374, 'bear_time_stop': 275, 'bear_use_sma': True, 'bear_use_ema': True, 'bear_use_atr': False, 'bear_use_adx': False, 'bear_use_spike': False, 'bear_rsi_required': False, 'sideways_strategy': 'mean_reversion', 'sideways_bb_std_mult': 2.319346274385659, 'sideways_rsi_os': 7, 'sideways_rsi_ob': 88, 'sideways_adx_thresh': 30.720182955980295, 'sideways_atr_min_pct': 0.025924907648337093, 'sideways_atr_max_pct': 0.12186211803874292, 'sideways_tp_mult': 1.4195519049535552, 'sideways_tsl_mult': 0.14314440607597526, 'sideways_time_stop': 215, 'sideways_use_sma': False, 'sideways_use_ema': True, 'sideways_use_atr': False, 'sideways_use_adx': False, 'sideways_use_spike': False, 'sideways_rsi_required': True}.
[I 2025-08-30 14:27:36,563] Trial 54 finished with values: [-0.018217952965573714, 0.01821842722543112] and parameters: {'p_sma': 37, 'p_std': 14, 'p_atr': 25, 'p_adx': 9, 'rsi_period': 46, 'ema1': 15, 'ema2': 16, 'slip_atr_k': 0.13244155208379632, 'slip_spread_k': 0.5300220603440671, 'spread_hl_frac': 0.04631570702451182, 'bb_std_mult': 0.5106176667595296, 'rsi_os': 50, 'rsi_ob': 85, 'vol_spike': 0.02970002909083981, 'adx_thresh': 33.72623637788349, 'atr_min_pct': 0.003909483245339027, 'atr_max_pct': 0.01002388572614495, 'tp_mult': 1.3310249148444262, 'tsl_mult': 0.07602207384223894, 'strategy': 'breakout', 'time_stop': 279, 'use_sma': False, 'use_atr': False, 'use_adx': False, 'use_ema': False, 'use_spike': True, 'rsi_required': False, 'edge_k': 1.8398954293208476, 'edge_cap': 0.5055896689717975, 'bull_strategy': 'breakout', 'bull_bb_std_mult': 2.8393807704062928, 'bull_rsi_os': 30, 'bull_rsi_ob': 90, 'bull_adx_thresh': 20.31728910370036, 'bull_atr_min_pct': 0.002317698762930043, 'bull_atr_max_pct': 0.010728166501275373, 'bull_tp_mult': 2.5842383854002215, 'bull_tsl_mult': 0.3325822676935978, 'bull_time_stop': 245, 'bull_use_sma': False, 'bull_use_ema': True, 'bull_use_atr': False, 'bull_use_adx': False, 'bull_use_spike': True, 'bull_rsi_required': True, 'bear_strategy': 'mean_reversion', 'bear_bb_std_mult': 1.4229178809361147, 'bear_rsi_os': 31, 'bear_rsi_ob': 67, 'bear_adx_thresh': 33.28908407433945, 'bear_atr_min_pct': 0.010939301774892548, 'bear_atr_max_pct': 0.1320700072091283, 'bear_tp_mult': 2.3929208851303394, 'bear_tsl_mult': 0.6542156414451181, 'bear_time_stop': 38, 'bear_use_sma': True, 'bear_use_ema': True, 'bear_use_atr': False, 'bear_use_adx': False, 'bear_use_spike': True, 'bear_rsi_required': False, 'sideways_strategy': 'mean_reversion', 'sideways_bb_std_mult': 2.9732103835804877, 'sideways_rsi_os': 7, 'sideways_rsi_ob': 56, 'sideways_adx_thresh': 18.718621994806078, 'sideways_atr_min_pct': 0.0009505952047291679, 'sideways_atr_max_pct': 0.13886289491188547, 'sideways_tp_mult': 1.0427721442202569, 'sideways_tsl_mult': 0.11996677644855289, 'sideways_time_stop': 212, 'sideways_use_sma': True, 'sideways_use_ema': True, 'sideways_use_atr': True, 'sideways_use_adx': False, 'sideways_use_spike': False, 'sideways_rsi_required': False}.
[I 2025-08-30 14:27:36,754] Trial 57 finished with values: [-1000000000.0, 1000000000.0] and parameters: {'p_sma': 43, 'p_std': 10, 'p_atr': 11, 'p_adx': 29, 'rsi_period': 76, 'ema1': 30, 'ema2': 44, 'slip_atr_k': 0.15573232701060738, 'slip_spread_k': 0.7184241501567934, 'spread_hl_frac': 0.04404212233752026, 'bb_std_mult': 0.8267178690683219, 'rsi_os': 16, 'rsi_ob': 52, 'vol_spike': 0.07775819567665002, 'adx_thresh': 14.789551251174428, 'atr_min_pct': 0.028180865010627686, 'atr_max_pct': 0.1289693343360677, 'tp_mult': 2.225140247362585, 'tsl_mult': 0.8810123161793388, 'strategy': 'breakout', 'time_stop': 284, 'use_sma': True, 'use_atr': True, 'use_adx': False, 'use_ema': True, 'use_spike': False, 'rsi_required': False, 'edge_k': 1.7491012258822192, 'edge_cap': 0.8332375113400181, 'bull_strategy': 'mean_reversion', 'bull_bb_std_mult': 0.6713141470029598, 'bull_rsi_os': 29, 'bull_rsi_ob': 46, 'bull_adx_thresh': 9.169629053306407, 'bull_atr_min_pct': 0.029192390585417758, 'bull_atr_max_pct': 0.14495411938669164, 'bull_tp_mult': 1.5791210293938174, 'bull_tsl_mult': 0.0018817547200245532, 'bull_time_stop': 86, 'bull_use_sma': True, 'bull_use_ema': False, 'bull_use_atr': True, 'bull_use_adx': False, 'bull_use_spike': True, 'bull_rsi_required': True, 'bear_strategy': 'breakout', 'bear_bb_std_mult': 2.52037079176302, 'bear_rsi_os': 54, 'bear_rsi_ob': 51, 'bear_adx_thresh': 28.127149971886634, 'bear_atr_min_pct': 0.006776823599417808, 'bear_atr_max_pct': 0.1489908378714656, 'bear_tp_mult': 1.5075777290234358, 'bear_tsl_mult': 0.6571639789426342, 'bear_time_stop': 284, 'bear_use_sma': False, 'bear_use_ema': True, 'bear_use_atr': False, 'bear_use_adx': False, 'bear_use_spike': False, 'bear_rsi_required': False, 'sideways_strategy': 'breakout', 'sideways_bb_std_mult': 3.370046603973378, 'sideways_rsi_os': 7, 'sideways_rsi_ob': 77, 'sideways_adx_thresh': 18.838479463499496, 'sideways_atr_min_pct': 0.023846119974596548, 'sideways_atr_max_pct': 0.1358456557141067, 'sideways_tp_mult': 1.5066969014322926, 'sideways_tsl_mult': 0.09921693963067162, 'sideways_time_stop': 174, 'sideways_use_sma': False, 'sideways_use_ema': False, 'sideways_use_atr': False, 'sideways_use_adx': True, 'sideways_use_spike': False, 'sideways_rsi_required': True}.
[I 2025-08-30 14:27:36,919] Trial 53 finished with values: [-1000000000.0, 1000000000.0] and parameters: {'p_sma': 48, 'p_std': 10, 'p_atr': 7, 'p_adx': 9, 'rsi_period': 84, 'ema1': 12, 'ema2': 41, 'slip_atr_k': 0.04578052942417826, 'slip_spread_k': 0.3182991477320618, 'spread_hl_frac': 0.01708518103437924, 'bb_std_mult': 0.5809075629009283, 'rsi_os': 35, 'rsi_ob': 53, 'vol_spike': 0.12646348918800743, 'adx_thresh': 31.75512916770244, 'atr_min_pct': 0.02777569947930748, 'atr_max_pct': 0.04943010816116243, 'tp_mult': 1.9805047285332142, 'tsl_mult': 0.07232726623285113, 'strategy': 'breakout', 'time_stop': 277, 'use_sma': False, 'use_atr': False, 'use_adx': False, 'use_ema': False, 'use_spike': True, 'rsi_required': True, 'edge_k': 1.842835730303845, 'edge_cap': 0.7771441244059454, 'bull_strategy': 'mean_reversion', 'bull_bb_std_mult': 2.7693167216571797, 'bull_rsi_os': 17, 'bull_rsi_ob': 90, 'bull_adx_thresh': 10.13541030334401, 'bull_atr_min_pct': 0.019910560360519535, 'bull_atr_max_pct': 0.011410507039659887, 'bull_tp_mult': 2.583520290398426, 'bull_tsl_mult': 0.5898344209292745, 'bull_time_stop': 235, 'bull_use_sma': True, 'bull_use_ema': True, 'bull_use_atr': True, 'bull_use_adx': False, 'bull_use_spike': True, 'bull_rsi_required': True, 'bear_strategy': 'breakout', 'bear_bb_std_mult': 2.5466598316891593, 'bear_rsi_os': 31, 'bear_rsi_ob': 66, 'bear_adx_thresh': 13.813877726245245, 'bear_atr_min_pct': 0.02608397732473225, 'bear_atr_max_pct': 0.14308227929213702, 'bear_tp_mult': 1.3173712857666526, 'bear_tsl_mult': 0.6566454824311246, 'bear_time_stop': 279, 'bear_use_sma': False, 'bear_use_ema': False, 'bear_use_atr': False, 'bear_use_adx': False, 'bear_use_spike': True, 'bear_rsi_required': False, 'sideways_strategy': 'mean_reversion', 'sideways_bb_std_mult': 2.9421945734363852, 'sideways_rsi_os': 49, 'sideways_rsi_ob': 62, 'sideways_adx_thresh': 18.54438342563593, 'sideways_atr_min_pct': 0.020190263230998037, 'sideways_atr_max_pct': 0.075815042712871, 'sideways_tp_mult': 2.3317890013581275, 'sideways_tsl_mult': 0.4283865680714151, 'sideways_time_stop': 148, 'sideways_use_sma': True, 'sideways_use_ema': True, 'sideways_use_atr': True, 'sideways_use_adx': True, 'sideways_use_spike': False, 'sideways_rsi_required': False}.
[I 2025-08-30 14:28:07,774] Trial 58 finished with values: [-1000000000.0, 1000000000.0] and parameters: {'p_sma': 43, 'p_std': 49, 'p_atr': 11, 'p_adx': 27, 'rsi_period': 65, 'ema1': 11, 'ema2': 35, 'slip_atr_k': 0.01911574156637226, 'slip_spread_k': 0.6196345607734818, 'spread_hl_frac': 0.04128168499080519, 'bb_std_mult': 0.5016997203260384, 'rsi_os': 52, 'rsi_ob': 91, 'vol_spike': 0.03384997030320515, 'adx_thresh': 31.943264416347656, 'atr_min_pct': 0.003897511633023352, 'atr_max_pct': 0.13012365151793592, 'tp_mult': 1.9628555647158203, 'tsl_mult': 0.4624030528603001, 'strategy': 'breakout', 'time_stop': 274, 'use_sma': True, 'use_atr': False, 'use_adx': False, 'use_ema': True, 'use_spike': False, 'rsi_required': True, 'edge_k': 1.7445709857973224, 'edge_cap': 0.2970187324335714, 'bull_strategy': 'mean_reversion', 'bull_bb_std_mult': 0.8343972604221092, 'bull_rsi_os': 28, 'bull_rsi_ob': 46, 'bull_adx_thresh': 5.350335981416489, 'bull_atr_min_pct': 0.00506823013323636, 'bull_atr_max_pct': 0.1459656077718664, 'bull_tp_mult': 2.2869844086145763, 'bull_tsl_mult': 0.02152376544413237, 'bull_time_stop': 114, 'bull_use_sma': False, 'bull_use_ema': False, 'bull_use_atr': False, 'bull_use_adx': False, 'bull_use_spike': True, 'bull_rsi_required': False, 'bear_strategy': 'breakout', 'bear_bb_std_mult': 1.4399347006064462, 'bear_rsi_os': 31, 'bear_rsi_ob': 52, 'bear_adx_thresh': 21.708945539069823, 'bear_atr_min_pct': 0.006402144080298551, 'bear_atr_max_pct': 0.14902297144009702, 'bear_tp_mult': 1.5470912531026257, 'bear_tsl_mult': 0.2860290742924507, 'bear_time_stop': 213, 'bear_use_sma': False, 'bear_use_ema': True, 'bear_use_atr': False, 'bear_use_adx': False, 'bear_use_spike': True, 'bear_rsi_required': False, 'sideways_strategy': 'breakout', 'sideways_bb_std_mult': 1.2362804325723018, 'sideways_rsi_os': 17, 'sideways_rsi_ob': 93, 'sideways_adx_thresh': 10.266468754197366, 'sideways_atr_min_pct': 0.024057680810058782, 'sideways_atr_max_pct': 0.1336485943557838, 'sideways_tp_mult': 1.5183844732664598, 'sideways_tsl_mult': 0.03065286908687148, 'sideways_time_stop': 177, 'sideways_use_sma': True, 'sideways_use_ema': False, 'sideways_use_atr': False, 'sideways_use_adx': True, 'sideways_use_spike': False, 'sideways_rsi_required': False}.
[I 2025-08-30 14:28:08,366] Trial 59 finished with values: [-1000000000.0, 1000000000.0] and parameters: {'p_sma': 49, 'p_std': 48, 'p_atr': 11, 'p_adx': 28, 'rsi_period': 17, 'ema1': 11, 'ema2': 13, 'slip_atr_k': 0.1295916283087404, 'slip_spread_k': 0.05426553758425745, 'spread_hl_frac': 0.02375179466160679, 'bb_std_mult': 0.8604440931027859, 'rsi_os': 17, 'rsi_ob': 53, 'vol_spike': 0.15620845556223706, 'adx_thresh': 31.94474308859403, 'atr_min_pct': 0.00394555355705397, 'atr_max_pct': 0.030282310593985257, 'tp_mult': 1.9618444451088166, 'tsl_mult': 0.08215874619491595, 'strategy': 'breakout', 'time_stop': 275, 'use_sma': True, 'use_atr': False, 'use_adx': False, 'use_ema': True, 'use_spike': False, 'rsi_required': True, 'edge_k': 1.7572454544853175, 'edge_cap': 0.8657771518147671, 'bull_strategy': 'mean_reversion', 'bull_bb_std_mult': 0.6479051790398158, 'bull_rsi_os': 29, 'bull_rsi_ob': 81, 'bull_adx_thresh': 9.48153144113721, 'bull_atr_min_pct': 0.005025251495363108, 'bull_atr_max_pct': 0.14833727376305922, 'bull_tp_mult': 1.573832673802628, 'bull_tsl_mult': 0.9393838606867533, 'bull_time_stop': 86, 'bull_use_sma': False, 'bull_use_ema': True, 'bull_use_atr': True, 'bull_use_adx': False, 'bull_use_spike': False, 'bull_rsi_required': False, 'bear_strategy': 'breakout', 'bear_bb_std_mult': 0.5031094631207117, 'bear_rsi_os': 55, 'bear_rsi_ob': 52, 'bear_adx_thresh': 20.37247207310778, 'bear_atr_min_pct': 0.006364036980596287, 'bear_atr_max_pct': 0.11795755506720979, 'bear_tp_mult': 1.5145030907174601, 'bear_tsl_mult': 0.6666003219683391, 'bear_time_stop': 129, 'bear_use_sma': False, 'bear_use_ema': True, 'bear_use_atr': False, 'bear_use_adx': False, 'bear_use_spike': True, 'bear_rsi_required': False, 'sideways_strategy': 'breakout', 'sideways_bb_std_mult': 1.2666393189027, 'sideways_rsi_os': 10, 'sideways_rsi_ob': 62, 'sideways_adx_thresh': 18.276454525071422, 'sideways_atr_min_pct': 0.020262939416920818, 'sideways_atr_max_pct': 0.0495361505752752, 'sideways_tp_mult': 2.616779701086015, 'sideways_tsl_mult': 0.10542515843283262, 'sideways_time_stop': 152, 'sideways_use_sma': True, 'sideways_use_ema': True, 'sideways_use_atr': True, 'sideways_use_adx': True, 'sideways_use_spike': False, 'sideways_rsi_required': False}.
[I 2025-08-30 14:28:08,555] Trial 60 finished with values: [-1000000000.0, 1000000000.0] and parameters: {'p_sma': 48, 'p_std': 49, 'p_atr': 8, 'p_adx': 23, 'rsi_period': 83, 'ema1': 13, 'ema2': 13, 'slip_atr_k': 0.021659781922323373, 'slip_spread_k': 0.6286497323594329, 'spread_hl_frac': 0.00472835763999566, 'bb_std_mult': 1.0584429570399507, 'rsi_os': 30, 'rsi_ob': 79, 'vol_spike': 0.01800391360450579, 'adx_thresh': 31.62996508866261, 'atr_min_pct': 0.0036400458828361694, 'atr_max_pct': 0.10674889331421841, 'tp_mult': 1.9673763300173224, 'tsl_mult': 0.049127488911964556, 'strategy': 'breakout', 'time_stop': 243, 'use_sma': False, 'use_atr': False, 'use_adx': False, 'use_ema': True, 'use_spike': False, 'rsi_required': True, 'edge_k': 1.8757367405683967, 'edge_cap': 0.290915227074359, 'bull_strategy': 'mean_reversion', 'bull_bb_std_mult': 0.813728428328194, 'bull_rsi_os': 25, 'bull_rsi_ob': 86, 'bull_adx_thresh': 33.9722699138327, 'bull_atr_min_pct': 0.02187398531121732, 'bull_atr_max_pct': 0.016806665974858984, 'bull_tp_mult': 2.229347468152615, 'bull_tsl_mult': 0.9295642395989124, 'bull_time_stop': 112, 'bull_use_sma': False, 'bull_use_ema': True, 'bull_use_atr': False, 'bull_use_adx': False, 'bull_use_spike': False, 'bull_rsi_required': False, 'bear_strategy': 'breakout', 'bear_bb_std_mult': 0.532259644107616, 'bear_rsi_os': 31, 'bear_rsi_ob': 82, 'bear_adx_thresh': 13.39719640756923, 'bear_atr_min_pct': 0.007895151869478489, 'bear_atr_max_pct': 0.13995415768765226, 'bear_tp_mult': 2.37619145442258, 'bear_tsl_mult': 0.5918573428865825, 'bear_time_stop': 180, 'bear_use_sma': False, 'bear_use_ema': True, 'bear_use_atr': False, 'bear_use_adx': False, 'bear_use_spike': True, 'bear_rsi_required': False, 'sideways_strategy': 'breakout', 'sideways_bb_std_mult': 1.8886472396466814, 'sideways_rsi_os': 17, 'sideways_rsi_ob': 61, 'sideways_adx_thresh': 18.60113335590962, 'sideways_atr_min_pct': 0.02739124168540489, 'sideways_atr_max_pct': 0.07509003172281595, 'sideways_tp_mult': 2.8765294434766555, 'sideways_tsl_mult': 0.20269390115375163, 'sideways_time_stop': 153, 'sideways_use_sma': True, 'sideways_use_ema': True, 'sideways_use_atr': True, 'sideways_use_adx': True, 'sideways_use_spike': False, 'sideways_rsi_required': False}.
[I 2025-08-30 14:28:08,645] Trial 61 finished with values: [-1000000000.0, 1000000000.0] and parameters: {'p_sma': 38, 'p_std': 47, 'p_atr': 11, 'p_adx': 23, 'rsi_period': 14, 'ema1': 11, 'ema2': 14, 'slip_atr_k': 0.015524958495008276, 'slip_spread_k': 0.639987062166199, 'spread_hl_frac': 0.011433125953750012, 'bb_std_mult': 1.1099809003371102, 'rsi_os': 51, 'rsi_ob': 78, 'vol_spike': 0.15814843368955328, 'adx_thresh': 29.505280375316357, 'atr_min_pct': 0.003759338425867942, 'atr_max_pct': 0.10516213695836832, 'tp_mult': 2.086543951090137, 'tsl_mult': 0.05127866981120585, 'strategy': 'breakout', 'time_stop': 164, 'use_sma': False, 'use_atr': False, 'use_adx': False, 'use_ema': True, 'use_spike': False, 'rsi_required': True, 'edge_k': 1.9173638454311006, 'edge_cap': 0.2917741744611417, 'bull_strategy': 'mean_reversion', 'bull_bb_std_mult': 0.851132704494207, 'bull_rsi_os': 36, 'bull_rsi_ob': 54, 'bull_adx_thresh': 5.289858157910773, 'bull_atr_min_pct': 0.02465359376397026, 'bull_atr_max_pct': 0.04034957395278478, 'bull_tp_mult': 2.244490112026764, 'bull_tsl_mult': 0.8145372167122965, 'bull_time_stop': 113, 'bull_use_sma': False, 'bull_use_ema': True, 'bull_use_atr': False, 'bull_use_adx': False, 'bull_use_spike': False, 'bull_rsi_required': False, 'bear_strategy': 'breakout', 'bear_bb_std_mult': 2.184077547452524, 'bear_rsi_os': 9, 'bear_rsi_ob': 82, 'bear_adx_thresh': 6.951895807470779, 'bear_atr_min_pct': 0.02140873949404381, 'bear_atr_max_pct': 0.13370363885941378, 'bear_tp_mult': 2.408587039334735, 'bear_tsl_mult': 0.09701606965052734, 'bear_time_stop': 180, 'bear_use_sma': True, 'bear_use_ema': True, 'bear_use_atr': False, 'bear_use_adx': False, 'bear_use_spike': True, 'bear_rsi_required': False, 'sideways_strategy': 'breakout', 'sideways_bb_std_mult': 3.0859933160406805, 'sideways_rsi_os': 17, 'sideways_rsi_ob': 55, 'sideways_adx_thresh': 22.510109019390498, 'sideways_atr_min_pct': 0.026939406703932675, 'sideways_atr_max_pct': 0.05105717610626679, 'sideways_tp_mult': 2.6048053144496937, 'sideways_tsl_mult': 0.020118959656451264, 'sideways_time_stop': 243, 'sideways_use_sma': True, 'sideways_use_ema': True, 'sideways_use_atr': True, 'sideways_use_adx': False, 'sideways_use_spike': False, 'sideways_rsi_required': False}.
[I 2025-08-30 14:28:08,930] Trial 64 finished with values: [-1000000000.0, 1000000000.0] and parameters: {'p_sma': 5, 'p_std': 7, 'p_atr': 20, 'p_adx': 8, 'rsi_period': 49, 'ema1': 13, 'ema2': 31, 'slip_atr_k': 0.06553636629166759, 'slip_spread_k': 0.567828493637572, 'spread_hl_frac': 0.010976729153519283, 'bb_std_mult': 2.256413972728852, 'rsi_os': 26, 'rsi_ob': 75, 'vol_spike': 0.18327652698237057, 'adx_thresh': 33.867679324050975, 'atr_min_pct': 0.02306804965198929, 'atr_max_pct': 0.02158179961790168, 'tp_mult': 1.7859537128245782, 'tsl_mult': 0.01972973073682864, 'strategy': 'mean_reversion', 'time_stop': 160, 'use_sma': False, 'use_atr': True, 'use_adx': True, 'use_ema': True, 'use_spike': False, 'rsi_required': True, 'edge_k': 0.16542881037311508, 'edge_cap': 0.432464440098263, 'bull_strategy': 'breakout', 'bull_bb_std_mult': 1.1244722584428886, 'bull_rsi_os': 21, 'bull_rsi_ob': 84, 'bull_adx_thresh': 31.974220155465954, 'bull_atr_min_pct': 0.00016633534340577461, 'bull_atr_max_pct': 0.0418571245804846, 'bull_tp_mult': 2.7612964231487074, 'bull_tsl_mult': 0.7160626621199186, 'bull_time_stop': 133, 'bull_use_sma': False, 'bull_use_ema': True, 'bull_use_atr': False, 'bull_use_adx': True, 'bull_use_spike': False, 'bull_rsi_required': False, 'bear_strategy': 'mean_reversion', 'bear_bb_std_mult': 1.652864921699147, 'bear_rsi_os': 17, 'bear_rsi_ob': 92, 'bear_adx_thresh': 8.65553647402178, 'bear_atr_min_pct': 0.011130925364586755, 'bear_atr_max_pct': 0.10610130005193559, 'bear_tp_mult': 2.7715959469087457, 'bear_tsl_mult': 0.21399564587587072, 'bear_time_stop': 7, 'bear_use_sma': True, 'bear_use_ema': True, 'bear_use_atr': False, 'bear_use_adx': False, 'bear_use_spike': True, 'bear_rsi_required': True, 'sideways_strategy': 'breakout', 'sideways_bb_std_mult': 1.4780347309637103, 'sideways_rsi_os': 10, 'sideways_rsi_ob': 49, 'sideways_adx_thresh': 22.33468497603932, 'sideways_atr_min_pct': 0.025461084471180638, 'sideways_atr_max_pct': 0.026451483523106653, 'sideways_tp_mult': 1.7920224453088687, 'sideways_tsl_mult': 0.997568925934573, 'sideways_time_stop': 270, 'sideways_use_sma': False, 'sideways_use_ema': True, 'sideways_use_atr': True, 'sideways_use_adx': False, 'sideways_use_spike': False, 'sideways_rsi_required': False}.
