[I 2025-08-30 14:50:56,488] Trial 252 finished with values: [-0.01206482217185334, 0.01211739991547126] and parameters: {'p_sma': 44, 'p_std': 6, 'p_atr': 19, 'p_adx': 7, 'rsi_period': 26, 'ema1': 13, 'ema2': 47, 'slip_atr_k': 0.04100166883413452, 'slip_spread_k': 0.13824829837762456, 'spread_hl_frac': 0.005419874556313926, 'bb_std_mult': 3.3692031421495594, 'rsi_os': 8, 'rsi_ob': 84, 'vol_spike': 0.10533994781086065, 'adx_thresh': 16.965981800830797, 'atr_min_pct': 0.0029053307856041002, 'atr_max_pct': 0.07571165156645786, 'tp_mult': 2.1752433319651385, 'tsl_mult': 0.589815709001476, 'strategy': 'breakout', 'time_stop': 238, 'use_sma': False, 'use_atr': False, 'use_adx': True, 'use_ema': False, 'use_spike': False, 'rsi_required': False, 'edge_k': 0.423230146027321, 'edge_cap': 0.536831249342809, 'bull_strategy': 'breakout', 'bull_bb_std_mult': 2.903963843255063, 'bull_rsi_os': 43, 'bull_rsi_ob': 47, 'bull_adx_thresh': 21.894152624681865, 'bull_atr_min_pct': 0.002670940703916585, 'bull_atr_max_pct': 0.04349857437349971, 'bull_tp_mult': 1.1752425328451355, 'bull_tsl_mult': 0.8873150726289322, 'bull_time_stop': 140, 'bull_use_sma': True, 'bull_use_ema': False, 'bull_use_atr': False, 'bull_use_adx': False, 'bull_use_spike': True, 'bull_rsi_required': False, 'bear_strategy': 'mean_reversion', 'bear_bb_std_mult': 3.57831273181163, 'bear_rsi_os': 35, 'bear_rsi_ob': 89, 'bear_adx_thresh': 7.741707931537843, 'bear_atr_min_pct': 0.02847576855714244, 'bear_atr_max_pct': 0.14736155203558893, 'bear_tp_mult': 2.8673543612298418, 'bear_tsl_mult': 0.5581927643214171, 'bear_time_stop': 295, 'bear_use_sma': False, 'bear_use_ema': True, 'bear_use_atr': True, 'bear_use_adx': False, 'bear_use_spike': False, 'bear_rsi_required': False, 'sideways_strategy': 'mean_reversion', 'sideways_bb_std_mult': 1.0030125336554987, 'sideways_rsi_os': 42, 'sideways_rsi_ob': 62, 'sideways_adx_thresh': 22.59224012389605, 'sideways_atr_min_pct': 0.018489499163973553, 'sideways_atr_max_pct': 0.0728652128675811, 'sideways_tp_mult': 2.9968011821318394, 'sideways_tsl_mult': 0.8308271853877965, 'sideways_time_stop': 118, 'sideways_use_sma': True, 'sideways_use_ema': False, 'sideways_use_atr': False, 'sideways_use_adx': False, 'sideways_use_spike': False, 'sideways_rsi_required': True}.
[I 2025-08-30 14:51:09,917] Trial 253 finished with values: [-0.007249828684003146, 0.007262506391145729] and parameters: {'p_sma': 44, 'p_std': 6, 'p_atr': 19, 'p_adx': 27, 'rsi_period': 26, 'ema1': 13, 'ema2': 46, 'slip_atr_k': 0.019613106320135052, 'slip_spread_k': 0.1396244360185552, 'spread_hl_frac': 0.007604423958551307, 'bb_std_mult': 3.3851866558643398, 'rsi_os': 8, 'rsi_ob': 84, 'vol_spike': 0.09685107528382232, 'adx_thresh': 16.82900880961908, 'atr_min_pct': 0.0024507336524690554, 'atr_max_pct': 0.07629537165577284, 'tp_mult': 2.2402324812214554, 'tsl_mult': 0.586019061994928, 'strategy': 'breakout', 'time_stop': 237, 'use_sma': False, 'use_atr': False, 'use_adx': True, 'use_ema': False, 'use_spike': False, 'rsi_required': False, 'edge_k': 0.3880511717666846, 'edge_cap': 0.5335525621380608, 'bull_strategy': 'breakout', 'bull_bb_std_mult': 2.8940404397558264, 'bull_rsi_os': 44, 'bull_rsi_ob': 47, 'bull_adx_thresh': 22.923615056076066, 'bull_atr_min_pct': 0.0030404417216188646, 'bull_atr_max_pct': 0.0454701049259524, 'bull_tp_mult': 1.171352263701705, 'bull_tsl_mult': 0.8861605327446299, 'bull_time_stop': 137, 'bull_use_sma': True, 'bull_use_ema': True, 'bull_use_atr': False, 'bull_use_adx': False, 'bull_use_spike': True, 'bull_rsi_required': False, 'bear_strategy': 'mean_reversion', 'bear_bb_std_mult': 3.5960620245547488, 'bear_rsi_os': 35, 'bear_rsi_ob': 88, 'bear_adx_thresh': 7.376670405813153, 'bear_atr_min_pct': 0.028529953666487844, 'bear_atr_max_pct': 0.013850433044532137, 'bear_tp_mult': 2.8827014765216745, 'bear_tsl_mult': 0.5355201459657796, 'bear_time_stop': 284, 'bear_use_sma': True, 'bear_use_ema': False, 'bear_use_atr': True, 'bear_use_adx': False, 'bear_use_spike': True, 'bear_rsi_required': True, 'sideways_strategy': 'mean_reversion', 'sideways_bb_std_mult': 0.8280059054876235, 'sideways_rsi_os': 42, 'sideways_rsi_ob': 62, 'sideways_adx_thresh': 21.60091161424186, 'sideways_atr_min_pct': 0.020238658967448222, 'sideways_atr_max_pct': 0.0742498228087146, 'sideways_tp_mult': 2.9910085105214335, 'sideways_tsl_mult': 0.8333296419503551, 'sideways_time_stop': 116, 'sideways_use_sma': True, 'sideways_use_ema': False, 'sideways_use_atr': False, 'sideways_use_adx': False, 'sideways_use_spike': False, 'sideways_rsi_required': True}.
[I 2025-08-30 14:51:21,932] Trial 254 finished with values: [-1000000000.0, 1000000000.0] and parameters: {'p_sma': 45, 'p_std': 6, 'p_atr': 22, 'p_adx': 10, 'rsi_period': 29, 'ema1': 12, 'ema2': 55, 'slip_atr_k': 0.042945559447271686, 'slip_spread_k': 0.07993720144855532, 'spread_hl_frac': 0.005476911100601596, 'bb_std_mult': 3.272322588001618, 'rsi_os': 7, 'rsi_ob': 84, 'vol_spike': 0.11068186980961889, 'adx_thresh': 16.72800488175278, 'atr_min_pct': 0.001729488459370404, 'atr_max_pct': 0.07636788914953381, 'tp_mult': 2.248405762967495, 'tsl_mult': 0.6821557326741332, 'strategy': 'breakout', 'time_stop': 222, 'use_sma': False, 'use_atr': False, 'use_adx': True, 'use_ema': False, 'use_spike': False, 'rsi_required': False, 'edge_k': 0.23824826698480028, 'edge_cap': 0.60436716938212, 'bull_strategy': 'breakout', 'bull_bb_std_mult': 2.940176298517281, 'bull_rsi_os': 23, 'bull_rsi_ob': 51, 'bull_adx_thresh': 23.333167619778056, 'bull_atr_min_pct': 0.014845889591396013, 'bull_atr_max_pct': 0.04523769512169875, 'bull_tp_mult': 1.0755298543881369, 'bull_tsl_mult': 0.9706312792794215, 'bull_time_stop': 160, 'bull_use_sma': True, 'bull_use_ema': True, 'bull_use_atr': True, 'bull_use_adx': False, 'bull_use_spike': True, 'bull_rsi_required': False, 'bear_strategy': 'mean_reversion', 'bear_bb_std_mult': 3.5644580276061797, 'bear_rsi_os': 37, 'bear_rsi_ob': 91, 'bear_adx_thresh': 7.310919776072173, 'bear_atr_min_pct': 0.027303313643021382, 'bear_atr_max_pct': 0.14441943423731396, 'bear_tp_mult': 2.7476330239055438, 'bear_tsl_mult': 0.5945549354639177, 'bear_time_stop': 300, 'bear_use_sma': True, 'bear_use_ema': False, 'bear_use_atr': True, 'bear_use_adx': True, 'bear_use_spike': True, 'bear_rsi_required': True, 'sideways_strategy': 'mean_reversion', 'sideways_bb_std_mult': 0.7328637325019991, 'sideways_rsi_os': 41, 'sideways_rsi_ob': 60, 'sideways_adx_thresh': 21.552633642114554, 'sideways_atr_min_pct': 0.01854672845452543, 'sideways_atr_max_pct': 0.07288212843980137, 'sideways_tp_mult': 2.9504692971679014, 'sideways_tsl_mult': 0.7244260482782716, 'sideways_time_stop': 118, 'sideways_use_sma': True, 'sideways_use_ema': False, 'sideways_use_atr': False, 'sideways_use_adx': True, 'sideways_use_spike': False, 'sideways_rsi_required': True}.
[I 2025-08-30 14:51:24,010] Trial 255 finished with values: [-1000000000.0, 1000000000.0] and parameters: {'p_sma': 47, 'p_std': 6, 'p_atr': 22, 'p_adx': 10, 'rsi_period': 29, 'ema1': 12, 'ema2': 59, 'slip_atr_k': 0.043291594750675816, 'slip_spread_k': 0.0825368795934335, 'spread_hl_frac': 0.004987657578944576, 'bb_std_mult': 3.2585179391201886, 'rsi_os': 8, 'rsi_ob': 83, 'vol_spike': 0.10660677883767357, 'adx_thresh': 16.919839110143236, 'atr_min_pct': 0.001742783497973974, 'atr_max_pct': 0.07659539287920991, 'tp_mult': 2.325199171146213, 'tsl_mult': 0.6729820907200271, 'strategy': 'breakout', 'time_stop': 247, 'use_sma': False, 'use_atr': False, 'use_adx': True, 'use_ema': False, 'use_spike': False, 'rsi_required': False, 'edge_k': 0.2512179534207463, 'edge_cap': 0.6174489854451616, 'bull_strategy': 'breakout', 'bull_bb_std_mult': 2.941201029743004, 'bull_rsi_os': 23, 'bull_rsi_ob': 49, 'bull_adx_thresh': 22.692862786898413, 'bull_atr_min_pct': 0.019358029052564178, 'bull_atr_max_pct': 0.04564692017979839, 'bull_tp_mult': 1.1250290316049416, 'bull_tsl_mult': 0.9756914869148885, 'bull_time_stop': 162, 'bull_use_sma': True, 'bull_use_ema': True, 'bull_use_atr': True, 'bull_use_adx': False, 'bull_use_spike': True, 'bull_rsi_required': False, 'bear_strategy': 'mean_reversion', 'bear_bb_std_mult': 3.5557094801138898, 'bear_rsi_os': 37, 'bear_rsi_ob': 91, 'bear_adx_thresh': 8.716197553808883, 'bear_atr_min_pct': 0.027107390196838426, 'bear_atr_max_pct': 0.04673017269783752, 'bear_tp_mult': 2.7353540935011464, 'bear_tsl_mult': 0.5982773868336863, 'bear_time_stop': 299, 'bear_use_sma': True, 'bear_use_ema': False, 'bear_use_atr': True, 'bear_use_adx': True, 'bear_use_spike': True, 'bear_rsi_required': True, 'sideways_strategy': 'mean_reversion', 'sideways_bb_std_mult': 0.725032510452007, 'sideways_rsi_os': 42, 'sideways_rsi_ob': 60, 'sideways_adx_thresh': 21.673619825855358, 'sideways_atr_min_pct': 0.018304206643929594, 'sideways_atr_max_pct': 0.06879574252935126, 'sideways_tp_mult': 2.9444139106651717, 'sideways_tsl_mult': 0.7223059609465632, 'sideways_time_stop': 114, 'sideways_use_sma': True, 'sideways_use_ema': False, 'sideways_use_atr': False, 'sideways_use_adx': True, 'sideways_use_spike': False, 'sideways_rsi_required': True}.
[I 2025-08-30 14:51:27,343] Trial 256 finished with values: [-1000000000.0, 1000000000.0] and parameters: {'p_sma': 47, 'p_std': 6, 'p_atr': 26, 'p_adx': 10, 'rsi_period': 30, 'ema1': 12, 'ema2': 48, 'slip_atr_k': 0.0421748237114906, 'slip_spread_k': 0.07189366360819166, 'spread_hl_frac': 0.005167569451692448, 'bb_std_mult': 3.183774944696744, 'rsi_os': 8, 'rsi_ob': 84, 'vol_spike': 0.104824773253549, 'adx_thresh': 16.9520713845985, 'atr_min_pct': 0.0012738710094663305, 'atr_max_pct': 0.07601632968588479, 'tp_mult': 2.2548617205194836, 'tsl_mult': 0.6736899358294393, 'strategy': 'breakout', 'time_stop': 222, 'use_sma': False, 'use_atr': False, 'use_adx': True, 'use_ema': False, 'use_spike': False, 'rsi_required': False, 'edge_k': 0.24725357435376968, 'edge_cap': 0.5568597423448572, 'bull_strategy': 'breakout', 'bull_bb_std_mult': 2.9405638670333176, 'bull_rsi_os': 23, 'bull_rsi_ob': 49, 'bull_adx_thresh': 22.941836593551248, 'bull_atr_min_pct': 0.01721465409792617, 'bull_atr_max_pct': 0.04509391410751645, 'bull_tp_mult': 1.0779863257931037, 'bull_tsl_mult': 0.9732786193165385, 'bull_time_stop': 162, 'bull_use_sma': True, 'bull_use_ema': True, 'bull_use_atr': True, 'bull_use_adx': False, 'bull_use_spike': True, 'bull_rsi_required': False, 'bear_strategy': 'mean_reversion', 'bear_bb_std_mult': 3.5881587343390655, 'bear_rsi_os': 37, 'bear_rsi_ob': 91, 'bear_adx_thresh': 7.330489685770391, 'bear_atr_min_pct': 0.027051336353640886, 'bear_atr_max_pct': 0.14462193598686976, 'bear_tp_mult': 2.719403032796492, 'bear_tsl_mult': 0.607498026148267, 'bear_time_stop': 298, 'bear_use_sma': True, 'bear_use_ema': False, 'bear_use_atr': True, 'bear_use_adx': True, 'bear_use_spike': True, 'bear_rsi_required': True, 'sideways_strategy': 'mean_reversion', 'sideways_bb_std_mult': 0.729254548516918, 'sideways_rsi_os': 42, 'sideways_rsi_ob': 60, 'sideways_adx_thresh': 21.556268270831637, 'sideways_atr_min_pct': 0.018162280635312087, 'sideways_atr_max_pct': 0.0751017540644136, 'sideways_tp_mult': 2.9481030357516476, 'sideways_tsl_mult': 0.7288851579913194, 'sideways_time_stop': 118, 'sideways_use_sma': True, 'sideways_use_ema': False, 'sideways_use_atr': False, 'sideways_use_adx': True, 'sideways_use_spike': False, 'sideways_rsi_required': True}.
[I 2025-08-30 14:51:46,995] Trial 257 finished with values: [-1000000000.0, 1000000000.0] and parameters: {'p_sma': 45, 'p_std': 7, 'p_atr': 19, 'p_adx': 27, 'rsi_period': 29, 'ema1': 12, 'ema2': 48, 'slip_atr_k': 0.018374528880766836, 'slip_spread_k': 0.1532811380322781, 'spread_hl_frac': 0.007584134597707827, 'bb_std_mult': 3.2637951319472545, 'rsi_os': 7, 'rsi_ob': 83, 'vol_spike': 0.10752167782549257, 'adx_thresh': 17.234034958546694, 'atr_min_pct': 0.001748266549464479, 'atr_max_pct': 0.08031187689683608, 'tp_mult': 2.352978406835604, 'tsl_mult': 0.5461033227349246, 'strategy': 'breakout', 'time_stop': 251, 'use_sma': False, 'use_atr': False, 'use_adx': True, 'use_ema': False, 'use_spike': False, 'rsi_required': False, 'edge_k': 0.43726824375517676, 'edge_cap': 0.5546449069598568, 'bull_strategy': 'breakout', 'bull_bb_std_mult': 2.9152851799959953, 'bull_rsi_os': 46, 'bull_rsi_ob': 45, 'bull_adx_thresh': 26.9096915859144, 'bull_atr_min_pct': 0.0032943274577485614, 'bull_atr_max_pct': 0.05588839599056151, 'bull_tp_mult': 1.0873074740631203, 'bull_tsl_mult': 0.8827724498583381, 'bull_time_stop': 127, 'bull_use_sma': True, 'bull_use_ema': True, 'bull_use_atr': False, 'bull_use_adx': False, 'bull_use_spike': True, 'bull_rsi_required': False, 'bear_strategy': 'mean_reversion', 'bear_bb_std_mult': 3.5998838270429645, 'bear_rsi_os': 35, 'bear_rsi_ob': 85, 'bear_adx_thresh': 8.290757515951787, 'bear_atr_min_pct': 0.027841483384688354, 'bear_atr_max_pct': 0.015031867724809666, 'bear_tp_mult': 2.90616484622194, 'bear_tsl_mult': 0.4993323020279678, 'bear_time_stop': 282, 'bear_use_sma': True, 'bear_use_ema': False, 'bear_use_atr': True, 'bear_use_adx': True, 'bear_use_spike': True, 'bear_rsi_required': True, 'sideways_strategy': 'mean_reversion', 'sideways_bb_std_mult': 0.7392190048585425, 'sideways_rsi_os': 42, 'sideways_rsi_ob': 60, 'sideways_adx_thresh': 21.261760349079182, 'sideways_atr_min_pct': 0.020469293476170734, 'sideways_atr_max_pct': 0.07482623501534855, 'sideways_tp_mult': 2.928348833030585, 'sideways_tsl_mult': 0.8584222501975021, 'sideways_time_stop': 119, 'sideways_use_sma': True, 'sideways_use_ema': False, 'sideways_use_atr': False, 'sideways_use_adx': False, 'sideways_use_spike': False, 'sideways_rsi_required': True}.
[I 2025-08-30 14:51:57,488] Trial 258 finished with values: [-1000000000.0, 1000000000.0] and parameters: {'p_sma': 46, 'p_std': 29, 'p_atr': 19, 'p_adx': 27, 'rsi_period': 29, 'ema1': 12, 'ema2': 48, 'slip_atr_k': 0.018237473149661856, 'slip_spread_k': 0.14139701595464843, 'spread_hl_frac': 0.007265726951903809, 'bb_std_mult': 3.377482520552995, 'rsi_os': 8, 'rsi_ob': 83, 'vol_spike': 0.10692207443913637, 'adx_thresh': 17.110741201702268, 'atr_min_pct': 0.001178999351622433, 'atr_max_pct': 0.08078896130826481, 'tp_mult': 2.33872986140276, 'tsl_mult': 0.5475756496658098, 'strategy': 'breakout', 'time_stop': 251, 'use_sma': False, 'use_atr': False, 'use_adx': True, 'use_ema': False, 'use_spike': False, 'rsi_required': False, 'edge_k': 0.43053228134285737, 'edge_cap': 0.5599037760378783, 'bull_strategy': 'breakout', 'bull_bb_std_mult': 2.916669425475214, 'bull_rsi_os': 46, 'bull_rsi_ob': 47, 'bull_adx_thresh': 27.209722568679656, 'bull_atr_min_pct': 0.0035174991390746592, 'bull_atr_max_pct': 0.056837508939050714, 'bull_tp_mult': 1.1121052392694744, 'bull_tsl_mult': 0.8795466623655791, 'bull_time_stop': 127, 'bull_use_sma': True, 'bull_use_ema': True, 'bull_use_atr': False, 'bull_use_adx': False, 'bull_use_spike': True, 'bull_rsi_required': False, 'bear_strategy': 'mean_reversion', 'bear_bb_std_mult': 3.581667409346141, 'bear_rsi_os': 35, 'bear_rsi_ob': 86, 'bear_adx_thresh': 8.241947019075191, 'bear_atr_min_pct': 0.028569738228665584, 'bear_atr_max_pct': 0.014505859479517661, 'bear_tp_mult': 2.9531096749644297, 'bear_tsl_mult': 0.5075339843158678, 'bear_time_stop': 282, 'bear_use_sma': True, 'bear_use_ema': False, 'bear_use_atr': True, 'bear_use_adx': True, 'bear_use_spike': True, 'bear_rsi_required': True, 'sideways_strategy': 'mean_reversion', 'sideways_bb_std_mult': 0.6815042525712988, 'sideways_rsi_os': 42, 'sideways_rsi_ob': 61, 'sideways_adx_thresh': 20.982981582615697, 'sideways_atr_min_pct': 0.02042462761256196, 'sideways_atr_max_pct': 0.06782873537430098, 'sideways_tp_mult': 2.934596643241649, 'sideways_tsl_mult': 0.847041168768675, 'sideways_time_stop': 122, 'sideways_use_sma': True, 'sideways_use_ema': False, 'sideways_use_atr': False, 'sideways_use_adx': False, 'sideways_use_spike': False, 'sideways_rsi_required': True}.
[I 2025-08-30 14:51:59,256] Trial 259 finished with values: [-1000000000.0, 1000000000.0] and parameters: {'p_sma': 46, 'p_std': 7, 'p_atr': 19, 'p_adx': 27, 'rsi_period': 27, 'ema1': 12, 'ema2': 48, 'slip_atr_k': 0.018512829193135568, 'slip_spread_k': 0.14242573212474352, 'spread_hl_frac': 0.0074801284786551745, 'bb_std_mult': 3.363824674541177, 'rsi_os': 6, 'rsi_ob': 83, 'vol_spike': 0.10552036182267338, 'adx_thresh': 17.85136216185638, 'atr_min_pct': 0.0011046643391716161, 'atr_max_pct': 0.08171313003406572, 'tp_mult': 2.3259050933022403, 'tsl_mult': 0.5564562791812997, 'strategy': 'breakout', 'time_stop': 252, 'use_sma': False, 'use_atr': False, 'use_adx': True, 'use_ema': False, 'use_spike': False, 'rsi_required': False, 'edge_k': 0.42444071853516885, 'edge_cap': 0.5641118371450772, 'bull_strategy': 'breakout', 'bull_bb_std_mult': 3.039352763269028, 'bull_rsi_os': 46, 'bull_rsi_ob': 45, 'bull_adx_thresh': 27.28915596557294, 'bull_atr_min_pct': 0.0035939741617577155, 'bull_atr_max_pct': 0.05449879553640399, 'bull_tp_mult': 1.0960043400604367, 'bull_tsl_mult': 0.8860694493977253, 'bull_time_stop': 167, 'bull_use_sma': True, 'bull_use_ema': True, 'bull_use_atr': False, 'bull_use_adx': False, 'bull_use_spike': True, 'bull_rsi_required': True, 'bear_strategy': 'mean_reversion', 'bear_bb_std_mult': 3.594444939538718, 'bear_rsi_os': 35, 'bear_rsi_ob': 86, 'bear_adx_thresh': 8.195254777582567, 'bear_atr_min_pct': 0.028480131710969168, 'bear_atr_max_pct': 0.016132409090250016, 'bear_tp_mult': 2.991000232353663, 'bear_tsl_mult': 0.5016746572709091, 'bear_time_stop': 283, 'bear_use_sma': True, 'bear_use_ema': False, 'bear_use_atr': True, 'bear_use_adx': False, 'bear_use_spike': True, 'bear_rsi_required': True, 'sideways_strategy': 'mean_reversion', 'sideways_bb_std_mult': 0.814103617606478, 'sideways_rsi_os': 42, 'sideways_rsi_ob': 61, 'sideways_adx_thresh': 21.112298815586517, 'sideways_atr_min_pct': 0.020249651334077617, 'sideways_atr_max_pct': 0.07496268526877987, 'sideways_tp_mult': 2.9413152014260837, 'sideways_tsl_mult': 0.8483564421134357, 'sideways_time_stop': 121, 'sideways_use_sma': True, 'sideways_use_ema': False, 'sideways_use_atr': False, 'sideways_use_adx': False, 'sideways_use_spike': False, 'sideways_rsi_required': True}.
[I 2025-08-30 14:52:00,831] Trial 260 finished with values: [-1000000000.0, 1000000000.0] and parameters: {'p_sma': 45, 'p_std': 7, 'p_atr': 19, 'p_adx': 27, 'rsi_period': 27, 'ema1': 13, 'ema2': 48, 'slip_atr_k': 0.019479428137612956, 'slip_spread_k': 0.14570424492705544, 'spread_hl_frac': 0.007939699302516139, 'bb_std_mult': 3.371957990907787, 'rsi_os': 6, 'rsi_ob': 83, 'vol_spike': 0.10581394642621406, 'adx_thresh': 17.84272056144819, 'atr_min_pct': 0.002623482553316686, 'atr_max_pct': 0.083648758101273, 'tp_mult': 2.271902743530113, 'tsl_mult': 0.565463331762078, 'strategy': 'breakout', 'time_stop': 249, 'use_sma': False, 'use_atr': False, 'use_adx': True, 'use_ema': False, 'use_spike': False, 'rsi_required': False, 'edge_k': 0.3134323531053153, 'edge_cap': 0.564190626592661, 'bull_strategy': 'breakout', 'bull_bb_std_mult': 3.0204500935220064, 'bull_rsi_os': 46, 'bull_rsi_ob': 45, 'bull_adx_thresh': 27.138305600153103, 'bull_atr_min_pct': 0.003678469911317017, 'bull_atr_max_pct': 0.05426446812898113, 'bull_tp_mult': 1.1337880023948264, 'bull_tsl_mult': 0.882805751251617, 'bull_time_stop': 127, 'bull_use_sma': True, 'bull_use_ema': True, 'bull_use_atr': False, 'bull_use_adx': False, 'bull_use_spike': True, 'bull_rsi_required': True, 'bear_strategy': 'mean_reversion', 'bear_bb_std_mult': 3.5927533289883384, 'bear_rsi_os': 35, 'bear_rsi_ob': 85, 'bear_adx_thresh': 8.401543881073376, 'bear_atr_min_pct': 0.028632068308330136, 'bear_atr_max_pct': 0.015038030317095349, 'bear_tp_mult': 2.9983872086039476, 'bear_tsl_mult': 0.4963352108210263, 'bear_time_stop': 283, 'bear_use_sma': True, 'bear_use_ema': False, 'bear_use_atr': True, 'bear_use_adx': False, 'bear_use_spike': True, 'bear_rsi_required': True, 'sideways_strategy': 'mean_reversion', 'sideways_bb_std_mult': 0.8354047620426709, 'sideways_rsi_os': 42, 'sideways_rsi_ob': 61, 'sideways_adx_thresh': 20.921776732340728, 'sideways_atr_min_pct': 0.020722742812056705, 'sideways_atr_max_pct': 0.07948702893955106, 'sideways_tp_mult': 2.9399674532086406, 'sideways_tsl_mult': 0.8320860321186448, 'sideways_time_stop': 123, 'sideways_use_sma': True, 'sideways_use_ema': False, 'sideways_use_atr': False, 'sideways_use_adx': False, 'sideways_use_spike': False, 'sideways_rsi_required': True}.
