[I 2025-08-30 15:07:44,100] Trial 370 finished with values: [-1000000000.0, 1000000000.0] and parameters: {'p_sma': 53, 'p_std': 38, 'p_atr': 16, 'p_adx': 18, 'rsi_period': 48, 'ema1': 11, 'ema2': 20, 'slip_atr_k': 0.02496604551834649, 'slip_spread_k': 0.8296083704329817, 'spread_hl_frac': 0.00016649377504760225, 'bb_std_mult': 3.0567958640310686, 'rsi_os': 41, 'rsi_ob': 60, 'vol_spike': 0.23342380021404993, 'adx_thresh': 12.02823858607788, 'atr_min_pct': 0.004656680637555981, 'atr_max_pct': 0.10760407302889166, 'tp_mult': 1.6734356189110333, 'tsl_mult': 0.9275957707418794, 'strategy': 'breakout', 'time_stop': 278, 'use_sma': False, 'use_atr': False, 'use_adx': True, 'use_ema': False, 'use_spike': False, 'rsi_required': False, 'edge_k': 0.2828605006724728, 'edge_cap': 0.18038402328362102, 'bull_strategy': 'breakout', 'bull_bb_std_mult': 0.9245783340002807, 'bull_rsi_os': 55, 'bull_rsi_ob': 64, 'bull_adx_thresh': 32.16386720829121, 'bull_atr_min_pct': 0.021306509224845876, 'bull_atr_max_pct': 0.08322529159845139, 'bull_tp_mult': 2.0713712824860835, 'bull_tsl_mult': 0.9623483337068341, 'bull_time_stop': 134, 'bull_use_sma': True, 'bull_use_ema': True, 'bull_use_atr': True, 'bull_use_adx': False, 'bull_use_spike': True, 'bull_rsi_required': False, 'bear_strategy': 'mean_reversion', 'bear_bb_std_mult': 1.7868470693821048, 'bear_rsi_os': 8, 'bear_rsi_ob': 84, 'bear_adx_thresh': 17.915990604659953, 'bear_atr_min_pct': 0.027813777860044322, 'bear_atr_max_pct': 0.045628719746578165, 'bear_tp_mult': 2.654934131828452, 'bear_tsl_mult': 0.6270422277366129, 'bear_time_stop': 251, 'bear_use_sma': True, 'bear_use_ema': False, 'bear_use_atr': True, 'bear_use_adx': True, 'bear_use_spike': True, 'bear_rsi_required': True, 'sideways_strategy': 'mean_reversion', 'sideways_bb_std_mult': 2.494241058326336, 'sideways_rsi_os': 35, 'sideways_rsi_ob': 90, 'sideways_adx_thresh': 18.580164493933427, 'sideways_atr_min_pct': 0.024153081505491517, 'sideways_atr_max_pct': 0.13505792957128598, 'sideways_tp_mult': 1.5166562844215496, 'sideways_tsl_mult': 0.9974344358206323, 'sideways_time_stop': 79, 'sideways_use_sma': True, 'sideways_use_ema': False, 'sideways_use_atr': True, 'sideways_use_adx': True, 'sideways_use_spike': True, 'sideways_rsi_required': True}.
[I 2025-08-30 15:07:44,137] Trial 369 finished with values: [-1000000000.0, 1000000000.0] and parameters: {'p_sma': 52, 'p_std': 45, 'p_atr': 10, 'p_adx': 30, 'rsi_period': 49, 'ema1': 11, 'ema2': 55, 'slip_atr_k': 0.12108676795047686, 'slip_spread_k': 0.24983030246495044, 'spread_hl_frac': 0.03600322211563402, 'bb_std_mult': 1.370402738694804, 'rsi_os': 41, 'rsi_ob': 64, 'vol_spike': 0.23316561412550016, 'adx_thresh': 11.457166150214091, 'atr_min_pct': 0.004692067218098974, 'atr_max_pct': 0.10620487779382787, 'tp_mult': 1.4913297775660697, 'tsl_mult': 0.4915769298745229, 'strategy': 'breakout', 'time_stop': 213, 'use_sma': False, 'use_atr': False, 'use_adx': True, 'use_ema': False, 'use_spike': False, 'rsi_required': False, 'edge_k': 1.3215000062335922, 'edge_cap': 0.7813733280004487, 'bull_strategy': 'breakout', 'bull_bb_std_mult': 1.4128333437627427, 'bull_rsi_os': 55, 'bull_rsi_ob': 76, 'bull_adx_thresh': 33.33595840525202, 'bull_atr_min_pct': 0.0006402806623975186, 'bull_atr_max_pct': 0.11350813254041965, 'bull_tp_mult': 2.4914005886218824, 'bull_tsl_mult': 0.9978972598661616, 'bull_time_stop': 115, 'bull_use_sma': True, 'bull_use_ema': True, 'bull_use_atr': True, 'bull_use_adx': False, 'bull_use_spike': True, 'bull_rsi_required': False, 'bear_strategy': 'mean_reversion', 'bear_bb_std_mult': 3.065381188987889, 'bear_rsi_os': 27, 'bear_rsi_ob': 73, 'bear_adx_thresh': 5.646555977020887, 'bear_atr_min_pct': 0.01990621444665828, 'bear_atr_max_pct': 0.0893608984680748, 'bear_tp_mult': 2.8906822360981277, 'bear_tsl_mult': 0.6674404503992617, 'bear_time_stop': 252, 'bear_use_sma': True, 'bear_use_ema': False, 'bear_use_atr': True, 'bear_use_adx': True, 'bear_use_spike': True, 'bear_rsi_required': True, 'sideways_strategy': 'mean_reversion', 'sideways_bb_std_mult': 1.0562314574732026, 'sideways_rsi_os': 24, 'sideways_rsi_ob': 53, 'sideways_adx_thresh': 18.570495267012987, 'sideways_atr_min_pct': 0.024910247465628057, 'sideways_atr_max_pct': 0.10506988685060999, 'sideways_tp_mult': 2.3585940824009644, 'sideways_tsl_mult': 0.9537428324902388, 'sideways_time_stop': 77, 'sideways_use_sma': True, 'sideways_use_ema': False, 'sideways_use_atr': True, 'sideways_use_adx': True, 'sideways_use_spike': True, 'sideways_rsi_required': True}.
[I 2025-08-30 15:07:44,915] Trial 371 finished with values: [-1000000000.0, 1000000000.0] and parameters: {'p_sma': 42, 'p_std': 38, 'p_atr': 25, 'p_adx': 18, 'rsi_period': 48, 'ema1': 11, 'ema2': 55, 'slip_atr_k': 0.031800839673904596, 'slip_spread_k': 0.2973519392526188, 'spread_hl_frac': 0.0001115087480156947, 'bb_std_mult': 3.0568323796856633, 'rsi_os': 7, 'rsi_ob': 89, 'vol_spike': 0.23380061208387576, 'adx_thresh': 11.637777736501866, 'atr_min_pct': 0.01601650040728904, 'atr_max_pct': 0.10783392267702725, 'tp_mult': 1.5146195267048261, 'tsl_mult': 0.3936390493388442, 'strategy': 'breakout', 'time_stop': 214, 'use_sma': False, 'use_atr': False, 'use_adx': True, 'use_ema': False, 'use_spike': False, 'rsi_required': False, 'edge_k': 1.500764353245882, 'edge_cap': 0.7880221245224827, 'bull_strategy': 'breakout', 'bull_bb_std_mult': 0.9317459476289274, 'bull_rsi_os': 55, 'bull_rsi_ob': 64, 'bull_adx_thresh': 31.78819804421145, 'bull_atr_min_pct': 0.015834260992986533, 'bull_atr_max_pct': 0.1497593164771285, 'bull_tp_mult': 2.4644634125823828, 'bull_tsl_mult': 0.9438614159701647, 'bull_time_stop': 115, 'bull_use_sma': True, 'bull_use_ema': True, 'bull_use_atr': True, 'bull_use_adx': False, 'bull_use_spike': True, 'bull_rsi_required': False, 'bear_strategy': 'mean_reversion', 'bear_bb_std_mult': 2.9816219414762664, 'bear_rsi_os': 24, 'bear_rsi_ob': 84, 'bear_adx_thresh': 6.382034792710633, 'bear_atr_min_pct': 0.027890667470287896, 'bear_atr_max_pct': 0.021075652126484577, 'bear_tp_mult': 1.2369021425379128, 'bear_tsl_mult': 0.6316628208625702, 'bear_time_stop': 252, 'bear_use_sma': True, 'bear_use_ema': False, 'bear_use_atr': True, 'bear_use_adx': True, 'bear_use_spike': True, 'bear_rsi_required': True, 'sideways_strategy': 'mean_reversion', 'sideways_bb_std_mult': 1.0584591036602025, 'sideways_rsi_os': 33, 'sideways_rsi_ob': 90, 'sideways_adx_thresh': 18.66247173768976, 'sideways_atr_min_pct': 0.02438201180886473, 'sideways_atr_max_pct': 0.10450089862252787, 'sideways_tp_mult': 1.0186371808857841, 'sideways_tsl_mult': 0.9667088794660619, 'sideways_time_stop': 78, 'sideways_use_sma': True, 'sideways_use_ema': False, 'sideways_use_atr': True, 'sideways_use_adx': True, 'sideways_use_spike': True, 'sideways_rsi_required': True}.
[I 2025-08-30 15:07:44,915] Trial 372 finished with values: [-0.01084818682000499, 0.010823574824558254] and parameters: {'p_sma': 51, 'p_std': 38, 'p_atr': 16, 'p_adx': 18, 'rsi_period': 49, 'ema1': 22, 'ema2': 55, 'slip_atr_k': 0.054653542596981686, 'slip_spread_k': 0.0011085356871583518, 'spread_hl_frac': 0.017302272699767186, 'bb_std_mult': 1.3736289089923734, 'rsi_os': 52, 'rsi_ob': 60, 'vol_spike': 0.24246913724594904, 'adx_thresh': 11.90889369650733, 'atr_min_pct': 0.01603884348519121, 'atr_max_pct': 0.1059208405761011, 'tp_mult': 2.5196213479882945, 'tsl_mult': 0.22593309947273016, 'strategy': 'breakout', 'time_stop': 150, 'use_sma': False, 'use_atr': False, 'use_adx': True, 'use_ema': False, 'use_spike': False, 'rsi_required': False, 'edge_k': 0.0031021463739119293, 'edge_cap': 0.282261293121976, 'bull_strategy': 'breakout', 'bull_bb_std_mult': 0.9283509947425364, 'bull_rsi_os': 55, 'bull_rsi_ob': 56, 'bull_adx_thresh': 32.13085587149562, 'bull_atr_min_pct': 0.0005533539646580502, 'bull_atr_max_pct': 0.0898419877998437, 'bull_tp_mult': 1.0118289149003772, 'bull_tsl_mult': 0.5760023843817447, 'bull_time_stop': 147, 'bull_use_sma': True, 'bull_use_ema': True, 'bull_use_atr': True, 'bull_use_adx': False, 'bull_use_spike': True, 'bull_rsi_required': False, 'bear_strategy': 'mean_reversion', 'bear_bb_std_mult': 2.9743495942580838, 'bear_rsi_os': 24, 'bear_rsi_ob': 48, 'bear_adx_thresh': 13.045402640433597, 'bear_atr_min_pct': 0.014790723821752295, 'bear_atr_max_pct': 0.08902776710571658, 'bear_tp_mult': 2.6582592150156668, 'bear_tsl_mult': 0.6533268695443347, 'bear_time_stop': 255, 'bear_use_sma': True, 'bear_use_ema': False, 'bear_use_atr': True, 'bear_use_adx': True, 'bear_use_spike': True, 'bear_rsi_required': True, 'sideways_strategy': 'mean_reversion', 'sideways_bb_std_mult': 2.2985106332466985, 'sideways_rsi_os': 33, 'sideways_rsi_ob': 57, 'sideways_adx_thresh': 7.955963947287074, 'sideways_atr_min_pct': 0.02418322488790908, 'sideways_atr_max_pct': 0.10319984845968493, 'sideways_tp_mult': 1.0439389689820304, 'sideways_tsl_mult': 0.9989934519789513, 'sideways_time_stop': 94, 'sideways_use_sma': True, 'sideways_use_ema': False, 'sideways_use_atr': True, 'sideways_use_adx': True, 'sideways_use_spike': True, 'sideways_rsi_required': True}.
[I 2025-08-30 15:08:22,375] Trial 374 finished with values: [-1000000000.0, 1000000000.0] and parameters: {'p_sma': 41, 'p_std': 37, 'p_atr': 17, 'p_adx': 19, 'rsi_period': 54, 'ema1': 10, 'ema2': 60, 'slip_atr_k': 0.19224883629317324, 'slip_spread_k': 0.0010391187611990538, 'spread_hl_frac': 0.0012501804454229082, 'bb_std_mult': 1.9851082907418234, 'rsi_os': 49, 'rsi_ob': 88, 'vol_spike': 0.24228684368364742, 'adx_thresh': 13.123893071505096, 'atr_min_pct': 0.01602038520207799, 'atr_max_pct': 0.09852203443326561, 'tp_mult': 2.4304909521988276, 'tsl_mult': 0.33164536269355194, 'strategy': 'breakout', 'time_stop': 264, 'use_sma': False, 'use_atr': False, 'use_adx': True, 'use_ema': False, 'use_spike': False, 'rsi_required': False, 'edge_k': 1.0184407759928877, 'edge_cap': 0.859402085245244, 'bull_strategy': 'breakout', 'bull_bb_std_mult': 2.5216465111759216, 'bull_rsi_os': 54, 'bull_rsi_ob': 74, 'bull_adx_thresh': 32.175370335564466, 'bull_atr_min_pct': 0.018874393750512072, 'bull_atr_max_pct': 0.09733788949570259, 'bull_tp_mult': 1.0142178099603227, 'bull_tsl_mult': 0.5332687779296452, 'bull_time_stop': 130, 'bull_use_sma': True, 'bull_use_ema': True, 'bull_use_atr': True, 'bull_use_adx': False, 'bull_use_spike': True, 'bull_rsi_required': False, 'bear_strategy': 'mean_reversion', 'bear_bb_std_mult': 2.9648701664297716, 'bear_rsi_os': 51, 'bear_rsi_ob': 81, 'bear_adx_thresh': 6.6185716013395295, 'bear_atr_min_pct': 0.00575507690561829, 'bear_atr_max_pct': 0.01996062626407122, 'bear_tp_mult': 1.7003070950373247, 'bear_tsl_mult': 0.7071030475481126, 'bear_time_stop': 263, 'bear_use_sma': True, 'bear_use_ema': False, 'bear_use_atr': True, 'bear_use_adx': True, 'bear_use_spike': True, 'bear_rsi_required': True, 'sideways_strategy': 'mean_reversion', 'sideways_bb_std_mult': 1.1551164078119804, 'sideways_rsi_os': 33, 'sideways_rsi_ob': 57, 'sideways_adx_thresh': 19.997022300209387, 'sideways_atr_min_pct': 0.012463149063741265, 'sideways_atr_max_pct': 0.10029743130417644, 'sideways_tp_mult': 1.0484022816231775, 'sideways_tsl_mult': 0.4470460628032395, 'sideways_time_stop': 95, 'sideways_use_sma': True, 'sideways_use_ema': False, 'sideways_use_atr': True, 'sideways_use_adx': True, 'sideways_use_spike': True, 'sideways_rsi_required': True}.
[I 2025-08-30 15:08:23,454] Trial 376 finished with values: [-1000000000.0, 1000000000.0] and parameters: {'p_sma': 6, 'p_std': 23, 'p_atr': 9, 'p_adx': 17, 'rsi_period': 69, 'ema1': 10, 'ema2': 60, 'slip_atr_k': 0.19287532959570663, 'slip_spread_k': 0.2824174059361123, 'spread_hl_frac': 0.0014279638025378474, 'bb_std_mult': 1.1572608156192903, 'rsi_os': 8, 'rsi_ob': 90, 'vol_spike': 0.17759520336663134, 'adx_thresh': 13.056006668885777, 'atr_min_pct': 0.004022138920140215, 'atr_max_pct': 0.1390992449107694, 'tp_mult': 2.4294177633818284, 'tsl_mult': 0.452301524241402, 'strategy': 'breakout', 'time_stop': 261, 'use_sma': False, 'use_atr': False, 'use_adx': True, 'use_ema': False, 'use_spike': False, 'rsi_required': False, 'edge_k': 0.20568485131816827, 'edge_cap': 0.8582830721134788, 'bull_strategy': 'breakout', 'bull_bb_std_mult': 2.5582238255174237, 'bull_rsi_os': 52, 'bull_rsi_ob': 66, 'bull_adx_thresh': 5.518622992702287, 'bull_atr_min_pct': 0.017008420619736182, 'bull_atr_max_pct': 0.09458497459451323, 'bull_tp_mult': 1.8868782998705202, 'bull_tsl_mult': 0.9770825214479975, 'bull_time_stop': 137, 'bull_use_sma': True, 'bull_use_ema': True, 'bull_use_atr': True, 'bull_use_adx': False, 'bull_use_spike': True, 'bull_rsi_required': False, 'bear_strategy': 'mean_reversion', 'bear_bb_std_mult': 1.5773742138981153, 'bear_rsi_os': 41, 'bear_rsi_ob': 58, 'bear_adx_thresh': 25.454432126746603, 'bear_atr_min_pct': 0.026826047473892625, 'bear_atr_max_pct': 0.018341066941445695, 'bear_tp_mult': 1.3633050143587786, 'bear_tsl_mult': 0.7016844456259476, 'bear_time_stop': 241, 'bear_use_sma': True, 'bear_use_ema': False, 'bear_use_atr': True, 'bear_use_adx': True, 'bear_use_spike': True, 'bear_rsi_required': True, 'sideways_strategy': 'mean_reversion', 'sideways_bb_std_mult': 1.1496191767188644, 'sideways_rsi_os': 20, 'sideways_rsi_ob': 56, 'sideways_adx_thresh': 17.669870788719894, 'sideways_atr_min_pct': 0.023098685321681217, 'sideways_atr_max_pct': 0.09587348308229279, 'sideways_tp_mult': 2.086516591054631, 'sideways_tsl_mult': 0.9792884572202804, 'sideways_time_stop': 286, 'sideways_use_sma': True, 'sideways_use_ema': False, 'sideways_use_atr': True, 'sideways_use_adx': True, 'sideways_use_spike': True, 'sideways_rsi_required': True}.
[I 2025-08-30 15:08:24,161] Trial 373 finished with values: [-0.00964156707937569, 0.009611933906181234] and parameters: {'p_sma': 41, 'p_std': 43, 'p_atr': 9, 'p_adx': 13, 'rsi_period': 54, 'ema1': 10, 'ema2': 57, 'slip_atr_k': 0.01825928449589972, 'slip_spread_k': 0.29425886187844025, 'spread_hl_frac': 0.0011697917704127122, 'bb_std_mult': 2.999962338600735, 'rsi_os': 8, 'rsi_ob': 88, 'vol_spike': 0.24308630132866885, 'adx_thresh': 13.244702265973785, 'atr_min_pct': 0.018491510924402266, 'atr_max_pct': 0.12387630911968948, 'tp_mult': 1.8272817162965016, 'tsl_mult': 0.21615587706315748, 'strategy': 'breakout', 'time_stop': 11, 'use_sma': False, 'use_atr': False, 'use_adx': True, 'use_ema': False, 'use_spike': False, 'rsi_required': False, 'edge_k': 1.0811630603337874, 'edge_cap': 0.8685312583448022, 'bull_strategy': 'breakout', 'bull_bb_std_mult': 2.5317056733070795, 'bull_rsi_os': 12, 'bull_rsi_ob': 73, 'bull_adx_thresh': 32.55935993363705, 'bull_atr_min_pct': 0.0005639428281784685, 'bull_atr_max_pct': 0.12319689225437647, 'bull_tp_mult': 1.0104811217264418, 'bull_tsl_mult': 0.9537964917287395, 'bull_time_stop': 269, 'bull_use_sma': True, 'bull_use_ema': True, 'bull_use_atr': True, 'bull_use_adx': False, 'bull_use_spike': True, 'bull_rsi_required': False, 'bear_strategy': 'mean_reversion', 'bear_bb_std_mult': 2.9860502053086657, 'bear_rsi_os': 24, 'bear_rsi_ob': 81, 'bear_adx_thresh': 25.435408948483452, 'bear_atr_min_pct': 0.018579870614168804, 'bear_atr_max_pct': 0.019966083485988127, 'bear_tp_mult': 2.393181084237774, 'bear_tsl_mult': 0.6496025467080331, 'bear_time_stop': 262, 'bear_use_sma': True, 'bear_use_ema': False, 'bear_use_atr': True, 'bear_use_adx': True, 'bear_use_spike': True, 'bear_rsi_required': True, 'sideways_strategy': 'mean_reversion', 'sideways_bb_std_mult': 2.2569264074365463, 'sideways_rsi_os': 23, 'sideways_rsi_ob': 82, 'sideways_adx_thresh': 7.956715495099191, 'sideways_atr_min_pct': 0.023990571167190507, 'sideways_atr_max_pct': 0.06503261411891911, 'sideways_tp_mult': 1.633677201482784, 'sideways_tsl_mult': 0.3760214268753013, 'sideways_time_stop': 202, 'sideways_use_sma': True, 'sideways_use_ema': False, 'sideways_use_atr': True, 'sideways_use_adx': True, 'sideways_use_spike': True, 'sideways_rsi_required': True}.
[I 2025-08-30 15:08:24,338] Trial 375 finished with values: [-1000000000.0, 1000000000.0] and parameters: {'p_sma': 11, 'p_std': 51, 'p_atr': 16, 'p_adx': 17, 'rsi_period': 56, 'ema1': 30, 'ema2': 10, 'slip_atr_k': 0.015976211360070176, 'slip_spread_k': 0.9769084180538272, 'spread_hl_frac': 0.0013758612676824057, 'bb_std_mult': 2.6944826019495993, 'rsi_os': 33, 'rsi_ob': 87, 'vol_spike': 0.24409233694078616, 'adx_thresh': 12.8347663421415, 'atr_min_pct': 0.005142536299099131, 'atr_max_pct': 0.09804591650524602, 'tp_mult': 1.8351278204561425, 'tsl_mult': 0.45367223365789344, 'strategy': 'breakout', 'time_stop': 163, 'use_sma': False, 'use_atr': False, 'use_adx': True, 'use_ema': False, 'use_spike': False, 'rsi_required': False, 'edge_k': 0.21115309058210335, 'edge_cap': 0.8565163544658212, 'bull_strategy': 'breakout', 'bull_bb_std_mult': 2.106196748118875, 'bull_rsi_os': 11, 'bull_rsi_ob': 66, 'bull_adx_thresh': 32.85594295929818, 'bull_atr_min_pct': 4.523354638885191e-06, 'bull_atr_max_pct': 0.09533801842034414, 'bull_tp_mult': 1.7682696396589088, 'bull_tsl_mult': 0.9769061620503778, 'bull_time_stop': 131, 'bull_use_sma': True, 'bull_use_ema': True, 'bull_use_atr': True, 'bull_use_adx': False, 'bull_use_spike': True, 'bull_rsi_required': False, 'bear_strategy': 'mean_reversion', 'bear_bb_std_mult': 2.4079511830387923, 'bear_rsi_os': 41, 'bear_rsi_ob': 81, 'bear_adx_thresh': 6.754420598129542, 'bear_atr_min_pct': 0.006908131329984907, 'bear_atr_max_pct': 0.01922080132167642, 'bear_tp_mult': 1.6461589535539736, 'bear_tsl_mult': 0.7058430787432183, 'bear_time_stop': 240, 'bear_use_sma': True, 'bear_use_ema': False, 'bear_use_atr': True, 'bear_use_adx': True, 'bear_use_spike': True, 'bear_rsi_required': True, 'sideways_strategy': 'mean_reversion', 'sideways_bb_std_mult': 1.1343804228405965, 'sideways_rsi_os': 20, 'sideways_rsi_ob': 56, 'sideways_adx_thresh': 20.04122281179584, 'sideways_atr_min_pct': 0.011119951050791638, 'sideways_atr_max_pct': 0.08919010182816646, 'sideways_tp_mult': 2.4839448858765807, 'sideways_tsl_mult': 0.9996659103667399, 'sideways_time_stop': 84, 'sideways_use_sma': True, 'sideways_use_ema': False, 'sideways_use_atr': True, 'sideways_use_adx': True, 'sideways_use_spike': True, 'sideways_rsi_required': True}.
[I 2025-08-30 15:09:03,550] Trial 378 finished with values: [-1000000000.0, 1000000000.0] and parameters: {'p_sma': 9, 'p_std': 36, 'p_atr': 16, 'p_adx': 21, 'rsi_period': 63, 'ema1': 6, 'ema2': 58, 'slip_atr_k': 0.016660849789904612, 'slip_spread_k': 0.2660652151157408, 'spread_hl_frac': 0.004510717442452892, 'bb_std_mult': 2.702547757748015, 'rsi_os': 6, 'rsi_ob': 92, 'vol_spike': 0.2452763021774495, 'adx_thresh': 10.067989831008799, 'atr_min_pct': 0.012531113002563935, 'atr_max_pct': 0.11912558308138461, 'tp_mult': 2.821997958824946, 'tsl_mult': 0.47220397013242404, 'strategy': 'breakout', 'time_stop': 161, 'use_sma': False, 'use_atr': False, 'use_adx': True, 'use_ema': False, 'use_spike': False, 'rsi_required': False, 'edge_k': 1.0771562682605826, 'edge_cap': 0.805684033692173, 'bull_strategy': 'breakout', 'bull_bb_std_mult': 2.4263600162837573, 'bull_rsi_os': 11, 'bull_rsi_ob': 62, 'bull_adx_thresh': 33.383920222309726, 'bull_atr_min_pct': 0.00182379837276486, 'bull_atr_max_pct': 0.12383643314280238, 'bull_tp_mult': 1.7644098729246631, 'bull_tsl_mult': 0.598577708774632, 'bull_time_stop': 191, 'bull_use_sma': True, 'bull_use_ema': True, 'bull_use_atr': True, 'bull_use_adx': False, 'bull_use_spike': True, 'bull_rsi_required': True, 'bear_strategy': 'mean_reversion', 'bear_bb_std_mult': 3.074787842653098, 'bear_rsi_os': 26, 'bear_rsi_ob': 82, 'bear_adx_thresh': 7.02541364756767, 'bear_atr_min_pct': 0.025289771597651254, 'bear_atr_max_pct': 0.08021477292164289, 'bear_tp_mult': 2.3781607990385263, 'bear_tsl_mult': 0.6152579608839287, 'bear_time_stop': 258, 'bear_use_sma': True, 'bear_use_ema': False, 'bear_use_atr': True, 'bear_use_adx': True, 'bear_use_spike': True, 'bear_rsi_required': True, 'sideways_strategy': 'mean_reversion', 'sideways_bb_std_mult': 2.869312554013817, 'sideways_rsi_os': 36, 'sideways_rsi_ob': 92, 'sideways_adx_thresh': 6.887816598295981, 'sideways_atr_min_pct': 0.023649370579345096, 'sideways_atr_max_pct': 0.11819554325354073, 'sideways_tp_mult': 1.6272532923306258, 'sideways_tsl_mult': 0.9798046376822536, 'sideways_time_stop': 86, 'sideways_use_sma': True, 'sideways_use_ema': False, 'sideways_use_atr': True, 'sideways_use_adx': True, 'sideways_use_spike': True, 'sideways_rsi_required': True}.
