[I 2025-08-30 14:46:26,502] Trial 216 finished with values: [-1000000000.0, 1000000000.0] and parameters: {'p_sma': 31, 'p_std': 50, 'p_atr': 14, 'p_adx': 23, 'rsi_period': 16, 'ema1': 17, 'ema2': 39, 'slip_atr_k': 0.05438353350051418, 'slip_spread_k': 0.48111018826268503, 'spread_hl_frac': 0.04817096396589926, 'bb_std_mult': 3.5951450815366224, 'rsi_os': 18, 'rsi_ob': 61, 'vol_spike': 0.07836866790377006, 'adx_thresh': 17.37435628519938, 'atr_min_pct': 0.02491810662724933, 'atr_max_pct': 0.029237447621848572, 'tp_mult': 2.0083575510057345, 'tsl_mult': 0.12648716248602457, 'strategy': 'mean_reversion', 'time_stop': 88, 'use_sma': True, 'use_atr': True, 'use_adx': False, 'use_ema': False, 'use_spike': True, 'rsi_required': False, 'edge_k': 0.28121127307049887, 'edge_cap': 0.4985324116760184, 'bull_strategy': 'breakout', 'bull_bb_std_mult': 0.5972791497138852, 'bull_rsi_os': 41, 'bull_rsi_ob': 81, 'bull_adx_thresh': 18.955872001219923, 'bull_atr_min_pct': 0.010006199150564485, 'bull_atr_max_pct': 0.023969426862094658, 'bull_tp_mult': 1.9416552113917322, 'bull_tsl_mult': 0.36523085544602635, 'bull_time_stop': 22, 'bull_use_sma': False, 'bull_use_ema': False, 'bull_use_atr': True, 'bull_use_adx': True, 'bull_use_spike': False, 'bull_rsi_required': False, 'bear_strategy': 'mean_reversion', 'bear_bb_std_mult': 0.6224041839182851, 'bear_rsi_os': 19, 'bear_rsi_ob': 65, 'bear_adx_thresh': 33.05455633531661, 'bear_atr_min_pct': 0.011653626526368773, 'bear_atr_max_pct': 0.14196512552412582, 'bear_tp_mult': 1.9307221313298346, 'bear_tsl_mult': 0.002930765140010838, 'bear_time_stop': 155, 'bear_use_sma': False, 'bear_use_ema': True, 'bear_use_atr': False, 'bear_use_adx': False, 'bear_use_spike': True, 'bear_rsi_required': False, 'sideways_strategy': 'mean_reversion', 'sideways_bb_std_mult': 2.0702975159302306, 'sideways_rsi_os': 47, 'sideways_rsi_ob': 68, 'sideways_adx_thresh': 20.489482884476207, 'sideways_atr_min_pct': 0.023492729455920763, 'sideways_atr_max_pct': 0.09738949505663821, 'sideways_tp_mult': 2.9021083298576604, 'sideways_tsl_mult': 0.1384627714229381, 'sideways_time_stop': 54, 'sideways_use_sma': False, 'sideways_use_ema': True, 'sideways_use_atr': False, 'sideways_use_adx': True, 'sideways_use_spike': False, 'sideways_rsi_required': False}.
[I 2025-08-30 14:46:36,476] Trial 217 finished with values: [-0.01175093524000892, 0.01167473146550796] and parameters: {'p_sma': 52, 'p_std': 20, 'p_atr': 12, 'p_adx': 12, 'rsi_period': 15, 'ema1': 9, 'ema2': 15, 'slip_atr_k': 0.08329815312681521, 'slip_spread_k': 0.47614933267130877, 'spread_hl_frac': 0.03408335372919149, 'bb_std_mult': 3.598182272345529, 'rsi_os': 18, 'rsi_ob': 61, 'vol_spike': 0.08086880810209708, 'adx_thresh': 10.845322263369848, 'atr_min_pct': 0.006831003791323918, 'atr_max_pct': 0.029097185314931915, 'tp_mult': 2.0079772584479003, 'tsl_mult': 0.9015796769527031, 'strategy': 'mean_reversion', 'time_stop': 300, 'use_sma': True, 'use_atr': True, 'use_adx': True, 'use_ema': False, 'use_spike': True, 'rsi_required': False, 'edge_k': 1.7971852674622102, 'edge_cap': 0.5004203114412885, 'bull_strategy': 'breakout', 'bull_bb_std_mult': 1.8899988744433394, 'bull_rsi_os': 42, 'bull_rsi_ob': 70, 'bull_adx_thresh': 19.11981684832301, 'bull_atr_min_pct': 0.003083521765775277, 'bull_atr_max_pct': 0.13982866086660742, 'bull_tp_mult': 2.025979645391461, 'bull_tsl_mult': 0.3449433511028654, 'bull_time_stop': 294, 'bull_use_sma': False, 'bull_use_ema': False, 'bull_use_atr': True, 'bull_use_adx': True, 'bull_use_spike': False, 'bull_rsi_required': True, 'bear_strategy': 'mean_reversion', 'bear_bb_std_mult': 0.9350696613916638, 'bear_rsi_os': 19, 'bear_rsi_ob': 65, 'bear_adx_thresh': 24.087610634679756, 'bear_atr_min_pct': 0.011538062008613145, 'bear_atr_max_pct': 0.14207666982640446, 'bear_tp_mult': 2.988793097080448, 'bear_tsl_mult': 0.6662818888569424, 'bear_time_stop': 154, 'bear_use_sma': False, 'bear_use_ema': True, 'bear_use_atr': False, 'bear_use_adx': True, 'bear_use_spike': True, 'bear_rsi_required': False, 'sideways_strategy': 'mean_reversion', 'sideways_bb_std_mult': 2.0588091500058785, 'sideways_rsi_os': 12, 'sideways_rsi_ob': 68, 'sideways_adx_thresh': 16.32268823932936, 'sideways_atr_min_pct': 0.02338692808431528, 'sideways_atr_max_pct': 0.13774403512645153, 'sideways_tp_mult': 1.6847578646591788, 'sideways_tsl_mult': 0.15358655617901867, 'sideways_time_stop': 52, 'sideways_use_sma': False, 'sideways_use_ema': True, 'sideways_use_atr': False, 'sideways_use_adx': True, 'sideways_use_spike': False, 'sideways_rsi_required': False}.
[I 2025-08-30 14:46:39,214] Trial 218 finished with values: [-1000000000.0, 1000000000.0] and parameters: {'p_sma': 38, 'p_std': 26, 'p_atr': 12, 'p_adx': 9, 'rsi_period': 16, 'ema1': 17, 'ema2': 15, 'slip_atr_k': 0.2357727326870077, 'slip_spread_k': 0.5484816573308486, 'spread_hl_frac': 0.025934088469771115, 'bb_std_mult': 0.8772770014661537, 'rsi_os': 18, 'rsi_ob': 73, 'vol_spike': 0.095048092311869, 'adx_thresh': 27.389931408227284, 'atr_min_pct': 0.006710311969396497, 'atr_max_pct': 0.04196635407589046, 'tp_mult': 2.228510380765734, 'tsl_mult': 0.1180859333421843, 'strategy': 'mean_reversion', 'time_stop': 300, 'use_sma': True, 'use_atr': True, 'use_adx': True, 'use_ema': False, 'use_spike': True, 'rsi_required': False, 'edge_k': 1.7893785578375156, 'edge_cap': 0.46475481377023103, 'bull_strategy': 'breakout', 'bull_bb_std_mult': 2.6892888838248066, 'bull_rsi_os': 42, 'bull_rsi_ob': 81, 'bull_adx_thresh': 20.0740229812053, 'bull_atr_min_pct': 0.0032651322758272053, 'bull_atr_max_pct': 0.09235434159991968, 'bull_tp_mult': 2.0281672599250204, 'bull_tsl_mult': 0.8211972713774209, 'bull_time_stop': 292, 'bull_use_sma': False, 'bull_use_ema': False, 'bull_use_atr': True, 'bull_use_adx': True, 'bull_use_spike': False, 'bull_rsi_required': True, 'bear_strategy': 'mean_reversion', 'bear_bb_std_mult': 0.9159016603828255, 'bear_rsi_os': 19, 'bear_rsi_ob': 66, 'bear_adx_thresh': 27.971009065476405, 'bear_atr_min_pct': 0.0205424504265487, 'bear_atr_max_pct': 0.10577047467179057, 'bear_tp_mult': 2.249221570742744, 'bear_tsl_mult': 0.7292718939273337, 'bear_time_stop': 258, 'bear_use_sma': False, 'bear_use_ema': True, 'bear_use_atr': False, 'bear_use_adx': True, 'bear_use_spike': True, 'bear_rsi_required': False, 'sideways_strategy': 'mean_reversion', 'sideways_bb_std_mult': 2.073249703016401, 'sideways_rsi_os': 47, 'sideways_rsi_ob': 70, 'sideways_adx_thresh': 24.811905482231296, 'sideways_atr_min_pct': 0.023412553098488928, 'sideways_atr_max_pct': 0.012718558521236961, 'sideways_tp_mult': 2.5552287122232413, 'sideways_tsl_mult': 0.13590298343052643, 'sideways_time_stop': 73, 'sideways_use_sma': False, 'sideways_use_ema': True, 'sideways_use_atr': False, 'sideways_use_adx': True, 'sideways_use_spike': False, 'sideways_rsi_required': False}.
[I 2025-08-30 14:46:41,677] Trial 219 finished with values: [-1000000000.0, 1000000000.0] and parameters: {'p_sma': 42, 'p_std': 8, 'p_atr': 14, 'p_adx': 17, 'rsi_period': 18, 'ema1': 17, 'ema2': 31, 'slip_atr_k': 0.0842798302948886, 'slip_spread_k': 0.904001236417339, 'spread_hl_frac': 0.03877387298206632, 'bb_std_mult': 3.443090881247351, 'rsi_os': 19, 'rsi_ob': 52, 'vol_spike': 0.09581870932802793, 'adx_thresh': 34.99846133236763, 'atr_min_pct': 0.02492495299687252, 'atr_max_pct': 0.02841084487720902, 'tp_mult': 2.2168630546990182, 'tsl_mult': 0.12081454447811865, 'strategy': 'mean_reversion', 'time_stop': 93, 'use_sma': True, 'use_atr': True, 'use_adx': True, 'use_ema': False, 'use_spike': True, 'rsi_required': False, 'edge_k': 1.401539247977337, 'edge_cap': 0.46521478011442835, 'bull_strategy': 'breakout', 'bull_bb_std_mult': 2.6865571605398015, 'bull_rsi_os': 42, 'bull_rsi_ob': 79, 'bull_adx_thresh': 19.97544953493854, 'bull_atr_min_pct': 0.029443402416535903, 'bull_atr_max_pct': 0.1380566658825168, 'bull_tp_mult': 2.7391582963313184, 'bull_tsl_mult': 0.342365767279401, 'bull_time_stop': 100, 'bull_use_sma': False, 'bull_use_ema': False, 'bull_use_atr': True, 'bull_use_adx': True, 'bull_use_spike': False, 'bull_rsi_required': True, 'bear_strategy': 'mean_reversion', 'bear_bb_std_mult': 0.9313981007833119, 'bear_rsi_os': 19, 'bear_rsi_ob': 83, 'bear_adx_thresh': 24.21517441736677, 'bear_atr_min_pct': 0.011609481767892102, 'bear_atr_max_pct': 0.10477904377325904, 'bear_tp_mult': 2.6005218756819835, 'bear_tsl_mult': 0.9601463710621039, 'bear_time_stop': 124, 'bear_use_sma': False, 'bear_use_ema': True, 'bear_use_atr': False, 'bear_use_adx': True, 'bear_use_spike': True, 'bear_rsi_required': False, 'sideways_strategy': 'mean_reversion', 'sideways_bb_std_mult': 3.102457068902644, 'sideways_rsi_os': 46, 'sideways_rsi_ob': 70, 'sideways_adx_thresh': 16.513371336802397, 'sideways_atr_min_pct': 0.02149885856350341, 'sideways_atr_max_pct': 0.011619445758201752, 'sideways_tp_mult': 1.641113949733771, 'sideways_tsl_mult': 0.46200783076512353, 'sideways_time_stop': 169, 'sideways_use_sma': False, 'sideways_use_ema': True, 'sideways_use_atr': False, 'sideways_use_adx': True, 'sideways_use_spike': False, 'sideways_rsi_required': False}.
[I 2025-08-30 14:46:46,789] Trial 223 finished with values: [-1000000000.0, 1000000000.0] and parameters: {'p_sma': 8, 'p_std': 56, 'p_atr': 17, 'p_adx': 7, 'rsi_period': 68, 'ema1': 16, 'ema2': 11, 'slip_atr_k': 0.07807359847639578, 'slip_spread_k': 0.5295851308808199, 'spread_hl_frac': 0.04710837203244803, 'bb_std_mult': 1.388784753120449, 'rsi_os': 16, 'rsi_ob': 47, 'vol_spike': 0.07530401297166704, 'adx_thresh': 25.122505274694596, 'atr_min_pct': 0.028740377856351754, 'atr_max_pct': 0.02387493165053589, 'tp_mult': 1.1636195980676318, 'tsl_mult': 0.06273025226998952, 'strategy': 'breakout', 'time_stop': 290, 'use_sma': False, 'use_atr': True, 'use_adx': False, 'use_ema': True, 'use_spike': False, 'rsi_required': True, 'edge_k': 1.912128750831866, 'edge_cap': 0.400867172163123, 'bull_strategy': 'mean_reversion', 'bull_bb_std_mult': 2.2908353531290397, 'bull_rsi_os': 39, 'bull_rsi_ob': 79, 'bull_adx_thresh': 19.605795309308043, 'bull_atr_min_pct': 0.0025151249274240764, 'bull_atr_max_pct': 0.08458315690203728, 'bull_tp_mult': 1.3505045501067436, 'bull_tsl_mult': 0.30624217721369273, 'bull_time_stop': 187, 'bull_use_sma': False, 'bull_use_ema': False, 'bull_use_atr': False, 'bull_use_adx': True, 'bull_use_spike': False, 'bull_rsi_required': False, 'bear_strategy': 'breakout', 'bear_bb_std_mult': 3.2955607188071028, 'bear_rsi_os': 45, 'bear_rsi_ob': 49, 'bear_adx_thresh': 23.00170710624493, 'bear_atr_min_pct': 0.019705331845303122, 'bear_atr_max_pct': 0.14650664216830278, 'bear_tp_mult': 2.0898000553167266, 'bear_tsl_mult': 0.907949876463156, 'bear_time_stop': 134, 'bear_use_sma': True, 'bear_use_ema': True, 'bear_use_atr': True, 'bear_use_adx': False, 'bear_use_spike': False, 'bear_rsi_required': False, 'sideways_strategy': 'breakout', 'sideways_bb_std_mult': 1.9127602475872796, 'sideways_rsi_os': 44, 'sideways_rsi_ob': 66, 'sideways_adx_thresh': 26.399450348377833, 'sideways_atr_min_pct': 0.006058803252847515, 'sideways_atr_max_pct': 0.13703192380378384, 'sideways_tp_mult': 1.7931537673272797, 'sideways_tsl_mult': 0.1533389336825046, 'sideways_time_stop': 165, 'sideways_use_sma': False, 'sideways_use_ema': True, 'sideways_use_atr': False, 'sideways_use_adx': False, 'sideways_use_spike': False, 'sideways_rsi_required': False}.
[I 2025-08-30 14:46:55,476] Trial 220 finished with values: [-1000000000.0, 1000000000.0] and parameters: {'p_sma': 8, 'p_std': 5, 'p_atr': 17, 'p_adx': 12, 'rsi_period': 18, 'ema1': 17, 'ema2': 16, 'slip_atr_k': 0.08312947167957895, 'slip_spread_k': 0.5394027411925489, 'spread_hl_frac': 0.02593218796395938, 'bb_std_mult': 3.5832199361600408, 'rsi_os': 19, 'rsi_ob': 84, 'vol_spike': 0.09605587582584393, 'adx_thresh': 33.493036595302826, 'atr_min_pct': 0.017157820830465492, 'atr_max_pct': 0.02415945478713758, 'tp_mult': 2.228596974804512, 'tsl_mult': 0.06461092299341768, 'strategy': 'mean_reversion', 'time_stop': 290, 'use_sma': False, 'use_atr': True, 'use_adx': True, 'use_ema': True, 'use_spike': True, 'rsi_required': False, 'edge_k': 0.4311180356272034, 'edge_cap': 0.4617120567942136, 'bull_strategy': 'breakout', 'bull_bb_std_mult': 2.3174614672585583, 'bull_rsi_os': 42, 'bull_rsi_ob': 79, 'bull_adx_thresh': 19.55215678844574, 'bull_atr_min_pct': 0.003184950420240435, 'bull_atr_max_pct': 0.11290145790065814, 'bull_tp_mult': 1.3699361233172376, 'bull_tsl_mult': 0.3407685098325501, 'bull_time_stop': 292, 'bull_use_sma': False, 'bull_use_ema': False, 'bull_use_atr': True, 'bull_use_adx': True, 'bull_use_spike': False, 'bull_rsi_required': True, 'bear_strategy': 'mean_reversion', 'bear_bb_std_mult': 0.9352953843460643, 'bear_rsi_os': 50, 'bear_rsi_ob': 66, 'bear_adx_thresh': 30.911204249935533, 'bear_atr_min_pct': 0.008621553772368359, 'bear_atr_max_pct': 0.1473264042411637, 'bear_tp_mult': 1.6165916973144174, 'bear_tsl_mult': 0.23502757420844733, 'bear_time_stop': 134, 'bear_use_sma': True, 'bear_use_ema': True, 'bear_use_atr': True, 'bear_use_adx': True, 'bear_use_spike': True, 'bear_rsi_required': False, 'sideways_strategy': 'breakout', 'sideways_bb_std_mult': 1.9085930742891424, 'sideways_rsi_os': 22, 'sideways_rsi_ob': 70, 'sideways_adx_thresh': 16.33901768527482, 'sideways_atr_min_pct': 0.021410742853962085, 'sideways_atr_max_pct': 0.012941830920620592, 'sideways_tp_mult': 2.9390182460677297, 'sideways_tsl_mult': 0.07538751363100923, 'sideways_time_stop': 170, 'sideways_use_sma': False, 'sideways_use_ema': True, 'sideways_use_atr': False, 'sideways_use_adx': True, 'sideways_use_spike': False, 'sideways_rsi_required': False}.
[I 2025-08-30 14:47:04,966] Trial 221 finished with values: [-1000000000.0, 1000000000.0] and parameters: {'p_sma': 8, 'p_std': 43, 'p_atr': 17, 'p_adx': 10, 'rsi_period': 18, 'ema1': 14, 'ema2': 32, 'slip_atr_k': 0.0836150786524353, 'slip_spread_k': 0.5475773516863961, 'spread_hl_frac': 0.009038679773550839, 'bb_std_mult': 3.4523404108984934, 'rsi_os': 19, 'rsi_ob': 84, 'vol_spike': 0.08535160611008866, 'adx_thresh': 27.47136796612427, 'atr_min_pct': 0.015338612193242071, 'atr_max_pct': 0.13897026100939544, 'tp_mult': 2.2146519685044086, 'tsl_mult': 0.15530154122772277, 'strategy': 'mean_reversion', 'time_stop': 291, 'use_sma': False, 'use_atr': True, 'use_adx': True, 'use_ema': True, 'use_spike': True, 'rsi_required': False, 'edge_k': 1.9022998533974111, 'edge_cap': 0.4012008906729281, 'bull_strategy': 'breakout', 'bull_bb_std_mult': 2.6624165170050693, 'bull_rsi_os': 42, 'bull_rsi_ob': 79, 'bull_adx_thresh': 20.08830290194759, 'bull_atr_min_pct': 0.003147923626852324, 'bull_atr_max_pct': 0.02060341117356073, 'bull_tp_mult': 1.3593952152403563, 'bull_tsl_mult': 0.30641864779827677, 'bull_time_stop': 100, 'bull_use_sma': False, 'bull_use_ema': False, 'bull_use_atr': True, 'bull_use_adx': True, 'bull_use_spike': False, 'bull_rsi_required': True, 'bear_strategy': 'mean_reversion', 'bear_bb_std_mult': 0.9004819852316874, 'bear_rsi_os': 13, 'bear_rsi_ob': 66, 'bear_adx_thresh': 7.851923736043757, 'bear_atr_min_pct': 0.026662480791972854, 'bear_atr_max_pct': 0.14723474181523633, 'bear_tp_mult': 1.4196988825143184, 'bear_tsl_mult': 0.7290629774928018, 'bear_time_stop': 132, 'bear_use_sma': True, 'bear_use_ema': True, 'bear_use_atr': True, 'bear_use_adx': True, 'bear_use_spike': True, 'bear_rsi_required': False, 'sideways_strategy': 'breakout', 'sideways_bb_std_mult': 2.6981140515246844, 'sideways_rsi_os': 45, 'sideways_rsi_ob': 66, 'sideways_adx_thresh': 24.671934981473314, 'sideways_atr_min_pct': 0.005874965566138993, 'sideways_atr_max_pct': 0.011889997294250823, 'sideways_tp_mult': 1.7179746193694998, 'sideways_tsl_mult': 0.15980093937055057, 'sideways_time_stop': 159, 'sideways_use_sma': False, 'sideways_use_ema': True, 'sideways_use_atr': False, 'sideways_use_adx': True, 'sideways_use_spike': False, 'sideways_rsi_required': False}.
[I 2025-08-30 14:47:09,280] Trial 222 finished with values: [-0.01183385425829342, 0.01178652269710032] and parameters: {'p_sma': 41, 'p_std': 5, 'p_atr': 17, 'p_adx': 10, 'rsi_period': 18, 'ema1': 14, 'ema2': 32, 'slip_atr_k': 0.08376592441317275, 'slip_spread_k': 0.5279080920928593, 'spread_hl_frac': 0.04673276551229455, 'bb_std_mult': 1.4228923216667153, 'rsi_os': 20, 'rsi_ob': 56, 'vol_spike': 0.08470726491490083, 'adx_thresh': 24.90455273615575, 'atr_min_pct': 0.029480029456490794, 'atr_max_pct': 0.08711327214239536, 'tp_mult': 2.1217854279135104, 'tsl_mult': 0.059264954627365314, 'strategy': 'mean_reversion', 'time_stop': 291, 'use_sma': False, 'use_atr': True, 'use_adx': True, 'use_ema': True, 'use_spike': True, 'rsi_required': True, 'edge_k': 1.9022914412423837, 'edge_cap': 0.4060265802479732, 'bull_strategy': 'mean_reversion', 'bull_bb_std_mult': 2.2703392975089987, 'bull_rsi_os': 5, 'bull_rsi_ob': 79, 'bull_adx_thresh': 20.0386290759354, 'bull_atr_min_pct': 0.0028868301187798383, 'bull_atr_max_pct': 0.019771707764309133, 'bull_tp_mult': 1.3430549484628405, 'bull_tsl_mult': 0.30499506025773176, 'bull_time_stop': 157, 'bull_use_sma': False, 'bull_use_ema': False, 'bull_use_atr': False, 'bull_use_adx': True, 'bull_use_spike': False, 'bull_rsi_required': True, 'bear_strategy': 'breakout', 'bear_bb_std_mult': 3.451469976661746, 'bear_rsi_os': 13, 'bear_rsi_ob': 49, 'bear_adx_thresh': 7.716006270651672, 'bear_atr_min_pct': 0.02208812291691241, 'bear_atr_max_pct': 0.147348972606791, 'bear_tp_mult': 2.075928470415413, 'bear_tsl_mult': 0.5236709113330916, 'bear_time_stop': 133, 'bear_use_sma': True, 'bear_use_ema': True, 'bear_use_atr': True, 'bear_use_adx': True, 'bear_use_spike': False, 'bear_rsi_required': False, 'sideways_strategy': 'breakout', 'sideways_bb_std_mult': 3.115168172166782, 'sideways_rsi_os': 22, 'sideways_rsi_ob': 66, 'sideways_adx_thresh': 32.97251317788522, 'sideways_atr_min_pct': 0.006392914927520952, 'sideways_atr_max_pct': 0.10879255352595152, 'sideways_tp_mult': 1.7947920866906277, 'sideways_tsl_mult': 0.0757432219457305, 'sideways_time_stop': 87, 'sideways_use_sma': False, 'sideways_use_ema': True, 'sideways_use_atr': False, 'sideways_use_adx': False, 'sideways_use_spike': False, 'sideways_rsi_required': False}.
[I 2025-08-30 14:47:19,851] Trial 224 finished with values: [-0.009911495030474393, 0.009984905939866725] and parameters: {'p_sma': 41, 'p_std': 5, 'p_atr': 20, 'p_adx': 8, 'rsi_period': 22, 'ema1': 15, 'ema2': 45, 'slip_atr_k': 0.0830332208638453, 'slip_spread_k': 0.10909098994768923, 'spread_hl_frac': 0.009636090913779767, 'bb_std_mult': 3.592080711708179, 'rsi_os': 17, 'rsi_ob': 84, 'vol_spike': 0.08686722423948326, 'adx_thresh': 19.442885128051294, 'atr_min_pct': 0.0033707939799463137, 'atr_max_pct': 0.06926917823941083, 'tp_mult': 2.1245262292443954, 'tsl_mult': 0.617837028945341, 'strategy': 'mean_reversion', 'time_stop': 228, 'use_sma': True, 'use_atr': True, 'use_adx': False, 'use_ema': True, 'use_spike': True, 'rsi_required': True, 'edge_k': 1.8122266973693844, 'edge_cap': 0.4834531678410638, 'bull_strategy': 'mean_reversion', 'bull_bb_std_mult': 2.817810119010068, 'bull_rsi_os': 42, 'bull_rsi_ob': 54, 'bull_adx_thresh': 20.90823107844764, 'bull_atr_min_pct': 0.002981592415781064, 'bull_atr_max_pct': 0.0271868226003028, 'bull_tp_mult': 1.3015813319614293, 'bull_tsl_mult': 0.8562207162335453, 'bull_time_stop': 155, 'bull_use_sma': False, 'bull_use_ema': False, 'bull_use_atr': False, 'bull_use_adx': True, 'bull_use_spike': False, 'bull_rsi_required': False, 'bear_strategy': 'breakout', 'bear_bb_std_mult': 3.467964421691846, 'bear_rsi_os': 39, 'bear_rsi_ob': 89, 'bear_adx_thresh': 5.126094231734692, 'bear_atr_min_pct': 0.026586774187016944, 'bear_atr_max_pct': 0.14780802100782026, 'bear_tp_mult': 2.7216027216010232, 'bear_tsl_mult': 0.5219108096365362, 'bear_time_stop': 291, 'bear_use_sma': False, 'bear_use_ema': True, 'bear_use_atr': False, 'bear_use_adx': False, 'bear_use_spike': False, 'bear_rsi_required': False, 'sideways_strategy': 'breakout', 'sideways_bb_std_mult': 1.051271846129666, 'sideways_rsi_os': 46, 'sideways_rsi_ob': 66, 'sideways_adx_thresh': 25.344244262210154, 'sideways_atr_min_pct': 0.022152506161857603, 'sideways_atr_max_pct': 0.01472233059009243, 'sideways_tp_mult': 2.940217358696805, 'sideways_tsl_mult': 0.8100979853599898, 'sideways_time_stop': 123, 'sideways_use_sma': False, 'sideways_use_ema': True, 'sideways_use_atr': False, 'sideways_use_adx': False, 'sideways_use_spike': False, 'sideways_rsi_required': False}.
