[I 2025-08-30 14:39:15,167] Trial 156 finished with values: [-1000000000.0, 1000000000.0] and parameters: {'p_sma': 39, 'p_std': 8, 'p_atr': 17, 'p_adx': 8, 'rsi_period': 27, 'ema1': 29, 'ema2': 24, 'slip_atr_k': 0.0948452693082833, 'slip_spread_k': 0.4651537548962172, 'spread_hl_frac': 0.032758423329867115, 'bb_std_mult': 3.138877789434849, 'rsi_os': 52, 'rsi_ob': 71, 'vol_spike': 0.10068243987450985, 'adx_thresh': 8.342939491942793, 'atr_min_pct': 0.02929941756551046, 'atr_max_pct': 0.10351068079577017, 'tp_mult': 1.865666069046148, 'tsl_mult': 0.08727089618268556, 'strategy': 'mean_reversion', 'time_stop': 300, 'use_sma': True, 'use_atr': True, 'use_adx': False, 'use_ema': False, 'use_spike': True, 'rsi_required': True, 'edge_k': 1.7591027873679665, 'edge_cap': 0.8492654380430735, 'bull_strategy': 'mean_reversion', 'bull_bb_std_mult': 0.6237964810722644, 'bull_rsi_os': 47, 'bull_rsi_ob': 80, 'bull_adx_thresh': 21.064461761504123, 'bull_atr_min_pct': 0.0027374949568834545, 'bull_atr_max_pct': 0.11561865678373454, 'bull_tp_mult': 1.317746815871943, 'bull_tsl_mult': 0.36619530251956567, 'bull_time_stop': 85, 'bull_use_sma': True, 'bull_use_ema': False, 'bull_use_atr': False, 'bull_use_adx': True, 'bull_use_spike': False, 'bull_rsi_required': False, 'bear_strategy': 'breakout', 'bear_bb_std_mult': 1.9906752879548697, 'bear_rsi_os': 55, 'bear_rsi_ob': 81, 'bear_adx_thresh': 32.63043945097168, 'bear_atr_min_pct': 0.0020466352453172958, 'bear_atr_max_pct': 0.05116419987714088, 'bear_tp_mult': 1.8735550803140675, 'bear_tsl_mult': 0.7225592829133204, 'bear_time_stop': 148, 'bear_use_sma': False, 'bear_use_ema': True, 'bear_use_atr': False, 'bear_use_adx': False, 'bear_use_spike': False, 'bear_rsi_required': False, 'sideways_strategy': 'breakout', 'sideways_bb_std_mult': 1.7895094156442353, 'sideways_rsi_os': 48, 'sideways_rsi_ob': 53, 'sideways_adx_thresh': 25.472596878009707, 'sideways_atr_min_pct': 0.0029253315755485825, 'sideways_atr_max_pct': 0.010048444813620189, 'sideways_tp_mult': 2.3283600258288892, 'sideways_tsl_mult': 0.14395175670876412, 'sideways_time_stop': 187, 'sideways_use_sma': False, 'sideways_use_ema': True, 'sideways_use_atr': False, 'sideways_use_adx': False, 'sideways_use_spike': False, 'sideways_rsi_required': False}.
[I 2025-08-30 14:39:44,612] Trial 153 finished with values: [-0.030994259354533815, 0.030964155320922355] and parameters: {'p_sma': 28, 'p_std': 5, 'p_atr': 14, 'p_adx': 8, 'rsi_period': 44, 'ema1': 30, 'ema2': 30, 'slip_atr_k': 0.21557532014412434, 'slip_spread_k': 0.528658381661325, 'spread_hl_frac': 0.04982825930902205, 'bb_std_mult': 2.4093191318119103, 'rsi_os': 14, 'rsi_ob': 63, 'vol_spike': 0.05074023751812591, 'adx_thresh': 28.361346738297303, 'atr_min_pct': 0.011600905479615082, 'atr_max_pct': 0.03778985157715348, 'tp_mult': 2.6398543712027633, 'tsl_mult': 0.08915555524216161, 'strategy': 'mean_reversion', 'time_stop': 153, 'use_sma': True, 'use_atr': True, 'use_adx': False, 'use_ema': False, 'use_spike': True, 'rsi_required': True, 'edge_k': 1.768282348597421, 'edge_cap': 0.7586810778332792, 'bull_strategy': 'mean_reversion', 'bull_bb_std_mult': 0.6172860891602368, 'bull_rsi_os': 6, 'bull_rsi_ob': 59, 'bull_adx_thresh': 14.361959631767093, 'bull_atr_min_pct': 0.0021759971447695573, 'bull_atr_max_pct': 0.14144319166491248, 'bull_tp_mult': 1.319958523476714, 'bull_tsl_mult': 0.30047926133437025, 'bull_time_stop': 93, 'bull_use_sma': False, 'bull_use_ema': False, 'bull_use_atr': True, 'bull_use_adx': True, 'bull_use_spike': True, 'bull_rsi_required': False, 'bear_strategy': 'breakout', 'bear_bb_std_mult': 1.0496038547756381, 'bear_rsi_os': 22, 'bear_rsi_ob': 65, 'bear_adx_thresh': 12.478595265780164, 'bear_atr_min_pct': 0.017216464930653527, 'bear_atr_max_pct': 0.13907226786319887, 'bear_tp_mult': 1.8559331574186981, 'bear_tsl_mult': 0.9052714867963265, 'bear_time_stop': 147, 'bear_use_sma': False, 'bear_use_ema': True, 'bear_use_atr': False, 'bear_use_adx': False, 'bear_use_spike': False, 'bear_rsi_required': True, 'sideways_strategy': 'breakout', 'sideways_bb_std_mult': 1.5081404113063706, 'sideways_rsi_os': 42, 'sideways_rsi_ob': 70, 'sideways_adx_thresh': 11.527531742626756, 'sideways_atr_min_pct': 0.0026296361955216903, 'sideways_atr_max_pct': 0.01703952360960239, 'sideways_tp_mult': 1.2740404407059596, 'sideways_tsl_mult': 0.30345048461430346, 'sideways_time_stop': 153, 'sideways_use_sma': False, 'sideways_use_ema': True, 'sideways_use_atr': False, 'sideways_use_adx': True, 'sideways_use_spike': False, 'sideways_rsi_required': True}.
[I 2025-08-30 14:39:45,047] Trial 154 finished with values: [-0.029976161400615098, 0.029896981891292803] and parameters: {'p_sma': 39, 'p_std': 8, 'p_atr': 16, 'p_adx': 28, 'rsi_period': 20, 'ema1': 16, 'ema2': 23, 'slip_atr_k': 0.2168085079228052, 'slip_spread_k': 0.5242361136570419, 'spread_hl_frac': 0.04939903326315699, 'bb_std_mult': 3.180380471155222, 'rsi_os': 14, 'rsi_ob': 71, 'vol_spike': 0.05186631216941005, 'adx_thresh': 10.491399684957877, 'atr_min_pct': 0.02922919251187992, 'atr_max_pct': 0.13315070630841658, 'tp_mult': 2.6502599676238887, 'tsl_mult': 0.09620848714682433, 'strategy': 'mean_reversion', 'time_stop': 299, 'use_sma': True, 'use_atr': True, 'use_adx': False, 'use_ema': False, 'use_spike': True, 'rsi_required': True, 'edge_k': 1.867816877990973, 'edge_cap': 0.5582409170461856, 'bull_strategy': 'mean_reversion', 'bull_bb_std_mult': 0.6202385413239864, 'bull_rsi_os': 47, 'bull_rsi_ob': 93, 'bull_adx_thresh': 20.776774907010402, 'bull_atr_min_pct': 0.0026538513441748354, 'bull_atr_max_pct': 0.028027582385107372, 'bull_tp_mult': 1.2743805359650213, 'bull_tsl_mult': 0.36139660057436707, 'bull_time_stop': 89, 'bull_use_sma': True, 'bull_use_ema': False, 'bull_use_atr': False, 'bull_use_adx': True, 'bull_use_spike': False, 'bull_rsi_required': False, 'bear_strategy': 'breakout', 'bear_bb_std_mult': 3.176729441652933, 'bear_rsi_os': 18, 'bear_rsi_ob': 65, 'bear_adx_thresh': 32.58987964980594, 'bear_atr_min_pct': 0.014065315717629232, 'bear_atr_max_pct': 0.07591338656519576, 'bear_tp_mult': 1.735482089138796, 'bear_tsl_mult': 0.718546265404246, 'bear_time_stop': 108, 'bear_use_sma': False, 'bear_use_ema': True, 'bear_use_atr': False, 'bear_use_adx': False, 'bear_use_spike': False, 'bear_rsi_required': True, 'sideways_strategy': 'breakout', 'sideways_bb_std_mult': 1.8435447763999468, 'sideways_rsi_os': 48, 'sideways_rsi_ob': 60, 'sideways_adx_thresh': 25.67928315623978, 'sideways_atr_min_pct': 0.002623949351464098, 'sideways_atr_max_pct': 0.015901003655594246, 'sideways_tp_mult': 2.338409514097823, 'sideways_tsl_mult': 0.15212645391281282, 'sideways_time_stop': 187, 'sideways_use_sma': False, 'sideways_use_ema': True, 'sideways_use_atr': False, 'sideways_use_adx': False, 'sideways_use_spike': False, 'sideways_rsi_required': True}.
[I 2025-08-30 14:39:45,242] Trial 155 finished with values: [-1000000000.0, 1000000000.0] and parameters: {'p_sma': 39, 'p_std': 8, 'p_atr': 17, 'p_adx': 28, 'rsi_period': 26, 'ema1': 16, 'ema2': 30, 'slip_atr_k': 0.21562798947567036, 'slip_spread_k': 0.43333945787803296, 'spread_hl_frac': 0.027043904120747163, 'bb_std_mult': 2.2977074223403613, 'rsi_os': 40, 'rsi_ob': 92, 'vol_spike': 0.05296834591898427, 'adx_thresh': 25.63572794381831, 'atr_min_pct': 0.02919571851407927, 'atr_max_pct': 0.037507116977166646, 'tp_mult': 1.5408020561779705, 'tsl_mult': 0.09701284842508712, 'strategy': 'mean_reversion', 'time_stop': 300, 'use_sma': True, 'use_atr': True, 'use_adx': False, 'use_ema': False, 'use_spike': True, 'rsi_required': True, 'edge_k': 1.7661606728809085, 'edge_cap': 0.5853745941424915, 'bull_strategy': 'mean_reversion', 'bull_bb_std_mult': 0.6222138467372691, 'bull_rsi_os': 47, 'bull_rsi_ob': 80, 'bull_adx_thresh': 20.406103765016965, 'bull_atr_min_pct': 0.009008146321179439, 'bull_atr_max_pct': 0.11654437371977326, 'bull_tp_mult': 1.3353904342291403, 'bull_tsl_mult': 0.3759219497776221, 'bull_time_stop': 86, 'bull_use_sma': True, 'bull_use_ema': False, 'bull_use_atr': False, 'bull_use_adx': True, 'bull_use_spike': True, 'bull_rsi_required': False, 'bear_strategy': 'breakout', 'bear_bb_std_mult': 0.864854474390045, 'bear_rsi_os': 55, 'bear_rsi_ob': 68, 'bear_adx_thresh': 32.70571084065593, 'bear_atr_min_pct': 0.0022655155455193164, 'bear_atr_max_pct': 0.10253537899301349, 'bear_tp_mult': 1.8572899853589124, 'bear_tsl_mult': 0.7207038341655089, 'bear_time_stop': 146, 'bear_use_sma': False, 'bear_use_ema': True, 'bear_use_atr': False, 'bear_use_adx': False, 'bear_use_spike': False, 'bear_rsi_required': True, 'sideways_strategy': 'breakout', 'sideways_bb_std_mult': 1.7674725800534878, 'sideways_rsi_os': 48, 'sideways_rsi_ob': 60, 'sideways_adx_thresh': 25.17847299821751, 'sideways_atr_min_pct': 0.011681535043728306, 'sideways_atr_max_pct': 0.010102777624884485, 'sideways_tp_mult': 2.827040274908578, 'sideways_tsl_mult': 0.14842519281807703, 'sideways_time_stop': 252, 'sideways_use_sma': False, 'sideways_use_ema': True, 'sideways_use_atr': False, 'sideways_use_adx': False, 'sideways_use_spike': False, 'sideways_rsi_required': True}.
[I 2025-08-30 14:39:45,931] Trial 157 finished with values: [-0.013200919673065803, 0.013178638096719283] and parameters: {'p_sma': 40, 'p_std': 46, 'p_atr': 16, 'p_adx': 27, 'rsi_period': 19, 'ema1': 19, 'ema2': 32, 'slip_atr_k': 0.24733270096355967, 'slip_spread_k': 0.5273157723986154, 'spread_hl_frac': 0.04822552510416288, 'bb_std_mult': 2.3028193301405313, 'rsi_os': 40, 'rsi_ob': 71, 'vol_spike': 0.16164363431207732, 'adx_thresh': 13.172541217196471, 'atr_min_pct': 0.029288180437797098, 'atr_max_pct': 0.037313390802224185, 'tp_mult': 2.4153855988079984, 'tsl_mult': 0.8577062395786853, 'strategy': 'mean_reversion', 'time_stop': 169, 'use_sma': True, 'use_atr': True, 'use_adx': False, 'use_ema': False, 'use_spike': True, 'rsi_required': True, 'edge_k': 1.131655260579122, 'edge_cap': 0.32765024366263895, 'bull_strategy': 'mean_reversion', 'bull_bb_std_mult': 0.5036170943138373, 'bull_rsi_os': 40, 'bull_rsi_ob': 81, 'bull_adx_thresh': 13.984707006273414, 'bull_atr_min_pct': 0.0020677482241225824, 'bull_atr_max_pct': 0.056128179988958554, 'bull_tp_mult': 1.367314262446987, 'bull_tsl_mult': 0.6662347732486963, 'bull_time_stop': 92, 'bull_use_sma': True, 'bull_use_ema': False, 'bull_use_atr': False, 'bull_use_adx': True, 'bull_use_spike': True, 'bull_rsi_required': False, 'bear_strategy': 'breakout', 'bear_bb_std_mult': 3.2474303174911947, 'bear_rsi_os': 18, 'bear_rsi_ob': 47, 'bear_adx_thresh': 22.07777949977766, 'bear_atr_min_pct': 0.017617852921133544, 'bear_atr_max_pct': 0.14733725123047836, 'bear_tp_mult': 2.0597599109947713, 'bear_tsl_mult': 0.9940871681972857, 'bear_time_stop': 36, 'bear_use_sma': False, 'bear_use_ema': True, 'bear_use_atr': False, 'bear_use_adx': False, 'bear_use_spike': False, 'bear_rsi_required': True, 'sideways_strategy': 'breakout', 'sideways_bb_std_mult': 1.46405080079119, 'sideways_rsi_os': 46, 'sideways_rsi_ob': 60, 'sideways_adx_thresh': 26.045804296355673, 'sideways_atr_min_pct': 0.026338879128610423, 'sideways_atr_max_pct': 0.025575953194941912, 'sideways_tp_mult': 1.2669739844153896, 'sideways_tsl_mult': 0.16200018850330627, 'sideways_time_stop': 181, 'sideways_use_sma': False, 'sideways_use_ema': True, 'sideways_use_atr': False, 'sideways_use_adx': False, 'sideways_use_spike': False, 'sideways_rsi_required': True}.
[I 2025-08-30 14:40:17,406] Trial 159 finished with values: [-1000000000.0, 1000000000.0] and parameters: {'p_sma': 38, 'p_std': 7, 'p_atr': 13, 'p_adx': 7, 'rsi_period': 27, 'ema1': 19, 'ema2': 32, 'slip_atr_k': 0.0830544423141461, 'slip_spread_k': 0.4364712383574195, 'spread_hl_frac': 0.0478037665519963, 'bb_std_mult': 2.2532834852476493, 'rsi_os': 18, 'rsi_ob': 92, 'vol_spike': 0.1409648284138825, 'adx_thresh': 14.976826951413488, 'atr_min_pct': 0.028081378687643883, 'atr_max_pct': 0.1091597221808151, 'tp_mult': 2.207329648689451, 'tsl_mult': 0.10784664930721062, 'strategy': 'mean_reversion', 'time_stop': 59, 'use_sma': True, 'use_atr': True, 'use_adx': False, 'use_ema': True, 'use_spike': True, 'rsi_required': True, 'edge_k': 0.974069990684999, 'edge_cap': 0.6556984671865148, 'bull_strategy': 'mean_reversion', 'bull_bb_std_mult': 3.509806619844305, 'bull_rsi_os': 40, 'bull_rsi_ob': 81, 'bull_adx_thresh': 25.69325144991965, 'bull_atr_min_pct': 0.011418456880292562, 'bull_atr_max_pct': 0.14858867588556113, 'bull_tp_mult': 1.1900844205797827, 'bull_tsl_mult': 0.2039710676455903, 'bull_time_stop': 275, 'bull_use_sma': False, 'bull_use_ema': False, 'bull_use_atr': False, 'bull_use_adx': True, 'bull_use_spike': False, 'bull_rsi_required': False, 'bear_strategy': 'breakout', 'bear_bb_std_mult': 0.876705594640664, 'bear_rsi_os': 30, 'bear_rsi_ob': 70, 'bear_adx_thresh': 25.20399145127493, 'bear_atr_min_pct': 0.012300704705186431, 'bear_atr_max_pct': 0.14656678279852123, 'bear_tp_mult': 2.0472555572263187, 'bear_tsl_mult': 0.4142400124005437, 'bear_time_stop': 136, 'bear_use_sma': False, 'bear_use_ema': False, 'bear_use_atr': False, 'bear_use_adx': True, 'bear_use_spike': False, 'bear_rsi_required': False, 'sideways_strategy': 'breakout', 'sideways_bb_std_mult': 2.0987745111574885, 'sideways_rsi_os': 16, 'sideways_rsi_ob': 89, 'sideways_adx_thresh': 24.8029501253682, 'sideways_atr_min_pct': 0.009870907756491812, 'sideways_atr_max_pct': 0.060070847096797726, 'sideways_tp_mult': 2.5046549118049617, 'sideways_tsl_mult': 0.1053438989765644, 'sideways_time_stop': 178, 'sideways_use_sma': False, 'sideways_use_ema': True, 'sideways_use_atr': False, 'sideways_use_adx': False, 'sideways_use_spike': False, 'sideways_rsi_required': False}.
[I 2025-08-30 14:40:17,604] Trial 160 finished with values: [-1000000000.0, 1000000000.0] and parameters: {'p_sma': 41, 'p_std': 31, 'p_atr': 14, 'p_adx': 18, 'rsi_period': 12, 'ema1': 19, 'ema2': 32, 'slip_atr_k': 0.0831439403932009, 'slip_spread_k': 0.6336217804627149, 'spread_hl_frac': 0.04767947155154171, 'bb_std_mult': 2.346950931335676, 'rsi_os': 20, 'rsi_ob': 67, 'vol_spike': 0.025169185993451942, 'adx_thresh': 5.564242428370809, 'atr_min_pct': 0.004619038432221863, 'atr_max_pct': 0.04315433762824625, 'tp_mult': 2.8236617870677456, 'tsl_mult': 0.17596272469804225, 'strategy': 'mean_reversion', 'time_stop': 270, 'use_sma': True, 'use_atr': True, 'use_adx': False, 'use_ema': True, 'use_spike': True, 'rsi_required': True, 'edge_k': 1.9873921906310874, 'edge_cap': 0.4461570319166485, 'bull_strategy': 'mean_reversion', 'bull_bb_std_mult': 1.5007952506692797, 'bull_rsi_os': 34, 'bull_rsi_ob': 78, 'bull_adx_thresh': 19.26015634628336, 'bull_atr_min_pct': 0.01583871387830292, 'bull_atr_max_pct': 0.11080138313578436, 'bull_tp_mult': 1.3708369395102733, 'bull_tsl_mult': 0.20598794602981196, 'bull_time_stop': 285, 'bull_use_sma': False, 'bull_use_ema': False, 'bull_use_atr': False, 'bull_use_adx': True, 'bull_use_spike': False, 'bull_rsi_required': False, 'bear_strategy': 'breakout', 'bear_bb_std_mult': 1.30636726213061, 'bear_rsi_os': 18, 'bear_rsi_ob': 70, 'bear_adx_thresh': 23.584108444798712, 'bear_atr_min_pct': 0.012298318342894726, 'bear_atr_max_pct': 0.08267514907567015, 'bear_tp_mult': 2.0487229390548345, 'bear_tsl_mult': 0.9664668308390306, 'bear_time_stop': 96, 'bear_use_sma': False, 'bear_use_ema': False, 'bear_use_atr': False, 'bear_use_adx': True, 'bear_use_spike': False, 'bear_rsi_required': False, 'sideways_strategy': 'breakout', 'sideways_bb_std_mult': 2.078870559614226, 'sideways_rsi_os': 45, 'sideways_rsi_ob': 50, 'sideways_adx_thresh': 24.098828034564228, 'sideways_atr_min_pct': 0.01824415730107323, 'sideways_atr_max_pct': 0.06366340361130761, 'sideways_tp_mult': 2.8730660625392304, 'sideways_tsl_mult': 0.09972727629411167, 'sideways_time_stop': 65, 'sideways_use_sma': False, 'sideways_use_ema': True, 'sideways_use_atr': False, 'sideways_use_adx': False, 'sideways_use_spike': False, 'sideways_rsi_required': False}.
[I 2025-08-30 14:40:17,774] Trial 158 finished with values: [-1000000000.0, 1000000000.0] and parameters: {'p_sma': 38, 'p_std': 11, 'p_atr': 16, 'p_adx': 28, 'rsi_period': 20, 'ema1': 19, 'ema2': 54, 'slip_atr_k': 0.08354017132817305, 'slip_spread_k': 0.47588777973556623, 'spread_hl_frac': 0.036372746162027174, 'bb_std_mult': 2.277897141702938, 'rsi_os': 20, 'rsi_ob': 92, 'vol_spike': 0.06140632994986418, 'adx_thresh': 18.310541481968254, 'atr_min_pct': 0.02904936258990764, 'atr_max_pct': 0.12104822277525666, 'tp_mult': 2.107415323913837, 'tsl_mult': 0.67236337434033, 'strategy': 'mean_reversion', 'time_stop': 93, 'use_sma': True, 'use_atr': True, 'use_adx': False, 'use_ema': True, 'use_spike': True, 'rsi_required': True, 'edge_k': 0.09545152401304624, 'edge_cap': 0.5555796966822828, 'bull_strategy': 'mean_reversion', 'bull_bb_std_mult': 2.8821976775492493, 'bull_rsi_os': 40, 'bull_rsi_ob': 81, 'bull_adx_thresh': 25.788409450960753, 'bull_atr_min_pct': 0.01446949217183897, 'bull_atr_max_pct': 0.028208125419318074, 'bull_tp_mult': 1.3743559965387389, 'bull_tsl_mult': 0.04691573203375038, 'bull_time_stop': 87, 'bull_use_sma': True, 'bull_use_ema': False, 'bull_use_atr': False, 'bull_use_adx': True, 'bull_use_spike': False, 'bull_rsi_required': False, 'bear_strategy': 'breakout', 'bear_bb_std_mult': 0.8902107955430283, 'bear_rsi_os': 18, 'bear_rsi_ob': 68, 'bear_adx_thresh': 25.118932919164326, 'bear_atr_min_pct': 0.01417517450166637, 'bear_atr_max_pct': 0.024388175409624874, 'bear_tp_mult': 1.7369768062198685, 'bear_tsl_mult': 0.7803276013598667, 'bear_time_stop': 33, 'bear_use_sma': False, 'bear_use_ema': True, 'bear_use_atr': False, 'bear_use_adx': False, 'bear_use_spike': False, 'bear_rsi_required': False, 'sideways_strategy': 'breakout', 'sideways_bb_std_mult': 2.090172992223044, 'sideways_rsi_os': 46, 'sideways_rsi_ob': 62, 'sideways_adx_thresh': 26.02962701391818, 'sideways_atr_min_pct': 0.026095212767222445, 'sideways_atr_max_pct': 0.03313227001921929, 'sideways_tp_mult': 2.825169149024329, 'sideways_tsl_mult': 0.16851164330330654, 'sideways_time_stop': 66, 'sideways_use_sma': False, 'sideways_use_ema': True, 'sideways_use_atr': False, 'sideways_use_adx': False, 'sideways_use_spike': False, 'sideways_rsi_required': False}.
[I 2025-08-30 14:40:17,851] Trial 161 finished with values: [-1000000000.0, 1000000000.0] and parameters: {'p_sma': 41, 'p_std': 54, 'p_atr': 14, 'p_adx': 27, 'rsi_period': 19, 'ema1': 17, 'ema2': 33, 'slip_atr_k': 0.07517746353594722, 'slip_spread_k': 0.6310066521586386, 'spread_hl_frac': 0.03643432470378249, 'bb_std_mult': 1.5124506408107428, 'rsi_os': 20, 'rsi_ob': 80, 'vol_spike': 0.024660844467828312, 'adx_thresh': 15.383063650953922, 'atr_min_pct': 0.013451465818006946, 'atr_max_pct': 0.0423618592925645, 'tp_mult': 2.198338671161369, 'tsl_mult': 0.848325812661294, 'strategy': 'mean_reversion', 'time_stop': 56, 'use_sma': True, 'use_atr': True, 'use_adx': False, 'use_ema': True, 'use_spike': True, 'rsi_required': True, 'edge_k': 0.10550943833943405, 'edge_cap': 0.628333421332863, 'bull_strategy': 'mean_reversion', 'bull_bb_std_mult': 1.5065836541722868, 'bull_rsi_os': 40, 'bull_rsi_ob': 85, 'bull_adx_thresh': 19.294947853812772, 'bull_atr_min_pct': 0.014269490599339197, 'bull_atr_max_pct': 0.021549638017387768, 'bull_tp_mult': 1.3701559497381282, 'bull_tsl_mult': 0.32301915129280273, 'bull_time_stop': 284, 'bull_use_sma': False, 'bull_use_ema': False, 'bull_use_atr': False, 'bull_use_adx': True, 'bull_use_spike': False, 'bull_rsi_required': False, 'bear_strategy': 'breakout', 'bear_bb_std_mult': 3.2861201063128664, 'bear_rsi_os': 16, 'bear_rsi_ob': 74, 'bear_adx_thresh': 29.81256470232747, 'bear_atr_min_pct': 0.0006904272571673538, 'bear_atr_max_pct': 0.14055427242559185, 'bear_tp_mult': 2.058567523913782, 'bear_tsl_mult': 0.9828848245979929, 'bear_time_stop': 135, 'bear_use_sma': False, 'bear_use_ema': False, 'bear_use_atr': False, 'bear_use_adx': True, 'bear_use_spike': False, 'bear_rsi_required': False, 'sideways_strategy': 'breakout', 'sideways_bb_std_mult': 1.1540479172937346, 'sideways_rsi_os': 45, 'sideways_rsi_ob': 50, 'sideways_adx_thresh': 24.256671427529195, 'sideways_atr_min_pct': 0.010053542570374802, 'sideways_atr_max_pct': 0.13327477551977665, 'sideways_tp_mult': 2.7825734141547036, 'sideways_tsl_mult': 0.09308096055820658, 'sideways_time_stop': 179, 'sideways_use_sma': False, 'sideways_use_ema': True, 'sideways_use_atr': False, 'sideways_use_adx': False, 'sideways_use_spike': False, 'sideways_rsi_required': False}.
