[I 2025-08-30 15:48:14,156] Trial 559 finished with values: [-0.017322833293714757, 0.017209090779169038] and parameters: {'p_sma': 24, 'p_std': 59, 'p_atr': 13, 'p_adx': 26, 'rsi_period': 10, 'ema1': 22, 'ema2': 39, 'slip_atr_k': 3.81593653403355e-05, 'slip_spread_k': 0.6720063277714549, 'spread_hl_frac': 0.008206874058659514, 'bb_std_mult': 1.332050413694645, 'rsi_os': 33, 'rsi_ob': 84, 'vol_spike': 0.22066759473373868, 'adx_thresh': 32.80171095295117, 'atr_min_pct': 0.007077408373008269, 'atr_max_pct': 0.13100170128345423, 'tp_mult': 1.4208935569596255, 'tsl_mult': 0.388015923742132, 'strategy': 'breakout', 'time_stop': 82, 'use_sma': False, 'use_atr': False, 'use_adx': True, 'use_ema': False, 'use_spike': False, 'rsi_required': False, 'edge_k': 0.5556505619440509, 'edge_cap': 0.9463760978811154, 'bull_strategy': 'breakout', 'bull_bb_std_mult': 1.7008150338336832, 'bull_rsi_os': 14, 'bull_rsi_ob': 83, 'bull_adx_thresh': 7.820610387394604, 'bull_atr_min_pct': 0.02042580726425834, 'bull_atr_max_pct': 0.09574582812042019, 'bull_tp_mult': 2.1038450195840626, 'bull_tsl_mult': 0.05639464457490362, 'bull_time_stop': 168, 'bull_use_sma': True, 'bull_use_ema': True, 'bull_use_atr': True, 'bull_use_adx': True, 'bull_use_spike': True, 'bull_rsi_required': False, 'bear_strategy': 'mean_reversion', 'bear_bb_std_mult': 2.430601330946546, 'bear_rsi_os': 55, 'bear_rsi_ob': 76, 'bear_adx_thresh': 14.513925400534617, 'bear_atr_min_pct': 0.001678017230111102, 'bear_atr_max_pct': 0.10918074354985924, 'bear_tp_mult': 2.1343568401867854, 'bear_tsl_mult': 0.8451697069586283, 'bear_time_stop': 31, 'bear_use_sma': True, 'bear_use_ema': False, 'bear_use_atr': True, 'bear_use_adx': True, 'bear_use_spike': True, 'bear_rsi_required': True, 'sideways_strategy': 'mean_reversion', 'sideways_bb_std_mult': 3.5681785147821237, 'sideways_rsi_os': 25, 'sideways_rsi_ob': 80, 'sideways_adx_thresh': 11.489228747474533, 'sideways_atr_min_pct': 0.008857759772133527, 'sideways_atr_max_pct': 0.06906613942036696, 'sideways_tp_mult': 1.64413652226178, 'sideways_tsl_mult': 0.25850766217499044, 'sideways_time_stop': 136, 'sideways_use_sma': True, 'sideways_use_ema': False, 'sideways_use_atr': True, 'sideways_use_adx': True, 'sideways_use_spike': True, 'sideways_rsi_required': True}.
[I 2025-08-30 15:48:15,489] Trial 558 finished with values: [-1000000000.0, 0.16689798044100257] and parameters: {'p_sma': 24, 'p_std': 16, 'p_atr': 14, 'p_adx': 24, 'rsi_period': 14, 'ema1': 25, 'ema2': 26, 'slip_atr_k': 7.375415175988427e-06, 'slip_spread_k': 0.6792546519162682, 'spread_hl_frac': 0.0077372364219728765, 'bb_std_mult': 2.147036338756872, 'rsi_os': 30, 'rsi_ob': 87, 'vol_spike': 0.22310968954317292, 'adx_thresh': 9.374954835157498, 'atr_min_pct': 0.0060171647803054845, 'atr_max_pct': 0.10657635669698148, 'tp_mult': 1.5094141827540857, 'tsl_mult': 0.38539764020237033, 'strategy': 'breakout', 'time_stop': 195, 'use_sma': False, 'use_atr': False, 'use_adx': True, 'use_ema': False, 'use_spike': False, 'rsi_required': False, 'edge_k': 0.6722896796509373, 'edge_cap': 0.3047795689245677, 'bull_strategy': 'breakout', 'bull_bb_std_mult': 1.6960114813398643, 'bull_rsi_os': 14, 'bull_rsi_ob': 83, 'bull_adx_thresh': 7.8156374028623725, 'bull_atr_min_pct': 0.02017119669432837, 'bull_atr_max_pct': 0.09650793054086103, 'bull_tp_mult': 2.547682206094918, 'bull_tsl_mult': 0.0527699303920669, 'bull_time_stop': 59, 'bull_use_sma': True, 'bull_use_ema': True, 'bull_use_atr': True, 'bull_use_adx': True, 'bull_use_spike': True, 'bull_rsi_required': False, 'bear_strategy': 'mean_reversion', 'bear_bb_std_mult': 1.6558881885159913, 'bear_rsi_os': 50, 'bear_rsi_ob': 76, 'bear_adx_thresh': 29.114075411977606, 'bear_atr_min_pct': 0.00025731615054643995, 'bear_atr_max_pct': 0.05992472802262792, 'bear_tp_mult': 1.4002651616326909, 'bear_tsl_mult': 0.8172107505685764, 'bear_time_stop': 77, 'bear_use_sma': True, 'bear_use_ema': False, 'bear_use_atr': True, 'bear_use_adx': True, 'bear_use_spike': True, 'bear_rsi_required': True, 'sideways_strategy': 'mean_reversion', 'sideways_bb_std_mult': 3.20682367832787, 'sideways_rsi_os': 52, 'sideways_rsi_ob': 80, 'sideways_adx_thresh': 11.515167479228472, 'sideways_atr_min_pct': 6.8976150493452876e-06, 'sideways_atr_max_pct': 0.04431841781185796, 'sideways_tp_mult': 1.6116790498073437, 'sideways_tsl_mult': 0.41151346374935294, 'sideways_time_stop': 16, 'sideways_use_sma': True, 'sideways_use_ema': False, 'sideways_use_atr': True, 'sideways_use_adx': True, 'sideways_use_spike': True, 'sideways_rsi_required': True}.
[I 2025-08-30 15:48:16,482] Trial 557 finished with values: [-0.011309154584609682, 0.01132338743448012] and parameters: {'p_sma': 5, 'p_std': 21, 'p_atr': 13, 'p_adx': 24, 'rsi_period': 10, 'ema1': 19, 'ema2': 39, 'slip_atr_k': 0.004747328438968357, 'slip_spread_k': 0.72887713641878, 'spread_hl_frac': 0.008194258271564264, 'bb_std_mult': 2.1387249519894613, 'rsi_os': 29, 'rsi_ob': 84, 'vol_spike': 0.21876155593591803, 'adx_thresh': 9.41419482908412, 'atr_min_pct': 0.006942666418508835, 'atr_max_pct': 0.10589661689486793, 'tp_mult': 1.3971837189590617, 'tsl_mult': 0.9657087568584618, 'strategy': 'breakout', 'time_stop': 166, 'use_sma': False, 'use_atr': False, 'use_adx': True, 'use_ema': False, 'use_spike': False, 'rsi_required': False, 'edge_k': 1.0412867282608649, 'edge_cap': 0.9499753932985425, 'bull_strategy': 'breakout', 'bull_bb_std_mult': 1.7058292485383333, 'bull_rsi_os': 48, 'bull_rsi_ob': 87, 'bull_adx_thresh': 11.221961880695222, 'bull_atr_min_pct': 0.02061343609913239, 'bull_atr_max_pct': 0.05294670142087992, 'bull_tp_mult': 2.4526767017707214, 'bull_tsl_mult': 0.8102435753960971, 'bull_time_stop': 61, 'bull_use_sma': True, 'bull_use_ema': True, 'bull_use_atr': True, 'bull_use_adx': True, 'bull_use_spike': True, 'bull_rsi_required': False, 'bear_strategy': 'mean_reversion', 'bear_bb_std_mult': 2.0179217218891985, 'bear_rsi_os': 5, 'bear_rsi_ob': 76, 'bear_adx_thresh': 29.218537203813227, 'bear_atr_min_pct': 0.0016412536878922645, 'bear_atr_max_pct': 0.03033093635896028, 'bear_tp_mult': 1.498222120651527, 'bear_tsl_mult': 0.8182517697261344, 'bear_time_stop': 100, 'bear_use_sma': True, 'bear_use_ema': False, 'bear_use_atr': True, 'bear_use_adx': True, 'bear_use_spike': True, 'bear_rsi_required': True, 'sideways_strategy': 'mean_reversion', 'sideways_bb_std_mult': 3.2259506367165316, 'sideways_rsi_os': 27, 'sideways_rsi_ob': 79, 'sideways_adx_thresh': 30.702353920740777, 'sideways_atr_min_pct': 0.0004351336387974254, 'sideways_atr_max_pct': 0.06149280013308751, 'sideways_tp_mult': 1.4881460102698894, 'sideways_tsl_mult': 0.27833165660566295, 'sideways_time_stop': 16, 'sideways_use_sma': True, 'sideways_use_ema': False, 'sideways_use_atr': True, 'sideways_use_adx': True, 'sideways_use_spike': True, 'sideways_rsi_required': True}.
[I 2025-08-30 15:49:11,937] Trial 563 finished with values: [-1000000000.0, 1000000000.0] and parameters: {'p_sma': 28, 'p_std': 47, 'p_atr': 12, 'p_adx': 18, 'rsi_period': 10, 'ema1': 23, 'ema2': 36, 'slip_atr_k': 0.008932106032922866, 'slip_spread_k': 0.7226884032511558, 'spread_hl_frac': 0.0222575216272312, 'bb_std_mult': 0.8224815656458172, 'rsi_os': 46, 'rsi_ob': 73, 'vol_spike': 0.2296417833330595, 'adx_thresh': 8.645477148150825, 'atr_min_pct': 0.013954141113907342, 'atr_max_pct': 0.018365856705281312, 'tp_mult': 1.9002613971481248, 'tsl_mult': 0.422789312371998, 'strategy': 'breakout', 'time_stop': 164, 'use_sma': True, 'use_atr': True, 'use_adx': False, 'use_ema': True, 'use_spike': False, 'rsi_required': True, 'edge_k': 0.6127487245658526, 'edge_cap': 0.9980781136564161, 'bull_strategy': 'mean_reversion', 'bull_bb_std_mult': 1.5270420621044443, 'bull_rsi_os': 49, 'bull_rsi_ob': 85, 'bull_adx_thresh': 23.66930807374818, 'bull_atr_min_pct': 0.029591174301660746, 'bull_atr_max_pct': 0.1002484185158527, 'bull_tp_mult': 2.211009849998401, 'bull_tsl_mult': 0.8625442731391828, 'bull_time_stop': 44, 'bull_use_sma': True, 'bull_use_ema': True, 'bull_use_atr': False, 'bull_use_adx': True, 'bull_use_spike': False, 'bull_rsi_required': False, 'bear_strategy': 'breakout', 'bear_bb_std_mult': 1.7991103562182482, 'bear_rsi_os': 26, 'bear_rsi_ob': 55, 'bear_adx_thresh': 30.278427680559, 'bear_atr_min_pct': 0.0024164996816490193, 'bear_atr_max_pct': 0.10421783934037596, 'bear_tp_mult': 2.717430718726469, 'bear_tsl_mult': 0.8722766508490079, 'bear_time_stop': 92, 'bear_use_sma': True, 'bear_use_ema': False, 'bear_use_atr': False, 'bear_use_adx': True, 'bear_use_spike': False, 'bear_rsi_required': False, 'sideways_strategy': 'mean_reversion', 'sideways_bb_std_mult': 1.3811370104034175, 'sideways_rsi_os': 14, 'sideways_rsi_ob': 89, 'sideways_adx_thresh': 10.981747203906624, 'sideways_atr_min_pct': 0.020110959253068165, 'sideways_atr_max_pct': 0.06381116479480041, 'sideways_tp_mult': 1.3813910675710648, 'sideways_tsl_mult': 0.3857666400436119, 'sideways_time_stop': 124, 'sideways_use_sma': True, 'sideways_use_ema': False, 'sideways_use_atr': False, 'sideways_use_adx': False, 'sideways_use_spike': False, 'sideways_rsi_required': False}.
[I 2025-08-30 15:49:12,837] Trial 564 finished with values: [-0.032262290764873636, 0.03238843627355201] and parameters: {'p_sma': 8, 'p_std': 19, 'p_atr': 29, 'p_adx': 11, 'rsi_period': 9, 'ema1': 23, 'ema2': 36, 'slip_atr_k': 0.14710446545367803, 'slip_spread_k': 0.7142111213151469, 'spread_hl_frac': 0.01984960607582733, 'bb_std_mult': 0.8259524997644478, 'rsi_os': 51, 'rsi_ob': 62, 'vol_spike': 0.12469886472202166, 'adx_thresh': 8.604648287321801, 'atr_min_pct': 0.013822504668652603, 'atr_max_pct': 0.11264611260497005, 'tp_mult': 1.516737849606295, 'tsl_mult': 0.4193278048384531, 'strategy': 'breakout', 'time_stop': 152, 'use_sma': True, 'use_atr': True, 'use_adx': False, 'use_ema': True, 'use_spike': False, 'rsi_required': True, 'edge_k': 0.6267202189518287, 'edge_cap': 0.9991024272369121, 'bull_strategy': 'mean_reversion', 'bull_bb_std_mult': 3.4851960045149326, 'bull_rsi_os': 49, 'bull_rsi_ob': 85, 'bull_adx_thresh': 10.254430170295784, 'bull_atr_min_pct': 0.01865847618332888, 'bull_atr_max_pct': 0.10031353033763041, 'bull_tp_mult': 2.5837895554956574, 'bull_tsl_mult': 0.8658842443673587, 'bull_time_stop': 49, 'bull_use_sma': True, 'bull_use_ema': True, 'bull_use_atr': False, 'bull_use_adx': True, 'bull_use_spike': False, 'bull_rsi_required': True, 'bear_strategy': 'breakout', 'bear_bb_std_mult': 2.296497738878094, 'bear_rsi_os': 7, 'bear_rsi_ob': 59, 'bear_adx_thresh': 15.788888470694827, 'bear_atr_min_pct': 0.002665497489170829, 'bear_atr_max_pct': 0.10568546138740874, 'bear_tp_mult': 1.0674013663332447, 'bear_tsl_mult': 0.8689891335221288, 'bear_time_stop': 90, 'bear_use_sma': True, 'bear_use_ema': False, 'bear_use_atr': False, 'bear_use_adx': True, 'bear_use_spike': False, 'bear_rsi_required': False, 'sideways_strategy': 'mean_reversion', 'sideways_bb_std_mult': 3.021008994957771, 'sideways_rsi_os': 17, 'sideways_rsi_ob': 82, 'sideways_adx_thresh': 12.620508647125382, 'sideways_atr_min_pct': 0.020065141718556827, 'sideways_atr_max_pct': 0.04766832151358039, 'sideways_tp_mult': 1.6872172658196556, 'sideways_tsl_mult': 0.38524379352498656, 'sideways_time_stop': 119, 'sideways_use_sma': True, 'sideways_use_ema': False, 'sideways_use_atr': False, 'sideways_use_adx': False, 'sideways_use_spike': False, 'sideways_rsi_required': False}.
[I 2025-08-30 15:49:14,113] Trial 562 finished with values: [-0.011661179939863042, 0.012862725295675496] and parameters: {'p_sma': 8, 'p_std': 19, 'p_atr': 12, 'p_adx': 24, 'rsi_period': 67, 'ema1': 23, 'ema2': 36, 'slip_atr_k': 0.05170102336190055, 'slip_spread_k': 0.19364551636074934, 'spread_hl_frac': 0.007264113379031427, 'bb_std_mult': 2.3939040394717237, 'rsi_os': 51, 'rsi_ob': 73, 'vol_spike': 0.23106720687920645, 'adx_thresh': 8.816003520688687, 'atr_min_pct': 0.005805483858179241, 'atr_max_pct': 0.11276915818951441, 'tp_mult': 2.7541367108980115, 'tsl_mult': 0.8742676103544502, 'strategy': 'breakout', 'time_stop': 166, 'use_sma': True, 'use_atr': True, 'use_adx': False, 'use_ema': True, 'use_spike': False, 'rsi_required': False, 'edge_k': 0.6902548020092079, 'edge_cap': 0.9986312965740765, 'bull_strategy': 'mean_reversion', 'bull_bb_std_mult': 0.8599463804373211, 'bull_rsi_os': 49, 'bull_rsi_ob': 89, 'bull_adx_thresh': 8.487763663120923, 'bull_atr_min_pct': 0.01853040189112, 'bull_atr_max_pct': 0.06519973874355332, 'bull_tp_mult': 2.561549537001843, 'bull_tsl_mult': 0.8614433860052125, 'bull_time_stop': 61, 'bull_use_sma': True, 'bull_use_ema': True, 'bull_use_atr': True, 'bull_use_adx': True, 'bull_use_spike': False, 'bull_rsi_required': False, 'bear_strategy': 'breakout', 'bear_bb_std_mult': 1.651170821078991, 'bear_rsi_os': 7, 'bear_rsi_ob': 51, 'bear_adx_thresh': 15.683811760969016, 'bear_atr_min_pct': 2.069763831979987e-05, 'bear_atr_max_pct': 0.10588288980827482, 'bear_tp_mult': 2.7053447971254263, 'bear_tsl_mult': 0.868326796643725, 'bear_time_stop': 76, 'bear_use_sma': True, 'bear_use_ema': False, 'bear_use_atr': False, 'bear_use_adx': True, 'bear_use_spike': True, 'bear_rsi_required': True, 'sideways_strategy': 'mean_reversion', 'sideways_bb_std_mult': 2.9963687837430792, 'sideways_rsi_os': 17, 'sideways_rsi_ob': 89, 'sideways_adx_thresh': 30.346642657303306, 'sideways_atr_min_pct': 0.017828661085232882, 'sideways_atr_max_pct': 0.04821949442997722, 'sideways_tp_mult': 1.5627043433166183, 'sideways_tsl_mult': 0.8670081174225603, 'sideways_time_stop': 194, 'sideways_use_sma': True, 'sideways_use_ema': False, 'sideways_use_atr': False, 'sideways_use_adx': False, 'sideways_use_spike': True, 'sideways_rsi_required': False}.
[I 2025-08-30 15:49:15,236] Trial 561 finished with values: [-0.02762888416599507, 0.027452518664298046] and parameters: {'p_sma': 24, 'p_std': 19, 'p_atr': 12, 'p_adx': 24, 'rsi_period': 9, 'ema1': 25, 'ema2': 40, 'slip_atr_k': 0.15011969875603948, 'slip_spread_k': 0.6701875699054931, 'spread_hl_frac': 0.007452917381840401, 'bb_std_mult': 1.8353433188367658, 'rsi_os': 30, 'rsi_ob': 87, 'vol_spike': 0.2212643615532853, 'adx_thresh': 8.823417395754605, 'atr_min_pct': 0.014442937188856596, 'atr_max_pct': 0.13957342574515974, 'tp_mult': 1.514120238612603, 'tsl_mult': 0.42192803028292636, 'strategy': 'breakout', 'time_stop': 18, 'use_sma': False, 'use_atr': True, 'use_adx': False, 'use_ema': False, 'use_spike': False, 'rsi_required': False, 'edge_k': 0.637504098847267, 'edge_cap': 0.9878905894375374, 'bull_strategy': 'breakout', 'bull_bb_std_mult': 1.5654431286929924, 'bull_rsi_os': 12, 'bull_rsi_ob': 83, 'bull_adx_thresh': 18.164789661147278, 'bull_atr_min_pct': 0.02039121337284152, 'bull_atr_max_pct': 0.0957827349502223, 'bull_tp_mult': 2.5539454086971545, 'bull_tsl_mult': 0.43564740997134016, 'bull_time_stop': 58, 'bull_use_sma': True, 'bull_use_ema': True, 'bull_use_atr': True, 'bull_use_adx': True, 'bull_use_spike': True, 'bull_rsi_required': False, 'bear_strategy': 'mean_reversion', 'bear_bb_std_mult': 2.3611807012861017, 'bear_rsi_os': 26, 'bear_rsi_ob': 59, 'bear_adx_thresh': 14.486470204640703, 'bear_atr_min_pct': 0.002601889265072503, 'bear_atr_max_pct': 0.10499743570281513, 'bear_tp_mult': 2.705955410638033, 'bear_tsl_mult': 0.8689468187309893, 'bear_time_stop': 73, 'bear_use_sma': True, 'bear_use_ema': False, 'bear_use_atr': False, 'bear_use_adx': True, 'bear_use_spike': True, 'bear_rsi_required': True, 'sideways_strategy': 'mean_reversion', 'sideways_bb_std_mult': 2.9071155190625806, 'sideways_rsi_os': 27, 'sideways_rsi_ob': 83, 'sideways_adx_thresh': 11.198511646632014, 'sideways_atr_min_pct': 0.018070645566252316, 'sideways_atr_max_pct': 0.047233069771081417, 'sideways_tp_mult': 1.6160859275258306, 'sideways_tsl_mult': 0.4245752905839878, 'sideways_time_stop': 120, 'sideways_use_sma': True, 'sideways_use_ema': False, 'sideways_use_atr': False, 'sideways_use_adx': True, 'sideways_use_spike': True, 'sideways_rsi_required': True}.
[I 2025-08-30 15:49:58,049] Trial 568 finished with values: [-1000000000.0, 1000000000.0] and parameters: {'p_sma': 9, 'p_std': 44, 'p_atr': 21, 'p_adx': 26, 'rsi_period': 43, 'ema1': 24, 'ema2': 38, 'slip_atr_k': 0.19869912697171355, 'slip_spread_k': 0.6536671153465836, 'spread_hl_frac': 0.0315226411839172, 'bb_std_mult': 0.6920552990972828, 'rsi_os': 25, 'rsi_ob': 88, 'vol_spike': 0.20988035818281994, 'adx_thresh': 22.70047490451208, 'atr_min_pct': 0.006431458997316851, 'atr_max_pct': 0.12050373146589256, 'tp_mult': 1.4755408669822583, 'tsl_mult': 0.346741235335003, 'strategy': 'breakout', 'time_stop': 70, 'use_sma': False, 'use_atr': False, 'use_adx': True, 'use_ema': False, 'use_spike': False, 'rsi_required': False, 'edge_k': 0.564256115253816, 'edge_cap': 0.42954601625292776, 'bull_strategy': 'breakout', 'bull_bb_std_mult': 3.3233429624539217, 'bull_rsi_os': 51, 'bull_rsi_ob': 77, 'bull_adx_thresh': 8.982483661593124, 'bull_atr_min_pct': 0.022970179345070722, 'bull_atr_max_pct': 0.10534076767204018, 'bull_tp_mult': 2.598719521285677, 'bull_tsl_mult': 0.48470181734805334, 'bull_time_stop': 44, 'bull_use_sma': True, 'bull_use_ema': False, 'bull_use_atr': True, 'bull_use_adx': True, 'bull_use_spike': True, 'bull_rsi_required': True, 'bear_strategy': 'mean_reversion', 'bear_bb_std_mult': 1.90705712267685, 'bear_rsi_os': 22, 'bear_rsi_ob': 73, 'bear_adx_thresh': 13.719589265933351, 'bear_atr_min_pct': 0.007153889649820085, 'bear_atr_max_pct': 0.1159777786069056, 'bear_tp_mult': 1.8282921058103376, 'bear_tsl_mult': 0.8925559852981276, 'bear_time_stop': 84, 'bear_use_sma': False, 'bear_use_ema': True, 'bear_use_atr': True, 'bear_use_adx': False, 'bear_use_spike': True, 'bear_rsi_required': True, 'sideways_strategy': 'breakout', 'sideways_bb_std_mult': 3.1529119797087213, 'sideways_rsi_os': 11, 'sideways_rsi_ob': 77, 'sideways_adx_thresh': 9.744843920007183, 'sideways_atr_min_pct': 0.019093504844560148, 'sideways_atr_max_pct': 0.12419419365581774, 'sideways_tp_mult': 1.2415564957355285, 'sideways_tsl_mult': 0.30676918934190506, 'sideways_time_stop': 129, 'sideways_use_sma': False, 'sideways_use_ema': False, 'sideways_use_atr': True, 'sideways_use_adx': True, 'sideways_use_spike': True, 'sideways_rsi_required': True}.
[I 2025-08-30 15:49:58,571] Trial 566 finished with values: [-1000000000.0, 1000000000.0] and parameters: {'p_sma': 48, 'p_std': 24, 'p_atr': 12, 'p_adx': 24, 'rsi_period': 67, 'ema1': 25, 'ema2': 11, 'slip_atr_k': 0.051935134852687026, 'slip_spread_k': 0.6555441863000477, 'spread_hl_frac': 0.026485438655816755, 'bb_std_mult': 0.6543454150712417, 'rsi_os': 25, 'rsi_ob': 87, 'vol_spike': 0.06344612653151879, 'adx_thresh': 7.199315880731339, 'atr_min_pct': 0.014644518707792356, 'atr_max_pct': 0.12056687199392851, 'tp_mult': 1.4830013297851206, 'tsl_mult': 0.36255200227149675, 'strategy': 'breakout', 'time_stop': 145, 'use_sma': False, 'use_atr': False, 'use_adx': True, 'use_ema': False, 'use_spike': False, 'rsi_required': False, 'edge_k': 1.674492925515993, 'edge_cap': 0.3422706429367057, 'bull_strategy': 'breakout', 'bull_bb_std_mult': 1.550734696172959, 'bull_rsi_os': 8, 'bull_rsi_ob': 90, 'bull_adx_thresh': 25.375086188761156, 'bull_atr_min_pct': 0.019779965942243738, 'bull_atr_max_pct': 0.10613472678332676, 'bull_tp_mult': 2.5287340635258926, 'bull_tsl_mult': 0.8769178664384961, 'bull_time_stop': 299, 'bull_use_sma': True, 'bull_use_ema': True, 'bull_use_atr': True, 'bull_use_adx': True, 'bull_use_spike': True, 'bull_rsi_required': False, 'bear_strategy': 'mean_reversion', 'bear_bb_std_mult': 1.613810306786126, 'bear_rsi_os': 22, 'bear_rsi_ob': 52, 'bear_adx_thresh': 14.27675523416443, 'bear_atr_min_pct': 0.0038602469153016386, 'bear_atr_max_pct': 0.11617817662531103, 'bear_tp_mult': 1.8329993918374254, 'bear_tsl_mult': 0.8925697752102077, 'bear_time_stop': 77, 'bear_use_sma': False, 'bear_use_ema': False, 'bear_use_atr': True, 'bear_use_adx': False, 'bear_use_spike': True, 'bear_rsi_required': True, 'sideways_strategy': 'mean_reversion', 'sideways_bb_std_mult': 0.507740421689683, 'sideways_rsi_os': 15, 'sideways_rsi_ob': 77, 'sideways_adx_thresh': 14.973522878873556, 'sideways_atr_min_pct': 0.018160424609722062, 'sideways_atr_max_pct': 0.07428285759056077, 'sideways_tp_mult': 1.5809200415883777, 'sideways_tsl_mult': 0.4242111576543416, 'sideways_time_stop': 130, 'sideways_use_sma': True, 'sideways_use_ema': False, 'sideways_use_atr': True, 'sideways_use_adx': True, 'sideways_use_spike': True, 'sideways_rsi_required': True}.
