[I 2025-08-30 16:06:53,232] Trial 660 finished with values: [-1000000000.0, 1000000000.0] and parameters: {'p_sma': 52, 'p_std': 49, 'p_atr': 12, 'p_adx': 25, 'rsi_period': 14, 'ema1': 22, 'ema2': 13, 'slip_atr_k': 0.00024385096731577408, 'slip_spread_k': 0.6962367505315512, 'spread_hl_frac': 0.041395983253184415, 'bb_std_mult': 0.6101947159696565, 'rsi_os': 25, 'rsi_ob': 60, 'vol_spike': 0.18202664533193605, 'adx_thresh': 9.423742716272715, 'atr_min_pct': 0.00698254306319209, 'atr_max_pct': 0.10758609493231289, 'tp_mult': 1.5762273842061385, 'tsl_mult': 0.8299825825754796, 'strategy': 'breakout', 'time_stop': 21, 'use_sma': False, 'use_atr': False, 'use_adx': True, 'use_ema': True, 'use_spike': False, 'rsi_required': True, 'edge_k': 0.5861962692210875, 'edge_cap': 0.939356697242385, 'bull_strategy': 'mean_reversion', 'bull_bb_std_mult': 1.7300780920770287, 'bull_rsi_os': 27, 'bull_rsi_ob': 88, 'bull_adx_thresh': 8.026633047368236, 'bull_atr_min_pct': 0.0107708107806054, 'bull_atr_max_pct': 0.12465819155511437, 'bull_tp_mult': 2.5972827897116684, 'bull_tsl_mult': 0.846156573577039, 'bull_time_stop': 232, 'bull_use_sma': True, 'bull_use_ema': True, 'bull_use_atr': False, 'bull_use_adx': True, 'bull_use_spike': False, 'bull_rsi_required': False, 'bear_strategy': 'breakout', 'bear_bb_std_mult': 1.3575249531569415, 'bear_rsi_os': 15, 'bear_rsi_ob': 73, 'bear_adx_thresh': 16.071556151075715, 'bear_atr_min_pct': 0.0033344305593100863, 'bear_atr_max_pct': 0.10779345546558779, 'bear_tp_mult': 1.5671206571147915, 'bear_tsl_mult': 0.8365169872800162, 'bear_time_stop': 107, 'bear_use_sma': True, 'bear_use_ema': False, 'bear_use_atr': True, 'bear_use_adx': False, 'bear_use_spike': False, 'bear_rsi_required': False, 'sideways_strategy': 'mean_reversion', 'sideways_bb_std_mult': 3.292087185223423, 'sideways_rsi_os': 7, 'sideways_rsi_ob': 82, 'sideways_adx_thresh': 11.163853520241442, 'sideways_atr_min_pct': 0.01712550461162093, 'sideways_atr_max_pct': 0.06569921006903201, 'sideways_tp_mult': 1.288716093655033, 'sideways_tsl_mult': 0.24269398701779465, 'sideways_time_stop': 131, 'sideways_use_sma': True, 'sideways_use_ema': False, 'sideways_use_atr': False, 'sideways_use_adx': True, 'sideways_use_spike': False, 'sideways_rsi_required': True}.
[I 2025-08-30 16:06:53,245] Trial 659 finished with values: [-1000000000.0, 1000000000.0] and parameters: {'p_sma': 8, 'p_std': 49, 'p_atr': 29, 'p_adx': 25, 'rsi_period': 15, 'ema1': 26, 'ema2': 36, 'slip_atr_k': 0.22450205708501694, 'slip_spread_k': 0.7065055036862629, 'spread_hl_frac': 0.005498909324412099, 'bb_std_mult': 0.6402965242933438, 'rsi_os': 40, 'rsi_ob': 70, 'vol_spike': 0.011205865926223163, 'adx_thresh': 9.102299003105037, 'atr_min_pct': 0.02693712927577556, 'atr_max_pct': 0.10875075852715146, 'tp_mult': 1.093271318859952, 'tsl_mult': 0.000679814423053815, 'strategy': 'breakout', 'time_stop': 151, 'use_sma': False, 'use_atr': False, 'use_adx': True, 'use_ema': False, 'use_spike': False, 'rsi_required': False, 'edge_k': 0.5932191198311575, 'edge_cap': 0.20658254591738073, 'bull_strategy': 'breakout', 'bull_bb_std_mult': 1.730910622059908, 'bull_rsi_os': 49, 'bull_rsi_ob': 88, 'bull_adx_thresh': 13.718233563722404, 'bull_atr_min_pct': 0.021306267932004068, 'bull_atr_max_pct': 0.11342802578346514, 'bull_tp_mult': 1.5551306683029693, 'bull_tsl_mult': 0.8134501989285532, 'bull_time_stop': 74, 'bull_use_sma': True, 'bull_use_ema': True, 'bull_use_atr': True, 'bull_use_adx': True, 'bull_use_spike': True, 'bull_rsi_required': False, 'bear_strategy': 'mean_reversion', 'bear_bb_std_mult': 2.326088068158454, 'bear_rsi_os': 39, 'bear_rsi_ob': 79, 'bear_adx_thresh': 23.111666936898878, 'bear_atr_min_pct': 0.0036190867290051224, 'bear_atr_max_pct': 0.10811685310775065, 'bear_tp_mult': 1.576535154675253, 'bear_tsl_mult': 0.8323809967182831, 'bear_time_stop': 107, 'bear_use_sma': True, 'bear_use_ema': False, 'bear_use_atr': True, 'bear_use_adx': False, 'bear_use_spike': True, 'bear_rsi_required': True, 'sideways_strategy': 'mean_reversion', 'sideways_bb_std_mult': 3.2733699483507896, 'sideways_rsi_os': 8, 'sideways_rsi_ob': 81, 'sideways_adx_thresh': 11.114688090270636, 'sideways_atr_min_pct': 0.027664703591045812, 'sideways_atr_max_pct': 0.06428479668234421, 'sideways_tp_mult': 1.1657708727523073, 'sideways_tsl_mult': 0.8659671136639437, 'sideways_time_stop': 131, 'sideways_use_sma': True, 'sideways_use_ema': False, 'sideways_use_atr': False, 'sideways_use_adx': True, 'sideways_use_spike': True, 'sideways_rsi_required': True}.
[I 2025-08-30 16:06:53,754] Trial 658 finished with values: [-1000000000.0, 1000000000.0] and parameters: {'p_sma': 8, 'p_std': 15, 'p_atr': 7, 'p_adx': 25, 'rsi_period': 16, 'ema1': 22, 'ema2': 36, 'slip_atr_k': 0.0093602146777371, 'slip_spread_k': 0.7057819583527425, 'spread_hl_frac': 0.005879980256080017, 'bb_std_mult': 0.6494135677146073, 'rsi_os': 26, 'rsi_ob': 71, 'vol_spike': 0.1250468111625738, 'adx_thresh': 25.38396212701663, 'atr_min_pct': 0.007005353949931172, 'atr_max_pct': 0.1071120956728666, 'tp_mult': 2.028448455457986, 'tsl_mult': 0.3461248361338543, 'strategy': 'breakout', 'time_stop': 157, 'use_sma': False, 'use_atr': False, 'use_adx': True, 'use_ema': False, 'use_spike': False, 'rsi_required': False, 'edge_k': 0.5862313595364244, 'edge_cap': 0.9376153671751865, 'bull_strategy': 'breakout', 'bull_bb_std_mult': 1.5792092031939975, 'bull_rsi_os': 18, 'bull_rsi_ob': 88, 'bull_adx_thresh': 13.674802087133816, 'bull_atr_min_pct': 0.008932663831998713, 'bull_atr_max_pct': 0.10594436279075044, 'bull_tp_mult': 1.6683303811426853, 'bull_tsl_mult': 0.8082497839682175, 'bull_time_stop': 59, 'bull_use_sma': True, 'bull_use_ema': True, 'bull_use_atr': True, 'bull_use_adx': True, 'bull_use_spike': True, 'bull_rsi_required': False, 'bear_strategy': 'mean_reversion', 'bear_bb_std_mult': 2.4006394102760034, 'bear_rsi_os': 28, 'bear_rsi_ob': 73, 'bear_adx_thresh': 14.210070300661071, 'bear_atr_min_pct': 0.02282996670031437, 'bear_atr_max_pct': 0.1027931282546163, 'bear_tp_mult': 1.5850845183734967, 'bear_tsl_mult': 0.8308934325273898, 'bear_time_stop': 107, 'bear_use_sma': True, 'bear_use_ema': False, 'bear_use_atr': True, 'bear_use_adx': False, 'bear_use_spike': True, 'bear_rsi_required': True, 'sideways_strategy': 'mean_reversion', 'sideways_bb_std_mult': 3.3104639934135145, 'sideways_rsi_os': 7, 'sideways_rsi_ob': 81, 'sideways_adx_thresh': 11.032339625763179, 'sideways_atr_min_pct': 0.009881839841363971, 'sideways_atr_max_pct': 0.06545658980513501, 'sideways_tp_mult': 1.5914695635606217, 'sideways_tsl_mult': 0.8522502931396039, 'sideways_time_stop': 132, 'sideways_use_sma': True, 'sideways_use_ema': False, 'sideways_use_atr': False, 'sideways_use_adx': True, 'sideways_use_spike': True, 'sideways_rsi_required': True}.
[I 2025-08-30 16:06:54,479] Trial 657 finished with values: [-1000000000.0, 1000000000.0] and parameters: {'p_sma': 25, 'p_std': 24, 'p_atr': 29, 'p_adx': 25, 'rsi_period': 16, 'ema1': 26, 'ema2': 36, 'slip_atr_k': 0.16058643134244416, 'slip_spread_k': 0.7062291043082851, 'spread_hl_frac': 0.007369425454689748, 'bb_std_mult': 2.2774975106148236, 'rsi_os': 27, 'rsi_ob': 72, 'vol_spike': 0.15767099988251315, 'adx_thresh': 9.368736488252418, 'atr_min_pct': 0.006967243623373311, 'atr_max_pct': 0.06408569780716535, 'tp_mult': 1.481496868929196, 'tsl_mult': 0.3467449508255583, 'strategy': 'breakout', 'time_stop': 148, 'use_sma': False, 'use_atr': False, 'use_adx': True, 'use_ema': False, 'use_spike': False, 'rsi_required': False, 'edge_k': 0.5793852323591353, 'edge_cap': 0.19850032107398058, 'bull_strategy': 'breakout', 'bull_bb_std_mult': 2.133994488181496, 'bull_rsi_os': 49, 'bull_rsi_ob': 71, 'bull_adx_thresh': 9.787794985645393, 'bull_atr_min_pct': 0.005646233242119797, 'bull_atr_max_pct': 0.12614658089594807, 'bull_tp_mult': 1.557541281984981, 'bull_tsl_mult': 0.8108853023660234, 'bull_time_stop': 59, 'bull_use_sma': True, 'bull_use_ema': True, 'bull_use_atr': True, 'bull_use_adx': True, 'bull_use_spike': True, 'bull_rsi_required': True, 'bear_strategy': 'mean_reversion', 'bear_bb_std_mult': 1.4369242281827417, 'bear_rsi_os': 27, 'bear_rsi_ob': 73, 'bear_adx_thresh': 14.244092848585133, 'bear_atr_min_pct': 0.0035016967581508757, 'bear_atr_max_pct': 0.12050981236052646, 'bear_tp_mult': 1.1004480266850938, 'bear_tsl_mult': 0.7876555488861021, 'bear_time_stop': 84, 'bear_use_sma': True, 'bear_use_ema': False, 'bear_use_atr': True, 'bear_use_adx': True, 'bear_use_spike': True, 'bear_rsi_required': True, 'sideways_strategy': 'mean_reversion', 'sideways_bb_std_mult': 3.2949178171248596, 'sideways_rsi_os': 25, 'sideways_rsi_ob': 82, 'sideways_adx_thresh': 9.615974604724261, 'sideways_atr_min_pct': 0.008160551912999966, 'sideways_atr_max_pct': 0.07046759327781801, 'sideways_tp_mult': 1.5772957647379504, 'sideways_tsl_mult': 0.4313126493722195, 'sideways_time_stop': 132, 'sideways_use_sma': True, 'sideways_use_ema': False, 'sideways_use_atr': True, 'sideways_use_adx': True, 'sideways_use_spike': True, 'sideways_rsi_required': True}.
[I 2025-08-30 16:07:36,980] Trial 664 finished with values: [-1000000000.0, 1000000000.0] and parameters: {'p_sma': 50, 'p_std': 21, 'p_atr': 22, 'p_adx': 26, 'rsi_period': 7, 'ema1': 19, 'ema2': 38, 'slip_atr_k': 0.01591425268223072, 'slip_spread_k': 0.731791574599472, 'spread_hl_frac': 0.006825842497859959, 'bb_std_mult': 1.4365444029433216, 'rsi_os': 27, 'rsi_ob': 87, 'vol_spike': 0.20909331175864146, 'adx_thresh': 6.922144125704341, 'atr_min_pct': 0.011825935675816822, 'atr_max_pct': 0.1183403863298512, 'tp_mult': 1.4173148153622819, 'tsl_mult': 0.7465311307835631, 'strategy': 'mean_reversion', 'time_stop': 173, 'use_sma': True, 'use_atr': True, 'use_adx': True, 'use_ema': True, 'use_spike': False, 'rsi_required': True, 'edge_k': 0.07627225724912012, 'edge_cap': 0.9783548377094005, 'bull_strategy': 'mean_reversion', 'bull_bb_std_mult': 1.6538676822561715, 'bull_rsi_os': 48, 'bull_rsi_ob': 91, 'bull_adx_thresh': 14.96518222063795, 'bull_atr_min_pct': 0.019942213538718206, 'bull_atr_max_pct': 0.06047593098474807, 'bull_tp_mult': 2.4632587671920376, 'bull_tsl_mult': 0.8903190621108786, 'bull_time_stop': 37, 'bull_use_sma': False, 'bull_use_ema': False, 'bull_use_atr': False, 'bull_use_adx': True, 'bull_use_spike': False, 'bull_rsi_required': False, 'bear_strategy': 'breakout', 'bear_bb_std_mult': 1.571476943432528, 'bear_rsi_os': 26, 'bear_rsi_ob': 75, 'bear_adx_thresh': 29.569657085714596, 'bear_atr_min_pct': 0.0023435238832839, 'bear_atr_max_pct': 0.07802271414952332, 'bear_tp_mult': 2.482592173983107, 'bear_tsl_mult': 0.8574518676855202, 'bear_time_stop': 100, 'bear_use_sma': False, 'bear_use_ema': True, 'bear_use_atr': False, 'bear_use_adx': True, 'bear_use_spike': False, 'bear_rsi_required': False, 'sideways_strategy': 'mean_reversion', 'sideways_bb_std_mult': 3.2081877730253057, 'sideways_rsi_os': 15, 'sideways_rsi_ob': 72, 'sideways_adx_thresh': 10.437041063615917, 'sideways_atr_min_pct': 0.01924417065242094, 'sideways_atr_max_pct': 0.140145354024047, 'sideways_tp_mult': 1.509999628281111, 'sideways_tsl_mult': 0.18472659848849693, 'sideways_time_stop': 230, 'sideways_use_sma': False, 'sideways_use_ema': False, 'sideways_use_atr': True, 'sideways_use_adx': False, 'sideways_use_spike': False, 'sideways_rsi_required': False}.
[I 2025-08-30 16:07:37,868] Trial 661 finished with values: [-1000000000.0, 1000000000.0] and parameters: {'p_sma': 31, 'p_std': 15, 'p_atr': 7, 'p_adx': 26, 'rsi_period': 30, 'ema1': 30, 'ema2': 37, 'slip_atr_k': 8.84723386512528e-05, 'slip_spread_k': 0.7279003265038478, 'spread_hl_frac': 0.006941591046888075, 'bb_std_mult': 0.5002712010911052, 'rsi_os': 26, 'rsi_ob': 85, 'vol_spike': 0.20442884610855283, 'adx_thresh': 25.481209516206984, 'atr_min_pct': 0.007745299994717355, 'atr_max_pct': 0.11843368585035177, 'tp_mult': 1.5967481437011601, 'tsl_mult': 0.7495621750981848, 'strategy': 'breakout', 'time_stop': 171, 'use_sma': False, 'use_atr': True, 'use_adx': True, 'use_ema': False, 'use_spike': False, 'rsi_required': False, 'edge_k': 0.7175745034663104, 'edge_cap': 0.943182274858385, 'bull_strategy': 'breakout', 'bull_bb_std_mult': 1.6623101450608238, 'bull_rsi_os': 8, 'bull_rsi_ob': 56, 'bull_adx_thresh': 9.746912357949435, 'bull_atr_min_pct': 0.018051517156305867, 'bull_atr_max_pct': 0.1066463636195578, 'bull_tp_mult': 2.574767163720015, 'bull_tsl_mult': 0.7645807473490611, 'bull_time_stop': 60, 'bull_use_sma': True, 'bull_use_ema': False, 'bull_use_atr': True, 'bull_use_adx': True, 'bull_use_spike': True, 'bull_rsi_required': False, 'bear_strategy': 'mean_reversion', 'bear_bb_std_mult': 2.391013007965869, 'bear_rsi_os': 28, 'bear_rsi_ob': 75, 'bear_adx_thresh': 16.452394619490875, 'bear_atr_min_pct': 0.002470062493868483, 'bear_atr_max_pct': 0.10354878169654666, 'bear_tp_mult': 2.4663912148272233, 'bear_tsl_mult': 0.721852985426017, 'bear_time_stop': 101, 'bear_use_sma': True, 'bear_use_ema': True, 'bear_use_atr': False, 'bear_use_adx': True, 'bear_use_spike': True, 'bear_rsi_required': True, 'sideways_strategy': 'mean_reversion', 'sideways_bb_std_mult': 2.368599864709115, 'sideways_rsi_os': 15, 'sideways_rsi_ob': 75, 'sideways_adx_thresh': 10.502844040310672, 'sideways_atr_min_pct': 0.01021519584729174, 'sideways_atr_max_pct': 0.07509828785287617, 'sideways_tp_mult': 1.500776795754109, 'sideways_tsl_mult': 0.36811825192582964, 'sideways_time_stop': 125, 'sideways_use_sma': False, 'sideways_use_ema': False, 'sideways_use_atr': True, 'sideways_use_adx': True, 'sideways_use_spike': True, 'sideways_rsi_required': True}.
[I 2025-08-30 16:07:38,465] Trial 662 finished with values: [-1000000000.0, 1000000000.0] and parameters: {'p_sma': 31, 'p_std': 21, 'p_atr': 7, 'p_adx': 26, 'rsi_period': 58, 'ema1': 19, 'ema2': 37, 'slip_atr_k': 0.015595043648850634, 'slip_spread_k': 0.732243919139673, 'spread_hl_frac': 0.0068979603395929335, 'bb_std_mult': 0.7461862426452506, 'rsi_os': 26, 'rsi_ob': 87, 'vol_spike': 0.1244931592697115, 'adx_thresh': 30.83080961775801, 'atr_min_pct': 0.01500277931625529, 'atr_max_pct': 0.11549309375760952, 'tp_mult': 1.5888697092815267, 'tsl_mult': 0.3394770582176092, 'strategy': 'breakout', 'time_stop': 171, 'use_sma': False, 'use_atr': True, 'use_adx': True, 'use_ema': False, 'use_spike': False, 'rsi_required': False, 'edge_k': 0.6304937492230649, 'edge_cap': 0.9316115060470642, 'bull_strategy': 'breakout', 'bull_bb_std_mult': 1.9872901895664183, 'bull_rsi_os': 23, 'bull_rsi_ob': 93, 'bull_adx_thresh': 24.336870590661267, 'bull_atr_min_pct': 0.017785251081406585, 'bull_atr_max_pct': 0.1482023584182231, 'bull_tp_mult': 2.4636269848293217, 'bull_tsl_mult': 0.7676782790116758, 'bull_time_stop': 57, 'bull_use_sma': True, 'bull_use_ema': False, 'bull_use_atr': True, 'bull_use_adx': True, 'bull_use_spike': True, 'bull_rsi_required': False, 'bear_strategy': 'mean_reversion', 'bear_bb_std_mult': 2.1725954932338873, 'bear_rsi_os': 27, 'bear_rsi_ob': 75, 'bear_adx_thresh': 29.5445133224538, 'bear_atr_min_pct': 0.002272396066019062, 'bear_atr_max_pct': 0.10172783421562824, 'bear_tp_mult': 1.4046680673071608, 'bear_tsl_mult': 0.7207758313460587, 'bear_time_stop': 84, 'bear_use_sma': True, 'bear_use_ema': True, 'bear_use_atr': False, 'bear_use_adx': True, 'bear_use_spike': True, 'bear_rsi_required': True, 'sideways_strategy': 'mean_reversion', 'sideways_bb_std_mult': 3.1919148293088218, 'sideways_rsi_os': 25, 'sideways_rsi_ob': 75, 'sideways_adx_thresh': 9.60026661736295, 'sideways_atr_min_pct': 0.00983022339566705, 'sideways_atr_max_pct': 0.11693641213449198, 'sideways_tp_mult': 1.3625819238563575, 'sideways_tsl_mult': 0.40522275450673256, 'sideways_time_stop': 123, 'sideways_use_sma': False, 'sideways_use_ema': False, 'sideways_use_atr': True, 'sideways_use_adx': True, 'sideways_use_spike': True, 'sideways_rsi_required': True}.
[I 2025-08-30 16:07:38,820] Trial 663 finished with values: [-0.016412605928442292, 0.016285917055782785] and parameters: {'p_sma': 31, 'p_std': 21, 'p_atr': 13, 'p_adx': 26, 'rsi_period': 7, 'ema1': 26, 'ema2': 37, 'slip_atr_k': 4.681863013521881e-05, 'slip_spread_k': 0.7284050607370277, 'spread_hl_frac': 0.0072867482841359275, 'bb_std_mult': 0.7320917703276447, 'rsi_os': 27, 'rsi_ob': 87, 'vol_spike': 0.20210999955838163, 'adx_thresh': 6.964845547142336, 'atr_min_pct': 0.007679357076548811, 'atr_max_pct': 0.11874102468484747, 'tp_mult': 1.4117683466165047, 'tsl_mult': 0.39090337488530996, 'strategy': 'mean_reversion', 'time_stop': 145, 'use_sma': True, 'use_atr': True, 'use_adx': True, 'use_ema': True, 'use_spike': False, 'rsi_required': False, 'edge_k': 1.2240748750240358, 'edge_cap': 0.9797055460139612, 'bull_strategy': 'mean_reversion', 'bull_bb_std_mult': 1.6529344703064306, 'bull_rsi_os': 48, 'bull_rsi_ob': 91, 'bull_adx_thresh': 9.955931766923035, 'bull_atr_min_pct': 0.017751516301508556, 'bull_atr_max_pct': 0.10020388997535756, 'bull_tp_mult': 2.470742001367908, 'bull_tsl_mult': 0.898014782554071, 'bull_time_stop': 56, 'bull_use_sma': False, 'bull_use_ema': False, 'bull_use_atr': True, 'bull_use_adx': True, 'bull_use_spike': True, 'bull_rsi_required': False, 'bear_strategy': 'breakout', 'bear_bb_std_mult': 1.5462559044810653, 'bear_rsi_os': 27, 'bear_rsi_ob': 75, 'bear_adx_thresh': 16.888206704650027, 'bear_atr_min_pct': 0.000951685208254551, 'bear_atr_max_pct': 0.10498517112870019, 'bear_tp_mult': 1.4001405837740637, 'bear_tsl_mult': 0.46980697985540215, 'bear_time_stop': 84, 'bear_use_sma': False, 'bear_use_ema': True, 'bear_use_atr': False, 'bear_use_adx': True, 'bear_use_spike': True, 'bear_rsi_required': True, 'sideways_strategy': 'mean_reversion', 'sideways_bb_std_mult': 3.1927708257808907, 'sideways_rsi_os': 13, 'sideways_rsi_ob': 75, 'sideways_adx_thresh': 9.766378251519882, 'sideways_atr_min_pct': 0.007345422482314048, 'sideways_atr_max_pct': 0.11676554209562276, 'sideways_tp_mult': 1.3553556389197832, 'sideways_tsl_mult': 0.3987219507830986, 'sideways_time_stop': 239, 'sideways_use_sma': False, 'sideways_use_ema': False, 'sideways_use_atr': True, 'sideways_use_adx': False, 'sideways_use_spike': True, 'sideways_rsi_required': False}.
[I 2025-08-30 16:07:40,147] Trial 667 finished with values: [-1000000000.0, 1000000000.0] and parameters: {'p_sma': 7, 'p_std': 19, 'p_atr': 13, 'p_adx': 19, 'rsi_period': 9, 'ema1': 8, 'ema2': 37, 'slip_atr_k': 0.04626847124744099, 'slip_spread_k': 0.8133233347346516, 'spread_hl_frac': 0.045136653911479835, 'bb_std_mult': 0.8175262402492498, 'rsi_os': 52, 'rsi_ob': 49, 'vol_spike': 0.22659734846075785, 'adx_thresh': 8.23293544523963, 'atr_min_pct': 0.005252021361672136, 'atr_max_pct': 0.11457879545421516, 'tp_mult': 1.502650964216152, 'tsl_mult': 0.38634334138867843, 'strategy': 'mean_reversion', 'time_stop': 153, 'use_sma': True, 'use_atr': False, 'use_adx': False, 'use_ema': True, 'use_spike': True, 'rsi_required': False, 'edge_k': 1.931578582340073, 'edge_cap': 0.9813053866585776, 'bull_strategy': 'mean_reversion', 'bull_bb_std_mult': 3.515564377366651, 'bull_rsi_os': 50, 'bull_rsi_ob': 69, 'bull_adx_thresh': 11.045170959467999, 'bull_atr_min_pct': 0.023334264320222002, 'bull_atr_max_pct': 0.1377173117941716, 'bull_tp_mult': 2.5207578122217593, 'bull_tsl_mult': 0.5233308554816606, 'bull_time_stop': 11, 'bull_use_sma': False, 'bull_use_ema': True, 'bull_use_atr': False, 'bull_use_adx': True, 'bull_use_spike': False, 'bull_rsi_required': False, 'bear_strategy': 'breakout', 'bear_bb_std_mult': 1.20598610730637, 'bear_rsi_os': 9, 'bear_rsi_ob': 77, 'bear_adx_thresh': 23.776387909920405, 'bear_atr_min_pct': 0.0009372325602000498, 'bear_atr_max_pct': 0.10608844491420105, 'bear_tp_mult': 2.0686786729286624, 'bear_tsl_mult': 0.46775655271542194, 'bear_time_stop': 75, 'bear_use_sma': False, 'bear_use_ema': False, 'bear_use_atr': True, 'bear_use_adx': True, 'bear_use_spike': True, 'bear_rsi_required': True, 'sideways_strategy': 'breakout', 'sideways_bb_std_mult': 2.202790486730649, 'sideways_rsi_os': 22, 'sideways_rsi_ob': 80, 'sideways_adx_thresh': 12.842655885675331, 'sideways_atr_min_pct': 0.021185117654744456, 'sideways_atr_max_pct': 0.07217861351220663, 'sideways_tp_mult': 1.4395364817136995, 'sideways_tsl_mult': 0.5538923998301776, 'sideways_time_stop': 26, 'sideways_use_sma': True, 'sideways_use_ema': False, 'sideways_use_atr': True, 'sideways_use_adx': False, 'sideways_use_spike': True, 'sideways_rsi_required': False}.
