[I 2025-08-30 14:36:33,574] Trial 126 finished with values: [-1000000000.0, 1000000000.0] and parameters: {'p_sma': 42, 'p_std': 10, 'p_atr': 10, 'p_adx': 22, 'rsi_period': 37, 'ema1': 6, 'ema2': 29, 'slip_atr_k': 0.11325848952416877, 'slip_spread_k': 0.6145147085702448, 'spread_hl_frac': 0.04883350459918396, 'bb_std_mult': 2.785623226183489, 'rsi_os': 21, 'rsi_ob': 79, 'vol_spike': 0.103933477572458, 'adx_thresh': 18.974653984836646, 'atr_min_pct': 0.026844105200221714, 'atr_max_pct': 0.13684740550643337, 'tp_mult': 1.0659845336338962, 'tsl_mult': 0.6022661153036442, 'strategy': 'mean_reversion', 'time_stop': 300, 'use_sma': True, 'use_atr': True, 'use_adx': False, 'use_ema': True, 'use_spike': True, 'rsi_required': True, 'edge_k': 0.20471061857877848, 'edge_cap': 0.4267856972364139, 'bull_strategy': 'mean_reversion', 'bull_bb_std_mult': 0.5874646032416314, 'bull_rsi_os': 45, 'bull_rsi_ob': 62, 'bull_adx_thresh': 23.19457923827472, 'bull_atr_min_pct': 0.014879679149582783, 'bull_atr_max_pct': 0.05021359814175534, 'bull_tp_mult': 2.176224736534605, 'bull_tsl_mult': 0.31816620286548253, 'bull_time_stop': 98, 'bull_use_sma': False, 'bull_use_ema': False, 'bull_use_atr': False, 'bull_use_adx': True, 'bull_use_spike': False, 'bull_rsi_required': True, 'bear_strategy': 'breakout', 'bear_bb_std_mult': 2.436559990053089, 'bear_rsi_os': 23, 'bear_rsi_ob': 75, 'bear_adx_thresh': 6.964049200696762, 'bear_atr_min_pct': 0.024700744432615437, 'bear_atr_max_pct': 0.14695571305212146, 'bear_tp_mult': 1.8660404643965014, 'bear_tsl_mult': 0.16477304026336703, 'bear_time_stop': 48, 'bear_use_sma': False, 'bear_use_ema': False, 'bear_use_atr': False, 'bear_use_adx': True, 'bear_use_spike': False, 'bear_rsi_required': False, 'sideways_strategy': 'mean_reversion', 'sideways_bb_std_mult': 1.8192333616968888, 'sideways_rsi_os': 46, 'sideways_rsi_ob': 48, 'sideways_adx_thresh': 21.41922695672108, 'sideways_atr_min_pct': 0.013454653508798022, 'sideways_atr_max_pct': 0.023309585078469183, 'sideways_tp_mult': 2.896220691803218, 'sideways_tsl_mult': 0.7371820502877594, 'sideways_time_stop': 57, 'sideways_use_sma': False, 'sideways_use_ema': True, 'sideways_use_atr': False, 'sideways_use_adx': False, 'sideways_use_spike': False, 'sideways_rsi_required': False}.
[I 2025-08-30 14:36:33,780] Trial 128 finished with values: [-1000000000.0, 1000000000.0] and parameters: {'p_sma': 42, 'p_std': 10, 'p_atr': 10, 'p_adx': 9, 'rsi_period': 37, 'ema1': 26, 'ema2': 29, 'slip_atr_k': 0.19461003110025366, 'slip_spread_k': 0.8762579117897591, 'spread_hl_frac': 0.04265440613183107, 'bb_std_mult': 2.732009547720062, 'rsi_os': 21, 'rsi_ob': 79, 'vol_spike': 0.10505038369868963, 'adx_thresh': 18.954675434253993, 'atr_min_pct': 0.02699337408988993, 'atr_max_pct': 0.027283158243127763, 'tp_mult': 1.0612575824906534, 'tsl_mult': 0.9015654807072454, 'strategy': 'mean_reversion', 'time_stop': 277, 'use_sma': True, 'use_atr': True, 'use_adx': False, 'use_ema': True, 'use_spike': True, 'rsi_required': False, 'edge_k': 1.7593691315821445, 'edge_cap': 0.4209674797000687, 'bull_strategy': 'mean_reversion', 'bull_bb_std_mult': 1.4400824596839468, 'bull_rsi_os': 42, 'bull_rsi_ob': 62, 'bull_adx_thresh': 23.09696171273625, 'bull_atr_min_pct': 0.0070486588743928465, 'bull_atr_max_pct': 0.0728318493730732, 'bull_tp_mult': 1.4623269492395266, 'bull_tsl_mult': 0.32461893180385315, 'bull_time_stop': 96, 'bull_use_sma': False, 'bull_use_ema': False, 'bull_use_atr': False, 'bull_use_adx': True, 'bull_use_spike': False, 'bull_rsi_required': True, 'bear_strategy': 'breakout', 'bear_bb_std_mult': 2.86211105293484, 'bear_rsi_os': 24, 'bear_rsi_ob': 76, 'bear_adx_thresh': 29.057185861225538, 'bear_atr_min_pct': 0.024230767327294584, 'bear_atr_max_pct': 0.14686430269984446, 'bear_tp_mult': 2.7763272638430316, 'bear_tsl_mult': 0.22993468520216565, 'bear_time_stop': 141, 'bear_use_sma': False, 'bear_use_ema': False, 'bear_use_atr': False, 'bear_use_adx': True, 'bear_use_spike': False, 'bear_rsi_required': False, 'sideways_strategy': 'mean_reversion', 'sideways_bb_std_mult': 1.8111094316764753, 'sideways_rsi_os': 46, 'sideways_rsi_ob': 72, 'sideways_adx_thresh': 21.479447825536717, 'sideways_atr_min_pct': 0.01848937633308597, 'sideways_atr_max_pct': 0.02355998474190516, 'sideways_tp_mult': 2.0334131977310794, 'sideways_tsl_mult': 0.6058211352198374, 'sideways_time_stop': 59, 'sideways_use_sma': False, 'sideways_use_ema': False, 'sideways_use_atr': False, 'sideways_use_adx': True, 'sideways_use_spike': True, 'sideways_rsi_required': False}.
[I 2025-08-30 14:36:34,070] Trial 127 finished with values: [-1000000000.0, 1000000000.0] and parameters: {'p_sma': 44, 'p_std': 10, 'p_atr': 11, 'p_adx': 17, 'rsi_period': 21, 'ema1': 22, 'ema2': 58, 'slip_atr_k': 0.09298356787254212, 'slip_spread_k': 0.8760304173328108, 'spread_hl_frac': 0.04263173896806157, 'bb_std_mult': 2.8127727791731996, 'rsi_os': 36, 'rsi_ob': 79, 'vol_spike': 0.04319901695371705, 'adx_thresh': 19.113759583594472, 'atr_min_pct': 0.02687663610607297, 'atr_max_pct': 0.09861428999593883, 'tp_mult': 1.740004936085679, 'tsl_mult': 0.25078070633297184, 'strategy': 'mean_reversion', 'time_stop': 25, 'use_sma': True, 'use_atr': True, 'use_adx': False, 'use_ema': True, 'use_spike': True, 'rsi_required': False, 'edge_k': 0.20526473226679864, 'edge_cap': 0.69852004120839, 'bull_strategy': 'mean_reversion', 'bull_bb_std_mult': 0.5747475779585267, 'bull_rsi_os': 46, 'bull_rsi_ob': 83, 'bull_adx_thresh': 24.159457015277404, 'bull_atr_min_pct': 0.006989429672832802, 'bull_atr_max_pct': 0.07301666658979457, 'bull_tp_mult': 2.177050198079467, 'bull_tsl_mult': 0.3203411199199337, 'bull_time_stop': 100, 'bull_use_sma': False, 'bull_use_ema': False, 'bull_use_atr': False, 'bull_use_adx': True, 'bull_use_spike': False, 'bull_rsi_required': True, 'bear_strategy': 'breakout', 'bear_bb_std_mult': 0.6784069741064143, 'bear_rsi_os': 24, 'bear_rsi_ob': 67, 'bear_adx_thresh': 7.364354184351441, 'bear_atr_min_pct': 0.02493635221243045, 'bear_atr_max_pct': 0.13583099736195775, 'bear_tp_mult': 2.630595919245126, 'bear_tsl_mult': 0.04066414067259028, 'bear_time_stop': 141, 'bear_use_sma': False, 'bear_use_ema': False, 'bear_use_atr': False, 'bear_use_adx': True, 'bear_use_spike': False, 'bear_rsi_required': False, 'sideways_strategy': 'mean_reversion', 'sideways_bb_std_mult': 1.590844598680917, 'sideways_rsi_os': 25, 'sideways_rsi_ob': 71, 'sideways_adx_thresh': 21.31533446419619, 'sideways_atr_min_pct': 0.012928874103248193, 'sideways_atr_max_pct': 0.1423254770126598, 'sideways_tp_mult': 1.9624117820894191, 'sideways_tsl_mult': 0.6091659929763505, 'sideways_time_stop': 176, 'sideways_use_sma': False, 'sideways_use_ema': True, 'sideways_use_atr': False, 'sideways_use_adx': False, 'sideways_use_spike': False, 'sideways_rsi_required': False}.
[I 2025-08-30 14:36:34,530] Trial 130 finished with values: [-1000000000.0, 1000000000.0] and parameters: {'p_sma': 37, 'p_std': 6, 'p_atr': 11, 'p_adx': 9, 'rsi_period': 33, 'ema1': 18, 'ema2': 31, 'slip_atr_k': 0.09398102492890961, 'slip_spread_k': 0.2169519199877752, 'spread_hl_frac': 0.04650570003935108, 'bb_std_mult': 1.5488411226187386, 'rsi_os': 35, 'rsi_ob': 76, 'vol_spike': 0.044952080305987845, 'adx_thresh': 20.743840344330902, 'atr_min_pct': 0.027606990617888252, 'atr_max_pct': 0.02674670450996612, 'tp_mult': 1.292513227923326, 'tsl_mult': 0.5749195244423828, 'strategy': 'mean_reversion', 'time_stop': 279, 'use_sma': True, 'use_atr': True, 'use_adx': True, 'use_ema': True, 'use_spike': True, 'rsi_required': False, 'edge_k': 1.9703368203684393, 'edge_cap': 0.38832249666900587, 'bull_strategy': 'breakout', 'bull_bb_std_mult': 3.2781790913488678, 'bull_rsi_os': 35, 'bull_rsi_ob': 83, 'bull_adx_thresh': 24.876153980931573, 'bull_atr_min_pct': 0.019056258171082443, 'bull_atr_max_pct': 0.09705848581940776, 'bull_tp_mult': 1.970302249327363, 'bull_tsl_mult': 0.27717796027095426, 'bull_time_stop': 281, 'bull_use_sma': False, 'bull_use_ema': False, 'bull_use_atr': False, 'bull_use_adx': True, 'bull_use_spike': False, 'bull_rsi_required': True, 'bear_strategy': 'mean_reversion', 'bear_bb_std_mult': 1.0485434581210866, 'bear_rsi_os': 24, 'bear_rsi_ob': 67, 'bear_adx_thresh': 29.45197090304712, 'bear_atr_min_pct': 0.01164107321262187, 'bear_atr_max_pct': 0.030222923601130387, 'bear_tp_mult': 2.7768851483648254, 'bear_tsl_mult': 0.8310299181626911, 'bear_time_stop': 142, 'bear_use_sma': False, 'bear_use_ema': True, 'bear_use_atr': True, 'bear_use_adx': False, 'bear_use_spike': False, 'bear_rsi_required': False, 'sideways_strategy': 'breakout', 'sideways_bb_std_mult': 2.104966336860041, 'sideways_rsi_os': 35, 'sideways_rsi_ob': 52, 'sideways_adx_thresh': 30.99251710196683, 'sideways_atr_min_pct': 0.024278371380659167, 'sideways_atr_max_pct': 0.14109189940693298, 'sideways_tp_mult': 2.5980352309110644, 'sideways_tsl_mult': 0.22865407188561776, 'sideways_time_stop': 165, 'sideways_use_sma': False, 'sideways_use_ema': False, 'sideways_use_atr': False, 'sideways_use_adx': True, 'sideways_use_spike': True, 'sideways_rsi_required': False}.
[I 2025-08-30 14:37:05,481] Trial 133 finished with values: [-1000000000.0, 1000000000.0] and parameters: {'p_sma': 18, 'p_std': 12, 'p_atr': 12, 'p_adx': 19, 'rsi_period': 12, 'ema1': 16, 'ema2': 31, 'slip_atr_k': 0.1054019075825949, 'slip_spread_k': 0.5894862726014731, 'spread_hl_frac': 0.04018700217183089, 'bb_std_mult': 3.2412240296704753, 'rsi_os': 33, 'rsi_ob': 74, 'vol_spike': 0.15384401769770312, 'adx_thresh': 20.19747001935163, 'atr_min_pct': 0.013741469753909002, 'atr_max_pct': 0.04040919033235394, 'tp_mult': 2.724254699450381, 'tsl_mult': 0.1454992434570414, 'strategy': 'mean_reversion', 'time_stop': 286, 'use_sma': True, 'use_atr': True, 'use_adx': True, 'use_ema': True, 'use_spike': True, 'rsi_required': True, 'edge_k': 1.8369903141353305, 'edge_cap': 0.4461637493527219, 'bull_strategy': 'breakout', 'bull_bb_std_mult': 0.7019994386950741, 'bull_rsi_os': 15, 'bull_rsi_ob': 56, 'bull_adx_thresh': 14.613620909817627, 'bull_atr_min_pct': 0.008498040013778418, 'bull_atr_max_pct': 0.03299720886288578, 'bull_tp_mult': 1.4897773825632046, 'bull_tsl_mult': 0.29185122071962055, 'bull_time_stop': 70, 'bull_use_sma': False, 'bull_use_ema': False, 'bull_use_atr': True, 'bull_use_adx': True, 'bull_use_spike': False, 'bull_rsi_required': False, 'bear_strategy': 'mean_reversion', 'bear_bb_std_mult': 3.501230937376084, 'bear_rsi_os': 50, 'bear_rsi_ob': 72, 'bear_adx_thresh': 15.28585903985925, 'bear_atr_min_pct': 0.007353524323980801, 'bear_atr_max_pct': 0.14236587288385655, 'bear_tp_mult': 1.1032716532281648, 'bear_tsl_mult': 0.68072050189176, 'bear_time_stop': 90, 'bear_use_sma': False, 'bear_use_ema': True, 'bear_use_atr': True, 'bear_use_adx': False, 'bear_use_spike': False, 'bear_rsi_required': False, 'sideways_strategy': 'breakout', 'sideways_bb_std_mult': 2.127317407506276, 'sideways_rsi_os': 53, 'sideways_rsi_ob': 67, 'sideways_adx_thresh': 33.42051353773012, 'sideways_atr_min_pct': 0.008934428026812165, 'sideways_atr_max_pct': 0.015761667204976796, 'sideways_tp_mult': 2.180711929663063, 'sideways_tsl_mult': 0.27005693359231087, 'sideways_time_stop': 91, 'sideways_use_sma': False, 'sideways_use_ema': True, 'sideways_use_atr': False, 'sideways_use_adx': False, 'sideways_use_spike': False, 'sideways_rsi_required': False}.
[I 2025-08-30 14:37:05,482] Trial 129 finished with values: [-1000000000.0, 1000000000.0] and parameters: {'p_sma': 44, 'p_std': 6, 'p_atr': 12, 'p_adx': 19, 'rsi_period': 37, 'ema1': 22, 'ema2': 59, 'slip_atr_k': 0.11428969707675461, 'slip_spread_k': 0.5946900037194219, 'spread_hl_frac': 0.042471318033101696, 'bb_std_mult': 3.235772135275745, 'rsi_os': 18, 'rsi_ob': 79, 'vol_spike': 0.04224018101813437, 'adx_thresh': 6.35957606460182, 'atr_min_pct': 0.027827709149283918, 'atr_max_pct': 0.03863920466999724, 'tp_mult': 1.7216045327720064, 'tsl_mult': 0.595213216946364, 'strategy': 'mean_reversion', 'time_stop': 278, 'use_sma': True, 'use_atr': True, 'use_adx': True, 'use_ema': True, 'use_spike': True, 'rsi_required': False, 'edge_k': 0.22635802718788622, 'edge_cap': 0.6597302812761723, 'bull_strategy': 'breakout', 'bull_bb_std_mult': 1.0819158333594643, 'bull_rsi_os': 10, 'bull_rsi_ob': 83, 'bull_adx_thresh': 24.835886766724553, 'bull_atr_min_pct': 0.006602647727697239, 'bull_atr_max_pct': 0.0932852505961863, 'bull_tp_mult': 1.973389512117577, 'bull_tsl_mult': 0.3248157319639264, 'bull_time_stop': 111, 'bull_use_sma': False, 'bull_use_ema': False, 'bull_use_atr': False, 'bull_use_adx': True, 'bull_use_spike': False, 'bull_rsi_required': True, 'bear_strategy': 'mean_reversion', 'bear_bb_std_mult': 3.5763588257485335, 'bear_rsi_os': 33, 'bear_rsi_ob': 76, 'bear_adx_thresh': 27.432312371868804, 'bear_atr_min_pct': 0.010737970048302849, 'bear_atr_max_pct': 0.13577230290049155, 'bear_tp_mult': 1.0884846061104843, 'bear_tsl_mult': 0.16795928298995827, 'bear_time_stop': 6, 'bear_use_sma': False, 'bear_use_ema': False, 'bear_use_atr': True, 'bear_use_adx': True, 'bear_use_spike': False, 'bear_rsi_required': False, 'sideways_strategy': 'mean_reversion', 'sideways_bb_std_mult': 2.127016117597769, 'sideways_rsi_os': 46, 'sideways_rsi_ob': 65, 'sideways_adx_thresh': 31.038077511056645, 'sideways_atr_min_pct': 0.01351460794042297, 'sideways_atr_max_pct': 0.021907374799229676, 'sideways_tp_mult': 1.1150280200541753, 'sideways_tsl_mult': 0.22007059654294783, 'sideways_time_stop': 164, 'sideways_use_sma': False, 'sideways_use_ema': False, 'sideways_use_atr': False, 'sideways_use_adx': True, 'sideways_use_spike': True, 'sideways_rsi_required': False}.
[I 2025-08-30 14:37:05,755] Trial 132 finished with values: [-1000000000.0, 1000000000.0] and parameters: {'p_sma': 18, 'p_std': 12, 'p_atr': 16, 'p_adx': 8, 'rsi_period': 31, 'ema1': 16, 'ema2': 56, 'slip_atr_k': 0.05177692112659625, 'slip_spread_k': 0.5873877314945932, 'spread_hl_frac': 0.046025061855173584, 'bb_std_mult': 3.33188284672816, 'rsi_os': 33, 'rsi_ob': 76, 'vol_spike': 0.15439287433578786, 'adx_thresh': 6.386853069849227, 'atr_min_pct': 0.02770861159036917, 'atr_max_pct': 0.11106010638327495, 'tp_mult': 2.1766723012245075, 'tsl_mult': 0.4722406254030261, 'strategy': 'mean_reversion', 'time_stop': 101, 'use_sma': True, 'use_atr': True, 'use_adx': True, 'use_ema': True, 'use_spike': True, 'rsi_required': True, 'edge_k': 1.5454752421815394, 'edge_cap': 0.8245977487960747, 'bull_strategy': 'breakout', 'bull_bb_std_mult': 3.2725698794933753, 'bull_rsi_os': 49, 'bull_rsi_ob': 76, 'bull_adx_thresh': 24.778417528952016, 'bull_atr_min_pct': 0.018677898608869835, 'bull_atr_max_pct': 0.0959192516480513, 'bull_tp_mult': 2.471489589676982, 'bull_tsl_mult': 0.2782744880980976, 'bull_time_stop': 199, 'bull_use_sma': False, 'bull_use_ema': False, 'bull_use_atr': True, 'bull_use_adx': True, 'bull_use_spike': False, 'bull_rsi_required': False, 'bear_strategy': 'mean_reversion', 'bear_bb_std_mult': 3.5465125418957535, 'bear_rsi_os': 49, 'bear_rsi_ob': 72, 'bear_adx_thresh': 14.341693196971447, 'bear_atr_min_pct': 0.010490429297228317, 'bear_atr_max_pct': 0.03158462904066343, 'bear_tp_mult': 1.2276632775796008, 'bear_tsl_mult': 0.1766396209827884, 'bear_time_stop': 266, 'bear_use_sma': False, 'bear_use_ema': True, 'bear_use_atr': True, 'bear_use_adx': False, 'bear_use_spike': False, 'bear_rsi_required': False, 'sideways_strategy': 'breakout', 'sideways_bb_std_mult': 2.621132189492085, 'sideways_rsi_os': 29, 'sideways_rsi_ob': 67, 'sideways_adx_thresh': 19.95206068365315, 'sideways_atr_min_pct': 0.024473357158000995, 'sideways_atr_max_pct': 0.11987619342462894, 'sideways_tp_mult': 2.583941221771673, 'sideways_tsl_mult': 0.8245212484479431, 'sideways_time_stop': 20, 'sideways_use_sma': False, 'sideways_use_ema': False, 'sideways_use_atr': False, 'sideways_use_adx': True, 'sideways_use_spike': True, 'sideways_rsi_required': False}.
[I 2025-08-30 14:37:06,410] Trial 131 finished with values: [-1000000000.0, 1000000000.0] and parameters: {'p_sma': 37, 'p_std': 12, 'p_atr': 26, 'p_adx': 8, 'rsi_period': 33, 'ema1': 16, 'ema2': 57, 'slip_atr_k': 0.06411486971551406, 'slip_spread_k': 0.591627907585429, 'spread_hl_frac': 0.04713637438492879, 'bb_std_mult': 3.3362298424660537, 'rsi_os': 36, 'rsi_ob': 76, 'vol_spike': 0.04185854237854235, 'adx_thresh': 7.128794934780036, 'atr_min_pct': 0.027846882708810545, 'atr_max_pct': 0.039591180151834424, 'tp_mult': 1.2596055226712326, 'tsl_mult': 0.3505671935429956, 'strategy': 'mean_reversion', 'time_stop': 280, 'use_sma': True, 'use_atr': True, 'use_adx': True, 'use_ema': True, 'use_spike': True, 'rsi_required': False, 'edge_k': 1.4994808263025587, 'edge_cap': 0.3924016665661101, 'bull_strategy': 'breakout', 'bull_bb_std_mult': 0.6755611329473852, 'bull_rsi_os': 49, 'bull_rsi_ob': 83, 'bull_adx_thresh': 11.869146810272344, 'bull_atr_min_pct': 0.018521298524717518, 'bull_atr_max_pct': 0.09890565221052632, 'bull_tp_mult': 2.4895314715691086, 'bull_tsl_mult': 0.276540370036485, 'bull_time_stop': 110, 'bull_use_sma': False, 'bull_use_ema': False, 'bull_use_atr': True, 'bull_use_adx': True, 'bull_use_spike': False, 'bull_rsi_required': False, 'bear_strategy': 'mean_reversion', 'bear_bb_std_mult': 3.5412016742939016, 'bear_rsi_os': 16, 'bear_rsi_ob': 72, 'bear_adx_thresh': 27.557737457517, 'bear_atr_min_pct': 0.010494125088082956, 'bear_atr_max_pct': 0.13688201443503942, 'bear_tp_mult': 2.034812022800278, 'bear_tsl_mult': 0.5006799183820669, 'bear_time_stop': 269, 'bear_use_sma': False, 'bear_use_ema': True, 'bear_use_atr': True, 'bear_use_adx': False, 'bear_use_spike': False, 'bear_rsi_required': False, 'sideways_strategy': 'breakout', 'sideways_bb_std_mult': 2.117661200705083, 'sideways_rsi_os': 44, 'sideways_rsi_ob': 65, 'sideways_adx_thresh': 30.995471042117735, 'sideways_atr_min_pct': 0.024422131901757623, 'sideways_atr_max_pct': 0.015497607709287866, 'sideways_tp_mult': 2.805578707948582, 'sideways_tsl_mult': 0.8265009360926667, 'sideways_time_stop': 164, 'sideways_use_sma': False, 'sideways_use_ema': True, 'sideways_use_atr': False, 'sideways_use_adx': True, 'sideways_use_spike': True, 'sideways_rsi_required': False}.
[I 2025-08-30 14:37:38,400] Trial 134 finished with values: [-1000000000.0, 1000000000.0] and parameters: {'p_sma': 40, 'p_std': 37, 'p_atr': 16, 'p_adx': 8, 'rsi_period': 31, 'ema1': 16, 'ema2': 52, 'slip_atr_k': 0.06357820650403881, 'slip_spread_k': 0.5600561266837708, 'spread_hl_frac': 0.030742691069847172, 'bb_std_mult': 1.42409796278953, 'rsi_os': 16, 'rsi_ob': 76, 'vol_spike': 0.1334262566767183, 'adx_thresh': 29.08950926285492, 'atr_min_pct': 0.022532598771242997, 'atr_max_pct': 0.09082546988508772, 'tp_mult': 2.0566101321520702, 'tsl_mult': 0.07392888894144109, 'strategy': 'mean_reversion', 'time_stop': 176, 'use_sma': True, 'use_atr': True, 'use_adx': False, 'use_ema': False, 'use_spike': True, 'rsi_required': True, 'edge_k': 1.5555189810057208, 'edge_cap': 0.8203828155016462, 'bull_strategy': 'mean_reversion', 'bull_bb_std_mult': 3.023267674305716, 'bull_rsi_os': 48, 'bull_rsi_ob': 71, 'bull_adx_thresh': 18.57102099472877, 'bull_atr_min_pct': 0.0042919875254810004, 'bull_atr_max_pct': 0.019161654039798554, 'bull_tp_mult': 2.52074308988044, 'bull_tsl_mult': 0.26454012644525005, 'bull_time_stop': 151, 'bull_use_sma': False, 'bull_use_ema': False, 'bull_use_atr': True, 'bull_use_adx': True, 'bull_use_spike': True, 'bull_rsi_required': False, 'bear_strategy': 'breakout', 'bear_bb_std_mult': 0.9399185434105476, 'bear_rsi_os': 21, 'bear_rsi_ob': 80, 'bear_adx_thresh': 10.627263931505123, 'bear_atr_min_pct': 0.013027792478720593, 'bear_atr_max_pct': 0.058145869891410185, 'bear_tp_mult': 1.962445844916331, 'bear_tsl_mult': 0.5041353162385176, 'bear_time_stop': 270, 'bear_use_sma': False, 'bear_use_ema': True, 'bear_use_atr': False, 'bear_use_adx': False, 'bear_use_spike': False, 'bear_rsi_required': True, 'sideways_strategy': 'breakout', 'sideways_bb_std_mult': 1.9119970360732066, 'sideways_rsi_os': 44, 'sideways_rsi_ob': 45, 'sideways_adx_thresh': 14.909877693041883, 'sideways_atr_min_pct': 0.021460566067923664, 'sideways_atr_max_pct': 0.02742427416105774, 'sideways_tp_mult': 2.9252851284540595, 'sideways_tsl_mult': 0.8372718777201875, 'sideways_time_stop': 139, 'sideways_use_sma': False, 'sideways_use_ema': True, 'sideways_use_atr': False, 'sideways_use_adx': False, 'sideways_use_spike': False, 'sideways_rsi_required': True}.
