[I 2025-08-30 15:53:55,891] Trial 588 finished with values: [-1000000000.0, 1000000000.0] and parameters: {'p_sma': 7, 'p_std': 20, 'p_atr': 12, 'p_adx': 26, 'rsi_period': 9, 'ema1': 23, 'ema2': 39, 'slip_atr_k': 0.009343451738775337, 'slip_spread_k': 0.7135272180647838, 'spread_hl_frac': 0.0068282729287225475, 'bb_std_mult': 2.4610539106030918, 'rsi_os': 32, 'rsi_ob': 58, 'vol_spike': 0.07698614384640605, 'adx_thresh': 9.0769737601638, 'atr_min_pct': 0.016542650551001625, 'atr_max_pct': 0.11152810067661074, 'tp_mult': 1.4774211638384678, 'tsl_mult': 0.39457023026116433, 'strategy': 'mean_reversion', 'time_stop': 77, 'use_sma': False, 'use_atr': False, 'use_adx': True, 'use_ema': True, 'use_spike': True, 'rsi_required': False, 'edge_k': 0.5042142141481156, 'edge_cap': 0.9546671129209402, 'bull_strategy': 'mean_reversion', 'bull_bb_std_mult': 3.168959763792803, 'bull_rsi_os': 49, 'bull_rsi_ob': 58, 'bull_adx_thresh': 17.285177760556554, 'bull_atr_min_pct': 0.0207637186921388, 'bull_atr_max_pct': 0.10798434653257694, 'bull_tp_mult': 2.60041253136579, 'bull_tsl_mult': 0.646822866898825, 'bull_time_stop': 229, 'bull_use_sma': True, 'bull_use_ema': True, 'bull_use_atr': True, 'bull_use_adx': True, 'bull_use_spike': False, 'bull_rsi_required': False, 'bear_strategy': 'breakout', 'bear_bb_std_mult': 2.0020948044488733, 'bear_rsi_os': 23, 'bear_rsi_ob': 73, 'bear_adx_thresh': 34.99886420914308, 'bear_atr_min_pct': 0.006091473817967029, 'bear_atr_max_pct': 0.1036562257913764, 'bear_tp_mult': 2.6524037674684204, 'bear_tsl_mult': 0.3409877448606905, 'bear_time_stop': 89, 'bear_use_sma': True, 'bear_use_ema': False, 'bear_use_atr': True, 'bear_use_adx': False, 'bear_use_spike': True, 'bear_rsi_required': True, 'sideways_strategy': 'mean_reversion', 'sideways_bb_std_mult': 2.9686370820591312, 'sideways_rsi_os': 22, 'sideways_rsi_ob': 75, 'sideways_adx_thresh': 11.567261658999138, 'sideways_atr_min_pct': 0.021132651159133837, 'sideways_atr_max_pct': 0.0649453238818195, 'sideways_tp_mult': 1.9540745109840139, 'sideways_tsl_mult': 0.3199023336272258, 'sideways_time_stop': 117, 'sideways_use_sma': True, 'sideways_use_ema': False, 'sideways_use_atr': True, 'sideways_use_adx': True, 'sideways_use_spike': True, 'sideways_rsi_required': True}.
[I 2025-08-30 15:53:56,321] Trial 586 finished with values: [-1000000000.0, 1000000000.0] and parameters: {'p_sma': 55, 'p_std': 21, 'p_atr': 8, 'p_adx': 26, 'rsi_period': 9, 'ema1': 23, 'ema2': 38, 'slip_atr_k': 0.1562482447536849, 'slip_spread_k': 0.7502292950971206, 'spread_hl_frac': 0.02371565777658535, 'bb_std_mult': 0.6586308831410779, 'rsi_os': 30, 'rsi_ob': 85, 'vol_spike': 0.07613192932726949, 'adx_thresh': 21.97915183220773, 'atr_min_pct': 0.00626482326054019, 'atr_max_pct': 0.11099782775290763, 'tp_mult': 1.5751069509582307, 'tsl_mult': 0.8539539346672596, 'strategy': 'mean_reversion', 'time_stop': 148, 'use_sma': False, 'use_atr': False, 'use_adx': True, 'use_ema': True, 'use_spike': False, 'rsi_required': False, 'edge_k': 0.5172584166720289, 'edge_cap': 0.9577655754619984, 'bull_strategy': 'mean_reversion', 'bull_bb_std_mult': 2.9987407804087436, 'bull_rsi_os': 49, 'bull_rsi_ob': 88, 'bull_adx_thresh': 8.461177636242182, 'bull_atr_min_pct': 0.028158399521499997, 'bull_atr_max_pct': 0.10848713603191024, 'bull_tp_mult': 2.1625521420486393, 'bull_tsl_mult': 0.2677947301850554, 'bull_time_stop': 42, 'bull_use_sma': True, 'bull_use_ema': True, 'bull_use_atr': True, 'bull_use_adx': True, 'bull_use_spike': False, 'bull_rsi_required': False, 'bear_strategy': 'breakout', 'bear_bb_std_mult': 1.9719942127739267, 'bear_rsi_os': 25, 'bear_rsi_ob': 45, 'bear_adx_thresh': 31.71645858479767, 'bear_atr_min_pct': 0.002690962854789189, 'bear_atr_max_pct': 0.10418320419467282, 'bear_tp_mult': 2.7387109292314813, 'bear_tsl_mult': 0.42041184449015967, 'bear_time_stop': 234, 'bear_use_sma': True, 'bear_use_ema': False, 'bear_use_atr': True, 'bear_use_adx': True, 'bear_use_spike': True, 'bear_rsi_required': True, 'sideways_strategy': 'mean_reversion', 'sideways_bb_std_mult': 2.954752535684309, 'sideways_rsi_os': 26, 'sideways_rsi_ob': 77, 'sideways_adx_thresh': 11.390931988088045, 'sideways_atr_min_pct': 0.01946190301247577, 'sideways_atr_max_pct': 0.06538003904163868, 'sideways_tp_mult': 1.9323085628027459, 'sideways_tsl_mult': 0.23404528715043166, 'sideways_time_stop': 201, 'sideways_use_sma': True, 'sideways_use_ema': False, 'sideways_use_atr': True, 'sideways_use_adx': True, 'sideways_use_spike': True, 'sideways_rsi_required': True}.
[I 2025-08-30 15:53:56,743] Trial 587 finished with values: [-1000000000.0, 1000000000.0] and parameters: {'p_sma': 7, 'p_std': 21, 'p_atr': 11, 'p_adx': 26, 'rsi_period': 9, 'ema1': 23, 'ema2': 36, 'slip_atr_k': 0.00949849105904832, 'slip_spread_k': 0.752647786125847, 'spread_hl_frac': 0.036370928541559364, 'bb_std_mult': 0.7800367271442716, 'rsi_os': 28, 'rsi_ob': 84, 'vol_spike': 0.21852466775387358, 'adx_thresh': 33.51352485153188, 'atr_min_pct': 0.006668255142127233, 'atr_max_pct': 0.11279687967639293, 'tp_mult': 1.382135557940969, 'tsl_mult': 0.16694123469865058, 'strategy': 'mean_reversion', 'time_stop': 148, 'use_sma': False, 'use_atr': False, 'use_adx': True, 'use_ema': True, 'use_spike': False, 'rsi_required': False, 'edge_k': 0.7143038649721813, 'edge_cap': 0.9514782134374532, 'bull_strategy': 'mean_reversion', 'bull_bb_std_mult': 1.541233090383248, 'bull_rsi_os': 49, 'bull_rsi_ob': 88, 'bull_adx_thresh': 8.340026233208429, 'bull_atr_min_pct': 0.020792360110135372, 'bull_atr_max_pct': 0.10833057805551398, 'bull_tp_mult': 2.614742246916481, 'bull_tsl_mult': 0.8684512336226953, 'bull_time_stop': 45, 'bull_use_sma': True, 'bull_use_ema': True, 'bull_use_atr': True, 'bull_use_adx': True, 'bull_use_spike': False, 'bull_rsi_required': False, 'bear_strategy': 'breakout', 'bear_bb_std_mult': 1.992560406167551, 'bear_rsi_os': 25, 'bear_rsi_ob': 73, 'bear_adx_thresh': 30.991781058316093, 'bear_atr_min_pct': 0.003485823157752936, 'bear_atr_max_pct': 0.10389260523353082, 'bear_tp_mult': 2.7292133917791785, 'bear_tsl_mult': 0.4646607555191767, 'bear_time_stop': 89, 'bear_use_sma': True, 'bear_use_ema': False, 'bear_use_atr': True, 'bear_use_adx': True, 'bear_use_spike': True, 'bear_rsi_required': True, 'sideways_strategy': 'mean_reversion', 'sideways_bb_std_mult': 3.064587723758085, 'sideways_rsi_os': 21, 'sideways_rsi_ob': 86, 'sideways_adx_thresh': 11.67460702656103, 'sideways_atr_min_pct': 0.01942817264562842, 'sideways_atr_max_pct': 0.06609013375170497, 'sideways_tp_mult': 1.0704354288743396, 'sideways_tsl_mult': 0.05274456794643023, 'sideways_time_stop': 117, 'sideways_use_sma': True, 'sideways_use_ema': False, 'sideways_use_atr': True, 'sideways_use_adx': True, 'sideways_use_spike': True, 'sideways_rsi_required': True}.
[I 2025-08-30 15:53:57,014] Trial 585 finished with values: [-1000000000.0, 1000000000.0] and parameters: {'p_sma': 10, 'p_std': 21, 'p_atr': 11, 'p_adx': 26, 'rsi_period': 37, 'ema1': 23, 'ema2': 15, 'slip_atr_k': 0.004513407712641299, 'slip_spread_k': 0.7101163080465346, 'spread_hl_frac': 0.03773171905147736, 'bb_std_mult': 0.7741755437541916, 'rsi_os': 39, 'rsi_ob': 85, 'vol_spike': 0.20250782191185607, 'adx_thresh': 9.236064328145735, 'atr_min_pct': 0.006406345754422439, 'atr_max_pct': 0.111716934949366, 'tp_mult': 1.6041693175071376, 'tsl_mult': 0.16030719178177966, 'strategy': 'mean_reversion', 'time_stop': 150, 'use_sma': False, 'use_atr': True, 'use_adx': True, 'use_ema': True, 'use_spike': False, 'rsi_required': False, 'edge_k': 0.6413263293304658, 'edge_cap': 0.12377261133257866, 'bull_strategy': 'mean_reversion', 'bull_bb_std_mult': 0.9846779005891866, 'bull_rsi_os': 49, 'bull_rsi_ob': 90, 'bull_adx_thresh': 8.103563435204263, 'bull_atr_min_pct': 0.028146912878817452, 'bull_atr_max_pct': 0.1084404137461913, 'bull_tp_mult': 1.4387985098358336, 'bull_tsl_mult': 0.5551951084342155, 'bull_time_stop': 60, 'bull_use_sma': False, 'bull_use_ema': True, 'bull_use_atr': True, 'bull_use_adx': True, 'bull_use_spike': True, 'bull_rsi_required': False, 'bear_strategy': 'breakout', 'bear_bb_std_mult': 1.9938271067688416, 'bear_rsi_os': 25, 'bear_rsi_ob': 45, 'bear_adx_thresh': 34.871891632426085, 'bear_atr_min_pct': 0.0026658883022157927, 'bear_atr_max_pct': 0.05161357222050139, 'bear_tp_mult': 2.7313458896922027, 'bear_tsl_mult': 0.8115769285081348, 'bear_time_stop': 215, 'bear_use_sma': True, 'bear_use_ema': False, 'bear_use_atr': False, 'bear_use_adx': False, 'bear_use_spike': True, 'bear_rsi_required': True, 'sideways_strategy': 'mean_reversion', 'sideways_bb_std_mult': 3.021167165176435, 'sideways_rsi_os': 22, 'sideways_rsi_ob': 78, 'sideways_adx_thresh': 27.43045258926835, 'sideways_atr_min_pct': 0.012479621152129562, 'sideways_atr_max_pct': 0.1477045634662465, 'sideways_tp_mult': 1.0718591200381187, 'sideways_tsl_mult': 0.3767812271159011, 'sideways_time_stop': 203, 'sideways_use_sma': True, 'sideways_use_ema': False, 'sideways_use_atr': True, 'sideways_use_adx': True, 'sideways_use_spike': True, 'sideways_rsi_required': True}.
[I 2025-08-30 15:54:40,465] Trial 590 finished with values: [-1000000000.0, 1000000000.0] and parameters: {'p_sma': 8, 'p_std': 22, 'p_atr': 12, 'p_adx': 25, 'rsi_period': 15, 'ema1': 25, 'ema2': 36, 'slip_atr_k': 3.408608889765395e-05, 'slip_spread_k': 0.707313174094131, 'spread_hl_frac': 0.04460603536462278, 'bb_std_mult': 0.7981174800894196, 'rsi_os': 27, 'rsi_ob': 80, 'vol_spike': 0.1305004467915506, 'adx_thresh': 8.502624908129707, 'atr_min_pct': 0.006692092580362608, 'atr_max_pct': 0.11452460103172102, 'tp_mult': 1.376088805762655, 'tsl_mult': 0.1729948658488375, 'strategy': 'breakout', 'time_stop': 154, 'use_sma': False, 'use_atr': False, 'use_adx': True, 'use_ema': False, 'use_spike': False, 'rsi_required': True, 'edge_k': 0.7272993220471313, 'edge_cap': 0.9350933516432235, 'bull_strategy': 'breakout', 'bull_bb_std_mult': 1.5927532009937773, 'bull_rsi_os': 47, 'bull_rsi_ob': 90, 'bull_adx_thresh': 6.919595897262811, 'bull_atr_min_pct': 0.029948548966367047, 'bull_atr_max_pct': 0.10563966319229515, 'bull_tp_mult': 1.9389414570394063, 'bull_tsl_mult': 0.8734101533730526, 'bull_time_stop': 50, 'bull_use_sma': True, 'bull_use_ema': True, 'bull_use_atr': True, 'bull_use_adx': True, 'bull_use_spike': True, 'bull_rsi_required': False, 'bear_strategy': 'mean_reversion', 'bear_bb_std_mult': 1.8505786086214837, 'bear_rsi_os': 27, 'bear_rsi_ob': 47, 'bear_adx_thresh': 14.784761954976807, 'bear_atr_min_pct': 0.01762990541252988, 'bear_atr_max_pct': 0.11754698204571482, 'bear_tp_mult': 1.4446487197055677, 'bear_tsl_mult': 0.015404646299607694, 'bear_time_stop': 44, 'bear_use_sma': True, 'bear_use_ema': False, 'bear_use_atr': True, 'bear_use_adx': True, 'bear_use_spike': True, 'bear_rsi_required': False, 'sideways_strategy': 'mean_reversion', 'sideways_bb_std_mult': 3.052324791428002, 'sideways_rsi_os': 17, 'sideways_rsi_ob': 82, 'sideways_adx_thresh': 27.202808359273142, 'sideways_atr_min_pct': 0.01147243383231484, 'sideways_atr_max_pct': 0.13675245331026054, 'sideways_tp_mult': 1.1350367437382451, 'sideways_tsl_mult': 0.447654919957734, 'sideways_time_stop': 65, 'sideways_use_sma': True, 'sideways_use_ema': False, 'sideways_use_atr': True, 'sideways_use_adx': True, 'sideways_use_spike': True, 'sideways_rsi_required': True}.
[I 2025-08-30 15:54:40,977] Trial 589 finished with values: [-1000000000.0, 1000000000.0] and parameters: {'p_sma': 56, 'p_std': 22, 'p_atr': 14, 'p_adx': 26, 'rsi_period': 15, 'ema1': 23, 'ema2': 36, 'slip_atr_k': 0.004114803315690594, 'slip_spread_k': 0.7467073646089053, 'spread_hl_frac': 0.007354502430909686, 'bb_std_mult': 0.772829707177715, 'rsi_os': 29, 'rsi_ob': 84, 'vol_spike': 0.21746809117260502, 'adx_thresh': 8.488561883753516, 'atr_min_pct': 0.0066503084017300205, 'atr_max_pct': 0.11435173781358446, 'tp_mult': 1.3840316382987488, 'tsl_mult': 0.15854456888296115, 'strategy': 'mean_reversion', 'time_stop': 155, 'use_sma': False, 'use_atr': False, 'use_adx': True, 'use_ema': True, 'use_spike': False, 'rsi_required': False, 'edge_k': 0.7313284323364897, 'edge_cap': 0.9257971781949927, 'bull_strategy': 'mean_reversion', 'bull_bb_std_mult': 1.5864763106755775, 'bull_rsi_os': 49, 'bull_rsi_ob': 90, 'bull_adx_thresh': 8.33127122320671, 'bull_atr_min_pct': 0.01524057601579434, 'bull_atr_max_pct': 0.10654114470052219, 'bull_tp_mult': 1.9989881042856847, 'bull_tsl_mult': 0.26473888039948645, 'bull_time_stop': 213, 'bull_use_sma': True, 'bull_use_ema': True, 'bull_use_atr': True, 'bull_use_adx': True, 'bull_use_spike': False, 'bull_rsi_required': False, 'bear_strategy': 'breakout', 'bear_bb_std_mult': 1.9611731788958613, 'bear_rsi_os': 25, 'bear_rsi_ob': 68, 'bear_adx_thresh': 31.44412814512988, 'bear_atr_min_pct': 0.01911557583017961, 'bear_atr_max_pct': 0.06591319067108688, 'bear_tp_mult': 1.4503099671363646, 'bear_tsl_mult': 0.004784722238447892, 'bear_time_stop': 46, 'bear_use_sma': True, 'bear_use_ema': False, 'bear_use_atr': True, 'bear_use_adx': True, 'bear_use_spike': True, 'bear_rsi_required': True, 'sideways_strategy': 'mean_reversion', 'sideways_bb_std_mult': 2.3410106967301214, 'sideways_rsi_os': 26, 'sideways_rsi_ob': 91, 'sideways_adx_thresh': 12.660871749489779, 'sideways_atr_min_pct': 0.019497986429926714, 'sideways_atr_max_pct': 0.07425593702764716, 'sideways_tp_mult': 1.0727756327226716, 'sideways_tsl_mult': 0.3405798387159581, 'sideways_time_stop': 157, 'sideways_use_sma': True, 'sideways_use_ema': False, 'sideways_use_atr': True, 'sideways_use_adx': True, 'sideways_use_spike': True, 'sideways_rsi_required': True}.
[I 2025-08-30 15:54:41,554] Trial 592 finished with values: [-1000000000.0, 1000000000.0] and parameters: {'p_sma': 59, 'p_std': 22, 'p_atr': 12, 'p_adx': 25, 'rsi_period': 15, 'ema1': 25, 'ema2': 56, 'slip_atr_k': 0.0003837188382598869, 'slip_spread_k': 0.5852897646591244, 'spread_hl_frac': 0.04392409598588202, 'bb_std_mult': 1.2983118772241367, 'rsi_os': 41, 'rsi_ob': 87, 'vol_spike': 0.2184043496738049, 'adx_thresh': 18.309216342121932, 'atr_min_pct': 0.024440261647888803, 'atr_max_pct': 0.1064116974527199, 'tp_mult': 1.54274468432115, 'tsl_mult': 0.36481731504575826, 'strategy': 'breakout', 'time_stop': 169, 'use_sma': False, 'use_atr': False, 'use_adx': True, 'use_ema': False, 'use_spike': True, 'rsi_required': True, 'edge_k': 0.6088709188884476, 'edge_cap': 0.9280378783334464, 'bull_strategy': 'breakout', 'bull_bb_std_mult': 1.5829641042344216, 'bull_rsi_os': 47, 'bull_rsi_ob': 89, 'bull_adx_thresh': 7.342046655762208, 'bull_atr_min_pct': 0.019302374105218973, 'bull_atr_max_pct': 0.10318618779125358, 'bull_tp_mult': 1.9448676010069454, 'bull_tsl_mult': 0.013673617325936416, 'bull_time_stop': 283, 'bull_use_sma': True, 'bull_use_ema': False, 'bull_use_atr': True, 'bull_use_adx': True, 'bull_use_spike': True, 'bull_rsi_required': False, 'bear_strategy': 'mean_reversion', 'bear_bb_std_mult': 1.844679619362054, 'bear_rsi_os': 27, 'bear_rsi_ob': 68, 'bear_adx_thresh': 16.082484041998324, 'bear_atr_min_pct': 0.01926183513236806, 'bear_atr_max_pct': 0.11845314840544123, 'bear_tp_mult': 1.4393485532047885, 'bear_tsl_mult': 0.7770037458032952, 'bear_time_stop': 80, 'bear_use_sma': True, 'bear_use_ema': True, 'bear_use_atr': True, 'bear_use_adx': True, 'bear_use_spike': True, 'bear_rsi_required': False, 'sideways_strategy': 'breakout', 'sideways_bb_std_mult': 2.675649832719904, 'sideways_rsi_os': 6, 'sideways_rsi_ob': 82, 'sideways_adx_thresh': 5.806418755274073, 'sideways_atr_min_pct': 0.018536248485791083, 'sideways_atr_max_pct': 0.07434649913428044, 'sideways_tp_mult': 2.6219642179533533, 'sideways_tsl_mult': 0.33680870245834654, 'sideways_time_stop': 156, 'sideways_use_sma': False, 'sideways_use_ema': True, 'sideways_use_atr': True, 'sideways_use_adx': True, 'sideways_use_spike': True, 'sideways_rsi_required': True}.
[I 2025-08-30 15:54:41,778] Trial 591 finished with values: [-0.030562009919648858, 0.03046103858200554] and parameters: {'p_sma': 58, 'p_std': 22, 'p_atr': 12, 'p_adx': 25, 'rsi_period': 7, 'ema1': 25, 'ema2': 36, 'slip_atr_k': 0.1190525595094107, 'slip_spread_k': 0.5793628991152626, 'spread_hl_frac': 0.0068420922868092015, 'bb_std_mult': 0.5980832615735736, 'rsi_os': 27, 'rsi_ob': 87, 'vol_spike': 0.20001989991772975, 'adx_thresh': 8.961867206405826, 'atr_min_pct': 0.006338201636427468, 'atr_max_pct': 0.10583672123446311, 'tp_mult': 1.4767787930478975, 'tsl_mult': 0.36682988765639446, 'strategy': 'breakout', 'time_stop': 155, 'use_sma': False, 'use_atr': False, 'use_adx': True, 'use_ema': False, 'use_spike': False, 'rsi_required': True, 'edge_k': 0.6166880391720041, 'edge_cap': 0.13971257190415626, 'bull_strategy': 'breakout', 'bull_bb_std_mult': 1.6140366947496456, 'bull_rsi_os': 47, 'bull_rsi_ob': 90, 'bull_adx_thresh': 7.546925629747264, 'bull_atr_min_pct': 0.015215592293295862, 'bull_atr_max_pct': 0.10401131121749345, 'bull_tp_mult': 2.55745482259075, 'bull_tsl_mult': 0.8156559780923374, 'bull_time_stop': 51, 'bull_use_sma': True, 'bull_use_ema': True, 'bull_use_atr': True, 'bull_use_adx': True, 'bull_use_spike': True, 'bull_rsi_required': False, 'bear_strategy': 'mean_reversion', 'bear_bb_std_mult': 1.0139600020240407, 'bear_rsi_os': 27, 'bear_rsi_ob': 75, 'bear_adx_thresh': 14.659857242249295, 'bear_atr_min_pct': 0.00249744741812851, 'bear_atr_max_pct': 0.11882035854397814, 'bear_tp_mult': 2.579621043053209, 'bear_tsl_mult': 0.8858458681996594, 'bear_time_stop': 82, 'bear_use_sma': True, 'bear_use_ema': False, 'bear_use_atr': True, 'bear_use_adx': True, 'bear_use_spike': True, 'bear_rsi_required': False, 'sideways_strategy': 'breakout', 'sideways_bb_std_mult': 3.1213366356758216, 'sideways_rsi_os': 17, 'sideways_rsi_ob': 46, 'sideways_adx_thresh': 9.396606189691733, 'sideways_atr_min_pct': 0.011760326120729348, 'sideways_atr_max_pct': 0.13746035951703214, 'sideways_tp_mult': 1.5294838200394243, 'sideways_tsl_mult': 0.33295419088477074, 'sideways_time_stop': 155, 'sideways_use_sma': False, 'sideways_use_ema': True, 'sideways_use_atr': True, 'sideways_use_adx': True, 'sideways_use_spike': True, 'sideways_rsi_required': True}.
[I 2025-08-30 15:55:27,025] Trial 596 finished with values: [-1000000000.0, 1000000000.0] and parameters: {'p_sma': 5, 'p_std': 20, 'p_atr': 23, 'p_adx': 24, 'rsi_period': 10, 'ema1': 7, 'ema2': 38, 'slip_atr_k': 0.22876357642920228, 'slip_spread_k': 0.729980902491467, 'spread_hl_frac': 0.004847170612234403, 'bb_std_mult': 1.0749949588693166, 'rsi_os': 37, 'rsi_ob': 88, 'vol_spike': 0.23104029713767493, 'adx_thresh': 10.521455507183893, 'atr_min_pct': 0.012311190571281843, 'atr_max_pct': 0.022884182811339394, 'tp_mult': 1.5398605810102832, 'tsl_mult': 0.7407577076218629, 'strategy': 'breakout', 'time_stop': 176, 'use_sma': True, 'use_atr': False, 'use_adx': True, 'use_ema': False, 'use_spike': True, 'rsi_required': False, 'edge_k': 0.8502902735557027, 'edge_cap': 0.9632571344958244, 'bull_strategy': 'breakout', 'bull_bb_std_mult': 3.5620453076248015, 'bull_rsi_os': 51, 'bull_rsi_ob': 88, 'bull_adx_thresh': 11.117851287154899, 'bull_atr_min_pct': 0.01818861493576369, 'bull_atr_max_pct': 0.1005696874042056, 'bull_tp_mult': 2.261625199417633, 'bull_tsl_mult': 0.9115123572692848, 'bull_time_stop': 70, 'bull_use_sma': True, 'bull_use_ema': False, 'bull_use_atr': False, 'bull_use_adx': True, 'bull_use_spike': True, 'bull_rsi_required': True, 'bear_strategy': 'mean_reversion', 'bear_bb_std_mult': 2.821914477425871, 'bear_rsi_os': 24, 'bear_rsi_ob': 77, 'bear_adx_thresh': 15.69369004288857, 'bear_atr_min_pct': 0.0015782981222675413, 'bear_atr_max_pct': 0.10724485753640828, 'bear_tp_mult': 2.653898051253366, 'bear_tsl_mult': 0.8808087408082533, 'bear_time_stop': 178, 'bear_use_sma': True, 'bear_use_ema': True, 'bear_use_atr': True, 'bear_use_adx': False, 'bear_use_spike': False, 'bear_rsi_required': True, 'sideways_strategy': 'mean_reversion', 'sideways_bb_std_mult': 3.336330845679864, 'sideways_rsi_os': 12, 'sideways_rsi_ob': 76, 'sideways_adx_thresh': 10.887017144374692, 'sideways_atr_min_pct': 0.021203854089747412, 'sideways_atr_max_pct': 0.1340515303390337, 'sideways_tp_mult': 1.3866826876804046, 'sideways_tsl_mult': 0.3608310610248174, 'sideways_time_stop': 145, 'sideways_use_sma': True, 'sideways_use_ema': False, 'sideways_use_atr': True, 'sideways_use_adx': False, 'sideways_use_spike': False, 'sideways_rsi_required': False}.
