[I 2025-08-30 14:33:56,215] Trial 108 finished with values: [-1000000000.0, 1000000000.0] and parameters: {'p_sma': 42, 'p_std': 19, 'p_atr': 15, 'p_adx': 20, 'rsi_period': 29, 'ema1': 18, 'ema2': 30, 'slip_atr_k': 0.09354219547423256, 'slip_spread_k': 0.5197158841816283, 'spread_hl_frac': 0.043755489420449045, 'bb_std_mult': 3.059890916398097, 'rsi_os': 23, 'rsi_ob': 68, 'vol_spike': 0.048772628487549104, 'adx_thresh': 27.107997924140783, 'atr_min_pct': 0.02998515702438287, 'atr_max_pct': 0.04443074059897393, 'tp_mult': 2.0159239485899487, 'tsl_mult': 0.2069592024990451, 'strategy': 'mean_reversion', 'time_stop': 289, 'use_sma': True, 'use_atr': True, 'use_adx': False, 'use_ema': True, 'use_spike': True, 'rsi_required': False, 'edge_k': 1.7954438411429061, 'edge_cap': 0.5960391428680158, 'bull_strategy': 'mean_reversion', 'bull_bb_std_mult': 1.9358111064855048, 'bull_rsi_os': 39, 'bull_rsi_ob': 80, 'bull_adx_thresh': 21.58331639428518, 'bull_atr_min_pct': 0.025709311300233132, 'bull_atr_max_pct': 0.03796344548878642, 'bull_tp_mult': 1.918731544077826, 'bull_tsl_mult': 0.3527514659246483, 'bull_time_stop': 127, 'bull_use_sma': False, 'bull_use_ema': False, 'bull_use_atr': False, 'bull_use_adx': True, 'bull_use_spike': True, 'bull_rsi_required': False, 'bear_strategy': 'breakout', 'bear_bb_std_mult': 0.7361204687282835, 'bear_rsi_os': 15, 'bear_rsi_ob': 68, 'bear_adx_thresh': 17.161796024676796, 'bear_atr_min_pct': 0.010904926882761937, 'bear_atr_max_pct': 0.08630685751411533, 'bear_tp_mult': 2.1772922332301734, 'bear_tsl_mult': 0.7940679255781172, 'bear_time_stop': 145, 'bear_use_sma': False, 'bear_use_ema': False, 'bear_use_atr': False, 'bear_use_adx': True, 'bear_use_spike': False, 'bear_rsi_required': True, 'sideways_strategy': 'breakout', 'sideways_bb_std_mult': 2.1957096161573024, 'sideways_rsi_os': 48, 'sideways_rsi_ob': 68, 'sideways_adx_thresh': 27.341670207314348, 'sideways_atr_min_pct': 0.01515935904523821, 'sideways_atr_max_pct': 0.045388054747688276, 'sideways_tp_mult': 2.7280624048921913, 'sideways_tsl_mult': 0.18583307688474776, 'sideways_time_stop': 143, 'sideways_use_sma': False, 'sideways_use_ema': True, 'sideways_use_atr': False, 'sideways_use_adx': True, 'sideways_use_spike': True, 'sideways_rsi_required': True}.
[I 2025-08-30 14:34:26,946] Trial 109 finished with values: [-1000000000.0, 1000000000.0] and parameters: {'p_sma': 42, 'p_std': 52, 'p_atr': 15, 'p_adx': 16, 'rsi_period': 29, 'ema1': 17, 'ema2': 27, 'slip_atr_k': 0.17598066194624176, 'slip_spread_k': 0.4610258396046862, 'spread_hl_frac': 0.04353841694514945, 'bb_std_mult': 3.016951234471387, 'rsi_os': 20, 'rsi_ob': 75, 'vol_spike': 0.0863759428843589, 'adx_thresh': 27.32411736037587, 'atr_min_pct': 0.02720707360555054, 'atr_max_pct': 0.03614284187065034, 'tp_mult': 2.015386011671718, 'tsl_mult': 0.1744066276498263, 'strategy': 'mean_reversion', 'time_stop': 291, 'use_sma': True, 'use_atr': True, 'use_adx': False, 'use_ema': True, 'use_spike': True, 'rsi_required': False, 'edge_k': 0.4224791769583157, 'edge_cap': 0.5354470219233084, 'bull_strategy': 'breakout', 'bull_bb_std_mult': 1.263940070486533, 'bull_rsi_os': 43, 'bull_rsi_ob': 76, 'bull_adx_thresh': 21.59332983098263, 'bull_atr_min_pct': 0.02594388522440453, 'bull_atr_max_pct': 0.08129011807117074, 'bull_tp_mult': 1.499398395839781, 'bull_tsl_mult': 0.35237782804808204, 'bull_time_stop': 131, 'bull_use_sma': False, 'bull_use_ema': False, 'bull_use_atr': False, 'bull_use_adx': True, 'bull_use_spike': True, 'bull_rsi_required': False, 'bear_strategy': 'mean_reversion', 'bear_bb_std_mult': 0.846562537661264, 'bear_rsi_os': 16, 'bear_rsi_ob': 69, 'bear_adx_thresh': 22.70824263828247, 'bear_atr_min_pct': 0.010820405096830044, 'bear_atr_max_pct': 0.1499756334497142, 'bear_tp_mult': 1.995529262775933, 'bear_tsl_mult': 0.7396778545747862, 'bear_time_stop': 116, 'bear_use_sma': False, 'bear_use_ema': False, 'bear_use_atr': True, 'bear_use_adx': True, 'bear_use_spike': False, 'bear_rsi_required': True, 'sideways_strategy': 'breakout', 'sideways_bb_std_mult': 2.2289336073159753, 'sideways_rsi_os': 41, 'sideways_rsi_ob': 68, 'sideways_adx_thresh': 27.74663541127477, 'sideways_atr_min_pct': 0.01600688385236438, 'sideways_atr_max_pct': 0.04602884859113175, 'sideways_tp_mult': 2.7434788941566013, 'sideways_tsl_mult': 0.19631969435071955, 'sideways_time_stop': 143, 'sideways_use_sma': False, 'sideways_use_ema': False, 'sideways_use_atr': False, 'sideways_use_adx': True, 'sideways_use_spike': True, 'sideways_rsi_required': True}.
[I 2025-08-30 14:34:27,101] Trial 111 finished with values: [-1000000000.0, 1000000000.0] and parameters: {'p_sma': 40, 'p_std': 45, 'p_atr': 12, 'p_adx': 20, 'rsi_period': 19, 'ema1': 17, 'ema2': 27, 'slip_atr_k': 0.16198614637459086, 'slip_spread_k': 0.45257209503456675, 'spread_hl_frac': 0.04995946652800988, 'bb_std_mult': 2.988590962067678, 'rsi_os': 19, 'rsi_ob': 75, 'vol_spike': 0.11565590784122658, 'adx_thresh': 22.941503725824866, 'atr_min_pct': 0.029968646651959033, 'atr_max_pct': 0.036508587089208525, 'tp_mult': 2.0206715827712656, 'tsl_mult': 0.17023554837387417, 'strategy': 'mean_reversion', 'time_stop': 282, 'use_sma': True, 'use_atr': True, 'use_adx': False, 'use_ema': False, 'use_spike': True, 'rsi_required': False, 'edge_k': 0.3862224182025765, 'edge_cap': 0.5986830854593075, 'bull_strategy': 'breakout', 'bull_bb_std_mult': 3.5997680159322423, 'bull_rsi_os': 44, 'bull_rsi_ob': 78, 'bull_adx_thresh': 21.923675854166433, 'bull_atr_min_pct': 0.009221401059538729, 'bull_atr_max_pct': 0.043403957319271325, 'bull_tp_mult': 1.6350622992768231, 'bull_tsl_mult': 0.18419642152120033, 'bull_time_stop': 95, 'bull_use_sma': False, 'bull_use_ema': False, 'bull_use_atr': False, 'bull_use_adx': True, 'bull_use_spike': False, 'bull_rsi_required': False, 'bear_strategy': 'mean_reversion', 'bear_bb_std_mult': 0.8425204419052706, 'bear_rsi_os': 7, 'bear_rsi_ob': 69, 'bear_adx_thresh': 27.917470691859496, 'bear_atr_min_pct': 0.011185760436810133, 'bear_atr_max_pct': 0.08362384041540925, 'bear_tp_mult': 2.3148582694781306, 'bear_tsl_mult': 0.935798487326327, 'bear_time_stop': 129, 'bear_use_sma': False, 'bear_use_ema': True, 'bear_use_atr': True, 'bear_use_adx': False, 'bear_use_spike': False, 'bear_rsi_required': False, 'sideways_strategy': 'mean_reversion', 'sideways_bb_std_mult': 2.1960952900483104, 'sideways_rsi_os': 43, 'sideways_rsi_ob': 64, 'sideways_adx_thresh': 27.625364867261887, 'sideways_atr_min_pct': 0.015528699182367654, 'sideways_atr_max_pct': 0.06854344150312197, 'sideways_tp_mult': 2.774134373946446, 'sideways_tsl_mult': 0.3678562474937328, 'sideways_time_stop': 81, 'sideways_use_sma': False, 'sideways_use_ema': False, 'sideways_use_atr': False, 'sideways_use_adx': True, 'sideways_use_spike': True, 'sideways_rsi_required': False}.
[I 2025-08-30 14:34:27,258] Trial 110 finished with values: [-1000000000.0, 1000000000.0] and parameters: {'p_sma': 40, 'p_std': 51, 'p_atr': 17, 'p_adx': 16, 'rsi_period': 29, 'ema1': 18, 'ema2': 26, 'slip_atr_k': 0.17925659472656766, 'slip_spread_k': 0.46153146322889516, 'spread_hl_frac': 0.04380519261578616, 'bb_std_mult': 3.0393015101378555, 'rsi_os': 20, 'rsi_ob': 74, 'vol_spike': 0.14172589257901827, 'adx_thresh': 25.50255453342671, 'atr_min_pct': 0.02747632288655147, 'atr_max_pct': 0.04753490728652998, 'tp_mult': 2.0200462321217993, 'tsl_mult': 0.1656121903558196, 'strategy': 'mean_reversion', 'time_stop': 287, 'use_sma': True, 'use_atr': True, 'use_adx': False, 'use_ema': True, 'use_spike': True, 'rsi_required': False, 'edge_k': 1.7888124766569549, 'edge_cap': 0.5342049507438634, 'bull_strategy': 'breakout', 'bull_bb_std_mult': 1.931913082395952, 'bull_rsi_os': 49, 'bull_rsi_ob': 80, 'bull_adx_thresh': 22.347060089867217, 'bull_atr_min_pct': 0.011285989788945367, 'bull_atr_max_pct': 0.04289621949215483, 'bull_tp_mult': 1.6581837781768447, 'bull_tsl_mult': 0.343478597183226, 'bull_time_stop': 121, 'bull_use_sma': False, 'bull_use_ema': False, 'bull_use_atr': False, 'bull_use_adx': True, 'bull_use_spike': False, 'bull_rsi_required': False, 'bear_strategy': 'mean_reversion', 'bear_bb_std_mult': 0.8395383025143046, 'bear_rsi_os': 16, 'bear_rsi_ob': 69, 'bear_adx_thresh': 9.623976545583139, 'bear_atr_min_pct': 0.010966729075059948, 'bear_atr_max_pct': 0.13861781889114766, 'bear_tp_mult': 1.9907717909171416, 'bear_tsl_mult': 0.9406527701339594, 'bear_time_stop': 134, 'bear_use_sma': False, 'bear_use_ema': True, 'bear_use_atr': True, 'bear_use_adx': True, 'bear_use_spike': False, 'bear_rsi_required': True, 'sideways_strategy': 'breakout', 'sideways_bb_std_mult': 2.154158025378732, 'sideways_rsi_os': 41, 'sideways_rsi_ob': 68, 'sideways_adx_thresh': 26.207410676298903, 'sideways_atr_min_pct': 0.015553347010501877, 'sideways_atr_max_pct': 0.11308498463522113, 'sideways_tp_mult': 2.752683067295626, 'sideways_tsl_mult': 0.2577142191825491, 'sideways_time_stop': 146, 'sideways_use_sma': False, 'sideways_use_ema': False, 'sideways_use_atr': False, 'sideways_use_adx': True, 'sideways_use_spike': True, 'sideways_rsi_required': True}.
[I 2025-08-30 14:34:27,269] Trial 112 finished with values: [-1000000000.0, 1000000000.0] and parameters: {'p_sma': 54, 'p_std': 44, 'p_atr': 14, 'p_adx': 8, 'rsi_period': 19, 'ema1': 17, 'ema2': 26, 'slip_atr_k': 0.1649451637841277, 'slip_spread_k': 0.4985320588500572, 'spread_hl_frac': 0.049780663565998695, 'bb_std_mult': 1.8318200026891969, 'rsi_os': 19, 'rsi_ob': 75, 'vol_spike': 0.11631570787852138, 'adx_thresh': 23.317787621406598, 'atr_min_pct': 0.027363978267005762, 'atr_max_pct': 0.03724954257676165, 'tp_mult': 2.1368601846652435, 'tsl_mult': 0.2660274803011068, 'strategy': 'mean_reversion', 'time_stop': 282, 'use_sma': True, 'use_atr': True, 'use_adx': False, 'use_ema': False, 'use_spike': True, 'rsi_required': False, 'edge_k': 0.3878812295953358, 'edge_cap': 0.5674886195885067, 'bull_strategy': 'breakout', 'bull_bb_std_mult': 0.6781252101164363, 'bull_rsi_os': 44, 'bull_rsi_ob': 78, 'bull_adx_thresh': 22.591138034670813, 'bull_atr_min_pct': 0.017165892964055674, 'bull_atr_max_pct': 0.04639778267567594, 'bull_tp_mult': 1.6551056144192917, 'bull_tsl_mult': 0.43344555727568196, 'bull_time_stop': 98, 'bull_use_sma': False, 'bull_use_ema': False, 'bull_use_atr': True, 'bull_use_adx': True, 'bull_use_spike': False, 'bull_rsi_required': True, 'bear_strategy': 'mean_reversion', 'bear_bb_std_mult': 0.8442278113845048, 'bear_rsi_os': 53, 'bear_rsi_ob': 71, 'bear_adx_thresh': 9.383261885115553, 'bear_atr_min_pct': 0.010160884619503995, 'bear_atr_max_pct': 0.02104374503507682, 'bear_tp_mult': 2.2864057441429013, 'bear_tsl_mult': 0.7428237613125551, 'bear_time_stop': 134, 'bear_use_sma': False, 'bear_use_ema': True, 'bear_use_atr': True, 'bear_use_adx': False, 'bear_use_spike': False, 'bear_rsi_required': False, 'sideways_strategy': 'mean_reversion', 'sideways_bb_std_mult': 2.194541250897949, 'sideways_rsi_os': 43, 'sideways_rsi_ob': 64, 'sideways_adx_thresh': 28.375885513822162, 'sideways_atr_min_pct': 0.01608639481798702, 'sideways_atr_max_pct': 0.07033771604861982, 'sideways_tp_mult': 2.7761325364431304, 'sideways_tsl_mult': 0.3765089782498415, 'sideways_time_stop': 168, 'sideways_use_sma': False, 'sideways_use_ema': False, 'sideways_use_atr': False, 'sideways_use_adx': True, 'sideways_use_spike': True, 'sideways_rsi_required': False}.
[I 2025-08-30 14:34:56,893] Trial 113 finished with values: [-1000000000.0, 1000000000.0] and parameters: {'p_sma': 40, 'p_std': 44, 'p_atr': 14, 'p_adx': 7, 'rsi_period': 18, 'ema1': 17, 'ema2': 26, 'slip_atr_k': 0.1680226833822813, 'slip_spread_k': 0.5711326786400364, 'spread_hl_frac': 0.04953057612128252, 'bb_std_mult': 1.8452792405430518, 'rsi_os': 25, 'rsi_ob': 76, 'vol_spike': 0.14363817568372927, 'adx_thresh': 25.98713923588627, 'atr_min_pct': 0.0265534450058963, 'atr_max_pct': 0.02848329642606629, 'tp_mult': 1.8393747441325963, 'tsl_mult': 0.8481443000963997, 'strategy': 'mean_reversion', 'time_stop': 284, 'use_sma': True, 'use_atr': True, 'use_adx': False, 'use_ema': False, 'use_spike': True, 'rsi_required': True, 'edge_k': 0.06810805137558318, 'edge_cap': 0.4989070745645856, 'bull_strategy': 'breakout', 'bull_bb_std_mult': 2.8977715219665883, 'bull_rsi_os': 37, 'bull_rsi_ob': 78, 'bull_adx_thresh': 17.920651630267436, 'bull_atr_min_pct': 0.009252874390859188, 'bull_atr_max_pct': 0.1280470653464433, 'bull_tp_mult': 1.393614101049561, 'bull_tsl_mult': 0.19382227982801528, 'bull_time_stop': 120, 'bull_use_sma': False, 'bull_use_ema': False, 'bull_use_atr': True, 'bull_use_adx': True, 'bull_use_spike': False, 'bull_rsi_required': True, 'bear_strategy': 'mean_reversion', 'bear_bb_std_mult': 0.978134102408823, 'bear_rsi_os': 53, 'bear_rsi_ob': 71, 'bear_adx_thresh': 28.39133800816618, 'bear_atr_min_pct': 0.0098767810948183, 'bear_atr_max_pct': 0.10658827844147517, 'bear_tp_mult': 2.2718554783476224, 'bear_tsl_mult': 0.9457334381153129, 'bear_time_stop': 134, 'bear_use_sma': False, 'bear_use_ema': True, 'bear_use_atr': True, 'bear_use_adx': False, 'bear_use_spike': False, 'bear_rsi_required': False, 'sideways_strategy': 'mean_reversion', 'sideways_bb_std_mult': 1.8919807486262388, 'sideways_rsi_os': 45, 'sideways_rsi_ob': 63, 'sideways_adx_thresh': 22.964251142232847, 'sideways_atr_min_pct': 0.017570401678658747, 'sideways_atr_max_pct': 0.11695463536837866, 'sideways_tp_mult': 2.7569699598154256, 'sideways_tsl_mult': 0.7116312774886577, 'sideways_time_stop': 74, 'sideways_use_sma': False, 'sideways_use_ema': False, 'sideways_use_atr': False, 'sideways_use_adx': False, 'sideways_use_spike': False, 'sideways_rsi_required': False}.
[I 2025-08-30 14:34:58,209] Trial 115 finished with values: [-1000000000.0, 1000000000.0] and parameters: {'p_sma': 37, 'p_std': 33, 'p_atr': 16, 'p_adx': 7, 'rsi_period': 16, 'ema1': 19, 'ema2': 28, 'slip_atr_k': 0.06794783792308658, 'slip_spread_k': 0.5824718168526187, 'spread_hl_frac': 0.045122824755253, 'bb_std_mult': 2.4822749944246025, 'rsi_os': 17, 'rsi_ob': 60, 'vol_spike': 0.0945007841743003, 'adx_thresh': 29.01784349162139, 'atr_min_pct': 0.026190767067771858, 'atr_max_pct': 0.031242703251492965, 'tp_mult': 2.082991592094574, 'tsl_mult': 0.44972458124531034, 'strategy': 'mean_reversion', 'time_stop': 273, 'use_sma': True, 'use_atr': True, 'use_adx': True, 'use_ema': True, 'use_spike': True, 'rsi_required': True, 'edge_k': 1.2839554229298336, 'edge_cap': 0.7630780395312913, 'bull_strategy': 'mean_reversion', 'bull_bb_std_mult': 0.5000402114731248, 'bull_rsi_os': 48, 'bull_rsi_ob': 48, 'bull_adx_thresh': 18.054601158522217, 'bull_atr_min_pct': 0.02117068070771644, 'bull_atr_max_pct': 0.027279354029244182, 'bull_tp_mult': 1.6100183543896032, 'bull_tsl_mult': 0.21584515152864714, 'bull_time_stop': 246, 'bull_use_sma': False, 'bull_use_ema': False, 'bull_use_atr': True, 'bull_use_adx': True, 'bull_use_spike': False, 'bull_rsi_required': False, 'bear_strategy': 'breakout', 'bear_bb_std_mult': 1.2365896570632477, 'bear_rsi_os': 48, 'bear_rsi_ob': 54, 'bear_adx_thresh': 5.946967566932257, 'bear_atr_min_pct': 0.011980099682860413, 'bear_atr_max_pct': 0.04426226092117714, 'bear_tp_mult': 1.8963607279727603, 'bear_tsl_mult': 0.8571379383300114, 'bear_time_stop': 155, 'bear_use_sma': False, 'bear_use_ema': True, 'bear_use_atr': False, 'bear_use_adx': False, 'bear_use_spike': False, 'bear_rsi_required': False, 'sideways_strategy': 'breakout', 'sideways_bb_std_mult': 1.8782488136386286, 'sideways_rsi_os': 50, 'sideways_rsi_ob': 70, 'sideways_adx_thresh': 23.683782940281834, 'sideways_atr_min_pct': 0.017873987565527924, 'sideways_atr_max_pct': 0.10744903053423563, 'sideways_tp_mult': 1.8091018462497048, 'sideways_tsl_mult': 0.6717441831883255, 'sideways_time_stop': 152, 'sideways_use_sma': False, 'sideways_use_ema': True, 'sideways_use_atr': False, 'sideways_use_adx': False, 'sideways_use_spike': False, 'sideways_rsi_required': False}.
[I 2025-08-30 14:34:58,323] Trial 116 finished with values: [-1000000000.0, 1000000000.0] and parameters: {'p_sma': 37, 'p_std': 5, 'p_atr': 20, 'p_adx': 7, 'rsi_period': 13, 'ema1': 15, 'ema2': 32, 'slip_atr_k': 0.2096596873658116, 'slip_spread_k': 0.48904285821059673, 'spread_hl_frac': 0.0454383824393983, 'bb_std_mult': 3.4434236866197203, 'rsi_os': 17, 'rsi_ob': 73, 'vol_spike': 0.09324918338679619, 'adx_thresh': 16.688432251782984, 'atr_min_pct': 0.028839879113028953, 'atr_max_pct': 0.03143326714399612, 'tp_mult': 2.0811346482313384, 'tsl_mult': 0.4123657238401698, 'strategy': 'mean_reversion', 'time_stop': 270, 'use_sma': True, 'use_atr': True, 'use_adx': True, 'use_ema': True, 'use_spike': True, 'rsi_required': True, 'edge_k': 1.692052828064266, 'edge_cap': 0.5010181347658911, 'bull_strategy': 'mean_reversion', 'bull_bb_std_mult': 0.5022808189478597, 'bull_rsi_os': 36, 'bull_rsi_ob': 66, 'bull_adx_thresh': 17.655063698848874, 'bull_atr_min_pct': 0.023587795785994764, 'bull_atr_max_pct': 0.027545539443924953, 'bull_tp_mult': 1.6136940388921577, 'bull_tsl_mult': 0.39710994908622405, 'bull_time_stop': 117, 'bull_use_sma': False, 'bull_use_ema': False, 'bull_use_atr': True, 'bull_use_adx': True, 'bull_use_spike': False, 'bull_rsi_required': False, 'bear_strategy': 'breakout', 'bear_bb_std_mult': 0.9967034645138277, 'bear_rsi_os': 22, 'bear_rsi_ob': 54, 'bear_adx_thresh': 23.857112469454055, 'bear_atr_min_pct': 0.014578686418326436, 'bear_atr_max_pct': 0.11582028261643024, 'bear_tp_mult': 1.905715142801199, 'bear_tsl_mult': 0.8684089270888983, 'bear_time_stop': 69, 'bear_use_sma': False, 'bear_use_ema': True, 'bear_use_atr': False, 'bear_use_adx': False, 'bear_use_spike': False, 'bear_rsi_required': False, 'sideways_strategy': 'breakout', 'sideways_bb_std_mult': 1.8681743922728278, 'sideways_rsi_os': 46, 'sideways_rsi_ob': 69, 'sideways_adx_thresh': 23.118084464440408, 'sideways_atr_min_pct': 0.01924569781929029, 'sideways_atr_max_pct': 0.018937814966603957, 'sideways_tp_mult': 1.703026796764788, 'sideways_tsl_mult': 0.6965752330840789, 'sideways_time_stop': 169, 'sideways_use_sma': False, 'sideways_use_ema': True, 'sideways_use_atr': False, 'sideways_use_adx': False, 'sideways_use_spike': False, 'sideways_rsi_required': False}.
[I 2025-08-30 14:34:58,502] Trial 114 finished with values: [-1000000000.0, 1000000000.0] and parameters: {'p_sma': 44, 'p_std': 5, 'p_atr': 14, 'p_adx': 7, 'rsi_period': 15, 'ema1': 15, 'ema2': 32, 'slip_atr_k': 0.20559535908314142, 'slip_spread_k': 0.4968228486269524, 'spread_hl_frac': 0.0453455528355844, 'bb_std_mult': 1.8281381484032857, 'rsi_os': 17, 'rsi_ob': 72, 'vol_spike': 0.017630977374937462, 'adx_thresh': 26.254550159017747, 'atr_min_pct': 0.028870188319500462, 'atr_max_pct': 0.030998258805057875, 'tp_mult': 2.1299354599374634, 'tsl_mult': 0.8223724168000089, 'strategy': 'mean_reversion', 'time_stop': 281, 'use_sma': True, 'use_atr': True, 'use_adx': True, 'use_ema': True, 'use_spike': True, 'rsi_required': True, 'edge_k': 0.8136266417282368, 'edge_cap': 0.5078572873243086, 'bull_strategy': 'mean_reversion', 'bull_bb_std_mult': 0.5054149652243174, 'bull_rsi_os': 37, 'bull_rsi_ob': 78, 'bull_adx_thresh': 17.614637381717298, 'bull_atr_min_pct': 0.01320213264837401, 'bull_atr_max_pct': 0.027513326213545894, 'bull_tp_mult': 1.606635211022523, 'bull_tsl_mult': 0.4253023827942155, 'bull_time_stop': 139, 'bull_use_sma': False, 'bull_use_ema': False, 'bull_use_atr': True, 'bull_use_adx': True, 'bull_use_spike': False, 'bull_rsi_required': True, 'bear_strategy': 'breakout', 'bear_bb_std_mult': 0.9785342856878381, 'bear_rsi_os': 20, 'bear_rsi_ob': 63, 'bear_adx_thresh': 18.000426091703552, 'bear_atr_min_pct': 0.010138026003801374, 'bear_atr_max_pct': 0.10937833190429269, 'bear_tp_mult': 1.9030201715218693, 'bear_tsl_mult': 0.74721244950028, 'bear_time_stop': 157, 'bear_use_sma': False, 'bear_use_ema': True, 'bear_use_atr': False, 'bear_use_adx': False, 'bear_use_spike': False, 'bear_rsi_required': False, 'sideways_strategy': 'breakout', 'sideways_bb_std_mult': 1.874613832980021, 'sideways_rsi_os': 45, 'sideways_rsi_ob': 63, 'sideways_adx_thresh': 28.798546039024224, 'sideways_atr_min_pct': 0.01944192230565342, 'sideways_atr_max_pct': 0.0188960036983783, 'sideways_tp_mult': 2.855870076465278, 'sideways_tsl_mult': 0.5396747639339016, 'sideways_time_stop': 167, 'sideways_use_sma': False, 'sideways_use_ema': True, 'sideways_use_atr': False, 'sideways_use_adx': False, 'sideways_use_spike': False, 'sideways_rsi_required': False}.
