[I 2025-08-30 15:55:28,640] Trial 594 finished with values: [-1000000000.0, 1000000000.0] and parameters: {'p_sma': 58, 'p_std': 18, 'p_atr': 12, 'p_adx': 18, 'rsi_period': 7, 'ema1': 25, 'ema2': 54, 'slip_atr_k': 0.004497759246775797, 'slip_spread_k': 0.9085537644977395, 'spread_hl_frac': 0.04079691807560644, 'bb_std_mult': 1.076148195243837, 'rsi_os': 25, 'rsi_ob': 88, 'vol_spike': 0.03226170789448808, 'adx_thresh': 25.03005555019626, 'atr_min_pct': 0.011391812814115568, 'atr_max_pct': 0.10584895622800193, 'tp_mult': 1.5462638768066506, 'tsl_mult': 0.36712864905193643, 'strategy': 'breakout', 'time_stop': 168, 'use_sma': False, 'use_atr': False, 'use_adx': True, 'use_ema': False, 'use_spike': True, 'rsi_required': True, 'edge_k': 0.857785751242079, 'edge_cap': 0.958175727588934, 'bull_strategy': 'breakout', 'bull_bb_std_mult': 1.687365770906132, 'bull_rsi_os': 51, 'bull_rsi_ob': 55, 'bull_adx_thresh': 11.217779474670795, 'bull_atr_min_pct': 0.011231453057045029, 'bull_atr_max_pct': 0.10074531622474368, 'bull_tp_mult': 2.2521599691081367, 'bull_tsl_mult': 0.9037593062557893, 'bull_time_stop': 69, 'bull_use_sma': True, 'bull_use_ema': False, 'bull_use_atr': False, 'bull_use_adx': True, 'bull_use_spike': True, 'bull_rsi_required': True, 'bear_strategy': 'mean_reversion', 'bear_bb_std_mult': 1.7840107523494655, 'bear_rsi_os': 27, 'bear_rsi_ob': 50, 'bear_adx_thresh': 19.195357209790316, 'bear_atr_min_pct': 0.001587200105095347, 'bear_atr_max_pct': 0.10834998423222122, 'bear_tp_mult': 2.5896310423400637, 'bear_tsl_mult': 0.09656261352023515, 'bear_time_stop': 80, 'bear_use_sma': True, 'bear_use_ema': True, 'bear_use_atr': True, 'bear_use_adx': True, 'bear_use_spike': False, 'bear_rsi_required': False, 'sideways_strategy': 'breakout', 'sideways_bb_std_mult': 2.1618426471630796, 'sideways_rsi_os': 10, 'sideways_rsi_ob': 83, 'sideways_adx_thresh': 5.883432800130132, 'sideways_atr_min_pct': 0.018845070787960206, 'sideways_atr_max_pct': 0.1124635285191841, 'sideways_tp_mult': 1.8522750322208443, 'sideways_tsl_mult': 0.7372271667825481, 'sideways_time_stop': 229, 'sideways_use_sma': False, 'sideways_use_ema': True, 'sideways_use_atr': True, 'sideways_use_adx': True, 'sideways_use_spike': False, 'sideways_rsi_required': False}.
[I 2025-08-30 15:55:29,374] Trial 593 finished with values: [-1000000000.0, 1000000000.0] and parameters: {'p_sma': 6, 'p_std': 41, 'p_atr': 25, 'p_adx': 18, 'rsi_period': 7, 'ema1': 25, 'ema2': 55, 'slip_atr_k': 0.013928024949040205, 'slip_spread_k': 0.5787256975196726, 'spread_hl_frac': 0.007797815008721639, 'bb_std_mult': 0.5794218919415182, 'rsi_os': 41, 'rsi_ob': 87, 'vol_spike': 0.23103478731164312, 'adx_thresh': 7.900905294925195, 'atr_min_pct': 0.024103457891287, 'atr_max_pct': 0.10698776585948279, 'tp_mult': 1.5323983087590354, 'tsl_mult': 0.3623943042598702, 'strategy': 'breakout', 'time_stop': 169, 'use_sma': False, 'use_atr': False, 'use_adx': True, 'use_ema': False, 'use_spike': True, 'rsi_required': False, 'edge_k': 0.6049614116467141, 'edge_cap': 0.45145299534103445, 'bull_strategy': 'breakout', 'bull_bb_std_mult': 3.596411577979802, 'bull_rsi_os': 48, 'bull_rsi_ob': 89, 'bull_adx_thresh': 10.354256645061911, 'bull_atr_min_pct': 0.010520171825811202, 'bull_atr_max_pct': 0.0474871596542683, 'bull_tp_mult': 2.012497395958831, 'bull_tsl_mult': 0.7852449915597521, 'bull_time_stop': 69, 'bull_use_sma': True, 'bull_use_ema': False, 'bull_use_atr': False, 'bull_use_adx': True, 'bull_use_spike': True, 'bull_rsi_required': False, 'bear_strategy': 'mean_reversion', 'bear_bb_std_mult': 1.5570571904017434, 'bear_rsi_os': 41, 'bear_rsi_ob': 75, 'bear_adx_thresh': 16.114834820833202, 'bear_atr_min_pct': 0.0014590383304166463, 'bear_atr_max_pct': 0.10686641039268742, 'bear_tp_mult': 2.562780594603207, 'bear_tsl_mult': 0.7711610997214128, 'bear_time_stop': 82, 'bear_use_sma': True, 'bear_use_ema': True, 'bear_use_atr': True, 'bear_use_adx': True, 'bear_use_spike': False, 'bear_rsi_required': True, 'sideways_strategy': 'breakout', 'sideways_bb_std_mult': 2.4180903632951343, 'sideways_rsi_os': 13, 'sideways_rsi_ob': 93, 'sideways_adx_thresh': 12.50916026226626, 'sideways_atr_min_pct': 0.018679023743480825, 'sideways_atr_max_pct': 0.11263628983456309, 'sideways_tp_mult': 2.6248627508001756, 'sideways_tsl_mult': 0.5721892398599849, 'sideways_time_stop': 293, 'sideways_use_sma': False, 'sideways_use_ema': True, 'sideways_use_atr': True, 'sideways_use_adx': True, 'sideways_use_spike': False, 'sideways_rsi_required': False}.
[I 2025-08-30 15:55:29,843] Trial 595 finished with values: [-1000000000.0, 1000000000.0] and parameters: {'p_sma': 5, 'p_std': 11, 'p_atr': 24, 'p_adx': 24, 'rsi_period': 8, 'ema1': 25, 'ema2': 39, 'slip_atr_k': 0.01281249292313971, 'slip_spread_k': 0.9158405041055604, 'spread_hl_frac': 0.01914017912480359, 'bb_std_mult': 0.5749199022137519, 'rsi_os': 25, 'rsi_ob': 88, 'vol_spike': 0.21227646091298102, 'adx_thresh': 24.710871320202944, 'atr_min_pct': 0.0072119722906045045, 'atr_max_pct': 0.10837845964313846, 'tp_mult': 1.4708042984167709, 'tsl_mult': 0.3328215467057003, 'strategy': 'breakout', 'time_stop': 166, 'use_sma': False, 'use_atr': False, 'use_adx': True, 'use_ema': False, 'use_spike': False, 'rsi_required': False, 'edge_k': 0.6636597243283088, 'edge_cap': 0.9664866434150843, 'bull_strategy': 'breakout', 'bull_bb_std_mult': 1.6781380336459084, 'bull_rsi_os': 51, 'bull_rsi_ob': 55, 'bull_adx_thresh': 11.37226312077995, 'bull_atr_min_pct': 0.008174187488796229, 'bull_atr_max_pct': 0.13023904958809057, 'bull_tp_mult': 1.5085622797259453, 'bull_tsl_mult': 0.1256436405247836, 'bull_time_stop': 70, 'bull_use_sma': True, 'bull_use_ema': False, 'bull_use_atr': False, 'bull_use_adx': True, 'bull_use_spike': True, 'bull_rsi_required': True, 'bear_strategy': 'mean_reversion', 'bear_bb_std_mult': 1.0015731246650643, 'bear_rsi_os': 23, 'bear_rsi_ob': 75, 'bear_adx_thresh': 17.75182139881024, 'bear_atr_min_pct': 0.0014499203157727727, 'bear_atr_max_pct': 0.10695501984148795, 'bear_tp_mult': 2.576217796086064, 'bear_tsl_mult': 0.8891349632467458, 'bear_time_stop': 95, 'bear_use_sma': True, 'bear_use_ema': True, 'bear_use_atr': True, 'bear_use_adx': True, 'bear_use_spike': False, 'bear_rsi_required': True, 'sideways_strategy': 'breakout', 'sideways_bb_std_mult': 3.339288744790095, 'sideways_rsi_os': 10, 'sideways_rsi_ob': 46, 'sideways_adx_thresh': 9.183755760040098, 'sideways_atr_min_pct': 0.020406824869365826, 'sideways_atr_max_pct': 0.05030801078782782, 'sideways_tp_mult': 1.511883278120377, 'sideways_tsl_mult': 0.35855711995395895, 'sideways_time_stop': 32, 'sideways_use_sma': False, 'sideways_use_ema': True, 'sideways_use_atr': True, 'sideways_use_adx': True, 'sideways_use_spike': False, 'sideways_rsi_required': False}.
[I 2025-08-30 15:56:12,576] Trial 597 finished with values: [-1000000000.0, 1000000000.0] and parameters: {'p_sma': 6, 'p_std': 42, 'p_atr': 12, 'p_adx': 24, 'rsi_period': 7, 'ema1': 19, 'ema2': 39, 'slip_atr_k': 0.01417318355020833, 'slip_spread_k': 0.9237142873248357, 'spread_hl_frac': 0.03358193045980222, 'bb_std_mult': 1.1929135830176503, 'rsi_os': 33, 'rsi_ob': 86, 'vol_spike': 0.03133415848598438, 'adx_thresh': 6.260041555758386, 'atr_min_pct': 0.00509563527675051, 'atr_max_pct': 0.06178084608081107, 'tp_mult': 1.1200408754177178, 'tsl_mult': 0.3330773563599527, 'strategy': 'breakout', 'time_stop': 165, 'use_sma': False, 'use_atr': False, 'use_adx': True, 'use_ema': False, 'use_spike': False, 'rsi_required': False, 'edge_k': 0.547524371464152, 'edge_cap': 0.19090164408349064, 'bull_strategy': 'breakout', 'bull_bb_std_mult': 1.892589012721334, 'bull_rsi_os': 48, 'bull_rsi_ob': 55, 'bull_adx_thresh': 10.143286759643898, 'bull_atr_min_pct': 0.008072125468725204, 'bull_atr_max_pct': 0.04807177877255757, 'bull_tp_mult': 2.3875739030044474, 'bull_tsl_mult': 0.9083376025012659, 'bull_time_stop': 238, 'bull_use_sma': True, 'bull_use_ema': True, 'bull_use_atr': False, 'bull_use_adx': True, 'bull_use_spike': True, 'bull_rsi_required': False, 'bear_strategy': 'mean_reversion', 'bear_bb_std_mult': 1.7534611994805651, 'bear_rsi_os': 13, 'bear_rsi_ob': 62, 'bear_adx_thresh': 18.99694350224452, 'bear_atr_min_pct': 0.009583606054447745, 'bear_atr_max_pct': 0.11351764641756251, 'bear_tp_mult': 1.715646994959236, 'bear_tsl_mult': 0.8545675904312472, 'bear_time_stop': 95, 'bear_use_sma': False, 'bear_use_ema': False, 'bear_use_atr': True, 'bear_use_adx': True, 'bear_use_spike': False, 'bear_rsi_required': True, 'sideways_strategy': 'mean_reversion', 'sideways_bb_std_mult': 3.5221031857075813, 'sideways_rsi_os': 24, 'sideways_rsi_ob': 79, 'sideways_adx_thresh': 10.494562642754639, 'sideways_atr_min_pct': 0.018817440344685743, 'sideways_atr_max_pct': 0.11429474986997029, 'sideways_tp_mult': 1.33936686994277, 'sideways_tsl_mult': 0.7366431409760069, 'sideways_time_stop': 31, 'sideways_use_sma': True, 'sideways_use_ema': False, 'sideways_use_atr': True, 'sideways_use_adx': True, 'sideways_use_spike': False, 'sideways_rsi_required': False}.
[I 2025-08-30 15:56:13,106] Trial 598 finished with values: [-1000000000.0, 1000000000.0] and parameters: {'p_sma': 6, 'p_std': 25, 'p_atr': 25, 'p_adx': 10, 'rsi_period': 12, 'ema1': 18, 'ema2': 39, 'slip_atr_k': 0.013111151589230804, 'slip_spread_k': 0.6714837798141399, 'spread_hl_frac': 0.007594045928263752, 'bb_std_mult': 1.462666023253623, 'rsi_os': 13, 'rsi_ob': 86, 'vol_spike': 0.21010539334276895, 'adx_thresh': 6.714594369495546, 'atr_min_pct': 0.00511622047068431, 'atr_max_pct': 0.11790567999945503, 'tp_mult': 2.8017817246663963, 'tsl_mult': 0.7702850826581696, 'strategy': 'breakout', 'time_stop': 140, 'use_sma': False, 'use_atr': False, 'use_adx': True, 'use_ema': False, 'use_spike': False, 'rsi_required': False, 'edge_k': 0.6725182565849669, 'edge_cap': 0.9827548929651421, 'bull_strategy': 'breakout', 'bull_bb_std_mult': 1.502452338244663, 'bull_rsi_os': 45, 'bull_rsi_ob': 85, 'bull_adx_thresh': 9.077201559210978, 'bull_atr_min_pct': 0.01210922848842927, 'bull_atr_max_pct': 0.014793897218508753, 'bull_tp_mult': 2.474966373433729, 'bull_tsl_mult': 0.8841091586873123, 'bull_time_stop': 237, 'bull_use_sma': True, 'bull_use_ema': True, 'bull_use_atr': True, 'bull_use_adx': True, 'bull_use_spike': True, 'bull_rsi_required': False, 'bear_strategy': 'mean_reversion', 'bear_bb_std_mult': 1.7588849952773011, 'bear_rsi_os': 13, 'bear_rsi_ob': 95, 'bear_adx_thresh': 17.51284204376505, 'bear_atr_min_pct': 0.004023032987853425, 'bear_atr_max_pct': 0.12250779207759606, 'bear_tp_mult': 1.3156640681341836, 'bear_tsl_mult': 0.8284549741712705, 'bear_time_stop': 98, 'bear_use_sma': False, 'bear_use_ema': False, 'bear_use_atr': True, 'bear_use_adx': True, 'bear_use_spike': True, 'bear_rsi_required': True, 'sideways_strategy': 'mean_reversion', 'sideways_bb_std_mult': 3.225997232610397, 'sideways_rsi_os': 24, 'sideways_rsi_ob': 79, 'sideways_adx_thresh': 10.6599252738776, 'sideways_atr_min_pct': 0.020258713756246445, 'sideways_atr_max_pct': 0.05715997793582819, 'sideways_tp_mult': 1.2986656917647954, 'sideways_tsl_mult': 0.4233189588009437, 'sideways_time_stop': 126, 'sideways_use_sma': True, 'sideways_use_ema': False, 'sideways_use_atr': True, 'sideways_use_adx': True, 'sideways_use_spike': True, 'sideways_rsi_required': True}.
[I 2025-08-30 15:56:13,738] Trial 599 finished with values: [-1000000000.0, 1000000000.0] and parameters: {'p_sma': 8, 'p_std': 51, 'p_atr': 11, 'p_adx': 16, 'rsi_period': 12, 'ema1': 24, 'ema2': 39, 'slip_atr_k': 0.043836626945634075, 'slip_spread_k': 0.06337093450918946, 'spread_hl_frac': 0.0117896672043745, 'bb_std_mult': 0.6747517518984224, 'rsi_os': 13, 'rsi_ob': 76, 'vol_spike': 0.22236146755333164, 'adx_thresh': 6.674196784660609, 'atr_min_pct': 0.005077374650342968, 'atr_max_pct': 0.11747969127620773, 'tp_mult': 1.4457524785414986, 'tsl_mult': 0.778482528651862, 'strategy': 'breakout', 'time_stop': 141, 'use_sma': False, 'use_atr': False, 'use_adx': True, 'use_ema': False, 'use_spike': False, 'rsi_required': False, 'edge_k': 0.526132543123194, 'edge_cap': 0.9798106997038315, 'bull_strategy': 'breakout', 'bull_bb_std_mult': 1.8971845010989399, 'bull_rsi_os': 20, 'bull_rsi_ob': 84, 'bull_adx_thresh': 9.118144738298092, 'bull_atr_min_pct': 0.020039707612199836, 'bull_atr_max_pct': 0.14678124850990998, 'bull_tp_mult': 2.8264486206769206, 'bull_tsl_mult': 0.144487723597007, 'bull_time_stop': 57, 'bull_use_sma': True, 'bull_use_ema': True, 'bull_use_atr': True, 'bull_use_adx': True, 'bull_use_spike': True, 'bull_rsi_required': False, 'bear_strategy': 'mean_reversion', 'bear_bb_std_mult': 1.7360493228818705, 'bear_rsi_os': 49, 'bear_rsi_ob': 61, 'bear_adx_thresh': 17.470377713163465, 'bear_atr_min_pct': 0.0035197253472862475, 'bear_atr_max_pct': 0.11402419293513331, 'bear_tp_mult': 1.7097305342584062, 'bear_tsl_mult': 0.8278016191289483, 'bear_time_stop': 94, 'bear_use_sma': False, 'bear_use_ema': False, 'bear_use_atr': True, 'bear_use_adx': True, 'bear_use_spike': True, 'bear_rsi_required': True, 'sideways_strategy': 'mean_reversion', 'sideways_bb_std_mult': 3.2382814169088476, 'sideways_rsi_os': 20, 'sideways_rsi_ob': 80, 'sideways_adx_thresh': 10.603425943247716, 'sideways_atr_min_pct': 0.019979736818061197, 'sideways_atr_max_pct': 0.04211802619078093, 'sideways_tp_mult': 1.1646881785250889, 'sideways_tsl_mult': 0.36162861635827387, 'sideways_time_stop': 127, 'sideways_use_sma': True, 'sideways_use_ema': False, 'sideways_use_atr': False, 'sideways_use_adx': True, 'sideways_use_spike': True, 'sideways_rsi_required': True}.
[I 2025-08-30 15:56:14,081] Trial 600 finished with values: [-1000000000.0, 1000000000.0] and parameters: {'p_sma': 9, 'p_std': 44, 'p_atr': 13, 'p_adx': 16, 'rsi_period': 12, 'ema1': 24, 'ema2': 37, 'slip_atr_k': 0.09651479014347936, 'slip_spread_k': 0.6731979087112299, 'spread_hl_frac': 0.006964736042807169, 'bb_std_mult': 0.6869097587965032, 'rsi_os': 13, 'rsi_ob': 71, 'vol_spike': 0.22343063660136045, 'adx_thresh': 9.402057151418035, 'atr_min_pct': 0.005076934650375682, 'atr_max_pct': 0.14986698963963946, 'tp_mult': 1.6227436522274035, 'tsl_mult': 0.7701338674203839, 'strategy': 'breakout', 'time_stop': 62, 'use_sma': True, 'use_atr': True, 'use_adx': False, 'use_ema': False, 'use_spike': False, 'rsi_required': False, 'edge_k': 0.5436771912450383, 'edge_cap': 0.9838952473286338, 'bull_strategy': 'breakout', 'bull_bb_std_mult': 1.9319702208638274, 'bull_rsi_os': 48, 'bull_rsi_ob': 84, 'bull_adx_thresh': 27.722869911818098, 'bull_atr_min_pct': 0.01991061138358858, 'bull_atr_max_pct': 0.06214062040130029, 'bull_tp_mult': 2.834032949080614, 'bull_tsl_mult': 0.8833382077212222, 'bull_time_stop': 56, 'bull_use_sma': True, 'bull_use_ema': True, 'bull_use_atr': True, 'bull_use_adx': True, 'bull_use_spike': True, 'bull_rsi_required': False, 'bear_strategy': 'mean_reversion', 'bear_bb_std_mult': 2.188631916434881, 'bear_rsi_os': 13, 'bear_rsi_ob': 62, 'bear_adx_thresh': 14.263384587455135, 'bear_atr_min_pct': 0.003925189432504549, 'bear_atr_max_pct': 0.11346978225609206, 'bear_tp_mult': 2.2223119763737516, 'bear_tsl_mult': 0.8238927640091502, 'bear_time_stop': 90, 'bear_use_sma': False, 'bear_use_ema': False, 'bear_use_atr': False, 'bear_use_adx': False, 'bear_use_spike': True, 'bear_rsi_required': True, 'sideways_strategy': 'mean_reversion', 'sideways_bb_std_mult': 3.5139693206799043, 'sideways_rsi_os': 24, 'sideways_rsi_ob': 79, 'sideways_adx_thresh': 10.571546949162979, 'sideways_atr_min_pct': 0.020127263585167594, 'sideways_atr_max_pct': 0.06925302296586143, 'sideways_tp_mult': 1.2848864529664348, 'sideways_tsl_mult': 0.2944453726952894, 'sideways_time_stop': 137, 'sideways_use_sma': True, 'sideways_use_ema': False, 'sideways_use_atr': False, 'sideways_use_adx': False, 'sideways_use_spike': True, 'sideways_rsi_required': True}.
[I 2025-08-30 15:56:14,961] Trial 604 finished with values: [-1000000000.0, 1000000000.0] and parameters: {'p_sma': 8, 'p_std': 59, 'p_atr': 13, 'p_adx': 25, 'rsi_period': 61, 'ema1': 22, 'ema2': 27, 'slip_atr_k': 0.00011338419412216865, 'slip_spread_k': 0.6984573025090736, 'spread_hl_frac': 0.009548738693447537, 'bb_std_mult': 2.3586228253794372, 'rsi_os': 55, 'rsi_ob': 89, 'vol_spike': 0.12044007127626412, 'adx_thresh': 8.268439485773856, 'atr_min_pct': 0.019405160763763963, 'atr_max_pct': 0.11553456156886419, 'tp_mult': 1.5732819941415672, 'tsl_mult': 0.6818148911928852, 'strategy': 'mean_reversion', 'time_stop': 158, 'use_sma': True, 'use_atr': True, 'use_adx': False, 'use_ema': False, 'use_spike': False, 'rsi_required': False, 'edge_k': 0.5854906400359764, 'edge_cap': 0.4113739557924252, 'bull_strategy': 'breakout', 'bull_bb_std_mult': 2.170924367231288, 'bull_rsi_os': 12, 'bull_rsi_ob': 74, 'bull_adx_thresh': 14.676371028977993, 'bull_atr_min_pct': 0.021756711957214677, 'bull_atr_max_pct': 0.0971974409505277, 'bull_tp_mult': 2.5180341697399937, 'bull_tsl_mult': 0.8301433358749445, 'bull_time_stop': 48, 'bull_use_sma': False, 'bull_use_ema': True, 'bull_use_atr': True, 'bull_use_adx': True, 'bull_use_spike': False, 'bull_rsi_required': False, 'bear_strategy': 'mean_reversion', 'bear_bb_std_mult': 1.930002042400471, 'bear_rsi_os': 47, 'bear_rsi_ob': 57, 'bear_adx_thresh': 16.661819006119977, 'bear_atr_min_pct': 0.002797285546563231, 'bear_atr_max_pct': 0.10956787691226177, 'bear_tp_mult': 2.107803659510123, 'bear_tsl_mult': 0.9183691071045239, 'bear_time_stop': 87, 'bear_use_sma': True, 'bear_use_ema': False, 'bear_use_atr': False, 'bear_use_adx': False, 'bear_use_spike': True, 'bear_rsi_required': True, 'sideways_strategy': 'mean_reversion', 'sideways_bb_std_mult': 3.126480624095472, 'sideways_rsi_os': 16, 'sideways_rsi_ob': 77, 'sideways_adx_thresh': 11.835008187966803, 'sideways_atr_min_pct': 0.02105564930944246, 'sideways_atr_max_pct': 0.07231152792623617, 'sideways_tp_mult': 2.00046917577618, 'sideways_tsl_mult': 0.5100051650394912, 'sideways_time_stop': 117, 'sideways_use_sma': True, 'sideways_use_ema': False, 'sideways_use_atr': True, 'sideways_use_adx': False, 'sideways_use_spike': True, 'sideways_rsi_required': True}.
[I 2025-08-30 15:56:53,725] Trial 603 finished with values: [-1000000000.0, 1000000000.0] and parameters: {'p_sma': 9, 'p_std': 60, 'p_atr': 13, 'p_adx': 25, 'rsi_period': 74, 'ema1': 24, 'ema2': 27, 'slip_atr_k': 0.2099350741814721, 'slip_spread_k': 0.7179294734664409, 'spread_hl_frac': 0.006658121250168344, 'bb_std_mult': 1.9162747960013407, 'rsi_os': 30, 'rsi_ob': 89, 'vol_spike': 0.20796076132170307, 'adx_thresh': 9.530966739485192, 'atr_min_pct': 0.001253262330523499, 'atr_max_pct': 0.12334354074192933, 'tp_mult': 2.8520995816750565, 'tsl_mult': 0.3887022735189479, 'strategy': 'breakout', 'time_stop': 217, 'use_sma': True, 'use_atr': True, 'use_adx': False, 'use_ema': False, 'use_spike': False, 'rsi_required': False, 'edge_k': 1.4478163359403566, 'edge_cap': 0.9984463072470944, 'bull_strategy': 'breakout', 'bull_bb_std_mult': 1.522075938463456, 'bull_rsi_os': 50, 'bull_rsi_ob': 77, 'bull_adx_thresh': 10.213951993718306, 'bull_atr_min_pct': 0.021678703175406173, 'bull_atr_max_pct': 0.07157010099232465, 'bull_tp_mult': 2.5367783052405675, 'bull_tsl_mult': 0.8253742370564637, 'bull_time_stop': 50, 'bull_use_sma': False, 'bull_use_ema': True, 'bull_use_atr': True, 'bull_use_adx': True, 'bull_use_spike': False, 'bull_rsi_required': False, 'bear_strategy': 'mean_reversion', 'bear_bb_std_mult': 1.910205530448255, 'bear_rsi_os': 26, 'bear_rsi_ob': 57, 'bear_adx_thresh': 21.301662363815556, 'bear_atr_min_pct': 0.0023107318285117417, 'bear_atr_max_pct': 0.08680642183030382, 'bear_tp_mult': 2.2566817863629063, 'bear_tsl_mult': 0.8029360149531495, 'bear_time_stop': 88, 'bear_use_sma': True, 'bear_use_ema': False, 'bear_use_atr': False, 'bear_use_adx': False, 'bear_use_spike': True, 'bear_rsi_required': True, 'sideways_strategy': 'mean_reversion', 'sideways_bb_std_mult': 3.112059733221466, 'sideways_rsi_os': 16, 'sideways_rsi_ob': 77, 'sideways_adx_thresh': 16.06366721638025, 'sideways_atr_min_pct': 0.017380542504072123, 'sideways_atr_max_pct': 0.06978731367397259, 'sideways_tp_mult': 1.6933940119608726, 'sideways_tsl_mult': 0.5076745647048823, 'sideways_time_stop': 137, 'sideways_use_sma': True, 'sideways_use_ema': False, 'sideways_use_atr': False, 'sideways_use_adx': False, 'sideways_use_spike': True, 'sideways_rsi_required': True}.
