[I 2025-08-30 14:22:48,063] Trial 17 finished with values: [-1000000000.0, 1000000000.0] and parameters: {'p_sma': 19, 'p_std': 30, 'p_atr': 10, 'p_adx': 8, 'rsi_period': 8, 'ema1': 12, 'ema2': 60, 'slip_atr_k': 0.0607209651150999, 'slip_spread_k': 0.36692649013424805, 'spread_hl_frac': 0.014615854740313378, 'bb_std_mult': 0.5972320068448422, 'rsi_os': 18, 'rsi_ob': 81, 'vol_spike': 0.20266309315948744, 'adx_thresh': 9.732285750240152, 'atr_min_pct': 0.020756073615158993, 'atr_max_pct': 0.041384477954558, 'tp_mult': 2.6090898222487735, 'tsl_mult': 0.5469480839060583, 'strategy': 'mean_reversion', 'time_stop': 297, 'use_sma': False, 'use_atr': True, 'use_adx': False, 'use_ema': False, 'use_spike': True, 'rsi_required': False, 'edge_k': 0.04933684600510102, 'edge_cap': 0.9975153563357435, 'bull_strategy': 'breakout', 'bull_bb_std_mult': 0.972271239315323, 'bull_rsi_os': 32, 'bull_rsi_ob': 83, 'bull_adx_thresh': 23.67108744965435, 'bull_atr_min_pct': 0.006779355984824865, 'bull_atr_max_pct': 0.10656274693564025, 'bull_tp_mult': 1.0391772299434046, 'bull_tsl_mult': 0.6152639460113923, 'bull_time_stop': 94, 'bull_use_sma': True, 'bull_use_ema': True, 'bull_use_atr': True, 'bull_use_adx': False, 'bull_use_spike': True, 'bull_rsi_required': True, 'bear_strategy': 'mean_reversion', 'bear_bb_std_mult': 1.5594446459440547, 'bear_rsi_os': 40, 'bear_rsi_ob': 85, 'bear_adx_thresh': 7.266752675511775, 'bear_atr_min_pct': 0.010348940949355602, 'bear_atr_max_pct': 0.06657176466050299, 'bear_tp_mult': 1.701448516425142, 'bear_tsl_mult': 0.7182031284187083, 'bear_time_stop': 179, 'bear_use_sma': False, 'bear_use_ema': True, 'bear_use_atr': False, 'bear_use_adx': False, 'bear_use_spike': True, 'bear_rsi_required': False, 'sideways_strategy': 'breakout', 'sideways_bb_std_mult': 1.684897149298377, 'sideways_rsi_os': 5, 'sideways_rsi_ob': 95, 'sideways_adx_thresh': 17.09450030463466, 'sideways_atr_min_pct': 0.028364597294664527, 'sideways_atr_max_pct': 0.10790286940699899, 'sideways_tp_mult': 1.6336461077116262, 'sideways_tsl_mult': 0.0040034122840464925, 'sideways_time_stop': 282, 'sideways_use_sma': False, 'sideways_use_ema': True, 'sideways_use_atr': False, 'sideways_use_adx': False, 'sideways_use_spike': False, 'sideways_rsi_required': True}.
[I 2025-08-30 14:22:48,105] Trial 19 finished with values: [-1000000000.0, 1000000000.0] and parameters: {'p_sma': 19, 'p_std': 42, 'p_atr': 9, 'p_adx': 27, 'rsi_period': 7, 'ema1': 12, 'ema2': 33, 'slip_atr_k': 0.05482851544558107, 'slip_spread_k': 0.1088364313246847, 'spread_hl_frac': 0.017878495355441528, 'bb_std_mult': 0.7697255983144778, 'rsi_os': 53, 'rsi_ob': 77, 'vol_spike': 0.19762761095138714, 'adx_thresh': 7.300946901918653, 'atr_min_pct': 0.01994636390462635, 'atr_max_pct': 0.046002787059209196, 'tp_mult': 2.1994654793105797, 'tsl_mult': 0.07137312540720936, 'strategy': 'mean_reversion', 'time_stop': 239, 'use_sma': True, 'use_atr': True, 'use_adx': False, 'use_ema': False, 'use_spike': True, 'rsi_required': True, 'edge_k': 1.7154093461253899, 'edge_cap': 0.9963092376498133, 'bull_strategy': 'breakout', 'bull_bb_std_mult': 1.9537148178990829, 'bull_rsi_os': 35, 'bull_rsi_ob': 63, 'bull_adx_thresh': 23.79006805766196, 'bull_atr_min_pct': 0.009870915840097534, 'bull_atr_max_pct': 0.11323623068772184, 'bull_tp_mult': 2.415042499742439, 'bull_tsl_mult': 0.2461796162304657, 'bull_time_stop': 95, 'bull_use_sma': True, 'bull_use_ema': True, 'bull_use_atr': True, 'bull_use_adx': False, 'bull_use_spike': True, 'bull_rsi_required': True, 'bear_strategy': 'mean_reversion', 'bear_bb_std_mult': 2.8080767880648745, 'bear_rsi_os': 40, 'bear_rsi_ob': 76, 'bear_adx_thresh': 16.846103327614287, 'bear_atr_min_pct': 0.019432271609751167, 'bear_atr_max_pct': 0.05764440736362911, 'bear_tp_mult': 2.157515720509765, 'bear_tsl_mult': 0.7877342371417415, 'bear_time_stop': 84, 'bear_use_sma': False, 'bear_use_ema': True, 'bear_use_atr': False, 'bear_use_adx': False, 'bear_use_spike': True, 'bear_rsi_required': False, 'sideways_strategy': 'breakout', 'sideways_bb_std_mult': 1.5870114177499257, 'sideways_rsi_os': 54, 'sideways_rsi_ob': 60, 'sideways_adx_thresh': 6.584626802186962, 'sideways_atr_min_pct': 0.015288064665708916, 'sideways_atr_max_pct': 0.10078032858721558, 'sideways_tp_mult': 1.6634579434999437, 'sideways_tsl_mult': 0.06794082664319015, 'sideways_time_stop': 294, 'sideways_use_sma': False, 'sideways_use_ema': True, 'sideways_use_atr': False, 'sideways_use_adx': False, 'sideways_use_spike': False, 'sideways_rsi_required': False}.
[I 2025-08-30 14:23:19,672] Trial 20 finished with values: [-1000000000.0, 1000000000.0] and parameters: {'p_sma': 8, 'p_std': 42, 'p_atr': 30, 'p_adx': 25, 'rsi_period': 42, 'ema1': 5, 'ema2': 33, 'slip_atr_k': 0.056779101463091716, 'slip_spread_k': 0.13443957253223832, 'spread_hl_frac': 0.006960345156625294, 'bb_std_mult': 0.9239952326826528, 'rsi_os': 48, 'rsi_ob': 95, 'vol_spike': 0.27280717490278433, 'adx_thresh': 8.84958007060931, 'atr_min_pct': 0.01791551549368927, 'atr_max_pct': 0.06686915684501828, 'tp_mult': 2.143107026978886, 'tsl_mult': 0.022848648428204388, 'strategy': 'mean_reversion', 'time_stop': 192, 'use_sma': False, 'use_atr': True, 'use_adx': False, 'use_ema': False, 'use_spike': True, 'rsi_required': False, 'edge_k': 1.673835136832471, 'edge_cap': 0.9881700828013229, 'bull_strategy': 'breakout', 'bull_bb_std_mult': 1.9742769024320854, 'bull_rsi_os': 55, 'bull_rsi_ob': 94, 'bull_adx_thresh': 22.003821742082522, 'bull_atr_min_pct': 0.013258919804665899, 'bull_atr_max_pct': 0.12428851170362122, 'bull_tp_mult': 1.459270024479587, 'bull_tsl_mult': 0.582504325416032, 'bull_time_stop': 96, 'bull_use_sma': True, 'bull_use_ema': True, 'bull_use_atr': True, 'bull_use_adx': False, 'bull_use_spike': True, 'bull_rsi_required': True, 'bear_strategy': 'mean_reversion', 'bear_bb_std_mult': 2.6245020500668175, 'bear_rsi_os': 38, 'bear_rsi_ob': 76, 'bear_adx_thresh': 11.664758998905338, 'bear_atr_min_pct': 0.011928993422208982, 'bear_atr_max_pct': 0.014640105149171929, 'bear_tp_mult': 2.5343027727441103, 'bear_tsl_mult': 0.8186765208800857, 'bear_time_stop': 65, 'bear_use_sma': False, 'bear_use_ema': True, 'bear_use_atr': False, 'bear_use_adx': False, 'bear_use_spike': True, 'bear_rsi_required': True, 'sideways_strategy': 'breakout', 'sideways_bb_std_mult': 0.9344862219236776, 'sideways_rsi_os': 18, 'sideways_rsi_ob': 59, 'sideways_adx_thresh': 19.88833288981334, 'sideways_atr_min_pct': 0.025480794102735124, 'sideways_atr_max_pct': 0.06527272749507164, 'sideways_tp_mult': 2.2266576417890014, 'sideways_tsl_mult': 0.041945231354793, 'sideways_time_stop': 247, 'sideways_use_sma': False, 'sideways_use_ema': True, 'sideways_use_atr': False, 'sideways_use_adx': False, 'sideways_use_spike': False, 'sideways_rsi_required': True}.
[I 2025-08-30 14:23:19,784] Trial 23 finished with values: [-1000000000.0, 1000000000.0] and parameters: {'p_sma': 41, 'p_std': 25, 'p_atr': 21, 'p_adx': 19, 'rsi_period': 41, 'ema1': 5, 'ema2': 10, 'slip_atr_k': 0.12303794070334859, 'slip_spread_k': 0.685939106446553, 'spread_hl_frac': 0.02395319335448886, 'bb_std_mult': 1.087916991492335, 'rsi_os': 5, 'rsi_ob': 94, 'vol_spike': 0.16212700894106513, 'adx_thresh': 28.939989121681602, 'atr_min_pct': 0.0003324801335816835, 'atr_max_pct': 0.06934092152698379, 'tp_mult': 2.0464770461693664, 'tsl_mult': 0.00117343121173491, 'strategy': 'breakout', 'time_stop': 182, 'use_sma': False, 'use_atr': False, 'use_adx': False, 'use_ema': True, 'use_spike': False, 'rsi_required': True, 'edge_k': 1.5807330773240547, 'edge_cap': 0.48774626537708826, 'bull_strategy': 'mean_reversion', 'bull_bb_std_mult': 0.7560790137190964, 'bull_rsi_os': 39, 'bull_rsi_ob': 92, 'bull_adx_thresh': 29.482814301326673, 'bull_atr_min_pct': 0.018085467300298443, 'bull_atr_max_pct': 0.01219528355090616, 'bull_tp_mult': 1.460240117247557, 'bull_tsl_mult': 0.9742283748122774, 'bull_time_stop': 66, 'bull_use_sma': False, 'bull_use_ema': True, 'bull_use_atr': False, 'bull_use_adx': True, 'bull_use_spike': False, 'bull_rsi_required': False, 'bear_strategy': 'breakout', 'bear_bb_std_mult': 0.5133110933031556, 'bear_rsi_os': 5, 'bear_rsi_ob': 95, 'bear_adx_thresh': 29.364656885762543, 'bear_atr_min_pct': 0.006807759246489365, 'bear_atr_max_pct': 0.12293550701873905, 'bear_tp_mult': 2.547738059311861, 'bear_tsl_mult': 0.9224997163748909, 'bear_time_stop': 223, 'bear_use_sma': True, 'bear_use_ema': False, 'bear_use_atr': False, 'bear_use_adx': False, 'bear_use_spike': False, 'bear_rsi_required': False, 'sideways_strategy': 'breakout', 'sideways_bb_std_mult': 3.148952723403898, 'sideways_rsi_os': 21, 'sideways_rsi_ob': 78, 'sideways_adx_thresh': 11.051343007225531, 'sideways_atr_min_pct': 0.02432963265528727, 'sideways_atr_max_pct': 0.032792131918548725, 'sideways_tp_mult': 2.1539136934169125, 'sideways_tsl_mult': 0.17830141316172646, 'sideways_time_stop': 191, 'sideways_use_sma': True, 'sideways_use_ema': True, 'sideways_use_atr': True, 'sideways_use_adx': True, 'sideways_use_spike': False, 'sideways_rsi_required': False}.
[I 2025-08-30 14:23:20,087] Trial 21 finished with values: [-1000000000.0, 1000000000.0] and parameters: {'p_sma': 41, 'p_std': 46, 'p_atr': 21, 'p_adx': 18, 'rsi_period': 41, 'ema1': 13, 'ema2': 10, 'slip_atr_k': 0.06883916415825449, 'slip_spread_k': 0.6728077833356861, 'spread_hl_frac': 0.01929097381132642, 'bb_std_mult': 0.9743244867949548, 'rsi_os': 19, 'rsi_ob': 92, 'vol_spike': 0.16830136062316337, 'adx_thresh': 29.67404921500111, 'atr_min_pct': 0.016903294161321025, 'atr_max_pct': 0.050955841304319474, 'tp_mult': 2.0631091297966413, 'tsl_mult': 0.009261369140792872, 'strategy': 'breakout', 'time_stop': 177, 'use_sma': True, 'use_atr': False, 'use_adx': False, 'use_ema': True, 'use_spike': False, 'rsi_required': True, 'edge_k': 1.671248451212818, 'edge_cap': 0.47593412222120357, 'bull_strategy': 'mean_reversion', 'bull_bb_std_mult': 0.848845493506508, 'bull_rsi_os': 35, 'bull_rsi_ob': 95, 'bull_adx_thresh': 29.44585621712758, 'bull_atr_min_pct': 0.015488840403776473, 'bull_atr_max_pct': 0.01517682206060482, 'bull_tp_mult': 1.4902124192506043, 'bull_tsl_mult': 0.6548095157824085, 'bull_time_stop': 100, 'bull_use_sma': False, 'bull_use_ema': True, 'bull_use_atr': False, 'bull_use_adx': True, 'bull_use_spike': False, 'bull_rsi_required': False, 'bear_strategy': 'breakout', 'bear_bb_std_mult': 1.5389898288773114, 'bear_rsi_os': 41, 'bear_rsi_ob': 77, 'bear_adx_thresh': 29.320920496581337, 'bear_atr_min_pct': 0.007192321260596282, 'bear_atr_max_pct': 0.12523502452391738, 'bear_tp_mult': 2.556648410576512, 'bear_tsl_mult': 0.992620098656815, 'bear_time_stop': 225, 'bear_use_sma': True, 'bear_use_ema': False, 'bear_use_atr': False, 'bear_use_adx': False, 'bear_use_spike': False, 'bear_rsi_required': False, 'sideways_strategy': 'breakout', 'sideways_bb_std_mult': 3.0355179144896556, 'sideways_rsi_os': 19, 'sideways_rsi_ob': 95, 'sideways_adx_thresh': 6.918892295551887, 'sideways_atr_min_pct': 0.0249711966690932, 'sideways_atr_max_pct': 0.066858530110685, 'sideways_tp_mult': 2.2023115456005713, 'sideways_tsl_mult': 0.018058118271957982, 'sideways_time_stop': 197, 'sideways_use_sma': True, 'sideways_use_ema': True, 'sideways_use_atr': True, 'sideways_use_adx': True, 'sideways_use_spike': False, 'sideways_rsi_required': False}.
[I 2025-08-30 14:23:20,248] Trial 22 finished with values: [-1000000000.0, 1000000000.0] and parameters: {'p_sma': 41, 'p_std': 44, 'p_atr': 21, 'p_adx': 19, 'rsi_period': 41, 'ema1': 14, 'ema2': 32, 'slip_atr_k': 0.12400639084432512, 'slip_spread_k': 0.6766401049155356, 'spread_hl_frac': 0.024230978650874386, 'bb_std_mult': 0.9815870116355696, 'rsi_os': 6, 'rsi_ob': 95, 'vol_spike': 0.16586683028306382, 'adx_thresh': 28.14873532755989, 'atr_min_pct': 0.00039351883350092, 'atr_max_pct': 0.06404272474040347, 'tp_mult': 2.2056410714508594, 'tsl_mult': 0.033403679005525225, 'strategy': 'breakout', 'time_stop': 175, 'use_sma': True, 'use_atr': False, 'use_adx': False, 'use_ema': True, 'use_spike': False, 'rsi_required': True, 'edge_k': 1.6689923244659777, 'edge_cap': 0.44400156654342254, 'bull_strategy': 'mean_reversion', 'bull_bb_std_mult': 1.9924841903422505, 'bull_rsi_os': 37, 'bull_rsi_ob': 93, 'bull_adx_thresh': 29.698014438620874, 'bull_atr_min_pct': 0.01379956800788195, 'bull_atr_max_pct': 0.03984041567793616, 'bull_tp_mult': 1.459732814787151, 'bull_tsl_mult': 0.9744970530954482, 'bull_time_stop': 69, 'bull_use_sma': False, 'bull_use_ema': True, 'bull_use_atr': False, 'bull_use_adx': True, 'bull_use_spike': False, 'bull_rsi_required': False, 'bear_strategy': 'breakout', 'bear_bb_std_mult': 1.6023839183344886, 'bear_rsi_os': 15, 'bear_rsi_ob': 76, 'bear_adx_thresh': 30.00552128093876, 'bear_atr_min_pct': 0.008197985769661142, 'bear_atr_max_pct': 0.12626709507086623, 'bear_tp_mult': 1.433197946855198, 'bear_tsl_mult': 0.9705882490333593, 'bear_time_stop': 224, 'bear_use_sma': True, 'bear_use_ema': False, 'bear_use_atr': False, 'bear_use_adx': False, 'bear_use_spike': False, 'bear_rsi_required': False, 'sideways_strategy': 'breakout', 'sideways_bb_std_mult': 3.080867430420331, 'sideways_rsi_os': 21, 'sideways_rsi_ob': 77, 'sideways_adx_thresh': 11.291996172893182, 'sideways_atr_min_pct': 0.024614474945479865, 'sideways_atr_max_pct': 0.032626344993119706, 'sideways_tp_mult': 2.2115880595888373, 'sideways_tsl_mult': 0.13793602602785648, 'sideways_time_stop': 190, 'sideways_use_sma': True, 'sideways_use_ema': True, 'sideways_use_atr': True, 'sideways_use_adx': True, 'sideways_use_spike': False, 'sideways_rsi_required': False}.
[I 2025-08-30 14:23:51,182] Trial 26 finished with values: [-1000000000.0, 1000000000.0] and parameters: {'p_sma': 28, 'p_std': 5, 'p_atr': 16, 'p_adx': 10, 'rsi_period': 62, 'ema1': 8, 'ema2': 19, 'slip_atr_k': 0.0935480481676071, 'slip_spread_k': 0.641190952314831, 'spread_hl_frac': 0.03207384663201732, 'bb_std_mult': 1.7012905048063058, 'rsi_os': 6, 'rsi_ob': 73, 'vol_spike': 0.0008289963704931902, 'adx_thresh': 31.628881804447225, 'atr_min_pct': 0.011852095138458573, 'atr_max_pct': 0.026282191854327973, 'tp_mult': 2.384596473840031, 'tsl_mult': 0.22792570062106443, 'strategy': 'breakout', 'time_stop': 213, 'use_sma': False, 'use_atr': False, 'use_adx': False, 'use_ema': True, 'use_spike': False, 'rsi_required': True, 'edge_k': 1.9595179320924445, 'edge_cap': 0.39929290097480724, 'bull_strategy': 'mean_reversion', 'bull_bb_std_mult': 1.4268056911115883, 'bull_rsi_os': 23, 'bull_rsi_ob': 79, 'bull_adx_thresh': 34.86293297284952, 'bull_atr_min_pct': 0.010788766349112952, 'bull_atr_max_pct': 0.0349074076221419, 'bull_tp_mult': 1.2600495888032148, 'bull_tsl_mult': 0.8701296750992851, 'bull_time_stop': 65, 'bull_use_sma': False, 'bull_use_ema': True, 'bull_use_atr': False, 'bull_use_adx': False, 'bull_use_spike': False, 'bull_rsi_required': False, 'bear_strategy': 'breakout', 'bear_bb_std_mult': 1.17171418873043, 'bear_rsi_os': 24, 'bear_rsi_ob': 90, 'bear_adx_thresh': 34.546235169460054, 'bear_atr_min_pct': 0.014768431916402428, 'bear_atr_max_pct': 0.09749850250778863, 'bear_tp_mult': 1.4351047523359026, 'bear_tsl_mult': 0.6208693543242537, 'bear_time_stop': 138, 'bear_use_sma': True, 'bear_use_ema': True, 'bear_use_atr': True, 'bear_use_adx': True, 'bear_use_spike': True, 'bear_rsi_required': False, 'sideways_strategy': 'breakout', 'sideways_bb_std_mult': 3.1756553140893686, 'sideways_rsi_os': 46, 'sideways_rsi_ob': 85, 'sideways_adx_thresh': 13.720850537543566, 'sideways_atr_min_pct': 0.026944030480003343, 'sideways_atr_max_pct': 0.03248710817508244, 'sideways_tp_mult': 2.983281814747554, 'sideways_tsl_mult': 0.17005908602380118, 'sideways_time_stop': 5, 'sideways_use_sma': True, 'sideways_use_ema': False, 'sideways_use_atr': True, 'sideways_use_adx': False, 'sideways_use_spike': True, 'sideways_rsi_required': False}.
[I 2025-08-30 14:23:52,436] Trial 24 finished with values: [-1000000000.0, 1000000000.0] and parameters: {'p_sma': 40, 'p_std': 11, 'p_atr': 16, 'p_adx': 10, 'rsi_period': 61, 'ema1': 14, 'ema2': 20, 'slip_atr_k': 0.1027177066068812, 'slip_spread_k': 0.6775598382377448, 'spread_hl_frac': 0.0317006690417409, 'bb_std_mult': 0.9838451965897457, 'rsi_os': 10, 'rsi_ob': 88, 'vol_spike': 0.1726771638745066, 'adx_thresh': 30.48536604399955, 'atr_min_pct': 0.010923508783475304, 'atr_max_pct': 0.02524997780661699, 'tp_mult': 2.294465378579333, 'tsl_mult': 0.23536767374752585, 'strategy': 'breakout', 'time_stop': 210, 'use_sma': False, 'use_atr': False, 'use_adx': False, 'use_ema': True, 'use_spike': False, 'rsi_required': True, 'edge_k': 1.9910706944895729, 'edge_cap': 0.3941918875196311, 'bull_strategy': 'mean_reversion', 'bull_bb_std_mult': 1.4489767947770384, 'bull_rsi_os': 23, 'bull_rsi_ob': 77, 'bull_adx_thresh': 31.56887048529914, 'bull_atr_min_pct': 0.017851023665465513, 'bull_atr_max_pct': 0.035450737061520826, 'bull_tp_mult': 1.2492655641602772, 'bull_tsl_mult': 0.814081718902223, 'bull_time_stop': 123, 'bull_use_sma': False, 'bull_use_ema': True, 'bull_use_atr': False, 'bull_use_adx': False, 'bull_use_spike': False, 'bull_rsi_required': False, 'bear_strategy': 'breakout', 'bear_bb_std_mult': 1.790604549004113, 'bear_rsi_os': 15, 'bear_rsi_ob': 90, 'bear_adx_thresh': 34.71330316119912, 'bear_atr_min_pct': 0.013971692354252118, 'bear_atr_max_pct': 0.13244623973553307, 'bear_tp_mult': 1.4468119719618677, 'bear_tsl_mult': 0.9718677377030505, 'bear_time_stop': 130, 'bear_use_sma': True, 'bear_use_ema': True, 'bear_use_atr': False, 'bear_use_adx': False, 'bear_use_spike': True, 'bear_rsi_required': False, 'sideways_strategy': 'breakout', 'sideways_bb_std_mult': 3.229752633749771, 'sideways_rsi_os': 43, 'sideways_rsi_ob': 85, 'sideways_adx_thresh': 5.091094189596872, 'sideways_atr_min_pct': 0.026543941096169612, 'sideways_atr_max_pct': 0.030559671523453576, 'sideways_tp_mult': 2.9637753022907316, 'sideways_tsl_mult': 0.1795291063086334, 'sideways_time_stop': 187, 'sideways_use_sma': True, 'sideways_use_ema': True, 'sideways_use_atr': True, 'sideways_use_adx': False, 'sideways_use_spike': False, 'sideways_rsi_required': False}.
[I 2025-08-30 14:23:52,546] Trial 27 finished with values: [-1000000000.0, 1000000000.0] and parameters: {'p_sma': 29, 'p_std': 10, 'p_atr': 15, 'p_adx': 9, 'rsi_period': 61, 'ema1': 8, 'ema2': 41, 'slip_atr_k': 0.08726751569023741, 'slip_spread_k': 0.48960273995466025, 'spread_hl_frac': 0.0327083667321883, 'bb_std_mult': 1.603065987099188, 'rsi_os': 12, 'rsi_ob': 74, 'vol_spike': 0.22953778413236084, 'adx_thresh': 31.347471749996917, 'atr_min_pct': 0.0108403709002308, 'atr_max_pct': 0.025986766659251363, 'tp_mult': 1.8778432434190733, 'tsl_mult': 0.22868246101208703, 'strategy': 'breakout', 'time_stop': 210, 'use_sma': False, 'use_atr': False, 'use_adx': False, 'use_ema': True, 'use_spike': False, 'rsi_required': True, 'edge_k': 1.9708813973197257, 'edge_cap': 0.38748225155090055, 'bull_strategy': 'mean_reversion', 'bull_bb_std_mult': 1.373947494094176, 'bull_rsi_os': 22, 'bull_rsi_ob': 78, 'bull_adx_thresh': 34.74601143817509, 'bull_atr_min_pct': 0.003955244361272779, 'bull_atr_max_pct': 0.05880244148248593, 'bull_tp_mult': 1.2000222002577783, 'bull_tsl_mult': 0.8419172314822346, 'bull_time_stop': 188, 'bull_use_sma': False, 'bull_use_ema': True, 'bull_use_atr': False, 'bull_use_adx': False, 'bull_use_spike': False, 'bull_rsi_required': False, 'bear_strategy': 'breakout', 'bear_bb_std_mult': 1.8255051466262229, 'bear_rsi_os': 23, 'bear_rsi_ob': 90, 'bear_adx_thresh': 34.90974555961328, 'bear_atr_min_pct': 0.012586235961417655, 'bear_atr_max_pct': 0.1007176365696085, 'bear_tp_mult': 1.9381152186536552, 'bear_tsl_mult': 0.5576946237168477, 'bear_time_stop': 142, 'bear_use_sma': True, 'bear_use_ema': True, 'bear_use_atr': True, 'bear_use_adx': True, 'bear_use_spike': True, 'bear_rsi_required': False, 'sideways_strategy': 'breakout', 'sideways_bb_std_mult': 3.2898158253249017, 'sideways_rsi_os': 40, 'sideways_rsi_ob': 84, 'sideways_adx_thresh': 14.237403989639894, 'sideways_atr_min_pct': 0.021584366212857357, 'sideways_atr_max_pct': 0.030396945607933976, 'sideways_tp_mult': 2.992804194878079, 'sideways_tsl_mult': 0.6237432577872344, 'sideways_time_stop': 26, 'sideways_use_sma': True, 'sideways_use_ema': False, 'sideways_use_atr': True, 'sideways_use_adx': False, 'sideways_use_spike': True, 'sideways_rsi_required': False}.
