[I 2025-08-30 14:49:44,594] Trial 243 finished with values: [-0.013181699429941962, 0.013158031428786656] and parameters: {'p_sma': 45, 'p_std': 5, 'p_atr': 20, 'p_adx': 15, 'rsi_period': 26, 'ema1': 13, 'ema2': 46, 'slip_atr_k': 0.03901732866968782, 'slip_spread_k': 0.13400761506158904, 'spread_hl_frac': 0.009995827578370125, 'bb_std_mult': 3.3490633044330256, 'rsi_os': 10, 'rsi_ob': 85, 'vol_spike': 0.09244728597716395, 'adx_thresh': 14.470132438711873, 'atr_min_pct': 0.0036213337141339594, 'atr_max_pct': 0.07425051548301852, 'tp_mult': 2.1899969746303043, 'tsl_mult': 0.5978832812166902, 'strategy': 'breakout', 'time_stop': 231, 'use_sma': True, 'use_atr': False, 'use_adx': False, 'use_ema': False, 'use_spike': False, 'rsi_required': True, 'edge_k': 0.614011579041478, 'edge_cap': 0.5164216532072821, 'bull_strategy': 'mean_reversion', 'bull_bb_std_mult': 2.73191868005998, 'bull_rsi_os': 44, 'bull_rsi_ob': 47, 'bull_adx_thresh': 22.85100526928851, 'bull_atr_min_pct': 0.0025865691030276155, 'bull_atr_max_pct': 0.04210819038810188, 'bull_tp_mult': 1.177141100480131, 'bull_tsl_mult': 0.8938728093901679, 'bull_time_stop': 152, 'bull_use_sma': True, 'bull_use_ema': False, 'bull_use_atr': False, 'bull_use_adx': False, 'bull_use_spike': False, 'bull_rsi_required': False, 'bear_strategy': 'breakout', 'bear_bb_std_mult': 3.598636785921805, 'bear_rsi_os': 32, 'bear_rsi_ob': 90, 'bear_adx_thresh': 7.449405527278102, 'bear_atr_min_pct': 0.028171278253356892, 'bear_atr_max_pct': 0.1495693146483913, 'bear_tp_mult': 2.7526359403850593, 'bear_tsl_mult': 0.5500307094419281, 'bear_time_stop': 292, 'bear_use_sma': False, 'bear_use_ema': True, 'bear_use_atr': True, 'bear_use_adx': False, 'bear_use_spike': False, 'bear_rsi_required': False, 'sideways_strategy': 'mean_reversion', 'sideways_bb_std_mult': 0.9969346236477035, 'sideways_rsi_os': 40, 'sideways_rsi_ob': 63, 'sideways_adx_thresh': 22.453960726914904, 'sideways_atr_min_pct': 0.016330611334392037, 'sideways_atr_max_pct': 0.07170151104346749, 'sideways_tp_mult': 2.998217536351275, 'sideways_tsl_mult': 0.7667696813737814, 'sideways_time_stop': 97, 'sideways_use_sma': True, 'sideways_use_ema': False, 'sideways_use_atr': False, 'sideways_use_adx': False, 'sideways_use_spike': False, 'sideways_rsi_required': True}.
[I 2025-08-30 14:49:53,733] Trial 244 finished with values: [-0.013146644837026877, 0.013082458584293783] and parameters: {'p_sma': 44, 'p_std': 5, 'p_atr': 20, 'p_adx': 9, 'rsi_period': 25, 'ema1': 13, 'ema2': 46, 'slip_atr_k': 0.03684520950475663, 'slip_spread_k': 0.12010554481477446, 'spread_hl_frac': 0.00987502641810616, 'bb_std_mult': 3.4264408525776178, 'rsi_os': 10, 'rsi_ob': 85, 'vol_spike': 0.09359613885421901, 'adx_thresh': 16.65105431613562, 'atr_min_pct': 0.0035242703720112113, 'atr_max_pct': 0.07401545858287058, 'tp_mult': 2.195946724277144, 'tsl_mult': 0.5979124474644739, 'strategy': 'breakout', 'time_stop': 248, 'use_sma': True, 'use_atr': False, 'use_adx': False, 'use_ema': False, 'use_spike': False, 'rsi_required': True, 'edge_k': 0.5146393848285876, 'edge_cap': 0.510321222398037, 'bull_strategy': 'mean_reversion', 'bull_bb_std_mult': 2.9353229075181773, 'bull_rsi_os': 43, 'bull_rsi_ob': 49, 'bull_adx_thresh': 21.868328538321236, 'bull_atr_min_pct': 0.0026231434858399938, 'bull_atr_max_pct': 0.04189189979695255, 'bull_tp_mult': 1.1373583847146573, 'bull_tsl_mult': 0.9398924782117924, 'bull_time_stop': 154, 'bull_use_sma': True, 'bull_use_ema': False, 'bull_use_atr': False, 'bull_use_adx': False, 'bull_use_spike': False, 'bull_rsi_required': False, 'bear_strategy': 'breakout', 'bear_bb_std_mult': 3.509484447887884, 'bear_rsi_os': 36, 'bear_rsi_ob': 89, 'bear_adx_thresh': 7.454421179038785, 'bear_atr_min_pct': 0.028194229800983447, 'bear_atr_max_pct': 0.015289133119474788, 'bear_tp_mult': 2.85765662393644, 'bear_tsl_mult': 0.5552833871396968, 'bear_time_stop': 294, 'bear_use_sma': False, 'bear_use_ema': False, 'bear_use_atr': True, 'bear_use_adx': False, 'bear_use_spike': False, 'bear_rsi_required': False, 'sideways_strategy': 'mean_reversion', 'sideways_bb_std_mult': 0.9941959051352447, 'sideways_rsi_os': 40, 'sideways_rsi_ob': 63, 'sideways_adx_thresh': 22.35932568453326, 'sideways_atr_min_pct': 0.01824162762051921, 'sideways_atr_max_pct': 0.0843455442445372, 'sideways_tp_mult': 2.9614014712702064, 'sideways_tsl_mult': 0.779741367363782, 'sideways_time_stop': 95, 'sideways_use_sma': True, 'sideways_use_ema': False, 'sideways_use_atr': False, 'sideways_use_adx': False, 'sideways_use_spike': False, 'sideways_rsi_required': True}.
[I 2025-08-30 14:50:06,438] Trial 245 finished with values: [-0.015347464047887116, 0.01538839663911841] and parameters: {'p_sma': 45, 'p_std': 5, 'p_atr': 21, 'p_adx': 9, 'rsi_period': 25, 'ema1': 14, 'ema2': 46, 'slip_atr_k': 0.03727998846959585, 'slip_spread_k': 0.12391312417925615, 'spread_hl_frac': 0.009884719700246274, 'bb_std_mult': 3.318930214382986, 'rsi_os': 11, 'rsi_ob': 85, 'vol_spike': 0.09150565951497865, 'adx_thresh': 13.558188851000955, 'atr_min_pct': 0.0034528728591257233, 'atr_max_pct': 0.07435800250116256, 'tp_mult': 2.1957246081370707, 'tsl_mult': 0.5980253219360332, 'strategy': 'breakout', 'time_stop': 231, 'use_sma': True, 'use_atr': False, 'use_adx': False, 'use_ema': False, 'use_spike': False, 'rsi_required': True, 'edge_k': 0.5823787054628822, 'edge_cap': 0.5051716695535065, 'bull_strategy': 'mean_reversion', 'bull_bb_std_mult': 2.9554680369123965, 'bull_rsi_os': 43, 'bull_rsi_ob': 49, 'bull_adx_thresh': 21.936386376636108, 'bull_atr_min_pct': 0.002360940276748118, 'bull_atr_max_pct': 0.04208811839498316, 'bull_tp_mult': 1.2077139204073566, 'bull_tsl_mult': 0.9416123359993321, 'bull_time_stop': 153, 'bull_use_sma': True, 'bull_use_ema': False, 'bull_use_atr': False, 'bull_use_adx': False, 'bull_use_spike': False, 'bull_rsi_required': False, 'bear_strategy': 'breakout', 'bear_bb_std_mult': 3.5125186539781077, 'bear_rsi_os': 36, 'bear_rsi_ob': 89, 'bear_adx_thresh': 7.8076462560135385, 'bear_atr_min_pct': 0.027931285836085396, 'bear_atr_max_pct': 0.1498511319826891, 'bear_tp_mult': 2.8512836495519083, 'bear_tsl_mult': 0.5526481438445981, 'bear_time_stop': 293, 'bear_use_sma': False, 'bear_use_ema': True, 'bear_use_atr': True, 'bear_use_adx': False, 'bear_use_spike': False, 'bear_rsi_required': False, 'sideways_strategy': 'mean_reversion', 'sideways_bb_std_mult': 1.000829786073826, 'sideways_rsi_os': 40, 'sideways_rsi_ob': 63, 'sideways_adx_thresh': 22.59593240480433, 'sideways_atr_min_pct': 0.018366533233664155, 'sideways_atr_max_pct': 0.07104789808041538, 'sideways_tp_mult': 2.953229361416146, 'sideways_tsl_mult': 0.7648970087502893, 'sideways_time_stop': 87, 'sideways_use_sma': True, 'sideways_use_ema': False, 'sideways_use_atr': False, 'sideways_use_adx': False, 'sideways_use_spike': False, 'sideways_rsi_required': True}.
[I 2025-08-30 14:50:14,902] Trial 246 finished with values: [-0.01249412641539216, 0.012471398157262743] and parameters: {'p_sma': 45, 'p_std': 5, 'p_atr': 20, 'p_adx': 15, 'rsi_period': 25, 'ema1': 13, 'ema2': 46, 'slip_atr_k': 0.03690467533410777, 'slip_spread_k': 0.12698240745707182, 'spread_hl_frac': 0.009719710206206456, 'bb_std_mult': 3.3003172007807136, 'rsi_os': 11, 'rsi_ob': 85, 'vol_spike': 0.09238521383991499, 'adx_thresh': 13.488157418691841, 'atr_min_pct': 0.004729035105715552, 'atr_max_pct': 0.07421116367721305, 'tp_mult': 2.3466976633173218, 'tsl_mult': 0.593479483553416, 'strategy': 'breakout', 'time_stop': 233, 'use_sma': True, 'use_atr': False, 'use_adx': False, 'use_ema': False, 'use_spike': False, 'rsi_required': True, 'edge_k': 0.5144448493523301, 'edge_cap': 0.5150228256557512, 'bull_strategy': 'mean_reversion', 'bull_bb_std_mult': 2.904792976540464, 'bull_rsi_os': 43, 'bull_rsi_ob': 45, 'bull_adx_thresh': 21.83184649444224, 'bull_atr_min_pct': 0.002704876009913995, 'bull_atr_max_pct': 0.04258441114224968, 'bull_tp_mult': 1.2233141568166341, 'bull_tsl_mult': 0.9421960258332243, 'bull_time_stop': 153, 'bull_use_sma': True, 'bull_use_ema': False, 'bull_use_atr': False, 'bull_use_adx': False, 'bull_use_spike': False, 'bull_rsi_required': False, 'bear_strategy': 'breakout', 'bear_bb_std_mult': 3.512307084174291, 'bear_rsi_os': 36, 'bear_rsi_ob': 90, 'bear_adx_thresh': 7.56420269270628, 'bear_atr_min_pct': 0.028263931835466445, 'bear_atr_max_pct': 0.14976720467075805, 'bear_tp_mult': 2.853425045962915, 'bear_tsl_mult': 0.5476381079269002, 'bear_time_stop': 291, 'bear_use_sma': False, 'bear_use_ema': True, 'bear_use_atr': True, 'bear_use_adx': False, 'bear_use_spike': False, 'bear_rsi_required': False, 'sideways_strategy': 'mean_reversion', 'sideways_bb_std_mult': 0.9834975392479121, 'sideways_rsi_os': 40, 'sideways_rsi_ob': 64, 'sideways_adx_thresh': 22.606889920328253, 'sideways_atr_min_pct': 0.018359206380741476, 'sideways_atr_max_pct': 0.07263484598860512, 'sideways_tp_mult': 2.954354541221944, 'sideways_tsl_mult': 0.7652617910157163, 'sideways_time_stop': 95, 'sideways_use_sma': True, 'sideways_use_ema': False, 'sideways_use_atr': False, 'sideways_use_adx': False, 'sideways_use_spike': True, 'sideways_rsi_required': True}.
[I 2025-08-30 14:50:16,585] Trial 247 finished with values: [-0.013967671904787649, 0.013942487208226608] and parameters: {'p_sma': 44, 'p_std': 5, 'p_atr': 19, 'p_adx': 9, 'rsi_period': 25, 'ema1': 13, 'ema2': 46, 'slip_atr_k': 0.03619877011172061, 'slip_spread_k': 0.11861927096247342, 'spread_hl_frac': 0.009854747647963404, 'bb_std_mult': 3.3131202435997373, 'rsi_os': 11, 'rsi_ob': 85, 'vol_spike': 0.0943643113806921, 'adx_thresh': 13.292155098148813, 'atr_min_pct': 0.0023661565641427736, 'atr_max_pct': 0.07543939193138846, 'tp_mult': 2.180575651852642, 'tsl_mult': 0.5946823512094467, 'strategy': 'breakout', 'time_stop': 232, 'use_sma': True, 'use_atr': False, 'use_adx': False, 'use_ema': False, 'use_spike': False, 'rsi_required': True, 'edge_k': 0.40461543792082433, 'edge_cap': 0.5065118801349846, 'bull_strategy': 'mean_reversion', 'bull_bb_std_mult': 2.9264656264338416, 'bull_rsi_os': 43, 'bull_rsi_ob': 51, 'bull_adx_thresh': 22.69389787158781, 'bull_atr_min_pct': 0.0025075884589849692, 'bull_atr_max_pct': 0.04259350839222146, 'bull_tp_mult': 1.1876995647127353, 'bull_tsl_mult': 0.9354787269003715, 'bull_time_stop': 156, 'bull_use_sma': True, 'bull_use_ema': False, 'bull_use_atr': True, 'bull_use_adx': False, 'bull_use_spike': False, 'bull_rsi_required': False, 'bear_strategy': 'breakout', 'bear_bb_std_mult': 3.536723183015831, 'bear_rsi_os': 36, 'bear_rsi_ob': 90, 'bear_adx_thresh': 7.381491572062261, 'bear_atr_min_pct': 0.028408598615456287, 'bear_atr_max_pct': 0.14996115990790024, 'bear_tp_mult': 2.749243738396314, 'bear_tsl_mult': 0.5541255935773596, 'bear_time_stop': 294, 'bear_use_sma': False, 'bear_use_ema': True, 'bear_use_atr': True, 'bear_use_adx': False, 'bear_use_spike': False, 'bear_rsi_required': False, 'sideways_strategy': 'mean_reversion', 'sideways_bb_std_mult': 0.8014397509635667, 'sideways_rsi_os': 40, 'sideways_rsi_ob': 63, 'sideways_adx_thresh': 22.462260818936297, 'sideways_atr_min_pct': 0.018718907594223864, 'sideways_atr_max_pct': 0.07227917071379802, 'sideways_tp_mult': 2.9998686797204135, 'sideways_tsl_mult': 0.7624902042899891, 'sideways_time_stop': 100, 'sideways_use_sma': True, 'sideways_use_ema': False, 'sideways_use_atr': False, 'sideways_use_adx': True, 'sideways_use_spike': True, 'sideways_rsi_required': True}.
[I 2025-08-30 14:50:24,838] Trial 248 finished with values: [-1000000000.0, 1000000000.0] and parameters: {'p_sma': 46, 'p_std': 5, 'p_atr': 21, 'p_adx': 9, 'rsi_period': 24, 'ema1': 13, 'ema2': 46, 'slip_atr_k': 0.03641165989647316, 'slip_spread_k': 0.0917943022160908, 'spread_hl_frac': 0.010008834084269625, 'bb_std_mult': 3.316496360994659, 'rsi_os': 10, 'rsi_ob': 85, 'vol_spike': 0.09413972421569353, 'adx_thresh': 16.429494486592468, 'atr_min_pct': 0.004794171675223386, 'atr_max_pct': 0.07350717149530461, 'tp_mult': 2.2047750667369024, 'tsl_mult': 0.653369280345172, 'strategy': 'breakout', 'time_stop': 233, 'use_sma': True, 'use_atr': False, 'use_adx': False, 'use_ema': False, 'use_spike': False, 'rsi_required': True, 'edge_k': 0.5102790597862378, 'edge_cap': 0.5105599065756966, 'bull_strategy': 'mean_reversion', 'bull_bb_std_mult': 2.733589144411236, 'bull_rsi_os': 43, 'bull_rsi_ob': 49, 'bull_adx_thresh': 22.57538119389558, 'bull_atr_min_pct': 0.0035725954388396266, 'bull_atr_max_pct': 0.041679718812760586, 'bull_tp_mult': 1.2183775632955745, 'bull_tsl_mult': 0.9357732933438867, 'bull_time_stop': 154, 'bull_use_sma': True, 'bull_use_ema': False, 'bull_use_atr': True, 'bull_use_adx': False, 'bull_use_spike': False, 'bull_rsi_required': False, 'bear_strategy': 'breakout', 'bear_bb_std_mult': 3.511766973832878, 'bear_rsi_os': 36, 'bear_rsi_ob': 90, 'bear_adx_thresh': 5.944563767534424, 'bear_atr_min_pct': 0.028201662137506994, 'bear_atr_max_pct': 0.1472000542503281, 'bear_tp_mult': 2.751840585485055, 'bear_tsl_mult': 0.5553485380809868, 'bear_time_stop': 294, 'bear_use_sma': False, 'bear_use_ema': True, 'bear_use_atr': True, 'bear_use_adx': False, 'bear_use_spike': False, 'bear_rsi_required': True, 'sideways_strategy': 'mean_reversion', 'sideways_bb_std_mult': 0.8040883523895652, 'sideways_rsi_os': 40, 'sideways_rsi_ob': 63, 'sideways_adx_thresh': 22.484528937390902, 'sideways_atr_min_pct': 0.01895213698009885, 'sideways_atr_max_pct': 0.07192840523389668, 'sideways_tp_mult': 2.956133673461401, 'sideways_tsl_mult': 0.7651090524885695, 'sideways_time_stop': 96, 'sideways_use_sma': True, 'sideways_use_ema': False, 'sideways_use_atr': False, 'sideways_use_adx': True, 'sideways_use_spike': True, 'sideways_rsi_required': True}.
[I 2025-08-30 14:50:37,916] Trial 249 finished with values: [-0.011717722790648977, 0.011653330415754016] and parameters: {'p_sma': 44, 'p_std': 5, 'p_atr': 21, 'p_adx': 7, 'rsi_period': 26, 'ema1': 13, 'ema2': 46, 'slip_atr_k': 0.03816179368936606, 'slip_spread_k': 0.0874371877294338, 'spread_hl_frac': 0.009931522448270816, 'bb_std_mult': 3.3100153740192377, 'rsi_os': 11, 'rsi_ob': 84, 'vol_spike': 0.09250501810059698, 'adx_thresh': 16.420928909028298, 'atr_min_pct': 0.0024670430489307383, 'atr_max_pct': 0.07311396176227156, 'tp_mult': 2.3388286482127327, 'tsl_mult': 0.5942958759715967, 'strategy': 'breakout', 'time_stop': 234, 'use_sma': True, 'use_atr': False, 'use_adx': False, 'use_ema': False, 'use_spike': False, 'rsi_required': True, 'edge_k': 0.4212722758935501, 'edge_cap': 0.509955657455937, 'bull_strategy': 'mean_reversion', 'bull_bb_std_mult': 2.9124018219533614, 'bull_rsi_os': 14, 'bull_rsi_ob': 49, 'bull_adx_thresh': 22.583405288297577, 'bull_atr_min_pct': 0.002760364939233876, 'bull_atr_max_pct': 0.04215865394784705, 'bull_tp_mult': 1.2117279982942522, 'bull_tsl_mult': 0.9310922470583353, 'bull_time_stop': 154, 'bull_use_sma': True, 'bull_use_ema': False, 'bull_use_atr': True, 'bull_use_adx': False, 'bull_use_spike': True, 'bull_rsi_required': False, 'bear_strategy': 'breakout', 'bear_bb_std_mult': 3.5883283371240937, 'bear_rsi_os': 36, 'bear_rsi_ob': 90, 'bear_adx_thresh': 7.363618593303861, 'bear_atr_min_pct': 0.028345977009574527, 'bear_atr_max_pct': 0.14755961215983315, 'bear_tp_mult': 2.858357588808874, 'bear_tsl_mult': 0.5596693810420136, 'bear_time_stop': 294, 'bear_use_sma': False, 'bear_use_ema': True, 'bear_use_atr': True, 'bear_use_adx': False, 'bear_use_spike': False, 'bear_rsi_required': True, 'sideways_strategy': 'mean_reversion', 'sideways_bb_std_mult': 0.8034484564688291, 'sideways_rsi_os': 40, 'sideways_rsi_ob': 63, 'sideways_adx_thresh': 22.50780385338015, 'sideways_atr_min_pct': 0.018452621747602597, 'sideways_atr_max_pct': 0.07333797567010583, 'sideways_tp_mult': 2.996500100545617, 'sideways_tsl_mult': 0.8224732221506388, 'sideways_time_stop': 95, 'sideways_use_sma': True, 'sideways_use_ema': False, 'sideways_use_atr': False, 'sideways_use_adx': True, 'sideways_use_spike': True, 'sideways_rsi_required': True}.
[I 2025-08-30 14:50:48,085] Trial 250 finished with values: [-0.007276715003995182, 0.007301173451075356] and parameters: {'p_sma': 44, 'p_std': 5, 'p_atr': 21, 'p_adx': 9, 'rsi_period': 26, 'ema1': 13, 'ema2': 46, 'slip_atr_k': 0.03702065491688405, 'slip_spread_k': 0.08252996129680379, 'spread_hl_frac': 0.007091075216515082, 'bb_std_mult': 3.3022050139710073, 'rsi_os': 8, 'rsi_ob': 85, 'vol_spike': 0.09608037344131633, 'adx_thresh': 16.72470943998967, 'atr_min_pct': 0.002184873822564168, 'atr_max_pct': 0.0742817528992884, 'tp_mult': 2.192249472851434, 'tsl_mult': 0.6495197242138174, 'strategy': 'breakout', 'time_stop': 236, 'use_sma': False, 'use_atr': False, 'use_adx': False, 'use_ema': False, 'use_spike': False, 'rsi_required': True, 'edge_k': 0.2555980344180454, 'edge_cap': 0.5349586957657455, 'bull_strategy': 'breakout', 'bull_bb_std_mult': 2.927017063319534, 'bull_rsi_os': 23, 'bull_rsi_ob': 49, 'bull_adx_thresh': 22.525448815072608, 'bull_atr_min_pct': 0.0034094666422652326, 'bull_atr_max_pct': 0.04276727431373438, 'bull_tp_mult': 1.1749302422678072, 'bull_tsl_mult': 0.9353527484897791, 'bull_time_stop': 153, 'bull_use_sma': True, 'bull_use_ema': False, 'bull_use_atr': True, 'bull_use_adx': False, 'bull_use_spike': True, 'bull_rsi_required': False, 'bear_strategy': 'mean_reversion', 'bear_bb_std_mult': 3.5299430812998644, 'bear_rsi_os': 36, 'bear_rsi_ob': 90, 'bear_adx_thresh': 7.564815619368762, 'bear_atr_min_pct': 0.028217542573437213, 'bear_atr_max_pct': 0.1466755339503853, 'bear_tp_mult': 2.750356743644522, 'bear_tsl_mult': 0.5553666141889577, 'bear_time_stop': 293, 'bear_use_sma': False, 'bear_use_ema': True, 'bear_use_atr': True, 'bear_use_adx': False, 'bear_use_spike': False, 'bear_rsi_required': True, 'sideways_strategy': 'mean_reversion', 'sideways_bb_std_mult': 0.8027531187392756, 'sideways_rsi_os': 41, 'sideways_rsi_ob': 62, 'sideways_adx_thresh': 22.41732590553934, 'sideways_atr_min_pct': 0.018945073250523647, 'sideways_atr_max_pct': 0.07281751727395185, 'sideways_tp_mult': 2.9950493646446317, 'sideways_tsl_mult': 0.7721752063774975, 'sideways_time_stop': 116, 'sideways_use_sma': True, 'sideways_use_ema': False, 'sideways_use_atr': False, 'sideways_use_adx': True, 'sideways_use_spike': False, 'sideways_rsi_required': True}.
[I 2025-08-30 14:50:50,100] Trial 251 finished with values: [-1000000000.0, 1000000000.0] and parameters: {'p_sma': 44, 'p_std': 5, 'p_atr': 21, 'p_adx': 27, 'rsi_period': 26, 'ema1': 13, 'ema2': 46, 'slip_atr_k': 0.03710050986242534, 'slip_spread_k': 0.08672764868888896, 'spread_hl_frac': 0.007223043403401537, 'bb_std_mult': 3.352968547444177, 'rsi_os': 10, 'rsi_ob': 85, 'vol_spike': 0.09596147930924781, 'adx_thresh': 16.582936761123, 'atr_min_pct': 0.0026411933025728774, 'atr_max_pct': 0.0741093099401258, 'tp_mult': 2.2006418029904316, 'tsl_mult': 0.5936623649271267, 'strategy': 'breakout', 'time_stop': 236, 'use_sma': False, 'use_atr': False, 'use_adx': False, 'use_ema': False, 'use_spike': False, 'rsi_required': True, 'edge_k': 0.4023342048357899, 'edge_cap': 0.5137485714714949, 'bull_strategy': 'breakout', 'bull_bb_std_mult': 2.7170917201524754, 'bull_rsi_os': 43, 'bull_rsi_ob': 47, 'bull_adx_thresh': 22.61311653540346, 'bull_atr_min_pct': 0.003370581548094786, 'bull_atr_max_pct': 0.04328710722108826, 'bull_tp_mult': 1.1641538124622204, 'bull_tsl_mult': 0.9362829678225728, 'bull_time_stop': 138, 'bull_use_sma': True, 'bull_use_ema': False, 'bull_use_atr': True, 'bull_use_adx': False, 'bull_use_spike': True, 'bull_rsi_required': False, 'bear_strategy': 'mean_reversion', 'bear_bb_std_mult': 3.536436606852885, 'bear_rsi_os': 36, 'bear_rsi_ob': 90, 'bear_adx_thresh': 7.500363298612544, 'bear_atr_min_pct': 0.028225488143800638, 'bear_atr_max_pct': 0.14741383555316329, 'bear_tp_mult': 2.74690136625284, 'bear_tsl_mult': 0.5637830970261822, 'bear_time_stop': 293, 'bear_use_sma': False, 'bear_use_ema': True, 'bear_use_atr': True, 'bear_use_adx': False, 'bear_use_spike': False, 'bear_rsi_required': True, 'sideways_strategy': 'mean_reversion', 'sideways_bb_std_mult': 0.8282605824224518, 'sideways_rsi_os': 41, 'sideways_rsi_ob': 62, 'sideways_adx_thresh': 22.580385908021952, 'sideways_atr_min_pct': 0.018703970164705663, 'sideways_atr_max_pct': 0.0725654762667635, 'sideways_tp_mult': 2.99868298190897, 'sideways_tsl_mult': 0.7674699275481397, 'sideways_time_stop': 98, 'sideways_use_sma': True, 'sideways_use_ema': False, 'sideways_use_atr': False, 'sideways_use_adx': True, 'sideways_use_spike': False, 'sideways_rsi_required': True}.
