[I 2025-08-30 16:48:37,549] Trial 875 finished with values: [-1000000000.0, 1000000000.0] and parameters: {'p_sma': 11, 'p_std': 21, 'p_atr': 12, 'p_adx': 7, 'rsi_period': 18, 'ema1': 5, 'ema2': 23, 'slip_atr_k': 0.10276168784029127, 'slip_spread_k': 0.6857637967386069, 'spread_hl_frac': 0.03853967866373461, 'bb_std_mult': 3.3913542253423627, 'rsi_os': 18, 'rsi_ob': 85, 'vol_spike': 0.19740407845908525, 'adx_thresh': 7.920834134365336, 'atr_min_pct': 0.006707310570566921, 'atr_max_pct': 0.11112258868876625, 'tp_mult': 1.610787063630766, 'tsl_mult': 0.3775143957216885, 'strategy': 'breakout', 'time_stop': 162, 'use_sma': False, 'use_atr': True, 'use_adx': True, 'use_ema': False, 'use_spike': True, 'rsi_required': False, 'edge_k': 0.5979592087669915, 'edge_cap': 0.9647331045106086, 'bull_strategy': 'breakout', 'bull_bb_std_mult': 1.5294791859258587, 'bull_rsi_os': 7, 'bull_rsi_ob': 54, 'bull_adx_thresh': 10.00848799731974, 'bull_atr_min_pct': 0.019052210702953355, 'bull_atr_max_pct': 0.10224443500338891, 'bull_tp_mult': 1.9594777015249967, 'bull_tsl_mult': 0.47653317006022106, 'bull_time_stop': 52, 'bull_use_sma': True, 'bull_use_ema': False, 'bull_use_atr': False, 'bull_use_adx': True, 'bull_use_spike': True, 'bull_rsi_required': False, 'bear_strategy': 'mean_reversion', 'bear_bb_std_mult': 3.42081685605714, 'bear_rsi_os': 40, 'bear_rsi_ob': 47, 'bear_adx_thresh': 30.497135433901008, 'bear_atr_min_pct': 0.0043866980274946486, 'bear_atr_max_pct': 0.10553485517843421, 'bear_tp_mult': 2.5563267587778147, 'bear_tsl_mult': 0.8748542315179156, 'bear_time_stop': 173, 'bear_use_sma': True, 'bear_use_ema': True, 'bear_use_atr': False, 'bear_use_adx': False, 'bear_use_spike': True, 'bear_rsi_required': True, 'sideways_strategy': 'mean_reversion', 'sideways_bb_std_mult': 2.1365610438064206, 'sideways_rsi_os': 25, 'sideways_rsi_ob': 63, 'sideways_adx_thresh': 9.58506244041318, 'sideways_atr_min_pct': 0.01797875839017723, 'sideways_atr_max_pct': 0.13053967288425278, 'sideways_tp_mult': 1.6565690937316915, 'sideways_tsl_mult': 0.3593356420978837, 'sideways_time_stop': 122, 'sideways_use_sma': True, 'sideways_use_ema': False, 'sideways_use_atr': False, 'sideways_use_adx': False, 'sideways_use_spike': True, 'sideways_rsi_required': True}.
[I 2025-08-30 16:48:38,977] Trial 874 finished with values: [-1000000000.0, 1000000000.0] and parameters: {'p_sma': 9, 'p_std': 21, 'p_atr': 12, 'p_adx': 25, 'rsi_period': 13, 'ema1': 25, 'ema2': 23, 'slip_atr_k': 0.008118422074971396, 'slip_spread_k': 0.7202722937393176, 'spread_hl_frac': 0.015387499544649652, 'bb_std_mult': 3.4118272075354428, 'rsi_os': 27, 'rsi_ob': 65, 'vol_spike': 0.19857467726345973, 'adx_thresh': 8.323911157502458, 'atr_min_pct': 0.00703930025588373, 'atr_max_pct': 0.06959572872189632, 'tp_mult': 1.7108189404315992, 'tsl_mult': 0.6093622265583867, 'strategy': 'breakout', 'time_stop': 163, 'use_sma': False, 'use_atr': False, 'use_adx': True, 'use_ema': False, 'use_spike': False, 'rsi_required': False, 'edge_k': 0.6099614341002272, 'edge_cap': 0.9371016572247922, 'bull_strategy': 'breakout', 'bull_bb_std_mult': 1.5320867826770261, 'bull_rsi_os': 50, 'bull_rsi_ob': 86, 'bull_adx_thresh': 30.678548380874943, 'bull_atr_min_pct': 0.016679390625465328, 'bull_atr_max_pct': 0.12389702628416435, 'bull_tp_mult': 2.6378671834251084, 'bull_tsl_mult': 0.8973763859384332, 'bull_time_stop': 61, 'bull_use_sma': True, 'bull_use_ema': False, 'bull_use_atr': False, 'bull_use_adx': True, 'bull_use_spike': True, 'bull_rsi_required': False, 'bear_strategy': 'mean_reversion', 'bear_bb_std_mult': 1.6882566859630594, 'bear_rsi_os': 19, 'bear_rsi_ob': 72, 'bear_adx_thresh': 15.181533695016903, 'bear_atr_min_pct': 0.004180074000216007, 'bear_atr_max_pct': 0.08470804053713102, 'bear_tp_mult': 1.4980145251449815, 'bear_tsl_mult': 0.9279217916845637, 'bear_time_stop': 76, 'bear_use_sma': True, 'bear_use_ema': True, 'bear_use_atr': True, 'bear_use_adx': False, 'bear_use_spike': True, 'bear_rsi_required': True, 'sideways_strategy': 'mean_reversion', 'sideways_bb_std_mult': 2.12242167833297, 'sideways_rsi_os': 31, 'sideways_rsi_ob': 80, 'sideways_adx_thresh': 9.638894991118224, 'sideways_atr_min_pct': 0.020791363688196465, 'sideways_atr_max_pct': 0.08200041650806315, 'sideways_tp_mult': 1.6302984700847805, 'sideways_tsl_mult': 0.73841192879033, 'sideways_time_stop': 139, 'sideways_use_sma': True, 'sideways_use_ema': False, 'sideways_use_atr': False, 'sideways_use_adx': True, 'sideways_use_spike': True, 'sideways_rsi_required': True}.
[I 2025-08-30 16:48:39,307] Trial 872 finished with values: [-0.007203361696444532, 0.008340139157775447] and parameters: {'p_sma': 36, 'p_std': 16, 'p_atr': 12, 'p_adx': 18, 'rsi_period': 7, 'ema1': 5, 'ema2': 39, 'slip_atr_k': 0.00900515703297966, 'slip_spread_k': 0.7179049209195406, 'spread_hl_frac': 0.006205364325874349, 'bb_std_mult': 0.5029303504213813, 'rsi_os': 27, 'rsi_ob': 65, 'vol_spike': 0.19601995109913675, 'adx_thresh': 9.194438855504117, 'atr_min_pct': 0.004798825576272951, 'atr_max_pct': 0.10853151238534686, 'tp_mult': 1.590480997858911, 'tsl_mult': 0.6120460206161447, 'strategy': 'mean_reversion', 'time_stop': 113, 'use_sma': False, 'use_atr': False, 'use_adx': True, 'use_ema': False, 'use_spike': False, 'rsi_required': False, 'edge_k': 1.6301213388560436, 'edge_cap': 0.19145883021870896, 'bull_strategy': 'mean_reversion', 'bull_bb_std_mult': 1.7209522760374474, 'bull_rsi_os': 49, 'bull_rsi_ob': 55, 'bull_adx_thresh': 9.70213850352973, 'bull_atr_min_pct': 0.02071901146499046, 'bull_atr_max_pct': 0.10293189883423677, 'bull_tp_mult': 2.515282700477419, 'bull_tsl_mult': 0.9541772760030196, 'bull_time_stop': 60, 'bull_use_sma': True, 'bull_use_ema': True, 'bull_use_atr': True, 'bull_use_adx': True, 'bull_use_spike': True, 'bull_rsi_required': False, 'bear_strategy': 'breakout', 'bear_bb_std_mult': 1.2765642362103584, 'bear_rsi_os': 27, 'bear_rsi_ob': 73, 'bear_adx_thresh': 14.997876566306527, 'bear_atr_min_pct': 0.002817396659960306, 'bear_atr_max_pct': 0.08528716877561963, 'bear_tp_mult': 2.568157632729439, 'bear_tsl_mult': 0.5498620167352828, 'bear_time_stop': 276, 'bear_use_sma': False, 'bear_use_ema': False, 'bear_use_atr': True, 'bear_use_adx': True, 'bear_use_spike': True, 'bear_rsi_required': True, 'sideways_strategy': 'mean_reversion', 'sideways_bb_std_mult': 1.3263765425722203, 'sideways_rsi_os': 24, 'sideways_rsi_ob': 81, 'sideways_adx_thresh': 9.558328773820019, 'sideways_atr_min_pct': 0.01857760634986532, 'sideways_atr_max_pct': 0.06314336736924088, 'sideways_tp_mult': 1.2108075219428938, 'sideways_tsl_mult': 0.18283187621499963, 'sideways_time_stop': 18, 'sideways_use_sma': True, 'sideways_use_ema': False, 'sideways_use_atr': True, 'sideways_use_adx': True, 'sideways_use_spike': True, 'sideways_rsi_required': True}.
[I 2025-08-30 16:49:33,804] Trial 876 finished with values: [-1000000000.0, 1000000000.0] and parameters: {'p_sma': 11, 'p_std': 22, 'p_atr': 30, 'p_adx': 22, 'rsi_period': 7, 'ema1': 28, 'ema2': 56, 'slip_atr_k': 0.10316572516679229, 'slip_spread_k': 0.6643971910905313, 'spread_hl_frac': 0.040405162215131296, 'bb_std_mult': 0.7822543176478782, 'rsi_os': 46, 'rsi_ob': 83, 'vol_spike': 0.19978538599842977, 'adx_thresh': 7.398834435305728, 'atr_min_pct': 0.00700166238298954, 'atr_max_pct': 0.115117476175948, 'tp_mult': 1.6049909517947285, 'tsl_mult': 0.3782717214732957, 'strategy': 'breakout', 'time_stop': 162, 'use_sma': False, 'use_atr': True, 'use_adx': True, 'use_ema': False, 'use_spike': True, 'rsi_required': False, 'edge_k': 0.6132631142310233, 'edge_cap': 0.18725590004651027, 'bull_strategy': 'breakout', 'bull_bb_std_mult': 1.772193820945692, 'bull_rsi_os': 45, 'bull_rsi_ob': 54, 'bull_adx_thresh': 10.15084146682684, 'bull_atr_min_pct': 0.018901999530696028, 'bull_atr_max_pct': 0.014603672166185272, 'bull_tp_mult': 1.3305743615766348, 'bull_tsl_mult': 0.1436113237222108, 'bull_time_stop': 51, 'bull_use_sma': True, 'bull_use_ema': False, 'bull_use_atr': False, 'bull_use_adx': True, 'bull_use_spike': True, 'bull_rsi_required': False, 'bear_strategy': 'mean_reversion', 'bear_bb_std_mult': 1.2830424948424843, 'bear_rsi_os': 27, 'bear_rsi_ob': 66, 'bear_adx_thresh': 14.536885319397223, 'bear_atr_min_pct': 0.004430641958595768, 'bear_atr_max_pct': 0.10586885658449977, 'bear_tp_mult': 2.5897395596644412, 'bear_tsl_mult': 0.8745337665666524, 'bear_time_stop': 75, 'bear_use_sma': True, 'bear_use_ema': True, 'bear_use_atr': False, 'bear_use_adx': False, 'bear_use_spike': True, 'bear_rsi_required': True, 'sideways_strategy': 'mean_reversion', 'sideways_bb_std_mult': 3.068157008947938, 'sideways_rsi_os': 8, 'sideways_rsi_ob': 84, 'sideways_adx_thresh': 11.782419857069259, 'sideways_atr_min_pct': 0.017898810250728557, 'sideways_atr_max_pct': 0.07881592409816159, 'sideways_tp_mult': 1.9126929558293924, 'sideways_tsl_mult': 0.8579683077657037, 'sideways_time_stop': 228, 'sideways_use_sma': True, 'sideways_use_ema': False, 'sideways_use_atr': False, 'sideways_use_adx': False, 'sideways_use_spike': True, 'sideways_rsi_required': True}.
[I 2025-08-30 16:49:34,550] Trial 878 finished with values: [-1000000000.0, 1000000000.0] and parameters: {'p_sma': 19, 'p_std': 60, 'p_atr': 14, 'p_adx': 22, 'rsi_period': 7, 'ema1': 19, 'ema2': 37, 'slip_atr_k': 4.868680518153664e-05, 'slip_spread_k': 0.4843906026026742, 'spread_hl_frac': 0.04136426463735071, 'bb_std_mult': 0.8355401431604037, 'rsi_os': 45, 'rsi_ob': 89, 'vol_spike': 0.20919685514380756, 'adx_thresh': 9.315745582156458, 'atr_min_pct': 0.006120337555311995, 'atr_max_pct': 0.11550742086691504, 'tp_mult': 1.5293135432042613, 'tsl_mult': 0.4115091236808746, 'strategy': 'breakout', 'time_stop': 284, 'use_sma': False, 'use_atr': False, 'use_adx': True, 'use_ema': False, 'use_spike': False, 'rsi_required': False, 'edge_k': 1.1720419933070887, 'edge_cap': 0.1639187460072335, 'bull_strategy': 'breakout', 'bull_bb_std_mult': 2.0500375012975476, 'bull_rsi_os': 45, 'bull_rsi_ob': 89, 'bull_adx_thresh': 11.198610419408917, 'bull_atr_min_pct': 0.02773636586408581, 'bull_atr_max_pct': 0.015076351498334126, 'bull_tp_mult': 2.4692130405674595, 'bull_tsl_mult': 0.7221814054267193, 'bull_time_stop': 52, 'bull_use_sma': True, 'bull_use_ema': True, 'bull_use_atr': True, 'bull_use_adx': True, 'bull_use_spike': True, 'bull_rsi_required': False, 'bear_strategy': 'mean_reversion', 'bear_bb_std_mult': 2.1111149174601187, 'bear_rsi_os': 8, 'bear_rsi_ob': 53, 'bear_adx_thresh': 26.746561170451276, 'bear_atr_min_pct': 0.009606741212051403, 'bear_atr_max_pct': 0.11054186131493211, 'bear_tp_mult': 2.6073264853744833, 'bear_tsl_mult': 0.5432429695591362, 'bear_time_stop': 89, 'bear_use_sma': True, 'bear_use_ema': False, 'bear_use_atr': True, 'bear_use_adx': True, 'bear_use_spike': True, 'bear_rsi_required': True, 'sideways_strategy': 'mean_reversion', 'sideways_bb_std_mult': 3.072549159484735, 'sideways_rsi_os': 23, 'sideways_rsi_ob': 71, 'sideways_adx_thresh': 11.87751210903693, 'sideways_atr_min_pct': 0.02007708555685684, 'sideways_atr_max_pct': 0.07787472354692282, 'sideways_tp_mult': 1.2785281969019762, 'sideways_tsl_mult': 0.3295567838309532, 'sideways_time_stop': 114, 'sideways_use_sma': True, 'sideways_use_ema': False, 'sideways_use_atr': True, 'sideways_use_adx': True, 'sideways_use_spike': True, 'sideways_rsi_required': True}.
[I 2025-08-30 16:49:34,958] Trial 879 finished with values: [-1000000000.0, 1000000000.0] and parameters: {'p_sma': 7, 'p_std': 13, 'p_atr': 14, 'p_adx': 25, 'rsi_period': 7, 'ema1': 21, 'ema2': 42, 'slip_atr_k': 0.005223314368177521, 'slip_spread_k': 0.21379653641523166, 'spread_hl_frac': 0.00872524884107367, 'bb_std_mult': 0.7635394181319359, 'rsi_os': 46, 'rsi_ob': 49, 'vol_spike': 0.2066305729125453, 'adx_thresh': 7.486088895492386, 'atr_min_pct': 0.006052747238940446, 'atr_max_pct': 0.11701947454401197, 'tp_mult': 1.5329349072538343, 'tsl_mult': 0.30139134153022346, 'strategy': 'breakout', 'time_stop': 285, 'use_sma': False, 'use_atr': True, 'use_adx': False, 'use_ema': False, 'use_spike': True, 'rsi_required': False, 'edge_k': 0.5228127930725449, 'edge_cap': 0.5772421555840099, 'bull_strategy': 'breakout', 'bull_bb_std_mult': 2.8462590951851503, 'bull_rsi_os': 46, 'bull_rsi_ob': 87, 'bull_adx_thresh': 11.055285817088894, 'bull_atr_min_pct': 0.010833864523572285, 'bull_atr_max_pct': 0.021781930024740465, 'bull_tp_mult': 2.22592018949577, 'bull_tsl_mult': 0.878793542790058, 'bull_time_stop': 15, 'bull_use_sma': True, 'bull_use_ema': True, 'bull_use_atr': True, 'bull_use_adx': True, 'bull_use_spike': True, 'bull_rsi_required': False, 'bear_strategy': 'mean_reversion', 'bear_bb_std_mult': 1.874921521487274, 'bear_rsi_os': 26, 'bear_rsi_ob': 53, 'bear_adx_thresh': 14.31795809952601, 'bear_atr_min_pct': 0.017409599912838088, 'bear_atr_max_pct': 0.11045820095655445, 'bear_tp_mult': 2.644889115156636, 'bear_tsl_mult': 0.817028637494947, 'bear_time_stop': 204, 'bear_use_sma': True, 'bear_use_ema': False, 'bear_use_atr': False, 'bear_use_adx': True, 'bear_use_spike': True, 'bear_rsi_required': True, 'sideways_strategy': 'mean_reversion', 'sideways_bb_std_mult': 0.5724811737145798, 'sideways_rsi_os': 27, 'sideways_rsi_ob': 76, 'sideways_adx_thresh': 11.877289908771921, 'sideways_atr_min_pct': 0.019938293780222084, 'sideways_atr_max_pct': 0.03005985659073556, 'sideways_tp_mult': 1.2927614876205238, 'sideways_tsl_mult': 0.3371357481364607, 'sideways_time_stop': 12, 'sideways_use_sma': True, 'sideways_use_ema': False, 'sideways_use_atr': True, 'sideways_use_adx': False, 'sideways_use_spike': True, 'sideways_rsi_required': True}.
[I 2025-08-30 16:49:35,879] Trial 877 finished with values: [-1000000000.0, 1000000000.0] and parameters: {'p_sma': 60, 'p_std': 22, 'p_atr': 14, 'p_adx': 25, 'rsi_period': 7, 'ema1': 25, 'ema2': 37, 'slip_atr_k': 0.00027421485503083644, 'slip_spread_k': 0.4907187803070494, 'spread_hl_frac': 0.004825412965169917, 'bb_std_mult': 0.8045500423304004, 'rsi_os': 27, 'rsi_ob': 59, 'vol_spike': 0.20491339944082412, 'adx_thresh': 7.294423919832232, 'atr_min_pct': 0.0061323495865013185, 'atr_max_pct': 0.11473146927818119, 'tp_mult': 1.533205527678426, 'tsl_mult': 0.7781255880516417, 'strategy': 'breakout', 'time_stop': 250, 'use_sma': False, 'use_atr': False, 'use_adx': True, 'use_ema': False, 'use_spike': False, 'rsi_required': False, 'edge_k': 1.7050703054742211, 'edge_cap': 0.18421265222390543, 'bull_strategy': 'breakout', 'bull_bb_std_mult': 1.4544820364426991, 'bull_rsi_os': 36, 'bull_rsi_ob': 83, 'bull_adx_thresh': 17.20247539180687, 'bull_atr_min_pct': 0.01851591568867071, 'bull_atr_max_pct': 0.015019948606975864, 'bull_tp_mult': 2.742486703426583, 'bull_tsl_mult': 0.14218066672418683, 'bull_time_stop': 63, 'bull_use_sma': True, 'bull_use_ema': True, 'bull_use_atr': True, 'bull_use_adx': True, 'bull_use_spike': True, 'bull_rsi_required': False, 'bear_strategy': 'mean_reversion', 'bear_bb_std_mult': 1.950591305458433, 'bear_rsi_os': 8, 'bear_rsi_ob': 75, 'bear_adx_thresh': 14.571660948541384, 'bear_atr_min_pct': 0.02001195013662047, 'bear_atr_max_pct': 0.029361782224617196, 'bear_tp_mult': 2.609940342493145, 'bear_tsl_mult': 0.8195938431492449, 'bear_time_stop': 19, 'bear_use_sma': True, 'bear_use_ema': False, 'bear_use_atr': True, 'bear_use_adx': True, 'bear_use_spike': True, 'bear_rsi_required': True, 'sideways_strategy': 'mean_reversion', 'sideways_bb_std_mult': 3.0715284045203894, 'sideways_rsi_os': 31, 'sideways_rsi_ob': 80, 'sideways_adx_thresh': 12.176572980386867, 'sideways_atr_min_pct': 0.02071600282742362, 'sideways_atr_max_pct': 0.07781453321317038, 'sideways_tp_mult': 1.2024588619618333, 'sideways_tsl_mult': 0.8468217907956375, 'sideways_time_stop': 19, 'sideways_use_sma': True, 'sideways_use_ema': False, 'sideways_use_atr': True, 'sideways_use_adx': True, 'sideways_use_spike': True, 'sideways_rsi_required': True}.
[I 2025-08-30 16:50:27,225] Trial 880 finished with values: [-1000000000.0, 1000000000.0] and parameters: {'p_sma': 7, 'p_std': 14, 'p_atr': 10, 'p_adx': 28, 'rsi_period': 60, 'ema1': 26, 'ema2': 37, 'slip_atr_k': 0.24738691298692161, 'slip_spread_k': 0.7558627702480363, 'spread_hl_frac': 0.023231687070192557, 'bb_std_mult': 0.8352023529342838, 'rsi_os': 49, 'rsi_ob': 86, 'vol_spike': 0.21188418548957116, 'adx_thresh': 19.321098595923676, 'atr_min_pct': 0.008447699648877378, 'atr_max_pct': 0.05494101684133118, 'tp_mult': 2.3459957639975775, 'tsl_mult': 0.7815973988557885, 'strategy': 'breakout', 'time_stop': 100, 'use_sma': False, 'use_atr': False, 'use_adx': False, 'use_ema': False, 'use_spike': False, 'rsi_required': False, 'edge_k': 0.8730475175213906, 'edge_cap': 0.9706927690846222, 'bull_strategy': 'breakout', 'bull_bb_std_mult': 1.6228476383963981, 'bull_rsi_os': 47, 'bull_rsi_ob': 87, 'bull_adx_thresh': 11.183443173796492, 'bull_atr_min_pct': 0.018498438026551177, 'bull_atr_max_pct': 0.1323749310660416, 'bull_tp_mult': 2.594464688003583, 'bull_tsl_mult': 0.8652735884387042, 'bull_time_stop': 151, 'bull_use_sma': True, 'bull_use_ema': True, 'bull_use_atr': True, 'bull_use_adx': True, 'bull_use_spike': True, 'bull_rsi_required': False, 'bear_strategy': 'mean_reversion', 'bear_bb_std_mult': 1.8878552205885657, 'bear_rsi_os': 26, 'bear_rsi_ob': 75, 'bear_adx_thresh': 14.55565530823538, 'bear_atr_min_pct': 0.017244694318999252, 'bear_atr_max_pct': 0.11029784865659313, 'bear_tp_mult': 2.6484375706736176, 'bear_tsl_mult': 0.8162735352302948, 'bear_time_stop': 120, 'bear_use_sma': True, 'bear_use_ema': False, 'bear_use_atr': True, 'bear_use_adx': True, 'bear_use_spike': True, 'bear_rsi_required': True, 'sideways_strategy': 'mean_reversion', 'sideways_bb_std_mult': 0.5867399763769985, 'sideways_rsi_os': 49, 'sideways_rsi_ob': 78, 'sideways_adx_thresh': 8.05174979418118, 'sideways_atr_min_pct': 0.0200569011075915, 'sideways_atr_max_pct': 0.06726893836673915, 'sideways_tp_mult': 1.2899597048402784, 'sideways_tsl_mult': 0.6396422251122656, 'sideways_time_stop': 219, 'sideways_use_sma': True, 'sideways_use_ema': False, 'sideways_use_atr': True, 'sideways_use_adx': True, 'sideways_use_spike': True, 'sideways_rsi_required': True}.
