[I 2025-08-30 16:13:27,561] Trial 691 finished with values: [-1000000000.0, 1000000000.0] and parameters: {'p_sma': 8, 'p_std': 46, 'p_atr': 12, 'p_adx': 28, 'rsi_period': 8, 'ema1': 27, 'ema2': 35, 'slip_atr_k': 0.09543469363640807, 'slip_spread_k': 0.7230117863692904, 'spread_hl_frac': 0.006411409754843532, 'bb_std_mult': 0.743851015769645, 'rsi_os': 26, 'rsi_ob': 87, 'vol_spike': 0.2981091697266536, 'adx_thresh': 31.76011635731547, 'atr_min_pct': 0.017141000979119695, 'atr_max_pct': 0.10891796027617381, 'tp_mult': 1.4904661798931853, 'tsl_mult': 0.3511003339143375, 'strategy': 'breakout', 'time_stop': 168, 'use_sma': False, 'use_atr': False, 'use_adx': True, 'use_ema': True, 'use_spike': False, 'rsi_required': True, 'edge_k': 0.6419694821230217, 'edge_cap': 0.7469443264139427, 'bull_strategy': 'mean_reversion', 'bull_bb_std_mult': 1.557461152077649, 'bull_rsi_os': 48, 'bull_rsi_ob': 76, 'bull_adx_thresh': 10.366422741954594, 'bull_atr_min_pct': 0.026184850541177127, 'bull_atr_max_pct': 0.10757262618105821, 'bull_tp_mult': 2.50924605238747, 'bull_tsl_mult': 0.49689250488922043, 'bull_time_stop': 51, 'bull_use_sma': True, 'bull_use_ema': False, 'bull_use_atr': False, 'bull_use_adx': True, 'bull_use_spike': False, 'bull_rsi_required': False, 'bear_strategy': 'breakout', 'bear_bb_std_mult': 1.3816814955019046, 'bear_rsi_os': 28, 'bear_rsi_ob': 75, 'bear_adx_thresh': 15.318527601600262, 'bear_atr_min_pct': 0.00355741549943364, 'bear_atr_max_pct': 0.0699024090071381, 'bear_tp_mult': 2.541393810180311, 'bear_tsl_mult': 0.927022941026466, 'bear_time_stop': 111, 'bear_use_sma': False, 'bear_use_ema': True, 'bear_use_atr': True, 'bear_use_adx': False, 'bear_use_spike': True, 'bear_rsi_required': True, 'sideways_strategy': 'mean_reversion', 'sideways_bb_std_mult': 3.3274088038362435, 'sideways_rsi_os': 8, 'sideways_rsi_ob': 76, 'sideways_adx_thresh': 16.040475937684725, 'sideways_atr_min_pct': 0.004529274146828287, 'sideways_atr_max_pct': 0.07742412315213608, 'sideways_tp_mult': 1.2726023220750418, 'sideways_tsl_mult': 0.7887881005526554, 'sideways_time_stop': 300, 'sideways_use_sma': False, 'sideways_use_ema': True, 'sideways_use_atr': False, 'sideways_use_adx': True, 'sideways_use_spike': True, 'sideways_rsi_required': False}.
[I 2025-08-30 16:14:15,699] Trial 696 finished with values: [-1000000000.0, 1000000000.0] and parameters: {'p_sma': 8, 'p_std': 21, 'p_atr': 21, 'p_adx': 25, 'rsi_period': 8, 'ema1': 21, 'ema2': 60, 'slip_atr_k': 0.00010575253102407828, 'slip_spread_k': 0.4717559252368736, 'spread_hl_frac': 0.010233494736310191, 'bb_std_mult': 0.7548966976423673, 'rsi_os': 28, 'rsi_ob': 48, 'vol_spike': 0.22376676488146227, 'adx_thresh': 8.018763711587164, 'atr_min_pct': 0.012239867747501519, 'atr_max_pct': 0.11895823255074191, 'tp_mult': 1.6588774003800721, 'tsl_mult': 0.39163461767843954, 'strategy': 'breakout', 'time_stop': 46, 'use_sma': False, 'use_atr': False, 'use_adx': True, 'use_ema': False, 'use_spike': False, 'rsi_required': True, 'edge_k': 0.6431005155883552, 'edge_cap': 0.9681603685390444, 'bull_strategy': 'breakout', 'bull_bb_std_mult': 1.2214761103936103, 'bull_rsi_os': 35, 'bull_rsi_ob': 87, 'bull_adx_thresh': 11.420374635992479, 'bull_atr_min_pct': 0.005132790626512746, 'bull_atr_max_pct': 0.14435953890915926, 'bull_tp_mult': 1.9816851634519337, 'bull_tsl_mult': 0.8814239905920873, 'bull_time_stop': 244, 'bull_use_sma': True, 'bull_use_ema': True, 'bull_use_atr': True, 'bull_use_adx': True, 'bull_use_spike': True, 'bull_rsi_required': True, 'bear_strategy': 'mean_reversion', 'bear_bb_std_mult': 1.422442852220096, 'bear_rsi_os': 23, 'bear_rsi_ob': 75, 'bear_adx_thresh': 16.032694021989833, 'bear_atr_min_pct': 0.010274097776544585, 'bear_atr_max_pct': 0.037970444300516666, 'bear_tp_mult': 1.297696547519613, 'bear_tsl_mult': 0.32156641680150566, 'bear_time_stop': 101, 'bear_use_sma': True, 'bear_use_ema': False, 'bear_use_atr': True, 'bear_use_adx': True, 'bear_use_spike': False, 'bear_rsi_required': False, 'sideways_strategy': 'breakout', 'sideways_bb_std_mult': 3.2182879764164287, 'sideways_rsi_os': 21, 'sideways_rsi_ob': 70, 'sideways_adx_thresh': 6.6404249815618055, 'sideways_atr_min_pct': 0.020668283611303722, 'sideways_atr_max_pct': 0.07362221555861619, 'sideways_tp_mult': 1.2672523535528126, 'sideways_tsl_mult': 0.6564039875464589, 'sideways_time_stop': 191, 'sideways_use_sma': True, 'sideways_use_ema': False, 'sideways_use_atr': True, 'sideways_use_adx': True, 'sideways_use_spike': False, 'sideways_rsi_required': True}.
[I 2025-08-30 16:14:15,705] Trial 697 finished with values: [-1000000000.0, 1000000000.0] and parameters: {'p_sma': 54, 'p_std': 50, 'p_atr': 13, 'p_adx': 25, 'rsi_period': 9, 'ema1': 21, 'ema2': 14, 'slip_atr_k': 0.009390329058697477, 'slip_spread_k': 0.4693599216835297, 'spread_hl_frac': 0.04337371284041546, 'bb_std_mult': 1.5020239704569744, 'rsi_os': 37, 'rsi_ob': 88, 'vol_spike': 0.1309592353595908, 'adx_thresh': 26.274570358160727, 'atr_min_pct': 0.012386051611004369, 'atr_max_pct': 0.11941439631827118, 'tp_mult': 1.9881502029547855, 'tsl_mult': 0.27224839987989036, 'strategy': 'breakout', 'time_stop': 149, 'use_sma': False, 'use_atr': True, 'use_adx': False, 'use_ema': False, 'use_spike': True, 'rsi_required': False, 'edge_k': 0.7696579928001963, 'edge_cap': 0.9673016827211718, 'bull_strategy': 'breakout', 'bull_bb_std_mult': 1.6390004757949386, 'bull_rsi_os': 27, 'bull_rsi_ob': 87, 'bull_adx_thresh': 30.912225725150492, 'bull_atr_min_pct': 0.0076554162886280025, 'bull_atr_max_pct': 0.010266604585247058, 'bull_tp_mult': 2.4118935914295165, 'bull_tsl_mult': 0.8830736307871411, 'bull_time_stop': 59, 'bull_use_sma': True, 'bull_use_ema': True, 'bull_use_atr': True, 'bull_use_adx': True, 'bull_use_spike': True, 'bull_rsi_required': True, 'bear_strategy': 'mean_reversion', 'bear_bb_std_mult': 2.6309151945924008, 'bear_rsi_os': 49, 'bear_rsi_ob': 63, 'bear_adx_thresh': 19.50709388042283, 'bear_atr_min_pct': 0.010155581798689282, 'bear_atr_max_pct': 0.09210297360007025, 'bear_tp_mult': 2.2252709694877844, 'bear_tsl_mult': 0.831283142034572, 'bear_time_stop': 50, 'bear_use_sma': True, 'bear_use_ema': False, 'bear_use_atr': False, 'bear_use_adx': True, 'bear_use_spike': False, 'bear_rsi_required': False, 'sideways_strategy': 'breakout', 'sideways_bb_std_mult': 3.2279880655068087, 'sideways_rsi_os': 14, 'sideways_rsi_ob': 81, 'sideways_adx_thresh': 11.619843938665213, 'sideways_atr_min_pct': 0.017393084450269578, 'sideways_atr_max_pct': 0.10839252831261757, 'sideways_tp_mult': 1.708517001308728, 'sideways_tsl_mult': 0.47323575744126206, 'sideways_time_stop': 39, 'sideways_use_sma': True, 'sideways_use_ema': False, 'sideways_use_atr': True, 'sideways_use_adx': False, 'sideways_use_spike': False, 'sideways_rsi_required': True}.
[I 2025-08-30 16:14:16,259] Trial 695 finished with values: [-1000000000.0, 1000000000.0] and parameters: {'p_sma': 8, 'p_std': 19, 'p_atr': 21, 'p_adx': 25, 'rsi_period': 8, 'ema1': 21, 'ema2': 38, 'slip_atr_k': 0.010088399993204183, 'slip_spread_k': 0.470784239218118, 'spread_hl_frac': 0.016158556033164594, 'bb_std_mult': 0.7203296269883721, 'rsi_os': 35, 'rsi_ob': 88, 'vol_spike': 0.22495028634874054, 'adx_thresh': 28.56961607607772, 'atr_min_pct': 0.017046764213981127, 'atr_max_pct': 0.11393935133153595, 'tp_mult': 1.4891008773401981, 'tsl_mult': 0.4299550298098883, 'strategy': 'breakout', 'time_stop': 44, 'use_sma': False, 'use_atr': False, 'use_adx': True, 'use_ema': False, 'use_spike': False, 'rsi_required': True, 'edge_k': 0.5711158138675656, 'edge_cap': 0.34371149998368256, 'bull_strategy': 'breakout', 'bull_bb_std_mult': 1.560945369882893, 'bull_rsi_os': 35, 'bull_rsi_ob': 87, 'bull_adx_thresh': 30.77487619860679, 'bull_atr_min_pct': 0.00718838521056656, 'bull_atr_max_pct': 0.14444874042764339, 'bull_tp_mult': 2.0854282337748424, 'bull_tsl_mult': 0.8781169948536307, 'bull_time_stop': 57, 'bull_use_sma': True, 'bull_use_ema': True, 'bull_use_atr': True, 'bull_use_adx': True, 'bull_use_spike': True, 'bull_rsi_required': False, 'bear_strategy': 'mean_reversion', 'bear_bb_std_mult': 1.39309408244478, 'bear_rsi_os': 24, 'bear_rsi_ob': 75, 'bear_adx_thresh': 17.825285611914257, 'bear_atr_min_pct': 0.010045779008644083, 'bear_atr_max_pct': 0.10525513488047292, 'bear_tp_mult': 2.648164368774313, 'bear_tsl_mult': 0.9236259654659007, 'bear_time_stop': 98, 'bear_use_sma': True, 'bear_use_ema': False, 'bear_use_atr': True, 'bear_use_adx': True, 'bear_use_spike': False, 'bear_rsi_required': False, 'sideways_strategy': 'mean_reversion', 'sideways_bb_std_mult': 3.244386661144153, 'sideways_rsi_os': 13, 'sideways_rsi_ob': 81, 'sideways_adx_thresh': 16.47661154861283, 'sideways_atr_min_pct': 0.026944464170683302, 'sideways_atr_max_pct': 0.07206954435227216, 'sideways_tp_mult': 2.764487624556889, 'sideways_tsl_mult': 0.3972050853166798, 'sideways_time_stop': 136, 'sideways_use_sma': True, 'sideways_use_ema': False, 'sideways_use_atr': True, 'sideways_use_adx': True, 'sideways_use_spike': False, 'sideways_rsi_required': True}.
[I 2025-08-30 16:14:16,544] Trial 694 finished with values: [-1000000000.0, 1000000000.0] and parameters: {'p_sma': 8, 'p_std': 14, 'p_atr': 21, 'p_adx': 25, 'rsi_period': 7, 'ema1': 22, 'ema2': 37, 'slip_atr_k': 0.009839695017450592, 'slip_spread_k': 0.737933771803422, 'spread_hl_frac': 0.019107634094817756, 'bb_std_mult': 1.537754437626916, 'rsi_os': 28, 'rsi_ob': 87, 'vol_spike': 0.22377182869215886, 'adx_thresh': 8.298992039627011, 'atr_min_pct': 0.013973027614750045, 'atr_max_pct': 0.11807432680851704, 'tp_mult': 1.9535151127399026, 'tsl_mult': 0.4284559214918207, 'strategy': 'breakout', 'time_stop': 71, 'use_sma': False, 'use_atr': False, 'use_adx': True, 'use_ema': False, 'use_spike': False, 'rsi_required': False, 'edge_k': 0.5729085213795867, 'edge_cap': 0.9705134472326419, 'bull_strategy': 'breakout', 'bull_bb_std_mult': 1.4778707356063894, 'bull_rsi_os': 50, 'bull_rsi_ob': 87, 'bull_adx_thresh': 10.532969506783369, 'bull_atr_min_pct': 0.021452756332535988, 'bull_atr_max_pct': 0.034213766569898454, 'bull_tp_mult': 2.5611133908402586, 'bull_tsl_mult': 0.4745751200685018, 'bull_time_stop': 59, 'bull_use_sma': True, 'bull_use_ema': True, 'bull_use_atr': True, 'bull_use_adx': True, 'bull_use_spike': True, 'bull_rsi_required': False, 'bear_strategy': 'mean_reversion', 'bear_bb_std_mult': 1.3688994894991975, 'bear_rsi_os': 24, 'bear_rsi_ob': 75, 'bear_adx_thresh': 15.936413599786734, 'bear_atr_min_pct': 0.010154653735645065, 'bear_atr_max_pct': 0.03789859307698573, 'bear_tp_mult': 2.6465961750207425, 'bear_tsl_mult': 0.820243981098847, 'bear_time_stop': 112, 'bear_use_sma': True, 'bear_use_ema': False, 'bear_use_atr': True, 'bear_use_adx': True, 'bear_use_spike': True, 'bear_rsi_required': True, 'sideways_strategy': 'mean_reversion', 'sideways_bb_std_mult': 3.2112032569149176, 'sideways_rsi_os': 13, 'sideways_rsi_ob': 81, 'sideways_adx_thresh': 16.887638442239087, 'sideways_atr_min_pct': 0.013336718087137205, 'sideways_atr_max_pct': 0.1238087209093692, 'sideways_tp_mult': 1.701243809724716, 'sideways_tsl_mult': 0.6582025486914895, 'sideways_time_stop': 61, 'sideways_use_sma': True, 'sideways_use_ema': False, 'sideways_use_atr': True, 'sideways_use_adx': True, 'sideways_use_spike': True, 'sideways_rsi_required': False}.
[I 2025-08-30 16:15:03,077] Trial 700 finished with values: [-1000000000.0, 1000000000.0] and parameters: {'p_sma': 22, 'p_std': 21, 'p_atr': 13, 'p_adx': 24, 'rsi_period': 43, 'ema1': 30, 'ema2': 59, 'slip_atr_k': 0.22859842536132496, 'slip_spread_k': 0.74040216048391, 'spread_hl_frac': 0.012583225896924918, 'bb_std_mult': 0.6708050530924364, 'rsi_os': 36, 'rsi_ob': 83, 'vol_spike': 0.22016191427447346, 'adx_thresh': 8.473401427219493, 'atr_min_pct': 0.013731131319654984, 'atr_max_pct': 0.023097150810358603, 'tp_mult': 1.3918719071389292, 'tsl_mult': 0.3421193301618052, 'strategy': 'breakout', 'time_stop': 65, 'use_sma': True, 'use_atr': False, 'use_adx': True, 'use_ema': False, 'use_spike': False, 'rsi_required': False, 'edge_k': 0.5140611483297544, 'edge_cap': 0.23353702796586445, 'bull_strategy': 'breakout', 'bull_bb_std_mult': 0.6965287300932728, 'bull_rsi_os': 50, 'bull_rsi_ob': 89, 'bull_adx_thresh': 10.843599168550815, 'bull_atr_min_pct': 0.021760625727871512, 'bull_atr_max_pct': 0.11236653667714956, 'bull_tp_mult': 2.567667037702844, 'bull_tsl_mult': 0.6902095416480281, 'bull_time_stop': 41, 'bull_use_sma': True, 'bull_use_ema': True, 'bull_use_atr': True, 'bull_use_adx': True, 'bull_use_spike': True, 'bull_rsi_required': False, 'bear_strategy': 'mean_reversion', 'bear_bb_std_mult': 0.9552243073957478, 'bear_rsi_os': 15, 'bear_rsi_ob': 73, 'bear_adx_thresh': 34.22692792962229, 'bear_atr_min_pct': 0.00029751127148307894, 'bear_atr_max_pct': 0.12515599458992605, 'bear_tp_mult': 2.6604128637462683, 'bear_tsl_mult': 0.8914504169319638, 'bear_time_stop': 79, 'bear_use_sma': True, 'bear_use_ema': False, 'bear_use_atr': True, 'bear_use_adx': True, 'bear_use_spike': True, 'bear_rsi_required': True, 'sideways_strategy': 'mean_reversion', 'sideways_bb_std_mult': 3.0810137016134194, 'sideways_rsi_os': 41, 'sideways_rsi_ob': 80, 'sideways_adx_thresh': 8.140963444554183, 'sideways_atr_min_pct': 0.00367133891531057, 'sideways_atr_max_pct': 0.06965683493295147, 'sideways_tp_mult': 1.5981420653833727, 'sideways_tsl_mult': 0.632464531140919, 'sideways_time_stop': 58, 'sideways_use_sma': True, 'sideways_use_ema': False, 'sideways_use_atr': True, 'sideways_use_adx': True, 'sideways_use_spike': True, 'sideways_rsi_required': True}.
[I 2025-08-30 16:15:03,393] Trial 701 finished with values: [-1000000000.0, 1000000000.0] and parameters: {'p_sma': 57, 'p_std': 11, 'p_atr': 13, 'p_adx': 24, 'rsi_period': 11, 'ema1': 30, 'ema2': 38, 'slip_atr_k': 0.004706350825434905, 'slip_spread_k': 0.6595170407694245, 'spread_hl_frac': 0.007445296964813723, 'bb_std_mult': 1.677135839944157, 'rsi_os': 26, 'rsi_ob': 83, 'vol_spike': 0.2162772892875582, 'adx_thresh': 9.886265235465753, 'atr_min_pct': 0.00549760166295592, 'atr_max_pct': 0.016700551366514743, 'tp_mult': 1.5610799648832516, 'tsl_mult': 0.7192850178547606, 'strategy': 'breakout', 'time_stop': 158, 'use_sma': True, 'use_atr': True, 'use_adx': False, 'use_ema': False, 'use_spike': True, 'rsi_required': False, 'edge_k': 0.4944730352136364, 'edge_cap': 0.9429236282598199, 'bull_strategy': 'breakout', 'bull_bb_std_mult': 0.6948845744448771, 'bull_rsi_os': 50, 'bull_rsi_ob': 73, 'bull_adx_thresh': 26.379152289725162, 'bull_atr_min_pct': 0.00841870073727934, 'bull_atr_max_pct': 0.09355193395681675, 'bull_tp_mult': 2.5887904118753693, 'bull_tsl_mult': 0.9102945975962305, 'bull_time_stop': 37, 'bull_use_sma': True, 'bull_use_ema': True, 'bull_use_atr': True, 'bull_use_adx': True, 'bull_use_spike': True, 'bull_rsi_required': False, 'bear_strategy': 'mean_reversion', 'bear_bb_std_mult': 2.746257435807939, 'bear_rsi_os': 26, 'bear_rsi_ob': 73, 'bear_adx_thresh': 20.620923307030473, 'bear_atr_min_pct': 0.0084278633890846, 'bear_atr_max_pct': 0.08080231224472242, 'bear_tp_mult': 1.6778264533042244, 'bear_tsl_mult': 0.11031707967366522, 'bear_time_stop': 74, 'bear_use_sma': True, 'bear_use_ema': False, 'bear_use_atr': False, 'bear_use_adx': True, 'bear_use_spike': True, 'bear_rsi_required': True, 'sideways_strategy': 'mean_reversion', 'sideways_bb_std_mult': 3.0666611102273813, 'sideways_rsi_os': 23, 'sideways_rsi_ob': 79, 'sideways_adx_thresh': 9.324993151864538, 'sideways_atr_min_pct': 0.028980286338455494, 'sideways_atr_max_pct': 0.06908082221745862, 'sideways_tp_mult': 1.6063351386512583, 'sideways_tsl_mult': 0.3780294096698527, 'sideways_time_stop': 119, 'sideways_use_sma': True, 'sideways_use_ema': False, 'sideways_use_atr': True, 'sideways_use_adx': False, 'sideways_use_spike': True, 'sideways_rsi_required': True}.
[I 2025-08-30 16:15:03,753] Trial 699 finished with values: [-0.02380177242741288, 0.02371343316817931] and parameters: {'p_sma': 7, 'p_std': 22, 'p_atr': 11, 'p_adx': 24, 'rsi_period': 11, 'ema1': 22, 'ema2': 38, 'slip_atr_k': 0.2499340143857241, 'slip_spread_k': 0.6645369599193894, 'spread_hl_frac': 0.019616552668373807, 'bb_std_mult': 0.6758517663894853, 'rsi_os': 14, 'rsi_ob': 78, 'vol_spike': 0.22015630159907365, 'adx_thresh': 8.287137380373174, 'atr_min_pct': 0.014188515555512468, 'atr_max_pct': 0.1141763049200895, 'tp_mult': 1.137780998756624, 'tsl_mult': 0.4222459656951376, 'strategy': 'breakout', 'time_stop': 66, 'use_sma': True, 'use_atr': False, 'use_adx': True, 'use_ema': False, 'use_spike': False, 'rsi_required': False, 'edge_k': 0.5803544606179648, 'edge_cap': 0.23434110017304788, 'bull_strategy': 'breakout', 'bull_bb_std_mult': 1.0093278440458813, 'bull_rsi_os': 49, 'bull_rsi_ob': 73, 'bull_adx_thresh': 9.56892592741673, 'bull_atr_min_pct': 0.008340747059347156, 'bull_atr_max_pct': 0.11273275006423047, 'bull_tp_mult': 2.5600151436370817, 'bull_tsl_mult': 0.5418190548857649, 'bull_time_stop': 43, 'bull_use_sma': True, 'bull_use_ema': True, 'bull_use_atr': True, 'bull_use_adx': True, 'bull_use_spike': True, 'bull_rsi_required': False, 'bear_strategy': 'mean_reversion', 'bear_bb_std_mult': 2.3513261943903743, 'bear_rsi_os': 25, 'bear_rsi_ob': 73, 'bear_adx_thresh': 20.50417461599368, 'bear_atr_min_pct': 0.00020840936324534667, 'bear_atr_max_pct': 0.05925073937711615, 'bear_tp_mult': 2.79606876739857, 'bear_tsl_mult': 0.8848250573913032, 'bear_time_stop': 94, 'bear_use_sma': True, 'bear_use_ema': False, 'bear_use_atr': True, 'bear_use_adx': True, 'bear_use_spike': True, 'bear_rsi_required': True, 'sideways_strategy': 'mean_reversion', 'sideways_bb_std_mult': 3.1966202884829253, 'sideways_rsi_os': 19, 'sideways_rsi_ob': 82, 'sideways_adx_thresh': 8.242658794796695, 'sideways_atr_min_pct': 0.01650875090641658, 'sideways_atr_max_pct': 0.06976140266434258, 'sideways_tp_mult': 1.4546816348964897, 'sideways_tsl_mult': 0.3902187745113424, 'sideways_time_stop': 149, 'sideways_use_sma': True, 'sideways_use_ema': False, 'sideways_use_atr': True, 'sideways_use_adx': True, 'sideways_use_spike': True, 'sideways_rsi_required': True}.
[I 2025-08-30 16:15:03,955] Trial 698 finished with values: [-1000000000.0, 1000000000.0] and parameters: {'p_sma': 7, 'p_std': 19, 'p_atr': 11, 'p_adx': 24, 'rsi_period': 11, 'ema1': 19, 'ema2': 37, 'slip_atr_k': 0.004441545190722978, 'slip_spread_k': 0.7376800526580465, 'spread_hl_frac': 0.0159647864086367, 'bb_std_mult': 1.9584005771583226, 'rsi_os': 28, 'rsi_ob': 69, 'vol_spike': 0.2196867614378674, 'adx_thresh': 8.180097283688529, 'atr_min_pct': 0.014361478752368045, 'atr_max_pct': 0.11409544063683193, 'tp_mult': 1.5522233360859832, 'tsl_mult': 0.7171345388710726, 'strategy': 'breakout', 'time_stop': 72, 'use_sma': True, 'use_atr': False, 'use_adx': True, 'use_ema': False, 'use_spike': False, 'rsi_required': False, 'edge_k': 0.5814855003994099, 'edge_cap': 0.3121774684451024, 'bull_strategy': 'breakout', 'bull_bb_std_mult': 2.182655335316875, 'bull_rsi_os': 50, 'bull_rsi_ob': 88, 'bull_adx_thresh': 9.413840089709122, 'bull_atr_min_pct': 0.02128055587511318, 'bull_atr_max_pct': 0.0936622153437301, 'bull_tp_mult': 2.5586799647862493, 'bull_tsl_mult': 0.2590093451172375, 'bull_time_stop': 41, 'bull_use_sma': True, 'bull_use_ema': True, 'bull_use_atr': True, 'bull_use_adx': True, 'bull_use_spike': True, 'bull_rsi_required': False, 'bear_strategy': 'mean_reversion', 'bear_bb_std_mult': 2.1130351873762816, 'bear_rsi_os': 25, 'bear_rsi_ob': 48, 'bear_adx_thresh': 17.422425849878472, 'bear_atr_min_pct': 0.004917194306668399, 'bear_atr_max_pct': 0.02668827285882136, 'bear_tp_mult': 2.6563577797667137, 'bear_tsl_mult': 0.879939751906488, 'bear_time_stop': 97, 'bear_use_sma': True, 'bear_use_ema': False, 'bear_use_atr': True, 'bear_use_adx': True, 'bear_use_spike': True, 'bear_rsi_required': True, 'sideways_strategy': 'mean_reversion', 'sideways_bb_std_mult': 3.1815015827169733, 'sideways_rsi_os': 23, 'sideways_rsi_ob': 82, 'sideways_adx_thresh': 9.418431704465855, 'sideways_atr_min_pct': 0.026949832774347645, 'sideways_atr_max_pct': 0.06942751991659277, 'sideways_tp_mult': 1.6056478508173146, 'sideways_tsl_mult': 0.6206178889611438, 'sideways_time_stop': 250, 'sideways_use_sma': True, 'sideways_use_ema': False, 'sideways_use_atr': True, 'sideways_use_adx': True, 'sideways_use_spike': True, 'sideways_rsi_required': True}.
