[I 2025-08-30 15:10:46,372] Trial 385 finished with values: [-0.004766539961844507, 0.004918375934373888] and parameters: {'p_sma': 18, 'p_std': 30, 'p_atr': 17, 'p_adx': 29, 'rsi_period': 79, 'ema1': 29, 'ema2': 37, 'slip_atr_k': 0.002001669787026339, 'slip_spread_k': 0.8708488600688706, 'spread_hl_frac': 0.004427437426576137, 'bb_std_mult': 3.1765561260199764, 'rsi_os': 23, 'rsi_ob': 87, 'vol_spike': 0.21630126133800254, 'adx_thresh': 9.69368770142544, 'atr_min_pct': 0.008153151950511407, 'atr_max_pct': 0.11192420132253648, 'tp_mult': 1.7623532623781573, 'tsl_mult': 0.5280002929900371, 'strategy': 'breakout', 'time_stop': 171, 'use_sma': False, 'use_atr': False, 'use_adx': True, 'use_ema': False, 'use_spike': False, 'rsi_required': False, 'edge_k': 0.5804472047656382, 'edge_cap': 0.7099610940213494, 'bull_strategy': 'breakout', 'bull_bb_std_mult': 1.616166449036251, 'bull_rsi_os': 51, 'bull_rsi_ob': 86, 'bull_adx_thresh': 14.761535263221328, 'bull_atr_min_pct': 0.0019636618232106184, 'bull_atr_max_pct': 0.09715619947944025, 'bull_tp_mult': 2.5443095485161757, 'bull_tsl_mult': 0.9364753374100147, 'bull_time_stop': 120, 'bull_use_sma': True, 'bull_use_ema': True, 'bull_use_atr': True, 'bull_use_adx': False, 'bull_use_spike': True, 'bull_rsi_required': False, 'bear_strategy': 'mean_reversion', 'bear_bb_std_mult': 2.85040539698459, 'bear_rsi_os': 28, 'bear_rsi_ob': 75, 'bear_adx_thresh': 5.040832198924642, 'bear_atr_min_pct': 0.004313211877301245, 'bear_atr_max_pct': 0.1087323409229638, 'bear_tp_mult': 2.863791957749503, 'bear_tsl_mult': 0.9567729344564093, 'bear_time_stop': 108, 'bear_use_sma': True, 'bear_use_ema': False, 'bear_use_atr': True, 'bear_use_adx': True, 'bear_use_spike': True, 'bear_rsi_required': True, 'sideways_strategy': 'mean_reversion', 'sideways_bb_std_mult': 3.272492814421822, 'sideways_rsi_os': 33, 'sideways_rsi_ob': 52, 'sideways_adx_thresh': 12.027731531192853, 'sideways_atr_min_pct': 0.021790188441027904, 'sideways_atr_max_pct': 0.08834904764456002, 'sideways_tp_mult': 2.2464251631858168, 'sideways_tsl_mult': 0.3372416908579103, 'sideways_time_stop': 98, 'sideways_use_sma': True, 'sideways_use_ema': False, 'sideways_use_atr': True, 'sideways_use_adx': True, 'sideways_use_spike': True, 'sideways_rsi_required': True}.
[I 2025-08-30 15:10:47,452] Trial 386 finished with values: [-0.0043948148887192895, 0.0047093994598920615] and parameters: {'p_sma': 19, 'p_std': 30, 'p_atr': 17, 'p_adx': 28, 'rsi_period': 52, 'ema1': 26, 'ema2': 38, 'slip_atr_k': 0.0007232659295696341, 'slip_spread_k': 0.761286932292415, 'spread_hl_frac': 0.004027166762021247, 'bb_std_mult': 3.183820335640084, 'rsi_os': 23, 'rsi_ob': 87, 'vol_spike': 0.21681339840609534, 'adx_thresh': 9.020817930850178, 'atr_min_pct': 0.0073266052044842055, 'atr_max_pct': 0.11046030668602975, 'tp_mult': 1.765706080620875, 'tsl_mult': 0.5409346314091814, 'strategy': 'breakout', 'time_stop': 136, 'use_sma': False, 'use_atr': False, 'use_adx': True, 'use_ema': False, 'use_spike': False, 'rsi_required': False, 'edge_k': 0.5914579582012895, 'edge_cap': 0.7171837760232689, 'bull_strategy': 'breakout', 'bull_bb_std_mult': 1.560889516161219, 'bull_rsi_os': 51, 'bull_rsi_ob': 89, 'bull_adx_thresh': 12.431044917206838, 'bull_atr_min_pct': 0.0019184232593004687, 'bull_atr_max_pct': 0.09906903425061103, 'bull_tp_mult': 2.568004803590949, 'bull_tsl_mult': 0.9352436449899172, 'bull_time_stop': 111, 'bull_use_sma': True, 'bull_use_ema': True, 'bull_use_atr': True, 'bull_use_adx': False, 'bull_use_spike': True, 'bull_rsi_required': False, 'bear_strategy': 'mean_reversion', 'bear_bb_std_mult': 1.3761532160152283, 'bear_rsi_os': 28, 'bear_rsi_ob': 75, 'bear_adx_thresh': 14.4258332511081, 'bear_atr_min_pct': 0.003150016285144457, 'bear_atr_max_pct': 0.10900044922655758, 'bear_tp_mult': 2.851793750822365, 'bear_tsl_mult': 0.6359285103185115, 'bear_time_stop': 96, 'bear_use_sma': True, 'bear_use_ema': False, 'bear_use_atr': True, 'bear_use_adx': True, 'bear_use_spike': True, 'bear_rsi_required': True, 'sideways_strategy': 'mean_reversion', 'sideways_bb_std_mult': 3.272501456278844, 'sideways_rsi_os': 33, 'sideways_rsi_ob': 53, 'sideways_adx_thresh': 9.76877996427736, 'sideways_atr_min_pct': 0.022101363136418625, 'sideways_atr_max_pct': 0.08811562415396221, 'sideways_tp_mult': 2.2241348834063848, 'sideways_tsl_mult': 0.33866139404393364, 'sideways_time_stop': 98, 'sideways_use_sma': True, 'sideways_use_ema': False, 'sideways_use_atr': True, 'sideways_use_adx': True, 'sideways_use_spike': True, 'sideways_rsi_required': True}.
[I 2025-08-30 15:11:35,712] Trial 391 finished with values: [-1000000000.0, 1000000000.0] and parameters: {'p_sma': 20, 'p_std': 28, 'p_atr': 17, 'p_adx': 28, 'rsi_period': 81, 'ema1': 27, 'ema2': 37, 'slip_atr_k': 0.00221769157304038, 'slip_spread_k': 0.8617948944637566, 'spread_hl_frac': 0.005801371291828308, 'bb_std_mult': 3.194138853748706, 'rsi_os': 24, 'rsi_ob': 80, 'vol_spike': 0.190573460653225, 'adx_thresh': 9.343170885347039, 'atr_min_pct': 0.009165892278452081, 'atr_max_pct': 0.11291185928634598, 'tp_mult': 1.7555630960236268, 'tsl_mult': 0.5408387542907946, 'strategy': 'breakout', 'time_stop': 176, 'use_sma': False, 'use_atr': False, 'use_adx': True, 'use_ema': False, 'use_spike': False, 'rsi_required': False, 'edge_k': 0.6414488581536069, 'edge_cap': 0.622683832635147, 'bull_strategy': 'breakout', 'bull_bb_std_mult': 1.5781719064107471, 'bull_rsi_os': 49, 'bull_rsi_ob': 90, 'bull_adx_thresh': 15.651985998082383, 'bull_atr_min_pct': 0.005892323920613906, 'bull_atr_max_pct': 0.11823435878290316, 'bull_tp_mult': 2.805894523084957, 'bull_tsl_mult': 0.9074824806192406, 'bull_time_stop': 112, 'bull_use_sma': True, 'bull_use_ema': True, 'bull_use_atr': True, 'bull_use_adx': False, 'bull_use_spike': True, 'bull_rsi_required': False, 'bear_strategy': 'mean_reversion', 'bear_bb_std_mult': 2.6791890743865734, 'bear_rsi_os': 29, 'bear_rsi_ob': 76, 'bear_adx_thresh': 5.340526708251828, 'bear_atr_min_pct': 0.007718946546715778, 'bear_atr_max_pct': 0.13031916709786903, 'bear_tp_mult': 2.7910564403211477, 'bear_tsl_mult': 0.9081033545399041, 'bear_time_stop': 105, 'bear_use_sma': True, 'bear_use_ema': False, 'bear_use_atr': True, 'bear_use_adx': True, 'bear_use_spike': True, 'bear_rsi_required': True, 'sideways_strategy': 'mean_reversion', 'sideways_bb_std_mult': 3.3176854561848055, 'sideways_rsi_os': 31, 'sideways_rsi_ob': 51, 'sideways_adx_thresh': 10.149663050864152, 'sideways_atr_min_pct': 0.017151095823126863, 'sideways_atr_max_pct': 0.08178433220423742, 'sideways_tp_mult': 2.127411313580787, 'sideways_tsl_mult': 0.35441696096855485, 'sideways_time_stop': 106, 'sideways_use_sma': True, 'sideways_use_ema': False, 'sideways_use_atr': True, 'sideways_use_adx': True, 'sideways_use_spike': True, 'sideways_rsi_required': True}.
[I 2025-08-30 15:11:36,704] Trial 390 finished with values: [-0.0036539730005126225, 0.0037024039861747265] and parameters: {'p_sma': 20, 'p_std': 31, 'p_atr': 23, 'p_adx': 28, 'rsi_period': 52, 'ema1': 26, 'ema2': 37, 'slip_atr_k': 0.00021431635796275372, 'slip_spread_k': 0.6999006938339309, 'spread_hl_frac': 0.0040332471085456345, 'bb_std_mult': 3.160829037976096, 'rsi_os': 26, 'rsi_ob': 87, 'vol_spike': 0.21771680060005233, 'adx_thresh': 9.69954191740737, 'atr_min_pct': 0.00731233856967696, 'atr_max_pct': 0.10493693033707067, 'tp_mult': 1.6472684128078219, 'tsl_mult': 0.5375490567515122, 'strategy': 'breakout', 'time_stop': 183, 'use_sma': False, 'use_atr': False, 'use_adx': True, 'use_ema': False, 'use_spike': False, 'rsi_required': False, 'edge_k': 0.5686793522270855, 'edge_cap': 0.7442199937147094, 'bull_strategy': 'breakout', 'bull_bb_std_mult': 1.5273811377131283, 'bull_rsi_os': 51, 'bull_rsi_ob': 93, 'bull_adx_thresh': 15.22153908511504, 'bull_atr_min_pct': 0.001888220994615403, 'bull_atr_max_pct': 0.09593815891371571, 'bull_tp_mult': 2.6047449751326757, 'bull_tsl_mult': 0.9345472310317634, 'bull_time_stop': 115, 'bull_use_sma': True, 'bull_use_ema': True, 'bull_use_atr': True, 'bull_use_adx': False, 'bull_use_spike': True, 'bull_rsi_required': False, 'bear_strategy': 'mean_reversion', 'bear_bb_std_mult': 3.2268359306587384, 'bear_rsi_os': 29, 'bear_rsi_ob': 72, 'bear_adx_thresh': 21.55594615075876, 'bear_atr_min_pct': 0.007584301297246501, 'bear_atr_max_pct': 0.12647176301638258, 'bear_tp_mult': 2.854123230705411, 'bear_tsl_mult': 0.27898141291093137, 'bear_time_stop': 54, 'bear_use_sma': True, 'bear_use_ema': False, 'bear_use_atr': True, 'bear_use_adx': True, 'bear_use_spike': True, 'bear_rsi_required': True, 'sideways_strategy': 'mean_reversion', 'sideways_bb_std_mult': 2.767040238787835, 'sideways_rsi_os': 34, 'sideways_rsi_ob': 52, 'sideways_adx_thresh': 6.380219972934746, 'sideways_atr_min_pct': 0.021463964191395662, 'sideways_atr_max_pct': 0.08570877799850604, 'sideways_tp_mult': 2.31511760325416, 'sideways_tsl_mult': 0.24048607183374332, 'sideways_time_stop': 108, 'sideways_use_sma': True, 'sideways_use_ema': False, 'sideways_use_atr': True, 'sideways_use_adx': True, 'sideways_use_spike': True, 'sideways_rsi_required': True}.
[I 2025-08-30 15:11:36,726] Trial 392 finished with values: [-0.0023236300677424993, 0.002433400815965232] and parameters: {'p_sma': 16, 'p_std': 29, 'p_atr': 11, 'p_adx': 26, 'rsi_period': 52, 'ema1': 25, 'ema2': 37, 'slip_atr_k': 0.0011241804123291218, 'slip_spread_k': 0.7060288390248284, 'spread_hl_frac': 0.0053751510491380295, 'bb_std_mult': 3.171134052931133, 'rsi_os': 23, 'rsi_ob': 87, 'vol_spike': 0.21580648226670746, 'adx_thresh': 8.030675147613504, 'atr_min_pct': 0.007298781055457597, 'atr_max_pct': 0.11352011423999903, 'tp_mult': 1.711811072277356, 'tsl_mult': 0.5393762650126902, 'strategy': 'breakout', 'time_stop': 139, 'use_sma': False, 'use_atr': False, 'use_adx': True, 'use_ema': False, 'use_spike': False, 'rsi_required': False, 'edge_k': 0.5644733718507334, 'edge_cap': 0.6933398681597386, 'bull_strategy': 'breakout', 'bull_bb_std_mult': 1.5520810791643387, 'bull_rsi_os': 48, 'bull_rsi_ob': 90, 'bull_adx_thresh': 11.791283828858822, 'bull_atr_min_pct': 0.0021313065061816534, 'bull_atr_max_pct': 0.11502003798066049, 'bull_tp_mult': 2.597722121883912, 'bull_tsl_mult': 0.9317224948943321, 'bull_time_stop': 48, 'bull_use_sma': True, 'bull_use_ema': True, 'bull_use_atr': True, 'bull_use_adx': False, 'bull_use_spike': True, 'bull_rsi_required': False, 'bear_strategy': 'mean_reversion', 'bear_bb_std_mult': 1.3803281795363809, 'bear_rsi_os': 28, 'bear_rsi_ob': 76, 'bear_adx_thresh': 11.985856814209448, 'bear_atr_min_pct': 0.0032976903359545878, 'bear_atr_max_pct': 0.10757990350702812, 'bear_tp_mult': 2.765776972695064, 'bear_tsl_mult': 0.6031501414540923, 'bear_time_stop': 94, 'bear_use_sma': True, 'bear_use_ema': False, 'bear_use_atr': True, 'bear_use_adx': True, 'bear_use_spike': True, 'bear_rsi_required': True, 'sideways_strategy': 'mean_reversion', 'sideways_bb_std_mult': 3.310771801541268, 'sideways_rsi_os': 31, 'sideways_rsi_ob': 51, 'sideways_adx_thresh': 9.923343655099224, 'sideways_atr_min_pct': 0.02136687188327494, 'sideways_atr_max_pct': 0.08363005858003436, 'sideways_tp_mult': 2.154346724419466, 'sideways_tsl_mult': 0.35066760468475244, 'sideways_time_stop': 110, 'sideways_use_sma': True, 'sideways_use_ema': False, 'sideways_use_atr': True, 'sideways_use_adx': True, 'sideways_use_spike': True, 'sideways_rsi_required': True}.
[I 2025-08-30 15:11:38,066] Trial 389 finished with values: [-1000000000.0, 1000000000.0] and parameters: {'p_sma': 19, 'p_std': 31, 'p_atr': 17, 'p_adx': 28, 'rsi_period': 52, 'ema1': 26, 'ema2': 37, 'slip_atr_k': 0.0006727580728098159, 'slip_spread_k': 0.8850715036650652, 'spread_hl_frac': 0.0041546022705431195, 'bb_std_mult': 3.1809251905264375, 'rsi_os': 23, 'rsi_ob': 87, 'vol_spike': 0.21388107569586534, 'adx_thresh': 9.652337558623657, 'atr_min_pct': 0.007712576060279871, 'atr_max_pct': 0.10438222682495059, 'tp_mult': 1.918064683324279, 'tsl_mult': 0.5393765165055822, 'strategy': 'breakout', 'time_stop': 171, 'use_sma': False, 'use_atr': False, 'use_adx': True, 'use_ema': False, 'use_spike': False, 'rsi_required': False, 'edge_k': 0.6412901368628625, 'edge_cap': 0.7286540234383931, 'bull_strategy': 'breakout', 'bull_bb_std_mult': 1.0840107098619045, 'bull_rsi_os': 51, 'bull_rsi_ob': 95, 'bull_adx_thresh': 15.999518782814087, 'bull_atr_min_pct': 0.0020403987708167105, 'bull_atr_max_pct': 0.09600902542279538, 'bull_tp_mult': 2.5965008099290756, 'bull_tsl_mult': 0.9301180926901941, 'bull_time_stop': 116, 'bull_use_sma': True, 'bull_use_ema': True, 'bull_use_atr': True, 'bull_use_adx': False, 'bull_use_spike': True, 'bull_rsi_required': False, 'bear_strategy': 'mean_reversion', 'bear_bb_std_mult': 3.2403976705459785, 'bear_rsi_os': 28, 'bear_rsi_ob': 73, 'bear_adx_thresh': 5.779504489805605, 'bear_atr_min_pct': 0.004453974014507851, 'bear_atr_max_pct': 0.1263173274361642, 'bear_tp_mult': 2.870540938638371, 'bear_tsl_mult': 0.6326210628654833, 'bear_time_stop': 97, 'bear_use_sma': True, 'bear_use_ema': False, 'bear_use_atr': True, 'bear_use_adx': True, 'bear_use_spike': True, 'bear_rsi_required': True, 'sideways_strategy': 'mean_reversion', 'sideways_bb_std_mult': 2.7378117738015786, 'sideways_rsi_os': 32, 'sideways_rsi_ob': 53, 'sideways_adx_thresh': 6.231144849949237, 'sideways_atr_min_pct': 0.021799557080327114, 'sideways_atr_max_pct': 0.0852269975309444, 'sideways_tp_mult': 2.22364562335001, 'sideways_tsl_mult': 0.34093641683327747, 'sideways_time_stop': 99, 'sideways_use_sma': True, 'sideways_use_ema': False, 'sideways_use_atr': True, 'sideways_use_adx': True, 'sideways_use_spike': True, 'sideways_rsi_required': True}.
[I 2025-08-30 15:12:28,200] Trial 393 finished with values: [-1000000000.0, 1000000000.0] and parameters: {'p_sma': 14, 'p_std': 29, 'p_atr': 16, 'p_adx': 26, 'rsi_period': 52, 'ema1': 25, 'ema2': 43, 'slip_atr_k': 0.00018190816567930236, 'slip_spread_k': 0.710042372526987, 'spread_hl_frac': 0.005607383439525635, 'bb_std_mult': 3.1871285454009706, 'rsi_os': 23, 'rsi_ob': 87, 'vol_spike': 0.2161352346351751, 'adx_thresh': 7.83905640734442, 'atr_min_pct': 0.007220391914406135, 'atr_max_pct': 0.11305552602982988, 'tp_mult': 1.6876140039740424, 'tsl_mult': 0.5414537866392384, 'strategy': 'breakout', 'time_stop': 136, 'use_sma': False, 'use_atr': False, 'use_adx': True, 'use_ema': False, 'use_spike': False, 'rsi_required': False, 'edge_k': 0.6212131217312761, 'edge_cap': 0.6907568342345711, 'bull_strategy': 'breakout', 'bull_bb_std_mult': 1.5267023651592813, 'bull_rsi_os': 49, 'bull_rsi_ob': 93, 'bull_adx_thresh': 11.640437394732842, 'bull_atr_min_pct': 0.002213385722399345, 'bull_atr_max_pct': 0.10884204112304159, 'bull_tp_mult': 2.5211244013810354, 'bull_tsl_mult': 0.9011645809445136, 'bull_time_stop': 48, 'bull_use_sma': True, 'bull_use_ema': True, 'bull_use_atr': True, 'bull_use_adx': False, 'bull_use_spike': True, 'bull_rsi_required': False, 'bear_strategy': 'mean_reversion', 'bear_bb_std_mult': 1.4838293958971907, 'bear_rsi_os': 28, 'bear_rsi_ob': 73, 'bear_adx_thresh': 13.563340955244776, 'bear_atr_min_pct': 0.003424742706665559, 'bear_atr_max_pct': 0.1076818853544409, 'bear_tp_mult': 2.7776222254088205, 'bear_tsl_mult': 0.6029718410184729, 'bear_time_stop': 94, 'bear_use_sma': True, 'bear_use_ema': False, 'bear_use_atr': True, 'bear_use_adx': True, 'bear_use_spike': True, 'bear_rsi_required': True, 'sideways_strategy': 'mean_reversion', 'sideways_bb_std_mult': 3.1672730078436544, 'sideways_rsi_os': 31, 'sideways_rsi_ob': 52, 'sideways_adx_thresh': 9.620041366367765, 'sideways_atr_min_pct': 0.021586208730017636, 'sideways_atr_max_pct': 0.08413689214357434, 'sideways_tp_mult': 2.1713042898586483, 'sideways_tsl_mult': 0.31914462996515486, 'sideways_time_stop': 109, 'sideways_use_sma': True, 'sideways_use_ema': False, 'sideways_use_atr': True, 'sideways_use_adx': True, 'sideways_use_spike': True, 'sideways_rsi_required': True}.
[I 2025-08-30 15:12:29,351] Trial 396 finished with values: [-1000000000.0, 1000000000.0] and parameters: {'p_sma': 16, 'p_std': 28, 'p_atr': 11, 'p_adx': 26, 'rsi_period': 36, 'ema1': 23, 'ema2': 37, 'slip_atr_k': 0.00023151103384663903, 'slip_spread_k': 0.7002080566304749, 'spread_hl_frac': 0.005611645887078195, 'bb_std_mult': 3.170065731794022, 'rsi_os': 23, 'rsi_ob': 87, 'vol_spike': 0.17147330072447686, 'adx_thresh': 7.887138998171364, 'atr_min_pct': 0.008578759178890276, 'atr_max_pct': 0.11552470033503756, 'tp_mult': 1.64798062813117, 'tsl_mult': 0.5420575594706696, 'strategy': 'breakout', 'time_stop': 139, 'use_sma': False, 'use_atr': False, 'use_adx': True, 'use_ema': False, 'use_spike': False, 'rsi_required': False, 'edge_k': 0.5602573410290487, 'edge_cap': 0.6408560164016819, 'bull_strategy': 'breakout', 'bull_bb_std_mult': 1.5227055135786638, 'bull_rsi_os': 34, 'bull_rsi_ob': 93, 'bull_adx_thresh': 11.695637725901967, 'bull_atr_min_pct': 0.009274078255436021, 'bull_atr_max_pct': 0.106679629190162, 'bull_tp_mult': 2.6130634473008767, 'bull_tsl_mult': 0.8995632843105744, 'bull_time_stop': 34, 'bull_use_sma': True, 'bull_use_ema': True, 'bull_use_atr': True, 'bull_use_adx': False, 'bull_use_spike': True, 'bull_rsi_required': False, 'bear_strategy': 'mean_reversion', 'bear_bb_std_mult': 1.4082843654180692, 'bear_rsi_os': 28, 'bear_rsi_ob': 76, 'bear_adx_thresh': 11.96879569627472, 'bear_atr_min_pct': 0.0035209636837243417, 'bear_atr_max_pct': 0.10755672667083864, 'bear_tp_mult': 2.43052829323758, 'bear_tsl_mult': 0.5952515931365259, 'bear_time_stop': 83, 'bear_use_sma': True, 'bear_use_ema': False, 'bear_use_atr': True, 'bear_use_adx': True, 'bear_use_spike': True, 'bear_rsi_required': True, 'sideways_strategy': 'mean_reversion', 'sideways_bb_std_mult': 3.2663852749145184, 'sideways_rsi_os': 30, 'sideways_rsi_ob': 50, 'sideways_adx_thresh': 9.487050576327386, 'sideways_atr_min_pct': 0.015458874524209456, 'sideways_atr_max_pct': 0.08150943369907973, 'sideways_tp_mult': 2.165646434158955, 'sideways_tsl_mult': 0.24499625487534793, 'sideways_time_stop': 111, 'sideways_use_sma': True, 'sideways_use_ema': False, 'sideways_use_atr': True, 'sideways_use_adx': True, 'sideways_use_spike': True, 'sideways_rsi_required': True}.
[I 2025-08-30 15:12:29,725] Trial 395 finished with values: [-1000000000.0, 1000000000.0] and parameters: {'p_sma': 16, 'p_std': 28, 'p_atr': 11, 'p_adx': 25, 'rsi_period': 36, 'ema1': 23, 'ema2': 36, 'slip_atr_k': 0.0007742218697073219, 'slip_spread_k': 0.7161387480814467, 'spread_hl_frac': 0.0055810419796877685, 'bb_std_mult': 3.1811299498320342, 'rsi_os': 22, 'rsi_ob': 87, 'vol_spike': 0.1663769224798025, 'adx_thresh': 8.381619196982653, 'atr_min_pct': 0.007355409384864986, 'atr_max_pct': 0.11587205885065596, 'tp_mult': 1.7006428930308297, 'tsl_mult': 0.5404641662183239, 'strategy': 'breakout', 'time_stop': 138, 'use_sma': False, 'use_atr': False, 'use_adx': True, 'use_ema': False, 'use_spike': False, 'rsi_required': False, 'edge_k': 0.5651955009069225, 'edge_cap': 0.6620950565710266, 'bull_strategy': 'breakout', 'bull_bb_std_mult': 1.5260805975169227, 'bull_rsi_os': 34, 'bull_rsi_ob': 89, 'bull_adx_thresh': 11.53400872130986, 'bull_atr_min_pct': 0.00816852361577828, 'bull_atr_max_pct': 0.11480153959175815, 'bull_tp_mult': 2.5989164623584813, 'bull_tsl_mult': 0.9021106559926383, 'bull_time_stop': 45, 'bull_use_sma': True, 'bull_use_ema': True, 'bull_use_atr': True, 'bull_use_adx': False, 'bull_use_spike': True, 'bull_rsi_required': False, 'bear_strategy': 'mean_reversion', 'bear_bb_std_mult': 1.394443138644152, 'bear_rsi_os': 28, 'bear_rsi_ob': 76, 'bear_adx_thresh': 10.75143724223562, 'bear_atr_min_pct': 0.0035781165077960956, 'bear_atr_max_pct': 0.12749867788310829, 'bear_tp_mult': 2.189721085870612, 'bear_tsl_mult': 0.5977205425086506, 'bear_time_stop': 82, 'bear_use_sma': True, 'bear_use_ema': False, 'bear_use_atr': True, 'bear_use_adx': True, 'bear_use_spike': True, 'bear_rsi_required': True, 'sideways_strategy': 'mean_reversion', 'sideways_bb_std_mult': 3.287737957851597, 'sideways_rsi_os': 30, 'sideways_rsi_ob': 50, 'sideways_adx_thresh': 9.607656508408963, 'sideways_atr_min_pct': 0.01741773998894919, 'sideways_atr_max_pct': 0.08347082091293921, 'sideways_tp_mult': 2.1685085701336666, 'sideways_tsl_mult': 0.39101173305263187, 'sideways_time_stop': 111, 'sideways_use_sma': True, 'sideways_use_ema': False, 'sideways_use_atr': True, 'sideways_use_adx': True, 'sideways_use_spike': True, 'sideways_rsi_required': True}.
