[I 2025-08-30 15:04:35,202] Trial 349 finished with values: [-0.009577584858778243, 0.00953297140385281] and parameters: {'p_sma': 23, 'p_std': 36, 'p_atr': 16, 'p_adx': 13, 'rsi_period': 7, 'ema1': 11, 'ema2': 49, 'slip_atr_k': 0.02336426869618516, 'slip_spread_k': 0.3037029096997147, 'spread_hl_frac': 0.03713755005904031, 'bb_std_mult': 2.6344456974598374, 'rsi_os': 7, 'rsi_ob': 89, 'vol_spike': 0.24182609398955643, 'adx_thresh': 12.48168460718443, 'atr_min_pct': 0.01194451055569901, 'atr_max_pct': 0.09814616719676465, 'tp_mult': 2.481774451433193, 'tsl_mult': 0.5063415536582249, 'strategy': 'breakout', 'time_stop': 270, 'use_sma': False, 'use_atr': False, 'use_adx': True, 'use_ema': False, 'use_spike': False, 'rsi_required': False, 'edge_k': 0.39183855406435747, 'edge_cap': 0.8033139568254556, 'bull_strategy': 'breakout', 'bull_bb_std_mult': 1.988130798475756, 'bull_rsi_os': 54, 'bull_rsi_ob': 62, 'bull_adx_thresh': 32.4424547547855, 'bull_atr_min_pct': 1.7335274814792663e-05, 'bull_atr_max_pct': 0.12696071843655124, 'bull_tp_mult': 2.181878728011729, 'bull_tsl_mult': 0.12099623704684642, 'bull_time_stop': 128, 'bull_use_sma': True, 'bull_use_ema': True, 'bull_use_atr': True, 'bull_use_adx': False, 'bull_use_spike': True, 'bull_rsi_required': False, 'bear_strategy': 'mean_reversion', 'bear_bb_std_mult': 1.7141923157725798, 'bear_rsi_os': 53, 'bear_rsi_ob': 46, 'bear_adx_thresh': 21.012399739709092, 'bear_atr_min_pct': 0.018056503996090947, 'bear_atr_max_pct': 0.015065690219225228, 'bear_tp_mult': 2.9977770519061866, 'bear_tsl_mult': 0.18679832743576186, 'bear_time_stop': 268, 'bear_use_sma': True, 'bear_use_ema': False, 'bear_use_atr': True, 'bear_use_adx': True, 'bear_use_spike': True, 'bear_rsi_required': True, 'sideways_strategy': 'mean_reversion', 'sideways_bb_std_mult': 1.078676746551952, 'sideways_rsi_os': 38, 'sideways_rsi_ob': 59, 'sideways_adx_thresh': 20.572873306322624, 'sideways_atr_min_pct': 0.0046478462347533025, 'sideways_atr_max_pct': 0.09724983041388845, 'sideways_tp_mult': 2.32962999494779, 'sideways_tsl_mult': 0.6860383074906875, 'sideways_time_stop': 82, 'sideways_use_sma': True, 'sideways_use_ema': False, 'sideways_use_atr': True, 'sideways_use_adx': True, 'sideways_use_spike': True, 'sideways_rsi_required': True}.
[I 2025-08-30 15:04:35,298] Trial 350 finished with values: [-1000000000.0, 1000000000.0] and parameters: {'p_sma': 23, 'p_std': 54, 'p_atr': 16, 'p_adx': 28, 'rsi_period': 50, 'ema1': 20, 'ema2': 14, 'slip_atr_k': 0.019582099890542673, 'slip_spread_k': 0.3071501448349551, 'spread_hl_frac': 0.024693066350934396, 'bb_std_mult': 1.0478750614181815, 'rsi_os': 47, 'rsi_ob': 88, 'vol_spike': 0.23267381321716177, 'adx_thresh': 12.487980705768756, 'atr_min_pct': 0.004425980314281564, 'atr_max_pct': 0.09695404608130964, 'tp_mult': 1.8757871044179235, 'tsl_mult': 0.5044656861687331, 'strategy': 'breakout', 'time_stop': 269, 'use_sma': False, 'use_atr': False, 'use_adx': True, 'use_ema': False, 'use_spike': False, 'rsi_required': False, 'edge_k': 0.40224460307635035, 'edge_cap': 0.799386784850769, 'bull_strategy': 'breakout', 'bull_bb_std_mult': 2.485109475019388, 'bull_rsi_os': 54, 'bull_rsi_ob': 63, 'bull_adx_thresh': 32.61628665208211, 'bull_atr_min_pct': 0.0006067503445188545, 'bull_atr_max_pct': 0.12575405405113424, 'bull_tp_mult': 1.0637406922521147, 'bull_tsl_mult': 0.15600176403994614, 'bull_time_stop': 141, 'bull_use_sma': True, 'bull_use_ema': True, 'bull_use_atr': True, 'bull_use_adx': False, 'bull_use_spike': True, 'bull_rsi_required': False, 'bear_strategy': 'mean_reversion', 'bear_bb_std_mult': 1.6820327886313406, 'bear_rsi_os': 26, 'bear_rsi_ob': 45, 'bear_adx_thresh': 6.938004448097299, 'bear_atr_min_pct': 0.027303215159049286, 'bear_atr_max_pct': 0.01529567985558572, 'bear_tp_mult': 2.998255188411889, 'bear_tsl_mult': 0.42905207546020074, 'bear_time_stop': 270, 'bear_use_sma': True, 'bear_use_ema': False, 'bear_use_atr': True, 'bear_use_adx': True, 'bear_use_spike': True, 'bear_rsi_required': True, 'sideways_strategy': 'mean_reversion', 'sideways_bb_std_mult': 1.1190234274047342, 'sideways_rsi_os': 18, 'sideways_rsi_ob': 59, 'sideways_adx_thresh': 20.33563376705981, 'sideways_atr_min_pct': 0.004556253396889072, 'sideways_atr_max_pct': 0.09789654271886933, 'sideways_tp_mult': 2.31947811259096, 'sideways_tsl_mult': 0.639420459703399, 'sideways_time_stop': 91, 'sideways_use_sma': True, 'sideways_use_ema': False, 'sideways_use_atr': True, 'sideways_use_adx': True, 'sideways_use_spike': True, 'sideways_rsi_required': True}.
[I 2025-08-30 15:05:10,029] Trial 353 finished with values: [-1000000000.0, 1000000000.0] and parameters: {'p_sma': 23, 'p_std': 34, 'p_atr': 16, 'p_adx': 30, 'rsi_period': 53, 'ema1': 10, 'ema2': 49, 'slip_atr_k': 0.018051070321861883, 'slip_spread_k': 0.6795871319365498, 'spread_hl_frac': 0.0021849928958157004, 'bb_std_mult': 1.0430966492667637, 'rsi_os': 9, 'rsi_ob': 88, 'vol_spike': 0.24862124610976322, 'adx_thresh': 12.47826291129962, 'atr_min_pct': 0.00646787778005088, 'atr_max_pct': 0.14856520645057375, 'tp_mult': 2.74276994413884, 'tsl_mult': 0.4843751057502815, 'strategy': 'breakout', 'time_stop': 268, 'use_sma': False, 'use_atr': False, 'use_adx': True, 'use_ema': False, 'use_spike': False, 'rsi_required': False, 'edge_k': 0.4093015915883297, 'edge_cap': 0.7700265884729426, 'bull_strategy': 'breakout', 'bull_bb_std_mult': 1.9747868397450883, 'bull_rsi_os': 53, 'bull_rsi_ob': 73, 'bull_adx_thresh': 32.533340303512404, 'bull_atr_min_pct': 0.0009716124786898603, 'bull_atr_max_pct': 0.102544920203784, 'bull_tp_mult': 2.1882021732913195, 'bull_tsl_mult': 0.9779616398712013, 'bull_time_stop': 141, 'bull_use_sma': True, 'bull_use_ema': True, 'bull_use_atr': True, 'bull_use_adx': False, 'bull_use_spike': True, 'bull_rsi_required': False, 'bear_strategy': 'mean_reversion', 'bear_bb_std_mult': 3.191572283956081, 'bear_rsi_os': 26, 'bear_rsi_ob': 84, 'bear_adx_thresh': 7.018670531860062, 'bear_atr_min_pct': 0.0274252343778911, 'bear_atr_max_pct': 0.06312916583970868, 'bear_tp_mult': 1.3928927711077934, 'bear_tsl_mult': 0.9308998757521336, 'bear_time_stop': 269, 'bear_use_sma': True, 'bear_use_ema': False, 'bear_use_atr': True, 'bear_use_adx': True, 'bear_use_spike': True, 'bear_rsi_required': True, 'sideways_strategy': 'mean_reversion', 'sideways_bb_std_mult': 1.117999127342418, 'sideways_rsi_os': 8, 'sideways_rsi_ob': 50, 'sideways_adx_thresh': 20.63647484025764, 'sideways_atr_min_pct': 0.024165688844024945, 'sideways_atr_max_pct': 0.051803216150892686, 'sideways_tp_mult': 1.5653268169360692, 'sideways_tsl_mult': 0.5006161182746229, 'sideways_time_stop': 259, 'sideways_use_sma': True, 'sideways_use_ema': False, 'sideways_use_atr': True, 'sideways_use_adx': True, 'sideways_use_spike': True, 'sideways_rsi_required': True}.
[I 2025-08-30 15:05:10,059] Trial 356 finished with values: [-1000000000.0, 1000000000.0] and parameters: {'p_sma': 29, 'p_std': 34, 'p_atr': 24, 'p_adx': 30, 'rsi_period': 53, 'ema1': 23, 'ema2': 17, 'slip_atr_k': 0.22395535074853104, 'slip_spread_k': 0.3519806743467434, 'spread_hl_frac': 0.03194586815967411, 'bb_std_mult': 0.8101804453703032, 'rsi_os': 9, 'rsi_ob': 92, 'vol_spike': 0.2488706041789151, 'adx_thresh': 11.631851656299213, 'atr_min_pct': 0.006496589919448771, 'atr_max_pct': 0.10416613839553644, 'tp_mult': 2.5101629111713817, 'tsl_mult': 0.7851174308206704, 'strategy': 'breakout', 'time_stop': 195, 'use_sma': False, 'use_atr': False, 'use_adx': True, 'use_ema': False, 'use_spike': False, 'rsi_required': False, 'edge_k': 0.07747132216987085, 'edge_cap': 0.7683772061392894, 'bull_strategy': 'breakout', 'bull_bb_std_mult': 2.5258262502047044, 'bull_rsi_os': 55, 'bull_rsi_ob': 70, 'bull_adx_thresh': 9.095261027916077, 'bull_atr_min_pct': 0.016337579870375603, 'bull_atr_max_pct': 0.10249195876099282, 'bull_tp_mult': 2.412186431208147, 'bull_tsl_mult': 0.978416683931267, 'bull_time_stop': 134, 'bull_use_sma': True, 'bull_use_ema': True, 'bull_use_atr': True, 'bull_use_adx': False, 'bull_use_spike': True, 'bull_rsi_required': True, 'bear_strategy': 'mean_reversion', 'bear_bb_std_mult': 2.791754421370303, 'bear_rsi_os': 5, 'bear_rsi_ob': 81, 'bear_adx_thresh': 24.770535447372872, 'bear_atr_min_pct': 0.021742342348059843, 'bear_atr_max_pct': 0.12372364976515693, 'bear_tp_mult': 1.5707647015537112, 'bear_tsl_mult': 0.6774017489168813, 'bear_time_stop': 256, 'bear_use_sma': True, 'bear_use_ema': False, 'bear_use_atr': True, 'bear_use_adx': True, 'bear_use_spike': True, 'bear_rsi_required': True, 'sideways_strategy': 'mean_reversion', 'sideways_bb_std_mult': 1.021260269339645, 'sideways_rsi_os': 36, 'sideways_rsi_ob': 56, 'sideways_adx_thresh': 10.948240660219758, 'sideways_atr_min_pct': 0.02393514272785168, 'sideways_atr_max_pct': 0.1304137456763208, 'sideways_tp_mult': 2.3778065580801355, 'sideways_tsl_mult': 0.4970202511886726, 'sideways_time_stop': 71, 'sideways_use_sma': True, 'sideways_use_ema': False, 'sideways_use_atr': True, 'sideways_use_adx': True, 'sideways_use_spike': True, 'sideways_rsi_required': True}.
[I 2025-08-30 15:05:10,372] Trial 354 finished with values: [-1000000000.0, 1000000000.0] and parameters: {'p_sma': 38, 'p_std': 35, 'p_atr': 24, 'p_adx': 30, 'rsi_period': 53, 'ema1': 9, 'ema2': 49, 'slip_atr_k': 0.22079484704004204, 'slip_spread_k': 0.3498544851139055, 'spread_hl_frac': 0.012900904189546232, 'bb_std_mult': 2.957517915381254, 'rsi_os': 9, 'rsi_ob': 89, 'vol_spike': 0.24838853152415327, 'adx_thresh': 8.518662323694533, 'atr_min_pct': 0.01095451558292159, 'atr_max_pct': 0.10262106206367091, 'tp_mult': 2.4815416119951266, 'tsl_mult': 0.4261139289436446, 'strategy': 'breakout', 'time_stop': 178, 'use_sma': False, 'use_atr': False, 'use_adx': True, 'use_ema': False, 'use_spike': False, 'rsi_required': False, 'edge_k': 0.24543409812777295, 'edge_cap': 0.7641196769561494, 'bull_strategy': 'breakout', 'bull_bb_std_mult': 1.8009081572310301, 'bull_rsi_os': 55, 'bull_rsi_ob': 65, 'bull_adx_thresh': 31.428294799017344, 'bull_atr_min_pct': 0.001337523326171561, 'bull_atr_max_pct': 0.10265028084649633, 'bull_tp_mult': 2.2211336779428223, 'bull_tsl_mult': 0.9734222173607018, 'bull_time_stop': 14, 'bull_use_sma': True, 'bull_use_ema': True, 'bull_use_atr': True, 'bull_use_adx': False, 'bull_use_spike': True, 'bull_rsi_required': False, 'bear_strategy': 'mean_reversion', 'bear_bb_std_mult': 3.2939618155952304, 'bear_rsi_os': 24, 'bear_rsi_ob': 45, 'bear_adx_thresh': 12.259826275037563, 'bear_atr_min_pct': 0.027142805671943958, 'bear_atr_max_pct': 0.014875589302063355, 'bear_tp_mult': 2.886155310660288, 'bear_tsl_mult': 0.42034880551602594, 'bear_time_stop': 270, 'bear_use_sma': True, 'bear_use_ema': False, 'bear_use_atr': True, 'bear_use_adx': True, 'bear_use_spike': True, 'bear_rsi_required': True, 'sideways_strategy': 'mean_reversion', 'sideways_bb_std_mult': 1.1079703147359268, 'sideways_rsi_os': 8, 'sideways_rsi_ob': 56, 'sideways_adx_thresh': 20.44110220090088, 'sideways_atr_min_pct': 0.004532047144876124, 'sideways_atr_max_pct': 0.05208937589985047, 'sideways_tp_mult': 2.349516699681519, 'sideways_tsl_mult': 0.4829258960303593, 'sideways_time_stop': 84, 'sideways_use_sma': True, 'sideways_use_ema': False, 'sideways_use_atr': True, 'sideways_use_adx': True, 'sideways_use_spike': True, 'sideways_rsi_required': True}.
[I 2025-08-30 15:05:10,544] Trial 355 finished with values: [-1000000000.0, 1000000000.0] and parameters: {'p_sma': 29, 'p_std': 34, 'p_atr': 28, 'p_adx': 30, 'rsi_period': 53, 'ema1': 9, 'ema2': 17, 'slip_atr_k': 0.22293971717164363, 'slip_spread_k': 0.3517565756732459, 'spread_hl_frac': 0.04034029088036235, 'bb_std_mult': 1.6651182449988657, 'rsi_os': 9, 'rsi_ob': 87, 'vol_spike': 0.24813539497425055, 'adx_thresh': 11.826343292588007, 'atr_min_pct': 0.011173663085576145, 'atr_max_pct': 0.10377558674916418, 'tp_mult': 2.728076368707045, 'tsl_mult': 0.4780041606345842, 'strategy': 'breakout', 'time_stop': 24, 'use_sma': False, 'use_atr': False, 'use_adx': True, 'use_ema': False, 'use_spike': False, 'rsi_required': False, 'edge_k': 0.25370111139433893, 'edge_cap': 0.7685041725575987, 'bull_strategy': 'breakout', 'bull_bb_std_mult': 2.5287462058901937, 'bull_rsi_os': 55, 'bull_rsi_ob': 72, 'bull_adx_thresh': 31.608278708370403, 'bull_atr_min_pct': 0.027184609648538936, 'bull_atr_max_pct': 0.08868997117484691, 'bull_tp_mult': 1.659921392077138, 'bull_tsl_mult': 0.9773515023218837, 'bull_time_stop': 143, 'bull_use_sma': True, 'bull_use_ema': True, 'bull_use_atr': True, 'bull_use_adx': False, 'bull_use_spike': True, 'bull_rsi_required': True, 'bear_strategy': 'mean_reversion', 'bear_bb_std_mult': 3.2809161670794005, 'bear_rsi_os': 24, 'bear_rsi_ob': 82, 'bear_adx_thresh': 7.061754263650086, 'bear_atr_min_pct': 0.0026082867028171548, 'bear_atr_max_pct': 0.015809668687948898, 'bear_tp_mult': 1.6000163337411963, 'bear_tsl_mult': 0.4365158698334042, 'bear_time_stop': 25, 'bear_use_sma': True, 'bear_use_ema': False, 'bear_use_atr': True, 'bear_use_adx': True, 'bear_use_spike': True, 'bear_rsi_required': True, 'sideways_strategy': 'mean_reversion', 'sideways_bb_std_mult': 1.0353478141580332, 'sideways_rsi_os': 14, 'sideways_rsi_ob': 56, 'sideways_adx_thresh': 19.578683528147838, 'sideways_atr_min_pct': 0.023962341116914674, 'sideways_atr_max_pct': 0.09017229029438428, 'sideways_tp_mult': 1.5700710521422938, 'sideways_tsl_mult': 0.5585864048114059, 'sideways_time_stop': 71, 'sideways_use_sma': True, 'sideways_use_ema': False, 'sideways_use_atr': True, 'sideways_use_adx': True, 'sideways_use_spike': True, 'sideways_rsi_required': True}.
[I 2025-08-30 15:05:45,221] Trial 360 finished with values: [-1000000000.0, 1000000000.0] and parameters: {'p_sma': 32, 'p_std': 28, 'p_atr': 17, 'p_adx': 24, 'rsi_period': 61, 'ema1': 10, 'ema2': 47, 'slip_atr_k': 0.014953082704235019, 'slip_spread_k': 0.7486796886811342, 'spread_hl_frac': 0.0011782497639089545, 'bb_std_mult': 1.5613754982771026, 'rsi_os': 6, 'rsi_ob': 92, 'vol_spike': 0.237086676103281, 'adx_thresh': 5.90562141902701, 'atr_min_pct': 0.005203287919973475, 'atr_max_pct': 0.09690212038643792, 'tp_mult': 1.3388286607095807, 'tsl_mult': 0.45792445239282514, 'strategy': 'breakout', 'time_stop': 105, 'use_sma': False, 'use_atr': False, 'use_adx': True, 'use_ema': False, 'use_spike': False, 'rsi_required': False, 'edge_k': 0.7581994812005701, 'edge_cap': 0.7927352144607889, 'bull_strategy': 'breakout', 'bull_bb_std_mult': 1.1776772596879148, 'bull_rsi_os': 53, 'bull_rsi_ob': 59, 'bull_adx_thresh': 33.15015124767602, 'bull_atr_min_pct': 0.020872541950237085, 'bull_atr_max_pct': 0.09266963120934077, 'bull_tp_mult': 2.639663270360976, 'bull_tsl_mult': 0.9473975642767538, 'bull_time_stop': 299, 'bull_use_sma': True, 'bull_use_ema': True, 'bull_use_atr': True, 'bull_use_adx': False, 'bull_use_spike': True, 'bull_rsi_required': False, 'bear_strategy': 'mean_reversion', 'bear_bb_std_mult': 3.1479596848595106, 'bear_rsi_os': 44, 'bear_rsi_ob': 51, 'bear_adx_thresh': 5.943839988333753, 'bear_atr_min_pct': 0.008046999030689854, 'bear_atr_max_pct': 0.07238480185490125, 'bear_tp_mult': 2.506109046384501, 'bear_tsl_mult': 0.07990589353596667, 'bear_time_stop': 209, 'bear_use_sma': True, 'bear_use_ema': False, 'bear_use_atr': True, 'bear_use_adx': True, 'bear_use_spike': True, 'bear_rsi_required': True, 'sideways_strategy': 'mean_reversion', 'sideways_bb_std_mult': 0.9495992775730631, 'sideways_rsi_os': 27, 'sideways_rsi_ob': 84, 'sideways_adx_thresh': 19.346410615642817, 'sideways_atr_min_pct': 0.007352082329496458, 'sideways_atr_max_pct': 0.14762820651250566, 'sideways_tp_mult': 1.8674959853732263, 'sideways_tsl_mult': 0.9791792466650096, 'sideways_time_stop': 95, 'sideways_use_sma': True, 'sideways_use_ema': False, 'sideways_use_atr': True, 'sideways_use_adx': True, 'sideways_use_spike': True, 'sideways_rsi_required': True}.
[I 2025-08-30 15:05:46,731] Trial 357 finished with values: [-0.015144561091419928, 0.01508320676286755] and parameters: {'p_sma': 55, 'p_std': 35, 'p_atr': 17, 'p_adx': 22, 'rsi_period': 60, 'ema1': 9, 'ema2': 47, 'slip_atr_k': 0.18639457358126793, 'slip_spread_k': 0.2801449101553169, 'spread_hl_frac': 0.001059929443799366, 'bb_std_mult': 2.94768905514481, 'rsi_os': 6, 'rsi_ob': 94, 'vol_spike': 0.23754224760040446, 'adx_thresh': 5.838892823499947, 'atr_min_pct': 0.011091206354725904, 'atr_max_pct': 0.10245014890758108, 'tp_mult': 2.4725491366459145, 'tsl_mult': 0.4298703451380665, 'strategy': 'breakout', 'time_stop': 263, 'use_sma': False, 'use_atr': False, 'use_adx': True, 'use_ema': False, 'use_spike': False, 'rsi_required': False, 'edge_k': 0.24328156116432864, 'edge_cap': 0.7018211538673291, 'bull_strategy': 'breakout', 'bull_bb_std_mult': 1.3461096888471404, 'bull_rsi_os': 18, 'bull_rsi_ob': 59, 'bull_adx_thresh': 31.066610462667192, 'bull_atr_min_pct': 0.0014714829583500127, 'bull_atr_max_pct': 0.08814603001477467, 'bull_tp_mult': 2.820038766138482, 'bull_tsl_mult': 0.9732684223876287, 'bull_time_stop': 14, 'bull_use_sma': True, 'bull_use_ema': True, 'bull_use_atr': True, 'bull_use_adx': False, 'bull_use_spike': True, 'bull_rsi_required': False, 'bear_strategy': 'mean_reversion', 'bear_bb_std_mult': 3.2803810358481464, 'bear_rsi_os': 11, 'bear_rsi_ob': 82, 'bear_adx_thresh': 23.39584054253914, 'bear_atr_min_pct': 0.022868444776515815, 'bear_atr_max_pct': 0.1177573993146859, 'bear_tp_mult': 2.9242122508884267, 'bear_tsl_mult': 0.07069084638396361, 'bear_time_stop': 28, 'bear_use_sma': True, 'bear_use_ema': False, 'bear_use_atr': True, 'bear_use_adx': True, 'bear_use_spike': True, 'bear_rsi_required': True, 'sideways_strategy': 'mean_reversion', 'sideways_bb_std_mult': 0.9418200695143675, 'sideways_rsi_os': 34, 'sideways_rsi_ob': 85, 'sideways_adx_thresh': 19.26922663764222, 'sideways_atr_min_pct': 0.02482660492290065, 'sideways_atr_max_pct': 0.14398206767428207, 'sideways_tp_mult': 2.558010561036576, 'sideways_tsl_mult': 0.9795490327521686, 'sideways_time_stop': 94, 'sideways_use_sma': True, 'sideways_use_ema': False, 'sideways_use_atr': True, 'sideways_use_adx': True, 'sideways_use_spike': True, 'sideways_rsi_required': True}.
[I 2025-08-30 15:05:46,871] Trial 359 finished with values: [-1000000000.0, 1000000000.0] and parameters: {'p_sma': 32, 'p_std': 25, 'p_atr': 17, 'p_adx': 24, 'rsi_period': 57, 'ema1': 26, 'ema2': 47, 'slip_atr_k': 0.16160766244046265, 'slip_spread_k': 0.27695649743495704, 'spread_hl_frac': 0.01920807368834699, 'bb_std_mult': 2.9808374518142906, 'rsi_os': 6, 'rsi_ob': 94, 'vol_spike': 0.23782569715825028, 'adx_thresh': 5.786588323291349, 'atr_min_pct': 0.02543874286930499, 'atr_max_pct': 0.09276824685414573, 'tp_mult': 2.4309846918253983, 'tsl_mult': 0.5289591296439384, 'strategy': 'breakout', 'time_stop': 262, 'use_sma': False, 'use_atr': False, 'use_adx': True, 'use_ema': False, 'use_spike': False, 'rsi_required': False, 'edge_k': 0.31590181862122013, 'edge_cap': 0.2193649302767648, 'bull_strategy': 'breakout', 'bull_bb_std_mult': 1.3061486745905952, 'bull_rsi_os': 25, 'bull_rsi_ob': 59, 'bull_adx_thresh': 7.793196873927357, 'bull_atr_min_pct': 0.025842861716352288, 'bull_atr_max_pct': 0.08735819360762542, 'bull_tp_mult': 2.7017610371517513, 'bull_tsl_mult': 0.00021312158255987201, 'bull_time_stop': 132, 'bull_use_sma': True, 'bull_use_ema': True, 'bull_use_atr': True, 'bull_use_adx': False, 'bull_use_spike': True, 'bull_rsi_required': False, 'bear_strategy': 'mean_reversion', 'bear_bb_std_mult': 3.117011716413776, 'bear_rsi_os': 43, 'bear_rsi_ob': 51, 'bear_adx_thresh': 23.4610421904766, 'bear_atr_min_pct': 0.02444468055941708, 'bear_atr_max_pct': 0.03919079212264343, 'bear_tp_mult': 2.9292499277294834, 'bear_tsl_mult': 0.3148205635384882, 'bear_time_stop': 246, 'bear_use_sma': True, 'bear_use_ema': False, 'bear_use_atr': True, 'bear_use_adx': True, 'bear_use_spike': True, 'bear_rsi_required': True, 'sideways_strategy': 'mean_reversion', 'sideways_bb_std_mult': 0.950484583465761, 'sideways_rsi_os': 34, 'sideways_rsi_ob': 55, 'sideways_adx_thresh': 19.061515660368297, 'sideways_atr_min_pct': 0.0055051098717716265, 'sideways_atr_max_pct': 0.10130126830417531, 'sideways_tp_mult': 2.4137437326122093, 'sideways_tsl_mult': 0.9760001326100456, 'sideways_time_stop': 27, 'sideways_use_sma': True, 'sideways_use_ema': False, 'sideways_use_atr': True, 'sideways_use_adx': True, 'sideways_use_spike': True, 'sideways_rsi_required': True}.
