[I 2025-08-30 14:41:21,222] Trial 174 finished with values: [-1000000000.0, 1000000000.0] and parameters: {'p_sma': 38, 'p_std': 6, 'p_atr': 15, 'p_adx': 29, 'rsi_period': 21, 'ema1': 26, 'ema2': 21, 'slip_atr_k': 0.24938913768079618, 'slip_spread_k': 0.5180697988185182, 'spread_hl_frac': 0.012461489895327475, 'bb_std_mult': 3.2902641598502718, 'rsi_os': 15, 'rsi_ob': 46, 'vol_spike': 0.07444119644162792, 'adx_thresh': 27.763551876904767, 'atr_min_pct': 0.02951245037381707, 'atr_max_pct': 0.04018049983635924, 'tp_mult': 2.119990949661758, 'tsl_mult': 0.11649152280915863, 'strategy': 'mean_reversion', 'time_stop': 119, 'use_sma': True, 'use_atr': True, 'use_adx': False, 'use_ema': False, 'use_spike': True, 'rsi_required': True, 'edge_k': 1.8456543938696937, 'edge_cap': 0.964715184746288, 'bull_strategy': 'mean_reversion', 'bull_bb_std_mult': 2.227405662639828, 'bull_rsi_os': 41, 'bull_rsi_ob': 82, 'bull_adx_thresh': 22.093989440861126, 'bull_atr_min_pct': 0.028601745246705133, 'bull_atr_max_pct': 0.025308025004265412, 'bull_tp_mult': 2.5815327324262816, 'bull_tsl_mult': 0.5871008121180015, 'bull_time_stop': 111, 'bull_use_sma': True, 'bull_use_ema': False, 'bull_use_atr': False, 'bull_use_adx': True, 'bull_use_spike': False, 'bull_rsi_required': False, 'bear_strategy': 'breakout', 'bear_bb_std_mult': 0.7416761447425538, 'bear_rsi_os': 21, 'bear_rsi_ob': 58, 'bear_adx_thresh': 34.21265807381945, 'bear_atr_min_pct': 0.011869338755557401, 'bear_atr_max_pct': 0.09465260444337217, 'bear_tp_mult': 1.957854634663055, 'bear_tsl_mult': 0.7444604850845695, 'bear_time_stop': 221, 'bear_use_sma': False, 'bear_use_ema': True, 'bear_use_atr': False, 'bear_use_adx': True, 'bear_use_spike': False, 'bear_rsi_required': True, 'sideways_strategy': 'breakout', 'sideways_bb_std_mult': 2.001006642718506, 'sideways_rsi_os': 52, 'sideways_rsi_ob': 66, 'sideways_adx_thresh': 24.698894949941675, 'sideways_atr_min_pct': 0.02298298625699958, 'sideways_atr_max_pct': 0.013601431338198683, 'sideways_tp_mult': 2.854178858074275, 'sideways_tsl_mult': 0.12680954215838555, 'sideways_time_stop': 217, 'sideways_use_sma': False, 'sideways_use_ema': True, 'sideways_use_atr': False, 'sideways_use_adx': False, 'sideways_use_spike': False, 'sideways_rsi_required': True}.
[I 2025-08-30 14:41:21,229] Trial 173 finished with values: [-1000000000.0, 1000000000.0] and parameters: {'p_sma': 16, 'p_std': 35, 'p_atr': 27, 'p_adx': 8, 'rsi_period': 23, 'ema1': 16, 'ema2': 13, 'slip_atr_k': 0.037362375594796896, 'slip_spread_k': 0.5248861750918673, 'spread_hl_frac': 0.04347594247757648, 'bb_std_mult': 1.6378291090026145, 'rsi_os': 54, 'rsi_ob': 72, 'vol_spike': 0.09943246955301645, 'adx_thresh': 27.497758783701524, 'atr_min_pct': 0.02188907183859407, 'atr_max_pct': 0.06509605967882637, 'tp_mult': 2.137543444102467, 'tsl_mult': 0.3408265802278869, 'strategy': 'mean_reversion', 'time_stop': 125, 'use_sma': True, 'use_atr': True, 'use_adx': False, 'use_ema': False, 'use_spike': True, 'rsi_required': True, 'edge_k': 0.33148274292756186, 'edge_cap': 0.49287538472354525, 'bull_strategy': 'mean_reversion', 'bull_bb_std_mult': 0.7081507423061473, 'bull_rsi_os': 41, 'bull_rsi_ob': 82, 'bull_adx_thresh': 13.083760247003331, 'bull_atr_min_pct': 0.02847199853829166, 'bull_atr_max_pct': 0.10600425157039459, 'bull_tp_mult': 1.4658829741879837, 'bull_tsl_mult': 0.5880217172506182, 'bull_time_stop': 96, 'bull_use_sma': False, 'bull_use_ema': True, 'bull_use_atr': False, 'bull_use_adx': False, 'bull_use_spike': False, 'bull_rsi_required': False, 'bear_strategy': 'breakout', 'bear_bb_std_mult': 0.7207650984870462, 'bear_rsi_os': 19, 'bear_rsi_ob': 79, 'bear_adx_thresh': 28.08547189600334, 'bear_atr_min_pct': 0.0100567238597371, 'bear_atr_max_pct': 0.14514608070203, 'bear_tp_mult': 1.3206921907164832, 'bear_tsl_mult': 0.8165705787286294, 'bear_time_stop': 128, 'bear_use_sma': False, 'bear_use_ema': True, 'bear_use_atr': False, 'bear_use_adx': True, 'bear_use_spike': False, 'bear_rsi_required': True, 'sideways_strategy': 'breakout', 'sideways_bb_std_mult': 1.87255655112513, 'sideways_rsi_os': 53, 'sideways_rsi_ob': 66, 'sideways_adx_thresh': 25.180074690530823, 'sideways_atr_min_pct': 0.022653982281326472, 'sideways_atr_max_pct': 0.08165703031768712, 'sideways_tp_mult': 1.8464323263095772, 'sideways_tsl_mult': 0.47711273543882016, 'sideways_time_stop': 300, 'sideways_use_sma': False, 'sideways_use_ema': True, 'sideways_use_atr': False, 'sideways_use_adx': False, 'sideways_use_spike': False, 'sideways_rsi_required': True}.
[I 2025-08-30 14:41:21,734] Trial 175 finished with values: [-1000000000.0, 1000000000.0] and parameters: {'p_sma': 39, 'p_std': 42, 'p_atr': 12, 'p_adx': 17, 'rsi_period': 23, 'ema1': 21, 'ema2': 13, 'slip_atr_k': 0.0787705323269149, 'slip_spread_k': 0.7524316926274539, 'spread_hl_frac': 0.04816845579867653, 'bb_std_mult': 3.394856631596733, 'rsi_os': 54, 'rsi_ob': 88, 'vol_spike': 0.16133814589167267, 'adx_thresh': 23.73954532673275, 'atr_min_pct': 0.029935513312240963, 'atr_max_pct': 0.03307241792141754, 'tp_mult': 2.108344170742785, 'tsl_mult': 0.07204674749913835, 'strategy': 'mean_reversion', 'time_stop': 287, 'use_sma': True, 'use_atr': True, 'use_adx': False, 'use_ema': True, 'use_spike': True, 'rsi_required': True, 'edge_k': 1.6633770322772525, 'edge_cap': 0.9992291293666445, 'bull_strategy': 'mean_reversion', 'bull_bb_std_mult': 1.702230069688897, 'bull_rsi_os': 42, 'bull_rsi_ob': 46, 'bull_adx_thresh': 13.85262751510336, 'bull_atr_min_pct': 0.024014562456338436, 'bull_atr_max_pct': 0.03446784846978598, 'bull_tp_mult': 2.717358897394618, 'bull_tsl_mult': 0.3519533182086387, 'bull_time_stop': 93, 'bull_use_sma': False, 'bull_use_ema': False, 'bull_use_atr': False, 'bull_use_adx': True, 'bull_use_spike': False, 'bull_rsi_required': False, 'bear_strategy': 'breakout', 'bear_bb_std_mult': 0.8269970922808105, 'bear_rsi_os': 43, 'bear_rsi_ob': 86, 'bear_adx_thresh': 30.4565373492606, 'bear_atr_min_pct': 0.010228754939999397, 'bear_atr_max_pct': 0.14479332497143668, 'bear_tp_mult': 2.103868919702717, 'bear_tsl_mult': 0.2067568556424113, 'bear_time_stop': 190, 'bear_use_sma': False, 'bear_use_ema': True, 'bear_use_atr': False, 'bear_use_adx': False, 'bear_use_spike': False, 'bear_rsi_required': False, 'sideways_strategy': 'breakout', 'sideways_bb_std_mult': 2.1909073673394786, 'sideways_rsi_os': 18, 'sideways_rsi_ob': 68, 'sideways_adx_thresh': 26.08603137727482, 'sideways_atr_min_pct': 0.018596186645503342, 'sideways_atr_max_pct': 0.139030199974059, 'sideways_tp_mult': 1.8513193229941025, 'sideways_tsl_mult': 0.39274790763623135, 'sideways_time_stop': 114, 'sideways_use_sma': False, 'sideways_use_ema': True, 'sideways_use_atr': False, 'sideways_use_adx': False, 'sideways_use_spike': False, 'sideways_rsi_required': False}.
[I 2025-08-30 14:41:49,160] Trial 172 finished with values: [-1000000000.0, 1000000000.0] and parameters: {'p_sma': 40, 'p_std': 22, 'p_atr': 15, 'p_adx': 29, 'rsi_period': 23, 'ema1': 26, 'ema2': 21, 'slip_atr_k': 0.1830945690005081, 'slip_spread_k': 0.5186146327380046, 'spread_hl_frac': 0.04825506519507564, 'bb_std_mult': 3.2769086074150984, 'rsi_os': 22, 'rsi_ob': 88, 'vol_spike': 0.07017272498975237, 'adx_thresh': 25.0972578805701, 'atr_min_pct': 0.029756095871482268, 'atr_max_pct': 0.06586874838921727, 'tp_mult': 2.2522175800806044, 'tsl_mult': 0.3070944086670647, 'strategy': 'mean_reversion', 'time_stop': 287, 'use_sma': True, 'use_atr': True, 'use_adx': False, 'use_ema': True, 'use_spike': True, 'rsi_required': True, 'edge_k': 1.6548038696215004, 'edge_cap': 0.9683718669204615, 'bull_strategy': 'mean_reversion', 'bull_bb_std_mult': 1.0287103479530249, 'bull_rsi_os': 43, 'bull_rsi_ob': 82, 'bull_adx_thresh': 22.093066450171527, 'bull_atr_min_pct': 0.02880253258943899, 'bull_atr_max_pct': 0.02470709566584353, 'bull_tp_mult': 1.1552770956762553, 'bull_tsl_mult': 0.384210799579296, 'bull_time_stop': 93, 'bull_use_sma': True, 'bull_use_ema': False, 'bull_use_atr': False, 'bull_use_adx': True, 'bull_use_spike': False, 'bull_rsi_required': False, 'bear_strategy': 'breakout', 'bear_bb_std_mult': 2.694431964636478, 'bear_rsi_os': 19, 'bear_rsi_ob': 71, 'bear_adx_thresh': 14.390977960295674, 'bear_atr_min_pct': 0.029242985290720162, 'bear_atr_max_pct': 0.1458967042781363, 'bear_tp_mult': 2.156868277934704, 'bear_tsl_mult': 0.08361693534680464, 'bear_time_stop': 156, 'bear_use_sma': False, 'bear_use_ema': True, 'bear_use_atr': False, 'bear_use_adx': True, 'bear_use_spike': False, 'bear_rsi_required': False, 'sideways_strategy': 'breakout', 'sideways_bb_std_mult': 1.8942161588214042, 'sideways_rsi_os': 53, 'sideways_rsi_ob': 66, 'sideways_adx_thresh': 24.777320020079383, 'sideways_atr_min_pct': 0.0229475538751423, 'sideways_atr_max_pct': 0.01357578902113555, 'sideways_tp_mult': 2.8652217085029528, 'sideways_tsl_mult': 0.4005141098965418, 'sideways_time_stop': 216, 'sideways_use_sma': False, 'sideways_use_ema': True, 'sideways_use_atr': False, 'sideways_use_adx': False, 'sideways_use_spike': False, 'sideways_rsi_required': False}.
[I 2025-08-30 14:41:50,591] Trial 171 finished with values: [-1000000000.0, 1000000000.0] and parameters: {'p_sma': 34, 'p_std': 49, 'p_atr': 27, 'p_adx': 8, 'rsi_period': 22, 'ema1': 21, 'ema2': 35, 'slip_atr_k': 0.06436198049491784, 'slip_spread_k': 0.521982629717866, 'spread_hl_frac': 0.004882189569485919, 'bb_std_mult': 1.6190383026423376, 'rsi_os': 53, 'rsi_ob': 88, 'vol_spike': 0.01105928770482413, 'adx_thresh': 19.905496372061204, 'atr_min_pct': 0.02376911054482085, 'atr_max_pct': 0.12708268266174483, 'tp_mult': 2.27387948468948, 'tsl_mult': 0.489526811310417, 'strategy': 'breakout', 'time_stop': 287, 'use_sma': True, 'use_atr': True, 'use_adx': False, 'use_ema': True, 'use_spike': True, 'rsi_required': True, 'edge_k': 1.632639478536336, 'edge_cap': 0.0751439780304719, 'bull_strategy': 'breakout', 'bull_bb_std_mult': 0.8755964717286692, 'bull_rsi_os': 41, 'bull_rsi_ob': 82, 'bull_adx_thresh': 21.742533020768846, 'bull_atr_min_pct': 0.004711519041311927, 'bull_atr_max_pct': 0.034119533958241736, 'bull_tp_mult': 1.1519701124997312, 'bull_tsl_mult': 0.5725160331802992, 'bull_time_stop': 29, 'bull_use_sma': False, 'bull_use_ema': True, 'bull_use_atr': True, 'bull_use_adx': False, 'bull_use_spike': False, 'bull_rsi_required': False, 'bear_strategy': 'mean_reversion', 'bear_bb_std_mult': 2.8951692434601277, 'bear_rsi_os': 19, 'bear_rsi_ob': 66, 'bear_adx_thresh': 15.542017181872893, 'bear_atr_min_pct': 0.012069313159462853, 'bear_atr_max_pct': 0.147249034370004, 'bear_tp_mult': 1.9328830111617128, 'bear_tsl_mult': 0.20084268257635762, 'bear_time_stop': 223, 'bear_use_sma': False, 'bear_use_ema': True, 'bear_use_atr': True, 'bear_use_adx': True, 'bear_use_spike': True, 'bear_rsi_required': False, 'sideways_strategy': 'breakout', 'sideways_bb_std_mult': 1.404744951390704, 'sideways_rsi_os': 40, 'sideways_rsi_ob': 65, 'sideways_adx_thresh': 25.07460848528822, 'sideways_atr_min_pct': 0.02263843635290836, 'sideways_atr_max_pct': 0.01387721351740902, 'sideways_tp_mult': 2.8640035829533703, 'sideways_tsl_mult': 0.3883438820073457, 'sideways_time_stop': 262, 'sideways_use_sma': False, 'sideways_use_ema': True, 'sideways_use_atr': True, 'sideways_use_adx': True, 'sideways_use_spike': False, 'sideways_rsi_required': False}.
[I 2025-08-30 14:41:52,120] Trial 176 finished with values: [-1000000000.0, 1000000000.0] and parameters: {'p_sma': 33, 'p_std': 6, 'p_atr': 12, 'p_adx': 7, 'rsi_period': 22, 'ema1': 7, 'ema2': 29, 'slip_atr_k': 0.06676476705339268, 'slip_spread_k': 0.149559028853625, 'spread_hl_frac': 0.03139507559827144, 'bb_std_mult': 1.9151580713161216, 'rsi_os': 5, 'rsi_ob': 82, 'vol_spike': 0.24379167534544716, 'adx_thresh': 23.81106623231019, 'atr_min_pct': 0.015568363805180107, 'atr_max_pct': 0.026347532279594518, 'tp_mult': 2.2769869798555775, 'tsl_mult': 0.8729215052727646, 'strategy': 'breakout', 'time_stop': 287, 'use_sma': True, 'use_atr': True, 'use_adx': False, 'use_ema': True, 'use_spike': True, 'rsi_required': True, 'edge_k': 1.7951690809900234, 'edge_cap': 0.3464785280276129, 'bull_strategy': 'mean_reversion', 'bull_bb_std_mult': 2.088693079934871, 'bull_rsi_os': 42, 'bull_rsi_ob': 46, 'bull_adx_thresh': 22.821346764421648, 'bull_atr_min_pct': 0.02429909308861443, 'bull_atr_max_pct': 0.047895625842419305, 'bull_tp_mult': 1.1384503513087036, 'bull_tsl_mult': 0.38587583410706255, 'bull_time_stop': 173, 'bull_use_sma': False, 'bull_use_ema': False, 'bull_use_atr': False, 'bull_use_adx': True, 'bull_use_spike': False, 'bull_rsi_required': False, 'bear_strategy': 'breakout', 'bear_bb_std_mult': 0.8341416776862729, 'bear_rsi_os': 43, 'bear_rsi_ob': 63, 'bear_adx_thresh': 30.448074807651757, 'bear_atr_min_pct': 0.011272600222961136, 'bear_atr_max_pct': 0.04693601465989554, 'bear_tp_mult': 2.9249778905299633, 'bear_tsl_mult': 0.6925095514646165, 'bear_time_stop': 86, 'bear_use_sma': False, 'bear_use_ema': False, 'bear_use_atr': True, 'bear_use_adx': False, 'bear_use_spike': False, 'bear_rsi_required': False, 'sideways_strategy': 'breakout', 'sideways_bb_std_mult': 1.9263105497110096, 'sideways_rsi_os': 48, 'sideways_rsi_ob': 62, 'sideways_adx_thresh': 26.017335202061147, 'sideways_atr_min_pct': 0.014708064211631226, 'sideways_atr_max_pct': 0.013306380295660253, 'sideways_tp_mult': 2.919782843594257, 'sideways_tsl_mult': 0.109161121574797, 'sideways_time_stop': 112, 'sideways_use_sma': False, 'sideways_use_ema': True, 'sideways_use_atr': True, 'sideways_use_adx': False, 'sideways_use_spike': False, 'sideways_rsi_required': False}.
[I 2025-08-30 14:41:53,053] Trial 177 finished with values: [-0.04110328979963418, 0.04109232303514458] and parameters: {'p_sma': 33, 'p_std': 8, 'p_atr': 17, 'p_adx': 7, 'rsi_period': 18, 'ema1': 14, 'ema2': 29, 'slip_atr_k': 0.15141607889396924, 'slip_spread_k': 0.5442606903925076, 'spread_hl_frac': 0.04827592849765755, 'bb_std_mult': 2.4774172553596694, 'rsi_os': 48, 'rsi_ob': 82, 'vol_spike': 0.2904216378669232, 'adx_thresh': 28.497677510171595, 'atr_min_pct': 0.019985624821628266, 'atr_max_pct': 0.08860979669123206, 'tp_mult': 2.0327315442221434, 'tsl_mult': 0.6960848602550451, 'strategy': 'breakout', 'time_stop': 66, 'use_sma': True, 'use_atr': True, 'use_adx': True, 'use_ema': True, 'use_spike': True, 'rsi_required': False, 'edge_k': 1.4422179059965186, 'edge_cap': 0.41042084128108425, 'bull_strategy': 'mean_reversion', 'bull_bb_std_mult': 1.050120170700896, 'bull_rsi_os': 43, 'bull_rsi_ob': 80, 'bull_adx_thresh': 17.04836593449528, 'bull_atr_min_pct': 0.0006861659366880516, 'bull_atr_max_pct': 0.012972401501503967, 'bull_tp_mult': 1.1701210579379167, 'bull_tsl_mult': 0.3859925166519901, 'bull_time_stop': 242, 'bull_use_sma': True, 'bull_use_ema': False, 'bull_use_atr': False, 'bull_use_adx': True, 'bull_use_spike': False, 'bull_rsi_required': True, 'bear_strategy': 'breakout', 'bear_bb_std_mult': 0.6532297057810823, 'bear_rsi_os': 20, 'bear_rsi_ob': 60, 'bear_adx_thresh': 28.955119829912324, 'bear_atr_min_pct': 0.011193587821785634, 'bear_atr_max_pct': 0.06471876961314882, 'bear_tp_mult': 1.9063968798436248, 'bear_tsl_mult': 0.7855154748352422, 'bear_time_stop': 157, 'bear_use_sma': False, 'bear_use_ema': False, 'bear_use_atr': True, 'bear_use_adx': False, 'bear_use_spike': False, 'bear_rsi_required': False, 'sideways_strategy': 'breakout', 'sideways_bb_std_mult': 2.726599016377178, 'sideways_rsi_os': 47, 'sideways_rsi_ob': 61, 'sideways_adx_thresh': 23.52226798697032, 'sideways_atr_min_pct': 0.026915666268356286, 'sideways_atr_max_pct': 0.09738498400966797, 'sideways_tp_mult': 2.8801388920744295, 'sideways_tsl_mult': 0.1213622267623191, 'sideways_time_stop': 291, 'sideways_use_sma': False, 'sideways_use_ema': True, 'sideways_use_atr': True, 'sideways_use_adx': False, 'sideways_use_spike': False, 'sideways_rsi_required': False}.
[I 2025-08-30 14:42:24,052] Trial 179 finished with values: [-0.018745748393802053, 0.018680589346608018] and parameters: {'p_sma': 57, 'p_std': 14, 'p_atr': 17, 'p_adx': 23, 'rsi_period': 77, 'ema1': 28, 'ema2': 29, 'slip_atr_k': 0.07187103989823158, 'slip_spread_k': 0.16484998510665827, 'spread_hl_frac': 0.0468326605027727, 'bb_std_mult': 3.5661556344315324, 'rsi_os': 19, 'rsi_ob': 65, 'vol_spike': 0.13017391423124164, 'adx_thresh': 24.4099839739507, 'atr_min_pct': 0.028062872800767816, 'atr_max_pct': 0.057550588649821474, 'tp_mult': 2.0505486451383814, 'tsl_mult': 0.7619885419375697, 'strategy': 'breakout', 'time_stop': 133, 'use_sma': True, 'use_atr': True, 'use_adx': True, 'use_ema': True, 'use_spike': True, 'rsi_required': False, 'edge_k': 1.8150966346682444, 'edge_cap': 0.3774350158814279, 'bull_strategy': 'mean_reversion', 'bull_bb_std_mult': 2.0679995318124473, 'bull_rsi_os': 39, 'bull_rsi_ob': 80, 'bull_adx_thresh': 7.032960634857339, 'bull_atr_min_pct': 0.0007316307919743329, 'bull_atr_max_pct': 0.13766053521979754, 'bull_tp_mult': 2.2730949117620782, 'bull_tsl_mult': 0.2888334984843786, 'bull_time_stop': 200, 'bull_use_sma': False, 'bull_use_ema': False, 'bull_use_atr': False, 'bull_use_adx': True, 'bull_use_spike': False, 'bull_rsi_required': True, 'bear_strategy': 'breakout', 'bear_bb_std_mult': 0.937200567742467, 'bear_rsi_os': 6, 'bear_rsi_ob': 64, 'bear_adx_thresh': 33.63539249894622, 'bear_atr_min_pct': 0.011207853346721338, 'bear_atr_max_pct': 0.13755906538735835, 'bear_tp_mult': 1.8928429451355424, 'bear_tsl_mult': 0.2624260971104413, 'bear_time_stop': 231, 'bear_use_sma': False, 'bear_use_ema': False, 'bear_use_atr': False, 'bear_use_adx': False, 'bear_use_spike': False, 'bear_rsi_required': False, 'sideways_strategy': 'breakout', 'sideways_bb_std_mult': 1.949485590650094, 'sideways_rsi_os': 47, 'sideways_rsi_ob': 63, 'sideways_adx_thresh': 23.544858162071158, 'sideways_atr_min_pct': 0.014707065699257525, 'sideways_atr_max_pct': 0.01752486853158206, 'sideways_tp_mult': 1.0743935911674174, 'sideways_tsl_mult': 0.3547852602511202, 'sideways_time_stop': 167, 'sideways_use_sma': False, 'sideways_use_ema': True, 'sideways_use_atr': True, 'sideways_use_adx': False, 'sideways_use_spike': False, 'sideways_rsi_required': False}.
[I 2025-08-30 14:42:24,323] Trial 178 finished with values: [-1000000000.0, 1000000000.0] and parameters: {'p_sma': 5, 'p_std': 5, 'p_atr': 17, 'p_adx': 7, 'rsi_period': 18, 'ema1': 14, 'ema2': 29, 'slip_atr_k': 0.15734670683651406, 'slip_spread_k': 0.49642600468190073, 'spread_hl_frac': 0.0463436037048448, 'bb_std_mult': 3.5949624300609306, 'rsi_os': 48, 'rsi_ob': 65, 'vol_spike': 0.13015738578877004, 'adx_thresh': 19.630713521894748, 'atr_min_pct': 0.023462260145496742, 'atr_max_pct': 0.059098854887842944, 'tp_mult': 2.0271504812468315, 'tsl_mult': 0.11897150968031833, 'strategy': 'breakout', 'time_stop': 5, 'use_sma': True, 'use_atr': True, 'use_adx': True, 'use_ema': True, 'use_spike': True, 'rsi_required': False, 'edge_k': 1.8155325218156295, 'edge_cap': 0.3872062963022989, 'bull_strategy': 'mean_reversion', 'bull_bb_std_mult': 0.5784452074921902, 'bull_rsi_os': 39, 'bull_rsi_ob': 80, 'bull_adx_thresh': 17.143909936877147, 'bull_atr_min_pct': 0.017798326699110183, 'bull_atr_max_pct': 0.04758787675539462, 'bull_tp_mult': 2.3910886140547674, 'bull_tsl_mult': 0.28867295466295584, 'bull_time_stop': 224, 'bull_use_sma': False, 'bull_use_ema': False, 'bull_use_atr': False, 'bull_use_adx': True, 'bull_use_spike': False, 'bull_rsi_required': True, 'bear_strategy': 'breakout', 'bear_bb_std_mult': 0.9505503598237861, 'bear_rsi_os': 37, 'bear_rsi_ob': 53, 'bear_adx_thresh': 33.59692682531927, 'bear_atr_min_pct': 0.01124058319484255, 'bear_atr_max_pct': 0.13795330066943082, 'bear_tp_mult': 2.9363715644825104, 'bear_tsl_mult': 0.06488688385956942, 'bear_time_stop': 103, 'bear_use_sma': False, 'bear_use_ema': False, 'bear_use_atr': True, 'bear_use_adx': False, 'bear_use_spike': False, 'bear_rsi_required': False, 'sideways_strategy': 'breakout', 'sideways_bb_std_mult': 0.8800530354879148, 'sideways_rsi_os': 47, 'sideways_rsi_ob': 61, 'sideways_adx_thresh': 23.448308146170273, 'sideways_atr_min_pct': 0.004193491976404798, 'sideways_atr_max_pct': 0.01735714811676079, 'sideways_tp_mult': 1.0767602873175617, 'sideways_tsl_mult': 0.9611530009389673, 'sideways_time_stop': 263, 'sideways_use_sma': False, 'sideways_use_ema': True, 'sideways_use_atr': True, 'sideways_use_adx': False, 'sideways_use_spike': False, 'sideways_rsi_required': False}.
