[I 2025-08-30 16:32:06,156] Trial 794 finished with values: [-1000000000.0, 1000000000.0] and parameters: {'p_sma': 7, 'p_std': 24, 'p_atr': 28, 'p_adx': 24, 'rsi_period': 9, 'ema1': 17, 'ema2': 40, 'slip_atr_k': 0.005457793528582256, 'slip_spread_k': 0.6752594607098781, 'spread_hl_frac': 0.014977886096503433, 'bb_std_mult': 0.618091710046817, 'rsi_os': 25, 'rsi_ob': 59, 'vol_spike': 0.19104274195903745, 'adx_thresh': 10.649177668012474, 'atr_min_pct': 0.028289607043308483, 'atr_max_pct': 0.01766886145468617, 'tp_mult': 2.5510319425113757, 'tsl_mult': 0.6081199179878759, 'strategy': 'breakout', 'time_stop': 163, 'use_sma': False, 'use_atr': True, 'use_adx': False, 'use_ema': False, 'use_spike': True, 'rsi_required': False, 'edge_k': 0.5045347201286323, 'edge_cap': 0.9195674424078977, 'bull_strategy': 'breakout', 'bull_bb_std_mult': 1.5147685148201602, 'bull_rsi_os': 21, 'bull_rsi_ob': 87, 'bull_adx_thresh': 9.659528110558705, 'bull_atr_min_pct': 0.020697161769063, 'bull_atr_max_pct': 0.10031623458667802, 'bull_tp_mult': 2.065972948964667, 'bull_tsl_mult': 0.8484162193852812, 'bull_time_stop': 60, 'bull_use_sma': True, 'bull_use_ema': True, 'bull_use_atr': True, 'bull_use_adx': True, 'bull_use_spike': True, 'bull_rsi_required': True, 'bear_strategy': 'mean_reversion', 'bear_bb_std_mult': 2.1338343441254763, 'bear_rsi_os': 28, 'bear_rsi_ob': 79, 'bear_adx_thresh': 15.784866387477148, 'bear_atr_min_pct': 0.014714100628977668, 'bear_atr_max_pct': 0.04027893262658407, 'bear_tp_mult': 2.733499174662565, 'bear_tsl_mult': 0.8536152628537389, 'bear_time_stop': 73, 'bear_use_sma': True, 'bear_use_ema': False, 'bear_use_atr': False, 'bear_use_adx': True, 'bear_use_spike': True, 'bear_rsi_required': True, 'sideways_strategy': 'breakout', 'sideways_bb_std_mult': 3.1239027945776416, 'sideways_rsi_os': 8, 'sideways_rsi_ob': 81, 'sideways_adx_thresh': 30.88663195236552, 'sideways_atr_min_pct': 0.019014431977428782, 'sideways_atr_max_pct': 0.07118760903539482, 'sideways_tp_mult': 1.5239505346212838, 'sideways_tsl_mult': 0.8215414603924687, 'sideways_time_stop': 175, 'sideways_use_sma': False, 'sideways_use_ema': True, 'sideways_use_atr': True, 'sideways_use_adx': False, 'sideways_use_spike': True, 'sideways_rsi_required': False}.
[I 2025-08-30 16:32:49,221] Trial 795 finished with values: [-1000000000.0, 1000000000.0] and parameters: {'p_sma': 7, 'p_std': 24, 'p_atr': 15, 'p_adx': 26, 'rsi_period': 13, 'ema1': 25, 'ema2': 16, 'slip_atr_k': 0.10310428004025948, 'slip_spread_k': 0.6772713279334291, 'spread_hl_frac': 0.03481914086572834, 'bb_std_mult': 0.634557915389383, 'rsi_os': 17, 'rsi_ob': 85, 'vol_spike': 0.2247079169322933, 'adx_thresh': 10.39638642437391, 'atr_min_pct': 0.007265335660721819, 'atr_max_pct': 0.049120574493514355, 'tp_mult': 1.0132548990736512, 'tsl_mult': 0.34974178888976026, 'strategy': 'mean_reversion', 'time_stop': 88, 'use_sma': False, 'use_atr': True, 'use_adx': False, 'use_ema': True, 'use_spike': True, 'rsi_required': False, 'edge_k': 1.5037595640878418, 'edge_cap': 0.5919935675953358, 'bull_strategy': 'mean_reversion', 'bull_bb_std_mult': 1.514365453788674, 'bull_rsi_os': 48, 'bull_rsi_ob': 57, 'bull_adx_thresh': 21.93971939582925, 'bull_atr_min_pct': 0.02480141201534401, 'bull_atr_max_pct': 0.10007122529448094, 'bull_tp_mult': 1.4486795967397077, 'bull_tsl_mult': 0.844558724743093, 'bull_time_stop': 60, 'bull_use_sma': False, 'bull_use_ema': True, 'bull_use_atr': False, 'bull_use_adx': True, 'bull_use_spike': True, 'bull_rsi_required': True, 'bear_strategy': 'breakout', 'bear_bb_std_mult': 2.1303941997710734, 'bear_rsi_os': 18, 'bear_rsi_ob': 65, 'bear_adx_thresh': 28.399681572905635, 'bear_atr_min_pct': 0.007835385471066067, 'bear_atr_max_pct': 0.11178139031265065, 'bear_tp_mult': 2.733379362244907, 'bear_tsl_mult': 0.36900279090955773, 'bear_time_stop': 65, 'bear_use_sma': False, 'bear_use_ema': False, 'bear_use_atr': False, 'bear_use_adx': True, 'bear_use_spike': False, 'bear_rsi_required': True, 'sideways_strategy': 'breakout', 'sideways_bb_std_mult': 3.1282918540228, 'sideways_rsi_os': 7, 'sideways_rsi_ob': 87, 'sideways_adx_thresh': 10.63401229200207, 'sideways_atr_min_pct': 0.01913265229133329, 'sideways_atr_max_pct': 0.07346947197678733, 'sideways_tp_mult': 1.423577938594792, 'sideways_tsl_mult': 0.368268274533226, 'sideways_time_stop': 125, 'sideways_use_sma': False, 'sideways_use_ema': True, 'sideways_use_atr': True, 'sideways_use_adx': False, 'sideways_use_spike': False, 'sideways_rsi_required': False}.
[I 2025-08-30 16:32:49,892] Trial 792 finished with values: [-1000000000.0, 1000000000.0] and parameters: {'p_sma': 8, 'p_std': 9, 'p_atr': 12, 'p_adx': 27, 'rsi_period': 9, 'ema1': 22, 'ema2': 54, 'slip_atr_k': 0.017116044361466742, 'slip_spread_k': 0.9966210284211928, 'spread_hl_frac': 0.039373860454003526, 'bb_std_mult': 0.6448950321082625, 'rsi_os': 33, 'rsi_ob': 86, 'vol_spike': 0.20417699980440224, 'adx_thresh': 10.53171663240562, 'atr_min_pct': 0.00719269820674488, 'atr_max_pct': 0.07165881247931982, 'tp_mult': 1.5180729689688928, 'tsl_mult': 0.3323705277524943, 'strategy': 'breakout', 'time_stop': 165, 'use_sma': False, 'use_atr': False, 'use_adx': True, 'use_ema': False, 'use_spike': False, 'rsi_required': False, 'edge_k': 1.4796323322608822, 'edge_cap': 0.9510671773597263, 'bull_strategy': 'breakout', 'bull_bb_std_mult': 1.5502991728881648, 'bull_rsi_os': 32, 'bull_rsi_ob': 52, 'bull_adx_thresh': 9.737579838974824, 'bull_atr_min_pct': 0.02757763314488633, 'bull_atr_max_pct': 0.10237643746698376, 'bull_tp_mult': 1.5991856306608714, 'bull_tsl_mult': 0.8209270738375316, 'bull_time_stop': 49, 'bull_use_sma': True, 'bull_use_ema': True, 'bull_use_atr': True, 'bull_use_adx': True, 'bull_use_spike': True, 'bull_rsi_required': False, 'bear_strategy': 'mean_reversion', 'bear_bb_std_mult': 1.7308576127368713, 'bear_rsi_os': 21, 'bear_rsi_ob': 79, 'bear_adx_thresh': 18.593142726862016, 'bear_atr_min_pct': 0.0032493560229510934, 'bear_atr_max_pct': 0.11151620069428902, 'bear_tp_mult': 2.727486209055244, 'bear_tsl_mult': 0.8791949511801358, 'bear_time_stop': 126, 'bear_use_sma': True, 'bear_use_ema': False, 'bear_use_atr': True, 'bear_use_adx': True, 'bear_use_spike': True, 'bear_rsi_required': True, 'sideways_strategy': 'mean_reversion', 'sideways_bb_std_mult': 1.285588534826776, 'sideways_rsi_os': 34, 'sideways_rsi_ob': 81, 'sideways_adx_thresh': 30.7350055742047, 'sideways_atr_min_pct': 0.01914556065419745, 'sideways_atr_max_pct': 0.07107891698948919, 'sideways_tp_mult': 1.535590247507445, 'sideways_tsl_mult': 0.36942118905814236, 'sideways_time_stop': 36, 'sideways_use_sma': True, 'sideways_use_ema': True, 'sideways_use_atr': True, 'sideways_use_adx': True, 'sideways_use_spike': True, 'sideways_rsi_required': True}.
[I 2025-08-30 16:32:50,471] Trial 793 finished with values: [-1000000000.0, 1000000000.0] and parameters: {'p_sma': 47, 'p_std': 47, 'p_atr': 15, 'p_adx': 24, 'rsi_period': 44, 'ema1': 25, 'ema2': 39, 'slip_atr_k': 0.016770068822523403, 'slip_spread_k': 0.919759628060107, 'spread_hl_frac': 0.008173713613412193, 'bb_std_mult': 2.038130238687562, 'rsi_os': 40, 'rsi_ob': 85, 'vol_spike': 0.018873969520461387, 'adx_thresh': 16.688886344292452, 'atr_min_pct': 0.006766511902470057, 'atr_max_pct': 0.11736473066579584, 'tp_mult': 1.5301611374116002, 'tsl_mult': 0.3935427565351428, 'strategy': 'breakout', 'time_stop': 166, 'use_sma': False, 'use_atr': False, 'use_adx': False, 'use_ema': False, 'use_spike': False, 'rsi_required': False, 'edge_k': 1.5108446040921872, 'edge_cap': 0.9301028022169483, 'bull_strategy': 'breakout', 'bull_bb_std_mult': 1.7835844561113876, 'bull_rsi_os': 47, 'bull_rsi_ob': 90, 'bull_adx_thresh': 22.338035676264937, 'bull_atr_min_pct': 0.025922851860096054, 'bull_atr_max_pct': 0.10068973714549898, 'bull_tp_mult': 2.813703789384701, 'bull_tsl_mult': 0.7540440948783016, 'bull_time_stop': 49, 'bull_use_sma': True, 'bull_use_ema': True, 'bull_use_atr': True, 'bull_use_adx': True, 'bull_use_spike': True, 'bull_rsi_required': True, 'bear_strategy': 'mean_reversion', 'bear_bb_std_mult': 2.1249355491002837, 'bear_rsi_os': 28, 'bear_rsi_ob': 71, 'bear_adx_thresh': 8.37645725348683, 'bear_atr_min_pct': 0.003185012687923327, 'bear_atr_max_pct': 0.11083632611392155, 'bear_tp_mult': 1.3754691824571519, 'bear_tsl_mult': 0.366784849744735, 'bear_time_stop': 124, 'bear_use_sma': True, 'bear_use_ema': False, 'bear_use_atr': True, 'bear_use_adx': True, 'bear_use_spike': True, 'bear_rsi_required': True, 'sideways_strategy': 'breakout', 'sideways_bb_std_mult': 3.4562615237313823, 'sideways_rsi_os': 14, 'sideways_rsi_ob': 87, 'sideways_adx_thresh': 31.033868265412025, 'sideways_atr_min_pct': 0.019225434161091556, 'sideways_atr_max_pct': 0.127754798545285, 'sideways_tp_mult': 1.9948438424226909, 'sideways_tsl_mult': 0.8222639677963299, 'sideways_time_stop': 172, 'sideways_use_sma': False, 'sideways_use_ema': True, 'sideways_use_atr': True, 'sideways_use_adx': True, 'sideways_use_spike': True, 'sideways_rsi_required': True}.
[I 2025-08-30 16:32:51,689] Trial 796 finished with values: [-1000000000.0, 1000000000.0] and parameters: {'p_sma': 47, 'p_std': 39, 'p_atr': 19, 'p_adx': 26, 'rsi_period': 17, 'ema1': 25, 'ema2': 35, 'slip_atr_k': 0.1972929588765902, 'slip_spread_k': 0.8057409966588301, 'spread_hl_frac': 0.03747075594733939, 'bb_std_mult': 2.1667749913741203, 'rsi_os': 26, 'rsi_ob': 86, 'vol_spike': 0.22539551164127503, 'adx_thresh': 7.656622957538773, 'atr_min_pct': 0.009054338075906252, 'atr_max_pct': 0.07284227912845742, 'tp_mult': 1.5398868289402314, 'tsl_mult': 0.3946223756670191, 'strategy': 'mean_reversion', 'time_stop': 183, 'use_sma': False, 'use_atr': False, 'use_adx': True, 'use_ema': True, 'use_spike': False, 'rsi_required': False, 'edge_k': 0.5600524925849226, 'edge_cap': 0.3183734817291195, 'bull_strategy': 'mean_reversion', 'bull_bb_std_mult': 1.759673541812417, 'bull_rsi_os': 50, 'bull_rsi_ob': 86, 'bull_adx_thresh': 9.885320324324377, 'bull_atr_min_pct': 0.01838360784479218, 'bull_atr_max_pct': 0.0935652837323989, 'bull_tp_mult': 2.331563281021605, 'bull_tsl_mult': 0.7574566149733478, 'bull_time_stop': 66, 'bull_use_sma': False, 'bull_use_ema': True, 'bull_use_atr': False, 'bull_use_adx': True, 'bull_use_spike': True, 'bull_rsi_required': True, 'bear_strategy': 'breakout', 'bear_bb_std_mult': 2.3437062228851775, 'bear_rsi_os': 18, 'bear_rsi_ob': 72, 'bear_adx_thresh': 18.914984397711567, 'bear_atr_min_pct': 0.0010230738189620598, 'bear_atr_max_pct': 0.11228229296425507, 'bear_tp_mult': 1.312097378712034, 'bear_tsl_mult': 0.9494047412316513, 'bear_time_stop': 84, 'bear_use_sma': False, 'bear_use_ema': False, 'bear_use_atr': True, 'bear_use_adx': True, 'bear_use_spike': False, 'bear_rsi_required': False, 'sideways_strategy': 'breakout', 'sideways_bb_std_mult': 2.153723173552088, 'sideways_rsi_os': 34, 'sideways_rsi_ob': 80, 'sideways_adx_thresh': 10.47770447608346, 'sideways_atr_min_pct': 0.01997402542013275, 'sideways_atr_max_pct': 0.025909137297230177, 'sideways_tp_mult': 2.0197161793224816, 'sideways_tsl_mult': 0.3710623251016177, 'sideways_time_stop': 259, 'sideways_use_sma': True, 'sideways_use_ema': True, 'sideways_use_atr': True, 'sideways_use_adx': True, 'sideways_use_spike': False, 'sideways_rsi_required': True}.
[I 2025-08-30 16:33:33,755] Trial 799 finished with values: [-1000000000.0, 1000000000.0] and parameters: {'p_sma': 6, 'p_std': 21, 'p_atr': 13, 'p_adx': 26, 'rsi_period': 59, 'ema1': 26, 'ema2': 35, 'slip_atr_k': 0.13015974346406747, 'slip_spread_k': 0.44811140667036653, 'spread_hl_frac': 0.037736565767107697, 'bb_std_mult': 0.6850204876160564, 'rsi_os': 27, 'rsi_ob': 87, 'vol_spike': 0.22953392118022634, 'adx_thresh': 7.611181443038337, 'atr_min_pct': 0.025654821742907348, 'atr_max_pct': 0.12524789602170874, 'tp_mult': 1.6051279554015394, 'tsl_mult': 0.3511038606018097, 'strategy': 'mean_reversion', 'time_stop': 180, 'use_sma': True, 'use_atr': False, 'use_adx': True, 'use_ema': True, 'use_spike': False, 'rsi_required': True, 'edge_k': 0.5669728349117502, 'edge_cap': 0.3977426778271927, 'bull_strategy': 'mean_reversion', 'bull_bb_std_mult': 1.7287022599438222, 'bull_rsi_os': 50, 'bull_rsi_ob': 86, 'bull_adx_thresh': 10.703467946111061, 'bull_atr_min_pct': 0.02161918139758733, 'bull_atr_max_pct': 0.10724041455560686, 'bull_tp_mult': 2.6776249632066684, 'bull_tsl_mult': 0.9075584911555992, 'bull_time_stop': 74, 'bull_use_sma': False, 'bull_use_ema': False, 'bull_use_atr': False, 'bull_use_adx': False, 'bull_use_spike': True, 'bull_rsi_required': False, 'bear_strategy': 'breakout', 'bear_bb_std_mult': 1.676913676763728, 'bear_rsi_os': 9, 'bear_rsi_ob': 46, 'bear_adx_thresh': 13.897033171084075, 'bear_atr_min_pct': 0.0012788953494385074, 'bear_atr_max_pct': 0.09767004234053332, 'bear_tp_mult': 1.2100704708981893, 'bear_tsl_mult': 0.9098839245138328, 'bear_time_stop': 85, 'bear_use_sma': False, 'bear_use_ema': True, 'bear_use_atr': True, 'bear_use_adx': False, 'bear_use_spike': False, 'bear_rsi_required': False, 'sideways_strategy': 'mean_reversion', 'sideways_bb_std_mult': 3.1893419293079632, 'sideways_rsi_os': 44, 'sideways_rsi_ob': 78, 'sideways_adx_thresh': 11.023678927538345, 'sideways_atr_min_pct': 0.02034975105299282, 'sideways_atr_max_pct': 0.06161712968454062, 'sideways_tp_mult': 1.2273243642467426, 'sideways_tsl_mult': 0.8734351457918981, 'sideways_time_stop': 259, 'sideways_use_sma': True, 'sideways_use_ema': False, 'sideways_use_atr': False, 'sideways_use_adx': True, 'sideways_use_spike': False, 'sideways_rsi_required': True}.
[I 2025-08-30 16:33:36,150] Trial 800 finished with values: [-1000000000.0, 1000000000.0] and parameters: {'p_sma': 10, 'p_std': 54, 'p_atr': 13, 'p_adx': 14, 'rsi_period': 13, 'ema1': 24, 'ema2': 28, 'slip_atr_k': 0.004412650067321582, 'slip_spread_k': 0.44286561116688405, 'spread_hl_frac': 0.004244694292663432, 'bb_std_mult': 0.5658077626292639, 'rsi_os': 27, 'rsi_ob': 81, 'vol_spike': 0.15135778468257036, 'adx_thresh': 24.574378149758875, 'atr_min_pct': 0.013211922310825741, 'atr_max_pct': 0.12399182724991718, 'tp_mult': 1.607128603148252, 'tsl_mult': 0.11669583240660164, 'strategy': 'breakout', 'time_stop': 154, 'use_sma': True, 'use_atr': False, 'use_adx': True, 'use_ema': False, 'use_spike': False, 'rsi_required': True, 'edge_k': 0.6432374184316442, 'edge_cap': 0.17889388933126704, 'bull_strategy': 'breakout', 'bull_bb_std_mult': 1.6366525292090777, 'bull_rsi_os': 52, 'bull_rsi_ob': 87, 'bull_adx_thresh': 10.80123041806835, 'bull_atr_min_pct': 0.004879801330352335, 'bull_atr_max_pct': 0.10759768569755615, 'bull_tp_mult': 2.378651597621931, 'bull_tsl_mult': 0.8627804671624165, 'bull_time_stop': 170, 'bull_use_sma': True, 'bull_use_ema': False, 'bull_use_atr': True, 'bull_use_adx': False, 'bull_use_spike': True, 'bull_rsi_required': False, 'bear_strategy': 'mean_reversion', 'bear_bb_std_mult': 1.774619523609851, 'bear_rsi_os': 9, 'bear_rsi_ob': 74, 'bear_adx_thresh': 16.64775047866167, 'bear_atr_min_pct': 3.0188390176595897e-05, 'bear_atr_max_pct': 0.11705046591124191, 'bear_tp_mult': 2.6928243091688677, 'bear_tsl_mult': 0.8527437375413262, 'bear_time_stop': 103, 'bear_use_sma': True, 'bear_use_ema': True, 'bear_use_atr': True, 'bear_use_adx': False, 'bear_use_spike': True, 'bear_rsi_required': False, 'sideways_strategy': 'mean_reversion', 'sideways_bb_std_mult': 3.2239386959916567, 'sideways_rsi_os': 29, 'sideways_rsi_ob': 78, 'sideways_adx_thresh': 14.674151711430625, 'sideways_atr_min_pct': 0.021314283059570262, 'sideways_atr_max_pct': 0.019609623974193836, 'sideways_tp_mult': 1.2260140043217735, 'sideways_tsl_mult': 0.8517689378712736, 'sideways_time_stop': 139, 'sideways_use_sma': True, 'sideways_use_ema': False, 'sideways_use_atr': False, 'sideways_use_adx': True, 'sideways_use_spike': True, 'sideways_rsi_required': True}.
[I 2025-08-30 16:33:36,854] Trial 798 finished with values: [-1000000000.0, 1000000000.0] and parameters: {'p_sma': 48, 'p_std': 21, 'p_atr': 23, 'p_adx': 17, 'rsi_period': 12, 'ema1': 26, 'ema2': 28, 'slip_atr_k': 0.1317076853596381, 'slip_spread_k': 0.5446356321567546, 'spread_hl_frac': 0.029102743484653307, 'bb_std_mult': 2.1292015469798344, 'rsi_os': 27, 'rsi_ob': 85, 'vol_spike': 0.23128663239203873, 'adx_thresh': 7.660604882727986, 'atr_min_pct': 0.025525321661134366, 'atr_max_pct': 0.11068680077118476, 'tp_mult': 1.601743583935022, 'tsl_mult': 0.7500056638997252, 'strategy': 'mean_reversion', 'time_stop': 154, 'use_sma': True, 'use_atr': False, 'use_adx': True, 'use_ema': False, 'use_spike': False, 'rsi_required': False, 'edge_k': 0.5680481198108008, 'edge_cap': 0.31905677625000894, 'bull_strategy': 'breakout', 'bull_bb_std_mult': 1.6912443431718416, 'bull_rsi_os': 52, 'bull_rsi_ob': 86, 'bull_adx_thresh': 14.01292391314491, 'bull_atr_min_pct': 0.0077700862814069965, 'bull_atr_max_pct': 0.10658040403407001, 'bull_tp_mult': 2.6203807186967496, 'bull_tsl_mult': 0.7754419097646956, 'bull_time_stop': 66, 'bull_use_sma': False, 'bull_use_ema': False, 'bull_use_atr': True, 'bull_use_adx': False, 'bull_use_spike': True, 'bull_rsi_required': False, 'bear_strategy': 'mean_reversion', 'bear_bb_std_mult': 1.148381411110456, 'bear_rsi_os': 25, 'bear_rsi_ob': 71, 'bear_adx_thresh': 13.950688885771651, 'bear_atr_min_pct': 0.024804724408601642, 'bear_atr_max_pct': 0.10826635591663872, 'bear_tp_mult': 1.3806827586646566, 'bear_tsl_mult': 0.9086885664111808, 'bear_time_stop': 84, 'bear_use_sma': True, 'bear_use_ema': True, 'bear_use_atr': True, 'bear_use_adx': False, 'bear_use_spike': True, 'bear_rsi_required': False, 'sideways_strategy': 'mean_reversion', 'sideways_bb_std_mult': 3.221389928011796, 'sideways_rsi_os': 29, 'sideways_rsi_ob': 78, 'sideways_adx_thresh': 7.104298544496576, 'sideways_atr_min_pct': 0.02003444188745655, 'sideways_atr_max_pct': 0.020604407033201384, 'sideways_tp_mult': 2.0087420960274005, 'sideways_tsl_mult': 0.7148300043979906, 'sideways_time_stop': 139, 'sideways_use_sma': True, 'sideways_use_ema': False, 'sideways_use_atr': False, 'sideways_use_adx': True, 'sideways_use_spike': True, 'sideways_rsi_required': True}.
[I 2025-08-30 16:33:37,309] Trial 797 finished with values: [-1000000000.0, 1000000000.0] and parameters: {'p_sma': 59, 'p_std': 39, 'p_atr': 13, 'p_adx': 17, 'rsi_period': 16, 'ema1': 8, 'ema2': 28, 'slip_atr_k': 0.1230179406215784, 'slip_spread_k': 0.9196222526001709, 'spread_hl_frac': 0.008214454194897703, 'bb_std_mult': 2.0147714498375477, 'rsi_os': 27, 'rsi_ob': 82, 'vol_spike': 0.021159525806547008, 'adx_thresh': 7.863210311678812, 'atr_min_pct': 0.02434138483082146, 'atr_max_pct': 0.11034328073404374, 'tp_mult': 1.5171665841379876, 'tsl_mult': 0.7390123071193374, 'strategy': 'breakout', 'time_stop': 167, 'use_sma': False, 'use_atr': False, 'use_adx': True, 'use_ema': False, 'use_spike': False, 'rsi_required': False, 'edge_k': 1.986224056329252, 'edge_cap': 0.9308904397097849, 'bull_strategy': 'breakout', 'bull_bb_std_mult': 1.7490317890069678, 'bull_rsi_os': 50, 'bull_rsi_ob': 86, 'bull_adx_thresh': 31.412315764553675, 'bull_atr_min_pct': 0.02834914209066952, 'bull_atr_max_pct': 0.10764942154101517, 'bull_tp_mult': 1.625741576052118, 'bull_tsl_mult': 0.9118976881773645, 'bull_time_stop': 294, 'bull_use_sma': True, 'bull_use_ema': False, 'bull_use_atr': True, 'bull_use_adx': False, 'bull_use_spike': True, 'bull_rsi_required': False, 'bear_strategy': 'mean_reversion', 'bear_bb_std_mult': 1.6741351323904174, 'bear_rsi_os': 25, 'bear_rsi_ob': 57, 'bear_adx_thresh': 18.505442792862162, 'bear_atr_min_pct': 0.0014668545369502422, 'bear_atr_max_pct': 0.10913503909762416, 'bear_tp_mult': 2.700835219330218, 'bear_tsl_mult': 0.912044245394342, 'bear_time_stop': 82, 'bear_use_sma': True, 'bear_use_ema': True, 'bear_use_atr': True, 'bear_use_adx': False, 'bear_use_spike': True, 'bear_rsi_required': False, 'sideways_strategy': 'mean_reversion', 'sideways_bb_std_mult': 3.465762929623688, 'sideways_rsi_os': 14, 'sideways_rsi_ob': 90, 'sideways_adx_thresh': 9.83730989011477, 'sideways_atr_min_pct': 0.01436745889793243, 'sideways_atr_max_pct': 0.1284119434565581, 'sideways_tp_mult': 2.013630576762244, 'sideways_tsl_mult': 0.37409086101215927, 'sideways_time_stop': 137, 'sideways_use_sma': True, 'sideways_use_ema': False, 'sideways_use_atr': False, 'sideways_use_adx': True, 'sideways_use_spike': True, 'sideways_rsi_required': True}.
