[I 2025-08-30 16:40:54,483] Trial 836 finished with values: [-1000000000.0, 1000000000.0] and parameters: {'p_sma': 12, 'p_std': 20, 'p_atr': 12, 'p_adx': 27, 'rsi_period': 9, 'ema1': 6, 'ema2': 34, 'slip_atr_k': 0.13937246093484948, 'slip_spread_k': 0.8267061281926703, 'spread_hl_frac': 0.008339234141329501, 'bb_std_mult': 0.5018625426968129, 'rsi_os': 25, 'rsi_ob': 88, 'vol_spike': 0.2066066655728418, 'adx_thresh': 9.899096413060029, 'atr_min_pct': 0.005390802946917666, 'atr_max_pct': 0.10398619953716387, 'tp_mult': 1.9958390051745165, 'tsl_mult': 0.3751401742340813, 'strategy': 'breakout', 'time_stop': 42, 'use_sma': False, 'use_atr': False, 'use_adx': True, 'use_ema': False, 'use_spike': False, 'rsi_required': False, 'edge_k': 0.8102047488332502, 'edge_cap': 0.9651615681630248, 'bull_strategy': 'breakout', 'bull_bb_std_mult': 1.7477120550984422, 'bull_rsi_os': 47, 'bull_rsi_ob': 87, 'bull_adx_thresh': 18.126103735258795, 'bull_atr_min_pct': 0.01782597392661906, 'bull_atr_max_pct': 0.09743893028358092, 'bull_tp_mult': 2.09313158771886, 'bull_tsl_mult': 0.8967395775062569, 'bull_time_stop': 56, 'bull_use_sma': True, 'bull_use_ema': False, 'bull_use_atr': False, 'bull_use_adx': True, 'bull_use_spike': True, 'bull_rsi_required': False, 'bear_strategy': 'mean_reversion', 'bear_bb_std_mult': 1.7845441885528919, 'bear_rsi_os': 33, 'bear_rsi_ob': 80, 'bear_adx_thresh': 16.393036397466545, 'bear_atr_min_pct': 0.026705110078524687, 'bear_atr_max_pct': 0.11647805477982154, 'bear_tp_mult': 2.4579182761936424, 'bear_tsl_mult': 0.34638479145087997, 'bear_time_stop': 196, 'bear_use_sma': True, 'bear_use_ema': True, 'bear_use_atr': True, 'bear_use_adx': False, 'bear_use_spike': True, 'bear_rsi_required': True, 'sideways_strategy': 'mean_reversion', 'sideways_bb_std_mult': 3.193632728668251, 'sideways_rsi_os': 42, 'sideways_rsi_ob': 78, 'sideways_adx_thresh': 10.751673631933823, 'sideways_atr_min_pct': 0.02677383818805036, 'sideways_atr_max_pct': 0.06635031520407744, 'sideways_tp_mult': 1.4443498381860798, 'sideways_tsl_mult': 0.35675969608134883, 'sideways_time_stop': 269, 'sideways_use_sma': True, 'sideways_use_ema': False, 'sideways_use_atr': False, 'sideways_use_adx': True, 'sideways_use_spike': True, 'sideways_rsi_required': True}.
[I 2025-08-30 16:40:54,916] Trial 838 finished with values: [-1000000000.0, 1000000000.0] and parameters: {'p_sma': 11, 'p_std': 9, 'p_atr': 12, 'p_adx': 27, 'rsi_period': 12, 'ema1': 14, 'ema2': 34, 'slip_atr_k': 0.011715672503153255, 'slip_spread_k': 0.7487143356372237, 'spread_hl_frac': 0.01742841689216253, 'bb_std_mult': 0.6575966636479937, 'rsi_os': 27, 'rsi_ob': 88, 'vol_spike': 0.21402270108629232, 'adx_thresh': 8.853050264772147, 'atr_min_pct': 0.010321367863026775, 'atr_max_pct': 0.1117796888842259, 'tp_mult': 1.1838809166196274, 'tsl_mult': 0.3132273069249712, 'strategy': 'breakout', 'time_stop': 189, 'use_sma': False, 'use_atr': False, 'use_adx': True, 'use_ema': False, 'use_spike': False, 'rsi_required': False, 'edge_k': 0.5679718213157879, 'edge_cap': 0.4492217547595364, 'bull_strategy': 'breakout', 'bull_bb_std_mult': 3.2595792600207956, 'bull_rsi_os': 47, 'bull_rsi_ob': 87, 'bull_adx_thresh': 18.161726904437664, 'bull_atr_min_pct': 0.01940597484846573, 'bull_atr_max_pct': 0.11419416541743521, 'bull_tp_mult': 2.682083536760187, 'bull_tsl_mult': 0.918865819363324, 'bull_time_stop': 57, 'bull_use_sma': True, 'bull_use_ema': False, 'bull_use_atr': False, 'bull_use_adx': False, 'bull_use_spike': True, 'bull_rsi_required': False, 'bear_strategy': 'mean_reversion', 'bear_bb_std_mult': 1.9141477848556125, 'bear_rsi_os': 25, 'bear_rsi_ob': 64, 'bear_adx_thresh': 34.98450246812337, 'bear_atr_min_pct': 0.004012743367420382, 'bear_atr_max_pct': 0.10932977398988153, 'bear_tp_mult': 2.760849392040892, 'bear_tsl_mult': 0.8696782057266876, 'bear_time_stop': 198, 'bear_use_sma': True, 'bear_use_ema': True, 'bear_use_atr': True, 'bear_use_adx': False, 'bear_use_spike': True, 'bear_rsi_required': True, 'sideways_strategy': 'mean_reversion', 'sideways_bb_std_mult': 3.186424611711248, 'sideways_rsi_os': 42, 'sideways_rsi_ob': 78, 'sideways_adx_thresh': 10.594269663299462, 'sideways_atr_min_pct': 0.0041899633433458774, 'sideways_atr_max_pct': 0.13514316895644854, 'sideways_tp_mult': 2.6952461882822853, 'sideways_tsl_mult': 0.3735598282002827, 'sideways_time_stop': 136, 'sideways_use_sma': True, 'sideways_use_ema': True, 'sideways_use_atr': False, 'sideways_use_adx': True, 'sideways_use_spike': True, 'sideways_rsi_required': True}.
[I 2025-08-30 16:41:42,926] Trial 842 finished with values: [-1000000000.0, 1000000000.0] and parameters: {'p_sma': 9, 'p_std': 23, 'p_atr': 25, 'p_adx': 11, 'rsi_period': 61, 'ema1': 26, 'ema2': 24, 'slip_atr_k': 0.1570094085909533, 'slip_spread_k': 0.6043745566122426, 'spread_hl_frac': 0.0064811680542686415, 'bb_std_mult': 0.6739625137377003, 'rsi_os': 36, 'rsi_ob': 76, 'vol_spike': 0.19813455166060312, 'adx_thresh': 8.030686454522183, 'atr_min_pct': 0.00696893618301447, 'atr_max_pct': 0.11500953206943129, 'tp_mult': 1.487593890687561, 'tsl_mult': 0.3300175741065775, 'strategy': 'breakout', 'time_stop': 90, 'use_sma': False, 'use_atr': True, 'use_adx': True, 'use_ema': True, 'use_spike': True, 'rsi_required': True, 'edge_k': 0.6812652606810176, 'edge_cap': 0.38032715241282694, 'bull_strategy': 'breakout', 'bull_bb_std_mult': 1.158841161639459, 'bull_rsi_os': 22, 'bull_rsi_ob': 65, 'bull_adx_thresh': 9.419254141045672, 'bull_atr_min_pct': 0.005726519920314102, 'bull_atr_max_pct': 0.10093426245714245, 'bull_tp_mult': 2.5982123166410704, 'bull_tsl_mult': 0.8822194355747389, 'bull_time_stop': 173, 'bull_use_sma': True, 'bull_use_ema': True, 'bull_use_atr': True, 'bull_use_adx': False, 'bull_use_spike': False, 'bull_rsi_required': False, 'bear_strategy': 'mean_reversion', 'bear_bb_std_mult': 1.5387709513826158, 'bear_rsi_os': 34, 'bear_rsi_ob': 61, 'bear_adx_thresh': 25.92222904379656, 'bear_atr_min_pct': 0.0025003111629316017, 'bear_atr_max_pct': 0.13967320710187922, 'bear_tp_mult': 2.6892625712979865, 'bear_tsl_mult': 0.8599644487374624, 'bear_time_stop': 103, 'bear_use_sma': True, 'bear_use_ema': False, 'bear_use_atr': False, 'bear_use_adx': True, 'bear_use_spike': False, 'bear_rsi_required': False, 'sideways_strategy': 'mean_reversion', 'sideways_bb_std_mult': 3.0934441202371454, 'sideways_rsi_os': 6, 'sideways_rsi_ob': 72, 'sideways_adx_thresh': 29.760785873789224, 'sideways_atr_min_pct': 0.01376591763351935, 'sideways_atr_max_pct': 0.07076514517511558, 'sideways_tp_mult': 1.6259964776354467, 'sideways_tsl_mult': 0.23801870288603555, 'sideways_time_stop': 115, 'sideways_use_sma': True, 'sideways_use_ema': True, 'sideways_use_atr': True, 'sideways_use_adx': False, 'sideways_use_spike': False, 'sideways_rsi_required': False}.
[I 2025-08-30 16:41:43,510] Trial 839 finished with values: [-1000000000.0, 1000000000.0] and parameters: {'p_sma': 21, 'p_std': 20, 'p_atr': 12, 'p_adx': 11, 'rsi_period': 11, 'ema1': 14, 'ema2': 33, 'slip_atr_k': 0.009879990074559367, 'slip_spread_k': 0.7044867184820874, 'spread_hl_frac': 0.006978809714061628, 'bb_std_mult': 0.6612200776161994, 'rsi_os': 27, 'rsi_ob': 88, 'vol_spike': 0.08366211574316904, 'adx_thresh': 17.349320671948092, 'atr_min_pct': 0.007964204345345269, 'atr_max_pct': 0.046896314358775816, 'tp_mult': 2.006697505663188, 'tsl_mult': 0.3184762967674675, 'strategy': 'breakout', 'time_stop': 138, 'use_sma': False, 'use_atr': False, 'use_adx': True, 'use_ema': False, 'use_spike': False, 'rsi_required': False, 'edge_k': 0.5675755463800218, 'edge_cap': 0.08514176034309756, 'bull_strategy': 'breakout', 'bull_bb_std_mult': 1.1663675587458364, 'bull_rsi_os': 16, 'bull_rsi_ob': 56, 'bull_adx_thresh': 6.668389691246066, 'bull_atr_min_pct': 0.02447339460143446, 'bull_atr_max_pct': 0.017703322172381346, 'bull_tp_mult': 2.663490001391477, 'bull_tsl_mult': 0.9035653912739892, 'bull_time_stop': 54, 'bull_use_sma': True, 'bull_use_ema': False, 'bull_use_atr': True, 'bull_use_adx': False, 'bull_use_spike': True, 'bull_rsi_required': False, 'bear_strategy': 'mean_reversion', 'bear_bb_std_mult': 1.0571349814782902, 'bear_rsi_os': 32, 'bear_rsi_ob': 62, 'bear_adx_thresh': 14.597538426141082, 'bear_atr_min_pct': 0.0025769130262489927, 'bear_atr_max_pct': 0.11085912250114925, 'bear_tp_mult': 1.3377920312657552, 'bear_tsl_mult': 0.8456670804725215, 'bear_time_stop': 198, 'bear_use_sma': True, 'bear_use_ema': True, 'bear_use_atr': True, 'bear_use_adx': False, 'bear_use_spike': True, 'bear_rsi_required': True, 'sideways_strategy': 'mean_reversion', 'sideways_bb_std_mult': 2.513680581003161, 'sideways_rsi_os': 28, 'sideways_rsi_ob': 89, 'sideways_adx_thresh': 29.944494157566915, 'sideways_atr_min_pct': 0.026492602540185404, 'sideways_atr_max_pct': 0.12433520467837172, 'sideways_tp_mult': 2.6953169051462877, 'sideways_tsl_mult': 0.43495065121399196, 'sideways_time_stop': 139, 'sideways_use_sma': True, 'sideways_use_ema': True, 'sideways_use_atr': False, 'sideways_use_adx': True, 'sideways_use_spike': True, 'sideways_rsi_required': True}.
[I 2025-08-30 16:41:45,023] Trial 841 finished with values: [-1000000000.0, 1000000000.0] and parameters: {'p_sma': 9, 'p_std': 19, 'p_atr': 13, 'p_adx': 25, 'rsi_period': 11, 'ema1': 14, 'ema2': 36, 'slip_atr_k': 0.22765884980412593, 'slip_spread_k': 0.7091061744237735, 'spread_hl_frac': 0.003806415400730172, 'bb_std_mult': 0.670738191431035, 'rsi_os': 27, 'rsi_ob': 90, 'vol_spike': 0.21452552774141118, 'adx_thresh': 8.87098998228312, 'atr_min_pct': 0.006938597137494432, 'atr_max_pct': 0.12231332288156738, 'tp_mult': 1.5106876600650836, 'tsl_mult': 0.3223365217683484, 'strategy': 'breakout', 'time_stop': 130, 'use_sma': False, 'use_atr': True, 'use_adx': True, 'use_ema': True, 'use_spike': True, 'rsi_required': False, 'edge_k': 0.6867916288068903, 'edge_cap': 0.44936226749142844, 'bull_strategy': 'breakout', 'bull_bb_std_mult': 1.4642726466239666, 'bull_rsi_os': 49, 'bull_rsi_ob': 73, 'bull_adx_thresh': 9.280945956437806, 'bull_atr_min_pct': 0.018731767988253357, 'bull_atr_max_pct': 0.03990561350173614, 'bull_tp_mult': 2.5950378372268883, 'bull_tsl_mult': 0.9187046458613862, 'bull_time_stop': 178, 'bull_use_sma': True, 'bull_use_ema': True, 'bull_use_atr': True, 'bull_use_adx': False, 'bull_use_spike': False, 'bull_rsi_required': False, 'bear_strategy': 'mean_reversion', 'bear_bb_std_mult': 1.9379988142083289, 'bear_rsi_os': 27, 'bear_rsi_ob': 75, 'bear_adx_thresh': 14.74715178652663, 'bear_atr_min_pct': 0.0025630825701485503, 'bear_atr_max_pct': 0.09789282318329266, 'bear_tp_mult': 1.3375193401591547, 'bear_tsl_mult': 0.869178498906914, 'bear_time_stop': 103, 'bear_use_sma': True, 'bear_use_ema': False, 'bear_use_atr': False, 'bear_use_adx': True, 'bear_use_spike': True, 'bear_rsi_required': True, 'sideways_strategy': 'mean_reversion', 'sideways_bb_std_mult': 2.501160730727816, 'sideways_rsi_os': 28, 'sideways_rsi_ob': 79, 'sideways_adx_thresh': 11.421130334807513, 'sideways_atr_min_pct': 0.020231916063434826, 'sideways_atr_max_pct': 0.04571091255684672, 'sideways_tp_mult': 2.6983040827772333, 'sideways_tsl_mult': 0.44727612226489155, 'sideways_time_stop': 136, 'sideways_use_sma': True, 'sideways_use_ema': True, 'sideways_use_atr': True, 'sideways_use_adx': False, 'sideways_use_spike': False, 'sideways_rsi_required': False}.
[I 2025-08-30 16:41:46,015] Trial 840 finished with values: [-0.045465831557732095, 0.04533997470166759] and parameters: {'p_sma': 9, 'p_std': 20, 'p_atr': 14, 'p_adx': 11, 'rsi_period': 11, 'ema1': 22, 'ema2': 34, 'slip_atr_k': 0.2289926076750463, 'slip_spread_k': 0.6127496025912089, 'spread_hl_frac': 0.01803496335016838, 'bb_std_mult': 0.6884832665587751, 'rsi_os': 27, 'rsi_ob': 88, 'vol_spike': 0.2157322561763603, 'adx_thresh': 8.905579019584353, 'atr_min_pct': 0.005692572560090757, 'atr_max_pct': 0.1125869419697673, 'tp_mult': 1.4937281847692665, 'tsl_mult': 0.31888131409605, 'strategy': 'breakout', 'time_stop': 79, 'use_sma': False, 'use_atr': True, 'use_adx': True, 'use_ema': False, 'use_spike': True, 'rsi_required': False, 'edge_k': 0.6801710550400222, 'edge_cap': 0.7050557555638893, 'bull_strategy': 'breakout', 'bull_bb_std_mult': 1.0254628254100484, 'bull_rsi_os': 49, 'bull_rsi_ob': 90, 'bull_adx_thresh': 9.363027751811256, 'bull_atr_min_pct': 0.024467359659766652, 'bull_atr_max_pct': 0.09774676857409281, 'bull_tp_mult': 2.681494741807182, 'bull_tsl_mult': 0.9094143188396382, 'bull_time_stop': 55, 'bull_use_sma': True, 'bull_use_ema': True, 'bull_use_atr': True, 'bull_use_adx': False, 'bull_use_spike': True, 'bull_rsi_required': False, 'bear_strategy': 'mean_reversion', 'bear_bb_std_mult': 1.9186962008517958, 'bear_rsi_os': 54, 'bear_rsi_ob': 75, 'bear_adx_thresh': 16.809208840799016, 'bear_atr_min_pct': 0.002513068851223998, 'bear_atr_max_pct': 0.11234902406154132, 'bear_tp_mult': 2.758655106492769, 'bear_tsl_mult': 0.32130381174397493, 'bear_time_stop': 101, 'bear_use_sma': True, 'bear_use_ema': False, 'bear_use_atr': False, 'bear_use_adx': True, 'bear_use_spike': True, 'bear_rsi_required': True, 'sideways_strategy': 'mean_reversion', 'sideways_bb_std_mult': 3.4278187180335657, 'sideways_rsi_os': 28, 'sideways_rsi_ob': 76, 'sideways_adx_thresh': 29.87991571615813, 'sideways_atr_min_pct': 0.026907409352272604, 'sideways_atr_max_pct': 0.1353795642315817, 'sideways_tp_mult': 2.7492899564205593, 'sideways_tsl_mult': 0.23292568063987124, 'sideways_time_stop': 288, 'sideways_use_sma': True, 'sideways_use_ema': True, 'sideways_use_atr': True, 'sideways_use_adx': False, 'sideways_use_spike': True, 'sideways_rsi_required': True}.
[I 2025-08-30 16:42:41,204] Trial 843 finished with values: [-0.007294610319218964, 0.00768859845341506] and parameters: {'p_sma': 27, 'p_std': 46, 'p_atr': 21, 'p_adx': 14, 'rsi_period': 45, 'ema1': 25, 'ema2': 57, 'slip_atr_k': 0.010218895233889398, 'slip_spread_k': 0.8655239166905491, 'spread_hl_frac': 0.007364081620810942, 'bb_std_mult': 2.5677221259690945, 'rsi_os': 28, 'rsi_ob': 87, 'vol_spike': 0.23472767946916204, 'adx_thresh': 9.090237430692177, 'atr_min_pct': 0.014769600977772933, 'atr_max_pct': 0.04662082050806867, 'tp_mult': 1.5211616345989742, 'tsl_mult': 0.33916746176973506, 'strategy': 'breakout', 'time_stop': 161, 'use_sma': False, 'use_atr': False, 'use_adx': True, 'use_ema': False, 'use_spike': False, 'rsi_required': False, 'edge_k': 0.49614400756827093, 'edge_cap': 0.9427765434971774, 'bull_strategy': 'breakout', 'bull_bb_std_mult': 1.4944635665236716, 'bull_rsi_os': 9, 'bull_rsi_ob': 90, 'bull_adx_thresh': 6.889986224542209, 'bull_atr_min_pct': 0.018660616170000092, 'bull_atr_max_pct': 0.018869263690736625, 'bull_tp_mult': 2.71866263516227, 'bull_tsl_mult': 0.8400790263683132, 'bull_time_stop': 67, 'bull_use_sma': True, 'bull_use_ema': True, 'bull_use_atr': True, 'bull_use_adx': True, 'bull_use_spike': True, 'bull_rsi_required': True, 'bear_strategy': 'mean_reversion', 'bear_bb_std_mult': 2.31658556510242, 'bear_rsi_os': 53, 'bear_rsi_ob': 75, 'bear_adx_thresh': 32.00998604037363, 'bear_atr_min_pct': 0.0027539977045191464, 'bear_atr_max_pct': 0.09927593371204232, 'bear_tp_mult': 1.533589163257258, 'bear_tsl_mult': 0.8270872470646966, 'bear_time_stop': 93, 'bear_use_sma': True, 'bear_use_ema': False, 'bear_use_atr': True, 'bear_use_adx': True, 'bear_use_spike': True, 'bear_rsi_required': True, 'sideways_strategy': 'breakout', 'sideways_bb_std_mult': 3.3153169494893837, 'sideways_rsi_os': 22, 'sideways_rsi_ob': 79, 'sideways_adx_thresh': 26.337806745558044, 'sideways_atr_min_pct': 0.006376354321451722, 'sideways_atr_max_pct': 0.04590507531891969, 'sideways_tp_mult': 1.5647511956515248, 'sideways_tsl_mult': 0.44059013612882403, 'sideways_time_stop': 126, 'sideways_use_sma': False, 'sideways_use_ema': False, 'sideways_use_atr': True, 'sideways_use_adx': True, 'sideways_use_spike': True, 'sideways_rsi_required': True}.
[I 2025-08-30 16:42:41,580] Trial 845 finished with values: [-1000000000.0, 1000000000.0] and parameters: {'p_sma': 32, 'p_std': 22, 'p_atr': 11, 'p_adx': 24, 'rsi_period': 14, 'ema1': 7, 'ema2': 41, 'slip_atr_k': 0.04698256635318736, 'slip_spread_k': 0.6675797389275733, 'spread_hl_frac': 0.047398757631739834, 'bb_std_mult': 2.5485825845725216, 'rsi_os': 16, 'rsi_ob': 87, 'vol_spike': 0.2309046869793963, 'adx_thresh': 29.20940539287675, 'atr_min_pct': 0.014803879994246486, 'atr_max_pct': 0.08077373792687632, 'tp_mult': 1.5979271880156813, 'tsl_mult': 0.38133349216694806, 'strategy': 'breakout', 'time_stop': 160, 'use_sma': False, 'use_atr': False, 'use_adx': False, 'use_ema': False, 'use_spike': False, 'rsi_required': False, 'edge_k': 0.49593299931341467, 'edge_cap': 0.7000425020794645, 'bull_strategy': 'mean_reversion', 'bull_bb_std_mult': 1.013485520371142, 'bull_rsi_os': 5, 'bull_rsi_ob': 90, 'bull_adx_thresh': 10.389146930292387, 'bull_atr_min_pct': 0.020732476290548457, 'bull_atr_max_pct': 0.14110895059551087, 'bull_tp_mult': 1.2584652269056895, 'bull_tsl_mult': 0.736889437447453, 'bull_time_stop': 67, 'bull_use_sma': True, 'bull_use_ema': True, 'bull_use_atr': True, 'bull_use_adx': True, 'bull_use_spike': True, 'bull_rsi_required': True, 'bear_strategy': 'breakout', 'bear_bb_std_mult': 1.3276105243682572, 'bear_rsi_os': 26, 'bear_rsi_ob': 74, 'bear_adx_thresh': 33.39689492264168, 'bear_atr_min_pct': 0.006538718303863288, 'bear_atr_max_pct': 0.11334280319881672, 'bear_tp_mult': 2.6205349356625343, 'bear_tsl_mult': 0.7903983314501906, 'bear_time_stop': 30, 'bear_use_sma': True, 'bear_use_ema': False, 'bear_use_atr': True, 'bear_use_adx': True, 'bear_use_spike': False, 'bear_rsi_required': True, 'sideways_strategy': 'breakout', 'sideways_bb_std_mult': 3.4219736391688516, 'sideways_rsi_os': 15, 'sideways_rsi_ob': 59, 'sideways_adx_thresh': 9.153683406460598, 'sideways_atr_min_pct': 0.009990097768137293, 'sideways_atr_max_pct': 0.06880513242755147, 'sideways_tp_mult': 2.4835909403584977, 'sideways_tsl_mult': 0.5990244862458793, 'sideways_time_stop': 30, 'sideways_use_sma': False, 'sideways_use_ema': False, 'sideways_use_atr': True, 'sideways_use_adx': True, 'sideways_use_spike': True, 'sideways_rsi_required': True}.
[I 2025-08-30 16:42:41,943] Trial 846 finished with values: [-1000000000.0, 1000000000.0] and parameters: {'p_sma': 15, 'p_std': 24, 'p_atr': 11, 'p_adx': 24, 'rsi_period': 13, 'ema1': 7, 'ema2': 38, 'slip_atr_k': 0.01855971577657946, 'slip_spread_k': 0.0028723361261057123, 'spread_hl_frac': 0.021819761441729847, 'bb_std_mult': 0.5772577515266641, 'rsi_os': 44, 'rsi_ob': 75, 'vol_spike': 0.12045165060327469, 'adx_thresh': 7.3946055167243365, 'atr_min_pct': 0.003947482380557702, 'atr_max_pct': 0.07908805967661825, 'tp_mult': 1.4233305673455683, 'tsl_mult': 0.3825123773773612, 'strategy': 'breakout', 'time_stop': 161, 'use_sma': False, 'use_atr': False, 'use_adx': False, 'use_ema': False, 'use_spike': False, 'rsi_required': True, 'edge_k': 0.506439124519957, 'edge_cap': 0.9233401751666087, 'bull_strategy': 'mean_reversion', 'bull_bb_std_mult': 1.6784685607547807, 'bull_rsi_os': 50, 'bull_rsi_ob': 89, 'bull_adx_thresh': 10.492059876421814, 'bull_atr_min_pct': 0.020589213792306858, 'bull_atr_max_pct': 0.14076571086252185, 'bull_tp_mult': 2.5241866563756026, 'bull_tsl_mult': 0.1872327593174556, 'bull_time_stop': 44, 'bull_use_sma': True, 'bull_use_ema': True, 'bull_use_atr': True, 'bull_use_adx': True, 'bull_use_spike': True, 'bull_rsi_required': True, 'bear_strategy': 'breakout', 'bear_bb_std_mult': 1.5997164576082143, 'bear_rsi_os': 44, 'bear_rsi_ob': 77, 'bear_adx_thresh': 15.44750175624905, 'bear_atr_min_pct': 0.0160159976178025, 'bear_atr_max_pct': 0.05208254201884412, 'bear_tp_mult': 2.7196310939762838, 'bear_tsl_mult': 0.8222293078211369, 'bear_time_stop': 68, 'bear_use_sma': True, 'bear_use_ema': False, 'bear_use_atr': True, 'bear_use_adx': True, 'bear_use_spike': False, 'bear_rsi_required': False, 'sideways_strategy': 'breakout', 'sideways_bb_std_mult': 3.034940887549503, 'sideways_rsi_os': 17, 'sideways_rsi_ob': 79, 'sideways_adx_thresh': 25.632318064818797, 'sideways_atr_min_pct': 0.008468413127229742, 'sideways_atr_max_pct': 0.01074317367865947, 'sideways_tp_mult': 1.3090111378279903, 'sideways_tsl_mult': 0.47843692483445593, 'sideways_time_stop': 61, 'sideways_use_sma': False, 'sideways_use_ema': False, 'sideways_use_atr': True, 'sideways_use_adx': True, 'sideways_use_spike': True, 'sideways_rsi_required': True}.
