[I 2025-08-30 14:28:09,033] Trial 66 finished with values: [-1000000000.0, 1000000000.0] and parameters: {'p_sma': 34, 'p_std': 13, 'p_atr': 16, 'p_adx': 10, 'rsi_period': 60, 'ema1': 10, 'ema2': 56, 'slip_atr_k': 0.13010696556334223, 'slip_spread_k': 0.17764038848770164, 'spread_hl_frac': 0.0005519725930666561, 'bb_std_mult': 3.3633467055890884, 'rsi_os': 12, 'rsi_ob': 86, 'vol_spike': 0.10734495025992334, 'adx_thresh': 8.03609805622955, 'atr_min_pct': 0.01911357088737655, 'atr_max_pct': 0.014470965891737662, 'tp_mult': 2.396069571806464, 'tsl_mult': 0.15248040101461713, 'strategy': 'mean_reversion', 'time_stop': 184, 'use_sma': False, 'use_atr': False, 'use_adx': True, 'use_ema': True, 'use_spike': True, 'rsi_required': False, 'edge_k': 1.643031373789459, 'edge_cap': 0.5070498670194139, 'bull_strategy': 'breakout', 'bull_bb_std_mult': 2.507040247033279, 'bull_rsi_os': 33, 'bull_rsi_ob': 83, 'bull_adx_thresh': 34.06366601932238, 'bull_atr_min_pct': 0.002642629558668206, 'bull_atr_max_pct': 0.025263893375736944, 'bull_tp_mult': 1.078590105865147, 'bull_tsl_mult': 0.8615845876387623, 'bull_time_stop': 136, 'bull_use_sma': False, 'bull_use_ema': True, 'bull_use_atr': False, 'bull_use_adx': False, 'bull_use_spike': False, 'bull_rsi_required': False, 'bear_strategy': 'mean_reversion', 'bear_bb_std_mult': 1.1476080804643216, 'bear_rsi_os': 46, 'bear_rsi_ob': 61, 'bear_adx_thresh': 33.46248824393585, 'bear_atr_min_pct': 0.018716789713952818, 'bear_atr_max_pct': 0.011245356301776421, 'bear_tp_mult': 1.9040881581900198, 'bear_tsl_mult': 0.9159980560357508, 'bear_time_stop': 57, 'bear_use_sma': True, 'bear_use_ema': True, 'bear_use_atr': False, 'bear_use_adx': False, 'bear_use_spike': False, 'bear_rsi_required': True, 'sideways_strategy': 'breakout', 'sideways_bb_std_mult': 3.244093791457746, 'sideways_rsi_os': 42, 'sideways_rsi_ob': 69, 'sideways_adx_thresh': 15.571929267134598, 'sideways_atr_min_pct': 0.014102772516439599, 'sideways_atr_max_pct': 0.016984473943401707, 'sideways_tp_mult': 2.9438737656271003, 'sideways_tsl_mult': 0.9242191576782712, 'sideways_time_stop': 203, 'sideways_use_sma': True, 'sideways_use_ema': False, 'sideways_use_atr': False, 'sideways_use_adx': False, 'sideways_use_spike': True, 'sideways_rsi_required': True}.
[I 2025-08-30 14:28:39,277] Trial 63 finished with values: [-1000000000.0, 1000000000.0] and parameters: {'p_sma': 5, 'p_std': 7, 'p_atr': 16, 'p_adx': 24, 'rsi_period': 60, 'ema1': 9, 'ema2': 31, 'slip_atr_k': 0.06716371128236996, 'slip_spread_k': 0.1713572752604104, 'spread_hl_frac': 0.010500704243909335, 'bb_std_mult': 1.1128699081152562, 'rsi_os': 12, 'rsi_ob': 78, 'vol_spike': 0.18208503487319372, 'adx_thresh': 29.85609479698199, 'atr_min_pct': 0.019444068869069124, 'atr_max_pct': 0.021167009079477585, 'tp_mult': 2.0988242425744286, 'tsl_mult': 0.040454267657666965, 'strategy': 'mean_reversion', 'time_stop': 162, 'use_sma': False, 'use_atr': False, 'use_adx': True, 'use_ema': True, 'use_spike': False, 'rsi_required': True, 'edge_k': 1.8803523422775756, 'edge_cap': 0.5044213737280917, 'bull_strategy': 'breakout', 'bull_bb_std_mult': 1.1070169595426305, 'bull_rsi_os': 25, 'bull_rsi_ob': 53, 'bull_adx_thresh': 32.097962155432725, 'bull_atr_min_pct': 0.025437429546741067, 'bull_atr_max_pct': 0.03966450152748864, 'bull_tp_mult': 2.775471560689261, 'bull_tsl_mult': 0.9996405144632, 'bull_time_stop': 7, 'bull_use_sma': False, 'bull_use_ema': True, 'bull_use_atr': False, 'bull_use_adx': False, 'bull_use_spike': False, 'bull_rsi_required': False, 'bear_strategy': 'mean_reversion', 'bear_bb_std_mult': 3.445430585055389, 'bear_rsi_os': 44, 'bear_rsi_ob': 83, 'bear_adx_thresh': 15.66949554539194, 'bear_atr_min_pct': 0.02984991641170267, 'bear_atr_max_pct': 0.11908998168677863, 'bear_tp_mult': 2.38188082653978, 'bear_tsl_mult': 0.5258748884703646, 'bear_time_stop': 182, 'bear_use_sma': True, 'bear_use_ema': True, 'bear_use_atr': False, 'bear_use_adx': False, 'bear_use_spike': True, 'bear_rsi_required': False, 'sideways_strategy': 'breakout', 'sideways_bb_std_mult': 3.1036164239873254, 'sideways_rsi_os': 30, 'sideways_rsi_ob': 54, 'sideways_adx_thresh': 22.113337420821995, 'sideways_atr_min_pct': 0.027178877495577985, 'sideways_atr_max_pct': 0.0556123928123516, 'sideways_tp_mult': 1.7690013106838132, 'sideways_tsl_mult': 0.20618736856483308, 'sideways_time_stop': 197, 'sideways_use_sma': True, 'sideways_use_ema': True, 'sideways_use_atr': True, 'sideways_use_adx': False, 'sideways_use_spike': False, 'sideways_rsi_required': False}.
[I 2025-08-30 14:28:39,603] Trial 65 finished with values: [-1000000000.0, 1000000000.0] and parameters: {'p_sma': 26, 'p_std': 39, 'p_atr': 20, 'p_adx': 8, 'rsi_period': 49, 'ema1': 13, 'ema2': 31, 'slip_atr_k': 0.06619788088531692, 'slip_spread_k': 0.5748340236487262, 'spread_hl_frac': 0.019283633421050276, 'bb_std_mult': 0.6740652137591994, 'rsi_os': 11, 'rsi_ob': 75, 'vol_spike': 0.10636984699481287, 'adx_thresh': 34.03260701875813, 'atr_min_pct': 0.0013920171106282294, 'atr_max_pct': 0.023115661054245562, 'tp_mult': 1.7895336090663858, 'tsl_mult': 0.14585734323652239, 'strategy': 'mean_reversion', 'time_stop': 206, 'use_sma': False, 'use_atr': True, 'use_adx': True, 'use_ema': True, 'use_spike': False, 'rsi_required': False, 'edge_k': 0.12041941919308274, 'edge_cap': 0.42838618921871163, 'bull_strategy': 'breakout', 'bull_bb_std_mult': 2.505460266578713, 'bull_rsi_os': 21, 'bull_rsi_ob': 83, 'bull_adx_thresh': 32.07541617175128, 'bull_atr_min_pct': 0.002656863419419142, 'bull_atr_max_pct': 0.02544822182353091, 'bull_tp_mult': 1.0888361879436397, 'bull_tsl_mult': 0.7352322870256554, 'bull_time_stop': 63, 'bull_use_sma': False, 'bull_use_ema': True, 'bull_use_atr': False, 'bull_use_adx': True, 'bull_use_spike': False, 'bull_rsi_required': False, 'bear_strategy': 'mean_reversion', 'bear_bb_std_mult': 1.6759849649911158, 'bear_rsi_os': 45, 'bear_rsi_ob': 88, 'bear_adx_thresh': 34.058358999332896, 'bear_atr_min_pct': 0.01852718832976787, 'bear_atr_max_pct': 0.10221049496710727, 'bear_tp_mult': 2.130381878523611, 'bear_tsl_mult': 0.20173551050431576, 'bear_time_stop': 51, 'bear_use_sma': True, 'bear_use_ema': True, 'bear_use_atr': False, 'bear_use_adx': False, 'bear_use_spike': False, 'bear_rsi_required': True, 'sideways_strategy': 'breakout', 'sideways_bb_std_mult': 3.2422658789853926, 'sideways_rsi_os': 29, 'sideways_rsi_ob': 83, 'sideways_adx_thresh': 7.376835727031352, 'sideways_atr_min_pct': 0.01644236849923774, 'sideways_atr_max_pct': 0.02624245824434677, 'sideways_tp_mult': 2.9481325839187504, 'sideways_tsl_mult': 0.9087410088814879, 'sideways_time_stop': 201, 'sideways_use_sma': False, 'sideways_use_ema': True, 'sideways_use_atr': True, 'sideways_use_adx': False, 'sideways_use_spike': False, 'sideways_rsi_required': False}.
[I 2025-08-30 14:28:39,714] Trial 62 finished with values: [-0.014399604392098309, 0.014346114828376121] and parameters: {'p_sma': 34, 'p_std': 7, 'p_atr': 9, 'p_adx': 23, 'rsi_period': 13, 'ema1': 13, 'ema2': 31, 'slip_atr_k': 0.06541567611114418, 'slip_spread_k': 0.08590140140568803, 'spread_hl_frac': 0.0109270301446771, 'bb_std_mult': 1.1314436223956683, 'rsi_os': 11, 'rsi_ob': 78, 'vol_spike': 0.18785463140330738, 'adx_thresh': 29.81079915834747, 'atr_min_pct': 0.019186680632850325, 'atr_max_pct': 0.1101456449980986, 'tp_mult': 2.071952710598902, 'tsl_mult': 0.0364150106251667, 'strategy': 'mean_reversion', 'time_stop': 237, 'use_sma': False, 'use_atr': False, 'use_adx': False, 'use_ema': True, 'use_spike': False, 'rsi_required': True, 'edge_k': 0.1567149682298128, 'edge_cap': 0.9286358518352336, 'bull_strategy': 'breakout', 'bull_bb_std_mult': 2.5558561371739947, 'bull_rsi_os': 35, 'bull_rsi_ob': 54, 'bull_adx_thresh': 33.666158205758094, 'bull_atr_min_pct': 0.001185556083895763, 'bull_atr_max_pct': 0.04119372748220848, 'bull_tp_mult': 1.0802393098201706, 'bull_tsl_mult': 0.9406462550202667, 'bull_time_stop': 144, 'bull_use_sma': False, 'bull_use_ema': True, 'bull_use_atr': False, 'bull_use_adx': False, 'bull_use_spike': False, 'bull_rsi_required': False, 'bear_strategy': 'mean_reversion', 'bear_bb_std_mult': 2.1956684013537413, 'bear_rsi_os': 9, 'bear_rsi_ob': 82, 'bear_adx_thresh': 6.53415771841529, 'bear_atr_min_pct': 0.018751543457913845, 'bear_atr_max_pct': 0.010137699472100109, 'bear_tp_mult': 2.1584466497812276, 'bear_tsl_mult': 0.1826476967861303, 'bear_time_stop': 53, 'bear_use_sma': True, 'bear_use_ema': True, 'bear_use_atr': False, 'bear_use_adx': False, 'bear_use_spike': True, 'bear_rsi_required': False, 'sideways_strategy': 'breakout', 'sideways_bb_std_mult': 1.863841022863781, 'sideways_rsi_os': 10, 'sideways_rsi_ob': 49, 'sideways_adx_thresh': 22.447021944088046, 'sideways_atr_min_pct': 0.027223523595765704, 'sideways_atr_max_pct': 0.050432928415803706, 'sideways_tp_mult': 2.9256391749684165, 'sideways_tsl_mult': 0.2022273369874307, 'sideways_time_stop': 200, 'sideways_use_sma': True, 'sideways_use_ema': True, 'sideways_use_atr': True, 'sideways_use_adx': False, 'sideways_use_spike': False, 'sideways_rsi_required': False}.
[I 2025-08-30 14:28:40,387] Trial 67 finished with values: [-0.013905536378454042, 0.013831072911654781] and parameters: {'p_sma': 26, 'p_std': 38, 'p_atr': 9, 'p_adx': 7, 'rsi_period': 44, 'ema1': 9, 'ema2': 16, 'slip_atr_k': 0.20924972957564542, 'slip_spread_k': 0.44206785001972315, 'spread_hl_frac': 0.014334543803050565, 'bb_std_mult': 0.6378043489103287, 'rsi_os': 7, 'rsi_ob': 93, 'vol_spike': 0.2105322887593575, 'adx_thresh': 34.064455650259944, 'atr_min_pct': 0.006025569496787996, 'atr_max_pct': 0.027763041745975416, 'tp_mult': 1.179696426126672, 'tsl_mult': 0.1905592727881144, 'strategy': 'mean_reversion', 'time_stop': 198, 'use_sma': False, 'use_atr': True, 'use_adx': False, 'use_ema': False, 'use_spike': False, 'rsi_required': True, 'edge_k': 1.3529634133225181, 'edge_cap': 0.142952564040851, 'bull_strategy': 'breakout', 'bull_bb_std_mult': 2.9407167732144184, 'bull_rsi_os': 24, 'bull_rsi_ob': 79, 'bull_adx_thresh': 20.43940969530885, 'bull_atr_min_pct': 0.0016191129227344854, 'bull_atr_max_pct': 0.08472101749577196, 'bull_tp_mult': 1.2281588022033778, 'bull_tsl_mult': 0.67813359821031, 'bull_time_stop': 64, 'bull_use_sma': False, 'bull_use_ema': False, 'bull_use_atr': False, 'bull_use_adx': False, 'bull_use_spike': False, 'bull_rsi_required': False, 'bear_strategy': 'mean_reversion', 'bear_bb_std_mult': 3.3222131316532666, 'bear_rsi_os': 21, 'bear_rsi_ob': 88, 'bear_adx_thresh': 34.84864339543298, 'bear_atr_min_pct': 0.009719400173480316, 'bear_atr_max_pct': 0.1274493373529152, 'bear_tp_mult': 2.190167998107537, 'bear_tsl_mult': 0.5027183791945462, 'bear_time_stop': 156, 'bear_use_sma': True, 'bear_use_ema': True, 'bear_use_atr': False, 'bear_use_adx': False, 'bear_use_spike': True, 'bear_rsi_required': False, 'sideways_strategy': 'breakout', 'sideways_bb_std_mult': 2.3306765947823793, 'sideways_rsi_os': 30, 'sideways_rsi_ob': 83, 'sideways_adx_thresh': 7.559532916183864, 'sideways_atr_min_pct': 0.017052893640351806, 'sideways_atr_max_pct': 0.015312757907161483, 'sideways_tp_mult': 2.9255847156176635, 'sideways_tsl_mult': 0.8182123321647992, 'sideways_time_stop': 136, 'sideways_use_sma': False, 'sideways_use_ema': True, 'sideways_use_atr': True, 'sideways_use_adx': False, 'sideways_use_spike': False, 'sideways_rsi_required': False}.
[I 2025-08-30 14:29:11,889] Trial 68 finished with values: [-1000000000.0, 1000000000.0] and parameters: {'p_sma': 26, 'p_std': 52, 'p_atr': 23, 'p_adx': 7, 'rsi_period': 44, 'ema1': 14, 'ema2': 53, 'slip_atr_k': 0.20491781391243252, 'slip_spread_k': 0.4454718133500387, 'spread_hl_frac': 0.014133971591426795, 'bb_std_mult': 0.6724917188028456, 'rsi_os': 7, 'rsi_ob': 87, 'vol_spike': 0.2539267388428275, 'adx_thresh': 33.93811714475775, 'atr_min_pct': 0.0010416477878917706, 'atr_max_pct': 0.027998169730113914, 'tp_mult': 1.2089285860102108, 'tsl_mult': 0.19082642526791432, 'strategy': 'breakout', 'time_stop': 201, 'use_sma': False, 'use_atr': True, 'use_adx': False, 'use_ema': False, 'use_spike': False, 'rsi_required': False, 'edge_k': 0.48471758791331143, 'edge_cap': 0.950182429552817, 'bull_strategy': 'mean_reversion', 'bull_bb_std_mult': 1.295046419933952, 'bull_rsi_os': 38, 'bull_rsi_ob': 49, 'bull_adx_thresh': 30.043022413726796, 'bull_atr_min_pct': 0.012669758569160923, 'bull_atr_max_pct': 0.08736930898168527, 'bull_tp_mult': 1.0695765645313913, 'bull_tsl_mult': 0.6849442539727726, 'bull_time_stop': 91, 'bull_use_sma': False, 'bull_use_ema': False, 'bull_use_atr': False, 'bull_use_adx': True, 'bull_use_spike': False, 'bull_rsi_required': False, 'bear_strategy': 'breakout', 'bear_bb_std_mult': 1.429771288399195, 'bear_rsi_os': 14, 'bear_rsi_ob': 88, 'bear_adx_thresh': 34.990717853021465, 'bear_atr_min_pct': 0.00999396428090836, 'bear_atr_max_pct': 0.12652759985037326, 'bear_tp_mult': 2.123382522966615, 'bear_tsl_mult': 0.7309702267126735, 'bear_time_stop': 161, 'bear_use_sma': True, 'bear_use_ema': False, 'bear_use_atr': False, 'bear_use_adx': False, 'bear_use_spike': True, 'bear_rsi_required': False, 'sideways_strategy': 'mean_reversion', 'sideways_bb_std_mult': 3.4610181974988166, 'sideways_rsi_os': 6, 'sideways_rsi_ob': 57, 'sideways_adx_thresh': 6.20295205404908, 'sideways_atr_min_pct': 0.017502366096641703, 'sideways_atr_max_pct': 0.025067722393231726, 'sideways_tp_mult': 2.944847502949587, 'sideways_tsl_mult': 0.1321496164802145, 'sideways_time_stop': 283, 'sideways_use_sma': False, 'sideways_use_ema': True, 'sideways_use_atr': True, 'sideways_use_adx': False, 'sideways_use_spike': False, 'sideways_rsi_required': False}.
[I 2025-08-30 14:29:12,009] Trial 70 finished with values: [-1000000000.0, 1000000000.0] and parameters: {'p_sma': 39, 'p_std': 55, 'p_atr': 14, 'p_adx': 7, 'rsi_period': 32, 'ema1': 9, 'ema2': 16, 'slip_atr_k': 0.22116128448330408, 'slip_spread_k': 0.8060267342597565, 'spread_hl_frac': 0.014059884717892534, 'bb_std_mult': 0.7894778275399346, 'rsi_os': 7, 'rsi_ob': 93, 'vol_spike': 0.20735835541739792, 'adx_thresh': 11.413640647183515, 'atr_min_pct': 0.005921662961786559, 'atr_max_pct': 0.029788913570089413, 'tp_mult': 2.8750178414251644, 'tsl_mult': 0.002880256457733977, 'strategy': 'breakout', 'time_stop': 245, 'use_sma': False, 'use_atr': False, 'use_adx': False, 'use_ema': True, 'use_spike': False, 'rsi_required': True, 'edge_k': 1.518019167357497, 'edge_cap': 0.36447150324894023, 'bull_strategy': 'mean_reversion', 'bull_bb_std_mult': 0.6318812557378053, 'bull_rsi_os': 24, 'bull_rsi_ob': 79, 'bull_adx_thresh': 12.849087902963024, 'bull_atr_min_pct': 0.01488908653853585, 'bull_atr_max_pct': 0.11784749315167953, 'bull_tp_mult': 1.2028596343420643, 'bull_tsl_mult': 0.6819132304956832, 'bull_time_stop': 90, 'bull_use_sma': True, 'bull_use_ema': True, 'bull_use_atr': False, 'bull_use_adx': False, 'bull_use_spike': False, 'bull_rsi_required': True, 'bear_strategy': 'breakout', 'bear_bb_std_mult': 0.8864591617682686, 'bear_rsi_os': 38, 'bear_rsi_ob': 78, 'bear_adx_thresh': 32.60017267237264, 'bear_atr_min_pct': 0.01531215031707395, 'bear_atr_max_pct': 0.1254470726061835, 'bear_tp_mult': 1.1560720242932434, 'bear_tsl_mult': 0.7263751052842882, 'bear_time_stop': 162, 'bear_use_sma': True, 'bear_use_ema': False, 'bear_use_atr': True, 'bear_use_adx': True, 'bear_use_spike': True, 'bear_rsi_required': False, 'sideways_strategy': 'breakout', 'sideways_bb_std_mult': 3.541330582766702, 'sideways_rsi_os': 6, 'sideways_rsi_ob': 74, 'sideways_adx_thresh': 10.275618197376726, 'sideways_atr_min_pct': 0.02913351275987807, 'sideways_atr_max_pct': 0.11152378446691183, 'sideways_tp_mult': 2.9934805895248835, 'sideways_tsl_mult': 0.28980775811588805, 'sideways_time_stop': 190, 'sideways_use_sma': True, 'sideways_use_ema': True, 'sideways_use_atr': True, 'sideways_use_adx': False, 'sideways_use_spike': False, 'sideways_rsi_required': False}.
[I 2025-08-30 14:29:12,183] Trial 69 finished with values: [-1000000000.0, 1000000000.0] and parameters: {'p_sma': 38, 'p_std': 29, 'p_atr': 14, 'p_adx': 7, 'rsi_period': 44, 'ema1': 9, 'ema2': 37, 'slip_atr_k': 0.09688371636097821, 'slip_spread_k': 0.43747991789030144, 'spread_hl_frac': 0.014152808705012863, 'bb_std_mult': 0.7908938637709901, 'rsi_os': 8, 'rsi_ob': 49, 'vol_spike': 0.2112382363145683, 'adx_thresh': 11.796923866527665, 'atr_min_pct': 0.006422353419952724, 'atr_max_pct': 0.013266450751747037, 'tp_mult': 1.158566427090928, 'tsl_mult': 0.00014974524872082146, 'strategy': 'breakout', 'time_stop': 247, 'use_sma': False, 'use_atr': False, 'use_adx': False, 'use_ema': False, 'use_spike': False, 'rsi_required': True, 'edge_k': 0.4564675900582509, 'edge_cap': 0.9304129525031781, 'bull_strategy': 'mean_reversion', 'bull_bb_std_mult': 0.5955142261769852, 'bull_rsi_os': 24, 'bull_rsi_ob': 79, 'bull_adx_thresh': 12.734004992170693, 'bull_atr_min_pct': 0.012061373892565619, 'bull_atr_max_pct': 0.12135466953862947, 'bull_tp_mult': 1.2373856741906626, 'bull_tsl_mult': 0.7914939201971561, 'bull_time_stop': 62, 'bull_use_sma': True, 'bull_use_ema': False, 'bull_use_atr': False, 'bull_use_adx': False, 'bull_use_spike': True, 'bull_rsi_required': True, 'bear_strategy': 'breakout', 'bear_bb_std_mult': 1.4177253352820451, 'bear_rsi_os': 15, 'bear_rsi_ob': 90, 'bear_adx_thresh': 32.142068019289404, 'bear_atr_min_pct': 0.015212913171088312, 'bear_atr_max_pct': 0.12616556837120102, 'bear_tp_mult': 1.8130602894774421, 'bear_tsl_mult': 0.7265193518441385, 'bear_time_stop': 160, 'bear_use_sma': True, 'bear_use_ema': False, 'bear_use_atr': False, 'bear_use_adx': True, 'bear_use_spike': True, 'bear_rsi_required': False, 'sideways_strategy': 'mean_reversion', 'sideways_bb_std_mult': 3.4043717784175485, 'sideways_rsi_os': 6, 'sideways_rsi_ob': 74, 'sideways_adx_thresh': 32.98087026982161, 'sideways_atr_min_pct': 0.00492447607186962, 'sideways_atr_max_pct': 0.03660039363189956, 'sideways_tp_mult': 2.0122414002811033, 'sideways_tsl_mult': 0.8543325825158847, 'sideways_time_stop': 235, 'sideways_use_sma': True, 'sideways_use_ema': True, 'sideways_use_atr': True, 'sideways_use_adx': False, 'sideways_use_spike': True, 'sideways_rsi_required': True}.
[I 2025-08-30 14:29:12,196] Trial 71 finished with values: [-1000000000.0, 1000000000.0] and parameters: {'p_sma': 15, 'p_std': 30, 'p_atr': 26, 'p_adx': 13, 'rsi_period': 43, 'ema1': 9, 'ema2': 17, 'slip_atr_k': 0.09723000013000713, 'slip_spread_k': 0.4367450262286964, 'spread_hl_frac': 0.02596274672870072, 'bb_std_mult': 0.8237299080212725, 'rsi_os': 8, 'rsi_ob': 71, 'vol_spike': 0.20973753496856606, 'adx_thresh': 5.324852507415377, 'atr_min_pct': 0.005793785643088309, 'atr_max_pct': 0.029130272329839814, 'tp_mult': 2.246255557272689, 'tsl_mult': 0.00035834219758771116, 'strategy': 'breakout', 'time_stop': 247, 'use_sma': True, 'use_atr': False, 'use_adx': False, 'use_ema': False, 'use_spike': False, 'rsi_required': True, 'edge_k': 1.9359302853263796, 'edge_cap': 0.9411021256061287, 'bull_strategy': 'mean_reversion', 'bull_bb_std_mult': 0.6331959202377321, 'bull_rsi_os': 24, 'bull_rsi_ob': 77, 'bull_adx_thresh': 34.150660063118615, 'bull_atr_min_pct': 0.004346456284814936, 'bull_atr_max_pct': 0.08666324759117709, 'bull_tp_mult': 1.2621955314768367, 'bull_tsl_mult': 0.8054017247948326, 'bull_time_stop': 90, 'bull_use_sma': True, 'bull_use_ema': True, 'bull_use_atr': False, 'bull_use_adx': False, 'bull_use_spike': False, 'bull_rsi_required': True, 'bear_strategy': 'breakout', 'bear_bb_std_mult': 0.9153741884239188, 'bear_rsi_os': 14, 'bear_rsi_ob': 80, 'bear_adx_thresh': 32.140411612086176, 'bear_atr_min_pct': 0.015685245773550672, 'bear_atr_max_pct': 0.12782127230490967, 'bear_tp_mult': 1.1526681986690268, 'bear_tsl_mult': 0.7163051059327558, 'bear_time_stop': 160, 'bear_use_sma': True, 'bear_use_ema': False, 'bear_use_atr': True, 'bear_use_adx': True, 'bear_use_spike': True, 'bear_rsi_required': False, 'sideways_strategy': 'breakout', 'sideways_bb_std_mult': 3.5882080936257794, 'sideways_rsi_os': 54, 'sideways_rsi_ob': 74, 'sideways_adx_thresh': 5.946322689399668, 'sideways_atr_min_pct': 0.027812236124880416, 'sideways_atr_max_pct': 0.03622969128196457, 'sideways_tp_mult': 2.9256182846411045, 'sideways_tsl_mult': 0.2900149768695774, 'sideways_time_stop': 182, 'sideways_use_sma': True, 'sideways_use_ema': True, 'sideways_use_atr': True, 'sideways_use_adx': False, 'sideways_use_spike': False, 'sideways_rsi_required': False}.
