[I 2025-08-30 16:20:25,328] Trial 729 finished with values: [-1000000000.0, 1000000000.0] and parameters: {'p_sma': 9, 'p_std': 20, 'p_atr': 12, 'p_adx': 27, 'rsi_period': 73, 'ema1': 26, 'ema2': 12, 'slip_atr_k': 0.14717463879025483, 'slip_spread_k': 0.7116786067856742, 'spread_hl_frac': 0.03849171757129218, 'bb_std_mult': 1.7495610234443062, 'rsi_os': 15, 'rsi_ob': 88, 'vol_spike': 0.1918352176077073, 'adx_thresh': 9.40077167580578, 'atr_min_pct': 0.02594126096534722, 'atr_max_pct': 0.10665744596106227, 'tp_mult': 1.5578523624005491, 'tsl_mult': 0.29167518659180836, 'strategy': 'mean_reversion', 'time_stop': 167, 'use_sma': True, 'use_atr': False, 'use_adx': True, 'use_ema': False, 'use_spike': False, 'rsi_required': False, 'edge_k': 1.4713259672078647, 'edge_cap': 0.9590001175895115, 'bull_strategy': 'breakout', 'bull_bb_std_mult': 1.5281808258326437, 'bull_rsi_os': 34, 'bull_rsi_ob': 90, 'bull_adx_thresh': 15.4887959700674, 'bull_atr_min_pct': 0.025594831327954294, 'bull_atr_max_pct': 0.027207208955212503, 'bull_tp_mult': 1.7580640630104554, 'bull_tsl_mult': 0.8760101661786585, 'bull_time_stop': 48, 'bull_use_sma': False, 'bull_use_ema': True, 'bull_use_atr': True, 'bull_use_adx': False, 'bull_use_spike': True, 'bull_rsi_required': False, 'bear_strategy': 'mean_reversion', 'bear_bb_std_mult': 1.6409209039067225, 'bear_rsi_os': 24, 'bear_rsi_ob': 91, 'bear_adx_thresh': 16.74592665322444, 'bear_atr_min_pct': 0.0012874745387234689, 'bear_atr_max_pct': 0.04961766193051768, 'bear_tp_mult': 1.4783239932503718, 'bear_tsl_mult': 0.8574889527792503, 'bear_time_stop': 102, 'bear_use_sma': False, 'bear_use_ema': False, 'bear_use_atr': True, 'bear_use_adx': True, 'bear_use_spike': False, 'bear_rsi_required': True, 'sideways_strategy': 'mean_reversion', 'sideways_bb_std_mult': 3.4914590904859364, 'sideways_rsi_os': 25, 'sideways_rsi_ob': 81, 'sideways_adx_thresh': 10.812071398751383, 'sideways_atr_min_pct': 0.020594363801689754, 'sideways_atr_max_pct': 0.1461195717064655, 'sideways_tp_mult': 1.2797545606626588, 'sideways_tsl_mult': 0.3913137383822478, 'sideways_time_stop': 264, 'sideways_use_sma': True, 'sideways_use_ema': False, 'sideways_use_atr': True, 'sideways_use_adx': True, 'sideways_use_spike': False, 'sideways_rsi_required': False}.
[I 2025-08-30 16:21:10,893] Trial 730 finished with values: [-1000000000.0, 1000000000.0] and parameters: {'p_sma': 9, 'p_std': 20, 'p_atr': 12, 'p_adx': 7, 'rsi_period': 73, 'ema1': 26, 'ema2': 30, 'slip_atr_k': 0.013085539654593309, 'slip_spread_k': 0.7091080587999602, 'spread_hl_frac': 0.007548409123217539, 'bb_std_mult': 0.9044490956057025, 'rsi_os': 29, 'rsi_ob': 79, 'vol_spike': 0.21318668203830463, 'adx_thresh': 23.17561437686817, 'atr_min_pct': 0.006546270316872569, 'atr_max_pct': 0.10685977240023133, 'tp_mult': 2.745432371720572, 'tsl_mult': 0.26898274149498996, 'strategy': 'breakout', 'time_stop': 202, 'use_sma': False, 'use_atr': False, 'use_adx': True, 'use_ema': False, 'use_spike': False, 'rsi_required': False, 'edge_k': 0.5985161735008758, 'edge_cap': 0.9633473038985955, 'bull_strategy': 'breakout', 'bull_bb_std_mult': 0.8900460584341419, 'bull_rsi_os': 30, 'bull_rsi_ob': 93, 'bull_adx_thresh': 9.322862281189359, 'bull_atr_min_pct': 0.01887062540195945, 'bull_atr_max_pct': 0.11084651509721172, 'bull_tp_mult': 2.5292154600527037, 'bull_tsl_mult': 0.08431364607948272, 'bull_time_stop': 35, 'bull_use_sma': True, 'bull_use_ema': True, 'bull_use_atr': True, 'bull_use_adx': False, 'bull_use_spike': True, 'bull_rsi_required': False, 'bear_strategy': 'mean_reversion', 'bear_bb_std_mult': 2.1224301415408497, 'bear_rsi_os': 24, 'bear_rsi_ob': 75, 'bear_adx_thresh': 16.66317297011553, 'bear_atr_min_pct': 0.0033379848275090903, 'bear_atr_max_pct': 0.07704991445174342, 'bear_tp_mult': 2.660306719930306, 'bear_tsl_mult': 0.850166893551291, 'bear_time_stop': 168, 'bear_use_sma': True, 'bear_use_ema': False, 'bear_use_atr': True, 'bear_use_adx': True, 'bear_use_spike': False, 'bear_rsi_required': True, 'sideways_strategy': 'mean_reversion', 'sideways_bb_std_mult': 1.7749370410858878, 'sideways_rsi_os': 17, 'sideways_rsi_ob': 79, 'sideways_adx_thresh': 5.02345183880356, 'sideways_atr_min_pct': 0.02046824411914855, 'sideways_atr_max_pct': 0.12616860961821086, 'sideways_tp_mult': 1.534045952925888, 'sideways_tsl_mult': 0.7263286374211851, 'sideways_time_stop': 265, 'sideways_use_sma': True, 'sideways_use_ema': False, 'sideways_use_atr': True, 'sideways_use_adx': True, 'sideways_use_spike': False, 'sideways_rsi_required': True}.
[I 2025-08-30 16:21:12,051] Trial 732 finished with values: [-0.0052091617396645695, 0.005510453058458312] and parameters: {'p_sma': 8, 'p_std': 20, 'p_atr': 27, 'p_adx': 27, 'rsi_period': 12, 'ema1': 25, 'ema2': 35, 'slip_atr_k': 0.014474730111992644, 'slip_spread_k': 0.6129285857475445, 'spread_hl_frac': 0.008254837167912872, 'bb_std_mult': 0.6127352673278178, 'rsi_os': 29, 'rsi_ob': 47, 'vol_spike': 0.2915995596150125, 'adx_thresh': 9.375143738892055, 'atr_min_pct': 0.006855499293530666, 'atr_max_pct': 0.10499486827104788, 'tp_mult': 1.4198626154224123, 'tsl_mult': 0.25839708214264595, 'strategy': 'breakout', 'time_stop': 168, 'use_sma': True, 'use_atr': True, 'use_adx': False, 'use_ema': False, 'use_spike': True, 'rsi_required': False, 'edge_k': 0.5980084736087289, 'edge_cap': 0.9793193585878758, 'bull_strategy': 'breakout', 'bull_bb_std_mult': 1.7915729463872723, 'bull_rsi_os': 29, 'bull_rsi_ob': 87, 'bull_adx_thresh': 15.521872121263975, 'bull_atr_min_pct': 0.02568883904720604, 'bull_atr_max_pct': 0.10614326646830699, 'bull_tp_mult': 2.6539267910998032, 'bull_tsl_mult': 0.8866019215414158, 'bull_time_stop': 49, 'bull_use_sma': True, 'bull_use_ema': True, 'bull_use_atr': True, 'bull_use_adx': True, 'bull_use_spike': True, 'bull_rsi_required': False, 'bear_strategy': 'mean_reversion', 'bear_bb_std_mult': 1.6293087424267256, 'bear_rsi_os': 25, 'bear_rsi_ob': 52, 'bear_adx_thresh': 17.21687678840651, 'bear_atr_min_pct': 0.0014254457652485668, 'bear_atr_max_pct': 0.10638527724498884, 'bear_tp_mult': 2.5088677159091692, 'bear_tsl_mult': 0.8519409157244829, 'bear_time_stop': 93, 'bear_use_sma': True, 'bear_use_ema': False, 'bear_use_atr': False, 'bear_use_adx': True, 'bear_use_spike': True, 'bear_rsi_required': True, 'sideways_strategy': 'mean_reversion', 'sideways_bb_std_mult': 2.1787762165158004, 'sideways_rsi_os': 9, 'sideways_rsi_ob': 70, 'sideways_adx_thresh': 9.757727005665586, 'sideways_atr_min_pct': 0.02052130814312016, 'sideways_atr_max_pct': 0.14282866111591364, 'sideways_tp_mult': 1.5618733812617331, 'sideways_tsl_mult': 0.3811702913041149, 'sideways_time_stop': 229, 'sideways_use_sma': True, 'sideways_use_ema': False, 'sideways_use_atr': True, 'sideways_use_adx': False, 'sideways_use_spike': True, 'sideways_rsi_required': True}.
[I 2025-08-30 16:21:12,673] Trial 733 finished with values: [-1000000000.0, 1000000000.0] and parameters: {'p_sma': 7, 'p_std': 22, 'p_atr': 12, 'p_adx': 7, 'rsi_period': 47, 'ema1': 21, 'ema2': 35, 'slip_atr_k': 0.1921070709709588, 'slip_spread_k': 0.8480363916910854, 'spread_hl_frac': 0.007869122844080208, 'bb_std_mult': 0.6096415511180256, 'rsi_os': 40, 'rsi_ob': 77, 'vol_spike': 0.21208945091106282, 'adx_thresh': 29.399289592690245, 'atr_min_pct': 0.011454897846110097, 'atr_max_pct': 0.1036681924553126, 'tp_mult': 1.3936620991026551, 'tsl_mult': 0.8377444809411533, 'strategy': 'breakout', 'time_stop': 160, 'use_sma': False, 'use_atr': True, 'use_adx': False, 'use_ema': False, 'use_spike': True, 'rsi_required': False, 'edge_k': 0.6144604273118732, 'edge_cap': 0.4845702613420539, 'bull_strategy': 'breakout', 'bull_bb_std_mult': 1.6218858784828991, 'bull_rsi_os': 49, 'bull_rsi_ob': 87, 'bull_adx_thresh': 9.452335978624392, 'bull_atr_min_pct': 0.019823527507277748, 'bull_atr_max_pct': 0.10287722261862965, 'bull_tp_mult': 2.495538675095242, 'bull_tsl_mult': 0.01660874456389494, 'bull_time_stop': 33, 'bull_use_sma': True, 'bull_use_ema': True, 'bull_use_atr': True, 'bull_use_adx': True, 'bull_use_spike': True, 'bull_rsi_required': False, 'bear_strategy': 'mean_reversion', 'bear_bb_std_mult': 2.1777164350839953, 'bear_rsi_os': 25, 'bear_rsi_ob': 77, 'bear_adx_thresh': 24.008633964694226, 'bear_atr_min_pct': 0.003241598755056289, 'bear_atr_max_pct': 0.07637530922947305, 'bear_tp_mult': 2.6394866833490433, 'bear_tsl_mult': 0.0009915725829647837, 'bear_time_stop': 192, 'bear_use_sma': True, 'bear_use_ema': False, 'bear_use_atr': False, 'bear_use_adx': True, 'bear_use_spike': True, 'bear_rsi_required': True, 'sideways_strategy': 'mean_reversion', 'sideways_bb_std_mult': 0.8805569186971303, 'sideways_rsi_os': 29, 'sideways_rsi_ob': 70, 'sideways_adx_thresh': 8.815999665019339, 'sideways_atr_min_pct': 0.01954818994814812, 'sideways_atr_max_pct': 0.023720494575949484, 'sideways_tp_mult': 1.5573537270916675, 'sideways_tsl_mult': 0.35385830491350784, 'sideways_time_stop': 141, 'sideways_use_sma': True, 'sideways_use_ema': False, 'sideways_use_atr': True, 'sideways_use_adx': False, 'sideways_use_spike': True, 'sideways_rsi_required': True}.
[I 2025-08-30 16:21:13,378] Trial 731 finished with values: [-1000000000.0, 1000000000.0] and parameters: {'p_sma': 8, 'p_std': 20, 'p_atr': 30, 'p_adx': 7, 'rsi_period': 12, 'ema1': 22, 'ema2': 35, 'slip_atr_k': 8.197481251015211e-05, 'slip_spread_k': 0.7061502421367225, 'spread_hl_frac': 0.007856265461654445, 'bb_std_mult': 2.380818943510824, 'rsi_os': 30, 'rsi_ob': 50, 'vol_spike': 0.13681773187450202, 'adx_thresh': 9.24288742551861, 'atr_min_pct': 0.0069138571130588425, 'atr_max_pct': 0.10363663997595067, 'tp_mult': 1.4341067300504486, 'tsl_mult': 0.2693152461873659, 'strategy': 'breakout', 'time_stop': 168, 'use_sma': True, 'use_atr': True, 'use_adx': False, 'use_ema': False, 'use_spike': True, 'rsi_required': False, 'edge_k': 1.8816111442611643, 'edge_cap': 0.9866067153795943, 'bull_strategy': 'breakout', 'bull_bb_std_mult': 1.6050873514865036, 'bull_rsi_os': 29, 'bull_rsi_ob': 87, 'bull_adx_thresh': 15.513759231841451, 'bull_atr_min_pct': 0.003733707774055118, 'bull_atr_max_pct': 0.025298518417897584, 'bull_tp_mult': 2.490403037366503, 'bull_tsl_mult': 0.01445807642398067, 'bull_time_stop': 47, 'bull_use_sma': True, 'bull_use_ema': True, 'bull_use_atr': True, 'bull_use_adx': True, 'bull_use_spike': True, 'bull_rsi_required': False, 'bear_strategy': 'mean_reversion', 'bear_bb_std_mult': 1.6294462019556226, 'bear_rsi_os': 42, 'bear_rsi_ob': 77, 'bear_adx_thresh': 16.823018893354902, 'bear_atr_min_pct': 0.016435796809641467, 'bear_atr_max_pct': 0.10631099138610473, 'bear_tp_mult': 2.251060112485713, 'bear_tsl_mult': 0.8495702372356253, 'bear_time_stop': 94, 'bear_use_sma': True, 'bear_use_ema': False, 'bear_use_atr': False, 'bear_use_adx': True, 'bear_use_spike': True, 'bear_rsi_required': True, 'sideways_strategy': 'mean_reversion', 'sideways_bb_std_mult': 1.839943084280789, 'sideways_rsi_os': 9, 'sideways_rsi_ob': 79, 'sideways_adx_thresh': 9.918309433381816, 'sideways_atr_min_pct': 0.020343348051022975, 'sideways_atr_max_pct': 0.1428910878929559, 'sideways_tp_mult': 1.085490043272511, 'sideways_tsl_mult': 0.38804271185333045, 'sideways_time_stop': 127, 'sideways_use_sma': True, 'sideways_use_ema': False, 'sideways_use_atr': True, 'sideways_use_adx': False, 'sideways_use_spike': True, 'sideways_rsi_required': True}.
[I 2025-08-30 16:21:59,376] Trial 735 finished with values: [-1000000000.0, 1000000000.0] and parameters: {'p_sma': 7, 'p_std': 23, 'p_atr': 26, 'p_adx': 26, 'rsi_period': 12, 'ema1': 22, 'ema2': 35, 'slip_atr_k': 0.0040011316789063806, 'slip_spread_k': 0.684273723878209, 'spread_hl_frac': 0.008071911327311485, 'bb_std_mult': 0.5973281490053723, 'rsi_os': 25, 'rsi_ob': 50, 'vol_spike': 0.1354979201764428, 'adx_thresh': 24.742367824356535, 'atr_min_pct': 0.01040030606845313, 'atr_max_pct': 0.13577953641696777, 'tp_mult': 2.3178078731483587, 'tsl_mult': 0.4014161758807897, 'strategy': 'breakout', 'time_stop': 189, 'use_sma': False, 'use_atr': True, 'use_adx': False, 'use_ema': False, 'use_spike': True, 'rsi_required': True, 'edge_k': 0.6355316750110239, 'edge_cap': 0.904728966012896, 'bull_strategy': 'breakout', 'bull_bb_std_mult': 1.6117797157971907, 'bull_rsi_os': 49, 'bull_rsi_ob': 87, 'bull_adx_thresh': 5.992368024848144, 'bull_atr_min_pct': 0.02959483782837205, 'bull_atr_max_pct': 0.10132542093509914, 'bull_tp_mult': 2.6470022626426664, 'bull_tsl_mult': 0.15717905511831665, 'bull_time_stop': 60, 'bull_use_sma': True, 'bull_use_ema': True, 'bull_use_atr': True, 'bull_use_adx': True, 'bull_use_spike': True, 'bull_rsi_required': False, 'bear_strategy': 'mean_reversion', 'bear_bb_std_mult': 1.650688539563501, 'bear_rsi_os': 26, 'bear_rsi_ob': 52, 'bear_adx_thresh': 14.274846530487602, 'bear_atr_min_pct': 0.016439471236390377, 'bear_atr_max_pct': 0.13089617749170987, 'bear_tp_mult': 2.273461633453606, 'bear_tsl_mult': 0.16666959447214663, 'bear_time_stop': 189, 'bear_use_sma': True, 'bear_use_ema': False, 'bear_use_atr': False, 'bear_use_adx': True, 'bear_use_spike': True, 'bear_rsi_required': False, 'sideways_strategy': 'mean_reversion', 'sideways_bb_std_mult': 2.0902049541155283, 'sideways_rsi_os': 41, 'sideways_rsi_ob': 77, 'sideways_adx_thresh': 8.68515676840868, 'sideways_atr_min_pct': 0.012645515654280154, 'sideways_atr_max_pct': 0.07066004418549894, 'sideways_tp_mult': 1.3246149289559415, 'sideways_tsl_mult': 0.35496408729209183, 'sideways_time_stop': 143, 'sideways_use_sma': True, 'sideways_use_ema': False, 'sideways_use_atr': True, 'sideways_use_adx': False, 'sideways_use_spike': True, 'sideways_rsi_required': True}.
[I 2025-08-30 16:22:00,007] Trial 736 finished with values: [-1000000000.0, 1000000000.0] and parameters: {'p_sma': 37, 'p_std': 23, 'p_atr': 12, 'p_adx': 16, 'rsi_period': 12, 'ema1': 8, 'ema2': 35, 'slip_atr_k': 0.00018323286186152615, 'slip_spread_k': 0.6452508959603553, 'spread_hl_frac': 0.008285238148340684, 'bb_std_mult': 0.5750613399953135, 'rsi_os': 25, 'rsi_ob': 50, 'vol_spike': 0.1354892648662335, 'adx_thresh': 9.189284946234595, 'atr_min_pct': 0.006944527164137747, 'atr_max_pct': 0.11244760103555722, 'tp_mult': 2.030233754732627, 'tsl_mult': 0.39555506665442236, 'strategy': 'breakout', 'time_stop': 58, 'use_sma': True, 'use_atr': True, 'use_adx': False, 'use_ema': False, 'use_spike': True, 'rsi_required': True, 'edge_k': 0.558644942658377, 'edge_cap': 0.9871180003525283, 'bull_strategy': 'breakout', 'bull_bb_std_mult': 1.7878956189548116, 'bull_rsi_os': 51, 'bull_rsi_ob': 87, 'bull_adx_thresh': 10.127731115363549, 'bull_atr_min_pct': 0.009143574260543328, 'bull_atr_max_pct': 0.10679194685025338, 'bull_tp_mult': 2.65722631184305, 'bull_tsl_mult': 0.5688496066149831, 'bull_time_stop': 234, 'bull_use_sma': True, 'bull_use_ema': True, 'bull_use_atr': True, 'bull_use_adx': True, 'bull_use_spike': True, 'bull_rsi_required': False, 'bear_strategy': 'mean_reversion', 'bear_bb_std_mult': 1.654673569012589, 'bear_rsi_os': 54, 'bear_rsi_ob': 57, 'bear_adx_thresh': 12.328172023630605, 'bear_atr_min_pct': 0.005466622166140224, 'bear_atr_max_pct': 0.12213921168884387, 'bear_tp_mult': 2.5101866368089576, 'bear_tsl_mult': 0.7526998279269221, 'bear_time_stop': 5, 'bear_use_sma': True, 'bear_use_ema': False, 'bear_use_atr': False, 'bear_use_adx': True, 'bear_use_spike': True, 'bear_rsi_required': False, 'sideways_strategy': 'mean_reversion', 'sideways_bb_std_mult': 2.177460145361508, 'sideways_rsi_os': 12, 'sideways_rsi_ob': 78, 'sideways_adx_thresh': 21.905180816425684, 'sideways_atr_min_pct': 0.019627499681267518, 'sideways_atr_max_pct': 0.07189023634052066, 'sideways_tp_mult': 2.5275730468094446, 'sideways_tsl_mult': 0.4851213291083888, 'sideways_time_stop': 129, 'sideways_use_sma': True, 'sideways_use_ema': False, 'sideways_use_atr': True, 'sideways_use_adx': False, 'sideways_use_spike': True, 'sideways_rsi_required': True}.
[I 2025-08-30 16:22:00,804] Trial 734 finished with values: [-0.006083343590800205, 0.006122031644782067] and parameters: {'p_sma': 37, 'p_std': 23, 'p_atr': 8, 'p_adx': 26, 'rsi_period': 12, 'ema1': 25, 'ema2': 35, 'slip_atr_k': 0.0002962189041454816, 'slip_spread_k': 0.17657643975798903, 'spread_hl_frac': 0.008232772866649009, 'bb_std_mult': 0.5811465779133057, 'rsi_os': 11, 'rsi_ob': 50, 'vol_spike': 0.2905536090076639, 'adx_thresh': 9.08563268267853, 'atr_min_pct': 0.006848098965655629, 'atr_max_pct': 0.1130347024023037, 'tp_mult': 1.4151869693140888, 'tsl_mult': 0.8457916416679119, 'strategy': 'breakout', 'time_stop': 158, 'use_sma': False, 'use_atr': True, 'use_adx': False, 'use_ema': False, 'use_spike': True, 'rsi_required': True, 'edge_k': 1.3158048232114217, 'edge_cap': 0.0504746273737135, 'bull_strategy': 'breakout', 'bull_bb_std_mult': 1.615063488721165, 'bull_rsi_os': 49, 'bull_rsi_ob': 87, 'bull_adx_thresh': 34.9802109174981, 'bull_atr_min_pct': 0.004103864800307383, 'bull_atr_max_pct': 0.10176607428915967, 'bull_tp_mult': 2.655975434064161, 'bull_tsl_mult': 0.5779718279152347, 'bull_time_stop': 235, 'bull_use_sma': True, 'bull_use_ema': True, 'bull_use_atr': True, 'bull_use_adx': True, 'bull_use_spike': True, 'bull_rsi_required': False, 'bear_strategy': 'mean_reversion', 'bear_bb_std_mult': 2.4976013121337086, 'bear_rsi_os': 26, 'bear_rsi_ob': 52, 'bear_adx_thresh': 24.086287949443054, 'bear_atr_min_pct': 0.0023803697241824157, 'bear_atr_max_pct': 0.10540149602473466, 'bear_tp_mult': 2.6217849327850504, 'bear_tsl_mult': 0.744933651222732, 'bear_time_stop': 92, 'bear_use_sma': True, 'bear_use_ema': False, 'bear_use_atr': False, 'bear_use_adx': True, 'bear_use_spike': True, 'bear_rsi_required': False, 'sideways_strategy': 'mean_reversion', 'sideways_bb_std_mult': 3.121372214590732, 'sideways_rsi_os': 41, 'sideways_rsi_ob': 79, 'sideways_adx_thresh': 31.901080857663658, 'sideways_atr_min_pct': 0.019836489733717926, 'sideways_atr_max_pct': 0.0719862080569042, 'sideways_tp_mult': 2.5527784894428933, 'sideways_tsl_mult': 0.28683177561559303, 'sideways_time_stop': 127, 'sideways_use_sma': True, 'sideways_use_ema': False, 'sideways_use_atr': True, 'sideways_use_adx': False, 'sideways_use_spike': True, 'sideways_rsi_required': True}.
[I 2025-08-30 16:22:00,805] Trial 737 finished with values: [-0.04880945616343402, 0.04866831611148434] and parameters: {'p_sma': 37, 'p_std': 22, 'p_atr': 12, 'p_adx': 26, 'rsi_period': 10, 'ema1': 20, 'ema2': 56, 'slip_atr_k': 0.2006522484427651, 'slip_spread_k': 0.35384085656517217, 'spread_hl_frac': 0.00691730657564808, 'bb_std_mult': 0.5938411176339785, 'rsi_os': 25, 'rsi_ob': 57, 'vol_spike': 0.221224632295441, 'adx_thresh': 21.707938271063572, 'atr_min_pct': 0.019328104217643943, 'atr_max_pct': 0.11273773036530432, 'tp_mult': 1.5156484208680152, 'tsl_mult': 0.39236413566890804, 'strategy': 'breakout', 'time_stop': 147, 'use_sma': False, 'use_atr': False, 'use_adx': True, 'use_ema': False, 'use_spike': False, 'rsi_required': True, 'edge_k': 0.10656170947626531, 'edge_cap': 0.1690078115217059, 'bull_strategy': 'breakout', 'bull_bb_std_mult': 1.6916050897472854, 'bull_rsi_os': 51, 'bull_rsi_ob': 56, 'bull_adx_thresh': 7.64691706268153, 'bull_atr_min_pct': 0.0267667861456553, 'bull_atr_max_pct': 0.10636299752751353, 'bull_tp_mult': 2.0372537914293707, 'bull_tsl_mult': 0.5757010285248745, 'bull_time_stop': 16, 'bull_use_sma': True, 'bull_use_ema': True, 'bull_use_atr': True, 'bull_use_adx': True, 'bull_use_spike': True, 'bull_rsi_required': False, 'bear_strategy': 'mean_reversion', 'bear_bb_std_mult': 2.0908745157240776, 'bear_rsi_os': 26, 'bear_rsi_ob': 59, 'bear_adx_thresh': 14.385832822451183, 'bear_atr_min_pct': 0.001430156229911785, 'bear_atr_max_pct': 0.10977519112450795, 'bear_tp_mult': 2.517293489233431, 'bear_tsl_mult': 0.23467761236370793, 'bear_time_stop': 72, 'bear_use_sma': True, 'bear_use_ema': False, 'bear_use_atr': True, 'bear_use_adx': True, 'bear_use_spike': True, 'bear_rsi_required': False, 'sideways_strategy': 'mean_reversion', 'sideways_bb_std_mult': 2.966652893570446, 'sideways_rsi_os': 12, 'sideways_rsi_ob': 67, 'sideways_adx_thresh': 10.229975544156593, 'sideways_atr_min_pct': 0.003067156300453986, 'sideways_atr_max_pct': 0.0355578899776519, 'sideways_tp_mult': 1.4719706300923279, 'sideways_tsl_mult': 0.3738959952730833, 'sideways_time_stop': 133, 'sideways_use_sma': True, 'sideways_use_ema': False, 'sideways_use_atr': True, 'sideways_use_adx': True, 'sideways_use_spike': True, 'sideways_rsi_required': True}.
