[I 2025-08-30 16:22:45,356] Trial 738 finished with values: [-1000000000.0, 1000000000.0] and parameters: {'p_sma': 37, 'p_std': 22, 'p_atr': 12, 'p_adx': 18, 'rsi_period': 10, 'ema1': 20, 'ema2': 39, 'slip_atr_k': 0.0002429637296446068, 'slip_spread_k': 0.5099225283775194, 'spread_hl_frac': 0.04474049712295262, 'bb_std_mult': 1.3228094880728718, 'rsi_os': 27, 'rsi_ob': 54, 'vol_spike': 0.22325422735559985, 'adx_thresh': 8.089240088497217, 'atr_min_pct': 0.01934333449917482, 'atr_max_pct': 0.14054733151855864, 'tp_mult': 1.499212907726753, 'tsl_mult': 0.34796933910502387, 'strategy': 'breakout', 'time_stop': 28, 'use_sma': False, 'use_atr': False, 'use_adx': True, 'use_ema': False, 'use_spike': False, 'rsi_required': True, 'edge_k': 0.5138057082664645, 'edge_cap': 0.08086541243895756, 'bull_strategy': 'breakout', 'bull_bb_std_mult': 1.7877378540735178, 'bull_rsi_os': 51, 'bull_rsi_ob': 66, 'bull_adx_thresh': 10.082261479917355, 'bull_atr_min_pct': 0.006229226593790655, 'bull_atr_max_pct': 0.10667572409970977, 'bull_tp_mult': 2.584536151457369, 'bull_tsl_mult': 0.7056124078727521, 'bull_time_stop': 53, 'bull_use_sma': True, 'bull_use_ema': True, 'bull_use_atr': True, 'bull_use_adx': True, 'bull_use_spike': True, 'bull_rsi_required': False, 'bear_strategy': 'mean_reversion', 'bear_bb_std_mult': 2.0812032693489098, 'bear_rsi_os': 28, 'bear_rsi_ob': 59, 'bear_adx_thresh': 15.858877308945704, 'bear_atr_min_pct': 0.005275379974178117, 'bear_atr_max_pct': 0.1277679494717408, 'bear_tp_mult': 2.796426316558978, 'bear_tsl_mult': 0.8922096794581267, 'bear_time_stop': 76, 'bear_use_sma': True, 'bear_use_ema': False, 'bear_use_atr': True, 'bear_use_adx': True, 'bear_use_spike': True, 'bear_rsi_required': False, 'sideways_strategy': 'mean_reversion', 'sideways_bb_std_mult': 2.9221670998177127, 'sideways_rsi_os': 12, 'sideways_rsi_ob': 78, 'sideways_adx_thresh': 23.20668212725761, 'sideways_atr_min_pct': 0.01958484953131455, 'sideways_atr_max_pct': 0.12002361047305202, 'sideways_tp_mult': 2.54053935927644, 'sideways_tsl_mult': 0.491054068899316, 'sideways_time_stop': 133, 'sideways_use_sma': True, 'sideways_use_ema': True, 'sideways_use_atr': True, 'sideways_use_adx': True, 'sideways_use_spike': True, 'sideways_rsi_required': True}.
[I 2025-08-30 16:22:45,803] Trial 740 finished with values: [-1000000000.0, 1000000000.0] and parameters: {'p_sma': 29, 'p_std': 19, 'p_atr': 13, 'p_adx': 24, 'rsi_period': 8, 'ema1': 14, 'ema2': 41, 'slip_atr_k': 0.16321448568265545, 'slip_spread_k': 0.8171364434485091, 'spread_hl_frac': 0.004438998906906652, 'bb_std_mult': 0.5017332927682888, 'rsi_os': 27, 'rsi_ob': 73, 'vol_spike': 0.2062486564341392, 'adx_thresh': 8.146087162695999, 'atr_min_pct': 0.026681007329792956, 'atr_max_pct': 0.1465847777366787, 'tp_mult': 2.5991041395647967, 'tsl_mult': 0.3487762780206539, 'strategy': 'breakout', 'time_stop': 152, 'use_sma': False, 'use_atr': False, 'use_adx': True, 'use_ema': True, 'use_spike': False, 'rsi_required': False, 'edge_k': 0.5191067849872535, 'edge_cap': 0.7389432050650253, 'bull_strategy': 'mean_reversion', 'bull_bb_std_mult': 1.7435092859462362, 'bull_rsi_os': 47, 'bull_rsi_ob': 65, 'bull_adx_thresh': 16.693846682879666, 'bull_atr_min_pct': 0.0193116134582581, 'bull_atr_max_pct': 0.09604942475304537, 'bull_tp_mult': 2.5755078658232393, 'bull_tsl_mult': 0.8575880175406204, 'bull_time_stop': 54, 'bull_use_sma': True, 'bull_use_ema': True, 'bull_use_atr': False, 'bull_use_adx': True, 'bull_use_spike': False, 'bull_rsi_required': True, 'bear_strategy': 'breakout', 'bear_bb_std_mult': 2.068964275646989, 'bear_rsi_os': 28, 'bear_rsi_ob': 86, 'bear_adx_thresh': 15.748177791281405, 'bear_atr_min_pct': 0.015470682452568284, 'bear_atr_max_pct': 0.11031034456483636, 'bear_tp_mult': 2.5686994522984445, 'bear_tsl_mult': 0.40858208230390614, 'bear_time_stop': 81, 'bear_use_sma': True, 'bear_use_ema': False, 'bear_use_atr': True, 'bear_use_adx': True, 'bear_use_spike': True, 'bear_rsi_required': True, 'sideways_strategy': 'breakout', 'sideways_bb_std_mult': 2.595460068067692, 'sideways_rsi_os': 19, 'sideways_rsi_ob': 46, 'sideways_adx_thresh': 23.194620257020123, 'sideways_atr_min_pct': 0.02111486293726408, 'sideways_atr_max_pct': 0.07561737392672417, 'sideways_tp_mult': 1.3434760334718463, 'sideways_tsl_mult': 0.5955092557411799, 'sideways_time_stop': 134, 'sideways_use_sma': False, 'sideways_use_ema': True, 'sideways_use_atr': True, 'sideways_use_adx': True, 'sideways_use_spike': True, 'sideways_rsi_required': True}.
[I 2025-08-30 16:22:46,838] Trial 741 finished with values: [-1000000000.0, 1000000000.0] and parameters: {'p_sma': 11, 'p_std': 44, 'p_atr': 13, 'p_adx': 19, 'rsi_period': 63, 'ema1': 14, 'ema2': 41, 'slip_atr_k': 0.1641222478381306, 'slip_spread_k': 0.5696915849310619, 'spread_hl_frac': 0.0038301647349809342, 'bb_std_mult': 2.1037005415460515, 'rsi_os': 27, 'rsi_ob': 84, 'vol_spike': 0.18326765734765454, 'adx_thresh': 7.879450479571275, 'atr_min_pct': 0.005606332275423804, 'atr_max_pct': 0.11905910487753857, 'tp_mult': 1.919334157624459, 'tsl_mult': 0.3445081125255531, 'strategy': 'breakout', 'time_stop': 151, 'use_sma': False, 'use_atr': False, 'use_adx': True, 'use_ema': True, 'use_spike': False, 'rsi_required': False, 'edge_k': 1.0980024627739866, 'edge_cap': 0.9985818909593613, 'bull_strategy': 'mean_reversion', 'bull_bb_std_mult': 1.7443048308230156, 'bull_rsi_os': 47, 'bull_rsi_ob': 88, 'bull_adx_thresh': 8.892687961148061, 'bull_atr_min_pct': 0.01472333479219091, 'bull_atr_max_pct': 0.10292380591945166, 'bull_tp_mult': 2.583151707087919, 'bull_tsl_mult': 0.8538762955414874, 'bull_time_stop': 53, 'bull_use_sma': True, 'bull_use_ema': True, 'bull_use_atr': False, 'bull_use_adx': True, 'bull_use_spike': False, 'bull_rsi_required': True, 'bear_strategy': 'breakout', 'bear_bb_std_mult': 2.0877559645894666, 'bear_rsi_os': 40, 'bear_rsi_ob': 64, 'bear_adx_thresh': 32.66021018712126, 'bear_atr_min_pct': 0.015604273900940534, 'bear_atr_max_pct': 0.09969602961695558, 'bear_tp_mult': 2.8023602590913885, 'bear_tsl_mult': 0.10134468911588357, 'bear_time_stop': 82, 'bear_use_sma': True, 'bear_use_ema': False, 'bear_use_atr': True, 'bear_use_adx': True, 'bear_use_spike': True, 'bear_rsi_required': True, 'sideways_strategy': 'breakout', 'sideways_bb_std_mult': 2.788782182270336, 'sideways_rsi_os': 43, 'sideways_rsi_ob': 84, 'sideways_adx_thresh': 23.028382170359226, 'sideways_atr_min_pct': 0.02559375871751926, 'sideways_atr_max_pct': 0.07518918673554231, 'sideways_tp_mult': 1.3540144763797382, 'sideways_tsl_mult': 0.4024670962803581, 'sideways_time_stop': 32, 'sideways_use_sma': False, 'sideways_use_ema': True, 'sideways_use_atr': True, 'sideways_use_adx': True, 'sideways_use_spike': True, 'sideways_rsi_required': True}.
[I 2025-08-30 16:22:47,645] Trial 739 finished with values: [-1000000000.0, 1000000000.0] and parameters: {'p_sma': 50, 'p_std': 44, 'p_atr': 13, 'p_adx': 19, 'rsi_period': 10, 'ema1': 20, 'ema2': 24, 'slip_atr_k': 0.012866314533020569, 'slip_spread_k': 0.5689919939795489, 'spread_hl_frac': 0.03610673868851187, 'bb_std_mult': 0.6879320254358743, 'rsi_os': 27, 'rsi_ob': 84, 'vol_spike': 0.22362414823738583, 'adx_thresh': 26.417318688742494, 'atr_min_pct': 0.005594360921806171, 'atr_max_pct': 0.12606374512249693, 'tp_mult': 2.599293942392217, 'tsl_mult': 0.3405789130501456, 'strategy': 'breakout', 'time_stop': 151, 'use_sma': False, 'use_atr': False, 'use_adx': True, 'use_ema': False, 'use_spike': False, 'rsi_required': False, 'edge_k': 0.5796330923101434, 'edge_cap': 0.06787892905952575, 'bull_strategy': 'breakout', 'bull_bb_std_mult': 1.681035500252065, 'bull_rsi_os': 47, 'bull_rsi_ob': 88, 'bull_adx_thresh': 7.984775970789341, 'bull_atr_min_pct': 0.0060266291297149995, 'bull_atr_max_pct': 0.10513690210198072, 'bull_tp_mult': 2.593062674185372, 'bull_tsl_mult': 0.36318506468546086, 'bull_time_stop': 41, 'bull_use_sma': True, 'bull_use_ema': True, 'bull_use_atr': True, 'bull_use_adx': True, 'bull_use_spike': True, 'bull_rsi_required': True, 'bear_strategy': 'mean_reversion', 'bear_bb_std_mult': 2.0658501643507408, 'bear_rsi_os': 20, 'bear_rsi_ob': 93, 'bear_adx_thresh': 32.6085222454455, 'bear_atr_min_pct': 0.018288594486000682, 'bear_atr_max_pct': 0.12775722478053195, 'bear_tp_mult': 1.7395623219338552, 'bear_tsl_mult': 0.09723357882198108, 'bear_time_stop': 69, 'bear_use_sma': True, 'bear_use_ema': False, 'bear_use_atr': True, 'bear_use_adx': True, 'bear_use_spike': True, 'bear_rsi_required': True, 'sideways_strategy': 'breakout', 'sideways_bb_std_mult': 2.969688684826307, 'sideways_rsi_os': 51, 'sideways_rsi_ob': 67, 'sideways_adx_thresh': 31.899934186488608, 'sideways_atr_min_pct': 0.021352366468244472, 'sideways_atr_max_pct': 0.07904113766417296, 'sideways_tp_mult': 1.4743361566342044, 'sideways_tsl_mult': 0.40277187069815334, 'sideways_time_stop': 159, 'sideways_use_sma': False, 'sideways_use_ema': True, 'sideways_use_atr': True, 'sideways_use_adx': True, 'sideways_use_spike': True, 'sideways_rsi_required': True}.
[I 2025-08-30 16:22:48,723] Trial 745 finished with values: [-1000000000.0, 1000000000.0] and parameters: {'p_sma': 8, 'p_std': 21, 'p_atr': 27, 'p_adx': 20, 'rsi_period': 38, 'ema1': 29, 'ema2': 33, 'slip_atr_k': 0.005608328827952719, 'slip_spread_k': 0.7447036992845293, 'spread_hl_frac': 0.005533050222470675, 'bb_std_mult': 1.4169178470910622, 'rsi_os': 52, 'rsi_ob': 82, 'vol_spike': 0.11177320541942079, 'adx_thresh': 8.548189685975865, 'atr_min_pct': 0.005155354530877622, 'atr_max_pct': 0.11684661954735034, 'tp_mult': 1.634092288184925, 'tsl_mult': 0.9716295524652339, 'strategy': 'mean_reversion', 'time_stop': 163, 'use_sma': True, 'use_atr': False, 'use_adx': True, 'use_ema': False, 'use_spike': False, 'rsi_required': False, 'edge_k': 0.7029108850230834, 'edge_cap': 0.30301450969091315, 'bull_strategy': 'breakout', 'bull_bb_std_mult': 1.5408721795641243, 'bull_rsi_os': 50, 'bull_rsi_ob': 62, 'bull_adx_thresh': 9.62862754741756, 'bull_atr_min_pct': 0.01811687387818254, 'bull_atr_max_pct': 0.11408229757760013, 'bull_tp_mult': 1.8651272397386915, 'bull_tsl_mult': 0.4065174735548174, 'bull_time_stop': 90, 'bull_use_sma': False, 'bull_use_ema': False, 'bull_use_atr': True, 'bull_use_adx': True, 'bull_use_spike': True, 'bull_rsi_required': False, 'bear_strategy': 'mean_reversion', 'bear_bb_std_mult': 1.5919837376191786, 'bear_rsi_os': 29, 'bear_rsi_ob': 66, 'bear_adx_thresh': 25.473840167327296, 'bear_atr_min_pct': 0.002437780734216651, 'bear_atr_max_pct': 0.10744659168835732, 'bear_tp_mult': 2.707848056346364, 'bear_tsl_mult': 0.8454370226384316, 'bear_time_stop': 97, 'bear_use_sma': False, 'bear_use_ema': True, 'bear_use_atr': True, 'bear_use_adx': False, 'bear_use_spike': False, 'bear_rsi_required': True, 'sideways_strategy': 'mean_reversion', 'sideways_bb_std_mult': 3.379022945755666, 'sideways_rsi_os': 16, 'sideways_rsi_ob': 82, 'sideways_adx_thresh': 9.473095016998021, 'sideways_atr_min_pct': 0.015229017797069035, 'sideways_atr_max_pct': 0.0603013555289446, 'sideways_tp_mult': 1.3840015332899955, 'sideways_tsl_mult': 0.37251604463701254, 'sideways_time_stop': 151, 'sideways_use_sma': True, 'sideways_use_ema': False, 'sideways_use_atr': False, 'sideways_use_adx': True, 'sideways_use_spike': False, 'sideways_rsi_required': False}.
[I 2025-08-30 16:23:30,016] Trial 743 finished with values: [-1000000000.0, 1000000000.0] and parameters: {'p_sma': 46, 'p_std': 21, 'p_atr': 9, 'p_adx': 25, 'rsi_period': 8, 'ema1': 27, 'ema2': 37, 'slip_atr_k': 0.011057150326774548, 'slip_spread_k': 0.8701743657010463, 'spread_hl_frac': 0.04086670721584047, 'bb_std_mult': 0.6950197646320555, 'rsi_os': 28, 'rsi_ob': 85, 'vol_spike': 0.20177408812852704, 'adx_thresh': 6.749378973900663, 'atr_min_pct': 0.005248867016502565, 'atr_max_pct': 0.11682814426832033, 'tp_mult': 1.5677822454702617, 'tsl_mult': 0.6052369008217339, 'strategy': 'breakout', 'time_stop': 162, 'use_sma': False, 'use_atr': False, 'use_adx': True, 'use_ema': False, 'use_spike': False, 'rsi_required': False, 'edge_k': 0.5820483007842455, 'edge_cap': 0.9829949230239944, 'bull_strategy': 'breakout', 'bull_bb_std_mult': 1.6948552303513476, 'bull_rsi_os': 19, 'bull_rsi_ob': 72, 'bull_adx_thresh': 17.944821081789044, 'bull_atr_min_pct': 0.014737683103143086, 'bull_atr_max_pct': 0.10365569377645868, 'bull_tp_mult': 2.114633815220351, 'bull_tsl_mult': 0.8883634047704294, 'bull_time_stop': 39, 'bull_use_sma': True, 'bull_use_ema': False, 'bull_use_atr': True, 'bull_use_adx': True, 'bull_use_spike': True, 'bull_rsi_required': True, 'bear_strategy': 'mean_reversion', 'bear_bb_std_mult': 1.6749596834023917, 'bear_rsi_os': 48, 'bear_rsi_ob': 94, 'bear_adx_thresh': 18.220401428905245, 'bear_atr_min_pct': 0.01835985072521668, 'bear_atr_max_pct': 0.09933900033709081, 'bear_tp_mult': 2.6983104892366585, 'bear_tsl_mult': 0.8459797931260992, 'bear_time_stop': 88, 'bear_use_sma': True, 'bear_use_ema': True, 'bear_use_atr': True, 'bear_use_adx': False, 'bear_use_spike': True, 'bear_rsi_required': True, 'sideways_strategy': 'breakout', 'sideways_bb_std_mult': 3.37539903852606, 'sideways_rsi_os': 43, 'sideways_rsi_ob': 82, 'sideways_adx_thresh': 12.97157785782062, 'sideways_atr_min_pct': 0.015145105572516105, 'sideways_atr_max_pct': 0.07827975943782796, 'sideways_tp_mult': 1.402872698917366, 'sideways_tsl_mult': 0.3857205566795481, 'sideways_time_stop': 157, 'sideways_use_sma': False, 'sideways_use_ema': False, 'sideways_use_atr': False, 'sideways_use_adx': True, 'sideways_use_spike': True, 'sideways_rsi_required': True}.
[I 2025-08-30 16:23:30,806] Trial 742 finished with values: [-1000000000.0, 1000000000.0] and parameters: {'p_sma': 10, 'p_std': 52, 'p_atr': 11, 'p_adx': 24, 'rsi_period': 65, 'ema1': 18, 'ema2': 37, 'slip_atr_k': 0.006308503791187485, 'slip_spread_k': 0.7381918741367745, 'spread_hl_frac': 0.00398687710637551, 'bb_std_mult': 0.6768906541966743, 'rsi_os': 29, 'rsi_ob': 88, 'vol_spike': 0.20449235557374723, 'adx_thresh': 34.95047296503819, 'atr_min_pct': 0.005184224561217733, 'atr_max_pct': 0.11673225682435949, 'tp_mult': 1.6275740424772176, 'tsl_mult': 0.32923531966822217, 'strategy': 'breakout', 'time_stop': 150, 'use_sma': False, 'use_atr': False, 'use_adx': True, 'use_ema': True, 'use_spike': False, 'rsi_required': False, 'edge_k': 0.5700874755268367, 'edge_cap': 0.9814773234129325, 'bull_strategy': 'mean_reversion', 'bull_bb_std_mult': 1.7059783178645718, 'bull_rsi_os': 46, 'bull_rsi_ob': 72, 'bull_adx_thresh': 8.675809035153934, 'bull_atr_min_pct': 0.014986704503484074, 'bull_atr_max_pct': 0.09599016772514443, 'bull_tp_mult': 2.6024915654545544, 'bull_tsl_mult': 0.9209731143174089, 'bull_time_stop': 41, 'bull_use_sma': True, 'bull_use_ema': True, 'bull_use_atr': False, 'bull_use_adx': True, 'bull_use_spike': False, 'bull_rsi_required': True, 'bear_strategy': 'breakout', 'bear_bb_std_mult': 1.6805415721106742, 'bear_rsi_os': 48, 'bear_rsi_ob': 94, 'bear_adx_thresh': 25.42881606095017, 'bear_atr_min_pct': 0.004309601794316862, 'bear_atr_max_pct': 0.10955278682542235, 'bear_tp_mult': 2.7087103197051565, 'bear_tsl_mult': 0.25672156505179, 'bear_time_stop': 212, 'bear_use_sma': True, 'bear_use_ema': False, 'bear_use_atr': True, 'bear_use_adx': True, 'bear_use_spike': True, 'bear_rsi_required': True, 'sideways_strategy': 'breakout', 'sideways_bb_std_mult': 3.372743334547284, 'sideways_rsi_os': 43, 'sideways_rsi_ob': 84, 'sideways_adx_thresh': 24.451086209698843, 'sideways_atr_min_pct': 0.021202374923573665, 'sideways_atr_max_pct': 0.07979371888184392, 'sideways_tp_mult': 1.3430166784139854, 'sideways_tsl_mult': 0.4038425870693422, 'sideways_time_stop': 153, 'sideways_use_sma': False, 'sideways_use_ema': True, 'sideways_use_atr': True, 'sideways_use_adx': True, 'sideways_use_spike': True, 'sideways_rsi_required': True}.
[I 2025-08-30 16:23:31,430] Trial 746 finished with values: [-0.01281427071920882, 0.012793335389363942] and parameters: {'p_sma': 58, 'p_std': 52, 'p_atr': 9, 'p_adx': 12, 'rsi_period': 17, 'ema1': 23, 'ema2': 37, 'slip_atr_k': 0.06487204627021333, 'slip_spread_k': 0.6861924534791098, 'spread_hl_frac': 0.006726535613156621, 'bb_std_mult': 0.5015905235858276, 'rsi_os': 26, 'rsi_ob': 87, 'vol_spike': 0.20977089752873487, 'adx_thresh': 9.992341321454278, 'atr_min_pct': 0.01594435527071404, 'atr_max_pct': 0.11563862680916782, 'tp_mult': 2.8874025205512837, 'tsl_mult': 0.1781628996520504, 'strategy': 'breakout', 'time_stop': 158, 'use_sma': False, 'use_atr': False, 'use_adx': True, 'use_ema': False, 'use_spike': False, 'rsi_required': False, 'edge_k': 0.9167611063947925, 'edge_cap': 0.9396669478012478, 'bull_strategy': 'breakout', 'bull_bb_std_mult': 1.5525414918953184, 'bull_rsi_os': 19, 'bull_rsi_ob': 51, 'bull_adx_thresh': 9.070154306868787, 'bull_atr_min_pct': 0.020325460895163867, 'bull_atr_max_pct': 0.06125264015610587, 'bull_tp_mult': 2.133380794001945, 'bull_tsl_mult': 0.7944457436083698, 'bull_time_stop': 62, 'bull_use_sma': True, 'bull_use_ema': True, 'bull_use_atr': True, 'bull_use_adx': False, 'bull_use_spike': True, 'bull_rsi_required': False, 'bear_strategy': 'mean_reversion', 'bear_bb_std_mult': 1.6586883818293618, 'bear_rsi_os': 48, 'bear_rsi_ob': 62, 'bear_adx_thresh': 15.692773717499659, 'bear_atr_min_pct': 0.00419648963157568, 'bear_atr_max_pct': 0.11222642889058591, 'bear_tp_mult': 2.677664808437843, 'bear_tsl_mult': 0.3110133644865449, 'bear_time_stop': 89, 'bear_use_sma': True, 'bear_use_ema': False, 'bear_use_atr': True, 'bear_use_adx': True, 'bear_use_spike': True, 'bear_rsi_required': True, 'sideways_strategy': 'mean_reversion', 'sideways_bb_std_mult': 1.6617313731475756, 'sideways_rsi_os': 6, 'sideways_rsi_ob': 94, 'sideways_adx_thresh': 12.393719990725133, 'sideways_atr_min_pct': 0.018629048230329636, 'sideways_atr_max_pct': 0.07018008035625499, 'sideways_tp_mult': 2.7815507606249534, 'sideways_tsl_mult': 0.8332758052510233, 'sideways_time_stop': 110, 'sideways_use_sma': True, 'sideways_use_ema': False, 'sideways_use_atr': True, 'sideways_use_adx': True, 'sideways_use_spike': True, 'sideways_rsi_required': True}.
[I 2025-08-30 16:23:31,857] Trial 744 finished with values: [-1000000000.0, 1000000000.0] and parameters: {'p_sma': 8, 'p_std': 21, 'p_atr': 11, 'p_adx': 12, 'rsi_period': 68, 'ema1': 23, 'ema2': 23, 'slip_atr_k': 0.08945699268435134, 'slip_spread_k': 0.6106888184093411, 'spread_hl_frac': 0.040994839965206684, 'bb_std_mult': 0.6523176036606081, 'rsi_os': 29, 'rsi_ob': 59, 'vol_spike': 0.20076378752966492, 'adx_thresh': 11.022631448198176, 'atr_min_pct': 0.005308250664338387, 'atr_max_pct': 0.11643082746843941, 'tp_mult': 2.062434629769812, 'tsl_mult': 0.3140091900848682, 'strategy': 'mean_reversion', 'time_stop': 11, 'use_sma': True, 'use_atr': False, 'use_adx': True, 'use_ema': False, 'use_spike': False, 'rsi_required': False, 'edge_k': 0.7056429344936781, 'edge_cap': 0.907317740887123, 'bull_strategy': 'breakout', 'bull_bb_std_mult': 1.5523917996489958, 'bull_rsi_os': 19, 'bull_rsi_ob': 62, 'bull_adx_thresh': 18.828523293425064, 'bull_atr_min_pct': 0.018163252559454515, 'bull_atr_max_pct': 0.07338663690335347, 'bull_tp_mult': 1.654600068105187, 'bull_tsl_mult': 0.8877098811753084, 'bull_time_stop': 87, 'bull_use_sma': False, 'bull_use_ema': False, 'bull_use_atr': True, 'bull_use_adx': True, 'bull_use_spike': True, 'bull_rsi_required': False, 'bear_strategy': 'mean_reversion', 'bear_bb_std_mult': 1.6626577746565983, 'bear_rsi_os': 48, 'bear_rsi_ob': 66, 'bear_adx_thresh': 15.639999567271735, 'bear_atr_min_pct': 0.003901494053751147, 'bear_atr_max_pct': 0.11231992287195577, 'bear_tp_mult': 2.7004179568976494, 'bear_tsl_mult': 0.8839488713923521, 'bear_time_stop': 98, 'bear_use_sma': True, 'bear_use_ema': True, 'bear_use_atr': True, 'bear_use_adx': False, 'bear_use_spike': True, 'bear_rsi_required': True, 'sideways_strategy': 'mean_reversion', 'sideways_bb_std_mult': 3.375572254858209, 'sideways_rsi_os': 23, 'sideways_rsi_ob': 80, 'sideways_adx_thresh': 12.626990131100843, 'sideways_atr_min_pct': 0.029914412980760335, 'sideways_atr_max_pct': 0.11478856536277335, 'sideways_tp_mult': 1.299337078928503, 'sideways_tsl_mult': 0.3792109452263364, 'sideways_time_stop': 196, 'sideways_use_sma': True, 'sideways_use_ema': False, 'sideways_use_atr': False, 'sideways_use_adx': True, 'sideways_use_spike': True, 'sideways_rsi_required': False}.
