[I 2025-08-30 14:40:18,240] Trial 164 finished with values: [-1000000000.0, 1000000000.0] and parameters: {'p_sma': 41, 'p_std': 46, 'p_atr': 16, 'p_adx': 9, 'rsi_period': 18, 'ema1': 17, 'ema2': 33, 'slip_atr_k': 0.0014634039798607223, 'slip_spread_k': 0.4010418178390785, 'spread_hl_frac': 0.029161527907267285, 'bb_std_mult': 1.7539029778899362, 'rsi_os': 42, 'rsi_ob': 69, 'vol_spike': 0.12138194145021061, 'adx_thresh': 26.641609891916275, 'atr_min_pct': 0.02842883024548872, 'atr_max_pct': 0.025584134624789864, 'tp_mult': 2.080599740694613, 'tsl_mult': 0.9965003577460283, 'strategy': 'mean_reversion', 'time_stop': 18, 'use_sma': True, 'use_atr': True, 'use_adx': False, 'use_ema': True, 'use_spike': True, 'rsi_required': False, 'edge_k': 1.9027286160678478, 'edge_cap': 0.6276846314170952, 'bull_strategy': 'mean_reversion', 'bull_bb_std_mult': 1.3493432678672321, 'bull_rsi_os': 17, 'bull_rsi_ob': 48, 'bull_adx_thresh': 23.528191925803604, 'bull_atr_min_pct': 0.0035360742696891132, 'bull_atr_max_pct': 0.04145898753059295, 'bull_tp_mult': 2.796249360111497, 'bull_tsl_mult': 0.3257547462448632, 'bull_time_stop': 103, 'bull_use_sma': False, 'bull_use_ema': False, 'bull_use_atr': False, 'bull_use_adx': True, 'bull_use_spike': False, 'bull_rsi_required': True, 'bear_strategy': 'breakout', 'bear_bb_std_mult': 2.836748731126129, 'bear_rsi_os': 16, 'bear_rsi_ob': 74, 'bear_adx_thresh': 20.858249757585103, 'bear_atr_min_pct': 0.011068923004043217, 'bear_atr_max_pct': 0.08859172843185621, 'bear_tp_mult': 2.7137700017357687, 'bear_tsl_mult': 0.7794484161401367, 'bear_time_stop': 155, 'bear_use_sma': False, 'bear_use_ema': True, 'bear_use_atr': False, 'bear_use_adx': False, 'bear_use_spike': False, 'bear_rsi_required': False, 'sideways_strategy': 'mean_reversion', 'sideways_bb_std_mult': 1.9619038983296777, 'sideways_rsi_os': 46, 'sideways_rsi_ob': 69, 'sideways_adx_thresh': 26.441538613215375, 'sideways_atr_min_pct': 0.02363083771806198, 'sideways_atr_max_pct': 0.07135894385932813, 'sideways_tp_mult': 2.054793052250264, 'sideways_tsl_mult': 0.9966426318466454, 'sideways_time_stop': 47, 'sideways_use_sma': False, 'sideways_use_ema': False, 'sideways_use_atr': False, 'sideways_use_adx': False, 'sideways_use_spike': False, 'sideways_rsi_required': False}.
[I 2025-08-30 14:40:47,729] Trial 163 finished with values: [-1000000000.0, 1000000000.0] and parameters: {'p_sma': 41, 'p_std': 11, 'p_atr': 24, 'p_adx': 27, 'rsi_period': 20, 'ema1': 17, 'ema2': 33, 'slip_atr_k': 0.0007286409264779942, 'slip_spread_k': 0.9283465450122674, 'spread_hl_frac': 0.04497385219785886, 'bb_std_mult': 1.742704588254162, 'rsi_os': 15, 'rsi_ob': 59, 'vol_spike': 0.061457013143965455, 'adx_thresh': 26.600967056246223, 'atr_min_pct': 0.013302598642866731, 'atr_max_pct': 0.1197474477961163, 'tp_mult': 2.071384316342095, 'tsl_mult': 0.5420491209433989, 'strategy': 'mean_reversion', 'time_stop': 15, 'use_sma': True, 'use_atr': True, 'use_adx': False, 'use_ema': True, 'use_spike': True, 'rsi_required': False, 'edge_k': 0.5307961826925655, 'edge_cap': 0.9090803425968302, 'bull_strategy': 'mean_reversion', 'bull_bb_std_mult': 2.8798152340749574, 'bull_rsi_os': 38, 'bull_rsi_ob': 75, 'bull_adx_thresh': 23.382096427575195, 'bull_atr_min_pct': 0.009905874263617213, 'bull_atr_max_pct': 0.0562701530282545, 'bull_tp_mult': 2.818488638960857, 'bull_tsl_mult': 0.32815448226090915, 'bull_time_stop': 100, 'bull_use_sma': False, 'bull_use_ema': False, 'bull_use_atr': False, 'bull_use_adx': True, 'bull_use_spike': False, 'bull_rsi_required': True, 'bear_strategy': 'breakout', 'bear_bb_std_mult': 1.4756613802695122, 'bear_rsi_os': 26, 'bear_rsi_ob': 47, 'bear_adx_thresh': 21.605033686084223, 'bear_atr_min_pct': 0.020416569862089035, 'bear_atr_max_pct': 0.04242700572446987, 'bear_tp_mult': 2.8605264020063776, 'bear_tsl_mult': 0.36917607793045004, 'bear_time_stop': 166, 'bear_use_sma': False, 'bear_use_ema': True, 'bear_use_atr': False, 'bear_use_adx': False, 'bear_use_spike': False, 'bear_rsi_required': False, 'sideways_strategy': 'mean_reversion', 'sideways_bb_std_mult': 1.1348814764949238, 'sideways_rsi_os': 46, 'sideways_rsi_ob': 69, 'sideways_adx_thresh': 26.5833374144271, 'sideways_atr_min_pct': 0.025656598184758527, 'sideways_atr_max_pct': 0.08884493754065571, 'sideways_tp_mult': 2.801080263600534, 'sideways_tsl_mult': 0.17632545825504287, 'sideways_time_stop': 83, 'sideways_use_sma': False, 'sideways_use_ema': False, 'sideways_use_atr': False, 'sideways_use_adx': False, 'sideways_use_spike': False, 'sideways_rsi_required': False}.
[I 2025-08-30 14:40:48,076] Trial 162 finished with values: [-1000000000.0, 1000000000.0] and parameters: {'p_sma': 41, 'p_std': 27, 'p_atr': 24, 'p_adx': 9, 'rsi_period': 19, 'ema1': 17, 'ema2': 54, 'slip_atr_k': 0.07452500971698946, 'slip_spread_k': 0.93315740344646, 'spread_hl_frac': 0.045475246720496784, 'bb_std_mult': 3.0777351573463454, 'rsi_os': 20, 'rsi_ob': 59, 'vol_spike': 0.023488443114140514, 'adx_thresh': 26.30999087497237, 'atr_min_pct': 0.028693665974408478, 'atr_max_pct': 0.04525188383796692, 'tp_mult': 1.4228782061457144, 'tsl_mult': 0.15850562838090476, 'strategy': 'mean_reversion', 'time_stop': 17, 'use_sma': True, 'use_atr': True, 'use_adx': False, 'use_ema': True, 'use_spike': True, 'rsi_required': True, 'edge_k': 0.287735771197671, 'edge_cap': 0.9219918021926794, 'bull_strategy': 'mean_reversion', 'bull_bb_std_mult': 0.500421818767678, 'bull_rsi_os': 38, 'bull_rsi_ob': 85, 'bull_adx_thresh': 19.117298299329754, 'bull_atr_min_pct': 0.014014312443553336, 'bull_atr_max_pct': 0.05192837739408592, 'bull_tp_mult': 1.3844185686822765, 'bull_tsl_mult': 0.32207913957601847, 'bull_time_stop': 286, 'bull_use_sma': False, 'bull_use_ema': False, 'bull_use_atr': False, 'bull_use_adx': True, 'bull_use_spike': False, 'bull_rsi_required': False, 'bear_strategy': 'breakout', 'bear_bb_std_mult': 1.3002818460002288, 'bear_rsi_os': 26, 'bear_rsi_ob': 55, 'bear_adx_thresh': 22.066338788350052, 'bear_atr_min_pct': 0.011740975323072755, 'bear_atr_max_pct': 0.1407063706077218, 'bear_tp_mult': 1.9988295392256494, 'bear_tsl_mult': 0.46672205984000437, 'bear_time_stop': 35, 'bear_use_sma': False, 'bear_use_ema': False, 'bear_use_atr': False, 'bear_use_adx': False, 'bear_use_spike': False, 'bear_rsi_required': False, 'sideways_strategy': 'mean_reversion', 'sideways_bb_std_mult': 2.35900389706981, 'sideways_rsi_os': 46, 'sideways_rsi_ob': 69, 'sideways_adx_thresh': 24.216471838697558, 'sideways_atr_min_pct': 0.02586228789663566, 'sideways_atr_max_pct': 0.13243024865543337, 'sideways_tp_mult': 2.7811888447085127, 'sideways_tsl_mult': 0.7967334081136703, 'sideways_time_stop': 160, 'sideways_use_sma': False, 'sideways_use_ema': False, 'sideways_use_atr': False, 'sideways_use_adx': False, 'sideways_use_spike': False, 'sideways_rsi_required': False}.
[I 2025-08-30 14:40:48,623] Trial 166 finished with values: [-1000000000.0, 0.16247999021304566] and parameters: {'p_sma': 36, 'p_std': 5, 'p_atr': 13, 'p_adx': 8, 'rsi_period': 16, 'ema1': 15, 'ema2': 60, 'slip_atr_k': 0.01637116783841816, 'slip_spread_k': 0.48252168617196545, 'spread_hl_frac': 0.008029026073461464, 'bb_std_mult': 2.0404038270555724, 'rsi_os': 17, 'rsi_ob': 95, 'vol_spike': 0.14707452221937162, 'adx_thresh': 13.926622268562998, 'atr_min_pct': 0.017385433794422242, 'atr_max_pct': 0.03113171052351411, 'tp_mult': 2.4153909496338093, 'tsl_mult': 0.40579493335523564, 'strategy': 'mean_reversion', 'time_stop': 294, 'use_sma': False, 'use_atr': False, 'use_adx': False, 'use_ema': True, 'use_spike': False, 'rsi_required': True, 'edge_k': 0.6750997732709259, 'edge_cap': 0.7100417251300841, 'bull_strategy': 'mean_reversion', 'bull_bb_std_mult': 1.8679074961265771, 'bull_rsi_os': 38, 'bull_rsi_ob': 52, 'bull_adx_thresh': 18.43469271790485, 'bull_atr_min_pct': 0.006093356370623172, 'bull_atr_max_pct': 0.05617103639282387, 'bull_tp_mult': 2.6724343788479743, 'bull_tsl_mult': 0.4547963809578077, 'bull_time_stop': 216, 'bull_use_sma': False, 'bull_use_ema': False, 'bull_use_atr': False, 'bull_use_adx': True, 'bull_use_spike': True, 'bull_rsi_required': False, 'bear_strategy': 'breakout', 'bear_bb_std_mult': 1.473331253506262, 'bear_rsi_os': 20, 'bear_rsi_ob': 47, 'bear_adx_thresh': 21.906460617433574, 'bear_atr_min_pct': 0.013276800576331335, 'bear_atr_max_pct': 0.041710274870587066, 'bear_tp_mult': 1.9979252400107503, 'bear_tsl_mult': 0.38252831198674875, 'bear_time_stop': 120, 'bear_use_sma': True, 'bear_use_ema': True, 'bear_use_atr': False, 'bear_use_adx': False, 'bear_use_spike': True, 'bear_rsi_required': False, 'sideways_strategy': 'mean_reversion', 'sideways_bb_std_mult': 2.898598690599422, 'sideways_rsi_os': 47, 'sideways_rsi_ob': 95, 'sideways_adx_thresh': 27.209831645386036, 'sideways_atr_min_pct': 0.00027620222919781147, 'sideways_atr_max_pct': 0.08898018739024738, 'sideways_tp_mult': 1.9737770317855587, 'sideways_tsl_mult': 0.16529097794887798, 'sideways_time_stop': 159, 'sideways_use_sma': True, 'sideways_use_ema': False, 'sideways_use_atr': False, 'sideways_use_adx': False, 'sideways_use_spike': True, 'sideways_rsi_required': False}.
[I 2025-08-30 14:40:48,759] Trial 165 finished with values: [-0.041728500688766546, 0.041711804498479506] and parameters: {'p_sma': 40, 'p_std': 46, 'p_atr': 13, 'p_adx': 9, 'rsi_period': 22, 'ema1': 17, 'ema2': 60, 'slip_atr_k': 0.01285332374478193, 'slip_spread_k': 0.40468735397551014, 'spread_hl_frac': 0.04479008239666468, 'bb_std_mult': 1.689050318301956, 'rsi_os': 17, 'rsi_ob': 95, 'vol_spike': 0.12068351557040852, 'adx_thresh': 12.717361202955892, 'atr_min_pct': 0.028598741388801432, 'atr_max_pct': 0.032025773795604444, 'tp_mult': 2.065906236099843, 'tsl_mult': 0.4276239446946444, 'strategy': 'mean_reversion', 'time_stop': 294, 'use_sma': True, 'use_atr': True, 'use_adx': False, 'use_ema': True, 'use_spike': False, 'rsi_required': False, 'edge_k': 1.721445040484886, 'edge_cap': 0.9099144711705419, 'bull_strategy': 'mean_reversion', 'bull_bb_std_mult': 0.5038516354797913, 'bull_rsi_os': 37, 'bull_rsi_ob': 52, 'bull_adx_thresh': 18.39702943094877, 'bull_atr_min_pct': 0.0035416803408512953, 'bull_atr_max_pct': 0.015917724710402745, 'bull_tp_mult': 1.2585315000884887, 'bull_tsl_mult': 0.697874240997761, 'bull_time_stop': 213, 'bull_use_sma': False, 'bull_use_ema': False, 'bull_use_atr': False, 'bull_use_adx': True, 'bull_use_spike': False, 'bull_rsi_required': True, 'bear_strategy': 'breakout', 'bear_bb_std_mult': 0.9952718201860888, 'bear_rsi_os': 34, 'bear_rsi_ob': 77, 'bear_adx_thresh': 22.194166592709784, 'bear_atr_min_pct': 0.013426815684152537, 'bear_atr_max_pct': 0.04338997810188567, 'bear_tp_mult': 1.9352056558363215, 'bear_tsl_mult': 0.44665885625252655, 'bear_time_stop': 167, 'bear_use_sma': False, 'bear_use_ema': True, 'bear_use_atr': False, 'bear_use_adx': False, 'bear_use_spike': True, 'bear_rsi_required': False, 'sideways_strategy': 'mean_reversion', 'sideways_bb_std_mult': 2.3620627894585358, 'sideways_rsi_os': 50, 'sideways_rsi_ob': 69, 'sideways_adx_thresh': 26.722979771461763, 'sideways_atr_min_pct': 0.001544480443315198, 'sideways_atr_max_pct': 0.013985278545987773, 'sideways_tp_mult': 1.480650876420235, 'sideways_tsl_mult': 0.1703322158944852, 'sideways_time_stop': 208, 'sideways_use_sma': False, 'sideways_use_ema': False, 'sideways_use_atr': False, 'sideways_use_adx': False, 'sideways_use_spike': True, 'sideways_rsi_required': False}.
[I 2025-08-30 14:41:20,048] Trial 170 finished with values: [-1000000000.0, 1000000000.0] and parameters: {'p_sma': 37, 'p_std': 7, 'p_atr': 18, 'p_adx': 7, 'rsi_period': 16, 'ema1': 6, 'ema2': 34, 'slip_atr_k': 0.09216263951664733, 'slip_spread_k': 0.5674099749576742, 'spread_hl_frac': 0.03984481500827774, 'bb_std_mult': 2.8486487590093974, 'rsi_os': 18, 'rsi_ob': 54, 'vol_spike': 0.09138614006152383, 'adx_thresh': 21.945491131558246, 'atr_min_pct': 0.02111256574639366, 'atr_max_pct': 0.03642811487250707, 'tp_mult': 2.1611749227883457, 'tsl_mult': 0.046562464747967124, 'strategy': 'breakout', 'time_stop': 35, 'use_sma': False, 'use_atr': False, 'use_adx': True, 'use_ema': False, 'use_spike': True, 'rsi_required': True, 'edge_k': 1.1480773146956862, 'edge_cap': 0.32496219255146386, 'bull_strategy': 'breakout', 'bull_bb_std_mult': 0.5673162752880642, 'bull_rsi_os': 44, 'bull_rsi_ob': 79, 'bull_adx_thresh': 15.17001114395122, 'bull_atr_min_pct': 0.02657362649915565, 'bull_atr_max_pct': 0.12003300742380839, 'bull_tp_mult': 1.2925801972017983, 'bull_tsl_mult': 0.6715947768772477, 'bull_time_stop': 266, 'bull_use_sma': True, 'bull_use_ema': True, 'bull_use_atr': True, 'bull_use_adx': False, 'bull_use_spike': True, 'bull_rsi_required': False, 'bear_strategy': 'mean_reversion', 'bear_bb_std_mult': 1.4013289907120772, 'bear_rsi_os': 46, 'bear_rsi_ob': 60, 'bear_adx_thresh': 31.616188935353087, 'bear_atr_min_pct': 0.010732470695507942, 'bear_atr_max_pct': 0.03471438629359885, 'bear_tp_mult': 2.508748980437346, 'bear_tsl_mult': 0.3340500742440017, 'bear_time_stop': 79, 'bear_use_sma': True, 'bear_use_ema': True, 'bear_use_atr': True, 'bear_use_adx': False, 'bear_use_spike': False, 'bear_rsi_required': True, 'sideways_strategy': 'breakout', 'sideways_bb_std_mult': 1.6685412885923514, 'sideways_rsi_os': 34, 'sideways_rsi_ob': 73, 'sideways_adx_thresh': 25.650053058862845, 'sideways_atr_min_pct': 0.008786308707989321, 'sideways_atr_max_pct': 0.024640572674089364, 'sideways_tp_mult': 2.9078969004417523, 'sideways_tsl_mult': 0.7504875800634934, 'sideways_time_stop': 192, 'sideways_use_sma': True, 'sideways_use_ema': True, 'sideways_use_atr': True, 'sideways_use_adx': True, 'sideways_use_spike': False, 'sideways_rsi_required': True}.
[I 2025-08-30 14:41:20,705] Trial 168 finished with values: [-0.04237278961072721, 0.042350618454477816] and parameters: {'p_sma': 37, 'p_std': 49, 'p_atr': 18, 'p_adx': 8, 'rsi_period': 15, 'ema1': 15, 'ema2': 35, 'slip_atr_k': 0.09061042882036006, 'slip_spread_k': 0.024850639973785116, 'spread_hl_frac': 0.0338432617469573, 'bb_std_mult': 2.01410783325066, 'rsi_os': 18, 'rsi_ob': 54, 'vol_spike': 0.1793972616239005, 'adx_thresh': 20.25492618308799, 'atr_min_pct': 0.018079560984570957, 'atr_max_pct': 0.10135582977382424, 'tp_mult': 2.424170037676612, 'tsl_mult': 0.07712341752120558, 'strategy': 'breakout', 'time_stop': 294, 'use_sma': False, 'use_atr': False, 'use_adx': True, 'use_ema': True, 'use_spike': False, 'rsi_required': True, 'edge_k': 1.7293417591163323, 'edge_cap': 0.7977156732340515, 'bull_strategy': 'breakout', 'bull_bb_std_mult': 0.5694507591749827, 'bull_rsi_os': 51, 'bull_rsi_ob': 78, 'bull_adx_thresh': 18.52768677245532, 'bull_atr_min_pct': 0.004924796885949073, 'bull_atr_max_pct': 0.016017278442500928, 'bull_tp_mult': 1.2659896612510748, 'bull_tsl_mult': 0.4554234532508845, 'bull_time_stop': 260, 'bull_use_sma': False, 'bull_use_ema': True, 'bull_use_atr': True, 'bull_use_adx': False, 'bull_use_spike': True, 'bull_rsi_required': False, 'bear_strategy': 'mean_reversion', 'bear_bb_std_mult': 1.0613184987162256, 'bear_rsi_os': 34, 'bear_rsi_ob': 67, 'bear_adx_thresh': 15.554050140296443, 'bear_atr_min_pct': 0.013060597011889065, 'bear_atr_max_pct': 0.1479552623511292, 'bear_tp_mult': 1.928450010063732, 'bear_tsl_mult': 0.02236596543781255, 'bear_time_stop': 120, 'bear_use_sma': True, 'bear_use_ema': True, 'bear_use_atr': True, 'bear_use_adx': False, 'bear_use_spike': True, 'bear_rsi_required': False, 'sideways_strategy': 'breakout', 'sideways_bb_std_mult': 1.3915492855774103, 'sideways_rsi_os': 33, 'sideways_rsi_ob': 73, 'sideways_adx_thresh': 27.12947571938682, 'sideways_atr_min_pct': 0.0008836633860446821, 'sideways_atr_max_pct': 0.024607232439602666, 'sideways_tp_mult': 1.4768654426036059, 'sideways_tsl_mult': 0.04976151362704813, 'sideways_time_stop': 207, 'sideways_use_sma': True, 'sideways_use_ema': True, 'sideways_use_atr': True, 'sideways_use_adx': True, 'sideways_use_spike': True, 'sideways_rsi_required': False}.
[I 2025-08-30 14:41:20,724] Trial 169 finished with values: [-0.02123355461017873, 0.021385613514014294] and parameters: {'p_sma': 33, 'p_std': 39, 'p_atr': 27, 'p_adx': 16, 'rsi_period': 22, 'ema1': 14, 'ema2': 35, 'slip_atr_k': 0.09239951007207375, 'slip_spread_k': 0.5670585329539569, 'spread_hl_frac': 0.04831540600437185, 'bb_std_mult': 1.9130400640316747, 'rsi_os': 18, 'rsi_ob': 55, 'vol_spike': 0.16139398101784438, 'adx_thresh': 22.10146413287565, 'atr_min_pct': 0.021788058786779498, 'atr_max_pct': 0.03257526018301563, 'tp_mult': 2.148778125602395, 'tsl_mult': 0.04556444039016961, 'strategy': 'breakout', 'time_stop': 166, 'use_sma': False, 'use_atr': False, 'use_adx': True, 'use_ema': True, 'use_spike': False, 'rsi_required': True, 'edge_k': 1.4611123980296035, 'edge_cap': 0.32725190551636396, 'bull_strategy': 'breakout', 'bull_bb_std_mult': 0.5672765400316604, 'bull_rsi_os': 44, 'bull_rsi_ob': 79, 'bull_adx_thresh': 13.543223097684162, 'bull_atr_min_pct': 0.02642800139266361, 'bull_atr_max_pct': 0.01572372601565427, 'bull_tp_mult': 1.2624800723552494, 'bull_tsl_mult': 0.6638197766179814, 'bull_time_stop': 113, 'bull_use_sma': True, 'bull_use_ema': True, 'bull_use_atr': True, 'bull_use_adx': False, 'bull_use_spike': True, 'bull_rsi_required': False, 'bear_strategy': 'mean_reversion', 'bear_bb_std_mult': 1.0010399143867383, 'bear_rsi_os': 47, 'bear_rsi_ob': 77, 'bear_adx_thresh': 28.042691436661674, 'bear_atr_min_pct': 0.010112260094078677, 'bear_atr_max_pct': 0.14755154776622112, 'bear_tp_mult': 1.9269769780322366, 'bear_tsl_mult': 0.8191317756946448, 'bear_time_stop': 224, 'bear_use_sma': True, 'bear_use_ema': True, 'bear_use_atr': True, 'bear_use_adx': False, 'bear_use_spike': True, 'bear_rsi_required': True, 'sideways_strategy': 'breakout', 'sideways_bb_std_mult': 1.642784264627919, 'sideways_rsi_os': 33, 'sideways_rsi_ob': 63, 'sideways_adx_thresh': 25.822352481103422, 'sideways_atr_min_pct': 0.001642567496224939, 'sideways_atr_max_pct': 0.024674853911808473, 'sideways_tp_mult': 1.4397995761579794, 'sideways_tsl_mult': 0.7467800775670179, 'sideways_time_stop': 183, 'sideways_use_sma': True, 'sideways_use_ema': True, 'sideways_use_atr': True, 'sideways_use_adx': True, 'sideways_use_spike': True, 'sideways_rsi_required': True}.
[I 2025-08-30 14:41:20,797] Trial 167 finished with values: [-0.10738625213400865, 0.10737157427026918] and parameters: {'p_sma': 40, 'p_std': 27, 'p_atr': 27, 'p_adx': 8, 'rsi_period': 16, 'ema1': 15, 'ema2': 31, 'slip_atr_k': 0.18623282025121973, 'slip_spread_k': 0.02488794460407695, 'spread_hl_frac': 0.045576829039062676, 'bb_std_mult': 3.0816449386503497, 'rsi_os': 17, 'rsi_ob': 55, 'vol_spike': 0.0800507799754422, 'adx_thresh': 29.656403920532235, 'atr_min_pct': 0.021455357092944438, 'atr_max_pct': 0.12740711608857733, 'tp_mult': 2.164590747400029, 'tsl_mult': 0.4859277284275802, 'strategy': 'mean_reversion', 'time_stop': 294, 'use_sma': False, 'use_atr': False, 'use_adx': False, 'use_ema': True, 'use_spike': False, 'rsi_required': True, 'edge_k': 1.719129619365146, 'edge_cap': 0.49393023509779727, 'bull_strategy': 'breakout', 'bull_bb_std_mult': 0.5101517432551811, 'bull_rsi_os': 8, 'bull_rsi_ob': 78, 'bull_adx_thresh': 15.197314861353028, 'bull_atr_min_pct': 0.004895972686210968, 'bull_atr_max_pct': 0.10623235491478819, 'bull_tp_mult': 1.2492424627450767, 'bull_tsl_mult': 0.6615773958212823, 'bull_time_stop': 96, 'bull_use_sma': False, 'bull_use_ema': True, 'bull_use_atr': True, 'bull_use_adx': False, 'bull_use_spike': True, 'bull_rsi_required': False, 'bear_strategy': 'mean_reversion', 'bear_bb_std_mult': 2.9457261917101003, 'bear_rsi_os': 19, 'bear_rsi_ob': 67, 'bear_adx_thresh': 19.982806538230037, 'bear_atr_min_pct': 0.013166464739424096, 'bear_atr_max_pct': 0.1476441463719218, 'bear_tp_mult': 2.0040665830747435, 'bear_tsl_mult': 0.44061598183230005, 'bear_time_stop': 116, 'bear_use_sma': True, 'bear_use_ema': True, 'bear_use_atr': False, 'bear_use_adx': False, 'bear_use_spike': True, 'bear_rsi_required': False, 'sideways_strategy': 'breakout', 'sideways_bb_std_mult': 1.894712691094355, 'sideways_rsi_os': 50, 'sideways_rsi_ob': 65, 'sideways_adx_thresh': 27.167416771638052, 'sideways_atr_min_pct': 0.0004910707006664707, 'sideways_atr_max_pct': 0.08118458243797172, 'sideways_tp_mult': 1.7455637355418692, 'sideways_tsl_mult': 0.7425102772167734, 'sideways_time_stop': 161, 'sideways_use_sma': True, 'sideways_use_ema': True, 'sideways_use_atr': False, 'sideways_use_adx': True, 'sideways_use_spike': True, 'sideways_rsi_required': False}.
