[I 2025-08-30 14:48:40,020] Trial 234 finished with values: [-1000000000.0, 1000000000.0] and parameters: {'p_sma': 43, 'p_std': 5, 'p_atr': 20, 'p_adx': 8, 'rsi_period': 24, 'ema1': 14, 'ema2': 45, 'slip_atr_k': 0.09192336997875174, 'slip_spread_k': 0.13243182291175828, 'spread_hl_frac': 0.00805467503190246, 'bb_std_mult': 1.4977115997728947, 'rsi_os': 12, 'rsi_ob': 86, 'vol_spike': 0.09002913358731666, 'adx_thresh': 18.682775147522328, 'atr_min_pct': 0.0032607175269011614, 'atr_max_pct': 0.07145804066617296, 'tp_mult': 2.1602518338804573, 'tsl_mult': 0.6199131848752782, 'strategy': 'breakout', 'time_stop': 236, 'use_sma': True, 'use_atr': False, 'use_adx': False, 'use_ema': False, 'use_spike': False, 'rsi_required': True, 'edge_k': 1.4926234257400908, 'edge_cap': 0.5131390120831462, 'bull_strategy': 'mean_reversion', 'bull_bb_std_mult': 2.7918427891805933, 'bull_rsi_os': 44, 'bull_rsi_ob': 54, 'bull_adx_thresh': 22.11527921529512, 'bull_atr_min_pct': 0.003015038928863402, 'bull_atr_max_pct': 0.043759492673475224, 'bull_tp_mult': 2.85425798387575, 'bull_tsl_mult': 0.8588572635491851, 'bull_time_stop': 149, 'bull_use_sma': False, 'bull_use_ema': False, 'bull_use_atr': False, 'bull_use_adx': False, 'bull_use_spike': False, 'bull_rsi_required': False, 'bear_strategy': 'breakout', 'bear_bb_std_mult': 3.4667809163695953, 'bear_rsi_os': 35, 'bear_rsi_ob': 88, 'bear_adx_thresh': 5.5898814625758435, 'bear_atr_min_pct': 0.028744592694735154, 'bear_atr_max_pct': 0.1497497860437015, 'bear_tp_mult': 2.8296584907283373, 'bear_tsl_mult': 0.5403230085021461, 'bear_time_stop': 287, 'bear_use_sma': False, 'bear_use_ema': True, 'bear_use_atr': False, 'bear_use_adx': False, 'bear_use_spike': False, 'bear_rsi_required': False, 'sideways_strategy': 'mean_reversion', 'sideways_bb_std_mult': 0.9475971185444773, 'sideways_rsi_os': 45, 'sideways_rsi_ob': 64, 'sideways_adx_thresh': 24.60426402775627, 'sideways_atr_min_pct': 0.013285412366392567, 'sideways_atr_max_pct': 0.02091536745421394, 'sideways_tp_mult': 2.993809728109452, 'sideways_tsl_mult': 0.7962783455639306, 'sideways_time_stop': 126, 'sideways_use_sma': True, 'sideways_use_ema': False, 'sideways_use_atr': False, 'sideways_use_adx': False, 'sideways_use_spike': False, 'sideways_rsi_required': True}.
[I 2025-08-30 14:48:42,719] Trial 235 finished with values: [-0.018215314388459913, 0.018141845117646705] and parameters: {'p_sma': 43, 'p_std': 5, 'p_atr': 20, 'p_adx': 8, 'rsi_period': 24, 'ema1': 14, 'ema2': 45, 'slip_atr_k': 0.1905360723526367, 'slip_spread_k': 0.13073561145850016, 'spread_hl_frac': 0.011563077396218204, 'bb_std_mult': 3.5076600840306744, 'rsi_os': 16, 'rsi_ob': 86, 'vol_spike': 0.0909563066892896, 'adx_thresh': 15.684041521525655, 'atr_min_pct': 0.003449176310351294, 'atr_max_pct': 0.070550817437661, 'tp_mult': 2.0897982860868534, 'tsl_mult': 0.6226837326371613, 'strategy': 'breakout', 'time_stop': 230, 'use_sma': True, 'use_atr': False, 'use_adx': False, 'use_ema': False, 'use_spike': False, 'rsi_required': True, 'edge_k': 0.0560118680332754, 'edge_cap': 0.47560244376249744, 'bull_strategy': 'mean_reversion', 'bull_bb_std_mult': 2.8263420724962525, 'bull_rsi_os': 44, 'bull_rsi_ob': 54, 'bull_adx_thresh': 21.948175675997362, 'bull_atr_min_pct': 0.0029525190830794234, 'bull_atr_max_pct': 0.032122302075703046, 'bull_tp_mult': 1.240016851697753, 'bull_tsl_mult': 0.858966267069324, 'bull_time_stop': 147, 'bull_use_sma': False, 'bull_use_ema': False, 'bull_use_atr': False, 'bull_use_adx': False, 'bull_use_spike': False, 'bull_rsi_required': False, 'bear_strategy': 'breakout', 'bear_bb_std_mult': 3.4504584739276347, 'bear_rsi_os': 32, 'bear_rsi_ob': 88, 'bear_adx_thresh': 6.314002861215917, 'bear_atr_min_pct': 0.02908199075077661, 'bear_atr_max_pct': 0.14985708222040142, 'bear_tp_mult': 2.836077447401375, 'bear_tsl_mult': 0.546287955686385, 'bear_time_stop': 287, 'bear_use_sma': False, 'bear_use_ema': True, 'bear_use_atr': False, 'bear_use_adx': False, 'bear_use_spike': False, 'bear_rsi_required': False, 'sideways_strategy': 'mean_reversion', 'sideways_bb_std_mult': 0.9706680992020221, 'sideways_rsi_os': 45, 'sideways_rsi_ob': 64, 'sideways_adx_thresh': 24.60347870640629, 'sideways_atr_min_pct': 0.004672509780353721, 'sideways_atr_max_pct': 0.06842127447458504, 'sideways_tp_mult': 2.9644038914166266, 'sideways_tsl_mult': 0.7977692186996749, 'sideways_time_stop': 129, 'sideways_use_sma': True, 'sideways_use_ema': False, 'sideways_use_atr': False, 'sideways_use_adx': False, 'sideways_use_spike': False, 'sideways_rsi_required': True}.
[I 2025-08-30 14:48:53,179] Trial 236 finished with values: [-0.010516074475670711, 0.010441837489135608] and parameters: {'p_sma': 44, 'p_std': 5, 'p_atr': 20, 'p_adx': 8, 'rsi_period': 24, 'ema1': 14, 'ema2': 45, 'slip_atr_k': 0.10797173068255533, 'slip_spread_k': 0.13035495029703334, 'spread_hl_frac': 0.008306673088166358, 'bb_std_mult': 3.4852959575797304, 'rsi_os': 16, 'rsi_ob': 85, 'vol_spike': 0.08989489784992905, 'adx_thresh': 19.276386822917193, 'atr_min_pct': 0.003437341963361807, 'atr_max_pct': 0.06936490453462618, 'tp_mult': 1.0130134291981006, 'tsl_mult': 0.6238189971464453, 'strategy': 'breakout', 'time_stop': 236, 'use_sma': True, 'use_atr': True, 'use_adx': False, 'use_ema': False, 'use_spike': False, 'rsi_required': True, 'edge_k': 0.9570984708196583, 'edge_cap': 0.5078616118027389, 'bull_strategy': 'mean_reversion', 'bull_bb_std_mult': 2.7863362424538103, 'bull_rsi_os': 43, 'bull_rsi_ob': 54, 'bull_adx_thresh': 21.972999696137013, 'bull_atr_min_pct': 0.002850713100066912, 'bull_atr_max_pct': 0.03306512493746804, 'bull_tp_mult': 2.858191459224311, 'bull_tsl_mult': 0.8647271726841623, 'bull_time_stop': 146, 'bull_use_sma': False, 'bull_use_ema': False, 'bull_use_atr': False, 'bull_use_adx': True, 'bull_use_spike': False, 'bull_rsi_required': False, 'bear_strategy': 'breakout', 'bear_bb_std_mult': 3.4499081352855487, 'bear_rsi_os': 39, 'bear_rsi_ob': 88, 'bear_adx_thresh': 6.502444971041677, 'bear_atr_min_pct': 0.029011701701470424, 'bear_atr_max_pct': 0.1499129554364977, 'bear_tp_mult': 2.7674294777195856, 'bear_tsl_mult': 0.5051653783057721, 'bear_time_stop': 287, 'bear_use_sma': False, 'bear_use_ema': True, 'bear_use_atr': False, 'bear_use_adx': False, 'bear_use_spike': False, 'bear_rsi_required': False, 'sideways_strategy': 'mean_reversion', 'sideways_bb_std_mult': 0.9943535821882878, 'sideways_rsi_os': 43, 'sideways_rsi_ob': 64, 'sideways_adx_thresh': 25.183926717986893, 'sideways_atr_min_pct': 0.013070492472599247, 'sideways_atr_max_pct': 0.020921318879515878, 'sideways_tp_mult': 2.970435486175031, 'sideways_tsl_mult': 0.792924204432647, 'sideways_time_stop': 126, 'sideways_use_sma': False, 'sideways_use_ema': False, 'sideways_use_atr': False, 'sideways_use_adx': False, 'sideways_use_spike': False, 'sideways_rsi_required': False}.
[I 2025-08-30 14:49:03,411] Trial 237 finished with values: [-0.008202598584903353, 0.008144263367053895] and parameters: {'p_sma': 45, 'p_std': 5, 'p_atr': 20, 'p_adx': 8, 'rsi_period': 28, 'ema1': 13, 'ema2': 45, 'slip_atr_k': 0.03311645011279461, 'slip_spread_k': 0.13178824420613228, 'spread_hl_frac': 0.008495555621036582, 'bb_std_mult': 2.7307114372163093, 'rsi_os': 10, 'rsi_ob': 86, 'vol_spike': 0.10234386286077697, 'adx_thresh': 13.365211934899255, 'atr_min_pct': 0.0035527992038174756, 'atr_max_pct': 0.07120146473125438, 'tp_mult': 2.180221345375607, 'tsl_mult': 0.6136960930957523, 'strategy': 'breakout', 'time_stop': 240, 'use_sma': True, 'use_atr': False, 'use_adx': False, 'use_ema': False, 'use_spike': False, 'rsi_required': True, 'edge_k': 0.3463058017834464, 'edge_cap': 0.5180546006418988, 'bull_strategy': 'mean_reversion', 'bull_bb_std_mult': 2.7914140032266443, 'bull_rsi_os': 44, 'bull_rsi_ob': 48, 'bull_adx_thresh': 31.816161940960527, 'bull_atr_min_pct': 0.0029883591760245013, 'bull_atr_max_pct': 0.04423644270234417, 'bull_tp_mult': 1.1252199759307835, 'bull_tsl_mult': 0.9106782385700563, 'bull_time_stop': 144, 'bull_use_sma': False, 'bull_use_ema': False, 'bull_use_atr': False, 'bull_use_adx': False, 'bull_use_spike': False, 'bull_rsi_required': False, 'bear_strategy': 'breakout', 'bear_bb_std_mult': 3.493391196115423, 'bear_rsi_os': 34, 'bear_rsi_ob': 88, 'bear_adx_thresh': 6.639111200177157, 'bear_atr_min_pct': 0.029476248466718022, 'bear_atr_max_pct': 0.14955389176444586, 'bear_tp_mult': 2.8346258133217956, 'bear_tsl_mult': 0.5462337911050301, 'bear_time_stop': 287, 'bear_use_sma': False, 'bear_use_ema': True, 'bear_use_atr': False, 'bear_use_adx': False, 'bear_use_spike': False, 'bear_rsi_required': False, 'sideways_strategy': 'mean_reversion', 'sideways_bb_std_mult': 0.9556064764479424, 'sideways_rsi_os': 40, 'sideways_rsi_ob': 64, 'sideways_adx_thresh': 22.28214849827902, 'sideways_atr_min_pct': 0.016387334340890448, 'sideways_atr_max_pct': 0.10087287546269463, 'sideways_tp_mult': 2.9900083027342452, 'sideways_tsl_mult': 0.7918541777694296, 'sideways_time_stop': 108, 'sideways_use_sma': True, 'sideways_use_ema': False, 'sideways_use_atr': False, 'sideways_use_adx': False, 'sideways_use_spike': False, 'sideways_rsi_required': True}.
[I 2025-08-30 14:49:11,573] Trial 238 finished with values: [-1000000000.0, 1000000000.0] and parameters: {'p_sma': 44, 'p_std': 5, 'p_atr': 20, 'p_adx': 8, 'rsi_period': 27, 'ema1': 13, 'ema2': 44, 'slip_atr_k': 0.03008293306931739, 'slip_spread_k': 0.16014958157188114, 'spread_hl_frac': 0.008422547994058548, 'bb_std_mult': 3.211523361660735, 'rsi_os': 9, 'rsi_ob': 86, 'vol_spike': 0.10136622253498077, 'adx_thresh': 15.521188059649658, 'atr_min_pct': 0.004000979300123283, 'atr_max_pct': 0.06953807964330312, 'tp_mult': 2.2689305971197475, 'tsl_mult': 0.6120056731490371, 'strategy': 'breakout', 'time_stop': 242, 'use_sma': True, 'use_atr': False, 'use_adx': False, 'use_ema': False, 'use_spike': False, 'rsi_required': True, 'edge_k': 0.35960571149894127, 'edge_cap': 0.5266022632572672, 'bull_strategy': 'mean_reversion', 'bull_bb_std_mult': 2.7977135528710813, 'bull_rsi_os': 43, 'bull_rsi_ob': 48, 'bull_adx_thresh': 11.527114396733909, 'bull_atr_min_pct': 0.004142817886975626, 'bull_atr_max_pct': 0.05150856994145951, 'bull_tp_mult': 1.115956081863508, 'bull_tsl_mult': 0.90778390325369, 'bull_time_stop': 144, 'bull_use_sma': False, 'bull_use_ema': False, 'bull_use_atr': False, 'bull_use_adx': False, 'bull_use_spike': False, 'bull_rsi_required': True, 'bear_strategy': 'breakout', 'bear_bb_std_mult': 3.3995588619435564, 'bear_rsi_os': 34, 'bear_rsi_ob': 87, 'bear_adx_thresh': 6.4788651242512, 'bear_atr_min_pct': 0.029330386357768898, 'bear_atr_max_pct': 0.1497166419773906, 'bear_tp_mult': 2.885463387324289, 'bear_tsl_mult': 0.5810620130842227, 'bear_time_stop': 276, 'bear_use_sma': False, 'bear_use_ema': True, 'bear_use_atr': False, 'bear_use_adx': True, 'bear_use_spike': False, 'bear_rsi_required': False, 'sideways_strategy': 'mean_reversion', 'sideways_bb_std_mult': 0.8875888655488795, 'sideways_rsi_os': 38, 'sideways_rsi_ob': 64, 'sideways_adx_thresh': 21.83736761516109, 'sideways_atr_min_pct': 0.019455406639797623, 'sideways_atr_max_pct': 0.07760240758082784, 'sideways_tp_mult': 2.9941237190712986, 'sideways_tsl_mult': 0.777309948848827, 'sideways_time_stop': 107, 'sideways_use_sma': True, 'sideways_use_ema': False, 'sideways_use_atr': False, 'sideways_use_adx': False, 'sideways_use_spike': False, 'sideways_rsi_required': True}.
[I 2025-08-30 14:49:13,286] Trial 239 finished with values: [-1000000000.0, 1000000000.0] and parameters: {'p_sma': 44, 'p_std': 5, 'p_atr': 20, 'p_adx': 8, 'rsi_period': 28, 'ema1': 13, 'ema2': 50, 'slip_atr_k': 0.03144078768506659, 'slip_spread_k': 0.16691278717829267, 'spread_hl_frac': 0.008598958166710337, 'bb_std_mult': 2.192200068194264, 'rsi_os': 9, 'rsi_ob': 87, 'vol_spike': 0.09969390604492538, 'adx_thresh': 15.73115471287596, 'atr_min_pct': 0.004185992514778877, 'atr_max_pct': 0.06875047323675161, 'tp_mult': 2.274245074897837, 'tsl_mult': 0.6258063628067855, 'strategy': 'breakout', 'time_stop': 243, 'use_sma': True, 'use_atr': False, 'use_adx': False, 'use_ema': False, 'use_spike': False, 'rsi_required': True, 'edge_k': 0.03884893667013034, 'edge_cap': 0.51972750457757, 'bull_strategy': 'mean_reversion', 'bull_bb_std_mult': 2.795505644823301, 'bull_rsi_os': 44, 'bull_rsi_ob': 48, 'bull_adx_thresh': 22.461114777928458, 'bull_atr_min_pct': 0.004093916099542258, 'bull_atr_max_pct': 0.05213990216356417, 'bull_tp_mult': 1.2013469206043847, 'bull_tsl_mult': 0.912432487429339, 'bull_time_stop': 145, 'bull_use_sma': False, 'bull_use_ema': False, 'bull_use_atr': False, 'bull_use_adx': False, 'bull_use_spike': False, 'bull_rsi_required': True, 'bear_strategy': 'breakout', 'bear_bb_std_mult': 3.3872848897243517, 'bear_rsi_os': 34, 'bear_rsi_ob': 87, 'bear_adx_thresh': 6.780037918496837, 'bear_atr_min_pct': 0.029294348737990028, 'bear_atr_max_pct': 0.14975450691756756, 'bear_tp_mult': 2.7910165154894404, 'bear_tsl_mult': 0.5788534395353742, 'bear_time_stop': 277, 'bear_use_sma': False, 'bear_use_ema': True, 'bear_use_atr': False, 'bear_use_adx': True, 'bear_use_spike': False, 'bear_rsi_required': False, 'sideways_strategy': 'mean_reversion', 'sideways_bb_std_mult': 0.8924573592161184, 'sideways_rsi_os': 41, 'sideways_rsi_ob': 64, 'sideways_adx_thresh': 22.093239360958222, 'sideways_atr_min_pct': 0.019615197773019726, 'sideways_atr_max_pct': 0.07651174178649774, 'sideways_tp_mult': 2.9749793107483056, 'sideways_tsl_mult': 0.8070131869569799, 'sideways_time_stop': 107, 'sideways_use_sma': True, 'sideways_use_ema': False, 'sideways_use_atr': False, 'sideways_use_adx': False, 'sideways_use_spike': False, 'sideways_rsi_required': True}.
[I 2025-08-30 14:49:23,380] Trial 240 finished with values: [-1000000000.0, 1000000000.0] and parameters: {'p_sma': 45, 'p_std': 5, 'p_atr': 20, 'p_adx': 8, 'rsi_period': 26, 'ema1': 13, 'ema2': 44, 'slip_atr_k': 0.026995430703883456, 'slip_spread_k': 0.15756097657418547, 'spread_hl_frac': 0.008657250925470636, 'bb_std_mult': 3.3509212620656657, 'rsi_os': 9, 'rsi_ob': 87, 'vol_spike': 0.10155247886869331, 'adx_thresh': 14.412498266301792, 'atr_min_pct': 0.0041248673943748764, 'atr_max_pct': 0.06884073716877355, 'tp_mult': 2.187968337444454, 'tsl_mult': 0.6230072411959823, 'strategy': 'breakout', 'time_stop': 242, 'use_sma': True, 'use_atr': False, 'use_adx': False, 'use_ema': False, 'use_spike': False, 'rsi_required': True, 'edge_k': 0.3541264284721237, 'edge_cap': 0.5225652551820008, 'bull_strategy': 'mean_reversion', 'bull_bb_std_mult': 2.7655867586478315, 'bull_rsi_os': 44, 'bull_rsi_ob': 47, 'bull_adx_thresh': 22.811040223982538, 'bull_atr_min_pct': 0.004077835652521834, 'bull_atr_max_pct': 0.05002572380731072, 'bull_tp_mult': 1.1850692732340598, 'bull_tsl_mult': 0.9030432019250781, 'bull_time_stop': 144, 'bull_use_sma': False, 'bull_use_ema': False, 'bull_use_atr': False, 'bull_use_adx': False, 'bull_use_spike': False, 'bull_rsi_required': True, 'bear_strategy': 'breakout', 'bear_bb_std_mult': 3.3980495272140416, 'bear_rsi_os': 32, 'bear_rsi_ob': 87, 'bear_adx_thresh': 6.629314033986769, 'bear_atr_min_pct': 0.029307605207602505, 'bear_atr_max_pct': 0.14828220246588544, 'bear_tp_mult': 2.791671524042548, 'bear_tsl_mult': 0.5780644730158162, 'bear_time_stop': 280, 'bear_use_sma': False, 'bear_use_ema': True, 'bear_use_atr': False, 'bear_use_adx': True, 'bear_use_spike': False, 'bear_rsi_required': False, 'sideways_strategy': 'mean_reversion', 'sideways_bb_std_mult': 0.8810473551516299, 'sideways_rsi_os': 38, 'sideways_rsi_ob': 63, 'sideways_adx_thresh': 19.464681886344323, 'sideways_atr_min_pct': 0.019388295061559122, 'sideways_atr_max_pct': 0.07778541052205101, 'sideways_tp_mult': 2.999548504760243, 'sideways_tsl_mult': 0.8053582775579823, 'sideways_time_stop': 109, 'sideways_use_sma': True, 'sideways_use_ema': False, 'sideways_use_atr': False, 'sideways_use_adx': False, 'sideways_use_spike': False, 'sideways_rsi_required': True}.
[I 2025-08-30 14:49:34,837] Trial 241 finished with values: [-0.011006157458821497, 0.010939653411496027] and parameters: {'p_sma': 44, 'p_std': 5, 'p_atr': 20, 'p_adx': 8, 'rsi_period': 28, 'ema1': 13, 'ema2': 44, 'slip_atr_k': 0.03026709651601671, 'slip_spread_k': 0.1400663816786209, 'spread_hl_frac': 0.00859589739551504, 'bb_std_mult': 3.323722992298065, 'rsi_os': 9, 'rsi_ob': 85, 'vol_spike': 0.10061571439196314, 'adx_thresh': 15.683011318656188, 'atr_min_pct': 0.004181461581375488, 'atr_max_pct': 0.06903946402957592, 'tp_mult': 2.2575730615571663, 'tsl_mult': 0.6156617570419642, 'strategy': 'breakout', 'time_stop': 242, 'use_sma': True, 'use_atr': False, 'use_adx': False, 'use_ema': False, 'use_spike': False, 'rsi_required': True, 'edge_k': 0.3650988979626118, 'edge_cap': 0.534231987623132, 'bull_strategy': 'mean_reversion', 'bull_bb_std_mult': 2.8012991504300113, 'bull_rsi_os': 45, 'bull_rsi_ob': 48, 'bull_adx_thresh': 22.48838789465557, 'bull_atr_min_pct': 0.00251251800932719, 'bull_atr_max_pct': 0.04166888157901978, 'bull_tp_mult': 1.1915800499435663, 'bull_tsl_mult': 0.9109197214481827, 'bull_time_stop': 143, 'bull_use_sma': False, 'bull_use_ema': False, 'bull_use_atr': False, 'bull_use_adx': False, 'bull_use_spike': False, 'bull_rsi_required': False, 'bear_strategy': 'breakout', 'bear_bb_std_mult': 3.4230134155572847, 'bear_rsi_os': 32, 'bear_rsi_ob': 87, 'bear_adx_thresh': 6.516458334207362, 'bear_atr_min_pct': 0.029142115248816925, 'bear_atr_max_pct': 0.1491995234015455, 'bear_tp_mult': 2.7964252022235847, 'bear_tsl_mult': 0.5803006389692779, 'bear_time_stop': 280, 'bear_use_sma': False, 'bear_use_ema': True, 'bear_use_atr': False, 'bear_use_adx': True, 'bear_use_spike': False, 'bear_rsi_required': False, 'sideways_strategy': 'mean_reversion', 'sideways_bb_std_mult': 0.8834144948790117, 'sideways_rsi_os': 41, 'sideways_rsi_ob': 64, 'sideways_adx_thresh': 22.212360683314714, 'sideways_atr_min_pct': 0.01941877321408311, 'sideways_atr_max_pct': 0.07704615655228177, 'sideways_tp_mult': 2.971096630420641, 'sideways_tsl_mult': 0.7731982203448345, 'sideways_time_stop': 108, 'sideways_use_sma': True, 'sideways_use_ema': False, 'sideways_use_atr': False, 'sideways_use_adx': False, 'sideways_use_spike': False, 'sideways_rsi_required': True}.
[I 2025-08-30 14:49:42,848] Trial 242 finished with values: [-0.013009385422888098, 0.012990451719771966] and parameters: {'p_sma': 45, 'p_std': 5, 'p_atr': 20, 'p_adx': 8, 'rsi_period': 26, 'ema1': 13, 'ema2': 46, 'slip_atr_k': 0.03395473224048443, 'slip_spread_k': 0.12702537357825985, 'spread_hl_frac': 0.008893214235101294, 'bb_std_mult': 3.333056571853517, 'rsi_os': 9, 'rsi_ob': 85, 'vol_spike': 0.09502601474317816, 'adx_thresh': 14.272642340904051, 'atr_min_pct': 0.002457203543232757, 'atr_max_pct': 0.07509144666200603, 'tp_mult': 2.1836212448007397, 'tsl_mult': 0.6204619032491405, 'strategy': 'breakout', 'time_stop': 249, 'use_sma': True, 'use_atr': False, 'use_adx': False, 'use_ema': False, 'use_spike': False, 'rsi_required': True, 'edge_k': 0.5372194978076987, 'edge_cap': 0.5170337855722776, 'bull_strategy': 'mean_reversion', 'bull_bb_std_mult': 2.9172696432975105, 'bull_rsi_os': 44, 'bull_rsi_ob': 47, 'bull_adx_thresh': 22.771481118519176, 'bull_atr_min_pct': 0.0026251950663460865, 'bull_atr_max_pct': 0.04257490868384669, 'bull_tp_mult': 1.1777650454690096, 'bull_tsl_mult': 0.9149574675244371, 'bull_time_stop': 154, 'bull_use_sma': True, 'bull_use_ema': False, 'bull_use_atr': False, 'bull_use_adx': False, 'bull_use_spike': False, 'bull_rsi_required': False, 'bear_strategy': 'breakout', 'bear_bb_std_mult': 3.4977617761118873, 'bear_rsi_os': 32, 'bear_rsi_ob': 88, 'bear_adx_thresh': 6.655256162875093, 'bear_atr_min_pct': 0.0281757624675574, 'bear_atr_max_pct': 0.015070757750553956, 'bear_tp_mult': 2.7962140266363096, 'bear_tsl_mult': 0.5505524795489455, 'bear_time_stop': 294, 'bear_use_sma': False, 'bear_use_ema': True, 'bear_use_atr': True, 'bear_use_adx': False, 'bear_use_spike': False, 'bear_rsi_required': False, 'sideways_strategy': 'mean_reversion', 'sideways_bb_std_mult': 0.9928386357184993, 'sideways_rsi_os': 40, 'sideways_rsi_ob': 64, 'sideways_adx_thresh': 21.988852842030454, 'sideways_atr_min_pct': 0.01827845488999431, 'sideways_atr_max_pct': 0.07227759522372536, 'sideways_tp_mult': 2.988764174503798, 'sideways_tsl_mult': 0.8135424704926613, 'sideways_time_stop': 86, 'sideways_use_sma': True, 'sideways_use_ema': False, 'sideways_use_atr': False, 'sideways_use_adx': False, 'sideways_use_spike': False, 'sideways_rsi_required': True}.
