[I 2025-08-30 14:53:39,277] Trial 271 finished with values: [-0.0068449894315230075, 0.006931088766538242] and parameters: {'p_sma': 42, 'p_std': 31, 'p_atr': 18, 'p_adx': 29, 'rsi_period': 26, 'ema1': 10, 'ema2': 53, 'slip_atr_k': 0.028679049865798244, 'slip_spread_k': 0.22810634211348324, 'spread_hl_frac': 0.0032211198374260037, 'bb_std_mult': 3.215746354300897, 'rsi_os': 7, 'rsi_ob': 94, 'vol_spike': 0.28390711796391427, 'adx_thresh': 15.267029112363307, 'atr_min_pct': 0.0027393834192568868, 'atr_max_pct': 0.0846178033895239, 'tp_mult': 2.394365862552036, 'tsl_mult': 0.5796440355685682, 'strategy': 'breakout', 'time_stop': 247, 'use_sma': False, 'use_atr': False, 'use_adx': True, 'use_ema': False, 'use_spike': False, 'rsi_required': False, 'edge_k': 0.46281753533476433, 'edge_cap': 0.5677397079872384, 'bull_strategy': 'breakout', 'bull_bb_std_mult': 2.7653770431079696, 'bull_rsi_os': 50, 'bull_rsi_ob': 48, 'bull_adx_thresh': 29.565763142567373, 'bull_atr_min_pct': 0.001339897433705013, 'bull_atr_max_pct': 0.06396040491698703, 'bull_tp_mult': 1.092862610265286, 'bull_tsl_mult': 0.9126398073762619, 'bull_time_stop': 122, 'bull_use_sma': True, 'bull_use_ema': True, 'bull_use_atr': False, 'bull_use_adx': False, 'bull_use_spike': True, 'bull_rsi_required': False, 'bear_strategy': 'mean_reversion', 'bear_bb_std_mult': 3.3548386062867515, 'bear_rsi_os': 33, 'bear_rsi_ob': 87, 'bear_adx_thresh': 5.950160796885793, 'bear_atr_min_pct': 0.029952540894610094, 'bear_atr_max_pct': 0.011163571480687022, 'bear_tp_mult': 2.8496182113609625, 'bear_tsl_mult': 0.485024340898755, 'bear_time_stop': 249, 'bear_use_sma': True, 'bear_use_ema': False, 'bear_use_atr': True, 'bear_use_adx': False, 'bear_use_spike': True, 'bear_rsi_required': True, 'sideways_strategy': 'mean_reversion', 'sideways_bb_std_mult': 1.0110449694027372, 'sideways_rsi_os': 39, 'sideways_rsi_ob': 59, 'sideways_adx_thresh': 18.924882136529774, 'sideways_atr_min_pct': 0.022685813899112305, 'sideways_atr_max_pct': 0.08364371219548013, 'sideways_tp_mult': 2.2844657592545765, 'sideways_tsl_mult': 0.9153812017199171, 'sideways_time_stop': 105, 'sideways_use_sma': True, 'sideways_use_ema': False, 'sideways_use_atr': True, 'sideways_use_adx': False, 'sideways_use_spike': True, 'sideways_rsi_required': True}.
[I 2025-08-30 14:53:39,469] Trial 270 finished with values: [-0.00701225573576425, 0.007036470020269156] and parameters: {'p_sma': 42, 'p_std': 31, 'p_atr': 18, 'p_adx': 29, 'rsi_period': 31, 'ema1': 10, 'ema2': 57, 'slip_atr_k': 0.027339147200386847, 'slip_spread_k': 0.23180946277292025, 'spread_hl_frac': 0.0028956337577306815, 'bb_std_mult': 3.197108422407196, 'rsi_os': 9, 'rsi_ob': 90, 'vol_spike': 0.28187962860699745, 'adx_thresh': 15.066353980600155, 'atr_min_pct': 0.002717307130593151, 'atr_max_pct': 0.0783534336514122, 'tp_mult': 2.383987010219237, 'tsl_mult': 0.5909693878808076, 'strategy': 'breakout', 'time_stop': 256, 'use_sma': False, 'use_atr': False, 'use_adx': True, 'use_ema': False, 'use_spike': False, 'rsi_required': False, 'edge_k': 0.48118542633583883, 'edge_cap': 0.5708910288649492, 'bull_strategy': 'breakout', 'bull_bb_std_mult': 2.7514972524413874, 'bull_rsi_os': 50, 'bull_rsi_ob': 46, 'bull_adx_thresh': 29.28171220551113, 'bull_atr_min_pct': 0.0013888142135254648, 'bull_atr_max_pct': 0.07516060415710737, 'bull_tp_mult': 1.0622915213269892, 'bull_tsl_mult': 0.9192631702920655, 'bull_time_stop': 120, 'bull_use_sma': True, 'bull_use_ema': True, 'bull_use_atr': False, 'bull_use_adx': False, 'bull_use_spike': True, 'bull_rsi_required': False, 'bear_strategy': 'mean_reversion', 'bear_bb_std_mult': 3.370168943454335, 'bear_rsi_os': 30, 'bear_rsi_ob': 89, 'bear_adx_thresh': 5.665190078583116, 'bear_atr_min_pct': 0.02995353238582628, 'bear_atr_max_pct': 0.010549299172478961, 'bear_tp_mult': 2.932983871808493, 'bear_tsl_mult': 0.5075017898847377, 'bear_time_stop': 261, 'bear_use_sma': True, 'bear_use_ema': False, 'bear_use_atr': True, 'bear_use_adx': False, 'bear_use_spike': True, 'bear_rsi_required': True, 'sideways_strategy': 'mean_reversion', 'sideways_bb_std_mult': 0.992488382294125, 'sideways_rsi_os': 39, 'sideways_rsi_ob': 58, 'sideways_adx_thresh': 18.93257852248468, 'sideways_atr_min_pct': 0.022619189092598333, 'sideways_atr_max_pct': 0.08515551446836724, 'sideways_tp_mult': 2.958920712142438, 'sideways_tsl_mult': 0.9418315035842335, 'sideways_time_stop': 103, 'sideways_use_sma': True, 'sideways_use_ema': False, 'sideways_use_atr': True, 'sideways_use_adx': False, 'sideways_use_spike': True, 'sideways_rsi_required': True}.
[I 2025-08-30 14:53:39,584] Trial 272 finished with values: [-0.006706966245467294, 0.006768959499617406] and parameters: {'p_sma': 42, 'p_std': 34, 'p_atr': 18, 'p_adx': 24, 'rsi_period': 28, 'ema1': 10, 'ema2': 50, 'slip_atr_k': 0.027682148520682154, 'slip_spread_k': 0.23754603388766332, 'spread_hl_frac': 0.003786926061176282, 'bb_std_mult': 3.2298008990416385, 'rsi_os': 9, 'rsi_ob': 91, 'vol_spike': 0.28266765329839766, 'adx_thresh': 14.832201158297142, 'atr_min_pct': 0.003255526213256456, 'atr_max_pct': 0.08519924945432597, 'tp_mult': 2.3859182328646806, 'tsl_mult': 0.5869716902592431, 'strategy': 'breakout', 'time_stop': 259, 'use_sma': False, 'use_atr': False, 'use_adx': True, 'use_ema': False, 'use_spike': False, 'rsi_required': False, 'edge_k': 0.4530108042006577, 'edge_cap': 0.5598815379918645, 'bull_strategy': 'breakout', 'bull_bb_std_mult': 2.735207199213517, 'bull_rsi_os': 50, 'bull_rsi_ob': 48, 'bull_adx_thresh': 29.865930467997384, 'bull_atr_min_pct': 0.0012985086408475112, 'bull_atr_max_pct': 0.08206877223725118, 'bull_tp_mult': 1.0637711558209126, 'bull_tsl_mult': 0.9091075735462503, 'bull_time_stop': 122, 'bull_use_sma': True, 'bull_use_ema': True, 'bull_use_atr': False, 'bull_use_adx': False, 'bull_use_spike': True, 'bull_rsi_required': False, 'bear_strategy': 'mean_reversion', 'bear_bb_std_mult': 3.3521614060935936, 'bear_rsi_os': 33, 'bear_rsi_ob': 87, 'bear_adx_thresh': 6.676116653162916, 'bear_atr_min_pct': 0.029984607528938015, 'bear_atr_max_pct': 0.010372979793162223, 'bear_tp_mult': 2.8614001085502108, 'bear_tsl_mult': 0.48489028035064374, 'bear_time_stop': 262, 'bear_use_sma': True, 'bear_use_ema': False, 'bear_use_atr': True, 'bear_use_adx': False, 'bear_use_spike': True, 'bear_rsi_required': True, 'sideways_strategy': 'mean_reversion', 'sideways_bb_std_mult': 1.0377359227953686, 'sideways_rsi_os': 37, 'sideways_rsi_ob': 58, 'sideways_adx_thresh': 18.94518864249616, 'sideways_atr_min_pct': 0.022693717789779154, 'sideways_atr_max_pct': 0.0824927713467295, 'sideways_tp_mult': 2.1425702547337684, 'sideways_tsl_mult': 0.9332816674472739, 'sideways_time_stop': 102, 'sideways_use_sma': True, 'sideways_use_ema': False, 'sideways_use_atr': True, 'sideways_use_adx': False, 'sideways_use_spike': True, 'sideways_rsi_required': True}.
[I 2025-08-30 14:54:11,412] Trial 273 finished with values: [-0.008153802700108459, 0.008157104464050354] and parameters: {'p_sma': 42, 'p_std': 31, 'p_atr': 18, 'p_adx': 25, 'rsi_period': 26, 'ema1': 10, 'ema2': 52, 'slip_atr_k': 0.029430895622155007, 'slip_spread_k': 0.23541270632937478, 'spread_hl_frac': 0.003946975084337442, 'bb_std_mult': 3.207948889271696, 'rsi_os': 9, 'rsi_ob': 91, 'vol_spike': 0.2825240526964372, 'adx_thresh': 15.063950305963669, 'atr_min_pct': 0.0028096973960506084, 'atr_max_pct': 0.08473902164334988, 'tp_mult': 2.3897305267864053, 'tsl_mult': 0.5859999537832982, 'strategy': 'breakout', 'time_stop': 257, 'use_sma': False, 'use_atr': False, 'use_adx': True, 'use_ema': False, 'use_spike': False, 'rsi_required': False, 'edge_k': 0.45958536623593593, 'edge_cap': 0.16619324195612156, 'bull_strategy': 'breakout', 'bull_bb_std_mult': 2.766101342006895, 'bull_rsi_os': 50, 'bull_rsi_ob': 48, 'bull_adx_thresh': 29.895839102196117, 'bull_atr_min_pct': 0.0012487970877093923, 'bull_atr_max_pct': 0.06331575357919979, 'bull_tp_mult': 1.0452222267913276, 'bull_tsl_mult': 0.9174755081656037, 'bull_time_stop': 122, 'bull_use_sma': True, 'bull_use_ema': True, 'bull_use_atr': False, 'bull_use_adx': False, 'bull_use_spike': True, 'bull_rsi_required': False, 'bear_strategy': 'mean_reversion', 'bear_bb_std_mult': 3.3283988079106424, 'bear_rsi_os': 30, 'bear_rsi_ob': 87, 'bear_adx_thresh': 6.015125128003783, 'bear_atr_min_pct': 0.02996335891148819, 'bear_atr_max_pct': 0.011035743276715736, 'bear_tp_mult': 2.8601830731459406, 'bear_tsl_mult': 0.47987305818445414, 'bear_time_stop': 261, 'bear_use_sma': True, 'bear_use_ema': False, 'bear_use_atr': True, 'bear_use_adx': False, 'bear_use_spike': True, 'bear_rsi_required': True, 'sideways_strategy': 'mean_reversion', 'sideways_bb_std_mult': 1.0130323563863655, 'sideways_rsi_os': 39, 'sideways_rsi_ob': 58, 'sideways_adx_thresh': 18.740908520266466, 'sideways_atr_min_pct': 0.02237700072551365, 'sideways_atr_max_pct': 0.08304079279893932, 'sideways_tp_mult': 2.29994834890632, 'sideways_tsl_mult': 0.9157785720065108, 'sideways_time_stop': 104, 'sideways_use_sma': True, 'sideways_use_ema': False, 'sideways_use_atr': True, 'sideways_use_adx': False, 'sideways_use_spike': True, 'sideways_rsi_required': True}.
[I 2025-08-30 14:54:11,547] Trial 274 finished with values: [-0.006661188445113653, 0.006676827189592853] and parameters: {'p_sma': 42, 'p_std': 36, 'p_atr': 18, 'p_adx': 25, 'rsi_period': 28, 'ema1': 11, 'ema2': 52, 'slip_atr_k': 0.028723361228684463, 'slip_spread_k': 0.22423990225577858, 'spread_hl_frac': 0.005395671347719273, 'bb_std_mult': 3.1996613235112408, 'rsi_os': 9, 'rsi_ob': 90, 'vol_spike': 0.29738913306295844, 'adx_thresh': 14.659513868497282, 'atr_min_pct': 0.0033810049473204282, 'atr_max_pct': 0.0851871700515016, 'tp_mult': 2.3923065953998925, 'tsl_mult': 0.5846074255854712, 'strategy': 'breakout', 'time_stop': 259, 'use_sma': False, 'use_atr': False, 'use_adx': True, 'use_ema': False, 'use_spike': False, 'rsi_required': False, 'edge_k': 0.3176491813369433, 'edge_cap': 0.8402495774013496, 'bull_strategy': 'breakout', 'bull_bb_std_mult': 2.759617644813218, 'bull_rsi_os': 48, 'bull_rsi_ob': 48, 'bull_adx_thresh': 29.765087692835284, 'bull_atr_min_pct': 0.001004861795700186, 'bull_atr_max_pct': 0.06296661033619198, 'bull_tp_mult': 1.095693149046286, 'bull_tsl_mult': 0.9178717321882403, 'bull_time_stop': 122, 'bull_use_sma': True, 'bull_use_ema': True, 'bull_use_atr': False, 'bull_use_adx': False, 'bull_use_spike': True, 'bull_rsi_required': False, 'bear_strategy': 'mean_reversion', 'bear_bb_std_mult': 3.3249926957880938, 'bear_rsi_os': 31, 'bear_rsi_ob': 89, 'bear_adx_thresh': 5.844187016886457, 'bear_atr_min_pct': 0.029870511221077894, 'bear_atr_max_pct': 0.010101496846403346, 'bear_tp_mult': 2.8557838894928618, 'bear_tsl_mult': 0.4874696978297565, 'bear_time_stop': 264, 'bear_use_sma': True, 'bear_use_ema': False, 'bear_use_atr': True, 'bear_use_adx': False, 'bear_use_spike': True, 'bear_rsi_required': True, 'sideways_strategy': 'mean_reversion', 'sideways_bb_std_mult': 1.0085741139615902, 'sideways_rsi_os': 37, 'sideways_rsi_ob': 59, 'sideways_adx_thresh': 18.81320907217181, 'sideways_atr_min_pct': 0.02209195758679901, 'sideways_atr_max_pct': 0.08009008522966658, 'sideways_tp_mult': 2.9618742161625025, 'sideways_tsl_mult': 0.9231325602704222, 'sideways_time_stop': 106, 'sideways_use_sma': True, 'sideways_use_ema': False, 'sideways_use_atr': True, 'sideways_use_adx': False, 'sideways_use_spike': True, 'sideways_rsi_required': True}.
[I 2025-08-30 14:54:11,633] Trial 275 finished with values: [-0.0062339912353670535, 0.006278011229854372] and parameters: {'p_sma': 42, 'p_std': 32, 'p_atr': 19, 'p_adx': 29, 'rsi_period': 26, 'ema1': 10, 'ema2': 52, 'slip_atr_k': 0.028615442472703742, 'slip_spread_k': 0.22466472345940186, 'spread_hl_frac': 0.003850521502047349, 'bb_std_mult': 3.1879378705647867, 'rsi_os': 7, 'rsi_ob': 91, 'vol_spike': 0.28256878978212424, 'adx_thresh': 15.280127947231124, 'atr_min_pct': 0.003080163659157836, 'atr_max_pct': 0.08295802926959929, 'tp_mult': 2.3854723983178108, 'tsl_mult': 0.5774240545198779, 'strategy': 'breakout', 'time_stop': 245, 'use_sma': False, 'use_atr': False, 'use_adx': True, 'use_ema': False, 'use_spike': False, 'rsi_required': False, 'edge_k': 0.3255989172043837, 'edge_cap': 0.8447237841963284, 'bull_strategy': 'breakout', 'bull_bb_std_mult': 2.7588001838195346, 'bull_rsi_os': 50, 'bull_rsi_ob': 48, 'bull_adx_thresh': 29.765737324250384, 'bull_atr_min_pct': 0.0013112592739706506, 'bull_atr_max_pct': 0.07932330039064209, 'bull_tp_mult': 1.1080388150189908, 'bull_tsl_mult': 0.9250178972650862, 'bull_time_stop': 121, 'bull_use_sma': True, 'bull_use_ema': True, 'bull_use_atr': False, 'bull_use_adx': False, 'bull_use_spike': True, 'bull_rsi_required': False, 'bear_strategy': 'mean_reversion', 'bear_bb_std_mult': 3.339627676894822, 'bear_rsi_os': 31, 'bear_rsi_ob': 87, 'bear_adx_thresh': 5.734628490463621, 'bear_atr_min_pct': 0.029883643626118533, 'bear_atr_max_pct': 0.011623377097900341, 'bear_tp_mult': 2.869532958623394, 'bear_tsl_mult': 0.5585800387497255, 'bear_time_stop': 260, 'bear_use_sma': True, 'bear_use_ema': False, 'bear_use_atr': True, 'bear_use_adx': False, 'bear_use_spike': True, 'bear_rsi_required': True, 'sideways_strategy': 'mean_reversion', 'sideways_bb_std_mult': 1.012790938377139, 'sideways_rsi_os': 37, 'sideways_rsi_ob': 58, 'sideways_adx_thresh': 18.888816507641476, 'sideways_atr_min_pct': 0.022717980023364705, 'sideways_atr_max_pct': 0.08312762824394676, 'sideways_tp_mult': 2.283188030389371, 'sideways_tsl_mult': 0.9075493604929357, 'sideways_time_stop': 105, 'sideways_use_sma': True, 'sideways_use_ema': False, 'sideways_use_atr': True, 'sideways_use_adx': False, 'sideways_use_spike': True, 'sideways_rsi_required': True}.
[I 2025-08-30 14:54:11,814] Trial 276 finished with values: [-0.007893637751888338, 0.007891735603440593] and parameters: {'p_sma': 42, 'p_std': 31, 'p_atr': 19, 'p_adx': 25, 'rsi_period': 28, 'ema1': 10, 'ema2': 50, 'slip_atr_k': 0.02830204961419128, 'slip_spread_k': 0.23103497117108718, 'spread_hl_frac': 0.003752343826454765, 'bb_std_mult': 3.206675555019307, 'rsi_os': 9, 'rsi_ob': 91, 'vol_spike': 0.2827643108439631, 'adx_thresh': 14.854706407466466, 'atr_min_pct': 0.0029578934072032924, 'atr_max_pct': 0.08810371756372358, 'tp_mult': 2.3661359457010946, 'tsl_mult': 0.5836936863737873, 'strategy': 'breakout', 'time_stop': 258, 'use_sma': False, 'use_atr': False, 'use_adx': True, 'use_ema': False, 'use_spike': False, 'rsi_required': False, 'edge_k': 0.43667812583450194, 'edge_cap': 0.5733041889314797, 'bull_strategy': 'breakout', 'bull_bb_std_mult': 2.829169162441841, 'bull_rsi_os': 50, 'bull_rsi_ob': 48, 'bull_adx_thresh': 30.231892784747036, 'bull_atr_min_pct': 0.001330624847177494, 'bull_atr_max_pct': 0.061368768371763555, 'bull_tp_mult': 1.1002945941997937, 'bull_tsl_mult': 0.9527737145099217, 'bull_time_stop': 122, 'bull_use_sma': True, 'bull_use_ema': True, 'bull_use_atr': False, 'bull_use_adx': False, 'bull_use_spike': True, 'bull_rsi_required': False, 'bear_strategy': 'mean_reversion', 'bear_bb_std_mult': 3.381433673073327, 'bear_rsi_os': 30, 'bear_rsi_ob': 87, 'bear_adx_thresh': 5.8820792340258095, 'bear_atr_min_pct': 0.029960519271442044, 'bear_atr_max_pct': 0.011086013109355988, 'bear_tp_mult': 2.8491993675603147, 'bear_tsl_mult': 0.5070832162703998, 'bear_time_stop': 261, 'bear_use_sma': True, 'bear_use_ema': False, 'bear_use_atr': True, 'bear_use_adx': True, 'bear_use_spike': True, 'bear_rsi_required': True, 'sideways_strategy': 'mean_reversion', 'sideways_bb_std_mult': 1.0178806817252337, 'sideways_rsi_os': 39, 'sideways_rsi_ob': 58, 'sideways_adx_thresh': 18.700095000155216, 'sideways_atr_min_pct': 0.02239816535391177, 'sideways_atr_max_pct': 0.08253855725924931, 'sideways_tp_mult': 2.307376746815638, 'sideways_tsl_mult': 0.9075500565183964, 'sideways_time_stop': 104, 'sideways_use_sma': True, 'sideways_use_ema': False, 'sideways_use_atr': True, 'sideways_use_adx': True, 'sideways_use_spike': True, 'sideways_rsi_required': True}.
[I 2025-08-30 14:54:43,482] Trial 277 finished with values: [-0.006190014420416667, 0.006276485246611042] and parameters: {'p_sma': 42, 'p_std': 32, 'p_atr': 18, 'p_adx': 29, 'rsi_period': 55, 'ema1': 10, 'ema2': 52, 'slip_atr_k': 0.026357262917770734, 'slip_spread_k': 0.23461423606186643, 'spread_hl_frac': 0.0033705074964276763, 'bb_std_mult': 3.117268947803005, 'rsi_os': 5, 'rsi_ob': 91, 'vol_spike': 0.28450093470210086, 'adx_thresh': 15.334707617472313, 'atr_min_pct': 0.003050996673552067, 'atr_max_pct': 0.08748665621515188, 'tp_mult': 2.394884460373748, 'tsl_mult': 0.5720576832000298, 'strategy': 'breakout', 'time_stop': 260, 'use_sma': False, 'use_atr': False, 'use_adx': True, 'use_ema': False, 'use_spike': False, 'rsi_required': False, 'edge_k': 0.2905417846681731, 'edge_cap': 0.8248120009133036, 'bull_strategy': 'breakout', 'bull_bb_std_mult': 2.6381571875489676, 'bull_rsi_os': 50, 'bull_rsi_ob': 48, 'bull_adx_thresh': 29.718540860550593, 'bull_atr_min_pct': 0.0013669597761913931, 'bull_atr_max_pct': 0.0807947650443617, 'bull_tp_mult': 1.010530701162454, 'bull_tsl_mult': 0.9195577665861288, 'bull_time_stop': 121, 'bull_use_sma': True, 'bull_use_ema': True, 'bull_use_atr': True, 'bull_use_adx': False, 'bull_use_spike': True, 'bull_rsi_required': False, 'bear_strategy': 'mean_reversion', 'bear_bb_std_mult': 3.2621071658666954, 'bear_rsi_os': 30, 'bear_rsi_ob': 85, 'bear_adx_thresh': 5.673025527948156, 'bear_atr_min_pct': 0.029921536032421595, 'bear_atr_max_pct': 0.010883005020457664, 'bear_tp_mult': 2.840102617643315, 'bear_tsl_mult': 0.5675680247120961, 'bear_time_stop': 261, 'bear_use_sma': True, 'bear_use_ema': False, 'bear_use_atr': True, 'bear_use_adx': True, 'bear_use_spike': True, 'bear_rsi_required': True, 'sideways_strategy': 'mean_reversion', 'sideways_bb_std_mult': 1.114151311033474, 'sideways_rsi_os': 36, 'sideways_rsi_ob': 57, 'sideways_adx_thresh': 18.41172029975105, 'sideways_atr_min_pct': 0.022571072467644906, 'sideways_atr_max_pct': 0.08695363190563041, 'sideways_tp_mult': 2.274169312136519, 'sideways_tsl_mult': 0.9125495482594058, 'sideways_time_stop': 102, 'sideways_use_sma': True, 'sideways_use_ema': False, 'sideways_use_atr': True, 'sideways_use_adx': True, 'sideways_use_spike': True, 'sideways_rsi_required': True}.
[I 2025-08-30 14:54:43,624] Trial 279 finished with values: [-0.006909710101292377, 0.006944410796010745] and parameters: {'p_sma': 42, 'p_std': 32, 'p_atr': 18, 'p_adx': 29, 'rsi_period': 28, 'ema1': 10, 'ema2': 52, 'slip_atr_k': 0.028486350279037634, 'slip_spread_k': 0.22544585937128597, 'spread_hl_frac': 0.002998282623049088, 'bb_std_mult': 3.0966447481795334, 'rsi_os': 5, 'rsi_ob': 91, 'vol_spike': 0.28399191852552913, 'adx_thresh': 15.079155037509445, 'atr_min_pct': 0.004671368210404416, 'atr_max_pct': 0.08854607152770451, 'tp_mult': 2.387191152792898, 'tsl_mult': 0.5801747098701437, 'strategy': 'breakout', 'time_stop': 253, 'use_sma': False, 'use_atr': False, 'use_adx': True, 'use_ema': False, 'use_spike': False, 'rsi_required': False, 'edge_k': 0.2933859666662524, 'edge_cap': 0.8490671284422352, 'bull_strategy': 'breakout', 'bull_bb_std_mult': 2.680056083762418, 'bull_rsi_os': 50, 'bull_rsi_ob': 48, 'bull_adx_thresh': 29.827058601039052, 'bull_atr_min_pct': 0.0010122660612693003, 'bull_atr_max_pct': 0.0815042347108442, 'bull_tp_mult': 1.0254957331709191, 'bull_tsl_mult': 0.9576669117681753, 'bull_time_stop': 123, 'bull_use_sma': True, 'bull_use_ema': True, 'bull_use_atr': True, 'bull_use_adx': False, 'bull_use_spike': True, 'bull_rsi_required': False, 'bear_strategy': 'mean_reversion', 'bear_bb_std_mult': 3.3403517866766466, 'bear_rsi_os': 30, 'bear_rsi_ob': 85, 'bear_adx_thresh': 5.438730217302442, 'bear_atr_min_pct': 0.02995540700997186, 'bear_atr_max_pct': 0.010252580342910088, 'bear_tp_mult': 2.843168991593793, 'bear_tsl_mult': 0.5737257022007946, 'bear_time_stop': 260, 'bear_use_sma': True, 'bear_use_ema': False, 'bear_use_atr': True, 'bear_use_adx': True, 'bear_use_spike': True, 'bear_rsi_required': True, 'sideways_strategy': 'mean_reversion', 'sideways_bb_std_mult': 1.1365260685384548, 'sideways_rsi_os': 36, 'sideways_rsi_ob': 57, 'sideways_adx_thresh': 18.450288798354602, 'sideways_atr_min_pct': 0.0227681832574777, 'sideways_atr_max_pct': 0.08732971208379094, 'sideways_tp_mult': 2.295091620040562, 'sideways_tsl_mult': 0.9407009344488905, 'sideways_time_stop': 101, 'sideways_use_sma': True, 'sideways_use_ema': False, 'sideways_use_atr': True, 'sideways_use_adx': True, 'sideways_use_spike': True, 'sideways_rsi_required': True}.
