[I 2025-08-30 15:05:46,889] Trial 358 finished with values: [-1000000000.0, 1000000000.0] and parameters: {'p_sma': 14, 'p_std': 35, 'p_atr': 17, 'p_adx': 29, 'rsi_period': 54, 'ema1': 9, 'ema2': 47, 'slip_atr_k': 0.15890332222255932, 'slip_spread_k': 0.9470494405103677, 'spread_hl_frac': 0.02021949510787693, 'bb_std_mult': 2.944598695200778, 'rsi_os': 6, 'rsi_ob': 50, 'vol_spike': 0.2375140035038082, 'adx_thresh': 8.545270726184567, 'atr_min_pct': 0.0054838812059394455, 'atr_max_pct': 0.06308592858788024, 'tp_mult': 2.4573600059399126, 'tsl_mult': 0.5294751221350572, 'strategy': 'breakout', 'time_stop': 21, 'use_sma': False, 'use_atr': False, 'use_adx': True, 'use_ema': False, 'use_spike': False, 'rsi_required': False, 'edge_k': 0.7806647778428062, 'edge_cap': 0.8204460890923386, 'bull_strategy': 'breakout', 'bull_bb_std_mult': 3.33013354175133, 'bull_rsi_os': 18, 'bull_rsi_ob': 72, 'bull_adx_thresh': 31.100591493512063, 'bull_atr_min_pct': 0.029136564325381954, 'bull_atr_max_pct': 0.08855856109249535, 'bull_tp_mult': 2.626282400333599, 'bull_tsl_mult': 0.46744807015990136, 'bull_time_stop': 13, 'bull_use_sma': True, 'bull_use_ema': True, 'bull_use_atr': True, 'bull_use_adx': False, 'bull_use_spike': True, 'bull_rsi_required': False, 'bear_strategy': 'mean_reversion', 'bear_bb_std_mult': 3.117024407757377, 'bear_rsi_os': 25, 'bear_rsi_ob': 51, 'bear_adx_thresh': 6.047733997331632, 'bear_atr_min_pct': 0.026905266618743408, 'bear_atr_max_pct': 0.03579815162884681, 'bear_tp_mult': 2.919486649402384, 'bear_tsl_mult': 0.6452315630227415, 'bear_time_stop': 28, 'bear_use_sma': True, 'bear_use_ema': False, 'bear_use_atr': True, 'bear_use_adx': True, 'bear_use_spike': True, 'bear_rsi_required': True, 'sideways_strategy': 'mean_reversion', 'sideways_bb_std_mult': 1.038971957028502, 'sideways_rsi_os': 34, 'sideways_rsi_ob': 58, 'sideways_adx_thresh': 19.217771731699102, 'sideways_atr_min_pct': 0.007612098970698316, 'sideways_atr_max_pct': 0.09140288724770296, 'sideways_tp_mult': 2.6265468688508196, 'sideways_tsl_mult': 0.29463602330038274, 'sideways_time_stop': 24, 'sideways_use_sma': True, 'sideways_use_ema': False, 'sideways_use_atr': True, 'sideways_use_adx': True, 'sideways_use_spike': True, 'sideways_rsi_required': True}.
[I 2025-08-30 15:06:21,819] Trial 361 finished with values: [-0.06003634865574059, 0.06000953444551103] and parameters: {'p_sma': 55, 'p_std': 59, 'p_atr': 17, 'p_adx': 29, 'rsi_period': 57, 'ema1': 10, 'ema2': 50, 'slip_atr_k': 0.16166976130041139, 'slip_spread_k': 0.28230780582879256, 'spread_hl_frac': 0.01924325295208846, 'bb_std_mult': 2.0701399687340376, 'rsi_os': 30, 'rsi_ob': 94, 'vol_spike': 0.22501980309971506, 'adx_thresh': 7.249732444954608, 'atr_min_pct': 0.0254185852276558, 'atr_max_pct': 0.09432830877904058, 'tp_mult': 1.0584658931170003, 'tsl_mult': 0.5281542417875221, 'strategy': 'breakout', 'time_stop': 261, 'use_sma': False, 'use_atr': False, 'use_adx': True, 'use_ema': False, 'use_spike': False, 'rsi_required': False, 'edge_k': 0.3316558279084655, 'edge_cap': 0.8205986641265783, 'bull_strategy': 'breakout', 'bull_bb_std_mult': 2.586715477452126, 'bull_rsi_os': 18, 'bull_rsi_ob': 92, 'bull_adx_thresh': 9.972699502055582, 'bull_atr_min_pct': 0.0014663599668389826, 'bull_atr_max_pct': 0.08759655039396107, 'bull_tp_mult': 1.0978470754164802, 'bull_tsl_mult': 0.09552487201921589, 'bull_time_stop': 277, 'bull_use_sma': True, 'bull_use_ema': True, 'bull_use_atr': True, 'bull_use_adx': False, 'bull_use_spike': True, 'bull_rsi_required': False, 'bear_strategy': 'mean_reversion', 'bear_bb_std_mult': 3.123641316876232, 'bear_rsi_os': 42, 'bear_rsi_ob': 56, 'bear_adx_thresh': 23.577039636565537, 'bear_atr_min_pct': 2.753817067618035e-05, 'bear_atr_max_pct': 0.03883879894670079, 'bear_tp_mult': 2.9241926768795463, 'bear_tsl_mult': 0.32417520130400657, 'bear_time_stop': 15, 'bear_use_sma': True, 'bear_use_ema': False, 'bear_use_atr': True, 'bear_use_adx': True, 'bear_use_spike': True, 'bear_rsi_required': True, 'sideways_strategy': 'mean_reversion', 'sideways_bb_std_mult': 0.9590715348930683, 'sideways_rsi_os': 34, 'sideways_rsi_ob': 58, 'sideways_adx_thresh': 29.88664299029133, 'sideways_atr_min_pct': 0.0033469433123492973, 'sideways_atr_max_pct': 0.09220846156484906, 'sideways_tp_mult': 2.425370699535169, 'sideways_tsl_mult': 0.29419842853360545, 'sideways_time_stop': 227, 'sideways_use_sma': True, 'sideways_use_ema': False, 'sideways_use_atr': True, 'sideways_use_adx': True, 'sideways_use_spike': True, 'sideways_rsi_required': True}.
[I 2025-08-30 15:06:23,105] Trial 364 finished with values: [-1000000000.0, 1000000000.0] and parameters: {'p_sma': 39, 'p_std': 33, 'p_atr': 11, 'p_adx': 30, 'rsi_period': 51, 'ema1': 10, 'ema2': 51, 'slip_atr_k': 0.010379812952624228, 'slip_spread_k': 0.33310132679117693, 'spread_hl_frac': 0.002162458931900182, 'bb_std_mult': 2.8228853343290847, 'rsi_os': 26, 'rsi_ob': 89, 'vol_spike': 0.22843140695198783, 'adx_thresh': 6.8480888037331, 'atr_min_pct': 0.021286593434472402, 'atr_max_pct': 0.1144987047304015, 'tp_mult': 1.0709580454970804, 'tsl_mult': 0.8261495015783913, 'strategy': 'breakout', 'time_stop': 253, 'use_sma': False, 'use_atr': False, 'use_adx': True, 'use_ema': False, 'use_spike': False, 'rsi_required': False, 'edge_k': 0.3340491719120216, 'edge_cap': 0.12020158091963584, 'bull_strategy': 'breakout', 'bull_bb_std_mult': 2.6573705240458803, 'bull_rsi_os': 21, 'bull_rsi_ob': 67, 'bull_adx_thresh': 34.50694368892138, 'bull_atr_min_pct': 0.028001936533899895, 'bull_atr_max_pct': 0.09237467304600208, 'bull_tp_mult': 1.096980086717235, 'bull_tsl_mult': 0.7952000707958695, 'bull_time_stop': 136, 'bull_use_sma': True, 'bull_use_ema': True, 'bull_use_atr': True, 'bull_use_adx': False, 'bull_use_spike': True, 'bull_rsi_required': True, 'bear_strategy': 'mean_reversion', 'bear_bb_std_mult': 2.222499367328008, 'bear_rsi_os': 25, 'bear_rsi_ob': 79, 'bear_adx_thresh': 6.541732937152558, 'bear_atr_min_pct': 0.0018735045245986872, 'bear_atr_max_pct': 0.0243790447893154, 'bear_tp_mult': 2.970872652555777, 'bear_tsl_mult': 0.10803712337774019, 'bear_time_stop': 5, 'bear_use_sma': True, 'bear_use_ema': False, 'bear_use_atr': True, 'bear_use_adx': True, 'bear_use_spike': True, 'bear_rsi_required': True, 'sideways_strategy': 'mean_reversion', 'sideways_bb_std_mult': 1.1517380811268731, 'sideways_rsi_os': 36, 'sideways_rsi_ob': 55, 'sideways_adx_thresh': 14.99861520068542, 'sideways_atr_min_pct': 0.023286410296578974, 'sideways_atr_max_pct': 0.0929395032889728, 'sideways_tp_mult': 2.3736867180122827, 'sideways_tsl_mult': 0.9990060264039884, 'sideways_time_stop': 241, 'sideways_use_sma': True, 'sideways_use_ema': False, 'sideways_use_atr': True, 'sideways_use_adx': True, 'sideways_use_spike': True, 'sideways_rsi_required': True}.
[I 2025-08-30 15:06:23,380] Trial 362 finished with values: [-1000000000.0, 1000000000.0] and parameters: {'p_sma': 43, 'p_std': 25, 'p_atr': 17, 'p_adx': 29, 'rsi_period': 51, 'ema1': 27, 'ema2': 50, 'slip_atr_k': 0.009914100658286934, 'slip_spread_k': 0.6521275139110523, 'spread_hl_frac': 0.0024376235482366894, 'bb_std_mult': 2.8007993248080787, 'rsi_os': 30, 'rsi_ob': 54, 'vol_spike': 0.2263692756807578, 'adx_thresh': 7.017407992544042, 'atr_min_pct': 0.005527325077086909, 'atr_max_pct': 0.09388307597350048, 'tp_mult': 2.6191285011757537, 'tsl_mult': 0.5292550829674371, 'strategy': 'breakout', 'time_stop': 254, 'use_sma': False, 'use_atr': False, 'use_adx': True, 'use_ema': False, 'use_spike': False, 'rsi_required': False, 'edge_k': 0.34152985328368013, 'edge_cap': 0.8279766300344111, 'bull_strategy': 'breakout', 'bull_bb_std_mult': 2.397936622479604, 'bull_rsi_os': 52, 'bull_rsi_ob': 88, 'bull_adx_thresh': 34.58724956576489, 'bull_atr_min_pct': 0.02800120236052691, 'bull_atr_max_pct': 0.08392243665595006, 'bull_tp_mult': 1.12552050698556, 'bull_tsl_mult': 0.7479019890912627, 'bull_time_stop': 278, 'bull_use_sma': True, 'bull_use_ema': True, 'bull_use_atr': True, 'bull_use_adx': False, 'bull_use_spike': True, 'bull_rsi_required': False, 'bear_strategy': 'mean_reversion', 'bear_bb_std_mult': 2.1436299639763337, 'bear_rsi_os': 25, 'bear_rsi_ob': 79, 'bear_adx_thresh': 9.812442409616322, 'bear_atr_min_pct': 0.01722810182158413, 'bear_atr_max_pct': 0.024061639521326537, 'bear_tp_mult': 2.9610533296761603, 'bear_tsl_mult': 0.6509538514201545, 'bear_time_stop': 246, 'bear_use_sma': True, 'bear_use_ema': False, 'bear_use_atr': True, 'bear_use_adx': True, 'bear_use_spike': True, 'bear_rsi_required': True, 'sideways_strategy': 'mean_reversion', 'sideways_bb_std_mult': 2.9239890338686783, 'sideways_rsi_os': 30, 'sideways_rsi_ob': 58, 'sideways_adx_thresh': 8.932497057684083, 'sideways_atr_min_pct': 0.014010545802028276, 'sideways_atr_max_pct': 0.058119903145228066, 'sideways_tp_mult': 2.3989180816385405, 'sideways_tsl_mult': 0.3033204566015129, 'sideways_time_stop': 86, 'sideways_use_sma': True, 'sideways_use_ema': False, 'sideways_use_atr': True, 'sideways_use_adx': True, 'sideways_use_spike': True, 'sideways_rsi_required': True}.
[I 2025-08-30 15:06:23,731] Trial 363 finished with values: [-0.016391456956590944, 0.0164403137929483] and parameters: {'p_sma': 43, 'p_std': 33, 'p_atr': 27, 'p_adx': 29, 'rsi_period': 51, 'ema1': 10, 'ema2': 50, 'slip_atr_k': 0.011420472772577838, 'slip_spread_k': 0.3284814581705496, 'spread_hl_frac': 0.0021197908951617267, 'bb_std_mult': 2.858817788687973, 'rsi_os': 30, 'rsi_ob': 57, 'vol_spike': 0.2243481261684789, 'adx_thresh': 7.069984118554164, 'atr_min_pct': 0.021141451661138316, 'atr_max_pct': 0.09363430696486423, 'tp_mult': 2.3722140064079613, 'tsl_mult': 0.4695435737225695, 'strategy': 'breakout', 'time_stop': 254, 'use_sma': False, 'use_atr': False, 'use_adx': True, 'use_ema': False, 'use_spike': False, 'rsi_required': False, 'edge_k': 0.898307563358925, 'edge_cap': 0.9910575414130418, 'bull_strategy': 'breakout', 'bull_bb_std_mult': 2.575195374985624, 'bull_rsi_os': 32, 'bull_rsi_ob': 88, 'bull_adx_thresh': 34.4875815248517, 'bull_atr_min_pct': 0.0008277846081867779, 'bull_atr_max_pct': 0.13042696309234794, 'bull_tp_mult': 1.121495990809396, 'bull_tsl_mult': 0.7964745908764871, 'bull_time_stop': 278, 'bull_use_sma': True, 'bull_use_ema': True, 'bull_use_atr': True, 'bull_use_adx': False, 'bull_use_spike': True, 'bull_rsi_required': True, 'bear_strategy': 'mean_reversion', 'bear_bb_std_mult': 2.239148688551138, 'bear_rsi_os': 25, 'bear_rsi_ob': 79, 'bear_adx_thresh': 8.892460239350283, 'bear_atr_min_pct': 0.020844202155721085, 'bear_atr_max_pct': 0.06684079917214894, 'bear_tp_mult': 2.229526073362172, 'bear_tsl_mult': 0.691725944862258, 'bear_time_stop': 16, 'bear_use_sma': True, 'bear_use_ema': False, 'bear_use_atr': True, 'bear_use_adx': True, 'bear_use_spike': True, 'bear_rsi_required': True, 'sideways_strategy': 'mean_reversion', 'sideways_bb_std_mult': 2.6441114651205355, 'sideways_rsi_os': 36, 'sideways_rsi_ob': 55, 'sideways_adx_thresh': 17.93590957866613, 'sideways_atr_min_pct': 0.000844555826124048, 'sideways_atr_max_pct': 0.09272008358039831, 'sideways_tp_mult': 2.4361098522281615, 'sideways_tsl_mult': 0.9843302764064551, 'sideways_time_stop': 240, 'sideways_use_sma': True, 'sideways_use_ema': False, 'sideways_use_atr': True, 'sideways_use_adx': True, 'sideways_use_spike': True, 'sideways_rsi_required': True}.
[I 2025-08-30 15:07:02,116] Trial 367 finished with values: [-1000000000.0, 1000000000.0] and parameters: {'p_sma': 27, 'p_std': 56, 'p_atr': 30, 'p_adx': 11, 'rsi_period': 45, 'ema1': 24, 'ema2': 40, 'slip_atr_k': 0.021309534785316216, 'slip_spread_k': 0.3203560562687829, 'spread_hl_frac': 0.0036322123559715796, 'bb_std_mult': 2.9146194219442485, 'rsi_os': 8, 'rsi_ob': 58, 'vol_spike': 0.24503466068581925, 'adx_thresh': 13.047672698225698, 'atr_min_pct': 0.008012961639722415, 'atr_max_pct': 0.052491456192354735, 'tp_mult': 2.5503251531968676, 'tsl_mult': 0.29556806113277534, 'strategy': 'breakout', 'time_stop': 126, 'use_sma': False, 'use_atr': False, 'use_adx': True, 'use_ema': False, 'use_spike': False, 'rsi_required': False, 'edge_k': 0.2831683014029904, 'edge_cap': 0.8973208126690417, 'bull_strategy': 'breakout', 'bull_bb_std_mult': 0.9909626958461659, 'bull_rsi_os': 53, 'bull_rsi_ob': 91, 'bull_adx_thresh': 33.603255561688734, 'bull_atr_min_pct': 0.024150433600047955, 'bull_atr_max_pct': 0.10832704186769834, 'bull_tp_mult': 2.333962857368965, 'bull_tsl_mult': 0.6937435465931732, 'bull_time_stop': 57, 'bull_use_sma': True, 'bull_use_ema': True, 'bull_use_atr': True, 'bull_use_adx': False, 'bull_use_spike': True, 'bull_rsi_required': True, 'bear_strategy': 'mean_reversion', 'bear_bb_std_mult': 3.209865754501464, 'bear_rsi_os': 27, 'bear_rsi_ob': 81, 'bear_adx_thresh': 5.413475636845997, 'bear_atr_min_pct': 0.021009536075077342, 'bear_atr_max_pct': 0.017572027858342856, 'bear_tp_mult': 2.998297454053366, 'bear_tsl_mult': 0.22008677731623916, 'bear_time_stop': 260, 'bear_use_sma': True, 'bear_use_ema': False, 'bear_use_atr': True, 'bear_use_adx': True, 'bear_use_spike': True, 'bear_rsi_required': True, 'sideways_strategy': 'mean_reversion', 'sideways_bb_std_mult': 1.2956140460155718, 'sideways_rsi_os': 37, 'sideways_rsi_ob': 49, 'sideways_adx_thresh': 30.545907644244846, 'sideways_atr_min_pct': 0.02349734976167552, 'sideways_atr_max_pct': 0.08927767062931699, 'sideways_tp_mult': 2.4664171110159248, 'sideways_tsl_mult': 0.9524037420026625, 'sideways_time_stop': 89, 'sideways_use_sma': True, 'sideways_use_ema': False, 'sideways_use_atr': True, 'sideways_use_adx': True, 'sideways_use_spike': True, 'sideways_rsi_required': True}.
[I 2025-08-30 15:07:02,478] Trial 365 finished with values: [-0.008294106965920811, 0.008259938282689653] and parameters: {'p_sma': 27, 'p_std': 45, 'p_atr': 27, 'p_adx': 30, 'rsi_period': 51, 'ema1': 8, 'ema2': 50, 'slip_atr_k': 0.011508914961176247, 'slip_spread_k': 0.3257481398291926, 'spread_hl_frac': 0.035644920266112226, 'bb_std_mult': 2.8128753421056465, 'rsi_os': 43, 'rsi_ob': 91, 'vol_spike': 0.22803782658589247, 'adx_thresh': 11.339865032285708, 'atr_min_pct': 0.005790709302567138, 'atr_max_pct': 0.11511172127579322, 'tp_mult': 2.3654560014325514, 'tsl_mult': 0.4869804185091592, 'strategy': 'breakout', 'time_stop': 125, 'use_sma': False, 'use_atr': False, 'use_adx': True, 'use_ema': False, 'use_spike': False, 'rsi_required': False, 'edge_k': 0.3439783386710895, 'edge_cap': 0.7846161549408887, 'bull_strategy': 'breakout', 'bull_bb_std_mult': 2.6653642771306765, 'bull_rsi_os': 53, 'bull_rsi_ob': 71, 'bull_adx_thresh': 10.992653725020359, 'bull_atr_min_pct': 0.0006020856298256233, 'bull_atr_max_pct': 0.13171080680375874, 'bull_tp_mult': 1.0391097216843592, 'bull_tsl_mult': 0.999898860856701, 'bull_time_stop': 182, 'bull_use_sma': True, 'bull_use_ema': True, 'bull_use_atr': True, 'bull_use_adx': False, 'bull_use_spike': True, 'bull_rsi_required': True, 'bear_strategy': 'mean_reversion', 'bear_bb_std_mult': 3.224788969555424, 'bear_rsi_os': 25, 'bear_rsi_ob': 79, 'bear_adx_thresh': 8.780959109133297, 'bear_atr_min_pct': 0.02608984174709794, 'bear_atr_max_pct': 0.017874330914991774, 'bear_tp_mult': 2.22961458809606, 'bear_tsl_mult': 0.1137389178562972, 'bear_time_stop': 44, 'bear_use_sma': True, 'bear_use_ema': False, 'bear_use_atr': True, 'bear_use_adx': True, 'bear_use_spike': True, 'bear_rsi_required': True, 'sideways_strategy': 'mean_reversion', 'sideways_bb_std_mult': 3.3482509617652525, 'sideways_rsi_os': 6, 'sideways_rsi_ob': 48, 'sideways_adx_thresh': 14.97155237932401, 'sideways_atr_min_pct': 0.023138171594195595, 'sideways_atr_max_pct': 0.03253658122973319, 'sideways_tp_mult': 2.388071942943876, 'sideways_tsl_mult': 0.9530970488546882, 'sideways_time_stop': 5, 'sideways_use_sma': True, 'sideways_use_ema': False, 'sideways_use_atr': True, 'sideways_use_adx': True, 'sideways_use_spike': True, 'sideways_rsi_required': True}.
[I 2025-08-30 15:07:02,690] Trial 368 finished with values: [-1000000000.0, 1000000000.0] and parameters: {'p_sma': 41, 'p_std': 45, 'p_atr': 7, 'p_adx': 30, 'rsi_period': 34, 'ema1': 8, 'ema2': 48, 'slip_atr_k': 0.019781417373026647, 'slip_spread_k': 0.2555143660779161, 'spread_hl_frac': 0.03896140665610766, 'bb_std_mult': 3.0153274268603276, 'rsi_os': 44, 'rsi_ob': 91, 'vol_spike': 0.25296782894003955, 'adx_thresh': 13.42821947484907, 'atr_min_pct': 0.007365447077841817, 'atr_max_pct': 0.05027457539574283, 'tp_mult': 1.4536347042132824, 'tsl_mult': 0.865282065515192, 'strategy': 'breakout', 'time_stop': 59, 'use_sma': False, 'use_atr': False, 'use_adx': True, 'use_ema': False, 'use_spike': False, 'rsi_required': False, 'edge_k': 1.3195033748515586, 'edge_cap': 0.8995407960112062, 'bull_strategy': 'breakout', 'bull_bb_std_mult': 2.478653788905351, 'bull_rsi_os': 53, 'bull_rsi_ob': 76, 'bull_adx_thresh': 33.36004245114371, 'bull_atr_min_pct': 0.0006722772327148714, 'bull_atr_max_pct': 0.09271983041661284, 'bull_tp_mult': 1.0460978769635545, 'bull_tsl_mult': 0.9999875429966427, 'bull_time_stop': 126, 'bull_use_sma': True, 'bull_use_ema': True, 'bull_use_atr': True, 'bull_use_adx': False, 'bull_use_spike': True, 'bull_rsi_required': False, 'bear_strategy': 'mean_reversion', 'bear_bb_std_mult': 3.207206071167274, 'bear_rsi_os': 27, 'bear_rsi_ob': 82, 'bear_adx_thresh': 5.431140445548069, 'bear_atr_min_pct': 0.02002265646327872, 'bear_atr_max_pct': 0.0977212648617198, 'bear_tp_mult': 2.877658913003509, 'bear_tsl_mult': 0.6726552455730288, 'bear_time_stop': 260, 'bear_use_sma': True, 'bear_use_ema': False, 'bear_use_atr': True, 'bear_use_adx': True, 'bear_use_spike': True, 'bear_rsi_required': True, 'sideways_strategy': 'mean_reversion', 'sideways_bb_std_mult': 3.598067268990307, 'sideways_rsi_os': 37, 'sideways_rsi_ob': 53, 'sideways_adx_thresh': 30.46525019371223, 'sideways_atr_min_pct': 0.025028697808979053, 'sideways_atr_max_pct': 0.09615995805418595, 'sideways_tp_mult': 1.749173478444177, 'sideways_tsl_mult': 0.9522399445714441, 'sideways_time_stop': 89, 'sideways_use_sma': True, 'sideways_use_ema': False, 'sideways_use_atr': True, 'sideways_use_adx': True, 'sideways_use_spike': True, 'sideways_rsi_required': True}.
[I 2025-08-30 15:07:02,976] Trial 366 finished with values: [-0.006840436127163563, 0.006849325975971202] and parameters: {'p_sma': 43, 'p_std': 43, 'p_atr': 27, 'p_adx': 17, 'rsi_period': 46, 'ema1': 11, 'ema2': 41, 'slip_atr_k': 0.020331443953897292, 'slip_spread_k': 0.2603880851946283, 'spread_hl_frac': 0.002640222466131752, 'bb_std_mult': 1.176236795565965, 'rsi_os': 52, 'rsi_ob': 59, 'vol_spike': 0.23216125179867625, 'adx_thresh': 13.235058353204671, 'atr_min_pct': 0.008170905670580084, 'atr_max_pct': 0.11902971952800212, 'tp_mult': 2.363135310782146, 'tsl_mult': 0.45992289505774014, 'strategy': 'breakout', 'time_stop': 13, 'use_sma': False, 'use_atr': False, 'use_adx': True, 'use_ema': False, 'use_spike': False, 'rsi_required': False, 'edge_k': 1.0815816541119645, 'edge_cap': 0.9795770010191964, 'bull_strategy': 'breakout', 'bull_bb_std_mult': 0.9951254715278586, 'bull_rsi_os': 33, 'bull_rsi_ob': 88, 'bull_adx_thresh': 33.29969313688104, 'bull_atr_min_pct': 0.0007953974342684269, 'bull_atr_max_pct': 0.1310754435297277, 'bull_tp_mult': 2.3436346687885106, 'bull_tsl_mult': 0.9957013114162464, 'bull_time_stop': 115, 'bull_use_sma': True, 'bull_use_ema': True, 'bull_use_atr': True, 'bull_use_adx': False, 'bull_use_spike': True, 'bull_rsi_required': False, 'bear_strategy': 'mean_reversion', 'bear_bb_std_mult': 3.211708302368321, 'bear_rsi_os': 27, 'bear_rsi_ob': 81, 'bear_adx_thresh': 9.79139876070662, 'bear_atr_min_pct': 0.025834000560665756, 'bear_atr_max_pct': 0.06658995217424356, 'bear_tp_mult': 2.9652381938947263, 'bear_tsl_mult': 0.22052539476985772, 'bear_time_stop': 260, 'bear_use_sma': True, 'bear_use_ema': False, 'bear_use_atr': True, 'bear_use_adx': True, 'bear_use_spike': True, 'bear_rsi_required': True, 'sideways_strategy': 'mean_reversion', 'sideways_bb_std_mult': 1.3150097695864165, 'sideways_rsi_os': 5, 'sideways_rsi_ob': 54, 'sideways_adx_thresh': 18.592348684038324, 'sideways_atr_min_pct': 0.025138288579920235, 'sideways_atr_max_pct': 0.09459572643354947, 'sideways_tp_mult': 1.5120970317175044, 'sideways_tsl_mult': 0.9569788405679505, 'sideways_time_stop': 87, 'sideways_use_sma': True, 'sideways_use_ema': False, 'sideways_use_atr': True, 'sideways_use_adx': True, 'sideways_use_spike': True, 'sideways_rsi_required': True}.
