[I 2025-08-30 15:22:13,287] Trial 443 finished with values: [-0.003652138025913021, 0.005222865706225753] and parameters: {'p_sma': 11, 'p_std': 20, 'p_atr': 13, 'p_adx': 23, 'rsi_period': 9, 'ema1': 25, 'ema2': 34, 'slip_atr_k': 0.010854208162663609, 'slip_spread_k': 0.7338958682285414, 'spread_hl_frac': 0.007457227062075642, 'bb_std_mult': 0.6459430759525522, 'rsi_os': 22, 'rsi_ob': 87, 'vol_spike': 0.21955089808186487, 'adx_thresh': 8.715351278584873, 'atr_min_pct': 0.007600975474569286, 'atr_max_pct': 0.12160430518937812, 'tp_mult': 1.5244340743602616, 'tsl_mult': 0.3654270773449985, 'strategy': 'breakout', 'time_stop': 151, 'use_sma': False, 'use_atr': False, 'use_adx': True, 'use_ema': False, 'use_spike': False, 'rsi_required': False, 'edge_k': 0.5709934304488176, 'edge_cap': 0.99120407800172, 'bull_strategy': 'breakout', 'bull_bb_std_mult': 1.8072826741653913, 'bull_rsi_os': 47, 'bull_rsi_ob': 90, 'bull_adx_thresh': 7.607748811785443, 'bull_atr_min_pct': 0.018412914705880083, 'bull_atr_max_pct': 0.10381888184980081, 'bull_tp_mult': 2.74890929030936, 'bull_tsl_mult': 0.7609103924571154, 'bull_time_stop': 37, 'bull_use_sma': True, 'bull_use_ema': True, 'bull_use_atr': True, 'bull_use_adx': True, 'bull_use_spike': True, 'bull_rsi_required': False, 'bear_strategy': 'mean_reversion', 'bear_bb_std_mult': 2.4467874592926298, 'bear_rsi_os': 27, 'bear_rsi_ob': 72, 'bear_adx_thresh': 16.25752223586141, 'bear_atr_min_pct': 0.0029626713743157685, 'bear_atr_max_pct': 0.10878278526380013, 'bear_tp_mult': 2.7274047256361413, 'bear_tsl_mult': 0.8572807844401349, 'bear_time_stop': 107, 'bear_use_sma': True, 'bear_use_ema': False, 'bear_use_atr': True, 'bear_use_adx': True, 'bear_use_spike': True, 'bear_rsi_required': True, 'sideways_strategy': 'mean_reversion', 'sideways_bb_std_mult': 3.038885031262105, 'sideways_rsi_os': 33, 'sideways_rsi_ob': 74, 'sideways_adx_thresh': 10.372196109581802, 'sideways_atr_min_pct': 0.021047586236121837, 'sideways_atr_max_pct': 0.07470495803039418, 'sideways_tp_mult': 2.155021583148644, 'sideways_tsl_mult': 0.39344671415974136, 'sideways_time_stop': 145, 'sideways_use_sma': True, 'sideways_use_ema': False, 'sideways_use_atr': True, 'sideways_use_adx': True, 'sideways_use_spike': True, 'sideways_rsi_required': True}.
[I 2025-08-30 15:22:14,405] Trial 444 finished with values: [-0.005797650719512104, 0.0077282323022272795] and parameters: {'p_sma': 11, 'p_std': 19, 'p_atr': 13, 'p_adx': 22, 'rsi_period': 10, 'ema1': 25, 'ema2': 34, 'slip_atr_k': 0.01170869805192533, 'slip_spread_k': 0.7418090184166952, 'spread_hl_frac': 0.007840579069139599, 'bb_std_mult': 0.6343259365850353, 'rsi_os': 22, 'rsi_ob': 86, 'vol_spike': 0.22137565702294268, 'adx_thresh': 9.466718723264487, 'atr_min_pct': 0.007476945431602185, 'atr_max_pct': 0.12213274089262456, 'tp_mult': 1.531788082917811, 'tsl_mult': 0.3695982530213241, 'strategy': 'breakout', 'time_stop': 164, 'use_sma': False, 'use_atr': False, 'use_adx': True, 'use_ema': False, 'use_spike': False, 'rsi_required': False, 'edge_k': 0.48570492591949976, 'edge_cap': 0.9924886431131881, 'bull_strategy': 'breakout', 'bull_bb_std_mult': 1.8574123062680885, 'bull_rsi_os': 48, 'bull_rsi_ob': 90, 'bull_adx_thresh': 7.870694405370802, 'bull_atr_min_pct': 0.018592225143551938, 'bull_atr_max_pct': 0.10023252116380675, 'bull_tp_mult': 2.6898527563329186, 'bull_tsl_mult': 0.7503994357528037, 'bull_time_stop': 39, 'bull_use_sma': True, 'bull_use_ema': True, 'bull_use_atr': True, 'bull_use_adx': True, 'bull_use_spike': True, 'bull_rsi_required': False, 'bear_strategy': 'mean_reversion', 'bear_bb_std_mult': 2.037435800472334, 'bear_rsi_os': 27, 'bear_rsi_ob': 73, 'bear_adx_thresh': 16.49684198743539, 'bear_atr_min_pct': 0.002415388678428629, 'bear_atr_max_pct': 0.10718904283200893, 'bear_tp_mult': 2.708212379333837, 'bear_tsl_mult': 0.8641823943030552, 'bear_time_stop': 109, 'bear_use_sma': True, 'bear_use_ema': False, 'bear_use_atr': True, 'bear_use_adx': True, 'bear_use_spike': True, 'bear_rsi_required': True, 'sideways_strategy': 'mean_reversion', 'sideways_bb_std_mult': 2.968468942323975, 'sideways_rsi_os': 33, 'sideways_rsi_ob': 74, 'sideways_adx_thresh': 10.38161339265161, 'sideways_atr_min_pct': 0.02101517921274554, 'sideways_atr_max_pct': 0.07577698964979016, 'sideways_tp_mult': 2.1625233560710875, 'sideways_tsl_mult': 0.403430224522075, 'sideways_time_stop': 148, 'sideways_use_sma': True, 'sideways_use_ema': False, 'sideways_use_atr': True, 'sideways_use_adx': True, 'sideways_use_spike': True, 'sideways_rsi_required': True}.
[I 2025-08-30 15:22:15,215] Trial 441 finished with values: [-1000000000.0, 1000000000.0] and parameters: {'p_sma': 16, 'p_std': 29, 'p_atr': 12, 'p_adx': 24, 'rsi_period': 51, 'ema1': 25, 'ema2': 36, 'slip_atr_k': 0.004431535057519408, 'slip_spread_k': 0.6890551064732316, 'spread_hl_frac': 0.004641540551048124, 'bb_std_mult': 0.6185796744771301, 'rsi_os': 21, 'rsi_ob': 70, 'vol_spike': 0.21823453160657824, 'adx_thresh': 8.471191528509024, 'atr_min_pct': 0.0063054290457252495, 'atr_max_pct': 0.05510805654838158, 'tp_mult': 1.6942505734924849, 'tsl_mult': 0.36455218237491294, 'strategy': 'breakout', 'time_stop': 132, 'use_sma': False, 'use_atr': False, 'use_adx': True, 'use_ema': False, 'use_spike': False, 'rsi_required': False, 'edge_k': 0.5681246984940258, 'edge_cap': 0.9794148441009637, 'bull_strategy': 'breakout', 'bull_bb_std_mult': 1.687205591495205, 'bull_rsi_os': 48, 'bull_rsi_ob': 90, 'bull_adx_thresh': 11.819230601814263, 'bull_atr_min_pct': 0.018407002155925296, 'bull_atr_max_pct': 0.13329404986778942, 'bull_tp_mult': 2.679871057476196, 'bull_tsl_mult': 0.739911151427377, 'bull_time_stop': 53, 'bull_use_sma': True, 'bull_use_ema': True, 'bull_use_atr': True, 'bull_use_adx': True, 'bull_use_spike': True, 'bull_rsi_required': True, 'bear_strategy': 'mean_reversion', 'bear_bb_std_mult': 1.1137304086205146, 'bear_rsi_os': 27, 'bear_rsi_ob': 59, 'bear_adx_thresh': 11.336234177884489, 'bear_atr_min_pct': 0.0025891828785703868, 'bear_atr_max_pct': 0.12610648938923397, 'bear_tp_mult': 2.7459880378575368, 'bear_tsl_mult': 0.20440289470271722, 'bear_time_stop': 106, 'bear_use_sma': True, 'bear_use_ema': False, 'bear_use_atr': True, 'bear_use_adx': True, 'bear_use_spike': True, 'bear_rsi_required': True, 'sideways_strategy': 'breakout', 'sideways_bb_std_mult': 3.320715536508012, 'sideways_rsi_os': 27, 'sideways_rsi_ob': 50, 'sideways_adx_thresh': 10.170420325063882, 'sideways_atr_min_pct': 0.007903719250952318, 'sideways_atr_max_pct': 0.07616504842687738, 'sideways_tp_mult': 2.1518418370377184, 'sideways_tsl_mult': 0.36193459007372686, 'sideways_time_stop': 255, 'sideways_use_sma': False, 'sideways_use_ema': True, 'sideways_use_atr': True, 'sideways_use_adx': True, 'sideways_use_spike': True, 'sideways_rsi_required': True}.
[I 2025-08-30 15:22:15,599] Trial 442 finished with values: [-1000000000.0, 1000000000.0] and parameters: {'p_sma': 16, 'p_std': 23, 'p_atr': 10, 'p_adx': 24, 'rsi_period': 51, 'ema1': 25, 'ema2': 35, 'slip_atr_k': 0.20514980624101753, 'slip_spread_k': 0.6968468475382786, 'spread_hl_frac': 0.004218815436443486, 'bb_std_mult': 3.2897085852598242, 'rsi_os': 22, 'rsi_ob': 55, 'vol_spike': 0.21895242118651279, 'adx_thresh': 8.50364460233919, 'atr_min_pct': 0.007488387836092351, 'atr_max_pct': 0.1121865822856837, 'tp_mult': 1.5470271842750853, 'tsl_mult': 0.37476377837129027, 'strategy': 'breakout', 'time_stop': 143, 'use_sma': False, 'use_atr': True, 'use_adx': True, 'use_ema': False, 'use_spike': False, 'rsi_required': False, 'edge_k': 0.4812391480269899, 'edge_cap': 0.9953132941267095, 'bull_strategy': 'breakout', 'bull_bb_std_mult': 1.6560327204822203, 'bull_rsi_os': 47, 'bull_rsi_ob': 88, 'bull_adx_thresh': 8.516431323538773, 'bull_atr_min_pct': 0.023513694218910405, 'bull_atr_max_pct': 0.13283508771569857, 'bull_tp_mult': 2.6622464656534053, 'bull_tsl_mult': 0.9212932952735347, 'bull_time_stop': 53, 'bull_use_sma': True, 'bull_use_ema': True, 'bull_use_atr': True, 'bull_use_adx': False, 'bull_use_spike': True, 'bull_rsi_required': True, 'bear_strategy': 'mean_reversion', 'bear_bb_std_mult': 1.9954735995260369, 'bear_rsi_os': 28, 'bear_rsi_ob': 75, 'bear_adx_thresh': 11.194485568718184, 'bear_atr_min_pct': 0.002571618795574938, 'bear_atr_max_pct': 0.13355347632437758, 'bear_tp_mult': 2.763606069747365, 'bear_tsl_mult': 0.1994170341832754, 'bear_time_stop': 109, 'bear_use_sma': True, 'bear_use_ema': False, 'bear_use_atr': True, 'bear_use_adx': True, 'bear_use_spike': True, 'bear_rsi_required': True, 'sideways_strategy': 'breakout', 'sideways_bb_std_mult': 3.3418938920176533, 'sideways_rsi_os': 30, 'sideways_rsi_ob': 50, 'sideways_adx_thresh': 10.377523090449044, 'sideways_atr_min_pct': 0.020249245539515508, 'sideways_atr_max_pct': 0.07773682809374757, 'sideways_tp_mult': 2.1410197343793897, 'sideways_tsl_mult': 0.36437793069306884, 'sideways_time_stop': 133, 'sideways_use_sma': False, 'sideways_use_ema': True, 'sideways_use_atr': True, 'sideways_use_adx': True, 'sideways_use_spike': True, 'sideways_rsi_required': True}.
[I 2025-08-30 15:23:02,411] Trial 447 finished with values: [-0.004918574579536483, 0.008488845836505547] and parameters: {'p_sma': 11, 'p_std': 19, 'p_atr': 13, 'p_adx': 23, 'rsi_period': 8, 'ema1': 25, 'ema2': 34, 'slip_atr_k': 0.010937143820853038, 'slip_spread_k': 0.7448142773243651, 'spread_hl_frac': 0.007672960837007303, 'bb_std_mult': 0.6666938263192097, 'rsi_os': 22, 'rsi_ob': 86, 'vol_spike': 0.2105044935516279, 'adx_thresh': 9.48917378668929, 'atr_min_pct': 0.007406911314997495, 'atr_max_pct': 0.12236066620210907, 'tp_mult': 1.539335428422084, 'tsl_mult': 0.3686380596227573, 'strategy': 'breakout', 'time_stop': 160, 'use_sma': False, 'use_atr': False, 'use_adx': True, 'use_ema': False, 'use_spike': False, 'rsi_required': False, 'edge_k': 0.49538657164220656, 'edge_cap': 0.9970941881009692, 'bull_strategy': 'breakout', 'bull_bb_std_mult': 1.8173840046688943, 'bull_rsi_os': 47, 'bull_rsi_ob': 88, 'bull_adx_thresh': 8.525500380175115, 'bull_atr_min_pct': 0.01888423730577968, 'bull_atr_max_pct': 0.1001406386608612, 'bull_tp_mult': 2.7370766374671636, 'bull_tsl_mult': 0.8078496787231295, 'bull_time_stop': 38, 'bull_use_sma': True, 'bull_use_ema': True, 'bull_use_atr': True, 'bull_use_adx': True, 'bull_use_spike': True, 'bull_rsi_required': False, 'bear_strategy': 'mean_reversion', 'bear_bb_std_mult': 1.9970427950180774, 'bear_rsi_os': 27, 'bear_rsi_ob': 73, 'bear_adx_thresh': 16.100901462774612, 'bear_atr_min_pct': 0.0025767473371931774, 'bear_atr_max_pct': 0.10767933526249365, 'bear_tp_mult': 2.718227350358313, 'bear_tsl_mult': 0.8555786035891243, 'bear_time_stop': 111, 'bear_use_sma': True, 'bear_use_ema': False, 'bear_use_atr': True, 'bear_use_adx': True, 'bear_use_spike': True, 'bear_rsi_required': True, 'sideways_strategy': 'mean_reversion', 'sideways_bb_std_mult': 3.0230713075692828, 'sideways_rsi_os': 32, 'sideways_rsi_ob': 77, 'sideways_adx_thresh': 10.499950295424837, 'sideways_atr_min_pct': 0.020973624870641947, 'sideways_atr_max_pct': 0.07560595962263439, 'sideways_tp_mult': 2.1703172821784893, 'sideways_tsl_mult': 0.3993170840793437, 'sideways_time_stop': 144, 'sideways_use_sma': True, 'sideways_use_ema': False, 'sideways_use_atr': True, 'sideways_use_adx': True, 'sideways_use_spike': True, 'sideways_rsi_required': True}.
[I 2025-08-30 15:23:02,738] Trial 446 finished with values: [-0.00851526813047676, 0.009889887115411337] and parameters: {'p_sma': 11, 'p_std': 21, 'p_atr': 13, 'p_adx': 22, 'rsi_period': 8, 'ema1': 25, 'ema2': 35, 'slip_atr_k': 0.010134193448541742, 'slip_spread_k': 0.743446462658893, 'spread_hl_frac': 0.007885139516871673, 'bb_std_mult': 0.6513707889031842, 'rsi_os': 21, 'rsi_ob': 87, 'vol_spike': 0.2169696858722241, 'adx_thresh': 9.56604473071988, 'atr_min_pct': 0.008296646005554714, 'atr_max_pct': 0.12217287557172422, 'tp_mult': 1.5424414569030582, 'tsl_mult': 0.3711785064719621, 'strategy': 'breakout', 'time_stop': 161, 'use_sma': False, 'use_atr': False, 'use_adx': True, 'use_ema': False, 'use_spike': False, 'rsi_required': False, 'edge_k': 0.4690940189049959, 'edge_cap': 0.9995375812806765, 'bull_strategy': 'breakout', 'bull_bb_std_mult': 1.8520921536114332, 'bull_rsi_os': 47, 'bull_rsi_ob': 90, 'bull_adx_thresh': 8.531850129475897, 'bull_atr_min_pct': 0.01902815108380856, 'bull_atr_max_pct': 0.10017176258468687, 'bull_tp_mult': 2.7710113081340855, 'bull_tsl_mult': 0.8163680857451436, 'bull_time_stop': 38, 'bull_use_sma': True, 'bull_use_ema': True, 'bull_use_atr': True, 'bull_use_adx': True, 'bull_use_spike': True, 'bull_rsi_required': False, 'bear_strategy': 'mean_reversion', 'bear_bb_std_mult': 1.7483376537726043, 'bear_rsi_os': 27, 'bear_rsi_ob': 73, 'bear_adx_thresh': 15.699269889898591, 'bear_atr_min_pct': 0.0023741552193161392, 'bear_atr_max_pct': 0.10715674476792593, 'bear_tp_mult': 2.7115419144053323, 'bear_tsl_mult': 0.8638808774708217, 'bear_time_stop': 108, 'bear_use_sma': True, 'bear_use_ema': False, 'bear_use_atr': True, 'bear_use_adx': True, 'bear_use_spike': True, 'bear_rsi_required': True, 'sideways_strategy': 'mean_reversion', 'sideways_bb_std_mult': 3.0470839844427657, 'sideways_rsi_os': 33, 'sideways_rsi_ob': 79, 'sideways_adx_thresh': 10.397602465909559, 'sideways_atr_min_pct': 0.021125192329292133, 'sideways_atr_max_pct': 0.07546004653714128, 'sideways_tp_mult': 2.155253039828096, 'sideways_tsl_mult': 0.39326596782094236, 'sideways_time_stop': 146, 'sideways_use_sma': True, 'sideways_use_ema': False, 'sideways_use_atr': True, 'sideways_use_adx': True, 'sideways_use_spike': True, 'sideways_rsi_required': True}.
[I 2025-08-30 15:23:03,152] Trial 445 finished with values: [-0.007836074453655195, 0.00843676416530147] and parameters: {'p_sma': 12, 'p_std': 20, 'p_atr': 13, 'p_adx': 23, 'rsi_period': 9, 'ema1': 25, 'ema2': 34, 'slip_atr_k': 0.010883233921360473, 'slip_spread_k': 0.7411194981606877, 'spread_hl_frac': 0.007750173224056904, 'bb_std_mult': 0.6449380572240315, 'rsi_os': 22, 'rsi_ob': 86, 'vol_spike': 0.22068219629091057, 'adx_thresh': 8.737559350598769, 'atr_min_pct': 0.007353667990003465, 'atr_max_pct': 0.12216949038297599, 'tp_mult': 1.5432573708620887, 'tsl_mult': 0.37397652514106355, 'strategy': 'breakout', 'time_stop': 163, 'use_sma': False, 'use_atr': False, 'use_adx': True, 'use_ema': False, 'use_spike': False, 'rsi_required': False, 'edge_k': 0.4706921783116354, 'edge_cap': 0.9967574953241354, 'bull_strategy': 'breakout', 'bull_bb_std_mult': 1.835339620583008, 'bull_rsi_os': 47, 'bull_rsi_ob': 90, 'bull_adx_thresh': 8.437322228451885, 'bull_atr_min_pct': 0.018844447762988787, 'bull_atr_max_pct': 0.100305781248669, 'bull_tp_mult': 2.696688501186836, 'bull_tsl_mult': 0.7800538603816638, 'bull_time_stop': 36, 'bull_use_sma': True, 'bull_use_ema': True, 'bull_use_atr': True, 'bull_use_adx': True, 'bull_use_spike': True, 'bull_rsi_required': False, 'bear_strategy': 'mean_reversion', 'bear_bb_std_mult': 1.9988430993433797, 'bear_rsi_os': 27, 'bear_rsi_ob': 73, 'bear_adx_thresh': 16.099302660914585, 'bear_atr_min_pct': 0.002258714998217075, 'bear_atr_max_pct': 0.10755731698550612, 'bear_tp_mult': 2.740951591760805, 'bear_tsl_mult': 0.8935966339678297, 'bear_time_stop': 108, 'bear_use_sma': True, 'bear_use_ema': False, 'bear_use_atr': True, 'bear_use_adx': True, 'bear_use_spike': True, 'bear_rsi_required': True, 'sideways_strategy': 'mean_reversion', 'sideways_bb_std_mult': 3.0203712864882233, 'sideways_rsi_os': 33, 'sideways_rsi_ob': 80, 'sideways_adx_thresh': 10.598554388445002, 'sideways_atr_min_pct': 0.0210538781651427, 'sideways_atr_max_pct': 0.07519982207739852, 'sideways_tp_mult': 2.1436755666824543, 'sideways_tsl_mult': 0.3982177045316396, 'sideways_time_stop': 135, 'sideways_use_sma': True, 'sideways_use_ema': False, 'sideways_use_atr': True, 'sideways_use_adx': True, 'sideways_use_spike': True, 'sideways_rsi_required': True}.
[I 2025-08-30 15:23:03,692] Trial 448 finished with values: [-1000000000.0, 1000000000.0] and parameters: {'p_sma': 12, 'p_std': 20, 'p_atr': 13, 'p_adx': 23, 'rsi_period': 9, 'ema1': 24, 'ema2': 34, 'slip_atr_k': 0.01148677855653932, 'slip_spread_k': 0.7377275081688808, 'spread_hl_frac': 0.00754635886772017, 'bb_std_mult': 0.650914064900028, 'rsi_os': 21, 'rsi_ob': 87, 'vol_spike': 0.20860966240386344, 'adx_thresh': 9.649768160322107, 'atr_min_pct': 0.00811444885795654, 'atr_max_pct': 0.11327683664636141, 'tp_mult': 1.5481024910032752, 'tsl_mult': 0.35667331982142786, 'strategy': 'breakout', 'time_stop': 161, 'use_sma': False, 'use_atr': False, 'use_adx': True, 'use_ema': False, 'use_spike': False, 'rsi_required': False, 'edge_k': 0.4769755090295734, 'edge_cap': 0.9979864092644384, 'bull_strategy': 'breakout', 'bull_bb_std_mult': 1.8131884239328961, 'bull_rsi_os': 47, 'bull_rsi_ob': 91, 'bull_adx_thresh': 8.123502135014354, 'bull_atr_min_pct': 0.018974004737084216, 'bull_atr_max_pct': 0.1033126112508682, 'bull_tp_mult': 2.690791047126271, 'bull_tsl_mult': 0.7867041004164134, 'bull_time_stop': 38, 'bull_use_sma': True, 'bull_use_ema': True, 'bull_use_atr': True, 'bull_use_adx': True, 'bull_use_spike': True, 'bull_rsi_required': False, 'bear_strategy': 'mean_reversion', 'bear_bb_std_mult': 2.552668789879214, 'bear_rsi_os': 26, 'bear_rsi_ob': 72, 'bear_adx_thresh': 16.14123604420242, 'bear_atr_min_pct': 0.003157345120087566, 'bear_atr_max_pct': 0.10749913477061447, 'bear_tp_mult': 2.7080893693499846, 'bear_tsl_mult': 0.8685809574781371, 'bear_time_stop': 116, 'bear_use_sma': True, 'bear_use_ema': False, 'bear_use_atr': True, 'bear_use_adx': True, 'bear_use_spike': True, 'bear_rsi_required': True, 'sideways_strategy': 'mean_reversion', 'sideways_bb_std_mult': 3.0454234548898964, 'sideways_rsi_os': 33, 'sideways_rsi_ob': 77, 'sideways_adx_thresh': 10.454653691172913, 'sideways_atr_min_pct': 0.02102150466834012, 'sideways_atr_max_pct': 0.07495876050370114, 'sideways_tp_mult': 2.179187867758178, 'sideways_tsl_mult': 0.40028230520427266, 'sideways_time_stop': 147, 'sideways_use_sma': True, 'sideways_use_ema': False, 'sideways_use_atr': True, 'sideways_use_adx': True, 'sideways_use_spike': True, 'sideways_rsi_required': True}.
[I 2025-08-30 15:23:51,109] Trial 451 finished with values: [-1000000000.0, 1000000000.0] and parameters: {'p_sma': 11, 'p_std': 19, 'p_atr': 13, 'p_adx': 23, 'rsi_period': 9, 'ema1': 24, 'ema2': 34, 'slip_atr_k': 0.01144353674049421, 'slip_spread_k': 0.7224663766453097, 'spread_hl_frac': 0.006817905100511548, 'bb_std_mult': 0.7181040140482344, 'rsi_os': 24, 'rsi_ob': 87, 'vol_spike': 0.20892395914829617, 'adx_thresh': 9.615506454360784, 'atr_min_pct': 0.008139095440038404, 'atr_max_pct': 0.11341338130222837, 'tp_mult': 1.5091384705624706, 'tsl_mult': 0.3440886214724555, 'strategy': 'breakout', 'time_stop': 155, 'use_sma': False, 'use_atr': False, 'use_adx': True, 'use_ema': False, 'use_spike': False, 'rsi_required': False, 'edge_k': 0.5947209734184538, 'edge_cap': 0.9710084127777672, 'bull_strategy': 'breakout', 'bull_bb_std_mult': 1.7562492259269895, 'bull_rsi_os': 48, 'bull_rsi_ob': 88, 'bull_adx_thresh': 7.883130908990479, 'bull_atr_min_pct': 0.01930347211647876, 'bull_atr_max_pct': 0.10351870914937679, 'bull_tp_mult': 2.6824459824481997, 'bull_tsl_mult': 0.8254719095749316, 'bull_time_stop': 43, 'bull_use_sma': True, 'bull_use_ema': True, 'bull_use_atr': True, 'bull_use_adx': True, 'bull_use_spike': True, 'bull_rsi_required': False, 'bear_strategy': 'mean_reversion', 'bear_bb_std_mult': 2.0079140643166085, 'bear_rsi_os': 26, 'bear_rsi_ob': 72, 'bear_adx_thresh': 16.529085120308146, 'bear_atr_min_pct': 0.004410789788663856, 'bear_atr_max_pct': 0.1095597646007826, 'bear_tp_mult': 2.713615734629258, 'bear_tsl_mult': 0.8577814525809015, 'bear_time_stop': 119, 'bear_use_sma': True, 'bear_use_ema': False, 'bear_use_atr': True, 'bear_use_adx': True, 'bear_use_spike': True, 'bear_rsi_required': True, 'sideways_strategy': 'mean_reversion', 'sideways_bb_std_mult': 2.973392813083696, 'sideways_rsi_os': 33, 'sideways_rsi_ob': 81, 'sideways_adx_thresh': 10.053748389502973, 'sideways_atr_min_pct': 0.021198627893472828, 'sideways_atr_max_pct': 0.06807051091465992, 'sideways_tp_mult': 2.187467516076804, 'sideways_tsl_mult': 0.37615715009831896, 'sideways_time_stop': 138, 'sideways_use_sma': True, 'sideways_use_ema': False, 'sideways_use_atr': True, 'sideways_use_adx': True, 'sideways_use_spike': True, 'sideways_rsi_required': True}.
