[I 2025-08-30 16:34:22,168] Trial 801 finished with values: [-1000000000.0, 1000000000.0] and parameters: {'p_sma': 59, 'p_std': 17, 'p_atr': 13, 'p_adx': 17, 'rsi_period': 12, 'ema1': 19, 'ema2': 15, 'slip_atr_k': 0.010971320983897886, 'slip_spread_k': 0.06231363891152386, 'spread_hl_frac': 0.003820936346182347, 'bb_std_mult': 0.5661745706494763, 'rsi_os': 25, 'rsi_ob': 82, 'vol_spike': 0.2076640529321232, 'adx_thresh': 9.625774247132192, 'atr_min_pct': 0.012629281115596941, 'atr_max_pct': 0.05738647757382968, 'tp_mult': 1.7426321248868963, 'tsl_mult': 0.1173211724277306, 'strategy': 'breakout', 'time_stop': 154, 'use_sma': False, 'use_atr': True, 'use_adx': True, 'use_ema': False, 'use_spike': True, 'rsi_required': False, 'edge_k': 0.6426364632327386, 'edge_cap': 0.11447079517833936, 'bull_strategy': 'breakout', 'bull_bb_std_mult': 3.3719242436133783, 'bull_rsi_os': 49, 'bull_rsi_ob': 91, 'bull_adx_thresh': 12.685807729466815, 'bull_atr_min_pct': 0.019163743722378883, 'bull_atr_max_pct': 0.10375745704659373, 'bull_tp_mult': 2.618182891608357, 'bull_tsl_mult': 0.9476752242914819, 'bull_time_stop': 281, 'bull_use_sma': True, 'bull_use_ema': False, 'bull_use_atr': True, 'bull_use_adx': False, 'bull_use_spike': True, 'bull_rsi_required': False, 'bear_strategy': 'mean_reversion', 'bear_bb_std_mult': 1.7699466255749325, 'bear_rsi_os': 25, 'bear_rsi_ob': 51, 'bear_adx_thresh': 15.451505569757149, 'bear_atr_min_pct': 0.004659499071412934, 'bear_atr_max_pct': 0.10729632240330174, 'bear_tp_mult': 1.11213629371606, 'bear_tsl_mult': 0.4143308301877837, 'bear_time_stop': 114, 'bear_use_sma': True, 'bear_use_ema': True, 'bear_use_atr': True, 'bear_use_adx': False, 'bear_use_spike': True, 'bear_rsi_required': True, 'sideways_strategy': 'mean_reversion', 'sideways_bb_std_mult': 3.2671941968210203, 'sideways_rsi_os': 30, 'sideways_rsi_ob': 70, 'sideways_adx_thresh': 15.858000842879438, 'sideways_atr_min_pct': 0.02111693120626361, 'sideways_atr_max_pct': 0.040045061091833034, 'sideways_tp_mult': 1.9206823927370373, 'sideways_tsl_mult': 0.29212691548409575, 'sideways_time_stop': 138, 'sideways_use_sma': True, 'sideways_use_ema': False, 'sideways_use_atr': False, 'sideways_use_adx': False, 'sideways_use_spike': True, 'sideways_rsi_required': True}.
[I 2025-08-30 16:34:24,715] Trial 803 finished with values: [-1000000000.0, 1000000000.0] and parameters: {'p_sma': 57, 'p_std': 13, 'p_atr': 10, 'p_adx': 24, 'rsi_period': 10, 'ema1': 8, 'ema2': 38, 'slip_atr_k': 0.011695927030878944, 'slip_spread_k': 0.724571629819809, 'spread_hl_frac': 0.032720487050425594, 'bb_std_mult': 0.5462673320805613, 'rsi_os': 30, 'rsi_ob': 87, 'vol_spike': 0.05444235505924816, 'adx_thresh': 20.71179612753055, 'atr_min_pct': 0.005228888615165619, 'atr_max_pct': 0.1155709438946174, 'tp_mult': 1.4121750988964732, 'tsl_mult': 0.3623740731057056, 'strategy': 'breakout', 'time_stop': 144, 'use_sma': False, 'use_atr': True, 'use_adx': True, 'use_ema': False, 'use_spike': True, 'rsi_required': False, 'edge_k': 1.9032764976658747, 'edge_cap': 0.9401256798262397, 'bull_strategy': 'breakout', 'bull_bb_std_mult': 3.3663433534603744, 'bull_rsi_os': 49, 'bull_rsi_ob': 89, 'bull_adx_thresh': 12.615960150601643, 'bull_atr_min_pct': 0.020214210698827166, 'bull_atr_max_pct': 0.10427379411096377, 'bull_tp_mult': 2.513107327552767, 'bull_tsl_mult': 0.09918167440533027, 'bull_time_stop': 42, 'bull_use_sma': True, 'bull_use_ema': True, 'bull_use_atr': True, 'bull_use_adx': True, 'bull_use_spike': False, 'bull_rsi_required': False, 'bear_strategy': 'mean_reversion', 'bear_bb_std_mult': 0.9764925960601336, 'bear_rsi_os': 14, 'bear_rsi_ob': 75, 'bear_adx_thresh': 15.331666850937758, 'bear_atr_min_pct': 0.0015912415246361038, 'bear_atr_max_pct': 0.1059720349954345, 'bear_tp_mult': 1.1092730120140697, 'bear_tsl_mult': 0.8600344676095508, 'bear_time_stop': 219, 'bear_use_sma': True, 'bear_use_ema': False, 'bear_use_atr': False, 'bear_use_adx': True, 'bear_use_spike': True, 'bear_rsi_required': True, 'sideways_strategy': 'mean_reversion', 'sideways_bb_std_mult': 3.075277202790739, 'sideways_rsi_os': 23, 'sideways_rsi_ob': 93, 'sideways_adx_thresh': 8.902203149664622, 'sideways_atr_min_pct': 0.020904150973918623, 'sideways_atr_max_pct': 0.03999782436057482, 'sideways_tp_mult': 1.4832358906686576, 'sideways_tsl_mult': 0.5489924813638511, 'sideways_time_stop': 132, 'sideways_use_sma': True, 'sideways_use_ema': False, 'sideways_use_atr': True, 'sideways_use_adx': False, 'sideways_use_spike': True, 'sideways_rsi_required': False}.
[I 2025-08-30 16:34:25,683] Trial 802 finished with values: [-0.034573034038453576, 0.03466553151362383] and parameters: {'p_sma': 57, 'p_std': 17, 'p_atr': 7, 'p_adx': 28, 'rsi_period': 12, 'ema1': 23, 'ema2': 37, 'slip_atr_k': 0.14619582511540086, 'slip_spread_k': 0.5500135739728104, 'spread_hl_frac': 0.03130798080723716, 'bb_std_mult': 0.5713469408046573, 'rsi_os': 24, 'rsi_ob': 83, 'vol_spike': 0.1270208672675184, 'adx_thresh': 20.843551504191968, 'atr_min_pct': 0.006559527806797328, 'atr_max_pct': 0.1113539537999875, 'tp_mult': 1.4220516051166874, 'tsl_mult': 0.7608758560636913, 'strategy': 'breakout', 'time_stop': 135, 'use_sma': False, 'use_atr': True, 'use_adx': True, 'use_ema': False, 'use_spike': True, 'rsi_required': False, 'edge_k': 1.2995088157091335, 'edge_cap': 0.9851375362682443, 'bull_strategy': 'breakout', 'bull_bb_std_mult': 3.400651416870481, 'bull_rsi_os': 36, 'bull_rsi_ob': 70, 'bull_adx_thresh': 28.681201482097993, 'bull_atr_min_pct': 0.020421299367001097, 'bull_atr_max_pct': 0.10441501043534122, 'bull_tp_mult': 2.619828802368934, 'bull_tsl_mult': 0.8821403514767966, 'bull_time_stop': 282, 'bull_use_sma': True, 'bull_use_ema': True, 'bull_use_atr': True, 'bull_use_adx': True, 'bull_use_spike': True, 'bull_rsi_required': False, 'bear_strategy': 'mean_reversion', 'bear_bb_std_mult': 1.143762045062191, 'bear_rsi_os': 25, 'bear_rsi_ob': 51, 'bear_adx_thresh': 15.379274046260692, 'bear_atr_min_pct': 0.0014178771763596867, 'bear_atr_max_pct': 0.10748378409769706, 'bear_tp_mult': 2.8100082695615387, 'bear_tsl_mult': 0.893108681062674, 'bear_time_stop': 116, 'bear_use_sma': True, 'bear_use_ema': False, 'bear_use_atr': False, 'bear_use_adx': True, 'bear_use_spike': True, 'bear_rsi_required': True, 'sideways_strategy': 'mean_reversion', 'sideways_bb_std_mult': 3.0607985460127933, 'sideways_rsi_os': 30, 'sideways_rsi_ob': 90, 'sideways_adx_thresh': 9.844645440067438, 'sideways_atr_min_pct': 0.01976884580498836, 'sideways_atr_max_pct': 0.06855198827779319, 'sideways_tp_mult': 1.6041808238330106, 'sideways_tsl_mult': 0.7204323751695442, 'sideways_time_stop': 134, 'sideways_use_sma': True, 'sideways_use_ema': False, 'sideways_use_atr': True, 'sideways_use_adx': False, 'sideways_use_spike': True, 'sideways_rsi_required': False}.
[I 2025-08-30 16:34:26,436] Trial 804 finished with values: [-1000000000.0, 1000000000.0] and parameters: {'p_sma': 35, 'p_std': 17, 'p_atr': 12, 'p_adx': 25, 'rsi_period': 10, 'ema1': 28, 'ema2': 37, 'slip_atr_k': 0.010219963281762305, 'slip_spread_k': 0.728901410243809, 'spread_hl_frac': 0.020469737726002846, 'bb_std_mult': 1.0083409718278256, 'rsi_os': 25, 'rsi_ob': 87, 'vol_spike': 0.22098075063866168, 'adx_thresh': 9.75688491677347, 'atr_min_pct': 0.007769820144893807, 'atr_max_pct': 0.06432881870410881, 'tp_mult': 1.749478439310517, 'tsl_mult': 0.36118186203881636, 'strategy': 'breakout', 'time_stop': 134, 'use_sma': False, 'use_atr': True, 'use_adx': True, 'use_ema': False, 'use_spike': True, 'rsi_required': False, 'edge_k': 0.5015642626124018, 'edge_cap': 0.9780747684408424, 'bull_strategy': 'breakout', 'bull_bb_std_mult': 1.36801758867145, 'bull_rsi_os': 18, 'bull_rsi_ob': 89, 'bull_adx_thresh': 9.447205950936203, 'bull_atr_min_pct': 0.02026789844503842, 'bull_atr_max_pct': 0.13527410667333312, 'bull_tp_mult': 1.3150543860415227, 'bull_tsl_mult': 0.10406113436793468, 'bull_time_stop': 42, 'bull_use_sma': True, 'bull_use_ema': True, 'bull_use_atr': True, 'bull_use_adx': True, 'bull_use_spike': False, 'bull_rsi_required': False, 'bear_strategy': 'mean_reversion', 'bear_bb_std_mult': 2.0276708196413757, 'bear_rsi_os': 27, 'bear_rsi_ob': 75, 'bear_adx_thresh': 31.202581627443895, 'bear_atr_min_pct': 0.021540687871848287, 'bear_atr_max_pct': 0.058256185532827666, 'bear_tp_mult': 2.8090265964237875, 'bear_tsl_mult': 0.4178052384334262, 'bear_time_stop': 93, 'bear_use_sma': True, 'bear_use_ema': False, 'bear_use_atr': False, 'bear_use_adx': True, 'bear_use_spike': True, 'bear_rsi_required': True, 'sideways_strategy': 'mean_reversion', 'sideways_bb_std_mult': 1.4037727110466105, 'sideways_rsi_os': 11, 'sideways_rsi_ob': 79, 'sideways_adx_thresh': 16.06974502725862, 'sideways_atr_min_pct': 0.02085113362305709, 'sideways_atr_max_pct': 0.0680283445164115, 'sideways_tp_mult': 1.4559657936337091, 'sideways_tsl_mult': 0.40596166147438373, 'sideways_time_stop': 124, 'sideways_use_sma': False, 'sideways_use_ema': False, 'sideways_use_atr': True, 'sideways_use_adx': False, 'sideways_use_spike': True, 'sideways_rsi_required': False}.
[I 2025-08-30 16:35:15,500] Trial 807 finished with values: [-0.011906511170136636, 0.013439534338235476] and parameters: {'p_sma': 9, 'p_std': 21, 'p_atr': 12, 'p_adx': 25, 'rsi_period': 7, 'ema1': 28, 'ema2': 39, 'slip_atr_k': 9.82103905984895e-05, 'slip_spread_k': 0.7528746139356144, 'spread_hl_frac': 0.016714801349797012, 'bb_std_mult': 1.302543235126913, 'rsi_os': 35, 'rsi_ob': 89, 'vol_spike': 0.22062469298416626, 'adx_thresh': 8.599422557625243, 'atr_min_pct': 0.007976975247541384, 'atr_max_pct': 0.09257738263951355, 'tp_mult': 1.4774559900583177, 'tsl_mult': 0.41544329658062, 'strategy': 'breakout', 'time_stop': 149, 'use_sma': False, 'use_atr': False, 'use_adx': False, 'use_ema': True, 'use_spike': False, 'rsi_required': True, 'edge_k': 0.1587229842796154, 'edge_cap': 0.9613703773602164, 'bull_strategy': 'mean_reversion', 'bull_bb_std_mult': 1.4212718512296634, 'bull_rsi_os': 45, 'bull_rsi_ob': 83, 'bull_adx_thresh': 9.327963076745922, 'bull_atr_min_pct': 0.017236144116587297, 'bull_atr_max_pct': 0.09863787962965659, 'bull_tp_mult': 2.5542065287790794, 'bull_tsl_mult': 0.3636458482540508, 'bull_time_stop': 56, 'bull_use_sma': True, 'bull_use_ema': True, 'bull_use_atr': False, 'bull_use_adx': True, 'bull_use_spike': False, 'bull_rsi_required': False, 'bear_strategy': 'breakout', 'bear_bb_std_mult': 2.0008158942133427, 'bear_rsi_os': 27, 'bear_rsi_ob': 77, 'bear_adx_thresh': 15.936696699397315, 'bear_atr_min_pct': 0.002526912540287978, 'bear_atr_max_pct': 0.12063292417947784, 'bear_tp_mult': 2.3038511443663596, 'bear_tsl_mult': 0.8438378927647122, 'bear_time_stop': 94, 'bear_use_sma': False, 'bear_use_ema': False, 'bear_use_atr': True, 'bear_use_adx': True, 'bear_use_spike': False, 'bear_rsi_required': True, 'sideways_strategy': 'mean_reversion', 'sideways_bb_std_mult': 1.4280051768037803, 'sideways_rsi_os': 16, 'sideways_rsi_ob': 95, 'sideways_adx_thresh': 11.351189634493467, 'sideways_atr_min_pct': 0.018605478663690212, 'sideways_atr_max_pct': 0.0755384401985912, 'sideways_tp_mult': 1.1361964802251696, 'sideways_tsl_mult': 0.4331630918296592, 'sideways_time_stop': 123, 'sideways_use_sma': False, 'sideways_use_ema': False, 'sideways_use_atr': True, 'sideways_use_adx': True, 'sideways_use_spike': False, 'sideways_rsi_required': True}.
[I 2025-08-30 16:35:15,866] Trial 806 finished with values: [-1000000000.0, 1000000000.0] and parameters: {'p_sma': 9, 'p_std': 21, 'p_atr': 11, 'p_adx': 25, 'rsi_period': 7, 'ema1': 24, 'ema2': 37, 'slip_atr_k': 3.1402372424743966e-05, 'slip_spread_k': 0.6984798255056611, 'spread_hl_frac': 0.02018008818113983, 'bb_std_mult': 1.2811646896277384, 'rsi_os': 52, 'rsi_ob': 60, 'vol_spike': 0.21885435837652847, 'adx_thresh': 8.410616034658881, 'atr_min_pct': 0.006595665412181239, 'atr_max_pct': 0.09230617622534439, 'tp_mult': 1.453776307239688, 'tsl_mult': 0.360398981167968, 'strategy': 'breakout', 'time_stop': 159, 'use_sma': False, 'use_atr': False, 'use_adx': False, 'use_ema': True, 'use_spike': False, 'rsi_required': False, 'edge_k': 0.4196387161600964, 'edge_cap': 0.9992587300611017, 'bull_strategy': 'mean_reversion', 'bull_bb_std_mult': 1.3475853442809607, 'bull_rsi_os': 18, 'bull_rsi_ob': 54, 'bull_adx_thresh': 9.16212932962663, 'bull_atr_min_pct': 0.009414087279441301, 'bull_atr_max_pct': 0.13541762591601791, 'bull_tp_mult': 2.5533150373400604, 'bull_tsl_mult': 0.3511230169625448, 'bull_time_stop': 56, 'bull_use_sma': True, 'bull_use_ema': True, 'bull_use_atr': True, 'bull_use_adx': True, 'bull_use_spike': True, 'bull_rsi_required': False, 'bear_strategy': 'breakout', 'bear_bb_std_mult': 2.255208718184589, 'bear_rsi_os': 27, 'bear_rsi_ob': 73, 'bear_adx_thresh': 15.918554212120295, 'bear_atr_min_pct': 0.009546837368381404, 'bear_atr_max_pct': 0.10084092145565393, 'bear_tp_mult': 1.7999177079663733, 'bear_tsl_mult': 0.22859932567047375, 'bear_time_stop': 92, 'bear_use_sma': False, 'bear_use_ema': False, 'bear_use_atr': False, 'bear_use_adx': True, 'bear_use_spike': True, 'bear_rsi_required': True, 'sideways_strategy': 'mean_reversion', 'sideways_bb_std_mult': 1.4813727365793241, 'sideways_rsi_os': 16, 'sideways_rsi_ob': 80, 'sideways_adx_thresh': 11.423715706650688, 'sideways_atr_min_pct': 0.018362378285332732, 'sideways_atr_max_pct': 0.06754860084440648, 'sideways_tp_mult': 2.81306577663455, 'sideways_tsl_mult': 0.7928744907804031, 'sideways_time_stop': 121, 'sideways_use_sma': False, 'sideways_use_ema': False, 'sideways_use_atr': True, 'sideways_use_adx': True, 'sideways_use_spike': True, 'sideways_rsi_required': False}.
[I 2025-08-30 16:35:16,268] Trial 805 finished with values: [-1000000000.0, 1000000000.0] and parameters: {'p_sma': 13, 'p_std': 21, 'p_atr': 12, 'p_adx': 28, 'rsi_period': 10, 'ema1': 28, 'ema2': 37, 'slip_atr_k': 0.00021117239206199236, 'slip_spread_k': 0.7482389178767257, 'spread_hl_frac': 0.019897239927367215, 'bb_std_mult': 1.5725003389108785, 'rsi_os': 51, 'rsi_ob': 87, 'vol_spike': 0.13024772418863567, 'adx_thresh': 8.694257095559983, 'atr_min_pct': 0.0066194171004236285, 'atr_max_pct': 0.11443835416182518, 'tp_mult': 1.4153099997862542, 'tsl_mult': 0.3629545217329396, 'strategy': 'breakout', 'time_stop': 142, 'use_sma': False, 'use_atr': True, 'use_adx': False, 'use_ema': False, 'use_spike': True, 'rsi_required': False, 'edge_k': 0.5274697030820098, 'edge_cap': 0.986738029491573, 'bull_strategy': 'breakout', 'bull_bb_std_mult': 3.5970442165325167, 'bull_rsi_os': 23, 'bull_rsi_ob': 70, 'bull_adx_thresh': 6.176275582332897, 'bull_atr_min_pct': 0.017403499499602855, 'bull_atr_max_pct': 0.13249337765838753, 'bull_tp_mult': 1.8560630416926838, 'bull_tsl_mult': 0.880995642681992, 'bull_time_stop': 42, 'bull_use_sma': True, 'bull_use_ema': True, 'bull_use_atr': True, 'bull_use_adx': True, 'bull_use_spike': False, 'bull_rsi_required': False, 'bear_strategy': 'mean_reversion', 'bear_bb_std_mult': 2.0099988199497343, 'bear_rsi_os': 27, 'bear_rsi_ob': 67, 'bear_adx_thresh': 16.08911131523919, 'bear_atr_min_pct': 0.003643223121305003, 'bear_atr_max_pct': 0.10519576965354271, 'bear_tp_mult': 2.7686913689309125, 'bear_tsl_mult': 0.8518051901387635, 'bear_time_stop': 149, 'bear_use_sma': True, 'bear_use_ema': False, 'bear_use_atr': False, 'bear_use_adx': True, 'bear_use_spike': True, 'bear_rsi_required': True, 'sideways_strategy': 'mean_reversion', 'sideways_bb_std_mult': 1.5053023419320863, 'sideways_rsi_os': 19, 'sideways_rsi_ob': 80, 'sideways_adx_thresh': 27.815522336379825, 'sideways_atr_min_pct': 0.018467046628232772, 'sideways_atr_max_pct': 0.06851060097316503, 'sideways_tp_mult': 2.7984568546252078, 'sideways_tsl_mult': 0.4030255432593072, 'sideways_time_stop': 129, 'sideways_use_sma': False, 'sideways_use_ema': False, 'sideways_use_atr': True, 'sideways_use_adx': False, 'sideways_use_spike': True, 'sideways_rsi_required': False}.
[I 2025-08-30 16:35:17,026] Trial 808 finished with values: [-1000000000.0, 1000000000.0] and parameters: {'p_sma': 9, 'p_std': 21, 'p_atr': 11, 'p_adx': 22, 'rsi_period': 66, 'ema1': 15, 'ema2': 41, 'slip_atr_k': 0.004473070975916227, 'slip_spread_k': 0.7447265494235648, 'spread_hl_frac': 0.009131572050538482, 'bb_std_mult': 0.7207510045441409, 'rsi_os': 26, 'rsi_ob': 60, 'vol_spike': 0.1420800304300968, 'adx_thresh': 8.69627276234893, 'atr_min_pct': 0.006014663742259884, 'atr_max_pct': 0.1145632313263848, 'tp_mult': 2.3297835518108365, 'tsl_mult': 0.1922921583270047, 'strategy': 'breakout', 'time_stop': 161, 'use_sma': False, 'use_atr': False, 'use_adx': False, 'use_ema': True, 'use_spike': False, 'rsi_required': True, 'edge_k': 0.5936564315659613, 'edge_cap': 0.4827392327941648, 'bull_strategy': 'mean_reversion', 'bull_bb_std_mult': 1.4410130991662045, 'bull_rsi_os': 41, 'bull_rsi_ob': 80, 'bull_adx_thresh': 17.719511642410044, 'bull_atr_min_pct': 0.00907794458049795, 'bull_atr_max_pct': 0.06601145687250251, 'bull_tp_mult': 2.5487774075081093, 'bull_tsl_mult': 0.35693524278188205, 'bull_time_stop': 54, 'bull_use_sma': True, 'bull_use_ema': True, 'bull_use_atr': False, 'bull_use_adx': True, 'bull_use_spike': True, 'bull_rsi_required': True, 'bear_strategy': 'breakout', 'bear_bb_std_mult': 1.9578369190372136, 'bear_rsi_os': 29, 'bear_rsi_ob': 77, 'bear_adx_thresh': 16.24622074701388, 'bear_atr_min_pct': 0.0035908527024082347, 'bear_atr_max_pct': 0.1363859552550088, 'bear_tp_mult': 2.492524340936972, 'bear_tsl_mult': 0.8469794004750325, 'bear_time_stop': 100, 'bear_use_sma': False, 'bear_use_ema': False, 'bear_use_atr': True, 'bear_use_adx': True, 'bear_use_spike': False, 'bear_rsi_required': True, 'sideways_strategy': 'breakout', 'sideways_bb_std_mult': 0.8519204421717703, 'sideways_rsi_os': 17, 'sideways_rsi_ob': 68, 'sideways_adx_thresh': 11.526028833061964, 'sideways_atr_min_pct': 0.029429800623049084, 'sideways_atr_max_pct': 0.05328301520240096, 'sideways_tp_mult': 1.1301141689275027, 'sideways_tsl_mult': 0.4329756284888167, 'sideways_time_stop': 293, 'sideways_use_sma': False, 'sideways_use_ema': False, 'sideways_use_atr': True, 'sideways_use_adx': True, 'sideways_use_spike': False, 'sideways_rsi_required': True}.
[I 2025-08-30 16:36:01,112] Trial 809 finished with values: [-1000000000.0, 1000000000.0] and parameters: {'p_sma': 13, 'p_std': 23, 'p_atr': 11, 'p_adx': 26, 'rsi_period': 75, 'ema1': 22, 'ema2': 12, 'slip_atr_k': 0.06131363626261127, 'slip_spread_k': 0.6975104965190404, 'spread_hl_frac': 0.022802617707463356, 'bb_std_mult': 1.5917123844834327, 'rsi_os': 26, 'rsi_ob': 80, 'vol_spike': 0.21167783268843737, 'adx_thresh': 8.393350736859103, 'atr_min_pct': 0.005644724816897944, 'atr_max_pct': 0.11317661481599614, 'tp_mult': 1.465228228185826, 'tsl_mult': 0.2838855823662275, 'strategy': 'breakout', 'time_stop': 160, 'use_sma': True, 'use_atr': False, 'use_adx': False, 'use_ema': False, 'use_spike': False, 'rsi_required': False, 'edge_k': 1.1189661485810343, 'edge_cap': 0.4743208241993822, 'bull_strategy': 'breakout', 'bull_bb_std_mult': 1.0914946884236076, 'bull_rsi_os': 31, 'bull_rsi_ob': 88, 'bull_adx_thresh': 5.7775923987524, 'bull_atr_min_pct': 0.009439385899838868, 'bull_atr_max_pct': 0.06688762954140783, 'bull_tp_mult': 1.8459519901865593, 'bull_tsl_mult': 0.8620770204935141, 'bull_time_stop': 53, 'bull_use_sma': True, 'bull_use_ema': True, 'bull_use_atr': True, 'bull_use_adx': True, 'bull_use_spike': True, 'bull_rsi_required': True, 'bear_strategy': 'mean_reversion', 'bear_bb_std_mult': 2.27665034029007, 'bear_rsi_os': 29, 'bear_rsi_ob': 73, 'bear_adx_thresh': 28.925102465396108, 'bear_atr_min_pct': 0.020837266026562905, 'bear_atr_max_pct': 0.11399856236062436, 'bear_tp_mult': 1.4755209566202476, 'bear_tsl_mult': 0.28631773887880274, 'bear_time_stop': 101, 'bear_use_sma': True, 'bear_use_ema': False, 'bear_use_atr': True, 'bear_use_adx': True, 'bear_use_spike': True, 'bear_rsi_required': True, 'sideways_strategy': 'breakout', 'sideways_bb_std_mult': 1.5716256475553305, 'sideways_rsi_os': 38, 'sideways_rsi_ob': 66, 'sideways_adx_thresh': 21.888925124014435, 'sideways_atr_min_pct': 0.015767380339234666, 'sideways_atr_max_pct': 0.05207218796046584, 'sideways_tp_mult': 2.8306620369072952, 'sideways_tsl_mult': 0.7886177396081551, 'sideways_time_stop': 72, 'sideways_use_sma': True, 'sideways_use_ema': False, 'sideways_use_atr': True, 'sideways_use_adx': True, 'sideways_use_spike': True, 'sideways_rsi_required': True}.
