[I 2025-08-30 14:23:52,676] Trial 25 finished with values: [-1000000000.0, 1000000000.0] and parameters: {'p_sma': 39, 'p_std': 5, 'p_atr': 15, 'p_adx': 10, 'rsi_period': 58, 'ema1': 14, 'ema2': 20, 'slip_atr_k': 0.09139501688478263, 'slip_spread_k': 0.6651006764205899, 'spread_hl_frac': 0.029067079025519034, 'bb_std_mult': 0.8925072387314417, 'rsi_os': 6, 'rsi_ob': 73, 'vol_spike': 0.1756011336216945, 'adx_thresh': 30.320493680183535, 'atr_min_pct': 0.011865383623532125, 'atr_max_pct': 0.02480560522112817, 'tp_mult': 1.9048387094941819, 'tsl_mult': 0.2268446967644798, 'strategy': 'breakout', 'time_stop': 207, 'use_sma': False, 'use_atr': False, 'use_adx': False, 'use_ema': True, 'use_spike': False, 'rsi_required': True, 'edge_k': 1.9823312961132604, 'edge_cap': 0.3954081429786482, 'bull_strategy': 'mean_reversion', 'bull_bb_std_mult': 1.5855083625987922, 'bull_rsi_os': 20, 'bull_rsi_ob': 79, 'bull_adx_thresh': 31.483763497432182, 'bull_atr_min_pct': 0.01689695716690715, 'bull_atr_max_pct': 0.03278353362173975, 'bull_tp_mult': 1.2326684609169378, 'bull_tsl_mult': 0.8320490549110598, 'bull_time_stop': 183, 'bull_use_sma': False, 'bull_use_ema': True, 'bull_use_atr': False, 'bull_use_adx': False, 'bull_use_spike': False, 'bull_rsi_required': False, 'bear_strategy': 'breakout', 'bear_bb_std_mult': 1.6846429260116986, 'bear_rsi_os': 16, 'bear_rsi_ob': 89, 'bear_adx_thresh': 34.01661786576824, 'bear_atr_min_pct': 0.014053908343227142, 'bear_atr_max_pct': 0.12918458572720176, 'bear_tp_mult': 1.41673215249794, 'bear_tsl_mult': 0.9862591941024497, 'bear_time_stop': 212, 'bear_use_sma': True, 'bear_use_ema': True, 'bear_use_atr': False, 'bear_use_adx': False, 'bear_use_spike': True, 'bear_rsi_required': False, 'sideways_strategy': 'breakout', 'sideways_bb_std_mult': 3.182085441775722, 'sideways_rsi_os': 39, 'sideways_rsi_ob': 86, 'sideways_adx_thresh': 13.653985116096335, 'sideways_atr_min_pct': 0.026819463684148257, 'sideways_atr_max_pct': 0.03088496627660557, 'sideways_tp_mult': 2.95554107763427, 'sideways_tsl_mult': 0.16478645528815816, 'sideways_time_stop': 183, 'sideways_use_sma': True, 'sideways_use_ema': True, 'sideways_use_atr': True, 'sideways_use_adx': False, 'sideways_use_spike': False, 'sideways_rsi_required': False}.
[I 2025-08-30 14:24:23,813] Trial 30 finished with values: [-1000000000.0, 1000000000.0] and parameters: {'p_sma': 36, 'p_std': 14, 'p_atr': 20, 'p_adx': 7, 'rsi_period': 70, 'ema1': 10, 'ema2': 43, 'slip_atr_k': 0.1424762556778994, 'slip_spread_k': 0.7793392470630163, 'spread_hl_frac': 0.009270726243018414, 'bb_std_mult': 0.5246136022764302, 'rsi_os': 25, 'rsi_ob': 85, 'vol_spike': 0.05356574960335163, 'adx_thresh': 26.719920625407745, 'atr_min_pct': 0.025224206350511764, 'atr_max_pct': 0.12207188475765635, 'tp_mult': 2.518605847043368, 'tsl_mult': 0.10814986267632953, 'strategy': 'breakout', 'time_stop': 254, 'use_sma': False, 'use_atr': False, 'use_adx': False, 'use_ema': True, 'use_spike': False, 'rsi_required': True, 'edge_k': 0.9030233639940397, 'edge_cap': 0.5507348266629841, 'bull_strategy': 'mean_reversion', 'bull_bb_std_mult': 0.7261919188505115, 'bull_rsi_os': 18, 'bull_rsi_ob': 88, 'bull_adx_thresh': 14.343627443183637, 'bull_atr_min_pct': 0.00402638618415762, 'bull_atr_max_pct': 0.09126599116814507, 'bull_tp_mult': 1.0191712602972594, 'bull_tsl_mult': 0.7102880369054633, 'bull_time_stop': 289, 'bull_use_sma': False, 'bull_use_ema': True, 'bull_use_atr': False, 'bull_use_adx': False, 'bull_use_spike': False, 'bull_rsi_required': False, 'bear_strategy': 'breakout', 'bear_bb_std_mult': 0.798054415656312, 'bear_rsi_os': 33, 'bear_rsi_ob': 87, 'bear_adx_thresh': 31.9299221917847, 'bear_atr_min_pct': 0.005115702296877871, 'bear_atr_max_pct': 0.14888996447699424, 'bear_tp_mult': 1.8126557715767486, 'bear_tsl_mult': 0.36165514559424633, 'bear_time_stop': 172, 'bear_use_sma': True, 'bear_use_ema': True, 'bear_use_atr': False, 'bear_use_adx': False, 'bear_use_spike': True, 'bear_rsi_required': False, 'sideways_strategy': 'mean_reversion', 'sideways_bb_std_mult': 2.112726247569301, 'sideways_rsi_os': 11, 'sideways_rsi_ob': 75, 'sideways_adx_thresh': 8.936911489442679, 'sideways_atr_min_pct': 0.02293603938372791, 'sideways_atr_max_pct': 0.13550339775273937, 'sideways_tp_mult': 2.6285619833538476, 'sideways_tsl_mult': 0.32301486929350803, 'sideways_time_stop': 227, 'sideways_use_sma': True, 'sideways_use_ema': True, 'sideways_use_atr': True, 'sideways_use_adx': False, 'sideways_use_spike': False, 'sideways_rsi_required': False}.
[I 2025-08-30 14:24:24,041] Trial 29 finished with values: [-1000000000.0, 1000000000.0] and parameters: {'p_sma': 31, 'p_std': 12, 'p_atr': 24, 'p_adx': 8, 'rsi_period': 72, 'ema1': 30, 'ema2': 43, 'slip_atr_k': 0.026097075905756044, 'slip_spread_k': 0.4662239859351718, 'spread_hl_frac': 0.007930101147365554, 'bb_std_mult': 2.0505372709059277, 'rsi_os': 14, 'rsi_ob': 84, 'vol_spike': 0.0412517462837812, 'adx_thresh': 34.96808398180834, 'atr_min_pct': 0.00916417989087485, 'atr_max_pct': 0.1175884064687597, 'tp_mult': 1.864740014000948, 'tsl_mult': 0.1133308675574691, 'strategy': 'breakout', 'time_stop': 253, 'use_sma': False, 'use_atr': False, 'use_adx': False, 'use_ema': True, 'use_spike': False, 'rsi_required': True, 'edge_k': 0.8514385173759313, 'edge_cap': 0.5563067188155996, 'bull_strategy': 'mean_reversion', 'bull_bb_std_mult': 0.7438134977970108, 'bull_rsi_os': 20, 'bull_rsi_ob': 57, 'bull_adx_thresh': 14.275037310655616, 'bull_atr_min_pct': 0.0030271248290209517, 'bull_atr_max_pct': 0.09359350834855854, 'bull_tp_mult': 1.011782131530659, 'bull_tsl_mult': 0.6777967285510675, 'bull_time_stop': 205, 'bull_use_sma': False, 'bull_use_ema': True, 'bull_use_atr': False, 'bull_use_adx': False, 'bull_use_spike': False, 'bull_rsi_required': False, 'bear_strategy': 'breakout', 'bear_bb_std_mult': 1.880655234641041, 'bear_rsi_os': 25, 'bear_rsi_ob': 56, 'bear_adx_thresh': 31.955964043433216, 'bear_atr_min_pct': 0.012260120589743666, 'bear_atr_max_pct': 0.14965952055095788, 'bear_tp_mult': 1.8683494582028928, 'bear_tsl_mult': 0.3984169785160202, 'bear_time_stop': 173, 'bear_use_sma': True, 'bear_use_ema': True, 'bear_use_atr': True, 'bear_use_adx': True, 'bear_use_spike': True, 'bear_rsi_required': False, 'sideways_strategy': 'mean_reversion', 'sideways_bb_std_mult': 3.345247629282554, 'sideways_rsi_os': 10, 'sideways_rsi_ob': 74, 'sideways_adx_thresh': 14.08818921575664, 'sideways_atr_min_pct': 0.021868267505347434, 'sideways_atr_max_pct': 0.1471300383678253, 'sideways_tp_mult': 2.697759441091035, 'sideways_tsl_mult': 0.5745469994925129, 'sideways_time_stop': 232, 'sideways_use_sma': True, 'sideways_use_ema': False, 'sideways_use_atr': True, 'sideways_use_adx': False, 'sideways_use_spike': True, 'sideways_rsi_required': False}.
[I 2025-08-30 14:24:24,124] Trial 31 finished with values: [-1000000000.0, 1000000000.0] and parameters: {'p_sma': 24, 'p_std': 57, 'p_atr': 27, 'p_adx': 7, 'rsi_period': 70, 'ema1': 10, 'ema2': 29, 'slip_atr_k': 0.14382447570184032, 'slip_spread_k': 0.7680762297413358, 'spread_hl_frac': 0.009234757678741875, 'bb_std_mult': 1.9916426000591834, 'rsi_os': 23, 'rsi_ob': 87, 'vol_spike': 0.04912152111003178, 'adx_thresh': 26.20498773973599, 'atr_min_pct': 0.014566201226457439, 'atr_max_pct': 0.11795231633980299, 'tp_mult': 2.5577420850999197, 'tsl_mult': 0.11395237419778269, 'strategy': 'breakout', 'time_stop': 254, 'use_sma': False, 'use_atr': False, 'use_adx': False, 'use_ema': True, 'use_spike': False, 'rsi_required': True, 'edge_k': 0.7912127990347484, 'edge_cap': 0.5741599015689381, 'bull_strategy': 'mean_reversion', 'bull_bb_std_mult': 0.7261224791303234, 'bull_rsi_os': 29, 'bull_rsi_ob': 57, 'bull_adx_thresh': 13.708167827496267, 'bull_atr_min_pct': 0.0034914536384660615, 'bull_atr_max_pct': 0.06775810100884558, 'bull_tp_mult': 1.0103492571388422, 'bull_tsl_mult': 0.7094315105161173, 'bull_time_stop': 35, 'bull_use_sma': False, 'bull_use_ema': True, 'bull_use_atr': False, 'bull_use_adx': False, 'bull_use_spike': False, 'bull_rsi_required': False, 'bear_strategy': 'breakout', 'bear_bb_std_mult': 1.2624308235598356, 'bear_rsi_os': 33, 'bear_rsi_ob': 55, 'bear_adx_thresh': 31.247979969342097, 'bear_atr_min_pct': 0.004594049816876932, 'bear_atr_max_pct': 0.11217958133740383, 'bear_tp_mult': 1.8542474754706473, 'bear_tsl_mult': 0.4265966555552111, 'bear_time_stop': 167, 'bear_use_sma': True, 'bear_use_ema': True, 'bear_use_atr': False, 'bear_use_adx': False, 'bear_use_spike': True, 'bear_rsi_required': False, 'sideways_strategy': 'mean_reversion', 'sideways_bb_std_mult': 2.1356555563843833, 'sideways_rsi_os': 9, 'sideways_rsi_ob': 75, 'sideways_adx_thresh': 8.816154243239257, 'sideways_atr_min_pct': 0.022488515487412424, 'sideways_atr_max_pct': 0.056236201176525516, 'sideways_tp_mult': 2.710685529081174, 'sideways_tsl_mult': 0.8067745514017679, 'sideways_time_stop': 229, 'sideways_use_sma': True, 'sideways_use_ema': True, 'sideways_use_atr': True, 'sideways_use_adx': False, 'sideways_use_spike': False, 'sideways_rsi_required': False}.
[I 2025-08-30 14:24:24,292] Trial 28 finished with values: [-1000000000.0, 1000000000.0] and parameters: {'p_sma': 36, 'p_std': 12, 'p_atr': 27, 'p_adx': 9, 'rsi_period': 69, 'ema1': 9, 'ema2': 43, 'slip_atr_k': 0.035371792544667546, 'slip_spread_k': 0.47815257744627326, 'spread_hl_frac': 0.008720804839732104, 'bb_std_mult': 1.896130085143529, 'rsi_os': 13, 'rsi_ob': 88, 'vol_spike': 0.05593527659742732, 'adx_thresh': 26.89623137907997, 'atr_min_pct': 0.00904064488504265, 'atr_max_pct': 0.01978351366700898, 'tp_mult': 1.8887951693657241, 'tsl_mult': 0.972667672125444, 'strategy': 'breakout', 'time_stop': 264, 'use_sma': False, 'use_atr': False, 'use_adx': False, 'use_ema': True, 'use_spike': False, 'rsi_required': True, 'edge_k': 0.9405599924400526, 'edge_cap': 0.5749608661501946, 'bull_strategy': 'mean_reversion', 'bull_bb_std_mult': 1.3338797670054579, 'bull_rsi_os': 23, 'bull_rsi_ob': 57, 'bull_adx_thresh': 32.252474656737164, 'bull_atr_min_pct': 0.0035414724478777665, 'bull_atr_max_pct': 0.05814774855055815, 'bull_tp_mult': 1.1787112772925208, 'bull_tsl_mult': 0.8399363024462917, 'bull_time_stop': 192, 'bull_use_sma': False, 'bull_use_ema': True, 'bull_use_atr': False, 'bull_use_adx': False, 'bull_use_spike': False, 'bull_rsi_required': False, 'bear_strategy': 'breakout', 'bear_bb_std_mult': 1.7370833595139117, 'bear_rsi_os': 16, 'bear_rsi_ob': 89, 'bear_adx_thresh': 31.974442667053275, 'bear_atr_min_pct': 0.012674021045083236, 'bear_atr_max_pct': 0.13813985860238595, 'bear_tp_mult': 1.9203937222408642, 'bear_tsl_mult': 0.5662780647539281, 'bear_time_stop': 163, 'bear_use_sma': True, 'bear_use_ema': True, 'bear_use_atr': False, 'bear_use_adx': False, 'bear_use_spike': True, 'bear_rsi_required': False, 'sideways_strategy': 'breakout', 'sideways_bb_std_mult': 3.317570845892089, 'sideways_rsi_os': 36, 'sideways_rsi_ob': 84, 'sideways_adx_thresh': 5.35330147141204, 'sideways_atr_min_pct': 0.02208521446931564, 'sideways_atr_max_pct': 0.026526433216895642, 'sideways_tp_mult': 2.682744959173354, 'sideways_tsl_mult': 0.5768808874671417, 'sideways_time_stop': 223, 'sideways_use_sma': True, 'sideways_use_ema': True, 'sideways_use_atr': True, 'sideways_use_adx': False, 'sideways_use_spike': False, 'sideways_rsi_required': False}.
[I 2025-08-30 14:24:55,376] Trial 35 finished with values: [-1000000000.0, 1000000000.0] and parameters: {'p_sma': 7, 'p_std': 52, 'p_atr': 19, 'p_adx': 13, 'rsi_period': 49, 'ema1': 21, 'ema2': 36, 'slip_atr_k': 0.11021506643623565, 'slip_spread_k': 0.6130089157750254, 'spread_hl_frac': 0.0415317776168368, 'bb_std_mult': 1.241071741752054, 'rsi_os': 17, 'rsi_ob': 80, 'vol_spike': 0.23011245381695655, 'adx_thresh': 21.452508406250995, 'atr_min_pct': 0.00303136400306578, 'atr_max_pct': 0.03223759767700874, 'tp_mult': 1.6663539213696272, 'tsl_mult': 0.8403233681213689, 'strategy': 'breakout', 'time_stop': 40, 'use_sma': True, 'use_atr': False, 'use_adx': True, 'use_ema': True, 'use_spike': False, 'rsi_required': True, 'edge_k': 1.432189234605769, 'edge_cap': 0.28202059499028975, 'bull_strategy': 'mean_reversion', 'bull_bb_std_mult': 1.0088869279048536, 'bull_rsi_os': 15, 'bull_rsi_ob': 87, 'bull_adx_thresh': 18.779946086745124, 'bull_atr_min_pct': 0.0014736428991829894, 'bull_atr_max_pct': 0.06935228934954515, 'bull_tp_mult': 1.3708883372678182, 'bull_tsl_mult': 0.41761244725405594, 'bull_time_stop': 41, 'bull_use_sma': False, 'bull_use_ema': False, 'bull_use_atr': False, 'bull_use_adx': True, 'bull_use_spike': False, 'bull_rsi_required': False, 'bear_strategy': 'breakout', 'bear_bb_std_mult': 1.3191059872374327, 'bear_rsi_os': 20, 'bear_rsi_ob': 94, 'bear_adx_thresh': 26.871829698115686, 'bear_atr_min_pct': 0.0007156348828061196, 'bear_atr_max_pct': 0.07576363916598297, 'bear_tp_mult': 2.955921077630981, 'bear_tsl_mult': 0.6154363173129427, 'bear_time_stop': 110, 'bear_use_sma': True, 'bear_use_ema': False, 'bear_use_atr': False, 'bear_use_adx': True, 'bear_use_spike': False, 'bear_rsi_required': False, 'sideways_strategy': 'breakout', 'sideways_bb_std_mult': 2.897798601262131, 'sideways_rsi_os': 15, 'sideways_rsi_ob': 90, 'sideways_adx_thresh': 21.137219771568688, 'sideways_atr_min_pct': 0.0287427241836788, 'sideways_atr_max_pct': 0.02046314431519859, 'sideways_tp_mult': 2.8176172448164643, 'sideways_tsl_mult': 0.7586649298127854, 'sideways_time_stop': 167, 'sideways_use_sma': True, 'sideways_use_ema': True, 'sideways_use_atr': True, 'sideways_use_adx': True, 'sideways_use_spike': True, 'sideways_rsi_required': False}.
[I 2025-08-30 14:24:55,413] Trial 32 finished with values: [-1000000000.0, 1000000000.0] and parameters: {'p_sma': 23, 'p_std': 60, 'p_atr': 24, 'p_adx': 12, 'rsi_period': 74, 'ema1': 16, 'ema2': 29, 'slip_atr_k': 0.025315325002306543, 'slip_spread_k': 0.4642228002414546, 'spread_hl_frac': 0.038646388647410365, 'bb_std_mult': 1.9224298055349378, 'rsi_os': 15, 'rsi_ob': 89, 'vol_spike': 0.2649987041460736, 'adx_thresh': 33.20874528153942, 'atr_min_pct': 0.01423049317194129, 'atr_max_pct': 0.01575383229665365, 'tp_mult': 1.0129354261833452, 'tsl_mult': 0.9704197929714784, 'strategy': 'breakout', 'time_stop': 259, 'use_sma': False, 'use_atr': False, 'use_adx': False, 'use_ema': True, 'use_spike': False, 'rsi_required': True, 'edge_k': 1.4832710700642258, 'edge_cap': 0.15621616563094548, 'bull_strategy': 'mean_reversion', 'bull_bb_std_mult': 3.545866263132855, 'bull_rsi_os': 27, 'bull_rsi_ob': 59, 'bull_adx_thresh': 15.890512401687172, 'bull_atr_min_pct': 0.010671558109877029, 'bull_atr_max_pct': 0.0688355533065769, 'bull_tp_mult': 2.9762334926746594, 'bull_tsl_mult': 0.4116821015255349, 'bull_time_stop': 126, 'bull_use_sma': False, 'bull_use_ema': True, 'bull_use_atr': False, 'bull_use_adx': False, 'bull_use_spike': False, 'bull_rsi_required': False, 'bear_strategy': 'breakout', 'bear_bb_std_mult': 1.2824587512034793, 'bear_rsi_os': 28, 'bear_rsi_ob': 63, 'bear_adx_thresh': 26.253934800526835, 'bear_atr_min_pct': 0.005378497734681044, 'bear_atr_max_pct': 0.1126254311106882, 'bear_tp_mult': 2.037183963731243, 'bear_tsl_mult': 0.4451774292131822, 'bear_time_stop': 110, 'bear_use_sma': True, 'bear_use_ema': True, 'bear_use_atr': True, 'bear_use_adx': True, 'bear_use_spike': False, 'bear_rsi_required': False, 'sideways_strategy': 'breakout', 'sideways_bb_std_mult': 2.0667692391143433, 'sideways_rsi_os': 34, 'sideways_rsi_ob': 90, 'sideways_adx_thresh': 20.497670305855873, 'sideways_atr_min_pct': 0.006247147246168903, 'sideways_atr_max_pct': 0.010328368501217832, 'sideways_tp_mult': 2.751128662147368, 'sideways_tsl_mult': 0.49049433631670286, 'sideways_time_stop': 245, 'sideways_use_sma': True, 'sideways_use_ema': True, 'sideways_use_atr': True, 'sideways_use_adx': True, 'sideways_use_spike': True, 'sideways_rsi_required': False}.
[I 2025-08-30 14:24:55,539] Trial 34 finished with values: [-1000000000.0, 1000000000.0] and parameters: {'p_sma': 54, 'p_std': 23, 'p_atr': 19, 'p_adx': 12, 'rsi_period': 52, 'ema1': 21, 'ema2': 46, 'slip_atr_k': 0.03897278627843332, 'slip_spread_k': 0.6017199091096636, 'spread_hl_frac': 0.03758078059756706, 'bb_std_mult': 1.246229910778741, 'rsi_os': 18, 'rsi_ob': 80, 'vol_spike': 0.22079056438425881, 'adx_thresh': 32.88121778174046, 'atr_min_pct': 0.002737877583796076, 'atr_max_pct': 0.017418812692522916, 'tp_mult': 2.7924148283731416, 'tsl_mult': 0.9715497943389424, 'strategy': 'breakout', 'time_stop': 54, 'use_sma': False, 'use_atr': False, 'use_adx': False, 'use_ema': True, 'use_spike': False, 'rsi_required': True, 'edge_k': 1.4549416339215668, 'edge_cap': 0.29557543190612806, 'bull_strategy': 'mean_reversion', 'bull_bb_std_mult': 1.0237210932135548, 'bull_rsi_os': 15, 'bull_rsi_ob': 88, 'bull_adx_thresh': 32.87214013725815, 'bull_atr_min_pct': 0.0017075070265237557, 'bull_atr_max_pct': 0.04930067465250741, 'bull_tp_mult': 1.3223387355440868, 'bull_tsl_mult': 0.4462466457595301, 'bull_time_stop': 39, 'bull_use_sma': False, 'bull_use_ema': True, 'bull_use_atr': False, 'bull_use_adx': False, 'bull_use_spike': False, 'bull_rsi_required': False, 'bear_strategy': 'breakout', 'bear_bb_std_mult': 1.2859363321422683, 'bear_rsi_os': 28, 'bear_rsi_ob': 94, 'bear_adx_thresh': 26.95060495644044, 'bear_atr_min_pct': 0.00028837815162435256, 'bear_atr_max_pct': 0.07312232082680355, 'bear_tp_mult': 2.9621231758274105, 'bear_tsl_mult': 0.6200425932629989, 'bear_time_stop': 112, 'bear_use_sma': True, 'bear_use_ema': True, 'bear_use_atr': False, 'bear_use_adx': False, 'bear_use_spike': False, 'bear_rsi_required': False, 'sideways_strategy': 'breakout', 'sideways_bb_std_mult': 2.9266836402910097, 'sideways_rsi_os': 15, 'sideways_rsi_ob': 90, 'sideways_adx_thresh': 20.679634874913894, 'sideways_atr_min_pct': 0.028482160483106114, 'sideways_atr_max_pct': 0.010836376468217168, 'sideways_tp_mult': 2.786158316013439, 'sideways_tsl_mult': 0.002649316472827068, 'sideways_time_stop': 168, 'sideways_use_sma': True, 'sideways_use_ema': True, 'sideways_use_atr': True, 'sideways_use_adx': True, 'sideways_use_spike': False, 'sideways_rsi_required': False}.
[I 2025-08-30 14:24:55,816] Trial 33 finished with values: [-1000000000.0, 1000000000.0] and parameters: {'p_sma': 45, 'p_std': 60, 'p_atr': 27, 'p_adx': 12, 'rsi_period': 51, 'ema1': 16, 'ema2': 29, 'slip_atr_k': 0.14081069325793952, 'slip_spread_k': 0.28555818656484033, 'spread_hl_frac': 0.03668897656944701, 'bb_std_mult': 1.2268615618262753, 'rsi_os': 23, 'rsi_ob': 90, 'vol_spike': 0.2659931828491541, 'adx_thresh': 21.42671887220871, 'atr_min_pct': 0.014044115017154732, 'atr_max_pct': 0.01765606282077138, 'tp_mult': 1.7105768390695912, 'tsl_mult': 0.9583172208074003, 'strategy': 'breakout', 'time_stop': 150, 'use_sma': True, 'use_atr': False, 'use_adx': False, 'use_ema': True, 'use_spike': False, 'rsi_required': True, 'edge_k': 1.4300878445438339, 'edge_cap': 0.10276600355084314, 'bull_strategy': 'mean_reversion', 'bull_bb_std_mult': 2.1894168479517178, 'bull_rsi_os': 29, 'bull_rsi_ob': 88, 'bull_adx_thresh': 18.128234959637602, 'bull_atr_min_pct': 0.010471343239208073, 'bull_atr_max_pct': 0.06621136210713777, 'bull_tp_mult': 1.647744925152666, 'bull_tsl_mult': 0.9074546241474911, 'bull_time_stop': 120, 'bull_use_sma': False, 'bull_use_ema': True, 'bull_use_atr': True, 'bull_use_adx': True, 'bull_use_spike': False, 'bull_rsi_required': False, 'bear_strategy': 'breakout', 'bear_bb_std_mult': 1.355715703946968, 'bear_rsi_os': 29, 'bear_rsi_ob': 63, 'bear_adx_thresh': 26.62216862212679, 'bear_atr_min_pct': 0.004940849769994334, 'bear_atr_max_pct': 0.11385626957124455, 'bear_tp_mult': 1.2669778037472303, 'bear_tsl_mult': 0.886526163192985, 'bear_time_stop': 106, 'bear_use_sma': True, 'bear_use_ema': False, 'bear_use_atr': True, 'bear_use_adx': True, 'bear_use_spike': False, 'bear_rsi_required': False, 'sideways_strategy': 'breakout', 'sideways_bb_std_mult': 1.9991347264129549, 'sideways_rsi_os': 35, 'sideways_rsi_ob': 91, 'sideways_adx_thresh': 20.198748224561363, 'sideways_atr_min_pct': 0.005005954491538848, 'sideways_atr_max_pct': 0.05695153152926016, 'sideways_tp_mult': 2.79568659029637, 'sideways_tsl_mult': 0.8802669306708963, 'sideways_time_stop': 167, 'sideways_use_sma': True, 'sideways_use_ema': True, 'sideways_use_atr': True, 'sideways_use_adx': True, 'sideways_use_spike': True, 'sideways_rsi_required': False}.
