[I 2025-08-30 15:39:03,334] Trial 521 finished with values: [-1000000000.0, 1000000000.0] and parameters: {'p_sma': 10, 'p_std': 13, 'p_atr': 12, 'p_adx': 11, 'rsi_period': 9, 'ema1': 18, 'ema2': 39, 'slip_atr_k': 0.007580931696139023, 'slip_spread_k': 0.6763373311937231, 'spread_hl_frac': 0.023710268491592752, 'bb_std_mult': 0.68276989659338, 'rsi_os': 27, 'rsi_ob': 52, 'vol_spike': 0.2129420997252606, 'adx_thresh': 34.612139828887436, 'atr_min_pct': 0.0055389562108953076, 'atr_max_pct': 0.1159104006454947, 'tp_mult': 1.140213016391497, 'tsl_mult': 0.3331991850074124, 'strategy': 'breakout', 'time_stop': 100, 'use_sma': False, 'use_atr': True, 'use_adx': True, 'use_ema': True, 'use_spike': True, 'rsi_required': True, 'edge_k': 1.6386370614074184, 'edge_cap': 0.9791892461490537, 'bull_strategy': 'breakout', 'bull_bb_std_mult': 1.1379407117876497, 'bull_rsi_os': 48, 'bull_rsi_ob': 88, 'bull_adx_thresh': 10.242416436485923, 'bull_atr_min_pct': 0.02011733009689053, 'bull_atr_max_pct': 0.1382329308870463, 'bull_tp_mult': 2.597080825085268, 'bull_tsl_mult': 0.5984577848906406, 'bull_time_stop': 175, 'bull_use_sma': False, 'bull_use_ema': False, 'bull_use_atr': True, 'bull_use_adx': True, 'bull_use_spike': True, 'bull_rsi_required': False, 'bear_strategy': 'mean_reversion', 'bear_bb_std_mult': 1.844226408149684, 'bear_rsi_os': 26, 'bear_rsi_ob': 60, 'bear_adx_thresh': 15.551068427898175, 'bear_atr_min_pct': 0.002965404184178729, 'bear_atr_max_pct': 0.10631719177486604, 'bear_tp_mult': 1.7930178763625542, 'bear_tsl_mult': 0.9017894819734689, 'bear_time_stop': 101, 'bear_use_sma': True, 'bear_use_ema': True, 'bear_use_atr': False, 'bear_use_adx': False, 'bear_use_spike': True, 'bear_rsi_required': True, 'sideways_strategy': 'breakout', 'sideways_bb_std_mult': 3.0916866462896424, 'sideways_rsi_os': 11, 'sideways_rsi_ob': 78, 'sideways_adx_thresh': 34.80341548963358, 'sideways_atr_min_pct': 0.005547686352011104, 'sideways_atr_max_pct': 0.06119786263075254, 'sideways_tp_mult': 2.6015419700469486, 'sideways_tsl_mult': 0.4149625683314744, 'sideways_time_stop': 130, 'sideways_use_sma': False, 'sideways_use_ema': True, 'sideways_use_atr': True, 'sideways_use_adx': True, 'sideways_use_spike': True, 'sideways_rsi_required': False}.
[I 2025-08-30 15:39:45,777] Trial 524 finished with values: [-0.0053618225614442405, 0.00618805340262992] and parameters: {'p_sma': 7, 'p_std': 21, 'p_atr': 12, 'p_adx': 13, 'rsi_period': 11, 'ema1': 24, 'ema2': 36, 'slip_atr_k': 0.0002690652228159566, 'slip_spread_k': 0.6967083363462897, 'spread_hl_frac': 0.03237243334140013, 'bb_std_mult': 0.6548272809471136, 'rsi_os': 34, 'rsi_ob': 88, 'vol_spike': 0.19833218691104648, 'adx_thresh': 23.236103905353833, 'atr_min_pct': 0.005555546696179073, 'atr_max_pct': 0.06030753039518318, 'tp_mult': 1.5089453471544, 'tsl_mult': 0.3419293388859912, 'strategy': 'breakout', 'time_stop': 154, 'use_sma': False, 'use_atr': False, 'use_adx': True, 'use_ema': False, 'use_spike': False, 'rsi_required': False, 'edge_k': 0.047228866228845034, 'edge_cap': 0.9795405615896878, 'bull_strategy': 'mean_reversion', 'bull_bb_std_mult': 1.4320236586209047, 'bull_rsi_os': 50, 'bull_rsi_ob': 52, 'bull_adx_thresh': 10.266914877372717, 'bull_atr_min_pct': 0.019636149820611574, 'bull_atr_max_pct': 0.10335319995759551, 'bull_tp_mult': 2.412263020838446, 'bull_tsl_mult': 0.03152655208405025, 'bull_time_stop': 50, 'bull_use_sma': True, 'bull_use_ema': True, 'bull_use_atr': False, 'bull_use_adx': True, 'bull_use_spike': False, 'bull_rsi_required': False, 'bear_strategy': 'breakout', 'bear_bb_std_mult': 1.8780024339085257, 'bear_rsi_os': 25, 'bear_rsi_ob': 57, 'bear_adx_thresh': 15.548872711915289, 'bear_atr_min_pct': 0.0029031105941685455, 'bear_atr_max_pct': 0.10590248229233874, 'bear_tp_mult': 1.7983097047412637, 'bear_tsl_mult': 0.8881076040255075, 'bear_time_stop': 91, 'bear_use_sma': False, 'bear_use_ema': False, 'bear_use_atr': True, 'bear_use_adx': True, 'bear_use_spike': False, 'bear_rsi_required': False, 'sideways_strategy': 'mean_reversion', 'sideways_bb_std_mult': 0.5852727851672856, 'sideways_rsi_os': 26, 'sideways_rsi_ob': 89, 'sideways_adx_thresh': 10.146672011478724, 'sideways_atr_min_pct': 0.004041183502932814, 'sideways_atr_max_pct': 0.030661709616539586, 'sideways_tp_mult': 1.1584355402236395, 'sideways_tsl_mult': 0.41601442107657854, 'sideways_time_stop': 132, 'sideways_use_sma': True, 'sideways_use_ema': False, 'sideways_use_atr': True, 'sideways_use_adx': True, 'sideways_use_spike': False, 'sideways_rsi_required': True}.
[I 2025-08-30 15:39:47,547] Trial 525 finished with values: [-1000000000.0, 1000000000.0] and parameters: {'p_sma': 7, 'p_std': 21, 'p_atr': 12, 'p_adx': 20, 'rsi_period': 75, 'ema1': 24, 'ema2': 59, 'slip_atr_k': 0.00021099368335051049, 'slip_spread_k': 0.6275360794038154, 'spread_hl_frac': 0.04191698344576078, 'bb_std_mult': 0.5626626247967056, 'rsi_os': 34, 'rsi_ob': 63, 'vol_spike': 0.04256300849616902, 'adx_thresh': 23.181914927222095, 'atr_min_pct': 0.022290447077321293, 'atr_max_pct': 0.12004204508342273, 'tp_mult': 1.2633218491770437, 'tsl_mult': 0.32565542624275656, 'strategy': 'breakout', 'time_stop': 152, 'use_sma': False, 'use_atr': False, 'use_adx': True, 'use_ema': False, 'use_spike': False, 'rsi_required': False, 'edge_k': 0.7023040972938631, 'edge_cap': 0.9176737037278135, 'bull_strategy': 'mean_reversion', 'bull_bb_std_mult': 1.698968563098411, 'bull_rsi_os': 50, 'bull_rsi_ob': 89, 'bull_adx_thresh': 10.307488217089666, 'bull_atr_min_pct': 0.019031691865324656, 'bull_atr_max_pct': 0.10969929217560068, 'bull_tp_mult': 2.993616109091263, 'bull_tsl_mult': 0.8467874673119957, 'bull_time_stop': 56, 'bull_use_sma': True, 'bull_use_ema': True, 'bull_use_atr': False, 'bull_use_adx': True, 'bull_use_spike': False, 'bull_rsi_required': True, 'bear_strategy': 'breakout', 'bear_bb_std_mult': 1.8478343832074682, 'bear_rsi_os': 25, 'bear_rsi_ob': 74, 'bear_adx_thresh': 14.998646535171684, 'bear_atr_min_pct': 0.0008948316196134521, 'bear_atr_max_pct': 0.10795248740580816, 'bear_tp_mult': 2.7206285755389574, 'bear_tsl_mult': 0.9023275044542729, 'bear_time_stop': 91, 'bear_use_sma': False, 'bear_use_ema': False, 'bear_use_atr': True, 'bear_use_adx': True, 'bear_use_spike': False, 'bear_rsi_required': False, 'sideways_strategy': 'mean_reversion', 'sideways_bb_std_mult': 3.2171647322510535, 'sideways_rsi_os': 26, 'sideways_rsi_ob': 79, 'sideways_adx_thresh': 9.8894345079612, 'sideways_atr_min_pct': 0.002235177972329439, 'sideways_atr_max_pct': 0.0304428676436984, 'sideways_tp_mult': 1.173637483996925, 'sideways_tsl_mult': 0.35960537763046807, 'sideways_time_stop': 128, 'sideways_use_sma': True, 'sideways_use_ema': False, 'sideways_use_atr': True, 'sideways_use_adx': True, 'sideways_use_spike': False, 'sideways_rsi_required': True}.
[I 2025-08-30 15:39:49,668] Trial 526 finished with values: [-1000000000.0, 1000000000.0] and parameters: {'p_sma': 7, 'p_std': 56, 'p_atr': 12, 'p_adx': 20, 'rsi_period': 7, 'ema1': 24, 'ema2': 10, 'slip_atr_k': 0.0005160849495629081, 'slip_spread_k': 0.9390435645395729, 'spread_hl_frac': 0.009155451685207792, 'bb_std_mult': 0.8368337983520027, 'rsi_os': 34, 'rsi_ob': 88, 'vol_spike': 0.04085532263177449, 'adx_thresh': 9.139622110589443, 'atr_min_pct': 0.005815077508057358, 'atr_max_pct': 0.1090553662732396, 'tp_mult': 1.9470892421686365, 'tsl_mult': 0.29583022804504083, 'strategy': 'breakout', 'time_stop': 154, 'use_sma': False, 'use_atr': False, 'use_adx': True, 'use_ema': False, 'use_spike': False, 'rsi_required': False, 'edge_k': 0.6991102411926347, 'edge_cap': 0.11258556217086813, 'bull_strategy': 'mean_reversion', 'bull_bb_std_mult': 1.7155024816449902, 'bull_rsi_os': 50, 'bull_rsi_ob': 85, 'bull_adx_thresh': 10.233202945242505, 'bull_atr_min_pct': 0.018893913372963145, 'bull_atr_max_pct': 0.10328472849204479, 'bull_tp_mult': 1.8669926709585116, 'bull_tsl_mult': 0.143649289819136, 'bull_time_stop': 49, 'bull_use_sma': True, 'bull_use_ema': True, 'bull_use_atr': False, 'bull_use_adx': True, 'bull_use_spike': False, 'bull_rsi_required': True, 'bear_strategy': 'breakout', 'bear_bb_std_mult': 1.8924551234965565, 'bear_rsi_os': 25, 'bear_rsi_ob': 74, 'bear_adx_thresh': 17.13303994593697, 'bear_atr_min_pct': 0.0010690914740470354, 'bear_atr_max_pct': 0.10975738160943709, 'bear_tp_mult': 1.7045250475430622, 'bear_tsl_mult': 0.8598293569812487, 'bear_time_stop': 91, 'bear_use_sma': False, 'bear_use_ema': False, 'bear_use_atr': True, 'bear_use_adx': True, 'bear_use_spike': False, 'bear_rsi_required': False, 'sideways_strategy': 'mean_reversion', 'sideways_bb_std_mult': 2.230329925802898, 'sideways_rsi_os': 6, 'sideways_rsi_ob': 79, 'sideways_adx_thresh': 10.090030823197395, 'sideways_atr_min_pct': 0.002858833863353647, 'sideways_atr_max_pct': 0.12736730622755685, 'sideways_tp_mult': 1.1471353272414004, 'sideways_tsl_mult': 0.3510080769064946, 'sideways_time_stop': 218, 'sideways_use_sma': True, 'sideways_use_ema': False, 'sideways_use_atr': False, 'sideways_use_adx': True, 'sideways_use_spike': False, 'sideways_rsi_required': True}.
[I 2025-08-30 15:39:50,674] Trial 523 finished with values: [-1000000000.0, 1000000000.0] and parameters: {'p_sma': 9, 'p_std': 13, 'p_atr': 12, 'p_adx': 20, 'rsi_period': 62, 'ema1': 18, 'ema2': 40, 'slip_atr_k': 0.004723098165708657, 'slip_spread_k': 0.6340764461919774, 'spread_hl_frac': 0.04189074483340508, 'bb_std_mult': 0.649162925284565, 'rsi_os': 28, 'rsi_ob': 89, 'vol_spike': 0.04301095783595933, 'adx_thresh': 8.847435449489533, 'atr_min_pct': 0.006496787733199871, 'atr_max_pct': 0.10886238764861891, 'tp_mult': 1.1467556876313418, 'tsl_mult': 0.34040906239519053, 'strategy': 'breakout', 'time_stop': 153, 'use_sma': False, 'use_atr': True, 'use_adx': True, 'use_ema': False, 'use_spike': False, 'rsi_required': False, 'edge_k': 0.03702896865954097, 'edge_cap': 0.9820671399212929, 'bull_strategy': 'breakout', 'bull_bb_std_mult': 1.730260941428102, 'bull_rsi_os': 6, 'bull_rsi_ob': 89, 'bull_adx_thresh': 16.780459958890013, 'bull_atr_min_pct': 0.018904415353066598, 'bull_atr_max_pct': 0.10260571018928967, 'bull_tp_mult': 2.6050169131956076, 'bull_tsl_mult': 0.8541985705087731, 'bull_time_stop': 49, 'bull_use_sma': True, 'bull_use_ema': True, 'bull_use_atr': True, 'bull_use_adx': True, 'bull_use_spike': True, 'bull_rsi_required': False, 'bear_strategy': 'mean_reversion', 'bear_bb_std_mult': 1.8548720472141897, 'bear_rsi_os': 25, 'bear_rsi_ob': 60, 'bear_adx_thresh': 15.504523596607646, 'bear_atr_min_pct': 0.002947373719164034, 'bear_atr_max_pct': 0.10602865716059064, 'bear_tp_mult': 2.710563277993616, 'bear_tsl_mult': 0.04295833126747012, 'bear_time_stop': 11, 'bear_use_sma': True, 'bear_use_ema': False, 'bear_use_atr': False, 'bear_use_adx': False, 'bear_use_spike': True, 'bear_rsi_required': True, 'sideways_strategy': 'mean_reversion', 'sideways_bb_std_mult': 0.5598518228425713, 'sideways_rsi_os': 26, 'sideways_rsi_ob': 79, 'sideways_adx_thresh': 10.861876342030582, 'sideways_atr_min_pct': 0.01923587272829252, 'sideways_atr_max_pct': 0.13912293716992202, 'sideways_tp_mult': 1.2169179410378597, 'sideways_tsl_mult': 0.4174896902821983, 'sideways_time_stop': 21, 'sideways_use_sma': True, 'sideways_use_ema': False, 'sideways_use_atr': False, 'sideways_use_adx': True, 'sideways_use_spike': True, 'sideways_rsi_required': False}.
[I 2025-08-30 15:40:42,136] Trial 528 finished with values: [-1000000000.0, 1000000000.0] and parameters: {'p_sma': 9, 'p_std': 18, 'p_atr': 28, 'p_adx': 26, 'rsi_period': 7, 'ema1': 25, 'ema2': 37, 'slip_atr_k': 3.764208983607814e-05, 'slip_spread_k': 0.7031459541289513, 'spread_hl_frac': 0.009047194945084838, 'bb_std_mult': 1.103643148413549, 'rsi_os': 45, 'rsi_ob': 54, 'vol_spike': 0.22261898700389837, 'adx_thresh': 9.041700454767973, 'atr_min_pct': 0.017261922818786083, 'atr_max_pct': 0.11083116290974492, 'tp_mult': 1.4128815394118184, 'tsl_mult': 0.30386286870634194, 'strategy': 'breakout', 'time_stop': 179, 'use_sma': False, 'use_atr': False, 'use_adx': True, 'use_ema': False, 'use_spike': False, 'rsi_required': False, 'edge_k': 0.6486275705575595, 'edge_cap': 0.957616891810724, 'bull_strategy': 'breakout', 'bull_bb_std_mult': 3.3903844042768716, 'bull_rsi_os': 47, 'bull_rsi_ob': 85, 'bull_adx_thresh': 8.951498297528277, 'bull_atr_min_pct': 0.02225431635338744, 'bull_atr_max_pct': 0.14144950275575352, 'bull_tp_mult': 2.619152236914214, 'bull_tsl_mult': 0.07140905335233805, 'bull_time_stop': 47, 'bull_use_sma': True, 'bull_use_ema': True, 'bull_use_atr': True, 'bull_use_adx': True, 'bull_use_spike': True, 'bull_rsi_required': False, 'bear_strategy': 'mean_reversion', 'bear_bb_std_mult': 2.758485094201423, 'bear_rsi_os': 38, 'bear_rsi_ob': 75, 'bear_adx_thresh': 16.992396715278286, 'bear_atr_min_pct': 0.005947014589471986, 'bear_atr_max_pct': 0.11004759902057651, 'bear_tp_mult': 1.6100956123494767, 'bear_tsl_mult': 0.8546954279778802, 'bear_time_stop': 9, 'bear_use_sma': True, 'bear_use_ema': False, 'bear_use_atr': True, 'bear_use_adx': True, 'bear_use_spike': True, 'bear_rsi_required': True, 'sideways_strategy': 'mean_reversion', 'sideways_bb_std_mult': 2.2072032141377655, 'sideways_rsi_os': 24, 'sideways_rsi_ob': 80, 'sideways_adx_thresh': 12.062785004365551, 'sideways_atr_min_pct': 0.019314390638742237, 'sideways_atr_max_pct': 0.054132922474978466, 'sideways_tp_mult': 1.6808172407769935, 'sideways_tsl_mult': 0.3490655269133162, 'sideways_time_stop': 33, 'sideways_use_sma': True, 'sideways_use_ema': False, 'sideways_use_atr': False, 'sideways_use_adx': True, 'sideways_use_spike': True, 'sideways_rsi_required': True}.
[I 2025-08-30 15:40:43,679] Trial 527 finished with values: [-0.0067355298523194, 0.006848121063981306] and parameters: {'p_sma': 9, 'p_std': 23, 'p_atr': 12, 'p_adx': 25, 'rsi_period': 7, 'ema1': 24, 'ema2': 10, 'slip_atr_k': 0.0005754940349963398, 'slip_spread_k': 0.638942653191506, 'spread_hl_frac': 0.00927885973538777, 'bb_std_mult': 0.8382348240441984, 'rsi_os': 29, 'rsi_ob': 66, 'vol_spike': 0.026393204093288727, 'adx_thresh': 8.774166534461004, 'atr_min_pct': 0.016958162244686062, 'atr_max_pct': 0.11961103905028686, 'tp_mult': 1.5380753600286174, 'tsl_mult': 0.30165681503964287, 'strategy': 'breakout', 'time_stop': 179, 'use_sma': False, 'use_atr': False, 'use_adx': True, 'use_ema': False, 'use_spike': False, 'rsi_required': False, 'edge_k': 0.6502750870654471, 'edge_cap': 0.9085300237183804, 'bull_strategy': 'breakout', 'bull_bb_std_mult': 1.7367498781568438, 'bull_rsi_os': 47, 'bull_rsi_ob': 89, 'bull_adx_thresh': 9.151199075229426, 'bull_atr_min_pct': 0.018933585399458518, 'bull_atr_max_pct': 0.03592192967584531, 'bull_tp_mult': 2.9690959548153133, 'bull_tsl_mult': 0.08153401903440444, 'bull_time_stop': 265, 'bull_use_sma': True, 'bull_use_ema': True, 'bull_use_atr': True, 'bull_use_adx': True, 'bull_use_spike': True, 'bull_rsi_required': True, 'bear_strategy': 'mean_reversion', 'bear_bb_std_mult': 2.738045719782864, 'bear_rsi_os': 8, 'bear_rsi_ob': 74, 'bear_adx_thresh': 16.8291229114917, 'bear_atr_min_pct': 0.0011173835428929131, 'bear_atr_max_pct': 0.10982281588677806, 'bear_tp_mult': 1.6708611002325495, 'bear_tsl_mult': 0.8325041918737092, 'bear_time_stop': 203, 'bear_use_sma': False, 'bear_use_ema': False, 'bear_use_atr': True, 'bear_use_adx': True, 'bear_use_spike': True, 'bear_rsi_required': True, 'sideways_strategy': 'mean_reversion', 'sideways_bb_std_mult': 3.0054201924910915, 'sideways_rsi_os': 14, 'sideways_rsi_ob': 79, 'sideways_adx_thresh': 33.581291079083954, 'sideways_atr_min_pct': 0.0024182575155351545, 'sideways_atr_max_pct': 0.07304163039362481, 'sideways_tp_mult': 1.6666054327176518, 'sideways_tsl_mult': 0.3645653763308964, 'sideways_time_stop': 9, 'sideways_use_sma': True, 'sideways_use_ema': False, 'sideways_use_atr': False, 'sideways_use_adx': True, 'sideways_use_spike': True, 'sideways_rsi_required': True}.
[I 2025-08-30 15:40:45,398] Trial 529 finished with values: [-1000000000.0, 1000000000.0] and parameters: {'p_sma': 57, 'p_std': 20, 'p_atr': 11, 'p_adx': 26, 'rsi_period': 12, 'ema1': 25, 'ema2': 36, 'slip_atr_k': 0.21919871552164813, 'slip_spread_k': 0.9739667297010655, 'spread_hl_frac': 0.008283983213343251, 'bb_std_mult': 0.5642060492640641, 'rsi_os': 45, 'rsi_ob': 76, 'vol_spike': 0.2224764506609734, 'adx_thresh': 8.78250503445506, 'atr_min_pct': 0.01890379853714138, 'atr_max_pct': 0.05708166549643908, 'tp_mult': 1.4243514322300448, 'tsl_mult': 0.9135191879999951, 'strategy': 'breakout', 'time_stop': 189, 'use_sma': False, 'use_atr': False, 'use_adx': True, 'use_ema': False, 'use_spike': False, 'rsi_required': False, 'edge_k': 0.6516905451368966, 'edge_cap': 0.9545193753997969, 'bull_strategy': 'breakout', 'bull_bb_std_mult': 3.3636442264414868, 'bull_rsi_os': 19, 'bull_rsi_ob': 87, 'bull_adx_thresh': 9.110875624728951, 'bull_atr_min_pct': 0.021939346256719755, 'bull_atr_max_pct': 0.11115458001451793, 'bull_tp_mult': 1.53726817309462, 'bull_tsl_mult': 0.8041446102088723, 'bull_time_stop': 70, 'bull_use_sma': True, 'bull_use_ema': True, 'bull_use_atr': True, 'bull_use_adx': True, 'bull_use_spike': True, 'bull_rsi_required': False, 'bear_strategy': 'mean_reversion', 'bear_bb_std_mult': 1.799036901516098, 'bear_rsi_os': 24, 'bear_rsi_ob': 49, 'bear_adx_thresh': 17.796607130787073, 'bear_atr_min_pct': 0.021968209056438627, 'bear_atr_max_pct': 0.06357812839587185, 'bear_tp_mult': 2.544577413500329, 'bear_tsl_mult': 0.8327211026825974, 'bear_time_stop': 10, 'bear_use_sma': True, 'bear_use_ema': False, 'bear_use_atr': True, 'bear_use_adx': True, 'bear_use_spike': True, 'bear_rsi_required': True, 'sideways_strategy': 'mean_reversion', 'sideways_bb_std_mult': 2.337013119626912, 'sideways_rsi_os': 24, 'sideways_rsi_ob': 82, 'sideways_adx_thresh': 11.635541771292539, 'sideways_atr_min_pct': 0.019352274931665636, 'sideways_atr_max_pct': 0.07339506933369414, 'sideways_tp_mult': 1.3357220382061707, 'sideways_tsl_mult': 0.47804106398764884, 'sideways_time_stop': 119, 'sideways_use_sma': True, 'sideways_use_ema': False, 'sideways_use_atr': True, 'sideways_use_adx': True, 'sideways_use_spike': True, 'sideways_rsi_required': True}.
[I 2025-08-30 15:40:47,218] Trial 530 finished with values: [-1000000000.0, 1000000000.0] and parameters: {'p_sma': 6, 'p_std': 19, 'p_atr': 26, 'p_adx': 25, 'rsi_period': 10, 'ema1': 25, 'ema2': 16, 'slip_atr_k': 0.21697810943654494, 'slip_spread_k': 0.6035327744047462, 'spread_hl_frac': 0.010250336375542292, 'bb_std_mult': 0.9690276434642273, 'rsi_os': 39, 'rsi_ob': 87, 'vol_spike': 0.07163549083882421, 'adx_thresh': 8.264852226851698, 'atr_min_pct': 0.01881336057377782, 'atr_max_pct': 0.11092425410161082, 'tp_mult': 1.4270631105161244, 'tsl_mult': 0.2417751265175308, 'strategy': 'breakout', 'time_stop': 178, 'use_sma': False, 'use_atr': False, 'use_adx': False, 'use_ema': False, 'use_spike': False, 'rsi_required': False, 'edge_k': 0.6504723325603412, 'edge_cap': 0.9556155853200246, 'bull_strategy': 'breakout', 'bull_bb_std_mult': 1.6174937474542148, 'bull_rsi_os': 17, 'bull_rsi_ob': 87, 'bull_adx_thresh': 9.363551305425226, 'bull_atr_min_pct': 0.02061564740853246, 'bull_atr_max_pct': 0.11064272503946634, 'bull_tp_mult': 2.9018064896009417, 'bull_tsl_mult': 0.07585877674408847, 'bull_time_stop': 78, 'bull_use_sma': True, 'bull_use_ema': True, 'bull_use_atr': True, 'bull_use_adx': True, 'bull_use_spike': True, 'bull_rsi_required': False, 'bear_strategy': 'mean_reversion', 'bear_bb_std_mult': 1.795834465521767, 'bear_rsi_os': 23, 'bear_rsi_ob': 48, 'bear_adx_thresh': 17.81478845637772, 'bear_atr_min_pct': 0.00372729777598654, 'bear_atr_max_pct': 0.11500709035522949, 'bear_tp_mult': 1.6504871039527227, 'bear_tsl_mult': 0.828374074006188, 'bear_time_stop': 180, 'bear_use_sma': True, 'bear_use_ema': False, 'bear_use_atr': True, 'bear_use_adx': True, 'bear_use_spike': True, 'bear_rsi_required': True, 'sideways_strategy': 'mean_reversion', 'sideways_bb_std_mult': 3.1583160535629067, 'sideways_rsi_os': 18, 'sideways_rsi_ob': 45, 'sideways_adx_thresh': 11.793125556930425, 'sideways_atr_min_pct': 0.020324799136400284, 'sideways_atr_max_pct': 0.1460739963905585, 'sideways_tp_mult': 1.8339918859212823, 'sideways_tsl_mult': 0.36961793306057245, 'sideways_time_stop': 119, 'sideways_use_sma': True, 'sideways_use_ema': False, 'sideways_use_atr': True, 'sideways_use_adx': True, 'sideways_use_spike': True, 'sideways_rsi_required': True}.
