[I 2025-08-30 15:32:24,333] Trial 488 finished with values: [-1000000000.0, 1000000000.0] and parameters: {'p_sma': 6, 'p_std': 21, 'p_atr': 12, 'p_adx': 25, 'rsi_period': 13, 'ema1': 23, 'ema2': 40, 'slip_atr_k': 0.11551292617870446, 'slip_spread_k': 0.6833487923490815, 'spread_hl_frac': 0.009553023757440573, 'bb_std_mult': 0.5375686176286614, 'rsi_os': 29, 'rsi_ob': 66, 'vol_spike': 0.2046130933731548, 'adx_thresh': 10.257084962000222, 'atr_min_pct': 0.0059709770275030005, 'atr_max_pct': 0.14354852465566115, 'tp_mult': 1.4595671174484361, 'tsl_mult': 0.2936276062136558, 'strategy': 'mean_reversion', 'time_stop': 162, 'use_sma': True, 'use_atr': True, 'use_adx': False, 'use_ema': True, 'use_spike': True, 'rsi_required': True, 'edge_k': 0.6575461129072921, 'edge_cap': 0.9391374208811943, 'bull_strategy': 'mean_reversion', 'bull_bb_std_mult': 1.244451852067212, 'bull_rsi_os': 49, 'bull_rsi_ob': 85, 'bull_adx_thresh': 9.959361962774603, 'bull_atr_min_pct': 0.020916332658427662, 'bull_atr_max_pct': 0.10763661742000476, 'bull_tp_mult': 2.554255935030991, 'bull_tsl_mult': 0.8484439119041672, 'bull_time_stop': 60, 'bull_use_sma': False, 'bull_use_ema': False, 'bull_use_atr': True, 'bull_use_adx': True, 'bull_use_spike': False, 'bull_rsi_required': True, 'bear_strategy': 'breakout', 'bear_bb_std_mult': 1.8322484340113108, 'bear_rsi_os': 25, 'bear_rsi_ob': 76, 'bear_adx_thresh': 14.738001057781673, 'bear_atr_min_pct': 0.0006544295230881594, 'bear_atr_max_pct': 0.1149228652459153, 'bear_tp_mult': 2.610056972447123, 'bear_tsl_mult': 0.83084298495937, 'bear_time_stop': 87, 'bear_use_sma': False, 'bear_use_ema': True, 'bear_use_atr': False, 'bear_use_adx': True, 'bear_use_spike': False, 'bear_rsi_required': False, 'sideways_strategy': 'breakout', 'sideways_bb_std_mult': 3.182445968901773, 'sideways_rsi_os': 10, 'sideways_rsi_ob': 82, 'sideways_adx_thresh': 12.299524443785648, 'sideways_atr_min_pct': 0.019345570058283395, 'sideways_atr_max_pct': 0.06493131753241328, 'sideways_tp_mult': 1.4675882731495298, 'sideways_tsl_mult': 0.4224475354985669, 'sideways_time_stop': 126, 'sideways_use_sma': False, 'sideways_use_ema': True, 'sideways_use_atr': False, 'sideways_use_adx': True, 'sideways_use_spike': False, 'sideways_rsi_required': False}.
[I 2025-08-30 15:32:25,414] Trial 485 finished with values: [-1000000000.0, 1000000000.0] and parameters: {'p_sma': 7, 'p_std': 21, 'p_atr': 13, 'p_adx': 25, 'rsi_period': 13, 'ema1': 20, 'ema2': 39, 'slip_atr_k': 0.23105555533953515, 'slip_spread_k': 0.6841092700514096, 'spread_hl_frac': 0.009026385491083562, 'bb_std_mult': 0.542883227877812, 'rsi_os': 29, 'rsi_ob': 58, 'vol_spike': 0.20678203095144973, 'adx_thresh': 9.600059550061372, 'atr_min_pct': 0.006069478704802897, 'atr_max_pct': 0.010295576475268742, 'tp_mult': 1.4689471647113603, 'tsl_mult': 0.3357004350741783, 'strategy': 'mean_reversion', 'time_stop': 164, 'use_sma': True, 'use_atr': True, 'use_adx': False, 'use_ema': True, 'use_spike': True, 'rsi_required': True, 'edge_k': 0.6676798667622127, 'edge_cap': 0.9315457135502813, 'bull_strategy': 'mean_reversion', 'bull_bb_std_mult': 1.2228846674490041, 'bull_rsi_os': 49, 'bull_rsi_ob': 85, 'bull_adx_thresh': 10.166699481142958, 'bull_atr_min_pct': 0.020758815183434833, 'bull_atr_max_pct': 0.10566138316868508, 'bull_tp_mult': 2.539877856140662, 'bull_tsl_mult': 0.8456565830011279, 'bull_time_stop': 60, 'bull_use_sma': False, 'bull_use_ema': False, 'bull_use_atr': True, 'bull_use_adx': True, 'bull_use_spike': False, 'bull_rsi_required': True, 'bear_strategy': 'breakout', 'bear_bb_std_mult': 1.823354002461573, 'bear_rsi_os': 25, 'bear_rsi_ob': 77, 'bear_adx_thresh': 14.837113523364023, 'bear_atr_min_pct': 0.0015423029917969915, 'bear_atr_max_pct': 0.11609902609061205, 'bear_tp_mult': 2.606105101296, 'bear_tsl_mult': 0.815528334388113, 'bear_time_stop': 87, 'bear_use_sma': False, 'bear_use_ema': True, 'bear_use_atr': False, 'bear_use_adx': True, 'bear_use_spike': False, 'bear_rsi_required': False, 'sideways_strategy': 'breakout', 'sideways_bb_std_mult': 3.162198985898719, 'sideways_rsi_os': 17, 'sideways_rsi_ob': 79, 'sideways_adx_thresh': 12.033773943100183, 'sideways_atr_min_pct': 0.018818781221723386, 'sideways_atr_max_pct': 0.06860663386422729, 'sideways_tp_mult': 1.4575860193785712, 'sideways_tsl_mult': 0.4368187871339018, 'sideways_time_stop': 126, 'sideways_use_sma': False, 'sideways_use_ema': True, 'sideways_use_atr': False, 'sideways_use_adx': True, 'sideways_use_spike': False, 'sideways_rsi_required': False}.
[I 2025-08-30 15:32:25,425] Trial 486 finished with values: [-1000000000.0, 1000000000.0] and parameters: {'p_sma': 6, 'p_std': 21, 'p_atr': 13, 'p_adx': 25, 'rsi_period': 13, 'ema1': 23, 'ema2': 41, 'slip_atr_k': 0.23717683154088684, 'slip_spread_k': 0.6813283747831221, 'spread_hl_frac': 0.011262775595723107, 'bb_std_mult': 0.5466081242768063, 'rsi_os': 29, 'rsi_ob': 64, 'vol_spike': 0.20835305041076277, 'adx_thresh': 10.084270515739986, 'atr_min_pct': 0.0059943755994356866, 'atr_max_pct': 0.05910989786953994, 'tp_mult': 1.3851651357054955, 'tsl_mult': 0.334755710760321, 'strategy': 'mean_reversion', 'time_stop': 171, 'use_sma': True, 'use_atr': True, 'use_adx': False, 'use_ema': True, 'use_spike': True, 'rsi_required': True, 'edge_k': 0.6693001413141687, 'edge_cap': 0.9343909705345141, 'bull_strategy': 'mean_reversion', 'bull_bb_std_mult': 3.3854854907623384, 'bull_rsi_os': 49, 'bull_rsi_ob': 85, 'bull_adx_thresh': 9.954526393991483, 'bull_atr_min_pct': 0.020798697029224506, 'bull_atr_max_pct': 0.10701201455318264, 'bull_tp_mult': 2.5243969029734825, 'bull_tsl_mult': 0.8468727971594665, 'bull_time_stop': 60, 'bull_use_sma': False, 'bull_use_ema': False, 'bull_use_atr': True, 'bull_use_adx': True, 'bull_use_spike': False, 'bull_rsi_required': True, 'bear_strategy': 'breakout', 'bear_bb_std_mult': 1.829292386892241, 'bear_rsi_os': 25, 'bear_rsi_ob': 76, 'bear_adx_thresh': 14.725225029885067, 'bear_atr_min_pct': 0.0023668152377539537, 'bear_atr_max_pct': 0.11626630889510514, 'bear_tp_mult': 2.6071925022044957, 'bear_tsl_mult': 0.8323261640777672, 'bear_time_stop': 86, 'bear_use_sma': False, 'bear_use_ema': True, 'bear_use_atr': False, 'bear_use_adx': True, 'bear_use_spike': False, 'bear_rsi_required': False, 'sideways_strategy': 'breakout', 'sideways_bb_std_mult': 3.192113830022126, 'sideways_rsi_os': 16, 'sideways_rsi_ob': 79, 'sideways_adx_thresh': 12.240718581850782, 'sideways_atr_min_pct': 0.017611428709242746, 'sideways_atr_max_pct': 0.0632287918554722, 'sideways_tp_mult': 1.461883930131516, 'sideways_tsl_mult': 0.424224104772681, 'sideways_time_stop': 127, 'sideways_use_sma': False, 'sideways_use_ema': True, 'sideways_use_atr': False, 'sideways_use_adx': True, 'sideways_use_spike': False, 'sideways_rsi_required': False}.
[I 2025-08-30 15:32:26,780] Trial 491 finished with values: [-1000000000.0, 1000000000.0] and parameters: {'p_sma': 7, 'p_std': 17, 'p_atr': 12, 'p_adx': 25, 'rsi_period': 11, 'ema1': 23, 'ema2': 38, 'slip_atr_k': 0.21225829665005858, 'slip_spread_k': 0.6989942001770575, 'spread_hl_frac': 0.04009649090595563, 'bb_std_mult': 0.588768718471053, 'rsi_os': 28, 'rsi_ob': 46, 'vol_spike': 0.22402642831116573, 'adx_thresh': 9.189459781132319, 'atr_min_pct': 0.01750649333104171, 'atr_max_pct': 0.14893418877509385, 'tp_mult': 1.4208523474657335, 'tsl_mult': 0.3491929419483649, 'strategy': 'mean_reversion', 'time_stop': 182, 'use_sma': True, 'use_atr': True, 'use_adx': False, 'use_ema': True, 'use_spike': True, 'rsi_required': True, 'edge_k': 1.1241019528298104, 'edge_cap': 0.9470504962977777, 'bull_strategy': 'mean_reversion', 'bull_bb_std_mult': 1.5548264789902135, 'bull_rsi_os': 49, 'bull_rsi_ob': 86, 'bull_adx_thresh': 9.446202531207394, 'bull_atr_min_pct': 0.019825450450576373, 'bull_atr_max_pct': 0.10245319424748077, 'bull_tp_mult': 2.4884868822313253, 'bull_tsl_mult': 0.8733100330220848, 'bull_time_stop': 54, 'bull_use_sma': False, 'bull_use_ema': False, 'bull_use_atr': True, 'bull_use_adx': True, 'bull_use_spike': False, 'bull_rsi_required': True, 'bear_strategy': 'breakout', 'bear_bb_std_mult': 1.8580273509657763, 'bear_rsi_os': 47, 'bear_rsi_ob': 75, 'bear_adx_thresh': 15.247233168587982, 'bear_atr_min_pct': 0.001055558817222377, 'bear_atr_max_pct': 0.11261810587297318, 'bear_tp_mult': 2.631611215583874, 'bear_tsl_mult': 0.8705109699281314, 'bear_time_stop': 94, 'bear_use_sma': False, 'bear_use_ema': True, 'bear_use_atr': False, 'bear_use_adx': True, 'bear_use_spike': False, 'bear_rsi_required': False, 'sideways_strategy': 'breakout', 'sideways_bb_std_mult': 3.1431491707766894, 'sideways_rsi_os': 12, 'sideways_rsi_ob': 80, 'sideways_adx_thresh': 11.694661195950209, 'sideways_atr_min_pct': 0.019341804340217646, 'sideways_atr_max_pct': 0.06627596766470087, 'sideways_tp_mult': 1.348585931003482, 'sideways_tsl_mult': 0.01971728205507972, 'sideways_time_stop': 124, 'sideways_use_sma': False, 'sideways_use_ema': True, 'sideways_use_atr': True, 'sideways_use_adx': True, 'sideways_use_spike': True, 'sideways_rsi_required': False}.
[I 2025-08-30 15:33:16,574] Trial 490 finished with values: [-1000000000.0, 1000000000.0] and parameters: {'p_sma': 7, 'p_std': 23, 'p_atr': 12, 'p_adx': 25, 'rsi_period': 10, 'ema1': 23, 'ema2': 39, 'slip_atr_k': 0.1694194755912833, 'slip_spread_k': 0.6786671870368672, 'spread_hl_frac': 0.008910150957450085, 'bb_std_mult': 0.5701290765394617, 'rsi_os': 28, 'rsi_ob': 74, 'vol_spike': 0.020078607977892654, 'adx_thresh': 9.466067487435915, 'atr_min_pct': 0.005911789655002839, 'atr_max_pct': 0.1355286950474041, 'tp_mult': 1.4913980297696543, 'tsl_mult': 0.3294816393253457, 'strategy': 'mean_reversion', 'time_stop': 174, 'use_sma': True, 'use_atr': True, 'use_adx': False, 'use_ema': True, 'use_spike': True, 'rsi_required': True, 'edge_k': 0.6881293873655681, 'edge_cap': 0.9338545656479833, 'bull_strategy': 'mean_reversion', 'bull_bb_std_mult': 1.5501949930642915, 'bull_rsi_os': 49, 'bull_rsi_ob': 86, 'bull_adx_thresh': 9.345445267380537, 'bull_atr_min_pct': 0.01998821097876229, 'bull_atr_max_pct': 0.10471887270805028, 'bull_tp_mult': 2.5315518863638524, 'bull_tsl_mult': 0.8552120797591483, 'bull_time_stop': 57, 'bull_use_sma': False, 'bull_use_ema': False, 'bull_use_atr': True, 'bull_use_adx': True, 'bull_use_spike': False, 'bull_rsi_required': True, 'bear_strategy': 'breakout', 'bear_bb_std_mult': 1.758653665755953, 'bear_rsi_os': 25, 'bear_rsi_ob': 76, 'bear_adx_thresh': 15.066915862327582, 'bear_atr_min_pct': 0.001501680724991175, 'bear_atr_max_pct': 0.11399086335231379, 'bear_tp_mult': 2.634470415561569, 'bear_tsl_mult': 0.8086979056223632, 'bear_time_stop': 92, 'bear_use_sma': False, 'bear_use_ema': True, 'bear_use_atr': False, 'bear_use_adx': True, 'bear_use_spike': False, 'bear_rsi_required': False, 'sideways_strategy': 'breakout', 'sideways_bb_std_mult': 3.180335401007495, 'sideways_rsi_os': 17, 'sideways_rsi_ob': 79, 'sideways_adx_thresh': 11.871349022873897, 'sideways_atr_min_pct': 0.019366077849752215, 'sideways_atr_max_pct': 0.0674440538977632, 'sideways_tp_mult': 1.364568141716088, 'sideways_tsl_mult': 0.40866217269019767, 'sideways_time_stop': 126, 'sideways_use_sma': False, 'sideways_use_ema': True, 'sideways_use_atr': True, 'sideways_use_adx': True, 'sideways_use_spike': False, 'sideways_rsi_required': False}.
[I 2025-08-30 15:33:17,672] Trial 489 finished with values: [-1000000000.0, 1000000000.0] and parameters: {'p_sma': 7, 'p_std': 23, 'p_atr': 12, 'p_adx': 25, 'rsi_period': 12, 'ema1': 23, 'ema2': 41, 'slip_atr_k': 0.2135626333314565, 'slip_spread_k': 0.6853770178696428, 'spread_hl_frac': 0.025607095253010075, 'bb_std_mult': 0.6070316588490106, 'rsi_os': 28, 'rsi_ob': 57, 'vol_spike': 0.22676274258681248, 'adx_thresh': 10.044949481051649, 'atr_min_pct': 0.0060775412241851805, 'atr_max_pct': 0.017180172233241406, 'tp_mult': 1.3946686649592297, 'tsl_mult': 0.33824625848009676, 'strategy': 'mean_reversion', 'time_stop': 175, 'use_sma': True, 'use_atr': True, 'use_adx': False, 'use_ema': True, 'use_spike': True, 'rsi_required': True, 'edge_k': 0.6830633748710362, 'edge_cap': 0.9445815820868172, 'bull_strategy': 'mean_reversion', 'bull_bb_std_mult': 3.5937899963905675, 'bull_rsi_os': 49, 'bull_rsi_ob': 86, 'bull_adx_thresh': 10.038151243703386, 'bull_atr_min_pct': 0.020727244729993925, 'bull_atr_max_pct': 0.10531166135440412, 'bull_tp_mult': 2.5357102846970765, 'bull_tsl_mult': 0.8536563688507733, 'bull_time_stop': 60, 'bull_use_sma': False, 'bull_use_ema': False, 'bull_use_atr': True, 'bull_use_adx': True, 'bull_use_spike': False, 'bull_rsi_required': True, 'bear_strategy': 'breakout', 'bear_bb_std_mult': 1.7700141627416737, 'bear_rsi_os': 52, 'bear_rsi_ob': 76, 'bear_adx_thresh': 14.739206378195263, 'bear_atr_min_pct': 0.0006749153243338362, 'bear_atr_max_pct': 0.11489413687836408, 'bear_tp_mult': 2.6314148795111794, 'bear_tsl_mult': 0.8271124725347585, 'bear_time_stop': 91, 'bear_use_sma': False, 'bear_use_ema': True, 'bear_use_atr': False, 'bear_use_adx': True, 'bear_use_spike': False, 'bear_rsi_required': False, 'sideways_strategy': 'breakout', 'sideways_bb_std_mult': 3.1817365140109146, 'sideways_rsi_os': 12, 'sideways_rsi_ob': 80, 'sideways_adx_thresh': 12.34890590125402, 'sideways_atr_min_pct': 0.01914283222281532, 'sideways_atr_max_pct': 0.0668212599039973, 'sideways_tp_mult': 1.450123868658282, 'sideways_tsl_mult': 0.4274675952568132, 'sideways_time_stop': 124, 'sideways_use_sma': False, 'sideways_use_ema': True, 'sideways_use_atr': False, 'sideways_use_adx': True, 'sideways_use_spike': False, 'sideways_rsi_required': False}.
[I 2025-08-30 15:33:18,515] Trial 492 finished with values: [-1000000000.0, 1000000000.0] and parameters: {'p_sma': 7, 'p_std': 23, 'p_atr': 12, 'p_adx': 25, 'rsi_period': 11, 'ema1': 23, 'ema2': 38, 'slip_atr_k': 0.24849587375433663, 'slip_spread_k': 0.7013796346733902, 'spread_hl_frac': 0.040824518573219726, 'bb_std_mult': 0.609045898308271, 'rsi_os': 28, 'rsi_ob': 74, 'vol_spike': 0.030687160664316843, 'adx_thresh': 9.09511167299554, 'atr_min_pct': 0.006012012037958939, 'atr_max_pct': 0.13749777824258966, 'tp_mult': 1.4980380105801967, 'tsl_mult': 0.34797588408153, 'strategy': 'mean_reversion', 'time_stop': 182, 'use_sma': True, 'use_atr': True, 'use_adx': False, 'use_ema': True, 'use_spike': True, 'rsi_required': True, 'edge_k': 1.1453957792042408, 'edge_cap': 0.9504000245895545, 'bull_strategy': 'mean_reversion', 'bull_bb_std_mult': 3.1480705469357586, 'bull_rsi_os': 49, 'bull_rsi_ob': 86, 'bull_adx_thresh': 9.284090207383631, 'bull_atr_min_pct': 0.01987994455094254, 'bull_atr_max_pct': 0.10235265576878373, 'bull_tp_mult': 2.57342003201443, 'bull_tsl_mult': 0.8734854255191802, 'bull_time_stop': 56, 'bull_use_sma': False, 'bull_use_ema': False, 'bull_use_atr': True, 'bull_use_adx': True, 'bull_use_spike': False, 'bull_rsi_required': True, 'bear_strategy': 'breakout', 'bear_bb_std_mult': 1.7632640412174887, 'bear_rsi_os': 47, 'bear_rsi_ob': 75, 'bear_adx_thresh': 15.411742437013704, 'bear_atr_min_pct': 0.0011998081952014031, 'bear_atr_max_pct': 0.11322217431868231, 'bear_tp_mult': 2.640732719162741, 'bear_tsl_mult': 0.8680993900857614, 'bear_time_stop': 95, 'bear_use_sma': False, 'bear_use_ema': True, 'bear_use_atr': False, 'bear_use_adx': True, 'bear_use_spike': False, 'bear_rsi_required': False, 'sideways_strategy': 'breakout', 'sideways_bb_std_mult': 3.2009197425158455, 'sideways_rsi_os': 7, 'sideways_rsi_ob': 80, 'sideways_adx_thresh': 12.605394345033735, 'sideways_atr_min_pct': 0.01932229432700234, 'sideways_atr_max_pct': 0.06666932744072813, 'sideways_tp_mult': 1.3770665968512967, 'sideways_tsl_mult': 0.4097004522563518, 'sideways_time_stop': 126, 'sideways_use_sma': False, 'sideways_use_ema': True, 'sideways_use_atr': True, 'sideways_use_adx': True, 'sideways_use_spike': True, 'sideways_rsi_required': False}.
[I 2025-08-30 15:33:20,568] Trial 493 finished with values: [-1000000000.0, 1000000000.0] and parameters: {'p_sma': 8, 'p_std': 23, 'p_atr': 23, 'p_adx': 25, 'rsi_period': 10, 'ema1': 24, 'ema2': 38, 'slip_atr_k': 0.1230319648940039, 'slip_spread_k': 0.6954011454853938, 'spread_hl_frac': 0.008868037972051334, 'bb_std_mult': 0.62016050411278, 'rsi_os': 27, 'rsi_ob': 88, 'vol_spike': 0.21745987120794147, 'adx_thresh': 20.202044811007852, 'atr_min_pct': 0.0057300585970195255, 'atr_max_pct': 0.10898720542456221, 'tp_mult': 1.4962332478543874, 'tsl_mult': 0.38527820889503384, 'strategy': 'mean_reversion', 'time_stop': 174, 'use_sma': True, 'use_atr': True, 'use_adx': False, 'use_ema': True, 'use_spike': True, 'rsi_required': True, 'edge_k': 0.7570854367525225, 'edge_cap': 0.9466582815391167, 'bull_strategy': 'mean_reversion', 'bull_bb_std_mult': 1.6210561715579401, 'bull_rsi_os': 49, 'bull_rsi_ob': 86, 'bull_adx_thresh': 9.369814329741004, 'bull_atr_min_pct': 0.019966244185639897, 'bull_atr_max_pct': 0.10460089390739058, 'bull_tp_mult': 2.532682954491991, 'bull_tsl_mult': 0.8694982865966645, 'bull_time_stop': 57, 'bull_use_sma': False, 'bull_use_ema': False, 'bull_use_atr': True, 'bull_use_adx': True, 'bull_use_spike': False, 'bull_rsi_required': True, 'bear_strategy': 'breakout', 'bear_bb_std_mult': 1.7579219432271418, 'bear_rsi_os': 6, 'bear_rsi_ob': 75, 'bear_adx_thresh': 14.115747415682925, 'bear_atr_min_pct': 0.0015114234271460057, 'bear_atr_max_pct': 0.11045864873026584, 'bear_tp_mult': 2.643933514528846, 'bear_tsl_mult': 0.8536633440927134, 'bear_time_stop': 94, 'bear_use_sma': False, 'bear_use_ema': True, 'bear_use_atr': False, 'bear_use_adx': True, 'bear_use_spike': False, 'bear_rsi_required': False, 'sideways_strategy': 'breakout', 'sideways_bb_std_mult': 3.186004615154807, 'sideways_rsi_os': 19, 'sideways_rsi_ob': 81, 'sideways_adx_thresh': 12.742278202865114, 'sideways_atr_min_pct': 0.019473141716048626, 'sideways_atr_max_pct': 0.06678529024539707, 'sideways_tp_mult': 1.3751229627242942, 'sideways_tsl_mult': 0.40926102986094204, 'sideways_time_stop': 133, 'sideways_use_sma': False, 'sideways_use_ema': True, 'sideways_use_atr': True, 'sideways_use_adx': True, 'sideways_use_spike': True, 'sideways_rsi_required': False}.
[I 2025-08-30 15:34:07,596] Trial 496 finished with values: [-1000000000.0, 1000000000.0] and parameters: {'p_sma': 8, 'p_std': 19, 'p_atr': 23, 'p_adx': 12, 'rsi_period': 9, 'ema1': 24, 'ema2': 38, 'slip_atr_k': 0.12576288151441786, 'slip_spread_k': 0.7085310932496293, 'spread_hl_frac': 0.008540333305135001, 'bb_std_mult': 0.745168469407286, 'rsi_os': 31, 'rsi_ob': 72, 'vol_spike': 0.21702761291191994, 'adx_thresh': 30.960057614651987, 'atr_min_pct': 0.006337499805530708, 'atr_max_pct': 0.10758561261603022, 'tp_mult': 1.436329279374196, 'tsl_mult': 0.3753323604074116, 'strategy': 'mean_reversion', 'time_stop': 166, 'use_sma': True, 'use_atr': True, 'use_adx': False, 'use_ema': True, 'use_spike': True, 'rsi_required': False, 'edge_k': 0.6378611728408644, 'edge_cap': 0.9567983397912406, 'bull_strategy': 'mean_reversion', 'bull_bb_std_mult': 1.6348487472359634, 'bull_rsi_os': 51, 'bull_rsi_ob': 87, 'bull_adx_thresh': 9.594497436307442, 'bull_atr_min_pct': 0.020213528178368526, 'bull_atr_max_pct': 0.07252718552681779, 'bull_tp_mult': 2.571641810532205, 'bull_tsl_mult': 0.8283922299477589, 'bull_time_stop': 67, 'bull_use_sma': False, 'bull_use_ema': False, 'bull_use_atr': True, 'bull_use_adx': True, 'bull_use_spike': False, 'bull_rsi_required': True, 'bear_strategy': 'breakout', 'bear_bb_std_mult': 1.9036731139231735, 'bear_rsi_os': 42, 'bear_rsi_ob': 75, 'bear_adx_thresh': 14.369095878701662, 'bear_atr_min_pct': 0.0019905123145664582, 'bear_atr_max_pct': 0.1102728345973612, 'bear_tp_mult': 2.6438552760030736, 'bear_tsl_mult': 0.8513230758685535, 'bear_time_stop': 83, 'bear_use_sma': False, 'bear_use_ema': True, 'bear_use_atr': False, 'bear_use_adx': True, 'bear_use_spike': False, 'bear_rsi_required': False, 'sideways_strategy': 'breakout', 'sideways_bb_std_mult': 3.2451834835943028, 'sideways_rsi_os': 23, 'sideways_rsi_ob': 77, 'sideways_adx_thresh': 28.385126513851645, 'sideways_atr_min_pct': 0.01995536260108414, 'sideways_atr_max_pct': 0.06840714317540886, 'sideways_tp_mult': 1.1787712479214099, 'sideways_tsl_mult': 0.468547945508495, 'sideways_time_stop': 133, 'sideways_use_sma': False, 'sideways_use_ema': True, 'sideways_use_atr': True, 'sideways_use_adx': True, 'sideways_use_spike': True, 'sideways_rsi_required': False}.
