[I 2025-08-30 14:54:43,912] Trial 278 finished with values: [-0.006974511500531633, 0.007009159769503342] and parameters: {'p_sma': 41, 'p_std': 32, 'p_atr': 18, 'p_adx': 29, 'rsi_period': 30, 'ema1': 10, 'ema2': 52, 'slip_atr_k': 0.028619356134237328, 'slip_spread_k': 0.23224441896768128, 'spread_hl_frac': 0.0033050151646242198, 'bb_std_mult': 3.111897303331668, 'rsi_os': 5, 'rsi_ob': 91, 'vol_spike': 0.28422747760816836, 'adx_thresh': 14.520675096926393, 'atr_min_pct': 0.0043281520090275374, 'atr_max_pct': 0.08900691144474773, 'tp_mult': 2.399170708785748, 'tsl_mult': 0.5780438693544937, 'strategy': 'breakout', 'time_stop': 261, 'use_sma': False, 'use_atr': False, 'use_adx': True, 'use_ema': False, 'use_spike': False, 'rsi_required': False, 'edge_k': 0.28376878782033554, 'edge_cap': 0.8359724147603059, 'bull_strategy': 'breakout', 'bull_bb_std_mult': 2.656851986743179, 'bull_rsi_os': 50, 'bull_rsi_ob': 48, 'bull_adx_thresh': 29.683998841416795, 'bull_atr_min_pct': 0.0011315266999433098, 'bull_atr_max_pct': 0.07869916906977462, 'bull_tp_mult': 1.04734576492211, 'bull_tsl_mult': 0.952086173774114, 'bull_time_stop': 122, 'bull_use_sma': True, 'bull_use_ema': True, 'bull_use_atr': True, 'bull_use_adx': False, 'bull_use_spike': True, 'bull_rsi_required': False, 'bear_strategy': 'mean_reversion', 'bear_bb_std_mult': 3.3221792199661753, 'bear_rsi_os': 30, 'bear_rsi_ob': 85, 'bear_adx_thresh': 5.016570577629052, 'bear_atr_min_pct': 0.029933496707768008, 'bear_atr_max_pct': 0.01036036890959886, 'bear_tp_mult': 2.8402877236514277, 'bear_tsl_mult': 0.5731337048917673, 'bear_time_stop': 262, 'bear_use_sma': True, 'bear_use_ema': False, 'bear_use_atr': True, 'bear_use_adx': True, 'bear_use_spike': True, 'bear_rsi_required': True, 'sideways_strategy': 'mean_reversion', 'sideways_bb_std_mult': 1.0981609870904674, 'sideways_rsi_os': 36, 'sideways_rsi_ob': 57, 'sideways_adx_thresh': 18.418087210286266, 'sideways_atr_min_pct': 0.022557779490251378, 'sideways_atr_max_pct': 0.08627736135857489, 'sideways_tp_mult': 2.289572057021225, 'sideways_tsl_mult': 0.9135134547821864, 'sideways_time_stop': 102, 'sideways_use_sma': True, 'sideways_use_ema': False, 'sideways_use_atr': True, 'sideways_use_adx': True, 'sideways_use_spike': True, 'sideways_rsi_required': True}.
[I 2025-08-30 14:54:44,064] Trial 280 finished with values: [-0.006632480678319563, 0.006700361897882472] and parameters: {'p_sma': 42, 'p_std': 32, 'p_atr': 18, 'p_adx': 29, 'rsi_period': 55, 'ema1': 10, 'ema2': 52, 'slip_atr_k': 0.028941091309984852, 'slip_spread_k': 0.23439729078498206, 'spread_hl_frac': 0.0029457812214324914, 'bb_std_mult': 3.0959165076584676, 'rsi_os': 5, 'rsi_ob': 93, 'vol_spike': 0.28187878858260895, 'adx_thresh': 15.106347730207299, 'atr_min_pct': 0.004921010791139792, 'atr_max_pct': 0.0867250396607863, 'tp_mult': 2.399671268237034, 'tsl_mult': 0.583177278304503, 'strategy': 'breakout', 'time_stop': 259, 'use_sma': False, 'use_atr': False, 'use_adx': True, 'use_ema': False, 'use_spike': False, 'rsi_required': False, 'edge_k': 0.3066884134290181, 'edge_cap': 0.8408178238413081, 'bull_strategy': 'breakout', 'bull_bb_std_mult': 2.6364469556319494, 'bull_rsi_os': 50, 'bull_rsi_ob': 50, 'bull_adx_thresh': 29.765649361849704, 'bull_atr_min_pct': 0.0012731944076888652, 'bull_atr_max_pct': 0.08033620058777292, 'bull_tp_mult': 1.031825999812436, 'bull_tsl_mult': 0.9534680610661195, 'bull_time_stop': 122, 'bull_use_sma': True, 'bull_use_ema': True, 'bull_use_atr': True, 'bull_use_adx': False, 'bull_use_spike': True, 'bull_rsi_required': False, 'bear_strategy': 'mean_reversion', 'bear_bb_std_mult': 3.333434389855683, 'bear_rsi_os': 30, 'bear_rsi_ob': 85, 'bear_adx_thresh': 5.601518460210468, 'bear_atr_min_pct': 0.029867796311265255, 'bear_atr_max_pct': 0.01193880026887461, 'bear_tp_mult': 2.8814189004907713, 'bear_tsl_mult': 0.589717767969732, 'bear_time_stop': 262, 'bear_use_sma': True, 'bear_use_ema': False, 'bear_use_atr': True, 'bear_use_adx': True, 'bear_use_spike': True, 'bear_rsi_required': True, 'sideways_strategy': 'mean_reversion', 'sideways_bb_std_mult': 1.1548535409288077, 'sideways_rsi_os': 35, 'sideways_rsi_ob': 58, 'sideways_adx_thresh': 18.710296289143354, 'sideways_atr_min_pct': 0.022659537471990867, 'sideways_atr_max_pct': 0.0878142736611388, 'sideways_tp_mult': 2.308114085418821, 'sideways_tsl_mult': 0.9449029013677435, 'sideways_time_stop': 102, 'sideways_use_sma': True, 'sideways_use_ema': False, 'sideways_use_atr': True, 'sideways_use_adx': True, 'sideways_use_spike': True, 'sideways_rsi_required': True}.
[I 2025-08-30 14:55:15,155] Trial 281 finished with values: [-0.006602325445866142, 0.006670373150208542] and parameters: {'p_sma': 42, 'p_std': 32, 'p_atr': 18, 'p_adx': 29, 'rsi_period': 49, 'ema1': 10, 'ema2': 52, 'slip_atr_k': 0.027879333548865144, 'slip_spread_k': 0.24851265163614805, 'spread_hl_frac': 0.003066656173634226, 'bb_std_mult': 2.9470480562452415, 'rsi_os': 5, 'rsi_ob': 91, 'vol_spike': 0.2824603544276618, 'adx_thresh': 14.905274818610156, 'atr_min_pct': 0.003030289802634704, 'atr_max_pct': 0.08817345598399952, 'tp_mult': 2.406829203741949, 'tsl_mult': 0.509549469997589, 'strategy': 'breakout', 'time_stop': 259, 'use_sma': False, 'use_atr': False, 'use_adx': True, 'use_ema': False, 'use_spike': False, 'rsi_required': False, 'edge_k': 0.18676028531944866, 'edge_cap': 0.8037639681996459, 'bull_strategy': 'breakout', 'bull_bb_std_mult': 2.4730152613921135, 'bull_rsi_os': 50, 'bull_rsi_ob': 49, 'bull_adx_thresh': 29.788915322321618, 'bull_atr_min_pct': 0.0012651169113164912, 'bull_atr_max_pct': 0.08148519503835883, 'bull_tp_mult': 1.0101816440892373, 'bull_tsl_mult': 0.960386011681018, 'bull_time_stop': 121, 'bull_use_sma': True, 'bull_use_ema': True, 'bull_use_atr': True, 'bull_use_adx': False, 'bull_use_spike': True, 'bull_rsi_required': False, 'bear_strategy': 'mean_reversion', 'bear_bb_std_mult': 2.653769350185579, 'bear_rsi_os': 30, 'bear_rsi_ob': 83, 'bear_adx_thresh': 5.5717380168556545, 'bear_atr_min_pct': 0.02999117476427328, 'bear_atr_max_pct': 0.010203127129574833, 'bear_tp_mult': 2.8239552251490365, 'bear_tsl_mult': 0.6211548076926249, 'bear_time_stop': 262, 'bear_use_sma': True, 'bear_use_ema': False, 'bear_use_atr': True, 'bear_use_adx': True, 'bear_use_spike': True, 'bear_rsi_required': True, 'sideways_strategy': 'mean_reversion', 'sideways_bb_std_mult': 0.5304783074001612, 'sideways_rsi_os': 35, 'sideways_rsi_ob': 57, 'sideways_adx_thresh': 17.97818395818651, 'sideways_atr_min_pct': 0.022611698002769576, 'sideways_atr_max_pct': 0.0898897304713487, 'sideways_tp_mult': 2.272358651418734, 'sideways_tsl_mult': 0.9164486153542454, 'sideways_time_stop': 104, 'sideways_use_sma': True, 'sideways_use_ema': False, 'sideways_use_atr': True, 'sideways_use_adx': True, 'sideways_use_spike': True, 'sideways_rsi_required': True}.
[I 2025-08-30 14:55:15,325] Trial 283 finished with values: [-0.006578230973486088, 0.006646212556363737] and parameters: {'p_sma': 42, 'p_std': 32, 'p_atr': 18, 'p_adx': 29, 'rsi_period': 55, 'ema1': 10, 'ema2': 52, 'slip_atr_k': 0.028327218514507323, 'slip_spread_k': 0.2384334062109196, 'spread_hl_frac': 0.0030311868987211777, 'bb_std_mult': 3.1208814509800127, 'rsi_os': 5, 'rsi_ob': 91, 'vol_spike': 0.2823210260961236, 'adx_thresh': 15.356208430071097, 'atr_min_pct': 0.004260097590962955, 'atr_max_pct': 0.08903715538698913, 'tp_mult': 2.4022241191641247, 'tsl_mult': 0.5068544375470552, 'strategy': 'breakout', 'time_stop': 259, 'use_sma': False, 'use_atr': False, 'use_adx': True, 'use_ema': False, 'use_spike': False, 'rsi_required': False, 'edge_k': 0.2826256831772211, 'edge_cap': 0.8508440176163587, 'bull_strategy': 'breakout', 'bull_bb_std_mult': 2.4506431268712645, 'bull_rsi_os': 50, 'bull_rsi_ob': 50, 'bull_adx_thresh': 29.73245228725377, 'bull_atr_min_pct': 0.001228713397612753, 'bull_atr_max_pct': 0.08050016935463734, 'bull_tp_mult': 1.0133134213135029, 'bull_tsl_mult': 0.9534764412966533, 'bull_time_stop': 119, 'bull_use_sma': True, 'bull_use_ema': True, 'bull_use_atr': True, 'bull_use_adx': False, 'bull_use_spike': True, 'bull_rsi_required': True, 'bear_strategy': 'mean_reversion', 'bear_bb_std_mult': 2.9722875718151984, 'bear_rsi_os': 30, 'bear_rsi_ob': 84, 'bear_adx_thresh': 5.610384881805698, 'bear_atr_min_pct': 0.029975943686459533, 'bear_atr_max_pct': 0.010913889639411105, 'bear_tp_mult': 2.802739605486277, 'bear_tsl_mult': 0.573138005601488, 'bear_time_stop': 262, 'bear_use_sma': True, 'bear_use_ema': False, 'bear_use_atr': True, 'bear_use_adx': True, 'bear_use_spike': True, 'bear_rsi_required': True, 'sideways_strategy': 'mean_reversion', 'sideways_bb_std_mult': 1.1902354457226885, 'sideways_rsi_os': 35, 'sideways_rsi_ob': 57, 'sideways_adx_thresh': 18.28644312938176, 'sideways_atr_min_pct': 0.02252938006396104, 'sideways_atr_max_pct': 0.08801157700334733, 'sideways_tp_mult': 2.2969787798781587, 'sideways_tsl_mult': 0.9126915236329384, 'sideways_time_stop': 104, 'sideways_use_sma': True, 'sideways_use_ema': False, 'sideways_use_atr': True, 'sideways_use_adx': True, 'sideways_use_spike': True, 'sideways_rsi_required': True}.
[I 2025-08-30 14:55:15,461] Trial 282 finished with values: [-0.006712910476696199, 0.006749088354070027] and parameters: {'p_sma': 42, 'p_std': 32, 'p_atr': 18, 'p_adx': 29, 'rsi_period': 55, 'ema1': 10, 'ema2': 52, 'slip_atr_k': 0.026285402880069624, 'slip_spread_k': 0.24251504061333365, 'spread_hl_frac': 0.002944809245043294, 'bb_std_mult': 3.1032856636693893, 'rsi_os': 5, 'rsi_ob': 90, 'vol_spike': 0.2831965919634953, 'adx_thresh': 15.08820656290545, 'atr_min_pct': 0.0043614071317985325, 'atr_max_pct': 0.08927817724876927, 'tp_mult': 2.3875733272773303, 'tsl_mult': 0.5510190322326988, 'strategy': 'breakout', 'time_stop': 261, 'use_sma': False, 'use_atr': False, 'use_adx': True, 'use_ema': False, 'use_spike': False, 'rsi_required': False, 'edge_k': 0.28013328656575043, 'edge_cap': 0.8137355522184335, 'bull_strategy': 'breakout', 'bull_bb_std_mult': 2.4697741269489697, 'bull_rsi_os': 50, 'bull_rsi_ob': 48, 'bull_adx_thresh': 29.805985247692888, 'bull_atr_min_pct': 0.0011548641860031831, 'bull_atr_max_pct': 0.08010099545976568, 'bull_tp_mult': 1.01392616459366, 'bull_tsl_mult': 0.9146291509435389, 'bull_time_stop': 121, 'bull_use_sma': True, 'bull_use_ema': True, 'bull_use_atr': True, 'bull_use_adx': False, 'bull_use_spike': True, 'bull_rsi_required': False, 'bear_strategy': 'mean_reversion', 'bear_bb_std_mult': 3.0285532667587374, 'bear_rsi_os': 27, 'bear_rsi_ob': 79, 'bear_adx_thresh': 5.620454335681449, 'bear_atr_min_pct': 0.029728649003524923, 'bear_atr_max_pct': 0.01023281109196183, 'bear_tp_mult': 2.8206061597665633, 'bear_tsl_mult': 0.5787638055147254, 'bear_time_stop': 260, 'bear_use_sma': True, 'bear_use_ema': False, 'bear_use_atr': True, 'bear_use_adx': True, 'bear_use_spike': True, 'bear_rsi_required': True, 'sideways_strategy': 'mean_reversion', 'sideways_bb_std_mult': 1.1262538087164873, 'sideways_rsi_os': 34, 'sideways_rsi_ob': 57, 'sideways_adx_thresh': 18.344297598162697, 'sideways_atr_min_pct': 0.022383074404002425, 'sideways_atr_max_pct': 0.08744267546476468, 'sideways_tp_mult': 2.2945085980715128, 'sideways_tsl_mult': 0.9172804162092276, 'sideways_time_stop': 103, 'sideways_use_sma': True, 'sideways_use_ema': False, 'sideways_use_atr': True, 'sideways_use_adx': True, 'sideways_use_spike': True, 'sideways_rsi_required': True}.
[I 2025-08-30 14:55:15,573] Trial 284 finished with values: [-0.0074113718117104765, 0.00744612709745371] and parameters: {'p_sma': 42, 'p_std': 31, 'p_atr': 18, 'p_adx': 29, 'rsi_period': 55, 'ema1': 10, 'ema2': 52, 'slip_atr_k': 0.028067384139084377, 'slip_spread_k': 0.24064118758041597, 'spread_hl_frac': 0.003038622971600936, 'bb_std_mult': 3.1280374519952576, 'rsi_os': 5, 'rsi_ob': 91, 'vol_spike': 0.28277515113084206, 'adx_thresh': 15.197588639439116, 'atr_min_pct': 0.0041016634037596145, 'atr_max_pct': 0.0891718280734593, 'tp_mult': 2.460287869082283, 'tsl_mult': 0.554355260571311, 'strategy': 'breakout', 'time_stop': 259, 'use_sma': False, 'use_atr': False, 'use_adx': True, 'use_ema': False, 'use_spike': False, 'rsi_required': False, 'edge_k': 0.18877703775156085, 'edge_cap': 0.7544402022261884, 'bull_strategy': 'breakout', 'bull_bb_std_mult': 2.4690979836029996, 'bull_rsi_os': 49, 'bull_rsi_ob': 50, 'bull_adx_thresh': 29.860618777178743, 'bull_atr_min_pct': 0.0010254832819051873, 'bull_atr_max_pct': 0.08045006821444935, 'bull_tp_mult': 1.0187543193469444, 'bull_tsl_mult': 0.9564326894125339, 'bull_time_stop': 121, 'bull_use_sma': True, 'bull_use_ema': True, 'bull_use_atr': True, 'bull_use_adx': False, 'bull_use_spike': True, 'bull_rsi_required': True, 'bear_strategy': 'mean_reversion', 'bear_bb_std_mult': 2.9836814709185986, 'bear_rsi_os': 30, 'bear_rsi_ob': 84, 'bear_adx_thresh': 5.600803957870695, 'bear_atr_min_pct': 0.029944197422060777, 'bear_atr_max_pct': 0.010064149209269305, 'bear_tp_mult': 2.822248112491901, 'bear_tsl_mult': 0.5878513541551093, 'bear_time_stop': 261, 'bear_use_sma': True, 'bear_use_ema': False, 'bear_use_atr': True, 'bear_use_adx': True, 'bear_use_spike': True, 'bear_rsi_required': True, 'sideways_strategy': 'mean_reversion', 'sideways_bb_std_mult': 1.1765671210076525, 'sideways_rsi_os': 35, 'sideways_rsi_ob': 57, 'sideways_adx_thresh': 17.803353565048404, 'sideways_atr_min_pct': 0.022530562616513213, 'sideways_atr_max_pct': 0.08689629039390989, 'sideways_tp_mult': 2.3053135135937026, 'sideways_tsl_mult': 0.9114516859844668, 'sideways_time_stop': 103, 'sideways_use_sma': True, 'sideways_use_ema': False, 'sideways_use_atr': True, 'sideways_use_adx': True, 'sideways_use_spike': True, 'sideways_rsi_required': True}.
[I 2025-08-30 14:55:46,108] Trial 285 finished with values: [-0.006771010280602452, 0.006805785357781664] and parameters: {'p_sma': 42, 'p_std': 32, 'p_atr': 18, 'p_adx': 29, 'rsi_period': 55, 'ema1': 10, 'ema2': 52, 'slip_atr_k': 0.028083757605567854, 'slip_spread_k': 0.24046424501489877, 'spread_hl_frac': 0.003032480722094852, 'bb_std_mult': 3.100280582467632, 'rsi_os': 5, 'rsi_ob': 91, 'vol_spike': 0.2831523508201513, 'adx_thresh': 15.148377184876997, 'atr_min_pct': 0.0043884056105516385, 'atr_max_pct': 0.08939325320103284, 'tp_mult': 2.449512018979902, 'tsl_mult': 0.5471044360886427, 'strategy': 'breakout', 'time_stop': 261, 'use_sma': False, 'use_atr': False, 'use_adx': True, 'use_ema': False, 'use_spike': False, 'rsi_required': False, 'edge_k': 0.19464206261850014, 'edge_cap': 0.8441792627571924, 'bull_strategy': 'breakout', 'bull_bb_std_mult': 2.6268351071804243, 'bull_rsi_os': 50, 'bull_rsi_ob': 48, 'bull_adx_thresh': 29.897504513700394, 'bull_atr_min_pct': 0.001135999682274194, 'bull_atr_max_pct': 0.08054621820494931, 'bull_tp_mult': 1.018190910262333, 'bull_tsl_mult': 0.9234280002979044, 'bull_time_stop': 122, 'bull_use_sma': True, 'bull_use_ema': True, 'bull_use_atr': True, 'bull_use_adx': False, 'bull_use_spike': True, 'bull_rsi_required': False, 'bear_strategy': 'mean_reversion', 'bear_bb_std_mult': 2.9850456811737356, 'bear_rsi_os': 30, 'bear_rsi_ob': 84, 'bear_adx_thresh': 5.568950688132449, 'bear_atr_min_pct': 0.029614701865730023, 'bear_atr_max_pct': 0.010018208944217476, 'bear_tp_mult': 2.8210020125553994, 'bear_tsl_mult': 0.6178534197513742, 'bear_time_stop': 263, 'bear_use_sma': True, 'bear_use_ema': False, 'bear_use_atr': True, 'bear_use_adx': True, 'bear_use_spike': True, 'bear_rsi_required': True, 'sideways_strategy': 'mean_reversion', 'sideways_bb_std_mult': 1.1877059332331639, 'sideways_rsi_os': 36, 'sideways_rsi_ob': 57, 'sideways_adx_thresh': 18.105406426666697, 'sideways_atr_min_pct': 0.0226652116493667, 'sideways_atr_max_pct': 0.08781775576638606, 'sideways_tp_mult': 2.295790356812448, 'sideways_tsl_mult': 0.9131486378788501, 'sideways_time_stop': 104, 'sideways_use_sma': True, 'sideways_use_ema': False, 'sideways_use_atr': True, 'sideways_use_adx': True, 'sideways_use_spike': True, 'sideways_rsi_required': True}.
[I 2025-08-30 14:55:46,343] Trial 287 finished with values: [-0.006840932287069834, 0.006875656462475259] and parameters: {'p_sma': 42, 'p_std': 32, 'p_atr': 18, 'p_adx': 29, 'rsi_period': 55, 'ema1': 10, 'ema2': 52, 'slip_atr_k': 0.028306600841601855, 'slip_spread_k': 0.23869565587959699, 'spread_hl_frac': 0.0030996212197021036, 'bb_std_mult': 3.1103501729451146, 'rsi_os': 5, 'rsi_ob': 91, 'vol_spike': 0.28405536897871037, 'adx_thresh': 15.15996309472015, 'atr_min_pct': 0.0038892778847201604, 'atr_max_pct': 0.08891215973449221, 'tp_mult': 2.391956862808804, 'tsl_mult': 0.5008867418462574, 'strategy': 'breakout', 'time_stop': 261, 'use_sma': False, 'use_atr': False, 'use_adx': True, 'use_ema': False, 'use_spike': False, 'rsi_required': False, 'edge_k': 0.27390872455446885, 'edge_cap': 0.8275519802040925, 'bull_strategy': 'breakout', 'bull_bb_std_mult': 2.608892760339396, 'bull_rsi_os': 50, 'bull_rsi_ob': 50, 'bull_adx_thresh': 29.778620359433397, 'bull_atr_min_pct': 0.0011261582828193894, 'bull_atr_max_pct': 0.07950843070460213, 'bull_tp_mult': 1.0105584247078323, 'bull_tsl_mult': 0.913600893376605, 'bull_time_stop': 121, 'bull_use_sma': True, 'bull_use_ema': True, 'bull_use_atr': True, 'bull_use_adx': False, 'bull_use_spike': True, 'bull_rsi_required': False, 'bear_strategy': 'mean_reversion', 'bear_bb_std_mult': 3.018436716436968, 'bear_rsi_os': 30, 'bear_rsi_ob': 83, 'bear_adx_thresh': 5.6654366306210555, 'bear_atr_min_pct': 0.029990852358856145, 'bear_atr_max_pct': 0.010160862571060856, 'bear_tp_mult': 2.8361661429745597, 'bear_tsl_mult': 0.6124423494691764, 'bear_time_stop': 261, 'bear_use_sma': True, 'bear_use_ema': False, 'bear_use_atr': True, 'bear_use_adx': True, 'bear_use_spike': True, 'bear_rsi_required': True, 'sideways_strategy': 'mean_reversion', 'sideways_bb_std_mult': 1.1986760802470933, 'sideways_rsi_os': 35, 'sideways_rsi_ob': 57, 'sideways_adx_thresh': 18.10419979233741, 'sideways_atr_min_pct': 0.022568539789860346, 'sideways_atr_max_pct': 0.08671163681022764, 'sideways_tp_mult': 2.2889569376223546, 'sideways_tsl_mult': 0.9088393048694283, 'sideways_time_stop': 103, 'sideways_use_sma': True, 'sideways_use_ema': False, 'sideways_use_atr': True, 'sideways_use_adx': True, 'sideways_use_spike': True, 'sideways_rsi_required': True}.
[I 2025-08-30 14:55:46,572] Trial 286 finished with values: [-0.006648550939721831, 0.006716267184723541] and parameters: {'p_sma': 42, 'p_std': 32, 'p_atr': 18, 'p_adx': 29, 'rsi_period': 55, 'ema1': 10, 'ema2': 52, 'slip_atr_k': 0.029951832457282127, 'slip_spread_k': 0.23738956491066554, 'spread_hl_frac': 0.0028404696891450756, 'bb_std_mult': 3.096661525880991, 'rsi_os': 5, 'rsi_ob': 91, 'vol_spike': 0.2819062644728365, 'adx_thresh': 15.159721254689087, 'atr_min_pct': 0.004207141673543895, 'atr_max_pct': 0.0896824371844138, 'tp_mult': 2.3945113957077524, 'tsl_mult': 0.5113454670994327, 'strategy': 'breakout', 'time_stop': 260, 'use_sma': False, 'use_atr': False, 'use_adx': True, 'use_ema': False, 'use_spike': False, 'rsi_required': False, 'edge_k': 0.19734178866482666, 'edge_cap': 0.8373169244177516, 'bull_strategy': 'breakout', 'bull_bb_std_mult': 2.6144404449417835, 'bull_rsi_os': 50, 'bull_rsi_ob': 50, 'bull_adx_thresh': 29.801582624498785, 'bull_atr_min_pct': 0.001236408137909472, 'bull_atr_max_pct': 0.08023906293401767, 'bull_tp_mult': 1.0114322444849608, 'bull_tsl_mult': 0.9523425136184732, 'bull_time_stop': 122, 'bull_use_sma': True, 'bull_use_ema': True, 'bull_use_atr': True, 'bull_use_adx': False, 'bull_use_spike': True, 'bull_rsi_required': False, 'bear_strategy': 'mean_reversion', 'bear_bb_std_mult': 2.9762138504150997, 'bear_rsi_os': 30, 'bear_rsi_ob': 84, 'bear_adx_thresh': 5.589604895241915, 'bear_atr_min_pct': 0.029936349170133738, 'bear_atr_max_pct': 0.010316996130416757, 'bear_tp_mult': 2.83001327129074, 'bear_tsl_mult': 0.5798422921019959, 'bear_time_stop': 259, 'bear_use_sma': True, 'bear_use_ema': False, 'bear_use_atr': True, 'bear_use_adx': True, 'bear_use_spike': True, 'bear_rsi_required': True, 'sideways_strategy': 'mean_reversion', 'sideways_bb_std_mult': 1.183237088392803, 'sideways_rsi_os': 36, 'sideways_rsi_ob': 57, 'sideways_adx_thresh': 18.233214714700885, 'sideways_atr_min_pct': 0.022531997776815076, 'sideways_atr_max_pct': 0.08623716322857486, 'sideways_tp_mult': 2.307550631139685, 'sideways_tsl_mult': 0.9160732712230948, 'sideways_time_stop': 104, 'sideways_use_sma': True, 'sideways_use_ema': False, 'sideways_use_atr': True, 'sideways_use_adx': True, 'sideways_use_spike': True, 'sideways_rsi_required': True}.
