[I 2025-08-30 16:30:35,173] Trial 782 finished with values: [-0.024513051655596252, 0.024516196603982743] and parameters: {'p_sma': 22, 'p_std': 41, 'p_atr': 11, 'p_adx': 25, 'rsi_period': 11, 'ema1': 23, 'ema2': 32, 'slip_atr_k': 0.11662109004270153, 'slip_spread_k': 0.6825215471794953, 'spread_hl_frac': 0.02399781970955713, 'bb_std_mult': 2.7149130661400087, 'rsi_os': 28, 'rsi_ob': 72, 'vol_spike': 0.21539410827624808, 'adx_thresh': 8.447100006397815, 'atr_min_pct': 0.005673188751740364, 'atr_max_pct': 0.11511469643668683, 'tp_mult': 1.6575171173380796, 'tsl_mult': 0.37512286311085347, 'strategy': 'breakout', 'time_stop': 193, 'use_sma': True, 'use_atr': False, 'use_adx': False, 'use_ema': False, 'use_spike': True, 'rsi_required': True, 'edge_k': 0.6823318841205017, 'edge_cap': 0.97470550073007, 'bull_strategy': 'breakout', 'bull_bb_std_mult': 2.334651943296603, 'bull_rsi_os': 51, 'bull_rsi_ob': 81, 'bull_adx_thresh': 11.650257682075962, 'bull_atr_min_pct': 0.018968281792424175, 'bull_atr_max_pct': 0.09782229988994326, 'bull_tp_mult': 2.5576081671861908, 'bull_tsl_mult': 0.3126909418642251, 'bull_time_stop': 57, 'bull_use_sma': True, 'bull_use_ema': True, 'bull_use_atr': True, 'bull_use_adx': False, 'bull_use_spike': True, 'bull_rsi_required': False, 'bear_strategy': 'mean_reversion', 'bear_bb_std_mult': 2.0603994048253655, 'bear_rsi_os': 24, 'bear_rsi_ob': 75, 'bear_adx_thresh': 14.740065809848115, 'bear_atr_min_pct': 0.0021242078633699805, 'bear_atr_max_pct': 0.11046003981271903, 'bear_tp_mult': 1.851866419754396, 'bear_tsl_mult': 0.8393128563415804, 'bear_time_stop': 109, 'bear_use_sma': True, 'bear_use_ema': False, 'bear_use_atr': True, 'bear_use_adx': True, 'bear_use_spike': True, 'bear_rsi_required': True, 'sideways_strategy': 'mean_reversion', 'sideways_bb_std_mult': 3.3167608686130756, 'sideways_rsi_os': 52, 'sideways_rsi_ob': 83, 'sideways_adx_thresh': 24.133478791509386, 'sideways_atr_min_pct': 0.021699465671570824, 'sideways_atr_max_pct': 0.0645794134669912, 'sideways_tp_mult': 1.3680984931396223, 'sideways_tsl_mult': 0.4596863215913469, 'sideways_time_stop': 109, 'sideways_use_sma': True, 'sideways_use_ema': False, 'sideways_use_atr': True, 'sideways_use_adx': True, 'sideways_use_spike': True, 'sideways_rsi_required': True}.
[I 2025-08-30 16:31:20,448] Trial 787 finished with values: [-1000000000.0, 1000000000.0] and parameters: {'p_sma': 7, 'p_std': 45, 'p_atr': 14, 'p_adx': 11, 'rsi_period': 79, 'ema1': 24, 'ema2': 11, 'slip_atr_k': 0.010657555055341453, 'slip_spread_k': 0.7179683658280659, 'spread_hl_frac': 0.049234233228551416, 'bb_std_mult': 0.500282730794174, 'rsi_os': 50, 'rsi_ob': 48, 'vol_spike': 0.17566932156323803, 'adx_thresh': 6.940365450558015, 'atr_min_pct': 0.005000173592180465, 'atr_max_pct': 0.11075752379601606, 'tp_mult': 1.3836891419041186, 'tsl_mult': 0.29885876493894525, 'strategy': 'breakout', 'time_stop': 171, 'use_sma': False, 'use_atr': True, 'use_adx': True, 'use_ema': True, 'use_spike': False, 'rsi_required': False, 'edge_k': 1.7020802525679293, 'edge_cap': 0.7153961982274688, 'bull_strategy': 'mean_reversion', 'bull_bb_std_mult': 1.321681321364971, 'bull_rsi_os': 49, 'bull_rsi_ob': 88, 'bull_adx_thresh': 8.152289900503918, 'bull_atr_min_pct': 0.01957266542665981, 'bull_atr_max_pct': 0.10497367409858198, 'bull_tp_mult': 2.5875696809770377, 'bull_tsl_mult': 0.8538668843976719, 'bull_time_stop': 66, 'bull_use_sma': True, 'bull_use_ema': False, 'bull_use_atr': False, 'bull_use_adx': True, 'bull_use_spike': False, 'bull_rsi_required': False, 'bear_strategy': 'breakout', 'bear_bb_std_mult': 3.395287571162346, 'bear_rsi_os': 50, 'bear_rsi_ob': 54, 'bear_adx_thresh': 21.173025995323073, 'bear_atr_min_pct': 0.006372617742143828, 'bear_atr_max_pct': 0.10400509577929518, 'bear_tp_mult': 2.6127870414789736, 'bear_tsl_mult': 0.26352051901223406, 'bear_time_stop': 142, 'bear_use_sma': False, 'bear_use_ema': True, 'bear_use_atr': True, 'bear_use_adx': False, 'bear_use_spike': True, 'bear_rsi_required': True, 'sideways_strategy': 'mean_reversion', 'sideways_bb_std_mult': 2.9137965818837737, 'sideways_rsi_os': 6, 'sideways_rsi_ob': 85, 'sideways_adx_thresh': 9.74389459300551, 'sideways_atr_min_pct': 0.007782570985277107, 'sideways_atr_max_pct': 0.05847838023310483, 'sideways_tp_mult': 1.151174293958107, 'sideways_tsl_mult': 0.41479861324198625, 'sideways_time_stop': 119, 'sideways_use_sma': True, 'sideways_use_ema': False, 'sideways_use_atr': False, 'sideways_use_adx': True, 'sideways_use_spike': False, 'sideways_rsi_required': True}.
[I 2025-08-30 16:31:20,918] Trial 786 finished with values: [-1000000000.0, 1000000000.0] and parameters: {'p_sma': 30, 'p_std': 26, 'p_atr': 12, 'p_adx': 25, 'rsi_period': 11, 'ema1': 6, 'ema2': 20, 'slip_atr_k': 0.007760620648838334, 'slip_spread_k': 0.1563768367805135, 'spread_hl_frac': 0.0066211736723994965, 'bb_std_mult': 2.6155805482880305, 'rsi_os': 26, 'rsi_ob': 78, 'vol_spike': 0.17206166826275102, 'adx_thresh': 13.7535017234415, 'atr_min_pct': 0.020272518953455103, 'atr_max_pct': 0.03917951325397865, 'tp_mult': 1.6667726728584198, 'tsl_mult': 0.9481700970552902, 'strategy': 'breakout', 'time_stop': 173, 'use_sma': False, 'use_atr': True, 'use_adx': True, 'use_ema': False, 'use_spike': False, 'rsi_required': False, 'edge_k': 0.6147733644950727, 'edge_cap': 0.14841208400276418, 'bull_strategy': 'breakout', 'bull_bb_std_mult': 2.1331955167808796, 'bull_rsi_os': 49, 'bull_rsi_ob': 88, 'bull_adx_thresh': 7.800976190371385, 'bull_atr_min_pct': 0.011899048615751171, 'bull_atr_max_pct': 0.11218822455266181, 'bull_tp_mult': 2.5886317661354745, 'bull_tsl_mult': 0.8898575765681542, 'bull_time_stop': 33, 'bull_use_sma': True, 'bull_use_ema': False, 'bull_use_atr': True, 'bull_use_adx': True, 'bull_use_spike': False, 'bull_rsi_required': False, 'bear_strategy': 'mean_reversion', 'bear_bb_std_mult': 1.5826819324890842, 'bear_rsi_os': 53, 'bear_rsi_ob': 76, 'bear_adx_thresh': 15.12882898499478, 'bear_atr_min_pct': 0.002740798736669157, 'bear_atr_max_pct': 0.1031328231605419, 'bear_tp_mult': 2.6067354600833457, 'bear_tsl_mult': 0.8319588930000543, 'bear_time_stop': 139, 'bear_use_sma': True, 'bear_use_ema': True, 'bear_use_atr': True, 'bear_use_adx': False, 'bear_use_spike': True, 'bear_rsi_required': True, 'sideways_strategy': 'mean_reversion', 'sideways_bb_std_mult': 3.0153697865260414, 'sideways_rsi_os': 52, 'sideways_rsi_ob': 79, 'sideways_adx_thresh': 23.822415756408336, 'sideways_atr_min_pct': 0.008030128842185806, 'sideways_atr_max_pct': 0.14008847890279227, 'sideways_tp_mult': 1.3274655321830764, 'sideways_tsl_mult': 0.42019682060078467, 'sideways_time_stop': 120, 'sideways_use_sma': True, 'sideways_use_ema': False, 'sideways_use_atr': False, 'sideways_use_adx': True, 'sideways_use_spike': True, 'sideways_rsi_required': True}.
[I 2025-08-30 16:31:21,920] Trial 785 finished with values: [-1000000000.0, 1000000000.0] and parameters: {'p_sma': 30, 'p_std': 45, 'p_atr': 11, 'p_adx': 25, 'rsi_period': 69, 'ema1': 24, 'ema2': 34, 'slip_atr_k': 0.010221655103903998, 'slip_spread_k': 0.7139489483278441, 'spread_hl_frac': 0.01230965856084604, 'bb_std_mult': 0.8840474248584675, 'rsi_os': 44, 'rsi_ob': 48, 'vol_spike': 0.17655256322503032, 'adx_thresh': 8.41785274170166, 'atr_min_pct': 0.010947329996604981, 'atr_max_pct': 0.11194259072480757, 'tp_mult': 1.581168342278559, 'tsl_mult': 0.3118586940443732, 'strategy': 'breakout', 'time_stop': 194, 'use_sma': False, 'use_atr': False, 'use_adx': True, 'use_ema': False, 'use_spike': False, 'rsi_required': False, 'edge_k': 0.604508820339715, 'edge_cap': 0.9998415634268816, 'bull_strategy': 'breakout', 'bull_bb_std_mult': 1.6676324088823526, 'bull_rsi_os': 49, 'bull_rsi_ob': 88, 'bull_adx_thresh': 7.755035530642246, 'bull_atr_min_pct': 0.011845224486055277, 'bull_atr_max_pct': 0.04774712355615821, 'bull_tp_mult': 2.58247991802342, 'bull_tsl_mult': 0.5530691156134102, 'bull_time_stop': 34, 'bull_use_sma': True, 'bull_use_ema': False, 'bull_use_atr': True, 'bull_use_adx': True, 'bull_use_spike': False, 'bull_rsi_required': False, 'bear_strategy': 'mean_reversion', 'bear_bb_std_mult': 1.626207371519906, 'bear_rsi_os': 27, 'bear_rsi_ob': 76, 'bear_adx_thresh': 21.128362934912527, 'bear_atr_min_pct': 0.02025565411005386, 'bear_atr_max_pct': 0.05314609090850496, 'bear_tp_mult': 2.625118418365778, 'bear_tsl_mult': 0.8270275363694046, 'bear_time_stop': 162, 'bear_use_sma': True, 'bear_use_ema': True, 'bear_use_atr': True, 'bear_use_adx': False, 'bear_use_spike': True, 'bear_rsi_required': True, 'sideways_strategy': 'mean_reversion', 'sideways_bb_std_mult': 3.034399159890518, 'sideways_rsi_os': 46, 'sideways_rsi_ob': 82, 'sideways_adx_thresh': 13.406029311192622, 'sideways_atr_min_pct': 0.0204569397787584, 'sideways_atr_max_pct': 0.05824312361965157, 'sideways_tp_mult': 1.3847303832955629, 'sideways_tsl_mult': 0.0008159700725575703, 'sideways_time_stop': 114, 'sideways_use_sma': True, 'sideways_use_ema': False, 'sideways_use_atr': False, 'sideways_use_adx': True, 'sideways_use_spike': True, 'sideways_rsi_required': True}.
[I 2025-08-30 16:31:22,227] Trial 784 finished with values: [-1000000000.0, 1000000000.0] and parameters: {'p_sma': 11, 'p_std': 41, 'p_atr': 11, 'p_adx': 25, 'rsi_period': 11, 'ema1': 24, 'ema2': 32, 'slip_atr_k': 0.01008656507807566, 'slip_spread_k': 0.6410101271698372, 'spread_hl_frac': 0.006582166176282405, 'bb_std_mult': 0.7317743714643082, 'rsi_os': 48, 'rsi_ob': 78, 'vol_spike': 0.21227636788929233, 'adx_thresh': 23.581440171617853, 'atr_min_pct': 0.005651591226243913, 'atr_max_pct': 0.11353712425285496, 'tp_mult': 2.272290256318659, 'tsl_mult': 0.9449744779788345, 'strategy': 'breakout', 'time_stop': 144, 'use_sma': False, 'use_atr': False, 'use_adx': True, 'use_ema': False, 'use_spike': False, 'rsi_required': True, 'edge_k': 0.5640854255083904, 'edge_cap': 0.9694925477290951, 'bull_strategy': 'breakout', 'bull_bb_std_mult': 1.6375830952588253, 'bull_rsi_os': 6, 'bull_rsi_ob': 82, 'bull_adx_thresh': 11.547026349723948, 'bull_atr_min_pct': 0.01945501660836192, 'bull_atr_max_pct': 0.11241483102913258, 'bull_tp_mult': 2.57630570720573, 'bull_tsl_mult': 0.9313558608207244, 'bull_time_stop': 53, 'bull_use_sma': True, 'bull_use_ema': True, 'bull_use_atr': True, 'bull_use_adx': False, 'bull_use_spike': False, 'bull_rsi_required': False, 'bear_strategy': 'mean_reversion', 'bear_bb_std_mult': 1.5577832991138951, 'bear_rsi_os': 24, 'bear_rsi_ob': 86, 'bear_adx_thresh': 22.102158006730942, 'bear_atr_min_pct': 0.0021189313210156564, 'bear_atr_max_pct': 0.10269973545487728, 'bear_tp_mult': 2.6270696832503737, 'bear_tsl_mult': 0.8278238993452605, 'bear_time_stop': 139, 'bear_use_sma': True, 'bear_use_ema': False, 'bear_use_atr': True, 'bear_use_adx': True, 'bear_use_spike': True, 'bear_rsi_required': True, 'sideways_strategy': 'mean_reversion', 'sideways_bb_std_mult': 3.0420368288615593, 'sideways_rsi_os': 40, 'sideways_rsi_ob': 83, 'sideways_adx_thresh': 11.870431325510092, 'sideways_atr_min_pct': 0.021839123873106433, 'sideways_atr_max_pct': 0.07978653142921187, 'sideways_tp_mult': 1.3799749090808642, 'sideways_tsl_mult': 0.4169461566539907, 'sideways_time_stop': 245, 'sideways_use_sma': True, 'sideways_use_ema': False, 'sideways_use_atr': True, 'sideways_use_adx': True, 'sideways_use_spike': True, 'sideways_rsi_required': True}.
[I 2025-08-30 16:32:02,166] Trial 791 finished with values: [-1000000000.0, 1000000000.0] and parameters: {'p_sma': 32, 'p_std': 19, 'p_atr': 26, 'p_adx': 20, 'rsi_period': 7, 'ema1': 30, 'ema2': 37, 'slip_atr_k': 0.0031346815610031943, 'slip_spread_k': 0.6988894288427253, 'spread_hl_frac': 0.008830295616500346, 'bb_std_mult': 1.1070862765510117, 'rsi_os': 30, 'rsi_ob': 87, 'vol_spike': 0.10781663178660728, 'adx_thresh': 22.630454561879283, 'atr_min_pct': 0.01746622776476924, 'atr_max_pct': 0.1073535687323248, 'tp_mult': 1.7939155468667685, 'tsl_mult': 0.4065642123063468, 'strategy': 'breakout', 'time_stop': 51, 'use_sma': False, 'use_atr': False, 'use_adx': True, 'use_ema': True, 'use_spike': False, 'rsi_required': False, 'edge_k': 0.4570427241188904, 'edge_cap': 0.8906701425420256, 'bull_strategy': 'mean_reversion', 'bull_bb_std_mult': 1.4383368803138676, 'bull_rsi_os': 47, 'bull_rsi_ob': 89, 'bull_adx_thresh': 8.754988508930126, 'bull_atr_min_pct': 0.029959512412764074, 'bull_atr_max_pct': 0.020508166948287963, 'bull_tp_mult': 2.638674839111393, 'bull_tsl_mult': 0.8869138148638901, 'bull_time_stop': 11, 'bull_use_sma': True, 'bull_use_ema': True, 'bull_use_atr': False, 'bull_use_adx': True, 'bull_use_spike': True, 'bull_rsi_required': False, 'bear_strategy': 'breakout', 'bear_bb_std_mult': 0.7811867731565465, 'bear_rsi_os': 26, 'bear_rsi_ob': 78, 'bear_adx_thresh': 16.769483132618095, 'bear_atr_min_pct': 0.01726969388105475, 'bear_atr_max_pct': 0.1073337880432819, 'bear_tp_mult': 2.689020822861884, 'bear_tsl_mult': 0.7378057001720799, 'bear_time_stop': 92, 'bear_use_sma': False, 'bear_use_ema': False, 'bear_use_atr': True, 'bear_use_adx': True, 'bear_use_spike': True, 'bear_rsi_required': True, 'sideways_strategy': 'mean_reversion', 'sideways_bb_std_mult': 3.5989904108432755, 'sideways_rsi_os': 9, 'sideways_rsi_ob': 78, 'sideways_adx_thresh': 11.23011731993769, 'sideways_atr_min_pct': 0.017194711601527093, 'sideways_atr_max_pct': 0.07665093911804702, 'sideways_tp_mult': 1.293929335594246, 'sideways_tsl_mult': 0.33444715804187686, 'sideways_time_stop': 128, 'sideways_use_sma': True, 'sideways_use_ema': False, 'sideways_use_atr': True, 'sideways_use_adx': True, 'sideways_use_spike': False, 'sideways_rsi_required': True}.
[I 2025-08-30 16:32:03,273] Trial 790 finished with values: [-0.024788722408875197, 0.024940935580736824] and parameters: {'p_sma': 8, 'p_std': 19, 'p_atr': 12, 'p_adx': 27, 'rsi_period': 7, 'ema1': 25, 'ema2': 37, 'slip_atr_k': 0.18579637535883048, 'slip_spread_k': 0.6494866841344068, 'spread_hl_frac': 0.006683916771277532, 'bb_std_mult': 0.6467645157246977, 'rsi_os': 46, 'rsi_ob': 90, 'vol_spike': 0.19977655897531635, 'adx_thresh': 25.574135684801572, 'atr_min_pct': 0.022303348273206243, 'atr_max_pct': 0.10789446662636686, 'tp_mult': 1.4480213911804674, 'tsl_mult': 0.33406984561301867, 'strategy': 'breakout', 'time_stop': 53, 'use_sma': False, 'use_atr': False, 'use_adx': True, 'use_ema': False, 'use_spike': False, 'rsi_required': False, 'edge_k': 1.6586198920064923, 'edge_cap': 0.9560212392745506, 'bull_strategy': 'breakout', 'bull_bb_std_mult': 1.5461256018483103, 'bull_rsi_os': 48, 'bull_rsi_ob': 53, 'bull_adx_thresh': 8.538655889709384, 'bull_atr_min_pct': 0.019734940008865297, 'bull_atr_max_pct': 0.10204164045123086, 'bull_tp_mult': 2.254144657075082, 'bull_tsl_mult': 0.4256523635003575, 'bull_time_stop': 108, 'bull_use_sma': True, 'bull_use_ema': True, 'bull_use_atr': True, 'bull_use_adx': True, 'bull_use_spike': True, 'bull_rsi_required': False, 'bear_strategy': 'mean_reversion', 'bear_bb_std_mult': 1.7493591087103229, 'bear_rsi_os': 26, 'bear_rsi_ob': 74, 'bear_adx_thresh': 10.990516722762951, 'bear_atr_min_pct': 0.002974578114391002, 'bear_atr_max_pct': 0.10697853573775025, 'bear_tp_mult': 2.669381991773238, 'bear_tsl_mult': 0.7047590394671143, 'bear_time_stop': 92, 'bear_use_sma': True, 'bear_use_ema': False, 'bear_use_atr': True, 'bear_use_adx': True, 'bear_use_spike': True, 'bear_rsi_required': True, 'sideways_strategy': 'mean_reversion', 'sideways_bb_std_mult': 3.5377146912668884, 'sideways_rsi_os': 21, 'sideways_rsi_ob': 48, 'sideways_adx_thresh': 12.226683806314355, 'sideways_atr_min_pct': 0.017510818606343476, 'sideways_atr_max_pct': 0.07092381178396122, 'sideways_tp_mult': 1.0143037515243618, 'sideways_tsl_mult': 0.326644313716947, 'sideways_time_stop': 13, 'sideways_use_sma': True, 'sideways_use_ema': False, 'sideways_use_atr': True, 'sideways_use_adx': True, 'sideways_use_spike': True, 'sideways_rsi_required': True}.
[I 2025-08-30 16:32:03,809] Trial 788 finished with values: [-1000000000.0, 1000000000.0] and parameters: {'p_sma': 5, 'p_std': 26, 'p_atr': 12, 'p_adx': 21, 'rsi_period': 70, 'ema1': 25, 'ema2': 19, 'slip_atr_k': 0.005201758920506264, 'slip_spread_k': 0.10646566107641847, 'spread_hl_frac': 0.006425262891275387, 'bb_std_mult': 1.1261008732243742, 'rsi_os': 53, 'rsi_ob': 93, 'vol_spike': 0.2012101359447445, 'adx_thresh': 32.34906011766091, 'atr_min_pct': 0.010961978227223706, 'atr_max_pct': 0.11806401152396796, 'tp_mult': 2.649076631865658, 'tsl_mult': 0.3185128982709469, 'strategy': 'breakout', 'time_stop': 98, 'use_sma': False, 'use_atr': False, 'use_adx': True, 'use_ema': False, 'use_spike': False, 'rsi_required': False, 'edge_k': 0.6068477968787773, 'edge_cap': 0.9607310877321732, 'bull_strategy': 'breakout', 'bull_bb_std_mult': 2.1380176001359086, 'bull_rsi_os': 47, 'bull_rsi_ob': 90, 'bull_adx_thresh': 8.715251893672233, 'bull_atr_min_pct': 0.019721464520376708, 'bull_atr_max_pct': 0.11464390821874167, 'bull_tp_mult': 2.6485816597277205, 'bull_tsl_mult': 0.8910330983785275, 'bull_time_stop': 34, 'bull_use_sma': True, 'bull_use_ema': True, 'bull_use_atr': True, 'bull_use_adx': True, 'bull_use_spike': False, 'bull_rsi_required': False, 'bear_strategy': 'mean_reversion', 'bear_bb_std_mult': 1.5491182718120844, 'bear_rsi_os': 46, 'bear_rsi_ob': 76, 'bear_adx_thresh': 21.82290094609817, 'bear_atr_min_pct': 0.002882869641488375, 'bear_atr_max_pct': 0.07402023727896441, 'bear_tp_mult': 2.149040322657329, 'bear_tsl_mult': 0.7123571615029969, 'bear_time_stop': 158, 'bear_use_sma': True, 'bear_use_ema': False, 'bear_use_atr': True, 'bear_use_adx': True, 'bear_use_spike': True, 'bear_rsi_required': True, 'sideways_strategy': 'mean_reversion', 'sideways_bb_std_mult': 3.184185697226579, 'sideways_rsi_os': 21, 'sideways_rsi_ob': 79, 'sideways_adx_thresh': 12.103198864855054, 'sideways_atr_min_pct': 0.017346177802397708, 'sideways_atr_max_pct': 0.1405997686168919, 'sideways_tp_mult': 1.2803300802027802, 'sideways_tsl_mult': 0.046589766380671305, 'sideways_time_stop': 37, 'sideways_use_sma': True, 'sideways_use_ema': False, 'sideways_use_atr': True, 'sideways_use_adx': True, 'sideways_use_spike': True, 'sideways_rsi_required': True}.
[I 2025-08-30 16:32:04,501] Trial 789 finished with values: [-1000000000.0, 1000000000.0] and parameters: {'p_sma': 5, 'p_std': 19, 'p_atr': 12, 'p_adx': 21, 'rsi_period': 9, 'ema1': 29, 'ema2': 34, 'slip_atr_k': 0.004972726366353734, 'slip_spread_k': 0.7069381610433589, 'spread_hl_frac': 0.03974527278443095, 'bb_std_mult': 0.859504463121834, 'rsi_os': 33, 'rsi_ob': 90, 'vol_spike': 0.20227358112027882, 'adx_thresh': 25.671206658125584, 'atr_min_pct': 0.022501706510683745, 'atr_max_pct': 0.106853423466571, 'tp_mult': 1.973347670072651, 'tsl_mult': 0.3194846920070966, 'strategy': 'breakout', 'time_stop': 230, 'use_sma': False, 'use_atr': False, 'use_adx': True, 'use_ema': False, 'use_spike': False, 'rsi_required': False, 'edge_k': 1.8540991568486123, 'edge_cap': 0.9535074942482877, 'bull_strategy': 'breakout', 'bull_bb_std_mult': 1.6539574469757627, 'bull_rsi_os': 47, 'bull_rsi_ob': 90, 'bull_adx_thresh': 9.046799017863574, 'bull_atr_min_pct': 0.019638324557827807, 'bull_atr_max_pct': 0.046592972632315655, 'bull_tp_mult': 2.2609638368880027, 'bull_tsl_mult': 0.9239285404393478, 'bull_time_stop': 51, 'bull_use_sma': True, 'bull_use_ema': True, 'bull_use_atr': True, 'bull_use_adx': True, 'bull_use_spike': True, 'bull_rsi_required': False, 'bear_strategy': 'mean_reversion', 'bear_bb_std_mult': 0.7962782547696035, 'bear_rsi_os': 27, 'bear_rsi_ob': 86, 'bear_adx_thresh': 8.264417973010834, 'bear_atr_min_pct': 0.002934970382401441, 'bear_atr_max_pct': 0.11106975358050113, 'bear_tp_mult': 2.655058617993766, 'bear_tsl_mult': 0.8789068835714958, 'bear_time_stop': 108, 'bear_use_sma': True, 'bear_use_ema': False, 'bear_use_atr': True, 'bear_use_adx': True, 'bear_use_spike': True, 'bear_rsi_required': True, 'sideways_strategy': 'mean_reversion', 'sideways_bb_std_mult': 1.7293543126593725, 'sideways_rsi_os': 21, 'sideways_rsi_ob': 48, 'sideways_adx_thresh': 12.991586881977899, 'sideways_atr_min_pct': 0.020494153539965657, 'sideways_atr_max_pct': 0.07918983663606338, 'sideways_tp_mult': 1.2793058076678117, 'sideways_tsl_mult': 0.3347510646387962, 'sideways_time_stop': 129, 'sideways_use_sma': True, 'sideways_use_ema': False, 'sideways_use_atr': True, 'sideways_use_adx': True, 'sideways_use_spike': True, 'sideways_rsi_required': True}.
