[I 2025-09-01 03:55:33,461] Trial 548 finished with values: [-1000000000.0, 1000000000.0] and parameters: {'p_sma': 20, 'p_std': 51, 'p_atr': 24, 'p_adx': 11, 'rsi_period': 43, 'ema1': 13, 'ema2': 52, 'slip_atr_k': 0.009264550037318037, 'slip_spread_k': 0.00028091857954147537, 'spread_hl_frac': 0.04294928022181336, 'bb_std_mult': 2.205972063568059, 'rsi_os': 44, 'rsi_ob': 78, 'vol_spike': 0.1918704205453134, 'adx_thresh': 15.34762033686152, 'atr_min_pct': 0.010628644357641458, 'atr_max_pct': 0.08113134602694719, 'tp_mult': 2.3692087001927953, 'tsl_mult': 0.33450095118281126, 'strategy': 'mean_reversion', 'time_stop': 97, 'use_sma': True, 'use_atr': False, 'use_adx': False, 'use_ema': True, 'use_spike': False, 'rsi_required': True, 'edge_k': 0.18561363150199883, 'edge_cap': 0.2786779050683601, 'bull_strategy': 'mean_reversion', 'bull_bb_std_mult': 0.8985945356001697, 'bull_rsi_os': 6, 'bull_rsi_ob': 76, 'bull_adx_thresh': 7.3141679249169105, 'bull_atr_min_pct': 0.010180676995393347, 'bull_atr_max_pct': 0.10542241091697581, 'bull_tp_mult': 1.4126213739755769, 'bull_tsl_mult': 0.30570462966004847, 'bull_time_stop': 295, 'bull_use_sma': False, 'bull_use_ema': False, 'bull_use_atr': True, 'bull_use_adx': True, 'bull_use_spike': False, 'bull_rsi_required': True, 'bear_strategy': 'mean_reversion', 'bear_bb_std_mult': 3.215050970542325, 'bear_rsi_os': 47, 'bear_rsi_ob': 71, 'bear_adx_thresh': 33.70475066490788, 'bear_atr_min_pct': 0.008115902254346913, 'bear_atr_max_pct': 0.05796943973258679, 'bear_tp_mult': 2.934385098098721, 'bear_tsl_mult': 0.04045005335591457, 'bear_time_stop': 282, 'bear_use_sma': True, 'bear_use_ema': True, 'bear_use_atr': True, 'bear_use_adx': True, 'bear_use_spike': True, 'bear_rsi_required': False, 'sideways_strategy': 'breakout', 'sideways_bb_std_mult': 3.5347528504720485, 'sideways_rsi_os': 6, 'sideways_rsi_ob': 60, 'sideways_adx_thresh': 29.736436689977857, 'sideways_atr_min_pct': 0.02121297357168877, 'sideways_atr_max_pct': 0.11053683768062615, 'sideways_tp_mult': 2.0384676783813944, 'sideways_tsl_mult': 0.6671345475074691, 'sideways_time_stop': 165, 'sideways_use_sma': False, 'sideways_use_ema': False, 'sideways_use_atr': False, 'sideways_use_adx': False, 'sideways_use_spike': False, 'sideways_rsi_required': True}.
[I 2025-09-01 03:55:33,762] Trial 547 finished with values: [-1000000000.0, 1000000000.0] and parameters: {'p_sma': 19, 'p_std': 50, 'p_atr': 24, 'p_adx': 11, 'rsi_period': 39, 'ema1': 12, 'ema2': 52, 'slip_atr_k': 0.01076417178801905, 'slip_spread_k': 0.044827678432456636, 'spread_hl_frac': 0.042780774839509914, 'bb_std_mult': 2.5310964048085745, 'rsi_os': 44, 'rsi_ob': 81, 'vol_spike': 0.19108583718050295, 'adx_thresh': 22.786532653690806, 'atr_min_pct': 0.011587405427355278, 'atr_max_pct': 0.11399901538730456, 'tp_mult': 2.5145503046618174, 'tsl_mult': 0.3005439256735537, 'strategy': 'mean_reversion', 'time_stop': 98, 'use_sma': True, 'use_atr': False, 'use_adx': False, 'use_ema': True, 'use_spike': False, 'rsi_required': True, 'edge_k': 0.1851222923794611, 'edge_cap': 0.23410949423164099, 'bull_strategy': 'mean_reversion', 'bull_bb_std_mult': 0.8048217034462188, 'bull_rsi_os': 6, 'bull_rsi_ob': 76, 'bull_adx_thresh': 7.354444954642075, 'bull_atr_min_pct': 0.009674546293487497, 'bull_atr_max_pct': 0.11010347207456667, 'bull_tp_mult': 1.5400556490095083, 'bull_tsl_mult': 0.30625522303747277, 'bull_time_stop': 295, 'bull_use_sma': False, 'bull_use_ema': False, 'bull_use_atr': True, 'bull_use_adx': True, 'bull_use_spike': False, 'bull_rsi_required': True, 'bear_strategy': 'mean_reversion', 'bear_bb_std_mult': 3.1901860507966004, 'bear_rsi_os': 45, 'bear_rsi_ob': 71, 'bear_adx_thresh': 33.78414258855566, 'bear_atr_min_pct': 0.0081505444810979, 'bear_atr_max_pct': 0.04608077217206341, 'bear_tp_mult': 2.9394426110127796, 'bear_tsl_mult': 0.03705417659047361, 'bear_time_stop': 284, 'bear_use_sma': True, 'bear_use_ema': True, 'bear_use_atr': True, 'bear_use_adx': True, 'bear_use_spike': True, 'bear_rsi_required': False, 'sideways_strategy': 'breakout', 'sideways_bb_std_mult': 3.473111573914028, 'sideways_rsi_os': 8, 'sideways_rsi_ob': 60, 'sideways_adx_thresh': 29.91650520648636, 'sideways_atr_min_pct': 0.02114568910972782, 'sideways_atr_max_pct': 0.11258211381989412, 'sideways_tp_mult': 2.000578403107647, 'sideways_tsl_mult': 0.6770671588285339, 'sideways_time_stop': 157, 'sideways_use_sma': False, 'sideways_use_ema': False, 'sideways_use_atr': False, 'sideways_use_adx': False, 'sideways_use_spike': False, 'sideways_rsi_required': True}.
[I 2025-09-01 03:55:34,311] Trial 551 finished with values: [-1000000000.0, 1000000000.0] and parameters: {'p_sma': 15, 'p_std': 51, 'p_atr': 25, 'p_adx': 11, 'rsi_period': 10, 'ema1': 13, 'ema2': 52, 'slip_atr_k': 2.6070005915730145e-05, 'slip_spread_k': 0.021215516262951664, 'spread_hl_frac': 0.04559851285774469, 'bb_std_mult': 2.53291241862734, 'rsi_os': 44, 'rsi_ob': 54, 'vol_spike': 0.18459979232445736, 'adx_thresh': 15.264446326105672, 'atr_min_pct': 0.009366517495252805, 'atr_max_pct': 0.1195600619241512, 'tp_mult': 2.3661603187697544, 'tsl_mult': 0.5166813914709839, 'strategy': 'mean_reversion', 'time_stop': 72, 'use_sma': True, 'use_atr': False, 'use_adx': False, 'use_ema': True, 'use_spike': False, 'rsi_required': True, 'edge_k': 0.2741112475137452, 'edge_cap': 0.2685051416723126, 'bull_strategy': 'mean_reversion', 'bull_bb_std_mult': 0.6750224070625596, 'bull_rsi_os': 7, 'bull_rsi_ob': 76, 'bull_adx_thresh': 8.735847392968987, 'bull_atr_min_pct': 0.0007141595794351275, 'bull_atr_max_pct': 0.10601416788630531, 'bull_tp_mult': 1.4881082497948914, 'bull_tsl_mult': 0.7528500040032069, 'bull_time_stop': 163, 'bull_use_sma': False, 'bull_use_ema': False, 'bull_use_atr': True, 'bull_use_adx': True, 'bull_use_spike': False, 'bull_rsi_required': True, 'bear_strategy': 'mean_reversion', 'bear_bb_std_mult': 3.1886608411912287, 'bear_rsi_os': 46, 'bear_rsi_ob': 71, 'bear_adx_thresh': 31.87190327397871, 'bear_atr_min_pct': 0.00797124908166417, 'bear_atr_max_pct': 0.05593509667033931, 'bear_tp_mult': 2.951697170068718, 'bear_tsl_mult': 0.07583087100764298, 'bear_time_stop': 288, 'bear_use_sma': True, 'bear_use_ema': True, 'bear_use_atr': True, 'bear_use_adx': True, 'bear_use_spike': False, 'bear_rsi_required': False, 'sideways_strategy': 'breakout', 'sideways_bb_std_mult': 3.4495604482156796, 'sideways_rsi_os': 6, 'sideways_rsi_ob': 60, 'sideways_adx_thresh': 30.084606979936307, 'sideways_atr_min_pct': 0.020881397354845732, 'sideways_atr_max_pct': 0.10797070076511202, 'sideways_tp_mult': 1.9886980387045503, 'sideways_tsl_mult': 0.7208828437578889, 'sideways_time_stop': 145, 'sideways_use_sma': False, 'sideways_use_ema': False, 'sideways_use_atr': False, 'sideways_use_adx': False, 'sideways_use_spike': False, 'sideways_rsi_required': True}.
[I 2025-09-01 03:56:13,687] Trial 553 finished with values: [-1000000000.0, 1000000000.0] and parameters: {'p_sma': 17, 'p_std': 49, 'p_atr': 25, 'p_adx': 11, 'rsi_period': 10, 'ema1': 11, 'ema2': 53, 'slip_atr_k': 0.009365777609365692, 'slip_spread_k': 0.024858508309261652, 'spread_hl_frac': 0.045706181971953475, 'bb_std_mult': 2.5156599044886465, 'rsi_os': 42, 'rsi_ob': 81, 'vol_spike': 0.18499667346613646, 'adx_thresh': 14.27469308227326, 'atr_min_pct': 0.009463627092239038, 'atr_max_pct': 0.10070872051833052, 'tp_mult': 2.581998743333112, 'tsl_mult': 0.3325326356047678, 'strategy': 'mean_reversion', 'time_stop': 78, 'use_sma': True, 'use_atr': False, 'use_adx': False, 'use_ema': True, 'use_spike': False, 'rsi_required': True, 'edge_k': 0.25563204916618487, 'edge_cap': 0.22675383627534595, 'bull_strategy': 'mean_reversion', 'bull_bb_std_mult': 0.655385044255284, 'bull_rsi_os': 9, 'bull_rsi_ob': 80, 'bull_adx_thresh': 8.762412783240327, 'bull_atr_min_pct': 0.006285763932257833, 'bull_atr_max_pct': 0.11046447408636842, 'bull_tp_mult': 1.5221124209260133, 'bull_tsl_mult': 0.26473042973020106, 'bull_time_stop': 94, 'bull_use_sma': False, 'bull_use_ema': False, 'bull_use_atr': True, 'bull_use_adx': True, 'bull_use_spike': False, 'bull_rsi_required': True, 'bear_strategy': 'mean_reversion', 'bear_bb_std_mult': 3.2754969352544125, 'bear_rsi_os': 42, 'bear_rsi_ob': 70, 'bear_adx_thresh': 31.78612041697922, 'bear_atr_min_pct': 0.009337131067211646, 'bear_atr_max_pct': 0.045588680237614324, 'bear_tp_mult': 2.8261215418725603, 'bear_tsl_mult': 0.07364241464364446, 'bear_time_stop': 278, 'bear_use_sma': True, 'bear_use_ema': True, 'bear_use_atr': True, 'bear_use_adx': True, 'bear_use_spike': True, 'bear_rsi_required': False, 'sideways_strategy': 'mean_reversion', 'sideways_bb_std_mult': 3.4363964889115666, 'sideways_rsi_os': 10, 'sideways_rsi_ob': 57, 'sideways_adx_thresh': 30.457458182197794, 'sideways_atr_min_pct': 0.024408177038993353, 'sideways_atr_max_pct': 0.10535915812151626, 'sideways_tp_mult': 1.9676124239947583, 'sideways_tsl_mult': 0.7145314543200971, 'sideways_time_stop': 155, 'sideways_use_sma': False, 'sideways_use_ema': False, 'sideways_use_atr': False, 'sideways_use_adx': False, 'sideways_use_spike': False, 'sideways_rsi_required': True}.
[I 2025-09-01 03:56:13,949] Trial 552 finished with values: [-1000000000.0, 1000000000.0] and parameters: {'p_sma': 15, 'p_std': 49, 'p_atr': 23, 'p_adx': 11, 'rsi_period': 10, 'ema1': 11, 'ema2': 53, 'slip_atr_k': 0.1201143501801932, 'slip_spread_k': 0.018659190997473984, 'spread_hl_frac': 0.04169672477323827, 'bb_std_mult': 2.5253999604193127, 'rsi_os': 43, 'rsi_ob': 79, 'vol_spike': 0.18284820423323442, 'adx_thresh': 13.753906100363144, 'atr_min_pct': 0.009330315857823672, 'atr_max_pct': 0.11354231238908438, 'tp_mult': 2.579509432423875, 'tsl_mult': 0.8840039773533641, 'strategy': 'mean_reversion', 'time_stop': 77, 'use_sma': True, 'use_atr': False, 'use_adx': False, 'use_ema': True, 'use_spike': False, 'rsi_required': True, 'edge_k': 0.1844198387493371, 'edge_cap': 0.2757447256058651, 'bull_strategy': 'mean_reversion', 'bull_bb_std_mult': 0.6941491878987498, 'bull_rsi_os': 5, 'bull_rsi_ob': 77, 'bull_adx_thresh': 8.640875362163156, 'bull_atr_min_pct': 0.006564869959963004, 'bull_atr_max_pct': 0.09494797275371916, 'bull_tp_mult': 1.403331582693425, 'bull_tsl_mult': 0.4102440232468302, 'bull_time_stop': 203, 'bull_use_sma': False, 'bull_use_ema': False, 'bull_use_atr': True, 'bull_use_adx': True, 'bull_use_spike': False, 'bull_rsi_required': True, 'bear_strategy': 'mean_reversion', 'bear_bb_std_mult': 3.2540210050899034, 'bear_rsi_os': 46, 'bear_rsi_ob': 70, 'bear_adx_thresh': 31.79595989220393, 'bear_atr_min_pct': 0.009099428598268984, 'bear_atr_max_pct': 0.05600979627373928, 'bear_tp_mult': 2.8415940685168244, 'bear_tsl_mult': 0.0361297022242735, 'bear_time_stop': 279, 'bear_use_sma': True, 'bear_use_ema': True, 'bear_use_atr': True, 'bear_use_adx': True, 'bear_use_spike': True, 'bear_rsi_required': False, 'sideways_strategy': 'mean_reversion', 'sideways_bb_std_mult': 3.4538547239600934, 'sideways_rsi_os': 10, 'sideways_rsi_ob': 57, 'sideways_adx_thresh': 6.2721182775366096, 'sideways_atr_min_pct': 0.02063832811579472, 'sideways_atr_max_pct': 0.10484239358280713, 'sideways_tp_mult': 1.9712843648360816, 'sideways_tsl_mult': 0.7392496946782809, 'sideways_time_stop': 163, 'sideways_use_sma': False, 'sideways_use_ema': False, 'sideways_use_atr': False, 'sideways_use_adx': False, 'sideways_use_spike': False, 'sideways_rsi_required': True}.
[I 2025-09-01 03:56:14,171] Trial 555 finished with values: [-1000000000.0, 1000000000.0] and parameters: {'p_sma': 17, 'p_std': 54, 'p_atr': 25, 'p_adx': 12, 'rsi_period': 8, 'ema1': 11, 'ema2': 53, 'slip_atr_k': 0.11771262121589876, 'slip_spread_k': 0.021000402378940384, 'spread_hl_frac': 0.041238858490970295, 'bb_std_mult': 2.3359667341440984, 'rsi_os': 42, 'rsi_ob': 79, 'vol_spike': 0.1720997174852528, 'adx_thresh': 13.812209731910414, 'atr_min_pct': 0.010072587131747244, 'atr_max_pct': 0.100189097912532, 'tp_mult': 2.5943528140269074, 'tsl_mult': 0.3230594259722529, 'strategy': 'mean_reversion', 'time_stop': 79, 'use_sma': True, 'use_atr': False, 'use_adx': False, 'use_ema': True, 'use_spike': False, 'rsi_required': True, 'edge_k': 0.24557128919425197, 'edge_cap': 0.21636932004836137, 'bull_strategy': 'mean_reversion', 'bull_bb_std_mult': 0.6408857479276321, 'bull_rsi_os': 5, 'bull_rsi_ob': 74, 'bull_adx_thresh': 10.08580010692032, 'bull_atr_min_pct': 0.014816674462042625, 'bull_atr_max_pct': 0.14986304535762257, 'bull_tp_mult': 1.3155573728791898, 'bull_tsl_mult': 0.2738309827798926, 'bull_time_stop': 5, 'bull_use_sma': False, 'bull_use_ema': False, 'bull_use_atr': True, 'bull_use_adx': True, 'bull_use_spike': False, 'bull_rsi_required': True, 'bear_strategy': 'mean_reversion', 'bear_bb_std_mult': 3.435069783227542, 'bear_rsi_os': 46, 'bear_rsi_ob': 69, 'bear_adx_thresh': 34.497907219988186, 'bear_atr_min_pct': 0.009080038974596822, 'bear_atr_max_pct': 0.05438928182710228, 'bear_tp_mult': 2.844737207924853, 'bear_tsl_mult': 0.07471740153270223, 'bear_time_stop': 278, 'bear_use_sma': True, 'bear_use_ema': True, 'bear_use_atr': True, 'bear_use_adx': True, 'bear_use_spike': True, 'bear_rsi_required': False, 'sideways_strategy': 'mean_reversion', 'sideways_bb_std_mult': 3.532099966686685, 'sideways_rsi_os': 10, 'sideways_rsi_ob': 57, 'sideways_adx_thresh': 31.04623773506682, 'sideways_atr_min_pct': 0.024328603397383464, 'sideways_atr_max_pct': 0.10469923734456288, 'sideways_tp_mult': 1.967036620847312, 'sideways_tsl_mult': 0.7389255091887972, 'sideways_time_stop': 156, 'sideways_use_sma': False, 'sideways_use_ema': False, 'sideways_use_atr': False, 'sideways_use_adx': True, 'sideways_use_spike': False, 'sideways_rsi_required': True}.
[I 2025-09-01 03:56:14,331] Trial 554 finished with values: [-1000000000.0, 1000000000.0] and parameters: {'p_sma': 17, 'p_std': 54, 'p_atr': 25, 'p_adx': 11, 'rsi_period': 10, 'ema1': 11, 'ema2': 53, 'slip_atr_k': 0.004381331412895637, 'slip_spread_k': 0.014880965801416096, 'spread_hl_frac': 0.041738413172715996, 'bb_std_mult': 2.33741947672278, 'rsi_os': 42, 'rsi_ob': 79, 'vol_spike': 0.186120536391636, 'adx_thresh': 29.13141508152831, 'atr_min_pct': 0.0093381238444776, 'atr_max_pct': 0.10123536104986944, 'tp_mult': 2.600082022531364, 'tsl_mult': 0.8910971812882595, 'strategy': 'mean_reversion', 'time_stop': 79, 'use_sma': True, 'use_atr': False, 'use_adx': False, 'use_ema': True, 'use_spike': False, 'rsi_required': True, 'edge_k': 0.2761463665463242, 'edge_cap': 0.25827041321053046, 'bull_strategy': 'mean_reversion', 'bull_bb_std_mult': 0.6562219091840256, 'bull_rsi_os': 7, 'bull_rsi_ob': 80, 'bull_adx_thresh': 8.793893492463255, 'bull_atr_min_pct': 0.015267823439672808, 'bull_atr_max_pct': 0.11077502104503113, 'bull_tp_mult': 1.4875763499998027, 'bull_tsl_mult': 0.9808844191735304, 'bull_time_stop': 288, 'bull_use_sma': False, 'bull_use_ema': False, 'bull_use_atr': True, 'bull_use_adx': True, 'bull_use_spike': False, 'bull_rsi_required': True, 'bear_strategy': 'mean_reversion', 'bear_bb_std_mult': 3.4265692489455, 'bear_rsi_os': 42, 'bear_rsi_ob': 70, 'bear_adx_thresh': 31.62409681170556, 'bear_atr_min_pct': 0.009263102379561731, 'bear_atr_max_pct': 0.055109066265017555, 'bear_tp_mult': 2.8345203525415315, 'bear_tsl_mult': 0.07441567083643366, 'bear_time_stop': 277, 'bear_use_sma': True, 'bear_use_ema': True, 'bear_use_atr': True, 'bear_use_adx': True, 'bear_use_spike': False, 'bear_rsi_required': False, 'sideways_strategy': 'mean_reversion', 'sideways_bb_std_mult': 3.422519351321531, 'sideways_rsi_os': 10, 'sideways_rsi_ob': 57, 'sideways_adx_thresh': 31.30803388924863, 'sideways_atr_min_pct': 0.023110250225154137, 'sideways_atr_max_pct': 0.10531267932754924, 'sideways_tp_mult': 1.9702027353265943, 'sideways_tsl_mult': 0.7323251137189676, 'sideways_time_stop': 145, 'sideways_use_sma': False, 'sideways_use_ema': False, 'sideways_use_atr': False, 'sideways_use_adx': False, 'sideways_use_spike': False, 'sideways_rsi_required': True}.
[I 2025-09-01 03:56:56,999] Trial 556 finished with values: [-1000000000.0, 1000000000.0] and parameters: {'p_sma': 17, 'p_std': 54, 'p_atr': 25, 'p_adx': 13, 'rsi_period': 8, 'ema1': 13, 'ema2': 50, 'slip_atr_k': 0.1587245394147881, 'slip_spread_k': 0.06655231421333835, 'spread_hl_frac': 0.04430774041391494, 'bb_std_mult': 2.311318208016931, 'rsi_os': 45, 'rsi_ob': 62, 'vol_spike': 0.19932471439277574, 'adx_thresh': 29.028144139006702, 'atr_min_pct': 0.010178433267339743, 'atr_max_pct': 0.06938827032498468, 'tp_mult': 2.4544531064079655, 'tsl_mult': 0.333930146290643, 'strategy': 'mean_reversion', 'time_stop': 95, 'use_sma': True, 'use_atr': True, 'use_adx': False, 'use_ema': True, 'use_spike': False, 'rsi_required': True, 'edge_k': 0.23842133335430638, 'edge_cap': 0.2529202813426211, 'bull_strategy': 'mean_reversion', 'bull_bb_std_mult': 0.8464331676172607, 'bull_rsi_os': 8, 'bull_rsi_ob': 80, 'bull_adx_thresh': 9.916321514769894, 'bull_atr_min_pct': 0.01191717322322177, 'bull_atr_max_pct': 0.10674583163254418, 'bull_tp_mult': 1.4674267674804278, 'bull_tsl_mult': 0.8439797776644209, 'bull_time_stop': 300, 'bull_use_sma': False, 'bull_use_ema': False, 'bull_use_atr': True, 'bull_use_adx': True, 'bull_use_spike': False, 'bull_rsi_required': True, 'bear_strategy': 'mean_reversion', 'bear_bb_std_mult': 3.362021531299019, 'bear_rsi_os': 45, 'bear_rsi_ob': 69, 'bear_adx_thresh': 34.522696283949784, 'bear_atr_min_pct': 0.00762089172713531, 'bear_atr_max_pct': 0.049998811299398024, 'bear_tp_mult': 2.9991473010412686, 'bear_tsl_mult': 0.055208304289929754, 'bear_time_stop': 266, 'bear_use_sma': True, 'bear_use_ema': True, 'bear_use_atr': True, 'bear_use_adx': True, 'bear_use_spike': False, 'bear_rsi_required': False, 'sideways_strategy': 'breakout', 'sideways_bb_std_mult': 3.302946421884279, 'sideways_rsi_os': 9, 'sideways_rsi_ob': 58, 'sideways_adx_thresh': 31.194045400484086, 'sideways_atr_min_pct': 0.022778687786829822, 'sideways_atr_max_pct': 0.09915138282773112, 'sideways_tp_mult': 1.8973495654647332, 'sideways_tsl_mult': 0.7396703135833429, 'sideways_time_stop': 170, 'sideways_use_sma': False, 'sideways_use_ema': False, 'sideways_use_atr': False, 'sideways_use_adx': True, 'sideways_use_spike': False, 'sideways_rsi_required': False}.
[I 2025-09-01 03:56:57,255] Trial 557 finished with values: [-1000000000.0, 1000000000.0] and parameters: {'p_sma': 17, 'p_std': 52, 'p_atr': 25, 'p_adx': 13, 'rsi_period': 9, 'ema1': 13, 'ema2': 50, 'slip_atr_k': 0.004860716949742546, 'slip_spread_k': 0.06700627356633332, 'spread_hl_frac': 0.043632298764200224, 'bb_std_mult': 2.3001258373161537, 'rsi_os': 45, 'rsi_ob': 56, 'vol_spike': 0.17227063705323292, 'adx_thresh': 13.648037408264955, 'atr_min_pct': 0.009957008586901342, 'atr_max_pct': 0.060997832899376894, 'tp_mult': 2.4532708819752314, 'tsl_mult': 0.311113742306484, 'strategy': 'mean_reversion', 'time_stop': 104, 'use_sma': True, 'use_atr': True, 'use_adx': False, 'use_ema': True, 'use_spike': False, 'rsi_required': True, 'edge_k': 0.2282404244131867, 'edge_cap': 0.24739369105026698, 'bull_strategy': 'mean_reversion', 'bull_bb_std_mult': 0.8484580917540592, 'bull_rsi_os': 8, 'bull_rsi_ob': 80, 'bull_adx_thresh': 9.922270523411791, 'bull_atr_min_pct': 0.015245587563677538, 'bull_atr_max_pct': 0.10083796544801292, 'bull_tp_mult': 2.4162103746291033, 'bull_tsl_mult': 0.8451895656402431, 'bull_time_stop': 288, 'bull_use_sma': False, 'bull_use_ema': False, 'bull_use_atr': True, 'bull_use_adx': True, 'bull_use_spike': False, 'bull_rsi_required': True, 'bear_strategy': 'mean_reversion', 'bear_bb_std_mult': 3.3537193894447372, 'bear_rsi_os': 45, 'bear_rsi_ob': 69, 'bear_adx_thresh': 34.23233540432996, 'bear_atr_min_pct': 0.007232460685268616, 'bear_atr_max_pct': 0.05100643905708381, 'bear_tp_mult': 2.8954801802916066, 'bear_tsl_mult': 0.05927972232499279, 'bear_time_stop': 265, 'bear_use_sma': True, 'bear_use_ema': True, 'bear_use_atr': True, 'bear_use_adx': True, 'bear_use_spike': False, 'bear_rsi_required': False, 'sideways_strategy': 'breakout', 'sideways_bb_std_mult': 3.277859191653425, 'sideways_rsi_os': 9, 'sideways_rsi_ob': 58, 'sideways_adx_thresh': 31.154405030968984, 'sideways_atr_min_pct': 0.0231017084658156, 'sideways_atr_max_pct': 0.09981728687314147, 'sideways_tp_mult': 1.8688963229737658, 'sideways_tsl_mult': 0.7266915400396292, 'sideways_time_stop': 172, 'sideways_use_sma': False, 'sideways_use_ema': False, 'sideways_use_atr': False, 'sideways_use_adx': True, 'sideways_use_spike': False, 'sideways_rsi_required': False}.
