[I 2025-09-01 02:26:47,198] Trial 36 finished with values: [-1000000000.0, 1000000000.0] and parameters: {'p_sma': 26, 'p_std': 54, 'p_atr': 19, 'p_adx': 26, 'rsi_period': 18, 'ema1': 27, 'ema2': 35, 'slip_atr_k': 0.20979539100844322, 'slip_spread_k': 0.8756193226900986, 'spread_hl_frac': 0.0444773666297018, 'bb_std_mult': 2.850193907932609, 'rsi_os': 19, 'rsi_ob': 45, 'vol_spike': 0.1803046130246324, 'adx_thresh': 21.297921634230953, 'atr_min_pct': 0.009707785582681277, 'atr_max_pct': 0.14045656261831374, 'tp_mult': 2.738493447902341, 'tsl_mult': 0.740928180370809, 'strategy': 'mean_reversion', 'time_stop': 227, 'use_sma': True, 'use_atr': False, 'use_adx': True, 'use_ema': False, 'use_spike': False, 'rsi_required': True, 'edge_k': 1.2989086697987235, 'edge_cap': 0.5190235669200473, 'bull_strategy': 'breakout', 'bull_bb_std_mult': 1.051436158335, 'bull_rsi_os': 25, 'bull_rsi_ob': 95, 'bull_adx_thresh': 9.02132874003147, 'bull_atr_min_pct': 0.029430905948992822, 'bull_atr_max_pct': 0.10520643133935764, 'bull_tp_mult': 2.4246536845574824, 'bull_tsl_mult': 0.7461855432941198, 'bull_time_stop': 229, 'bull_use_sma': False, 'bull_use_ema': False, 'bull_use_atr': True, 'bull_use_adx': False, 'bull_use_spike': True, 'bull_rsi_required': False, 'bear_strategy': 'mean_reversion', 'bear_bb_std_mult': 0.6032785410828865, 'bear_rsi_os': 50, 'bear_rsi_ob': 80, 'bear_adx_thresh': 21.65761466074553, 'bear_atr_min_pct': 0.015460448456705236, 'bear_atr_max_pct': 0.08793484715981895, 'bear_tp_mult': 1.1855055141705355, 'bear_tsl_mult': 0.4065221322012771, 'bear_time_stop': 114, 'bear_use_sma': True, 'bear_use_ema': True, 'bear_use_atr': True, 'bear_use_adx': False, 'bear_use_spike': False, 'bear_rsi_required': True, 'sideways_strategy': 'breakout', 'sideways_bb_std_mult': 1.2552777747516854, 'sideways_rsi_os': 34, 'sideways_rsi_ob': 45, 'sideways_adx_thresh': 14.945504790311302, 'sideways_atr_min_pct': 0.028130304437335565, 'sideways_atr_max_pct': 0.07309017472181625, 'sideways_tp_mult': 1.8553763903487361, 'sideways_tsl_mult': 0.5043863908079558, 'sideways_time_stop': 39, 'sideways_use_sma': True, 'sideways_use_ema': False, 'sideways_use_atr': False, 'sideways_use_adx': True, 'sideways_use_spike': False, 'sideways_rsi_required': True}.
[I 2025-09-01 02:26:47,247] Trial 37 finished with values: [-1000000000.0, 1000000000.0] and parameters: {'p_sma': 37, 'p_std': 32, 'p_atr': 17, 'p_adx': 26, 'rsi_period': 66, 'ema1': 14, 'ema2': 50, 'slip_atr_k': 0.21040816109538604, 'slip_spread_k': 0.03021476208073426, 'spread_hl_frac': 0.04081497279637401, 'bb_std_mult': 3.587468559570691, 'rsi_os': 20, 'rsi_ob': 45, 'vol_spike': 0.04423208192845547, 'adx_thresh': 29.5050967394527, 'atr_min_pct': 0.007879387050327948, 'atr_max_pct': 0.1390641431180574, 'tp_mult': 2.319399487053469, 'tsl_mult': 0.7150237725180427, 'strategy': 'mean_reversion', 'time_stop': 234, 'use_sma': True, 'use_atr': True, 'use_adx': True, 'use_ema': False, 'use_spike': False, 'rsi_required': True, 'edge_k': 0.9362691841102736, 'edge_cap': 0.5569196911760275, 'bull_strategy': 'breakout', 'bull_bb_std_mult': 2.916353865983771, 'bull_rsi_os': 25, 'bull_rsi_ob': 56, 'bull_adx_thresh': 10.291140227237221, 'bull_atr_min_pct': 0.02872928048390062, 'bull_atr_max_pct': 0.11302032024706903, 'bull_tp_mult': 2.440530036087445, 'bull_tsl_mult': 0.4391318376554475, 'bull_time_stop': 26, 'bull_use_sma': False, 'bull_use_ema': False, 'bull_use_atr': True, 'bull_use_adx': False, 'bull_use_spike': True, 'bull_rsi_required': False, 'bear_strategy': 'mean_reversion', 'bear_bb_std_mult': 0.5456071118824468, 'bear_rsi_os': 50, 'bear_rsi_ob': 65, 'bear_adx_thresh': 16.799725220661085, 'bear_atr_min_pct': 0.015347088036297009, 'bear_atr_max_pct': 0.13338605226745648, 'bear_tp_mult': 1.185772497871076, 'bear_tsl_mult': 0.7609718473935847, 'bear_time_stop': 145, 'bear_use_sma': True, 'bear_use_ema': True, 'bear_use_atr': True, 'bear_use_adx': False, 'bear_use_spike': False, 'bear_rsi_required': True, 'sideways_strategy': 'breakout', 'sideways_bb_std_mult': 0.7639871781500172, 'sideways_rsi_os': 34, 'sideways_rsi_ob': 45, 'sideways_adx_thresh': 15.931206406739324, 'sideways_atr_min_pct': 0.01947261143057798, 'sideways_atr_max_pct': 0.0694858193822078, 'sideways_tp_mult': 1.8135304022356347, 'sideways_tsl_mult': 0.2858530049464071, 'sideways_time_stop': 300, 'sideways_use_sma': True, 'sideways_use_ema': False, 'sideways_use_atr': True, 'sideways_use_adx': True, 'sideways_use_spike': False, 'sideways_rsi_required': True}.
[I 2025-09-01 02:27:34,103] Trial 38 finished with values: [-1000000000.0, 1000000000.0] and parameters: {'p_sma': 34, 'p_std': 29, 'p_atr': 16, 'p_adx': 25, 'rsi_period': 66, 'ema1': 19, 'ema2': 50, 'slip_atr_k': 0.20670487449399982, 'slip_spread_k': 0.56123360711886, 'spread_hl_frac': 0.040063674992289494, 'bb_std_mult': 2.8641515814874947, 'rsi_os': 20, 'rsi_ob': 61, 'vol_spike': 0.17489058034403193, 'adx_thresh': 14.938306854154998, 'atr_min_pct': 0.016969936141873566, 'atr_max_pct': 0.1408228974342651, 'tp_mult': 2.3006946574562885, 'tsl_mult': 0.8167429166695419, 'strategy': 'mean_reversion', 'time_stop': 243, 'use_sma': True, 'use_atr': True, 'use_adx': True, 'use_ema': True, 'use_spike': False, 'rsi_required': True, 'edge_k': 0.2524751172286368, 'edge_cap': 0.35230814492670975, 'bull_strategy': 'breakout', 'bull_bb_std_mult': 2.82270917882439, 'bull_rsi_os': 26, 'bull_rsi_ob': 68, 'bull_adx_thresh': 10.221130494445616, 'bull_atr_min_pct': 0.028213680896841255, 'bull_atr_max_pct': 0.11611882694756866, 'bull_tp_mult': 2.3638964186467124, 'bull_tsl_mult': 0.48819037840235396, 'bull_time_stop': 107, 'bull_use_sma': False, 'bull_use_ema': True, 'bull_use_atr': True, 'bull_use_adx': False, 'bull_use_spike': False, 'bull_rsi_required': False, 'bear_strategy': 'mean_reversion', 'bear_bb_std_mult': 2.90840217324904, 'bear_rsi_os': 51, 'bear_rsi_ob': 66, 'bear_adx_thresh': 21.122816180649476, 'bear_atr_min_pct': 0.016255114001674963, 'bear_atr_max_pct': 0.11994668939015532, 'bear_tp_mult': 1.4272708513332406, 'bear_tsl_mult': 0.737641038623184, 'bear_time_stop': 143, 'bear_use_sma': True, 'bear_use_ema': True, 'bear_use_atr': True, 'bear_use_adx': False, 'bear_use_spike': False, 'bear_rsi_required': False, 'sideways_strategy': 'breakout', 'sideways_bb_std_mult': 0.8214096442726017, 'sideways_rsi_os': 34, 'sideways_rsi_ob': 45, 'sideways_adx_thresh': 14.834725668226554, 'sideways_atr_min_pct': 0.020151403352833514, 'sideways_atr_max_pct': 0.07048540531138478, 'sideways_tp_mult': 2.479304428693701, 'sideways_tsl_mult': 0.2704266754117689, 'sideways_time_stop': 43, 'sideways_use_sma': True, 'sideways_use_ema': False, 'sideways_use_atr': True, 'sideways_use_adx': False, 'sideways_use_spike': False, 'sideways_rsi_required': True}.
[I 2025-09-01 02:27:35,367] Trial 41 finished with values: [-1000000000.0, 1000000000.0] and parameters: {'p_sma': 33, 'p_std': 40, 'p_atr': 28, 'p_adx': 8, 'rsi_period': 67, 'ema1': 18, 'ema2': 21, 'slip_atr_k': 0.24729559998247735, 'slip_spread_k': 0.4149134680221448, 'spread_hl_frac': 0.03399437622622111, 'bb_std_mult': 2.244903379216252, 'rsi_os': 16, 'rsi_ob': 53, 'vol_spike': 0.1451576093643282, 'adx_thresh': 14.075884546020205, 'atr_min_pct': 0.011928401946639999, 'atr_max_pct': 0.06606295512014321, 'tp_mult': 1.7370208160489427, 'tsl_mult': 0.7909490989408625, 'strategy': 'mean_reversion', 'time_stop': 294, 'use_sma': False, 'use_atr': True, 'use_adx': False, 'use_ema': True, 'use_spike': False, 'rsi_required': True, 'edge_k': 1.5253663888660323, 'edge_cap': 0.35190927476587525, 'bull_strategy': 'mean_reversion', 'bull_bb_std_mult': 2.809617757309476, 'bull_rsi_os': 8, 'bull_rsi_ob': 48, 'bull_adx_thresh': 17.948002711696766, 'bull_atr_min_pct': 0.02460638054001471, 'bull_atr_max_pct': 0.013050743258962452, 'bull_tp_mult': 1.8568948626569706, 'bull_tsl_mult': 0.34056716874756154, 'bull_time_stop': 88, 'bull_use_sma': False, 'bull_use_ema': True, 'bull_use_atr': True, 'bull_use_adx': True, 'bull_use_spike': False, 'bull_rsi_required': False, 'bear_strategy': 'breakout', 'bear_bb_std_mult': 2.962775771320941, 'bear_rsi_os': 28, 'bear_rsi_ob': 76, 'bear_adx_thresh': 16.188289356712566, 'bear_atr_min_pct': 0.0029841449904408615, 'bear_atr_max_pct': 0.06991256545984235, 'bear_tp_mult': 1.4518189981323328, 'bear_tsl_mult': 0.5688486462553106, 'bear_time_stop': 61, 'bear_use_sma': True, 'bear_use_ema': True, 'bear_use_atr': True, 'bear_use_adx': True, 'bear_use_spike': False, 'bear_rsi_required': False, 'sideways_strategy': 'breakout', 'sideways_bb_std_mult': 0.5147329689184748, 'sideways_rsi_os': 8, 'sideways_rsi_ob': 91, 'sideways_adx_thresh': 18.498104608813776, 'sideways_atr_min_pct': 0.010944190095789352, 'sideways_atr_max_pct': 0.12880881180139345, 'sideways_tp_mult': 1.0261714410938727, 'sideways_tsl_mult': 0.6054667273607158, 'sideways_time_stop': 79, 'sideways_use_sma': True, 'sideways_use_ema': False, 'sideways_use_atr': False, 'sideways_use_adx': False, 'sideways_use_spike': False, 'sideways_rsi_required': True}.
[I 2025-09-01 02:27:35,404] Trial 39 finished with values: [-1000000000.0, 1000000000.0] and parameters: {'p_sma': 34, 'p_std': 32, 'p_atr': 17, 'p_adx': 26, 'rsi_period': 67, 'ema1': 11, 'ema2': 50, 'slip_atr_k': 0.21550328793981918, 'slip_spread_k': 0.037888149018115436, 'spread_hl_frac': 0.03915598092363306, 'bb_std_mult': 1.2750175084537296, 'rsi_os': 20, 'rsi_ob': 86, 'vol_spike': 0.18092721581931184, 'adx_thresh': 28.942032906078662, 'atr_min_pct': 0.010253810577570308, 'atr_max_pct': 0.14331711691903554, 'tp_mult': 2.311075806488707, 'tsl_mult': 0.818325693338379, 'strategy': 'mean_reversion', 'time_stop': 171, 'use_sma': False, 'use_atr': True, 'use_adx': True, 'use_ema': True, 'use_spike': False, 'rsi_required': True, 'edge_k': 1.2984237138952435, 'edge_cap': 0.3419396746158259, 'bull_strategy': 'breakout', 'bull_bb_std_mult': 2.849186084006658, 'bull_rsi_os': 24, 'bull_rsi_ob': 56, 'bull_adx_thresh': 10.611398106800415, 'bull_atr_min_pct': 0.029384816557301623, 'bull_atr_max_pct': 0.1124919872431798, 'bull_tp_mult': 1.6140594360751583, 'bull_tsl_mult': 0.7275506105720377, 'bull_time_stop': 228, 'bull_use_sma': False, 'bull_use_ema': True, 'bull_use_atr': True, 'bull_use_adx': True, 'bull_use_spike': False, 'bull_rsi_required': False, 'bear_strategy': 'mean_reversion', 'bear_bb_std_mult': 2.9004689696747867, 'bear_rsi_os': 28, 'bear_rsi_ob': 76, 'bear_adx_thresh': 20.942220087978654, 'bear_atr_min_pct': 0.029687477667237127, 'bear_atr_max_pct': 0.06734514367052682, 'bear_tp_mult': 1.4319167355437292, 'bear_tsl_mult': 0.7636663221328708, 'bear_time_stop': 140, 'bear_use_sma': True, 'bear_use_ema': True, 'bear_use_atr': True, 'bear_use_adx': False, 'bear_use_spike': False, 'bear_rsi_required': True, 'sideways_strategy': 'breakout', 'sideways_bb_std_mult': 0.7636436458091989, 'sideways_rsi_os': 34, 'sideways_rsi_ob': 45, 'sideways_adx_thresh': 18.723954776046156, 'sideways_atr_min_pct': 0.02119901931691271, 'sideways_atr_max_pct': 0.07533233319981482, 'sideways_tp_mult': 1.8285583743129865, 'sideways_tsl_mult': 0.2746660313490709, 'sideways_time_stop': 299, 'sideways_use_sma': True, 'sideways_use_ema': False, 'sideways_use_atr': False, 'sideways_use_adx': False, 'sideways_use_spike': False, 'sideways_rsi_required': True}.
[I 2025-09-01 02:27:35,960] Trial 40 finished with values: [-1000000000.0, 1000000000.0] and parameters: {'p_sma': 33, 'p_std': 32, 'p_atr': 17, 'p_adx': 7, 'rsi_period': 65, 'ema1': 19, 'ema2': 51, 'slip_atr_k': 0.1923502803630442, 'slip_spread_k': 0.08023845217314701, 'spread_hl_frac': 0.039776820057934835, 'bb_std_mult': 3.5850623065693563, 'rsi_os': 16, 'rsi_ob': 60, 'vol_spike': 0.055432491361250655, 'adx_thresh': 30.3024941644626, 'atr_min_pct': 0.012393446621801689, 'atr_max_pct': 0.06580933979253407, 'tp_mult': 2.2922363017909064, 'tsl_mult': 0.8205025701674502, 'strategy': 'mean_reversion', 'time_stop': 282, 'use_sma': False, 'use_atr': True, 'use_adx': True, 'use_ema': True, 'use_spike': False, 'rsi_required': True, 'edge_k': 0.24538996170595795, 'edge_cap': 0.34774989372907006, 'bull_strategy': 'mean_reversion', 'bull_bb_std_mult': 2.7112110278301307, 'bull_rsi_os': 46, 'bull_rsi_ob': 56, 'bull_adx_thresh': 33.56467810528015, 'bull_atr_min_pct': 0.024414680329932503, 'bull_atr_max_pct': 0.11326616489435122, 'bull_tp_mult': 1.8518760708462707, 'bull_tsl_mult': 0.43032997309167864, 'bull_time_stop': 94, 'bull_use_sma': False, 'bull_use_ema': True, 'bull_use_atr': True, 'bull_use_adx': True, 'bull_use_spike': False, 'bull_rsi_required': False, 'bear_strategy': 'breakout', 'bear_bb_std_mult': 2.9662572982829243, 'bear_rsi_os': 28, 'bear_rsi_ob': 76, 'bear_adx_thresh': 15.920891274277036, 'bear_atr_min_pct': 0.0037530960903052694, 'bear_atr_max_pct': 0.13553659274648294, 'bear_tp_mult': 1.4941663168747428, 'bear_tsl_mult': 0.5665886823185828, 'bear_time_stop': 140, 'bear_use_sma': True, 'bear_use_ema': True, 'bear_use_atr': True, 'bear_use_adx': False, 'bear_use_spike': False, 'bear_rsi_required': False, 'sideways_strategy': 'breakout', 'sideways_bb_std_mult': 2.0060931645417415, 'sideways_rsi_os': 10, 'sideways_rsi_ob': 91, 'sideways_adx_thresh': 18.82267193893943, 'sideways_atr_min_pct': 0.010389909426095668, 'sideways_atr_max_pct': 0.13440949358532023, 'sideways_tp_mult': 1.8060890176154276, 'sideways_tsl_mult': 0.2866363948093773, 'sideways_time_stop': 86, 'sideways_use_sma': True, 'sideways_use_ema': False, 'sideways_use_atr': False, 'sideways_use_adx': False, 'sideways_use_spike': False, 'sideways_rsi_required': True}.
[I 2025-09-01 02:28:24,599] Trial 43 finished with values: [-0.024953703294124385, 0.02476856813847746] and parameters: {'p_sma': 23, 'p_std': 50, 'p_atr': 21, 'p_adx': 8, 'rsi_period': 72, 'ema1': 7, 'ema2': 57, 'slip_atr_k': 0.16423073349268702, 'slip_spread_k': 0.7460544153707974, 'spread_hl_frac': 0.03376480275363182, 'bb_std_mult': 3.1753134548070734, 'rsi_os': 8, 'rsi_ob': 67, 'vol_spike': 0.14635864890760014, 'adx_thresh': 23.78517505734622, 'atr_min_pct': 0.012944716203748926, 'atr_max_pct': 0.10533545651160578, 'tp_mult': 2.214940178497035, 'tsl_mult': 0.6340646141548034, 'strategy': 'breakout', 'time_stop': 274, 'use_sma': False, 'use_atr': False, 'use_adx': True, 'use_ema': False, 'use_spike': False, 'rsi_required': True, 'edge_k': 0.6729683547144744, 'edge_cap': 0.4864508721583315, 'bull_strategy': 'breakout', 'bull_bb_std_mult': 3.320634686131151, 'bull_rsi_os': 19, 'bull_rsi_ob': 63, 'bull_adx_thresh': 32.538939432148304, 'bull_atr_min_pct': 0.00017114645915235205, 'bull_atr_max_pct': 0.08631718224553789, 'bull_tp_mult': 1.868954978748955, 'bull_tsl_mult': 0.6209633757150819, 'bull_time_stop': 70, 'bull_use_sma': False, 'bull_use_ema': True, 'bull_use_atr': True, 'bull_use_adx': False, 'bull_use_spike': True, 'bull_rsi_required': True, 'bear_strategy': 'breakout', 'bear_bb_std_mult': 2.5405571171710135, 'bear_rsi_os': 46, 'bear_rsi_ob': 87, 'bear_adx_thresh': 25.847184128176913, 'bear_atr_min_pct': 0.010282210017401646, 'bear_atr_max_pct': 0.05037088462719477, 'bear_tp_mult': 2.3214496001841547, 'bear_tsl_mult': 0.8611786799552703, 'bear_time_stop': 97, 'bear_use_sma': True, 'bear_use_ema': False, 'bear_use_atr': False, 'bear_use_adx': False, 'bear_use_spike': True, 'bear_rsi_required': True, 'sideways_strategy': 'breakout', 'sideways_bb_std_mult': 1.0224667742372648, 'sideways_rsi_os': 15, 'sideways_rsi_ob': 85, 'sideways_adx_thresh': 23.151517638847626, 'sideways_atr_min_pct': 0.01636347902105959, 'sideways_atr_max_pct': 0.05281586354237895, 'sideways_tp_mult': 1.5937858715633182, 'sideways_tsl_mult': 0.4608136395273119, 'sideways_time_stop': 84, 'sideways_use_sma': False, 'sideways_use_ema': True, 'sideways_use_atr': False, 'sideways_use_adx': False, 'sideways_use_spike': False, 'sideways_rsi_required': False}.
[I 2025-09-01 02:28:25,093] Trial 45 finished with values: [-1000000000.0, 1000000000.0] and parameters: {'p_sma': 23, 'p_std': 50, 'p_atr': 21, 'p_adx': 8, 'rsi_period': 72, 'ema1': 6, 'ema2': 55, 'slip_atr_k': 0.1645699392918985, 'slip_spread_k': 0.7470873048290594, 'spread_hl_frac': 0.0278711820116555, 'bb_std_mult': 3.1281050787994067, 'rsi_os': 8, 'rsi_ob': 67, 'vol_spike': 0.1467986064580679, 'adx_thresh': 22.979371008953464, 'atr_min_pct': 0.016678046850491977, 'atr_max_pct': 0.10069220248088638, 'tp_mult': 1.0361625522787044, 'tsl_mult': 0.3346068605842485, 'strategy': 'breakout', 'time_stop': 200, 'use_sma': False, 'use_atr': False, 'use_adx': False, 'use_ema': False, 'use_spike': True, 'rsi_required': False, 'edge_k': 1.1770598960443153, 'edge_cap': 0.7215042607231194, 'bull_strategy': 'breakout', 'bull_bb_std_mult': 3.2821404834811965, 'bull_rsi_os': 19, 'bull_rsi_ob': 62, 'bull_adx_thresh': 11.889715716566071, 'bull_atr_min_pct': 0.005825228966375369, 'bull_atr_max_pct': 0.08472648822824144, 'bull_tp_mult': 2.7550714870616475, 'bull_tsl_mult': 0.60928088953012, 'bull_time_stop': 267, 'bull_use_sma': False, 'bull_use_ema': True, 'bull_use_atr': False, 'bull_use_adx': False, 'bull_use_spike': True, 'bull_rsi_required': True, 'bear_strategy': 'breakout', 'bear_bb_std_mult': 2.564096374314434, 'bear_rsi_os': 45, 'bear_rsi_ob': 87, 'bear_adx_thresh': 26.46598243362798, 'bear_atr_min_pct': 0.011207536638236325, 'bear_atr_max_pct': 0.09312533320862096, 'bear_tp_mult': 2.3507325157106163, 'bear_tsl_mult': 0.8697470267749918, 'bear_time_stop': 91, 'bear_use_sma': True, 'bear_use_ema': False, 'bear_use_atr': False, 'bear_use_adx': True, 'bear_use_spike': True, 'bear_rsi_required': True, 'sideways_strategy': 'breakout', 'sideways_bb_std_mult': 1.1028808591013266, 'sideways_rsi_os': 5, 'sideways_rsi_ob': 85, 'sideways_adx_thresh': 22.56709267743878, 'sideways_atr_min_pct': 0.016076642923550027, 'sideways_atr_max_pct': 0.0533783340262058, 'sideways_tp_mult': 1.65148917537909, 'sideways_tsl_mult': 0.4477699604643022, 'sideways_time_stop': 274, 'sideways_use_sma': False, 'sideways_use_ema': True, 'sideways_use_atr': False, 'sideways_use_adx': False, 'sideways_use_spike': True, 'sideways_rsi_required': False}.
[I 2025-09-01 02:28:25,467] Trial 44 finished with values: [-0.029799408923200876, 0.029616016282577304] and parameters: {'p_sma': 23, 'p_std': 50, 'p_atr': 21, 'p_adx': 8, 'rsi_period': 71, 'ema1': 7, 'ema2': 54, 'slip_atr_k': 0.1631231645164493, 'slip_spread_k': 0.7511873600574026, 'spread_hl_frac': 0.02783158665920801, 'bb_std_mult': 3.1148768119239008, 'rsi_os': 42, 'rsi_ob': 68, 'vol_spike': 0.14279259789749943, 'adx_thresh': 10.872189631640422, 'atr_min_pct': 0.016538820718497035, 'atr_max_pct': 0.0980313418546084, 'tp_mult': 2.140391138291169, 'tsl_mult': 0.332433654795544, 'strategy': 'breakout', 'time_stop': 198, 'use_sma': False, 'use_atr': False, 'use_adx': True, 'use_ema': False, 'use_spike': False, 'rsi_required': True, 'edge_k': 0.6079601015106614, 'edge_cap': 0.7090119824330627, 'bull_strategy': 'breakout', 'bull_bb_std_mult': 3.2795330276393635, 'bull_rsi_os': 18, 'bull_rsi_ob': 62, 'bull_adx_thresh': 34.697627982245216, 'bull_atr_min_pct': 0.00035449647614830014, 'bull_atr_max_pct': 0.08339063064092053, 'bull_tp_mult': 2.823466657450662, 'bull_tsl_mult': 0.622822343935641, 'bull_time_stop': 120, 'bull_use_sma': False, 'bull_use_ema': True, 'bull_use_atr': True, 'bull_use_adx': False, 'bull_use_spike': True, 'bull_rsi_required': True, 'bear_strategy': 'breakout', 'bear_bb_std_mult': 2.731385012821846, 'bear_rsi_os': 46, 'bear_rsi_ob': 87, 'bear_adx_thresh': 26.70098064318533, 'bear_atr_min_pct': 0.0066046393230780615, 'bear_atr_max_pct': 0.05177126465550305, 'bear_tp_mult': 2.410195579915244, 'bear_tsl_mult': 0.8759464372107695, 'bear_time_stop': 97, 'bear_use_sma': True, 'bear_use_ema': False, 'bear_use_atr': False, 'bear_use_adx': False, 'bear_use_spike': True, 'bear_rsi_required': True, 'sideways_strategy': 'breakout', 'sideways_bb_std_mult': 1.0568380387358678, 'sideways_rsi_os': 41, 'sideways_rsi_ob': 83, 'sideways_adx_thresh': 22.327379162329798, 'sideways_atr_min_pct': 0.015708037724676775, 'sideways_atr_max_pct': 0.0540783287432805, 'sideways_tp_mult': 1.640765069835134, 'sideways_tsl_mult': 0.47426464368893706, 'sideways_time_stop': 90, 'sideways_use_sma': False, 'sideways_use_ema': True, 'sideways_use_atr': False, 'sideways_use_adx': False, 'sideways_use_spike': False, 'sideways_rsi_required': False}.
