[I 2025-09-01 02:35:34,627] Trial 84 finished with values: [-1000000000.0, 1000000000.0] and parameters: {'p_sma': 15, 'p_std': 48, 'p_atr': 19, 'p_adx': 9, 'rsi_period': 64, 'ema1': 8, 'ema2': 44, 'slip_atr_k': 0.13328551733814242, 'slip_spread_k': 0.5147540868445288, 'spread_hl_frac': 0.004492209004204429, 'bb_std_mult': 2.3193169824879716, 'rsi_os': 37, 'rsi_ob': 91, 'vol_spike': 0.061735156135507646, 'adx_thresh': 25.67705842884874, 'atr_min_pct': 0.014093396527337605, 'atr_max_pct': 0.03295021280853395, 'tp_mult': 2.0357626069582597, 'tsl_mult': 0.9557654652945473, 'strategy': 'breakout', 'time_stop': 277, 'use_sma': False, 'use_atr': False, 'use_adx': False, 'use_ema': False, 'use_spike': True, 'rsi_required': False, 'edge_k': 0.4851833800314555, 'edge_cap': 0.10663713122423288, 'bull_strategy': 'mean_reversion', 'bull_bb_std_mult': 0.9951881691268898, 'bull_rsi_os': 34, 'bull_rsi_ob': 65, 'bull_adx_thresh': 15.434225559676666, 'bull_atr_min_pct': 0.0018703841113729273, 'bull_atr_max_pct': 0.1417367033174019, 'bull_tp_mult': 1.4612293789952986, 'bull_tsl_mult': 0.4170439658100211, 'bull_time_stop': 72, 'bull_use_sma': False, 'bull_use_ema': False, 'bull_use_atr': False, 'bull_use_adx': True, 'bull_use_spike': True, 'bull_rsi_required': True, 'bear_strategy': 'breakout', 'bear_bb_std_mult': 2.6662508783967027, 'bear_rsi_os': 11, 'bear_rsi_ob': 48, 'bear_adx_thresh': 31.40592675512957, 'bear_atr_min_pct': 0.016588676899419556, 'bear_atr_max_pct': 0.0647276083636995, 'bear_tp_mult': 2.2862423691449956, 'bear_tsl_mult': 0.4574039621235584, 'bear_time_stop': 70, 'bear_use_sma': False, 'bear_use_ema': False, 'bear_use_atr': False, 'bear_use_adx': True, 'bear_use_spike': True, 'bear_rsi_required': True, 'sideways_strategy': 'breakout', 'sideways_bb_std_mult': 2.910136120455024, 'sideways_rsi_os': 53, 'sideways_rsi_ob': 56, 'sideways_adx_thresh': 31.639856091442603, 'sideways_atr_min_pct': 0.012871646892881254, 'sideways_atr_max_pct': 0.05776628422323708, 'sideways_tp_mult': 1.2937775374767995, 'sideways_tsl_mult': 0.07332168058155386, 'sideways_time_stop': 188, 'sideways_use_sma': False, 'sideways_use_ema': True, 'sideways_use_atr': True, 'sideways_use_adx': True, 'sideways_use_spike': True, 'sideways_rsi_required': False}.
[I 2025-09-01 02:35:34,950] Trial 81 finished with values: [-1000000000.0, 1000000000.0] and parameters: {'p_sma': 7, 'p_std': 46, 'p_atr': 19, 'p_adx': 11, 'rsi_period': 69, 'ema1': 29, 'ema2': 56, 'slip_atr_k': 0.1331003556227202, 'slip_spread_k': 0.5106727887337157, 'spread_hl_frac': 0.006137535406933537, 'bb_std_mult': 2.4185004560641015, 'rsi_os': 36, 'rsi_ob': 91, 'vol_spike': 0.2427641867632418, 'adx_thresh': 25.847737307040834, 'atr_min_pct': 0.022932359172375655, 'atr_max_pct': 0.03953108179324255, 'tp_mult': 2.3906298431464883, 'tsl_mult': 0.6534600431862924, 'strategy': 'mean_reversion', 'time_stop': 237, 'use_sma': False, 'use_atr': False, 'use_adx': False, 'use_ema': True, 'use_spike': True, 'rsi_required': False, 'edge_k': 0.30901244219726015, 'edge_cap': 0.21770348521233, 'bull_strategy': 'mean_reversion', 'bull_bb_std_mult': 1.4765320313538992, 'bull_rsi_os': 7, 'bull_rsi_ob': 64, 'bull_adx_thresh': 15.162535738444678, 'bull_atr_min_pct': 0.0069018541108317975, 'bull_atr_max_pct': 0.1406376115295549, 'bull_tp_mult': 1.458678583275909, 'bull_tsl_mult': 0.29083463754764216, 'bull_time_stop': 56, 'bull_use_sma': False, 'bull_use_ema': False, 'bull_use_atr': False, 'bull_use_adx': True, 'bull_use_spike': True, 'bull_rsi_required': False, 'bear_strategy': 'breakout', 'bear_bb_std_mult': 2.1392269688534427, 'bear_rsi_os': 6, 'bear_rsi_ob': 91, 'bear_adx_thresh': 14.841600377889407, 'bear_atr_min_pct': 0.01280793252975143, 'bear_atr_max_pct': 0.03303843188585055, 'bear_tp_mult': 2.494829661371972, 'bear_tsl_mult': 0.8025254138317846, 'bear_time_stop': 83, 'bear_use_sma': False, 'bear_use_ema': False, 'bear_use_atr': False, 'bear_use_adx': True, 'bear_use_spike': True, 'bear_rsi_required': True, 'sideways_strategy': 'breakout', 'sideways_bb_std_mult': 2.758245839213807, 'sideways_rsi_os': 52, 'sideways_rsi_ob': 56, 'sideways_adx_thresh': 30.24816106378923, 'sideways_atr_min_pct': 0.011968520449870592, 'sideways_atr_max_pct': 0.08137840782978364, 'sideways_tp_mult': 1.503422208929695, 'sideways_tsl_mult': 0.6943964244956229, 'sideways_time_stop': 46, 'sideways_use_sma': True, 'sideways_use_ema': True, 'sideways_use_atr': True, 'sideways_use_adx': True, 'sideways_use_spike': True, 'sideways_rsi_required': False}.
[I 2025-09-01 02:35:35,996] Trial 82 finished with values: [-1000000000.0, 1000000000.0] and parameters: {'p_sma': 16, 'p_std': 54, 'p_atr': 19, 'p_adx': 11, 'rsi_period': 64, 'ema1': 8, 'ema2': 13, 'slip_atr_k': 0.1335642244267374, 'slip_spread_k': 0.61328652055663, 'spread_hl_frac': 0.019226012109293825, 'bb_std_mult': 0.858202816564843, 'rsi_os': 45, 'rsi_ob': 62, 'vol_spike': 0.24309913837220856, 'adx_thresh': 25.913990153571273, 'atr_min_pct': 0.0009347499080207752, 'atr_max_pct': 0.038990184215592215, 'tp_mult': 1.1291379696198622, 'tsl_mult': 0.0007551152115013449, 'strategy': 'breakout', 'time_stop': 236, 'use_sma': False, 'use_atr': False, 'use_adx': False, 'use_ema': False, 'use_spike': True, 'rsi_required': False, 'edge_k': 1.0187552666375685, 'edge_cap': 0.05352195560015269, 'bull_strategy': 'mean_reversion', 'bull_bb_std_mult': 1.0077779287248785, 'bull_rsi_os': 35, 'bull_rsi_ob': 54, 'bull_adx_thresh': 32.12418523983945, 'bull_atr_min_pct': 0.0022450942294427703, 'bull_atr_max_pct': 0.1419825474818011, 'bull_tp_mult': 2.6448535605910957, 'bull_tsl_mult': 0.41062019023406143, 'bull_time_stop': 57, 'bull_use_sma': False, 'bull_use_ema': False, 'bull_use_atr': False, 'bull_use_adx': True, 'bull_use_spike': True, 'bull_rsi_required': True, 'bear_strategy': 'breakout', 'bear_bb_std_mult': 2.1130619217241557, 'bear_rsi_os': 12, 'bear_rsi_ob': 91, 'bear_adx_thresh': 31.735892089906898, 'bear_atr_min_pct': 0.016523649221002266, 'bear_atr_max_pct': 0.06873039522769545, 'bear_tp_mult': 1.854011072601371, 'bear_tsl_mult': 0.7954482799571501, 'bear_time_stop': 39, 'bear_use_sma': False, 'bear_use_ema': False, 'bear_use_atr': False, 'bear_use_adx': True, 'bear_use_spike': True, 'bear_rsi_required': True, 'sideways_strategy': 'breakout', 'sideways_bb_std_mult': 2.9430039128494077, 'sideways_rsi_os': 19, 'sideways_rsi_ob': 84, 'sideways_adx_thresh': 31.82475021432306, 'sideways_atr_min_pct': 0.011860858666123693, 'sideways_atr_max_pct': 0.06007394151406715, 'sideways_tp_mult': 1.5955269436884816, 'sideways_tsl_mult': 0.17578927015575635, 'sideways_time_stop': 193, 'sideways_use_sma': False, 'sideways_use_ema': True, 'sideways_use_atr': True, 'sideways_use_adx': True, 'sideways_use_spike': True, 'sideways_rsi_required': False}.
[I 2025-09-01 02:35:36,148] Trial 83 finished with values: [-1000000000.0, 1000000000.0] and parameters: {'p_sma': 14, 'p_std': 48, 'p_atr': 23, 'p_adx': 9, 'rsi_period': 63, 'ema1': 8, 'ema2': 46, 'slip_atr_k': 0.1281493430816053, 'slip_spread_k': 0.07775929098092571, 'spread_hl_frac': 0.019947966072753107, 'bb_std_mult': 2.481713053087981, 'rsi_os': 32, 'rsi_ob': 63, 'vol_spike': 0.14532302192646454, 'adx_thresh': 25.78553064689361, 'atr_min_pct': 0.014125208518176648, 'atr_max_pct': 0.03007741454062319, 'tp_mult': 2.3573325222820096, 'tsl_mult': 0.015598009908240451, 'strategy': 'breakout', 'time_stop': 236, 'use_sma': False, 'use_atr': False, 'use_adx': False, 'use_ema': False, 'use_spike': True, 'rsi_required': False, 'edge_k': 0.9912091474747577, 'edge_cap': 0.8141581654271284, 'bull_strategy': 'mean_reversion', 'bull_bb_std_mult': 1.161221436419022, 'bull_rsi_os': 34, 'bull_rsi_ob': 65, 'bull_adx_thresh': 32.02563530048857, 'bull_atr_min_pct': 0.0020205466243132133, 'bull_atr_max_pct': 0.1411345918688892, 'bull_tp_mult': 2.682104773820159, 'bull_tsl_mult': 0.5493597506543116, 'bull_time_stop': 70, 'bull_use_sma': True, 'bull_use_ema': False, 'bull_use_atr': False, 'bull_use_adx': True, 'bull_use_spike': False, 'bull_rsi_required': True, 'bear_strategy': 'breakout', 'bear_bb_std_mult': 0.6842479534873287, 'bear_rsi_os': 11, 'bear_rsi_ob': 48, 'bear_adx_thresh': 25.654845506822202, 'bear_atr_min_pct': 0.016359997514942434, 'bear_atr_max_pct': 0.06352188797597791, 'bear_tp_mult': 1.8830141715938868, 'bear_tsl_mult': 0.8237547523464747, 'bear_time_stop': 247, 'bear_use_sma': False, 'bear_use_ema': False, 'bear_use_atr': False, 'bear_use_adx': True, 'bear_use_spike': True, 'bear_rsi_required': True, 'sideways_strategy': 'breakout', 'sideways_bb_std_mult': 2.7685700486252953, 'sideways_rsi_os': 53, 'sideways_rsi_ob': 85, 'sideways_adx_thresh': 30.371188517751946, 'sideways_atr_min_pct': 0.011804383756176944, 'sideways_atr_max_pct': 0.12437491506493062, 'sideways_tp_mult': 1.9014435664697162, 'sideways_tsl_mult': 0.6982715339020964, 'sideways_time_stop': 63, 'sideways_use_sma': False, 'sideways_use_ema': True, 'sideways_use_atr': True, 'sideways_use_adx': True, 'sideways_use_spike': True, 'sideways_rsi_required': False}.
[I 2025-09-01 02:36:20,091] Trial 88 finished with values: [-1000000000.0, 1000000000.0] and parameters: {'p_sma': 23, 'p_std': 42, 'p_atr': 25, 'p_adx': 10, 'rsi_period': 81, 'ema1': 22, 'ema2': 54, 'slip_atr_k': 0.11563419327400479, 'slip_spread_k': 0.1521691163210815, 'spread_hl_frac': 0.03789235529500967, 'bb_std_mult': 1.1767521209138558, 'rsi_os': 5, 'rsi_ob': 47, 'vol_spike': 0.13553693504448136, 'adx_thresh': 28.862401646448696, 'atr_min_pct': 0.004182809923888238, 'atr_max_pct': 0.09366102556850045, 'tp_mult': 2.2471268271529556, 'tsl_mult': 0.2807804629350065, 'strategy': 'breakout', 'time_stop': 288, 'use_sma': True, 'use_atr': False, 'use_adx': True, 'use_ema': False, 'use_spike': True, 'rsi_required': False, 'edge_k': 0.8071396854261863, 'edge_cap': 0.1605551886377527, 'bull_strategy': 'mean_reversion', 'bull_bb_std_mult': 2.076378994194348, 'bull_rsi_os': 55, 'bull_rsi_ob': 71, 'bull_adx_thresh': 29.24697822300358, 'bull_atr_min_pct': 0.004727737086359438, 'bull_atr_max_pct': 0.1454415288313077, 'bull_tp_mult': 1.8136196944192833, 'bull_tsl_mult': 0.7078910953104367, 'bull_time_stop': 214, 'bull_use_sma': False, 'bull_use_ema': False, 'bull_use_atr': False, 'bull_use_adx': False, 'bull_use_spike': False, 'bull_rsi_required': True, 'bear_strategy': 'breakout', 'bear_bb_std_mult': 3.4029171648658965, 'bear_rsi_os': 5, 'bear_rsi_ob': 95, 'bear_adx_thresh': 20.241368034706685, 'bear_atr_min_pct': 0.008704926493487385, 'bear_atr_max_pct': 0.04860706411196032, 'bear_tp_mult': 1.6716382609603482, 'bear_tsl_mult': 0.9793555643073485, 'bear_time_stop': 279, 'bear_use_sma': False, 'bear_use_ema': True, 'bear_use_atr': True, 'bear_use_adx': False, 'bear_use_spike': False, 'bear_rsi_required': False, 'sideways_strategy': 'breakout', 'sideways_bb_std_mult': 2.465703171952426, 'sideways_rsi_os': 15, 'sideways_rsi_ob': 58, 'sideways_adx_thresh': 26.168626970701904, 'sideways_atr_min_pct': 0.014825186697945506, 'sideways_atr_max_pct': 0.14138466833619023, 'sideways_tp_mult': 1.5145510497087598, 'sideways_tsl_mult': 0.33488337818184427, 'sideways_time_stop': 256, 'sideways_use_sma': False, 'sideways_use_ema': False, 'sideways_use_atr': False, 'sideways_use_adx': False, 'sideways_use_spike': True, 'sideways_rsi_required': True}.
[I 2025-09-01 02:36:23,583] Trial 86 finished with values: [-1000000000.0, 1000000000.0] and parameters: {'p_sma': 17, 'p_std': 42, 'p_atr': 23, 'p_adx': 10, 'rsi_period': 60, 'ema1': 21, 'ema2': 54, 'slip_atr_k': 0.12428422844520154, 'slip_spread_k': 0.7046580676950178, 'spread_hl_frac': 0.020142709919956293, 'bb_std_mult': 1.6887282494750677, 'rsi_os': 5, 'rsi_ob': 63, 'vol_spike': 0.14445225514524587, 'adx_thresh': 26.836104804570468, 'atr_min_pct': 0.004181980091975374, 'atr_max_pct': 0.1066159138589841, 'tp_mult': 1.941702544593771, 'tsl_mult': 0.7338455907224102, 'strategy': 'breakout', 'time_stop': 262, 'use_sma': True, 'use_atr': False, 'use_adx': False, 'use_ema': False, 'use_spike': True, 'rsi_required': False, 'edge_k': 1.0196539945191154, 'edge_cap': 0.05254704682311896, 'bull_strategy': 'mean_reversion', 'bull_bb_std_mult': 0.7707786436309538, 'bull_rsi_os': 28, 'bull_rsi_ob': 61, 'bull_adx_thresh': 31.970511306268705, 'bull_atr_min_pct': 0.00452764043060541, 'bull_atr_max_pct': 0.1493817463140236, 'bull_tp_mult': 1.795268591140267, 'bull_tsl_mult': 0.7094329183418797, 'bull_time_stop': 67, 'bull_use_sma': True, 'bull_use_ema': False, 'bull_use_atr': False, 'bull_use_adx': False, 'bull_use_spike': False, 'bull_rsi_required': True, 'bear_strategy': 'breakout', 'bear_bb_std_mult': 2.834332168451338, 'bear_rsi_os': 12, 'bear_rsi_ob': 95, 'bear_adx_thresh': 25.953607826242276, 'bear_atr_min_pct': 0.008628100464889939, 'bear_atr_max_pct': 0.09595740204150598, 'bear_tp_mult': 1.6641005586134212, 'bear_tsl_mult': 0.9843012494870164, 'bear_time_stop': 38, 'bear_use_sma': False, 'bear_use_ema': True, 'bear_use_atr': False, 'bear_use_adx': True, 'bear_use_spike': False, 'bear_rsi_required': False, 'sideways_strategy': 'breakout', 'sideways_bb_std_mult': 2.948488739843521, 'sideways_rsi_os': 46, 'sideways_rsi_ob': 58, 'sideways_adx_thresh': 26.077006581480717, 'sideways_atr_min_pct': 0.020491228850161664, 'sideways_atr_max_pct': 0.025664749344232574, 'sideways_tp_mult': 2.242545300233494, 'sideways_tsl_mult': 0.8605492522547002, 'sideways_time_stop': 250, 'sideways_use_sma': False, 'sideways_use_ema': True, 'sideways_use_atr': True, 'sideways_use_adx': True, 'sideways_use_spike': True, 'sideways_rsi_required': True}.
[I 2025-09-01 02:36:24,756] Trial 87 finished with values: [-0.030203419085934047, 0.030046871550866355] and parameters: {'p_sma': 25, 'p_std': 38, 'p_atr': 23, 'p_adx': 10, 'rsi_period': 60, 'ema1': 22, 'ema2': 54, 'slip_atr_k': 0.1260329063379928, 'slip_spread_k': 0.1512349448960144, 'spread_hl_frac': 0.04311481318444596, 'bb_std_mult': 1.2018745209368378, 'rsi_os': 31, 'rsi_ob': 67, 'vol_spike': 0.14547951844175647, 'adx_thresh': 21.928838422159394, 'atr_min_pct': 0.013777012444989975, 'atr_max_pct': 0.12511201256389554, 'tp_mult': 1.926099056700878, 'tsl_mult': 0.729957708534077, 'strategy': 'breakout', 'time_stop': 267, 'use_sma': True, 'use_atr': False, 'use_adx': False, 'use_ema': False, 'use_spike': True, 'rsi_required': False, 'edge_k': 1.527762623076978, 'edge_cap': 0.9140196662588704, 'bull_strategy': 'mean_reversion', 'bull_bb_std_mult': 1.1623103935646961, 'bull_rsi_os': 52, 'bull_rsi_ob': 62, 'bull_adx_thresh': 29.125057763820493, 'bull_atr_min_pct': 2.8425866329504736e-05, 'bull_atr_max_pct': 0.14879792525585778, 'bull_tp_mult': 1.7380688795291332, 'bull_tsl_mult': 0.1629098163262565, 'bull_time_stop': 234, 'bull_use_sma': True, 'bull_use_ema': False, 'bull_use_atr': False, 'bull_use_adx': False, 'bull_use_spike': False, 'bull_rsi_required': True, 'bear_strategy': 'breakout', 'bear_bb_std_mult': 3.382638724681178, 'bear_rsi_os': 5, 'bear_rsi_ob': 95, 'bear_adx_thresh': 26.34229340583681, 'bear_atr_min_pct': 0.014726548041776382, 'bear_atr_max_pct': 0.09651262298478427, 'bear_tp_mult': 1.129238893970789, 'bear_tsl_mult': 0.08090335081683947, 'bear_time_stop': 279, 'bear_use_sma': False, 'bear_use_ema': True, 'bear_use_atr': False, 'bear_use_adx': True, 'bear_use_spike': False, 'bear_rsi_required': False, 'sideways_strategy': 'breakout', 'sideways_bb_std_mult': 2.3782984439594115, 'sideways_rsi_os': 47, 'sideways_rsi_ob': 76, 'sideways_adx_thresh': 25.916200394275464, 'sideways_atr_min_pct': 0.019934608048215983, 'sideways_atr_max_pct': 0.14230303582555756, 'sideways_tp_mult': 2.335936721588643, 'sideways_tsl_mult': 0.33123859772062797, 'sideways_time_stop': 60, 'sideways_use_sma': False, 'sideways_use_ema': True, 'sideways_use_atr': True, 'sideways_use_adx': True, 'sideways_use_spike': True, 'sideways_rsi_required': True}.
[I 2025-09-01 02:36:25,786] Trial 85 finished with values: [-1000000000.0, 1000000000.0] and parameters: {'p_sma': 16, 'p_std': 42, 'p_atr': 23, 'p_adx': 9, 'rsi_period': 60, 'ema1': 21, 'ema2': 54, 'slip_atr_k': 0.1258763320926929, 'slip_spread_k': 0.5987487500874232, 'spread_hl_frac': 0.020003262848548937, 'bb_std_mult': 1.682136022486421, 'rsi_os': 5, 'rsi_ob': 47, 'vol_spike': 0.14553109038808304, 'adx_thresh': 26.935482751895524, 'atr_min_pct': 0.0037766062278058177, 'atr_max_pct': 0.0946840779717735, 'tp_mult': 1.9376443373441545, 'tsl_mult': 0.8537404744622312, 'strategy': 'breakout', 'time_stop': 264, 'use_sma': False, 'use_atr': False, 'use_adx': False, 'use_ema': True, 'use_spike': True, 'rsi_required': False, 'edge_k': 0.801178908903089, 'edge_cap': 0.8142836563889069, 'bull_strategy': 'mean_reversion', 'bull_bb_std_mult': 1.1539889726916093, 'bull_rsi_os': 12, 'bull_rsi_ob': 62, 'bull_adx_thresh': 31.948704372941908, 'bull_atr_min_pct': 0.0022765124092073773, 'bull_atr_max_pct': 0.14968458229763737, 'bull_tp_mult': 2.761298663708146, 'bull_tsl_mult': 0.16522573171734706, 'bull_time_stop': 64, 'bull_use_sma': True, 'bull_use_ema': False, 'bull_use_atr': False, 'bull_use_adx': False, 'bull_use_spike': False, 'bull_rsi_required': True, 'bear_strategy': 'breakout', 'bear_bb_std_mult': 2.5143670322255476, 'bear_rsi_os': 39, 'bear_rsi_ob': 91, 'bear_adx_thresh': 20.090168166649768, 'bear_atr_min_pct': 0.014808955166902286, 'bear_atr_max_pct': 0.09725224172115049, 'bear_tp_mult': 1.6507956764991976, 'bear_tsl_mult': 0.36078406797877194, 'bear_time_stop': 61, 'bear_use_sma': False, 'bear_use_ema': True, 'bear_use_atr': False, 'bear_use_adx': True, 'bear_use_spike': False, 'bear_rsi_required': True, 'sideways_strategy': 'breakout', 'sideways_bb_std_mult': 2.708107308993681, 'sideways_rsi_os': 15, 'sideways_rsi_ob': 58, 'sideways_adx_thresh': 30.229026200045983, 'sideways_atr_min_pct': 0.012106436930509092, 'sideways_atr_max_pct': 0.12400021928134258, 'sideways_tp_mult': 1.396690085786861, 'sideways_tsl_mult': 0.6922675222531306, 'sideways_time_stop': 59, 'sideways_use_sma': False, 'sideways_use_ema': True, 'sideways_use_atr': True, 'sideways_use_adx': True, 'sideways_use_spike': True, 'sideways_rsi_required': True}.
[I 2025-09-01 02:37:08,290] Trial 91 finished with values: [-1000000000.0, 1000000000.0] and parameters: {'p_sma': 25, 'p_std': 44, 'p_atr': 30, 'p_adx': 9, 'rsi_period': 55, 'ema1': 11, 'ema2': 58, 'slip_atr_k': 0.15811563432793682, 'slip_spread_k': 0.3287007784662707, 'spread_hl_frac': 0.043167985372791956, 'bb_std_mult': 1.0289566643718375, 'rsi_os': 26, 'rsi_ob': 67, 'vol_spike': 0.1595625876220962, 'adx_thresh': 13.531561530648741, 'atr_min_pct': 0.016096455103443395, 'atr_max_pct': 0.12632148073873906, 'tp_mult': 2.026879600150705, 'tsl_mult': 0.8528944924385469, 'strategy': 'mean_reversion', 'time_stop': 269, 'use_sma': False, 'use_atr': True, 'use_adx': True, 'use_ema': True, 'use_spike': False, 'rsi_required': True, 'edge_k': 1.5049591103244881, 'edge_cap': 0.9526710620392771, 'bull_strategy': 'mean_reversion', 'bull_bb_std_mult': 1.2683821714760177, 'bull_rsi_os': 12, 'bull_rsi_ob': 80, 'bull_adx_thresh': 25.03273544768754, 'bull_atr_min_pct': 0.0008710769927542383, 'bull_atr_max_pct': 0.029230261256962, 'bull_tp_mult': 1.7200204963330652, 'bull_tsl_mult': 0.13798556088159591, 'bull_time_stop': 137, 'bull_use_sma': False, 'bull_use_ema': True, 'bull_use_atr': True, 'bull_use_adx': False, 'bull_use_spike': True, 'bull_rsi_required': False, 'bear_strategy': 'mean_reversion', 'bear_bb_std_mult': 2.5867810000792844, 'bear_rsi_os': 39, 'bear_rsi_ob': 93, 'bear_adx_thresh': 17.872972848058126, 'bear_atr_min_pct': 0.014741159645422889, 'bear_atr_max_pct': 0.040329627617995537, 'bear_tp_mult': 2.2773957520258357, 'bear_tsl_mult': 0.933194312865398, 'bear_time_stop': 155, 'bear_use_sma': True, 'bear_use_ema': False, 'bear_use_atr': True, 'bear_use_adx': False, 'bear_use_spike': False, 'bear_rsi_required': True, 'sideways_strategy': 'breakout', 'sideways_bb_std_mult': 2.6950600975492582, 'sideways_rsi_os': 12, 'sideways_rsi_ob': 73, 'sideways_adx_thresh': 9.417527065831674, 'sideways_atr_min_pct': 0.022873285509940694, 'sideways_atr_max_pct': 0.08709787019159354, 'sideways_tp_mult': 2.471489736092597, 'sideways_tsl_mult': 0.7639137733055259, 'sideways_time_stop': 93, 'sideways_use_sma': True, 'sideways_use_ema': False, 'sideways_use_atr': False, 'sideways_use_adx': False, 'sideways_use_spike': False, 'sideways_rsi_required': True}.
