[I 2025-09-01 03:11:35,585] Trial 294 finished with values: [-0.0691879686189617, 0.06930279613420003] and parameters: {'p_sma': 50, 'p_std': 22, 'p_atr': 11, 'p_adx': 16, 'rsi_period': 8, 'ema1': 20, 'ema2': 57, 'slip_atr_k': 0.07440924751882858, 'slip_spread_k': 0.5322813637050585, 'spread_hl_frac': 0.026954722963276046, 'bb_std_mult': 2.59295097025001, 'rsi_os': 19, 'rsi_ob': 70, 'vol_spike': 0.24266355489682395, 'adx_thresh': 10.991828518573918, 'atr_min_pct': 0.01096071475528224, 'atr_max_pct': 0.04688776172483614, 'tp_mult': 1.4223149482656479, 'tsl_mult': 0.3191234699367985, 'strategy': 'mean_reversion', 'time_stop': 209, 'use_sma': False, 'use_atr': False, 'use_adx': True, 'use_ema': False, 'use_spike': True, 'rsi_required': False, 'edge_k': 0.09233474438347361, 'edge_cap': 0.451601994123318, 'bull_strategy': 'breakout', 'bull_bb_std_mult': 0.996602677906292, 'bull_rsi_os': 14, 'bull_rsi_ob': 94, 'bull_adx_thresh': 34.05787058247246, 'bull_atr_min_pct': 0.009015656310854395, 'bull_atr_max_pct': 0.11748234360222856, 'bull_tp_mult': 1.8770293796661732, 'bull_tsl_mult': 0.28070713595539504, 'bull_time_stop': 288, 'bull_use_sma': True, 'bull_use_ema': True, 'bull_use_atr': False, 'bull_use_adx': False, 'bull_use_spike': True, 'bull_rsi_required': False, 'bear_strategy': 'mean_reversion', 'bear_bb_std_mult': 1.5966806396416902, 'bear_rsi_os': 13, 'bear_rsi_ob': 77, 'bear_adx_thresh': 24.183186129416452, 'bear_atr_min_pct': 0.0013373184962934236, 'bear_atr_max_pct': 0.03393260382840681, 'bear_tp_mult': 1.0508925990022793, 'bear_tsl_mult': 0.1846240722721708, 'bear_time_stop': 70, 'bear_use_sma': True, 'bear_use_ema': False, 'bear_use_atr': False, 'bear_use_adx': False, 'bear_use_spike': True, 'bear_rsi_required': True, 'sideways_strategy': 'mean_reversion', 'sideways_bb_std_mult': 1.7595147522906815, 'sideways_rsi_os': 50, 'sideways_rsi_ob': 77, 'sideways_adx_thresh': 19.764936285821225, 'sideways_atr_min_pct': 0.0015835459128247503, 'sideways_atr_max_pct': 0.13034233697110348, 'sideways_tp_mult': 1.6233196827522822, 'sideways_tsl_mult': 0.09712129429127048, 'sideways_time_stop': 108, 'sideways_use_sma': True, 'sideways_use_ema': True, 'sideways_use_atr': True, 'sideways_use_adx': False, 'sideways_use_spike': True, 'sideways_rsi_required': True}.
[I 2025-09-01 03:12:17,694] Trial 300 finished with values: [-1000000000.0, 1000000000.0] and parameters: {'p_sma': 14, 'p_std': 58, 'p_atr': 30, 'p_adx': 12, 'rsi_period': 14, 'ema1': 20, 'ema2': 55, 'slip_atr_k': 0.09310456478386911, 'slip_spread_k': 0.14136394119137033, 'spread_hl_frac': 0.03372276794870917, 'bb_std_mult': 1.2880344198593663, 'rsi_os': 20, 'rsi_ob': 94, 'vol_spike': 0.21573659542132584, 'adx_thresh': 12.73757351194444, 'atr_min_pct': 0.008214634736441283, 'atr_max_pct': 0.05876616023398416, 'tp_mult': 2.661379062847455, 'tsl_mult': 0.9079925948712284, 'strategy': 'mean_reversion', 'time_stop': 81, 'use_sma': False, 'use_atr': False, 'use_adx': True, 'use_ema': False, 'use_spike': True, 'rsi_required': False, 'edge_k': 0.704194583746877, 'edge_cap': 0.5050107122148313, 'bull_strategy': 'breakout', 'bull_bb_std_mult': 1.687222257151008, 'bull_rsi_os': 50, 'bull_rsi_ob': 54, 'bull_adx_thresh': 22.308629823407458, 'bull_atr_min_pct': 0.009064502272640234, 'bull_atr_max_pct': 0.11394144704697416, 'bull_tp_mult': 1.5263100205096936, 'bull_tsl_mult': 0.23412313155050096, 'bull_time_stop': 286, 'bull_use_sma': True, 'bull_use_ema': False, 'bull_use_atr': False, 'bull_use_adx': False, 'bull_use_spike': True, 'bull_rsi_required': False, 'bear_strategy': 'breakout', 'bear_bb_std_mult': 1.208419408096372, 'bear_rsi_os': 52, 'bear_rsi_ob': 51, 'bear_adx_thresh': 25.688988415504365, 'bear_atr_min_pct': 0.02750659557964983, 'bear_atr_max_pct': 0.04298107624666707, 'bear_tp_mult': 1.3337499414165976, 'bear_tsl_mult': 0.24975987082056839, 'bear_time_stop': 21, 'bear_use_sma': False, 'bear_use_ema': False, 'bear_use_atr': True, 'bear_use_adx': False, 'bear_use_spike': True, 'bear_rsi_required': True, 'sideways_strategy': 'breakout', 'sideways_bb_std_mult': 1.931207082838541, 'sideways_rsi_os': 48, 'sideways_rsi_ob': 76, 'sideways_adx_thresh': 19.761384634663035, 'sideways_atr_min_pct': 0.005353015407825243, 'sideways_atr_max_pct': 0.026520645386376204, 'sideways_tp_mult': 2.0581827675936784, 'sideways_tsl_mult': 0.2056142979065682, 'sideways_time_stop': 133, 'sideways_use_sma': True, 'sideways_use_ema': False, 'sideways_use_atr': True, 'sideways_use_adx': False, 'sideways_use_spike': True, 'sideways_rsi_required': True}.
[I 2025-09-01 03:12:18,359] Trial 299 finished with values: [-1000000000.0, 1000000000.0] and parameters: {'p_sma': 24, 'p_std': 58, 'p_atr': 14, 'p_adx': 17, 'rsi_period': 14, 'ema1': 20, 'ema2': 55, 'slip_atr_k': 0.2026330839293795, 'slip_spread_k': 0.13893961716658537, 'spread_hl_frac': 0.034718398742752704, 'bb_std_mult': 2.0010399140725728, 'rsi_os': 20, 'rsi_ob': 70, 'vol_spike': 0.22719459367538283, 'adx_thresh': 5.644020052674244, 'atr_min_pct': 0.004674409566057797, 'atr_max_pct': 0.04658104301743067, 'tp_mult': 2.665606481700646, 'tsl_mult': 0.9060517328598521, 'strategy': 'mean_reversion', 'time_stop': 10, 'use_sma': False, 'use_atr': False, 'use_adx': True, 'use_ema': False, 'use_spike': True, 'rsi_required': False, 'edge_k': 0.0413522870119795, 'edge_cap': 0.3306302679212647, 'bull_strategy': 'breakout', 'bull_bb_std_mult': 2.6892252624567496, 'bull_rsi_os': 51, 'bull_rsi_ob': 51, 'bull_adx_thresh': 22.328544115595513, 'bull_atr_min_pct': 0.0012629885214826637, 'bull_atr_max_pct': 0.10657789676928069, 'bull_tp_mult': 1.6602548653958824, 'bull_tsl_mult': 0.9971220792317732, 'bull_time_stop': 276, 'bull_use_sma': True, 'bull_use_ema': False, 'bull_use_atr': False, 'bull_use_adx': False, 'bull_use_spike': True, 'bull_rsi_required': False, 'bear_strategy': 'breakout', 'bear_bb_std_mult': 1.6023154083861488, 'bear_rsi_os': 52, 'bear_rsi_ob': 52, 'bear_adx_thresh': 25.561664481412308, 'bear_atr_min_pct': 0.027556407474233994, 'bear_atr_max_pct': 0.04218087619964539, 'bear_tp_mult': 1.048046173452042, 'bear_tsl_mult': 0.13462243000755697, 'bear_time_stop': 71, 'bear_use_sma': False, 'bear_use_ema': False, 'bear_use_atr': True, 'bear_use_adx': False, 'bear_use_spike': True, 'bear_rsi_required': True, 'sideways_strategy': 'breakout', 'sideways_bb_std_mult': 1.6090015242249551, 'sideways_rsi_os': 41, 'sideways_rsi_ob': 75, 'sideways_adx_thresh': 19.58131882267738, 'sideways_atr_min_pct': 0.027321290299462446, 'sideways_atr_max_pct': 0.13901252957935917, 'sideways_tp_mult': 1.687754176522445, 'sideways_tsl_mult': 0.16357293493840422, 'sideways_time_stop': 154, 'sideways_use_sma': True, 'sideways_use_ema': False, 'sideways_use_atr': True, 'sideways_use_adx': False, 'sideways_use_spike': True, 'sideways_rsi_required': True}.
[I 2025-09-01 03:12:18,680] Trial 301 finished with values: [-1000000000.0, 1000000000.0] and parameters: {'p_sma': 24, 'p_std': 26, 'p_atr': 19, 'p_adx': 29, 'rsi_period': 14, 'ema1': 12, 'ema2': 54, 'slip_atr_k': 0.028970250371377633, 'slip_spread_k': 0.1376693598876744, 'spread_hl_frac': 0.03444788384483313, 'bb_std_mult': 2.1384555453281506, 'rsi_os': 14, 'rsi_ob': 72, 'vol_spike': 0.22804616408375325, 'adx_thresh': 15.233510081734293, 'atr_min_pct': 0.0010666886912762841, 'atr_max_pct': 0.05869339534381121, 'tp_mult': 2.6495011360441247, 'tsl_mult': 0.9023623556214609, 'strategy': 'mean_reversion', 'time_stop': 161, 'use_sma': False, 'use_atr': False, 'use_adx': True, 'use_ema': True, 'use_spike': True, 'rsi_required': False, 'edge_k': 0.03941584117384066, 'edge_cap': 0.41800028670069844, 'bull_strategy': 'breakout', 'bull_bb_std_mult': 3.363104872262819, 'bull_rsi_os': 27, 'bull_rsi_ob': 88, 'bull_adx_thresh': 22.325392646582678, 'bull_atr_min_pct': 0.005375644771671283, 'bull_atr_max_pct': 0.10794415092836677, 'bull_tp_mult': 2.3849567049490603, 'bull_tsl_mult': 0.7693264088042788, 'bull_time_stop': 259, 'bull_use_sma': True, 'bull_use_ema': False, 'bull_use_atr': False, 'bull_use_adx': False, 'bull_use_spike': True, 'bull_rsi_required': False, 'bear_strategy': 'breakout', 'bear_bb_std_mult': 2.414060957305247, 'bear_rsi_os': 36, 'bear_rsi_ob': 52, 'bear_adx_thresh': 17.463400631694874, 'bear_atr_min_pct': 0.02755669796726937, 'bear_atr_max_pct': 0.04047711282368017, 'bear_tp_mult': 1.0555701217391098, 'bear_tsl_mult': 0.12438949726462564, 'bear_time_stop': 53, 'bear_use_sma': False, 'bear_use_ema': False, 'bear_use_atr': True, 'bear_use_adx': False, 'bear_use_spike': True, 'bear_rsi_required': True, 'sideways_strategy': 'breakout', 'sideways_bb_std_mult': 1.9272905151236797, 'sideways_rsi_os': 41, 'sideways_rsi_ob': 82, 'sideways_adx_thresh': 23.842601656562465, 'sideways_atr_min_pct': 0.026671043119816953, 'sideways_atr_max_pct': 0.1385950034693535, 'sideways_tp_mult': 1.703322732785005, 'sideways_tsl_mult': 0.22351958294361662, 'sideways_time_stop': 133, 'sideways_use_sma': True, 'sideways_use_ema': False, 'sideways_use_atr': True, 'sideways_use_adx': False, 'sideways_use_spike': True, 'sideways_rsi_required': True}.
[I 2025-09-01 03:12:19,211] Trial 298 finished with values: [-1000000000.0, 1000000000.0] and parameters: {'p_sma': 13, 'p_std': 26, 'p_atr': 26, 'p_adx': 29, 'rsi_period': 19, 'ema1': 21, 'ema2': 55, 'slip_atr_k': 0.02941903219220081, 'slip_spread_k': 0.1348295163899051, 'spread_hl_frac': 0.021830542621216104, 'bb_std_mult': 2.677958863283396, 'rsi_os': 20, 'rsi_ob': 88, 'vol_spike': 0.05823242879911761, 'adx_thresh': 16.21478842646807, 'atr_min_pct': 0.00810114146286951, 'atr_max_pct': 0.05540696523176937, 'tp_mult': 2.656329275838863, 'tsl_mult': 0.3647323124554728, 'strategy': 'mean_reversion', 'time_stop': 51, 'use_sma': False, 'use_atr': False, 'use_adx': True, 'use_ema': False, 'use_spike': True, 'rsi_required': False, 'edge_k': 0.1418842039004921, 'edge_cap': 0.42224292484669135, 'bull_strategy': 'breakout', 'bull_bb_std_mult': 2.2801439997829736, 'bull_rsi_os': 14, 'bull_rsi_ob': 54, 'bull_adx_thresh': 25.042280774669955, 'bull_atr_min_pct': 0.005304816808871311, 'bull_atr_max_pct': 0.11402815078016637, 'bull_tp_mult': 1.4987484742731287, 'bull_tsl_mult': 0.1950564652840237, 'bull_time_stop': 259, 'bull_use_sma': True, 'bull_use_ema': True, 'bull_use_atr': False, 'bull_use_adx': False, 'bull_use_spike': True, 'bull_rsi_required': False, 'bear_strategy': 'mean_reversion', 'bear_bb_std_mult': 2.4241988034335424, 'bear_rsi_os': 36, 'bear_rsi_ob': 51, 'bear_adx_thresh': 24.33557974405121, 'bear_atr_min_pct': 0.02793627575627174, 'bear_atr_max_pct': 0.03735297559865218, 'bear_tp_mult': 1.1220553164529699, 'bear_tsl_mult': 0.07528056670917813, 'bear_time_stop': 66, 'bear_use_sma': True, 'bear_use_ema': False, 'bear_use_atr': False, 'bear_use_adx': False, 'bear_use_spike': True, 'bear_rsi_required': True, 'sideways_strategy': 'mean_reversion', 'sideways_bb_std_mult': 1.9800294740352626, 'sideways_rsi_os': 29, 'sideways_rsi_ob': 82, 'sideways_adx_thresh': 19.966154762274147, 'sideways_atr_min_pct': 0.0267617063701955, 'sideways_atr_max_pct': 0.025036786038902657, 'sideways_tp_mult': 2.97537711068887, 'sideways_tsl_mult': 0.09327568996802119, 'sideways_time_stop': 133, 'sideways_use_sma': True, 'sideways_use_ema': True, 'sideways_use_atr': False, 'sideways_use_adx': False, 'sideways_use_spike': True, 'sideways_rsi_required': True}.
[I 2025-09-01 03:12:58,750] Trial 303 finished with values: [-1000000000.0, 1000000000.0] and parameters: {'p_sma': 13, 'p_std': 56, 'p_atr': 26, 'p_adx': 17, 'rsi_period': 10, 'ema1': 21, 'ema2': 40, 'slip_atr_k': 0.029150927545688425, 'slip_spread_k': 0.9995704518417987, 'spread_hl_frac': 0.023821865061142585, 'bb_std_mult': 1.4950446433999693, 'rsi_os': 40, 'rsi_ob': 52, 'vol_spike': 0.01297166474608491, 'adx_thresh': 15.49731137048421, 'atr_min_pct': 0.007834955255927518, 'atr_max_pct': 0.07728545875711239, 'tp_mult': 1.218599543984435, 'tsl_mult': 0.46744193798302286, 'strategy': 'mean_reversion', 'time_stop': 159, 'use_sma': True, 'use_atr': True, 'use_adx': True, 'use_ema': True, 'use_spike': True, 'rsi_required': False, 'edge_k': 1.9607592277815176, 'edge_cap': 0.4197478394553961, 'bull_strategy': 'breakout', 'bull_bb_std_mult': 3.3952133264136757, 'bull_rsi_os': 54, 'bull_rsi_ob': 86, 'bull_adx_thresh': 24.036412932548355, 'bull_atr_min_pct': 0.01653645690568291, 'bull_atr_max_pct': 0.12035516970722378, 'bull_tp_mult': 1.6227182809760587, 'bull_tsl_mult': 0.1943419030782247, 'bull_time_stop': 260, 'bull_use_sma': True, 'bull_use_ema': False, 'bull_use_atr': False, 'bull_use_adx': False, 'bull_use_spike': True, 'bull_rsi_required': False, 'bear_strategy': 'breakout', 'bear_bb_std_mult': 2.264322492558464, 'bear_rsi_os': 36, 'bear_rsi_ob': 59, 'bear_adx_thresh': 31.46583550124562, 'bear_atr_min_pct': 0.028616962332169787, 'bear_atr_max_pct': 0.02600399038844822, 'bear_tp_mult': 1.1171819703850177, 'bear_tsl_mult': 0.12516111816787412, 'bear_time_stop': 191, 'bear_use_sma': False, 'bear_use_ema': True, 'bear_use_atr': False, 'bear_use_adx': False, 'bear_use_spike': True, 'bear_rsi_required': False, 'sideways_strategy': 'breakout', 'sideways_bb_std_mult': 1.8734346981749617, 'sideways_rsi_os': 46, 'sideways_rsi_ob': 57, 'sideways_adx_thresh': 32.04730636287756, 'sideways_atr_min_pct': 0.026460723154159312, 'sideways_atr_max_pct': 0.031892085866228964, 'sideways_tp_mult': 2.6955656899096994, 'sideways_tsl_mult': 0.9708891260154751, 'sideways_time_stop': 133, 'sideways_use_sma': True, 'sideways_use_ema': True, 'sideways_use_atr': True, 'sideways_use_adx': False, 'sideways_use_spike': True, 'sideways_rsi_required': True}.
[I 2025-09-01 03:12:59,150] Trial 302 finished with values: [-1000000000.0, 1000000000.0] and parameters: {'p_sma': 44, 'p_std': 57, 'p_atr': 27, 'p_adx': 17, 'rsi_period': 10, 'ema1': 16, 'ema2': 50, 'slip_atr_k': 0.029700318310939867, 'slip_spread_k': 0.9900723596917125, 'spread_hl_frac': 0.04876779764667888, 'bb_std_mult': 1.5207279408410337, 'rsi_os': 40, 'rsi_ob': 88, 'vol_spike': 0.013424323581057274, 'adx_thresh': 15.564271285394222, 'atr_min_pct': 0.008917991586089177, 'atr_max_pct': 0.07688800067325419, 'tp_mult': 1.1012477483644432, 'tsl_mult': 0.36641988342588444, 'strategy': 'mean_reversion', 'time_stop': 57, 'use_sma': True, 'use_atr': False, 'use_adx': True, 'use_ema': True, 'use_spike': True, 'rsi_required': False, 'edge_k': 1.9472761406947132, 'edge_cap': 0.4182427403969011, 'bull_strategy': 'breakout', 'bull_bb_std_mult': 2.6737392859505302, 'bull_rsi_os': 52, 'bull_rsi_ob': 88, 'bull_adx_thresh': 22.825793469785157, 'bull_atr_min_pct': 0.005765888362403026, 'bull_atr_max_pct': 0.02707008439305207, 'bull_tp_mult': 2.5833522238758104, 'bull_tsl_mult': 0.19512214382344326, 'bull_time_stop': 273, 'bull_use_sma': True, 'bull_use_ema': False, 'bull_use_atr': False, 'bull_use_adx': False, 'bull_use_spike': True, 'bull_rsi_required': False, 'bear_strategy': 'breakout', 'bear_bb_std_mult': 2.416956883106371, 'bear_rsi_os': 26, 'bear_rsi_ob': 59, 'bear_adx_thresh': 22.18355839963673, 'bear_atr_min_pct': 0.027620929491668715, 'bear_atr_max_pct': 0.1140219978287309, 'bear_tp_mult': 1.0787561059091668, 'bear_tsl_mult': 0.06984577731063252, 'bear_time_stop': 52, 'bear_use_sma': False, 'bear_use_ema': False, 'bear_use_atr': False, 'bear_use_adx': False, 'bear_use_spike': True, 'bear_rsi_required': True, 'sideways_strategy': 'breakout', 'sideways_bb_std_mult': 2.5901504095106094, 'sideways_rsi_os': 46, 'sideways_rsi_ob': 75, 'sideways_adx_thresh': 31.854009148918465, 'sideways_atr_min_pct': 0.027438624151590943, 'sideways_atr_max_pct': 0.024058116617107616, 'sideways_tp_mult': 1.6910239771431124, 'sideways_tsl_mult': 0.16038349484173192, 'sideways_time_stop': 247, 'sideways_use_sma': True, 'sideways_use_ema': True, 'sideways_use_atr': True, 'sideways_use_adx': False, 'sideways_use_spike': True, 'sideways_rsi_required': True}.
[I 2025-09-01 03:12:59,811] Trial 305 finished with values: [-1000000000.0, 1000000000.0] and parameters: {'p_sma': 60, 'p_std': 57, 'p_atr': 27, 'p_adx': 26, 'rsi_period': 10, 'ema1': 16, 'ema2': 41, 'slip_atr_k': 0.058103379149634926, 'slip_spread_k': 0.2079939053884356, 'spread_hl_frac': 0.024509689768026345, 'bb_std_mult': 1.5043411113154992, 'rsi_os': 18, 'rsi_ob': 52, 'vol_spike': 0.21012065357674087, 'adx_thresh': 13.678923600527895, 'atr_min_pct': 0.008981712579193307, 'atr_max_pct': 0.07816233617184025, 'tp_mult': 1.2156431470903186, 'tsl_mult': 0.3948847917127653, 'strategy': 'mean_reversion', 'time_stop': 57, 'use_sma': True, 'use_atr': True, 'use_adx': True, 'use_ema': True, 'use_spike': True, 'rsi_required': False, 'edge_k': 1.0047638815493516, 'edge_cap': 0.24002714287117688, 'bull_strategy': 'breakout', 'bull_bb_std_mult': 1.0733760428906598, 'bull_rsi_os': 9, 'bull_rsi_ob': 55, 'bull_adx_thresh': 24.06802488347205, 'bull_atr_min_pct': 0.0012033885822102955, 'bull_atr_max_pct': 0.12145001284094566, 'bull_tp_mult': 2.6003507334263616, 'bull_tsl_mult': 0.9467978148934584, 'bull_time_stop': 20, 'bull_use_sma': True, 'bull_use_ema': False, 'bull_use_atr': False, 'bull_use_adx': True, 'bull_use_spike': True, 'bull_rsi_required': False, 'bear_strategy': 'breakout', 'bear_bb_std_mult': 2.3117510321304504, 'bear_rsi_os': 25, 'bear_rsi_ob': 59, 'bear_adx_thresh': 22.134117641022737, 'bear_atr_min_pct': 0.026757057464144064, 'bear_atr_max_pct': 0.024906654659069587, 'bear_tp_mult': 1.0927927684334895, 'bear_tsl_mult': 0.15927883044545188, 'bear_time_stop': 156, 'bear_use_sma': False, 'bear_use_ema': True, 'bear_use_atr': False, 'bear_use_adx': False, 'bear_use_spike': True, 'bear_rsi_required': False, 'sideways_strategy': 'breakout', 'sideways_bb_std_mult': 1.856216557191108, 'sideways_rsi_os': 46, 'sideways_rsi_ob': 72, 'sideways_adx_thresh': 34.258039834867866, 'sideways_atr_min_pct': 0.027570991362001748, 'sideways_atr_max_pct': 0.05485646526902441, 'sideways_tp_mult': 1.0139329392695597, 'sideways_tsl_mult': 0.12718754243941865, 'sideways_time_stop': 245, 'sideways_use_sma': True, 'sideways_use_ema': True, 'sideways_use_atr': True, 'sideways_use_adx': False, 'sideways_use_spike': True, 'sideways_rsi_required': True}.
[I 2025-09-01 03:13:00,066] Trial 304 finished with values: [-1000000000.0, 1000000000.0] and parameters: {'p_sma': 58, 'p_std': 56, 'p_atr': 26, 'p_adx': 26, 'rsi_period': 10, 'ema1': 10, 'ema2': 40, 'slip_atr_k': 0.03982453926353602, 'slip_spread_k': 0.6028709682440831, 'spread_hl_frac': 0.045750548193704964, 'bb_std_mult': 1.491283579087036, 'rsi_os': 17, 'rsi_ob': 52, 'vol_spike': 0.21109185526537885, 'adx_thresh': 15.853647311635989, 'atr_min_pct': 0.009154212336213587, 'atr_max_pct': 0.07737634033936584, 'tp_mult': 1.2449019282833156, 'tsl_mult': 0.4755804843250534, 'strategy': 'mean_reversion', 'time_stop': 51, 'use_sma': True, 'use_atr': True, 'use_adx': True, 'use_ema': True, 'use_spike': True, 'rsi_required': False, 'edge_k': 0.17876462094943812, 'edge_cap': 0.9950214146707841, 'bull_strategy': 'breakout', 'bull_bb_std_mult': 1.0843344672236288, 'bull_rsi_os': 17, 'bull_rsi_ob': 49, 'bull_adx_thresh': 23.121757068569718, 'bull_atr_min_pct': 0.02514965228378152, 'bull_atr_max_pct': 0.1217759388906566, 'bull_tp_mult': 1.6748266217179837, 'bull_tsl_mult': 0.19526738427979295, 'bull_time_stop': 271, 'bull_use_sma': True, 'bull_use_ema': False, 'bull_use_atr': False, 'bull_use_adx': True, 'bull_use_spike': True, 'bull_rsi_required': False, 'bear_strategy': 'breakout', 'bear_bb_std_mult': 2.2577313546430005, 'bear_rsi_os': 55, 'bear_rsi_ob': 65, 'bear_adx_thresh': 16.546537882546254, 'bear_atr_min_pct': 0.028622457866106454, 'bear_atr_max_pct': 0.026486178325804514, 'bear_tp_mult': 2.2275448869211916, 'bear_tsl_mult': 0.06852522639235148, 'bear_time_stop': 64, 'bear_use_sma': False, 'bear_use_ema': True, 'bear_use_atr': False, 'bear_use_adx': False, 'bear_use_spike': True, 'bear_rsi_required': False, 'sideways_strategy': 'breakout', 'sideways_bb_std_mult': 1.8368978986471316, 'sideways_rsi_os': 24, 'sideways_rsi_ob': 75, 'sideways_adx_thresh': 31.949000339974763, 'sideways_atr_min_pct': 0.02745171388282223, 'sideways_atr_max_pct': 0.03205754418987178, 'sideways_tp_mult': 2.432344565996118, 'sideways_tsl_mult': 0.12458867310129308, 'sideways_time_stop': 122, 'sideways_use_sma': True, 'sideways_use_ema': True, 'sideways_use_atr': True, 'sideways_use_adx': False, 'sideways_use_spike': True, 'sideways_rsi_required': True}.
