[I 2025-09-01 03:04:31,921] Trial 251 finished with values: [-0.03716309717703825, 0.03698512231851466] and parameters: {'p_sma': 56, 'p_std': 10, 'p_atr': 10, 'p_adx': 17, 'rsi_period': 11, 'ema1': 23, 'ema2': 24, 'slip_atr_k': 0.0150582870062375, 'slip_spread_k': 0.10822504782283027, 'spread_hl_frac': 0.03666330503491638, 'bb_std_mult': 2.5496008349157244, 'rsi_os': 23, 'rsi_ob': 74, 'vol_spike': 0.19447736752817468, 'adx_thresh': 11.346981731291347, 'atr_min_pct': 0.006531008167477611, 'atr_max_pct': 0.05270443394983794, 'tp_mult': 2.6352493022944423, 'tsl_mult': 0.4175208411978749, 'strategy': 'mean_reversion', 'time_stop': 176, 'use_sma': True, 'use_atr': True, 'use_adx': True, 'use_ema': True, 'use_spike': False, 'rsi_required': True, 'edge_k': 0.11340421378710899, 'edge_cap': 0.788686476919771, 'bull_strategy': 'breakout', 'bull_bb_std_mult': 1.052351817748072, 'bull_rsi_os': 15, 'bull_rsi_ob': 52, 'bull_adx_thresh': 16.52540594353639, 'bull_atr_min_pct': 0.0005646403559198543, 'bull_atr_max_pct': 0.02790474644355679, 'bull_tp_mult': 1.6118007105794272, 'bull_tsl_mult': 0.22800746819965612, 'bull_time_stop': 270, 'bull_use_sma': True, 'bull_use_ema': False, 'bull_use_atr': True, 'bull_use_adx': True, 'bull_use_spike': True, 'bull_rsi_required': False, 'bear_strategy': 'breakout', 'bear_bb_std_mult': 2.09231923120947, 'bear_rsi_os': 53, 'bear_rsi_ob': 60, 'bear_adx_thresh': 23.55965410837193, 'bear_atr_min_pct': 0.02628768994776176, 'bear_atr_max_pct': 0.028526585144389993, 'bear_tp_mult': 2.7731731543431244, 'bear_tsl_mult': 0.6358779969929627, 'bear_time_stop': 218, 'bear_use_sma': True, 'bear_use_ema': False, 'bear_use_atr': True, 'bear_use_adx': False, 'bear_use_spike': False, 'bear_rsi_required': False, 'sideways_strategy': 'breakout', 'sideways_bb_std_mult': 1.9788724660079133, 'sideways_rsi_os': 53, 'sideways_rsi_ob': 76, 'sideways_adx_thresh': 27.246653883687163, 'sideways_atr_min_pct': 0.0214907926268899, 'sideways_atr_max_pct': 0.030733007318639528, 'sideways_tp_mult': 1.6939303813975284, 'sideways_tsl_mult': 0.16064204170867, 'sideways_time_stop': 119, 'sideways_use_sma': True, 'sideways_use_ema': False, 'sideways_use_atr': True, 'sideways_use_adx': False, 'sideways_use_spike': False, 'sideways_rsi_required': True}.
[I 2025-09-01 03:05:13,549] Trial 253 finished with values: [-0.02118338086078675, 0.020983289800806798] and parameters: {'p_sma': 56, 'p_std': 31, 'p_atr': 29, 'p_adx': 17, 'rsi_period': 17, 'ema1': 22, 'ema2': 17, 'slip_atr_k': 0.0212747620858796, 'slip_spread_k': 0.08201027539240574, 'spread_hl_frac': 0.024635709956850545, 'bb_std_mult': 2.537261332120279, 'rsi_os': 21, 'rsi_ob': 74, 'vol_spike': 0.20942077961657607, 'adx_thresh': 16.580338561875934, 'atr_min_pct': 0.007776000412466277, 'atr_max_pct': 0.05333912756965212, 'tp_mult': 2.6252229050177296, 'tsl_mult': 0.9532943397230111, 'strategy': 'mean_reversion', 'time_stop': 188, 'use_sma': True, 'use_atr': False, 'use_adx': True, 'use_ema': False, 'use_spike': False, 'rsi_required': True, 'edge_k': 0.07384572840607603, 'edge_cap': 0.8772858441253835, 'bull_strategy': 'breakout', 'bull_bb_std_mult': 1.0684723769842548, 'bull_rsi_os': 29, 'bull_rsi_ob': 52, 'bull_adx_thresh': 21.51432207025186, 'bull_atr_min_pct': 0.0012502449215893371, 'bull_atr_max_pct': 0.038753207942068636, 'bull_tp_mult': 1.251986095058904, 'bull_tsl_mult': 0.1774066307783883, 'bull_time_stop': 300, 'bull_use_sma': True, 'bull_use_ema': False, 'bull_use_atr': True, 'bull_use_adx': True, 'bull_use_spike': True, 'bull_rsi_required': False, 'bear_strategy': 'breakout', 'bear_bb_std_mult': 3.2438217150019613, 'bear_rsi_os': 53, 'bear_rsi_ob': 59, 'bear_adx_thresh': 28.515827183159082, 'bear_atr_min_pct': 0.026201657196909006, 'bear_atr_max_pct': 0.010453315886130408, 'bear_tp_mult': 1.0470893863639623, 'bear_tsl_mult': 0.6198783668558424, 'bear_time_stop': 72, 'bear_use_sma': False, 'bear_use_ema': False, 'bear_use_atr': False, 'bear_use_adx': False, 'bear_use_spike': True, 'bear_rsi_required': False, 'sideways_strategy': 'breakout', 'sideways_bb_std_mult': 0.9945824517695907, 'sideways_rsi_os': 51, 'sideways_rsi_ob': 73, 'sideways_adx_thresh': 34.91782689938049, 'sideways_atr_min_pct': 0.025067645082062634, 'sideways_atr_max_pct': 0.02590664947248729, 'sideways_tp_mult': 1.6106762330292659, 'sideways_tsl_mult': 0.4012112124083133, 'sideways_time_stop': 13, 'sideways_use_sma': True, 'sideways_use_ema': True, 'sideways_use_atr': True, 'sideways_use_adx': False, 'sideways_use_spike': False, 'sideways_rsi_required': True}.
[I 2025-09-01 03:05:14,181] Trial 256 finished with values: [-1000000000.0, 1000000000.0] and parameters: {'p_sma': 28, 'p_std': 58, 'p_atr': 16, 'p_adx': 17, 'rsi_period': 26, 'ema1': 22, 'ema2': 41, 'slip_atr_k': 0.03148842097457738, 'slip_spread_k': 0.16336287900393112, 'spread_hl_frac': 0.031731793233109706, 'bb_std_mult': 2.35692880905407, 'rsi_os': 19, 'rsi_ob': 53, 'vol_spike': 0.06449314490106814, 'adx_thresh': 16.863866432969665, 'atr_min_pct': 0.007850095553550838, 'atr_max_pct': 0.14206827988114779, 'tp_mult': 2.6245373794428146, 'tsl_mult': 0.3373169296790025, 'strategy': 'mean_reversion', 'time_stop': 202, 'use_sma': False, 'use_atr': False, 'use_adx': True, 'use_ema': False, 'use_spike': True, 'rsi_required': False, 'edge_k': 0.033139669071385595, 'edge_cap': 0.4816411357370298, 'bull_strategy': 'breakout', 'bull_bb_std_mult': 1.1893275552393694, 'bull_rsi_os': 17, 'bull_rsi_ob': 55, 'bull_adx_thresh': 9.901252241388372, 'bull_atr_min_pct': 0.014722706386985225, 'bull_atr_max_pct': 0.11734673214232388, 'bull_tp_mult': 1.809691508885763, 'bull_tsl_mult': 0.2886915103656438, 'bull_time_stop': 252, 'bull_use_sma': True, 'bull_use_ema': True, 'bull_use_atr': False, 'bull_use_adx': False, 'bull_use_spike': True, 'bull_rsi_required': False, 'bear_strategy': 'mean_reversion', 'bear_bb_std_mult': 1.3926588530405006, 'bear_rsi_os': 55, 'bear_rsi_ob': 56, 'bear_adx_thresh': 8.989839202452117, 'bear_atr_min_pct': 0.02767475528589658, 'bear_atr_max_pct': 0.02602792673858777, 'bear_tp_mult': 1.1278358064242442, 'bear_tsl_mult': 0.1508852861626752, 'bear_time_stop': 177, 'bear_use_sma': False, 'bear_use_ema': False, 'bear_use_atr': False, 'bear_use_adx': False, 'bear_use_spike': True, 'bear_rsi_required': True, 'sideways_strategy': 'breakout', 'sideways_bb_std_mult': 1.7143649141445194, 'sideways_rsi_os': 39, 'sideways_rsi_ob': 64, 'sideways_adx_thresh': 14.874392261614439, 'sideways_atr_min_pct': 0.028381494372390664, 'sideways_atr_max_pct': 0.02173717721019427, 'sideways_tp_mult': 1.523620665148738, 'sideways_tsl_mult': 0.10792130234087287, 'sideways_time_stop': 138, 'sideways_use_sma': True, 'sideways_use_ema': True, 'sideways_use_atr': False, 'sideways_use_adx': False, 'sideways_use_spike': True, 'sideways_rsi_required': True}.
[I 2025-09-01 03:05:14,770] Trial 254 finished with values: [-1000000000.0, 1000000000.0] and parameters: {'p_sma': 28, 'p_std': 58, 'p_atr': 29, 'p_adx': 21, 'rsi_period': 17, 'ema1': 22, 'ema2': 58, 'slip_atr_k': 0.02043735080583213, 'slip_spread_k': 0.10748679816281412, 'spread_hl_frac': 0.024630291990335146, 'bb_std_mult': 2.525481951735195, 'rsi_os': 17, 'rsi_ob': 95, 'vol_spike': 0.2155250002815263, 'adx_thresh': 11.169220163369474, 'atr_min_pct': 0.029717947973371187, 'atr_max_pct': 0.07464783423923164, 'tp_mult': 2.995375538264403, 'tsl_mult': 0.45493869312224117, 'strategy': 'mean_reversion', 'time_stop': 191, 'use_sma': False, 'use_atr': False, 'use_adx': True, 'use_ema': False, 'use_spike': True, 'rsi_required': False, 'edge_k': 0.04860894619296313, 'edge_cap': 0.4750303318108227, 'bull_strategy': 'breakout', 'bull_bb_std_mult': 1.178848761441068, 'bull_rsi_os': 46, 'bull_rsi_ob': 55, 'bull_adx_thresh': 6.684228034175025, 'bull_atr_min_pct': 0.001032718240305973, 'bull_atr_max_pct': 0.11807991405941136, 'bull_tp_mult': 1.816527381537387, 'bull_tsl_mult': 0.2894645746338294, 'bull_time_stop': 297, 'bull_use_sma': True, 'bull_use_ema': True, 'bull_use_atr': False, 'bull_use_adx': False, 'bull_use_spike': True, 'bull_rsi_required': False, 'bear_strategy': 'breakout', 'bear_bb_std_mult': 3.181368837237576, 'bear_rsi_os': 50, 'bear_rsi_ob': 56, 'bear_adx_thresh': 24.379862912235726, 'bear_atr_min_pct': 0.027815419258598553, 'bear_atr_max_pct': 0.020782700139621295, 'bear_tp_mult': 1.9508641184796618, 'bear_tsl_mult': 0.22080546437279908, 'bear_time_stop': 241, 'bear_use_sma': True, 'bear_use_ema': False, 'bear_use_atr': False, 'bear_use_adx': False, 'bear_use_spike': True, 'bear_rsi_required': True, 'sideways_strategy': 'breakout', 'sideways_bb_std_mult': 1.0082514341917979, 'sideways_rsi_os': 40, 'sideways_rsi_ob': 73, 'sideways_adx_thresh': 23.819579655130465, 'sideways_atr_min_pct': 0.028420875030740766, 'sideways_atr_max_pct': 0.019468976697224406, 'sideways_tp_mult': 1.8597955013369663, 'sideways_tsl_mult': 0.14303789600898353, 'sideways_time_stop': 119, 'sideways_use_sma': True, 'sideways_use_ema': True, 'sideways_use_atr': True, 'sideways_use_adx': False, 'sideways_use_spike': True, 'sideways_rsi_required': True}.
[I 2025-09-01 03:05:14,977] Trial 255 finished with values: [-1000000000.0, 1000000000.0] and parameters: {'p_sma': 36, 'p_std': 58, 'p_atr': 12, 'p_adx': 21, 'rsi_period': 15, 'ema1': 22, 'ema2': 58, 'slip_atr_k': 0.07932870309684081, 'slip_spread_k': 0.1094890532869635, 'spread_hl_frac': 0.032075984303909004, 'bb_std_mult': 2.0932526485663487, 'rsi_os': 21, 'rsi_ob': 74, 'vol_spike': 0.2099627581015637, 'adx_thresh': 16.642596542847237, 'atr_min_pct': 0.029623121837514997, 'atr_max_pct': 0.056066011027548095, 'tp_mult': 2.6296945562354166, 'tsl_mult': 0.45045991245639644, 'strategy': 'mean_reversion', 'time_stop': 120, 'use_sma': False, 'use_atr': False, 'use_adx': True, 'use_ema': False, 'use_spike': True, 'rsi_required': False, 'edge_k': 0.0353469329844269, 'edge_cap': 0.8862596345176779, 'bull_strategy': 'breakout', 'bull_bb_std_mult': 1.1771017352376656, 'bull_rsi_os': 26, 'bull_rsi_ob': 55, 'bull_adx_thresh': 12.094807460203606, 'bull_atr_min_pct': 0.018486829660910652, 'bull_atr_max_pct': 0.11758678606564052, 'bull_tp_mult': 1.5985717008873728, 'bull_tsl_mult': 0.19197852378458435, 'bull_time_stop': 300, 'bull_use_sma': True, 'bull_use_ema': True, 'bull_use_atr': False, 'bull_use_adx': False, 'bull_use_spike': True, 'bull_rsi_required': False, 'bear_strategy': 'breakout', 'bear_bb_std_mult': 0.803849483030066, 'bear_rsi_os': 51, 'bear_rsi_ob': 56, 'bear_adx_thresh': 5.595129027120397, 'bear_atr_min_pct': 0.02751584256569066, 'bear_atr_max_pct': 0.026495822062688665, 'bear_tp_mult': 1.1233920126590986, 'bear_tsl_mult': 0.21654503878586243, 'bear_time_stop': 95, 'bear_use_sma': True, 'bear_use_ema': False, 'bear_use_atr': False, 'bear_use_adx': False, 'bear_use_spike': True, 'bear_rsi_required': True, 'sideways_strategy': 'breakout', 'sideways_bb_std_mult': 1.7835894020703413, 'sideways_rsi_os': 40, 'sideways_rsi_ob': 73, 'sideways_adx_thresh': 23.252683272974206, 'sideways_atr_min_pct': 0.021766722341888204, 'sideways_atr_max_pct': 0.0507277973795322, 'sideways_tp_mult': 1.6984192847418964, 'sideways_tsl_mult': 0.8500463209345566, 'sideways_time_stop': 180, 'sideways_use_sma': True, 'sideways_use_ema': True, 'sideways_use_atr': True, 'sideways_use_adx': False, 'sideways_use_spike': True, 'sideways_rsi_required': True}.
[I 2025-09-01 03:05:57,239] Trial 260 finished with values: [-1000000000.0, 1000000000.0] and parameters: {'p_sma': 37, 'p_std': 56, 'p_atr': 18, 'p_adx': 16, 'rsi_period': 13, 'ema1': 17, 'ema2': 53, 'slip_atr_k': 0.09818160935574871, 'slip_spread_k': 0.7103030002212392, 'spread_hl_frac': 0.029921529912834203, 'bb_std_mult': 1.9390461371311465, 'rsi_os': 21, 'rsi_ob': 76, 'vol_spike': 0.2995328466023415, 'adx_thresh': 19.73893283182111, 'atr_min_pct': 0.009102787915375951, 'atr_max_pct': 0.12272619948762226, 'tp_mult': 2.7838847466695507, 'tsl_mult': 0.9463394997869694, 'strategy': 'mean_reversion', 'time_stop': 155, 'use_sma': False, 'use_atr': False, 'use_adx': True, 'use_ema': False, 'use_spike': True, 'rsi_required': False, 'edge_k': 0.16629313611272606, 'edge_cap': 0.43161116599093385, 'bull_strategy': 'breakout', 'bull_bb_std_mult': 0.9758106887360356, 'bull_rsi_os': 29, 'bull_rsi_ob': 53, 'bull_adx_thresh': 21.85104403297915, 'bull_atr_min_pct': 0.002435169869201643, 'bull_atr_max_pct': 0.015543638432205145, 'bull_tp_mult': 2.956227272799685, 'bull_tsl_mult': 0.1686633488010307, 'bull_time_stop': 257, 'bull_use_sma': True, 'bull_use_ema': False, 'bull_use_atr': False, 'bull_use_adx': False, 'bull_use_spike': True, 'bull_rsi_required': False, 'bear_strategy': 'breakout', 'bear_bb_std_mult': 2.2802230902551828, 'bear_rsi_os': 52, 'bear_rsi_ob': 52, 'bear_adx_thresh': 7.765592744094725, 'bear_atr_min_pct': 0.025113700003058265, 'bear_atr_max_pct': 0.01912585911891153, 'bear_tp_mult': 1.0672673611765315, 'bear_tsl_mult': 0.13525684792528342, 'bear_time_stop': 164, 'bear_use_sma': False, 'bear_use_ema': False, 'bear_use_atr': False, 'bear_use_adx': False, 'bear_use_spike': True, 'bear_rsi_required': True, 'sideways_strategy': 'breakout', 'sideways_bb_std_mult': 1.3670768857651798, 'sideways_rsi_os': 51, 'sideways_rsi_ob': 53, 'sideways_adx_thresh': 25.805201290875406, 'sideways_atr_min_pct': 0.024971238129545534, 'sideways_atr_max_pct': 0.02667527908810257, 'sideways_tp_mult': 1.728768772470165, 'sideways_tsl_mult': 0.22773572009823223, 'sideways_time_stop': 127, 'sideways_use_sma': True, 'sideways_use_ema': True, 'sideways_use_atr': True, 'sideways_use_adx': False, 'sideways_use_spike': True, 'sideways_rsi_required': True}.
[I 2025-09-01 03:05:57,600] Trial 258 finished with values: [-0.03305540097024606, 0.03266229100678502] and parameters: {'p_sma': 37, 'p_std': 31, 'p_atr': 12, 'p_adx': 22, 'rsi_period': 17, 'ema1': 21, 'ema2': 58, 'slip_atr_k': 0.021184683784791526, 'slip_spread_k': 0.8957366229836319, 'spread_hl_frac': 0.030093698488931304, 'bb_std_mult': 2.2398291050233134, 'rsi_os': 21, 'rsi_ob': 95, 'vol_spike': 0.20992731144346613, 'adx_thresh': 19.721624245223587, 'atr_min_pct': 0.007054474578757686, 'atr_max_pct': 0.056436238885327644, 'tp_mult': 2.7717533770407283, 'tsl_mult': 0.4519618438210387, 'strategy': 'mean_reversion', 'time_stop': 170, 'use_sma': False, 'use_atr': False, 'use_adx': True, 'use_ema': False, 'use_spike': True, 'rsi_required': False, 'edge_k': 0.18353227593222105, 'edge_cap': 0.8811822473941557, 'bull_strategy': 'breakout', 'bull_bb_std_mult': 0.9929355757519915, 'bull_rsi_os': 26, 'bull_rsi_ob': 53, 'bull_adx_thresh': 7.23530746530815, 'bull_atr_min_pct': 0.018420044799342315, 'bull_atr_max_pct': 0.1086196324555316, 'bull_tp_mult': 2.2439991676048403, 'bull_tsl_mult': 0.1839371220697655, 'bull_time_stop': 300, 'bull_use_sma': True, 'bull_use_ema': True, 'bull_use_atr': False, 'bull_use_adx': False, 'bull_use_spike': True, 'bull_rsi_required': False, 'bear_strategy': 'breakout', 'bear_bb_std_mult': 2.143145426880033, 'bear_rsi_os': 51, 'bear_rsi_ob': 78, 'bear_adx_thresh': 5.812257500575459, 'bear_atr_min_pct': 0.0042592663969542865, 'bear_atr_max_pct': 0.09063508088675692, 'bear_tp_mult': 1.0625901719370674, 'bear_tsl_mult': 0.5257478803232176, 'bear_time_stop': 240, 'bear_use_sma': False, 'bear_use_ema': False, 'bear_use_atr': False, 'bear_use_adx': False, 'bear_use_spike': True, 'bear_rsi_required': True, 'sideways_strategy': 'breakout', 'sideways_bb_std_mult': 2.5398971655692195, 'sideways_rsi_os': 49, 'sideways_rsi_ob': 73, 'sideways_adx_thresh': 34.84568883008316, 'sideways_atr_min_pct': 0.02741028338593806, 'sideways_atr_max_pct': 0.026671322807193285, 'sideways_tp_mult': 1.7115627875347164, 'sideways_tsl_mult': 0.22733447434555648, 'sideways_time_stop': 126, 'sideways_use_sma': True, 'sideways_use_ema': True, 'sideways_use_atr': True, 'sideways_use_adx': False, 'sideways_use_spike': True, 'sideways_rsi_required': True}.
[I 2025-09-01 03:05:57,852] Trial 257 finished with values: [-1000000000.0, 1000000000.0] and parameters: {'p_sma': 28, 'p_std': 58, 'p_atr': 19, 'p_adx': 27, 'rsi_period': 26, 'ema1': 21, 'ema2': 10, 'slip_atr_k': 0.07959228265447375, 'slip_spread_k': 0.046973995948992, 'spread_hl_frac': 0.025221215922331397, 'bb_std_mult': 1.0720518551198492, 'rsi_os': 21, 'rsi_ob': 93, 'vol_spike': 0.20922064388911668, 'adx_thresh': 17.443530147483642, 'atr_min_pct': 0.029680709900190803, 'atr_max_pct': 0.05689359852274384, 'tp_mult': 2.614534668275998, 'tsl_mult': 0.9437490066998412, 'strategy': 'mean_reversion', 'time_stop': 156, 'use_sma': False, 'use_atr': False, 'use_adx': True, 'use_ema': False, 'use_spike': True, 'rsi_required': False, 'edge_k': 0.031269170612449555, 'edge_cap': 0.6888945433130286, 'bull_strategy': 'breakout', 'bull_bb_std_mult': 1.1833410051934559, 'bull_rsi_os': 17, 'bull_rsi_ob': 55, 'bull_adx_thresh': 21.651555401651525, 'bull_atr_min_pct': 0.002477962412425307, 'bull_atr_max_pct': 0.013869627737909049, 'bull_tp_mult': 1.8142715429685772, 'bull_tsl_mult': 0.3004940265234746, 'bull_time_stop': 300, 'bull_use_sma': True, 'bull_use_ema': True, 'bull_use_atr': False, 'bull_use_adx': False, 'bull_use_spike': True, 'bull_rsi_required': False, 'bear_strategy': 'breakout', 'bear_bb_std_mult': 0.7482811941738232, 'bear_rsi_os': 55, 'bear_rsi_ob': 81, 'bear_adx_thresh': 15.231211667065498, 'bear_atr_min_pct': 0.02791892343586856, 'bear_atr_max_pct': 0.03925091845828517, 'bear_tp_mult': 2.6960371594005927, 'bear_tsl_mult': 0.22402485937874922, 'bear_time_stop': 74, 'bear_use_sma': False, 'bear_use_ema': False, 'bear_use_atr': False, 'bear_use_adx': False, 'bear_use_spike': True, 'bear_rsi_required': True, 'sideways_strategy': 'breakout', 'sideways_bb_std_mult': 1.7036873789720364, 'sideways_rsi_os': 51, 'sideways_rsi_ob': 73, 'sideways_adx_thresh': 34.850303451709344, 'sideways_atr_min_pct': 0.027488152993653116, 'sideways_atr_max_pct': 0.022451065256251002, 'sideways_tp_mult': 1.6591584864786937, 'sideways_tsl_mult': 0.9626697720673196, 'sideways_time_stop': 209, 'sideways_use_sma': True, 'sideways_use_ema': True, 'sideways_use_atr': True, 'sideways_use_adx': False, 'sideways_use_spike': True, 'sideways_rsi_required': True}.
[I 2025-09-01 03:05:58,184] Trial 259 finished with values: [-0.03984005052658923, 0.039036630298294794] and parameters: {'p_sma': 36, 'p_std': 31, 'p_atr': 28, 'p_adx': 12, 'rsi_period': 14, 'ema1': 17, 'ema2': 10, 'slip_atr_k': 0.0983985100076927, 'slip_spread_k': 0.12557770108884686, 'spread_hl_frac': 0.02115842202912386, 'bb_std_mult': 0.9697225960911708, 'rsi_os': 21, 'rsi_ob': 90, 'vol_spike': 0.21130167187810614, 'adx_thresh': 16.363263271670334, 'atr_min_pct': 0.007154766018841419, 'atr_max_pct': 0.05753499783160098, 'tp_mult': 2.7721261349555717, 'tsl_mult': 0.3863428777629603, 'strategy': 'mean_reversion', 'time_stop': 155, 'use_sma': False, 'use_atr': False, 'use_adx': True, 'use_ema': False, 'use_spike': True, 'rsi_required': False, 'edge_k': 0.17518953495993445, 'edge_cap': 0.4228736999122801, 'bull_strategy': 'breakout', 'bull_bb_std_mult': 3.470271768338164, 'bull_rsi_os': 43, 'bull_rsi_ob': 53, 'bull_adx_thresh': 24.176853108935884, 'bull_atr_min_pct': 0.0024929742628145898, 'bull_atr_max_pct': 0.039688796361662206, 'bull_tp_mult': 1.6537679853889033, 'bull_tsl_mult': 0.16884362540633358, 'bull_time_stop': 283, 'bull_use_sma': True, 'bull_use_ema': False, 'bull_use_atr': False, 'bull_use_adx': False, 'bull_use_spike': True, 'bull_rsi_required': False, 'bear_strategy': 'breakout', 'bear_bb_std_mult': 1.753889242953656, 'bear_rsi_os': 52, 'bear_rsi_ob': 61, 'bear_adx_thresh': 25.056127018642773, 'bear_atr_min_pct': 0.004367163814614579, 'bear_atr_max_pct': 0.012506879682213451, 'bear_tp_mult': 1.0107239514897646, 'bear_tsl_mult': 0.5124721855797096, 'bear_time_stop': 163, 'bear_use_sma': False, 'bear_use_ema': False, 'bear_use_atr': False, 'bear_use_adx': False, 'bear_use_spike': True, 'bear_rsi_required': True, 'sideways_strategy': 'breakout', 'sideways_bb_std_mult': 1.0918100314019648, 'sideways_rsi_os': 49, 'sideways_rsi_ob': 73, 'sideways_adx_thresh': 25.663876528242593, 'sideways_atr_min_pct': 0.02743237660342209, 'sideways_atr_max_pct': 0.025414757472934715, 'sideways_tp_mult': 1.705391476767657, 'sideways_tsl_mult': 0.2276814650805072, 'sideways_time_stop': 207, 'sideways_use_sma': True, 'sideways_use_ema': True, 'sideways_use_atr': True, 'sideways_use_adx': False, 'sideways_use_spike': True, 'sideways_rsi_required': True}.
