[I 2025-09-01 03:43:36,083] Trial 486 finished with values: [-0.016107441895066188, 0.015968508079065094] and parameters: {'p_sma': 17, 'p_std': 52, 'p_atr': 25, 'p_adx': 11, 'rsi_period': 7, 'ema1': 14, 'ema2': 51, 'slip_atr_k': 0.004654010295143646, 'slip_spread_k': 0.038846939497739714, 'spread_hl_frac': 0.04295570441509276, 'bb_std_mult': 2.5617060418134443, 'rsi_os': 44, 'rsi_ob': 80, 'vol_spike': 0.18185022066210138, 'adx_thresh': 13.787610655045329, 'atr_min_pct': 0.011060983331980129, 'atr_max_pct': 0.050431949678282566, 'tp_mult': 2.561762885183228, 'tsl_mult': 0.3079209856679704, 'strategy': 'mean_reversion', 'time_stop': 86, 'use_sma': False, 'use_atr': False, 'use_adx': True, 'use_ema': False, 'use_spike': True, 'rsi_required': False, 'edge_k': 0.2595638531347364, 'edge_cap': 0.253750737325208, 'bull_strategy': 'breakout', 'bull_bb_std_mult': 0.8157630496476118, 'bull_rsi_os': 7, 'bull_rsi_ob': 80, 'bull_adx_thresh': 8.066414570932135, 'bull_atr_min_pct': 3.985870329266792e-05, 'bull_atr_max_pct': 0.10376933784735973, 'bull_tp_mult': 1.4407810261458112, 'bull_tsl_mult': 0.27034549682481773, 'bull_time_stop': 300, 'bull_use_sma': True, 'bull_use_ema': False, 'bull_use_atr': False, 'bull_use_adx': True, 'bull_use_spike': False, 'bull_rsi_required': True, 'bear_strategy': 'breakout', 'bear_bb_std_mult': 3.1988458852051016, 'bear_rsi_os': 47, 'bear_rsi_ob': 69, 'bear_adx_thresh': 32.99833523984604, 'bear_atr_min_pct': 0.007267039564688994, 'bear_atr_max_pct': 0.06017790565167705, 'bear_tp_mult': 2.941232240700649, 'bear_tsl_mult': 0.059672198635615986, 'bear_time_stop': 291, 'bear_use_sma': True, 'bear_use_ema': False, 'bear_use_atr': False, 'bear_use_adx': False, 'bear_use_spike': True, 'bear_rsi_required': True, 'sideways_strategy': 'breakout', 'sideways_bb_std_mult': 3.599624357919625, 'sideways_rsi_os': 8, 'sideways_rsi_ob': 59, 'sideways_adx_thresh': 31.15816637026399, 'sideways_atr_min_pct': 0.022991471723470904, 'sideways_atr_max_pct': 0.10467224509346094, 'sideways_tp_mult': 1.9510410960488407, 'sideways_tsl_mult': 0.659549831517355, 'sideways_time_stop': 158, 'sideways_use_sma': False, 'sideways_use_ema': True, 'sideways_use_atr': False, 'sideways_use_adx': False, 'sideways_use_spike': True, 'sideways_rsi_required': True}.
[I 2025-09-01 03:44:21,147] Trial 490 finished with values: [-0.016142664063460654, 0.016003589067499092] and parameters: {'p_sma': 17, 'p_std': 53, 'p_atr': 25, 'p_adx': 11, 'rsi_period': 7, 'ema1': 14, 'ema2': 51, 'slip_atr_k': 0.004974683173421403, 'slip_spread_k': 0.042343283833823506, 'spread_hl_frac': 0.042262560204405726, 'bb_std_mult': 2.550908372801216, 'rsi_os': 44, 'rsi_ob': 80, 'vol_spike': 0.1801123619250402, 'adx_thresh': 13.851710522934507, 'atr_min_pct': 0.010450861402911116, 'atr_max_pct': 0.045958541441530915, 'tp_mult': 2.542752311862153, 'tsl_mult': 0.2604730852526158, 'strategy': 'mean_reversion', 'time_stop': 88, 'use_sma': False, 'use_atr': False, 'use_adx': True, 'use_ema': False, 'use_spike': True, 'rsi_required': False, 'edge_k': 0.23505130951700404, 'edge_cap': 0.25758567834863344, 'bull_strategy': 'breakout', 'bull_bb_std_mult': 0.7792939291628279, 'bull_rsi_os': 7, 'bull_rsi_ob': 80, 'bull_adx_thresh': 8.022060475958265, 'bull_atr_min_pct': 4.2208948371561634e-05, 'bull_atr_max_pct': 0.10430405341581019, 'bull_tp_mult': 1.4360437305563218, 'bull_tsl_mult': 0.26392028388937816, 'bull_time_stop': 299, 'bull_use_sma': True, 'bull_use_ema': False, 'bull_use_atr': False, 'bull_use_adx': True, 'bull_use_spike': False, 'bull_rsi_required': True, 'bear_strategy': 'breakout', 'bear_bb_std_mult': 3.203731836255549, 'bear_rsi_os': 47, 'bear_rsi_ob': 68, 'bear_adx_thresh': 32.49017001596717, 'bear_atr_min_pct': 0.007524354320571631, 'bear_atr_max_pct': 0.05483239627777641, 'bear_tp_mult': 2.932743222288905, 'bear_tsl_mult': 0.017894877132071774, 'bear_time_stop': 293, 'bear_use_sma': True, 'bear_use_ema': False, 'bear_use_atr': False, 'bear_use_adx': False, 'bear_use_spike': True, 'bear_rsi_required': True, 'sideways_strategy': 'mean_reversion', 'sideways_bb_std_mult': 3.5931225782550156, 'sideways_rsi_os': 7, 'sideways_rsi_ob': 59, 'sideways_adx_thresh': 31.236644681569963, 'sideways_atr_min_pct': 0.02292125058004548, 'sideways_atr_max_pct': 0.1065360525834865, 'sideways_tp_mult': 1.946085248269926, 'sideways_tsl_mult': 0.7226063390378673, 'sideways_time_stop': 158, 'sideways_use_sma': False, 'sideways_use_ema': True, 'sideways_use_atr': False, 'sideways_use_adx': False, 'sideways_use_spike': True, 'sideways_rsi_required': True}.
[I 2025-09-01 03:44:21,559] Trial 488 finished with values: [-0.01599145945044833, 0.01585325402900098] and parameters: {'p_sma': 17, 'p_std': 52, 'p_atr': 25, 'p_adx': 11, 'rsi_period': 8, 'ema1': 14, 'ema2': 52, 'slip_atr_k': 0.002993032006160064, 'slip_spread_k': 0.025080686701839466, 'spread_hl_frac': 0.042622039502541356, 'bb_std_mult': 2.561487488424403, 'rsi_os': 44, 'rsi_ob': 80, 'vol_spike': 0.1813335084706667, 'adx_thresh': 13.883648463000618, 'atr_min_pct': 0.010830181351511826, 'atr_max_pct': 0.04558534994200827, 'tp_mult': 2.5336487567464565, 'tsl_mult': 0.30315444914000944, 'strategy': 'mean_reversion', 'time_stop': 87, 'use_sma': False, 'use_atr': False, 'use_adx': True, 'use_ema': False, 'use_spike': True, 'rsi_required': False, 'edge_k': 0.2483041433329919, 'edge_cap': 0.2497787245812296, 'bull_strategy': 'breakout', 'bull_bb_std_mult': 0.823839095668538, 'bull_rsi_os': 8, 'bull_rsi_ob': 80, 'bull_adx_thresh': 8.051748742839886, 'bull_atr_min_pct': 0.0001732792281652723, 'bull_atr_max_pct': 0.1040455821879816, 'bull_tp_mult': 1.3931229099171607, 'bull_tsl_mult': 0.26062121503853347, 'bull_time_stop': 299, 'bull_use_sma': True, 'bull_use_ema': False, 'bull_use_atr': False, 'bull_use_adx': True, 'bull_use_spike': False, 'bull_rsi_required': True, 'bear_strategy': 'breakout', 'bear_bb_std_mult': 3.2117762123110962, 'bear_rsi_os': 47, 'bear_rsi_ob': 68, 'bear_adx_thresh': 32.77103458304478, 'bear_atr_min_pct': 0.007406700654707177, 'bear_atr_max_pct': 0.05445254380640063, 'bear_tp_mult': 2.950630854719822, 'bear_tsl_mult': 0.05470195705456109, 'bear_time_stop': 293, 'bear_use_sma': True, 'bear_use_ema': False, 'bear_use_atr': False, 'bear_use_adx': False, 'bear_use_spike': True, 'bear_rsi_required': True, 'sideways_strategy': 'breakout', 'sideways_bb_std_mult': 3.5832170855948604, 'sideways_rsi_os': 7, 'sideways_rsi_ob': 58, 'sideways_adx_thresh': 30.811315714031714, 'sideways_atr_min_pct': 0.023093235403580107, 'sideways_atr_max_pct': 0.10684825206117105, 'sideways_tp_mult': 1.9392015670651106, 'sideways_tsl_mult': 0.7168609844111644, 'sideways_time_stop': 158, 'sideways_use_sma': False, 'sideways_use_ema': True, 'sideways_use_atr': False, 'sideways_use_adx': False, 'sideways_use_spike': True, 'sideways_rsi_required': False}.
[I 2025-09-01 03:44:21,818] Trial 487 finished with values: [-0.0170211609587666, 0.016882666773743643] and parameters: {'p_sma': 17, 'p_std': 53, 'p_atr': 25, 'p_adx': 11, 'rsi_period': 7, 'ema1': 14, 'ema2': 51, 'slip_atr_k': 0.0046180376856674865, 'slip_spread_k': 0.022915230144488832, 'spread_hl_frac': 0.042485747540038955, 'bb_std_mult': 2.5795613800846002, 'rsi_os': 43, 'rsi_ob': 80, 'vol_spike': 0.18354750119727795, 'adx_thresh': 14.005004551352814, 'atr_min_pct': 0.011333198389715466, 'atr_max_pct': 0.11583669962000119, 'tp_mult': 2.541606228593646, 'tsl_mult': 0.3040066355539926, 'strategy': 'mean_reversion', 'time_stop': 87, 'use_sma': False, 'use_atr': False, 'use_adx': True, 'use_ema': False, 'use_spike': True, 'rsi_required': False, 'edge_k': 0.2534284819233644, 'edge_cap': 0.2628464069279381, 'bull_strategy': 'breakout', 'bull_bb_std_mult': 0.7734554520715192, 'bull_rsi_os': 8, 'bull_rsi_ob': 80, 'bull_adx_thresh': 8.064166711492623, 'bull_atr_min_pct': 0.000164638961124138, 'bull_atr_max_pct': 0.10304235965803624, 'bull_tp_mult': 1.425070772771099, 'bull_tsl_mult': 0.2623067955247275, 'bull_time_stop': 296, 'bull_use_sma': True, 'bull_use_ema': False, 'bull_use_atr': False, 'bull_use_adx': True, 'bull_use_spike': False, 'bull_rsi_required': True, 'bear_strategy': 'breakout', 'bear_bb_std_mult': 3.205111130886401, 'bear_rsi_os': 47, 'bear_rsi_ob': 68, 'bear_adx_thresh': 32.667644619048104, 'bear_atr_min_pct': 0.007711491591476136, 'bear_atr_max_pct': 0.056062825686457804, 'bear_tp_mult': 2.9362761207747905, 'bear_tsl_mult': 0.053432996311653554, 'bear_time_stop': 292, 'bear_use_sma': True, 'bear_use_ema': False, 'bear_use_atr': False, 'bear_use_adx': False, 'bear_use_spike': True, 'bear_rsi_required': False, 'sideways_strategy': 'breakout', 'sideways_bb_std_mult': 3.5658565177563517, 'sideways_rsi_os': 8, 'sideways_rsi_ob': 59, 'sideways_adx_thresh': 30.39068200687303, 'sideways_atr_min_pct': 0.023140960366574537, 'sideways_atr_max_pct': 0.10689905334115352, 'sideways_tp_mult': 1.961025898748929, 'sideways_tsl_mult': 0.7195697299966397, 'sideways_time_stop': 161, 'sideways_use_sma': False, 'sideways_use_ema': True, 'sideways_use_atr': False, 'sideways_use_adx': False, 'sideways_use_spike': True, 'sideways_rsi_required': False}.
[I 2025-09-01 03:44:22,040] Trial 489 finished with values: [-0.016082259914890873, 0.01594348137506648] and parameters: {'p_sma': 17, 'p_std': 52, 'p_atr': 25, 'p_adx': 11, 'rsi_period': 7, 'ema1': 14, 'ema2': 52, 'slip_atr_k': 0.004362079973440228, 'slip_spread_k': 0.035056622012183056, 'spread_hl_frac': 0.04276326717511624, 'bb_std_mult': 2.566983358326055, 'rsi_os': 44, 'rsi_ob': 80, 'vol_spike': 0.1830999064948517, 'adx_thresh': 14.034275273129262, 'atr_min_pct': 0.011028367604752664, 'atr_max_pct': 0.04605170617065256, 'tp_mult': 2.528600192274911, 'tsl_mult': 0.30754428357524055, 'strategy': 'mean_reversion', 'time_stop': 87, 'use_sma': False, 'use_atr': False, 'use_adx': True, 'use_ema': False, 'use_spike': True, 'rsi_required': False, 'edge_k': 0.24589662794630426, 'edge_cap': 0.2497443116290426, 'bull_strategy': 'breakout', 'bull_bb_std_mult': 0.7364751480412932, 'bull_rsi_os': 8, 'bull_rsi_ob': 80, 'bull_adx_thresh': 7.975724083831526, 'bull_atr_min_pct': 0.00017551001953623155, 'bull_atr_max_pct': 0.1025207881218616, 'bull_tp_mult': 1.4259821535665054, 'bull_tsl_mult': 0.25829096636876236, 'bull_time_stop': 296, 'bull_use_sma': True, 'bull_use_ema': False, 'bull_use_atr': False, 'bull_use_adx': True, 'bull_use_spike': False, 'bull_rsi_required': True, 'bear_strategy': 'breakout', 'bear_bb_std_mult': 3.1981889491110467, 'bear_rsi_os': 47, 'bear_rsi_ob': 69, 'bear_adx_thresh': 32.835098819307845, 'bear_atr_min_pct': 0.007371826044478352, 'bear_atr_max_pct': 0.05397428478042096, 'bear_tp_mult': 2.9416392631454062, 'bear_tsl_mult': 0.045451020837127265, 'bear_time_stop': 286, 'bear_use_sma': True, 'bear_use_ema': False, 'bear_use_atr': False, 'bear_use_adx': False, 'bear_use_spike': True, 'bear_rsi_required': True, 'sideways_strategy': 'breakout', 'sideways_bb_std_mult': 3.5976818520545737, 'sideways_rsi_os': 7, 'sideways_rsi_ob': 59, 'sideways_adx_thresh': 31.224555435547476, 'sideways_atr_min_pct': 0.023370947093987956, 'sideways_atr_max_pct': 0.10616243613912382, 'sideways_tp_mult': 1.9402036765795827, 'sideways_tsl_mult': 0.7172518232509958, 'sideways_time_stop': 159, 'sideways_use_sma': False, 'sideways_use_ema': True, 'sideways_use_atr': False, 'sideways_use_adx': False, 'sideways_use_spike': True, 'sideways_rsi_required': False}.
[I 2025-09-01 03:45:03,218] Trial 494 finished with values: [-0.016966456858154344, 0.0167825293586651] and parameters: {'p_sma': 18, 'p_std': 52, 'p_atr': 25, 'p_adx': 11, 'rsi_period': 8, 'ema1': 13, 'ema2': 51, 'slip_atr_k': 0.004106993262296964, 'slip_spread_k': 0.0249587437827394, 'spread_hl_frac': 0.042784579419197284, 'bb_std_mult': 2.555375132799473, 'rsi_os': 44, 'rsi_ob': 80, 'vol_spike': 0.1840877381370572, 'adx_thresh': 13.902559297906965, 'atr_min_pct': 0.01055255819572979, 'atr_max_pct': 0.13598775873241215, 'tp_mult': 2.556973258145096, 'tsl_mult': 0.3058741885444034, 'strategy': 'mean_reversion', 'time_stop': 86, 'use_sma': False, 'use_atr': False, 'use_adx': True, 'use_ema': False, 'use_spike': True, 'rsi_required': False, 'edge_k': 0.2522447263424866, 'edge_cap': 0.24639045829202738, 'bull_strategy': 'breakout', 'bull_bb_std_mult': 0.8061786600047383, 'bull_rsi_os': 7, 'bull_rsi_ob': 80, 'bull_adx_thresh': 8.107053861425442, 'bull_atr_min_pct': 0.00016444901976838452, 'bull_atr_max_pct': 0.10307513399198248, 'bull_tp_mult': 1.4191977661141868, 'bull_tsl_mult': 0.260008258616649, 'bull_time_stop': 297, 'bull_use_sma': True, 'bull_use_ema': False, 'bull_use_atr': False, 'bull_use_adx': True, 'bull_use_spike': False, 'bull_rsi_required': True, 'bear_strategy': 'breakout', 'bear_bb_std_mult': 3.2228561659652857, 'bear_rsi_os': 47, 'bear_rsi_ob': 68, 'bear_adx_thresh': 32.83751515685542, 'bear_atr_min_pct': 0.007744151142025772, 'bear_atr_max_pct': 0.05442399822056148, 'bear_tp_mult': 2.952660034110397, 'bear_tsl_mult': 0.05177851645809539, 'bear_time_stop': 293, 'bear_use_sma': True, 'bear_use_ema': False, 'bear_use_atr': False, 'bear_use_adx': False, 'bear_use_spike': True, 'bear_rsi_required': True, 'sideways_strategy': 'mean_reversion', 'sideways_bb_std_mult': 3.56945956950334, 'sideways_rsi_os': 7, 'sideways_rsi_ob': 59, 'sideways_adx_thresh': 31.450175145981714, 'sideways_atr_min_pct': 0.02343176247995923, 'sideways_atr_max_pct': 0.10626785198780372, 'sideways_tp_mult': 1.9411793469807357, 'sideways_tsl_mult': 0.7130314734670179, 'sideways_time_stop': 159, 'sideways_use_sma': False, 'sideways_use_ema': True, 'sideways_use_atr': False, 'sideways_use_adx': False, 'sideways_use_spike': True, 'sideways_rsi_required': False}.
[I 2025-09-01 03:45:03,542] Trial 491 finished with values: [-0.016068469764054294, 0.015929875342456466] and parameters: {'p_sma': 17, 'p_std': 53, 'p_atr': 25, 'p_adx': 11, 'rsi_period': 7, 'ema1': 14, 'ema2': 51, 'slip_atr_k': 0.0037919483377226305, 'slip_spread_k': 0.03476630813937864, 'spread_hl_frac': 0.04184537421590838, 'bb_std_mult': 2.548243449151056, 'rsi_os': 43, 'rsi_ob': 80, 'vol_spike': 0.1817043425270216, 'adx_thresh': 14.146247487156243, 'atr_min_pct': 0.0109839356216562, 'atr_max_pct': 0.016768590247211196, 'tp_mult': 2.583276179423717, 'tsl_mult': 0.30227435987549084, 'strategy': 'mean_reversion', 'time_stop': 88, 'use_sma': False, 'use_atr': False, 'use_adx': True, 'use_ema': False, 'use_spike': True, 'rsi_required': False, 'edge_k': 0.25804149646529634, 'edge_cap': 0.2517363550069539, 'bull_strategy': 'breakout', 'bull_bb_std_mult': 0.7513763863972251, 'bull_rsi_os': 7, 'bull_rsi_ob': 80, 'bull_adx_thresh': 7.929255365253235, 'bull_atr_min_pct': 1.8184421024973898e-05, 'bull_atr_max_pct': 0.10377527334419913, 'bull_tp_mult': 1.4540000490428806, 'bull_tsl_mult': 0.25043016333873147, 'bull_time_stop': 300, 'bull_use_sma': True, 'bull_use_ema': False, 'bull_use_atr': False, 'bull_use_adx': True, 'bull_use_spike': False, 'bull_rsi_required': True, 'bear_strategy': 'breakout', 'bear_bb_std_mult': 3.180563555076171, 'bear_rsi_os': 46, 'bear_rsi_ob': 68, 'bear_adx_thresh': 32.67703554953495, 'bear_atr_min_pct': 0.007342384662455055, 'bear_atr_max_pct': 0.05501155865793526, 'bear_tp_mult': 2.9391160673864816, 'bear_tsl_mult': 0.053892192567494515, 'bear_time_stop': 292, 'bear_use_sma': True, 'bear_use_ema': False, 'bear_use_atr': False, 'bear_use_adx': False, 'bear_use_spike': True, 'bear_rsi_required': True, 'sideways_strategy': 'mean_reversion', 'sideways_bb_std_mult': 3.4629796054006974, 'sideways_rsi_os': 6, 'sideways_rsi_ob': 59, 'sideways_adx_thresh': 31.364751424957632, 'sideways_atr_min_pct': 0.02301954574450501, 'sideways_atr_max_pct': 0.10506827430464416, 'sideways_tp_mult': 1.9447792407392648, 'sideways_tsl_mult': 0.7178338873450976, 'sideways_time_stop': 158, 'sideways_use_sma': False, 'sideways_use_ema': True, 'sideways_use_atr': False, 'sideways_use_adx': False, 'sideways_use_spike': True, 'sideways_rsi_required': True}.
[I 2025-09-01 03:45:04,162] Trial 492 finished with values: [-0.016434091653433236, 0.016295399541522593] and parameters: {'p_sma': 17, 'p_std': 53, 'p_atr': 25, 'p_adx': 11, 'rsi_period': 7, 'ema1': 14, 'ema2': 51, 'slip_atr_k': 0.004402718449710497, 'slip_spread_k': 0.03223087321090532, 'spread_hl_frac': 0.0430303798640219, 'bb_std_mult': 2.5658458919653704, 'rsi_os': 44, 'rsi_ob': 80, 'vol_spike': 0.18206457222069897, 'adx_thresh': 13.899836998925942, 'atr_min_pct': 0.010927566235559722, 'atr_max_pct': 0.08369521831134949, 'tp_mult': 2.549525727721868, 'tsl_mult': 0.26523132244131903, 'strategy': 'mean_reversion', 'time_stop': 82, 'use_sma': False, 'use_atr': False, 'use_adx': True, 'use_ema': False, 'use_spike': True, 'rsi_required': False, 'edge_k': 0.2585669126660797, 'edge_cap': 0.24850208409037966, 'bull_strategy': 'breakout', 'bull_bb_std_mult': 0.7418231642612572, 'bull_rsi_os': 7, 'bull_rsi_ob': 80, 'bull_adx_thresh': 7.940069923288674, 'bull_atr_min_pct': 3.3784189150947496e-05, 'bull_atr_max_pct': 0.10330789297730264, 'bull_tp_mult': 1.3970646750598874, 'bull_tsl_mult': 0.2629309599214622, 'bull_time_stop': 296, 'bull_use_sma': True, 'bull_use_ema': False, 'bull_use_atr': False, 'bull_use_adx': True, 'bull_use_spike': False, 'bull_rsi_required': True, 'bear_strategy': 'breakout', 'bear_bb_std_mult': 3.1914609353084806, 'bear_rsi_os': 47, 'bear_rsi_ob': 68, 'bear_adx_thresh': 32.86722707455888, 'bear_atr_min_pct': 0.00762021385335001, 'bear_atr_max_pct': 0.05538171539324456, 'bear_tp_mult': 2.9224069308284033, 'bear_tsl_mult': 0.05839179904451437, 'bear_time_stop': 293, 'bear_use_sma': True, 'bear_use_ema': False, 'bear_use_atr': False, 'bear_use_adx': False, 'bear_use_spike': True, 'bear_rsi_required': True, 'sideways_strategy': 'mean_reversion', 'sideways_bb_std_mult': 3.5732434829571864, 'sideways_rsi_os': 8, 'sideways_rsi_ob': 59, 'sideways_adx_thresh': 31.32425267534024, 'sideways_atr_min_pct': 0.02346914981671492, 'sideways_atr_max_pct': 0.10607469018706903, 'sideways_tp_mult': 1.9578690014111966, 'sideways_tsl_mult': 0.7151508646810053, 'sideways_time_stop': 160, 'sideways_use_sma': False, 'sideways_use_ema': True, 'sideways_use_atr': False, 'sideways_use_adx': False, 'sideways_use_spike': True, 'sideways_rsi_required': False}.
[I 2025-09-01 03:45:04,701] Trial 493 finished with values: [-0.016059161904306007, 0.015874792256766145] and parameters: {'p_sma': 18, 'p_std': 52, 'p_atr': 25, 'p_adx': 11, 'rsi_period': 7, 'ema1': 14, 'ema2': 51, 'slip_atr_k': 0.004317703093679682, 'slip_spread_k': 0.03671161624419382, 'spread_hl_frac': 0.04310283593311194, 'bb_std_mult': 2.565866634875765, 'rsi_os': 42, 'rsi_ob': 80, 'vol_spike': 0.18084271398133012, 'adx_thresh': 14.068924648460097, 'atr_min_pct': 0.010918573158749221, 'atr_max_pct': 0.046182954208910304, 'tp_mult': 2.557657463239392, 'tsl_mult': 0.3140817014930236, 'strategy': 'mean_reversion', 'time_stop': 87, 'use_sma': False, 'use_atr': False, 'use_adx': True, 'use_ema': False, 'use_spike': True, 'rsi_required': False, 'edge_k': 0.2604737297398534, 'edge_cap': 0.2518226213149069, 'bull_strategy': 'breakout', 'bull_bb_std_mult': 0.7967056606234268, 'bull_rsi_os': 8, 'bull_rsi_ob': 80, 'bull_adx_thresh': 8.03004401486609, 'bull_atr_min_pct': 1.5592387219031466e-05, 'bull_atr_max_pct': 0.10487188927192792, 'bull_tp_mult': 1.4214361169388072, 'bull_tsl_mult': 0.25983747518716976, 'bull_time_stop': 300, 'bull_use_sma': True, 'bull_use_ema': False, 'bull_use_atr': False, 'bull_use_adx': True, 'bull_use_spike': False, 'bull_rsi_required': True, 'bear_strategy': 'breakout', 'bear_bb_std_mult': 3.202803025122496, 'bear_rsi_os': 47, 'bear_rsi_ob': 68, 'bear_adx_thresh': 32.8258924375721, 'bear_atr_min_pct': 0.007442339998656176, 'bear_atr_max_pct': 0.0551477107602072, 'bear_tp_mult': 2.9413961515755482, 'bear_tsl_mult': 0.05259413625472173, 'bear_time_stop': 286, 'bear_use_sma': True, 'bear_use_ema': False, 'bear_use_atr': False, 'bear_use_adx': False, 'bear_use_spike': True, 'bear_rsi_required': True, 'sideways_strategy': 'mean_reversion', 'sideways_bb_std_mult': 3.5870839897260938, 'sideways_rsi_os': 7, 'sideways_rsi_ob': 59, 'sideways_adx_thresh': 30.951102146033254, 'sideways_atr_min_pct': 0.02340881257023271, 'sideways_atr_max_pct': 0.10441532101882027, 'sideways_tp_mult': 1.9527813242789975, 'sideways_tsl_mult': 0.7144253373595277, 'sideways_time_stop': 157, 'sideways_use_sma': False, 'sideways_use_ema': True, 'sideways_use_atr': False, 'sideways_use_adx': False, 'sideways_use_spike': True, 'sideways_rsi_required': False}.
