[I 2025-09-01 03:50:28,304] Trial 520 finished with values: [-1000000000.0, 1000000000.0] and parameters: {'p_sma': 15, 'p_std': 52, 'p_atr': 25, 'p_adx': 11, 'rsi_period': 9, 'ema1': 12, 'ema2': 51, 'slip_atr_k': 0.007052548593866399, 'slip_spread_k': 0.051304416473492695, 'spread_hl_frac': 0.0439866470490222, 'bb_std_mult': 2.400014708097469, 'rsi_os': 43, 'rsi_ob': 79, 'vol_spike': 0.18849411881400788, 'adx_thresh': 14.042324461874982, 'atr_min_pct': 0.009914550943457149, 'atr_max_pct': 0.03831291950179024, 'tp_mult': 2.523630799191495, 'tsl_mult': 0.287215512203557, 'strategy': 'breakout', 'time_stop': 73, 'use_sma': True, 'use_atr': False, 'use_adx': False, 'use_ema': True, 'use_spike': False, 'rsi_required': True, 'edge_k': 0.5284751995553786, 'edge_cap': 0.25770292124862926, 'bull_strategy': 'mean_reversion', 'bull_bb_std_mult': 0.603862957227983, 'bull_rsi_os': 6, 'bull_rsi_ob': 78, 'bull_adx_thresh': 8.609479199663065, 'bull_atr_min_pct': 0.027239739677532366, 'bull_atr_max_pct': 0.10847131229260763, 'bull_tp_mult': 1.4548886908791907, 'bull_tsl_mult': 0.27262617193881267, 'bull_time_stop': 291, 'bull_use_sma': False, 'bull_use_ema': True, 'bull_use_atr': True, 'bull_use_adx': True, 'bull_use_spike': False, 'bull_rsi_required': True, 'bear_strategy': 'mean_reversion', 'bear_bb_std_mult': 3.4136182968015523, 'bear_rsi_os': 46, 'bear_rsi_ob': 81, 'bear_adx_thresh': 33.335785589363, 'bear_atr_min_pct': 0.008467556900404214, 'bear_atr_max_pct': 0.04881567265930541, 'bear_tp_mult': 2.8583197373412426, 'bear_tsl_mult': 0.04422659796274275, 'bear_time_stop': 271, 'bear_use_sma': True, 'bear_use_ema': True, 'bear_use_atr': True, 'bear_use_adx': True, 'bear_use_spike': True, 'bear_rsi_required': False, 'sideways_strategy': 'breakout', 'sideways_bb_std_mult': 3.524971947608514, 'sideways_rsi_os': 10, 'sideways_rsi_ob': 59, 'sideways_adx_thresh': 30.88120421029882, 'sideways_atr_min_pct': 0.02290457536531064, 'sideways_atr_max_pct': 0.10703453853878353, 'sideways_tp_mult': 1.9188075772038324, 'sideways_tsl_mult': 0.7003099178532671, 'sideways_time_stop': 153, 'sideways_use_sma': False, 'sideways_use_ema': False, 'sideways_use_atr': False, 'sideways_use_adx': True, 'sideways_use_spike': False, 'sideways_rsi_required': False}.
[I 2025-09-01 03:51:07,799] Trial 523 finished with values: [-1000000000.0, 1000000000.0] and parameters: {'p_sma': 17, 'p_std': 52, 'p_atr': 25, 'p_adx': 11, 'rsi_period': 9, 'ema1': 13, 'ema2': 51, 'slip_atr_k': 0.0003857931419803521, 'slip_spread_k': 0.014439881650508218, 'spread_hl_frac': 0.04250015055192868, 'bb_std_mult': 2.433204470099012, 'rsi_os': 43, 'rsi_ob': 80, 'vol_spike': 0.19491002973664948, 'adx_thresh': 13.894988506700175, 'atr_min_pct': 0.01104228648560859, 'atr_max_pct': 0.08917834821191253, 'tp_mult': 2.456197416238104, 'tsl_mult': 0.29102673920078787, 'strategy': 'mean_reversion', 'time_stop': 84, 'use_sma': True, 'use_atr': False, 'use_adx': False, 'use_ema': True, 'use_spike': False, 'rsi_required': True, 'edge_k': 0.2251393787948513, 'edge_cap': 0.2531509062785015, 'bull_strategy': 'mean_reversion', 'bull_bb_std_mult': 0.6060675389887261, 'bull_rsi_os': 6, 'bull_rsi_ob': 78, 'bull_adx_thresh': 7.766190605781202, 'bull_atr_min_pct': 0.0008085235009067687, 'bull_atr_max_pct': 0.10944230212526829, 'bull_tp_mult': 1.4400064321503026, 'bull_tsl_mult': 0.6393979084956596, 'bull_time_stop': 292, 'bull_use_sma': False, 'bull_use_ema': True, 'bull_use_atr': True, 'bull_use_adx': True, 'bull_use_spike': False, 'bull_rsi_required': True, 'bear_strategy': 'mean_reversion', 'bear_bb_std_mult': 3.392957400679945, 'bear_rsi_os': 46, 'bear_rsi_ob': 79, 'bear_adx_thresh': 34.87773819455505, 'bear_atr_min_pct': 0.009175205235540329, 'bear_atr_max_pct': 0.04908142924211425, 'bear_tp_mult': 2.9020104445106236, 'bear_tsl_mult': 0.044118070671607446, 'bear_time_stop': 281, 'bear_use_sma': True, 'bear_use_ema': True, 'bear_use_atr': True, 'bear_use_adx': True, 'bear_use_spike': False, 'bear_rsi_required': False, 'sideways_strategy': 'mean_reversion', 'sideways_bb_std_mult': 3.3278615086407495, 'sideways_rsi_os': 10, 'sideways_rsi_ob': 59, 'sideways_adx_thresh': 31.657001417941313, 'sideways_atr_min_pct': 0.022967253862018908, 'sideways_atr_max_pct': 0.10356016845868088, 'sideways_tp_mult': 1.8979124937148135, 'sideways_tsl_mult': 0.7477583989130807, 'sideways_time_stop': 158, 'sideways_use_sma': False, 'sideways_use_ema': False, 'sideways_use_atr': False, 'sideways_use_adx': True, 'sideways_use_spike': False, 'sideways_rsi_required': True}.
[I 2025-09-01 03:51:09,304] Trial 525 finished with values: [-1000000000.0, 1000000000.0] and parameters: {'p_sma': 18, 'p_std': 52, 'p_atr': 25, 'p_adx': 12, 'rsi_period': 8, 'ema1': 13, 'ema2': 52, 'slip_atr_k': 0.0001295008875141703, 'slip_spread_k': 0.0029118766189959386, 'spread_hl_frac': 0.04274971840213309, 'bb_std_mult': 2.223636684087382, 'rsi_os': 44, 'rsi_ob': 78, 'vol_spike': 0.19504098890216232, 'adx_thresh': 14.197476494980176, 'atr_min_pct': 0.0109048443588775, 'atr_max_pct': 0.12747453890172306, 'tp_mult': 2.4579013291412806, 'tsl_mult': 0.3251163684685591, 'strategy': 'mean_reversion', 'time_stop': 101, 'use_sma': True, 'use_atr': True, 'use_adx': False, 'use_ema': True, 'use_spike': False, 'rsi_required': True, 'edge_k': 0.3858326348261284, 'edge_cap': 0.23633327309286595, 'bull_strategy': 'mean_reversion', 'bull_bb_std_mult': 0.8146627513895061, 'bull_rsi_os': 7, 'bull_rsi_ob': 76, 'bull_adx_thresh': 9.834241970029469, 'bull_atr_min_pct': 0.024970375938725843, 'bull_atr_max_pct': 0.10550127011257107, 'bull_tp_mult': 1.42959464490254, 'bull_tsl_mult': 0.9021843581863683, 'bull_time_stop': 290, 'bull_use_sma': False, 'bull_use_ema': False, 'bull_use_atr': True, 'bull_use_adx': True, 'bull_use_spike': False, 'bull_rsi_required': True, 'bear_strategy': 'mean_reversion', 'bear_bb_std_mult': 3.31690157188441, 'bear_rsi_os': 45, 'bear_rsi_ob': 50, 'bear_adx_thresh': 34.96074568272811, 'bear_atr_min_pct': 0.007997045459312494, 'bear_atr_max_pct': 0.056548644276737337, 'bear_tp_mult': 2.9129735521637827, 'bear_tsl_mult': 0.0472833570896442, 'bear_time_stop': 281, 'bear_use_sma': True, 'bear_use_ema': True, 'bear_use_atr': True, 'bear_use_adx': True, 'bear_use_spike': False, 'bear_rsi_required': False, 'sideways_strategy': 'breakout', 'sideways_bb_std_mult': 3.4110654370662443, 'sideways_rsi_os': 7, 'sideways_rsi_ob': 58, 'sideways_adx_thresh': 31.563715551813452, 'sideways_atr_min_pct': 0.024112687243161762, 'sideways_atr_max_pct': 0.11196927511611904, 'sideways_tp_mult': 1.9096337993435628, 'sideways_tsl_mult': 0.6494616473776706, 'sideways_time_stop': 152, 'sideways_use_sma': False, 'sideways_use_ema': False, 'sideways_use_atr': False, 'sideways_use_adx': False, 'sideways_use_spike': False, 'sideways_rsi_required': True}.
[I 2025-09-01 03:51:10,080] Trial 524 finished with values: [-1000000000.0, 1000000000.0] and parameters: {'p_sma': 15, 'p_std': 52, 'p_atr': 25, 'p_adx': 11, 'rsi_period': 8, 'ema1': 13, 'ema2': 52, 'slip_atr_k': 0.0002556478280979265, 'slip_spread_k': 0.062048855197236186, 'spread_hl_frac': 0.0426005334278267, 'bb_std_mult': 2.441327087205215, 'rsi_os': 44, 'rsi_ob': 78, 'vol_spike': 0.19439834603810255, 'adx_thresh': 13.97717346131789, 'atr_min_pct': 0.009709298592642981, 'atr_max_pct': 0.037678040037460114, 'tp_mult': 2.544053114544541, 'tsl_mult': 0.3265344230163038, 'strategy': 'mean_reversion', 'time_stop': 84, 'use_sma': True, 'use_atr': False, 'use_adx': False, 'use_ema': True, 'use_spike': False, 'rsi_required': True, 'edge_k': 0.39600077970125824, 'edge_cap': 0.247571910267451, 'bull_strategy': 'mean_reversion', 'bull_bb_std_mult': 0.6257985301588713, 'bull_rsi_os': 6, 'bull_rsi_ob': 78, 'bull_adx_thresh': 9.996276012905522, 'bull_atr_min_pct': 0.02740246409023825, 'bull_atr_max_pct': 0.10945074392316287, 'bull_tp_mult': 1.433928041908096, 'bull_tsl_mult': 0.7815120150500994, 'bull_time_stop': 292, 'bull_use_sma': False, 'bull_use_ema': False, 'bull_use_atr': True, 'bull_use_adx': True, 'bull_use_spike': False, 'bull_rsi_required': True, 'bear_strategy': 'mean_reversion', 'bear_bb_std_mult': 3.3210071315198424, 'bear_rsi_os': 46, 'bear_rsi_ob': 81, 'bear_adx_thresh': 34.858063253758175, 'bear_atr_min_pct': 0.008216134572090339, 'bear_atr_max_pct': 0.04966488037012854, 'bear_tp_mult': 2.853755460675001, 'bear_tsl_mult': 0.04195500278473415, 'bear_time_stop': 281, 'bear_use_sma': True, 'bear_use_ema': True, 'bear_use_atr': True, 'bear_use_adx': True, 'bear_use_spike': True, 'bear_rsi_required': False, 'sideways_strategy': 'breakout', 'sideways_bb_std_mult': 3.5181322714454866, 'sideways_rsi_os': 10, 'sideways_rsi_ob': 58, 'sideways_adx_thresh': 31.84875127236662, 'sideways_atr_min_pct': 0.022414879423568224, 'sideways_atr_max_pct': 0.10409533732746674, 'sideways_tp_mult': 1.940502933899941, 'sideways_tsl_mult': 0.7526981531219876, 'sideways_time_stop': 148, 'sideways_use_sma': False, 'sideways_use_ema': False, 'sideways_use_atr': False, 'sideways_use_adx': False, 'sideways_use_spike': False, 'sideways_rsi_required': True}.
[I 2025-09-01 03:51:10,500] Trial 526 finished with values: [-0.014477772463473815, 0.014373602533330912] and parameters: {'p_sma': 18, 'p_std': 51, 'p_atr': 25, 'p_adx': 12, 'rsi_period': 8, 'ema1': 13, 'ema2': 52, 'slip_atr_k': 0.000947218564818077, 'slip_spread_k': 0.0013180744368066002, 'spread_hl_frac': 0.04264972256473114, 'bb_std_mult': 2.4537064045656245, 'rsi_os': 44, 'rsi_ob': 78, 'vol_spike': 0.1958934738607635, 'adx_thresh': 14.329729536307319, 'atr_min_pct': 0.010889146218672536, 'atr_max_pct': 0.050318510043640394, 'tp_mult': 2.437952926960298, 'tsl_mult': 0.3254058280156994, 'strategy': 'mean_reversion', 'time_stop': 100, 'use_sma': True, 'use_atr': True, 'use_adx': False, 'use_ema': True, 'use_spike': False, 'rsi_required': True, 'edge_k': 0.2168685007966136, 'edge_cap': 0.23401974960837513, 'bull_strategy': 'mean_reversion', 'bull_bb_std_mult': 0.8115488530799836, 'bull_rsi_os': 7, 'bull_rsi_ob': 77, 'bull_adx_thresh': 7.748668578871089, 'bull_atr_min_pct': 0.0008212370702570769, 'bull_atr_max_pct': 0.10415663150050361, 'bull_tp_mult': 1.4304226039316943, 'bull_tsl_mult': 0.32459841316546345, 'bull_time_stop': 300, 'bull_use_sma': False, 'bull_use_ema': False, 'bull_use_atr': True, 'bull_use_adx': True, 'bull_use_spike': False, 'bull_rsi_required': True, 'bear_strategy': 'mean_reversion', 'bear_bb_std_mult': 3.296103279901857, 'bear_rsi_os': 45, 'bear_rsi_ob': 50, 'bear_adx_thresh': 34.54872249828944, 'bear_atr_min_pct': 0.008156109916396936, 'bear_atr_max_pct': 0.056567206921517385, 'bear_tp_mult': 2.949738124710272, 'bear_tsl_mult': 0.04337330253911627, 'bear_time_stop': 279, 'bear_use_sma': True, 'bear_use_ema': True, 'bear_use_atr': True, 'bear_use_adx': True, 'bear_use_spike': False, 'bear_rsi_required': False, 'sideways_strategy': 'breakout', 'sideways_bb_std_mult': 3.404352714075635, 'sideways_rsi_os': 7, 'sideways_rsi_ob': 58, 'sideways_adx_thresh': 31.60895593628619, 'sideways_atr_min_pct': 0.02387044390240906, 'sideways_atr_max_pct': 0.1125875204535298, 'sideways_tp_mult': 1.917129649975284, 'sideways_tsl_mult': 0.7568097763643054, 'sideways_time_stop': 147, 'sideways_use_sma': False, 'sideways_use_ema': False, 'sideways_use_atr': False, 'sideways_use_adx': False, 'sideways_use_spike': False, 'sideways_rsi_required': True}.
[I 2025-09-01 03:51:50,786] Trial 528 finished with values: [-1000000000.0, 1000000000.0] and parameters: {'p_sma': 17, 'p_std': 50, 'p_atr': 24, 'p_adx': 10, 'rsi_period': 10, 'ema1': 13, 'ema2': 52, 'slip_atr_k': 0.006662647848556353, 'slip_spread_k': 0.05832137799696463, 'spread_hl_frac': 0.045369366428032125, 'bb_std_mult': 2.467604650547803, 'rsi_os': 45, 'rsi_ob': 78, 'vol_spike': 0.17974681838782056, 'adx_thresh': 15.44537066274944, 'atr_min_pct': 0.009714801916168284, 'atr_max_pct': 0.05029741468763615, 'tp_mult': 2.563484446746841, 'tsl_mult': 0.30578967802046747, 'strategy': 'mean_reversion', 'time_stop': 92, 'use_sma': True, 'use_atr': False, 'use_adx': False, 'use_ema': True, 'use_spike': False, 'rsi_required': True, 'edge_k': 0.30243260532494365, 'edge_cap': 0.22299723374390235, 'bull_strategy': 'mean_reversion', 'bull_bb_std_mult': 0.762919180437533, 'bull_rsi_os': 8, 'bull_rsi_ob': 77, 'bull_adx_thresh': 7.728388042942245, 'bull_atr_min_pct': 0.019386849413466255, 'bull_atr_max_pct': 0.1056553510148781, 'bull_tp_mult': 1.5345694283375868, 'bull_tsl_mult': 0.24045025099195624, 'bull_time_stop': 300, 'bull_use_sma': False, 'bull_use_ema': False, 'bull_use_atr': True, 'bull_use_adx': True, 'bull_use_spike': False, 'bull_rsi_required': True, 'bear_strategy': 'mean_reversion', 'bear_bb_std_mult': 3.295719251649639, 'bear_rsi_os': 43, 'bear_rsi_ob': 48, 'bear_adx_thresh': 33.72774946037739, 'bear_atr_min_pct': 0.007957650523353477, 'bear_atr_max_pct': 0.05267348466199252, 'bear_tp_mult': 2.9564655219887124, 'bear_tsl_mult': 0.020690078831094073, 'bear_time_stop': 279, 'bear_use_sma': True, 'bear_use_ema': True, 'bear_use_atr': True, 'bear_use_adx': True, 'bear_use_spike': True, 'bear_rsi_required': False, 'sideways_strategy': 'breakout', 'sideways_bb_std_mult': 3.4480085697837173, 'sideways_rsi_os': 8, 'sideways_rsi_ob': 61, 'sideways_adx_thresh': 29.906726904514287, 'sideways_atr_min_pct': 0.023396496088616797, 'sideways_atr_max_pct': 0.1110896478908308, 'sideways_tp_mult': 1.9401676237484196, 'sideways_tsl_mult': 0.7235615361432158, 'sideways_time_stop': 146, 'sideways_use_sma': False, 'sideways_use_ema': False, 'sideways_use_atr': False, 'sideways_use_adx': False, 'sideways_use_spike': False, 'sideways_rsi_required': True}.
[I 2025-09-01 03:51:51,656] Trial 530 finished with values: [-0.013951416387679272, 0.013844441204284515] and parameters: {'p_sma': 17, 'p_std': 50, 'p_atr': 24, 'p_adx': 9, 'rsi_period': 10, 'ema1': 13, 'ema2': 52, 'slip_atr_k': 0.007572517768040009, 'slip_spread_k': 0.028213865148183668, 'spread_hl_frac': 0.04580089259663862, 'bb_std_mult': 2.2830757581365115, 'rsi_os': 45, 'rsi_ob': 80, 'vol_spike': 0.18301830606455236, 'adx_thresh': 15.318618867600705, 'atr_min_pct': 0.012136226724550819, 'atr_max_pct': 0.10673094081592434, 'tp_mult': 2.3817087833597768, 'tsl_mult': 0.3235017022702291, 'strategy': 'mean_reversion', 'time_stop': 91, 'use_sma': True, 'use_atr': True, 'use_adx': False, 'use_ema': True, 'use_spike': False, 'rsi_required': True, 'edge_k': 0.2134341475294325, 'edge_cap': 0.22046883103381615, 'bull_strategy': 'mean_reversion', 'bull_bb_std_mult': 0.7798656721427062, 'bull_rsi_os': 9, 'bull_rsi_ob': 77, 'bull_adx_thresh': 7.645439601523013, 'bull_atr_min_pct': 0.0008382166762132453, 'bull_atr_max_pct': 0.10512570794612836, 'bull_tp_mult': 1.532191838951212, 'bull_tsl_mult': 0.8152010903019996, 'bull_time_stop': 300, 'bull_use_sma': False, 'bull_use_ema': False, 'bull_use_atr': True, 'bull_use_adx': True, 'bull_use_spike': False, 'bull_rsi_required': True, 'bear_strategy': 'mean_reversion', 'bear_bb_std_mult': 3.2565240191765863, 'bear_rsi_os': 45, 'bear_rsi_ob': 91, 'bear_adx_thresh': 33.76949816910436, 'bear_atr_min_pct': 0.007966350985133128, 'bear_atr_max_pct': 0.05242631370209231, 'bear_tp_mult': 2.954151731360951, 'bear_tsl_mult': 0.020533259120515457, 'bear_time_stop': 275, 'bear_use_sma': True, 'bear_use_ema': True, 'bear_use_atr': True, 'bear_use_adx': True, 'bear_use_spike': True, 'bear_rsi_required': False, 'sideways_strategy': 'breakout', 'sideways_bb_std_mult': 3.4313355822870952, 'sideways_rsi_os': 8, 'sideways_rsi_ob': 56, 'sideways_adx_thresh': 29.86651994127856, 'sideways_atr_min_pct': 0.023424784819584467, 'sideways_atr_max_pct': 0.10851044862969211, 'sideways_tp_mult': 1.9232280969905946, 'sideways_tsl_mult': 0.6774221319679368, 'sideways_time_stop': 147, 'sideways_use_sma': False, 'sideways_use_ema': False, 'sideways_use_atr': False, 'sideways_use_adx': False, 'sideways_use_spike': False, 'sideways_rsi_required': True}.
[I 2025-09-01 03:51:52,304] Trial 527 finished with values: [-1000000000.0, 1000000000.0] and parameters: {'p_sma': 18, 'p_std': 50, 'p_atr': 24, 'p_adx': 12, 'rsi_period': 8, 'ema1': 12, 'ema2': 52, 'slip_atr_k': 0.007687565373965952, 'slip_spread_k': 0.0021261938826574525, 'spread_hl_frac': 0.04581424620588135, 'bb_std_mult': 2.2605081171177104, 'rsi_os': 44, 'rsi_ob': 78, 'vol_spike': 0.18666628842381439, 'adx_thresh': 14.278608797343455, 'atr_min_pct': 0.010816348063809454, 'atr_max_pct': 0.050368099158202666, 'tp_mult': 2.423288959899789, 'tsl_mult': 0.31222495399209005, 'strategy': 'mean_reversion', 'time_stop': 100, 'use_sma': True, 'use_atr': True, 'use_adx': False, 'use_ema': True, 'use_spike': False, 'rsi_required': True, 'edge_k': 0.38452128765768745, 'edge_cap': 0.2396225297066831, 'bull_strategy': 'mean_reversion', 'bull_bb_std_mult': 0.8250260270234326, 'bull_rsi_os': 8, 'bull_rsi_ob': 76, 'bull_adx_thresh': 7.787033626791274, 'bull_atr_min_pct': 0.011051080079028048, 'bull_atr_max_pct': 0.10558745512061982, 'bull_tp_mult': 1.5320193877941675, 'bull_tsl_mult': 0.31738321722868285, 'bull_time_stop': 300, 'bull_use_sma': False, 'bull_use_ema': False, 'bull_use_atr': True, 'bull_use_adx': True, 'bull_use_spike': False, 'bull_rsi_required': True, 'bear_strategy': 'mean_reversion', 'bear_bb_std_mult': 3.314013723360891, 'bear_rsi_os': 45, 'bear_rsi_ob': 84, 'bear_adx_thresh': 34.26961073030328, 'bear_atr_min_pct': 0.008074267446765855, 'bear_atr_max_pct': 0.05278506691547596, 'bear_tp_mult': 2.9573506351132743, 'bear_tsl_mult': 0.020683184660244214, 'bear_time_stop': 282, 'bear_use_sma': True, 'bear_use_ema': True, 'bear_use_atr': True, 'bear_use_adx': True, 'bear_use_spike': True, 'bear_rsi_required': False, 'sideways_strategy': 'breakout', 'sideways_bb_std_mult': 3.4215863404269893, 'sideways_rsi_os': 7, 'sideways_rsi_ob': 56, 'sideways_adx_thresh': 29.851340564000484, 'sideways_atr_min_pct': 0.024198646171829822, 'sideways_atr_max_pct': 0.1087515168333684, 'sideways_tp_mult': 1.9153032793336624, 'sideways_tsl_mult': 0.6506528188307508, 'sideways_time_stop': 148, 'sideways_use_sma': False, 'sideways_use_ema': False, 'sideways_use_atr': False, 'sideways_use_adx': False, 'sideways_use_spike': False, 'sideways_rsi_required': True}.
[I 2025-09-01 03:51:52,708] Trial 529 finished with values: [-1000000000.0, 1000000000.0] and parameters: {'p_sma': 17, 'p_std': 51, 'p_atr': 24, 'p_adx': 12, 'rsi_period': 10, 'ema1': 13, 'ema2': 52, 'slip_atr_k': 0.007944482176289933, 'slip_spread_k': 0.02563888265171968, 'spread_hl_frac': 0.04607853034338862, 'bb_std_mult': 2.2808708164721083, 'rsi_os': 44, 'rsi_ob': 80, 'vol_spike': 0.17982774781487104, 'adx_thresh': 15.143112591662575, 'atr_min_pct': 0.0106808070326121, 'atr_max_pct': 0.10443893258531664, 'tp_mult': 2.4046178889905887, 'tsl_mult': 0.3202118608914399, 'strategy': 'mean_reversion', 'time_stop': 93, 'use_sma': True, 'use_atr': True, 'use_adx': False, 'use_ema': True, 'use_spike': False, 'rsi_required': True, 'edge_k': 0.29920262921911883, 'edge_cap': 0.21614481353564288, 'bull_strategy': 'mean_reversion', 'bull_bb_std_mult': 0.7730069982834327, 'bull_rsi_os': 8, 'bull_rsi_ob': 77, 'bull_adx_thresh': 7.671471171051697, 'bull_atr_min_pct': 0.011098765192424007, 'bull_atr_max_pct': 0.10635474601044805, 'bull_tp_mult': 1.5248698982604976, 'bull_tsl_mult': 0.32656968884717186, 'bull_time_stop': 299, 'bull_use_sma': False, 'bull_use_ema': False, 'bull_use_atr': True, 'bull_use_adx': True, 'bull_use_spike': False, 'bull_rsi_required': True, 'bear_strategy': 'mean_reversion', 'bear_bb_std_mult': 3.2259373202023864, 'bear_rsi_os': 45, 'bear_rsi_ob': 73, 'bear_adx_thresh': 33.718991174974576, 'bear_atr_min_pct': 0.007719406811047, 'bear_atr_max_pct': 0.056494568847430225, 'bear_tp_mult': 2.9577211289043386, 'bear_tsl_mult': 0.01319019479697165, 'bear_time_stop': 277, 'bear_use_sma': True, 'bear_use_ema': True, 'bear_use_atr': True, 'bear_use_adx': True, 'bear_use_spike': True, 'bear_rsi_required': False, 'sideways_strategy': 'breakout', 'sideways_bb_std_mult': 3.437562741785756, 'sideways_rsi_os': 8, 'sideways_rsi_ob': 61, 'sideways_adx_thresh': 29.775439178485808, 'sideways_atr_min_pct': 0.023363027137810622, 'sideways_atr_max_pct': 0.11097808797248068, 'sideways_tp_mult': 1.9101623624346986, 'sideways_tsl_mult': 0.6812835097827835, 'sideways_time_stop': 163, 'sideways_use_sma': False, 'sideways_use_ema': False, 'sideways_use_atr': False, 'sideways_use_adx': False, 'sideways_use_spike': False, 'sideways_rsi_required': True}.
