[I 2025-09-01 03:32:35,566] Trial 422 finished with values: [-1000000000.0, 1000000000.0] and parameters: {'p_sma': 29, 'p_std': 58, 'p_atr': 28, 'p_adx': 17, 'rsi_period': 23, 'ema1': 13, 'ema2': 19, 'slip_atr_k': 0.07719376986172413, 'slip_spread_k': 0.4357323306329402, 'spread_hl_frac': 0.026537078869204936, 'bb_std_mult': 1.5673179111032904, 'rsi_os': 22, 'rsi_ob': 86, 'vol_spike': 0.20198698153428374, 'adx_thresh': 11.82402587955592, 'atr_min_pct': 0.00634600764480497, 'atr_max_pct': 0.10283944219606284, 'tp_mult': 2.766157202847727, 'tsl_mult': 0.38497038238286346, 'strategy': 'mean_reversion', 'time_stop': 157, 'use_sma': False, 'use_atr': False, 'use_adx': True, 'use_ema': False, 'use_spike': True, 'rsi_required': False, 'edge_k': 0.8259967616613604, 'edge_cap': 0.43222671263349105, 'bull_strategy': 'breakout', 'bull_bb_std_mult': 2.1682305626014218, 'bull_rsi_os': 50, 'bull_rsi_ob': 91, 'bull_adx_thresh': 19.100317169284708, 'bull_atr_min_pct': 0.01885824806264441, 'bull_atr_max_pct': 0.11538401144003224, 'bull_tp_mult': 2.8865162340680013, 'bull_tsl_mult': 0.16317385597016187, 'bull_time_stop': 85, 'bull_use_sma': True, 'bull_use_ema': False, 'bull_use_atr': False, 'bull_use_adx': True, 'bull_use_spike': True, 'bull_rsi_required': False, 'bear_strategy': 'breakout', 'bear_bb_std_mult': 2.075264157182843, 'bear_rsi_os': 53, 'bear_rsi_ob': 80, 'bear_adx_thresh': 10.06878486483081, 'bear_atr_min_pct': 0.026857102982429763, 'bear_atr_max_pct': 0.14478277737265965, 'bear_tp_mult': 1.0510362258015988, 'bear_tsl_mult': 0.15741136493621016, 'bear_time_stop': 65, 'bear_use_sma': False, 'bear_use_ema': False, 'bear_use_atr': False, 'bear_use_adx': False, 'bear_use_spike': True, 'bear_rsi_required': True, 'sideways_strategy': 'breakout', 'sideways_bb_std_mult': 1.8638092286523074, 'sideways_rsi_os': 21, 'sideways_rsi_ob': 73, 'sideways_adx_thresh': 28.881981230004797, 'sideways_atr_min_pct': 0.01602506926214608, 'sideways_atr_max_pct': 0.012695241076149168, 'sideways_tp_mult': 1.6198854175933388, 'sideways_tsl_mult': 0.44731238211744034, 'sideways_time_stop': 221, 'sideways_use_sma': True, 'sideways_use_ema': True, 'sideways_use_atr': True, 'sideways_use_adx': True, 'sideways_use_spike': True, 'sideways_rsi_required': False}.
[I 2025-09-01 03:32:36,574] Trial 425 finished with values: [-1000000000.0, 1000000000.0] and parameters: {'p_sma': 22, 'p_std': 57, 'p_atr': 28, 'p_adx': 15, 'rsi_period': 11, 'ema1': 11, 'ema2': 48, 'slip_atr_k': 0.028122501878899916, 'slip_spread_k': 0.1857577888189162, 'spread_hl_frac': 0.027655978061554957, 'bb_std_mult': 2.0415351922182787, 'rsi_os': 53, 'rsi_ob': 84, 'vol_spike': 0.20406400776293107, 'adx_thresh': 11.637921530208667, 'atr_min_pct': 0.013285961267036905, 'atr_max_pct': 0.0640456942175281, 'tp_mult': 2.6144242187039506, 'tsl_mult': 0.6496311175504944, 'strategy': 'mean_reversion', 'time_stop': 169, 'use_sma': True, 'use_atr': True, 'use_adx': False, 'use_ema': True, 'use_spike': False, 'rsi_required': True, 'edge_k': 0.05699689291559941, 'edge_cap': 0.48398626978381887, 'bull_strategy': 'breakout', 'bull_bb_std_mult': 1.6656394396063678, 'bull_rsi_os': 17, 'bull_rsi_ob': 50, 'bull_adx_thresh': 11.87185164468011, 'bull_atr_min_pct': 0.02009310998000967, 'bull_atr_max_pct': 0.12024847517314831, 'bull_tp_mult': 1.546734981658577, 'bull_tsl_mult': 0.926153787686661, 'bull_time_stop': 283, 'bull_use_sma': True, 'bull_use_ema': False, 'bull_use_atr': True, 'bull_use_adx': False, 'bull_use_spike': False, 'bull_rsi_required': False, 'bear_strategy': 'breakout', 'bear_bb_std_mult': 2.5081751891106077, 'bear_rsi_os': 42, 'bear_rsi_ob': 59, 'bear_adx_thresh': 25.263431040054105, 'bear_atr_min_pct': 0.013786029319357228, 'bear_atr_max_pct': 0.14141984100486626, 'bear_tp_mult': 1.3172787166414106, 'bear_tsl_mult': 0.08412877365381048, 'bear_time_stop': 89, 'bear_use_sma': True, 'bear_use_ema': True, 'bear_use_atr': False, 'bear_use_adx': True, 'bear_use_spike': False, 'bear_rsi_required': True, 'sideways_strategy': 'breakout', 'sideways_bb_std_mult': 1.9706249819967454, 'sideways_rsi_os': 50, 'sideways_rsi_ob': 46, 'sideways_adx_thresh': 29.749862179487447, 'sideways_atr_min_pct': 0.018231994135604165, 'sideways_atr_max_pct': 0.025648970556590177, 'sideways_tp_mult': 2.2646352340524043, 'sideways_tsl_mult': 0.16590683889334246, 'sideways_time_stop': 8, 'sideways_use_sma': True, 'sideways_use_ema': True, 'sideways_use_atr': True, 'sideways_use_adx': False, 'sideways_use_spike': False, 'sideways_rsi_required': True}.
[I 2025-09-01 03:33:19,331] Trial 427 finished with values: [-1000000000.0, 1000000000.0] and parameters: {'p_sma': 20, 'p_std': 34, 'p_atr': 20, 'p_adx': 15, 'rsi_period': 17, 'ema1': 30, 'ema2': 35, 'slip_atr_k': 0.029965520693353898, 'slip_spread_k': 0.18120903859141174, 'spread_hl_frac': 0.0279438641183311, 'bb_std_mult': 2.0466740776610206, 'rsi_os': 20, 'rsi_ob': 84, 'vol_spike': 0.26277935914407685, 'adx_thresh': 11.593582519734973, 'atr_min_pct': 0.009428559010960576, 'atr_max_pct': 0.12771905556582486, 'tp_mult': 2.6195910362158075, 'tsl_mult': 0.37192332115863436, 'strategy': 'mean_reversion', 'time_stop': 171, 'use_sma': True, 'use_atr': True, 'use_adx': False, 'use_ema': True, 'use_spike': False, 'rsi_required': True, 'edge_k': 0.046324123038052965, 'edge_cap': 0.47706850923802707, 'bull_strategy': 'breakout', 'bull_bb_std_mult': 1.1256177451753393, 'bull_rsi_os': 37, 'bull_rsi_ob': 50, 'bull_adx_thresh': 11.784005690878795, 'bull_atr_min_pct': 0.010095960441097066, 'bull_atr_max_pct': 0.12150725088288697, 'bull_tp_mult': 1.0902282920335926, 'bull_tsl_mult': 0.19246440278578955, 'bull_time_stop': 23, 'bull_use_sma': True, 'bull_use_ema': False, 'bull_use_atr': True, 'bull_use_adx': False, 'bull_use_spike': False, 'bull_rsi_required': False, 'bear_strategy': 'breakout', 'bear_bb_std_mult': 1.9455395316609247, 'bear_rsi_os': 37, 'bear_rsi_ob': 84, 'bear_adx_thresh': 18.10728898066137, 'bear_atr_min_pct': 0.012111655074001172, 'bear_atr_max_pct': 0.02559221673146234, 'bear_tp_mult': 2.223383200446555, 'bear_tsl_mult': 0.10815744363871414, 'bear_time_stop': 88, 'bear_use_sma': True, 'bear_use_ema': True, 'bear_use_atr': False, 'bear_use_adx': True, 'bear_use_spike': False, 'bear_rsi_required': True, 'sideways_strategy': 'breakout', 'sideways_bb_std_mult': 1.4708466675125744, 'sideways_rsi_os': 46, 'sideways_rsi_ob': 90, 'sideways_adx_thresh': 29.44441538354805, 'sideways_atr_min_pct': 0.026690697975412955, 'sideways_atr_max_pct': 0.02677326020859631, 'sideways_tp_mult': 2.6182537874316685, 'sideways_tsl_mult': 0.237321638243791, 'sideways_time_stop': 8, 'sideways_use_sma': True, 'sideways_use_ema': True, 'sideways_use_atr': True, 'sideways_use_adx': False, 'sideways_use_spike': False, 'sideways_rsi_required': True}.
[I 2025-09-01 03:33:19,580] Trial 428 finished with values: [-0.03375577867842916, 0.03360150661389215] and parameters: {'p_sma': 34, 'p_std': 33, 'p_atr': 9, 'p_adx': 26, 'rsi_period': 17, 'ema1': 30, 'ema2': 22, 'slip_atr_k': 0.04056026396553525, 'slip_spread_k': 0.9188570598426402, 'spread_hl_frac': 0.028118555389024653, 'bb_std_mult': 1.4547654884854009, 'rsi_os': 21, 'rsi_ob': 84, 'vol_spike': 0.2580638846203125, 'adx_thresh': 12.61092236137201, 'atr_min_pct': 0.009312965567589294, 'atr_max_pct': 0.07432469015492896, 'tp_mult': 2.6735630887711856, 'tsl_mult': 0.37401896299604465, 'strategy': 'mean_reversion', 'time_stop': 174, 'use_sma': False, 'use_atr': False, 'use_adx': True, 'use_ema': False, 'use_spike': True, 'rsi_required': False, 'edge_k': 1.3887380869682846, 'edge_cap': 0.40768993355546995, 'bull_strategy': 'breakout', 'bull_bb_std_mult': 1.3879082230522661, 'bull_rsi_os': 41, 'bull_rsi_ob': 73, 'bull_adx_thresh': 15.55079692245554, 'bull_atr_min_pct': 0.0005621761683497871, 'bull_atr_max_pct': 0.11463926963793486, 'bull_tp_mult': 2.733464383205523, 'bull_tsl_mult': 0.8378177276550375, 'bull_time_stop': 277, 'bull_use_sma': True, 'bull_use_ema': False, 'bull_use_atr': False, 'bull_use_adx': False, 'bull_use_spike': True, 'bull_rsi_required': False, 'bear_strategy': 'breakout', 'bear_bb_std_mult': 2.8236321654374654, 'bear_rsi_os': 37, 'bear_rsi_ob': 83, 'bear_adx_thresh': 16.893972662197182, 'bear_atr_min_pct': 0.028572429340863417, 'bear_atr_max_pct': 0.02423233353958991, 'bear_tp_mult': 1.660902728169516, 'bear_tsl_mult': 0.11814323196565028, 'bear_time_stop': 72, 'bear_use_sma': False, 'bear_use_ema': False, 'bear_use_atr': True, 'bear_use_adx': False, 'bear_use_spike': True, 'bear_rsi_required': True, 'sideways_strategy': 'breakout', 'sideways_bb_std_mult': 1.9487819664540782, 'sideways_rsi_os': 50, 'sideways_rsi_ob': 80, 'sideways_adx_thresh': 27.827727700959002, 'sideways_atr_min_pct': 0.026854927527545445, 'sideways_atr_max_pct': 0.027180115913555646, 'sideways_tp_mult': 1.701532828819548, 'sideways_tsl_mult': 0.23950286737405635, 'sideways_time_stop': 36, 'sideways_use_sma': True, 'sideways_use_ema': False, 'sideways_use_atr': True, 'sideways_use_adx': False, 'sideways_use_spike': True, 'sideways_rsi_required': True}.
[I 2025-09-01 03:33:20,023] Trial 426 finished with values: [-1000000000.0, 1000000000.0] and parameters: {'p_sma': 22, 'p_std': 34, 'p_atr': 10, 'p_adx': 15, 'rsi_period': 18, 'ema1': 21, 'ema2': 55, 'slip_atr_k': 0.02974877735311513, 'slip_spread_k': 0.7490241648320475, 'spread_hl_frac': 0.029831979888793957, 'bb_std_mult': 1.4486855969837829, 'rsi_os': 20, 'rsi_ob': 84, 'vol_spike': 0.23400048671349494, 'adx_thresh': 11.560314914490212, 'atr_min_pct': 0.009255721391823919, 'atr_max_pct': 0.06356370506263939, 'tp_mult': 2.6130176037692627, 'tsl_mult': 0.3747336581840932, 'strategy': 'mean_reversion', 'time_stop': 169, 'use_sma': True, 'use_atr': True, 'use_adx': False, 'use_ema': True, 'use_spike': False, 'rsi_required': True, 'edge_k': 0.04461816176793615, 'edge_cap': 0.4823874274582829, 'bull_strategy': 'breakout', 'bull_bb_std_mult': 1.1307626497134853, 'bull_rsi_os': 34, 'bull_rsi_ob': 50, 'bull_adx_thresh': 22.80019735310401, 'bull_atr_min_pct': 0.020050225317421448, 'bull_atr_max_pct': 0.03076149197871591, 'bull_tp_mult': 1.6524647456264465, 'bull_tsl_mult': 0.928781503527863, 'bull_time_stop': 281, 'bull_use_sma': True, 'bull_use_ema': False, 'bull_use_atr': True, 'bull_use_adx': False, 'bull_use_spike': False, 'bull_rsi_required': False, 'bear_strategy': 'breakout', 'bear_bb_std_mult': 2.506816829151065, 'bear_rsi_os': 52, 'bear_rsi_ob': 59, 'bear_adx_thresh': 7.116007303071855, 'bear_atr_min_pct': 0.028492895275696803, 'bear_atr_max_pct': 0.14058278225116044, 'bear_tp_mult': 1.9231572506698433, 'bear_tsl_mult': 0.08705763031606291, 'bear_time_stop': 210, 'bear_use_sma': True, 'bear_use_ema': True, 'bear_use_atr': False, 'bear_use_adx': True, 'bear_use_spike': False, 'bear_rsi_required': True, 'sideways_strategy': 'breakout', 'sideways_bb_std_mult': 2.23510578191243, 'sideways_rsi_os': 50, 'sideways_rsi_ob': 74, 'sideways_adx_thresh': 29.40526069355754, 'sideways_atr_min_pct': 0.01819216548998539, 'sideways_atr_max_pct': 0.026556213354228895, 'sideways_tp_mult': 2.6366975502876673, 'sideways_tsl_mult': 0.16675175956064472, 'sideways_time_stop': 10, 'sideways_use_sma': True, 'sideways_use_ema': True, 'sideways_use_atr': True, 'sideways_use_adx': False, 'sideways_use_spike': False, 'sideways_rsi_required': True}.
[I 2025-09-01 03:33:21,413] Trial 424 finished with values: [-1000000000.0, 1000000000.0] and parameters: {'p_sma': 11, 'p_std': 58, 'p_atr': 20, 'p_adx': 19, 'rsi_period': 18, 'ema1': 16, 'ema2': 56, 'slip_atr_k': 0.10675415180928016, 'slip_spread_k': 0.1894718801561115, 'spread_hl_frac': 0.027421372187794068, 'bb_std_mult': 3.558051220472415, 'rsi_os': 22, 'rsi_ob': 87, 'vol_spike': 0.20147990336570604, 'adx_thresh': 32.78723429826686, 'atr_min_pct': 0.006791172906805605, 'atr_max_pct': 0.0523845919770328, 'tp_mult': 2.7556163849849566, 'tsl_mult': 0.3821919265104774, 'strategy': 'mean_reversion', 'time_stop': 159, 'use_sma': True, 'use_atr': False, 'use_adx': False, 'use_ema': False, 'use_spike': True, 'rsi_required': False, 'edge_k': 0.05838099558229501, 'edge_cap': 0.4320685488344489, 'bull_strategy': 'breakout', 'bull_bb_std_mult': 1.671255550852671, 'bull_rsi_os': 13, 'bull_rsi_ob': 73, 'bull_adx_thresh': 20.97899988252538, 'bull_atr_min_pct': 0.000860985785847551, 'bull_atr_max_pct': 0.13128951564260022, 'bull_tp_mult': 2.944114159852745, 'bull_tsl_mult': 0.07313430244850189, 'bull_time_stop': 280, 'bull_use_sma': True, 'bull_use_ema': False, 'bull_use_atr': False, 'bull_use_adx': False, 'bull_use_spike': True, 'bull_rsi_required': False, 'bear_strategy': 'breakout', 'bear_bb_std_mult': 2.522882283783839, 'bear_rsi_os': 54, 'bear_rsi_ob': 59, 'bear_adx_thresh': 10.02172726006795, 'bear_atr_min_pct': 0.011846376760387928, 'bear_atr_max_pct': 0.14070682961837783, 'bear_tp_mult': 1.9356126687517201, 'bear_tsl_mult': 0.15302952453089308, 'bear_time_stop': 67, 'bear_use_sma': False, 'bear_use_ema': False, 'bear_use_atr': False, 'bear_use_adx': True, 'bear_use_spike': True, 'bear_rsi_required': True, 'sideways_strategy': 'breakout', 'sideways_bb_std_mult': 2.1374784973763963, 'sideways_rsi_os': 21, 'sideways_rsi_ob': 81, 'sideways_adx_thresh': 29.541845421766023, 'sideways_atr_min_pct': 0.0265575521464138, 'sideways_atr_max_pct': 0.011711719471929963, 'sideways_tp_mult': 2.2679468593455896, 'sideways_tsl_mult': 0.2442794046252212, 'sideways_time_stop': 262, 'sideways_use_sma': True, 'sideways_use_ema': True, 'sideways_use_atr': True, 'sideways_use_adx': False, 'sideways_use_spike': True, 'sideways_rsi_required': True}.
[I 2025-09-01 03:34:07,331] Trial 432 finished with values: [-1000000000.0, 1000000000.0] and parameters: {'p_sma': 28, 'p_std': 23, 'p_atr': 28, 'p_adx': 16, 'rsi_period': 82, 'ema1': 21, 'ema2': 59, 'slip_atr_k': 0.0236790966260833, 'slip_spread_k': 0.16072812136338677, 'spread_hl_frac': 0.028949276972802723, 'bb_std_mult': 0.7293989449862892, 'rsi_os': 42, 'rsi_ob': 85, 'vol_spike': 0.21798151301857904, 'adx_thresh': 10.585322237788802, 'atr_min_pct': 0.019644900259658253, 'atr_max_pct': 0.048397882705165304, 'tp_mult': 1.5619615842436358, 'tsl_mult': 0.19684694764861993, 'strategy': 'mean_reversion', 'time_stop': 163, 'use_sma': False, 'use_atr': False, 'use_adx': True, 'use_ema': False, 'use_spike': True, 'rsi_required': False, 'edge_k': 0.1903997407556834, 'edge_cap': 0.9071836070058102, 'bull_strategy': 'mean_reversion', 'bull_bb_std_mult': 1.927837283764487, 'bull_rsi_os': 17, 'bull_rsi_ob': 54, 'bull_adx_thresh': 7.044706059380857, 'bull_atr_min_pct': 0.027930413784770063, 'bull_atr_max_pct': 0.1172732192182478, 'bull_tp_mult': 2.3046107561479503, 'bull_tsl_mult': 0.12437696599001807, 'bull_time_stop': 269, 'bull_use_sma': False, 'bull_use_ema': True, 'bull_use_atr': False, 'bull_use_adx': False, 'bull_use_spike': True, 'bull_rsi_required': False, 'bear_strategy': 'mean_reversion', 'bear_bb_std_mult': 1.7156083599658707, 'bear_rsi_os': 49, 'bear_rsi_ob': 61, 'bear_adx_thresh': 23.4260039624127, 'bear_atr_min_pct': 0.004736574425679376, 'bear_atr_max_pct': 0.026780514882283037, 'bear_tp_mult': 2.3740789255058674, 'bear_tsl_mult': 0.2240264790758058, 'bear_time_stop': 53, 'bear_use_sma': False, 'bear_use_ema': False, 'bear_use_atr': True, 'bear_use_adx': False, 'bear_use_spike': True, 'bear_rsi_required': True, 'sideways_strategy': 'mean_reversion', 'sideways_bb_std_mult': 3.581113933750517, 'sideways_rsi_os': 46, 'sideways_rsi_ob': 86, 'sideways_adx_thresh': 28.767949549738333, 'sideways_atr_min_pct': 0.02553813054350179, 'sideways_atr_max_pct': 0.03172629154702714, 'sideways_tp_mult': 1.7663262402493929, 'sideways_tsl_mult': 0.2169844354765614, 'sideways_time_stop': 121, 'sideways_use_sma': True, 'sideways_use_ema': False, 'sideways_use_atr': False, 'sideways_use_adx': False, 'sideways_use_spike': True, 'sideways_rsi_required': True}.
[I 2025-09-01 03:34:07,847] Trial 429 finished with values: [-1000000000.0, 1000000000.0] and parameters: {'p_sma': 40, 'p_std': 25, 'p_atr': 28, 'p_adx': 19, 'rsi_period': 35, 'ema1': 26, 'ema2': 55, 'slip_atr_k': 0.21888200529007146, 'slip_spread_k': 0.7475523165765108, 'spread_hl_frac': 0.02982146537608019, 'bb_std_mult': 1.446750678403561, 'rsi_os': 21, 'rsi_ob': 84, 'vol_spike': 0.28235623959766865, 'adx_thresh': 10.72502061217537, 'atr_min_pct': 0.006393014744161329, 'atr_max_pct': 0.03648231707684362, 'tp_mult': 2.6741723141799802, 'tsl_mult': 0.1417324162571139, 'strategy': 'mean_reversion', 'time_stop': 164, 'use_sma': False, 'use_atr': False, 'use_adx': True, 'use_ema': False, 'use_spike': True, 'rsi_required': False, 'edge_k': 0.10381336631027653, 'edge_cap': 0.40520073881050583, 'bull_strategy': 'mean_reversion', 'bull_bb_std_mult': 1.9257432527274871, 'bull_rsi_os': 20, 'bull_rsi_ob': 54, 'bull_adx_thresh': 7.043736341406587, 'bull_atr_min_pct': 0.027935651255146986, 'bull_atr_max_pct': 0.04199714170060476, 'bull_tp_mult': 2.723284157353866, 'bull_tsl_mult': 0.29594662639486197, 'bull_time_stop': 279, 'bull_use_sma': True, 'bull_use_ema': False, 'bull_use_atr': False, 'bull_use_adx': False, 'bull_use_spike': True, 'bull_rsi_required': False, 'bear_strategy': 'breakout', 'bear_bb_std_mult': 2.8052899415666652, 'bear_rsi_os': 48, 'bear_rsi_ob': 67, 'bear_adx_thresh': 23.259350758938947, 'bear_atr_min_pct': 0.02730966147136933, 'bear_atr_max_pct': 0.06392605283827493, 'bear_tp_mult': 1.7368376782204136, 'bear_tsl_mult': 0.6944036672474896, 'bear_time_stop': 74, 'bear_use_sma': False, 'bear_use_ema': False, 'bear_use_atr': True, 'bear_use_adx': False, 'bear_use_spike': True, 'bear_rsi_required': True, 'sideways_strategy': 'breakout', 'sideways_bb_std_mult': 2.2369369533810355, 'sideways_rsi_os': 50, 'sideways_rsi_ob': 75, 'sideways_adx_thresh': 27.83759914885491, 'sideways_atr_min_pct': 0.025554993399419974, 'sideways_atr_max_pct': 0.016528959436416635, 'sideways_tp_mult': 1.7179116943834032, 'sideways_tsl_mult': 0.1534774020624748, 'sideways_time_stop': 240, 'sideways_use_sma': True, 'sideways_use_ema': False, 'sideways_use_atr': True, 'sideways_use_adx': False, 'sideways_use_spike': True, 'sideways_rsi_required': True}.
[I 2025-09-01 03:34:08,196] Trial 431 finished with values: [-1000000000.0, 1000000000.0] and parameters: {'p_sma': 27, 'p_std': 25, 'p_atr': 28, 'p_adx': 19, 'rsi_period': 12, 'ema1': 5, 'ema2': 58, 'slip_atr_k': 0.10725070473779307, 'slip_spread_k': 0.7994447353997087, 'spread_hl_frac': 0.028591199208744963, 'bb_std_mult': 1.522119470155572, 'rsi_os': 21, 'rsi_ob': 85, 'vol_spike': 0.0676702664169677, 'adx_thresh': 10.587547294208033, 'atr_min_pct': 0.01980271435735611, 'atr_max_pct': 0.0485352766525809, 'tp_mult': 1.5771968744962184, 'tsl_mult': 0.20060106431182162, 'strategy': 'mean_reversion', 'time_stop': 161, 'use_sma': False, 'use_atr': False, 'use_adx': True, 'use_ema': False, 'use_spike': True, 'rsi_required': False, 'edge_k': 0.12660765843458952, 'edge_cap': 0.20789932828250968, 'bull_strategy': 'mean_reversion', 'bull_bb_std_mult': 1.010012973946795, 'bull_rsi_os': 14, 'bull_rsi_ob': 54, 'bull_adx_thresh': 24.623121544895668, 'bull_atr_min_pct': 0.004021419256887563, 'bull_atr_max_pct': 0.11737591865487598, 'bull_tp_mult': 1.7426169748443823, 'bull_tsl_mult': 0.2661054052682225, 'bull_time_stop': 270, 'bull_use_sma': True, 'bull_use_ema': True, 'bull_use_atr': False, 'bull_use_adx': False, 'bull_use_spike': True, 'bull_rsi_required': False, 'bear_strategy': 'mean_reversion', 'bear_bb_std_mult': 1.714019702903729, 'bear_rsi_os': 49, 'bear_rsi_ob': 61, 'bear_adx_thresh': 20.75298297020851, 'bear_atr_min_pct': 0.004851516254109633, 'bear_atr_max_pct': 0.10347685196101644, 'bear_tp_mult': 2.7910241755891345, 'bear_tsl_mult': 0.14580103674267159, 'bear_time_stop': 52, 'bear_use_sma': False, 'bear_use_ema': False, 'bear_use_atr': True, 'bear_use_adx': False, 'bear_use_spike': True, 'bear_rsi_required': True, 'sideways_strategy': 'mean_reversion', 'sideways_bb_std_mult': 1.6127546058631945, 'sideways_rsi_os': 46, 'sideways_rsi_ob': 61, 'sideways_adx_thresh': 28.667034927162646, 'sideways_atr_min_pct': 0.005846534429310303, 'sideways_atr_max_pct': 0.03200447841242101, 'sideways_tp_mult': 1.8470521285929948, 'sideways_tsl_mult': 0.21984158293677045, 'sideways_time_stop': 263, 'sideways_use_sma': True, 'sideways_use_ema': False, 'sideways_use_atr': True, 'sideways_use_adx': False, 'sideways_use_spike': True, 'sideways_rsi_required': True}.
