[I 2025-09-01 03:06:43,272] Trial 264 finished with values: [-1000000000.0, 1000000000.0] and parameters: {'p_sma': 5, 'p_std': 56, 'p_atr': 28, 'p_adx': 18, 'rsi_period': 76, 'ema1': 16, 'ema2': 33, 'slip_atr_k': 0.027161099888549832, 'slip_spread_k': 0.14844852379618784, 'spread_hl_frac': 0.028684713595789755, 'bb_std_mult': 1.4050608228522337, 'rsi_os': 22, 'rsi_ob': 51, 'vol_spike': 0.07831244614780807, 'adx_thresh': 5.082345706042801, 'atr_min_pct': 0.008048877012104397, 'atr_max_pct': 0.11291852398027, 'tp_mult': 2.723361901943334, 'tsl_mult': 0.3364922602384417, 'strategy': 'mean_reversion', 'time_stop': 143, 'use_sma': False, 'use_atr': False, 'use_adx': True, 'use_ema': False, 'use_spike': False, 'rsi_required': True, 'edge_k': 1.191780995918463, 'edge_cap': 0.2698869820180347, 'bull_strategy': 'breakout', 'bull_bb_std_mult': 1.1336129962182666, 'bull_rsi_os': 47, 'bull_rsi_ob': 52, 'bull_adx_thresh': 14.414535317441429, 'bull_atr_min_pct': 0.001705304985580722, 'bull_atr_max_pct': 0.09140397877344625, 'bull_tp_mult': 2.493010002888273, 'bull_tsl_mult': 0.3476880344491432, 'bull_time_stop': 244, 'bull_use_sma': True, 'bull_use_ema': False, 'bull_use_atr': True, 'bull_use_adx': False, 'bull_use_spike': False, 'bull_rsi_required': False, 'bear_strategy': 'mean_reversion', 'bear_bb_std_mult': 1.659971750395657, 'bear_rsi_os': 50, 'bear_rsi_ob': 59, 'bear_adx_thresh': 24.49112165375769, 'bear_atr_min_pct': 0.028470091199112604, 'bear_atr_max_pct': 0.03662466100723514, 'bear_tp_mult': 2.604677886955883, 'bear_tsl_mult': 0.16503396079252658, 'bear_time_stop': 71, 'bear_use_sma': False, 'bear_use_ema': False, 'bear_use_atr': False, 'bear_use_adx': False, 'bear_use_spike': True, 'bear_rsi_required': True, 'sideways_strategy': 'mean_reversion', 'sideways_bb_std_mult': 1.4996481008506257, 'sideways_rsi_os': 47, 'sideways_rsi_ob': 93, 'sideways_adx_thresh': 32.56470696499531, 'sideways_atr_min_pct': 0.026764319274860688, 'sideways_atr_max_pct': 0.024289828166193402, 'sideways_tp_mult': 1.6584112741505372, 'sideways_tsl_mult': 0.18700618303097946, 'sideways_time_stop': 251, 'sideways_use_sma': True, 'sideways_use_ema': True, 'sideways_use_atr': False, 'sideways_use_adx': False, 'sideways_use_spike': False, 'sideways_rsi_required': True}.
[I 2025-09-01 03:06:44,141] Trial 261 finished with values: [-0.023065235374647997, 0.022966225008671248] and parameters: {'p_sma': 21, 'p_std': 31, 'p_atr': 28, 'p_adx': 18, 'rsi_period': 13, 'ema1': 21, 'ema2': 20, 'slip_atr_k': 0.09024340601180553, 'slip_spread_k': 0.1503243791334196, 'spread_hl_frac': 0.02116043576299074, 'bb_std_mult': 1.0295231457419458, 'rsi_os': 20, 'rsi_ob': 90, 'vol_spike': 0.09198909482497139, 'adx_thresh': 5.00649894279772, 'atr_min_pct': 0.007811074274750491, 'atr_max_pct': 0.11249968472753087, 'tp_mult': 2.503378045858768, 'tsl_mult': 0.8055985753918878, 'strategy': 'mean_reversion', 'time_stop': 170, 'use_sma': False, 'use_atr': False, 'use_adx': True, 'use_ema': False, 'use_spike': True, 'rsi_required': False, 'edge_k': 0.13323510237531794, 'edge_cap': 0.8565095719376783, 'bull_strategy': 'breakout', 'bull_bb_std_mult': 1.123622051335111, 'bull_rsi_os': 48, 'bull_rsi_ob': 52, 'bull_adx_thresh': 23.99968400127099, 'bull_atr_min_pct': 0.0014397128345580042, 'bull_atr_max_pct': 0.1090897278581115, 'bull_tp_mult': 1.646241750686278, 'bull_tsl_mult': 0.3012214525773839, 'bull_time_stop': 285, 'bull_use_sma': True, 'bull_use_ema': False, 'bull_use_atr': False, 'bull_use_adx': False, 'bull_use_spike': True, 'bull_rsi_required': False, 'bear_strategy': 'breakout', 'bear_bb_std_mult': 2.1534534508195424, 'bear_rsi_os': 52, 'bear_rsi_ob': 61, 'bear_adx_thresh': 25.207177914490718, 'bear_atr_min_pct': 0.028306137829771327, 'bear_atr_max_pct': 0.037216398918248496, 'bear_tp_mult': 1.01002887180056, 'bear_tsl_mult': 0.744064671579993, 'bear_time_stop': 204, 'bear_use_sma': False, 'bear_use_ema': False, 'bear_use_atr': False, 'bear_use_adx': False, 'bear_use_spike': True, 'bear_rsi_required': True, 'sideways_strategy': 'breakout', 'sideways_bb_std_mult': 3.230786309955802, 'sideways_rsi_os': 49, 'sideways_rsi_ob': 48, 'sideways_adx_thresh': 34.80739017514187, 'sideways_atr_min_pct': 0.02739824385705626, 'sideways_atr_max_pct': 0.023400970790649404, 'sideways_tp_mult': 1.683079922519279, 'sideways_tsl_mult': 0.1856752054451651, 'sideways_time_stop': 248, 'sideways_use_sma': True, 'sideways_use_ema': True, 'sideways_use_atr': True, 'sideways_use_adx': False, 'sideways_use_spike': True, 'sideways_rsi_required': True}.
[I 2025-09-01 03:06:44,596] Trial 262 finished with values: [-1000000000.0, 1000000000.0] and parameters: {'p_sma': 6, 'p_std': 35, 'p_atr': 28, 'p_adx': 18, 'rsi_period': 13, 'ema1': 21, 'ema2': 10, 'slip_atr_k': 0.027532349229845786, 'slip_spread_k': 0.5781223270046758, 'spread_hl_frac': 0.02566584874337785, 'bb_std_mult': 1.4241028633759953, 'rsi_os': 20, 'rsi_ob': 90, 'vol_spike': 0.228517162156586, 'adx_thresh': 5.071221053183377, 'atr_min_pct': 0.007784314350268549, 'atr_max_pct': 0.06546845726884601, 'tp_mult': 2.7386828074299787, 'tsl_mult': 0.38156228129049363, 'strategy': 'mean_reversion', 'time_stop': 179, 'use_sma': False, 'use_atr': False, 'use_adx': True, 'use_ema': False, 'use_spike': True, 'rsi_required': False, 'edge_k': 0.13648814139458282, 'edge_cap': 0.2628813293842604, 'bull_strategy': 'breakout', 'bull_bb_std_mult': 1.1231712971134757, 'bull_rsi_os': 47, 'bull_rsi_ob': 52, 'bull_adx_thresh': 24.0375464302462, 'bull_atr_min_pct': 0.0015833690673809856, 'bull_atr_max_pct': 0.11418026731719655, 'bull_tp_mult': 2.1188728800219305, 'bull_tsl_mult': 0.29986213998775024, 'bull_time_stop': 262, 'bull_use_sma': True, 'bull_use_ema': False, 'bull_use_atr': False, 'bull_use_adx': False, 'bull_use_spike': True, 'bull_rsi_required': False, 'bear_strategy': 'mean_reversion', 'bear_bb_std_mult': 1.7266634653224504, 'bear_rsi_os': 50, 'bear_rsi_ob': 61, 'bear_adx_thresh': 25.1398178805609, 'bear_atr_min_pct': 0.02981363559890881, 'bear_atr_max_pct': 0.08193978139342618, 'bear_tp_mult': 1.0130377202646106, 'bear_tsl_mult': 0.16354849445071865, 'bear_time_stop': 76, 'bear_use_sma': False, 'bear_use_ema': False, 'bear_use_atr': False, 'bear_use_adx': False, 'bear_use_spike': True, 'bear_rsi_required': True, 'sideways_strategy': 'breakout', 'sideways_bb_std_mult': 1.5047925047380597, 'sideways_rsi_os': 47, 'sideways_rsi_ob': 91, 'sideways_adx_thresh': 26.46231959567291, 'sideways_atr_min_pct': 0.026752293918988382, 'sideways_atr_max_pct': 0.02197321598843605, 'sideways_tp_mult': 1.65324466934158, 'sideways_tsl_mult': 0.18689669709179743, 'sideways_time_stop': 10, 'sideways_use_sma': True, 'sideways_use_ema': True, 'sideways_use_atr': False, 'sideways_use_adx': False, 'sideways_use_spike': True, 'sideways_rsi_required': True}.
[I 2025-09-01 03:06:45,115] Trial 263 finished with values: [-1000000000.0, 1000000000.0] and parameters: {'p_sma': 21, 'p_std': 55, 'p_atr': 28, 'p_adx': 13, 'rsi_period': 76, 'ema1': 14, 'ema2': 56, 'slip_atr_k': 0.011887087326089554, 'slip_spread_k': 0.7603315099731256, 'spread_hl_frac': 0.02036849813707806, 'bb_std_mult': 1.4207357886459913, 'rsi_os': 20, 'rsi_ob': 77, 'vol_spike': 0.09595416216999111, 'adx_thresh': 13.181828791487698, 'atr_min_pct': 0.00024517871298831463, 'atr_max_pct': 0.04695522248452681, 'tp_mult': 2.730135284379642, 'tsl_mult': 0.8031232833858262, 'strategy': 'mean_reversion', 'time_stop': 179, 'use_sma': False, 'use_atr': False, 'use_adx': True, 'use_ema': False, 'use_spike': True, 'rsi_required': False, 'edge_k': 1.5770138730484327, 'edge_cap': 0.4134846107391917, 'bull_strategy': 'breakout', 'bull_bb_std_mult': 3.152906533017941, 'bull_rsi_os': 31, 'bull_rsi_ob': 52, 'bull_adx_thresh': 14.522006430658795, 'bull_atr_min_pct': 0.013909921761084562, 'bull_atr_max_pct': 0.12173111254784551, 'bull_tp_mult': 1.2543626453348988, 'bull_tsl_mult': 0.3471612733757951, 'bull_time_stop': 280, 'bull_use_sma': True, 'bull_use_ema': False, 'bull_use_atr': False, 'bull_use_adx': False, 'bull_use_spike': True, 'bull_rsi_required': False, 'bear_strategy': 'mean_reversion', 'bear_bb_std_mult': 1.7315413367355963, 'bear_rsi_os': 54, 'bear_rsi_ob': 61, 'bear_adx_thresh': 28.561004052096816, 'bear_atr_min_pct': 0.0022015842383572622, 'bear_atr_max_pct': 0.03696656288023136, 'bear_tp_mult': 2.6098212438630597, 'bear_tsl_mult': 0.1707744203794812, 'bear_time_stop': 133, 'bear_use_sma': False, 'bear_use_ema': False, 'bear_use_atr': False, 'bear_use_adx': False, 'bear_use_spike': True, 'bear_rsi_required': True, 'sideways_strategy': 'mean_reversion', 'sideways_bb_std_mult': 3.234495075437514, 'sideways_rsi_os': 47, 'sideways_rsi_ob': 76, 'sideways_adx_thresh': 26.647955852753736, 'sideways_atr_min_pct': 0.026755115354515507, 'sideways_atr_max_pct': 0.02392149149066009, 'sideways_tp_mult': 2.3603800945012288, 'sideways_tsl_mult': 0.2000749693228946, 'sideways_time_stop': 114, 'sideways_use_sma': True, 'sideways_use_ema': True, 'sideways_use_atr': False, 'sideways_use_adx': False, 'sideways_use_spike': True, 'sideways_rsi_required': True}.
[I 2025-09-01 03:06:45,889] Trial 268 finished with values: [-1000000000.0, 1000000000.0] and parameters: {'p_sma': 58, 'p_std': 53, 'p_atr': 29, 'p_adx': 24, 'rsi_period': 10, 'ema1': 19, 'ema2': 44, 'slip_atr_k': 0.08923167553801445, 'slip_spread_k': 0.17219544662972064, 'spread_hl_frac': 0.02857544098681119, 'bb_std_mult': 1.500557554071589, 'rsi_os': 15, 'rsi_ob': 47, 'vol_spike': 0.019271394438782147, 'adx_thresh': 11.88064255231384, 'atr_min_pct': 0.027881915716323223, 'atr_max_pct': 0.050554437528914996, 'tp_mult': 2.458123931161269, 'tsl_mult': 0.75302125927458, 'strategy': 'mean_reversion', 'time_stop': 166, 'use_sma': True, 'use_atr': False, 'use_adx': True, 'use_ema': True, 'use_spike': True, 'rsi_required': False, 'edge_k': 1.7325141869830485, 'edge_cap': 0.5711311318528699, 'bull_strategy': 'breakout', 'bull_bb_std_mult': 2.0257081731433013, 'bull_rsi_os': 50, 'bull_rsi_ob': 49, 'bull_adx_thresh': 11.039783608843099, 'bull_atr_min_pct': 0.02584784890823811, 'bull_atr_max_pct': 0.03148209283839865, 'bull_tp_mult': 2.66197205318635, 'bull_tsl_mult': 0.2513209769857874, 'bull_time_stop': 292, 'bull_use_sma': True, 'bull_use_ema': False, 'bull_use_atr': False, 'bull_use_adx': True, 'bull_use_spike': False, 'bull_rsi_required': False, 'bear_strategy': 'breakout', 'bear_bb_std_mult': 2.270556850151235, 'bear_rsi_os': 52, 'bear_rsi_ob': 67, 'bear_adx_thresh': 34.093607845245636, 'bear_atr_min_pct': 0.02693843653014364, 'bear_atr_max_pct': 0.03290613658412083, 'bear_tp_mult': 2.0281382625066295, 'bear_tsl_mult': 0.09815311917789309, 'bear_time_stop': 142, 'bear_use_sma': True, 'bear_use_ema': True, 'bear_use_atr': True, 'bear_use_adx': False, 'bear_use_spike': True, 'bear_rsi_required': False, 'sideways_strategy': 'breakout', 'sideways_bb_std_mult': 2.037715528615125, 'sideways_rsi_os': 43, 'sideways_rsi_ob': 49, 'sideways_adx_thresh': 17.359442363029558, 'sideways_atr_min_pct': 0.028113007610944568, 'sideways_atr_max_pct': 0.019623514279899418, 'sideways_tp_mult': 1.7203588702730275, 'sideways_tsl_mult': 0.16980508053475252, 'sideways_time_stop': 132, 'sideways_use_sma': True, 'sideways_use_ema': False, 'sideways_use_atr': True, 'sideways_use_adx': False, 'sideways_use_spike': True, 'sideways_rsi_required': True}.
[I 2025-09-01 03:07:24,103] Trial 265 finished with values: [-1000000000.0, 1000000000.0] and parameters: {'p_sma': 26, 'p_std': 27, 'p_atr': 28, 'p_adx': 17, 'rsi_period': 13, 'ema1': 14, 'ema2': 20, 'slip_atr_k': 0.010556201638162904, 'slip_spread_k': 0.1704790274013182, 'spread_hl_frac': 0.02598817808644697, 'bb_std_mult': 1.5166641489806343, 'rsi_os': 20, 'rsi_ob': 77, 'vol_spike': 0.22893235073603124, 'adx_thresh': 7.951757072000909, 'atr_min_pct': 1.9635059089327667e-05, 'atr_max_pct': 0.06564374183565257, 'tp_mult': 2.4750640938957535, 'tsl_mult': 0.8001883172917468, 'strategy': 'mean_reversion', 'time_stop': 178, 'use_sma': False, 'use_atr': False, 'use_adx': True, 'use_ema': False, 'use_spike': True, 'rsi_required': False, 'edge_k': 0.1308233947200123, 'edge_cap': 0.49288802383044217, 'bull_strategy': 'breakout', 'bull_bb_std_mult': 3.1431715803385165, 'bull_rsi_os': 14, 'bull_rsi_ob': 56, 'bull_adx_thresh': 22.77413732759671, 'bull_atr_min_pct': 0.02326583346083185, 'bull_atr_max_pct': 0.03211786292590102, 'bull_tp_mult': 2.6720143143075132, 'bull_tsl_mult': 0.27702126026730906, 'bull_time_stop': 263, 'bull_use_sma': True, 'bull_use_ema': False, 'bull_use_atr': False, 'bull_use_adx': True, 'bull_use_spike': True, 'bull_rsi_required': False, 'bear_strategy': 'breakout', 'bear_bb_std_mult': 1.471406868108915, 'bear_rsi_os': 49, 'bear_rsi_ob': 59, 'bear_adx_thresh': 33.998233884335754, 'bear_atr_min_pct': 0.02666992438726785, 'bear_atr_max_pct': 0.08166791804874726, 'bear_tp_mult': 1.0945965526667072, 'bear_tsl_mult': 0.004492860404369359, 'bear_time_stop': 78, 'bear_use_sma': False, 'bear_use_ema': True, 'bear_use_atr': True, 'bear_use_adx': False, 'bear_use_spike': True, 'bear_rsi_required': False, 'sideways_strategy': 'breakout', 'sideways_bb_std_mult': 2.0572258780593526, 'sideways_rsi_os': 47, 'sideways_rsi_ob': 76, 'sideways_adx_thresh': 26.69332344207362, 'sideways_atr_min_pct': 0.026241487258515866, 'sideways_atr_max_pct': 0.020057203124370183, 'sideways_tp_mult': 1.6015421919099966, 'sideways_tsl_mult': 0.17992698217476708, 'sideways_time_stop': 234, 'sideways_use_sma': True, 'sideways_use_ema': False, 'sideways_use_atr': True, 'sideways_use_adx': False, 'sideways_use_spike': True, 'sideways_rsi_required': True}.
[I 2025-09-01 03:07:24,997] Trial 267 finished with values: [-0.03948664004225133, 0.039224426520546474] and parameters: {'p_sma': 30, 'p_std': 57, 'p_atr': 29, 'p_adx': 17, 'rsi_period': 10, 'ema1': 13, 'ema2': 47, 'slip_atr_k': 0.009186703110205877, 'slip_spread_k': 0.7614678627478753, 'spread_hl_frac': 0.03543567329438484, 'bb_std_mult': 1.5049506977205787, 'rsi_os': 15, 'rsi_ob': 80, 'vol_spike': 0.2180201127839288, 'adx_thresh': 11.913848173678812, 'atr_min_pct': 0.028400093823343006, 'atr_max_pct': 0.11796051992420242, 'tp_mult': 2.6699829029663977, 'tsl_mult': 0.7655140600621513, 'strategy': 'mean_reversion', 'time_stop': 173, 'use_sma': False, 'use_atr': False, 'use_adx': True, 'use_ema': True, 'use_spike': True, 'rsi_required': False, 'edge_k': 0.06400954165576106, 'edge_cap': 0.5783402913731643, 'bull_strategy': 'breakout', 'bull_bb_std_mult': 2.0060316651724244, 'bull_rsi_os': 55, 'bull_rsi_ob': 54, 'bull_adx_thresh': 22.933215376701863, 'bull_atr_min_pct': 0.011158580440727131, 'bull_atr_max_pct': 0.11054023206722323, 'bull_tp_mult': 2.542557017712011, 'bull_tsl_mult': 0.3770414734498937, 'bull_time_stop': 291, 'bull_use_sma': True, 'bull_use_ema': False, 'bull_use_atr': False, 'bull_use_adx': True, 'bull_use_spike': True, 'bull_rsi_required': False, 'bear_strategy': 'breakout', 'bear_bb_std_mult': 2.2610373716458256, 'bear_rsi_os': 54, 'bear_rsi_ob': 67, 'bear_adx_thresh': 24.233384161807233, 'bear_atr_min_pct': 0.0024980263855286684, 'bear_atr_max_pct': 0.020616866153570765, 'bear_tp_mult': 1.0959235559211398, 'bear_tsl_mult': 0.6288842749864854, 'bear_time_stop': 139, 'bear_use_sma': True, 'bear_use_ema': True, 'bear_use_atr': True, 'bear_use_adx': False, 'bear_use_spike': True, 'bear_rsi_required': False, 'sideways_strategy': 'mean_reversion', 'sideways_bb_std_mult': 2.0570921252174115, 'sideways_rsi_os': 49, 'sideways_rsi_ob': 76, 'sideways_adx_thresh': 27.439271689031997, 'sideways_atr_min_pct': 0.027987100536294215, 'sideways_atr_max_pct': 0.01949150004297465, 'sideways_tp_mult': 1.7214607132394018, 'sideways_tsl_mult': 0.9276660447115967, 'sideways_time_stop': 111, 'sideways_use_sma': True, 'sideways_use_ema': False, 'sideways_use_atr': True, 'sideways_use_adx': False, 'sideways_use_spike': True, 'sideways_rsi_required': True}.
[I 2025-09-01 03:07:25,552] Trial 266 finished with values: [-0.025732854775140535, 0.02558226384924484] and parameters: {'p_sma': 30, 'p_std': 35, 'p_atr': 28, 'p_adx': 24, 'rsi_period': 13, 'ema1': 21, 'ema2': 56, 'slip_atr_k': 0.01287282154445534, 'slip_spread_k': 0.7608546642860752, 'spread_hl_frac': 0.020227098576653814, 'bb_std_mult': 1.5323633261227672, 'rsi_os': 37, 'rsi_ob': 78, 'vol_spike': 0.09105660811178906, 'adx_thresh': 18.841999572696913, 'atr_min_pct': 0.00024636293180919054, 'atr_max_pct': 0.11835061194752239, 'tp_mult': 1.628832886698109, 'tsl_mult': 0.765576438319384, 'strategy': 'mean_reversion', 'time_stop': 175, 'use_sma': False, 'use_atr': False, 'use_adx': True, 'use_ema': True, 'use_spike': True, 'rsi_required': False, 'edge_k': 0.1361427467925358, 'edge_cap': 0.5713520092820014, 'bull_strategy': 'breakout', 'bull_bb_std_mult': 3.1448373200256974, 'bull_rsi_os': 17, 'bull_rsi_ob': 56, 'bull_adx_thresh': 22.93746837414521, 'bull_atr_min_pct': 0.0011378675119403225, 'bull_atr_max_pct': 0.11421144508810482, 'bull_tp_mult': 1.9808609162566186, 'bull_tsl_mult': 0.24840078608237684, 'bull_time_stop': 262, 'bull_use_sma': True, 'bull_use_ema': False, 'bull_use_atr': False, 'bull_use_adx': True, 'bull_use_spike': True, 'bull_rsi_required': False, 'bear_strategy': 'breakout', 'bear_bb_std_mult': 2.2649942875820086, 'bear_rsi_os': 54, 'bear_rsi_ob': 61, 'bear_adx_thresh': 34.233578690866764, 'bear_atr_min_pct': 0.003553495304874454, 'bear_atr_max_pct': 0.0763855806528576, 'bear_tp_mult': 2.998907384958279, 'bear_tsl_mult': 0.5711239015347497, 'bear_time_stop': 187, 'bear_use_sma': False, 'bear_use_ema': True, 'bear_use_atr': True, 'bear_use_adx': False, 'bear_use_spike': True, 'bear_rsi_required': False, 'sideways_strategy': 'breakout', 'sideways_bb_std_mult': 3.2457596436650364, 'sideways_rsi_os': 47, 'sideways_rsi_ob': 48, 'sideways_adx_thresh': 20.660161117408805, 'sideways_atr_min_pct': 0.026343584114494632, 'sideways_atr_max_pct': 0.022995897913094022, 'sideways_tp_mult': 1.6678417386279882, 'sideways_tsl_mult': 0.1815364923129569, 'sideways_time_stop': 6, 'sideways_use_sma': True, 'sideways_use_ema': False, 'sideways_use_atr': True, 'sideways_use_adx': False, 'sideways_use_spike': True, 'sideways_rsi_required': True}.
[I 2025-09-01 03:07:25,833] Trial 269 finished with values: [-1000000000.0, 1000000000.0] and parameters: {'p_sma': 43, 'p_std': 6, 'p_atr': 29, 'p_adx': 17, 'rsi_period': 12, 'ema1': 13, 'ema2': 15, 'slip_atr_k': 0.01678544424729839, 'slip_spread_k': 0.19260444731548804, 'spread_hl_frac': 0.019249388333951643, 'bb_std_mult': 3.097931381296871, 'rsi_os': 26, 'rsi_ob': 81, 'vol_spike': 0.18739707301216146, 'adx_thresh': 7.489493520080838, 'atr_min_pct': 0.0023747179864946587, 'atr_max_pct': 0.08061098877589598, 'tp_mult': 1.5591523749902676, 'tsl_mult': 0.35082247340999734, 'strategy': 'mean_reversion', 'time_stop': 173, 'use_sma': False, 'use_atr': True, 'use_adx': True, 'use_ema': False, 'use_spike': True, 'rsi_required': False, 'edge_k': 0.07445621864738347, 'edge_cap': 0.4911750115408803, 'bull_strategy': 'breakout', 'bull_bb_std_mult': 1.0225570642938981, 'bull_rsi_os': 13, 'bull_rsi_ob': 54, 'bull_adx_thresh': 22.802379157226756, 'bull_atr_min_pct': 0.023073768450319464, 'bull_atr_max_pct': 0.12000699229790006, 'bull_tp_mult': 1.3630898632080761, 'bull_tsl_mult': 0.2730050978116372, 'bull_time_stop': 31, 'bull_use_sma': True, 'bull_use_ema': False, 'bull_use_atr': False, 'bull_use_adx': True, 'bull_use_spike': True, 'bull_rsi_required': False, 'bear_strategy': 'breakout', 'bear_bb_std_mult': 2.313392766063068, 'bear_rsi_os': 54, 'bear_rsi_ob': 85, 'bear_adx_thresh': 23.83182126415575, 'bear_atr_min_pct': 0.025916254110610337, 'bear_atr_max_pct': 0.07651301675095915, 'bear_tp_mult': 1.0965184873637424, 'bear_tsl_mult': 0.5728929973173845, 'bear_time_stop': 58, 'bear_use_sma': False, 'bear_use_ema': True, 'bear_use_atr': False, 'bear_use_adx': False, 'bear_use_spike': True, 'bear_rsi_required': False, 'sideways_strategy': 'breakout', 'sideways_bb_std_mult': 1.941312040334584, 'sideways_rsi_os': 49, 'sideways_rsi_ob': 46, 'sideways_adx_thresh': 27.512469811161893, 'sideways_atr_min_pct': 0.026087004896468376, 'sideways_atr_max_pct': 0.027712670734717122, 'sideways_tp_mult': 1.7651368153006937, 'sideways_tsl_mult': 0.9279154963630425, 'sideways_time_stop': 236, 'sideways_use_sma': True, 'sideways_use_ema': True, 'sideways_use_atr': True, 'sideways_use_adx': False, 'sideways_use_spike': True, 'sideways_rsi_required': True}.
