[I 2025-09-01 02:31:37,198] Trial 61 finished with values: [-1000000000.0, 1000000000.0] and parameters: {'p_sma': 11, 'p_std': 35, 'p_atr': 8, 'p_adx': 16, 'rsi_period': 62, 'ema1': 5, 'ema2': 10, 'slip_atr_k': 0.15106096061972646, 'slip_spread_k': 0.1254586527012419, 'spread_hl_frac': 0.012823290114479224, 'bb_std_mult': 2.070788127811561, 'rsi_os': 42, 'rsi_ob': 76, 'vol_spike': 0.18319739723173842, 'adx_thresh': 19.271152148369737, 'atr_min_pct': 0.018775496897879992, 'atr_max_pct': 0.07728643708806593, 'tp_mult': 1.9846689836985896, 'tsl_mult': 0.5500898837414794, 'strategy': 'breakout', 'time_stop': 127, 'use_sma': False, 'use_atr': False, 'use_adx': False, 'use_ema': True, 'use_spike': True, 'rsi_required': False, 'edge_k': 0.6050096238081032, 'edge_cap': 0.08694249512341062, 'bull_strategy': 'mean_reversion', 'bull_bb_std_mult': 1.8738798383833426, 'bull_rsi_os': 15, 'bull_rsi_ob': 86, 'bull_adx_thresh': 20.137641079964546, 'bull_atr_min_pct': 0.0015563259830839325, 'bull_atr_max_pct': 0.14265994482382527, 'bull_tp_mult': 1.4765461682209535, 'bull_tsl_mult': 0.08229298551741554, 'bull_time_stop': 26, 'bull_use_sma': False, 'bull_use_ema': False, 'bull_use_atr': False, 'bull_use_adx': False, 'bull_use_spike': True, 'bull_rsi_required': True, 'bear_strategy': 'breakout', 'bear_bb_std_mult': 3.1248355083956327, 'bear_rsi_os': 19, 'bear_rsi_ob': 63, 'bear_adx_thresh': 27.577626615780424, 'bear_atr_min_pct': 0.011638724959217778, 'bear_atr_max_pct': 0.10468897125717037, 'bear_tp_mult': 2.429812893525297, 'bear_tsl_mult': 0.9502551720726772, 'bear_time_stop': 32, 'bear_use_sma': False, 'bear_use_ema': False, 'bear_use_atr': False, 'bear_use_adx': True, 'bear_use_spike': True, 'bear_rsi_required': True, 'sideways_strategy': 'breakout', 'sideways_bb_std_mult': 2.238519006585593, 'sideways_rsi_os': 8, 'sideways_rsi_ob': 54, 'sideways_adx_thresh': 29.740582264473062, 'sideways_atr_min_pct': 0.013969377822477735, 'sideways_atr_max_pct': 0.1194920418290771, 'sideways_tp_mult': 2.69486721997448, 'sideways_tsl_mult': 0.5770480011218443, 'sideways_time_stop': 54, 'sideways_use_sma': False, 'sideways_use_ema': True, 'sideways_use_atr': True, 'sideways_use_adx': True, 'sideways_use_spike': True, 'sideways_rsi_required': False}.
[I 2025-09-01 02:32:28,984] Trial 65 finished with values: [-1000000000.0, 1000000000.0] and parameters: {'p_sma': 55, 'p_std': 53, 'p_atr': 21, 'p_adx': 17, 'rsi_period': 35, 'ema1': 5, 'ema2': 54, 'slip_atr_k': 0.1507493186820835, 'slip_spread_k': 0.12230800942176699, 'spread_hl_frac': 0.008348948534228913, 'bb_std_mult': 2.049989969336736, 'rsi_os': 41, 'rsi_ob': 83, 'vol_spike': 0.1647211612223702, 'adx_thresh': 22.389849326584557, 'atr_min_pct': 4.9256064889584283e-05, 'atr_max_pct': 0.09808591958376625, 'tp_mult': 1.9616561022193533, 'tsl_mult': 0.6243433874912354, 'strategy': 'breakout', 'time_stop': 162, 'use_sma': False, 'use_atr': False, 'use_adx': False, 'use_ema': False, 'use_spike': True, 'rsi_required': False, 'edge_k': 0.24206100509767214, 'edge_cap': 0.21669301571115634, 'bull_strategy': 'mean_reversion', 'bull_bb_std_mult': 1.393904036550369, 'bull_rsi_os': 46, 'bull_rsi_ob': 86, 'bull_adx_thresh': 19.875534417633254, 'bull_atr_min_pct': 0.009731104938167326, 'bull_atr_max_pct': 0.10800975399004009, 'bull_tp_mult': 2.2563410158851456, 'bull_tsl_mult': 0.5682074221770964, 'bull_time_stop': 62, 'bull_use_sma': False, 'bull_use_ema': False, 'bull_use_atr': False, 'bull_use_adx': True, 'bull_use_spike': True, 'bull_rsi_required': True, 'bear_strategy': 'mean_reversion', 'bear_bb_std_mult': 2.643081648414621, 'bear_rsi_os': 7, 'bear_rsi_ob': 63, 'bear_adx_thresh': 30.15179063396073, 'bear_atr_min_pct': 0.023020456493600204, 'bear_atr_max_pct': 0.11299874597383106, 'bear_tp_mult': 2.3170089082028866, 'bear_tsl_mult': 0.9616238090131944, 'bear_time_stop': 235, 'bear_use_sma': False, 'bear_use_ema': False, 'bear_use_atr': False, 'bear_use_adx': True, 'bear_use_spike': True, 'bear_rsi_required': True, 'sideways_strategy': 'mean_reversion', 'sideways_bb_std_mult': 2.635226768302773, 'sideways_rsi_os': 17, 'sideways_rsi_ob': 54, 'sideways_adx_thresh': 29.58882375137654, 'sideways_atr_min_pct': 0.014346419648990172, 'sideways_atr_max_pct': 0.1367482463991434, 'sideways_tp_mult': 1.5531905947263471, 'sideways_tsl_mult': 0.5749552491940527, 'sideways_time_stop': 233, 'sideways_use_sma': False, 'sideways_use_ema': True, 'sideways_use_atr': True, 'sideways_use_adx': True, 'sideways_use_spike': True, 'sideways_rsi_required': False}.
[I 2025-09-01 02:32:28,050] Trial 64 finished with values: [-0.028922785089740555, 0.02874406912990332] and parameters: {'p_sma': 22, 'p_std': 5, 'p_atr': 21, 'p_adx': 16, 'rsi_period': 7, 'ema1': 5, 'ema2': 48, 'slip_atr_k': 0.16983439737824443, 'slip_spread_k': 0.11100698626913741, 'spread_hl_frac': 4.6252836355399965e-05, 'bb_std_mult': 1.9641764590970832, 'rsi_os': 5, 'rsi_ob': 82, 'vol_spike': 0.16255440102987292, 'adx_thresh': 34.87796928071598, 'atr_min_pct': 0.008482904831749662, 'atr_max_pct': 0.10061327525034444, 'tp_mult': 2.111516144266433, 'tsl_mult': 0.6248964018374475, 'strategy': 'breakout', 'time_stop': 225, 'use_sma': False, 'use_atr': False, 'use_adx': False, 'use_ema': False, 'use_spike': True, 'rsi_required': False, 'edge_k': 0.2616418244348908, 'edge_cap': 0.37857056266908895, 'bull_strategy': 'mean_reversion', 'bull_bb_std_mult': 1.4660362670137146, 'bull_rsi_os': 45, 'bull_rsi_ob': 86, 'bull_adx_thresh': 20.432143810743625, 'bull_atr_min_pct': 0.00294283693717222, 'bull_atr_max_pct': 0.10768618709050157, 'bull_tp_mult': 1.6949449707930195, 'bull_tsl_mult': 0.5805528659025047, 'bull_time_stop': 63, 'bull_use_sma': False, 'bull_use_ema': False, 'bull_use_atr': False, 'bull_use_adx': True, 'bull_use_spike': True, 'bull_rsi_required': True, 'bear_strategy': 'mean_reversion', 'bear_bb_std_mult': 2.448477206746748, 'bear_rsi_os': 35, 'bear_rsi_ob': 93, 'bear_adx_thresh': 29.65631459223051, 'bear_atr_min_pct': 0.021901807855982218, 'bear_atr_max_pct': 0.06260503495443037, 'bear_tp_mult': 2.3305639541975847, 'bear_tsl_mult': 0.9659887833790718, 'bear_time_stop': 234, 'bear_use_sma': False, 'bear_use_ema': False, 'bear_use_atr': False, 'bear_use_adx': True, 'bear_use_spike': True, 'bear_rsi_required': True, 'sideways_strategy': 'mean_reversion', 'sideways_bb_std_mult': 2.8805233712348155, 'sideways_rsi_os': 45, 'sideways_rsi_ob': 55, 'sideways_adx_thresh': 29.819718985543798, 'sideways_atr_min_pct': 0.013469495787824233, 'sideways_atr_max_pct': 0.13142849712605162, 'sideways_tp_mult': 1.024067677651361, 'sideways_tsl_mult': 0.909927660736208, 'sideways_time_stop': 228, 'sideways_use_sma': False, 'sideways_use_ema': True, 'sideways_use_atr': True, 'sideways_use_adx': True, 'sideways_use_spike': True, 'sideways_rsi_required': False}.
[I 2025-09-01 02:32:29,027] Trial 67 finished with values: [-1000000000.0, 1000000000.0] and parameters: {'p_sma': 7, 'p_std': 27, 'p_atr': 21, 'p_adx': 17, 'rsi_period': 51, 'ema1': 6, 'ema2': 48, 'slip_atr_k': 0.048153523297736756, 'slip_spread_k': 0.46673746364626606, 'spread_hl_frac': 0.00805348978049318, 'bb_std_mult': 1.6322191774681274, 'rsi_os': 6, 'rsi_ob': 83, 'vol_spike': 0.16538781407996472, 'adx_thresh': 25.947135203996385, 'atr_min_pct': 0.008302802713932614, 'atr_max_pct': 0.10219569291718995, 'tp_mult': 2.1198397508987235, 'tsl_mult': 0.6205828241932413, 'strategy': 'mean_reversion', 'time_stop': 226, 'use_sma': False, 'use_atr': False, 'use_adx': False, 'use_ema': False, 'use_spike': True, 'rsi_required': False, 'edge_k': 0.2760770774870357, 'edge_cap': 0.8612705838221418, 'bull_strategy': 'mean_reversion', 'bull_bb_std_mult': 1.4783906531608626, 'bull_rsi_os': 43, 'bull_rsi_ob': 64, 'bull_adx_thresh': 17.201939437107242, 'bull_atr_min_pct': 0.0028075008470900085, 'bull_atr_max_pct': 0.07658092587672498, 'bull_tp_mult': 1.6920430047292838, 'bull_tsl_mult': 0.5696982794215372, 'bull_time_stop': 60, 'bull_use_sma': True, 'bull_use_ema': False, 'bull_use_atr': False, 'bull_use_adx': True, 'bull_use_spike': True, 'bull_rsi_required': False, 'bear_strategy': 'breakout', 'bear_bb_std_mult': 2.654080863989822, 'bear_rsi_os': 7, 'bear_rsi_ob': 52, 'bear_adx_thresh': 22.05021365251326, 'bear_atr_min_pct': 0.00928297661921206, 'bear_atr_max_pct': 0.11725233072666877, 'bear_tp_mult': 2.3201276155977077, 'bear_tsl_mult': 0.03342144958034199, 'bear_time_stop': 234, 'bear_use_sma': False, 'bear_use_ema': True, 'bear_use_atr': False, 'bear_use_adx': True, 'bear_use_spike': True, 'bear_rsi_required': True, 'sideways_strategy': 'mean_reversion', 'sideways_bb_std_mult': 2.8515188733861203, 'sideways_rsi_os': 12, 'sideways_rsi_ob': 56, 'sideways_adx_thresh': 8.462815901008158, 'sideways_atr_min_pct': 0.006168610969400403, 'sideways_atr_max_pct': 0.13813360309318445, 'sideways_tp_mult': 1.5811559508280935, 'sideways_tsl_mult': 0.7530930697530738, 'sideways_time_stop': 280, 'sideways_use_sma': True, 'sideways_use_ema': True, 'sideways_use_atr': True, 'sideways_use_adx': True, 'sideways_use_spike': True, 'sideways_rsi_required': False}.
[I 2025-09-01 02:32:30,950] Trial 66 finished with values: [-0.021082591449492427, 0.021183752690938105] and parameters: {'p_sma': 44, 'p_std': 26, 'p_atr': 21, 'p_adx': 16, 'rsi_period': 49, 'ema1': 6, 'ema2': 26, 'slip_atr_k': 0.14622278036293027, 'slip_spread_k': 0.46467118133214, 'spread_hl_frac': 0.0036291809386176984, 'bb_std_mult': 1.602387614244389, 'rsi_os': 43, 'rsi_ob': 69, 'vol_spike': 0.18926493413720835, 'adx_thresh': 26.114507292239164, 'atr_min_pct': 0.007913838430072467, 'atr_max_pct': 0.10150219299206548, 'tp_mult': 2.1282434787732574, 'tsl_mult': 0.6200100652793806, 'strategy': 'breakout', 'time_stop': 63, 'use_sma': False, 'use_atr': False, 'use_adx': False, 'use_ema': False, 'use_spike': True, 'rsi_required': False, 'edge_k': 0.7366091731421283, 'edge_cap': 0.8312039707953374, 'bull_strategy': 'mean_reversion', 'bull_bb_std_mult': 1.1581271092815795, 'bull_rsi_os': 46, 'bull_rsi_ob': 64, 'bull_adx_thresh': 19.932207529043477, 'bull_atr_min_pct': 0.002755229964142684, 'bull_atr_max_pct': 0.028668126064680943, 'bull_tp_mult': 1.6812533873457562, 'bull_tsl_mult': 0.9223792766134842, 'bull_time_stop': 58, 'bull_use_sma': False, 'bull_use_ema': False, 'bull_use_atr': False, 'bull_use_adx': False, 'bull_use_spike': True, 'bull_rsi_required': False, 'bear_strategy': 'breakout', 'bear_bb_std_mult': 2.6484288094465906, 'bear_rsi_os': 7, 'bear_rsi_ob': 62, 'bear_adx_thresh': 30.011471152781894, 'bear_atr_min_pct': 0.011899818800041474, 'bear_atr_max_pct': 0.11673843079994155, 'bear_tp_mult': 2.3227108084085013, 'bear_tsl_mult': 0.04895356662878381, 'bear_time_stop': 80, 'bear_use_sma': False, 'bear_use_ema': False, 'bear_use_atr': False, 'bear_use_adx': True, 'bear_use_spike': True, 'bear_rsi_required': True, 'sideways_strategy': 'mean_reversion', 'sideways_bb_std_mult': 2.921437386914339, 'sideways_rsi_os': 17, 'sideways_rsi_ob': 54, 'sideways_adx_thresh': 9.14141860930966, 'sideways_atr_min_pct': 0.014320049190604495, 'sideways_atr_max_pct': 0.13450052667034812, 'sideways_tp_mult': 1.592556947620934, 'sideways_tsl_mult': 0.5718732761108201, 'sideways_time_stop': 282, 'sideways_use_sma': True, 'sideways_use_ema': True, 'sideways_use_atr': True, 'sideways_use_adx': True, 'sideways_use_spike': True, 'sideways_rsi_required': False}.
[I 2025-09-01 02:33:14,152] Trial 71 finished with values: [-1000000000.0, 1000000000.0] and parameters: {'p_sma': 46, 'p_std': 9, 'p_atr': 25, 'p_adx': 15, 'rsi_period': 11, 'ema1': 16, 'ema2': 27, 'slip_atr_k': 0.020484475323435544, 'slip_spread_k': 0.31261935508648125, 'spread_hl_frac': 0.024802206830199954, 'bb_std_mult': 1.5210856214495245, 'rsi_os': 11, 'rsi_ob': 69, 'vol_spike': 0.2599146641563352, 'adx_thresh': 11.475962365445088, 'atr_min_pct': 0.017674121766079878, 'atr_max_pct': 0.11529567388361517, 'tp_mult': 1.8463342949235075, 'tsl_mult': 0.6865573100443487, 'strategy': 'mean_reversion', 'time_stop': 283, 'use_sma': False, 'use_atr': True, 'use_adx': False, 'use_ema': False, 'use_spike': True, 'rsi_required': False, 'edge_k': 0.5266039481961471, 'edge_cap': 0.7079304769435155, 'bull_strategy': 'mean_reversion', 'bull_bb_std_mult': 1.1527579975596314, 'bull_rsi_os': 11, 'bull_rsi_ob': 69, 'bull_adx_thresh': 24.628330088762816, 'bull_atr_min_pct': 0.017785737232759776, 'bull_atr_max_pct': 0.1207492247564721, 'bull_tp_mult': 1.6881033265936127, 'bull_tsl_mult': 0.9127792332972611, 'bull_time_stop': 128, 'bull_use_sma': True, 'bull_use_ema': False, 'bull_use_atr': False, 'bull_use_adx': False, 'bull_use_spike': False, 'bull_rsi_required': False, 'bear_strategy': 'breakout', 'bear_bb_std_mult': 1.8875292025036876, 'bear_rsi_os': 8, 'bear_rsi_ob': 94, 'bear_adx_thresh': 6.7491580988639885, 'bear_atr_min_pct': 0.008094487322445717, 'bear_atr_max_pct': 0.14936303254319183, 'bear_tp_mult': 2.1475602763638633, 'bear_tsl_mult': 0.8984149021654192, 'bear_time_stop': 81, 'bear_use_sma': False, 'bear_use_ema': False, 'bear_use_atr': False, 'bear_use_adx': True, 'bear_use_spike': True, 'bear_rsi_required': True, 'sideways_strategy': 'breakout', 'sideways_bb_std_mult': 2.892927561789456, 'sideways_rsi_os': 10, 'sideways_rsi_ob': 48, 'sideways_adx_thresh': 13.579607697421242, 'sideways_atr_min_pct': 0.01867442312733665, 'sideways_atr_max_pct': 0.1295026370957431, 'sideways_tp_mult': 1.4597672061468772, 'sideways_tsl_mult': 0.9576256014435183, 'sideways_time_stop': 207, 'sideways_use_sma': True, 'sideways_use_ema': True, 'sideways_use_atr': True, 'sideways_use_adx': True, 'sideways_use_spike': True, 'sideways_rsi_required': False}.
[I 2025-09-01 02:33:15,064] Trial 70 finished with values: [-1000000000.0, 1000000000.0] and parameters: {'p_sma': 21, 'p_std': 57, 'p_atr': 20, 'p_adx': 15, 'rsi_period': 11, 'ema1': 16, 'ema2': 27, 'slip_atr_k': 0.17058904314048656, 'slip_spread_k': 0.5299833905101734, 'spread_hl_frac': 0.025388303590656157, 'bb_std_mult': 1.7887509612558283, 'rsi_os': 12, 'rsi_ob': 62, 'vol_spike': 0.13916928935291784, 'adx_thresh': 10.923316266828454, 'atr_min_pct': 0.014546518806982949, 'atr_max_pct': 0.11923504026393447, 'tp_mult': 1.8674032823017543, 'tsl_mult': 0.3159997294882497, 'strategy': 'breakout', 'time_stop': 249, 'use_sma': False, 'use_atr': False, 'use_adx': False, 'use_ema': False, 'use_spike': True, 'rsi_required': False, 'edge_k': 0.5319627234357605, 'edge_cap': 0.3941339850429449, 'bull_strategy': 'mean_reversion', 'bull_bb_std_mult': 0.5253000200998179, 'bull_rsi_os': 10, 'bull_rsi_ob': 69, 'bull_adx_thresh': 24.059831831874984, 'bull_atr_min_pct': 0.00014780476074864412, 'bull_atr_max_pct': 0.11903466038645755, 'bull_tp_mult': 1.6759560955821533, 'bull_tsl_mult': 0.9187030089150265, 'bull_time_stop': 129, 'bull_use_sma': True, 'bull_use_ema': False, 'bull_use_atr': False, 'bull_use_adx': False, 'bull_use_spike': False, 'bull_rsi_required': True, 'bear_strategy': 'breakout', 'bear_bb_std_mult': 1.5626175378326452, 'bear_rsi_os': 35, 'bear_rsi_ob': 45, 'bear_adx_thresh': 12.756994814383955, 'bear_atr_min_pct': 0.009848201538971079, 'bear_atr_max_pct': 0.05511677461774939, 'bear_tp_mult': 2.1152483537002382, 'bear_tsl_mult': 0.8858432252236124, 'bear_time_stop': 11, 'bear_use_sma': False, 'bear_use_ema': False, 'bear_use_atr': False, 'bear_use_adx': True, 'bear_use_spike': True, 'bear_rsi_required': True, 'sideways_strategy': 'breakout', 'sideways_bb_std_mult': 3.1850891057075015, 'sideways_rsi_os': 42, 'sideways_rsi_ob': 49, 'sideways_adx_thresh': 26.147613858066247, 'sideways_atr_min_pct': 0.01909634205803819, 'sideways_atr_max_pct': 0.12745455663898628, 'sideways_tp_mult': 2.8497720441214263, 'sideways_tsl_mult': 0.4785490695351659, 'sideways_time_stop': 168, 'sideways_use_sma': False, 'sideways_use_ema': True, 'sideways_use_atr': True, 'sideways_use_adx': True, 'sideways_use_spike': True, 'sideways_rsi_required': False}.
[I 2025-09-01 02:33:16,068] Trial 68 finished with values: [-1000000000.0, 1000000000.0] and parameters: {'p_sma': 44, 'p_std': 9, 'p_atr': 20, 'p_adx': 14, 'rsi_period': 43, 'ema1': 16, 'ema2': 25, 'slip_atr_k': 0.17241895719097666, 'slip_spread_k': 0.30819495374737327, 'spread_hl_frac': 0.00029450547330867483, 'bb_std_mult': 1.8589608038839147, 'rsi_os': 5, 'rsi_ob': 69, 'vol_spike': 0.27627495802574387, 'adx_thresh': 17.6711020303748, 'atr_min_pct': 0.017625854907591755, 'atr_max_pct': 0.11619629763611172, 'tp_mult': 1.8299253706195466, 'tsl_mult': 0.6950587753540343, 'strategy': 'breakout', 'time_stop': 282, 'use_sma': False, 'use_atr': False, 'use_adx': False, 'use_ema': False, 'use_spike': True, 'rsi_required': False, 'edge_k': 0.7107135216663003, 'edge_cap': 0.999946352572096, 'bull_strategy': 'mean_reversion', 'bull_bb_std_mult': 1.170379508358796, 'bull_rsi_os': 10, 'bull_rsi_ob': 68, 'bull_adx_thresh': 23.87433363125851, 'bull_atr_min_pct': 0.016867691334914264, 'bull_atr_max_pct': 0.12774360409520252, 'bull_tp_mult': 1.654788562924717, 'bull_tsl_mult': 0.23618017371345112, 'bull_time_stop': 38, 'bull_use_sma': True, 'bull_use_ema': False, 'bull_use_atr': False, 'bull_use_adx': False, 'bull_use_spike': False, 'bull_rsi_required': True, 'bear_strategy': 'breakout', 'bear_bb_std_mult': 2.237919198566431, 'bear_rsi_os': 26, 'bear_rsi_ob': 94, 'bear_adx_thresh': 8.466067976573143, 'bear_atr_min_pct': 0.008415396676684077, 'bear_atr_max_pct': 0.05546906776315999, 'bear_tp_mult': 2.0852163686836, 'bear_tsl_mult': 0.9054700244582423, 'bear_time_stop': 6, 'bear_use_sma': False, 'bear_use_ema': False, 'bear_use_atr': False, 'bear_use_adx': True, 'bear_use_spike': True, 'bear_rsi_required': True, 'sideways_strategy': 'breakout', 'sideways_bb_std_mult': 2.866983167314333, 'sideways_rsi_os': 44, 'sideways_rsi_ob': 51, 'sideways_adx_thresh': 19.790424752771454, 'sideways_atr_min_pct': 0.01894206211797843, 'sideways_atr_max_pct': 0.12814664183856506, 'sideways_tp_mult': 1.0209404766445507, 'sideways_tsl_mult': 0.9790994335048322, 'sideways_time_stop': 211, 'sideways_use_sma': False, 'sideways_use_ema': True, 'sideways_use_atr': True, 'sideways_use_adx': True, 'sideways_use_spike': True, 'sideways_rsi_required': False}.
[I 2025-09-01 02:33:16,573] Trial 69 finished with values: [-0.03168945790050948, 0.03153202935286384] and parameters: {'p_sma': 46, 'p_std': 58, 'p_atr': 20, 'p_adx': 15, 'rsi_period': 50, 'ema1': 9, 'ema2': 52, 'slip_atr_k': 0.17577973459509783, 'slip_spread_k': 0.0011953865837193156, 'spread_hl_frac': 0.025274977442427966, 'bb_std_mult': 1.69884305889462, 'rsi_os': 11, 'rsi_ob': 62, 'vol_spike': 0.13696809529174292, 'adx_thresh': 17.445698451142583, 'atr_min_pct': 0.017714847685930277, 'atr_max_pct': 0.1148385040660336, 'tp_mult': 1.8335047379964133, 'tsl_mult': 0.6873952969463402, 'strategy': 'breakout', 'time_stop': 251, 'use_sma': False, 'use_atr': False, 'use_adx': False, 'use_ema': False, 'use_spike': True, 'rsi_required': False, 'edge_k': 0.5439113411066199, 'edge_cap': 0.16146290472948446, 'bull_strategy': 'mean_reversion', 'bull_bb_std_mult': 1.1359224131953674, 'bull_rsi_os': 11, 'bull_rsi_ob': 70, 'bull_adx_thresh': 26.954539344036924, 'bull_atr_min_pct': 1.636948097124938e-05, 'bull_atr_max_pct': 0.12117054624624217, 'bull_tp_mult': 2.8345177706453066, 'bull_tsl_mult': 0.2553094839088665, 'bull_time_stop': 38, 'bull_use_sma': True, 'bull_use_ema': False, 'bull_use_atr': False, 'bull_use_adx': False, 'bull_use_spike': False, 'bull_rsi_required': True, 'bear_strategy': 'breakout', 'bear_bb_std_mult': 2.23709899713006, 'bear_rsi_os': 36, 'bear_rsi_ob': 95, 'bear_adx_thresh': 13.994767939936997, 'bear_atr_min_pct': 0.008156485426090876, 'bear_atr_max_pct': 0.056661866281082246, 'bear_tp_mult': 2.826983117472377, 'bear_tsl_mult': 0.8959772215956665, 'bear_time_stop': 79, 'bear_use_sma': False, 'bear_use_ema': False, 'bear_use_atr': False, 'bear_use_adx': True, 'bear_use_spike': True, 'bear_rsi_required': True, 'sideways_strategy': 'breakout', 'sideways_bb_std_mult': 3.1849925051362926, 'sideways_rsi_os': 44, 'sideways_rsi_ob': 51, 'sideways_adx_thresh': 25.972408453605713, 'sideways_atr_min_pct': 0.0190296478245443, 'sideways_atr_max_pct': 0.12787018099941852, 'sideways_tp_mult': 1.0409385511285314, 'sideways_tsl_mult': 0.8936031890189954, 'sideways_time_stop': 165, 'sideways_use_sma': False, 'sideways_use_ema': True, 'sideways_use_atr': True, 'sideways_use_adx': True, 'sideways_use_spike': True, 'sideways_rsi_required': False}.
