[I 2025-09-01 02:54:27,666] Trial 191 finished with values: [-1000000000.0, 1000000000.0] and parameters: {'p_sma': 42, 'p_std': 58, 'p_atr': 27, 'p_adx': 8, 'rsi_period': 43, 'ema1': 12, 'ema2': 59, 'slip_atr_k': 0.006272437680455737, 'slip_spread_k': 0.37880417991195525, 'spread_hl_frac': 0.014074808063049315, 'bb_std_mult': 1.5921903256245709, 'rsi_os': 47, 'rsi_ob': 82, 'vol_spike': 0.14687963202593965, 'adx_thresh': 25.146710425680013, 'atr_min_pct': 0.020411047938814403, 'atr_max_pct': 0.04822748475928036, 'tp_mult': 2.1176480506790276, 'tsl_mult': 0.0470898060401122, 'strategy': 'mean_reversion', 'time_stop': 255, 'use_sma': False, 'use_atr': True, 'use_adx': True, 'use_ema': True, 'use_spike': False, 'rsi_required': True, 'edge_k': 1.635504249875519, 'edge_cap': 0.5260837441013043, 'bull_strategy': 'mean_reversion', 'bull_bb_std_mult': 1.1489428004459266, 'bull_rsi_os': 15, 'bull_rsi_ob': 66, 'bull_adx_thresh': 26.39067968210808, 'bull_atr_min_pct': 0.026370581277798157, 'bull_atr_max_pct': 0.11942159491438026, 'bull_tp_mult': 2.6991045325343155, 'bull_tsl_mult': 0.35572523870374984, 'bull_time_stop': 142, 'bull_use_sma': False, 'bull_use_ema': False, 'bull_use_atr': True, 'bull_use_adx': False, 'bull_use_spike': True, 'bull_rsi_required': False, 'bear_strategy': 'mean_reversion', 'bear_bb_std_mult': 0.8534164759447678, 'bear_rsi_os': 6, 'bear_rsi_ob': 64, 'bear_adx_thresh': 23.557603476923592, 'bear_atr_min_pct': 0.019857908434188404, 'bear_atr_max_pct': 0.14819386567206277, 'bear_tp_mult': 1.1950998715248644, 'bear_tsl_mult': 0.45989819398548243, 'bear_time_stop': 173, 'bear_use_sma': False, 'bear_use_ema': False, 'bear_use_atr': True, 'bear_use_adx': False, 'bear_use_spike': True, 'bear_rsi_required': True, 'sideways_strategy': 'mean_reversion', 'sideways_bb_std_mult': 1.162183733584408, 'sideways_rsi_os': 27, 'sideways_rsi_ob': 74, 'sideways_adx_thresh': 29.116921484710804, 'sideways_atr_min_pct': 0.009275291797452137, 'sideways_atr_max_pct': 0.07658137953728544, 'sideways_tp_mult': 1.2553844701417836, 'sideways_tsl_mult': 0.7968085013753623, 'sideways_time_stop': 293, 'sideways_use_sma': True, 'sideways_use_ema': False, 'sideways_use_atr': True, 'sideways_use_adx': False, 'sideways_use_spike': False, 'sideways_rsi_required': True}.
[I 2025-09-01 02:54:28,068] Trial 190 finished with values: [-1000000000.0, 1000000000.0] and parameters: {'p_sma': 40, 'p_std': 58, 'p_atr': 28, 'p_adx': 25, 'rsi_period': 71, 'ema1': 24, 'ema2': 55, 'slip_atr_k': 0.0057020709513119355, 'slip_spread_k': 0.38035816505095865, 'spread_hl_frac': 0.016071791808771056, 'bb_std_mult': 3.15082294776193, 'rsi_os': 48, 'rsi_ob': 83, 'vol_spike': 0.2375951581960853, 'adx_thresh': 12.907697175963028, 'atr_min_pct': 0.01887839603465877, 'atr_max_pct': 0.04821675785669718, 'tp_mult': 2.140821207580098, 'tsl_mult': 0.05470033308217259, 'strategy': 'mean_reversion', 'time_stop': 14, 'use_sma': False, 'use_atr': True, 'use_adx': True, 'use_ema': True, 'use_spike': False, 'rsi_required': True, 'edge_k': 1.8464925615057441, 'edge_cap': 0.3852927892381933, 'bull_strategy': 'mean_reversion', 'bull_bb_std_mult': 2.9695897422363813, 'bull_rsi_os': 55, 'bull_rsi_ob': 66, 'bull_adx_thresh': 26.39394517212793, 'bull_atr_min_pct': 0.029048636390763494, 'bull_atr_max_pct': 0.1068418779366823, 'bull_tp_mult': 1.619579278505486, 'bull_tsl_mult': 0.14229299511031496, 'bull_time_stop': 226, 'bull_use_sma': False, 'bull_use_ema': False, 'bull_use_atr': True, 'bull_use_adx': False, 'bull_use_spike': True, 'bull_rsi_required': False, 'bear_strategy': 'mean_reversion', 'bear_bb_std_mult': 1.183389390501429, 'bear_rsi_os': 6, 'bear_rsi_ob': 95, 'bear_adx_thresh': 23.323623806497352, 'bear_atr_min_pct': 0.025850315089318263, 'bear_atr_max_pct': 0.14965630541665295, 'bear_tp_mult': 1.2116792150818625, 'bear_tsl_mult': 0.16366225066613282, 'bear_time_stop': 292, 'bear_use_sma': False, 'bear_use_ema': False, 'bear_use_atr': True, 'bear_use_adx': False, 'bear_use_spike': True, 'bear_rsi_required': True, 'sideways_strategy': 'mean_reversion', 'sideways_bb_std_mult': 1.462394376836948, 'sideways_rsi_os': 20, 'sideways_rsi_ob': 74, 'sideways_adx_thresh': 18.182843628044612, 'sideways_atr_min_pct': 0.006482337421734022, 'sideways_atr_max_pct': 0.09227295694313854, 'sideways_tp_mult': 1.2687341795355935, 'sideways_tsl_mult': 0.7975145386977989, 'sideways_time_stop': 294, 'sideways_use_sma': True, 'sideways_use_ema': False, 'sideways_use_atr': True, 'sideways_use_adx': False, 'sideways_use_spike': False, 'sideways_rsi_required': True}.
[I 2025-09-01 02:54:28,280] Trial 189 finished with values: [-1000000000.0, 1000000000.0] and parameters: {'p_sma': 34, 'p_std': 58, 'p_atr': 27, 'p_adx': 8, 'rsi_period': 73, 'ema1': 13, 'ema2': 55, 'slip_atr_k': 0.01553296508877236, 'slip_spread_k': 0.7845655994646222, 'spread_hl_frac': 0.014016896055869527, 'bb_std_mult': 0.6409819056103838, 'rsi_os': 47, 'rsi_ob': 92, 'vol_spike': 0.14228545640582743, 'adx_thresh': 25.488000906978446, 'atr_min_pct': 0.018819956911336578, 'atr_max_pct': 0.04829162402012008, 'tp_mult': 2.1460262269496173, 'tsl_mult': 0.09118279838316758, 'strategy': 'mean_reversion', 'time_stop': 25, 'use_sma': False, 'use_atr': True, 'use_adx': True, 'use_ema': True, 'use_spike': False, 'rsi_required': True, 'edge_k': 0.40317841739990384, 'edge_cap': 0.38938068679820065, 'bull_strategy': 'mean_reversion', 'bull_bb_std_mult': 1.1675381829682538, 'bull_rsi_os': 17, 'bull_rsi_ob': 66, 'bull_adx_thresh': 26.44854041116135, 'bull_atr_min_pct': 0.0020599586861118086, 'bull_atr_max_pct': 0.11783681466509766, 'bull_tp_mult': 1.6261795356734827, 'bull_tsl_mult': 0.5219799865385478, 'bull_time_stop': 141, 'bull_use_sma': False, 'bull_use_ema': False, 'bull_use_atr': True, 'bull_use_adx': False, 'bull_use_spike': True, 'bull_rsi_required': False, 'bear_strategy': 'mean_reversion', 'bear_bb_std_mult': 2.5419485548385, 'bear_rsi_os': 6, 'bear_rsi_ob': 62, 'bear_adx_thresh': 21.89351983807626, 'bear_atr_min_pct': 0.020607037070614214, 'bear_atr_max_pct': 0.14960925347331136, 'bear_tp_mult': 1.1885061113975142, 'bear_tsl_mult': 0.6676490842536292, 'bear_time_stop': 292, 'bear_use_sma': False, 'bear_use_ema': False, 'bear_use_atr': True, 'bear_use_adx': False, 'bear_use_spike': True, 'bear_rsi_required': True, 'sideways_strategy': 'mean_reversion', 'sideways_bb_std_mult': 0.8706445072773894, 'sideways_rsi_os': 27, 'sideways_rsi_ob': 74, 'sideways_adx_thresh': 30.404105891240228, 'sideways_atr_min_pct': 0.006712087454101638, 'sideways_atr_max_pct': 0.0161644018287109, 'sideways_tp_mult': 1.2715482811829153, 'sideways_tsl_mult': 0.36363583746989947, 'sideways_time_stop': 225, 'sideways_use_sma': True, 'sideways_use_ema': False, 'sideways_use_atr': True, 'sideways_use_adx': False, 'sideways_use_spike': False, 'sideways_rsi_required': False}.
[I 2025-09-01 02:54:28,519] Trial 192 finished with values: [-0.01761373024385271, 0.01752446800209215] and parameters: {'p_sma': 33, 'p_std': 58, 'p_atr': 28, 'p_adx': 17, 'rsi_period': 9, 'ema1': 21, 'ema2': 59, 'slip_atr_k': 0.017584676662793276, 'slip_spread_k': 0.24904311092448078, 'spread_hl_frac': 0.011451329973345355, 'bb_std_mult': 1.4238043651119618, 'rsi_os': 48, 'rsi_ob': 87, 'vol_spike': 0.21523197450705464, 'adx_thresh': 25.436490579884897, 'atr_min_pct': 0.00853813343784772, 'atr_max_pct': 0.04822395859074334, 'tp_mult': 2.6346038225718886, 'tsl_mult': 0.3080277723237299, 'strategy': 'mean_reversion', 'time_stop': 253, 'use_sma': False, 'use_atr': True, 'use_adx': True, 'use_ema': True, 'use_spike': False, 'rsi_required': True, 'edge_k': 0.37078408568395277, 'edge_cap': 0.5336916013337895, 'bull_strategy': 'mean_reversion', 'bull_bb_std_mult': 1.4340533841098941, 'bull_rsi_os': 55, 'bull_rsi_ob': 59, 'bull_adx_thresh': 23.142881765374288, 'bull_atr_min_pct': 0.0006700672242913151, 'bull_atr_max_pct': 0.1259879358211513, 'bull_tp_mult': 1.7145448131477155, 'bull_tsl_mult': 0.5222196429106808, 'bull_time_stop': 132, 'bull_use_sma': True, 'bull_use_ema': False, 'bull_use_atr': True, 'bull_use_adx': False, 'bull_use_spike': True, 'bull_rsi_required': False, 'bear_strategy': 'mean_reversion', 'bear_bb_std_mult': 1.192063335752763, 'bear_rsi_os': 38, 'bear_rsi_ob': 62, 'bear_adx_thresh': 23.99908831768728, 'bear_atr_min_pct': 0.020689881846079224, 'bear_atr_max_pct': 0.1316208194985903, 'bear_tp_mult': 1.0149034102370256, 'bear_tsl_mult': 0.1711453557957277, 'bear_time_stop': 73, 'bear_use_sma': False, 'bear_use_ema': False, 'bear_use_atr': True, 'bear_use_adx': False, 'bear_use_spike': True, 'bear_rsi_required': True, 'sideways_strategy': 'mean_reversion', 'sideways_bb_std_mult': 1.8216045691532081, 'sideways_rsi_os': 15, 'sideways_rsi_ob': 82, 'sideways_adx_thresh': 29.214448675750546, 'sideways_atr_min_pct': 0.028063532494201668, 'sideways_atr_max_pct': 0.09207366649747022, 'sideways_tp_mult': 1.1606342961043299, 'sideways_tsl_mult': 0.2718293838394569, 'sideways_time_stop': 133, 'sideways_use_sma': True, 'sideways_use_ema': False, 'sideways_use_atr': True, 'sideways_use_adx': False, 'sideways_use_spike': False, 'sideways_rsi_required': True}.
[I 2025-09-01 02:55:05,632] Trial 193 finished with values: [-1000000000.0, 1000000000.0] and parameters: {'p_sma': 33, 'p_std': 58, 'p_atr': 28, 'p_adx': 17, 'rsi_period': 9, 'ema1': 20, 'ema2': 59, 'slip_atr_k': 0.015853872466364216, 'slip_spread_k': 0.2557889689882051, 'spread_hl_frac': 0.010708937339947287, 'bb_std_mult': 1.4280323171486877, 'rsi_os': 48, 'rsi_ob': 87, 'vol_spike': 0.21832864134723654, 'adx_thresh': 25.952920509578853, 'atr_min_pct': 0.008119582230307886, 'atr_max_pct': 0.04489184378717562, 'tp_mult': 2.662717356359455, 'tsl_mult': 0.30549660623833774, 'strategy': 'mean_reversion', 'time_stop': 249, 'use_sma': False, 'use_atr': True, 'use_adx': True, 'use_ema': True, 'use_spike': False, 'rsi_required': True, 'edge_k': 0.35359997778251545, 'edge_cap': 0.4727101860315039, 'bull_strategy': 'mean_reversion', 'bull_bb_std_mult': 1.3898136353858912, 'bull_rsi_os': 17, 'bull_rsi_ob': 59, 'bull_adx_thresh': 23.055961688164516, 'bull_atr_min_pct': 0.0007888496133373981, 'bull_atr_max_pct': 0.12595676270316464, 'bull_tp_mult': 1.7070580486031348, 'bull_tsl_mult': 0.5266272900263392, 'bull_time_stop': 110, 'bull_use_sma': True, 'bull_use_ema': True, 'bull_use_atr': True, 'bull_use_adx': False, 'bull_use_spike': True, 'bull_rsi_required': False, 'bear_strategy': 'mean_reversion', 'bear_bb_std_mult': 1.1969254909218914, 'bear_rsi_os': 33, 'bear_rsi_ob': 61, 'bear_adx_thresh': 23.877827807923506, 'bear_atr_min_pct': 0.022060758867426398, 'bear_atr_max_pct': 0.1311842318166732, 'bear_tp_mult': 1.0131450331833496, 'bear_tsl_mult': 0.15609670096749467, 'bear_time_stop': 107, 'bear_use_sma': False, 'bear_use_ema': False, 'bear_use_atr': True, 'bear_use_adx': False, 'bear_use_spike': True, 'bear_rsi_required': True, 'sideways_strategy': 'breakout', 'sideways_bb_std_mult': 1.7996871324131372, 'sideways_rsi_os': 16, 'sideways_rsi_ob': 87, 'sideways_adx_thresh': 18.098433616792086, 'sideways_atr_min_pct': 0.028460843308547607, 'sideways_atr_max_pct': 0.09329414517265597, 'sideways_tp_mult': 1.1753913655867243, 'sideways_tsl_mult': 0.26586722946665897, 'sideways_time_stop': 134, 'sideways_use_sma': True, 'sideways_use_ema': False, 'sideways_use_atr': True, 'sideways_use_adx': False, 'sideways_use_spike': False, 'sideways_rsi_required': True}.
[I 2025-09-01 02:55:07,362] Trial 195 finished with values: [-1000000000.0, 1000000000.0] and parameters: {'p_sma': 33, 'p_std': 56, 'p_atr': 29, 'p_adx': 18, 'rsi_period': 9, 'ema1': 21, 'ema2': 59, 'slip_atr_k': 0.015171151420521549, 'slip_spread_k': 0.24615957141530342, 'spread_hl_frac': 0.011085469511275942, 'bb_std_mult': 1.425074562183025, 'rsi_os': 48, 'rsi_ob': 87, 'vol_spike': 0.21700545192747608, 'adx_thresh': 25.61436188354357, 'atr_min_pct': 0.008534376838808068, 'atr_max_pct': 0.0448631546621146, 'tp_mult': 2.650476466317206, 'tsl_mult': 0.3021421289783202, 'strategy': 'mean_reversion', 'time_stop': 124, 'use_sma': False, 'use_atr': False, 'use_adx': True, 'use_ema': False, 'use_spike': True, 'rsi_required': False, 'edge_k': 0.35987305442729944, 'edge_cap': 0.4781897036372111, 'bull_strategy': 'mean_reversion', 'bull_bb_std_mult': 1.283363719605484, 'bull_rsi_os': 16, 'bull_rsi_ob': 61, 'bull_adx_thresh': 23.19987086659238, 'bull_atr_min_pct': 0.0007209411887349635, 'bull_atr_max_pct': 0.12431129722632987, 'bull_tp_mult': 1.7102173848959952, 'bull_tsl_mult': 0.5466902004910691, 'bull_time_stop': 132, 'bull_use_sma': True, 'bull_use_ema': True, 'bull_use_atr': False, 'bull_use_adx': True, 'bull_use_spike': True, 'bull_rsi_required': False, 'bear_strategy': 'breakout', 'bear_bb_std_mult': 2.4979371160933708, 'bear_rsi_os': 5, 'bear_rsi_ob': 56, 'bear_adx_thresh': 24.274159262304316, 'bear_atr_min_pct': 0.022728643670348762, 'bear_atr_max_pct': 0.12997928157629868, 'bear_tp_mult': 1.0628838326483048, 'bear_tsl_mult': 0.05810545678101454, 'bear_time_stop': 137, 'bear_use_sma': False, 'bear_use_ema': False, 'bear_use_atr': False, 'bear_use_adx': False, 'bear_use_spike': True, 'bear_rsi_required': True, 'sideways_strategy': 'breakout', 'sideways_bb_std_mult': 1.7649037608214557, 'sideways_rsi_os': 16, 'sideways_rsi_ob': 81, 'sideways_adx_thresh': 29.978052360235406, 'sideways_atr_min_pct': 0.028286987357041195, 'sideways_atr_max_pct': 0.09313989449319966, 'sideways_tp_mult': 1.1569353801946156, 'sideways_tsl_mult': 0.26408951462539765, 'sideways_time_stop': 131, 'sideways_use_sma': True, 'sideways_use_ema': True, 'sideways_use_atr': True, 'sideways_use_adx': False, 'sideways_use_spike': True, 'sideways_rsi_required': True}.
[I 2025-09-01 02:55:07,876] Trial 196 finished with values: [-1000000000.0, 1000000000.0] and parameters: {'p_sma': 33, 'p_std': 57, 'p_atr': 28, 'p_adx': 17, 'rsi_period': 9, 'ema1': 21, 'ema2': 59, 'slip_atr_k': 0.015227973546170073, 'slip_spread_k': 0.24794786461240545, 'spread_hl_frac': 0.011350029826334816, 'bb_std_mult': 1.4389126427850765, 'rsi_os': 49, 'rsi_ob': 86, 'vol_spike': 0.2216217083308461, 'adx_thresh': 26.167804143025, 'atr_min_pct': 0.008334084513761242, 'atr_max_pct': 0.04484348143342147, 'tp_mult': 2.6539351773979307, 'tsl_mult': 0.2991978092726837, 'strategy': 'mean_reversion', 'time_stop': 248, 'use_sma': False, 'use_atr': False, 'use_adx': True, 'use_ema': False, 'use_spike': True, 'rsi_required': False, 'edge_k': 0.3919529514574338, 'edge_cap': 0.4603782545136802, 'bull_strategy': 'mean_reversion', 'bull_bb_std_mult': 1.3545116565943283, 'bull_rsi_os': 17, 'bull_rsi_ob': 59, 'bull_adx_thresh': 22.990610187990615, 'bull_atr_min_pct': 0.0006446023542012534, 'bull_atr_max_pct': 0.1259009350050727, 'bull_tp_mult': 1.7201436252879043, 'bull_tsl_mult': 0.5421571308668263, 'bull_time_stop': 133, 'bull_use_sma': True, 'bull_use_ema': True, 'bull_use_atr': False, 'bull_use_adx': True, 'bull_use_spike': True, 'bull_rsi_required': False, 'bear_strategy': 'breakout', 'bear_bb_std_mult': 2.3205909772780524, 'bear_rsi_os': 5, 'bear_rsi_ob': 59, 'bear_adx_thresh': 24.275413785200918, 'bear_atr_min_pct': 0.022386710688327118, 'bear_atr_max_pct': 0.12977065655686823, 'bear_tp_mult': 1.020002310626644, 'bear_tsl_mult': 0.1261008982720347, 'bear_time_stop': 148, 'bear_use_sma': False, 'bear_use_ema': False, 'bear_use_atr': False, 'bear_use_adx': False, 'bear_use_spike': True, 'bear_rsi_required': True, 'sideways_strategy': 'breakout', 'sideways_bb_std_mult': 1.7880720193536206, 'sideways_rsi_os': 16, 'sideways_rsi_ob': 81, 'sideways_adx_thresh': 30.079282591079608, 'sideways_atr_min_pct': 0.02848082317519212, 'sideways_atr_max_pct': 0.09210646137253663, 'sideways_tp_mult': 1.1872227499534382, 'sideways_tsl_mult': 0.2657308969582855, 'sideways_time_stop': 121, 'sideways_use_sma': True, 'sideways_use_ema': True, 'sideways_use_atr': False, 'sideways_use_adx': False, 'sideways_use_spike': True, 'sideways_rsi_required': True}.
[I 2025-09-01 02:55:07,876] Trial 194 finished with values: [-1000000000.0, 1000000000.0] and parameters: {'p_sma': 32, 'p_std': 57, 'p_atr': 29, 'p_adx': 17, 'rsi_period': 9, 'ema1': 16, 'ema2': 59, 'slip_atr_k': 0.015629712380263554, 'slip_spread_k': 0.24879713132798742, 'spread_hl_frac': 0.010828592015385585, 'bb_std_mult': 1.4469174201119475, 'rsi_os': 48, 'rsi_ob': 87, 'vol_spike': 0.21900855402440703, 'adx_thresh': 25.880138355387164, 'atr_min_pct': 0.00831829196988622, 'atr_max_pct': 0.043041980725156005, 'tp_mult': 2.669037763485453, 'tsl_mult': 0.30448681880977013, 'strategy': 'mean_reversion', 'time_stop': 251, 'use_sma': False, 'use_atr': False, 'use_adx': True, 'use_ema': False, 'use_spike': True, 'rsi_required': False, 'edge_k': 0.3617564064956102, 'edge_cap': 0.4726838163823021, 'bull_strategy': 'mean_reversion', 'bull_bb_std_mult': 1.2950147626105581, 'bull_rsi_os': 17, 'bull_rsi_ob': 59, 'bull_adx_thresh': 21.289898772635606, 'bull_atr_min_pct': 0.0009032156232558344, 'bull_atr_max_pct': 0.12399712441045382, 'bull_tp_mult': 1.6982639486687792, 'bull_tsl_mult': 0.5278253075960699, 'bull_time_stop': 131, 'bull_use_sma': True, 'bull_use_ema': True, 'bull_use_atr': False, 'bull_use_adx': False, 'bull_use_spike': True, 'bull_rsi_required': False, 'bear_strategy': 'breakout', 'bear_bb_std_mult': 2.512679720079301, 'bear_rsi_os': 5, 'bear_rsi_ob': 62, 'bear_adx_thresh': 24.104383443189715, 'bear_atr_min_pct': 0.020684890259841066, 'bear_atr_max_pct': 0.13095811611344754, 'bear_tp_mult': 1.0117162004522775, 'bear_tsl_mult': 0.10222665153174237, 'bear_time_stop': 108, 'bear_use_sma': False, 'bear_use_ema': False, 'bear_use_atr': False, 'bear_use_adx': False, 'bear_use_spike': True, 'bear_rsi_required': True, 'sideways_strategy': 'breakout', 'sideways_bb_std_mult': 1.8157797269173404, 'sideways_rsi_os': 16, 'sideways_rsi_ob': 81, 'sideways_adx_thresh': 30.14507091632473, 'sideways_atr_min_pct': 0.028479027119426507, 'sideways_atr_max_pct': 0.08964941364035298, 'sideways_tp_mult': 1.1736641358222095, 'sideways_tsl_mult': 0.26179262234540257, 'sideways_time_stop': 121, 'sideways_use_sma': True, 'sideways_use_ema': True, 'sideways_use_atr': True, 'sideways_use_adx': False, 'sideways_use_spike': True, 'sideways_rsi_required': True}.
[I 2025-09-01 02:55:08,614] Trial 200 finished with values: [-1000000000.0, 1000000000.0] and parameters: {'p_sma': 31, 'p_std': 59, 'p_atr': 28, 'p_adx': 17, 'rsi_period': 7, 'ema1': 18, 'ema2': 49, 'slip_atr_k': 0.022918113980221422, 'slip_spread_k': 0.30486885811984143, 'spread_hl_frac': 0.012763641517586471, 'bb_std_mult': 0.8050391901602916, 'rsi_os': 51, 'rsi_ob': 89, 'vol_spike': 0.24812209687959957, 'adx_thresh': 25.140297420127293, 'atr_min_pct': 0.009593061411633944, 'atr_max_pct': 0.03993374345379859, 'tp_mult': 2.7948324942229097, 'tsl_mult': 0.26438640900781823, 'strategy': 'mean_reversion', 'time_stop': 260, 'use_sma': False, 'use_atr': False, 'use_adx': True, 'use_ema': False, 'use_spike': True, 'rsi_required': False, 'edge_k': 0.5169284223991749, 'edge_cap': 0.517907479374356, 'bull_strategy': 'breakout', 'bull_bb_std_mult': 1.2181367744205438, 'bull_rsi_os': 34, 'bull_rsi_ob': 60, 'bull_adx_thresh': 22.015463073357505, 'bull_atr_min_pct': 0.0012425793223336799, 'bull_atr_max_pct': 0.12922105317602484, 'bull_tp_mult': 1.943720158733789, 'bull_tsl_mult': 0.7317835556438471, 'bull_time_stop': 116, 'bull_use_sma': True, 'bull_use_ema': False, 'bull_use_atr': False, 'bull_use_adx': False, 'bull_use_spike': True, 'bull_rsi_required': False, 'bear_strategy': 'breakout', 'bear_bb_std_mult': 2.3545482096894985, 'bear_rsi_os': 7, 'bear_rsi_ob': 69, 'bear_adx_thresh': 24.88950794225663, 'bear_atr_min_pct': 0.024629507962472274, 'bear_atr_max_pct': 0.13376126665314753, 'bear_tp_mult': 1.067459630310979, 'bear_tsl_mult': 0.18886188086239541, 'bear_time_stop': 81, 'bear_use_sma': True, 'bear_use_ema': False, 'bear_use_atr': False, 'bear_use_adx': False, 'bear_use_spike': True, 'bear_rsi_required': True, 'sideways_strategy': 'breakout', 'sideways_bb_std_mult': 1.8467249686674283, 'sideways_rsi_os': 51, 'sideways_rsi_ob': 67, 'sideways_adx_thresh': 29.085901585045658, 'sideways_atr_min_pct': 0.02968375520138223, 'sideways_atr_max_pct': 0.09003602345210335, 'sideways_tp_mult': 1.2174746629589115, 'sideways_tsl_mult': 0.22226794473906886, 'sideways_time_stop': 143, 'sideways_use_sma': True, 'sideways_use_ema': True, 'sideways_use_atr': False, 'sideways_use_adx': False, 'sideways_use_spike': True, 'sideways_rsi_required': True}.
