[I 2025-09-01 04:03:26,527] Trial 593 finished with values: [-0.0368270105615911, 0.036707944894619766] and parameters: {'p_sma': 18, 'p_std': 35, 'p_atr': 21, 'p_adx': 13, 'rsi_period': 9, 'ema1': 16, 'ema2': 24, 'slip_atr_k': 0.2364804699196949, 'slip_spread_k': 0.9266555789932396, 'spread_hl_frac': 0.04210661857772797, 'bb_std_mult': 3.4975998550856824, 'rsi_os': 45, 'rsi_ob': 66, 'vol_spike': 0.19946863519675034, 'adx_thresh': 12.668299348641066, 'atr_min_pct': 0.016272381593823878, 'atr_max_pct': 0.0481851911426864, 'tp_mult': 2.5575408319069073, 'tsl_mult': 0.2742056549132109, 'strategy': 'mean_reversion', 'time_stop': 73, 'use_sma': True, 'use_atr': False, 'use_adx': False, 'use_ema': True, 'use_spike': False, 'rsi_required': True, 'edge_k': 1.7569965375745045, 'edge_cap': 0.6575579648864779, 'bull_strategy': 'mean_reversion', 'bull_bb_std_mult': 0.6211659391782631, 'bull_rsi_os': 7, 'bull_rsi_ob': 81, 'bull_adx_thresh': 8.310866405037292, 'bull_atr_min_pct': 0.0006852407477189993, 'bull_atr_max_pct': 0.03393526057447457, 'bull_tp_mult': 1.4294728236164034, 'bull_tsl_mult': 0.4458591143947521, 'bull_time_stop': 119, 'bull_use_sma': False, 'bull_use_ema': False, 'bull_use_atr': True, 'bull_use_adx': True, 'bull_use_spike': False, 'bull_rsi_required': True, 'bear_strategy': 'mean_reversion', 'bear_bb_std_mult': 2.959904479124978, 'bear_rsi_os': 29, 'bear_rsi_ob': 70, 'bear_adx_thresh': 34.94660600460211, 'bear_atr_min_pct': 0.006898522403218311, 'bear_atr_max_pct': 0.058803924635923224, 'bear_tp_mult': 2.958092758486252, 'bear_tsl_mult': 0.7148172137854861, 'bear_time_stop': 286, 'bear_use_sma': True, 'bear_use_ema': True, 'bear_use_atr': True, 'bear_use_adx': True, 'bear_use_spike': True, 'bear_rsi_required': False, 'sideways_strategy': 'breakout', 'sideways_bb_std_mult': 2.7001398137547667, 'sideways_rsi_os': 31, 'sideways_rsi_ob': 60, 'sideways_adx_thresh': 14.899300638400216, 'sideways_atr_min_pct': 0.023161125127012898, 'sideways_atr_max_pct': 0.1044452500567379, 'sideways_tp_mult': 1.913388005035368, 'sideways_tsl_mult': 0.6549091807087911, 'sideways_time_stop': 160, 'sideways_use_sma': False, 'sideways_use_ema': False, 'sideways_use_atr': False, 'sideways_use_adx': False, 'sideways_use_spike': False, 'sideways_rsi_required': False}.
[I 2025-09-01 04:03:26,532] Trial 595 finished with values: [-1000000000.0, 1000000000.0] and parameters: {'p_sma': 18, 'p_std': 51, 'p_atr': 24, 'p_adx': 8, 'rsi_period': 47, 'ema1': 14, 'ema2': 43, 'slip_atr_k': 0.06449186601357744, 'slip_spread_k': 0.02841077425195737, 'spread_hl_frac': 0.0420570801090867, 'bb_std_mult': 2.3560633680093526, 'rsi_os': 12, 'rsi_ob': 80, 'vol_spike': 0.26854347954307434, 'adx_thresh': 12.894467805846435, 'atr_min_pct': 0.010728666136976744, 'atr_max_pct': 0.048544149811846994, 'tp_mult': 2.5657660338347537, 'tsl_mult': 0.5457643286155813, 'strategy': 'mean_reversion', 'time_stop': 76, 'use_sma': True, 'use_atr': False, 'use_adx': False, 'use_ema': True, 'use_spike': False, 'rsi_required': True, 'edge_k': 0.2970498087319048, 'edge_cap': 0.2573551349992137, 'bull_strategy': 'mean_reversion', 'bull_bb_std_mult': 0.6367162387196945, 'bull_rsi_os': 31, 'bull_rsi_ob': 74, 'bull_adx_thresh': 8.942408925880756, 'bull_atr_min_pct': 0.019747715999663976, 'bull_atr_max_pct': 0.08367097846855147, 'bull_tp_mult': 1.4381348222604482, 'bull_tsl_mult': 0.27209164676565667, 'bull_time_stop': 22, 'bull_use_sma': False, 'bull_use_ema': False, 'bull_use_atr': True, 'bull_use_adx': True, 'bull_use_spike': False, 'bull_rsi_required': True, 'bear_strategy': 'mean_reversion', 'bear_bb_std_mult': 2.9497950908878314, 'bear_rsi_os': 29, 'bear_rsi_ob': 70, 'bear_adx_thresh': 33.31836214638152, 'bear_atr_min_pct': 0.006983089712037397, 'bear_atr_max_pct': 0.07473213100100402, 'bear_tp_mult': 2.9610635227540145, 'bear_tsl_mult': 0.057827767741195815, 'bear_time_stop': 286, 'bear_use_sma': True, 'bear_use_ema': True, 'bear_use_atr': True, 'bear_use_adx': True, 'bear_use_spike': True, 'bear_rsi_required': False, 'sideways_strategy': 'breakout', 'sideways_bb_std_mult': 3.2234947632428668, 'sideways_rsi_os': 31, 'sideways_rsi_ob': 89, 'sideways_adx_thresh': 32.738480816765424, 'sideways_atr_min_pct': 0.02321550793539834, 'sideways_atr_max_pct': 0.10499487742156074, 'sideways_tp_mult': 1.8327329649760737, 'sideways_tsl_mult': 0.6532825819966378, 'sideways_time_stop': 170, 'sideways_use_sma': False, 'sideways_use_ema': False, 'sideways_use_atr': False, 'sideways_use_adx': False, 'sideways_use_spike': False, 'sideways_rsi_required': False}.
[I 2025-09-01 04:03:27,985] Trial 599 finished with values: [-1000000000.0, 1000000000.0] and parameters: {'p_sma': 21, 'p_std': 30, 'p_atr': 20, 'p_adx': 7, 'rsi_period': 37, 'ema1': 13, 'ema2': 53, 'slip_atr_k': 0.004509041726631099, 'slip_spread_k': 0.0004129658090878188, 'spread_hl_frac': 0.04481552353415109, 'bb_std_mult': 2.171095046004276, 'rsi_os': 29, 'rsi_ob': 49, 'vol_spike': 0.18087661640037891, 'adx_thresh': 21.2875919509438, 'atr_min_pct': 0.0028288516031134327, 'atr_max_pct': 0.029237423576910164, 'tp_mult': 1.1640888273309073, 'tsl_mult': 0.32859087024061473, 'strategy': 'mean_reversion', 'time_stop': 86, 'use_sma': True, 'use_atr': False, 'use_adx': False, 'use_ema': True, 'use_spike': False, 'rsi_required': True, 'edge_k': 0.19545210658844409, 'edge_cap': 0.212766511374887, 'bull_strategy': 'mean_reversion', 'bull_bb_std_mult': 0.8170037740297095, 'bull_rsi_os': 5, 'bull_rsi_ob': 76, 'bull_adx_thresh': 7.9067484314334004, 'bull_atr_min_pct': 0.004714654825414219, 'bull_atr_max_pct': 0.10753058807623421, 'bull_tp_mult': 1.5291276941899894, 'bull_tsl_mult': 0.6689388523893931, 'bull_time_stop': 294, 'bull_use_sma': False, 'bull_use_ema': False, 'bull_use_atr': True, 'bull_use_adx': True, 'bull_use_spike': False, 'bull_rsi_required': True, 'bear_strategy': 'mean_reversion', 'bear_bb_std_mult': 3.2096552766389372, 'bear_rsi_os': 20, 'bear_rsi_ob': 68, 'bear_adx_thresh': 10.802784272557268, 'bear_atr_min_pct': 0.019760003325153125, 'bear_atr_max_pct': 0.04956773833375747, 'bear_tp_mult': 2.199195514478721, 'bear_tsl_mult': 0.03286493212344892, 'bear_time_stop': 112, 'bear_use_sma': True, 'bear_use_ema': True, 'bear_use_atr': True, 'bear_use_adx': True, 'bear_use_spike': False, 'bear_rsi_required': False, 'sideways_strategy': 'breakout', 'sideways_bb_std_mult': 3.5981574800382443, 'sideways_rsi_os': 20, 'sideways_rsi_ob': 58, 'sideways_adx_thresh': 31.67197233749378, 'sideways_atr_min_pct': 0.020025644859430924, 'sideways_atr_max_pct': 0.09810500664238729, 'sideways_tp_mult': 1.9676115445504574, 'sideways_tsl_mult': 0.034895144619595586, 'sideways_time_stop': 149, 'sideways_use_sma': False, 'sideways_use_ema': False, 'sideways_use_atr': False, 'sideways_use_adx': True, 'sideways_use_spike': False, 'sideways_rsi_required': True}.
[I 2025-09-01 04:03:55,610] Trial 597 finished with values: [-0.016522913068111156, 0.016530679125829815] and parameters: {'p_sma': 16, 'p_std': 37, 'p_atr': 11, 'p_adx': 8, 'rsi_period': 9, 'ema1': 16, 'ema2': 53, 'slip_atr_k': 0.0006351988282413317, 'slip_spread_k': 0.034158752507487455, 'spread_hl_frac': 0.041743472675654356, 'bb_std_mult': 2.357247581327024, 'rsi_os': 47, 'rsi_ob': 80, 'vol_spike': 0.19810697904713032, 'adx_thresh': 13.426744813488554, 'atr_min_pct': 0.00916929775549448, 'atr_max_pct': 0.05134749296347691, 'tp_mult': 2.5817209057188784, 'tsl_mult': 0.27793298000952527, 'strategy': 'mean_reversion', 'time_stop': 84, 'use_sma': True, 'use_atr': False, 'use_adx': False, 'use_ema': True, 'use_spike': False, 'rsi_required': True, 'edge_k': 1.8481999773053923, 'edge_cap': 0.10342063249441336, 'bull_strategy': 'mean_reversion', 'bull_bb_std_mult': 0.832082505178335, 'bull_rsi_os': 23, 'bull_rsi_ob': 81, 'bull_adx_thresh': 6.940781268885143, 'bull_atr_min_pct': 0.0016442150730737286, 'bull_atr_max_pct': 0.07457843109456035, 'bull_tp_mult': 1.2957127659315417, 'bull_tsl_mult': 0.8187557539183756, 'bull_time_stop': 294, 'bull_use_sma': False, 'bull_use_ema': False, 'bull_use_atr': True, 'bull_use_adx': True, 'bull_use_spike': False, 'bull_rsi_required': True, 'bear_strategy': 'mean_reversion', 'bear_bb_std_mult': 0.8484073159492185, 'bear_rsi_os': 29, 'bear_rsi_ob': 67, 'bear_adx_thresh': 10.711939747760592, 'bear_atr_min_pct': 0.006559871031064545, 'bear_atr_max_pct': 0.07730283120001501, 'bear_tp_mult': 2.920812451160542, 'bear_tsl_mult': 0.03879723379783792, 'bear_time_stop': 202, 'bear_use_sma': True, 'bear_use_ema': True, 'bear_use_atr': True, 'bear_use_adx': True, 'bear_use_spike': True, 'bear_rsi_required': False, 'sideways_strategy': 'breakout', 'sideways_bb_std_mult': 3.5707165882494127, 'sideways_rsi_os': 20, 'sideways_rsi_ob': 58, 'sideways_adx_thresh': 31.823106129491464, 'sideways_atr_min_pct': 0.02225253643332181, 'sideways_atr_max_pct': 0.09730739101671494, 'sideways_tp_mult': 1.8339158583095412, 'sideways_tsl_mult': 0.667713974932789, 'sideways_time_stop': 149, 'sideways_use_sma': False, 'sideways_use_ema': False, 'sideways_use_atr': False, 'sideways_use_adx': True, 'sideways_use_spike': False, 'sideways_rsi_required': False}.
[I 2025-09-01 04:03:56,626] Trial 598 finished with values: [-1000000000.0, 1000000000.0] and parameters: {'p_sma': 21, 'p_std': 20, 'p_atr': 26, 'p_adx': 7, 'rsi_period': 66, 'ema1': 14, 'ema2': 53, 'slip_atr_k': 0.16278333977441897, 'slip_spread_k': 0.6191287435439489, 'spread_hl_frac': 0.044444636847483815, 'bb_std_mult': 2.3677615407284662, 'rsi_os': 40, 'rsi_ob': 80, 'vol_spike': 0.18111874814543608, 'adx_thresh': 14.776833789872754, 'atr_min_pct': 0.012921025962287464, 'atr_max_pct': 0.10388304451596803, 'tp_mult': 2.2375117144494254, 'tsl_mult': 0.32247794424431675, 'strategy': 'mean_reversion', 'time_stop': 87, 'use_sma': True, 'use_atr': False, 'use_adx': False, 'use_ema': True, 'use_spike': False, 'rsi_required': True, 'edge_k': 0.2845615910303142, 'edge_cap': 0.07653225539997599, 'bull_strategy': 'mean_reversion', 'bull_bb_std_mult': 0.8220394230902466, 'bull_rsi_os': 27, 'bull_rsi_ob': 79, 'bull_adx_thresh': 6.869320738259697, 'bull_atr_min_pct': 0.0197832976752664, 'bull_atr_max_pct': 0.11077615362700682, 'bull_tp_mult': 1.537638750154602, 'bull_tsl_mult': 0.6711320152219202, 'bull_time_stop': 293, 'bull_use_sma': False, 'bull_use_ema': False, 'bull_use_atr': True, 'bull_use_adx': True, 'bull_use_spike': False, 'bull_rsi_required': True, 'bear_strategy': 'mean_reversion', 'bear_bb_std_mult': 3.22425426417488, 'bear_rsi_os': 15, 'bear_rsi_ob': 73, 'bear_adx_thresh': 18.947475295060784, 'bear_atr_min_pct': 0.008446140221363786, 'bear_atr_max_pct': 0.049060970789313464, 'bear_tp_mult': 2.922641667394822, 'bear_tsl_mult': 0.039102629061565475, 'bear_time_stop': 114, 'bear_use_sma': True, 'bear_use_ema': True, 'bear_use_atr': True, 'bear_use_adx': True, 'bear_use_spike': True, 'bear_rsi_required': False, 'sideways_strategy': 'breakout', 'sideways_bb_std_mult': 3.5981350763390942, 'sideways_rsi_os': 7, 'sideways_rsi_ob': 57, 'sideways_adx_thresh': 30.877116328922938, 'sideways_atr_min_pct': 0.011021514674497909, 'sideways_atr_max_pct': 0.09974587512105358, 'sideways_tp_mult': 1.8339579450132246, 'sideways_tsl_mult': 0.7625254130627808, 'sideways_time_stop': 255, 'sideways_use_sma': False, 'sideways_use_ema': False, 'sideways_use_atr': False, 'sideways_use_adx': True, 'sideways_use_spike': False, 'sideways_rsi_required': True}.
[I 2025-09-01 04:03:57,333] Trial 596 finished with values: [-0.030440260114677264, 0.030327483793338546] and parameters: {'p_sma': 17, 'p_std': 30, 'p_atr': 11, 'p_adx': 14, 'rsi_period': 9, 'ema1': 13, 'ema2': 53, 'slip_atr_k': 0.0001187442502641467, 'slip_spread_k': 0.5163033686932036, 'spread_hl_frac': 0.04214428231461137, 'bb_std_mult': 3.599590054116913, 'rsi_os': 44, 'rsi_ob': 80, 'vol_spike': 0.19618966625887702, 'adx_thresh': 29.794430079678033, 'atr_min_pct': 0.010877174244946674, 'atr_max_pct': 0.04728786646981863, 'tp_mult': 2.5613501658938613, 'tsl_mult': 0.534846749300927, 'strategy': 'mean_reversion', 'time_stop': 46, 'use_sma': True, 'use_atr': False, 'use_adx': False, 'use_ema': True, 'use_spike': False, 'rsi_required': True, 'edge_k': 1.8401175496047144, 'edge_cap': 0.16163052114189, 'bull_strategy': 'mean_reversion', 'bull_bb_std_mult': 0.6627057720816054, 'bull_rsi_os': 26, 'bull_rsi_ob': 81, 'bull_adx_thresh': 6.814076270812571, 'bull_atr_min_pct': 0.0005904326294454641, 'bull_atr_max_pct': 0.03396660242429562, 'bull_tp_mult': 1.5471669055608503, 'bull_tsl_mult': 0.6528188743817311, 'bull_time_stop': 294, 'bull_use_sma': False, 'bull_use_ema': False, 'bull_use_atr': True, 'bull_use_adx': True, 'bull_use_spike': False, 'bull_rsi_required': True, 'bear_strategy': 'mean_reversion', 'bear_bb_std_mult': 3.212338319240088, 'bear_rsi_os': 12, 'bear_rsi_ob': 73, 'bear_adx_thresh': 33.28846020127805, 'bear_atr_min_pct': 0.006759585726004212, 'bear_atr_max_pct': 0.07415049810261447, 'bear_tp_mult': 2.9587103688546774, 'bear_tsl_mult': 0.03830464173458787, 'bear_time_stop': 165, 'bear_use_sma': True, 'bear_use_ema': True, 'bear_use_atr': True, 'bear_use_adx': True, 'bear_use_spike': True, 'bear_rsi_required': False, 'sideways_strategy': 'breakout', 'sideways_bb_std_mult': 2.706459593717656, 'sideways_rsi_os': 9, 'sideways_rsi_ob': 58, 'sideways_adx_thresh': 20.61141946481165, 'sideways_atr_min_pct': 0.022120163997776575, 'sideways_atr_max_pct': 0.09837134317079144, 'sideways_tp_mult': 1.8411888316857987, 'sideways_tsl_mult': 0.6560598668341587, 'sideways_time_stop': 242, 'sideways_use_sma': False, 'sideways_use_ema': False, 'sideways_use_atr': False, 'sideways_use_adx': True, 'sideways_use_spike': False, 'sideways_rsi_required': True}.
Starting optimization (600 trials, n_jobs=4) | multi-objective=True
Saved trials CSV -> runs/REAL_FUT_SHORT_US_EU_ret/h0-1-2-3_r0.03_s911/trials_metrics.csv
Saved Pareto plot -> runs/REAL_FUT_SHORT_US_EU_ret/h0-1-2-3_r0.03_s911/pareto_return_vs_drawdown.png
Top-K under DD cap: [300] (agg='median')
=== Selected trial(s) ===
top_k=1 selected_trial_numbers=[300] primary=300
ret%_train=-0.09% dd%_train=0.00% trades=1
ret%_test=0.00% dd%_test=0.00% pnl_test=0.00 trades_test=0
WFO fold 1: OOS PnL=0.00 trades=0 win_rate=0.00% avg=0.000000 ret%=0.00% maxDD=0.000000 maxDD%=0.00%
WFO fold 2: OOS PnL=0.00 trades=0 win_rate=0.00% avg=0.000000 ret%=0.00% maxDD=0.000000 maxDD%=0.00%
WFO fold 3: OOS PnL=0.00 trades=0 win_rate=0.00% avg=0.000000 ret%=0.00% maxDD=0.000000 maxDD%=0.00%
WFO fold 4: OOS PnL=0.00 trades=0 win_rate=0.00% avg=0.000000 ret%=0.00% maxDD=0.000000 maxDD%=0.00%
WFO fold 5: OOS PnL=0.00 trades=0 win_rate=0.00% avg=0.000000 ret%=0.00% maxDD=0.000000 maxDD%=0.00%
WFO fold 6: OOS PnL=0.00 trades=0 win_rate=0.00% avg=0.000000 ret%=0.00% maxDD=0.000000 maxDD%=0.00%
WFO summary: meanPnL=0.00 stdPnL=0.00 meanWR=0.00% meanAvg=0.000000 meanRet%=0.00% worstDD=0.000000 worstDD%=0.00% folds=6 trades=0
Wrote runs/REAL_FUT_SHORT_US_EU_ret/h0-1-2-3_r0.03_s911/strategy_profile.json
=== ECHO SELECTED PARAMS (JSON) ===
{
  "adx_thresh": 12.73757351194444,
  "aggregate_params": "median",
  "atr_max_pct": 0.05876616023398416,
  "atr_min_pct": 0.008214634736441283,
  "bar_priority": "stop_first",
  "bb_std_mult": 1.2880344198593663,
  "bear_adx_thresh": 25.688988415504365,
  "bear_atr_max_pct": 0.04298107624666707,
  "bear_atr_min_pct": 0.02750659557964983,
  "bear_bb_std_mult": 1.208419408096372,
  "bear_rsi_ob": 51,
  "bear_rsi_os": 52,
  "bear_rsi_required": true,
  "bear_strategy": "breakout",
  "bear_time_stop": 21,
  "bear_tp_mult": 1.3337499414165976,
  "bear_tsl_mult": 0.24975987082056839,
  "bear_use_adx": false,
  "bear_use_atr": true,
  "bear_use_ema": false,
  "bear_use_sma": false,
  "bear_use_spike": true,
  "bull_adx_thresh": 22.308629823407458,
  "bull_atr_max_pct": 0.11394144704697416,
  "bull_atr_min_pct": 0.009064502272640234,
  "bull_bb_std_mult": 1.687222257151008,
  "bull_rsi_ob": 54,
  "bull_rsi_os": 50,
  "bull_rsi_required": false,
  "bull_strategy": "breakout",
  "bull_time_stop": 286,
  "bull_tp_mult": 1.5263100205096936,
  "bull_tsl_mult": 0.23412313155050096,
  "bull_use_adx": false,
  "bull_use_atr": false,
  "bull_use_ema": false,
  "bull_use_sma": true,
  "bull_use_spike": true,
  "cooldown_bars": 30,
  "daily_loss_limit_pct": 0.12,
  "edge_cap": 0.5050107122148313,
  "edge_k": 0.704194583746877,
  "ema1": 20,
  "ema2": 55,
  "embargo_bars": 150,
  "fee": 0.001,
  "fill_timing": "next_open",
  "include_hours_set": "{0, 1, 2, 3}",
  "lockout_bars": 100,
  "max_consec_losses": 7,
  "max_notional_pct_equity": 1.0,
  "min_notional": 5.0,
  "ml_thresh": 0.0,
  "objective": "multi",
  "p_adx": 12,
  "p_atr": 30,
  "p_sma": 14,
  "p_std": 58,
  "participation_cap": 1.0,
  "price_step": 0.0001,
  "proba_temp": 1.0,
  "qty_step": 0.0001,
  "regime_adapt": true,
  "regime_band": 0.006,
  "regime_fast": 50,
  "regime_overrides": {
    "bear": {
      "adx": 20.0,
      "allowed_sides": [
        "long",
        "short"
      ],
      "atr_range": [
        0.0015,
        0.06
      ],
      "bb_std_mult": 1.2571599337995167,
      "mode": "breakout",
      "rsi_required": true,
      "time_stop_bars": 122,
      "tp_mult": 1.7149673432024581,
      "tsl_mult": 0.25,
      "use_adx": true,
      "use_atr": true
    },
    "bull": {
      "adx": 18.0,
      "allowed_sides": [
        "long",
        "short"
      ],
      "atr_range": [
        0.0008,
        0.06
      ],
      "bb_std_mult": 2.0169431746748376,
      "mode": "mean_reversion",
      "rsi_required": false,
      "time_stop_bars": 214,
      "tp_mult": 1.9194251920826044,
      "tsl_mult": 0.6891458682949287,
      "use_adx": true,
      "use_atr": true
    },
    "sideways": {
      "adx": 15.0,
      "allowed_sides": [
        "long",
        "short"
      ],
      "atr_range": [
        0.001,
        0.14
      ],
      "bb_std_mult": 1.5828092896467827,
      "mode": "breakout",
      "rsi_required": true,
      "time_stop_bars": 235,
      "tp_mult": 2.341879695778944,
      "tsl_mult": 0.651967765830165,
      "use_adx": true,
      "use_atr": true
    }
  },
  "regime_slow": 200,
  "risk_min_stop_frac": 0.001,
  "risk_per_trade": 0.03,
  "risk_stop_atr_mult": 1.0,
  "round_exits": true,
  "rsi_key": "rsi14",
  "rsi_ob": 94,
  "rsi_os": 20,
  "rsi_period": 14,
  "rsi_required": false,
  "select_top_k": 1,
  "session_end": 24,
  "session_start": 0,
  "sides": "short",
  "sideways_adx_thresh": 19.761384634663035,
  "sideways_atr_max_pct": 0.026520645386376204,
  "sideways_atr_min_pct": 0.005353015407825243,
  "sideways_bb_std_mult": 1.931207082838541,
  "sideways_rsi_ob": 76,
  "sideways_rsi_os": 48,
  "sideways_rsi_required": true,
  "sideways_strategy": "breakout",
  "sideways_time_stop": 133,
  "sideways_tp_mult": 2.0581827675936784,
  "sideways_tsl_mult": 0.2056142979065682,
  "sideways_use_adx": false,
  "sideways_use_atr": true,
  "sideways_use_ema": false,
  "sideways_use_sma": true,
  "sideways_use_spike": true,
  "slip_atr_k": 0.09310456478386911,
  "slip_spread_k": 0.14136394119137033,
  "slippage": 0.0006,
  "spread_hl_frac": 0.03372276794870917,
  "start_equity": 20000.0,
  "stop_extra_slip": 0.0,
  "strategy": "mean_reversion",
  "time_stop": 81,
  "tp_mult": 2.661379062847455,
  "tsl_mult": 0.9079925948712284,
  "use_adx": true,
  "use_atr": false,
  "use_ema": false,
  "use_ml": false,
  "use_sma": false,
  "use_spike": true,
  "vol_spike": 0.21573659542132584,
  "wfo_folds": 6
}
Wrote runs/REAL_FUT_SHORT_US_EU_ret/h0-1-2-3_r0.03_s911/best_params.pkl
