[I 2025-09-01 03:37:57,032] Trial 452 finished with values: [-1000000000.0, 1000000000.0] and parameters: {'p_sma': 29, 'p_std': 55, 'p_atr': 28, 'p_adx': 18, 'rsi_period': 11, 'ema1': 22, 'ema2': 59, 'slip_atr_k': 0.024201456362999356, 'slip_spread_k': 0.20462590515833334, 'spread_hl_frac': 0.009392427485476019, 'bb_std_mult': 2.15753551101525, 'rsi_os': 19, 'rsi_ob': 82, 'vol_spike': 0.19630378590193026, 'adx_thresh': 10.996535150283258, 'atr_min_pct': 0.010085688608589102, 'atr_max_pct': 0.14178606848622144, 'tp_mult': 2.30091837362475, 'tsl_mult': 0.36382929977087203, 'strategy': 'breakout', 'time_stop': 168, 'use_sma': False, 'use_atr': False, 'use_adx': True, 'use_ema': True, 'use_spike': True, 'rsi_required': False, 'edge_k': 0.02480457759734614, 'edge_cap': 0.08750233357868831, 'bull_strategy': 'mean_reversion', 'bull_bb_std_mult': 2.3003345454126944, 'bull_rsi_os': 30, 'bull_rsi_ob': 53, 'bull_adx_thresh': 25.999777524269955, 'bull_atr_min_pct': 0.0024333998183986047, 'bull_atr_max_pct': 0.11832469042745891, 'bull_tp_mult': 1.9127717639176691, 'bull_tsl_mult': 0.003546911075542336, 'bull_time_stop': 36, 'bull_use_sma': True, 'bull_use_ema': False, 'bull_use_atr': False, 'bull_use_adx': False, 'bull_use_spike': True, 'bull_rsi_required': True, 'bear_strategy': 'breakout', 'bear_bb_std_mult': 2.1097578167759212, 'bear_rsi_os': 54, 'bear_rsi_ob': 58, 'bear_adx_thresh': 27.540463602848845, 'bear_atr_min_pct': 0.02561825370758291, 'bear_atr_max_pct': 0.021882523346451316, 'bear_tp_mult': 1.0761637893685914, 'bear_tsl_mult': 0.666493398755549, 'bear_time_stop': 270, 'bear_use_sma': False, 'bear_use_ema': False, 'bear_use_atr': True, 'bear_use_adx': False, 'bear_use_spike': True, 'bear_rsi_required': True, 'sideways_strategy': 'breakout', 'sideways_bb_std_mult': 0.5986949177916581, 'sideways_rsi_os': 47, 'sideways_rsi_ob': 85, 'sideways_adx_thresh': 30.006578701946193, 'sideways_atr_min_pct': 0.01357820706561754, 'sideways_atr_max_pct': 0.023494259908817875, 'sideways_tp_mult': 2.329086806933983, 'sideways_tsl_mult': 0.21332099226173717, 'sideways_time_stop': 149, 'sideways_use_sma': False, 'sideways_use_ema': False, 'sideways_use_atr': False, 'sideways_use_adx': False, 'sideways_use_spike': True, 'sideways_rsi_required': True}.
[I 2025-09-01 03:37:58,213] Trial 449 finished with values: [-1000000000.0, 1000000000.0] and parameters: {'p_sma': 30, 'p_std': 15, 'p_atr': 28, 'p_adx': 29, 'rsi_period': 11, 'ema1': 21, 'ema2': 59, 'slip_atr_k': 0.21228536027649791, 'slip_spread_k': 0.208810984746981, 'spread_hl_frac': 0.030283697836683048, 'bb_std_mult': 3.4292425643331517, 'rsi_os': 19, 'rsi_ob': 82, 'vol_spike': 0.1764341741568708, 'adx_thresh': 11.99112914678634, 'atr_min_pct': 0.027703120343956954, 'atr_max_pct': 0.05146126494668358, 'tp_mult': 2.8413990226450383, 'tsl_mult': 0.33920174366957634, 'strategy': 'mean_reversion', 'time_stop': 289, 'use_sma': False, 'use_atr': False, 'use_adx': True, 'use_ema': False, 'use_spike': True, 'rsi_required': False, 'edge_k': 0.160017618458651, 'edge_cap': 0.8125031128815782, 'bull_strategy': 'breakout', 'bull_bb_std_mult': 2.3023836818057664, 'bull_rsi_os': 12, 'bull_rsi_ob': 56, 'bull_adx_thresh': 26.136377085795345, 'bull_atr_min_pct': 0.0022103843370865402, 'bull_atr_max_pct': 0.12413690828904332, 'bull_tp_mult': 1.6349370823370277, 'bull_tsl_mult': 0.2202473771021266, 'bull_time_stop': 256, 'bull_use_sma': True, 'bull_use_ema': False, 'bull_use_atr': False, 'bull_use_adx': False, 'bull_use_spike': True, 'bull_rsi_required': False, 'bear_strategy': 'breakout', 'bear_bb_std_mult': 0.8780305465991105, 'bear_rsi_os': 14, 'bear_rsi_ob': 63, 'bear_adx_thresh': 24.269374219611116, 'bear_atr_min_pct': 0.025582556711091123, 'bear_atr_max_pct': 0.02387450389691473, 'bear_tp_mult': 1.8554993121722545, 'bear_tsl_mult': 0.16926366489796496, 'bear_time_stop': 60, 'bear_use_sma': False, 'bear_use_ema': False, 'bear_use_atr': False, 'bear_use_adx': False, 'bear_use_spike': True, 'bear_rsi_required': True, 'sideways_strategy': 'breakout', 'sideways_bb_std_mult': 1.0017287330356075, 'sideways_rsi_os': 49, 'sideways_rsi_ob': 49, 'sideways_adx_thresh': 7.018224742602714, 'sideways_atr_min_pct': 0.011567694984889902, 'sideways_atr_max_pct': 0.12367031223493272, 'sideways_tp_mult': 1.931364530944744, 'sideways_tsl_mult': 0.21732677344044604, 'sideways_time_stop': 148, 'sideways_use_sma': True, 'sideways_use_ema': True, 'sideways_use_atr': False, 'sideways_use_adx': False, 'sideways_use_spike': True, 'sideways_rsi_required': False}.
[I 2025-09-01 03:37:58,409] Trial 450 finished with values: [-1000000000.0, 1000000000.0] and parameters: {'p_sma': 29, 'p_std': 55, 'p_atr': 8, 'p_adx': 29, 'rsi_period': 11, 'ema1': 29, 'ema2': 34, 'slip_atr_k': 0.02520341577438226, 'slip_spread_k': 0.5405768162526201, 'spread_hl_frac': 0.028464110301234816, 'bb_std_mult': 1.385216962455775, 'rsi_os': 51, 'rsi_ob': 82, 'vol_spike': 0.08768302803593997, 'adx_thresh': 11.938598022181798, 'atr_min_pct': 0.027859570977163343, 'atr_max_pct': 0.047070306460552214, 'tp_mult': 2.3161488869813205, 'tsl_mult': 0.35613617522587393, 'strategy': 'breakout', 'time_stop': 224, 'use_sma': False, 'use_atr': False, 'use_adx': True, 'use_ema': True, 'use_spike': True, 'rsi_required': False, 'edge_k': 0.6282419021880337, 'edge_cap': 0.42588827120256195, 'bull_strategy': 'mean_reversion', 'bull_bb_std_mult': 2.856707752721155, 'bull_rsi_os': 30, 'bull_rsi_ob': 48, 'bull_adx_thresh': 28.438767311671555, 'bull_atr_min_pct': 0.0023212326622808932, 'bull_atr_max_pct': 0.016515795894736243, 'bull_tp_mult': 1.480572325460063, 'bull_tsl_mult': 0.285847882813657, 'bull_time_stop': 264, 'bull_use_sma': True, 'bull_use_ema': False, 'bull_use_atr': False, 'bull_use_adx': False, 'bull_use_spike': True, 'bull_rsi_required': True, 'bear_strategy': 'breakout', 'bear_bb_std_mult': 2.0966718985717, 'bear_rsi_os': 13, 'bear_rsi_ob': 57, 'bear_adx_thresh': 24.990431680311573, 'bear_atr_min_pct': 0.025659547097040977, 'bear_atr_max_pct': 0.05786965562964478, 'bear_tp_mult': 1.0108230492697479, 'bear_tsl_mult': 0.1624102258718561, 'bear_time_stop': 71, 'bear_use_sma': False, 'bear_use_ema': False, 'bear_use_atr': False, 'bear_use_adx': False, 'bear_use_spike': True, 'bear_rsi_required': True, 'sideways_strategy': 'breakout', 'sideways_bb_std_mult': 2.6197995732907655, 'sideways_rsi_os': 48, 'sideways_rsi_ob': 73, 'sideways_adx_thresh': 29.886545250753382, 'sideways_atr_min_pct': 0.027986742253497267, 'sideways_atr_max_pct': 0.09842793386062665, 'sideways_tp_mult': 1.5990406618367294, 'sideways_tsl_mult': 0.2681913769490171, 'sideways_time_stop': 146, 'sideways_use_sma': False, 'sideways_use_ema': True, 'sideways_use_atr': False, 'sideways_use_adx': False, 'sideways_use_spike': True, 'sideways_rsi_required': True}.
[I 2025-09-01 03:38:40,780] Trial 456 finished with values: [-1000000000.0, 1000000000.0] and parameters: {'p_sma': 45, 'p_std': 7, 'p_atr': 27, 'p_adx': 17, 'rsi_period': 25, 'ema1': 19, 'ema2': 40, 'slip_atr_k': 0.03683482385235974, 'slip_spread_k': 0.14990647714317992, 'spread_hl_frac': 0.025810882886789736, 'bb_std_mult': 1.5028630067081514, 'rsi_os': 30, 'rsi_ob': 84, 'vol_spike': 0.20531641494184077, 'adx_thresh': 10.452955903214768, 'atr_min_pct': 0.007983812493711794, 'atr_max_pct': 0.10667534465945275, 'tp_mult': 2.6452999546745772, 'tsl_mult': 0.39834420470096066, 'strategy': 'mean_reversion', 'time_stop': 175, 'use_sma': True, 'use_atr': True, 'use_adx': False, 'use_ema': False, 'use_spike': False, 'rsi_required': True, 'edge_k': 1.7833159023920135, 'edge_cap': 0.476281048872232, 'bull_strategy': 'breakout', 'bull_bb_std_mult': 1.3202103033013848, 'bull_rsi_os': 16, 'bull_rsi_ob': 54, 'bull_adx_thresh': 13.439913358826892, 'bull_atr_min_pct': 0.007749858440582699, 'bull_atr_max_pct': 0.13720574854533446, 'bull_tp_mult': 1.1919893453380004, 'bull_tsl_mult': 0.18197839736704385, 'bull_time_stop': 160, 'bull_use_sma': False, 'bull_use_ema': False, 'bull_use_atr': True, 'bull_use_adx': True, 'bull_use_spike': False, 'bull_rsi_required': False, 'bear_strategy': 'mean_reversion', 'bear_bb_std_mult': 1.9699876533508935, 'bear_rsi_os': 50, 'bear_rsi_ob': 89, 'bear_adx_thresh': 23.796294607022332, 'bear_atr_min_pct': 0.017602417916515935, 'bear_atr_max_pct': 0.03027723105933472, 'bear_tp_mult': 1.0449176858714688, 'bear_tsl_mult': 0.9234612231175147, 'bear_time_stop': 27, 'bear_use_sma': False, 'bear_use_ema': True, 'bear_use_atr': False, 'bear_use_adx': True, 'bear_use_spike': False, 'bear_rsi_required': False, 'sideways_strategy': 'mean_reversion', 'sideways_bb_std_mult': 1.7870271666715845, 'sideways_rsi_os': 49, 'sideways_rsi_ob': 64, 'sideways_adx_thresh': 28.99144801555888, 'sideways_atr_min_pct': 0.0014423130198977369, 'sideways_atr_max_pct': 0.07165961751560328, 'sideways_tp_mult': 1.6388231521795154, 'sideways_tsl_mult': 0.18178092844359528, 'sideways_time_stop': 210, 'sideways_use_sma': True, 'sideways_use_ema': True, 'sideways_use_atr': True, 'sideways_use_adx': True, 'sideways_use_spike': False, 'sideways_rsi_required': True}.
[I 2025-09-01 03:38:41,859] Trial 455 finished with values: [-1000000000.0, 1000000000.0] and parameters: {'p_sma': 11, 'p_std': 60, 'p_atr': 27, 'p_adx': 17, 'rsi_period': 45, 'ema1': 19, 'ema2': 58, 'slip_atr_k': 0.18458827533445593, 'slip_spread_k': 0.5505299783857404, 'spread_hl_frac': 0.04638807528317335, 'bb_std_mult': 1.3979469392915957, 'rsi_os': 21, 'rsi_ob': 84, 'vol_spike': 0.20764603793879652, 'adx_thresh': 12.141751786230476, 'atr_min_pct': 0.029855235868969585, 'atr_max_pct': 0.04696497569336967, 'tp_mult': 2.640573898438436, 'tsl_mult': 0.9222381548648404, 'strategy': 'mean_reversion', 'time_stop': 119, 'use_sma': True, 'use_atr': True, 'use_adx': True, 'use_ema': False, 'use_spike': True, 'rsi_required': False, 'edge_k': 0.0009938294362606959, 'edge_cap': 0.4249108149183555, 'bull_strategy': 'breakout', 'bull_bb_std_mult': 1.169162941637048, 'bull_rsi_os': 35, 'bull_rsi_ob': 51, 'bull_adx_thresh': 18.354385834689946, 'bull_atr_min_pct': 0.0009646319451535503, 'bull_atr_max_pct': 0.07377197461890218, 'bull_tp_mult': 2.79265282603175, 'bull_tsl_mult': 0.1854912960969986, 'bull_time_stop': 114, 'bull_use_sma': False, 'bull_use_ema': False, 'bull_use_atr': False, 'bull_use_adx': True, 'bull_use_spike': True, 'bull_rsi_required': False, 'bear_strategy': 'breakout', 'bear_bb_std_mult': 1.9510247607144091, 'bear_rsi_os': 50, 'bear_rsi_ob': 69, 'bear_adx_thresh': 24.786991714554407, 'bear_atr_min_pct': 0.00987398794831245, 'bear_atr_max_pct': 0.06984381579039467, 'bear_tp_mult': 1.0117731772263292, 'bear_tsl_mult': 0.41719991281145247, 'bear_time_stop': 260, 'bear_use_sma': False, 'bear_use_ema': True, 'bear_use_atr': False, 'bear_use_adx': False, 'bear_use_spike': False, 'bear_rsi_required': False, 'sideways_strategy': 'mean_reversion', 'sideways_bb_std_mult': 1.7732127139249911, 'sideways_rsi_os': 48, 'sideways_rsi_ob': 69, 'sideways_adx_thresh': 28.863030246403675, 'sideways_atr_min_pct': 0.004296675156787834, 'sideways_atr_max_pct': 0.01936516701189037, 'sideways_tp_mult': 2.9128752445814414, 'sideways_tsl_mult': 0.18031643827360766, 'sideways_time_stop': 66, 'sideways_use_sma': True, 'sideways_use_ema': True, 'sideways_use_atr': True, 'sideways_use_adx': True, 'sideways_use_spike': True, 'sideways_rsi_required': True}.
[I 2025-09-01 03:38:42,112] Trial 454 finished with values: [-1000000000.0, 1000000000.0] and parameters: {'p_sma': 30, 'p_std': 58, 'p_atr': 28, 'p_adx': 14, 'rsi_period': 25, 'ema1': 17, 'ema2': 40, 'slip_atr_k': 0.03608193307320391, 'slip_spread_k': 0.5455398927470596, 'spread_hl_frac': 0.046400464235538216, 'bb_std_mult': 1.5201463128054908, 'rsi_os': 20, 'rsi_ob': 84, 'vol_spike': 0.08073977653664452, 'adx_thresh': 11.883531821248438, 'atr_min_pct': 0.015689278638802585, 'atr_max_pct': 0.047809829615430864, 'tp_mult': 2.7027113706415697, 'tsl_mult': 0.39356096562126613, 'strategy': 'mean_reversion', 'time_stop': 225, 'use_sma': True, 'use_atr': False, 'use_adx': True, 'use_ema': False, 'use_spike': True, 'rsi_required': False, 'edge_k': 0.08700014082890682, 'edge_cap': 0.4212643337165296, 'bull_strategy': 'breakout', 'bull_bb_std_mult': 1.0322918515989963, 'bull_rsi_os': 15, 'bull_rsi_ob': 78, 'bull_adx_thresh': 24.096594151755, 'bull_atr_min_pct': 0.00211960116070251, 'bull_atr_max_pct': 0.1025529160522917, 'bull_tp_mult': 1.697891589727914, 'bull_tsl_mult': 0.28679871881246727, 'bull_time_stop': 257, 'bull_use_sma': False, 'bull_use_ema': False, 'bull_use_atr': False, 'bull_use_adx': True, 'bull_use_spike': True, 'bull_rsi_required': False, 'bear_strategy': 'breakout', 'bear_bb_std_mult': 2.0017349860923046, 'bear_rsi_os': 50, 'bear_rsi_ob': 61, 'bear_adx_thresh': 24.795840600747912, 'bear_atr_min_pct': 0.010012193949584327, 'bear_atr_max_pct': 0.02935571224144097, 'bear_tp_mult': 1.0134105309843549, 'bear_tsl_mult': 0.36419773340563083, 'bear_time_stop': 158, 'bear_use_sma': False, 'bear_use_ema': True, 'bear_use_atr': False, 'bear_use_adx': False, 'bear_use_spike': False, 'bear_rsi_required': False, 'sideways_strategy': 'mean_reversion', 'sideways_bb_std_mult': 1.942302505599772, 'sideways_rsi_os': 48, 'sideways_rsi_ob': 69, 'sideways_adx_thresh': 27.876753059871522, 'sideways_atr_min_pct': 0.011875158260772978, 'sideways_atr_max_pct': 0.13058726115147462, 'sideways_tp_mult': 1.5383091463761807, 'sideways_tsl_mult': 0.15039632153081017, 'sideways_time_stop': 66, 'sideways_use_sma': True, 'sideways_use_ema': True, 'sideways_use_atr': True, 'sideways_use_adx': True, 'sideways_use_spike': True, 'sideways_rsi_required': True}.
[I 2025-09-01 03:38:42,386] Trial 453 finished with values: [-1000000000.0, 1000000000.0] and parameters: {'p_sma': 48, 'p_std': 58, 'p_atr': 13, 'p_adx': 25, 'rsi_period': 13, 'ema1': 17, 'ema2': 21, 'slip_atr_k': 0.018056060202639904, 'slip_spread_k': 0.17362924401503255, 'spread_hl_frac': 0.028294546779031107, 'bb_std_mult': 1.3704581856048819, 'rsi_os': 20, 'rsi_ob': 84, 'vol_spike': 0.27057166162602764, 'adx_thresh': 12.20748084323155, 'atr_min_pct': 0.020772950501909165, 'atr_max_pct': 0.04823639183892074, 'tp_mult': 2.9457606221942774, 'tsl_mult': 0.7504300958631192, 'strategy': 'mean_reversion', 'time_stop': 226, 'use_sma': True, 'use_atr': False, 'use_adx': True, 'use_ema': False, 'use_spike': True, 'rsi_required': False, 'edge_k': 0.0018979664912888439, 'edge_cap': 0.4288270152330959, 'bull_strategy': 'breakout', 'bull_bb_std_mult': 2.741379111664285, 'bull_rsi_os': 25, 'bull_rsi_ob': 49, 'bull_adx_thresh': 24.10119629347545, 'bull_atr_min_pct': 0.002161049480826035, 'bull_atr_max_pct': 0.11781049198104705, 'bull_tp_mult': 1.5960015632901607, 'bull_tsl_mult': 0.19057344363300613, 'bull_time_stop': 257, 'bull_use_sma': False, 'bull_use_ema': False, 'bull_use_atr': False, 'bull_use_adx': True, 'bull_use_spike': True, 'bull_rsi_required': False, 'bear_strategy': 'breakout', 'bear_bb_std_mult': 1.4305792113330211, 'bear_rsi_os': 50, 'bear_rsi_ob': 61, 'bear_adx_thresh': 24.05220679880253, 'bear_atr_min_pct': 0.02764559814632698, 'bear_atr_max_pct': 0.02927295749618319, 'bear_tp_mult': 1.0453480275487552, 'bear_tsl_mult': 0.37029916693151643, 'bear_time_stop': 263, 'bear_use_sma': False, 'bear_use_ema': True, 'bear_use_atr': False, 'bear_use_adx': False, 'bear_use_spike': False, 'bear_rsi_required': False, 'sideways_strategy': 'mean_reversion', 'sideways_bb_std_mult': 1.7808339770228552, 'sideways_rsi_os': 49, 'sideways_rsi_ob': 47, 'sideways_adx_thresh': 28.957633293086502, 'sideways_atr_min_pct': 0.027607506972269078, 'sideways_atr_max_pct': 0.12303420880295157, 'sideways_tp_mult': 1.6397886651456999, 'sideways_tsl_mult': 0.1816189300173751, 'sideways_time_stop': 65, 'sideways_use_sma': True, 'sideways_use_ema': True, 'sideways_use_atr': True, 'sideways_use_adx': True, 'sideways_use_spike': True, 'sideways_rsi_required': True}.
[I 2025-09-01 03:39:24,413] Trial 460 finished with values: [-1000000000.0, 1000000000.0] and parameters: {'p_sma': 27, 'p_std': 56, 'p_atr': 22, 'p_adx': 17, 'rsi_period': 9, 'ema1': 20, 'ema2': 56, 'slip_atr_k': 0.014054444268191031, 'slip_spread_k': 0.11716574556727166, 'spread_hl_frac': 0.029661477136431493, 'bb_std_mult': 2.691510245908849, 'rsi_os': 23, 'rsi_ob': 86, 'vol_spike': 0.04565895697465512, 'adx_thresh': 11.378929378527076, 'atr_min_pct': 0.0072256701363087915, 'atr_max_pct': 0.05614546758382895, 'tp_mult': 1.6663137616773338, 'tsl_mult': 0.4145713459211481, 'strategy': 'mean_reversion', 'time_stop': 162, 'use_sma': False, 'use_atr': False, 'use_adx': False, 'use_ema': False, 'use_spike': False, 'rsi_required': True, 'edge_k': 0.0558088101244057, 'edge_cap': 0.4995659261750973, 'bull_strategy': 'breakout', 'bull_bb_std_mult': 1.1470602612653593, 'bull_rsi_os': 16, 'bull_rsi_ob': 45, 'bull_adx_thresh': 8.865429241914828, 'bull_atr_min_pct': 0.0012161801919636965, 'bull_atr_max_pct': 0.04656746580830472, 'bull_tp_mult': 1.6612742913947276, 'bull_tsl_mult': 0.2536469515173924, 'bull_time_stop': 76, 'bull_use_sma': True, 'bull_use_ema': True, 'bull_use_atr': True, 'bull_use_adx': False, 'bull_use_spike': False, 'bull_rsi_required': False, 'bear_strategy': 'mean_reversion', 'bear_bb_std_mult': 2.5441085861488406, 'bear_rsi_os': 53, 'bear_rsi_ob': 51, 'bear_adx_thresh': 28.0182171076945, 'bear_atr_min_pct': 0.02652032324562544, 'bear_atr_max_pct': 0.02661712507746722, 'bear_tp_mult': 1.084335200484615, 'bear_tsl_mult': 0.1279889079375602, 'bear_time_stop': 142, 'bear_use_sma': True, 'bear_use_ema': False, 'bear_use_atr': True, 'bear_use_adx': True, 'bear_use_spike': True, 'bear_rsi_required': True, 'sideways_strategy': 'breakout', 'sideways_bb_std_mult': 1.916528091277439, 'sideways_rsi_os': 47, 'sideways_rsi_ob': 76, 'sideways_adx_thresh': 12.913534043288287, 'sideways_atr_min_pct': 0.012737693721212626, 'sideways_atr_max_pct': 0.14310915771520816, 'sideways_tp_mult': 2.454597916290104, 'sideways_tsl_mult': 0.6752059654015187, 'sideways_time_stop': 123, 'sideways_use_sma': True, 'sideways_use_ema': False, 'sideways_use_atr': True, 'sideways_use_adx': False, 'sideways_use_spike': False, 'sideways_rsi_required': True}.
[I 2025-09-01 03:39:25,830] Trial 458 finished with values: [-1000000000.0, 1000000000.0] and parameters: {'p_sma': 26, 'p_std': 59, 'p_atr': 22, 'p_adx': 22, 'rsi_period': 13, 'ema1': 23, 'ema2': 56, 'slip_atr_k': 0.01686812238684271, 'slip_spread_k': 0.1670959472837052, 'spread_hl_frac': 0.02817542754331684, 'bb_std_mult': 1.3177005200779766, 'rsi_os': 23, 'rsi_ob': 85, 'vol_spike': 0.24768520644699674, 'adx_thresh': 11.295573142829694, 'atr_min_pct': 0.007308383591831712, 'atr_max_pct': 0.05541080595496678, 'tp_mult': 2.7450070480571256, 'tsl_mult': 0.41128985296907006, 'strategy': 'mean_reversion', 'time_stop': 161, 'use_sma': False, 'use_atr': False, 'use_adx': True, 'use_ema': False, 'use_spike': True, 'rsi_required': False, 'edge_k': 1.8780768428784693, 'edge_cap': 0.5314672537644961, 'bull_strategy': 'breakout', 'bull_bb_std_mult': 2.2306519474907542, 'bull_rsi_os': 48, 'bull_rsi_ob': 58, 'bull_adx_thresh': 8.789215669886104, 'bull_atr_min_pct': 0.016795294242628198, 'bull_atr_max_pct': 0.11921092341152, 'bull_tp_mult': 1.5952522635727024, 'bull_tsl_mult': 0.43120629193954385, 'bull_time_stop': 182, 'bull_use_sma': True, 'bull_use_ema': True, 'bull_use_atr': False, 'bull_use_adx': False, 'bull_use_spike': True, 'bull_rsi_required': False, 'bear_strategy': 'mean_reversion', 'bear_bb_std_mult': 2.69339331165758, 'bear_rsi_os': 53, 'bear_rsi_ob': 87, 'bear_adx_thresh': 23.922247755976116, 'bear_atr_min_pct': 0.02754899357060269, 'bear_atr_max_pct': 0.026459464258995053, 'bear_tp_mult': 1.088632409166212, 'bear_tsl_mult': 0.13665457549540344, 'bear_time_stop': 67, 'bear_use_sma': True, 'bear_use_ema': False, 'bear_use_atr': False, 'bear_use_adx': False, 'bear_use_spike': True, 'bear_rsi_required': True, 'sideways_strategy': 'breakout', 'sideways_bb_std_mult': 0.7058461923127475, 'sideways_rsi_os': 47, 'sideways_rsi_ob': 76, 'sideways_adx_thresh': 27.127176168055566, 'sideways_atr_min_pct': 0.014728672520024102, 'sideways_atr_max_pct': 0.02950857895767958, 'sideways_tp_mult': 1.7372192655172418, 'sideways_tsl_mult': 0.8721292933049642, 'sideways_time_stop': 123, 'sideways_use_sma': True, 'sideways_use_ema': True, 'sideways_use_atr': True, 'sideways_use_adx': False, 'sideways_use_spike': True, 'sideways_rsi_required': True}.
