[I 2025-09-01 03:36:30,858] Trial 443 finished with values: [-0.035170651322147584, 0.035480805273974556] and parameters: {'p_sma': 51, 'p_std': 59, 'p_atr': 18, 'p_adx': 18, 'rsi_period': 70, 'ema1': 22, 'ema2': 57, 'slip_atr_k': 0.04864143064656734, 'slip_spread_k': 0.1636133169631866, 'spread_hl_frac': 0.027373684738846858, 'bb_std_mult': 1.589255977777162, 'rsi_os': 20, 'rsi_ob': 85, 'vol_spike': 0.06066214254496284, 'adx_thresh': 11.845520736571014, 'atr_min_pct': 0.010923531054424498, 'atr_max_pct': 0.1495363402513104, 'tp_mult': 2.6662352593837486, 'tsl_mult': 0.3965976347364327, 'strategy': 'mean_reversion', 'time_stop': 235, 'use_sma': True, 'use_atr': True, 'use_adx': False, 'use_ema': False, 'use_spike': True, 'rsi_required': False, 'edge_k': 1.6681569984388736, 'edge_cap': 0.45296749892857063, 'bull_strategy': 'breakout', 'bull_bb_std_mult': 1.0963343749608305, 'bull_rsi_os': 15, 'bull_rsi_ob': 75, 'bull_adx_thresh': 22.832569450435187, 'bull_atr_min_pct': 0.0011778693290915678, 'bull_atr_max_pct': 0.02204242984685318, 'bull_tp_mult': 1.5550192370406166, 'bull_tsl_mult': 0.3106934187050263, 'bull_time_stop': 274, 'bull_use_sma': True, 'bull_use_ema': False, 'bull_use_atr': False, 'bull_use_adx': False, 'bull_use_spike': True, 'bull_rsi_required': False, 'bear_strategy': 'mean_reversion', 'bear_bb_std_mult': 2.0301460429119498, 'bear_rsi_os': 55, 'bear_rsi_ob': 58, 'bear_adx_thresh': 26.478957852725795, 'bear_atr_min_pct': 0.0025518870209133033, 'bear_atr_max_pct': 0.02288881777953013, 'bear_tp_mult': 1.0697111248662947, 'bear_tsl_mult': 0.298441749622834, 'bear_time_stop': 65, 'bear_use_sma': True, 'bear_use_ema': False, 'bear_use_atr': True, 'bear_use_adx': True, 'bear_use_spike': True, 'bear_rsi_required': True, 'sideways_strategy': 'breakout', 'sideways_bb_std_mult': 0.8956322755754829, 'sideways_rsi_os': 48, 'sideways_rsi_ob': 70, 'sideways_adx_thresh': 29.14090516151282, 'sideways_atr_min_pct': 0.003091263871088575, 'sideways_atr_max_pct': 0.01902986580487838, 'sideways_tp_mult': 1.7679826703240853, 'sideways_tsl_mult': 0.18633185027610194, 'sideways_time_stop': 118, 'sideways_use_sma': True, 'sideways_use_ema': False, 'sideways_use_atr': True, 'sideways_use_adx': False, 'sideways_use_spike': True, 'sideways_rsi_required': True}.
[I 2025-09-01 03:36:31,212] Trial 444 finished with values: [-1000000000.0, 1000000000.0] and parameters: {'p_sma': 46, 'p_std': 59, 'p_atr': 11, 'p_adx': 17, 'rsi_period': 33, 'ema1': 15, 'ema2': 57, 'slip_atr_k': 0.24266263756262263, 'slip_spread_k': 0.15910078065336078, 'spread_hl_frac': 0.029083273338279373, 'bb_std_mult': 2.2518097474756864, 'rsi_os': 20, 'rsi_ob': 84, 'vol_spike': 0.06003750879855742, 'adx_thresh': 11.863978631470731, 'atr_min_pct': 0.006992143861518317, 'atr_max_pct': 0.07994103695500798, 'tp_mult': 2.1877233548109962, 'tsl_mult': 0.40156072715511915, 'strategy': 'mean_reversion', 'time_stop': 79, 'use_sma': True, 'use_atr': False, 'use_adx': False, 'use_ema': False, 'use_spike': True, 'rsi_required': False, 'edge_k': 0.07972522232267124, 'edge_cap': 0.45508723011419344, 'bull_strategy': 'breakout', 'bull_bb_std_mult': 1.1068275235287568, 'bull_rsi_os': 15, 'bull_rsi_ob': 52, 'bull_adx_thresh': 32.05981749662045, 'bull_atr_min_pct': 0.0008768500479638047, 'bull_atr_max_pct': 0.022153262247210335, 'bull_tp_mult': 1.6722482123520392, 'bull_tsl_mult': 0.3119925183038389, 'bull_time_stop': 170, 'bull_use_sma': True, 'bull_use_ema': False, 'bull_use_atr': False, 'bull_use_adx': False, 'bull_use_spike': True, 'bull_rsi_required': False, 'bear_strategy': 'breakout', 'bear_bb_std_mult': 0.6565326342866313, 'bear_rsi_os': 55, 'bear_rsi_ob': 49, 'bear_adx_thresh': 26.745488519767697, 'bear_atr_min_pct': 0.027839463396965768, 'bear_atr_max_pct': 0.031011634345916243, 'bear_tp_mult': 1.4152301836843955, 'bear_tsl_mult': 0.1426896882550835, 'bear_time_stop': 67, 'bear_use_sma': False, 'bear_use_ema': False, 'bear_use_atr': True, 'bear_use_adx': True, 'bear_use_spike': True, 'bear_rsi_required': True, 'sideways_strategy': 'breakout', 'sideways_bb_std_mult': 1.9306480015670966, 'sideways_rsi_os': 48, 'sideways_rsi_ob': 45, 'sideways_adx_thresh': 29.289610398491213, 'sideways_atr_min_pct': 0.029272163229570942, 'sideways_atr_max_pct': 0.029811338049461907, 'sideways_tp_mult': 2.3916467181995764, 'sideways_tsl_mult': 0.19794347339211776, 'sideways_time_stop': 271, 'sideways_use_sma': True, 'sideways_use_ema': False, 'sideways_use_atr': True, 'sideways_use_adx': False, 'sideways_use_spike': True, 'sideways_rsi_required': True}.
[I 2025-09-01 03:36:31,403] Trial 441 finished with values: [-1000000000.0, 1000000000.0] and parameters: {'p_sma': 54, 'p_std': 58, 'p_atr': 18, 'p_adx': 17, 'rsi_period': 16, 'ema1': 7, 'ema2': 26, 'slip_atr_k': 0.008163263439462859, 'slip_spread_k': 0.13901561893989756, 'spread_hl_frac': 0.027255294593361325, 'bb_std_mult': 1.6094720118051768, 'rsi_os': 41, 'rsi_ob': 85, 'vol_spike': 0.23103865690027023, 'adx_thresh': 11.024228338173538, 'atr_min_pct': 0.01837836651375583, 'atr_max_pct': 0.07137730862236906, 'tp_mult': 1.9376250572304918, 'tsl_mult': 0.9412924425244872, 'strategy': 'mean_reversion', 'time_stop': 50, 'use_sma': True, 'use_atr': True, 'use_adx': False, 'use_ema': False, 'use_spike': False, 'rsi_required': True, 'edge_k': 0.07231476197481049, 'edge_cap': 0.44987161869419723, 'bull_strategy': 'breakout', 'bull_bb_std_mult': 1.1078439611763728, 'bull_rsi_os': 17, 'bull_rsi_ob': 75, 'bull_adx_thresh': 23.086153446752128, 'bull_atr_min_pct': 0.021284166941642806, 'bull_atr_max_pct': 0.11985604105247577, 'bull_tp_mult': 1.5485532745995951, 'bull_tsl_mult': 0.3107169110030015, 'bull_time_stop': 275, 'bull_use_sma': True, 'bull_use_ema': False, 'bull_use_atr': True, 'bull_use_adx': False, 'bull_use_spike': False, 'bull_rsi_required': False, 'bear_strategy': 'mean_reversion', 'bear_bb_std_mult': 2.7523380504276966, 'bear_rsi_os': 21, 'bear_rsi_ob': 58, 'bear_adx_thresh': 22.45778034503882, 'bear_atr_min_pct': 0.007516265878636855, 'bear_atr_max_pct': 0.030643049642059345, 'bear_tp_mult': 1.011564579256482, 'bear_tsl_mult': 0.7760892131611705, 'bear_time_stop': 82, 'bear_use_sma': True, 'bear_use_ema': False, 'bear_use_atr': False, 'bear_use_adx': True, 'bear_use_spike': True, 'bear_rsi_required': True, 'sideways_strategy': 'mean_reversion', 'sideways_bb_std_mult': 1.2912422514492468, 'sideways_rsi_os': 47, 'sideways_rsi_ob': 87, 'sideways_adx_thresh': 9.221910186703656, 'sideways_atr_min_pct': 0.01532548459323219, 'sideways_atr_max_pct': 0.04150018565571003, 'sideways_tp_mult': 1.80890750437096, 'sideways_tsl_mult': 0.1985045279319928, 'sideways_time_stop': 158, 'sideways_use_sma': True, 'sideways_use_ema': True, 'sideways_use_atr': True, 'sideways_use_adx': False, 'sideways_use_spike': False, 'sideways_rsi_required': True}.
[I 2025-09-01 03:36:31,568] Trial 442 finished with values: [-0.016945478974501715, 0.016783549133341298] and parameters: {'p_sma': 46, 'p_std': 58, 'p_atr': 13, 'p_adx': 17, 'rsi_period': 7, 'ema1': 7, 'ema2': 57, 'slip_atr_k': 0.00835501448882868, 'slip_spread_k': 0.16366808149051532, 'spread_hl_frac': 0.027397910432979754, 'bb_std_mult': 2.3859018765242004, 'rsi_os': 22, 'rsi_ob': 84, 'vol_spike': 0.21653068503840747, 'adx_thresh': 11.279616188692012, 'atr_min_pct': 0.005065708570318921, 'atr_max_pct': 0.05114635184185747, 'tp_mult': 2.6464293807541583, 'tsl_mult': 0.4190301487419895, 'strategy': 'mean_reversion', 'time_stop': 291, 'use_sma': True, 'use_atr': True, 'use_adx': False, 'use_ema': True, 'use_spike': False, 'rsi_required': True, 'edge_k': 0.1803096932226287, 'edge_cap': 0.9415642724010227, 'bull_strategy': 'breakout', 'bull_bb_std_mult': 1.1166305852312142, 'bull_rsi_os': 17, 'bull_rsi_ob': 75, 'bull_adx_thresh': 26.054599496170752, 'bull_atr_min_pct': 0.0008529468612794182, 'bull_atr_max_pct': 0.1236055826719182, 'bull_tp_mult': 2.1417622523481876, 'bull_tsl_mult': 0.3133315574948112, 'bull_time_stop': 272, 'bull_use_sma': True, 'bull_use_ema': False, 'bull_use_atr': True, 'bull_use_adx': False, 'bull_use_spike': True, 'bull_rsi_required': False, 'bear_strategy': 'mean_reversion', 'bear_bb_std_mult': 2.7187732931502473, 'bear_rsi_os': 21, 'bear_rsi_ob': 64, 'bear_adx_thresh': 25.00489321593847, 'bear_atr_min_pct': 0.025362258846453913, 'bear_atr_max_pct': 0.02304021120863249, 'bear_tp_mult': 1.0464540202261432, 'bear_tsl_mult': 0.1300014530927417, 'bear_time_stop': 83, 'bear_use_sma': True, 'bear_use_ema': False, 'bear_use_atr': False, 'bear_use_adx': True, 'bear_use_spike': True, 'bear_rsi_required': True, 'sideways_strategy': 'mean_reversion', 'sideways_bb_std_mult': 0.7322229791575003, 'sideways_rsi_os': 48, 'sideways_rsi_ob': 69, 'sideways_adx_thresh': 29.075775445519184, 'sideways_atr_min_pct': 0.015311202034389272, 'sideways_atr_max_pct': 0.029488201898723143, 'sideways_tp_mult': 1.805288857389995, 'sideways_tsl_mult': 0.2030324021823973, 'sideways_time_stop': 271, 'sideways_use_sma': True, 'sideways_use_ema': True, 'sideways_use_atr': True, 'sideways_use_adx': False, 'sideways_use_spike': False, 'sideways_rsi_required': True}.
[I 2025-09-01 03:37:13,786] Trial 446 finished with values: [-1000000000.0, 1000000000.0] and parameters: {'p_sma': 7, 'p_std': 57, 'p_atr': 29, 'p_adx': 17, 'rsi_period': 7, 'ema1': 18, 'ema2': 29, 'slip_atr_k': 0.008961814711002313, 'slip_spread_k': 0.1276204631371433, 'spread_hl_frac': 0.02860747889177617, 'bb_std_mult': 1.4976153240227326, 'rsi_os': 22, 'rsi_ob': 84, 'vol_spike': 0.2138528827220616, 'adx_thresh': 11.37676571733383, 'atr_min_pct': 0.004552970532115447, 'atr_max_pct': 0.07059785419339677, 'tp_mult': 1.1935585811180278, 'tsl_mult': 0.5938212266978403, 'strategy': 'mean_reversion', 'time_stop': 154, 'use_sma': False, 'use_atr': False, 'use_adx': True, 'use_ema': False, 'use_spike': True, 'rsi_required': False, 'edge_k': 1.1000403063040676, 'edge_cap': 0.2972325843674227, 'bull_strategy': 'breakout', 'bull_bb_std_mult': 1.266356464561171, 'bull_rsi_os': 19, 'bull_rsi_ob': 84, 'bull_adx_thresh': 30.905752611466106, 'bull_atr_min_pct': 0.006813477263905727, 'bull_atr_max_pct': 0.12149645873352075, 'bull_tp_mult': 2.142093383736683, 'bull_tsl_mult': 0.9626242643532222, 'bull_time_stop': 296, 'bull_use_sma': True, 'bull_use_ema': True, 'bull_use_atr': False, 'bull_use_adx': False, 'bull_use_spike': True, 'bull_rsi_required': False, 'bear_strategy': 'breakout', 'bear_bb_std_mult': 0.9788729014699529, 'bear_rsi_os': 21, 'bear_rsi_ob': 60, 'bear_adx_thresh': 15.92737753853638, 'bear_atr_min_pct': 0.026944396113275013, 'bear_atr_max_pct': 0.02715751444642534, 'bear_tp_mult': 2.4860244991311236, 'bear_tsl_mult': 0.10800583670084912, 'bear_time_stop': 74, 'bear_use_sma': False, 'bear_use_ema': False, 'bear_use_atr': False, 'bear_use_adx': False, 'bear_use_spike': True, 'bear_rsi_required': True, 'sideways_strategy': 'breakout', 'sideways_bb_std_mult': 1.3039456362021737, 'sideways_rsi_os': 47, 'sideways_rsi_ob': 57, 'sideways_adx_thresh': 9.323298433247981, 'sideways_atr_min_pct': 0.026577544540965132, 'sideways_atr_max_pct': 0.027947486391308618, 'sideways_tp_mult': 2.048477821828529, 'sideways_tsl_mult': 0.42550022037397606, 'sideways_time_stop': 98, 'sideways_use_sma': True, 'sideways_use_ema': True, 'sideways_use_atr': True, 'sideways_use_adx': False, 'sideways_use_spike': True, 'sideways_rsi_required': True}.
[I 2025-09-01 03:37:14,328] Trial 448 finished with values: [-1000000000.0, 1000000000.0] and parameters: {'p_sma': 15, 'p_std': 57, 'p_atr': 29, 'p_adx': 16, 'rsi_period': 7, 'ema1': 21, 'ema2': 56, 'slip_atr_k': 0.21115111680368795, 'slip_spread_k': 0.12979739634153065, 'spread_hl_frac': 0.03013260769212553, 'bb_std_mult': 3.401319364052669, 'rsi_os': 22, 'rsi_ob': 83, 'vol_spike': 0.21403814358493567, 'adx_thresh': 11.793230107368569, 'atr_min_pct': 0.004866431369220575, 'atr_max_pct': 0.05189548130019857, 'tp_mult': 2.813131244929142, 'tsl_mult': 0.35172743663839257, 'strategy': 'mean_reversion', 'time_stop': 292, 'use_sma': False, 'use_atr': False, 'use_adx': True, 'use_ema': False, 'use_spike': True, 'rsi_required': False, 'edge_k': 0.18181948022568295, 'edge_cap': 0.12924241312058216, 'bull_strategy': 'breakout', 'bull_bb_std_mult': 1.818214225724657, 'bull_rsi_os': 19, 'bull_rsi_ob': 56, 'bull_adx_thresh': 30.941986377333315, 'bull_atr_min_pct': 0.01746258202407803, 'bull_atr_max_pct': 0.010668104096822714, 'bull_tp_mult': 1.6399799009331817, 'bull_tsl_mult': 0.7183918673695602, 'bull_time_stop': 218, 'bull_use_sma': True, 'bull_use_ema': True, 'bull_use_atr': False, 'bull_use_adx': False, 'bull_use_spike': True, 'bull_rsi_required': False, 'bear_strategy': 'breakout', 'bear_bb_std_mult': 3.4032055947040245, 'bear_rsi_os': 52, 'bear_rsi_ob': 60, 'bear_adx_thresh': 24.36519726841162, 'bear_atr_min_pct': 0.026960764918302647, 'bear_atr_max_pct': 0.02373184541559661, 'bear_tp_mult': 1.049208135113043, 'bear_tsl_mult': 0.09884897109828117, 'bear_time_stop': 60, 'bear_use_sma': False, 'bear_use_ema': False, 'bear_use_atr': False, 'bear_use_adx': False, 'bear_use_spike': True, 'bear_rsi_required': True, 'sideways_strategy': 'breakout', 'sideways_bb_std_mult': 1.843464485352908, 'sideways_rsi_os': 49, 'sideways_rsi_ob': 50, 'sideways_adx_thresh': 28.352644116867047, 'sideways_atr_min_pct': 0.00659367649751892, 'sideways_atr_max_pct': 0.08140413291328008, 'sideways_tp_mult': 1.7287799673716489, 'sideways_tsl_mult': 0.4161799818644325, 'sideways_time_stop': 98, 'sideways_use_sma': True, 'sideways_use_ema': True, 'sideways_use_atr': True, 'sideways_use_adx': False, 'sideways_use_spike': True, 'sideways_rsi_required': False}.
[I 2025-09-01 03:37:14,658] Trial 447 finished with values: [-1000000000.0, 1000000000.0] and parameters: {'p_sma': 43, 'p_std': 57, 'p_atr': 29, 'p_adx': 16, 'rsi_period': 55, 'ema1': 21, 'ema2': 29, 'slip_atr_k': 0.2066285422402432, 'slip_spread_k': 0.945355316024723, 'spread_hl_frac': 0.029107088681799263, 'bb_std_mult': 1.8162250714841826, 'rsi_os': 22, 'rsi_ob': 83, 'vol_spike': 0.21346168226762996, 'adx_thresh': 11.726867002699182, 'atr_min_pct': 0.027742848384049633, 'atr_max_pct': 0.05153498791712594, 'tp_mult': 2.7550765256086462, 'tsl_mult': 0.09409728352920643, 'strategy': 'mean_reversion', 'time_stop': 154, 'use_sma': False, 'use_atr': False, 'use_adx': True, 'use_ema': False, 'use_spike': True, 'rsi_required': False, 'edge_k': 0.18344503228699138, 'edge_cap': 0.13375387915295633, 'bull_strategy': 'breakout', 'bull_bb_std_mult': 1.2359492110189305, 'bull_rsi_os': 19, 'bull_rsi_ob': 48, 'bull_adx_thresh': 30.966307292523418, 'bull_atr_min_pct': 0.023382335277716042, 'bull_atr_max_pct': 0.12335152619531328, 'bull_tp_mult': 2.998392050896455, 'bull_tsl_mult': 0.22462053514331173, 'bull_time_stop': 295, 'bull_use_sma': True, 'bull_use_ema': True, 'bull_use_atr': False, 'bull_use_adx': False, 'bull_use_spike': True, 'bull_rsi_required': False, 'bear_strategy': 'breakout', 'bear_bb_std_mult': 1.1779873640748129, 'bear_rsi_os': 52, 'bear_rsi_ob': 56, 'bear_adx_thresh': 12.81795080375272, 'bear_atr_min_pct': 0.0038863576949034143, 'bear_atr_max_pct': 0.026883893688558584, 'bear_tp_mult': 2.4990458666507656, 'bear_tsl_mult': 0.9023446043636021, 'bear_time_stop': 74, 'bear_use_sma': False, 'bear_use_ema': False, 'bear_use_atr': False, 'bear_use_adx': False, 'bear_use_spike': True, 'bear_rsi_required': True, 'sideways_strategy': 'breakout', 'sideways_bb_std_mult': 1.8586282843316693, 'sideways_rsi_os': 48, 'sideways_rsi_ob': 73, 'sideways_adx_thresh': 28.491861398834537, 'sideways_atr_min_pct': 0.006315572616979397, 'sideways_atr_max_pct': 0.05802559588883811, 'sideways_tp_mult': 1.5965365992951124, 'sideways_tsl_mult': 0.2598798971900535, 'sideways_time_stop': 110, 'sideways_use_sma': True, 'sideways_use_ema': True, 'sideways_use_atr': True, 'sideways_use_adx': False, 'sideways_use_spike': True, 'sideways_rsi_required': False}.
[I 2025-09-01 03:37:14,893] Trial 445 finished with values: [-0.016364346263039953, 0.016366589355276642] and parameters: {'p_sma': 16, 'p_std': 57, 'p_atr': 13, 'p_adx': 17, 'rsi_period': 13, 'ema1': 18, 'ema2': 29, 'slip_atr_k': 0.009680625506711855, 'slip_spread_k': 0.5379186747989286, 'spread_hl_frac': 0.029012273409774345, 'bb_std_mult': 1.5161746332307426, 'rsi_os': 20, 'rsi_ob': 82, 'vol_spike': 0.08618868119167429, 'adx_thresh': 11.709650081796537, 'atr_min_pct': 0.007143192187060469, 'atr_max_pct': 0.05057496253801118, 'tp_mult': 1.9161085777494231, 'tsl_mult': 0.35466183943547835, 'strategy': 'mean_reversion', 'time_stop': 97, 'use_sma': True, 'use_atr': False, 'use_adx': False, 'use_ema': False, 'use_spike': True, 'rsi_required': False, 'edge_k': 0.07526266214385131, 'edge_cap': 0.4246517961225744, 'bull_strategy': 'breakout', 'bull_bb_std_mult': 1.2344780044304298, 'bull_rsi_os': 21, 'bull_rsi_ob': 49, 'bull_adx_thresh': 5.604546871522453, 'bull_atr_min_pct': 0.000847945566847195, 'bull_atr_max_pct': 0.12377821139030791, 'bull_tp_mult': 2.9943743574524175, 'bull_tsl_mult': 0.4324160751707356, 'bull_time_stop': 183, 'bull_use_sma': True, 'bull_use_ema': False, 'bull_use_atr': False, 'bull_use_adx': False, 'bull_use_spike': True, 'bull_rsi_required': False, 'bear_strategy': 'breakout', 'bear_bb_std_mult': 2.6997941000447727, 'bear_rsi_os': 14, 'bear_rsi_ob': 60, 'bear_adx_thresh': 27.914271888372642, 'bear_atr_min_pct': 0.006271616335159097, 'bear_atr_max_pct': 0.030860535379729014, 'bear_tp_mult': 1.3958332926429575, 'bear_tsl_mult': 0.7806452155048045, 'bear_time_stop': 72, 'bear_use_sma': False, 'bear_use_ema': False, 'bear_use_atr': False, 'bear_use_adx': True, 'bear_use_spike': True, 'bear_rsi_required': True, 'sideways_strategy': 'breakout', 'sideways_bb_std_mult': 1.0170579117738112, 'sideways_rsi_os': 47, 'sideways_rsi_ob': 69, 'sideways_adx_thresh': 9.059648961313892, 'sideways_atr_min_pct': 0.006476220600503979, 'sideways_atr_max_pct': 0.02955159552468465, 'sideways_tp_mult': 2.3142114738371355, 'sideways_tsl_mult': 0.981577550304281, 'sideways_time_stop': 98, 'sideways_use_sma': True, 'sideways_use_ema': True, 'sideways_use_atr': True, 'sideways_use_adx': False, 'sideways_use_spike': True, 'sideways_rsi_required': True}.
[I 2025-09-01 03:37:57,004] Trial 451 finished with values: [-0.025048637915556227, 0.024906522659039546] and parameters: {'p_sma': 56, 'p_std': 59, 'p_atr': 28, 'p_adx': 18, 'rsi_period': 11, 'ema1': 22, 'ema2': 43, 'slip_atr_k': 0.025045013761285883, 'slip_spread_k': 0.04856907784058584, 'spread_hl_frac': 0.04260206180356475, 'bb_std_mult': 0.6333762415666344, 'rsi_os': 19, 'rsi_ob': 86, 'vol_spike': 0.22077574146721374, 'adx_thresh': 10.981237131458169, 'atr_min_pct': 0.005952596715283589, 'atr_max_pct': 0.05645376471724746, 'tp_mult': 2.592046197516319, 'tsl_mult': 0.3613174724425028, 'strategy': 'breakout', 'time_stop': 168, 'use_sma': False, 'use_atr': False, 'use_adx': True, 'use_ema': True, 'use_spike': True, 'rsi_required': False, 'edge_k': 1.262809949543242, 'edge_cap': 0.4863065085084134, 'bull_strategy': 'mean_reversion', 'bull_bb_std_mult': 1.183121123744519, 'bull_rsi_os': 21, 'bull_rsi_ob': 53, 'bull_adx_thresh': 26.37087094896423, 'bull_atr_min_pct': 0.0006548592313269047, 'bull_atr_max_pct': 0.038278848869352476, 'bull_tp_mult': 1.287838659600305, 'bull_tsl_mult': 0.0019214758696768364, 'bull_time_stop': 267, 'bull_use_sma': True, 'bull_use_ema': False, 'bull_use_atr': False, 'bull_use_adx': False, 'bull_use_spike': True, 'bull_rsi_required': True, 'bear_strategy': 'breakout', 'bear_bb_std_mult': 2.0998068164109216, 'bear_rsi_os': 54, 'bear_rsi_ob': 59, 'bear_adx_thresh': 30.260802817446606, 'bear_atr_min_pct': 0.028269520261292407, 'bear_atr_max_pct': 0.023132117589550402, 'bear_tp_mult': 2.060201328717003, 'bear_tsl_mult': 0.17465085527012794, 'bear_time_stop': 117, 'bear_use_sma': False, 'bear_use_ema': False, 'bear_use_atr': True, 'bear_use_adx': False, 'bear_use_spike': True, 'bear_rsi_required': True, 'sideways_strategy': 'breakout', 'sideways_bb_std_mult': 2.6334145742512556, 'sideways_rsi_os': 47, 'sideways_rsi_ob': 75, 'sideways_adx_thresh': 29.89246563997829, 'sideways_atr_min_pct': 0.026986915847800136, 'sideways_atr_max_pct': 0.024655106879118732, 'sideways_tp_mult': 1.6871472984295157, 'sideways_tsl_mult': 0.21484964984564545, 'sideways_time_stop': 146, 'sideways_use_sma': False, 'sideways_use_ema': False, 'sideways_use_atr': False, 'sideways_use_adx': False, 'sideways_use_spike': True, 'sideways_rsi_required': True}.
