[I 2025-09-01 02:33:59,000] Trial 72 finished with values: [-1000000000.0, 1000000000.0] and parameters: {'p_sma': 21, 'p_std': 57, 'p_atr': 13, 'p_adx': 13, 'rsi_period': 57, 'ema1': 13, 'ema2': 52, 'slip_atr_k': 0.17046901184007884, 'slip_spread_k': 0.06648174080327557, 'spread_hl_frac': 0.0032197262921130343, 'bb_std_mult': 1.7436913214915681, 'rsi_os': 55, 'rsi_ob': 62, 'vol_spike': 0.28020668949361277, 'adx_thresh': 18.006585670143327, 'atr_min_pct': 0.026861429428094975, 'atr_max_pct': 0.08354944796974992, 'tp_mult': 2.096327290349424, 'tsl_mult': 0.7159404822719371, 'strategy': 'breakout', 'time_stop': 245, 'use_sma': False, 'use_atr': False, 'use_adx': False, 'use_ema': False, 'use_spike': True, 'rsi_required': False, 'edge_k': 0.7380724323370169, 'edge_cap': 0.38238923922166435, 'bull_strategy': 'mean_reversion', 'bull_bb_std_mult': 0.5352343051500525, 'bull_rsi_os': 40, 'bull_rsi_ob': 63, 'bull_adx_thresh': 27.110345670470085, 'bull_atr_min_pct': 0.0030244851066146645, 'bull_atr_max_pct': 0.12947343155000518, 'bull_tp_mult': 2.8708597981534107, 'bull_tsl_mult': 0.23058778348891956, 'bull_time_stop': 38, 'bull_use_sma': False, 'bull_use_ema': False, 'bull_use_atr': False, 'bull_use_adx': False, 'bull_use_spike': True, 'bull_rsi_required': True, 'bear_strategy': 'breakout', 'bear_bb_std_mult': 1.533122054698984, 'bear_rsi_os': 7, 'bear_rsi_ob': 94, 'bear_adx_thresh': 12.809301562378362, 'bear_atr_min_pct': 0.009639355786261796, 'bear_atr_max_pct': 0.05749437791741365, 'bear_tp_mult': 2.0838918595782188, 'bear_tsl_mult': 0.2484427081157612, 'bear_time_stop': 126, 'bear_use_sma': False, 'bear_use_ema': True, 'bear_use_atr': False, 'bear_use_adx': True, 'bear_use_spike': True, 'bear_rsi_required': False, 'sideways_strategy': 'breakout', 'sideways_bb_std_mult': 3.21068540488608, 'sideways_rsi_os': 13, 'sideways_rsi_ob': 52, 'sideways_adx_thresh': 19.824834224445322, 'sideways_atr_min_pct': 0.02166680257527042, 'sideways_atr_max_pct': 0.09178045963626263, 'sideways_tp_mult': 1.0677610963046191, 'sideways_tsl_mult': 0.47794517202908643, 'sideways_time_stop': 161, 'sideways_use_sma': False, 'sideways_use_ema': True, 'sideways_use_atr': True, 'sideways_use_adx': True, 'sideways_use_spike': True, 'sideways_rsi_required': False}.
[I 2025-09-01 02:33:59,433] Trial 73 finished with values: [-1000000000.0, 1000000000.0] and parameters: {'p_sma': 13, 'p_std': 42, 'p_atr': 12, 'p_adx': 13, 'rsi_period': 57, 'ema1': 13, 'ema2': 52, 'slip_atr_k': 0.1069175112039478, 'slip_spread_k': 0.003923657470645603, 'spread_hl_frac': 0.002723993728005761, 'bb_std_mult': 1.2905233854811315, 'rsi_os': 55, 'rsi_ob': 60, 'vol_spike': 0.19187117060588846, 'adx_thresh': 32.28619499419661, 'atr_min_pct': 0.0069667646194265945, 'atr_max_pct': 0.084676041137812, 'tp_mult': 2.1027502849298263, 'tsl_mult': 0.9957737225353503, 'strategy': 'breakout', 'time_stop': 95, 'use_sma': True, 'use_atr': False, 'use_adx': False, 'use_ema': False, 'use_spike': True, 'rsi_required': False, 'edge_k': 0.7173087015167459, 'edge_cap': 0.3065013247522248, 'bull_strategy': 'mean_reversion', 'bull_bb_std_mult': 1.6762868699416702, 'bull_rsi_os': 48, 'bull_rsi_ob': 92, 'bull_adx_thresh': 26.58480958850978, 'bull_atr_min_pct': 0.003370136686463635, 'bull_atr_max_pct': 0.12829872880617393, 'bull_tp_mult': 1.7701444209556834, 'bull_tsl_mult': 0.5189214425188056, 'bull_time_stop': 38, 'bull_use_sma': False, 'bull_use_ema': False, 'bull_use_atr': False, 'bull_use_adx': False, 'bull_use_spike': True, 'bull_rsi_required': True, 'bear_strategy': 'breakout', 'bear_bb_std_mult': 1.1230690194098847, 'bear_rsi_os': 9, 'bear_rsi_ob': 90, 'bear_adx_thresh': 8.194779208587478, 'bear_atr_min_pct': 0.02672547738405672, 'bear_atr_max_pct': 0.039871023420409185, 'bear_tp_mult': 2.873826668318632, 'bear_tsl_mult': 0.6922022207511973, 'bear_time_stop': 104, 'bear_use_sma': False, 'bear_use_ema': True, 'bear_use_atr': False, 'bear_use_adx': True, 'bear_use_spike': True, 'bear_rsi_required': False, 'sideways_strategy': 'breakout', 'sideways_bb_std_mult': 2.097485397261005, 'sideways_rsi_os': 13, 'sideways_rsi_ob': 67, 'sideways_adx_thresh': 20.5761864826259, 'sideways_atr_min_pct': 0.02203021828833101, 'sideways_atr_max_pct': 0.09118557360377809, 'sideways_tp_mult': 1.1951419019325715, 'sideways_tsl_mult': 0.9112004080407134, 'sideways_time_stop': 89, 'sideways_use_sma': False, 'sideways_use_ema': True, 'sideways_use_atr': True, 'sideways_use_adx': True, 'sideways_use_spike': True, 'sideways_rsi_required': False}.
[I 2025-09-01 02:33:59,958] Trial 75 finished with values: [-1000000000.0, 1000000000.0] and parameters: {'p_sma': 18, 'p_std': 23, 'p_atr': 13, 'p_adx': 13, 'rsi_period': 50, 'ema1': 9, 'ema2': 52, 'slip_atr_k': 0.14168209556657227, 'slip_spread_k': 0.1630451987925664, 'spread_hl_frac': 0.015843108578968625, 'bb_std_mult': 1.2580672935843944, 'rsi_os': 22, 'rsi_ob': 73, 'vol_spike': 0.11467089074625897, 'adx_thresh': 7.618693047390657, 'atr_min_pct': 0.010404113110559816, 'atr_max_pct': 0.08378048788461864, 'tp_mult': 2.122629445710126, 'tsl_mult': 0.4187665371258207, 'strategy': 'breakout', 'time_stop': 261, 'use_sma': True, 'use_atr': False, 'use_adx': False, 'use_ema': False, 'use_spike': True, 'rsi_required': False, 'edge_k': 0.3981875172860286, 'edge_cap': 0.1549490907414204, 'bull_strategy': 'mean_reversion', 'bull_bb_std_mult': 1.6237166886714434, 'bull_rsi_os': 18, 'bull_rsi_ob': 63, 'bull_adx_thresh': 27.225146698597317, 'bull_atr_min_pct': 0.0031845183563584374, 'bull_atr_max_pct': 0.13273726066161, 'bull_tp_mult': 1.5182330663081454, 'bull_tsl_mult': 0.512642868167802, 'bull_time_stop': 80, 'bull_use_sma': False, 'bull_use_ema': False, 'bull_use_atr': False, 'bull_use_adx': False, 'bull_use_spike': True, 'bull_rsi_required': True, 'bear_strategy': 'breakout', 'bear_bb_std_mult': 1.9415719274145642, 'bear_rsi_os': 9, 'bear_rsi_ob': 86, 'bear_adx_thresh': 23.61445905845601, 'bear_atr_min_pct': 0.010858367233446058, 'bear_atr_max_pct': 0.0490092515391767, 'bear_tp_mult': 1.9464388328823592, 'bear_tsl_mult': 0.9688825651014102, 'bear_time_stop': 53, 'bear_use_sma': False, 'bear_use_ema': True, 'bear_use_atr': False, 'bear_use_adx': True, 'bear_use_spike': True, 'bear_rsi_required': False, 'sideways_strategy': 'breakout', 'sideways_bb_std_mult': 1.87674875588931, 'sideways_rsi_os': 13, 'sideways_rsi_ob': 65, 'sideways_adx_thresh': 8.543569932563633, 'sideways_atr_min_pct': 0.0034758006668272508, 'sideways_atr_max_pct': 0.09256610986927283, 'sideways_tp_mult': 2.0563689178672253, 'sideways_tsl_mult': 0.9011014751067825, 'sideways_time_stop': 141, 'sideways_use_sma': False, 'sideways_use_ema': True, 'sideways_use_atr': True, 'sideways_use_adx': True, 'sideways_use_spike': True, 'sideways_rsi_required': False}.
[I 2025-09-01 02:34:00,823] Trial 74 finished with values: [-0.02935310245336864, 0.029203107746093516] and parameters: {'p_sma': 18, 'p_std': 23, 'p_atr': 12, 'p_adx': 13, 'rsi_period': 50, 'ema1': 10, 'ema2': 56, 'slip_atr_k': 0.14167988302207032, 'slip_spread_k': 0.007843097250284647, 'spread_hl_frac': 0.015980061895759505, 'bb_std_mult': 1.6859538173807203, 'rsi_os': 23, 'rsi_ob': 59, 'vol_spike': 0.19055363330208025, 'adx_thresh': 23.59047884111035, 'atr_min_pct': 0.007111578370876073, 'atr_max_pct': 0.08566781634033081, 'tp_mult': 2.107639009045884, 'tsl_mult': 0.007642812707248259, 'strategy': 'breakout', 'time_stop': 61, 'use_sma': True, 'use_atr': False, 'use_adx': False, 'use_ema': False, 'use_spike': True, 'rsi_required': False, 'edge_k': 1.0757789491649958, 'edge_cap': 0.3150003414462247, 'bull_strategy': 'mean_reversion', 'bull_bb_std_mult': 1.6287174629648544, 'bull_rsi_os': 17, 'bull_rsi_ob': 63, 'bull_adx_thresh': 27.087233489958248, 'bull_atr_min_pct': 0.0011658643143632515, 'bull_atr_max_pct': 0.13221871179608674, 'bull_tp_mult': 1.7746986432026892, 'bull_tsl_mult': 0.4976969305193104, 'bull_time_stop': 75, 'bull_use_sma': False, 'bull_use_ema': False, 'bull_use_atr': False, 'bull_use_adx': False, 'bull_use_spike': True, 'bull_rsi_required': True, 'bear_strategy': 'breakout', 'bear_bb_std_mult': 1.0956530408694891, 'bear_rsi_os': 7, 'bear_rsi_ob': 90, 'bear_adx_thresh': 29.33990763471902, 'bear_atr_min_pct': 0.012786432235990347, 'bear_atr_max_pct': 0.04771845799281522, 'bear_tp_mult': 1.8927808293228034, 'bear_tsl_mult': 0.21957928605663396, 'bear_time_stop': 127, 'bear_use_sma': False, 'bear_use_ema': True, 'bear_use_atr': False, 'bear_use_adx': True, 'bear_use_spike': True, 'bear_rsi_required': False, 'sideways_strategy': 'breakout', 'sideways_bb_std_mult': 3.4152758953290325, 'sideways_rsi_os': 13, 'sideways_rsi_ob': 65, 'sideways_adx_thresh': 28.163531992742463, 'sideways_atr_min_pct': 0.016713716006806167, 'sideways_atr_max_pct': 0.0796319932841878, 'sideways_tp_mult': 2.0833403925294314, 'sideways_tsl_mult': 0.23263794775236357, 'sideways_time_stop': 42, 'sideways_use_sma': False, 'sideways_use_ema': True, 'sideways_use_atr': True, 'sideways_use_adx': True, 'sideways_use_spike': True, 'sideways_rsi_required': False}.
[I 2025-09-01 02:34:01,357] Trial 76 finished with values: [-1000000000.0, 1000000000.0] and parameters: {'p_sma': 18, 'p_std': 23, 'p_atr': 24, 'p_adx': 13, 'rsi_period': 49, 'ema1': 9, 'ema2': 38, 'slip_atr_k': 0.1419390987113148, 'slip_spread_k': 0.44568913196088344, 'spread_hl_frac': 0.015912953143605524, 'bb_std_mult': 1.258241192162389, 'rsi_os': 23, 'rsi_ob': 73, 'vol_spike': 0.19117368716792482, 'adx_thresh': 23.171126059737862, 'atr_min_pct': 0.021939950511368066, 'atr_max_pct': 0.010587499695758312, 'tp_mult': 2.147968823961461, 'tsl_mult': 0.5628356093689919, 'strategy': 'breakout', 'time_stop': 259, 'use_sma': True, 'use_atr': True, 'use_adx': False, 'use_ema': False, 'use_spike': True, 'rsi_required': False, 'edge_k': 0.3823049318513361, 'edge_cap': 0.16780827456428257, 'bull_strategy': 'mean_reversion', 'bull_bb_std_mult': 2.3015446970575963, 'bull_rsi_os': 18, 'bull_rsi_ob': 91, 'bull_adx_thresh': 30.10518650163716, 'bull_atr_min_pct': 0.0011805904905278347, 'bull_atr_max_pct': 0.1471882462955342, 'bull_tp_mult': 1.5516319816166113, 'bull_tsl_mult': 0.5154286008716542, 'bull_time_stop': 79, 'bull_use_sma': False, 'bull_use_ema': False, 'bull_use_atr': False, 'bull_use_adx': False, 'bull_use_spike': True, 'bull_rsi_required': True, 'bear_strategy': 'mean_reversion', 'bear_bb_std_mult': 2.847313086840964, 'bear_rsi_os': 9, 'bear_rsi_ob': 90, 'bear_adx_thresh': 23.907171119587723, 'bear_atr_min_pct': 0.012086424679218756, 'bear_atr_max_pct': 0.047690328159571006, 'bear_tp_mult': 2.81222453247651, 'bear_tsl_mult': 0.9691088576631324, 'bear_time_stop': 48, 'bear_use_sma': False, 'bear_use_ema': False, 'bear_use_atr': False, 'bear_use_adx': True, 'bear_use_spike': True, 'bear_rsi_required': True, 'sideways_strategy': 'breakout', 'sideways_bb_std_mult': 3.385830764899925, 'sideways_rsi_os': 17, 'sideways_rsi_ob': 64, 'sideways_adx_thresh': 28.302980354346406, 'sideways_atr_min_pct': 0.002184392589734796, 'sideways_atr_max_pct': 0.10347788806492439, 'sideways_tp_mult': 1.2084008739356409, 'sideways_tsl_mult': 0.8963904874417551, 'sideways_time_stop': 140, 'sideways_use_sma': False, 'sideways_use_ema': True, 'sideways_use_atr': True, 'sideways_use_adx': True, 'sideways_use_spike': True, 'sideways_rsi_required': False}.
[I 2025-09-01 02:34:46,583] Trial 78 finished with values: [-0.035442537918853434, 0.035477967552416424] and parameters: {'p_sma': 39, 'p_std': 30, 'p_atr': 24, 'p_adx': 19, 'rsi_period': 22, 'ema1': 6, 'ema2': 59, 'slip_atr_k': 0.22578756609060255, 'slip_spread_k': 0.4492504594277371, 'spread_hl_frac': 0.02891480981215159, 'bb_std_mult': 1.4562368261260277, 'rsi_os': 7, 'rsi_ob': 53, 'vol_spike': 0.15599224594278258, 'adx_thresh': 23.911854875408913, 'atr_min_pct': 0.011919463683636491, 'atr_max_pct': 0.09447912888987152, 'tp_mult': 2.8240327943348227, 'tsl_mult': 0.560059322911296, 'strategy': 'mean_reversion', 'time_stop': 67, 'use_sma': False, 'use_atr': True, 'use_adx': False, 'use_ema': False, 'use_spike': True, 'rsi_required': False, 'edge_k': 1.7856771682864834, 'edge_cap': 0.2283300402415885, 'bull_strategy': 'mean_reversion', 'bull_bb_std_mult': 2.364077183037549, 'bull_rsi_os': 15, 'bull_rsi_ob': 58, 'bull_adx_thresh': 29.458740931463872, 'bull_atr_min_pct': 0.0009753315705801117, 'bull_atr_max_pct': 0.14722216714010755, 'bull_tp_mult': 1.5812563506276243, 'bull_tsl_mult': 0.484041959452801, 'bull_time_stop': 98, 'bull_use_sma': False, 'bull_use_ema': False, 'bull_use_atr': False, 'bull_use_adx': False, 'bull_use_spike': True, 'bull_rsi_required': False, 'bear_strategy': 'mean_reversion', 'bear_bb_std_mult': 2.257108258519574, 'bear_rsi_os': 14, 'bear_rsi_ob': 68, 'bear_adx_thresh': 29.577705039059573, 'bear_atr_min_pct': 0.012395401927813405, 'bear_atr_max_pct': 0.12947140236292937, 'bear_tp_mult': 2.364139621570982, 'bear_tsl_mult': 0.18353653788681934, 'bear_time_stop': 224, 'bear_use_sma': False, 'bear_use_ema': False, 'bear_use_atr': False, 'bear_use_adx': True, 'bear_use_spike': True, 'bear_rsi_required': True, 'sideways_strategy': 'mean_reversion', 'sideways_bb_std_mult': 3.0975788929169767, 'sideways_rsi_os': 17, 'sideways_rsi_ob': 70, 'sideways_adx_thresh': 28.19546725427123, 'sideways_atr_min_pct': 0.01662982562297004, 'sideways_atr_max_pct': 0.07790767270956056, 'sideways_tp_mult': 1.4308060392773065, 'sideways_tsl_mult': 0.12405328274589522, 'sideways_time_stop': 113, 'sideways_use_sma': True, 'sideways_use_ema': True, 'sideways_use_atr': True, 'sideways_use_adx': True, 'sideways_use_spike': True, 'sideways_rsi_required': False}.
[I 2025-09-01 02:34:47,990] Trial 80 finished with values: [-1000000000.0, 1000000000.0] and parameters: {'p_sma': 37, 'p_std': 46, 'p_atr': 22, 'p_adx': 11, 'rsi_period': 55, 'ema1': 28, 'ema2': 56, 'slip_atr_k': 0.10289741447254869, 'slip_spread_k': 0.2683622034757626, 'spread_hl_frac': 0.006203925184182408, 'bb_std_mult': 1.5697077223912095, 'rsi_os': 7, 'rsi_ob': 54, 'vol_spike': 0.0009964918244761423, 'adx_thresh': 24.00922799364783, 'atr_min_pct': 0.012076086686052982, 'atr_max_pct': 0.10449467103540637, 'tp_mult': 2.7964554587992603, 'tsl_mult': 0.6666083685273965, 'strategy': 'mean_reversion', 'time_stop': 66, 'use_sma': False, 'use_atr': True, 'use_adx': False, 'use_ema': True, 'use_spike': True, 'rsi_required': False, 'edge_k': 0.011270595105888348, 'edge_cap': 0.22962373536262598, 'bull_strategy': 'mean_reversion', 'bull_bb_std_mult': 1.4674604427083295, 'bull_rsi_os': 15, 'bull_rsi_ob': 49, 'bull_adx_thresh': 31.314444343792967, 'bull_atr_min_pct': 0.02002773806044375, 'bull_atr_max_pct': 0.1364792549706822, 'bull_tp_mult': 2.065341633805648, 'bull_tsl_mult': 0.29065928944011143, 'bull_time_stop': 94, 'bull_use_sma': False, 'bull_use_ema': False, 'bull_use_atr': False, 'bull_use_adx': False, 'bull_use_spike': True, 'bull_rsi_required': False, 'bear_strategy': 'mean_reversion', 'bear_bb_std_mult': 2.2714996126474585, 'bear_rsi_os': 6, 'bear_rsi_ob': 69, 'bear_adx_thresh': 14.882233412343524, 'bear_atr_min_pct': 0.012497880481639675, 'bear_atr_max_pct': 0.03164127147133263, 'bear_tp_mult': 2.35918355866516, 'bear_tsl_mult': 0.6078339448374479, 'bear_time_stop': 81, 'bear_use_sma': False, 'bear_use_ema': False, 'bear_use_atr': False, 'bear_use_adx': True, 'bear_use_spike': True, 'bear_rsi_required': True, 'sideways_strategy': 'mean_reversion', 'sideways_bb_std_mult': 3.059890526936078, 'sideways_rsi_os': 20, 'sideways_rsi_ob': 61, 'sideways_adx_thresh': 28.153487164124666, 'sideways_atr_min_pct': 0.014872077966616375, 'sideways_atr_max_pct': 0.07879931081170499, 'sideways_tp_mult': 1.4607517572744277, 'sideways_tsl_mult': 0.2297989829668345, 'sideways_time_stop': 42, 'sideways_use_sma': True, 'sideways_use_ema': True, 'sideways_use_atr': True, 'sideways_use_adx': True, 'sideways_use_spike': True, 'sideways_rsi_required': False}.
[I 2025-09-01 02:34:49,249] Trial 79 finished with values: [-0.05028388064361966, 0.05008840567997974] and parameters: {'p_sma': 39, 'p_std': 30, 'p_atr': 22, 'p_adx': 11, 'rsi_period': 69, 'ema1': 6, 'ema2': 56, 'slip_atr_k': 0.2361475421394205, 'slip_spread_k': 0.4523338128422415, 'spread_hl_frac': 0.006105700368231517, 'bb_std_mult': 1.5950288404544324, 'rsi_os': 7, 'rsi_ob': 67, 'vol_spike': 0.29808489262153015, 'adx_thresh': 23.54856363242578, 'atr_min_pct': 0.011786316781318418, 'atr_max_pct': 0.04548347230691756, 'tp_mult': 1.1469795276557968, 'tsl_mult': 0.5587297242510721, 'strategy': 'mean_reversion', 'time_stop': 62, 'use_sma': False, 'use_atr': True, 'use_adx': False, 'use_ema': False, 'use_spike': True, 'rsi_required': False, 'edge_k': 0.03259970401842227, 'edge_cap': 0.22520112798540354, 'bull_strategy': 'mean_reversion', 'bull_bb_std_mult': 2.3021149219078647, 'bull_rsi_os': 15, 'bull_rsi_ob': 54, 'bull_adx_thresh': 30.452987577351024, 'bull_atr_min_pct': 0.000930615006549073, 'bull_atr_max_pct': 0.1464615463778276, 'bull_tp_mult': 2.5325272773772274, 'bull_tsl_mult': 0.48850058466969054, 'bull_time_stop': 55, 'bull_use_sma': False, 'bull_use_ema': False, 'bull_use_atr': False, 'bull_use_adx': False, 'bull_use_spike': True, 'bull_rsi_required': False, 'bear_strategy': 'mean_reversion', 'bear_bb_std_mult': 2.105839258813409, 'bear_rsi_os': 6, 'bear_rsi_ob': 68, 'bear_adx_thresh': 11.478976350969447, 'bear_atr_min_pct': 0.012716471042755868, 'bear_atr_max_pct': 0.12825679501987527, 'bear_tp_mult': 2.371678229449629, 'bear_tsl_mult': 0.9478702994111325, 'bear_time_stop': 82, 'bear_use_sma': False, 'bear_use_ema': False, 'bear_use_atr': False, 'bear_use_adx': True, 'bear_use_spike': True, 'bear_rsi_required': True, 'sideways_strategy': 'mean_reversion', 'sideways_bb_std_mult': 3.0979064816533173, 'sideways_rsi_os': 17, 'sideways_rsi_ob': 61, 'sideways_adx_thresh': 28.39629019073897, 'sideways_atr_min_pct': 0.016550047605496273, 'sideways_atr_max_pct': 0.07892166397396264, 'sideways_tp_mult': 1.2186413677209467, 'sideways_tsl_mult': 0.1647820325654219, 'sideways_time_stop': 42, 'sideways_use_sma': True, 'sideways_use_ema': True, 'sideways_use_atr': True, 'sideways_use_adx': True, 'sideways_use_spike': True, 'sideways_rsi_required': False}.
[I 2025-09-01 02:34:49,673] Trial 77 finished with values: [-0.022676333865135123, 0.022550140185409684] and parameters: {'p_sma': 39, 'p_std': 48, 'p_atr': 24, 'p_adx': 11, 'rsi_period': 49, 'ema1': 6, 'ema2': 56, 'slip_atr_k': 0.14280892489536964, 'slip_spread_k': 0.15346107989191105, 'spread_hl_frac': 0.015948886996050078, 'bb_std_mult': 1.4687612395720202, 'rsi_os': 7, 'rsi_ob': 73, 'vol_spike': 0.15491096985157876, 'adx_thresh': 23.529505473469783, 'atr_min_pct': 0.010005428317708, 'atr_max_pct': 0.09439254144716912, 'tp_mult': 2.8330573331969977, 'tsl_mult': 0.5702567305519648, 'strategy': 'mean_reversion', 'time_stop': 261, 'use_sma': True, 'use_atr': True, 'use_adx': False, 'use_ema': False, 'use_spike': True, 'rsi_required': False, 'edge_k': 0.3755269267214459, 'edge_cap': 0.15723204495793314, 'bull_strategy': 'mean_reversion', 'bull_bb_std_mult': 1.507879303465819, 'bull_rsi_os': 18, 'bull_rsi_ob': 65, 'bull_adx_thresh': 29.81581886696106, 'bull_atr_min_pct': 0.0014728331911764239, 'bull_atr_max_pct': 0.1463074551660254, 'bull_tp_mult': 1.538424695363361, 'bull_tsl_mult': 0.4975060763092736, 'bull_time_stop': 77, 'bull_use_sma': False, 'bull_use_ema': False, 'bull_use_atr': False, 'bull_use_adx': False, 'bull_use_spike': True, 'bull_rsi_required': False, 'bear_strategy': 'mean_reversion', 'bear_bb_std_mult': 0.7167934178230744, 'bear_rsi_os': 5, 'bear_rsi_ob': 91, 'bear_adx_thresh': 29.30788809053772, 'bear_atr_min_pct': 0.012228701965034885, 'bear_atr_max_pct': 0.047005282473848525, 'bear_tp_mult': 1.900005097264522, 'bear_tsl_mult': 0.9649458095900119, 'bear_time_stop': 54, 'bear_use_sma': False, 'bear_use_ema': False, 'bear_use_atr': False, 'bear_use_adx': True, 'bear_use_spike': True, 'bear_rsi_required': True, 'sideways_strategy': 'breakout', 'sideways_bb_std_mult': 2.7579264838711595, 'sideways_rsi_os': 17, 'sideways_rsi_ob': 65, 'sideways_adx_thresh': 32.02869679687092, 'sideways_atr_min_pct': 0.001982867684723893, 'sideways_atr_max_pct': 0.07956770887386039, 'sideways_tp_mult': 1.2241946099775376, 'sideways_tsl_mult': 0.8837159960682979, 'sideways_time_stop': 43, 'sideways_use_sma': True, 'sideways_use_ema': True, 'sideways_use_atr': True, 'sideways_use_adx': True, 'sideways_use_spike': True, 'sideways_rsi_required': False}.
