[I 2025-09-01 03:23:30,383] Trial 372 finished with values: [-1000000000.0, 1000000000.0] and parameters: {'p_sma': 24, 'p_std': 51, 'p_atr': 12, 'p_adx': 20, 'rsi_period': 10, 'ema1': 22, 'ema2': 57, 'slip_atr_k': 0.04035976020017129, 'slip_spread_k': 0.10550703223492236, 'spread_hl_frac': 0.023269668753019602, 'bb_std_mult': 1.4231621450342886, 'rsi_os': 24, 'rsi_ob': 89, 'vol_spike': 0.2874767723116888, 'adx_thresh': 16.68559838377691, 'atr_min_pct': 0.018012933443570005, 'atr_max_pct': 0.08827641999203381, 'tp_mult': 2.711900116921335, 'tsl_mult': 0.44504925580343113, 'strategy': 'mean_reversion', 'time_stop': 210, 'use_sma': False, 'use_atr': False, 'use_adx': True, 'use_ema': False, 'use_spike': True, 'rsi_required': False, 'edge_k': 0.03829145369080799, 'edge_cap': 0.8921467374433067, 'bull_strategy': 'mean_reversion', 'bull_bb_std_mult': 1.1549824631844767, 'bull_rsi_os': 24, 'bull_rsi_ob': 51, 'bull_adx_thresh': 23.297514020196555, 'bull_atr_min_pct': 0.0008968238112741934, 'bull_atr_max_pct': 0.11806512070576831, 'bull_tp_mult': 1.6229209714815651, 'bull_tsl_mult': 0.3643108963225238, 'bull_time_stop': 92, 'bull_use_sma': True, 'bull_use_ema': True, 'bull_use_atr': False, 'bull_use_adx': False, 'bull_use_spike': True, 'bull_rsi_required': False, 'bear_strategy': 'mean_reversion', 'bear_bb_std_mult': 0.9081398600713615, 'bear_rsi_os': 53, 'bear_rsi_ob': 62, 'bear_adx_thresh': 24.93302784562513, 'bear_atr_min_pct': 0.026829413473944873, 'bear_atr_max_pct': 0.08372504059444319, 'bear_tp_mult': 2.8506903641570775, 'bear_tsl_mult': 0.10774380937296102, 'bear_time_stop': 292, 'bear_use_sma': True, 'bear_use_ema': False, 'bear_use_atr': False, 'bear_use_adx': False, 'bear_use_spike': True, 'bear_rsi_required': True, 'sideways_strategy': 'breakout', 'sideways_bb_std_mult': 1.262050298389385, 'sideways_rsi_os': 45, 'sideways_rsi_ob': 80, 'sideways_adx_thresh': 28.858567388745215, 'sideways_atr_min_pct': 0.02862457145986455, 'sideways_atr_max_pct': 0.05016389207957703, 'sideways_tp_mult': 1.869695701839419, 'sideways_tsl_mult': 0.18055117102910986, 'sideways_time_stop': 121, 'sideways_use_sma': True, 'sideways_use_ema': True, 'sideways_use_atr': False, 'sideways_use_adx': False, 'sideways_use_spike': True, 'sideways_rsi_required': False}.
[I 2025-09-01 03:23:30,845] Trial 370 finished with values: [-1000000000.0, 1000000000.0] and parameters: {'p_sma': 33, 'p_std': 51, 'p_atr': 28, 'p_adx': 20, 'rsi_period': 10, 'ema1': 26, 'ema2': 45, 'slip_atr_k': 0.022656875745241264, 'slip_spread_k': 0.1572465624700583, 'spread_hl_frac': 0.03428860147224576, 'bb_std_mult': 2.311736448087042, 'rsi_os': 18, 'rsi_ob': 88, 'vol_spike': 0.21863994838310416, 'adx_thresh': 15.071899841971817, 'atr_min_pct': 0.0068247100527776185, 'atr_max_pct': 0.08778676514236601, 'tp_mult': 2.7325972791963227, 'tsl_mult': 0.4509852284278915, 'strategy': 'mean_reversion', 'time_stop': 214, 'use_sma': False, 'use_atr': True, 'use_adx': True, 'use_ema': False, 'use_spike': True, 'rsi_required': False, 'edge_k': 0.03739070719745166, 'edge_cap': 0.47135354872161794, 'bull_strategy': 'mean_reversion', 'bull_bb_std_mult': 2.2518347650010004, 'bull_rsi_os': 17, 'bull_rsi_ob': 52, 'bull_adx_thresh': 23.568181616163383, 'bull_atr_min_pct': 0.009543705765995836, 'bull_atr_max_pct': 0.09573824674316872, 'bull_tp_mult': 1.620534261840754, 'bull_tsl_mult': 0.35342885312174455, 'bull_time_stop': 91, 'bull_use_sma': True, 'bull_use_ema': False, 'bull_use_atr': False, 'bull_use_adx': False, 'bull_use_spike': False, 'bull_rsi_required': False, 'bear_strategy': 'breakout', 'bear_bb_std_mult': 2.2832858110030467, 'bear_rsi_os': 53, 'bear_rsi_ob': 63, 'bear_adx_thresh': 21.950493688329914, 'bear_atr_min_pct': 0.003883614595750415, 'bear_atr_max_pct': 0.03111560385238807, 'bear_tp_mult': 2.8933814865190377, 'bear_tsl_mult': 0.13026410563410337, 'bear_time_stop': 183, 'bear_use_sma': True, 'bear_use_ema': True, 'bear_use_atr': False, 'bear_use_adx': False, 'bear_use_spike': True, 'bear_rsi_required': True, 'sideways_strategy': 'breakout', 'sideways_bb_std_mult': 2.023460269951442, 'sideways_rsi_os': 45, 'sideways_rsi_ob': 48, 'sideways_adx_thresh': 14.465756013598572, 'sideways_atr_min_pct': 0.028422712133873453, 'sideways_atr_max_pct': 0.12423997584307872, 'sideways_tp_mult': 1.6297639811555844, 'sideways_tsl_mult': 0.18180876229708723, 'sideways_time_stop': 87, 'sideways_use_sma': True, 'sideways_use_ema': True, 'sideways_use_atr': False, 'sideways_use_adx': False, 'sideways_use_spike': True, 'sideways_rsi_required': False}.
[I 2025-09-01 03:23:31,345] Trial 369 finished with values: [-0.02633795498536473, 0.026243855258806553] and parameters: {'p_sma': 51, 'p_std': 55, 'p_atr': 18, 'p_adx': 20, 'rsi_period': 11, 'ema1': 22, 'ema2': 25, 'slip_atr_k': 0.02125039688308493, 'slip_spread_k': 0.939529846268466, 'spread_hl_frac': 0.03442917912073092, 'bb_std_mult': 1.4140153596604297, 'rsi_os': 18, 'rsi_ob': 88, 'vol_spike': 0.08330571070644016, 'adx_thresh': 18.804493579241743, 'atr_min_pct': 0.014977868503402651, 'atr_max_pct': 0.0474825090546043, 'tp_mult': 2.7310555547986564, 'tsl_mult': 0.1599770356850586, 'strategy': 'mean_reversion', 'time_stop': 156, 'use_sma': False, 'use_atr': True, 'use_adx': True, 'use_ema': False, 'use_spike': True, 'rsi_required': False, 'edge_k': 0.7657381662417668, 'edge_cap': 0.47359565679405735, 'bull_strategy': 'mean_reversion', 'bull_bb_std_mult': 1.16697739482759, 'bull_rsi_os': 24, 'bull_rsi_ob': 52, 'bull_adx_thresh': 23.54999795479457, 'bull_atr_min_pct': 0.001039250149808748, 'bull_atr_max_pct': 0.09641019345088882, 'bull_tp_mult': 1.6198831992163512, 'bull_tsl_mult': 0.7698525864478751, 'bull_time_stop': 261, 'bull_use_sma': True, 'bull_use_ema': False, 'bull_use_atr': False, 'bull_use_adx': False, 'bull_use_spike': False, 'bull_rsi_required': False, 'bear_strategy': 'breakout', 'bear_bb_std_mult': 2.278344514344495, 'bear_rsi_os': 28, 'bear_rsi_ob': 62, 'bear_adx_thresh': 21.699091135884032, 'bear_atr_min_pct': 0.026671374982325968, 'bear_atr_max_pct': 0.029910968233166864, 'bear_tp_mult': 2.178197072399823, 'bear_tsl_mult': 0.13315657643679427, 'bear_time_stop': 10, 'bear_use_sma': True, 'bear_use_ema': True, 'bear_use_atr': False, 'bear_use_adx': False, 'bear_use_spike': True, 'bear_rsi_required': True, 'sideways_strategy': 'breakout', 'sideways_bb_std_mult': 1.9974641305707461, 'sideways_rsi_os': 49, 'sideways_rsi_ob': 74, 'sideways_adx_thresh': 14.592424280144613, 'sideways_atr_min_pct': 0.028463561118042047, 'sideways_atr_max_pct': 0.06121222781055742, 'sideways_tp_mult': 2.8802750675431708, 'sideways_tsl_mult': 0.5032054880838491, 'sideways_time_stop': 92, 'sideways_use_sma': True, 'sideways_use_ema': True, 'sideways_use_atr': False, 'sideways_use_adx': False, 'sideways_use_spike': True, 'sideways_rsi_required': False}.
[I 2025-09-01 03:23:31,887] Trial 371 finished with values: [-0.02597162613199544, 0.02583114326435529] and parameters: {'p_sma': 33, 'p_std': 51, 'p_atr': 28, 'p_adx': 18, 'rsi_period': 83, 'ema1': 9, 'ema2': 45, 'slip_atr_k': 0.022965639065068287, 'slip_spread_k': 0.6329890181678647, 'spread_hl_frac': 0.02885289518901284, 'bb_std_mult': 2.3352899538790863, 'rsi_os': 18, 'rsi_ob': 88, 'vol_spike': 0.1767921576361398, 'adx_thresh': 6.455669958478247, 'atr_min_pct': 0.007128294210179862, 'atr_max_pct': 0.1044010880288928, 'tp_mult': 2.724102853598753, 'tsl_mult': 0.4558388545521085, 'strategy': 'mean_reversion', 'time_stop': 136, 'use_sma': False, 'use_atr': True, 'use_adx': True, 'use_ema': False, 'use_spike': True, 'rsi_required': False, 'edge_k': 0.03753010278511461, 'edge_cap': 0.4366263526778906, 'bull_strategy': 'mean_reversion', 'bull_bb_std_mult': 1.1824811824546007, 'bull_rsi_os': 36, 'bull_rsi_ob': 57, 'bull_adx_thresh': 23.33748966374204, 'bull_atr_min_pct': 0.000986052852665993, 'bull_atr_max_pct': 0.02421747664665274, 'bull_tp_mult': 1.6180792559306751, 'bull_tsl_mult': 0.3454191342191889, 'bull_time_stop': 38, 'bull_use_sma': True, 'bull_use_ema': False, 'bull_use_atr': False, 'bull_use_adx': False, 'bull_use_spike': False, 'bull_rsi_required': False, 'bear_strategy': 'breakout', 'bear_bb_std_mult': 2.247504159765798, 'bear_rsi_os': 53, 'bear_rsi_ob': 62, 'bear_adx_thresh': 25.422145882409055, 'bear_atr_min_pct': 0.0051706937110879096, 'bear_atr_max_pct': 0.029805824689646654, 'bear_tp_mult': 1.094098252334279, 'bear_tsl_mult': 0.13226672142876475, 'bear_time_stop': 12, 'bear_use_sma': True, 'bear_use_ema': True, 'bear_use_atr': False, 'bear_use_adx': False, 'bear_use_spike': True, 'bear_rsi_required': True, 'sideways_strategy': 'breakout', 'sideways_bb_std_mult': 2.0092124441074106, 'sideways_rsi_os': 45, 'sideways_rsi_ob': 74, 'sideways_adx_thresh': 14.544999327550968, 'sideways_atr_min_pct': 0.02834224439859856, 'sideways_atr_max_pct': 0.04283666074669402, 'sideways_tp_mult': 1.8671273018045507, 'sideways_tsl_mult': 0.17880120024465568, 'sideways_time_stop': 123, 'sideways_use_sma': True, 'sideways_use_ema': True, 'sideways_use_atr': False, 'sideways_use_adx': False, 'sideways_use_spike': True, 'sideways_rsi_required': False}.
[I 2025-09-01 03:23:32,828] Trial 376 finished with values: [-1000000000.0, 1000000000.0] and parameters: {'p_sma': 40, 'p_std': 57, 'p_atr': 19, 'p_adx': 14, 'rsi_period': 33, 'ema1': 21, 'ema2': 57, 'slip_atr_k': 0.01636176734270771, 'slip_spread_k': 0.5522866620962285, 'spread_hl_frac': 0.03181692077188421, 'bb_std_mult': 1.327322020624675, 'rsi_os': 21, 'rsi_ob': 48, 'vol_spike': 0.24635841941453113, 'adx_thresh': 17.697615521620804, 'atr_min_pct': 0.007840677581173626, 'atr_max_pct': 0.05044352566020787, 'tp_mult': 2.581952314501538, 'tsl_mult': 0.027381198113116345, 'strategy': 'mean_reversion', 'time_stop': 121, 'use_sma': True, 'use_atr': False, 'use_adx': True, 'use_ema': False, 'use_spike': True, 'rsi_required': False, 'edge_k': 1.9976450684939535, 'edge_cap': 0.8418341433877506, 'bull_strategy': 'breakout', 'bull_bb_std_mult': 1.2866628388569508, 'bull_rsi_os': 13, 'bull_rsi_ob': 53, 'bull_adx_thresh': 24.411364508229898, 'bull_atr_min_pct': 3.7985038207408737e-05, 'bull_atr_max_pct': 0.11288494713075205, 'bull_tp_mult': 1.722142995026227, 'bull_tsl_mult': 0.26512756924574143, 'bull_time_stop': 244, 'bull_use_sma': True, 'bull_use_ema': True, 'bull_use_atr': False, 'bull_use_adx': True, 'bull_use_spike': True, 'bull_rsi_required': False, 'bear_strategy': 'mean_reversion', 'bear_bb_std_mult': 1.6368985141076162, 'bear_rsi_os': 52, 'bear_rsi_ob': 59, 'bear_adx_thresh': 9.304048575095212, 'bear_atr_min_pct': 0.011448442058950091, 'bear_atr_max_pct': 0.012513895656984339, 'bear_tp_mult': 1.6283386742549966, 'bear_tsl_mult': 0.002047208865750161, 'bear_time_stop': 79, 'bear_use_sma': False, 'bear_use_ema': False, 'bear_use_atr': False, 'bear_use_adx': False, 'bear_use_spike': True, 'bear_rsi_required': True, 'sideways_strategy': 'breakout', 'sideways_bb_std_mult': 2.175774760034638, 'sideways_rsi_os': 12, 'sideways_rsi_ob': 76, 'sideways_adx_thresh': 24.980098103459635, 'sideways_atr_min_pct': 0.026682598784966538, 'sideways_atr_max_pct': 0.024462074351556687, 'sideways_tp_mult': 1.7023072653655476, 'sideways_tsl_mult': 0.11200157525229687, 'sideways_time_stop': 117, 'sideways_use_sma': True, 'sideways_use_ema': True, 'sideways_use_atr': True, 'sideways_use_adx': False, 'sideways_use_spike': True, 'sideways_rsi_required': True}.
[I 2025-09-01 03:24:11,348] Trial 377 finished with values: [-1000000000.0, 1000000000.0] and parameters: {'p_sma': 18, 'p_std': 58, 'p_atr': 17, 'p_adx': 16, 'rsi_period': 72, 'ema1': 17, 'ema2': 33, 'slip_atr_k': 0.21049312407908094, 'slip_spread_k': 0.8095485009845682, 'spread_hl_frac': 0.0007423035586963458, 'bb_std_mult': 2.4119501762040882, 'rsi_os': 11, 'rsi_ob': 79, 'vol_spike': 0.21295599937766782, 'adx_thresh': 9.732727232410706, 'atr_min_pct': 0.00877672262215514, 'atr_max_pct': 0.13470684642265, 'tp_mult': 1.8762386283420955, 'tsl_mult': 0.3682111029591799, 'strategy': 'mean_reversion', 'time_stop': 75, 'use_sma': True, 'use_atr': False, 'use_adx': True, 'use_ema': False, 'use_spike': True, 'rsi_required': False, 'edge_k': 1.810056012349881, 'edge_cap': 0.4948683059476681, 'bull_strategy': 'breakout', 'bull_bb_std_mult': 2.821094706930783, 'bull_rsi_os': 30, 'bull_rsi_ob': 53, 'bull_adx_thresh': 12.597503021979026, 'bull_atr_min_pct': 0.0022380894377801944, 'bull_atr_max_pct': 0.07296073554130836, 'bull_tp_mult': 1.5187589564542558, 'bull_tsl_mult': 0.29670294080637394, 'bull_time_stop': 277, 'bull_use_sma': False, 'bull_use_ema': False, 'bull_use_atr': False, 'bull_use_adx': False, 'bull_use_spike': True, 'bull_rsi_required': False, 'bear_strategy': 'breakout', 'bear_bb_std_mult': 1.543900803348292, 'bear_rsi_os': 55, 'bear_rsi_ob': 59, 'bear_adx_thresh': 24.845654562496655, 'bear_atr_min_pct': 0.009708039472110812, 'bear_atr_max_pct': 0.019785954722217634, 'bear_tp_mult': 1.011793913174032, 'bear_tsl_mult': 0.07690772775029442, 'bear_time_stop': 58, 'bear_use_sma': False, 'bear_use_ema': False, 'bear_use_atr': False, 'bear_use_adx': False, 'bear_use_spike': True, 'bear_rsi_required': True, 'sideways_strategy': 'breakout', 'sideways_bb_std_mult': 0.5028700360667278, 'sideways_rsi_os': 38, 'sideways_rsi_ob': 73, 'sideways_adx_thresh': 25.994067086890123, 'sideways_atr_min_pct': 0.011240414843300595, 'sideways_atr_max_pct': 0.01551503331108321, 'sideways_tp_mult': 1.4986937062628733, 'sideways_tsl_mult': 0.2735971816714584, 'sideways_time_stop': 252, 'sideways_use_sma': True, 'sideways_use_ema': True, 'sideways_use_atr': True, 'sideways_use_adx': False, 'sideways_use_spike': True, 'sideways_rsi_required': True}.
[I 2025-09-01 03:24:11,566] Trial 374 finished with values: [-1000000000.0, 1000000000.0] and parameters: {'p_sma': 26, 'p_std': 55, 'p_atr': 28, 'p_adx': 28, 'rsi_period': 72, 'ema1': 10, 'ema2': 12, 'slip_atr_k': 0.09039306139326929, 'slip_spread_k': 0.6657075209609626, 'spread_hl_frac': 0.0010694411073640317, 'bb_std_mult': 3.333205493569518, 'rsi_os': 11, 'rsi_ob': 86, 'vol_spike': 0.21355691194134618, 'adx_thresh': 6.3802005950396286, 'atr_min_pct': 0.027144545192154288, 'atr_max_pct': 0.046792860975062814, 'tp_mult': 2.5919652899024315, 'tsl_mult': 0.6744812403039586, 'strategy': 'mean_reversion', 'time_stop': 179, 'use_sma': True, 'use_atr': False, 'use_adx': True, 'use_ema': False, 'use_spike': True, 'rsi_required': False, 'edge_k': 0.7613751861557096, 'edge_cap': 0.49541421893691573, 'bull_strategy': 'breakout', 'bull_bb_std_mult': 1.1977671122020563, 'bull_rsi_os': 27, 'bull_rsi_ob': 53, 'bull_adx_thresh': 24.44145560746021, 'bull_atr_min_pct': 0.00038829123388787383, 'bull_atr_max_pct': 0.112950087357867, 'bull_tp_mult': 1.7439313074173195, 'bull_tsl_mult': 0.2639478301710491, 'bull_time_stop': 244, 'bull_use_sma': True, 'bull_use_ema': False, 'bull_use_atr': False, 'bull_use_adx': False, 'bull_use_spike': True, 'bull_rsi_required': False, 'bear_strategy': 'breakout', 'bear_bb_std_mult': 1.5413497284446973, 'bear_rsi_os': 27, 'bear_rsi_ob': 59, 'bear_adx_thresh': 25.419034872464426, 'bear_atr_min_pct': 0.026679381572875974, 'bear_atr_max_pct': 0.02854129125287654, 'bear_tp_mult': 1.8665166350099816, 'bear_tsl_mult': 0.16414419241984204, 'bear_time_stop': 134, 'bear_use_sma': False, 'bear_use_ema': False, 'bear_use_atr': False, 'bear_use_adx': False, 'bear_use_spike': True, 'bear_rsi_required': True, 'sideways_strategy': 'breakout', 'sideways_bb_std_mult': 0.9206408575891878, 'sideways_rsi_os': 8, 'sideways_rsi_ob': 74, 'sideways_adx_thresh': 26.140123274199258, 'sideways_atr_min_pct': 0.013013254181337626, 'sideways_atr_max_pct': 0.024409525913044315, 'sideways_tp_mult': 1.5098006529183252, 'sideways_tsl_mult': 0.23475489224194968, 'sideways_time_stop': 251, 'sideways_use_sma': True, 'sideways_use_ema': True, 'sideways_use_atr': True, 'sideways_use_adx': False, 'sideways_use_spike': True, 'sideways_rsi_required': True}.
[I 2025-09-01 03:24:11,795] Trial 375 finished with values: [-1000000000.0, 1000000000.0] and parameters: {'p_sma': 26, 'p_std': 58, 'p_atr': 17, 'p_adx': 7, 'rsi_period': 42, 'ema1': 21, 'ema2': 60, 'slip_atr_k': 0.016318142884545216, 'slip_spread_k': 0.6234503849606458, 'spread_hl_frac': 0.0437144846214188, 'bb_std_mult': 1.3252686206477369, 'rsi_os': 21, 'rsi_ob': 86, 'vol_spike': 0.21231969232046444, 'adx_thresh': 6.394764298478913, 'atr_min_pct': 0.001262912323469055, 'atr_max_pct': 0.014909302094222698, 'tp_mult': 2.5884338939778644, 'tsl_mult': 0.3093250260785698, 'strategy': 'mean_reversion', 'time_stop': 140, 'use_sma': True, 'use_atr': False, 'use_adx': True, 'use_ema': False, 'use_spike': True, 'rsi_required': False, 'edge_k': 0.1325951880807568, 'edge_cap': 0.4978730359345824, 'bull_strategy': 'breakout', 'bull_bb_std_mult': 3.314254528487237, 'bull_rsi_os': 13, 'bull_rsi_ob': 53, 'bull_adx_thresh': 24.07739029378326, 'bull_atr_min_pct': 0.011602269846062729, 'bull_atr_max_pct': 0.10990342581621577, 'bull_tp_mult': 1.73112853715059, 'bull_tsl_mult': 0.32566588128138385, 'bull_time_stop': 300, 'bull_use_sma': True, 'bull_use_ema': False, 'bull_use_atr': False, 'bull_use_adx': True, 'bull_use_spike': True, 'bull_rsi_required': False, 'bear_strategy': 'breakout', 'bear_bb_std_mult': 2.1917977242555926, 'bear_rsi_os': 52, 'bear_rsi_ob': 73, 'bear_adx_thresh': 25.578480648380957, 'bear_atr_min_pct': 0.029355585560321373, 'bear_atr_max_pct': 0.021133441309790946, 'bear_tp_mult': 1.6278916969248416, 'bear_tsl_mult': 0.27164878128322123, 'bear_time_stop': 137, 'bear_use_sma': False, 'bear_use_ema': False, 'bear_use_atr': False, 'bear_use_adx': False, 'bear_use_spike': True, 'bear_rsi_required': True, 'sideways_strategy': 'breakout', 'sideways_bb_std_mult': 1.7532560190611022, 'sideways_rsi_os': 12, 'sideways_rsi_ob': 76, 'sideways_adx_thresh': 26.277049241737608, 'sideways_atr_min_pct': 0.026746555315038684, 'sideways_atr_max_pct': 0.015972644134944432, 'sideways_tp_mult': 1.4983361645480202, 'sideways_tsl_mult': 0.9189926682375392, 'sideways_time_stop': 116, 'sideways_use_sma': True, 'sideways_use_ema': True, 'sideways_use_atr': True, 'sideways_use_adx': False, 'sideways_use_spike': True, 'sideways_rsi_required': True}.
[I 2025-09-01 03:24:12,218] Trial 373 finished with values: [-0.023038011101432, 0.022909304063317416] and parameters: {'p_sma': 33, 'p_std': 54, 'p_atr': 16, 'p_adx': 7, 'rsi_period': 11, 'ema1': 21, 'ema2': 12, 'slip_atr_k': 0.02142942271388173, 'slip_spread_k': 0.660218432243026, 'spread_hl_frac': 0.03428163372907631, 'bb_std_mult': 1.411897287633739, 'rsi_os': 37, 'rsi_ob': 95, 'vol_spike': 0.21498629739727249, 'adx_thresh': 15.317292254118888, 'atr_min_pct': 0.006946308742189405, 'atr_max_pct': 0.01524795730583968, 'tp_mult': 1.8753261826521748, 'tsl_mult': 0.36805243912868973, 'strategy': 'mean_reversion', 'time_stop': 179, 'use_sma': True, 'use_atr': False, 'use_adx': True, 'use_ema': False, 'use_spike': True, 'rsi_required': False, 'edge_k': 0.145009591407937, 'edge_cap': 0.4991388459196758, 'bull_strategy': 'breakout', 'bull_bb_std_mult': 1.1929915865262908, 'bull_rsi_os': 17, 'bull_rsi_ob': 82, 'bull_adx_thresh': 24.45560111517994, 'bull_atr_min_pct': 0.0003681762129463783, 'bull_atr_max_pct': 0.11336011610823807, 'bull_tp_mult': 1.8595125895365718, 'bull_tsl_mult': 0.7681191126527613, 'bull_time_stop': 300, 'bull_use_sma': True, 'bull_use_ema': False, 'bull_use_atr': False, 'bull_use_adx': False, 'bull_use_spike': True, 'bull_rsi_required': False, 'bear_strategy': 'breakout', 'bear_bb_std_mult': 2.2687334659799365, 'bear_rsi_os': 28, 'bear_rsi_ob': 59, 'bear_adx_thresh': 21.617699539653657, 'bear_atr_min_pct': 0.029946805452955513, 'bear_atr_max_pct': 0.030640739308424633, 'bear_tp_mult': 1.0123477273867747, 'bear_tsl_mult': 0.16369460400743882, 'bear_time_stop': 56, 'bear_use_sma': True, 'bear_use_ema': False, 'bear_use_atr': False, 'bear_use_adx': False, 'bear_use_spike': True, 'bear_rsi_required': True, 'sideways_strategy': 'breakout', 'sideways_bb_std_mult': 1.990695224659938, 'sideways_rsi_os': 12, 'sideways_rsi_ob': 76, 'sideways_adx_thresh': 26.363650268341235, 'sideways_atr_min_pct': 0.02807223861425062, 'sideways_atr_max_pct': 0.10336448743451684, 'sideways_tp_mult': 2.875007739542844, 'sideways_tsl_mult': 0.508654385063281, 'sideways_time_stop': 90, 'sideways_use_sma': True, 'sideways_use_ema': True, 'sideways_use_atr': False, 'sideways_use_adx': False, 'sideways_use_spike': True, 'sideways_rsi_required': True}.
