[I 2025-09-01 03:03:04,790] Trial 241 finished with values: [-1000000000.0, 1000000000.0] and parameters: {'p_sma': 25, 'p_std': 60, 'p_atr': 27, 'p_adx': 18, 'rsi_period': 34, 'ema1': 21, 'ema2': 51, 'slip_atr_k': 0.20792031818145645, 'slip_spread_k': 0.15638289708470937, 'spread_hl_frac': 0.0306410618007824, 'bb_std_mult': 2.756062381943414, 'rsi_os': 16, 'rsi_ob': 91, 'vol_spike': 0.22090803830762476, 'adx_thresh': 6.237512115174619, 'atr_min_pct': 0.007353264509692008, 'atr_max_pct': 0.13722877242611395, 'tp_mult': 1.3541172464142055, 'tsl_mult': 0.35230603999623833, 'strategy': 'mean_reversion', 'time_stop': 152, 'use_sma': False, 'use_atr': False, 'use_adx': True, 'use_ema': False, 'use_spike': True, 'rsi_required': False, 'edge_k': 0.03469659077108145, 'edge_cap': 0.44058415109865656, 'bull_strategy': 'breakout', 'bull_bb_std_mult': 1.7864709319789238, 'bull_rsi_os': 53, 'bull_rsi_ob': 53, 'bull_adx_thresh': 22.946336598326837, 'bull_atr_min_pct': 0.01719322088466265, 'bull_atr_max_pct': 0.021845872693932344, 'bull_tp_mult': 1.6599914519516188, 'bull_tsl_mult': 0.2506440565458978, 'bull_time_stop': 290, 'bull_use_sma': True, 'bull_use_ema': True, 'bull_use_atr': False, 'bull_use_adx': False, 'bull_use_spike': True, 'bull_rsi_required': False, 'bear_strategy': 'breakout', 'bear_bb_std_mult': 2.1924802295757746, 'bear_rsi_os': 51, 'bear_rsi_ob': 60, 'bear_adx_thresh': 25.715509785684112, 'bear_atr_min_pct': 0.027807284799026787, 'bear_atr_max_pct': 0.01684010090795789, 'bear_tp_mult': 1.1072939237546686, 'bear_tsl_mult': 0.1508231619046672, 'bear_time_stop': 66, 'bear_use_sma': False, 'bear_use_ema': False, 'bear_use_atr': False, 'bear_use_adx': False, 'bear_use_spike': True, 'bear_rsi_required': True, 'sideways_strategy': 'breakout', 'sideways_bb_std_mult': 1.2030058985970444, 'sideways_rsi_os': 45, 'sideways_rsi_ob': 60, 'sideways_adx_thresh': 19.993185404256426, 'sideways_atr_min_pct': 0.028022012911481056, 'sideways_atr_max_pct': 0.017670215287727276, 'sideways_tp_mult': 1.7502227185981019, 'sideways_tsl_mult': 0.19722082968353674, 'sideways_time_stop': 133, 'sideways_use_sma': True, 'sideways_use_ema': True, 'sideways_use_atr': True, 'sideways_use_adx': False, 'sideways_use_spike': True, 'sideways_rsi_required': True}.
[I 2025-09-01 03:03:05,482] Trial 247 finished with values: [-1000000000.0, 1000000000.0] and parameters: {'p_sma': 23, 'p_std': 57, 'p_atr': 29, 'p_adx': 16, 'rsi_period': 81, 'ema1': 15, 'ema2': 57, 'slip_atr_k': 0.02065945193092171, 'slip_spread_k': 0.13394983583842554, 'spread_hl_frac': 0.03347582167870217, 'bb_std_mult': 1.4913682112840871, 'rsi_os': 21, 'rsi_ob': 45, 'vol_spike': 0.22421846004476698, 'adx_thresh': 13.113421849443125, 'atr_min_pct': 0.007635729786275878, 'atr_max_pct': 0.04832675677226968, 'tp_mult': 2.66286132837532, 'tsl_mult': 0.39901539250188744, 'strategy': 'mean_reversion', 'time_stop': 159, 'use_sma': False, 'use_atr': True, 'use_adx': True, 'use_ema': False, 'use_spike': True, 'rsi_required': False, 'edge_k': 0.16119770763269858, 'edge_cap': 0.7393825465297922, 'bull_strategy': 'breakout', 'bull_bb_std_mult': 1.1802054200968628, 'bull_rsi_os': 24, 'bull_rsi_ob': 54, 'bull_adx_thresh': 23.82088046328889, 'bull_atr_min_pct': 0.019802374929421402, 'bull_atr_max_pct': 0.05793991777921485, 'bull_tp_mult': 2.4503789616724783, 'bull_tsl_mult': 0.2051869299126839, 'bull_time_stop': 279, 'bull_use_sma': True, 'bull_use_ema': False, 'bull_use_atr': False, 'bull_use_adx': False, 'bull_use_spike': False, 'bull_rsi_required': False, 'bear_strategy': 'breakout', 'bear_bb_std_mult': 2.330488684639031, 'bear_rsi_os': 50, 'bear_rsi_ob': 58, 'bear_adx_thresh': 6.726015419982012, 'bear_atr_min_pct': 0.027004103754851225, 'bear_atr_max_pct': 0.023631491063955838, 'bear_tp_mult': 1.8626644115920092, 'bear_tsl_mult': 0.12162732955936735, 'bear_time_stop': 62, 'bear_use_sma': True, 'bear_use_ema': True, 'bear_use_atr': False, 'bear_use_adx': False, 'bear_use_spike': True, 'bear_rsi_required': True, 'sideways_strategy': 'mean_reversion', 'sideways_bb_std_mult': 1.2808600477818697, 'sideways_rsi_os': 41, 'sideways_rsi_ob': 74, 'sideways_adx_thresh': 33.66675251574855, 'sideways_atr_min_pct': 0.02370108089380009, 'sideways_atr_max_pct': 0.03908477237306776, 'sideways_tp_mult': 1.7852279311998143, 'sideways_tsl_mult': 0.21082568146595476, 'sideways_time_stop': 215, 'sideways_use_sma': True, 'sideways_use_ema': True, 'sideways_use_atr': True, 'sideways_use_adx': False, 'sideways_use_spike': True, 'sideways_rsi_required': True}.
[I 2025-09-01 03:03:46,385] Trial 244 finished with values: [-1000000000.0, 1000000000.0] and parameters: {'p_sma': 23, 'p_std': 24, 'p_atr': 27, 'p_adx': 16, 'rsi_period': 82, 'ema1': 11, 'ema2': 51, 'slip_atr_k': 0.014076745162141698, 'slip_spread_k': 0.1353624670282792, 'spread_hl_frac': 0.022153489031345213, 'bb_std_mult': 3.027142824803991, 'rsi_os': 27, 'rsi_ob': 91, 'vol_spike': 0.22083189246027718, 'adx_thresh': 10.155660565409095, 'atr_min_pct': 0.008704637332024659, 'atr_max_pct': 0.04718404768365709, 'tp_mult': 1.1359612397588599, 'tsl_mult': 0.34477329315463007, 'strategy': 'mean_reversion', 'time_stop': 165, 'use_sma': False, 'use_atr': False, 'use_adx': True, 'use_ema': False, 'use_spike': True, 'rsi_required': False, 'edge_k': 0.01828517005711361, 'edge_cap': 0.9336490223179175, 'bull_strategy': 'breakout', 'bull_bb_std_mult': 1.5994767620652213, 'bull_rsi_os': 17, 'bull_rsi_ob': 54, 'bull_adx_thresh': 23.311381377696375, 'bull_atr_min_pct': 0.02502244566154697, 'bull_atr_max_pct': 0.11265119676525988, 'bull_tp_mult': 1.6883034189062016, 'bull_tsl_mult': 0.20640439018820822, 'bull_time_stop': 279, 'bull_use_sma': True, 'bull_use_ema': False, 'bull_use_atr': False, 'bull_use_adx': False, 'bull_use_spike': False, 'bull_rsi_required': False, 'bear_strategy': 'breakout', 'bear_bb_std_mult': 3.453253342729747, 'bear_rsi_os': 51, 'bear_rsi_ob': 58, 'bear_adx_thresh': 13.086096612743974, 'bear_atr_min_pct': 0.02709474994462462, 'bear_atr_max_pct': 0.02865012880944652, 'bear_tp_mult': 1.0539157136876232, 'bear_tsl_mult': 0.7696337923957961, 'bear_time_stop': 66, 'bear_use_sma': False, 'bear_use_ema': True, 'bear_use_atr': False, 'bear_use_adx': False, 'bear_use_spike': True, 'bear_rsi_required': True, 'sideways_strategy': 'mean_reversion', 'sideways_bb_std_mult': 1.8947614735725689, 'sideways_rsi_os': 44, 'sideways_rsi_ob': 52, 'sideways_adx_thresh': 26.24776574948943, 'sideways_atr_min_pct': 0.02383424689798115, 'sideways_atr_max_pct': 0.03930336408373862, 'sideways_tp_mult': 1.7982074076048764, 'sideways_tsl_mult': 0.2029833413616612, 'sideways_time_stop': 128, 'sideways_use_sma': True, 'sideways_use_ema': True, 'sideways_use_atr': True, 'sideways_use_adx': False, 'sideways_use_spike': True, 'sideways_rsi_required': True}.
[I 2025-09-01 03:03:46,419] Trial 245 finished with values: [-1000000000.0, 1000000000.0] and parameters: {'p_sma': 23, 'p_std': 57, 'p_atr': 15, 'p_adx': 16, 'rsi_period': 32, 'ema1': 11, 'ema2': 57, 'slip_atr_k': 0.021428688037239824, 'slip_spread_k': 0.14347952628575408, 'spread_hl_frac': 0.03273944336801905, 'bb_std_mult': 1.4691702803125082, 'rsi_os': 20, 'rsi_ob': 82, 'vol_spike': 0.2215747231584554, 'adx_thresh': 8.02053238190042, 'atr_min_pct': 0.00847321564935359, 'atr_max_pct': 0.04889495127279509, 'tp_mult': 2.6721467762409077, 'tsl_mult': 0.3907203568878864, 'strategy': 'mean_reversion', 'time_stop': 165, 'use_sma': False, 'use_atr': False, 'use_adx': True, 'use_ema': False, 'use_spike': True, 'rsi_required': False, 'edge_k': 0.07799073918470523, 'edge_cap': 0.9432737293569866, 'bull_strategy': 'breakout', 'bull_bb_std_mult': 1.7680961468460867, 'bull_rsi_os': 5, 'bull_rsi_ob': 54, 'bull_adx_thresh': 23.50376756328467, 'bull_atr_min_pct': 0.0019052191111343243, 'bull_atr_max_pct': 0.1196819505365644, 'bull_tp_mult': 1.123252556420677, 'bull_tsl_mult': 0.20609923264420843, 'bull_time_stop': 277, 'bull_use_sma': True, 'bull_use_ema': False, 'bull_use_atr': False, 'bull_use_adx': False, 'bull_use_spike': False, 'bull_rsi_required': False, 'bear_strategy': 'breakout', 'bear_bb_std_mult': 2.327013477680167, 'bear_rsi_os': 51, 'bear_rsi_ob': 58, 'bear_adx_thresh': 14.596396969195233, 'bear_atr_min_pct': 0.027217830619031082, 'bear_atr_max_pct': 0.022816029304248874, 'bear_tp_mult': 1.061620645542701, 'bear_tsl_mult': 0.8221606044177905, 'bear_time_stop': 63, 'bear_use_sma': False, 'bear_use_ema': True, 'bear_use_atr': False, 'bear_use_adx': False, 'bear_use_spike': True, 'bear_rsi_required': True, 'sideways_strategy': 'mean_reversion', 'sideways_bb_std_mult': 1.894632777788708, 'sideways_rsi_os': 44, 'sideways_rsi_ob': 74, 'sideways_adx_thresh': 33.70529402782324, 'sideways_atr_min_pct': 0.028033403286637254, 'sideways_atr_max_pct': 0.02130948733986517, 'sideways_tp_mult': 1.7724103658612396, 'sideways_tsl_mult': 0.20703329442582374, 'sideways_time_stop': 129, 'sideways_use_sma': True, 'sideways_use_ema': True, 'sideways_use_atr': True, 'sideways_use_adx': False, 'sideways_use_spike': True, 'sideways_rsi_required': True}.
[I 2025-09-01 03:03:46,787] Trial 246 finished with values: [-1000000000.0, 1000000000.0] and parameters: {'p_sma': 49, 'p_std': 24, 'p_atr': 9, 'p_adx': 17, 'rsi_period': 32, 'ema1': 15, 'ema2': 57, 'slip_atr_k': 0.17835581584838325, 'slip_spread_k': 0.13020718405068413, 'spread_hl_frac': 0.022830622896761753, 'bb_std_mult': 0.5653238586876981, 'rsi_os': 27, 'rsi_ob': 71, 'vol_spike': 0.22283476966059884, 'adx_thresh': 10.275583945833514, 'atr_min_pct': 0.00319872382544111, 'atr_max_pct': 0.04905680643427779, 'tp_mult': 2.7033168736461133, 'tsl_mult': 0.41587313002017207, 'strategy': 'mean_reversion', 'time_stop': 161, 'use_sma': False, 'use_atr': False, 'use_adx': True, 'use_ema': False, 'use_spike': True, 'rsi_required': False, 'edge_k': 0.08360387338367578, 'edge_cap': 0.4554547057084997, 'bull_strategy': 'breakout', 'bull_bb_std_mult': 0.5285349774058541, 'bull_rsi_os': 16, 'bull_rsi_ob': 51, 'bull_adx_thresh': 23.637494897892978, 'bull_atr_min_pct': 0.017177729029077826, 'bull_atr_max_pct': 0.11202036526069978, 'bull_tp_mult': 1.6888917253425162, 'bull_tsl_mult': 0.262913809074885, 'bull_time_stop': 276, 'bull_use_sma': True, 'bull_use_ema': False, 'bull_use_atr': False, 'bull_use_adx': False, 'bull_use_spike': False, 'bull_rsi_required': False, 'bear_strategy': 'breakout', 'bear_bb_std_mult': 2.290986429376358, 'bear_rsi_os': 50, 'bear_rsi_ob': 58, 'bear_adx_thresh': 7.110178272312487, 'bear_atr_min_pct': 0.02692116697742886, 'bear_atr_max_pct': 0.023808065071317417, 'bear_tp_mult': 1.0446170920978275, 'bear_tsl_mult': 0.11951384284989955, 'bear_time_stop': 63, 'bear_use_sma': False, 'bear_use_ema': True, 'bear_use_atr': False, 'bear_use_adx': False, 'bear_use_spike': True, 'bear_rsi_required': True, 'sideways_strategy': 'mean_reversion', 'sideways_bb_std_mult': 1.8668369521656034, 'sideways_rsi_os': 43, 'sideways_rsi_ob': 74, 'sideways_adx_thresh': 33.34769732041978, 'sideways_atr_min_pct': 0.02826582261397686, 'sideways_atr_max_pct': 0.010054736671819935, 'sideways_tp_mult': 1.7636124123563728, 'sideways_tsl_mult': 0.2055391917087422, 'sideways_time_stop': 146, 'sideways_use_sma': True, 'sideways_use_ema': True, 'sideways_use_atr': True, 'sideways_use_adx': False, 'sideways_use_spike': True, 'sideways_rsi_required': True}.
[I 2025-09-01 03:03:47,977] Trial 248 finished with values: [-0.03363709459333508, 0.03346911719872976] and parameters: {'p_sma': 21, 'p_std': 21, 'p_atr': 17, 'p_adx': 17, 'rsi_period': 11, 'ema1': 23, 'ema2': 24, 'slip_atr_k': 0.014877346606429085, 'slip_spread_k': 0.1394853598185047, 'spread_hl_frac': 0.022761029115645898, 'bb_std_mult': 1.5160016025331668, 'rsi_os': 20, 'rsi_ob': 71, 'vol_spike': 0.04789563878830587, 'adx_thresh': 15.218688628996233, 'atr_min_pct': 0.008883270763735861, 'atr_max_pct': 0.05268260205928433, 'tp_mult': 2.70245753656804, 'tsl_mult': 0.42095320504178113, 'strategy': 'mean_reversion', 'time_stop': 177, 'use_sma': False, 'use_atr': False, 'use_adx': True, 'use_ema': False, 'use_spike': True, 'rsi_required': False, 'edge_k': 0.09169786022653097, 'edge_cap': 0.5191635701331031, 'bull_strategy': 'breakout', 'bull_bb_std_mult': 0.5627877367172331, 'bull_rsi_os': 16, 'bull_rsi_ob': 51, 'bull_adx_thresh': 23.492564052887275, 'bull_atr_min_pct': 5.603099544617264e-05, 'bull_atr_max_pct': 0.11275564862092059, 'bull_tp_mult': 1.6953984469308738, 'bull_tsl_mult': 0.2673178142628877, 'bull_time_stop': 275, 'bull_use_sma': True, 'bull_use_ema': False, 'bull_use_atr': False, 'bull_use_adx': False, 'bull_use_spike': False, 'bull_rsi_required': False, 'bear_strategy': 'breakout', 'bear_bb_std_mult': 3.0859213185912817, 'bear_rsi_os': 53, 'bear_rsi_ob': 58, 'bear_adx_thresh': 23.46508534632483, 'bear_atr_min_pct': 0.026394299738860334, 'bear_atr_max_pct': 0.029105904891748576, 'bear_tp_mult': 2.961180996076111, 'bear_tsl_mult': 0.11207907480666433, 'bear_time_stop': 222, 'bear_use_sma': False, 'bear_use_ema': True, 'bear_use_atr': False, 'bear_use_adx': False, 'bear_use_spike': False, 'bear_rsi_required': True, 'sideways_strategy': 'breakout', 'sideways_bb_std_mult': 1.8929178922816061, 'sideways_rsi_os': 53, 'sideways_rsi_ob': 75, 'sideways_adx_thresh': 19.354140128303214, 'sideways_atr_min_pct': 0.027033263330962905, 'sideways_atr_max_pct': 0.010263234002216166, 'sideways_tp_mult': 1.6905689269365065, 'sideways_tsl_mult': 0.1529482919697986, 'sideways_time_stop': 144, 'sideways_use_sma': True, 'sideways_use_ema': True, 'sideways_use_atr': True, 'sideways_use_adx': False, 'sideways_use_spike': True, 'sideways_rsi_required': True}.
[I 2025-09-01 03:04:28,777] Trial 252 finished with values: [-1000000000.0, 1000000000.0] and parameters: {'p_sma': 52, 'p_std': 13, 'p_atr': 10, 'p_adx': 20, 'rsi_period': 11, 'ema1': 20, 'ema2': 55, 'slip_atr_k': 0.038429285424462535, 'slip_spread_k': 0.1639720317780763, 'spread_hl_frac': 0.036772345390686974, 'bb_std_mult': 1.33401667495144, 'rsi_os': 23, 'rsi_ob': 81, 'vol_spike': 0.1958674271787459, 'adx_thresh': 9.33844398190837, 'atr_min_pct': 0.0066275514084049615, 'atr_max_pct': 0.05205093898912276, 'tp_mult': 1.7539838559547896, 'tsl_mult': 0.46843968283449333, 'strategy': 'mean_reversion', 'time_stop': 183, 'use_sma': True, 'use_atr': True, 'use_adx': True, 'use_ema': True, 'use_spike': False, 'rsi_required': True, 'edge_k': 0.12922604629369283, 'edge_cap': 0.6489306739518717, 'bull_strategy': 'breakout', 'bull_bb_std_mult': 2.9130008626596537, 'bull_rsi_os': 15, 'bull_rsi_ob': 52, 'bull_adx_thresh': 24.412779513389992, 'bull_atr_min_pct': 0.026707073548778333, 'bull_atr_max_pct': 0.12016852691440141, 'bull_tp_mult': 1.3242566676043377, 'bull_tsl_mult': 0.226637210666166, 'bull_time_stop': 267, 'bull_use_sma': True, 'bull_use_ema': False, 'bull_use_atr': True, 'bull_use_adx': True, 'bull_use_spike': True, 'bull_rsi_required': False, 'bear_strategy': 'mean_reversion', 'bear_bb_std_mult': 2.080906707309005, 'bear_rsi_os': 53, 'bear_rsi_ob': 60, 'bear_adx_thresh': 24.870318882295532, 'bear_atr_min_pct': 0.025507527683346094, 'bear_atr_max_pct': 0.038502888317609174, 'bear_tp_mult': 1.0150366595321025, 'bear_tsl_mult': 0.1796584950073834, 'bear_time_stop': 214, 'bear_use_sma': True, 'bear_use_ema': False, 'bear_use_atr': True, 'bear_use_adx': False, 'bear_use_spike': False, 'bear_rsi_required': False, 'sideways_strategy': 'breakout', 'sideways_bb_std_mult': 0.6048134241112242, 'sideways_rsi_os': 37, 'sideways_rsi_ob': 76, 'sideways_adx_thresh': 27.783624290729147, 'sideways_atr_min_pct': 0.026655006563313644, 'sideways_atr_max_pct': 0.030472851147842553, 'sideways_tp_mult': 1.6345689804984147, 'sideways_tsl_mult': 0.17792622008293207, 'sideways_time_stop': 120, 'sideways_use_sma': True, 'sideways_use_ema': False, 'sideways_use_atr': False, 'sideways_use_adx': False, 'sideways_use_spike': False, 'sideways_rsi_required': True}.
[I 2025-09-01 03:04:30,679] Trial 250 finished with values: [-0.04100918917742635, 0.04079797354479619] and parameters: {'p_sma': 52, 'p_std': 14, 'p_atr': 13, 'p_adx': 17, 'rsi_period': 11, 'ema1': 20, 'ema2': 23, 'slip_atr_k': 0.186104594350286, 'slip_spread_k': 0.06681874530491848, 'spread_hl_frac': 0.036556577040517436, 'bb_std_mult': 1.2881540036441659, 'rsi_os': 23, 'rsi_ob': 70, 'vol_spike': 0.1943026628220502, 'adx_thresh': 11.603899739873436, 'atr_min_pct': 0.004546976594962119, 'atr_max_pct': 0.051539119725264565, 'tp_mult': 2.7087520079363134, 'tsl_mult': 0.41378618976069453, 'strategy': 'mean_reversion', 'time_stop': 141, 'use_sma': True, 'use_atr': True, 'use_adx': True, 'use_ema': True, 'use_spike': False, 'rsi_required': True, 'edge_k': 0.0942800429207951, 'edge_cap': 0.5196782363193706, 'bull_strategy': 'breakout', 'bull_bb_std_mult': 1.071120525897049, 'bull_rsi_os': 16, 'bull_rsi_ob': 51, 'bull_adx_thresh': 24.662060431466646, 'bull_atr_min_pct': 0.0005153026936575915, 'bull_atr_max_pct': 0.048544947309834316, 'bull_tp_mult': 1.5893742963574118, 'bull_tsl_mult': 0.2653453850226061, 'bull_time_stop': 269, 'bull_use_sma': True, 'bull_use_ema': False, 'bull_use_atr': True, 'bull_use_adx': True, 'bull_use_spike': True, 'bull_rsi_required': False, 'bear_strategy': 'breakout', 'bear_bb_std_mult': 2.062908029970928, 'bear_rsi_os': 53, 'bear_rsi_ob': 59, 'bear_adx_thresh': 30.59431981726422, 'bear_atr_min_pct': 0.02629037475812388, 'bear_atr_max_pct': 0.010048320382973859, 'bear_tp_mult': 1.0129993957049688, 'bear_tsl_mult': 0.11301086448846327, 'bear_time_stop': 74, 'bear_use_sma': False, 'bear_use_ema': False, 'bear_use_atr': True, 'bear_use_adx': False, 'bear_use_spike': False, 'bear_rsi_required': False, 'sideways_strategy': 'breakout', 'sideways_bb_std_mult': 1.9920345440620468, 'sideways_rsi_os': 53, 'sideways_rsi_ob': 75, 'sideways_adx_thresh': 21.714355486260118, 'sideways_atr_min_pct': 0.021016669699231598, 'sideways_atr_max_pct': 0.010623440774968063, 'sideways_tp_mult': 1.6247033745569655, 'sideways_tsl_mult': 0.39407816161739684, 'sideways_time_stop': 144, 'sideways_use_sma': True, 'sideways_use_ema': False, 'sideways_use_atr': True, 'sideways_use_adx': False, 'sideways_use_spike': False, 'sideways_rsi_required': True}.
[I 2025-09-01 03:04:31,578] Trial 249 finished with values: [-0.038634973529661165, 0.03844071066820606] and parameters: {'p_sma': 45, 'p_std': 17, 'p_atr': 9, 'p_adx': 17, 'rsi_period': 11, 'ema1': 20, 'ema2': 17, 'slip_atr_k': 0.17602051605146044, 'slip_spread_k': 0.08609324046787875, 'spread_hl_frac': 0.024727767209490773, 'bb_std_mult': 0.5824790857365116, 'rsi_os': 23, 'rsi_ob': 69, 'vol_spike': 0.04886321835410273, 'adx_thresh': 15.224362700022644, 'atr_min_pct': 0.003691978424435971, 'atr_max_pct': 0.05378680722466227, 'tp_mult': 1.724845257619925, 'tsl_mult': 0.4149692521782952, 'strategy': 'mean_reversion', 'time_stop': 188, 'use_sma': True, 'use_atr': True, 'use_adx': True, 'use_ema': True, 'use_spike': False, 'rsi_required': True, 'edge_k': 0.0898712086357708, 'edge_cap': 0.7957169731906513, 'bull_strategy': 'breakout', 'bull_bb_std_mult': 1.0576924063457167, 'bull_rsi_os': 16, 'bull_rsi_ob': 51, 'bull_adx_thresh': 24.755028405344135, 'bull_atr_min_pct': 7.925070374336187e-05, 'bull_atr_max_pct': 0.11904815615064263, 'bull_tp_mult': 2.8702127743290524, 'bull_tsl_mult': 0.22996756675300745, 'bull_time_stop': 268, 'bull_use_sma': True, 'bull_use_ema': False, 'bull_use_atr': True, 'bull_use_adx': True, 'bull_use_spike': True, 'bull_rsi_required': False, 'bear_strategy': 'breakout', 'bear_bb_std_mult': 2.0402918480391867, 'bear_rsi_os': 53, 'bear_rsi_ob': 60, 'bear_adx_thresh': 23.58900705414342, 'bear_atr_min_pct': 0.02633818095969307, 'bear_atr_max_pct': 0.030091146528376488, 'bear_tp_mult': 1.0434329935976867, 'bear_tsl_mult': 0.111402935425344, 'bear_time_stop': 221, 'bear_use_sma': False, 'bear_use_ema': False, 'bear_use_atr': True, 'bear_use_adx': False, 'bear_use_spike': False, 'bear_rsi_required': False, 'sideways_strategy': 'breakout', 'sideways_bb_std_mult': 0.5858297729307174, 'sideways_rsi_os': 53, 'sideways_rsi_ob': 75, 'sideways_adx_thresh': 19.214841236179957, 'sideways_atr_min_pct': 0.02088110238923383, 'sideways_atr_max_pct': 0.029947215531670783, 'sideways_tp_mult': 1.6203258029093557, 'sideways_tsl_mult': 0.4018566661335204, 'sideways_time_stop': 120, 'sideways_use_sma': True, 'sideways_use_ema': False, 'sideways_use_atr': True, 'sideways_use_adx': False, 'sideways_use_spike': False, 'sideways_rsi_required': True}.
