[I 2025-09-01 02:47:47,381] Trial 142 finished with values: [-1000000000.0, 1000000000.0] and parameters: {'p_sma': 22, 'p_std': 43, 'p_atr': 22, 'p_adx': 10, 'rsi_period': 64, 'ema1': 17, 'ema2': 58, 'slip_atr_k': 0.22443872359645903, 'slip_spread_k': 0.33237786141105025, 'spread_hl_frac': 0.00470208713460462, 'bb_std_mult': 2.394485341681839, 'rsi_os': 8, 'rsi_ob': 59, 'vol_spike': 0.1403583539759114, 'adx_thresh': 20.79789337631311, 'atr_min_pct': 0.014407532029181607, 'atr_max_pct': 0.09367255449466584, 'tp_mult': 2.0976564244131035, 'tsl_mult': 0.05673359950227602, 'strategy': 'mean_reversion', 'time_stop': 289, 'use_sma': True, 'use_atr': True, 'use_adx': False, 'use_ema': False, 'use_spike': True, 'rsi_required': False, 'edge_k': 1.1404046853990875, 'edge_cap': 0.41480003263380016, 'bull_strategy': 'mean_reversion', 'bull_bb_std_mult': 1.1307801757489322, 'bull_rsi_os': 16, 'bull_rsi_ob': 71, 'bull_adx_thresh': 31.542110626816633, 'bull_atr_min_pct': 0.02136260151903638, 'bull_atr_max_pct': 0.14081898289703923, 'bull_tp_mult': 1.4238497250498963, 'bull_tsl_mult': 0.7621742823936185, 'bull_time_stop': 295, 'bull_use_sma': False, 'bull_use_ema': False, 'bull_use_atr': False, 'bull_use_adx': False, 'bull_use_spike': True, 'bull_rsi_required': False, 'bear_strategy': 'mean_reversion', 'bear_bb_std_mult': 3.419560519234131, 'bear_rsi_os': 34, 'bear_rsi_ob': 93, 'bear_adx_thresh': 22.59125674634072, 'bear_atr_min_pct': 0.009196120596508137, 'bear_atr_max_pct': 0.01902264577749705, 'bear_tp_mult': 1.234902075541124, 'bear_tsl_mult': 0.9995118766662862, 'bear_time_stop': 59, 'bear_use_sma': False, 'bear_use_ema': True, 'bear_use_atr': False, 'bear_use_adx': True, 'bear_use_spike': False, 'bear_rsi_required': True, 'sideways_strategy': 'mean_reversion', 'sideways_bb_std_mult': 3.4738218134122247, 'sideways_rsi_os': 45, 'sideways_rsi_ob': 82, 'sideways_adx_thresh': 28.567538732750986, 'sideways_atr_min_pct': 0.002569895932369939, 'sideways_atr_max_pct': 0.109969357982357, 'sideways_tp_mult': 2.3100011342473232, 'sideways_tsl_mult': 0.6223167918672544, 'sideways_time_stop': 109, 'sideways_use_sma': True, 'sideways_use_ema': True, 'sideways_use_atr': False, 'sideways_use_adx': False, 'sideways_use_spike': True, 'sideways_rsi_required': False}.
[I 2025-09-01 02:47:48,173] Trial 145 finished with values: [-0.016285754725906543, 0.016111076550623753] and parameters: {'p_sma': 38, 'p_std': 43, 'p_atr': 24, 'p_adx': 9, 'rsi_period': 59, 'ema1': 29, 'ema2': 57, 'slip_atr_k': 0.0012889787812558617, 'slip_spread_k': 0.3908192302086431, 'spread_hl_frac': 0.014553996494979704, 'bb_std_mult': 1.5820099277468302, 'rsi_os': 46, 'rsi_ob': 60, 'vol_spike': 0.14139030008663026, 'adx_thresh': 23.884993865589617, 'atr_min_pct': 0.020925297126443483, 'atr_max_pct': 0.026367487312505142, 'tp_mult': 2.0883999544246308, 'tsl_mult': 0.047052332760090465, 'strategy': 'breakout', 'time_stop': 264, 'use_sma': False, 'use_atr': False, 'use_adx': False, 'use_ema': False, 'use_spike': True, 'rsi_required': False, 'edge_k': 0.4111528551474695, 'edge_cap': 0.4174927794953246, 'bull_strategy': 'mean_reversion', 'bull_bb_std_mult': 1.1509943205114388, 'bull_rsi_os': 17, 'bull_rsi_ob': 64, 'bull_adx_thresh': 26.789116535225787, 'bull_atr_min_pct': 0.001966960137207014, 'bull_atr_max_pct': 0.11617098817510835, 'bull_tp_mult': 1.5905903127378358, 'bull_tsl_mult': 0.5252688620798894, 'bull_time_stop': 187, 'bull_use_sma': False, 'bull_use_ema': False, 'bull_use_atr': False, 'bull_use_adx': False, 'bull_use_spike': True, 'bull_rsi_required': True, 'bear_strategy': 'breakout', 'bear_bb_std_mult': 2.662960649399029, 'bear_rsi_os': 5, 'bear_rsi_ob': 95, 'bear_adx_thresh': 22.8433625151278, 'bear_atr_min_pct': 0.015581988171462315, 'bear_atr_max_pct': 0.14969104811707734, 'bear_tp_mult': 1.2498714748368522, 'bear_tsl_mult': 0.32978455887225966, 'bear_time_stop': 58, 'bear_use_sma': False, 'bear_use_ema': False, 'bear_use_atr': False, 'bear_use_adx': True, 'bear_use_spike': True, 'bear_rsi_required': True, 'sideways_strategy': 'breakout', 'sideways_bb_std_mult': 2.151409922540306, 'sideways_rsi_os': 17, 'sideways_rsi_ob': 73, 'sideways_adx_thresh': 30.36915816817295, 'sideways_atr_min_pct': 0.008914886513978874, 'sideways_atr_max_pct': 0.07232271494321958, 'sideways_tp_mult': 1.3432584083910808, 'sideways_tsl_mult': 0.5703989445116584, 'sideways_time_stop': 288, 'sideways_use_sma': False, 'sideways_use_ema': True, 'sideways_use_atr': True, 'sideways_use_adx': True, 'sideways_use_spike': True, 'sideways_rsi_required': False}.
[I 2025-09-01 02:48:33,427] Trial 148 finished with values: [-1000000000.0, 1000000000.0] and parameters: {'p_sma': 15, 'p_std': 45, 'p_atr': 24, 'p_adx': 18, 'rsi_period': 50, 'ema1': 6, 'ema2': 59, 'slip_atr_k': 0.1519837464523599, 'slip_spread_k': 0.26831855049673975, 'spread_hl_frac': 0.007866580093828606, 'bb_std_mult': 2.815930816470649, 'rsi_os': 46, 'rsi_ob': 65, 'vol_spike': 0.2859206200520118, 'adx_thresh': 6.1666577974311085, 'atr_min_pct': 0.022928482061492887, 'atr_max_pct': 0.08651925326003897, 'tp_mult': 2.3373830669930644, 'tsl_mult': 0.9701452823219059, 'strategy': 'breakout', 'time_stop': 282, 'use_sma': False, 'use_atr': False, 'use_adx': False, 'use_ema': False, 'use_spike': False, 'rsi_required': True, 'edge_k': 1.9014837880447675, 'edge_cap': 0.6643608440964746, 'bull_strategy': 'breakout', 'bull_bb_std_mult': 1.3300586571703001, 'bull_rsi_os': 41, 'bull_rsi_ob': 84, 'bull_adx_thresh': 34.99652276870569, 'bull_atr_min_pct': 0.0017266634675515181, 'bull_atr_max_pct': 0.019346956264820324, 'bull_tp_mult': 1.5087695751411978, 'bull_tsl_mult': 0.4775578432893379, 'bull_time_stop': 184, 'bull_use_sma': False, 'bull_use_ema': False, 'bull_use_atr': True, 'bull_use_adx': True, 'bull_use_spike': True, 'bull_rsi_required': True, 'bear_strategy': 'breakout', 'bear_bb_std_mult': 2.9264226694001936, 'bear_rsi_os': 13, 'bear_rsi_ob': 66, 'bear_adx_thresh': 25.441588163027983, 'bear_atr_min_pct': 0.012376323087975448, 'bear_atr_max_pct': 0.05039065505428925, 'bear_tp_mult': 1.822705888905187, 'bear_tsl_mult': 0.3342859314204819, 'bear_time_stop': 173, 'bear_use_sma': True, 'bear_use_ema': False, 'bear_use_atr': True, 'bear_use_adx': True, 'bear_use_spike': True, 'bear_rsi_required': True, 'sideways_strategy': 'breakout', 'sideways_bb_std_mult': 2.0134333675017895, 'sideways_rsi_os': 37, 'sideways_rsi_ob': 73, 'sideways_adx_thresh': 30.512025977351485, 'sideways_atr_min_pct': 0.013682967318949368, 'sideways_atr_max_pct': 0.11471195127475445, 'sideways_tp_mult': 1.289207910653864, 'sideways_tsl_mult': 0.9442578262048205, 'sideways_time_stop': 291, 'sideways_use_sma': False, 'sideways_use_ema': False, 'sideways_use_atr': True, 'sideways_use_adx': True, 'sideways_use_spike': False, 'sideways_rsi_required': False}.
[I 2025-09-01 02:48:34,167] Trial 149 finished with values: [-1000000000.0, 1000000000.0] and parameters: {'p_sma': 39, 'p_std': 43, 'p_atr': 25, 'p_adx': 11, 'rsi_period': 49, 'ema1': 29, 'ema2': 59, 'slip_atr_k': 0.0038666400807325966, 'slip_spread_k': 0.3877022666425037, 'spread_hl_frac': 0.016359104987605406, 'bb_std_mult': 1.7413451038164134, 'rsi_os': 46, 'rsi_ob': 58, 'vol_spike': 0.1321875794963958, 'adx_thresh': 22.42057083138028, 'atr_min_pct': 0.023057843939982225, 'atr_max_pct': 0.0272511345262148, 'tp_mult': 2.2431866245372145, 'tsl_mult': 0.04030458612037196, 'strategy': 'breakout', 'time_stop': 229, 'use_sma': False, 'use_atr': False, 'use_adx': False, 'use_ema': False, 'use_spike': False, 'rsi_required': True, 'edge_k': 0.26234769079767706, 'edge_cap': 0.3736149914459324, 'bull_strategy': 'breakout', 'bull_bb_std_mult': 0.7404821821960398, 'bull_rsi_os': 20, 'bull_rsi_ob': 64, 'bull_adx_thresh': 23.48943000775718, 'bull_atr_min_pct': 0.0036444407236081236, 'bull_atr_max_pct': 0.10979632102200867, 'bull_tp_mult': 1.7882966304170358, 'bull_tsl_mult': 0.9617126412496337, 'bull_time_stop': 182, 'bull_use_sma': False, 'bull_use_ema': True, 'bull_use_atr': True, 'bull_use_adx': True, 'bull_use_spike': True, 'bull_rsi_required': True, 'bear_strategy': 'breakout', 'bear_bb_std_mult': 2.9222749757055664, 'bear_rsi_os': 6, 'bear_rsi_ob': 95, 'bear_adx_thresh': 21.476121549436964, 'bear_atr_min_pct': 0.015672198620000743, 'bear_atr_max_pct': 0.14851540514973052, 'bear_tp_mult': 1.3949967518246202, 'bear_tsl_mult': 0.33613232709553714, 'bear_time_stop': 50, 'bear_use_sma': False, 'bear_use_ema': False, 'bear_use_atr': True, 'bear_use_adx': True, 'bear_use_spike': True, 'bear_rsi_required': True, 'sideways_strategy': 'breakout', 'sideways_bb_std_mult': 1.969759827732682, 'sideways_rsi_os': 29, 'sideways_rsi_ob': 73, 'sideways_adx_thresh': 32.42754023901572, 'sideways_atr_min_pct': 0.006481372104048321, 'sideways_atr_max_pct': 0.07283431731150136, 'sideways_tp_mult': 1.2881935058038732, 'sideways_tsl_mult': 0.5383180837275638, 'sideways_time_stop': 291, 'sideways_use_sma': False, 'sideways_use_ema': False, 'sideways_use_atr': True, 'sideways_use_adx': True, 'sideways_use_spike': False, 'sideways_rsi_required': False}.
[I 2025-09-01 02:48:34,512] Trial 146 finished with values: [-1000000000.0, 1000000000.0] and parameters: {'p_sma': 28, 'p_std': 46, 'p_atr': 27, 'p_adx': 9, 'rsi_period': 46, 'ema1': 6, 'ema2': 57, 'slip_atr_k': 0.10602696213832867, 'slip_spread_k': 0.22070121727680306, 'spread_hl_frac': 0.005129045505253784, 'bb_std_mult': 2.8537912931173297, 'rsi_os': 46, 'rsi_ob': 65, 'vol_spike': 0.2818236270573524, 'adx_thresh': 23.523651438640027, 'atr_min_pct': 0.021027145090791573, 'atr_max_pct': 0.04643922984970385, 'tp_mult': 2.0863341330057343, 'tsl_mult': 0.6504751936401838, 'strategy': 'breakout', 'time_stop': 292, 'use_sma': False, 'use_atr': False, 'use_adx': False, 'use_ema': False, 'use_spike': True, 'rsi_required': False, 'edge_k': 1.1373565946264503, 'edge_cap': 0.3732721840271298, 'bull_strategy': 'mean_reversion', 'bull_bb_std_mult': 1.3329445816524768, 'bull_rsi_os': 41, 'bull_rsi_ob': 84, 'bull_adx_thresh': 31.5251620143006, 'bull_atr_min_pct': 0.001825546362594558, 'bull_atr_max_pct': 0.14439046950790022, 'bull_tp_mult': 1.6022240067862765, 'bull_tsl_mult': 0.7549249965887392, 'bull_time_stop': 138, 'bull_use_sma': False, 'bull_use_ema': False, 'bull_use_atr': False, 'bull_use_adx': False, 'bull_use_spike': True, 'bull_rsi_required': True, 'bear_strategy': 'breakout', 'bear_bb_std_mult': 2.670496484977832, 'bear_rsi_os': 11, 'bear_rsi_ob': 91, 'bear_adx_thresh': 24.5272593332264, 'bear_atr_min_pct': 0.006914006150233502, 'bear_atr_max_pct': 0.04965021612371596, 'bear_tp_mult': 2.368819884699688, 'bear_tsl_mult': 0.3330701517742398, 'bear_time_stop': 59, 'bear_use_sma': False, 'bear_use_ema': False, 'bear_use_atr': True, 'bear_use_adx': True, 'bear_use_spike': True, 'bear_rsi_required': True, 'sideways_strategy': 'breakout', 'sideways_bb_std_mult': 2.9821298063139983, 'sideways_rsi_os': 13, 'sideways_rsi_ob': 73, 'sideways_adx_thresh': 30.53147998352832, 'sideways_atr_min_pct': 0.0092441632341132, 'sideways_atr_max_pct': 0.116214035194869, 'sideways_tp_mult': 1.4420745566378297, 'sideways_tsl_mult': 0.5641640965239727, 'sideways_time_stop': 108, 'sideways_use_sma': False, 'sideways_use_ema': False, 'sideways_use_atr': True, 'sideways_use_adx': True, 'sideways_use_spike': True, 'sideways_rsi_required': False}.
[I 2025-09-01 02:48:34,853] Trial 147 finished with values: [-1000000000.0, 1000000000.0] and parameters: {'p_sma': 28, 'p_std': 43, 'p_atr': 24, 'p_adx': 9, 'rsi_period': 64, 'ema1': 17, 'ema2': 58, 'slip_atr_k': 0.071057225370075, 'slip_spread_k': 0.2708310379072621, 'spread_hl_frac': 0.0077427577215072076, 'bb_std_mult': 0.5785523883067967, 'rsi_os': 5, 'rsi_ob': 62, 'vol_spike': 0.04864452803461765, 'adx_thresh': 26.437278312832294, 'atr_min_pct': 0.012781087765217991, 'atr_max_pct': 0.0856235075116805, 'tp_mult': 2.3633711390485144, 'tsl_mult': 0.9740739568582443, 'strategy': 'breakout', 'time_stop': 293, 'use_sma': False, 'use_atr': False, 'use_adx': False, 'use_ema': False, 'use_spike': True, 'rsi_required': False, 'edge_k': 0.5410326471094995, 'edge_cap': 0.6686274317914775, 'bull_strategy': 'mean_reversion', 'bull_bb_std_mult': 1.6921595381294012, 'bull_rsi_os': 16, 'bull_rsi_ob': 85, 'bull_adx_thresh': 26.95269157667212, 'bull_atr_min_pct': 0.0020420680117944037, 'bull_atr_max_pct': 0.10881976122315845, 'bull_tp_mult': 1.5059852353684804, 'bull_tsl_mult': 0.7564479521716558, 'bull_time_stop': 137, 'bull_use_sma': False, 'bull_use_ema': False, 'bull_use_atr': False, 'bull_use_adx': False, 'bull_use_spike': True, 'bull_rsi_required': True, 'bear_strategy': 'breakout', 'bear_bb_std_mult': 0.7548319876922478, 'bear_rsi_os': 29, 'bear_rsi_ob': 67, 'bear_adx_thresh': 5.072398950421508, 'bear_atr_min_pct': 0.012344506699810177, 'bear_atr_max_pct': 0.050300377910434305, 'bear_tp_mult': 1.2480132600757243, 'bear_tsl_mult': 0.9876851495096041, 'bear_time_stop': 57, 'bear_use_sma': True, 'bear_use_ema': False, 'bear_use_atr': True, 'bear_use_adx': True, 'bear_use_spike': True, 'bear_rsi_required': True, 'sideways_strategy': 'breakout', 'sideways_bb_std_mult': 1.3221430947069672, 'sideways_rsi_os': 17, 'sideways_rsi_ob': 73, 'sideways_adx_thresh': 19.421058571214317, 'sideways_atr_min_pct': 0.01103900929219395, 'sideways_atr_max_pct': 0.11263794022548505, 'sideways_tp_mult': 1.2824521344785493, 'sideways_tsl_mult': 0.6253676117175431, 'sideways_time_stop': 242, 'sideways_use_sma': False, 'sideways_use_ema': False, 'sideways_use_atr': True, 'sideways_use_adx': True, 'sideways_use_spike': True, 'sideways_rsi_required': False}.
[I 2025-09-01 02:48:35,321] Trial 151 finished with values: [-1000000000.0, 1000000000.0] and parameters: {'p_sma': 38, 'p_std': 42, 'p_atr': 25, 'p_adx': 10, 'rsi_period': 16, 'ema1': 26, 'ema2': 25, 'slip_atr_k': 0.036105303126330486, 'slip_spread_k': 0.44054903052200206, 'spread_hl_frac': 0.015089178921092147, 'bb_std_mult': 1.6538194020552017, 'rsi_os': 48, 'rsi_ob': 56, 'vol_spike': 0.12904958356728843, 'adx_thresh': 19.94385515642804, 'atr_min_pct': 0.021068801978570015, 'atr_max_pct': 0.020889680705360732, 'tp_mult': 2.1601117106250696, 'tsl_mult': 0.21043316175535692, 'strategy': 'breakout', 'time_stop': 208, 'use_sma': False, 'use_atr': False, 'use_adx': False, 'use_ema': True, 'use_spike': True, 'rsi_required': False, 'edge_k': 0.2120635129265697, 'edge_cap': 0.4175811183033814, 'bull_strategy': 'mean_reversion', 'bull_bb_std_mult': 0.919566217052229, 'bull_rsi_os': 18, 'bull_rsi_ob': 63, 'bull_adx_thresh': 17.029572540366935, 'bull_atr_min_pct': 0.004122974360651864, 'bull_atr_max_pct': 0.11848819628892687, 'bull_tp_mult': 1.6069899838836763, 'bull_tsl_mult': 0.6411911018200072, 'bull_time_stop': 175, 'bull_use_sma': False, 'bull_use_ema': False, 'bull_use_atr': False, 'bull_use_adx': False, 'bull_use_spike': True, 'bull_rsi_required': True, 'bear_strategy': 'breakout', 'bear_bb_std_mult': 2.862847768499558, 'bear_rsi_os': 5, 'bear_rsi_ob': 95, 'bear_adx_thresh': 19.86328636549376, 'bear_atr_min_pct': 0.017307618366417716, 'bear_atr_max_pct': 0.14379488052446907, 'bear_tp_mult': 1.2827528199834168, 'bear_tsl_mult': 0.31272264589586973, 'bear_time_stop': 299, 'bear_use_sma': False, 'bear_use_ema': False, 'bear_use_atr': False, 'bear_use_adx': True, 'bear_use_spike': True, 'bear_rsi_required': True, 'sideways_strategy': 'breakout', 'sideways_bb_std_mult': 2.1583545724398028, 'sideways_rsi_os': 26, 'sideways_rsi_ob': 86, 'sideways_adx_thresh': 31.860331115781072, 'sideways_atr_min_pct': 0.011007146650515255, 'sideways_atr_max_pct': 0.06285452887949766, 'sideways_tp_mult': 2.185707699753423, 'sideways_tsl_mult': 0.5662457873730593, 'sideways_time_stop': 281, 'sideways_use_sma': False, 'sideways_use_ema': True, 'sideways_use_atr': True, 'sideways_use_adx': True, 'sideways_use_spike': True, 'sideways_rsi_required': False}.
[I 2025-09-01 02:48:35,568] Trial 153 finished with values: [-1000000000.0, 1000000000.0] and parameters: {'p_sma': 36, 'p_std': 36, 'p_atr': 25, 'p_adx': 14, 'rsi_period': 51, 'ema1': 26, 'ema2': 47, 'slip_atr_k': 0.035736537928445486, 'slip_spread_k': 0.43443916110168435, 'spread_hl_frac': 0.014654993511716346, 'bb_std_mult': 1.648912097741629, 'rsi_os': 44, 'rsi_ob': 56, 'vol_spike': 0.12473395039052103, 'adx_thresh': 22.630221884939562, 'atr_min_pct': 0.02449018189403698, 'atr_max_pct': 0.023300274260280356, 'tp_mult': 2.151690591249223, 'tsl_mult': 0.19190028398657694, 'strategy': 'breakout', 'time_stop': 252, 'use_sma': False, 'use_atr': False, 'use_adx': True, 'use_ema': True, 'use_spike': True, 'rsi_required': False, 'edge_k': 0.2163840559655733, 'edge_cap': 0.4200344756056317, 'bull_strategy': 'mean_reversion', 'bull_bb_std_mult': 2.8726983041768435, 'bull_rsi_os': 18, 'bull_rsi_ob': 74, 'bull_adx_thresh': 20.707887775512127, 'bull_atr_min_pct': 0.003374761438072674, 'bull_atr_max_pct': 0.117800042212598, 'bull_tp_mult': 1.1775894496287775, 'bull_tsl_mult': 0.3094268551929845, 'bull_time_stop': 172, 'bull_use_sma': False, 'bull_use_ema': True, 'bull_use_atr': False, 'bull_use_adx': False, 'bull_use_spike': True, 'bull_rsi_required': True, 'bear_strategy': 'breakout', 'bear_bb_std_mult': 1.0519500130330228, 'bear_rsi_os': 46, 'bear_rsi_ob': 95, 'bear_adx_thresh': 20.87956448652049, 'bear_atr_min_pct': 0.01724751555327489, 'bear_atr_max_pct': 0.1451656340233041, 'bear_tp_mult': 1.1567586275615558, 'bear_tsl_mult': 0.2929406337358087, 'bear_time_stop': 36, 'bear_use_sma': False, 'bear_use_ema': False, 'bear_use_atr': False, 'bear_use_adx': False, 'bear_use_spike': True, 'bear_rsi_required': True, 'sideways_strategy': 'breakout', 'sideways_bb_std_mult': 2.1477236853667554, 'sideways_rsi_os': 21, 'sideways_rsi_ob': 75, 'sideways_adx_thresh': 31.890295123026153, 'sideways_atr_min_pct': 0.00878044168803434, 'sideways_atr_max_pct': 0.08452219597108007, 'sideways_tp_mult': 2.094502034785565, 'sideways_tsl_mult': 0.5177038346979379, 'sideways_time_stop': 281, 'sideways_use_sma': False, 'sideways_use_ema': True, 'sideways_use_atr': True, 'sideways_use_adx': True, 'sideways_use_spike': True, 'sideways_rsi_required': True}.
[I 2025-09-01 02:48:35,723] Trial 154 finished with values: [-1000000000.0, 1000000000.0] and parameters: {'p_sma': 36, 'p_std': 40, 'p_atr': 24, 'p_adx': 22, 'rsi_period': 59, 'ema1': 30, 'ema2': 34, 'slip_atr_k': 0.019160850522914403, 'slip_spread_k': 0.38676212449571024, 'spread_hl_frac': 0.014271070673069942, 'bb_std_mult': 1.7207582518492077, 'rsi_os': 44, 'rsi_ob': 59, 'vol_spike': 0.12414303010592465, 'adx_thresh': 22.89986927321747, 'atr_min_pct': 0.019731778615390022, 'atr_max_pct': 0.01449997131717185, 'tp_mult': 2.4154015702010847, 'tsl_mult': 0.10474099243746737, 'strategy': 'breakout', 'time_stop': 254, 'use_sma': False, 'use_atr': False, 'use_adx': True, 'use_ema': False, 'use_spike': True, 'rsi_required': False, 'edge_k': 0.4046968873961546, 'edge_cap': 0.44143361740424814, 'bull_strategy': 'mean_reversion', 'bull_bb_std_mult': 1.0849873484063453, 'bull_rsi_os': 17, 'bull_rsi_ob': 55, 'bull_adx_thresh': 20.972895915299503, 'bull_atr_min_pct': 0.0032872852239305703, 'bull_atr_max_pct': 0.11599785075091901, 'bull_tp_mult': 1.0520750913777226, 'bull_tsl_mult': 0.5256145572667689, 'bull_time_stop': 197, 'bull_use_sma': True, 'bull_use_ema': True, 'bull_use_atr': False, 'bull_use_adx': False, 'bull_use_spike': True, 'bull_rsi_required': True, 'bear_strategy': 'breakout', 'bear_bb_std_mult': 2.76332855351392, 'bear_rsi_os': 6, 'bear_rsi_ob': 95, 'bear_adx_thresh': 19.349776847101342, 'bear_atr_min_pct': 0.016023103275479397, 'bear_atr_max_pct': 0.1261361297977962, 'bear_tp_mult': 1.6066467764458128, 'bear_tsl_mult': 0.27677285573211396, 'bear_time_stop': 36, 'bear_use_sma': False, 'bear_use_ema': False, 'bear_use_atr': False, 'bear_use_adx': False, 'bear_use_spike': True, 'bear_rsi_required': True, 'sideways_strategy': 'breakout', 'sideways_bb_std_mult': 1.8607914119305522, 'sideways_rsi_os': 7, 'sideways_rsi_ob': 74, 'sideways_adx_thresh': 32.131042915737055, 'sideways_atr_min_pct': 0.008617598378545274, 'sideways_atr_max_pct': 0.05690112815635892, 'sideways_tp_mult': 2.0970467480020965, 'sideways_tsl_mult': 0.5281531327416914, 'sideways_time_stop': 284, 'sideways_use_sma': False, 'sideways_use_ema': True, 'sideways_use_atr': True, 'sideways_use_adx': True, 'sideways_use_spike': True, 'sideways_rsi_required': True}.
