[I 2025-09-01 03:07:26,541] Trial 272 finished with values: [-1000000000.0, 1000000000.0] and parameters: {'p_sma': 42, 'p_std': 6, 'p_atr': 27, 'p_adx': 16, 'rsi_period': 15, 'ema1': 20, 'ema2': 27, 'slip_atr_k': 0.019663384501859848, 'slip_spread_k': 0.13812882472803412, 'spread_hl_frac': 0.03128373374600101, 'bb_std_mult': 1.3477211189647138, 'rsi_os': 17, 'rsi_ob': 48, 'vol_spike': 0.002878722660671379, 'adx_thresh': 9.804107872861955, 'atr_min_pct': 0.006222224906739491, 'atr_max_pct': 0.04905973008920916, 'tp_mult': 2.5199597876865085, 'tsl_mult': 0.34614389164049053, 'strategy': 'mean_reversion', 'time_stop': 161, 'use_sma': True, 'use_atr': True, 'use_adx': True, 'use_ema': False, 'use_spike': False, 'rsi_required': True, 'edge_k': 0.0031410329693215555, 'edge_cap': 0.8568324125032382, 'bull_strategy': 'breakout', 'bull_bb_std_mult': 2.1265637597258795, 'bull_rsi_os': 12, 'bull_rsi_ob': 90, 'bull_adx_thresh': 25.445406017159907, 'bull_atr_min_pct': 0.009975570886942238, 'bull_atr_max_pct': 0.12081032921747335, 'bull_tp_mult': 1.64968083489377, 'bull_tsl_mult': 0.21776440180370873, 'bull_time_stop': 23, 'bull_use_sma': True, 'bull_use_ema': False, 'bull_use_atr': True, 'bull_use_adx': False, 'bull_use_spike': False, 'bull_rsi_required': False, 'bear_strategy': 'breakout', 'bear_bb_std_mult': 2.338739974996099, 'bear_rsi_os': 24, 'bear_rsi_ob': 72, 'bear_adx_thresh': 24.110240154618044, 'bear_atr_min_pct': 0.0056097055145835125, 'bear_atr_max_pct': 0.0311572152514187, 'bear_tp_mult': 1.1607441340198783, 'bear_tsl_mult': 0.1310965981893715, 'bear_time_stop': 57, 'bear_use_sma': False, 'bear_use_ema': False, 'bear_use_atr': False, 'bear_use_adx': False, 'bear_use_spike': False, 'bear_rsi_required': True, 'sideways_strategy': 'breakout', 'sideways_bb_std_mult': 1.920475183335268, 'sideways_rsi_os': 42, 'sideways_rsi_ob': 74, 'sideways_adx_thresh': 13.467595240778886, 'sideways_atr_min_pct': 0.028593091230090784, 'sideways_atr_max_pct': 0.02777978414434892, 'sideways_tp_mult': 1.7536787999840757, 'sideways_tsl_mult': 0.1492559206433367, 'sideways_time_stop': 138, 'sideways_use_sma': True, 'sideways_use_ema': True, 'sideways_use_atr': True, 'sideways_use_adx': False, 'sideways_use_spike': False, 'sideways_rsi_required': True}.
[I 2025-09-01 03:08:05,228] Trial 273 finished with values: [-1000000000.0, 1000000000.0] and parameters: {'p_sma': 48, 'p_std': 59, 'p_atr': 28, 'p_adx': 16, 'rsi_period': 22, 'ema1': 20, 'ema2': 36, 'slip_atr_k': 0.0234916727147505, 'slip_spread_k': 0.8526184141848722, 'spread_hl_frac': 0.02401435207708097, 'bb_std_mult': 1.2846621663590223, 'rsi_os': 17, 'rsi_ob': 93, 'vol_spike': 0.21760479413740144, 'adx_thresh': 9.588986041115511, 'atr_min_pct': 0.00913643823612912, 'atr_max_pct': 0.04891533009680857, 'tp_mult': 2.522916222207461, 'tsl_mult': 0.3916654599001788, 'strategy': 'mean_reversion', 'time_stop': 164, 'use_sma': True, 'use_atr': True, 'use_adx': True, 'use_ema': False, 'use_spike': False, 'rsi_required': True, 'edge_k': 0.006383809884081382, 'edge_cap': 0.45512029588667713, 'bull_strategy': 'breakout', 'bull_bb_std_mult': 2.1198042637112953, 'bull_rsi_os': 15, 'bull_rsi_ob': 81, 'bull_adx_thresh': 8.018244133595536, 'bull_atr_min_pct': 0.027940293635344914, 'bull_atr_max_pct': 0.11616311700058446, 'bull_tp_mult': 1.6512344552920863, 'bull_tsl_mult': 0.21657855549650368, 'bull_time_stop': 286, 'bull_use_sma': True, 'bull_use_ema': False, 'bull_use_atr': True, 'bull_use_adx': False, 'bull_use_spike': False, 'bull_rsi_required': False, 'bear_strategy': 'breakout', 'bear_bb_std_mult': 2.3676365975575395, 'bear_rsi_os': 52, 'bear_rsi_ob': 74, 'bear_adx_thresh': 34.97517082803226, 'bear_atr_min_pct': 0.027387123959878797, 'bear_atr_max_pct': 0.030369366300612054, 'bear_tp_mult': 1.1623914284899974, 'bear_tsl_mult': 0.1314581886947269, 'bear_time_stop': 288, 'bear_use_sma': False, 'bear_use_ema': False, 'bear_use_atr': False, 'bear_use_adx': False, 'bear_use_spike': False, 'bear_rsi_required': True, 'sideways_strategy': 'breakout', 'sideways_bb_std_mult': 1.8322899476138115, 'sideways_rsi_os': 42, 'sideways_rsi_ob': 59, 'sideways_adx_thresh': 8.70206400683872, 'sideways_atr_min_pct': 0.027321161442469762, 'sideways_atr_max_pct': 0.026191062468177442, 'sideways_tp_mult': 1.6897525697283513, 'sideways_tsl_mult': 0.7723409982516372, 'sideways_time_stop': 138, 'sideways_use_sma': True, 'sideways_use_ema': True, 'sideways_use_atr': True, 'sideways_use_adx': False, 'sideways_use_spike': False, 'sideways_rsi_required': True}.
[I 2025-09-01 03:08:05,615] Trial 270 finished with values: [-1000000000.0, 1000000000.0] and parameters: {'p_sma': 8, 'p_std': 5, 'p_atr': 29, 'p_adx': 17, 'rsi_period': 15, 'ema1': 20, 'ema2': 55, 'slip_atr_k': 0.019105976293421742, 'slip_spread_k': 0.7351664874836783, 'spread_hl_frac': 0.04651204790811067, 'bb_std_mult': 3.598325166387514, 'rsi_os': 32, 'rsi_ob': 79, 'vol_spike': 0.186527187858938, 'adx_thresh': 18.982733489514715, 'atr_min_pct': 0.00936458642967402, 'atr_max_pct': 0.11734001010753209, 'tp_mult': 2.6720761553996573, 'tsl_mult': 0.3500268111437153, 'strategy': 'mean_reversion', 'time_stop': 171, 'use_sma': False, 'use_atr': True, 'use_adx': True, 'use_ema': True, 'use_spike': False, 'rsi_required': True, 'edge_k': 1.3611671465464048, 'edge_cap': 0.8399681202070012, 'bull_strategy': 'breakout', 'bull_bb_std_mult': 2.4300310976191373, 'bull_rsi_os': 17, 'bull_rsi_ob': 54, 'bull_adx_thresh': 23.21037608207719, 'bull_atr_min_pct': 0.021892838924500706, 'bull_atr_max_pct': 0.10905768873892949, 'bull_tp_mult': 1.650416409853949, 'bull_tsl_mult': 0.21795997655441748, 'bull_time_stop': 284, 'bull_use_sma': True, 'bull_use_ema': False, 'bull_use_atr': True, 'bull_use_adx': False, 'bull_use_spike': True, 'bull_rsi_required': False, 'bear_strategy': 'breakout', 'bear_bb_std_mult': 2.3407282206953894, 'bear_rsi_os': 54, 'bear_rsi_ob': 75, 'bear_adx_thresh': 24.26527015297186, 'bear_atr_min_pct': 0.005314960223482544, 'bear_atr_max_pct': 0.02134926634691601, 'bear_tp_mult': 1.051827893836237, 'bear_tsl_mult': 0.5778314630351311, 'bear_time_stop': 300, 'bear_use_sma': False, 'bear_use_ema': False, 'bear_use_atr': False, 'bear_use_adx': False, 'bear_use_spike': False, 'bear_rsi_required': True, 'sideways_strategy': 'breakout', 'sideways_bb_std_mult': 1.9167911182719728, 'sideways_rsi_os': 49, 'sideways_rsi_ob': 46, 'sideways_adx_thresh': 8.424277003346756, 'sideways_atr_min_pct': 0.018649507690274267, 'sideways_atr_max_pct': 0.027542878954916895, 'sideways_tp_mult': 1.7668826338883294, 'sideways_tsl_mult': 0.14379357878137028, 'sideways_time_stop': 190, 'sideways_use_sma': True, 'sideways_use_ema': True, 'sideways_use_atr': True, 'sideways_use_adx': False, 'sideways_use_spike': False, 'sideways_rsi_required': True}.
[I 2025-09-01 03:08:05,949] Trial 271 finished with values: [-0.03234912062917117, 0.031895084246301546] and parameters: {'p_sma': 8, 'p_std': 6, 'p_atr': 27, 'p_adx': 16, 'rsi_period': 15, 'ema1': 21, 'ema2': 56, 'slip_atr_k': 0.016233703873616483, 'slip_spread_k': 0.20067882294220546, 'spread_hl_frac': 0.030573699292299188, 'bb_std_mult': 3.301201397225621, 'rsi_os': 26, 'rsi_ob': 73, 'vol_spike': 0.2171212432460305, 'adx_thresh': 9.261892076848055, 'atr_min_pct': 0.009489307023762324, 'atr_max_pct': 0.048213829332205006, 'tp_mult': 1.645981060826366, 'tsl_mult': 0.3535795373748136, 'strategy': 'mean_reversion', 'time_stop': 70, 'use_sma': True, 'use_atr': True, 'use_adx': True, 'use_ema': False, 'use_spike': False, 'rsi_required': True, 'edge_k': 1.4224348041786707, 'edge_cap': 0.4616707269580809, 'bull_strategy': 'breakout', 'bull_bb_std_mult': 2.392285753940447, 'bull_rsi_os': 17, 'bull_rsi_ob': 46, 'bull_adx_thresh': 5.892996776864662, 'bull_atr_min_pct': 0.010263933289448546, 'bull_atr_max_pct': 0.1152933615825329, 'bull_tp_mult': 1.6398672270079415, 'bull_tsl_mult': 0.23006043953084077, 'bull_time_stop': 284, 'bull_use_sma': True, 'bull_use_ema': False, 'bull_use_atr': True, 'bull_use_adx': False, 'bull_use_spike': True, 'bull_rsi_required': False, 'bear_strategy': 'breakout', 'bear_bb_std_mult': 2.35716316830281, 'bear_rsi_os': 53, 'bear_rsi_ob': 49, 'bear_adx_thresh': 22.729950133565005, 'bear_atr_min_pct': 0.0035043506225582513, 'bear_atr_max_pct': 0.07641359268828699, 'bear_tp_mult': 1.1608980714372807, 'bear_tsl_mult': 0.13108276268410748, 'bear_time_stop': 287, 'bear_use_sma': False, 'bear_use_ema': False, 'bear_use_atr': False, 'bear_use_adx': False, 'bear_use_spike': False, 'bear_rsi_required': True, 'sideways_strategy': 'breakout', 'sideways_bb_std_mult': 1.934350724942064, 'sideways_rsi_os': 42, 'sideways_rsi_ob': 79, 'sideways_adx_thresh': 8.789938565810806, 'sideways_atr_min_pct': 0.018525150354845872, 'sideways_atr_max_pct': 0.026184191766064756, 'sideways_tp_mult': 1.674602850465339, 'sideways_tsl_mult': 0.02271680365562756, 'sideways_time_stop': 138, 'sideways_use_sma': True, 'sideways_use_ema': True, 'sideways_use_atr': True, 'sideways_use_adx': False, 'sideways_use_spike': False, 'sideways_rsi_required': True}.
[I 2025-09-01 03:08:06,891] Trial 274 finished with values: [-1000000000.0, 1000000000.0] and parameters: {'p_sma': 8, 'p_std': 59, 'p_atr': 27, 'p_adx': 15, 'rsi_period': 16, 'ema1': 22, 'ema2': 57, 'slip_atr_k': 0.02376511285321526, 'slip_spread_k': 0.8557233960737106, 'spread_hl_frac': 0.03374528258696215, 'bb_std_mult': 0.7983390458811406, 'rsi_os': 25, 'rsi_ob': 73, 'vol_spike': 0.2929486336864746, 'adx_thresh': 29.873358472454644, 'atr_min_pct': 0.025483316764039986, 'atr_max_pct': 0.06066036657843808, 'tp_mult': 1.1824618967765668, 'tsl_mult': 0.39590434681780806, 'strategy': 'mean_reversion', 'time_stop': 70, 'use_sma': False, 'use_atr': False, 'use_adx': True, 'use_ema': False, 'use_spike': False, 'rsi_required': True, 'edge_k': 1.3476311894297326, 'edge_cap': 0.4558799200682978, 'bull_strategy': 'breakout', 'bull_bb_std_mult': 2.434260529146412, 'bull_rsi_os': 6, 'bull_rsi_ob': 81, 'bull_adx_thresh': 23.84588029545626, 'bull_atr_min_pct': 0.0008966618544290796, 'bull_atr_max_pct': 0.07190248351191506, 'bull_tp_mult': 1.554884072556328, 'bull_tsl_mult': 0.12918687928222283, 'bull_time_stop': 282, 'bull_use_sma': True, 'bull_use_ema': True, 'bull_use_atr': True, 'bull_use_adx': False, 'bull_use_spike': True, 'bull_rsi_required': False, 'bear_strategy': 'mean_reversion', 'bear_bb_std_mult': 2.355003617764164, 'bear_rsi_os': 52, 'bear_rsi_ob': 49, 'bear_adx_thresh': 12.291091325721569, 'bear_atr_min_pct': 0.028078874356470992, 'bear_atr_max_pct': 0.04166006179136234, 'bear_tp_mult': 1.0478021978714518, 'bear_tsl_mult': 0.6543556609522131, 'bear_time_stop': 72, 'bear_use_sma': False, 'bear_use_ema': False, 'bear_use_atr': False, 'bear_use_adx': False, 'bear_use_spike': False, 'bear_rsi_required': True, 'sideways_strategy': 'breakout', 'sideways_bb_std_mult': 1.8279479193903991, 'sideways_rsi_os': 45, 'sideways_rsi_ob': 59, 'sideways_adx_thresh': 15.632080395240235, 'sideways_atr_min_pct': 0.01865944147275778, 'sideways_atr_max_pct': 0.024502507190023993, 'sideways_tp_mult': 1.6900754491078216, 'sideways_tsl_mult': 0.22132362316727927, 'sideways_time_stop': 123, 'sideways_use_sma': True, 'sideways_use_ema': True, 'sideways_use_atr': True, 'sideways_use_adx': False, 'sideways_use_spike': False, 'sideways_rsi_required': True}.
[I 2025-09-01 03:08:07,585] Trial 276 finished with values: [-1000000000.0, 1000000000.0] and parameters: {'p_sma': 11, 'p_std': 56, 'p_atr': 14, 'p_adx': 18, 'rsi_period': 24, 'ema1': 21, 'ema2': 58, 'slip_atr_k': 0.03631388556545306, 'slip_spread_k': 0.07889579010981379, 'spread_hl_frac': 0.02980984783514256, 'bb_std_mult': 0.8836930450179927, 'rsi_os': 55, 'rsi_ob': 50, 'vol_spike': 0.20656614506745577, 'adx_thresh': 14.752868707355459, 'atr_min_pct': 0.026760270784780125, 'atr_max_pct': 0.053423625621035586, 'tp_mult': 2.675797225850675, 'tsl_mult': 0.9869790574686804, 'strategy': 'mean_reversion', 'time_stop': 147, 'use_sma': False, 'use_atr': False, 'use_adx': True, 'use_ema': False, 'use_spike': True, 'rsi_required': False, 'edge_k': 1.4180602889055494, 'edge_cap': 0.46699355868646397, 'bull_strategy': 'breakout', 'bull_bb_std_mult': 1.0859509864151762, 'bull_rsi_os': 42, 'bull_rsi_ob': 45, 'bull_adx_thresh': 13.153260243855287, 'bull_atr_min_pct': 0.0010136230444226008, 'bull_atr_max_pct': 0.07864452893804563, 'bull_tp_mult': 1.570248297798256, 'bull_tsl_mult': 0.31311703178156736, 'bull_time_stop': 11, 'bull_use_sma': True, 'bull_use_ema': True, 'bull_use_atr': False, 'bull_use_adx': False, 'bull_use_spike': True, 'bull_rsi_required': False, 'bear_strategy': 'mean_reversion', 'bear_bb_std_mult': 2.1613329985952032, 'bear_rsi_os': 51, 'bear_rsi_ob': 57, 'bear_adx_thresh': 22.96872417580823, 'bear_atr_min_pct': 0.02807020271943117, 'bear_atr_max_pct': 0.025152027927050777, 'bear_tp_mult': 1.0480818913875303, 'bear_tsl_mult': 0.6670940896746005, 'bear_time_stop': 69, 'bear_use_sma': True, 'bear_use_ema': False, 'bear_use_atr': False, 'bear_use_adx': False, 'bear_use_spike': True, 'bear_rsi_required': True, 'sideways_strategy': 'mean_reversion', 'sideways_bb_std_mult': 1.7819322015069394, 'sideways_rsi_os': 52, 'sideways_rsi_ob': 79, 'sideways_adx_thresh': 12.884591932668929, 'sideways_atr_min_pct': 0.02787602047567357, 'sideways_atr_max_pct': 0.023801373470009508, 'sideways_tp_mult': 2.7848614712394295, 'sideways_tsl_mult': 0.8222778715379853, 'sideways_time_stop': 20, 'sideways_use_sma': True, 'sideways_use_ema': True, 'sideways_use_atr': False, 'sideways_use_adx': False, 'sideways_use_spike': True, 'sideways_rsi_required': True}.
[I 2025-09-01 03:08:07,615] Trial 277 finished with values: [-1000000000.0, 1000000000.0] and parameters: {'p_sma': 39, 'p_std': 59, 'p_atr': 30, 'p_adx': 15, 'rsi_period': 9, 'ema1': 22, 'ema2': 58, 'slip_atr_k': 0.030530867169795216, 'slip_spread_k': 0.08396465525900952, 'spread_hl_frac': 0.029577690841187023, 'bb_std_mult': 3.183782270704417, 'rsi_os': 30, 'rsi_ob': 50, 'vol_spike': 0.10416096577742626, 'adx_thresh': 32.74671339404756, 'atr_min_pct': 0.008401112746517003, 'atr_max_pct': 0.060863357544393495, 'tp_mult': 1.8022459840891896, 'tsl_mult': 0.4869322671876431, 'strategy': 'mean_reversion', 'time_stop': 25, 'use_sma': False, 'use_atr': False, 'use_adx': True, 'use_ema': False, 'use_spike': True, 'rsi_required': False, 'edge_k': 0.0802850007742354, 'edge_cap': 0.29910116609697834, 'bull_strategy': 'breakout', 'bull_bb_std_mult': 1.220838621889901, 'bull_rsi_os': 36, 'bull_rsi_ob': 87, 'bull_adx_thresh': 24.11893174690274, 'bull_atr_min_pct': 0.0010450748301034799, 'bull_atr_max_pct': 0.06423616188726362, 'bull_tp_mult': 1.5667776031872473, 'bull_tsl_mult': 0.3195118794157793, 'bull_time_stop': 274, 'bull_use_sma': True, 'bull_use_ema': True, 'bull_use_atr': False, 'bull_use_adx': False, 'bull_use_spike': True, 'bull_rsi_required': False, 'bear_strategy': 'mean_reversion', 'bear_bb_std_mult': 2.1985065949879834, 'bear_rsi_os': 51, 'bear_rsi_ob': 57, 'bear_adx_thresh': 25.03215145443845, 'bear_atr_min_pct': 0.024866822162946715, 'bear_atr_max_pct': 0.06953172860269738, 'bear_tp_mult': 1.0105070155637155, 'bear_tsl_mult': 0.7421405061306472, 'bear_time_stop': 206, 'bear_use_sma': True, 'bear_use_ema': False, 'bear_use_atr': False, 'bear_use_adx': False, 'bear_use_spike': True, 'bear_rsi_required': True, 'sideways_strategy': 'mean_reversion', 'sideways_bb_std_mult': 1.7655645569621623, 'sideways_rsi_os': 51, 'sideways_rsi_ob': 95, 'sideways_adx_thresh': 18.588171291533108, 'sideways_atr_min_pct': 0.027922132656393556, 'sideways_atr_max_pct': 0.023126629866523474, 'sideways_tp_mult': 2.7815786878790525, 'sideways_tsl_mult': 0.2169938945920964, 'sideways_time_stop': 122, 'sideways_use_sma': True, 'sideways_use_ema': True, 'sideways_use_atr': False, 'sideways_use_adx': False, 'sideways_use_spike': True, 'sideways_rsi_required': True}.
[I 2025-09-01 03:08:45,943] Trial 275 finished with values: [-1000000000.0, 1000000000.0] and parameters: {'p_sma': 26, 'p_std': 59, 'p_atr': 27, 'p_adx': 18, 'rsi_period': 36, 'ema1': 21, 'ema2': 58, 'slip_atr_k': 0.034099386620282536, 'slip_spread_k': 0.08382203619507533, 'spread_hl_frac': 0.04374732766492892, 'bb_std_mult': 0.8109083789912583, 'rsi_os': 26, 'rsi_ob': 83, 'vol_spike': 0.20479896611899454, 'adx_thresh': 29.591872971807412, 'atr_min_pct': 0.008345949329455817, 'atr_max_pct': 0.10947646318858062, 'tp_mult': 2.6787931585132427, 'tsl_mult': 0.8430413122855208, 'strategy': 'mean_reversion', 'time_stop': 27, 'use_sma': False, 'use_atr': False, 'use_adx': True, 'use_ema': False, 'use_spike': True, 'rsi_required': False, 'edge_k': 1.8764999511454914, 'edge_cap': 0.46090258366090336, 'bull_strategy': 'breakout', 'bull_bb_std_mult': 1.0860602999800417, 'bull_rsi_os': 42, 'bull_rsi_ob': 45, 'bull_adx_thresh': 13.169604603410729, 'bull_atr_min_pct': 0.0008690723905660873, 'bull_atr_max_pct': 0.11536042955064615, 'bull_tp_mult': 1.5755157574873717, 'bull_tsl_mult': 0.025615392915430468, 'bull_time_stop': 250, 'bull_use_sma': True, 'bull_use_ema': True, 'bull_use_atr': False, 'bull_use_adx': False, 'bull_use_spike': True, 'bull_rsi_required': False, 'bear_strategy': 'mean_reversion', 'bear_bb_std_mult': 2.201186097226437, 'bear_rsi_os': 52, 'bear_rsi_ob': 57, 'bear_adx_thresh': 11.547938479604992, 'bear_atr_min_pct': 0.02840449750372589, 'bear_atr_max_pct': 0.02476576628922226, 'bear_tp_mult': 1.0485934558146703, 'bear_tsl_mult': 0.48859102689338235, 'bear_time_stop': 230, 'bear_use_sma': True, 'bear_use_ema': False, 'bear_use_atr': False, 'bear_use_adx': False, 'bear_use_spike': True, 'bear_rsi_required': True, 'sideways_strategy': 'mean_reversion', 'sideways_bb_std_mult': 1.668538101154976, 'sideways_rsi_os': 52, 'sideways_rsi_ob': 55, 'sideways_adx_thresh': 5.688785303089569, 'sideways_atr_min_pct': 0.0277525985585701, 'sideways_atr_max_pct': 0.13581136266031452, 'sideways_tp_mult': 2.9282095244278663, 'sideways_tsl_mult': 0.813168440095627, 'sideways_time_stop': 24, 'sideways_use_sma': True, 'sideways_use_ema': True, 'sideways_use_atr': False, 'sideways_use_adx': False, 'sideways_use_spike': True, 'sideways_rsi_required': True}.
[I 2025-09-01 03:08:46,443] Trial 278 finished with values: [-0.031830276211676445, 0.03161604830018316] and parameters: {'p_sma': 45, 'p_std': 57, 'p_atr': 11, 'p_adx': 20, 'rsi_period': 36, 'ema1': 10, 'ema2': 58, 'slip_atr_k': 0.2499046506003871, 'slip_spread_k': 0.15123975719263014, 'spread_hl_frac': 0.029522214988109467, 'bb_std_mult': 1.4634708739995237, 'rsi_os': 19, 'rsi_ob': 92, 'vol_spike': 0.10483622065385773, 'adx_thresh': 6.761758998953901, 'atr_min_pct': 0.008379026540934772, 'atr_max_pct': 0.054310426255471174, 'tp_mult': 1.8083391070791222, 'tsl_mult': 0.37397725537453924, 'strategy': 'mean_reversion', 'time_stop': 38, 'use_sma': False, 'use_atr': False, 'use_adx': True, 'use_ema': False, 'use_spike': True, 'rsi_required': False, 'edge_k': 0.08154930923414856, 'edge_cap': 0.43702012839984467, 'bull_strategy': 'breakout', 'bull_bb_std_mult': 0.8075588398271802, 'bull_rsi_os': 23, 'bull_rsi_ob': 50, 'bull_adx_thresh': 13.297366266003754, 'bull_atr_min_pct': 0.0016892516512239724, 'bull_atr_max_pct': 0.08480773786271004, 'bull_tp_mult': 1.712574895215433, 'bull_tsl_mult': 0.30660222648410157, 'bull_time_stop': 273, 'bull_use_sma': True, 'bull_use_ema': True, 'bull_use_atr': False, 'bull_use_adx': False, 'bull_use_spike': True, 'bull_rsi_required': False, 'bear_strategy': 'mean_reversion', 'bear_bb_std_mult': 2.1687518286777374, 'bear_rsi_os': 51, 'bear_rsi_ob': 57, 'bear_adx_thresh': 11.388838683007906, 'bear_atr_min_pct': 0.007743528577221505, 'bear_atr_max_pct': 0.08729068058521218, 'bear_tp_mult': 1.010087624033721, 'bear_tsl_mult': 0.68342485663137, 'bear_time_stop': 66, 'bear_use_sma': True, 'bear_use_ema': False, 'bear_use_atr': False, 'bear_use_adx': False, 'bear_use_spike': True, 'bear_rsi_required': True, 'sideways_strategy': 'mean_reversion', 'sideways_bb_std_mult': 1.6832595745202252, 'sideways_rsi_os': 51, 'sideways_rsi_ob': 88, 'sideways_adx_thresh': 5.792349440839537, 'sideways_atr_min_pct': 0.02780538802773161, 'sideways_atr_max_pct': 0.01716261432105927, 'sideways_tp_mult': 2.467861435823837, 'sideways_tsl_mult': 0.19137871842123239, 'sideways_time_stop': 101, 'sideways_use_sma': True, 'sideways_use_ema': True, 'sideways_use_atr': False, 'sideways_use_adx': False, 'sideways_use_spike': True, 'sideways_rsi_required': True}.
