[I 2025-09-01 02:58:43,053] Trial 217 finished with values: [-1000000000.0, 1000000000.0] and parameters: {'p_sma': 31, 'p_std': 59, 'p_atr': 28, 'p_adx': 16, 'rsi_period': 8, 'ema1': 20, 'ema2': 57, 'slip_atr_k': 0.019464809367994256, 'slip_spread_k': 0.13497638241767154, 'spread_hl_frac': 0.037927855530367746, 'bb_std_mult': 1.365922940164389, 'rsi_os': 19, 'rsi_ob': 84, 'vol_spike': 0.2035993248411563, 'adx_thresh': 25.431825220093806, 'atr_min_pct': 0.007825488511492805, 'atr_max_pct': 0.043059629189744736, 'tp_mult': 2.6869399508906984, 'tsl_mult': 0.37578057189368097, 'strategy': 'mean_reversion', 'time_stop': 270, 'use_sma': False, 'use_atr': False, 'use_adx': True, 'use_ema': False, 'use_spike': True, 'rsi_required': False, 'edge_k': 1.0359754956260594, 'edge_cap': 0.6884159628013793, 'bull_strategy': 'breakout', 'bull_bb_std_mult': 3.3385007881916664, 'bull_rsi_os': 16, 'bull_rsi_ob': 62, 'bull_adx_thresh': 22.382007186907884, 'bull_atr_min_pct': 0.012325622273324196, 'bull_atr_max_pct': 0.1237349726884584, 'bull_tp_mult': 2.513434440360196, 'bull_tsl_mult': 0.24883342581405782, 'bull_time_stop': 137, 'bull_use_sma': True, 'bull_use_ema': False, 'bull_use_atr': False, 'bull_use_adx': False, 'bull_use_spike': True, 'bull_rsi_required': False, 'bear_strategy': 'breakout', 'bear_bb_std_mult': 2.490585774418148, 'bear_rsi_os': 51, 'bear_rsi_ob': 61, 'bear_adx_thresh': 34.619013470180064, 'bear_atr_min_pct': 0.02164991835298992, 'bear_atr_max_pct': 0.12898487857110777, 'bear_tp_mult': 1.01288047328675, 'bear_tsl_mult': 0.08613501903542559, 'bear_time_stop': 67, 'bear_use_sma': False, 'bear_use_ema': False, 'bear_use_atr': False, 'bear_use_adx': False, 'bear_use_spike': True, 'bear_rsi_required': True, 'sideways_strategy': 'mean_reversion', 'sideways_bb_std_mult': 1.853328385315865, 'sideways_rsi_os': 16, 'sideways_rsi_ob': 75, 'sideways_adx_thresh': 28.516144769074433, 'sideways_atr_min_pct': 0.02807726521137804, 'sideways_atr_max_pct': 0.08548626941944161, 'sideways_tp_mult': 1.7216432647855884, 'sideways_tsl_mult': 0.2804520475094236, 'sideways_time_stop': 129, 'sideways_use_sma': True, 'sideways_use_ema': True, 'sideways_use_atr': True, 'sideways_use_adx': False, 'sideways_use_spike': True, 'sideways_rsi_required': True}.
[I 2025-09-01 02:58:43,053] Trial 214 finished with values: [-0.016762735783792615, 0.01667409635954047] and parameters: {'p_sma': 34, 'p_std': 60, 'p_atr': 28, 'p_adx': 17, 'rsi_period': 9, 'ema1': 20, 'ema2': 34, 'slip_atr_k': 0.011415246527310938, 'slip_spread_k': 0.139166864927425, 'spread_hl_frac': 0.02372039823241995, 'bb_std_mult': 3.2216897789961325, 'rsi_os': 19, 'rsi_ob': 87, 'vol_spike': 0.20440919355849665, 'adx_thresh': 25.92799154402803, 'atr_min_pct': 0.007934795673676664, 'atr_max_pct': 0.042119835345503544, 'tp_mult': 2.7423052397510914, 'tsl_mult': 0.3151591997637633, 'strategy': 'mean_reversion', 'time_stop': 273, 'use_sma': False, 'use_atr': False, 'use_adx': True, 'use_ema': False, 'use_spike': True, 'rsi_required': False, 'edge_k': 1.0371661416439482, 'edge_cap': 0.4419537310979977, 'bull_strategy': 'mean_reversion', 'bull_bb_std_mult': 1.1250954610006025, 'bull_rsi_os': 19, 'bull_rsi_ob': 62, 'bull_adx_thresh': 23.652102856777734, 'bull_atr_min_pct': 0.0001648880248915699, 'bull_atr_max_pct': 0.12287364234897764, 'bull_tp_mult': 1.5475042412451958, 'bull_tsl_mult': 0.49131358178831086, 'bull_time_stop': 145, 'bull_use_sma': True, 'bull_use_ema': False, 'bull_use_atr': False, 'bull_use_adx': False, 'bull_use_spike': False, 'bull_rsi_required': False, 'bear_strategy': 'mean_reversion', 'bear_bb_std_mult': 2.387955027886775, 'bear_rsi_os': 5, 'bear_rsi_ob': 61, 'bear_adx_thresh': 23.802401944125503, 'bear_atr_min_pct': 0.018900411292534974, 'bear_atr_max_pct': 0.022028655905697574, 'bear_tp_mult': 1.011268324001634, 'bear_tsl_mult': 0.0834025242820224, 'bear_time_stop': 67, 'bear_use_sma': False, 'bear_use_ema': False, 'bear_use_atr': False, 'bear_use_adx': False, 'bear_use_spike': True, 'bear_rsi_required': True, 'sideways_strategy': 'mean_reversion', 'sideways_bb_std_mult': 1.946203248206563, 'sideways_rsi_os': 43, 'sideways_rsi_ob': 75, 'sideways_adx_thresh': 16.679381710269126, 'sideways_atr_min_pct': 0.02615941632519079, 'sideways_atr_max_pct': 0.14968017628108593, 'sideways_tp_mult': 1.9031949217096773, 'sideways_tsl_mult': 0.28367899535963725, 'sideways_time_stop': 113, 'sideways_use_sma': True, 'sideways_use_ema': True, 'sideways_use_atr': False, 'sideways_use_adx': False, 'sideways_use_spike': True, 'sideways_rsi_required': True}.
[I 2025-09-01 02:58:43,849] Trial 220 finished with values: [-1000000000.0, 1000000000.0] and parameters: {'p_sma': 60, 'p_std': 58, 'p_atr': 30, 'p_adx': 15, 'rsi_period': 12, 'ema1': 21, 'ema2': 57, 'slip_atr_k': 0.017178824633568294, 'slip_spread_k': 0.34251231497142115, 'spread_hl_frac': 0.04819775584142516, 'bb_std_mult': 3.4314767372450565, 'rsi_os': 53, 'rsi_ob': 85, 'vol_spike': 0.22637444442249005, 'adx_thresh': 5.350311640014178, 'atr_min_pct': 0.00922185858731091, 'atr_max_pct': 0.05056258302421959, 'tp_mult': 2.599292005199013, 'tsl_mult': 0.26637359301346947, 'strategy': 'mean_reversion', 'time_stop': 183, 'use_sma': True, 'use_atr': True, 'use_adx': True, 'use_ema': True, 'use_spike': True, 'rsi_required': False, 'edge_k': 0.31726245648605894, 'edge_cap': 0.45993161708228425, 'bull_strategy': 'breakout', 'bull_bb_std_mult': 1.1210379058380615, 'bull_rsi_os': 16, 'bull_rsi_ob': 55, 'bull_adx_thresh': 23.20581709252878, 'bull_atr_min_pct': 0.0071381511712390235, 'bull_atr_max_pct': 0.12989728684768465, 'bull_tp_mult': 2.015399951894658, 'bull_tsl_mult': 0.48951290798665753, 'bull_time_stop': 116, 'bull_use_sma': True, 'bull_use_ema': False, 'bull_use_atr': False, 'bull_use_adx': False, 'bull_use_spike': True, 'bull_rsi_required': False, 'bear_strategy': 'breakout', 'bear_bb_std_mult': 2.4000408062271026, 'bear_rsi_os': 38, 'bear_rsi_ob': 63, 'bear_adx_thresh': 23.02744807043636, 'bear_atr_min_pct': 0.020221083497773247, 'bear_atr_max_pct': 0.024522229543593704, 'bear_tp_mult': 1.9684080234486965, 'bear_tsl_mult': 0.14850660438572766, 'bear_time_stop': 69, 'bear_use_sma': True, 'bear_use_ema': False, 'bear_use_atr': True, 'bear_use_adx': False, 'bear_use_spike': True, 'bear_rsi_required': True, 'sideways_strategy': 'breakout', 'sideways_bb_std_mult': 0.7406251991295332, 'sideways_rsi_os': 17, 'sideways_rsi_ob': 75, 'sideways_adx_thresh': 34.70636477693026, 'sideways_atr_min_pct': 0.027436440208217783, 'sideways_atr_max_pct': 0.14865891549165167, 'sideways_tp_mult': 1.9530334846432746, 'sideways_tsl_mult': 0.18634601117559085, 'sideways_time_stop': 124, 'sideways_use_sma': True, 'sideways_use_ema': False, 'sideways_use_atr': True, 'sideways_use_adx': False, 'sideways_use_spike': True, 'sideways_rsi_required': True}.
[I 2025-09-01 02:59:22,898] Trial 218 finished with values: [-1000000000.0, 1000000000.0] and parameters: {'p_sma': 31, 'p_std': 59, 'p_atr': 28, 'p_adx': 17, 'rsi_period': 12, 'ema1': 21, 'ema2': 57, 'slip_atr_k': 0.017321976898519578, 'slip_spread_k': 0.13140170284613573, 'spread_hl_frac': 0.027847272148488075, 'bb_std_mult': 1.4660034650387428, 'rsi_os': 21, 'rsi_ob': 84, 'vol_spike': 0.1996812983023251, 'adx_thresh': 27.485801982461258, 'atr_min_pct': 0.007840448728562089, 'atr_max_pct': 0.05056374292331486, 'tp_mult': 2.739238526555644, 'tsl_mult': 0.9107293259542661, 'strategy': 'mean_reversion', 'time_stop': 166, 'use_sma': False, 'use_atr': False, 'use_adx': True, 'use_ema': False, 'use_spike': True, 'rsi_required': False, 'edge_k': 0.09165375050099478, 'edge_cap': 0.7526296530807609, 'bull_strategy': 'breakout', 'bull_bb_std_mult': 2.1814919501229024, 'bull_rsi_os': 16, 'bull_rsi_ob': 73, 'bull_adx_thresh': 23.45381485181139, 'bull_atr_min_pct': 0.012551143824325244, 'bull_atr_max_pct': 0.1303512793082204, 'bull_tp_mult': 1.5546235567991282, 'bull_tsl_mult': 0.6725198225202336, 'bull_time_stop': 118, 'bull_use_sma': True, 'bull_use_ema': False, 'bull_use_atr': False, 'bull_use_adx': False, 'bull_use_spike': True, 'bull_rsi_required': False, 'bear_strategy': 'mean_reversion', 'bear_bb_std_mult': 2.283281173926687, 'bear_rsi_os': 53, 'bear_rsi_ob': 63, 'bear_adx_thresh': 24.203989020635547, 'bear_atr_min_pct': 0.021183791154655116, 'bear_atr_max_pct': 0.014857764418380617, 'bear_tp_mult': 1.0806117471150627, 'bear_tsl_mult': 0.13572847276954303, 'bear_time_stop': 70, 'bear_use_sma': False, 'bear_use_ema': False, 'bear_use_atr': False, 'bear_use_adx': False, 'bear_use_spike': True, 'bear_rsi_required': True, 'sideways_strategy': 'breakout', 'sideways_bb_std_mult': 1.881333432312393, 'sideways_rsi_os': 16, 'sideways_rsi_ob': 76, 'sideways_adx_thresh': 28.598571422312553, 'sideways_atr_min_pct': 0.027655579378468097, 'sideways_atr_max_pct': 0.02348913434449222, 'sideways_tp_mult': 1.9358952089331904, 'sideways_tsl_mult': 0.2830809037425402, 'sideways_time_stop': 128, 'sideways_use_sma': True, 'sideways_use_ema': True, 'sideways_use_atr': False, 'sideways_use_adx': False, 'sideways_use_spike': True, 'sideways_rsi_required': True}.
[I 2025-09-01 02:59:23,476] Trial 221 finished with values: [-1000000000.0, 1000000000.0] and parameters: {'p_sma': 59, 'p_std': 58, 'p_atr': 30, 'p_adx': 15, 'rsi_period': 12, 'ema1': 21, 'ema2': 39, 'slip_atr_k': 0.01894088480552644, 'slip_spread_k': 0.9763209664996029, 'spread_hl_frac': 0.011655308102792333, 'bb_std_mult': 1.4725122950392417, 'rsi_os': 21, 'rsi_ob': 85, 'vol_spike': 0.19853409132828242, 'adx_thresh': 26.872081222901276, 'atr_min_pct': 0.0051530433944584324, 'atr_max_pct': 0.05137815130076696, 'tp_mult': 2.7436598196038333, 'tsl_mult': 0.2818184321257048, 'strategy': 'mean_reversion', 'time_stop': 217, 'use_sma': True, 'use_atr': True, 'use_adx': True, 'use_ema': True, 'use_spike': True, 'rsi_required': False, 'edge_k': 0.4570768159276413, 'edge_cap': 0.45865110278789967, 'bull_strategy': 'breakout', 'bull_bb_std_mult': 2.2253118595319594, 'bull_rsi_os': 16, 'bull_rsi_ob': 53, 'bull_adx_thresh': 23.45361407065093, 'bull_atr_min_pct': 0.0021045500959869234, 'bull_atr_max_pct': 0.0793709161957566, 'bull_tp_mult': 1.6405606765836287, 'bull_tsl_mult': 0.18347489840475928, 'bull_time_stop': 119, 'bull_use_sma': True, 'bull_use_ema': False, 'bull_use_atr': False, 'bull_use_adx': False, 'bull_use_spike': True, 'bull_rsi_required': False, 'bear_strategy': 'breakout', 'bear_bb_std_mult': 1.8456382404380376, 'bear_rsi_os': 31, 'bear_rsi_ob': 63, 'bear_adx_thresh': 22.875197745598534, 'bear_atr_min_pct': 0.020398206630686967, 'bear_atr_max_pct': 0.02397922836002011, 'bear_tp_mult': 1.0929096392624995, 'bear_tsl_mult': 0.13921126199080983, 'bear_time_stop': 71, 'bear_use_sma': True, 'bear_use_ema': False, 'bear_use_atr': True, 'bear_use_adx': False, 'bear_use_spike': True, 'bear_rsi_required': True, 'sideways_strategy': 'breakout', 'sideways_bb_std_mult': 0.7845244008509962, 'sideways_rsi_os': 50, 'sideways_rsi_ob': 51, 'sideways_adx_thresh': 16.577754195042395, 'sideways_atr_min_pct': 0.028933900921691035, 'sideways_atr_max_pct': 0.09867883719640055, 'sideways_tp_mult': 1.2935155948679826, 'sideways_tsl_mult': 0.1960368729615246, 'sideways_time_stop': 137, 'sideways_use_sma': True, 'sideways_use_ema': False, 'sideways_use_atr': True, 'sideways_use_adx': False, 'sideways_use_spike': True, 'sideways_rsi_required': True}.
[I 2025-09-01 02:59:24,158] Trial 219 finished with values: [-0.015911172110326333, 0.01582494186761548] and parameters: {'p_sma': 31, 'p_std': 58, 'p_atr': 28, 'p_adx': 17, 'rsi_period': 12, 'ema1': 21, 'ema2': 57, 'slip_atr_k': 0.020014140323284267, 'slip_spread_k': 0.14246876556248517, 'spread_hl_frac': 0.0281825516721738, 'bb_std_mult': 1.4617609547593904, 'rsi_os': 21, 'rsi_ob': 84, 'vol_spike': 0.2148438210988168, 'adx_thresh': 11.549079033311731, 'atr_min_pct': 0.007765179128789294, 'atr_max_pct': 0.05081856569441211, 'tp_mult': 2.6840671453438674, 'tsl_mult': 0.3755058859665295, 'strategy': 'mean_reversion', 'time_stop': 169, 'use_sma': False, 'use_atr': False, 'use_adx': True, 'use_ema': False, 'use_spike': True, 'rsi_required': False, 'edge_k': 0.06587180490968958, 'edge_cap': 0.45608430615543843, 'bull_strategy': 'breakout', 'bull_bb_std_mult': 1.1235290957217121, 'bull_rsi_os': 16, 'bull_rsi_ob': 53, 'bull_adx_thresh': 23.386902083822342, 'bull_atr_min_pct': 0.0011619013731570514, 'bull_atr_max_pct': 0.117296266691668, 'bull_tp_mult': 1.6380500945277794, 'bull_tsl_mult': 0.251375025260704, 'bull_time_stop': 282, 'bull_use_sma': True, 'bull_use_ema': False, 'bull_use_atr': False, 'bull_use_adx': False, 'bull_use_spike': True, 'bull_rsi_required': False, 'bear_strategy': 'breakout', 'bear_bb_std_mult': 2.285148756611737, 'bear_rsi_os': 52, 'bear_rsi_ob': 59, 'bear_adx_thresh': 24.382669821734282, 'bear_atr_min_pct': 0.02727073348251169, 'bear_atr_max_pct': 0.02565692628995632, 'bear_tp_mult': 1.0124928186041324, 'bear_tsl_mult': 0.13561582994913168, 'bear_time_stop': 67, 'bear_use_sma': False, 'bear_use_ema': False, 'bear_use_atr': False, 'bear_use_adx': False, 'bear_use_spike': True, 'bear_rsi_required': True, 'sideways_strategy': 'breakout', 'sideways_bb_std_mult': 1.8645661728241025, 'sideways_rsi_os': 48, 'sideways_rsi_ob': 75, 'sideways_adx_thresh': 28.81938312962813, 'sideways_atr_min_pct': 0.027585645159605002, 'sideways_atr_max_pct': 0.023760750185526362, 'sideways_tp_mult': 1.7010889706012589, 'sideways_tsl_mult': 0.1950728080475687, 'sideways_time_stop': 126, 'sideways_use_sma': True, 'sideways_use_ema': True, 'sideways_use_atr': True, 'sideways_use_adx': False, 'sideways_use_spike': True, 'sideways_rsi_required': True}.
[I 2025-09-01 02:59:24,277] Trial 222 finished with values: [-1000000000.0, 1000000000.0] and parameters: {'p_sma': 30, 'p_std': 57, 'p_atr': 28, 'p_adx': 17, 'rsi_period': 11, 'ema1': 21, 'ema2': 58, 'slip_atr_k': 0.021506487077563877, 'slip_spread_k': 0.6295334679352119, 'spread_hl_frac': 0.024259591650519184, 'bb_std_mult': 1.463529218727726, 'rsi_os': 22, 'rsi_ob': 83, 'vol_spike': 0.19690278690729318, 'adx_thresh': 26.970142155548352, 'atr_min_pct': 0.00515545433813294, 'atr_max_pct': 0.04486223986462442, 'tp_mult': 2.753312232988264, 'tsl_mult': 0.8933829822681666, 'strategy': 'mean_reversion', 'time_stop': 213, 'use_sma': False, 'use_atr': False, 'use_adx': True, 'use_ema': False, 'use_spike': True, 'rsi_required': False, 'edge_k': 0.4609695484982724, 'edge_cap': 0.42064450861253533, 'bull_strategy': 'mean_reversion', 'bull_bb_std_mult': 0.6681433515277608, 'bull_rsi_os': 18, 'bull_rsi_ob': 53, 'bull_adx_thresh': 23.453561343340418, 'bull_atr_min_pct': 0.002018123192188877, 'bull_atr_max_pct': 0.04445360269304878, 'bull_tp_mult': 2.7191233068207636, 'bull_tsl_mult': 0.5467775794058282, 'bull_time_stop': 130, 'bull_use_sma': True, 'bull_use_ema': False, 'bull_use_atr': False, 'bull_use_adx': False, 'bull_use_spike': True, 'bull_rsi_required': False, 'bear_strategy': 'mean_reversion', 'bear_bb_std_mult': 1.714634184464384, 'bear_rsi_os': 53, 'bear_rsi_ob': 63, 'bear_adx_thresh': 23.23897415543484, 'bear_atr_min_pct': 0.019057691892091354, 'bear_atr_max_pct': 0.01466299929642026, 'bear_tp_mult': 1.0681953913730062, 'bear_tsl_mult': 0.037292738916730656, 'bear_time_stop': 98, 'bear_use_sma': False, 'bear_use_ema': False, 'bear_use_atr': False, 'bear_use_adx': False, 'bear_use_spike': False, 'bear_rsi_required': True, 'sideways_strategy': 'breakout', 'sideways_bb_std_mult': 1.8839255050146666, 'sideways_rsi_os': 19, 'sideways_rsi_ob': 50, 'sideways_adx_thresh': 16.175438261410157, 'sideways_atr_min_pct': 0.028961321018544525, 'sideways_atr_max_pct': 0.08246073495379085, 'sideways_tp_mult': 1.1029386724515164, 'sideways_tsl_mult': 0.3179999853664977, 'sideways_time_stop': 105, 'sideways_use_sma': True, 'sideways_use_ema': True, 'sideways_use_atr': False, 'sideways_use_adx': False, 'sideways_use_spike': True, 'sideways_rsi_required': True}.
[I 2025-09-01 02:59:24,880] Trial 223 finished with values: [-1000000000.0, 1000000000.0] and parameters: {'p_sma': 29, 'p_std': 57, 'p_atr': 29, 'p_adx': 19, 'rsi_period': 10, 'ema1': 21, 'ema2': 58, 'slip_atr_k': 0.02209757106455268, 'slip_spread_k': 0.6699376483982613, 'spread_hl_frac': 0.042233592511268334, 'bb_std_mult': 2.8976648205351547, 'rsi_os': 51, 'rsi_ob': 88, 'vol_spike': 0.21549334840167855, 'adx_thresh': 25.167939115360422, 'atr_min_pct': 0.010077159067890145, 'atr_max_pct': 0.1191063979293878, 'tp_mult': 2.729842456480973, 'tsl_mult': 0.29341158886080215, 'strategy': 'mean_reversion', 'time_stop': 218, 'use_sma': True, 'use_atr': False, 'use_adx': True, 'use_ema': False, 'use_spike': False, 'rsi_required': True, 'edge_k': 0.476825457062244, 'edge_cap': 0.42488841772248626, 'bull_strategy': 'mean_reversion', 'bull_bb_std_mult': 1.2530819921399339, 'bull_rsi_os': 18, 'bull_rsi_ob': 60, 'bull_adx_thresh': 23.60683188755538, 'bull_atr_min_pct': 0.0020602106653039754, 'bull_atr_max_pct': 0.06941737056263417, 'bull_tp_mult': 1.0523750539387178, 'bull_tsl_mult': 0.5447359803477638, 'bull_time_stop': 129, 'bull_use_sma': True, 'bull_use_ema': False, 'bull_use_atr': True, 'bull_use_adx': True, 'bull_use_spike': True, 'bull_rsi_required': False, 'bear_strategy': 'breakout', 'bear_bb_std_mult': 1.836180433615911, 'bear_rsi_os': 9, 'bear_rsi_ob': 59, 'bear_adx_thresh': 24.49333938244, 'bear_atr_min_pct': 0.019052829627119957, 'bear_atr_max_pct': 0.13838091237131417, 'bear_tp_mult': 1.0873005748836744, 'bear_tsl_mult': 0.03418460900464598, 'bear_time_stop': 64, 'bear_use_sma': False, 'bear_use_ema': False, 'bear_use_atr': False, 'bear_use_adx': False, 'bear_use_spike': False, 'bear_rsi_required': False, 'sideways_strategy': 'breakout', 'sideways_bb_std_mult': 1.5826902714050926, 'sideways_rsi_os': 19, 'sideways_rsi_ob': 75, 'sideways_adx_thresh': 16.52547763354002, 'sideways_atr_min_pct': 0.028981140732090325, 'sideways_atr_max_pct': 0.08173809503744751, 'sideways_tp_mult': 1.1204009103822228, 'sideways_tsl_mult': 0.19372498231070215, 'sideways_time_stop': 104, 'sideways_use_sma': True, 'sideways_use_ema': True, 'sideways_use_atr': True, 'sideways_use_adx': False, 'sideways_use_spike': False, 'sideways_rsi_required': True}.
[I 2025-09-01 03:00:06,337] Trial 225 finished with values: [-1000000000.0, 1000000000.0] and parameters: {'p_sma': 24, 'p_std': 57, 'p_atr': 29, 'p_adx': 19, 'rsi_period': 14, 'ema1': 15, 'ema2': 30, 'slip_atr_k': 0.025938537418163893, 'slip_spread_k': 0.1457057877053248, 'spread_hl_frac': 0.029362771079586403, 'bb_std_mult': 1.3261766397895498, 'rsi_os': 23, 'rsi_ob': 75, 'vol_spike': 0.2100326033127932, 'adx_thresh': 11.53918035225482, 'atr_min_pct': 0.007226219859250258, 'atr_max_pct': 0.057326089553657575, 'tp_mult': 2.678839511595141, 'tsl_mult': 0.41204627084012196, 'strategy': 'mean_reversion', 'time_stop': 160, 'use_sma': False, 'use_atr': False, 'use_adx': True, 'use_ema': False, 'use_spike': False, 'rsi_required': True, 'edge_k': 0.06400518664698446, 'edge_cap': 0.7809008398198152, 'bull_strategy': 'breakout', 'bull_bb_std_mult': 1.0364670453982943, 'bull_rsi_os': 15, 'bull_rsi_ob': 52, 'bull_adx_thresh': 23.89368786402373, 'bull_atr_min_pct': 0.0008734263688490898, 'bull_atr_max_pct': 0.11335453920955733, 'bull_tp_mult': 1.682423745197451, 'bull_tsl_mult': 0.2720560719998809, 'bull_time_stop': 271, 'bull_use_sma': True, 'bull_use_ema': True, 'bull_use_atr': True, 'bull_use_adx': True, 'bull_use_spike': False, 'bull_rsi_required': False, 'bear_strategy': 'breakout', 'bear_bb_std_mult': 2.1763672505644216, 'bear_rsi_os': 52, 'bear_rsi_ob': 58, 'bear_adx_thresh': 9.785645487619437, 'bear_atr_min_pct': 0.02771966534372625, 'bear_atr_max_pct': 0.031107447588828954, 'bear_tp_mult': 1.0125750379032772, 'bear_tsl_mult': 0.16763033248721834, 'bear_time_stop': 79, 'bear_use_sma': False, 'bear_use_ema': False, 'bear_use_atr': False, 'bear_use_adx': False, 'bear_use_spike': False, 'bear_rsi_required': False, 'sideways_strategy': 'breakout', 'sideways_bb_std_mult': 0.503592516556135, 'sideways_rsi_os': 46, 'sideways_rsi_ob': 57, 'sideways_adx_thresh': 25.03964401534143, 'sideways_atr_min_pct': 0.02553010990021828, 'sideways_atr_max_pct': 0.025462764046818957, 'sideways_tp_mult': 1.6910138643352672, 'sideways_tsl_mult': 0.15747355347030245, 'sideways_time_stop': 135, 'sideways_use_sma': True, 'sideways_use_ema': True, 'sideways_use_atr': True, 'sideways_use_adx': False, 'sideways_use_spike': False, 'sideways_rsi_required': True}.
