[I 2025-09-01 04:00:34,882] Trial 577 finished with values: [-1000000000.0, 1000000000.0] and parameters: {'p_sma': 20, 'p_std': 55, 'p_atr': 17, 'p_adx': 14, 'rsi_period': 61, 'ema1': 13, 'ema2': 52, 'slip_atr_k': 0.14128681065873333, 'slip_spread_k': 0.05480134537678151, 'spread_hl_frac': 0.04496780928396548, 'bb_std_mult': 2.4864737518468396, 'rsi_os': 42, 'rsi_ob': 78, 'vol_spike': 0.02647019316097085, 'adx_thresh': 34.800801110768454, 'atr_min_pct': 0.022347072356485934, 'atr_max_pct': 0.12627643947143968, 'tp_mult': 1.6262411515503674, 'tsl_mult': 0.9691185159976383, 'strategy': 'breakout', 'time_stop': 73, 'use_sma': True, 'use_atr': False, 'use_adx': False, 'use_ema': True, 'use_spike': False, 'rsi_required': True, 'edge_k': 0.7987165371837525, 'edge_cap': 0.22900010334671358, 'bull_strategy': 'mean_reversion', 'bull_bb_std_mult': 0.7121017325501001, 'bull_rsi_os': 5, 'bull_rsi_ob': 77, 'bull_adx_thresh': 8.486042172168133, 'bull_atr_min_pct': 0.013180336025359838, 'bull_atr_max_pct': 0.09827596803651534, 'bull_tp_mult': 1.5527355816308284, 'bull_tsl_mult': 0.7235792981609194, 'bull_time_stop': 195, 'bull_use_sma': False, 'bull_use_ema': True, 'bull_use_atr': True, 'bull_use_adx': True, 'bull_use_spike': False, 'bull_rsi_required': True, 'bear_strategy': 'mean_reversion', 'bear_bb_std_mult': 3.411369074749247, 'bear_rsi_os': 46, 'bear_rsi_ob': 71, 'bear_adx_thresh': 31.25575312860304, 'bear_atr_min_pct': 0.009304300702658407, 'bear_atr_max_pct': 0.051541028561043596, 'bear_tp_mult': 2.9983433682737672, 'bear_tsl_mult': 0.8695526416446875, 'bear_time_stop': 282, 'bear_use_sma': True, 'bear_use_ema': True, 'bear_use_atr': True, 'bear_use_adx': True, 'bear_use_spike': True, 'bear_rsi_required': False, 'sideways_strategy': 'mean_reversion', 'sideways_bb_std_mult': 3.4889760240468934, 'sideways_rsi_os': 25, 'sideways_rsi_ob': 58, 'sideways_adx_thresh': 30.28191451355692, 'sideways_atr_min_pct': 0.022397219679669556, 'sideways_atr_max_pct': 0.11138787528386179, 'sideways_tp_mult': 2.004195059991763, 'sideways_tsl_mult': 0.7392352986911991, 'sideways_time_stop': 165, 'sideways_use_sma': False, 'sideways_use_ema': False, 'sideways_use_atr': False, 'sideways_use_adx': False, 'sideways_use_spike': False, 'sideways_rsi_required': False}.
[I 2025-09-01 04:00:35,966] Trial 578 finished with values: [-1000000000.0, 1000000000.0] and parameters: {'p_sma': 20, 'p_std': 55, 'p_atr': 26, 'p_adx': 14, 'rsi_period': 11, 'ema1': 13, 'ema2': 52, 'slip_atr_k': 0.14290134958567027, 'slip_spread_k': 0.0745384602246108, 'spread_hl_frac': 0.044496430913394475, 'bb_std_mult': 2.3774461609828226, 'rsi_os': 41, 'rsi_ob': 78, 'vol_spike': 0.19344149627278331, 'adx_thresh': 15.034060892305302, 'atr_min_pct': 0.028447977833129377, 'atr_max_pct': 0.1241447519598852, 'tp_mult': 1.4383942300052086, 'tsl_mult': 0.33278818648072245, 'strategy': 'breakout', 'time_stop': 81, 'use_sma': True, 'use_atr': False, 'use_adx': False, 'use_ema': True, 'use_spike': False, 'rsi_required': True, 'edge_k': 0.20631667163482822, 'edge_cap': 0.2290649465974672, 'bull_strategy': 'mean_reversion', 'bull_bb_std_mult': 2.674440757825651, 'bull_rsi_os': 5, 'bull_rsi_ob': 77, 'bull_adx_thresh': 10.42375545051997, 'bull_atr_min_pct': 0.012985462134756572, 'bull_atr_max_pct': 0.11102009975875732, 'bull_tp_mult': 1.5562520606233041, 'bull_tsl_mult': 0.06843745454707811, 'bull_time_stop': 139, 'bull_use_sma': False, 'bull_use_ema': True, 'bull_use_atr': True, 'bull_use_adx': True, 'bull_use_spike': False, 'bull_rsi_required': True, 'bear_strategy': 'mean_reversion', 'bear_bb_std_mult': 3.4020051748102427, 'bear_rsi_os': 44, 'bear_rsi_ob': 71, 'bear_adx_thresh': 32.221110502741, 'bear_atr_min_pct': 0.009096239383211939, 'bear_atr_max_pct': 0.051167760508884594, 'bear_tp_mult': 2.8566071295099187, 'bear_tsl_mult': 0.4895986971728481, 'bear_time_stop': 282, 'bear_use_sma': True, 'bear_use_ema': True, 'bear_use_atr': True, 'bear_use_adx': True, 'bear_use_spike': True, 'bear_rsi_required': False, 'sideways_strategy': 'mean_reversion', 'sideways_bb_std_mult': 3.485205410217109, 'sideways_rsi_os': 5, 'sideways_rsi_ob': 63, 'sideways_adx_thresh': 30.54569079922729, 'sideways_atr_min_pct': 0.023802792457871255, 'sideways_atr_max_pct': 0.1056040252877549, 'sideways_tp_mult': 1.9986385333460661, 'sideways_tsl_mult': 0.7482928642203955, 'sideways_time_stop': 165, 'sideways_use_sma': False, 'sideways_use_ema': False, 'sideways_use_atr': False, 'sideways_use_adx': False, 'sideways_use_spike': False, 'sideways_rsi_required': False}.
[I 2025-09-01 04:00:35,971] Trial 576 finished with values: [-1000000000.0, 1000000000.0] and parameters: {'p_sma': 19, 'p_std': 39, 'p_atr': 26, 'p_adx': 8, 'rsi_period': 76, 'ema1': 13, 'ema2': 54, 'slip_atr_k': 0.14200062271603545, 'slip_spread_k': 0.05367642362773848, 'spread_hl_frac': 0.04370728748175962, 'bb_std_mult': 2.2475965486000318, 'rsi_os': 42, 'rsi_ob': 79, 'vol_spike': 0.1954149904699949, 'adx_thresh': 15.17138738741794, 'atr_min_pct': 0.012049056530863257, 'atr_max_pct': 0.039763471247719645, 'tp_mult': 1.452196534202328, 'tsl_mult': 0.08824440846011194, 'strategy': 'mean_reversion', 'time_stop': 82, 'use_sma': True, 'use_atr': True, 'use_adx': False, 'use_ema': True, 'use_spike': False, 'rsi_required': True, 'edge_k': 0.2206959898932614, 'edge_cap': 0.2257543202562012, 'bull_strategy': 'mean_reversion', 'bull_bb_std_mult': 0.7070276845321589, 'bull_rsi_os': 5, 'bull_rsi_ob': 79, 'bull_adx_thresh': 8.44756992167769, 'bull_atr_min_pct': 0.0015857321785761576, 'bull_atr_max_pct': 0.04199608139191672, 'bull_tp_mult': 2.8607783763862975, 'bull_tsl_mult': 0.22480077036763246, 'bull_time_stop': 287, 'bull_use_sma': False, 'bull_use_ema': False, 'bull_use_atr': True, 'bull_use_adx': True, 'bull_use_spike': False, 'bull_rsi_required': True, 'bear_strategy': 'mean_reversion', 'bear_bb_std_mult': 3.2955696329129194, 'bear_rsi_os': 44, 'bear_rsi_ob': 71, 'bear_adx_thresh': 31.064100064392694, 'bear_atr_min_pct': 0.008024976147736044, 'bear_atr_max_pct': 0.05581032326751095, 'bear_tp_mult': 2.9938246923280443, 'bear_tsl_mult': 0.03930705416803343, 'bear_time_stop': 284, 'bear_use_sma': True, 'bear_use_ema': True, 'bear_use_atr': True, 'bear_use_adx': True, 'bear_use_spike': False, 'bear_rsi_required': False, 'sideways_strategy': 'breakout', 'sideways_bb_std_mult': 3.3610935402185205, 'sideways_rsi_os': 12, 'sideways_rsi_ob': 60, 'sideways_adx_thresh': 31.956736456438268, 'sideways_atr_min_pct': 0.023534953006168827, 'sideways_atr_max_pct': 0.09556821636068594, 'sideways_tp_mult': 1.8431810935399948, 'sideways_tsl_mult': 0.747497928624113, 'sideways_time_stop': 150, 'sideways_use_sma': False, 'sideways_use_ema': False, 'sideways_use_atr': False, 'sideways_use_adx': False, 'sideways_use_spike': False, 'sideways_rsi_required': False}.
[I 2025-09-01 04:00:36,394] Trial 579 finished with values: [-1000000000.0, 1000000000.0] and parameters: {'p_sma': 16, 'p_std': 55, 'p_atr': 26, 'p_adx': 8, 'rsi_period': 61, 'ema1': 15, 'ema2': 52, 'slip_atr_k': 0.005216593265303023, 'slip_spread_k': 0.020463628012398143, 'spread_hl_frac': 0.04984967186780217, 'bb_std_mult': 2.398473352618396, 'rsi_os': 41, 'rsi_ob': 82, 'vol_spike': 0.19318257757273236, 'adx_thresh': 14.958287828182478, 'atr_min_pct': 0.012162174254129509, 'atr_max_pct': 0.12907875732178642, 'tp_mult': 1.5994521939622837, 'tsl_mult': 0.08537681929293273, 'strategy': 'breakout', 'time_stop': 82, 'use_sma': True, 'use_atr': False, 'use_adx': False, 'use_ema': True, 'use_spike': False, 'rsi_required': True, 'edge_k': 0.2249480594965172, 'edge_cap': 0.22690806308518677, 'bull_strategy': 'mean_reversion', 'bull_bb_std_mult': 2.1451500259991723, 'bull_rsi_os': 5, 'bull_rsi_ob': 77, 'bull_adx_thresh': 8.683720392179236, 'bull_atr_min_pct': 0.0015192380160935768, 'bull_atr_max_pct': 0.04888772707605453, 'bull_tp_mult': 1.564856233091535, 'bull_tsl_mult': 0.7863137319953806, 'bull_time_stop': 11, 'bull_use_sma': False, 'bull_use_ema': True, 'bull_use_atr': True, 'bull_use_adx': True, 'bull_use_spike': False, 'bull_rsi_required': True, 'bear_strategy': 'mean_reversion', 'bear_bb_std_mult': 3.399774931363006, 'bear_rsi_os': 44, 'bear_rsi_ob': 71, 'bear_adx_thresh': 30.870758365028834, 'bear_atr_min_pct': 0.008029947552835943, 'bear_atr_max_pct': 0.050383733840519355, 'bear_tp_mult': 2.997852569024852, 'bear_tsl_mult': 0.43777953373161793, 'bear_time_stop': 283, 'bear_use_sma': True, 'bear_use_ema': True, 'bear_use_atr': True, 'bear_use_adx': True, 'bear_use_spike': True, 'bear_rsi_required': False, 'sideways_strategy': 'mean_reversion', 'sideways_bb_std_mult': 3.4911407886917485, 'sideways_rsi_os': 9, 'sideways_rsi_ob': 62, 'sideways_adx_thresh': 30.25799744843089, 'sideways_atr_min_pct': 0.02244227956172723, 'sideways_atr_max_pct': 0.10606250690174548, 'sideways_tp_mult': 2.002247634989255, 'sideways_tsl_mult': 0.7458905569266551, 'sideways_time_stop': 165, 'sideways_use_sma': False, 'sideways_use_ema': False, 'sideways_use_atr': False, 'sideways_use_adx': False, 'sideways_use_spike': False, 'sideways_rsi_required': False}.
[I 2025-09-01 04:01:17,345] Trial 582 finished with values: [-0.08913194451484874, 0.08898322363055212] and parameters: {'p_sma': 15, 'p_std': 7, 'p_atr': 24, 'p_adx': 7, 'rsi_period': 33, 'ema1': 12, 'ema2': 19, 'slip_atr_k': 0.2445592001374477, 'slip_spread_k': 0.4001478869041292, 'spread_hl_frac': 0.042114683486032575, 'bb_std_mult': 2.3174692163429174, 'rsi_os': 46, 'rsi_ob': 55, 'vol_spike': 0.18507002843258824, 'adx_thresh': 13.221370293973846, 'atr_min_pct': 0.014925635790253427, 'atr_max_pct': 0.06513454867158606, 'tp_mult': 1.531149954226928, 'tsl_mult': 0.33847515255452176, 'strategy': 'mean_reversion', 'time_stop': 63, 'use_sma': True, 'use_atr': False, 'use_adx': False, 'use_ema': True, 'use_spike': False, 'rsi_required': True, 'edge_k': 0.1680921437837503, 'edge_cap': 0.2003191066020184, 'bull_strategy': 'mean_reversion', 'bull_bb_std_mult': 0.7818672033843301, 'bull_rsi_os': 9, 'bull_rsi_ob': 69, 'bull_adx_thresh': 6.105079065894246, 'bull_atr_min_pct': 0.000585086174768743, 'bull_atr_max_pct': 0.0489045514568681, 'bull_tp_mult': 2.096590010901913, 'bull_tsl_mult': 0.9084336219306888, 'bull_time_stop': 14, 'bull_use_sma': False, 'bull_use_ema': False, 'bull_use_atr': True, 'bull_use_adx': True, 'bull_use_spike': False, 'bull_rsi_required': True, 'bear_strategy': 'mean_reversion', 'bear_bb_std_mult': 3.340291039584807, 'bear_rsi_os': 48, 'bear_rsi_ob': 72, 'bear_adx_thresh': 34.28399310255901, 'bear_atr_min_pct': 0.010240445792261195, 'bear_atr_max_pct': 0.045040175600476455, 'bear_tp_mult': 2.9156767079042094, 'bear_tsl_mult': 0.0660351916650086, 'bear_time_stop': 289, 'bear_use_sma': True, 'bear_use_ema': True, 'bear_use_atr': True, 'bear_use_adx': True, 'bear_use_spike': True, 'bear_rsi_required': False, 'sideways_strategy': 'breakout', 'sideways_bb_std_mult': 3.5346484826036164, 'sideways_rsi_os': 8, 'sideways_rsi_ob': 61, 'sideways_adx_thresh': 11.126879491201915, 'sideways_atr_min_pct': 0.02266132911236395, 'sideways_atr_max_pct': 0.10255794006031094, 'sideways_tp_mult': 2.765920184128106, 'sideways_tsl_mult': 0.6807559468704496, 'sideways_time_stop': 35, 'sideways_use_sma': False, 'sideways_use_ema': False, 'sideways_use_atr': False, 'sideways_use_adx': False, 'sideways_use_spike': False, 'sideways_rsi_required': True}.
[I 2025-09-01 04:01:17,642] Trial 580 finished with values: [-0.022312708803834957, 0.022167101601804177] and parameters: {'p_sma': 15, 'p_std': 46, 'p_atr': 24, 'p_adx': 8, 'rsi_period': 21, 'ema1': 12, 'ema2': 31, 'slip_atr_k': 0.24427796447319206, 'slip_spread_k': 0.4007949005683993, 'spread_hl_frac': 0.04130188694201123, 'bb_std_mult': 2.3023878120932912, 'rsi_os': 46, 'rsi_ob': 55, 'vol_spike': 0.09808487818299799, 'adx_thresh': 13.365360803873553, 'atr_min_pct': 0.011603333398728932, 'atr_max_pct': 0.05633252575726507, 'tp_mult': 2.605909794097637, 'tsl_mult': 0.33877893690913197, 'strategy': 'mean_reversion', 'time_stop': 76, 'use_sma': True, 'use_atr': False, 'use_adx': False, 'use_ema': True, 'use_spike': False, 'rsi_required': True, 'edge_k': 0.1707020683812323, 'edge_cap': 0.20594203532101213, 'bull_strategy': 'mean_reversion', 'bull_bb_std_mult': 2.119973583751734, 'bull_rsi_os': 9, 'bull_rsi_ob': 78, 'bull_adx_thresh': 6.444380857012288, 'bull_atr_min_pct': 0.000612015791299856, 'bull_atr_max_pct': 0.04886812842127468, 'bull_tp_mult': 2.0958934598013528, 'bull_tsl_mult': 0.29298427680248673, 'bull_time_stop': 294, 'bull_use_sma': False, 'bull_use_ema': False, 'bull_use_atr': True, 'bull_use_adx': True, 'bull_use_spike': False, 'bull_rsi_required': True, 'bear_strategy': 'mean_reversion', 'bear_bb_std_mult': 3.497652431092354, 'bear_rsi_os': 48, 'bear_rsi_ob': 72, 'bear_adx_thresh': 34.03182863916014, 'bear_atr_min_pct': 0.010111300571423076, 'bear_atr_max_pct': 0.04958684683673736, 'bear_tp_mult': 2.9164717808110683, 'bear_tsl_mult': 0.9394062460419578, 'bear_time_stop': 290, 'bear_use_sma': True, 'bear_use_ema': True, 'bear_use_atr': True, 'bear_use_adx': True, 'bear_use_spike': True, 'bear_rsi_required': False, 'sideways_strategy': 'breakout', 'sideways_bb_std_mult': 3.047252301671808, 'sideways_rsi_os': 8, 'sideways_rsi_ob': 62, 'sideways_adx_thresh': 30.03593292648848, 'sideways_atr_min_pct': 0.018996509667188216, 'sideways_atr_max_pct': 0.10235458325521084, 'sideways_tp_mult': 1.8871455294816928, 'sideways_tsl_mult': 0.6852152642900192, 'sideways_time_stop': 85, 'sideways_use_sma': False, 'sideways_use_ema': False, 'sideways_use_atr': False, 'sideways_use_adx': False, 'sideways_use_spike': False, 'sideways_rsi_required': True}.
[I 2025-09-01 04:01:17,981] Trial 583 finished with values: [-1000000000.0, 1000000000.0] and parameters: {'p_sma': 15, 'p_std': 53, 'p_atr': 25, 'p_adx': 13, 'rsi_period': 78, 'ema1': 12, 'ema2': 50, 'slip_atr_k': 0.00505441507954733, 'slip_spread_k': 0.7247316875336778, 'spread_hl_frac': 0.008313566307763087, 'bb_std_mult': 2.3205070554553093, 'rsi_os': 44, 'rsi_ob': 57, 'vol_spike': 0.03899345315179367, 'adx_thresh': 27.221516371017643, 'atr_min_pct': 0.009814699852618939, 'atr_max_pct': 0.04867460678219692, 'tp_mult': 2.5955721286563085, 'tsl_mult': 0.12314640891278844, 'strategy': 'mean_reversion', 'time_stop': 216, 'use_sma': True, 'use_atr': False, 'use_adx': False, 'use_ema': True, 'use_spike': False, 'rsi_required': True, 'edge_k': 1.0790707563605184, 'edge_cap': 0.1992858550103032, 'bull_strategy': 'mean_reversion', 'bull_bb_std_mult': 0.8065516234675569, 'bull_rsi_os': 10, 'bull_rsi_ob': 69, 'bull_adx_thresh': 9.844447679403377, 'bull_atr_min_pct': 0.018341266887021507, 'bull_atr_max_pct': 0.10820022828640846, 'bull_tp_mult': 1.4956916345143947, 'bull_tsl_mult': 0.4717447487500174, 'bull_time_stop': 208, 'bull_use_sma': False, 'bull_use_ema': False, 'bull_use_atr': True, 'bull_use_adx': True, 'bull_use_spike': False, 'bull_rsi_required': True, 'bear_strategy': 'mean_reversion', 'bear_bb_std_mult': 3.231744038928359, 'bear_rsi_os': 48, 'bear_rsi_ob': 72, 'bear_adx_thresh': 34.14592928060606, 'bear_atr_min_pct': 0.007762534343357946, 'bear_atr_max_pct': 0.10031335550294737, 'bear_tp_mult': 2.9071855992577005, 'bear_tsl_mult': 0.9400097642811984, 'bear_time_stop': 270, 'bear_use_sma': True, 'bear_use_ema': True, 'bear_use_atr': True, 'bear_use_adx': True, 'bear_use_spike': True, 'bear_rsi_required': False, 'sideways_strategy': 'breakout', 'sideways_bb_std_mult': 3.522930094955247, 'sideways_rsi_os': 8, 'sideways_rsi_ob': 58, 'sideways_adx_thresh': 13.34720585462954, 'sideways_atr_min_pct': 0.022725424369827517, 'sideways_atr_max_pct': 0.10203499107232859, 'sideways_tp_mult': 1.88421487588498, 'sideways_tsl_mult': 0.694134555993228, 'sideways_time_stop': 155, 'sideways_use_sma': False, 'sideways_use_ema': False, 'sideways_use_atr': False, 'sideways_use_adx': False, 'sideways_use_spike': False, 'sideways_rsi_required': True}.
[I 2025-09-01 04:01:18,236] Trial 581 finished with values: [-1000000000.0, 1000000000.0] and parameters: {'p_sma': 15, 'p_std': 7, 'p_atr': 25, 'p_adx': 7, 'rsi_period': 28, 'ema1': 12, 'ema2': 31, 'slip_atr_k': 0.05446704480240207, 'slip_spread_k': 0.024291151654862956, 'spread_hl_frac': 0.04120731990414851, 'bb_std_mult': 2.4065387235436018, 'rsi_os': 46, 'rsi_ob': 82, 'vol_spike': 0.1842208468426645, 'adx_thresh': 13.19190291429805, 'atr_min_pct': 0.009908745346611082, 'atr_max_pct': 0.14212591184927295, 'tp_mult': 2.911406996382208, 'tsl_mult': 0.010354373283117502, 'strategy': 'mean_reversion', 'time_stop': 85, 'use_sma': True, 'use_atr': False, 'use_adx': False, 'use_ema': True, 'use_spike': False, 'rsi_required': True, 'edge_k': 1.0753223116360415, 'edge_cap': 0.23966033452336646, 'bull_strategy': 'mean_reversion', 'bull_bb_std_mult': 2.1055415122045797, 'bull_rsi_os': 6, 'bull_rsi_ob': 69, 'bull_adx_thresh': 9.315529214039142, 'bull_atr_min_pct': 0.029835646676896598, 'bull_atr_max_pct': 0.10789303118789037, 'bull_tp_mult': 1.4844672353644044, 'bull_tsl_mult': 0.298596022692692, 'bull_time_stop': 295, 'bull_use_sma': False, 'bull_use_ema': False, 'bull_use_atr': True, 'bull_use_adx': True, 'bull_use_spike': False, 'bull_rsi_required': True, 'bear_strategy': 'mean_reversion', 'bear_bb_std_mult': 3.478479292473076, 'bear_rsi_os': 41, 'bear_rsi_ob': 72, 'bear_adx_thresh': 34.03979773852948, 'bear_atr_min_pct': 0.007905187509457352, 'bear_atr_max_pct': 0.046018561521837725, 'bear_tp_mult': 2.898253613233582, 'bear_tsl_mult': 0.64595281543155, 'bear_time_stop': 290, 'bear_use_sma': True, 'bear_use_ema': True, 'bear_use_atr': True, 'bear_use_adx': True, 'bear_use_spike': True, 'bear_rsi_required': False, 'sideways_strategy': 'breakout', 'sideways_bb_std_mult': 3.5316580691126136, 'sideways_rsi_os': 23, 'sideways_rsi_ob': 61, 'sideways_adx_thresh': 5.9767728590849885, 'sideways_atr_min_pct': 0.022491871933590958, 'sideways_atr_max_pct': 0.1070786180997448, 'sideways_tp_mult': 1.88623924696323, 'sideways_tsl_mult': 0.6777019191133509, 'sideways_time_stop': 153, 'sideways_use_sma': False, 'sideways_use_ema': False, 'sideways_use_atr': False, 'sideways_use_adx': False, 'sideways_use_spike': False, 'sideways_rsi_required': True}.
[I 2025-09-01 04:02:00,674] Trial 585 finished with values: [-1000000000.0, 1000000000.0] and parameters: {'p_sma': 16, 'p_std': 15, 'p_atr': 23, 'p_adx': 9, 'rsi_period': 28, 'ema1': 12, 'ema2': 13, 'slip_atr_k': 0.055467997076316444, 'slip_spread_k': 0.8259046706269153, 'spread_hl_frac': 0.044849452007334, 'bb_std_mult': 2.5052853784425597, 'rsi_os': 43, 'rsi_ob': 64, 'vol_spike': 0.1755160327872294, 'adx_thresh': 12.629010636484619, 'atr_min_pct': 0.009731030766478955, 'atr_max_pct': 0.07441964273281299, 'tp_mult': 2.555545626300856, 'tsl_mult': 4.001079761178916e-05, 'strategy': 'mean_reversion', 'time_stop': 92, 'use_sma': True, 'use_atr': False, 'use_adx': False, 'use_ema': True, 'use_spike': False, 'rsi_required': True, 'edge_k': 1.4192320739802513, 'edge_cap': 0.24968516007601024, 'bull_strategy': 'mean_reversion', 'bull_bb_std_mult': 0.934642297775623, 'bull_rsi_os': 6, 'bull_rsi_ob': 82, 'bull_adx_thresh': 9.731266328601816, 'bull_atr_min_pct': 0.02112159256102954, 'bull_atr_max_pct': 0.08805264330063771, 'bull_tp_mult': 2.7678491524097906, 'bull_tsl_mult': 0.48188445740950736, 'bull_time_stop': 206, 'bull_use_sma': False, 'bull_use_ema': False, 'bull_use_atr': True, 'bull_use_adx': True, 'bull_use_spike': False, 'bull_rsi_required': True, 'bear_strategy': 'mean_reversion', 'bear_bb_std_mult': 3.3053588821128317, 'bear_rsi_os': 45, 'bear_rsi_ob': 68, 'bear_adx_thresh': 32.930939246400655, 'bear_atr_min_pct': 0.0076147208739643065, 'bear_atr_max_pct': 0.0625416085991668, 'bear_tp_mult': 2.8733252973918497, 'bear_tsl_mult': 0.7532671666688063, 'bear_time_stop': 270, 'bear_use_sma': True, 'bear_use_ema': True, 'bear_use_atr': True, 'bear_use_adx': True, 'bear_use_spike': False, 'bear_rsi_required': False, 'sideways_strategy': 'breakout', 'sideways_bb_std_mult': 3.5572864748039597, 'sideways_rsi_os': 10, 'sideways_rsi_ob': 58, 'sideways_adx_thresh': 29.507182914403632, 'sideways_atr_min_pct': 0.024665273192124183, 'sideways_atr_max_pct': 0.10732324941250108, 'sideways_tp_mult': 1.1232985918462304, 'sideways_tsl_mult': 0.7219496228809635, 'sideways_time_stop': 153, 'sideways_use_sma': False, 'sideways_use_ema': False, 'sideways_use_atr': False, 'sideways_use_adx': True, 'sideways_use_spike': False, 'sideways_rsi_required': True}.
