[I 2025-09-01 03:45:50,014] Trial 497 finished with values: [-0.01756103412864507, 0.017378203138509483] and parameters: {'p_sma': 18, 'p_std': 52, 'p_atr': 25, 'p_adx': 11, 'rsi_period': 8, 'ema1': 14, 'ema2': 51, 'slip_atr_k': 0.0006361919203395796, 'slip_spread_k': 0.02650554364312059, 'spread_hl_frac': 0.04215404529186125, 'bb_std_mult': 2.5347771670559798, 'rsi_os': 44, 'rsi_ob': 81, 'vol_spike': 0.18246109191229598, 'adx_thresh': 13.965026500220013, 'atr_min_pct': 0.010817992810373588, 'atr_max_pct': 0.03410851997238964, 'tp_mult': 2.5556563185781327, 'tsl_mult': 0.3095226235131967, 'strategy': 'mean_reversion', 'time_stop': 90, 'use_sma': False, 'use_atr': False, 'use_adx': False, 'use_ema': False, 'use_spike': True, 'rsi_required': False, 'edge_k': 0.2752044902848831, 'edge_cap': 0.2637686744256833, 'bull_strategy': 'breakout', 'bull_bb_std_mult': 0.7383330641241428, 'bull_rsi_os': 8, 'bull_rsi_ob': 80, 'bull_adx_thresh': 8.036271603361083, 'bull_atr_min_pct': 1.09655274887875e-05, 'bull_atr_max_pct': 0.1039109571618849, 'bull_tp_mult': 1.4020533070843983, 'bull_tsl_mult': 0.26113327685527365, 'bull_time_stop': 296, 'bull_use_sma': True, 'bull_use_ema': False, 'bull_use_atr': False, 'bull_use_adx': True, 'bull_use_spike': False, 'bull_rsi_required': True, 'bear_strategy': 'breakout', 'bear_bb_std_mult': 3.184607955198611, 'bear_rsi_os': 47, 'bear_rsi_ob': 68, 'bear_adx_thresh': 32.97966132780883, 'bear_atr_min_pct': 0.007249435516212671, 'bear_atr_max_pct': 0.054592650982737585, 'bear_tp_mult': 2.9510720992454607, 'bear_tsl_mult': 0.015121972954007995, 'bear_time_stop': 292, 'bear_use_sma': True, 'bear_use_ema': False, 'bear_use_atr': False, 'bear_use_adx': True, 'bear_use_spike': True, 'bear_rsi_required': False, 'sideways_strategy': 'mean_reversion', 'sideways_bb_std_mult': 3.5523436865384816, 'sideways_rsi_os': 8, 'sideways_rsi_ob': 60, 'sideways_adx_thresh': 31.0610776396854, 'sideways_atr_min_pct': 0.022936288726471108, 'sideways_atr_max_pct': 0.10485713835089383, 'sideways_tp_mult': 1.89835343123864, 'sideways_tsl_mult': 0.6905240887151723, 'sideways_time_stop': 161, 'sideways_use_sma': False, 'sideways_use_ema': True, 'sideways_use_atr': False, 'sideways_use_adx': False, 'sideways_use_spike': True, 'sideways_rsi_required': False}.
[I 2025-09-01 03:45:50,016] Trial 496 finished with values: [-0.016008164629584654, 0.01586991733126289] and parameters: {'p_sma': 17, 'p_std': 53, 'p_atr': 25, 'p_adx': 11, 'rsi_period': 7, 'ema1': 14, 'ema2': 52, 'slip_atr_k': 0.0036807468191216806, 'slip_spread_k': 0.01679573730190584, 'spread_hl_frac': 0.04217149288869103, 'bb_std_mult': 2.5378346028206904, 'rsi_os': 44, 'rsi_ob': 81, 'vol_spike': 0.1819093800700585, 'adx_thresh': 13.963326061704837, 'atr_min_pct': 0.010845457941871585, 'atr_max_pct': 0.11557427551190252, 'tp_mult': 2.4865311901967213, 'tsl_mult': 0.30585796961206385, 'strategy': 'mean_reversion', 'time_stop': 89, 'use_sma': False, 'use_atr': False, 'use_adx': False, 'use_ema': False, 'use_spike': True, 'rsi_required': False, 'edge_k': 0.27546244073101883, 'edge_cap': 0.2665551750539937, 'bull_strategy': 'breakout', 'bull_bb_std_mult': 0.717031007491732, 'bull_rsi_os': 8, 'bull_rsi_ob': 80, 'bull_adx_thresh': 8.164495175630101, 'bull_atr_min_pct': 4.0757654366186355e-05, 'bull_atr_max_pct': 0.10389516480456622, 'bull_tp_mult': 1.4090152632385302, 'bull_tsl_mult': 0.2597897552993105, 'bull_time_stop': 300, 'bull_use_sma': True, 'bull_use_ema': False, 'bull_use_atr': False, 'bull_use_adx': True, 'bull_use_spike': False, 'bull_rsi_required': True, 'bear_strategy': 'breakout', 'bear_bb_std_mult': 3.166704360465118, 'bear_rsi_os': 47, 'bear_rsi_ob': 68, 'bear_adx_thresh': 32.69220336545138, 'bear_atr_min_pct': 0.007284392446644289, 'bear_atr_max_pct': 0.05500250997461424, 'bear_tp_mult': 2.947665657087241, 'bear_tsl_mult': 0.05280951606561686, 'bear_time_stop': 294, 'bear_use_sma': True, 'bear_use_ema': False, 'bear_use_atr': False, 'bear_use_adx': True, 'bear_use_spike': True, 'bear_rsi_required': False, 'sideways_strategy': 'mean_reversion', 'sideways_bb_std_mult': 3.5439402996509943, 'sideways_rsi_os': 8, 'sideways_rsi_ob': 59, 'sideways_adx_thresh': 31.174697471094422, 'sideways_atr_min_pct': 0.02305545021707708, 'sideways_atr_max_pct': 0.10556437911374168, 'sideways_tp_mult': 1.9181065753617619, 'sideways_tsl_mult': 0.6870231973441033, 'sideways_time_stop': 162, 'sideways_use_sma': False, 'sideways_use_ema': True, 'sideways_use_atr': False, 'sideways_use_adx': False, 'sideways_use_spike': True, 'sideways_rsi_required': True}.
[I 2025-09-01 03:45:50,012] Trial 495 finished with values: [-0.016026149282650892, 0.015841929657736294] and parameters: {'p_sma': 18, 'p_std': 52, 'p_atr': 25, 'p_adx': 11, 'rsi_period': 8, 'ema1': 14, 'ema2': 52, 'slip_atr_k': 0.004755325848981686, 'slip_spread_k': 0.021256756587251624, 'spread_hl_frac': 0.04196709811228376, 'bb_std_mult': 2.5456906510065163, 'rsi_os': 44, 'rsi_ob': 81, 'vol_spike': 0.17449653448087074, 'adx_thresh': 14.020308934760337, 'atr_min_pct': 0.010679177406520059, 'atr_max_pct': 0.13561363001565338, 'tp_mult': 2.565667035338161, 'tsl_mult': 0.30744259950551056, 'strategy': 'mean_reversion', 'time_stop': 89, 'use_sma': False, 'use_atr': False, 'use_adx': False, 'use_ema': False, 'use_spike': True, 'rsi_required': False, 'edge_k': 0.27699706413707653, 'edge_cap': 0.2650585153955235, 'bull_strategy': 'breakout', 'bull_bb_std_mult': 0.7255497744970487, 'bull_rsi_os': 8, 'bull_rsi_ob': 80, 'bull_adx_thresh': 8.28732894233113, 'bull_atr_min_pct': 0.00019212456169983566, 'bull_atr_max_pct': 0.10371717036626892, 'bull_tp_mult': 1.4003523336522155, 'bull_tsl_mult': 0.2595257637277525, 'bull_time_stop': 296, 'bull_use_sma': True, 'bull_use_ema': False, 'bull_use_atr': False, 'bull_use_adx': True, 'bull_use_spike': False, 'bull_rsi_required': True, 'bear_strategy': 'breakout', 'bear_bb_std_mult': 3.183358999412334, 'bear_rsi_os': 48, 'bear_rsi_ob': 68, 'bear_adx_thresh': 32.66657397007293, 'bear_atr_min_pct': 0.007279431319579914, 'bear_atr_max_pct': 0.0544048654898203, 'bear_tp_mult': 2.941524201205024, 'bear_tsl_mult': 0.05721221897630425, 'bear_time_stop': 292, 'bear_use_sma': True, 'bear_use_ema': False, 'bear_use_atr': False, 'bear_use_adx': True, 'bear_use_spike': True, 'bear_rsi_required': False, 'sideways_strategy': 'mean_reversion', 'sideways_bb_std_mult': 3.5601676496945895, 'sideways_rsi_os': 7, 'sideways_rsi_ob': 59, 'sideways_adx_thresh': 31.123449610307276, 'sideways_atr_min_pct': 0.023462067351890013, 'sideways_atr_max_pct': 0.10529837436960708, 'sideways_tp_mult': 1.8983298094180192, 'sideways_tsl_mult': 0.6892546311513682, 'sideways_time_stop': 161, 'sideways_use_sma': False, 'sideways_use_ema': True, 'sideways_use_atr': False, 'sideways_use_adx': False, 'sideways_use_spike': True, 'sideways_rsi_required': True}.
[I 2025-09-01 03:45:50,340] Trial 498 finished with values: [-0.016055583445770183, 0.015871174655894084] and parameters: {'p_sma': 18, 'p_std': 52, 'p_atr': 25, 'p_adx': 11, 'rsi_period': 7, 'ema1': 14, 'ema2': 51, 'slip_atr_k': 0.0053950985368939625, 'slip_spread_k': 0.021746661751484014, 'spread_hl_frac': 0.04215041221887215, 'bb_std_mult': 2.5495053348773014, 'rsi_os': 44, 'rsi_ob': 81, 'vol_spike': 0.18185215086623802, 'adx_thresh': 13.855201677994293, 'atr_min_pct': 0.010728697453944386, 'atr_max_pct': 0.11592679998385903, 'tp_mult': 2.56775004233323, 'tsl_mult': 0.31240352191518156, 'strategy': 'mean_reversion', 'time_stop': 89, 'use_sma': False, 'use_atr': False, 'use_adx': True, 'use_ema': False, 'use_spike': True, 'rsi_required': False, 'edge_k': 0.25844496479457246, 'edge_cap': 0.265018334270803, 'bull_strategy': 'breakout', 'bull_bb_std_mult': 0.7843551780630871, 'bull_rsi_os': 7, 'bull_rsi_ob': 80, 'bull_adx_thresh': 8.367127825939066, 'bull_atr_min_pct': 0.0002916386839347626, 'bull_atr_max_pct': 0.104022165616725, 'bull_tp_mult': 1.394963827224705, 'bull_tsl_mult': 0.26181833835960006, 'bull_time_stop': 300, 'bull_use_sma': True, 'bull_use_ema': False, 'bull_use_atr': False, 'bull_use_adx': True, 'bull_use_spike': False, 'bull_rsi_required': True, 'bear_strategy': 'breakout', 'bear_bb_std_mult': 3.167220363918923, 'bear_rsi_os': 47, 'bear_rsi_ob': 68, 'bear_adx_thresh': 32.54212549602215, 'bear_atr_min_pct': 0.0074731048383439485, 'bear_atr_max_pct': 0.054777520158029024, 'bear_tp_mult': 2.937640261377134, 'bear_tsl_mult': 0.015505388815511362, 'bear_time_stop': 293, 'bear_use_sma': True, 'bear_use_ema': False, 'bear_use_atr': False, 'bear_use_adx': False, 'bear_use_spike': True, 'bear_rsi_required': False, 'sideways_strategy': 'mean_reversion', 'sideways_bb_std_mult': 3.5527864962682725, 'sideways_rsi_os': 8, 'sideways_rsi_ob': 59, 'sideways_adx_thresh': 31.11276209463436, 'sideways_atr_min_pct': 0.023423826716898764, 'sideways_atr_max_pct': 0.10524272934652906, 'sideways_tp_mult': 1.967479881132934, 'sideways_tsl_mult': 0.6892951844150754, 'sideways_time_stop': 163, 'sideways_use_sma': False, 'sideways_use_ema': True, 'sideways_use_atr': False, 'sideways_use_adx': False, 'sideways_use_spike': True, 'sideways_rsi_required': True}.
[I 2025-09-01 03:46:30,362] Trial 499 finished with values: [-1000000000.0, 1000000000.0] and parameters: {'p_sma': 16, 'p_std': 54, 'p_atr': 24, 'p_adx': 10, 'rsi_period': 7, 'ema1': 14, 'ema2': 53, 'slip_atr_k': 0.006388792062695587, 'slip_spread_k': 0.04415640527350306, 'spread_hl_frac': 0.04143009616182301, 'bb_std_mult': 2.494874447497792, 'rsi_os': 42, 'rsi_ob': 81, 'vol_spike': 0.17560905379168876, 'adx_thresh': 13.16903382742821, 'atr_min_pct': 0.01074173504899355, 'atr_max_pct': 0.08435434926232734, 'tp_mult': 2.4631306666863786, 'tsl_mult': 0.3097348661523263, 'strategy': 'breakout', 'time_stop': 78, 'use_sma': False, 'use_atr': False, 'use_adx': True, 'use_ema': False, 'use_spike': True, 'rsi_required': False, 'edge_k': 0.3137095548173592, 'edge_cap': 0.28100253504585604, 'bull_strategy': 'breakout', 'bull_bb_std_mult': 0.8736510910847537, 'bull_rsi_os': 7, 'bull_rsi_ob': 81, 'bull_adx_thresh': 7.321756253289383, 'bull_atr_min_pct': 1.4010765220631797e-05, 'bull_atr_max_pct': 0.10522369496469686, 'bull_tp_mult': 1.4925743353532073, 'bull_tsl_mult': 0.2545150676893699, 'bull_time_stop': 293, 'bull_use_sma': True, 'bull_use_ema': True, 'bull_use_atr': False, 'bull_use_adx': True, 'bull_use_spike': False, 'bull_rsi_required': False, 'bear_strategy': 'breakout', 'bear_bb_std_mult': 3.1555552949551187, 'bear_rsi_os': 48, 'bear_rsi_ob': 69, 'bear_adx_thresh': 32.07866192193151, 'bear_atr_min_pct': 0.006895773124017173, 'bear_atr_max_pct': 0.0506570538428667, 'bear_tp_mult': 2.9022581264399094, 'bear_tsl_mult': 0.03194522318770426, 'bear_time_stop': 286, 'bear_use_sma': True, 'bear_use_ema': False, 'bear_use_atr': False, 'bear_use_adx': False, 'bear_use_spike': True, 'bear_rsi_required': True, 'sideways_strategy': 'breakout', 'sideways_bb_std_mult': 3.452639725485832, 'sideways_rsi_os': 6, 'sideways_rsi_ob': 58, 'sideways_adx_thresh': 30.676245075869033, 'sideways_atr_min_pct': 0.023839542836392665, 'sideways_atr_max_pct': 0.10964684557081296, 'sideways_tp_mult': 1.8474754590257823, 'sideways_tsl_mult': 0.6880157312961366, 'sideways_time_stop': 170, 'sideways_use_sma': True, 'sideways_use_ema': True, 'sideways_use_atr': False, 'sideways_use_adx': True, 'sideways_use_spike': True, 'sideways_rsi_required': True}.
[I 2025-09-01 03:46:31,199] Trial 502 finished with values: [-1000000000.0, 1000000000.0] and parameters: {'p_sma': 16, 'p_std': 54, 'p_atr': 25, 'p_adx': 11, 'rsi_period': 7, 'ema1': 14, 'ema2': 53, 'slip_atr_k': 0.00015975221603448716, 'slip_spread_k': 0.0005534369705323949, 'spread_hl_frac': 0.041751827383621286, 'bb_std_mult': 2.5020793628236273, 'rsi_os': 42, 'rsi_ob': 81, 'vol_spike': 0.17382412226965271, 'adx_thresh': 13.269362227679334, 'atr_min_pct': 0.010936498401404688, 'atr_max_pct': 0.04657224149589957, 'tp_mult': 2.4644502891736755, 'tsl_mult': 0.2730985619179026, 'strategy': 'breakout', 'time_stop': 79, 'use_sma': False, 'use_atr': False, 'use_adx': True, 'use_ema': False, 'use_spike': True, 'rsi_required': False, 'edge_k': 0.306852865242655, 'edge_cap': 0.28372824127174057, 'bull_strategy': 'breakout', 'bull_bb_std_mult': 0.8858125555387799, 'bull_rsi_os': 7, 'bull_rsi_ob': 81, 'bull_adx_thresh': 7.188941831306089, 'bull_atr_min_pct': 5.70542841688889e-05, 'bull_atr_max_pct': 0.10598061191104019, 'bull_tp_mult': 1.4996536233606226, 'bull_tsl_mult': 0.24849664859879794, 'bull_time_stop': 293, 'bull_use_sma': False, 'bull_use_ema': True, 'bull_use_atr': False, 'bull_use_adx': True, 'bull_use_spike': False, 'bull_rsi_required': False, 'bear_strategy': 'breakout', 'bear_bb_std_mult': 3.1626040103652957, 'bear_rsi_os': 48, 'bear_rsi_ob': 69, 'bear_adx_thresh': 32.1653411171175, 'bear_atr_min_pct': 0.00687438584430551, 'bear_atr_max_pct': 0.05182440716972286, 'bear_tp_mult': 2.8948214403870804, 'bear_tsl_mult': 0.06947776799960549, 'bear_time_stop': 287, 'bear_use_sma': True, 'bear_use_ema': False, 'bear_use_atr': False, 'bear_use_adx': False, 'bear_use_spike': True, 'bear_rsi_required': True, 'sideways_strategy': 'breakout', 'sideways_bb_std_mult': 3.4290867504024103, 'sideways_rsi_os': 6, 'sideways_rsi_ob': 58, 'sideways_adx_thresh': 31.073053471453203, 'sideways_atr_min_pct': 0.023761361788955715, 'sideways_atr_max_pct': 0.10932094253736895, 'sideways_tp_mult': 1.837531252595633, 'sideways_tsl_mult': 0.6861483066015436, 'sideways_time_stop': 168, 'sideways_use_sma': True, 'sideways_use_ema': True, 'sideways_use_atr': False, 'sideways_use_adx': True, 'sideways_use_spike': True, 'sideways_rsi_required': True}.
[I 2025-09-01 03:46:31,431] Trial 500 finished with values: [-1000000000.0, 1000000000.0] and parameters: {'p_sma': 16, 'p_std': 54, 'p_atr': 24, 'p_adx': 10, 'rsi_period': 7, 'ema1': 14, 'ema2': 53, 'slip_atr_k': 0.006918484387114076, 'slip_spread_k': 0.05312934013911846, 'spread_hl_frac': 0.041668576142205226, 'bb_std_mult': 2.448177638389935, 'rsi_os': 42, 'rsi_ob': 81, 'vol_spike': 0.1735322897572163, 'adx_thresh': 13.178856535782545, 'atr_min_pct': 0.010569023114056686, 'atr_max_pct': 0.08364043621428423, 'tp_mult': 2.4719581748761055, 'tsl_mult': 0.2732542422190732, 'strategy': 'breakout', 'time_stop': 80, 'use_sma': False, 'use_atr': False, 'use_adx': True, 'use_ema': False, 'use_spike': True, 'rsi_required': False, 'edge_k': 0.31330116056910984, 'edge_cap': 0.275673561003815, 'bull_strategy': 'breakout', 'bull_bb_std_mult': 0.7343105208394733, 'bull_rsi_os': 7, 'bull_rsi_ob': 81, 'bull_adx_thresh': 7.142766906766525, 'bull_atr_min_pct': 8.664771640351621e-05, 'bull_atr_max_pct': 0.10654459069581096, 'bull_tp_mult': 1.4800342169447718, 'bull_tsl_mult': 0.24547248168184485, 'bull_time_stop': 292, 'bull_use_sma': True, 'bull_use_ema': True, 'bull_use_atr': False, 'bull_use_adx': True, 'bull_use_spike': False, 'bull_rsi_required': False, 'bear_strategy': 'breakout', 'bear_bb_std_mult': 3.131056738758129, 'bear_rsi_os': 48, 'bear_rsi_ob': 69, 'bear_adx_thresh': 32.04951228192285, 'bear_atr_min_pct': 0.007033376439889323, 'bear_atr_max_pct': 0.0514532138808229, 'bear_tp_mult': 2.881936244538436, 'bear_tsl_mult': 0.06895925885002695, 'bear_time_stop': 286, 'bear_use_sma': True, 'bear_use_ema': False, 'bear_use_atr': False, 'bear_use_adx': False, 'bear_use_spike': True, 'bear_rsi_required': True, 'sideways_strategy': 'breakout', 'sideways_bb_std_mult': 3.4449226616213053, 'sideways_rsi_os': 6, 'sideways_rsi_ob': 58, 'sideways_adx_thresh': 30.637529126695597, 'sideways_atr_min_pct': 0.02374022576566307, 'sideways_atr_max_pct': 0.10938778112460709, 'sideways_tp_mult': 1.8445268137649549, 'sideways_tsl_mult': 0.6903995466682236, 'sideways_time_stop': 165, 'sideways_use_sma': True, 'sideways_use_ema': True, 'sideways_use_atr': False, 'sideways_use_adx': True, 'sideways_use_spike': True, 'sideways_rsi_required': True}.
[I 2025-09-01 03:46:31,557] Trial 501 finished with values: [-1000000000.0, 1000000000.0] and parameters: {'p_sma': 16, 'p_std': 54, 'p_atr': 25, 'p_adx': 10, 'rsi_period': 7, 'ema1': 14, 'ema2': 53, 'slip_atr_k': 0.005817220874654298, 'slip_spread_k': 0.049027387230804714, 'spread_hl_frac': 0.04126007774252514, 'bb_std_mult': 2.4983567026616496, 'rsi_os': 42, 'rsi_ob': 81, 'vol_spike': 0.17467221713420478, 'adx_thresh': 13.150228600582464, 'atr_min_pct': 0.010819139277385256, 'atr_max_pct': 0.018053298016539557, 'tp_mult': 2.4930273709111876, 'tsl_mult': 0.27712702676250217, 'strategy': 'breakout', 'time_stop': 94, 'use_sma': False, 'use_atr': False, 'use_adx': True, 'use_ema': False, 'use_spike': True, 'rsi_required': False, 'edge_k': 0.28753604257502235, 'edge_cap': 0.2872331404714241, 'bull_strategy': 'breakout', 'bull_bb_std_mult': 0.8587728472806724, 'bull_rsi_os': 7, 'bull_rsi_ob': 81, 'bull_adx_thresh': 7.280485049530206, 'bull_atr_min_pct': 0.0005149335783566061, 'bull_atr_max_pct': 0.1067572969186289, 'bull_tp_mult': 1.4904700458088234, 'bull_tsl_mult': 0.25304202627386785, 'bull_time_stop': 292, 'bull_use_sma': True, 'bull_use_ema': True, 'bull_use_atr': False, 'bull_use_adx': True, 'bull_use_spike': False, 'bull_rsi_required': False, 'bear_strategy': 'breakout', 'bear_bb_std_mult': 3.122252522959877, 'bear_rsi_os': 48, 'bear_rsi_ob': 69, 'bear_adx_thresh': 32.07355837954209, 'bear_atr_min_pct': 0.007051140496495881, 'bear_atr_max_pct': 0.05194940071424812, 'bear_tp_mult': 2.8951308129358155, 'bear_tsl_mult': 0.06412386709024526, 'bear_time_stop': 285, 'bear_use_sma': True, 'bear_use_ema': False, 'bear_use_atr': False, 'bear_use_adx': False, 'bear_use_spike': True, 'bear_rsi_required': True, 'sideways_strategy': 'breakout', 'sideways_bb_std_mult': 3.458351312938094, 'sideways_rsi_os': 6, 'sideways_rsi_ob': 58, 'sideways_adx_thresh': 31.082992044433574, 'sideways_atr_min_pct': 0.023719928080330407, 'sideways_atr_max_pct': 0.10899823550291539, 'sideways_tp_mult': 1.8522982420438252, 'sideways_tsl_mult': 0.6876792900832303, 'sideways_time_stop': 167, 'sideways_use_sma': True, 'sideways_use_ema': True, 'sideways_use_atr': False, 'sideways_use_adx': True, 'sideways_use_spike': True, 'sideways_rsi_required': True}.
[I 2025-09-01 03:47:14,002] Trial 506 finished with values: [-0.014197265515454638, 0.014092918741886744] and parameters: {'p_sma': 18, 'p_std': 53, 'p_atr': 25, 'p_adx': 11, 'rsi_period': 9, 'ema1': 13, 'ema2': 52, 'slip_atr_k': 0.0002463454820336294, 'slip_spread_k': 0.018978290208474073, 'spread_hl_frac': 0.04369424674589335, 'bb_std_mult': 2.57689158109275, 'rsi_os': 44, 'rsi_ob': 80, 'vol_spike': 0.19143881777505256, 'adx_thresh': 14.319470212986856, 'atr_min_pct': 0.00989130392732614, 'atr_max_pct': 0.04952351820326016, 'tp_mult': 2.587067268318586, 'tsl_mult': 0.3130534901964218, 'strategy': 'mean_reversion', 'time_stop': 93, 'use_sma': True, 'use_atr': False, 'use_adx': False, 'use_ema': False, 'use_spike': True, 'rsi_required': False, 'edge_k': 0.22574010492560798, 'edge_cap': 0.24038206802789303, 'bull_strategy': 'mean_reversion', 'bull_bb_std_mult': 0.8162761294166436, 'bull_rsi_os': 9, 'bull_rsi_ob': 78, 'bull_adx_thresh': 6.256294110798531, 'bull_atr_min_pct': 6.1041251299157685e-06, 'bull_atr_max_pct': 0.10599145129737762, 'bull_tp_mult': 1.4391743402238522, 'bull_tsl_mult': 0.27622670240841557, 'bull_time_stop': 300, 'bull_use_sma': False, 'bull_use_ema': False, 'bull_use_atr': False, 'bull_use_adx': True, 'bull_use_spike': False, 'bull_rsi_required': True, 'bear_strategy': 'mean_reversion', 'bear_bb_std_mult': 2.976589751184922, 'bear_rsi_os': 47, 'bear_rsi_ob': 67, 'bear_adx_thresh': 31.38234621803546, 'bear_atr_min_pct': 0.00787428158274392, 'bear_atr_max_pct': 0.05677437079451034, 'bear_tp_mult': 2.9877469161746113, 'bear_tsl_mult': 0.02052321321007683, 'bear_time_stop': 294, 'bear_use_sma': True, 'bear_use_ema': True, 'bear_use_atr': False, 'bear_use_adx': True, 'bear_use_spike': False, 'bear_rsi_required': False, 'sideways_strategy': 'mean_reversion', 'sideways_bb_std_mult': 3.527794628707293, 'sideways_rsi_os': 8, 'sideways_rsi_ob': 60, 'sideways_adx_thresh': 31.04737401482516, 'sideways_atr_min_pct': 0.02275520190551095, 'sideways_atr_max_pct': 0.10453297951608645, 'sideways_tp_mult': 1.9068760082244158, 'sideways_tsl_mult': 0.7438855717808782, 'sideways_time_stop': 155, 'sideways_use_sma': False, 'sideways_use_ema': True, 'sideways_use_atr': False, 'sideways_use_adx': False, 'sideways_use_spike': True, 'sideways_rsi_required': True}.
