[I 2025-09-01 03:15:48,321] Trial 322 finished with values: [-0.04337666651576788, 0.043194180440829844] and parameters: {'p_sma': 36, 'p_std': 14, 'p_atr': 27, 'p_adx': 17, 'rsi_period': 15, 'ema1': 19, 'ema2': 36, 'slip_atr_k': 0.13113182237351595, 'slip_spread_k': 0.11764657119710295, 'spread_hl_frac': 0.0018777786876179592, 'bb_std_mult': 1.5667983849299962, 'rsi_os': 32, 'rsi_ob': 74, 'vol_spike': 0.2159725647963921, 'adx_thresh': 21.089208457023584, 'atr_min_pct': 0.0075831824948965135, 'atr_max_pct': 0.05337282870758912, 'tp_mult': 2.886164864119384, 'tsl_mult': 0.3472002658877029, 'strategy': 'mean_reversion', 'time_stop': 115, 'use_sma': True, 'use_atr': True, 'use_adx': True, 'use_ema': True, 'use_spike': True, 'rsi_required': False, 'edge_k': 0.07276476679330517, 'edge_cap': 0.4675174528798674, 'bull_strategy': 'breakout', 'bull_bb_std_mult': 1.1429642998969747, 'bull_rsi_os': 20, 'bull_rsi_ob': 72, 'bull_adx_thresh': 21.95139278270367, 'bull_atr_min_pct': 0.00107317916243176, 'bull_atr_max_pct': 0.07545782222393181, 'bull_tp_mult': 1.7272496085824418, 'bull_tsl_mult': 0.17886504254988272, 'bull_time_stop': 84, 'bull_use_sma': True, 'bull_use_ema': False, 'bull_use_atr': False, 'bull_use_adx': True, 'bull_use_spike': False, 'bull_rsi_required': False, 'bear_strategy': 'breakout', 'bear_bb_std_mult': 2.360161398773152, 'bear_rsi_os': 38, 'bear_rsi_ob': 54, 'bear_adx_thresh': 23.849661511721184, 'bear_atr_min_pct': 0.027922188597305553, 'bear_atr_max_pct': 0.046900031262211025, 'bear_tp_mult': 1.0932779415858889, 'bear_tsl_mult': 0.4811825270285318, 'bear_time_stop': 66, 'bear_use_sma': False, 'bear_use_ema': True, 'bear_use_atr': False, 'bear_use_adx': False, 'bear_use_spike': True, 'bear_rsi_required': True, 'sideways_strategy': 'breakout', 'sideways_bb_std_mult': 0.6542678355030282, 'sideways_rsi_os': 33, 'sideways_rsi_ob': 75, 'sideways_adx_thresh': 24.265313331904828, 'sideways_atr_min_pct': 0.028108021214402455, 'sideways_atr_max_pct': 0.021851957366604533, 'sideways_tp_mult': 2.8401097560523367, 'sideways_tsl_mult': 0.194535473587486, 'sideways_time_stop': 113, 'sideways_use_sma': True, 'sideways_use_ema': True, 'sideways_use_atr': True, 'sideways_use_adx': False, 'sideways_use_spike': True, 'sideways_rsi_required': True}.
[I 2025-09-01 03:16:30,251] Trial 328 finished with values: [-1000000000.0, 1000000000.0] and parameters: {'p_sma': 56, 'p_std': 56, 'p_atr': 29, 'p_adx': 16, 'rsi_period': 52, 'ema1': 22, 'ema2': 28, 'slip_atr_k': 0.17279761868693722, 'slip_spread_k': 0.9215040719896264, 'spread_hl_frac': 0.030223063604189596, 'bb_std_mult': 1.6420715488396078, 'rsi_os': 22, 'rsi_ob': 95, 'vol_spike': 0.22510120188567925, 'adx_thresh': 11.283141437479147, 'atr_min_pct': 0.0020358889021999654, 'atr_max_pct': 0.04655677448667887, 'tp_mult': 2.6841504453570675, 'tsl_mult': 0.4041215248562518, 'strategy': 'breakout', 'time_stop': 161, 'use_sma': False, 'use_atr': False, 'use_adx': False, 'use_ema': False, 'use_spike': True, 'rsi_required': False, 'edge_k': 0.0004508711838359103, 'edge_cap': 0.906709751868976, 'bull_strategy': 'breakout', 'bull_bb_std_mult': 2.923559767486256, 'bull_rsi_os': 28, 'bull_rsi_ob': 47, 'bull_adx_thresh': 22.72692885035023, 'bull_atr_min_pct': 0.020166759968588528, 'bull_atr_max_pct': 0.114317414679522, 'bull_tp_mult': 1.5789659547203467, 'bull_tsl_mult': 0.2159734633497054, 'bull_time_stop': 291, 'bull_use_sma': True, 'bull_use_ema': True, 'bull_use_atr': False, 'bull_use_adx': False, 'bull_use_spike': True, 'bull_rsi_required': True, 'bear_strategy': 'mean_reversion', 'bear_bb_std_mult': 2.2972671762375043, 'bear_rsi_os': 55, 'bear_rsi_ob': 58, 'bear_adx_thresh': 19.582477445043725, 'bear_atr_min_pct': 0.025615329225962144, 'bear_atr_max_pct': 0.028289481559496774, 'bear_tp_mult': 1.1393672960152292, 'bear_tsl_mult': 0.17494546537730998, 'bear_time_stop': 53, 'bear_use_sma': False, 'bear_use_ema': False, 'bear_use_atr': True, 'bear_use_adx': True, 'bear_use_spike': True, 'bear_rsi_required': True, 'sideways_strategy': 'breakout', 'sideways_bb_std_mult': 1.8884649220375824, 'sideways_rsi_os': 6, 'sideways_rsi_ob': 76, 'sideways_adx_thresh': 15.15240858900544, 'sideways_atr_min_pct': 0.020557557029120724, 'sideways_atr_max_pct': 0.02656903964156455, 'sideways_tp_mult': 2.5181986252213013, 'sideways_tsl_mult': 0.22969110506402324, 'sideways_time_stop': 30, 'sideways_use_sma': False, 'sideways_use_ema': False, 'sideways_use_atr': False, 'sideways_use_adx': False, 'sideways_use_spike': True, 'sideways_rsi_required': False}.
[I 2025-09-01 03:16:30,825] Trial 327 finished with values: [-0.24899686655951503, 0.24889748625367428] and parameters: {'p_sma': 36, 'p_std': 53, 'p_atr': 29, 'p_adx': 15, 'rsi_period': 21, 'ema1': 21, 'ema2': 36, 'slip_atr_k': 0.17132842026538203, 'slip_spread_k': 0.11677296285111288, 'spread_hl_frac': 0.0023676650080448995, 'bb_std_mult': 3.3714747850019524, 'rsi_os': 16, 'rsi_ob': 75, 'vol_spike': 0.21624440749757187, 'adx_thresh': 33.4178141282121, 'atr_min_pct': 0.0265919249888399, 'atr_max_pct': 0.04710088821924258, 'tp_mult': 2.7316569621448608, 'tsl_mult': 0.40997759933534855, 'strategy': 'mean_reversion', 'time_stop': 163, 'use_sma': False, 'use_atr': False, 'use_adx': True, 'use_ema': False, 'use_spike': True, 'rsi_required': False, 'edge_k': 1.1800308870292344, 'edge_cap': 0.6136370507118148, 'bull_strategy': 'breakout', 'bull_bb_std_mult': 2.927264896508866, 'bull_rsi_os': 13, 'bull_rsi_ob': 90, 'bull_adx_thresh': 22.85659356205081, 'bull_atr_min_pct': 0.02658661242546111, 'bull_atr_max_pct': 0.08066377758289923, 'bull_tp_mult': 1.4072835872046923, 'bull_tsl_mult': 0.22189028668283675, 'bull_time_stop': 293, 'bull_use_sma': True, 'bull_use_ema': True, 'bull_use_atr': False, 'bull_use_adx': False, 'bull_use_spike': True, 'bull_rsi_required': False, 'bear_strategy': 'mean_reversion', 'bear_bb_std_mult': 2.9664071060639587, 'bear_rsi_os': 44, 'bear_rsi_ob': 56, 'bear_adx_thresh': 32.94985620008312, 'bear_atr_min_pct': 0.02589629846050008, 'bear_atr_max_pct': 0.026918639606618482, 'bear_tp_mult': 1.491030152284539, 'bear_tsl_mult': 0.17295603372103813, 'bear_time_stop': 149, 'bear_use_sma': False, 'bear_use_ema': False, 'bear_use_atr': True, 'bear_use_adx': False, 'bear_use_spike': True, 'bear_rsi_required': True, 'sideways_strategy': 'breakout', 'sideways_bb_std_mult': 1.227314981806972, 'sideways_rsi_os': 48, 'sideways_rsi_ob': 85, 'sideways_adx_thresh': 15.047056181846926, 'sideways_atr_min_pct': 0.00012886274725715068, 'sideways_atr_max_pct': 0.02485528389943054, 'sideways_tp_mult': 2.5148325049872495, 'sideways_tsl_mult': 0.7256707035154436, 'sideways_time_stop': 128, 'sideways_use_sma': True, 'sideways_use_ema': False, 'sideways_use_atr': True, 'sideways_use_adx': False, 'sideways_use_spike': True, 'sideways_rsi_required': False}.
[I 2025-09-01 03:16:31,332] Trial 325 finished with values: [-0.04585160197627847, 0.04570569236933955] and parameters: {'p_sma': 32, 'p_std': 10, 'p_atr': 29, 'p_adx': 15, 'rsi_period': 80, 'ema1': 26, 'ema2': 36, 'slip_atr_k': 0.026036722716463692, 'slip_spread_k': 0.11752422992495963, 'spread_hl_frac': 0.029963157442366963, 'bb_std_mult': 1.6365517427301608, 'rsi_os': 16, 'rsi_ob': 84, 'vol_spike': 0.22492850009103732, 'adx_thresh': 8.606359617065412, 'atr_min_pct': 0.00199329113921168, 'atr_max_pct': 0.05249759885618782, 'tp_mult': 2.7332968707540877, 'tsl_mult': 0.3592904523772266, 'strategy': 'breakout', 'time_stop': 160, 'use_sma': True, 'use_atr': False, 'use_adx': False, 'use_ema': False, 'use_spike': True, 'rsi_required': False, 'edge_k': 0.04257249465092207, 'edge_cap': 0.6990495322492987, 'bull_strategy': 'breakout', 'bull_bb_std_mult': 2.889191691249872, 'bull_rsi_os': 25, 'bull_rsi_ob': 47, 'bull_adx_thresh': 22.815103820106295, 'bull_atr_min_pct': 0.0005885966581324276, 'bull_atr_max_pct': 0.04854397474481629, 'bull_tp_mult': 1.40935775822468, 'bull_tsl_mult': 0.23915839721276733, 'bull_time_stop': 290, 'bull_use_sma': True, 'bull_use_ema': False, 'bull_use_atr': False, 'bull_use_adx': True, 'bull_use_spike': True, 'bull_rsi_required': True, 'bear_strategy': 'breakout', 'bear_bb_std_mult': 3.590146654990101, 'bear_rsi_os': 40, 'bear_rsi_ob': 56, 'bear_adx_thresh': 20.3844472535121, 'bear_atr_min_pct': 0.027281666569973564, 'bear_atr_max_pct': 0.0660824636966653, 'bear_tp_mult': 1.486621724861996, 'bear_tsl_mult': 0.17230160827470592, 'bear_time_stop': 63, 'bear_use_sma': False, 'bear_use_ema': False, 'bear_use_atr': False, 'bear_use_adx': True, 'bear_use_spike': True, 'bear_rsi_required': True, 'sideways_strategy': 'breakout', 'sideways_bb_std_mult': 0.6489764919859267, 'sideways_rsi_os': 54, 'sideways_rsi_ob': 56, 'sideways_adx_thresh': 23.776104884802994, 'sideways_atr_min_pct': 0.028812834619165013, 'sideways_atr_max_pct': 0.030102827820254672, 'sideways_tp_mult': 1.6719651350500104, 'sideways_tsl_mult': 0.18680768330795416, 'sideways_time_stop': 131, 'sideways_use_sma': False, 'sideways_use_ema': True, 'sideways_use_atr': True, 'sideways_use_adx': True, 'sideways_use_spike': True, 'sideways_rsi_required': True}.
[I 2025-09-01 03:16:31,691] Trial 326 finished with values: [-1000000000.0, 1000000000.0] and parameters: {'p_sma': 31, 'p_std': 53, 'p_atr': 29, 'p_adx': 15, 'rsi_period': 81, 'ema1': 5, 'ema2': 28, 'slip_atr_k': 0.11541770559413796, 'slip_spread_k': 0.10326280227478887, 'spread_hl_frac': 0.037686147442945184, 'bb_std_mult': 1.8566000873774844, 'rsi_os': 36, 'rsi_ob': 84, 'vol_spike': 0.19193250421438607, 'adx_thresh': 8.562668464270477, 'atr_min_pct': 0.007215264813738295, 'atr_max_pct': 0.14958891349569037, 'tp_mult': 2.3284581997514864, 'tsl_mult': 0.3568416274628672, 'strategy': 'mean_reversion', 'time_stop': 160, 'use_sma': False, 'use_atr': False, 'use_adx': True, 'use_ema': False, 'use_spike': True, 'rsi_required': False, 'edge_k': 1.2405463776319585, 'edge_cap': 0.4689281251012379, 'bull_strategy': 'breakout', 'bull_bb_std_mult': 1.2534238475407427, 'bull_rsi_os': 12, 'bull_rsi_ob': 74, 'bull_adx_thresh': 22.92275347125333, 'bull_atr_min_pct': 0.0019568538081151986, 'bull_atr_max_pct': 0.019669581296934052, 'bull_tp_mult': 1.376856666595013, 'bull_tsl_mult': 0.20640932519300156, 'bull_time_stop': 157, 'bull_use_sma': True, 'bull_use_ema': False, 'bull_use_atr': False, 'bull_use_adx': True, 'bull_use_spike': True, 'bull_rsi_required': False, 'bear_strategy': 'breakout', 'bear_bb_std_mult': 2.2959525648491907, 'bear_rsi_os': 40, 'bear_rsi_ob': 57, 'bear_adx_thresh': 23.662707076204455, 'bear_atr_min_pct': 0.025750936494669346, 'bear_atr_max_pct': 0.027813343097417315, 'bear_tp_mult': 1.0118231310933832, 'bear_tsl_mult': 0.18009016010246803, 'bear_time_stop': 63, 'bear_use_sma': False, 'bear_use_ema': False, 'bear_use_atr': False, 'bear_use_adx': False, 'bear_use_spike': True, 'bear_rsi_required': True, 'sideways_strategy': 'breakout', 'sideways_bb_std_mult': 1.0591847694685352, 'sideways_rsi_os': 48, 'sideways_rsi_ob': 54, 'sideways_adx_thresh': 25.64854414679762, 'sideways_atr_min_pct': 0.026865544455373376, 'sideways_atr_max_pct': 0.028840853430348368, 'sideways_tp_mult': 2.8317037177734243, 'sideways_tsl_mult': 0.9979620546976598, 'sideways_time_stop': 29, 'sideways_use_sma': True, 'sideways_use_ema': True, 'sideways_use_atr': True, 'sideways_use_adx': True, 'sideways_use_spike': True, 'sideways_rsi_required': False}.
[I 2025-09-01 03:16:32,328] Trial 331 finished with values: [-1000000000.0, 1000000000.0] and parameters: {'p_sma': 6, 'p_std': 58, 'p_atr': 28, 'p_adx': 12, 'rsi_period': 70, 'ema1': 17, 'ema2': 59, 'slip_atr_k': 0.009033996544704055, 'slip_spread_k': 0.006974898789247341, 'spread_hl_frac': 0.024608000843876168, 'bb_std_mult': 1.2916070018557768, 'rsi_os': 38, 'rsi_ob': 48, 'vol_spike': 0.07731347417047582, 'adx_thresh': 12.205920204158614, 'atr_min_pct': 0.007191970424428276, 'atr_max_pct': 0.13314441396352908, 'tp_mult': 2.9581247424924904, 'tsl_mult': 0.5695909628515362, 'strategy': 'mean_reversion', 'time_stop': 153, 'use_sma': False, 'use_atr': False, 'use_adx': True, 'use_ema': False, 'use_spike': True, 'rsi_required': False, 'edge_k': 1.2410817241838736, 'edge_cap': 0.3433857679070361, 'bull_strategy': 'breakout', 'bull_bb_std_mult': 1.0472768588366157, 'bull_rsi_os': 12, 'bull_rsi_ob': 53, 'bull_adx_thresh': 25.70669086476562, 'bull_atr_min_pct': 0.0020119300534861104, 'bull_atr_max_pct': 0.05943287274506636, 'bull_tp_mult': 1.6568604839798864, 'bull_tsl_mult': 0.2953753265012785, 'bull_time_stop': 277, 'bull_use_sma': False, 'bull_use_ema': False, 'bull_use_atr': False, 'bull_use_adx': False, 'bull_use_spike': True, 'bull_rsi_required': False, 'bear_strategy': 'breakout', 'bear_bb_std_mult': 2.106080109085995, 'bear_rsi_os': 52, 'bear_rsi_ob': 57, 'bear_adx_thresh': 18.523905918959954, 'bear_atr_min_pct': 0.028868338040614776, 'bear_atr_max_pct': 0.07204537751663587, 'bear_tp_mult': 1.0514904484786085, 'bear_tsl_mult': 0.1247984626918519, 'bear_time_stop': 211, 'bear_use_sma': False, 'bear_use_ema': False, 'bear_use_atr': False, 'bear_use_adx': False, 'bear_use_spike': True, 'bear_rsi_required': True, 'sideways_strategy': 'mean_reversion', 'sideways_bb_std_mult': 1.5275111236791914, 'sideways_rsi_os': 49, 'sideways_rsi_ob': 72, 'sideways_adx_thresh': 5.223628037544454, 'sideways_atr_min_pct': 0.007890963150339528, 'sideways_atr_max_pct': 0.026256029053387902, 'sideways_tp_mult': 1.706387858982485, 'sideways_tsl_mult': 0.14790897902533517, 'sideways_time_stop': 137, 'sideways_use_sma': True, 'sideways_use_ema': True, 'sideways_use_atr': True, 'sideways_use_adx': False, 'sideways_use_spike': True, 'sideways_rsi_required': True}.
[I 2025-09-01 03:17:14,433] Trial 330 finished with values: [-0.038583023608045, 0.03814326831292052] and parameters: {'p_sma': 33, 'p_std': 58, 'p_atr': 10, 'p_adx': 30, 'rsi_period': 12, 'ema1': 27, 'ema2': 26, 'slip_atr_k': 0.011576243024265402, 'slip_spread_k': 0.008879640334527927, 'spread_hl_frac': 0.03735479548015029, 'bb_std_mult': 1.9074159825983277, 'rsi_os': 19, 'rsi_ob': 85, 'vol_spike': 0.07305923028240936, 'adx_thresh': 8.606876356031968, 'atr_min_pct': 0.009688252281440015, 'atr_max_pct': 0.05730250089039624, 'tp_mult': 2.334752847582693, 'tsl_mult': 0.13501389117703683, 'strategy': 'mean_reversion', 'time_stop': 157, 'use_sma': False, 'use_atr': False, 'use_adx': True, 'use_ema': False, 'use_spike': True, 'rsi_required': False, 'edge_k': 1.469677790720461, 'edge_cap': 0.5139622668478165, 'bull_strategy': 'breakout', 'bull_bb_std_mult': 1.0355359624022096, 'bull_rsi_os': 12, 'bull_rsi_ob': 74, 'bull_adx_thresh': 20.24566043777006, 'bull_atr_min_pct': 0.001983295411179882, 'bull_atr_max_pct': 0.018798130473991863, 'bull_tp_mult': 2.346763403788889, 'bull_tsl_mult': 0.07942697415543887, 'bull_time_stop': 274, 'bull_use_sma': False, 'bull_use_ema': False, 'bull_use_atr': False, 'bull_use_adx': False, 'bull_use_spike': True, 'bull_rsi_required': False, 'bear_strategy': 'breakout', 'bear_bb_std_mult': 2.2643216186183377, 'bear_rsi_os': 52, 'bear_rsi_ob': 81, 'bear_adx_thresh': 18.586915510849703, 'bear_atr_min_pct': 0.003156956931714399, 'bear_atr_max_pct': 0.07195507779242803, 'bear_tp_mult': 1.0124990183462648, 'bear_tsl_mult': 0.12452278392396021, 'bear_time_stop': 181, 'bear_use_sma': False, 'bear_use_ema': False, 'bear_use_atr': False, 'bear_use_adx': False, 'bear_use_spike': True, 'bear_rsi_required': True, 'sideways_strategy': 'breakout', 'sideways_bb_std_mult': 1.0457904720062634, 'sideways_rsi_os': 38, 'sideways_rsi_ob': 56, 'sideways_adx_thresh': 11.166432418291786, 'sideways_atr_min_pct': 0.027005523670480803, 'sideways_atr_max_pct': 0.028227669403363763, 'sideways_tp_mult': 1.7025999971126113, 'sideways_tsl_mult': 0.3543262256981808, 'sideways_time_stop': 120, 'sideways_use_sma': True, 'sideways_use_ema': True, 'sideways_use_atr': True, 'sideways_use_adx': True, 'sideways_use_spike': True, 'sideways_rsi_required': True}.
[I 2025-09-01 03:17:14,451] Trial 329 finished with values: [-1000000000.0, 1000000000.0] and parameters: {'p_sma': 31, 'p_std': 58, 'p_atr': 29, 'p_adx': 15, 'rsi_period': 9, 'ema1': 21, 'ema2': 56, 'slip_atr_k': 0.011322816854162723, 'slip_spread_k': 0.8897641580853443, 'spread_hl_frac': 0.03702511893087398, 'bb_std_mult': 1.285230762470876, 'rsi_os': 38, 'rsi_ob': 79, 'vol_spike': 0.19119146940132387, 'adx_thresh': 19.26991305413783, 'atr_min_pct': 0.024226001256668475, 'atr_max_pct': 0.08311139692788579, 'tp_mult': 2.8033653820211466, 'tsl_mult': 0.727448751808543, 'strategy': 'mean_reversion', 'time_stop': 16, 'use_sma': False, 'use_atr': False, 'use_adx': True, 'use_ema': False, 'use_spike': True, 'rsi_required': False, 'edge_k': 0.04051179965771995, 'edge_cap': 0.5131706516801205, 'bull_strategy': 'breakout', 'bull_bb_std_mult': 1.0610534860631735, 'bull_rsi_os': 34, 'bull_rsi_ob': 90, 'bull_adx_thresh': 9.871006769818479, 'bull_atr_min_pct': 0.0021047625596352726, 'bull_atr_max_pct': 0.017927506872624253, 'bull_tp_mult': 1.4060892741870623, 'bull_tsl_mult': 0.29482807607948397, 'bull_time_stop': 266, 'bull_use_sma': True, 'bull_use_ema': False, 'bull_use_atr': False, 'bull_use_adx': False, 'bull_use_spike': True, 'bull_rsi_required': False, 'bear_strategy': 'breakout', 'bear_bb_std_mult': 1.365478752705123, 'bear_rsi_os': 44, 'bear_rsi_ob': 56, 'bear_adx_thresh': 25.8489656629174, 'bear_atr_min_pct': 0.022956327264850963, 'bear_atr_max_pct': 0.0659548802429128, 'bear_tp_mult': 1.4765173852809776, 'bear_tsl_mult': 0.1286323767862713, 'bear_time_stop': 149, 'bear_use_sma': False, 'bear_use_ema': False, 'bear_use_atr': False, 'bear_use_adx': False, 'bear_use_spike': True, 'bear_rsi_required': True, 'sideways_strategy': 'breakout', 'sideways_bb_std_mult': 1.5352937583585085, 'sideways_rsi_os': 48, 'sideways_rsi_ob': 48, 'sideways_adx_thresh': 25.92164092740848, 'sideways_atr_min_pct': 0.027084564998061087, 'sideways_atr_max_pct': 0.02613070638811361, 'sideways_tp_mult': 1.6747089916822222, 'sideways_tsl_mult': 0.3820043609325216, 'sideways_time_stop': 129, 'sideways_use_sma': True, 'sideways_use_ema': True, 'sideways_use_atr': True, 'sideways_use_adx': False, 'sideways_use_spike': True, 'sideways_rsi_required': False}.
[I 2025-09-01 03:17:15,038] Trial 332 finished with values: [-1000000000.0, 1000000000.0] and parameters: {'p_sma': 10, 'p_std': 58, 'p_atr': 12, 'p_adx': 18, 'rsi_period': 9, 'ema1': 20, 'ema2': 57, 'slip_atr_k': 0.03425177959552964, 'slip_spread_k': 0.1410284085196294, 'spread_hl_frac': 0.02890151261000705, 'bb_std_mult': 2.0636366114757387, 'rsi_os': 19, 'rsi_ob': 81, 'vol_spike': 0.07653848082377027, 'adx_thresh': 10.557671578036627, 'atr_min_pct': 0.005328895412624879, 'atr_max_pct': 0.12171957894715268, 'tp_mult': 2.8188640504068223, 'tsl_mult': 0.32826546413525953, 'strategy': 'mean_reversion', 'time_stop': 231, 'use_sma': False, 'use_atr': False, 'use_adx': True, 'use_ema': False, 'use_spike': True, 'rsi_required': False, 'edge_k': 1.6115899488877246, 'edge_cap': 0.5147895311988127, 'bull_strategy': 'breakout', 'bull_bb_std_mult': 1.0272894925978373, 'bull_rsi_os': 35, 'bull_rsi_ob': 80, 'bull_adx_thresh': 25.817121091640967, 'bull_atr_min_pct': 0.0278851476604347, 'bull_atr_max_pct': 0.06049100180397804, 'bull_tp_mult': 1.5890880914384031, 'bull_tsl_mult': 0.9754278368094964, 'bull_time_stop': 274, 'bull_use_sma': False, 'bull_use_ema': False, 'bull_use_atr': False, 'bull_use_adx': False, 'bull_use_spike': True, 'bull_rsi_required': False, 'bear_strategy': 'breakout', 'bear_bb_std_mult': 2.104737558754307, 'bear_rsi_os': 52, 'bear_rsi_ob': 81, 'bear_adx_thresh': 24.60454026309642, 'bear_atr_min_pct': 0.026771820502848, 'bear_atr_max_pct': 0.03257936769738255, 'bear_tp_mult': 2.0491382284683612, 'bear_tsl_mult': 0.1422163995663358, 'bear_time_stop': 267, 'bear_use_sma': False, 'bear_use_ema': False, 'bear_use_atr': False, 'bear_use_adx': False, 'bear_use_spike': True, 'bear_rsi_required': True, 'sideways_strategy': 'mean_reversion', 'sideways_bb_std_mult': 1.8932038752366536, 'sideways_rsi_os': 47, 'sideways_rsi_ob': 73, 'sideways_adx_thresh': 34.918493602095104, 'sideways_atr_min_pct': 0.013924050004150876, 'sideways_atr_max_pct': 0.02598077280602887, 'sideways_tp_mult': 1.7195214824505098, 'sideways_tsl_mult': 0.15392491570268318, 'sideways_time_stop': 121, 'sideways_use_sma': True, 'sideways_use_ema': True, 'sideways_use_atr': False, 'sideways_use_adx': False, 'sideways_use_spike': True, 'sideways_rsi_required': True}.
