[I 2025-09-01 03:26:21,343] Trial 389 finished with values: [-0.02619273816764378, 0.02613188145822907] and parameters: {'p_sma': 31, 'p_std': 36, 'p_atr': 20, 'p_adx': 16, 'rsi_period': 12, 'ema1': 22, 'ema2': 57, 'slip_atr_k': 0.03376043453190335, 'slip_spread_k': 0.10470184317439904, 'spread_hl_frac': 0.02816154776238513, 'bb_std_mult': 2.1005425152282453, 'rsi_os': 16, 'rsi_ob': 77, 'vol_spike': 0.25305023312568625, 'adx_thresh': 15.677740300058677, 'atr_min_pct': 0.008682891092883905, 'atr_max_pct': 0.08131883578800599, 'tp_mult': 2.4886197469738116, 'tsl_mult': 0.24574101507565832, 'strategy': 'mean_reversion', 'time_stop': 170, 'use_sma': True, 'use_atr': True, 'use_adx': True, 'use_ema': False, 'use_spike': True, 'rsi_required': False, 'edge_k': 1.7109089733497402, 'edge_cap': 0.653140067593436, 'bull_strategy': 'mean_reversion', 'bull_bb_std_mult': 1.2515438394496752, 'bull_rsi_os': 18, 'bull_rsi_ob': 68, 'bull_adx_thresh': 8.128462445181952, 'bull_atr_min_pct': 0.0013572077520272727, 'bull_atr_max_pct': 0.10010711133206106, 'bull_tp_mult': 1.5018095477112654, 'bull_tsl_mult': 0.25606453372469756, 'bull_time_stop': 280, 'bull_use_sma': True, 'bull_use_ema': False, 'bull_use_atr': False, 'bull_use_adx': False, 'bull_use_spike': False, 'bull_rsi_required': False, 'bear_strategy': 'breakout', 'bear_bb_std_mult': 2.3198593822283935, 'bear_rsi_os': 43, 'bear_rsi_ob': 60, 'bear_adx_thresh': 24.248040924431173, 'bear_atr_min_pct': 0.02604231316185319, 'bear_atr_max_pct': 0.022555406562660543, 'bear_tp_mult': 1.4420314118783455, 'bear_tsl_mult': 0.8573091215846746, 'bear_time_stop': 55, 'bear_use_sma': False, 'bear_use_ema': True, 'bear_use_atr': False, 'bear_use_adx': False, 'bear_use_spike': True, 'bear_rsi_required': True, 'sideways_strategy': 'breakout', 'sideways_bb_std_mult': 1.7631691945018964, 'sideways_rsi_os': 32, 'sideways_rsi_ob': 75, 'sideways_adx_thresh': 27.18737497941678, 'sideways_atr_min_pct': 0.008229524920185229, 'sideways_atr_max_pct': 0.026339181170612524, 'sideways_tp_mult': 1.5720140157545293, 'sideways_tsl_mult': 0.16861908552032906, 'sideways_time_stop': 124, 'sideways_use_sma': True, 'sideways_use_ema': True, 'sideways_use_atr': True, 'sideways_use_adx': False, 'sideways_use_spike': True, 'sideways_rsi_required': False}.
[I 2025-09-01 03:26:21,366] Trial 387 finished with values: [-0.027231763360727967, 0.027077086412836193] and parameters: {'p_sma': 19, 'p_std': 29, 'p_atr': 28, 'p_adx': 18, 'rsi_period': 47, 'ema1': 16, 'ema2': 55, 'slip_atr_k': 0.01379279565758235, 'slip_spread_k': 0.4611417123665055, 'spread_hl_frac': 0.004010114047512649, 'bb_std_mult': 1.5845899975160638, 'rsi_os': 20, 'rsi_ob': 90, 'vol_spike': 0.11415702618633056, 'adx_thresh': 15.889700088352363, 'atr_min_pct': 0.006517555278590409, 'atr_max_pct': 0.050865034606479946, 'tp_mult': 2.672208262736805, 'tsl_mult': 0.4787162652588541, 'strategy': 'mean_reversion', 'time_stop': 170, 'use_sma': False, 'use_atr': False, 'use_adx': True, 'use_ema': False, 'use_spike': True, 'rsi_required': False, 'edge_k': 0.004321838004925707, 'edge_cap': 0.48280008261549495, 'bull_strategy': 'breakout', 'bull_bb_std_mult': 1.2880552456317589, 'bull_rsi_os': 7, 'bull_rsi_ob': 87, 'bull_adx_thresh': 6.557943712626223, 'bull_atr_min_pct': 0.001598927491605783, 'bull_atr_max_pct': 0.12296836153140242, 'bull_tp_mult': 1.5043782324127948, 'bull_tsl_mult': 0.8697045240619454, 'bull_time_stop': 281, 'bull_use_sma': True, 'bull_use_ema': False, 'bull_use_atr': False, 'bull_use_adx': False, 'bull_use_spike': False, 'bull_rsi_required': False, 'bear_strategy': 'breakout', 'bear_bb_std_mult': 2.189096215963271, 'bear_rsi_os': 53, 'bear_rsi_ob': 60, 'bear_adx_thresh': 29.73320929904113, 'bear_atr_min_pct': 0.02617259522003007, 'bear_atr_max_pct': 0.027105517832267542, 'bear_tp_mult': 1.08562704308462, 'bear_tsl_mult': 0.0953921745861679, 'bear_time_stop': 80, 'bear_use_sma': False, 'bear_use_ema': True, 'bear_use_atr': False, 'bear_use_adx': False, 'bear_use_spike': True, 'bear_rsi_required': True, 'sideways_strategy': 'breakout', 'sideways_bb_std_mult': 1.72751887571741, 'sideways_rsi_os': 24, 'sideways_rsi_ob': 75, 'sideways_adx_thresh': 29.189574140801604, 'sideways_atr_min_pct': 0.011991149205341896, 'sideways_atr_max_pct': 0.02245040825679517, 'sideways_tp_mult': 2.31336147832941, 'sideways_tsl_mult': 0.16751312563058618, 'sideways_time_stop': 73, 'sideways_use_sma': True, 'sideways_use_ema': True, 'sideways_use_atr': True, 'sideways_use_adx': False, 'sideways_use_spike': True, 'sideways_rsi_required': False}.
[I 2025-09-01 03:26:21,556] Trial 388 finished with values: [-1000000000.0, 1000000000.0] and parameters: {'p_sma': 31, 'p_std': 54, 'p_atr': 29, 'p_adx': 16, 'rsi_period': 12, 'ema1': 23, 'ema2': 55, 'slip_atr_k': 0.03319285058804196, 'slip_spread_k': 0.4703070092401281, 'spread_hl_frac': 0.033279866744427636, 'bb_std_mult': 1.4218284410445055, 'rsi_os': 22, 'rsi_ob': 77, 'vol_spike': 0.11335863001557975, 'adx_thresh': 19.40410395780528, 'atr_min_pct': 0.008945103909037022, 'atr_max_pct': 0.02931525619711025, 'tp_mult': 2.5405902273634653, 'tsl_mult': 0.25693785850551576, 'strategy': 'mean_reversion', 'time_stop': 170, 'use_sma': False, 'use_atr': True, 'use_adx': True, 'use_ema': False, 'use_spike': True, 'rsi_required': False, 'edge_k': 0.11894053761774159, 'edge_cap': 0.6209113937643128, 'bull_strategy': 'mean_reversion', 'bull_bb_std_mult': 0.7082312675148619, 'bull_rsi_os': 6, 'bull_rsi_ob': 51, 'bull_adx_thresh': 25.399686796340564, 'bull_atr_min_pct': 0.0015216863642674616, 'bull_atr_max_pct': 0.12173677496686543, 'bull_tp_mult': 2.0937019129997902, 'bull_tsl_mult': 0.26445345216613864, 'bull_time_stop': 272, 'bull_use_sma': True, 'bull_use_ema': False, 'bull_use_atr': False, 'bull_use_adx': False, 'bull_use_spike': False, 'bull_rsi_required': False, 'bear_strategy': 'breakout', 'bear_bb_std_mult': 2.190023161412376, 'bear_rsi_os': 50, 'bear_rsi_ob': 60, 'bear_adx_thresh': 15.616585363735787, 'bear_atr_min_pct': 0.02635143180889112, 'bear_atr_max_pct': 0.027499268041796886, 'bear_tp_mult': 1.711412453840175, 'bear_tsl_mult': 0.090394067549329, 'bear_time_stop': 283, 'bear_use_sma': False, 'bear_use_ema': True, 'bear_use_atr': False, 'bear_use_adx': False, 'bear_use_spike': True, 'bear_rsi_required': True, 'sideways_strategy': 'breakout', 'sideways_bb_std_mult': 1.9445627788336952, 'sideways_rsi_os': 32, 'sideways_rsi_ob': 94, 'sideways_adx_thresh': 30.076720845405056, 'sideways_atr_min_pct': 0.029730980316552302, 'sideways_atr_max_pct': 0.022376496491469534, 'sideways_tp_mult': 1.5779596996592002, 'sideways_tsl_mult': 0.22398877637896103, 'sideways_time_stop': 152, 'sideways_use_sma': True, 'sideways_use_ema': True, 'sideways_use_atr': True, 'sideways_use_adx': False, 'sideways_use_spike': True, 'sideways_rsi_required': False}.
[I 2025-09-01 03:26:22,302] Trial 392 finished with values: [-1000000000.0, 1000000000.0] and parameters: {'p_sma': 23, 'p_std': 54, 'p_atr': 29, 'p_adx': 17, 'rsi_period': 20, 'ema1': 21, 'ema2': 56, 'slip_atr_k': 0.05446782708180871, 'slip_spread_k': 0.5889214439393214, 'spread_hl_frac': 0.030285710768700624, 'bb_std_mult': 2.9196420382509825, 'rsi_os': 55, 'rsi_ob': 72, 'vol_spike': 0.19913662583884378, 'adx_thresh': 17.16043696289312, 'atr_min_pct': 0.009983863930362038, 'atr_max_pct': 0.04620082560297575, 'tp_mult': 1.4970637463046803, 'tsl_mult': 0.40170015022710753, 'strategy': 'mean_reversion', 'time_stop': 146, 'use_sma': False, 'use_atr': True, 'use_adx': False, 'use_ema': True, 'use_spike': True, 'rsi_required': False, 'edge_k': 0.23027151049040728, 'edge_cap': 0.41337837841940217, 'bull_strategy': 'mean_reversion', 'bull_bb_std_mult': 3.572796034638608, 'bull_rsi_os': 16, 'bull_rsi_ob': 51, 'bull_adx_thresh': 24.787070720754457, 'bull_atr_min_pct': 0.018051310513293367, 'bull_atr_max_pct': 0.03446789405028628, 'bull_tp_mult': 1.6899482637580587, 'bull_tsl_mult': 0.1700016921354609, 'bull_time_stop': 258, 'bull_use_sma': True, 'bull_use_ema': False, 'bull_use_atr': False, 'bull_use_adx': False, 'bull_use_spike': True, 'bull_rsi_required': False, 'bear_strategy': 'breakout', 'bear_bb_std_mult': 2.3697132089410022, 'bear_rsi_os': 23, 'bear_rsi_ob': 56, 'bear_adx_thresh': 28.88102992432517, 'bear_atr_min_pct': 0.027771344094434255, 'bear_atr_max_pct': 0.021960735300179748, 'bear_tp_mult': 1.0562071851843677, 'bear_tsl_mult': 0.1697571521344466, 'bear_time_stop': 144, 'bear_use_sma': True, 'bear_use_ema': False, 'bear_use_atr': True, 'bear_use_adx': True, 'bear_use_spike': True, 'bear_rsi_required': True, 'sideways_strategy': 'breakout', 'sideways_bb_std_mult': 2.576164807882851, 'sideways_rsi_os': 51, 'sideways_rsi_ob': 72, 'sideways_adx_thresh': 27.997161297253722, 'sideways_atr_min_pct': 0.010299413930429355, 'sideways_atr_max_pct': 0.031515456207236885, 'sideways_tp_mult': 1.7001369452086004, 'sideways_tsl_mult': 0.8363188831267925, 'sideways_time_stop': 141, 'sideways_use_sma': True, 'sideways_use_ema': False, 'sideways_use_atr': True, 'sideways_use_adx': False, 'sideways_use_spike': True, 'sideways_rsi_required': True}.
[I 2025-09-01 03:26:22,350] Trial 390 finished with values: [-1000000000.0, 1000000000.0] and parameters: {'p_sma': 19, 'p_std': 38, 'p_atr': 29, 'p_adx': 16, 'rsi_period': 20, 'ema1': 27, 'ema2': 57, 'slip_atr_k': 0.015071623690467257, 'slip_spread_k': 0.46154479173651014, 'spread_hl_frac': 0.003912285955473542, 'bb_std_mult': 1.4192302862755384, 'rsi_os': 55, 'rsi_ob': 77, 'vol_spike': 0.042071691304327044, 'adx_thresh': 19.428219931133157, 'atr_min_pct': 0.008926629148422224, 'atr_max_pct': 0.045700658355530534, 'tp_mult': 2.9285295071461217, 'tsl_mult': 0.07212558163363253, 'strategy': 'mean_reversion', 'time_stop': 12, 'use_sma': True, 'use_atr': True, 'use_adx': True, 'use_ema': False, 'use_spike': True, 'rsi_required': False, 'edge_k': 0.600785462490786, 'edge_cap': 0.4782424891413275, 'bull_strategy': 'mean_reversion', 'bull_bb_std_mult': 3.000657784731981, 'bull_rsi_os': 6, 'bull_rsi_ob': 51, 'bull_adx_thresh': 25.193058741210226, 'bull_atr_min_pct': 0.0011042292478351688, 'bull_atr_max_pct': 0.1365523742867202, 'bull_tp_mult': 1.6425820744440427, 'bull_tsl_mult': 0.2585404948530533, 'bull_time_stop': 271, 'bull_use_sma': True, 'bull_use_ema': False, 'bull_use_atr': False, 'bull_use_adx': False, 'bull_use_spike': False, 'bull_rsi_required': False, 'bear_strategy': 'breakout', 'bear_bb_std_mult': 2.3645193877448167, 'bear_rsi_os': 39, 'bear_rsi_ob': 60, 'bear_adx_thresh': 29.43049204607375, 'bear_atr_min_pct': 0.007372733992841903, 'bear_atr_max_pct': 0.022932748780529193, 'bear_tp_mult': 1.0720944601369502, 'bear_tsl_mult': 0.679567197787752, 'bear_time_stop': 82, 'bear_use_sma': False, 'bear_use_ema': True, 'bear_use_atr': False, 'bear_use_adx': False, 'bear_use_spike': True, 'bear_rsi_required': True, 'sideways_strategy': 'breakout', 'sideways_bb_std_mult': 1.9029049616571518, 'sideways_rsi_os': 52, 'sideways_rsi_ob': 70, 'sideways_adx_thresh': 29.91882245170921, 'sideways_atr_min_pct': 0.029908533492268116, 'sideways_atr_max_pct': 0.02214646501472013, 'sideways_tp_mult': 2.9933145015226144, 'sideways_tsl_mult': 0.17468141530246487, 'sideways_time_stop': 143, 'sideways_use_sma': True, 'sideways_use_ema': True, 'sideways_use_atr': True, 'sideways_use_adx': False, 'sideways_use_spike': True, 'sideways_rsi_required': False}.
[I 2025-09-01 03:26:58,390] Trial 393 finished with values: [-1000000000.0, 1000000000.0] and parameters: {'p_sma': 50, 'p_std': 38, 'p_atr': 29, 'p_adx': 29, 'rsi_period': 36, 'ema1': 21, 'ema2': 42, 'slip_atr_k': 0.0001536581251770225, 'slip_spread_k': 0.5883036471949183, 'spread_hl_frac': 0.030443789952171365, 'bb_std_mult': 2.51115969018894, 'rsi_os': 28, 'rsi_ob': 53, 'vol_spike': 0.19969255642882755, 'adx_thresh': 28.19774043259034, 'atr_min_pct': 0.007454441414296198, 'atr_max_pct': 0.04571163095229757, 'tp_mult': 2.7497590110971957, 'tsl_mult': 0.41870095688301184, 'strategy': 'mean_reversion', 'time_stop': 159, 'use_sma': True, 'use_atr': False, 'use_adx': False, 'use_ema': True, 'use_spike': True, 'rsi_required': False, 'edge_k': 0.5665038149301733, 'edge_cap': 0.42100074107271596, 'bull_strategy': 'breakout', 'bull_bb_std_mult': 3.5869320923214545, 'bull_rsi_os': 45, 'bull_rsi_ob': 51, 'bull_adx_thresh': 27.862625573569886, 'bull_atr_min_pct': 0.0007940180089288237, 'bull_atr_max_pct': 0.11308419467741422, 'bull_tp_mult': 2.4364528319309118, 'bull_tsl_mult': 0.46057060514104164, 'bull_time_stop': 80, 'bull_use_sma': True, 'bull_use_ema': False, 'bull_use_atr': False, 'bull_use_adx': False, 'bull_use_spike': True, 'bull_rsi_required': False, 'bear_strategy': 'breakout', 'bear_bb_std_mult': 2.8965440129759044, 'bear_rsi_os': 23, 'bear_rsi_ob': 58, 'bear_adx_thresh': 24.6007314037616, 'bear_atr_min_pct': 0.028009266238923032, 'bear_atr_max_pct': 0.024253744659040517, 'bear_tp_mult': 1.0537881876774835, 'bear_tsl_mult': 0.17337526149131693, 'bear_time_stop': 215, 'bear_use_sma': True, 'bear_use_ema': False, 'bear_use_atr': True, 'bear_use_adx': True, 'bear_use_spike': True, 'bear_rsi_required': True, 'sideways_strategy': 'breakout', 'sideways_bb_std_mult': 1.890094540670822, 'sideways_rsi_os': 48, 'sideways_rsi_ob': 72, 'sideways_adx_thresh': 27.857254678927863, 'sideways_atr_min_pct': 0.010691264392269202, 'sideways_atr_max_pct': 0.03330445441624042, 'sideways_tp_mult': 2.378258192328454, 'sideways_tsl_mult': 0.19636530707635175, 'sideways_time_stop': 163, 'sideways_use_sma': True, 'sideways_use_ema': False, 'sideways_use_atr': False, 'sideways_use_adx': False, 'sideways_use_spike': True, 'sideways_rsi_required': True}.
[I 2025-09-01 03:26:59,867] Trial 391 finished with values: [-1000000000.0, 1000000000.0] and parameters: {'p_sma': 32, 'p_std': 54, 'p_atr': 29, 'p_adx': 24, 'rsi_period': 13, 'ema1': 21, 'ema2': 56, 'slip_atr_k': 0.021073491634507915, 'slip_spread_k': 0.5997360295328192, 'spread_hl_frac': 0.035003546880084654, 'bb_std_mult': 1.3994296586155555, 'rsi_os': 22, 'rsi_ob': 72, 'vol_spike': 0.19719976616685925, 'adx_thresh': 19.40593525254182, 'atr_min_pct': 0.008996425276951707, 'atr_max_pct': 0.04585300462308457, 'tp_mult': 2.614977544576819, 'tsl_mult': 0.4017395784867989, 'strategy': 'mean_reversion', 'time_stop': 158, 'use_sma': False, 'use_atr': True, 'use_adx': False, 'use_ema': True, 'use_spike': True, 'rsi_required': False, 'edge_k': 0.5889387420143565, 'edge_cap': 0.9285540378402877, 'bull_strategy': 'mean_reversion', 'bull_bb_std_mult': 3.555317048185767, 'bull_rsi_os': 16, 'bull_rsi_ob': 51, 'bull_adx_thresh': 25.42146935151792, 'bull_atr_min_pct': 0.0005704544692534554, 'bull_atr_max_pct': 0.03499944273591251, 'bull_tp_mult': 1.6746836825421476, 'bull_tsl_mult': 0.4501763437911462, 'bull_time_stop': 256, 'bull_use_sma': True, 'bull_use_ema': False, 'bull_use_atr': False, 'bull_use_adx': False, 'bull_use_spike': True, 'bull_rsi_required': False, 'bear_strategy': 'breakout', 'bear_bb_std_mult': 1.248151236850272, 'bear_rsi_os': 49, 'bear_rsi_ob': 87, 'bear_adx_thresh': 24.69173078740424, 'bear_atr_min_pct': 0.029999662376554492, 'bear_atr_max_pct': 0.02254280021233442, 'bear_tp_mult': 1.0664929797159524, 'bear_tsl_mult': 0.5233234095593616, 'bear_time_stop': 90, 'bear_use_sma': True, 'bear_use_ema': False, 'bear_use_atr': True, 'bear_use_adx': True, 'bear_use_spike': True, 'bear_rsi_required': True, 'sideways_strategy': 'breakout', 'sideways_bb_std_mult': 1.1133786719258225, 'sideways_rsi_os': 51, 'sideways_rsi_ob': 72, 'sideways_adx_thresh': 27.68702150863502, 'sideways_atr_min_pct': 0.029954517906633723, 'sideways_atr_max_pct': 0.0341352327510434, 'sideways_tp_mult': 1.6864714331206148, 'sideways_tsl_mult': 0.2306386443085297, 'sideways_time_stop': 142, 'sideways_use_sma': True, 'sideways_use_ema': False, 'sideways_use_atr': True, 'sideways_use_adx': False, 'sideways_use_spike': True, 'sideways_rsi_required': True}.
[I 2025-09-01 03:27:06,232] Trial 394 finished with values: [-0.019205012684836764, 0.019118237734080317] and parameters: {'p_sma': 39, 'p_std': 59, 'p_atr': 29, 'p_adx': 15, 'rsi_period': 15, 'ema1': 11, 'ema2': 58, 'slip_atr_k': 0.019251521517661477, 'slip_spread_k': 0.14170889213089283, 'spread_hl_frac': 0.025783913385433593, 'bb_std_mult': 1.4762854107805812, 'rsi_os': 34, 'rsi_ob': 75, 'vol_spike': 0.1222593848786075, 'adx_thresh': 27.860525631552534, 'atr_min_pct': 0.00597601485834221, 'atr_max_pct': 0.09491865781429322, 'tp_mult': 2.752389785309086, 'tsl_mult': 0.40718754757399617, 'strategy': 'mean_reversion', 'time_stop': 156, 'use_sma': True, 'use_atr': False, 'use_adx': True, 'use_ema': False, 'use_spike': False, 'rsi_required': True, 'edge_k': 0.10534848380670725, 'edge_cap': 0.4687113192131371, 'bull_strategy': 'breakout', 'bull_bb_std_mult': 2.995470208939427, 'bull_rsi_os': 47, 'bull_rsi_ob': 54, 'bull_adx_thresh': 21.28761752411246, 'bull_atr_min_pct': 0.00033500043058805123, 'bull_atr_max_pct': 0.11405680470277357, 'bull_tp_mult': 2.4963727628106547, 'bull_tsl_mult': 0.39240489421361974, 'bull_time_stop': 79, 'bull_use_sma': True, 'bull_use_ema': False, 'bull_use_atr': True, 'bull_use_adx': False, 'bull_use_spike': True, 'bull_rsi_required': False, 'bear_strategy': 'breakout', 'bear_bb_std_mult': 2.3574359916527454, 'bear_rsi_os': 46, 'bear_rsi_ob': 58, 'bear_adx_thresh': 24.70440137207728, 'bear_atr_min_pct': 0.028924932854057516, 'bear_atr_max_pct': 0.023127063343426648, 'bear_tp_mult': 1.0126055894398174, 'bear_tsl_mult': 0.5274291812552883, 'bear_time_stop': 90, 'bear_use_sma': False, 'bear_use_ema': False, 'bear_use_atr': False, 'bear_use_adx': False, 'bear_use_spike': False, 'bear_rsi_required': True, 'sideways_strategy': 'breakout', 'sideways_bb_std_mult': 1.3652097463068442, 'sideways_rsi_os': 52, 'sideways_rsi_ob': 76, 'sideways_adx_thresh': 30.765365754508007, 'sideways_atr_min_pct': 0.026431230387372467, 'sideways_atr_max_pct': 0.12919681916736608, 'sideways_tp_mult': 2.379995557256739, 'sideways_tsl_mult': 0.23177578793012193, 'sideways_time_stop': 113, 'sideways_use_sma': True, 'sideways_use_ema': True, 'sideways_use_atr': False, 'sideways_use_adx': False, 'sideways_use_spike': False, 'sideways_rsi_required': True}.
[I 2025-09-01 03:27:06,754] Trial 395 finished with values: [-1000000000.0, 1000000000.0] and parameters: {'p_sma': 32, 'p_std': 59, 'p_atr': 28, 'p_adx': 24, 'rsi_period': 15, 'ema1': 22, 'ema2': 58, 'slip_atr_k': 0.020653741231984345, 'slip_spread_k': 0.13878150720218224, 'spread_hl_frac': 0.025712929417521627, 'bb_std_mult': 2.5013044209035304, 'rsi_os': 19, 'rsi_ob': 75, 'vol_spike': 0.10428805353154433, 'adx_thresh': 9.169215867370179, 'atr_min_pct': 0.005852781594098722, 'atr_max_pct': 0.14688657416202164, 'tp_mult': 2.833370009614951, 'tsl_mult': 0.7151757800531953, 'strategy': 'mean_reversion', 'time_stop': 158, 'use_sma': False, 'use_atr': False, 'use_adx': True, 'use_ema': True, 'use_spike': False, 'rsi_required': True, 'edge_k': 0.6712181971929763, 'edge_cap': 0.4222283386181258, 'bull_strategy': 'breakout', 'bull_bb_std_mult': 1.1833770961991859, 'bull_rsi_os': 17, 'bull_rsi_ob': 76, 'bull_adx_thresh': 21.343640368664143, 'bull_atr_min_pct': 0.01218197428955511, 'bull_atr_max_pct': 0.11358133435596585, 'bull_tp_mult': 1.5906425592478723, 'bull_tsl_mult': 0.6834352986934231, 'bull_time_stop': 264, 'bull_use_sma': True, 'bull_use_ema': True, 'bull_use_atr': True, 'bull_use_adx': False, 'bull_use_spike': True, 'bull_rsi_required': False, 'bear_strategy': 'mean_reversion', 'bear_bb_std_mult': 1.2691774716903494, 'bear_rsi_os': 15, 'bear_rsi_ob': 82, 'bear_adx_thresh': 24.892966218861922, 'bear_atr_min_pct': 0.008750930246351676, 'bear_atr_max_pct': 0.029747113220639318, 'bear_tp_mult': 2.960824789638395, 'bear_tsl_mult': 0.14755357401804484, 'bear_time_stop': 161, 'bear_use_sma': False, 'bear_use_ema': False, 'bear_use_atr': False, 'bear_use_adx': False, 'bear_use_spike': False, 'bear_rsi_required': True, 'sideways_strategy': 'breakout', 'sideways_bb_std_mult': 1.8608383070642376, 'sideways_rsi_os': 46, 'sideways_rsi_ob': 73, 'sideways_adx_thresh': 27.485798909877413, 'sideways_atr_min_pct': 0.029079847563068154, 'sideways_atr_max_pct': 0.0170406928103468, 'sideways_tp_mult': 1.743854314669961, 'sideways_tsl_mult': 0.632436773373976, 'sideways_time_stop': 114, 'sideways_use_sma': True, 'sideways_use_ema': True, 'sideways_use_atr': False, 'sideways_use_adx': False, 'sideways_use_spike': False, 'sideways_rsi_required': True}.
