[I 2025-09-01 03:00:06,770] Trial 224 finished with values: [-0.020811979694635552, 0.02069771142543558] and parameters: {'p_sma': 33, 'p_std': 57, 'p_atr': 29, 'p_adx': 17, 'rsi_period': 10, 'ema1': 15, 'ema2': 58, 'slip_atr_k': 0.22073251270466412, 'slip_spread_k': 0.890365354088305, 'spread_hl_frac': 0.012438910120411595, 'bb_std_mult': 1.5301641099837904, 'rsi_os': 27, 'rsi_ob': 88, 'vol_spike': 0.21528454804619293, 'adx_thresh': 11.955438920649923, 'atr_min_pct': 0.007149234109117249, 'atr_max_pct': 0.11844993004602927, 'tp_mult': 2.68697372136405, 'tsl_mult': 0.29411935080465146, 'strategy': 'mean_reversion', 'time_stop': 264, 'use_sma': False, 'use_atr': False, 'use_adx': True, 'use_ema': False, 'use_spike': False, 'rsi_required': True, 'edge_k': 0.38731711768581334, 'edge_cap': 0.4258624541219288, 'bull_strategy': 'mean_reversion', 'bull_bb_std_mult': 1.2236990414958444, 'bull_rsi_os': 18, 'bull_rsi_ob': 60, 'bull_adx_thresh': 22.77957644042955, 'bull_atr_min_pct': 0.001238737758388238, 'bull_atr_max_pct': 0.045852658965327885, 'bull_tp_mult': 1.6237612805098791, 'bull_tsl_mult': 0.5148521904466526, 'bull_time_stop': 130, 'bull_use_sma': True, 'bull_use_ema': False, 'bull_use_atr': True, 'bull_use_adx': True, 'bull_use_spike': True, 'bull_rsi_required': False, 'bear_strategy': 'breakout', 'bear_bb_std_mult': 0.7437695477583253, 'bear_rsi_os': 25, 'bear_rsi_ob': 59, 'bear_adx_thresh': 32.1236804968523, 'bear_atr_min_pct': 0.018958212644217407, 'bear_atr_max_pct': 0.13199897278914136, 'bear_tp_mult': 1.0467778861123018, 'bear_tsl_mult': 0.030172286255225667, 'bear_time_stop': 61, 'bear_use_sma': False, 'bear_use_ema': False, 'bear_use_atr': False, 'bear_use_adx': False, 'bear_use_spike': False, 'bear_rsi_required': False, 'sideways_strategy': 'breakout', 'sideways_bb_std_mult': 1.8208974226160548, 'sideways_rsi_os': 14, 'sideways_rsi_ob': 57, 'sideways_adx_thresh': 19.95235266643929, 'sideways_atr_min_pct': 0.029344656587066073, 'sideways_atr_max_pct': 0.08225566247452726, 'sideways_tp_mult': 1.270514668351555, 'sideways_tsl_mult': 0.25873508392723144, 'sideways_time_stop': 112, 'sideways_use_sma': True, 'sideways_use_ema': True, 'sideways_use_atr': True, 'sideways_use_adx': False, 'sideways_use_spike': False, 'sideways_rsi_required': True}.
[I 2025-09-01 03:00:07,278] Trial 226 finished with values: [-1000000000.0, 1000000000.0] and parameters: {'p_sma': 27, 'p_std': 57, 'p_atr': 29, 'p_adx': 19, 'rsi_period': 14, 'ema1': 21, 'ema2': 29, 'slip_atr_k': 0.02444015820571476, 'slip_spread_k': 0.1470294050757948, 'spread_hl_frac': 0.02907738323832433, 'bb_std_mult': 1.320945055411126, 'rsi_os': 20, 'rsi_ob': 76, 'vol_spike': 0.20772553312779435, 'adx_thresh': 11.650394476351671, 'atr_min_pct': 0.007209609753719898, 'atr_max_pct': 0.059116627861382304, 'tp_mult': 2.681598786153583, 'tsl_mult': 0.3931499661178168, 'strategy': 'mean_reversion', 'time_stop': 172, 'use_sma': False, 'use_atr': False, 'use_adx': True, 'use_ema': False, 'use_spike': False, 'rsi_required': True, 'edge_k': 0.038557447568362546, 'edge_cap': 0.5481500257101732, 'bull_strategy': 'breakout', 'bull_bb_std_mult': 1.0419076946143317, 'bull_rsi_os': 14, 'bull_rsi_ob': 51, 'bull_adx_thresh': 23.898372611286458, 'bull_atr_min_pct': 0.0008078975664356713, 'bull_atr_max_pct': 0.11422389301989573, 'bull_tp_mult': 2.5828511478564296, 'bull_tsl_mult': 0.27504321701742784, 'bull_time_stop': 273, 'bull_use_sma': True, 'bull_use_ema': True, 'bull_use_atr': True, 'bull_use_adx': True, 'bull_use_spike': False, 'bull_rsi_required': False, 'bear_strategy': 'breakout', 'bear_bb_std_mult': 2.1244100082141757, 'bear_rsi_os': 50, 'bear_rsi_ob': 57, 'bear_adx_thresh': 24.494096093977273, 'bear_atr_min_pct': 0.02739809914733304, 'bear_atr_max_pct': 0.03130321674328906, 'bear_tp_mult': 2.8537481380357375, 'bear_tsl_mult': 0.16682636422619126, 'bear_time_stop': 80, 'bear_use_sma': False, 'bear_use_ema': True, 'bear_use_atr': False, 'bear_use_adx': False, 'bear_use_spike': False, 'bear_rsi_required': False, 'sideways_strategy': 'breakout', 'sideways_bb_std_mult': 1.9505622058733478, 'sideways_rsi_os': 48, 'sideways_rsi_ob': 57, 'sideways_adx_thresh': 24.822562654187177, 'sideways_atr_min_pct': 0.025692476356778363, 'sideways_atr_max_pct': 0.013374499689548208, 'sideways_tp_mult': 1.6887568781636924, 'sideways_tsl_mult': 0.1607714561476689, 'sideways_time_stop': 134, 'sideways_use_sma': True, 'sideways_use_ema': True, 'sideways_use_atr': True, 'sideways_use_adx': False, 'sideways_use_spike': False, 'sideways_rsi_required': True}.
[I 2025-09-01 03:00:07,472] Trial 227 finished with values: [-1000000000.0, 1000000000.0] and parameters: {'p_sma': 27, 'p_std': 55, 'p_atr': 27, 'p_adx': 16, 'rsi_period': 15, 'ema1': 22, 'ema2': 56, 'slip_atr_k': 0.026363600427652442, 'slip_spread_k': 0.14622913260704204, 'spread_hl_frac': 0.029634851898823596, 'bb_std_mult': 1.3126987945183552, 'rsi_os': 23, 'rsi_ob': 76, 'vol_spike': 0.20816854795813358, 'adx_thresh': 12.439797841990574, 'atr_min_pct': 0.007300089474472094, 'atr_max_pct': 0.05832760577238122, 'tp_mult': 2.6547380735920485, 'tsl_mult': 0.3909800624327748, 'strategy': 'mean_reversion', 'time_stop': 160, 'use_sma': False, 'use_atr': False, 'use_adx': True, 'use_ema': False, 'use_spike': True, 'rsi_required': False, 'edge_k': 0.062409471405786454, 'edge_cap': 0.4981946644311512, 'bull_strategy': 'breakout', 'bull_bb_std_mult': 0.9804648812303991, 'bull_rsi_os': 14, 'bull_rsi_ob': 50, 'bull_adx_thresh': 24.330455884942296, 'bull_atr_min_pct': 0.015864812785489305, 'bull_atr_max_pct': 0.1108601435942691, 'bull_tp_mult': 1.6785108665031065, 'bull_tsl_mult': 0.2826978465495264, 'bull_time_stop': 280, 'bull_use_sma': True, 'bull_use_ema': True, 'bull_use_atr': False, 'bull_use_adx': False, 'bull_use_spike': False, 'bull_rsi_required': False, 'bear_strategy': 'breakout', 'bear_bb_std_mult': 2.150501818571667, 'bear_rsi_os': 49, 'bear_rsi_ob': 57, 'bear_adx_thresh': 32.06059402283678, 'bear_atr_min_pct': 0.027597157461119442, 'bear_atr_max_pct': 0.031517191875678884, 'bear_tp_mult': 1.0410762146077488, 'bear_tsl_mult': 0.16918348198163646, 'bear_time_stop': 79, 'bear_use_sma': False, 'bear_use_ema': True, 'bear_use_atr': False, 'bear_use_adx': False, 'bear_use_spike': True, 'bear_rsi_required': True, 'sideways_strategy': 'mean_reversion', 'sideways_bb_std_mult': 1.9182310825622038, 'sideways_rsi_os': 46, 'sideways_rsi_ob': 75, 'sideways_adx_thresh': 25.187181677338934, 'sideways_atr_min_pct': 0.025724596762165597, 'sideways_atr_max_pct': 0.03530308123280965, 'sideways_tp_mult': 1.6736670183828972, 'sideways_tsl_mult': 0.15782683230850847, 'sideways_time_stop': 136, 'sideways_use_sma': True, 'sideways_use_ema': True, 'sideways_use_atr': True, 'sideways_use_adx': False, 'sideways_use_spike': True, 'sideways_rsi_required': True}.
[I 2025-09-01 03:00:49,002] Trial 231 finished with values: [-1000000000.0, 1000000000.0] and parameters: {'p_sma': 24, 'p_std': 19, 'p_atr': 13, 'p_adx': 18, 'rsi_period': 18, 'ema1': 22, 'ema2': 55, 'slip_atr_k': 0.03369823345789784, 'slip_spread_k': 0.1282262755683809, 'spread_hl_frac': 0.026650066253466515, 'bb_std_mult': 1.3849942665471227, 'rsi_os': 18, 'rsi_ob': 78, 'vol_spike': 0.21775359648122464, 'adx_thresh': 10.30454317341852, 'atr_min_pct': 0.005686614297586021, 'atr_max_pct': 0.05582642853121145, 'tp_mult': 2.852020295512639, 'tsl_mult': 0.4414605289891672, 'strategy': 'mean_reversion', 'time_stop': 197, 'use_sma': False, 'use_atr': False, 'use_adx': True, 'use_ema': True, 'use_spike': True, 'rsi_required': False, 'edge_k': 0.10156660589451563, 'edge_cap': 0.8264006279329432, 'bull_strategy': 'breakout', 'bull_bb_std_mult': 1.054804471651576, 'bull_rsi_os': 15, 'bull_rsi_ob': 48, 'bull_adx_thresh': 22.967277528047042, 'bull_atr_min_pct': 0.009193868288088759, 'bull_atr_max_pct': 0.11763438952056146, 'bull_tp_mult': 1.7618941104705184, 'bull_tsl_mult': 0.32973476807294205, 'bull_time_stop': 293, 'bull_use_sma': True, 'bull_use_ema': False, 'bull_use_atr': False, 'bull_use_adx': False, 'bull_use_spike': True, 'bull_rsi_required': False, 'bear_strategy': 'breakout', 'bear_bb_std_mult': 2.252079785773696, 'bear_rsi_os': 54, 'bear_rsi_ob': 59, 'bear_adx_thresh': 31.11242600160613, 'bear_atr_min_pct': 0.02681020177202766, 'bear_atr_max_pct': 0.026951398103263996, 'bear_tp_mult': 1.0129493650665269, 'bear_tsl_mult': 0.20362678815418545, 'bear_time_stop': 85, 'bear_use_sma': True, 'bear_use_ema': False, 'bear_use_atr': True, 'bear_use_adx': False, 'bear_use_spike': True, 'bear_rsi_required': True, 'sideways_strategy': 'breakout', 'sideways_bb_std_mult': 1.831126323628384, 'sideways_rsi_os': 52, 'sideways_rsi_ob': 76, 'sideways_adx_thresh': 26.59947067594756, 'sideways_atr_min_pct': 0.02655624873555995, 'sideways_atr_max_pct': 0.02133404494976099, 'sideways_tp_mult': 1.6266037511860825, 'sideways_tsl_mult': 0.12840644047363112, 'sideways_time_stop': 124, 'sideways_use_sma': True, 'sideways_use_ema': False, 'sideways_use_atr': True, 'sideways_use_adx': False, 'sideways_use_spike': True, 'sideways_rsi_required': True}.
[I 2025-09-01 03:00:49,239] Trial 229 finished with values: [-1000000000.0, 1000000000.0] and parameters: {'p_sma': 26, 'p_std': 59, 'p_atr': 18, 'p_adx': 17, 'rsi_period': 15, 'ema1': 22, 'ema2': 43, 'slip_atr_k': 0.23723613073300978, 'slip_spread_k': 0.12274410155303371, 'spread_hl_frac': 0.025738955904085672, 'bb_std_mult': 1.3980211531464957, 'rsi_os': 20, 'rsi_ob': 77, 'vol_spike': 0.20841637591941736, 'adx_thresh': 12.36077397969571, 'atr_min_pct': 0.005896706987118083, 'atr_max_pct': 0.0583625204319998, 'tp_mult': 2.860594415323192, 'tsl_mult': 0.38788973801239834, 'strategy': 'mean_reversion', 'time_stop': 171, 'use_sma': False, 'use_atr': False, 'use_adx': True, 'use_ema': True, 'use_spike': True, 'rsi_required': False, 'edge_k': 0.04448772239926342, 'edge_cap': 0.5532617388268355, 'bull_strategy': 'breakout', 'bull_bb_std_mult': 1.0364281684798766, 'bull_rsi_os': 14, 'bull_rsi_ob': 50, 'bull_adx_thresh': 24.405035624422833, 'bull_atr_min_pct': 0.027478959921266533, 'bull_atr_max_pct': 0.11604053191222594, 'bull_tp_mult': 1.6689205721140297, 'bull_tsl_mult': 0.3240772058134279, 'bull_time_stop': 285, 'bull_use_sma': True, 'bull_use_ema': True, 'bull_use_atr': False, 'bull_use_adx': False, 'bull_use_spike': True, 'bull_rsi_required': False, 'bear_strategy': 'breakout', 'bear_bb_std_mult': 2.0997302392028185, 'bear_rsi_os': 49, 'bear_rsi_ob': 57, 'bear_adx_thresh': 24.913898294548673, 'bear_atr_min_pct': 0.027097769940392907, 'bear_atr_max_pct': 0.02664807916564026, 'bear_tp_mult': 2.918042871436672, 'bear_tsl_mult': 0.15804633669279977, 'bear_time_stop': 85, 'bear_use_sma': False, 'bear_use_ema': True, 'bear_use_atr': True, 'bear_use_adx': False, 'bear_use_spike': True, 'bear_rsi_required': True, 'sideways_strategy': 'breakout', 'sideways_bb_std_mult': 1.9450815793976381, 'sideways_rsi_os': 48, 'sideways_rsi_ob': 75, 'sideways_adx_thresh': 24.435936837736485, 'sideways_atr_min_pct': 0.026133401476137828, 'sideways_atr_max_pct': 0.0344655733739954, 'sideways_tp_mult': 1.6619931995127946, 'sideways_tsl_mult': 0.13272759545574747, 'sideways_time_stop': 124, 'sideways_use_sma': True, 'sideways_use_ema': False, 'sideways_use_atr': True, 'sideways_use_adx': False, 'sideways_use_spike': True, 'sideways_rsi_required': True}.
[I 2025-09-01 03:00:49,822] Trial 230 finished with values: [-0.05263092112846712, 0.05244397814685418] and parameters: {'p_sma': 27, 'p_std': 19, 'p_atr': 16, 'p_adx': 16, 'rsi_period': 17, 'ema1': 22, 'ema2': 56, 'slip_atr_k': 0.2404761477887148, 'slip_spread_k': 0.11935322010004604, 'spread_hl_frac': 0.026413849274254563, 'bb_std_mult': 1.3473158498621298, 'rsi_os': 18, 'rsi_ob': 79, 'vol_spike': 0.21350480887122128, 'adx_thresh': 12.503531552905926, 'atr_min_pct': 0.0006513229050107028, 'atr_max_pct': 0.05487300849752741, 'tp_mult': 2.6402981268142676, 'tsl_mult': 0.4373846185236612, 'strategy': 'mean_reversion', 'time_stop': 197, 'use_sma': False, 'use_atr': False, 'use_adx': True, 'use_ema': True, 'use_spike': True, 'rsi_required': False, 'edge_k': 0.12062481469368039, 'edge_cap': 0.4978762652876927, 'bull_strategy': 'breakout', 'bull_bb_std_mult': 0.9003436056945835, 'bull_rsi_os': 14, 'bull_rsi_ob': 48, 'bull_adx_thresh': 5.92599428283147, 'bull_atr_min_pct': 0.0013713830295509115, 'bull_atr_max_pct': 0.11553453053175265, 'bull_tp_mult': 1.7525175277514007, 'bull_tsl_mult': 0.33030751434453376, 'bull_time_stop': 283, 'bull_use_sma': True, 'bull_use_ema': False, 'bull_use_atr': False, 'bull_use_adx': False, 'bull_use_spike': True, 'bull_rsi_required': False, 'bear_strategy': 'breakout', 'bear_bb_std_mult': 2.219527000574802, 'bear_rsi_os': 54, 'bear_rsi_ob': 57, 'bear_adx_thresh': 24.99856864461773, 'bear_atr_min_pct': 0.026902939258733462, 'bear_atr_max_pct': 0.02035880331809445, 'bear_tp_mult': 1.0451379111361638, 'bear_tsl_mult': 0.19030617474701136, 'bear_time_stop': 73, 'bear_use_sma': True, 'bear_use_ema': False, 'bear_use_atr': True, 'bear_use_adx': False, 'bear_use_spike': True, 'bear_rsi_required': True, 'sideways_strategy': 'mean_reversion', 'sideways_bb_std_mult': 1.9238548706252787, 'sideways_rsi_os': 48, 'sideways_rsi_ob': 75, 'sideways_adx_thresh': 25.658265951907936, 'sideways_atr_min_pct': 0.026051360963778303, 'sideways_atr_max_pct': 0.03322369832593928, 'sideways_tp_mult': 1.6317387985501972, 'sideways_tsl_mult': 0.12161238380727063, 'sideways_time_stop': 124, 'sideways_use_sma': True, 'sideways_use_ema': False, 'sideways_use_atr': True, 'sideways_use_adx': False, 'sideways_use_spike': True, 'sideways_rsi_required': True}.
[I 2025-09-01 03:00:50,258] Trial 228 finished with values: [-1000000000.0, 1000000000.0] and parameters: {'p_sma': 27, 'p_std': 59, 'p_atr': 27, 'p_adx': 16, 'rsi_period': 15, 'ema1': 22, 'ema2': 56, 'slip_atr_k': 0.23944718122313652, 'slip_spread_k': 0.11694922433919572, 'spread_hl_frac': 0.025917219007437566, 'bb_std_mult': 1.3963623639942235, 'rsi_os': 18, 'rsi_ob': 78, 'vol_spike': 0.21319797213892017, 'adx_thresh': 8.438005849736834, 'atr_min_pct': 0.005887997950829002, 'atr_max_pct': 0.055368170874839535, 'tp_mult': 2.6278728323793104, 'tsl_mult': 0.43537095043772683, 'strategy': 'mean_reversion', 'time_stop': 173, 'use_sma': False, 'use_atr': False, 'use_adx': True, 'use_ema': False, 'use_spike': True, 'rsi_required': False, 'edge_k': 0.10839291617525712, 'edge_cap': 0.5044843956736369, 'bull_strategy': 'breakout', 'bull_bb_std_mult': 1.0362380250359866, 'bull_rsi_os': 14, 'bull_rsi_ob': 50, 'bull_adx_thresh': 24.43587281370864, 'bull_atr_min_pct': 0.015736351082634666, 'bull_atr_max_pct': 0.11527024403849222, 'bull_tp_mult': 1.7502353265498143, 'bull_tsl_mult': 0.3351142278253201, 'bull_time_stop': 282, 'bull_use_sma': True, 'bull_use_ema': False, 'bull_use_atr': False, 'bull_use_adx': False, 'bull_use_spike': True, 'bull_rsi_required': False, 'bear_strategy': 'breakout', 'bear_bb_std_mult': 2.1084688056690175, 'bear_rsi_os': 54, 'bear_rsi_ob': 57, 'bear_adx_thresh': 24.786656442947113, 'bear_atr_min_pct': 0.027344957586621543, 'bear_atr_max_pct': 0.026466697280747267, 'bear_tp_mult': 2.8850234446776, 'bear_tsl_mult': 0.2016846416678646, 'bear_time_stop': 86, 'bear_use_sma': False, 'bear_use_ema': True, 'bear_use_atr': False, 'bear_use_adx': False, 'bear_use_spike': True, 'bear_rsi_required': True, 'sideways_strategy': 'mean_reversion', 'sideways_bb_std_mult': 1.954230333837271, 'sideways_rsi_os': 48, 'sideways_rsi_ob': 75, 'sideways_adx_thresh': 24.235850569117524, 'sideways_atr_min_pct': 0.02590761770229611, 'sideways_atr_max_pct': 0.03331056618993775, 'sideways_tp_mult': 1.6514217458311289, 'sideways_tsl_mult': 0.14801814532149699, 'sideways_time_stop': 125, 'sideways_use_sma': True, 'sideways_use_ema': True, 'sideways_use_atr': True, 'sideways_use_adx': False, 'sideways_use_spike': True, 'sideways_rsi_required': True}.
[I 2025-09-01 03:01:34,975] Trial 233 finished with values: [-1000000000.0, 1000000000.0] and parameters: {'p_sma': 24, 'p_std': 59, 'p_atr': 28, 'p_adx': 29, 'rsi_period': 13, 'ema1': 20, 'ema2': 56, 'slip_atr_k': 0.11307575305998592, 'slip_spread_k': 0.1131948212169164, 'spread_hl_frac': 0.03436490765951237, 'bb_std_mult': 1.385701772544741, 'rsi_os': 25, 'rsi_ob': 94, 'vol_spike': 0.21415330379992764, 'adx_thresh': 8.686298856900082, 'atr_min_pct': 0.007764722165446707, 'atr_max_pct': 0.05474305618988455, 'tp_mult': 2.5737520153160833, 'tsl_mult': 0.42787138937039604, 'strategy': 'mean_reversion', 'time_stop': 179, 'use_sma': False, 'use_atr': True, 'use_adx': True, 'use_ema': False, 'use_spike': True, 'rsi_required': False, 'edge_k': 0.11803217976401248, 'edge_cap': 0.4833190331225155, 'bull_strategy': 'breakout', 'bull_bb_std_mult': 0.9092816798534937, 'bull_rsi_os': 35, 'bull_rsi_ob': 54, 'bull_adx_thresh': 10.431809007048543, 'bull_atr_min_pct': 0.020800457793712496, 'bull_atr_max_pct': 0.11578900629043365, 'bull_tp_mult': 1.7338276023484873, 'bull_tsl_mult': 0.14655302896539024, 'bull_time_stop': 264, 'bull_use_sma': True, 'bull_use_ema': False, 'bull_use_atr': False, 'bull_use_adx': False, 'bull_use_spike': True, 'bull_rsi_required': False, 'bear_strategy': 'breakout', 'bear_bb_std_mult': 1.9812459209575157, 'bear_rsi_os': 52, 'bear_rsi_ob': 58, 'bear_adx_thresh': 25.292696737221675, 'bear_atr_min_pct': 0.02817075962790666, 'bear_atr_max_pct': 0.022101014576812787, 'bear_tp_mult': 1.0477794609605937, 'bear_tsl_mult': 0.12017126272768272, 'bear_time_stop': 74, 'bear_use_sma': True, 'bear_use_ema': False, 'bear_use_atr': False, 'bear_use_adx': False, 'bear_use_spike': True, 'bear_rsi_required': True, 'sideways_strategy': 'breakout', 'sideways_bb_std_mult': 1.8501716672216688, 'sideways_rsi_os': 50, 'sideways_rsi_ob': 90, 'sideways_adx_thresh': 21.459639281447032, 'sideways_atr_min_pct': 0.027067281532340632, 'sideways_atr_max_pct': 0.04053287078889665, 'sideways_tp_mult': 1.7517799473850615, 'sideways_tsl_mult': 0.17703807735147853, 'sideways_time_stop': 197, 'sideways_use_sma': True, 'sideways_use_ema': True, 'sideways_use_atr': True, 'sideways_use_adx': False, 'sideways_use_spike': True, 'sideways_rsi_required': True}.
[I 2025-09-01 03:01:35,338] Trial 232 finished with values: [-1000000000.0, 1000000000.0] and parameters: {'p_sma': 47, 'p_std': 59, 'p_atr': 28, 'p_adx': 29, 'rsi_period': 14, 'ema1': 20, 'ema2': 46, 'slip_atr_k': 0.22094592124515272, 'slip_spread_k': 0.17014502613739793, 'spread_hl_frac': 0.03429984731340499, 'bb_std_mult': 1.395631943227758, 'rsi_os': 25, 'rsi_ob': 80, 'vol_spike': 0.213525062924966, 'adx_thresh': 8.743064166441506, 'atr_min_pct': 0.007937142273641545, 'atr_max_pct': 0.05432212972398555, 'tp_mult': 2.5638566582992004, 'tsl_mult': 0.40884894267435506, 'strategy': 'mean_reversion', 'time_stop': 183, 'use_sma': False, 'use_atr': True, 'use_adx': True, 'use_ema': False, 'use_spike': True, 'rsi_required': False, 'edge_k': 0.11493541301263471, 'edge_cap': 0.47664989811764286, 'bull_strategy': 'breakout', 'bull_bb_std_mult': 0.9436966232268973, 'bull_rsi_os': 33, 'bull_rsi_ob': 54, 'bull_adx_thresh': 22.700237940633468, 'bull_atr_min_pct': 0.001160369504220745, 'bull_atr_max_pct': 0.11524965588699952, 'bull_tp_mult': 1.737340032996486, 'bull_tsl_mult': 0.13401953572181935, 'bull_time_stop': 260, 'bull_use_sma': True, 'bull_use_ema': False, 'bull_use_atr': False, 'bull_use_adx': False, 'bull_use_spike': True, 'bull_rsi_required': False, 'bear_strategy': 'breakout', 'bear_bb_std_mult': 2.277164592444233, 'bear_rsi_os': 54, 'bear_rsi_ob': 58, 'bear_adx_thresh': 33.350337385130544, 'bear_atr_min_pct': 0.02831122767258059, 'bear_atr_max_pct': 0.020548335705775935, 'bear_tp_mult': 1.0418014519666392, 'bear_tsl_mult': 0.12908383339095017, 'bear_time_stop': 5, 'bear_use_sma': True, 'bear_use_ema': False, 'bear_use_atr': False, 'bear_use_adx': False, 'bear_use_spike': True, 'bear_rsi_required': True, 'sideways_strategy': 'breakout', 'sideways_bb_std_mult': 1.8380429567506065, 'sideways_rsi_os': 50, 'sideways_rsi_ob': 63, 'sideways_adx_thresh': 21.01307553392851, 'sideways_atr_min_pct': 0.027126440214271574, 'sideways_atr_max_pct': 0.03264248922679409, 'sideways_tp_mult': 1.824284608842982, 'sideways_tsl_mult': 0.17458762406926853, 'sideways_time_stop': 202, 'sideways_use_sma': True, 'sideways_use_ema': True, 'sideways_use_atr': True, 'sideways_use_adx': False, 'sideways_use_spike': True, 'sideways_rsi_required': True}.
