[I 2025-09-01 03:34:09,017] Trial 430 finished with values: [-1000000000.0, 1000000000.0] and parameters: {'p_sma': 40, 'p_std': 25, 'p_atr': 28, 'p_adx': 14, 'rsi_period': 12, 'ema1': 21, 'ema2': 55, 'slip_atr_k': 0.16771504527487868, 'slip_spread_k': 0.7541509415882334, 'spread_hl_frac': 0.02976524241356058, 'bb_std_mult': 0.7070445709587136, 'rsi_os': 21, 'rsi_ob': 84, 'vol_spike': 0.28190715741569417, 'adx_thresh': 12.847999372384374, 'atr_min_pct': 0.0076650846534047565, 'atr_max_pct': 0.022683659079796657, 'tp_mult': 2.7100902259614954, 'tsl_mult': 0.011880821114621631, 'strategy': 'mean_reversion', 'time_stop': 165, 'use_sma': False, 'use_atr': False, 'use_adx': True, 'use_ema': False, 'use_spike': True, 'rsi_required': False, 'edge_k': 0.11403848477950809, 'edge_cap': 0.44471185981863326, 'bull_strategy': 'mean_reversion', 'bull_bb_std_mult': 0.6481658983176801, 'bull_rsi_os': 14, 'bull_rsi_ob': 54, 'bull_adx_thresh': 22.4623107288028, 'bull_atr_min_pct': 0.027975027812007787, 'bull_atr_max_pct': 0.029918368727212305, 'bull_tp_mult': 2.9485381452674995, 'bull_tsl_mult': 0.2666842171956777, 'bull_time_stop': 283, 'bull_use_sma': True, 'bull_use_ema': False, 'bull_use_atr': False, 'bull_use_adx': False, 'bull_use_spike': True, 'bull_rsi_required': False, 'bear_strategy': 'breakout', 'bear_bb_std_mult': 1.6783434790310507, 'bear_rsi_os': 49, 'bear_rsi_ob': 60, 'bear_adx_thresh': 23.490133947176172, 'bear_atr_min_pct': 0.0274902692183655, 'bear_atr_max_pct': 0.025447646482870782, 'bear_tp_mult': 1.9278132191260287, 'bear_tsl_mult': 0.5592500032255339, 'bear_time_stop': 50, 'bear_use_sma': False, 'bear_use_ema': False, 'bear_use_atr': False, 'bear_use_adx': False, 'bear_use_spike': True, 'bear_rsi_required': True, 'sideways_strategy': 'breakout', 'sideways_bb_std_mult': 1.5950939618157989, 'sideways_rsi_os': 46, 'sideways_rsi_ob': 82, 'sideways_adx_thresh': 28.913204193753245, 'sideways_atr_min_pct': 0.023282961752020867, 'sideways_atr_max_pct': 0.01697978656557043, 'sideways_tp_mult': 1.9975008085871577, 'sideways_tsl_mult': 0.16268870016233136, 'sideways_time_stop': 126, 'sideways_use_sma': True, 'sideways_use_ema': True, 'sideways_use_atr': True, 'sideways_use_adx': False, 'sideways_use_spike': True, 'sideways_rsi_required': True}.
[I 2025-09-01 03:34:57,184] Trial 435 finished with values: [-1000000000.0, 1000000000.0] and parameters: {'p_sma': 25, 'p_std': 59, 'p_atr': 19, 'p_adx': 27, 'rsi_period': 9, 'ema1': 27, 'ema2': 14, 'slip_atr_k': 0.22632690419990256, 'slip_spread_k': 0.8888317048702621, 'spread_hl_frac': 0.026348206426727964, 'bb_std_mult': 1.3422867246477976, 'rsi_os': 31, 'rsi_ob': 83, 'vol_spike': 0.008165468250429186, 'adx_thresh': 12.316884840170896, 'atr_min_pct': 0.007524120540653606, 'atr_max_pct': 0.044409986506567134, 'tp_mult': 2.7266031535293322, 'tsl_mult': 0.9999465910452537, 'strategy': 'breakout', 'time_stop': 241, 'use_sma': False, 'use_atr': False, 'use_adx': True, 'use_ema': False, 'use_spike': True, 'rsi_required': False, 'edge_k': 0.2573842410611824, 'edge_cap': 0.17016618764737823, 'bull_strategy': 'breakout', 'bull_bb_std_mult': 0.6554112573381241, 'bull_rsi_os': 47, 'bull_rsi_ob': 52, 'bull_adx_thresh': 22.21358335260796, 'bull_atr_min_pct': 0.015139757352243861, 'bull_atr_max_pct': 0.11473155676039966, 'bull_tp_mult': 1.9747862699632508, 'bull_tsl_mult': 0.20868157857340203, 'bull_time_stop': 70, 'bull_use_sma': True, 'bull_use_ema': False, 'bull_use_atr': False, 'bull_use_adx': True, 'bull_use_spike': True, 'bull_rsi_required': True, 'bear_strategy': 'breakout', 'bear_bb_std_mult': 2.60315073744267, 'bear_rsi_os': 52, 'bear_rsi_ob': 76, 'bear_adx_thresh': 11.728377336140474, 'bear_atr_min_pct': 0.026008758480439865, 'bear_atr_max_pct': 0.08502868621524637, 'bear_tp_mult': 1.1209804357264912, 'bear_tsl_mult': 0.11937409298502441, 'bear_time_stop': 223, 'bear_use_sma': False, 'bear_use_ema': False, 'bear_use_atr': False, 'bear_use_adx': False, 'bear_use_spike': True, 'bear_rsi_required': False, 'sideways_strategy': 'breakout', 'sideways_bb_std_mult': 1.7361134178552242, 'sideways_rsi_os': 45, 'sideways_rsi_ob': 75, 'sideways_adx_thresh': 27.57618853731146, 'sideways_atr_min_pct': 0.02840010501862339, 'sideways_atr_max_pct': 0.03586476224188072, 'sideways_tp_mult': 2.160735571487406, 'sideways_tsl_mult': 0.08841203738032877, 'sideways_time_stop': 138, 'sideways_use_sma': False, 'sideways_use_ema': True, 'sideways_use_atr': False, 'sideways_use_adx': True, 'sideways_use_spike': True, 'sideways_rsi_required': False}.
[I 2025-09-01 03:34:57,190] Trial 433 finished with values: [-1000000000.0, 1000000000.0] and parameters: {'p_sma': 25, 'p_std': 57, 'p_atr': 19, 'p_adx': 17, 'rsi_period': 12, 'ema1': 5, 'ema2': 58, 'slip_atr_k': 0.1645850964212098, 'slip_spread_k': 0.4884499982938598, 'spread_hl_frac': 0.02636002865817749, 'bb_std_mult': 1.5058762631439306, 'rsi_os': 21, 'rsi_ob': 83, 'vol_spike': 0.008516448775682112, 'adx_thresh': 12.264897155434122, 'atr_min_pct': 0.02642147284704039, 'atr_max_pct': 0.03699040490947591, 'tp_mult': 2.7224902326333917, 'tsl_mult': 0.1392553173241039, 'strategy': 'breakout', 'time_stop': 175, 'use_sma': False, 'use_atr': False, 'use_adx': True, 'use_ema': False, 'use_spike': True, 'rsi_required': False, 'edge_k': 0.10177562408703733, 'edge_cap': 0.7009788787492305, 'bull_strategy': 'mean_reversion', 'bull_bb_std_mult': 0.9940203815250196, 'bull_rsi_os': 28, 'bull_rsi_ob': 52, 'bull_adx_thresh': 24.571439717028916, 'bull_atr_min_pct': 0.0017110478461957023, 'bull_atr_max_pct': 0.1155211847604434, 'bull_tp_mult': 1.7452759882611772, 'bull_tsl_mult': 0.2623049505344829, 'bull_time_stop': 287, 'bull_use_sma': True, 'bull_use_ema': False, 'bull_use_atr': False, 'bull_use_adx': True, 'bull_use_spike': True, 'bull_rsi_required': True, 'bear_strategy': 'breakout', 'bear_bb_std_mult': 1.7755280148066526, 'bear_rsi_os': 19, 'bear_rsi_ob': 56, 'bear_adx_thresh': 11.84805820096764, 'bear_atr_min_pct': 0.027012122091093937, 'bear_atr_max_pct': 0.10438653471766024, 'bear_tp_mult': 2.285437440012092, 'bear_tsl_mult': 0.16697235998725374, 'bear_time_stop': 222, 'bear_use_sma': False, 'bear_use_ema': False, 'bear_use_atr': False, 'bear_use_adx': False, 'bear_use_spike': True, 'bear_rsi_required': False, 'sideways_strategy': 'breakout', 'sideways_bb_std_mult': 1.6189883806871537, 'sideways_rsi_os': 51, 'sideways_rsi_ob': 74, 'sideways_adx_thresh': 27.43649601164988, 'sideways_atr_min_pct': 0.02817356428483959, 'sideways_atr_max_pct': 0.03598008097249515, 'sideways_tp_mult': 1.7246553779791194, 'sideways_tsl_mult': 0.17464767376980567, 'sideways_time_stop': 118, 'sideways_use_sma': False, 'sideways_use_ema': True, 'sideways_use_atr': True, 'sideways_use_adx': False, 'sideways_use_spike': True, 'sideways_rsi_required': True}.
[I 2025-09-01 03:34:57,978] Trial 434 finished with values: [-1000000000.0, 1000000000.0] and parameters: {'p_sma': 37, 'p_std': 57, 'p_atr': 19, 'p_adx': 16, 'rsi_period': 29, 'ema1': 20, 'ema2': 46, 'slip_atr_k': 0.01875743327167622, 'slip_spread_k': 0.12424612414784875, 'spread_hl_frac': 0.028326408631758553, 'bb_std_mult': 1.3558543855117033, 'rsi_os': 19, 'rsi_ob': 83, 'vol_spike': 0.20761528034577229, 'adx_thresh': 12.896381041684414, 'atr_min_pct': 0.00766305443602997, 'atr_max_pct': 0.021879886339921835, 'tp_mult': 2.4288088609371434, 'tsl_mult': 0.3460002743407019, 'strategy': 'breakout', 'time_stop': 241, 'use_sma': False, 'use_atr': False, 'use_adx': True, 'use_ema': False, 'use_spike': True, 'rsi_required': False, 'edge_k': 0.123834906153515, 'edge_cap': 0.9669119277809894, 'bull_strategy': 'breakout', 'bull_bb_std_mult': 0.9992111797677924, 'bull_rsi_os': 14, 'bull_rsi_ob': 56, 'bull_adx_thresh': 24.771995059649843, 'bull_atr_min_pct': 0.0017244162934231385, 'bull_atr_max_pct': 0.11439328449199511, 'bull_tp_mult': 1.617065644365461, 'bull_tsl_mult': 0.9977704329932564, 'bull_time_stop': 287, 'bull_use_sma': True, 'bull_use_ema': True, 'bull_use_atr': False, 'bull_use_adx': True, 'bull_use_spike': True, 'bull_rsi_required': True, 'bear_strategy': 'breakout', 'bear_bb_std_mult': 2.609352787667703, 'bear_rsi_os': 46, 'bear_rsi_ob': 62, 'bear_adx_thresh': 25.613137525294423, 'bear_atr_min_pct': 0.02607680634709596, 'bear_atr_max_pct': 0.01857165767177371, 'bear_tp_mult': 1.1261484028094746, 'bear_tsl_mult': 0.5565306703688908, 'bear_time_stop': 17, 'bear_use_sma': False, 'bear_use_ema': False, 'bear_use_atr': False, 'bear_use_adx': False, 'bear_use_spike': True, 'bear_rsi_required': False, 'sideways_strategy': 'breakout', 'sideways_bb_std_mult': 1.7127735863656628, 'sideways_rsi_os': 45, 'sideways_rsi_ob': 61, 'sideways_adx_thresh': 28.66739620498654, 'sideways_atr_min_pct': 0.028284698835832105, 'sideways_atr_max_pct': 0.036168371455435805, 'sideways_tp_mult': 1.6720984236913592, 'sideways_tsl_mult': 0.34965525182834145, 'sideways_time_stop': 128, 'sideways_use_sma': False, 'sideways_use_ema': True, 'sideways_use_atr': True, 'sideways_use_adx': True, 'sideways_use_spike': True, 'sideways_rsi_required': True}.
[I 2025-09-01 03:34:58,572] Trial 436 finished with values: [-0.02882329240957293, 0.028715064352804912] and parameters: {'p_sma': 38, 'p_std': 13, 'p_atr': 28, 'p_adx': 16, 'rsi_period': 14, 'ema1': 24, 'ema2': 53, 'slip_atr_k': 0.018504946745918207, 'slip_spread_k': 0.10013694796920827, 'spread_hl_frac': 0.02608147310078536, 'bb_std_mult': 1.9258130353545257, 'rsi_os': 19, 'rsi_ob': 83, 'vol_spike': 0.004268273943830003, 'adx_thresh': 12.279007750108988, 'atr_min_pct': 0.008561506571767187, 'atr_max_pct': 0.06064799554154472, 'tp_mult': 1.7402381475474415, 'tsl_mult': 0.9819564731810411, 'strategy': 'breakout', 'time_stop': 174, 'use_sma': False, 'use_atr': False, 'use_adx': True, 'use_ema': False, 'use_spike': True, 'rsi_required': False, 'edge_k': 0.9768266138008281, 'edge_cap': 0.565503409179678, 'bull_strategy': 'breakout', 'bull_bb_std_mult': 0.8873349562379795, 'bull_rsi_os': 16, 'bull_rsi_ob': 52, 'bull_adx_thresh': 23.376477386050773, 'bull_atr_min_pct': 0.0015095957457869728, 'bull_atr_max_pct': 0.11394554250406308, 'bull_tp_mult': 1.6737485098094864, 'bull_tsl_mult': 0.19753439951986615, 'bull_time_stop': 289, 'bull_use_sma': False, 'bull_use_ema': False, 'bull_use_atr': False, 'bull_use_adx': True, 'bull_use_spike': True, 'bull_rsi_required': True, 'bear_strategy': 'breakout', 'bear_bb_std_mult': 1.8976559775511674, 'bear_rsi_os': 30, 'bear_rsi_ob': 77, 'bear_adx_thresh': 11.8495769269663, 'bear_atr_min_pct': 0.023875985727454203, 'bear_atr_max_pct': 0.08015733773536529, 'bear_tp_mult': 1.1405819401015944, 'bear_tsl_mult': 0.16910286799419924, 'bear_time_stop': 234, 'bear_use_sma': False, 'bear_use_ema': False, 'bear_use_atr': False, 'bear_use_adx': False, 'bear_use_spike': True, 'bear_rsi_required': False, 'sideways_strategy': 'breakout', 'sideways_bb_std_mult': 1.6887536832138323, 'sideways_rsi_os': 49, 'sideways_rsi_ob': 77, 'sideways_adx_thresh': 28.072205355952146, 'sideways_atr_min_pct': 0.009845951027140736, 'sideways_atr_max_pct': 0.02314610860003668, 'sideways_tp_mult': 1.6712783046313993, 'sideways_tsl_mult': 0.8986783186106425, 'sideways_time_stop': 139, 'sideways_use_sma': False, 'sideways_use_ema': True, 'sideways_use_atr': False, 'sideways_use_adx': True, 'sideways_use_spike': True, 'sideways_rsi_required': False}.
[I 2025-09-01 03:35:42,026] Trial 437 finished with values: [-1000000000.0, 1000000000.0] and parameters: {'p_sma': 35, 'p_std': 55, 'p_atr': 27, 'p_adx': 16, 'rsi_period': 14, 'ema1': 9, 'ema2': 56, 'slip_atr_k': 0.19363154436687852, 'slip_spread_k': 0.09655142764000316, 'spread_hl_frac': 0.02802676888197771, 'bb_std_mult': 1.4094972573678504, 'rsi_os': 23, 'rsi_ob': 86, 'vol_spike': 0.032785702533606936, 'adx_thresh': 11.140596969510927, 'atr_min_pct': 0.008454009283397007, 'atr_max_pct': 0.11927427513321287, 'tp_mult': 1.734079176969121, 'tsl_mult': 0.0437620778683569, 'strategy': 'mean_reversion', 'time_stop': 183, 'use_sma': False, 'use_atr': False, 'use_adx': True, 'use_ema': True, 'use_spike': False, 'rsi_required': True, 'edge_k': 0.02503108937219567, 'edge_cap': 0.5579994253803258, 'bull_strategy': 'breakout', 'bull_bb_std_mult': 1.2301994540386931, 'bull_rsi_os': 16, 'bull_rsi_ob': 53, 'bull_adx_thresh': 23.520633283597657, 'bull_atr_min_pct': 0.0018574490908178061, 'bull_atr_max_pct': 0.11141126057604109, 'bull_tp_mult': 1.6197889797400165, 'bull_tsl_mult': 0.8881160709644165, 'bull_time_stop': 262, 'bull_use_sma': False, 'bull_use_ema': True, 'bull_use_atr': True, 'bull_use_adx': False, 'bull_use_spike': False, 'bull_rsi_required': False, 'bear_strategy': 'breakout', 'bear_bb_std_mult': 2.467161149202232, 'bear_rsi_os': 51, 'bear_rsi_ob': 58, 'bear_adx_thresh': 25.71038976562272, 'bear_atr_min_pct': 0.023038174499624642, 'bear_atr_max_pct': 0.01868591837323511, 'bear_tp_mult': 1.0435915258301713, 'bear_tsl_mult': 0.2619647527209093, 'bear_time_stop': 232, 'bear_use_sma': False, 'bear_use_ema': True, 'bear_use_atr': False, 'bear_use_adx': False, 'bear_use_spike': False, 'bear_rsi_required': True, 'sideways_strategy': 'breakout', 'sideways_bb_std_mult': 2.0203770322028096, 'sideways_rsi_os': 48, 'sideways_rsi_ob': 77, 'sideways_adx_thresh': 29.677752231095656, 'sideways_atr_min_pct': 0.027527227676058908, 'sideways_atr_max_pct': 0.022529720299586296, 'sideways_tp_mult': 1.6617079615942942, 'sideways_tsl_mult': 0.33701605770247484, 'sideways_time_stop': 129, 'sideways_use_sma': True, 'sideways_use_ema': True, 'sideways_use_atr': True, 'sideways_use_adx': True, 'sideways_use_spike': False, 'sideways_rsi_required': True}.
[I 2025-09-01 03:35:42,531] Trial 438 finished with values: [-0.019295447086912443, 0.019351688617973192] and parameters: {'p_sma': 35, 'p_std': 52, 'p_atr': 27, 'p_adx': 16, 'rsi_period': 29, 'ema1': 15, 'ema2': 29, 'slip_atr_k': 0.1943772611834117, 'slip_spread_k': 0.0959904888369761, 'spread_hl_frac': 0.027433989619262526, 'bb_std_mult': 1.2378157134231444, 'rsi_os': 19, 'rsi_ob': 86, 'vol_spike': 0.05580896571970294, 'adx_thresh': 11.210642713972629, 'atr_min_pct': 0.008115900682464478, 'atr_max_pct': 0.09191242777588088, 'tp_mult': 1.709785496906912, 'tsl_mult': 0.055539255186387415, 'strategy': 'mean_reversion', 'time_stop': 178, 'use_sma': False, 'use_atr': False, 'use_adx': True, 'use_ema': True, 'use_spike': False, 'rsi_required': True, 'edge_k': 1.2716581043010846, 'edge_cap': 0.5639876635226261, 'bull_strategy': 'breakout', 'bull_bb_std_mult': 1.223972395448505, 'bull_rsi_os': 16, 'bull_rsi_ob': 56, 'bull_adx_thresh': 18.324194883637798, 'bull_atr_min_pct': 0.0019053215518042357, 'bull_atr_max_pct': 0.022155310435969987, 'bull_tp_mult': 1.6231144074175747, 'bull_tsl_mult': 0.1852610833900273, 'bull_time_stop': 263, 'bull_use_sma': False, 'bull_use_ema': True, 'bull_use_atr': True, 'bull_use_adx': False, 'bull_use_spike': False, 'bull_rsi_required': False, 'bear_strategy': 'breakout', 'bear_bb_std_mult': 1.916464686989188, 'bear_rsi_os': 30, 'bear_rsi_ob': 63, 'bear_adx_thresh': 25.76577808917923, 'bear_atr_min_pct': 0.024829445225526527, 'bear_atr_max_pct': 0.08117343484052263, 'bear_tp_mult': 1.8455890017852528, 'bear_tsl_mult': 0.13367030179563644, 'bear_time_stop': 232, 'bear_use_sma': False, 'bear_use_ema': True, 'bear_use_atr': False, 'bear_use_adx': False, 'bear_use_spike': False, 'bear_rsi_required': True, 'sideways_strategy': 'breakout', 'sideways_bb_std_mult': 2.0215308523442004, 'sideways_rsi_os': 49, 'sideways_rsi_ob': 69, 'sideways_adx_thresh': 28.179008339377404, 'sideways_atr_min_pct': 0.009815898372472693, 'sideways_atr_max_pct': 0.04253449516519795, 'sideways_tp_mult': 1.670126635244137, 'sideways_tsl_mult': 0.9002569787436171, 'sideways_time_stop': 130, 'sideways_use_sma': True, 'sideways_use_ema': True, 'sideways_use_atr': True, 'sideways_use_adx': True, 'sideways_use_spike': False, 'sideways_rsi_required': True}.
[I 2025-09-01 03:35:43,116] Trial 439 finished with values: [-0.023333630330827693, 0.0231431525295319] and parameters: {'p_sma': 54, 'p_std': 58, 'p_atr': 27, 'p_adx': 17, 'rsi_period': 15, 'ema1': 20, 'ema2': 57, 'slip_atr_k': 0.19878690932634885, 'slip_spread_k': 0.08743685197647652, 'spread_hl_frac': 0.027069373015659808, 'bb_std_mult': 1.218970867750153, 'rsi_os': 23, 'rsi_ob': 86, 'vol_spike': 0.23015830358928022, 'adx_thresh': 11.272387974633407, 'atr_min_pct': 0.018355426643475448, 'atr_max_pct': 0.09143547823843218, 'tp_mult': 2.6461280988777323, 'tsl_mult': 0.41745398249190857, 'strategy': 'mean_reversion', 'time_stop': 184, 'use_sma': False, 'use_atr': True, 'use_adx': True, 'use_ema': True, 'use_spike': False, 'rsi_required': True, 'edge_k': 0.03438028093412509, 'edge_cap': 0.5679347983092448, 'bull_strategy': 'breakout', 'bull_bb_std_mult': 3.2872842619115867, 'bull_rsi_os': 17, 'bull_rsi_ob': 53, 'bull_adx_thresh': 23.32160038629202, 'bull_atr_min_pct': 5.843050230407241e-06, 'bull_atr_max_pct': 0.10814585563656585, 'bull_tp_mult': 2.571127159460328, 'bull_tsl_mult': 0.2297064609273943, 'bull_time_stop': 194, 'bull_use_sma': False, 'bull_use_ema': False, 'bull_use_atr': True, 'bull_use_adx': False, 'bull_use_spike': False, 'bull_rsi_required': False, 'bear_strategy': 'mean_reversion', 'bear_bb_std_mult': 1.8946170266023141, 'bear_rsi_os': 51, 'bear_rsi_ob': 64, 'bear_adx_thresh': 22.436384697964627, 'bear_atr_min_pct': 0.02409439110751385, 'bear_atr_max_pct': 0.08061828945937027, 'bear_tp_mult': 2.9164009735143797, 'bear_tsl_mult': 0.13070039924561888, 'bear_time_stop': 232, 'bear_use_sma': True, 'bear_use_ema': True, 'bear_use_atr': False, 'bear_use_adx': False, 'bear_use_spike': False, 'bear_rsi_required': True, 'sideways_strategy': 'mean_reversion', 'sideways_bb_std_mult': 2.8793110285616508, 'sideways_rsi_os': 48, 'sideways_rsi_ob': 77, 'sideways_adx_thresh': 28.161648298015802, 'sideways_atr_min_pct': 0.02757334831707952, 'sideways_atr_max_pct': 0.023759697417845678, 'sideways_tp_mult': 1.8013907366961184, 'sideways_tsl_mult': 0.8366728518349438, 'sideways_time_stop': 182, 'sideways_use_sma': True, 'sideways_use_ema': True, 'sideways_use_atr': False, 'sideways_use_adx': False, 'sideways_use_spike': False, 'sideways_rsi_required': False}.
[I 2025-09-01 03:35:43,246] Trial 440 finished with values: [-1000000000.0, 1000000000.0] and parameters: {'p_sma': 18, 'p_std': 52, 'p_atr': 18, 'p_adx': 28, 'rsi_period': 9, 'ema1': 9, 'ema2': 25, 'slip_atr_k': 0.04850075562618987, 'slip_spread_k': 0.09246434540108324, 'spread_hl_frac': 0.02720694696169948, 'bb_std_mult': 1.4230481568458806, 'rsi_os': 22, 'rsi_ob': 85, 'vol_spike': 0.22931142115870895, 'adx_thresh': 11.136605981283957, 'atr_min_pct': 0.008536992698894864, 'atr_max_pct': 0.09214788217559099, 'tp_mult': 2.6651707142143004, 'tsl_mult': 0.04328882865182104, 'strategy': 'mean_reversion', 'time_stop': 180, 'use_sma': False, 'use_atr': True, 'use_adx': True, 'use_ema': True, 'use_spike': False, 'rsi_required': True, 'edge_k': 1.4998249024607397, 'edge_cap': 0.9493869342014458, 'bull_strategy': 'breakout', 'bull_bb_std_mult': 3.2834724031541938, 'bull_rsi_os': 17, 'bull_rsi_ob': 68, 'bull_adx_thresh': 23.030755306661845, 'bull_atr_min_pct': 4.800378533798065e-05, 'bull_atr_max_pct': 0.10763607099142332, 'bull_tp_mult': 2.559053770868466, 'bull_tsl_mult': 0.34937895369638067, 'bull_time_stop': 274, 'bull_use_sma': False, 'bull_use_ema': False, 'bull_use_atr': True, 'bull_use_adx': False, 'bull_use_spike': False, 'bull_rsi_required': False, 'bear_strategy': 'mean_reversion', 'bear_bb_std_mult': 1.3601491717667438, 'bear_rsi_os': 51, 'bear_rsi_ob': 86, 'bear_adx_thresh': 25.03115692778518, 'bear_atr_min_pct': 0.02509204061199751, 'bear_atr_max_pct': 0.11037042053257479, 'bear_tp_mult': 2.1549745117891006, 'bear_tsl_mult': 0.11801856184237164, 'bear_time_stop': 82, 'bear_use_sma': True, 'bear_use_ema': True, 'bear_use_atr': False, 'bear_use_adx': False, 'bear_use_spike': False, 'bear_rsi_required': True, 'sideways_strategy': 'mean_reversion', 'sideways_bb_std_mult': 2.8239742981383653, 'sideways_rsi_os': 49, 'sideways_rsi_ob': 75, 'sideways_adx_thresh': 29.673735766572364, 'sideways_atr_min_pct': 0.02736795734222415, 'sideways_atr_max_pct': 0.021637405006231854, 'sideways_tp_mult': 1.7857248059856108, 'sideways_tsl_mult': 0.82599888542527, 'sideways_time_stop': 182, 'sideways_use_sma': True, 'sideways_use_ema': True, 'sideways_use_atr': True, 'sideways_use_adx': False, 'sideways_use_spike': False, 'sideways_rsi_required': True}.
