[I 2025-09-01 03:30:47,569] Trial 415 finished with values: [-1000000000.0, 1000000000.0] and parameters: {'p_sma': 42, 'p_std': 5, 'p_atr': 30, 'p_adx': 18, 'rsi_period': 8, 'ema1': 22, 'ema2': 44, 'slip_atr_k': 0.09597525572962845, 'slip_spread_k': 0.2233588518145952, 'spread_hl_frac': 0.028779016918594642, 'bb_std_mult': 1.4758990747164125, 'rsi_os': 20, 'rsi_ob': 82, 'vol_spike': 0.21660573434920108, 'adx_thresh': 12.443067331061917, 'atr_min_pct': 0.021406095316709523, 'atr_max_pct': 0.04878079612973034, 'tp_mult': 2.5610287644615397, 'tsl_mult': 0.3538200225888849, 'strategy': 'mean_reversion', 'time_stop': 64, 'use_sma': False, 'use_atr': False, 'use_adx': True, 'use_ema': False, 'use_spike': False, 'rsi_required': True, 'edge_k': 1.3106039048032212, 'edge_cap': 0.7305354112431712, 'bull_strategy': 'breakout', 'bull_bb_std_mult': 1.562925520073054, 'bull_rsi_os': 43, 'bull_rsi_ob': 55, 'bull_adx_thresh': 23.762549976267767, 'bull_atr_min_pct': 0.026424477007472844, 'bull_atr_max_pct': 0.11134395495657576, 'bull_tp_mult': 1.6347945647168645, 'bull_tsl_mult': 0.2421346219422019, 'bull_time_stop': 12, 'bull_use_sma': True, 'bull_use_ema': True, 'bull_use_atr': True, 'bull_use_adx': False, 'bull_use_spike': True, 'bull_rsi_required': False, 'bear_strategy': 'breakout', 'bear_bb_std_mult': 1.996989579201893, 'bear_rsi_os': 53, 'bear_rsi_ob': 58, 'bear_adx_thresh': 24.32343426645149, 'bear_atr_min_pct': 0.02764774400585184, 'bear_atr_max_pct': 0.05590104980265263, 'bear_tp_mult': 2.0074732998185496, 'bear_tsl_mult': 0.1986192210445049, 'bear_time_stop': 60, 'bear_use_sma': False, 'bear_use_ema': False, 'bear_use_atr': False, 'bear_use_adx': False, 'bear_use_spike': False, 'bear_rsi_required': True, 'sideways_strategy': 'mean_reversion', 'sideways_bb_std_mult': 1.7024979403236267, 'sideways_rsi_os': 49, 'sideways_rsi_ob': 55, 'sideways_adx_thresh': 29.511834183315557, 'sideways_atr_min_pct': 0.017310719311716627, 'sideways_atr_max_pct': 0.021566198401081302, 'sideways_tp_mult': 2.748245508537888, 'sideways_tsl_mult': 0.19036115507557888, 'sideways_time_stop': 233, 'sideways_use_sma': True, 'sideways_use_ema': True, 'sideways_use_atr': True, 'sideways_use_adx': False, 'sideways_use_spike': False, 'sideways_rsi_required': True}.
[I 2025-09-01 03:30:48,347] Trial 412 finished with values: [-1000000000.0, 1000000000.0] and parameters: {'p_sma': 17, 'p_std': 56, 'p_atr': 26, 'p_adx': 18, 'rsi_period': 13, 'ema1': 12, 'ema2': 54, 'slip_atr_k': 0.01219857944470956, 'slip_spread_k': 0.11770040039499396, 'spread_hl_frac': 0.027583433773353868, 'bb_std_mult': 2.821226567271328, 'rsi_os': 21, 'rsi_ob': 85, 'vol_spike': 0.22373120088037116, 'adx_thresh': 33.71739893446969, 'atr_min_pct': 0.008381357797015798, 'atr_max_pct': 0.04292580700606471, 'tp_mult': 2.735769799536776, 'tsl_mult': 0.3407742758481038, 'strategy': 'mean_reversion', 'time_stop': 70, 'use_sma': False, 'use_atr': False, 'use_adx': True, 'use_ema': False, 'use_spike': True, 'rsi_required': False, 'edge_k': 1.6008450599825987, 'edge_cap': 0.24703584621846114, 'bull_strategy': 'breakout', 'bull_bb_std_mult': 1.2456275868180118, 'bull_rsi_os': 43, 'bull_rsi_ob': 55, 'bull_adx_thresh': 23.897851613471403, 'bull_atr_min_pct': 0.0028107506224091597, 'bull_atr_max_pct': 0.11086175855100672, 'bull_tp_mult': 1.6388339010871162, 'bull_tsl_mult': 0.24572131032211833, 'bull_time_stop': 250, 'bull_use_sma': True, 'bull_use_ema': False, 'bull_use_atr': False, 'bull_use_adx': False, 'bull_use_spike': True, 'bull_rsi_required': False, 'bear_strategy': 'breakout', 'bear_bb_std_mult': 2.586521131359742, 'bear_rsi_os': 52, 'bear_rsi_ob': 55, 'bear_adx_thresh': 23.959751898345854, 'bear_atr_min_pct': 0.0211324918124286, 'bear_atr_max_pct': 0.09178403873151607, 'bear_tp_mult': 1.7921810785078138, 'bear_tsl_mult': 0.06595906636678728, 'bear_time_stop': 78, 'bear_use_sma': False, 'bear_use_ema': False, 'bear_use_atr': False, 'bear_use_adx': False, 'bear_use_spike': True, 'bear_rsi_required': True, 'sideways_strategy': 'breakout', 'sideways_bb_std_mult': 2.974326243058476, 'sideways_rsi_os': 48, 'sideways_rsi_ob': 62, 'sideways_adx_thresh': 28.75627104207375, 'sideways_atr_min_pct': 0.02890118898726101, 'sideways_atr_max_pct': 0.019932746915511206, 'sideways_tp_mult': 2.711863099876214, 'sideways_tsl_mult': 0.2934033873250901, 'sideways_time_stop': 133, 'sideways_use_sma': True, 'sideways_use_ema': True, 'sideways_use_atr': True, 'sideways_use_adx': False, 'sideways_use_spike': True, 'sideways_rsi_required': True}.
[I 2025-09-01 03:31:39,097] Trial 416 finished with values: [-1000000000.0, 1000000000.0] and parameters: {'p_sma': 41, 'p_std': 60, 'p_atr': 30, 'p_adx': 18, 'rsi_period': 67, 'ema1': 22, 'ema2': 57, 'slip_atr_k': 0.06028483339667766, 'slip_spread_k': 0.13497831553971304, 'spread_hl_frac': 0.028912962160015494, 'bb_std_mult': 1.6810453278466344, 'rsi_os': 20, 'rsi_ob': 82, 'vol_spike': 0.29613061403208135, 'adx_thresh': 33.83196007884226, 'atr_min_pct': 0.0008166566738735358, 'atr_max_pct': 0.04094641555835361, 'tp_mult': 2.880375696297495, 'tsl_mult': 0.3568367268083717, 'strategy': 'breakout', 'time_stop': 182, 'use_sma': False, 'use_atr': False, 'use_adx': True, 'use_ema': False, 'use_spike': False, 'rsi_required': True, 'edge_k': 1.6054722251501112, 'edge_cap': 0.7394501775319577, 'bull_strategy': 'breakout', 'bull_bb_std_mult': 1.553230512405576, 'bull_rsi_os': 46, 'bull_rsi_ob': 93, 'bull_adx_thresh': 32.6236632193872, 'bull_atr_min_pct': 0.013643565971311935, 'bull_atr_max_pct': 0.08677195008786015, 'bull_tp_mult': 1.7869542271258847, 'bull_tsl_mult': 0.21649553642521258, 'bull_time_stop': 108, 'bull_use_sma': False, 'bull_use_ema': True, 'bull_use_atr': True, 'bull_use_adx': False, 'bull_use_spike': True, 'bull_rsi_required': True, 'bear_strategy': 'mean_reversion', 'bear_bb_std_mult': 2.655132810066037, 'bear_rsi_os': 11, 'bear_rsi_ob': 74, 'bear_adx_thresh': 24.570955791403833, 'bear_atr_min_pct': 0.027880518646249658, 'bear_atr_max_pct': 0.03216872587683048, 'bear_tp_mult': 1.1756611431733661, 'bear_tsl_mult': 0.18565988670266764, 'bear_time_stop': 41, 'bear_use_sma': False, 'bear_use_ema': False, 'bear_use_atr': False, 'bear_use_adx': False, 'bear_use_spike': False, 'bear_rsi_required': True, 'sideways_strategy': 'mean_reversion', 'sideways_bb_std_mult': 1.8051920676683282, 'sideways_rsi_os': 48, 'sideways_rsi_ob': 55, 'sideways_adx_thresh': 29.54098012659992, 'sideways_atr_min_pct': 0.02875038505650854, 'sideways_atr_max_pct': 0.13621259291035995, 'sideways_tp_mult': 2.803559910735612, 'sideways_tsl_mult': 0.18947631863989609, 'sideways_time_stop': 121, 'sideways_use_sma': False, 'sideways_use_ema': True, 'sideways_use_atr': False, 'sideways_use_adx': False, 'sideways_use_spike': False, 'sideways_rsi_required': True}.
[I 2025-09-01 03:31:39,962] Trial 417 finished with values: [-0.09929492405387375, 0.09898275404579954] and parameters: {'p_sma': 44, 'p_std': 5, 'p_atr': 30, 'p_adx': 18, 'rsi_period': 12, 'ema1': 22, 'ema2': 57, 'slip_atr_k': 0.006150616067991364, 'slip_spread_k': 0.977495481746444, 'spread_hl_frac': 0.02887228835987471, 'bb_std_mult': 2.823054832262466, 'rsi_os': 20, 'rsi_ob': 83, 'vol_spike': 0.10035857389355421, 'adx_thresh': 18.547110753794364, 'atr_min_pct': 0.022938605788329916, 'atr_max_pct': 0.08497239370451894, 'tp_mult': 2.550700882964653, 'tsl_mult': 0.867064365181643, 'strategy': 'breakout', 'time_stop': 66, 'use_sma': False, 'use_atr': False, 'use_adx': True, 'use_ema': False, 'use_spike': True, 'rsi_required': False, 'edge_k': 1.5539237530868772, 'edge_cap': 0.587366454722869, 'bull_strategy': 'breakout', 'bull_bb_std_mult': 1.5661185685202146, 'bull_rsi_os': 42, 'bull_rsi_ob': 53, 'bull_adx_thresh': 29.202115790501857, 'bull_atr_min_pct': 0.016111585216107435, 'bull_atr_max_pct': 0.10473812648289248, 'bull_tp_mult': 1.7897975656321, 'bull_tsl_mult': 0.28146392109633533, 'bull_time_stop': 277, 'bull_use_sma': False, 'bull_use_ema': True, 'bull_use_atr': False, 'bull_use_adx': False, 'bull_use_spike': True, 'bull_rsi_required': True, 'bear_strategy': 'mean_reversion', 'bear_bb_std_mult': 2.0169128601944086, 'bear_rsi_os': 11, 'bear_rsi_ob': 48, 'bear_adx_thresh': 24.633248473586928, 'bear_atr_min_pct': 8.162639845151962e-05, 'bear_atr_max_pct': 0.03251729592473417, 'bear_tp_mult': 1.988697531173229, 'bear_tsl_mult': 0.19218203345342352, 'bear_time_stop': 46, 'bear_use_sma': False, 'bear_use_ema': False, 'bear_use_atr': False, 'bear_use_adx': False, 'bear_use_spike': True, 'bear_rsi_required': False, 'sideways_strategy': 'mean_reversion', 'sideways_bb_std_mult': 1.7963221922322306, 'sideways_rsi_os': 48, 'sideways_rsi_ob': 77, 'sideways_adx_thresh': 28.320746188581808, 'sideways_atr_min_pct': 0.0074809233522465, 'sideways_atr_max_pct': 0.02054310125968051, 'sideways_tp_mult': 2.8107188738224975, 'sideways_tsl_mult': 0.18728508375024677, 'sideways_time_stop': 231, 'sideways_use_sma': False, 'sideways_use_ema': True, 'sideways_use_atr': False, 'sideways_use_adx': False, 'sideways_use_spike': True, 'sideways_rsi_required': True}.
[I 2025-09-01 03:31:40,149] Trial 418 finished with values: [-1000000000.0, 1000000000.0] and parameters: {'p_sma': 45, 'p_std': 60, 'p_atr': 29, 'p_adx': 22, 'rsi_period': 77, 'ema1': 20, 'ema2': 24, 'slip_atr_k': 0.06433725787393538, 'slip_spread_k': 0.8374158749768945, 'spread_hl_frac': 0.02939944767886325, 'bb_std_mult': 1.625572753832638, 'rsi_os': 20, 'rsi_ob': 83, 'vol_spike': 0.21161324016564514, 'adx_thresh': 9.680115107609643, 'atr_min_pct': 0.023182455318858868, 'atr_max_pct': 0.05517793008446349, 'tp_mult': 2.7932327053560053, 'tsl_mult': 0.4035137293779908, 'strategy': 'breakout', 'time_stop': 72, 'use_sma': False, 'use_atr': False, 'use_adx': True, 'use_ema': False, 'use_spike': True, 'rsi_required': False, 'edge_k': 0.09309812126924058, 'edge_cap': 0.3432999423957179, 'bull_strategy': 'breakout', 'bull_bb_std_mult': 2.47202815655663, 'bull_rsi_os': 16, 'bull_rsi_ob': 53, 'bull_adx_thresh': 16.847436478274684, 'bull_atr_min_pct': 0.024636118550133555, 'bull_atr_max_pct': 0.10519047732350531, 'bull_tp_mult': 1.7920945518020814, 'bull_tsl_mult': 0.28160930729381367, 'bull_time_stop': 233, 'bull_use_sma': False, 'bull_use_ema': False, 'bull_use_atr': False, 'bull_use_adx': True, 'bull_use_spike': True, 'bull_rsi_required': True, 'bear_strategy': 'mean_reversion', 'bear_bb_std_mult': 2.678058042058512, 'bear_rsi_os': 11, 'bear_rsi_ob': 59, 'bear_adx_thresh': 34.63079589531075, 'bear_atr_min_pct': 0.028146498816663097, 'bear_atr_max_pct': 0.12238320374012915, 'bear_tp_mult': 1.179238553805254, 'bear_tsl_mult': 0.14545015777442963, 'bear_time_stop': 81, 'bear_use_sma': False, 'bear_use_ema': False, 'bear_use_atr': False, 'bear_use_adx': False, 'bear_use_spike': True, 'bear_rsi_required': False, 'sideways_strategy': 'breakout', 'sideways_bb_std_mult': 3.11653653827961, 'sideways_rsi_os': 48, 'sideways_rsi_ob': 67, 'sideways_adx_thresh': 28.190358453160393, 'sideways_atr_min_pct': 0.024538739526442064, 'sideways_atr_max_pct': 0.05209101658741067, 'sideways_tp_mult': 2.7098181913580888, 'sideways_tsl_mult': 0.2085715413321927, 'sideways_time_stop': 24, 'sideways_use_sma': False, 'sideways_use_ema': True, 'sideways_use_atr': False, 'sideways_use_adx': True, 'sideways_use_spike': True, 'sideways_rsi_required': False}.
[I 2025-09-01 03:31:40,315] Trial 419 finished with values: [-1000000000.0, 1000000000.0] and parameters: {'p_sma': 53, 'p_std': 60, 'p_atr': 29, 'p_adx': 17, 'rsi_period': 77, 'ema1': 14, 'ema2': 57, 'slip_atr_k': 0.05955259613489565, 'slip_spread_k': 0.5102797439695964, 'spread_hl_frac': 0.029535027227223676, 'bb_std_mult': 1.660718592890086, 'rsi_os': 22, 'rsi_ob': 83, 'vol_spike': 0.21105510991063672, 'adx_thresh': 17.82797310267206, 'atr_min_pct': 0.0036845777226213756, 'atr_max_pct': 0.05551981766635445, 'tp_mult': 1.9768109571689092, 'tsl_mult': 0.40872462119713643, 'strategy': 'breakout', 'time_stop': 181, 'use_sma': False, 'use_atr': False, 'use_adx': True, 'use_ema': False, 'use_spike': True, 'rsi_required': False, 'edge_k': 1.4408910899787102, 'edge_cap': 0.6348726612738786, 'bull_strategy': 'breakout', 'bull_bb_std_mult': 0.9412891708513464, 'bull_rsi_os': 16, 'bull_rsi_ob': 71, 'bull_adx_thresh': 16.492061737174534, 'bull_atr_min_pct': 0.011210814658207065, 'bull_atr_max_pct': 0.07910742844804108, 'bull_tp_mult': 1.3277154857645952, 'bull_tsl_mult': 0.21714959796292227, 'bull_time_stop': 272, 'bull_use_sma': False, 'bull_use_ema': True, 'bull_use_atr': False, 'bull_use_adx': True, 'bull_use_spike': True, 'bull_rsi_required': True, 'bear_strategy': 'mean_reversion', 'bear_bb_std_mult': 2.063490146810681, 'bear_rsi_os': 32, 'bear_rsi_ob': 72, 'bear_adx_thresh': 26.02704103258251, 'bear_atr_min_pct': 1.928945193463774e-05, 'bear_atr_max_pct': 0.02255322766781036, 'bear_tp_mult': 2.4454596100840265, 'bear_tsl_mult': 0.47642830740198117, 'bear_time_stop': 277, 'bear_use_sma': False, 'bear_use_ema': False, 'bear_use_atr': False, 'bear_use_adx': False, 'bear_use_spike': True, 'bear_rsi_required': False, 'sideways_strategy': 'mean_reversion', 'sideways_bb_std_mult': 1.8049103561151942, 'sideways_rsi_os': 47, 'sideways_rsi_ob': 77, 'sideways_adx_thresh': 28.1950298596295, 'sideways_atr_min_pct': 0.028079322057021412, 'sideways_atr_max_pct': 0.01744274518030759, 'sideways_tp_mult': 1.6277143046895948, 'sideways_tsl_mult': 0.20444367879896475, 'sideways_time_stop': 126, 'sideways_use_sma': False, 'sideways_use_ema': True, 'sideways_use_atr': False, 'sideways_use_adx': True, 'sideways_use_spike': True, 'sideways_rsi_required': False}.
[I 2025-09-01 03:32:34,059] Trial 423 finished with values: [-1000000000.0, 1000000000.0] and parameters: {'p_sma': 8, 'p_std': 58, 'p_atr': 7, 'p_adx': 17, 'rsi_period': 42, 'ema1': 21, 'ema2': 59, 'slip_atr_k': 0.23752148522907449, 'slip_spread_k': 0.14352029362992472, 'spread_hl_frac': 0.026570179039490483, 'bb_std_mult': 1.5531442105311584, 'rsi_os': 22, 'rsi_ob': 81, 'vol_spike': 0.16618358944375944, 'adx_thresh': 27.759073074076646, 'atr_min_pct': 0.014159129380875974, 'atr_max_pct': 0.04938768067662169, 'tp_mult': 1.827647679248988, 'tsl_mult': 0.5589559929810204, 'strategy': 'mean_reversion', 'time_stop': 175, 'use_sma': False, 'use_atr': True, 'use_adx': True, 'use_ema': False, 'use_spike': True, 'rsi_required': False, 'edge_k': 1.9026961518869587, 'edge_cap': 0.05025359734516549, 'bull_strategy': 'mean_reversion', 'bull_bb_std_mult': 2.6092846484358936, 'bull_rsi_os': 18, 'bull_rsi_ob': 57, 'bull_adx_thresh': 19.242018849724737, 'bull_atr_min_pct': 0.0016695119253184471, 'bull_atr_max_pct': 0.09335098557046172, 'bull_tp_mult': 2.0514589658521833, 'bull_tsl_mult': 0.14220500173244144, 'bull_time_stop': 55, 'bull_use_sma': True, 'bull_use_ema': False, 'bull_use_atr': False, 'bull_use_adx': False, 'bull_use_spike': True, 'bull_rsi_required': False, 'bear_strategy': 'breakout', 'bear_bb_std_mult': 2.9663701282208548, 'bear_rsi_os': 53, 'bear_rsi_ob': 61, 'bear_adx_thresh': 13.569901348390557, 'bear_atr_min_pct': 0.02640022009005104, 'bear_atr_max_pct': 0.020223597414703757, 'bear_tp_mult': 1.044422893299913, 'bear_tsl_mult': 0.5978345079892028, 'bear_time_stop': 102, 'bear_use_sma': True, 'bear_use_ema': False, 'bear_use_atr': True, 'bear_use_adx': False, 'bear_use_spike': True, 'bear_rsi_required': True, 'sideways_strategy': 'breakout', 'sideways_bb_std_mult': 1.8819374790487589, 'sideways_rsi_os': 46, 'sideways_rsi_ob': 73, 'sideways_adx_thresh': 28.937388514723832, 'sideways_atr_min_pct': 0.02778585022354204, 'sideways_atr_max_pct': 0.0457710269411061, 'sideways_tp_mult': 1.6646171731399106, 'sideways_tsl_mult': 0.6589416770814784, 'sideways_time_stop': 205, 'sideways_use_sma': True, 'sideways_use_ema': False, 'sideways_use_atr': True, 'sideways_use_adx': False, 'sideways_use_spike': True, 'sideways_rsi_required': True}.
[I 2025-09-01 03:32:35,190] Trial 421 finished with values: [-0.03464916560981579, 0.03448438194664029] and parameters: {'p_sma': 53, 'p_std': 18, 'p_atr': 7, 'p_adx': 17, 'rsi_period': 22, 'ema1': 20, 'ema2': 18, 'slip_atr_k': 0.018969447363377225, 'slip_spread_k': 0.14423554649971773, 'spread_hl_frac': 0.02688441051287383, 'bb_std_mult': 3.5544631001908633, 'rsi_os': 22, 'rsi_ob': 84, 'vol_spike': 0.19241477658234207, 'adx_thresh': 17.85565183345039, 'atr_min_pct': 0.0032507495734112497, 'atr_max_pct': 0.05310777618993972, 'tp_mult': 2.7924186193641702, 'tsl_mult': 0.8297448815120847, 'strategy': 'mean_reversion', 'time_stop': 158, 'use_sma': False, 'use_atr': False, 'use_adx': True, 'use_ema': False, 'use_spike': True, 'rsi_required': False, 'edge_k': 0.0916988897281818, 'edge_cap': 0.43655868862256486, 'bull_strategy': 'breakout', 'bull_bb_std_mult': 2.47488244889151, 'bull_rsi_os': 13, 'bull_rsi_ob': 71, 'bull_adx_thresh': 16.385653240043286, 'bull_atr_min_pct': 0.0011667173571431756, 'bull_atr_max_pct': 0.1306315129758543, 'bull_tp_mult': 1.2268694008719057, 'bull_tsl_mult': 0.1655534306697844, 'bull_time_stop': 53, 'bull_use_sma': True, 'bull_use_ema': False, 'bull_use_atr': False, 'bull_use_adx': True, 'bull_use_spike': True, 'bull_rsi_required': False, 'bear_strategy': 'breakout', 'bear_bb_std_mult': 2.0946301739689144, 'bear_rsi_os': 53, 'bear_rsi_ob': 80, 'bear_adx_thresh': 9.723968286113205, 'bear_atr_min_pct': 0.026735127154115686, 'bear_atr_max_pct': 0.02099785644871499, 'bear_tp_mult': 1.0489026690792573, 'bear_tsl_mult': 0.1398811745520344, 'bear_time_stop': 67, 'bear_use_sma': False, 'bear_use_ema': False, 'bear_use_atr': False, 'bear_use_adx': False, 'bear_use_spike': True, 'bear_rsi_required': False, 'sideways_strategy': 'breakout', 'sideways_bb_std_mult': 1.8994758548809965, 'sideways_rsi_os': 47, 'sideways_rsi_ob': 78, 'sideways_adx_thresh': 28.353260421648116, 'sideways_atr_min_pct': 0.024235572011080758, 'sideways_atr_max_pct': 0.012806695120364782, 'sideways_tp_mult': 1.6181589927555862, 'sideways_tsl_mult': 0.01893582713564218, 'sideways_time_stop': 127, 'sideways_use_sma': True, 'sideways_use_ema': True, 'sideways_use_atr': True, 'sideways_use_adx': True, 'sideways_use_spike': True, 'sideways_rsi_required': False}.
[I 2025-09-01 03:32:35,565] Trial 420 finished with values: [-0.019505837157235306, 0.01933711530905908] and parameters: {'p_sma': 53, 'p_std': 58, 'p_atr': 29, 'p_adx': 17, 'rsi_period': 18, 'ema1': 20, 'ema2': 56, 'slip_atr_k': 0.07814811595241519, 'slip_spread_k': 0.4351651125144027, 'spread_hl_frac': 0.026852706810504962, 'bb_std_mult': 1.542377783734994, 'rsi_os': 22, 'rsi_ob': 83, 'vol_spike': 0.1652255802730855, 'adx_thresh': 9.600472308577457, 'atr_min_pct': 0.014254081642766266, 'atr_max_pct': 0.022358136491780617, 'tp_mult': 2.7889206654369456, 'tsl_mult': 0.40434011873199127, 'strategy': 'breakout', 'time_stop': 157, 'use_sma': False, 'use_atr': False, 'use_adx': True, 'use_ema': False, 'use_spike': True, 'rsi_required': False, 'edge_k': 0.061679398597631274, 'edge_cap': 0.5835150980184582, 'bull_strategy': 'breakout', 'bull_bb_std_mult': 1.1228252640836789, 'bull_rsi_os': 50, 'bull_rsi_ob': 50, 'bull_adx_thresh': 24.59131909194248, 'bull_atr_min_pct': 0.0009516384987291894, 'bull_atr_max_pct': 0.10262021557299958, 'bull_tp_mult': 1.9758086852229928, 'bull_tsl_mult': 0.2888593352855007, 'bull_time_stop': 271, 'bull_use_sma': False, 'bull_use_ema': False, 'bull_use_atr': False, 'bull_use_adx': True, 'bull_use_spike': True, 'bull_rsi_required': True, 'bear_strategy': 'mean_reversion', 'bear_bb_std_mult': 2.048194233736482, 'bear_rsi_os': 53, 'bear_rsi_ob': 59, 'bear_adx_thresh': 17.96738668966214, 'bear_atr_min_pct': 0.01179482317955833, 'bear_atr_max_pct': 0.12140539923122198, 'bear_tp_mult': 1.0611548860652456, 'bear_tsl_mult': 0.1495369560188999, 'bear_time_stop': 101, 'bear_use_sma': False, 'bear_use_ema': False, 'bear_use_atr': False, 'bear_use_adx': False, 'bear_use_spike': True, 'bear_rsi_required': False, 'sideways_strategy': 'breakout', 'sideways_bb_std_mult': 1.896329692765154, 'sideways_rsi_os': 46, 'sideways_rsi_ob': 87, 'sideways_adx_thresh': 27.99494715967663, 'sideways_atr_min_pct': 0.027982844323612057, 'sideways_atr_max_pct': 0.01687891058277404, 'sideways_tp_mult': 1.6396406854429697, 'sideways_tsl_mult': 0.016332199311092976, 'sideways_time_stop': 219, 'sideways_use_sma': False, 'sideways_use_ema': True, 'sideways_use_atr': False, 'sideways_use_adx': True, 'sideways_use_spike': True, 'sideways_rsi_required': False}.
