[I 2025-09-01 03:13:42,667] Trial 308 finished with values: [-1000000000.0, 1000000000.0] and parameters: {'p_sma': 29, 'p_std': 8, 'p_atr': 18, 'p_adx': 18, 'rsi_period': 12, 'ema1': 22, 'ema2': 59, 'slip_atr_k': 0.18280699679307863, 'slip_spread_k': 0.5680296179426828, 'spread_hl_frac': 0.019094473211616066, 'bb_std_mult': 1.0275246470726243, 'rsi_os': 23, 'rsi_ob': 84, 'vol_spike': 0.21986920602686397, 'adx_thresh': 28.898231954068486, 'atr_min_pct': 0.017162739580975785, 'atr_max_pct': 0.04979717396440889, 'tp_mult': 1.017089144363689, 'tsl_mult': 0.3453828389967446, 'strategy': 'mean_reversion', 'time_stop': 176, 'use_sma': False, 'use_atr': False, 'use_adx': True, 'use_ema': False, 'use_spike': False, 'rsi_required': True, 'edge_k': 1.4922987352817123, 'edge_cap': 0.46953292682772463, 'bull_strategy': 'breakout', 'bull_bb_std_mult': 1.2032189925698267, 'bull_rsi_os': 48, 'bull_rsi_ob': 92, 'bull_adx_thresh': 23.140731605765268, 'bull_atr_min_pct': 0.015252050478929958, 'bull_atr_max_pct': 0.11172412246985251, 'bull_tp_mult': 1.6815094520102347, 'bull_tsl_mult': 0.2678972147366592, 'bull_time_stop': 294, 'bull_use_sma': True, 'bull_use_ema': False, 'bull_use_atr': True, 'bull_use_adx': True, 'bull_use_spike': False, 'bull_rsi_required': False, 'bear_strategy': 'breakout', 'bear_bb_std_mult': 3.0088387151416383, 'bear_rsi_os': 51, 'bear_rsi_ob': 62, 'bear_adx_thresh': 16.39493769191744, 'bear_atr_min_pct': 0.02630025971416575, 'bear_atr_max_pct': 0.013235324421490826, 'bear_tp_mult': 2.1487338034140055, 'bear_tsl_mult': 0.7452196390213852, 'bear_time_stop': 111, 'bear_use_sma': False, 'bear_use_ema': False, 'bear_use_atr': False, 'bear_use_adx': False, 'bear_use_spike': False, 'bear_rsi_required': True, 'sideways_strategy': 'breakout', 'sideways_bb_std_mult': 0.9759427768293638, 'sideways_rsi_os': 55, 'sideways_rsi_ob': 52, 'sideways_adx_thresh': 28.347338365157597, 'sideways_atr_min_pct': 0.022287773572913814, 'sideways_atr_max_pct': 0.023079269308736345, 'sideways_tp_mult': 2.420258518555841, 'sideways_tsl_mult': 0.18824956300230924, 'sideways_time_stop': 123, 'sideways_use_sma': True, 'sideways_use_ema': True, 'sideways_use_atr': True, 'sideways_use_adx': False, 'sideways_use_spike': False, 'sideways_rsi_required': True}.
[I 2025-09-01 03:13:42,704] Trial 309 finished with values: [-1000000000.0, 1000000000.0] and parameters: {'p_sma': 11, 'p_std': 59, 'p_atr': 29, 'p_adx': 18, 'rsi_period': 12, 'ema1': 22, 'ema2': 56, 'slip_atr_k': 0.018155749524569924, 'slip_spread_k': 0.09683151253670537, 'spread_hl_frac': 0.028857364169488857, 'bb_std_mult': 1.6219115259120174, 'rsi_os': 28, 'rsi_ob': 93, 'vol_spike': 0.2197412791357624, 'adx_thresh': 28.898615062279873, 'atr_min_pct': 0.007542488553887164, 'atr_max_pct': 0.012338011067704505, 'tp_mult': 2.5736825768314686, 'tsl_mult': 0.2271707472124901, 'strategy': 'mean_reversion', 'time_stop': 172, 'use_sma': False, 'use_atr': False, 'use_adx': True, 'use_ema': False, 'use_spike': False, 'rsi_required': True, 'edge_k': 0.11213410423360748, 'edge_cap': 0.46529666411429543, 'bull_strategy': 'breakout', 'bull_bb_std_mult': 1.2067123381004594, 'bull_rsi_os': 37, 'bull_rsi_ob': 78, 'bull_adx_thresh': 12.263674718454077, 'bull_atr_min_pct': 0.0005089016969804935, 'bull_atr_max_pct': 0.12432461545346093, 'bull_tp_mult': 1.5906342796179298, 'bull_tsl_mult': 0.2332959445523409, 'bull_time_stop': 295, 'bull_use_sma': True, 'bull_use_ema': False, 'bull_use_atr': True, 'bull_use_adx': False, 'bull_use_spike': False, 'bull_rsi_required': False, 'bear_strategy': 'breakout', 'bear_bb_std_mult': 1.5039742229456796, 'bear_rsi_os': 51, 'bear_rsi_ob': 86, 'bear_adx_thresh': 24.810582857443567, 'bear_atr_min_pct': 0.026190159118179963, 'bear_atr_max_pct': 0.012980227192139416, 'bear_tp_mult': 1.044574351644204, 'bear_tsl_mult': 0.542083415885096, 'bear_time_stop': 171, 'bear_use_sma': False, 'bear_use_ema': False, 'bear_use_atr': False, 'bear_use_adx': False, 'bear_use_spike': False, 'bear_rsi_required': True, 'sideways_strategy': 'breakout', 'sideways_bb_std_mult': 0.9577535451057897, 'sideways_rsi_os': 48, 'sideways_rsi_ob': 89, 'sideways_adx_thresh': 18.541260996301137, 'sideways_atr_min_pct': 0.029226792232980553, 'sideways_atr_max_pct': 0.14960482447679124, 'sideways_tp_mult': 1.7700958127992479, 'sideways_tsl_mult': 0.18627162068981376, 'sideways_time_stop': 125, 'sideways_use_sma': True, 'sideways_use_ema': True, 'sideways_use_atr': True, 'sideways_use_adx': False, 'sideways_use_spike': False, 'sideways_rsi_required': True}.
[I 2025-09-01 03:13:42,948] Trial 306 finished with values: [-1000000000.0, 1000000000.0] and parameters: {'p_sma': 60, 'p_std': 51, 'p_atr': 20, 'p_adx': 18, 'rsi_period': 11, 'ema1': 23, 'ema2': 45, 'slip_atr_k': 0.015565261583329744, 'slip_spread_k': 0.5715784845164985, 'spread_hl_frac': 0.04750337030837269, 'bb_std_mult': 2.8784525356299286, 'rsi_os': 23, 'rsi_ob': 78, 'vol_spike': 0.21025198275923185, 'adx_thresh': 13.739193853805444, 'atr_min_pct': 0.008911520366291474, 'atr_max_pct': 0.011975931474662443, 'tp_mult': 1.03648937179168, 'tsl_mult': 0.998299813522092, 'strategy': 'mean_reversion', 'time_stop': 94, 'use_sma': True, 'use_atr': False, 'use_adx': True, 'use_ema': False, 'use_spike': True, 'rsi_required': False, 'edge_k': 0.1873055898945486, 'edge_cap': 0.5306661123283921, 'bull_strategy': 'breakout', 'bull_bb_std_mult': 1.0717547013980853, 'bull_rsi_os': 21, 'bull_rsi_ob': 78, 'bull_adx_thresh': 24.035130553977854, 'bull_atr_min_pct': 0.025258709436705648, 'bull_atr_max_pct': 0.026475931530465874, 'bull_tp_mult': 1.6778085703284977, 'bull_tsl_mult': 0.2288279354484566, 'bull_time_stop': 270, 'bull_use_sma': True, 'bull_use_ema': False, 'bull_use_atr': False, 'bull_use_adx': True, 'bull_use_spike': True, 'bull_rsi_required': False, 'bear_strategy': 'breakout', 'bear_bb_std_mult': 3.5021548477992352, 'bear_rsi_os': 25, 'bear_rsi_ob': 59, 'bear_adx_thresh': 24.839646136826115, 'bear_atr_min_pct': 0.026598450076874953, 'bear_atr_max_pct': 0.1137064306651269, 'bear_tp_mult': 2.2411672621562286, 'bear_tsl_mult': 0.15596801166295252, 'bear_time_stop': 155, 'bear_use_sma': False, 'bear_use_ema': False, 'bear_use_atr': False, 'bear_use_adx': False, 'bear_use_spike': True, 'bear_rsi_required': True, 'sideways_strategy': 'breakout', 'sideways_bb_std_mult': 1.405825728226366, 'sideways_rsi_os': 25, 'sideways_rsi_ob': 61, 'sideways_adx_thresh': 34.17177980629452, 'sideways_atr_min_pct': 0.022192009376752506, 'sideways_atr_max_pct': 0.02326213390564864, 'sideways_tp_mult': 2.428910764212926, 'sideways_tsl_mult': 0.1832389202067346, 'sideways_time_stop': 175, 'sideways_use_sma': True, 'sideways_use_ema': True, 'sideways_use_atr': True, 'sideways_use_adx': False, 'sideways_use_spike': True, 'sideways_rsi_required': True}.
[I 2025-09-01 03:13:43,202] Trial 307 finished with values: [-1000000000.0, 1000000000.0] and parameters: {'p_sma': 60, 'p_std': 59, 'p_atr': 29, 'p_adx': 18, 'rsi_period': 12, 'ema1': 22, 'ema2': 59, 'slip_atr_k': 0.013006108184486826, 'slip_spread_k': 0.05487593942378689, 'spread_hl_frac': 0.01916434530254891, 'bb_std_mult': 1.3445292887422216, 'rsi_os': 24, 'rsi_ob': 78, 'vol_spike': 0.20702673148388026, 'adx_thresh': 13.770369739488254, 'atr_min_pct': 0.01630087537337286, 'atr_max_pct': 0.05004837099970054, 'tp_mult': 2.5655737830945706, 'tsl_mult': 0.39947144145039903, 'strategy': 'mean_reversion', 'time_stop': 92, 'use_sma': False, 'use_atr': True, 'use_adx': True, 'use_ema': False, 'use_spike': True, 'rsi_required': False, 'edge_k': 0.21675966803193025, 'edge_cap': 0.528115805460898, 'bull_strategy': 'breakout', 'bull_bb_std_mult': 1.077061626872384, 'bull_rsi_os': 44, 'bull_rsi_ob': 55, 'bull_adx_thresh': 23.317324998440164, 'bull_atr_min_pct': 0.017802112721873202, 'bull_atr_max_pct': 0.12237198166516286, 'bull_tp_mult': 1.2658741737901775, 'bull_tsl_mult': 0.9451563320866614, 'bull_time_stop': 42, 'bull_use_sma': True, 'bull_use_ema': False, 'bull_use_atr': False, 'bull_use_adx': True, 'bull_use_spike': False, 'bull_rsi_required': False, 'bear_strategy': 'breakout', 'bear_bb_std_mult': 2.3222892872231347, 'bear_rsi_os': 51, 'bear_rsi_ob': 65, 'bear_adx_thresh': 24.708493520434438, 'bear_atr_min_pct': 0.026533124256161746, 'bear_atr_max_pct': 0.013135057668855045, 'bear_tp_mult': 2.5506846392316147, 'bear_tsl_mult': 0.1591468436178465, 'bear_time_stop': 65, 'bear_use_sma': False, 'bear_use_ema': True, 'bear_use_atr': False, 'bear_use_adx': False, 'bear_use_spike': True, 'bear_rsi_required': True, 'sideways_strategy': 'breakout', 'sideways_bb_std_mult': 1.8461188619020343, 'sideways_rsi_os': 52, 'sideways_rsi_ob': 76, 'sideways_adx_thresh': 20.82764218694208, 'sideways_atr_min_pct': 0.022241627450080053, 'sideways_atr_max_pct': 0.14956587618142567, 'sideways_tp_mult': 1.7556495218351291, 'sideways_tsl_mult': 0.13875357262789417, 'sideways_time_stop': 123, 'sideways_use_sma': True, 'sideways_use_ema': True, 'sideways_use_atr': True, 'sideways_use_adx': False, 'sideways_use_spike': True, 'sideways_rsi_required': True}.
[I 2025-09-01 03:14:22,455] Trial 313 finished with values: [-1000000000.0, 1000000000.0] and parameters: {'p_sma': 19, 'p_std': 37, 'p_atr': 8, 'p_adx': 17, 'rsi_period': 17, 'ema1': 12, 'ema2': 57, 'slip_atr_k': 0.12213716112667086, 'slip_spread_k': 0.907056170743378, 'spread_hl_frac': 0.032025813104983175, 'bb_std_mult': 2.9822173569489965, 'rsi_os': 25, 'rsi_ob': 82, 'vol_spike': 0.18059988951192021, 'adx_thresh': 32.199283336672366, 'atr_min_pct': 0.009875524570194139, 'atr_max_pct': 0.05473685771544999, 'tp_mult': 2.75505377847864, 'tsl_mult': 0.4269134158227478, 'strategy': 'mean_reversion', 'time_stop': 142, 'use_sma': False, 'use_atr': False, 'use_adx': True, 'use_ema': False, 'use_spike': True, 'rsi_required': False, 'edge_k': 1.7996260781620883, 'edge_cap': 0.48224076745559863, 'bull_strategy': 'breakout', 'bull_bb_std_mult': 2.5549238711146764, 'bull_rsi_os': 7, 'bull_rsi_ob': 52, 'bull_adx_thresh': 20.987005380697408, 'bull_atr_min_pct': 0.003085649818660549, 'bull_atr_max_pct': 0.11672146496247465, 'bull_tp_mult': 1.6155237674576373, 'bull_tsl_mult': 0.3304883127632321, 'bull_time_stop': 248, 'bull_use_sma': True, 'bull_use_ema': True, 'bull_use_atr': False, 'bull_use_adx': False, 'bull_use_spike': True, 'bull_rsi_required': False, 'bear_strategy': 'mean_reversion', 'bear_bb_std_mult': 2.146113244354773, 'bear_rsi_os': 22, 'bear_rsi_ob': 61, 'bear_adx_thresh': 23.379672291610703, 'bear_atr_min_pct': 0.0069403486558487874, 'bear_atr_max_pct': 0.030663865511815033, 'bear_tp_mult': 2.663592405595008, 'bear_tsl_mult': 0.11989502470543763, 'bear_time_stop': 74, 'bear_use_sma': True, 'bear_use_ema': False, 'bear_use_atr': True, 'bear_use_adx': False, 'bear_use_spike': True, 'bear_rsi_required': True, 'sideways_strategy': 'mean_reversion', 'sideways_bb_std_mult': 3.3551833954419306, 'sideways_rsi_os': 43, 'sideways_rsi_ob': 73, 'sideways_adx_thresh': 16.95749401482319, 'sideways_atr_min_pct': 0.02585255683164598, 'sideways_atr_max_pct': 0.02702610672685734, 'sideways_tp_mult': 2.346338428177012, 'sideways_tsl_mult': 0.21266378748999412, 'sideways_time_stop': 141, 'sideways_use_sma': True, 'sideways_use_ema': False, 'sideways_use_atr': False, 'sideways_use_adx': False, 'sideways_use_spike': True, 'sideways_rsi_required': True}.
[I 2025-09-01 03:14:23,431] Trial 312 finished with values: [-0.049311561547578986, 0.04909265629380693] and parameters: {'p_sma': 38, 'p_std': 18, 'p_atr': 28, 'p_adx': 17, 'rsi_period': 16, 'ema1': 12, 'ema2': 33, 'slip_atr_k': 0.1920521148683732, 'slip_spread_k': 0.1825449044977036, 'spread_hl_frac': 0.03175963181139087, 'bb_std_mult': 1.3463204782667142, 'rsi_os': 25, 'rsi_ob': 82, 'vol_spike': 0.2050675354003829, 'adx_thresh': 10.039506335579087, 'atr_min_pct': 0.027495840944293463, 'atr_max_pct': 0.11388332181017768, 'tp_mult': 2.774211907334212, 'tsl_mult': 0.9608993141684343, 'strategy': 'mean_reversion', 'time_stop': 198, 'use_sma': False, 'use_atr': False, 'use_adx': True, 'use_ema': False, 'use_spike': True, 'rsi_required': False, 'edge_k': 1.5738937633056551, 'edge_cap': 0.49323925001540986, 'bull_strategy': 'breakout', 'bull_bb_std_mult': 2.5260663028739456, 'bull_rsi_os': 17, 'bull_rsi_ob': 52, 'bull_adx_thresh': 18.460299467412995, 'bull_atr_min_pct': 5.334134469480107e-06, 'bull_atr_max_pct': 0.11679499131876257, 'bull_tp_mult': 2.228011829736305, 'bull_tsl_mult': 0.2612260506109813, 'bull_time_stop': 283, 'bull_use_sma': True, 'bull_use_ema': True, 'bull_use_atr': False, 'bull_use_adx': False, 'bull_use_spike': True, 'bull_rsi_required': False, 'bear_strategy': 'mean_reversion', 'bear_bb_std_mult': 3.3786017256468575, 'bear_rsi_os': 22, 'bear_rsi_ob': 71, 'bear_adx_thresh': 30.21634787475623, 'bear_atr_min_pct': 0.006838002493116826, 'bear_atr_max_pct': 0.03084446495811878, 'bear_tp_mult': 2.9421015014959746, 'bear_tsl_mult': 0.8087552441513007, 'bear_time_stop': 74, 'bear_use_sma': False, 'bear_use_ema': False, 'bear_use_atr': True, 'bear_use_adx': False, 'bear_use_spike': True, 'bear_rsi_required': True, 'sideways_strategy': 'breakout', 'sideways_bb_std_mult': 2.1034283024196245, 'sideways_rsi_os': 43, 'sideways_rsi_ob': 63, 'sideways_adx_thresh': 26.063814489632136, 'sideways_atr_min_pct': 0.010456407991269059, 'sideways_atr_max_pct': 0.016447033852126296, 'sideways_tp_mult': 1.7302881609216008, 'sideways_tsl_mult': 0.24664961066694238, 'sideways_time_stop': 141, 'sideways_use_sma': True, 'sideways_use_ema': False, 'sideways_use_atr': False, 'sideways_use_adx': False, 'sideways_use_spike': True, 'sideways_rsi_required': True}.
[I 2025-09-01 03:14:23,786] Trial 311 finished with values: [-1000000000.0, 1000000000.0] and parameters: {'p_sma': 38, 'p_std': 59, 'p_atr': 8, 'p_adx': 27, 'rsi_period': 13, 'ema1': 21, 'ema2': 15, 'slip_atr_k': 0.012943364289674707, 'slip_spread_k': 0.8229095971785418, 'spread_hl_frac': 0.030813018447018815, 'bb_std_mult': 2.2871284219697343, 'rsi_os': 21, 'rsi_ob': 86, 'vol_spike': 0.20500358001126398, 'adx_thresh': 30.463148829687242, 'atr_min_pct': 0.016477998782030538, 'atr_max_pct': 0.04986652168424075, 'tp_mult': 1.5265790771025056, 'tsl_mult': 0.9694296147179561, 'strategy': 'mean_reversion', 'time_stop': 197, 'use_sma': False, 'use_atr': False, 'use_adx': True, 'use_ema': False, 'use_spike': True, 'rsi_required': False, 'edge_k': 0.024451264545341786, 'edge_cap': 0.4887377318606776, 'bull_strategy': 'breakout', 'bull_bb_std_mult': 1.1399070596714675, 'bull_rsi_os': 44, 'bull_rsi_ob': 52, 'bull_adx_thresh': 18.610750262779177, 'bull_atr_min_pct': 0.0025151150087618403, 'bull_atr_max_pct': 0.09843719986333119, 'bull_tp_mult': 2.760462386504529, 'bull_tsl_mult': 0.25988116066538464, 'bull_time_stop': 218, 'bull_use_sma': True, 'bull_use_ema': True, 'bull_use_atr': False, 'bull_use_adx': False, 'bull_use_spike': True, 'bull_rsi_required': False, 'bear_strategy': 'mean_reversion', 'bear_bb_std_mult': 2.167968197542912, 'bear_rsi_os': 53, 'bear_rsi_ob': 61, 'bear_adx_thresh': 23.27403126943852, 'bear_atr_min_pct': 0.027028678756343457, 'bear_atr_max_pct': 0.030836880096390244, 'bear_tp_mult': 1.6791154895687428, 'bear_tsl_mult': 0.608874517031101, 'bear_time_stop': 74, 'bear_use_sma': False, 'bear_use_ema': False, 'bear_use_atr': True, 'bear_use_adx': False, 'bear_use_spike': True, 'bear_rsi_required': True, 'sideways_strategy': 'breakout', 'sideways_bb_std_mult': 2.088577918144399, 'sideways_rsi_os': 52, 'sideways_rsi_ob': 93, 'sideways_adx_thresh': 33.21575135756923, 'sideways_atr_min_pct': 0.025690076542818664, 'sideways_atr_max_pct': 0.015532886167706345, 'sideways_tp_mult': 2.352724587509619, 'sideways_tsl_mult': 0.24411198012690352, 'sideways_time_stop': 196, 'sideways_use_sma': True, 'sideways_use_ema': False, 'sideways_use_atr': False, 'sideways_use_adx': False, 'sideways_use_spike': True, 'sideways_rsi_required': True}.
[I 2025-09-01 03:14:24,061] Trial 310 finished with values: [-1000000000.0, 1000000000.0] and parameters: {'p_sma': 27, 'p_std': 59, 'p_atr': 8, 'p_adx': 17, 'rsi_period': 68, 'ema1': 24, 'ema2': 57, 'slip_atr_k': 0.08431533022259542, 'slip_spread_k': 0.9607826621940421, 'spread_hl_frac': 0.031772756869776424, 'bb_std_mult': 2.9693462719995383, 'rsi_os': 25, 'rsi_ob': 82, 'vol_spike': 0.20540482707735017, 'adx_thresh': 6.939044733904169, 'atr_min_pct': 0.002887857724354119, 'atr_max_pct': 0.049481110627532174, 'tp_mult': 2.6918161103807954, 'tsl_mult': 0.4497257867486107, 'strategy': 'mean_reversion', 'time_stop': 142, 'use_sma': False, 'use_atr': False, 'use_adx': True, 'use_ema': False, 'use_spike': True, 'rsi_required': False, 'edge_k': 0.004658929218924246, 'edge_cap': 0.49244205764777516, 'bull_strategy': 'breakout', 'bull_bb_std_mult': 2.4989061262517365, 'bull_rsi_os': 44, 'bull_rsi_ob': 83, 'bull_adx_thresh': 20.884612073375486, 'bull_atr_min_pct': 0.007295414429234221, 'bull_atr_max_pct': 0.11758946886578703, 'bull_tp_mult': 1.2684229068697315, 'bull_tsl_mult': 0.651259347058458, 'bull_time_stop': 283, 'bull_use_sma': True, 'bull_use_ema': True, 'bull_use_atr': False, 'bull_use_adx': False, 'bull_use_spike': True, 'bull_rsi_required': False, 'bear_strategy': 'mean_reversion', 'bear_bb_std_mult': 2.151555839145815, 'bear_rsi_os': 21, 'bear_rsi_ob': 72, 'bear_adx_thresh': 7.689689827261807, 'bear_atr_min_pct': 0.006846312555171572, 'bear_atr_max_pct': 0.016130234585375047, 'bear_tp_mult': 1.7457302985911218, 'bear_tsl_mult': 0.10468152707163061, 'bear_time_stop': 76, 'bear_use_sma': False, 'bear_use_ema': False, 'bear_use_atr': True, 'bear_use_adx': False, 'bear_use_spike': True, 'bear_rsi_required': True, 'sideways_strategy': 'breakout', 'sideways_bb_std_mult': 2.087642693048655, 'sideways_rsi_os': 52, 'sideways_rsi_ob': 76, 'sideways_adx_thresh': 33.32830120967317, 'sideways_atr_min_pct': 0.025787831496371674, 'sideways_atr_max_pct': 0.02742023723274404, 'sideways_tp_mult': 1.7369005613617436, 'sideways_tsl_mult': 0.21064736741913545, 'sideways_time_stop': 259, 'sideways_use_sma': True, 'sideways_use_ema': False, 'sideways_use_atr': False, 'sideways_use_adx': False, 'sideways_use_spike': True, 'sideways_rsi_required': True}.
[I 2025-09-01 03:14:24,797] Trial 314 finished with values: [-1000000000.0, 1000000000.0] and parameters: {'p_sma': 39, 'p_std': 17, 'p_atr': 28, 'p_adx': 16, 'rsi_period': 34, 'ema1': 24, 'ema2': 15, 'slip_atr_k': 0.08398574061844433, 'slip_spread_k': 0.1954481008631881, 'spread_hl_frac': 0.025711457805712625, 'bb_std_mult': 1.4078154266018301, 'rsi_os': 54, 'rsi_ob': 87, 'vol_spike': 0.04264913460019033, 'adx_thresh': 11.926405044979278, 'atr_min_pct': 0.007180793802144123, 'atr_max_pct': 0.12533624092231666, 'tp_mult': 2.6920427054113523, 'tsl_mult': 0.2497285479620338, 'strategy': 'mean_reversion', 'time_stop': 300, 'use_sma': False, 'use_atr': False, 'use_adx': True, 'use_ema': False, 'use_spike': True, 'rsi_required': False, 'edge_k': 1.1128784698275445, 'edge_cap': 0.49257271297752603, 'bull_strategy': 'breakout', 'bull_bb_std_mult': 1.8227334579865955, 'bull_rsi_os': 17, 'bull_rsi_ob': 83, 'bull_adx_thresh': 24.448458636311365, 'bull_atr_min_pct': 0.011801633990397098, 'bull_atr_max_pct': 0.11937218956269764, 'bull_tp_mult': 1.5377568819031397, 'bull_tsl_mult': 0.2626372212566095, 'bull_time_stop': 283, 'bull_use_sma': True, 'bull_use_ema': False, 'bull_use_atr': False, 'bull_use_adx': False, 'bull_use_spike': True, 'bull_rsi_required': False, 'bear_strategy': 'breakout', 'bear_bb_std_mult': 2.236627100416136, 'bear_rsi_os': 53, 'bear_rsi_ob': 70, 'bear_adx_thresh': 10.19085230996354, 'bear_atr_min_pct': 0.029674201346689917, 'bear_atr_max_pct': 0.0170099723084748, 'bear_tp_mult': 1.0110164285345862, 'bear_tsl_mult': 0.10516059828956573, 'bear_time_stop': 203, 'bear_use_sma': False, 'bear_use_ema': False, 'bear_use_atr': False, 'bear_use_adx': False, 'bear_use_spike': True, 'bear_rsi_required': True, 'sideways_strategy': 'breakout', 'sideways_bb_std_mult': 2.031656477694686, 'sideways_rsi_os': 49, 'sideways_rsi_ob': 93, 'sideways_adx_thresh': 33.28392235571516, 'sideways_atr_min_pct': 0.01937967523467953, 'sideways_atr_max_pct': 0.015338287619218252, 'sideways_tp_mult': 1.89240877534633, 'sideways_tsl_mult': 0.2557939383165111, 'sideways_time_stop': 139, 'sideways_use_sma': True, 'sideways_use_ema': True, 'sideways_use_atr': False, 'sideways_use_adx': False, 'sideways_use_spike': True, 'sideways_rsi_required': True}.
