[I 2025-09-01 02:40:28,863] Trial 105 finished with values: [-0.08509729782081654, 0.08491525693445115] and parameters: {'p_sma': 49, 'p_std': 20, 'p_atr': 24, 'p_adx': 8, 'rsi_period': 53, 'ema1': 7, 'ema2': 60, 'slip_atr_k': 0.03086498395924811, 'slip_spread_k': 0.49208572770379017, 'spread_hl_frac': 0.004109507358381986, 'bb_std_mult': 2.760353160171679, 'rsi_os': 8, 'rsi_ob': 79, 'vol_spike': 0.13427594559050837, 'adx_thresh': 23.027449959884546, 'atr_min_pct': 0.011366964260110381, 'atr_max_pct': 0.08099708100270481, 'tp_mult': 2.6017498495876774, 'tsl_mult': 0.3643549467833957, 'strategy': 'mean_reversion', 'time_stop': 275, 'use_sma': True, 'use_atr': False, 'use_adx': False, 'use_ema': False, 'use_spike': True, 'rsi_required': False, 'edge_k': 1.7102793253756823, 'edge_cap': 0.15684989663159013, 'bull_strategy': 'mean_reversion', 'bull_bb_std_mult': 1.0920580695618334, 'bull_rsi_os': 14, 'bull_rsi_ob': 64, 'bull_adx_thresh': 18.720961798915095, 'bull_atr_min_pct': 6.9423501237491e-05, 'bull_atr_max_pct': 0.1446444633331746, 'bull_tp_mult': 1.517484354096733, 'bull_tsl_mult': 0.4752655556943768, 'bull_time_stop': 204, 'bull_use_sma': True, 'bull_use_ema': False, 'bull_use_atr': False, 'bull_use_adx': False, 'bull_use_spike': False, 'bull_rsi_required': False, 'bear_strategy': 'mean_reversion', 'bear_bb_std_mult': 1.7785788035705936, 'bear_rsi_os': 16, 'bear_rsi_ob': 86, 'bear_adx_thresh': 33.764038252795004, 'bear_atr_min_pct': 0.0015330247986066695, 'bear_atr_max_pct': 0.09061713049386547, 'bear_tp_mult': 2.2691368654770185, 'bear_tsl_mult': 0.6173945654592218, 'bear_time_stop': 56, 'bear_use_sma': False, 'bear_use_ema': True, 'bear_use_atr': False, 'bear_use_adx': True, 'bear_use_spike': False, 'bear_rsi_required': True, 'sideways_strategy': 'mean_reversion', 'sideways_bb_std_mult': 3.1579056180572493, 'sideways_rsi_os': 28, 'sideways_rsi_ob': 67, 'sideways_adx_thresh': 29.66175467486777, 'sideways_atr_min_pct': 0.00361476211243986, 'sideways_atr_max_pct': 0.10254858416214947, 'sideways_tp_mult': 1.1835444408649796, 'sideways_tsl_mult': 0.49154389837068474, 'sideways_time_stop': 217, 'sideways_use_sma': True, 'sideways_use_ema': True, 'sideways_use_atr': False, 'sideways_use_adx': True, 'sideways_use_spike': True, 'sideways_rsi_required': False}.
[I 2025-09-01 02:41:11,136] Trial 111 finished with values: [-1000000000.0, 1000000000.0] and parameters: {'p_sma': 15, 'p_std': 43, 'p_atr': 21, 'p_adx': 10, 'rsi_period': 58, 'ema1': 7, 'ema2': 37, 'slip_atr_k': 0.19007824597733292, 'slip_spread_k': 0.3553367047094398, 'spread_hl_frac': 0.012674902037581112, 'bb_std_mult': 2.7092176525697513, 'rsi_os': 6, 'rsi_ob': 61, 'vol_spike': 0.11782888481428211, 'adx_thresh': 24.503316685368365, 'atr_min_pct': 0.01139402012477365, 'atr_max_pct': 0.023675214697230038, 'tp_mult': 1.693177322275323, 'tsl_mult': 0.6293872585485704, 'strategy': 'breakout', 'time_stop': 20, 'use_sma': False, 'use_atr': False, 'use_adx': True, 'use_ema': True, 'use_spike': True, 'rsi_required': False, 'edge_k': 0.20493572164627027, 'edge_cap': 0.07298590461352711, 'bull_strategy': 'mean_reversion', 'bull_bb_std_mult': 1.2167365691597827, 'bull_rsi_os': 13, 'bull_rsi_ob': 89, 'bull_adx_thresh': 22.965018499651976, 'bull_atr_min_pct': 0.00961910788250025, 'bull_atr_max_pct': 0.14916075906457843, 'bull_tp_mult': 1.9041784844557925, 'bull_tsl_mult': 0.43859768933563764, 'bull_time_stop': 88, 'bull_use_sma': False, 'bull_use_ema': False, 'bull_use_atr': False, 'bull_use_adx': False, 'bull_use_spike': True, 'bull_rsi_required': True, 'bear_strategy': 'breakout', 'bear_bb_std_mult': 3.5078777035298288, 'bear_rsi_os': 7, 'bear_rsi_ob': 50, 'bear_adx_thresh': 10.349844231069174, 'bear_atr_min_pct': 0.009619684943483564, 'bear_atr_max_pct': 0.04137059007185853, 'bear_tp_mult': 1.228643533067217, 'bear_tsl_mult': 0.60335179705056, 'bear_time_stop': 34, 'bear_use_sma': False, 'bear_use_ema': False, 'bear_use_atr': True, 'bear_use_adx': False, 'bear_use_spike': True, 'bear_rsi_required': False, 'sideways_strategy': 'breakout', 'sideways_bb_std_mult': 1.1640994626213748, 'sideways_rsi_os': 12, 'sideways_rsi_ob': 93, 'sideways_adx_thresh': 27.699778956231587, 'sideways_atr_min_pct': 0.015289628606189922, 'sideways_atr_max_pct': 0.11778890457045366, 'sideways_tp_mult': 1.182327456714995, 'sideways_tsl_mult': 0.5049071334607251, 'sideways_time_stop': 149, 'sideways_use_sma': False, 'sideways_use_ema': False, 'sideways_use_atr': True, 'sideways_use_adx': True, 'sideways_use_spike': True, 'sideways_rsi_required': True}.
[I 2025-09-01 02:41:12,428] Trial 112 finished with values: [-1000000000.0, 1000000000.0] and parameters: {'p_sma': 15, 'p_std': 43, 'p_atr': 11, 'p_adx': 10, 'rsi_period': 48, 'ema1': 25, 'ema2': 37, 'slip_atr_k': 0.21802287714627117, 'slip_spread_k': 0.14065335192782474, 'spread_hl_frac': 0.007161560056631735, 'bb_std_mult': 1.6203220854584506, 'rsi_os': 6, 'rsi_ob': 61, 'vol_spike': 0.29145865060598974, 'adx_thresh': 21.928772450097803, 'atr_min_pct': 0.0052200782192233595, 'atr_max_pct': 0.01511110245632323, 'tp_mult': 1.2272405167088345, 'tsl_mult': 0.09828460990262194, 'strategy': 'breakout', 'time_stop': 17, 'use_sma': False, 'use_atr': False, 'use_adx': True, 'use_ema': True, 'use_spike': True, 'rsi_required': False, 'edge_k': 0.30229295954277224, 'edge_cap': 0.07169454272612498, 'bull_strategy': 'mean_reversion', 'bull_bb_std_mult': 1.2049136285343536, 'bull_rsi_os': 7, 'bull_rsi_ob': 47, 'bull_adx_thresh': 28.027012730243847, 'bull_atr_min_pct': 0.009270192237165565, 'bull_atr_max_pct': 0.06427602742813389, 'bull_tp_mult': 2.3028732403556784, 'bull_tsl_mult': 0.4355112018898503, 'bull_time_stop': 91, 'bull_use_sma': False, 'bull_use_ema': False, 'bull_use_atr': False, 'bull_use_adx': False, 'bull_use_spike': True, 'bull_rsi_required': True, 'bear_strategy': 'breakout', 'bear_bb_std_mult': 3.591529424914948, 'bear_rsi_os': 26, 'bear_rsi_ob': 90, 'bear_adx_thresh': 27.106829929786056, 'bear_atr_min_pct': 0.00942628513442962, 'bear_atr_max_pct': 0.08308474023183231, 'bear_tp_mult': 2.7212801888342204, 'bear_tsl_mult': 0.1963727799087292, 'bear_time_stop': 90, 'bear_use_sma': True, 'bear_use_ema': False, 'bear_use_atr': True, 'bear_use_adx': False, 'bear_use_spike': True, 'bear_rsi_required': False, 'sideways_strategy': 'breakout', 'sideways_bb_std_mult': 2.985497767475877, 'sideways_rsi_os': 16, 'sideways_rsi_ob': 79, 'sideways_adx_thresh': 27.63703652697048, 'sideways_atr_min_pct': 0.015434291139202505, 'sideways_atr_max_pct': 0.11657603528680513, 'sideways_tp_mult': 1.3148223407107855, 'sideways_tsl_mult': 0.8300311950252934, 'sideways_time_stop': 148, 'sideways_use_sma': False, 'sideways_use_ema': False, 'sideways_use_atr': True, 'sideways_use_adx': True, 'sideways_use_spike': True, 'sideways_rsi_required': True}.
[I 2025-09-01 02:41:13,353] Trial 110 finished with values: [-1000000000.0, 1000000000.0] and parameters: {'p_sma': 60, 'p_std': 46, 'p_atr': 29, 'p_adx': 10, 'rsi_period': 53, 'ema1': 26, 'ema2': 37, 'slip_atr_k': 0.1640411820657665, 'slip_spread_k': 0.9699479217166433, 'spread_hl_frac': 0.007220838833889697, 'bb_std_mult': 2.134845224733935, 'rsi_os': 6, 'rsi_ob': 61, 'vol_spike': 0.12144749839084261, 'adx_thresh': 22.966994778875637, 'atr_min_pct': 0.021021688285199316, 'atr_max_pct': 0.08168971888823875, 'tp_mult': 1.4447776674848094, 'tsl_mult': 0.2160848457072273, 'strategy': 'breakout', 'time_stop': 146, 'use_sma': True, 'use_atr': False, 'use_adx': True, 'use_ema': True, 'use_spike': True, 'rsi_required': False, 'edge_k': 0.3284912090726031, 'edge_cap': 0.1742630765911432, 'bull_strategy': 'mean_reversion', 'bull_bb_std_mult': 1.1952233205177554, 'bull_rsi_os': 14, 'bull_rsi_ob': 49, 'bull_adx_thresh': 28.31075478432207, 'bull_atr_min_pct': 0.00996675078054634, 'bull_atr_max_pct': 0.06649890036435042, 'bull_tp_mult': 2.209465820091468, 'bull_tsl_mult': 0.19526370628553302, 'bull_time_stop': 88, 'bull_use_sma': False, 'bull_use_ema': False, 'bull_use_atr': False, 'bull_use_adx': False, 'bull_use_spike': True, 'bull_rsi_required': True, 'bear_strategy': 'breakout', 'bear_bb_std_mult': 2.5064937783330477, 'bear_rsi_os': 7, 'bear_rsi_ob': 82, 'bear_adx_thresh': 23.998399913380037, 'bear_atr_min_pct': 0.011699250134690684, 'bear_atr_max_pct': 0.04028377483393143, 'bear_tp_mult': 1.3590336581524882, 'bear_tsl_mult': 0.3754206097107926, 'bear_time_stop': 87, 'bear_use_sma': True, 'bear_use_ema': False, 'bear_use_atr': False, 'bear_use_adx': False, 'bear_use_spike': False, 'bear_rsi_required': False, 'sideways_strategy': 'breakout', 'sideways_bb_std_mult': 2.9878063078077557, 'sideways_rsi_os': 14, 'sideways_rsi_ob': 79, 'sideways_adx_thresh': 14.273673061091134, 'sideways_atr_min_pct': 0.02702335810270414, 'sideways_atr_max_pct': 0.11318541162402046, 'sideways_tp_mult': 1.317992421562153, 'sideways_tsl_mult': 0.4954217231719513, 'sideways_time_stop': 271, 'sideways_use_sma': False, 'sideways_use_ema': True, 'sideways_use_atr': True, 'sideways_use_adx': True, 'sideways_use_spike': True, 'sideways_rsi_required': True}.
[I 2025-09-01 02:41:14,402] Trial 109 finished with values: [-1000000000.0, 1000000000.0] and parameters: {'p_sma': 17, 'p_std': 45, 'p_atr': 29, 'p_adx': 10, 'rsi_period': 52, 'ema1': 24, 'ema2': 36, 'slip_atr_k': 0.18827440923233177, 'slip_spread_k': 0.35013432376356735, 'spread_hl_frac': 0.0036558439914491933, 'bb_std_mult': 2.1712308163726406, 'rsi_os': 29, 'rsi_ob': 70, 'vol_spike': 0.26635360510290085, 'adx_thresh': 23.12193696000143, 'atr_min_pct': 0.027310560901388503, 'atr_max_pct': 0.05067483857669021, 'tp_mult': 1.927971892184712, 'tsl_mult': 0.4473685166856563, 'strategy': 'breakout', 'time_stop': 177, 'use_sma': True, 'use_atr': False, 'use_adx': True, 'use_ema': True, 'use_spike': True, 'rsi_required': False, 'edge_k': 0.2928633204368429, 'edge_cap': 0.07169780663804291, 'bull_strategy': 'mean_reversion', 'bull_bb_std_mult': 1.223261111794459, 'bull_rsi_os': 14, 'bull_rsi_ob': 89, 'bull_adx_thresh': 12.95717600672685, 'bull_atr_min_pct': 0.01610200708177884, 'bull_atr_max_pct': 0.1494151872105826, 'bull_tp_mult': 1.649924777094779, 'bull_tsl_mult': 0.19722177295241244, 'bull_time_stop': 88, 'bull_use_sma': False, 'bull_use_ema': False, 'bull_use_atr': False, 'bull_use_adx': False, 'bull_use_spike': True, 'bull_rsi_required': True, 'bear_strategy': 'breakout', 'bear_bb_std_mult': 2.5171244224603577, 'bear_rsi_os': 7, 'bear_rsi_ob': 50, 'bear_adx_thresh': 24.151785524153738, 'bear_atr_min_pct': 0.013269506975366403, 'bear_atr_max_pct': 0.10010615190592648, 'bear_tp_mult': 2.3980142337613946, 'bear_tsl_mult': 0.6973064553715395, 'bear_time_stop': 88, 'bear_use_sma': True, 'bear_use_ema': False, 'bear_use_atr': False, 'bear_use_adx': False, 'bear_use_spike': False, 'bear_rsi_required': False, 'sideways_strategy': 'breakout', 'sideways_bb_std_mult': 3.0266652308202344, 'sideways_rsi_os': 32, 'sideways_rsi_ob': 47, 'sideways_adx_thresh': 12.23800854504497, 'sideways_atr_min_pct': 0.01963338413844742, 'sideways_atr_max_pct': 0.11272927095967636, 'sideways_tp_mult': 1.3143684886701, 'sideways_tsl_mult': 0.5135810289805144, 'sideways_time_stop': 269, 'sideways_use_sma': False, 'sideways_use_ema': True, 'sideways_use_atr': True, 'sideways_use_adx': True, 'sideways_use_spike': True, 'sideways_rsi_required': True}.
[I 2025-09-01 02:42:00,797] Trial 116 finished with values: [-0.03197807497001126, 0.031810012915551085] and parameters: {'p_sma': 43, 'p_std': 41, 'p_atr': 23, 'p_adx': 9, 'rsi_period': 73, 'ema1': 8, 'ema2': 15, 'slip_atr_k': 0.15342544427622187, 'slip_spread_k': 0.644580583340616, 'spread_hl_frac': 0.04786311915536744, 'bb_std_mult': 0.5015404572331243, 'rsi_os': 12, 'rsi_ob': 64, 'vol_spike': 0.1415739705971258, 'adx_thresh': 6.0633298071486585, 'atr_min_pct': 0.016939318241196086, 'atr_max_pct': 0.09572105808316878, 'tp_mult': 2.013825319373958, 'tsl_mult': 0.5366070776163154, 'strategy': 'breakout', 'time_stop': 250, 'use_sma': False, 'use_atr': False, 'use_adx': False, 'use_ema': False, 'use_spike': False, 'rsi_required': True, 'edge_k': 1.5656617083812652, 'edge_cap': 0.20504552925686848, 'bull_strategy': 'breakout', 'bull_bb_std_mult': 1.1179670115139904, 'bull_rsi_os': 16, 'bull_rsi_ob': 66, 'bull_adx_thresh': 29.96214411019401, 'bull_atr_min_pct': 0.0009707338009655603, 'bull_atr_max_pct': 0.05733491620052625, 'bull_tp_mult': 2.48175025928367, 'bull_tsl_mult': 0.49449134148034884, 'bull_time_stop': 17, 'bull_use_sma': False, 'bull_use_ema': True, 'bull_use_atr': True, 'bull_use_adx': True, 'bull_use_spike': False, 'bull_rsi_required': True, 'bear_strategy': 'breakout', 'bear_bb_std_mult': 1.4577712431000052, 'bear_rsi_os': 5, 'bear_rsi_ob': 92, 'bear_adx_thresh': 30.912297505459616, 'bear_atr_min_pct': 0.018665034557513196, 'bear_atr_max_pct': 0.051889547743287676, 'bear_tp_mult': 2.3165293622316687, 'bear_tsl_mult': 0.2327274576659042, 'bear_time_stop': 133, 'bear_use_sma': False, 'bear_use_ema': False, 'bear_use_atr': False, 'bear_use_adx': True, 'bear_use_spike': True, 'bear_rsi_required': True, 'sideways_strategy': 'breakout', 'sideways_bb_std_mult': 2.943652538549653, 'sideways_rsi_os': 42, 'sideways_rsi_ob': 74, 'sideways_adx_thresh': 25.43283036780721, 'sideways_atr_min_pct': 0.01433218070596201, 'sideways_atr_max_pct': 0.10917445833175811, 'sideways_tp_mult': 1.4766461178232517, 'sideways_tsl_mult': 0.45292621712495335, 'sideways_time_stop': 56, 'sideways_use_sma': False, 'sideways_use_ema': True, 'sideways_use_atr': True, 'sideways_use_adx': True, 'sideways_use_spike': False, 'sideways_rsi_required': False}.
[I 2025-09-01 02:42:01,907] Trial 114 finished with values: [-0.02714029634272297, 0.026918126185436198] and parameters: {'p_sma': 43, 'p_std': 46, 'p_atr': 23, 'p_adx': 9, 'rsi_period': 73, 'ema1': 24, 'ema2': 49, 'slip_atr_k': 0.11977680415257988, 'slip_spread_k': 0.9402921222861162, 'spread_hl_frac': 0.008237692358469807, 'bb_std_mult': 1.244120055879041, 'rsi_os': 29, 'rsi_ob': 63, 'vol_spike': 0.15064478284643604, 'adx_thresh': 23.584058333179165, 'atr_min_pct': 0.021243482953874154, 'atr_max_pct': 0.10056769993409151, 'tp_mult': 1.2748779780580861, 'tsl_mult': 0.5768895362611153, 'strategy': 'breakout', 'time_stop': 282, 'use_sma': False, 'use_atr': False, 'use_adx': False, 'use_ema': False, 'use_spike': True, 'rsi_required': False, 'edge_k': 0.5071884000177543, 'edge_cap': 0.6035686612922839, 'bull_strategy': 'breakout', 'bull_bb_std_mult': 1.095547136132413, 'bull_rsi_os': 49, 'bull_rsi_ob': 93, 'bull_adx_thresh': 29.99148633636864, 'bull_atr_min_pct': 0.0009340433011742761, 'bull_atr_max_pct': 0.06754080283290538, 'bull_tp_mult': 2.195855064737871, 'bull_tsl_mult': 0.9421847579803145, 'bull_time_stop': 106, 'bull_use_sma': False, 'bull_use_ema': False, 'bull_use_atr': False, 'bull_use_adx': False, 'bull_use_spike': True, 'bull_rsi_required': True, 'bear_strategy': 'breakout', 'bear_bb_std_mult': 2.418948695674988, 'bear_rsi_os': 5, 'bear_rsi_ob': 92, 'bear_adx_thresh': 26.112835807761744, 'bear_atr_min_pct': 0.013067570752652071, 'bear_atr_max_pct': 0.07261681929560375, 'bear_tp_mult': 2.390683209702658, 'bear_tsl_mult': 0.46138452917585726, 'bear_time_stop': 249, 'bear_use_sma': False, 'bear_use_ema': False, 'bear_use_atr': False, 'bear_use_adx': True, 'bear_use_spike': True, 'bear_rsi_required': True, 'sideways_strategy': 'breakout', 'sideways_bb_std_mult': 0.9552126185776324, 'sideways_rsi_os': 47, 'sideways_rsi_ob': 74, 'sideways_adx_thresh': 31.309104283838252, 'sideways_atr_min_pct': 0.01447304678460177, 'sideways_atr_max_pct': 0.11339537737869225, 'sideways_tp_mult': 1.3329423771449342, 'sideways_tsl_mult': 0.6616594395511537, 'sideways_time_stop': 58, 'sideways_use_sma': False, 'sideways_use_ema': True, 'sideways_use_atr': True, 'sideways_use_adx': True, 'sideways_use_spike': True, 'sideways_rsi_required': False}.
[I 2025-09-01 02:42:02,391] Trial 115 finished with values: [-1000000000.0, 1000000000.0] and parameters: {'p_sma': 32, 'p_std': 48, 'p_atr': 23, 'p_adx': 8, 'rsi_period': 68, 'ema1': 8, 'ema2': 49, 'slip_atr_k': 0.15375698042702435, 'slip_spread_k': 0.8976885354904196, 'spread_hl_frac': 0.002694117720458092, 'bb_std_mult': 3.3260193722557165, 'rsi_os': 5, 'rsi_ob': 64, 'vol_spike': 0.1489981257801642, 'adx_thresh': 23.596955423144404, 'atr_min_pct': 0.025353402551372882, 'atr_max_pct': 0.0603679682615135, 'tp_mult': 1.8053395753534203, 'tsl_mult': 0.5841300761648671, 'strategy': 'breakout', 'time_stop': 176, 'use_sma': False, 'use_atr': False, 'use_adx': False, 'use_ema': False, 'use_spike': False, 'rsi_required': True, 'edge_k': 0.6492149717156941, 'edge_cap': 0.5022292268526851, 'bull_strategy': 'breakout', 'bull_bb_std_mult': 1.0978618538444105, 'bull_rsi_os': 11, 'bull_rsi_ob': 93, 'bull_adx_thresh': 12.645269211231518, 'bull_atr_min_pct': 0.02993954104004084, 'bull_atr_max_pct': 0.14969259981185812, 'bull_tp_mult': 1.6548282866849826, 'bull_tsl_mult': 0.5216428416097705, 'bull_time_stop': 119, 'bull_use_sma': False, 'bull_use_ema': True, 'bull_use_atr': True, 'bull_use_adx': True, 'bull_use_spike': True, 'bull_rsi_required': True, 'bear_strategy': 'breakout', 'bear_bb_std_mult': 2.739001742644779, 'bear_rsi_os': 19, 'bear_rsi_ob': 92, 'bear_adx_thresh': 29.835219922314536, 'bear_atr_min_pct': 0.010378159993392975, 'bear_atr_max_pct': 0.049982532459238456, 'bear_tp_mult': 2.387788532348975, 'bear_tsl_mult': 0.8951652356390616, 'bear_time_stop': 282, 'bear_use_sma': False, 'bear_use_ema': False, 'bear_use_atr': False, 'bear_use_adx': True, 'bear_use_spike': True, 'bear_rsi_required': True, 'sideways_strategy': 'breakout', 'sideways_bb_std_mult': 2.8664246436837355, 'sideways_rsi_os': 18, 'sideways_rsi_ob': 74, 'sideways_adx_thresh': 17.496961671511183, 'sideways_atr_min_pct': 0.017129960384513275, 'sideways_atr_max_pct': 0.11249280789246574, 'sideways_tp_mult': 1.4689181144733623, 'sideways_tsl_mult': 0.595786971555974, 'sideways_time_stop': 174, 'sideways_use_sma': False, 'sideways_use_ema': True, 'sideways_use_atr': True, 'sideways_use_adx': True, 'sideways_use_spike': False, 'sideways_rsi_required': False}.
[I 2025-09-01 02:42:02,735] Trial 113 finished with values: [-1000000000.0, 1000000000.0] and parameters: {'p_sma': 32, 'p_std': 46, 'p_atr': 11, 'p_adx': 9, 'rsi_period': 65, 'ema1': 24, 'ema2': 29, 'slip_atr_k': 0.16219965823033405, 'slip_spread_k': 0.9105131993541877, 'spread_hl_frac': 0.007019390120975997, 'bb_std_mult': 2.1735281653840457, 'rsi_os': 29, 'rsi_ob': 64, 'vol_spike': 0.09871189791934584, 'adx_thresh': 33.57928937031522, 'atr_min_pct': 0.016754559130662542, 'atr_max_pct': 0.0614425394903689, 'tp_mult': 1.4418723012751058, 'tsl_mult': 0.5833321625826209, 'strategy': 'breakout', 'time_stop': 178, 'use_sma': False, 'use_atr': False, 'use_adx': True, 'use_ema': True, 'use_spike': False, 'rsi_required': True, 'edge_k': 0.29885725943834685, 'edge_cap': 0.5783294415062875, 'bull_strategy': 'breakout', 'bull_bb_std_mult': 1.3143512434168898, 'bull_rsi_os': 16, 'bull_rsi_ob': 93, 'bull_adx_thresh': 12.937737653591775, 'bull_atr_min_pct': 0.015495971209446936, 'bull_atr_max_pct': 0.08323604456385182, 'bull_tp_mult': 2.21130859296049, 'bull_tsl_mult': 0.9242968815143608, 'bull_time_stop': 15, 'bull_use_sma': False, 'bull_use_ema': True, 'bull_use_atr': True, 'bull_use_adx': True, 'bull_use_spike': True, 'bull_rsi_required': True, 'bear_strategy': 'breakout', 'bear_bb_std_mult': 2.7243168657817836, 'bear_rsi_os': 5, 'bear_rsi_ob': 90, 'bear_adx_thresh': 29.73085676238819, 'bear_atr_min_pct': 0.010107227241926638, 'bear_atr_max_pct': 0.07302844313219861, 'bear_tp_mult': 1.7268184622943674, 'bear_tsl_mult': 0.44178517378276094, 'bear_time_stop': 19, 'bear_use_sma': True, 'bear_use_ema': False, 'bear_use_atr': False, 'bear_use_adx': False, 'bear_use_spike': True, 'bear_rsi_required': False, 'sideways_strategy': 'breakout', 'sideways_bb_std_mult': 0.9542626778201893, 'sideways_rsi_os': 32, 'sideways_rsi_ob': 79, 'sideways_adx_thresh': 32.56491489686795, 'sideways_atr_min_pct': 0.0012519136427899813, 'sideways_atr_max_pct': 0.11392188114839376, 'sideways_tp_mult': 1.2952507193060603, 'sideways_tsl_mult': 0.46234249452727194, 'sideways_time_stop': 273, 'sideways_use_sma': False, 'sideways_use_ema': True, 'sideways_use_atr': True, 'sideways_use_adx': True, 'sideways_use_spike': False, 'sideways_rsi_required': True}.
