[I 2025-09-01 02:23:43,165] Trial 19 finished with values: [-1000000000.0, 1000000000.0] and parameters: {'p_sma': 52, 'p_std': 20, 'p_atr': 12, 'p_adx': 21, 'rsi_period': 74, 'ema1': 21, 'ema2': 44, 'slip_atr_k': 0.09387295531743689, 'slip_spread_k': 0.7337585681598363, 'spread_hl_frac': 0.014786415322794925, 'bb_std_mult': 2.316337714029568, 'rsi_os': 37, 'rsi_ob': 65, 'vol_spike': 0.20094718843756376, 'adx_thresh': 15.903977537520795, 'atr_min_pct': 0.021903578807196948, 'atr_max_pct': 0.029292990210128645, 'tp_mult': 2.5452763252700055, 'tsl_mult': 0.27126989711306426, 'strategy': 'breakout', 'time_stop': 108, 'use_sma': False, 'use_atr': False, 'use_adx': True, 'use_ema': False, 'use_spike': False, 'rsi_required': True, 'edge_k': 0.7537187011252244, 'edge_cap': 0.060341333029203414, 'bull_strategy': 'breakout', 'bull_bb_std_mult': 2.5011869903123665, 'bull_rsi_os': 5, 'bull_rsi_ob': 59, 'bull_adx_thresh': 22.489270107684398, 'bull_atr_min_pct': 0.00875274208822946, 'bull_atr_max_pct': 0.06310312849054536, 'bull_tp_mult': 1.413242735603086, 'bull_tsl_mult': 0.012385321851456521, 'bull_time_stop': 297, 'bull_use_sma': True, 'bull_use_ema': True, 'bull_use_atr': True, 'bull_use_adx': False, 'bull_use_spike': True, 'bull_rsi_required': True, 'bear_strategy': 'breakout', 'bear_bb_std_mult': 3.005221089008856, 'bear_rsi_os': 40, 'bear_rsi_ob': 45, 'bear_adx_thresh': 14.923868889912685, 'bear_atr_min_pct': 0.009134707780892443, 'bear_atr_max_pct': 0.029973989279886332, 'bear_tp_mult': 2.916362225500049, 'bear_tsl_mult': 0.20894274819817, 'bear_time_stop': 168, 'bear_use_sma': True, 'bear_use_ema': False, 'bear_use_atr': True, 'bear_use_adx': False, 'bear_use_spike': False, 'bear_rsi_required': True, 'sideways_strategy': 'mean_reversion', 'sideways_bb_std_mult': 1.715500982200704, 'sideways_rsi_os': 27, 'sideways_rsi_ob': 64, 'sideways_adx_thresh': 28.065513255300687, 'sideways_atr_min_pct': 0.022331537834379644, 'sideways_atr_max_pct': 0.06265164251699237, 'sideways_tp_mult': 1.450869208924253, 'sideways_tsl_mult': 0.935432537535944, 'sideways_time_stop': 132, 'sideways_use_sma': False, 'sideways_use_ema': False, 'sideways_use_atr': False, 'sideways_use_adx': False, 'sideways_use_spike': False, 'sideways_rsi_required': True}.
[I 2025-09-01 02:23:43,417] Trial 16 finished with values: [-0.11316141110216471, 0.11275018127492728] and parameters: {'p_sma': 59, 'p_std': 22, 'p_atr': 14, 'p_adx': 16, 'rsi_period': 84, 'ema1': 23, 'ema2': 56, 'slip_atr_k': 0.0029525831317294, 'slip_spread_k': 0.9577204987601986, 'spread_hl_frac': 0.0014787401758834216, 'bb_std_mult': 2.593035287883855, 'rsi_os': 32, 'rsi_ob': 93, 'vol_spike': 0.09395028867835438, 'adx_thresh': 5.018305654583656, 'atr_min_pct': 0.018717463948399963, 'atr_max_pct': 0.04199801556016643, 'tp_mult': 2.9869781504734316, 'tsl_mult': 0.3818475230605845, 'strategy': 'breakout', 'time_stop': 164, 'use_sma': False, 'use_atr': False, 'use_adx': True, 'use_ema': True, 'use_spike': False, 'rsi_required': True, 'edge_k': 1.4449582324873145, 'edge_cap': 0.7737723332710774, 'bull_strategy': 'mean_reversion', 'bull_bb_std_mult': 1.5642633523603764, 'bull_rsi_os': 37, 'bull_rsi_ob': 51, 'bull_adx_thresh': 25.77550477708105, 'bull_atr_min_pct': 0.0076672299677391885, 'bull_atr_max_pct': 0.073177831234593, 'bull_tp_mult': 1.6977728217413528, 'bull_tsl_mult': 0.9954918436382376, 'bull_time_stop': 290, 'bull_use_sma': True, 'bull_use_ema': True, 'bull_use_atr': True, 'bull_use_adx': True, 'bull_use_spike': True, 'bull_rsi_required': True, 'bear_strategy': 'breakout', 'bear_bb_std_mult': 3.3553829184591124, 'bear_rsi_os': 54, 'bear_rsi_ob': 95, 'bear_adx_thresh': 5.221876828676929, 'bear_atr_min_pct': 0.001767826011445385, 'bear_atr_max_pct': 0.0570367553906527, 'bear_tp_mult': 1.026715485821368, 'bear_tsl_mult': 0.312665891685718, 'bear_time_stop': 297, 'bear_use_sma': True, 'bear_use_ema': False, 'bear_use_atr': True, 'bear_use_adx': False, 'bear_use_spike': False, 'bear_rsi_required': True, 'sideways_strategy': 'mean_reversion', 'sideways_bb_std_mult': 3.550727172089805, 'sideways_rsi_os': 25, 'sideways_rsi_ob': 94, 'sideways_adx_thresh': 25.53394299883654, 'sideways_atr_min_pct': 0.0004135790060310982, 'sideways_atr_max_pct': 0.14567349187349818, 'sideways_tp_mult': 1.5261954898018029, 'sideways_tsl_mult': 0.022123006415401547, 'sideways_time_stop': 209, 'sideways_use_sma': False, 'sideways_use_ema': False, 'sideways_use_atr': False, 'sideways_use_adx': False, 'sideways_use_spike': False, 'sideways_rsi_required': True}.
[I 2025-09-01 02:24:28,347] Trial 22 finished with values: [-0.036848606918897575, 0.036666528507844305] and parameters: {'p_sma': 28, 'p_std': 51, 'p_atr': 18, 'p_adx': 7, 'rsi_period': 71, 'ema1': 12, 'ema2': 39, 'slip_atr_k': 0.1583255966489339, 'slip_spread_k': 0.8129569987038067, 'spread_hl_frac': 0.03530042976832323, 'bb_std_mult': 3.0856854656208488, 'rsi_os': 10, 'rsi_ob': 59, 'vol_spike': 0.168353076906891, 'adx_thresh': 9.990041189641698, 'atr_min_pct': 0.015825297838055634, 'atr_max_pct': 0.14942416631862526, 'tp_mult': 2.2018188833757524, 'tsl_mult': 0.6005815106293402, 'strategy': 'breakout', 'time_stop': 187, 'use_sma': False, 'use_atr': False, 'use_adx': True, 'use_ema': False, 'use_spike': False, 'rsi_required': True, 'edge_k': 1.0870531138036668, 'edge_cap': 0.4749060108408838, 'bull_strategy': 'breakout', 'bull_bb_std_mult': 3.544059870641858, 'bull_rsi_os': 21, 'bull_rsi_ob': 46, 'bull_adx_thresh': 12.07003110876029, 'bull_atr_min_pct': 0.00011835511415351184, 'bull_atr_max_pct': 0.08925167837959246, 'bull_tp_mult': 1.9696373207441273, 'bull_tsl_mult': 0.6792109639678561, 'bull_time_stop': 181, 'bull_use_sma': False, 'bull_use_ema': True, 'bull_use_atr': True, 'bull_use_adx': False, 'bull_use_spike': True, 'bull_rsi_required': True, 'bear_strategy': 'breakout', 'bear_bb_std_mult': 2.4596553557677034, 'bear_rsi_os': 43, 'bear_rsi_ob': 85, 'bear_adx_thresh': 33.9421290293022, 'bear_atr_min_pct': 0.0060755594671084105, 'bear_atr_max_pct': 0.07051133597918798, 'bear_tp_mult': 1.3164359635515925, 'bear_tsl_mult': 0.49356630003957624, 'bear_time_stop': 94, 'bear_use_sma': True, 'bear_use_ema': False, 'bear_use_atr': True, 'bear_use_adx': False, 'bear_use_spike': False, 'bear_rsi_required': True, 'sideways_strategy': 'breakout', 'sideways_bb_std_mult': 1.0787262813818288, 'sideways_rsi_os': 36, 'sideways_rsi_ob': 89, 'sideways_adx_thresh': 21.282160071935753, 'sideways_atr_min_pct': 0.029963469140145055, 'sideways_atr_max_pct': 0.036137891166332384, 'sideways_tp_mult': 1.7298453316892037, 'sideways_tsl_mult': 0.42131899116356797, 'sideways_time_stop': 108, 'sideways_use_sma': False, 'sideways_use_ema': False, 'sideways_use_atr': False, 'sideways_use_adx': False, 'sideways_use_spike': False, 'sideways_rsi_required': True}.
[I 2025-09-01 02:24:28,946] Trial 21 finished with values: [-0.043995035865887044, 0.04381496563515895] and parameters: {'p_sma': 28, 'p_std': 50, 'p_atr': 18, 'p_adx': 10, 'rsi_period': 72, 'ema1': 12, 'ema2': 30, 'slip_atr_k': 0.15523482300518193, 'slip_spread_k': 0.8055993403940183, 'spread_hl_frac': 0.034707621126834606, 'bb_std_mult': 3.0358115877016436, 'rsi_os': 10, 'rsi_ob': 57, 'vol_spike': 0.04440857802398483, 'adx_thresh': 9.824608662857827, 'atr_min_pct': 0.01564994484068496, 'atr_max_pct': 0.06902197701508164, 'tp_mult': 2.1978568858947276, 'tsl_mult': 0.5933107553197088, 'strategy': 'breakout', 'time_stop': 190, 'use_sma': False, 'use_atr': False, 'use_adx': True, 'use_ema': False, 'use_spike': False, 'rsi_required': True, 'edge_k': 1.17948407792962, 'edge_cap': 0.5324314386147309, 'bull_strategy': 'breakout', 'bull_bb_std_mult': 2.513787513897746, 'bull_rsi_os': 21, 'bull_rsi_ob': 45, 'bull_adx_thresh': 5.055974750852169, 'bull_atr_min_pct': 0.0019672477788683935, 'bull_atr_max_pct': 0.037904751093304496, 'bull_tp_mult': 1.957902041560875, 'bull_tsl_mult': 0.6511696824172666, 'bull_time_stop': 178, 'bull_use_sma': False, 'bull_use_ema': True, 'bull_use_atr': True, 'bull_use_adx': False, 'bull_use_spike': True, 'bull_rsi_required': True, 'bear_strategy': 'breakout', 'bear_bb_std_mult': 2.348206835896191, 'bear_rsi_os': 47, 'bear_rsi_ob': 84, 'bear_adx_thresh': 9.290527884699792, 'bear_atr_min_pct': 0.004537682662564364, 'bear_atr_max_pct': 0.07300028592533324, 'bear_tp_mult': 1.3248220272783007, 'bear_tsl_mult': 0.14976917305581028, 'bear_time_stop': 91, 'bear_use_sma': True, 'bear_use_ema': False, 'bear_use_atr': True, 'bear_use_adx': False, 'bear_use_spike': False, 'bear_rsi_required': True, 'sideways_strategy': 'breakout', 'sideways_bb_std_mult': 1.2503517537810243, 'sideways_rsi_os': 37, 'sideways_rsi_ob': 62, 'sideways_adx_thresh': 6.349723676304393, 'sideways_atr_min_pct': 0.028984523588844225, 'sideways_atr_max_pct': 0.06745667123376127, 'sideways_tp_mult': 1.727530917081188, 'sideways_tsl_mult': 0.2043158298245374, 'sideways_time_stop': 101, 'sideways_use_sma': False, 'sideways_use_ema': False, 'sideways_use_atr': False, 'sideways_use_adx': False, 'sideways_use_spike': False, 'sideways_rsi_required': True}.
[I 2025-09-01 02:24:29,369] Trial 23 finished with values: [-0.05976516970998236, 0.05959069061615055] and parameters: {'p_sma': 29, 'p_std': 50, 'p_atr': 7, 'p_adx': 11, 'rsi_period': 71, 'ema1': 12, 'ema2': 40, 'slip_atr_k': 0.15046611838045712, 'slip_spread_k': 0.7968938180174172, 'spread_hl_frac': 0.034112091586586055, 'bb_std_mult': 3.0145148452429265, 'rsi_os': 6, 'rsi_ob': 61, 'vol_spike': 0.04020876064775092, 'adx_thresh': 9.283455981276942, 'atr_min_pct': 0.015425327891923645, 'atr_max_pct': 0.06466671392294653, 'tp_mult': 2.278951543865767, 'tsl_mult': 0.5945563269500509, 'strategy': 'breakout', 'time_stop': 187, 'use_sma': False, 'use_atr': False, 'use_adx': True, 'use_ema': False, 'use_spike': False, 'rsi_required': True, 'edge_k': 1.1402530383768665, 'edge_cap': 0.4435922414818255, 'bull_strategy': 'breakout', 'bull_bb_std_mult': 2.479713925915503, 'bull_rsi_os': 20, 'bull_rsi_ob': 78, 'bull_adx_thresh': 12.096917627593143, 'bull_atr_min_pct': 0.001197949872393583, 'bull_atr_max_pct': 0.09443442702750596, 'bull_tp_mult': 1.9751355807209754, 'bull_tsl_mult': 0.6702908903534466, 'bull_time_stop': 248, 'bull_use_sma': False, 'bull_use_ema': True, 'bull_use_atr': True, 'bull_use_adx': False, 'bull_use_spike': True, 'bull_rsi_required': True, 'bear_strategy': 'breakout', 'bear_bb_std_mult': 2.3615157487652882, 'bear_rsi_os': 45, 'bear_rsi_ob': 83, 'bear_adx_thresh': 34.509471102256775, 'bear_atr_min_pct': 0.004970834799435351, 'bear_atr_max_pct': 0.07499468307726644, 'bear_tp_mult': 1.336141281484922, 'bear_tsl_mult': 0.4833501267126321, 'bear_time_stop': 91, 'bear_use_sma': True, 'bear_use_ema': False, 'bear_use_atr': True, 'bear_use_adx': False, 'bear_use_spike': False, 'bear_rsi_required': True, 'sideways_strategy': 'breakout', 'sideways_bb_std_mult': 1.0433151424781704, 'sideways_rsi_os': 19, 'sideways_rsi_ob': 89, 'sideways_adx_thresh': 30.172502373215465, 'sideways_atr_min_pct': 0.02644940547541989, 'sideways_atr_max_pct': 0.03423029298637781, 'sideways_tp_mult': 1.7436238437367715, 'sideways_tsl_mult': 0.4247248277110454, 'sideways_time_stop': 99, 'sideways_use_sma': False, 'sideways_use_ema': False, 'sideways_use_atr': False, 'sideways_use_adx': False, 'sideways_use_spike': False, 'sideways_rsi_required': True}.
[I 2025-09-01 02:24:29,665] Trial 20 finished with values: [-0.04875025945695799, 0.04864188111611317] and parameters: {'p_sma': 30, 'p_std': 36, 'p_atr': 18, 'p_adx': 8, 'rsi_period': 71, 'ema1': 12, 'ema2': 54, 'slip_atr_k': 0.16302298599423526, 'slip_spread_k': 0.7634726206995385, 'spread_hl_frac': 0.02048493197888146, 'bb_std_mult': 3.069947247270035, 'rsi_os': 6, 'rsi_ob': 58, 'vol_spike': 0.12200384975909097, 'adx_thresh': 9.377751444181653, 'atr_min_pct': 0.016000341943245566, 'atr_max_pct': 0.14996642594599258, 'tp_mult': 2.2064174599531476, 'tsl_mult': 0.5834385933844739, 'strategy': 'breakout', 'time_stop': 186, 'use_sma': False, 'use_atr': False, 'use_adx': True, 'use_ema': False, 'use_spike': False, 'rsi_required': True, 'edge_k': 1.1748814403142245, 'edge_cap': 0.4384238814289241, 'bull_strategy': 'breakout', 'bull_bb_std_mult': 2.507806043765644, 'bull_rsi_os': 21, 'bull_rsi_ob': 45, 'bull_adx_thresh': 12.31936843774469, 'bull_atr_min_pct': 0.000976033317934194, 'bull_atr_max_pct': 0.09392681604953351, 'bull_tp_mult': 1.9200003790500382, 'bull_tsl_mult': 0.6753756738936916, 'bull_time_stop': 251, 'bull_use_sma': False, 'bull_use_ema': True, 'bull_use_atr': True, 'bull_use_adx': False, 'bull_use_spike': True, 'bull_rsi_required': True, 'bear_strategy': 'breakout', 'bear_bb_std_mult': 2.3778672680936235, 'bear_rsi_os': 46, 'bear_rsi_ob': 83, 'bear_adx_thresh': 9.463956865445136, 'bear_atr_min_pct': 0.005015124608844172, 'bear_atr_max_pct': 0.0750845562606346, 'bear_tp_mult': 1.2947341808893067, 'bear_tsl_mult': 0.49815801233731916, 'bear_time_stop': 98, 'bear_use_sma': True, 'bear_use_ema': False, 'bear_use_atr': True, 'bear_use_adx': False, 'bear_use_spike': False, 'bear_rsi_required': True, 'sideways_strategy': 'breakout', 'sideways_bb_std_mult': 1.0888876385261588, 'sideways_rsi_os': 38, 'sideways_rsi_ob': 88, 'sideways_adx_thresh': 5.820069193727459, 'sideways_atr_min_pct': 0.02640965563930922, 'sideways_atr_max_pct': 0.03195008910560585, 'sideways_tp_mult': 1.6999998251743114, 'sideways_tsl_mult': 0.42942208711429, 'sideways_time_stop': 99, 'sideways_use_sma': False, 'sideways_use_ema': False, 'sideways_use_atr': False, 'sideways_use_adx': False, 'sideways_use_spike': False, 'sideways_rsi_required': True}.
[I 2025-09-01 02:25:11,783] Trial 24 finished with values: [-1000000000.0, 1000000000.0] and parameters: {'p_sma': 9, 'p_std': 51, 'p_atr': 18, 'p_adx': 7, 'rsi_period': 74, 'ema1': 11, 'ema2': 30, 'slip_atr_k': 0.16141037761920077, 'slip_spread_k': 0.8107461016575768, 'spread_hl_frac': 0.03614036417446812, 'bb_std_mult': 3.212914605839698, 'rsi_os': 7, 'rsi_ob': 56, 'vol_spike': 0.1670821168440168, 'adx_thresh': 9.298534596498547, 'atr_min_pct': 0.015505953498954207, 'atr_max_pct': 0.14944968230525096, 'tp_mult': 2.1605899261700223, 'tsl_mult': 0.5840124760508892, 'strategy': 'breakout', 'time_stop': 180, 'use_sma': False, 'use_atr': False, 'use_adx': True, 'use_ema': False, 'use_spike': False, 'rsi_required': True, 'edge_k': 1.2094065953026025, 'edge_cap': 0.45214581660024156, 'bull_strategy': 'breakout', 'bull_bb_std_mult': 3.380769279179431, 'bull_rsi_os': 21, 'bull_rsi_ob': 45, 'bull_adx_thresh': 11.614788908537385, 'bull_atr_min_pct': 0.00048252839152813573, 'bull_atr_max_pct': 0.09242678952273965, 'bull_tp_mult': 1.9921027180592639, 'bull_tsl_mult': 0.6712059961523469, 'bull_time_stop': 178, 'bull_use_sma': False, 'bull_use_ema': True, 'bull_use_atr': True, 'bull_use_adx': False, 'bull_use_spike': True, 'bull_rsi_required': True, 'bear_strategy': 'breakout', 'bear_bb_std_mult': 2.3781976309479504, 'bear_rsi_os': 44, 'bear_rsi_ob': 85, 'bear_adx_thresh': 34.98322189350673, 'bear_atr_min_pct': 0.004923502706125427, 'bear_atr_max_pct': 0.07446263857784202, 'bear_tp_mult': 1.3144466228630192, 'bear_tsl_mult': 0.48351689391562047, 'bear_time_stop': 83, 'bear_use_sma': True, 'bear_use_ema': False, 'bear_use_atr': True, 'bear_use_adx': False, 'bear_use_spike': False, 'bear_rsi_required': True, 'sideways_strategy': 'breakout', 'sideways_bb_std_mult': 1.0902826013653724, 'sideways_rsi_os': 36, 'sideways_rsi_ob': 87, 'sideways_adx_thresh': 21.104563828975113, 'sideways_atr_min_pct': 0.029996574973913098, 'sideways_atr_max_pct': 0.03278145111967298, 'sideways_tp_mult': 1.7324498344816261, 'sideways_tsl_mult': 0.20173091810880706, 'sideways_time_stop': 104, 'sideways_use_sma': False, 'sideways_use_ema': False, 'sideways_use_atr': False, 'sideways_use_adx': False, 'sideways_use_spike': False, 'sideways_rsi_required': True}.
[I 2025-09-01 02:25:12,718] Trial 27 finished with values: [-1000000000.0, 1000000000.0] and parameters: {'p_sma': 31, 'p_std': 55, 'p_atr': 18, 'p_adx': 7, 'rsi_period': 54, 'ema1': 5, 'ema2': 31, 'slip_atr_k': 0.1744514230480097, 'slip_spread_k': 0.6956568873343434, 'spread_hl_frac': 0.036748891503784804, 'bb_std_mult': 3.243301803086901, 'rsi_os': 14, 'rsi_ob': 56, 'vol_spike': 0.1727971504479217, 'adx_thresh': 30.756009797299388, 'atr_min_pct': 0.025094370541797133, 'atr_max_pct': 0.14810329776956807, 'tp_mult': 2.0304434727976908, 'tsl_mult': 0.6690785999524699, 'strategy': 'breakout', 'time_stop': 193, 'use_sma': False, 'use_atr': False, 'use_adx': True, 'use_ema': False, 'use_spike': True, 'rsi_required': False, 'edge_k': 1.21183101804887, 'edge_cap': 0.4187370379022214, 'bull_strategy': 'breakout', 'bull_bb_std_mult': 3.4580749778406097, 'bull_rsi_os': 22, 'bull_rsi_ob': 45, 'bull_adx_thresh': 6.505989322568617, 'bull_atr_min_pct': 0.003830724078025873, 'bull_atr_max_pct': 0.03739428171955247, 'bull_tp_mult': 1.9720187410066023, 'bull_tsl_mult': 0.6499913793255717, 'bull_time_stop': 173, 'bull_use_sma': False, 'bull_use_ema': True, 'bull_use_atr': False, 'bull_use_adx': False, 'bull_use_spike': True, 'bull_rsi_required': True, 'bear_strategy': 'breakout', 'bear_bb_std_mult': 2.3404201026742757, 'bear_rsi_os': 32, 'bear_rsi_ob': 85, 'bear_adx_thresh': 30.512427251886628, 'bear_atr_min_pct': 0.012111513198193511, 'bear_atr_max_pct': 0.0765941419885196, 'bear_tp_mult': 1.283606803735948, 'bear_tsl_mult': 0.11193808316363135, 'bear_time_stop': 8, 'bear_use_sma': False, 'bear_use_ema': False, 'bear_use_atr': True, 'bear_use_adx': False, 'bear_use_spike': True, 'bear_rsi_required': True, 'sideways_strategy': 'breakout', 'sideways_bb_std_mult': 0.9316201572604439, 'sideways_rsi_os': 37, 'sideways_rsi_ob': 87, 'sideways_adx_thresh': 21.500473740637048, 'sideways_atr_min_pct': 0.029498843955263514, 'sideways_atr_max_pct': 0.031863020319758524, 'sideways_tp_mult': 2.3432479009582066, 'sideways_tsl_mult': 0.202003647327738, 'sideways_time_stop': 100, 'sideways_use_sma': False, 'sideways_use_ema': False, 'sideways_use_atr': False, 'sideways_use_adx': False, 'sideways_use_spike': True, 'sideways_rsi_required': False}.
[I 2025-09-01 02:25:14,366] Trial 26 finished with values: [-0.041176221714791295, 0.04099058897906714] and parameters: {'p_sma': 29, 'p_std': 50, 'p_atr': 24, 'p_adx': 8, 'rsi_period': 53, 'ema1': 11, 'ema2': 31, 'slip_atr_k': 0.1682546233947431, 'slip_spread_k': 0.7490064072001825, 'spread_hl_frac': 0.036119262170251486, 'bb_std_mult': 3.2081009707339576, 'rsi_os': 5, 'rsi_ob': 58, 'vol_spike': 0.12860587831337994, 'adx_thresh': 34.16535017798385, 'atr_min_pct': 0.024359199510542995, 'atr_max_pct': 0.1492294304582098, 'tp_mult': 2.220660974511641, 'tsl_mult': 0.5900708401856176, 'strategy': 'breakout', 'time_stop': 192, 'use_sma': False, 'use_atr': False, 'use_adx': True, 'use_ema': False, 'use_spike': True, 'rsi_required': False, 'edge_k': 1.2552280577144257, 'edge_cap': 0.43093632869322634, 'bull_strategy': 'breakout', 'bull_bb_std_mult': 3.5461668325622764, 'bull_rsi_os': 21, 'bull_rsi_ob': 76, 'bull_adx_thresh': 12.257239773366255, 'bull_atr_min_pct': 0.00028115374907494316, 'bull_atr_max_pct': 0.09723090024300843, 'bull_tp_mult': 1.9944892257742315, 'bull_tsl_mult': 0.6685212107531636, 'bull_time_stop': 170, 'bull_use_sma': False, 'bull_use_ema': True, 'bull_use_atr': False, 'bull_use_adx': False, 'bull_use_spike': True, 'bull_rsi_required': True, 'bear_strategy': 'breakout', 'bear_bb_std_mult': 2.3606923801636035, 'bear_rsi_os': 47, 'bear_rsi_ob': 84, 'bear_adx_thresh': 34.90510172147108, 'bear_atr_min_pct': 0.00546998795904226, 'bear_atr_max_pct': 0.07822590177715448, 'bear_tp_mult': 1.398574694254097, 'bear_tsl_mult': 0.12540821496062127, 'bear_time_stop': 90, 'bear_use_sma': False, 'bear_use_ema': False, 'bear_use_atr': True, 'bear_use_adx': False, 'bear_use_spike': True, 'bear_rsi_required': True, 'sideways_strategy': 'breakout', 'sideways_bb_std_mult': 1.0311611350875058, 'sideways_rsi_os': 36, 'sideways_rsi_ob': 88, 'sideways_adx_thresh': 6.452514810371962, 'sideways_atr_min_pct': 0.029718804488106567, 'sideways_atr_max_pct': 0.03752659022690325, 'sideways_tp_mult': 1.7626235067762246, 'sideways_tsl_mult': 0.4193835795630881, 'sideways_time_stop': 100, 'sideways_use_sma': False, 'sideways_use_ema': False, 'sideways_use_atr': False, 'sideways_use_adx': False, 'sideways_use_spike': True, 'sideways_rsi_required': False}.
