[I 2025-09-01 02:38:51,864] Trial 100 finished with values: [-1000000000.0, 1000000000.0] and parameters: {'p_sma': 57, 'p_std': 44, 'p_atr': 22, 'p_adx': 22, 'rsi_period': 29, 'ema1': 19, 'ema2': 17, 'slip_atr_k': 0.04228707128139958, 'slip_spread_k': 0.2914597881738056, 'spread_hl_frac': 0.007144844068441042, 'bb_std_mult': 1.181018688525219, 'rsi_os': 18, 'rsi_ob': 66, 'vol_spike': 0.02492924354001319, 'adx_thresh': 31.200628875654616, 'atr_min_pct': 0.01288276096676101, 'atr_max_pct': 0.09826127969765668, 'tp_mult': 2.066588629467949, 'tsl_mult': 0.7860296100603208, 'strategy': 'mean_reversion', 'time_stop': 288, 'use_sma': False, 'use_atr': True, 'use_adx': False, 'use_ema': False, 'use_spike': True, 'rsi_required': False, 'edge_k': 1.9040621193026301, 'edge_cap': 0.9105249080080895, 'bull_strategy': 'mean_reversion', 'bull_bb_std_mult': 1.5420071124687427, 'bull_rsi_os': 23, 'bull_rsi_ob': 84, 'bull_adx_thresh': 29.59159499875897, 'bull_atr_min_pct': 0.01442370773184673, 'bull_atr_max_pct': 0.04402493866942014, 'bull_tp_mult': 1.340485837265378, 'bull_tsl_mult': 0.5439380711737825, 'bull_time_stop': 160, 'bull_use_sma': False, 'bull_use_ema': False, 'bull_use_atr': False, 'bull_use_adx': True, 'bull_use_spike': True, 'bull_rsi_required': False, 'bear_strategy': 'mean_reversion', 'bear_bb_std_mult': 1.1257709779034728, 'bear_rsi_os': 6, 'bear_rsi_ob': 74, 'bear_adx_thresh': 19.180434271588386, 'bear_atr_min_pct': 0.010985218751262637, 'bear_atr_max_pct': 0.04660632259710425, 'bear_tp_mult': 2.495717556573236, 'bear_tsl_mult': 0.0049966080733516716, 'bear_time_stop': 69, 'bear_use_sma': False, 'bear_use_ema': True, 'bear_use_atr': False, 'bear_use_adx': True, 'bear_use_spike': True, 'bear_rsi_required': True, 'sideways_strategy': 'breakout', 'sideways_bb_std_mult': 3.424283488958916, 'sideways_rsi_os': 19, 'sideways_rsi_ob': 69, 'sideways_adx_thresh': 6.617943627182811, 'sideways_atr_min_pct': 0.018359312175480452, 'sideways_atr_max_pct': 0.04945208098018713, 'sideways_tp_mult': 1.680711122633865, 'sideways_tsl_mult': 0.6321880761992732, 'sideways_time_stop': 35, 'sideways_use_sma': True, 'sideways_use_ema': True, 'sideways_use_atr': True, 'sideways_use_adx': False, 'sideways_use_spike': True, 'sideways_rsi_required': False}.
[I 2025-09-01 02:38:52,356] Trial 97 finished with values: [-1000000000.0, 1000000000.0] and parameters: {'p_sma': 57, 'p_std': 49, 'p_atr': 22, 'p_adx': 21, 'rsi_period': 37, 'ema1': 18, 'ema2': 57, 'slip_atr_k': 0.1803023265894369, 'slip_spread_k': 0.048283944792164524, 'spread_hl_frac': 0.023039196333972233, 'bb_std_mult': 1.4406740320146783, 'rsi_os': 6, 'rsi_ob': 94, 'vol_spike': 0.03152804193767318, 'adx_thresh': 30.3969529956467, 'atr_min_pct': 0.013518416346928755, 'atr_max_pct': 0.1090424906804814, 'tp_mult': 2.0299927157051085, 'tsl_mult': 0.6794391234320727, 'strategy': 'breakout', 'time_stop': 103, 'use_sma': False, 'use_atr': False, 'use_adx': False, 'use_ema': False, 'use_spike': True, 'rsi_required': False, 'edge_k': 0.5806620828316696, 'edge_cap': 0.10398839472756527, 'bull_strategy': 'breakout', 'bull_bb_std_mult': 1.3738138930958048, 'bull_rsi_os': 39, 'bull_rsi_ob': 68, 'bull_adx_thresh': 29.03349265893377, 'bull_atr_min_pct': 0.0004719501078992163, 'bull_atr_max_pct': 0.13715440675738227, 'bull_tp_mult': 1.5865062434920656, 'bull_tsl_mult': 0.5464724571384014, 'bull_time_stop': 47, 'bull_use_sma': False, 'bull_use_ema': False, 'bull_use_atr': False, 'bull_use_adx': False, 'bull_use_spike': True, 'bull_rsi_required': True, 'bear_strategy': 'breakout', 'bear_bb_std_mult': 2.3292157338164015, 'bear_rsi_os': 5, 'bear_rsi_ob': 59, 'bear_adx_thresh': 17.13082033409603, 'bear_atr_min_pct': 0.0075146358749845245, 'bear_atr_max_pct': 0.05366283647846211, 'bear_tp_mult': 2.1684279133066418, 'bear_tsl_mult': 0.07249412720578746, 'bear_time_stop': 181, 'bear_use_sma': False, 'bear_use_ema': False, 'bear_use_atr': False, 'bear_use_adx': True, 'bear_use_spike': True, 'bear_rsi_required': True, 'sideways_strategy': 'breakout', 'sideways_bb_std_mult': 1.5451688728500859, 'sideways_rsi_os': 16, 'sideways_rsi_ob': 70, 'sideways_adx_thresh': 28.88508038224476, 'sideways_atr_min_pct': 0.01000921464922716, 'sideways_atr_max_pct': 0.11556310656538712, 'sideways_tp_mult': 1.2329633257040247, 'sideways_tsl_mult': 0.6276285953623901, 'sideways_time_stop': 35, 'sideways_use_sma': False, 'sideways_use_ema': True, 'sideways_use_atr': True, 'sideways_use_adx': True, 'sideways_use_spike': True, 'sideways_rsi_required': False}.
[I 2025-09-01 02:39:34,209] Trial 103 finished with values: [-1000000000.0, 1000000000.0] and parameters: {'p_sma': 22, 'p_std': 34, 'p_atr': 26, 'p_adx': 27, 'rsi_period': 44, 'ema1': 6, 'ema2': 55, 'slip_atr_k': 0.15535189325654844, 'slip_spread_k': 0.40604729985063814, 'spread_hl_frac': 0.010968144231509712, 'bb_std_mult': 2.9200000158692108, 'rsi_os': 39, 'rsi_ob': 95, 'vol_spike': 0.1696068380396099, 'adx_thresh': 29.168266657344375, 'atr_min_pct': 0.0138631398336517, 'atr_max_pct': 0.08843560448112271, 'tp_mult': 1.025393418502857, 'tsl_mult': 0.731377021818003, 'strategy': 'breakout', 'time_stop': 52, 'use_sma': False, 'use_atr': True, 'use_adx': True, 'use_ema': False, 'use_spike': False, 'rsi_required': True, 'edge_k': 0.4310501914960132, 'edge_cap': 0.13436821508571375, 'bull_strategy': 'mean_reversion', 'bull_bb_std_mult': 1.7452581095906525, 'bull_rsi_os': 9, 'bull_rsi_ob': 68, 'bull_adx_thresh': 28.863712632122763, 'bull_atr_min_pct': 0.011404175826906605, 'bull_atr_max_pct': 0.010979580308493664, 'bull_tp_mult': 1.5775973954031242, 'bull_tsl_mult': 0.7863402908717627, 'bull_time_stop': 276, 'bull_use_sma': False, 'bull_use_ema': True, 'bull_use_atr': True, 'bull_use_adx': False, 'bull_use_spike': False, 'bull_rsi_required': True, 'bear_strategy': 'breakout', 'bear_bb_std_mult': 2.7039969838886107, 'bear_rsi_os': 10, 'bear_rsi_ob': 58, 'bear_adx_thresh': 11.723171244595973, 'bear_atr_min_pct': 0.010176484975870384, 'bear_atr_max_pct': 0.05947933086990197, 'bear_tp_mult': 2.990502101731236, 'bear_tsl_mult': 0.994159391049384, 'bear_time_stop': 49, 'bear_use_sma': False, 'bear_use_ema': False, 'bear_use_atr': True, 'bear_use_adx': False, 'bear_use_spike': True, 'bear_rsi_required': False, 'sideways_strategy': 'mean_reversion', 'sideways_bb_std_mult': 1.9245070896019905, 'sideways_rsi_os': 5, 'sideways_rsi_ob': 73, 'sideways_adx_thresh': 13.227623325248045, 'sideways_atr_min_pct': 0.017272061116510622, 'sideways_atr_max_pct': 0.1066224139594487, 'sideways_tp_mult': 1.2389327263668284, 'sideways_tsl_mult': 0.5461136764251078, 'sideways_time_stop': 51, 'sideways_use_sma': False, 'sideways_use_ema': False, 'sideways_use_atr': False, 'sideways_use_adx': False, 'sideways_use_spike': False, 'sideways_rsi_required': False}.
[I 2025-09-01 02:39:35,899] Trial 104 finished with values: [-1000000000.0, 1000000000.0] and parameters: {'p_sma': 17, 'p_std': 20, 'p_atr': 24, 'p_adx': 27, 'rsi_period': 45, 'ema1': 6, 'ema2': 42, 'slip_atr_k': 0.13839390141220498, 'slip_spread_k': 0.09568345764817765, 'spread_hl_frac': 0.011269263107412442, 'bb_std_mult': 1.3096779794182507, 'rsi_os': 9, 'rsi_ob': 79, 'vol_spike': 0.1311163144816844, 'adx_thresh': 27.30680297846766, 'atr_min_pct': 0.010663599602651236, 'atr_max_pct': 0.08762402769750213, 'tp_mult': 1.891105619355071, 'tsl_mult': 0.6459644388543915, 'strategy': 'breakout', 'time_stop': 50, 'use_sma': False, 'use_atr': False, 'use_adx': False, 'use_ema': False, 'use_spike': False, 'rsi_required': True, 'edge_k': 0.4349517432829038, 'edge_cap': 0.1309746950257837, 'bull_strategy': 'mean_reversion', 'bull_bb_std_mult': 1.0683438428794785, 'bull_rsi_os': 17, 'bull_rsi_ob': 64, 'bull_adx_thresh': 18.54809520139397, 'bull_atr_min_pct': 0.00013547732652546533, 'bull_atr_max_pct': 0.010984112534305063, 'bull_tp_mult': 1.5238619770593944, 'bull_tsl_mult': 0.4655228817460788, 'bull_time_stop': 288, 'bull_use_sma': True, 'bull_use_ema': True, 'bull_use_atr': True, 'bull_use_adx': False, 'bull_use_spike': False, 'bull_rsi_required': True, 'bear_strategy': 'breakout', 'bear_bb_std_mult': 2.012377142378985, 'bear_rsi_os': 30, 'bear_rsi_ob': 53, 'bear_adx_thresh': 32.45799664667474, 'bear_atr_min_pct': 0.0016611721959576865, 'bear_atr_max_pct': 0.09063280238856194, 'bear_tp_mult': 2.4011094198755334, 'bear_tsl_mult': 0.9833559310221529, 'bear_time_stop': 47, 'bear_use_sma': False, 'bear_use_ema': False, 'bear_use_atr': True, 'bear_use_adx': True, 'bear_use_spike': True, 'bear_rsi_required': True, 'sideways_strategy': 'mean_reversion', 'sideways_bb_std_mult': 3.345138789044309, 'sideways_rsi_os': 14, 'sideways_rsi_ob': 73, 'sideways_adx_thresh': 29.7446054765136, 'sideways_atr_min_pct': 0.004058819052049332, 'sideways_atr_max_pct': 0.14703536972309839, 'sideways_tp_mult': 1.1481416118973886, 'sideways_tsl_mult': 0.5536894282097771, 'sideways_time_stop': 219, 'sideways_use_sma': False, 'sideways_use_ema': False, 'sideways_use_atr': False, 'sideways_use_adx': True, 'sideways_use_spike': False, 'sideways_rsi_required': False}.
[I 2025-09-01 02:39:36,966] Trial 102 finished with values: [-1000000000.0, 1000000000.0] and parameters: {'p_sma': 57, 'p_std': 45, 'p_atr': 22, 'p_adx': 27, 'rsi_period': 83, 'ema1': 20, 'ema2': 18, 'slip_atr_k': 0.182592900582084, 'slip_spread_k': 0.4063854225529182, 'spread_hl_frac': 0.011206672717537301, 'bb_std_mult': 1.9264955881567074, 'rsi_os': 34, 'rsi_ob': 68, 'vol_spike': 0.20000808056699348, 'adx_thresh': 28.507527000785004, 'atr_min_pct': 0.013472809262817863, 'atr_max_pct': 0.0988745948305224, 'tp_mult': 2.2575387136549683, 'tsl_mult': 0.38372943175263924, 'strategy': 'mean_reversion', 'time_stop': 43, 'use_sma': False, 'use_atr': True, 'use_adx': False, 'use_ema': False, 'use_spike': False, 'rsi_required': True, 'edge_k': 0.43309671148369483, 'edge_cap': 0.13059877493454816, 'bull_strategy': 'mean_reversion', 'bull_bb_std_mult': 1.5568035747775812, 'bull_rsi_os': 14, 'bull_rsi_ob': 68, 'bull_adx_thresh': 26.334717848915577, 'bull_atr_min_pct': 0.011563254786672465, 'bull_atr_max_pct': 0.14606687639942448, 'bull_tp_mult': 1.298628482784494, 'bull_tsl_mult': 0.4660030644718641, 'bull_time_stop': 204, 'bull_use_sma': False, 'bull_use_ema': True, 'bull_use_atr': True, 'bull_use_adx': False, 'bull_use_spike': False, 'bull_rsi_required': False, 'bear_strategy': 'mean_reversion', 'bear_bb_std_mult': 3.286447588586002, 'bear_rsi_os': 10, 'bear_rsi_ob': 86, 'bear_adx_thresh': 21.010509456140237, 'bear_atr_min_pct': 0.0009519194803118448, 'bear_atr_max_pct': 0.05919552858987786, 'bear_tp_mult': 2.274378409652731, 'bear_tsl_mult': 0.9987054654736105, 'bear_time_stop': 55, 'bear_use_sma': False, 'bear_use_ema': True, 'bear_use_atr': False, 'bear_use_adx': True, 'bear_use_spike': True, 'bear_rsi_required': True, 'sideways_strategy': 'mean_reversion', 'sideways_bb_std_mult': 3.380353360369349, 'sideways_rsi_os': 6, 'sideways_rsi_ob': 69, 'sideways_adx_thresh': 31.914111986913444, 'sideways_atr_min_pct': 0.0038959289930675708, 'sideways_atr_max_pct': 0.04806214250187583, 'sideways_tp_mult': 1.0860637018546577, 'sideways_tsl_mult': 0.5473743166609569, 'sideways_time_stop': 68, 'sideways_use_sma': True, 'sideways_use_ema': True, 'sideways_use_atr': False, 'sideways_use_adx': False, 'sideways_use_spike': False, 'sideways_rsi_required': False}.
[I 2025-09-01 02:39:37,665] Trial 101 finished with values: [-1000000000.0, 1000000000.0] and parameters: {'p_sma': 51, 'p_std': 52, 'p_atr': 22, 'p_adx': 12, 'rsi_period': 79, 'ema1': 20, 'ema2': 55, 'slip_atr_k': 0.13727254797050575, 'slip_spread_k': 0.4191044580149924, 'spread_hl_frac': 0.004675717926797292, 'bb_std_mult': 1.1927598672189217, 'rsi_os': 8, 'rsi_ob': 95, 'vol_spike': 0.018640279650254138, 'adx_thresh': 15.252832803067331, 'atr_min_pct': 0.010638670792738834, 'atr_max_pct': 0.08749289728878941, 'tp_mult': 1.999890847422567, 'tsl_mult': 0.6552542861973579, 'strategy': 'mean_reversion', 'time_stop': 289, 'use_sma': False, 'use_atr': True, 'use_adx': False, 'use_ema': False, 'use_spike': True, 'rsi_required': False, 'edge_k': 0.3736567209573086, 'edge_cap': 0.9001370868432339, 'bull_strategy': 'mean_reversion', 'bull_bb_std_mult': 0.968683640289418, 'bull_rsi_os': 23, 'bull_rsi_ob': 64, 'bull_adx_thresh': 29.523049315364755, 'bull_atr_min_pct': 0.011611734132531002, 'bull_atr_max_pct': 0.13891144076528703, 'bull_tp_mult': 1.9170650579249373, 'bull_tsl_mult': 0.4665323657624664, 'bull_time_stop': 275, 'bull_use_sma': False, 'bull_use_ema': False, 'bull_use_atr': False, 'bull_use_adx': True, 'bull_use_spike': True, 'bull_rsi_required': False, 'bear_strategy': 'mean_reversion', 'bear_bb_std_mult': 1.775745070312992, 'bear_rsi_os': 10, 'bear_rsi_ob': 74, 'bear_adx_thresh': 32.54748043105293, 'bear_atr_min_pct': 0.024224384521003558, 'bear_atr_max_pct': 0.04653615087438344, 'bear_tp_mult': 2.2729498066635068, 'bear_tsl_mult': 0.9963032142686782, 'bear_time_stop': 70, 'bear_use_sma': False, 'bear_use_ema': True, 'bear_use_atr': False, 'bear_use_adx': True, 'bear_use_spike': True, 'bear_rsi_required': True, 'sideways_strategy': 'mean_reversion', 'sideways_bb_std_mult': 2.5235735990891706, 'sideways_rsi_os': 22, 'sideways_rsi_ob': 68, 'sideways_adx_thresh': 13.04853802953475, 'sideways_atr_min_pct': 0.00411829638138708, 'sideways_atr_max_pct': 0.10750359985236457, 'sideways_tp_mult': 1.252450278108906, 'sideways_tsl_mult': 0.9927530884027098, 'sideways_time_stop': 33, 'sideways_use_sma': True, 'sideways_use_ema': True, 'sideways_use_atr': False, 'sideways_use_adx': False, 'sideways_use_spike': True, 'sideways_rsi_required': False}.
[I 2025-09-01 02:40:27,129] Trial 107 finished with values: [-1000000000.0, 1000000000.0] and parameters: {'p_sma': 20, 'p_std': 52, 'p_atr': 21, 'p_adx': 7, 'rsi_period': 56, 'ema1': 30, 'ema2': 60, 'slip_atr_k': 0.022732056952300017, 'slip_spread_k': 0.48769308312697374, 'spread_hl_frac': 0.008983665018917866, 'bb_std_mult': 1.5395734808196222, 'rsi_os': 50, 'rsi_ob': 63, 'vol_spike': 0.1841865499420973, 'adx_thresh': 26.457195512486937, 'atr_min_pct': 0.01470696246295533, 'atr_max_pct': 0.09212178456937355, 'tp_mult': 2.6639403195506572, 'tsl_mult': 0.7038783164022763, 'strategy': 'breakout', 'time_stop': 276, 'use_sma': True, 'use_atr': False, 'use_adx': False, 'use_ema': False, 'use_spike': True, 'rsi_required': False, 'edge_k': 1.7221017950557194, 'edge_cap': 0.757493469511548, 'bull_strategy': 'mean_reversion', 'bull_bb_std_mult': 1.9832606432731883, 'bull_rsi_os': 37, 'bull_rsi_ob': 71, 'bull_adx_thresh': 30.276718406364864, 'bull_atr_min_pct': 0.001405462257446239, 'bull_atr_max_pct': 0.14379593044207925, 'bull_tp_mult': 2.5573527661426647, 'bull_tsl_mult': 0.5036337564586235, 'bull_time_stop': 76, 'bull_use_sma': True, 'bull_use_ema': False, 'bull_use_atr': False, 'bull_use_adx': False, 'bull_use_spike': True, 'bull_rsi_required': True, 'bear_strategy': 'breakout', 'bear_bb_std_mult': 1.7842506898838473, 'bear_rsi_os': 35, 'bear_rsi_ob': 61, 'bear_adx_thresh': 33.842749775823094, 'bear_atr_min_pct': 0.021110101201548295, 'bear_atr_max_pct': 0.10937461597200523, 'bear_tp_mult': 2.3327347250265724, 'bear_tsl_mult': 0.9652612096717443, 'bear_time_stop': 74, 'bear_use_sma': True, 'bear_use_ema': False, 'bear_use_atr': False, 'bear_use_adx': True, 'bear_use_spike': False, 'bear_rsi_required': True, 'sideways_strategy': 'breakout', 'sideways_bb_std_mult': 3.1535207916736367, 'sideways_rsi_os': 21, 'sideways_rsi_ob': 66, 'sideways_adx_thresh': 30.716468162654053, 'sideways_atr_min_pct': 0.01635784501035458, 'sideways_atr_max_pct': 0.10151601075119436, 'sideways_tp_mult': 1.6060470558453595, 'sideways_tsl_mult': 0.9929540888028607, 'sideways_time_stop': 5, 'sideways_use_sma': False, 'sideways_use_ema': True, 'sideways_use_atr': True, 'sideways_use_adx': True, 'sideways_use_spike': True, 'sideways_rsi_required': False}.
[I 2025-09-01 02:40:27,156] Trial 108 finished with values: [-0.030113020705752613, 0.03003236553086179] and parameters: {'p_sma': 31, 'p_std': 41, 'p_atr': 21, 'p_adx': 9, 'rsi_period': 58, 'ema1': 30, 'ema2': 60, 'slip_atr_k': 0.16422393414750963, 'slip_spread_k': 0.6781724164815036, 'spread_hl_frac': 0.01293961981026686, 'bb_std_mult': 2.16775162719234, 'rsi_os': 29, 'rsi_ob': 63, 'vol_spike': 0.2886307332231966, 'adx_thresh': 23.33725454674478, 'atr_min_pct': 0.014753370750577787, 'atr_max_pct': 0.09215078510763972, 'tp_mult': 1.9163973685900004, 'tsl_mult': 0.5782524923873249, 'strategy': 'breakout', 'time_stop': 275, 'use_sma': True, 'use_atr': False, 'use_adx': True, 'use_ema': False, 'use_spike': True, 'rsi_required': False, 'edge_k': 0.2967245888866712, 'edge_cap': 0.744395051574882, 'bull_strategy': 'mean_reversion', 'bull_bb_std_mult': 1.228051253364651, 'bull_rsi_os': 14, 'bull_rsi_ob': 71, 'bull_adx_thresh': 30.387688740519593, 'bull_atr_min_pct': 0.001322111749479105, 'bull_atr_max_pct': 0.1442382854616787, 'bull_tp_mult': 1.6604724543302596, 'bull_tsl_mult': 0.5026418281368371, 'bull_time_stop': 76, 'bull_use_sma': True, 'bull_use_ema': False, 'bull_use_atr': False, 'bull_use_adx': False, 'bull_use_spike': True, 'bull_rsi_required': True, 'bear_strategy': 'breakout', 'bear_bb_std_mult': 2.4859155249435214, 'bear_rsi_os': 36, 'bear_rsi_ob': 82, 'bear_adx_thresh': 15.730098903146109, 'bear_atr_min_pct': 0.013179545000119286, 'bear_atr_max_pct': 0.040193885884812375, 'bear_tp_mult': 1.2455094154696202, 'bear_tsl_mult': 0.9642131025604874, 'bear_time_stop': 16, 'bear_use_sma': True, 'bear_use_ema': False, 'bear_use_atr': False, 'bear_use_adx': False, 'bear_use_spike': False, 'bear_rsi_required': False, 'sideways_strategy': 'breakout', 'sideways_bb_std_mult': 3.154543443590924, 'sideways_rsi_os': 14, 'sideways_rsi_ob': 66, 'sideways_adx_thresh': 12.134418142640104, 'sideways_atr_min_pct': 0.015320825594316448, 'sideways_atr_max_pct': 0.10396229813339988, 'sideways_tp_mult': 1.489582586918786, 'sideways_tsl_mult': 0.04189234244926077, 'sideways_time_stop': 58, 'sideways_use_sma': False, 'sideways_use_ema': True, 'sideways_use_atr': True, 'sideways_use_adx': True, 'sideways_use_spike': True, 'sideways_rsi_required': True}.
[I 2025-09-01 02:40:28,086] Trial 106 finished with values: [-0.03286985406379894, 0.03271108449493774] and parameters: {'p_sma': 49, 'p_std': 45, 'p_atr': 22, 'p_adx': 9, 'rsi_period': 53, 'ema1': 9, 'ema2': 60, 'slip_atr_k': 0.02937223520032753, 'slip_spread_k': 0.874864317611742, 'spread_hl_frac': 0.009007851740774942, 'bb_std_mult': 1.5566567872793622, 'rsi_os': 34, 'rsi_ob': 70, 'vol_spike': 0.12391773026908033, 'adx_thresh': 26.397549728780746, 'atr_min_pct': 0.02710232923200722, 'atr_max_pct': 0.09217069478377718, 'tp_mult': 2.8911343430194982, 'tsl_mult': 0.706200307652499, 'strategy': 'mean_reversion', 'time_stop': 255, 'use_sma': True, 'use_atr': False, 'use_adx': False, 'use_ema': False, 'use_spike': True, 'rsi_required': False, 'edge_k': 1.6791229885861596, 'edge_cap': 0.16825942943212074, 'bull_strategy': 'mean_reversion', 'bull_bb_std_mult': 1.9877250815803773, 'bull_rsi_os': 14, 'bull_rsi_ob': 50, 'bull_adx_thresh': 26.3948478461074, 'bull_atr_min_pct': 0.0014040188555550115, 'bull_atr_max_pct': 0.01782042742327406, 'bull_tp_mult': 2.8499709466078276, 'bull_tsl_mult': 0.380938440689916, 'bull_time_stop': 76, 'bull_use_sma': True, 'bull_use_ema': False, 'bull_use_atr': False, 'bull_use_adx': False, 'bull_use_spike': True, 'bull_rsi_required': False, 'bear_strategy': 'mean_reversion', 'bear_bb_std_mult': 2.5034507711238727, 'bear_rsi_os': 7, 'bear_rsi_ob': 83, 'bear_adx_thresh': 24.005305707770326, 'bear_atr_min_pct': 0.021405225475211457, 'bear_atr_max_pct': 0.057958228994073185, 'bear_tp_mult': 2.2553031235137415, 'bear_tsl_mult': 0.9630660466044857, 'bear_time_stop': 57, 'bear_use_sma': True, 'bear_use_ema': True, 'bear_use_atr': False, 'bear_use_adx': True, 'bear_use_spike': False, 'bear_rsi_required': True, 'sideways_strategy': 'breakout', 'sideways_bb_std_mult': 3.0532230089306096, 'sideways_rsi_os': 14, 'sideways_rsi_ob': 66, 'sideways_adx_thresh': 11.93702397063598, 'sideways_atr_min_pct': 0.019548622547077944, 'sideways_atr_max_pct': 0.017099321248264743, 'sideways_tp_mult': 1.0738984882916793, 'sideways_tsl_mult': 0.9943712372265803, 'sideways_time_stop': 63, 'sideways_use_sma': True, 'sideways_use_ema': True, 'sideways_use_atr': True, 'sideways_use_adx': True, 'sideways_use_spike': True, 'sideways_rsi_required': False}.
