[I 2025-09-01 03:18:37,558] Trial 342 finished with values: [-0.0203784388201127, 0.020241852022785556] and parameters: {'p_sma': 45, 'p_std': 24, 'p_atr': 14, 'p_adx': 21, 'rsi_period': 13, 'ema1': 11, 'ema2': 23, 'slip_atr_k': 0.023741290333886087, 'slip_spread_k': 0.7861181000622544, 'spread_hl_frac': 0.03878675756920793, 'bb_std_mult': 1.509895439159128, 'rsi_os': 18, 'rsi_ob': 76, 'vol_spike': 0.005905379018022211, 'adx_thresh': 13.193349121836906, 'atr_min_pct': 0.008046643145034785, 'atr_max_pct': 0.05614499095251484, 'tp_mult': 2.543198883906409, 'tsl_mult': 0.28777334401827676, 'strategy': 'mean_reversion', 'time_stop': 39, 'use_sma': False, 'use_atr': False, 'use_adx': True, 'use_ema': True, 'use_spike': True, 'rsi_required': False, 'edge_k': 0.7614369300955761, 'edge_cap': 0.8633234694387038, 'bull_strategy': 'breakout', 'bull_bb_std_mult': 1.381510727326923, 'bull_rsi_os': 46, 'bull_rsi_ob': 57, 'bull_adx_thresh': 23.185395507092235, 'bull_atr_min_pct': 0.0015407361278912922, 'bull_atr_max_pct': 0.11174412738732485, 'bull_tp_mult': 1.9127101185592368, 'bull_tsl_mult': 0.2782299289414695, 'bull_time_stop': 100, 'bull_use_sma': False, 'bull_use_ema': False, 'bull_use_atr': False, 'bull_use_adx': True, 'bull_use_spike': True, 'bull_rsi_required': False, 'bear_strategy': 'breakout', 'bear_bb_std_mult': 1.1291927687625611, 'bear_rsi_os': 28, 'bear_rsi_ob': 58, 'bear_adx_thresh': 15.01649060464758, 'bear_atr_min_pct': 0.027864027290566584, 'bear_atr_max_pct': 0.022922081243229336, 'bear_tp_mult': 1.9387250721684353, 'bear_tsl_mult': 0.20859961213217804, 'bear_time_stop': 79, 'bear_use_sma': False, 'bear_use_ema': False, 'bear_use_atr': False, 'bear_use_adx': False, 'bear_use_spike': True, 'bear_rsi_required': True, 'sideways_strategy': 'breakout', 'sideways_bb_std_mult': 1.8352409362394715, 'sideways_rsi_os': 53, 'sideways_rsi_ob': 75, 'sideways_adx_thresh': 9.786178812937058, 'sideways_atr_min_pct': 0.02628618852323224, 'sideways_atr_max_pct': 0.07394300134091365, 'sideways_tp_mult': 1.6497531870044062, 'sideways_tsl_mult': 0.17629940460376653, 'sideways_time_stop': 96, 'sideways_use_sma': True, 'sideways_use_ema': True, 'sideways_use_atr': True, 'sideways_use_adx': True, 'sideways_use_spike': True, 'sideways_rsi_required': True}.
[I 2025-09-01 03:19:21,018] Trial 344 finished with values: [-1000000000.0, 1000000000.0] and parameters: {'p_sma': 37, 'p_std': 30, 'p_atr': 27, 'p_adx': 17, 'rsi_period': 18, 'ema1': 21, 'ema2': 38, 'slip_atr_k': 0.023822233860242428, 'slip_spread_k': 0.08790885059037348, 'spread_hl_frac': 0.023929072073749946, 'bb_std_mult': 1.3791182285636412, 'rsi_os': 17, 'rsi_ob': 87, 'vol_spike': 0.23066166203215493, 'adx_thresh': 18.15230347003628, 'atr_min_pct': 0.015810958374490515, 'atr_max_pct': 0.056220555852506515, 'tp_mult': 2.599822667831893, 'tsl_mult': 0.4125667555840643, 'strategy': 'mean_reversion', 'time_stop': 39, 'use_sma': False, 'use_atr': False, 'use_adx': True, 'use_ema': False, 'use_spike': True, 'rsi_required': False, 'edge_k': 0.03871855489997189, 'edge_cap': 0.45065426154790833, 'bull_strategy': 'breakout', 'bull_bb_std_mult': 1.7322621236571139, 'bull_rsi_os': 29, 'bull_rsi_ob': 52, 'bull_adx_thresh': 23.149975539301366, 'bull_atr_min_pct': 0.003685778862558586, 'bull_atr_max_pct': 0.11219350174016503, 'bull_tp_mult': 1.7572544084799122, 'bull_tsl_mult': 0.3364250503523447, 'bull_time_stop': 17, 'bull_use_sma': False, 'bull_use_ema': False, 'bull_use_atr': False, 'bull_use_adx': True, 'bull_use_spike': True, 'bull_rsi_required': False, 'bear_strategy': 'breakout', 'bear_bb_std_mult': 0.5922370457314552, 'bear_rsi_os': 53, 'bear_rsi_ob': 47, 'bear_adx_thresh': 22.898661960831678, 'bear_atr_min_pct': 0.027881769868045414, 'bear_atr_max_pct': 0.07918497879159932, 'bear_tp_mult': 1.011120165056205, 'bear_tsl_mult': 0.40799654443691, 'bear_time_stop': 77, 'bear_use_sma': False, 'bear_use_ema': False, 'bear_use_atr': False, 'bear_use_adx': False, 'bear_use_spike': True, 'bear_rsi_required': True, 'sideways_strategy': 'breakout', 'sideways_bb_std_mult': 1.4412318951094214, 'sideways_rsi_os': 50, 'sideways_rsi_ob': 76, 'sideways_adx_thresh': 10.291432587446137, 'sideways_atr_min_pct': 0.0097590928520909, 'sideways_atr_max_pct': 0.03325914422244555, 'sideways_tp_mult': 1.644649953682251, 'sideways_tsl_mult': 0.17293736040957025, 'sideways_time_stop': 228, 'sideways_use_sma': True, 'sideways_use_ema': True, 'sideways_use_atr': True, 'sideways_use_adx': True, 'sideways_use_spike': True, 'sideways_rsi_required': True}.
[I 2025-09-01 03:19:21,348] Trial 346 finished with values: [-1000000000.0, 1000000000.0] and parameters: {'p_sma': 41, 'p_std': 56, 'p_atr': 20, 'p_adx': 17, 'rsi_period': 25, 'ema1': 23, 'ema2': 59, 'slip_atr_k': 0.004892735581233891, 'slip_spread_k': 0.09396208736958711, 'spread_hl_frac': 0.023836906468185565, 'bb_std_mult': 1.3804064864577406, 'rsi_os': 24, 'rsi_ob': 76, 'vol_spike': 0.23023231805510289, 'adx_thresh': 9.39267218454923, 'atr_min_pct': 0.00862778769707868, 'atr_max_pct': 0.05617559749077511, 'tp_mult': 2.5438668460692355, 'tsl_mult': 0.6986056144692809, 'strategy': 'mean_reversion', 'time_stop': 37, 'use_sma': False, 'use_atr': False, 'use_adx': True, 'use_ema': False, 'use_spike': True, 'rsi_required': False, 'edge_k': 0.0024071124250609754, 'edge_cap': 0.4557143469104617, 'bull_strategy': 'breakout', 'bull_bb_std_mult': 2.08136541507195, 'bull_rsi_os': 5, 'bull_rsi_ob': 57, 'bull_adx_thresh': 23.3032103580827, 'bull_atr_min_pct': 0.003699844109867582, 'bull_atr_max_pct': 0.11170333909211977, 'bull_tp_mult': 1.9043722023816958, 'bull_tsl_mult': 0.2772439499170024, 'bull_time_stop': 266, 'bull_use_sma': True, 'bull_use_ema': False, 'bull_use_atr': False, 'bull_use_adx': True, 'bull_use_spike': True, 'bull_rsi_required': False, 'bear_strategy': 'breakout', 'bear_bb_std_mult': 2.198479707074463, 'bear_rsi_os': 54, 'bear_rsi_ob': 58, 'bear_adx_thresh': 14.904391451251758, 'bear_atr_min_pct': 0.027729543409352343, 'bear_atr_max_pct': 0.025176819393195035, 'bear_tp_mult': 2.503985980362447, 'bear_tsl_mult': 0.11353409535850353, 'bear_time_stop': 76, 'bear_use_sma': False, 'bear_use_ema': False, 'bear_use_atr': False, 'bear_use_adx': False, 'bear_use_spike': True, 'bear_rsi_required': True, 'sideways_strategy': 'breakout', 'sideways_bb_std_mult': 2.409053582276407, 'sideways_rsi_os': 37, 'sideways_rsi_ob': 76, 'sideways_adx_thresh': 26.636861699791112, 'sideways_atr_min_pct': 0.026451057098054936, 'sideways_atr_max_pct': 0.07378209477482554, 'sideways_tp_mult': 1.6501811442251315, 'sideways_tsl_mult': 0.4085516624856475, 'sideways_time_stop': 119, 'sideways_use_sma': True, 'sideways_use_ema': True, 'sideways_use_atr': True, 'sideways_use_adx': True, 'sideways_use_spike': True, 'sideways_rsi_required': True}.
[I 2025-09-01 03:19:22,013] Trial 343 finished with values: [-0.02588980764481963, 0.025741058631508003] and parameters: {'p_sma': 22, 'p_std': 30, 'p_atr': 28, 'p_adx': 17, 'rsi_period': 7, 'ema1': 23, 'ema2': 23, 'slip_atr_k': 0.023641303672032994, 'slip_spread_k': 0.06860071055273682, 'spread_hl_frac': 0.02684693856521378, 'bb_std_mult': 1.3862414547619892, 'rsi_os': 26, 'rsi_ob': 90, 'vol_spike': 0.2123833424036444, 'adx_thresh': 11.822550617181998, 'atr_min_pct': 0.004206180409948249, 'atr_max_pct': 0.14120094803171707, 'tp_mult': 2.5113394864412713, 'tsl_mult': 0.4135283509353407, 'strategy': 'mean_reversion', 'time_stop': 106, 'use_sma': True, 'use_atr': False, 'use_adx': True, 'use_ema': False, 'use_spike': True, 'rsi_required': False, 'edge_k': 0.05140198878972159, 'edge_cap': 0.47168905289236507, 'bull_strategy': 'breakout', 'bull_bb_std_mult': 1.3441662756852992, 'bull_rsi_os': 15, 'bull_rsi_ob': 53, 'bull_adx_thresh': 17.634692656043278, 'bull_atr_min_pct': 0.0014543200343950173, 'bull_atr_max_pct': 0.11216524741835332, 'bull_tp_mult': 1.6952372581564938, 'bull_tsl_mult': 0.1317144503071612, 'bull_time_stop': 167, 'bull_use_sma': False, 'bull_use_ema': False, 'bull_use_atr': False, 'bull_use_adx': True, 'bull_use_spike': True, 'bull_rsi_required': False, 'bear_strategy': 'breakout', 'bear_bb_std_mult': 0.8130527424684921, 'bear_rsi_os': 20, 'bear_rsi_ob': 47, 'bear_adx_thresh': 22.579764588374147, 'bear_atr_min_pct': 0.005899782629180511, 'bear_atr_max_pct': 0.021242745951562454, 'bear_tp_mult': 2.005745902282951, 'bear_tsl_mult': 0.11847128314535094, 'bear_time_stop': 78, 'bear_use_sma': False, 'bear_use_ema': False, 'bear_use_atr': False, 'bear_use_adx': False, 'bear_use_spike': True, 'bear_rsi_required': True, 'sideways_strategy': 'breakout', 'sideways_bb_std_mult': 1.6316755594113541, 'sideways_rsi_os': 34, 'sideways_rsi_ob': 63, 'sideways_adx_thresh': 9.755020981939154, 'sideways_atr_min_pct': 0.026142092151763496, 'sideways_atr_max_pct': 0.023742472919404522, 'sideways_tp_mult': 1.6616576150812528, 'sideways_tsl_mult': 0.41113282843265403, 'sideways_time_stop': 119, 'sideways_use_sma': True, 'sideways_use_ema': True, 'sideways_use_atr': True, 'sideways_use_adx': True, 'sideways_use_spike': True, 'sideways_rsi_required': True}.
[I 2025-09-01 03:19:22,023] Trial 345 finished with values: [-1000000000.0, 1000000000.0] and parameters: {'p_sma': 42, 'p_std': 56, 'p_atr': 27, 'p_adx': 17, 'rsi_period': 31, 'ema1': 21, 'ema2': 59, 'slip_atr_k': 0.024528101158932378, 'slip_spread_k': 0.17513084314166094, 'spread_hl_frac': 0.038870245308531635, 'bb_std_mult': 1.3857518247925555, 'rsi_os': 17, 'rsi_ob': 87, 'vol_spike': 0.21902315644041936, 'adx_thresh': 18.27577735733038, 'atr_min_pct': 0.007254105128594988, 'atr_max_pct': 0.057272362823341624, 'tp_mult': 2.579845943434194, 'tsl_mult': 0.41644966146983087, 'strategy': 'mean_reversion', 'time_stop': 105, 'use_sma': False, 'use_atr': False, 'use_adx': True, 'use_ema': False, 'use_spike': True, 'rsi_required': False, 'edge_k': 0.23783494069705713, 'edge_cap': 0.45276171158414624, 'bull_strategy': 'breakout', 'bull_bb_std_mult': 1.4170104630325535, 'bull_rsi_os': 8, 'bull_rsi_ob': 52, 'bull_adx_thresh': 23.340086227984425, 'bull_atr_min_pct': 0.016362409116192456, 'bull_atr_max_pct': 0.03686599716341611, 'bull_tp_mult': 1.69478170660083, 'bull_tsl_mult': 0.05368975099438256, 'bull_time_stop': 266, 'bull_use_sma': False, 'bull_use_ema': False, 'bull_use_atr': False, 'bull_use_adx': True, 'bull_use_spike': True, 'bull_rsi_required': False, 'bear_strategy': 'breakout', 'bear_bb_std_mult': 2.20344947409574, 'bear_rsi_os': 54, 'bear_rsi_ob': 58, 'bear_adx_thresh': 15.205236232986701, 'bear_atr_min_pct': 0.005880174607668997, 'bear_atr_max_pct': 0.06147019076627655, 'bear_tp_mult': 1.048300270503819, 'bear_tsl_mult': 0.19960723398995928, 'bear_time_stop': 30, 'bear_use_sma': False, 'bear_use_ema': False, 'bear_use_atr': False, 'bear_use_adx': False, 'bear_use_spike': True, 'bear_rsi_required': True, 'sideways_strategy': 'breakout', 'sideways_bb_std_mult': 1.678818029536112, 'sideways_rsi_os': 43, 'sideways_rsi_ob': 76, 'sideways_adx_thresh': 17.763562202926778, 'sideways_atr_min_pct': 0.026201422553236556, 'sideways_atr_max_pct': 0.0737325913625233, 'sideways_tp_mult': 1.6491010513014601, 'sideways_tsl_mult': 0.1758146495516235, 'sideways_time_stop': 119, 'sideways_use_sma': True, 'sideways_use_ema': True, 'sideways_use_atr': True, 'sideways_use_adx': True, 'sideways_use_spike': True, 'sideways_rsi_required': True}.
[I 2025-09-01 03:20:04,945] Trial 347 finished with values: [-1000000000.0, 1000000000.0] and parameters: {'p_sma': 44, 'p_std': 54, 'p_atr': 16, 'p_adx': 27, 'rsi_period': 9, 'ema1': 29, 'ema2': 55, 'slip_atr_k': 0.20365268929499603, 'slip_spread_k': 0.18440852887082593, 'spread_hl_frac': 0.04085526407997117, 'bb_std_mult': 1.5524662015387034, 'rsi_os': 26, 'rsi_ob': 88, 'vol_spike': 0.2194793832128802, 'adx_thresh': 11.648532121958922, 'atr_min_pct': 0.00727742371289565, 'atr_max_pct': 0.05129218044018333, 'tp_mult': 2.7198704093708312, 'tsl_mult': 0.43576609609438155, 'strategy': 'mean_reversion', 'time_stop': 167, 'use_sma': False, 'use_atr': False, 'use_adx': True, 'use_ema': False, 'use_spike': True, 'rsi_required': False, 'edge_k': 0.06293371007059084, 'edge_cap': 0.5407085644625429, 'bull_strategy': 'breakout', 'bull_bb_std_mult': 1.3495558389963025, 'bull_rsi_os': 14, 'bull_rsi_ob': 70, 'bull_adx_thresh': 19.202582251534515, 'bull_atr_min_pct': 0.010644577463200584, 'bull_atr_max_pct': 0.11913371038291588, 'bull_tp_mult': 1.7048787931928184, 'bull_tsl_mult': 0.24735505620639048, 'bull_time_stop': 288, 'bull_use_sma': True, 'bull_use_ema': False, 'bull_use_atr': False, 'bull_use_adx': False, 'bull_use_spike': True, 'bull_rsi_required': False, 'bear_strategy': 'breakout', 'bear_bb_std_mult': 0.7827856097228301, 'bear_rsi_os': 20, 'bear_rsi_ob': 61, 'bear_adx_thresh': 25.19382236149692, 'bear_atr_min_pct': 0.028859890264940746, 'bear_atr_max_pct': 0.01566194088002444, 'bear_tp_mult': 1.0546604201776184, 'bear_tsl_mult': 0.5070531348441689, 'bear_time_stop': 68, 'bear_use_sma': False, 'bear_use_ema': False, 'bear_use_atr': False, 'bear_use_adx': False, 'bear_use_spike': True, 'bear_rsi_required': True, 'sideways_strategy': 'mean_reversion', 'sideways_bb_std_mult': 1.678656453372262, 'sideways_rsi_os': 30, 'sideways_rsi_ob': 78, 'sideways_adx_thresh': 20.88502948359936, 'sideways_atr_min_pct': 0.025162579355577298, 'sideways_atr_max_pct': 0.06967626894745992, 'sideways_tp_mult': 1.7096939924074201, 'sideways_tsl_mult': 0.19851227694101303, 'sideways_time_stop': 133, 'sideways_use_sma': True, 'sideways_use_ema': True, 'sideways_use_atr': True, 'sideways_use_adx': False, 'sideways_use_spike': True, 'sideways_rsi_required': True}.
[I 2025-09-01 03:20:05,988] Trial 350 finished with values: [-1000000000.0, 1000000000.0] and parameters: {'p_sma': 39, 'p_std': 24, 'p_atr': 9, 'p_adx': 18, 'rsi_period': 23, 'ema1': 22, 'ema2': 34, 'slip_atr_k': 0.18760231377563008, 'slip_spread_k': 0.13038091706757265, 'spread_hl_frac': 0.040989742122390246, 'bb_std_mult': 1.5441952235061225, 'rsi_os': 10, 'rsi_ob': 83, 'vol_spike': 0.20226028424528003, 'adx_thresh': 10.769832509866543, 'atr_min_pct': 0.0069462146515127665, 'atr_max_pct': 0.05155602293621278, 'tp_mult': 2.7058058722989085, 'tsl_mult': 0.29428375096553805, 'strategy': 'mean_reversion', 'time_stop': 84, 'use_sma': False, 'use_atr': False, 'use_adx': True, 'use_ema': False, 'use_spike': True, 'rsi_required': False, 'edge_k': 0.6908328617508757, 'edge_cap': 0.41269004136982057, 'bull_strategy': 'breakout', 'bull_bb_std_mult': 1.208372409397708, 'bull_rsi_os': 46, 'bull_rsi_ob': 56, 'bull_adx_thresh': 22.212552375766162, 'bull_atr_min_pct': 0.010643656465521472, 'bull_atr_max_pct': 0.11974737264340919, 'bull_tp_mult': 2.2761045904321637, 'bull_tsl_mult': 0.15008865345574338, 'bull_time_stop': 287, 'bull_use_sma': True, 'bull_use_ema': False, 'bull_use_atr': False, 'bull_use_adx': False, 'bull_use_spike': True, 'bull_rsi_required': False, 'bear_strategy': 'breakout', 'bear_bb_std_mult': 1.9440117325428103, 'bear_rsi_os': 11, 'bear_rsi_ob': 61, 'bear_adx_thresh': 25.140446197083463, 'bear_atr_min_pct': 0.02747000674656609, 'bear_atr_max_pct': 0.015046363694586196, 'bear_tp_mult': 1.0634232447750864, 'bear_tsl_mult': 0.8413034739677901, 'bear_time_stop': 122, 'bear_use_sma': False, 'bear_use_ema': False, 'bear_use_atr': False, 'bear_use_adx': False, 'bear_use_spike': True, 'bear_rsi_required': True, 'sideways_strategy': 'mean_reversion', 'sideways_bb_std_mult': 1.8908388426580025, 'sideways_rsi_os': 26, 'sideways_rsi_ob': 78, 'sideways_adx_thresh': 23.312278081946815, 'sideways_atr_min_pct': 0.017715566859259377, 'sideways_atr_max_pct': 0.01370034412882929, 'sideways_tp_mult': 1.730362395607583, 'sideways_tsl_mult': 0.19067223029337607, 'sideways_time_stop': 128, 'sideways_use_sma': True, 'sideways_use_ema': True, 'sideways_use_atr': True, 'sideways_use_adx': False, 'sideways_use_spike': True, 'sideways_rsi_required': True}.
[I 2025-09-01 03:20:06,001] Trial 349 finished with values: [-1000000000.0, 1000000000.0] and parameters: {'p_sma': 44, 'p_std': 24, 'p_atr': 9, 'p_adx': 18, 'rsi_period': 10, 'ema1': 11, 'ema2': 58, 'slip_atr_k': 0.24254261435940183, 'slip_spread_k': 0.12637612732512588, 'spread_hl_frac': 0.021112875159499594, 'bb_std_mult': 1.5497527680564507, 'rsi_os': 20, 'rsi_ob': 83, 'vol_spike': 0.20237921513975407, 'adx_thresh': 10.75323360178193, 'atr_min_pct': 0.02360737352321955, 'atr_max_pct': 0.05096441497898103, 'tp_mult': 2.71035213097269, 'tsl_mult': 0.28392123354850485, 'strategy': 'mean_reversion', 'time_stop': 237, 'use_sma': False, 'use_atr': False, 'use_adx': True, 'use_ema': False, 'use_spike': True, 'rsi_required': False, 'edge_k': 0.0844294361569794, 'edge_cap': 0.5459084552129994, 'bull_strategy': 'breakout', 'bull_bb_std_mult': 1.2216304264511944, 'bull_rsi_os': 19, 'bull_rsi_ob': 56, 'bull_adx_thresh': 33.13561032600677, 'bull_atr_min_pct': 0.024358455591348666, 'bull_atr_max_pct': 0.11906038186429094, 'bull_tp_mult': 1.5615881951920236, 'bull_tsl_mult': 0.8943474196563306, 'bull_time_stop': 286, 'bull_use_sma': True, 'bull_use_ema': False, 'bull_use_atr': False, 'bull_use_adx': False, 'bull_use_spike': True, 'bull_rsi_required': False, 'bear_strategy': 'breakout', 'bear_bb_std_mult': 1.988420035962419, 'bear_rsi_os': 49, 'bear_rsi_ob': 87, 'bear_adx_thresh': 12.232545424236875, 'bear_atr_min_pct': 0.028675518985327164, 'bear_atr_max_pct': 0.09922237639631079, 'bear_tp_mult': 1.9446258313152989, 'bear_tsl_mult': 0.7068783579140108, 'bear_time_stop': 117, 'bear_use_sma': False, 'bear_use_ema': False, 'bear_use_atr': False, 'bear_use_adx': False, 'bear_use_spike': True, 'bear_rsi_required': True, 'sideways_strategy': 'mean_reversion', 'sideways_bb_std_mult': 2.7266374284788744, 'sideways_rsi_os': 26, 'sideways_rsi_ob': 78, 'sideways_adx_thresh': 12.040794602004171, 'sideways_atr_min_pct': 0.02522102939041883, 'sideways_atr_max_pct': 0.06991359522190299, 'sideways_tp_mult': 1.7341169890942132, 'sideways_tsl_mult': 0.19630130533835813, 'sideways_time_stop': 128, 'sideways_use_sma': True, 'sideways_use_ema': True, 'sideways_use_atr': True, 'sideways_use_adx': False, 'sideways_use_spike': True, 'sideways_rsi_required': True}.
[I 2025-09-01 03:20:06,369] Trial 348 finished with values: [-1000000000.0, 1000000000.0] and parameters: {'p_sma': 42, 'p_std': 24, 'p_atr': 28, 'p_adx': 21, 'rsi_period': 9, 'ema1': 11, 'ema2': 58, 'slip_atr_k': 0.05071083679566801, 'slip_spread_k': 0.186381250354331, 'spread_hl_frac': 0.03923627952315595, 'bb_std_mult': 1.7681585970758964, 'rsi_os': 20, 'rsi_ob': 89, 'vol_spike': 0.21848611566067833, 'adx_thresh': 11.49223583110262, 'atr_min_pct': 0.011672189195109562, 'atr_max_pct': 0.05124373292157283, 'tp_mult': 1.4490362671603405, 'tsl_mult': 0.2905990439096261, 'strategy': 'mean_reversion', 'time_stop': 168, 'use_sma': False, 'use_atr': False, 'use_adx': True, 'use_ema': False, 'use_spike': True, 'rsi_required': False, 'edge_k': 0.06307233934212826, 'edge_cap': 0.5450963346165314, 'bull_strategy': 'breakout', 'bull_bb_std_mult': 1.338998154587879, 'bull_rsi_os': 14, 'bull_rsi_ob': 92, 'bull_adx_thresh': 17.81077336879921, 'bull_atr_min_pct': 0.0027138144739404877, 'bull_atr_max_pct': 0.11949549605111269, 'bull_tp_mult': 1.6808722875906748, 'bull_tsl_mult': 0.05191669170503388, 'bull_time_stop': 197, 'bull_use_sma': True, 'bull_use_ema': False, 'bull_use_atr': False, 'bull_use_adx': False, 'bull_use_spike': True, 'bull_rsi_required': False, 'bear_strategy': 'breakout', 'bear_bb_std_mult': 0.7898420223471929, 'bear_rsi_os': 49, 'bear_rsi_ob': 61, 'bear_adx_thresh': 25.255501521732874, 'bear_atr_min_pct': 0.028558716177731907, 'bear_atr_max_pct': 0.05932237030669364, 'bear_tp_mult': 1.3702372945421453, 'bear_tsl_mult': 0.8377509979451264, 'bear_time_stop': 50, 'bear_use_sma': False, 'bear_use_ema': False, 'bear_use_atr': False, 'bear_use_adx': False, 'bear_use_spike': True, 'bear_rsi_required': True, 'sideways_strategy': 'mean_reversion', 'sideways_bb_std_mult': 1.6552368412274037, 'sideways_rsi_os': 42, 'sideways_rsi_ob': 61, 'sideways_adx_thresh': 17.31211003005953, 'sideways_atr_min_pct': 0.025211324714302805, 'sideways_atr_max_pct': 0.04772281383102055, 'sideways_tp_mult': 1.708715405788375, 'sideways_tsl_mult': 0.19863289310261337, 'sideways_time_stop': 130, 'sideways_use_sma': True, 'sideways_use_ema': True, 'sideways_use_atr': True, 'sideways_use_adx': False, 'sideways_use_spike': True, 'sideways_rsi_required': True}.
