[I 2025-09-01 03:39:26,188] Trial 459 finished with values: [-1000000000.0, 1000000000.0] and parameters: {'p_sma': 48, 'p_std': 36, 'p_atr': 9, 'p_adx': 18, 'rsi_period': 14, 'ema1': 20, 'ema2': 56, 'slip_atr_k': 0.01859347724452997, 'slip_spread_k': 0.35327356431701784, 'spread_hl_frac': 0.02807783907771693, 'bb_std_mult': 1.44712582206455, 'rsi_os': 9, 'rsi_ob': 86, 'vol_spike': 0.1280474236476176, 'adx_thresh': 11.350029991397621, 'atr_min_pct': 0.007259725481009955, 'atr_max_pct': 0.13225329855100273, 'tp_mult': 1.3039825714823323, 'tsl_mult': 0.4195261885907988, 'strategy': 'mean_reversion', 'time_stop': 99, 'use_sma': False, 'use_atr': False, 'use_adx': True, 'use_ema': False, 'use_spike': True, 'rsi_required': False, 'edge_k': 0.0747425075522581, 'edge_cap': 0.49946553527896864, 'bull_strategy': 'breakout', 'bull_bb_std_mult': 1.0573130057936588, 'bull_rsi_os': 48, 'bull_rsi_ob': 86, 'bull_adx_thresh': 22.312175513503266, 'bull_atr_min_pct': 0.0057572711242290485, 'bull_atr_max_pct': 0.11813771826180965, 'bull_tp_mult': 1.5767412427124763, 'bull_tsl_mult': 0.04209374339172539, 'bull_time_stop': 74, 'bull_use_sma': True, 'bull_use_ema': True, 'bull_use_atr': False, 'bull_use_adx': False, 'bull_use_spike': True, 'bull_rsi_required': False, 'bear_strategy': 'mean_reversion', 'bear_bb_std_mult': 2.549676979784257, 'bear_rsi_os': 53, 'bear_rsi_ob': 60, 'bear_adx_thresh': 34.987959116979, 'bear_atr_min_pct': 0.027635723848042245, 'bear_atr_max_pct': 0.08749300643808619, 'bear_tp_mult': 1.0778122633751248, 'bear_tsl_mult': 0.13644417915046494, 'bear_time_stop': 67, 'bear_use_sma': True, 'bear_use_ema': False, 'bear_use_atr': False, 'bear_use_adx': False, 'bear_use_spike': True, 'bear_rsi_required': True, 'sideways_strategy': 'breakout', 'sideways_bb_std_mult': 1.9030646157436364, 'sideways_rsi_os': 47, 'sideways_rsi_ob': 76, 'sideways_adx_thresh': 11.694683248792408, 'sideways_atr_min_pct': 0.02884436624283778, 'sideways_atr_max_pct': 0.14684378155300803, 'sideways_tp_mult': 1.014144659613451, 'sideways_tsl_mult': 0.8625383668413643, 'sideways_time_stop': 122, 'sideways_use_sma': True, 'sideways_use_ema': True, 'sideways_use_atr': True, 'sideways_use_adx': False, 'sideways_use_spike': True, 'sideways_rsi_required': True}.
[I 2025-09-01 03:39:26,539] Trial 457 finished with values: [-0.025099614636861278, 0.024914015723522785] and parameters: {'p_sma': 10, 'p_std': 17, 'p_atr': 13, 'p_adx': 25, 'rsi_period': 13, 'ema1': 20, 'ema2': 38, 'slip_atr_k': 0.15149788367612005, 'slip_spread_k': 0.17661171313579926, 'spread_hl_frac': 0.027848096880783702, 'bb_std_mult': 3.0072956205768415, 'rsi_os': 21, 'rsi_ob': 85, 'vol_spike': 0.21836404472466814, 'adx_thresh': 11.27266758156959, 'atr_min_pct': 0.01559804213852379, 'atr_max_pct': 0.04788318182783353, 'tp_mult': 2.7035651106508762, 'tsl_mult': 0.17585697176532794, 'strategy': 'mean_reversion', 'time_stop': 119, 'use_sma': False, 'use_atr': False, 'use_adx': True, 'use_ema': False, 'use_spike': True, 'rsi_required': False, 'edge_k': 0.0020360539058501548, 'edge_cap': 0.4231302211011864, 'bull_strategy': 'breakout', 'bull_bb_std_mult': 1.1577619355085202, 'bull_rsi_os': 49, 'bull_rsi_ob': 51, 'bull_adx_thresh': 24.20392469233392, 'bull_atr_min_pct': 0.0010313701514810957, 'bull_atr_max_pct': 0.05671218987247145, 'bull_tp_mult': 1.7037095230044361, 'bull_tsl_mult': 0.7491300405375264, 'bull_time_stop': 113, 'bull_use_sma': True, 'bull_use_ema': False, 'bull_use_atr': False, 'bull_use_adx': True, 'bull_use_spike': True, 'bull_rsi_required': False, 'bear_strategy': 'breakout', 'bear_bb_std_mult': 3.5945249314777543, 'bear_rsi_os': 53, 'bear_rsi_ob': 51, 'bear_adx_thresh': 24.907399151033424, 'bear_atr_min_pct': 0.02767117723300121, 'bear_atr_max_pct': 0.026358251789242674, 'bear_tp_mult': 1.0802905225242907, 'bear_tsl_mult': 0.12862606384137304, 'bear_time_stop': 260, 'bear_use_sma': True, 'bear_use_ema': True, 'bear_use_atr': False, 'bear_use_adx': False, 'bear_use_spike': False, 'bear_rsi_required': False, 'sideways_strategy': 'breakout', 'sideways_bb_std_mult': 1.901766547609806, 'sideways_rsi_os': 48, 'sideways_rsi_ob': 76, 'sideways_adx_thresh': 27.29765703736383, 'sideways_atr_min_pct': 0.02879191215882135, 'sideways_atr_max_pct': 0.146333253359667, 'sideways_tp_mult': 1.558597233173777, 'sideways_tsl_mult': 0.867747937360395, 'sideways_time_stop': 133, 'sideways_use_sma': True, 'sideways_use_ema': True, 'sideways_use_atr': True, 'sideways_use_adx': True, 'sideways_use_spike': True, 'sideways_rsi_required': True}.
[I 2025-09-01 03:40:02,467] Trial 463 finished with values: [-1000000000.0, 1000000000.0] and parameters: {'p_sma': 16, 'p_std': 60, 'p_atr': 29, 'p_adx': 16, 'rsi_period': 84, 'ema1': 22, 'ema2': 57, 'slip_atr_k': 0.07025248879786214, 'slip_spread_k': 0.1439256108269743, 'spread_hl_frac': 0.026960519335873852, 'bb_std_mult': 1.5664767561554627, 'rsi_os': 22, 'rsi_ob': 83, 'vol_spike': 0.2174676864648212, 'adx_thresh': 10.536202412063146, 'atr_min_pct': 0.012287627511244964, 'atr_max_pct': 0.045318660358381266, 'tp_mult': 1.7855611622366128, 'tsl_mult': 0.3794232116641552, 'strategy': 'breakout', 'time_stop': 34, 'use_sma': False, 'use_atr': True, 'use_adx': False, 'use_ema': True, 'use_spike': False, 'rsi_required': True, 'edge_k': 0.11839911486698307, 'edge_cap': 0.8737121078032497, 'bull_strategy': 'mean_reversion', 'bull_bb_std_mult': 3.4744930408222716, 'bull_rsi_os': 18, 'bull_rsi_ob': 55, 'bull_adx_thresh': 21.925430009484757, 'bull_atr_min_pct': 0.0032453496475371366, 'bull_atr_max_pct': 0.11098306476465335, 'bull_tp_mult': 1.3496157429099394, 'bull_tsl_mult': 0.37434878959607043, 'bull_time_stop': 286, 'bull_use_sma': True, 'bull_use_ema': False, 'bull_use_atr': True, 'bull_use_adx': False, 'bull_use_spike': True, 'bull_rsi_required': True, 'bear_strategy': 'breakout', 'bear_bb_std_mult': 2.891715536642036, 'bear_rsi_os': 47, 'bear_rsi_ob': 59, 'bear_adx_thresh': 7.9658338433503495, 'bear_atr_min_pct': 0.008071503852497037, 'bear_atr_max_pct': 0.11986759317845046, 'bear_tp_mult': 2.715338496232668, 'bear_tsl_mult': 0.07453590147186817, 'bear_time_stop': 56, 'bear_use_sma': False, 'bear_use_ema': False, 'bear_use_atr': True, 'bear_use_adx': True, 'bear_use_spike': True, 'bear_rsi_required': True, 'sideways_strategy': 'breakout', 'sideways_bb_std_mult': 1.9744265128528369, 'sideways_rsi_os': 49, 'sideways_rsi_ob': 74, 'sideways_adx_thresh': 28.305108893516973, 'sideways_atr_min_pct': 0.027130085279336056, 'sideways_atr_max_pct': 0.11830710008636225, 'sideways_tp_mult': 1.6854986596006527, 'sideways_tsl_mult': 0.39066310056474135, 'sideways_time_stop': 20, 'sideways_use_sma': False, 'sideways_use_ema': False, 'sideways_use_atr': True, 'sideways_use_adx': False, 'sideways_use_spike': False, 'sideways_rsi_required': False}.
[I 2025-09-01 03:40:02,766] Trial 464 finished with values: [-1000000000.0, 1000000000.0] and parameters: {'p_sma': 23, 'p_std': 60, 'p_atr': 29, 'p_adx': 16, 'rsi_period': 37, 'ema1': 27, 'ema2': 58, 'slip_atr_k': 0.07018244096899598, 'slip_spread_k': 0.1403643314037139, 'spread_hl_frac': 0.026371498695222706, 'bb_std_mult': 1.2673112220154636, 'rsi_os': 20, 'rsi_ob': 83, 'vol_spike': 0.20929925259450016, 'adx_thresh': 10.746684211643517, 'atr_min_pct': 0.0017543432571067476, 'atr_max_pct': 0.053445547222220266, 'tp_mult': 2.5719404185550747, 'tsl_mult': 0.3381363606089255, 'strategy': 'breakout', 'time_stop': 176, 'use_sma': False, 'use_atr': True, 'use_adx': False, 'use_ema': True, 'use_spike': False, 'rsi_required': True, 'edge_k': 1.1421292702710364, 'edge_cap': 0.45158439324856764, 'bull_strategy': 'mean_reversion', 'bull_bb_std_mult': 1.2361200291120034, 'bull_rsi_os': 18, 'bull_rsi_ob': 55, 'bull_adx_thresh': 12.555321390494893, 'bull_atr_min_pct': 0.003123095708434542, 'bull_atr_max_pct': 0.098587752971046, 'bull_tp_mult': 2.480456560469312, 'bull_tsl_mult': 0.33604918801511063, 'bull_time_stop': 284, 'bull_use_sma': True, 'bull_use_ema': False, 'bull_use_atr': True, 'bull_use_adx': False, 'bull_use_spike': False, 'bull_rsi_required': True, 'bear_strategy': 'breakout', 'bear_bb_std_mult': 1.8061645214542956, 'bear_rsi_os': 43, 'bear_rsi_ob': 71, 'bear_adx_thresh': 22.78415256215024, 'bear_atr_min_pct': 0.01853179252019466, 'bear_atr_max_pct': 0.020834753580394934, 'bear_tp_mult': 2.9892520056338205, 'bear_tsl_mult': 0.07820614226762401, 'bear_time_stop': 57, 'bear_use_sma': False, 'bear_use_ema': False, 'bear_use_atr': True, 'bear_use_adx': True, 'bear_use_spike': True, 'bear_rsi_required': True, 'sideways_strategy': 'breakout', 'sideways_bb_std_mult': 2.0035050317069403, 'sideways_rsi_os': 27, 'sideways_rsi_ob': 74, 'sideways_adx_thresh': 28.13497871232431, 'sideways_atr_min_pct': 0.021146135677416043, 'sideways_atr_max_pct': 0.11865842352471892, 'sideways_tp_mult': 1.6817276214746393, 'sideways_tsl_mult': 0.492964464663565, 'sideways_time_stop': 130, 'sideways_use_sma': False, 'sideways_use_ema': False, 'sideways_use_atr': True, 'sideways_use_adx': False, 'sideways_use_spike': False, 'sideways_rsi_required': False}.
[I 2025-09-01 03:40:03,287] Trial 462 finished with values: [-1000000000.0, 1000000000.0] and parameters: {'p_sma': 16, 'p_std': 17, 'p_atr': 28, 'p_adx': 18, 'rsi_period': 74, 'ema1': 22, 'ema2': 38, 'slip_atr_k': 0.1508989558943153, 'slip_spread_k': 0.3505633192540348, 'spread_hl_frac': 0.027271684644257724, 'bb_std_mult': 1.4573357032935497, 'rsi_os': 21, 'rsi_ob': 83, 'vol_spike': 0.21854494710195554, 'adx_thresh': 10.479355965000224, 'atr_min_pct': 0.007822191188358451, 'atr_max_pct': 0.13187196040795612, 'tp_mult': 2.5747873568690895, 'tsl_mult': 0.3789105504178651, 'strategy': 'mean_reversion', 'time_stop': 177, 'use_sma': False, 'use_atr': False, 'use_adx': True, 'use_ema': True, 'use_spike': True, 'rsi_required': False, 'edge_k': 0.08739463444656373, 'edge_cap': 0.4618363339885335, 'bull_strategy': 'breakout', 'bull_bb_std_mult': 1.0577564458410156, 'bull_rsi_os': 18, 'bull_rsi_ob': 93, 'bull_adx_thresh': 21.96335881081488, 'bull_atr_min_pct': 0.0034820614279416065, 'bull_atr_max_pct': 0.09873168910800235, 'bull_tp_mult': 1.711612522061458, 'bull_tsl_mult': 0.6936616399441373, 'bull_time_stop': 283, 'bull_use_sma': True, 'bull_use_ema': False, 'bull_use_atr': False, 'bull_use_adx': False, 'bull_use_spike': True, 'bull_rsi_required': True, 'bear_strategy': 'breakout', 'bear_bb_std_mult': 2.8582660085932905, 'bear_rsi_os': 52, 'bear_rsi_ob': 59, 'bear_adx_thresh': 17.491851892917133, 'bear_atr_min_pct': 0.02832971862211116, 'bear_atr_max_pct': 0.0877015282845691, 'bear_tp_mult': 1.2067088056112099, 'bear_tsl_mult': 0.3155366890887966, 'bear_time_stop': 56, 'bear_use_sma': False, 'bear_use_ema': False, 'bear_use_atr': False, 'bear_use_adx': False, 'bear_use_spike': True, 'bear_rsi_required': True, 'sideways_strategy': 'breakout', 'sideways_bb_std_mult': 1.159951875603723, 'sideways_rsi_os': 27, 'sideways_rsi_ob': 79, 'sideways_adx_thresh': 28.206498540233497, 'sideways_atr_min_pct': 0.005187508466696224, 'sideways_atr_max_pct': 0.014885090465168447, 'sideways_tp_mult': 1.703758632094347, 'sideways_tsl_mult': 0.9360741406582938, 'sideways_time_stop': 132, 'sideways_use_sma': False, 'sideways_use_ema': True, 'sideways_use_atr': True, 'sideways_use_adx': False, 'sideways_use_spike': True, 'sideways_rsi_required': False}.
[I 2025-09-01 03:40:03,666] Trial 461 finished with values: [-1000000000.0, 1000000000.0] and parameters: {'p_sma': 13, 'p_std': 60, 'p_atr': 28, 'p_adx': 18, 'rsi_period': 14, 'ema1': 23, 'ema2': 17, 'slip_atr_k': 0.07251126184663069, 'slip_spread_k': 0.361063856314704, 'spread_hl_frac': 0.027963292148401687, 'bb_std_mult': 1.451634461304471, 'rsi_os': 10, 'rsi_ob': 85, 'vol_spike': 0.2197157408224507, 'adx_thresh': 10.651550987132788, 'atr_min_pct': 0.00796425926882575, 'atr_max_pct': 0.09735242845931157, 'tp_mult': 2.2387453725644764, 'tsl_mult': 0.6165244470147666, 'strategy': 'mean_reversion', 'time_stop': 174, 'use_sma': False, 'use_atr': False, 'use_adx': True, 'use_ema': False, 'use_spike': True, 'rsi_required': False, 'edge_k': 0.07280312610192673, 'edge_cap': 0.4626715607582454, 'bull_strategy': 'breakout', 'bull_bb_std_mult': 3.478945467868492, 'bull_rsi_os': 11, 'bull_rsi_ob': 55, 'bull_adx_thresh': 22.085806857653715, 'bull_atr_min_pct': 0.01825328857767671, 'bull_atr_max_pct': 0.09882867691341896, 'bull_tp_mult': 1.6003445004294945, 'bull_tsl_mult': 0.6988178700834575, 'bull_time_stop': 284, 'bull_use_sma': True, 'bull_use_ema': False, 'bull_use_atr': False, 'bull_use_adx': False, 'bull_use_spike': True, 'bull_rsi_required': False, 'bear_strategy': 'breakout', 'bear_bb_std_mult': 0.6024551913783616, 'bear_rsi_os': 52, 'bear_rsi_ob': 71, 'bear_adx_thresh': 32.454204723273, 'bear_atr_min_pct': 0.016473622197970533, 'bear_atr_max_pct': 0.020778372816473205, 'bear_tp_mult': 1.0983139781467053, 'bear_tsl_mult': 0.14204374410603066, 'bear_time_stop': 67, 'bear_use_sma': True, 'bear_use_ema': False, 'bear_use_atr': False, 'bear_use_adx': False, 'bear_use_spike': True, 'bear_rsi_required': True, 'sideways_strategy': 'breakout', 'sideways_bb_std_mult': 2.02165603727091, 'sideways_rsi_os': 47, 'sideways_rsi_ob': 74, 'sideways_adx_thresh': 27.23246222591055, 'sideways_atr_min_pct': 0.02882302776979262, 'sideways_atr_max_pct': 0.11824572620018602, 'sideways_tp_mult': 1.745055613157317, 'sideways_tsl_mult': 0.9289361465853695, 'sideways_time_stop': 130, 'sideways_use_sma': True, 'sideways_use_ema': True, 'sideways_use_atr': True, 'sideways_use_adx': False, 'sideways_use_spike': True, 'sideways_rsi_required': False}.
[I 2025-09-01 03:40:04,778] Trial 465 finished with values: [-1000000000.0, 1000000000.0] and parameters: {'p_sma': 23, 'p_std': 57, 'p_atr': 28, 'p_adx': 13, 'rsi_period': 79, 'ema1': 10, 'ema2': 37, 'slip_atr_k': 0.02242378623671707, 'slip_spread_k': 0.1325440776121535, 'spread_hl_frac': 0.029308804527773537, 'bb_std_mult': 1.2416590709485127, 'rsi_os': 37, 'rsi_ob': 45, 'vol_spike': 0.20904043738909575, 'adx_thresh': 12.671056864548376, 'atr_min_pct': 0.002365269610133362, 'atr_max_pct': 0.09771670183897342, 'tp_mult': 2.5755865543422307, 'tsl_mult': 0.3336013131785986, 'strategy': 'mean_reversion', 'time_stop': 176, 'use_sma': False, 'use_atr': False, 'use_adx': True, 'use_ema': False, 'use_spike': True, 'rsi_required': False, 'edge_k': 0.06699841864263213, 'edge_cap': 0.4553950198804145, 'bull_strategy': 'breakout', 'bull_bb_std_mult': 2.9666966213905424, 'bull_rsi_os': 33, 'bull_rsi_ob': 81, 'bull_adx_thresh': 22.57156564501645, 'bull_atr_min_pct': 0.025582739904009267, 'bull_atr_max_pct': 0.12814276777891195, 'bull_tp_mult': 1.5270636557080786, 'bull_tsl_mult': 0.3409195733386058, 'bull_time_stop': 27, 'bull_use_sma': True, 'bull_use_ema': False, 'bull_use_atr': False, 'bull_use_adx': False, 'bull_use_spike': False, 'bull_rsi_required': False, 'bear_strategy': 'breakout', 'bear_bb_std_mult': 1.0770214684289088, 'bear_rsi_os': 52, 'bear_rsi_ob': 71, 'bear_adx_thresh': 23.144570924126047, 'bear_atr_min_pct': 0.021855763528927777, 'bear_atr_max_pct': 0.021258734517034885, 'bear_tp_mult': 2.4091905418358235, 'bear_tsl_mult': 0.6102434868517588, 'bear_time_stop': 75, 'bear_use_sma': False, 'bear_use_ema': False, 'bear_use_atr': False, 'bear_use_adx': False, 'bear_use_spike': True, 'bear_rsi_required': True, 'sideways_strategy': 'breakout', 'sideways_bb_std_mult': 1.8421263494512223, 'sideways_rsi_os': 49, 'sideways_rsi_ob': 71, 'sideways_adx_thresh': 27.935517171826923, 'sideways_atr_min_pct': 0.0007414394791800515, 'sideways_atr_max_pct': 0.020108534835067696, 'sideways_tp_mult': 1.7123602073168231, 'sideways_tsl_mult': 0.999408530165744, 'sideways_time_stop': 170, 'sideways_use_sma': True, 'sideways_use_ema': True, 'sideways_use_atr': False, 'sideways_use_adx': False, 'sideways_use_spike': True, 'sideways_rsi_required': False}.
[I 2025-09-01 03:40:04,885] Trial 466 finished with values: [-1000000000.0, 1000000000.0] and parameters: {'p_sma': 13, 'p_std': 57, 'p_atr': 28, 'p_adx': 13, 'rsi_period': 9, 'ema1': 23, 'ema2': 54, 'slip_atr_k': 0.02211191724047351, 'slip_spread_k': 0.11175660243351387, 'spread_hl_frac': 0.029367135866556576, 'bb_std_mult': 1.4371259090508566, 'rsi_os': 10, 'rsi_ob': 46, 'vol_spike': 0.225288146280354, 'adx_thresh': 12.665977609787063, 'atr_min_pct': 0.007770707774437053, 'atr_max_pct': 0.025119047380507117, 'tp_mult': 2.668165435257019, 'tsl_mult': 0.3882768410597319, 'strategy': 'mean_reversion', 'time_stop': 170, 'use_sma': False, 'use_atr': False, 'use_adx': True, 'use_ema': False, 'use_spike': True, 'rsi_required': False, 'edge_k': 0.714733144847496, 'edge_cap': 0.26325606475140984, 'bull_strategy': 'breakout', 'bull_bb_std_mult': 0.8919990518734455, 'bull_rsi_os': 17, 'bull_rsi_ob': 52, 'bull_adx_thresh': 23.563828723214495, 'bull_atr_min_pct': 0.0015316929681325443, 'bull_atr_max_pct': 0.07082203776115023, 'bull_tp_mult': 2.2697205515527914, 'bull_tsl_mult': 0.23509072181662743, 'bull_time_stop': 290, 'bull_use_sma': True, 'bull_use_ema': False, 'bull_use_atr': False, 'bull_use_adx': False, 'bull_use_spike': True, 'bull_rsi_required': False, 'bear_strategy': 'breakout', 'bear_bb_std_mult': 1.0945595384162443, 'bear_rsi_os': 40, 'bear_rsi_ob': 57, 'bear_adx_thresh': 17.394099592093042, 'bear_atr_min_pct': 0.028470749893795784, 'bear_atr_max_pct': 0.1139439088782902, 'bear_tp_mult': 2.41859227015049, 'bear_tsl_mult': 0.5794417787946459, 'bear_time_stop': 78, 'bear_use_sma': False, 'bear_use_ema': False, 'bear_use_atr': False, 'bear_use_adx': False, 'bear_use_spike': True, 'bear_rsi_required': True, 'sideways_strategy': 'breakout', 'sideways_bb_std_mult': 2.4461531832817593, 'sideways_rsi_os': 9, 'sideways_rsi_ob': 79, 'sideways_adx_thresh': 29.279619852110006, 'sideways_atr_min_pct': 0.008072396972364766, 'sideways_atr_max_pct': 0.014851373578798246, 'sideways_tp_mult': 1.7492339236139347, 'sideways_tsl_mult': 0.4652675986142403, 'sideways_time_stop': 116, 'sideways_use_sma': True, 'sideways_use_ema': True, 'sideways_use_atr': False, 'sideways_use_adx': False, 'sideways_use_spike': True, 'sideways_rsi_required': True}.
[I 2025-09-01 03:40:43,390] Trial 467 finished with values: [-1000000000.0, 1000000000.0] and parameters: {'p_sma': 13, 'p_std': 28, 'p_atr': 28, 'p_adx': 21, 'rsi_period': 66, 'ema1': 21, 'ema2': 52, 'slip_atr_k': 0.12616626401147757, 'slip_spread_k': 0.11088026335366655, 'spread_hl_frac': 0.02920346327401901, 'bb_std_mult': 2.3652525722058906, 'rsi_os': 21, 'rsi_ob': 51, 'vol_spike': 0.22433043481456805, 'adx_thresh': 12.685110039602057, 'atr_min_pct': 0.02526294568365496, 'atr_max_pct': 0.12421061678961753, 'tp_mult': 2.6847333276237535, 'tsl_mult': 0.31795760940097234, 'strategy': 'mean_reversion', 'time_stop': 169, 'use_sma': False, 'use_atr': False, 'use_adx': True, 'use_ema': False, 'use_spike': True, 'rsi_required': False, 'edge_k': 1.7086776561623425, 'edge_cap': 0.32639512551065025, 'bull_strategy': 'breakout', 'bull_bb_std_mult': 1.219671964343182, 'bull_rsi_os': 5, 'bull_rsi_ob': 81, 'bull_adx_thresh': 23.415147880178143, 'bull_atr_min_pct': 0.028708728246071742, 'bull_atr_max_pct': 0.05107433366271796, 'bull_tp_mult': 1.527275105301873, 'bull_tsl_mult': 0.15094919460569023, 'bull_time_stop': 291, 'bull_use_sma': True, 'bull_use_ema': False, 'bull_use_atr': False, 'bull_use_adx': False, 'bull_use_spike': False, 'bull_rsi_required': False, 'bear_strategy': 'breakout', 'bear_bb_std_mult': 2.4578674755448557, 'bear_rsi_os': 52, 'bear_rsi_ob': 58, 'bear_adx_thresh': 25.62260521380069, 'bear_atr_min_pct': 0.00645724181163808, 'bear_atr_max_pct': 0.11455821869791646, 'bear_tp_mult': 1.010810703295315, 'bear_tsl_mult': 0.09986665811169024, 'bear_time_stop': 76, 'bear_use_sma': False, 'bear_use_ema': False, 'bear_use_atr': False, 'bear_use_adx': False, 'bear_use_spike': True, 'bear_rsi_required': True, 'sideways_strategy': 'breakout', 'sideways_bb_std_mult': 1.8495777133396745, 'sideways_rsi_os': 49, 'sideways_rsi_ob': 51, 'sideways_adx_thresh': 29.316409913974745, 'sideways_atr_min_pct': 0.008125622629034228, 'sideways_atr_max_pct': 0.020465155966608087, 'sideways_tp_mult': 1.7521361307016405, 'sideways_tsl_mult': 0.997377249802671, 'sideways_time_stop': 168, 'sideways_use_sma': True, 'sideways_use_ema': True, 'sideways_use_atr': False, 'sideways_use_adx': False, 'sideways_use_spike': True, 'sideways_rsi_required': True}.
