[I 2025-09-01 02:37:09,208] Trial 92 finished with values: [-1000000000.0, 1000000000.0] and parameters: {'p_sma': 26, 'p_std': 37, 'p_atr': 21, 'p_adx': 7, 'rsi_period': 75, 'ema1': 11, 'ema2': 59, 'slip_atr_k': 0.15788574668759267, 'slip_spread_k': 0.2331184667129675, 'spread_hl_frac': 0.014029428246694736, 'bb_std_mult': 1.356746889704377, 'rsi_os': 7, 'rsi_ob': 81, 'vol_spike': 0.15823748887143635, 'adx_thresh': 21.569814330838724, 'atr_min_pct': 0.009852028859990727, 'atr_max_pct': 0.0862827655137635, 'tp_mult': 2.1688411424093568, 'tsl_mult': 0.14630045324821378, 'strategy': 'mean_reversion', 'time_stop': 278, 'use_sma': True, 'use_atr': True, 'use_adx': True, 'use_ema': True, 'use_spike': False, 'rsi_required': True, 'edge_k': 0.19283653485228158, 'edge_cap': 0.1400111269922084, 'bull_strategy': 'mean_reversion', 'bull_bb_std_mult': 1.2362570778733788, 'bull_rsi_os': 17, 'bull_rsi_ob': 81, 'bull_adx_thresh': 6.715003914072545, 'bull_atr_min_pct': 0.025994669769734316, 'bull_atr_max_pct': 0.13421755779117267, 'bull_tp_mult': 1.743242772044898, 'bull_tsl_mult': 0.585597800625535, 'bull_time_stop': 238, 'bull_use_sma': False, 'bull_use_ema': True, 'bull_use_atr': True, 'bull_use_adx': False, 'bull_use_spike': True, 'bull_rsi_required': False, 'bear_strategy': 'mean_reversion', 'bear_bb_std_mult': 2.4049159029409983, 'bear_rsi_os': 8, 'bear_rsi_ob': 78, 'bear_adx_thresh': 29.051453665318736, 'bear_atr_min_pct': 0.029962455090808693, 'bear_atr_max_pct': 0.14184203300369966, 'bear_tp_mult': 2.5880993217471944, 'bear_tsl_mult': 0.5427184998628573, 'bear_time_stop': 158, 'bear_use_sma': True, 'bear_use_ema': False, 'bear_use_atr': True, 'bear_use_adx': False, 'bear_use_spike': True, 'bear_rsi_required': False, 'sideways_strategy': 'mean_reversion', 'sideways_bb_std_mult': 2.8234019125818945, 'sideways_rsi_os': 32, 'sideways_rsi_ob': 76, 'sideways_adx_thresh': 23.972831494807625, 'sideways_atr_min_pct': 0.007856904538920368, 'sideways_atr_max_pct': 0.1324558922175163, 'sideways_tp_mult': 1.3194013117952164, 'sideways_tsl_mult': 0.40259874253551386, 'sideways_time_stop': 20, 'sideways_use_sma': True, 'sideways_use_ema': False, 'sideways_use_atr': False, 'sideways_use_adx': False, 'sideways_use_spike': False, 'sideways_rsi_required': True}.
[I 2025-09-01 02:37:09,405] Trial 90 finished with values: [-1000000000.0, 1000000000.0] and parameters: {'p_sma': 26, 'p_std': 7, 'p_atr': 20, 'p_adx': 8, 'rsi_period': 75, 'ema1': 10, 'ema2': 59, 'slip_atr_k': 0.14872195597812216, 'slip_spread_k': 0.24370432330730024, 'spread_hl_frac': 0.0018307501135383635, 'bb_std_mult': 1.0208703804500334, 'rsi_os': 11, 'rsi_ob': 67, 'vol_spike': 0.1584796152740749, 'adx_thresh': 20.16059865632648, 'atr_min_pct': 0.028644834310693333, 'atr_max_pct': 0.12695608355756074, 'tp_mult': 2.159056670413653, 'tsl_mult': 0.15668537148210143, 'strategy': 'breakout', 'time_stop': 253, 'use_sma': False, 'use_atr': False, 'use_adx': True, 'use_ema': True, 'use_spike': False, 'rsi_required': True, 'edge_k': 1.45605124353063, 'edge_cap': 0.9540847183676111, 'bull_strategy': 'mean_reversion', 'bull_bb_std_mult': 2.646780509575661, 'bull_rsi_os': 12, 'bull_rsi_ob': 79, 'bull_adx_thresh': 27.48259343536713, 'bull_atr_min_pct': 0.02290630088248813, 'bull_atr_max_pct': 0.03168507857285149, 'bull_tp_mult': 1.7417954467657504, 'bull_tsl_mult': 0.15877207350663203, 'bull_time_stop': 88, 'bull_use_sma': False, 'bull_use_ema': True, 'bull_use_atr': True, 'bull_use_adx': False, 'bull_use_spike': True, 'bull_rsi_required': True, 'bear_strategy': 'breakout', 'bear_bb_std_mult': 2.5580823480761588, 'bear_rsi_os': 8, 'bear_rsi_ob': 79, 'bear_adx_thresh': 28.935564019832658, 'bear_atr_min_pct': 0.029330708371278828, 'bear_atr_max_pct': 0.1388870380206121, 'bear_tp_mult': 2.5651763060034396, 'bear_tsl_mult': 0.9074100626397498, 'bear_time_stop': 61, 'bear_use_sma': True, 'bear_use_ema': False, 'bear_use_atr': True, 'bear_use_adx': False, 'bear_use_spike': False, 'bear_rsi_required': True, 'sideways_strategy': 'breakout', 'sideways_bb_std_mult': 2.8268103507979463, 'sideways_rsi_os': 11, 'sideways_rsi_ob': 76, 'sideways_adx_thresh': 9.579609726047472, 'sideways_atr_min_pct': 0.006235156091678353, 'sideways_atr_max_pct': 0.13171636667430636, 'sideways_tp_mult': 1.3990394283786725, 'sideways_tsl_mult': 0.3110883505744406, 'sideways_time_stop': 289, 'sideways_use_sma': False, 'sideways_use_ema': False, 'sideways_use_atr': True, 'sideways_use_adx': True, 'sideways_use_spike': False, 'sideways_rsi_required': True}.
[I 2025-09-01 02:37:10,308] Trial 89 finished with values: [-1000000000.0, 1000000000.0] and parameters: {'p_sma': 25, 'p_std': 12, 'p_atr': 30, 'p_adx': 10, 'rsi_period': 60, 'ema1': 7, 'ema2': 23, 'slip_atr_k': 0.19670749662873954, 'slip_spread_k': 0.19685837788435107, 'spread_hl_frac': 0.04300562655798394, 'bb_std_mult': 1.024517069459608, 'rsi_os': 10, 'rsi_ob': 60, 'vol_spike': 0.1507223466581233, 'adx_thresh': 21.63103383456965, 'atr_min_pct': 0.015919023507859186, 'atr_max_pct': 0.01857975540197345, 'tp_mult': 2.165519158719009, 'tsl_mult': 0.14136108971721967, 'strategy': 'breakout', 'time_stop': 266, 'use_sma': True, 'use_atr': False, 'use_adx': False, 'use_ema': True, 'use_spike': True, 'rsi_required': False, 'edge_k': 0.6739846438566268, 'edge_cap': 0.19735137464498995, 'bull_strategy': 'mean_reversion', 'bull_bb_std_mult': 2.630429461948004, 'bull_rsi_os': 12, 'bull_rsi_ob': 74, 'bull_adx_thresh': 27.234620365216028, 'bull_atr_min_pct': 0.008650802406340474, 'bull_atr_max_pct': 0.13466785513022084, 'bull_tp_mult': 1.7290164147979925, 'bull_tsl_mult': 0.5836003129652806, 'bull_time_stop': 241, 'bull_use_sma': True, 'bull_use_ema': False, 'bull_use_atr': False, 'bull_use_adx': False, 'bull_use_spike': True, 'bull_rsi_required': True, 'bear_strategy': 'breakout', 'bear_bb_std_mult': 2.844671260618767, 'bear_rsi_os': 8, 'bear_rsi_ob': 93, 'bear_adx_thresh': 26.902675796597997, 'bear_atr_min_pct': 0.014552101126709367, 'bear_atr_max_pct': 0.09500000501010829, 'bear_tp_mult': 2.5858253991123163, 'bear_tsl_mult': 0.2690495228943457, 'bear_time_stop': 63, 'bear_use_sma': True, 'bear_use_ema': True, 'bear_use_atr': False, 'bear_use_adx': True, 'bear_use_spike': False, 'bear_rsi_required': False, 'sideways_strategy': 'breakout', 'sideways_bb_std_mult': 2.402971231156762, 'sideways_rsi_os': 9, 'sideways_rsi_ob': 76, 'sideways_adx_thresh': 29.137042372847134, 'sideways_atr_min_pct': 0.020452255344624044, 'sideways_atr_max_pct': 0.029117864976252246, 'sideways_tp_mult': 1.3827883344095135, 'sideways_tsl_mult': 0.7672369628181428, 'sideways_time_stop': 247, 'sideways_use_sma': False, 'sideways_use_ema': True, 'sideways_use_atr': True, 'sideways_use_adx': True, 'sideways_use_spike': True, 'sideways_rsi_required': True}.
[I 2025-09-01 02:37:59,459] Trial 93 finished with values: [-1000000000.0, 1000000000.0] and parameters: {'p_sma': 19, 'p_std': 38, 'p_atr': 15, 'p_adx': 29, 'rsi_period': 24, 'ema1': 10, 'ema2': 59, 'slip_atr_k': 0.1468004355507422, 'slip_spread_k': 0.23324673747854954, 'spread_hl_frac': 0.0016575173674999522, 'bb_std_mult': 1.3555406789750108, 'rsi_os': 7, 'rsi_ob': 59, 'vol_spike': 0.17748121607349393, 'adx_thresh': 34.838612233155615, 'atr_min_pct': 0.029074170192023255, 'atr_max_pct': 0.10298196274032076, 'tp_mult': 2.510399225661323, 'tsl_mult': 0.16948114776465828, 'strategy': 'breakout', 'time_stop': 79, 'use_sma': True, 'use_atr': False, 'use_adx': True, 'use_ema': False, 'use_spike': False, 'rsi_required': True, 'edge_k': 0.09017932499524228, 'edge_cap': 0.59713934988044, 'bull_strategy': 'breakout', 'bull_bb_std_mult': 2.7132627988719022, 'bull_rsi_os': 51, 'bull_rsi_ob': 67, 'bull_adx_thresh': 7.099153195538257, 'bull_atr_min_pct': 0.003872687377561461, 'bull_atr_max_pct': 0.13309417834127368, 'bull_tp_mult': 1.632180848430803, 'bull_tsl_mult': 0.36578139648117824, 'bull_time_stop': 237, 'bull_use_sma': False, 'bull_use_ema': True, 'bull_use_atr': True, 'bull_use_adx': False, 'bull_use_spike': True, 'bull_rsi_required': True, 'bear_strategy': 'breakout', 'bear_bb_std_mult': 0.7219567154915336, 'bear_rsi_os': 15, 'bear_rsi_ob': 78, 'bear_adx_thresh': 28.78899598458235, 'bear_atr_min_pct': 0.029341844918481144, 'bear_atr_max_pct': 0.13896437220869662, 'bear_tp_mult': 1.109167837629872, 'bear_tsl_mult': 0.9148700242438111, 'bear_time_stop': 104, 'bear_use_sma': True, 'bear_use_ema': False, 'bear_use_atr': True, 'bear_use_adx': False, 'bear_use_spike': True, 'bear_rsi_required': False, 'sideways_strategy': 'mean_reversion', 'sideways_bb_std_mult': 2.8045415356610266, 'sideways_rsi_os': 11, 'sideways_rsi_ob': 76, 'sideways_adx_thresh': 24.213163471407846, 'sideways_atr_min_pct': 0.013666698521647641, 'sideways_atr_max_pct': 0.13328777840043493, 'sideways_tp_mult': 2.3920902455788755, 'sideways_tsl_mult': 0.37504322077182767, 'sideways_time_stop': 78, 'sideways_use_sma': False, 'sideways_use_ema': False, 'sideways_use_atr': False, 'sideways_use_adx': False, 'sideways_use_spike': False, 'sideways_rsi_required': False}.
[I 2025-09-01 02:38:02,029] Trial 96 finished with values: [-1000000000.0, 1000000000.0] and parameters: {'p_sma': 19, 'p_std': 49, 'p_atr': 15, 'p_adx': 29, 'rsi_period': 34, 'ema1': 6, 'ema2': 34, 'slip_atr_k': 0.08661470295628448, 'slip_spread_k': 0.5460310547523994, 'spread_hl_frac': 0.009919550652655507, 'bb_std_mult': 1.4113514901992976, 'rsi_os': 6, 'rsi_ob': 65, 'vol_spike': 0.1742279434981771, 'adx_thresh': 7.003008367866011, 'atr_min_pct': 0.01519826851628521, 'atr_max_pct': 0.10263575561556948, 'tp_mult': 2.4787516549955537, 'tsl_mult': 0.6819363450445115, 'strategy': 'breakout', 'time_stop': 78, 'use_sma': False, 'use_atr': False, 'use_adx': False, 'use_ema': False, 'use_spike': True, 'rsi_required': False, 'edge_k': 0.09075332532942126, 'edge_cap': 0.11023072308324833, 'bull_strategy': 'breakout', 'bull_bb_std_mult': 0.8180632066986212, 'bull_rsi_os': 39, 'bull_rsi_ob': 67, 'bull_adx_thresh': 28.765457710014967, 'bull_atr_min_pct': 0.0005028476536997461, 'bull_atr_max_pct': 0.14459634304557822, 'bull_tp_mult': 1.6058166913038983, 'bull_tsl_mult': 0.6286084435690529, 'bull_time_stop': 47, 'bull_use_sma': False, 'bull_use_ema': False, 'bull_use_atr': False, 'bull_use_adx': False, 'bull_use_spike': True, 'bull_rsi_required': True, 'bear_strategy': 'breakout', 'bear_bb_std_mult': 2.2975855359465367, 'bear_rsi_os': 53, 'bear_rsi_ob': 88, 'bear_adx_thresh': 17.03112794350575, 'bear_atr_min_pct': 0.007503037667342557, 'bear_atr_max_pct': 0.054153548514165636, 'bear_tp_mult': 2.180425699474893, 'bear_tsl_mult': 0.09108488276397636, 'bear_time_stop': 181, 'bear_use_sma': False, 'bear_use_ema': False, 'bear_use_atr': False, 'bear_use_adx': True, 'bear_use_spike': True, 'bear_rsi_required': True, 'sideways_strategy': 'breakout', 'sideways_bb_std_mult': 1.5773559741752745, 'sideways_rsi_os': 16, 'sideways_rsi_ob': 70, 'sideways_adx_thresh': 34.002191036755555, 'sideways_atr_min_pct': 0.016167178835907518, 'sideways_atr_max_pct': 0.1154553966169067, 'sideways_tp_mult': 2.5285985337895727, 'sideways_tsl_mult': 0.8039010146077783, 'sideways_time_stop': 77, 'sideways_use_sma': False, 'sideways_use_ema': True, 'sideways_use_atr': True, 'sideways_use_adx': True, 'sideways_use_spike': True, 'sideways_rsi_required': False}.
[I 2025-09-01 02:38:02,035] Trial 95 finished with values: [-0.020396916240962293, 0.02024278843316483] and parameters: {'p_sma': 19, 'p_std': 49, 'p_atr': 10, 'p_adx': 10, 'rsi_period': 34, 'ema1': 7, 'ema2': 57, 'slip_atr_k': 0.04011921153778991, 'slip_spread_k': 0.2081907658891584, 'spread_hl_frac': 0.010690293575839095, 'bb_std_mult': 1.4607177076716733, 'rsi_os': 9, 'rsi_ob': 60, 'vol_spike': 0.17556211618975454, 'adx_thresh': 7.38100535029386, 'atr_min_pct': 0.01281394861239288, 'atr_max_pct': 0.11208265400628066, 'tp_mult': 2.477867896489503, 'tsl_mult': 0.6764254222598092, 'strategy': 'breakout', 'time_stop': 75, 'use_sma': False, 'use_atr': False, 'use_adx': False, 'use_ema': False, 'use_spike': True, 'rsi_required': False, 'edge_k': 0.5762962666613078, 'edge_cap': 0.1919189356355228, 'bull_strategy': 'breakout', 'bull_bb_std_mult': 1.3923077961220915, 'bull_rsi_os': 9, 'bull_rsi_ob': 74, 'bull_adx_thresh': 28.977691811873356, 'bull_atr_min_pct': 4.694922747832398e-05, 'bull_atr_max_pct': 0.14464284867997432, 'bull_tp_mult': 1.6128905422735065, 'bull_tsl_mult': 0.365915852604417, 'bull_time_stop': 47, 'bull_use_sma': False, 'bull_use_ema': False, 'bull_use_atr': False, 'bull_use_adx': False, 'bull_use_spike': True, 'bull_rsi_required': True, 'bear_strategy': 'breakout', 'bear_bb_std_mult': 0.7664900461787276, 'bear_rsi_os': 35, 'bear_rsi_ob': 93, 'bear_adx_thresh': 26.8665003496739, 'bear_atr_min_pct': 0.010421591808786827, 'bear_atr_max_pct': 0.04545119054280102, 'bear_tp_mult': 1.1165508544145375, 'bear_tsl_mult': 0.2843835959378461, 'bear_time_stop': 100, 'bear_use_sma': False, 'bear_use_ema': False, 'bear_use_atr': False, 'bear_use_adx': True, 'bear_use_spike': True, 'bear_rsi_required': True, 'sideways_strategy': 'breakout', 'sideways_bb_std_mult': 3.371031422407498, 'sideways_rsi_os': 14, 'sideways_rsi_ob': 70, 'sideways_adx_thresh': 29.25849297753399, 'sideways_atr_min_pct': 0.013811949191576887, 'sideways_atr_max_pct': 0.1147265851724101, 'sideways_tp_mult': 2.5683216938479636, 'sideways_tsl_mult': 0.6302526739980258, 'sideways_time_stop': 75, 'sideways_use_sma': False, 'sideways_use_ema': True, 'sideways_use_atr': True, 'sideways_use_adx': True, 'sideways_use_spike': True, 'sideways_rsi_required': False}.
[I 2025-09-01 02:38:02,819] Trial 94 finished with values: [-1000000000.0, 1000000000.0] and parameters: {'p_sma': 19, 'p_std': 39, 'p_atr': 15, 'p_adx': 8, 'rsi_period': 35, 'ema1': 7, 'ema2': 21, 'slip_atr_k': 0.14709391204844083, 'slip_spread_k': 0.1884421234526522, 'spread_hl_frac': 0.009632484207285893, 'bb_std_mult': 1.4434777057666717, 'rsi_os': 10, 'rsi_ob': 59, 'vol_spike': 0.17681900945082218, 'adx_thresh': 24.910337065216453, 'atr_min_pct': 0.02851611110295041, 'atr_max_pct': 0.11146754391605262, 'tp_mult': 2.527498864755424, 'tsl_mult': 0.6084555773674117, 'strategy': 'breakout', 'time_stop': 102, 'use_sma': False, 'use_atr': False, 'use_adx': False, 'use_ema': False, 'use_spike': True, 'rsi_required': False, 'edge_k': 0.5067378585998552, 'edge_cap': 0.18747851745925814, 'bull_strategy': 'breakout', 'bull_bb_std_mult': 1.388957635476576, 'bull_rsi_os': 9, 'bull_rsi_ob': 67, 'bull_adx_thresh': 27.403044399877988, 'bull_atr_min_pct': 0.02357901865308617, 'bull_atr_max_pct': 0.13544872509629619, 'bull_tp_mult': 1.608078259128908, 'bull_tsl_mult': 0.6245116893888785, 'bull_time_stop': 45, 'bull_use_sma': False, 'bull_use_ema': False, 'bull_use_atr': False, 'bull_use_adx': False, 'bull_use_spike': True, 'bull_rsi_required': True, 'bear_strategy': 'breakout', 'bear_bb_std_mult': 2.3170294073450477, 'bear_rsi_os': 52, 'bear_rsi_ob': 93, 'bear_adx_thresh': 22.266290841489827, 'bear_atr_min_pct': 0.010664780778287936, 'bear_atr_max_pct': 0.027335787826408234, 'bear_tp_mult': 2.177608777525798, 'bear_tsl_mult': 0.07710960636938147, 'bear_time_stop': 180, 'bear_use_sma': False, 'bear_use_ema': False, 'bear_use_atr': False, 'bear_use_adx': True, 'bear_use_spike': True, 'bear_rsi_required': True, 'sideways_strategy': 'breakout', 'sideways_bb_std_mult': 1.574507084575587, 'sideways_rsi_os': 9, 'sideways_rsi_ob': 71, 'sideways_adx_thresh': 28.796516544703806, 'sideways_atr_min_pct': 0.017286320714921265, 'sideways_atr_max_pct': 0.1004019885057166, 'sideways_tp_mult': 2.893440526686234, 'sideways_tsl_mult': 0.31091671684362354, 'sideways_time_stop': 73, 'sideways_use_sma': False, 'sideways_use_ema': True, 'sideways_use_atr': True, 'sideways_use_adx': True, 'sideways_use_spike': True, 'sideways_rsi_required': False}.
[I 2025-09-01 02:38:50,627] Trial 99 finished with values: [-1000000000.0, 1000000000.0] and parameters: {'p_sma': 13, 'p_std': 40, 'p_atr': 10, 'p_adx': 22, 'rsi_period': 69, 'ema1': 18, 'ema2': 57, 'slip_atr_k': 0.04254956548643761, 'slip_spread_k': 0.28308513350044817, 'spread_hl_frac': 0.0072631188557226965, 'bb_std_mult': 1.49327447633069, 'rsi_os': 48, 'rsi_ob': 66, 'vol_spike': 0.20888273634050375, 'adx_thresh': 30.88236955449714, 'atr_min_pct': 0.012713458103664057, 'atr_max_pct': 0.0719832305236516, 'tp_mult': 2.073922169486864, 'tsl_mult': 0.604579044253305, 'strategy': 'breakout', 'time_stop': 99, 'use_sma': False, 'use_atr': False, 'use_adx': False, 'use_ema': False, 'use_spike': True, 'rsi_required': False, 'edge_k': 0.5800290516154831, 'edge_cap': 0.6904895257532332, 'bull_strategy': 'breakout', 'bull_bb_std_mult': 1.3520757033479578, 'bull_rsi_os': 44, 'bull_rsi_ob': 62, 'bull_adx_thresh': 30.83535018058057, 'bull_atr_min_pct': 0.020470504798504093, 'bull_atr_max_pct': 0.13743507165856028, 'bull_tp_mult': 1.5120456315885349, 'bull_tsl_mult': 0.5441372209888693, 'bull_time_stop': 258, 'bull_use_sma': False, 'bull_use_ema': False, 'bull_use_atr': False, 'bull_use_adx': True, 'bull_use_spike': True, 'bull_rsi_required': True, 'bear_strategy': 'breakout', 'bear_bb_std_mult': 2.432761728381835, 'bear_rsi_os': 6, 'bear_rsi_ob': 93, 'bear_adx_thresh': 21.915707434124577, 'bear_atr_min_pct': 0.010931069697873457, 'bear_atr_max_pct': 0.04387866871951379, 'bear_tp_mult': 1.5382031756686168, 'bear_tsl_mult': 0.9413554378097038, 'bear_time_stop': 210, 'bear_use_sma': False, 'bear_use_ema': False, 'bear_use_atr': False, 'bear_use_adx': True, 'bear_use_spike': True, 'bear_rsi_required': True, 'sideways_strategy': 'breakout', 'sideways_bb_std_mult': 2.152910118336505, 'sideways_rsi_os': 19, 'sideways_rsi_ob': 73, 'sideways_adx_thresh': 17.916335825007284, 'sideways_atr_min_pct': 0.010116545455407511, 'sideways_atr_max_pct': 0.11142844655573482, 'sideways_tp_mult': 2.8240175632371742, 'sideways_tsl_mult': 0.6139972277168392, 'sideways_time_stop': 37, 'sideways_use_sma': False, 'sideways_use_ema': True, 'sideways_use_atr': True, 'sideways_use_adx': True, 'sideways_use_spike': True, 'sideways_rsi_required': False}.
[I 2025-09-01 02:38:51,103] Trial 98 finished with values: [-1000000000.0, 1000000000.0] and parameters: {'p_sma': 13, 'p_std': 52, 'p_atr': 7, 'p_adx': 21, 'rsi_period': 79, 'ema1': 18, 'ema2': 57, 'slip_atr_k': 0.046655087827593075, 'slip_spread_k': 0.05007508484934278, 'spread_hl_frac': 0.005352511793313933, 'bb_std_mult': 1.4453049901496573, 'rsi_os': 31, 'rsi_ob': 66, 'vol_spike': 0.024034970413644274, 'adx_thresh': 24.760123438427737, 'atr_min_pct': 0.012864971518247888, 'atr_max_pct': 0.11100433937946279, 'tp_mult': 2.0666849642213134, 'tsl_mult': 0.7821638214465909, 'strategy': 'breakout', 'time_stop': 114, 'use_sma': False, 'use_atr': False, 'use_adx': False, 'use_ema': False, 'use_spike': True, 'rsi_required': False, 'edge_k': 0.37622901587453494, 'edge_cap': 0.9106723193523542, 'bull_strategy': 'breakout', 'bull_bb_std_mult': 1.371257266898367, 'bull_rsi_os': 43, 'bull_rsi_ob': 62, 'bull_adx_thresh': 31.008653160146178, 'bull_atr_min_pct': 0.0193894854475217, 'bull_atr_max_pct': 0.13836214673355407, 'bull_tp_mult': 1.4237833197933147, 'bull_tsl_mult': 0.5456510317582085, 'bull_time_stop': 266, 'bull_use_sma': False, 'bull_use_ema': False, 'bull_use_atr': False, 'bull_use_adx': True, 'bull_use_spike': True, 'bull_rsi_required': True, 'bear_strategy': 'breakout', 'bear_bb_std_mult': 2.6209909843473493, 'bear_rsi_os': 6, 'bear_rsi_ob': 90, 'bear_adx_thresh': 22.15220303593469, 'bear_atr_min_pct': 0.011272687326926456, 'bear_atr_max_pct': 0.04751711728985049, 'bear_tp_mult': 2.4840087023203448, 'bear_tsl_mult': 0.9484328533633579, 'bear_time_stop': 207, 'bear_use_sma': False, 'bear_use_ema': False, 'bear_use_atr': False, 'bear_use_adx': True, 'bear_use_spike': True, 'bear_rsi_required': True, 'sideways_strategy': 'breakout', 'sideways_bb_std_mult': 2.5529228478450032, 'sideways_rsi_os': 19, 'sideways_rsi_ob': 71, 'sideways_adx_thresh': 27.54958917525131, 'sideways_atr_min_pct': 0.014970688177901707, 'sideways_atr_max_pct': 0.11020811124414889, 'sideways_tp_mult': 2.107935291948635, 'sideways_tsl_mult': 0.6204872291894734, 'sideways_time_stop': 33, 'sideways_use_sma': False, 'sideways_use_ema': True, 'sideways_use_atr': True, 'sideways_use_adx': True, 'sideways_use_spike': True, 'sideways_rsi_required': False}.
