[I 2025-09-01 02:42:50,936] Trial 120 finished with values: [-0.024088071368016273, 0.023810314577162348] and parameters: {'p_sma': 20, 'p_std': 15, 'p_atr': 14, 'p_adx': 8, 'rsi_period': 26, 'ema1': 5, 'ema2': 58, 'slip_atr_k': 0.1208031765667135, 'slip_spread_k': 0.7082986790234466, 'spread_hl_frac': 0.03275684012197591, 'bb_std_mult': 3.4915794759355716, 'rsi_os': 9, 'rsi_ob': 57, 'vol_spike': 0.16296035574799336, 'adx_thresh': 24.25638557422951, 'atr_min_pct': 0.02358394851717971, 'atr_max_pct': 0.10134888603525877, 'tp_mult': 1.8967752051789368, 'tsl_mult': 0.6646077357955537, 'strategy': 'breakout', 'time_stop': 283, 'use_sma': False, 'use_atr': True, 'use_adx': False, 'use_ema': False, 'use_spike': True, 'rsi_required': False, 'edge_k': 0.49472528504453056, 'edge_cap': 0.14630848278620753, 'bull_strategy': 'mean_reversion', 'bull_bb_std_mult': 1.438098419387833, 'bull_rsi_os': 10, 'bull_rsi_ob': 60, 'bull_adx_thresh': 17.589588555203736, 'bull_atr_min_pct': 0.0026569107340406995, 'bull_atr_max_pct': 0.07750275631568891, 'bull_tp_mult': 1.3963441619387842, 'bull_tsl_mult': 0.5715029947493195, 'bull_time_stop': 224, 'bull_use_sma': True, 'bull_use_ema': False, 'bull_use_atr': False, 'bull_use_adx': False, 'bull_use_spike': True, 'bull_rsi_required': True, 'bear_strategy': 'breakout', 'bear_bb_std_mult': 2.419978511796413, 'bear_rsi_os': 9, 'bear_rsi_ob': 88, 'bear_adx_thresh': 16.30223038293705, 'bear_atr_min_pct': 0.027188213391624867, 'bear_atr_max_pct': 0.036104939266830435, 'bear_tp_mult': 1.0772933343535938, 'bear_tsl_mult': 0.2935966673045505, 'bear_time_stop': 42, 'bear_use_sma': False, 'bear_use_ema': False, 'bear_use_atr': True, 'bear_use_adx': True, 'bear_use_spike': True, 'bear_rsi_required': True, 'sideways_strategy': 'breakout', 'sideways_bb_std_mult': 2.6861690038249524, 'sideways_rsi_os': 26, 'sideways_rsi_ob': 72, 'sideways_adx_thresh': 22.094079031223472, 'sideways_atr_min_pct': 0.017881240419078837, 'sideways_atr_max_pct': 0.10524385116758359, 'sideways_tp_mult': 1.414502478349334, 'sideways_tsl_mult': 0.6515479050737139, 'sideways_time_stop': 199, 'sideways_use_sma': False, 'sideways_use_ema': False, 'sideways_use_atr': True, 'sideways_use_adx': False, 'sideways_use_spike': True, 'sideways_rsi_required': False}.
[I 2025-09-01 02:42:51,341] Trial 118 finished with values: [-1000000000.0, 1000000000.0] and parameters: {'p_sma': 31, 'p_std': 48, 'p_atr': 16, 'p_adx': 8, 'rsi_period': 66, 'ema1': 23, 'ema2': 58, 'slip_atr_k': 0.1430319394790455, 'slip_spread_k': 0.25481771514133505, 'spread_hl_frac': 0.02663829710618954, 'bb_std_mult': 2.5569255594324636, 'rsi_os': 5, 'rsi_ob': 65, 'vol_spike': 0.16819651897781188, 'adx_thresh': 25.321798696348722, 'atr_min_pct': 0.015158200603885924, 'atr_max_pct': 0.10140715901682676, 'tp_mult': 1.5885043022752574, 'tsl_mult': 0.5911367486665433, 'strategy': 'breakout', 'time_stop': 283, 'use_sma': False, 'use_atr': True, 'use_adx': False, 'use_ema': False, 'use_spike': False, 'rsi_required': True, 'edge_k': 0.6545553237088552, 'edge_cap': 0.24604706906934026, 'bull_strategy': 'breakout', 'bull_bb_std_mult': 1.3026137895785546, 'bull_rsi_os': 10, 'bull_rsi_ob': 77, 'bull_adx_thresh': 17.417358848847055, 'bull_atr_min_pct': 0.0026672764501987317, 'bull_atr_max_pct': 0.09061434826140315, 'bull_tp_mult': 1.4123434651896851, 'bull_tsl_mult': 0.5672794008165145, 'bull_time_stop': 32, 'bull_use_sma': False, 'bull_use_ema': False, 'bull_use_atr': True, 'bull_use_adx': True, 'bull_use_spike': True, 'bull_rsi_required': True, 'bear_strategy': 'breakout', 'bear_bb_std_mult': 2.711991049178613, 'bear_rsi_os': 19, 'bear_rsi_ob': 88, 'bear_adx_thresh': 25.890662517724657, 'bear_atr_min_pct': 0.0028635639178810554, 'bear_atr_max_pct': 0.03630165243160155, 'bear_tp_mult': 1.0872994654744876, 'bear_tsl_mult': 0.30031198782011453, 'bear_time_stop': 286, 'bear_use_sma': False, 'bear_use_ema': False, 'bear_use_atr': False, 'bear_use_adx': True, 'bear_use_spike': True, 'bear_rsi_required': True, 'sideways_strategy': 'breakout', 'sideways_bb_std_mult': 1.4091551064231704, 'sideways_rsi_os': 51, 'sideways_rsi_ob': 72, 'sideways_adx_thresh': 7.31080986443488, 'sideways_atr_min_pct': 0.016954267788516084, 'sideways_atr_max_pct': 0.10548910783256635, 'sideways_tp_mult': 1.3999114156980261, 'sideways_tsl_mult': 0.6593899684826312, 'sideways_time_stop': 178, 'sideways_use_sma': False, 'sideways_use_ema': True, 'sideways_use_atr': True, 'sideways_use_adx': False, 'sideways_use_spike': False, 'sideways_rsi_required': False}.
[I 2025-09-01 02:42:52,647] Trial 117 finished with values: [-1000000000.0, 1000000000.0] and parameters: {'p_sma': 46, 'p_std': 48, 'p_atr': 14, 'p_adx': 8, 'rsi_period': 67, 'ema1': 5, 'ema2': 53, 'slip_atr_k': 0.20193109532402737, 'slip_spread_k': 0.9137331310669079, 'spread_hl_frac': 0.0027293050731946565, 'bb_std_mult': 1.3312321093714778, 'rsi_os': 5, 'rsi_ob': 57, 'vol_spike': 0.1523754747691769, 'adx_thresh': 33.56997038151246, 'atr_min_pct': 0.025856083270314266, 'atr_max_pct': 0.09593286917522696, 'tp_mult': 2.1192051124802975, 'tsl_mult': 0.5871370675669288, 'strategy': 'breakout', 'time_stop': 282, 'use_sma': False, 'use_atr': True, 'use_adx': False, 'use_ema': False, 'use_spike': True, 'rsi_required': False, 'edge_k': 0.48069790049373545, 'edge_cap': 0.24113044284274415, 'bull_strategy': 'mean_reversion', 'bull_bb_std_mult': 1.4530124135255555, 'bull_rsi_os': 11, 'bull_rsi_ob': 65, 'bull_adx_thresh': 5.947482111637779, 'bull_atr_min_pct': 0.012337374124379614, 'bull_atr_max_pct': 0.08172014931249268, 'bull_tp_mult': 1.5583197459791165, 'bull_tsl_mult': 0.9380602619729725, 'bull_time_stop': 103, 'bull_use_sma': True, 'bull_use_ema': False, 'bull_use_atr': False, 'bull_use_adx': False, 'bull_use_spike': True, 'bull_rsi_required': True, 'bear_strategy': 'breakout', 'bear_bb_std_mult': 2.7385200239148437, 'bear_rsi_os': 19, 'bear_rsi_ob': 91, 'bear_adx_thresh': 29.825905087816132, 'bear_atr_min_pct': 0.026615829346078493, 'bear_atr_max_pct': 0.010180240836242027, 'bear_tp_mult': 1.7180827429598975, 'bear_tsl_mult': 0.15722560538473263, 'bear_time_stop': 223, 'bear_use_sma': False, 'bear_use_ema': False, 'bear_use_atr': False, 'bear_use_adx': True, 'bear_use_spike': True, 'bear_rsi_required': True, 'sideways_strategy': 'breakout', 'sideways_bb_std_mult': 0.552071902720987, 'sideways_rsi_os': 18, 'sideways_rsi_ob': 72, 'sideways_adx_thresh': 31.31711370258119, 'sideways_atr_min_pct': 0.016738308255966755, 'sideways_atr_max_pct': 0.10467056985612826, 'sideways_tp_mult': 1.4252284682845013, 'sideways_tsl_mult': 0.04170296474734586, 'sideways_time_stop': 47, 'sideways_use_sma': False, 'sideways_use_ema': True, 'sideways_use_atr': True, 'sideways_use_adx': False, 'sideways_use_spike': True, 'sideways_rsi_required': False}.
[I 2025-09-01 02:42:52,959] Trial 119 finished with values: [-0.05514386325609044, 0.054998714146475766] and parameters: {'p_sma': 12, 'p_std': 47, 'p_atr': 14, 'p_adx': 8, 'rsi_period': 66, 'ema1': 15, 'ema2': 32, 'slip_atr_k': 0.14332022424807267, 'slip_spread_k': 0.6837428730104578, 'spread_hl_frac': 0.008684425293582723, 'bb_std_mult': 0.6903699380912098, 'rsi_os': 16, 'rsi_ob': 68, 'vol_spike': 0.0907667572731449, 'adx_thresh': 25.39425343740782, 'atr_min_pct': 0.00129261389686346, 'atr_max_pct': 0.09668329846780538, 'tp_mult': 1.2733457222751121, 'tsl_mult': 0.749734777110856, 'strategy': 'breakout', 'time_stop': 221, 'use_sma': False, 'use_atr': True, 'use_adx': False, 'use_ema': False, 'use_spike': True, 'rsi_required': False, 'edge_k': 1.3222548510748928, 'edge_cap': 0.570489984996475, 'bull_strategy': 'mean_reversion', 'bull_bb_std_mult': 1.3019700295874286, 'bull_rsi_os': 27, 'bull_rsi_ob': 76, 'bull_adx_thresh': 11.058313718449849, 'bull_atr_min_pct': 0.002844547983907929, 'bull_atr_max_pct': 0.08200487565941882, 'bull_tp_mult': 1.4838941177869904, 'bull_tsl_mult': 0.6033511236314569, 'bull_time_stop': 102, 'bull_use_sma': False, 'bull_use_ema': False, 'bull_use_atr': False, 'bull_use_adx': False, 'bull_use_spike': True, 'bull_rsi_required': True, 'bear_strategy': 'breakout', 'bear_bb_std_mult': 2.3992572207392833, 'bear_rsi_os': 9, 'bear_rsi_ob': 88, 'bear_adx_thresh': 25.242675768977996, 'bear_atr_min_pct': 0.026893096750962124, 'bear_atr_max_pct': 0.07244320191180866, 'bear_tp_mult': 1.0855030861471517, 'bear_tsl_mult': 0.5325588546643594, 'bear_time_stop': 98, 'bear_use_sma': False, 'bear_use_ema': False, 'bear_use_atr': False, 'bear_use_adx': True, 'bear_use_spike': True, 'bear_rsi_required': True, 'sideways_strategy': 'breakout', 'sideways_bb_std_mult': 1.4235457130300313, 'sideways_rsi_os': 47, 'sideways_rsi_ob': 72, 'sideways_adx_thresh': 31.196781775278257, 'sideways_atr_min_pct': 0.0015540692933062542, 'sideways_atr_max_pct': 0.10572936910482733, 'sideways_tp_mult': 1.4131352621484206, 'sideways_tsl_mult': 0.6436370675354218, 'sideways_time_stop': 82, 'sideways_use_sma': False, 'sideways_use_ema': True, 'sideways_use_atr': True, 'sideways_use_adx': False, 'sideways_use_spike': True, 'sideways_rsi_required': False}.
[I 2025-09-01 02:42:53,184] Trial 121 finished with values: [-1000000000.0, 1000000000.0] and parameters: {'p_sma': 18, 'p_std': 49, 'p_atr': 20, 'p_adx': 8, 'rsi_period': 62, 'ema1': 14, 'ema2': 58, 'slip_atr_k': 0.07901253790692203, 'slip_spread_k': 0.2050826386992881, 'spread_hl_frac': 0.02694407993679373, 'bb_std_mult': 1.3318096415741858, 'rsi_os': 52, 'rsi_ob': 84, 'vol_spike': 0.16683117406133613, 'adx_thresh': 25.383871525649663, 'atr_min_pct': 0.015034787736535209, 'atr_max_pct': 0.09627205555827718, 'tp_mult': 2.1130243259844126, 'tsl_mult': 0.6689477613549448, 'strategy': 'mean_reversion', 'time_stop': 136, 'use_sma': False, 'use_atr': True, 'use_adx': False, 'use_ema': False, 'use_spike': True, 'rsi_required': False, 'edge_k': 0.5076893926998421, 'edge_cap': 0.6242515275674708, 'bull_strategy': 'mean_reversion', 'bull_bb_std_mult': 1.4270645539668187, 'bull_rsi_os': 49, 'bull_rsi_ob': 77, 'bull_adx_thresh': 25.673352206367134, 'bull_atr_min_pct': 0.0027443611923395517, 'bull_atr_max_pct': 0.1252380387789061, 'bull_tp_mult': 1.5482760706048182, 'bull_tsl_mult': 0.029147339076294354, 'bull_time_stop': 65, 'bull_use_sma': False, 'bull_use_ema': False, 'bull_use_atr': False, 'bull_use_adx': False, 'bull_use_spike': True, 'bull_rsi_required': False, 'bear_strategy': 'mean_reversion', 'bear_bb_std_mult': 1.278981114557784, 'bear_rsi_os': 8, 'bear_rsi_ob': 88, 'bear_adx_thresh': 6.079472113216303, 'bear_atr_min_pct': 0.008994581530473353, 'bear_atr_max_pct': 0.03687479202399077, 'bear_tp_mult': 2.519513450579572, 'bear_tsl_mult': 0.9239703422008053, 'bear_time_stop': 43, 'bear_use_sma': False, 'bear_use_ema': False, 'bear_use_atr': True, 'bear_use_adx': True, 'bear_use_spike': True, 'bear_rsi_required': True, 'sideways_strategy': 'mean_reversion', 'sideways_bb_std_mult': 1.7836568686036998, 'sideways_rsi_os': 16, 'sideways_rsi_ob': 72, 'sideways_adx_thresh': 31.019007108631993, 'sideways_atr_min_pct': 0.01805795381658306, 'sideways_atr_max_pct': 0.10563321399259154, 'sideways_tp_mult': 1.4016405434886396, 'sideways_tsl_mult': 0.6512976587760401, 'sideways_time_stop': 123, 'sideways_use_sma': True, 'sideways_use_ema': False, 'sideways_use_atr': False, 'sideways_use_adx': False, 'sideways_use_spike': True, 'sideways_rsi_required': False}.
[I 2025-09-01 02:43:37,061] Trial 122 finished with values: [-1000000000.0, 1000000000.0] and parameters: {'p_sma': 12, 'p_std': 16, 'p_atr': 14, 'p_adx': 7, 'rsi_period': 62, 'ema1': 5, 'ema2': 12, 'slip_atr_k': 0.24776138409580062, 'slip_spread_k': 0.7761437793557526, 'spread_hl_frac': 0.008225564498331249, 'bb_std_mult': 3.48125392161338, 'rsi_os': 9, 'rsi_ob': 57, 'vol_spike': 0.11016691612829022, 'adx_thresh': 8.295560716118882, 'atr_min_pct': 0.018872682262724583, 'atr_max_pct': 0.14439853504428732, 'tp_mult': 1.355686758372666, 'tsl_mult': 0.029503330949480322, 'strategy': 'mean_reversion', 'time_stop': 134, 'use_sma': False, 'use_atr': True, 'use_adx': False, 'use_ema': False, 'use_spike': True, 'rsi_required': False, 'edge_k': 0.5022041629372213, 'edge_cap': 0.6294655748149492, 'bull_strategy': 'mean_reversion', 'bull_bb_std_mult': 0.8951284926020222, 'bull_rsi_os': 19, 'bull_rsi_ob': 65, 'bull_adx_thresh': 25.720055388078286, 'bull_atr_min_pct': 0.027098863893755168, 'bull_atr_max_pct': 0.14116042529661227, 'bull_tp_mult': 1.5524342508798559, 'bull_tsl_mult': 0.7847067915491104, 'bull_time_stop': 221, 'bull_use_sma': False, 'bull_use_ema': False, 'bull_use_atr': False, 'bull_use_adx': False, 'bull_use_spike': True, 'bull_rsi_required': False, 'bear_strategy': 'mean_reversion', 'bear_bb_std_mult': 2.3759920418653824, 'bear_rsi_os': 9, 'bear_rsi_ob': 94, 'bear_adx_thresh': 7.203631374911483, 'bear_atr_min_pct': 0.02749577469959761, 'bear_atr_max_pct': 0.07909508801905415, 'bear_tp_mult': 2.5341008427723932, 'bear_tsl_mult': 0.8638308629970588, 'bear_time_stop': 44, 'bear_use_sma': False, 'bear_use_ema': False, 'bear_use_atr': True, 'bear_use_adx': True, 'bear_use_spike': True, 'bear_rsi_required': True, 'sideways_strategy': 'mean_reversion', 'sideways_bb_std_mult': 2.66283114824074, 'sideways_rsi_os': 16, 'sideways_rsi_ob': 72, 'sideways_adx_thresh': 31.277911633169133, 'sideways_atr_min_pct': 0.016218414929519802, 'sideways_atr_max_pct': 0.12223932780080783, 'sideways_tp_mult': 1.3614756513311668, 'sideways_tsl_mult': 0.6501879107199411, 'sideways_time_stop': 50, 'sideways_use_sma': True, 'sideways_use_ema': False, 'sideways_use_atr': False, 'sideways_use_adx': False, 'sideways_use_spike': True, 'sideways_rsi_required': False}.
[I 2025-09-01 02:43:38,239] Trial 124 finished with values: [-1000000000.0, 1000000000.0] and parameters: {'p_sma': 22, 'p_std': 15, 'p_atr': 21, 'p_adx': 25, 'rsi_period': 62, 'ema1': 14, 'ema2': 12, 'slip_atr_k': 0.2440679355221211, 'slip_spread_k': 0.2095185371596769, 'spread_hl_frac': 0.005371240279348797, 'bb_std_mult': 1.2202405510556775, 'rsi_os': 9, 'rsi_ob': 63, 'vol_spike': 0.05781688208500868, 'adx_thresh': 8.351309758328213, 'atr_min_pct': 0.00903462959837422, 'atr_max_pct': 0.10507178305728698, 'tp_mult': 1.8771365811027436, 'tsl_mult': 0.6631271356685232, 'strategy': 'mean_reversion', 'time_stop': 202, 'use_sma': False, 'use_atr': False, 'use_adx': False, 'use_ema': False, 'use_spike': True, 'rsi_required': False, 'edge_k': 0.3686723868322046, 'edge_cap': 0.6277372014364856, 'bull_strategy': 'mean_reversion', 'bull_bb_std_mult': 2.951044631444735, 'bull_rsi_os': 19, 'bull_rsi_ob': 60, 'bull_adx_thresh': 9.68482815504548, 'bull_atr_min_pct': 0.02751887473610199, 'bull_atr_max_pct': 0.14288399193374815, 'bull_tp_mult': 1.0988846668952879, 'bull_tsl_mult': 0.8817695129511904, 'bull_time_stop': 63, 'bull_use_sma': False, 'bull_use_ema': False, 'bull_use_atr': False, 'bull_use_adx': False, 'bull_use_spike': False, 'bull_rsi_required': False, 'bear_strategy': 'mean_reversion', 'bear_bb_std_mult': 0.8465185986142683, 'bear_rsi_os': 32, 'bear_rsi_ob': 94, 'bear_adx_thresh': 5.751398304994909, 'bear_atr_min_pct': 0.01197121629868645, 'bear_atr_max_pct': 0.07895504938909087, 'bear_tp_mult': 1.5819027910257835, 'bear_tsl_mult': 0.864898023944139, 'bear_time_stop': 255, 'bear_use_sma': False, 'bear_use_ema': True, 'bear_use_atr': True, 'bear_use_adx': True, 'bear_use_spike': True, 'bear_rsi_required': True, 'sideways_strategy': 'mean_reversion', 'sideways_bb_std_mult': 2.891283695166724, 'sideways_rsi_os': 16, 'sideways_rsi_ob': 75, 'sideways_adx_thresh': 21.87964192623228, 'sideways_atr_min_pct': 0.017835117297630373, 'sideways_atr_max_pct': 0.12261060555494716, 'sideways_tp_mult': 1.3556789029962562, 'sideways_tsl_mult': 0.6772015786098748, 'sideways_time_stop': 59, 'sideways_use_sma': True, 'sideways_use_ema': False, 'sideways_use_atr': False, 'sideways_use_adx': True, 'sideways_use_spike': True, 'sideways_rsi_required': False}.
[I 2025-09-01 02:43:38,693] Trial 123 finished with values: [-1000000000.0, 1000000000.0] and parameters: {'p_sma': 12, 'p_std': 41, 'p_atr': 20, 'p_adx': 7, 'rsi_period': 62, 'ema1': 6, 'ema2': 24, 'slip_atr_k': 0.11889119660610334, 'slip_spread_k': 0.6859652949667914, 'spread_hl_frac': 0.008297263441360527, 'bb_std_mult': 3.496402799800336, 'rsi_os': 15, 'rsi_ob': 68, 'vol_spike': 0.009422839865448673, 'adx_thresh': 29.816677705379462, 'atr_min_pct': 0.0091336651922953, 'atr_max_pct': 0.14379342077081686, 'tp_mult': 1.8799093683191526, 'tsl_mult': 0.6656557336284987, 'strategy': 'mean_reversion', 'time_stop': 220, 'use_sma': False, 'use_atr': False, 'use_adx': False, 'use_ema': False, 'use_spike': True, 'rsi_required': False, 'edge_k': 0.5079637151304928, 'edge_cap': 0.6353074428572, 'bull_strategy': 'mean_reversion', 'bull_bb_std_mult': 0.8578959835778288, 'bull_rsi_os': 30, 'bull_rsi_ob': 60, 'bull_adx_thresh': 25.443265522384138, 'bull_atr_min_pct': 0.0017759367861290738, 'bull_atr_max_pct': 0.09716093820072448, 'bull_tp_mult': 1.4770742455379668, 'bull_tsl_mult': 0.6027113247488758, 'bull_time_stop': 65, 'bull_use_sma': False, 'bull_use_ema': False, 'bull_use_atr': False, 'bull_use_adx': False, 'bull_use_spike': True, 'bull_rsi_required': False, 'bear_strategy': 'mean_reversion', 'bear_bb_std_mult': 2.3894580071929226, 'bear_rsi_os': 9, 'bear_rsi_ob': 94, 'bear_adx_thresh': 16.161240999841077, 'bear_atr_min_pct': 0.028454245362106577, 'bear_atr_max_pct': 0.06682285537538261, 'bear_tp_mult': 2.4501489770887517, 'bear_tsl_mult': 0.8561852610016516, 'bear_time_stop': 254, 'bear_use_sma': False, 'bear_use_ema': False, 'bear_use_atr': True, 'bear_use_adx': True, 'bear_use_spike': True, 'bear_rsi_required': True, 'sideways_strategy': 'mean_reversion', 'sideways_bb_std_mult': 0.6776751459164083, 'sideways_rsi_os': 13, 'sideways_rsi_ob': 89, 'sideways_adx_thresh': 26.804187120166908, 'sideways_atr_min_pct': 0.01593622658635408, 'sideways_atr_max_pct': 0.1213908507867728, 'sideways_tp_mult': 2.635164704460534, 'sideways_tsl_mult': 0.6432769030626894, 'sideways_time_stop': 84, 'sideways_use_sma': True, 'sideways_use_ema': False, 'sideways_use_atr': False, 'sideways_use_adx': True, 'sideways_use_spike': True, 'sideways_rsi_required': False}.
[I 2025-09-01 02:43:39,160] Trial 125 finished with values: [-0.04145312389214073, 0.041313151123581054] and parameters: {'p_sma': 20, 'p_std': 15, 'p_atr': 9, 'p_adx': 28, 'rsi_period': 59, 'ema1': 6, 'ema2': 56, 'slip_atr_k': 0.24537757506415145, 'slip_spread_k': 0.8359404443718734, 'spread_hl_frac': 0.03291269919381564, 'bb_std_mult': 3.491295306235631, 'rsi_os': 7, 'rsi_ob': 63, 'vol_spike': 0.16293937838867298, 'adx_thresh': 24.20973352772477, 'atr_min_pct': 0.014353758770558932, 'atr_max_pct': 0.10636927722210815, 'tp_mult': 1.941469897616688, 'tsl_mult': 0.6330128596329841, 'strategy': 'breakout', 'time_stop': 270, 'use_sma': False, 'use_atr': False, 'use_adx': False, 'use_ema': False, 'use_spike': True, 'rsi_required': False, 'edge_k': 0.40154075681539336, 'edge_cap': 0.3113841067617369, 'bull_strategy': 'mean_reversion', 'bull_bb_std_mult': 3.077128190702601, 'bull_rsi_os': 19, 'bull_rsi_ob': 61, 'bull_adx_thresh': 27.616473037607793, 'bull_atr_min_pct': 0.0008446184284334195, 'bull_atr_max_pct': 0.03607671778918217, 'bull_tp_mult': 2.3626615967469915, 'bull_tsl_mult': 0.10535125804041479, 'bull_time_stop': 224, 'bull_use_sma': True, 'bull_use_ema': False, 'bull_use_atr': False, 'bull_use_adx': False, 'bull_use_spike': False, 'bull_rsi_required': True, 'bear_strategy': 'breakout', 'bear_bb_std_mult': 2.6009481937886236, 'bear_rsi_os': 43, 'bear_rsi_ob': 94, 'bear_adx_thresh': 16.159787265970554, 'bear_atr_min_pct': 0.011504766593438702, 'bear_atr_max_pct': 0.12274744522703179, 'bear_tp_mult': 2.4372125709771026, 'bear_tsl_mult': 0.6761290769739532, 'bear_time_stop': 248, 'bear_use_sma': False, 'bear_use_ema': True, 'bear_use_atr': True, 'bear_use_adx': True, 'bear_use_spike': True, 'bear_rsi_required': True, 'sideways_strategy': 'breakout', 'sideways_bb_std_mult': 0.6883035161828088, 'sideways_rsi_os': 14, 'sideways_rsi_ob': 90, 'sideways_adx_thresh': 28.839750441480643, 'sideways_atr_min_pct': 0.02522834650186871, 'sideways_atr_max_pct': 0.12105797318100489, 'sideways_tp_mult': 1.3560054496495595, 'sideways_tsl_mult': 0.7104110051395458, 'sideways_time_stop': 200, 'sideways_use_sma': False, 'sideways_use_ema': False, 'sideways_use_atr': True, 'sideways_use_adx': True, 'sideways_use_spike': True, 'sideways_rsi_required': False}.
