[I 2025-09-01 02:46:08,193] Trial 136 finished with values: [-1000000000.0, 1000000000.0] and parameters: {'p_sma': 18, 'p_std': 28, 'p_atr': 22, 'p_adx': 30, 'rsi_period': 27, 'ema1': 9, 'ema2': 42, 'slip_atr_k': 0.05307125975061537, 'slip_spread_k': 0.15978680463500733, 'spread_hl_frac': 0.03049959930081283, 'bb_std_mult': 1.2409547107764984, 'rsi_os': 7, 'rsi_ob': 89, 'vol_spike': 0.1531503086496722, 'adx_thresh': 12.171700664845094, 'atr_min_pct': 0.013121653381437406, 'atr_max_pct': 0.1000554716867344, 'tp_mult': 2.7340104269323318, 'tsl_mult': 0.11091726714671507, 'strategy': 'breakout', 'time_stop': 31, 'use_sma': False, 'use_atr': False, 'use_adx': False, 'use_ema': False, 'use_spike': True, 'rsi_required': False, 'edge_k': 0.8661745054779141, 'edge_cap': 0.1896411240516181, 'bull_strategy': 'mean_reversion', 'bull_bb_std_mult': 1.0095552089637325, 'bull_rsi_os': 13, 'bull_rsi_ob': 67, 'bull_adx_thresh': 29.65139427457251, 'bull_atr_min_pct': 0.018665592207174894, 'bull_atr_max_pct': 0.02540641950775012, 'bull_tp_mult': 2.9912083766698103, 'bull_tsl_mult': 0.56719884526472, 'bull_time_stop': 5, 'bull_use_sma': False, 'bull_use_ema': True, 'bull_use_atr': False, 'bull_use_adx': False, 'bull_use_spike': True, 'bull_rsi_required': True, 'bear_strategy': 'breakout', 'bear_bb_std_mult': 2.808473167781268, 'bear_rsi_os': 55, 'bear_rsi_ob': 90, 'bear_adx_thresh': 26.457555319305794, 'bear_atr_min_pct': 0.01051969756820235, 'bear_atr_max_pct': 0.04347700830772182, 'bear_tp_mult': 2.410819279281909, 'bear_tsl_mult': 0.9201186176309982, 'bear_time_stop': 66, 'bear_use_sma': False, 'bear_use_ema': False, 'bear_use_atr': False, 'bear_use_adx': True, 'bear_use_spike': True, 'bear_rsi_required': False, 'sideways_strategy': 'breakout', 'sideways_bb_std_mult': 2.3556026642122356, 'sideways_rsi_os': 15, 'sideways_rsi_ob': 69, 'sideways_adx_thresh': 10.851644523738146, 'sideways_atr_min_pct': 0.01562635935338752, 'sideways_atr_max_pct': 0.06574950919353084, 'sideways_tp_mult': 1.9258138903305564, 'sideways_tsl_mult': 0.5966146270135196, 'sideways_time_stop': 52, 'sideways_use_sma': False, 'sideways_use_ema': True, 'sideways_use_atr': True, 'sideways_use_adx': True, 'sideways_use_spike': True, 'sideways_rsi_required': False}.
[I 2025-09-01 02:46:08,196] Trial 134 finished with values: [-1000000000.0, 1000000000.0] and parameters: {'p_sma': 7, 'p_std': 39, 'p_atr': 21, 'p_adx': 30, 'rsi_period': 12, 'ema1': 9, 'ema2': 20, 'slip_atr_k': 0.13623143637741703, 'slip_spread_k': 0.16629735344280988, 'spread_hl_frac': 0.023565208942532723, 'bb_std_mult': 1.2438629677543909, 'rsi_os': 7, 'rsi_ob': 55, 'vol_spike': 0.2519778323914255, 'adx_thresh': 24.77264610201654, 'atr_min_pct': 0.013358989387725714, 'atr_max_pct': 0.09993331511211756, 'tp_mult': 2.0097046187507255, 'tsl_mult': 0.24954493356282875, 'strategy': 'breakout', 'time_stop': 35, 'use_sma': False, 'use_atr': False, 'use_adx': True, 'use_ema': True, 'use_spike': True, 'rsi_required': False, 'edge_k': 1.0873041846908615, 'edge_cap': 0.2057027342901847, 'bull_strategy': 'mean_reversion', 'bull_bb_std_mult': 1.011134987625513, 'bull_rsi_os': 13, 'bull_rsi_ob': 57, 'bull_adx_thresh': 14.89918869660189, 'bull_atr_min_pct': 0.0014128485139801787, 'bull_atr_max_pct': 0.1310151382976061, 'bull_tp_mult': 1.6880156556500379, 'bull_tsl_mult': 0.5622237195221561, 'bull_time_stop': 162, 'bull_use_sma': False, 'bull_use_ema': False, 'bull_use_atr': False, 'bull_use_adx': False, 'bull_use_spike': True, 'bull_rsi_required': True, 'bear_strategy': 'breakout', 'bear_bb_std_mult': 2.452001200025168, 'bear_rsi_os': 8, 'bear_rsi_ob': 71, 'bear_adx_thresh': 26.436945082315457, 'bear_atr_min_pct': 0.010525246594387002, 'bear_atr_max_pct': 0.05417728698523357, 'bear_tp_mult': 2.3231223415167266, 'bear_tsl_mult': 0.7344424291705687, 'bear_time_stop': 197, 'bear_use_sma': False, 'bear_use_ema': False, 'bear_use_atr': False, 'bear_use_adx': False, 'bear_use_spike': True, 'bear_rsi_required': False, 'sideways_strategy': 'breakout', 'sideways_bb_std_mult': 2.8487776130580094, 'sideways_rsi_os': 15, 'sideways_rsi_ob': 71, 'sideways_adx_thresh': 28.343418392355645, 'sideways_atr_min_pct': 0.005272205599945592, 'sideways_atr_max_pct': 0.04183959373055679, 'sideways_tp_mult': 1.9774036495365535, 'sideways_tsl_mult': 0.599569359997852, 'sideways_time_stop': 56, 'sideways_use_sma': False, 'sideways_use_ema': True, 'sideways_use_atr': True, 'sideways_use_adx': True, 'sideways_use_spike': True, 'sideways_rsi_required': False}.
[I 2025-09-01 02:46:09,106] Trial 135 finished with values: [-1000000000.0, 1000000000.0] and parameters: {'p_sma': 7, 'p_std': 39, 'p_atr': 22, 'p_adx': 30, 'rsi_period': 20, 'ema1': 9, 'ema2': 51, 'slip_atr_k': 0.1476617582606542, 'slip_spread_k': 0.16527831837338855, 'spread_hl_frac': 0.009783247034964677, 'bb_std_mult': 1.2825361208897914, 'rsi_os': 7, 'rsi_ob': 90, 'vol_spike': 0.039303871560143505, 'adx_thresh': 27.101597575325968, 'atr_min_pct': 0.013865747562872106, 'atr_max_pct': 0.09988464250638547, 'tp_mult': 2.0479542024233446, 'tsl_mult': 0.6098266865770265, 'strategy': 'breakout', 'time_stop': 245, 'use_sma': False, 'use_atr': False, 'use_adx': False, 'use_ema': False, 'use_spike': True, 'rsi_required': False, 'edge_k': 1.0806048448574255, 'edge_cap': 0.1879642206201198, 'bull_strategy': 'mean_reversion', 'bull_bb_std_mult': 1.0160223891261055, 'bull_rsi_os': 13, 'bull_rsi_ob': 52, 'bull_adx_thresh': 29.534862356523828, 'bull_atr_min_pct': 0.007920881453649982, 'bull_atr_max_pct': 0.04866211202698933, 'bull_tp_mult': 1.6818041365127843, 'bull_tsl_mult': 0.565822361107478, 'bull_time_stop': 50, 'bull_use_sma': False, 'bull_use_ema': True, 'bull_use_atr': False, 'bull_use_adx': False, 'bull_use_spike': True, 'bull_rsi_required': True, 'bear_strategy': 'breakout', 'bear_bb_std_mult': 3.0233701832925997, 'bear_rsi_os': 7, 'bear_rsi_ob': 71, 'bear_adx_thresh': 26.20825384744449, 'bear_atr_min_pct': 0.005612922051509859, 'bear_atr_max_pct': 0.04466412785799482, 'bear_tp_mult': 2.314554889116362, 'bear_tsl_mult': 0.7293201652813108, 'bear_time_stop': 67, 'bear_use_sma': False, 'bear_use_ema': False, 'bear_use_atr': False, 'bear_use_adx': True, 'bear_use_spike': True, 'bear_rsi_required': False, 'sideways_strategy': 'breakout', 'sideways_bb_std_mult': 2.81139090644158, 'sideways_rsi_os': 15, 'sideways_rsi_ob': 75, 'sideways_adx_thresh': 10.419611539253266, 'sideways_atr_min_pct': 0.007581796103641189, 'sideways_atr_max_pct': 0.10946328828432175, 'sideways_tp_mult': 1.5297408607908303, 'sideways_tsl_mult': 0.6008471939244839, 'sideways_time_stop': 56, 'sideways_use_sma': False, 'sideways_use_ema': True, 'sideways_use_atr': True, 'sideways_use_adx': True, 'sideways_use_spike': True, 'sideways_rsi_required': False}.
[I 2025-09-01 02:46:57,410] Trial 141 finished with values: [-1000000000.0, 1000000000.0] and parameters: {'p_sma': 17, 'p_std': 50, 'p_atr': 23, 'p_adx': 16, 'rsi_period': 56, 'ema1': 8, 'ema2': 55, 'slip_atr_k': 0.1424869300409537, 'slip_spread_k': 0.307843513230464, 'spread_hl_frac': 0.04155280868747242, 'bb_std_mult': 1.405380029746627, 'rsi_os': 5, 'rsi_ob': 93, 'vol_spike': 0.17146451721524347, 'adx_thresh': 14.765691593801387, 'atr_min_pct': 0.015518039319872811, 'atr_max_pct': 0.050560007807785974, 'tp_mult': 1.9123702818251265, 'tsl_mult': 0.33705519738367473, 'strategy': 'mean_reversion', 'time_stop': 118, 'use_sma': True, 'use_atr': True, 'use_adx': False, 'use_ema': False, 'use_spike': True, 'rsi_required': False, 'edge_k': 0.5976649467593287, 'edge_cap': 0.12073439547956713, 'bull_strategy': 'mean_reversion', 'bull_bb_std_mult': 3.19962589833147, 'bull_rsi_os': 11, 'bull_rsi_ob': 63, 'bull_adx_thresh': 28.334713267588832, 'bull_atr_min_pct': 0.0005357488490645358, 'bull_atr_max_pct': 0.10446865547431822, 'bull_tp_mult': 2.90269111087711, 'bull_tsl_mult': 0.8225323756199614, 'bull_time_stop': 82, 'bull_use_sma': True, 'bull_use_ema': False, 'bull_use_atr': False, 'bull_use_adx': False, 'bull_use_spike': False, 'bull_rsi_required': False, 'bear_strategy': 'mean_reversion', 'bear_bb_std_mult': 1.5602339945245434, 'bear_rsi_os': 6, 'bear_rsi_ob': 89, 'bear_adx_thresh': 28.27655512601792, 'bear_atr_min_pct': 0.0096909963201719, 'bear_atr_max_pct': 0.12927969364072228, 'bear_tp_mult': 2.2009113875724, 'bear_tsl_mult': 0.032787691494820415, 'bear_time_stop': 61, 'bear_use_sma': False, 'bear_use_ema': True, 'bear_use_atr': True, 'bear_use_adx': True, 'bear_use_spike': False, 'bear_rsi_required': True, 'sideways_strategy': 'mean_reversion', 'sideways_bb_std_mult': 2.5893245405276444, 'sideways_rsi_os': 18, 'sideways_rsi_ob': 64, 'sideways_adx_thresh': 29.36107127587072, 'sideways_atr_min_pct': 0.029108959637508033, 'sideways_atr_max_pct': 0.12612218542867032, 'sideways_tp_mult': 2.5407857872689648, 'sideways_tsl_mult': 0.24139989708735277, 'sideways_time_stop': 60, 'sideways_use_sma': True, 'sideways_use_ema': False, 'sideways_use_atr': False, 'sideways_use_adx': False, 'sideways_use_spike': True, 'sideways_rsi_required': True}.
[I 2025-09-01 02:46:59,166] Trial 138 finished with values: [-1000000000.0, 1000000000.0] and parameters: {'p_sma': 16, 'p_std': 50, 'p_atr': 22, 'p_adx': 16, 'rsi_period': 19, 'ema1': 8, 'ema2': 55, 'slip_atr_k': 0.16785005579004714, 'slip_spread_k': 0.29830562914018754, 'spread_hl_frac': 0.013199638579321177, 'bb_std_mult': 0.8109812131917007, 'rsi_os': 8, 'rsi_ob': 66, 'vol_spike': 0.17230480850530036, 'adx_thresh': 20.79023762226531, 'atr_min_pct': 0.014394402863260342, 'atr_max_pct': 0.10076358846915627, 'tp_mult': 2.135803900718565, 'tsl_mult': 0.5046717496924359, 'strategy': 'mean_reversion', 'time_stop': 243, 'use_sma': True, 'use_atr': True, 'use_adx': False, 'use_ema': False, 'use_spike': True, 'rsi_required': False, 'edge_k': 0.3534126685573328, 'edge_cap': 0.47097237139382914, 'bull_strategy': 'mean_reversion', 'bull_bb_std_mult': 0.947752462045752, 'bull_rsi_os': 13, 'bull_rsi_ob': 65, 'bull_adx_thresh': 28.628760761447147, 'bull_atr_min_pct': 3.289478613720775e-05, 'bull_atr_max_pct': 0.14065556429810055, 'bull_tp_mult': 2.7445462267838487, 'bull_tsl_mult': 0.5621018936152476, 'bull_time_stop': 70, 'bull_use_sma': False, 'bull_use_ema': False, 'bull_use_atr': False, 'bull_use_adx': False, 'bull_use_spike': True, 'bull_rsi_required': False, 'bear_strategy': 'mean_reversion', 'bear_bb_std_mult': 2.5395939064864512, 'bear_rsi_os': 21, 'bear_rsi_ob': 55, 'bear_adx_thresh': 27.235413688184618, 'bear_atr_min_pct': 0.010379116815594851, 'bear_atr_max_pct': 0.05549394741754261, 'bear_tp_mult': 1.4999838022995444, 'bear_tsl_mult': 0.9829180957192103, 'bear_time_stop': 62, 'bear_use_sma': False, 'bear_use_ema': True, 'bear_use_atr': False, 'bear_use_adx': True, 'bear_use_spike': False, 'bear_rsi_required': False, 'sideways_strategy': 'mean_reversion', 'sideways_bb_std_mult': 2.377008213117187, 'sideways_rsi_os': 15, 'sideways_rsi_ob': 83, 'sideways_adx_thresh': 28.575175306839867, 'sideways_atr_min_pct': 0.015704562701005963, 'sideways_atr_max_pct': 0.10940212049423981, 'sideways_tp_mult': 1.7660522842924382, 'sideways_tsl_mult': 0.6043504442475884, 'sideways_time_stop': 61, 'sideways_use_sma': True, 'sideways_use_ema': True, 'sideways_use_atr': False, 'sideways_use_adx': False, 'sideways_use_spike': True, 'sideways_rsi_required': False}.
[I 2025-09-01 02:47:00,057] Trial 139 finished with values: [-1000000000.0, 1000000000.0] and parameters: {'p_sma': 17, 'p_std': 55, 'p_atr': 23, 'p_adx': 16, 'rsi_period': 55, 'ema1': 8, 'ema2': 55, 'slip_atr_k': 0.14232939859248764, 'slip_spread_k': 0.3205021855356797, 'spread_hl_frac': 0.009708760849206933, 'bb_std_mult': 1.1561537756212812, 'rsi_os': 27, 'rsi_ob': 65, 'vol_spike': 0.1707622924792103, 'adx_thresh': 26.236851736523263, 'atr_min_pct': 0.0060217793040228985, 'atr_max_pct': 0.053167641048435764, 'tp_mult': 2.913514886549639, 'tsl_mult': 0.5033434398281388, 'strategy': 'mean_reversion', 'time_stop': 242, 'use_sma': True, 'use_atr': True, 'use_adx': False, 'use_ema': False, 'use_spike': True, 'rsi_required': False, 'edge_k': 0.3517443346507486, 'edge_cap': 0.461260280276957, 'bull_strategy': 'mean_reversion', 'bull_bb_std_mult': 1.5146302880450042, 'bull_rsi_os': 15, 'bull_rsi_ob': 63, 'bull_adx_thresh': 28.597925675676237, 'bull_atr_min_pct': 0.021518816951693456, 'bull_atr_max_pct': 0.1398173358255875, 'bull_tp_mult': 1.4484332186303064, 'bull_tsl_mult': 0.8176175548499958, 'bull_time_stop': 69, 'bull_use_sma': False, 'bull_use_ema': False, 'bull_use_atr': False, 'bull_use_adx': False, 'bull_use_spike': False, 'bull_rsi_required': False, 'bear_strategy': 'mean_reversion', 'bear_bb_std_mult': 1.5910009022415714, 'bear_rsi_os': 41, 'bear_rsi_ob': 93, 'bear_adx_thresh': 27.377282133732344, 'bear_atr_min_pct': 0.00906015295669389, 'bear_atr_max_pct': 0.01472671448747824, 'bear_tp_mult': 2.467833032152281, 'bear_tsl_mult': 0.7798840990151215, 'bear_time_stop': 167, 'bear_use_sma': False, 'bear_use_ema': True, 'bear_use_atr': False, 'bear_use_adx': True, 'bear_use_spike': False, 'bear_rsi_required': True, 'sideways_strategy': 'mean_reversion', 'sideways_bb_std_mult': 2.6708656022374884, 'sideways_rsi_os': 40, 'sideways_rsi_ob': 83, 'sideways_adx_thresh': 5.0332317350587985, 'sideways_atr_min_pct': 0.0029990151806536525, 'sideways_atr_max_pct': 0.10945981172138745, 'sideways_tp_mult': 1.492020041103656, 'sideways_tsl_mult': 0.7423316410975263, 'sideways_time_stop': 59, 'sideways_use_sma': True, 'sideways_use_ema': True, 'sideways_use_atr': False, 'sideways_use_adx': False, 'sideways_use_spike': True, 'sideways_rsi_required': False}.
[I 2025-09-01 02:47:00,616] Trial 140 finished with values: [-0.025369416725793625, 0.025216437962500216] and parameters: {'p_sma': 40, 'p_std': 43, 'p_atr': 23, 'p_adx': 16, 'rsi_period': 20, 'ema1': 8, 'ema2': 57, 'slip_atr_k': 0.14168522278671689, 'slip_spread_k': 0.09418995087466517, 'spread_hl_frac': 0.009499111389220587, 'bb_std_mult': 1.1420168721521349, 'rsi_os': 8, 'rsi_ob': 65, 'vol_spike': 0.17168781787932297, 'adx_thresh': 26.474973076370073, 'atr_min_pct': 0.005380974610623644, 'atr_max_pct': 0.0444742219862277, 'tp_mult': 2.087301127354664, 'tsl_mult': 0.5044977215816007, 'strategy': 'mean_reversion', 'time_stop': 286, 'use_sma': True, 'use_atr': True, 'use_adx': False, 'use_ema': False, 'use_spike': True, 'rsi_required': False, 'edge_k': 0.3526599911773083, 'edge_cap': 0.46141555185997674, 'bull_strategy': 'mean_reversion', 'bull_bb_std_mult': 2.5794948450733846, 'bull_rsi_os': 15, 'bull_rsi_ob': 63, 'bull_adx_thresh': 31.286781416369454, 'bull_atr_min_pct': 1.4490182568949574e-06, 'bull_atr_max_pct': 0.14013887832620509, 'bull_tp_mult': 2.739266531556899, 'bull_tsl_mult': 0.5342091404667354, 'bull_time_stop': 296, 'bull_use_sma': False, 'bull_use_ema': False, 'bull_use_atr': False, 'bull_use_adx': False, 'bull_use_spike': False, 'bull_rsi_required': False, 'bear_strategy': 'mean_reversion', 'bear_bb_std_mult': 1.0348913383086271, 'bear_rsi_os': 5, 'bear_rsi_ob': 89, 'bear_adx_thresh': 27.04009886959336, 'bear_atr_min_pct': 0.01574703690443261, 'bear_atr_max_pct': 0.049266085477853244, 'bear_tp_mult': 2.1941929718251743, 'bear_tsl_mult': 0.3380575349456656, 'bear_time_stop': 60, 'bear_use_sma': False, 'bear_use_ema': True, 'bear_use_atr': False, 'bear_use_adx': True, 'bear_use_spike': False, 'bear_rsi_required': True, 'sideways_strategy': 'mean_reversion', 'sideways_bb_std_mult': 1.2927092630399544, 'sideways_rsi_os': 40, 'sideways_rsi_ob': 75, 'sideways_adx_thresh': 30.606080324366925, 'sideways_atr_min_pct': 0.028982951411136652, 'sideways_atr_max_pct': 0.11144331567427494, 'sideways_tp_mult': 1.347535937173065, 'sideways_tsl_mult': 0.562158743478284, 'sideways_time_stop': 61, 'sideways_use_sma': True, 'sideways_use_ema': True, 'sideways_use_atr': False, 'sideways_use_adx': False, 'sideways_use_spike': True, 'sideways_rsi_required': False}.
[I 2025-09-01 02:47:46,138] Trial 143 finished with values: [-0.029828564763002552, 0.029639357938383026] and parameters: {'p_sma': 28, 'p_std': 43, 'p_atr': 24, 'p_adx': 10, 'rsi_period': 46, 'ema1': 22, 'ema2': 57, 'slip_atr_k': 0.10550208443506412, 'slip_spread_k': 0.33023509956250857, 'spread_hl_frac': 0.0053383534791632, 'bb_std_mult': 2.9782747419910995, 'rsi_os': 6, 'rsi_ob': 62, 'vol_spike': 0.13951120368439013, 'adx_thresh': 26.421833290075178, 'atr_min_pct': 0.021185069041821367, 'atr_max_pct': 0.02575405082183011, 'tp_mult': 2.077391663243406, 'tsl_mult': 0.6908261639572848, 'strategy': 'breakout', 'time_stop': 294, 'use_sma': False, 'use_atr': False, 'use_adx': False, 'use_ema': False, 'use_spike': True, 'rsi_required': False, 'edge_k': 1.1365601625238364, 'edge_cap': 0.7163458773970737, 'bull_strategy': 'mean_reversion', 'bull_bb_std_mult': 1.6850187253628042, 'bull_rsi_os': 45, 'bull_rsi_ob': 84, 'bull_adx_thresh': 19.49123887627311, 'bull_atr_min_pct': 0.0019016945804823892, 'bull_atr_max_pct': 0.11537479200593964, 'bull_tp_mult': 1.4416739021436424, 'bull_tsl_mult': 0.6469656348450615, 'bull_time_stop': 297, 'bull_use_sma': False, 'bull_use_ema': False, 'bull_use_atr': False, 'bull_use_adx': False, 'bull_use_spike': False, 'bull_rsi_required': True, 'bear_strategy': 'breakout', 'bear_bb_std_mult': 1.0426178781856006, 'bear_rsi_os': 41, 'bear_rsi_ob': 93, 'bear_adx_thresh': 25.534444962177165, 'bear_atr_min_pct': 0.012361140033604449, 'bear_atr_max_pct': 0.05676133881100851, 'bear_tp_mult': 2.478350323159641, 'bear_tsl_mult': 0.9972556901740084, 'bear_time_stop': 56, 'bear_use_sma': False, 'bear_use_ema': False, 'bear_use_atr': False, 'bear_use_adx': True, 'bear_use_spike': True, 'bear_rsi_required': True, 'sideways_strategy': 'breakout', 'sideways_bb_std_mult': 3.5991466875134908, 'sideways_rsi_os': 38, 'sideways_rsi_ob': 73, 'sideways_adx_thresh': 30.633182074435588, 'sideways_atr_min_pct': 0.00251650602072399, 'sideways_atr_max_pct': 0.11466904816434785, 'sideways_tp_mult': 2.1294470164912305, 'sideways_tsl_mult': 0.5630612074422053, 'sideways_time_stop': 241, 'sideways_use_sma': False, 'sideways_use_ema': True, 'sideways_use_atr': True, 'sideways_use_adx': True, 'sideways_use_spike': True, 'sideways_rsi_required': False}.
[I 2025-09-01 02:47:46,754] Trial 144 finished with values: [-0.04153577262338004, 0.04136802172700367] and parameters: {'p_sma': 41, 'p_std': 41, 'p_atr': 12, 'p_adx': 9, 'rsi_period': 46, 'ema1': 7, 'ema2': 57, 'slip_atr_k': 0.10533703420803923, 'slip_spread_k': 0.0716508606596171, 'spread_hl_frac': 0.005181358156753956, 'bb_std_mult': 1.4065862479413438, 'rsi_os': 6, 'rsi_ob': 60, 'vol_spike': 0.14637622494198488, 'adx_thresh': 23.93656888014862, 'atr_min_pct': 0.012375744477996995, 'atr_max_pct': 0.044789350719399094, 'tp_mult': 2.083402514236086, 'tsl_mult': 0.6384041806967485, 'strategy': 'breakout', 'time_stop': 264, 'use_sma': False, 'use_atr': False, 'use_adx': False, 'use_ema': False, 'use_spike': True, 'rsi_required': False, 'edge_k': 0.5675303999051846, 'edge_cap': 0.7210050900639702, 'bull_strategy': 'mean_reversion', 'bull_bb_std_mult': 1.1633517002296783, 'bull_rsi_os': 15, 'bull_rsi_ob': 70, 'bull_adx_thresh': 27.78714167865855, 'bull_atr_min_pct': 0.0007748676087069753, 'bull_atr_max_pct': 0.14364216102220978, 'bull_tp_mult': 1.5968207014312312, 'bull_tsl_mult': 0.5335112572333701, 'bull_time_stop': 57, 'bull_use_sma': True, 'bull_use_ema': False, 'bull_use_atr': False, 'bull_use_adx': False, 'bull_use_spike': False, 'bull_rsi_required': True, 'bear_strategy': 'breakout', 'bear_bb_std_mult': 2.6451280468705405, 'bear_rsi_os': 5, 'bear_rsi_ob': 91, 'bear_adx_thresh': 22.985253011856706, 'bear_atr_min_pct': 0.015767315055396084, 'bear_atr_max_pct': 0.1037213253666353, 'bear_tp_mult': 1.9168234013149612, 'bear_tsl_mult': 0.9574885024112825, 'bear_time_stop': 118, 'bear_use_sma': False, 'bear_use_ema': False, 'bear_use_atr': False, 'bear_use_adx': True, 'bear_use_spike': True, 'bear_rsi_required': True, 'sideways_strategy': 'breakout', 'sideways_bb_std_mult': 2.9203972288269036, 'sideways_rsi_os': 13, 'sideways_rsi_ob': 77, 'sideways_adx_thresh': 27.829087177579357, 'sideways_atr_min_pct': 0.01750446831044804, 'sideways_atr_max_pct': 0.09501369862627426, 'sideways_tp_mult': 1.337229131996719, 'sideways_tsl_mult': 0.5659689822014218, 'sideways_time_stop': 70, 'sideways_use_sma': False, 'sideways_use_ema': True, 'sideways_use_atr': True, 'sideways_use_adx': True, 'sideways_use_spike': True, 'sideways_rsi_required': False}.
