[I 2025-09-01 03:14:24,811] Trial 316 finished with values: [-1000000000.0, 1000000000.0] and parameters: {'p_sma': 27, 'p_std': 34, 'p_atr': 28, 'p_adx': 13, 'rsi_period': 68, 'ema1': 18, 'ema2': 52, 'slip_atr_k': 0.02479887208693087, 'slip_spread_k': 0.6541395089487512, 'spread_hl_frac': 0.025884464952568197, 'bb_std_mult': 1.42879916754677, 'rsi_os': 12, 'rsi_ob': 46, 'vol_spike': 0.23573621092400576, 'adx_thresh': 6.613236293782699, 'atr_min_pct': 0.0028043556832735624, 'atr_max_pct': 0.12682199139862463, 'tp_mult': 2.706217234311612, 'tsl_mult': 0.450526747647328, 'strategy': 'mean_reversion', 'time_stop': 170, 'use_sma': False, 'use_atr': False, 'use_adx': True, 'use_ema': False, 'use_spike': False, 'rsi_required': True, 'edge_k': 1.115098412434402, 'edge_cap': 0.211597545269537, 'bull_strategy': 'breakout', 'bull_bb_std_mult': 1.3099021704367226, 'bull_rsi_os': 16, 'bull_rsi_ob': 54, 'bull_adx_thresh': 5.097496508462818, 'bull_atr_min_pct': 0.022639214772739204, 'bull_atr_max_pct': 0.11013401927601221, 'bull_tp_mult': 1.5366365174486971, 'bull_tsl_mult': 0.7104757128700772, 'bull_time_stop': 278, 'bull_use_sma': True, 'bull_use_ema': False, 'bull_use_atr': True, 'bull_use_adx': False, 'bull_use_spike': True, 'bull_rsi_required': False, 'bear_strategy': 'breakout', 'bear_bb_std_mult': 3.0716758501725048, 'bear_rsi_os': 53, 'bear_rsi_ob': 79, 'bear_adx_thresh': 25.18403064938418, 'bear_atr_min_pct': 0.025138675553790416, 'bear_atr_max_pct': 0.021653507388863433, 'bear_tp_mult': 1.0434948156000365, 'bear_tsl_mult': 0.10162101426880624, 'bear_time_stop': 58, 'bear_use_sma': False, 'bear_use_ema': False, 'bear_use_atr': False, 'bear_use_adx': False, 'bear_use_spike': False, 'bear_rsi_required': False, 'sideways_strategy': 'mean_reversion', 'sideways_bb_std_mult': 2.011892613899934, 'sideways_rsi_os': 39, 'sideways_rsi_ob': 78, 'sideways_adx_thresh': 27.099685533742793, 'sideways_atr_min_pct': 0.019550536093835356, 'sideways_atr_max_pct': 0.12678666025531404, 'sideways_tp_mult': 1.9047068737574937, 'sideways_tsl_mult': 0.215085911755205, 'sideways_time_stop': 185, 'sideways_use_sma': True, 'sideways_use_ema': True, 'sideways_use_atr': True, 'sideways_use_adx': False, 'sideways_use_spike': False, 'sideways_rsi_required': True}.
[I 2025-09-01 03:14:24,845] Trial 315 finished with values: [-1000000000.0, 1000000000.0] and parameters: {'p_sma': 27, 'p_std': 58, 'p_atr': 28, 'p_adx': 13, 'rsi_period': 13, 'ema1': 18, 'ema2': 47, 'slip_atr_k': 0.08443719610022184, 'slip_spread_k': 0.9633443182621719, 'spread_hl_frac': 0.020869464716826658, 'bb_std_mult': 0.5214154117280718, 'rsi_os': 54, 'rsi_ob': 86, 'vol_spike': 0.23504132660939583, 'adx_thresh': 14.655621531060557, 'atr_min_pct': 0.006176239647102838, 'atr_max_pct': 0.07306507717368584, 'tp_mult': 1.5178344704064821, 'tsl_mult': 0.3347055262697641, 'strategy': 'mean_reversion', 'time_stop': 192, 'use_sma': False, 'use_atr': False, 'use_adx': True, 'use_ema': False, 'use_spike': False, 'rsi_required': True, 'edge_k': 1.7480785792073725, 'edge_cap': 0.45106173473888117, 'bull_strategy': 'breakout', 'bull_bb_std_mult': 0.7089144518430044, 'bull_rsi_os': 16, 'bull_rsi_ob': 50, 'bull_adx_thresh': 10.697376060376548, 'bull_atr_min_pct': 0.0022893119177991804, 'bull_atr_max_pct': 0.11931504707784035, 'bull_tp_mult': 2.773762347043797, 'bull_tsl_mult': 0.7103968499301416, 'bull_time_stop': 219, 'bull_use_sma': True, 'bull_use_ema': False, 'bull_use_atr': True, 'bull_use_adx': False, 'bull_use_spike': True, 'bull_rsi_required': False, 'bear_strategy': 'breakout', 'bear_bb_std_mult': 2.2219775498772867, 'bear_rsi_os': 53, 'bear_rsi_ob': 57, 'bear_adx_thresh': 22.787415803526265, 'bear_atr_min_pct': 0.025052560361143655, 'bear_atr_max_pct': 0.022672242180948293, 'bear_tp_mult': 1.0387219452548044, 'bear_tsl_mult': 0.09704456427972935, 'bear_time_stop': 60, 'bear_use_sma': False, 'bear_use_ema': False, 'bear_use_atr': False, 'bear_use_adx': False, 'bear_use_spike': False, 'bear_rsi_required': False, 'sideways_strategy': 'breakout', 'sideways_bb_std_mult': 1.7939170290049702, 'sideways_rsi_os': 51, 'sideways_rsi_ob': 78, 'sideways_adx_thresh': 33.54119923367658, 'sideways_atr_min_pct': 0.011465899841492933, 'sideways_atr_max_pct': 0.018446072655397012, 'sideways_tp_mult': 1.5491415309674168, 'sideways_tsl_mult': 0.21901650656231364, 'sideways_time_stop': 258, 'sideways_use_sma': True, 'sideways_use_ema': True, 'sideways_use_atr': True, 'sideways_use_adx': False, 'sideways_use_spike': False, 'sideways_rsi_required': True}.
[I 2025-09-01 03:14:59,663] Trial 317 finished with values: [-0.025815297644757318, 0.025642118113570513] and parameters: {'p_sma': 40, 'p_std': 34, 'p_atr': 28, 'p_adx': 16, 'rsi_period': 74, 'ema1': 21, 'ema2': 52, 'slip_atr_k': 0.15829246753693654, 'slip_spread_k': 0.19293037276457076, 'spread_hl_frac': 0.028012058176973734, 'bb_std_mult': 0.5230680797423237, 'rsi_os': 12, 'rsi_ob': 92, 'vol_spike': 0.23575119474716819, 'adx_thresh': 12.804316760555412, 'atr_min_pct': 0.003601814482864717, 'atr_max_pct': 0.044054958959478294, 'tp_mult': 2.630305497027662, 'tsl_mult': 0.3843269087648103, 'strategy': 'mean_reversion', 'time_stop': 170, 'use_sma': False, 'use_atr': False, 'use_adx': True, 'use_ema': False, 'use_spike': False, 'rsi_required': True, 'edge_k': 0.071807847290725, 'edge_cap': 0.44377106733778976, 'bull_strategy': 'breakout', 'bull_bb_std_mult': 1.8428380618085318, 'bull_rsi_os': 16, 'bull_rsi_ob': 50, 'bull_adx_thresh': 24.62193917480435, 'bull_atr_min_pct': 0.0014553058324250222, 'bull_atr_max_pct': 0.10996482584449212, 'bull_tp_mult': 1.7761516830087123, 'bull_tsl_mult': 0.37817462399520674, 'bull_time_stop': 300, 'bull_use_sma': True, 'bull_use_ema': False, 'bull_use_atr': True, 'bull_use_adx': False, 'bull_use_spike': True, 'bull_rsi_required': False, 'bear_strategy': 'breakout', 'bear_bb_std_mult': 2.233038404951811, 'bear_rsi_os': 16, 'bear_rsi_ob': 76, 'bear_adx_thresh': 10.585565625301951, 'bear_atr_min_pct': 0.029466820630255533, 'bear_atr_max_pct': 0.11891313363865905, 'bear_tp_mult': 1.015727660536255, 'bear_tsl_mult': 0.13649911707041792, 'bear_time_stop': 129, 'bear_use_sma': True, 'bear_use_ema': False, 'bear_use_atr': False, 'bear_use_adx': False, 'bear_use_spike': False, 'bear_rsi_required': False, 'sideways_strategy': 'mean_reversion', 'sideways_bb_std_mult': 2.0011992088032766, 'sideways_rsi_os': 39, 'sideways_rsi_ob': 74, 'sideways_adx_thresh': 12.484813954855959, 'sideways_atr_min_pct': 0.019328381192730365, 'sideways_atr_max_pct': 0.01775866987616572, 'sideways_tp_mult': 1.9046585065788662, 'sideways_tsl_mult': 0.16554270995233908, 'sideways_time_stop': 147, 'sideways_use_sma': True, 'sideways_use_ema': True, 'sideways_use_atr': True, 'sideways_use_adx': False, 'sideways_use_spike': False, 'sideways_rsi_required': True}.
[I 2025-09-01 03:15:05,315] Trial 318 finished with values: [-0.0601971716189742, 0.06001157383118768] and parameters: {'p_sma': 21, 'p_std': 12, 'p_atr': 28, 'p_adx': 13, 'rsi_period': 38, 'ema1': 18, 'ema2': 58, 'slip_atr_k': 0.22617634581244792, 'slip_spread_k': 0.5150403254252316, 'spread_hl_frac': 0.027944447311985813, 'bb_std_mult': 3.531021987679651, 'rsi_os': 21, 'rsi_ob': 92, 'vol_spike': 0.08752163399163404, 'adx_thresh': 14.855866203103043, 'atr_min_pct': 0.006330685240753256, 'atr_max_pct': 0.07276197855186144, 'tp_mult': 2.6243089422872696, 'tsl_mult': 0.5246738228190165, 'strategy': 'mean_reversion', 'time_stop': 190, 'use_sma': False, 'use_atr': True, 'use_adx': True, 'use_ema': False, 'use_spike': False, 'rsi_required': True, 'edge_k': 0.12049796321772288, 'edge_cap': 0.2834427459679639, 'bull_strategy': 'breakout', 'bull_bb_std_mult': 0.9171421902489265, 'bull_rsi_os': 15, 'bull_rsi_ob': 50, 'bull_adx_thresh': 15.938547390948784, 'bull_atr_min_pct': 0.0014561343442039312, 'bull_atr_max_pct': 0.1094633869001094, 'bull_tp_mult': 1.6334277005596238, 'bull_tsl_mult': 0.31542200289013916, 'bull_time_stop': 5, 'bull_use_sma': True, 'bull_use_ema': False, 'bull_use_atr': True, 'bull_use_adx': False, 'bull_use_spike': False, 'bull_rsi_required': False, 'bear_strategy': 'breakout', 'bear_bb_std_mult': 0.9673508985291681, 'bear_rsi_os': 50, 'bear_rsi_ob': 58, 'bear_adx_thresh': 6.530915258341842, 'bear_atr_min_pct': 0.024047117378372715, 'bear_atr_max_pct': 0.10841317538198281, 'bear_tp_mult': 1.0403277335966785, 'bear_tsl_mult': 0.44483445152476864, 'bear_time_stop': 83, 'bear_use_sma': True, 'bear_use_ema': True, 'bear_use_atr': False, 'bear_use_adx': False, 'bear_use_spike': False, 'bear_rsi_required': False, 'sideways_strategy': 'mean_reversion', 'sideways_bb_std_mult': 1.7970288093667288, 'sideways_rsi_os': 50, 'sideways_rsi_ob': 74, 'sideways_adx_thresh': 22.213754447917587, 'sideways_atr_min_pct': 0.012569778360831464, 'sideways_atr_max_pct': 0.12597392492146872, 'sideways_tp_mult': 1.5509359261149132, 'sideways_tsl_mult': 0.9459457076427822, 'sideways_time_stop': 148, 'sideways_use_sma': True, 'sideways_use_ema': True, 'sideways_use_atr': True, 'sideways_use_adx': False, 'sideways_use_spike': False, 'sideways_rsi_required': True}.
[I 2025-09-01 03:15:05,739] Trial 319 finished with values: [-0.03376248299766449, 0.03363269003653305] and parameters: {'p_sma': 41, 'p_std': 14, 'p_atr': 27, 'p_adx': 20, 'rsi_period': 38, 'ema1': 19, 'ema2': 47, 'slip_atr_k': 0.12999460133677104, 'slip_spread_k': 0.15326042188374492, 'spread_hl_frac': 0.03589461332727238, 'bb_std_mult': 1.1066383252979426, 'rsi_os': 33, 'rsi_ob': 77, 'vol_spike': 0.21633447263296865, 'adx_thresh': 14.70077047652935, 'atr_min_pct': 0.0076946148371899205, 'atr_max_pct': 0.043061241509107465, 'tp_mult': 2.6203784165532755, 'tsl_mult': 0.8578866167193687, 'strategy': 'mean_reversion', 'time_stop': 191, 'use_sma': False, 'use_atr': True, 'use_adx': True, 'use_ema': True, 'use_spike': False, 'rsi_required': True, 'edge_k': 0.07462435857044594, 'edge_cap': 0.4528802555277, 'bull_strategy': 'breakout', 'bull_bb_std_mult': 1.1287702066141319, 'bull_rsi_os': 20, 'bull_rsi_ob': 50, 'bull_adx_thresh': 23.7095164718031, 'bull_atr_min_pct': 0.0013062037622595755, 'bull_atr_max_pct': 0.05582693319980905, 'bull_tp_mult': 2.893478344176695, 'bull_tsl_mult': 0.7978435663511829, 'bull_time_stop': 254, 'bull_use_sma': True, 'bull_use_ema': False, 'bull_use_atr': True, 'bull_use_adx': False, 'bull_use_spike': False, 'bull_rsi_required': False, 'bear_strategy': 'breakout', 'bear_bb_std_mult': 1.0303024871642432, 'bear_rsi_os': 50, 'bear_rsi_ob': 84, 'bear_adx_thresh': 29.21703846585814, 'bear_atr_min_pct': 0.028205054908611724, 'bear_atr_max_pct': 0.04595295852704068, 'bear_tp_mult': 2.8761702693261286, 'bear_tsl_mult': 0.20400444539069573, 'bear_time_stop': 85, 'bear_use_sma': True, 'bear_use_ema': True, 'bear_use_atr': False, 'bear_use_adx': False, 'bear_use_spike': False, 'bear_rsi_required': False, 'sideways_strategy': 'breakout', 'sideways_bb_std_mult': 2.5102079821782124, 'sideways_rsi_os': 51, 'sideways_rsi_ob': 74, 'sideways_adx_thresh': 22.81728645719988, 'sideways_atr_min_pct': 0.012298324463600293, 'sideways_atr_max_pct': 0.02095472881139967, 'sideways_tp_mult': 1.573738924212812, 'sideways_tsl_mult': 0.0011214820436745154, 'sideways_time_stop': 128, 'sideways_use_sma': True, 'sideways_use_ema': True, 'sideways_use_atr': True, 'sideways_use_adx': False, 'sideways_use_spike': False, 'sideways_rsi_required': True}.
[I 2025-09-01 03:15:06,150] Trial 320 finished with values: [-0.030837183229966314, 0.03075657706314019] and parameters: {'p_sma': 16, 'p_std': 28, 'p_atr': 27, 'p_adx': 25, 'rsi_period': 14, 'ema1': 21, 'ema2': 58, 'slip_atr_k': 0.02016899544528257, 'slip_spread_k': 0.7025772285022058, 'spread_hl_frac': 0.02758403049888625, 'bb_std_mult': 1.570274186648267, 'rsi_os': 31, 'rsi_ob': 92, 'vol_spike': 0.2150672009189541, 'adx_thresh': 9.883340512681626, 'atr_min_pct': 0.007747093331444561, 'atr_max_pct': 0.10712067703075037, 'tp_mult': 2.6290970190833014, 'tsl_mult': 0.3826802923951392, 'strategy': 'mean_reversion', 'time_stop': 179, 'use_sma': False, 'use_atr': True, 'use_adx': True, 'use_ema': True, 'use_spike': True, 'rsi_required': False, 'edge_k': 0.11113809356767262, 'edge_cap': 0.39274931664821494, 'bull_strategy': 'breakout', 'bull_bb_std_mult': 0.934476615628479, 'bull_rsi_os': 15, 'bull_rsi_ob': 72, 'bull_adx_thresh': 16.028888614553797, 'bull_atr_min_pct': 0.0011678324607483671, 'bull_atr_max_pct': 0.11439665817383747, 'bull_tp_mult': 2.1844005543339198, 'bull_tsl_mult': 0.8008560339655737, 'bull_time_stop': 8, 'bull_use_sma': True, 'bull_use_ema': False, 'bull_use_atr': False, 'bull_use_adx': False, 'bull_use_spike': False, 'bull_rsi_required': False, 'bear_strategy': 'breakout', 'bear_bb_std_mult': 3.2583548259113173, 'bear_rsi_os': 48, 'bear_rsi_ob': 59, 'bear_adx_thresh': 14.259700610721882, 'bear_atr_min_pct': 0.028360165217358263, 'bear_atr_max_pct': 0.11891870177880524, 'bear_tp_mult': 1.0859958299250652, 'bear_tsl_mult': 0.14149761411537995, 'bear_time_stop': 86, 'bear_use_sma': True, 'bear_use_ema': True, 'bear_use_atr': False, 'bear_use_adx': False, 'bear_use_spike': True, 'bear_rsi_required': True, 'sideways_strategy': 'mean_reversion', 'sideways_bb_std_mult': 1.9105947182654672, 'sideways_rsi_os': 45, 'sideways_rsi_ob': 74, 'sideways_adx_thresh': 22.311464027682938, 'sideways_atr_min_pct': 0.028051985985033712, 'sideways_atr_max_pct': 0.021388100396946906, 'sideways_tp_mult': 1.8438741856501462, 'sideways_tsl_mult': 0.1639836857852399, 'sideways_time_stop': 112, 'sideways_use_sma': True, 'sideways_use_ema': True, 'sideways_use_atr': True, 'sideways_use_adx': False, 'sideways_use_spike': True, 'sideways_rsi_required': True}.
[I 2025-09-01 03:15:46,771] Trial 321 finished with values: [-1000000000.0, 1000000000.0] and parameters: {'p_sma': 16, 'p_std': 13, 'p_atr': 27, 'p_adx': 25, 'rsi_period': 14, 'ema1': 14, 'ema2': 58, 'slip_atr_k': 0.12922168884617466, 'slip_spread_k': 0.15741331098818942, 'spread_hl_frac': 0.022670450727644745, 'bb_std_mult': 2.477464996139741, 'rsi_os': 32, 'rsi_ob': 67, 'vol_spike': 0.06846589143638242, 'adx_thresh': 17.412190681527058, 'atr_min_pct': 0.02890492863360069, 'atr_max_pct': 0.054253977369962555, 'tp_mult': 2.6244316628573863, 'tsl_mult': 0.8437301770227045, 'strategy': 'mean_reversion', 'time_stop': 180, 'use_sma': True, 'use_atr': True, 'use_adx': True, 'use_ema': True, 'use_spike': True, 'rsi_required': False, 'edge_k': 0.11687473196039647, 'edge_cap': 0.3915760618125566, 'bull_strategy': 'breakout', 'bull_bb_std_mult': 0.9314395541068056, 'bull_rsi_os': 41, 'bull_rsi_ob': 54, 'bull_adx_thresh': 21.752641256501132, 'bull_atr_min_pct': 0.008388059197501234, 'bull_atr_max_pct': 0.09269834116056022, 'bull_tp_mult': 1.6377395935815877, 'bull_tsl_mult': 0.7876139887202533, 'bull_time_stop': 233, 'bull_use_sma': True, 'bull_use_ema': False, 'bull_use_atr': False, 'bull_use_adx': False, 'bull_use_spike': False, 'bull_rsi_required': False, 'bear_strategy': 'breakout', 'bear_bb_std_mult': 1.0201701438878905, 'bear_rsi_os': 50, 'bear_rsi_ob': 60, 'bear_adx_thresh': 6.563483682182808, 'bear_atr_min_pct': 0.028068384079883737, 'bear_atr_max_pct': 0.019213911135031052, 'bear_tp_mult': 1.0822813168376033, 'bear_tsl_mult': 0.8811428907549967, 'bear_time_stop': 83, 'bear_use_sma': True, 'bear_use_ema': True, 'bear_use_atr': False, 'bear_use_adx': False, 'bear_use_spike': True, 'bear_rsi_required': True, 'sideways_strategy': 'breakout', 'sideways_bb_std_mult': 1.1423511338042214, 'sideways_rsi_os': 45, 'sideways_rsi_ob': 75, 'sideways_adx_thresh': 24.436701064637948, 'sideways_atr_min_pct': 0.028110025996372013, 'sideways_atr_max_pct': 0.0223849260772638, 'sideways_tp_mult': 1.8225087163035192, 'sideways_tsl_mult': 0.17015998632767873, 'sideways_time_stop': 114, 'sideways_use_sma': True, 'sideways_use_ema': True, 'sideways_use_atr': True, 'sideways_use_adx': False, 'sideways_use_spike': True, 'sideways_rsi_required': True}.
[I 2025-09-01 03:15:47,809] Trial 324 finished with values: [-0.051472697839077264, 0.05132143695073017] and parameters: {'p_sma': 43, 'p_std': 10, 'p_atr': 30, 'p_adx': 17, 'rsi_period': 11, 'ema1': 20, 'ema2': 17, 'slip_atr_k': 0.024790002032107183, 'slip_spread_k': 0.6176390399721446, 'spread_hl_frac': 0.044219446354564304, 'bb_std_mult': 1.1938642274312437, 'rsi_os': 18, 'rsi_ob': 74, 'vol_spike': 0.22304295386200576, 'adx_thresh': 21.31732553596013, 'atr_min_pct': 0.008411809605415167, 'atr_max_pct': 0.05262084330038186, 'tp_mult': 1.8426149159034377, 'tsl_mult': 0.3028594099444252, 'strategy': 'breakout', 'time_stop': 124, 'use_sma': True, 'use_atr': False, 'use_adx': False, 'use_ema': False, 'use_spike': True, 'rsi_required': False, 'edge_k': 0.05021175618766163, 'edge_cap': 0.43145954761313376, 'bull_strategy': 'breakout', 'bull_bb_std_mult': 1.1689170289407789, 'bull_rsi_os': 18, 'bull_rsi_ob': 53, 'bull_adx_thresh': 11.678532132982287, 'bull_atr_min_pct': 0.0006899203706361064, 'bull_atr_max_pct': 0.06582570721256167, 'bull_tp_mult': 1.1712225062615598, 'bull_tsl_mult': 0.23801178537960627, 'bull_time_stop': 34, 'bull_use_sma': True, 'bull_use_ema': False, 'bull_use_atr': False, 'bull_use_adx': True, 'bull_use_spike': True, 'bull_rsi_required': True, 'bear_strategy': 'breakout', 'bear_bb_std_mult': 2.347555840269161, 'bear_rsi_os': 38, 'bear_rsi_ob': 60, 'bear_adx_thresh': 5.201453763570797, 'bear_atr_min_pct': 0.02727273416400853, 'bear_atr_max_pct': 0.018579494484050538, 'bear_tp_mult': 1.0108377328720715, 'bear_tsl_mult': 0.01990499048321437, 'bear_time_stop': 44, 'bear_use_sma': False, 'bear_use_ema': False, 'bear_use_atr': False, 'bear_use_adx': True, 'bear_use_spike': True, 'bear_rsi_required': True, 'sideways_strategy': 'breakout', 'sideways_bb_std_mult': 0.6636263303963579, 'sideways_rsi_os': 54, 'sideways_rsi_ob': 69, 'sideways_adx_thresh': 24.480090424212925, 'sideways_atr_min_pct': 0.028891815291936268, 'sideways_atr_max_pct': 0.03638454771521285, 'sideways_tp_mult': 1.6601328251557028, 'sideways_tsl_mult': 0.1929694507639498, 'sideways_time_stop': 215, 'sideways_use_sma': False, 'sideways_use_ema': True, 'sideways_use_atr': True, 'sideways_use_adx': True, 'sideways_use_spike': True, 'sideways_rsi_required': True}.
[I 2025-09-01 03:15:48,072] Trial 323 finished with values: [-0.026463003544400676, 0.02631753880681813] and parameters: {'p_sma': 43, 'p_std': 57, 'p_atr': 30, 'p_adx': 17, 'rsi_period': 80, 'ema1': 5, 'ema2': 11, 'slip_atr_k': 0.018686867448613573, 'slip_spread_k': 0.10220643220269532, 'spread_hl_frac': 0.022782124265707332, 'bb_std_mult': 1.851825029033328, 'rsi_os': 15, 'rsi_ob': 84, 'vol_spike': 0.22451942652069684, 'adx_thresh': 17.052801660294428, 'atr_min_pct': 0.008241448969907519, 'atr_max_pct': 0.05276561342876897, 'tp_mult': 2.74776809112933, 'tsl_mult': 0.36010616296352604, 'strategy': 'mean_reversion', 'time_stop': 180, 'use_sma': True, 'use_atr': False, 'use_adx': True, 'use_ema': True, 'use_spike': True, 'rsi_required': False, 'edge_k': 0.12243018852756699, 'edge_cap': 0.05712888893400864, 'bull_strategy': 'breakout', 'bull_bb_std_mult': 1.2138050507989742, 'bull_rsi_os': 18, 'bull_rsi_ob': 69, 'bull_adx_thresh': 8.527988924847982, 'bull_atr_min_pct': 0.0007469345683965402, 'bull_atr_max_pct': 0.07623450934225952, 'bull_tp_mult': 1.712008303568699, 'bull_tsl_mult': 0.17201612475464542, 'bull_time_stop': 264, 'bull_use_sma': True, 'bull_use_ema': False, 'bull_use_atr': False, 'bull_use_adx': True, 'bull_use_spike': True, 'bull_rsi_required': False, 'bear_strategy': 'breakout', 'bear_bb_std_mult': 2.3480471912883853, 'bear_rsi_os': 52, 'bear_rsi_ob': 60, 'bear_adx_thresh': 8.756806776727215, 'bear_atr_min_pct': 0.027217577733869378, 'bear_atr_max_pct': 0.08530160471640698, 'bear_tp_mult': 1.073941431898468, 'bear_tsl_mult': 0.7636394533995242, 'bear_time_stop': 44, 'bear_use_sma': False, 'bear_use_ema': False, 'bear_use_atr': False, 'bear_use_adx': False, 'bear_use_spike': True, 'bear_rsi_required': True, 'sideways_strategy': 'breakout', 'sideways_bb_std_mult': 0.8675846912479082, 'sideways_rsi_os': 45, 'sideways_rsi_ob': 54, 'sideways_adx_thresh': 24.39246370134754, 'sideways_atr_min_pct': 0.003298530453910549, 'sideways_atr_max_pct': 0.030387133704088777, 'sideways_tp_mult': 1.82331437655405, 'sideways_tsl_mult': 0.7833470682046187, 'sideways_time_stop': 114, 'sideways_use_sma': True, 'sideways_use_ema': True, 'sideways_use_atr': True, 'sideways_use_adx': True, 'sideways_use_spike': True, 'sideways_rsi_required': True}.
