[I 2025-09-01 02:29:58,406] Trial 55 finished with values: [-1000000000.0, 1000000000.0] and parameters: {'p_sma': 15, 'p_std': 25, 'p_atr': 22, 'p_adx': 18, 'rsi_period': 42, 'ema1': 10, 'ema2': 60, 'slip_atr_k': 0.010625739156030212, 'slip_spread_k': 0.1756506652646749, 'spread_hl_frac': 0.003826249591071391, 'bb_std_mult': 0.7121442690962068, 'rsi_os': 8, 'rsi_ob': 64, 'vol_spike': 0.10071323292155923, 'adx_thresh': 24.346808014827506, 'atr_min_pct': 0.014587737043527511, 'atr_max_pct': 0.10605277177323792, 'tp_mult': 1.513731554287938, 'tsl_mult': 0.7595252533213214, 'strategy': 'breakout', 'time_stop': 294, 'use_sma': False, 'use_atr': False, 'use_adx': False, 'use_ema': False, 'use_spike': True, 'rsi_required': False, 'edge_k': 0.47440715637833053, 'edge_cap': 0.19716620905361334, 'bull_strategy': 'mean_reversion', 'bull_bb_std_mult': 1.3046056205715733, 'bull_rsi_os': 7, 'bull_rsi_ob': 61, 'bull_adx_thresh': 28.166245149913628, 'bull_atr_min_pct': 0.021329436553583644, 'bull_atr_max_pct': 0.13829492672301383, 'bull_tp_mult': 1.0162662989751967, 'bull_tsl_mult': 0.39812501514099524, 'bull_time_stop': 82, 'bull_use_sma': False, 'bull_use_ema': False, 'bull_use_atr': False, 'bull_use_adx': False, 'bull_use_spike': True, 'bull_rsi_required': True, 'bear_strategy': 'breakout', 'bear_bb_std_mult': 0.9469819957529666, 'bear_rsi_os': 17, 'bear_rsi_ob': 92, 'bear_adx_thresh': 22.828170179745857, 'bear_atr_min_pct': 0.006435885846413806, 'bear_atr_max_pct': 0.01855961463826985, 'bear_tp_mult': 2.517819722342733, 'bear_tsl_mult': 0.9305699261207395, 'bear_time_stop': 56, 'bear_use_sma': False, 'bear_use_ema': False, 'bear_use_atr': False, 'bear_use_adx': True, 'bear_use_spike': True, 'bear_rsi_required': True, 'sideways_strategy': 'mean_reversion', 'sideways_bb_std_mult': 2.593476398948187, 'sideways_rsi_os': 7, 'sideways_rsi_ob': 81, 'sideways_adx_thresh': 34.71063746955771, 'sideways_atr_min_pct': 0.012557955819777642, 'sideways_atr_max_pct': 0.09717322871619934, 'sideways_tp_mult': 1.326365748154993, 'sideways_tsl_mult': 0.6699041393740326, 'sideways_time_stop': 24, 'sideways_use_sma': False, 'sideways_use_ema': True, 'sideways_use_atr': True, 'sideways_use_adx': True, 'sideways_use_spike': True, 'sideways_rsi_required': False}.
[I 2025-09-01 02:29:59,033] Trial 51 finished with values: [-1000000000.0, 1000000000.0] and parameters: {'p_sma': 16, 'p_std': 40, 'p_atr': 27, 'p_adx': 20, 'rsi_period': 40, 'ema1': 7, 'ema2': 58, 'slip_atr_k': 0.09641863112281741, 'slip_spread_k': 0.21140592448427134, 'spread_hl_frac': 0.006193300126654073, 'bb_std_mult': 1.408764250925741, 'rsi_os': 8, 'rsi_ob': 64, 'vol_spike': 0.2534102911459839, 'adx_thresh': 25.156936663757406, 'atr_min_pct': 0.013216145195355545, 'atr_max_pct': 0.08880408499505336, 'tp_mult': 1.803360682564793, 'tsl_mult': 0.9346511268176269, 'strategy': 'mean_reversion', 'time_stop': 290, 'use_sma': True, 'use_atr': False, 'use_adx': False, 'use_ema': False, 'use_spike': True, 'rsi_required': False, 'edge_k': 0.4349724965221501, 'edge_cap': 0.14661488202168343, 'bull_strategy': 'mean_reversion', 'bull_bb_std_mult': 0.8845161647095932, 'bull_rsi_os': 13, 'bull_rsi_ob': 66, 'bull_adx_thresh': 28.100671945152683, 'bull_atr_min_pct': 0.013966767685051961, 'bull_atr_max_pct': 0.1240204929225737, 'bull_tp_mult': 1.4149955697987973, 'bull_tsl_mult': 0.33995146919388797, 'bull_time_stop': 50, 'bull_use_sma': True, 'bull_use_ema': False, 'bull_use_atr': False, 'bull_use_adx': True, 'bull_use_spike': False, 'bull_rsi_required': False, 'bear_strategy': 'breakout', 'bear_bb_std_mult': 2.751103950623236, 'bear_rsi_os': 5, 'bear_rsi_ob': 92, 'bear_adx_thresh': 24.54358326960399, 'bear_atr_min_pct': 0.013801742953606089, 'bear_atr_max_pct': 0.051505687934081563, 'bear_tp_mult': 2.235234122556629, 'bear_tsl_mult': 0.9960082089200369, 'bear_time_stop': 64, 'bear_use_sma': False, 'bear_use_ema': True, 'bear_use_atr': False, 'bear_use_adx': True, 'bear_use_spike': True, 'bear_rsi_required': False, 'sideways_strategy': 'mean_reversion', 'sideways_bb_std_mult': 3.007756760646687, 'sideways_rsi_os': 15, 'sideways_rsi_ob': 69, 'sideways_adx_thresh': 30.867258747453427, 'sideways_atr_min_pct': 0.015694466872340853, 'sideways_atr_max_pct': 0.11093166403958653, 'sideways_tp_mult': 1.1063476273387216, 'sideways_tsl_mult': 0.6971187694941485, 'sideways_time_stop': 28, 'sideways_use_sma': True, 'sideways_use_ema': True, 'sideways_use_atr': True, 'sideways_use_adx': True, 'sideways_use_spike': True, 'sideways_rsi_required': False}.
[I 2025-09-01 02:30:48,377] Trial 58 finished with values: [-1000000000.0, 1000000000.0] and parameters: {'p_sma': 20, 'p_std': 45, 'p_atr': 26, 'p_adx': 30, 'rsi_period': 15, 'ema1': 8, 'ema2': 18, 'slip_atr_k': 0.1188380133458343, 'slip_spread_k': 0.35074881265138197, 'spread_hl_frac': 0.017982718276595953, 'bb_std_mult': 1.11377784413269, 'rsi_os': 9, 'rsi_ob': 71, 'vol_spike': 0.2117937729161935, 'adx_thresh': 32.27750240875582, 'atr_min_pct': 0.0027126326918255114, 'atr_max_pct': 0.0909814029363554, 'tp_mult': 1.3575119875303021, 'tsl_mult': 0.47157702661236656, 'strategy': 'breakout', 'time_stop': 268, 'use_sma': False, 'use_atr': True, 'use_adx': False, 'use_ema': False, 'use_spike': True, 'rsi_required': False, 'edge_k': 1.9313890097270003, 'edge_cap': 0.2788079962883673, 'bull_strategy': 'mean_reversion', 'bull_bb_std_mult': 0.6875531865558528, 'bull_rsi_os': 51, 'bull_rsi_ob': 73, 'bull_adx_thresh': 24.113476151910014, 'bull_atr_min_pct': 0.005526360886291933, 'bull_atr_max_pct': 0.05101152713459429, 'bull_tp_mult': 1.2304856846951717, 'bull_tsl_mult': 0.4622614197682725, 'bull_time_stop': 113, 'bull_use_sma': True, 'bull_use_ema': False, 'bull_use_atr': False, 'bull_use_adx': False, 'bull_use_spike': True, 'bull_rsi_required': True, 'bear_strategy': 'breakout', 'bear_bb_std_mult': 2.221449484785357, 'bear_rsi_os': 14, 'bear_rsi_ob': 89, 'bear_adx_thresh': 18.243242587562833, 'bear_atr_min_pct': 0.019998207455839537, 'bear_atr_max_pct': 0.022793425968281163, 'bear_tp_mult': 2.64306248861221, 'bear_tsl_mult': 0.8441856557704563, 'bear_time_stop': 266, 'bear_use_sma': False, 'bear_use_ema': False, 'bear_use_atr': False, 'bear_use_adx': True, 'bear_use_spike': True, 'bear_rsi_required': True, 'sideways_strategy': 'breakout', 'sideways_bb_std_mult': 3.252668381907106, 'sideways_rsi_os': 55, 'sideways_rsi_ob': 75, 'sideways_adx_thresh': 26.98893318431729, 'sideways_atr_min_pct': 0.017947697615957478, 'sideways_atr_max_pct': 0.10514969041184184, 'sideways_tp_mult': 2.99632348633482, 'sideways_tsl_mult': 0.8303533948940722, 'sideways_time_stop': 74, 'sideways_use_sma': False, 'sideways_use_ema': True, 'sideways_use_atr': True, 'sideways_use_adx': True, 'sideways_use_spike': True, 'sideways_rsi_required': False}.
[I 2025-09-01 02:30:49,364] Trial 56 finished with values: [-1000000000.0, 1000000000.0] and parameters: {'p_sma': 21, 'p_std': 16, 'p_atr': 23, 'p_adx': 23, 'rsi_period': 18, 'ema1': 8, 'ema2': 60, 'slip_atr_k': 0.005261466545283283, 'slip_spread_k': 0.3719236758525702, 'spread_hl_frac': 0.01765571193724611, 'bb_std_mult': 0.7530444596791804, 'rsi_os': 9, 'rsi_ob': 87, 'vol_spike': 0.1627637025833223, 'adx_thresh': 27.910924557016994, 'atr_min_pct': 0.012732817663755919, 'atr_max_pct': 0.10904959219386794, 'tp_mult': 1.5357214753846062, 'tsl_mult': 0.7685385517488974, 'strategy': 'breakout', 'time_stop': 8, 'use_sma': False, 'use_atr': False, 'use_adx': False, 'use_ema': False, 'use_spike': True, 'rsi_required': False, 'edge_k': 0.4620348949603917, 'edge_cap': 0.30138157259252346, 'bull_strategy': 'mean_reversion', 'bull_bb_std_mult': 1.2914352256807722, 'bull_rsi_os': 8, 'bull_rsi_ob': 60, 'bull_adx_thresh': 28.23675745790807, 'bull_atr_min_pct': 0.02201983893736857, 'bull_atr_max_pct': 0.13881054900917045, 'bull_tp_mult': 1.2543331890696785, 'bull_tsl_mult': 0.4542263184565838, 'bull_time_stop': 113, 'bull_use_sma': False, 'bull_use_ema': False, 'bull_use_atr': False, 'bull_use_adx': False, 'bull_use_spike': True, 'bull_rsi_required': True, 'bear_strategy': 'breakout', 'bear_bb_std_mult': 0.958766851623517, 'bear_rsi_os': 23, 'bear_rsi_ob': 89, 'bear_adx_thresh': 23.093253637260965, 'bear_atr_min_pct': 0.0064594898257351666, 'bear_atr_max_pct': 0.01988959890343117, 'bear_tp_mult': 2.2160942160946377, 'bear_tsl_mult': 0.8463732666746461, 'bear_time_stop': 76, 'bear_use_sma': False, 'bear_use_ema': False, 'bear_use_atr': False, 'bear_use_adx': True, 'bear_use_spike': True, 'bear_rsi_required': True, 'sideways_strategy': 'breakout', 'sideways_bb_std_mult': 3.278949009228664, 'sideways_rsi_os': 18, 'sideways_rsi_ob': 75, 'sideways_adx_thresh': 27.312381966207692, 'sideways_atr_min_pct': 0.017959158701890125, 'sideways_atr_max_pct': 0.10022496172559003, 'sideways_tp_mult': 2.989500954463599, 'sideways_tsl_mult': 0.8275781846364627, 'sideways_time_stop': 71, 'sideways_use_sma': False, 'sideways_use_ema': True, 'sideways_use_atr': True, 'sideways_use_adx': True, 'sideways_use_spike': True, 'sideways_rsi_required': False}.
[I 2025-09-01 02:30:49,650] Trial 57 finished with values: [-1000000000.0, 1000000000.0] and parameters: {'p_sma': 11, 'p_std': 35, 'p_atr': 23, 'p_adx': 24, 'rsi_period': 21, 'ema1': 8, 'ema2': 10, 'slip_atr_k': 0.1324161897584422, 'slip_spread_k': 0.3812484223703139, 'spread_hl_frac': 0.011858253723855091, 'bb_std_mult': 1.116281138137575, 'rsi_os': 9, 'rsi_ob': 71, 'vol_spike': 0.21262689928638673, 'adx_thresh': 27.765277024825895, 'atr_min_pct': 0.002421247589405635, 'atr_max_pct': 0.09057807892547254, 'tp_mult': 1.9852598060115672, 'tsl_mult': 0.4853351541782579, 'strategy': 'breakout', 'time_stop': 10, 'use_sma': False, 'use_atr': True, 'use_adx': False, 'use_ema': False, 'use_spike': True, 'rsi_required': False, 'edge_k': 0.6346440851766831, 'edge_cap': 0.2707896500555199, 'bull_strategy': 'mean_reversion', 'bull_bb_std_mult': 0.635315755259332, 'bull_rsi_os': 54, 'bull_rsi_ob': 72, 'bull_adx_thresh': 32.66669184849612, 'bull_atr_min_pct': 0.0055458295757870625, 'bull_atr_max_pct': 0.1430837437568206, 'bull_tp_mult': 1.3038596702174954, 'bull_tsl_mult': 0.45213264754885363, 'bull_time_stop': 27, 'bull_use_sma': True, 'bull_use_ema': False, 'bull_use_atr': False, 'bull_use_adx': False, 'bull_use_spike': True, 'bull_rsi_required': True, 'bear_strategy': 'breakout', 'bear_bb_std_mult': 1.6783738981512468, 'bear_rsi_os': 21, 'bear_rsi_ob': 89, 'bear_adx_thresh': 27.860007024500774, 'bear_atr_min_pct': 0.019951239830423524, 'bear_atr_max_pct': 0.05124852389091195, 'bear_tp_mult': 2.687648825480867, 'bear_tsl_mult': 0.8792534911898814, 'bear_time_stop': 75, 'bear_use_sma': False, 'bear_use_ema': False, 'bear_use_atr': False, 'bear_use_adx': True, 'bear_use_spike': True, 'bear_rsi_required': True, 'sideways_strategy': 'breakout', 'sideways_bb_std_mult': 2.3418537238238257, 'sideways_rsi_os': 20, 'sideways_rsi_ob': 72, 'sideways_adx_thresh': 27.01270888676007, 'sideways_atr_min_pct': 0.016823121457946594, 'sideways_atr_max_pct': 0.10786552678375798, 'sideways_tp_mult': 2.978759150298349, 'sideways_tsl_mult': 0.6365326026294043, 'sideways_time_stop': 52, 'sideways_use_sma': False, 'sideways_use_ema': True, 'sideways_use_atr': True, 'sideways_use_adx': True, 'sideways_use_spike': True, 'sideways_rsi_required': False}.
[I 2025-09-01 02:30:50,001] Trial 59 finished with values: [-1000000000.0, 1000000000.0] and parameters: {'p_sma': 12, 'p_std': 18, 'p_atr': 9, 'p_adx': 24, 'rsi_period': 16, 'ema1': 25, 'ema2': 16, 'slip_atr_k': 0.12273970015734229, 'slip_spread_k': 0.3640170081286096, 'spread_hl_frac': 0.017602816754496403, 'bb_std_mult': 1.0746479907177495, 'rsi_os': 48, 'rsi_ob': 88, 'vol_spike': 0.18929957413543344, 'adx_thresh': 28.07182243938479, 'atr_min_pct': 0.0022381183859753306, 'atr_max_pct': 0.078298881621065, 'tp_mult': 1.4180848711712777, 'tsl_mult': 0.4905344923505867, 'strategy': 'breakout', 'time_stop': 270, 'use_sma': False, 'use_atr': True, 'use_adx': False, 'use_ema': True, 'use_spike': True, 'rsi_required': False, 'edge_k': 1.9828508699879528, 'edge_cap': 0.2583562176394094, 'bull_strategy': 'mean_reversion', 'bull_bb_std_mult': 0.6790638908630429, 'bull_rsi_os': 18, 'bull_rsi_ob': 59, 'bull_adx_thresh': 32.94824355694775, 'bull_atr_min_pct': 8.009847295337882e-05, 'bull_atr_max_pct': 0.04747037828026472, 'bull_tp_mult': 1.2255760019432007, 'bull_tsl_mult': 0.003128261948868838, 'bull_time_stop': 113, 'bull_use_sma': False, 'bull_use_ema': False, 'bull_use_atr': False, 'bull_use_adx': False, 'bull_use_spike': True, 'bull_rsi_required': True, 'bear_strategy': 'breakout', 'bear_bb_std_mult': 3.123025253783923, 'bear_rsi_os': 23, 'bear_rsi_ob': 88, 'bear_adx_thresh': 27.781330692903943, 'bear_atr_min_pct': 0.01941528450846317, 'bear_atr_max_pct': 0.023906744244553586, 'bear_tp_mult': 2.641298246565845, 'bear_tsl_mult': 0.8479652551203495, 'bear_time_stop': 265, 'bear_use_sma': False, 'bear_use_ema': False, 'bear_use_atr': False, 'bear_use_adx': True, 'bear_use_spike': True, 'bear_rsi_required': True, 'sideways_strategy': 'breakout', 'sideways_bb_std_mult': 3.2780045974754612, 'sideways_rsi_os': 55, 'sideways_rsi_ob': 74, 'sideways_adx_thresh': 27.194593303455594, 'sideways_atr_min_pct': 0.017723809178142435, 'sideways_atr_max_pct': 0.12101053740313476, 'sideways_tp_mult': 2.9506565155232094, 'sideways_tsl_mult': 0.8656918182323798, 'sideways_time_stop': 71, 'sideways_use_sma': False, 'sideways_use_ema': True, 'sideways_use_atr': True, 'sideways_use_adx': True, 'sideways_use_spike': True, 'sideways_rsi_required': False}.
[I 2025-09-01 02:31:35,814] Trial 60 finished with values: [-1000000000.0, 1000000000.0] and parameters: {'p_sma': 10, 'p_std': 14, 'p_atr': 10, 'p_adx': 23, 'rsi_period': 61, 'ema1': 25, 'ema2': 10, 'slip_atr_k': 0.13839286288913114, 'slip_spread_k': 0.3864328355641405, 'spread_hl_frac': 0.011854754213526157, 'bb_std_mult': 1.1206250233378872, 'rsi_os': 14, 'rsi_ob': 88, 'vol_spike': 0.07558673230217634, 'adx_thresh': 19.457931036093726, 'atr_min_pct': 0.020355269482761614, 'atr_max_pct': 0.07686537574804389, 'tp_mult': 1.602443416432901, 'tsl_mult': 0.5416348892435221, 'strategy': 'breakout', 'time_stop': 125, 'use_sma': False, 'use_atr': False, 'use_adx': False, 'use_ema': True, 'use_spike': True, 'rsi_required': False, 'edge_k': 0.6127445719434296, 'edge_cap': 0.08724486552998795, 'bull_strategy': 'mean_reversion', 'bull_bb_std_mult': 1.8395902754450115, 'bull_rsi_os': 15, 'bull_rsi_ob': 60, 'bull_adx_thresh': 32.75134831519689, 'bull_atr_min_pct': 0.0015544375403137823, 'bull_atr_max_pct': 0.07095065716344715, 'bull_tp_mult': 1.463704245139187, 'bull_tsl_mult': 0.050079579275992325, 'bull_time_stop': 24, 'bull_use_sma': False, 'bull_use_ema': False, 'bull_use_atr': False, 'bull_use_adx': False, 'bull_use_spike': True, 'bull_rsi_required': True, 'bear_strategy': 'breakout', 'bear_bb_std_mult': 2.48276538156992, 'bear_rsi_os': 22, 'bear_rsi_ob': 57, 'bear_adx_thresh': 27.72263587829099, 'bear_atr_min_pct': 0.025570371744153064, 'bear_atr_max_pct': 0.10491875475359666, 'bear_tp_mult': 2.4403012124708368, 'bear_tsl_mult': 0.8016322708909087, 'bear_time_stop': 25, 'bear_use_sma': False, 'bear_use_ema': False, 'bear_use_atr': False, 'bear_use_adx': True, 'bear_use_spike': True, 'bear_rsi_required': True, 'sideways_strategy': 'breakout', 'sideways_bb_std_mult': 2.2727305111380867, 'sideways_rsi_os': 23, 'sideways_rsi_ob': 71, 'sideways_adx_thresh': 32.408889936332585, 'sideways_atr_min_pct': 0.017276455463645844, 'sideways_atr_max_pct': 0.12181999939521071, 'sideways_tp_mult': 2.710635912404991, 'sideways_tsl_mult': 0.7874788076744188, 'sideways_time_stop': 56, 'sideways_use_sma': False, 'sideways_use_ema': True, 'sideways_use_atr': True, 'sideways_use_adx': True, 'sideways_use_spike': True, 'sideways_rsi_required': False}.
[I 2025-09-01 02:31:36,199] Trial 63 finished with values: [-0.04084011168183621, 0.04070256849719527] and parameters: {'p_sma': 52, 'p_std': 26, 'p_atr': 21, 'p_adx': 17, 'rsi_period': 8, 'ema1': 5, 'ema2': 48, 'slip_atr_k': 0.06893222193053594, 'slip_spread_k': 0.11268817919524572, 'spread_hl_frac': 0.010639872220637302, 'bb_std_mult': 2.0483825118083216, 'rsi_os': 42, 'rsi_ob': 77, 'vol_spike': 0.07288659766434867, 'adx_thresh': 18.861204498107327, 'atr_min_pct': 0.019725109013505843, 'atr_max_pct': 0.09841337336441616, 'tp_mult': 1.978807522881907, 'tsl_mult': 0.616467496463459, 'strategy': 'breakout', 'time_stop': 163, 'use_sma': False, 'use_atr': False, 'use_adx': False, 'use_ema': True, 'use_spike': True, 'rsi_required': False, 'edge_k': 0.1658163890362162, 'edge_cap': 0.08912312937807926, 'bull_strategy': 'mean_reversion', 'bull_bb_std_mult': 1.8482369654737814, 'bull_rsi_os': 5, 'bull_rsi_ob': 87, 'bull_adx_thresh': 20.77484241572179, 'bull_atr_min_pct': 0.001751763441887556, 'bull_atr_max_pct': 0.07177224584554467, 'bull_tp_mult': 1.1342139172559673, 'bull_tsl_mult': 0.07024176543740207, 'bull_time_stop': 13, 'bull_use_sma': False, 'bull_use_ema': False, 'bull_use_atr': False, 'bull_use_adx': True, 'bull_use_spike': True, 'bull_rsi_required': True, 'bear_strategy': 'mean_reversion', 'bear_bb_std_mult': 2.474884488937479, 'bear_rsi_os': 12, 'bear_rsi_ob': 63, 'bear_adx_thresh': 30.37002043844233, 'bear_atr_min_pct': 0.011631512596084324, 'bear_atr_max_pct': 0.05975311749947301, 'bear_tp_mult': 2.4593841850470612, 'bear_tsl_mult': 0.05659937417590416, 'bear_time_stop': 29, 'bear_use_sma': False, 'bear_use_ema': False, 'bear_use_atr': False, 'bear_use_adx': True, 'bear_use_spike': True, 'bear_rsi_required': True, 'sideways_strategy': 'mean_reversion', 'sideways_bb_std_mult': 2.618292438595545, 'sideways_rsi_os': 23, 'sideways_rsi_ob': 62, 'sideways_adx_thresh': 32.47554066046823, 'sideways_atr_min_pct': 0.014274520336763753, 'sideways_atr_max_pct': 0.13806057139531513, 'sideways_tp_mult': 2.679154156882503, 'sideways_tsl_mult': 0.5780196203118592, 'sideways_time_stop': 232, 'sideways_use_sma': False, 'sideways_use_ema': True, 'sideways_use_atr': True, 'sideways_use_adx': True, 'sideways_use_spike': True, 'sideways_rsi_required': False}.
[I 2025-09-01 02:31:36,784] Trial 62 finished with values: [-1000000000.0, 1000000000.0] and parameters: {'p_sma': 54, 'p_std': 5, 'p_atr': 8, 'p_adx': 28, 'rsi_period': 62, 'ema1': 5, 'ema2': 55, 'slip_atr_k': 0.06731899884996739, 'slip_spread_k': 0.11215342773927084, 'spread_hl_frac': 0.010219737074310203, 'bb_std_mult': 2.0145256466536594, 'rsi_os': 14, 'rsi_ob': 77, 'vol_spike': 0.08386764125978323, 'adx_thresh': 22.424117290479895, 'atr_min_pct': 0.02014995728503268, 'atr_max_pct': 0.077508500190859, 'tp_mult': 1.6484492077617345, 'tsl_mult': 0.6377021501952908, 'strategy': 'breakout', 'time_stop': 130, 'use_sma': False, 'use_atr': False, 'use_adx': False, 'use_ema': True, 'use_spike': True, 'rsi_required': False, 'edge_k': 0.12991502630036295, 'edge_cap': 0.08473774839209627, 'bull_strategy': 'mean_reversion', 'bull_bb_std_mult': 1.8626188909214074, 'bull_rsi_os': 5, 'bull_rsi_ob': 87, 'bull_adx_thresh': 34.906496778713894, 'bull_atr_min_pct': 0.010917659962653713, 'bull_atr_max_pct': 0.056711474475848137, 'bull_tp_mult': 1.1688893351501721, 'bull_tsl_mult': 0.5916558934729307, 'bull_time_stop': 73, 'bull_use_sma': False, 'bull_use_ema': False, 'bull_use_atr': False, 'bull_use_adx': True, 'bull_use_spike': True, 'bull_rsi_required': True, 'bear_strategy': 'mean_reversion', 'bear_bb_std_mult': 2.4624371849011877, 'bear_rsi_os': 13, 'bear_rsi_ob': 56, 'bear_adx_thresh': 19.80535358139012, 'bear_atr_min_pct': 0.022482251370041024, 'bear_atr_max_pct': 0.06159719756386078, 'bear_tp_mult': 2.454873188696776, 'bear_tsl_mult': 0.9527359100116496, 'bear_time_stop': 25, 'bear_use_sma': False, 'bear_use_ema': False, 'bear_use_atr': False, 'bear_use_adx': True, 'bear_use_spike': True, 'bear_rsi_required': True, 'sideways_strategy': 'mean_reversion', 'sideways_bb_std_mult': 2.6420862529126907, 'sideways_rsi_os': 28, 'sideways_rsi_ob': 60, 'sideways_adx_thresh': 33.06481108977032, 'sideways_atr_min_pct': 0.013176432397148444, 'sideways_atr_max_pct': 0.11985513124138196, 'sideways_tp_mult': 2.5840141896083386, 'sideways_tsl_mult': 0.9182556478112824, 'sideways_time_stop': 237, 'sideways_use_sma': False, 'sideways_use_ema': True, 'sideways_use_atr': True, 'sideways_use_adx': True, 'sideways_use_spike': True, 'sideways_rsi_required': False}.
