[I 2025-09-01 02:57:11,006] Trial 209 finished with values: [-1000000000.0, 1000000000.0] and parameters: {'p_sma': 32, 'p_std': 54, 'p_atr': 27, 'p_adx': 18, 'rsi_period': 11, 'ema1': 22, 'ema2': 60, 'slip_atr_k': 0.01863050511445343, 'slip_spread_k': 0.18865021520694342, 'spread_hl_frac': 0.04025989337834787, 'bb_std_mult': 1.5294516029710663, 'rsi_os': 47, 'rsi_ob': 86, 'vol_spike': 0.22500991313693994, 'adx_thresh': 24.987493319469177, 'atr_min_pct': 0.008853786200029669, 'atr_max_pct': 0.04707334604822189, 'tp_mult': 2.7059077733237453, 'tsl_mult': 0.3523560229519124, 'strategy': 'mean_reversion', 'time_stop': 265, 'use_sma': True, 'use_atr': True, 'use_adx': True, 'use_ema': True, 'use_spike': False, 'rsi_required': True, 'edge_k': 0.9572593071886079, 'edge_cap': 0.288346672135836, 'bull_strategy': 'mean_reversion', 'bull_bb_std_mult': 2.3189750380971543, 'bull_rsi_os': 38, 'bull_rsi_ob': 60, 'bull_adx_thresh': 19.324637553999644, 'bull_atr_min_pct': 0.008575329178881777, 'bull_atr_max_pct': 0.12694781333839078, 'bull_tp_mult': 1.5843181116545497, 'bull_tsl_mult': 0.3891602254027764, 'bull_time_stop': 136, 'bull_use_sma': True, 'bull_use_ema': False, 'bull_use_atr': True, 'bull_use_adx': False, 'bull_use_spike': True, 'bull_rsi_required': False, 'bear_strategy': 'breakout', 'bear_bb_std_mult': 2.5389801108664902, 'bear_rsi_os': 6, 'bear_rsi_ob': 60, 'bear_adx_thresh': 23.81620715578487, 'bear_atr_min_pct': 0.020038144816908524, 'bear_atr_max_pct': 0.13093613611396912, 'bear_tp_mult': 1.0625177252392861, 'bear_tsl_mult': 0.059215627520061695, 'bear_time_stop': 48, 'bear_use_sma': True, 'bear_use_ema': True, 'bear_use_atr': True, 'bear_use_adx': False, 'bear_use_spike': False, 'bear_rsi_required': True, 'sideways_strategy': 'breakout', 'sideways_bb_std_mult': 1.7584219709942461, 'sideways_rsi_os': 17, 'sideways_rsi_ob': 78, 'sideways_adx_thresh': 29.57662694274362, 'sideways_atr_min_pct': 0.028919676479845058, 'sideways_atr_max_pct': 0.09519308889265184, 'sideways_tp_mult': 1.786418587083218, 'sideways_tsl_mult': 0.22132790992479617, 'sideways_time_stop': 160, 'sideways_use_sma': True, 'sideways_use_ema': False, 'sideways_use_atr': True, 'sideways_use_adx': False, 'sideways_use_spike': False, 'sideways_rsi_required': True}.
[I 2025-09-01 02:57:11,212] Trial 207 finished with values: [-0.018534491013626586, 0.01839542392569942] and parameters: {'p_sma': 35, 'p_std': 54, 'p_atr': 27, 'p_adx': 18, 'rsi_period': 22, 'ema1': 21, 'ema2': 60, 'slip_atr_k': 0.019235391351835815, 'slip_spread_k': 0.1875546907278241, 'spread_hl_frac': 0.041383477485049835, 'bb_std_mult': 2.4903913734772507, 'rsi_os': 47, 'rsi_ob': 88, 'vol_spike': 0.22527371777466945, 'adx_thresh': 24.818807730937625, 'atr_min_pct': 0.008838494254070324, 'atr_max_pct': 0.04724338107756447, 'tp_mult': 2.701964967978061, 'tsl_mult': 0.32186578949897443, 'strategy': 'mean_reversion', 'time_stop': 271, 'use_sma': True, 'use_atr': True, 'use_adx': True, 'use_ema': True, 'use_spike': False, 'rsi_required': True, 'edge_k': 0.9328808060663976, 'edge_cap': 0.4848139920934737, 'bull_strategy': 'mean_reversion', 'bull_bb_std_mult': 2.021438195118371, 'bull_rsi_os': 19, 'bull_rsi_ob': 61, 'bull_adx_thresh': 25.06810019690421, 'bull_atr_min_pct': 9.10602950908862e-05, 'bull_atr_max_pct': 0.12719547975643863, 'bull_tp_mult': 1.5818967197463436, 'bull_tsl_mult': 0.6108154725376163, 'bull_time_stop': 136, 'bull_use_sma': True, 'bull_use_ema': False, 'bull_use_atr': True, 'bull_use_adx': False, 'bull_use_spike': True, 'bull_rsi_required': False, 'bear_strategy': 'mean_reversion', 'bear_bb_std_mult': 2.516789628992506, 'bear_rsi_os': 24, 'bear_rsi_ob': 57, 'bear_adx_thresh': 25.537735968219796, 'bear_atr_min_pct': 0.0201202324878743, 'bear_atr_max_pct': 0.12471527136930893, 'bear_tp_mult': 1.0498757491946051, 'bear_tsl_mult': 0.05956400139698196, 'bear_time_stop': 59, 'bear_use_sma': True, 'bear_use_ema': False, 'bear_use_atr': True, 'bear_use_adx': False, 'bear_use_spike': True, 'bear_rsi_required': True, 'sideways_strategy': 'breakout', 'sideways_bb_std_mult': 1.7540331179356015, 'sideways_rsi_os': 17, 'sideways_rsi_ob': 79, 'sideways_adx_thresh': 34.579670755664665, 'sideways_atr_min_pct': 0.029068781612839406, 'sideways_atr_max_pct': 0.09452039292324882, 'sideways_tp_mult': 1.7604568879937252, 'sideways_tsl_mult': 0.21143641980000083, 'sideways_time_stop': 112, 'sideways_use_sma': True, 'sideways_use_ema': False, 'sideways_use_atr': True, 'sideways_use_adx': False, 'sideways_use_spike': False, 'sideways_rsi_required': True}.
[I 2025-09-01 02:57:11,417] Trial 208 finished with values: [-1000000000.0, 1000000000.0] and parameters: {'p_sma': 32, 'p_std': 54, 'p_atr': 27, 'p_adx': 18, 'rsi_period': 11, 'ema1': 21, 'ema2': 60, 'slip_atr_k': 0.028201159891958753, 'slip_spread_k': 0.2711848662536963, 'spread_hl_frac': 0.031666672373176254, 'bb_std_mult': 2.2334038974433916, 'rsi_os': 47, 'rsi_ob': 86, 'vol_spike': 0.22431343912164559, 'adx_thresh': 9.780460288078764, 'atr_min_pct': 0.008860686843589986, 'atr_max_pct': 0.04775427215773818, 'tp_mult': 2.6969834135956052, 'tsl_mult': 0.35304048550787076, 'strategy': 'mean_reversion', 'time_stop': 279, 'use_sma': True, 'use_atr': True, 'use_adx': True, 'use_ema': True, 'use_spike': False, 'rsi_required': True, 'edge_k': 0.9409336803854149, 'edge_cap': 0.486124543596295, 'bull_strategy': 'mean_reversion', 'bull_bb_std_mult': 3.599608569630984, 'bull_rsi_os': 32, 'bull_rsi_ob': 61, 'bull_adx_thresh': 8.52968361133323, 'bull_atr_min_pct': 0.006104668844968944, 'bull_atr_max_pct': 0.1268416011870091, 'bull_tp_mult': 1.5937235770660398, 'bull_tsl_mult': 0.5093778255172036, 'bull_time_stop': 123, 'bull_use_sma': True, 'bull_use_ema': False, 'bull_use_atr': True, 'bull_use_adx': False, 'bull_use_spike': True, 'bull_rsi_required': False, 'bear_strategy': 'breakout', 'bear_bb_std_mult': 2.556586348092969, 'bear_rsi_os': 15, 'bear_rsi_ob': 60, 'bear_adx_thresh': 25.295212896093542, 'bear_atr_min_pct': 0.01980960125722129, 'bear_atr_max_pct': 0.13163146163791958, 'bear_tp_mult': 1.048702416773188, 'bear_tsl_mult': 0.05095163714913672, 'bear_time_stop': 58, 'bear_use_sma': True, 'bear_use_ema': True, 'bear_use_atr': True, 'bear_use_adx': False, 'bear_use_spike': True, 'bear_rsi_required': True, 'sideways_strategy': 'breakout', 'sideways_bb_std_mult': 1.7178325534019598, 'sideways_rsi_os': 17, 'sideways_rsi_ob': 78, 'sideways_adx_thresh': 29.75648921932282, 'sideways_atr_min_pct': 0.028814816352253546, 'sideways_atr_max_pct': 0.09419018658606472, 'sideways_tp_mult': 1.237463532691395, 'sideways_tsl_mult': 0.2188700450771815, 'sideways_time_stop': 159, 'sideways_use_sma': True, 'sideways_use_ema': False, 'sideways_use_atr': True, 'sideways_use_adx': False, 'sideways_use_spike': False, 'sideways_rsi_required': True}.
[I 2025-09-01 02:57:56,995] Trial 211 finished with values: [-1000000000.0, 1000000000.0] and parameters: {'p_sma': 35, 'p_std': 56, 'p_atr': 29, 'p_adx': 15, 'rsi_period': 13, 'ema1': 21, 'ema2': 22, 'slip_atr_k': 0.09940496950912747, 'slip_spread_k': 0.2724371732922865, 'spread_hl_frac': 0.01312166456535154, 'bb_std_mult': 2.4594816631990444, 'rsi_os': 45, 'rsi_ob': 88, 'vol_spike': 0.21300162920826113, 'adx_thresh': 7.344701395041028, 'atr_min_pct': 0.006638246084427862, 'atr_max_pct': 0.03886137585978033, 'tp_mult': 2.6234891712585124, 'tsl_mult': 0.23340931406044202, 'strategy': 'mean_reversion', 'time_stop': 257, 'use_sma': False, 'use_atr': False, 'use_adx': True, 'use_ema': False, 'use_spike': True, 'rsi_required': False, 'edge_k': 0.14812011979885997, 'edge_cap': 0.48196730490740786, 'bull_strategy': 'mean_reversion', 'bull_bb_std_mult': 3.04171370047056, 'bull_rsi_os': 15, 'bull_rsi_ob': 57, 'bull_adx_thresh': 9.32785967182871, 'bull_atr_min_pct': 0.00653026430133965, 'bull_atr_max_pct': 0.11861264098954817, 'bull_tp_mult': 1.6693012053209857, 'bull_tsl_mult': 0.9038856071112085, 'bull_time_stop': 126, 'bull_use_sma': True, 'bull_use_ema': True, 'bull_use_atr': False, 'bull_use_adx': True, 'bull_use_spike': True, 'bull_rsi_required': False, 'bear_strategy': 'breakout', 'bear_bb_std_mult': 2.0432563889217388, 'bear_rsi_os': 23, 'bear_rsi_ob': 62, 'bear_adx_thresh': 25.15270923226752, 'bear_atr_min_pct': 0.02844417661933451, 'bear_atr_max_pct': 0.1355281244234163, 'bear_tp_mult': 1.1388048650793237, 'bear_tsl_mult': 0.10460151462425282, 'bear_time_stop': 62, 'bear_use_sma': False, 'bear_use_ema': False, 'bear_use_atr': False, 'bear_use_adx': False, 'bear_use_spike': True, 'bear_rsi_required': False, 'sideways_strategy': 'breakout', 'sideways_bb_std_mult': 1.7434262432447545, 'sideways_rsi_os': 15, 'sideways_rsi_ob': 77, 'sideways_adx_thresh': 23.280131790374156, 'sideways_atr_min_pct': 0.027243500377108827, 'sideways_atr_max_pct': 0.01942406577399272, 'sideways_tp_mult': 2.852168513972275, 'sideways_tsl_mult': 0.2386990230902256, 'sideways_time_stop': 169, 'sideways_use_sma': True, 'sideways_use_ema': True, 'sideways_use_atr': True, 'sideways_use_adx': False, 'sideways_use_spike': True, 'sideways_rsi_required': True}.
[I 2025-09-01 02:57:57,222] Trial 210 finished with values: [-1000000000.0, 1000000000.0] and parameters: {'p_sma': 35, 'p_std': 56, 'p_atr': 29, 'p_adx': 18, 'rsi_period': 10, 'ema1': 22, 'ema2': 26, 'slip_atr_k': 0.08999731666948223, 'slip_spread_k': 0.8157668152616181, 'spread_hl_frac': 0.021335452683181363, 'bb_std_mult': 1.483937531777281, 'rsi_os': 45, 'rsi_ob': 86, 'vol_spike': 0.23893298136238397, 'adx_thresh': 26.63467406609883, 'atr_min_pct': 0.006677156437910525, 'atr_max_pct': 0.03849659920676532, 'tp_mult': 2.699393906226199, 'tsl_mult': 0.29011486892699573, 'strategy': 'mean_reversion', 'time_stop': 265, 'use_sma': False, 'use_atr': False, 'use_adx': True, 'use_ema': False, 'use_spike': True, 'rsi_required': False, 'edge_k': 0.9424574898834017, 'edge_cap': 0.87706720864281, 'bull_strategy': 'mean_reversion', 'bull_bb_std_mult': 2.3601803857851973, 'bull_rsi_os': 29, 'bull_rsi_ob': 60, 'bull_adx_thresh': 25.158649623266392, 'bull_atr_min_pct': 0.006471891295328129, 'bull_atr_max_pct': 0.033480629238427644, 'bull_tp_mult': 1.6085886726454015, 'bull_tsl_mult': 0.5162177674181558, 'bull_time_stop': 124, 'bull_use_sma': True, 'bull_use_ema': False, 'bull_use_atr': False, 'bull_use_adx': False, 'bull_use_spike': True, 'bull_rsi_required': False, 'bear_strategy': 'breakout', 'bear_bb_std_mult': 1.4693250623897336, 'bear_rsi_os': 6, 'bear_rsi_ob': 60, 'bear_adx_thresh': 25.387526092158218, 'bear_atr_min_pct': 0.01857722094090855, 'bear_atr_max_pct': 0.128461702771506, 'bear_tp_mult': 1.095184579202959, 'bear_tsl_mult': 0.10025934818530732, 'bear_time_stop': 48, 'bear_use_sma': False, 'bear_use_ema': True, 'bear_use_atr': False, 'bear_use_adx': False, 'bear_use_spike': False, 'bear_rsi_required': True, 'sideways_strategy': 'breakout', 'sideways_bb_std_mult': 1.7553353509543226, 'sideways_rsi_os': 15, 'sideways_rsi_ob': 78, 'sideways_adx_thresh': 11.466319248883858, 'sideways_atr_min_pct': 0.029933324841118776, 'sideways_atr_max_pct': 0.09249977090027793, 'sideways_tp_mult': 1.2947130300042395, 'sideways_tsl_mult': 0.24370659842532663, 'sideways_time_stop': 170, 'sideways_use_sma': True, 'sideways_use_ema': True, 'sideways_use_atr': True, 'sideways_use_adx': False, 'sideways_use_spike': True, 'sideways_rsi_required': True}.
[I 2025-09-01 02:57:57,525] Trial 213 finished with values: [-0.08430855468001086, 0.08440010446324099] and parameters: {'p_sma': 35, 'p_std': 56, 'p_atr': 28, 'p_adx': 17, 'rsi_period': 10, 'ema1': 22, 'ema2': 22, 'slip_atr_k': 0.20119479359378473, 'slip_spread_k': 0.09570165955050097, 'spread_hl_frac': 0.013257775104544251, 'bb_std_mult': 3.238522351153703, 'rsi_os': 45, 'rsi_ob': 89, 'vol_spike': 0.21346216742231464, 'adx_thresh': 26.039218080648943, 'atr_min_pct': 0.006540753196413167, 'atr_max_pct': 0.03844364077561264, 'tp_mult': 2.6424646381878754, 'tsl_mult': 0.31649375299000543, 'strategy': 'mean_reversion', 'time_stop': 205, 'use_sma': False, 'use_atr': False, 'use_adx': True, 'use_ema': False, 'use_spike': True, 'rsi_required': False, 'edge_k': 1.9929071000504532, 'edge_cap': 0.4272087882089479, 'bull_strategy': 'mean_reversion', 'bull_bb_std_mult': 3.079570270357182, 'bull_rsi_os': 42, 'bull_rsi_ob': 58, 'bull_adx_thresh': 23.81298608268694, 'bull_atr_min_pct': 0.00018914640766064315, 'bull_atr_max_pct': 0.053723335226760066, 'bull_tp_mult': 1.680622074419549, 'bull_tsl_mult': 0.8023878581587172, 'bull_time_stop': 146, 'bull_use_sma': True, 'bull_use_ema': True, 'bull_use_atr': False, 'bull_use_adx': True, 'bull_use_spike': False, 'bull_rsi_required': False, 'bear_strategy': 'mean_reversion', 'bear_bb_std_mult': 2.386742650874899, 'bear_rsi_os': 5, 'bear_rsi_ob': 62, 'bear_adx_thresh': 25.597436738227213, 'bear_atr_min_pct': 0.0004892960608299367, 'bear_atr_max_pct': 0.12464337051781992, 'bear_tp_mult': 1.1317342542191953, 'bear_tsl_mult': 0.11327217040014986, 'bear_time_stop': 197, 'bear_use_sma': False, 'bear_use_ema': False, 'bear_use_atr': False, 'bear_use_adx': False, 'bear_use_spike': False, 'bear_rsi_required': False, 'sideways_strategy': 'breakout', 'sideways_bb_std_mult': 1.748375122650922, 'sideways_rsi_os': 15, 'sideways_rsi_ob': 77, 'sideways_adx_thresh': 23.398850970179197, 'sideways_atr_min_pct': 0.026494407008941723, 'sideways_atr_max_pct': 0.09032938362018922, 'sideways_tp_mult': 2.8836212470885174, 'sideways_tsl_mult': 0.24633507707559582, 'sideways_time_stop': 115, 'sideways_use_sma': True, 'sideways_use_ema': True, 'sideways_use_atr': False, 'sideways_use_adx': False, 'sideways_use_spike': True, 'sideways_rsi_required': True}.
[I 2025-09-01 02:57:57,731] Trial 212 finished with values: [-1000000000.0, 1000000000.0] and parameters: {'p_sma': 34, 'p_std': 57, 'p_atr': 29, 'p_adx': 17, 'rsi_period': 14, 'ema1': 22, 'ema2': 35, 'slip_atr_k': 0.01217555415536958, 'slip_spread_k': 0.09460904235354167, 'spread_hl_frac': 0.03168892277298269, 'bb_std_mult': 1.597670990623577, 'rsi_os': 45, 'rsi_ob': 89, 'vol_spike': 0.2384127859904523, 'adx_thresh': 9.391532253859445, 'atr_min_pct': 0.006544300473805511, 'atr_max_pct': 0.03836071744316739, 'tp_mult': 2.618523646011965, 'tsl_mult': 0.323447342296988, 'strategy': 'mean_reversion', 'time_stop': 255, 'use_sma': False, 'use_atr': False, 'use_adx': True, 'use_ema': False, 'use_spike': True, 'rsi_required': False, 'edge_k': 0.4121757328970683, 'edge_cap': 0.4801092910466386, 'bull_strategy': 'mean_reversion', 'bull_bb_std_mult': 3.244537762436173, 'bull_rsi_os': 19, 'bull_rsi_ob': 58, 'bull_adx_thresh': 22.667958922113176, 'bull_atr_min_pct': 0.00010783194432734578, 'bull_atr_max_pct': 0.053298070263804356, 'bull_tp_mult': 1.8917972886892112, 'bull_tsl_mult': 0.8385780563900245, 'bull_time_stop': 145, 'bull_use_sma': True, 'bull_use_ema': True, 'bull_use_atr': False, 'bull_use_adx': True, 'bull_use_spike': False, 'bull_rsi_required': False, 'bear_strategy': 'breakout', 'bear_bb_std_mult': 3.5287785015527664, 'bear_rsi_os': 5, 'bear_rsi_ob': 60, 'bear_adx_thresh': 25.79005186157528, 'bear_atr_min_pct': 0.018600728743323906, 'bear_atr_max_pct': 0.13538410947276983, 'bear_tp_mult': 1.1332143477332637, 'bear_tsl_mult': 0.09714531932551815, 'bear_time_stop': 196, 'bear_use_sma': False, 'bear_use_ema': True, 'bear_use_atr': False, 'bear_use_adx': False, 'bear_use_spike': True, 'bear_rsi_required': False, 'sideways_strategy': 'breakout', 'sideways_bb_std_mult': 1.9646974092864409, 'sideways_rsi_os': 15, 'sideways_rsi_ob': 77, 'sideways_adx_thresh': 6.45049425177376, 'sideways_atr_min_pct': 0.02990229531468597, 'sideways_atr_max_pct': 0.0905353923500523, 'sideways_tp_mult': 1.883836312815104, 'sideways_tsl_mult': 0.24187047765722747, 'sideways_time_stop': 115, 'sideways_use_sma': True, 'sideways_use_ema': True, 'sideways_use_atr': True, 'sideways_use_adx': False, 'sideways_use_spike': True, 'sideways_rsi_required': True}.
[I 2025-09-01 02:58:42,213] Trial 216 finished with values: [-1000000000.0, 1000000000.0] and parameters: {'p_sma': 33, 'p_std': 60, 'p_atr': 28, 'p_adx': 16, 'rsi_period': 8, 'ema1': 20, 'ema2': 35, 'slip_atr_k': 0.010784635976537713, 'slip_spread_k': 0.31183988469197343, 'spread_hl_frac': 0.014495798967456872, 'bb_std_mult': 1.57145544703079, 'rsi_os': 13, 'rsi_ob': 87, 'vol_spike': 0.2331717656763633, 'adx_thresh': 24.674333881669813, 'atr_min_pct': 0.007924073906682167, 'atr_max_pct': 0.04215378061547388, 'tp_mult': 2.7589207536519056, 'tsl_mult': 0.31976037461096807, 'strategy': 'mean_reversion', 'time_stop': 255, 'use_sma': False, 'use_atr': False, 'use_adx': True, 'use_ema': False, 'use_spike': True, 'rsi_required': False, 'edge_k': 0.4254821238540943, 'edge_cap': 0.44109977028035496, 'bull_strategy': 'mean_reversion', 'bull_bb_std_mult': 1.161778109042106, 'bull_rsi_os': 19, 'bull_rsi_ob': 62, 'bull_adx_thresh': 22.37022908541603, 'bull_atr_min_pct': 0.0016463953027759527, 'bull_atr_max_pct': 0.12280797288747806, 'bull_tp_mult': 2.3456367422840807, 'bull_tsl_mult': 0.5373500145615072, 'bull_time_stop': 142, 'bull_use_sma': True, 'bull_use_ema': False, 'bull_use_atr': False, 'bull_use_adx': False, 'bull_use_spike': True, 'bull_rsi_required': False, 'bear_strategy': 'breakout', 'bear_bb_std_mult': 2.4640802208084294, 'bear_rsi_os': 20, 'bear_rsi_ob': 61, 'bear_adx_thresh': 23.714980596336613, 'bear_atr_min_pct': 0.02606817441505365, 'bear_atr_max_pct': 0.13529440636023954, 'bear_tp_mult': 1.02775201999909, 'bear_tsl_mult': 0.0864122230430896, 'bear_time_stop': 260, 'bear_use_sma': False, 'bear_use_ema': False, 'bear_use_atr': False, 'bear_use_adx': False, 'bear_use_spike': True, 'bear_rsi_required': True, 'sideways_strategy': 'mean_reversion', 'sideways_bb_std_mult': 1.9851255059913273, 'sideways_rsi_os': 43, 'sideways_rsi_ob': 75, 'sideways_adx_thresh': 6.874804317725417, 'sideways_atr_min_pct': 0.028257568780374873, 'sideways_atr_max_pct': 0.08619753160881431, 'sideways_tp_mult': 1.212262735346712, 'sideways_tsl_mult': 0.3314418084657127, 'sideways_time_stop': 127, 'sideways_use_sma': True, 'sideways_use_ema': True, 'sideways_use_atr': True, 'sideways_use_adx': False, 'sideways_use_spike': True, 'sideways_rsi_required': True}.
[I 2025-09-01 02:58:42,760] Trial 215 finished with values: [-1000000000.0, 1000000000.0] and parameters: {'p_sma': 34, 'p_std': 60, 'p_atr': 28, 'p_adx': 17, 'rsi_period': 9, 'ema1': 20, 'ema2': 34, 'slip_atr_k': 0.009652971844458338, 'slip_spread_k': 0.31682840949961155, 'spread_hl_frac': 0.014078152189716316, 'bb_std_mult': 1.5911150928882338, 'rsi_os': 13, 'rsi_ob': 87, 'vol_spike': 0.2048376778636581, 'adx_thresh': 25.70245712752641, 'atr_min_pct': 0.010213424185324529, 'atr_max_pct': 0.04318827914429556, 'tp_mult': 2.759383298088924, 'tsl_mult': 0.31790905580118234, 'strategy': 'mean_reversion', 'time_stop': 274, 'use_sma': False, 'use_atr': False, 'use_adx': True, 'use_ema': False, 'use_spike': True, 'rsi_required': False, 'edge_k': 1.0477566035603514, 'edge_cap': 0.4376366952932556, 'bull_strategy': 'mean_reversion', 'bull_bb_std_mult': 2.034672514235767, 'bull_rsi_os': 19, 'bull_rsi_ob': 62, 'bull_adx_thresh': 24.04005758364228, 'bull_atr_min_pct': 0.012364783901619348, 'bull_atr_max_pct': 0.12306030844339715, 'bull_tp_mult': 1.5526380423188408, 'bull_tsl_mult': 0.677041065262017, 'bull_time_stop': 149, 'bull_use_sma': True, 'bull_use_ema': False, 'bull_use_atr': False, 'bull_use_adx': False, 'bull_use_spike': False, 'bull_rsi_required': False, 'bear_strategy': 'mean_reversion', 'bear_bb_std_mult': 2.4853748013589634, 'bear_rsi_os': 5, 'bear_rsi_ob': 61, 'bear_adx_thresh': 23.78639121172726, 'bear_atr_min_pct': 0.021659854808424615, 'bear_atr_max_pct': 0.1258285325854081, 'bear_tp_mult': 2.767490404358231, 'bear_tsl_mult': 0.07736879551043926, 'bear_time_stop': 53, 'bear_use_sma': False, 'bear_use_ema': False, 'bear_use_atr': False, 'bear_use_adx': False, 'bear_use_spike': True, 'bear_rsi_required': True, 'sideways_strategy': 'mean_reversion', 'sideways_bb_std_mult': 1.9891336313474477, 'sideways_rsi_os': 43, 'sideways_rsi_ob': 76, 'sideways_adx_thresh': 10.124713606832133, 'sideways_atr_min_pct': 0.02662229455861888, 'sideways_atr_max_pct': 0.08571025712647218, 'sideways_tp_mult': 1.2141612955464438, 'sideways_tsl_mult': 0.2798486823679859, 'sideways_time_stop': 115, 'sideways_use_sma': True, 'sideways_use_ema': True, 'sideways_use_atr': False, 'sideways_use_adx': False, 'sideways_use_spike': True, 'sideways_rsi_required': True}.
