[I 2025-09-01 03:48:51,396] Trial 513 finished with values: [-1000000000.0, 1000000000.0] and parameters: {'p_sma': 19, 'p_std': 51, 'p_atr': 24, 'p_adx': 12, 'rsi_period': 10, 'ema1': 13, 'ema2': 50, 'slip_atr_k': 0.002945758289706264, 'slip_spread_k': 0.0002308766864363085, 'spread_hl_frac': 0.04509688326646199, 'bb_std_mult': 2.34008046670657, 'rsi_os': 45, 'rsi_ob': 78, 'vol_spike': 0.19360438713819542, 'adx_thresh': 14.642694508584214, 'atr_min_pct': 0.010314829536203033, 'atr_max_pct': 0.0412404172783988, 'tp_mult': 2.498249133430861, 'tsl_mult': 0.31974703645598235, 'strategy': 'mean_reversion', 'time_stop': 90, 'use_sma': True, 'use_atr': True, 'use_adx': False, 'use_ema': True, 'use_spike': False, 'rsi_required': True, 'edge_k': 0.3397578182021544, 'edge_cap': 0.22895119935421274, 'bull_strategy': 'mean_reversion', 'bull_bb_std_mult': 0.6852381510926451, 'bull_rsi_os': 5, 'bull_rsi_ob': 77, 'bull_adx_thresh': 8.76654147926298, 'bull_atr_min_pct': 0.021636077407839092, 'bull_atr_max_pct': 0.10390175319853125, 'bull_tp_mult': 1.5178961255121226, 'bull_tsl_mult': 0.30422651974010967, 'bull_time_stop': 300, 'bull_use_sma': False, 'bull_use_ema': False, 'bull_use_atr': True, 'bull_use_adx': True, 'bull_use_spike': False, 'bull_rsi_required': True, 'bear_strategy': 'mean_reversion', 'bear_bb_std_mult': 3.3488057541146383, 'bear_rsi_os': 45, 'bear_rsi_ob': 90, 'bear_adx_thresh': 34.172888804386986, 'bear_atr_min_pct': 0.008905581668490283, 'bear_atr_max_pct': 0.05839723982959801, 'bear_tp_mult': 2.972393024032113, 'bear_tsl_mult': 0.026918431862014987, 'bear_time_stop': 277, 'bear_use_sma': True, 'bear_use_ema': True, 'bear_use_atr': True, 'bear_use_adx': True, 'bear_use_spike': True, 'bear_rsi_required': False, 'sideways_strategy': 'breakout', 'sideways_bb_std_mult': 3.4031296233573656, 'sideways_rsi_os': 9, 'sideways_rsi_ob': 57, 'sideways_adx_thresh': 30.282642415519412, 'sideways_atr_min_pct': 0.022039698919948836, 'sideways_atr_max_pct': 0.0990178020717879, 'sideways_tp_mult': 1.9837963162424672, 'sideways_tsl_mult': 0.6661431279822824, 'sideways_time_stop': 155, 'sideways_use_sma': False, 'sideways_use_ema': False, 'sideways_use_atr': False, 'sideways_use_adx': False, 'sideways_use_spike': False, 'sideways_rsi_required': True}.
[I 2025-09-01 03:48:51,702] Trial 512 finished with values: [-0.01864392022307748, 0.01853852553285008] and parameters: {'p_sma': 19, 'p_std': 50, 'p_atr': 24, 'p_adx': 12, 'rsi_period': 9, 'ema1': 13, 'ema2': 50, 'slip_atr_k': 0.0012580150082451963, 'slip_spread_k': 0.01871126832781098, 'spread_hl_frac': 0.04494879525384874, 'bb_std_mult': 2.3309966039345893, 'rsi_os': 45, 'rsi_ob': 78, 'vol_spike': 0.19172636353344405, 'adx_thresh': 14.540253217258204, 'atr_min_pct': 0.011432649336506392, 'atr_max_pct': 0.04435526479993707, 'tp_mult': 2.499234639700937, 'tsl_mult': 0.30928223167546043, 'strategy': 'mean_reversion', 'time_stop': 95, 'use_sma': True, 'use_atr': True, 'use_adx': False, 'use_ema': True, 'use_spike': False, 'rsi_required': True, 'edge_k': 0.21101419357986062, 'edge_cap': 0.23151413773264917, 'bull_strategy': 'mean_reversion', 'bull_bb_std_mult': 0.6761288482093337, 'bull_rsi_os': 5, 'bull_rsi_ob': 77, 'bull_adx_thresh': 8.564009824281019, 'bull_atr_min_pct': 0.0008622510881503523, 'bull_atr_max_pct': 0.10183288153506424, 'bull_tp_mult': 1.513994737661127, 'bull_tsl_mult': 0.3036889612804002, 'bull_time_stop': 300, 'bull_use_sma': False, 'bull_use_ema': False, 'bull_use_atr': True, 'bull_use_adx': True, 'bull_use_spike': False, 'bull_rsi_required': True, 'bear_strategy': 'mean_reversion', 'bear_bb_std_mult': 3.3549750669746756, 'bear_rsi_os': 45, 'bear_rsi_ob': 78, 'bear_adx_thresh': 33.871855142358456, 'bear_atr_min_pct': 0.0034439168494915674, 'bear_atr_max_pct': 0.0599208802333124, 'bear_tp_mult': 2.9965754892383916, 'bear_tsl_mult': 0.008487800314757599, 'bear_time_stop': 253, 'bear_use_sma': True, 'bear_use_ema': True, 'bear_use_atr': True, 'bear_use_adx': True, 'bear_use_spike': False, 'bear_rsi_required': False, 'sideways_strategy': 'breakout', 'sideways_bb_std_mult': 3.4000851602805304, 'sideways_rsi_os': 9, 'sideways_rsi_ob': 57, 'sideways_adx_thresh': 31.572752011208078, 'sideways_atr_min_pct': 0.022695632891466616, 'sideways_atr_max_pct': 0.10005505556209082, 'sideways_tp_mult': 1.9771163559385103, 'sideways_tsl_mult': 0.6681556946813481, 'sideways_time_stop': 152, 'sideways_use_sma': False, 'sideways_use_ema': False, 'sideways_use_atr': False, 'sideways_use_adx': False, 'sideways_use_spike': False, 'sideways_rsi_required': True}.
[I 2025-09-01 03:49:37,186] Trial 517 finished with values: [-1000000000.0, 1000000000.0] and parameters: {'p_sma': 17, 'p_std': 51, 'p_atr': 25, 'p_adx': 10, 'rsi_period': 9, 'ema1': 12, 'ema2': 49, 'slip_atr_k': 0.002213000005982928, 'slip_spread_k': 0.03614490738144967, 'spread_hl_frac': 0.044112439430895434, 'bb_std_mult': 2.2701920120814014, 'rsi_os': 46, 'rsi_ob': 79, 'vol_spike': 0.18343241759298715, 'adx_thresh': 14.938161074726303, 'atr_min_pct': 0.011826618975542613, 'atr_max_pct': 0.04548974720615907, 'tp_mult': 2.519852824985918, 'tsl_mult': 0.29772145234488157, 'strategy': 'mean_reversion', 'time_stop': 88, 'use_sma': True, 'use_atr': False, 'use_adx': False, 'use_ema': True, 'use_spike': False, 'rsi_required': True, 'edge_k': 0.34629354415732594, 'edge_cap': 0.24868515802407157, 'bull_strategy': 'mean_reversion', 'bull_bb_std_mult': 0.7221969380343203, 'bull_rsi_os': 6, 'bull_rsi_ob': 78, 'bull_adx_thresh': 9.388903516869444, 'bull_atr_min_pct': 0.009275303814924911, 'bull_atr_max_pct': 0.10081035282812512, 'bull_tp_mult': 1.4744341937306635, 'bull_tsl_mult': 0.8557689545588618, 'bull_time_stop': 300, 'bull_use_sma': False, 'bull_use_ema': False, 'bull_use_atr': True, 'bull_use_adx': True, 'bull_use_spike': False, 'bull_rsi_required': True, 'bear_strategy': 'mean_reversion', 'bear_bb_std_mult': 3.279844440397754, 'bear_rsi_os': 44, 'bear_rsi_ob': 76, 'bear_adx_thresh': 33.37932177453026, 'bear_atr_min_pct': 0.008584082687736097, 'bear_atr_max_pct': 0.053946453651407704, 'bear_tp_mult': 2.944865377633581, 'bear_tsl_mult': 0.031791165863668425, 'bear_time_stop': 273, 'bear_use_sma': True, 'bear_use_ema': True, 'bear_use_atr': True, 'bear_use_adx': True, 'bear_use_spike': True, 'bear_rsi_required': False, 'sideways_strategy': 'breakout', 'sideways_bb_std_mult': 3.4808173687973127, 'sideways_rsi_os': 8, 'sideways_rsi_ob': 61, 'sideways_adx_thresh': 30.057288814498232, 'sideways_atr_min_pct': 0.021855012914286907, 'sideways_atr_max_pct': 0.10258787586493728, 'sideways_tp_mult': 1.9670488386697476, 'sideways_tsl_mult': 0.7022524730440314, 'sideways_time_stop': 151, 'sideways_use_sma': False, 'sideways_use_ema': False, 'sideways_use_atr': False, 'sideways_use_adx': False, 'sideways_use_spike': False, 'sideways_rsi_required': False}.
[I 2025-09-01 03:49:37,440] Trial 515 finished with values: [-1000000000.0, 1000000000.0] and parameters: {'p_sma': 19, 'p_std': 51, 'p_atr': 24, 'p_adx': 10, 'rsi_period': 10, 'ema1': 13, 'ema2': 50, 'slip_atr_k': 0.0014895715523099088, 'slip_spread_k': 0.03516670743474955, 'spread_hl_frac': 0.04508690931926018, 'bb_std_mult': 2.334244814663468, 'rsi_os': 45, 'rsi_ob': 79, 'vol_spike': 0.18767424904946206, 'adx_thresh': 14.933399006758894, 'atr_min_pct': 0.010331030205587812, 'atr_max_pct': 0.045445769950911506, 'tp_mult': 2.4315439344890675, 'tsl_mult': 0.3148400394560085, 'strategy': 'mean_reversion', 'time_stop': 89, 'use_sma': True, 'use_atr': False, 'use_adx': False, 'use_ema': True, 'use_spike': False, 'rsi_required': True, 'edge_k': 0.35012036854618633, 'edge_cap': 0.2053967746928709, 'bull_strategy': 'mean_reversion', 'bull_bb_std_mult': 0.6950863502289125, 'bull_rsi_os': 5, 'bull_rsi_ob': 76, 'bull_adx_thresh': 9.152184786311725, 'bull_atr_min_pct': 0.024371828813433333, 'bull_atr_max_pct': 0.10554639787524907, 'bull_tp_mult': 1.506347558192867, 'bull_tsl_mult': 0.29418985229183897, 'bull_time_stop': 297, 'bull_use_sma': False, 'bull_use_ema': False, 'bull_use_atr': True, 'bull_use_adx': True, 'bull_use_spike': False, 'bull_rsi_required': True, 'bear_strategy': 'mean_reversion', 'bear_bb_std_mult': 3.2789020169817253, 'bear_rsi_os': 44, 'bear_rsi_ob': 78, 'bear_adx_thresh': 34.435426768882486, 'bear_atr_min_pct': 0.008778501562384142, 'bear_atr_max_pct': 0.05739295359214207, 'bear_tp_mult': 2.933421159067576, 'bear_tsl_mult': 0.00017432938543671117, 'bear_time_stop': 273, 'bear_use_sma': True, 'bear_use_ema': True, 'bear_use_atr': True, 'bear_use_adx': True, 'bear_use_spike': True, 'bear_rsi_required': False, 'sideways_strategy': 'breakout', 'sideways_bb_std_mult': 3.4792874371540394, 'sideways_rsi_os': 9, 'sideways_rsi_ob': 57, 'sideways_adx_thresh': 30.19862021123395, 'sideways_atr_min_pct': 0.0218124093906333, 'sideways_atr_max_pct': 0.10003096362121718, 'sideways_tp_mult': 1.9805123598258623, 'sideways_tsl_mult': 0.7146796204756578, 'sideways_time_stop': 152, 'sideways_use_sma': False, 'sideways_use_ema': False, 'sideways_use_atr': False, 'sideways_use_adx': False, 'sideways_use_spike': False, 'sideways_rsi_required': True}.
[I 2025-09-01 03:49:37,882] Trial 516 finished with values: [-1000000000.0, 1000000000.0] and parameters: {'p_sma': 19, 'p_std': 51, 'p_atr': 24, 'p_adx': 10, 'rsi_period': 9, 'ema1': 12, 'ema2': 49, 'slip_atr_k': 0.0021610809093123295, 'slip_spread_k': 0.040453038790851485, 'spread_hl_frac': 0.045423153600801305, 'bb_std_mult': 2.304024060244606, 'rsi_os': 46, 'rsi_ob': 79, 'vol_spike': 0.18694785660504581, 'adx_thresh': 14.68351605162895, 'atr_min_pct': 0.010300779826560386, 'atr_max_pct': 0.044674673480274193, 'tp_mult': 2.5148024471963746, 'tsl_mult': 0.3194130332869383, 'strategy': 'mean_reversion', 'time_stop': 89, 'use_sma': True, 'use_atr': False, 'use_adx': False, 'use_ema': True, 'use_spike': False, 'rsi_required': True, 'edge_k': 0.34829648540101793, 'edge_cap': 0.20873802814832754, 'bull_strategy': 'mean_reversion', 'bull_bb_std_mult': 0.7129410509754828, 'bull_rsi_os': 5, 'bull_rsi_ob': 76, 'bull_adx_thresh': 9.20781000216053, 'bull_atr_min_pct': 0.012749893883115385, 'bull_atr_max_pct': 0.10135433526866328, 'bull_tp_mult': 1.4988491607475571, 'bull_tsl_mult': 0.29664747436849026, 'bull_time_stop': 298, 'bull_use_sma': False, 'bull_use_ema': False, 'bull_use_atr': True, 'bull_use_adx': True, 'bull_use_spike': False, 'bull_rsi_required': True, 'bear_strategy': 'mean_reversion', 'bear_bb_std_mult': 3.285744112626604, 'bear_rsi_os': 44, 'bear_rsi_ob': 46, 'bear_adx_thresh': 33.46671375104771, 'bear_atr_min_pct': 0.008578984110570297, 'bear_atr_max_pct': 0.05382531300795167, 'bear_tp_mult': 2.9348546089372842, 'bear_tsl_mult': 0.002445663108565921, 'bear_time_stop': 276, 'bear_use_sma': True, 'bear_use_ema': True, 'bear_use_atr': True, 'bear_use_adx': True, 'bear_use_spike': True, 'bear_rsi_required': False, 'sideways_strategy': 'breakout', 'sideways_bb_std_mult': 3.4879974255653816, 'sideways_rsi_os': 9, 'sideways_rsi_ob': 57, 'sideways_adx_thresh': 30.29655346524189, 'sideways_atr_min_pct': 0.02187502071251035, 'sideways_atr_max_pct': 0.10077537874853588, 'sideways_tp_mult': 1.9629732682913685, 'sideways_tsl_mult': 0.7025028143308686, 'sideways_time_stop': 152, 'sideways_use_sma': False, 'sideways_use_ema': False, 'sideways_use_atr': False, 'sideways_use_adx': False, 'sideways_use_spike': False, 'sideways_rsi_required': True}.
[I 2025-09-01 03:49:38,098] Trial 518 finished with values: [-1000000000.0, 1000000000.0] and parameters: {'p_sma': 18, 'p_std': 52, 'p_atr': 25, 'p_adx': 10, 'rsi_period': 9, 'ema1': 12, 'ema2': 49, 'slip_atr_k': 0.006639481176043079, 'slip_spread_k': 0.0343947367249653, 'spread_hl_frac': 0.04408457549360208, 'bb_std_mult': 2.40091059071862, 'rsi_os': 46, 'rsi_ob': 79, 'vol_spike': 0.18424976751648095, 'adx_thresh': 14.977247154889568, 'atr_min_pct': 0.010119947190202457, 'atr_max_pct': 0.07533335994419527, 'tp_mult': 2.5335423028484314, 'tsl_mult': 0.2967767873935484, 'strategy': 'breakout', 'time_stop': 85, 'use_sma': True, 'use_atr': False, 'use_adx': False, 'use_ema': True, 'use_spike': False, 'rsi_required': True, 'edge_k': 0.35555011009079435, 'edge_cap': 0.20385013286891163, 'bull_strategy': 'mean_reversion', 'bull_bb_std_mult': 0.7458795608944441, 'bull_rsi_os': 6, 'bull_rsi_ob': 78, 'bull_adx_thresh': 9.345813010786566, 'bull_atr_min_pct': 0.00909227078727851, 'bull_atr_max_pct': 0.10716129444938213, 'bull_tp_mult': 1.361424574278571, 'bull_tsl_mult': 0.2801941796750751, 'bull_time_stop': 300, 'bull_use_sma': False, 'bull_use_ema': False, 'bull_use_atr': True, 'bull_use_adx': True, 'bull_use_spike': False, 'bull_rsi_required': True, 'bear_strategy': 'mean_reversion', 'bear_bb_std_mult': 3.2624622518946866, 'bear_rsi_os': 44, 'bear_rsi_ob': 76, 'bear_adx_thresh': 33.37331677157891, 'bear_atr_min_pct': 0.00864847627451777, 'bear_atr_max_pct': 0.054761789205565486, 'bear_tp_mult': 2.9167368046190485, 'bear_tsl_mult': 0.03684522126460622, 'bear_time_stop': 271, 'bear_use_sma': True, 'bear_use_ema': True, 'bear_use_atr': True, 'bear_use_adx': True, 'bear_use_spike': True, 'bear_rsi_required': False, 'sideways_strategy': 'breakout', 'sideways_bb_std_mult': 3.490767150573273, 'sideways_rsi_os': 8, 'sideways_rsi_ob': 62, 'sideways_adx_thresh': 30.154802353250417, 'sideways_atr_min_pct': 0.02189308477650326, 'sideways_atr_max_pct': 0.10718236095850285, 'sideways_tp_mult': 1.9440923623458837, 'sideways_tsl_mult': 0.7072687873493614, 'sideways_time_stop': 153, 'sideways_use_sma': False, 'sideways_use_ema': False, 'sideways_use_atr': False, 'sideways_use_adx': False, 'sideways_use_spike': False, 'sideways_rsi_required': False}.
[I 2025-09-01 03:50:27,249] Trial 519 finished with values: [-1000000000.0, 1000000000.0] and parameters: {'p_sma': 15, 'p_std': 52, 'p_atr': 25, 'p_adx': 11, 'rsi_period': 9, 'ema1': 12, 'ema2': 51, 'slip_atr_k': 0.006510590965141182, 'slip_spread_k': 0.04637399618827692, 'spread_hl_frac': 0.04411274730643544, 'bb_std_mult': 2.380998990859701, 'rsi_os': 43, 'rsi_ob': 79, 'vol_spike': 0.187444664578239, 'adx_thresh': 13.749301002005758, 'atr_min_pct': 0.010134967227725597, 'atr_max_pct': 0.048082502891184604, 'tp_mult': 2.530355328001754, 'tsl_mult': 0.2378739410240273, 'strategy': 'breakout', 'time_stop': 74, 'use_sma': True, 'use_atr': False, 'use_adx': False, 'use_ema': True, 'use_spike': False, 'rsi_required': True, 'edge_k': 0.4407279486713006, 'edge_cap': 0.2638088160295138, 'bull_strategy': 'mean_reversion', 'bull_bb_std_mult': 0.7646158519422149, 'bull_rsi_os': 6, 'bull_rsi_ob': 78, 'bull_adx_thresh': 8.714353712911807, 'bull_atr_min_pct': 0.013931498574371756, 'bull_atr_max_pct': 0.10780403829439526, 'bull_tp_mult': 1.4570480760217728, 'bull_tsl_mult': 0.2769278881222609, 'bull_time_stop': 292, 'bull_use_sma': False, 'bull_use_ema': True, 'bull_use_atr': True, 'bull_use_adx': True, 'bull_use_spike': False, 'bull_rsi_required': True, 'bear_strategy': 'mean_reversion', 'bear_bb_std_mult': 3.4372583096250913, 'bear_rsi_os': 46, 'bear_rsi_ob': 53, 'bear_adx_thresh': 32.64519711095374, 'bear_atr_min_pct': 0.00914418846920915, 'bear_atr_max_pct': 0.05376406721263869, 'bear_tp_mult': 2.8672714576952787, 'bear_tsl_mult': 0.03789504386678404, 'bear_time_stop': 270, 'bear_use_sma': True, 'bear_use_ema': True, 'bear_use_atr': True, 'bear_use_adx': True, 'bear_use_spike': True, 'bear_rsi_required': False, 'sideways_strategy': 'breakout', 'sideways_bb_std_mult': 3.5194314900279076, 'sideways_rsi_os': 11, 'sideways_rsi_ob': 62, 'sideways_adx_thresh': 30.862269990305155, 'sideways_atr_min_pct': 0.022956429108001636, 'sideways_atr_max_pct': 0.10659368704003463, 'sideways_tp_mult': 2.0260881764441314, 'sideways_tsl_mult': 0.7062591937185425, 'sideways_time_stop': 156, 'sideways_use_sma': False, 'sideways_use_ema': False, 'sideways_use_atr': False, 'sideways_use_adx': True, 'sideways_use_spike': False, 'sideways_rsi_required': False}.
[I 2025-09-01 03:50:27,706] Trial 522 finished with values: [-1000000000.0, 1000000000.0] and parameters: {'p_sma': 17, 'p_std': 52, 'p_atr': 25, 'p_adx': 11, 'rsi_period': 9, 'ema1': 13, 'ema2': 51, 'slip_atr_k': 0.007655802485668113, 'slip_spread_k': 0.018511361873072764, 'spread_hl_frac': 0.04355411856723836, 'bb_std_mult': 2.419149501492627, 'rsi_os': 43, 'rsi_ob': 80, 'vol_spike': 0.19541577925702291, 'adx_thresh': 13.625927687407462, 'atr_min_pct': 0.011014149500302722, 'atr_max_pct': 0.04760614939289033, 'tp_mult': 2.479721251206183, 'tsl_mult': 0.28642269283484423, 'strategy': 'breakout', 'time_stop': 103, 'use_sma': True, 'use_atr': False, 'use_adx': False, 'use_ema': True, 'use_spike': False, 'rsi_required': True, 'edge_k': 0.4212817211672602, 'edge_cap': 0.26253072467335914, 'bull_strategy': 'mean_reversion', 'bull_bb_std_mult': 0.8085579842786182, 'bull_rsi_os': 6, 'bull_rsi_ob': 78, 'bull_adx_thresh': 8.483075776502172, 'bull_atr_min_pct': 0.0010322920357399472, 'bull_atr_max_pct': 0.10882015308813558, 'bull_tp_mult': 1.4791437919513164, 'bull_tsl_mult': 0.6356067389652017, 'bull_time_stop': 294, 'bull_use_sma': False, 'bull_use_ema': True, 'bull_use_atr': True, 'bull_use_adx': True, 'bull_use_spike': False, 'bull_rsi_required': True, 'bear_strategy': 'mean_reversion', 'bear_bb_std_mult': 3.4170562668116835, 'bear_rsi_os': 46, 'bear_rsi_ob': 86, 'bear_adx_thresh': 32.7740602070871, 'bear_atr_min_pct': 0.009261616477376083, 'bear_atr_max_pct': 0.04828054467703379, 'bear_tp_mult': 2.873387966597849, 'bear_tsl_mult': 0.04118006175533233, 'bear_time_stop': 267, 'bear_use_sma': True, 'bear_use_ema': True, 'bear_use_atr': True, 'bear_use_adx': True, 'bear_use_spike': False, 'bear_rsi_required': False, 'sideways_strategy': 'mean_reversion', 'sideways_bb_std_mult': 3.3233664047874547, 'sideways_rsi_os': 11, 'sideways_rsi_ob': 59, 'sideways_adx_thresh': 10.653096823990426, 'sideways_atr_min_pct': 0.022883411001714465, 'sideways_atr_max_pct': 0.1036565453925105, 'sideways_tp_mult': 2.025653707176183, 'sideways_tsl_mult': 0.732666417517595, 'sideways_time_stop': 159, 'sideways_use_sma': False, 'sideways_use_ema': False, 'sideways_use_atr': False, 'sideways_use_adx': True, 'sideways_use_spike': False, 'sideways_rsi_required': True}.
[I 2025-09-01 03:50:28,291] Trial 521 finished with values: [-1000000000.0, 1000000000.0] and parameters: {'p_sma': 15, 'p_std': 49, 'p_atr': 25, 'p_adx': 11, 'rsi_period': 9, 'ema1': 12, 'ema2': 51, 'slip_atr_k': 0.006822514911223938, 'slip_spread_k': 0.05112942706490168, 'spread_hl_frac': 0.04388844626843573, 'bb_std_mult': 2.4062042202940876, 'rsi_os': 43, 'rsi_ob': 80, 'vol_spike': 0.19371107921695124, 'adx_thresh': 13.942997901554218, 'atr_min_pct': 0.009979746846936876, 'atr_max_pct': 0.04798993393998157, 'tp_mult': 2.526649342854409, 'tsl_mult': 0.28897922361797124, 'strategy': 'breakout', 'time_stop': 84, 'use_sma': True, 'use_atr': False, 'use_adx': False, 'use_ema': True, 'use_spike': False, 'rsi_required': True, 'edge_k': 0.4218144408309542, 'edge_cap': 0.2583748223876122, 'bull_strategy': 'mean_reversion', 'bull_bb_std_mult': 0.7782929781707119, 'bull_rsi_os': 6, 'bull_rsi_ob': 78, 'bull_adx_thresh': 8.37587950380629, 'bull_atr_min_pct': 0.0140228607806557, 'bull_atr_max_pct': 0.10866624057445884, 'bull_tp_mult': 1.3598898782782123, 'bull_tsl_mult': 0.2767559210937958, 'bull_time_stop': 291, 'bull_use_sma': False, 'bull_use_ema': True, 'bull_use_atr': True, 'bull_use_adx': True, 'bull_use_spike': False, 'bull_rsi_required': True, 'bear_strategy': 'mean_reversion', 'bear_bb_std_mult': 3.4560974537169877, 'bear_rsi_os': 46, 'bear_rsi_ob': 88, 'bear_adx_thresh': 32.81606785584151, 'bear_atr_min_pct': 0.008276497974219177, 'bear_atr_max_pct': 0.050223089672511996, 'bear_tp_mult': 2.853057807730712, 'bear_tsl_mult': 0.030911619509924708, 'bear_time_stop': 268, 'bear_use_sma': True, 'bear_use_ema': True, 'bear_use_atr': True, 'bear_use_adx': True, 'bear_use_spike': True, 'bear_rsi_required': False, 'sideways_strategy': 'mean_reversion', 'sideways_bb_std_mult': 3.531220670965182, 'sideways_rsi_os': 10, 'sideways_rsi_ob': 62, 'sideways_adx_thresh': 30.841463035813668, 'sideways_atr_min_pct': 0.0224364384542547, 'sideways_atr_max_pct': 0.10560009208771319, 'sideways_tp_mult': 1.94130124822597, 'sideways_tsl_mult': 0.7367971668889701, 'sideways_time_stop': 157, 'sideways_use_sma': False, 'sideways_use_ema': False, 'sideways_use_atr': False, 'sideways_use_adx': True, 'sideways_use_spike': False, 'sideways_rsi_required': False}.
