[I 2025-09-01 03:01:35,737] Trial 235 finished with values: [-0.020016669214242055, 0.019925893998480968] and parameters: {'p_sma': 47, 'p_std': 58, 'p_atr': 28, 'p_adx': 17, 'rsi_period': 13, 'ema1': 20, 'ema2': 57, 'slip_atr_k': 0.02943075497595518, 'slip_spread_k': 0.174433346916025, 'spread_hl_frac': 0.034467675905367035, 'bb_std_mult': 1.4571016875272103, 'rsi_os': 25, 'rsi_ob': 74, 'vol_spike': 0.20521667608817765, 'adx_thresh': 14.107522053244363, 'atr_min_pct': 0.008069920331517409, 'atr_max_pct': 0.04972513555683288, 'tp_mult': 1.4923627403590443, 'tsl_mult': 0.36883376558551856, 'strategy': 'mean_reversion', 'time_stop': 137, 'use_sma': True, 'use_atr': True, 'use_adx': True, 'use_ema': False, 'use_spike': True, 'rsi_required': False, 'edge_k': 0.16179182637335773, 'edge_cap': 0.4728468187145711, 'bull_strategy': 'breakout', 'bull_bb_std_mult': 1.1180651643538206, 'bull_rsi_os': 15, 'bull_rsi_ob': 55, 'bull_adx_thresh': 10.888613848904138, 'bull_atr_min_pct': 0.0014068290880362966, 'bull_atr_max_pct': 0.11733466724841968, 'bull_tp_mult': 1.2590339779516873, 'bull_tsl_mult': 0.18431519580941338, 'bull_time_stop': 262, 'bull_use_sma': True, 'bull_use_ema': False, 'bull_use_atr': False, 'bull_use_adx': False, 'bull_use_spike': True, 'bull_rsi_required': False, 'bear_strategy': 'mean_reversion', 'bear_bb_std_mult': 2.00997844508816, 'bear_rsi_os': 51, 'bear_rsi_ob': 59, 'bear_adx_thresh': 13.076395558395792, 'bear_atr_min_pct': 0.028164417650978605, 'bear_atr_max_pct': 0.022014090513248333, 'bear_tp_mult': 1.0103834468434019, 'bear_tsl_mult': 0.5826012954881533, 'bear_time_stop': 71, 'bear_use_sma': False, 'bear_use_ema': False, 'bear_use_atr': False, 'bear_use_adx': False, 'bear_use_spike': True, 'bear_rsi_required': True, 'sideways_strategy': 'breakout', 'sideways_bb_std_mult': 0.5927329067300893, 'sideways_rsi_os': 54, 'sideways_rsi_ob': 45, 'sideways_adx_thresh': 22.56823570543709, 'sideways_atr_min_pct': 0.02721244634215225, 'sideways_atr_max_pct': 0.04096933707683187, 'sideways_tp_mult': 1.7483979560276186, 'sideways_tsl_mult': 0.17710024638386335, 'sideways_time_stop': 117, 'sideways_use_sma': True, 'sideways_use_ema': True, 'sideways_use_atr': False, 'sideways_use_adx': False, 'sideways_use_spike': True, 'sideways_rsi_required': True}.
[I 2025-09-01 03:01:36,016] Trial 234 finished with values: [-0.028232606237853175, 0.028044445194830007] and parameters: {'p_sma': 47, 'p_std': 58, 'p_atr': 28, 'p_adx': 17, 'rsi_period': 13, 'ema1': 20, 'ema2': 57, 'slip_atr_k': 0.19590975719191736, 'slip_spread_k': 0.1048814876432641, 'spread_hl_frac': 0.028246870031212006, 'bb_std_mult': 1.4349388053320293, 'rsi_os': 24, 'rsi_ob': 94, 'vol_spike': 0.21543711545088928, 'adx_thresh': 8.637387049052691, 'atr_min_pct': 0.008096538139477411, 'atr_max_pct': 0.12903487420893053, 'tp_mult': 2.586400722467051, 'tsl_mult': 0.3742495154690479, 'strategy': 'mean_reversion', 'time_stop': 185, 'use_sma': True, 'use_atr': True, 'use_adx': True, 'use_ema': False, 'use_spike': True, 'rsi_required': False, 'edge_k': 0.1521615500150944, 'edge_cap': 0.4704537820160837, 'bull_strategy': 'breakout', 'bull_bb_std_mult': 2.522911631499398, 'bull_rsi_os': 15, 'bull_rsi_ob': 55, 'bull_adx_thresh': 11.433181060212833, 'bull_atr_min_pct': 0.0005059728611681388, 'bull_atr_max_pct': 0.11672475374715591, 'bull_tp_mult': 1.6159731888440871, 'bull_tsl_mult': 0.36143373721906186, 'bull_time_stop': 252, 'bull_use_sma': True, 'bull_use_ema': False, 'bull_use_atr': False, 'bull_use_adx': False, 'bull_use_spike': True, 'bull_rsi_required': False, 'bear_strategy': 'mean_reversion', 'bear_bb_std_mult': 1.9823418683360832, 'bear_rsi_os': 47, 'bear_rsi_ob': 59, 'bear_adx_thresh': 17.083690869438364, 'bear_atr_min_pct': 0.028201346748911955, 'bear_atr_max_pct': 0.03513469247766188, 'bear_tp_mult': 1.0137403183909086, 'bear_tsl_mult': 0.12225507410959494, 'bear_time_stop': 5, 'bear_use_sma': False, 'bear_use_ema': False, 'bear_use_atr': False, 'bear_use_adx': False, 'bear_use_spike': True, 'bear_rsi_required': True, 'sideways_strategy': 'breakout', 'sideways_bb_std_mult': 1.8381702112344755, 'sideways_rsi_os': 50, 'sideways_rsi_ob': 88, 'sideways_adx_thresh': 22.62491437166866, 'sideways_atr_min_pct': 0.02711332340420204, 'sideways_atr_max_pct': 0.044740262179622695, 'sideways_tp_mult': 1.8281659812912514, 'sideways_tsl_mult': 0.18086194626260593, 'sideways_time_stop': 118, 'sideways_use_sma': True, 'sideways_use_ema': True, 'sideways_use_atr': False, 'sideways_use_adx': False, 'sideways_use_spike': True, 'sideways_rsi_required': True}.
[I 2025-09-01 03:02:20,723] Trial 237 finished with values: [-1000000000.0, 1000000000.0] and parameters: {'p_sma': 29, 'p_std': 58, 'p_atr': 28, 'p_adx': 17, 'rsi_period': 30, 'ema1': 21, 'ema2': 57, 'slip_atr_k': 0.03096992508104473, 'slip_spread_k': 0.09721134998669756, 'spread_hl_frac': 0.02323312205180275, 'bb_std_mult': 1.4365843684357813, 'rsi_os': 22, 'rsi_ob': 73, 'vol_spike': 0.2017950917583148, 'adx_thresh': 13.97241635351703, 'atr_min_pct': 0.006888566965574019, 'atr_max_pct': 0.04989547845575062, 'tp_mult': 1.487364208565971, 'tsl_mult': 0.36353750559782844, 'strategy': 'mean_reversion', 'time_stop': 149, 'use_sma': True, 'use_atr': False, 'use_adx': True, 'use_ema': False, 'use_spike': False, 'rsi_required': True, 'edge_k': 0.05878094346596321, 'edge_cap': 0.4658874898184266, 'bull_strategy': 'breakout', 'bull_bb_std_mult': 1.114569747824969, 'bull_rsi_os': 15, 'bull_rsi_ob': 56, 'bull_adx_thresh': 22.116973361597665, 'bull_atr_min_pct': 0.029959625161465917, 'bull_atr_max_pct': 0.11884942449123283, 'bull_tp_mult': 1.6333599858304597, 'bull_tsl_mult': 0.1794659848702111, 'bull_time_stop': 300, 'bull_use_sma': True, 'bull_use_ema': False, 'bull_use_atr': True, 'bull_use_adx': True, 'bull_use_spike': False, 'bull_rsi_required': False, 'bear_strategy': 'mean_reversion', 'bear_bb_std_mult': 2.0207137073015913, 'bear_rsi_os': 47, 'bear_rsi_ob': 59, 'bear_adx_thresh': 23.96784851473981, 'bear_atr_min_pct': 0.02636825710168385, 'bear_atr_max_pct': 0.03405129986253341, 'bear_tp_mult': 1.0166788640999649, 'bear_tsl_mult': 0.14447027614926972, 'bear_time_stop': 152, 'bear_use_sma': False, 'bear_use_ema': False, 'bear_use_atr': False, 'bear_use_adx': False, 'bear_use_spike': True, 'bear_rsi_required': False, 'sideways_strategy': 'breakout', 'sideways_bb_std_mult': 3.4909165596123044, 'sideways_rsi_os': 52, 'sideways_rsi_ob': 45, 'sideways_adx_thresh': 22.568913985463052, 'sideways_atr_min_pct': 0.02767892359177524, 'sideways_atr_max_pct': 0.04469080099790762, 'sideways_tp_mult': 1.5765895254882325, 'sideways_tsl_mult': 0.19506582394302108, 'sideways_time_stop': 111, 'sideways_use_sma': True, 'sideways_use_ema': True, 'sideways_use_atr': False, 'sideways_use_adx': False, 'sideways_use_spike': False, 'sideways_rsi_required': True}.
[I 2025-09-01 03:02:21,074] Trial 238 finished with values: [-1000000000.0, 1000000000.0] and parameters: {'p_sma': 9, 'p_std': 58, 'p_atr': 28, 'p_adx': 17, 'rsi_period': 12, 'ema1': 12, 'ema2': 13, 'slip_atr_k': 0.19494909922666592, 'slip_spread_k': 0.18512568167940066, 'spread_hl_frac': 0.02801374994588912, 'bb_std_mult': 1.4548815246380482, 'rsi_os': 22, 'rsi_ob': 74, 'vol_spike': 0.20540640347911218, 'adx_thresh': 13.913284993370203, 'atr_min_pct': 0.008395172984719, 'atr_max_pct': 0.052218933918388784, 'tp_mult': 2.701693165834499, 'tsl_mult': 0.366550702676773, 'strategy': 'mean_reversion', 'time_stop': 165, 'use_sma': True, 'use_atr': False, 'use_adx': True, 'use_ema': False, 'use_spike': False, 'rsi_required': True, 'edge_k': 0.05849900878908348, 'edge_cap': 0.44705265253199633, 'bull_strategy': 'breakout', 'bull_bb_std_mult': 1.1113874512148216, 'bull_rsi_os': 39, 'bull_rsi_ob': 52, 'bull_adx_thresh': 22.053797209877263, 'bull_atr_min_pct': 0.0005588579729523409, 'bull_atr_max_pct': 0.1178632504381296, 'bull_tp_mult': 1.622899896110906, 'bull_tsl_mult': 0.23999841798188337, 'bull_time_stop': 271, 'bull_use_sma': True, 'bull_use_ema': False, 'bull_use_atr': True, 'bull_use_adx': True, 'bull_use_spike': True, 'bull_rsi_required': False, 'bear_strategy': 'mean_reversion', 'bear_bb_std_mult': 2.211111867394762, 'bear_rsi_os': 52, 'bear_rsi_ob': 59, 'bear_adx_thresh': 24.04494564422474, 'bear_atr_min_pct': 0.026361706423012717, 'bear_atr_max_pct': 0.03462992395713433, 'bear_tp_mult': 1.0830306591408068, 'bear_tsl_mult': 0.14383121929658677, 'bear_time_stop': 70, 'bear_use_sma': False, 'bear_use_ema': False, 'bear_use_atr': False, 'bear_use_adx': False, 'bear_use_spike': True, 'bear_rsi_required': False, 'sideways_strategy': 'breakout', 'sideways_bb_std_mult': 1.805963138747971, 'sideways_rsi_os': 54, 'sideways_rsi_ob': 45, 'sideways_adx_thresh': 22.463794150628242, 'sideways_atr_min_pct': 0.027558356131035598, 'sideways_atr_max_pct': 0.014428327911259609, 'sideways_tp_mult': 1.5722460771353641, 'sideways_tsl_mult': 0.2068431899157901, 'sideways_time_stop': 111, 'sideways_use_sma': True, 'sideways_use_ema': True, 'sideways_use_atr': False, 'sideways_use_adx': False, 'sideways_use_spike': False, 'sideways_rsi_required': True}.
[I 2025-09-01 03:02:21,539] Trial 239 finished with values: [-1000000000.0, 1000000000.0] and parameters: {'p_sma': 10, 'p_std': 60, 'p_atr': 11, 'p_adx': 18, 'rsi_period': 84, 'ema1': 21, 'ema2': 13, 'slip_atr_k': 0.20793651885710204, 'slip_spread_k': 0.18282112200184775, 'spread_hl_frac': 0.030806056086490077, 'bb_std_mult': 2.769153508452135, 'rsi_os': 22, 'rsi_ob': 92, 'vol_spike': 0.2027829130260248, 'adx_thresh': 14.073293925663245, 'atr_min_pct': 0.006920164352370707, 'atr_max_pct': 0.05005290471341495, 'tp_mult': 1.378560688070133, 'tsl_mult': 0.3667848558765993, 'strategy': 'mean_reversion', 'time_stop': 151, 'use_sma': False, 'use_atr': False, 'use_adx': True, 'use_ema': False, 'use_spike': False, 'rsi_required': True, 'edge_k': 0.06317996668442802, 'edge_cap': 0.4465956922070638, 'bull_strategy': 'breakout', 'bull_bb_std_mult': 1.120645769858238, 'bull_rsi_os': 40, 'bull_rsi_ob': 53, 'bull_adx_thresh': 22.393724410377615, 'bull_atr_min_pct': 0.0012917697919313934, 'bull_atr_max_pct': 0.11194386252221969, 'bull_tp_mult': 1.2123063220755221, 'bull_tsl_mult': 0.24941436139083353, 'bull_time_stop': 291, 'bull_use_sma': True, 'bull_use_ema': False, 'bull_use_atr': True, 'bull_use_adx': True, 'bull_use_spike': True, 'bull_rsi_required': False, 'bear_strategy': 'mean_reversion', 'bear_bb_std_mult': 2.0662780072811855, 'bear_rsi_os': 51, 'bear_rsi_ob': 60, 'bear_adx_thresh': 23.831341422182387, 'bear_atr_min_pct': 0.029097903238372587, 'bear_atr_max_pct': 0.01328089934735748, 'bear_tp_mult': 1.0872959280552075, 'bear_tsl_mult': 0.5894731051158212, 'bear_time_stop': 66, 'bear_use_sma': False, 'bear_use_ema': False, 'bear_use_atr': False, 'bear_use_adx': False, 'bear_use_spike': True, 'bear_rsi_required': False, 'sideways_strategy': 'breakout', 'sideways_bb_std_mult': 3.3173177781092624, 'sideways_rsi_os': 55, 'sideways_rsi_ob': 77, 'sideways_adx_thresh': 20.264339685883147, 'sideways_atr_min_pct': 0.027634746038353513, 'sideways_atr_max_pct': 0.01827566045594948, 'sideways_tp_mult': 1.5821859438148227, 'sideways_tsl_mult': 0.2082936322843404, 'sideways_time_stop': 140, 'sideways_use_sma': True, 'sideways_use_ema': True, 'sideways_use_atr': False, 'sideways_use_adx': False, 'sideways_use_spike': False, 'sideways_rsi_required': True}.
[I 2025-09-01 03:02:21,838] Trial 236 finished with values: [-1000000000.0, 1000000000.0] and parameters: {'p_sma': 29, 'p_std': 60, 'p_atr': 28, 'p_adx': 17, 'rsi_period': 13, 'ema1': 21, 'ema2': 46, 'slip_atr_k': 0.2210188090448059, 'slip_spread_k': 0.17667990172133224, 'spread_hl_frac': 0.024020615139690275, 'bb_std_mult': 2.7686171325840436, 'rsi_os': 24, 'rsi_ob': 80, 'vol_spike': 0.20529579482563023, 'adx_thresh': 14.549882003614051, 'atr_min_pct': 0.008120912087377521, 'atr_max_pct': 0.12957570780467592, 'tp_mult': 1.4720820554006289, 'tsl_mult': 0.36775771375042327, 'strategy': 'mean_reversion', 'time_stop': 138, 'use_sma': True, 'use_atr': True, 'use_adx': True, 'use_ema': False, 'use_spike': True, 'rsi_required': False, 'edge_k': 0.1597933404198077, 'edge_cap': 0.464503718442877, 'bull_strategy': 'breakout', 'bull_bb_std_mult': 1.1100299514161824, 'bull_rsi_os': 39, 'bull_rsi_ob': 55, 'bull_adx_thresh': 22.46773452210677, 'bull_atr_min_pct': 0.001361590494206269, 'bull_atr_max_pct': 0.022614716137301975, 'bull_tp_mult': 1.641595425564101, 'bull_tsl_mult': 0.3602793383033782, 'bull_time_stop': 261, 'bull_use_sma': True, 'bull_use_ema': False, 'bull_use_atr': False, 'bull_use_adx': False, 'bull_use_spike': True, 'bull_rsi_required': False, 'bear_strategy': 'mean_reversion', 'bear_bb_std_mult': 2.210103090928003, 'bear_rsi_os': 47, 'bear_rsi_ob': 59, 'bear_adx_thresh': 16.906171661321235, 'bear_atr_min_pct': 0.02861456923700375, 'bear_atr_max_pct': 0.03362770664787704, 'bear_tp_mult': 1.0112139853382667, 'bear_tsl_mult': 0.14147125325869733, 'bear_time_stop': 68, 'bear_use_sma': False, 'bear_use_ema': False, 'bear_use_atr': False, 'bear_use_adx': False, 'bear_use_spike': True, 'bear_rsi_required': True, 'sideways_strategy': 'breakout', 'sideways_bb_std_mult': 1.7963656104531671, 'sideways_rsi_os': 55, 'sideways_rsi_ob': 77, 'sideways_adx_thresh': 18.962157662182694, 'sideways_atr_min_pct': 0.027235779334662254, 'sideways_atr_max_pct': 0.0146521019036093, 'sideways_tp_mult': 1.825336499637104, 'sideways_tsl_mult': 0.17539944906084984, 'sideways_time_stop': 118, 'sideways_use_sma': True, 'sideways_use_ema': True, 'sideways_use_atr': False, 'sideways_use_adx': False, 'sideways_use_spike': True, 'sideways_rsi_required': True}.
[I 2025-09-01 03:03:03,665] Trial 243 finished with values: [-1000000000.0, 1000000000.0] and parameters: {'p_sma': 25, 'p_std': 56, 'p_atr': 29, 'p_adx': 23, 'rsi_period': 39, 'ema1': 19, 'ema2': 38, 'slip_atr_k': 0.23075621122435958, 'slip_spread_k': 0.1557148954518906, 'spread_hl_frac': 0.027128969598722925, 'bb_std_mult': 2.009803782118651, 'rsi_os': 17, 'rsi_ob': 91, 'vol_spike': 0.03550059696985279, 'adx_thresh': 7.139247406125547, 'atr_min_pct': 0.007284413865687275, 'atr_max_pct': 0.06299668069043948, 'tp_mult': 2.7229813512339183, 'tsl_mult': 0.4809000195433544, 'strategy': 'mean_reversion', 'time_stop': 190, 'use_sma': False, 'use_atr': False, 'use_adx': True, 'use_ema': True, 'use_spike': True, 'rsi_required': False, 'edge_k': 0.04397781419593959, 'edge_cap': 0.9211914952504352, 'bull_strategy': 'breakout', 'bull_bb_std_mult': 2.6855564430684926, 'bull_rsi_os': 16, 'bull_rsi_ob': 52, 'bull_adx_thresh': 25.010553408320273, 'bull_atr_min_pct': 0.0079843734557428, 'bull_atr_max_pct': 0.06196395288539018, 'bull_tp_mult': 2.302698710285062, 'bull_tsl_mult': 0.3017436113856674, 'bull_time_stop': 287, 'bull_use_sma': True, 'bull_use_ema': True, 'bull_use_atr': False, 'bull_use_adx': False, 'bull_use_spike': True, 'bull_rsi_required': False, 'bear_strategy': 'breakout', 'bear_bb_std_mult': 1.901567999076415, 'bear_rsi_os': 52, 'bear_rsi_ob': 56, 'bear_adx_thresh': 25.835152559405255, 'bear_atr_min_pct': 0.027760077964985693, 'bear_atr_max_pct': 0.017229523983951747, 'bear_tp_mult': 2.120529198366491, 'bear_tsl_mult': 0.17572221795333165, 'bear_time_stop': 75, 'bear_use_sma': False, 'bear_use_ema': False, 'bear_use_atr': True, 'bear_use_adx': False, 'bear_use_spike': False, 'bear_rsi_required': True, 'sideways_strategy': 'mean_reversion', 'sideways_bb_std_mult': 1.183630841316194, 'sideways_rsi_os': 45, 'sideways_rsi_ob': 76, 'sideways_adx_thresh': 27.122092366052236, 'sideways_atr_min_pct': 0.02655495667652222, 'sideways_atr_max_pct': 0.026293629808381305, 'sideways_tp_mult': 1.7334991110505535, 'sideways_tsl_mult': 0.19824779831562922, 'sideways_time_stop': 134, 'sideways_use_sma': True, 'sideways_use_ema': False, 'sideways_use_atr': True, 'sideways_use_adx': False, 'sideways_use_spike': True, 'sideways_rsi_required': True}.
[I 2025-09-01 03:03:03,694] Trial 242 finished with values: [-1000000000.0, 1000000000.0] and parameters: {'p_sma': 54, 'p_std': 55, 'p_atr': 27, 'p_adx': 18, 'rsi_period': 13, 'ema1': 21, 'ema2': 55, 'slip_atr_k': 0.02828341327065776, 'slip_spread_k': 0.15558892967316215, 'spread_hl_frac': 0.027333879421918457, 'bb_std_mult': 0.7376295842590292, 'rsi_os': 19, 'rsi_ob': 82, 'vol_spike': 0.03553705863232748, 'adx_thresh': 6.5521756850322435, 'atr_min_pct': 0.007397306356384593, 'atr_max_pct': 0.14650689565341746, 'tp_mult': 2.796800598409039, 'tsl_mult': 0.40560775181120146, 'strategy': 'mean_reversion', 'time_stop': 134, 'use_sma': False, 'use_atr': False, 'use_adx': True, 'use_ema': True, 'use_spike': True, 'rsi_required': False, 'edge_k': 7.268464827926702e-05, 'edge_cap': 0.43855477748484856, 'bull_strategy': 'breakout', 'bull_bb_std_mult': 2.8432466413052815, 'bull_rsi_os': 53, 'bull_rsi_ob': 53, 'bull_adx_thresh': 23.01320537295291, 'bull_atr_min_pct': 0.023851534289097552, 'bull_atr_max_pct': 0.073938015086845, 'bull_tp_mult': 2.3116955515164577, 'bull_tsl_mult': 0.30629368832484477, 'bull_time_stop': 288, 'bull_use_sma': True, 'bull_use_ema': True, 'bull_use_atr': False, 'bull_use_adx': False, 'bull_use_spike': True, 'bull_rsi_required': False, 'bear_strategy': 'breakout', 'bear_bb_std_mult': 2.188848518433708, 'bear_rsi_os': 52, 'bear_rsi_ob': 55, 'bear_adx_thresh': 24.519890572112388, 'bear_atr_min_pct': 0.02908932295117, 'bear_atr_max_pct': 0.01731176659724249, 'bear_tp_mult': 2.1200463579619964, 'bear_tsl_mult': 0.5536709861846579, 'bear_time_stop': 116, 'bear_use_sma': False, 'bear_use_ema': False, 'bear_use_atr': True, 'bear_use_adx': False, 'bear_use_spike': False, 'bear_rsi_required': True, 'sideways_strategy': 'breakout', 'sideways_bb_std_mult': 2.0171735402881277, 'sideways_rsi_os': 46, 'sideways_rsi_ob': 60, 'sideways_adx_thresh': 34.32897336189546, 'sideways_atr_min_pct': 0.026596471118803446, 'sideways_atr_max_pct': 0.024506523342800648, 'sideways_tp_mult': 1.7344740544427675, 'sideways_tsl_mult': 0.16954916054799365, 'sideways_time_stop': 131, 'sideways_use_sma': True, 'sideways_use_ema': False, 'sideways_use_atr': True, 'sideways_use_adx': False, 'sideways_use_spike': True, 'sideways_rsi_required': True}.
[I 2025-09-01 03:03:04,427] Trial 240 finished with values: [-1000000000.0, 1000000000.0] and parameters: {'p_sma': 25, 'p_std': 60, 'p_atr': 27, 'p_adx': 18, 'rsi_period': 84, 'ema1': 21, 'ema2': 13, 'slip_atr_k': 0.026421866674393276, 'slip_spread_k': 0.18287505509539034, 'spread_hl_frac': 0.027439577806870712, 'bb_std_mult': 2.74365593481566, 'rsi_os': 19, 'rsi_ob': 82, 'vol_spike': 0.2594075184612165, 'adx_thresh': 5.956273432093392, 'atr_min_pct': 0.00850882371944738, 'atr_max_pct': 0.05112253375715174, 'tp_mult': 1.3786558694988063, 'tsl_mult': 0.3789283131234912, 'strategy': 'mean_reversion', 'time_stop': 169, 'use_sma': False, 'use_atr': False, 'use_adx': True, 'use_ema': False, 'use_spike': True, 'rsi_required': False, 'edge_k': 0.011368435418673287, 'edge_cap': 0.9329362127441116, 'bull_strategy': 'breakout', 'bull_bb_std_mult': 1.1201097822802246, 'bull_rsi_os': 39, 'bull_rsi_ob': 53, 'bull_adx_thresh': 22.87430822276289, 'bull_atr_min_pct': 0.001662001938496278, 'bull_atr_max_pct': 0.021602023671553748, 'bull_tp_mult': 1.1395266536074526, 'bull_tsl_mult': 0.24053399360764513, 'bull_time_stop': 289, 'bull_use_sma': True, 'bull_use_ema': False, 'bull_use_atr': False, 'bull_use_adx': False, 'bull_use_spike': True, 'bull_rsi_required': False, 'bear_strategy': 'breakout', 'bear_bb_std_mult': 2.2253215362288583, 'bear_rsi_os': 52, 'bear_rsi_ob': 60, 'bear_adx_thresh': 25.837165959659977, 'bear_atr_min_pct': 0.02884381745986687, 'bear_atr_max_pct': 0.016684226218950327, 'bear_tp_mult': 1.083250503651715, 'bear_tsl_mult': 0.14670616491012703, 'bear_time_stop': 273, 'bear_use_sma': False, 'bear_use_ema': False, 'bear_use_atr': False, 'bear_use_adx': False, 'bear_use_spike': True, 'bear_rsi_required': True, 'sideways_strategy': 'breakout', 'sideways_bb_std_mult': 1.786606704669236, 'sideways_rsi_os': 45, 'sideways_rsi_ob': 77, 'sideways_adx_thresh': 34.13179619155073, 'sideways_atr_min_pct': 0.027777447337834608, 'sideways_atr_max_pct': 0.013755502833609374, 'sideways_tp_mult': 1.73106339504408, 'sideways_tsl_mult': 0.21373528159306204, 'sideways_time_stop': 130, 'sideways_use_sma': True, 'sideways_use_ema': True, 'sideways_use_atr': True, 'sideways_use_adx': False, 'sideways_use_spike': True, 'sideways_rsi_required': True}.
