[I 2025-09-01 03:52:34,562] Trial 533 finished with values: [-1000000000.0, 1000000000.0] and parameters: {'p_sma': 16, 'p_std': 53, 'p_atr': 25, 'p_adx': 10, 'rsi_period': 10, 'ema1': 13, 'ema2': 53, 'slip_atr_k': 0.00020490577129419108, 'slip_spread_k': 0.03551495003971429, 'spread_hl_frac': 0.04334104806785907, 'bb_std_mult': 2.3582082344772712, 'rsi_os': 41, 'rsi_ob': 80, 'vol_spike': 0.19686675773951667, 'adx_thresh': 13.57267273017234, 'atr_min_pct': 0.011997834519620273, 'atr_max_pct': 0.10856001931802323, 'tp_mult': 2.5734016304200136, 'tsl_mult': 0.22249322744341726, 'strategy': 'mean_reversion', 'time_stop': 76, 'use_sma': True, 'use_atr': False, 'use_adx': False, 'use_ema': True, 'use_spike': False, 'rsi_required': True, 'edge_k': 0.2156776479638073, 'edge_cap': 0.2747000937677523, 'bull_strategy': 'mean_reversion', 'bull_bb_std_mult': 0.8795434628635153, 'bull_rsi_os': 5, 'bull_rsi_ob': 79, 'bull_adx_thresh': 9.0873607331403, 'bull_atr_min_pct': 0.0007694161970357646, 'bull_atr_max_pct': 0.10950662027790016, 'bull_tp_mult': 1.474919391787369, 'bull_tsl_mult': 0.2575494256427028, 'bull_time_stop': 294, 'bull_use_sma': False, 'bull_use_ema': False, 'bull_use_atr': True, 'bull_use_adx': True, 'bull_use_spike': False, 'bull_rsi_required': True, 'bear_strategy': 'mean_reversion', 'bear_bb_std_mult': 3.2301335571463365, 'bear_rsi_os': 46, 'bear_rsi_ob': 71, 'bear_adx_thresh': 33.380068472945496, 'bear_atr_min_pct': 0.009520852427647332, 'bear_atr_max_pct': 0.05578228664103615, 'bear_tp_mult': 2.910350602452087, 'bear_tsl_mult': 0.057163859533722466, 'bear_time_stop': 277, 'bear_use_sma': True, 'bear_use_ema': True, 'bear_use_atr': True, 'bear_use_adx': True, 'bear_use_spike': True, 'bear_rsi_required': False, 'sideways_strategy': 'breakout', 'sideways_bb_std_mult': 3.585795149047208, 'sideways_rsi_os': 8, 'sideways_rsi_ob': 60, 'sideways_adx_thresh': 13.747946305147412, 'sideways_atr_min_pct': 0.023368614578495994, 'sideways_atr_max_pct': 0.10819115117519434, 'sideways_tp_mult': 2.0021246696168222, 'sideways_tsl_mult': 0.6922081143002831, 'sideways_time_stop': 161, 'sideways_use_sma': False, 'sideways_use_ema': False, 'sideways_use_atr': False, 'sideways_use_adx': False, 'sideways_use_spike': False, 'sideways_rsi_required': True}.
[I 2025-09-01 03:52:35,324] Trial 532 finished with values: [-1000000000.0, 1000000000.0] and parameters: {'p_sma': 18, 'p_std': 50, 'p_atr': 25, 'p_adx': 12, 'rsi_period': 41, 'ema1': 13, 'ema2': 53, 'slip_atr_k': 0.008741860816540912, 'slip_spread_k': 0.0313491457528421, 'spread_hl_frac': 0.043356952421592994, 'bb_std_mult': 2.3068955809559397, 'rsi_os': 44, 'rsi_ob': 81, 'vol_spike': 0.18613876300058635, 'adx_thresh': 15.159634503272336, 'atr_min_pct': 0.011914414879625556, 'atr_max_pct': 0.05309044946387193, 'tp_mult': 2.418799674989658, 'tsl_mult': 0.32165210190956367, 'strategy': 'mean_reversion', 'time_stop': 98, 'use_sma': True, 'use_atr': True, 'use_adx': False, 'use_ema': True, 'use_spike': False, 'rsi_required': True, 'edge_k': 0.2116611628339505, 'edge_cap': 0.22908208518811152, 'bull_strategy': 'mean_reversion', 'bull_bb_std_mult': 0.8454861327340107, 'bull_rsi_os': 8, 'bull_rsi_ob': 76, 'bull_adx_thresh': 7.683353489421831, 'bull_atr_min_pct': 0.008491825355436893, 'bull_atr_max_pct': 0.10513313975003973, 'bull_tp_mult': 1.522317777493393, 'bull_tsl_mult': 0.6688882789995703, 'bull_time_stop': 300, 'bull_use_sma': False, 'bull_use_ema': False, 'bull_use_atr': True, 'bull_use_adx': True, 'bull_use_spike': False, 'bull_rsi_required': True, 'bear_strategy': 'mean_reversion', 'bear_bb_std_mult': 3.22518210407323, 'bear_rsi_os': 45, 'bear_rsi_ob': 72, 'bear_adx_thresh': 34.00932091036012, 'bear_atr_min_pct': 0.007602476874227731, 'bear_atr_max_pct': 0.05718601812017272, 'bear_tp_mult': 2.968222732088103, 'bear_tsl_mult': 0.05505950709078291, 'bear_time_stop': 276, 'bear_use_sma': True, 'bear_use_ema': True, 'bear_use_atr': True, 'bear_use_adx': True, 'bear_use_spike': True, 'bear_rsi_required': False, 'sideways_strategy': 'breakout', 'sideways_bb_std_mult': 3.5891128288733585, 'sideways_rsi_os': 8, 'sideways_rsi_ob': 56, 'sideways_adx_thresh': 15.60452899277967, 'sideways_atr_min_pct': 0.024252694627225565, 'sideways_atr_max_pct': 0.10791255601526445, 'sideways_tp_mult': 1.904547221948439, 'sideways_tsl_mult': 0.682332847878126, 'sideways_time_stop': 160, 'sideways_use_sma': False, 'sideways_use_ema': False, 'sideways_use_atr': False, 'sideways_use_adx': False, 'sideways_use_spike': False, 'sideways_rsi_required': True}.
[I 2025-09-01 03:52:35,324] Trial 534 finished with values: [-1000000000.0, 1000000000.0] and parameters: {'p_sma': 16, 'p_std': 53, 'p_atr': 23, 'p_adx': 10, 'rsi_period': 27, 'ema1': 13, 'ema2': 50, 'slip_atr_k': 0.0004383785362670387, 'slip_spread_k': 0.03426306741983526, 'spread_hl_frac': 0.04315206614932371, 'bb_std_mult': 2.3360908381099623, 'rsi_os': 45, 'rsi_ob': 81, 'vol_spike': 0.19700969739490878, 'adx_thresh': 13.525111063733679, 'atr_min_pct': 0.009627089890312947, 'atr_max_pct': 0.05296559083536716, 'tp_mult': 2.5710557183444647, 'tsl_mult': 0.3270233134953296, 'strategy': 'mean_reversion', 'time_stop': 75, 'use_sma': True, 'use_atr': False, 'use_adx': False, 'use_ema': True, 'use_spike': False, 'rsi_required': True, 'edge_k': 0.22110537031327374, 'edge_cap': 0.27016345826973376, 'bull_strategy': 'mean_reversion', 'bull_bb_std_mult': 0.8674494335076657, 'bull_rsi_os': 5, 'bull_rsi_ob': 79, 'bull_adx_thresh': 8.757587051623126, 'bull_atr_min_pct': 0.0261661683734389, 'bull_atr_max_pct': 0.11029448320632522, 'bull_tp_mult': 1.4839161770111386, 'bull_tsl_mult': 0.9471160259661373, 'bull_time_stop': 300, 'bull_use_sma': False, 'bull_use_ema': False, 'bull_use_atr': True, 'bull_use_adx': True, 'bull_use_spike': False, 'bull_rsi_required': True, 'bear_strategy': 'mean_reversion', 'bear_bb_std_mult': 3.2451388294661903, 'bear_rsi_os': 46, 'bear_rsi_ob': 71, 'bear_adx_thresh': 32.6932760079862, 'bear_atr_min_pct': 0.00902451832565396, 'bear_atr_max_pct': 0.06267713779644621, 'bear_tp_mult': 2.9080112084539396, 'bear_tsl_mult': 0.04947590264585295, 'bear_time_stop': 268, 'bear_use_sma': True, 'bear_use_ema': True, 'bear_use_atr': True, 'bear_use_adx': True, 'bear_use_spike': True, 'bear_rsi_required': False, 'sideways_strategy': 'mean_reversion', 'sideways_bb_std_mult': 3.549765345174689, 'sideways_rsi_os': 7, 'sideways_rsi_ob': 60, 'sideways_adx_thresh': 8.489060140065648, 'sideways_atr_min_pct': 0.021503453405620748, 'sideways_atr_max_pct': 0.10706249308603688, 'sideways_tp_mult': 1.996371781999678, 'sideways_tsl_mult': 0.6829480010849349, 'sideways_time_stop': 161, 'sideways_use_sma': False, 'sideways_use_ema': False, 'sideways_use_atr': False, 'sideways_use_adx': False, 'sideways_use_spike': False, 'sideways_rsi_required': True}.
[I 2025-09-01 03:52:35,517] Trial 531 finished with values: [-1000000000.0, 1000000000.0] and parameters: {'p_sma': 17, 'p_std': 52, 'p_atr': 24, 'p_adx': 13, 'rsi_period': 63, 'ema1': 13, 'ema2': 52, 'slip_atr_k': 0.008487803347926481, 'slip_spread_k': 0.024795806210351195, 'spread_hl_frac': 0.04337304621919714, 'bb_std_mult': 2.289026762052872, 'rsi_os': 44, 'rsi_ob': 80, 'vol_spike': 0.18657469552405823, 'adx_thresh': 14.419064946418057, 'atr_min_pct': 0.010502078934312443, 'atr_max_pct': 0.014018628356313692, 'tp_mult': 2.572714919487405, 'tsl_mult': 0.3212166124468449, 'strategy': 'mean_reversion', 'time_stop': 77, 'use_sma': True, 'use_atr': True, 'use_adx': False, 'use_ema': True, 'use_spike': False, 'rsi_required': True, 'edge_k': 0.21046557897148985, 'edge_cap': 0.23587728112821124, 'bull_strategy': 'mean_reversion', 'bull_bb_std_mult': 0.8562258595775794, 'bull_rsi_os': 8, 'bull_rsi_ob': 77, 'bull_adx_thresh': 7.784935248923866, 'bull_atr_min_pct': 0.011204033489847125, 'bull_atr_max_pct': 0.10468331224357619, 'bull_tp_mult': 1.4982573246920698, 'bull_tsl_mult': 0.25608408405971145, 'bull_time_stop': 300, 'bull_use_sma': False, 'bull_use_ema': False, 'bull_use_atr': True, 'bull_use_adx': True, 'bull_use_spike': False, 'bull_rsi_required': True, 'bear_strategy': 'mean_reversion', 'bear_bb_std_mult': 3.237245383681746, 'bear_rsi_os': 45, 'bear_rsi_ob': 91, 'bear_adx_thresh': 33.985071949068605, 'bear_atr_min_pct': 0.007764149792682365, 'bear_atr_max_pct': 0.0567099260958916, 'bear_tp_mult': 2.9679709581756253, 'bear_tsl_mult': 0.021165094255877766, 'bear_time_stop': 279, 'bear_use_sma': True, 'bear_use_ema': True, 'bear_use_atr': True, 'bear_use_adx': True, 'bear_use_spike': True, 'bear_rsi_required': False, 'sideways_strategy': 'breakout', 'sideways_bb_std_mult': 3.587741084039166, 'sideways_rsi_os': 7, 'sideways_rsi_ob': 61, 'sideways_adx_thresh': 13.935310492983195, 'sideways_atr_min_pct': 0.0240522654198155, 'sideways_atr_max_pct': 0.09717989773904098, 'sideways_tp_mult': 1.8930207834979085, 'sideways_tsl_mult': 0.6942064882816028, 'sideways_time_stop': 164, 'sideways_use_sma': False, 'sideways_use_ema': False, 'sideways_use_atr': False, 'sideways_use_adx': False, 'sideways_use_spike': False, 'sideways_rsi_required': True}.
[I 2025-09-01 03:53:17,112] Trial 537 finished with values: [-1000000000.0, 1000000000.0] and parameters: {'p_sma': 17, 'p_std': 52, 'p_atr': 25, 'p_adx': 11, 'rsi_period': 63, 'ema1': 12, 'ema2': 50, 'slip_atr_k': 0.00013406229904730418, 'slip_spread_k': 0.060852162465923586, 'spread_hl_frac': 0.04448478382208778, 'bb_std_mult': 2.513679522780261, 'rsi_os': 42, 'rsi_ob': 79, 'vol_spike': 0.18754939915032595, 'adx_thresh': 28.635029333042464, 'atr_min_pct': 0.010357071819422406, 'atr_max_pct': 0.013674591593519594, 'tp_mult': 2.4932440160894878, 'tsl_mult': 0.23952929483153806, 'strategy': 'mean_reversion', 'time_stop': 106, 'use_sma': True, 'use_atr': False, 'use_adx': False, 'use_ema': True, 'use_spike': False, 'rsi_required': True, 'edge_k': 0.2503636976512279, 'edge_cap': 0.29556688191449576, 'bull_strategy': 'mean_reversion', 'bull_bb_std_mult': 0.709554008403503, 'bull_rsi_os': 7, 'bull_rsi_ob': 77, 'bull_adx_thresh': 8.293133059547559, 'bull_atr_min_pct': 0.015932744007194268, 'bull_atr_max_pct': 0.10021911336821519, 'bull_tp_mult': 1.3909263960013527, 'bull_tsl_mult': 0.46154665737620454, 'bull_time_stop': 291, 'bull_use_sma': False, 'bull_use_ema': False, 'bull_use_atr': True, 'bull_use_adx': True, 'bull_use_spike': False, 'bull_rsi_required': True, 'bear_strategy': 'mean_reversion', 'bear_bb_std_mult': 3.3724588752172395, 'bear_rsi_os': 47, 'bear_rsi_ob': 70, 'bear_adx_thresh': 32.401850598983714, 'bear_atr_min_pct': 0.008598508804314665, 'bear_atr_max_pct': 0.059911728065029785, 'bear_tp_mult': 2.790675402857711, 'bear_tsl_mult': 0.028520862890717716, 'bear_time_stop': 266, 'bear_use_sma': True, 'bear_use_ema': True, 'bear_use_atr': True, 'bear_use_adx': True, 'bear_use_spike': False, 'bear_rsi_required': False, 'sideways_strategy': 'mean_reversion', 'sideways_bb_std_mult': 3.3545691284147887, 'sideways_rsi_os': 11, 'sideways_rsi_ob': 58, 'sideways_adx_thresh': 5.176966136938329, 'sideways_atr_min_pct': 0.02309184507200302, 'sideways_atr_max_pct': 0.09670677213310169, 'sideways_tp_mult': 1.9493250854443525, 'sideways_tsl_mult': 0.7225531358126414, 'sideways_time_stop': 175, 'sideways_use_sma': False, 'sideways_use_ema': False, 'sideways_use_atr': False, 'sideways_use_adx': False, 'sideways_use_spike': False, 'sideways_rsi_required': False}.
[I 2025-09-01 03:53:17,159] Trial 535 finished with values: [-1000000000.0, 1000000000.0] and parameters: {'p_sma': 18, 'p_std': 53, 'p_atr': 25, 'p_adx': 11, 'rsi_period': 41, 'ema1': 13, 'ema2': 53, 'slip_atr_k': 4.020326009934565e-05, 'slip_spread_k': 0.027204168102904224, 'spread_hl_frac': 0.04226802994767581, 'bb_std_mult': 2.477941758364019, 'rsi_os': 45, 'rsi_ob': 81, 'vol_spike': 0.18832563835024946, 'adx_thresh': 14.357669830688629, 'atr_min_pct': 0.010490003515070224, 'atr_max_pct': 0.13979012890057962, 'tp_mult': 2.4887876831062683, 'tsl_mult': 0.3222493052549387, 'strategy': 'mean_reversion', 'time_stop': 92, 'use_sma': True, 'use_atr': False, 'use_adx': False, 'use_ema': True, 'use_spike': False, 'rsi_required': True, 'edge_k': 0.21584028471196423, 'edge_cap': 0.29765961408112224, 'bull_strategy': 'mean_reversion', 'bull_bb_std_mult': 0.8440655017446524, 'bull_rsi_os': 7, 'bull_rsi_ob': 79, 'bull_adx_thresh': 8.444128851494698, 'bull_atr_min_pct': 0.008615394747692986, 'bull_atr_max_pct': 0.10198382690788618, 'bull_tp_mult': 1.4933593981835172, 'bull_tsl_mult': 0.9500941238184291, 'bull_time_stop': 294, 'bull_use_sma': False, 'bull_use_ema': False, 'bull_use_atr': True, 'bull_use_adx': True, 'bull_use_spike': False, 'bull_rsi_required': True, 'bear_strategy': 'mean_reversion', 'bear_bb_std_mult': 3.255694756447352, 'bear_rsi_os': 44, 'bear_rsi_ob': 72, 'bear_adx_thresh': 31.51875055621732, 'bear_atr_min_pct': 0.008807926825264817, 'bear_atr_max_pct': 0.062214113127714035, 'bear_tp_mult': 2.8279952196982787, 'bear_tsl_mult': 0.05096020072777834, 'bear_time_stop': 265, 'bear_use_sma': True, 'bear_use_ema': True, 'bear_use_atr': True, 'bear_use_adx': True, 'bear_use_spike': False, 'bear_rsi_required': False, 'sideways_strategy': 'mean_reversion', 'sideways_bb_std_mult': 3.533030112841921, 'sideways_rsi_os': 7, 'sideways_rsi_ob': 58, 'sideways_adx_thresh': 15.642628632704191, 'sideways_atr_min_pct': 0.022748995636327016, 'sideways_atr_max_pct': 0.10302899210989769, 'sideways_tp_mult': 2.0754409236614095, 'sideways_tsl_mult': 0.7312929008146174, 'sideways_time_stop': 159, 'sideways_use_sma': False, 'sideways_use_ema': False, 'sideways_use_atr': False, 'sideways_use_adx': False, 'sideways_use_spike': False, 'sideways_rsi_required': True}.
[I 2025-09-01 03:53:17,451] Trial 536 finished with values: [-1000000000.0, 1000000000.0] and parameters: {'p_sma': 17, 'p_std': 52, 'p_atr': 25, 'p_adx': 11, 'rsi_period': 64, 'ema1': 12, 'ema2': 50, 'slip_atr_k': 0.007639672413047614, 'slip_spread_k': 0.05222199858672786, 'spread_hl_frac': 0.04482384548069581, 'bb_std_mult': 2.4734421868609946, 'rsi_os': 43, 'rsi_ob': 79, 'vol_spike': 0.18824351726833652, 'adx_thresh': 14.254696175015576, 'atr_min_pct': 0.01038168693715882, 'atr_max_pct': 0.047520635991309866, 'tp_mult': 2.485041204143172, 'tsl_mult': 0.24055161922954588, 'strategy': 'mean_reversion', 'time_stop': 88, 'use_sma': True, 'use_atr': False, 'use_adx': False, 'use_ema': True, 'use_spike': False, 'rsi_required': True, 'edge_k': 0.24712463015880115, 'edge_cap': 0.29460999699283424, 'bull_strategy': 'mean_reversion', 'bull_bb_std_mult': 0.6992974647125614, 'bull_rsi_os': 7, 'bull_rsi_ob': 77, 'bull_adx_thresh': 8.206489412316339, 'bull_atr_min_pct': 0.0008368273785066637, 'bull_atr_max_pct': 0.10129201195569873, 'bull_tp_mult': 1.4958934480698571, 'bull_tsl_mult': 0.26990025740845874, 'bull_time_stop': 291, 'bull_use_sma': False, 'bull_use_ema': False, 'bull_use_atr': True, 'bull_use_adx': True, 'bull_use_spike': False, 'bull_rsi_required': True, 'bear_strategy': 'mean_reversion', 'bear_bb_std_mult': 3.3839452423699874, 'bear_rsi_os': 47, 'bear_rsi_ob': 70, 'bear_adx_thresh': 31.224948639960854, 'bear_atr_min_pct': 0.008500386178577861, 'bear_atr_max_pct': 0.06023691523053008, 'bear_tp_mult': 2.8115020189324382, 'bear_tsl_mult': 0.028457707232693044, 'bear_time_stop': 286, 'bear_use_sma': True, 'bear_use_ema': True, 'bear_use_atr': True, 'bear_use_adx': True, 'bear_use_spike': False, 'bear_rsi_required': False, 'sideways_strategy': 'mean_reversion', 'sideways_bb_std_mult': 3.477596227494886, 'sideways_rsi_os': 11, 'sideways_rsi_ob': 58, 'sideways_adx_thresh': 5.206549059018318, 'sideways_atr_min_pct': 0.022366648558994104, 'sideways_atr_max_pct': 0.09736388864834876, 'sideways_tp_mult': 1.9728581824337, 'sideways_tsl_mult': 0.7296940891250582, 'sideways_time_stop': 175, 'sideways_use_sma': False, 'sideways_use_ema': False, 'sideways_use_atr': False, 'sideways_use_adx': False, 'sideways_use_spike': False, 'sideways_rsi_required': False}.
[I 2025-09-01 03:53:17,926] Trial 538 finished with values: [-1000000000.0, 1000000000.0] and parameters: {'p_sma': 15, 'p_std': 53, 'p_atr': 26, 'p_adx': 11, 'rsi_period': 7, 'ema1': 14, 'ema2': 51, 'slip_atr_k': 0.00510041544910346, 'slip_spread_k': 0.05959851695151752, 'spread_hl_frac': 0.04494189407997814, 'bb_std_mult': 2.4770689600326703, 'rsi_os': 43, 'rsi_ob': 79, 'vol_spike': 0.18049492204021866, 'adx_thresh': 13.226081281720274, 'atr_min_pct': 0.009676813824235853, 'atr_max_pct': 0.0427645641042183, 'tp_mult': 2.4613828339218307, 'tsl_mult': 0.24074346737656627, 'strategy': 'mean_reversion', 'time_stop': 108, 'use_sma': True, 'use_atr': False, 'use_adx': False, 'use_ema': True, 'use_spike': False, 'rsi_required': True, 'edge_k': 0.25916845905131886, 'edge_cap': 0.1970042523138653, 'bull_strategy': 'mean_reversion', 'bull_bb_std_mult': 0.714352805168309, 'bull_rsi_os': 7, 'bull_rsi_ob': 79, 'bull_adx_thresh': 8.370612038483511, 'bull_atr_min_pct': 0.0009144568210620251, 'bull_atr_max_pct': 0.10276373964056656, 'bull_tp_mult': 1.385497743801575, 'bull_tsl_mult': 0.2898373612961039, 'bull_time_stop': 291, 'bull_use_sma': False, 'bull_use_ema': False, 'bull_use_atr': True, 'bull_use_adx': True, 'bull_use_spike': False, 'bull_rsi_required': True, 'bear_strategy': 'mean_reversion', 'bear_bb_std_mult': 3.3640119395963595, 'bear_rsi_os': 47, 'bear_rsi_ob': 70, 'bear_adx_thresh': 32.5281692357877, 'bear_atr_min_pct': 0.008551315346766928, 'bear_atr_max_pct': 0.05277181890247389, 'bear_tp_mult': 2.7970129189954713, 'bear_tsl_mult': 0.028527810507139095, 'bear_time_stop': 265, 'bear_use_sma': True, 'bear_use_ema': True, 'bear_use_atr': True, 'bear_use_adx': True, 'bear_use_spike': False, 'bear_rsi_required': False, 'sideways_strategy': 'mean_reversion', 'sideways_bb_std_mult': 3.368344679236562, 'sideways_rsi_os': 9, 'sideways_rsi_ob': 58, 'sideways_adx_thresh': 5.228077065082951, 'sideways_atr_min_pct': 0.022344204838185985, 'sideways_atr_max_pct': 0.10286861912465747, 'sideways_tp_mult': 1.9612835387236236, 'sideways_tsl_mult': 0.7112250532134217, 'sideways_time_stop': 148, 'sideways_use_sma': False, 'sideways_use_ema': False, 'sideways_use_atr': False, 'sideways_use_adx': False, 'sideways_use_spike': False, 'sideways_rsi_required': False}.
[I 2025-09-01 03:54:07,353] Trial 539 finished with values: [-1000000000.0, 1000000000.0] and parameters: {'p_sma': 14, 'p_std': 53, 'p_atr': 26, 'p_adx': 10, 'rsi_period': 7, 'ema1': 14, 'ema2': 51, 'slip_atr_k': 0.00482614865151163, 'slip_spread_k': 0.001635057190549044, 'spread_hl_frac': 0.0421393327660216, 'bb_std_mult': 2.379160224182329, 'rsi_os': 46, 'rsi_ob': 77, 'vol_spike': 0.17835478121356238, 'adx_thresh': 31.374056057923006, 'atr_min_pct': 0.009592500106935681, 'atr_max_pct': 0.04308173162134773, 'tp_mult': 2.5421681167809496, 'tsl_mult': 0.27002556416522216, 'strategy': 'breakout', 'time_stop': 82, 'use_sma': True, 'use_atr': False, 'use_adx': False, 'use_ema': True, 'use_spike': False, 'rsi_required': True, 'edge_k': 0.2634282696416527, 'edge_cap': 0.18409499089095605, 'bull_strategy': 'mean_reversion', 'bull_bb_std_mult': 0.7687732080782133, 'bull_rsi_os': 5, 'bull_rsi_ob': 79, 'bull_adx_thresh': 9.334147383563458, 'bull_atr_min_pct': 0.007254061331953148, 'bull_atr_max_pct': 0.09739174768742354, 'bull_tp_mult': 1.4486729693887341, 'bull_tsl_mult': 0.2891346040415167, 'bull_time_stop': 289, 'bull_use_sma': False, 'bull_use_ema': True, 'bull_use_atr': True, 'bull_use_adx': True, 'bull_use_spike': False, 'bull_rsi_required': True, 'bear_strategy': 'mean_reversion', 'bear_bb_std_mult': 3.492656365545436, 'bear_rsi_os': 43, 'bear_rsi_ob': 70, 'bear_adx_thresh': 33.22859297889983, 'bear_atr_min_pct': 0.009507773050852996, 'bear_atr_max_pct': 0.05323434434910664, 'bear_tp_mult': 2.9213431774538825, 'bear_tsl_mult': 0.0012651316764851206, 'bear_time_stop': 284, 'bear_use_sma': True, 'bear_use_ema': True, 'bear_use_atr': True, 'bear_use_adx': True, 'bear_use_spike': True, 'bear_rsi_required': False, 'sideways_strategy': 'breakout', 'sideways_bb_std_mult': 3.3802238924909607, 'sideways_rsi_os': 9, 'sideways_rsi_ob': 60, 'sideways_adx_thresh': 12.446186812434348, 'sideways_atr_min_pct': 0.022201431687496737, 'sideways_atr_max_pct': 0.10200695977487412, 'sideways_tp_mult': 1.8811189998080218, 'sideways_tsl_mult': 0.7573952241111812, 'sideways_time_stop': 151, 'sideways_use_sma': False, 'sideways_use_ema': False, 'sideways_use_atr': False, 'sideways_use_adx': True, 'sideways_use_spike': False, 'sideways_rsi_required': True}.
