[I 2025-09-01 02:44:27,281] Trial 128 finished with values: [-1000000000.0, 1000000000.0] and parameters: {'p_sma': 20, 'p_std': 44, 'p_atr': 25, 'p_adx': 12, 'rsi_period': 7, 'ema1': 7, 'ema2': 56, 'slip_atr_k': 0.06206403119945139, 'slip_spread_k': 0.02339109624125657, 'spread_hl_frac': 0.03300231424781811, 'bb_std_mult': 1.4946049469324854, 'rsi_os': 21, 'rsi_ob': 63, 'vol_spike': 0.16176721316567164, 'adx_thresh': 13.273020950604831, 'atr_min_pct': 0.012228975595119717, 'atr_max_pct': 0.09030007778696694, 'tp_mult': 1.97214579320293, 'tsl_mult': 0.6259842749134216, 'strategy': 'breakout', 'time_stop': 270, 'use_sma': True, 'use_atr': False, 'use_adx': False, 'use_ema': False, 'use_spike': True, 'rsi_required': False, 'edge_k': 0.5642462168789285, 'edge_cap': 0.11191851020878987, 'bull_strategy': 'mean_reversion', 'bull_bb_std_mult': 3.423291737688592, 'bull_rsi_os': 53, 'bull_rsi_ob': 66, 'bull_adx_thresh': 7.544872890757812, 'bull_atr_min_pct': 0.02557448448871972, 'bull_atr_max_pct': 0.07517821987468684, 'bull_tp_mult': 1.3652229412946175, 'bull_tsl_mult': 0.11412482432191551, 'bull_time_stop': 57, 'bull_use_sma': True, 'bull_use_ema': True, 'bull_use_atr': False, 'bull_use_adx': False, 'bull_use_spike': False, 'bull_rsi_required': True, 'bear_strategy': 'breakout', 'bear_bb_std_mult': 2.587659544057692, 'bear_rsi_os': 48, 'bear_rsi_ob': 46, 'bear_adx_thresh': 20.553238000866756, 'bear_atr_min_pct': 0.012947940809504408, 'bear_atr_max_pct': 0.06259754891006716, 'bear_tp_mult': 2.005123790013684, 'bear_tsl_mult': 0.9736351505021419, 'bear_time_stop': 66, 'bear_use_sma': False, 'bear_use_ema': True, 'bear_use_atr': False, 'bear_use_adx': True, 'bear_use_spike': False, 'bear_rsi_required': True, 'sideways_strategy': 'breakout', 'sideways_bb_std_mult': 2.9401421567016612, 'sideways_rsi_os': 25, 'sideways_rsi_ob': 70, 'sideways_adx_thresh': 16.397900462498423, 'sideways_atr_min_pct': 0.026001794723247672, 'sideways_atr_max_pct': 0.011323810745057991, 'sideways_tp_mult': 2.233961208138193, 'sideways_tsl_mult': 0.713732212290177, 'sideways_time_stop': 66, 'sideways_use_sma': False, 'sideways_use_ema': True, 'sideways_use_atr': True, 'sideways_use_adx': True, 'sideways_use_spike': True, 'sideways_rsi_required': False}.
[I 2025-09-01 02:44:27,280] Trial 127 finished with values: [-0.0315362313227564, 0.03139555675360899] and parameters: {'p_sma': 20, 'p_std': 41, 'p_atr': 9, 'p_adx': 9, 'rsi_period': 41, 'ema1': 7, 'ema2': 56, 'slip_atr_k': 0.1190345759730149, 'slip_spread_k': 0.7206016098805107, 'spread_hl_frac': 0.03281839006564774, 'bb_std_mult': 1.393005408001717, 'rsi_os': 24, 'rsi_ob': 63, 'vol_spike': 0.16129189973825295, 'adx_thresh': 24.13171379590976, 'atr_min_pct': 0.012327211949548349, 'atr_max_pct': 0.09195178597806293, 'tp_mult': 1.9488777690297807, 'tsl_mult': 0.6325330690238342, 'strategy': 'breakout', 'time_stop': 268, 'use_sma': True, 'use_atr': False, 'use_adx': False, 'use_ema': False, 'use_spike': True, 'rsi_required': False, 'edge_k': 1.2355164678551407, 'edge_cap': 0.9793911105763353, 'bull_strategy': 'mean_reversion', 'bull_bb_std_mult': 3.405581072929026, 'bull_rsi_os': 53, 'bull_rsi_ob': 61, 'bull_adx_thresh': 27.673792962360217, 'bull_atr_min_pct': 0.000648708394261354, 'bull_atr_max_pct': 0.03639981436618078, 'bull_tp_mult': 2.391084829068736, 'bull_tsl_mult': 0.11245237449635309, 'bull_time_stop': 56, 'bull_use_sma': True, 'bull_use_ema': False, 'bull_use_atr': False, 'bull_use_adx': False, 'bull_use_spike': False, 'bull_rsi_required': True, 'bear_strategy': 'breakout', 'bear_bb_std_mult': 2.608426180513115, 'bear_rsi_os': 44, 'bear_rsi_ob': 46, 'bear_adx_thresh': 15.985442864336799, 'bear_atr_min_pct': 0.01142077560206698, 'bear_atr_max_pct': 0.06572548854997247, 'bear_tp_mult': 2.4458162000189922, 'bear_tsl_mult': 0.9659129218005243, 'bear_time_stop': 121, 'bear_use_sma': False, 'bear_use_ema': True, 'bear_use_atr': False, 'bear_use_adx': True, 'bear_use_spike': False, 'bear_rsi_required': True, 'sideways_strategy': 'breakout', 'sideways_bb_std_mult': 2.7391460321246472, 'sideways_rsi_os': 13, 'sideways_rsi_ob': 77, 'sideways_adx_thresh': 26.722090684555425, 'sideways_atr_min_pct': 0.013262440613431039, 'sideways_atr_max_pct': 0.09711703414997648, 'sideways_tp_mult': 2.646719520865309, 'sideways_tsl_mult': 0.7165500474714497, 'sideways_time_stop': 68, 'sideways_use_sma': False, 'sideways_use_ema': True, 'sideways_use_atr': True, 'sideways_use_adx': True, 'sideways_use_spike': True, 'sideways_rsi_required': False}.
[I 2025-09-01 02:44:27,891] Trial 129 finished with values: [-1000000000.0, 1000000000.0] and parameters: {'p_sma': 16, 'p_std': 44, 'p_atr': 17, 'p_adx': 11, 'rsi_period': 41, 'ema1': 7, 'ema2': 56, 'slip_atr_k': 0.23346837323275738, 'slip_spread_k': 0.7266327736518257, 'spread_hl_frac': 0.037437150029954375, 'bb_std_mult': 1.5132257593611944, 'rsi_os': 44, 'rsi_ob': 65, 'vol_spike': 0.15186023547464084, 'adx_thresh': 13.6443397439647, 'atr_min_pct': 0.023621198422707816, 'atr_max_pct': 0.09028742610693816, 'tp_mult': 1.0955239405259367, 'tsl_mult': 0.2987105999008508, 'strategy': 'breakout', 'time_stop': 155, 'use_sma': True, 'use_atr': False, 'use_adx': True, 'use_ema': True, 'use_spike': True, 'rsi_required': False, 'edge_k': 1.8297657351029093, 'edge_cap': 0.09904014676301354, 'bull_strategy': 'mean_reversion', 'bull_bb_std_mult': 2.449715053571804, 'bull_rsi_os': 10, 'bull_rsi_ob': 63, 'bull_adx_thresh': 28.694310850736954, 'bull_atr_min_pct': 0.025119596194053975, 'bull_atr_max_pct': 0.07688198241237758, 'bull_tp_mult': 2.019967019316233, 'bull_tsl_mult': 0.533311733822642, 'bull_time_stop': 53, 'bull_use_sma': True, 'bull_use_ema': True, 'bull_use_atr': False, 'bull_use_adx': False, 'bull_use_spike': True, 'bull_rsi_required': True, 'bear_strategy': 'breakout', 'bear_bb_std_mult': 1.124991284731097, 'bear_rsi_os': 5, 'bear_rsi_ob': 65, 'bear_adx_thresh': 23.243146627310622, 'bear_atr_min_pct': 0.021863242026645226, 'bear_atr_max_pct': 0.06196475573759419, 'bear_tp_mult': 2.9284515121134316, 'bear_tsl_mult': 0.9744003073954935, 'bear_time_stop': 273, 'bear_use_sma': False, 'bear_use_ema': False, 'bear_use_atr': False, 'bear_use_adx': False, 'bear_use_spike': False, 'bear_rsi_required': False, 'sideways_strategy': 'breakout', 'sideways_bb_std_mult': 2.757759208263955, 'sideways_rsi_os': 24, 'sideways_rsi_ob': 70, 'sideways_adx_thresh': 29.224822571505847, 'sideways_atr_min_pct': 0.013378264285972252, 'sideways_atr_max_pct': 0.010765752321598543, 'sideways_tp_mult': 2.400654380564392, 'sideways_tsl_mult': 0.590197521786647, 'sideways_time_stop': 67, 'sideways_use_sma': False, 'sideways_use_ema': True, 'sideways_use_atr': True, 'sideways_use_adx': True, 'sideways_use_spike': True, 'sideways_rsi_required': True}.
[I 2025-09-01 02:44:27,897] Trial 126 finished with values: [-0.022240873715896337, 0.022119295757453437] and parameters: {'p_sma': 14, 'p_std': 41, 'p_atr': 21, 'p_adx': 16, 'rsi_period': 26, 'ema1': 6, 'ema2': 56, 'slip_atr_k': 0.058457707292558655, 'slip_spread_k': 0.8497956955674415, 'spread_hl_frac': 0.03304243390517839, 'bb_std_mult': 1.383656397205256, 'rsi_os': 24, 'rsi_ob': 63, 'vol_spike': 0.1522636644338771, 'adx_thresh': 13.499630045317515, 'atr_min_pct': 0.023681083661264635, 'atr_max_pct': 0.10653531634195963, 'tp_mult': 1.979528564040522, 'tsl_mult': 0.6216950285153282, 'strategy': 'breakout', 'time_stop': 300, 'use_sma': True, 'use_atr': False, 'use_adx': False, 'use_ema': False, 'use_spike': True, 'rsi_required': False, 'edge_k': 1.8199747353200955, 'edge_cap': 0.10052045138187368, 'bull_strategy': 'mean_reversion', 'bull_bb_std_mult': 1.026936933796913, 'bull_rsi_os': 13, 'bull_rsi_ob': 69, 'bull_adx_thresh': 8.16010318931087, 'bull_atr_min_pct': 0.0007235599290604962, 'bull_atr_max_pct': 0.03769406843140408, 'bull_tp_mult': 2.3850518584104687, 'bull_tsl_mult': 0.8707279601272742, 'bull_time_stop': 59, 'bull_use_sma': True, 'bull_use_ema': False, 'bull_use_atr': False, 'bull_use_adx': False, 'bull_use_spike': False, 'bull_rsi_required': True, 'bear_strategy': 'breakout', 'bear_bb_std_mult': 2.614237258563976, 'bear_rsi_os': 48, 'bear_rsi_ob': 47, 'bear_adx_thresh': 23.202281008314362, 'bear_atr_min_pct': 0.01140869825508112, 'bear_atr_max_pct': 0.06622495197072477, 'bear_tp_mult': 1.6025575148658846, 'bear_tsl_mult': 0.9722309232476268, 'bear_time_stop': 67, 'bear_use_sma': False, 'bear_use_ema': True, 'bear_use_atr': False, 'bear_use_adx': True, 'bear_use_spike': False, 'bear_rsi_required': True, 'sideways_strategy': 'breakout', 'sideways_bb_std_mult': 2.7674749972707415, 'sideways_rsi_os': 26, 'sideways_rsi_ob': 75, 'sideways_adx_thresh': 22.095423910485813, 'sideways_atr_min_pct': 0.013513489816293935, 'sideways_atr_max_pct': 0.11823089671962408, 'sideways_tp_mult': 1.3574882090083997, 'sideways_tsl_mult': 0.6888112323542449, 'sideways_time_stop': 61, 'sideways_use_sma': False, 'sideways_use_ema': True, 'sideways_use_atr': True, 'sideways_use_adx': True, 'sideways_use_spike': True, 'sideways_rsi_required': False}.
[I 2025-09-01 02:45:16,197] Trial 130 finished with values: [-1000000000.0, 1000000000.0] and parameters: {'p_sma': 35, 'p_std': 6, 'p_atr': 23, 'p_adx': 24, 'rsi_period': 70, 'ema1': 27, 'ema2': 53, 'slip_atr_k': 0.12812767845208545, 'slip_spread_k': 0.6166946631284318, 'spread_hl_frac': 0.029151929865426814, 'bb_std_mult': 1.8044295090751579, 'rsi_os': 53, 'rsi_ob': 81, 'vol_spike': 0.23447097154816185, 'adx_thresh': 10.611447029783072, 'atr_min_pct': 0.007103149657228802, 'atr_max_pct': 0.13487207649090033, 'tp_mult': 2.2014985409050665, 'tsl_mult': 0.8786475281853809, 'strategy': 'breakout', 'time_stop': 260, 'use_sma': False, 'use_atr': False, 'use_adx': False, 'use_ema': False, 'use_spike': False, 'rsi_required': True, 'edge_k': 0.4452448281037386, 'edge_cap': 0.14464646985679122, 'bull_strategy': 'breakout', 'bull_bb_std_mult': 2.1700978122928354, 'bull_rsi_os': 8, 'bull_rsi_ob': 69, 'bull_adx_thresh': 30.531492062185876, 'bull_atr_min_pct': 0.017831803212081738, 'bull_atr_max_pct': 0.1465233268181545, 'bull_tp_mult': 1.634735498658346, 'bull_tsl_mult': 0.50243465766502, 'bull_time_stop': 192, 'bull_use_sma': False, 'bull_use_ema': False, 'bull_use_atr': True, 'bull_use_adx': True, 'bull_use_spike': True, 'bull_rsi_required': True, 'bear_strategy': 'breakout', 'bear_bb_std_mult': 2.18997447292243, 'bear_rsi_os': 6, 'bear_rsi_ob': 91, 'bear_adx_thresh': 18.668159311292328, 'bear_atr_min_pct': 0.02429078687998409, 'bear_atr_max_pct': 0.11593173444774396, 'bear_tp_mult': 2.6404298650587243, 'bear_tsl_mult': 0.9407263562283757, 'bear_time_stop': 76, 'bear_use_sma': True, 'bear_use_ema': False, 'bear_use_atr': False, 'bear_use_adx': True, 'bear_use_spike': True, 'bear_rsi_required': True, 'sideways_strategy': 'breakout', 'sideways_bb_std_mult': 3.0941652034814395, 'sideways_rsi_os': 10, 'sideways_rsi_ob': 74, 'sideways_adx_thresh': 29.9348559523835, 'sideways_atr_min_pct': 0.014455315059071302, 'sideways_atr_max_pct': 0.11842875417271312, 'sideways_tp_mult': 2.789680370503829, 'sideways_tsl_mult': 0.6783403605741422, 'sideways_time_stop': 92, 'sideways_use_sma': False, 'sideways_use_ema': True, 'sideways_use_atr': True, 'sideways_use_adx': True, 'sideways_use_spike': False, 'sideways_rsi_required': True}.
[I 2025-09-01 02:45:17,131] Trial 131 finished with values: [-1000000000.0, 1000000000.0] and parameters: {'p_sma': 14, 'p_std': 18, 'p_atr': 21, 'p_adx': 24, 'rsi_period': 77, 'ema1': 28, 'ema2': 58, 'slip_atr_k': 0.01250414150995896, 'slip_spread_k': 0.9960429940724902, 'spread_hl_frac': 0.006244799779919742, 'bb_std_mult': 1.9681068796702446, 'rsi_os': 39, 'rsi_ob': 51, 'vol_spike': 0.2207676703989846, 'adx_thresh': 10.842582665448735, 'atr_min_pct': 0.0031686810320740565, 'atr_max_pct': 0.07510031823890422, 'tp_mult': 2.1996345556590557, 'tsl_mult': 0.5267592728231832, 'strategy': 'breakout', 'time_stop': 298, 'use_sma': False, 'use_atr': False, 'use_adx': True, 'use_ema': True, 'use_spike': False, 'rsi_required': True, 'edge_k': 1.3938552620419107, 'edge_cap': 0.8585841988406124, 'bull_strategy': 'breakout', 'bull_bb_std_mult': 3.3178290649826705, 'bull_rsi_os': 47, 'bull_rsi_ob': 58, 'bull_adx_thresh': 21.769600782801035, 'bull_atr_min_pct': 0.006253282682290974, 'bull_atr_max_pct': 0.14596019514114988, 'bull_tp_mult': 2.169541067716996, 'bull_tsl_mult': 0.5060040555610913, 'bull_time_stop': 146, 'bull_use_sma': False, 'bull_use_ema': False, 'bull_use_atr': True, 'bull_use_adx': True, 'bull_use_spike': True, 'bull_rsi_required': True, 'bear_strategy': 'breakout', 'bear_bb_std_mult': 2.45401263065258, 'bear_rsi_os': 24, 'bear_rsi_ob': 92, 'bear_adx_thresh': 24.80732283335027, 'bear_atr_min_pct': 0.02387140096535609, 'bear_atr_max_pct': 0.1161094475876365, 'bear_tp_mult': 2.348689448200852, 'bear_tsl_mult': 0.9434671169678468, 'bear_time_stop': 76, 'bear_use_sma': True, 'bear_use_ema': False, 'bear_use_atr': False, 'bear_use_adx': False, 'bear_use_spike': True, 'bear_rsi_required': True, 'sideways_strategy': 'breakout', 'sideways_bb_std_mult': 3.0977391839885438, 'sideways_rsi_os': 11, 'sideways_rsi_ob': 71, 'sideways_adx_thresh': 33.84287702645148, 'sideways_atr_min_pct': 0.005461925393986657, 'sideways_atr_max_pct': 0.11729770148591064, 'sideways_tp_mult': 1.2679328627393764, 'sideways_tsl_mult': 0.671506949550526, 'sideways_time_stop': 42, 'sideways_use_sma': False, 'sideways_use_ema': True, 'sideways_use_atr': True, 'sideways_use_adx': True, 'sideways_use_spike': False, 'sideways_rsi_required': False}.
[I 2025-09-01 02:45:17,604] Trial 133 finished with values: [-1000000000.0, 1000000000.0] and parameters: {'p_sma': 14, 'p_std': 47, 'p_atr': 21, 'p_adx': 19, 'rsi_period': 13, 'ema1': 28, 'ema2': 28, 'slip_atr_k': 0.13535879135515927, 'slip_spread_k': 0.5553299102876621, 'spread_hl_frac': 0.006028550411037647, 'bb_std_mult': 1.843812587399563, 'rsi_os': 39, 'rsi_ob': 52, 'vol_spike': 0.18448325978324734, 'adx_thresh': 10.970028014816144, 'atr_min_pct': 0.016162238976435383, 'atr_max_pct': 0.13369400801267117, 'tp_mult': 2.0025682660235287, 'tsl_mult': 0.2457273539992475, 'strategy': 'breakout', 'time_stop': 259, 'use_sma': False, 'use_atr': False, 'use_adx': True, 'use_ema': True, 'use_spike': False, 'rsi_required': True, 'edge_k': 0.4608234132762487, 'edge_cap': 0.8458480294870908, 'bull_strategy': 'breakout', 'bull_bb_std_mult': 1.0587427748650033, 'bull_rsi_os': 32, 'bull_rsi_ob': 58, 'bull_adx_thresh': 33.45830746726159, 'bull_atr_min_pct': 0.0013584067715392296, 'bull_atr_max_pct': 0.14618143691153027, 'bull_tp_mult': 2.589127144781827, 'bull_tsl_mult': 0.5032727240909483, 'bull_time_stop': 73, 'bull_use_sma': False, 'bull_use_ema': False, 'bull_use_atr': True, 'bull_use_adx': True, 'bull_use_spike': True, 'bull_rsi_required': True, 'bear_strategy': 'breakout', 'bear_bb_std_mult': 2.440617461627276, 'bear_rsi_os': 25, 'bear_rsi_ob': 92, 'bear_adx_thresh': 24.76587479101332, 'bear_atr_min_pct': 0.004317413673111623, 'bear_atr_max_pct': 0.11718793622118434, 'bear_tp_mult': 2.643210347810953, 'bear_tsl_mult': 0.9400176999368685, 'bear_time_stop': 75, 'bear_use_sma': True, 'bear_use_ema': False, 'bear_use_atr': False, 'bear_use_adx': False, 'bear_use_spike': True, 'bear_rsi_required': True, 'sideways_strategy': 'breakout', 'sideways_bb_std_mult': 3.110644855140255, 'sideways_rsi_os': 11, 'sideways_rsi_ob': 71, 'sideways_adx_thresh': 33.73888435214966, 'sideways_atr_min_pct': 0.014624930335905197, 'sideways_atr_max_pct': 0.04108564888779095, 'sideways_tp_mult': 1.2654548585013257, 'sideways_tsl_mult': 0.6765608751108911, 'sideways_time_stop': 20, 'sideways_use_sma': False, 'sideways_use_ema': True, 'sideways_use_atr': True, 'sideways_use_adx': True, 'sideways_use_spike': False, 'sideways_rsi_required': False}.
[I 2025-09-01 02:45:18,140] Trial 132 finished with values: [-1000000000.0, 1000000000.0] and parameters: {'p_sma': 7, 'p_std': 12, 'p_atr': 26, 'p_adx': 30, 'rsi_period': 27, 'ema1': 27, 'ema2': 44, 'slip_atr_k': 0.010293761004936841, 'slip_spread_k': 0.5573416881226756, 'spread_hl_frac': 1.9475390167239363e-05, 'bb_std_mult': 0.8850488842346043, 'rsi_os': 54, 'rsi_ob': 85, 'vol_spike': 0.06901943934248138, 'adx_thresh': 27.432956889135177, 'atr_min_pct': 0.0075094732293320325, 'atr_max_pct': 0.09969951620671319, 'tp_mult': 2.1913566547710412, 'tsl_mult': 0.24051230137778312, 'strategy': 'breakout', 'time_stop': 256, 'use_sma': False, 'use_atr': False, 'use_adx': True, 'use_ema': True, 'use_spike': False, 'rsi_required': True, 'edge_k': 0.4435584409759917, 'edge_cap': 0.14383857790908575, 'bull_strategy': 'breakout', 'bull_bb_std_mult': 1.0082945372279146, 'bull_rsi_os': 8, 'bull_rsi_ob': 58, 'bull_adx_thresh': 21.665836542042186, 'bull_atr_min_pct': 0.013558789223758605, 'bull_atr_max_pct': 0.1314323242630574, 'bull_tp_mult': 2.1592361764938643, 'bull_tsl_mult': 0.5012476252270881, 'bull_time_stop': 146, 'bull_use_sma': False, 'bull_use_ema': False, 'bull_use_atr': True, 'bull_use_adx': True, 'bull_use_spike': True, 'bull_rsi_required': True, 'bear_strategy': 'breakout', 'bear_bb_std_mult': 3.0223684950703937, 'bear_rsi_os': 55, 'bear_rsi_ob': 92, 'bear_adx_thresh': 25.424142000788123, 'bear_atr_min_pct': 0.02341478392292256, 'bear_atr_max_pct': 0.04466001598197909, 'bear_tp_mult': 2.336899215207369, 'bear_tsl_mult': 0.9316212841419421, 'bear_time_stop': 52, 'bear_use_sma': True, 'bear_use_ema': False, 'bear_use_atr': False, 'bear_use_adx': False, 'bear_use_spike': True, 'bear_rsi_required': True, 'sideways_strategy': 'breakout', 'sideways_bb_std_mult': 2.795963476905251, 'sideways_rsi_os': 11, 'sideways_rsi_ob': 71, 'sideways_adx_thresh': 29.92835961984581, 'sideways_atr_min_pct': 0.02362975783964006, 'sideways_atr_max_pct': 0.11840518163752212, 'sideways_tp_mult': 1.5549516158714747, 'sideways_tsl_mult': 0.6749815407956238, 'sideways_time_stop': 46, 'sideways_use_sma': False, 'sideways_use_ema': True, 'sideways_use_atr': True, 'sideways_use_adx': True, 'sideways_use_spike': False, 'sideways_rsi_required': False}.
[I 2025-09-01 02:46:06,547] Trial 137 finished with values: [-1000000000.0, 1000000000.0] and parameters: {'p_sma': 18, 'p_std': 46, 'p_atr': 28, 'p_adx': 9, 'rsi_period': 32, 'ema1': 9, 'ema2': 42, 'slip_atr_k': 0.14931271921394038, 'slip_spread_k': 0.1689615250949656, 'spread_hl_frac': 0.030489939935910194, 'bb_std_mult': 1.6347041868448215, 'rsi_os': 7, 'rsi_ob': 49, 'vol_spike': 0.15526855606868348, 'adx_thresh': 24.781147721160934, 'atr_min_pct': 0.013714757906524546, 'atr_max_pct': 0.03537690424491929, 'tp_mult': 2.0448147554092455, 'tsl_mult': 0.7209452032970893, 'strategy': 'breakout', 'time_stop': 277, 'use_sma': False, 'use_atr': False, 'use_adx': False, 'use_ema': False, 'use_spike': True, 'rsi_required': False, 'edge_k': 1.6048852399463671, 'edge_cap': 0.184091780937926, 'bull_strategy': 'mean_reversion', 'bull_bb_std_mult': 1.2566447448861127, 'bull_rsi_os': 13, 'bull_rsi_ob': 66, 'bull_adx_thresh': 29.66441359334243, 'bull_atr_min_pct': 0.0074340011449312935, 'bull_atr_max_pct': 0.025685896996442956, 'bull_tp_mult': 1.6945156314195908, 'bull_tsl_mult': 0.5793422557905401, 'bull_time_stop': 160, 'bull_use_sma': False, 'bull_use_ema': True, 'bull_use_atr': False, 'bull_use_adx': False, 'bull_use_spike': True, 'bull_rsi_required': True, 'bear_strategy': 'breakout', 'bear_bb_std_mult': 2.803425668205497, 'bear_rsi_os': 37, 'bear_rsi_ob': 61, 'bear_adx_thresh': 26.295507170032973, 'bear_atr_min_pct': 0.017555988753818787, 'bear_atr_max_pct': 0.02854544510261943, 'bear_tp_mult': 2.3934000193971023, 'bear_tsl_mult': 0.7237817339004959, 'bear_time_stop': 147, 'bear_use_sma': False, 'bear_use_ema': False, 'bear_use_atr': False, 'bear_use_adx': True, 'bear_use_spike': True, 'bear_rsi_required': False, 'sideways_strategy': 'breakout', 'sideways_bb_std_mult': 2.870951235430054, 'sideways_rsi_os': 27, 'sideways_rsi_ob': 68, 'sideways_adx_thresh': 10.873103582261702, 'sideways_atr_min_pct': 0.007722663299226748, 'sideways_atr_max_pct': 0.053422450042842365, 'sideways_tp_mult': 2.015040670732642, 'sideways_tsl_mult': 0.587435150005133, 'sideways_time_stop': 74, 'sideways_use_sma': False, 'sideways_use_ema': True, 'sideways_use_atr': True, 'sideways_use_adx': True, 'sideways_use_spike': True, 'sideways_rsi_required': True}.
