[I 2025-09-01 03:54:07,774] Trial 542 finished with values: [-1000000000.0, 1000000000.0] and parameters: {'p_sma': 19, 'p_std': 53, 'p_atr': 25, 'p_adx': 10, 'rsi_period': 52, 'ema1': 14, 'ema2': 53, 'slip_atr_k': 0.005249625534631954, 'slip_spread_k': 0.016481871636754988, 'spread_hl_frac': 0.04407608249773618, 'bb_std_mult': 2.3866772198051347, 'rsi_os': 46, 'rsi_ob': 77, 'vol_spike': 0.19780202347267278, 'adx_thresh': 31.287830726126792, 'atr_min_pct': 0.011122033387132036, 'atr_max_pct': 0.14704650153464, 'tp_mult': 2.543585264304, 'tsl_mult': 0.2712814380862936, 'strategy': 'breakout', 'time_stop': 81, 'use_sma': True, 'use_atr': False, 'use_adx': False, 'use_ema': True, 'use_spike': False, 'rsi_required': True, 'edge_k': 0.18702241970118416, 'edge_cap': 0.24711743354784918, 'bull_strategy': 'mean_reversion', 'bull_bb_std_mult': 0.7853066366860011, 'bull_rsi_os': 9, 'bull_rsi_ob': 75, 'bull_adx_thresh': 9.519489980752208, 'bull_atr_min_pct': 0.023539774091509355, 'bull_atr_max_pct': 0.10962098259901888, 'bull_tp_mult': 1.4605900333116664, 'bull_tsl_mult': 0.32279995745617984, 'bull_time_stop': 294, 'bull_use_sma': False, 'bull_use_ema': True, 'bull_use_atr': True, 'bull_use_adx': True, 'bull_use_spike': False, 'bull_rsi_required': True, 'bear_strategy': 'mean_reversion', 'bear_bb_std_mult': 3.482778813590592, 'bear_rsi_os': 46, 'bear_rsi_ob': 71, 'bear_adx_thresh': 33.202836171154466, 'bear_atr_min_pct': 0.009702650549314674, 'bear_atr_max_pct': 0.05126153270271093, 'bear_tp_mult': 2.874838622609859, 'bear_tsl_mult': 0.003166223024332754, 'bear_time_stop': 273, 'bear_use_sma': True, 'bear_use_ema': True, 'bear_use_atr': True, 'bear_use_adx': True, 'bear_use_spike': True, 'bear_rsi_required': False, 'sideways_strategy': 'breakout', 'sideways_bb_std_mult': 3.471024286314395, 'sideways_rsi_os': 9, 'sideways_rsi_ob': 59, 'sideways_adx_thresh': 30.634986125533345, 'sideways_atr_min_pct': 0.02345231039254818, 'sideways_atr_max_pct': 0.10513740512110958, 'sideways_tp_mult': 1.8931246564405613, 'sideways_tsl_mult': 0.7578454326221857, 'sideways_time_stop': 150, 'sideways_use_sma': False, 'sideways_use_ema': False, 'sideways_use_atr': False, 'sideways_use_adx': True, 'sideways_use_spike': False, 'sideways_rsi_required': True}.
[I 2025-09-01 03:54:08,019] Trial 541 finished with values: [-1000000000.0, 1000000000.0] and parameters: {'p_sma': 16, 'p_std': 53, 'p_atr': 26, 'p_adx': 10, 'rsi_period': 7, 'ema1': 14, 'ema2': 51, 'slip_atr_k': 0.005207401754699234, 'slip_spread_k': 0.06083332281245683, 'spread_hl_frac': 0.04212336655150435, 'bb_std_mult': 2.3833689605018633, 'rsi_os': 46, 'rsi_ob': 77, 'vol_spike': 0.17873655964577442, 'adx_thresh': 12.990689565093673, 'atr_min_pct': 0.011336179791147373, 'atr_max_pct': 0.04208450149249274, 'tp_mult': 2.5439329066625054, 'tsl_mult': 0.28362347192890064, 'strategy': 'breakout', 'time_stop': 85, 'use_sma': True, 'use_atr': False, 'use_adx': False, 'use_ema': True, 'use_spike': False, 'rsi_required': True, 'edge_k': 0.1885992298005136, 'edge_cap': 0.24887291431367928, 'bull_strategy': 'mean_reversion', 'bull_bb_std_mult': 0.7743360187296147, 'bull_rsi_os': 5, 'bull_rsi_ob': 79, 'bull_adx_thresh': 9.109952474699764, 'bull_atr_min_pct': 0.02337995185256623, 'bull_atr_max_pct': 0.10782256774569406, 'bull_tp_mult': 1.4551521017344222, 'bull_tsl_mult': 0.810288427667936, 'bull_time_stop': 289, 'bull_use_sma': False, 'bull_use_ema': True, 'bull_use_atr': True, 'bull_use_adx': True, 'bull_use_spike': False, 'bull_rsi_required': True, 'bear_strategy': 'mean_reversion', 'bear_bb_std_mult': 3.3518847955036692, 'bear_rsi_os': 43, 'bear_rsi_ob': 70, 'bear_adx_thresh': 33.05496154593373, 'bear_atr_min_pct': 0.00972131606111923, 'bear_atr_max_pct': 0.052412077265795456, 'bear_tp_mult': 2.882768916090301, 'bear_tsl_mult': 0.0034135480763599624, 'bear_time_stop': 272, 'bear_use_sma': True, 'bear_use_ema': True, 'bear_use_atr': True, 'bear_use_adx': True, 'bear_use_spike': True, 'bear_rsi_required': False, 'sideways_strategy': 'breakout', 'sideways_bb_std_mult': 3.388315382556179, 'sideways_rsi_os': 9, 'sideways_rsi_ob': 59, 'sideways_adx_thresh': 30.670815051727974, 'sideways_atr_min_pct': 0.02222923751811951, 'sideways_atr_max_pct': 0.1043672590552172, 'sideways_tp_mult': 1.87249380905088, 'sideways_tsl_mult': 0.7588557874913956, 'sideways_time_stop': 156, 'sideways_use_sma': False, 'sideways_use_ema': False, 'sideways_use_atr': False, 'sideways_use_adx': True, 'sideways_use_spike': False, 'sideways_rsi_required': True}.
[I 2025-09-01 03:54:08,233] Trial 540 finished with values: [-1000000000.0, 1000000000.0] and parameters: {'p_sma': 15, 'p_std': 53, 'p_atr': 26, 'p_adx': 10, 'rsi_period': 7, 'ema1': 14, 'ema2': 51, 'slip_atr_k': 0.0051660853769811286, 'slip_spread_k': 0.01666417793605294, 'spread_hl_frac': 0.04441072490736626, 'bb_std_mult': 2.385890125074614, 'rsi_os': 46, 'rsi_ob': 77, 'vol_spike': 0.19388632255832672, 'adx_thresh': 12.78269939045179, 'atr_min_pct': 0.00954044674879069, 'atr_max_pct': 0.04311344929085411, 'tp_mult': 2.534819927329789, 'tsl_mult': 0.277421006057219, 'strategy': 'breakout', 'time_stop': 85, 'use_sma': True, 'use_atr': False, 'use_adx': False, 'use_ema': True, 'use_spike': False, 'rsi_required': True, 'edge_k': 0.262662127852545, 'edge_cap': 0.19435209049795005, 'bull_strategy': 'mean_reversion', 'bull_bb_std_mult': 0.7380987168651907, 'bull_rsi_os': 5, 'bull_rsi_ob': 79, 'bull_adx_thresh': 9.0102352079429, 'bull_atr_min_pct': 0.0013127389943274476, 'bull_atr_max_pct': 0.10893642442934973, 'bull_tp_mult': 1.4519621692332083, 'bull_tsl_mult': 0.24605986000068614, 'bull_time_stop': 289, 'bull_use_sma': False, 'bull_use_ema': True, 'bull_use_atr': True, 'bull_use_adx': True, 'bull_use_spike': False, 'bull_rsi_required': True, 'bear_strategy': 'mean_reversion', 'bear_bb_std_mult': 3.32583855868444, 'bear_rsi_os': 46, 'bear_rsi_ob': 70, 'bear_adx_thresh': 33.17655597761766, 'bear_atr_min_pct': 0.009753340387351397, 'bear_atr_max_pct': 0.05336459173504643, 'bear_tp_mult': 2.8825523528775805, 'bear_tsl_mult': 0.06345150738613227, 'bear_time_stop': 273, 'bear_use_sma': True, 'bear_use_ema': True, 'bear_use_atr': True, 'bear_use_adx': True, 'bear_use_spike': True, 'bear_rsi_required': False, 'sideways_strategy': 'breakout', 'sideways_bb_std_mult': 3.377944033844279, 'sideways_rsi_os': 9, 'sideways_rsi_ob': 59, 'sideways_adx_thresh': 31.016984547506866, 'sideways_atr_min_pct': 0.023539438322663767, 'sideways_atr_max_pct': 0.10142665307878562, 'sideways_tp_mult': 1.8880009283801589, 'sideways_tsl_mult': 0.7068179337091718, 'sideways_time_stop': 148, 'sideways_use_sma': False, 'sideways_use_ema': False, 'sideways_use_atr': False, 'sideways_use_adx': True, 'sideways_use_spike': False, 'sideways_rsi_required': True}.
[I 2025-09-01 03:54:49,890] Trial 546 finished with values: [-1000000000.0, 1000000000.0] and parameters: {'p_sma': 18, 'p_std': 48, 'p_atr': 23, 'p_adx': 12, 'rsi_period': 82, 'ema1': 13, 'ema2': 48, 'slip_atr_k': 0.00779259338814578, 'slip_spread_k': 0.039640115363613705, 'spread_hl_frac': 0.046879847285675, 'bb_std_mult': 2.4332814950944237, 'rsi_os': 41, 'rsi_ob': 80, 'vol_spike': 0.19823936399907313, 'adx_thresh': 13.603293846737342, 'atr_min_pct': 0.009831567710403586, 'atr_max_pct': 0.049431531950867844, 'tp_mult': 2.59084930418567, 'tsl_mult': 0.3073267420249417, 'strategy': 'mean_reversion', 'time_stop': 92, 'use_sma': True, 'use_atr': True, 'use_adx': False, 'use_ema': True, 'use_spike': False, 'rsi_required': True, 'edge_k': 0.22389254300166234, 'edge_cap': 0.2701720904805428, 'bull_strategy': 'mean_reversion', 'bull_bb_std_mult': 0.9221340399637664, 'bull_rsi_os': 6, 'bull_rsi_ob': 78, 'bull_adx_thresh': 6.917011219467462, 'bull_atr_min_pct': 0.005244752838294271, 'bull_atr_max_pct': 0.0658799899840845, 'bull_tp_mult': 1.5433204804417597, 'bull_tsl_mult': 0.26815473781761007, 'bull_time_stop': 300, 'bull_use_sma': False, 'bull_use_ema': False, 'bull_use_atr': True, 'bull_use_adx': True, 'bull_use_spike': False, 'bull_rsi_required': True, 'bear_strategy': 'mean_reversion', 'bear_bb_std_mult': 3.2801593316994797, 'bear_rsi_os': 44, 'bear_rsi_ob': 72, 'bear_adx_thresh': 34.252363921877574, 'bear_atr_min_pct': 0.007298053294569824, 'bear_atr_max_pct': 0.048606740626637474, 'bear_tp_mult': 2.9345513125646043, 'bear_tsl_mult': 0.0527519569460563, 'bear_time_stop': 281, 'bear_use_sma': True, 'bear_use_ema': True, 'bear_use_atr': True, 'bear_use_adx': True, 'bear_use_spike': True, 'bear_rsi_required': False, 'sideways_strategy': 'breakout', 'sideways_bb_std_mult': 3.528615300344207, 'sideways_rsi_os': 7, 'sideways_rsi_ob': 57, 'sideways_adx_thresh': 30.09024384653611, 'sideways_atr_min_pct': 0.021514606381790653, 'sideways_atr_max_pct': 0.11452417915873905, 'sideways_tp_mult': 1.9380710748475525, 'sideways_tsl_mult': 0.6418162557217317, 'sideways_time_stop': 168, 'sideways_use_sma': False, 'sideways_use_ema': False, 'sideways_use_atr': False, 'sideways_use_adx': False, 'sideways_use_spike': False, 'sideways_rsi_required': True}.
[I 2025-09-01 03:54:50,279] Trial 543 finished with values: [-1000000000.0, 1000000000.0] and parameters: {'p_sma': 19, 'p_std': 54, 'p_atr': 26, 'p_adx': 12, 'rsi_period': 71, 'ema1': 12, 'ema2': 53, 'slip_atr_k': 0.0046668990930607245, 'slip_spread_k': 0.04384597320736575, 'spread_hl_frac': 0.04693663806761636, 'bb_std_mult': 2.386422938116839, 'rsi_os': 46, 'rsi_ob': 80, 'vol_spike': 0.1972657029313986, 'adx_thresh': 13.084747835397156, 'atr_min_pct': 0.011298244125663453, 'atr_max_pct': 0.04979022668454682, 'tp_mult': 2.5245287930246647, 'tsl_mult': 0.298513880532903, 'strategy': 'breakout', 'time_stop': 87, 'use_sma': True, 'use_atr': False, 'use_adx': False, 'use_ema': True, 'use_spike': False, 'rsi_required': True, 'edge_k': 0.20895598637884322, 'edge_cap': 0.2464347686603293, 'bull_strategy': 'mean_reversion', 'bull_bb_std_mult': 0.7747602565909617, 'bull_rsi_os': 10, 'bull_rsi_ob': 78, 'bull_adx_thresh': 9.760220144069631, 'bull_atr_min_pct': 0.004346499836703351, 'bull_atr_max_pct': 0.10908590440455597, 'bull_tp_mult': 1.540865727806122, 'bull_tsl_mult': 0.24207866937231848, 'bull_time_stop': 300, 'bull_use_sma': False, 'bull_use_ema': True, 'bull_use_atr': True, 'bull_use_adx': True, 'bull_use_spike': False, 'bull_rsi_required': True, 'bear_strategy': 'mean_reversion', 'bear_bb_std_mult': 3.2968891144569974, 'bear_rsi_os': 44, 'bear_rsi_ob': 72, 'bear_adx_thresh': 33.14620996899666, 'bear_atr_min_pct': 0.01012840418810074, 'bear_atr_max_pct': 0.05068453724102316, 'bear_tp_mult': 2.878918969221126, 'bear_tsl_mult': 0.06484163935374732, 'bear_time_stop': 275, 'bear_use_sma': True, 'bear_use_ema': True, 'bear_use_atr': True, 'bear_use_adx': True, 'bear_use_spike': True, 'bear_rsi_required': False, 'sideways_strategy': 'breakout', 'sideways_bb_std_mult': 3.465017632765061, 'sideways_rsi_os': 8, 'sideways_rsi_ob': 59, 'sideways_adx_thresh': 30.907513399526636, 'sideways_atr_min_pct': 0.02367302172517244, 'sideways_atr_max_pct': 0.11298591627244647, 'sideways_tp_mult': 1.9333302927045022, 'sideways_tsl_mult': 0.7120976745863334, 'sideways_time_stop': 155, 'sideways_use_sma': False, 'sideways_use_ema': False, 'sideways_use_atr': False, 'sideways_use_adx': False, 'sideways_use_spike': False, 'sideways_rsi_required': True}.
[I 2025-09-01 03:54:50,605] Trial 544 finished with values: [-1000000000.0, 1000000000.0] and parameters: {'p_sma': 16, 'p_std': 48, 'p_atr': 24, 'p_adx': 12, 'rsi_period': 46, 'ema1': 12, 'ema2': 49, 'slip_atr_k': 4.381724491735943e-05, 'slip_spread_k': 0.04559349832108144, 'spread_hl_frac': 0.04709859763682616, 'bb_std_mult': 2.428545178721368, 'rsi_os': 41, 'rsi_ob': 80, 'vol_spike': 0.1803191437771259, 'adx_thresh': 12.909027190483135, 'atr_min_pct': 0.012379868441294906, 'atr_max_pct': 0.046862621958525794, 'tp_mult': 2.5184958245421103, 'tsl_mult': 0.29569726409236624, 'strategy': 'mean_reversion', 'time_stop': 89, 'use_sma': True, 'use_atr': False, 'use_adx': False, 'use_ema': True, 'use_spike': False, 'rsi_required': True, 'edge_k': 0.20018215989736765, 'edge_cap': 0.26488032182365817, 'bull_strategy': 'mean_reversion', 'bull_bb_std_mult': 0.7951614235142236, 'bull_rsi_os': 6, 'bull_rsi_ob': 78, 'bull_adx_thresh': 6.797697132122793, 'bull_atr_min_pct': 0.0012245239010626812, 'bull_atr_max_pct': 0.10763311323542459, 'bull_tp_mult': 1.425397197574161, 'bull_tsl_mult': 0.24183865312708225, 'bull_time_stop': 300, 'bull_use_sma': False, 'bull_use_ema': False, 'bull_use_atr': True, 'bull_use_adx': True, 'bull_use_spike': False, 'bull_rsi_required': True, 'bear_strategy': 'mean_reversion', 'bear_bb_std_mult': 3.3032923666299028, 'bear_rsi_os': 44, 'bear_rsi_ob': 72, 'bear_adx_thresh': 34.31742594950221, 'bear_atr_min_pct': 0.007368330331260606, 'bear_atr_max_pct': 0.055248061147127166, 'bear_tp_mult': 2.9243164498502185, 'bear_tsl_mult': 0.05781797149475229, 'bear_time_stop': 274, 'bear_use_sma': True, 'bear_use_ema': True, 'bear_use_atr': True, 'bear_use_adx': True, 'bear_use_spike': True, 'bear_rsi_required': False, 'sideways_strategy': 'breakout', 'sideways_bb_std_mult': 3.5018485572032865, 'sideways_rsi_os': 8, 'sideways_rsi_ob': 59, 'sideways_adx_thresh': 29.736570465327237, 'sideways_atr_min_pct': 0.023645858540541586, 'sideways_atr_max_pct': 0.11009413585489922, 'sideways_tp_mult': 1.9312710181061916, 'sideways_tsl_mult': 0.7010745767846747, 'sideways_time_stop': 155, 'sideways_use_sma': False, 'sideways_use_ema': False, 'sideways_use_atr': False, 'sideways_use_adx': False, 'sideways_use_spike': False, 'sideways_rsi_required': True}.
[I 2025-09-01 03:54:50,829] Trial 545 finished with values: [-1000000000.0, 1000000000.0] and parameters: {'p_sma': 18, 'p_std': 51, 'p_atr': 24, 'p_adx': 12, 'rsi_period': 38, 'ema1': 12, 'ema2': 48, 'slip_atr_k': 0.007644740252828032, 'slip_spread_k': 0.04176110597942573, 'spread_hl_frac': 0.04701481341528999, 'bb_std_mult': 2.4343330547624196, 'rsi_os': 41, 'rsi_ob': 80, 'vol_spike': 0.1959815221852219, 'adx_thresh': 13.577582907672834, 'atr_min_pct': 0.012617165470440162, 'atr_max_pct': 0.07926157390320647, 'tp_mult': 2.51868189219564, 'tsl_mult': 0.2986127588971264, 'strategy': 'mean_reversion', 'time_stop': 91, 'use_sma': True, 'use_atr': False, 'use_adx': False, 'use_ema': True, 'use_spike': False, 'rsi_required': True, 'edge_k': 0.21247931193845374, 'edge_cap': 0.21778721685987773, 'bull_strategy': 'mean_reversion', 'bull_bb_std_mult': 0.9104772994962992, 'bull_rsi_os': 6, 'bull_rsi_ob': 78, 'bull_adx_thresh': 7.090321304644789, 'bull_atr_min_pct': 0.020648815679077805, 'bull_atr_max_pct': 0.10997781511979748, 'bull_tp_mult': 1.5457811489552886, 'bull_tsl_mult': 0.25006835443612696, 'bull_time_stop': 295, 'bull_use_sma': False, 'bull_use_ema': False, 'bull_use_atr': True, 'bull_use_adx': True, 'bull_use_spike': False, 'bull_rsi_required': True, 'bear_strategy': 'mean_reversion', 'bear_bb_std_mult': 3.3175433126551828, 'bear_rsi_os': 45, 'bear_rsi_ob': 71, 'bear_adx_thresh': 33.524647384626604, 'bear_atr_min_pct': 0.007359954783007282, 'bear_atr_max_pct': 0.047561859600627386, 'bear_tp_mult': 2.917503127567501, 'bear_tsl_mult': 0.0506582362091455, 'bear_time_stop': 284, 'bear_use_sma': True, 'bear_use_ema': True, 'bear_use_atr': True, 'bear_use_adx': True, 'bear_use_spike': True, 'bear_rsi_required': False, 'sideways_strategy': 'breakout', 'sideways_bb_std_mult': 3.5197616485015994, 'sideways_rsi_os': 7, 'sideways_rsi_ob': 56, 'sideways_adx_thresh': 29.700409652505083, 'sideways_atr_min_pct': 0.023781330083720114, 'sideways_atr_max_pct': 0.1131498203030103, 'sideways_tp_mult': 1.931275704524758, 'sideways_tsl_mult': 0.7084947769691404, 'sideways_time_stop': 167, 'sideways_use_sma': False, 'sideways_use_ema': False, 'sideways_use_atr': False, 'sideways_use_adx': False, 'sideways_use_spike': False, 'sideways_rsi_required': True}.
[I 2025-09-01 03:54:51,773] Trial 549 finished with values: [-1000000000.0, 1000000000.0] and parameters: {'p_sma': 20, 'p_std': 51, 'p_atr': 24, 'p_adx': 11, 'rsi_period': 10, 'ema1': 13, 'ema2': 52, 'slip_atr_k': 4.6837644126891675e-05, 'slip_spread_k': 0.06529111161929091, 'spread_hl_frac': 0.04291420790531813, 'bb_std_mult': 2.19624205056725, 'rsi_os': 44, 'rsi_ob': 81, 'vol_spike': 0.1910126685542493, 'adx_thresh': 14.490266668700485, 'atr_min_pct': 0.010578219682950724, 'atr_max_pct': 0.010248468563406166, 'tp_mult': 2.5780038726094126, 'tsl_mult': 0.33383320150126955, 'strategy': 'mean_reversion', 'time_stop': 99, 'use_sma': True, 'use_atr': True, 'use_adx': False, 'use_ema': True, 'use_spike': False, 'rsi_required': True, 'edge_k': 0.24037814511335553, 'edge_cap': 0.32043375246851025, 'bull_strategy': 'mean_reversion', 'bull_bb_std_mult': 0.5668100760204815, 'bull_rsi_os': 7, 'bull_rsi_ob': 76, 'bull_adx_thresh': 7.329709064122481, 'bull_atr_min_pct': 0.0007244004733425008, 'bull_atr_max_pct': 0.10471764615626536, 'bull_tp_mult': 1.5200691236233983, 'bull_tsl_mult': 0.301814301807789, 'bull_time_stop': 292, 'bull_use_sma': False, 'bull_use_ema': False, 'bull_use_atr': True, 'bull_use_adx': True, 'bull_use_spike': False, 'bull_rsi_required': True, 'bear_strategy': 'mean_reversion', 'bear_bb_std_mult': 3.1944675789441486, 'bear_rsi_os': 47, 'bear_rsi_ob': 69, 'bear_adx_thresh': 32.33433549995598, 'bear_atr_min_pct': 0.00825749248456729, 'bear_atr_max_pct': 0.05851591007040193, 'bear_tp_mult': 2.99105567411476, 'bear_tsl_mult': 0.031895897024787775, 'bear_time_stop': 284, 'bear_use_sma': True, 'bear_use_ema': True, 'bear_use_atr': True, 'bear_use_adx': True, 'bear_use_spike': True, 'bear_rsi_required': False, 'sideways_strategy': 'breakout', 'sideways_bb_std_mult': 3.596408625290458, 'sideways_rsi_os': 5, 'sideways_rsi_ob': 61, 'sideways_adx_thresh': 32.22766957047135, 'sideways_atr_min_pct': 0.02277805718697222, 'sideways_atr_max_pct': 0.10745187130544222, 'sideways_tp_mult': 2.0189039069227257, 'sideways_tsl_mult': 0.6718880907505657, 'sideways_time_stop': 144, 'sideways_use_sma': False, 'sideways_use_ema': False, 'sideways_use_atr': False, 'sideways_use_adx': False, 'sideways_use_spike': False, 'sideways_rsi_required': False}.
[I 2025-09-01 03:55:32,526] Trial 550 finished with values: [-1000000000.0, 1000000000.0] and parameters: {'p_sma': 16, 'p_std': 51, 'p_atr': 25, 'p_adx': 11, 'rsi_period': 10, 'ema1': 13, 'ema2': 52, 'slip_atr_k': 0.00958364160844295, 'slip_spread_k': 0.06698566465999878, 'spread_hl_frac': 0.042926194187492994, 'bb_std_mult': 2.562685483639476, 'rsi_os': 44, 'rsi_ob': 53, 'vol_spike': 0.19158453606144235, 'adx_thresh': 15.347388634809386, 'atr_min_pct': 0.010687536438369472, 'atr_max_pct': 0.053366683228083106, 'tp_mult': 2.571102645774821, 'tsl_mult': 0.840091969115724, 'strategy': 'mean_reversion', 'time_stop': 68, 'use_sma': True, 'use_atr': True, 'use_adx': False, 'use_ema': True, 'use_spike': False, 'rsi_required': True, 'edge_k': 0.2716372360058489, 'edge_cap': 0.22621295858377377, 'bull_strategy': 'mean_reversion', 'bull_bb_std_mult': 0.8434002390763808, 'bull_rsi_os': 6, 'bull_rsi_ob': 76, 'bull_adx_thresh': 8.094332410896724, 'bull_atr_min_pct': 0.0008457294795406588, 'bull_atr_max_pct': 0.10444509755396926, 'bull_tp_mult': 1.4869658239229733, 'bull_tsl_mult': 0.7437350938803949, 'bull_time_stop': 294, 'bull_use_sma': False, 'bull_use_ema': False, 'bull_use_atr': True, 'bull_use_adx': True, 'bull_use_spike': False, 'bull_rsi_required': True, 'bear_strategy': 'mean_reversion', 'bear_bb_std_mult': 3.1920602089493952, 'bear_rsi_os': 47, 'bear_rsi_ob': 71, 'bear_adx_thresh': 32.55655305103796, 'bear_atr_min_pct': 0.008349159313762566, 'bear_atr_max_pct': 0.05799929445710543, 'bear_tp_mult': 2.9912663259820773, 'bear_tsl_mult': 0.020725658292458204, 'bear_time_stop': 287, 'bear_use_sma': True, 'bear_use_ema': True, 'bear_use_atr': True, 'bear_use_adx': True, 'bear_use_spike': False, 'bear_rsi_required': False, 'sideways_strategy': 'breakout', 'sideways_bb_std_mult': 3.5973104109250187, 'sideways_rsi_os': 5, 'sideways_rsi_ob': 60, 'sideways_adx_thresh': 32.22972832486213, 'sideways_atr_min_pct': 0.023083937284191947, 'sideways_atr_max_pct': 0.1072803725367516, 'sideways_tp_mult': 2.0203401491738253, 'sideways_tsl_mult': 0.6743112404938411, 'sideways_time_stop': 148, 'sideways_use_sma': False, 'sideways_use_ema': False, 'sideways_use_atr': False, 'sideways_use_adx': False, 'sideways_use_spike': False, 'sideways_rsi_required': False}.
