[I 2025-09-01 03:08:48,463] Trial 279 finished with values: [-0.03586412770386593, 0.03574408769002097] and parameters: {'p_sma': 41, 'p_std': 11, 'p_atr': 28, 'p_adx': 18, 'rsi_period': 78, 'ema1': 21, 'ema2': 53, 'slip_atr_k': 0.029408603740183975, 'slip_spread_k': 0.12175866847448014, 'spread_hl_frac': 0.03836966504610271, 'bb_std_mult': 3.402083695663257, 'rsi_os': 30, 'rsi_ob': 83, 'vol_spike': 0.2733895485911315, 'adx_thresh': 10.57249535970182, 'atr_min_pct': 0.00824538781805864, 'atr_max_pct': 0.04593716602794422, 'tp_mult': 2.8154290255255177, 'tsl_mult': 0.37391920143151697, 'strategy': 'mean_reversion', 'time_stop': 26, 'use_sma': False, 'use_atr': False, 'use_adx': True, 'use_ema': False, 'use_spike': True, 'rsi_required': False, 'edge_k': 1.8255651028911988, 'edge_cap': 0.43613150583497096, 'bull_strategy': 'breakout', 'bull_bb_std_mult': 0.8419061817170808, 'bull_rsi_os': 23, 'bull_rsi_ob': 75, 'bull_adx_thresh': 9.057447266590385, 'bull_atr_min_pct': 0.0015778583649953188, 'bull_atr_max_pct': 0.0451031543932567, 'bull_tp_mult': 1.7225255380200792, 'bull_tsl_mult': 0.15657972215550486, 'bull_time_stop': 253, 'bull_use_sma': True, 'bull_use_ema': False, 'bull_use_atr': False, 'bull_use_adx': False, 'bull_use_spike': True, 'bull_rsi_required': False, 'bear_strategy': 'breakout', 'bear_bb_std_mult': 2.220778580043066, 'bear_rsi_os': 18, 'bear_rsi_ob': 59, 'bear_adx_thresh': 25.316189464776937, 'bear_atr_min_pct': 0.025554719427202225, 'bear_atr_max_pct': 0.08800242168272146, 'bear_tp_mult': 1.0110365023035974, 'bear_tsl_mult': 0.193045429447783, 'bear_time_stop': 233, 'bear_use_sma': True, 'bear_use_ema': False, 'bear_use_atr': False, 'bear_use_adx': False, 'bear_use_spike': True, 'bear_rsi_required': True, 'sideways_strategy': 'mean_reversion', 'sideways_bb_std_mult': 1.8721436007736711, 'sideways_rsi_os': 36, 'sideways_rsi_ob': 77, 'sideways_adx_thresh': 25.302374585286586, 'sideways_atr_min_pct': 0.027160818231473375, 'sideways_atr_max_pct': 0.02210349864044253, 'sideways_tp_mult': 1.8017180303931575, 'sideways_tsl_mult': 0.2531637410346271, 'sideways_time_stop': 128, 'sideways_use_sma': True, 'sideways_use_ema': True, 'sideways_use_atr': False, 'sideways_use_adx': False, 'sideways_use_spike': True, 'sideways_rsi_required': True}.
[I 2025-09-01 03:08:48,861] Trial 280 finished with values: [-1000000000.0, 1000000000.0] and parameters: {'p_sma': 56, 'p_std': 57, 'p_atr': 28, 'p_adx': 18, 'rsi_period': 29, 'ema1': 21, 'ema2': 55, 'slip_atr_k': 0.21343942023787316, 'slip_spread_k': 0.12853190258977298, 'spread_hl_frac': 0.028182416905171932, 'bb_std_mult': 1.4495547530824473, 'rsi_os': 28, 'rsi_ob': 83, 'vol_spike': 0.2786649780645859, 'adx_thresh': 13.069367951232188, 'atr_min_pct': 0.0075830107368794865, 'atr_max_pct': 0.13730970654416674, 'tp_mult': 2.6002635477761995, 'tsl_mult': 0.3789868227988712, 'strategy': 'mean_reversion', 'time_stop': 187, 'use_sma': False, 'use_atr': False, 'use_adx': True, 'use_ema': False, 'use_spike': True, 'rsi_required': False, 'edge_k': 1.860206928411027, 'edge_cap': 0.43376634446962664, 'bull_strategy': 'breakout', 'bull_bb_std_mult': 0.7662225775805487, 'bull_rsi_os': 23, 'bull_rsi_ob': 76, 'bull_adx_thresh': 17.560783076959034, 'bull_atr_min_pct': 0.0017690545317787121, 'bull_atr_max_pct': 0.11882725088437028, 'bull_tp_mult': 1.7146100395968025, 'bull_tsl_mult': 0.00022028914200644678, 'bull_time_stop': 96, 'bull_use_sma': True, 'bull_use_ema': False, 'bull_use_atr': False, 'bull_use_adx': False, 'bull_use_spike': False, 'bull_rsi_required': False, 'bear_strategy': 'breakout', 'bear_bb_std_mult': 2.2200972415507696, 'bear_rsi_os': 18, 'bear_rsi_ob': 45, 'bear_adx_thresh': 25.303073311070477, 'bear_atr_min_pct': 0.027099494765186725, 'bear_atr_max_pct': 0.016379248651366293, 'bear_tp_mult': 1.0103007566106623, 'bear_tsl_mult': 0.1520532973239679, 'bear_time_stop': 252, 'bear_use_sma': False, 'bear_use_ema': False, 'bear_use_atr': False, 'bear_use_adx': False, 'bear_use_spike': True, 'bear_rsi_required': True, 'sideways_strategy': 'breakout', 'sideways_bb_std_mult': 1.6777724990588374, 'sideways_rsi_os': 35, 'sideways_rsi_ob': 86, 'sideways_adx_thresh': 24.875864390346344, 'sideways_atr_min_pct': 0.028497485813117368, 'sideways_atr_max_pct': 0.017565923320806833, 'sideways_tp_mult': 2.5561906971478794, 'sideways_tsl_mult': 0.16587892712874708, 'sideways_time_stop': 130, 'sideways_use_sma': True, 'sideways_use_ema': True, 'sideways_use_atr': True, 'sideways_use_adx': False, 'sideways_use_spike': True, 'sideways_rsi_required': True}.
[I 2025-09-01 03:09:27,007] Trial 282 finished with values: [-0.026426851080970537, 0.026272693946802008] and parameters: {'p_sma': 22, 'p_std': 29, 'p_atr': 28, 'p_adx': 23, 'rsi_period': 12, 'ema1': 21, 'ema2': 29, 'slip_atr_k': 0.024392911342774562, 'slip_spread_k': 0.799459843942732, 'spread_hl_frac': 0.026888128143048858, 'bb_std_mult': 0.6590086220530755, 'rsi_os': 24, 'rsi_ob': 75, 'vol_spike': 0.22605681100559918, 'adx_thresh': 12.29626871154928, 'atr_min_pct': 0.007529605456157082, 'atr_max_pct': 0.13862601923175757, 'tp_mult': 2.604805257605992, 'tsl_mult': 0.33197068876519137, 'strategy': 'mean_reversion', 'time_stop': 109, 'use_sma': False, 'use_atr': False, 'use_adx': True, 'use_ema': True, 'use_spike': True, 'rsi_required': False, 'edge_k': 0.10862298450710794, 'edge_cap': 0.9637262231722231, 'bull_strategy': 'breakout', 'bull_bb_std_mult': 1.9110451230098837, 'bull_rsi_os': 15, 'bull_rsi_ob': 77, 'bull_adx_thresh': 24.972857817759234, 'bull_atr_min_pct': 0.0019890196137927318, 'bull_atr_max_pct': 0.04330787049052375, 'bull_tp_mult': 1.7098075933283388, 'bull_tsl_mult': 0.09298909665190908, 'bull_time_stop': 256, 'bull_use_sma': True, 'bull_use_ema': False, 'bull_use_atr': False, 'bull_use_adx': False, 'bull_use_spike': False, 'bull_rsi_required': False, 'bear_strategy': 'breakout', 'bear_bb_std_mult': 2.251909693313317, 'bear_rsi_os': 18, 'bear_rsi_ob': 59, 'bear_adx_thresh': 32.16567111838048, 'bear_atr_min_pct': 8.059561481584508e-05, 'bear_atr_max_pct': 0.01436019575898279, 'bear_tp_mult': 2.7494259656938547, 'bear_tsl_mult': 0.7885345816517403, 'bear_time_stop': 83, 'bear_use_sma': False, 'bear_use_ema': False, 'bear_use_atr': True, 'bear_use_adx': False, 'bear_use_spike': True, 'bear_rsi_required': True, 'sideways_strategy': 'breakout', 'sideways_bb_std_mult': 0.825787905467428, 'sideways_rsi_os': 36, 'sideways_rsi_ob': 75, 'sideways_adx_thresh': 25.148386005121246, 'sideways_atr_min_pct': 0.02699460068272228, 'sideways_atr_max_pct': 0.020970356163904143, 'sideways_tp_mult': 1.7923333266814194, 'sideways_tsl_mult': 0.7491430115938362, 'sideways_time_stop': 129, 'sideways_use_sma': True, 'sideways_use_ema': False, 'sideways_use_atr': True, 'sideways_use_adx': False, 'sideways_use_spike': True, 'sideways_rsi_required': True}.
[I 2025-09-01 03:09:27,330] Trial 283 finished with values: [-1000000000.0, 1000000000.0] and parameters: {'p_sma': 22, 'p_std': 58, 'p_atr': 28, 'p_adx': 25, 'rsi_period': 12, 'ema1': 19, 'ema2': 31, 'slip_atr_k': 0.2294874720091392, 'slip_spread_k': 0.6450219889696566, 'spread_hl_frac': 0.03523397534133997, 'bb_std_mult': 1.5898260560037514, 'rsi_os': 24, 'rsi_ob': 76, 'vol_spike': 0.23324951655787612, 'adx_thresh': 13.5013985587371, 'atr_min_pct': 0.007515876071261365, 'atr_max_pct': 0.05023657372471764, 'tp_mult': 2.601125462531122, 'tsl_mult': 0.8750254152961039, 'strategy': 'mean_reversion', 'time_stop': 194, 'use_sma': True, 'use_atr': False, 'use_adx': True, 'use_ema': True, 'use_spike': True, 'rsi_required': False, 'edge_k': 0.111790548907018, 'edge_cap': 0.40542033339485894, 'bull_strategy': 'breakout', 'bull_bb_std_mult': 3.537466322302355, 'bull_rsi_os': 15, 'bull_rsi_ob': 54, 'bull_adx_thresh': 22.165059041603964, 'bull_atr_min_pct': 0.0020352957990565587, 'bull_atr_max_pct': 0.11936024056265619, 'bull_tp_mult': 2.80819440681072, 'bull_tsl_mult': 0.10339720582612061, 'bull_time_stop': 294, 'bull_use_sma': True, 'bull_use_ema': False, 'bull_use_atr': False, 'bull_use_adx': False, 'bull_use_spike': False, 'bull_rsi_required': False, 'bear_strategy': 'breakout', 'bear_bb_std_mult': 2.272562116330366, 'bear_rsi_os': 34, 'bear_rsi_ob': 82, 'bear_adx_thresh': 26.651653321340344, 'bear_atr_min_pct': 0.027226670101228152, 'bear_atr_max_pct': 0.09809264517607218, 'bear_tp_mult': 2.751164860935106, 'bear_tsl_mult': 0.09504551060383937, 'bear_time_stop': 261, 'bear_use_sma': False, 'bear_use_ema': False, 'bear_use_atr': True, 'bear_use_adx': False, 'bear_use_spike': True, 'bear_rsi_required': True, 'sideways_strategy': 'breakout', 'sideways_bb_std_mult': 1.8326572522291555, 'sideways_rsi_os': 46, 'sideways_rsi_ob': 86, 'sideways_adx_thresh': 22.08469946713007, 'sideways_atr_min_pct': 0.020014468711491887, 'sideways_atr_max_pct': 0.01702039716498207, 'sideways_tp_mult': 2.221424610173152, 'sideways_tsl_mult': 0.06637221469895438, 'sideways_time_stop': 114, 'sideways_use_sma': True, 'sideways_use_ema': False, 'sideways_use_atr': True, 'sideways_use_adx': False, 'sideways_use_spike': True, 'sideways_rsi_required': True}.
[I 2025-09-01 03:09:27,648] Trial 284 finished with values: [-0.019833238545148957, 0.019635918778186] and parameters: {'p_sma': 50, 'p_std': 53, 'p_atr': 28, 'p_adx': 17, 'rsi_period': 12, 'ema1': 22, 'ema2': 38, 'slip_atr_k': 0.22570093914547373, 'slip_spread_k': 0.6418836640054768, 'spread_hl_frac': 0.0264528989710668, 'bb_std_mult': 1.5934028289482693, 'rsi_os': 24, 'rsi_ob': 75, 'vol_spike': 0.054012645176131746, 'adx_thresh': 13.491939395576392, 'atr_min_pct': 0.007036590180784099, 'atr_max_pct': 0.05113613732627493, 'tp_mult': 1.2960329869806348, 'tsl_mult': 0.5443117877576634, 'strategy': 'mean_reversion', 'time_stop': 129, 'use_sma': True, 'use_atr': False, 'use_adx': True, 'use_ema': True, 'use_spike': True, 'rsi_required': False, 'edge_k': 1.2803237488365338, 'edge_cap': 0.40180699804933256, 'bull_strategy': 'breakout', 'bull_bb_std_mult': 3.389688987719652, 'bull_rsi_os': 15, 'bull_rsi_ob': 53, 'bull_adx_thresh': 24.992017030486867, 'bull_atr_min_pct': 0.0020161210612907607, 'bull_atr_max_pct': 0.11305876311750299, 'bull_tp_mult': 1.610686386745604, 'bull_tsl_mult': 0.1931778520934489, 'bull_time_stop': 240, 'bull_use_sma': True, 'bull_use_ema': False, 'bull_use_atr': False, 'bull_use_adx': True, 'bull_use_spike': False, 'bull_rsi_required': False, 'bear_strategy': 'breakout', 'bear_bb_std_mult': 2.290372251999924, 'bear_rsi_os': 34, 'bear_rsi_ob': 82, 'bear_adx_thresh': 26.2341830190039, 'bear_atr_min_pct': 0.027540855439758736, 'bear_atr_max_pct': 0.013022275960569013, 'bear_tp_mult': 2.7384171423671626, 'bear_tsl_mult': 0.7081864033854745, 'bear_time_stop': 276, 'bear_use_sma': False, 'bear_use_ema': True, 'bear_use_atr': True, 'bear_use_adx': False, 'bear_use_spike': True, 'bear_rsi_required': False, 'sideways_strategy': 'breakout', 'sideways_bb_std_mult': 1.8392924821914054, 'sideways_rsi_os': 54, 'sideways_rsi_ob': 74, 'sideways_adx_thresh': 11.555790546586023, 'sideways_atr_min_pct': 0.004451063704662743, 'sideways_atr_max_pct': 0.13876512446281547, 'sideways_tp_mult': 2.4302832556028933, 'sideways_tsl_mult': 0.20319104425117251, 'sideways_time_stop': 115, 'sideways_use_sma': True, 'sideways_use_ema': False, 'sideways_use_atr': True, 'sideways_use_adx': False, 'sideways_use_spike': True, 'sideways_rsi_required': True}.
[I 2025-09-01 03:09:27,803] Trial 281 finished with values: [-1000000000.0, 1000000000.0] and parameters: {'p_sma': 19, 'p_std': 57, 'p_atr': 28, 'p_adx': 17, 'rsi_period': 29, 'ema1': 19, 'ema2': 31, 'slip_atr_k': 0.02436184203788591, 'slip_spread_k': 0.15096496124006756, 'spread_hl_frac': 0.028309376457804566, 'bb_std_mult': 0.6866564800867525, 'rsi_os': 18, 'rsi_ob': 75, 'vol_spike': 0.029054050130224385, 'adx_thresh': 10.612741490490503, 'atr_min_pct': 0.007627448539712631, 'atr_max_pct': 0.045203974590766346, 'tp_mult': 2.811732903375453, 'tsl_mult': 0.37417154380657763, 'strategy': 'mean_reversion', 'time_stop': 186, 'use_sma': False, 'use_atr': False, 'use_adx': True, 'use_ema': True, 'use_spike': True, 'rsi_required': False, 'edge_k': 1.281235000204398, 'edge_cap': 0.6056415275907789, 'bull_strategy': 'breakout', 'bull_bb_std_mult': 1.8971440087379432, 'bull_rsi_os': 15, 'bull_rsi_ob': 51, 'bull_adx_thresh': 21.334915188903935, 'bull_atr_min_pct': 0.0017532698336555001, 'bull_atr_max_pct': 0.05145395427463917, 'bull_tp_mult': 2.046747759857642, 'bull_tsl_mult': 0.15813092792378386, 'bull_time_stop': 294, 'bull_use_sma': True, 'bull_use_ema': False, 'bull_use_atr': False, 'bull_use_adx': False, 'bull_use_spike': False, 'bull_rsi_required': False, 'bear_strategy': 'breakout', 'bear_bb_std_mult': 2.3053408759056464, 'bear_rsi_os': 18, 'bear_rsi_ob': 83, 'bear_adx_thresh': 26.280222551706302, 'bear_atr_min_pct': 0.027208336134724648, 'bear_atr_max_pct': 0.1027510882062146, 'bear_tp_mult': 2.808091501342492, 'bear_tsl_mult': 0.1556403019467189, 'bear_time_stop': 64, 'bear_use_sma': False, 'bear_use_ema': False, 'bear_use_atr': True, 'bear_use_adx': False, 'bear_use_spike': True, 'bear_rsi_required': True, 'sideways_strategy': 'breakout', 'sideways_bb_std_mult': 1.8507555850611481, 'sideways_rsi_os': 46, 'sideways_rsi_ob': 75, 'sideways_adx_thresh': 24.27924945053111, 'sideways_atr_min_pct': 0.02714600734472647, 'sideways_atr_max_pct': 0.145158491308052, 'sideways_tp_mult': 2.466557788596307, 'sideways_tsl_mult': 0.7417923522703969, 'sideways_time_stop': 99, 'sideways_use_sma': True, 'sideways_use_ema': False, 'sideways_use_atr': True, 'sideways_use_adx': False, 'sideways_use_spike': True, 'sideways_rsi_required': True}.
[I 2025-09-01 03:09:28,434] Trial 286 finished with values: [-1000000000.0, 1000000000.0] and parameters: {'p_sma': 51, 'p_std': 53, 'p_atr': 15, 'p_adx': 17, 'rsi_period': 43, 'ema1': 22, 'ema2': 43, 'slip_atr_k': 0.1112678039129169, 'slip_spread_k': 0.15233666706248544, 'spread_hl_frac': 0.039596153033449745, 'bb_std_mult': 1.371103234585456, 'rsi_os': 35, 'rsi_ob': 45, 'vol_spike': 0.02732879198853151, 'adx_thresh': 34.18668520229936, 'atr_min_pct': 0.006653595660395181, 'atr_max_pct': 0.05341861693426493, 'tp_mult': 2.402237679553191, 'tsl_mult': 0.5461552522403794, 'strategy': 'mean_reversion', 'time_stop': 130, 'use_sma': True, 'use_atr': False, 'use_adx': True, 'use_ema': False, 'use_spike': True, 'rsi_required': False, 'edge_k': 0.03542250913211889, 'edge_cap': 0.5020536685877379, 'bull_strategy': 'breakout', 'bull_bb_std_mult': 0.611125640292679, 'bull_rsi_os': 18, 'bull_rsi_ob': 53, 'bull_adx_thresh': 23.544493318336507, 'bull_atr_min_pct': 0.029390250843250358, 'bull_atr_max_pct': 0.11310765723102635, 'bull_tp_mult': 2.075356985525415, 'bull_tsl_mult': 0.04951001741114208, 'bull_time_stop': 267, 'bull_use_sma': True, 'bull_use_ema': False, 'bull_use_atr': False, 'bull_use_adx': True, 'bull_use_spike': True, 'bull_rsi_required': False, 'bear_strategy': 'breakout', 'bear_bb_std_mult': 0.9308328903712721, 'bear_rsi_os': 53, 'bear_rsi_ob': 55, 'bear_adx_thresh': 24.61846063989465, 'bear_atr_min_pct': 0.026756202126696244, 'bear_atr_max_pct': 0.01873436187348518, 'bear_tp_mult': 1.9868482987894358, 'bear_tsl_mult': 0.7020172153741089, 'bear_time_stop': 89, 'bear_use_sma': False, 'bear_use_ema': True, 'bear_use_atr': False, 'bear_use_adx': False, 'bear_use_spike': True, 'bear_rsi_required': False, 'sideways_strategy': 'breakout', 'sideways_bb_std_mult': 1.9804460743292018, 'sideways_rsi_os': 54, 'sideways_rsi_ob': 74, 'sideways_adx_thresh': 32.72923309620338, 'sideways_atr_min_pct': 0.004423831074799458, 'sideways_atr_max_pct': 0.024374132661273848, 'sideways_tp_mult': 2.273720705543959, 'sideways_tsl_mult': 0.368000664019536, 'sideways_time_stop': 118, 'sideways_use_sma': True, 'sideways_use_ema': True, 'sideways_use_atr': True, 'sideways_use_adx': False, 'sideways_use_spike': True, 'sideways_rsi_required': True}.
[I 2025-09-01 03:10:06,768] Trial 285 finished with values: [-1000000000.0, 1000000000.0] and parameters: {'p_sma': 20, 'p_std': 58, 'p_atr': 17, 'p_adx': 17, 'rsi_period': 44, 'ema1': 22, 'ema2': 56, 'slip_atr_k': 0.015605636995688912, 'slip_spread_k': 0.1563367427144186, 'spread_hl_frac': 0.03302756001872992, 'bb_std_mult': 1.5824588629066871, 'rsi_os': 34, 'rsi_ob': 89, 'vol_spike': 0.029475636273428724, 'adx_thresh': 20.503823787784057, 'atr_min_pct': 0.006827367903111245, 'atr_max_pct': 0.1316932662366382, 'tp_mult': 2.932608232550896, 'tsl_mult': 0.4329700814372157, 'strategy': 'mean_reversion', 'time_stop': 166, 'use_sma': True, 'use_atr': False, 'use_adx': True, 'use_ema': True, 'use_spike': True, 'rsi_required': False, 'edge_k': 1.2966360908334393, 'edge_cap': 0.40673404449782724, 'bull_strategy': 'breakout', 'bull_bb_std_mult': 3.253899370641996, 'bull_rsi_os': 33, 'bull_rsi_ob': 53, 'bull_adx_thresh': 21.511256461489253, 'bull_atr_min_pct': 0.029260699938273915, 'bull_atr_max_pct': 0.11214786284571779, 'bull_tp_mult': 1.0901372654388242, 'bull_tsl_mult': 0.4077553768125684, 'bull_time_stop': 295, 'bull_use_sma': True, 'bull_use_ema': False, 'bull_use_atr': False, 'bull_use_adx': True, 'bull_use_spike': True, 'bull_rsi_required': False, 'bear_strategy': 'breakout', 'bear_bb_std_mult': 2.2934793254498973, 'bear_rsi_os': 49, 'bear_rsi_ob': 60, 'bear_adx_thresh': 26.28474281982557, 'bear_atr_min_pct': 0.026658531162167053, 'bear_atr_max_pct': 0.01914575309077174, 'bear_tp_mult': 2.80818597697472, 'bear_tsl_mult': 0.10839710700436062, 'bear_time_stop': 91, 'bear_use_sma': False, 'bear_use_ema': True, 'bear_use_atr': True, 'bear_use_adx': False, 'bear_use_spike': True, 'bear_rsi_required': False, 'sideways_strategy': 'breakout', 'sideways_bb_std_mult': 1.8714407916800593, 'sideways_rsi_os': 33, 'sideways_rsi_ob': 74, 'sideways_adx_thresh': 11.507706792058093, 'sideways_atr_min_pct': 0.029444160896486278, 'sideways_atr_max_pct': 0.1440152287116726, 'sideways_tp_mult': 2.176348932936794, 'sideways_tsl_mult': 0.07060930459564096, 'sideways_time_stop': 117, 'sideways_use_sma': True, 'sideways_use_ema': False, 'sideways_use_atr': True, 'sideways_use_adx': False, 'sideways_use_spike': True, 'sideways_rsi_required': True}.
[I 2025-09-01 03:10:07,808] Trial 288 finished with values: [-1000000000.0, 1000000000.0] and parameters: {'p_sma': 46, 'p_std': 55, 'p_atr': 29, 'p_adx': 19, 'rsi_period': 41, 'ema1': 22, 'ema2': 18, 'slip_atr_k': 0.017346708386695494, 'slip_spread_k': 0.1661375877199062, 'spread_hl_frac': 0.023290653554948047, 'bb_std_mult': 1.3850513746433806, 'rsi_os': 35, 'rsi_ob': 89, 'vol_spike': 0.2590431586218874, 'adx_thresh': 7.797246724148228, 'atr_min_pct': 0.006790931806874021, 'atr_max_pct': 0.05207921696251575, 'tp_mult': 2.4153329940985206, 'tsl_mult': 0.5449781714512982, 'strategy': 'mean_reversion', 'time_stop': 131, 'use_sma': True, 'use_atr': True, 'use_adx': True, 'use_ema': False, 'use_spike': True, 'rsi_required': False, 'edge_k': 0.05697820678910573, 'edge_cap': 0.48275613173642806, 'bull_strategy': 'breakout', 'bull_bb_std_mult': 1.1516086718108691, 'bull_rsi_os': 18, 'bull_rsi_ob': 53, 'bull_adx_thresh': 23.49412298133938, 'bull_atr_min_pct': 0.029381817818623743, 'bull_atr_max_pct': 0.010301944786789946, 'bull_tp_mult': 2.9955086383359086, 'bull_tsl_mult': 0.25901618250884545, 'bull_time_stop': 277, 'bull_use_sma': True, 'bull_use_ema': False, 'bull_use_atr': False, 'bull_use_adx': True, 'bull_use_spike': True, 'bull_rsi_required': False, 'bear_strategy': 'breakout', 'bear_bb_std_mult': 3.237170238916267, 'bear_rsi_os': 49, 'bear_rsi_ob': 60, 'bear_adx_thresh': 13.292299820081372, 'bear_atr_min_pct': 0.026612908384306334, 'bear_atr_max_pct': 0.09294340951088767, 'bear_tp_mult': 1.0877096153703483, 'bear_tsl_mult': 0.10945450223538461, 'bear_time_stop': 103, 'bear_use_sma': False, 'bear_use_ema': True, 'bear_use_atr': False, 'bear_use_adx': False, 'bear_use_spike': True, 'bear_rsi_required': False, 'sideways_strategy': 'breakout', 'sideways_bb_std_mult': 1.8948557212650283, 'sideways_rsi_os': 54, 'sideways_rsi_ob': 74, 'sideways_adx_thresh': 32.73885534836175, 'sideways_atr_min_pct': 0.025229058939376707, 'sideways_atr_max_pct': 0.028648919388811984, 'sideways_tp_mult': 1.7252898366780127, 'sideways_tsl_mult': 0.8840426020541341, 'sideways_time_stop': 117, 'sideways_use_sma': True, 'sideways_use_ema': True, 'sideways_use_atr': True, 'sideways_use_adx': False, 'sideways_use_spike': True, 'sideways_rsi_required': True}.
