[I 2025-09-01 03:42:09,944] Trial 478 finished with values: [-0.013925473884921824, 0.013941628727346764] and parameters: {'p_sma': 17, 'p_std': 55, 'p_atr': 25, 'p_adx': 11, 'rsi_period': 8, 'ema1': 14, 'ema2': 53, 'slip_atr_k': 0.004359542448694442, 'slip_spread_k': 0.06530369232001149, 'spread_hl_frac': 0.04152042900416593, 'bb_std_mult': 2.485460453828696, 'rsi_os': 43, 'rsi_ob': 81, 'vol_spike': 0.18821776187521966, 'adx_thresh': 13.226191199989067, 'atr_min_pct': 0.009885318417075026, 'atr_max_pct': 0.05033277228215022, 'tp_mult': 2.6178524585028637, 'tsl_mult': 0.31075534092126667, 'strategy': 'mean_reversion', 'time_stop': 86, 'use_sma': False, 'use_atr': False, 'use_adx': True, 'use_ema': False, 'use_spike': True, 'rsi_required': False, 'edge_k': 0.24945251995488327, 'edge_cap': 0.270695496492247, 'bull_strategy': 'breakout', 'bull_bb_std_mult': 0.8789041034514328, 'bull_rsi_os': 7, 'bull_rsi_ob': 80, 'bull_adx_thresh': 7.7585374381957255, 'bull_atr_min_pct': 3.8961355337093634e-05, 'bull_atr_max_pct': 0.10892660184646522, 'bull_tp_mult': 1.4966934028846988, 'bull_tsl_mult': 0.2667663789720925, 'bull_time_stop': 297, 'bull_use_sma': True, 'bull_use_ema': False, 'bull_use_atr': False, 'bull_use_adx': True, 'bull_use_spike': False, 'bull_rsi_required': False, 'bear_strategy': 'breakout', 'bear_bb_std_mult': 3.145405826921948, 'bear_rsi_os': 49, 'bear_rsi_ob': 68, 'bear_adx_thresh': 32.92605854264637, 'bear_atr_min_pct': 0.007123916501803761, 'bear_atr_max_pct': 0.05236146106125326, 'bear_tp_mult': 2.90401113571872, 'bear_tsl_mult': 0.0761970280282262, 'bear_time_stop': 291, 'bear_use_sma': True, 'bear_use_ema': False, 'bear_use_atr': False, 'bear_use_adx': False, 'bear_use_spike': True, 'bear_rsi_required': True, 'sideways_strategy': 'breakout', 'sideways_bb_std_mult': 3.5356105212501765, 'sideways_rsi_os': 7, 'sideways_rsi_ob': 59, 'sideways_adx_thresh': 29.950811824853705, 'sideways_atr_min_pct': 0.023759734624327043, 'sideways_atr_max_pct': 0.10741554587558479, 'sideways_tp_mult': 1.8531482342026178, 'sideways_tsl_mult': 0.713086289152864, 'sideways_time_stop': 162, 'sideways_use_sma': True, 'sideways_use_ema': True, 'sideways_use_atr': False, 'sideways_use_adx': False, 'sideways_use_spike': True, 'sideways_rsi_required': True}.
[I 2025-09-01 03:42:09,962] Trial 475 finished with values: [-0.014682073347296654, 0.014560854415095867] and parameters: {'p_sma': 19, 'p_std': 55, 'p_atr': 26, 'p_adx': 11, 'rsi_period': 7, 'ema1': 14, 'ema2': 53, 'slip_atr_k': 0.0030343664468990236, 'slip_spread_k': 0.04702562139732905, 'spread_hl_frac': 0.03959975484587836, 'bb_std_mult': 2.4466307998289043, 'rsi_os': 43, 'rsi_ob': 81, 'vol_spike': 0.18043332888938948, 'adx_thresh': 13.146000541277072, 'atr_min_pct': 0.009943903741711712, 'atr_max_pct': 0.11599475192999845, 'tp_mult': 2.611123233210929, 'tsl_mult': 0.2746423898368195, 'strategy': 'mean_reversion', 'time_stop': 156, 'use_sma': False, 'use_atr': False, 'use_adx': True, 'use_ema': False, 'use_spike': True, 'rsi_required': False, 'edge_k': 0.3223274497243123, 'edge_cap': 0.27301682359668994, 'bull_strategy': 'breakout', 'bull_bb_std_mult': 0.9132901352265337, 'bull_rsi_os': 7, 'bull_rsi_ob': 84, 'bull_adx_thresh': 5.9220759491803365, 'bull_atr_min_pct': 0.00022071695505911348, 'bull_atr_max_pct': 0.10563496169753878, 'bull_tp_mult': 1.4684951662600862, 'bull_tsl_mult': 0.27192845863061005, 'bull_time_stop': 298, 'bull_use_sma': True, 'bull_use_ema': False, 'bull_use_atr': False, 'bull_use_adx': True, 'bull_use_spike': False, 'bull_rsi_required': False, 'bear_strategy': 'breakout', 'bear_bb_std_mult': 3.123580691456651, 'bear_rsi_os': 49, 'bear_rsi_ob': 68, 'bear_adx_thresh': 33.032479891642694, 'bear_atr_min_pct': 0.006185973638761686, 'bear_atr_max_pct': 0.04934880729476469, 'bear_tp_mult': 2.9059498395240695, 'bear_tsl_mult': 0.050358427128108896, 'bear_time_stop': 290, 'bear_use_sma': True, 'bear_use_ema': False, 'bear_use_atr': False, 'bear_use_adx': False, 'bear_use_spike': False, 'bear_rsi_required': True, 'sideways_strategy': 'breakout', 'sideways_bb_std_mult': 3.5513650179997063, 'sideways_rsi_os': 7, 'sideways_rsi_ob': 72, 'sideways_adx_thresh': 30.076823551814094, 'sideways_atr_min_pct': 0.024881041211013918, 'sideways_atr_max_pct': 0.10468234537969691, 'sideways_tp_mult': 1.904038898175348, 'sideways_tsl_mult': 0.7131903861837318, 'sideways_time_stop': 197, 'sideways_use_sma': True, 'sideways_use_ema': True, 'sideways_use_atr': False, 'sideways_use_adx': False, 'sideways_use_spike': True, 'sideways_rsi_required': True}.
[I 2025-09-01 03:42:50,247] Trial 479 finished with values: [-0.014131006297824933, 0.013945882842610564] and parameters: {'p_sma': 18, 'p_std': 55, 'p_atr': 26, 'p_adx': 11, 'rsi_period': 8, 'ema1': 25, 'ema2': 53, 'slip_atr_k': 0.003836265401297692, 'slip_spread_k': 0.061677775916056714, 'spread_hl_frac': 0.039720073739453736, 'bb_std_mult': 2.3772945011281608, 'rsi_os': 32, 'rsi_ob': 79, 'vol_spike': 0.16065957685560198, 'adx_thresh': 13.876126249005402, 'atr_min_pct': 0.009790235458614238, 'atr_max_pct': 0.05105552403836272, 'tp_mult': 2.6083958732307675, 'tsl_mult': 0.3098924063188383, 'strategy': 'mean_reversion', 'time_stop': 151, 'use_sma': False, 'use_atr': False, 'use_adx': True, 'use_ema': False, 'use_spike': True, 'rsi_required': False, 'edge_k': 0.24601481976518794, 'edge_cap': 0.3451998708248205, 'bull_strategy': 'breakout', 'bull_bb_std_mult': 0.897686390940867, 'bull_rsi_os': 6, 'bull_rsi_ob': 77, 'bull_adx_thresh': 7.862331496976932, 'bull_atr_min_pct': 0.0004112294169889657, 'bull_atr_max_pct': 0.10916657973388007, 'bull_tp_mult': 1.4865272367445141, 'bull_tsl_mult': 0.27108570607306004, 'bull_time_stop': 299, 'bull_use_sma': True, 'bull_use_ema': False, 'bull_use_atr': False, 'bull_use_adx': True, 'bull_use_spike': False, 'bull_rsi_required': False, 'bear_strategy': 'breakout', 'bear_bb_std_mult': 3.000187765321006, 'bear_rsi_os': 50, 'bear_rsi_ob': 65, 'bear_adx_thresh': 32.95772425660842, 'bear_atr_min_pct': 0.007142427084787202, 'bear_atr_max_pct': 0.0437581546944151, 'bear_tp_mult': 2.9391031766706224, 'bear_tsl_mult': 0.07966629786275811, 'bear_time_stop': 281, 'bear_use_sma': False, 'bear_use_ema': False, 'bear_use_atr': False, 'bear_use_adx': False, 'bear_use_spike': True, 'bear_rsi_required': True, 'sideways_strategy': 'breakout', 'sideways_bb_std_mult': 3.42690445698087, 'sideways_rsi_os': 11, 'sideways_rsi_ob': 59, 'sideways_adx_thresh': 30.03922032465678, 'sideways_atr_min_pct': 0.023794224768998166, 'sideways_atr_max_pct': 0.10110405380809478, 'sideways_tp_mult': 1.9195741753912978, 'sideways_tsl_mult': 0.7441886721934824, 'sideways_time_stop': 195, 'sideways_use_sma': True, 'sideways_use_ema': True, 'sideways_use_atr': False, 'sideways_use_adx': False, 'sideways_use_spike': True, 'sideways_rsi_required': True}.
[I 2025-09-01 03:42:50,536] Trial 480 finished with values: [-1000000000.0, 1000000000.0] and parameters: {'p_sma': 7, 'p_std': 55, 'p_atr': 26, 'p_adx': 11, 'rsi_period': 8, 'ema1': 25, 'ema2': 51, 'slip_atr_k': 0.004926467878162144, 'slip_spread_k': 0.0504025855188128, 'spread_hl_frac': 0.039619570762715904, 'bb_std_mult': 2.367632840568336, 'rsi_os': 38, 'rsi_ob': 80, 'vol_spike': 0.1677912888284158, 'adx_thresh': 13.970296017543918, 'atr_min_pct': 0.009346357288965606, 'atr_max_pct': 0.04990584983607695, 'tp_mult': 1.5034592975400924, 'tsl_mult': 0.27190157378542845, 'strategy': 'mean_reversion', 'time_stop': 83, 'use_sma': False, 'use_atr': False, 'use_adx': True, 'use_ema': False, 'use_spike': True, 'rsi_required': False, 'edge_k': 0.23629939469010497, 'edge_cap': 0.36045583653559926, 'bull_strategy': 'breakout', 'bull_bb_std_mult': 0.89981815843486, 'bull_rsi_os': 6, 'bull_rsi_ob': 79, 'bull_adx_thresh': 7.573265752543136, 'bull_atr_min_pct': 1.1659638071536056e-05, 'bull_atr_max_pct': 0.10964204117428351, 'bull_tp_mult': 1.4820695907578225, 'bull_tsl_mult': 0.2931751593719798, 'bull_time_stop': 300, 'bull_use_sma': True, 'bull_use_ema': False, 'bull_use_atr': False, 'bull_use_adx': False, 'bull_use_spike': False, 'bull_rsi_required': False, 'bear_strategy': 'breakout', 'bear_bb_std_mult': 3.191944197995426, 'bear_rsi_os': 50, 'bear_rsi_ob': 69, 'bear_adx_thresh': 33.10388283111169, 'bear_atr_min_pct': 0.007043288971545344, 'bear_atr_max_pct': 0.041399398878777076, 'bear_tp_mult': 2.766239159160434, 'bear_tsl_mult': 0.04102531589389119, 'bear_time_stop': 281, 'bear_use_sma': False, 'bear_use_ema': False, 'bear_use_atr': False, 'bear_use_adx': False, 'bear_use_spike': True, 'bear_rsi_required': True, 'sideways_strategy': 'breakout', 'sideways_bb_std_mult': 3.428968977201559, 'sideways_rsi_os': 10, 'sideways_rsi_ob': 73, 'sideways_adx_thresh': 29.933586953978924, 'sideways_atr_min_pct': 0.025051544676214843, 'sideways_atr_max_pct': 0.11565609024819469, 'sideways_tp_mult': 1.9199318750081749, 'sideways_tsl_mult': 0.7331868747353942, 'sideways_time_stop': 173, 'sideways_use_sma': True, 'sideways_use_ema': True, 'sideways_use_atr': False, 'sideways_use_adx': False, 'sideways_use_spike': True, 'sideways_rsi_required': False}.
[I 2025-09-01 03:42:50,923] Trial 482 finished with values: [-0.016091596556971344, 0.015952751657009934] and parameters: {'p_sma': 17, 'p_std': 52, 'p_atr': 25, 'p_adx': 11, 'rsi_period': 7, 'ema1': 14, 'ema2': 52, 'slip_atr_k': 0.004660036816302609, 'slip_spread_k': 0.03376468771346427, 'spread_hl_frac': 0.04306386054910777, 'bb_std_mult': 2.5622268129166668, 'rsi_os': 43, 'rsi_ob': 80, 'vol_spike': 0.18180024461393732, 'adx_thresh': 13.861409352010678, 'atr_min_pct': 0.011197257889933794, 'atr_max_pct': 0.13557425104158155, 'tp_mult': 2.542516723424834, 'tsl_mult': 0.3099754272777071, 'strategy': 'mean_reversion', 'time_stop': 85, 'use_sma': False, 'use_atr': False, 'use_adx': True, 'use_ema': False, 'use_spike': True, 'rsi_required': False, 'edge_k': 0.2536900305948627, 'edge_cap': 0.17086328732536302, 'bull_strategy': 'breakout', 'bull_bb_std_mult': 0.7512304216735946, 'bull_rsi_os': 10, 'bull_rsi_ob': 80, 'bull_adx_thresh': 7.798767928324202, 'bull_atr_min_pct': 0.00019857717182239973, 'bull_atr_max_pct': 0.10359826876884695, 'bull_tp_mult': 1.4354265604997574, 'bull_tsl_mult': 0.26774235793989654, 'bull_time_stop': 298, 'bull_use_sma': True, 'bull_use_ema': False, 'bull_use_atr': False, 'bull_use_adx': True, 'bull_use_spike': False, 'bull_rsi_required': False, 'bear_strategy': 'breakout', 'bear_bb_std_mult': 3.1976437847815387, 'bear_rsi_os': 47, 'bear_rsi_ob': 69, 'bear_adx_thresh': 31.31605088119364, 'bear_atr_min_pct': 0.007253099462596761, 'bear_atr_max_pct': 0.06763240829064768, 'bear_tp_mult': 2.932899701046447, 'bear_tsl_mult': 0.049204807049148355, 'bear_time_stop': 283, 'bear_use_sma': True, 'bear_use_ema': False, 'bear_use_atr': False, 'bear_use_adx': False, 'bear_use_spike': True, 'bear_rsi_required': True, 'sideways_strategy': 'breakout', 'sideways_bb_std_mult': 3.581764649510521, 'sideways_rsi_os': 7, 'sideways_rsi_ob': 56, 'sideways_adx_thresh': 31.05387309933221, 'sideways_atr_min_pct': 0.023240055499647215, 'sideways_atr_max_pct': 0.1051300114194837, 'sideways_tp_mult': 1.924827469325109, 'sideways_tsl_mult': 0.7223304005353961, 'sideways_time_stop': 158, 'sideways_use_sma': True, 'sideways_use_ema': True, 'sideways_use_atr': False, 'sideways_use_adx': False, 'sideways_use_spike': True, 'sideways_rsi_required': False}.
[I 2025-09-01 03:42:51,137] Trial 481 finished with values: [-0.01764806416030784, 0.017509612082208276] and parameters: {'p_sma': 17, 'p_std': 53, 'p_atr': 25, 'p_adx': 11, 'rsi_period': 7, 'ema1': 14, 'ema2': 47, 'slip_atr_k': 0.003752400036644018, 'slip_spread_k': 0.03880323154543539, 'spread_hl_frac': 0.04295942202878584, 'bb_std_mult': 2.567898687489179, 'rsi_os': 43, 'rsi_ob': 80, 'vol_spike': 0.1815592422862251, 'adx_thresh': 13.937605189832881, 'atr_min_pct': 0.011694477139154169, 'atr_max_pct': 0.11190022819251176, 'tp_mult': 2.540006206185115, 'tsl_mult': 0.26182042439349074, 'strategy': 'mean_reversion', 'time_stop': 83, 'use_sma': False, 'use_atr': False, 'use_adx': True, 'use_ema': False, 'use_spike': True, 'rsi_required': False, 'edge_k': 0.23680651938374075, 'edge_cap': 0.239455372287069, 'bull_strategy': 'breakout', 'bull_bb_std_mult': 0.7843305555781711, 'bull_rsi_os': 6, 'bull_rsi_ob': 79, 'bull_adx_thresh': 7.704605276273188, 'bull_atr_min_pct': 0.00015810146994520282, 'bull_atr_max_pct': 0.10102537198515077, 'bull_tp_mult': 1.426398978979662, 'bull_tsl_mult': 0.25980127379161055, 'bull_time_stop': 297, 'bull_use_sma': True, 'bull_use_ema': False, 'bull_use_atr': False, 'bull_use_adx': True, 'bull_use_spike': False, 'bull_rsi_required': True, 'bear_strategy': 'breakout', 'bear_bb_std_mult': 3.229098346470904, 'bear_rsi_os': 46, 'bear_rsi_ob': 69, 'bear_adx_thresh': 33.020728905650444, 'bear_atr_min_pct': 0.008605133340187707, 'bear_atr_max_pct': 0.062343944755755346, 'bear_tp_mult': 2.931991544064874, 'bear_tsl_mult': 0.046058645683222675, 'bear_time_stop': 282, 'bear_use_sma': True, 'bear_use_ema': False, 'bear_use_atr': False, 'bear_use_adx': False, 'bear_use_spike': True, 'bear_rsi_required': True, 'sideways_strategy': 'breakout', 'sideways_bb_std_mult': 3.59988274045706, 'sideways_rsi_os': 7, 'sideways_rsi_ob': 59, 'sideways_adx_thresh': 31.564556522401993, 'sideways_atr_min_pct': 0.02193991042117803, 'sideways_atr_max_pct': 0.10180804527773989, 'sideways_tp_mult': 1.936132043620426, 'sideways_tsl_mult': 0.7224257292500815, 'sideways_time_stop': 157, 'sideways_use_sma': False, 'sideways_use_ema': True, 'sideways_use_atr': False, 'sideways_use_adx': False, 'sideways_use_spike': True, 'sideways_rsi_required': False}.
[I 2025-09-01 03:43:34,575] Trial 483 finished with values: [-0.015815138414393748, 0.015676523804262755] and parameters: {'p_sma': 17, 'p_std': 52, 'p_atr': 25, 'p_adx': 11, 'rsi_period': 8, 'ema1': 14, 'ema2': 42, 'slip_atr_k': 0.0047125401160309725, 'slip_spread_k': 0.018710468132661133, 'spread_hl_frac': 0.042520679519056845, 'bb_std_mult': 2.5671516645466785, 'rsi_os': 44, 'rsi_ob': 80, 'vol_spike': 0.18434120320916253, 'adx_thresh': 13.97400072169199, 'atr_min_pct': 0.011045405965686912, 'atr_max_pct': 0.08341878643396837, 'tp_mult': 2.5561087216864236, 'tsl_mult': 0.26475768657114035, 'strategy': 'mean_reversion', 'time_stop': 85, 'use_sma': False, 'use_atr': False, 'use_adx': True, 'use_ema': False, 'use_spike': True, 'rsi_required': False, 'edge_k': 0.2531890023838275, 'edge_cap': 0.23933776097371678, 'bull_strategy': 'breakout', 'bull_bb_std_mult': 0.7863677481042637, 'bull_rsi_os': 8, 'bull_rsi_ob': 80, 'bull_adx_thresh': 7.724281457172114, 'bull_atr_min_pct': 0.000116127270765132, 'bull_atr_max_pct': 0.10379569830827648, 'bull_tp_mult': 1.4211228390182642, 'bull_tsl_mult': 0.2641710240792301, 'bull_time_stop': 299, 'bull_use_sma': True, 'bull_use_ema': False, 'bull_use_atr': False, 'bull_use_adx': True, 'bull_use_spike': False, 'bull_rsi_required': True, 'bear_strategy': 'breakout', 'bear_bb_std_mult': 3.1941632054415416, 'bear_rsi_os': 47, 'bear_rsi_ob': 68, 'bear_adx_thresh': 32.88490611084944, 'bear_atr_min_pct': 0.007105588555787757, 'bear_atr_max_pct': 0.06104381676494583, 'bear_tp_mult': 2.9487014113817636, 'bear_tsl_mult': 0.044013501009980305, 'bear_time_stop': 283, 'bear_use_sma': True, 'bear_use_ema': False, 'bear_use_atr': False, 'bear_use_adx': False, 'bear_use_spike': True, 'bear_rsi_required': True, 'sideways_strategy': 'breakout', 'sideways_bb_std_mult': 3.580140497831233, 'sideways_rsi_os': 7, 'sideways_rsi_ob': 59, 'sideways_adx_thresh': 31.443375491525334, 'sideways_atr_min_pct': 0.02236323662361574, 'sideways_atr_max_pct': 0.10650201814868009, 'sideways_tp_mult': 1.928262939526523, 'sideways_tsl_mult': 0.7184565658075688, 'sideways_time_stop': 156, 'sideways_use_sma': False, 'sideways_use_ema': True, 'sideways_use_atr': False, 'sideways_use_adx': False, 'sideways_use_spike': True, 'sideways_rsi_required': False}.
[I 2025-09-01 03:43:35,421] Trial 484 finished with values: [-0.01602540733649549, 0.015886974679883405] and parameters: {'p_sma': 17, 'p_std': 52, 'p_atr': 25, 'p_adx': 11, 'rsi_period': 7, 'ema1': 14, 'ema2': 47, 'slip_atr_k': 0.0037944645857133598, 'slip_spread_k': 0.02478683859292232, 'spread_hl_frac': 0.04294342301399789, 'bb_std_mult': 2.5605037711656786, 'rsi_os': 44, 'rsi_ob': 80, 'vol_spike': 0.18454777146750617, 'adx_thresh': 14.07920740671982, 'atr_min_pct': 0.010679672127096638, 'atr_max_pct': 0.05064773328819858, 'tp_mult': 2.5549864022197255, 'tsl_mult': 0.264234861609541, 'strategy': 'mean_reversion', 'time_stop': 85, 'use_sma': False, 'use_atr': False, 'use_adx': True, 'use_ema': False, 'use_spike': True, 'rsi_required': False, 'edge_k': 0.2573807458066353, 'edge_cap': 0.25081483670506016, 'bull_strategy': 'breakout', 'bull_bb_std_mult': 0.803652552776634, 'bull_rsi_os': 8, 'bull_rsi_ob': 80, 'bull_adx_thresh': 8.21909757834444, 'bull_atr_min_pct': 1.4053558868593994e-05, 'bull_atr_max_pct': 0.10340570059378952, 'bull_tp_mult': 1.409738014362661, 'bull_tsl_mult': 0.2626808795181374, 'bull_time_stop': 296, 'bull_use_sma': True, 'bull_use_ema': False, 'bull_use_atr': False, 'bull_use_adx': True, 'bull_use_spike': False, 'bull_rsi_required': True, 'bear_strategy': 'breakout', 'bear_bb_std_mult': 3.2123417176994944, 'bear_rsi_os': 47, 'bear_rsi_ob': 68, 'bear_adx_thresh': 31.41306120363128, 'bear_atr_min_pct': 0.007264317584133524, 'bear_atr_max_pct': 0.07339526965996437, 'bear_tp_mult': 2.948317484983397, 'bear_tsl_mult': 0.01598995208224728, 'bear_time_stop': 292, 'bear_use_sma': True, 'bear_use_ema': False, 'bear_use_atr': False, 'bear_use_adx': False, 'bear_use_spike': True, 'bear_rsi_required': True, 'sideways_strategy': 'breakout', 'sideways_bb_std_mult': 3.58381352972331, 'sideways_rsi_os': 7, 'sideways_rsi_ob': 62, 'sideways_adx_thresh': 31.204407402294812, 'sideways_atr_min_pct': 0.021908179220415002, 'sideways_atr_max_pct': 0.10550572349974273, 'sideways_tp_mult': 1.9482205345435775, 'sideways_tsl_mult': 0.6772721521234055, 'sideways_time_stop': 159, 'sideways_use_sma': False, 'sideways_use_ema': True, 'sideways_use_atr': False, 'sideways_use_adx': False, 'sideways_use_spike': True, 'sideways_rsi_required': True}.
[I 2025-09-01 03:43:35,797] Trial 485 finished with values: [-0.01448636958021321, 0.014347576920954749] and parameters: {'p_sma': 17, 'p_std': 54, 'p_atr': 25, 'p_adx': 11, 'rsi_period': 7, 'ema1': 14, 'ema2': 52, 'slip_atr_k': 0.00459261347368008, 'slip_spread_k': 0.020006003787765056, 'spread_hl_frac': 0.0428214673705844, 'bb_std_mult': 2.5388382198937247, 'rsi_os': 44, 'rsi_ob': 81, 'vol_spike': 0.18119638984191985, 'adx_thresh': 14.079800117403833, 'atr_min_pct': 0.011188165987978217, 'atr_max_pct': 0.11483172027583627, 'tp_mult': 2.5423997083266325, 'tsl_mult': 0.30469379439729377, 'strategy': 'mean_reversion', 'time_stop': 87, 'use_sma': False, 'use_atr': False, 'use_adx': True, 'use_ema': False, 'use_spike': True, 'rsi_required': False, 'edge_k': 0.2663611006238237, 'edge_cap': 0.25732460021102344, 'bull_strategy': 'breakout', 'bull_bb_std_mult': 0.7421875982757334, 'bull_rsi_os': 7, 'bull_rsi_ob': 78, 'bull_adx_thresh': 8.14433169231546, 'bull_atr_min_pct': 6.487285397625584e-05, 'bull_atr_max_pct': 0.10289623020242385, 'bull_tp_mult': 1.4344119119805852, 'bull_tsl_mult': 0.26634245720538957, 'bull_time_stop': 299, 'bull_use_sma': True, 'bull_use_ema': False, 'bull_use_atr': False, 'bull_use_adx': True, 'bull_use_spike': False, 'bull_rsi_required': True, 'bear_strategy': 'breakout', 'bear_bb_std_mult': 3.214189703134719, 'bear_rsi_os': 47, 'bear_rsi_ob': 68, 'bear_adx_thresh': 32.492758998775805, 'bear_atr_min_pct': 0.007067428456154927, 'bear_atr_max_pct': 0.06305614449018707, 'bear_tp_mult': 2.9428543839607277, 'bear_tsl_mult': 0.045477144205428637, 'bear_time_stop': 292, 'bear_use_sma': True, 'bear_use_ema': False, 'bear_use_atr': False, 'bear_use_adx': False, 'bear_use_spike': True, 'bear_rsi_required': True, 'sideways_strategy': 'breakout', 'sideways_bb_std_mult': 3.5936195014050756, 'sideways_rsi_os': 7, 'sideways_rsi_ob': 60, 'sideways_adx_thresh': 31.252200204881404, 'sideways_atr_min_pct': 0.023002401315025095, 'sideways_atr_max_pct': 0.10490912830364107, 'sideways_tp_mult': 1.9418523141358042, 'sideways_tsl_mult': 0.6901451574541123, 'sideways_time_stop': 158, 'sideways_use_sma': False, 'sideways_use_ema': True, 'sideways_use_atr': False, 'sideways_use_adx': False, 'sideways_use_spike': True, 'sideways_rsi_required': True}.
