[I 2025-09-01 02:50:59,394] Trial 170 finished with values: [-1000000000.0, 1000000000.0] and parameters: {'p_sma': 38, 'p_std': 60, 'p_atr': 25, 'p_adx': 7, 'rsi_period': 59, 'ema1': 30, 'ema2': 32, 'slip_atr_k': 0.06272656840458342, 'slip_spread_k': 0.9454549001993277, 'spread_hl_frac': 0.02157599150330297, 'bb_std_mult': 1.6197907634241373, 'rsi_os': 50, 'rsi_ob': 57, 'vol_spike': 0.10086432646924326, 'adx_thresh': 31.46797689437554, 'atr_min_pct': 0.02778048455251606, 'atr_max_pct': 0.026590118804789023, 'tp_mult': 1.0801125259560973, 'tsl_mult': 0.46440924202290157, 'strategy': 'breakout', 'time_stop': 269, 'use_sma': False, 'use_atr': True, 'use_adx': False, 'use_ema': True, 'use_spike': True, 'rsi_required': False, 'edge_k': 0.7731957836257465, 'edge_cap': 0.3524178697375787, 'bull_strategy': 'mean_reversion', 'bull_bb_std_mult': 1.121218364441331, 'bull_rsi_os': 16, 'bull_rsi_ob': 65, 'bull_adx_thresh': 23.811227936384952, 'bull_atr_min_pct': 0.023544019612855578, 'bull_atr_max_pct': 0.08875673564347183, 'bull_tp_mult': 2.799000382188325, 'bull_tsl_mult': 0.5478130015941659, 'bull_time_stop': 119, 'bull_use_sma': False, 'bull_use_ema': True, 'bull_use_atr': False, 'bull_use_adx': False, 'bull_use_spike': True, 'bull_rsi_required': True, 'bear_strategy': 'breakout', 'bear_bb_std_mult': 1.9351294846566447, 'bear_rsi_os': 17, 'bear_rsi_ob': 94, 'bear_adx_thresh': 17.82850593523866, 'bear_atr_min_pct': 0.013695760085751336, 'bear_atr_max_pct': 0.13721291641609565, 'bear_tp_mult': 1.2841401689246352, 'bear_tsl_mult': 0.4377037464358642, 'bear_time_stop': 54, 'bear_use_sma': False, 'bear_use_ema': False, 'bear_use_atr': True, 'bear_use_adx': True, 'bear_use_spike': True, 'bear_rsi_required': True, 'sideways_strategy': 'breakout', 'sideways_bb_std_mult': 2.314147320998598, 'sideways_rsi_os': 41, 'sideways_rsi_ob': 76, 'sideways_adx_thresh': 7.740325425657536, 'sideways_atr_min_pct': 0.022795854644613922, 'sideways_atr_max_pct': 0.048193886628026573, 'sideways_tp_mult': 1.3301710031584402, 'sideways_tsl_mult': 0.04691470347532395, 'sideways_time_stop': 275, 'sideways_use_sma': False, 'sideways_use_ema': False, 'sideways_use_atr': True, 'sideways_use_adx': True, 'sideways_use_spike': True, 'sideways_rsi_required': False}.
[I 2025-09-01 02:51:38,956] Trial 172 finished with values: [-1000000000.0, 1000000000.0] and parameters: {'p_sma': 51, 'p_std': 41, 'p_atr': 23, 'p_adx': 28, 'rsi_period': 54, 'ema1': 25, 'ema2': 56, 'slip_atr_k': 0.05065764896807172, 'slip_spread_k': 0.35619882783599477, 'spread_hl_frac': 0.0449077591002989, 'bb_std_mult': 2.280465527544992, 'rsi_os': 49, 'rsi_ob': 57, 'vol_spike': 0.2680604430161696, 'adx_thresh': 15.68070064118755, 'atr_min_pct': 0.01741318610645713, 'atr_max_pct': 0.027344708584330732, 'tp_mult': 2.7598584814536253, 'tsl_mult': 0.01860939535075086, 'strategy': 'mean_reversion', 'time_stop': 240, 'use_sma': False, 'use_atr': True, 'use_adx': False, 'use_ema': True, 'use_spike': True, 'rsi_required': False, 'edge_k': 0.26866824409522977, 'edge_cap': 0.35938904750188194, 'bull_strategy': 'mean_reversion', 'bull_bb_std_mult': 1.0801636296005128, 'bull_rsi_os': 50, 'bull_rsi_ob': 79, 'bull_adx_thresh': 23.58321445998343, 'bull_atr_min_pct': 0.003100428955532735, 'bull_atr_max_pct': 0.11488545754896431, 'bull_tp_mult': 1.517483879529049, 'bull_tsl_mult': 0.41484823678326455, 'bull_time_stop': 206, 'bull_use_sma': False, 'bull_use_ema': True, 'bull_use_atr': False, 'bull_use_adx': False, 'bull_use_spike': False, 'bull_rsi_required': False, 'bear_strategy': 'mean_reversion', 'bear_bb_std_mult': 2.591143883161038, 'bear_rsi_os': 27, 'bear_rsi_ob': 54, 'bear_adx_thresh': 8.378758203616522, 'bear_atr_min_pct': 0.013444556456433769, 'bear_atr_max_pct': 0.1354360062476213, 'bear_tp_mult': 1.2928001667525026, 'bear_tsl_mult': 0.2762314540106362, 'bear_time_stop': 14, 'bear_use_sma': False, 'bear_use_ema': False, 'bear_use_atr': True, 'bear_use_adx': True, 'bear_use_spike': True, 'bear_rsi_required': True, 'sideways_strategy': 'mean_reversion', 'sideways_bb_std_mult': 2.448475011162582, 'sideways_rsi_os': 6, 'sideways_rsi_ob': 76, 'sideways_adx_thresh': 8.0447995001138, 'sideways_atr_min_pct': 0.022554177670952164, 'sideways_atr_max_pct': 0.061267966144110925, 'sideways_tp_mult': 1.423164332503261, 'sideways_tsl_mult': 0.20870005758691929, 'sideways_time_stop': 287, 'sideways_use_sma': True, 'sideways_use_ema': False, 'sideways_use_atr': True, 'sideways_use_adx': False, 'sideways_use_spike': True, 'sideways_rsi_required': False}.
[I 2025-09-01 02:51:42,861] Trial 174 finished with values: [-1000000000.0, 1000000000.0] and parameters: {'p_sma': 38, 'p_std': 41, 'p_atr': 23, 'p_adx': 28, 'rsi_period': 62, 'ema1': 23, 'ema2': 56, 'slip_atr_k': 0.044447903982997264, 'slip_spread_k': 0.48446374281159943, 'spread_hl_frac': 0.01770396633588911, 'bb_std_mult': 2.9471536921972312, 'rsi_os': 46, 'rsi_ob': 61, 'vol_spike': 0.13492033153575408, 'adx_thresh': 16.035354820721214, 'atr_min_pct': 0.022435898234220254, 'atr_max_pct': 0.06888007633317417, 'tp_mult': 1.969108575511832, 'tsl_mult': 0.20762120263812425, 'strategy': 'breakout', 'time_stop': 267, 'use_sma': True, 'use_atr': False, 'use_adx': False, 'use_ema': False, 'use_spike': True, 'rsi_required': False, 'edge_k': 1.7805952451673623, 'edge_cap': 0.4105511826770183, 'bull_strategy': 'mean_reversion', 'bull_bb_std_mult': 1.270115665687588, 'bull_rsi_os': 25, 'bull_rsi_ob': 51, 'bull_adx_thresh': 14.55245721074474, 'bull_atr_min_pct': 0.0020486577669275837, 'bull_atr_max_pct': 0.11348345505229408, 'bull_tp_mult': 1.8400887703849746, 'bull_tsl_mult': 0.21761834426889853, 'bull_time_stop': 187, 'bull_use_sma': False, 'bull_use_ema': False, 'bull_use_atr': False, 'bull_use_adx': False, 'bull_use_spike': False, 'bull_rsi_required': True, 'bear_strategy': 'breakout', 'bear_bb_std_mult': 2.7767125402175923, 'bear_rsi_os': 44, 'bear_rsi_ob': 94, 'bear_adx_thresh': 8.110766657243301, 'bear_atr_min_pct': 0.01487357018097668, 'bear_atr_max_pct': 0.14669030149038195, 'bear_tp_mult': 1.6966661954558806, 'bear_tsl_mult': 0.37157130206387257, 'bear_time_stop': 18, 'bear_use_sma': False, 'bear_use_ema': True, 'bear_use_atr': False, 'bear_use_adx': True, 'bear_use_spike': False, 'bear_rsi_required': True, 'sideways_strategy': 'breakout', 'sideways_bb_std_mult': 2.324948273471997, 'sideways_rsi_os': 18, 'sideways_rsi_ob': 72, 'sideways_adx_thresh': 31.372097302414318, 'sideways_atr_min_pct': 0.011518200418891119, 'sideways_atr_max_pct': 0.029473217739691263, 'sideways_tp_mult': 1.402062635006893, 'sideways_tsl_mult': 0.42223122136368096, 'sideways_time_stop': 288, 'sideways_use_sma': False, 'sideways_use_ema': True, 'sideways_use_atr': True, 'sideways_use_adx': True, 'sideways_use_spike': True, 'sideways_rsi_required': False}.
[I 2025-09-01 02:51:42,872] Trial 175 finished with values: [-1000000000.0, 1000000000.0] and parameters: {'p_sma': 42, 'p_std': 41, 'p_atr': 10, 'p_adx': 9, 'rsi_period': 63, 'ema1': 25, 'ema2': 56, 'slip_atr_k': 0.04240781434538174, 'slip_spread_k': 0.4575428042740539, 'spread_hl_frac': 0.04987209255475781, 'bb_std_mult': 2.6430909686510518, 'rsi_os': 25, 'rsi_ob': 61, 'vol_spike': 0.1348627983812947, 'adx_thresh': 15.625756043190252, 'atr_min_pct': 0.0225954833996711, 'atr_max_pct': 0.03850088747707699, 'tp_mult': 2.590590997261858, 'tsl_mult': 0.9328415698954036, 'strategy': 'breakout', 'time_stop': 259, 'use_sma': True, 'use_atr': False, 'use_adx': False, 'use_ema': False, 'use_spike': True, 'rsi_required': False, 'edge_k': 1.2237386657190688, 'edge_cap': 0.40745876571734163, 'bull_strategy': 'mean_reversion', 'bull_bb_std_mult': 0.9729745766555247, 'bull_rsi_os': 51, 'bull_rsi_ob': 63, 'bull_adx_thresh': 32.34822416885497, 'bull_atr_min_pct': 0.002868773112980996, 'bull_atr_max_pct': 0.10510841181201964, 'bull_tp_mult': 2.9224067897687473, 'bull_tsl_mult': 0.5123438529750081, 'bull_time_stop': 222, 'bull_use_sma': False, 'bull_use_ema': False, 'bull_use_atr': False, 'bull_use_adx': False, 'bull_use_spike': False, 'bull_rsi_required': True, 'bear_strategy': 'mean_reversion', 'bear_bb_std_mult': 2.625638989510699, 'bear_rsi_os': 40, 'bear_rsi_ob': 58, 'bear_adx_thresh': 20.7482635703074, 'bear_atr_min_pct': 0.014933042341069309, 'bear_atr_max_pct': 0.14631937413737253, 'bear_tp_mult': 1.6192217554296173, 'bear_tsl_mult': 0.2784309401054249, 'bear_time_stop': 12, 'bear_use_sma': False, 'bear_use_ema': True, 'bear_use_atr': False, 'bear_use_adx': True, 'bear_use_spike': False, 'bear_rsi_required': True, 'sideways_strategy': 'mean_reversion', 'sideways_bb_std_mult': 2.4428025865614176, 'sideways_rsi_os': 19, 'sideways_rsi_ob': 74, 'sideways_adx_thresh': 5.864572335004663, 'sideways_atr_min_pct': 0.0023311858673389727, 'sideways_atr_max_pct': 0.02866958383887245, 'sideways_tp_mult': 1.4089258191331697, 'sideways_tsl_mult': 0.5451855918872088, 'sideways_time_stop': 287, 'sideways_use_sma': False, 'sideways_use_ema': True, 'sideways_use_atr': True, 'sideways_use_adx': True, 'sideways_use_spike': True, 'sideways_rsi_required': False}.
[I 2025-09-01 02:51:43,506] Trial 173 finished with values: [-1000000000.0, 1000000000.0] and parameters: {'p_sma': 38, 'p_std': 43, 'p_atr': 23, 'p_adx': 14, 'rsi_period': 63, 'ema1': 25, 'ema2': 32, 'slip_atr_k': 0.04954473855692342, 'slip_spread_k': 0.9345621776056874, 'spread_hl_frac': 0.044752218173038816, 'bb_std_mult': 2.3465465127020044, 'rsi_os': 40, 'rsi_ob': 78, 'vol_spike': 0.13500411568891807, 'adx_thresh': 15.854936559531412, 'atr_min_pct': 0.020257768147875884, 'atr_max_pct': 0.0684178980932191, 'tp_mult': 2.584645923625186, 'tsl_mult': 0.2050375148111906, 'strategy': 'mean_reversion', 'time_stop': 76, 'use_sma': False, 'use_atr': False, 'use_adx': False, 'use_ema': False, 'use_spike': True, 'rsi_required': False, 'edge_k': 0.27869800108415654, 'edge_cap': 0.4036626708342881, 'bull_strategy': 'mean_reversion', 'bull_bb_std_mult': 0.8380487967665418, 'bull_rsi_os': 25, 'bull_rsi_ob': 88, 'bull_adx_thresh': 32.63392881765833, 'bull_atr_min_pct': 0.0029944735530258258, 'bull_atr_max_pct': 0.0601709664080932, 'bull_tp_mult': 2.918617637068326, 'bull_tsl_mult': 0.22120687301348368, 'bull_time_stop': 124, 'bull_use_sma': False, 'bull_use_ema': True, 'bull_use_atr': False, 'bull_use_adx': False, 'bull_use_spike': False, 'bull_rsi_required': False, 'bear_strategy': 'mean_reversion', 'bear_bb_std_mult': 2.6254033712636238, 'bear_rsi_os': 27, 'bear_rsi_ob': 94, 'bear_adx_thresh': 18.225890005605294, 'bear_atr_min_pct': 0.013361494354561831, 'bear_atr_max_pct': 0.13702047260176242, 'bear_tp_mult': 1.7068151071113296, 'bear_tsl_mult': 0.3684299920305148, 'bear_time_stop': 70, 'bear_use_sma': False, 'bear_use_ema': False, 'bear_use_atr': False, 'bear_use_adx': True, 'bear_use_spike': True, 'bear_rsi_required': True, 'sideways_strategy': 'mean_reversion', 'sideways_bb_std_mult': 2.4494500248232667, 'sideways_rsi_os': 42, 'sideways_rsi_ob': 62, 'sideways_adx_thresh': 31.290138703725006, 'sideways_atr_min_pct': 0.002036303727008965, 'sideways_atr_max_pct': 0.028962500314756355, 'sideways_tp_mult': 1.1469900396687303, 'sideways_tsl_mult': 0.4266909908756509, 'sideways_time_stop': 285, 'sideways_use_sma': True, 'sideways_use_ema': True, 'sideways_use_atr': True, 'sideways_use_adx': False, 'sideways_use_spike': True, 'sideways_rsi_required': False}.
[I 2025-09-01 02:51:44,160] Trial 179 finished with values: [-1000000000.0, 1000000000.0] and parameters: {'p_sma': 55, 'p_std': 45, 'p_atr': 24, 'p_adx': 9, 'rsi_period': 37, 'ema1': 28, 'ema2': 11, 'slip_atr_k': 0.031114428666169813, 'slip_spread_k': 0.37837653623396883, 'spread_hl_frac': 0.046890646980359205, 'bb_std_mult': 1.7196427283137112, 'rsi_os': 45, 'rsi_ob': 72, 'vol_spike': 0.06893572717621659, 'adx_thresh': 33.20786949702315, 'atr_min_pct': 0.029219426570129003, 'atr_max_pct': 0.016833165062007854, 'tp_mult': 2.1834685572843306, 'tsl_mult': 0.17297412622098382, 'strategy': 'breakout', 'time_stop': 45, 'use_sma': False, 'use_atr': False, 'use_adx': False, 'use_ema': False, 'use_spike': False, 'rsi_required': True, 'edge_k': 0.45632534829990123, 'edge_cap': 0.9761441633436405, 'bull_strategy': 'breakout', 'bull_bb_std_mult': 1.0491455210168645, 'bull_rsi_os': 28, 'bull_rsi_ob': 67, 'bull_adx_thresh': 18.810324851903218, 'bull_atr_min_pct': 0.015085903662317626, 'bull_atr_max_pct': 0.041589863401108595, 'bull_tp_mult': 2.4014402512467146, 'bull_tsl_mult': 0.02814541139962612, 'bull_time_stop': 180, 'bull_use_sma': True, 'bull_use_ema': False, 'bull_use_atr': True, 'bull_use_adx': True, 'bull_use_spike': True, 'bull_rsi_required': True, 'bear_strategy': 'breakout', 'bear_bb_std_mult': 0.9622498042358432, 'bear_rsi_os': 6, 'bear_rsi_ob': 77, 'bear_adx_thresh': 15.4788981849069, 'bear_atr_min_pct': 0.015540493256683535, 'bear_atr_max_pct': 0.12662697160197406, 'bear_tp_mult': 1.756545328814038, 'bear_tsl_mult': 0.34104655649942917, 'bear_time_stop': 188, 'bear_use_sma': True, 'bear_use_ema': False, 'bear_use_atr': False, 'bear_use_adx': True, 'bear_use_spike': True, 'bear_rsi_required': False, 'sideways_strategy': 'breakout', 'sideways_bb_std_mult': 2.093480363072659, 'sideways_rsi_os': 20, 'sideways_rsi_ob': 60, 'sideways_adx_thresh': 14.136555040570494, 'sideways_atr_min_pct': 0.0033516787113813873, 'sideways_atr_max_pct': 0.03737223804493512, 'sideways_tp_mult': 1.4575862289320405, 'sideways_tsl_mult': 0.8809309813731203, 'sideways_time_stop': 256, 'sideways_use_sma': False, 'sideways_use_ema': True, 'sideways_use_atr': False, 'sideways_use_adx': True, 'sideways_use_spike': False, 'sideways_rsi_required': True}.
[I 2025-09-01 02:52:22,984] Trial 178 finished with values: [-1000000000.0, 1000000000.0] and parameters: {'p_sma': 53, 'p_std': 45, 'p_atr': 8, 'p_adx': 9, 'rsi_period': 56, 'ema1': 19, 'ema2': 45, 'slip_atr_k': 0.03262636474024547, 'slip_spread_k': 0.3876417445811026, 'spread_hl_frac': 0.014784083753515299, 'bb_std_mult': 1.6936974724580522, 'rsi_os': 41, 'rsi_ob': 72, 'vol_spike': 0.20528094332196298, 'adx_thresh': 18.198779758718516, 'atr_min_pct': 0.02389148851591424, 'atr_max_pct': 0.0622605919418741, 'tp_mult': 2.0592602074657282, 'tsl_mult': 0.0015030011422807188, 'strategy': 'breakout', 'time_stop': 44, 'use_sma': False, 'use_atr': False, 'use_adx': False, 'use_ema': False, 'use_spike': False, 'rsi_required': True, 'edge_k': 0.4516050860471304, 'edge_cap': 0.9819336527311282, 'bull_strategy': 'breakout', 'bull_bb_std_mult': 0.5895252145467584, 'bull_rsi_os': 31, 'bull_rsi_ob': 67, 'bull_adx_thresh': 7.821749285456548, 'bull_atr_min_pct': 0.019203404569240138, 'bull_atr_max_pct': 0.11114825831463182, 'bull_tp_mult': 1.598510302850852, 'bull_tsl_mult': 0.5022592261778823, 'bull_time_stop': 192, 'bull_use_sma': False, 'bull_use_ema': False, 'bull_use_atr': True, 'bull_use_adx': True, 'bull_use_spike': True, 'bull_rsi_required': True, 'bear_strategy': 'breakout', 'bear_bb_std_mult': 2.7223917276301064, 'bear_rsi_os': 6, 'bear_rsi_ob': 70, 'bear_adx_thresh': 18.803662261990883, 'bear_atr_min_pct': 0.015603643349113206, 'bear_atr_max_pct': 0.1260820800344972, 'bear_tp_mult': 1.8029184260802977, 'bear_tsl_mult': 0.34554926613490095, 'bear_time_stop': 127, 'bear_use_sma': True, 'bear_use_ema': False, 'bear_use_atr': False, 'bear_use_adx': True, 'bear_use_spike': True, 'bear_rsi_required': False, 'sideways_strategy': 'breakout', 'sideways_bb_std_mult': 2.12054955675909, 'sideways_rsi_os': 17, 'sideways_rsi_ob': 62, 'sideways_adx_thresh': 13.918545289404234, 'sideways_atr_min_pct': 0.010426205009788343, 'sideways_atr_max_pct': 0.09783628385307838, 'sideways_tp_mult': 2.6562993473408696, 'sideways_tsl_mult': 0.615019758045835, 'sideways_time_stop': 185, 'sideways_use_sma': False, 'sideways_use_ema': True, 'sideways_use_atr': False, 'sideways_use_adx': True, 'sideways_use_spike': False, 'sideways_rsi_required': False}.
[I 2025-09-01 02:52:24,312] Trial 180 finished with values: [-1000000000.0, 1000000000.0] and parameters: {'p_sma': 36, 'p_std': 38, 'p_atr': 8, 'p_adx': 8, 'rsi_period': 56, 'ema1': 19, 'ema2': 59, 'slip_atr_k': 0.03295783262673932, 'slip_spread_k': 0.3176052061074476, 'spread_hl_frac': 0.015190564011139756, 'bb_std_mult': 3.3709710184612995, 'rsi_os': 44, 'rsi_ob': 80, 'vol_spike': 0.1570018110703983, 'adx_thresh': 17.924039625656224, 'atr_min_pct': 0.023204573986118412, 'atr_max_pct': 0.05703154888558325, 'tp_mult': 2.0390124539873327, 'tsl_mult': 0.43453761139225205, 'strategy': 'breakout', 'time_stop': 147, 'use_sma': True, 'use_atr': False, 'use_adx': False, 'use_ema': False, 'use_spike': True, 'rsi_required': False, 'edge_k': 1.5219176922759516, 'edge_cap': 0.4300095844122431, 'bull_strategy': 'breakout', 'bull_bb_std_mult': 1.786847987376894, 'bull_rsi_os': 36, 'bull_rsi_ob': 60, 'bull_adx_thresh': 13.515712387482623, 'bull_atr_min_pct': 0.018681614869104975, 'bull_atr_max_pct': 0.12030037011250425, 'bull_tp_mult': 2.6372950568045415, 'bull_tsl_mult': 0.08649102127630998, 'bull_time_stop': 189, 'bull_use_sma': False, 'bull_use_ema': False, 'bull_use_atr': False, 'bull_use_adx': True, 'bull_use_spike': True, 'bull_rsi_required': True, 'bear_strategy': 'breakout', 'bear_bb_std_mult': 1.6480111996840998, 'bear_rsi_os': 31, 'bear_rsi_ob': 46, 'bear_adx_thresh': 19.239270340955827, 'bear_atr_min_pct': 0.002504173708054948, 'bear_atr_max_pct': 0.12279787208662316, 'bear_tp_mult': 1.1049082267839336, 'bear_tsl_mult': 0.3794215943869431, 'bear_time_stop': 204, 'bear_use_sma': True, 'bear_use_ema': True, 'bear_use_atr': False, 'bear_use_adx': True, 'bear_use_spike': False, 'bear_rsi_required': False, 'sideways_strategy': 'breakout', 'sideways_bb_std_mult': 3.5962883014710787, 'sideways_rsi_os': 17, 'sideways_rsi_ob': 71, 'sideways_adx_thresh': 9.281720766511503, 'sideways_atr_min_pct': 0.026979895510012394, 'sideways_atr_max_pct': 0.0960798767461858, 'sideways_tp_mult': 2.637200985072598, 'sideways_tsl_mult': 0.6051831767525455, 'sideways_time_stop': 300, 'sideways_use_sma': False, 'sideways_use_ema': True, 'sideways_use_atr': False, 'sideways_use_adx': True, 'sideways_use_spike': True, 'sideways_rsi_required': False}.
[I 2025-09-01 02:52:24,528] Trial 177 finished with values: [-0.02123481604451627, 0.021074108842205154] and parameters: {'p_sma': 55, 'p_std': 42, 'p_atr': 27, 'p_adx': 9, 'rsi_period': 39, 'ema1': 21, 'ema2': 59, 'slip_atr_k': 0.032724704883439204, 'slip_spread_k': 0.38182450718209815, 'spread_hl_frac': 0.01528566354687433, 'bb_std_mult': 1.7015235064391538, 'rsi_os': 40, 'rsi_ob': 72, 'vol_spike': 0.21905837222093444, 'adx_thresh': 18.29671840688752, 'atr_min_pct': 0.02913115031929895, 'atr_max_pct': 0.060008928596796025, 'tp_mult': 2.171598129715071, 'tsl_mult': 0.4302255555503631, 'strategy': 'breakout', 'time_stop': 42, 'use_sma': False, 'use_atr': False, 'use_adx': False, 'use_ema': False, 'use_spike': False, 'rsi_required': True, 'edge_k': 1.4945485817333723, 'edge_cap': 0.7922497698377672, 'bull_strategy': 'breakout', 'bull_bb_std_mult': 3.378847096106492, 'bull_rsi_os': 28, 'bull_rsi_ob': 95, 'bull_adx_thresh': 18.89495156896575, 'bull_atr_min_pct': 0.0013353545327489927, 'bull_atr_max_pct': 0.12728363533010764, 'bull_tp_mult': 2.6147179460127266, 'bull_tsl_mult': 0.08813990887652129, 'bull_time_stop': 177, 'bull_use_sma': False, 'bull_use_ema': False, 'bull_use_atr': True, 'bull_use_adx': True, 'bull_use_spike': True, 'bull_rsi_required': True, 'bear_strategy': 'breakout', 'bear_bb_std_mult': 1.2122171049941426, 'bear_rsi_os': 38, 'bear_rsi_ob': 64, 'bear_adx_thresh': 18.724132038979512, 'bear_atr_min_pct': 0.020303168411074157, 'bear_atr_max_pct': 0.12575596795990657, 'bear_tp_mult': 1.0192919573303731, 'bear_tsl_mult': 0.47599510749752016, 'bear_time_stop': 128, 'bear_use_sma': True, 'bear_use_ema': False, 'bear_use_atr': False, 'bear_use_adx': True, 'bear_use_spike': True, 'bear_rsi_required': False, 'sideways_strategy': 'breakout', 'sideways_bb_std_mult': 2.09607891792042, 'sideways_rsi_os': 17, 'sideways_rsi_ob': 60, 'sideways_adx_thresh': 30.462670043024094, 'sideways_atr_min_pct': 0.02842856261951005, 'sideways_atr_max_pct': 0.09454875617180143, 'sideways_tp_mult': 2.610000123645463, 'sideways_tsl_mult': 0.6128275896186153, 'sideways_time_stop': 280, 'sideways_use_sma': False, 'sideways_use_ema': True, 'sideways_use_atr': False, 'sideways_use_adx': True, 'sideways_use_spike': False, 'sideways_rsi_required': False}.
