[I 2025-09-01 03:58:27,424] Trial 565 finished with values: [-1000000000.0, 1000000000.0] and parameters: {'p_sma': 14, 'p_std': 52, 'p_atr': 25, 'p_adx': 12, 'rsi_period': 8, 'ema1': 12, 'ema2': 51, 'slip_atr_k': 0.0003149163680785112, 'slip_spread_k': 0.002401287554736009, 'spread_hl_frac': 0.04238194321988312, 'bb_std_mult': 2.435510619224093, 'rsi_os': 47, 'rsi_ob': 81, 'vol_spike': 0.2998362052196265, 'adx_thresh': 32.803872601913184, 'atr_min_pct': 0.010399614614358472, 'atr_max_pct': 0.04938477370873673, 'tp_mult': 1.857986848365052, 'tsl_mult': 0.28697294786119415, 'strategy': 'mean_reversion', 'time_stop': 90, 'use_sma': True, 'use_atr': False, 'use_adx': False, 'use_ema': True, 'use_spike': False, 'rsi_required': True, 'edge_k': 1.9421649241894496, 'edge_cap': 0.17504003121216416, 'bull_strategy': 'mean_reversion', 'bull_bb_std_mult': 0.5046353235485255, 'bull_rsi_os': 5, 'bull_rsi_ob': 77, 'bull_adx_thresh': 9.2536446521544, 'bull_atr_min_pct': 0.0007409342312344505, 'bull_atr_max_pct': 0.14051582960080933, 'bull_tp_mult': 1.036493154818739, 'bull_tsl_mult': 0.26359575942743396, 'bull_time_stop': 148, 'bull_use_sma': False, 'bull_use_ema': False, 'bull_use_atr': True, 'bull_use_adx': True, 'bull_use_spike': False, 'bull_rsi_required': True, 'bear_strategy': 'mean_reversion', 'bear_bb_std_mult': 3.1611471906713753, 'bear_rsi_os': 44, 'bear_rsi_ob': 68, 'bear_adx_thresh': 33.51088592391527, 'bear_atr_min_pct': 0.006709566390850504, 'bear_atr_max_pct': 0.05303382796855486, 'bear_tp_mult': 2.8754839899123006, 'bear_tsl_mult': 0.03395539930104439, 'bear_time_stop': 258, 'bear_use_sma': True, 'bear_use_ema': True, 'bear_use_atr': True, 'bear_use_adx': True, 'bear_use_spike': True, 'bear_rsi_required': False, 'sideways_strategy': 'breakout', 'sideways_bb_std_mult': 3.5482367376380766, 'sideways_rsi_os': 7, 'sideways_rsi_ob': 59, 'sideways_adx_thresh': 29.599533577129066, 'sideways_atr_min_pct': 0.021758502009709302, 'sideways_atr_max_pct': 0.10342676971003412, 'sideways_tp_mult': 1.92051118246468, 'sideways_tsl_mult': 0.6431937645091519, 'sideways_time_stop': 157, 'sideways_use_sma': False, 'sideways_use_ema': False, 'sideways_use_atr': False, 'sideways_use_adx': False, 'sideways_use_spike': False, 'sideways_rsi_required': True}.
[I 2025-09-01 03:59:06,711] Trial 570 finished with values: [-1000000000.0, 1000000000.0] and parameters: {'p_sma': 19, 'p_std': 54, 'p_atr': 24, 'p_adx': 11, 'rsi_period': 8, 'ema1': 13, 'ema2': 52, 'slip_atr_k': 0.010600516915618974, 'slip_spread_k': 0.003145044708685405, 'spread_hl_frac': 0.040979496064995166, 'bb_std_mult': 2.3811977152002606, 'rsi_os': 40, 'rsi_ob': 51, 'vol_spike': 0.07178470677357762, 'adx_thresh': 33.14803293146177, 'atr_min_pct': 0.026906854381549297, 'atr_max_pct': 0.05488434795544059, 'tp_mult': 2.9753110144792227, 'tsl_mult': 0.2854523259793984, 'strategy': 'mean_reversion', 'time_stop': 69, 'use_sma': True, 'use_atr': False, 'use_adx': False, 'use_ema': True, 'use_spike': False, 'rsi_required': True, 'edge_k': 1.4626544311476057, 'edge_cap': 0.2642108718500403, 'bull_strategy': 'mean_reversion', 'bull_bb_std_mult': 0.9161802935341944, 'bull_rsi_os': 6, 'bull_rsi_ob': 75, 'bull_adx_thresh': 9.194548927516356, 'bull_atr_min_pct': 0.007987239529498334, 'bull_atr_max_pct': 0.11135225210625527, 'bull_tp_mult': 1.0340152077806353, 'bull_tsl_mult': 0.03895944817096153, 'bull_time_stop': 290, 'bull_use_sma': False, 'bull_use_ema': False, 'bull_use_atr': True, 'bull_use_adx': True, 'bull_use_spike': False, 'bull_rsi_required': True, 'bear_strategy': 'mean_reversion', 'bear_bb_std_mult': 3.1707339628557536, 'bear_rsi_os': 46, 'bear_rsi_ob': 71, 'bear_adx_thresh': 34.498689874596714, 'bear_atr_min_pct': 0.01043151877455941, 'bear_atr_max_pct': 0.04767949396630332, 'bear_tp_mult': 2.8776624697507978, 'bear_tsl_mult': 0.08525191569952345, 'bear_time_stop': 260, 'bear_use_sma': True, 'bear_use_ema': True, 'bear_use_atr': True, 'bear_use_adx': True, 'bear_use_spike': False, 'bear_rsi_required': False, 'sideways_strategy': 'breakout', 'sideways_bb_std_mult': 3.4604570919917617, 'sideways_rsi_os': 8, 'sideways_rsi_ob': 55, 'sideways_adx_thresh': 19.297257363690328, 'sideways_atr_min_pct': 0.024301507339617202, 'sideways_atr_max_pct': 0.10889924849773056, 'sideways_tp_mult': 1.9259475348218724, 'sideways_tsl_mult': 0.7540461380071859, 'sideways_time_stop': 165, 'sideways_use_sma': False, 'sideways_use_ema': False, 'sideways_use_atr': False, 'sideways_use_adx': False, 'sideways_use_spike': False, 'sideways_rsi_required': True}.
[I 2025-09-01 03:59:07,809] Trial 571 finished with values: [-1000000000.0, 1000000000.0] and parameters: {'p_sma': 19, 'p_std': 19, 'p_atr': 24, 'p_adx': 11, 'rsi_period': 9, 'ema1': 13, 'ema2': 53, 'slip_atr_k': 0.01055460888220022, 'slip_spread_k': 0.001494586221729051, 'spread_hl_frac': 0.040308375755436374, 'bb_std_mult': 2.3616048461996146, 'rsi_os': 45, 'rsi_ob': 79, 'vol_spike': 0.016596729118502157, 'adx_thresh': 30.832877104347787, 'atr_min_pct': 0.009384003731319613, 'atr_max_pct': 0.13486834385755594, 'tp_mult': 2.5905080626400707, 'tsl_mult': 0.7402022316054638, 'strategy': 'mean_reversion', 'time_stop': 82, 'use_sma': True, 'use_atr': False, 'use_adx': False, 'use_ema': True, 'use_spike': False, 'rsi_required': True, 'edge_k': 0.2114827586549507, 'edge_cap': 0.25623107175306903, 'bull_strategy': 'mean_reversion', 'bull_bb_std_mult': 0.9101301028497968, 'bull_rsi_os': 6, 'bull_rsi_ob': 75, 'bull_adx_thresh': 8.726542353178859, 'bull_atr_min_pct': 0.007967326470368068, 'bull_atr_max_pct': 0.11070864415313517, 'bull_tp_mult': 1.4658834360390074, 'bull_tsl_mult': 0.03962488887950516, 'bull_time_stop': 29, 'bull_use_sma': False, 'bull_use_ema': False, 'bull_use_atr': True, 'bull_use_adx': True, 'bull_use_spike': False, 'bull_rsi_required': True, 'bear_strategy': 'mean_reversion', 'bear_bb_std_mult': 3.1418572005849104, 'bear_rsi_os': 46, 'bear_rsi_ob': 70, 'bear_adx_thresh': 34.46829137404158, 'bear_atr_min_pct': 0.00861425989650937, 'bear_atr_max_pct': 0.04816869493657114, 'bear_tp_mult': 2.9572701530095213, 'bear_tsl_mult': 0.08099427087346919, 'bear_time_stop': 279, 'bear_use_sma': True, 'bear_use_ema': True, 'bear_use_atr': True, 'bear_use_adx': True, 'bear_use_spike': False, 'bear_rsi_required': False, 'sideways_strategy': 'breakout', 'sideways_bb_std_mult': 3.4625936198839886, 'sideways_rsi_os': 9, 'sideways_rsi_ob': 55, 'sideways_adx_thresh': 17.710211718643713, 'sideways_atr_min_pct': 0.024620189679076487, 'sideways_atr_max_pct': 0.10954172029669257, 'sideways_tp_mult': 1.9075302540970338, 'sideways_tsl_mult': 0.7135968303892365, 'sideways_time_stop': 149, 'sideways_use_sma': False, 'sideways_use_ema': False, 'sideways_use_atr': False, 'sideways_use_adx': False, 'sideways_use_spike': False, 'sideways_rsi_required': True}.
[I 2025-09-01 03:59:08,185] Trial 568 finished with values: [-0.017731935346496752, 0.017598777237148595] and parameters: {'p_sma': 18, 'p_std': 54, 'p_atr': 25, 'p_adx': 10, 'rsi_period': 8, 'ema1': 14, 'ema2': 11, 'slip_atr_k': 0.20424695753436095, 'slip_spread_k': 0.012219361716188426, 'spread_hl_frac': 0.042458390637916975, 'bb_std_mult': 2.6305775214084552, 'rsi_os': 47, 'rsi_ob': 51, 'vol_spike': 0.1786686111844397, 'adx_thresh': 13.616036720170072, 'atr_min_pct': 0.010038356216467325, 'atr_max_pct': 0.05456463824084355, 'tp_mult': 2.997160793030774, 'tsl_mult': 0.2852278484278159, 'strategy': 'mean_reversion', 'time_stop': 69, 'use_sma': True, 'use_atr': False, 'use_adx': False, 'use_ema': True, 'use_spike': False, 'rsi_required': True, 'edge_k': 1.966325589687075, 'edge_cap': 0.2632333830938927, 'bull_strategy': 'mean_reversion', 'bull_bb_std_mult': 0.8707793632174088, 'bull_rsi_os': 6, 'bull_rsi_ob': 75, 'bull_adx_thresh': 9.186351443155695, 'bull_atr_min_pct': 0.0005543890071697132, 'bull_atr_max_pct': 0.09271966794679687, 'bull_tp_mult': 1.058482613852942, 'bull_tsl_mult': 0.25852921288010405, 'bull_time_stop': 106, 'bull_use_sma': False, 'bull_use_ema': False, 'bull_use_atr': True, 'bull_use_adx': True, 'bull_use_spike': False, 'bull_rsi_required': True, 'bear_strategy': 'mean_reversion', 'bear_bb_std_mult': 3.154085100827393, 'bear_rsi_os': 43, 'bear_rsi_ob': 68, 'bear_adx_thresh': 33.60863833152103, 'bear_atr_min_pct': 0.008016641677621629, 'bear_atr_max_pct': 0.05302548629116145, 'bear_tp_mult': 2.9443900963514187, 'bear_tsl_mult': 0.07599181906737072, 'bear_time_stop': 259, 'bear_use_sma': True, 'bear_use_ema': True, 'bear_use_atr': True, 'bear_use_adx': True, 'bear_use_spike': True, 'bear_rsi_required': False, 'sideways_strategy': 'mean_reversion', 'sideways_bb_std_mult': 3.4281745921919726, 'sideways_rsi_os': 11, 'sideways_rsi_ob': 59, 'sideways_adx_thresh': 18.288519610669287, 'sideways_atr_min_pct': 0.024491024367563487, 'sideways_atr_max_pct': 0.10878818226361786, 'sideways_tp_mult': 1.9243676244638706, 'sideways_tsl_mult': 0.714073259463696, 'sideways_time_stop': 143, 'sideways_use_sma': False, 'sideways_use_ema': False, 'sideways_use_atr': False, 'sideways_use_adx': False, 'sideways_use_spike': False, 'sideways_rsi_required': True}.
[I 2025-09-01 03:59:08,412] Trial 569 finished with values: [-0.01482900683265509, 0.01472212130989348] and parameters: {'p_sma': 19, 'p_std': 54, 'p_atr': 24, 'p_adx': 11, 'rsi_period': 33, 'ema1': 13, 'ema2': 52, 'slip_atr_k': 0.0099271205769106, 'slip_spread_k': 0.005596248505326685, 'spread_hl_frac': 0.04050529302368938, 'bb_std_mult': 2.376783025400684, 'rsi_os': 47, 'rsi_ob': 79, 'vol_spike': 0.018150659183074846, 'adx_thresh': 15.84182431987025, 'atr_min_pct': 0.009811951891284155, 'atr_max_pct': 0.02668899376696801, 'tp_mult': 2.599705350235993, 'tsl_mult': 0.21289551064867374, 'strategy': 'mean_reversion', 'time_stop': 112, 'use_sma': True, 'use_atr': False, 'use_adx': False, 'use_ema': True, 'use_spike': False, 'rsi_required': True, 'edge_k': 1.9527562518726955, 'edge_cap': 0.26473602882935593, 'bull_strategy': 'mean_reversion', 'bull_bb_std_mult': 0.8900951503675272, 'bull_rsi_os': 6, 'bull_rsi_ob': 74, 'bull_adx_thresh': 9.157453299888997, 'bull_atr_min_pct': 0.0008304175551583348, 'bull_atr_max_pct': 0.11075460001041008, 'bull_tp_mult': 1.0617159481567748, 'bull_tsl_mult': 0.2335774071870229, 'bull_time_stop': 287, 'bull_use_sma': False, 'bull_use_ema': False, 'bull_use_atr': True, 'bull_use_adx': True, 'bull_use_spike': False, 'bull_rsi_required': True, 'bear_strategy': 'mean_reversion', 'bear_bb_std_mult': 3.1450899348020096, 'bear_rsi_os': 46, 'bear_rsi_ob': 71, 'bear_adx_thresh': 33.467043298761794, 'bear_atr_min_pct': 0.010269918973941304, 'bear_atr_max_pct': 0.04786825149982013, 'bear_tp_mult': 2.8748760745185935, 'bear_tsl_mult': 0.08107010603532505, 'bear_time_stop': 277, 'bear_use_sma': True, 'bear_use_ema': True, 'bear_use_atr': True, 'bear_use_adx': True, 'bear_use_spike': False, 'bear_rsi_required': False, 'sideways_strategy': 'breakout', 'sideways_bb_std_mult': 3.444551304573549, 'sideways_rsi_os': 8, 'sideways_rsi_ob': 55, 'sideways_adx_thresh': 10.358992011266515, 'sideways_atr_min_pct': 0.023356365830317583, 'sideways_atr_max_pct': 0.10935518842753597, 'sideways_tp_mult': 1.9054068341765127, 'sideways_tsl_mult': 0.7594604218947313, 'sideways_time_stop': 84, 'sideways_use_sma': False, 'sideways_use_ema': False, 'sideways_use_atr': False, 'sideways_use_adx': False, 'sideways_use_spike': False, 'sideways_rsi_required': True}.
[I 2025-09-01 03:59:48,591] Trial 574 finished with values: [-1000000000.0, 1000000000.0] and parameters: {'p_sma': 16, 'p_std': 40, 'p_atr': 23, 'p_adx': 11, 'rsi_period': 51, 'ema1': 14, 'ema2': 53, 'slip_atr_k': 0.0849444685499551, 'slip_spread_k': 0.07081038321537061, 'spread_hl_frac': 0.04603506371558407, 'bb_std_mult': 2.716208155366151, 'rsi_os': 44, 'rsi_ob': 80, 'vol_spike': 0.19051386979601662, 'adx_thresh': 14.305135264306188, 'atr_min_pct': 0.013512876562034051, 'atr_max_pct': 0.026309904171403137, 'tp_mult': 2.548529450933143, 'tsl_mult': 0.21576336362522314, 'strategy': 'mean_reversion', 'time_stop': 101, 'use_sma': True, 'use_atr': True, 'use_adx': False, 'use_ema': True, 'use_spike': False, 'rsi_required': True, 'edge_k': 0.2707796443628412, 'edge_cap': 0.29264729674759377, 'bull_strategy': 'mean_reversion', 'bull_bb_std_mult': 3.1740559738379526, 'bull_rsi_os': 7, 'bull_rsi_ob': 79, 'bull_adx_thresh': 7.234220606090701, 'bull_atr_min_pct': 0.0165349446148244, 'bull_atr_max_pct': 0.10714592756717935, 'bull_tp_mult': 1.421660370210634, 'bull_tsl_mult': 0.5883308745473166, 'bull_time_stop': 85, 'bull_use_sma': False, 'bull_use_ema': False, 'bull_use_atr': True, 'bull_use_adx': True, 'bull_use_spike': False, 'bull_rsi_required': True, 'bear_strategy': 'mean_reversion', 'bear_bb_std_mult': 3.253462866373793, 'bear_rsi_os': 46, 'bear_rsi_ob': 70, 'bear_adx_thresh': 33.21812226930088, 'bear_atr_min_pct': 0.008719529880957876, 'bear_atr_max_pct': 0.05755976883592151, 'bear_tp_mult': 2.783496812176623, 'bear_tsl_mult': 0.8502314862646503, 'bear_time_stop': 275, 'bear_use_sma': True, 'bear_use_ema': True, 'bear_use_atr': True, 'bear_use_adx': True, 'bear_use_spike': True, 'bear_rsi_required': False, 'sideways_strategy': 'breakout', 'sideways_bb_std_mult': 3.416270284829215, 'sideways_rsi_os': 29, 'sideways_rsi_ob': 56, 'sideways_adx_thresh': 10.510636991527448, 'sideways_atr_min_pct': 0.023102155532144238, 'sideways_atr_max_pct': 0.11414115011084366, 'sideways_tp_mult': 2.051320745788106, 'sideways_tsl_mult': 0.7710746147554142, 'sideways_time_stop': 176, 'sideways_use_sma': False, 'sideways_use_ema': False, 'sideways_use_atr': False, 'sideways_use_adx': True, 'sideways_use_spike': False, 'sideways_rsi_required': True}.
[I 2025-09-01 03:59:49,121] Trial 573 finished with values: [-1000000000.0, 1000000000.0] and parameters: {'p_sma': 18, 'p_std': 50, 'p_atr': 25, 'p_adx': 11, 'rsi_period': 80, 'ema1': 14, 'ema2': 54, 'slip_atr_k': 0.0854293341681392, 'slip_spread_k': 0.02848428748822812, 'spread_hl_frac': 0.0432838018115379, 'bb_std_mult': 2.247385349181202, 'rsi_os': 45, 'rsi_ob': 80, 'vol_spike': 0.2899784311896945, 'adx_thresh': 22.400042476072247, 'atr_min_pct': 0.02439470516629125, 'atr_max_pct': 0.046792742440308656, 'tp_mult': 1.2286535110472836, 'tsl_mult': 0.3140669268256264, 'strategy': 'mean_reversion', 'time_stop': 100, 'use_sma': True, 'use_atr': True, 'use_adx': False, 'use_ema': True, 'use_spike': False, 'rsi_required': True, 'edge_k': 0.29774602456962784, 'edge_cap': 0.28911627652625316, 'bull_strategy': 'mean_reversion', 'bull_bb_std_mult': 0.801849642449916, 'bull_rsi_os': 7, 'bull_rsi_ob': 79, 'bull_adx_thresh': 6.956569665607986, 'bull_atr_min_pct': 0.0016017818625530872, 'bull_atr_max_pct': 0.09339891993066526, 'bull_tp_mult': 2.3465735426348204, 'bull_tsl_mult': 0.2276900130787602, 'bull_time_stop': 295, 'bull_use_sma': False, 'bull_use_ema': False, 'bull_use_atr': True, 'bull_use_adx': True, 'bull_use_spike': False, 'bull_rsi_required': True, 'bear_strategy': 'mean_reversion', 'bear_bb_std_mult': 3.2613177816381276, 'bear_rsi_os': 45, 'bear_rsi_ob': 69, 'bear_adx_thresh': 33.385354001030876, 'bear_atr_min_pct': 0.008046764485142612, 'bear_atr_max_pct': 0.05523095071722978, 'bear_tp_mult': 2.9382356305300315, 'bear_tsl_mult': 0.04660418595522736, 'bear_time_stop': 275, 'bear_use_sma': True, 'bear_use_ema': True, 'bear_use_atr': True, 'bear_use_adx': True, 'bear_use_spike': True, 'bear_rsi_required': False, 'sideways_strategy': 'breakout', 'sideways_bb_std_mult': 3.379599197262649, 'sideways_rsi_os': 12, 'sideways_rsi_ob': 60, 'sideways_adx_thresh': 8.04070250630426, 'sideways_atr_min_pct': 0.023281455756099762, 'sideways_atr_max_pct': 0.11592999958661948, 'sideways_tp_mult': 1.838080767721435, 'sideways_tsl_mult': 0.6720455851233785, 'sideways_time_stop': 178, 'sideways_use_sma': False, 'sideways_use_ema': False, 'sideways_use_atr': False, 'sideways_use_adx': True, 'sideways_use_spike': False, 'sideways_rsi_required': True}.
[I 2025-09-01 03:59:49,135] Trial 572 finished with values: [-0.022516741871121293, 0.022410648340414098] and parameters: {'p_sma': 18, 'p_std': 39, 'p_atr': 24, 'p_adx': 11, 'rsi_period': 58, 'ema1': 14, 'ema2': 53, 'slip_atr_k': 0.010698189049177567, 'slip_spread_k': 0.0696720618201441, 'spread_hl_frac': 8.595052063741643e-05, 'bb_std_mult': 2.640992662206321, 'rsi_os': 45, 'rsi_ob': 79, 'vol_spike': 0.1899601442656106, 'adx_thresh': 15.79933373173231, 'atr_min_pct': 0.009198432951190032, 'atr_max_pct': 0.03904923171452751, 'tp_mult': 1.2282780802658912, 'tsl_mult': 0.6422279425412598, 'strategy': 'mean_reversion', 'time_stop': 108, 'use_sma': True, 'use_atr': True, 'use_adx': False, 'use_ema': True, 'use_spike': False, 'rsi_required': True, 'edge_k': 1.3504950210519608, 'edge_cap': 0.275190184568781, 'bull_strategy': 'mean_reversion', 'bull_bb_std_mult': 0.5810664221244036, 'bull_rsi_os': 7, 'bull_rsi_ob': 79, 'bull_adx_thresh': 8.504921924407121, 'bull_atr_min_pct': 0.0006304841917836706, 'bull_atr_max_pct': 0.04305635875805557, 'bull_tp_mult': 2.8544026162020724, 'bull_tsl_mult': 0.23561812557416484, 'bull_time_stop': 288, 'bull_use_sma': False, 'bull_use_ema': False, 'bull_use_atr': True, 'bull_use_adx': True, 'bull_use_spike': False, 'bull_rsi_required': True, 'bear_strategy': 'mean_reversion', 'bear_bb_std_mult': 3.2856187937851415, 'bear_rsi_os': 46, 'bear_rsi_ob': 70, 'bear_adx_thresh': 33.43966595839996, 'bear_atr_min_pct': 0.008583944710474863, 'bear_atr_max_pct': 0.05651823829478326, 'bear_tp_mult': 2.95280128935139, 'bear_tsl_mult': 0.821909533344604, 'bear_time_stop': 277, 'bear_use_sma': True, 'bear_use_ema': True, 'bear_use_atr': True, 'bear_use_adx': True, 'bear_use_spike': False, 'bear_rsi_required': False, 'sideways_strategy': 'breakout', 'sideways_bb_std_mult': 3.386095289821517, 'sideways_rsi_os': 9, 'sideways_rsi_ob': 60, 'sideways_adx_thresh': 31.717558370082727, 'sideways_atr_min_pct': 0.023434809271081228, 'sideways_atr_max_pct': 0.1159073013961216, 'sideways_tp_mult': 2.050137948159999, 'sideways_tsl_mult': 0.7153236325564254, 'sideways_time_stop': 146, 'sideways_use_sma': False, 'sideways_use_ema': False, 'sideways_use_atr': False, 'sideways_use_adx': False, 'sideways_use_spike': False, 'sideways_rsi_required': True}.
[I 2025-09-01 03:59:49,388] Trial 575 finished with values: [-1000000000.0, 1000000000.0] and parameters: {'p_sma': 20, 'p_std': 50, 'p_atr': 26, 'p_adx': 13, 'rsi_period': 80, 'ema1': 13, 'ema2': 54, 'slip_atr_k': 0.14514417733420537, 'slip_spread_k': 0.07228684710516711, 'spread_hl_frac': 0.04391249171909045, 'bb_std_mult': 2.7233522906617145, 'rsi_os': 42, 'rsi_ob': 80, 'vol_spike': 0.28970254154686326, 'adx_thresh': 22.362258249978904, 'atr_min_pct': 0.01348985744441195, 'atr_max_pct': 0.046236430059017744, 'tp_mult': 2.608423815082417, 'tsl_mult': 0.6365023225457105, 'strategy': 'mean_reversion', 'time_stop': 100, 'use_sma': True, 'use_atr': True, 'use_adx': False, 'use_ema': True, 'use_spike': False, 'rsi_required': True, 'edge_k': 1.3424173552098142, 'edge_cap': 0.2936012235889614, 'bull_strategy': 'mean_reversion', 'bull_bb_std_mult': 2.650710689771763, 'bull_rsi_os': 6, 'bull_rsi_ob': 79, 'bull_adx_thresh': 7.540367591339928, 'bull_atr_min_pct': 0.016626921546498117, 'bull_atr_max_pct': 0.09648733641534203, 'bull_tp_mult': 1.4943843164822077, 'bull_tsl_mult': 0.7241870859757402, 'bull_time_stop': 140, 'bull_use_sma': False, 'bull_use_ema': False, 'bull_use_atr': True, 'bull_use_adx': True, 'bull_use_spike': False, 'bull_rsi_required': True, 'bear_strategy': 'mean_reversion', 'bear_bb_std_mult': 3.261269587868748, 'bear_rsi_os': 45, 'bear_rsi_ob': 70, 'bear_adx_thresh': 32.23196165799071, 'bear_atr_min_pct': 0.008736326408811688, 'bear_atr_max_pct': 0.05720478734986593, 'bear_tp_mult': 2.807560856951804, 'bear_tsl_mult': 0.03999015824222361, 'bear_time_stop': 275, 'bear_use_sma': True, 'bear_use_ema': True, 'bear_use_atr': True, 'bear_use_adx': True, 'bear_use_spike': True, 'bear_rsi_required': False, 'sideways_strategy': 'breakout', 'sideways_bb_std_mult': 3.379246850141725, 'sideways_rsi_os': 6, 'sideways_rsi_ob': 56, 'sideways_adx_thresh': 10.259183905999683, 'sideways_atr_min_pct': 0.02347103545478521, 'sideways_atr_max_pct': 0.11247972934650732, 'sideways_tp_mult': 2.0545555736502426, 'sideways_tsl_mult': 0.7771467845060671, 'sideways_time_stop': 76, 'sideways_use_sma': False, 'sideways_use_ema': False, 'sideways_use_atr': False, 'sideways_use_adx': True, 'sideways_use_spike': False, 'sideways_rsi_required': False}.
