2025-09-01 02:20:36,954 WARNING: DATA SANITY: Extreme jumps >20*ATR200: 42
[I 2025-09-01 02:20:36,977] A new study created in memory with name: no-name-ba8410ad-b8a3-4626-821f-d12ce2cb5049
[I 2025-09-01 02:21:20,277] Trial 1 finished with values: [-1000000000.0, 1000000000.0] and parameters: {'p_sma': 37, 'p_std': 35, 'p_atr': 16, 'p_adx': 27, 'rsi_period': 9, 'ema1': 24, 'ema2': 23, 'slip_atr_k': 0.2214624605677745, 'slip_spread_k': 0.016078016140360418, 'spread_hl_frac': 0.026621703131942412, 'bb_std_mult': 1.2150841281166103, 'rsi_os': 10, 'rsi_ob': 81, 'vol_spike': 0.19318345005379994, 'adx_thresh': 18.85949860213663, 'atr_min_pct': 0.004939769331352163, 'atr_max_pct': 0.04684269400905732, 'tp_mult': 1.663823602242256, 'tsl_mult': 0.7409049646080796, 'strategy': 'mean_reversion', 'time_stop': 235, 'use_sma': True, 'use_atr': True, 'use_adx': False, 'use_ema': False, 'use_spike': False, 'rsi_required': False, 'edge_k': 0.8844281790367365, 'edge_cap': 0.6160929214417417, 'bull_strategy': 'breakout', 'bull_bb_std_mult': 0.6287186257480499, 'bull_rsi_os': 17, 'bull_rsi_ob': 69, 'bull_adx_thresh': 33.94380696577098, 'bull_atr_min_pct': 0.01513599617981899, 'bull_atr_max_pct': 0.10750154801660283, 'bull_tp_mult': 1.116426181681989, 'bull_tsl_mult': 0.42983950026145856, 'bull_time_stop': 34, 'bull_use_sma': False, 'bull_use_ema': False, 'bull_use_atr': True, 'bull_use_adx': False, 'bull_use_spike': False, 'bull_rsi_required': False, 'bear_strategy': 'mean_reversion', 'bear_bb_std_mult': 1.3440860299520425, 'bear_rsi_os': 14, 'bear_rsi_ob': 78, 'bear_adx_thresh': 30.97470874991825, 'bear_atr_min_pct': 0.010795587227110118, 'bear_atr_max_pct': 0.057886429988308875, 'bear_tp_mult': 2.319908949819388, 'bear_tsl_mult': 0.4085878682290124, 'bear_time_stop': 71, 'bear_use_sma': True, 'bear_use_ema': True, 'bear_use_atr': False, 'bear_use_adx': True, 'bear_use_spike': True, 'bear_rsi_required': True, 'sideways_strategy': 'mean_reversion', 'sideways_bb_std_mult': 1.2463100482594398, 'sideways_rsi_os': 5, 'sideways_rsi_ob': 85, 'sideways_adx_thresh': 13.00040328130742, 'sideways_atr_min_pct': 0.014262105558172594, 'sideways_atr_max_pct': 0.08206677678126346, 'sideways_tp_mult': 1.9075301223392633, 'sideways_tsl_mult': 0.8278340536286779, 'sideways_time_stop': 297, 'sideways_use_sma': True, 'sideways_use_ema': False, 'sideways_use_atr': True, 'sideways_use_adx': False, 'sideways_use_spike': True, 'sideways_rsi_required': False}.
[I 2025-09-01 02:21:20,442] Trial 4 finished with values: [-1000000000.0, 1000000000.0] and parameters: {'p_sma': 49, 'p_std': 39, 'p_atr': 30, 'p_adx': 23, 'rsi_period': 63, 'ema1': 13, 'ema2': 37, 'slip_atr_k': 0.2259095336258384, 'slip_spread_k': 0.637367957878106, 'spread_hl_frac': 0.005885593562376368, 'bb_std_mult': 0.9164647010960457, 'rsi_os': 17, 'rsi_ob': 49, 'vol_spike': 0.15059890610389204, 'adx_thresh': 26.725448758719878, 'atr_min_pct': 0.009152425354541064, 'atr_max_pct': 0.13187003504201703, 'tp_mult': 1.2159062296564385, 'tsl_mult': 0.07337237819996356, 'strategy': 'mean_reversion', 'time_stop': 21, 'use_sma': True, 'use_atr': True, 'use_adx': False, 'use_ema': True, 'use_spike': False, 'rsi_required': False, 'edge_k': 1.612754184329288, 'edge_cap': 0.19149470485624076, 'bull_strategy': 'breakout', 'bull_bb_std_mult': 1.0803946025128957, 'bull_rsi_os': 6, 'bull_rsi_ob': 89, 'bull_adx_thresh': 17.979229541672954, 'bull_atr_min_pct': 0.0009505557943067966, 'bull_atr_max_pct': 0.12048803320522454, 'bull_tp_mult': 2.6635569125918495, 'bull_tsl_mult': 0.40175892496219545, 'bull_time_stop': 253, 'bull_use_sma': False, 'bull_use_ema': True, 'bull_use_atr': False, 'bull_use_adx': True, 'bull_use_spike': False, 'bull_rsi_required': False, 'bear_strategy': 'breakout', 'bear_bb_std_mult': 1.973901031288656, 'bear_rsi_os': 25, 'bear_rsi_ob': 77, 'bear_adx_thresh': 13.729673371072419, 'bear_atr_min_pct': 0.005158415955444549, 'bear_atr_max_pct': 0.10863827448770744, 'bear_tp_mult': 2.1049552673247174, 'bear_tsl_mult': 0.8225616868838278, 'bear_time_stop': 245, 'bear_use_sma': True, 'bear_use_ema': False, 'bear_use_atr': True, 'bear_use_adx': False, 'bear_use_spike': False, 'bear_rsi_required': False, 'sideways_strategy': 'mean_reversion', 'sideways_bb_std_mult': 0.5970352769357935, 'sideways_rsi_os': 34, 'sideways_rsi_ob': 55, 'sideways_adx_thresh': 20.466982218023404, 'sideways_atr_min_pct': 0.00507557584072529, 'sideways_atr_max_pct': 0.050230382038168, 'sideways_tp_mult': 2.204009997004523, 'sideways_tsl_mult': 0.8552017006829925, 'sideways_time_stop': 56, 'sideways_use_sma': True, 'sideways_use_ema': False, 'sideways_use_atr': False, 'sideways_use_adx': True, 'sideways_use_spike': False, 'sideways_rsi_required': True}.
[I 2025-09-01 02:21:20,503] Trial 5 finished with values: [-1000000000.0, 1000000000.0] and parameters: {'p_sma': 20, 'p_std': 52, 'p_atr': 29, 'p_adx': 8, 'rsi_period': 82, 'ema1': 24, 'ema2': 25, 'slip_atr_k': 0.19974527599185188, 'slip_spread_k': 0.8222314608826679, 'spread_hl_frac': 0.030964344536021867, 'bb_std_mult': 1.2180354928653934, 'rsi_os': 54, 'rsi_ob': 91, 'vol_spike': 0.07602242142376038, 'adx_thresh': 32.64824390150167, 'atr_min_pct': 0.011718837189908146, 'atr_max_pct': 0.07816709436258434, 'tp_mult': 1.488854320049023, 'tsl_mult': 0.7531642914128266, 'strategy': 'mean_reversion', 'time_stop': 70, 'use_sma': False, 'use_atr': False, 'use_adx': False, 'use_ema': False, 'use_spike': False, 'rsi_required': True, 'edge_k': 0.42727215282342557, 'edge_cap': 0.33344891781176866, 'bull_strategy': 'mean_reversion', 'bull_bb_std_mult': 2.996790111141723, 'bull_rsi_os': 26, 'bull_rsi_ob': 80, 'bull_adx_thresh': 30.86500051004282, 'bull_atr_min_pct': 0.019509809904141487, 'bull_atr_max_pct': 0.10712681829286884, 'bull_tp_mult': 1.498681503286607, 'bull_tsl_mult': 0.9589352128176519, 'bull_time_stop': 218, 'bull_use_sma': True, 'bull_use_ema': False, 'bull_use_atr': True, 'bull_use_adx': False, 'bull_use_spike': False, 'bull_rsi_required': False, 'bear_strategy': 'mean_reversion', 'bear_bb_std_mult': 1.6776039171185955, 'bear_rsi_os': 25, 'bear_rsi_ob': 89, 'bear_adx_thresh': 10.522570930886197, 'bear_atr_min_pct': 0.01521555881256895, 'bear_atr_max_pct': 0.024396224612949897, 'bear_tp_mult': 1.958243878650105, 'bear_tsl_mult': 0.0178499488938082, 'bear_time_stop': 237, 'bear_use_sma': False, 'bear_use_ema': True, 'bear_use_atr': True, 'bear_use_adx': True, 'bear_use_spike': False, 'bear_rsi_required': False, 'sideways_strategy': 'breakout', 'sideways_bb_std_mult': 2.232424648502787, 'sideways_rsi_os': 22, 'sideways_rsi_ob': 82, 'sideways_adx_thresh': 31.24874014307976, 'sideways_atr_min_pct': 0.017835998359821033, 'sideways_atr_max_pct': 0.12444915409156332, 'sideways_tp_mult': 1.1116070008028995, 'sideways_tsl_mult': 0.5945610044063251, 'sideways_time_stop': 105, 'sideways_use_sma': True, 'sideways_use_ema': False, 'sideways_use_atr': True, 'sideways_use_adx': True, 'sideways_use_spike': False, 'sideways_rsi_required': False}.
[I 2025-09-01 02:21:20,553] Trial 6 finished with values: [-1000000000.0, 1000000000.0] and parameters: {'p_sma': 36, 'p_std': 56, 'p_atr': 8, 'p_adx': 18, 'rsi_period': 25, 'ema1': 9, 'ema2': 36, 'slip_atr_k': 0.15713336345246373, 'slip_spread_k': 0.3069249261292436, 'spread_hl_frac': 0.028626978922575392, 'bb_std_mult': 2.1054393831963685, 'rsi_os': 19, 'rsi_ob': 46, 'vol_spike': 0.003951055273340076, 'adx_thresh': 21.50224057605094, 'atr_min_pct': 0.011031042342893402, 'atr_max_pct': 0.11395924522171794, 'tp_mult': 1.5184922139349384, 'tsl_mult': 0.9840002190149213, 'strategy': 'mean_reversion', 'time_stop': 283, 'use_sma': False, 'use_atr': False, 'use_adx': True, 'use_ema': False, 'use_spike': True, 'rsi_required': True, 'edge_k': 0.5619315499281536, 'edge_cap': 0.8358569874833702, 'bull_strategy': 'mean_reversion', 'bull_bb_std_mult': 0.7406433495236239, 'bull_rsi_os': 13, 'bull_rsi_ob': 72, 'bull_adx_thresh': 16.043013847282893, 'bull_atr_min_pct': 0.02387623995741962, 'bull_atr_max_pct': 0.05180121409202476, 'bull_tp_mult': 1.6008668312745777, 'bull_tsl_mult': 0.5612755990931283, 'bull_time_stop': 216, 'bull_use_sma': True, 'bull_use_ema': False, 'bull_use_atr': True, 'bull_use_adx': False, 'bull_use_spike': False, 'bull_rsi_required': True, 'bear_strategy': 'breakout', 'bear_bb_std_mult': 2.066700943152985, 'bear_rsi_os': 48, 'bear_rsi_ob': 60, 'bear_adx_thresh': 31.10465721464806, 'bear_atr_min_pct': 0.022525237949649564, 'bear_atr_max_pct': 0.0988594919498603, 'bear_tp_mult': 1.9238911276148791, 'bear_tsl_mult': 0.014222214103012831, 'bear_time_stop': 29, 'bear_use_sma': False, 'bear_use_ema': False, 'bear_use_atr': False, 'bear_use_adx': True, 'bear_use_spike': True, 'bear_rsi_required': True, 'sideways_strategy': 'breakout', 'sideways_bb_std_mult': 0.6841476647048377, 'sideways_rsi_os': 10, 'sideways_rsi_ob': 51, 'sideways_adx_thresh': 19.040064624869007, 'sideways_atr_min_pct': 0.004799486514215099, 'sideways_atr_max_pct': 0.1034991006858794, 'sideways_tp_mult': 1.50436931583643, 'sideways_tsl_mult': 0.3139836244012776, 'sideways_time_stop': 257, 'sideways_use_sma': True, 'sideways_use_ema': True, 'sideways_use_atr': False, 'sideways_use_adx': False, 'sideways_use_spike': False, 'sideways_rsi_required': True}.
[I 2025-09-01 02:21:22,023] Trial 2 finished with values: [-1000000000.0, 1000000000.0] and parameters: {'p_sma': 25, 'p_std': 30, 'p_atr': 9, 'p_adx': 25, 'rsi_period': 7, 'ema1': 7, 'ema2': 48, 'slip_atr_k': 0.1942041143838457, 'slip_spread_k': 0.32950215988832143, 'spread_hl_frac': 0.04881404748270479, 'bb_std_mult': 3.0451934722950496, 'rsi_os': 22, 'rsi_ob': 55, 'vol_spike': 0.008830960533363075, 'adx_thresh': 25.271071100985168, 'atr_min_pct': 0.008973668214742353, 'atr_max_pct': 0.0890493161970416, 'tp_mult': 2.3793299138394817, 'tsl_mult': 0.8603662813028695, 'strategy': 'breakout', 'time_stop': 45, 'use_sma': True, 'use_atr': False, 'use_adx': True, 'use_ema': False, 'use_spike': True, 'rsi_required': True, 'edge_k': 1.83894376181071, 'edge_cap': 0.5208040122377794, 'bull_strategy': 'breakout', 'bull_bb_std_mult': 3.01757161640127, 'bull_rsi_os': 52, 'bull_rsi_ob': 88, 'bull_adx_thresh': 16.36851892057248, 'bull_atr_min_pct': 0.02864100958233349, 'bull_atr_max_pct': 0.08667347058723665, 'bull_tp_mult': 2.651202631724851, 'bull_tsl_mult': 0.31718425594213817, 'bull_time_stop': 211, 'bull_use_sma': False, 'bull_use_ema': True, 'bull_use_atr': True, 'bull_use_adx': False, 'bull_use_spike': False, 'bull_rsi_required': False, 'bear_strategy': 'mean_reversion', 'bear_bb_std_mult': 0.8576474694732691, 'bear_rsi_os': 38, 'bear_rsi_ob': 76, 'bear_adx_thresh': 13.245532076850024, 'bear_atr_min_pct': 0.02757976488276876, 'bear_atr_max_pct': 0.10668918581529944, 'bear_tp_mult': 2.2843524908864827, 'bear_tsl_mult': 0.7575030597619936, 'bear_time_stop': 214, 'bear_use_sma': True, 'bear_use_ema': True, 'bear_use_atr': True, 'bear_use_adx': True, 'bear_use_spike': False, 'bear_rsi_required': True, 'sideways_strategy': 'breakout', 'sideways_bb_std_mult': 2.53093645925917, 'sideways_rsi_os': 12, 'sideways_rsi_ob': 50, 'sideways_adx_thresh': 32.950097927757916, 'sideways_atr_min_pct': 0.011014626212624517, 'sideways_atr_max_pct': 0.0810085740489031, 'sideways_tp_mult': 1.2099584196824227, 'sideways_tsl_mult': 0.25262649278342264, 'sideways_time_stop': 203, 'sideways_use_sma': True, 'sideways_use_ema': False, 'sideways_use_atr': False, 'sideways_use_adx': True, 'sideways_use_spike': True, 'sideways_rsi_required': False}.
[I 2025-09-01 02:21:24,131] Trial 0 finished with values: [-1000000000.0, 1000000000.0] and parameters: {'p_sma': 45, 'p_std': 22, 'p_atr': 20, 'p_adx': 29, 'rsi_period': 83, 'ema1': 30, 'ema2': 59, 'slip_atr_k': 0.23196800423407796, 'slip_spread_k': 0.1383078512879603, 'spread_hl_frac': 0.04533786112654833, 'bb_std_mult': 1.5371613515655997, 'rsi_os': 53, 'rsi_ob': 93, 'vol_spike': 0.12308250323823433, 'adx_thresh': 24.82740406039712, 'atr_min_pct': 0.011176121905085611, 'atr_max_pct': 0.06047829420052571, 'tp_mult': 2.8163749813379244, 'tsl_mult': 0.7937092899843019, 'strategy': 'breakout', 'time_stop': 228, 'use_sma': True, 'use_atr': True, 'use_adx': True, 'use_ema': False, 'use_spike': False, 'rsi_required': True, 'edge_k': 1.352273943636461, 'edge_cap': 0.7545817478242856, 'bull_strategy': 'breakout', 'bull_bb_std_mult': 0.792336490926456, 'bull_rsi_os': 46, 'bull_rsi_ob': 89, 'bull_adx_thresh': 8.37503796608531, 'bull_atr_min_pct': 0.011830970836359516, 'bull_atr_max_pct': 0.11046010811419832, 'bull_tp_mult': 2.6989253686353227, 'bull_tsl_mult': 0.7288010121298548, 'bull_time_stop': 33, 'bull_use_sma': True, 'bull_use_ema': False, 'bull_use_atr': True, 'bull_use_adx': False, 'bull_use_spike': True, 'bull_rsi_required': False, 'bear_strategy': 'mean_reversion', 'bear_bb_std_mult': 1.9553742479463483, 'bear_rsi_os': 22, 'bear_rsi_ob': 87, 'bear_adx_thresh': 5.302652602893598, 'bear_atr_min_pct': 0.017001249881025835, 'bear_atr_max_pct': 0.063189558768895, 'bear_tp_mult': 2.5885423115321275, 'bear_tsl_mult': 0.7219470262131649, 'bear_time_stop': 132, 'bear_use_sma': True, 'bear_use_ema': True, 'bear_use_atr': True, 'bear_use_adx': False, 'bear_use_spike': False, 'bear_rsi_required': False, 'sideways_strategy': 'mean_reversion', 'sideways_bb_std_mult': 2.836068014987623, 'sideways_rsi_os': 55, 'sideways_rsi_ob': 72, 'sideways_adx_thresh': 15.340679325050946, 'sideways_atr_min_pct': 0.007525903456567638, 'sideways_atr_max_pct': 0.01845171090798493, 'sideways_tp_mult': 1.870373879950606, 'sideways_tsl_mult': 0.5673428770716022, 'sideways_time_stop': 227, 'sideways_use_sma': False, 'sideways_use_ema': True, 'sideways_use_atr': True, 'sideways_use_adx': True, 'sideways_use_spike': False, 'sideways_rsi_required': False}.
[I 2025-09-01 02:21:24,157] Trial 9 finished with values: [-1000000000.0, 1000000000.0] and parameters: {'p_sma': 58, 'p_std': 47, 'p_atr': 10, 'p_adx': 11, 'rsi_period': 61, 'ema1': 15, 'ema2': 14, 'slip_atr_k': 0.10960475099917721, 'slip_spread_k': 0.5215612964559816, 'spread_hl_frac': 0.022235658055105002, 'bb_std_mult': 2.777236499087009, 'rsi_os': 51, 'rsi_ob': 71, 'vol_spike': 0.2368287131794963, 'adx_thresh': 26.6709918878803, 'atr_min_pct': 0.020564689634245882, 'atr_max_pct': 0.012468737404362917, 'tp_mult': 1.2310490215641041, 'tsl_mult': 0.9740366828000255, 'strategy': 'breakout', 'time_stop': 8, 'use_sma': False, 'use_atr': False, 'use_adx': True, 'use_ema': False, 'use_spike': True, 'rsi_required': True, 'edge_k': 1.0132734900342535, 'edge_cap': 0.282212272895222, 'bull_strategy': 'breakout', 'bull_bb_std_mult': 2.246242203844271, 'bull_rsi_os': 12, 'bull_rsi_ob': 70, 'bull_adx_thresh': 9.594614295329597, 'bull_atr_min_pct': 0.008286548561749181, 'bull_atr_max_pct': 0.012203652106784018, 'bull_tp_mult': 2.206430347895525, 'bull_tsl_mult': 0.24206004245149626, 'bull_time_stop': 299, 'bull_use_sma': True, 'bull_use_ema': False, 'bull_use_atr': False, 'bull_use_adx': False, 'bull_use_spike': True, 'bull_rsi_required': False, 'bear_strategy': 'mean_reversion', 'bear_bb_std_mult': 3.308447364896591, 'bear_rsi_os': 18, 'bear_rsi_ob': 80, 'bear_adx_thresh': 19.03199463226426, 'bear_atr_min_pct': 0.02086235082842802, 'bear_atr_max_pct': 0.10161257967502313, 'bear_tp_mult': 1.4750127415563297, 'bear_tsl_mult': 0.9784229142413983, 'bear_time_stop': 217, 'bear_use_sma': False, 'bear_use_ema': True, 'bear_use_atr': True, 'bear_use_adx': True, 'bear_use_spike': False, 'bear_rsi_required': True, 'sideways_strategy': 'breakout', 'sideways_bb_std_mult': 2.0184472711118127, 'sideways_rsi_os': 18, 'sideways_rsi_ob': 78, 'sideways_adx_thresh': 17.004283470582987, 'sideways_atr_min_pct': 0.026707776364695814, 'sideways_atr_max_pct': 0.014971761932345251, 'sideways_tp_mult': 2.4522137415798784, 'sideways_tsl_mult': 0.7798356979325496, 'sideways_time_stop': 67, 'sideways_use_sma': False, 'sideways_use_ema': False, 'sideways_use_atr': True, 'sideways_use_adx': True, 'sideways_use_spike': False, 'sideways_rsi_required': True}.
[I 2025-09-01 02:21:25,151] Trial 3 finished with values: [-1000000000.0, 1000000000.0] and parameters: {'p_sma': 35, 'p_std': 44, 'p_atr': 21, 'p_adx': 19, 'rsi_period': 41, 'ema1': 17, 'ema2': 52, 'slip_atr_k': 0.2275663104831394, 'slip_spread_k': 0.23014243427555314, 'spread_hl_frac': 0.03891245367926125, 'bb_std_mult': 2.0768909611651893, 'rsi_os': 46, 'rsi_ob': 86, 'vol_spike': 0.19846104409008247, 'adx_thresh': 25.36939381035927, 'atr_min_pct': 0.028120490095968592, 'atr_max_pct': 0.04956197735076014, 'tp_mult': 1.1850465906395231, 'tsl_mult': 0.871721586126895, 'strategy': 'mean_reversion', 'time_stop': 129, 'use_sma': True, 'use_atr': True, 'use_adx': False, 'use_ema': True, 'use_spike': False, 'rsi_required': True, 'edge_k': 1.1082130317676695, 'edge_cap': 0.6424450603735309, 'bull_strategy': 'breakout', 'bull_bb_std_mult': 3.2064038460656965, 'bull_rsi_os': 16, 'bull_rsi_ob': 48, 'bull_adx_thresh': 31.558149783981516, 'bull_atr_min_pct': 0.02254187617897515, 'bull_atr_max_pct': 0.14412878346749564, 'bull_tp_mult': 2.2161387847828897, 'bull_tsl_mult': 0.20482233889072687, 'bull_time_stop': 100, 'bull_use_sma': True, 'bull_use_ema': True, 'bull_use_atr': False, 'bull_use_adx': False, 'bull_use_spike': False, 'bull_rsi_required': True, 'bear_strategy': 'breakout', 'bear_bb_std_mult': 2.7793172329788485, 'bear_rsi_os': 29, 'bear_rsi_ob': 54, 'bear_adx_thresh': 17.59066278663779, 'bear_atr_min_pct': 0.02507624310266224, 'bear_atr_max_pct': 0.12326067876699273, 'bear_tp_mult': 1.5473485803204112, 'bear_tsl_mult': 0.5756224898121016, 'bear_time_stop': 135, 'bear_use_sma': True, 'bear_use_ema': True, 'bear_use_atr': False, 'bear_use_adx': False, 'bear_use_spike': True, 'bear_rsi_required': False, 'sideways_strategy': 'breakout', 'sideways_bb_std_mult': 2.7602184677660886, 'sideways_rsi_os': 13, 'sideways_rsi_ob': 63, 'sideways_adx_thresh': 28.137342803388467, 'sideways_atr_min_pct': 0.0048634359760638575, 'sideways_atr_max_pct': 0.0505904221372298, 'sideways_tp_mult': 2.1257944014292796, 'sideways_tsl_mult': 0.9796950563852, 'sideways_time_stop': 15, 'sideways_use_sma': False, 'sideways_use_ema': True, 'sideways_use_atr': False, 'sideways_use_adx': True, 'sideways_use_spike': False, 'sideways_rsi_required': True}.
[I 2025-09-01 02:22:07,236] Trial 8 finished with values: [-1000000000.0, 1000000000.0] and parameters: {'p_sma': 42, 'p_std': 43, 'p_atr': 26, 'p_adx': 19, 'rsi_period': 61, 'ema1': 17, 'ema2': 33, 'slip_atr_k': 0.2307008705441254, 'slip_spread_k': 0.48074765302262057, 'spread_hl_frac': 0.02582250491825564, 'bb_std_mult': 3.5164659086708947, 'rsi_os': 24, 'rsi_ob': 65, 'vol_spike': 0.2876582738055807, 'adx_thresh': 23.67926510593172, 'atr_min_pct': 0.027769488025459584, 'atr_max_pct': 0.1001438311082083, 'tp_mult': 1.6661914375322253, 'tsl_mult': 0.9078526702257466, 'strategy': 'mean_reversion', 'time_stop': 57, 'use_sma': True, 'use_atr': True, 'use_adx': False, 'use_ema': False, 'use_spike': False, 'rsi_required': False, 'edge_k': 0.5653151045729217, 'edge_cap': 0.22491312058605414, 'bull_strategy': 'breakout', 'bull_bb_std_mult': 0.5193235223025661, 'bull_rsi_os': 49, 'bull_rsi_ob': 64, 'bull_adx_thresh': 21.250827937304205, 'bull_atr_min_pct': 0.004298690362418797, 'bull_atr_max_pct': 0.03076889985750832, 'bull_tp_mult': 2.611026690449195, 'bull_tsl_mult': 0.12009681192629507, 'bull_time_stop': 50, 'bull_use_sma': False, 'bull_use_ema': False, 'bull_use_atr': False, 'bull_use_adx': True, 'bull_use_spike': True, 'bull_rsi_required': False, 'bear_strategy': 'breakout', 'bear_bb_std_mult': 0.8781031980853718, 'bear_rsi_os': 38, 'bear_rsi_ob': 89, 'bear_adx_thresh': 18.767595572821154, 'bear_atr_min_pct': 0.02387556799081541, 'bear_atr_max_pct': 0.08710040984261422, 'bear_tp_mult': 1.6412073630799755, 'bear_tsl_mult': 0.6457030976509871, 'bear_time_stop': 74, 'bear_use_sma': True, 'bear_use_ema': True, 'bear_use_atr': True, 'bear_use_adx': True, 'bear_use_spike': False, 'bear_rsi_required': False, 'sideways_strategy': 'mean_reversion', 'sideways_bb_std_mult': 3.0939850801424336, 'sideways_rsi_os': 32, 'sideways_rsi_ob': 53, 'sideways_adx_thresh': 34.83279062589417, 'sideways_atr_min_pct': 0.013501273622508546, 'sideways_atr_max_pct': 0.09003586058365641, 'sideways_tp_mult': 1.9149518697717196, 'sideways_tsl_mult': 0.6696075200050687, 'sideways_time_stop': 137, 'sideways_use_sma': False, 'sideways_use_ema': False, 'sideways_use_atr': False, 'sideways_use_adx': False, 'sideways_use_spike': True, 'sideways_rsi_required': False}.
