[I 2025-09-01 02:50:11,824] Trial 162 finished with values: [-1000000000.0, 1000000000.0] and parameters: {'p_sma': 44, 'p_std': 31, 'p_atr': 24, 'p_adx': 26, 'rsi_period': 60, 'ema1': 23, 'ema2': 19, 'slip_atr_k': 0.012221191621696256, 'slip_spread_k': 0.41432614129884177, 'spread_hl_frac': 0.012554206499607942, 'bb_std_mult': 1.7929228272815672, 'rsi_os': 47, 'rsi_ob': 75, 'vol_spike': 0.11887695774067777, 'adx_thresh': 24.33645191623083, 'atr_min_pct': 0.024622388496833566, 'atr_max_pct': 0.04232803883028142, 'tp_mult': 2.28501476141443, 'tsl_mult': 0.33981823582607373, 'strategy': 'breakout', 'time_stop': 155, 'use_sma': True, 'use_atr': False, 'use_adx': True, 'use_ema': False, 'use_spike': True, 'rsi_required': False, 'edge_k': 1.3518353489115904, 'edge_cap': 0.3325107976124091, 'bull_strategy': 'mean_reversion', 'bull_bb_std_mult': 1.1936751078898542, 'bull_rsi_os': 17, 'bull_rsi_ob': 82, 'bull_adx_thresh': 22.435152234612687, 'bull_atr_min_pct': 0.004343785443243158, 'bull_atr_max_pct': 0.10549166399142057, 'bull_tp_mult': 1.5662966789274961, 'bull_tsl_mult': 0.8611296168093562, 'bull_time_stop': 165, 'bull_use_sma': True, 'bull_use_ema': False, 'bull_use_atr': False, 'bull_use_adx': False, 'bull_use_spike': True, 'bull_rsi_required': True, 'bear_strategy': 'breakout', 'bear_bb_std_mult': 3.0978161264024004, 'bear_rsi_os': 49, 'bear_rsi_ob': 80, 'bear_adx_thresh': 13.811354506998851, 'bear_atr_min_pct': 0.016152973480765557, 'bear_atr_max_pct': 0.11140067479077695, 'bear_tp_mult': 1.5238586783166055, 'bear_tsl_mult': 0.31880980953841787, 'bear_time_stop': 228, 'bear_use_sma': False, 'bear_use_ema': True, 'bear_use_atr': False, 'bear_use_adx': False, 'bear_use_spike': False, 'bear_rsi_required': False, 'sideways_strategy': 'breakout', 'sideways_bb_std_mult': 1.6400879503909978, 'sideways_rsi_os': 29, 'sideways_rsi_ob': 55, 'sideways_adx_thresh': 15.289008488163667, 'sideways_atr_min_pct': 0.005948005174322259, 'sideways_atr_max_pct': 0.08334654640110896, 'sideways_tp_mult': 1.8534135971355112, 'sideways_tsl_mult': 0.08137716652694693, 'sideways_time_stop': 300, 'sideways_use_sma': False, 'sideways_use_ema': True, 'sideways_use_atr': True, 'sideways_use_adx': True, 'sideways_use_spike': True, 'sideways_rsi_required': False}.
[I 2025-09-01 02:50:12,289] Trial 166 finished with values: [-1000000000.0, 1000000000.0] and parameters: {'p_sma': 47, 'p_std': 44, 'p_atr': 25, 'p_adx': 10, 'rsi_period': 24, 'ema1': 27, 'ema2': 54, 'slip_atr_k': 0.05483295787189651, 'slip_spread_k': 0.5026075600309257, 'spread_hl_frac': 0.015269416563674247, 'bb_std_mult': 1.8846614971359776, 'rsi_os': 47, 'rsi_ob': 55, 'vol_spike': 0.14552863097841542, 'adx_thresh': 24.970963738898725, 'atr_min_pct': 0.020468248955480377, 'atr_max_pct': 0.013235199941691575, 'tp_mult': 1.6670180720414591, 'tsl_mult': 0.414534325882615, 'strategy': 'breakout', 'time_stop': 59, 'use_sma': False, 'use_atr': False, 'use_adx': False, 'use_ema': False, 'use_spike': True, 'rsi_required': False, 'edge_k': 0.3756600939196095, 'edge_cap': 0.43018649266530923, 'bull_strategy': 'mean_reversion', 'bull_bb_std_mult': 2.761118159545256, 'bull_rsi_os': 44, 'bull_rsi_ob': 66, 'bull_adx_thresh': 18.109790380415497, 'bull_atr_min_pct': 0.02286833956747851, 'bull_atr_max_pct': 0.12214606153782495, 'bull_tp_mult': 2.464604168849511, 'bull_tsl_mult': 0.47984621284017187, 'bull_time_stop': 231, 'bull_use_sma': True, 'bull_use_ema': False, 'bull_use_atr': False, 'bull_use_adx': False, 'bull_use_spike': True, 'bull_rsi_required': True, 'bear_strategy': 'breakout', 'bear_bb_std_mult': 3.3155084595216833, 'bear_rsi_os': 5, 'bear_rsi_ob': 75, 'bear_adx_thresh': 22.92714544128118, 'bear_atr_min_pct': 0.014387141322449953, 'bear_atr_max_pct': 0.14806848163479866, 'bear_tp_mult': 1.2013706840077618, 'bear_tsl_mult': 0.25475839019456237, 'bear_time_stop': 69, 'bear_use_sma': False, 'bear_use_ema': False, 'bear_use_atr': False, 'bear_use_adx': True, 'bear_use_spike': True, 'bear_rsi_required': True, 'sideways_strategy': 'breakout', 'sideways_bb_std_mult': 2.0339844506939517, 'sideways_rsi_os': 31, 'sideways_rsi_ob': 92, 'sideways_adx_thresh': 29.663049854958636, 'sideways_atr_min_pct': 0.004663585761934137, 'sideways_atr_max_pct': 0.052476872395722976, 'sideways_tp_mult': 1.3763460824098996, 'sideways_tsl_mult': 0.005878152264387981, 'sideways_time_stop': 297, 'sideways_use_sma': False, 'sideways_use_ema': True, 'sideways_use_atr': True, 'sideways_use_adx': True, 'sideways_use_spike': True, 'sideways_rsi_required': True}.
[I 2025-09-01 02:50:12,390] Trial 167 finished with values: [-1000000000.0, 1000000000.0] and parameters: {'p_sma': 35, 'p_std': 42, 'p_atr': 7, 'p_adx': 23, 'rsi_period': 55, 'ema1': 25, 'ema2': 14, 'slip_atr_k': 0.00782553903701347, 'slip_spread_k': 0.3994433938403077, 'spread_hl_frac': 0.013581706303059451, 'bb_std_mult': 2.541076302853167, 'rsi_os': 45, 'rsi_ob': 59, 'vol_spike': 0.14344816925885384, 'adx_thresh': 23.099428115111795, 'atr_min_pct': 0.022217734163559676, 'atr_max_pct': 0.02089710328194963, 'tp_mult': 2.102077218206744, 'tsl_mult': 0.2976071151517451, 'strategy': 'breakout', 'time_stop': 247, 'use_sma': False, 'use_atr': False, 'use_adx': True, 'use_ema': True, 'use_spike': True, 'rsi_required': False, 'edge_k': 1.2727089338775497, 'edge_cap': 0.3890353565041865, 'bull_strategy': 'mean_reversion', 'bull_bb_std_mult': 3.121662085296312, 'bull_rsi_os': 19, 'bull_rsi_ob': 64, 'bull_adx_thresh': 34.53381086047893, 'bull_atr_min_pct': 0.010628506310984928, 'bull_atr_max_pct': 0.09546818554838922, 'bull_tp_mult': 1.7189479345618333, 'bull_tsl_mult': 0.44701572654381216, 'bull_time_stop': 188, 'bull_use_sma': False, 'bull_use_ema': False, 'bull_use_atr': False, 'bull_use_adx': False, 'bull_use_spike': True, 'bull_rsi_required': True, 'bear_strategy': 'breakout', 'bear_bb_std_mult': 0.62343150741124, 'bear_rsi_os': 5, 'bear_rsi_ob': 95, 'bear_adx_thresh': 22.398839299200663, 'bear_atr_min_pct': 0.016100296986362672, 'bear_atr_max_pct': 0.10648623291704554, 'bear_tp_mult': 1.4202873657517352, 'bear_tsl_mult': 0.3410485923457194, 'bear_time_stop': 268, 'bear_use_sma': False, 'bear_use_ema': False, 'bear_use_atr': True, 'bear_use_adx': False, 'bear_use_spike': True, 'bear_rsi_required': True, 'sideways_strategy': 'breakout', 'sideways_bb_std_mult': 1.9555079507896258, 'sideways_rsi_os': 8, 'sideways_rsi_ob': 49, 'sideways_adx_thresh': 30.22196424092907, 'sideways_atr_min_pct': 0.02116555190009419, 'sideways_atr_max_pct': 0.0798410533939024, 'sideways_tp_mult': 2.7306072600819435, 'sideways_tsl_mult': 0.4736907527625401, 'sideways_time_stop': 290, 'sideways_use_sma': False, 'sideways_use_ema': False, 'sideways_use_atr': True, 'sideways_use_adx': True, 'sideways_use_spike': True, 'sideways_rsi_required': True}.
[I 2025-09-01 02:50:58,395] Trial 163 finished with values: [-1000000000.0, 1000000000.0] and parameters: {'p_sma': 45, 'p_std': 25, 'p_atr': 7, 'p_adx': 10, 'rsi_period': 60, 'ema1': 24, 'ema2': 54, 'slip_atr_k': 0.008466315243685813, 'slip_spread_k': 0.41947971008429874, 'spread_hl_frac': 0.012384710495706781, 'bb_std_mult': 1.4819456115128375, 'rsi_os': 43, 'rsi_ob': 61, 'vol_spike': 0.08549527088444141, 'adx_thresh': 16.934851055019838, 'atr_min_pct': 0.01813287029322016, 'atr_max_pct': 0.031600636708617444, 'tp_mult': 1.1919570543449036, 'tsl_mult': 0.3304411887133887, 'strategy': 'breakout', 'time_stop': 156, 'use_sma': False, 'use_atr': False, 'use_adx': True, 'use_ema': False, 'use_spike': True, 'rsi_required': False, 'edge_k': 0.4127636454551312, 'edge_cap': 0.3949678551734902, 'bull_strategy': 'mean_reversion', 'bull_bb_std_mult': 2.7516503622338546, 'bull_rsi_os': 19, 'bull_rsi_ob': 61, 'bull_adx_thresh': 16.423084529380375, 'bull_atr_min_pct': 0.010689742383353063, 'bull_atr_max_pct': 0.12480133663849552, 'bull_tp_mult': 1.5767336480375043, 'bull_tsl_mult': 0.48365168962654537, 'bull_time_stop': 165, 'bull_use_sma': True, 'bull_use_ema': False, 'bull_use_atr': False, 'bull_use_adx': False, 'bull_use_spike': True, 'bull_rsi_required': True, 'bear_strategy': 'breakout', 'bear_bb_std_mult': 2.685891002399332, 'bear_rsi_os': 53, 'bear_rsi_ob': 80, 'bear_adx_thresh': 22.442468771750182, 'bear_atr_min_pct': 0.014179625604463631, 'bear_atr_max_pct': 0.12083094511084144, 'bear_tp_mult': 1.529022238758332, 'bear_tsl_mult': 0.3181711999278528, 'bear_time_stop': 241, 'bear_use_sma': False, 'bear_use_ema': False, 'bear_use_atr': False, 'bear_use_adx': False, 'bear_use_spike': True, 'bear_rsi_required': True, 'sideways_strategy': 'breakout', 'sideways_bb_std_mult': 1.7106964378515013, 'sideways_rsi_os': 9, 'sideways_rsi_ob': 80, 'sideways_adx_thresh': 20.772903893832787, 'sideways_atr_min_pct': 0.0006905712564370566, 'sideways_atr_max_pct': 0.066799336864418, 'sideways_tp_mult': 2.7529302870268824, 'sideways_tsl_mult': 0.08453532094162186, 'sideways_time_stop': 296, 'sideways_use_sma': False, 'sideways_use_ema': True, 'sideways_use_atr': True, 'sideways_use_adx': True, 'sideways_use_spike': True, 'sideways_rsi_required': False}.
[I 2025-09-01 02:50:58,425] Trial 165 finished with values: [-1000000000.0, 1000000000.0] and parameters: {'p_sma': 35, 'p_std': 44, 'p_atr': 24, 'p_adx': 10, 'rsi_period': 60, 'ema1': 27, 'ema2': 54, 'slip_atr_k': 0.056165096835103887, 'slip_spread_k': 0.41528737681892136, 'spread_hl_frac': 0.015336784243495777, 'bb_std_mult': 1.815507499345192, 'rsi_os': 47, 'rsi_ob': 59, 'vol_spike': 0.08227074280875946, 'adx_thresh': 17.005272703812945, 'atr_min_pct': 0.02479509773231183, 'atr_max_pct': 0.03364547084534974, 'tp_mult': 2.1220104627306156, 'tsl_mult': 0.36203291335856747, 'strategy': 'breakout', 'time_stop': 5, 'use_sma': False, 'use_atr': False, 'use_adx': True, 'use_ema': False, 'use_spike': True, 'rsi_required': False, 'edge_k': 1.4512295262550623, 'edge_cap': 0.43178714796648904, 'bull_strategy': 'mean_reversion', 'bull_bb_std_mult': 1.1627549705479219, 'bull_rsi_os': 45, 'bull_rsi_ob': 64, 'bull_adx_thresh': 33.3137048090876, 'bull_atr_min_pct': 0.0043988437457110115, 'bull_atr_max_pct': 0.09557843672699627, 'bull_tp_mult': 1.549937033221955, 'bull_tsl_mult': 0.48316151726861356, 'bull_time_stop': 235, 'bull_use_sma': True, 'bull_use_ema': False, 'bull_use_atr': False, 'bull_use_adx': False, 'bull_use_spike': True, 'bull_rsi_required': True, 'bear_strategy': 'breakout', 'bear_bb_std_mult': 0.636476382200732, 'bear_rsi_os': 5, 'bear_rsi_ob': 95, 'bear_adx_thresh': 22.549119520612336, 'bear_atr_min_pct': 0.016128774307690854, 'bear_atr_max_pct': 0.10753205432960974, 'bear_tp_mult': 1.4202468314570704, 'bear_tsl_mult': 0.23546735400819635, 'bear_time_stop': 160, 'bear_use_sma': False, 'bear_use_ema': False, 'bear_use_atr': False, 'bear_use_adx': False, 'bear_use_spike': True, 'bear_rsi_required': True, 'sideways_strategy': 'breakout', 'sideways_bb_std_mult': 2.045048737738438, 'sideways_rsi_os': 9, 'sideways_rsi_ob': 54, 'sideways_adx_thresh': 29.64960128555398, 'sideways_atr_min_pct': 0.005897316063249621, 'sideways_atr_max_pct': 0.08791085943923342, 'sideways_tp_mult': 1.3711485916309616, 'sideways_tsl_mult': 0.4928721660115072, 'sideways_time_stop': 297, 'sideways_use_sma': False, 'sideways_use_ema': True, 'sideways_use_atr': True, 'sideways_use_adx': True, 'sideways_use_spike': True, 'sideways_rsi_required': True}.
[I 2025-09-01 02:50:58,684] Trial 164 finished with values: [-1000000000.0, 1000000000.0] and parameters: {'p_sma': 30, 'p_std': 44, 'p_atr': 7, 'p_adx': 10, 'rsi_period': 60, 'ema1': 27, 'ema2': 54, 'slip_atr_k': 0.00019449697447404025, 'slip_spread_k': 0.40666444540928937, 'spread_hl_frac': 0.015547898064299969, 'bb_std_mult': 3.2809083180228713, 'rsi_os': 45, 'rsi_ob': 55, 'vol_spike': 0.14586541891827196, 'adx_thresh': 24.185897391520882, 'atr_min_pct': 0.024906633271999223, 'atr_max_pct': 0.0324010405777957, 'tp_mult': 2.0860140186558187, 'tsl_mult': 0.3365892350743767, 'strategy': 'breakout', 'time_stop': 268, 'use_sma': False, 'use_atr': False, 'use_adx': True, 'use_ema': False, 'use_spike': True, 'rsi_required': False, 'edge_k': 0.3766086422526584, 'edge_cap': 0.4541952996679636, 'bull_strategy': 'mean_reversion', 'bull_bb_std_mult': 1.1765793594577543, 'bull_rsi_os': 19, 'bull_rsi_ob': 64, 'bull_adx_thresh': 17.92607124445258, 'bull_atr_min_pct': 0.004226225642304935, 'bull_atr_max_pct': 0.09410438407445143, 'bull_tp_mult': 1.5710086179742913, 'bull_tsl_mult': 0.4451628903792486, 'bull_time_stop': 231, 'bull_use_sma': True, 'bull_use_ema': False, 'bull_use_atr': False, 'bull_use_adx': False, 'bull_use_spike': True, 'bull_rsi_required': True, 'bear_strategy': 'breakout', 'bear_bb_std_mult': 3.3184762508738697, 'bear_rsi_os': 5, 'bear_rsi_ob': 95, 'bear_adx_thresh': 12.03291949050056, 'bear_atr_min_pct': 0.014268875857511607, 'bear_atr_max_pct': 0.13165438980278046, 'bear_tp_mult': 1.4216202936536009, 'bear_tsl_mult': 0.32107348510959255, 'bear_time_stop': 227, 'bear_use_sma': False, 'bear_use_ema': False, 'bear_use_atr': False, 'bear_use_adx': False, 'bear_use_spike': True, 'bear_rsi_required': True, 'sideways_strategy': 'breakout', 'sideways_bb_std_mult': 2.044931281537258, 'sideways_rsi_os': 8, 'sideways_rsi_ob': 92, 'sideways_adx_thresh': 29.48719413438223, 'sideways_atr_min_pct': 0.00935135879114029, 'sideways_atr_max_pct': 0.08801464443399731, 'sideways_tp_mult': 2.413466445714166, 'sideways_tsl_mult': 0.47958044410099315, 'sideways_time_stop': 293, 'sideways_use_sma': False, 'sideways_use_ema': True, 'sideways_use_atr': True, 'sideways_use_adx': True, 'sideways_use_spike': True, 'sideways_rsi_required': True}.
[I 2025-09-01 02:50:58,873] Trial 168 finished with values: [-1000000000.0, 1000000000.0] and parameters: {'p_sma': 31, 'p_std': 8, 'p_atr': 25, 'p_adx': 10, 'rsi_period': 60, 'ema1': 28, 'ema2': 60, 'slip_atr_k': 0.0003721474863767492, 'slip_spread_k': 0.42264226206196903, 'spread_hl_frac': 0.013653489209736452, 'bb_std_mult': 1.6257856899182672, 'rsi_os': 51, 'rsi_ob': 47, 'vol_spike': 0.15035179501304094, 'adx_thresh': 31.776408387046896, 'atr_min_pct': 0.018179083869963513, 'atr_max_pct': 0.03428449492107151, 'tp_mult': 1.058440814460451, 'tsl_mult': 0.050439274642399, 'strategy': 'breakout', 'time_stop': 270, 'use_sma': False, 'use_atr': False, 'use_adx': False, 'use_ema': False, 'use_spike': True, 'rsi_required': False, 'edge_k': 0.7602390854164026, 'edge_cap': 0.4663257535888988, 'bull_strategy': 'mean_reversion', 'bull_bb_std_mult': 2.1106616681546395, 'bull_rsi_os': 20, 'bull_rsi_ob': 61, 'bull_adx_thresh': 15.762982637263217, 'bull_atr_min_pct': 0.02843008051553081, 'bull_atr_max_pct': 0.08709155921468047, 'bull_tp_mult': 2.7981337703217335, 'bull_tsl_mult': 0.5497909885847534, 'bull_time_stop': 153, 'bull_use_sma': False, 'bull_use_ema': False, 'bull_use_atr': False, 'bull_use_adx': False, 'bull_use_spike': True, 'bull_rsi_required': True, 'bear_strategy': 'breakout', 'bear_bb_std_mult': 1.9318880328940378, 'bear_rsi_os': 8, 'bear_rsi_ob': 95, 'bear_adx_thresh': 12.287142135580908, 'bear_atr_min_pct': 0.014144520625331893, 'bear_atr_max_pct': 0.0856742552269367, 'bear_tp_mult': 1.5765260828566858, 'bear_tsl_mult': 0.42689720361105515, 'bear_time_stop': 54, 'bear_use_sma': False, 'bear_use_ema': False, 'bear_use_atr': False, 'bear_use_adx': True, 'bear_use_spike': True, 'bear_rsi_required': True, 'sideways_strategy': 'breakout', 'sideways_bb_std_mult': 2.2151525428426, 'sideways_rsi_os': 39, 'sideways_rsi_ob': 53, 'sideways_adx_thresh': 30.919455749740358, 'sideways_atr_min_pct': 0.009748447587088085, 'sideways_atr_max_pct': 0.07244493010034332, 'sideways_tp_mult': 1.3390898340894508, 'sideways_tsl_mult': 0.5496618812306656, 'sideways_time_stop': 279, 'sideways_use_sma': False, 'sideways_use_ema': True, 'sideways_use_atr': True, 'sideways_use_adx': True, 'sideways_use_spike': True, 'sideways_rsi_required': False}.
[I 2025-09-01 02:50:59,367] Trial 169 finished with values: [-1000000000.0, 1000000000.0] and parameters: {'p_sma': 50, 'p_std': 41, 'p_atr': 25, 'p_adx': 7, 'rsi_period': 54, 'ema1': 30, 'ema2': 60, 'slip_atr_k': 0.0008785364367658746, 'slip_spread_k': 0.3669922584038935, 'spread_hl_frac': 0.013687151853006198, 'bb_std_mult': 1.6293251516628582, 'rsi_os': 50, 'rsi_ob': 57, 'vol_spike': 0.2667923867023343, 'adx_thresh': 31.33429515443304, 'atr_min_pct': 0.02142663664845204, 'atr_max_pct': 0.01777434542473519, 'tp_mult': 1.2717574430753968, 'tsl_mult': 0.46288881206898963, 'strategy': 'breakout', 'time_stop': 170, 'use_sma': False, 'use_atr': True, 'use_adx': False, 'use_ema': True, 'use_spike': True, 'rsi_required': False, 'edge_k': 0.4865411635180668, 'edge_cap': 0.45850107046358046, 'bull_strategy': 'mean_reversion', 'bull_bb_std_mult': 1.071286829661956, 'bull_rsi_os': 20, 'bull_rsi_ob': 65, 'bull_adx_thresh': 15.838473174645387, 'bull_atr_min_pct': 0.02834198465891233, 'bull_atr_max_pct': 0.08912738055274766, 'bull_tp_mult': 1.532406892047467, 'bull_tsl_mult': 0.060381316948908026, 'bull_time_stop': 153, 'bull_use_sma': False, 'bull_use_ema': True, 'bull_use_atr': False, 'bull_use_adx': False, 'bull_use_spike': True, 'bull_rsi_required': True, 'bear_strategy': 'breakout', 'bear_bb_std_mult': 2.5768991215624166, 'bear_rsi_os': 21, 'bear_rsi_ob': 54, 'bear_adx_thresh': 7.203206913370876, 'bear_atr_min_pct': 0.016708381853058663, 'bear_atr_max_pct': 0.10084205193654544, 'bear_tp_mult': 1.278931087081551, 'bear_tsl_mult': 0.42372816080566705, 'bear_time_stop': 54, 'bear_use_sma': False, 'bear_use_ema': False, 'bear_use_atr': True, 'bear_use_adx': True, 'bear_use_spike': True, 'bear_rsi_required': True, 'sideways_strategy': 'breakout', 'sideways_bb_std_mult': 2.21604100101275, 'sideways_rsi_os': 49, 'sideways_rsi_ob': 76, 'sideways_adx_thresh': 7.6208582353502035, 'sideways_atr_min_pct': 0.012423341745872642, 'sideways_atr_max_pct': 0.04511008153010986, 'sideways_tp_mult': 1.3063381438802446, 'sideways_tsl_mult': 0.5847111016287477, 'sideways_time_stop': 277, 'sideways_use_sma': False, 'sideways_use_ema': False, 'sideways_use_atr': True, 'sideways_use_adx': True, 'sideways_use_spike': True, 'sideways_rsi_required': False}.
[I 2025-09-01 02:50:59,372] Trial 171 finished with values: [-1000000000.0, 1000000000.0] and parameters: {'p_sma': 33, 'p_std': 8, 'p_atr': 25, 'p_adx': 14, 'rsi_period': 58, 'ema1': 28, 'ema2': 31, 'slip_atr_k': 0.06354394602562177, 'slip_spread_k': 0.5311703057855379, 'spread_hl_frac': 0.01364753921266607, 'bb_std_mult': 3.0715694453904927, 'rsi_os': 50, 'rsi_ob': 62, 'vol_spike': 0.2691188597102978, 'adx_thresh': 31.30401582063067, 'atr_min_pct': 0.017558939248561112, 'atr_max_pct': 0.02661088239602158, 'tp_mult': 2.0209496395253588, 'tsl_mult': 0.02446954120343692, 'strategy': 'mean_reversion', 'time_stop': 76, 'use_sma': False, 'use_atr': True, 'use_adx': False, 'use_ema': True, 'use_spike': True, 'rsi_required': False, 'edge_k': 0.273438476985206, 'edge_cap': 0.3644049703350598, 'bull_strategy': 'mean_reversion', 'bull_bb_std_mult': 1.1107037832602276, 'bull_rsi_os': 16, 'bull_rsi_ob': 79, 'bull_adx_thresh': 5.162538450339612, 'bull_atr_min_pct': 0.0244416541361649, 'bull_atr_max_pct': 0.087227646641819, 'bull_tp_mult': 1.5217247369417501, 'bull_tsl_mult': 0.5411507059001912, 'bull_time_stop': 256, 'bull_use_sma': False, 'bull_use_ema': True, 'bull_use_atr': False, 'bull_use_adx': False, 'bull_use_spike': True, 'bull_rsi_required': False, 'bear_strategy': 'mean_reversion', 'bear_bb_std_mult': 2.592558188028987, 'bear_rsi_os': 27, 'bear_rsi_ob': 53, 'bear_adx_thresh': 18.1901501830618, 'bear_atr_min_pct': 0.016600384171735597, 'bear_atr_max_pct': 0.13840828016108644, 'bear_tp_mult': 1.5760505265491023, 'bear_tsl_mult': 0.420658252780982, 'bear_time_stop': 216, 'bear_use_sma': False, 'bear_use_ema': False, 'bear_use_atr': True, 'bear_use_adx': True, 'bear_use_spike': True, 'bear_rsi_required': True, 'sideways_strategy': 'mean_reversion', 'sideways_bb_std_mult': 2.213813013961102, 'sideways_rsi_os': 33, 'sideways_rsi_ob': 76, 'sideways_adx_thresh': 23.5792405177004, 'sideways_atr_min_pct': 0.02277550310771062, 'sideways_atr_max_pct': 0.04718525045632531, 'sideways_tp_mult': 1.1182243637127232, 'sideways_tsl_mult': 0.04586865213699737, 'sideways_time_stop': 287, 'sideways_use_sma': True, 'sideways_use_ema': False, 'sideways_use_atr': True, 'sideways_use_adx': False, 'sideways_use_spike': True, 'sideways_rsi_required': False}.
