[I 2025-09-01 03:21:30,409] Trial 363 finished with values: [-1000000000.0, 1000000000.0] and parameters: {'p_sma': 25, 'p_std': 57, 'p_atr': 28, 'p_adx': 17, 'rsi_period': 44, 'ema1': 30, 'ema2': 30, 'slip_atr_k': 0.0456963542760466, 'slip_spread_k': 0.7792575589422306, 'spread_hl_frac': 0.019677883121036344, 'bb_std_mult': 1.479343686442636, 'rsi_os': 19, 'rsi_ob': 46, 'vol_spike': 0.2146532250646096, 'adx_thresh': 9.965571122665605, 'atr_min_pct': 0.008812053839711497, 'atr_max_pct': 0.054672236036499455, 'tp_mult': 2.7728781072641273, 'tsl_mult': 0.11461420046033205, 'strategy': 'mean_reversion', 'time_stop': 155, 'use_sma': False, 'use_atr': True, 'use_adx': True, 'use_ema': False, 'use_spike': True, 'rsi_required': False, 'edge_k': 0.09356495532714171, 'edge_cap': 0.4842412743728023, 'bull_strategy': 'breakout', 'bull_bb_std_mult': 0.9684952165013128, 'bull_rsi_os': 15, 'bull_rsi_ob': 54, 'bull_adx_thresh': 17.129180894358534, 'bull_atr_min_pct': 0.0012450274195345767, 'bull_atr_max_pct': 0.11700821097947409, 'bull_tp_mult': 2.4640517911612387, 'bull_tsl_mult': 0.3101513294634202, 'bull_time_stop': 269, 'bull_use_sma': True, 'bull_use_ema': False, 'bull_use_atr': False, 'bull_use_adx': True, 'bull_use_spike': False, 'bull_rsi_required': False, 'bear_strategy': 'breakout', 'bear_bb_std_mult': 2.0499880476814125, 'bear_rsi_os': 50, 'bear_rsi_ob': 66, 'bear_adx_thresh': 23.567348441932925, 'bear_atr_min_pct': 0.027172805928706432, 'bear_atr_max_pct': 0.05296706347182725, 'bear_tp_mult': 2.2903165549810387, 'bear_tsl_mult': 0.16584772154605779, 'bear_time_stop': 22, 'bear_use_sma': False, 'bear_use_ema': True, 'bear_use_atr': False, 'bear_use_adx': False, 'bear_use_spike': True, 'bear_rsi_required': True, 'sideways_strategy': 'breakout', 'sideways_bb_std_mult': 1.9491720141406574, 'sideways_rsi_os': 51, 'sideways_rsi_ob': 58, 'sideways_adx_thresh': 34.42978266805294, 'sideways_atr_min_pct': 0.003869122989074483, 'sideways_atr_max_pct': 0.02070183143197147, 'sideways_tp_mult': 2.0375862616948655, 'sideways_tsl_mult': 0.06097313240838936, 'sideways_time_stop': 182, 'sideways_use_sma': True, 'sideways_use_ema': True, 'sideways_use_atr': True, 'sideways_use_adx': True, 'sideways_use_spike': True, 'sideways_rsi_required': True}.
[I 2025-09-01 03:22:10,926] Trial 360 finished with values: [-0.05115975801653061, 0.05074764996038622] and parameters: {'p_sma': 57, 'p_std': 59, 'p_atr': 27, 'p_adx': 17, 'rsi_period': 12, 'ema1': 21, 'ema2': 30, 'slip_atr_k': 0.019032168274876967, 'slip_spread_k': 0.8678707523239806, 'spread_hl_frac': 0.026568810437751153, 'bb_std_mult': 1.4807164800878352, 'rsi_os': 14, 'rsi_ob': 93, 'vol_spike': 0.06410173210647763, 'adx_thresh': 34.12768336115279, 'atr_min_pct': 0.021994217165737486, 'atr_max_pct': 0.054008582509958394, 'tp_mult': 2.7735262456429335, 'tsl_mult': 0.11073192731519604, 'strategy': 'mean_reversion', 'time_stop': 150, 'use_sma': False, 'use_atr': False, 'use_adx': True, 'use_ema': False, 'use_spike': True, 'rsi_required': False, 'edge_k': 0.19528618458697988, 'edge_cap': 0.6748186525876869, 'bull_strategy': 'breakout', 'bull_bb_std_mult': 2.748586045837309, 'bull_rsi_os': 18, 'bull_rsi_ob': 55, 'bull_adx_thresh': 14.116994826454409, 'bull_atr_min_pct': 0.0015278919464426725, 'bull_atr_max_pct': 0.10612886789954756, 'bull_tp_mult': 1.0107013623929353, 'bull_tsl_mult': 0.6342965968581671, 'bull_time_stop': 270, 'bull_use_sma': True, 'bull_use_ema': False, 'bull_use_atr': False, 'bull_use_adx': True, 'bull_use_spike': True, 'bull_rsi_required': False, 'bear_strategy': 'breakout', 'bear_bb_std_mult': 3.4712184163168267, 'bear_rsi_os': 24, 'bear_rsi_ob': 55, 'bear_adx_thresh': 30.779575944634498, 'bear_atr_min_pct': 0.0019305746168533054, 'bear_atr_max_pct': 0.10174238639978408, 'bear_tp_mult': 1.2481154815945517, 'bear_tsl_mult': 0.627184056942184, 'bear_time_stop': 58, 'bear_use_sma': False, 'bear_use_ema': False, 'bear_use_atr': False, 'bear_use_adx': False, 'bear_use_spike': True, 'bear_rsi_required': True, 'sideways_strategy': 'breakout', 'sideways_bb_std_mult': 3.471796355883028, 'sideways_rsi_os': 10, 'sideways_rsi_ob': 71, 'sideways_adx_thresh': 32.30382554296703, 'sideways_atr_min_pct': 0.026892380892709875, 'sideways_atr_max_pct': 0.055278641104113596, 'sideways_tp_mult': 1.6790605330909765, 'sideways_tsl_mult': 0.24432947353788617, 'sideways_time_stop': 109, 'sideways_use_sma': True, 'sideways_use_ema': True, 'sideways_use_atr': True, 'sideways_use_adx': True, 'sideways_use_spike': True, 'sideways_rsi_required': True}.
[I 2025-09-01 03:22:10,940] Trial 361 finished with values: [-1000000000.0, 1000000000.0] and parameters: {'p_sma': 17, 'p_std': 56, 'p_atr': 27, 'p_adx': 27, 'rsi_period': 45, 'ema1': 14, 'ema2': 18, 'slip_atr_k': 0.027798708238681736, 'slip_spread_k': 0.1196219715665056, 'spread_hl_frac': 0.026894525575433825, 'bb_std_mult': 1.2233389197685685, 'rsi_os': 13, 'rsi_ob': 78, 'vol_spike': 0.018363613929080647, 'adx_thresh': 9.087023165381174, 'atr_min_pct': 0.0076440173778695615, 'atr_max_pct': 0.0407793993881934, 'tp_mult': 2.7802178690385504, 'tsl_mult': 0.3445313896333886, 'strategy': 'mean_reversion', 'time_stop': 148, 'use_sma': False, 'use_atr': False, 'use_adx': True, 'use_ema': False, 'use_spike': True, 'rsi_required': False, 'edge_k': 1.6490194998236576, 'edge_cap': 0.2292345182557199, 'bull_strategy': 'breakout', 'bull_bb_std_mult': 0.8502170505880382, 'bull_rsi_os': 10, 'bull_rsi_ob': 54, 'bull_adx_thresh': 31.729840463562446, 'bull_atr_min_pct': 0.0016960306189748777, 'bull_atr_max_pct': 0.0506947460263851, 'bull_tp_mult': 1.4519705694934206, 'bull_tsl_mult': 0.17909448468924427, 'bull_time_stop': 294, 'bull_use_sma': True, 'bull_use_ema': False, 'bull_use_atr': False, 'bull_use_adx': True, 'bull_use_spike': True, 'bull_rsi_required': False, 'bear_strategy': 'breakout', 'bear_bb_std_mult': 2.1719491336834342, 'bear_rsi_os': 50, 'bear_rsi_ob': 66, 'bear_adx_thresh': 12.701819213018652, 'bear_atr_min_pct': 0.027208605204996312, 'bear_atr_max_pct': 0.042117721895891407, 'bear_tp_mult': 1.0773748847048505, 'bear_tsl_mult': 0.9052639227346359, 'bear_time_stop': 199, 'bear_use_sma': False, 'bear_use_ema': False, 'bear_use_atr': False, 'bear_use_adx': False, 'bear_use_spike': True, 'bear_rsi_required': True, 'sideways_strategy': 'breakout', 'sideways_bb_std_mult': 1.9408900867591317, 'sideways_rsi_os': 44, 'sideways_rsi_ob': 58, 'sideways_adx_thresh': 32.368864902360684, 'sideways_atr_min_pct': 0.02914067056557518, 'sideways_atr_max_pct': 0.07942582356388704, 'sideways_tp_mult': 2.6697959658396466, 'sideways_tsl_mult': 0.17584852839571413, 'sideways_time_stop': 40, 'sideways_use_sma': True, 'sideways_use_ema': True, 'sideways_use_atr': True, 'sideways_use_adx': True, 'sideways_use_spike': True, 'sideways_rsi_required': True}.
[I 2025-09-01 03:22:12,406] Trial 359 finished with values: [-0.078870672523225, 0.07894473891963186] and parameters: {'p_sma': 55, 'p_std': 20, 'p_atr': 26, 'p_adx': 17, 'rsi_period': 12, 'ema1': 13, 'ema2': 30, 'slip_atr_k': 0.0030922842375005477, 'slip_spread_k': 0.8732753914477358, 'spread_hl_frac': 0.0358586123411017, 'bb_std_mult': 3.0434079361173962, 'rsi_os': 14, 'rsi_ob': 68, 'vol_spike': 0.22397224155306894, 'adx_thresh': 34.64880652593364, 'atr_min_pct': 0.008463219528791713, 'atr_max_pct': 0.11034237850675797, 'tp_mult': 2.27675941788583, 'tsl_mult': 0.6038082726524694, 'strategy': 'mean_reversion', 'time_stop': 184, 'use_sma': True, 'use_atr': False, 'use_adx': True, 'use_ema': False, 'use_spike': True, 'rsi_required': False, 'edge_k': 0.9784986656536785, 'edge_cap': 0.3144100582792181, 'bull_strategy': 'breakout', 'bull_bb_std_mult': 1.0870779546974658, 'bull_rsi_os': 40, 'bull_rsi_ob': 55, 'bull_adx_thresh': 21.687417047457927, 'bull_atr_min_pct': 0.017428888620393733, 'bull_atr_max_pct': 0.013195747268917687, 'bull_tp_mult': 2.9470871663413156, 'bull_tsl_mult': 0.6615385492137529, 'bull_time_stop': 294, 'bull_use_sma': False, 'bull_use_ema': False, 'bull_use_atr': False, 'bull_use_adx': False, 'bull_use_spike': True, 'bull_rsi_required': False, 'bear_strategy': 'breakout', 'bear_bb_std_mult': 2.450831573605298, 'bear_rsi_os': 50, 'bear_rsi_ob': 53, 'bear_adx_thresh': 30.833834082810935, 'bear_atr_min_pct': 0.001830894854579778, 'bear_atr_max_pct': 0.04291431589393845, 'bear_tp_mult': 1.2595678396935674, 'bear_tsl_mult': 0.6366034589168366, 'bear_time_stop': 68, 'bear_use_sma': False, 'bear_use_ema': False, 'bear_use_atr': False, 'bear_use_adx': False, 'bear_use_spike': True, 'bear_rsi_required': True, 'sideways_strategy': 'breakout', 'sideways_bb_std_mult': 1.8729181851149619, 'sideways_rsi_os': 10, 'sideways_rsi_ob': 75, 'sideways_adx_thresh': 18.83481391271397, 'sideways_atr_min_pct': 0.0038494892255741143, 'sideways_atr_max_pct': 0.03109012707382595, 'sideways_tp_mult': 2.568594606979542, 'sideways_tsl_mult': 0.1567837709162356, 'sideways_time_stop': 41, 'sideways_use_sma': True, 'sideways_use_ema': True, 'sideways_use_atr': True, 'sideways_use_adx': True, 'sideways_use_spike': True, 'sideways_rsi_required': True}.
[I 2025-09-01 03:22:12,883] Trial 364 finished with values: [-0.051447670690402236, 0.0512410431752654] and parameters: {'p_sma': 21, 'p_std': 39, 'p_atr': 7, 'p_adx': 22, 'rsi_period': 51, 'ema1': 20, 'ema2': 53, 'slip_atr_k': 0.010245611243058905, 'slip_spread_k': 0.11935347395734153, 'spread_hl_frac': 0.027214439171375216, 'bb_std_mult': 0.7534781834437254, 'rsi_os': 27, 'rsi_ob': 68, 'vol_spike': 0.1962397236375551, 'adx_thresh': 13.485273322333489, 'atr_min_pct': 0.02199774825859891, 'atr_max_pct': 0.040587334100608344, 'tp_mult': 2.640609151180379, 'tsl_mult': 0.8849672736011214, 'strategy': 'mean_reversion', 'time_stop': 163, 'use_sma': False, 'use_atr': False, 'use_adx': False, 'use_ema': True, 'use_spike': False, 'rsi_required': True, 'edge_k': 0.1786120630223708, 'edge_cap': 0.8036572693201616, 'bull_strategy': 'breakout', 'bull_bb_std_mult': 0.8745623674509726, 'bull_rsi_os': 16, 'bull_rsi_ob': 75, 'bull_adx_thresh': 14.131201371419575, 'bull_atr_min_pct': 0.0018017184131305943, 'bull_atr_max_pct': 0.05220651242938039, 'bull_tp_mult': 1.5785041417991008, 'bull_tsl_mult': 0.6581407098560015, 'bull_time_stop': 48, 'bull_use_sma': True, 'bull_use_ema': False, 'bull_use_atr': True, 'bull_use_adx': False, 'bull_use_spike': True, 'bull_rsi_required': False, 'bear_strategy': 'breakout', 'bear_bb_std_mult': 2.143052681260646, 'bear_rsi_os': 51, 'bear_rsi_ob': 58, 'bear_adx_thresh': 23.36894681760393, 'bear_atr_min_pct': 0.027978468836281942, 'bear_atr_max_pct': 0.02427696148542529, 'bear_tp_mult': 1.0523394162115487, 'bear_tsl_mult': 0.18854051314281162, 'bear_time_stop': 195, 'bear_use_sma': False, 'bear_use_ema': False, 'bear_use_atr': True, 'bear_use_adx': True, 'bear_use_spike': False, 'bear_rsi_required': False, 'sideways_strategy': 'breakout', 'sideways_bb_std_mult': 1.8943911447465362, 'sideways_rsi_os': 50, 'sideways_rsi_ob': 75, 'sideways_adx_thresh': 21.606028584000114, 'sideways_atr_min_pct': 0.002877133541190874, 'sideways_atr_max_pct': 0.028631706145477394, 'sideways_tp_mult': 1.6788222421057823, 'sideways_tsl_mult': 0.30953153799560196, 'sideways_time_stop': 223, 'sideways_use_sma': True, 'sideways_use_ema': False, 'sideways_use_atr': True, 'sideways_use_adx': False, 'sideways_use_spike': False, 'sideways_rsi_required': True}.
[I 2025-09-01 03:22:49,567] Trial 365 finished with values: [-1000000000.0, 1000000000.0] and parameters: {'p_sma': 47, 'p_std': 8, 'p_atr': 29, 'p_adx': 12, 'rsi_period': 14, 'ema1': 25, 'ema2': 53, 'slip_atr_k': 0.1102620349649598, 'slip_spread_k': 0.1302158245859642, 'spread_hl_frac': 0.022196446868759795, 'bb_std_mult': 3.123455762026939, 'rsi_os': 19, 'rsi_ob': 73, 'vol_spike': 0.03614998098146338, 'adx_thresh': 19.956501604882547, 'atr_min_pct': 0.020658280781794436, 'atr_max_pct': 0.035104129444297354, 'tp_mult': 2.669812491401989, 'tsl_mult': 0.3969728926706616, 'strategy': 'breakout', 'time_stop': 164, 'use_sma': False, 'use_atr': False, 'use_adx': False, 'use_ema': True, 'use_spike': False, 'rsi_required': True, 'edge_k': 0.08519357231299171, 'edge_cap': 0.5947122022151882, 'bull_strategy': 'breakout', 'bull_bb_std_mult': 1.0475881350613439, 'bull_rsi_os': 15, 'bull_rsi_ob': 53, 'bull_adx_thresh': 22.712768058832896, 'bull_atr_min_pct': 0.007628487875129981, 'bull_atr_max_pct': 0.04042264350033006, 'bull_tp_mult': 1.5739245610798887, 'bull_tsl_mult': 0.21183702966633683, 'bull_time_stop': 176, 'bull_use_sma': False, 'bull_use_ema': False, 'bull_use_atr': True, 'bull_use_adx': False, 'bull_use_spike': True, 'bull_rsi_required': True, 'bear_strategy': 'breakout', 'bear_bb_std_mult': 2.3272106473787995, 'bear_rsi_os': 51, 'bear_rsi_ob': 57, 'bear_adx_thresh': 23.46018310686095, 'bear_atr_min_pct': 0.027992677337703387, 'bear_atr_max_pct': 0.025768133368212473, 'bear_tp_mult': 1.0432717008270849, 'bear_tsl_mult': 0.6520364660979466, 'bear_time_stop': 237, 'bear_use_sma': False, 'bear_use_ema': False, 'bear_use_atr': True, 'bear_use_adx': True, 'bear_use_spike': False, 'bear_rsi_required': False, 'sideways_strategy': 'mean_reversion', 'sideways_bb_std_mult': 2.3034625428250486, 'sideways_rsi_os': 47, 'sideways_rsi_ob': 75, 'sideways_adx_thresh': 21.272627656964772, 'sideways_atr_min_pct': 0.014961962729352902, 'sideways_atr_max_pct': 0.028303319535485455, 'sideways_tp_mult': 1.7703788858045844, 'sideways_tsl_mult': 0.21204665504454862, 'sideways_time_stop': 14, 'sideways_use_sma': False, 'sideways_use_ema': False, 'sideways_use_atr': True, 'sideways_use_adx': False, 'sideways_use_spike': False, 'sideways_rsi_required': True}.
[I 2025-09-01 03:22:50,046] Trial 366 finished with values: [-1000000000.0, 1000000000.0] and parameters: {'p_sma': 47, 'p_std': 58, 'p_atr': 29, 'p_adx': 12, 'rsi_period': 14, 'ema1': 25, 'ema2': 14, 'slip_atr_k': 0.010905727476895463, 'slip_spread_k': 0.13504916041507248, 'spread_hl_frac': 0.022069851656732458, 'bb_std_mult': 3.1474358672392504, 'rsi_os': 23, 'rsi_ob': 68, 'vol_spike': 0.22639478722716502, 'adx_thresh': 14.177921864211825, 'atr_min_pct': 0.01045511855567392, 'atr_max_pct': 0.11541349390673941, 'tp_mult': 2.641817138421495, 'tsl_mult': 0.22314564248342889, 'strategy': 'breakout', 'time_stop': 164, 'use_sma': False, 'use_atr': False, 'use_adx': False, 'use_ema': True, 'use_spike': False, 'rsi_required': True, 'edge_k': 0.07050415305200526, 'edge_cap': 0.31240553920130976, 'bull_strategy': 'breakout', 'bull_bb_std_mult': 1.0394157621614897, 'bull_rsi_os': 15, 'bull_rsi_ob': 85, 'bull_adx_thresh': 22.63341589408729, 'bull_atr_min_pct': 0.021561490719118864, 'bull_atr_max_pct': 0.11511990159170114, 'bull_tp_mult': 1.5727835759711035, 'bull_tsl_mult': 0.2344863845308267, 'bull_time_stop': 282, 'bull_use_sma': False, 'bull_use_ema': False, 'bull_use_atr': True, 'bull_use_adx': False, 'bull_use_spike': True, 'bull_rsi_required': True, 'bear_strategy': 'breakout', 'bear_bb_std_mult': 2.345568844523935, 'bear_rsi_os': 54, 'bear_rsi_ob': 57, 'bear_adx_thresh': 32.55487207575885, 'bear_atr_min_pct': 0.022442637970026567, 'bear_atr_max_pct': 0.02536801824017841, 'bear_tp_mult': 1.044287176666077, 'bear_tsl_mult': 0.18957013720140606, 'bear_time_stop': 71, 'bear_use_sma': False, 'bear_use_ema': False, 'bear_use_atr': True, 'bear_use_adx': True, 'bear_use_spike': False, 'bear_rsi_required': False, 'sideways_strategy': 'mean_reversion', 'sideways_bb_std_mult': 1.8647472414325537, 'sideways_rsi_os': 50, 'sideways_rsi_ob': 46, 'sideways_adx_thresh': 22.000466153934678, 'sideways_atr_min_pct': 0.02691318009325265, 'sideways_atr_max_pct': 0.0358986246011498, 'sideways_tp_mult': 2.2058684579845416, 'sideways_tsl_mult': 0.21227780292191264, 'sideways_time_stop': 137, 'sideways_use_sma': False, 'sideways_use_ema': False, 'sideways_use_atr': True, 'sideways_use_adx': False, 'sideways_use_spike': False, 'sideways_rsi_required': True}.
[I 2025-09-01 03:22:50,098] Trial 368 finished with values: [-0.10010462945365384, 0.0999244214172475] and parameters: {'p_sma': 47, 'p_std': 8, 'p_atr': 29, 'p_adx': 16, 'rsi_period': 14, 'ema1': 21, 'ema2': 48, 'slip_atr_k': 0.06944360521090973, 'slip_spread_k': 0.16812723407359348, 'spread_hl_frac': 0.018281929573325646, 'bb_std_mult': 0.6123456086794001, 'rsi_os': 23, 'rsi_ob': 76, 'vol_spike': 0.21414313213363934, 'adx_thresh': 7.9998026929591886, 'atr_min_pct': 0.028130894327005558, 'atr_max_pct': 0.059052608387997446, 'tp_mult': 2.4445292353473937, 'tsl_mult': 0.3955057704967482, 'strategy': 'breakout', 'time_stop': 222, 'use_sma': False, 'use_atr': True, 'use_adx': False, 'use_ema': True, 'use_spike': False, 'rsi_required': True, 'edge_k': 0.08714633446688744, 'edge_cap': 0.42253290118645837, 'bull_strategy': 'mean_reversion', 'bull_bb_std_mult': 3.444395891428669, 'bull_rsi_os': 54, 'bull_rsi_ob': 85, 'bull_adx_thresh': 23.956698699781235, 'bull_atr_min_pct': 0.0008736294297632217, 'bull_atr_max_pct': 0.11539208451655833, 'bull_tp_mult': 1.5519618106886919, 'bull_tsl_mult': 0.925315585747305, 'bull_time_stop': 177, 'bull_use_sma': True, 'bull_use_ema': False, 'bull_use_atr': True, 'bull_use_adx': False, 'bull_use_spike': False, 'bull_rsi_required': True, 'bear_strategy': 'breakout', 'bear_bb_std_mult': 2.339546466744109, 'bear_rsi_os': 30, 'bear_rsi_ob': 57, 'bear_adx_thresh': 21.10278242198326, 'bear_atr_min_pct': 0.022344048703801352, 'bear_atr_max_pct': 0.068774159038262, 'bear_tp_mult': 2.622771098611219, 'bear_tsl_mult': 0.7842675295876478, 'bear_time_stop': 169, 'bear_use_sma': False, 'bear_use_ema': True, 'bear_use_atr': True, 'bear_use_adx': True, 'bear_use_spike': False, 'bear_rsi_required': False, 'sideways_strategy': 'mean_reversion', 'sideways_bb_std_mult': 1.7340287659468907, 'sideways_rsi_os': 47, 'sideways_rsi_ob': 77, 'sideways_adx_thresh': 31.253615040266858, 'sideways_atr_min_pct': 0.0019610902237750544, 'sideways_atr_max_pct': 0.021067452392187245, 'sideways_tp_mult': 2.232218683193522, 'sideways_tsl_mult': 0.21307102120046106, 'sideways_time_stop': 138, 'sideways_use_sma': False, 'sideways_use_ema': False, 'sideways_use_atr': True, 'sideways_use_adx': False, 'sideways_use_spike': False, 'sideways_rsi_required': True}.
[I 2025-09-01 03:22:50,387] Trial 367 finished with values: [-1000000000.0, 1000000000.0] and parameters: {'p_sma': 21, 'p_std': 8, 'p_atr': 30, 'p_adx': 23, 'rsi_period': 14, 'ema1': 20, 'ema2': 54, 'slip_atr_k': 0.009915907283771773, 'slip_spread_k': 0.13125663320230066, 'spread_hl_frac': 0.04548283182636268, 'bb_std_mult': 2.3222342266490905, 'rsi_os': 18, 'rsi_ob': 73, 'vol_spike': 0.00865357580152773, 'adx_thresh': 14.078582512524475, 'atr_min_pct': 0.01052037535338251, 'atr_max_pct': 0.047900422312651424, 'tp_mult': 2.6485954164995076, 'tsl_mult': 0.39290531633311243, 'strategy': 'breakout', 'time_stop': 164, 'use_sma': False, 'use_atr': True, 'use_adx': False, 'use_ema': True, 'use_spike': False, 'rsi_required': True, 'edge_k': 0.07889898795198419, 'edge_cap': 0.42732810435661983, 'bull_strategy': 'breakout', 'bull_bb_std_mult': 1.9735836390803025, 'bull_rsi_os': 36, 'bull_rsi_ob': 48, 'bull_adx_thresh': 5.799419017610006, 'bull_atr_min_pct': 0.028612038654708905, 'bull_atr_max_pct': 0.11578499800353947, 'bull_tp_mult': 1.5802803828938514, 'bull_tsl_mult': 0.22122604639480295, 'bull_time_stop': 177, 'bull_use_sma': True, 'bull_use_ema': False, 'bull_use_atr': True, 'bull_use_adx': False, 'bull_use_spike': False, 'bull_rsi_required': True, 'bear_strategy': 'breakout', 'bear_bb_std_mult': 2.3457346159618417, 'bear_rsi_os': 12, 'bear_rsi_ob': 83, 'bear_adx_thresh': 23.3903775324641, 'bear_atr_min_pct': 0.027910284111036878, 'bear_atr_max_pct': 0.025205342731019972, 'bear_tp_mult': 1.04054535545986, 'bear_tsl_mult': 0.1298396661747297, 'bear_time_stop': 169, 'bear_use_sma': False, 'bear_use_ema': True, 'bear_use_atr': True, 'bear_use_adx': True, 'bear_use_spike': False, 'bear_rsi_required': False, 'sideways_strategy': 'mean_reversion', 'sideways_bb_std_mult': 2.283045920495141, 'sideways_rsi_os': 50, 'sideways_rsi_ob': 95, 'sideways_adx_thresh': 7.888725192629272, 'sideways_atr_min_pct': 0.0019820198738080778, 'sideways_atr_max_pct': 0.14037003027364214, 'sideways_tp_mult': 2.2243680442125857, 'sideways_tsl_mult': 0.21251369031557557, 'sideways_time_stop': 15, 'sideways_use_sma': False, 'sideways_use_ema': False, 'sideways_use_atr': True, 'sideways_use_adx': False, 'sideways_use_spike': False, 'sideways_rsi_required': True}.
