[I 2025-09-01 02:25:14,437] Trial 25 finished with values: [-0.04056052458131654, 0.040380105923798974] and parameters: {'p_sma': 29, 'p_std': 50, 'p_atr': 18, 'p_adx': 7, 'rsi_period': 71, 'ema1': 10, 'ema2': 32, 'slip_atr_k': 0.15410676479465393, 'slip_spread_k': 0.7911975375084789, 'spread_hl_frac': 0.03449072101062204, 'bb_std_mult': 3.1798989140997374, 'rsi_os': 6, 'rsi_ob': 56, 'vol_spike': 0.17191316725471112, 'adx_thresh': 9.743344396079465, 'atr_min_pct': 0.015586967399666134, 'atr_max_pct': 0.14849717966328851, 'tp_mult': 2.207962551119902, 'tsl_mult': 0.598701186173747, 'strategy': 'breakout', 'time_stop': 188, 'use_sma': False, 'use_atr': False, 'use_adx': True, 'use_ema': False, 'use_spike': False, 'rsi_required': True, 'edge_k': 1.142496737211301, 'edge_cap': 0.442150777599055, 'bull_strategy': 'breakout', 'bull_bb_std_mult': 3.4763684767093, 'bull_rsi_os': 21, 'bull_rsi_ob': 45, 'bull_adx_thresh': 11.422199577428213, 'bull_atr_min_pct': 0.0001025661307278852, 'bull_atr_max_pct': 0.09319139445371473, 'bull_tp_mult': 1.9688016324977569, 'bull_tsl_mult': 0.6509568690272209, 'bull_time_stop': 169, 'bull_use_sma': False, 'bull_use_ema': True, 'bull_use_atr': True, 'bull_use_adx': False, 'bull_use_spike': True, 'bull_rsi_required': True, 'bear_strategy': 'breakout', 'bear_bb_std_mult': 2.4134099729582656, 'bear_rsi_os': 45, 'bear_rsi_ob': 84, 'bear_adx_thresh': 34.49133369737028, 'bear_atr_min_pct': 0.005964835291429838, 'bear_atr_max_pct': 0.07606239920555953, 'bear_tp_mult': 1.305155667432439, 'bear_tsl_mult': 0.13585760036521116, 'bear_time_stop': 71, 'bear_use_sma': True, 'bear_use_ema': False, 'bear_use_atr': True, 'bear_use_adx': False, 'bear_use_spike': False, 'bear_rsi_required': True, 'sideways_strategy': 'breakout', 'sideways_bb_std_mult': 1.003811526911914, 'sideways_rsi_os': 39, 'sideways_rsi_ob': 87, 'sideways_adx_thresh': 5.236801856060232, 'sideways_atr_min_pct': 0.028610195457967728, 'sideways_atr_max_pct': 0.03772926171347371, 'sideways_tp_mult': 1.7038202709907786, 'sideways_tsl_mult': 0.38820328254723446, 'sideways_time_stop': 98, 'sideways_use_sma': False, 'sideways_use_ema': False, 'sideways_use_atr': False, 'sideways_use_adx': False, 'sideways_use_spike': False, 'sideways_rsi_required': True}.
[I 2025-09-01 02:25:57,615] Trial 28 finished with values: [-1000000000.0, 1000000000.0] and parameters: {'p_sma': 29, 'p_std': 60, 'p_atr': 23, 'p_adx': 9, 'rsi_period': 52, 'ema1': 5, 'ema2': 30, 'slip_atr_k': 0.1784954756555906, 'slip_spread_k': 0.6583542870283589, 'spread_hl_frac': 0.021789390252922498, 'bb_std_mult': 0.5228845412789591, 'rsi_os': 13, 'rsi_ob': 57, 'vol_spike': 0.12070996557089801, 'adx_thresh': 34.21085273789303, 'atr_min_pct': 0.02390408961356462, 'atr_max_pct': 0.1484771154174742, 'tp_mult': 1.896516131324836, 'tsl_mult': 0.22505314901761048, 'strategy': 'breakout', 'time_stop': 90, 'use_sma': False, 'use_atr': False, 'use_adx': True, 'use_ema': False, 'use_spike': True, 'rsi_required': False, 'edge_k': 1.6674792336089963, 'edge_cap': 0.39702161883555254, 'bull_strategy': 'breakout', 'bull_bb_std_mult': 3.4972571680395266, 'bull_rsi_os': 30, 'bull_rsi_ob': 82, 'bull_adx_thresh': 5.388882497509532, 'bull_atr_min_pct': 0.004037132763848494, 'bull_atr_max_pct': 0.04153328156208167, 'bull_tp_mult': 2.949752635516245, 'bull_tsl_mult': 0.543940377455859, 'bull_time_stop': 190, 'bull_use_sma': False, 'bull_use_ema': True, 'bull_use_atr': False, 'bull_use_adx': False, 'bull_use_spike': True, 'bull_rsi_required': True, 'bear_strategy': 'breakout', 'bear_bb_std_mult': 1.33516011530646, 'bear_rsi_os': 33, 'bear_rsi_ob': 72, 'bear_adx_thresh': 29.263036700657516, 'bear_atr_min_pct': 0.012430924744767423, 'bear_atr_max_pct': 0.045033581478845314, 'bear_tp_mult': 1.7765299517656856, 'bear_tsl_mult': 0.6490697692412336, 'bear_time_stop': 18, 'bear_use_sma': False, 'bear_use_ema': False, 'bear_use_atr': True, 'bear_use_adx': False, 'bear_use_spike': True, 'bear_rsi_required': True, 'sideways_strategy': 'breakout', 'sideways_bb_std_mult': 0.8546244738482278, 'sideways_rsi_os': 39, 'sideways_rsi_ob': 78, 'sideways_adx_thresh': 11.022985323060096, 'sideways_atr_min_pct': 0.029985601673621062, 'sideways_atr_max_pct': 0.03540915895726743, 'sideways_tp_mult': 2.1786572938265065, 'sideways_tsl_mult': 0.3986534009057988, 'sideways_time_stop': 14, 'sideways_use_sma': False, 'sideways_use_ema': False, 'sideways_use_atr': False, 'sideways_use_adx': False, 'sideways_use_spike': True, 'sideways_rsi_required': False}.
[I 2025-09-01 02:25:59,726] Trial 30 finished with values: [-1000000000.0, 1000000000.0] and parameters: {'p_sma': 41, 'p_std': 59, 'p_atr': 24, 'p_adx': 10, 'rsi_period': 31, 'ema1': 15, 'ema2': 40, 'slip_atr_k': 0.11248041637921788, 'slip_spread_k': 0.5837881523612944, 'spread_hl_frac': 0.030275641140751597, 'bb_std_mult': 1.787104580714605, 'rsi_os': 29, 'rsi_ob': 50, 'vol_spike': 0.12814107903567767, 'adx_thresh': 16.636599468015675, 'atr_min_pct': 0.006098247064991907, 'atr_max_pct': 0.13427121600292696, 'tp_mult': 1.9104049541340686, 'tsl_mult': 0.15203072654533956, 'strategy': 'breakout', 'time_stop': 257, 'use_sma': False, 'use_atr': True, 'use_adx': False, 'use_ema': False, 'use_spike': True, 'rsi_required': False, 'edge_k': 1.7623016893316055, 'edge_cap': 0.6531732456038055, 'bull_strategy': 'breakout', 'bull_bb_std_mult': 3.5647182977429512, 'bull_rsi_os': 29, 'bull_rsi_ob': 78, 'bull_adx_thresh': 14.130962603984866, 'bull_atr_min_pct': 0.004639098568247606, 'bull_atr_max_pct': 0.1300118734094201, 'bull_tp_mult': 2.514830195922051, 'bull_tsl_mult': 0.8627895136367012, 'bull_time_stop': 202, 'bull_use_sma': False, 'bull_use_ema': True, 'bull_use_atr': False, 'bull_use_adx': False, 'bull_use_spike': False, 'bull_rsi_required': True, 'bear_strategy': 'mean_reversion', 'bear_bb_std_mult': 1.2445455992720365, 'bear_rsi_os': 31, 'bear_rsi_ob': 73, 'bear_adx_thresh': 22.78445135931493, 'bear_atr_min_pct': 0.01834673230885103, 'bear_atr_max_pct': 0.045049304311724776, 'bear_tp_mult': 1.7542927854847932, 'bear_tsl_mult': 0.647929253327512, 'bear_time_stop': 41, 'bear_use_sma': False, 'bear_use_ema': False, 'bear_use_atr': False, 'bear_use_adx': True, 'bear_use_spike': True, 'bear_rsi_required': False, 'sideways_strategy': 'breakout', 'sideways_bb_std_mult': 1.6667794373409308, 'sideways_rsi_os': 30, 'sideways_rsi_ob': 77, 'sideways_adx_thresh': 11.70250019660408, 'sideways_atr_min_pct': 0.023827767209256393, 'sideways_atr_max_pct': 0.042025630344603535, 'sideways_tp_mult': 1.2748074970256589, 'sideways_tsl_mult': 0.3414726986014996, 'sideways_time_stop': 12, 'sideways_use_sma': False, 'sideways_use_ema': True, 'sideways_use_atr': True, 'sideways_use_adx': False, 'sideways_use_spike': True, 'sideways_rsi_required': False}.
[I 2025-09-01 02:25:59,734] Trial 29 finished with values: [-1000000000.0, 1000000000.0] and parameters: {'p_sma': 24, 'p_std': 37, 'p_atr': 25, 'p_adx': 10, 'rsi_period': 28, 'ema1': 9, 'ema2': 40, 'slip_atr_k': 0.18367080567042154, 'slip_spread_k': 0.6590989501136783, 'spread_hl_frac': 0.02234568066010659, 'bb_std_mult': 2.9870359506510447, 'rsi_os': 25, 'rsi_ob': 51, 'vol_spike': 0.11478434471118594, 'adx_thresh': 16.143477954742707, 'atr_min_pct': 0.006066092986606077, 'atr_max_pct': 0.11112703436620375, 'tp_mult': 1.894242272267108, 'tsl_mult': 0.18684659764100842, 'strategy': 'breakout', 'time_stop': 253, 'use_sma': False, 'use_atr': True, 'use_adx': False, 'use_ema': False, 'use_spike': True, 'rsi_required': False, 'edge_k': 1.628785276259272, 'edge_cap': 0.6193710548645223, 'bull_strategy': 'breakout', 'bull_bb_std_mult': 3.597726833409965, 'bull_rsi_os': 31, 'bull_rsi_ob': 83, 'bull_adx_thresh': 13.614643104783074, 'bull_atr_min_pct': 0.0037436885921918604, 'bull_atr_max_pct': 0.12773332748185853, 'bull_tp_mult': 2.990375430947847, 'bull_tsl_mult': 0.8118594743132986, 'bull_time_stop': 184, 'bull_use_sma': False, 'bull_use_ema': True, 'bull_use_atr': False, 'bull_use_adx': False, 'bull_use_spike': False, 'bull_rsi_required': True, 'bear_strategy': 'mean_reversion', 'bear_bb_std_mult': 2.6775210486193615, 'bear_rsi_os': 49, 'bear_rsi_ob': 71, 'bear_adx_thresh': 28.63697124638755, 'bear_atr_min_pct': 0.017943357087394085, 'bear_atr_max_pct': 0.043133439627262, 'bear_tp_mult': 1.7767660560801068, 'bear_tsl_mult': 0.14003021274800842, 'bear_time_stop': 47, 'bear_use_sma': False, 'bear_use_ema': False, 'bear_use_atr': False, 'bear_use_adx': True, 'bear_use_spike': True, 'bear_rsi_required': False, 'sideways_strategy': 'breakout', 'sideways_bb_std_mult': 1.4832986398670662, 'sideways_rsi_os': 40, 'sideways_rsi_ob': 78, 'sideways_adx_thresh': 5.559926580741092, 'sideways_atr_min_pct': 0.024544387919737436, 'sideways_atr_max_pct': 0.044350932741076064, 'sideways_tp_mult': 2.1346580731636755, 'sideways_tsl_mult': 0.3682609879964166, 'sideways_time_stop': 14, 'sideways_use_sma': False, 'sideways_use_ema': True, 'sideways_use_atr': True, 'sideways_use_adx': False, 'sideways_use_spike': True, 'sideways_rsi_required': False}.
[I 2025-09-01 02:26:00,060] Trial 31 finished with values: [-1000000000.0, 1000000000.0] and parameters: {'p_sma': 14, 'p_std': 60, 'p_atr': 24, 'p_adx': 10, 'rsi_period': 54, 'ema1': 8, 'ema2': 40, 'slip_atr_k': 0.11913905271089675, 'slip_spread_k': 0.6396639137667267, 'spread_hl_frac': 0.03153206939587938, 'bb_std_mult': 1.885317245720624, 'rsi_os': 27, 'rsi_ob': 51, 'vol_spike': 0.12662556091560992, 'adx_thresh': 16.85874745064578, 'atr_min_pct': 0.004406520685982502, 'atr_max_pct': 0.13189313484469964, 'tp_mult': 2.444052130502533, 'tsl_mult': 0.24354180225529443, 'strategy': 'breakout', 'time_stop': 86, 'use_sma': False, 'use_atr': True, 'use_adx': False, 'use_ema': False, 'use_spike': True, 'rsi_required': False, 'edge_k': 0.8999315106302309, 'edge_cap': 0.6588841569102346, 'bull_strategy': 'breakout', 'bull_bb_std_mult': 3.5495686710450736, 'bull_rsi_os': 32, 'bull_rsi_ob': 83, 'bull_adx_thresh': 14.084421967969757, 'bull_atr_min_pct': 0.004796499619006426, 'bull_atr_max_pct': 0.13315943244969217, 'bull_tp_mult': 2.9580642126494787, 'bull_tsl_mult': 0.8680169932154764, 'bull_time_stop': 195, 'bull_use_sma': False, 'bull_use_ema': True, 'bull_use_atr': False, 'bull_use_adx': False, 'bull_use_spike': False, 'bull_rsi_required': True, 'bear_strategy': 'mean_reversion', 'bear_bb_std_mult': 1.4058471909659276, 'bear_rsi_os': 33, 'bear_rsi_ob': 72, 'bear_adx_thresh': 28.03126214468766, 'bear_atr_min_pct': 0.013371324355462412, 'bear_atr_max_pct': 0.04232356083150864, 'bear_tp_mult': 1.8064339984982913, 'bear_tsl_mult': 0.6498493952842284, 'bear_time_stop': 38, 'bear_use_sma': False, 'bear_use_ema': False, 'bear_use_atr': False, 'bear_use_adx': True, 'bear_use_spike': True, 'bear_rsi_required': False, 'sideways_strategy': 'breakout', 'sideways_bb_std_mult': 1.7012135280046319, 'sideways_rsi_os': 30, 'sideways_rsi_ob': 78, 'sideways_adx_thresh': 10.891631885562601, 'sideways_atr_min_pct': 0.023880599209933403, 'sideways_atr_max_pct': 0.041823956830453944, 'sideways_tp_mult': 1.2623260609888336, 'sideways_tsl_mult': 0.3509767359856667, 'sideways_time_stop': 5, 'sideways_use_sma': False, 'sideways_use_ema': True, 'sideways_use_atr': True, 'sideways_use_adx': False, 'sideways_use_spike': True, 'sideways_rsi_required': False}.
[I 2025-09-01 02:26:44,989] Trial 34 finished with values: [-1000000000.0, 1000000000.0] and parameters: {'p_sma': 14, 'p_std': 47, 'p_atr': 20, 'p_adx': 12, 'rsi_period': 76, 'ema1': 9, 'ema2': 27, 'slip_atr_k': 0.12876207944097406, 'slip_spread_k': 0.8733555793193114, 'spread_hl_frac': 0.04804105096608725, 'bb_std_mult': 3.3246431809691646, 'rsi_os': 10, 'rsi_ob': 62, 'vol_spike': 0.22729529926943304, 'adx_thresh': 18.929908019294032, 'atr_min_pct': 0.02588555118633335, 'atr_max_pct': 0.1209129423934791, 'tp_mult': 2.5275427373325385, 'tsl_mult': 0.5214199964897741, 'strategy': 'breakout', 'time_stop': 216, 'use_sma': True, 'use_atr': False, 'use_adx': True, 'use_ema': False, 'use_spike': False, 'rsi_required': True, 'edge_k': 0.8728629673151758, 'edge_cap': 0.5389260536346436, 'bull_strategy': 'breakout', 'bull_bb_std_mult': 3.1512872168440147, 'bull_rsi_os': 16, 'bull_rsi_ob': 75, 'bull_adx_thresh': 8.193026817150855, 'bull_atr_min_pct': 0.0024950732386891427, 'bull_atr_max_pct': 0.09879540828065701, 'bull_tp_mult': 2.1382421308441217, 'bull_tsl_mult': 0.6043845199383513, 'bull_time_stop': 156, 'bull_use_sma': False, 'bull_use_ema': False, 'bull_use_atr': True, 'bull_use_adx': False, 'bull_use_spike': True, 'bull_rsi_required': True, 'bear_strategy': 'breakout', 'bear_bb_std_mult': 2.1631041929251538, 'bear_rsi_os': 42, 'bear_rsi_ob': 91, 'bear_adx_thresh': 32.79043953824865, 'bear_atr_min_pct': 0.00694477441661758, 'bear_atr_max_pct': 0.014837562082339287, 'bear_tp_mult': 2.679942866644609, 'bear_tsl_mult': 0.3936724974915886, 'bear_time_stop': 122, 'bear_use_sma': True, 'bear_use_ema': False, 'bear_use_atr': True, 'bear_use_adx': False, 'bear_use_spike': False, 'bear_rsi_required': True, 'sideways_strategy': 'breakout', 'sideways_bb_std_mult': 1.3738271677697576, 'sideways_rsi_os': 49, 'sideways_rsi_ob': 59, 'sideways_adx_thresh': 22.8529356249781, 'sideways_atr_min_pct': 0.027926507144438957, 'sideways_atr_max_pct': 0.021266047932632683, 'sideways_tp_mult': 2.016123050891535, 'sideways_tsl_mult': 0.5240694083326938, 'sideways_time_stop': 128, 'sideways_use_sma': False, 'sideways_use_ema': False, 'sideways_use_atr': False, 'sideways_use_adx': True, 'sideways_use_spike': False, 'sideways_rsi_required': True}.
[I 2025-09-01 02:26:45,439] Trial 35 finished with values: [-1000000000.0, 1000000000.0] and parameters: {'p_sma': 26, 'p_std': 47, 'p_atr': 19, 'p_adx': 12, 'rsi_period': 78, 'ema1': 26, 'ema2': 35, 'slip_atr_k': 0.2069002792306735, 'slip_spread_k': 0.8380736645242032, 'spread_hl_frac': 0.04664955452138197, 'bb_std_mult': 3.432093423039129, 'rsi_os': 11, 'rsi_ob': 74, 'vol_spike': 0.22594938160030226, 'adx_thresh': 20.93596700402375, 'atr_min_pct': 0.029847762409385265, 'atr_max_pct': 0.12124258025227128, 'tp_mult': 2.6696594017387056, 'tsl_mult': 0.5209662591319565, 'strategy': 'mean_reversion', 'time_stop': 214, 'use_sma': True, 'use_atr': False, 'use_adx': True, 'use_ema': False, 'use_spike': False, 'rsi_required': True, 'edge_k': 0.7036644461064689, 'edge_cap': 0.5230957665045086, 'bull_strategy': 'breakout', 'bull_bb_std_mult': 3.1897070577454825, 'bull_rsi_os': 17, 'bull_rsi_ob': 76, 'bull_adx_thresh': 8.860464975431178, 'bull_atr_min_pct': 0.0023583036972090357, 'bull_atr_max_pct': 0.10239369636949808, 'bull_tp_mult': 2.0977872646663425, 'bull_tsl_mult': 0.7458968159017301, 'bull_time_stop': 150, 'bull_use_sma': False, 'bull_use_ema': False, 'bull_use_atr': True, 'bull_use_adx': False, 'bull_use_spike': True, 'bull_rsi_required': False, 'bear_strategy': 'breakout', 'bear_bb_std_mult': 2.1658214087223566, 'bear_rsi_os': 41, 'bear_rsi_ob': 81, 'bear_adx_thresh': 31.802583616952557, 'bear_atr_min_pct': 0.007485674043917974, 'bear_atr_max_pct': 0.08371952921490304, 'bear_tp_mult': 2.551224390735148, 'bear_tsl_mult': 0.4104745662393554, 'bear_time_stop': 110, 'bear_use_sma': True, 'bear_use_ema': True, 'bear_use_atr': True, 'bear_use_adx': False, 'bear_use_spike': False, 'bear_rsi_required': True, 'sideways_strategy': 'breakout', 'sideways_bb_std_mult': 1.333778964770858, 'sideways_rsi_os': 50, 'sideways_rsi_ob': 66, 'sideways_adx_thresh': 22.70812072714728, 'sideways_atr_min_pct': 0.027734270354384166, 'sideways_atr_max_pct': 0.013387883769185246, 'sideways_tp_mult': 1.9571047467337175, 'sideways_tsl_mult': 0.5263059050153911, 'sideways_time_stop': 129, 'sideways_use_sma': True, 'sideways_use_ema': False, 'sideways_use_atr': False, 'sideways_use_adx': True, 'sideways_use_spike': False, 'sideways_rsi_required': True}.
[I 2025-09-01 02:26:46,158] Trial 33 finished with values: [-1000000000.0, 1000000000.0] and parameters: {'p_sma': 17, 'p_std': 47, 'p_atr': 20, 'p_adx': 12, 'rsi_period': 77, 'ema1': 14, 'ema2': 42, 'slip_atr_k': 0.1315547546886044, 'slip_spread_k': 0.8394235780386978, 'spread_hl_frac': 0.04576672026537275, 'bb_std_mult': 3.3760574087746806, 'rsi_os': 29, 'rsi_ob': 75, 'vol_spike': 0.22117802880594528, 'adx_thresh': 20.598649638582867, 'atr_min_pct': 0.008909196851910463, 'atr_max_pct': 0.13786983112524087, 'tp_mult': 2.4264815527297614, 'tsl_mult': 0.5177724360976085, 'strategy': 'breakout', 'time_stop': 210, 'use_sma': True, 'use_atr': False, 'use_adx': True, 'use_ema': False, 'use_spike': False, 'rsi_required': True, 'edge_k': 0.9035425305815389, 'edge_cap': 0.5338200124336243, 'bull_strategy': 'breakout', 'bull_bb_std_mult': 3.083787530161165, 'bull_rsi_os': 16, 'bull_rsi_ob': 94, 'bull_adx_thresh': 8.766087377709322, 'bull_atr_min_pct': 0.002355051901707576, 'bull_atr_max_pct': 0.10147586185151056, 'bull_tp_mult': 2.1404382766398706, 'bull_tsl_mult': 0.4851978567006807, 'bull_time_stop': 153, 'bull_use_sma': False, 'bull_use_ema': False, 'bull_use_atr': True, 'bull_use_adx': False, 'bull_use_spike': True, 'bull_rsi_required': True, 'bear_strategy': 'breakout', 'bear_bb_std_mult': 0.5624756982903505, 'bear_rsi_os': 42, 'bear_rsi_ob': 81, 'bear_adx_thresh': 33.08857888008223, 'bear_atr_min_pct': 0.008324796742228836, 'bear_atr_max_pct': 0.011763371388545371, 'bear_tp_mult': 2.9679022600452174, 'bear_tsl_mult': 0.42098609759248484, 'bear_time_stop': 112, 'bear_use_sma': True, 'bear_use_ema': False, 'bear_use_atr': True, 'bear_use_adx': False, 'bear_use_spike': False, 'bear_rsi_required': True, 'sideways_strategy': 'breakout', 'sideways_bb_std_mult': 1.2389936685452845, 'sideways_rsi_os': 48, 'sideways_rsi_ob': 58, 'sideways_adx_thresh': 16.755701898007043, 'sideways_atr_min_pct': 0.02752342327829998, 'sideways_atr_max_pct': 0.023263474678666095, 'sideways_tp_mult': 1.973985865421482, 'sideways_tsl_mult': 0.5392543888501065, 'sideways_time_stop': 127, 'sideways_use_sma': False, 'sideways_use_ema': False, 'sideways_use_atr': False, 'sideways_use_adx': True, 'sideways_use_spike': False, 'sideways_rsi_required': True}.
[I 2025-09-01 02:26:46,997] Trial 32 finished with values: [-1000000000.0, 1000000000.0] and parameters: {'p_sma': 41, 'p_std': 56, 'p_atr': 25, 'p_adx': 11, 'rsi_period': 31, 'ema1': 9, 'ema2': 40, 'slip_atr_k': 0.11149253275899615, 'slip_spread_k': 0.5797975482108926, 'spread_hl_frac': 0.04605879711184097, 'bb_std_mult': 1.6833469824471003, 'rsi_os': 27, 'rsi_ob': 49, 'vol_spike': 0.22914719249073542, 'adx_thresh': 16.064276457338224, 'atr_min_pct': 0.029952647754834447, 'atr_max_pct': 0.1281206702957352, 'tp_mult': 2.6243259068469866, 'tsl_mult': 0.6879165086631492, 'strategy': 'breakout', 'time_stop': 244, 'use_sma': True, 'use_atr': True, 'use_adx': False, 'use_ema': False, 'use_spike': False, 'rsi_required': True, 'edge_k': 0.9231042066562589, 'edge_cap': 0.5571608538692348, 'bull_strategy': 'breakout', 'bull_bb_std_mult': 3.5750477778237144, 'bull_rsi_os': 33, 'bull_rsi_ob': 95, 'bull_adx_thresh': 13.890395827350805, 'bull_atr_min_pct': 0.003360021031970385, 'bull_atr_max_pct': 0.13485540272561666, 'bull_tp_mult': 2.415350784486946, 'bull_tsl_mult': 0.838648494362631, 'bull_time_stop': 7, 'bull_use_sma': False, 'bull_use_ema': False, 'bull_use_atr': True, 'bull_use_adx': False, 'bull_use_spike': False, 'bull_rsi_required': True, 'bear_strategy': 'mean_reversion', 'bear_bb_std_mult': 0.5684095725609779, 'bear_rsi_os': 50, 'bear_rsi_ob': 73, 'bear_adx_thresh': 33.00438456665117, 'bear_atr_min_pct': 0.017634361316777473, 'bear_atr_max_pct': 0.043903445933734575, 'bear_tp_mult': 2.769318257865844, 'bear_tsl_mult': 0.7010672304953728, 'bear_time_stop': 46, 'bear_use_sma': True, 'bear_use_ema': False, 'bear_use_atr': False, 'bear_use_adx': True, 'bear_use_spike': False, 'bear_rsi_required': False, 'sideways_strategy': 'breakout', 'sideways_bb_std_mult': 1.774578499583114, 'sideways_rsi_os': 30, 'sideways_rsi_ob': 79, 'sideways_adx_thresh': 15.995910178478642, 'sideways_atr_min_pct': 0.02487377242682484, 'sideways_atr_max_pct': 0.02116777626768606, 'sideways_tp_mult': 1.2669448086462036, 'sideways_tsl_mult': 0.5525923661152963, 'sideways_time_stop': 35, 'sideways_use_sma': False, 'sideways_use_ema': True, 'sideways_use_atr': True, 'sideways_use_adx': True, 'sideways_use_spike': False, 'sideways_rsi_required': False}.
