[I 2025-09-01 03:24:54,470] Trial 380 finished with values: [-1000000000.0, 1000000000.0] and parameters: {'p_sma': 38, 'p_std': 16, 'p_atr': 14, 'p_adx': 17, 'rsi_period': 75, 'ema1': 19, 'ema2': 59, 'slip_atr_k': 0.02768391447140341, 'slip_spread_k': 0.0873044315172173, 'spread_hl_frac': 0.02053785423361185, 'bb_std_mult': 3.455447214127407, 'rsi_os': 43, 'rsi_ob': 94, 'vol_spike': 0.21993599169554964, 'adx_thresh': 31.876308320248803, 'atr_min_pct': 0.024962754322191357, 'atr_max_pct': 0.05367577610982233, 'tp_mult': 1.165623978030169, 'tsl_mult': 0.7904142673985798, 'strategy': 'breakout', 'time_stop': 112, 'use_sma': False, 'use_atr': False, 'use_adx': True, 'use_ema': False, 'use_spike': True, 'rsi_required': False, 'edge_k': 1.0401879161014063, 'edge_cap': 0.1561473186408645, 'bull_strategy': 'breakout', 'bull_bb_std_mult': 0.9552914864057698, 'bull_rsi_os': 52, 'bull_rsi_ob': 89, 'bull_adx_thresh': 26.79577714018998, 'bull_atr_min_pct': 0.01965290266719357, 'bull_atr_max_pct': 0.06284282275613134, 'bull_tp_mult': 1.6613470034331144, 'bull_tsl_mult': 0.20302245213452638, 'bull_time_stop': 157, 'bull_use_sma': False, 'bull_use_ema': True, 'bull_use_atr': False, 'bull_use_adx': False, 'bull_use_spike': True, 'bull_rsi_required': True, 'bear_strategy': 'mean_reversion', 'bear_bb_std_mult': 2.410841653481407, 'bear_rsi_os': 33, 'bear_rsi_ob': 58, 'bear_adx_thresh': 7.740901877553474, 'bear_atr_min_pct': 0.023463539426626184, 'bear_atr_max_pct': 0.03941192579667025, 'bear_tp_mult': 1.1332610785341626, 'bear_tsl_mult': 0.15458316421651008, 'bear_time_stop': 261, 'bear_use_sma': False, 'bear_use_ema': False, 'bear_use_atr': False, 'bear_use_adx': False, 'bear_use_spike': True, 'bear_rsi_required': True, 'sideways_strategy': 'mean_reversion', 'sideways_bb_std_mult': 1.8250887459992855, 'sideways_rsi_os': 42, 'sideways_rsi_ob': 52, 'sideways_adx_thresh': 33.764556536243305, 'sideways_atr_min_pct': 0.027793307428317923, 'sideways_atr_max_pct': 0.019353413466785034, 'sideways_tp_mult': 1.8078539442449488, 'sideways_tsl_mult': 0.9508933801801072, 'sideways_time_stop': 174, 'sideways_use_sma': False, 'sideways_use_ema': True, 'sideways_use_atr': True, 'sideways_use_adx': True, 'sideways_use_spike': True, 'sideways_rsi_required': True}.
[I 2025-09-01 03:24:55,125] Trial 379 finished with values: [-1000000000.0, 1000000000.0] and parameters: {'p_sma': 9, 'p_std': 16, 'p_atr': 27, 'p_adx': 17, 'rsi_period': 17, 'ema1': 19, 'ema2': 51, 'slip_atr_k': 0.16006684961051448, 'slip_spread_k': 0.03856949783439939, 'spread_hl_frac': 0.047212551629883595, 'bb_std_mult': 1.663410797387237, 'rsi_os': 35, 'rsi_ob': 94, 'vol_spike': 0.22104464350526734, 'adx_thresh': 29.608587385129063, 'atr_min_pct': 0.004814095469998666, 'atr_max_pct': 0.05471596053083455, 'tp_mult': 2.6880202039764103, 'tsl_mult': 0.4296788117821305, 'strategy': 'breakout', 'time_stop': 128, 'use_sma': False, 'use_atr': False, 'use_adx': True, 'use_ema': False, 'use_spike': True, 'rsi_required': False, 'edge_k': 1.0673037182711382, 'edge_cap': 0.11822077889644073, 'bull_strategy': 'breakout', 'bull_bb_std_mult': 1.0393981546080304, 'bull_rsi_os': 21, 'bull_rsi_ob': 89, 'bull_adx_thresh': 26.9650535141775, 'bull_atr_min_pct': 0.02581403260334943, 'bull_atr_max_pct': 0.11783268831523667, 'bull_tp_mult': 1.6706929092673142, 'bull_tsl_mult': 0.22667093222878776, 'bull_time_stop': 154, 'bull_use_sma': False, 'bull_use_ema': True, 'bull_use_atr': False, 'bull_use_adx': False, 'bull_use_spike': True, 'bull_rsi_required': True, 'bear_strategy': 'mean_reversion', 'bear_bb_std_mult': 2.4305114971530175, 'bear_rsi_os': 51, 'bear_rsi_ob': 79, 'bear_adx_thresh': 22.505010911954606, 'bear_atr_min_pct': 0.027423212388718067, 'bear_atr_max_pct': 0.0405708033744265, 'bear_tp_mult': 1.132709580225816, 'bear_tsl_mult': 0.4535498569443132, 'bear_time_stop': 63, 'bear_use_sma': False, 'bear_use_ema': False, 'bear_use_atr': False, 'bear_use_adx': False, 'bear_use_spike': True, 'bear_rsi_required': True, 'sideways_strategy': 'mean_reversion', 'sideways_bb_std_mult': 1.8215267266566122, 'sideways_rsi_os': 42, 'sideways_rsi_ob': 92, 'sideways_adx_thresh': 15.953538463158347, 'sideways_atr_min_pct': 0.0277168082958712, 'sideways_atr_max_pct': 0.019725779031205617, 'sideways_tp_mult': 1.7509021695559235, 'sideways_tsl_mult': 0.9724579826914588, 'sideways_time_stop': 134, 'sideways_use_sma': False, 'sideways_use_ema': True, 'sideways_use_atr': True, 'sideways_use_adx': True, 'sideways_use_spike': True, 'sideways_rsi_required': True}.
[I 2025-09-01 03:24:55,399] Trial 378 finished with values: [-1000000000.0, 1000000000.0] and parameters: {'p_sma': 45, 'p_std': 19, 'p_atr': 14, 'p_adx': 30, 'rsi_period': 75, 'ema1': 19, 'ema2': 58, 'slip_atr_k': 0.15476911111634817, 'slip_spread_k': 0.14932549131459122, 'spread_hl_frac': 0.020492970288405833, 'bb_std_mult': 1.524205488265595, 'rsi_os': 25, 'rsi_ob': 94, 'vol_spike': 0.22004220372489033, 'adx_thresh': 32.01186439300386, 'atr_min_pct': 0.008047471515994381, 'atr_max_pct': 0.05408920363305305, 'tp_mult': 1.7537428768192342, 'tsl_mult': 0.33022303953785137, 'strategy': 'breakout', 'time_stop': 45, 'use_sma': False, 'use_atr': False, 'use_adx': True, 'use_ema': False, 'use_spike': True, 'rsi_required': False, 'edge_k': 1.0319680342367297, 'edge_cap': 0.45939497025325743, 'bull_strategy': 'breakout', 'bull_bb_std_mult': 0.9633250726574439, 'bull_rsi_os': 52, 'bull_rsi_ob': 49, 'bull_adx_thresh': 11.103361917902955, 'bull_atr_min_pct': 0.023836478248702345, 'bull_atr_max_pct': 0.08992706527972012, 'bull_tp_mult': 1.1227498459392087, 'bull_tsl_mult': 0.205919679497927, 'bull_time_stop': 153, 'bull_use_sma': False, 'bull_use_ema': True, 'bull_use_atr': False, 'bull_use_adx': False, 'bull_use_spike': True, 'bull_rsi_required': True, 'bear_strategy': 'mean_reversion', 'bear_bb_std_mult': 2.08749464624622, 'bear_rsi_os': 51, 'bear_rsi_ob': 68, 'bear_adx_thresh': 22.976392438053878, 'bear_atr_min_pct': 0.027558816165997594, 'bear_atr_max_pct': 0.11582725512500905, 'bear_tp_mult': 2.5462838358874267, 'bear_tsl_mult': 0.15175005171040765, 'bear_time_stop': 63, 'bear_use_sma': False, 'bear_use_ema': False, 'bear_use_atr': False, 'bear_use_adx': False, 'bear_use_spike': True, 'bear_rsi_required': True, 'sideways_strategy': 'mean_reversion', 'sideways_bb_std_mult': 1.8210208132727048, 'sideways_rsi_os': 41, 'sideways_rsi_ob': 77, 'sideways_adx_thresh': 18.162886075298857, 'sideways_atr_min_pct': 0.027924108378944427, 'sideways_atr_max_pct': 0.14656453612510267, 'sideways_tp_mult': 1.8032101421834117, 'sideways_tsl_mult': 0.7555107171159116, 'sideways_time_stop': 132, 'sideways_use_sma': False, 'sideways_use_ema': True, 'sideways_use_atr': True, 'sideways_use_adx': True, 'sideways_use_spike': True, 'sideways_rsi_required': True}.
[I 2025-09-01 03:24:55,541] Trial 381 finished with values: [-1000000000.0, 1000000000.0] and parameters: {'p_sma': 9, 'p_std': 59, 'p_atr': 27, 'p_adx': 19, 'rsi_period': 17, 'ema1': 23, 'ema2': 59, 'slip_atr_k': 0.22278540673345676, 'slip_spread_k': 0.027694905312087514, 'spread_hl_frac': 0.020248732229737797, 'bb_std_mult': 1.5516787782904338, 'rsi_os': 25, 'rsi_ob': 82, 'vol_spike': 0.052459331827511974, 'adx_thresh': 12.552076625510587, 'atr_min_pct': 0.008115055791102669, 'atr_max_pct': 0.054961642333516754, 'tp_mult': 2.693414936407784, 'tsl_mult': 0.33978273041136525, 'strategy': 'breakout', 'time_stop': 194, 'use_sma': False, 'use_atr': False, 'use_adx': True, 'use_ema': False, 'use_spike': True, 'rsi_required': False, 'edge_k': 1.1602246249754358, 'edge_cap': 0.44955868677974226, 'bull_strategy': 'breakout', 'bull_bb_std_mult': 0.9996016152480249, 'bull_rsi_os': 33, 'bull_rsi_ob': 70, 'bull_adx_thresh': 22.261226200502097, 'bull_atr_min_pct': 0.015620366987910769, 'bull_atr_max_pct': 0.06347133050097091, 'bull_tp_mult': 1.9453076681369226, 'bull_tsl_mult': 0.24033253999135692, 'bull_time_stop': 155, 'bull_use_sma': False, 'bull_use_ema': True, 'bull_use_atr': False, 'bull_use_adx': False, 'bull_use_spike': True, 'bull_rsi_required': True, 'bear_strategy': 'mean_reversion', 'bear_bb_std_mult': 2.2503360283166582, 'bear_rsi_os': 33, 'bear_rsi_ob': 58, 'bear_adx_thresh': 22.670256775783894, 'bear_atr_min_pct': 0.027290630635023506, 'bear_atr_max_pct': 0.026959066308989307, 'bear_tp_mult': 1.136289865139942, 'bear_tsl_mult': 0.4590410669439849, 'bear_time_stop': 64, 'bear_use_sma': False, 'bear_use_ema': False, 'bear_use_atr': False, 'bear_use_adx': False, 'bear_use_spike': True, 'bear_rsi_required': True, 'sideways_strategy': 'mean_reversion', 'sideways_bb_std_mult': 0.7887608593357915, 'sideways_rsi_os': 41, 'sideways_rsi_ob': 92, 'sideways_adx_thresh': 29.43700040314073, 'sideways_atr_min_pct': 3.403317475225709e-06, 'sideways_atr_max_pct': 0.020071890837550482, 'sideways_tp_mult': 1.8146140001699842, 'sideways_tsl_mult': 0.32426351494418293, 'sideways_time_stop': 175, 'sideways_use_sma': False, 'sideways_use_ema': True, 'sideways_use_atr': True, 'sideways_use_adx': True, 'sideways_use_spike': True, 'sideways_rsi_required': True}.
[I 2025-09-01 03:25:36,109] Trial 384 finished with values: [-1000000000.0, 1000000000.0] and parameters: {'p_sma': 15, 'p_std': 27, 'p_atr': 28, 'p_adx': 17, 'rsi_period': 11, 'ema1': 24, 'ema2': 50, 'slip_atr_k': 0.17845666503958443, 'slip_spread_k': 0.1750891443136044, 'spread_hl_frac': 0.017922638588260598, 'bb_std_mult': 1.4657892284159366, 'rsi_os': 30, 'rsi_ob': 80, 'vol_spike': 0.22983762366771177, 'adx_thresh': 10.93195703692089, 'atr_min_pct': 0.007491991908951485, 'atr_max_pct': 0.05978757932473604, 'tp_mult': 1.0890612681328762, 'tsl_mult': 0.5299946134244011, 'strategy': 'mean_reversion', 'time_stop': 178, 'use_sma': False, 'use_atr': False, 'use_adx': False, 'use_ema': True, 'use_spike': False, 'rsi_required': True, 'edge_k': 1.7581122158748386, 'edge_cap': 0.7527404224518408, 'bull_strategy': 'breakout', 'bull_bb_std_mult': 1.1020379600858026, 'bull_rsi_os': 14, 'bull_rsi_ob': 82, 'bull_adx_thresh': 22.70706133546903, 'bull_atr_min_pct': 0.003049002453399721, 'bull_atr_max_pct': 0.12635989008788726, 'bull_tp_mult': 1.7803798066047367, 'bull_tsl_mult': 0.027834854071924653, 'bull_time_stop': 287, 'bull_use_sma': True, 'bull_use_ema': False, 'bull_use_atr': True, 'bull_use_adx': True, 'bull_use_spike': True, 'bull_rsi_required': False, 'bear_strategy': 'breakout', 'bear_bb_std_mult': 2.2902444243422653, 'bear_rsi_os': 54, 'bear_rsi_ob': 70, 'bear_adx_thresh': 23.904404577165295, 'bear_atr_min_pct': 0.02532348423650546, 'bear_atr_max_pct': 0.02379768992565759, 'bear_tp_mult': 1.011466025781947, 'bear_tsl_mult': 0.8114438797741246, 'bear_time_stop': 73, 'bear_use_sma': True, 'bear_use_ema': False, 'bear_use_atr': True, 'bear_use_adx': True, 'bear_use_spike': False, 'bear_rsi_required': False, 'sideways_strategy': 'breakout', 'sideways_bb_std_mult': 1.922982680100294, 'sideways_rsi_os': 36, 'sideways_rsi_ob': 84, 'sideways_adx_thresh': 28.383999298678084, 'sideways_atr_min_pct': 0.007070757797787644, 'sideways_atr_max_pct': 0.10273796850202442, 'sideways_tp_mult': 1.6638783798801793, 'sideways_tsl_mult': 0.19566859664128944, 'sideways_time_stop': 213, 'sideways_use_sma': True, 'sideways_use_ema': False, 'sideways_use_atr': False, 'sideways_use_adx': False, 'sideways_use_spike': False, 'sideways_rsi_required': True}.
[I 2025-09-01 03:25:36,601] Trial 385 finished with values: [-1000000000.0, 1000000000.0] and parameters: {'p_sma': 37, 'p_std': 57, 'p_atr': 16, 'p_adx': 18, 'rsi_period': 8, 'ema1': 15, 'ema2': 50, 'slip_atr_k': 0.025768322960234943, 'slip_spread_k': 0.17625103878378282, 'spread_hl_frac': 0.024225628062236187, 'bb_std_mult': 1.0704928812961383, 'rsi_os': 23, 'rsi_ob': 56, 'vol_spike': 0.22817073114136507, 'adx_thresh': 11.327379821374567, 'atr_min_pct': 0.00704434718784638, 'atr_max_pct': 0.04849268473474434, 'tp_mult': 1.1125603059086262, 'tsl_mult': 0.3622680572928911, 'strategy': 'mean_reversion', 'time_stop': 178, 'use_sma': False, 'use_atr': False, 'use_adx': False, 'use_ema': True, 'use_spike': False, 'rsi_required': True, 'edge_k': 0.15000410410495563, 'edge_cap': 0.4451377128737988, 'bull_strategy': 'breakout', 'bull_bb_std_mult': 1.120184726577578, 'bull_rsi_os': 14, 'bull_rsi_ob': 82, 'bull_adx_thresh': 22.91224314349021, 'bull_atr_min_pct': 0.00482730429384697, 'bull_atr_max_pct': 0.1276846815983358, 'bull_tp_mult': 1.8622851796911974, 'bull_tsl_mult': 0.01841399042499947, 'bull_time_stop': 288, 'bull_use_sma': True, 'bull_use_ema': False, 'bull_use_atr': True, 'bull_use_adx': True, 'bull_use_spike': True, 'bull_rsi_required': False, 'bear_strategy': 'breakout', 'bear_bb_std_mult': 2.2975916000186705, 'bear_rsi_os': 41, 'bear_rsi_ob': 55, 'bear_adx_thresh': 31.707216157012553, 'bear_atr_min_pct': 0.025382123072882703, 'bear_atr_max_pct': 0.02377575746861612, 'bear_tp_mult': 2.1131784116373904, 'bear_tsl_mult': 0.10990944409676073, 'bear_time_stop': 73, 'bear_use_sma': True, 'bear_use_ema': False, 'bear_use_atr': True, 'bear_use_adx': True, 'bear_use_spike': False, 'bear_rsi_required': False, 'sideways_strategy': 'breakout', 'sideways_bb_std_mult': 1.586233613529474, 'sideways_rsi_os': 30, 'sideways_rsi_ob': 50, 'sideways_adx_thresh': 28.487205787597535, 'sideways_atr_min_pct': 0.027226088099878764, 'sideways_atr_max_pct': 0.026582089968507753, 'sideways_tp_mult': 1.6490775108525415, 'sideways_tsl_mult': 0.19656605912080477, 'sideways_time_stop': 125, 'sideways_use_sma': True, 'sideways_use_ema': False, 'sideways_use_atr': False, 'sideways_use_adx': False, 'sideways_use_spike': False, 'sideways_rsi_required': True}.
[I 2025-09-01 03:25:36,988] Trial 383 finished with values: [-1000000000.0, 1000000000.0] and parameters: {'p_sma': 6, 'p_std': 57, 'p_atr': 28, 'p_adx': 18, 'rsi_period': 8, 'ema1': 20, 'ema2': 39, 'slip_atr_k': 0.1779409270971312, 'slip_spread_k': 0.1787786781646044, 'spread_hl_frac': 0.04893346956001503, 'bb_std_mult': 1.0778270173961924, 'rsi_os': 25, 'rsi_ob': 80, 'vol_spike': 0.23018174166499905, 'adx_thresh': 12.153083886795123, 'atr_min_pct': 0.008003930682098875, 'atr_max_pct': 0.050118841382698634, 'tp_mult': 1.3419670934453833, 'tsl_mult': 0.36968132352251665, 'strategy': 'mean_reversion', 'time_stop': 196, 'use_sma': False, 'use_atr': False, 'use_adx': True, 'use_ema': False, 'use_spike': False, 'rsi_required': True, 'edge_k': 0.14837143109058057, 'edge_cap': 0.44125926442024405, 'bull_strategy': 'breakout', 'bull_bb_std_mult': 1.092793243496517, 'bull_rsi_os': 14, 'bull_rsi_ob': 87, 'bull_adx_thresh': 22.509734820204258, 'bull_atr_min_pct': 0.0031983837266024526, 'bull_atr_max_pct': 0.0903415387059712, 'bull_tp_mult': 1.8427131519671278, 'bull_tsl_mult': 0.2994920825138811, 'bull_time_stop': 286, 'bull_use_sma': True, 'bull_use_ema': False, 'bull_use_atr': True, 'bull_use_adx': True, 'bull_use_spike': True, 'bull_rsi_required': False, 'bear_strategy': 'breakout', 'bear_bb_std_mult': 2.2536234076198496, 'bear_rsi_os': 53, 'bear_rsi_ob': 70, 'bear_adx_thresh': 26.969136848745176, 'bear_atr_min_pct': 0.028314116134307784, 'bear_atr_max_pct': 0.02661034497449413, 'bear_tp_mult': 2.5469774057644305, 'bear_tsl_mult': 0.8048552692245388, 'bear_time_stop': 74, 'bear_use_sma': False, 'bear_use_ema': False, 'bear_use_atr': False, 'bear_use_adx': False, 'bear_use_spike': False, 'bear_rsi_required': False, 'sideways_strategy': 'breakout', 'sideways_bb_std_mult': 0.8143354949755153, 'sideways_rsi_os': 36, 'sideways_rsi_ob': 77, 'sideways_adx_thresh': 29.27969924305331, 'sideways_atr_min_pct': 0.01662709378045877, 'sideways_atr_max_pct': 0.022917665228578847, 'sideways_tp_mult': 1.952280435678841, 'sideways_tsl_mult': 0.7643350036656231, 'sideways_time_stop': 130, 'sideways_use_sma': True, 'sideways_use_ema': True, 'sideways_use_atr': True, 'sideways_use_adx': False, 'sideways_use_spike': False, 'sideways_rsi_required': True}.
[I 2025-09-01 03:25:37,256] Trial 382 finished with values: [-1000000000.0, 1000000000.0] and parameters: {'p_sma': 36, 'p_std': 28, 'p_atr': 27, 'p_adx': 30, 'rsi_period': 47, 'ema1': 23, 'ema2': 55, 'slip_atr_k': 0.17975838426921986, 'slip_spread_k': 0.14987099114149965, 'spread_hl_frac': 0.01778559186387983, 'bb_std_mult': 1.5897555176210214, 'rsi_os': 36, 'rsi_ob': 82, 'vol_spike': 0.20626665849278175, 'adx_thresh': 11.159836526613683, 'atr_min_pct': 0.007996158273721937, 'atr_max_pct': 0.030774055639905158, 'tp_mult': 2.68526173341676, 'tsl_mult': 0.3349297783517726, 'strategy': 'mean_reversion', 'time_stop': 178, 'use_sma': False, 'use_atr': False, 'use_adx': True, 'use_ema': False, 'use_spike': True, 'rsi_required': False, 'edge_k': 0.15756173034263538, 'edge_cap': 0.44633089863514624, 'bull_strategy': 'breakout', 'bull_bb_std_mult': 1.0136494663042768, 'bull_rsi_os': 16, 'bull_rsi_ob': 92, 'bull_adx_thresh': 22.369300836151954, 'bull_atr_min_pct': 0.0019493338189148328, 'bull_atr_max_pct': 0.11810223087586845, 'bull_tp_mult': 1.1477009329932724, 'bull_tsl_mult': 0.2331362976014699, 'bull_time_stop': 288, 'bull_use_sma': True, 'bull_use_ema': False, 'bull_use_atr': False, 'bull_use_adx': False, 'bull_use_spike': True, 'bull_rsi_required': False, 'bear_strategy': 'breakout', 'bear_bb_std_mult': 2.1820781045519397, 'bear_rsi_os': 51, 'bear_rsi_ob': 59, 'bear_adx_thresh': 26.822928032430106, 'bear_atr_min_pct': 0.017101243138426897, 'bear_atr_max_pct': 0.02693177520124633, 'bear_tp_mult': 1.01107811203129, 'bear_tsl_mult': 0.09865608980949331, 'bear_time_stop': 63, 'bear_use_sma': False, 'bear_use_ema': False, 'bear_use_atr': False, 'bear_use_adx': False, 'bear_use_spike': True, 'bear_rsi_required': True, 'sideways_strategy': 'breakout', 'sideways_bb_std_mult': 1.9282231539937023, 'sideways_rsi_os': 30, 'sideways_rsi_ob': 84, 'sideways_adx_thresh': 29.239774262532965, 'sideways_atr_min_pct': 0.027074740378237455, 'sideways_atr_max_pct': 0.1434996953392118, 'sideways_tp_mult': 1.7269919955780113, 'sideways_tsl_mult': 0.8668913402731621, 'sideways_time_stop': 130, 'sideways_use_sma': True, 'sideways_use_ema': True, 'sideways_use_atr': True, 'sideways_use_adx': True, 'sideways_use_spike': True, 'sideways_rsi_required': True}.
[I 2025-09-01 03:26:20,720] Trial 386 finished with values: [-1000000000.0, 1000000000.0] and parameters: {'p_sma': 36, 'p_std': 57, 'p_atr': 28, 'p_adx': 18, 'rsi_period': 12, 'ema1': 20, 'ema2': 57, 'slip_atr_k': 0.0320020449219475, 'slip_spread_k': 0.1029864954622601, 'spread_hl_frac': 0.03343622807461679, 'bb_std_mult': 1.971878826275697, 'rsi_os': 21, 'rsi_ob': 66, 'vol_spike': 0.20557067959193168, 'adx_thresh': 15.781038002756484, 'atr_min_pct': 0.0067868117876675885, 'atr_max_pct': 0.02872828790489225, 'tp_mult': 1.3262542671179307, 'tsl_mult': 0.3699379170719098, 'strategy': 'mean_reversion', 'time_stop': 169, 'use_sma': False, 'use_atr': False, 'use_adx': True, 'use_ema': False, 'use_spike': True, 'rsi_required': False, 'edge_k': 0.1481924008623796, 'edge_cap': 0.4464552132541365, 'bull_strategy': 'breakout', 'bull_bb_std_mult': 1.2933245612741582, 'bull_rsi_os': 17, 'bull_rsi_ob': 87, 'bull_adx_thresh': 20.110600260983254, 'bull_atr_min_pct': 0.004771168435412174, 'bull_atr_max_pct': 0.12195904357120382, 'bull_tp_mult': 1.5373195966915607, 'bull_tsl_mult': 0.30654044742294995, 'bull_time_stop': 280, 'bull_use_sma': True, 'bull_use_ema': False, 'bull_use_atr': False, 'bull_use_adx': True, 'bull_use_spike': False, 'bull_rsi_required': False, 'bear_strategy': 'breakout', 'bear_bb_std_mult': 2.2195408165206634, 'bear_rsi_os': 48, 'bear_rsi_ob': 60, 'bear_adx_thresh': 31.7470593295095, 'bear_atr_min_pct': 0.02570851397870445, 'bear_atr_max_pct': 0.027287323196361565, 'bear_tp_mult': 2.727873021190822, 'bear_tsl_mult': 0.7534642358719161, 'bear_time_stop': 284, 'bear_use_sma': False, 'bear_use_ema': True, 'bear_use_atr': False, 'bear_use_adx': False, 'bear_use_spike': True, 'bear_rsi_required': False, 'sideways_strategy': 'breakout', 'sideways_bb_std_mult': 1.7363395177097014, 'sideways_rsi_os': 24, 'sideways_rsi_ob': 89, 'sideways_adx_thresh': 29.033556857662244, 'sideways_atr_min_pct': 0.026977309798950466, 'sideways_atr_max_pct': 0.026798619207916284, 'sideways_tp_mult': 1.5819348866773635, 'sideways_tsl_mult': 0.16588869320307462, 'sideways_time_stop': 148, 'sideways_use_sma': True, 'sideways_use_ema': True, 'sideways_use_atr': True, 'sideways_use_adx': False, 'sideways_use_spike': True, 'sideways_rsi_required': True}.
