[I 2025-09-01 02:28:26,104] Trial 42 finished with values: [-1000000000.0, 1000000000.0] and parameters: {'p_sma': 23, 'p_std': 51, 'p_atr': 21, 'p_adx': 8, 'rsi_period': 72, 'ema1': 30, 'ema2': 56, 'slip_atr_k': 0.16182610223886779, 'slip_spread_k': 0.761916617412952, 'spread_hl_frac': 0.035728824522768675, 'bb_std_mult': 3.160576296031925, 'rsi_os': 41, 'rsi_ob': 58, 'vol_spike': 0.15316020363107724, 'adx_thresh': 22.56997324457093, 'atr_min_pct': 0.01658609636530457, 'atr_max_pct': 0.0729775713215087, 'tp_mult': 2.2096626292826462, 'tsl_mult': 0.6426768604782994, 'strategy': 'breakout', 'time_stop': 196, 'use_sma': False, 'use_atr': False, 'use_adx': True, 'use_ema': False, 'use_spike': False, 'rsi_required': True, 'edge_k': 0.6327204567930584, 'edge_cap': 0.47938942850968325, 'bull_strategy': 'breakout', 'bull_bb_std_mult': 3.28056344851696, 'bull_rsi_os': 20, 'bull_rsi_ob': 63, 'bull_adx_thresh': 34.16547964207879, 'bull_atr_min_pct': 0.0006297647906582873, 'bull_atr_max_pct': 0.08745359002737602, 'bull_tp_mult': 1.858242050982371, 'bull_tsl_mult': 0.6240195010541083, 'bull_time_stop': 264, 'bull_use_sma': False, 'bull_use_ema': True, 'bull_use_atr': True, 'bull_use_adx': False, 'bull_use_spike': True, 'bull_rsi_required': True, 'bear_strategy': 'breakout', 'bear_bb_std_mult': 2.555423388246781, 'bear_rsi_os': 22, 'bear_rsi_ob': 87, 'bear_adx_thresh': 26.673539467108522, 'bear_atr_min_pct': 0.00359428234106886, 'bear_atr_max_pct': 0.08154416305626941, 'bear_tp_mult': 2.4050385882889604, 'bear_tsl_mult': 0.8727236461226471, 'bear_time_stop': 95, 'bear_use_sma': True, 'bear_use_ema': False, 'bear_use_atr': False, 'bear_use_adx': False, 'bear_use_spike': True, 'bear_rsi_required': True, 'sideways_strategy': 'breakout', 'sideways_bb_std_mult': 1.0785523416599994, 'sideways_rsi_os': 40, 'sideways_rsi_ob': 84, 'sideways_adx_thresh': 22.831277909299104, 'sideways_atr_min_pct': 0.02571121241001542, 'sideways_atr_max_pct': 0.08649975351061685, 'sideways_tp_mult': 1.6316117741023846, 'sideways_tsl_mult': 0.4499297102217481, 'sideways_time_stop': 83, 'sideways_use_sma': False, 'sideways_use_ema': True, 'sideways_use_atr': False, 'sideways_use_adx': False, 'sideways_use_spike': False, 'sideways_rsi_required': False}.
[I 2025-09-01 02:29:11,551] Trial 47 finished with values: [-1000000000.0, 1000000000.0] and parameters: {'p_sma': 19, 'p_std': 43, 'p_atr': 22, 'p_adx': 9, 'rsi_period': 58, 'ema1': 7, 'ema2': 57, 'slip_atr_k': 0.14524554855831656, 'slip_spread_k': 0.42074065022690316, 'spread_hl_frac': 0.04986460590489054, 'bb_std_mult': 0.972808966652787, 'rsi_os': 12, 'rsi_ob': 69, 'vol_spike': 0.15679919156945665, 'adx_thresh': 27.50989421113883, 'atr_min_pct': 0.013950578232722548, 'atr_max_pct': 0.09606014233582727, 'tp_mult': 2.0678554511238616, 'tsl_mult': 0.6547891575527819, 'strategy': 'breakout', 'time_stop': 273, 'use_sma': False, 'use_atr': False, 'use_adx': False, 'use_ema': False, 'use_spike': False, 'rsi_required': True, 'edge_k': 0.5460566851354629, 'edge_cap': 0.25156948034432364, 'bull_strategy': 'breakout', 'bull_bb_std_mult': 1.3661032074234676, 'bull_rsi_os': 9, 'bull_rsi_ob': 70, 'bull_adx_thresh': 30.8540022986574, 'bull_atr_min_pct': 0.018064324340065444, 'bull_atr_max_pct': 0.019121987861393352, 'bull_tp_mult': 1.5506583344147657, 'bull_tsl_mult': 0.16567170825629757, 'bull_time_stop': 70, 'bull_use_sma': False, 'bull_use_ema': True, 'bull_use_atr': True, 'bull_use_adx': False, 'bull_use_spike': True, 'bull_rsi_required': True, 'bear_strategy': 'breakout', 'bear_bb_std_mult': 2.5588858772432044, 'bear_rsi_os': 47, 'bear_rsi_ob': 92, 'bear_adx_thresh': 19.05440057683889, 'bear_atr_min_pct': 0.010369192122821594, 'bear_atr_max_pct': 0.05209204776459809, 'bear_tp_mult': 2.4226113099434805, 'bear_tsl_mult': 0.97452733688867, 'bear_time_stop': 164, 'bear_use_sma': False, 'bear_use_ema': False, 'bear_use_atr': False, 'bear_use_adx': True, 'bear_use_spike': True, 'bear_rsi_required': True, 'sideways_strategy': 'breakout', 'sideways_bb_std_mult': 2.7212243280232684, 'sideways_rsi_os': 15, 'sideways_rsi_ob': 72, 'sideways_adx_thresh': 28.83463936157915, 'sideways_atr_min_pct': 0.009347271779313415, 'sideways_atr_max_pct': 0.08550008995693903, 'sideways_tp_mult': 1.3633718154925787, 'sideways_tsl_mult': 0.6138183697938926, 'sideways_time_stop': 61, 'sideways_use_sma': False, 'sideways_use_ema': True, 'sideways_use_atr': True, 'sideways_use_adx': True, 'sideways_use_spike': False, 'sideways_rsi_required': False}.
[I 2025-09-01 02:29:12,546] Trial 48 finished with values: [-0.020042618626293418, 0.019918834908758235] and parameters: {'p_sma': 17, 'p_std': 45, 'p_atr': 22, 'p_adx': 9, 'rsi_period': 61, 'ema1': 7, 'ema2': 57, 'slip_atr_k': 0.14336856384360255, 'slip_spread_k': 0.23242676022178854, 'spread_hl_frac': 0.00719824768968548, 'bb_std_mult': 1.4057573882847776, 'rsi_os': 5, 'rsi_ob': 64, 'vol_spike': 0.15622983571689947, 'adx_thresh': 25.104108711947106, 'atr_min_pct': 0.013643813934957895, 'atr_max_pct': 0.09515344343189623, 'tp_mult': 2.03563113953297, 'tsl_mult': 0.648130248889032, 'strategy': 'breakout', 'time_stop': 272, 'use_sma': False, 'use_atr': False, 'use_adx': False, 'use_ema': False, 'use_spike': True, 'rsi_required': False, 'edge_k': 0.4511515053575328, 'edge_cap': 0.14218607184239235, 'bull_strategy': 'mean_reversion', 'bull_bb_std_mult': 1.2209376693506877, 'bull_rsi_os': 13, 'bull_rsi_ob': 65, 'bull_adx_thresh': 28.934906196728033, 'bull_atr_min_pct': 7.856259502663881e-05, 'bull_atr_max_pct': 0.14767727616109833, 'bull_tp_mult': 1.5758998978867218, 'bull_tsl_mult': 0.5185126286979519, 'bull_time_stop': 64, 'bull_use_sma': False, 'bull_use_ema': False, 'bull_use_atr': False, 'bull_use_adx': False, 'bull_use_spike': True, 'bull_rsi_required': True, 'bear_strategy': 'breakout', 'bear_bb_std_mult': 2.51780039122036, 'bear_rsi_os': 6, 'bear_rsi_ob': 92, 'bear_adx_thresh': 25.169813440565004, 'bear_atr_min_pct': 0.010759147548942402, 'bear_atr_max_pct': 0.05181548091653514, 'bear_tp_mult': 2.3763208107730796, 'bear_tsl_mult': 0.9906641766042772, 'bear_time_stop': 64, 'bear_use_sma': False, 'bear_use_ema': False, 'bear_use_atr': False, 'bear_use_adx': True, 'bear_use_spike': True, 'bear_rsi_required': True, 'sideways_strategy': 'breakout', 'sideways_bb_std_mult': 2.8989310112223565, 'sideways_rsi_os': 15, 'sideways_rsi_ob': 72, 'sideways_adx_thresh': 29.319178497652985, 'sideways_atr_min_pct': 0.01601631378794366, 'sideways_atr_max_pct': 0.11316176108893994, 'sideways_tp_mult': 1.3399128899280308, 'sideways_tsl_mult': 0.6363650919434384, 'sideways_time_stop': 57, 'sideways_use_sma': False, 'sideways_use_ema': True, 'sideways_use_atr': True, 'sideways_use_adx': True, 'sideways_use_spike': True, 'sideways_rsi_required': False}.
[I 2025-09-01 02:29:13,325] Trial 49 finished with values: [-1000000000.0, 1000000000.0] and parameters: {'p_sma': 18, 'p_std': 44, 'p_atr': 23, 'p_adx': 9, 'rsi_period': 57, 'ema1': 6, 'ema2': 57, 'slip_atr_k': 0.14405177989080103, 'slip_spread_k': 0.18017604358273626, 'spread_hl_frac': 0.024850031410534136, 'bb_std_mult': 0.9562442779358142, 'rsi_os': 5, 'rsi_ob': 64, 'vol_spike': 0.13639107211942614, 'adx_thresh': 26.890063337430025, 'atr_min_pct': 0.01332067624643405, 'atr_max_pct': 0.09057959565680451, 'tp_mult': 2.0580986639408256, 'tsl_mult': 0.8786234735256472, 'strategy': 'breakout', 'time_stop': 272, 'use_sma': True, 'use_atr': False, 'use_adx': False, 'use_ema': False, 'use_spike': True, 'rsi_required': False, 'edge_k': 0.4655635538036236, 'edge_cap': 0.179251877289414, 'bull_strategy': 'mean_reversion', 'bull_bb_std_mult': 1.063730681347567, 'bull_rsi_os': 13, 'bull_rsi_ob': 72, 'bull_adx_thresh': 29.94947081926393, 'bull_atr_min_pct': 0.016165311186598846, 'bull_atr_max_pct': 0.024070411120448394, 'bull_tp_mult': 1.5480136384257863, 'bull_tsl_mult': 0.5268406830590711, 'bull_time_stop': 63, 'bull_use_sma': False, 'bull_use_ema': False, 'bull_use_atr': False, 'bull_use_adx': False, 'bull_use_spike': True, 'bull_rsi_required': True, 'bear_strategy': 'breakout', 'bear_bb_std_mult': 2.7449564194166296, 'bear_rsi_os': 5, 'bear_rsi_ob': 92, 'bear_adx_thresh': 24.571131662072823, 'bear_atr_min_pct': 0.010173714765812655, 'bear_atr_max_pct': 0.05108100256926906, 'bear_tp_mult': 2.22694038729255, 'bear_tsl_mult': 0.9223472106610761, 'bear_time_stop': 66, 'bear_use_sma': False, 'bear_use_ema': False, 'bear_use_atr': False, 'bear_use_adx': True, 'bear_use_spike': True, 'bear_rsi_required': False, 'sideways_strategy': 'breakout', 'sideways_bb_std_mult': 2.7608799823646133, 'sideways_rsi_os': 11, 'sideways_rsi_ob': 74, 'sideways_adx_thresh': 29.326546811802427, 'sideways_atr_min_pct': 0.008665547075873001, 'sideways_atr_max_pct': 0.0975511181903154, 'sideways_tp_mult': 2.3036191049882926, 'sideways_tsl_mult': 0.10397335426144133, 'sideways_time_stop': 65, 'sideways_use_sma': False, 'sideways_use_ema': True, 'sideways_use_atr': True, 'sideways_use_adx': True, 'sideways_use_spike': True, 'sideways_rsi_required': False}.
[I 2025-09-01 02:29:13,335] Trial 46 finished with values: [-0.024573502632657673, 0.024389616968735227] and parameters: {'p_sma': 23, 'p_std': 50, 'p_atr': 22, 'p_adx': 9, 'rsi_period': 79, 'ema1': 7, 'ema2': 55, 'slip_atr_k': 0.17164360011367455, 'slip_spread_k': 0.2246933454467248, 'spread_hl_frac': 0.027884564795793716, 'bb_std_mult': 3.1247321462808246, 'rsi_os': 9, 'rsi_ob': 68, 'vol_spike': 0.13978048746699742, 'adx_thresh': 22.50291214328243, 'atr_min_pct': 0.013415054917296077, 'atr_max_pct': 0.09803692938335129, 'tp_mult': 1.3299814565480799, 'tsl_mult': 0.3383243218807608, 'strategy': 'breakout', 'time_stop': 273, 'use_sma': False, 'use_atr': False, 'use_adx': False, 'use_ema': False, 'use_spike': True, 'rsi_required': False, 'edge_k': 0.6053195557198832, 'edge_cap': 0.7020726934394336, 'bull_strategy': 'breakout', 'bull_bb_std_mult': 1.2732546566960123, 'bull_rsi_os': 13, 'bull_rsi_ob': 63, 'bull_adx_thresh': 29.02149857307813, 'bull_atr_min_pct': 0.0001749191663636999, 'bull_atr_max_pct': 0.08577632467126246, 'bull_tp_mult': 2.8082617198530277, 'bull_tsl_mult': 0.6084960468739523, 'bull_time_stop': 64, 'bull_use_sma': False, 'bull_use_ema': True, 'bull_use_atr': False, 'bull_use_adx': False, 'bull_use_spike': True, 'bull_rsi_required': True, 'bear_strategy': 'breakout', 'bear_bb_std_mult': 2.592489984725066, 'bear_rsi_os': 47, 'bear_rsi_ob': 87, 'bear_adx_thresh': 26.00403932914229, 'bear_atr_min_pct': 0.010470896924189455, 'bear_atr_max_pct': 0.051376380673126144, 'bear_tp_mult': 2.383572474203753, 'bear_tsl_mult': 0.8959014538624133, 'bear_time_stop': 176, 'bear_use_sma': False, 'bear_use_ema': False, 'bear_use_atr': False, 'bear_use_adx': True, 'bear_use_spike': True, 'bear_rsi_required': True, 'sideways_strategy': 'breakout', 'sideways_bb_std_mult': 2.6809911614899833, 'sideways_rsi_os': 14, 'sideways_rsi_ob': 72, 'sideways_adx_thresh': 23.333534945966335, 'sideways_atr_min_pct': 0.015912133878072898, 'sideways_atr_max_pct': 0.09270974667363618, 'sideways_tp_mult': 1.5908857760514177, 'sideways_tsl_mult': 0.47113644821150763, 'sideways_time_stop': 81, 'sideways_use_sma': False, 'sideways_use_ema': True, 'sideways_use_atr': False, 'sideways_use_adx': False, 'sideways_use_spike': True, 'sideways_rsi_required': False}.
[I 2025-09-01 02:29:13,748] Trial 53 finished with values: [-1000000000.0, 1000000000.0] and parameters: {'p_sma': 9, 'p_std': 40, 'p_atr': 27, 'p_adx': 20, 'rsi_period': 38, 'ema1': 7, 'ema2': 53, 'slip_atr_k': 0.0595730053601639, 'slip_spread_k': 0.27306914484530675, 'spread_hl_frac': 0.008882045076698104, 'bb_std_mult': 1.3563189698196174, 'rsi_os': 52, 'rsi_ob': 66, 'vol_spike': 0.014645058465663163, 'adx_thresh': 26.178618868441212, 'atr_min_pct': 0.011139782453586522, 'atr_max_pct': 0.08343539041267045, 'tp_mult': 1.7643032850747167, 'tsl_mult': 0.0709088862927103, 'strategy': 'mean_reversion', 'time_stop': 33, 'use_sma': True, 'use_atr': False, 'use_adx': False, 'use_ema': True, 'use_spike': True, 'rsi_required': False, 'edge_k': 0.3366045734805636, 'edge_cap': 0.13316963232594214, 'bull_strategy': 'mean_reversion', 'bull_bb_std_mult': 1.2436203844724643, 'bull_rsi_os': 14, 'bull_rsi_ob': 65, 'bull_adx_thresh': 22.83175594364304, 'bull_atr_min_pct': 0.026229730001286658, 'bull_atr_max_pct': 0.14975568247978982, 'bull_tp_mult': 1.3721106174660238, 'bull_tsl_mult': 0.2833288581417188, 'bull_time_stop': 45, 'bull_use_sma': True, 'bull_use_ema': False, 'bull_use_atr': False, 'bull_use_adx': True, 'bull_use_spike': False, 'bull_rsi_required': False, 'bear_strategy': 'mean_reversion', 'bear_bb_std_mult': 2.0533866660582887, 'bear_rsi_os': 10, 'bear_rsi_ob': 88, 'bear_adx_thresh': 12.866643496943546, 'bear_atr_min_pct': 0.025468574896391885, 'bear_atr_max_pct': 0.036544440645484344, 'bear_tp_mult': 2.0322195665647875, 'bear_tsl_mult': 0.9999068257394145, 'bear_time_stop': 185, 'bear_use_sma': False, 'bear_use_ema': True, 'bear_use_atr': False, 'bear_use_adx': True, 'bear_use_spike': True, 'bear_rsi_required': False, 'sideways_strategy': 'mean_reversion', 'sideways_bb_std_mult': 3.017366873453415, 'sideways_rsi_os': 15, 'sideways_rsi_ob': 68, 'sideways_adx_thresh': 31.192685749898448, 'sideways_atr_min_pct': 0.015543607676957989, 'sideways_atr_max_pct': 0.11486020674226907, 'sideways_tp_mult': 1.1392367057623816, 'sideways_tsl_mult': 0.7296366711135396, 'sideways_time_stop': 30, 'sideways_use_sma': True, 'sideways_use_ema': True, 'sideways_use_atr': True, 'sideways_use_adx': True, 'sideways_use_spike': True, 'sideways_rsi_required': False}.
[I 2025-09-01 02:29:13,762] Trial 52 finished with values: [-1000000000.0, 1000000000.0] and parameters: {'p_sma': 10, 'p_std': 34, 'p_atr': 29, 'p_adx': 20, 'rsi_period': 47, 'ema1': 7, 'ema2': 58, 'slip_atr_k': 0.09290690766449633, 'slip_spread_k': 0.26398808250767725, 'spread_hl_frac': 0.007619812256047198, 'bb_std_mult': 1.3704927879761486, 'rsi_os': 50, 'rsi_ob': 66, 'vol_spike': 0.02444874150866022, 'adx_thresh': 24.773618842248034, 'atr_min_pct': 0.011077339708954217, 'atr_max_pct': 0.05538310591796287, 'tp_mult': 1.733619343707936, 'tsl_mult': 0.08059288655682623, 'strategy': 'mean_reversion', 'time_stop': 34, 'use_sma': True, 'use_atr': False, 'use_adx': False, 'use_ema': True, 'use_spike': True, 'rsi_required': False, 'edge_k': 0.3438662216555064, 'edge_cap': 0.12172783788581863, 'bull_strategy': 'mean_reversion', 'bull_bb_std_mult': 0.894065282374759, 'bull_rsi_os': 12, 'bull_rsi_ob': 66, 'bull_adx_thresh': 21.838333446539558, 'bull_atr_min_pct': 0.012906324159801162, 'bull_atr_max_pct': 0.14708882791098266, 'bull_tp_mult': 1.3875121263615926, 'bull_tsl_mult': 0.32798272740421497, 'bull_time_stop': 42, 'bull_use_sma': True, 'bull_use_ema': False, 'bull_use_atr': False, 'bull_use_adx': True, 'bull_use_spike': False, 'bull_rsi_required': False, 'bear_strategy': 'mean_reversion', 'bear_bb_std_mult': 3.1775507806989416, 'bear_rsi_os': 10, 'bear_rsi_ob': 55, 'bear_adx_thresh': 25.171325217834706, 'bear_atr_min_pct': 0.013721496587477545, 'bear_atr_max_pct': 0.034454931467084005, 'bear_tp_mult': 2.0294494709615387, 'bear_tsl_mult': 0.9967814524110666, 'bear_time_stop': 200, 'bear_use_sma': False, 'bear_use_ema': True, 'bear_use_atr': False, 'bear_use_adx': True, 'bear_use_spike': True, 'bear_rsi_required': False, 'sideways_strategy': 'mean_reversion', 'sideways_bb_std_mult': 2.98763839376851, 'sideways_rsi_os': 22, 'sideways_rsi_ob': 68, 'sideways_adx_thresh': 30.872355312534314, 'sideways_atr_min_pct': 0.01577086356208479, 'sideways_atr_max_pct': 0.11297980583691611, 'sideways_tp_mult': 1.1542212723118297, 'sideways_tsl_mult': 0.7359842914443756, 'sideways_time_stop': 49, 'sideways_use_sma': True, 'sideways_use_ema': True, 'sideways_use_atr': True, 'sideways_use_adx': True, 'sideways_use_spike': True, 'sideways_rsi_required': False}.
[I 2025-09-01 02:29:57,496] Trial 54 finished with values: [-1000000000.0, 1000000000.0] and parameters: {'p_sma': 16, 'p_std': 38, 'p_atr': 22, 'p_adx': 18, 'rsi_period': 47, 'ema1': 10, 'ema2': 58, 'slip_atr_k': 0.09556141387776752, 'slip_spread_k': 0.212208521062897, 'spread_hl_frac': 0.0048380473827355705, 'bb_std_mult': 1.4860078556848972, 'rsi_os': 8, 'rsi_ob': 64, 'vol_spike': 0.10782684058366415, 'adx_thresh': 24.285948472702486, 'atr_min_pct': 0.014836130587299504, 'atr_max_pct': 0.05718284659734712, 'tp_mult': 1.3123531062786036, 'tsl_mult': 0.7120525688340129, 'strategy': 'breakout', 'time_stop': 297, 'use_sma': False, 'use_atr': False, 'use_adx': False, 'use_ema': False, 'use_spike': True, 'rsi_required': False, 'edge_k': 0.1479680383633179, 'edge_cap': 0.11609602455673637, 'bull_strategy': 'mean_reversion', 'bull_bb_std_mult': 0.9338334711046956, 'bull_rsi_os': 11, 'bull_rsi_ob': 67, 'bull_adx_thresh': 28.23250145599353, 'bull_atr_min_pct': 0.012964914812549282, 'bull_atr_max_pct': 0.12312513691623464, 'bull_tp_mult': 1.0162464227369545, 'bull_tsl_mult': 0.36455208041421844, 'bull_time_stop': 81, 'bull_use_sma': True, 'bull_use_ema': False, 'bull_use_atr': False, 'bull_use_adx': True, 'bull_use_spike': True, 'bull_rsi_required': True, 'bear_strategy': 'breakout', 'bear_bb_std_mult': 1.8575539943091297, 'bear_rsi_os': 17, 'bear_rsi_ob': 93, 'bear_adx_thresh': 24.94100762174784, 'bear_atr_min_pct': 0.013980969006566528, 'bear_atr_max_pct': 0.06482861282760558, 'bear_tp_mult': 2.5287198762373686, 'bear_tsl_mult': 0.9270804404117097, 'bear_time_stop': 54, 'bear_use_sma': False, 'bear_use_ema': False, 'bear_use_atr': False, 'bear_use_adx': True, 'bear_use_spike': True, 'bear_rsi_required': True, 'sideways_strategy': 'mean_reversion', 'sideways_bb_std_mult': 2.4892417766080976, 'sideways_rsi_os': 14, 'sideways_rsi_ob': 81, 'sideways_adx_thresh': 34.81235535669787, 'sideways_atr_min_pct': 0.012543311062530548, 'sideways_atr_max_pct': 0.11746839837899903, 'sideways_tp_mult': 1.358957895811605, 'sideways_tsl_mult': 0.6559682220504873, 'sideways_time_stop': 27, 'sideways_use_sma': False, 'sideways_use_ema': True, 'sideways_use_atr': True, 'sideways_use_adx': True, 'sideways_use_spike': True, 'sideways_rsi_required': False}.
[I 2025-09-01 02:29:58,254] Trial 50 finished with values: [-1000000000.0, 1000000000.0] and parameters: {'p_sma': 48, 'p_std': 25, 'p_atr': 28, 'p_adx': 13, 'rsi_period': 80, 'ema1': 7, 'ema2': 53, 'slip_atr_k': 0.1859751188214639, 'slip_spread_k': 0.2318737662868791, 'spread_hl_frac': 0.032277810390911425, 'bb_std_mult': 0.5969394851444318, 'rsi_os': 5, 'rsi_ob': 65, 'vol_spike': 0.13816473452429584, 'adx_thresh': 25.14235808383822, 'atr_min_pct': 0.013249078710325565, 'atr_max_pct': 0.05603162687751338, 'tp_mult': 1.7658664443506478, 'tsl_mult': 0.9096859474247816, 'strategy': 'breakout', 'time_stop': 300, 'use_sma': True, 'use_atr': False, 'use_adx': False, 'use_ema': False, 'use_spike': True, 'rsi_required': False, 'edge_k': 0.40830690738629494, 'edge_cap': 0.18698304356122963, 'bull_strategy': 'mean_reversion', 'bull_bb_std_mult': 3.0148224182618284, 'bull_rsi_os': 13, 'bull_rsi_ob': 66, 'bull_adx_thresh': 28.844216295655198, 'bull_atr_min_pct': 0.027067044678446776, 'bull_atr_max_pct': 0.06100622008449165, 'bull_tp_mult': 1.623769405568063, 'bull_tsl_mult': 0.5265064200274993, 'bull_time_stop': 52, 'bull_use_sma': False, 'bull_use_ema': False, 'bull_use_atr': False, 'bull_use_adx': False, 'bull_use_spike': False, 'bull_rsi_required': True, 'bear_strategy': 'breakout', 'bear_bb_std_mult': 2.770296374475361, 'bear_rsi_os': 8, 'bear_rsi_ob': 51, 'bear_adx_thresh': 25.030338606056496, 'bear_atr_min_pct': 0.013738214142082086, 'bear_atr_max_pct': 0.037996333505522284, 'bear_tp_mult': 2.217836899453916, 'bear_tsl_mult': 0.9284554244764628, 'bear_time_stop': 192, 'bear_use_sma': False, 'bear_use_ema': False, 'bear_use_atr': False, 'bear_use_adx': True, 'bear_use_spike': True, 'bear_rsi_required': False, 'sideways_strategy': 'breakout', 'sideways_bb_std_mult': 0.6341763648306658, 'sideways_rsi_os': 17, 'sideways_rsi_ob': 81, 'sideways_adx_thresh': 23.855590416969825, 'sideways_atr_min_pct': 0.015435881334996756, 'sideways_atr_max_pct': 0.09487649977036529, 'sideways_tp_mult': 1.3598290700179552, 'sideways_tsl_mult': 0.11487198401489174, 'sideways_time_stop': 116, 'sideways_use_sma': False, 'sideways_use_ema': True, 'sideways_use_atr': True, 'sideways_use_adx': True, 'sideways_use_spike': True, 'sideways_rsi_required': False}.
