[I 2025-09-01 03:40:43,773] Trial 468 finished with values: [-0.015872048235141656, 0.015729697902874915] and parameters: {'p_sma': 20, 'p_std': 57, 'p_atr': 27, 'p_adx': 12, 'rsi_period': 9, 'ema1': 21, 'ema2': 54, 'slip_atr_k': 0.0058939364506052135, 'slip_spread_k': 0.1113918550370691, 'spread_hl_frac': 0.04023564114347393, 'bb_std_mult': 2.4232575707462907, 'rsi_os': 37, 'rsi_ob': 81, 'vol_spike': 0.20340600933999897, 'adx_thresh': 12.763135705551868, 'atr_min_pct': 0.00876834544203993, 'atr_max_pct': 0.05041086915969434, 'tp_mult': 2.676998069228654, 'tsl_mult': 0.31389695139791435, 'strategy': 'mean_reversion', 'time_stop': 169, 'use_sma': False, 'use_atr': False, 'use_adx': True, 'use_ema': False, 'use_spike': True, 'rsi_required': False, 'edge_k': 0.24124128060474315, 'edge_cap': 0.3585522135370036, 'bull_strategy': 'breakout', 'bull_bb_std_mult': 0.9814390691512727, 'bull_rsi_os': 5, 'bull_rsi_ob': 81, 'bull_adx_thresh': 10.635483913644636, 'bull_atr_min_pct': 0.0005883057467050141, 'bull_atr_max_pct': 0.1129053941011356, 'bull_tp_mult': 1.5285383117944187, 'bull_tsl_mult': 0.27441019725828386, 'bull_time_stop': 300, 'bull_use_sma': True, 'bull_use_ema': False, 'bull_use_atr': False, 'bull_use_adx': False, 'bull_use_spike': False, 'bull_rsi_required': False, 'bear_strategy': 'breakout', 'bear_bb_std_mult': 3.093862244703214, 'bear_rsi_os': 51, 'bear_rsi_ob': 65, 'bear_adx_thresh': 33.81186608116622, 'bear_atr_min_pct': 0.006251131163817874, 'bear_atr_max_pct': 0.031837790227146986, 'bear_tp_mult': 2.8515699218568424, 'bear_tsl_mult': 0.09922345280175279, 'bear_time_stop': 299, 'bear_use_sma': False, 'bear_use_ema': False, 'bear_use_atr': False, 'bear_use_adx': False, 'bear_use_spike': True, 'bear_rsi_required': True, 'sideways_strategy': 'breakout', 'sideways_bb_std_mult': 3.487218305649516, 'sideways_rsi_os': 9, 'sideways_rsi_ob': 75, 'sideways_adx_thresh': 29.302320549510533, 'sideways_atr_min_pct': 0.02579898332904402, 'sideways_atr_max_pct': 0.11110009625009182, 'sideways_tp_mult': 1.8317857894496938, 'sideways_tsl_mult': 0.7760205970231839, 'sideways_time_stop': 168, 'sideways_use_sma': True, 'sideways_use_ema': True, 'sideways_use_atr': False, 'sideways_use_adx': False, 'sideways_use_spike': True, 'sideways_rsi_required': True}.
[I 2025-09-01 03:40:45,031] Trial 470 finished with values: [-1000000000.0, 1000000000.0] and parameters: {'p_sma': 57, 'p_std': 31, 'p_atr': 25, 'p_adx': 17, 'rsi_period': 49, 'ema1': 26, 'ema2': 58, 'slip_atr_k': 0.0061963634832402775, 'slip_spread_k': 0.23248583527993505, 'spread_hl_frac': 0.03969315164123257, 'bb_std_mult': 1.5558999903767385, 'rsi_os': 50, 'rsi_ob': 64, 'vol_spike': 0.054622774272035976, 'adx_thresh': 11.837655574202644, 'atr_min_pct': 0.006487284195871314, 'atr_max_pct': 0.14413194075717622, 'tp_mult': 2.7291888898844667, 'tsl_mult': 0.6837191281703159, 'strategy': 'breakout', 'time_stop': 112, 'use_sma': True, 'use_atr': True, 'use_adx': True, 'use_ema': False, 'use_spike': True, 'rsi_required': False, 'edge_k': 0.8746568804132551, 'edge_cap': 0.4029348093330305, 'bull_strategy': 'mean_reversion', 'bull_bb_std_mult': 0.9557389308144166, 'bull_rsi_os': 39, 'bull_rsi_ob': 53, 'bull_adx_thresh': 27.308194409378732, 'bull_atr_min_pct': 0.00037000335500484566, 'bull_atr_max_pct': 0.11211943673374332, 'bull_tp_mult': 1.6574212665434163, 'bull_tsl_mult': 0.15216668375970382, 'bull_time_stop': 276, 'bull_use_sma': False, 'bull_use_ema': True, 'bull_use_atr': False, 'bull_use_adx': False, 'bull_use_spike': True, 'bull_rsi_required': False, 'bear_strategy': 'breakout', 'bear_bb_std_mult': 2.442170755577858, 'bear_rsi_os': 17, 'bear_rsi_ob': 74, 'bear_adx_thresh': 14.612736499639125, 'bear_atr_min_pct': 0.006372449110214678, 'bear_atr_max_pct': 0.017226218803978552, 'bear_tp_mult': 1.0103850967555428, 'bear_tsl_mult': 0.10958641382494919, 'bear_time_stop': 63, 'bear_use_sma': False, 'bear_use_ema': False, 'bear_use_atr': False, 'bear_use_adx': False, 'bear_use_spike': True, 'bear_rsi_required': True, 'sideways_strategy': 'mean_reversion', 'sideways_bb_std_mult': 3.394163238941222, 'sideways_rsi_os': 50, 'sideways_rsi_ob': 75, 'sideways_adx_thresh': 7.658175903396279, 'sideways_atr_min_pct': 0.02633057863310754, 'sideways_atr_max_pct': 0.02511097664357031, 'sideways_tp_mult': 1.643258119119484, 'sideways_tsl_mult': 0.15851333124763917, 'sideways_time_stop': 117, 'sideways_use_sma': True, 'sideways_use_ema': True, 'sideways_use_atr': True, 'sideways_use_adx': False, 'sideways_use_spike': True, 'sideways_rsi_required': True}.
[I 2025-09-01 03:40:45,032] Trial 469 finished with values: [-0.061896459384287894, 0.061746962266155316] and parameters: {'p_sma': 20, 'p_std': 9, 'p_atr': 27, 'p_adx': 17, 'rsi_period': 67, 'ema1': 21, 'ema2': 54, 'slip_atr_k': 0.010973460820511233, 'slip_spread_k': 0.2487949781697219, 'spread_hl_frac': 0.030485558050846462, 'bb_std_mult': 2.458253441380146, 'rsi_os': 21, 'rsi_ob': 82, 'vol_spike': 0.22715282203320666, 'adx_thresh': 12.583640042492647, 'atr_min_pct': 0.006423126647415093, 'atr_max_pct': 0.049981996670578184, 'tp_mult': 2.678301048021952, 'tsl_mult': 0.6921212511001206, 'strategy': 'mean_reversion', 'time_stop': 168, 'use_sma': True, 'use_atr': False, 'use_adx': True, 'use_ema': False, 'use_spike': True, 'rsi_required': False, 'edge_k': 1.701154481906195, 'edge_cap': 0.8339982183161812, 'bull_strategy': 'breakout', 'bull_bb_std_mult': 0.9314512298414098, 'bull_rsi_os': 8, 'bull_rsi_ob': 52, 'bull_adx_thresh': 10.997859539300247, 'bull_atr_min_pct': 0.0006603795396973864, 'bull_atr_max_pct': 0.11293431894611561, 'bull_tp_mult': 2.2804032617756658, 'bull_tsl_mult': 0.14023094146837994, 'bull_time_stop': 276, 'bull_use_sma': False, 'bull_use_ema': False, 'bull_use_atr': False, 'bull_use_adx': False, 'bull_use_spike': True, 'bull_rsi_required': False, 'bear_strategy': 'breakout', 'bear_bb_std_mult': 3.3140986410403612, 'bear_rsi_os': 17, 'bear_rsi_ob': 65, 'bear_adx_thresh': 14.511414162928912, 'bear_atr_min_pct': 0.029300851001043852, 'bear_atr_max_pct': 0.10675392191419612, 'bear_tp_mult': 1.0441416616799777, 'bear_tsl_mult': 0.10119388430000859, 'bear_time_stop': 247, 'bear_use_sma': False, 'bear_use_ema': False, 'bear_use_atr': False, 'bear_use_adx': False, 'bear_use_spike': True, 'bear_rsi_required': True, 'sideways_strategy': 'mean_reversion', 'sideways_bb_std_mult': 1.8530124344602412, 'sideways_rsi_os': 9, 'sideways_rsi_ob': 75, 'sideways_adx_thresh': 29.179836391072534, 'sideways_atr_min_pct': 0.025877916589738204, 'sideways_atr_max_pct': 0.025260314182540683, 'sideways_tp_mult': 1.8363001260413188, 'sideways_tsl_mult': 0.7373393962016417, 'sideways_time_stop': 114, 'sideways_use_sma': True, 'sideways_use_ema': True, 'sideways_use_atr': False, 'sideways_use_adx': False, 'sideways_use_spike': True, 'sideways_rsi_required': True}.
[I 2025-09-01 03:41:25,686] Trial 473 finished with values: [-1000000000.0, 1000000000.0] and parameters: {'p_sma': 6, 'p_std': 54, 'p_atr': 26, 'p_adx': 12, 'rsi_period': 7, 'ema1': 21, 'ema2': 52, 'slip_atr_k': 0.0004495371955422541, 'slip_spread_k': 0.07898598285064115, 'spread_hl_frac': 0.04056802135865925, 'bb_std_mult': 2.387601221645749, 'rsi_os': 36, 'rsi_ob': 80, 'vol_spike': 0.17929388119124712, 'adx_thresh': 13.544550539064137, 'atr_min_pct': 0.010012438258527974, 'atr_max_pct': 0.043064257166550594, 'tp_mult': 2.50555317885058, 'tsl_mult': 0.29685801467813006, 'strategy': 'breakout', 'time_stop': 55, 'use_sma': False, 'use_atr': True, 'use_adx': False, 'use_ema': True, 'use_spike': False, 'rsi_required': True, 'edge_k': 0.2892047122004869, 'edge_cap': 0.22016952479048524, 'bull_strategy': 'mean_reversion', 'bull_bb_std_mult': 0.8196192539123346, 'bull_rsi_os': 5, 'bull_rsi_ob': 79, 'bull_adx_thresh': 9.503295968456177, 'bull_atr_min_pct': 0.00028234904418450056, 'bull_atr_max_pct': 0.10847034468388943, 'bull_tp_mult': 1.4506898803744275, 'bull_tsl_mult': 0.2891793650534094, 'bull_time_stop': 296, 'bull_use_sma': True, 'bull_use_ema': True, 'bull_use_atr': True, 'bull_use_adx': False, 'bull_use_spike': False, 'bull_rsi_required': True, 'bear_strategy': 'mean_reversion', 'bear_bb_std_mult': 3.0717934712787662, 'bear_rsi_os': 48, 'bear_rsi_ob': 67, 'bear_adx_thresh': 33.77557160006581, 'bear_atr_min_pct': 0.005504802270991019, 'bear_atr_max_pct': 0.04834337484070095, 'bear_tp_mult': 2.8317955428432184, 'bear_tsl_mult': 0.05771308634932379, 'bear_time_stop': 299, 'bear_use_sma': False, 'bear_use_ema': True, 'bear_use_atr': True, 'bear_use_adx': True, 'bear_use_spike': True, 'bear_rsi_required': False, 'sideways_strategy': 'breakout', 'sideways_bb_std_mult': 3.4896271519741506, 'sideways_rsi_os': 8, 'sideways_rsi_ob': 67, 'sideways_adx_thresh': 30.291835237201877, 'sideways_atr_min_pct': 0.023943212520466706, 'sideways_atr_max_pct': 0.11076311097048831, 'sideways_tp_mult': 1.8954307244101387, 'sideways_tsl_mult': 0.7726703250721664, 'sideways_time_stop': 203, 'sideways_use_sma': False, 'sideways_use_ema': False, 'sideways_use_atr': False, 'sideways_use_adx': True, 'sideways_use_spike': False, 'sideways_rsi_required': True}.
[I 2025-09-01 03:41:25,698] Trial 474 finished with values: [-1000000000.0, 1000000000.0] and parameters: {'p_sma': 9, 'p_std': 54, 'p_atr': 26, 'p_adx': 12, 'rsi_period': 7, 'ema1': 21, 'ema2': 52, 'slip_atr_k': 0.00017447437216927889, 'slip_spread_k': 0.08350651711990818, 'spread_hl_frac': 0.040541078964672586, 'bb_std_mult': 2.4186978018147443, 'rsi_os': 40, 'rsi_ob': 80, 'vol_spike': 0.17070369040178884, 'adx_thresh': 13.288567780733004, 'atr_min_pct': 0.010315000697429993, 'atr_max_pct': 0.044552086257850634, 'tp_mult': 2.539090730786145, 'tsl_mult': 0.2797966386535759, 'strategy': 'breakout', 'time_stop': 58, 'use_sma': False, 'use_atr': True, 'use_adx': False, 'use_ema': True, 'use_spike': False, 'rsi_required': True, 'edge_k': 0.2904873972979299, 'edge_cap': 0.3527093284787558, 'bull_strategy': 'mean_reversion', 'bull_bb_std_mult': 0.8250828633067447, 'bull_rsi_os': 5, 'bull_rsi_ob': 83, 'bull_adx_thresh': 9.656510506149026, 'bull_atr_min_pct': 0.0002748982528768899, 'bull_atr_max_pct': 0.1072754579956341, 'bull_tp_mult': 1.4415083513294304, 'bull_tsl_mult': 0.28422425799745704, 'bull_time_stop': 299, 'bull_use_sma': True, 'bull_use_ema': True, 'bull_use_atr': True, 'bull_use_adx': False, 'bull_use_spike': False, 'bull_rsi_required': True, 'bear_strategy': 'mean_reversion', 'bear_bb_std_mult': 3.096250723606564, 'bear_rsi_os': 48, 'bear_rsi_ob': 67, 'bear_adx_thresh': 33.644592079226385, 'bear_atr_min_pct': 0.005715539981820607, 'bear_atr_max_pct': 0.0455612071027503, 'bear_tp_mult': 2.8383226807025417, 'bear_tsl_mult': 0.057924500877637106, 'bear_time_stop': 300, 'bear_use_sma': False, 'bear_use_ema': True, 'bear_use_atr': True, 'bear_use_adx': True, 'bear_use_spike': False, 'bear_rsi_required': False, 'sideways_strategy': 'breakout', 'sideways_bb_std_mult': 3.486918529935614, 'sideways_rsi_os': 5, 'sideways_rsi_ob': 94, 'sideways_adx_thresh': 30.501783471519634, 'sideways_atr_min_pct': 0.024645508519248186, 'sideways_atr_max_pct': 0.1131288097671411, 'sideways_tp_mult': 1.8743792442013234, 'sideways_tsl_mult': 0.7702414624264593, 'sideways_time_stop': 189, 'sideways_use_sma': False, 'sideways_use_ema': False, 'sideways_use_atr': False, 'sideways_use_adx': True, 'sideways_use_spike': False, 'sideways_rsi_required': True}.
[I 2025-09-01 03:41:26,565] Trial 471 finished with values: [-1000000000.0, 1000000000.0] and parameters: {'p_sma': 20, 'p_std': 12, 'p_atr': 27, 'p_adx': 17, 'rsi_period': 16, 'ema1': 21, 'ema2': 59, 'slip_atr_k': 0.00434188488389739, 'slip_spread_k': 0.15735664489580498, 'spread_hl_frac': 0.04452466828246149, 'bb_std_mult': 2.9281963363672827, 'rsi_os': 20, 'rsi_ob': 49, 'vol_spike': 0.205370711702744, 'adx_thresh': 11.844677224050772, 'atr_min_pct': 0.008924159625630996, 'atr_max_pct': 0.043647547366691575, 'tp_mult': 1.9091272198858253, 'tsl_mult': 0.7697680365997188, 'strategy': 'breakout', 'time_stop': 189, 'use_sma': True, 'use_atr': True, 'use_adx': False, 'use_ema': False, 'use_spike': False, 'rsi_required': True, 'edge_k': 0.23723063352070373, 'edge_cap': 0.22006610616042793, 'bull_strategy': 'mean_reversion', 'bull_bb_std_mult': 0.5456826059456286, 'bull_rsi_os': 51, 'bull_rsi_ob': 53, 'bull_adx_thresh': 5.060250532580477, 'bull_atr_min_pct': 0.0004372138311126637, 'bull_atr_max_pct': 0.1127265361108725, 'bull_tp_mult': 1.6512138534582657, 'bull_tsl_mult': 0.5934629968225976, 'bull_time_stop': 17, 'bull_use_sma': False, 'bull_use_ema': True, 'bull_use_atr': True, 'bull_use_adx': False, 'bull_use_spike': True, 'bull_rsi_required': False, 'bear_strategy': 'mean_reversion', 'bear_bb_std_mult': 3.3209268024842604, 'bear_rsi_os': 51, 'bear_rsi_ob': 62, 'bear_adx_thresh': 24.389246988794028, 'bear_atr_min_pct': 0.029212833316112234, 'bear_atr_max_pct': 0.03302190685518995, 'bear_tp_mult': 1.0459684278284782, 'bear_tsl_mult': 0.19044969395371197, 'bear_time_stop': 298, 'bear_use_sma': False, 'bear_use_ema': True, 'bear_use_atr': True, 'bear_use_adx': True, 'bear_use_spike': True, 'bear_rsi_required': True, 'sideways_strategy': 'mean_reversion', 'sideways_bb_std_mult': 1.7552472179709437, 'sideways_rsi_os': 5, 'sideways_rsi_ob': 91, 'sideways_adx_thresh': 30.130861603976157, 'sideways_atr_min_pct': 0.027893649491112053, 'sideways_atr_max_pct': 0.02595042864250532, 'sideways_tp_mult': 1.4535941159813432, 'sideways_tsl_mult': 0.20029463917039686, 'sideways_time_stop': 199, 'sideways_use_sma': True, 'sideways_use_ema': False, 'sideways_use_atr': True, 'sideways_use_adx': False, 'sideways_use_spike': False, 'sideways_rsi_required': True}.
[I 2025-09-01 03:41:26,843] Trial 472 finished with values: [-1000000000.0, 1000000000.0] and parameters: {'p_sma': 8, 'p_std': 53, 'p_atr': 26, 'p_adx': 12, 'rsi_period': 7, 'ema1': 21, 'ema2': 52, 'slip_atr_k': 0.0006588882267630934, 'slip_spread_k': 0.07009661753755375, 'spread_hl_frac': 0.04038607767043364, 'bb_std_mult': 2.4413855425922395, 'rsi_os': 34, 'rsi_ob': 81, 'vol_spike': 0.17795350214146255, 'adx_thresh': 13.204762451912822, 'atr_min_pct': 0.009746555567312474, 'atr_max_pct': 0.04377221832798964, 'tp_mult': 2.521512805624546, 'tsl_mult': 0.28946018471088103, 'strategy': 'breakout', 'time_stop': 161, 'use_sma': True, 'use_atr': True, 'use_adx': False, 'use_ema': False, 'use_spike': True, 'rsi_required': False, 'edge_k': 0.27751441094603135, 'edge_cap': 0.30358140603778266, 'bull_strategy': 'mean_reversion', 'bull_bb_std_mult': 0.8341492582049264, 'bull_rsi_os': 8, 'bull_rsi_ob': 83, 'bull_adx_thresh': 10.64316014799502, 'bull_atr_min_pct': 3.985747034125175e-06, 'bull_atr_max_pct': 0.10486447049865374, 'bull_tp_mult': 1.4549802702269488, 'bull_tsl_mult': 0.2851071012460804, 'bull_time_stop': 296, 'bull_use_sma': False, 'bull_use_ema': True, 'bull_use_atr': False, 'bull_use_adx': False, 'bull_use_spike': False, 'bull_rsi_required': False, 'bear_strategy': 'mean_reversion', 'bear_bb_std_mult': 3.101115089529966, 'bear_rsi_os': 49, 'bear_rsi_ob': 66, 'bear_adx_thresh': 33.81127829417089, 'bear_atr_min_pct': 0.006192404632951802, 'bear_atr_max_pct': 0.047298941612789226, 'bear_tp_mult': 2.845631031975162, 'bear_tsl_mult': 0.04373281161846491, 'bear_time_stop': 300, 'bear_use_sma': False, 'bear_use_ema': True, 'bear_use_atr': True, 'bear_use_adx': True, 'bear_use_spike': False, 'bear_rsi_required': True, 'sideways_strategy': 'mean_reversion', 'sideways_bb_std_mult': 3.500053676933203, 'sideways_rsi_os': 5, 'sideways_rsi_ob': 78, 'sideways_adx_thresh': 30.513278180451938, 'sideways_atr_min_pct': 0.024735308225310206, 'sideways_atr_max_pct': 0.11327324542337767, 'sideways_tp_mult': 1.877349148345703, 'sideways_tsl_mult': 0.76996515133542, 'sideways_time_stop': 189, 'sideways_use_sma': True, 'sideways_use_ema': False, 'sideways_use_atr': False, 'sideways_use_adx': True, 'sideways_use_spike': True, 'sideways_rsi_required': True}.
[I 2025-09-01 03:42:08,266] Trial 477 finished with values: [-1000000000.0, 1000000000.0] and parameters: {'p_sma': 5, 'p_std': 53, 'p_atr': 26, 'p_adx': 12, 'rsi_period': 7, 'ema1': 15, 'ema2': 53, 'slip_atr_k': 0.0020157339948849023, 'slip_spread_k': 0.06439775053399864, 'spread_hl_frac': 0.04156907675755674, 'bb_std_mult': 2.466238641597565, 'rsi_os': 43, 'rsi_ob': 81, 'vol_spike': 0.18745427859275632, 'adx_thresh': 13.230352275157813, 'atr_min_pct': 0.009882638964962841, 'atr_max_pct': 0.031911129070134284, 'tp_mult': 2.626967755481605, 'tsl_mult': 0.3048159538564594, 'strategy': 'mean_reversion', 'time_stop': 90, 'use_sma': False, 'use_atr': False, 'use_adx': True, 'use_ema': False, 'use_spike': True, 'rsi_required': False, 'edge_k': 0.31865607044340255, 'edge_cap': 0.2775063517503827, 'bull_strategy': 'breakout', 'bull_bb_std_mult': 0.8783330432071412, 'bull_rsi_os': 7, 'bull_rsi_ob': 84, 'bull_adx_thresh': 10.381126086414985, 'bull_atr_min_pct': 0.00012809928649911518, 'bull_atr_max_pct': 0.10697918406837847, 'bull_tp_mult': 1.480083500945883, 'bull_tsl_mult': 0.2788203929777042, 'bull_time_stop': 300, 'bull_use_sma': True, 'bull_use_ema': False, 'bull_use_atr': False, 'bull_use_adx': True, 'bull_use_spike': False, 'bull_rsi_required': False, 'bear_strategy': 'breakout', 'bear_bb_std_mult': 3.1254575049262616, 'bear_rsi_os': 49, 'bear_rsi_ob': 66, 'bear_adx_thresh': 34.340665091766766, 'bear_atr_min_pct': 0.006243094569585079, 'bear_atr_max_pct': 0.05271314410622191, 'bear_tp_mult': 2.8885801764712253, 'bear_tsl_mult': 0.06873759205471469, 'bear_time_stop': 289, 'bear_use_sma': True, 'bear_use_ema': False, 'bear_use_atr': False, 'bear_use_adx': False, 'bear_use_spike': False, 'bear_rsi_required': True, 'sideways_strategy': 'breakout', 'sideways_bb_std_mult': 3.5151332793420353, 'sideways_rsi_os': 7, 'sideways_rsi_ob': 78, 'sideways_adx_thresh': 30.703935867857926, 'sideways_atr_min_pct': 0.02474362802490982, 'sideways_atr_max_pct': 0.10833977847177631, 'sideways_tp_mult': 1.8653670921595602, 'sideways_tsl_mult': 0.7085303709425779, 'sideways_time_stop': 163, 'sideways_use_sma': True, 'sideways_use_ema': True, 'sideways_use_atr': False, 'sideways_use_adx': False, 'sideways_use_spike': True, 'sideways_rsi_required': True}.
[I 2025-09-01 03:42:08,871] Trial 476 finished with values: [-1000000000.0, 1000000000.0] and parameters: {'p_sma': 5, 'p_std': 55, 'p_atr': 26, 'p_adx': 10, 'rsi_period': 7, 'ema1': 14, 'ema2': 53, 'slip_atr_k': 4.26802441808663e-05, 'slip_spread_k': 0.08592993495115628, 'spread_hl_frac': 0.041639669730355156, 'bb_std_mult': 2.4474738240944673, 'rsi_os': 34, 'rsi_ob': 81, 'vol_spike': 0.18953677958315504, 'adx_thresh': 13.329298313661281, 'atr_min_pct': 0.009662425633484698, 'atr_max_pct': 0.040752983029820805, 'tp_mult': 2.624175660040123, 'tsl_mult': 0.2801180105847196, 'strategy': 'mean_reversion', 'time_stop': 153, 'use_sma': False, 'use_atr': False, 'use_adx': True, 'use_ema': False, 'use_spike': True, 'rsi_required': False, 'edge_k': 0.3181615006261815, 'edge_cap': 0.2850685122388126, 'bull_strategy': 'breakout', 'bull_bb_std_mult': 0.8459702388070969, 'bull_rsi_os': 7, 'bull_rsi_ob': 85, 'bull_adx_thresh': 5.597655706510993, 'bull_atr_min_pct': 0.00010849102946846397, 'bull_atr_max_pct': 0.1059079027457491, 'bull_tp_mult': 1.4738053489231937, 'bull_tsl_mult': 0.27210785828199757, 'bull_time_stop': 294, 'bull_use_sma': True, 'bull_use_ema': False, 'bull_use_atr': False, 'bull_use_adx': True, 'bull_use_spike': False, 'bull_rsi_required': False, 'bear_strategy': 'breakout', 'bear_bb_std_mult': 3.0144948348076377, 'bear_rsi_os': 49, 'bear_rsi_ob': 68, 'bear_adx_thresh': 34.26321903992539, 'bear_atr_min_pct': 0.006273821554259206, 'bear_atr_max_pct': 0.05041671511356643, 'bear_tp_mult': 2.8913283656242723, 'bear_tsl_mult': 0.03136146368747596, 'bear_time_stop': 290, 'bear_use_sma': True, 'bear_use_ema': False, 'bear_use_atr': False, 'bear_use_adx': False, 'bear_use_spike': False, 'bear_rsi_required': True, 'sideways_strategy': 'breakout', 'sideways_bb_std_mult': 3.5243424841091295, 'sideways_rsi_os': 7, 'sideways_rsi_ob': 78, 'sideways_adx_thresh': 30.068492520926995, 'sideways_atr_min_pct': 0.0240746618617418, 'sideways_atr_max_pct': 0.10632094979238906, 'sideways_tp_mult': 1.867880564667893, 'sideways_tsl_mult': 0.8148523466288481, 'sideways_time_stop': 164, 'sideways_use_sma': True, 'sideways_use_ema': True, 'sideways_use_atr': False, 'sideways_use_adx': False, 'sideways_use_spike': True, 'sideways_rsi_required': True}.
