[I 2025-09-01 03:10:08,980] Trial 287 finished with values: [-1000000000.0, 1000000000.0] and parameters: {'p_sma': 46, 'p_std': 55, 'p_atr': 8, 'p_adx': 19, 'rsi_period': 40, 'ema1': 22, 'ema2': 38, 'slip_atr_k': 0.015490468017529674, 'slip_spread_k': 0.1686653730465975, 'spread_hl_frac': 0.025052746314478937, 'bb_std_mult': 1.3594017350339582, 'rsi_os': 22, 'rsi_ob': 90, 'vol_spike': 0.20108375156847436, 'adx_thresh': 20.419849833309815, 'atr_min_pct': 0.006886055801899163, 'atr_max_pct': 0.05231767617661066, 'tp_mult': 2.378926724454719, 'tsl_mult': 0.425378551400656, 'strategy': 'mean_reversion', 'time_stop': 167, 'use_sma': True, 'use_atr': True, 'use_adx': True, 'use_ema': False, 'use_spike': True, 'rsi_required': False, 'edge_k': 1.687142839550472, 'edge_cap': 0.7635619400919076, 'bull_strategy': 'breakout', 'bull_bb_std_mult': 0.6258602126052535, 'bull_rsi_os': 18, 'bull_rsi_ob': 53, 'bull_adx_thresh': 23.60815137809014, 'bull_atr_min_pct': 0.02921992613405612, 'bull_atr_max_pct': 0.12180129734930023, 'bull_tp_mult': 1.9404996918146764, 'bull_tsl_mult': 0.2493515673959018, 'bull_time_stop': 240, 'bull_use_sma': True, 'bull_use_ema': False, 'bull_use_atr': False, 'bull_use_adx': True, 'bull_use_spike': True, 'bull_rsi_required': False, 'bear_strategy': 'breakout', 'bear_bb_std_mult': 2.3820752644490018, 'bear_rsi_os': 45, 'bear_rsi_ob': 60, 'bear_adx_thresh': 24.6829522685205, 'bear_atr_min_pct': 0.02916159479903782, 'bear_atr_max_pct': 0.0284087223072083, 'bear_tp_mult': 1.6408423567052117, 'bear_tsl_mult': 0.7161311460824592, 'bear_time_stop': 59, 'bear_use_sma': False, 'bear_use_ema': True, 'bear_use_atr': False, 'bear_use_adx': False, 'bear_use_spike': True, 'bear_rsi_required': False, 'sideways_strategy': 'breakout', 'sideways_bb_std_mult': 3.537089604227937, 'sideways_rsi_os': 44, 'sideways_rsi_ob': 74, 'sideways_adx_thresh': 10.042711566656525, 'sideways_atr_min_pct': 0.004619142400606338, 'sideways_atr_max_pct': 0.028817231995450797, 'sideways_tp_mult': 2.283974585923694, 'sideways_tsl_mult': 0.8492134299001184, 'sideways_time_stop': 117, 'sideways_use_sma': True, 'sideways_use_ema': True, 'sideways_use_atr': True, 'sideways_use_adx': False, 'sideways_use_spike': True, 'sideways_rsi_required': True}.
[I 2025-09-01 03:10:09,289] Trial 289 finished with values: [-0.027562867965756577, 0.02739888422958035] and parameters: {'p_sma': 46, 'p_std': 55, 'p_atr': 17, 'p_adx': 19, 'rsi_period': 10, 'ema1': 20, 'ema2': 59, 'slip_atr_k': 0.06811834934889249, 'slip_spread_k': 0.17349798520261075, 'spread_hl_frac': 0.032541434881206706, 'bb_std_mult': 1.5565698625752535, 'rsi_os': 22, 'rsi_ob': 90, 'vol_spike': 0.22017920249137607, 'adx_thresh': 7.718540185278732, 'atr_min_pct': 0.007085886559100957, 'atr_max_pct': 0.05153717621634151, 'tp_mult': 2.6452125297245437, 'tsl_mult': 0.43809040582228115, 'strategy': 'mean_reversion', 'time_stop': 166, 'use_sma': False, 'use_atr': True, 'use_adx': True, 'use_ema': False, 'use_spike': False, 'rsi_required': True, 'edge_k': 0.061264051525513494, 'edge_cap': 0.4790922341470108, 'bull_strategy': 'breakout', 'bull_bb_std_mult': 1.136363986592801, 'bull_rsi_os': 30, 'bull_rsi_ob': 53, 'bull_adx_thresh': 15.289197612752929, 'bull_atr_min_pct': 0.0005559824192809039, 'bull_atr_max_pct': 0.03455802577419924, 'bull_tp_mult': 1.026129213769369, 'bull_tsl_mult': 0.19321876539718444, 'bull_time_stop': 280, 'bull_use_sma': True, 'bull_use_ema': False, 'bull_use_atr': True, 'bull_use_adx': True, 'bull_use_spike': True, 'bull_rsi_required': False, 'bear_strategy': 'breakout', 'bear_bb_std_mult': 2.3787217813343537, 'bear_rsi_os': 42, 'bear_rsi_ob': 60, 'bear_adx_thresh': 23.668269386175147, 'bear_atr_min_pct': 0.006274227792447127, 'bear_atr_max_pct': 0.029014732753777688, 'bear_tp_mult': 1.072615566257701, 'bear_tsl_mult': 0.11021178296472488, 'bear_time_stop': 122, 'bear_use_sma': False, 'bear_use_ema': True, 'bear_use_atr': False, 'bear_use_adx': False, 'bear_use_spike': False, 'bear_rsi_required': False, 'sideways_strategy': 'breakout', 'sideways_bb_std_mult': 3.5381648328764506, 'sideways_rsi_os': 44, 'sideways_rsi_ob': 77, 'sideways_adx_thresh': 21.49655873053465, 'sideways_atr_min_pct': 0.02427791165484805, 'sideways_atr_max_pct': 0.029719572874873434, 'sideways_tp_mult': 2.1717658162104274, 'sideways_tsl_mult': 0.19611071128842864, 'sideways_time_stop': 124, 'sideways_use_sma': True, 'sideways_use_ema': True, 'sideways_use_atr': True, 'sideways_use_adx': False, 'sideways_use_spike': False, 'sideways_rsi_required': True}.
[I 2025-09-01 03:10:48,277] Trial 290 finished with values: [-1000000000.0, 1000000000.0] and parameters: {'p_sma': 48, 'p_std': 55, 'p_atr': 29, 'p_adx': 16, 'rsi_period': 40, 'ema1': 23, 'ema2': 26, 'slip_atr_k': 0.005661125461525989, 'slip_spread_k': 0.17902250765853545, 'spread_hl_frac': 0.0009121939065315013, 'bb_std_mult': 2.4236268028107015, 'rsi_os': 22, 'rsi_ob': 54, 'vol_spike': 0.20034406764373344, 'adx_thresh': 7.965132664281993, 'atr_min_pct': 0.006885114482363079, 'atr_max_pct': 0.052366528888473415, 'tp_mult': 2.7043679380112446, 'tsl_mult': 0.39941168078984024, 'strategy': 'mean_reversion', 'time_stop': 151, 'use_sma': False, 'use_atr': True, 'use_adx': True, 'use_ema': False, 'use_spike': False, 'rsi_required': True, 'edge_k': 1.6637013977401724, 'edge_cap': 0.47592103460599877, 'bull_strategy': 'breakout', 'bull_bb_std_mult': 2.797361095240506, 'bull_rsi_os': 16, 'bull_rsi_ob': 52, 'bull_adx_thresh': 23.484662018280513, 'bull_atr_min_pct': 0.019294039084987266, 'bull_atr_max_pct': 0.06809762118017657, 'bull_tp_mult': 1.6134676557119911, 'bull_tsl_mult': 0.2500174459874437, 'bull_time_stop': 279, 'bull_use_sma': True, 'bull_use_ema': False, 'bull_use_atr': True, 'bull_use_adx': False, 'bull_use_spike': True, 'bull_rsi_required': False, 'bear_strategy': 'breakout', 'bear_bb_std_mult': 0.6732378093888869, 'bear_rsi_os': 29, 'bear_rsi_ob': 58, 'bear_adx_thresh': 33.26586607731374, 'bear_atr_min_pct': 0.028886911400784063, 'bear_atr_max_pct': 0.010230504201140803, 'bear_tp_mult': 1.8356747750351532, 'bear_tsl_mult': 0.14323562345450208, 'bear_time_stop': 103, 'bear_use_sma': False, 'bear_use_ema': False, 'bear_use_atr': False, 'bear_use_adx': False, 'bear_use_spike': False, 'bear_rsi_required': True, 'sideways_strategy': 'breakout', 'sideways_bb_std_mult': 1.8077577270073644, 'sideways_rsi_os': 44, 'sideways_rsi_ob': 90, 'sideways_adx_thresh': 14.478135185676887, 'sideways_atr_min_pct': 0.024758413053416452, 'sideways_atr_max_pct': 0.021052646479455588, 'sideways_tp_mult': 1.7227496297017035, 'sideways_tsl_mult': 0.8785719212378282, 'sideways_time_stop': 133, 'sideways_use_sma': True, 'sideways_use_ema': True, 'sideways_use_atr': True, 'sideways_use_adx': False, 'sideways_use_spike': False, 'sideways_rsi_required': True}.
[I 2025-09-01 03:10:48,459] Trial 293 finished with values: [-1000000000.0, 1000000000.0] and parameters: {'p_sma': 48, 'p_std': 21, 'p_atr': 13, 'p_adx': 14, 'rsi_period': 48, 'ema1': 23, 'ema2': 57, 'slip_atr_k': 0.0747071085913314, 'slip_spread_k': 0.535737354314784, 'spread_hl_frac': 0.031208873548736162, 'bb_std_mult': 2.588864248368341, 'rsi_os': 19, 'rsi_ob': 80, 'vol_spike': 0.21452257041448872, 'adx_thresh': 11.06625770823895, 'atr_min_pct': 0.011320159298814652, 'atr_max_pct': 0.04625154783041947, 'tp_mult': 1.687844415958176, 'tsl_mult': 0.32125450761969543, 'strategy': 'mean_reversion', 'time_stop': 158, 'use_sma': False, 'use_atr': False, 'use_adx': True, 'use_ema': False, 'use_spike': False, 'rsi_required': True, 'edge_k': 0.08811518066837579, 'edge_cap': 0.8189308843822911, 'bull_strategy': 'breakout', 'bull_bb_std_mult': 0.989562649354955, 'bull_rsi_os': 16, 'bull_rsi_ob': 94, 'bull_adx_thresh': 24.28101193993423, 'bull_atr_min_pct': 0.0026636169648043386, 'bull_atr_max_pct': 0.11708563269272461, 'bull_tp_mult': 1.6787288121559223, 'bull_tsl_mult': 0.2839676763680092, 'bull_time_stop': 289, 'bull_use_sma': True, 'bull_use_ema': False, 'bull_use_atr': True, 'bull_use_adx': False, 'bull_use_spike': True, 'bull_rsi_required': False, 'bear_strategy': 'breakout', 'bear_bb_std_mult': 2.1434861392389446, 'bear_rsi_os': 53, 'bear_rsi_ob': 58, 'bear_adx_thresh': 27.95383720974983, 'bear_atr_min_pct': 0.027659209517494125, 'bear_atr_max_pct': 0.021747277905004383, 'bear_tp_mult': 1.812580484548516, 'bear_tsl_mult': 0.13848606553184648, 'bear_time_stop': 279, 'bear_use_sma': False, 'bear_use_ema': False, 'bear_use_atr': False, 'bear_use_adx': False, 'bear_use_spike': False, 'bear_rsi_required': True, 'sideways_strategy': 'breakout', 'sideways_bb_std_mult': 3.4309462104299233, 'sideways_rsi_os': 5, 'sideways_rsi_ob': 77, 'sideways_adx_thresh': 27.933740019864857, 'sideways_atr_min_pct': 0.02834317788045682, 'sideways_atr_max_pct': 0.020266553131353022, 'sideways_tp_mult': 1.6203798597314985, 'sideways_tsl_mult': 0.4398646502053591, 'sideways_time_stop': 106, 'sideways_use_sma': True, 'sideways_use_ema': True, 'sideways_use_atr': True, 'sideways_use_adx': False, 'sideways_use_spike': False, 'sideways_rsi_required': True}.
[I 2025-09-01 03:10:48,652] Trial 291 finished with values: [-1000000000.0, 1000000000.0] and parameters: {'p_sma': 50, 'p_std': 22, 'p_atr': 27, 'p_adx': 16, 'rsi_period': 48, 'ema1': 20, 'ema2': 59, 'slip_atr_k': 0.021123510221355998, 'slip_spread_k': 0.029510841794875786, 'spread_hl_frac': 0.04167647464896378, 'bb_std_mult': 1.5320422489522585, 'rsi_os': 19, 'rsi_ob': 79, 'vol_spike': 0.20035656058685347, 'adx_thresh': 14.399054033073353, 'atr_min_pct': 0.008690472028647984, 'atr_max_pct': 0.07071707335532863, 'tp_mult': 1.3153662707095601, 'tsl_mult': 0.4085744681272988, 'strategy': 'mean_reversion', 'time_stop': 152, 'use_sma': False, 'use_atr': False, 'use_adx': True, 'use_ema': False, 'use_spike': False, 'rsi_required': True, 'edge_k': 0.0006922574848023527, 'edge_cap': 0.7311174073873407, 'bull_strategy': 'breakout', 'bull_bb_std_mult': 1.0010188641233249, 'bull_rsi_os': 16, 'bull_rsi_ob': 52, 'bull_adx_thresh': 22.524265165228115, 'bull_atr_min_pct': 0.02075403262683261, 'bull_atr_max_pct': 0.11744923230459414, 'bull_tp_mult': 1.5967876134843033, 'bull_tsl_mult': 0.8538545086130184, 'bull_time_stop': 244, 'bull_use_sma': True, 'bull_use_ema': False, 'bull_use_atr': True, 'bull_use_adx': False, 'bull_use_spike': True, 'bull_rsi_required': False, 'bear_strategy': 'breakout', 'bear_bb_std_mult': 0.6831815760007138, 'bear_rsi_os': 29, 'bear_rsi_ob': 58, 'bear_adx_thresh': 23.426562356906217, 'bear_atr_min_pct': 0.0013068803837093575, 'bear_atr_max_pct': 0.010418503517894978, 'bear_tp_mult': 1.8925925396492775, 'bear_tsl_mult': 0.18109410050239563, 'bear_time_stop': 59, 'bear_use_sma': False, 'bear_use_ema': False, 'bear_use_atr': False, 'bear_use_adx': False, 'bear_use_spike': False, 'bear_rsi_required': True, 'sideways_strategy': 'breakout', 'sideways_bb_std_mult': 1.7463617799189273, 'sideways_rsi_os': 31, 'sideways_rsi_ob': 77, 'sideways_adx_thresh': 21.405874396766457, 'sideways_atr_min_pct': 0.028512613369181157, 'sideways_atr_max_pct': 0.02018138503822898, 'sideways_tp_mult': 1.6233268800677523, 'sideways_tsl_mult': 0.8501213142598145, 'sideways_time_stop': 228, 'sideways_use_sma': True, 'sideways_use_ema': True, 'sideways_use_atr': True, 'sideways_use_adx': False, 'sideways_use_spike': False, 'sideways_rsi_required': True}.
[I 2025-09-01 03:10:48,880] Trial 292 finished with values: [-0.07615147115444487, 0.07570090675964405] and parameters: {'p_sma': 49, 'p_std': 60, 'p_atr': 11, 'p_adx': 14, 'rsi_period': 8, 'ema1': 20, 'ema2': 57, 'slip_atr_k': 0.022376437970888195, 'slip_spread_k': 0.11154070569173934, 'spread_hl_frac': 0.027059598066259603, 'bb_std_mult': 1.2373354267833467, 'rsi_os': 22, 'rsi_ob': 80, 'vol_spike': 0.22164178300709214, 'adx_thresh': 9.1072851050215, 'atr_min_pct': 0.005716135581917801, 'atr_max_pct': 0.1463771955052866, 'tp_mult': 2.7196202144778026, 'tsl_mult': 0.3187226128648346, 'strategy': 'mean_reversion', 'time_stop': 150, 'use_sma': False, 'use_atr': False, 'use_adx': True, 'use_ema': False, 'use_spike': False, 'rsi_required': True, 'edge_k': 0.0701443128108706, 'edge_cap': 0.670119625849072, 'bull_strategy': 'breakout', 'bull_bb_std_mult': 0.9920028755765717, 'bull_rsi_os': 16, 'bull_rsi_ob': 52, 'bull_adx_thresh': 33.56841796123034, 'bull_atr_min_pct': 0.020994082434411702, 'bull_atr_max_pct': 0.10309598022362045, 'bull_tp_mult': 1.6177199168055754, 'bull_tsl_mult': 0.29195107956045835, 'bull_time_stop': 288, 'bull_use_sma': True, 'bull_use_ema': False, 'bull_use_atr': True, 'bull_use_adx': False, 'bull_use_spike': True, 'bull_rsi_required': False, 'bear_strategy': 'breakout', 'bear_bb_std_mult': 0.5540258057981742, 'bear_rsi_os': 42, 'bear_rsi_ob': 58, 'bear_adx_thresh': 23.14361988521659, 'bear_atr_min_pct': 0.0012766957417060156, 'bear_atr_max_pct': 0.03407372516761598, 'bear_tp_mult': 1.0573813730342199, 'bear_tsl_mult': 0.8311174716897173, 'bear_time_stop': 274, 'bear_use_sma': False, 'bear_use_ema': False, 'bear_use_atr': False, 'bear_use_adx': False, 'bear_use_spike': False, 'bear_rsi_required': True, 'sideways_strategy': 'breakout', 'sideways_bb_std_mult': 1.7480458122277494, 'sideways_rsi_os': 31, 'sideways_rsi_ob': 77, 'sideways_adx_thresh': 20.29913618510034, 'sideways_atr_min_pct': 0.02855580540557358, 'sideways_atr_max_pct': 0.020565590601433283, 'sideways_tp_mult': 1.6537764590271238, 'sideways_tsl_mult': 0.19528637152995731, 'sideways_time_stop': 108, 'sideways_use_sma': True, 'sideways_use_ema': True, 'sideways_use_atr': True, 'sideways_use_adx': False, 'sideways_use_spike': False, 'sideways_rsi_required': True}.
[I 2025-09-01 03:11:34,526] Trial 297 finished with values: [-0.17874996582699332, 0.1785900703381261] and parameters: {'p_sma': 54, 'p_std': 16, 'p_atr': 28, 'p_adx': 22, 'rsi_period': 12, 'ema1': 21, 'ema2': 49, 'slip_atr_k': 0.006818313186033778, 'slip_spread_k': 0.12800819184742823, 'spread_hl_frac': 0.026123535640047074, 'bb_std_mult': 1.4566855792471067, 'rsi_os': 16, 'rsi_ob': 69, 'vol_spike': 0.21080177927281085, 'adx_thresh': 17.52352196704521, 'atr_min_pct': 0.010512479717508637, 'atr_max_pct': 0.04857114822542798, 'tp_mult': 2.7585810826280976, 'tsl_mult': 0.5052377458408261, 'strategy': 'mean_reversion', 'time_stop': 101, 'use_sma': False, 'use_atr': False, 'use_adx': True, 'use_ema': True, 'use_spike': True, 'rsi_required': False, 'edge_k': 0.8025352494949248, 'edge_cap': 0.4470659562170701, 'bull_strategy': 'breakout', 'bull_bb_std_mult': 1.5451282364868768, 'bull_rsi_os': 13, 'bull_rsi_ob': 56, 'bull_adx_thresh': 25.833842914425134, 'bull_atr_min_pct': 0.024297702795755202, 'bull_atr_max_pct': 0.03914909201914187, 'bull_tp_mult': 2.4212783899589096, 'bull_tsl_mult': 0.9045724914853799, 'bull_time_stop': 268, 'bull_use_sma': True, 'bull_use_ema': True, 'bull_use_atr': False, 'bull_use_adx': False, 'bull_use_spike': False, 'bull_rsi_required': False, 'bear_strategy': 'mean_reversion', 'bear_bb_std_mult': 1.3292452365619498, 'bear_rsi_os': 13, 'bear_rsi_ob': 47, 'bear_adx_thresh': 9.548189688734126, 'bear_atr_min_pct': 0.025958301168409106, 'bear_atr_max_pct': 0.02340159202970143, 'bear_tp_mult': 2.0823097290074917, 'bear_tsl_mult': 0.09018827336260463, 'bear_time_stop': 79, 'bear_use_sma': True, 'bear_use_ema': False, 'bear_use_atr': True, 'bear_use_adx': False, 'bear_use_spike': True, 'bear_rsi_required': True, 'sideways_strategy': 'mean_reversion', 'sideways_bb_std_mult': 0.6946701521079286, 'sideways_rsi_os': 50, 'sideways_rsi_ob': 50, 'sideways_adx_thresh': 23.04023018458368, 'sideways_atr_min_pct': 0.0010567244406518815, 'sideways_atr_max_pct': 0.05910485336326603, 'sideways_tp_mult': 2.0010169746739424, 'sideways_tsl_mult': 0.23604926926508496, 'sideways_time_stop': 125, 'sideways_use_sma': True, 'sideways_use_ema': False, 'sideways_use_atr': False, 'sideways_use_adx': False, 'sideways_use_spike': True, 'sideways_rsi_required': True}.
[I 2025-09-01 03:11:35,278] Trial 296 finished with values: [-1000000000.0, 1000000000.0] and parameters: {'p_sma': 53, 'p_std': 60, 'p_atr': 28, 'p_adx': 28, 'rsi_period': 8, 'ema1': 21, 'ema2': 21, 'slip_atr_k': 0.00897963695806942, 'slip_spread_k': 0.11418619943867007, 'spread_hl_frac': 0.02190885912172132, 'bb_std_mult': 1.4411435675756004, 'rsi_os': 24, 'rsi_ob': 69, 'vol_spike': 0.2440036941612455, 'adx_thresh': 9.044672214386518, 'atr_min_pct': 0.007921647673990635, 'atr_max_pct': 0.04975350262434547, 'tp_mult': 2.7133011732253998, 'tsl_mult': 0.15632486446278293, 'strategy': 'mean_reversion', 'time_stop': 183, 'use_sma': False, 'use_atr': False, 'use_adx': True, 'use_ema': False, 'use_spike': True, 'rsi_required': False, 'edge_k': 0.14723592945696046, 'edge_cap': 0.4427509453076833, 'bull_strategy': 'breakout', 'bull_bb_std_mult': 1.2554981996441514, 'bull_rsi_os': 14, 'bull_rsi_ob': 56, 'bull_adx_thresh': 24.756875958283622, 'bull_atr_min_pct': 0.00056086347829764, 'bull_atr_max_pct': 0.057791360318025425, 'bull_tp_mult': 1.489420977495104, 'bull_tsl_mult': 0.2869075343598219, 'bull_time_stop': 265, 'bull_use_sma': True, 'bull_use_ema': True, 'bull_use_atr': False, 'bull_use_adx': False, 'bull_use_spike': False, 'bull_rsi_required': False, 'bear_strategy': 'mean_reversion', 'bear_bb_std_mult': 0.5026989467565166, 'bear_rsi_os': 32, 'bear_rsi_ob': 62, 'bear_adx_thresh': 24.04423107180395, 'bear_atr_min_pct': 0.028044926614609, 'bear_atr_max_pct': 0.0367464822587768, 'bear_tp_mult': 1.1207153601376423, 'bear_tsl_mult': 0.15449977727978842, 'bear_time_stop': 78, 'bear_use_sma': True, 'bear_use_ema': False, 'bear_use_atr': False, 'bear_use_adx': False, 'bear_use_spike': True, 'bear_rsi_required': True, 'sideways_strategy': 'mean_reversion', 'sideways_bb_std_mult': 1.9867635438490878, 'sideways_rsi_os': 48, 'sideways_rsi_ob': 65, 'sideways_adx_thresh': 7.192608577833438, 'sideways_atr_min_pct': 0.023110677684989187, 'sideways_atr_max_pct': 0.02434185658910249, 'sideways_tp_mult': 1.985630344304011, 'sideways_tsl_mult': 0.17315774823177338, 'sideways_time_stop': 126, 'sideways_use_sma': True, 'sideways_use_ema': True, 'sideways_use_atr': False, 'sideways_use_adx': False, 'sideways_use_spike': True, 'sideways_rsi_required': True}.
[I 2025-09-01 03:11:35,284] Trial 295 finished with values: [-1000000000.0, 1000000000.0] and parameters: {'p_sma': 53, 'p_std': 60, 'p_atr': 16, 'p_adx': 28, 'rsi_period': 19, 'ema1': 21, 'ema2': 56, 'slip_atr_k': 0.021284111161454747, 'slip_spread_k': 0.11502731038306466, 'spread_hl_frac': 0.026638275755701293, 'bb_std_mult': 1.438924066825644, 'rsi_os': 38, 'rsi_ob': 81, 'vol_spike': 0.05695048623971083, 'adx_thresh': 18.457687600725663, 'atr_min_pct': 0.006097062799890376, 'atr_max_pct': 0.05552050003393825, 'tp_mult': 2.727726448197999, 'tsl_mult': 0.5067360894314838, 'strategy': 'mean_reversion', 'time_stop': 182, 'use_sma': False, 'use_atr': False, 'use_adx': True, 'use_ema': False, 'use_spike': True, 'rsi_required': False, 'edge_k': 0.8074793904017434, 'edge_cap': 0.446114826452014, 'bull_strategy': 'breakout', 'bull_bb_std_mult': 1.244002519487836, 'bull_rsi_os': 14, 'bull_rsi_ob': 73, 'bull_adx_thresh': 16.731231140713263, 'bull_atr_min_pct': 0.02080389548076656, 'bull_atr_max_pct': 0.10354052017428213, 'bull_tp_mult': 2.1575025783620014, 'bull_tsl_mult': 0.8537204978270578, 'bull_time_stop': 271, 'bull_use_sma': True, 'bull_use_ema': True, 'bull_use_atr': False, 'bull_use_adx': False, 'bull_use_spike': False, 'bull_rsi_required': False, 'bear_strategy': 'mean_reversion', 'bear_bb_std_mult': 0.5023272252084887, 'bear_rsi_os': 50, 'bear_rsi_ob': 79, 'bear_adx_thresh': 24.040079991963427, 'bear_atr_min_pct': 0.025822363208792828, 'bear_atr_max_pct': 0.03471563020710642, 'bear_tp_mult': 1.904940077074215, 'bear_tsl_mult': 0.18207646786428416, 'bear_time_stop': 69, 'bear_use_sma': True, 'bear_use_ema': False, 'bear_use_atr': False, 'bear_use_adx': False, 'bear_use_spike': True, 'bear_rsi_required': True, 'sideways_strategy': 'mean_reversion', 'sideways_bb_std_mult': 1.754365131993816, 'sideways_rsi_os': 38, 'sideways_rsi_ob': 65, 'sideways_adx_thresh': 17.818906287866596, 'sideways_atr_min_pct': 0.001033411882446567, 'sideways_atr_max_pct': 0.058890525388282725, 'sideways_tp_mult': 1.6569975397476324, 'sideways_tsl_mult': 0.10060474820834381, 'sideways_time_stop': 88, 'sideways_use_sma': True, 'sideways_use_ema': True, 'sideways_use_atr': False, 'sideways_use_adx': False, 'sideways_use_spike': True, 'sideways_rsi_required': True}.
