[I 2025-09-01 03:20:45,788] Trial 353 finished with values: [-1000000000.0, 1000000000.0] and parameters: {'p_sma': 30, 'p_std': 57, 'p_atr': 18, 'p_adx': 17, 'rsi_period': 28, 'ema1': 28, 'ema2': 20, 'slip_atr_k': 0.014705691083623441, 'slip_spread_k': 0.1542817375922883, 'spread_hl_frac': 0.027808046931292803, 'bb_std_mult': 1.759881603914129, 'rsi_os': 20, 'rsi_ob': 77, 'vol_spike': 0.09492084890789701, 'adx_thresh': 14.137800339739247, 'atr_min_pct': 0.009380704898834698, 'atr_max_pct': 0.044075582533765596, 'tp_mult': 1.4063040013053323, 'tsl_mult': 0.49213994122531707, 'strategy': 'breakout', 'time_stop': 172, 'use_sma': False, 'use_atr': True, 'use_adx': False, 'use_ema': True, 'use_spike': False, 'rsi_required': True, 'edge_k': 0.11212159873363317, 'edge_cap': 0.2578989633289534, 'bull_strategy': 'breakout', 'bull_bb_std_mult': 1.4906021674832175, 'bull_rsi_os': 16, 'bull_rsi_ob': 51, 'bull_adx_thresh': 24.423566556078683, 'bull_atr_min_pct': 0.002592361930238039, 'bull_atr_max_pct': 0.12201332620008262, 'bull_tp_mult': 1.6567784605824494, 'bull_tsl_mult': 0.2111254173016374, 'bull_time_stop': 202, 'bull_use_sma': True, 'bull_use_ema': False, 'bull_use_atr': True, 'bull_use_adx': False, 'bull_use_spike': False, 'bull_rsi_required': True, 'bear_strategy': 'breakout', 'bear_bb_std_mult': 2.298719728628056, 'bear_rsi_os': 14, 'bear_rsi_ob': 85, 'bear_adx_thresh': 26.1746569275681, 'bear_atr_min_pct': 0.007970617191336592, 'bear_atr_max_pct': 0.10562639149778362, 'bear_tp_mult': 1.1759626658406341, 'bear_tsl_mult': 0.12164700677760266, 'bear_time_stop': 50, 'bear_use_sma': True, 'bear_use_ema': True, 'bear_use_atr': True, 'bear_use_adx': True, 'bear_use_spike': False, 'bear_rsi_required': False, 'sideways_strategy': 'breakout', 'sideways_bb_std_mult': 2.6498528132401424, 'sideways_rsi_os': 53, 'sideways_rsi_ob': 73, 'sideways_adx_thresh': 13.201676208426164, 'sideways_atr_min_pct': 0.028486370558328627, 'sideways_atr_max_pct': 0.0282744533076326, 'sideways_tp_mult': 1.6902062969576763, 'sideways_tsl_mult': 0.4392859233016403, 'sideways_time_stop': 143, 'sideways_use_sma': False, 'sideways_use_ema': False, 'sideways_use_atr': False, 'sideways_use_adx': False, 'sideways_use_spike': False, 'sideways_rsi_required': False}.
[I 2025-09-01 03:20:46,181] Trial 352 finished with values: [-1000000000.0, 1000000000.0] and parameters: {'p_sma': 35, 'p_std': 36, 'p_atr': 28, 'p_adx': 11, 'rsi_period': 27, 'ema1': 28, 'ema2': 57, 'slip_atr_k': 0.018961979932033902, 'slip_spread_k': 0.1525883399023541, 'spread_hl_frac': 0.03067022067595599, 'bb_std_mult': 1.5023415221808847, 'rsi_os': 22, 'rsi_ob': 54, 'vol_spike': 0.208850013340566, 'adx_thresh': 12.331423221463309, 'atr_min_pct': 0.011760774392027887, 'atr_max_pct': 0.043904337550643116, 'tp_mult': 1.6263210841046387, 'tsl_mult': 0.18421897396994164, 'strategy': 'breakout', 'time_stop': 175, 'use_sma': False, 'use_atr': True, 'use_adx': False, 'use_ema': True, 'use_spike': False, 'rsi_required': True, 'edge_k': 0.12739156926023829, 'edge_cap': 0.9606408892207233, 'bull_strategy': 'breakout', 'bull_bb_std_mult': 1.1136852189349424, 'bull_rsi_os': 49, 'bull_rsi_ob': 49, 'bull_adx_thresh': 24.171317525234468, 'bull_atr_min_pct': 0.00238291064339321, 'bull_atr_max_pct': 0.12164896347929287, 'bull_tp_mult': 1.6499777763048131, 'bull_tsl_mult': 0.2771621862760128, 'bull_time_stop': 227, 'bull_use_sma': True, 'bull_use_ema': False, 'bull_use_atr': True, 'bull_use_adx': False, 'bull_use_spike': False, 'bull_rsi_required': True, 'bear_strategy': 'breakout', 'bear_bb_std_mult': 2.3115655476045114, 'bear_rsi_os': 52, 'bear_rsi_ob': 85, 'bear_adx_thresh': 26.10261313585173, 'bear_atr_min_pct': 0.024443826960878528, 'bear_atr_max_pct': 0.028556942181968338, 'bear_tp_mult': 1.3654123045075623, 'bear_tsl_mult': 0.5524641873406722, 'bear_time_stop': 256, 'bear_use_sma': True, 'bear_use_ema': True, 'bear_use_atr': True, 'bear_use_adx': True, 'bear_use_spike': False, 'bear_rsi_required': False, 'sideways_strategy': 'breakout', 'sideways_bb_std_mult': 1.8102722343854694, 'sideways_rsi_os': 53, 'sideways_rsi_ob': 66, 'sideways_adx_thresh': 16.913695230186597, 'sideways_atr_min_pct': 0.028219508108175424, 'sideways_atr_max_pct': 0.06552650299522955, 'sideways_tp_mult': 2.932453575803849, 'sideways_tsl_mult': 0.2614934840085451, 'sideways_time_stop': 102, 'sideways_use_sma': False, 'sideways_use_ema': False, 'sideways_use_atr': False, 'sideways_use_adx': False, 'sideways_use_spike': False, 'sideways_rsi_required': False}.
[I 2025-09-01 03:20:46,663] Trial 354 finished with values: [-1000000000.0, 1000000000.0] and parameters: {'p_sma': 35, 'p_std': 59, 'p_atr': 29, 'p_adx': 11, 'rsi_period': 78, 'ema1': 22, 'ema2': 21, 'slip_atr_k': 0.015997149692295112, 'slip_spread_k': 0.6864021690608919, 'spread_hl_frac': 0.003325353619253086, 'bb_std_mult': 1.3166670875949327, 'rsi_os': 22, 'rsi_ob': 55, 'vol_spike': 0.2081316470363146, 'adx_thresh': 7.142949756189345, 'atr_min_pct': 0.009482988778616995, 'atr_max_pct': 0.019974770982086262, 'tp_mult': 2.8601620158988563, 'tsl_mult': 0.9246723560963277, 'strategy': 'breakout', 'time_stop': 175, 'use_sma': False, 'use_atr': True, 'use_adx': False, 'use_ema': True, 'use_spike': False, 'rsi_required': True, 'edge_k': 1.392563407856441, 'edge_cap': 0.40486795058253233, 'bull_strategy': 'breakout', 'bull_bb_std_mult': 1.4899108487922237, 'bull_rsi_os': 15, 'bull_rsi_ob': 51, 'bull_adx_thresh': 34.59295474974572, 'bull_atr_min_pct': 0.014570749834220043, 'bull_atr_max_pct': 0.08423707452824616, 'bull_tp_mult': 2.1293493479593844, 'bull_tsl_mult': 0.27961819519178815, 'bull_time_stop': 276, 'bull_use_sma': True, 'bull_use_ema': True, 'bull_use_atr': True, 'bull_use_adx': False, 'bull_use_spike': False, 'bull_rsi_required': True, 'bear_strategy': 'mean_reversion', 'bear_bb_std_mult': 3.3334413222616206, 'bear_rsi_os': 52, 'bear_rsi_ob': 77, 'bear_adx_thresh': 17.582708438781047, 'bear_atr_min_pct': 0.026300308277491653, 'bear_atr_max_pct': 0.03576951303553648, 'bear_tp_mult': 1.1652414702482128, 'bear_tsl_mult': 0.24497121261845844, 'bear_time_stop': 63, 'bear_use_sma': True, 'bear_use_ema': True, 'bear_use_atr': True, 'bear_use_adx': True, 'bear_use_spike': False, 'bear_rsi_required': False, 'sideways_strategy': 'breakout', 'sideways_bb_std_mult': 1.7937861322484139, 'sideways_rsi_os': 53, 'sideways_rsi_ob': 73, 'sideways_adx_thresh': 6.439889346607094, 'sideways_atr_min_pct': 0.008841056937426563, 'sideways_atr_max_pct': 0.13311287477827372, 'sideways_tp_mult': 2.1215885290366887, 'sideways_tsl_mult': 0.46128343372165787, 'sideways_time_stop': 241, 'sideways_use_sma': False, 'sideways_use_ema': False, 'sideways_use_atr': False, 'sideways_use_adx': False, 'sideways_use_spike': False, 'sideways_rsi_required': False}.
[I 2025-09-01 03:20:47,214] Trial 351 finished with values: [-1000000000.0, 1000000000.0] and parameters: {'p_sma': 30, 'p_std': 49, 'p_atr': 28, 'p_adx': 11, 'rsi_period': 65, 'ema1': 22, 'ema2': 58, 'slip_atr_k': 0.18916207974931223, 'slip_spread_k': 0.6873785531161177, 'spread_hl_frac': 0.031198958636698047, 'bb_std_mult': 1.7039577098625165, 'rsi_os': 20, 'rsi_ob': 85, 'vol_spike': 0.20221587381949818, 'adx_thresh': 32.79609666504719, 'atr_min_pct': 0.009512655424304284, 'atr_max_pct': 0.045258350975139604, 'tp_mult': 1.45552041156937, 'tsl_mult': 0.29852595169965995, 'strategy': 'mean_reversion', 'time_stop': 172, 'use_sma': False, 'use_atr': False, 'use_adx': True, 'use_ema': False, 'use_spike': True, 'rsi_required': False, 'edge_k': 1.5395583500294858, 'edge_cap': 0.401901447166764, 'bull_strategy': 'breakout', 'bull_bb_std_mult': 1.2169635796057063, 'bull_rsi_os': 19, 'bull_rsi_ob': 56, 'bull_adx_thresh': 7.5715534349252, 'bull_atr_min_pct': 0.014498041175991893, 'bull_atr_max_pct': 0.12160224492242619, 'bull_tp_mult': 1.6587711157431881, 'bull_tsl_mult': 0.15090792194043642, 'bull_time_stop': 200, 'bull_use_sma': True, 'bull_use_ema': False, 'bull_use_atr': False, 'bull_use_adx': False, 'bull_use_spike': True, 'bull_rsi_required': False, 'bear_strategy': 'breakout', 'bear_bb_std_mult': 1.9842601004033944, 'bear_rsi_os': 16, 'bear_rsi_ob': 60, 'bear_adx_thresh': 26.045541236546825, 'bear_atr_min_pct': 0.02835953994898341, 'bear_atr_max_pct': 0.03572762012573174, 'bear_tp_mult': 1.3686152615119607, 'bear_tsl_mult': 0.24140683999772167, 'bear_time_stop': 50, 'bear_use_sma': True, 'bear_use_ema': False, 'bear_use_atr': False, 'bear_use_adx': False, 'bear_use_spike': True, 'bear_rsi_required': True, 'sideways_strategy': 'mean_reversion', 'sideways_bb_std_mult': 3.1801431742351856, 'sideways_rsi_os': 53, 'sideways_rsi_ob': 88, 'sideways_adx_thresh': 23.180884959024052, 'sideways_atr_min_pct': 0.005824408324719832, 'sideways_atr_max_pct': 0.10108756630613618, 'sideways_tp_mult': 1.7437426881518046, 'sideways_tsl_mult': 0.13376232402219693, 'sideways_time_stop': 126, 'sideways_use_sma': True, 'sideways_use_ema': True, 'sideways_use_atr': False, 'sideways_use_adx': False, 'sideways_use_spike': True, 'sideways_rsi_required': False}.
[I 2025-09-01 03:21:28,159] Trial 356 finished with values: [-1000000000.0, 1000000000.0] and parameters: {'p_sma': 28, 'p_std': 49, 'p_atr': 29, 'p_adx': 24, 'rsi_period': 14, 'ema1': 20, 'ema2': 56, 'slip_atr_k': 0.03211258826769628, 'slip_spread_k': 0.20556962690470107, 'spread_hl_frac': 0.029443302888517545, 'bb_std_mult': 2.697739903188592, 'rsi_os': 22, 'rsi_ob': 81, 'vol_spike': 0.26393819711235766, 'adx_thresh': 7.104699188955154, 'atr_min_pct': 0.006282211082534864, 'atr_max_pct': 0.14433750090554553, 'tp_mult': 2.644074641383641, 'tsl_mult': 0.3570616345872554, 'strategy': 'mean_reversion', 'time_stop': 5, 'use_sma': True, 'use_atr': False, 'use_adx': True, 'use_ema': False, 'use_spike': True, 'rsi_required': False, 'edge_k': 1.335797157526842, 'edge_cap': 0.3698467790627761, 'bull_strategy': 'breakout', 'bull_bb_std_mult': 1.13402362254105, 'bull_rsi_os': 16, 'bull_rsi_ob': 53, 'bull_adx_thresh': 34.941005806443854, 'bull_atr_min_pct': 0.012883941757798303, 'bull_atr_max_pct': 0.11420707391177644, 'bull_tp_mult': 2.5377271288116066, 'bull_tsl_mult': 0.25297133875686156, 'bull_time_stop': 279, 'bull_use_sma': True, 'bull_use_ema': True, 'bull_use_atr': False, 'bull_use_adx': False, 'bull_use_spike': True, 'bull_rsi_required': False, 'bear_strategy': 'mean_reversion', 'bear_bb_std_mult': 2.2476647874604807, 'bear_rsi_os': 53, 'bear_rsi_ob': 60, 'bear_adx_thresh': 24.44582855971537, 'bear_atr_min_pct': 0.026092677129108136, 'bear_atr_max_pct': 0.10971004414874294, 'bear_tp_mult': 1.010885574918692, 'bear_tsl_mult': 0.04442076767881095, 'bear_time_stop': 94, 'bear_use_sma': False, 'bear_use_ema': False, 'bear_use_atr': False, 'bear_use_adx': False, 'bear_use_spike': True, 'bear_rsi_required': True, 'sideways_strategy': 'breakout', 'sideways_bb_std_mult': 3.047447424008926, 'sideways_rsi_os': 41, 'sideways_rsi_ob': 87, 'sideways_adx_thresh': 6.274157962967534, 'sideways_atr_min_pct': 0.02745197738697213, 'sideways_atr_max_pct': 0.1321308994680408, 'sideways_tp_mult': 1.6023838280025724, 'sideways_tsl_mult': 0.02747956385218664, 'sideways_time_stop': 193, 'sideways_use_sma': True, 'sideways_use_ema': True, 'sideways_use_atr': True, 'sideways_use_adx': False, 'sideways_use_spike': True, 'sideways_rsi_required': True}.
[I 2025-09-01 03:21:28,932] Trial 358 finished with values: [-1000000000.0, 1000000000.0] and parameters: {'p_sma': 15, 'p_std': 58, 'p_atr': 26, 'p_adx': 16, 'rsi_period': 12, 'ema1': 10, 'ema2': 56, 'slip_atr_k': 0.004352526439050888, 'slip_spread_k': 0.5002554639750652, 'spread_hl_frac': 0.0358623125679701, 'bb_std_mult': 3.060079810007532, 'rsi_os': 24, 'rsi_ob': 81, 'vol_spike': 0.27460564878368976, 'adx_thresh': 16.179025873401923, 'atr_min_pct': 0.008432266030651727, 'atr_max_pct': 0.06417982751278671, 'tp_mult': 2.6577072195820506, 'tsl_mult': 0.4671193235793546, 'strategy': 'mean_reversion', 'time_stop': 187, 'use_sma': True, 'use_atr': False, 'use_adx': True, 'use_ema': False, 'use_spike': True, 'rsi_required': False, 'edge_k': 1.9066561551459211, 'edge_cap': 0.3667569219232312, 'bull_strategy': 'breakout', 'bull_bb_std_mult': 3.2080757153000885, 'bull_rsi_os': 16, 'bull_rsi_ob': 53, 'bull_adx_thresh': 15.00071498608062, 'bull_atr_min_pct': 0.006799308760538083, 'bull_atr_max_pct': 0.1337857157910983, 'bull_tp_mult': 2.7049618573395326, 'bull_tsl_mult': 0.8289155854559046, 'bull_time_stop': 111, 'bull_use_sma': False, 'bull_use_ema': True, 'bull_use_atr': False, 'bull_use_adx': False, 'bull_use_spike': True, 'bull_rsi_required': False, 'bear_strategy': 'mean_reversion', 'bear_bb_std_mult': 2.4445843299948917, 'bear_rsi_os': 46, 'bear_rsi_ob': 58, 'bear_adx_thresh': 24.28546915999814, 'bear_atr_min_pct': 0.01797934768040877, 'bear_atr_max_pct': 0.08937435402289298, 'bear_tp_mult': 1.7746821121605392, 'bear_tsl_mult': 0.13830713375041265, 'bear_time_stop': 70, 'bear_use_sma': False, 'bear_use_ema': False, 'bear_use_atr': False, 'bear_use_adx': False, 'bear_use_spike': True, 'bear_rsi_required': True, 'sideways_strategy': 'breakout', 'sideways_bb_std_mult': 1.8577067241507614, 'sideways_rsi_os': 49, 'sideways_rsi_ob': 75, 'sideways_adx_thresh': 25.395804101360433, 'sideways_atr_min_pct': 0.027556683449629204, 'sideways_atr_max_pct': 0.03132223335857915, 'sideways_tp_mult': 1.612187561392123, 'sideways_tsl_mult': 0.15263454488698117, 'sideways_time_stop': 136, 'sideways_use_sma': True, 'sideways_use_ema': True, 'sideways_use_atr': True, 'sideways_use_adx': False, 'sideways_use_spike': True, 'sideways_rsi_required': True}.
[I 2025-09-01 03:21:29,164] Trial 355 finished with values: [-1000000000.0, 1000000000.0] and parameters: {'p_sma': 12, 'p_std': 59, 'p_atr': 28, 'p_adx': 11, 'rsi_period': 11, 'ema1': 21, 'ema2': 56, 'slip_atr_k': 0.018184521980747544, 'slip_spread_k': 0.8704198047925522, 'spread_hl_frac': 0.03059720900772956, 'bb_std_mult': 0.9659891920306638, 'rsi_os': 22, 'rsi_ob': 85, 'vol_spike': 0.20771718612877943, 'adx_thresh': 7.265204184542112, 'atr_min_pct': 0.0060974700744484325, 'atr_max_pct': 0.018921183272448815, 'tp_mult': 1.6190225628627282, 'tsl_mult': 0.8142499391558395, 'strategy': 'mean_reversion', 'time_stop': 186, 'use_sma': True, 'use_atr': False, 'use_adx': True, 'use_ema': False, 'use_spike': True, 'rsi_required': False, 'edge_k': 0.1345945793378787, 'edge_cap': 0.07304065610531335, 'bull_strategy': 'breakout', 'bull_bb_std_mult': 1.1164625288313976, 'bull_rsi_os': 40, 'bull_rsi_ob': 55, 'bull_adx_thresh': 14.958153553033256, 'bull_atr_min_pct': 0.014584351277543869, 'bull_atr_max_pct': 0.13341143526053714, 'bull_tp_mult': 1.3193600029885106, 'bull_tsl_mult': 0.27663759667724325, 'bull_time_stop': 225, 'bull_use_sma': True, 'bull_use_ema': True, 'bull_use_atr': False, 'bull_use_adx': False, 'bull_use_spike': True, 'bull_rsi_required': False, 'bear_strategy': 'mean_reversion', 'bear_bb_std_mult': 3.4354630174226783, 'bear_rsi_os': 52, 'bear_rsi_ob': 60, 'bear_adx_thresh': 24.325103593497804, 'bear_atr_min_pct': 0.02601158363821022, 'bear_atr_max_pct': 0.03526258402787732, 'bear_tp_mult': 1.23800310388414, 'bear_tsl_mult': 0.045059843158345214, 'bear_time_stop': 62, 'bear_use_sma': True, 'bear_use_ema': False, 'bear_use_atr': False, 'bear_use_adx': False, 'bear_use_spike': True, 'bear_rsi_required': True, 'sideways_strategy': 'breakout', 'sideways_bb_std_mult': 1.7729228242206267, 'sideways_rsi_os': 40, 'sideways_rsi_ob': 71, 'sideways_adx_thresh': 18.872504889844762, 'sideways_atr_min_pct': 0.027982957242304703, 'sideways_atr_max_pct': 0.0249151295281206, 'sideways_tp_mult': 2.953756761444062, 'sideways_tsl_mult': 0.14614592608001573, 'sideways_time_stop': 191, 'sideways_use_sma': True, 'sideways_use_ema': True, 'sideways_use_atr': False, 'sideways_use_adx': False, 'sideways_use_spike': True, 'sideways_rsi_required': False}.
[I 2025-09-01 03:21:29,551] Trial 357 finished with values: [-1000000000.0, 1000000000.0] and parameters: {'p_sma': 28, 'p_std': 59, 'p_atr': 26, 'p_adx': 17, 'rsi_period': 65, 'ema1': 21, 'ema2': 55, 'slip_atr_k': 0.1977792984097444, 'slip_spread_k': 0.20930418717024002, 'spread_hl_frac': 0.029398852422448482, 'bb_std_mult': 0.9351454826464631, 'rsi_os': 14, 'rsi_ob': 85, 'vol_spike': 0.2734433237086134, 'adx_thresh': 34.49324079504232, 'atr_min_pct': 0.006500400015048054, 'atr_max_pct': 0.13027840990040085, 'tp_mult': 2.280863712828719, 'tsl_mult': 0.35413944928926994, 'strategy': 'mean_reversion', 'time_stop': 185, 'use_sma': True, 'use_atr': False, 'use_adx': True, 'use_ema': False, 'use_spike': True, 'rsi_required': False, 'edge_k': 0.030854156338602425, 'edge_cap': 0.719192062117514, 'bull_strategy': 'breakout', 'bull_bb_std_mult': 1.1052270008979872, 'bull_rsi_os': 18, 'bull_rsi_ob': 55, 'bull_adx_thresh': 22.36157612984752, 'bull_atr_min_pct': 0.0015801060814837134, 'bull_atr_max_pct': 0.014030457544606453, 'bull_tp_mult': 1.0630567538594953, 'bull_tsl_mult': 0.2423416582878124, 'bull_time_stop': 259, 'bull_use_sma': True, 'bull_use_ema': True, 'bull_use_atr': False, 'bull_use_adx': False, 'bull_use_spike': True, 'bull_rsi_required': False, 'bear_strategy': 'mean_reversion', 'bear_bb_std_mult': 2.22633258988253, 'bear_rsi_os': 24, 'bear_rsi_ob': 60, 'bear_adx_thresh': 24.378273475659853, 'bear_atr_min_pct': 0.01816210571401024, 'bear_atr_max_pct': 0.044462813750627266, 'bear_tp_mult': 1.2632980682280235, 'bear_tsl_mult': 0.20811263539000396, 'bear_time_stop': 97, 'bear_use_sma': False, 'bear_use_ema': False, 'bear_use_atr': False, 'bear_use_adx': False, 'bear_use_spike': True, 'bear_rsi_required': True, 'sideways_strategy': 'breakout', 'sideways_bb_std_mult': 3.1754506268922684, 'sideways_rsi_os': 44, 'sideways_rsi_ob': 51, 'sideways_adx_thresh': 32.52520635737934, 'sideways_atr_min_pct': 0.027526302649582595, 'sideways_atr_max_pct': 0.02555769165128699, 'sideways_tp_mult': 1.7667680497996825, 'sideways_tsl_mult': 0.1400086430529082, 'sideways_time_stop': 123, 'sideways_use_sma': True, 'sideways_use_ema': True, 'sideways_use_atr': True, 'sideways_use_adx': False, 'sideways_use_spike': True, 'sideways_rsi_required': True}.
[I 2025-09-01 03:21:30,175] Trial 362 finished with values: [-1000000000.0, 1000000000.0] and parameters: {'p_sma': 55, 'p_std': 56, 'p_atr': 27, 'p_adx': 18, 'rsi_period': 15, 'ema1': 19, 'ema2': 11, 'slip_atr_k': 0.02960450258976751, 'slip_spread_k': 0.731769766363739, 'spread_hl_frac': 0.026535406478574445, 'bb_std_mult': 1.6055541345832798, 'rsi_os': 41, 'rsi_ob': 50, 'vol_spike': 0.2229560325069438, 'adx_thresh': 30.757673990709762, 'atr_min_pct': 0.007642821721156656, 'atr_max_pct': 0.10939320017957814, 'tp_mult': 2.7992483563250836, 'tsl_mult': 0.7428010925290862, 'strategy': 'mean_reversion', 'time_stop': 148, 'use_sma': False, 'use_atr': False, 'use_adx': True, 'use_ema': False, 'use_spike': True, 'rsi_required': False, 'edge_k': 0.0037307894206200717, 'edge_cap': 0.6775132282711758, 'bull_strategy': 'breakout', 'bull_bb_std_mult': 1.261963792965064, 'bull_rsi_os': 17, 'bull_rsi_ob': 52, 'bull_adx_thresh': 21.558145794890564, 'bull_atr_min_pct': 0.019120501133443088, 'bull_atr_max_pct': 0.04693894529119821, 'bull_tp_mult': 1.463647349607681, 'bull_tsl_mult': 0.1792830161608509, 'bull_time_stop': 295, 'bull_use_sma': False, 'bull_use_ema': False, 'bull_use_atr': False, 'bull_use_adx': True, 'bull_use_spike': True, 'bull_rsi_required': False, 'bear_strategy': 'breakout', 'bear_bb_std_mult': 1.4390412550747946, 'bear_rsi_os': 55, 'bear_rsi_ob': 53, 'bear_adx_thresh': 28.21564932769857, 'bear_atr_min_pct': 0.02743787752433104, 'bear_atr_max_pct': 0.018286627025757746, 'bear_tp_mult': 1.079363391716461, 'bear_tsl_mult': 0.6269947245622371, 'bear_time_stop': 67, 'bear_use_sma': False, 'bear_use_ema': False, 'bear_use_atr': False, 'bear_use_adx': False, 'bear_use_spike': True, 'bear_rsi_required': True, 'sideways_strategy': 'breakout', 'sideways_bb_std_mult': 3.4331063198237963, 'sideways_rsi_os': 46, 'sideways_rsi_ob': 74, 'sideways_adx_thresh': 26.97115933057025, 'sideways_atr_min_pct': 0.029162325260529146, 'sideways_atr_max_pct': 0.05552907698663399, 'sideways_tp_mult': 2.5780025319778455, 'sideways_tsl_mult': 0.24090780529015401, 'sideways_time_stop': 110, 'sideways_use_sma': True, 'sideways_use_ema': True, 'sideways_use_atr': True, 'sideways_use_adx': True, 'sideways_use_spike': True, 'sideways_rsi_required': True}.
