[I 2025-09-01 03:29:17,007] Trial 405 finished with values: [-0.017396563360381645, 0.017236444804574997] and parameters: {'p_sma': 59, 'p_std': 58, 'p_atr': 15, 'p_adx': 19, 'rsi_period': 49, 'ema1': 6, 'ema2': 54, 'slip_atr_k': 0.013229001517935577, 'slip_spread_k': 0.1957882537524939, 'spread_hl_frac': 0.02874598458766605, 'bb_std_mult': 1.6804787375122134, 'rsi_os': 16, 'rsi_ob': 74, 'vol_spike': 0.21539008464535242, 'adx_thresh': 33.85219051290838, 'atr_min_pct': 0.007282487929711453, 'atr_max_pct': 0.05173894630162929, 'tp_mult': 2.6994831201382463, 'tsl_mult': 0.38330382482682085, 'strategy': 'mean_reversion', 'time_stop': 98, 'use_sma': False, 'use_atr': False, 'use_adx': False, 'use_ema': False, 'use_spike': True, 'rsi_required': False, 'edge_k': 1.3067275579051567, 'edge_cap': 0.46266106551634645, 'bull_strategy': 'breakout', 'bull_bb_std_mult': 1.7219154446047698, 'bull_rsi_os': 43, 'bull_rsi_ob': 52, 'bull_adx_thresh': 22.035850984909448, 'bull_atr_min_pct': 0.0003617563830488425, 'bull_atr_max_pct': 0.08144760870482508, 'bull_tp_mult': 1.7073059578565855, 'bull_tsl_mult': 0.07456535865349101, 'bull_time_stop': 300, 'bull_use_sma': True, 'bull_use_ema': False, 'bull_use_atr': False, 'bull_use_adx': False, 'bull_use_spike': False, 'bull_rsi_required': False, 'bear_strategy': 'breakout', 'bear_bb_std_mult': 3.068586560483225, 'bear_rsi_os': 35, 'bear_rsi_ob': 57, 'bear_adx_thresh': 33.654396980451594, 'bear_atr_min_pct': 0.024827678906443076, 'bear_atr_max_pct': 0.09193291892644442, 'bear_tp_mult': 2.085722426625685, 'bear_tsl_mult': 0.1445720016143627, 'bear_time_stop': 189, 'bear_use_sma': True, 'bear_use_ema': True, 'bear_use_atr': True, 'bear_use_adx': True, 'bear_use_spike': True, 'bear_rsi_required': True, 'sideways_strategy': 'breakout', 'sideways_bb_std_mult': 2.8224109504953474, 'sideways_rsi_os': 48, 'sideways_rsi_ob': 75, 'sideways_adx_thresh': 28.43107711568823, 'sideways_atr_min_pct': 0.017101760759846395, 'sideways_atr_max_pct': 0.13692403829602157, 'sideways_tp_mult': 2.1471150617600316, 'sideways_tsl_mult': 0.11500424508778173, 'sideways_time_stop': 125, 'sideways_use_sma': True, 'sideways_use_ema': False, 'sideways_use_atr': True, 'sideways_use_adx': False, 'sideways_use_spike': True, 'sideways_rsi_required': False}.
[I 2025-09-01 03:29:17,137] Trial 404 finished with values: [-1000000000.0, 1000000000.0] and parameters: {'p_sma': 49, 'p_std': 58, 'p_atr': 15, 'p_adx': 25, 'rsi_period': 31, 'ema1': 6, 'ema2': 16, 'slip_atr_k': 0.2499248693324094, 'slip_spread_k': 0.15006745516232248, 'spread_hl_frac': 0.02941324876913231, 'bb_std_mult': 1.2747662056676923, 'rsi_os': 24, 'rsi_ob': 79, 'vol_spike': 0.022329355335154677, 'adx_thresh': 21.684536610279178, 'atr_min_pct': 0.028979247869213867, 'atr_max_pct': 0.05194630534227656, 'tp_mult': 1.2631061525299672, 'tsl_mult': 0.3805532811617171, 'strategy': 'mean_reversion', 'time_stop': 175, 'use_sma': True, 'use_atr': False, 'use_adx': False, 'use_ema': False, 'use_spike': True, 'rsi_required': False, 'edge_k': 0.9027015421458567, 'edge_cap': 0.39004145167241083, 'bull_strategy': 'breakout', 'bull_bb_std_mult': 1.0733521552112215, 'bull_rsi_os': 15, 'bull_rsi_ob': 79, 'bull_adx_thresh': 23.03536836203834, 'bull_atr_min_pct': 0.002197310590527069, 'bull_atr_max_pct': 0.06824032609019459, 'bull_tp_mult': 2.389907080161427, 'bull_tsl_mult': 0.31863068931002575, 'bull_time_stop': 210, 'bull_use_sma': True, 'bull_use_ema': False, 'bull_use_atr': False, 'bull_use_adx': False, 'bull_use_spike': True, 'bull_rsi_required': False, 'bear_strategy': 'breakout', 'bear_bb_std_mult': 1.094029568635813, 'bear_rsi_os': 35, 'bear_rsi_ob': 59, 'bear_adx_thresh': 24.10612382640008, 'bear_atr_min_pct': 0.010863551053445917, 'bear_atr_max_pct': 0.028262979743943283, 'bear_tp_mult': 1.096999667154296, 'bear_tsl_mult': 0.8802198556160237, 'bear_time_stop': 190, 'bear_use_sma': True, 'bear_use_ema': False, 'bear_use_atr': True, 'bear_use_adx': True, 'bear_use_spike': True, 'bear_rsi_required': True, 'sideways_strategy': 'breakout', 'sideways_bb_std_mult': 2.7724622321049357, 'sideways_rsi_os': 40, 'sideways_rsi_ob': 53, 'sideways_adx_thresh': 29.99352620574745, 'sideways_atr_min_pct': 0.027594470312983614, 'sideways_atr_max_pct': 0.06363156816042265, 'sideways_tp_mult': 2.496077550157627, 'sideways_tsl_mult': 0.11879567692238556, 'sideways_time_stop': 123, 'sideways_use_sma': True, 'sideways_use_ema': False, 'sideways_use_atr': True, 'sideways_use_adx': False, 'sideways_use_spike': True, 'sideways_rsi_required': False}.
[I 2025-09-01 03:29:17,277] Trial 406 finished with values: [-0.08925199261846506, 0.08905012350770967] and parameters: {'p_sma': 49, 'p_std': 21, 'p_atr': 15, 'p_adx': 16, 'rsi_period': 50, 'ema1': 6, 'ema2': 32, 'slip_atr_k': 0.11561468683601568, 'slip_spread_k': 0.1620201095822055, 'spread_hl_frac': 0.028394214116903432, 'bb_std_mult': 2.6301290707185716, 'rsi_os': 23, 'rsi_ob': 86, 'vol_spike': 0.23764258114472997, 'adx_thresh': 14.453373310258499, 'atr_min_pct': 0.007244223978489276, 'atr_max_pct': 0.13897300351528824, 'tp_mult': 2.694705832729387, 'tsl_mult': 0.3901084902760748, 'strategy': 'mean_reversion', 'time_stop': 21, 'use_sma': False, 'use_atr': True, 'use_adx': False, 'use_ema': True, 'use_spike': True, 'rsi_required': False, 'edge_k': 0.10960642286938993, 'edge_cap': 0.463815943486075, 'bull_strategy': 'mean_reversion', 'bull_bb_std_mult': 1.0717737851102167, 'bull_rsi_os': 15, 'bull_rsi_ob': 53, 'bull_adx_thresh': 21.844721747266256, 'bull_atr_min_pct': 1.9519869470130836e-06, 'bull_atr_max_pct': 0.12433767312368113, 'bull_tp_mult': 2.1945953239495926, 'bull_tsl_mult': 0.19060692084333747, 'bull_time_stop': 293, 'bull_use_sma': True, 'bull_use_ema': False, 'bull_use_atr': False, 'bull_use_adx': False, 'bull_use_spike': False, 'bull_rsi_required': False, 'bear_strategy': 'breakout', 'bear_bb_std_mult': 3.041520766135326, 'bear_rsi_os': 26, 'bear_rsi_ob': 57, 'bear_adx_thresh': 23.23323965353663, 'bear_atr_min_pct': 0.01939139113333467, 'bear_atr_max_pct': 0.028209294588951123, 'bear_tp_mult': 2.8208287341042806, 'bear_tsl_mult': 0.7256084406955183, 'bear_time_stop': 176, 'bear_use_sma': True, 'bear_use_ema': True, 'bear_use_atr': True, 'bear_use_adx': True, 'bear_use_spike': True, 'bear_rsi_required': True, 'sideways_strategy': 'breakout', 'sideways_bb_std_mult': 2.357297442202815, 'sideways_rsi_os': 47, 'sideways_rsi_ob': 53, 'sideways_adx_thresh': 28.361150396246195, 'sideways_atr_min_pct': 0.004957884699626944, 'sideways_atr_max_pct': 0.02513613575376664, 'sideways_tp_mult': 1.7812035230484016, 'sideways_tsl_mult': 0.22800718690492774, 'sideways_time_stop': 48, 'sideways_use_sma': True, 'sideways_use_ema': False, 'sideways_use_atr': True, 'sideways_use_adx': False, 'sideways_use_spike': True, 'sideways_rsi_required': False}.
[I 2025-09-01 03:29:58,839] Trial 410 finished with values: [-1000000000.0, 1000000000.0] and parameters: {'p_sma': 5, 'p_std': 21, 'p_atr': 12, 'p_adx': 17, 'rsi_period': 13, 'ema1': 20, 'ema2': 32, 'slip_atr_k': 0.014912958090383847, 'slip_spread_k': 0.20077717455469654, 'spread_hl_frac': 0.028107419950556534, 'bb_std_mult': 3.2779543991933666, 'rsi_os': 21, 'rsi_ob': 84, 'vol_spike': 0.22300522743908963, 'adx_thresh': 20.26106818939947, 'atr_min_pct': 0.015331045446573703, 'atr_max_pct': 0.06726773807793628, 'tp_mult': 2.6991365662880744, 'tsl_mult': 0.39543718227111657, 'strategy': 'mean_reversion', 'time_stop': 99, 'use_sma': False, 'use_atr': True, 'use_adx': False, 'use_ema': True, 'use_spike': True, 'rsi_required': False, 'edge_k': 0.04742101081990163, 'edge_cap': 0.46231006988953915, 'bull_strategy': 'mean_reversion', 'bull_bb_std_mult': 1.7333225911683725, 'bull_rsi_os': 11, 'bull_rsi_ob': 52, 'bull_adx_thresh': 9.312449643627339, 'bull_atr_min_pct': 0.0011456996578526363, 'bull_atr_max_pct': 0.12455633228008653, 'bull_tp_mult': 2.2390860336586194, 'bull_tsl_mult': 0.10015670421445544, 'bull_time_stop': 293, 'bull_use_sma': True, 'bull_use_ema': False, 'bull_use_atr': False, 'bull_use_adx': False, 'bull_use_spike': False, 'bull_rsi_required': False, 'bear_strategy': 'breakout', 'bear_bb_std_mult': 2.0229935806017108, 'bear_rsi_os': 51, 'bear_rsi_ob': 57, 'bear_adx_thresh': 23.087022368392493, 'bear_atr_min_pct': 0.026523832725278997, 'bear_atr_max_pct': 0.020347077251173146, 'bear_tp_mult': 2.661776778190042, 'bear_tsl_mult': 0.21385700282885978, 'bear_time_stop': 295, 'bear_use_sma': False, 'bear_use_ema': True, 'bear_use_atr': True, 'bear_use_adx': True, 'bear_use_spike': True, 'bear_rsi_required': True, 'sideways_strategy': 'breakout', 'sideways_bb_std_mult': 1.78213356321038, 'sideways_rsi_os': 47, 'sideways_rsi_ob': 74, 'sideways_adx_thresh': 28.892384130464357, 'sideways_atr_min_pct': 0.02716907994456258, 'sideways_atr_max_pct': 0.06769061184344594, 'sideways_tp_mult': 1.7793801747578013, 'sideways_tsl_mult': 0.14348820846307442, 'sideways_time_stop': 47, 'sideways_use_sma': True, 'sideways_use_ema': False, 'sideways_use_atr': True, 'sideways_use_adx': False, 'sideways_use_spike': True, 'sideways_rsi_required': True}.
[I 2025-09-01 03:29:59,119] Trial 409 finished with values: [-1000000000.0, 1000000000.0] and parameters: {'p_sma': 17, 'p_std': 21, 'p_atr': 26, 'p_adx': 23, 'rsi_period': 13, 'ema1': 12, 'ema2': 16, 'slip_atr_k': 0.015056206616734987, 'slip_spread_k': 0.16699072326413802, 'spread_hl_frac': 0.02787899335714391, 'bb_std_mult': 2.6225195470641927, 'rsi_os': 21, 'rsi_ob': 85, 'vol_spike': 0.23986205969911686, 'adx_thresh': 14.907413260996469, 'atr_min_pct': 0.029046513588662136, 'atr_max_pct': 0.13734632758471776, 'tp_mult': 2.7057968803829318, 'tsl_mult': 0.3855938121562564, 'strategy': 'mean_reversion', 'time_stop': 21, 'use_sma': False, 'use_atr': True, 'use_adx': False, 'use_ema': True, 'use_spike': True, 'rsi_required': False, 'edge_k': 0.10081438408780405, 'edge_cap': 0.4622308736459381, 'bull_strategy': 'mean_reversion', 'bull_bb_std_mult': 0.7762504563503061, 'bull_rsi_os': 15, 'bull_rsi_ob': 52, 'bull_adx_thresh': 21.609682878339385, 'bull_atr_min_pct': 0.002647132202179785, 'bull_atr_max_pct': 0.06820493043151236, 'bull_tp_mult': 2.212942302308072, 'bull_tsl_mult': 0.8190289032170817, 'bull_time_stop': 291, 'bull_use_sma': True, 'bull_use_ema': False, 'bull_use_atr': False, 'bull_use_adx': False, 'bull_use_spike': False, 'bull_rsi_required': False, 'bear_strategy': 'breakout', 'bear_bb_std_mult': 1.8601680238524982, 'bear_rsi_os': 52, 'bear_rsi_ob': 57, 'bear_adx_thresh': 23.958705077355642, 'bear_atr_min_pct': 0.01076766195231247, 'bear_atr_max_pct': 0.028298974334424777, 'bear_tp_mult': 2.0836157731413527, 'bear_tsl_mult': 0.13948861655760836, 'bear_time_stop': 190, 'bear_use_sma': True, 'bear_use_ema': True, 'bear_use_atr': True, 'bear_use_adx': True, 'bear_use_spike': True, 'bear_rsi_required': True, 'sideways_strategy': 'breakout', 'sideways_bb_std_mult': 2.9909933712414642, 'sideways_rsi_os': 47, 'sideways_rsi_ob': 53, 'sideways_adx_thresh': 28.799513924360475, 'sideways_atr_min_pct': 0.027213842034946086, 'sideways_atr_max_pct': 0.038820093846880205, 'sideways_tp_mult': 2.087615243661739, 'sideways_tsl_mult': 0.4802945533697008, 'sideways_time_stop': 129, 'sideways_use_sma': True, 'sideways_use_ema': False, 'sideways_use_atr': True, 'sideways_use_adx': False, 'sideways_use_spike': True, 'sideways_rsi_required': True}.
[I 2025-09-01 03:29:59,299] Trial 408 finished with values: [-1000000000.0, 1000000000.0] and parameters: {'p_sma': 49, 'p_std': 58, 'p_atr': 21, 'p_adx': 13, 'rsi_period': 53, 'ema1': 12, 'ema2': 56, 'slip_atr_k': 0.012388394083808018, 'slip_spread_k': 0.11582129164611682, 'spread_hl_frac': 0.0278381578108191, 'bb_std_mult': 3.212240861461787, 'rsi_os': 21, 'rsi_ob': 85, 'vol_spike': 0.2229548448346709, 'adx_thresh': 14.707816904755799, 'atr_min_pct': 0.007517816248245218, 'atr_max_pct': 0.06725804035641997, 'tp_mult': 2.679047448419915, 'tsl_mult': 0.3491812738770101, 'strategy': 'mean_reversion', 'time_stop': 19, 'use_sma': False, 'use_atr': True, 'use_adx': False, 'use_ema': True, 'use_spike': True, 'rsi_required': False, 'edge_k': 1.2113957466320824, 'edge_cap': 0.4646427546317763, 'bull_strategy': 'mean_reversion', 'bull_bb_std_mult': 0.7868717795515294, 'bull_rsi_os': 15, 'bull_rsi_ob': 53, 'bull_adx_thresh': 21.839632116632927, 'bull_atr_min_pct': 0.0026003923358253827, 'bull_atr_max_pct': 0.08265981369364926, 'bull_tp_mult': 2.19345448675583, 'bull_tsl_mult': 0.09891867713614927, 'bull_time_stop': 293, 'bull_use_sma': True, 'bull_use_ema': False, 'bull_use_atr': False, 'bull_use_adx': False, 'bull_use_spike': False, 'bull_rsi_required': False, 'bear_strategy': 'breakout', 'bear_bb_std_mult': 1.8793757032059484, 'bear_rsi_os': 51, 'bear_rsi_ob': 57, 'bear_adx_thresh': 23.88994581146985, 'bear_atr_min_pct': 0.02118753718816896, 'bear_atr_max_pct': 0.028002142231401114, 'bear_tp_mult': 2.5774521289251084, 'bear_tsl_mult': 0.06034108950190853, 'bear_time_stop': 127, 'bear_use_sma': True, 'bear_use_ema': True, 'bear_use_atr': True, 'bear_use_adx': True, 'bear_use_spike': True, 'bear_rsi_required': True, 'sideways_strategy': 'breakout', 'sideways_bb_std_mult': 2.376448412450761, 'sideways_rsi_os': 35, 'sideways_rsi_ob': 79, 'sideways_adx_thresh': 28.207926942032064, 'sideways_atr_min_pct': 0.027302889539125807, 'sideways_atr_max_pct': 0.06355017950523882, 'sideways_tp_mult': 1.7072658784540455, 'sideways_tsl_mult': 0.12923624251868077, 'sideways_time_stop': 134, 'sideways_use_sma': True, 'sideways_use_ema': False, 'sideways_use_atr': True, 'sideways_use_adx': False, 'sideways_use_spike': True, 'sideways_rsi_required': True}.
[I 2025-09-01 03:29:59,543] Trial 411 finished with values: [-0.07631385278649683, 0.07590097947425363] and parameters: {'p_sma': 58, 'p_std': 56, 'p_atr': 26, 'p_adx': 23, 'rsi_period': 53, 'ema1': 12, 'ema2': 37, 'slip_atr_k': 0.013298532017599982, 'slip_spread_k': 0.11172148913409674, 'spread_hl_frac': 0.027386251071483902, 'bb_std_mult': 1.3505492729946755, 'rsi_os': 21, 'rsi_ob': 85, 'vol_spike': 0.2235697730979945, 'adx_thresh': 20.813088234614945, 'atr_min_pct': 0.008261185902348502, 'atr_max_pct': 0.05335245357345416, 'tp_mult': 2.6075924165167113, 'tsl_mult': 0.3462282873955763, 'strategy': 'mean_reversion', 'time_stop': 88, 'use_sma': False, 'use_atr': False, 'use_adx': True, 'use_ema': True, 'use_spike': True, 'rsi_required': False, 'edge_k': 0.049159617008668506, 'edge_cap': 0.4644356673530518, 'bull_strategy': 'breakout', 'bull_bb_std_mult': 2.0549361935093122, 'bull_rsi_os': 55, 'bull_rsi_ob': 52, 'bull_adx_thresh': 10.27135943716286, 'bull_atr_min_pct': 0.029969260433497097, 'bull_atr_max_pct': 0.12025674333876513, 'bull_tp_mult': 1.6949521508528782, 'bull_tsl_mult': 0.09869804819966466, 'bull_time_stop': 251, 'bull_use_sma': True, 'bull_use_ema': False, 'bull_use_atr': False, 'bull_use_adx': False, 'bull_use_spike': False, 'bull_rsi_required': False, 'bear_strategy': 'breakout', 'bear_bb_std_mult': 2.5640691814772376, 'bear_rsi_os': 51, 'bear_rsi_ob': 78, 'bear_adx_thresh': 25.724093009136396, 'bear_atr_min_pct': 0.0007179884644001946, 'bear_atr_max_pct': 0.07487428341186703, 'bear_tp_mult': 1.0488958579111538, 'bear_tsl_mult': 0.13420424523186894, 'bear_time_stop': 76, 'bear_use_sma': False, 'bear_use_ema': True, 'bear_use_atr': False, 'bear_use_adx': False, 'bear_use_spike': True, 'bear_rsi_required': True, 'sideways_strategy': 'breakout', 'sideways_bb_std_mult': 2.9605398027813354, 'sideways_rsi_os': 49, 'sideways_rsi_ob': 74, 'sideways_adx_thresh': 28.781876346411504, 'sideways_atr_min_pct': 0.009083594111292718, 'sideways_atr_max_pct': 0.018438472508245273, 'sideways_tp_mult': 1.712016503713256, 'sideways_tsl_mult': 0.14037075050823253, 'sideways_time_stop': 133, 'sideways_use_sma': True, 'sideways_use_ema': True, 'sideways_use_atr': True, 'sideways_use_adx': False, 'sideways_use_spike': True, 'sideways_rsi_required': True}.
[I 2025-09-01 03:30:46,098] Trial 413 finished with values: [-1000000000.0, 1000000000.0] and parameters: {'p_sma': 59, 'p_std': 56, 'p_atr': 22, 'p_adx': 15, 'rsi_period': 69, 'ema1': 8, 'ema2': 54, 'slip_atr_k': 0.02650010629084712, 'slip_spread_k': 0.10449640130727247, 'spread_hl_frac': 0.02743228007493142, 'bb_std_mult': 1.477493828711409, 'rsi_os': 21, 'rsi_ob': 85, 'vol_spike': 0.22352204627055888, 'adx_thresh': 30.23192540960402, 'atr_min_pct': 0.024221906934601328, 'atr_max_pct': 0.049204378298691336, 'tp_mult': 1.0557216377716572, 'tsl_mult': 0.401909975905448, 'strategy': 'mean_reversion', 'time_stop': 172, 'use_sma': False, 'use_atr': False, 'use_adx': True, 'use_ema': False, 'use_spike': True, 'rsi_required': False, 'edge_k': 1.2077407742692838, 'edge_cap': 0.7852169322225508, 'bull_strategy': 'breakout', 'bull_bb_std_mult': 3.220952032418383, 'bull_rsi_os': 55, 'bull_rsi_ob': 55, 'bull_adx_thresh': 23.9467569421996, 'bull_atr_min_pct': 0.026753263599626903, 'bull_atr_max_pct': 0.04486430487179529, 'bull_tp_mult': 1.7110899526771381, 'bull_tsl_mult': 0.24460829044442078, 'bull_time_stop': 249, 'bull_use_sma': True, 'bull_use_ema': False, 'bull_use_atr': False, 'bull_use_adx': False, 'bull_use_spike': True, 'bull_rsi_required': False, 'bear_strategy': 'breakout', 'bear_bb_std_mult': 1.9498427652898611, 'bear_rsi_os': 50, 'bear_rsi_ob': 58, 'bear_adx_thresh': 11.116993602395098, 'bear_atr_min_pct': 0.027307656556337635, 'bear_atr_max_pct': 0.0972547658274202, 'bear_tp_mult': 1.798004686824008, 'bear_tsl_mult': 0.023495894575902232, 'bear_time_stop': 60, 'bear_use_sma': False, 'bear_use_ema': False, 'bear_use_atr': False, 'bear_use_adx': False, 'bear_use_spike': True, 'bear_rsi_required': True, 'sideways_strategy': 'breakout', 'sideways_bb_std_mult': 3.358186232855762, 'sideways_rsi_os': 49, 'sideways_rsi_ob': 75, 'sideways_adx_thresh': 29.40165735402862, 'sideways_atr_min_pct': 0.017200714943370336, 'sideways_atr_max_pct': 0.07663927995912118, 'sideways_tp_mult': 1.697898946446339, 'sideways_tsl_mult': 0.258282204710876, 'sideways_time_stop': 135, 'sideways_use_sma': True, 'sideways_use_ema': True, 'sideways_use_atr': True, 'sideways_use_adx': False, 'sideways_use_spike': True, 'sideways_rsi_required': True}.
[I 2025-09-01 03:30:46,631] Trial 414 finished with values: [-1000000000.0, 1000000000.0] and parameters: {'p_sma': 58, 'p_std': 56, 'p_atr': 13, 'p_adx': 26, 'rsi_period': 8, 'ema1': 8, 'ema2': 41, 'slip_atr_k': 0.02610234889032991, 'slip_spread_k': 0.7161486567228812, 'spread_hl_frac': 0.028583487927016173, 'bb_std_mult': 1.3618524989007996, 'rsi_os': 22, 'rsi_ob': 82, 'vol_spike': 0.21635551732257957, 'adx_thresh': 30.29459796382848, 'atr_min_pct': 0.00819600624728878, 'atr_max_pct': 0.04161588138069526, 'tp_mult': 1.3927058857198564, 'tsl_mult': 0.36003817228894947, 'strategy': 'mean_reversion', 'time_stop': 171, 'use_sma': False, 'use_atr': False, 'use_adx': True, 'use_ema': False, 'use_spike': False, 'rsi_required': True, 'edge_k': 0.20348011268358668, 'edge_cap': 0.778287631907943, 'bull_strategy': 'breakout', 'bull_bb_std_mult': 2.040703262044883, 'bull_rsi_os': 16, 'bull_rsi_ob': 55, 'bull_adx_thresh': 23.895005177545947, 'bull_atr_min_pct': 0.013127276860829635, 'bull_atr_max_pct': 0.08622993907011806, 'bull_tp_mult': 1.7055689951941035, 'bull_tsl_mult': 0.243619455569952, 'bull_time_stop': 42, 'bull_use_sma': True, 'bull_use_ema': False, 'bull_use_atr': True, 'bull_use_adx': False, 'bull_use_spike': True, 'bull_rsi_required': False, 'bear_strategy': 'breakout', 'bear_bb_std_mult': 2.507289360225122, 'bear_rsi_os': 50, 'bear_rsi_ob': 54, 'bear_adx_thresh': 8.544693904727087, 'bear_atr_min_pct': 0.012921576898824606, 'bear_atr_max_pct': 0.09218480646860708, 'bear_tp_mult': 1.0556730308969369, 'bear_tsl_mult': 0.49958078116773336, 'bear_time_stop': 60, 'bear_use_sma': False, 'bear_use_ema': False, 'bear_use_atr': False, 'bear_use_adx': False, 'bear_use_spike': False, 'bear_rsi_required': True, 'sideways_strategy': 'breakout', 'sideways_bb_std_mult': 3.2837566583217344, 'sideways_rsi_os': 49, 'sideways_rsi_ob': 75, 'sideways_adx_thresh': 29.20730501847423, 'sideways_atr_min_pct': 0.028881953242946498, 'sideways_atr_max_pct': 0.07714202630895613, 'sideways_tp_mult': 2.1342866425473184, 'sideways_tsl_mult': 0.050893645473749916, 'sideways_time_stop': 120, 'sideways_use_sma': True, 'sideways_use_ema': True, 'sideways_use_atr': True, 'sideways_use_adx': False, 'sideways_use_spike': False, 'sideways_rsi_required': True}.
