[I 2025-09-01 03:27:43,693] Trial 396 finished with values: [-1000000000.0, 1000000000.0] and parameters: {'p_sma': 24, 'p_std': 59, 'p_atr': 28, 'p_adx': 21, 'rsi_period': 15, 'ema1': 20, 'ema2': 58, 'slip_atr_k': 0.020335430528134604, 'slip_spread_k': 0.1272961704420307, 'spread_hl_frac': 0.024585030278685898, 'bb_std_mult': 1.503846662616424, 'rsi_os': 19, 'rsi_ob': 83, 'vol_spike': 0.1835181567967138, 'adx_thresh': 8.024990128680258, 'atr_min_pct': 0.01916160528899215, 'atr_max_pct': 0.09513958633241508, 'tp_mult': 1.6788465226211675, 'tsl_mult': 0.7140495629945556, 'strategy': 'breakout', 'time_stop': 30, 'use_sma': False, 'use_atr': False, 'use_adx': True, 'use_ema': False, 'use_spike': False, 'rsi_required': True, 'edge_k': 0.09514701832573177, 'edge_cap': 0.47036415851588137, 'bull_strategy': 'breakout', 'bull_bb_std_mult': 1.174818809405243, 'bull_rsi_os': 19, 'bull_rsi_ob': 54, 'bull_adx_thresh': 23.884240971174663, 'bull_atr_min_pct': 0.0061446355894349235, 'bull_atr_max_pct': 0.11676557036828265, 'bull_tp_mult': 1.5874572352189626, 'bull_tsl_mult': 0.6107611490779679, 'bull_time_stop': 264, 'bull_use_sma': False, 'bull_use_ema': True, 'bull_use_atr': True, 'bull_use_adx': False, 'bull_use_spike': True, 'bull_rsi_required': True, 'bear_strategy': 'mean_reversion', 'bear_bb_std_mult': 2.2692344077626463, 'bear_rsi_os': 17, 'bear_rsi_ob': 61, 'bear_adx_thresh': 24.875452329192857, 'bear_atr_min_pct': 0.029954462784440604, 'bear_atr_max_pct': 0.029576192502933134, 'bear_tp_mult': 1.013935637579841, 'bear_tsl_mult': 0.5294379206888237, 'bear_time_stop': 227, 'bear_use_sma': False, 'bear_use_ema': False, 'bear_use_atr': False, 'bear_use_adx': False, 'bear_use_spike': False, 'bear_rsi_required': True, 'sideways_strategy': 'mean_reversion', 'sideways_bb_std_mult': 1.3735315519019602, 'sideways_rsi_os': 43, 'sideways_rsi_ob': 74, 'sideways_adx_thresh': 30.849401544608998, 'sideways_atr_min_pct': 0.026323526864260004, 'sideways_atr_max_pct': 0.12047641783568644, 'sideways_tp_mult': 1.7368568720154194, 'sideways_tsl_mult': 0.38230860721292026, 'sideways_time_stop': 114, 'sideways_use_sma': False, 'sideways_use_ema': True, 'sideways_use_atr': False, 'sideways_use_adx': False, 'sideways_use_spike': False, 'sideways_rsi_required': True}.
[I 2025-09-01 03:27:45,862] Trial 397 finished with values: [-1000000000.0, 1000000000.0] and parameters: {'p_sma': 39, 'p_std': 59, 'p_atr': 30, 'p_adx': 17, 'rsi_period': 15, 'ema1': 22, 'ema2': 27, 'slip_atr_k': 0.007140239296555037, 'slip_spread_k': 0.13007448730559373, 'spread_hl_frac': 0.006542743428878239, 'bb_std_mult': 1.5116813030473377, 'rsi_os': 34, 'rsi_ob': 75, 'vol_spike': 0.1866528460027715, 'adx_thresh': 9.017627567897954, 'atr_min_pct': 0.012534109746888759, 'atr_max_pct': 0.09492522061870369, 'tp_mult': 2.3761178071482076, 'tsl_mult': 0.7132444643465928, 'strategy': 'breakout', 'time_stop': 153, 'use_sma': False, 'use_atr': False, 'use_adx': True, 'use_ema': False, 'use_spike': False, 'rsi_required': True, 'edge_k': 0.6753306932496279, 'edge_cap': 0.18765637689693904, 'bull_strategy': 'breakout', 'bull_bb_std_mult': 1.1561159245874904, 'bull_rsi_os': 19, 'bull_rsi_ob': 77, 'bull_adx_thresh': 30.297131123274937, 'bull_atr_min_pct': 0.012213843110284407, 'bull_atr_max_pct': 0.10817783050609052, 'bull_tp_mult': 2.51246872028094, 'bull_tsl_mult': 0.6210518034225455, 'bull_time_stop': 265, 'bull_use_sma': False, 'bull_use_ema': True, 'bull_use_atr': True, 'bull_use_adx': False, 'bull_use_spike': True, 'bull_rsi_required': True, 'bear_strategy': 'mean_reversion', 'bear_bb_std_mult': 1.8956267192325948, 'bear_rsi_os': 52, 'bear_rsi_ob': 50, 'bear_adx_thresh': 19.30478480156041, 'bear_atr_min_pct': 0.02913271676667443, 'bear_atr_max_pct': 0.02547456075287112, 'bear_tp_mult': 1.0124099461235994, 'bear_tsl_mult': 0.11981261915901426, 'bear_time_stop': 34, 'bear_use_sma': False, 'bear_use_ema': False, 'bear_use_atr': False, 'bear_use_adx': False, 'bear_use_spike': False, 'bear_rsi_required': True, 'sideways_strategy': 'mean_reversion', 'sideways_bb_std_mult': 1.8445717581561711, 'sideways_rsi_os': 43, 'sideways_rsi_ob': 59, 'sideways_adx_thresh': 26.79353914743916, 'sideways_atr_min_pct': 0.028095796214172145, 'sideways_atr_max_pct': 0.013628606069607174, 'sideways_tp_mult': 1.7449097426798572, 'sideways_tsl_mult': 0.25396691762609813, 'sideways_time_stop': 113, 'sideways_use_sma': False, 'sideways_use_ema': True, 'sideways_use_atr': False, 'sideways_use_adx': True, 'sideways_use_spike': False, 'sideways_rsi_required': True}.
[I 2025-09-01 03:27:51,022] Trial 398 finished with values: [-1000000000.0, 1000000000.0] and parameters: {'p_sma': 52, 'p_std': 60, 'p_atr': 30, 'p_adx': 21, 'rsi_period': 15, 'ema1': 22, 'ema2': 58, 'slip_atr_k': 0.10109007445105742, 'slip_spread_k': 0.07102035129494849, 'spread_hl_frac': 0.023068873405507673, 'bb_std_mult': 1.158021779472611, 'rsi_os': 33, 'rsi_ob': 83, 'vol_spike': 0.12338884012147233, 'adx_thresh': 8.287042155519773, 'atr_min_pct': 0.005637305410686184, 'atr_max_pct': 0.010272886315807889, 'tp_mult': 2.224429963863141, 'tsl_mult': 0.3785780728569569, 'strategy': 'breakout', 'time_stop': 165, 'use_sma': False, 'use_atr': False, 'use_adx': True, 'use_ema': False, 'use_spike': False, 'rsi_required': True, 'edge_k': 0.056924210361341834, 'edge_cap': 0.2837847254725806, 'bull_strategy': 'breakout', 'bull_bb_std_mult': 1.1743810199123588, 'bull_rsi_os': 18, 'bull_rsi_ob': 54, 'bull_adx_thresh': 33.76010892758658, 'bull_atr_min_pct': 0.008294683327169068, 'bull_atr_max_pct': 0.11694370592914176, 'bull_tp_mult': 1.5936916616628296, 'bull_tsl_mult': 0.2841142685038384, 'bull_time_stop': 274, 'bull_use_sma': False, 'bull_use_ema': True, 'bull_use_atr': True, 'bull_use_adx': True, 'bull_use_spike': True, 'bull_rsi_required': True, 'bear_strategy': 'mean_reversion', 'bear_bb_std_mult': 0.7178213592571587, 'bear_rsi_os': 16, 'bear_rsi_ob': 64, 'bear_adx_thresh': 6.021801540879347, 'bear_atr_min_pct': 0.009019766619887858, 'bear_atr_max_pct': 0.029142841849256404, 'bear_tp_mult': 1.0111091509364925, 'bear_tsl_mult': 0.11541146252874179, 'bear_time_stop': 55, 'bear_use_sma': False, 'bear_use_ema': False, 'bear_use_atr': False, 'bear_use_adx': False, 'bear_use_spike': False, 'bear_rsi_required': False, 'sideways_strategy': 'mean_reversion', 'sideways_bb_std_mult': 1.8488020327909942, 'sideways_rsi_os': 6, 'sideways_rsi_ob': 65, 'sideways_adx_thresh': 31.05109530022235, 'sideways_atr_min_pct': 0.021491985841595597, 'sideways_atr_max_pct': 0.10749225405094595, 'sideways_tp_mult': 1.746308956945219, 'sideways_tsl_mult': 0.7932547453059315, 'sideways_time_stop': 114, 'sideways_use_sma': False, 'sideways_use_ema': True, 'sideways_use_atr': False, 'sideways_use_adx': True, 'sideways_use_spike': False, 'sideways_rsi_required': True}.
[I 2025-09-01 03:27:51,770] Trial 399 finished with values: [-1000000000.0, 1000000000.0] and parameters: {'p_sma': 12, 'p_std': 11, 'p_atr': 27, 'p_adx': 17, 'rsi_period': 10, 'ema1': 20, 'ema2': 58, 'slip_atr_k': 0.12337022993932316, 'slip_spread_k': 0.23690056964791972, 'spread_hl_frac': 0.03138194675871279, 'bb_std_mult': 1.1643963154562451, 'rsi_os': 39, 'rsi_ob': 84, 'vol_spike': 0.18523494968601112, 'adx_thresh': 10.166076525293374, 'atr_min_pct': 0.01737892813603229, 'atr_max_pct': 0.05789525592225171, 'tp_mult': 2.751669678827336, 'tsl_mult': 0.36197118735267336, 'strategy': 'breakout', 'time_stop': 175, 'use_sma': False, 'use_atr': False, 'use_adx': True, 'use_ema': False, 'use_spike': False, 'rsi_required': True, 'edge_k': 0.06789537383715442, 'edge_cap': 0.5110811859634871, 'bull_strategy': 'breakout', 'bull_bb_std_mult': 3.0917140935280596, 'bull_rsi_os': 18, 'bull_rsi_ob': 54, 'bull_adx_thresh': 30.23711762619793, 'bull_atr_min_pct': 0.022537685381639243, 'bull_atr_max_pct': 0.11630444981008481, 'bull_tp_mult': 1.6028493814386524, 'bull_tsl_mult': 0.39243763320728453, 'bull_time_stop': 189, 'bull_use_sma': False, 'bull_use_ema': True, 'bull_use_atr': True, 'bull_use_adx': True, 'bull_use_spike': True, 'bull_rsi_required': True, 'bear_strategy': 'mean_reversion', 'bear_bb_std_mult': 2.2729244115989693, 'bear_rsi_os': 45, 'bear_rsi_ob': 89, 'bear_adx_thresh': 19.989216033887057, 'bear_atr_min_pct': 0.02894690472025208, 'bear_atr_max_pct': 0.02494813969952671, 'bear_tp_mult': 1.0146190425367847, 'bear_tsl_mult': 0.11702918483060379, 'bear_time_stop': 71, 'bear_use_sma': False, 'bear_use_ema': False, 'bear_use_atr': False, 'bear_use_adx': False, 'bear_use_spike': False, 'bear_rsi_required': False, 'sideways_strategy': 'mean_reversion', 'sideways_bb_std_mult': 1.9688210905944576, 'sideways_rsi_os': 43, 'sideways_rsi_ob': 65, 'sideways_adx_thresh': 30.501698922664847, 'sideways_atr_min_pct': 0.02634512642906437, 'sideways_atr_max_pct': 0.029118696649644248, 'sideways_tp_mult': 1.6295682525844146, 'sideways_tsl_mult': 0.8011794586571718, 'sideways_time_stop': 106, 'sideways_use_sma': False, 'sideways_use_ema': True, 'sideways_use_atr': True, 'sideways_use_adx': True, 'sideways_use_spike': False, 'sideways_rsi_required': True}.
[I 2025-09-01 03:28:32,344] Trial 400 finished with values: [-1000000000.0, 1000000000.0] and parameters: {'p_sma': 14, 'p_std': 56, 'p_atr': 27, 'p_adx': 17, 'rsi_period': 10, 'ema1': 21, 'ema2': 60, 'slip_atr_k': 0.02646583670516199, 'slip_spread_k': 0.07502317653003687, 'spread_hl_frac': 0.03221382344746402, 'bb_std_mult': 0.8760205215618295, 'rsi_os': 39, 'rsi_ob': 95, 'vol_spike': 0.20816279073151467, 'adx_thresh': 13.54562773461215, 'atr_min_pct': 0.017124435838437223, 'atr_max_pct': 0.058157964551368506, 'tp_mult': 2.645057748862828, 'tsl_mult': 0.37999332905805244, 'strategy': 'breakout', 'time_stop': 165, 'use_sma': True, 'use_atr': False, 'use_adx': True, 'use_ema': False, 'use_spike': True, 'rsi_required': False, 'edge_k': 0.0019738634428169005, 'edge_cap': 0.9884279567993208, 'bull_strategy': 'breakout', 'bull_bb_std_mult': 1.0562138346865022, 'bull_rsi_os': 22, 'bull_rsi_ob': 77, 'bull_adx_thresh': 23.318316207862082, 'bull_atr_min_pct': 0.022561314759981105, 'bull_atr_max_pct': 0.11785295527374513, 'bull_tp_mult': 2.838100653395675, 'bull_tsl_mult': 0.3759981381734334, 'bull_time_stop': 61, 'bull_use_sma': False, 'bull_use_ema': False, 'bull_use_atr': False, 'bull_use_adx': True, 'bull_use_spike': True, 'bull_rsi_required': True, 'bear_strategy': 'breakout', 'bear_bb_std_mult': 3.544425918203267, 'bear_rsi_os': 54, 'bear_rsi_ob': 45, 'bear_adx_thresh': 23.99501075278739, 'bear_atr_min_pct': 0.028955170834468184, 'bear_atr_max_pct': 0.02422318882055742, 'bear_tp_mult': 1.0985472016568687, 'bear_tsl_mult': 0.3895935249471568, 'bear_time_stop': 68, 'bear_use_sma': False, 'bear_use_ema': False, 'bear_use_atr': False, 'bear_use_adx': False, 'bear_use_spike': True, 'bear_rsi_required': False, 'sideways_strategy': 'mean_reversion', 'sideways_bb_std_mult': 2.0711585839399067, 'sideways_rsi_os': 6, 'sideways_rsi_ob': 76, 'sideways_adx_thresh': 28.699465420861884, 'sideways_atr_min_pct': 0.020038211544815075, 'sideways_atr_max_pct': 0.02940084042071272, 'sideways_tp_mult': 1.6429996082086278, 'sideways_tsl_mult': 0.8017266341606746, 'sideways_time_stop': 104, 'sideways_use_sma': False, 'sideways_use_ema': True, 'sideways_use_atr': True, 'sideways_use_adx': True, 'sideways_use_spike': True, 'sideways_rsi_required': True}.
[I 2025-09-01 03:28:34,076] Trial 401 finished with values: [-1000000000.0, 1000000000.0] and parameters: {'p_sma': 12, 'p_std': 11, 'p_atr': 27, 'p_adx': 17, 'rsi_period': 10, 'ema1': 29, 'ema2': 23, 'slip_atr_k': 0.14758659104002048, 'slip_spread_k': 0.07491837506612821, 'spread_hl_frac': 0.03234036317654288, 'bb_std_mult': 1.3085304206073332, 'rsi_os': 24, 'rsi_ob': 83, 'vol_spike': 0.2092314108430132, 'adx_thresh': 13.509824702715651, 'atr_min_pct': 0.016944540868706004, 'atr_max_pct': 0.05763153222356868, 'tp_mult': 2.6491757230041784, 'tsl_mult': 0.3659919118567106, 'strategy': 'mean_reversion', 'time_stop': 165, 'use_sma': True, 'use_atr': False, 'use_adx': True, 'use_ema': False, 'use_spike': True, 'rsi_required': False, 'edge_k': 0.0016676995352004897, 'edge_cap': 0.5112678899788746, 'bull_strategy': 'breakout', 'bull_bb_std_mult': 3.0881613797417673, 'bull_rsi_os': 26, 'bull_rsi_ob': 54, 'bull_adx_thresh': 33.80164144116438, 'bull_atr_min_pct': 0.0022001352336631775, 'bull_atr_max_pct': 0.054710248799311606, 'bull_tp_mult': 2.656134904508743, 'bull_tsl_mult': 0.39463317891898075, 'bull_time_stop': 187, 'bull_use_sma': True, 'bull_use_ema': False, 'bull_use_atr': False, 'bull_use_adx': True, 'bull_use_spike': True, 'bull_rsi_required': False, 'bear_strategy': 'breakout', 'bear_bb_std_mult': 3.2634564587633283, 'bear_rsi_os': 54, 'bear_rsi_ob': 45, 'bear_adx_thresh': 14.209364560035668, 'bear_atr_min_pct': 0.02691369305504337, 'bear_atr_max_pct': 0.025189378291211234, 'bear_tp_mult': 1.1028097523094382, 'bear_tsl_mult': 0.39552997692708936, 'bear_time_stop': 110, 'bear_use_sma': False, 'bear_use_ema': False, 'bear_use_atr': False, 'bear_use_adx': False, 'bear_use_spike': True, 'bear_rsi_required': False, 'sideways_strategy': 'breakout', 'sideways_bb_std_mult': 2.4940596320316493, 'sideways_rsi_os': 7, 'sideways_rsi_ob': 76, 'sideways_adx_thresh': 30.28797775814676, 'sideways_atr_min_pct': 0.02595632342319017, 'sideways_atr_max_pct': 0.12822565132964472, 'sideways_tp_mult': 1.664831392319636, 'sideways_tsl_mult': 0.7251617696150877, 'sideways_time_stop': 105, 'sideways_use_sma': True, 'sideways_use_ema': True, 'sideways_use_atr': True, 'sideways_use_adx': True, 'sideways_use_spike': True, 'sideways_rsi_required': True}.
[I 2025-09-01 03:28:35,467] Trial 402 finished with values: [-1000000000.0, 1000000000.0] and parameters: {'p_sma': 14, 'p_std': 47, 'p_atr': 27, 'p_adx': 19, 'rsi_period': 10, 'ema1': 21, 'ema2': 60, 'slip_atr_k': 0.13795887115807587, 'slip_spread_k': 0.19277181328698964, 'spread_hl_frac': 0.03822333327120455, 'bb_std_mult': 1.270537610627623, 'rsi_os': 17, 'rsi_ob': 84, 'vol_spike': 0.21571839433488565, 'adx_thresh': 10.204867367212845, 'atr_min_pct': 0.016726511755894895, 'atr_max_pct': 0.05151108516267507, 'tp_mult': 1.260438235218159, 'tsl_mult': 0.38089915408086694, 'strategy': 'mean_reversion', 'time_stop': 165, 'use_sma': True, 'use_atr': False, 'use_adx': True, 'use_ema': False, 'use_spike': True, 'rsi_required': False, 'edge_k': 0.0019011249005730507, 'edge_cap': 0.516261552856279, 'bull_strategy': 'breakout', 'bull_bb_std_mult': 2.3793998795089966, 'bull_rsi_os': 9, 'bull_rsi_ob': 46, 'bull_adx_thresh': 23.27518376015651, 'bull_atr_min_pct': 0.0003651665789963783, 'bull_atr_max_pct': 0.11986406261385284, 'bull_tp_mult': 2.609463686069257, 'bull_tsl_mult': 0.329015585957902, 'bull_time_stop': 300, 'bull_use_sma': True, 'bull_use_ema': False, 'bull_use_atr': False, 'bull_use_adx': True, 'bull_use_spike': True, 'bull_rsi_required': False, 'bear_strategy': 'breakout', 'bear_bb_std_mult': 2.31703255522665, 'bear_rsi_os': 35, 'bear_rsi_ob': 75, 'bear_adx_thresh': 33.414820446223644, 'bear_atr_min_pct': 0.027089778830136826, 'bear_atr_max_pct': 0.024911598738771763, 'bear_tp_mult': 1.085578525257184, 'bear_tsl_mult': 0.430263697798132, 'bear_time_stop': 69, 'bear_use_sma': False, 'bear_use_ema': False, 'bear_use_atr': False, 'bear_use_adx': False, 'bear_use_spike': True, 'bear_rsi_required': False, 'sideways_strategy': 'breakout', 'sideways_bb_std_mult': 2.0633392864618934, 'sideways_rsi_os': 48, 'sideways_rsi_ob': 76, 'sideways_adx_thresh': 30.277391368957893, 'sideways_atr_min_pct': 0.026256712697786993, 'sideways_atr_max_pct': 0.02919741473990165, 'sideways_tp_mult': 1.0639016623923865, 'sideways_tsl_mult': 0.20311836478132647, 'sideways_time_stop': 105, 'sideways_use_sma': True, 'sideways_use_ema': True, 'sideways_use_atr': True, 'sideways_use_adx': False, 'sideways_use_spike': True, 'sideways_rsi_required': False}.
[I 2025-09-01 03:28:36,084] Trial 403 finished with values: [-1000000000.0, 1000000000.0] and parameters: {'p_sma': 14, 'p_std': 47, 'p_atr': 11, 'p_adx': 16, 'rsi_period': 10, 'ema1': 21, 'ema2': 60, 'slip_atr_k': 0.1367133086962609, 'slip_spread_k': 0.15915571233583556, 'spread_hl_frac': 0.028904751441574464, 'bb_std_mult': 0.8429952749383596, 'rsi_os': 24, 'rsi_ob': 79, 'vol_spike': 0.20852842520663023, 'adx_thresh': 21.61980978690203, 'atr_min_pct': 0.007289837462091746, 'atr_max_pct': 0.051218925607485186, 'tp_mult': 2.6403512795498663, 'tsl_mult': 0.3740543983416932, 'strategy': 'mean_reversion', 'time_stop': 165, 'use_sma': True, 'use_atr': False, 'use_adx': True, 'use_ema': False, 'use_spike': True, 'rsi_required': False, 'edge_k': 0.9159984922610931, 'edge_cap': 0.38485852012246036, 'bull_strategy': 'breakout', 'bull_bb_std_mult': 1.0691434393482853, 'bull_rsi_os': 9, 'bull_rsi_ob': 95, 'bull_adx_thresh': 23.12666965286252, 'bull_atr_min_pct': 0.002176865435094051, 'bull_atr_max_pct': 0.11919136840964459, 'bull_tp_mult': 2.629339961203315, 'bull_tsl_mult': 0.3324700918800458, 'bull_time_stop': 100, 'bull_use_sma': True, 'bull_use_ema': False, 'bull_use_atr': False, 'bull_use_adx': False, 'bull_use_spike': True, 'bull_rsi_required': False, 'bear_strategy': 'breakout', 'bear_bb_std_mult': 2.3735314461545616, 'bear_rsi_os': 55, 'bear_rsi_ob': 45, 'bear_adx_thresh': 5.013202363525306, 'bear_atr_min_pct': 0.024502389147001907, 'bear_atr_max_pct': 0.02137699755775, 'bear_tp_mult': 1.0914284420048528, 'bear_tsl_mult': 0.39136116053192466, 'bear_time_stop': 251, 'bear_use_sma': False, 'bear_use_ema': False, 'bear_use_atr': False, 'bear_use_adx': False, 'bear_use_spike': True, 'bear_rsi_required': True, 'sideways_strategy': 'breakout', 'sideways_bb_std_mult': 2.5124300287642276, 'sideways_rsi_os': 39, 'sideways_rsi_ob': 76, 'sideways_adx_thresh': 28.511468333364427, 'sideways_atr_min_pct': 0.02042302423241312, 'sideways_atr_max_pct': 0.024993167087241135, 'sideways_tp_mult': 1.0616651712589769, 'sideways_tsl_mult': 0.21588283478525377, 'sideways_time_stop': 124, 'sideways_use_sma': True, 'sideways_use_ema': True, 'sideways_use_atr': True, 'sideways_use_adx': False, 'sideways_use_spike': True, 'sideways_rsi_required': False}.
[I 2025-09-01 03:29:16,280] Trial 407 finished with values: [-0.0198085770270785, 0.01973321398693869] and parameters: {'p_sma': 53, 'p_std': 58, 'p_atr': 16, 'p_adx': 26, 'rsi_period': 54, 'ema1': 22, 'ema2': 57, 'slip_atr_k': 0.012587113396469406, 'slip_spread_k': 0.11414039680409035, 'spread_hl_frac': 0.027613763874917263, 'bb_std_mult': 3.2489645190999266, 'rsi_os': 21, 'rsi_ob': 81, 'vol_spike': 0.22040198766290073, 'adx_thresh': 14.596654641299738, 'atr_min_pct': 0.003889708318043618, 'atr_max_pct': 0.02304310957313637, 'tp_mult': 2.69937433953085, 'tsl_mult': 0.3945061944139876, 'strategy': 'mean_reversion', 'time_stop': 176, 'use_sma': False, 'use_atr': True, 'use_adx': False, 'use_ema': True, 'use_spike': True, 'rsi_required': False, 'edge_k': 0.10559633381337652, 'edge_cap': 0.4654163482750977, 'bull_strategy': 'mean_reversion', 'bull_bb_std_mult': 2.4824810007024265, 'bull_rsi_os': 15, 'bull_rsi_ob': 53, 'bull_adx_thresh': 22.05166579417647, 'bull_atr_min_pct': 0.00026710577933938666, 'bull_atr_max_pct': 0.11406963937276203, 'bull_tp_mult': 2.0482103851665614, 'bull_tsl_mult': 0.1912765248919146, 'bull_time_stop': 211, 'bull_use_sma': True, 'bull_use_ema': False, 'bull_use_atr': False, 'bull_use_adx': False, 'bull_use_spike': False, 'bull_rsi_required': False, 'bear_strategy': 'breakout', 'bear_bb_std_mult': 1.0771433386589573, 'bear_rsi_os': 26, 'bear_rsi_ob': 57, 'bear_adx_thresh': 23.786041688459928, 'bear_atr_min_pct': 0.012102937295405744, 'bear_atr_max_pct': 0.028071769362705026, 'bear_tp_mult': 2.4596059103471317, 'bear_tsl_mult': 0.14184246253287475, 'bear_time_stop': 126, 'bear_use_sma': True, 'bear_use_ema': True, 'bear_use_atr': True, 'bear_use_adx': True, 'bear_use_spike': True, 'bear_rsi_required': True, 'sideways_strategy': 'breakout', 'sideways_bb_std_mult': 1.780884195211337, 'sideways_rsi_os': 21, 'sideways_rsi_ob': 79, 'sideways_adx_thresh': 27.210505854647458, 'sideways_atr_min_pct': 0.027615760924687992, 'sideways_atr_max_pct': 0.01829695953821902, 'sideways_tp_mult': 1.6826804717304968, 'sideways_tsl_mult': 0.1402896202034809, 'sideways_time_stop': 49, 'sideways_use_sma': True, 'sideways_use_ema': False, 'sideways_use_atr': True, 'sideways_use_adx': False, 'sideways_use_spike': True, 'sideways_rsi_required': True}.
