[I 2025-09-01 02:55:46,251] Trial 199 finished with values: [-1000000000.0, 1000000000.0] and parameters: {'p_sma': 30, 'p_std': 59, 'p_atr': 28, 'p_adx': 17, 'rsi_period': 7, 'ema1': 18, 'ema2': 16, 'slip_atr_k': 0.024320658663227943, 'slip_spread_k': 0.29172198098645163, 'spread_hl_frac': 0.013069302459249685, 'bb_std_mult': 1.516621250630818, 'rsi_os': 46, 'rsi_ob': 84, 'vol_spike': 0.25043739189570313, 'adx_thresh': 34.95049950650059, 'atr_min_pct': 0.009538599428040341, 'atr_max_pct': 0.051913278167715196, 'tp_mult': 2.4806321991999907, 'tsl_mult': 0.2621076641311948, 'strategy': 'mean_reversion', 'time_stop': 261, 'use_sma': False, 'use_atr': False, 'use_adx': True, 'use_ema': False, 'use_spike': True, 'rsi_required': False, 'edge_k': 0.5134178533345839, 'edge_cap': 0.5392877512764512, 'bull_strategy': 'breakout', 'bull_bb_std_mult': 1.9111163039571586, 'bull_rsi_os': 15, 'bull_rsi_ob': 59, 'bull_adx_thresh': 21.927445850540373, 'bull_atr_min_pct': 0.013213911727811395, 'bull_atr_max_pct': 0.12198748528547912, 'bull_tp_mult': 1.6174774709016704, 'bull_tsl_mult': 0.724484432396599, 'bull_time_stop': 125, 'bull_use_sma': True, 'bull_use_ema': False, 'bull_use_atr': False, 'bull_use_adx': False, 'bull_use_spike': True, 'bull_rsi_required': False, 'bear_strategy': 'breakout', 'bear_bb_std_mult': 2.4232736953135556, 'bear_rsi_os': 7, 'bear_rsi_ob': 69, 'bear_adx_thresh': 24.82961810488455, 'bear_atr_min_pct': 0.02525762423486655, 'bear_atr_max_pct': 0.13337548212636274, 'bear_tp_mult': 1.0725914227382496, 'bear_tsl_mult': 0.17678839352899722, 'bear_time_stop': 80, 'bear_use_sma': True, 'bear_use_ema': False, 'bear_use_atr': False, 'bear_use_adx': False, 'bear_use_spike': True, 'bear_rsi_required': True, 'sideways_strategy': 'breakout', 'sideways_bb_std_mult': 1.830678501509181, 'sideways_rsi_os': 54, 'sideways_rsi_ob': 67, 'sideways_adx_thresh': 29.33697192667322, 'sideways_atr_min_pct': 0.02939820390335579, 'sideways_atr_max_pct': 0.08859015532310459, 'sideways_tp_mult': 1.2526594253657048, 'sideways_tsl_mult': 0.29491211508605675, 'sideways_time_stop': 143, 'sideways_use_sma': True, 'sideways_use_ema': True, 'sideways_use_atr': False, 'sideways_use_adx': False, 'sideways_use_spike': True, 'sideways_rsi_required': True}.
[I 2025-09-01 02:55:46,643] Trial 198 finished with values: [-1000000000.0, 1000000000.0] and parameters: {'p_sma': 32, 'p_std': 59, 'p_atr': 28, 'p_adx': 17, 'rsi_period': 7, 'ema1': 21, 'ema2': 58, 'slip_atr_k': 0.022846079860597057, 'slip_spread_k': 0.22923103835534445, 'spread_hl_frac': 0.012227548579231523, 'bb_std_mult': 3.554671567919046, 'rsi_os': 49, 'rsi_ob': 85, 'vol_spike': 0.2295199763985542, 'adx_thresh': 26.887563220807845, 'atr_min_pct': 0.009692404362542675, 'atr_max_pct': 0.042242033142539714, 'tp_mult': 2.7815667266330495, 'tsl_mult': 0.27074077100879307, 'strategy': 'mean_reversion', 'time_stop': 259, 'use_sma': False, 'use_atr': False, 'use_adx': True, 'use_ema': False, 'use_spike': True, 'rsi_required': False, 'edge_k': 0.42094335086465395, 'edge_cap': 0.45407630881829214, 'bull_strategy': 'breakout', 'bull_bb_std_mult': 1.3055485700800935, 'bull_rsi_os': 18, 'bull_rsi_ob': 59, 'bull_adx_thresh': 21.372402197806725, 'bull_atr_min_pct': 0.013311997916441243, 'bull_atr_max_pct': 0.1229457993746726, 'bull_tp_mult': 1.756802495985619, 'bull_tsl_mult': 0.5594626629874662, 'bull_time_stop': 131, 'bull_use_sma': True, 'bull_use_ema': False, 'bull_use_atr': False, 'bull_use_adx': False, 'bull_use_spike': True, 'bull_rsi_required': False, 'bear_strategy': 'breakout', 'bear_bb_std_mult': 2.340818719777672, 'bear_rsi_os': 7, 'bear_rsi_ob': 69, 'bear_adx_thresh': 24.709706919806788, 'bear_atr_min_pct': 0.0207010888921275, 'bear_atr_max_pct': 0.1339701849768108, 'bear_tp_mult': 1.0130382805306999, 'bear_tsl_mult': 0.11983342253151985, 'bear_time_stop': 74, 'bear_use_sma': False, 'bear_use_ema': False, 'bear_use_atr': False, 'bear_use_adx': False, 'bear_use_spike': True, 'bear_rsi_required': True, 'sideways_strategy': 'breakout', 'sideways_bb_std_mult': 1.8067664470334408, 'sideways_rsi_os': 15, 'sideways_rsi_ob': 84, 'sideways_adx_thresh': 28.98858028392162, 'sideways_atr_min_pct': 0.029133091222428593, 'sideways_atr_max_pct': 0.08804009816677913, 'sideways_tp_mult': 1.1989095810360657, 'sideways_tsl_mult': 0.2891054622107321, 'sideways_time_stop': 120, 'sideways_use_sma': True, 'sideways_use_ema': True, 'sideways_use_atr': False, 'sideways_use_adx': False, 'sideways_use_spike': True, 'sideways_rsi_required': True}.
[I 2025-09-01 02:55:47,015] Trial 197 finished with values: [-0.018577667213930393, 0.01849061873309322] and parameters: {'p_sma': 32, 'p_std': 56, 'p_atr': 29, 'p_adx': 17, 'rsi_period': 8, 'ema1': 21, 'ema2': 59, 'slip_atr_k': 0.022002449916802995, 'slip_spread_k': 0.28318474228990814, 'spread_hl_frac': 0.011606042003961124, 'bb_std_mult': 1.441827744532913, 'rsi_os': 49, 'rsi_ob': 85, 'vol_spike': 0.22624516646604645, 'adx_thresh': 25.56224377984787, 'atr_min_pct': 0.008504864722844053, 'atr_max_pct': 0.04259223583846679, 'tp_mult': 2.6385204589183697, 'tsl_mult': 0.28549334591539627, 'strategy': 'mean_reversion', 'time_stop': 119, 'use_sma': False, 'use_atr': False, 'use_adx': True, 'use_ema': False, 'use_spike': True, 'rsi_required': False, 'edge_k': 0.8608146399393806, 'edge_cap': 0.4798938225720765, 'bull_strategy': 'breakout', 'bull_bb_std_mult': 1.2796253467878307, 'bull_rsi_os': 15, 'bull_rsi_ob': 59, 'bull_adx_thresh': 21.53498834140035, 'bull_atr_min_pct': 0.0006187720554933036, 'bull_atr_max_pct': 0.1231117807990994, 'bull_tp_mult': 1.7567979943884062, 'bull_tsl_mult': 0.5566517317712328, 'bull_time_stop': 133, 'bull_use_sma': True, 'bull_use_ema': False, 'bull_use_atr': False, 'bull_use_adx': True, 'bull_use_spike': True, 'bull_rsi_required': False, 'bear_strategy': 'breakout', 'bear_bb_std_mult': 2.4960501044017893, 'bear_rsi_os': 5, 'bear_rsi_ob': 57, 'bear_adx_thresh': 24.164723530950337, 'bear_atr_min_pct': 0.0225636218018007, 'bear_atr_max_pct': 0.12946263206307101, 'bear_tp_mult': 1.064831053100749, 'bear_tsl_mult': 0.12188584713494588, 'bear_time_stop': 73, 'bear_use_sma': False, 'bear_use_ema': False, 'bear_use_atr': False, 'bear_use_adx': False, 'bear_use_spike': True, 'bear_rsi_required': True, 'sideways_strategy': 'breakout', 'sideways_bb_std_mult': 1.7876253942351745, 'sideways_rsi_os': 16, 'sideways_rsi_ob': 80, 'sideways_adx_thresh': 29.897040458402763, 'sideways_atr_min_pct': 0.02908459774721183, 'sideways_atr_max_pct': 0.08975761120931142, 'sideways_tp_mult': 1.2050151471691468, 'sideways_tsl_mult': 0.29210450427128976, 'sideways_time_stop': 123, 'sideways_use_sma': True, 'sideways_use_ema': True, 'sideways_use_atr': False, 'sideways_use_adx': False, 'sideways_use_spike': True, 'sideways_rsi_required': True}.
[I 2025-09-01 02:55:47,418] Trial 201 finished with values: [-1000000000.0, 1000000000.0] and parameters: {'p_sma': 30, 'p_std': 60, 'p_atr': 30, 'p_adx': 18, 'rsi_period': 11, 'ema1': 19, 'ema2': 58, 'slip_atr_k': 0.022083296462479328, 'slip_spread_k': 0.2861878948518886, 'spread_hl_frac': 0.012009167305105886, 'bb_std_mult': 0.9364259619462527, 'rsi_os': 46, 'rsi_ob': 84, 'vol_spike': 0.22974237914021914, 'adx_thresh': 28.238443139656408, 'atr_min_pct': 0.007611008857885033, 'atr_max_pct': 0.05253766000763695, 'tp_mult': 2.54897861907871, 'tsl_mult': 0.2794006130975599, 'strategy': 'mean_reversion', 'time_stop': 230, 'use_sma': False, 'use_atr': False, 'use_adx': True, 'use_ema': False, 'use_spike': True, 'rsi_required': False, 'edge_k': 0.8876494800557151, 'edge_cap': 0.4456530227144001, 'bull_strategy': 'breakout', 'bull_bb_std_mult': 1.4385211588463545, 'bull_rsi_os': 18, 'bull_rsi_ob': 60, 'bull_adx_thresh': 24.094595671458887, 'bull_atr_min_pct': 0.016835533382535055, 'bull_atr_max_pct': 0.12077727601336465, 'bull_tp_mult': 1.6416413002683217, 'bull_tsl_mult': 0.5664478649465191, 'bull_time_stop': 104, 'bull_use_sma': True, 'bull_use_ema': False, 'bull_use_atr': False, 'bull_use_adx': False, 'bull_use_spike': True, 'bull_rsi_required': False, 'bear_strategy': 'breakout', 'bear_bb_std_mult': 2.4340954270717705, 'bear_rsi_os': 39, 'bear_rsi_ob': 48, 'bear_adx_thresh': 24.781861396888107, 'bear_atr_min_pct': 0.023449577283046637, 'bear_atr_max_pct': 0.12654541716973294, 'bear_tp_mult': 1.1125542644941875, 'bear_tsl_mult': 0.133827925027546, 'bear_time_stop': 75, 'bear_use_sma': False, 'bear_use_ema': False, 'bear_use_atr': False, 'bear_use_adx': False, 'bear_use_spike': True, 'bear_rsi_required': False, 'sideways_strategy': 'breakout', 'sideways_bb_std_mult': 1.660889723411308, 'sideways_rsi_os': 14, 'sideways_rsi_ob': 80, 'sideways_adx_thresh': 17.234734142983573, 'sideways_atr_min_pct': 0.027730706357195167, 'sideways_atr_max_pct': 0.0855569459342195, 'sideways_tp_mult': 2.5258985676754127, 'sideways_tsl_mult': 0.30160979143032896, 'sideways_time_stop': 96, 'sideways_use_sma': True, 'sideways_use_ema': True, 'sideways_use_atr': True, 'sideways_use_adx': False, 'sideways_use_spike': True, 'sideways_rsi_required': True}.
[I 2025-09-01 02:56:29,039] Trial 202 finished with values: [-1000000000.0, 1000000000.0] and parameters: {'p_sma': 34, 'p_std': 55, 'p_atr': 29, 'p_adx': 16, 'rsi_period': 12, 'ema1': 20, 'ema2': 58, 'slip_atr_k': 0.08278818522363937, 'slip_spread_k': 0.28439230085813305, 'spread_hl_frac': 0.03897969332906814, 'bb_std_mult': 1.3681438173761387, 'rsi_os': 49, 'rsi_ob': 85, 'vol_spike': 0.2309925859893306, 'adx_thresh': 28.104070828676704, 'atr_min_pct': 0.007454658887303735, 'atr_max_pct': 0.0539990139359834, 'tp_mult': 2.5563994037817426, 'tsl_mult': 0.2819257318656042, 'strategy': 'mean_reversion', 'time_stop': 94, 'use_sma': False, 'use_atr': False, 'use_adx': True, 'use_ema': False, 'use_spike': True, 'rsi_required': False, 'edge_k': 0.8674109864142188, 'edge_cap': 0.4541470782202685, 'bull_strategy': 'mean_reversion', 'bull_bb_std_mult': 1.1878451976371196, 'bull_rsi_os': 48, 'bull_rsi_ob': 57, 'bull_adx_thresh': 24.450682559828383, 'bull_atr_min_pct': 0.0014555145547551255, 'bull_atr_max_pct': 0.12079245418890505, 'bull_tp_mult': 1.7700983699902462, 'bull_tsl_mult': 0.5662937407182204, 'bull_time_stop': 106, 'bull_use_sma': True, 'bull_use_ema': False, 'bull_use_atr': False, 'bull_use_adx': False, 'bull_use_spike': False, 'bull_rsi_required': False, 'bear_strategy': 'breakout', 'bear_bb_std_mult': 2.456523845599111, 'bear_rsi_os': 37, 'bear_rsi_ob': 73, 'bear_adx_thresh': 23.428289649590095, 'bear_atr_min_pct': 0.023508969642786686, 'bear_atr_max_pct': 0.12740413438399875, 'bear_tp_mult': 1.1110671198038122, 'bear_tsl_mult': 0.13623389735508085, 'bear_time_stop': 70, 'bear_use_sma': False, 'bear_use_ema': False, 'bear_use_atr': False, 'bear_use_adx': False, 'bear_use_spike': True, 'bear_rsi_required': False, 'sideways_strategy': 'mean_reversion', 'sideways_bb_std_mult': 1.6245769292624954, 'sideways_rsi_os': 14, 'sideways_rsi_ob': 84, 'sideways_adx_thresh': 30.887434610802714, 'sideways_atr_min_pct': 0.027939827392362285, 'sideways_atr_max_pct': 0.08681881202643632, 'sideways_tp_mult': 2.045246658814053, 'sideways_tsl_mult': 0.1861338376015517, 'sideways_time_stop': 152, 'sideways_use_sma': True, 'sideways_use_ema': True, 'sideways_use_atr': True, 'sideways_use_adx': False, 'sideways_use_spike': True, 'sideways_rsi_required': True}.
[I 2025-09-01 02:56:29,085] Trial 205 finished with values: [-1000000000.0, 1000000000.0] and parameters: {'p_sma': 34, 'p_std': 56, 'p_atr': 27, 'p_adx': 16, 'rsi_period': 14, 'ema1': 20, 'ema2': 28, 'slip_atr_k': 0.21388235518253662, 'slip_spread_k': 0.19926527660367055, 'spread_hl_frac': 0.035369634338232, 'bb_std_mult': 1.5552894492276228, 'rsi_os': 33, 'rsi_ob': 85, 'vol_spike': 0.21110428673672604, 'adx_thresh': 25.555835986921586, 'atr_min_pct': 0.006233711163174722, 'atr_max_pct': 0.040571696526632235, 'tp_mult': 2.722580943573714, 'tsl_mult': 0.31640461436092243, 'strategy': 'mean_reversion', 'time_stop': 191, 'use_sma': False, 'use_atr': False, 'use_adx': True, 'use_ema': False, 'use_spike': True, 'rsi_required': False, 'edge_k': 0.8517296488436897, 'edge_cap': 0.5084247192306214, 'bull_strategy': 'mean_reversion', 'bull_bb_std_mult': 1.2016111975824741, 'bull_rsi_os': 16, 'bull_rsi_ob': 61, 'bull_adx_thresh': 20.453285987073215, 'bull_atr_min_pct': 0.022188906748034837, 'bull_atr_max_pct': 0.015793365317343017, 'bull_tp_mult': 2.112169778158307, 'bull_tsl_mult': 0.30938976428046416, 'bull_time_stop': 127, 'bull_use_sma': True, 'bull_use_ema': False, 'bull_use_atr': False, 'bull_use_adx': True, 'bull_use_spike': False, 'bull_rsi_required': False, 'bear_strategy': 'breakout', 'bear_bb_std_mult': 2.4915440717424344, 'bear_rsi_os': 48, 'bear_rsi_ob': 64, 'bear_adx_thresh': 24.28576617213357, 'bear_atr_min_pct': 0.02139541702426921, 'bear_atr_max_pct': 0.12809112421757873, 'bear_tp_mult': 1.0559036727384254, 'bear_tsl_mult': 0.08780045927627443, 'bear_time_stop': 62, 'bear_use_sma': False, 'bear_use_ema': True, 'bear_use_atr': False, 'bear_use_adx': False, 'bear_use_spike': False, 'bear_rsi_required': True, 'sideways_strategy': 'mean_reversion', 'sideways_bb_std_mult': 1.9277802490972256, 'sideways_rsi_os': 17, 'sideways_rsi_ob': 78, 'sideways_adx_thresh': 30.564899483740856, 'sideways_atr_min_pct': 0.027795694264404633, 'sideways_atr_max_pct': 0.09010943074687, 'sideways_tp_mult': 1.2975930273997849, 'sideways_tsl_mult': 0.24298414768804766, 'sideways_time_stop': 152, 'sideways_use_sma': True, 'sideways_use_ema': True, 'sideways_use_atr': True, 'sideways_use_adx': False, 'sideways_use_spike': True, 'sideways_rsi_required': True}.
[I 2025-09-01 02:56:29,518] Trial 203 finished with values: [-0.02187988347681824, 0.021730677778960386] and parameters: {'p_sma': 34, 'p_std': 54, 'p_atr': 27, 'p_adx': 18, 'rsi_period': 12, 'ema1': 20, 'ema2': 27, 'slip_atr_k': 0.021681790374618617, 'slip_spread_k': 0.28298213289295393, 'spread_hl_frac': 0.03495715703785157, 'bb_std_mult': 1.5390359015574238, 'rsi_os': 33, 'rsi_ob': 89, 'vol_spike': 0.23569523764594288, 'adx_thresh': 28.005157735720232, 'atr_min_pct': 0.006515445274441282, 'atr_max_pct': 0.05485233144312229, 'tp_mult': 2.698662868566985, 'tsl_mult': 0.3220012186743562, 'strategy': 'mean_reversion', 'time_stop': 190, 'use_sma': False, 'use_atr': False, 'use_adx': True, 'use_ema': False, 'use_spike': True, 'rsi_required': False, 'edge_k': 0.9489212403620377, 'edge_cap': 0.43608392616992797, 'bull_strategy': 'mean_reversion', 'bull_bb_std_mult': 3.034363669409022, 'bull_rsi_os': 38, 'bull_rsi_ob': 57, 'bull_adx_thresh': 20.407082874950813, 'bull_atr_min_pct': 3.362525082100808e-05, 'bull_atr_max_pct': 0.11984043229786534, 'bull_tp_mult': 1.578900949276504, 'bull_tsl_mult': 0.6112243007294289, 'bull_time_stop': 146, 'bull_use_sma': True, 'bull_use_ema': False, 'bull_use_atr': False, 'bull_use_adx': True, 'bull_use_spike': False, 'bull_rsi_required': False, 'bear_strategy': 'breakout', 'bear_bb_std_mult': 2.469797678005497, 'bear_rsi_os': 38, 'bear_rsi_ob': 52, 'bear_adx_thresh': 23.297353035408808, 'bear_atr_min_pct': 0.023181103006481477, 'bear_atr_max_pct': 0.12726571866744096, 'bear_tp_mult': 1.107747889911191, 'bear_tsl_mult': 0.13945874753935134, 'bear_time_stop': 58, 'bear_use_sma': False, 'bear_use_ema': True, 'bear_use_atr': False, 'bear_use_adx': False, 'bear_use_spike': False, 'bear_rsi_required': False, 'sideways_strategy': 'mean_reversion', 'sideways_bb_std_mult': 1.6575452250913483, 'sideways_rsi_os': 14, 'sideways_rsi_ob': 80, 'sideways_adx_thresh': 17.121041812757632, 'sideways_atr_min_pct': 0.027740269985154803, 'sideways_atr_max_pct': 0.08518061801246414, 'sideways_tp_mult': 1.1190139365963983, 'sideways_tsl_mult': 0.2402559550496043, 'sideways_time_stop': 156, 'sideways_use_sma': True, 'sideways_use_ema': True, 'sideways_use_atr': True, 'sideways_use_adx': False, 'sideways_use_spike': True, 'sideways_rsi_required': True}.
[I 2025-09-01 02:56:29,876] Trial 204 finished with values: [-0.016450078691237824, 0.016300716102699175] and parameters: {'p_sma': 34, 'p_std': 55, 'p_atr': 27, 'p_adx': 18, 'rsi_period': 14, 'ema1': 20, 'ema2': 58, 'slip_atr_k': 0.02029022008567195, 'slip_spread_k': 0.19354436713575005, 'spread_hl_frac': 0.03491340271914836, 'bb_std_mult': 1.523768558014829, 'rsi_os': 47, 'rsi_ob': 85, 'vol_spike': 0.2291029329186006, 'adx_thresh': 27.820329027228006, 'atr_min_pct': 0.007296783166819654, 'atr_max_pct': 0.03942362496082806, 'tp_mult': 2.55640139954599, 'tsl_mult': 0.28800046428572346, 'strategy': 'mean_reversion', 'time_stop': 206, 'use_sma': False, 'use_atr': False, 'use_adx': True, 'use_ema': False, 'use_spike': True, 'rsi_required': False, 'edge_k': 0.09099577338800979, 'edge_cap': 0.44995091107448654, 'bull_strategy': 'mean_reversion', 'bull_bb_std_mult': 1.2102212178542773, 'bull_rsi_os': 47, 'bull_rsi_ob': 57, 'bull_adx_thresh': 20.582278440114283, 'bull_atr_min_pct': 0.0013867383657849572, 'bull_atr_max_pct': 0.1198252292894061, 'bull_tp_mult': 1.5871621164821625, 'bull_tsl_mult': 0.3170302539498274, 'bull_time_stop': 121, 'bull_use_sma': True, 'bull_use_ema': False, 'bull_use_atr': False, 'bull_use_adx': True, 'bull_use_spike': False, 'bull_rsi_required': False, 'bear_strategy': 'breakout', 'bear_bb_std_mult': 2.5093152943667842, 'bear_rsi_os': 23, 'bear_rsi_ob': 60, 'bear_adx_thresh': 23.4073120706006, 'bear_atr_min_pct': 0.023534699022875562, 'bear_atr_max_pct': 0.12742684013782798, 'bear_tp_mult': 1.1182474799986983, 'bear_tsl_mult': 0.0903890690071521, 'bear_time_stop': 59, 'bear_use_sma': False, 'bear_use_ema': True, 'bear_use_atr': False, 'bear_use_adx': False, 'bear_use_spike': True, 'bear_rsi_required': False, 'sideways_strategy': 'mean_reversion', 'sideways_bb_std_mult': 1.6673072484263562, 'sideways_rsi_os': 14, 'sideways_rsi_ob': 79, 'sideways_adx_thresh': 20.16763891602019, 'sideways_atr_min_pct': 0.027398452228809773, 'sideways_atr_max_pct': 0.08656533686138745, 'sideways_tp_mult': 2.510524271932733, 'sideways_tsl_mult': 0.18921881652139305, 'sideways_time_stop': 162, 'sideways_use_sma': True, 'sideways_use_ema': True, 'sideways_use_atr': True, 'sideways_use_adx': False, 'sideways_use_spike': True, 'sideways_rsi_required': True}.
[I 2025-09-01 02:57:10,750] Trial 206 finished with values: [-1000000000.0, 1000000000.0] and parameters: {'p_sma': 32, 'p_std': 54, 'p_atr': 27, 'p_adx': 18, 'rsi_period': 22, 'ema1': 21, 'ema2': 60, 'slip_atr_k': 0.02729930087390292, 'slip_spread_k': 0.2173855042276353, 'spread_hl_frac': 0.04063284056927616, 'bb_std_mult': 1.5292353758829653, 'rsi_os': 47, 'rsi_ob': 88, 'vol_spike': 0.22422421043553012, 'adx_thresh': 24.747809479822855, 'atr_min_pct': 0.008776801882542406, 'atr_max_pct': 0.04688218394485343, 'tp_mult': 2.8981592620909304, 'tsl_mult': 0.35626889159120656, 'strategy': 'mean_reversion', 'time_stop': 274, 'use_sma': True, 'use_atr': True, 'use_adx': True, 'use_ema': True, 'use_spike': False, 'rsi_required': True, 'edge_k': 0.0005484932320394265, 'edge_cap': 0.5924866300830541, 'bull_strategy': 'mean_reversion', 'bull_bb_std_mult': 1.2453017443520762, 'bull_rsi_os': 6, 'bull_rsi_ob': 61, 'bull_adx_thresh': 25.331265840236128, 'bull_atr_min_pct': 0.014263290503044503, 'bull_atr_max_pct': 0.1271723415767589, 'bull_tp_mult': 1.57863480927318, 'bull_tsl_mult': 0.6135657178197483, 'bull_time_stop': 135, 'bull_use_sma': True, 'bull_use_ema': False, 'bull_use_atr': True, 'bull_use_adx': False, 'bull_use_spike': True, 'bull_rsi_required': False, 'bear_strategy': 'mean_reversion', 'bear_bb_std_mult': 2.539472031255592, 'bear_rsi_os': 15, 'bear_rsi_ob': 58, 'bear_adx_thresh': 23.03619305778446, 'bear_atr_min_pct': 0.01946856110466984, 'bear_atr_max_pct': 0.13100059772800576, 'bear_tp_mult': 1.0488033455092765, 'bear_tsl_mult': 0.06310335536059175, 'bear_time_stop': 58, 'bear_use_sma': True, 'bear_use_ema': False, 'bear_use_atr': True, 'bear_use_adx': False, 'bear_use_spike': True, 'bear_rsi_required': True, 'sideways_strategy': 'breakout', 'sideways_bb_std_mult': 1.8901401397657394, 'sideways_rsi_os': 17, 'sideways_rsi_ob': 80, 'sideways_adx_thresh': 29.64631126723635, 'sideways_atr_min_pct': 0.02922239950834348, 'sideways_atr_max_pct': 0.09975603609836964, 'sideways_tp_mult': 1.25472915453323, 'sideways_tsl_mult': 0.22365835001491535, 'sideways_time_stop': 162, 'sideways_use_sma': True, 'sideways_use_ema': False, 'sideways_use_atr': True, 'sideways_use_adx': False, 'sideways_use_spike': False, 'sideways_rsi_required': True}.
