[I 2025-09-01 02:22:09,439] Trial 11 finished with values: [-0.060184605775704614, 0.05965668744563026] and parameters: {'p_sma': 54, 'p_std': 42, 'p_atr': 11, 'p_adx': 17, 'rsi_period': 67, 'ema1': 21, 'ema2': 48, 'slip_atr_k': 0.13920581333039922, 'slip_spread_k': 0.9119273537770408, 'spread_hl_frac': 0.002050153510302638, 'bb_std_mult': 2.726928116378627, 'rsi_os': 55, 'rsi_ob': 93, 'vol_spike': 0.19685669002980624, 'adx_thresh': 8.808701422087706, 'atr_min_pct': 0.013236421658274385, 'atr_max_pct': 0.01920035143154989, 'tp_mult': 2.8963522653721743, 'tsl_mult': 0.5805768372093567, 'strategy': 'breakout', 'time_stop': 152, 'use_sma': False, 'use_atr': False, 'use_adx': True, 'use_ema': False, 'use_spike': False, 'rsi_required': True, 'edge_k': 1.058199487608905, 'edge_cap': 0.8752747989522996, 'bull_strategy': 'breakout', 'bull_bb_std_mult': 2.505043374505621, 'bull_rsi_os': 10, 'bull_rsi_ob': 59, 'bull_adx_thresh': 26.135401072159716, 'bull_atr_min_pct': 0.010744573213284127, 'bull_atr_max_pct': 0.08717816128459249, 'bull_tp_mult': 1.2030214346155907, 'bull_tsl_mult': 0.9614614510320625, 'bull_time_stop': 244, 'bull_use_sma': True, 'bull_use_ema': True, 'bull_use_atr': True, 'bull_use_adx': False, 'bull_use_spike': True, 'bull_rsi_required': True, 'bear_strategy': 'breakout', 'bear_bb_std_mult': 3.371205955539468, 'bear_rsi_os': 37, 'bear_rsi_ob': 90, 'bear_adx_thresh': 11.251408490813397, 'bear_atr_min_pct': 0.0018426455841527832, 'bear_atr_max_pct': 0.060749104883154485, 'bear_tp_mult': 1.028232993329198, 'bear_tsl_mult': 0.5180131390931004, 'bear_time_stop': 292, 'bear_use_sma': True, 'bear_use_ema': False, 'bear_use_atr': True, 'bear_use_adx': False, 'bear_use_spike': False, 'bear_rsi_required': True, 'sideways_strategy': 'mean_reversion', 'sideways_bb_std_mult': 3.5214029685632653, 'sideways_rsi_os': 21, 'sideways_rsi_ob': 92, 'sideways_adx_thresh': 33.84756048413318, 'sideways_atr_min_pct': 0.002165261236865844, 'sideways_atr_max_pct': 0.06518547127307388, 'sideways_tp_mult': 1.4487819889930336, 'sideways_tsl_mult': 0.9594835930207417, 'sideways_time_stop': 191, 'sideways_use_sma': False, 'sideways_use_ema': False, 'sideways_use_atr': False, 'sideways_use_adx': False, 'sideways_use_spike': False, 'sideways_rsi_required': True}.
[I 2025-09-01 02:22:10,517] Trial 7 finished with values: [-1000000000.0, 1000000000.0] and parameters: {'p_sma': 19, 'p_std': 60, 'p_atr': 9, 'p_adx': 14, 'rsi_period': 14, 'ema1': 29, 'ema2': 12, 'slip_atr_k': 0.058390840411261885, 'slip_spread_k': 0.32731012551570937, 'spread_hl_frac': 0.01047134398472609, 'bb_std_mult': 0.8532867823155081, 'rsi_os': 45, 'rsi_ob': 90, 'vol_spike': 0.15535923130666085, 'adx_thresh': 5.630487863402643, 'atr_min_pct': 0.0019429293508018807, 'atr_max_pct': 0.02116055062250714, 'tp_mult': 2.101625904119377, 'tsl_mult': 0.9239150208341461, 'strategy': 'breakout', 'time_stop': 262, 'use_sma': True, 'use_atr': True, 'use_adx': True, 'use_ema': False, 'use_spike': True, 'rsi_required': True, 'edge_k': 0.3483007119966455, 'edge_cap': 0.9526392449944097, 'bull_strategy': 'breakout', 'bull_bb_std_mult': 3.3450007344750903, 'bull_rsi_os': 28, 'bull_rsi_ob': 63, 'bull_adx_thresh': 25.348599363257904, 'bull_atr_min_pct': 0.012769191033179304, 'bull_atr_max_pct': 0.07878518679987939, 'bull_tp_mult': 1.2156005335097175, 'bull_tsl_mult': 0.561913903432758, 'bull_time_stop': 169, 'bull_use_sma': False, 'bull_use_ema': False, 'bull_use_atr': True, 'bull_use_adx': False, 'bull_use_spike': False, 'bull_rsi_required': False, 'bear_strategy': 'mean_reversion', 'bear_bb_std_mult': 2.5799243688659983, 'bear_rsi_os': 19, 'bear_rsi_ob': 70, 'bear_adx_thresh': 26.669831340437565, 'bear_atr_min_pct': 0.028174104071099312, 'bear_atr_max_pct': 0.1114426202537487, 'bear_tp_mult': 2.1575467806984334, 'bear_tsl_mult': 0.4975740492202687, 'bear_time_stop': 258, 'bear_use_sma': False, 'bear_use_ema': False, 'bear_use_atr': False, 'bear_use_adx': False, 'bear_use_spike': False, 'bear_rsi_required': False, 'sideways_strategy': 'mean_reversion', 'sideways_bb_std_mult': 3.138562763918463, 'sideways_rsi_os': 42, 'sideways_rsi_ob': 49, 'sideways_adx_thresh': 8.34466351197625, 'sideways_atr_min_pct': 0.004818553548955166, 'sideways_atr_max_pct': 0.051689211216014136, 'sideways_tp_mult': 2.7002590519549536, 'sideways_tsl_mult': 0.6695189501835107, 'sideways_time_stop': 64, 'sideways_use_sma': True, 'sideways_use_ema': True, 'sideways_use_atr': True, 'sideways_use_adx': True, 'sideways_use_spike': False, 'sideways_rsi_required': True}.
[I 2025-09-01 02:22:11,117] Trial 10 finished with values: [-1000000000.0, 1000000000.0] and parameters: {'p_sma': 13, 'p_std': 28, 'p_atr': 22, 'p_adx': 28, 'rsi_period': 59, 'ema1': 17, 'ema2': 20, 'slip_atr_k': 0.1372128999688913, 'slip_spread_k': 0.1228267558081022, 'spread_hl_frac': 0.04132493424853261, 'bb_std_mult': 3.446701303293299, 'rsi_os': 44, 'rsi_ob': 79, 'vol_spike': 0.08182024682928503, 'adx_thresh': 12.129867597802798, 'atr_min_pct': 0.028116789981321718, 'atr_max_pct': 0.08458397506936667, 'tp_mult': 1.931922708329713, 'tsl_mult': 0.6303948795333507, 'strategy': 'mean_reversion', 'time_stop': 213, 'use_sma': False, 'use_atr': True, 'use_adx': False, 'use_ema': False, 'use_spike': True, 'rsi_required': False, 'edge_k': 1.975704460026926, 'edge_cap': 0.9417967326492693, 'bull_strategy': 'mean_reversion', 'bull_bb_std_mult': 2.7702802899093983, 'bull_rsi_os': 24, 'bull_rsi_ob': 90, 'bull_adx_thresh': 19.061263505274145, 'bull_atr_min_pct': 0.015151000577102072, 'bull_atr_max_pct': 0.1181395400984698, 'bull_tp_mult': 2.3291177787013067, 'bull_tsl_mult': 0.391984480437229, 'bull_time_stop': 68, 'bull_use_sma': True, 'bull_use_ema': False, 'bull_use_atr': False, 'bull_use_adx': False, 'bull_use_spike': True, 'bull_rsi_required': True, 'bear_strategy': 'breakout', 'bear_bb_std_mult': 1.7092124917313507, 'bear_rsi_os': 14, 'bear_rsi_ob': 59, 'bear_adx_thresh': 21.06295630512406, 'bear_atr_min_pct': 0.02801019592772211, 'bear_atr_max_pct': 0.14563922566442974, 'bear_tp_mult': 2.1204901281982806, 'bear_tsl_mult': 0.913135562062664, 'bear_time_stop': 170, 'bear_use_sma': True, 'bear_use_ema': True, 'bear_use_atr': False, 'bear_use_adx': False, 'bear_use_spike': True, 'bear_rsi_required': True, 'sideways_strategy': 'mean_reversion', 'sideways_bb_std_mult': 1.5014000854776484, 'sideways_rsi_os': 44, 'sideways_rsi_ob': 72, 'sideways_adx_thresh': 33.31823380913833, 'sideways_atr_min_pct': 0.013551085729182353, 'sideways_atr_max_pct': 0.1085134340971841, 'sideways_tp_mult': 1.1220802510753212, 'sideways_tsl_mult': 0.7234065237423108, 'sideways_time_stop': 182, 'sideways_use_sma': True, 'sideways_use_ema': True, 'sideways_use_atr': True, 'sideways_use_adx': True, 'sideways_use_spike': True, 'sideways_rsi_required': False}.
[I 2025-09-01 02:22:55,553] Trial 12 finished with values: [-1000000000.0, 1000000000.0] and parameters: {'p_sma': 21, 'p_std': 10, 'p_atr': 30, 'p_adx': 14, 'rsi_period': 9, 'ema1': 28, 'ema2': 14, 'slip_atr_k': 0.24095228608278782, 'slip_spread_k': 0.4780731483021611, 'spread_hl_frac': 0.04302134501548655, 'bb_std_mult': 1.5768799226379389, 'rsi_os': 47, 'rsi_ob': 81, 'vol_spike': 0.24493700879174585, 'adx_thresh': 12.652854608140071, 'atr_min_pct': 0.013978244016471738, 'atr_max_pct': 0.13184472501302763, 'tp_mult': 1.18181047037548, 'tsl_mult': 0.002469724441763077, 'strategy': 'mean_reversion', 'time_stop': 54, 'use_sma': True, 'use_atr': False, 'use_adx': False, 'use_ema': True, 'use_spike': False, 'rsi_required': False, 'edge_k': 0.016952591351998336, 'edge_cap': 0.8922083786660853, 'bull_strategy': 'breakout', 'bull_bb_std_mult': 2.1336215141089303, 'bull_rsi_os': 54, 'bull_rsi_ob': 66, 'bull_adx_thresh': 16.217256505504658, 'bull_atr_min_pct': 0.0199104155058426, 'bull_atr_max_pct': 0.13926434473183777, 'bull_tp_mult': 2.3081016349608148, 'bull_tsl_mult': 0.7870778299661061, 'bull_time_stop': 101, 'bull_use_sma': True, 'bull_use_ema': True, 'bull_use_atr': False, 'bull_use_adx': True, 'bull_use_spike': True, 'bull_rsi_required': False, 'bear_strategy': 'mean_reversion', 'bear_bb_std_mult': 1.8504045847406172, 'bear_rsi_os': 11, 'bear_rsi_ob': 60, 'bear_adx_thresh': 9.390709776112946, 'bear_atr_min_pct': 0.02068289391955421, 'bear_atr_max_pct': 0.09331343217769802, 'bear_tp_mult': 1.5862929964803367, 'bear_tsl_mult': 0.8077185753751033, 'bear_time_stop': 212, 'bear_use_sma': True, 'bear_use_ema': True, 'bear_use_atr': False, 'bear_use_adx': True, 'bear_use_spike': False, 'bear_rsi_required': False, 'sideways_strategy': 'mean_reversion', 'sideways_bb_std_mult': 2.435100839166041, 'sideways_rsi_os': 49, 'sideways_rsi_ob': 83, 'sideways_adx_thresh': 32.44471110651997, 'sideways_atr_min_pct': 0.007067097908692834, 'sideways_atr_max_pct': 0.02128723959192016, 'sideways_tp_mult': 2.936982408329572, 'sideways_tsl_mult': 0.8014506793458123, 'sideways_time_stop': 256, 'sideways_use_sma': True, 'sideways_use_ema': True, 'sideways_use_atr': True, 'sideways_use_adx': False, 'sideways_use_spike': True, 'sideways_rsi_required': True}.
[I 2025-09-01 02:22:56,301] Trial 15 finished with values: [-0.14605698279474255, 0.1456487539578746] and parameters: {'p_sma': 59, 'p_std': 13, 'p_atr': 15, 'p_adx': 15, 'rsi_period': 84, 'ema1': 23, 'ema2': 60, 'slip_atr_k': 0.034761557405989824, 'slip_spread_k': 0.9836924751643878, 'spread_hl_frac': 0.0007984924915805981, 'bb_std_mult': 2.6318348690570237, 'rsi_os': 33, 'rsi_ob': 95, 'vol_spike': 0.27583159805995733, 'adx_thresh': 5.156722958446686, 'atr_min_pct': 0.01785957535563777, 'atr_max_pct': 0.04085965991021841, 'tp_mult': 2.9742172606472006, 'tsl_mult': 0.40128595466612516, 'strategy': 'breakout', 'time_stop': 151, 'use_sma': False, 'use_atr': False, 'use_adx': True, 'use_ema': True, 'use_spike': False, 'rsi_required': True, 'edge_k': 1.378388773390664, 'edge_cap': 0.7795776872572073, 'bull_strategy': 'mean_reversion', 'bull_bb_std_mult': 1.78280629210051, 'bull_rsi_os': 42, 'bull_rsi_ob': 51, 'bull_adx_thresh': 25.86278841617787, 'bull_atr_min_pct': 0.007902429230412011, 'bull_atr_max_pct': 0.06884284886420468, 'bull_tp_mult': 1.7957742866011748, 'bull_tsl_mult': 0.9700084477461643, 'bull_time_stop': 127, 'bull_use_sma': True, 'bull_use_ema': True, 'bull_use_atr': True, 'bull_use_adx': True, 'bull_use_spike': True, 'bull_rsi_required': True, 'bear_strategy': 'breakout', 'bear_bb_std_mult': 3.5366436357388227, 'bear_rsi_os': 54, 'bear_rsi_ob': 95, 'bear_adx_thresh': 6.101027850847097, 'bear_atr_min_pct': 2.769495764149972e-05, 'bear_atr_max_pct': 0.05543787331175945, 'bear_tp_mult': 1.0400475438717813, 'bear_tsl_mult': 0.3093516629340487, 'bear_time_stop': 283, 'bear_use_sma': True, 'bear_use_ema': False, 'bear_use_atr': True, 'bear_use_adx': False, 'bear_use_spike': False, 'bear_rsi_required': True, 'sideways_strategy': 'mean_reversion', 'sideways_bb_std_mult': 3.5669560584949793, 'sideways_rsi_os': 25, 'sideways_rsi_ob': 94, 'sideways_adx_thresh': 25.041693451677656, 'sideways_atr_min_pct': 0.0001596098171301845, 'sideways_atr_max_pct': 0.146596094489289, 'sideways_tp_mult': 1.6552665874620809, 'sideways_tsl_mult': 0.4405151666576847, 'sideways_time_stop': 226, 'sideways_use_sma': False, 'sideways_use_ema': False, 'sideways_use_atr': False, 'sideways_use_adx': False, 'sideways_use_spike': False, 'sideways_rsi_required': True}.
[I 2025-09-01 02:22:57,572] Trial 14 finished with values: [-0.10320766970864403, 0.10278647478449726] and parameters: {'p_sma': 5, 'p_std': 13, 'p_atr': 16, 'p_adx': 30, 'rsi_period': 84, 'ema1': 22, 'ema2': 60, 'slip_atr_k': 0.02801865123796557, 'slip_spread_k': 0.9937485334525235, 'spread_hl_frac': 0.0016744766557027294, 'bb_std_mult': 2.630042262009064, 'rsi_os': 35, 'rsi_ob': 95, 'vol_spike': 0.09320877475516719, 'adx_thresh': 5.52266962274171, 'atr_min_pct': 0.0183284952750473, 'atr_max_pct': 0.04877680012860669, 'tp_mult': 2.955061707299723, 'tsl_mult': 0.4604006663004238, 'strategy': 'breakout', 'time_stop': 184, 'use_sma': False, 'use_atr': False, 'use_adx': True, 'use_ema': True, 'use_spike': False, 'rsi_required': True, 'edge_k': 1.414491332197535, 'edge_cap': 0.9992594797139829, 'bull_strategy': 'mean_reversion', 'bull_bb_std_mult': 2.1915138957841482, 'bull_rsi_os': 41, 'bull_rsi_ob': 52, 'bull_adx_thresh': 25.493495843733605, 'bull_atr_min_pct': 0.010252152249447484, 'bull_atr_max_pct': 0.06494883646578441, 'bull_tp_mult': 1.7509119194739864, 'bull_tsl_mult': 0.9854219080475204, 'bull_time_stop': 130, 'bull_use_sma': True, 'bull_use_ema': True, 'bull_use_atr': True, 'bull_use_adx': True, 'bull_use_spike': True, 'bull_rsi_required': True, 'bear_strategy': 'breakout', 'bear_bb_std_mult': 3.2357381409072663, 'bear_rsi_os': 55, 'bear_rsi_ob': 95, 'bear_adx_thresh': 6.352270819875514, 'bear_atr_min_pct': 0.001064616674376723, 'bear_atr_max_pct': 0.06125877998595235, 'bear_tp_mult': 1.0150012177375958, 'bear_tsl_mult': 0.3057592699554451, 'bear_time_stop': 296, 'bear_use_sma': True, 'bear_use_ema': False, 'bear_use_atr': True, 'bear_use_adx': False, 'bear_use_spike': False, 'bear_rsi_required': True, 'sideways_strategy': 'mean_reversion', 'sideways_bb_std_mult': 3.5808699218783477, 'sideways_rsi_os': 54, 'sideways_rsi_ob': 95, 'sideways_adx_thresh': 24.975923194335433, 'sideways_atr_min_pct': 0.0016283239980076794, 'sideways_atr_max_pct': 0.14985643317701572, 'sideways_tp_mult': 1.5087416717503186, 'sideways_tsl_mult': 0.02382116383253291, 'sideways_time_stop': 193, 'sideways_use_sma': False, 'sideways_use_ema': False, 'sideways_use_atr': False, 'sideways_use_adx': False, 'sideways_use_spike': False, 'sideways_rsi_required': True}.
[I 2025-09-01 02:22:58,797] Trial 13 finished with values: [-1000000000.0, 1000000000.0] and parameters: {'p_sma': 59, 'p_std': 9, 'p_atr': 14, 'p_adx': 14, 'rsi_period': 39, 'ema1': 22, 'ema2': 46, 'slip_atr_k': 0.039878619626430384, 'slip_spread_k': 0.9486756064280203, 'spread_hl_frac': 0.0013026658106285146, 'bb_std_mult': 2.6752182151006014, 'rsi_os': 38, 'rsi_ob': 79, 'vol_spike': 0.26796016588770266, 'adx_thresh': 7.04000536234779, 'atr_min_pct': 0.00038647252530737107, 'atr_max_pct': 0.01599810879218176, 'tp_mult': 2.9345110552351175, 'tsl_mult': 0.43511205783933676, 'strategy': 'breakout', 'time_stop': 142, 'use_sma': False, 'use_atr': False, 'use_adx': True, 'use_ema': True, 'use_spike': True, 'rsi_required': False, 'edge_k': 0.059605091527391574, 'edge_cap': 0.9436109814859588, 'bull_strategy': 'mean_reversion', 'bull_bb_std_mult': 2.0628442751052614, 'bull_rsi_os': 35, 'bull_rsi_ob': 53, 'bull_adx_thresh': 25.984407124023335, 'bull_atr_min_pct': 0.014812928157645313, 'bull_atr_max_pct': 0.07697828135160115, 'bull_tp_mult': 1.0747364149406777, 'bull_tsl_mult': 0.9987066894380948, 'bull_time_stop': 143, 'bull_use_sma': True, 'bull_use_ema': True, 'bull_use_atr': True, 'bull_use_adx': True, 'bull_use_spike': True, 'bull_rsi_required': True, 'bear_strategy': 'breakout', 'bear_bb_std_mult': 3.4671233714387637, 'bear_rsi_os': 5, 'bear_rsi_ob': 66, 'bear_adx_thresh': 25.92075424382826, 'bear_atr_min_pct': 0.00020405800203779183, 'bear_atr_max_pct': 0.14576755186497373, 'bear_tp_mult': 1.011574426716508, 'bear_tsl_mult': 0.33600791390105733, 'bear_time_stop': 297, 'bear_use_sma': False, 'bear_use_ema': False, 'bear_use_atr': False, 'bear_use_adx': False, 'bear_use_spike': True, 'bear_rsi_required': True, 'sideways_strategy': 'mean_reversion', 'sideways_bb_std_mult': 3.5045913362223446, 'sideways_rsi_os': 44, 'sideways_rsi_ob': 95, 'sideways_adx_thresh': 24.783474094775325, 'sideways_atr_min_pct': 0.0006350219301649029, 'sideways_atr_max_pct': 0.14455446341229464, 'sideways_tp_mult': 2.7708247099333434, 'sideways_tsl_mult': 0.014929658535973778, 'sideways_time_stop': 176, 'sideways_use_sma': False, 'sideways_use_ema': True, 'sideways_use_atr': False, 'sideways_use_adx': False, 'sideways_use_spike': True, 'sideways_rsi_required': True}.
[I 2025-09-01 02:23:42,951] Trial 18 finished with values: [-1000000000.0, 1000000000.0] and parameters: {'p_sma': 5, 'p_std': 20, 'p_atr': 13, 'p_adx': 22, 'rsi_period': 45, 'ema1': 20, 'ema2': 45, 'slip_atr_k': 0.07653899786644769, 'slip_spread_k': 0.9624811265981508, 'spread_hl_frac': 0.015065919502265197, 'bb_std_mult': 2.4360222598982246, 'rsi_os': 38, 'rsi_ob': 68, 'vol_spike': 0.20185582358921036, 'adx_thresh': 12.51621432729415, 'atr_min_pct': 0.02238144586433624, 'atr_max_pct': 0.024830390921753973, 'tp_mult': 2.6089913183973152, 'tsl_mult': 0.43804645445566837, 'strategy': 'breakout', 'time_stop': 115, 'use_sma': False, 'use_atr': False, 'use_adx': True, 'use_ema': True, 'use_spike': False, 'rsi_required': True, 'edge_k': 0.8097552190101535, 'edge_cap': 0.06080833232246058, 'bull_strategy': 'mean_reversion', 'bull_bb_std_mult': 1.5794691134360055, 'bull_rsi_os': 36, 'bull_rsi_ob': 57, 'bull_adx_thresh': 26.08403012109541, 'bull_atr_min_pct': 0.0075341472240684606, 'bull_atr_max_pct': 0.054457930130362535, 'bull_tp_mult': 1.3321051030266922, 'bull_tsl_mult': 0.8295317227348229, 'bull_time_stop': 287, 'bull_use_sma': True, 'bull_use_ema': True, 'bull_use_atr': True, 'bull_use_adx': True, 'bull_use_spike': True, 'bull_rsi_required': True, 'bear_strategy': 'breakout', 'bear_bb_std_mult': 3.0177736191666886, 'bear_rsi_os': 37, 'bear_rsi_ob': 48, 'bear_adx_thresh': 23.55387482596455, 'bear_atr_min_pct': 0.009215789066061936, 'bear_atr_max_pct': 0.02951444579134625, 'bear_tp_mult': 1.0167712600674135, 'bear_tsl_mult': 0.25879613284089525, 'bear_time_stop': 290, 'bear_use_sma': False, 'bear_use_ema': False, 'bear_use_atr': True, 'bear_use_adx': False, 'bear_use_spike': True, 'bear_rsi_required': True, 'sideways_strategy': 'mean_reversion', 'sideways_bb_std_mult': 3.4218740936476193, 'sideways_rsi_os': 26, 'sideways_rsi_ob': 95, 'sideways_adx_thresh': 26.611037661574752, 'sideways_atr_min_pct': 0.02022417922004773, 'sideways_atr_max_pct': 0.06065266801335133, 'sideways_tp_mult': 1.4270535459326188, 'sideways_tsl_mult': 0.035605750518644064, 'sideways_time_stop': 158, 'sideways_use_sma': False, 'sideways_use_ema': False, 'sideways_use_atr': False, 'sideways_use_adx': False, 'sideways_use_spike': False, 'sideways_rsi_required': True}.
[I 2025-09-01 02:23:42,966] Trial 17 finished with values: [-0.15429210771069268, 0.15385263370458463] and parameters: {'p_sma': 58, 'p_std': 5, 'p_atr': 15, 'p_adx': 15, 'rsi_period': 47, 'ema1': 23, 'ema2': 46, 'slip_atr_k': 0.08438403922757498, 'slip_spread_k': 0.9292156093873029, 'spread_hl_frac': 0.013699776104217886, 'bb_std_mult': 2.6082686722651967, 'rsi_os': 34, 'rsi_ob': 72, 'vol_spike': 0.2966766481902122, 'adx_thresh': 5.214519781185537, 'atr_min_pct': 0.019758429085650342, 'atr_max_pct': 0.03247620613393053, 'tp_mult': 2.9511323147502155, 'tsl_mult': 0.3606020650188092, 'strategy': 'breakout', 'time_stop': 141, 'use_sma': False, 'use_atr': False, 'use_adx': True, 'use_ema': True, 'use_spike': False, 'rsi_required': True, 'edge_k': 1.4190357980687602, 'edge_cap': 0.7782969764459433, 'bull_strategy': 'mean_reversion', 'bull_bb_std_mult': 1.6333998861533514, 'bull_rsi_os': 38, 'bull_rsi_ob': 53, 'bull_adx_thresh': 25.647603660680733, 'bull_atr_min_pct': 0.0067166235065979, 'bull_atr_max_pct': 0.0812483944478598, 'bull_tp_mult': 1.7307202833986233, 'bull_tsl_mult': 0.9828200534848852, 'bull_time_stop': 279, 'bull_use_sma': True, 'bull_use_ema': True, 'bull_use_atr': True, 'bull_use_adx': True, 'bull_use_spike': True, 'bull_rsi_required': True, 'bear_strategy': 'breakout', 'bear_bb_std_mult': 3.5747990954007536, 'bear_rsi_os': 55, 'bear_rsi_ob': 95, 'bear_adx_thresh': 24.51159428214566, 'bear_atr_min_pct': 0.00017599093492604847, 'bear_atr_max_pct': 0.03010598025295707, 'bear_tp_mult': 1.0146948236004323, 'bear_tsl_mult': 0.33141291157758135, 'bear_time_stop': 295, 'bear_use_sma': True, 'bear_use_ema': False, 'bear_use_atr': True, 'bear_use_adx': False, 'bear_use_spike': False, 'bear_rsi_required': True, 'sideways_strategy': 'mean_reversion', 'sideways_bb_std_mult': 3.50358120348825, 'sideways_rsi_os': 25, 'sideways_rsi_ob': 95, 'sideways_adx_thresh': 25.488877501105897, 'sideways_atr_min_pct': 0.00030006245388585623, 'sideways_atr_max_pct': 0.14935642415395742, 'sideways_tp_mult': 1.548588061504864, 'sideways_tsl_mult': 0.008799764991362646, 'sideways_time_stop': 154, 'sideways_use_sma': False, 'sideways_use_ema': False, 'sideways_use_atr': False, 'sideways_use_adx': False, 'sideways_use_spike': False, 'sideways_rsi_required': True}.
