[I 2025-09-01 02:52:24,747] Trial 176 finished with values: [-1000000000.0, 1000000000.0] and parameters: {'p_sma': 37, 'p_std': 45, 'p_atr': 24, 'p_adx': 9, 'rsi_period': 63, 'ema1': 23, 'ema2': 56, 'slip_atr_k': 0.044478226861506855, 'slip_spread_k': 0.4784374266887281, 'spread_hl_frac': 0.017332056056533506, 'bb_std_mult': 2.6561235930638043, 'rsi_os': 46, 'rsi_ob': 72, 'vol_spike': 0.13550948676750335, 'adx_thresh': 18.29964159624176, 'atr_min_pct': 0.022845419771758364, 'atr_max_pct': 0.06962275827860197, 'tp_mult': 2.0392071494102098, 'tsl_mult': 0.19377889594238704, 'strategy': 'breakout', 'time_stop': 144, 'use_sma': True, 'use_atr': False, 'use_adx': False, 'use_ema': False, 'use_spike': True, 'rsi_required': False, 'edge_k': 0.4527886522726772, 'edge_cap': 0.4164517192488782, 'bull_strategy': 'breakout', 'bull_bb_std_mult': 0.9689731348133608, 'bull_rsi_os': 27, 'bull_rsi_ob': 63, 'bull_adx_thresh': 32.5322757972841, 'bull_atr_min_pct': 0.020423686671088823, 'bull_atr_max_pct': 0.11133091051239832, 'bull_tp_mult': 1.841562209256178, 'bull_tsl_mult': 0.21353732649421042, 'bull_time_stop': 179, 'bull_use_sma': False, 'bull_use_ema': False, 'bull_use_atr': False, 'bull_use_adx': True, 'bull_use_spike': False, 'bull_rsi_required': True, 'bear_strategy': 'breakout', 'bear_bb_std_mult': 2.770586088892759, 'bear_rsi_os': 43, 'bear_rsi_ob': 46, 'bear_adx_thresh': 11.025697445524894, 'bear_atr_min_pct': 0.01500954013677399, 'bear_atr_max_pct': 0.14275939035223065, 'bear_tp_mult': 1.7783053186647735, 'bear_tsl_mult': 0.35120021300610527, 'bear_time_stop': 64, 'bear_use_sma': True, 'bear_use_ema': True, 'bear_use_atr': False, 'bear_use_adx': True, 'bear_use_spike': False, 'bear_rsi_required': False, 'sideways_strategy': 'breakout', 'sideways_bb_std_mult': 1.9113330199421006, 'sideways_rsi_os': 18, 'sideways_rsi_ob': 72, 'sideways_adx_thresh': 21.92892948819586, 'sideways_atr_min_pct': 0.002517636355375807, 'sideways_atr_max_pct': 0.09706028598943628, 'sideways_tp_mult': 2.2699623645559743, 'sideways_tsl_mult': 0.5428012863546549, 'sideways_time_stop': 292, 'sideways_use_sma': False, 'sideways_use_ema': True, 'sideways_use_atr': False, 'sideways_use_adx': True, 'sideways_use_spike': True, 'sideways_rsi_required': False}.
[I 2025-09-01 02:53:06,936] Trial 182 finished with values: [-1000000000.0, 1000000000.0] and parameters: {'p_sma': 5, 'p_std': 43, 'p_atr': 17, 'p_adx': 19, 'rsi_period': 58, 'ema1': 21, 'ema2': 41, 'slip_atr_k': 0.011911120370131537, 'slip_spread_k': 0.5902481089825735, 'spread_hl_frac': 0.0162891551096432, 'bb_std_mult': 1.5066795605660819, 'rsi_os': 18, 'rsi_ob': 49, 'vol_spike': 0.00864253161128739, 'adx_thresh': 24.074933601626395, 'atr_min_pct': 0.0016046465732655717, 'atr_max_pct': 0.021922496443321993, 'tp_mult': 1.5930450179311628, 'tsl_mult': 0.8284976581118538, 'strategy': 'breakout', 'time_stop': 109, 'use_sma': False, 'use_atr': False, 'use_adx': False, 'use_ema': False, 'use_spike': True, 'rsi_required': False, 'edge_k': 1.9464223558133202, 'edge_cap': 0.8003844555685065, 'bull_strategy': 'mean_reversion', 'bull_bb_std_mult': 3.5022086374482964, 'bull_rsi_os': 18, 'bull_rsi_ob': 95, 'bull_adx_thresh': 24.51380758061487, 'bull_atr_min_pct': 0.0015576768893545796, 'bull_atr_max_pct': 0.12794299579327342, 'bull_tp_mult': 1.2824489965937007, 'bull_tsl_mult': 0.5826215885727042, 'bull_time_stop': 208, 'bull_use_sma': False, 'bull_use_ema': False, 'bull_use_atr': False, 'bull_use_adx': False, 'bull_use_spike': True, 'bull_rsi_required': True, 'bear_strategy': 'breakout', 'bear_bb_std_mult': 1.297905432475337, 'bear_rsi_os': 8, 'bear_rsi_ob': 50, 'bear_adx_thresh': 9.0533118892261, 'bear_atr_min_pct': 0.01920371996002516, 'bear_atr_max_pct': 0.1415276861082372, 'bear_tp_mult': 2.0587293542157408, 'bear_tsl_mult': 0.5040286505817325, 'bear_time_stop': 66, 'bear_use_sma': False, 'bear_use_ema': False, 'bear_use_atr': False, 'bear_use_adx': True, 'bear_use_spike': True, 'bear_rsi_required': True, 'sideways_strategy': 'breakout', 'sideways_bb_std_mult': 1.9155054189906273, 'sideways_rsi_os': 18, 'sideways_rsi_ob': 73, 'sideways_adx_thresh': 12.517523128770383, 'sideways_atr_min_pct': 0.013098296847040156, 'sideways_atr_max_pct': 0.14159251228629802, 'sideways_tp_mult': 1.3523902016914422, 'sideways_tsl_mult': 0.5836012398486767, 'sideways_time_stop': 279, 'sideways_use_sma': False, 'sideways_use_ema': True, 'sideways_use_atr': True, 'sideways_use_adx': True, 'sideways_use_spike': True, 'sideways_rsi_required': False}.
[I 2025-09-01 02:53:07,785] Trial 183 finished with values: [-0.024324367583679285, 0.02415100079779372] and parameters: {'p_sma': 34, 'p_std': 43, 'p_atr': 27, 'p_adx': 19, 'rsi_period': 39, 'ema1': 21, 'ema2': 49, 'slip_atr_k': 0.016417934299347185, 'slip_spread_k': 0.7917170773385872, 'spread_hl_frac': 0.011383514913131504, 'bb_std_mult': 1.514012405745445, 'rsi_os': 47, 'rsi_ob': 87, 'vol_spike': 0.141719992172168, 'adx_thresh': 25.35167209230896, 'atr_min_pct': 0.025547355706347925, 'atr_max_pct': 0.04344254622863444, 'tp_mult': 2.997942720551295, 'tsl_mult': 0.25994985125490194, 'strategy': 'mean_reversion', 'time_stop': 255, 'use_sma': False, 'use_atr': False, 'use_adx': True, 'use_ema': False, 'use_spike': True, 'rsi_required': False, 'edge_k': 0.8566323360253236, 'edge_cap': 0.8251002043281133, 'bull_strategy': 'mean_reversion', 'bull_bb_std_mult': 3.5050553356435485, 'bull_rsi_os': 17, 'bull_rsi_ob': 94, 'bull_adx_thresh': 9.171479848938217, 'bull_atr_min_pct': 0.001307842364878484, 'bull_atr_max_pct': 0.12730996603185407, 'bull_tp_mult': 1.7559389239622072, 'bull_tsl_mult': 0.34643635213118373, 'bull_time_stop': 167, 'bull_use_sma': False, 'bull_use_ema': False, 'bull_use_atr': False, 'bull_use_adx': False, 'bull_use_spike': True, 'bull_rsi_required': False, 'bear_strategy': 'breakout', 'bear_bb_std_mult': 1.2751476340794363, 'bear_rsi_os': 8, 'bear_rsi_ob': 49, 'bear_adx_thresh': 10.940191277583484, 'bear_atr_min_pct': 0.025243093993353886, 'bear_atr_max_pct': 0.13083951739046207, 'bear_tp_mult': 1.3255918308466064, 'bear_tsl_mult': 0.10416814449741102, 'bear_time_stop': 151, 'bear_use_sma': False, 'bear_use_ema': False, 'bear_use_atr': False, 'bear_use_adx': False, 'bear_use_spike': True, 'bear_rsi_required': True, 'sideways_strategy': 'breakout', 'sideways_bb_std_mult': 1.9226763628444985, 'sideways_rsi_os': 28, 'sideways_rsi_ob': 73, 'sideways_adx_thresh': 30.600425239752568, 'sideways_atr_min_pct': 0.024233170011605902, 'sideways_atr_max_pct': 0.0903748882490203, 'sideways_tp_mult': 1.7959714940533886, 'sideways_tsl_mult': 0.3553474163903074, 'sideways_time_stop': 274, 'sideways_use_sma': True, 'sideways_use_ema': True, 'sideways_use_atr': True, 'sideways_use_adx': False, 'sideways_use_spike': True, 'sideways_rsi_required': True}.
[I 2025-09-01 02:53:08,009] Trial 184 finished with values: [-0.01813693239558667, 0.01798932142344533] and parameters: {'p_sma': 44, 'p_std': 58, 'p_atr': 27, 'p_adx': 17, 'rsi_period': 22, 'ema1': 24, 'ema2': 58, 'slip_atr_k': 0.07961103801920455, 'slip_spread_k': 0.7876633376574596, 'spread_hl_frac': 0.016317372635084346, 'bb_std_mult': 1.5030391724977286, 'rsi_os': 48, 'rsi_ob': 92, 'vol_spike': 0.1497429037725045, 'adx_thresh': 23.988492930434965, 'atr_min_pct': 0.0017512676898153046, 'atr_max_pct': 0.12293865411511906, 'tp_mult': 1.376790071593553, 'tsl_mult': 0.30254289874854845, 'strategy': 'mean_reversion', 'time_stop': 256, 'use_sma': False, 'use_atr': False, 'use_adx': True, 'use_ema': False, 'use_spike': True, 'rsi_required': False, 'edge_k': 0.8665024353743873, 'edge_cap': 0.7816679251639739, 'bull_strategy': 'mean_reversion', 'bull_bb_std_mult': 1.1949964407715836, 'bull_rsi_os': 53, 'bull_rsi_ob': 66, 'bull_adx_thresh': 26.366589914861137, 'bull_atr_min_pct': 0.0013579364657055107, 'bull_atr_max_pct': 0.1277549029473406, 'bull_tp_mult': 1.4761597019813288, 'bull_tsl_mult': 0.5198053760235588, 'bull_time_stop': 168, 'bull_use_sma': True, 'bull_use_ema': False, 'bull_use_atr': False, 'bull_use_adx': False, 'bull_use_spike': True, 'bull_rsi_required': False, 'bear_strategy': 'breakout', 'bear_bb_std_mult': 1.30222427634651, 'bear_rsi_os': 8, 'bear_rsi_ob': 62, 'bear_adx_thresh': 24.218734833375766, 'bear_atr_min_pct': 0.025859115636928297, 'bear_atr_max_pct': 0.14930200352456197, 'bear_tp_mult': 1.026480626230972, 'bear_tsl_mult': 0.460350592102165, 'bear_time_stop': 105, 'bear_use_sma': False, 'bear_use_ema': False, 'bear_use_atr': False, 'bear_use_adx': False, 'bear_use_spike': True, 'bear_rsi_required': True, 'sideways_strategy': 'breakout', 'sideways_bb_std_mult': 1.9738637790955182, 'sideways_rsi_os': 17, 'sideways_rsi_ob': 74, 'sideways_adx_thresh': 30.590610581002995, 'sideways_atr_min_pct': 0.012881846529525287, 'sideways_atr_max_pct': 0.14167522302013202, 'sideways_tp_mult': 1.3527490282898038, 'sideways_tsl_mult': 0.34993884658278185, 'sideways_time_stop': 272, 'sideways_use_sma': True, 'sideways_use_ema': True, 'sideways_use_atr': True, 'sideways_use_adx': False, 'sideways_use_spike': True, 'sideways_rsi_required': True}.
[I 2025-09-01 02:53:08,210] Trial 181 finished with values: [-0.05054030411547561, 0.05040338172335387] and parameters: {'p_sma': 44, 'p_std': 27, 'p_atr': 24, 'p_adx': 8, 'rsi_period': 10, 'ema1': 20, 'ema2': 58, 'slip_atr_k': 0.07346630368409339, 'slip_spread_k': 0.8569735668862665, 'spread_hl_frac': 0.011471499940935314, 'bb_std_mult': 1.4986584187409624, 'rsi_os': 36, 'rsi_ob': 86, 'vol_spike': 0.1559529282160519, 'adx_thresh': 14.347080815216085, 'atr_min_pct': 0.0017155160903634809, 'atr_max_pct': 0.1239982342711341, 'tp_mult': 2.7033127207709025, 'tsl_mult': 0.8270944404173239, 'strategy': 'breakout', 'time_stop': 263, 'use_sma': True, 'use_atr': False, 'use_adx': False, 'use_ema': False, 'use_spike': True, 'rsi_required': False, 'edge_k': 1.5000643159877756, 'edge_cap': 0.43794852678548946, 'bull_strategy': 'mean_reversion', 'bull_bb_std_mult': 1.2604228924756473, 'bull_rsi_os': 37, 'bull_rsi_ob': 95, 'bull_adx_thresh': 13.739382382509518, 'bull_atr_min_pct': 0.001286250967518581, 'bull_atr_max_pct': 0.12177839120432367, 'bull_tp_mult': 2.628223484922534, 'bull_tsl_mult': 0.5810560619121174, 'bull_time_stop': 206, 'bull_use_sma': False, 'bull_use_ema': False, 'bull_use_atr': False, 'bull_use_adx': False, 'bull_use_spike': True, 'bull_rsi_required': True, 'bear_strategy': 'breakout', 'bear_bb_std_mult': 1.2561633963163046, 'bear_rsi_os': 8, 'bear_rsi_ob': 84, 'bear_adx_thresh': 10.832882205846131, 'bear_atr_min_pct': 0.017872452623613207, 'bear_atr_max_pct': 0.12308286042574268, 'bear_tp_mult': 1.022990603356406, 'bear_tsl_mult': 0.11013251320518441, 'bear_time_stop': 63, 'bear_use_sma': False, 'bear_use_ema': True, 'bear_use_atr': False, 'bear_use_adx': True, 'bear_use_spike': False, 'bear_rsi_required': True, 'sideways_strategy': 'breakout', 'sideways_bb_std_mult': 1.876105235912387, 'sideways_rsi_os': 18, 'sideways_rsi_ob': 78, 'sideways_adx_thresh': 9.247457756872963, 'sideways_atr_min_pct': 0.027163256006113717, 'sideways_atr_max_pct': 0.07010991958112182, 'sideways_tp_mult': 2.6047770514693105, 'sideways_tsl_mult': 0.5845872170392318, 'sideways_time_stop': 274, 'sideways_use_sma': False, 'sideways_use_ema': True, 'sideways_use_atr': True, 'sideways_use_adx': True, 'sideways_use_spike': True, 'sideways_rsi_required': False}.
[I 2025-09-01 02:53:46,534] Trial 188 finished with values: [-0.019793969091961072, 0.019730859674443248] and parameters: {'p_sma': 34, 'p_std': 17, 'p_atr': 27, 'p_adx': 25, 'rsi_period': 32, 'ema1': 13, 'ema2': 59, 'slip_atr_k': 0.015456060962506174, 'slip_spread_k': 0.29163180257501, 'spread_hl_frac': 0.013139038944777049, 'bb_std_mult': 3.1453353697568405, 'rsi_os': 48, 'rsi_ob': 92, 'vol_spike': 0.1441132581049511, 'adx_thresh': 25.31358063996376, 'atr_min_pct': 0.025566574968835066, 'atr_max_pct': 0.05303966795552405, 'tp_mult': 2.1638165960780227, 'tsl_mult': 0.15254735559788452, 'strategy': 'mean_reversion', 'time_stop': 121, 'use_sma': False, 'use_atr': True, 'use_adx': True, 'use_ema': True, 'use_spike': False, 'rsi_required': True, 'edge_k': 0.4072566818820525, 'edge_cap': 0.3894684331745898, 'bull_strategy': 'mean_reversion', 'bull_bb_std_mult': 1.1836452809413136, 'bull_rsi_os': 15, 'bull_rsi_ob': 66, 'bull_adx_thresh': 26.837037515754545, 'bull_atr_min_pct': 0.0020829552802283514, 'bull_atr_max_pct': 0.1239851682559902, 'bull_tp_mult': 1.5993927088443909, 'bull_tsl_mult': 0.5233360025639117, 'bull_time_stop': 169, 'bull_use_sma': False, 'bull_use_ema': False, 'bull_use_atr': True, 'bull_use_adx': False, 'bull_use_spike': True, 'bull_rsi_required': False, 'bear_strategy': 'mean_reversion', 'bear_bb_std_mult': 2.5314318161218763, 'bear_rsi_os': 6, 'bear_rsi_ob': 64, 'bear_adx_thresh': 21.901105126138706, 'bear_atr_min_pct': 0.025176646507857215, 'bear_atr_max_pct': 0.14977370353428382, 'bear_tp_mult': 1.211111593457482, 'bear_tsl_mult': 0.30492949471819697, 'bear_time_stop': 105, 'bear_use_sma': False, 'bear_use_ema': False, 'bear_use_atr': True, 'bear_use_adx': False, 'bear_use_spike': True, 'bear_rsi_required': True, 'sideways_strategy': 'mean_reversion', 'sideways_bb_std_mult': 1.8023406941946576, 'sideways_rsi_os': 16, 'sideways_rsi_ob': 74, 'sideways_adx_thresh': 30.409117996872155, 'sideways_atr_min_pct': 0.006507935202430228, 'sideways_atr_max_pct': 0.09067284075751184, 'sideways_tp_mult': 2.528222966968934, 'sideways_tsl_mult': 0.3616894570967578, 'sideways_time_stop': 225, 'sideways_use_sma': True, 'sideways_use_ema': False, 'sideways_use_atr': True, 'sideways_use_adx': False, 'sideways_use_spike': False, 'sideways_rsi_required': True}.
[I 2025-09-01 02:53:47,247] Trial 187 finished with values: [-0.01638690406982335, 0.016222356428700135] and parameters: {'p_sma': 39, 'p_std': 58, 'p_atr': 27, 'p_adx': 8, 'rsi_period': 61, 'ema1': 24, 'ema2': 57, 'slip_atr_k': 0.015581825278838548, 'slip_spread_k': 0.43235878745311673, 'spread_hl_frac': 0.011355164436635392, 'bb_std_mult': 1.5334542806215101, 'rsi_os': 47, 'rsi_ob': 86, 'vol_spike': 0.2519465857507245, 'adx_thresh': 25.422516400474805, 'atr_min_pct': 0.025490719547864787, 'atr_max_pct': 0.05390978206693065, 'tp_mult': 1.402350510279407, 'tsl_mult': 0.10158439091171001, 'strategy': 'mean_reversion', 'time_stop': 262, 'use_sma': False, 'use_atr': False, 'use_adx': True, 'use_ema': False, 'use_spike': False, 'rsi_required': True, 'edge_k': 1.8569292901849426, 'edge_cap': 0.7497520210214141, 'bull_strategy': 'mean_reversion', 'bull_bb_std_mult': 3.040003643773054, 'bull_rsi_os': 15, 'bull_rsi_ob': 66, 'bull_adx_thresh': 26.608036301149603, 'bull_atr_min_pct': 0.001385717585392355, 'bull_atr_max_pct': 0.12259728325445644, 'bull_tp_mult': 1.6086701556379148, 'bull_tsl_mult': 0.5231370126107323, 'bull_time_stop': 156, 'bull_use_sma': False, 'bull_use_ema': False, 'bull_use_atr': True, 'bull_use_adx': False, 'bull_use_spike': True, 'bull_rsi_required': False, 'bear_strategy': 'breakout', 'bear_bb_std_mult': 2.535490857662925, 'bear_rsi_os': 6, 'bear_rsi_ob': 63, 'bear_adx_thresh': 24.26131154239326, 'bear_atr_min_pct': 0.02040045919389931, 'bear_atr_max_pct': 0.14956266578405422, 'bear_tp_mult': 1.222664766683979, 'bear_tsl_mult': 0.3029044721875972, 'bear_time_stop': 46, 'bear_use_sma': False, 'bear_use_ema': False, 'bear_use_atr': False, 'bear_use_adx': False, 'bear_use_spike': True, 'bear_rsi_required': True, 'sideways_strategy': 'breakout', 'sideways_bb_std_mult': 1.154050214937037, 'sideways_rsi_os': 16, 'sideways_rsi_ob': 50, 'sideways_adx_thresh': 30.324262775041817, 'sideways_atr_min_pct': 0.024188978439293345, 'sideways_atr_max_pct': 0.0554828623945145, 'sideways_tp_mult': 2.8523925247985487, 'sideways_tsl_mult': 0.2775137368038052, 'sideways_time_stop': 271, 'sideways_use_sma': True, 'sideways_use_ema': True, 'sideways_use_atr': True, 'sideways_use_adx': False, 'sideways_use_spike': False, 'sideways_rsi_required': True}.
[I 2025-09-01 02:53:47,981] Trial 186 finished with values: [-0.026997194949106462, 0.026830041793559394] and parameters: {'p_sma': 39, 'p_std': 29, 'p_atr': 27, 'p_adx': 25, 'rsi_period': 9, 'ema1': 20, 'ema2': 16, 'slip_atr_k': 0.005572883512284902, 'slip_spread_k': 0.29250107561607896, 'spread_hl_frac': 0.014238954110723465, 'bb_std_mult': 1.5326377499063841, 'rsi_os': 48, 'rsi_ob': 92, 'vol_spike': 0.21989756639179783, 'adx_thresh': 23.581933418949383, 'atr_min_pct': 0.01875375001446674, 'atr_max_pct': 0.05395069837498935, 'tp_mult': 2.139805235926012, 'tsl_mult': 0.09702721370412495, 'strategy': 'mean_reversion', 'time_stop': 263, 'use_sma': False, 'use_atr': False, 'use_adx': True, 'use_ema': False, 'use_spike': False, 'rsi_required': True, 'edge_k': 0.3530786307165338, 'edge_cap': 0.44923712387984216, 'bull_strategy': 'mean_reversion', 'bull_bb_std_mult': 2.9985422930652508, 'bull_rsi_os': 17, 'bull_rsi_ob': 66, 'bull_adx_thresh': 23.142067523922986, 'bull_atr_min_pct': 0.001205413669744972, 'bull_atr_max_pct': 0.12306435809959454, 'bull_tp_mult': 1.6229614907254706, 'bull_tsl_mult': 0.5216829220843102, 'bull_time_stop': 169, 'bull_use_sma': False, 'bull_use_ema': False, 'bull_use_atr': True, 'bull_use_adx': False, 'bull_use_spike': True, 'bull_rsi_required': False, 'bear_strategy': 'breakout', 'bear_bb_std_mult': 0.8817673914046555, 'bear_rsi_os': 6, 'bear_rsi_ob': 64, 'bear_adx_thresh': 24.26330504484532, 'bear_atr_min_pct': 0.025949080009014247, 'bear_atr_max_pct': 0.1493781491624757, 'bear_tp_mult': 1.2014565201326273, 'bear_tsl_mult': 0.47173415387579126, 'bear_time_stop': 59, 'bear_use_sma': False, 'bear_use_ema': False, 'bear_use_atr': False, 'bear_use_adx': False, 'bear_use_spike': True, 'bear_rsi_required': True, 'sideways_strategy': 'breakout', 'sideways_bb_std_mult': 0.9057500115985524, 'sideways_rsi_os': 16, 'sideways_rsi_ob': 74, 'sideways_adx_thresh': 30.525332994429718, 'sideways_atr_min_pct': 0.024677180838290822, 'sideways_atr_max_pct': 0.06407737537394045, 'sideways_tp_mult': 1.2661193325578397, 'sideways_tsl_mult': 0.34333237147555695, 'sideways_time_stop': 222, 'sideways_use_sma': True, 'sideways_use_ema': True, 'sideways_use_atr': True, 'sideways_use_adx': False, 'sideways_use_spike': False, 'sideways_rsi_required': True}.
[I 2025-09-01 02:53:48,148] Trial 185 finished with values: [-0.016037123774356066, 0.01594778750757913] and parameters: {'p_sma': 33, 'p_std': 58, 'p_atr': 28, 'p_adx': 17, 'rsi_period': 9, 'ema1': 21, 'ema2': 58, 'slip_atr_k': 0.016263949057824807, 'slip_spread_k': 0.29624241691266195, 'spread_hl_frac': 0.013198297714133818, 'bb_std_mult': 1.532045532270919, 'rsi_os': 47, 'rsi_ob': 86, 'vol_spike': 0.2219550004162944, 'adx_thresh': 25.32393493837919, 'atr_min_pct': 0.008416257424493149, 'atr_max_pct': 0.044210548918264064, 'tp_mult': 2.683943081565201, 'tsl_mult': 0.3019437364762809, 'strategy': 'mean_reversion', 'time_stop': 263, 'use_sma': False, 'use_atr': False, 'use_adx': True, 'use_ema': False, 'use_spike': True, 'rsi_required': False, 'edge_k': 0.40647046128702874, 'edge_cap': 0.4472335747616346, 'bull_strategy': 'mean_reversion', 'bull_bb_std_mult': 1.1868095718111331, 'bull_rsi_os': 17, 'bull_rsi_ob': 61, 'bull_adx_thresh': 23.23216238835651, 'bull_atr_min_pct': 0.001092592254259636, 'bull_atr_max_pct': 0.12214450090328835, 'bull_tp_mult': 1.6123206363071696, 'bull_tsl_mult': 0.5290811444702481, 'bull_time_stop': 132, 'bull_use_sma': True, 'bull_use_ema': False, 'bull_use_atr': False, 'bull_use_adx': False, 'bull_use_spike': True, 'bull_rsi_required': False, 'bear_strategy': 'breakout', 'bear_bb_std_mult': 2.5164525359080097, 'bear_rsi_os': 5, 'bear_rsi_ob': 61, 'bear_adx_thresh': 24.11718149926538, 'bear_atr_min_pct': 0.01994516396651741, 'bear_atr_max_pct': 0.13092314769764657, 'bear_tp_mult': 1.0159950293172233, 'bear_tsl_mult': 0.10837955801320692, 'bear_time_stop': 60, 'bear_use_sma': False, 'bear_use_ema': False, 'bear_use_atr': False, 'bear_use_adx': False, 'bear_use_spike': True, 'bear_rsi_required': True, 'sideways_strategy': 'breakout', 'sideways_bb_std_mult': 1.8286303725222053, 'sideways_rsi_os': 16, 'sideways_rsi_ob': 75, 'sideways_adx_thresh': 30.067185029010016, 'sideways_atr_min_pct': 0.028622577163457785, 'sideways_atr_max_pct': 0.09045844360866057, 'sideways_tp_mult': 1.2724163071169103, 'sideways_tsl_mult': 0.2553946410579345, 'sideways_time_stop': 122, 'sideways_use_sma': True, 'sideways_use_ema': True, 'sideways_use_atr': True, 'sideways_use_adx': False, 'sideways_use_spike': True, 'sideways_rsi_required': True}.
