[I 2025-09-01 03:47:14,763] Trial 505 finished with values: [-0.01693637511525181, 0.01675172141821124] and parameters: {'p_sma': 18, 'p_std': 53, 'p_atr': 25, 'p_adx': 11, 'rsi_period': 9, 'ema1': 13, 'ema2': 52, 'slip_atr_k': 0.004841930732693277, 'slip_spread_k': 0.05723099157112687, 'spread_hl_frac': 0.04025448296586386, 'bb_std_mult': 2.6158688870397127, 'rsi_os': 44, 'rsi_ob': 79, 'vol_spike': 0.1908354492995801, 'adx_thresh': 13.692204505078386, 'atr_min_pct': 0.010265407137265797, 'atr_max_pct': 0.017199675119063368, 'tp_mult': 2.5972929729197824, 'tsl_mult': 0.25159544945963525, 'strategy': 'mean_reversion', 'time_stop': 94, 'use_sma': False, 'use_atr': False, 'use_adx': True, 'use_ema': False, 'use_spike': True, 'rsi_required': False, 'edge_k': 0.25878625691879764, 'edge_cap': 0.30222492260544515, 'bull_strategy': 'breakout', 'bull_bb_std_mult': 0.8255509819057463, 'bull_rsi_os': 9, 'bull_rsi_ob': 79, 'bull_adx_thresh': 6.452542875151813, 'bull_atr_min_pct': 8.921649012835124e-06, 'bull_atr_max_pct': 0.10801658145064078, 'bull_tp_mult': 1.445489315446963, 'bull_tsl_mult': 0.296886978982726, 'bull_time_stop': 300, 'bull_use_sma': True, 'bull_use_ema': False, 'bull_use_atr': False, 'bull_use_adx': True, 'bull_use_spike': False, 'bull_rsi_required': False, 'bear_strategy': 'breakout', 'bear_bb_std_mult': 3.0382272113014817, 'bear_rsi_os': 48, 'bear_rsi_ob': 67, 'bear_adx_thresh': 31.456291656368574, 'bear_atr_min_pct': 0.0077145807211401385, 'bear_atr_max_pct': 0.057263032371315206, 'bear_tp_mult': 2.9897018032419975, 'bear_tsl_mult': 0.07153026374809246, 'bear_time_stop': 294, 'bear_use_sma': True, 'bear_use_ema': False, 'bear_use_atr': False, 'bear_use_adx': False, 'bear_use_spike': False, 'bear_rsi_required': False, 'sideways_strategy': 'mean_reversion', 'sideways_bb_std_mult': 3.5639861917342692, 'sideways_rsi_os': 7, 'sideways_rsi_ob': 60, 'sideways_adx_thresh': 31.150794658679107, 'sideways_atr_min_pct': 0.02257415780743493, 'sideways_atr_max_pct': 0.10394748611015989, 'sideways_tp_mult': 1.8838612324443305, 'sideways_tsl_mult': 0.7397201673048006, 'sideways_time_stop': 163, 'sideways_use_sma': True, 'sideways_use_ema': True, 'sideways_use_atr': False, 'sideways_use_adx': False, 'sideways_use_spike': True, 'sideways_rsi_required': True}.
[I 2025-09-01 03:47:15,110] Trial 504 finished with values: [-0.01590786016911372, 0.015768331591511114] and parameters: {'p_sma': 17, 'p_std': 54, 'p_atr': 25, 'p_adx': 11, 'rsi_period': 9, 'ema1': 13, 'ema2': 52, 'slip_atr_k': 0.005675282310046479, 'slip_spread_k': 0.05271594790336105, 'spread_hl_frac': 0.04342038013048732, 'bb_std_mult': 2.447145036730536, 'rsi_os': 44, 'rsi_ob': 79, 'vol_spike': 0.1903955615065637, 'adx_thresh': 14.305511758196937, 'atr_min_pct': 0.01053291469083024, 'atr_max_pct': 0.04997243939003916, 'tp_mult': 2.5864698686409326, 'tsl_mult': 0.26360227797660984, 'strategy': 'mean_reversion', 'time_stop': 95, 'use_sma': False, 'use_atr': False, 'use_adx': True, 'use_ema': False, 'use_spike': True, 'rsi_required': False, 'edge_k': 0.23066531406878119, 'edge_cap': 0.24677275308164087, 'bull_strategy': 'breakout', 'bull_bb_std_mult': 0.7261398908179031, 'bull_rsi_os': 9, 'bull_rsi_ob': 79, 'bull_adx_thresh': 8.473634009689661, 'bull_atr_min_pct': 0.0007282247962169765, 'bull_atr_max_pct': 0.1079826682366577, 'bull_tp_mult': 1.444890079486063, 'bull_tsl_mult': 0.2762109469316117, 'bull_time_stop': 299, 'bull_use_sma': True, 'bull_use_ema': False, 'bull_use_atr': False, 'bull_use_adx': True, 'bull_use_spike': False, 'bull_rsi_required': False, 'bear_strategy': 'breakout', 'bear_bb_std_mult': 3.1296233953750447, 'bear_rsi_os': 49, 'bear_rsi_ob': 67, 'bear_adx_thresh': 31.47489911613877, 'bear_atr_min_pct': 0.008064026045805781, 'bear_atr_max_pct': 0.05397422611733687, 'bear_tp_mult': 2.9854543368747937, 'bear_tsl_mult': 0.06455116584084947, 'bear_time_stop': 286, 'bear_use_sma': True, 'bear_use_ema': False, 'bear_use_atr': False, 'bear_use_adx': False, 'bear_use_spike': False, 'bear_rsi_required': False, 'sideways_strategy': 'breakout', 'sideways_bb_std_mult': 3.4992518571283378, 'sideways_rsi_os': 7, 'sideways_rsi_ob': 60, 'sideways_adx_thresh': 31.195216980704654, 'sideways_atr_min_pct': 0.02292420458245386, 'sideways_atr_max_pct': 0.10326779504534263, 'sideways_tp_mult': 1.9036919179199432, 'sideways_tsl_mult': 0.7017950107457377, 'sideways_time_stop': 165, 'sideways_use_sma': True, 'sideways_use_ema': True, 'sideways_use_atr': False, 'sideways_use_adx': False, 'sideways_use_spike': True, 'sideways_rsi_required': True}.
[I 2025-09-01 03:47:15,112] Trial 503 finished with values: [-1000000000.0, 1000000000.0] and parameters: {'p_sma': 16, 'p_std': 54, 'p_atr': 25, 'p_adx': 11, 'rsi_period': 8, 'ema1': 14, 'ema2': 52, 'slip_atr_k': 0.004658583861972169, 'slip_spread_k': 0.0024948981746793497, 'spread_hl_frac': 0.043569391304438466, 'bb_std_mult': 2.50837077196121, 'rsi_os': 42, 'rsi_ob': 79, 'vol_spike': 0.18991670087978008, 'adx_thresh': 13.342476310936256, 'atr_min_pct': 0.011222426643559257, 'atr_max_pct': 0.045398112386977496, 'tp_mult': 2.595265710129562, 'tsl_mult': 0.26256590334136454, 'strategy': 'breakout', 'time_stop': 80, 'use_sma': False, 'use_atr': False, 'use_adx': True, 'use_ema': False, 'use_spike': True, 'rsi_required': False, 'edge_k': 0.2790013024067479, 'edge_cap': 0.2720634896990997, 'bull_strategy': 'breakout', 'bull_bb_std_mult': 0.7320057312413468, 'bull_rsi_os': 8, 'bull_rsi_ob': 79, 'bull_adx_thresh': 6.607659248884462, 'bull_atr_min_pct': 4.019502908644834e-05, 'bull_atr_max_pct': 0.10643203750742523, 'bull_tp_mult': 1.4550270483167502, 'bull_tsl_mult': 0.2764920103412445, 'bull_time_stop': 294, 'bull_use_sma': False, 'bull_use_ema': True, 'bull_use_atr': False, 'bull_use_adx': True, 'bull_use_spike': False, 'bull_rsi_required': False, 'bear_strategy': 'breakout', 'bear_bb_std_mult': 3.1251709360155844, 'bear_rsi_os': 48, 'bear_rsi_ob': 67, 'bear_adx_thresh': 32.260903128945856, 'bear_atr_min_pct': 0.007320655578952349, 'bear_atr_max_pct': 0.05146577120228479, 'bear_tp_mult': 2.86751098966312, 'bear_tsl_mult': 0.07164202986796045, 'bear_time_stop': 288, 'bear_use_sma': True, 'bear_use_ema': False, 'bear_use_atr': False, 'bear_use_adx': False, 'bear_use_spike': False, 'bear_rsi_required': True, 'sideways_strategy': 'breakout', 'sideways_bb_std_mult': 3.597626806684684, 'sideways_rsi_os': 6, 'sideways_rsi_ob': 60, 'sideways_adx_thresh': 31.26858737769345, 'sideways_atr_min_pct': 0.022589893545655583, 'sideways_atr_max_pct': 0.11058112023091748, 'sideways_tp_mult': 1.8490723921002545, 'sideways_tsl_mult': 0.7465199084479289, 'sideways_time_stop': 167, 'sideways_use_sma': True, 'sideways_use_ema': True, 'sideways_use_atr': False, 'sideways_use_adx': True, 'sideways_use_spike': True, 'sideways_rsi_required': True}.
[I 2025-09-01 03:48:01,417] Trial 509 finished with values: [-0.012613030315212437, 0.012508110433079983] and parameters: {'p_sma': 17, 'p_std': 53, 'p_atr': 25, 'p_adx': 11, 'rsi_period': 9, 'ema1': 13, 'ema2': 52, 'slip_atr_k': 0.0016520925895401393, 'slip_spread_k': 0.03361895491784433, 'spread_hl_frac': 0.04339925054918535, 'bb_std_mult': 2.416595191744838, 'rsi_os': 44, 'rsi_ob': 80, 'vol_spike': 0.1911391175765835, 'adx_thresh': 13.747716381566786, 'atr_min_pct': 0.01011258481453161, 'atr_max_pct': 0.049581237786370906, 'tp_mult': 2.563813733538696, 'tsl_mult': 0.3139940537733456, 'strategy': 'mean_reversion', 'time_stop': 88, 'use_sma': True, 'use_atr': False, 'use_adx': False, 'use_ema': True, 'use_spike': False, 'rsi_required': True, 'edge_k': 0.21954432987429623, 'edge_cap': 0.2519580781162532, 'bull_strategy': 'mean_reversion', 'bull_bb_std_mult': 0.8042785998930455, 'bull_rsi_os': 6, 'bull_rsi_ob': 78, 'bull_adx_thresh': 8.334105043185179, 'bull_atr_min_pct': 0.000617727004544141, 'bull_atr_max_pct': 0.10822869329293765, 'bull_tp_mult': 1.502911870446405, 'bull_tsl_mult': 0.27159918477040185, 'bull_time_stop': 300, 'bull_use_sma': False, 'bull_use_ema': False, 'bull_use_atr': True, 'bull_use_adx': True, 'bull_use_spike': False, 'bull_rsi_required': True, 'bear_strategy': 'mean_reversion', 'bear_bb_std_mult': 3.2798792166900226, 'bear_rsi_os': 46, 'bear_rsi_ob': 70, 'bear_adx_thresh': 33.36314615690813, 'bear_atr_min_pct': 0.0081849634526072, 'bear_atr_max_pct': 0.05388206586018913, 'bear_tp_mult': 2.9260642818663447, 'bear_tsl_mult': 0.04617957832790201, 'bear_time_stop': 279, 'bear_use_sma': True, 'bear_use_ema': True, 'bear_use_atr': True, 'bear_use_adx': True, 'bear_use_spike': True, 'bear_rsi_required': False, 'sideways_strategy': 'breakout', 'sideways_bb_std_mult': 3.5236849199873377, 'sideways_rsi_os': 8, 'sideways_rsi_ob': 59, 'sideways_adx_thresh': 30.108501523376113, 'sideways_atr_min_pct': 0.023134453451746438, 'sideways_atr_max_pct': 0.10608006447424971, 'sideways_tp_mult': 1.9166861917891693, 'sideways_tsl_mult': 0.7098092234290353, 'sideways_time_stop': 155, 'sideways_use_sma': False, 'sideways_use_ema': False, 'sideways_use_atr': False, 'sideways_use_adx': False, 'sideways_use_spike': False, 'sideways_rsi_required': True}.
[I 2025-09-01 03:48:01,418] Trial 510 finished with values: [-1000000000.0, 1000000000.0] and parameters: {'p_sma': 17, 'p_std': 53, 'p_atr': 25, 'p_adx': 11, 'rsi_period': 9, 'ema1': 13, 'ema2': 52, 'slip_atr_k': 0.0007778685159724862, 'slip_spread_k': 0.029015678076530348, 'spread_hl_frac': 0.04345898906803089, 'bb_std_mult': 2.4078584634209483, 'rsi_os': 44, 'rsi_ob': 80, 'vol_spike': 0.19060267082487364, 'adx_thresh': 14.300912250168446, 'atr_min_pct': 0.010048724105474619, 'atr_max_pct': 0.04878166225361445, 'tp_mult': 2.58418682758298, 'tsl_mult': 0.3112562092404404, 'strategy': 'mean_reversion', 'time_stop': 88, 'use_sma': True, 'use_atr': False, 'use_adx': False, 'use_ema': True, 'use_spike': False, 'rsi_required': True, 'edge_k': 0.21645747682573158, 'edge_cap': 0.24483298812011056, 'bull_strategy': 'mean_reversion', 'bull_bb_std_mult': 0.7825854341868599, 'bull_rsi_os': 6, 'bull_rsi_ob': 80, 'bull_adx_thresh': 8.372240560661592, 'bull_atr_min_pct': 0.0008157445548598123, 'bull_atr_max_pct': 0.1095593318574684, 'bull_tp_mult': 1.3987288505482296, 'bull_tsl_mult': 0.2714914027719792, 'bull_time_stop': 299, 'bull_use_sma': False, 'bull_use_ema': False, 'bull_use_atr': True, 'bull_use_adx': True, 'bull_use_spike': False, 'bull_rsi_required': True, 'bear_strategy': 'mean_reversion', 'bear_bb_std_mult': 3.274729107988586, 'bear_rsi_os': 45, 'bear_rsi_ob': 70, 'bear_adx_thresh': 33.270557359393266, 'bear_atr_min_pct': 0.008181923129994589, 'bear_atr_max_pct': 0.05463234246565621, 'bear_tp_mult': 2.9263835069088473, 'bear_tsl_mult': 0.01887900711848587, 'bear_time_stop': 279, 'bear_use_sma': True, 'bear_use_ema': True, 'bear_use_atr': True, 'bear_use_adx': True, 'bear_use_spike': True, 'bear_rsi_required': False, 'sideways_strategy': 'breakout', 'sideways_bb_std_mult': 3.5177625464280378, 'sideways_rsi_os': 9, 'sideways_rsi_ob': 59, 'sideways_adx_thresh': 29.92519217071435, 'sideways_atr_min_pct': 0.02334407474679155, 'sideways_atr_max_pct': 0.10554291367424022, 'sideways_tp_mult': 1.914778889021416, 'sideways_tsl_mult': 0.7196526461507067, 'sideways_time_stop': 154, 'sideways_use_sma': False, 'sideways_use_ema': False, 'sideways_use_atr': False, 'sideways_use_adx': False, 'sideways_use_spike': False, 'sideways_rsi_required': True}.
[I 2025-09-01 03:48:02,939] Trial 508 finished with values: [-0.013711739383110766, 0.01360719692805233] and parameters: {'p_sma': 18, 'p_std': 55, 'p_atr': 25, 'p_adx': 11, 'rsi_period': 9, 'ema1': 13, 'ema2': 52, 'slip_atr_k': 0.0008436356140613258, 'slip_spread_k': 0.023142979469005752, 'spread_hl_frac': 0.04363195491277676, 'bb_std_mult': 2.546842504454787, 'rsi_os': 43, 'rsi_ob': 79, 'vol_spike': 0.1895518897879516, 'adx_thresh': 14.548699121110202, 'atr_min_pct': 0.011361941874569449, 'atr_max_pct': 0.04948724182767363, 'tp_mult': 2.570287507867924, 'tsl_mult': 0.29507783831106765, 'strategy': 'mean_reversion', 'time_stop': 90, 'use_sma': True, 'use_atr': False, 'use_adx': False, 'use_ema': False, 'use_spike': True, 'rsi_required': False, 'edge_k': 0.2214625288949022, 'edge_cap': 0.2607211153045775, 'bull_strategy': 'mean_reversion', 'bull_bb_std_mult': 0.715683787147891, 'bull_rsi_os': 6, 'bull_rsi_ob': 78, 'bull_adx_thresh': 8.340826706470356, 'bull_atr_min_pct': 0.0006430015098294528, 'bull_atr_max_pct': 0.10892425933764902, 'bull_tp_mult': 1.450789973469242, 'bull_tsl_mult': 0.2756352798046155, 'bull_time_stop': 299, 'bull_use_sma': False, 'bull_use_ema': False, 'bull_use_atr': False, 'bull_use_adx': True, 'bull_use_spike': False, 'bull_rsi_required': True, 'bear_strategy': 'breakout', 'bear_bb_std_mult': 3.2423498826110704, 'bear_rsi_os': 46, 'bear_rsi_ob': 67, 'bear_adx_thresh': 33.26493620996336, 'bear_atr_min_pct': 0.008337099362301353, 'bear_atr_max_pct': 0.05414954530192404, 'bear_tp_mult': 2.858514705465389, 'bear_tsl_mult': 0.03476407488469288, 'bear_time_stop': 277, 'bear_use_sma': True, 'bear_use_ema': True, 'bear_use_atr': True, 'bear_use_adx': True, 'bear_use_spike': False, 'bear_rsi_required': False, 'sideways_strategy': 'breakout', 'sideways_bb_std_mult': 3.519390227737705, 'sideways_rsi_os': 8, 'sideways_rsi_ob': 60, 'sideways_adx_thresh': 30.23633132462492, 'sideways_atr_min_pct': 0.023051056586713338, 'sideways_atr_max_pct': 0.10489098368350336, 'sideways_tp_mult': 1.9174035010866242, 'sideways_tsl_mult': 0.7114361040609107, 'sideways_time_stop': 155, 'sideways_use_sma': False, 'sideways_use_ema': False, 'sideways_use_atr': False, 'sideways_use_adx': False, 'sideways_use_spike': True, 'sideways_rsi_required': True}.
[I 2025-09-01 03:48:02,958] Trial 507 finished with values: [-0.017181755085368233, 0.0169978786333845] and parameters: {'p_sma': 18, 'p_std': 53, 'p_atr': 25, 'p_adx': 11, 'rsi_period': 9, 'ema1': 13, 'ema2': 52, 'slip_atr_k': 0.004332282106210965, 'slip_spread_k': 0.02035295899083403, 'spread_hl_frac': 0.043376981225513034, 'bb_std_mult': 2.6118193774236604, 'rsi_os': 44, 'rsi_ob': 79, 'vol_spike': 0.19214897944123313, 'adx_thresh': 14.294953606663896, 'atr_min_pct': 0.010196076364220154, 'atr_max_pct': 0.04887807398589749, 'tp_mult': 2.5682879952392197, 'tsl_mult': 0.2590154321582632, 'strategy': 'mean_reversion', 'time_stop': 95, 'use_sma': True, 'use_atr': False, 'use_adx': False, 'use_ema': False, 'use_spike': True, 'rsi_required': False, 'edge_k': 0.23794219943517644, 'edge_cap': 0.2570252147751574, 'bull_strategy': 'breakout', 'bull_bb_std_mult': 0.8254752269069757, 'bull_rsi_os': 6, 'bull_rsi_ob': 78, 'bull_adx_thresh': 6.38543858271252, 'bull_atr_min_pct': 0.0005960745420169524, 'bull_atr_max_pct': 0.10856057668503696, 'bull_tp_mult': 1.446522869973172, 'bull_tsl_mult': 0.27275721275328346, 'bull_time_stop': 298, 'bull_use_sma': False, 'bull_use_ema': False, 'bull_use_atr': False, 'bull_use_adx': True, 'bull_use_spike': False, 'bull_rsi_required': True, 'bear_strategy': 'breakout', 'bear_bb_std_mult': 3.0272256035208582, 'bear_rsi_os': 47, 'bear_rsi_ob': 67, 'bear_adx_thresh': 33.18044544970438, 'bear_atr_min_pct': 0.008099443009521059, 'bear_atr_max_pct': 0.05839626010686703, 'bear_tp_mult': 2.9769600098484688, 'bear_tsl_mult': 0.024587929667447384, 'bear_time_stop': 294, 'bear_use_sma': True, 'bear_use_ema': True, 'bear_use_atr': True, 'bear_use_adx': True, 'bear_use_spike': False, 'bear_rsi_required': False, 'sideways_strategy': 'mean_reversion', 'sideways_bb_std_mult': 3.596687625213508, 'sideways_rsi_os': 8, 'sideways_rsi_ob': 60, 'sideways_adx_thresh': 31.66884038215841, 'sideways_atr_min_pct': 0.022625583080438195, 'sideways_atr_max_pct': 0.10414852833116034, 'sideways_tp_mult': 1.9132922931855925, 'sideways_tsl_mult': 0.7436221907738069, 'sideways_time_stop': 158, 'sideways_use_sma': False, 'sideways_use_ema': False, 'sideways_use_atr': False, 'sideways_use_adx': False, 'sideways_use_spike': True, 'sideways_rsi_required': True}.
[I 2025-09-01 03:48:50,942] Trial 511 finished with values: [-1000000000.0, 1000000000.0] and parameters: {'p_sma': 15, 'p_std': 51, 'p_atr': 24, 'p_adx': 12, 'rsi_period': 9, 'ema1': 13, 'ema2': 50, 'slip_atr_k': 0.00035985659493554677, 'slip_spread_k': 0.012527343061940865, 'spread_hl_frac': 0.044714873430052385, 'bb_std_mult': 2.3416909722282986, 'rsi_os': 45, 'rsi_ob': 78, 'vol_spike': 0.19264348159095976, 'adx_thresh': 14.466896926410573, 'atr_min_pct': 0.01130027047861608, 'atr_max_pct': 0.04125653600148652, 'tp_mult': 2.501963079995437, 'tsl_mult': 0.316050922742073, 'strategy': 'mean_reversion', 'time_stop': 95, 'use_sma': True, 'use_atr': True, 'use_adx': False, 'use_ema': True, 'use_spike': False, 'rsi_required': True, 'edge_k': 0.2039694090128355, 'edge_cap': 0.22823217719993658, 'bull_strategy': 'mean_reversion', 'bull_bb_std_mult': 0.6659431474679421, 'bull_rsi_os': 5, 'bull_rsi_ob': 77, 'bull_adx_thresh': 8.266238755406322, 'bull_atr_min_pct': 0.021942946363033792, 'bull_atr_max_pct': 0.10228164975528564, 'bull_tp_mult': 1.5176140005068541, 'bull_tsl_mult': 0.3026419291206226, 'bull_time_stop': 299, 'bull_use_sma': False, 'bull_use_ema': False, 'bull_use_atr': True, 'bull_use_adx': True, 'bull_use_spike': False, 'bull_rsi_required': True, 'bear_strategy': 'mean_reversion', 'bear_bb_std_mult': 3.362927195899261, 'bear_rsi_os': 45, 'bear_rsi_ob': 90, 'bear_adx_thresh': 34.00826695839051, 'bear_atr_min_pct': 0.014345031443550555, 'bear_atr_max_pct': 0.06029002349750252, 'bear_tp_mult': 2.996225598773903, 'bear_tsl_mult': 0.009435350126984841, 'bear_time_stop': 254, 'bear_use_sma': True, 'bear_use_ema': True, 'bear_use_atr': True, 'bear_use_adx': True, 'bear_use_spike': False, 'bear_rsi_required': False, 'sideways_strategy': 'breakout', 'sideways_bb_std_mult': 3.3747607000145776, 'sideways_rsi_os': 10, 'sideways_rsi_ob': 60, 'sideways_adx_thresh': 30.588638260550347, 'sideways_atr_min_pct': 0.02269780278540268, 'sideways_atr_max_pct': 0.10037264193877056, 'sideways_tp_mult': 2.012111113701913, 'sideways_tsl_mult': 0.6636565728053387, 'sideways_time_stop': 153, 'sideways_use_sma': False, 'sideways_use_ema': False, 'sideways_use_atr': False, 'sideways_use_adx': False, 'sideways_use_spike': False, 'sideways_rsi_required': True}.
[I 2025-09-01 03:48:51,223] Trial 514 finished with values: [-1000000000.0, 1000000000.0] and parameters: {'p_sma': 19, 'p_std': 50, 'p_atr': 24, 'p_adx': 12, 'rsi_period': 9, 'ema1': 13, 'ema2': 50, 'slip_atr_k': 0.0022623790568838563, 'slip_spread_k': 0.014074003495402502, 'spread_hl_frac': 0.04440480988186169, 'bb_std_mult': 2.29079764764567, 'rsi_os': 45, 'rsi_ob': 78, 'vol_spike': 0.19256239472783904, 'adx_thresh': 14.733070177739867, 'atr_min_pct': 0.011488148766869774, 'atr_max_pct': 0.045512525178511926, 'tp_mult': 2.5028224504968657, 'tsl_mult': 0.29319609329475554, 'strategy': 'mean_reversion', 'time_stop': 103, 'use_sma': True, 'use_atr': True, 'use_adx': False, 'use_ema': True, 'use_spike': False, 'rsi_required': True, 'edge_k': 0.3768059619513574, 'edge_cap': 0.2353063008398606, 'bull_strategy': 'mean_reversion', 'bull_bb_std_mult': 0.6636073110982847, 'bull_rsi_os': 5, 'bull_rsi_ob': 77, 'bull_adx_thresh': 8.766611816801108, 'bull_atr_min_pct': 0.021876993532793994, 'bull_atr_max_pct': 0.10379520851814736, 'bull_tp_mult': 1.5073565212058013, 'bull_tsl_mult': 0.3003397375742273, 'bull_time_stop': 300, 'bull_use_sma': False, 'bull_use_ema': False, 'bull_use_atr': True, 'bull_use_adx': True, 'bull_use_spike': False, 'bull_rsi_required': True, 'bear_strategy': 'mean_reversion', 'bear_bb_std_mult': 3.366360772344954, 'bear_rsi_os': 45, 'bear_rsi_ob': 74, 'bear_adx_thresh': 33.946277379113305, 'bear_atr_min_pct': 0.0093941149488447, 'bear_atr_max_pct': 0.05987054417640299, 'bear_tp_mult': 2.9588988784495114, 'bear_tsl_mult': 0.014994738825372465, 'bear_time_stop': 275, 'bear_use_sma': True, 'bear_use_ema': True, 'bear_use_atr': True, 'bear_use_adx': True, 'bear_use_spike': True, 'bear_rsi_required': False, 'sideways_strategy': 'breakout', 'sideways_bb_std_mult': 3.5093374444856886, 'sideways_rsi_os': 9, 'sideways_rsi_ob': 60, 'sideways_adx_thresh': 30.810931059125384, 'sideways_atr_min_pct': 0.023330429474562753, 'sideways_atr_max_pct': 0.10219250946661844, 'sideways_tp_mult': 1.9919382733214308, 'sideways_tsl_mult': 0.6677276793511142, 'sideways_time_stop': 154, 'sideways_use_sma': False, 'sideways_use_ema': False, 'sideways_use_atr': False, 'sideways_use_adx': False, 'sideways_use_spike': False, 'sideways_rsi_required': True}.
