[I 2025-09-01 04:02:00,711] Trial 587 finished with values: [-1000000000.0, 1000000000.0] and parameters: {'p_sma': 17, 'p_std': 23, 'p_atr': 12, 'p_adx': 9, 'rsi_period': 24, 'ema1': 28, 'ema2': 33, 'slip_atr_k': 0.1008068132941356, 'slip_spread_k': 0.9638415687984103, 'spread_hl_frac': 0.04616208131159826, 'bb_std_mult': 2.492865338139972, 'rsi_os': 43, 'rsi_ob': 81, 'vol_spike': 0.19869329506325722, 'adx_thresh': 14.046072584662797, 'atr_min_pct': 0.009353461444962073, 'atr_max_pct': 0.04432889126279758, 'tp_mult': 1.349363783980814, 'tsl_mult': 0.6659544332465717, 'strategy': 'mean_reversion', 'time_stop': 96, 'use_sma': True, 'use_atr': False, 'use_adx': False, 'use_ema': True, 'use_spike': False, 'rsi_required': True, 'edge_k': 1.42378609300628, 'edge_cap': 0.275932793999819, 'bull_strategy': 'mean_reversion', 'bull_bb_std_mult': 0.9296948927028484, 'bull_rsi_os': 6, 'bull_rsi_ob': 72, 'bull_adx_thresh': 7.606912208979159, 'bull_atr_min_pct': 0.02397040407567145, 'bull_atr_max_pct': 0.10313190699107534, 'bull_tp_mult': 1.5180770770011556, 'bull_tsl_mult': 0.24715167568888957, 'bull_time_stop': 48, 'bull_use_sma': False, 'bull_use_ema': False, 'bull_use_atr': True, 'bull_use_adx': True, 'bull_use_spike': False, 'bull_rsi_required': True, 'bear_strategy': 'mean_reversion', 'bear_bb_std_mult': 1.4932280627478658, 'bear_rsi_os': 46, 'bear_rsi_ob': 69, 'bear_adx_thresh': 32.77820533867117, 'bear_atr_min_pct': 0.008528437209461935, 'bear_atr_max_pct': 0.062093578340013375, 'bear_tp_mult': 2.857178947296287, 'bear_tsl_mult': 0.7569861607253618, 'bear_time_stop': 272, 'bear_use_sma': True, 'bear_use_ema': True, 'bear_use_atr': True, 'bear_use_adx': True, 'bear_use_spike': False, 'bear_rsi_required': False, 'sideways_strategy': 'breakout', 'sideways_bb_std_mult': 3.443944460397061, 'sideways_rsi_os': 10, 'sideways_rsi_ob': 59, 'sideways_adx_thresh': 29.61987440674552, 'sideways_atr_min_pct': 0.021584507482423854, 'sideways_atr_max_pct': 0.10784257954429949, 'sideways_tp_mult': 1.0890323935915527, 'sideways_tsl_mult': 0.6215320052653297, 'sideways_time_stop': 25, 'sideways_use_sma': False, 'sideways_use_ema': False, 'sideways_use_atr': False, 'sideways_use_adx': True, 'sideways_use_spike': False, 'sideways_rsi_required': True}.
[I 2025-09-01 04:02:01,309] Trial 584 finished with values: [-1000000000.0, 1000000000.0] and parameters: {'p_sma': 16, 'p_std': 53, 'p_atr': 25, 'p_adx': 13, 'rsi_period': 78, 'ema1': 12, 'ema2': 50, 'slip_atr_k': 0.11212231765794135, 'slip_spread_k': 0.02326068690239081, 'spread_hl_frac': 0.04108388541705071, 'bb_std_mult': 2.522728341583909, 'rsi_os': 43, 'rsi_ob': 81, 'vol_spike': 0.10033448714100984, 'adx_thresh': 27.034647117659418, 'atr_min_pct': 0.009817412799879906, 'atr_max_pct': 0.05298380142730332, 'tp_mult': 2.600315901948694, 'tsl_mult': 0.3108046612884665, 'strategy': 'mean_reversion', 'time_stop': 95, 'use_sma': True, 'use_atr': False, 'use_adx': False, 'use_ema': True, 'use_spike': False, 'rsi_required': True, 'edge_k': 1.4103881101456355, 'edge_cap': 0.9982802377684292, 'bull_strategy': 'mean_reversion', 'bull_bb_std_mult': 0.9269819973151124, 'bull_rsi_os': 6, 'bull_rsi_ob': 78, 'bull_adx_thresh': 9.504014152169457, 'bull_atr_min_pct': 0.0241431033540897, 'bull_atr_max_pct': 0.0538779602321536, 'bull_tp_mult': 1.4799270926987211, 'bull_tsl_mult': 0.2972787615677158, 'bull_time_stop': 216, 'bull_use_sma': False, 'bull_use_ema': False, 'bull_use_atr': True, 'bull_use_adx': True, 'bull_use_spike': False, 'bull_rsi_required': True, 'bear_strategy': 'mean_reversion', 'bear_bb_std_mult': 3.220004616070774, 'bear_rsi_os': 32, 'bear_rsi_ob': 69, 'bear_adx_thresh': 34.06379865298304, 'bear_atr_min_pct': 0.00786071017164076, 'bear_atr_max_pct': 0.06162191240280833, 'bear_tp_mult': 2.879107351838782, 'bear_tsl_mult': 0.27934377490369006, 'bear_time_stop': 270, 'bear_use_sma': True, 'bear_use_ema': True, 'bear_use_atr': True, 'bear_use_adx': True, 'bear_use_spike': False, 'bear_rsi_required': False, 'sideways_strategy': 'breakout', 'sideways_bb_std_mult': 3.5505904500450822, 'sideways_rsi_os': 8, 'sideways_rsi_ob': 59, 'sideways_adx_thresh': 29.62895905761598, 'sideways_atr_min_pct': 0.018804694282770523, 'sideways_atr_max_pct': 0.10760453677843633, 'sideways_tp_mult': 1.104124880141311, 'sideways_tsl_mult': 0.7007711156888449, 'sideways_time_stop': 153, 'sideways_use_sma': False, 'sideways_use_ema': False, 'sideways_use_atr': False, 'sideways_use_adx': False, 'sideways_use_spike': False, 'sideways_rsi_required': True}.
[I 2025-09-01 04:02:01,309] Trial 586 finished with values: [-1000000000.0, 1000000000.0] and parameters: {'p_sma': 17, 'p_std': 53, 'p_atr': 25, 'p_adx': 9, 'rsi_period': 11, 'ema1': 13, 'ema2': 14, 'slip_atr_k': 0.009553269595767532, 'slip_spread_k': 0.9606230730078267, 'spread_hl_frac': 0.04563991418800622, 'bb_std_mult': 2.480561664219091, 'rsi_os': 43, 'rsi_ob': 81, 'vol_spike': 0.17702614615307774, 'adx_thresh': 14.232710144608538, 'atr_min_pct': 5.1904167166997445e-06, 'atr_max_pct': 0.05403563605667066, 'tp_mult': 1.0641681459956314, 'tsl_mult': 0.5977133399059762, 'strategy': 'mean_reversion', 'time_stop': 97, 'use_sma': True, 'use_atr': False, 'use_adx': False, 'use_ema': True, 'use_spike': False, 'rsi_required': True, 'edge_k': 1.6385651125876453, 'edge_cap': 0.3343748080653793, 'bull_strategy': 'mean_reversion', 'bull_bb_std_mult': 1.873258469173618, 'bull_rsi_os': 6, 'bull_rsi_ob': 76, 'bull_adx_thresh': 7.519112079664594, 'bull_atr_min_pct': 0.0012261190681858505, 'bull_atr_max_pct': 0.053352777123107265, 'bull_tp_mult': 1.5246416024199172, 'bull_tsl_mult': 0.2496307259572696, 'bull_time_stop': 300, 'bull_use_sma': False, 'bull_use_ema': False, 'bull_use_atr': True, 'bull_use_adx': True, 'bull_use_spike': False, 'bull_rsi_required': True, 'bear_strategy': 'mean_reversion', 'bear_bb_std_mult': 3.343059344574611, 'bear_rsi_os': 46, 'bear_rsi_ob': 69, 'bear_adx_thresh': 34.83095456271617, 'bear_atr_min_pct': 0.00838700705836894, 'bear_atr_max_pct': 0.09597083005840581, 'bear_tp_mult': 2.8752212212610107, 'bear_tsl_mult': 0.05024009953433009, 'bear_time_stop': 270, 'bear_use_sma': True, 'bear_use_ema': True, 'bear_use_atr': True, 'bear_use_adx': True, 'bear_use_spike': False, 'bear_rsi_required': False, 'sideways_strategy': 'breakout', 'sideways_bb_std_mult': 3.4291187207277307, 'sideways_rsi_os': 6, 'sideways_rsi_ob': 59, 'sideways_adx_thresh': 29.75069284464578, 'sideways_atr_min_pct': 0.02420631512224139, 'sideways_atr_max_pct': 0.10763464453723404, 'sideways_tp_mult': 2.9974935916240577, 'sideways_tsl_mult': 0.7160095731859134, 'sideways_time_stop': 144, 'sideways_use_sma': False, 'sideways_use_ema': False, 'sideways_use_atr': False, 'sideways_use_adx': True, 'sideways_use_spike': False, 'sideways_rsi_required': True}.
[I 2025-09-01 04:02:42,471] Trial 588 finished with values: [-1000000000.0, 1000000000.0] and parameters: {'p_sma': 19, 'p_std': 53, 'p_atr': 25, 'p_adx': 14, 'rsi_period': 11, 'ema1': 15, 'ema2': 50, 'slip_atr_k': 0.01042044033692626, 'slip_spread_k': 0.6975119726929669, 'spread_hl_frac': 0.0058453758473676655, 'bb_std_mult': 0.5065732266260139, 'rsi_os': 52, 'rsi_ob': 59, 'vol_spike': 0.27825985972449196, 'adx_thresh': 16.074520748805256, 'atr_min_pct': 0.020194553484419838, 'atr_max_pct': 0.05352033177754875, 'tp_mult': 2.432732769816223, 'tsl_mult': 0.16613265368387953, 'strategy': 'breakout', 'time_stop': 93, 'use_sma': True, 'use_atr': False, 'use_adx': False, 'use_ema': True, 'use_spike': False, 'rsi_required': True, 'edge_k': 0.9971095655655627, 'edge_cap': 0.337758721141744, 'bull_strategy': 'mean_reversion', 'bull_bb_std_mult': 2.8053144392483276, 'bull_rsi_os': 7, 'bull_rsi_ob': 78, 'bull_adx_thresh': 7.305507405415808, 'bull_atr_min_pct': 0.0012691938471507233, 'bull_atr_max_pct': 0.014314171742340731, 'bull_tp_mult': 2.0081710032312645, 'bull_tsl_mult': 0.3113250091217498, 'bull_time_stop': 215, 'bull_use_sma': False, 'bull_use_ema': True, 'bull_use_atr': True, 'bull_use_adx': True, 'bull_use_spike': False, 'bull_rsi_required': True, 'bear_strategy': 'mean_reversion', 'bear_bb_std_mult': 3.1076327152191934, 'bear_rsi_os': 43, 'bear_rsi_ob': 69, 'bear_adx_thresh': 20.292988519594225, 'bear_atr_min_pct': 0.010999241481994229, 'bear_atr_max_pct': 0.05454653634027778, 'bear_tp_mult': 2.347546885439506, 'bear_tsl_mult': 0.004531452328613385, 'bear_time_stop': 179, 'bear_use_sma': True, 'bear_use_ema': True, 'bear_use_atr': True, 'bear_use_adx': True, 'bear_use_spike': True, 'bear_rsi_required': False, 'sideways_strategy': 'mean_reversion', 'sideways_bb_std_mult': 1.2168137818726654, 'sideways_rsi_os': 6, 'sideways_rsi_ob': 57, 'sideways_adx_thresh': 12.671462141560596, 'sideways_atr_min_pct': 0.023953812741423143, 'sideways_atr_max_pct': 0.11094358854931365, 'sideways_tp_mult': 1.9486844654897462, 'sideways_tsl_mult': 0.7035275986573651, 'sideways_time_stop': 54, 'sideways_use_sma': False, 'sideways_use_ema': False, 'sideways_use_atr': False, 'sideways_use_adx': False, 'sideways_use_spike': False, 'sideways_rsi_required': True}.
[I 2025-09-01 04:02:42,877] Trial 591 finished with values: [-1000000000.0, 1000000000.0] and parameters: {'p_sma': 19, 'p_std': 27, 'p_atr': 10, 'p_adx': 14, 'rsi_period': 9, 'ema1': 13, 'ema2': 49, 'slip_atr_k': 0.004029414707368763, 'slip_spread_k': 0.0512921388410858, 'spread_hl_frac': 0.043058498270355565, 'bb_std_mult': 0.9254179169996961, 'rsi_os': 45, 'rsi_ob': 62, 'vol_spike': 0.16746349982219413, 'adx_thresh': 15.9331876302054, 'atr_min_pct': 0.026216973062976087, 'atr_max_pct': 0.08767810109093137, 'tp_mult': 2.5277141532670946, 'tsl_mult': 0.31255995764967703, 'strategy': 'breakout', 'time_stop': 112, 'use_sma': True, 'use_atr': True, 'use_adx': False, 'use_ema': True, 'use_spike': False, 'rsi_required': True, 'edge_k': 1.5635498524711078, 'edge_cap': 0.2680536590717213, 'bull_strategy': 'mean_reversion', 'bull_bb_std_mult': 2.393516890660571, 'bull_rsi_os': 8, 'bull_rsi_ob': 78, 'bull_adx_thresh': 34.257214512152856, 'bull_atr_min_pct': 0.02561924859253257, 'bull_atr_max_pct': 0.025243095989169233, 'bull_tp_mult': 1.1005789421154473, 'bull_tsl_mult': 0.3531370285815421, 'bull_time_stop': 287, 'bull_use_sma': False, 'bull_use_ema': True, 'bull_use_atr': True, 'bull_use_adx': True, 'bull_use_spike': False, 'bull_rsi_required': True, 'bear_strategy': 'mean_reversion', 'bear_bb_std_mult': 3.097149642833777, 'bear_rsi_os': 39, 'bear_rsi_ob': 70, 'bear_adx_thresh': 6.227916933250839, 'bear_atr_min_pct': 0.009393197228619152, 'bear_atr_max_pct': 0.053502898217228874, 'bear_tp_mult': 2.6223377075929726, 'bear_tsl_mult': 0.0797462361758656, 'bear_time_stop': 280, 'bear_use_sma': True, 'bear_use_ema': True, 'bear_use_atr': True, 'bear_use_adx': True, 'bear_use_spike': True, 'bear_rsi_required': False, 'sideways_strategy': 'mean_reversion', 'sideways_bb_std_mult': 3.4765008372520354, 'sideways_rsi_os': 33, 'sideways_rsi_ob': 60, 'sideways_adx_thresh': 30.689737849727397, 'sideways_atr_min_pct': 0.021494665396296346, 'sideways_atr_max_pct': 0.051344507279358464, 'sideways_tp_mult': 1.9526762545185612, 'sideways_tsl_mult': 0.726953354080204, 'sideways_time_stop': 55, 'sideways_use_sma': False, 'sideways_use_ema': False, 'sideways_use_atr': False, 'sideways_use_adx': False, 'sideways_use_spike': False, 'sideways_rsi_required': True}.
[I 2025-09-01 04:02:43,000] Trial 590 finished with values: [-1000000000.0, 1000000000.0] and parameters: {'p_sma': 19, 'p_std': 10, 'p_atr': 10, 'p_adx': 13, 'rsi_period': 9, 'ema1': 13, 'ema2': 52, 'slip_atr_k': 0.004996781566384734, 'slip_spread_k': 0.684304646588413, 'spread_hl_frac': 0.04357574978694616, 'bb_std_mult': 2.4118867701973645, 'rsi_os': 44, 'rsi_ob': 79, 'vol_spike': 0.18848945479412813, 'adx_thresh': 20.3379447098908, 'atr_min_pct': 0.02166990311135534, 'atr_max_pct': 0.08818740843536116, 'tp_mult': 2.5276168434130257, 'tsl_mult': 0.303562173050851, 'strategy': 'breakout', 'time_stop': 87, 'use_sma': True, 'use_atr': True, 'use_adx': False, 'use_ema': True, 'use_spike': False, 'rsi_required': True, 'edge_k': 1.171011204711533, 'edge_cap': 0.6068871943373662, 'bull_strategy': 'mean_reversion', 'bull_bb_std_mult': 2.8137796918290117, 'bull_rsi_os': 8, 'bull_rsi_ob': 78, 'bull_adx_thresh': 8.33610402531157, 'bull_atr_min_pct': 0.02238090716468951, 'bull_atr_max_pct': 0.01254664291989617, 'bull_tp_mult': 1.1057912614337075, 'bull_tsl_mult': 0.3261281402235444, 'bull_time_stop': 289, 'bull_use_sma': False, 'bull_use_ema': True, 'bull_use_atr': True, 'bull_use_adx': True, 'bull_use_spike': False, 'bull_rsi_required': True, 'bear_strategy': 'mean_reversion', 'bear_bb_std_mult': 3.0926275735126256, 'bear_rsi_os': 45, 'bear_rsi_ob': 70, 'bear_adx_thresh': 6.244811403550292, 'bear_atr_min_pct': 0.009396426421812518, 'bear_atr_max_pct': 0.0541620013235354, 'bear_tp_mult': 1.5322938303294238, 'bear_tsl_mult': 0.0032561329391836633, 'bear_time_stop': 279, 'bear_use_sma': True, 'bear_use_ema': True, 'bear_use_atr': True, 'bear_use_adx': True, 'bear_use_spike': True, 'bear_rsi_required': False, 'sideways_strategy': 'mean_reversion', 'sideways_bb_std_mult': 3.4713224964223817, 'sideways_rsi_os': 33, 'sideways_rsi_ob': 57, 'sideways_adx_thresh': 11.88876862067123, 'sideways_atr_min_pct': 0.021320629295346383, 'sideways_atr_max_pct': 0.049136978192303574, 'sideways_tp_mult': 2.102436378963267, 'sideways_tsl_mult': 0.7041025516908853, 'sideways_time_stop': 160, 'sideways_use_sma': False, 'sideways_use_ema': False, 'sideways_use_atr': False, 'sideways_use_adx': False, 'sideways_use_spike': False, 'sideways_rsi_required': True}.
[I 2025-09-01 04:02:43,132] Trial 589 finished with values: [-1000000000.0, 1000000000.0] and parameters: {'p_sma': 18, 'p_std': 27, 'p_atr': 25, 'p_adx': 13, 'rsi_period': 44, 'ema1': 15, 'ema2': 50, 'slip_atr_k': 0.010511039238958955, 'slip_spread_k': 0.6943543436554587, 'spread_hl_frac': 0.005408372174649088, 'bb_std_mult': 1.0049750034395946, 'rsi_os': 45, 'rsi_ob': 59, 'vol_spike': 0.18801918827831804, 'adx_thresh': 14.296184399924451, 'atr_min_pct': 0.0004392923411235504, 'atr_max_pct': 0.05420389739165015, 'tp_mult': 2.5269860085510505, 'tsl_mult': 0.6031181673875881, 'strategy': 'breakout', 'time_stop': 95, 'use_sma': True, 'use_atr': False, 'use_adx': False, 'use_ema': True, 'use_spike': False, 'rsi_required': True, 'edge_k': 0.9924024061453669, 'edge_cap': 0.6108752731857547, 'bull_strategy': 'mean_reversion', 'bull_bb_std_mult': 0.8759447973178491, 'bull_rsi_os': 7, 'bull_rsi_ob': 78, 'bull_adx_thresh': 32.97931768771464, 'bull_atr_min_pct': 0.001137473542407476, 'bull_atr_max_pct': 0.11087538841856648, 'bull_tp_mult': 1.1621066999123668, 'bull_tsl_mult': 0.3213355425332231, 'bull_time_stop': 286, 'bull_use_sma': False, 'bull_use_ema': True, 'bull_use_atr': True, 'bull_use_adx': True, 'bull_use_spike': False, 'bull_rsi_required': True, 'bear_strategy': 'mean_reversion', 'bear_bb_std_mult': 3.0975334624433053, 'bear_rsi_os': 32, 'bear_rsi_ob': 69, 'bear_adx_thresh': 34.85491038067401, 'bear_atr_min_pct': 0.013332289143005471, 'bear_atr_max_pct': 0.05412284692133563, 'bear_tp_mult': 2.8199471550735087, 'bear_tsl_mult': 0.003302122034735948, 'bear_time_stop': 278, 'bear_use_sma': True, 'bear_use_ema': True, 'bear_use_atr': True, 'bear_use_adx': True, 'bear_use_spike': True, 'bear_rsi_required': False, 'sideways_strategy': 'mean_reversion', 'sideways_bb_std_mult': 3.4444227874553834, 'sideways_rsi_os': 6, 'sideways_rsi_ob': 60, 'sideways_adx_thresh': 6.923268915105018, 'sideways_atr_min_pct': 0.02396417447768021, 'sideways_atr_max_pct': 0.11158930169400405, 'sideways_tp_mult': 2.9598474138513966, 'sideways_tsl_mult': 0.7072024614940887, 'sideways_time_stop': 143, 'sideways_use_sma': False, 'sideways_use_ema': False, 'sideways_use_atr': False, 'sideways_use_adx': False, 'sideways_use_spike': False, 'sideways_rsi_required': True}.
[I 2025-09-01 04:03:25,318] Trial 594 finished with values: [-1000000000.0, 1000000000.0] and parameters: {'p_sma': 13, 'p_std': 51, 'p_atr': 24, 'p_adx': 8, 'rsi_period': 10, 'ema1': 14, 'ema2': 43, 'slip_atr_k': 0.1848805748480186, 'slip_spread_k': 0.027537175612750847, 'spread_hl_frac': 0.010253034003336381, 'bb_std_mult': 2.5980130612177312, 'rsi_os': 13, 'rsi_ob': 69, 'vol_spike': 0.1999920043316877, 'adx_thresh': 12.90615918711769, 'atr_min_pct': 0.01915924850359222, 'atr_max_pct': 0.04861926586477265, 'tp_mult': 1.8300273602412636, 'tsl_mult': 0.9241926864704801, 'strategy': 'mean_reversion', 'time_stop': 78, 'use_sma': True, 'use_atr': False, 'use_adx': False, 'use_ema': True, 'use_spike': False, 'rsi_required': True, 'edge_k': 0.23760091430863794, 'edge_cap': 0.24644503862379913, 'bull_strategy': 'mean_reversion', 'bull_bb_std_mult': 0.7321037888477852, 'bull_rsi_os': 5, 'bull_rsi_ob': 74, 'bull_adx_thresh': 8.856342702791824, 'bull_atr_min_pct': 0.0005524074928845054, 'bull_atr_max_pct': 0.10227874683103531, 'bull_tp_mult': 1.432003414847425, 'bull_tsl_mult': 0.2721665374807355, 'bull_time_stop': 37, 'bull_use_sma': False, 'bull_use_ema': False, 'bull_use_atr': True, 'bull_use_adx': True, 'bull_use_spike': False, 'bull_rsi_required': True, 'bear_strategy': 'mean_reversion', 'bear_bb_std_mult': 3.3119556233737217, 'bear_rsi_os': 27, 'bear_rsi_ob': 71, 'bear_adx_thresh': 32.068234372643985, 'bear_atr_min_pct': 0.00900683655991337, 'bear_atr_max_pct': 0.05791419880493699, 'bear_tp_mult': 2.954567180780721, 'bear_tsl_mult': 0.05960102762326573, 'bear_time_stop': 287, 'bear_use_sma': True, 'bear_use_ema': True, 'bear_use_atr': True, 'bear_use_adx': True, 'bear_use_spike': True, 'bear_rsi_required': False, 'sideways_strategy': 'breakout', 'sideways_bb_std_mult': 3.190999064646271, 'sideways_rsi_os': 31, 'sideways_rsi_ob': 64, 'sideways_adx_thresh': 30.535765168485693, 'sideways_atr_min_pct': 0.023037036246144536, 'sideways_atr_max_pct': 0.1049598950379214, 'sideways_tp_mult': 1.9060166338827602, 'sideways_tsl_mult': 0.7293310780706184, 'sideways_time_stop': 160, 'sideways_use_sma': False, 'sideways_use_ema': False, 'sideways_use_atr': False, 'sideways_use_adx': False, 'sideways_use_spike': False, 'sideways_rsi_required': False}.
[I 2025-09-01 04:03:25,853] Trial 592 finished with values: [-1000000000.0, 1000000000.0] and parameters: {'p_sma': 18, 'p_std': 51, 'p_atr': 21, 'p_adx': 13, 'rsi_period': 48, 'ema1': 13, 'ema2': 44, 'slip_atr_k': 0.004324739136905026, 'slip_spread_k': 0.0495715198067217, 'spread_hl_frac': 0.04371428017177033, 'bb_std_mult': 0.9236512709788534, 'rsi_os': 12, 'rsi_ob': 79, 'vol_spike': 0.18742971444850137, 'adx_thresh': 20.347404687832515, 'atr_min_pct': 0.017558396105030006, 'atr_max_pct': 0.04871243245624432, 'tp_mult': 2.5293994687393906, 'tsl_mult': 0.5395957402562429, 'strategy': 'breakout', 'time_stop': 108, 'use_sma': True, 'use_atr': True, 'use_adx': False, 'use_ema': True, 'use_spike': False, 'rsi_required': True, 'edge_k': 1.5394305822527667, 'edge_cap': 0.27105143933920756, 'bull_strategy': 'mean_reversion', 'bull_bb_std_mult': 2.5637414233389375, 'bull_rsi_os': 8, 'bull_rsi_ob': 80, 'bull_adx_thresh': 33.03966089914408, 'bull_atr_min_pct': 0.0005154803624038526, 'bull_atr_max_pct': 0.033546022647917936, 'bull_tp_mult': 1.45905248650049, 'bull_tsl_mult': 0.3513111381962322, 'bull_time_stop': 122, 'bull_use_sma': False, 'bull_use_ema': True, 'bull_use_atr': True, 'bull_use_adx': True, 'bull_use_spike': False, 'bull_rsi_required': True, 'bear_strategy': 'mean_reversion', 'bear_bb_std_mult': 3.3230885426368455, 'bear_rsi_os': 47, 'bear_rsi_ob': 70, 'bear_adx_thresh': 32.06090024727438, 'bear_atr_min_pct': 0.006833378261305397, 'bear_atr_max_pct': 0.06872003651779035, 'bear_tp_mult': 2.961225683175963, 'bear_tsl_mult': 0.07836156397213728, 'bear_time_stop': 278, 'bear_use_sma': True, 'bear_use_ema': True, 'bear_use_atr': True, 'bear_use_adx': True, 'bear_use_spike': True, 'bear_rsi_required': False, 'sideways_strategy': 'breakout', 'sideways_bb_std_mult': 3.484183222326739, 'sideways_rsi_os': 33, 'sideways_rsi_ob': 60, 'sideways_adx_thresh': 20.479312751861617, 'sideways_atr_min_pct': 0.023170566833955755, 'sideways_atr_max_pct': 0.0514952537789581, 'sideways_tp_mult': 2.6598485937959975, 'sideways_tsl_mult': 0.723758336589775, 'sideways_time_stop': 163, 'sideways_use_sma': False, 'sideways_use_ema': False, 'sideways_use_atr': False, 'sideways_use_adx': False, 'sideways_use_spike': False, 'sideways_rsi_required': True}.
