[I 2025-08-31 11:33:42,101] Trial 299 finished with values: [-1000000000.0, 1000000000.0] and parameters: {'p_sma': 38, 'p_std': 15, 'p_atr': 15, 'p_adx': 24, 'rsi_period': 34, 'ema1': 29, 'ema2': 39, 'slip_atr_k': 0.20536897497602868, 'slip_spread_k': 0.07934233624351714, 'spread_hl_frac': 0.0033069932896737267, 'bb_std_mult': 0.9336303738105128, 'rsi_os': 36, 'rsi_ob': 54, 'vol_spike': 0.06211256752100723, 'adx_thresh': 24.658300517161525, 'atr_min_pct': 0.01704663050786011, 'atr_max_pct': 0.03353709400940028, 'tp_mult': 2.873970364083977, 'tsl_mult': 0.31487591710229795, 'strategy': 'breakout', 'time_stop': 273, 'use_sma': True, 'use_atr': True, 'use_adx': False, 'use_ema': False, 'use_spike': True, 'rsi_required': True, 'edge_k': 0.06201097919994325, 'edge_cap': 0.8110715781889722, 'bull_strategy': 'breakout', 'bull_bb_std_mult': 2.7011320461819266, 'bull_rsi_os': 36, 'bull_rsi_ob': 49, 'bull_adx_thresh': 30.995369925420704, 'bull_atr_min_pct': 0.02802485806053698, 'bull_atr_max_pct': 0.048870755193038934, 'bull_tp_mult': 1.4123500299909064, 'bull_tsl_mult': 0.435417823431296, 'bull_time_stop': 5, 'bull_use_sma': True, 'bull_use_ema': True, 'bull_use_atr': True, 'bull_use_adx': False, 'bull_use_spike': False, 'bull_rsi_required': True, 'bear_strategy': 'mean_reversion', 'bear_bb_std_mult': 1.125521467697386, 'bear_rsi_os': 29, 'bear_rsi_ob': 83, 'bear_adx_thresh': 10.373944407021414, 'bear_atr_min_pct': 0.01576556285203158, 'bear_atr_max_pct': 0.10891869163550456, 'bear_tp_mult': 2.6278827146673946, 'bear_tsl_mult': 0.9921636536442249, 'bear_time_stop': 220, 'bear_use_sma': False, 'bear_use_ema': True, 'bear_use_atr': True, 'bear_use_adx': False, 'bear_use_spike': True, 'bear_rsi_required': False, 'sideways_strategy': 'breakout', 'sideways_bb_std_mult': 1.8123169045616414, 'sideways_rsi_os': 8, 'sideways_rsi_ob': 54, 'sideways_adx_thresh': 10.901765726487206, 'sideways_atr_min_pct': 0.0020171069331927152, 'sideways_atr_max_pct': 0.044737943456417184, 'sideways_tp_mult': 1.4075492866464399, 'sideways_tsl_mult': 0.3226425866930888, 'sideways_time_stop': 5, 'sideways_use_sma': True, 'sideways_use_ema': False, 'sideways_use_atr': True, 'sideways_use_adx': True, 'sideways_use_spike': False, 'sideways_rsi_required': True}.
[I 2025-08-31 11:33:43,638] Trial 298 finished with values: [-1000000000.0, 1000000000.0] and parameters: {'p_sma': 38, 'p_std': 16, 'p_atr': 15, 'p_adx': 24, 'rsi_period': 22, 'ema1': 22, 'ema2': 29, 'slip_atr_k': 0.009851280506691387, 'slip_spread_k': 0.8806903667700177, 'spread_hl_frac': 0.02742497920283769, 'bb_std_mult': 0.8135663750356743, 'rsi_os': 47, 'rsi_ob': 71, 'vol_spike': 0.17117089572664693, 'adx_thresh': 24.76153407728126, 'atr_min_pct': 0.0038513376026515864, 'atr_max_pct': 0.03217299479675205, 'tp_mult': 1.1113250137302806, 'tsl_mult': 0.3039372637090538, 'strategy': 'breakout', 'time_stop': 264, 'use_sma': True, 'use_atr': True, 'use_adx': False, 'use_ema': False, 'use_spike': True, 'rsi_required': True, 'edge_k': 0.03683392834618349, 'edge_cap': 0.5642313400854176, 'bull_strategy': 'mean_reversion', 'bull_bb_std_mult': 2.6624367209551076, 'bull_rsi_os': 22, 'bull_rsi_ob': 65, 'bull_adx_thresh': 14.98359840565874, 'bull_atr_min_pct': 0.02801076053706999, 'bull_atr_max_pct': 0.1467374679203437, 'bull_tp_mult': 1.397797701649264, 'bull_tsl_mult': 0.8462092991428041, 'bull_time_stop': 128, 'bull_use_sma': True, 'bull_use_ema': True, 'bull_use_atr': True, 'bull_use_adx': False, 'bull_use_spike': False, 'bull_rsi_required': True, 'bear_strategy': 'breakout', 'bear_bb_std_mult': 1.0063325181701048, 'bear_rsi_os': 6, 'bear_rsi_ob': 53, 'bear_adx_thresh': 30.160512850014424, 'bear_atr_min_pct': 0.0157841478391078, 'bear_atr_max_pct': 0.12754597492243797, 'bear_tp_mult': 1.2040109231828673, 'bear_tsl_mult': 0.9937213153340596, 'bear_time_stop': 124, 'bear_use_sma': False, 'bear_use_ema': True, 'bear_use_atr': True, 'bear_use_adx': False, 'bear_use_spike': True, 'bear_rsi_required': False, 'sideways_strategy': 'breakout', 'sideways_bb_std_mult': 1.7734540233792326, 'sideways_rsi_os': 34, 'sideways_rsi_ob': 72, 'sideways_adx_thresh': 10.850669403150809, 'sideways_atr_min_pct': 0.018352755471375104, 'sideways_atr_max_pct': 0.04599522227197715, 'sideways_tp_mult': 1.3137365266047374, 'sideways_tsl_mult': 0.2915121859660902, 'sideways_time_stop': 262, 'sideways_use_sma': True, 'sideways_use_ema': False, 'sideways_use_atr': True, 'sideways_use_adx': True, 'sideways_use_spike': False, 'sideways_rsi_required': False}.
[I 2025-08-31 11:33:44,082] Trial 297 finished with values: [-0.021496718273975257, 0.021654627471665945] and parameters: {'p_sma': 11, 'p_std': 16, 'p_atr': 14, 'p_adx': 24, 'rsi_period': 49, 'ema1': 26, 'ema2': 41, 'slip_atr_k': 0.05046218534012171, 'slip_spread_k': 0.8835236427700539, 'spread_hl_frac': 0.01192430699918137, 'bb_std_mult': 1.8586706931311783, 'rsi_os': 55, 'rsi_ob': 71, 'vol_spike': 0.12245486517972604, 'adx_thresh': 24.434741084602088, 'atr_min_pct': 0.016792125034614542, 'atr_max_pct': 0.048304078612862573, 'tp_mult': 1.1583370854949797, 'tsl_mult': 0.31339534733500757, 'strategy': 'breakout', 'time_stop': 272, 'use_sma': True, 'use_atr': False, 'use_adx': False, 'use_ema': False, 'use_spike': True, 'rsi_required': True, 'edge_k': 0.33651622382385415, 'edge_cap': 0.3057416131197872, 'bull_strategy': 'mean_reversion', 'bull_bb_std_mult': 2.6835834315765683, 'bull_rsi_os': 33, 'bull_rsi_ob': 65, 'bull_adx_thresh': 31.222156312089183, 'bull_atr_min_pct': 0.005487323310804727, 'bull_atr_max_pct': 0.14641101068511506, 'bull_tp_mult': 1.4191712964711116, 'bull_tsl_mult': 0.15725271723066825, 'bull_time_stop': 5, 'bull_use_sma': True, 'bull_use_ema': True, 'bull_use_atr': True, 'bull_use_adx': False, 'bull_use_spike': False, 'bull_rsi_required': True, 'bear_strategy': 'breakout', 'bear_bb_std_mult': 0.9912384691377973, 'bear_rsi_os': 26, 'bear_rsi_ob': 53, 'bear_adx_thresh': 10.336280689951666, 'bear_atr_min_pct': 0.01587185343715015, 'bear_atr_max_pct': 0.11718846951992579, 'bear_tp_mult': 2.6763788779441606, 'bear_tsl_mult': 0.9985002630539941, 'bear_time_stop': 217, 'bear_use_sma': False, 'bear_use_ema': True, 'bear_use_atr': True, 'bear_use_adx': False, 'bear_use_spike': True, 'bear_rsi_required': False, 'sideways_strategy': 'breakout', 'sideways_bb_std_mult': 2.2869728351004914, 'sideways_rsi_os': 35, 'sideways_rsi_ob': 73, 'sideways_adx_thresh': 13.656505981715702, 'sideways_atr_min_pct': 0.0021752016724393536, 'sideways_atr_max_pct': 0.046401711219712635, 'sideways_tp_mult': 1.322691546404874, 'sideways_tsl_mult': 0.901991750223794, 'sideways_time_stop': 17, 'sideways_use_sma': True, 'sideways_use_ema': True, 'sideways_use_atr': True, 'sideways_use_adx': True, 'sideways_use_spike': False, 'sideways_rsi_required': False}.
[I 2025-08-31 11:33:58,461] Trial 300 finished with values: [-1000000000.0, 1000000000.0] and parameters: {'p_sma': 26, 'p_std': 18, 'p_atr': 15, 'p_adx': 27, 'rsi_period': 81, 'ema1': 19, 'ema2': 29, 'slip_atr_k': 0.0395540021824185, 'slip_spread_k': 0.07211943211083958, 'spread_hl_frac': 0.0032737407643888793, 'bb_std_mult': 0.9486999631265602, 'rsi_os': 55, 'rsi_ob': 71, 'vol_spike': 0.10479791014184797, 'adx_thresh': 25.289180596829922, 'atr_min_pct': 0.005413341533067349, 'atr_max_pct': 0.03475232994202417, 'tp_mult': 1.1124985341346758, 'tsl_mult': 0.9862013298357384, 'strategy': 'breakout', 'time_stop': 271, 'use_sma': True, 'use_atr': True, 'use_adx': False, 'use_ema': False, 'use_spike': True, 'rsi_required': True, 'edge_k': 0.5140319127348022, 'edge_cap': 0.3035040509454374, 'bull_strategy': 'breakout', 'bull_bb_std_mult': 2.7048987857655393, 'bull_rsi_os': 54, 'bull_rsi_ob': 73, 'bull_adx_thresh': 29.334853249213005, 'bull_atr_min_pct': 0.003981737716634224, 'bull_atr_max_pct': 0.14690306759402913, 'bull_tp_mult': 1.4569918087238016, 'bull_tsl_mult': 0.1991986965241654, 'bull_time_stop': 209, 'bull_use_sma': True, 'bull_use_ema': True, 'bull_use_atr': True, 'bull_use_adx': False, 'bull_use_spike': False, 'bull_rsi_required': True, 'bear_strategy': 'mean_reversion', 'bear_bb_std_mult': 1.1867871890659834, 'bear_rsi_os': 29, 'bear_rsi_ob': 89, 'bear_adx_thresh': 31.52338335022403, 'bear_atr_min_pct': 0.015930502676720745, 'bear_atr_max_pct': 0.07779912681972892, 'bear_tp_mult': 2.592793004310949, 'bear_tsl_mult': 0.056050431856242255, 'bear_time_stop': 219, 'bear_use_sma': False, 'bear_use_ema': True, 'bear_use_atr': True, 'bear_use_adx': False, 'bear_use_spike': True, 'bear_rsi_required': False, 'sideways_strategy': 'breakout', 'sideways_bb_std_mult': 1.5640831468111358, 'sideways_rsi_os': 6, 'sideways_rsi_ob': 72, 'sideways_adx_thresh': 11.874449089309438, 'sideways_atr_min_pct': 0.002162433206093297, 'sideways_atr_max_pct': 0.0443010630633948, 'sideways_tp_mult': 2.475401805693478, 'sideways_tsl_mult': 0.2918892159448151, 'sideways_time_stop': 15, 'sideways_use_sma': True, 'sideways_use_ema': False, 'sideways_use_atr': True, 'sideways_use_adx': True, 'sideways_use_spike': False, 'sideways_rsi_required': True}.
[I 2025-08-31 11:34:12,414] Trial 304 finished with values: [-1000000000.0, 1000000000.0] and parameters: {'p_sma': 34, 'p_std': 15, 'p_atr': 13, 'p_adx': 16, 'rsi_period': 49, 'ema1': 12, 'ema2': 46, 'slip_atr_k': 0.24283108426113298, 'slip_spread_k': 0.9530383667011967, 'spread_hl_frac': 0.02247362719126528, 'bb_std_mult': 3.259043062038744, 'rsi_os': 34, 'rsi_ob': 73, 'vol_spike': 0.02994353716105924, 'adx_thresh': 7.308391900469465, 'atr_min_pct': 0.01901688508343471, 'atr_max_pct': 0.013666541196457571, 'tp_mult': 1.089842427309332, 'tsl_mult': 0.9045922008430545, 'strategy': 'breakout', 'time_stop': 291, 'use_sma': False, 'use_atr': True, 'use_adx': True, 'use_ema': True, 'use_spike': True, 'rsi_required': False, 'edge_k': 0.4104997691570598, 'edge_cap': 0.8589762657979686, 'bull_strategy': 'breakout', 'bull_bb_std_mult': 2.43345773555448, 'bull_rsi_os': 25, 'bull_rsi_ob': 78, 'bull_adx_thresh': 27.702784424277056, 'bull_atr_min_pct': 0.00466153235260949, 'bull_atr_max_pct': 0.04213130918363663, 'bull_tp_mult': 1.490112830186129, 'bull_tsl_mult': 0.2595011075992796, 'bull_time_stop': 230, 'bull_use_sma': False, 'bull_use_ema': True, 'bull_use_atr': True, 'bull_use_adx': True, 'bull_use_spike': True, 'bull_rsi_required': False, 'bear_strategy': 'breakout', 'bear_bb_std_mult': 1.1105466430992053, 'bear_rsi_os': 33, 'bear_rsi_ob': 52, 'bear_adx_thresh': 30.940481882200917, 'bear_atr_min_pct': 0.014738518770562264, 'bear_atr_max_pct': 0.08244597576424569, 'bear_tp_mult': 1.9887495062998033, 'bear_tsl_mult': 0.9207171748282514, 'bear_time_stop': 30, 'bear_use_sma': False, 'bear_use_ema': True, 'bear_use_atr': False, 'bear_use_adx': True, 'bear_use_spike': False, 'bear_rsi_required': True, 'sideways_strategy': 'breakout', 'sideways_bb_std_mult': 1.679047008928566, 'sideways_rsi_os': 13, 'sideways_rsi_ob': 51, 'sideways_adx_thresh': 8.643863563585512, 'sideways_atr_min_pct': 0.016018421852884664, 'sideways_atr_max_pct': 0.03839424617472107, 'sideways_tp_mult': 1.4139066076940907, 'sideways_tsl_mult': 0.22681337293038406, 'sideways_time_stop': 17, 'sideways_use_sma': True, 'sideways_use_ema': False, 'sideways_use_atr': True, 'sideways_use_adx': True, 'sideways_use_spike': False, 'sideways_rsi_required': True}.
[I 2025-08-31 11:34:14,861] Trial 301 finished with values: [-1000000000.0, 1000000000.0] and parameters: {'p_sma': 34, 'p_std': 18, 'p_atr': 13, 'p_adx': 14, 'rsi_period': 49, 'ema1': 21, 'ema2': 59, 'slip_atr_k': 0.21413300049777356, 'slip_spread_k': 0.05897351448318857, 'spread_hl_frac': 0.03266291690650273, 'bb_std_mult': 0.8374744817994384, 'rsi_os': 47, 'rsi_ob': 71, 'vol_spike': 0.12118631335616847, 'adx_thresh': 25.25815250808722, 'atr_min_pct': 0.003611966780965252, 'atr_max_pct': 0.09673160700422563, 'tp_mult': 1.106712020832523, 'tsl_mult': 0.9793851190058835, 'strategy': 'breakout', 'time_stop': 263, 'use_sma': True, 'use_atr': True, 'use_adx': False, 'use_ema': False, 'use_spike': True, 'rsi_required': True, 'edge_k': 1.5509891950645618, 'edge_cap': 0.7952697309885981, 'bull_strategy': 'breakout', 'bull_bb_std_mult': 2.42884351148386, 'bull_rsi_os': 43, 'bull_rsi_ob': 54, 'bull_adx_thresh': 15.348476555901929, 'bull_atr_min_pct': 0.00399662817253248, 'bull_atr_max_pct': 0.14622892770801205, 'bull_tp_mult': 2.8494391331321425, 'bull_tsl_mult': 0.19488506324621013, 'bull_time_stop': 229, 'bull_use_sma': False, 'bull_use_ema': True, 'bull_use_atr': True, 'bull_use_adx': False, 'bull_use_spike': False, 'bull_rsi_required': False, 'bear_strategy': 'breakout', 'bear_bb_std_mult': 1.2358311768708299, 'bear_rsi_os': 36, 'bear_rsi_ob': 53, 'bear_adx_thresh': 5.055996111810101, 'bear_atr_min_pct': 0.013961285269478369, 'bear_atr_max_pct': 0.08179493078949854, 'bear_tp_mult': 2.0554820302053276, 'bear_tsl_mult': 0.19007663811759024, 'bear_time_stop': 256, 'bear_use_sma': False, 'bear_use_ema': True, 'bear_use_atr': True, 'bear_use_adx': False, 'bear_use_spike': True, 'bear_rsi_required': False, 'sideways_strategy': 'breakout', 'sideways_bb_std_mult': 2.281578109928361, 'sideways_rsi_os': 35, 'sideways_rsi_ob': 61, 'sideways_adx_thresh': 29.20947840051339, 'sideways_atr_min_pct': 0.004645216403766557, 'sideways_atr_max_pct': 0.040319153423919035, 'sideways_tp_mult': 1.725361430322767, 'sideways_tsl_mult': 0.29761947468474215, 'sideways_time_stop': 212, 'sideways_use_sma': True, 'sideways_use_ema': False, 'sideways_use_atr': True, 'sideways_use_adx': True, 'sideways_use_spike': False, 'sideways_rsi_required': True}.
[I 2025-08-31 11:34:16,239] Trial 303 finished with values: [-1000000000.0, 1000000000.0] and parameters: {'p_sma': 33, 'p_std': 18, 'p_atr': 14, 'p_adx': 13, 'rsi_period': 80, 'ema1': 19, 'ema2': 37, 'slip_atr_k': 0.21433734556623177, 'slip_spread_k': 0.04934583537973656, 'spread_hl_frac': 0.0031966330107807634, 'bb_std_mult': 0.7850263424353692, 'rsi_os': 34, 'rsi_ob': 69, 'vol_spike': 0.10658514560433002, 'adx_thresh': 7.095398909001114, 'atr_min_pct': 0.01922219483242537, 'atr_max_pct': 0.1259755785056284, 'tp_mult': 1.1026099517684989, 'tsl_mult': 0.8998883387063625, 'strategy': 'breakout', 'time_stop': 293, 'use_sma': False, 'use_atr': True, 'use_adx': True, 'use_ema': True, 'use_spike': True, 'rsi_required': False, 'edge_k': 1.639393884210186, 'edge_cap': 0.7212590620166504, 'bull_strategy': 'breakout', 'bull_bb_std_mult': 1.774348275661891, 'bull_rsi_os': 13, 'bull_rsi_ob': 80, 'bull_adx_thresh': 27.822895824126444, 'bull_atr_min_pct': 0.003959952033126326, 'bull_atr_max_pct': 0.13503477210850626, 'bull_tp_mult': 2.850457612351413, 'bull_tsl_mult': 0.23433448794610773, 'bull_time_stop': 207, 'bull_use_sma': False, 'bull_use_ema': True, 'bull_use_atr': True, 'bull_use_adx': True, 'bull_use_spike': True, 'bull_rsi_required': False, 'bear_strategy': 'mean_reversion', 'bear_bb_std_mult': 1.1966216503879004, 'bear_rsi_os': 33, 'bear_rsi_ob': 49, 'bear_adx_thresh': 29.33443492541071, 'bear_atr_min_pct': 0.013825990418356159, 'bear_atr_max_pct': 0.05722099405787266, 'bear_tp_mult': 2.588610485526704, 'bear_tsl_mult': 0.8947092534151324, 'bear_time_stop': 257, 'bear_use_sma': False, 'bear_use_ema': True, 'bear_use_atr': False, 'bear_use_adx': True, 'bear_use_spike': False, 'bear_rsi_required': True, 'sideways_strategy': 'breakout', 'sideways_bb_std_mult': 3.1510306212615324, 'sideways_rsi_os': 6, 'sideways_rsi_ob': 61, 'sideways_adx_thresh': 8.751252530755927, 'sideways_atr_min_pct': 0.004534272296790752, 'sideways_atr_max_pct': 0.07793972959528114, 'sideways_tp_mult': 1.7315828128574733, 'sideways_tsl_mult': 0.24664322650755205, 'sideways_time_stop': 213, 'sideways_use_sma': True, 'sideways_use_ema': False, 'sideways_use_atr': True, 'sideways_use_adx': True, 'sideways_use_spike': False, 'sideways_rsi_required': True}.
[I 2025-08-31 11:34:16,305] Trial 302 finished with values: [-1000000000.0, 1000000000.0] and parameters: {'p_sma': 34, 'p_std': 18, 'p_atr': 14, 'p_adx': 10, 'rsi_period': 49, 'ema1': 21, 'ema2': 46, 'slip_atr_k': 0.041308275636273935, 'slip_spread_k': 0.051962995433475156, 'spread_hl_frac': 0.003009054136568667, 'bb_std_mult': 3.4887843419246005, 'rsi_os': 55, 'rsi_ob': 73, 'vol_spike': 0.2571952158794028, 'adx_thresh': 17.447010830789157, 'atr_min_pct': 0.00548551105236721, 'atr_max_pct': 0.012875384636724998, 'tp_mult': 1.8752930141359578, 'tsl_mult': 0.9868397425769666, 'strategy': 'breakout', 'time_stop': 291, 'use_sma': False, 'use_atr': True, 'use_adx': True, 'use_ema': True, 'use_spike': True, 'rsi_required': False, 'edge_k': 0.5220150450438636, 'edge_cap': 0.7201017218172746, 'bull_strategy': 'breakout', 'bull_bb_std_mult': 2.4039754984363504, 'bull_rsi_os': 26, 'bull_rsi_ob': 71, 'bull_adx_thresh': 21.097127481358562, 'bull_atr_min_pct': 0.004769156200912136, 'bull_atr_max_pct': 0.13469551521604622, 'bull_tp_mult': 1.472233429048397, 'bull_tsl_mult': 0.619928035306563, 'bull_time_stop': 205, 'bull_use_sma': False, 'bull_use_ema': True, 'bull_use_atr': True, 'bull_use_adx': True, 'bull_use_spike': True, 'bull_rsi_required': False, 'bear_strategy': 'mean_reversion', 'bear_bb_std_mult': 1.1982624447176689, 'bear_rsi_os': 32, 'bear_rsi_ob': 50, 'bear_adx_thresh': 22.368512910473637, 'bear_atr_min_pct': 0.014909433262556743, 'bear_atr_max_pct': 0.03510500722126468, 'bear_tp_mult': 1.976022578328597, 'bear_tsl_mult': 0.33024152414232577, 'bear_time_stop': 153, 'bear_use_sma': False, 'bear_use_ema': True, 'bear_use_atr': False, 'bear_use_adx': True, 'bear_use_spike': False, 'bear_rsi_required': True, 'sideways_strategy': 'breakout', 'sideways_bb_std_mult': 3.5968090427453516, 'sideways_rsi_os': 31, 'sideways_rsi_ob': 74, 'sideways_adx_thresh': 8.922697263524212, 'sideways_atr_min_pct': 0.004621636148831604, 'sideways_atr_max_pct': 0.07826976203735123, 'sideways_tp_mult': 1.962410543739628, 'sideways_tsl_mult': 0.23877839576667043, 'sideways_time_stop': 18, 'sideways_use_sma': True, 'sideways_use_ema': False, 'sideways_use_atr': True, 'sideways_use_adx': True, 'sideways_use_spike': False, 'sideways_rsi_required': True}.
[I 2025-08-31 11:34:16,676] Trial 305 finished with values: [-1000000000.0, 1000000000.0] and parameters: {'p_sma': 33, 'p_std': 14, 'p_atr': 14, 'p_adx': 13, 'rsi_period': 52, 'ema1': 21, 'ema2': 32, 'slip_atr_k': 0.07710660067805616, 'slip_spread_k': 0.04374327489897465, 'spread_hl_frac': 0.03204614883212828, 'bb_std_mult': 3.46263399101945, 'rsi_os': 32, 'rsi_ob': 47, 'vol_spike': 0.037600452281823196, 'adx_thresh': 25.396647016714216, 'atr_min_pct': 0.02523202115850512, 'atr_max_pct': 0.015335392691018574, 'tp_mult': 1.5704725861023738, 'tsl_mult': 0.2513133681430133, 'strategy': 'breakout', 'time_stop': 300, 'use_sma': False, 'use_atr': True, 'use_adx': True, 'use_ema': False, 'use_spike': True, 'rsi_required': True, 'edge_k': 1.1466706357957892, 'edge_cap': 0.8278592217433494, 'bull_strategy': 'breakout', 'bull_bb_std_mult': 2.603866658065281, 'bull_rsi_os': 43, 'bull_rsi_ob': 63, 'bull_adx_thresh': 14.91431098566069, 'bull_atr_min_pct': 0.00400026381134276, 'bull_atr_max_pct': 0.1340918216242705, 'bull_tp_mult': 2.9984485710454587, 'bull_tsl_mult': 0.6251803280259569, 'bull_time_stop': 137, 'bull_use_sma': False, 'bull_use_ema': True, 'bull_use_atr': True, 'bull_use_adx': True, 'bull_use_spike': False, 'bull_rsi_required': False, 'bear_strategy': 'breakout', 'bear_bb_std_mult': 2.9096495022589615, 'bear_rsi_os': 37, 'bear_rsi_ob': 85, 'bear_adx_thresh': 25.723861606243073, 'bear_atr_min_pct': 0.016930416056806757, 'bear_atr_max_pct': 0.11494340039939402, 'bear_tp_mult': 2.6420732963459987, 'bear_tsl_mult': 0.33010941102512836, 'bear_time_stop': 258, 'bear_use_sma': False, 'bear_use_ema': True, 'bear_use_atr': True, 'bear_use_adx': False, 'bear_use_spike': True, 'bear_rsi_required': False, 'sideways_strategy': 'breakout', 'sideways_bb_std_mult': 3.5927218810265247, 'sideways_rsi_os': 22, 'sideways_rsi_ob': 77, 'sideways_adx_thresh': 9.105817871600827, 'sideways_atr_min_pct': 0.004530132194016355, 'sideways_atr_max_pct': 0.049988287105128947, 'sideways_tp_mult': 1.2523053867106162, 'sideways_tsl_mult': 0.3914846013646803, 'sideways_time_stop': 176, 'sideways_use_sma': True, 'sideways_use_ema': False, 'sideways_use_atr': True, 'sideways_use_adx': True, 'sideways_use_spike': False, 'sideways_rsi_required': True}.
