[I 2025-08-31 11:31:00,742] Trial 270 finished with values: [-1000000000.0, 1000000000.0] and parameters: {'p_sma': 33, 'p_std': 29, 'p_atr': 16, 'p_adx': 29, 'rsi_period': 53, 'ema1': 13, 'ema2': 48, 'slip_atr_k': 0.05514355115080815, 'slip_spread_k': 0.1388016816149523, 'spread_hl_frac': 0.003752063149340702, 'bb_std_mult': 0.5503641576775999, 'rsi_os': 35, 'rsi_ob': 59, 'vol_spike': 0.1538813407047481, 'adx_thresh': 25.788060478496032, 'atr_min_pct': 0.005125345835725174, 'atr_max_pct': 0.02528336410945807, 'tp_mult': 1.6380409801905975, 'tsl_mult': 0.3240902281885807, 'strategy': 'breakout', 'time_stop': 75, 'use_sma': False, 'use_atr': False, 'use_adx': True, 'use_ema': False, 'use_spike': True, 'rsi_required': False, 'edge_k': 0.37420962689059295, 'edge_cap': 0.8417071143046033, 'bull_strategy': 'breakout', 'bull_bb_std_mult': 2.0611613520918137, 'bull_rsi_os': 24, 'bull_rsi_ob': 65, 'bull_adx_thresh': 14.577166971339848, 'bull_atr_min_pct': 0.002818687009642458, 'bull_atr_max_pct': 0.1477654239423133, 'bull_tp_mult': 1.526558159158243, 'bull_tsl_mult': 0.2649065405143956, 'bull_time_stop': 148, 'bull_use_sma': True, 'bull_use_ema': True, 'bull_use_atr': True, 'bull_use_adx': True, 'bull_use_spike': True, 'bull_rsi_required': False, 'bear_strategy': 'breakout', 'bear_bb_std_mult': 1.0100329660774157, 'bear_rsi_os': 34, 'bear_rsi_ob': 55, 'bear_adx_thresh': 21.382200364706005, 'bear_atr_min_pct': 0.013675542839103017, 'bear_atr_max_pct': 0.12526656889985194, 'bear_tp_mult': 2.6207290695990104, 'bear_tsl_mult': 0.39204440413461006, 'bear_time_stop': 181, 'bear_use_sma': False, 'bear_use_ema': True, 'bear_use_atr': False, 'bear_use_adx': True, 'bear_use_spike': False, 'bear_rsi_required': False, 'sideways_strategy': 'mean_reversion', 'sideways_bb_std_mult': 1.8483008473799474, 'sideways_rsi_os': 45, 'sideways_rsi_ob': 74, 'sideways_adx_thresh': 31.983390785768716, 'sideways_atr_min_pct': 0.0027664277874229096, 'sideways_atr_max_pct': 0.04175197659611568, 'sideways_tp_mult': 1.2861039065585582, 'sideways_tsl_mult': 0.3659657956571255, 'sideways_time_stop': 10, 'sideways_use_sma': True, 'sideways_use_ema': True, 'sideways_use_atr': True, 'sideways_use_adx': False, 'sideways_use_spike': True, 'sideways_rsi_required': True}.
[I 2025-08-31 11:31:01,506] Trial 272 finished with values: [-1000000000.0, 1000000000.0] and parameters: {'p_sma': 35, 'p_std': 26, 'p_atr': 10, 'p_adx': 29, 'rsi_period': 48, 'ema1': 28, 'ema2': 44, 'slip_atr_k': 0.004948931787593688, 'slip_spread_k': 0.09552340701621978, 'spread_hl_frac': 0.0061470628315031745, 'bb_std_mult': 0.6569575651207676, 'rsi_os': 52, 'rsi_ob': 74, 'vol_spike': 0.11918420610794943, 'adx_thresh': 25.695018314421393, 'atr_min_pct': 0.00476734706742185, 'atr_max_pct': 0.02535176072405437, 'tp_mult': 1.101620701847327, 'tsl_mult': 0.3178549892737423, 'strategy': 'mean_reversion', 'time_stop': 210, 'use_sma': False, 'use_atr': False, 'use_adx': True, 'use_ema': False, 'use_spike': True, 'rsi_required': False, 'edge_k': 0.5578259943820891, 'edge_cap': 0.8355758981893028, 'bull_strategy': 'breakout', 'bull_bb_std_mult': 2.570305269550904, 'bull_rsi_os': 12, 'bull_rsi_ob': 63, 'bull_adx_thresh': 14.529432586094284, 'bull_atr_min_pct': 0.0074107143315619555, 'bull_atr_max_pct': 0.14395853012376958, 'bull_tp_mult': 1.262379256599778, 'bull_tsl_mult': 0.24182018166752225, 'bull_time_stop': 150, 'bull_use_sma': True, 'bull_use_ema': True, 'bull_use_atr': False, 'bull_use_adx': True, 'bull_use_spike': True, 'bull_rsi_required': False, 'bear_strategy': 'mean_reversion', 'bear_bb_std_mult': 1.0212225846740695, 'bear_rsi_os': 34, 'bear_rsi_ob': 54, 'bear_adx_thresh': 19.18931181910696, 'bear_atr_min_pct': 0.015862349192000087, 'bear_atr_max_pct': 0.11050713396942685, 'bear_tp_mult': 2.613921468769522, 'bear_tsl_mult': 0.41002516033611064, 'bear_time_stop': 182, 'bear_use_sma': False, 'bear_use_ema': True, 'bear_use_atr': False, 'bear_use_adx': True, 'bear_use_spike': False, 'bear_rsi_required': False, 'sideways_strategy': 'mean_reversion', 'sideways_bb_std_mult': 2.7046798862108945, 'sideways_rsi_os': 20, 'sideways_rsi_ob': 74, 'sideways_adx_thresh': 24.580973506834958, 'sideways_atr_min_pct': 0.0028290648761337064, 'sideways_atr_max_pct': 0.04581485137610687, 'sideways_tp_mult': 1.277494416128838, 'sideways_tsl_mult': 0.35397800023196113, 'sideways_time_stop': 283, 'sideways_use_sma': True, 'sideways_use_ema': True, 'sideways_use_atr': True, 'sideways_use_adx': False, 'sideways_use_spike': True, 'sideways_rsi_required': True}.
[I 2025-08-31 11:31:01,525] Trial 273 finished with values: [-1000000000.0, 1000000000.0] and parameters: {'p_sma': 35, 'p_std': 27, 'p_atr': 10, 'p_adx': 29, 'rsi_period': 77, 'ema1': 26, 'ema2': 44, 'slip_atr_k': 0.17259849722547743, 'slip_spread_k': 0.09414726334836887, 'spread_hl_frac': 0.005777653139781604, 'bb_std_mult': 0.6878956565903692, 'rsi_os': 36, 'rsi_ob': 48, 'vol_spike': 0.17580793077375134, 'adx_thresh': 25.370816596218564, 'atr_min_pct': 0.004896217911190546, 'atr_max_pct': 0.025411423644490443, 'tp_mult': 1.7408419161111528, 'tsl_mult': 0.3023018245442393, 'strategy': 'mean_reversion', 'time_stop': 294, 'use_sma': False, 'use_atr': False, 'use_adx': True, 'use_ema': False, 'use_spike': True, 'rsi_required': False, 'edge_k': 0.5721556950546242, 'edge_cap': 0.7767253213786109, 'bull_strategy': 'breakout', 'bull_bb_std_mult': 2.6532841209982174, 'bull_rsi_os': 45, 'bull_rsi_ob': 63, 'bull_adx_thresh': 14.645142552023355, 'bull_atr_min_pct': 0.004994502584031649, 'bull_atr_max_pct': 0.14668703986775333, 'bull_tp_mult': 1.532878793875975, 'bull_tsl_mult': 0.4696182159483155, 'bull_time_stop': 194, 'bull_use_sma': True, 'bull_use_ema': True, 'bull_use_atr': False, 'bull_use_adx': True, 'bull_use_spike': True, 'bull_rsi_required': False, 'bear_strategy': 'mean_reversion', 'bear_bb_std_mult': 1.0170420713461816, 'bear_rsi_os': 32, 'bear_rsi_ob': 55, 'bear_adx_thresh': 21.22270103280356, 'bear_atr_min_pct': 0.015801644742230062, 'bear_atr_max_pct': 0.1257556272215334, 'bear_tp_mult': 2.6509621416403144, 'bear_tsl_mult': 0.43499952266900743, 'bear_time_stop': 243, 'bear_use_sma': False, 'bear_use_ema': True, 'bear_use_atr': False, 'bear_use_adx': True, 'bear_use_spike': False, 'bear_rsi_required': False, 'sideways_strategy': 'mean_reversion', 'sideways_bb_std_mult': 1.8715084526495747, 'sideways_rsi_os': 27, 'sideways_rsi_ob': 63, 'sideways_adx_thresh': 24.60195817452633, 'sideways_atr_min_pct': 0.004563275817391423, 'sideways_atr_max_pct': 0.045944900623073874, 'sideways_tp_mult': 1.4501832702197734, 'sideways_tsl_mult': 0.30585034925382865, 'sideways_time_stop': 203, 'sideways_use_sma': True, 'sideways_use_ema': True, 'sideways_use_atr': True, 'sideways_use_adx': False, 'sideways_use_spike': True, 'sideways_rsi_required': True}.
[I 2025-08-31 11:31:01,539] Trial 274 finished with values: [-1000000000.0, 1000000000.0] and parameters: {'p_sma': 35, 'p_std': 26, 'p_atr': 30, 'p_adx': 30, 'rsi_period': 48, 'ema1': 13, 'ema2': 34, 'slip_atr_k': 0.1389654078505159, 'slip_spread_k': 0.07799529949893579, 'spread_hl_frac': 0.00574465692851516, 'bb_std_mult': 0.6493660202232794, 'rsi_os': 52, 'rsi_ob': 72, 'vol_spike': 0.17927702198759055, 'adx_thresh': 24.92408954525028, 'atr_min_pct': 0.029946206421334824, 'atr_max_pct': 0.032786294190456235, 'tp_mult': 2.9954647050974827, 'tsl_mult': 0.2898046530456737, 'strategy': 'mean_reversion', 'time_stop': 205, 'use_sma': False, 'use_atr': False, 'use_adx': True, 'use_ema': False, 'use_spike': True, 'rsi_required': False, 'edge_k': 0.3001775340500126, 'edge_cap': 0.05098634446436778, 'bull_strategy': 'breakout', 'bull_bb_std_mult': 2.630808358562507, 'bull_rsi_os': 21, 'bull_rsi_ob': 86, 'bull_adx_thresh': 14.367433492131259, 'bull_atr_min_pct': 0.004747910061506605, 'bull_atr_max_pct': 0.14054925253086523, 'bull_tp_mult': 1.3426022012468504, 'bull_tsl_mult': 0.2388943149115845, 'bull_time_stop': 89, 'bull_use_sma': True, 'bull_use_ema': True, 'bull_use_atr': False, 'bull_use_adx': True, 'bull_use_spike': True, 'bull_rsi_required': False, 'bear_strategy': 'mean_reversion', 'bear_bb_std_mult': 1.1421432294766631, 'bear_rsi_os': 32, 'bear_rsi_ob': 53, 'bear_adx_thresh': 7.0055637914471784, 'bear_atr_min_pct': 0.015470699324572814, 'bear_atr_max_pct': 0.1208757501264793, 'bear_tp_mult': 2.6649300535028293, 'bear_tsl_mult': 0.8099271833288604, 'bear_time_stop': 143, 'bear_use_sma': False, 'bear_use_ema': True, 'bear_use_atr': False, 'bear_use_adx': False, 'bear_use_spike': False, 'bear_rsi_required': True, 'sideways_strategy': 'breakout', 'sideways_bb_std_mult': 1.8942973981323121, 'sideways_rsi_os': 54, 'sideways_rsi_ob': 63, 'sideways_adx_thresh': 30.24105942848469, 'sideways_atr_min_pct': 0.023354104290770214, 'sideways_atr_max_pct': 0.046629460798622395, 'sideways_tp_mult': 1.3797630682792712, 'sideways_tsl_mult': 0.3137104423339826, 'sideways_time_stop': 132, 'sideways_use_sma': True, 'sideways_use_ema': True, 'sideways_use_atr': True, 'sideways_use_adx': False, 'sideways_use_spike': False, 'sideways_rsi_required': False}.
[I 2025-08-31 11:31:02,327] Trial 275 finished with values: [-1000000000.0, 1000000000.0] and parameters: {'p_sma': 37, 'p_std': 44, 'p_atr': 29, 'p_adx': 30, 'rsi_period': 51, 'ema1': 12, 'ema2': 29, 'slip_atr_k': 0.09091467261336236, 'slip_spread_k': 0.07780003322156143, 'spread_hl_frac': 0.007855729431194596, 'bb_std_mult': 0.8328559994044612, 'rsi_os': 33, 'rsi_ob': 72, 'vol_spike': 0.16891942703506752, 'adx_thresh': 25.208124643290578, 'atr_min_pct': 0.026105367484563807, 'atr_max_pct': 0.021206957137350962, 'tp_mult': 1.0464061837842284, 'tsl_mult': 0.2654704968126511, 'strategy': 'mean_reversion', 'time_stop': 295, 'use_sma': False, 'use_atr': True, 'use_adx': True, 'use_ema': False, 'use_spike': True, 'rsi_required': True, 'edge_k': 1.4079161168443675, 'edge_cap': 0.7744743562390799, 'bull_strategy': 'breakout', 'bull_bb_std_mult': 2.6504087226133035, 'bull_rsi_os': 42, 'bull_rsi_ob': 66, 'bull_adx_thresh': 32.06644548923424, 'bull_atr_min_pct': 0.00495678674894456, 'bull_atr_max_pct': 0.14048157623228347, 'bull_tp_mult': 1.101105107755064, 'bull_tsl_mult': 0.1811235630229927, 'bull_time_stop': 193, 'bull_use_sma': True, 'bull_use_ema': True, 'bull_use_atr': False, 'bull_use_adx': True, 'bull_use_spike': False, 'bull_rsi_required': True, 'bear_strategy': 'mean_reversion', 'bear_bb_std_mult': 1.1351608085429257, 'bear_rsi_os': 30, 'bear_rsi_ob': 90, 'bear_adx_thresh': 20.404680485254904, 'bear_atr_min_pct': 0.01444660560199863, 'bear_atr_max_pct': 0.0732810834903404, 'bear_tp_mult': 2.6732245260970977, 'bear_tsl_mult': 0.43878671616751264, 'bear_time_stop': 264, 'bear_use_sma': False, 'bear_use_ema': True, 'bear_use_atr': True, 'bear_use_adx': False, 'bear_use_spike': True, 'bear_rsi_required': True, 'sideways_strategy': 'breakout', 'sideways_bb_std_mult': 1.894521730995122, 'sideways_rsi_os': 50, 'sideways_rsi_ob': 63, 'sideways_adx_thresh': 18.88050512578676, 'sideways_atr_min_pct': 0.017413266585975834, 'sideways_atr_max_pct': 0.04787165065563994, 'sideways_tp_mult': 1.389403685530182, 'sideways_tsl_mult': 0.30929749496544673, 'sideways_time_stop': 276, 'sideways_use_sma': True, 'sideways_use_ema': False, 'sideways_use_atr': True, 'sideways_use_adx': True, 'sideways_use_spike': False, 'sideways_rsi_required': False}.
[I 2025-08-31 11:31:27,213] Trial 271 finished with values: [-1000000000.0, 1000000000.0] and parameters: {'p_sma': 34, 'p_std': 30, 'p_atr': 30, 'p_adx': 29, 'rsi_period': 53, 'ema1': 13, 'ema2': 57, 'slip_atr_k': 0.055535415944695306, 'slip_spread_k': 0.0975271199545503, 'spread_hl_frac': 0.006188797453064153, 'bb_std_mult': 0.5134355874650484, 'rsi_os': 46, 'rsi_ob': 74, 'vol_spike': 0.15153095104727302, 'adx_thresh': 25.73287786888747, 'atr_min_pct': 0.0050331642239857585, 'atr_max_pct': 0.03458549276290568, 'tp_mult': 2.7029642637810105, 'tsl_mult': 0.2651496394384718, 'strategy': 'mean_reversion', 'time_stop': 208, 'use_sma': False, 'use_atr': False, 'use_adx': True, 'use_ema': False, 'use_spike': True, 'rsi_required': False, 'edge_k': 0.33939648399453387, 'edge_cap': 0.8399876108440719, 'bull_strategy': 'breakout', 'bull_bb_std_mult': 2.00945606268663, 'bull_rsi_os': 53, 'bull_rsi_ob': 85, 'bull_adx_thresh': 14.722508794166187, 'bull_atr_min_pct': 0.005237888338812811, 'bull_atr_max_pct': 0.12909551633074806, 'bull_tp_mult': 1.5261346397010487, 'bull_tsl_mult': 0.2611196862265347, 'bull_time_stop': 149, 'bull_use_sma': True, 'bull_use_ema': True, 'bull_use_atr': False, 'bull_use_adx': True, 'bull_use_spike': True, 'bull_rsi_required': False, 'bear_strategy': 'mean_reversion', 'bear_bb_std_mult': 1.0144698783116537, 'bear_rsi_os': 34, 'bear_rsi_ob': 80, 'bear_adx_thresh': 18.947636825839716, 'bear_atr_min_pct': 0.015498897235455802, 'bear_atr_max_pct': 0.05003951902318467, 'bear_tp_mult': 1.6404073956971283, 'bear_tsl_mult': 0.43733978909510096, 'bear_time_stop': 145, 'bear_use_sma': False, 'bear_use_ema': True, 'bear_use_atr': False, 'bear_use_adx': True, 'bear_use_spike': False, 'bear_rsi_required': False, 'sideways_strategy': 'mean_reversion', 'sideways_bb_std_mult': 1.8730520535985722, 'sideways_rsi_os': 20, 'sideways_rsi_ob': 63, 'sideways_adx_thresh': 24.887156829329054, 'sideways_atr_min_pct': 0.002918059049309452, 'sideways_atr_max_pct': 0.04207496913071496, 'sideways_tp_mult': 1.2714336905083745, 'sideways_tsl_mult': 0.3802555087838896, 'sideways_time_stop': 242, 'sideways_use_sma': True, 'sideways_use_ema': True, 'sideways_use_atr': True, 'sideways_use_adx': False, 'sideways_use_spike': True, 'sideways_rsi_required': False}.
[I 2025-08-31 11:31:33,472] Trial 277 finished with values: [-0.018167086959547163, 0.01793582174167701] and parameters: {'p_sma': 24, 'p_std': 17, 'p_atr': 12, 'p_adx': 24, 'rsi_period': 62, 'ema1': 12, 'ema2': 28, 'slip_atr_k': 0.09710261883591413, 'slip_spread_k': 0.12613678457275004, 'spread_hl_frac': 0.007864353979666755, 'bb_std_mult': 0.8410092369616058, 'rsi_os': 35, 'rsi_ob': 64, 'vol_spike': 0.1110415032226129, 'adx_thresh': 26.17579020038029, 'atr_min_pct': 0.004490054414622304, 'atr_max_pct': 0.020973622183017054, 'tp_mult': 1.047499689971959, 'tsl_mult': 0.26140716921842977, 'strategy': 'breakout', 'time_stop': 147, 'use_sma': True, 'use_atr': True, 'use_adx': False, 'use_ema': False, 'use_spike': True, 'rsi_required': True, 'edge_k': 0.5073130298647313, 'edge_cap': 0.10930230493439214, 'bull_strategy': 'mean_reversion', 'bull_bb_std_mult': 2.8108866886865362, 'bull_rsi_os': 22, 'bull_rsi_ob': 54, 'bull_adx_thresh': 13.394567580514007, 'bull_atr_min_pct': 0.0036875574416686506, 'bull_atr_max_pct': 0.1405202676891934, 'bull_tp_mult': 1.4127498350276284, 'bull_tsl_mult': 0.1850200678510549, 'bull_time_stop': 166, 'bull_use_sma': False, 'bull_use_ema': True, 'bull_use_atr': True, 'bull_use_adx': False, 'bull_use_spike': False, 'bull_rsi_required': True, 'bear_strategy': 'breakout', 'bear_bb_std_mult': 1.1330112616754222, 'bear_rsi_os': 30, 'bear_rsi_ob': 54, 'bear_adx_thresh': 31.85825061800759, 'bear_atr_min_pct': 0.015013600442602222, 'bear_atr_max_pct': 0.11712616160492914, 'bear_tp_mult': 1.661435526841621, 'bear_tsl_mult': 0.9398283447874796, 'bear_time_stop': 133, 'bear_use_sma': False, 'bear_use_ema': True, 'bear_use_atr': True, 'bear_use_adx': False, 'bear_use_spike': True, 'bear_rsi_required': False, 'sideways_strategy': 'breakout', 'sideways_bb_std_mult': 3.279056756378117, 'sideways_rsi_os': 34, 'sideways_rsi_ob': 72, 'sideways_adx_thresh': 20.505007142318988, 'sideways_atr_min_pct': 0.0021399591595761777, 'sideways_atr_max_pct': 0.050153855150971254, 'sideways_tp_mult': 1.3861560867393121, 'sideways_tsl_mult': 0.40574434330384523, 'sideways_time_stop': 5, 'sideways_use_sma': True, 'sideways_use_ema': False, 'sideways_use_atr': True, 'sideways_use_adx': True, 'sideways_use_spike': False, 'sideways_rsi_required': True}.
[I 2025-08-31 11:31:34,005] Trial 276 finished with values: [-1000000000.0, 1000000000.0] and parameters: {'p_sma': 37, 'p_std': 18, 'p_atr': 30, 'p_adx': 30, 'rsi_period': 17, 'ema1': 12, 'ema2': 29, 'slip_atr_k': 0.039140797560455076, 'slip_spread_k': 0.0797995529337169, 'spread_hl_frac': 0.00764208073228847, 'bb_std_mult': 3.3544419319546783, 'rsi_os': 33, 'rsi_ob': 72, 'vol_spike': 0.11039823971282783, 'adx_thresh': 24.91474623534045, 'atr_min_pct': 0.0036623470181958093, 'atr_max_pct': 0.03445131044332527, 'tp_mult': 1.501438482300916, 'tsl_mult': 0.2706146057555257, 'strategy': 'breakout', 'time_stop': 202, 'use_sma': False, 'use_atr': True, 'use_adx': True, 'use_ema': False, 'use_spike': True, 'rsi_required': True, 'edge_k': 0.5003512427518237, 'edge_cap': 0.873573196031234, 'bull_strategy': 'breakout', 'bull_bb_std_mult': 2.7997364188137817, 'bull_rsi_os': 22, 'bull_rsi_ob': 66, 'bull_adx_thresh': 15.303177151822563, 'bull_atr_min_pct': 0.0036232310930219697, 'bull_atr_max_pct': 0.14068298251109485, 'bull_tp_mult': 1.1021238261640738, 'bull_tsl_mult': 0.18088492108349835, 'bull_time_stop': 143, 'bull_use_sma': True, 'bull_use_ema': True, 'bull_use_atr': True, 'bull_use_adx': False, 'bull_use_spike': False, 'bull_rsi_required': True, 'bear_strategy': 'breakout', 'bear_bb_std_mult': 1.1703920802748502, 'bear_rsi_os': 30, 'bear_rsi_ob': 77, 'bear_adx_thresh': 20.254711121451333, 'bear_atr_min_pct': 0.015113853935286798, 'bear_atr_max_pct': 0.04987829394548958, 'bear_tp_mult': 1.6570464065793409, 'bear_tsl_mult': 0.9466764460227667, 'bear_time_stop': 141, 'bear_use_sma': False, 'bear_use_ema': True, 'bear_use_atr': True, 'bear_use_adx': False, 'bear_use_spike': True, 'bear_rsi_required': True, 'sideways_strategy': 'breakout', 'sideways_bb_std_mult': 2.0959977917848733, 'sideways_rsi_os': 34, 'sideways_rsi_ob': 72, 'sideways_adx_thresh': 31.12859527100526, 'sideways_atr_min_pct': 0.025469057341413255, 'sideways_atr_max_pct': 0.04875684648291481, 'sideways_tp_mult': 1.3623754512766737, 'sideways_tsl_mult': 0.3112501514852611, 'sideways_time_stop': 240, 'sideways_use_sma': True, 'sideways_use_ema': False, 'sideways_use_atr': True, 'sideways_use_adx': True, 'sideways_use_spike': False, 'sideways_rsi_required': False}.
[I 2025-08-31 11:31:36,362] Trial 278 finished with values: [-0.012559527472055021, 0.013563698873111468] and parameters: {'p_sma': 24, 'p_std': 32, 'p_atr': 28, 'p_adx': 22, 'rsi_period': 46, 'ema1': 24, 'ema2': 47, 'slip_atr_k': 0.039259430905089876, 'slip_spread_k': 0.1294261660530413, 'spread_hl_frac': 0.004779509212642958, 'bb_std_mult': 0.8246769009242437, 'rsi_os': 34, 'rsi_ob': 71, 'vol_spike': 0.11125127557067585, 'adx_thresh': 26.360418064477784, 'atr_min_pct': 0.02405538985258642, 'atr_max_pct': 0.12627527961970386, 'tp_mult': 1.5018381840867283, 'tsl_mult': 0.26029259422111506, 'strategy': 'breakout', 'time_stop': 144, 'use_sma': True, 'use_atr': True, 'use_adx': False, 'use_ema': False, 'use_spike': True, 'rsi_required': True, 'edge_k': 0.495766644998528, 'edge_cap': 0.10644441154440076, 'bull_strategy': 'mean_reversion', 'bull_bb_std_mult': 2.7907199736349084, 'bull_rsi_os': 23, 'bull_rsi_ob': 54, 'bull_adx_thresh': 15.26264536530339, 'bull_atr_min_pct': 0.003632134912958567, 'bull_atr_max_pct': 0.13657133679437675, 'bull_tp_mult': 2.0523955471990525, 'bull_tsl_mult': 0.40568123832107406, 'bull_time_stop': 121, 'bull_use_sma': False, 'bull_use_ema': True, 'bull_use_atr': True, 'bull_use_adx': False, 'bull_use_spike': False, 'bull_rsi_required': True, 'bear_strategy': 'breakout', 'bear_bb_std_mult': 0.9765256701810554, 'bear_rsi_os': 36, 'bear_rsi_ob': 54, 'bear_adx_thresh': 31.7654207649775, 'bear_atr_min_pct': 0.015023780943512727, 'bear_atr_max_pct': 0.1171728292370909, 'bear_tp_mult': 2.71402234431718, 'bear_tsl_mult': 0.930979701985245, 'bear_time_stop': 222, 'bear_use_sma': False, 'bear_use_ema': True, 'bear_use_atr': True, 'bear_use_adx': False, 'bear_use_spike': True, 'bear_rsi_required': False, 'sideways_strategy': 'breakout', 'sideways_bb_std_mult': 0.5835054977292722, 'sideways_rsi_os': 34, 'sideways_rsi_ob': 72, 'sideways_adx_thresh': 9.177879783695158, 'sideways_atr_min_pct': 0.002169077314792444, 'sideways_atr_max_pct': 0.13949177780671682, 'sideways_tp_mult': 1.4843924509590076, 'sideways_tsl_mult': 0.4070312321722459, 'sideways_time_stop': 224, 'sideways_use_sma': True, 'sideways_use_ema': False, 'sideways_use_atr': True, 'sideways_use_adx': True, 'sideways_use_spike': False, 'sideways_rsi_required': True}.
