[I 2025-08-31 10:58:48,855] Trial 21 finished with values: [-1000000000.0, 1000000000.0] and parameters: {'p_sma': 41, 'p_std': 30, 'p_atr': 21, 'p_adx': 21, 'rsi_period': 36, 'ema1': 15, 'ema2': 25, 'slip_atr_k': 0.04206078026488985, 'slip_spread_k': 0.7489535904292088, 'spread_hl_frac': 0.03145745251014271, 'bb_std_mult': 1.1392658584277267, 'rsi_os': 5, 'rsi_ob': 79, 'vol_spike': 0.12688112617369535, 'adx_thresh': 8.938759529959249, 'atr_min_pct': 0.010653436491912131, 'atr_max_pct': 0.05647713259566091, 'tp_mult': 2.434124311905231, 'tsl_mult': 0.604291128361379, 'strategy': 'breakout', 'time_stop': 114, 'use_sma': False, 'use_atr': True, 'use_adx': True, 'use_ema': True, 'use_spike': False, 'rsi_required': False, 'edge_k': 1.9751358973910729, 'edge_cap': 0.5009830345296417, 'bull_strategy': 'breakout', 'bull_bb_std_mult': 1.1402164520607263, 'bull_rsi_os': 22, 'bull_rsi_ob': 64, 'bull_adx_thresh': 17.50239178901363, 'bull_atr_min_pct': 0.029840224031227304, 'bull_atr_max_pct': 0.10725128082712865, 'bull_tp_mult': 2.0206444822592786, 'bull_tsl_mult': 0.3421925571813169, 'bull_time_stop': 133, 'bull_use_sma': False, 'bull_use_ema': False, 'bull_use_atr': True, 'bull_use_adx': False, 'bull_use_spike': False, 'bull_rsi_required': False, 'bear_strategy': 'mean_reversion', 'bear_bb_std_mult': 1.249790614543778, 'bear_rsi_os': 55, 'bear_rsi_ob': 57, 'bear_adx_thresh': 12.126320396941345, 'bear_atr_min_pct': 0.029831148793477327, 'bear_atr_max_pct': 0.03296219707825896, 'bear_tp_mult': 1.3382278135786232, 'bear_tsl_mult': 0.8740944238632324, 'bear_time_stop': 80, 'bear_use_sma': False, 'bear_use_ema': False, 'bear_use_atr': False, 'bear_use_adx': False, 'bear_use_spike': False, 'bear_rsi_required': True, 'sideways_strategy': 'mean_reversion', 'sideways_bb_std_mult': 0.5626602845415751, 'sideways_rsi_os': 34, 'sideways_rsi_ob': 63, 'sideways_adx_thresh': 8.508240680688973, 'sideways_atr_min_pct': 0.005320983251209922, 'sideways_atr_max_pct': 0.08943833436275125, 'sideways_tp_mult': 2.6311650492011176, 'sideways_tsl_mult': 0.35053149832147323, 'sideways_time_stop': 65, 'sideways_use_sma': False, 'sideways_use_ema': False, 'sideways_use_atr': True, 'sideways_use_adx': True, 'sideways_use_spike': True, 'sideways_rsi_required': False}.
[I 2025-08-31 10:58:49,325] Trial 20 finished with values: [-1000000000.0, 1000000000.0] and parameters: {'p_sma': 42, 'p_std': 29, 'p_atr': 21, 'p_adx': 21, 'rsi_period': 30, 'ema1': 15, 'ema2': 52, 'slip_atr_k': 0.05348282664681499, 'slip_spread_k': 0.7914057779156665, 'spread_hl_frac': 0.03243393561385231, 'bb_std_mult': 2.2201585527008016, 'rsi_os': 12, 'rsi_ob': 87, 'vol_spike': 0.09542460691403098, 'adx_thresh': 9.925387047463525, 'atr_min_pct': 0.010037388824815176, 'atr_max_pct': 0.13027983701700319, 'tp_mult': 2.548252444469266, 'tsl_mult': 0.5991329321292488, 'strategy': 'breakout', 'time_stop': 182, 'use_sma': False, 'use_atr': True, 'use_adx': True, 'use_ema': True, 'use_spike': False, 'rsi_required': False, 'edge_k': 1.7971464105467176, 'edge_cap': 0.44994070660948515, 'bull_strategy': 'mean_reversion', 'bull_bb_std_mult': 2.6820274197322123, 'bull_rsi_os': 15, 'bull_rsi_ob': 62, 'bull_adx_thresh': 17.304397901061684, 'bull_atr_min_pct': 0.029836871693208884, 'bull_atr_max_pct': 0.1111402818486285, 'bull_tp_mult': 2.1155873001123826, 'bull_tsl_mult': 0.2515728967564561, 'bull_time_stop': 130, 'bull_use_sma': True, 'bull_use_ema': False, 'bull_use_atr': True, 'bull_use_adx': False, 'bull_use_spike': True, 'bull_rsi_required': True, 'bear_strategy': 'mean_reversion', 'bear_bb_std_mult': 0.5091523018044692, 'bear_rsi_os': 43, 'bear_rsi_ob': 76, 'bear_adx_thresh': 13.844649084637583, 'bear_atr_min_pct': 0.029398930359328605, 'bear_atr_max_pct': 0.04701000996346365, 'bear_tp_mult': 2.6182207402654925, 'bear_tsl_mult': 0.344628394725813, 'bear_time_stop': 82, 'bear_use_sma': False, 'bear_use_ema': False, 'bear_use_atr': False, 'bear_use_adx': True, 'bear_use_spike': False, 'bear_rsi_required': True, 'sideways_strategy': 'breakout', 'sideways_bb_std_mult': 0.504356269729042, 'sideways_rsi_os': 13, 'sideways_rsi_ob': 64, 'sideways_adx_thresh': 7.42793476200734, 'sideways_atr_min_pct': 0.0049774119572259775, 'sideways_atr_max_pct': 0.0872721213073605, 'sideways_tp_mult': 2.0050784819093974, 'sideways_tsl_mult': 0.38017639309981005, 'sideways_time_stop': 54, 'sideways_use_sma': True, 'sideways_use_ema': True, 'sideways_use_atr': True, 'sideways_use_adx': True, 'sideways_use_spike': True, 'sideways_rsi_required': True}.
[I 2025-08-31 10:58:49,774] Trial 18 finished with values: [-1000000000.0, 1000000000.0] and parameters: {'p_sma': 21, 'p_std': 35, 'p_atr': 21, 'p_adx': 21, 'rsi_period': 33, 'ema1': 5, 'ema2': 25, 'slip_atr_k': 0.058941421249999376, 'slip_spread_k': 0.594559823896048, 'spread_hl_frac': 0.04980135403144256, 'bb_std_mult': 2.019935385879725, 'rsi_os': 34, 'rsi_ob': 88, 'vol_spike': 0.24923128716909435, 'adx_thresh': 16.089928451403328, 'atr_min_pct': 0.0209972337882352, 'atr_max_pct': 0.06573219836735125, 'tp_mult': 1.5396404494293217, 'tsl_mult': 0.3611744147465084, 'strategy': 'breakout', 'time_stop': 202, 'use_sma': False, 'use_atr': True, 'use_adx': True, 'use_ema': True, 'use_spike': False, 'rsi_required': False, 'edge_k': 1.9992170343990143, 'edge_cap': 0.4090942389134177, 'bull_strategy': 'mean_reversion', 'bull_bb_std_mult': 0.5376030386904431, 'bull_rsi_os': 17, 'bull_rsi_ob': 89, 'bull_adx_thresh': 34.71706162964372, 'bull_atr_min_pct': 0.02098150397713413, 'bull_atr_max_pct': 0.11490852702134158, 'bull_tp_mult': 2.869848940418973, 'bull_tsl_mult': 0.25439342103453044, 'bull_time_stop': 105, 'bull_use_sma': True, 'bull_use_ema': True, 'bull_use_atr': True, 'bull_use_adx': False, 'bull_use_spike': True, 'bull_rsi_required': True, 'bear_strategy': 'mean_reversion', 'bear_bb_std_mult': 1.2550677780365385, 'bear_rsi_os': 20, 'bear_rsi_ob': 75, 'bear_adx_thresh': 25.109581885335317, 'bear_atr_min_pct': 0.020278299468727872, 'bear_atr_max_pct': 0.11003329531136172, 'bear_tp_mult': 2.6843813461912323, 'bear_tsl_mult': 0.32301824462780737, 'bear_time_stop': 63, 'bear_use_sma': False, 'bear_use_ema': False, 'bear_use_atr': False, 'bear_use_adx': True, 'bear_use_spike': False, 'bear_rsi_required': False, 'sideways_strategy': 'breakout', 'sideways_bb_std_mult': 1.8333678441266295, 'sideways_rsi_os': 20, 'sideways_rsi_ob': 72, 'sideways_adx_thresh': 8.34117112285336, 'sideways_atr_min_pct': 0.004198004532838195, 'sideways_atr_max_pct': 0.08489580577597211, 'sideways_tp_mult': 1.9807261967585652, 'sideways_tsl_mult': 0.36244293971473074, 'sideways_time_stop': 271, 'sideways_use_sma': True, 'sideways_use_ema': True, 'sideways_use_atr': True, 'sideways_use_adx': True, 'sideways_use_spike': False, 'sideways_rsi_required': True}.
[I 2025-08-31 10:58:50,022] Trial 19 finished with values: [-1000000000.0, 1000000000.0] and parameters: {'p_sma': 42, 'p_std': 31, 'p_atr': 21, 'p_adx': 21, 'rsi_period': 32, 'ema1': 8, 'ema2': 26, 'slip_atr_k': 0.0463920865796191, 'slip_spread_k': 0.805862043935329, 'spread_hl_frac': 0.04048932616543479, 'bb_std_mult': 1.9832451272563025, 'rsi_os': 35, 'rsi_ob': 85, 'vol_spike': 0.09160748508349159, 'adx_thresh': 18.16798219503209, 'atr_min_pct': 0.010522791500175772, 'atr_max_pct': 0.06231830003764664, 'tp_mult': 1.5540028818151148, 'tsl_mult': 0.6335829676088381, 'strategy': 'breakout', 'time_stop': 199, 'use_sma': False, 'use_atr': True, 'use_adx': True, 'use_ema': True, 'use_spike': False, 'rsi_required': False, 'edge_k': 1.1152271745306568, 'edge_cap': 0.43533125217528373, 'bull_strategy': 'mean_reversion', 'bull_bb_std_mult': 0.526655110753991, 'bull_rsi_os': 17, 'bull_rsi_ob': 88, 'bull_adx_thresh': 34.48677222557718, 'bull_atr_min_pct': 0.017247938016399983, 'bull_atr_max_pct': 0.10320435419572387, 'bull_tp_mult': 2.981955960099294, 'bull_tsl_mult': 0.2620096465610643, 'bull_time_stop': 111, 'bull_use_sma': True, 'bull_use_ema': True, 'bull_use_atr': True, 'bull_use_adx': False, 'bull_use_spike': True, 'bull_rsi_required': True, 'bear_strategy': 'mean_reversion', 'bear_bb_std_mult': 1.2881280601814173, 'bear_rsi_os': 55, 'bear_rsi_ob': 74, 'bear_adx_thresh': 13.367654365780025, 'bear_atr_min_pct': 0.01956680735559214, 'bear_atr_max_pct': 0.11299024471031746, 'bear_tp_mult': 2.615710553640138, 'bear_tsl_mult': 0.2404776999366231, 'bear_time_stop': 70, 'bear_use_sma': False, 'bear_use_ema': False, 'bear_use_atr': False, 'bear_use_adx': True, 'bear_use_spike': False, 'bear_rsi_required': True, 'sideways_strategy': 'breakout', 'sideways_bb_std_mult': 0.5701246676696647, 'sideways_rsi_os': 17, 'sideways_rsi_ob': 63, 'sideways_adx_thresh': 23.067416456672557, 'sideways_atr_min_pct': 0.003760224616717175, 'sideways_atr_max_pct': 0.013907798376737002, 'sideways_tp_mult': 2.0222243351756295, 'sideways_tsl_mult': 0.37090628743911763, 'sideways_time_stop': 49, 'sideways_use_sma': True, 'sideways_use_ema': True, 'sideways_use_atr': True, 'sideways_use_adx': True, 'sideways_use_spike': True, 'sideways_rsi_required': True}.
[I 2025-08-31 10:59:20,775] Trial 25 finished with values: [-1000000000.0, 1000000000.0] and parameters: {'p_sma': 6, 'p_std': 60, 'p_atr': 12, 'p_adx': 26, 'rsi_period': 44, 'ema1': 20, 'ema2': 46, 'slip_atr_k': 0.22749830810065108, 'slip_spread_k': 0.4762411282051586, 'spread_hl_frac': 0.04079098563322163, 'bb_std_mult': 2.974541164863974, 'rsi_os': 45, 'rsi_ob': 73, 'vol_spike': 0.16914155094464822, 'adx_thresh': 19.750146698192655, 'atr_min_pct': 0.0010079568256180609, 'atr_max_pct': 0.08951456746193293, 'tp_mult': 2.239135926326264, 'tsl_mult': 0.7493788440605664, 'strategy': 'breakout', 'time_stop': 265, 'use_sma': False, 'use_atr': False, 'use_adx': True, 'use_ema': True, 'use_spike': False, 'rsi_required': False, 'edge_k': 0.242579969724249, 'edge_cap': 0.062223771634834, 'bull_strategy': 'mean_reversion', 'bull_bb_std_mult': 2.720564510500499, 'bull_rsi_os': 11, 'bull_rsi_ob': 76, 'bull_adx_thresh': 21.409064244930516, 'bull_atr_min_pct': 0.01079414910507839, 'bull_atr_max_pct': 0.019371193837578404, 'bull_tp_mult': 1.2617548465917108, 'bull_tsl_mult': 0.7734328728831794, 'bull_time_stop': 18, 'bull_use_sma': False, 'bull_use_ema': False, 'bull_use_atr': False, 'bull_use_adx': False, 'bull_use_spike': True, 'bull_rsi_required': False, 'bear_strategy': 'breakout', 'bear_bb_std_mult': 2.3415716571198346, 'bear_rsi_os': 35, 'bear_rsi_ob': 68, 'bear_adx_thresh': 5.859231961216035, 'bear_atr_min_pct': 0.026145790997476062, 'bear_atr_max_pct': 0.08466864054882052, 'bear_tp_mult': 2.1458612458679136, 'bear_tsl_mult': 0.6116162766389781, 'bear_time_stop': 100, 'bear_use_sma': False, 'bear_use_ema': False, 'bear_use_atr': False, 'bear_use_adx': True, 'bear_use_spike': False, 'bear_rsi_required': True, 'sideways_strategy': 'mean_reversion', 'sideways_bb_std_mult': 1.1332065038443369, 'sideways_rsi_os': 31, 'sideways_rsi_ob': 88, 'sideways_adx_thresh': 14.42872105560394, 'sideways_atr_min_pct': 0.008964769592428708, 'sideways_atr_max_pct': 0.06892957046920598, 'sideways_tp_mult': 2.759487735775968, 'sideways_tsl_mult': 0.18929265777772064, 'sideways_time_stop': 172, 'sideways_use_sma': False, 'sideways_use_ema': False, 'sideways_use_atr': True, 'sideways_use_adx': False, 'sideways_use_spike': True, 'sideways_rsi_required': True}.
[I 2025-08-31 10:59:21,200] Trial 24 finished with values: [-1000000000.0, 1000000000.0] and parameters: {'p_sma': 10, 'p_std': 58, 'p_atr': 12, 'p_adx': 26, 'rsi_period': 43, 'ema1': 8, 'ema2': 46, 'slip_atr_k': 0.22157584925930007, 'slip_spread_k': 0.5227712798718416, 'spread_hl_frac': 0.04009349769923035, 'bb_std_mult': 2.2805486857134403, 'rsi_os': 47, 'rsi_ob': 74, 'vol_spike': 0.07214701798419211, 'adx_thresh': 5.648013558800761, 'atr_min_pct': 0.004233652572270924, 'atr_max_pct': 0.09055686742316185, 'tp_mult': 2.2431855962904104, 'tsl_mult': 0.7569161454475487, 'strategy': 'breakout', 'time_stop': 266, 'use_sma': False, 'use_atr': False, 'use_adx': True, 'use_ema': True, 'use_spike': False, 'rsi_required': False, 'edge_k': 0.2562431669112447, 'edge_cap': 0.058041298103620936, 'bull_strategy': 'mean_reversion', 'bull_bb_std_mult': 1.98191450135604, 'bull_rsi_os': 10, 'bull_rsi_ob': 94, 'bull_adx_thresh': 20.686530260519, 'bull_atr_min_pct': 0.016778918091560374, 'bull_atr_max_pct': 0.018317444397150967, 'bull_tp_mult': 2.259498329331743, 'bull_tsl_mult': 0.37986921965535514, 'bull_time_stop': 14, 'bull_use_sma': False, 'bull_use_ema': False, 'bull_use_atr': False, 'bull_use_adx': False, 'bull_use_spike': True, 'bull_rsi_required': False, 'bear_strategy': 'breakout', 'bear_bb_std_mult': 2.3490677129423045, 'bear_rsi_os': 34, 'bear_rsi_ob': 94, 'bear_adx_thresh': 6.014227662459635, 'bear_atr_min_pct': 0.01339417787969671, 'bear_atr_max_pct': 0.08127704916071653, 'bear_tp_mult': 2.092092692152862, 'bear_tsl_mult': 0.6620133266914664, 'bear_time_stop': 107, 'bear_use_sma': False, 'bear_use_ema': False, 'bear_use_atr': False, 'bear_use_adx': True, 'bear_use_spike': False, 'bear_rsi_required': True, 'sideways_strategy': 'mean_reversion', 'sideways_bb_std_mult': 2.248381854945489, 'sideways_rsi_os': 31, 'sideways_rsi_ob': 88, 'sideways_adx_thresh': 15.752258510352695, 'sideways_atr_min_pct': 0.01100013726716109, 'sideways_atr_max_pct': 0.0704881333573696, 'sideways_tp_mult': 1.0492841865321774, 'sideways_tsl_mult': 0.19298868763089166, 'sideways_time_stop': 176, 'sideways_use_sma': False, 'sideways_use_ema': False, 'sideways_use_atr': True, 'sideways_use_adx': False, 'sideways_use_spike': True, 'sideways_rsi_required': True}.
[I 2025-08-31 10:59:21,705] Trial 23 finished with values: [-1000000000.0, 1000000000.0] and parameters: {'p_sma': 6, 'p_std': 49, 'p_atr': 13, 'p_adx': 13, 'rsi_period': 43, 'ema1': 24, 'ema2': 29, 'slip_atr_k': 0.18536687885221764, 'slip_spread_k': 0.44394831905422416, 'spread_hl_frac': 0.039286435295650506, 'bb_std_mult': 2.3250103859231697, 'rsi_os': 45, 'rsi_ob': 70, 'vol_spike': 0.17721968530959722, 'adx_thresh': 17.711478562231576, 'atr_min_pct': 0.02266018976627853, 'atr_max_pct': 0.0845743577131724, 'tp_mult': 2.703102576035979, 'tsl_mult': 0.7448652098819557, 'strategy': 'breakout', 'time_stop': 198, 'use_sma': False, 'use_atr': False, 'use_adx': True, 'use_ema': True, 'use_spike': False, 'rsi_required': False, 'edge_k': 0.24418917882404462, 'edge_cap': 0.3117470586622685, 'bull_strategy': 'mean_reversion', 'bull_bb_std_mult': 2.0814940643231594, 'bull_rsi_os': 11, 'bull_rsi_ob': 74, 'bull_adx_thresh': 13.608208441615151, 'bull_atr_min_pct': 0.01684371956050853, 'bull_atr_max_pct': 0.0628765641797312, 'bull_tp_mult': 1.2784341195277822, 'bull_tsl_mult': 0.7313565330892264, 'bull_time_stop': 196, 'bull_use_sma': True, 'bull_use_ema': False, 'bull_use_atr': False, 'bull_use_adx': False, 'bull_use_spike': True, 'bull_rsi_required': True, 'bear_strategy': 'breakout', 'bear_bb_std_mult': 1.3443124121383847, 'bear_rsi_os': 34, 'bear_rsi_ob': 59, 'bear_adx_thresh': 24.204715871843415, 'bear_atr_min_pct': 0.01903356170081561, 'bear_atr_max_pct': 0.11930092200724693, 'bear_tp_mult': 2.1012533244560467, 'bear_tsl_mult': 0.7169270797880181, 'bear_time_stop': 160, 'bear_use_sma': False, 'bear_use_ema': False, 'bear_use_atr': False, 'bear_use_adx': True, 'bear_use_spike': False, 'bear_rsi_required': True, 'sideways_strategy': 'breakout', 'sideways_bb_std_mult': 2.2964463194026328, 'sideways_rsi_os': 40, 'sideways_rsi_ob': 87, 'sideways_adx_thresh': 15.51436248870098, 'sideways_atr_min_pct': 0.010901324601791563, 'sideways_atr_max_pct': 0.09960514829694882, 'sideways_tp_mult': 1.091294257823182, 'sideways_tsl_mult': 0.18317611591509253, 'sideways_time_stop': 93, 'sideways_use_sma': True, 'sideways_use_ema': True, 'sideways_use_atr': True, 'sideways_use_adx': False, 'sideways_use_spike': True, 'sideways_rsi_required': True}.
[I 2025-08-31 10:59:21,866] Trial 22 finished with values: [-1000000000.0, 1000000000.0] and parameters: {'p_sma': 10, 'p_std': 50, 'p_atr': 13, 'p_adx': 25, 'rsi_period': 46, 'ema1': 23, 'ema2': 51, 'slip_atr_k': 0.18504530836203315, 'slip_spread_k': 0.4599727834123291, 'spread_hl_frac': 0.04140103531521196, 'bb_std_mult': 2.2943952702794634, 'rsi_os': 47, 'rsi_ob': 85, 'vol_spike': 0.08510352284893624, 'adx_thresh': 17.543015313760264, 'atr_min_pct': 0.022204774257358048, 'atr_max_pct': 0.1309962077874931, 'tp_mult': 1.8188013820564874, 'tsl_mult': 0.7351647377089501, 'strategy': 'breakout', 'time_stop': 201, 'use_sma': False, 'use_atr': True, 'use_adx': True, 'use_ema': True, 'use_spike': False, 'rsi_required': False, 'edge_k': 0.2763316576017622, 'edge_cap': 0.32527815759779827, 'bull_strategy': 'mean_reversion', 'bull_bb_std_mult': 2.6879544758692653, 'bull_rsi_os': 12, 'bull_rsi_ob': 61, 'bull_adx_thresh': 17.919167692232698, 'bull_atr_min_pct': 0.016223850236776045, 'bull_atr_max_pct': 0.062326441893663334, 'bull_tp_mult': 2.0245991893997024, 'bull_tsl_mult': 0.7308224535692815, 'bull_time_stop': 191, 'bull_use_sma': True, 'bull_use_ema': False, 'bull_use_atr': True, 'bull_use_adx': False, 'bull_use_spike': True, 'bull_rsi_required': True, 'bear_strategy': 'mean_reversion', 'bear_bb_std_mult': 0.509041658466935, 'bear_rsi_os': 33, 'bear_rsi_ob': 77, 'bear_adx_thresh': 14.302463313358183, 'bear_atr_min_pct': 0.018552527185654567, 'bear_atr_max_pct': 0.06151631872093672, 'bear_tp_mult': 2.0172273948159383, 'bear_tsl_mult': 0.7510324827222034, 'bear_time_stop': 153, 'bear_use_sma': False, 'bear_use_ema': False, 'bear_use_atr': False, 'bear_use_adx': True, 'bear_use_spike': False, 'bear_rsi_required': True, 'sideways_strategy': 'breakout', 'sideways_bb_std_mult': 2.322762565147062, 'sideways_rsi_os': 13, 'sideways_rsi_ob': 77, 'sideways_adx_thresh': 15.136906302121407, 'sideways_atr_min_pct': 0.010666666776066513, 'sideways_atr_max_pct': 0.095891154380351, 'sideways_tp_mult': 2.699468476711864, 'sideways_tsl_mult': 0.18788124891430003, 'sideways_time_stop': 57, 'sideways_use_sma': True, 'sideways_use_ema': True, 'sideways_use_atr': True, 'sideways_use_adx': True, 'sideways_use_spike': True, 'sideways_rsi_required': True}.
[I 2025-08-31 10:59:53,130] Trial 26 finished with values: [-1000000000.0, 1000000000.0] and parameters: {'p_sma': 13, 'p_std': 50, 'p_atr': 13, 'p_adx': 25, 'rsi_period': 20, 'ema1': 23, 'ema2': 10, 'slip_atr_k': 0.1044337871155924, 'slip_spread_k': 0.22933489877754898, 'spread_hl_frac': 0.0005955225762150559, 'bb_std_mult': 3.548485284918656, 'rsi_os': 29, 'rsi_ob': 74, 'vol_spike': 0.04873291569255765, 'adx_thresh': 6.378221184810359, 'atr_min_pct': 0.005313017093529951, 'atr_max_pct': 0.11055905059199228, 'tp_mult': 1.9308973302962182, 'tsl_mult': 0.24658896146084586, 'strategy': 'mean_reversion', 'time_stop': 117, 'use_sma': True, 'use_atr': False, 'use_adx': False, 'use_ema': True, 'use_spike': True, 'rsi_required': True, 'edge_k': 0.16641775621368265, 'edge_cap': 0.6674684085688186, 'bull_strategy': 'breakout', 'bull_bb_std_mult': 1.3327964695322678, 'bull_rsi_os': 40, 'bull_rsi_ob': 95, 'bull_adx_thresh': 28.938413056871077, 'bull_atr_min_pct': 0.024503700724896642, 'bull_atr_max_pct': 0.06039331802679976, 'bull_tp_mult': 2.313108188458763, 'bull_tsl_mult': 0.3631640569807932, 'bull_time_stop': 181, 'bull_use_sma': False, 'bull_use_ema': False, 'bull_use_atr': False, 'bull_use_adx': True, 'bull_use_spike': False, 'bull_rsi_required': False, 'bear_strategy': 'breakout', 'bear_bb_std_mult': 2.110117685092775, 'bear_rsi_os': 32, 'bear_rsi_ob': 59, 'bear_adx_thresh': 23.691896361256973, 'bear_atr_min_pct': 0.013529881178056239, 'bear_atr_max_pct': 0.06880451048467653, 'bear_tp_mult': 2.042866563538378, 'bear_tsl_mult': 0.7178122154558751, 'bear_time_stop': 141, 'bear_use_sma': True, 'bear_use_ema': True, 'bear_use_atr': True, 'bear_use_adx': False, 'bear_use_spike': False, 'bear_rsi_required': True, 'sideways_strategy': 'mean_reversion', 'sideways_bb_std_mult': 2.2036582540044334, 'sideways_rsi_os': 54, 'sideways_rsi_ob': 77, 'sideways_adx_thresh': 15.097532484697146, 'sideways_atr_min_pct': 0.012075719110755983, 'sideways_atr_max_pct': 0.0652754223626471, 'sideways_tp_mult': 1.1685340818911414, 'sideways_tsl_mult': 0.5480958377313991, 'sideways_time_stop': 85, 'sideways_use_sma': False, 'sideways_use_ema': False, 'sideways_use_atr': True, 'sideways_use_adx': False, 'sideways_use_spike': True, 'sideways_rsi_required': False}.
