[I 2025-08-31 11:11:07,252] Trial 115 finished with values: [-0.06049518924077624, 0.060129095067845965] and parameters: {'p_sma': 14, 'p_std': 48, 'p_atr': 18, 'p_adx': 18, 'rsi_period': 14, 'ema1': 8, 'ema2': 30, 'slip_atr_k': 0.11698273637882955, 'slip_spread_k': 0.34394207480345046, 'spread_hl_frac': 0.007210523907058936, 'bb_std_mult': 1.6307928098354467, 'rsi_os': 32, 'rsi_ob': 52, 'vol_spike': 0.025969579054024167, 'adx_thresh': 34.816510831568515, 'atr_min_pct': 0.002350605850920442, 'atr_max_pct': 0.14100054427269387, 'tp_mult': 1.598742303621131, 'tsl_mult': 0.04947543052785619, 'strategy': 'mean_reversion', 'time_stop': 78, 'use_sma': False, 'use_atr': False, 'use_adx': True, 'use_ema': True, 'use_spike': False, 'rsi_required': False, 'edge_k': 0.6996843538773734, 'edge_cap': 0.25030682896551215, 'bull_strategy': 'mean_reversion', 'bull_bb_std_mult': 1.7460841430408014, 'bull_rsi_os': 48, 'bull_rsi_ob': 71, 'bull_adx_thresh': 8.826347524386179, 'bull_atr_min_pct': 0.014770649611995552, 'bull_atr_max_pct': 0.07333447964448793, 'bull_tp_mult': 1.9190862867386107, 'bull_tsl_mult': 0.11745426600763548, 'bull_time_stop': 139, 'bull_use_sma': True, 'bull_use_ema': False, 'bull_use_atr': False, 'bull_use_adx': False, 'bull_use_spike': True, 'bull_rsi_required': True, 'bear_strategy': 'mean_reversion', 'bear_bb_std_mult': 1.7306499439896454, 'bear_rsi_os': 39, 'bear_rsi_ob': 50, 'bear_adx_thresh': 24.36167270271345, 'bear_atr_min_pct': 0.0022518851775435965, 'bear_atr_max_pct': 0.02173869010317319, 'bear_tp_mult': 2.3832683580636425, 'bear_tsl_mult': 0.8644073655690175, 'bear_time_stop': 45, 'bear_use_sma': False, 'bear_use_ema': False, 'bear_use_atr': False, 'bear_use_adx': False, 'bear_use_spike': False, 'bear_rsi_required': True, 'sideways_strategy': 'mean_reversion', 'sideways_bb_std_mult': 1.095690968654397, 'sideways_rsi_os': 26, 'sideways_rsi_ob': 80, 'sideways_adx_thresh': 6.874104654468914, 'sideways_atr_min_pct': 0.002883759767506903, 'sideways_atr_max_pct': 0.06586666766123375, 'sideways_tp_mult': 2.878928468695609, 'sideways_tsl_mult': 0.864258106677612, 'sideways_time_stop': 52, 'sideways_use_sma': True, 'sideways_use_ema': True, 'sideways_use_atr': True, 'sideways_use_adx': False, 'sideways_use_spike': False, 'sideways_rsi_required': True}.
[I 2025-08-31 11:11:38,353] Trial 119 finished with values: [-1000000000.0, 1000000000.0] and parameters: {'p_sma': 38, 'p_std': 37, 'p_atr': 18, 'p_adx': 20, 'rsi_period': 58, 'ema1': 17, 'ema2': 21, 'slip_atr_k': 0.08519562088285768, 'slip_spread_k': 0.8108669876543527, 'spread_hl_frac': 0.02213109285946082, 'bb_std_mult': 3.1078261743719713, 'rsi_os': 34, 'rsi_ob': 63, 'vol_spike': 0.1211481740187572, 'adx_thresh': 31.38089100566809, 'atr_min_pct': 0.0017565946421542029, 'atr_max_pct': 0.1407552244485007, 'tp_mult': 1.2172154589504516, 'tsl_mult': 0.039490501126680067, 'strategy': 'breakout', 'time_stop': 207, 'use_sma': True, 'use_atr': False, 'use_adx': True, 'use_ema': True, 'use_spike': False, 'rsi_required': True, 'edge_k': 0.22223931483422155, 'edge_cap': 0.7718031254682273, 'bull_strategy': 'mean_reversion', 'bull_bb_std_mult': 2.380096252773945, 'bull_rsi_os': 17, 'bull_rsi_ob': 65, 'bull_adx_thresh': 8.800901854436475, 'bull_atr_min_pct': 0.01884744340097614, 'bull_atr_max_pct': 0.06272444847474912, 'bull_tp_mult': 1.7529495366541035, 'bull_tsl_mult': 0.0573422832663958, 'bull_time_stop': 174, 'bull_use_sma': False, 'bull_use_ema': False, 'bull_use_atr': True, 'bull_use_adx': True, 'bull_use_spike': False, 'bull_rsi_required': False, 'bear_strategy': 'mean_reversion', 'bear_bb_std_mult': 0.786506806125294, 'bear_rsi_os': 17, 'bear_rsi_ob': 59, 'bear_adx_thresh': 32.51101743402724, 'bear_atr_min_pct': 0.0027157774091833868, 'bear_atr_max_pct': 0.04924677402890496, 'bear_tp_mult': 2.3711376331973684, 'bear_tsl_mult': 0.27591327228765694, 'bear_time_stop': 75, 'bear_use_sma': False, 'bear_use_ema': False, 'bear_use_atr': True, 'bear_use_adx': False, 'bear_use_spike': False, 'bear_rsi_required': True, 'sideways_strategy': 'mean_reversion', 'sideways_bb_std_mult': 0.8905858769820654, 'sideways_rsi_os': 32, 'sideways_rsi_ob': 76, 'sideways_adx_thresh': 5.86665207045291, 'sideways_atr_min_pct': 0.00010343798702349547, 'sideways_atr_max_pct': 0.018145336174006363, 'sideways_tp_mult': 1.8304392474290723, 'sideways_tsl_mult': 0.9446155443864445, 'sideways_time_stop': 15, 'sideways_use_sma': False, 'sideways_use_ema': True, 'sideways_use_atr': True, 'sideways_use_adx': False, 'sideways_use_spike': False, 'sideways_rsi_required': True}.
[I 2025-08-31 11:11:38,720] Trial 118 finished with values: [-1000000000.0, 1000000000.0] and parameters: {'p_sma': 39, 'p_std': 38, 'p_atr': 18, 'p_adx': 18, 'rsi_period': 58, 'ema1': 20, 'ema2': 21, 'slip_atr_k': 0.08525882171450165, 'slip_spread_k': 0.8177198643538934, 'spread_hl_frac': 0.020980229824583592, 'bb_std_mult': 2.8994946178585836, 'rsi_os': 41, 'rsi_ob': 93, 'vol_spike': 0.18260974650461992, 'adx_thresh': 31.942735709088943, 'atr_min_pct': 0.0019534516265173937, 'atr_max_pct': 0.1216935188804011, 'tp_mult': 1.2313202610471963, 'tsl_mult': 0.18622867184067904, 'strategy': 'mean_reversion', 'time_stop': 206, 'use_sma': False, 'use_atr': False, 'use_adx': False, 'use_ema': True, 'use_spike': False, 'rsi_required': True, 'edge_k': 0.3579517397712161, 'edge_cap': 0.7638794596454261, 'bull_strategy': 'mean_reversion', 'bull_bb_std_mult': 2.8061103361751596, 'bull_rsi_os': 14, 'bull_rsi_ob': 68, 'bull_adx_thresh': 8.727227111575509, 'bull_atr_min_pct': 0.0187264571019121, 'bull_atr_max_pct': 0.06290186167376811, 'bull_tp_mult': 1.6392411249532544, 'bull_tsl_mult': 0.04958619733186649, 'bull_time_stop': 173, 'bull_use_sma': True, 'bull_use_ema': False, 'bull_use_atr': True, 'bull_use_adx': True, 'bull_use_spike': False, 'bull_rsi_required': True, 'bear_strategy': 'mean_reversion', 'bear_bb_std_mult': 0.789622605250713, 'bear_rsi_os': 14, 'bear_rsi_ob': 60, 'bear_adx_thresh': 30.847583312533214, 'bear_atr_min_pct': 0.0025027221877161735, 'bear_atr_max_pct': 0.051113136828005966, 'bear_tp_mult': 2.3597465842288177, 'bear_tsl_mult': 0.27433974357242036, 'bear_time_stop': 82, 'bear_use_sma': False, 'bear_use_ema': False, 'bear_use_atr': True, 'bear_use_adx': False, 'bear_use_spike': False, 'bear_rsi_required': True, 'sideways_strategy': 'mean_reversion', 'sideways_bb_std_mult': 1.0948681966097997, 'sideways_rsi_os': 32, 'sideways_rsi_ob': 76, 'sideways_adx_thresh': 6.591860824577342, 'sideways_atr_min_pct': 7.247899634167108e-05, 'sideways_atr_max_pct': 0.020101050349327715, 'sideways_tp_mult': 1.8389701133461749, 'sideways_tsl_mult': 0.9303813021027673, 'sideways_time_stop': 5, 'sideways_use_sma': True, 'sideways_use_ema': True, 'sideways_use_atr': True, 'sideways_use_adx': False, 'sideways_use_spike': False, 'sideways_rsi_required': False}.
[I 2025-08-31 11:11:38,886] Trial 120 finished with values: [-0.047283066624710934, 0.047237857417747726] and parameters: {'p_sma': 38, 'p_std': 37, 'p_atr': 18, 'p_adx': 20, 'rsi_period': 55, 'ema1': 16, 'ema2': 21, 'slip_atr_k': 0.06509645709583695, 'slip_spread_k': 0.7686464793160376, 'spread_hl_frac': 0.021609520376947, 'bb_std_mult': 2.9063684279261484, 'rsi_os': 10, 'rsi_ob': 93, 'vol_spike': 0.12177330421642733, 'adx_thresh': 30.92098936231782, 'atr_min_pct': 0.00200064094981188, 'atr_max_pct': 0.14434853975030654, 'tp_mult': 1.2195209845453163, 'tsl_mult': 0.21268148219933503, 'strategy': 'breakout', 'time_stop': 93, 'use_sma': True, 'use_atr': False, 'use_adx': True, 'use_ema': True, 'use_spike': False, 'rsi_required': True, 'edge_k': 0.22577261021720438, 'edge_cap': 0.8026351001188403, 'bull_strategy': 'mean_reversion', 'bull_bb_std_mult': 2.3842687716323514, 'bull_rsi_os': 16, 'bull_rsi_ob': 68, 'bull_adx_thresh': 8.507025869283364, 'bull_atr_min_pct': 0.01793304776098099, 'bull_atr_max_pct': 0.06222551759154235, 'bull_tp_mult': 1.6950843126843278, 'bull_tsl_mult': 0.053963107754378806, 'bull_time_stop': 173, 'bull_use_sma': False, 'bull_use_ema': False, 'bull_use_atr': True, 'bull_use_adx': True, 'bull_use_spike': False, 'bull_rsi_required': False, 'bear_strategy': 'mean_reversion', 'bear_bb_std_mult': 0.5017896962134369, 'bear_rsi_os': 14, 'bear_rsi_ob': 57, 'bear_adx_thresh': 32.44830083127495, 'bear_atr_min_pct': 0.002796697333672264, 'bear_atr_max_pct': 0.05377463427185257, 'bear_tp_mult': 2.4724653103407968, 'bear_tsl_mult': 0.2739619582820334, 'bear_time_stop': 82, 'bear_use_sma': True, 'bear_use_ema': False, 'bear_use_atr': True, 'bear_use_adx': True, 'bear_use_spike': False, 'bear_rsi_required': True, 'sideways_strategy': 'breakout', 'sideways_bb_std_mult': 1.0675148444691416, 'sideways_rsi_os': 34, 'sideways_rsi_ob': 76, 'sideways_adx_thresh': 5.694316243865731, 'sideways_atr_min_pct': 0.0007849992891264607, 'sideways_atr_max_pct': 0.01767123104226314, 'sideways_tp_mult': 1.856294806446902, 'sideways_tsl_mult': 0.9714798762556278, 'sideways_time_stop': 16, 'sideways_use_sma': False, 'sideways_use_ema': True, 'sideways_use_atr': True, 'sideways_use_adx': False, 'sideways_use_spike': False, 'sideways_rsi_required': True}.
[I 2025-08-31 11:11:38,897] Trial 121 finished with values: [-0.014160629115691492, 0.015364328492816966] and parameters: {'p_sma': 39, 'p_std': 37, 'p_atr': 17, 'p_adx': 20, 'rsi_period': 58, 'ema1': 16, 'ema2': 21, 'slip_atr_k': 0.07536592202356387, 'slip_spread_k': 0.7627817974067571, 'spread_hl_frac': 0.02177945418200037, 'bb_std_mult': 3.0911124161506516, 'rsi_os': 41, 'rsi_ob': 94, 'vol_spike': 0.10949150172701269, 'adx_thresh': 31.375317978256284, 'atr_min_pct': 0.0011536286797154155, 'atr_max_pct': 0.076370628139229, 'tp_mult': 1.2251605277926354, 'tsl_mult': 0.21771987557191913, 'strategy': 'breakout', 'time_stop': 109, 'use_sma': True, 'use_atr': False, 'use_adx': True, 'use_ema': True, 'use_spike': False, 'rsi_required': True, 'edge_k': 0.3426853221840587, 'edge_cap': 0.8158415217943343, 'bull_strategy': 'breakout', 'bull_bb_std_mult': 3.408904028940012, 'bull_rsi_os': 17, 'bull_rsi_ob': 68, 'bull_adx_thresh': 16.52599218887646, 'bull_atr_min_pct': 0.017681557741688555, 'bull_atr_max_pct': 0.06990021934127184, 'bull_tp_mult': 1.6332711017627994, 'bull_tsl_mult': 0.3585162352772449, 'bull_time_stop': 163, 'bull_use_sma': False, 'bull_use_ema': False, 'bull_use_atr': True, 'bull_use_adx': True, 'bull_use_spike': False, 'bull_rsi_required': False, 'bear_strategy': 'breakout', 'bear_bb_std_mult': 0.7758661280101871, 'bear_rsi_os': 14, 'bear_rsi_ob': 57, 'bear_adx_thresh': 32.640283565651075, 'bear_atr_min_pct': 0.00419751828677838, 'bear_atr_max_pct': 0.05233835449165033, 'bear_tp_mult': 2.485277136766836, 'bear_tsl_mult': 0.2869422634308797, 'bear_time_stop': 84, 'bear_use_sma': True, 'bear_use_ema': False, 'bear_use_atr': True, 'bear_use_adx': True, 'bear_use_spike': True, 'bear_rsi_required': True, 'sideways_strategy': 'breakout', 'sideways_bb_std_mult': 1.1115471960878236, 'sideways_rsi_os': 32, 'sideways_rsi_ob': 73, 'sideways_adx_thresh': 5.800930655055063, 'sideways_atr_min_pct': 0.000685060217642891, 'sideways_atr_max_pct': 0.017322235126369302, 'sideways_tp_mult': 1.8501114043705331, 'sideways_tsl_mult': 0.9728091267118206, 'sideways_time_stop': 11, 'sideways_use_sma': False, 'sideways_use_ema': True, 'sideways_use_atr': True, 'sideways_use_adx': False, 'sideways_use_spike': False, 'sideways_rsi_required': True}.
[I 2025-08-31 11:12:11,173] Trial 122 finished with values: [-0.010079287957567962, 0.0135995874673595] and parameters: {'p_sma': 41, 'p_std': 38, 'p_atr': 19, 'p_adx': 21, 'rsi_period': 54, 'ema1': 16, 'ema2': 17, 'slip_atr_k': 0.0667783024078387, 'slip_spread_k': 0.7556501000300134, 'spread_hl_frac': 0.020582926881892002, 'bb_std_mult': 2.919846417393752, 'rsi_os': 38, 'rsi_ob': 93, 'vol_spike': 0.10906097377906514, 'adx_thresh': 30.500241311550873, 'atr_min_pct': 0.0011164620516350254, 'atr_max_pct': 0.1451944009308857, 'tp_mult': 1.076088156005233, 'tsl_mult': 0.22028396868901012, 'strategy': 'breakout', 'time_stop': 260, 'use_sma': False, 'use_atr': False, 'use_adx': True, 'use_ema': False, 'use_spike': False, 'rsi_required': True, 'edge_k': 0.3726521575050657, 'edge_cap': 0.8088562902501204, 'bull_strategy': 'breakout', 'bull_bb_std_mult': 2.7784964335854303, 'bull_rsi_os': 16, 'bull_rsi_ob': 68, 'bull_adx_thresh': 7.4510182833398915, 'bull_atr_min_pct': 0.017845018016790695, 'bull_atr_max_pct': 0.07111765421492011, 'bull_tp_mult': 1.6890212973290695, 'bull_tsl_mult': 0.3524257847925338, 'bull_time_stop': 185, 'bull_use_sma': True, 'bull_use_ema': False, 'bull_use_atr': True, 'bull_use_adx': True, 'bull_use_spike': False, 'bull_rsi_required': True, 'bear_strategy': 'breakout', 'bear_bb_std_mult': 0.5078950418889573, 'bear_rsi_os': 15, 'bear_rsi_ob': 57, 'bear_adx_thresh': 34.10744372445113, 'bear_atr_min_pct': 0.0045271661378670745, 'bear_atr_max_pct': 0.05421266040052754, 'bear_tp_mult': 2.4657079580653907, 'bear_tsl_mult': 0.3480756255781792, 'bear_time_stop': 84, 'bear_use_sma': True, 'bear_use_ema': False, 'bear_use_atr': True, 'bear_use_adx': True, 'bear_use_spike': True, 'bear_rsi_required': False, 'sideways_strategy': 'breakout', 'sideways_bb_std_mult': 1.0675596507106988, 'sideways_rsi_os': 32, 'sideways_rsi_ob': 73, 'sideways_adx_thresh': 5.8918634286490565, 'sideways_atr_min_pct': 0.0014072589673123032, 'sideways_atr_max_pct': 0.02169074337943639, 'sideways_tp_mult': 2.300003668290915, 'sideways_tsl_mult': 0.5979220197504552, 'sideways_time_stop': 27, 'sideways_use_sma': False, 'sideways_use_ema': True, 'sideways_use_atr': False, 'sideways_use_adx': False, 'sideways_use_spike': False, 'sideways_rsi_required': True}.
[I 2025-08-31 11:12:11,778] Trial 124 finished with values: [-0.028548025262330134, 0.028545493321062987] and parameters: {'p_sma': 42, 'p_std': 36, 'p_atr': 29, 'p_adx': 21, 'rsi_period': 55, 'ema1': 16, 'ema2': 17, 'slip_atr_k': 0.07463154609214509, 'slip_spread_k': 0.7614253404286471, 'spread_hl_frac': 0.023644555032631215, 'bb_std_mult': 2.2420401989092604, 'rsi_os': 35, 'rsi_ob': 74, 'vol_spike': 0.10947095440540397, 'adx_thresh': 30.35016633350669, 'atr_min_pct': 0.0011093124039269191, 'atr_max_pct': 0.14474577787244472, 'tp_mult': 1.4769496772972488, 'tsl_mult': 0.09089251903592022, 'strategy': 'breakout', 'time_stop': 110, 'use_sma': False, 'use_atr': True, 'use_adx': True, 'use_ema': False, 'use_spike': False, 'rsi_required': True, 'edge_k': 0.43758270731218657, 'edge_cap': 0.8003315494266584, 'bull_strategy': 'mean_reversion', 'bull_bb_std_mult': 2.2956674122518566, 'bull_rsi_os': 14, 'bull_rsi_ob': 64, 'bull_adx_thresh': 33.97533305618004, 'bull_atr_min_pct': 0.017659112254015792, 'bull_atr_max_pct': 0.04771449839674366, 'bull_tp_mult': 1.6860975249864958, 'bull_tsl_mult': 0.8984869364959875, 'bull_time_stop': 163, 'bull_use_sma': False, 'bull_use_ema': False, 'bull_use_atr': True, 'bull_use_adx': True, 'bull_use_spike': False, 'bull_rsi_required': False, 'bear_strategy': 'breakout', 'bear_bb_std_mult': 0.5013207249263314, 'bear_rsi_os': 13, 'bear_rsi_ob': 57, 'bear_adx_thresh': 32.98433500461952, 'bear_atr_min_pct': 0.004108778858403182, 'bear_atr_max_pct': 0.04298525810583352, 'bear_tp_mult': 2.4710150866879377, 'bear_tsl_mult': 0.18482029483246293, 'bear_time_stop': 63, 'bear_use_sma': True, 'bear_use_ema': False, 'bear_use_atr': True, 'bear_use_adx': True, 'bear_use_spike': True, 'bear_rsi_required': False, 'sideways_strategy': 'breakout', 'sideways_bb_std_mult': 1.1738106472773633, 'sideways_rsi_os': 34, 'sideways_rsi_ob': 73, 'sideways_adx_thresh': 5.61918720608966, 'sideways_atr_min_pct': 0.0006707817932345828, 'sideways_atr_max_pct': 0.013813777244860813, 'sideways_tp_mult': 2.171453640052593, 'sideways_tsl_mult': 0.6110221123520925, 'sideways_time_stop': 28, 'sideways_use_sma': False, 'sideways_use_ema': True, 'sideways_use_atr': False, 'sideways_use_adx': True, 'sideways_use_spike': False, 'sideways_rsi_required': True}.
[I 2025-08-31 11:12:11,940] Trial 123 finished with values: [-0.03353892860532992, 0.03348660208486347] and parameters: {'p_sma': 41, 'p_std': 36, 'p_atr': 17, 'p_adx': 21, 'rsi_period': 55, 'ema1': 16, 'ema2': 17, 'slip_atr_k': 0.07551342716543061, 'slip_spread_k': 0.7586360701292993, 'spread_hl_frac': 0.02581607188593492, 'bb_std_mult': 2.580639488004548, 'rsi_os': 38, 'rsi_ob': 74, 'vol_spike': 0.10847405248355876, 'adx_thresh': 30.501487878640596, 'atr_min_pct': 0.0010609595191826198, 'atr_max_pct': 0.0775806221917801, 'tp_mult': 1.476560780496288, 'tsl_mult': 0.20875458693877336, 'strategy': 'breakout', 'time_stop': 260, 'use_sma': True, 'use_atr': True, 'use_adx': True, 'use_ema': False, 'use_spike': True, 'rsi_required': True, 'edge_k': 0.29847408288218136, 'edge_cap': 0.799865367713458, 'bull_strategy': 'breakout', 'bull_bb_std_mult': 3.348814370000368, 'bull_rsi_os': 16, 'bull_rsi_ob': 64, 'bull_adx_thresh': 7.44007098884455, 'bull_atr_min_pct': 0.017363465383252463, 'bull_atr_max_pct': 0.07164084884990993, 'bull_tp_mult': 1.6630927447176012, 'bull_tsl_mult': 0.8129198348793287, 'bull_time_stop': 163, 'bull_use_sma': False, 'bull_use_ema': True, 'bull_use_atr': True, 'bull_use_adx': True, 'bull_use_spike': False, 'bull_rsi_required': False, 'bear_strategy': 'breakout', 'bear_bb_std_mult': 0.5602704011914524, 'bear_rsi_os': 15, 'bear_rsi_ob': 57, 'bear_adx_thresh': 32.79124510588255, 'bear_atr_min_pct': 0.0043712039026829325, 'bear_atr_max_pct': 0.05396104016041661, 'bear_tp_mult': 2.481214607253703, 'bear_tsl_mult': 0.3358053717437193, 'bear_time_stop': 60, 'bear_use_sma': True, 'bear_use_ema': True, 'bear_use_atr': True, 'bear_use_adx': True, 'bear_use_spike': True, 'bear_rsi_required': False, 'sideways_strategy': 'breakout', 'sideways_bb_std_mult': 0.9358800458550769, 'sideways_rsi_os': 34, 'sideways_rsi_ob': 75, 'sideways_adx_thresh': 5.620827963649848, 'sideways_atr_min_pct': 0.0008217075797541388, 'sideways_atr_max_pct': 0.024523817225702106, 'sideways_tp_mult': 1.2652301587234733, 'sideways_tsl_mult': 0.9828561423566113, 'sideways_time_stop': 28, 'sideways_use_sma': False, 'sideways_use_ema': True, 'sideways_use_atr': False, 'sideways_use_adx': False, 'sideways_use_spike': False, 'sideways_rsi_required': True}.
[I 2025-08-31 11:12:12,032] Trial 125 finished with values: [-0.019116134635978388, 0.01935468324928424] and parameters: {'p_sma': 41, 'p_std': 37, 'p_atr': 29, 'p_adx': 21, 'rsi_period': 55, 'ema1': 16, 'ema2': 18, 'slip_atr_k': 0.06558927446747412, 'slip_spread_k': 0.8701289282017013, 'spread_hl_frac': 0.02399768024965347, 'bb_std_mult': 2.502369820851276, 'rsi_os': 38, 'rsi_ob': 74, 'vol_spike': 0.1088992716311721, 'adx_thresh': 30.133189951462676, 'atr_min_pct': 0.001145180188121037, 'atr_max_pct': 0.13713183144177513, 'tp_mult': 1.4756659430987025, 'tsl_mult': 0.09694147120629028, 'strategy': 'breakout', 'time_stop': 108, 'use_sma': False, 'use_atr': True, 'use_adx': True, 'use_ema': False, 'use_spike': False, 'rsi_required': True, 'edge_k': 0.38477617202141434, 'edge_cap': 0.8104200714209548, 'bull_strategy': 'mean_reversion', 'bull_bb_std_mult': 2.286321840968305, 'bull_rsi_os': 16, 'bull_rsi_ob': 64, 'bull_adx_thresh': 7.4493766228481775, 'bull_atr_min_pct': 0.017706192503795452, 'bull_atr_max_pct': 0.07071187360094604, 'bull_tp_mult': 1.6979731763642472, 'bull_tsl_mult': 0.3662345108689127, 'bull_time_stop': 186, 'bull_use_sma': False, 'bull_use_ema': False, 'bull_use_atr': True, 'bull_use_adx': True, 'bull_use_spike': False, 'bull_rsi_required': False, 'bear_strategy': 'breakout', 'bear_bb_std_mult': 0.5674772617085372, 'bear_rsi_os': 13, 'bear_rsi_ob': 57, 'bear_adx_thresh': 32.74064508055125, 'bear_atr_min_pct': 0.004218688877330426, 'bear_atr_max_pct': 0.053945584231748354, 'bear_tp_mult': 2.328486347009217, 'bear_tsl_mult': 0.44194903330605706, 'bear_time_stop': 86, 'bear_use_sma': True, 'bear_use_ema': False, 'bear_use_atr': True, 'bear_use_adx': True, 'bear_use_spike': True, 'bear_rsi_required': False, 'sideways_strategy': 'breakout', 'sideways_bb_std_mult': 1.1814854550013094, 'sideways_rsi_os': 34, 'sideways_rsi_ob': 75, 'sideways_adx_thresh': 7.188094011293417, 'sideways_atr_min_pct': 0.0013550955997279788, 'sideways_atr_max_pct': 0.012845059059119994, 'sideways_tp_mult': 1.8979751157691034, 'sideways_tsl_mult': 0.9694266305901189, 'sideways_time_stop': 19, 'sideways_use_sma': False, 'sideways_use_ema': True, 'sideways_use_atr': False, 'sideways_use_adx': True, 'sideways_use_spike': False, 'sideways_rsi_required': True}.
