[I 2025-08-31 11:50:29,631] Trial 432 finished with values: [-0.017548397457182507, 0.018015736046240655] and parameters: {'p_sma': 29, 'p_std': 30, 'p_atr': 9, 'p_adx': 26, 'rsi_period': 53, 'ema1': 13, 'ema2': 37, 'slip_atr_k': 0.10708579326981893, 'slip_spread_k': 0.06057290051498421, 'spread_hl_frac': 0.0007770449666749898, 'bb_std_mult': 1.9269568729855873, 'rsi_os': 20, 'rsi_ob': 94, 'vol_spike': 0.24336836123026995, 'adx_thresh': 15.737957960688693, 'atr_min_pct': 0.02113218757637341, 'atr_max_pct': 0.10980251859968715, 'tp_mult': 1.1085443345189825, 'tsl_mult': 0.3321634111079279, 'strategy': 'breakout', 'time_stop': 295, 'use_sma': True, 'use_atr': False, 'use_adx': False, 'use_ema': False, 'use_spike': True, 'rsi_required': False, 'edge_k': 1.8675046090842982, 'edge_cap': 0.7655134101565177, 'bull_strategy': 'mean_reversion', 'bull_bb_std_mult': 2.724662208710231, 'bull_rsi_os': 40, 'bull_rsi_ob': 69, 'bull_adx_thresh': 5.0017535307472585, 'bull_atr_min_pct': 0.0018172930434606225, 'bull_atr_max_pct': 0.13100347336136992, 'bull_tp_mult': 2.7467796301871665, 'bull_tsl_mult': 0.31419259900103524, 'bull_time_stop': 105, 'bull_use_sma': False, 'bull_use_ema': True, 'bull_use_atr': True, 'bull_use_adx': True, 'bull_use_spike': False, 'bull_rsi_required': True, 'bear_strategy': 'breakout', 'bear_bb_std_mult': 1.1353812630723177, 'bear_rsi_os': 32, 'bear_rsi_ob': 94, 'bear_adx_thresh': 31.86151756957496, 'bear_atr_min_pct': 0.011516214893122859, 'bear_atr_max_pct': 0.012736010147581342, 'bear_tp_mult': 1.0854049386130478, 'bear_tsl_mult': 0.22358610713705207, 'bear_time_stop': 194, 'bear_use_sma': False, 'bear_use_ema': True, 'bear_use_atr': True, 'bear_use_adx': True, 'bear_use_spike': True, 'bear_rsi_required': False, 'sideways_strategy': 'breakout', 'sideways_bb_std_mult': 1.7643814454710163, 'sideways_rsi_os': 32, 'sideways_rsi_ob': 66, 'sideways_adx_thresh': 10.495752605456625, 'sideways_atr_min_pct': 0.00279376261126354, 'sideways_atr_max_pct': 0.0895541343362733, 'sideways_tp_mult': 1.4849521217819395, 'sideways_tsl_mult': 0.3449920475022442, 'sideways_time_stop': 215, 'sideways_use_sma': True, 'sideways_use_ema': False, 'sideways_use_atr': True, 'sideways_use_adx': False, 'sideways_use_spike': False, 'sideways_rsi_required': True}.
[I 2025-08-31 11:51:06,800] Trial 436 finished with values: [-1000000000.0, 1000000000.0] and parameters: {'p_sma': 20, 'p_std': 17, 'p_atr': 15, 'p_adx': 26, 'rsi_period': 43, 'ema1': 11, 'ema2': 36, 'slip_atr_k': 0.03606048765022204, 'slip_spread_k': 0.11780798348994581, 'spread_hl_frac': 0.0007219467347775108, 'bb_std_mult': 0.8035053166530346, 'rsi_os': 30, 'rsi_ob': 94, 'vol_spike': 0.23265806706564546, 'adx_thresh': 7.681051757086088, 'atr_min_pct': 0.005967958942235489, 'atr_max_pct': 0.040774176977128145, 'tp_mult': 1.2735244001563126, 'tsl_mult': 0.32217006164416945, 'strategy': 'breakout', 'time_stop': 87, 'use_sma': False, 'use_atr': True, 'use_adx': False, 'use_ema': False, 'use_spike': False, 'rsi_required': False, 'edge_k': 0.4267221577182932, 'edge_cap': 0.05271242609063381, 'bull_strategy': 'breakout', 'bull_bb_std_mult': 2.603767460848973, 'bull_rsi_os': 21, 'bull_rsi_ob': 62, 'bull_adx_thresh': 12.826697847173264, 'bull_atr_min_pct': 0.0055410823901361735, 'bull_atr_max_pct': 0.139880913527945, 'bull_tp_mult': 2.814302577389704, 'bull_tsl_mult': 0.5880244525593415, 'bull_time_stop': 145, 'bull_use_sma': True, 'bull_use_ema': True, 'bull_use_atr': True, 'bull_use_adx': False, 'bull_use_spike': False, 'bull_rsi_required': True, 'bear_strategy': 'breakout', 'bear_bb_std_mult': 1.1504227068662836, 'bear_rsi_os': 44, 'bear_rsi_ob': 94, 'bear_adx_thresh': 33.588024589159666, 'bear_atr_min_pct': 0.02906256823968517, 'bear_atr_max_pct': 0.0611135158504344, 'bear_tp_mult': 2.2564753341443144, 'bear_tsl_mult': 0.4004968498401811, 'bear_time_stop': 45, 'bear_use_sma': False, 'bear_use_ema': False, 'bear_use_atr': True, 'bear_use_adx': False, 'bear_use_spike': True, 'bear_rsi_required': False, 'sideways_strategy': 'mean_reversion', 'sideways_bb_std_mult': 1.5793579659121404, 'sideways_rsi_os': 30, 'sideways_rsi_ob': 73, 'sideways_adx_thresh': 10.530137397439551, 'sideways_atr_min_pct': 0.003313353746301394, 'sideways_atr_max_pct': 0.044190491468495866, 'sideways_tp_mult': 1.2324508314199594, 'sideways_tsl_mult': 0.34718726094510444, 'sideways_time_stop': 236, 'sideways_use_sma': True, 'sideways_use_ema': False, 'sideways_use_atr': True, 'sideways_use_adx': True, 'sideways_use_spike': False, 'sideways_rsi_required': True}.
[I 2025-08-31 11:51:07,795] Trial 433 finished with values: [-1000000000.0, 1000000000.0] and parameters: {'p_sma': 48, 'p_std': 30, 'p_atr': 25, 'p_adx': 26, 'rsi_period': 69, 'ema1': 11, 'ema2': 34, 'slip_atr_k': 0.036834513661983315, 'slip_spread_k': 0.13914378579395603, 'spread_hl_frac': 0.0007783440378012786, 'bb_std_mult': 0.955926418301128, 'rsi_os': 34, 'rsi_ob': 67, 'vol_spike': 0.19786397971772407, 'adx_thresh': 25.260428736074086, 'atr_min_pct': 0.0040352469065500765, 'atr_max_pct': 0.028941836597708704, 'tp_mult': 1.1096026373032626, 'tsl_mult': 0.7639384957605899, 'strategy': 'breakout', 'time_stop': 295, 'use_sma': True, 'use_atr': True, 'use_adx': True, 'use_ema': False, 'use_spike': False, 'rsi_required': True, 'edge_k': 0.282250798656859, 'edge_cap': 0.3878736297248646, 'bull_strategy': 'mean_reversion', 'bull_bb_std_mult': 2.7285715367153176, 'bull_rsi_os': 40, 'bull_rsi_ob': 79, 'bull_adx_thresh': 12.78792741607889, 'bull_atr_min_pct': 0.023868859904392456, 'bull_atr_max_pct': 0.030010454679768865, 'bull_tp_mult': 2.756049121258529, 'bull_tsl_mult': 0.3290148511292265, 'bull_time_stop': 156, 'bull_use_sma': False, 'bull_use_ema': True, 'bull_use_atr': True, 'bull_use_adx': True, 'bull_use_spike': False, 'bull_rsi_required': True, 'bear_strategy': 'breakout', 'bear_bb_std_mult': 3.0508446761940275, 'bear_rsi_os': 25, 'bear_rsi_ob': 51, 'bear_adx_thresh': 20.775865818312806, 'bear_atr_min_pct': 0.014627365162452263, 'bear_atr_max_pct': 0.07313832937160743, 'bear_tp_mult': 2.574786363844577, 'bear_tsl_mult': 0.3948263757288113, 'bear_time_stop': 194, 'bear_use_sma': False, 'bear_use_ema': False, 'bear_use_atr': True, 'bear_use_adx': False, 'bear_use_spike': True, 'bear_rsi_required': False, 'sideways_strategy': 'mean_reversion', 'sideways_bb_std_mult': 1.7530816154382052, 'sideways_rsi_os': 27, 'sideways_rsi_ob': 82, 'sideways_adx_thresh': 32.47728899466293, 'sideways_atr_min_pct': 0.02345071611783346, 'sideways_atr_max_pct': 0.07008353310387018, 'sideways_tp_mult': 1.4764101291991072, 'sideways_tsl_mult': 0.34741027231782606, 'sideways_time_stop': 214, 'sideways_use_sma': True, 'sideways_use_ema': False, 'sideways_use_atr': True, 'sideways_use_adx': True, 'sideways_use_spike': False, 'sideways_rsi_required': True}.
[I 2025-08-31 11:51:08,109] Trial 435 finished with values: [-1000000000.0, 1000000000.0] and parameters: {'p_sma': 29, 'p_std': 17, 'p_atr': 15, 'p_adx': 26, 'rsi_period': 55, 'ema1': 11, 'ema2': 34, 'slip_atr_k': 0.10399195698556092, 'slip_spread_k': 0.4470145318257567, 'spread_hl_frac': 0.04146103099415761, 'bb_std_mult': 2.9135685679743686, 'rsi_os': 34, 'rsi_ob': 67, 'vol_spike': 0.22203803416076728, 'adx_thresh': 25.370132482125864, 'atr_min_pct': 0.004008438662074493, 'atr_max_pct': 0.09638145368130033, 'tp_mult': 1.0612799938337454, 'tsl_mult': 0.3257323762966802, 'strategy': 'breakout', 'time_stop': 291, 'use_sma': False, 'use_atr': True, 'use_adx': False, 'use_ema': False, 'use_spike': False, 'rsi_required': False, 'edge_k': 1.8506420178462921, 'edge_cap': 0.8343471037784396, 'bull_strategy': 'breakout', 'bull_bb_std_mult': 2.229663929454258, 'bull_rsi_os': 23, 'bull_rsi_ob': 62, 'bull_adx_thresh': 12.499813856067645, 'bull_atr_min_pct': 0.026753399256719088, 'bull_atr_max_pct': 0.14154012922958978, 'bull_tp_mult': 1.5525006019513419, 'bull_tsl_mult': 0.5815392328530494, 'bull_time_stop': 157, 'bull_use_sma': True, 'bull_use_ema': True, 'bull_use_atr': True, 'bull_use_adx': False, 'bull_use_spike': False, 'bull_rsi_required': True, 'bear_strategy': 'breakout', 'bear_bb_std_mult': 3.535387328623897, 'bear_rsi_os': 34, 'bear_rsi_ob': 51, 'bear_adx_thresh': 27.6660657972436, 'bear_atr_min_pct': 0.0245696623764112, 'bear_atr_max_pct': 0.11476785018035937, 'bear_tp_mult': 2.3036148565242645, 'bear_tsl_mult': 0.3938135282112627, 'bear_time_stop': 194, 'bear_use_sma': False, 'bear_use_ema': False, 'bear_use_atr': True, 'bear_use_adx': False, 'bear_use_spike': True, 'bear_rsi_required': False, 'sideways_strategy': 'mean_reversion', 'sideways_bb_std_mult': 3.344224177784465, 'sideways_rsi_os': 32, 'sideways_rsi_ob': 60, 'sideways_adx_thresh': 10.316504659377374, 'sideways_atr_min_pct': 0.0036492247473827876, 'sideways_atr_max_pct': 0.043373736061244623, 'sideways_tp_mult': 1.495024651569856, 'sideways_tsl_mult': 0.3450690352363605, 'sideways_time_stop': 72, 'sideways_use_sma': True, 'sideways_use_ema': False, 'sideways_use_atr': True, 'sideways_use_adx': True, 'sideways_use_spike': False, 'sideways_rsi_required': True}.
[I 2025-08-31 11:51:08,405] Trial 434 finished with values: [-0.05084620450569943, 0.050709745433354894] and parameters: {'p_sma': 31, 'p_std': 17, 'p_atr': 15, 'p_adx': 26, 'rsi_period': 43, 'ema1': 11, 'ema2': 34, 'slip_atr_k': 0.04013672827641709, 'slip_spread_k': 0.9784377027136526, 'spread_hl_frac': 0.0008097546640894364, 'bb_std_mult': 1.9332332161834307, 'rsi_os': 12, 'rsi_ob': 70, 'vol_spike': 0.1705123135627943, 'adx_thresh': 14.055329803816758, 'atr_min_pct': 0.02700776433957114, 'atr_max_pct': 0.09060759491562065, 'tp_mult': 1.2358949010613764, 'tsl_mult': 0.3192458598118003, 'strategy': 'breakout', 'time_stop': 290, 'use_sma': False, 'use_atr': True, 'use_adx': False, 'use_ema': False, 'use_spike': False, 'rsi_required': False, 'edge_k': 0.8746649097275219, 'edge_cap': 0.05111388022182539, 'bull_strategy': 'breakout', 'bull_bb_std_mult': 2.00832183622876, 'bull_rsi_os': 23, 'bull_rsi_ob': 62, 'bull_adx_thresh': 5.747108068386565, 'bull_atr_min_pct': 0.0018274603864556825, 'bull_atr_max_pct': 0.14106173966811617, 'bull_tp_mult': 1.5385131193236974, 'bull_tsl_mult': 0.30089240325293215, 'bull_time_stop': 138, 'bull_use_sma': True, 'bull_use_ema': True, 'bull_use_atr': True, 'bull_use_adx': False, 'bull_use_spike': False, 'bull_rsi_required': True, 'bear_strategy': 'breakout', 'bear_bb_std_mult': 1.7856074818737104, 'bear_rsi_os': 25, 'bear_rsi_ob': 93, 'bear_adx_thresh': 26.029152762787596, 'bear_atr_min_pct': 0.02675722682886275, 'bear_atr_max_pct': 0.11568039909202066, 'bear_tp_mult': 1.0882612619103615, 'bear_tsl_mult': 0.06109223909910899, 'bear_time_stop': 93, 'bear_use_sma': False, 'bear_use_ema': False, 'bear_use_atr': True, 'bear_use_adx': False, 'bear_use_spike': True, 'bear_rsi_required': False, 'sideways_strategy': 'mean_reversion', 'sideways_bb_std_mult': 2.0511267531468405, 'sideways_rsi_os': 30, 'sideways_rsi_ob': 73, 'sideways_adx_thresh': 10.222304783071818, 'sideways_atr_min_pct': 0.0034987058681986674, 'sideways_atr_max_pct': 0.04369951835499865, 'sideways_tp_mult': 1.5257348187533015, 'sideways_tsl_mult': 0.3520599393283373, 'sideways_time_stop': 238, 'sideways_use_sma': True, 'sideways_use_ema': False, 'sideways_use_atr': True, 'sideways_use_adx': True, 'sideways_use_spike': False, 'sideways_rsi_required': True}.
[I 2025-08-31 11:51:43,375] Trial 437 finished with values: [-1000000000.0, 1000000000.0] and parameters: {'p_sma': 31, 'p_std': 16, 'p_atr': 29, 'p_adx': 26, 'rsi_period': 11, 'ema1': 13, 'ema2': 36, 'slip_atr_k': 0.011716110725578904, 'slip_spread_k': 0.0659671961916744, 'spread_hl_frac': 0.0416126183248868, 'bb_std_mult': 0.6842702430139864, 'rsi_os': 30, 'rsi_ob': 73, 'vol_spike': 0.033996009707465594, 'adx_thresh': 33.92631449816221, 'atr_min_pct': 0.021185791143356676, 'atr_max_pct': 0.06579410205516278, 'tp_mult': 1.0630191380812573, 'tsl_mult': 0.27545171565839033, 'strategy': 'breakout', 'time_stop': 289, 'use_sma': False, 'use_atr': True, 'use_adx': True, 'use_ema': False, 'use_spike': True, 'rsi_required': True, 'edge_k': 0.2787100522809005, 'edge_cap': 0.7613826401873575, 'bull_strategy': 'breakout', 'bull_bb_std_mult': 2.1969047872746126, 'bull_rsi_os': 13, 'bull_rsi_ob': 61, 'bull_adx_thresh': 31.561980396666087, 'bull_atr_min_pct': 0.022774901989594927, 'bull_atr_max_pct': 0.1418895583288582, 'bull_tp_mult': 1.4438112737220232, 'bull_tsl_mult': 0.30329026229953154, 'bull_time_stop': 139, 'bull_use_sma': True, 'bull_use_ema': True, 'bull_use_atr': True, 'bull_use_adx': True, 'bull_use_spike': False, 'bull_rsi_required': True, 'bear_strategy': 'breakout', 'bear_bb_std_mult': 3.568756613734495, 'bear_rsi_os': 32, 'bear_rsi_ob': 56, 'bear_adx_thresh': 21.8543988569059, 'bear_atr_min_pct': 0.02677759694903277, 'bear_atr_max_pct': 0.11487178234218898, 'bear_tp_mult': 2.5727590554330884, 'bear_tsl_mult': 0.3863911917046678, 'bear_time_stop': 119, 'bear_use_sma': True, 'bear_use_ema': True, 'bear_use_atr': True, 'bear_use_adx': False, 'bear_use_spike': True, 'bear_rsi_required': False, 'sideways_strategy': 'mean_reversion', 'sideways_bb_std_mult': 1.7585306170692367, 'sideways_rsi_os': 43, 'sideways_rsi_ob': 73, 'sideways_adx_thresh': 8.826309048146735, 'sideways_atr_min_pct': 0.0040280485353258125, 'sideways_atr_max_pct': 0.04152963396236594, 'sideways_tp_mult': 1.493985641616532, 'sideways_tsl_mult': 0.3361854683258525, 'sideways_time_stop': 10, 'sideways_use_sma': True, 'sideways_use_ema': False, 'sideways_use_atr': True, 'sideways_use_adx': True, 'sideways_use_spike': True, 'sideways_rsi_required': True}.
[I 2025-08-31 11:51:43,846] Trial 438 finished with values: [-0.030992790700555828, 0.030683516727090878] and parameters: {'p_sma': 31, 'p_std': 18, 'p_atr': 13, 'p_adx': 26, 'rsi_period': 40, 'ema1': 13, 'ema2': 36, 'slip_atr_k': 0.1057928341501365, 'slip_spread_k': 0.8929872952199771, 'spread_hl_frac': 0.036824393159442796, 'bb_std_mult': 3.498407190181867, 'rsi_os': 28, 'rsi_ob': 73, 'vol_spike': 0.03501532159561828, 'adx_thresh': 12.477148542585608, 'atr_min_pct': 0.0033604549736551614, 'atr_max_pct': 0.014928672316856647, 'tp_mult': 1.0684535451337747, 'tsl_mult': 0.4444136435937204, 'strategy': 'breakout', 'time_stop': 160, 'use_sma': False, 'use_atr': True, 'use_adx': True, 'use_ema': False, 'use_spike': True, 'rsi_required': True, 'edge_k': 0.3365898404118657, 'edge_cap': 0.6398776030928294, 'bull_strategy': 'breakout', 'bull_bb_std_mult': 2.190802886858955, 'bull_rsi_os': 35, 'bull_rsi_ob': 61, 'bull_adx_thresh': 24.258118187872725, 'bull_atr_min_pct': 0.001879227273528114, 'bull_atr_max_pct': 0.14126126731672817, 'bull_tp_mult': 1.4473978317198177, 'bull_tsl_mult': 0.6085230439205813, 'bull_time_stop': 131, 'bull_use_sma': True, 'bull_use_ema': True, 'bull_use_atr': True, 'bull_use_adx': True, 'bull_use_spike': False, 'bull_rsi_required': True, 'bear_strategy': 'breakout', 'bear_bb_std_mult': 2.8737732431403664, 'bear_rsi_os': 32, 'bear_rsi_ob': 69, 'bear_adx_thresh': 27.650661043833693, 'bear_atr_min_pct': 0.012666263412293361, 'bear_atr_max_pct': 0.012783113304377924, 'bear_tp_mult': 2.723027813316881, 'bear_tsl_mult': 0.3790408211523962, 'bear_time_stop': 96, 'bear_use_sma': True, 'bear_use_ema': True, 'bear_use_atr': True, 'bear_use_adx': False, 'bear_use_spike': True, 'bear_rsi_required': False, 'sideways_strategy': 'breakout', 'sideways_bb_std_mult': 3.3564183695635057, 'sideways_rsi_os': 15, 'sideways_rsi_ob': 73, 'sideways_adx_thresh': 8.919389789848703, 'sideways_atr_min_pct': 0.002914421604589301, 'sideways_atr_max_pct': 0.08992027641723017, 'sideways_tp_mult': 1.5027882998954114, 'sideways_tsl_mult': 0.3241022648691843, 'sideways_time_stop': 10, 'sideways_use_sma': True, 'sideways_use_ema': False, 'sideways_use_atr': False, 'sideways_use_adx': True, 'sideways_use_spike': True, 'sideways_rsi_required': True}.
[I 2025-08-31 11:51:44,055] Trial 440 finished with values: [-1000000000.0, 1000000000.0] and parameters: {'p_sma': 57, 'p_std': 28, 'p_atr': 13, 'p_adx': 27, 'rsi_period': 40, 'ema1': 13, 'ema2': 36, 'slip_atr_k': 0.012192988274861608, 'slip_spread_k': 0.8521890512268148, 'spread_hl_frac': 0.0033033029648112406, 'bb_std_mult': 0.7139969686054194, 'rsi_os': 28, 'rsi_ob': 73, 'vol_spike': 0.12733269426844926, 'adx_thresh': 26.815396210307274, 'atr_min_pct': 0.013915858126898837, 'atr_max_pct': 0.06590037227879583, 'tp_mult': 1.0123423574137507, 'tsl_mult': 0.2770921069887095, 'strategy': 'breakout', 'time_stop': 283, 'use_sma': False, 'use_atr': True, 'use_adx': True, 'use_ema': False, 'use_spike': True, 'rsi_required': True, 'edge_k': 0.9818389719044915, 'edge_cap': 0.7692635419180869, 'bull_strategy': 'breakout', 'bull_bb_std_mult': 3.3029962883175212, 'bull_rsi_os': 35, 'bull_rsi_ob': 61, 'bull_adx_thresh': 16.023100525453, 'bull_atr_min_pct': 0.008879798550662543, 'bull_atr_max_pct': 0.1374376351698887, 'bull_tp_mult': 1.4361211158929326, 'bull_tsl_mult': 0.8894533774198082, 'bull_time_stop': 132, 'bull_use_sma': True, 'bull_use_ema': True, 'bull_use_atr': True, 'bull_use_adx': True, 'bull_use_spike': False, 'bull_rsi_required': True, 'bear_strategy': 'breakout', 'bear_bb_std_mult': 2.8714046828372704, 'bear_rsi_os': 31, 'bear_rsi_ob': 76, 'bear_adx_thresh': 10.485672139561734, 'bear_atr_min_pct': 0.015585183618307226, 'bear_atr_max_pct': 0.10264273983929972, 'bear_tp_mult': 1.4915262229853767, 'bear_tsl_mult': 0.32159139532627673, 'bear_time_stop': 121, 'bear_use_sma': True, 'bear_use_ema': True, 'bear_use_atr': True, 'bear_use_adx': False, 'bear_use_spike': True, 'bear_rsi_required': True, 'sideways_strategy': 'breakout', 'sideways_bb_std_mult': 2.1281939052466123, 'sideways_rsi_os': 55, 'sideways_rsi_ob': 74, 'sideways_adx_thresh': 8.867001734560311, 'sideways_atr_min_pct': 0.00902871909486443, 'sideways_atr_max_pct': 0.027207965671820385, 'sideways_tp_mult': 1.6020672744123887, 'sideways_tsl_mult': 0.38253410363033713, 'sideways_time_stop': 10, 'sideways_use_sma': True, 'sideways_use_ema': False, 'sideways_use_atr': False, 'sideways_use_adx': True, 'sideways_use_spike': True, 'sideways_rsi_required': False}.
[I 2025-08-31 11:51:44,403] Trial 439 finished with values: [-0.042381638890515716, 0.04223762212646779] and parameters: {'p_sma': 31, 'p_std': 20, 'p_atr': 13, 'p_adx': 26, 'rsi_period': 14, 'ema1': 7, 'ema2': 36, 'slip_atr_k': 0.04274327986427183, 'slip_spread_k': 0.06902701731478093, 'spread_hl_frac': 0.0010337816408597172, 'bb_std_mult': 0.6106571347481812, 'rsi_os': 29, 'rsi_ob': 48, 'vol_spike': 0.035550469420134456, 'adx_thresh': 15.624408987066364, 'atr_min_pct': 0.0210115363239941, 'atr_max_pct': 0.12715727615907657, 'tp_mult': 2.0366644197746933, 'tsl_mult': 0.8889769604152749, 'strategy': 'breakout', 'time_stop': 285, 'use_sma': False, 'use_atr': True, 'use_adx': True, 'use_ema': False, 'use_spike': True, 'rsi_required': True, 'edge_k': 0.34010696752856306, 'edge_cap': 0.4067556228659279, 'bull_strategy': 'breakout', 'bull_bb_std_mult': 2.8617568193672946, 'bull_rsi_os': 13, 'bull_rsi_ob': 93, 'bull_adx_thresh': 24.274384165369874, 'bull_atr_min_pct': 0.029862104995169808, 'bull_atr_max_pct': 0.10244485797541789, 'bull_tp_mult': 1.451793912720796, 'bull_tsl_mult': 0.28486054254653, 'bull_time_stop': 138, 'bull_use_sma': True, 'bull_use_ema': True, 'bull_use_atr': True, 'bull_use_adx': True, 'bull_use_spike': False, 'bull_rsi_required': True, 'bear_strategy': 'breakout', 'bear_bb_std_mult': 1.0935213836547335, 'bear_rsi_os': 32, 'bear_rsi_ob': 76, 'bear_adx_thresh': 18.113899553211567, 'bear_atr_min_pct': 0.01575702010602618, 'bear_atr_max_pct': 0.012935372088855979, 'bear_tp_mult': 2.7418816458254356, 'bear_tsl_mult': 0.3760790128113832, 'bear_time_stop': 119, 'bear_use_sma': True, 'bear_use_ema': True, 'bear_use_atr': True, 'bear_use_adx': False, 'bear_use_spike': True, 'bear_rsi_required': False, 'sideways_strategy': 'breakout', 'sideways_bb_std_mult': 1.8185614954555087, 'sideways_rsi_os': 30, 'sideways_rsi_ob': 73, 'sideways_adx_thresh': 8.918451266635213, 'sideways_atr_min_pct': 0.002676719619159794, 'sideways_atr_max_pct': 0.02734737340170114, 'sideways_tp_mult': 1.541107340082544, 'sideways_tsl_mult': 0.3180196497526554, 'sideways_time_stop': 10, 'sideways_use_sma': True, 'sideways_use_ema': False, 'sideways_use_atr': False, 'sideways_use_adx': True, 'sideways_use_spike': True, 'sideways_rsi_required': False}.
