[I 2025-08-31 11:12:43,528] Trial 127 finished with values: [-0.01805378390024248, 0.018780122411086033] and parameters: {'p_sma': 41, 'p_std': 39, 'p_atr': 19, 'p_adx': 21, 'rsi_period': 55, 'ema1': 14, 'ema2': 16, 'slip_atr_k': 0.06082747626100912, 'slip_spread_k': 0.7545766055969115, 'spread_hl_frac': 0.019881256697364263, 'bb_std_mult': 3.0776013253757157, 'rsi_os': 40, 'rsi_ob': 90, 'vol_spike': 0.10753537161506344, 'adx_thresh': 29.124916015620666, 'atr_min_pct': 0.0009245068180814894, 'atr_max_pct': 0.14702059796530723, 'tp_mult': 1.138019333455213, 'tsl_mult': 0.1479203503028953, 'strategy': 'breakout', 'time_stop': 273, 'use_sma': False, 'use_atr': False, 'use_adx': True, 'use_ema': False, 'use_spike': False, 'rsi_required': True, 'edge_k': 0.3900152327695815, 'edge_cap': 0.8639188701960793, 'bull_strategy': 'breakout', 'bull_bb_std_mult': 2.8488004521501065, 'bull_rsi_os': 19, 'bull_rsi_ob': 69, 'bull_adx_thresh': 11.077151876112243, 'bull_atr_min_pct': 0.017517947027538498, 'bull_atr_max_pct': 0.06645328385243521, 'bull_tp_mult': 1.6197465754365792, 'bull_tsl_mult': 0.3568800723132626, 'bull_time_stop': 209, 'bull_use_sma': True, 'bull_use_ema': False, 'bull_use_atr': True, 'bull_use_adx': True, 'bull_use_spike': False, 'bull_rsi_required': True, 'bear_strategy': 'breakout', 'bear_bb_std_mult': 0.6011248149647922, 'bear_rsi_os': 15, 'bear_rsi_ob': 57, 'bear_adx_thresh': 34.477504011607415, 'bear_atr_min_pct': 0.004654421790752441, 'bear_atr_max_pct': 0.04538546748426777, 'bear_tp_mult': 2.501613535332593, 'bear_tsl_mult': 0.4428284422416581, 'bear_time_stop': 92, 'bear_use_sma': True, 'bear_use_ema': False, 'bear_use_atr': True, 'bear_use_adx': True, 'bear_use_spike': True, 'bear_rsi_required': False, 'sideways_strategy': 'breakout', 'sideways_bb_std_mult': 0.9246701082916507, 'sideways_rsi_os': 33, 'sideways_rsi_ob': 72, 'sideways_adx_thresh': 7.189200917408582, 'sideways_atr_min_pct': 0.0014759298525285466, 'sideways_atr_max_pct': 0.024817039111403653, 'sideways_tp_mult': 2.1698447370450165, 'sideways_tsl_mult': 0.6004253396209275, 'sideways_time_stop': 26, 'sideways_use_sma': False, 'sideways_use_ema': True, 'sideways_use_atr': False, 'sideways_use_adx': False, 'sideways_use_spike': False, 'sideways_rsi_required': True}.
[I 2025-08-31 11:12:43,726] Trial 128 finished with values: [-1000000000.0, 1000000000.0] and parameters: {'p_sma': 41, 'p_std': 35, 'p_atr': 16, 'p_adx': 21, 'rsi_period': 61, 'ema1': 14, 'ema2': 17, 'slip_atr_k': 0.057510557890762655, 'slip_spread_k': 0.7524592996935415, 'spread_hl_frac': 0.024012346506792737, 'bb_std_mult': 3.0407695864974964, 'rsi_os': 35, 'rsi_ob': 90, 'vol_spike': 0.1082322758714724, 'adx_thresh': 29.858825657036505, 'atr_min_pct': 0.0008366819758417591, 'atr_max_pct': 0.14602040096836943, 'tp_mult': 1.1186375297960416, 'tsl_mult': 0.08920399784901786, 'strategy': 'breakout', 'time_stop': 260, 'use_sma': False, 'use_atr': False, 'use_adx': True, 'use_ema': False, 'use_spike': False, 'rsi_required': True, 'edge_k': 0.3894700392944147, 'edge_cap': 0.8284705847087112, 'bull_strategy': 'breakout', 'bull_bb_std_mult': 2.838782721478473, 'bull_rsi_os': 19, 'bull_rsi_ob': 67, 'bull_adx_thresh': 7.8751400371988485, 'bull_atr_min_pct': 0.017271639519077012, 'bull_atr_max_pct': 0.06818311754221432, 'bull_tp_mult': 1.6697674608681987, 'bull_tsl_mult': 0.4121121395408191, 'bull_time_stop': 163, 'bull_use_sma': True, 'bull_use_ema': False, 'bull_use_atr': True, 'bull_use_adx': True, 'bull_use_spike': False, 'bull_rsi_required': True, 'bear_strategy': 'breakout', 'bear_bb_std_mult': 0.5687938084060016, 'bear_rsi_os': 15, 'bear_rsi_ob': 56, 'bear_adx_thresh': 34.36380209133729, 'bear_atr_min_pct': 0.004320914879838857, 'bear_atr_max_pct': 0.05889198591803478, 'bear_tp_mult': 2.5997826000600535, 'bear_tsl_mult': 0.4474197924289287, 'bear_time_stop': 56, 'bear_use_sma': True, 'bear_use_ema': False, 'bear_use_atr': True, 'bear_use_adx': True, 'bear_use_spike': True, 'bear_rsi_required': False, 'sideways_strategy': 'breakout', 'sideways_bb_std_mult': 0.9258409284364303, 'sideways_rsi_os': 31, 'sideways_rsi_ob': 73, 'sideways_adx_thresh': 7.079763118221205, 'sideways_atr_min_pct': 0.0015486520390036208, 'sideways_atr_max_pct': 0.02432089375394008, 'sideways_tp_mult': 2.1103915787330143, 'sideways_tsl_mult': 0.6044263701915737, 'sideways_time_stop': 10, 'sideways_use_sma': False, 'sideways_use_ema': True, 'sideways_use_atr': False, 'sideways_use_adx': False, 'sideways_use_spike': False, 'sideways_rsi_required': True}.
[I 2025-08-31 11:12:43,842] Trial 129 finished with values: [-0.012231596624086127, 0.014496409928414103] and parameters: {'p_sma': 41, 'p_std': 39, 'p_atr': 17, 'p_adx': 21, 'rsi_period': 54, 'ema1': 14, 'ema2': 17, 'slip_atr_k': 0.06039436319823256, 'slip_spread_k': 0.7620761329593353, 'spread_hl_frac': 0.01971019941277476, 'bb_std_mult': 2.7030512712450228, 'rsi_os': 38, 'rsi_ob': 91, 'vol_spike': 0.10479908993605565, 'adx_thresh': 30.171962620990875, 'atr_min_pct': 0.00091742531489808, 'atr_max_pct': 0.14698710692806907, 'tp_mult': 1.0756422588211916, 'tsl_mult': 0.08880896554268783, 'strategy': 'breakout', 'time_stop': 274, 'use_sma': False, 'use_atr': False, 'use_adx': True, 'use_ema': False, 'use_spike': False, 'rsi_required': True, 'edge_k': 0.2932033306616534, 'edge_cap': 0.8457746722200447, 'bull_strategy': 'breakout', 'bull_bb_std_mult': 2.835687143410268, 'bull_rsi_os': 19, 'bull_rsi_ob': 67, 'bull_adx_thresh': 7.803795877645481, 'bull_atr_min_pct': 0.01746980205893575, 'bull_atr_max_pct': 0.05395746220470909, 'bull_tp_mult': 1.6605725470202397, 'bull_tsl_mult': 0.3769583995073056, 'bull_time_stop': 187, 'bull_use_sma': True, 'bull_use_ema': False, 'bull_use_atr': True, 'bull_use_adx': True, 'bull_use_spike': False, 'bull_rsi_required': True, 'bear_strategy': 'breakout', 'bear_bb_std_mult': 0.5924401714976721, 'bear_rsi_os': 15, 'bear_rsi_ob': 57, 'bear_adx_thresh': 34.24928802983261, 'bear_atr_min_pct': 0.004345267445555214, 'bear_atr_max_pct': 0.06021512795341792, 'bear_tp_mult': 2.5822923651874503, 'bear_tsl_mult': 0.34128945827099944, 'bear_time_stop': 61, 'bear_use_sma': True, 'bear_use_ema': False, 'bear_use_atr': True, 'bear_use_adx': True, 'bear_use_spike': True, 'bear_rsi_required': False, 'sideways_strategy': 'breakout', 'sideways_bb_std_mult': 0.9645887679275073, 'sideways_rsi_os': 31, 'sideways_rsi_ob': 73, 'sideways_adx_thresh': 5.488213460908255, 'sideways_atr_min_pct': 0.001241755731461006, 'sideways_atr_max_pct': 0.024405247185713023, 'sideways_tp_mult': 2.134067722783225, 'sideways_tsl_mult': 0.5975852667693697, 'sideways_time_stop': 10, 'sideways_use_sma': False, 'sideways_use_ema': True, 'sideways_use_atr': False, 'sideways_use_adx': False, 'sideways_use_spike': False, 'sideways_rsi_required': True}.
[I 2025-08-31 11:12:43,925] Trial 126 finished with values: [-0.029328433123220976, 0.02928697026334828] and parameters: {'p_sma': 42, 'p_std': 36, 'p_atr': 19, 'p_adx': 21, 'rsi_period': 55, 'ema1': 16, 'ema2': 17, 'slip_atr_k': 0.06622519980348632, 'slip_spread_k': 0.7589115959675932, 'spread_hl_frac': 0.019342133660477705, 'bb_std_mult': 2.8466771184844686, 'rsi_os': 38, 'rsi_ob': 93, 'vol_spike': 0.10951171530852939, 'adx_thresh': 29.972874360182864, 'atr_min_pct': 0.0008560357909382027, 'atr_max_pct': 0.14995251373244994, 'tp_mult': 1.0678187602829434, 'tsl_mult': 0.08929629336156153, 'strategy': 'breakout', 'time_stop': 258, 'use_sma': False, 'use_atr': False, 'use_adx': True, 'use_ema': False, 'use_spike': False, 'rsi_required': True, 'edge_k': 0.2996717995344119, 'edge_cap': 0.8115072461363987, 'bull_strategy': 'breakout', 'bull_bb_std_mult': 2.8552843201853855, 'bull_rsi_os': 19, 'bull_rsi_ob': 68, 'bull_adx_thresh': 11.25558024529184, 'bull_atr_min_pct': 0.017287400458441963, 'bull_atr_max_pct': 0.06677658904306177, 'bull_tp_mult': 1.6786899752294842, 'bull_tsl_mult': 0.3333818540709833, 'bull_time_stop': 212, 'bull_use_sma': True, 'bull_use_ema': False, 'bull_use_atr': True, 'bull_use_adx': True, 'bull_use_spike': False, 'bull_rsi_required': True, 'bear_strategy': 'breakout', 'bear_bb_std_mult': 0.5159060352894094, 'bear_rsi_os': 15, 'bear_rsi_ob': 57, 'bear_adx_thresh': 34.2619498695082, 'bear_atr_min_pct': 0.004136656424602393, 'bear_atr_max_pct': 0.05406008017764674, 'bear_tp_mult': 2.490067576817676, 'bear_tsl_mult': 0.43817977627381005, 'bear_time_stop': 81, 'bear_use_sma': True, 'bear_use_ema': False, 'bear_use_atr': True, 'bear_use_adx': True, 'bear_use_spike': True, 'bear_rsi_required': False, 'sideways_strategy': 'breakout', 'sideways_bb_std_mult': 0.922575662218068, 'sideways_rsi_os': 34, 'sideways_rsi_ob': 73, 'sideways_adx_thresh': 6.259356813560728, 'sideways_atr_min_pct': 0.000990471225798412, 'sideways_atr_max_pct': 0.024458981477916867, 'sideways_tp_mult': 2.2766403783210136, 'sideways_tsl_mult': 0.7044044790993297, 'sideways_time_stop': 11, 'sideways_use_sma': False, 'sideways_use_ema': True, 'sideways_use_atr': False, 'sideways_use_adx': False, 'sideways_use_spike': False, 'sideways_rsi_required': True}.
[I 2025-08-31 11:13:15,474] Trial 130 finished with values: [-0.008898347573542242, 0.012374247126042077] and parameters: {'p_sma': 41, 'p_std': 40, 'p_atr': 17, 'p_adx': 21, 'rsi_period': 53, 'ema1': 15, 'ema2': 17, 'slip_atr_k': 0.058968278292295034, 'slip_spread_k': 0.7121159769442263, 'spread_hl_frac': 0.019279662606524677, 'bb_std_mult': 2.6846878601300763, 'rsi_os': 38, 'rsi_ob': 90, 'vol_spike': 0.10934822798733912, 'adx_thresh': 30.234643594973566, 'atr_min_pct': 0.0006649306449687421, 'atr_max_pct': 0.14714219680662383, 'tp_mult': 1.105987722317679, 'tsl_mult': 0.0934120367063363, 'strategy': 'breakout', 'time_stop': 298, 'use_sma': False, 'use_atr': False, 'use_adx': True, 'use_ema': False, 'use_spike': False, 'rsi_required': True, 'edge_k': 0.28946031776090275, 'edge_cap': 0.8497716651923157, 'bull_strategy': 'breakout', 'bull_bb_std_mult': 2.849295850284045, 'bull_rsi_os': 20, 'bull_rsi_ob': 64, 'bull_adx_thresh': 9.863462293098845, 'bull_atr_min_pct': 0.01642666309672953, 'bull_atr_max_pct': 0.06621369355518589, 'bull_tp_mult': 1.673687332375528, 'bull_tsl_mult': 0.35446030456134375, 'bull_time_stop': 164, 'bull_use_sma': True, 'bull_use_ema': False, 'bull_use_atr': True, 'bull_use_adx': True, 'bull_use_spike': False, 'bull_rsi_required': True, 'bear_strategy': 'breakout', 'bear_bb_std_mult': 0.5912389822495339, 'bear_rsi_os': 15, 'bear_rsi_ob': 58, 'bear_adx_thresh': 34.24549928388061, 'bear_atr_min_pct': 0.0044412674328352265, 'bear_atr_max_pct': 0.06120451432698234, 'bear_tp_mult': 2.588546820936968, 'bear_tsl_mult': 0.429348631442093, 'bear_time_stop': 61, 'bear_use_sma': True, 'bear_use_ema': False, 'bear_use_atr': True, 'bear_use_adx': True, 'bear_use_spike': True, 'bear_rsi_required': False, 'sideways_strategy': 'breakout', 'sideways_bb_std_mult': 1.1766039244649669, 'sideways_rsi_os': 31, 'sideways_rsi_ob': 70, 'sideways_adx_thresh': 7.256428322475292, 'sideways_atr_min_pct': 0.00152288593121867, 'sideways_atr_max_pct': 0.023829272305335252, 'sideways_tp_mult': 2.1080123177786807, 'sideways_tsl_mult': 0.6139475641493967, 'sideways_time_stop': 27, 'sideways_use_sma': False, 'sideways_use_ema': True, 'sideways_use_atr': False, 'sideways_use_adx': False, 'sideways_use_spike': False, 'sideways_rsi_required': True}.
[I 2025-08-31 11:13:15,707] Trial 132 finished with values: [-1000000000.0, 1000000000.0] and parameters: {'p_sma': 43, 'p_std': 40, 'p_atr': 19, 'p_adx': 19, 'rsi_period': 53, 'ema1': 15, 'ema2': 14, 'slip_atr_k': 0.04775874508437654, 'slip_spread_k': 0.7135119406423738, 'spread_hl_frac': 0.019381622396742976, 'bb_std_mult': 2.7190176059552114, 'rsi_os': 38, 'rsi_ob': 91, 'vol_spike': 0.09752892816867542, 'adx_thresh': 28.51807901542802, 'atr_min_pct': 0.0005068692354140018, 'atr_max_pct': 0.14773150187287365, 'tp_mult': 1.0501680687504098, 'tsl_mult': 0.10058664597212968, 'strategy': 'breakout', 'time_stop': 299, 'use_sma': False, 'use_atr': False, 'use_adx': True, 'use_ema': False, 'use_spike': False, 'rsi_required': True, 'edge_k': 0.44779782359445053, 'edge_cap': 0.8914809352237163, 'bull_strategy': 'breakout', 'bull_bb_std_mult': 2.9536286033856713, 'bull_rsi_os': 19, 'bull_rsi_ob': 72, 'bull_adx_thresh': 6.446288462913732, 'bull_atr_min_pct': 0.019891529948923736, 'bull_atr_max_pct': 0.06611566546521214, 'bull_tp_mult': 1.5870729662362737, 'bull_tsl_mult': 0.39396963247024414, 'bull_time_stop': 211, 'bull_use_sma': True, 'bull_use_ema': False, 'bull_use_atr': True, 'bull_use_adx': True, 'bull_use_spike': False, 'bull_rsi_required': True, 'bear_strategy': 'breakout', 'bear_bb_std_mult': 0.6377112564071769, 'bear_rsi_os': 13, 'bear_rsi_ob': 60, 'bear_adx_thresh': 34.8353913185999, 'bear_atr_min_pct': 0.0051273089129788355, 'bear_atr_max_pct': 0.04542096197956167, 'bear_tp_mult': 2.5130435706760097, 'bear_tsl_mult': 0.377767196661814, 'bear_time_stop': 68, 'bear_use_sma': True, 'bear_use_ema': False, 'bear_use_atr': True, 'bear_use_adx': True, 'bear_use_spike': True, 'bear_rsi_required': False, 'sideways_strategy': 'breakout', 'sideways_bb_std_mult': 0.8407252532933909, 'sideways_rsi_os': 29, 'sideways_rsi_ob': 71, 'sideways_adx_thresh': 6.320879862315433, 'sideways_atr_min_pct': 0.0014791119679618927, 'sideways_atr_max_pct': 0.012642707644983292, 'sideways_tp_mult': 2.2835356913873635, 'sideways_tsl_mult': 0.574187623684241, 'sideways_time_stop': 23, 'sideways_use_sma': False, 'sideways_use_ema': True, 'sideways_use_atr': False, 'sideways_use_adx': False, 'sideways_use_spike': False, 'sideways_rsi_required': True}.
[I 2025-08-31 11:13:15,805] Trial 133 finished with values: [-0.027360185462181108, 0.027503244226041577] and parameters: {'p_sma': 43, 'p_std': 40, 'p_atr': 17, 'p_adx': 19, 'rsi_period': 47, 'ema1': 17, 'ema2': 14, 'slip_atr_k': 0.058278248323074024, 'slip_spread_k': 0.7131421417987283, 'spread_hl_frac': 0.020163418442176534, 'bb_std_mult': 2.712139586086972, 'rsi_os': 37, 'rsi_ob': 91, 'vol_spike': 0.09581520018966903, 'adx_thresh': 28.612628524565473, 'atr_min_pct': 0.003192105876818227, 'atr_max_pct': 0.13753300743720545, 'tp_mult': 1.071099872649041, 'tsl_mult': 0.15406099938550366, 'strategy': 'breakout', 'time_stop': 289, 'use_sma': False, 'use_atr': False, 'use_adx': True, 'use_ema': False, 'use_spike': False, 'rsi_required': True, 'edge_k': 0.4483225426085255, 'edge_cap': 0.8630690727331569, 'bull_strategy': 'breakout', 'bull_bb_std_mult': 2.7293072850111795, 'bull_rsi_os': 19, 'bull_rsi_ob': 70, 'bull_adx_thresh': 7.38320048078444, 'bull_atr_min_pct': 0.016265596200957765, 'bull_atr_max_pct': 0.07557196686441824, 'bull_tp_mult': 1.5032086078981677, 'bull_tsl_mult': 0.38216882708813815, 'bull_time_stop': 186, 'bull_use_sma': True, 'bull_use_ema': False, 'bull_use_atr': True, 'bull_use_adx': True, 'bull_use_spike': False, 'bull_rsi_required': True, 'bear_strategy': 'breakout', 'bear_bb_std_mult': 0.6523775778430548, 'bear_rsi_os': 13, 'bear_rsi_ob': 60, 'bear_adx_thresh': 33.96735439410394, 'bear_atr_min_pct': 0.005144962117147884, 'bear_atr_max_pct': 0.04467667989474026, 'bear_tp_mult': 2.569197822855436, 'bear_tsl_mult': 0.3914458927187812, 'bear_time_stop': 68, 'bear_use_sma': True, 'bear_use_ema': False, 'bear_use_atr': True, 'bear_use_adx': True, 'bear_use_spike': True, 'bear_rsi_required': False, 'sideways_strategy': 'breakout', 'sideways_bb_std_mult': 1.1958604976110345, 'sideways_rsi_os': 33, 'sideways_rsi_ob': 71, 'sideways_adx_thresh': 5.088841882699389, 'sideways_atr_min_pct': 0.0014998782590471662, 'sideways_atr_max_pct': 0.011689862966718291, 'sideways_tp_mult': 2.0112360299726957, 'sideways_tsl_mult': 0.5745137358665932, 'sideways_time_stop': 21, 'sideways_use_sma': False, 'sideways_use_ema': True, 'sideways_use_atr': False, 'sideways_use_adx': False, 'sideways_use_spike': False, 'sideways_rsi_required': True}.
[I 2025-08-31 11:13:15,894] Trial 131 finished with values: [-0.02435637872031926, 0.024890971936095362] and parameters: {'p_sma': 42, 'p_std': 39, 'p_atr': 17, 'p_adx': 21, 'rsi_period': 55, 'ema1': 15, 'ema2': 17, 'slip_atr_k': 0.04800130095020229, 'slip_spread_k': 0.714937793597341, 'spread_hl_frac': 0.019428718264657426, 'bb_std_mult': 2.550276227093487, 'rsi_os': 38, 'rsi_ob': 91, 'vol_spike': 0.10819733516485239, 'adx_thresh': 29.0169258164142, 'atr_min_pct': 0.0010891227794846967, 'atr_max_pct': 0.14934850821012507, 'tp_mult': 1.0524841692992157, 'tsl_mult': 0.15170740892408952, 'strategy': 'breakout', 'time_stop': 295, 'use_sma': False, 'use_atr': False, 'use_adx': True, 'use_ema': False, 'use_spike': False, 'rsi_required': True, 'edge_k': 0.2894044618466157, 'edge_cap': 0.8747410246639754, 'bull_strategy': 'breakout', 'bull_bb_std_mult': 2.889082148444596, 'bull_rsi_os': 19, 'bull_rsi_ob': 72, 'bull_adx_thresh': 11.296394028371914, 'bull_atr_min_pct': 0.01649332872157115, 'bull_atr_max_pct': 0.0657356594015022, 'bull_tp_mult': 1.432437188506626, 'bull_tsl_mult': 0.3620762990722101, 'bull_time_stop': 197, 'bull_use_sma': True, 'bull_use_ema': False, 'bull_use_atr': True, 'bull_use_adx': True, 'bull_use_spike': False, 'bull_rsi_required': True, 'bear_strategy': 'breakout', 'bear_bb_std_mult': 0.628583616583172, 'bear_rsi_os': 13, 'bear_rsi_ob': 60, 'bear_adx_thresh': 34.753309647470616, 'bear_atr_min_pct': 0.0038289556843191987, 'bear_atr_max_pct': 0.04374079960854663, 'bear_tp_mult': 2.5041712127621487, 'bear_tsl_mult': 0.3393237115798914, 'bear_time_stop': 64, 'bear_use_sma': True, 'bear_use_ema': False, 'bear_use_atr': True, 'bear_use_adx': True, 'bear_use_spike': True, 'bear_rsi_required': False, 'sideways_strategy': 'breakout', 'sideways_bb_std_mult': 0.7950059848070201, 'sideways_rsi_os': 33, 'sideways_rsi_ob': 71, 'sideways_adx_thresh': 6.341122873435131, 'sideways_atr_min_pct': 0.0008565944961836912, 'sideways_atr_max_pct': 0.013104319345730215, 'sideways_tp_mult': 2.159795126239675, 'sideways_tsl_mult': 0.5783674601989333, 'sideways_time_stop': 27, 'sideways_use_sma': False, 'sideways_use_ema': True, 'sideways_use_atr': False, 'sideways_use_adx': False, 'sideways_use_spike': False, 'sideways_rsi_required': True}.
[I 2025-08-31 11:13:47,254] Trial 137 finished with values: [-1000000000.0, 1000000000.0] and parameters: {'p_sma': 47, 'p_std': 42, 'p_atr': 16, 'p_adx': 22, 'rsi_period': 45, 'ema1': 15, 'ema2': 16, 'slip_atr_k': 0.059293276621291593, 'slip_spread_k': 0.7009113862739474, 'spread_hl_frac': 0.017856933613982374, 'bb_std_mult': 2.494953520899343, 'rsi_os': 40, 'rsi_ob': 88, 'vol_spike': 0.13016200306225179, 'adx_thresh': 29.12734692900502, 'atr_min_pct': 0.002838021127716408, 'atr_max_pct': 0.149687178389053, 'tp_mult': 1.1522838110561697, 'tsl_mult': 0.1391128322878522, 'strategy': 'breakout', 'time_stop': 292, 'use_sma': False, 'use_atr': True, 'use_adx': False, 'use_ema': False, 'use_spike': True, 'rsi_required': True, 'edge_k': 0.26384376146202454, 'edge_cap': 0.8707158979065001, 'bull_strategy': 'breakout', 'bull_bb_std_mult': 3.1436001465902756, 'bull_rsi_os': 22, 'bull_rsi_ob': 62, 'bull_adx_thresh': 11.173894154846852, 'bull_atr_min_pct': 0.016429656955762748, 'bull_atr_max_pct': 0.06037492109085202, 'bull_tp_mult': 1.4850832026734206, 'bull_tsl_mult': 0.35200336953279376, 'bull_time_stop': 159, 'bull_use_sma': True, 'bull_use_ema': True, 'bull_use_atr': True, 'bull_use_adx': True, 'bull_use_spike': False, 'bull_rsi_required': False, 'bear_strategy': 'breakout', 'bear_bb_std_mult': 0.9345633691537372, 'bear_rsi_os': 55, 'bear_rsi_ob': 62, 'bear_adx_thresh': 34.05613666094542, 'bear_atr_min_pct': 0.006524028193531145, 'bear_atr_max_pct': 0.061898113695590624, 'bear_tp_mult': 2.688609057599699, 'bear_tsl_mult': 0.5000290176428558, 'bear_time_stop': 35, 'bear_use_sma': True, 'bear_use_ema': True, 'bear_use_atr': True, 'bear_use_adx': True, 'bear_use_spike': True, 'bear_rsi_required': False, 'sideways_strategy': 'mean_reversion', 'sideways_bb_std_mult': 1.038446909264333, 'sideways_rsi_os': 30, 'sideways_rsi_ob': 62, 'sideways_adx_thresh': 8.590248819180779, 'sideways_atr_min_pct': 0.018135326015255127, 'sideways_atr_max_pct': 0.031340363793555, 'sideways_tp_mult': 2.001814858614505, 'sideways_tsl_mult': 0.5098364362761525, 'sideways_time_stop': 199, 'sideways_use_sma': False, 'sideways_use_ema': False, 'sideways_use_atr': False, 'sideways_use_adx': True, 'sideways_use_spike': True, 'sideways_rsi_required': False}.
