[I 2025-08-31 11:40:14,466] Trial 350 finished with values: [-1000000000.0, 1000000000.0] and parameters: {'p_sma': 31, 'p_std': 43, 'p_atr': 14, 'p_adx': 25, 'rsi_period': 36, 'ema1': 25, 'ema2': 38, 'slip_atr_k': 0.0467894756703642, 'slip_spread_k': 0.2612331555530044, 'spread_hl_frac': 0.0020020001986122745, 'bb_std_mult': 0.7695600464455726, 'rsi_os': 30, 'rsi_ob': 54, 'vol_spike': 0.26110800990745625, 'adx_thresh': 24.9612541696255, 'atr_min_pct': 0.0033063731268641993, 'atr_max_pct': 0.028050703452114023, 'tp_mult': 1.6364884342174122, 'tsl_mult': 0.4137181209752167, 'strategy': 'breakout', 'time_stop': 224, 'use_sma': False, 'use_atr': False, 'use_adx': True, 'use_ema': False, 'use_spike': True, 'rsi_required': False, 'edge_k': 0.24981589116996608, 'edge_cap': 0.8244019513886466, 'bull_strategy': 'mean_reversion', 'bull_bb_std_mult': 2.760856757550873, 'bull_rsi_os': 14, 'bull_rsi_ob': 61, 'bull_adx_thresh': 14.011613290938831, 'bull_atr_min_pct': 0.00750813658361397, 'bull_atr_max_pct': 0.14114240719699533, 'bull_tp_mult': 1.191616011761587, 'bull_tsl_mult': 0.3126926569004083, 'bull_time_stop': 35, 'bull_use_sma': True, 'bull_use_ema': True, 'bull_use_atr': True, 'bull_use_adx': False, 'bull_use_spike': False, 'bull_rsi_required': False, 'bear_strategy': 'mean_reversion', 'bear_bb_std_mult': 2.0254511968310935, 'bear_rsi_os': 35, 'bear_rsi_ob': 52, 'bear_adx_thresh': 12.424214433126313, 'bear_atr_min_pct': 0.014106711224384505, 'bear_atr_max_pct': 0.11376127616792618, 'bear_tp_mult': 2.7006006512880485, 'bear_tsl_mult': 0.3120591399046922, 'bear_time_stop': 200, 'bear_use_sma': False, 'bear_use_ema': True, 'bear_use_atr': True, 'bear_use_adx': True, 'bear_use_spike': True, 'bear_rsi_required': False, 'sideways_strategy': 'breakout', 'sideways_bb_std_mult': 1.7298203447157092, 'sideways_rsi_os': 40, 'sideways_rsi_ob': 45, 'sideways_adx_thresh': 10.129917056299183, 'sideways_atr_min_pct': 0.010090521534303613, 'sideways_atr_max_pct': 0.04239614155500643, 'sideways_tp_mult': 1.4569996483261762, 'sideways_tsl_mult': 0.26478985447018055, 'sideways_time_stop': 113, 'sideways_use_sma': True, 'sideways_use_ema': True, 'sideways_use_atr': True, 'sideways_use_adx': False, 'sideways_use_spike': True, 'sideways_rsi_required': False}.
[I 2025-08-31 11:40:15,199] Trial 355 finished with values: [-1000000000.0, 1000000000.0] and parameters: {'p_sma': 29, 'p_std': 16, 'p_atr': 13, 'p_adx': 23, 'rsi_period': 55, 'ema1': 17, 'ema2': 43, 'slip_atr_k': 0.05438852120769136, 'slip_spread_k': 0.07523031189585555, 'spread_hl_frac': 0.0024203303725839095, 'bb_std_mult': 0.5091066261446132, 'rsi_os': 34, 'rsi_ob': 73, 'vol_spike': 0.09441117419555656, 'adx_thresh': 17.663693396416576, 'atr_min_pct': 0.02957602949641304, 'atr_max_pct': 0.022746744675512708, 'tp_mult': 1.179273792934811, 'tsl_mult': 0.38814405481498276, 'strategy': 'mean_reversion', 'time_stop': 288, 'use_sma': True, 'use_atr': True, 'use_adx': False, 'use_ema': False, 'use_spike': True, 'rsi_required': True, 'edge_k': 0.3668793484872665, 'edge_cap': 0.8640539439023499, 'bull_strategy': 'breakout', 'bull_bb_std_mult': 2.1919657154168437, 'bull_rsi_os': 34, 'bull_rsi_ob': 46, 'bull_adx_thresh': 15.121614619120754, 'bull_atr_min_pct': 0.0026897395480031104, 'bull_atr_max_pct': 0.13736231517728628, 'bull_tp_mult': 1.5022823873484663, 'bull_tsl_mult': 0.3016440090401397, 'bull_time_stop': 119, 'bull_use_sma': False, 'bull_use_ema': True, 'bull_use_atr': True, 'bull_use_adx': True, 'bull_use_spike': False, 'bull_rsi_required': True, 'bear_strategy': 'breakout', 'bear_bb_std_mult': 1.1026025469844685, 'bear_rsi_os': 33, 'bear_rsi_ob': 86, 'bear_adx_thresh': 18.259960396013202, 'bear_atr_min_pct': 0.013360686452619923, 'bear_atr_max_pct': 0.13935266877914207, 'bear_tp_mult': 2.6349332298677095, 'bear_tsl_mult': 0.3529430410949372, 'bear_time_stop': 190, 'bear_use_sma': False, 'bear_use_ema': True, 'bear_use_atr': True, 'bear_use_adx': False, 'bear_use_spike': True, 'bear_rsi_required': True, 'sideways_strategy': 'breakout', 'sideways_bb_std_mult': 2.010565462895658, 'sideways_rsi_os': 24, 'sideways_rsi_ob': 79, 'sideways_adx_thresh': 8.60887947832211, 'sideways_atr_min_pct': 0.028984922084679482, 'sideways_atr_max_pct': 0.044961119121084664, 'sideways_tp_mult': 1.3473376240654884, 'sideways_tsl_mult': 0.3140969108918656, 'sideways_time_stop': 12, 'sideways_use_sma': True, 'sideways_use_ema': False, 'sideways_use_atr': True, 'sideways_use_adx': True, 'sideways_use_spike': False, 'sideways_rsi_required': True}.
[I 2025-08-31 11:40:49,859] Trial 352 finished with values: [-1000000000.0, 1000000000.0] and parameters: {'p_sma': 31, 'p_std': 53, 'p_atr': 16, 'p_adx': 23, 'rsi_period': 51, 'ema1': 11, 'ema2': 31, 'slip_atr_k': 0.10135765855733402, 'slip_spread_k': 0.2572708570867783, 'spread_hl_frac': 0.0026835958011429102, 'bb_std_mult': 0.8346934549059747, 'rsi_os': 44, 'rsi_ob': 70, 'vol_spike': 0.12296373284479148, 'adx_thresh': 17.688225558536104, 'atr_min_pct': 0.009237874734170476, 'atr_max_pct': 0.05712764068791726, 'tp_mult': 1.6125249235243013, 'tsl_mult': 0.18383114239648307, 'strategy': 'breakout', 'time_stop': 291, 'use_sma': False, 'use_atr': True, 'use_adx': True, 'use_ema': False, 'use_spike': True, 'rsi_required': True, 'edge_k': 0.2444804082443268, 'edge_cap': 0.3336188444825944, 'bull_strategy': 'breakout', 'bull_bb_std_mult': 2.2202647460853937, 'bull_rsi_os': 30, 'bull_rsi_ob': 91, 'bull_adx_thresh': 31.83363467418148, 'bull_atr_min_pct': 0.002613486135426773, 'bull_atr_max_pct': 0.14195077687653468, 'bull_tp_mult': 1.51353651332323, 'bull_tsl_mult': 0.30666172860681573, 'bull_time_stop': 154, 'bull_use_sma': True, 'bull_use_ema': True, 'bull_use_atr': True, 'bull_use_adx': True, 'bull_use_spike': False, 'bull_rsi_required': False, 'bear_strategy': 'breakout', 'bear_bb_std_mult': 2.8342467989837505, 'bear_rsi_os': 8, 'bear_rsi_ob': 52, 'bear_adx_thresh': 20.804811131786582, 'bear_atr_min_pct': 0.013640812302993736, 'bear_atr_max_pct': 0.11292253865068216, 'bear_tp_mult': 2.2105649676513393, 'bear_tsl_mult': 0.6825421626326025, 'bear_time_stop': 185, 'bear_use_sma': False, 'bear_use_ema': True, 'bear_use_atr': True, 'bear_use_adx': False, 'bear_use_spike': True, 'bear_rsi_required': False, 'sideways_strategy': 'breakout', 'sideways_bb_std_mult': 1.6287108595555377, 'sideways_rsi_os': 33, 'sideways_rsi_ob': 71, 'sideways_adx_thresh': 8.67818352696355, 'sideways_atr_min_pct': 0.029355692677091174, 'sideways_atr_max_pct': 0.041657721445302484, 'sideways_tp_mult': 1.4418955417596766, 'sideways_tsl_mult': 0.1667856768461109, 'sideways_time_stop': 28, 'sideways_use_sma': True, 'sideways_use_ema': False, 'sideways_use_atr': True, 'sideways_use_adx': True, 'sideways_use_spike': True, 'sideways_rsi_required': True}.
[I 2025-08-31 11:40:50,393] Trial 354 finished with values: [-0.027260760501623182, 0.027010347165818304] and parameters: {'p_sma': 28, 'p_std': 18, 'p_atr': 13, 'p_adx': 23, 'rsi_period': 55, 'ema1': 11, 'ema2': 30, 'slip_atr_k': 0.012613899587062286, 'slip_spread_k': 0.04020600955670631, 'spread_hl_frac': 0.0016302005176428215, 'bb_std_mult': 0.7727495099052624, 'rsi_os': 34, 'rsi_ob': 73, 'vol_spike': 0.01178891559475459, 'adx_thresh': 24.17376342520002, 'atr_min_pct': 0.011744317091322416, 'atr_max_pct': 0.059099417441656775, 'tp_mult': 1.2755532859730374, 'tsl_mult': 0.5252291316114672, 'strategy': 'mean_reversion', 'time_stop': 288, 'use_sma': True, 'use_atr': True, 'use_adx': False, 'use_ema': False, 'use_spike': True, 'rsi_required': True, 'edge_k': 0.3573810987487364, 'edge_cap': 0.8686831972666941, 'bull_strategy': 'breakout', 'bull_bb_std_mult': 3.520038403294583, 'bull_rsi_os': 34, 'bull_rsi_ob': 65, 'bull_adx_thresh': 14.970256698645844, 'bull_atr_min_pct': 0.002645292302490098, 'bull_atr_max_pct': 0.13712675678716138, 'bull_tp_mult': 2.320457874649818, 'bull_tsl_mult': 0.30197586858997977, 'bull_time_stop': 156, 'bull_use_sma': False, 'bull_use_ema': True, 'bull_use_atr': True, 'bull_use_adx': True, 'bull_use_spike': False, 'bull_rsi_required': True, 'bear_strategy': 'breakout', 'bear_bb_std_mult': 3.0835863926105542, 'bear_rsi_os': 28, 'bear_rsi_ob': 56, 'bear_adx_thresh': 26.927820924802887, 'bear_atr_min_pct': 0.016828387373595873, 'bear_atr_max_pct': 0.10741681541484295, 'bear_tp_mult': 2.637045389157957, 'bear_tsl_mult': 0.07274691704236008, 'bear_time_stop': 186, 'bear_use_sma': False, 'bear_use_ema': True, 'bear_use_atr': True, 'bear_use_adx': False, 'bear_use_spike': True, 'bear_rsi_required': True, 'sideways_strategy': 'breakout', 'sideways_bb_std_mult': 2.0310266211025554, 'sideways_rsi_os': 33, 'sideways_rsi_ob': 80, 'sideways_adx_thresh': 8.651746643528195, 'sideways_atr_min_pct': 0.023175840295265236, 'sideways_atr_max_pct': 0.04524650181084997, 'sideways_tp_mult': 1.330385850484733, 'sideways_tsl_mult': 0.10785335975453775, 'sideways_time_stop': 181, 'sideways_use_sma': True, 'sideways_use_ema': False, 'sideways_use_atr': True, 'sideways_use_adx': True, 'sideways_use_spike': False, 'sideways_rsi_required': True}.
[I 2025-08-31 11:40:50,574] Trial 353 finished with values: [-0.013226762637823408, 0.014034018120211671] and parameters: {'p_sma': 29, 'p_std': 18, 'p_atr': 13, 'p_adx': 23, 'rsi_period': 55, 'ema1': 17, 'ema2': 31, 'slip_atr_k': 0.05018987810989256, 'slip_spread_k': 0.04478497288795045, 'spread_hl_frac': 0.002786396265083695, 'bb_std_mult': 0.8047698849983411, 'rsi_os': 34, 'rsi_ob': 60, 'vol_spike': 0.012999772179622338, 'adx_thresh': 27.79400933983476, 'atr_min_pct': 0.011578089782273555, 'atr_max_pct': 0.033566687174700155, 'tp_mult': 1.147211533462989, 'tsl_mult': 0.5280001794372583, 'strategy': 'mean_reversion', 'time_stop': 289, 'use_sma': True, 'use_atr': True, 'use_adx': False, 'use_ema': False, 'use_spike': True, 'rsi_required': True, 'edge_k': 0.3725077380581716, 'edge_cap': 0.19336818907599107, 'bull_strategy': 'breakout', 'bull_bb_std_mult': 2.212078037642067, 'bull_rsi_os': 34, 'bull_rsi_ob': 86, 'bull_adx_thresh': 15.154334245912137, 'bull_atr_min_pct': 0.008980655324568463, 'bull_atr_max_pct': 0.14481635157842812, 'bull_tp_mult': 1.5192563813826274, 'bull_tsl_mult': 0.2935106873897083, 'bull_time_stop': 169, 'bull_use_sma': False, 'bull_use_ema': True, 'bull_use_atr': True, 'bull_use_adx': True, 'bull_use_spike': False, 'bull_rsi_required': True, 'bear_strategy': 'breakout', 'bear_bb_std_mult': 1.066826566762029, 'bear_rsi_os': 28, 'bear_rsi_ob': 56, 'bear_adx_thresh': 18.313556644720634, 'bear_atr_min_pct': 0.016814449976805656, 'bear_atr_max_pct': 0.05225002815550364, 'bear_tp_mult': 2.6305412063469493, 'bear_tsl_mult': 0.3511065526980563, 'bear_time_stop': 187, 'bear_use_sma': False, 'bear_use_ema': True, 'bear_use_atr': True, 'bear_use_adx': False, 'bear_use_spike': True, 'bear_rsi_required': True, 'sideways_strategy': 'breakout', 'sideways_bb_std_mult': 1.9945182513901152, 'sideways_rsi_os': 33, 'sideways_rsi_ob': 79, 'sideways_adx_thresh': 28.992082260184112, 'sideways_atr_min_pct': 0.0023308356436316253, 'sideways_atr_max_pct': 0.12356596045222389, 'sideways_tp_mult': 1.3277777750588289, 'sideways_tsl_mult': 0.3735732252355497, 'sideways_time_stop': 182, 'sideways_use_sma': True, 'sideways_use_ema': False, 'sideways_use_atr': True, 'sideways_use_adx': True, 'sideways_use_spike': False, 'sideways_rsi_required': True}.
[I 2025-08-31 11:40:50,992] Trial 356 finished with values: [-1000000000.0, 1000000000.0] and parameters: {'p_sma': 28, 'p_std': 18, 'p_atr': 13, 'p_adx': 26, 'rsi_period': 51, 'ema1': 12, 'ema2': 31, 'slip_atr_k': 0.05101229014906558, 'slip_spread_k': 0.11835641252745331, 'spread_hl_frac': 0.0010374788286777652, 'bb_std_mult': 1.7597619411044447, 'rsi_os': 44, 'rsi_ob': 71, 'vol_spike': 0.01706552095163036, 'adx_thresh': 27.598684500022767, 'atr_min_pct': 0.01164165840494671, 'atr_max_pct': 0.015124862947199036, 'tp_mult': 1.136731879367691, 'tsl_mult': 0.5391072541542858, 'strategy': 'breakout', 'time_stop': 291, 'use_sma': True, 'use_atr': True, 'use_adx': False, 'use_ema': False, 'use_spike': True, 'rsi_required': True, 'edge_k': 1.31328392783651, 'edge_cap': 0.8978308330178045, 'bull_strategy': 'breakout', 'bull_bb_std_mult': 2.4484862564599683, 'bull_rsi_os': 24, 'bull_rsi_ob': 91, 'bull_adx_thresh': 15.140496970128899, 'bull_atr_min_pct': 0.009309283631049192, 'bull_atr_max_pct': 0.14455679603899907, 'bull_tp_mult': 2.108278562389148, 'bull_tsl_mult': 0.32038806814526316, 'bull_time_stop': 168, 'bull_use_sma': True, 'bull_use_ema': True, 'bull_use_atr': True, 'bull_use_adx': True, 'bull_use_spike': False, 'bull_rsi_required': True, 'bear_strategy': 'breakout', 'bear_bb_std_mult': 2.734139934624716, 'bear_rsi_os': 30, 'bear_rsi_ob': 82, 'bear_adx_thresh': 26.79553411538693, 'bear_atr_min_pct': 0.014542015837670714, 'bear_atr_max_pct': 0.1188147809350239, 'bear_tp_mult': 1.443767411185363, 'bear_tsl_mult': 0.09560802746366553, 'bear_time_stop': 187, 'bear_use_sma': False, 'bear_use_ema': True, 'bear_use_atr': True, 'bear_use_adx': False, 'bear_use_spike': True, 'bear_rsi_required': False, 'sideways_strategy': 'breakout', 'sideways_bb_std_mult': 1.8285153899977051, 'sideways_rsi_os': 35, 'sideways_rsi_ob': 71, 'sideways_adx_thresh': 7.603459786218258, 'sideways_atr_min_pct': 0.02242874914969119, 'sideways_atr_max_pct': 0.04607883387761972, 'sideways_tp_mult': 1.3967148733590566, 'sideways_tsl_mult': 0.1281224653970231, 'sideways_time_stop': 21, 'sideways_use_sma': True, 'sideways_use_ema': False, 'sideways_use_atr': True, 'sideways_use_adx': True, 'sideways_use_spike': False, 'sideways_rsi_required': True}.
[I 2025-08-31 11:41:28,251] Trial 357 finished with values: [-0.030340622836652398, 0.02974533777979107] and parameters: {'p_sma': 28, 'p_std': 45, 'p_atr': 13, 'p_adx': 28, 'rsi_period': 48, 'ema1': 12, 'ema2': 48, 'slip_atr_k': 0.04366158079365329, 'slip_spread_k': 0.03923936292108243, 'spread_hl_frac': 0.0014782022183731757, 'bb_std_mult': 1.763990161246375, 'rsi_os': 37, 'rsi_ob': 73, 'vol_spike': 0.15730088802983555, 'adx_thresh': 16.087118706857325, 'atr_min_pct': 0.005436744761915306, 'atr_max_pct': 0.03247653473653276, 'tp_mult': 1.1424650224972397, 'tsl_mult': 0.5227852237032681, 'strategy': 'breakout', 'time_stop': 11, 'use_sma': True, 'use_atr': True, 'use_adx': False, 'use_ema': False, 'use_spike': True, 'rsi_required': True, 'edge_k': 0.35283524600547805, 'edge_cap': 0.19040468200439892, 'bull_strategy': 'breakout', 'bull_bb_std_mult': 3.246382558850814, 'bull_rsi_os': 26, 'bull_rsi_ob': 65, 'bull_adx_thresh': 23.02198928678532, 'bull_atr_min_pct': 0.009259989597896283, 'bull_atr_max_pct': 0.13242896835951662, 'bull_tp_mult': 1.2505363050585534, 'bull_tsl_mult': 0.24944438920296377, 'bull_time_stop': 157, 'bull_use_sma': True, 'bull_use_ema': True, 'bull_use_atr': True, 'bull_use_adx': True, 'bull_use_spike': False, 'bull_rsi_required': True, 'bear_strategy': 'breakout', 'bear_bb_std_mult': 1.2069125188819916, 'bear_rsi_os': 33, 'bear_rsi_ob': 56, 'bear_adx_thresh': 32.059385947297734, 'bear_atr_min_pct': 0.0015122900084181112, 'bear_atr_max_pct': 0.11932273871376625, 'bear_tp_mult': 1.2230018268657488, 'bear_tsl_mult': 0.7341268745409734, 'bear_time_stop': 198, 'bear_use_sma': False, 'bear_use_ema': True, 'bear_use_atr': True, 'bear_use_adx': False, 'bear_use_spike': True, 'bear_rsi_required': False, 'sideways_strategy': 'breakout', 'sideways_bb_std_mult': 1.8216120958782354, 'sideways_rsi_os': 53, 'sideways_rsi_ob': 77, 'sideways_adx_thresh': 11.624680528435107, 'sideways_atr_min_pct': 0.017212719095862656, 'sideways_atr_max_pct': 0.12251878269019728, 'sideways_tp_mult': 1.6353731635765294, 'sideways_tsl_mult': 0.368228017496532, 'sideways_time_stop': 286, 'sideways_use_sma': True, 'sideways_use_ema': False, 'sideways_use_atr': True, 'sideways_use_adx': True, 'sideways_use_spike': False, 'sideways_rsi_required': True}.
[I 2025-08-31 11:41:29,101] Trial 358 finished with values: [-1000000000.0, 1000000000.0] and parameters: {'p_sma': 29, 'p_std': 34, 'p_atr': 12, 'p_adx': 28, 'rsi_period': 48, 'ema1': 13, 'ema2': 41, 'slip_atr_k': 0.04918492501412614, 'slip_spread_k': 0.1110075462976573, 'spread_hl_frac': 0.0012553306054340066, 'bb_std_mult': 1.7860985271003729, 'rsi_os': 35, 'rsi_ob': 60, 'vol_spike': 0.16612898850004937, 'adx_thresh': 26.673678830494758, 'atr_min_pct': 0.004737514853337547, 'atr_max_pct': 0.10724575174413883, 'tp_mult': 1.0129149751666713, 'tsl_mult': 0.33448660065762426, 'strategy': 'breakout', 'time_stop': 300, 'use_sma': False, 'use_atr': True, 'use_adx': True, 'use_ema': True, 'use_spike': True, 'rsi_required': True, 'edge_k': 1.2558414693742772, 'edge_cap': 0.8383637487755782, 'bull_strategy': 'breakout', 'bull_bb_std_mult': 2.424877216663548, 'bull_rsi_os': 26, 'bull_rsi_ob': 62, 'bull_adx_thresh': 16.088500290124536, 'bull_atr_min_pct': 0.009070409277191651, 'bull_atr_max_pct': 0.14504950433695296, 'bull_tp_mult': 1.2507931445272022, 'bull_tsl_mult': 0.27985382826643673, 'bull_time_stop': 170, 'bull_use_sma': True, 'bull_use_ema': True, 'bull_use_atr': True, 'bull_use_adx': True, 'bull_use_spike': True, 'bull_rsi_required': True, 'bear_strategy': 'breakout', 'bear_bb_std_mult': 1.1765084838024933, 'bear_rsi_os': 33, 'bear_rsi_ob': 54, 'bear_adx_thresh': 32.30762901857272, 'bear_atr_min_pct': 0.01460997855077782, 'bear_atr_max_pct': 0.11842644002101185, 'bear_tp_mult': 2.746782334321819, 'bear_tsl_mult': 0.7337205909416813, 'bear_time_stop': 201, 'bear_use_sma': False, 'bear_use_ema': True, 'bear_use_atr': False, 'bear_use_adx': False, 'bear_use_spike': False, 'bear_rsi_required': False, 'sideways_strategy': 'breakout', 'sideways_bb_std_mult': 1.7314916607988624, 'sideways_rsi_os': 28, 'sideways_rsi_ob': 83, 'sideways_adx_thresh': 27.538141571518203, 'sideways_atr_min_pct': 0.004228576431056971, 'sideways_atr_max_pct': 0.10327973592425925, 'sideways_tp_mult': 1.2188351430270339, 'sideways_tsl_mult': 0.32827228370120815, 'sideways_time_stop': 14, 'sideways_use_sma': True, 'sideways_use_ema': False, 'sideways_use_atr': True, 'sideways_use_adx': True, 'sideways_use_spike': False, 'sideways_rsi_required': False}.
[I 2025-08-31 11:41:29,114] Trial 359 finished with values: [-1000000000.0, 1000000000.0] and parameters: {'p_sma': 29, 'p_std': 59, 'p_atr': 16, 'p_adx': 28, 'rsi_period': 48, 'ema1': 5, 'ema2': 49, 'slip_atr_k': 0.0722227452045249, 'slip_spread_k': 0.11515491433075725, 'spread_hl_frac': 0.0011714809306319, 'bb_std_mult': 0.8947330971698189, 'rsi_os': 35, 'rsi_ob': 71, 'vol_spike': 0.291337837635799, 'adx_thresh': 16.349045410810163, 'atr_min_pct': 0.004687141618127078, 'atr_max_pct': 0.03447360965995167, 'tp_mult': 1.0127649973570585, 'tsl_mult': 0.33537224587252684, 'strategy': 'breakout', 'time_stop': 295, 'use_sma': False, 'use_atr': True, 'use_adx': True, 'use_ema': True, 'use_spike': True, 'rsi_required': True, 'edge_k': 1.2426264310691393, 'edge_cap': 0.8442632665352223, 'bull_strategy': 'breakout', 'bull_bb_std_mult': 3.235173840908515, 'bull_rsi_os': 26, 'bull_rsi_ob': 72, 'bull_adx_thresh': 23.23702255135722, 'bull_atr_min_pct': 0.00915237698048034, 'bull_atr_max_pct': 0.14562342144597887, 'bull_tp_mult': 1.453246714950965, 'bull_tsl_mult': 0.25295688438502556, 'bull_time_stop': 258, 'bull_use_sma': True, 'bull_use_ema': True, 'bull_use_atr': True, 'bull_use_adx': True, 'bull_use_spike': True, 'bull_rsi_required': True, 'bear_strategy': 'breakout', 'bear_bb_std_mult': 2.749626345225063, 'bear_rsi_os': 30, 'bear_rsi_ob': 54, 'bear_adx_thresh': 32.50789343716085, 'bear_atr_min_pct': 0.0009136413858073667, 'bear_atr_max_pct': 0.11762586947771911, 'bear_tp_mult': 1.2265051898407393, 'bear_tsl_mult': 0.733746545046118, 'bear_time_stop': 198, 'bear_use_sma': False, 'bear_use_ema': True, 'bear_use_atr': False, 'bear_use_adx': False, 'bear_use_spike': False, 'bear_rsi_required': False, 'sideways_strategy': 'breakout', 'sideways_bb_std_mult': 1.8367664305539104, 'sideways_rsi_os': 28, 'sideways_rsi_ob': 77, 'sideways_adx_thresh': 26.992763671604504, 'sideways_atr_min_pct': 0.004229187025885578, 'sideways_atr_max_pct': 0.10230900330881919, 'sideways_tp_mult': 1.4018158087135892, 'sideways_tsl_mult': 0.3315219971329112, 'sideways_time_stop': 5, 'sideways_use_sma': True, 'sideways_use_ema': False, 'sideways_use_atr': True, 'sideways_use_adx': True, 'sideways_use_spike': False, 'sideways_rsi_required': False}.
