[I 2025-08-31 11:36:31,720] Trial 325 finished with values: [-1000000000.0, 1000000000.0] and parameters: {'p_sma': 32, 'p_std': 19, 'p_atr': 15, 'p_adx': 27, 'rsi_period': 53, 'ema1': 11, 'ema2': 33, 'slip_atr_k': 0.055331917854723016, 'slip_spread_k': 0.10525648393170911, 'spread_hl_frac': 0.01477038561316369, 'bb_std_mult': 0.7254888530439361, 'rsi_os': 36, 'rsi_ob': 49, 'vol_spike': 0.11198657140777099, 'adx_thresh': 27.128975963793923, 'atr_min_pct': 0.00411457955409579, 'atr_max_pct': 0.01715632732832975, 'tp_mult': 1.0703951841742787, 'tsl_mult': 0.3421177505303492, 'strategy': 'mean_reversion', 'time_stop': 112, 'use_sma': False, 'use_atr': True, 'use_adx': True, 'use_ema': True, 'use_spike': True, 'rsi_required': True, 'edge_k': 0.16023590186183567, 'edge_cap': 0.8370005683630568, 'bull_strategy': 'breakout', 'bull_bb_std_mult': 2.623010190635177, 'bull_rsi_os': 8, 'bull_rsi_ob': 69, 'bull_adx_thresh': 12.770429053834293, 'bull_atr_min_pct': 0.00497930919245764, 'bull_atr_max_pct': 0.11857921179687783, 'bull_tp_mult': 2.196644483252684, 'bull_tsl_mult': 0.7310899710354065, 'bull_time_stop': 161, 'bull_use_sma': True, 'bull_use_ema': True, 'bull_use_atr': True, 'bull_use_adx': True, 'bull_use_spike': True, 'bull_rsi_required': True, 'bear_strategy': 'breakout', 'bear_bb_std_mult': 2.627510477522046, 'bear_rsi_os': 32, 'bear_rsi_ob': 93, 'bear_adx_thresh': 31.375169433727955, 'bear_atr_min_pct': 0.015162092314378931, 'bear_atr_max_pct': 0.028045522171990078, 'bear_tp_mult': 2.723296300672386, 'bear_tsl_mult': 0.4627728130850211, 'bear_time_stop': 178, 'bear_use_sma': False, 'bear_use_ema': True, 'bear_use_atr': False, 'bear_use_adx': True, 'bear_use_spike': False, 'bear_rsi_required': True, 'sideways_strategy': 'breakout', 'sideways_bb_std_mult': 1.903815546713787, 'sideways_rsi_os': 18, 'sideways_rsi_ob': 56, 'sideways_adx_thresh': 22.540588299019063, 'sideways_atr_min_pct': 0.013562742905244111, 'sideways_atr_max_pct': 0.09159490654803151, 'sideways_tp_mult': 1.4081640720931137, 'sideways_tsl_mult': 0.3474748783289793, 'sideways_time_stop': 17, 'sideways_use_sma': True, 'sideways_use_ema': False, 'sideways_use_atr': True, 'sideways_use_adx': True, 'sideways_use_spike': True, 'sideways_rsi_required': True}.
[I 2025-08-31 11:36:32,534] Trial 328 finished with values: [-1000000000.0, 1000000000.0] and parameters: {'p_sma': 57, 'p_std': 17, 'p_atr': 14, 'p_adx': 24, 'rsi_period': 50, 'ema1': 11, 'ema2': 39, 'slip_atr_k': 0.036551706389591335, 'slip_spread_k': 0.13111443273068224, 'spread_hl_frac': 0.03034526665401116, 'bb_std_mult': 0.8087091412344898, 'rsi_os': 11, 'rsi_ob': 70, 'vol_spike': 0.008410793257417476, 'adx_thresh': 25.83857646049485, 'atr_min_pct': 0.011155083823335257, 'atr_max_pct': 0.010144070164804782, 'tp_mult': 1.1343495059356765, 'tsl_mult': 0.7113022668706617, 'strategy': 'breakout', 'time_stop': 249, 'use_sma': False, 'use_atr': True, 'use_adx': True, 'use_ema': True, 'use_spike': True, 'rsi_required': False, 'edge_k': 0.46653763594424624, 'edge_cap': 0.2631686986170556, 'bull_strategy': 'mean_reversion', 'bull_bb_std_mult': 2.8279498059104924, 'bull_rsi_os': 23, 'bull_rsi_ob': 87, 'bull_adx_thresh': 14.52453401776659, 'bull_atr_min_pct': 0.004049541682585838, 'bull_atr_max_pct': 0.12437935109737845, 'bull_tp_mult': 1.8579530969278935, 'bull_tsl_mult': 0.14030306545059718, 'bull_time_stop': 135, 'bull_use_sma': True, 'bull_use_ema': True, 'bull_use_atr': True, 'bull_use_adx': True, 'bull_use_spike': True, 'bull_rsi_required': True, 'bear_strategy': 'mean_reversion', 'bear_bb_std_mult': 2.3319594628377476, 'bear_rsi_os': 24, 'bear_rsi_ob': 56, 'bear_adx_thresh': 30.200312116268673, 'bear_atr_min_pct': 0.014674130807284741, 'bear_atr_max_pct': 0.023348408917668248, 'bear_tp_mult': 2.6922180733571115, 'bear_tsl_mult': 0.149834590023407, 'bear_time_stop': 289, 'bear_use_sma': False, 'bear_use_ema': True, 'bear_use_atr': False, 'bear_use_adx': True, 'bear_use_spike': True, 'bear_rsi_required': False, 'sideways_strategy': 'breakout', 'sideways_bb_std_mult': 1.4460291818864794, 'sideways_rsi_os': 28, 'sideways_rsi_ob': 78, 'sideways_adx_thresh': 6.908699880951497, 'sideways_atr_min_pct': 0.016493055208999047, 'sideways_atr_max_pct': 0.06934455084785844, 'sideways_tp_mult': 2.767157581711417, 'sideways_tsl_mult': 0.20784336043006665, 'sideways_time_stop': 75, 'sideways_use_sma': True, 'sideways_use_ema': False, 'sideways_use_atr': True, 'sideways_use_adx': True, 'sideways_use_spike': False, 'sideways_rsi_required': False}.
[I 2025-08-31 11:36:57,420] Trial 323 finished with values: [-1000000000.0, 1000000000.0] and parameters: {'p_sma': 6, 'p_std': 19, 'p_atr': 25, 'p_adx': 17, 'rsi_period': 19, 'ema1': 23, 'ema2': 38, 'slip_atr_k': 0.038582891736648015, 'slip_spread_k': 0.10931814490099352, 'spread_hl_frac': 0.014580220035729714, 'bb_std_mult': 3.1498769483292492, 'rsi_os': 11, 'rsi_ob': 70, 'vol_spike': 0.11495338694368011, 'adx_thresh': 27.086482659127537, 'atr_min_pct': 0.004124977319292658, 'atr_max_pct': 0.11093992161432535, 'tp_mult': 1.056456643225201, 'tsl_mult': 0.3035385023421928, 'strategy': 'mean_reversion', 'time_stop': 286, 'use_sma': False, 'use_atr': True, 'use_adx': True, 'use_ema': False, 'use_spike': True, 'rsi_required': True, 'edge_k': 0.4566263056211583, 'edge_cap': 0.26389594226894814, 'bull_strategy': 'breakout', 'bull_bb_std_mult': 2.826955323903491, 'bull_rsi_os': 45, 'bull_rsi_ob': 66, 'bull_adx_thresh': 14.675960514050074, 'bull_atr_min_pct': 0.02917353041129956, 'bull_atr_max_pct': 0.120722082111223, 'bull_tp_mult': 1.8106050623882632, 'bull_tsl_mult': 0.5945953866290687, 'bull_time_stop': 153, 'bull_use_sma': True, 'bull_use_ema': True, 'bull_use_atr': True, 'bull_use_adx': True, 'bull_use_spike': False, 'bull_rsi_required': True, 'bear_strategy': 'breakout', 'bear_bb_std_mult': 1.0391267414137326, 'bear_rsi_os': 32, 'bear_rsi_ob': 56, 'bear_adx_thresh': 32.486230806906754, 'bear_atr_min_pct': 0.015350739993627842, 'bear_atr_max_pct': 0.028193340552153848, 'bear_tp_mult': 2.6912128902906165, 'bear_tsl_mult': 0.6504448813872203, 'bear_time_stop': 293, 'bear_use_sma': False, 'bear_use_ema': True, 'bear_use_atr': True, 'bear_use_adx': False, 'bear_use_spike': True, 'bear_rsi_required': True, 'sideways_strategy': 'mean_reversion', 'sideways_bb_std_mult': 1.8969289134369054, 'sideways_rsi_os': 46, 'sideways_rsi_ob': 56, 'sideways_adx_thresh': 20.76137423216718, 'sideways_atr_min_pct': 0.003972682129506262, 'sideways_atr_max_pct': 0.09576144775702408, 'sideways_tp_mult': 1.419624341315242, 'sideways_tsl_mult': 0.40403593446673686, 'sideways_time_stop': 147, 'sideways_use_sma': True, 'sideways_use_ema': False, 'sideways_use_atr': True, 'sideways_use_adx': False, 'sideways_use_spike': True, 'sideways_rsi_required': True}.
[I 2025-08-31 11:36:58,243] Trial 326 finished with values: [-1000000000.0, 1000000000.0] and parameters: {'p_sma': 32, 'p_std': 35, 'p_atr': 25, 'p_adx': 14, 'rsi_period': 28, 'ema1': 11, 'ema2': 33, 'slip_atr_k': 0.10916852691587864, 'slip_spread_k': 0.10732016318948591, 'spread_hl_frac': 0.003982771523735485, 'bb_std_mult': 0.7542210052877023, 'rsi_os': 35, 'rsi_ob': 71, 'vol_spike': 0.11741794407975126, 'adx_thresh': 27.029242346664823, 'atr_min_pct': 0.004094019043821772, 'atr_max_pct': 0.010676335919131336, 'tp_mult': 1.070697174033309, 'tsl_mult': 0.8388434503584634, 'strategy': 'mean_reversion', 'time_stop': 286, 'use_sma': False, 'use_atr': True, 'use_adx': True, 'use_ema': True, 'use_spike': True, 'rsi_required': True, 'edge_k': 1.3752544987729518, 'edge_cap': 0.8387645915078235, 'bull_strategy': 'breakout', 'bull_bb_std_mult': 2.364166639434962, 'bull_rsi_os': 7, 'bull_rsi_ob': 70, 'bull_adx_thresh': 12.413823297821864, 'bull_atr_min_pct': 0.005149009052774334, 'bull_atr_max_pct': 0.012142010236714393, 'bull_tp_mult': 1.8497301208523922, 'bull_tsl_mult': 0.24909426313530675, 'bull_time_stop': 162, 'bull_use_sma': True, 'bull_use_ema': True, 'bull_use_atr': True, 'bull_use_adx': True, 'bull_use_spike': True, 'bull_rsi_required': True, 'bear_strategy': 'breakout', 'bear_bb_std_mult': 1.164490180048904, 'bear_rsi_os': 32, 'bear_rsi_ob': 78, 'bear_adx_thresh': 30.463677757896768, 'bear_atr_min_pct': 0.015141085514227685, 'bear_atr_max_pct': 0.1117776091394923, 'bear_tp_mult': 2.730708562287741, 'bear_tsl_mult': 0.14980887198088194, 'bear_time_stop': 248, 'bear_use_sma': False, 'bear_use_ema': True, 'bear_use_atr': False, 'bear_use_adx': True, 'bear_use_spike': False, 'bear_rsi_required': True, 'sideways_strategy': 'mean_reversion', 'sideways_bb_std_mult': 1.8991452749542241, 'sideways_rsi_os': 42, 'sideways_rsi_ob': 57, 'sideways_adx_thresh': 21.989726089973296, 'sideways_atr_min_pct': 0.013637228470239356, 'sideways_atr_max_pct': 0.04839264450237296, 'sideways_tp_mult': 2.784880879520447, 'sideways_tsl_mult': 0.21650904816403777, 'sideways_time_stop': 17, 'sideways_use_sma': True, 'sideways_use_ema': False, 'sideways_use_atr': True, 'sideways_use_adx': False, 'sideways_use_spike': True, 'sideways_rsi_required': True}.
[I 2025-08-31 11:37:01,871] Trial 327 finished with values: [-1000000000.0, 1000000000.0] and parameters: {'p_sma': 55, 'p_std': 17, 'p_atr': 14, 'p_adx': 27, 'rsi_period': 76, 'ema1': 11, 'ema2': 28, 'slip_atr_k': 0.01720391859327068, 'slip_spread_k': 0.8040223236045285, 'spread_hl_frac': 0.0040471869112542296, 'bb_std_mult': 0.7828858989773166, 'rsi_os': 19, 'rsi_ob': 70, 'vol_spike': 0.2700074208114333, 'adx_thresh': 19.20023787412733, 'atr_min_pct': 0.004845709464747309, 'atr_max_pct': 0.1105332510425362, 'tp_mult': 2.67896332203562, 'tsl_mult': 0.7047981078668424, 'strategy': 'breakout', 'time_stop': 287, 'use_sma': False, 'use_atr': True, 'use_adx': True, 'use_ema': True, 'use_spike': True, 'rsi_required': True, 'edge_k': 0.4760506525594561, 'edge_cap': 0.6005120642164627, 'bull_strategy': 'mean_reversion', 'bull_bb_std_mult': 2.789701719152205, 'bull_rsi_os': 45, 'bull_rsi_ob': 84, 'bull_adx_thresh': 34.21443282657132, 'bull_atr_min_pct': 0.004067391040299334, 'bull_atr_max_pct': 0.1202637886951136, 'bull_tp_mult': 1.4756884173577676, 'bull_tsl_mult': 0.14165101025281346, 'bull_time_stop': 94, 'bull_use_sma': True, 'bull_use_ema': True, 'bull_use_atr': True, 'bull_use_adx': True, 'bull_use_spike': True, 'bull_rsi_required': True, 'bear_strategy': 'breakout', 'bear_bb_std_mult': 1.173611164664344, 'bear_rsi_os': 31, 'bear_rsi_ob': 78, 'bear_adx_thresh': 31.338920250242694, 'bear_atr_min_pct': 0.026901808964870228, 'bear_atr_max_pct': 0.02411843596307347, 'bear_tp_mult': 2.0977654743501533, 'bear_tsl_mult': 0.34592798998286695, 'bear_time_stop': 197, 'bear_use_sma': False, 'bear_use_ema': True, 'bear_use_atr': False, 'bear_use_adx': True, 'bear_use_spike': False, 'bear_rsi_required': False, 'sideways_strategy': 'breakout', 'sideways_bb_std_mult': 1.756838101096002, 'sideways_rsi_os': 19, 'sideways_rsi_ob': 76, 'sideways_adx_thresh': 7.287647850695436, 'sideways_atr_min_pct': 0.014024694448228453, 'sideways_atr_max_pct': 0.09559261015013086, 'sideways_tp_mult': 2.761080001772363, 'sideways_tsl_mult': 0.40364363832880834, 'sideways_time_stop': 18, 'sideways_use_sma': True, 'sideways_use_ema': False, 'sideways_use_atr': True, 'sideways_use_adx': True, 'sideways_use_spike': False, 'sideways_rsi_required': False}.
[I 2025-08-31 11:37:05,978] Trial 329 finished with values: [-0.04011759069897458, 0.03989320243611711] and parameters: {'p_sma': 60, 'p_std': 13, 'p_atr': 14, 'p_adx': 27, 'rsi_period': 52, 'ema1': 13, 'ema2': 28, 'slip_atr_k': 0.04257242328574491, 'slip_spread_k': 0.06533002600268176, 'spread_hl_frac': 0.004012011574636633, 'bb_std_mult': 0.7285977902397544, 'rsi_os': 34, 'rsi_ob': 71, 'vol_spike': 0.28628619457355664, 'adx_thresh': 18.390899002272818, 'atr_min_pct': 0.004941104651663102, 'atr_max_pct': 0.09960972613321978, 'tp_mult': 2.164955807046898, 'tsl_mult': 0.750926440134531, 'strategy': 'breakout', 'time_stop': 288, 'use_sma': False, 'use_atr': True, 'use_adx': True, 'use_ema': False, 'use_spike': True, 'rsi_required': True, 'edge_k': 1.3659103577638454, 'edge_cap': 0.6079017679010702, 'bull_strategy': 'breakout', 'bull_bb_std_mult': 2.3696214514308807, 'bull_rsi_os': 20, 'bull_rsi_ob': 89, 'bull_adx_thresh': 28.473786366166735, 'bull_atr_min_pct': 0.010250281717251203, 'bull_atr_max_pct': 0.06897041212250557, 'bull_tp_mult': 2.528665183786207, 'bull_tsl_mult': 0.2570889657091886, 'bull_time_stop': 153, 'bull_use_sma': True, 'bull_use_ema': True, 'bull_use_atr': False, 'bull_use_adx': True, 'bull_use_spike': False, 'bull_rsi_required': True, 'bear_strategy': 'breakout', 'bear_bb_std_mult': 1.168777591353649, 'bear_rsi_os': 39, 'bear_rsi_ob': 78, 'bear_adx_thresh': 31.03464843729393, 'bear_atr_min_pct': 0.013975381144120332, 'bear_atr_max_pct': 0.13479771810607416, 'bear_tp_mult': 2.6809569020367725, 'bear_tsl_mult': 0.3342805088398716, 'bear_time_stop': 195, 'bear_use_sma': False, 'bear_use_ema': True, 'bear_use_atr': True, 'bear_use_adx': False, 'bear_use_spike': False, 'bear_rsi_required': False, 'sideways_strategy': 'breakout', 'sideways_bb_std_mult': 0.7222722593406943, 'sideways_rsi_os': 49, 'sideways_rsi_ob': 50, 'sideways_adx_thresh': 25.866202436158424, 'sideways_atr_min_pct': 0.003019900286309223, 'sideways_atr_max_pct': 0.06386267226857528, 'sideways_tp_mult': 1.1993086737096064, 'sideways_tsl_mult': 0.41323095568759877, 'sideways_time_stop': 136, 'sideways_use_sma': True, 'sideways_use_ema': False, 'sideways_use_atr': True, 'sideways_use_adx': True, 'sideways_use_spike': False, 'sideways_rsi_required': True}.
[I 2025-08-31 11:37:40,695] Trial 330 finished with values: [-0.017317232111667913, 0.017246557240536583] and parameters: {'p_sma': 20, 'p_std': 13, 'p_atr': 14, 'p_adx': 27, 'rsi_period': 47, 'ema1': 20, 'ema2': 28, 'slip_atr_k': 0.11213252702861086, 'slip_spread_k': 0.7955772611249006, 'spread_hl_frac': 0.028211475703325, 'bb_std_mult': 0.7635852913860826, 'rsi_os': 22, 'rsi_ob': 67, 'vol_spike': 0.19276904084542051, 'adx_thresh': 25.127309226322726, 'atr_min_pct': 0.027562762561037048, 'atr_max_pct': 0.038832613430340814, 'tp_mult': 1.4740645346155121, 'tsl_mult': 0.8462397199938817, 'strategy': 'breakout', 'time_stop': 287, 'use_sma': False, 'use_atr': False, 'use_adx': True, 'use_ema': False, 'use_spike': True, 'rsi_required': True, 'edge_k': 1.5810428938056837, 'edge_cap': 0.8876164768327023, 'bull_strategy': 'breakout', 'bull_bb_std_mult': 2.3603850182153168, 'bull_rsi_os': 20, 'bull_rsi_ob': 84, 'bull_adx_thresh': 15.687715697775984, 'bull_atr_min_pct': 0.010314837497860475, 'bull_atr_max_pct': 0.14457877376726472, 'bull_tp_mult': 1.4720835429945405, 'bull_tsl_mult': 0.2550877545020751, 'bull_time_stop': 94, 'bull_use_sma': True, 'bull_use_ema': True, 'bull_use_atr': False, 'bull_use_adx': True, 'bull_use_spike': False, 'bull_rsi_required': True, 'bear_strategy': 'breakout', 'bear_bb_std_mult': 1.1604029493031092, 'bear_rsi_os': 29, 'bear_rsi_ob': 53, 'bear_adx_thresh': 9.549472064106384, 'bear_atr_min_pct': 0.013726355083237975, 'bear_atr_max_pct': 0.08628133385290804, 'bear_tp_mult': 2.577597899890192, 'bear_tsl_mult': 0.3396524880650212, 'bear_time_stop': 195, 'bear_use_sma': False, 'bear_use_ema': True, 'bear_use_atr': True, 'bear_use_adx': False, 'bear_use_spike': False, 'bear_rsi_required': False, 'sideways_strategy': 'breakout', 'sideways_bb_std_mult': 1.7061686673840466, 'sideways_rsi_os': 30, 'sideways_rsi_ob': 53, 'sideways_adx_thresh': 7.438087569451271, 'sideways_atr_min_pct': 0.0015462452976603644, 'sideways_atr_max_pct': 0.047106947088275355, 'sideways_tp_mult': 1.276379949160303, 'sideways_tsl_mult': 0.8483060618988991, 'sideways_time_stop': 201, 'sideways_use_sma': True, 'sideways_use_ema': True, 'sideways_use_atr': True, 'sideways_use_adx': True, 'sideways_use_spike': False, 'sideways_rsi_required': True}.
[I 2025-08-31 11:37:41,621] Trial 331 finished with values: [-1000000000.0, 1000000000.0] and parameters: {'p_sma': 29, 'p_std': 13, 'p_atr': 14, 'p_adx': 8, 'rsi_period': 76, 'ema1': 20, 'ema2': 45, 'slip_atr_k': 0.06687600494789167, 'slip_spread_k': 0.06673957058183216, 'spread_hl_frac': 0.0285712540447248, 'bb_std_mult': 0.8991857845091977, 'rsi_os': 22, 'rsi_ob': 67, 'vol_spike': 0.27045183757273816, 'adx_thresh': 26.10133274735238, 'atr_min_pct': 0.00478708256659092, 'atr_max_pct': 0.03971207806007436, 'tp_mult': 1.010362880670547, 'tsl_mult': 0.3217161393366179, 'strategy': 'breakout', 'time_stop': 162, 'use_sma': False, 'use_atr': False, 'use_adx': True, 'use_ema': False, 'use_spike': True, 'rsi_required': True, 'edge_k': 1.6929976479753786, 'edge_cap': 0.8837579377393654, 'bull_strategy': 'mean_reversion', 'bull_bb_std_mult': 2.682740951849036, 'bull_rsi_os': 5, 'bull_rsi_ob': 62, 'bull_adx_thresh': 15.435927226414538, 'bull_atr_min_pct': 0.004418814865452359, 'bull_atr_max_pct': 0.07028833049582109, 'bull_tp_mult': 2.029590158850997, 'bull_tsl_mult': 0.39357258253076427, 'bull_time_stop': 141, 'bull_use_sma': True, 'bull_use_ema': True, 'bull_use_atr': False, 'bull_use_adx': False, 'bull_use_spike': False, 'bull_rsi_required': False, 'bear_strategy': 'breakout', 'bear_bb_std_mult': 3.152774106975547, 'bear_rsi_os': 29, 'bear_rsi_ob': 53, 'bear_adx_thresh': 9.489035949124792, 'bear_atr_min_pct': 0.013770461899670587, 'bear_atr_max_pct': 0.09340606521879269, 'bear_tp_mult': 1.5179390847485146, 'bear_tsl_mult': 0.3386335274791076, 'bear_time_stop': 240, 'bear_use_sma': False, 'bear_use_ema': True, 'bear_use_atr': True, 'bear_use_adx': False, 'bear_use_spike': True, 'bear_rsi_required': False, 'sideways_strategy': 'breakout', 'sideways_bb_std_mult': 0.7182787706226712, 'sideways_rsi_os': 30, 'sideways_rsi_ob': 76, 'sideways_adx_thresh': 30.02054794558631, 'sideways_atr_min_pct': 0.015498837303810664, 'sideways_atr_max_pct': 0.1272547784098732, 'sideways_tp_mult': 1.3134866811565014, 'sideways_tsl_mult': 0.2673775174354444, 'sideways_time_stop': 137, 'sideways_use_sma': True, 'sideways_use_ema': True, 'sideways_use_atr': True, 'sideways_use_adx': True, 'sideways_use_spike': False, 'sideways_rsi_required': False}.
[I 2025-08-31 11:37:42,112] Trial 332 finished with values: [-1000000000.0, 1000000000.0] and parameters: {'p_sma': 59, 'p_std': 13, 'p_atr': 14, 'p_adx': 26, 'rsi_period': 72, 'ema1': 13, 'ema2': 55, 'slip_atr_k': 0.04599168915958818, 'slip_spread_k': 0.0756283967806734, 'spread_hl_frac': 0.0007929664394844932, 'bb_std_mult': 0.6824266993216208, 'rsi_os': 33, 'rsi_ob': 67, 'vol_spike': 0.19088648309636372, 'adx_thresh': 24.89029475734798, 'atr_min_pct': 0.016144134083471325, 'atr_max_pct': 0.11488189766615678, 'tp_mult': 1.126215715959759, 'tsl_mult': 0.32429717335232006, 'strategy': 'breakout', 'time_stop': 18, 'use_sma': False, 'use_atr': False, 'use_adx': True, 'use_ema': False, 'use_spike': True, 'rsi_required': False, 'edge_k': 1.6843534843080845, 'edge_cap': 0.8835045050919351, 'bull_strategy': 'breakout', 'bull_bb_std_mult': 2.6886007898066495, 'bull_rsi_os': 20, 'bull_rsi_ob': 62, 'bull_adx_thresh': 15.647703416748396, 'bull_atr_min_pct': 0.007121040194891324, 'bull_atr_max_pct': 0.1433271484571781, 'bull_tp_mult': 2.260516936504563, 'bull_tsl_mult': 0.44922518843831416, 'bull_time_stop': 141, 'bull_use_sma': True, 'bull_use_ema': True, 'bull_use_atr': False, 'bull_use_adx': False, 'bull_use_spike': False, 'bull_rsi_required': False, 'bear_strategy': 'mean_reversion', 'bear_bb_std_mult': 1.0974520565959225, 'bear_rsi_os': 39, 'bear_rsi_ob': 53, 'bear_adx_thresh': 31.11701133063632, 'bear_atr_min_pct': 0.014076687463652808, 'bear_atr_max_pct': 0.04169062708532279, 'bear_tp_mult': 2.6052800092403694, 'bear_tsl_mult': 0.3872547472063518, 'bear_time_stop': 188, 'bear_use_sma': False, 'bear_use_ema': True, 'bear_use_atr': True, 'bear_use_adx': False, 'bear_use_spike': True, 'bear_rsi_required': False, 'sideways_strategy': 'breakout', 'sideways_bb_std_mult': 1.7040653430405142, 'sideways_rsi_os': 30, 'sideways_rsi_ob': 53, 'sideways_adx_thresh': 25.97915853690225, 'sideways_atr_min_pct': 0.018686460664955946, 'sideways_atr_max_pct': 0.043786192488614074, 'sideways_tp_mult': 1.5389534393238278, 'sideways_tsl_mult': 0.2892153025793385, 'sideways_time_stop': 22, 'sideways_use_sma': True, 'sideways_use_ema': True, 'sideways_use_atr': True, 'sideways_use_adx': True, 'sideways_use_spike': False, 'sideways_rsi_required': True}.
