[I 2025-08-31 11:21:40,819] Trial 195 finished with values: [-0.15967514865510946, 0.15952130027004613] and parameters: {'p_sma': 43, 'p_std': 13, 'p_atr': 7, 'p_adx': 20, 'rsi_period': 53, 'ema1': 21, 'ema2': 14, 'slip_atr_k': 0.035190664593491995, 'slip_spread_k': 0.5464101736504526, 'spread_hl_frac': 0.04045143749308699, 'bb_std_mult': 2.4118503543688385, 'rsi_os': 48, 'rsi_ob': 82, 'vol_spike': 0.2751367640398263, 'adx_thresh': 32.56425342115093, 'atr_min_pct': 0.0030377811083146648, 'atr_max_pct': 0.06668646430544946, 'tp_mult': 1.0635436781788632, 'tsl_mult': 0.42912041759679265, 'strategy': 'breakout', 'time_stop': 188, 'use_sma': True, 'use_atr': True, 'use_adx': True, 'use_ema': False, 'use_spike': False, 'rsi_required': True, 'edge_k': 0.40959910792843307, 'edge_cap': 0.865329333195336, 'bull_strategy': 'breakout', 'bull_bb_std_mult': 1.0128560065478391, 'bull_rsi_os': 22, 'bull_rsi_ob': 62, 'bull_adx_thresh': 10.682391840721847, 'bull_atr_min_pct': 0.018202255473174056, 'bull_atr_max_pct': 0.04717160495785885, 'bull_tp_mult': 1.493913766403564, 'bull_tsl_mult': 0.36984805532587944, 'bull_time_stop': 49, 'bull_use_sma': True, 'bull_use_ema': False, 'bull_use_atr': True, 'bull_use_adx': True, 'bull_use_spike': False, 'bull_rsi_required': True, 'bear_strategy': 'mean_reversion', 'bear_bb_std_mult': 0.964924707398895, 'bear_rsi_os': 29, 'bear_rsi_ob': 54, 'bear_adx_thresh': 26.358373611857544, 'bear_atr_min_pct': 0.02225988083800369, 'bear_atr_max_pct': 0.014207107730605031, 'bear_tp_mult': 2.5428646902752767, 'bear_tsl_mult': 0.3878988283046791, 'bear_time_stop': 72, 'bear_use_sma': True, 'bear_use_ema': False, 'bear_use_atr': True, 'bear_use_adx': False, 'bear_use_spike': True, 'bear_rsi_required': False, 'sideways_strategy': 'mean_reversion', 'sideways_bb_std_mult': 1.1788981156091343, 'sideways_rsi_os': 33, 'sideways_rsi_ob': 55, 'sideways_adx_thresh': 13.808567750628967, 'sideways_atr_min_pct': 0.0017902318349937853, 'sideways_atr_max_pct': 0.013064304435821628, 'sideways_tp_mult': 2.1824713371470357, 'sideways_tsl_mult': 0.3733136626832402, 'sideways_time_stop': 21, 'sideways_use_sma': False, 'sideways_use_ema': False, 'sideways_use_atr': False, 'sideways_use_adx': True, 'sideways_use_spike': True, 'sideways_rsi_required': True}.
[I 2025-08-31 11:21:41,285] Trial 199 finished with values: [-1000000000.0, 1000000000.0] and parameters: {'p_sma': 5, 'p_std': 33, 'p_atr': 25, 'p_adx': 20, 'rsi_period': 32, 'ema1': 15, 'ema2': 15, 'slip_atr_k': 0.03807886710583896, 'slip_spread_k': 0.8627030019379691, 'spread_hl_frac': 0.03885173082927256, 'bb_std_mult': 2.2051108595485767, 'rsi_os': 49, 'rsi_ob': 55, 'vol_spike': 0.18833763655001384, 'adx_thresh': 31.88520485974988, 'atr_min_pct': 0.0028522454525942028, 'atr_max_pct': 0.09844803251984183, 'tp_mult': 1.0666984721482833, 'tsl_mult': 0.7310419661731802, 'strategy': 'breakout', 'time_stop': 84, 'use_sma': True, 'use_atr': True, 'use_adx': True, 'use_ema': False, 'use_spike': True, 'rsi_required': True, 'edge_k': 0.45795097873767765, 'edge_cap': 0.8689216177885325, 'bull_strategy': 'breakout', 'bull_bb_std_mult': 0.8932752630418899, 'bull_rsi_os': 23, 'bull_rsi_ob': 95, 'bull_adx_thresh': 11.578894778001107, 'bull_atr_min_pct': 0.009696875092454689, 'bull_atr_max_pct': 0.13261356794504575, 'bull_tp_mult': 1.4742227713254352, 'bull_tsl_mult': 0.9021794379171985, 'bull_time_stop': 154, 'bull_use_sma': True, 'bull_use_ema': False, 'bull_use_atr': True, 'bull_use_adx': True, 'bull_use_spike': False, 'bull_rsi_required': True, 'bear_strategy': 'breakout', 'bear_bb_std_mult': 0.757133158462197, 'bear_rsi_os': 15, 'bear_rsi_ob': 53, 'bear_adx_thresh': 33.90096836756243, 'bear_atr_min_pct': 0.014067270248977564, 'bear_atr_max_pct': 0.03197674844077341, 'bear_tp_mult': 2.57598791126264, 'bear_tsl_mult': 0.36563940552804114, 'bear_time_stop': 78, 'bear_use_sma': True, 'bear_use_ema': True, 'bear_use_atr': True, 'bear_use_adx': False, 'bear_use_spike': True, 'bear_rsi_required': False, 'sideways_strategy': 'breakout', 'sideways_bb_std_mult': 1.2202688497233107, 'sideways_rsi_os': 33, 'sideways_rsi_ob': 70, 'sideways_adx_thresh': 30.20157277807777, 'sideways_atr_min_pct': 0.004752038765753046, 'sideways_atr_max_pct': 0.012399847765929652, 'sideways_tp_mult': 1.764835913716519, 'sideways_tsl_mult': 0.7751146162861376, 'sideways_time_stop': 24, 'sideways_use_sma': False, 'sideways_use_ema': False, 'sideways_use_atr': False, 'sideways_use_adx': True, 'sideways_use_spike': False, 'sideways_rsi_required': True}.
[I 2025-08-31 11:22:14,466] Trial 200 finished with values: [-1000000000.0, 1000000000.0] and parameters: {'p_sma': 5, 'p_std': 27, 'p_atr': 25, 'p_adx': 21, 'rsi_period': 55, 'ema1': 19, 'ema2': 14, 'slip_atr_k': 0.043539168197568444, 'slip_spread_k': 0.6523764474278955, 'spread_hl_frac': 0.04437566225838853, 'bb_std_mult': 2.195663737663886, 'rsi_os': 11, 'rsi_ob': 80, 'vol_spike': 0.04401087537219546, 'adx_thresh': 31.651389424630327, 'atr_min_pct': 0.003949461178725073, 'atr_max_pct': 0.016165948441571376, 'tp_mult': 2.9431178980199197, 'tsl_mult': 0.037490655627032375, 'strategy': 'breakout', 'time_stop': 295, 'use_sma': False, 'use_atr': True, 'use_adx': False, 'use_ema': False, 'use_spike': True, 'rsi_required': True, 'edge_k': 0.3251278630517312, 'edge_cap': 0.8771776663841517, 'bull_strategy': 'breakout', 'bull_bb_std_mult': 0.8831899454665119, 'bull_rsi_os': 22, 'bull_rsi_ob': 89, 'bull_adx_thresh': 11.56298101247842, 'bull_atr_min_pct': 0.021670165827908514, 'bull_atr_max_pct': 0.1319165578671877, 'bull_tp_mult': 2.875939947276657, 'bull_tsl_mult': 0.2973263461603633, 'bull_time_stop': 154, 'bull_use_sma': True, 'bull_use_ema': False, 'bull_use_atr': True, 'bull_use_adx': True, 'bull_use_spike': False, 'bull_rsi_required': True, 'bear_strategy': 'breakout', 'bear_bb_std_mult': 3.372656516723718, 'bear_rsi_os': 15, 'bear_rsi_ob': 70, 'bear_adx_thresh': 32.48847531317426, 'bear_atr_min_pct': 0.014120670635856931, 'bear_atr_max_pct': 0.07549151296742623, 'bear_tp_mult': 2.6004107192381323, 'bear_tsl_mult': 0.36676854786802937, 'bear_time_stop': 271, 'bear_use_sma': True, 'bear_use_ema': True, 'bear_use_atr': True, 'bear_use_adx': False, 'bear_use_spike': True, 'bear_rsi_required': False, 'sideways_strategy': 'breakout', 'sideways_bb_std_mult': 0.6739520101611352, 'sideways_rsi_os': 32, 'sideways_rsi_ob': 74, 'sideways_adx_thresh': 8.527221752208249, 'sideways_atr_min_pct': 0.003966701356102182, 'sideways_atr_max_pct': 0.02353633519578637, 'sideways_tp_mult': 2.3251525072943986, 'sideways_tsl_mult': 0.6879150821365178, 'sideways_time_stop': 101, 'sideways_use_sma': False, 'sideways_use_ema': False, 'sideways_use_atr': False, 'sideways_use_adx': True, 'sideways_use_spike': False, 'sideways_rsi_required': False}.
[I 2025-08-31 11:22:14,773] Trial 203 finished with values: [-1000000000.0, 1000000000.0] and parameters: {'p_sma': 58, 'p_std': 15, 'p_atr': 29, 'p_adx': 21, 'rsi_period': 71, 'ema1': 20, 'ema2': 16, 'slip_atr_k': 0.04423651738475815, 'slip_spread_k': 0.9996751193054816, 'spread_hl_frac': 0.04465360586000804, 'bb_std_mult': 2.340183729225324, 'rsi_os': 11, 'rsi_ob': 80, 'vol_spike': 0.042508367495202495, 'adx_thresh': 20.131170462833058, 'atr_min_pct': 0.028859783868272836, 'atr_max_pct': 0.08392164570839891, 'tp_mult': 2.952772168782486, 'tsl_mult': 0.9237505388614696, 'strategy': 'mean_reversion', 'time_stop': 294, 'use_sma': False, 'use_atr': True, 'use_adx': False, 'use_ema': False, 'use_spike': True, 'rsi_required': True, 'edge_k': 1.16685870278274, 'edge_cap': 0.929371912997435, 'bull_strategy': 'breakout', 'bull_bb_std_mult': 3.5399139442604124, 'bull_rsi_os': 21, 'bull_rsi_ob': 90, 'bull_adx_thresh': 33.300728112689384, 'bull_atr_min_pct': 0.0299879235468236, 'bull_atr_max_pct': 0.10429406562232031, 'bull_tp_mult': 2.157671873936779, 'bull_tsl_mult': 0.8019968889116937, 'bull_time_stop': 146, 'bull_use_sma': False, 'bull_use_ema': True, 'bull_use_atr': True, 'bull_use_adx': True, 'bull_use_spike': False, 'bull_rsi_required': True, 'bear_strategy': 'breakout', 'bear_bb_std_mult': 1.6832410609619894, 'bear_rsi_os': 17, 'bear_rsi_ob': 56, 'bear_adx_thresh': 32.78331891583623, 'bear_atr_min_pct': 0.01542644936188096, 'bear_atr_max_pct': 0.10929485564786962, 'bear_tp_mult': 2.627941029975118, 'bear_tsl_mult': 0.3466552815408558, 'bear_time_stop': 270, 'bear_use_sma': True, 'bear_use_ema': True, 'bear_use_atr': True, 'bear_use_adx': False, 'bear_use_spike': True, 'bear_rsi_required': False, 'sideways_strategy': 'breakout', 'sideways_bb_std_mult': 2.654891905596341, 'sideways_rsi_os': 31, 'sideways_rsi_ob': 74, 'sideways_adx_thresh': 18.249858317964698, 'sideways_atr_min_pct': 0.0023989745744216417, 'sideways_atr_max_pct': 0.09542460415823448, 'sideways_tp_mult': 2.162485822495286, 'sideways_tsl_mult': 0.7398080607861284, 'sideways_time_stop': 10, 'sideways_use_sma': False, 'sideways_use_ema': False, 'sideways_use_atr': False, 'sideways_use_adx': True, 'sideways_use_spike': False, 'sideways_rsi_required': False}.
[I 2025-08-31 11:22:15,011] Trial 202 finished with values: [-1000000000.0, 1000000000.0] and parameters: {'p_sma': 10, 'p_std': 17, 'p_atr': 21, 'p_adx': 21, 'rsi_period': 55, 'ema1': 19, 'ema2': 15, 'slip_atr_k': 0.043202482809365755, 'slip_spread_k': 0.6476419550166889, 'spread_hl_frac': 0.029449502385396654, 'bb_std_mult': 2.195025595193813, 'rsi_os': 54, 'rsi_ob': 67, 'vol_spike': 0.17270965890972914, 'adx_thresh': 31.71365836233209, 'atr_min_pct': 0.0008223526817686877, 'atr_max_pct': 0.019262337997654595, 'tp_mult': 1.3410742766004904, 'tsl_mult': 0.7348564453465861, 'strategy': 'breakout', 'time_stop': 295, 'use_sma': False, 'use_atr': True, 'use_adx': False, 'use_ema': False, 'use_spike': True, 'rsi_required': True, 'edge_k': 1.7885550818465359, 'edge_cap': 0.5100469320732296, 'bull_strategy': 'breakout', 'bull_bb_std_mult': 0.6534047478992282, 'bull_rsi_os': 48, 'bull_rsi_ob': 90, 'bull_adx_thresh': 11.583271039383671, 'bull_atr_min_pct': 0.009679395082047742, 'bull_atr_max_pct': 0.13041031259228525, 'bull_tp_mult': 2.8911710538626565, 'bull_tsl_mult': 0.30328287543737026, 'bull_time_stop': 157, 'bull_use_sma': False, 'bull_use_ema': True, 'bull_use_atr': True, 'bull_use_adx': True, 'bull_use_spike': False, 'bull_rsi_required': True, 'bear_strategy': 'breakout', 'bear_bb_std_mult': 0.7405539265371517, 'bear_rsi_os': 15, 'bear_rsi_ob': 55, 'bear_adx_thresh': 32.61086402286603, 'bear_atr_min_pct': 0.0068524593159898055, 'bear_atr_max_pct': 0.11971275746862337, 'bear_tp_mult': 1.7799736184122317, 'bear_tsl_mult': 0.31982153974507527, 'bear_time_stop': 107, 'bear_use_sma': True, 'bear_use_ema': True, 'bear_use_atr': True, 'bear_use_adx': False, 'bear_use_spike': True, 'bear_rsi_required': False, 'sideways_strategy': 'breakout', 'sideways_bb_std_mult': 0.6375272028619463, 'sideways_rsi_os': 30, 'sideways_rsi_ob': 49, 'sideways_adx_thresh': 8.49928221977292, 'sideways_atr_min_pct': 0.0049767123936106696, 'sideways_atr_max_pct': 0.09300046369982011, 'sideways_tp_mult': 2.324968425349659, 'sideways_tsl_mult': 0.7320286224443583, 'sideways_time_stop': 26, 'sideways_use_sma': False, 'sideways_use_ema': False, 'sideways_use_atr': False, 'sideways_use_adx': True, 'sideways_use_spike': False, 'sideways_rsi_required': False}.
[I 2025-08-31 11:22:15,136] Trial 201 finished with values: [-0.09508348270029743, 0.09489885736602766] and parameters: {'p_sma': 33, 'p_std': 13, 'p_atr': 10, 'p_adx': 20, 'rsi_period': 55, 'ema1': 20, 'ema2': 15, 'slip_atr_k': 0.041679417443707636, 'slip_spread_k': 0.9963976646697037, 'spread_hl_frac': 0.044075062052312285, 'bb_std_mult': 2.320867468832297, 'rsi_os': 49, 'rsi_ob': 80, 'vol_spike': 0.15686011049454, 'adx_thresh': 31.61056554957221, 'atr_min_pct': 0.0013418816296731203, 'atr_max_pct': 0.10798922443167427, 'tp_mult': 2.9217743647818786, 'tsl_mult': 0.7224519104301851, 'strategy': 'breakout', 'time_stop': 85, 'use_sma': False, 'use_atr': True, 'use_adx': False, 'use_ema': False, 'use_spike': True, 'rsi_required': True, 'edge_k': 1.1764949837763148, 'edge_cap': 0.5075701321192629, 'bull_strategy': 'breakout', 'bull_bb_std_mult': 3.4357247695319444, 'bull_rsi_os': 27, 'bull_rsi_ob': 90, 'bull_adx_thresh': 11.69596744447021, 'bull_atr_min_pct': 0.0007322349290098742, 'bull_atr_max_pct': 0.03944700539554769, 'bull_tp_mult': 2.8893097306687423, 'bull_tsl_mult': 0.30109958557729716, 'bull_time_stop': 156, 'bull_use_sma': True, 'bull_use_ema': True, 'bull_use_atr': True, 'bull_use_adx': True, 'bull_use_spike': False, 'bull_rsi_required': True, 'bear_strategy': 'breakout', 'bear_bb_std_mult': 2.0316081627447145, 'bear_rsi_os': 17, 'bear_rsi_ob': 48, 'bear_adx_thresh': 32.71460382254652, 'bear_atr_min_pct': 0.001835111456510918, 'bear_atr_max_pct': 0.11804597739538905, 'bear_tp_mult': 2.60905913181257, 'bear_tsl_mult': 0.3656947713991055, 'bear_time_stop': 104, 'bear_use_sma': True, 'bear_use_ema': True, 'bear_use_atr': True, 'bear_use_adx': False, 'bear_use_spike': True, 'bear_rsi_required': False, 'sideways_strategy': 'breakout', 'sideways_bb_std_mult': 1.0293094476855125, 'sideways_rsi_os': 31, 'sideways_rsi_ob': 91, 'sideways_adx_thresh': 34.95795472544697, 'sideways_atr_min_pct': 0.002551612370935716, 'sideways_atr_max_pct': 0.10914901942624657, 'sideways_tp_mult': 1.7129234490105265, 'sideways_tsl_mult': 0.7353067157150562, 'sideways_time_stop': 25, 'sideways_use_sma': False, 'sideways_use_ema': False, 'sideways_use_atr': False, 'sideways_use_adx': True, 'sideways_use_spike': False, 'sideways_rsi_required': False}.
[I 2025-08-31 11:22:46,016] Trial 205 finished with values: [-1000000000.0, 1000000000.0] and parameters: {'p_sma': 45, 'p_std': 24, 'p_atr': 21, 'p_adx': 19, 'rsi_period': 48, 'ema1': 27, 'ema2': 15, 'slip_atr_k': 0.1946884284574569, 'slip_spread_k': 0.6167645371739109, 'spread_hl_frac': 0.029358873062698694, 'bb_std_mult': 2.260800983526288, 'rsi_os': 54, 'rsi_ob': 51, 'vol_spike': 0.15664281037290806, 'adx_thresh': 21.092261025991174, 'atr_min_pct': 0.0008310238796584513, 'atr_max_pct': 0.10728146819358737, 'tp_mult': 1.106745029669828, 'tsl_mult': 0.04932125732411839, 'strategy': 'breakout', 'time_stop': 295, 'use_sma': False, 'use_atr': True, 'use_adx': True, 'use_ema': False, 'use_spike': False, 'rsi_required': True, 'edge_k': 1.3392646864698599, 'edge_cap': 0.508782279952147, 'bull_strategy': 'breakout', 'bull_bb_std_mult': 0.8034464332360198, 'bull_rsi_os': 40, 'bull_rsi_ob': 60, 'bull_adx_thresh': 26.99258408198901, 'bull_atr_min_pct': 0.01670526210228404, 'bull_atr_max_pct': 0.14097158137994925, 'bull_tp_mult': 1.638318054478381, 'bull_tsl_mult': 0.3089564080608145, 'bull_time_stop': 162, 'bull_use_sma': True, 'bull_use_ema': False, 'bull_use_atr': True, 'bull_use_adx': True, 'bull_use_spike': False, 'bull_rsi_required': True, 'bear_strategy': 'breakout', 'bear_bb_std_mult': 2.0778968620140694, 'bear_rsi_os': 51, 'bear_rsi_ob': 79, 'bear_adx_thresh': 33.994198782043185, 'bear_atr_min_pct': 0.006949744303192286, 'bear_atr_max_pct': 0.1187437454684189, 'bear_tp_mult': 1.4644362379188336, 'bear_tsl_mult': 0.6726966627405271, 'bear_time_stop': 61, 'bear_use_sma': True, 'bear_use_ema': False, 'bear_use_atr': True, 'bear_use_adx': False, 'bear_use_spike': True, 'bear_rsi_required': False, 'sideways_strategy': 'breakout', 'sideways_bb_std_mult': 3.2266448737085365, 'sideways_rsi_os': 31, 'sideways_rsi_ob': 91, 'sideways_adx_thresh': 7.455300258269, 'sideways_atr_min_pct': 0.0026113164811431906, 'sideways_atr_max_pct': 0.10919530262103067, 'sideways_tp_mult': 1.9561635651941016, 'sideways_tsl_mult': 0.6745180944659988, 'sideways_time_stop': 254, 'sideways_use_sma': False, 'sideways_use_ema': False, 'sideways_use_atr': False, 'sideways_use_adx': True, 'sideways_use_spike': False, 'sideways_rsi_required': True}.
[I 2025-08-31 11:22:46,177] Trial 206 finished with values: [-1000000000.0, 1000000000.0] and parameters: {'p_sma': 52, 'p_std': 9, 'p_atr': 10, 'p_adx': 19, 'rsi_period': 57, 'ema1': 27, 'ema2': 56, 'slip_atr_k': 0.21333353065977337, 'slip_spread_k': 0.7370592131878029, 'spread_hl_frac': 0.042169554430814986, 'bb_std_mult': 2.2687583034197196, 'rsi_os': 38, 'rsi_ob': 81, 'vol_spike': 0.2308794535793396, 'adx_thresh': 30.95029467197529, 'atr_min_pct': 0.0012515870918863624, 'atr_max_pct': 0.04811481969555951, 'tp_mult': 2.8686220598441765, 'tsl_mult': 0.05158886116902321, 'strategy': 'breakout', 'time_stop': 300, 'use_sma': False, 'use_atr': True, 'use_adx': True, 'use_ema': False, 'use_spike': False, 'rsi_required': True, 'edge_k': 0.3462659427988018, 'edge_cap': 0.3646295903401765, 'bull_strategy': 'breakout', 'bull_bb_std_mult': 1.2682659785134416, 'bull_rsi_os': 28, 'bull_rsi_ob': 60, 'bull_adx_thresh': 9.901985760749252, 'bull_atr_min_pct': 0.016737287525700643, 'bull_atr_max_pct': 0.09885967744921775, 'bull_tp_mult': 1.6524060564244039, 'bull_tsl_mult': 0.3961010628793297, 'bull_time_stop': 70, 'bull_use_sma': True, 'bull_use_ema': False, 'bull_use_atr': True, 'bull_use_adx': True, 'bull_use_spike': False, 'bull_rsi_required': True, 'bear_strategy': 'breakout', 'bear_bb_std_mult': 0.8697105880211051, 'bear_rsi_os': 17, 'bear_rsi_ob': 58, 'bear_adx_thresh': 33.98155481391861, 'bear_atr_min_pct': 0.021057240346192756, 'bear_atr_max_pct': 0.1114265091436135, 'bear_tp_mult': 1.6961761769422352, 'bear_tsl_mult': 0.6779607473777717, 'bear_time_stop': 59, 'bear_use_sma': True, 'bear_use_ema': False, 'bear_use_atr': True, 'bear_use_adx': False, 'bear_use_spike': True, 'bear_rsi_required': False, 'sideways_strategy': 'breakout', 'sideways_bb_std_mult': 1.0401537927423556, 'sideways_rsi_os': 12, 'sideways_rsi_ob': 61, 'sideways_adx_thresh': 14.724140403680897, 'sideways_atr_min_pct': 0.0007762537815314812, 'sideways_atr_max_pct': 0.01807522315983787, 'sideways_tp_mult': 2.23175078416283, 'sideways_tsl_mult': 0.532086699324077, 'sideways_time_stop': 251, 'sideways_use_sma': False, 'sideways_use_ema': False, 'sideways_use_atr': False, 'sideways_use_adx': True, 'sideways_use_spike': False, 'sideways_rsi_required': True}.
[I 2025-08-31 11:22:46,502] Trial 204 finished with values: [-0.037944204127769776, 0.03815382698672782] and parameters: {'p_sma': 58, 'p_std': 16, 'p_atr': 22, 'p_adx': 19, 'rsi_period': 21, 'ema1': 14, 'ema2': 16, 'slip_atr_k': 0.19595984931626004, 'slip_spread_k': 0.6959285552587616, 'spread_hl_frac': 0.045297162923629265, 'bb_std_mult': 2.3395668282751827, 'rsi_os': 5, 'rsi_ob': 65, 'vol_spike': 0.17200655106429188, 'adx_thresh': 30.784719904061795, 'atr_min_pct': 0.0009982691270081013, 'atr_max_pct': 0.08521157214550604, 'tp_mult': 1.3545159424839648, 'tsl_mult': 0.38359895056725424, 'strategy': 'breakout', 'time_stop': 300, 'use_sma': False, 'use_atr': True, 'use_adx': True, 'use_ema': False, 'use_spike': False, 'rsi_required': True, 'edge_k': 1.797078885864854, 'edge_cap': 0.5427947510377034, 'bull_strategy': 'breakout', 'bull_bb_std_mult': 0.6426725548250991, 'bull_rsi_os': 21, 'bull_rsi_ob': 93, 'bull_adx_thresh': 10.11383060020972, 'bull_atr_min_pct': 0.028103546720787367, 'bull_atr_max_pct': 0.14023874334862754, 'bull_tp_mult': 1.6500890722272408, 'bull_tsl_mult': 0.38921235686331607, 'bull_time_stop': 148, 'bull_use_sma': False, 'bull_use_ema': True, 'bull_use_atr': True, 'bull_use_adx': True, 'bull_use_spike': False, 'bull_rsi_required': True, 'bear_strategy': 'breakout', 'bear_bb_std_mult': 3.517920695869627, 'bear_rsi_os': 17, 'bear_rsi_ob': 81, 'bear_adx_thresh': 34.088336594332695, 'bear_atr_min_pct': 0.019180655111705195, 'bear_atr_max_pct': 0.11945733512097603, 'bear_tp_mult': 1.9221146695195264, 'bear_tsl_mult': 0.700474594557696, 'bear_time_stop': 60, 'bear_use_sma': True, 'bear_use_ema': False, 'bear_use_atr': True, 'bear_use_adx': False, 'bear_use_spike': True, 'bear_rsi_required': False, 'sideways_strategy': 'breakout', 'sideways_bb_std_mult': 0.7807379083258383, 'sideways_rsi_os': 31, 'sideways_rsi_ob': 69, 'sideways_adx_thresh': 33.815035114705296, 'sideways_atr_min_pct': 0.002522230266517997, 'sideways_atr_max_pct': 0.01836548556569583, 'sideways_tp_mult': 2.1524989516515314, 'sideways_tsl_mult': 0.7423138578043791, 'sideways_time_stop': 73, 'sideways_use_sma': False, 'sideways_use_ema': False, 'sideways_use_atr': False, 'sideways_use_adx': True, 'sideways_use_spike': False, 'sideways_rsi_required': True}.
