[I 2025-08-31 11:02:02,321] Trial 44 finished with values: [-1000000000.0, 1000000000.0] and parameters: {'p_sma': 29, 'p_std': 26, 'p_atr': 9, 'p_adx': 23, 'rsi_period': 56, 'ema1': 17, 'ema2': 15, 'slip_atr_k': 0.12760825868346057, 'slip_spread_k': 0.14540946334554494, 'spread_hl_frac': 0.04424713784764813, 'bb_std_mult': 2.121063586210212, 'rsi_os': 32, 'rsi_ob': 70, 'vol_spike': 0.26757765546688655, 'adx_thresh': 31.249778129511668, 'atr_min_pct': 0.007081955373424365, 'atr_max_pct': 0.11785094938081944, 'tp_mult': 2.2326216821858638, 'tsl_mult': 0.9575130236388953, 'strategy': 'breakout', 'time_stop': 214, 'use_sma': True, 'use_atr': True, 'use_adx': True, 'use_ema': True, 'use_spike': False, 'rsi_required': True, 'edge_k': 0.00962150307688564, 'edge_cap': 0.7354276150264712, 'bull_strategy': 'breakout', 'bull_bb_std_mult': 2.552514345394702, 'bull_rsi_os': 50, 'bull_rsi_ob': 91, 'bull_adx_thresh': 22.53539030398796, 'bull_atr_min_pct': 0.022858434398883007, 'bull_atr_max_pct': 0.03235634815843169, 'bull_tp_mult': 1.9386271526785517, 'bull_tsl_mult': 0.8557867530371537, 'bull_time_stop': 167, 'bull_use_sma': True, 'bull_use_ema': False, 'bull_use_atr': False, 'bull_use_adx': False, 'bull_use_spike': False, 'bull_rsi_required': True, 'bear_strategy': 'breakout', 'bear_bb_std_mult': 1.0445898941174083, 'bear_rsi_os': 31, 'bear_rsi_ob': 71, 'bear_adx_thresh': 31.62704637762846, 'bear_atr_min_pct': 0.017116669303516255, 'bear_atr_max_pct': 0.07508242688184616, 'bear_tp_mult': 2.2187339092716485, 'bear_tsl_mult': 0.9530910863777349, 'bear_time_stop': 114, 'bear_use_sma': True, 'bear_use_ema': False, 'bear_use_atr': True, 'bear_use_adx': False, 'bear_use_spike': False, 'bear_rsi_required': True, 'sideways_strategy': 'breakout', 'sideways_bb_std_mult': 1.929862044200267, 'sideways_rsi_os': 21, 'sideways_rsi_ob': 52, 'sideways_adx_thresh': 9.453814196755072, 'sideways_atr_min_pct': 0.013490118369871617, 'sideways_atr_max_pct': 0.038260731645534056, 'sideways_tp_mult': 2.652287880847276, 'sideways_tsl_mult': 0.8906317445104222, 'sideways_time_stop': 132, 'sideways_use_sma': True, 'sideways_use_ema': True, 'sideways_use_atr': True, 'sideways_use_adx': False, 'sideways_use_spike': True, 'sideways_rsi_required': True}.
[I 2025-08-31 11:02:34,088] Trial 49 finished with values: [-1000000000.0, 1000000000.0] and parameters: {'p_sma': 33, 'p_std': 18, 'p_atr': 15, 'p_adx': 27, 'rsi_period': 75, 'ema1': 6, 'ema2': 45, 'slip_atr_k': 0.08713690003970144, 'slip_spread_k': 0.8358670262893189, 'spread_hl_frac': 0.02490257942903279, 'bb_std_mult': 0.5908014414769014, 'rsi_os': 37, 'rsi_ob': 85, 'vol_spike': 0.21281729958453108, 'adx_thresh': 34.8516161970516, 'atr_min_pct': 0.016439844357088222, 'atr_max_pct': 0.07947934324814382, 'tp_mult': 2.0228335442193703, 'tsl_mult': 0.4494879110979918, 'strategy': 'mean_reversion', 'time_stop': 280, 'use_sma': False, 'use_atr': False, 'use_adx': False, 'use_ema': False, 'use_spike': True, 'rsi_required': False, 'edge_k': 0.32089126543752855, 'edge_cap': 0.352232896179631, 'bull_strategy': 'mean_reversion', 'bull_bb_std_mult': 2.863024483695334, 'bull_rsi_os': 43, 'bull_rsi_ob': 79, 'bull_adx_thresh': 15.030545285840892, 'bull_atr_min_pct': 0.027591673694308306, 'bull_atr_max_pct': 0.1349698020161078, 'bull_tp_mult': 2.4972802556678717, 'bull_tsl_mult': 0.5265539270075111, 'bull_time_stop': 169, 'bull_use_sma': True, 'bull_use_ema': False, 'bull_use_atr': False, 'bull_use_adx': False, 'bull_use_spike': True, 'bull_rsi_required': False, 'bear_strategy': 'breakout', 'bear_bb_std_mult': 0.6923361770275429, 'bear_rsi_os': 10, 'bear_rsi_ob': 77, 'bear_adx_thresh': 5.033170568990053, 'bear_atr_min_pct': 0.024148956074522766, 'bear_atr_max_pct': 0.13288379325563082, 'bear_tp_mult': 1.6652394012361489, 'bear_tsl_mult': 0.8615938883226912, 'bear_time_stop': 270, 'bear_use_sma': True, 'bear_use_ema': True, 'bear_use_atr': False, 'bear_use_adx': True, 'bear_use_spike': True, 'bear_rsi_required': True, 'sideways_strategy': 'breakout', 'sideways_bb_std_mult': 3.1776788262846276, 'sideways_rsi_os': 47, 'sideways_rsi_ob': 91, 'sideways_adx_thresh': 11.960632511661059, 'sideways_atr_min_pct': 0.01966228944751077, 'sideways_atr_max_pct': 0.06700657739007211, 'sideways_tp_mult': 2.8357683096126935, 'sideways_tsl_mult': 0.5975171486797807, 'sideways_time_stop': 112, 'sideways_use_sma': True, 'sideways_use_ema': False, 'sideways_use_atr': False, 'sideways_use_adx': True, 'sideways_use_spike': False, 'sideways_rsi_required': False}.
[I 2025-08-31 11:02:35,039] Trial 47 finished with values: [-0.13885209089277617, 0.13862725941442094] and parameters: {'p_sma': 34, 'p_std': 17, 'p_atr': 27, 'p_adx': 27, 'rsi_period': 73, 'ema1': 26, 'ema2': 44, 'slip_atr_k': 0.09433471253695722, 'slip_spread_k': 0.31418765425453843, 'spread_hl_frac': 0.03691679669263687, 'bb_std_mult': 2.1729668662359534, 'rsi_os': 31, 'rsi_ob': 85, 'vol_spike': 0.2681976815838202, 'adx_thresh': 27.904342465931997, 'atr_min_pct': 1.07078671431355e-05, 'atr_max_pct': 0.024434980713270278, 'tp_mult': 2.2720245710903297, 'tsl_mult': 0.9835538086878585, 'strategy': 'mean_reversion', 'time_stop': 43, 'use_sma': False, 'use_atr': True, 'use_adx': False, 'use_ema': False, 'use_spike': True, 'rsi_required': False, 'edge_k': 0.522674178395631, 'edge_cap': 0.27200005312098063, 'bull_strategy': 'breakout', 'bull_bb_std_mult': 2.9235818105862315, 'bull_rsi_os': 49, 'bull_rsi_ob': 92, 'bull_adx_thresh': 9.452213476317421, 'bull_atr_min_pct': 0.00779998205704495, 'bull_atr_max_pct': 0.10085154581691821, 'bull_tp_mult': 2.455648936428955, 'bull_tsl_mult': 0.8757595950300983, 'bull_time_stop': 165, 'bull_use_sma': True, 'bull_use_ema': False, 'bull_use_atr': False, 'bull_use_adx': False, 'bull_use_spike': True, 'bull_rsi_required': True, 'bear_strategy': 'breakout', 'bear_bb_std_mult': 0.721993817892693, 'bear_rsi_os': 38, 'bear_rsi_ob': 71, 'bear_adx_thresh': 5.025299820546873, 'bear_atr_min_pct': 0.023893040876220788, 'bear_atr_max_pct': 0.07612989601085196, 'bear_tp_mult': 1.6728733440526797, 'bear_tsl_mult': 0.958635534029918, 'bear_time_stop': 179, 'bear_use_sma': True, 'bear_use_ema': True, 'bear_use_atr': False, 'bear_use_adx': True, 'bear_use_spike': True, 'bear_rsi_required': True, 'sideways_strategy': 'breakout', 'sideways_bb_std_mult': 0.9714405976235018, 'sideways_rsi_os': 47, 'sideways_rsi_ob': 45, 'sideways_adx_thresh': 12.206205178373413, 'sideways_atr_min_pct': 0.001626907025245765, 'sideways_atr_max_pct': 0.03809460688856573, 'sideways_tp_mult': 2.60939856479272, 'sideways_tsl_mult': 0.31744154862188234, 'sideways_time_stop': 118, 'sideways_use_sma': True, 'sideways_use_ema': True, 'sideways_use_atr': False, 'sideways_use_adx': True, 'sideways_use_spike': True, 'sideways_rsi_required': False}.
[I 2025-08-31 11:02:35,388] Trial 48 finished with values: [-1000000000.0, 1000000000.0] and parameters: {'p_sma': 34, 'p_std': 16, 'p_atr': 15, 'p_adx': 27, 'rsi_period': 79, 'ema1': 6, 'ema2': 44, 'slip_atr_k': 0.09127093520808413, 'slip_spread_k': 0.8339292241664656, 'spread_hl_frac': 0.024600868124516184, 'bb_std_mult': 0.5292663648217681, 'rsi_os': 37, 'rsi_ob': 83, 'vol_spike': 0.015475609874086055, 'adx_thresh': 32.23510033140559, 'atr_min_pct': 0.00011224439873879812, 'atr_max_pct': 0.11838527209298266, 'tp_mult': 2.2563465847964865, 'tsl_mult': 0.17085656034734492, 'strategy': 'mean_reversion', 'time_stop': 144, 'use_sma': False, 'use_atr': True, 'use_adx': False, 'use_ema': False, 'use_spike': True, 'rsi_required': False, 'edge_k': 1.5678603789854746, 'edge_cap': 0.6238955376200839, 'bull_strategy': 'breakout', 'bull_bb_std_mult': 2.910106089274702, 'bull_rsi_os': 8, 'bull_rsi_ob': 72, 'bull_adx_thresh': 8.831778023665915, 'bull_atr_min_pct': 0.012171041242683799, 'bull_atr_max_pct': 0.08537755913214015, 'bull_tp_mult': 2.452469746049763, 'bull_tsl_mult': 0.5070958372681404, 'bull_time_stop': 171, 'bull_use_sma': True, 'bull_use_ema': False, 'bull_use_atr': False, 'bull_use_adx': False, 'bull_use_spike': True, 'bull_rsi_required': True, 'bear_strategy': 'breakout', 'bear_bb_std_mult': 0.6502752464401089, 'bear_rsi_os': 17, 'bear_rsi_ob': 76, 'bear_adx_thresh': 21.7254146836676, 'bear_atr_min_pct': 0.023920205286955643, 'bear_atr_max_pct': 0.1351798803557559, 'bear_tp_mult': 1.275363575294671, 'bear_tsl_mult': 0.9648350857772162, 'bear_time_stop': 227, 'bear_use_sma': True, 'bear_use_ema': True, 'bear_use_atr': False, 'bear_use_adx': True, 'bear_use_spike': True, 'bear_rsi_required': True, 'sideways_strategy': 'breakout', 'sideways_bb_std_mult': 3.2110504959946304, 'sideways_rsi_os': 27, 'sideways_rsi_ob': 74, 'sideways_adx_thresh': 9.998706844823085, 'sideways_atr_min_pct': 0.020889788271012275, 'sideways_atr_max_pct': 0.13412357999721725, 'sideways_tp_mult': 2.600472520809215, 'sideways_tsl_mult': 0.30512997501929184, 'sideways_time_stop': 110, 'sideways_use_sma': True, 'sideways_use_ema': True, 'sideways_use_atr': False, 'sideways_use_adx': True, 'sideways_use_spike': True, 'sideways_rsi_required': False}.
[I 2025-08-31 11:02:35,615] Trial 46 finished with values: [-1000000000.0, 1000000000.0] and parameters: {'p_sma': 60, 'p_std': 18, 'p_atr': 27, 'p_adx': 27, 'rsi_period': 49, 'ema1': 6, 'ema2': 17, 'slip_atr_k': 0.09015769430115826, 'slip_spread_k': 0.3316256421281816, 'spread_hl_frac': 0.03545972901935562, 'bb_std_mult': 2.1301738772136845, 'rsi_os': 31, 'rsi_ob': 76, 'vol_spike': 0.2692231768472375, 'adx_thresh': 26.96550613945871, 'atr_min_pct': 0.006948798593313075, 'atr_max_pct': 0.11833324971399427, 'tp_mult': 1.3575999323913677, 'tsl_mult': 0.9939002413155361, 'strategy': 'mean_reversion', 'time_stop': 269, 'use_sma': False, 'use_atr': True, 'use_adx': False, 'use_ema': False, 'use_spike': False, 'rsi_required': False, 'edge_k': 0.5108634011804394, 'edge_cap': 0.28402762710493495, 'bull_strategy': 'breakout', 'bull_bb_std_mult': 2.939487948060168, 'bull_rsi_os': 50, 'bull_rsi_ob': 92, 'bull_adx_thresh': 29.61796037108539, 'bull_atr_min_pct': 0.00875665124495909, 'bull_atr_max_pct': 0.03206466627026872, 'bull_tp_mult': 2.498148144085225, 'bull_tsl_mult': 0.6048264828271814, 'bull_time_stop': 172, 'bull_use_sma': True, 'bull_use_ema': False, 'bull_use_atr': False, 'bull_use_adx': False, 'bull_use_spike': False, 'bull_rsi_required': True, 'bear_strategy': 'breakout', 'bear_bb_std_mult': 0.6664034951482389, 'bear_rsi_os': 11, 'bear_rsi_ob': 71, 'bear_adx_thresh': 5.012840050751897, 'bear_atr_min_pct': 0.017845200857456122, 'bear_atr_max_pct': 0.07295350752879375, 'bear_tp_mult': 2.2905334191466595, 'bear_tsl_mult': 0.9578671080337382, 'bear_time_stop': 179, 'bear_use_sma': True, 'bear_use_ema': False, 'bear_use_atr': True, 'bear_use_adx': True, 'bear_use_spike': True, 'bear_rsi_required': True, 'sideways_strategy': 'breakout', 'sideways_bb_std_mult': 1.0210183174735918, 'sideways_rsi_os': 48, 'sideways_rsi_ob': 92, 'sideways_adx_thresh': 13.1354383335242, 'sideways_atr_min_pct': 0.013896248387459694, 'sideways_atr_max_pct': 0.03910854078509561, 'sideways_tp_mult': 2.6013840469206206, 'sideways_tsl_mult': 0.573157501562033, 'sideways_time_stop': 119, 'sideways_use_sma': True, 'sideways_use_ema': True, 'sideways_use_atr': False, 'sideways_use_adx': True, 'sideways_use_spike': True, 'sideways_rsi_required': False}.
[I 2025-08-31 11:03:07,398] Trial 52 finished with values: [-1000000000.0, 1000000000.0] and parameters: {'p_sma': 23, 'p_std': 9, 'p_atr': 17, 'p_adx': 29, 'rsi_period': 16, 'ema1': 6, 'ema2': 54, 'slip_atr_k': 0.0008322655717004218, 'slip_spread_k': 0.6535044198819877, 'spread_hl_frac': 0.00441127704122244, 'bb_std_mult': 1.6494432616693464, 'rsi_os': 52, 'rsi_ob': 90, 'vol_spike': 0.24137932568920742, 'adx_thresh': 16.2235524354224, 'atr_min_pct': 0.02721460868894977, 'atr_max_pct': 0.1273219038473773, 'tp_mult': 2.486602633774294, 'tsl_mult': 0.6358681894984018, 'strategy': 'breakout', 'time_stop': 181, 'use_sma': False, 'use_atr': False, 'use_adx': True, 'use_ema': True, 'use_spike': False, 'rsi_required': False, 'edge_k': 0.18193346775194025, 'edge_cap': 0.2111812510729309, 'bull_strategy': 'mean_reversion', 'bull_bb_std_mult': 1.6607800270123587, 'bull_rsi_os': 20, 'bull_rsi_ob': 76, 'bull_adx_thresh': 29.716145276543642, 'bull_atr_min_pct': 2.4566010946094896e-06, 'bull_atr_max_pct': 0.0731522626698072, 'bull_tp_mult': 2.7134612345399423, 'bull_tsl_mult': 0.0021330678953134785, 'bull_time_stop': 73, 'bull_use_sma': True, 'bull_use_ema': True, 'bull_use_atr': False, 'bull_use_adx': False, 'bull_use_spike': True, 'bull_rsi_required': True, 'bear_strategy': 'breakout', 'bear_bb_std_mult': 2.169571197198053, 'bear_rsi_os': 25, 'bear_rsi_ob': 66, 'bear_adx_thresh': 19.468884859695255, 'bear_atr_min_pct': 0.015972603997582126, 'bear_atr_max_pct': 0.11693319485725848, 'bear_tp_mult': 2.8842426942933272, 'bear_tsl_mult': 0.5005397319355317, 'bear_time_stop': 66, 'bear_use_sma': False, 'bear_use_ema': False, 'bear_use_atr': False, 'bear_use_adx': True, 'bear_use_spike': False, 'bear_rsi_required': False, 'sideways_strategy': 'breakout', 'sideways_bb_std_mult': 1.6710626089918863, 'sideways_rsi_os': 10, 'sideways_rsi_ob': 86, 'sideways_adx_thresh': 7.452296760844576, 'sideways_atr_min_pct': 0.016630126532791247, 'sideways_atr_max_pct': 0.05195957478119571, 'sideways_tp_mult': 2.413525872042075, 'sideways_tsl_mult': 0.13354082970041262, 'sideways_time_stop': 72, 'sideways_use_sma': True, 'sideways_use_ema': False, 'sideways_use_atr': True, 'sideways_use_adx': False, 'sideways_use_spike': False, 'sideways_rsi_required': True}.
[I 2025-08-31 11:03:07,888] Trial 53 finished with values: [-1000000000.0, 1000000000.0] and parameters: {'p_sma': 24, 'p_std': 43, 'p_atr': 17, 'p_adx': 30, 'rsi_period': 17, 'ema1': 21, 'ema2': 56, 'slip_atr_k': 0.16830366120559137, 'slip_spread_k': 0.6530111867790338, 'spread_hl_frac': 0.030018992199328243, 'bb_std_mult': 1.602571249273129, 'rsi_os': 42, 'rsi_ob': 90, 'vol_spike': 0.24332288190579165, 'adx_thresh': 13.007319385199473, 'atr_min_pct': 0.027425989985154785, 'atr_max_pct': 0.12662804622650145, 'tp_mult': 2.884980428900244, 'tsl_mult': 0.6323961569556326, 'strategy': 'breakout', 'time_stop': 187, 'use_sma': False, 'use_atr': False, 'use_adx': True, 'use_ema': True, 'use_spike': False, 'rsi_required': False, 'edge_k': 0.19453832093792378, 'edge_cap': 0.21687948893532064, 'bull_strategy': 'mean_reversion', 'bull_bb_std_mult': 1.6605567573426754, 'bull_rsi_os': 20, 'bull_rsi_ob': 75, 'bull_adx_thresh': 25.79018118612564, 'bull_atr_min_pct': 0.003524511426404626, 'bull_atr_max_pct': 0.07374128559605723, 'bull_tp_mult': 2.238798802026679, 'bull_tsl_mult': 0.1898427463424471, 'bull_time_stop': 260, 'bull_use_sma': True, 'bull_use_ema': True, 'bull_use_atr': True, 'bull_use_adx': False, 'bull_use_spike': True, 'bull_rsi_required': False, 'bear_strategy': 'breakout', 'bear_bb_std_mult': 3.0484106713927672, 'bear_rsi_os': 25, 'bear_rsi_ob': 86, 'bear_adx_thresh': 34.764601422306015, 'bear_atr_min_pct': 0.011392984501515397, 'bear_atr_max_pct': 0.10255168817456918, 'bear_tp_mult': 2.887831599976978, 'bear_tsl_mult': 0.5446926631786012, 'bear_time_stop': 17, 'bear_use_sma': False, 'bear_use_ema': False, 'bear_use_atr': False, 'bear_use_adx': True, 'bear_use_spike': False, 'bear_rsi_required': False, 'sideways_strategy': 'breakout', 'sideways_bb_std_mult': 1.7067724388275676, 'sideways_rsi_os': 9, 'sideways_rsi_ob': 83, 'sideways_adx_thresh': 7.5242362615760285, 'sideways_atr_min_pct': 0.000220856972927407, 'sideways_atr_max_pct': 0.12022539321638825, 'sideways_tp_mult': 1.478111341361405, 'sideways_tsl_mult': 0.10891278759592427, 'sideways_time_stop': 271, 'sideways_use_sma': True, 'sideways_use_ema': False, 'sideways_use_atr': True, 'sideways_use_adx': False, 'sideways_use_spike': False, 'sideways_rsi_required': True}.
[I 2025-08-31 11:03:07,985] Trial 51 finished with values: [-1000000000.0, 1000000000.0] and parameters: {'p_sma': 60, 'p_std': 47, 'p_atr': 20, 'p_adx': 7, 'rsi_period': 26, 'ema1': 6, 'ema2': 54, 'slip_atr_k': 0.16653764849677763, 'slip_spread_k': 0.5556843332515855, 'spread_hl_frac': 0.0041841561975919025, 'bb_std_mult': 1.5436374910730004, 'rsi_os': 51, 'rsi_ob': 91, 'vol_spike': 0.03190944298829586, 'adx_thresh': 13.219815654633479, 'atr_min_pct': 0.02731167245904198, 'atr_max_pct': 0.12869006659121512, 'tp_mult': 2.9719600455162283, 'tsl_mult': 0.1927917804018821, 'strategy': 'breakout', 'time_stop': 148, 'use_sma': False, 'use_atr': False, 'use_adx': True, 'use_ema': True, 'use_spike': False, 'rsi_required': False, 'edge_k': 1.633600896633738, 'edge_cap': 0.6080013467812154, 'bull_strategy': 'mean_reversion', 'bull_bb_std_mult': 2.2259215504712326, 'bull_rsi_os': 8, 'bull_rsi_ob': 73, 'bull_adx_thresh': 30.146734892406776, 'bull_atr_min_pct': 0.015285482859086885, 'bull_atr_max_pct': 0.08726932241302203, 'bull_tp_mult': 1.3622967085193491, 'bull_tsl_mult': 0.0367335789139317, 'bull_time_stop': 68, 'bull_use_sma': True, 'bull_use_ema': True, 'bull_use_atr': False, 'bull_use_adx': False, 'bull_use_spike': True, 'bull_rsi_required': True, 'bear_strategy': 'breakout', 'bear_bb_std_mult': 2.141714862464716, 'bear_rsi_os': 25, 'bear_rsi_ob': 66, 'bear_adx_thresh': 21.60444138235806, 'bear_atr_min_pct': 0.015386296219896786, 'bear_atr_max_pct': 0.08655691201912726, 'bear_tp_mult': 2.8588074215692054, 'bear_tsl_mult': 0.47249929603080093, 'bear_time_stop': 226, 'bear_use_sma': False, 'bear_use_ema': False, 'bear_use_atr': False, 'bear_use_adx': True, 'bear_use_spike': False, 'bear_rsi_required': False, 'sideways_strategy': 'breakout', 'sideways_bb_std_mult': 1.7702038096092831, 'sideways_rsi_os': 27, 'sideways_rsi_ob': 74, 'sideways_adx_thresh': 17.109944393944286, 'sideways_atr_min_pct': 0.003865743362548876, 'sideways_atr_max_pct': 0.1225482984982903, 'sideways_tp_mult': 1.6242920094159927, 'sideways_tsl_mult': 0.1476056128782136, 'sideways_time_stop': 258, 'sideways_use_sma': True, 'sideways_use_ema': True, 'sideways_use_atr': True, 'sideways_use_adx': False, 'sideways_use_spike': False, 'sideways_rsi_required': True}.
[I 2025-08-31 11:03:08,611] Trial 50 finished with values: [-1000000000.0, 1000000000.0] and parameters: {'p_sma': 55, 'p_std': 47, 'p_atr': 26, 'p_adx': 8, 'rsi_period': 76, 'ema1': 6, 'ema2': 55, 'slip_atr_k': 0.09421616445957733, 'slip_spread_k': 0.6508289125881344, 'spread_hl_frac': 0.036833451171758805, 'bb_std_mult': 1.5153501589655776, 'rsi_os': 42, 'rsi_ob': 95, 'vol_spike': 0.04913511878520642, 'adx_thresh': 27.128422937917303, 'atr_min_pct': 0.02734916385023639, 'atr_max_pct': 0.14913793213275384, 'tp_mult': 2.469034212149589, 'tsl_mult': 0.19593350952987537, 'strategy': 'breakout', 'time_stop': 187, 'use_sma': False, 'use_atr': False, 'use_adx': False, 'use_ema': False, 'use_spike': True, 'rsi_required': False, 'edge_k': 1.654892309554044, 'edge_cap': 0.6323986014982113, 'bull_strategy': 'breakout', 'bull_bb_std_mult': 1.713607629001949, 'bull_rsi_os': 8, 'bull_rsi_ob': 72, 'bull_adx_thresh': 26.234864803299917, 'bull_atr_min_pct': 0.0075911917908660365, 'bull_atr_max_pct': 0.07449131095392594, 'bull_tp_mult': 2.6370373133123817, 'bull_tsl_mult': 0.1683970127047379, 'bull_time_stop': 276, 'bull_use_sma': True, 'bull_use_ema': True, 'bull_use_atr': False, 'bull_use_adx': False, 'bull_use_spike': True, 'bull_rsi_required': True, 'bear_strategy': 'breakout', 'bear_bb_std_mult': 2.2134504998578413, 'bear_rsi_os': 38, 'bear_rsi_ob': 86, 'bear_adx_thresh': 11.856868345856496, 'bear_atr_min_pct': 0.02826575493501205, 'bear_atr_max_pct': 0.08602850285896163, 'bear_tp_mult': 2.8937471125687795, 'bear_tsl_mult': 0.47611804071277325, 'bear_time_stop': 221, 'bear_use_sma': False, 'bear_use_ema': True, 'bear_use_atr': False, 'bear_use_adx': True, 'bear_use_spike': True, 'bear_rsi_required': False, 'sideways_strategy': 'breakout', 'sideways_bb_std_mult': 3.583039065921586, 'sideways_rsi_os': 26, 'sideways_rsi_ob': 47, 'sideways_adx_thresh': 10.694742296811341, 'sideways_atr_min_pct': 0.0014147193377154461, 'sideways_atr_max_pct': 0.12811817836262834, 'sideways_tp_mult': 2.5897964194526195, 'sideways_tsl_mult': 0.3140631316964899, 'sideways_time_stop': 77, 'sideways_use_sma': True, 'sideways_use_ema': True, 'sideways_use_atr': False, 'sideways_use_adx': False, 'sideways_use_spike': True, 'sideways_rsi_required': True}.
