[I 2025-08-31 11:29:52,803] Trial 261 finished with values: [-0.010138670763307545, 0.012315893986200288] and parameters: {'p_sma': 31, 'p_std': 34, 'p_atr': 10, 'p_adx': 27, 'rsi_period': 50, 'ema1': 11, 'ema2': 25, 'slip_atr_k': 0.0415916873870157, 'slip_spread_k': 0.07989238980255876, 'spread_hl_frac': 0.005640556818141844, 'bb_std_mult': 0.61555411158776, 'rsi_os': 34, 'rsi_ob': 70, 'vol_spike': 0.01696043863991964, 'adx_thresh': 27.046204880678356, 'atr_min_pct': 0.0038952599100288963, 'atr_max_pct': 0.020783264137115606, 'tp_mult': 1.0630486893084317, 'tsl_mult': 0.2892344430879426, 'strategy': 'breakout', 'time_stop': 264, 'use_sma': True, 'use_atr': True, 'use_adx': True, 'use_ema': False, 'use_spike': True, 'rsi_required': True, 'edge_k': 0.30163290675249876, 'edge_cap': 0.7720176434282852, 'bull_strategy': 'breakout', 'bull_bb_std_mult': 2.8488798243270512, 'bull_rsi_os': 34, 'bull_rsi_ob': 79, 'bull_adx_thresh': 12.994032222790132, 'bull_atr_min_pct': 0.004552508058558718, 'bull_atr_max_pct': 0.13962646477299653, 'bull_tp_mult': 2.7989280769862837, 'bull_tsl_mult': 0.1143809256377476, 'bull_time_stop': 148, 'bull_use_sma': True, 'bull_use_ema': True, 'bull_use_atr': True, 'bull_use_adx': True, 'bull_use_spike': False, 'bull_rsi_required': True, 'bear_strategy': 'breakout', 'bear_bb_std_mult': 1.1262268789684158, 'bear_rsi_os': 28, 'bear_rsi_ob': 93, 'bear_adx_thresh': 27.953717561088606, 'bear_atr_min_pct': 0.021075511611816568, 'bear_atr_max_pct': 0.0362538651391222, 'bear_tp_mult': 2.706350545107895, 'bear_tsl_mult': 0.41123085204500154, 'bear_time_stop': 251, 'bear_use_sma': False, 'bear_use_ema': True, 'bear_use_atr': True, 'bear_use_adx': False, 'bear_use_spike': True, 'bear_rsi_required': True, 'sideways_strategy': 'breakout', 'sideways_bb_std_mult': 1.759606526029031, 'sideways_rsi_os': 32, 'sideways_rsi_ob': 74, 'sideways_adx_thresh': 21.443359379212893, 'sideways_atr_min_pct': 0.003952046578882559, 'sideways_atr_max_pct': 0.04659698247218798, 'sideways_tp_mult': 1.3389125469607026, 'sideways_tsl_mult': 0.325921283659875, 'sideways_time_stop': 97, 'sideways_use_sma': True, 'sideways_use_ema': False, 'sideways_use_atr': True, 'sideways_use_adx': True, 'sideways_use_spike': False, 'sideways_rsi_required': True}.
[I 2025-08-31 11:29:53,755] Trial 262 finished with values: [-1000000000.0, 1000000000.0] and parameters: {'p_sma': 31, 'p_std': 23, 'p_atr': 9, 'p_adx': 25, 'rsi_period': 65, 'ema1': 11, 'ema2': 26, 'slip_atr_k': 0.0447805478571819, 'slip_spread_k': 0.0709699195120142, 'spread_hl_frac': 0.001536383619123414, 'bb_std_mult': 0.7508222245638305, 'rsi_os': 34, 'rsi_ob': 70, 'vol_spike': 0.017273572849730745, 'adx_thresh': 18.22726782539726, 'atr_min_pct': 0.003845212860812627, 'atr_max_pct': 0.01833793359830245, 'tp_mult': 2.148226332440903, 'tsl_mult': 0.2803688034064929, 'strategy': 'breakout', 'time_stop': 243, 'use_sma': True, 'use_atr': True, 'use_adx': True, 'use_ema': True, 'use_spike': True, 'rsi_required': True, 'edge_k': 1.7575694138819395, 'edge_cap': 0.6224749876257256, 'bull_strategy': 'breakout', 'bull_bb_std_mult': 2.5131054349795026, 'bull_rsi_os': 22, 'bull_rsi_ob': 79, 'bull_adx_thresh': 13.862464423606431, 'bull_atr_min_pct': 0.006435821790769028, 'bull_atr_max_pct': 0.03311007169541859, 'bull_tp_mult': 1.5042945896114241, 'bull_tsl_mult': 0.21159495765282116, 'bull_time_stop': 100, 'bull_use_sma': True, 'bull_use_ema': True, 'bull_use_atr': True, 'bull_use_adx': True, 'bull_use_spike': False, 'bull_rsi_required': True, 'bear_strategy': 'breakout', 'bear_bb_std_mult': 1.0702557099002425, 'bear_rsi_os': 28, 'bear_rsi_ob': 53, 'bear_adx_thresh': 17.771095315638355, 'bear_atr_min_pct': 0.022728472474058025, 'bear_atr_max_pct': 0.10975193689082396, 'bear_tp_mult': 2.7014143934150407, 'bear_tsl_mult': 0.1397468411134255, 'bear_time_stop': 250, 'bear_use_sma': False, 'bear_use_ema': True, 'bear_use_atr': True, 'bear_use_adx': False, 'bear_use_spike': True, 'bear_rsi_required': True, 'sideways_strategy': 'breakout', 'sideways_bb_std_mult': 1.7190133137358958, 'sideways_rsi_os': 32, 'sideways_rsi_ob': 94, 'sideways_adx_thresh': 7.994532729214244, 'sideways_atr_min_pct': 0.024367263925688942, 'sideways_atr_max_pct': 0.04594262272339514, 'sideways_tp_mult': 1.3418812144599246, 'sideways_tsl_mult': 0.469853485463838, 'sideways_time_stop': 15, 'sideways_use_sma': True, 'sideways_use_ema': False, 'sideways_use_atr': True, 'sideways_use_adx': True, 'sideways_use_spike': False, 'sideways_rsi_required': True}.
[I 2025-08-31 11:30:26,469] Trial 266 finished with values: [-1000000000.0, 1000000000.0] and parameters: {'p_sma': 25, 'p_std': 12, 'p_atr': 18, 'p_adx': 23, 'rsi_period': 50, 'ema1': 12, 'ema2': 51, 'slip_atr_k': 0.037955143437450344, 'slip_spread_k': 0.09131137935808945, 'spread_hl_frac': 0.03366150923102943, 'bb_std_mult': 0.5629127628531684, 'rsi_os': 33, 'rsi_ob': 70, 'vol_spike': 0.13755871622027846, 'adx_thresh': 24.985353397461495, 'atr_min_pct': 0.004372040169186873, 'atr_max_pct': 0.02178784686488903, 'tp_mult': 1.688748219850103, 'tsl_mult': 0.3053412295981201, 'strategy': 'breakout', 'time_stop': 294, 'use_sma': False, 'use_atr': True, 'use_adx': True, 'use_ema': True, 'use_spike': True, 'rsi_required': True, 'edge_k': 0.3424447044155227, 'edge_cap': 0.2385535692383609, 'bull_strategy': 'mean_reversion', 'bull_bb_std_mult': 3.594914881986249, 'bull_rsi_os': 24, 'bull_rsi_ob': 62, 'bull_adx_thresh': 13.175530645137474, 'bull_atr_min_pct': 0.003691632824659957, 'bull_atr_max_pct': 0.05180958286625777, 'bull_tp_mult': 1.471208449259644, 'bull_tsl_mult': 0.5873577891547289, 'bull_time_stop': 130, 'bull_use_sma': False, 'bull_use_ema': True, 'bull_use_atr': True, 'bull_use_adx': False, 'bull_use_spike': False, 'bull_rsi_required': False, 'bear_strategy': 'breakout', 'bear_bb_std_mult': 1.0904172883796222, 'bear_rsi_os': 31, 'bear_rsi_ob': 46, 'bear_adx_thresh': 32.70212386793459, 'bear_atr_min_pct': 0.025285470071394558, 'bear_atr_max_pct': 0.12141350918429908, 'bear_tp_mult': 2.636933727237224, 'bear_tsl_mult': 0.3566822324401216, 'bear_time_stop': 196, 'bear_use_sma': False, 'bear_use_ema': True, 'bear_use_atr': True, 'bear_use_adx': False, 'bear_use_spike': False, 'bear_rsi_required': False, 'sideways_strategy': 'breakout', 'sideways_bb_std_mult': 1.7670136643959924, 'sideways_rsi_os': 34, 'sideways_rsi_ob': 86, 'sideways_adx_thresh': 8.285803340161376, 'sideways_atr_min_pct': 0.003716608487314504, 'sideways_atr_max_pct': 0.043724203987571625, 'sideways_tp_mult': 1.4091526490604693, 'sideways_tsl_mult': 0.3221487607289596, 'sideways_time_stop': 21, 'sideways_use_sma': True, 'sideways_use_ema': False, 'sideways_use_atr': True, 'sideways_use_adx': True, 'sideways_use_spike': False, 'sideways_rsi_required': True}.
[I 2025-08-31 11:30:26,722] Trial 264 finished with values: [-1000000000.0, 1000000000.0] and parameters: {'p_sma': 30, 'p_std': 11, 'p_atr': 18, 'p_adx': 23, 'rsi_period': 73, 'ema1': 12, 'ema2': 25, 'slip_atr_k': 0.08087415950383639, 'slip_spread_k': 0.08321491909200279, 'spread_hl_frac': 0.0012956657811340313, 'bb_std_mult': 0.7529165419994502, 'rsi_os': 34, 'rsi_ob': 70, 'vol_spike': 0.1403128264861151, 'adx_thresh': 19.62655867905388, 'atr_min_pct': 0.0057543990077165786, 'atr_max_pct': 0.017635344747690587, 'tp_mult': 1.0468442533917663, 'tsl_mult': 0.2982784720232598, 'strategy': 'breakout', 'time_stop': 50, 'use_sma': False, 'use_atr': True, 'use_adx': True, 'use_ema': True, 'use_spike': True, 'rsi_required': True, 'edge_k': 1.7602072093573005, 'edge_cap': 0.6292968424099495, 'bull_strategy': 'mean_reversion', 'bull_bb_std_mult': 2.322572097809993, 'bull_rsi_os': 22, 'bull_rsi_ob': 62, 'bull_adx_thresh': 12.78161497933786, 'bull_atr_min_pct': 0.006810432427171506, 'bull_atr_max_pct': 0.14217671250138708, 'bull_tp_mult': 1.4784196070742182, 'bull_tsl_mult': 0.5803210723854767, 'bull_time_stop': 274, 'bull_use_sma': False, 'bull_use_ema': True, 'bull_use_atr': True, 'bull_use_adx': False, 'bull_use_spike': False, 'bull_rsi_required': True, 'bear_strategy': 'breakout', 'bear_bb_std_mult': 1.0856185716114872, 'bear_rsi_os': 7, 'bear_rsi_ob': 45, 'bear_adx_thresh': 27.9283452267901, 'bear_atr_min_pct': 0.022763035575854122, 'bear_atr_max_pct': 0.036732752513702366, 'bear_tp_mult': 2.701019143926383, 'bear_tsl_mult': 0.5206745490720135, 'bear_time_stop': 197, 'bear_use_sma': False, 'bear_use_ema': True, 'bear_use_atr': True, 'bear_use_adx': False, 'bear_use_spike': True, 'bear_rsi_required': False, 'sideways_strategy': 'breakout', 'sideways_bb_std_mult': 1.7599003209345112, 'sideways_rsi_os': 32, 'sideways_rsi_ob': 89, 'sideways_adx_thresh': 8.05242555269079, 'sideways_atr_min_pct': 0.014682815778348818, 'sideways_atr_max_pct': 0.0477498262809064, 'sideways_tp_mult': 1.48014998697842, 'sideways_tsl_mult': 0.14656913464473742, 'sideways_time_stop': 20, 'sideways_use_sma': True, 'sideways_use_ema': False, 'sideways_use_atr': True, 'sideways_use_adx': True, 'sideways_use_spike': False, 'sideways_rsi_required': True}.
[I 2025-08-31 11:30:26,880] Trial 263 finished with values: [-1000000000.0, 1000000000.0] and parameters: {'p_sma': 30, 'p_std': 23, 'p_atr': 21, 'p_adx': 27, 'rsi_period': 74, 'ema1': 11, 'ema2': 27, 'slip_atr_k': 0.06934074406812539, 'slip_spread_k': 0.11003375790895069, 'spread_hl_frac': 0.0015861964087679034, 'bb_std_mult': 0.7302622806396067, 'rsi_os': 34, 'rsi_ob': 70, 'vol_spike': 0.1374855392431308, 'adx_thresh': 26.955821546825813, 'atr_min_pct': 0.004054198815252116, 'atr_max_pct': 0.017371467135577034, 'tp_mult': 2.7770985785272755, 'tsl_mult': 0.2801429139568095, 'strategy': 'breakout', 'time_stop': 48, 'use_sma': False, 'use_atr': True, 'use_adx': True, 'use_ema': True, 'use_spike': True, 'rsi_required': True, 'edge_k': 1.6892842030662356, 'edge_cap': 0.1743226739578017, 'bull_strategy': 'breakout', 'bull_bb_std_mult': 2.511718820086939, 'bull_rsi_os': 34, 'bull_rsi_ob': 81, 'bull_adx_thresh': 13.98754832877687, 'bull_atr_min_pct': 0.006650649072062927, 'bull_atr_max_pct': 0.14238933413225968, 'bull_tp_mult': 1.1458970228746006, 'bull_tsl_mult': 0.8679810833980821, 'bull_time_stop': 131, 'bull_use_sma': True, 'bull_use_ema': True, 'bull_use_atr': True, 'bull_use_adx': True, 'bull_use_spike': False, 'bull_rsi_required': True, 'bear_strategy': 'breakout', 'bear_bb_std_mult': 0.9051751195873977, 'bear_rsi_os': 28, 'bear_rsi_ob': 93, 'bear_adx_thresh': 32.347060954073875, 'bear_atr_min_pct': 0.02263670443006842, 'bear_atr_max_pct': 0.014983538421126236, 'bear_tp_mult': 2.690887355015973, 'bear_tsl_mult': 0.36998654455728464, 'bear_time_stop': 197, 'bear_use_sma': False, 'bear_use_ema': True, 'bear_use_atr': True, 'bear_use_adx': False, 'bear_use_spike': True, 'bear_rsi_required': True, 'sideways_strategy': 'breakout', 'sideways_bb_std_mult': 1.5771601829395543, 'sideways_rsi_os': 24, 'sideways_rsi_ob': 94, 'sideways_adx_thresh': 9.847736311417172, 'sideways_atr_min_pct': 0.014419598737930151, 'sideways_atr_max_pct': 0.04943710291640927, 'sideways_tp_mult': 1.340254717649207, 'sideways_tsl_mult': 0.3345970863629174, 'sideways_time_stop': 69, 'sideways_use_sma': True, 'sideways_use_ema': False, 'sideways_use_atr': True, 'sideways_use_adx': True, 'sideways_use_spike': False, 'sideways_rsi_required': True}.
[I 2025-08-31 11:30:27,063] Trial 265 finished with values: [-1000000000.0, 1000000000.0] and parameters: {'p_sma': 24, 'p_std': 12, 'p_atr': 18, 'p_adx': 23, 'rsi_period': 50, 'ema1': 12, 'ema2': 25, 'slip_atr_k': 0.132779179950627, 'slip_spread_k': 0.1159236721162223, 'spread_hl_frac': 0.005575120582132005, 'bb_std_mult': 0.750361687996199, 'rsi_os': 33, 'rsi_ob': 70, 'vol_spike': 0.1371085391024437, 'adx_thresh': 25.972112410313464, 'atr_min_pct': 0.004008419868003944, 'atr_max_pct': 0.018297382816905176, 'tp_mult': 1.0553344089201488, 'tsl_mult': 0.29761777453000293, 'strategy': 'breakout', 'time_stop': 240, 'use_sma': False, 'use_atr': True, 'use_adx': True, 'use_ema': True, 'use_spike': True, 'rsi_required': True, 'edge_k': 0.40654300663181925, 'edge_cap': 0.24092826783255367, 'bull_strategy': 'mean_reversion', 'bull_bb_std_mult': 2.990438099828577, 'bull_rsi_os': 48, 'bull_rsi_ob': 52, 'bull_adx_thresh': 13.990468156504337, 'bull_atr_min_pct': 0.006553250717372658, 'bull_atr_max_pct': 0.14249816520343653, 'bull_tp_mult': 2.617472060640073, 'bull_tsl_mult': 0.5096034453928625, 'bull_time_stop': 257, 'bull_use_sma': True, 'bull_use_ema': True, 'bull_use_atr': True, 'bull_use_adx': False, 'bull_use_spike': False, 'bull_rsi_required': True, 'bear_strategy': 'breakout', 'bear_bb_std_mult': 1.090260085465287, 'bear_rsi_os': 30, 'bear_rsi_ob': 85, 'bear_adx_thresh': 17.500653529000548, 'bear_atr_min_pct': 0.022744570725010602, 'bear_atr_max_pct': 0.06135271235098819, 'bear_tp_mult': 2.6298831849221314, 'bear_tsl_mult': 0.36157281615164516, 'bear_time_stop': 199, 'bear_use_sma': False, 'bear_use_ema': True, 'bear_use_atr': True, 'bear_use_adx': False, 'bear_use_spike': True, 'bear_rsi_required': False, 'sideways_strategy': 'breakout', 'sideways_bb_std_mult': 1.742087141849691, 'sideways_rsi_os': 32, 'sideways_rsi_ob': 58, 'sideways_adx_thresh': 8.369423045313109, 'sideways_atr_min_pct': 0.004045240842505851, 'sideways_atr_max_pct': 0.04342617856403973, 'sideways_tp_mult': 1.3887916877985, 'sideways_tsl_mult': 0.33278151604137673, 'sideways_time_stop': 95, 'sideways_use_sma': True, 'sideways_use_ema': False, 'sideways_use_atr': True, 'sideways_use_adx': True, 'sideways_use_spike': False, 'sideways_rsi_required': True}.
[I 2025-08-31 11:30:59,267] Trial 267 finished with values: [-0.015126160678740286, 0.018295243764096768] and parameters: {'p_sma': 24, 'p_std': 14, 'p_atr': 16, 'p_adx': 29, 'rsi_period': 73, 'ema1': 12, 'ema2': 54, 'slip_atr_k': 0.05528347539186604, 'slip_spread_k': 0.11873495844924369, 'spread_hl_frac': 0.025166467461840425, 'bb_std_mult': 0.5279361613756113, 'rsi_os': 34, 'rsi_ob': 48, 'vol_spike': 0.15163518053604683, 'adx_thresh': 25.639533627015414, 'atr_min_pct': 0.005060700874563468, 'atr_max_pct': 0.017553613192653684, 'tp_mult': 1.059524065681214, 'tsl_mult': 0.29611354061952183, 'strategy': 'breakout', 'time_stop': 210, 'use_sma': False, 'use_atr': True, 'use_adx': True, 'use_ema': False, 'use_spike': True, 'rsi_required': True, 'edge_k': 0.4055494961698657, 'edge_cap': 0.1155662478253458, 'bull_strategy': 'breakout', 'bull_bb_std_mult': 1.993845667847363, 'bull_rsi_os': 42, 'bull_rsi_ob': 54, 'bull_adx_thresh': 14.35967615980288, 'bull_atr_min_pct': 0.0025772608075478472, 'bull_atr_max_pct': 0.14231011355949424, 'bull_tp_mult': 1.2580042796600805, 'bull_tsl_mult': 0.7358629735239548, 'bull_time_stop': 147, 'bull_use_sma': True, 'bull_use_ema': True, 'bull_use_atr': True, 'bull_use_adx': True, 'bull_use_spike': False, 'bull_rsi_required': True, 'bear_strategy': 'breakout', 'bear_bb_std_mult': 1.0351154713644868, 'bear_rsi_os': 34, 'bear_rsi_ob': 93, 'bear_adx_thresh': 32.268459624007534, 'bear_atr_min_pct': 0.015975066504865226, 'bear_atr_max_pct': 0.014622638779145838, 'bear_tp_mult': 2.628298428611497, 'bear_tsl_mult': 0.4160575644016836, 'bear_time_stop': 178, 'bear_use_sma': False, 'bear_use_ema': True, 'bear_use_atr': True, 'bear_use_adx': False, 'bear_use_spike': True, 'bear_rsi_required': False, 'sideways_strategy': 'breakout', 'sideways_bb_std_mult': 1.8854422619847968, 'sideways_rsi_os': 32, 'sideways_rsi_ob': 89, 'sideways_adx_thresh': 9.166215218713598, 'sideways_atr_min_pct': 0.0028732674833701986, 'sideways_atr_max_pct': 0.04820673820897753, 'sideways_tp_mult': 1.4729670812714104, 'sideways_tsl_mult': 0.4045662792096152, 'sideways_time_stop': 97, 'sideways_use_sma': True, 'sideways_use_ema': True, 'sideways_use_atr': True, 'sideways_use_adx': True, 'sideways_use_spike': False, 'sideways_rsi_required': True}.
[I 2025-08-31 11:30:59,889] Trial 268 finished with values: [-0.02500965134821087, 0.02502263065782766] and parameters: {'p_sma': 34, 'p_std': 14, 'p_atr': 20, 'p_adx': 30, 'rsi_period': 53, 'ema1': 22, 'ema2': 54, 'slip_atr_k': 0.055064792752869865, 'slip_spread_k': 0.11887226013781893, 'spread_hl_frac': 0.0008486251939869311, 'bb_std_mult': 0.5186611072990468, 'rsi_os': 34, 'rsi_ob': 71, 'vol_spike': 0.15287714340043013, 'adx_thresh': 25.72805661904988, 'atr_min_pct': 0.005195216717170492, 'atr_max_pct': 0.023788603878980998, 'tp_mult': 1.3962104962600796, 'tsl_mult': 0.3252318984111256, 'strategy': 'breakout', 'time_stop': 16, 'use_sma': False, 'use_atr': True, 'use_adx': True, 'use_ema': False, 'use_spike': True, 'rsi_required': True, 'edge_k': 0.3836055268497964, 'edge_cap': 0.32618545301192936, 'bull_strategy': 'breakout', 'bull_bb_std_mult': 2.408918565795559, 'bull_rsi_os': 24, 'bull_rsi_ob': 63, 'bull_adx_thresh': 14.82865053116437, 'bull_atr_min_pct': 0.002458620769657685, 'bull_atr_max_pct': 0.14328334895396924, 'bull_tp_mult': 2.5292924727008317, 'bull_tsl_mult': 0.5059342974613825, 'bull_time_stop': 147, 'bull_use_sma': True, 'bull_use_ema': True, 'bull_use_atr': True, 'bull_use_adx': True, 'bull_use_spike': False, 'bull_rsi_required': True, 'bear_strategy': 'breakout', 'bear_bb_std_mult': 1.051076665531714, 'bear_rsi_os': 34, 'bear_rsi_ob': 94, 'bear_adx_thresh': 32.384015729478456, 'bear_atr_min_pct': 0.013655096461807247, 'bear_atr_max_pct': 0.11091702045009727, 'bear_tp_mult': 2.619953340149048, 'bear_tsl_mult': 0.40870057430441287, 'bear_time_stop': 181, 'bear_use_sma': False, 'bear_use_ema': True, 'bear_use_atr': True, 'bear_use_adx': True, 'bear_use_spike': True, 'bear_rsi_required': False, 'sideways_strategy': 'mean_reversion', 'sideways_bb_std_mult': 2.5953567025321593, 'sideways_rsi_os': 20, 'sideways_rsi_ob': 58, 'sideways_adx_thresh': 8.868433397502454, 'sideways_atr_min_pct': 0.0028201700150882994, 'sideways_atr_max_pct': 0.04367940825059849, 'sideways_tp_mult': 1.3152921317898896, 'sideways_tsl_mult': 0.3797444909393644, 'sideways_time_stop': 67, 'sideways_use_sma': True, 'sideways_use_ema': True, 'sideways_use_atr': True, 'sideways_use_adx': True, 'sideways_use_spike': True, 'sideways_rsi_required': True}.
[I 2025-08-31 11:31:00,550] Trial 269 finished with values: [-0.013199733434548944, 0.013783415612390142] and parameters: {'p_sma': 24, 'p_std': 14, 'p_atr': 16, 'p_adx': 30, 'rsi_period': 50, 'ema1': 22, 'ema2': 44, 'slip_atr_k': 0.055890727243955336, 'slip_spread_k': 0.11781356252202269, 'spread_hl_frac': 0.025767197985368258, 'bb_std_mult': 0.5170336519058218, 'rsi_os': 52, 'rsi_ob': 72, 'vol_spike': 0.15430228434336776, 'adx_thresh': 26.03316063499023, 'atr_min_pct': 0.005268388622956465, 'atr_max_pct': 0.033879200800165835, 'tp_mult': 1.0574681593542739, 'tsl_mult': 0.32163899803793355, 'strategy': 'breakout', 'time_stop': 19, 'use_sma': False, 'use_atr': True, 'use_adx': True, 'use_ema': False, 'use_spike': True, 'rsi_required': True, 'edge_k': 0.41129611983834485, 'edge_cap': 0.8400918209197031, 'bull_strategy': 'breakout', 'bull_bb_std_mult': 2.3763051726149214, 'bull_rsi_os': 42, 'bull_rsi_ob': 52, 'bull_adx_thresh': 14.435755058747208, 'bull_atr_min_pct': 0.002768364770810711, 'bull_atr_max_pct': 0.14838402481315804, 'bull_tp_mult': 2.5231983401838187, 'bull_tsl_mult': 0.18076576818707663, 'bull_time_stop': 147, 'bull_use_sma': True, 'bull_use_ema': True, 'bull_use_atr': True, 'bull_use_adx': True, 'bull_use_spike': False, 'bull_rsi_required': True, 'bear_strategy': 'breakout', 'bear_bb_std_mult': 1.0252844958803498, 'bear_rsi_os': 33, 'bear_rsi_ob': 80, 'bear_adx_thresh': 31.80749400165232, 'bear_atr_min_pct': 0.013528778768786692, 'bear_atr_max_pct': 0.12629632306639882, 'bear_tp_mult': 2.622529852383012, 'bear_tsl_mult': 0.9534422342480599, 'bear_time_stop': 145, 'bear_use_sma': False, 'bear_use_ema': True, 'bear_use_atr': True, 'bear_use_adx': True, 'bear_use_spike': True, 'bear_rsi_required': False, 'sideways_strategy': 'mean_reversion', 'sideways_bb_std_mult': 2.5928464254833257, 'sideways_rsi_os': 21, 'sideways_rsi_ob': 74, 'sideways_adx_thresh': 9.00001290175434, 'sideways_atr_min_pct': 0.01759759694045373, 'sideways_atr_max_pct': 0.04425260764177757, 'sideways_tp_mult': 1.2840039188155112, 'sideways_tsl_mult': 0.4044495972218677, 'sideways_time_stop': 222, 'sideways_use_sma': True, 'sideways_use_ema': True, 'sideways_use_atr': True, 'sideways_use_adx': True, 'sideways_use_spike': True, 'sideways_rsi_required': True}.
