[I 2025-08-31 11:39:00,567] Trial 344 finished with values: [-1000000000.0, 1000000000.0] and parameters: {'p_sma': 29, 'p_std': 17, 'p_atr': 15, 'p_adx': 15, 'rsi_period': 9, 'ema1': 6, 'ema2': 35, 'slip_atr_k': 0.17711284390816392, 'slip_spread_k': 0.9131811844627657, 'spread_hl_frac': 0.0009709883118720987, 'bb_std_mult': 1.143492204055934, 'rsi_os': 33, 'rsi_ob': 75, 'vol_spike': 0.17591978483610282, 'adx_thresh': 24.312146492869168, 'atr_min_pct': 0.028626810212185036, 'atr_max_pct': 0.018594163979707624, 'tp_mult': 1.3903748211176512, 'tsl_mult': 0.6264249614679556, 'strategy': 'breakout', 'time_stop': 295, 'use_sma': False, 'use_atr': True, 'use_adx': True, 'use_ema': True, 'use_spike': True, 'rsi_required': True, 'edge_k': 0.8934352280742736, 'edge_cap': 0.6565597549815054, 'bull_strategy': 'breakout', 'bull_bb_std_mult': 2.3772727608397246, 'bull_rsi_os': 22, 'bull_rsi_ob': 82, 'bull_adx_thresh': 30.29297744627775, 'bull_atr_min_pct': 0.0016983376821773331, 'bull_atr_max_pct': 0.10479925219451046, 'bull_tp_mult': 1.5434402730781802, 'bull_tsl_mult': 0.2943997420416571, 'bull_time_stop': 271, 'bull_use_sma': True, 'bull_use_ema': True, 'bull_use_atr': False, 'bull_use_adx': True, 'bull_use_spike': True, 'bull_rsi_required': True, 'bear_strategy': 'breakout', 'bear_bb_std_mult': 0.8672448878442037, 'bear_rsi_os': 31, 'bear_rsi_ob': 95, 'bear_adx_thresh': 29.36187337425005, 'bear_atr_min_pct': 0.017347797907068092, 'bear_atr_max_pct': 0.12028547498460267, 'bear_tp_mult': 2.799579334024995, 'bear_tsl_mult': 0.3752384063615254, 'bear_time_stop': 193, 'bear_use_sma': False, 'bear_use_ema': True, 'bear_use_atr': False, 'bear_use_adx': False, 'bear_use_spike': False, 'bear_rsi_required': False, 'sideways_strategy': 'mean_reversion', 'sideways_bb_std_mult': 1.851328431575922, 'sideways_rsi_os': 37, 'sideways_rsi_ob': 81, 'sideways_adx_thresh': 30.750905207907117, 'sideways_atr_min_pct': 0.0032160323053658955, 'sideways_atr_max_pct': 0.047193563838773614, 'sideways_tp_mult': 1.3870877991989283, 'sideways_tsl_mult': 0.4822627711071835, 'sideways_time_stop': 49, 'sideways_use_sma': True, 'sideways_use_ema': False, 'sideways_use_atr': True, 'sideways_use_adx': True, 'sideways_use_spike': False, 'sideways_rsi_required': True}.
[I 2025-08-31 11:39:00,619] Trial 345 finished with values: [-1000000000.0, 1000000000.0] and parameters: {'p_sma': 30, 'p_std': 55, 'p_atr': 15, 'p_adx': 15, 'rsi_period': 52, 'ema1': 13, 'ema2': 32, 'slip_atr_k': 0.03240695987156808, 'slip_spread_k': 0.9082415594247071, 'spread_hl_frac': 0.0009324816044380606, 'bb_std_mult': 1.1625635781943382, 'rsi_os': 48, 'rsi_ob': 75, 'vol_spike': 0.17479311760669478, 'adx_thresh': 12.531060611474622, 'atr_min_pct': 0.021475199966659357, 'atr_max_pct': 0.01873758622016654, 'tp_mult': 1.0346996049833361, 'tsl_mult': 0.315556233697711, 'strategy': 'breakout', 'time_stop': 118, 'use_sma': False, 'use_atr': True, 'use_adx': True, 'use_ema': False, 'use_spike': True, 'rsi_required': True, 'edge_k': 0.2212770746402744, 'edge_cap': 0.7843194606243135, 'bull_strategy': 'breakout', 'bull_bb_std_mult': 1.9744971796349142, 'bull_rsi_os': 21, 'bull_rsi_ob': 63, 'bull_adx_thresh': 14.484277082930607, 'bull_atr_min_pct': 0.008595291527179777, 'bull_atr_max_pct': 0.03819050585616486, 'bull_tp_mult': 1.3692296493031149, 'bull_tsl_mult': 0.2663632477760401, 'bull_time_stop': 45, 'bull_use_sma': True, 'bull_use_ema': True, 'bull_use_atr': False, 'bull_use_adx': True, 'bull_use_spike': False, 'bull_rsi_required': True, 'bear_strategy': 'breakout', 'bear_bb_std_mult': 1.1121789870382255, 'bear_rsi_os': 31, 'bear_rsi_ob': 81, 'bear_adx_thresh': 30.73114135417668, 'bear_atr_min_pct': 0.028755420108755536, 'bear_atr_max_pct': 0.07335454350481782, 'bear_tp_mult': 2.66146328688508, 'bear_tsl_mult': 0.41131061650656864, 'bear_time_stop': 194, 'bear_use_sma': False, 'bear_use_ema': True, 'bear_use_atr': True, 'bear_use_adx': False, 'bear_use_spike': True, 'bear_rsi_required': False, 'sideways_strategy': 'mean_reversion', 'sideways_bb_std_mult': 2.5655912921412853, 'sideways_rsi_os': 8, 'sideways_rsi_ob': 73, 'sideways_adx_thresh': 8.314587656123484, 'sideways_atr_min_pct': 0.003394121505578411, 'sideways_atr_max_pct': 0.04788235262713466, 'sideways_tp_mult': 1.3875864886346816, 'sideways_tsl_mult': 0.476965101688677, 'sideways_time_stop': 53, 'sideways_use_sma': True, 'sideways_use_ema': False, 'sideways_use_atr': True, 'sideways_use_adx': True, 'sideways_use_spike': False, 'sideways_rsi_required': True}.
[I 2025-08-31 11:39:34,576] Trial 343 finished with values: [-0.04653624355729424, 0.046257907620732716] and parameters: {'p_sma': 30, 'p_std': 32, 'p_atr': 15, 'p_adx': 25, 'rsi_period': 53, 'ema1': 6, 'ema2': 40, 'slip_atr_k': 0.1792064989909946, 'slip_spread_k': 0.19888391390625276, 'spread_hl_frac': 0.0010777367107170218, 'bb_std_mult': 1.0187504308066675, 'rsi_os': 33, 'rsi_ob': 70, 'vol_spike': 0.17565188684753696, 'adx_thresh': 13.590052508490986, 'atr_min_pct': 0.00661187128827623, 'atr_max_pct': 0.018961857899818427, 'tp_mult': 2.836361096489897, 'tsl_mult': 0.9397136099570602, 'strategy': 'breakout', 'time_stop': 300, 'use_sma': False, 'use_atr': True, 'use_adx': True, 'use_ema': True, 'use_spike': True, 'rsi_required': True, 'edge_k': 0.9973602486299874, 'edge_cap': 0.8504771669013798, 'bull_strategy': 'breakout', 'bull_bb_std_mult': 2.4344930207111424, 'bull_rsi_os': 22, 'bull_rsi_ob': 63, 'bull_adx_thresh': 14.678836669172764, 'bull_atr_min_pct': 0.0019656408626364617, 'bull_atr_max_pct': 0.075576590701155, 'bull_tp_mult': 1.5477227571685805, 'bull_tsl_mult': 0.294021263591788, 'bull_time_stop': 134, 'bull_use_sma': True, 'bull_use_ema': True, 'bull_use_atr': False, 'bull_use_adx': True, 'bull_use_spike': True, 'bull_rsi_required': True, 'bear_strategy': 'breakout', 'bear_bb_std_mult': 3.4180871885856376, 'bear_rsi_os': 31, 'bear_rsi_ob': 55, 'bear_adx_thresh': 29.528726155093224, 'bear_atr_min_pct': 0.025650053561433128, 'bear_atr_max_pct': 0.12157991539338817, 'bear_tp_mult': 2.562930285972813, 'bear_tsl_mult': 0.40557876919044944, 'bear_time_stop': 193, 'bear_use_sma': False, 'bear_use_ema': True, 'bear_use_atr': False, 'bear_use_adx': False, 'bear_use_spike': False, 'bear_rsi_required': False, 'sideways_strategy': 'mean_reversion', 'sideways_bb_std_mult': 2.5662011535639557, 'sideways_rsi_os': 37, 'sideways_rsi_ob': 73, 'sideways_adx_thresh': 17.258574086745377, 'sideways_atr_min_pct': 0.0033922560772628664, 'sideways_atr_max_pct': 0.04798583808146738, 'sideways_tp_mult': 2.900794251934509, 'sideways_tsl_mult': 0.48366009609725336, 'sideways_time_stop': 42, 'sideways_use_sma': True, 'sideways_use_ema': False, 'sideways_use_atr': True, 'sideways_use_adx': True, 'sideways_use_spike': False, 'sideways_rsi_required': True}.
[I 2025-08-31 11:39:34,995] Trial 342 finished with values: [-0.02502260877305673, 0.02486475610145292] and parameters: {'p_sma': 30, 'p_std': 57, 'p_atr': 15, 'p_adx': 24, 'rsi_period': 53, 'ema1': 6, 'ema2': 35, 'slip_atr_k': 0.034495414562297114, 'slip_spread_k': 0.1417532961464583, 'spread_hl_frac': 0.0010213024388105352, 'bb_std_mult': 0.6768865541962333, 'rsi_os': 24, 'rsi_ob': 75, 'vol_spike': 0.17406010890000273, 'adx_thresh': 11.063538128783064, 'atr_min_pct': 0.028530608833061813, 'atr_max_pct': 0.052191004679055464, 'tp_mult': 1.0335422015685765, 'tsl_mult': 0.2550431158052231, 'strategy': 'breakout', 'time_stop': 294, 'use_sma': False, 'use_atr': True, 'use_adx': True, 'use_ema': True, 'use_spike': True, 'rsi_required': True, 'edge_k': 0.41889611006375527, 'edge_cap': 0.8508625260158383, 'bull_strategy': 'breakout', 'bull_bb_std_mult': 2.9875278676867176, 'bull_rsi_os': 22, 'bull_rsi_ob': 80, 'bull_adx_thresh': 19.914468487292936, 'bull_atr_min_pct': 0.0010891406275623707, 'bull_atr_max_pct': 0.037844828078691016, 'bull_tp_mult': 1.36110635573162, 'bull_tsl_mult': 0.2862835740221932, 'bull_time_stop': 25, 'bull_use_sma': True, 'bull_use_ema': True, 'bull_use_atr': False, 'bull_use_adx': True, 'bull_use_spike': True, 'bull_rsi_required': True, 'bear_strategy': 'breakout', 'bear_bb_std_mult': 1.1185541229934048, 'bear_rsi_os': 31, 'bear_rsi_ob': 55, 'bear_adx_thresh': 16.911398353195505, 'bear_atr_min_pct': 0.025830915198193024, 'bear_atr_max_pct': 0.08646935265720666, 'bear_tp_mult': 1.1513322067666047, 'bear_tsl_mult': 0.4129655851673993, 'bear_time_stop': 191, 'bear_use_sma': False, 'bear_use_ema': True, 'bear_use_atr': False, 'bear_use_adx': False, 'bear_use_spike': False, 'bear_rsi_required': False, 'sideways_strategy': 'mean_reversion', 'sideways_bb_std_mult': 2.996066696300229, 'sideways_rsi_os': 36, 'sideways_rsi_ob': 73, 'sideways_adx_thresh': 23.92942932436077, 'sideways_atr_min_pct': 0.003295543905238737, 'sideways_atr_max_pct': 0.04787756507590686, 'sideways_tp_mult': 2.89953456641311, 'sideways_tsl_mult': 0.6228734428185566, 'sideways_time_stop': 203, 'sideways_use_sma': True, 'sideways_use_ema': False, 'sideways_use_atr': True, 'sideways_use_adx': True, 'sideways_use_spike': False, 'sideways_rsi_required': True}.
[I 2025-08-31 11:39:37,896] Trial 346 finished with values: [-1000000000.0, 1000000000.0] and parameters: {'p_sma': 31, 'p_std': 56, 'p_atr': 15, 'p_adx': 10, 'rsi_period': 53, 'ema1': 13, 'ema2': 57, 'slip_atr_k': 0.03272110731810344, 'slip_spread_k': 0.14086560807713103, 'spread_hl_frac': 1.5401316901635098e-05, 'bb_std_mult': 0.6791604035452254, 'rsi_os': 8, 'rsi_ob': 77, 'vol_spike': 0.18404697517965685, 'adx_thresh': 5.181746059824057, 'atr_min_pct': 0.010193277915852832, 'atr_max_pct': 0.016522452081040757, 'tp_mult': 1.0424830074275526, 'tsl_mult': 0.26340131874330247, 'strategy': 'breakout', 'time_stop': 300, 'use_sma': False, 'use_atr': False, 'use_adx': True, 'use_ema': False, 'use_spike': True, 'rsi_required': True, 'edge_k': 0.42452536756852977, 'edge_cap': 0.15778977897083885, 'bull_strategy': 'breakout', 'bull_bb_std_mult': 3.0296374725740853, 'bull_rsi_os': 21, 'bull_rsi_ob': 63, 'bull_adx_thresh': 14.54113385867339, 'bull_atr_min_pct': 0.007836465567811899, 'bull_atr_max_pct': 0.08906067004100807, 'bull_tp_mult': 1.3732985374840045, 'bull_tsl_mult': 0.26321066644112057, 'bull_time_stop': 133, 'bull_use_sma': True, 'bull_use_ema': True, 'bull_use_atr': True, 'bull_use_adx': True, 'bull_use_spike': False, 'bull_rsi_required': True, 'bear_strategy': 'breakout', 'bear_bb_std_mult': 1.0028582212495594, 'bear_rsi_os': 21, 'bear_rsi_ob': 58, 'bear_adx_thresh': 26.413556597057294, 'bear_atr_min_pct': 0.015711364034624493, 'bear_atr_max_pct': 0.12668796171965804, 'bear_tp_mult': 1.3529255150682957, 'bear_tsl_mult': 0.8775955995070935, 'bear_time_stop': 194, 'bear_use_sma': False, 'bear_use_ema': True, 'bear_use_atr': True, 'bear_use_adx': False, 'bear_use_spike': True, 'bear_rsi_required': False, 'sideways_strategy': 'mean_reversion', 'sideways_bb_std_mult': 3.1683555871357814, 'sideways_rsi_os': 32, 'sideways_rsi_ob': 73, 'sideways_adx_thresh': 34.841812444512605, 'sideways_atr_min_pct': 0.000716703796526128, 'sideways_atr_max_pct': 0.03931161679388765, 'sideways_tp_mult': 1.3161031838497006, 'sideways_tsl_mult': 0.2842554920198763, 'sideways_time_stop': 204, 'sideways_use_sma': True, 'sideways_use_ema': False, 'sideways_use_atr': True, 'sideways_use_adx': True, 'sideways_use_spike': False, 'sideways_rsi_required': True}.
[I 2025-08-31 11:39:38,013] Trial 347 finished with values: [-1000000000.0, 1000000000.0] and parameters: {'p_sma': 31, 'p_std': 15, 'p_atr': 14, 'p_adx': 24, 'rsi_period': 53, 'ema1': 11, 'ema2': 34, 'slip_atr_k': 0.11544574187330633, 'slip_spread_k': 0.9635744855293282, 'spread_hl_frac': 5.9145033376272155e-05, 'bb_std_mult': 1.019450202303354, 'rsi_os': 24, 'rsi_ob': 54, 'vol_spike': 0.13168272524326868, 'adx_thresh': 25.017272172597643, 'atr_min_pct': 0.003234975058293722, 'atr_max_pct': 0.1325695033073621, 'tp_mult': 2.833975054356903, 'tsl_mult': 0.2545989912096141, 'strategy': 'breakout', 'time_stop': 221, 'use_sma': False, 'use_atr': False, 'use_adx': True, 'use_ema': False, 'use_spike': True, 'rsi_required': False, 'edge_k': 0.9625855450056552, 'edge_cap': 0.9964332349809526, 'bull_strategy': 'mean_reversion', 'bull_bb_std_mult': 2.252739722343714, 'bull_rsi_os': 14, 'bull_rsi_ob': 66, 'bull_adx_thresh': 19.722010733945382, 'bull_atr_min_pct': 0.008405062610599395, 'bull_atr_max_pct': 0.13900849114336578, 'bull_tp_mult': 1.5834498288201602, 'bull_tsl_mult': 0.26876887994897253, 'bull_time_stop': 107, 'bull_use_sma': True, 'bull_use_ema': True, 'bull_use_atr': True, 'bull_use_adx': True, 'bull_use_spike': False, 'bull_rsi_required': True, 'bear_strategy': 'mean_reversion', 'bear_bb_std_mult': 1.0058902549388093, 'bear_rsi_os': 35, 'bear_rsi_ob': 52, 'bear_adx_thresh': 31.45061013900304, 'bear_atr_min_pct': 0.015473449488986851, 'bear_atr_max_pct': 0.11445329952365874, 'bear_tp_mult': 1.3515783769032164, 'bear_tsl_mult': 0.308008998691927, 'bear_time_stop': 200, 'bear_use_sma': False, 'bear_use_ema': True, 'bear_use_atr': True, 'bear_use_adx': False, 'bear_use_spike': True, 'bear_rsi_required': False, 'sideways_strategy': 'breakout', 'sideways_bb_std_mult': 3.060786093955825, 'sideways_rsi_os': 32, 'sideways_rsi_ob': 90, 'sideways_adx_thresh': 16.371122023751298, 'sideways_atr_min_pct': 0.01013346217544993, 'sideways_atr_max_pct': 0.039636577359893725, 'sideways_tp_mult': 1.4779749430089402, 'sideways_tsl_mult': 0.25815565591212375, 'sideways_time_stop': 81, 'sideways_use_sma': True, 'sideways_use_ema': True, 'sideways_use_atr': True, 'sideways_use_adx': True, 'sideways_use_spike': False, 'sideways_rsi_required': True}.
[I 2025-08-31 11:40:14,013] Trial 351 finished with values: [-1000000000.0, 1000000000.0] and parameters: {'p_sma': 29, 'p_std': 18, 'p_atr': 14, 'p_adx': 25, 'rsi_period': 47, 'ema1': 12, 'ema2': 44, 'slip_atr_k': 0.20666268672326898, 'slip_spread_k': 0.16080531009563012, 'spread_hl_frac': 0.001953120501933554, 'bb_std_mult': 1.3111342503705201, 'rsi_os': 37, 'rsi_ob': 68, 'vol_spike': 0.19643773840718834, 'adx_thresh': 25.534500962967325, 'atr_min_pct': 0.00511090561766819, 'atr_max_pct': 0.028088344498727456, 'tp_mult': 1.0865378555820744, 'tsl_mult': 0.6871325615616828, 'strategy': 'mean_reversion', 'time_stop': 278, 'use_sma': False, 'use_atr': True, 'use_adx': True, 'use_ema': False, 'use_spike': True, 'rsi_required': False, 'edge_k': 0.10518959369977154, 'edge_cap': 0.8239829260687831, 'bull_strategy': 'mean_reversion', 'bull_bb_std_mult': 2.096188181383294, 'bull_rsi_os': 18, 'bull_rsi_ob': 55, 'bull_adx_thresh': 13.962886424590774, 'bull_atr_min_pct': 0.0025890866317602253, 'bull_atr_max_pct': 0.09382945835862683, 'bull_tp_mult': 1.010772476230408, 'bull_tsl_mult': 0.3196745701119348, 'bull_time_stop': 152, 'bull_use_sma': True, 'bull_use_ema': True, 'bull_use_atr': True, 'bull_use_adx': False, 'bull_use_spike': False, 'bull_rsi_required': False, 'bear_strategy': 'mean_reversion', 'bear_bb_std_mult': 1.234642311517666, 'bear_rsi_os': 23, 'bear_rsi_ob': 54, 'bear_adx_thresh': 33.013036230767426, 'bear_atr_min_pct': 0.014152308420599523, 'bear_atr_max_pct': 0.14241133291977118, 'bear_tp_mult': 2.7683801388172657, 'bear_tsl_mult': 0.35897166043019074, 'bear_time_stop': 183, 'bear_use_sma': False, 'bear_use_ema': True, 'bear_use_atr': True, 'bear_use_adx': True, 'bear_use_spike': True, 'bear_rsi_required': True, 'sideways_strategy': 'breakout', 'sideways_bb_std_mult': 1.7409860972510662, 'sideways_rsi_os': 31, 'sideways_rsi_ob': 75, 'sideways_adx_thresh': 9.744325249212087, 'sideways_atr_min_pct': 0.006567840457359742, 'sideways_atr_max_pct': 0.08225215803124884, 'sideways_tp_mult': 2.0251485001991556, 'sideways_tsl_mult': 0.4559530963418076, 'sideways_time_stop': 109, 'sideways_use_sma': True, 'sideways_use_ema': True, 'sideways_use_atr': True, 'sideways_use_adx': False, 'sideways_use_spike': True, 'sideways_rsi_required': False}.
[I 2025-08-31 11:40:14,320] Trial 349 finished with values: [-1000000000.0, 1000000000.0] and parameters: {'p_sma': 31, 'p_std': 14, 'p_atr': 14, 'p_adx': 25, 'rsi_period': 16, 'ema1': 12, 'ema2': 39, 'slip_atr_k': 0.20823395159114128, 'slip_spread_k': 0.14125656931614106, 'spread_hl_frac': 0.00016255863082733756, 'bb_std_mult': 0.8572294022593255, 'rsi_os': 30, 'rsi_ob': 69, 'vol_spike': 0.23783643730786527, 'adx_thresh': 25.162025305609756, 'atr_min_pct': 0.0033048570561789318, 'atr_max_pct': 0.027462686549435546, 'tp_mult': 1.0890288309941774, 'tsl_mult': 0.31100411119858995, 'strategy': 'breakout', 'time_stop': 89, 'use_sma': False, 'use_atr': False, 'use_adx': True, 'use_ema': False, 'use_spike': True, 'rsi_required': False, 'edge_k': 0.25992978403237144, 'edge_cap': 0.8258303547617387, 'bull_strategy': 'mean_reversion', 'bull_bb_std_mult': 2.088804664032921, 'bull_rsi_os': 30, 'bull_rsi_ob': 66, 'bull_adx_thresh': 14.054540878254652, 'bull_atr_min_pct': 0.00720683816448801, 'bull_atr_max_pct': 0.14139112057548076, 'bull_tp_mult': 1.5956604266031276, 'bull_tsl_mult': 0.2623959466048446, 'bull_time_stop': 148, 'bull_use_sma': True, 'bull_use_ema': True, 'bull_use_atr': True, 'bull_use_adx': False, 'bull_use_spike': False, 'bull_rsi_required': False, 'bear_strategy': 'mean_reversion', 'bear_bb_std_mult': 1.0168118958960235, 'bear_rsi_os': 21, 'bear_rsi_ob': 52, 'bear_adx_thresh': 31.383435812889036, 'bear_atr_min_pct': 0.015543742774854277, 'bear_atr_max_pct': 0.1485750290012584, 'bear_tp_mult': 2.6962368665973395, 'bear_tsl_mult': 0.8420950114309873, 'bear_time_stop': 183, 'bear_use_sma': False, 'bear_use_ema': True, 'bear_use_atr': True, 'bear_use_adx': True, 'bear_use_spike': True, 'bear_rsi_required': False, 'sideways_strategy': 'breakout', 'sideways_bb_std_mult': 1.8423328508529204, 'sideways_rsi_os': 32, 'sideways_rsi_ob': 75, 'sideways_adx_thresh': 16.36036044491349, 'sideways_atr_min_pct': 0.008760932374404512, 'sideways_atr_max_pct': 0.03920130159743343, 'sideways_tp_mult': 1.4493613555338918, 'sideways_tsl_mult': 0.17584081531815648, 'sideways_time_stop': 30, 'sideways_use_sma': True, 'sideways_use_ema': True, 'sideways_use_atr': True, 'sideways_use_adx': False, 'sideways_use_spike': True, 'sideways_rsi_required': True}.
[I 2025-08-31 11:40:14,320] Trial 348 finished with values: [-1000000000.0, 1000000000.0] and parameters: {'p_sma': 31, 'p_std': 15, 'p_atr': 14, 'p_adx': 24, 'rsi_period': 36, 'ema1': 11, 'ema2': 34, 'slip_atr_k': 0.11384727388873443, 'slip_spread_k': 0.14014729096839643, 'spread_hl_frac': 0.00013644005828729853, 'bb_std_mult': 0.6827179638202343, 'rsi_os': 30, 'rsi_ob': 68, 'vol_spike': 0.1301989451839838, 'adx_thresh': 10.880493254262364, 'atr_min_pct': 0.01513593219285929, 'atr_max_pct': 0.027738993445970094, 'tp_mult': 1.6096435124440678, 'tsl_mult': 0.24805090591260048, 'strategy': 'breakout', 'time_stop': 295, 'use_sma': False, 'use_atr': False, 'use_adx': True, 'use_ema': False, 'use_spike': True, 'rsi_required': False, 'edge_k': 0.423311562321362, 'edge_cap': 0.8249773640771729, 'bull_strategy': 'mean_reversion', 'bull_bb_std_mult': 3.004923143104317, 'bull_rsi_os': 23, 'bull_rsi_ob': 62, 'bull_adx_thresh': 13.763581797181883, 'bull_atr_min_pct': 0.0005948675404816028, 'bull_atr_max_pct': 0.14110052145866053, 'bull_tp_mult': 1.6045432103927557, 'bull_tsl_mult': 0.26749007790466534, 'bull_time_stop': 151, 'bull_use_sma': True, 'bull_use_ema': True, 'bull_use_atr': True, 'bull_use_adx': True, 'bull_use_spike': False, 'bull_rsi_required': True, 'bear_strategy': 'mean_reversion', 'bear_bb_std_mult': 2.8161798940531835, 'bear_rsi_os': 35, 'bear_rsi_ob': 54, 'bear_adx_thresh': 17.09654073367286, 'bear_atr_min_pct': 0.015627758732086324, 'bear_atr_max_pct': 0.1483459789843919, 'bear_tp_mult': 2.171106189316888, 'bear_tsl_mult': 0.8761225244660937, 'bear_time_stop': 183, 'bear_use_sma': False, 'bear_use_ema': True, 'bear_use_atr': True, 'bear_use_adx': False, 'bear_use_spike': True, 'bear_rsi_required': False, 'sideways_strategy': 'breakout', 'sideways_bb_std_mult': 1.596033928799971, 'sideways_rsi_os': 32, 'sideways_rsi_ob': 87, 'sideways_adx_thresh': 32.26597443170393, 'sideways_atr_min_pct': 0.006038990428794518, 'sideways_atr_max_pct': 0.03993863959597585, 'sideways_tp_mult': 1.4596004916280791, 'sideways_tsl_mult': 0.9215182156702844, 'sideways_time_stop': 26, 'sideways_use_sma': True, 'sideways_use_ema': True, 'sideways_use_atr': True, 'sideways_use_adx': True, 'sideways_use_spike': False, 'sideways_rsi_required': True}.
