[I 2025-08-31 11:53:28,699] Trial 451 finished with values: [-0.03148019077558506, 0.03248670214670293] and parameters: {'p_sma': 30, 'p_std': 56, 'p_atr': 13, 'p_adx': 27, 'rsi_period': 53, 'ema1': 29, 'ema2': 38, 'slip_atr_k': 0.050252302209882894, 'slip_spread_k': 0.17957293718089773, 'spread_hl_frac': 0.020069328173837164, 'bb_std_mult': 1.2076758725247125, 'rsi_os': 31, 'rsi_ob': 76, 'vol_spike': 0.12957449870591983, 'adx_thresh': 11.580189823683712, 'atr_min_pct': 0.00802941530326401, 'atr_max_pct': 0.022775218104088335, 'tp_mult': 1.0648973961341295, 'tsl_mult': 0.9220875726070454, 'strategy': 'breakout', 'time_stop': 48, 'use_sma': False, 'use_atr': True, 'use_adx': False, 'use_ema': False, 'use_spike': False, 'rsi_required': False, 'edge_k': 0.3749097914479816, 'edge_cap': 0.6148294210617653, 'bull_strategy': 'breakout', 'bull_bb_std_mult': 2.576710113102422, 'bull_rsi_os': 29, 'bull_rsi_ob': 64, 'bull_adx_thresh': 27.52213679122374, 'bull_atr_min_pct': 0.014854667966940172, 'bull_atr_max_pct': 0.0658553846591025, 'bull_tp_mult': 2.961784564178454, 'bull_tsl_mult': 0.3435582362673272, 'bull_time_stop': 182, 'bull_use_sma': True, 'bull_use_ema': True, 'bull_use_atr': True, 'bull_use_adx': False, 'bull_use_spike': False, 'bull_rsi_required': True, 'bear_strategy': 'breakout', 'bear_bb_std_mult': 1.0490355480078344, 'bear_rsi_os': 33, 'bear_rsi_ob': 56, 'bear_adx_thresh': 19.44353455304551, 'bear_atr_min_pct': 0.0005144498524357055, 'bear_atr_max_pct': 0.12779115009275377, 'bear_tp_mult': 1.2612967366520687, 'bear_tsl_mult': 0.3156868764028214, 'bear_time_stop': 208, 'bear_use_sma': False, 'bear_use_ema': False, 'bear_use_atr': True, 'bear_use_adx': False, 'bear_use_spike': True, 'bear_rsi_required': True, 'sideways_strategy': 'breakout', 'sideways_bb_std_mult': 1.3937332037600547, 'sideways_rsi_os': 47, 'sideways_rsi_ob': 80, 'sideways_adx_thresh': 27.494679887018123, 'sideways_atr_min_pct': 0.003905469950801106, 'sideways_atr_max_pct': 0.04560511161059616, 'sideways_tp_mult': 1.1880091227022704, 'sideways_tsl_mult': 0.12118680649124863, 'sideways_time_stop': 157, 'sideways_use_sma': True, 'sideways_use_ema': False, 'sideways_use_atr': True, 'sideways_use_adx': True, 'sideways_use_spike': False, 'sideways_rsi_required': True}.
[I 2025-08-31 11:53:28,718] Trial 449 finished with values: [-0.062133265878893895, 0.0614172158323265] and parameters: {'p_sma': 32, 'p_std': 16, 'p_atr': 27, 'p_adx': 27, 'rsi_period': 49, 'ema1': 12, 'ema2': 38, 'slip_atr_k': 0.03014447629823902, 'slip_spread_k': 0.16809065840920812, 'spread_hl_frac': 0.03417211953450754, 'bb_std_mult': 0.8064014516278927, 'rsi_os': 30, 'rsi_ob': 76, 'vol_spike': 0.09131180667916666, 'adx_thresh': 25.080783665566347, 'atr_min_pct': 0.01609056539638197, 'atr_max_pct': 0.022831016549347875, 'tp_mult': 1.1355657414439106, 'tsl_mult': 0.29390930569033247, 'strategy': 'breakout', 'time_stop': 300, 'use_sma': True, 'use_atr': True, 'use_adx': True, 'use_ema': False, 'use_spike': True, 'rsi_required': True, 'edge_k': 1.2867939755110782, 'edge_cap': 0.868278915417841, 'bull_strategy': 'mean_reversion', 'bull_bb_std_mult': 2.5682942006320246, 'bull_rsi_os': 27, 'bull_rsi_ob': 85, 'bull_adx_thresh': 18.460478606775922, 'bull_atr_min_pct': 0.0071870184293791215, 'bull_atr_max_pct': 0.06597438444026053, 'bull_tp_mult': 1.2840476566073267, 'bull_tsl_mult': 0.35287337680966113, 'bull_time_stop': 154, 'bull_use_sma': False, 'bull_use_ema': True, 'bull_use_atr': True, 'bull_use_adx': True, 'bull_use_spike': False, 'bull_rsi_required': True, 'bear_strategy': 'breakout', 'bear_bb_std_mult': 2.240135524315953, 'bear_rsi_os': 33, 'bear_rsi_ob': 56, 'bear_adx_thresh': 6.147353745358588, 'bear_atr_min_pct': 0.00024278014132510066, 'bear_atr_max_pct': 0.12597890502170506, 'bear_tp_mult': 1.2874909426330736, 'bear_tsl_mult': 0.3581224477232447, 'bear_time_stop': 268, 'bear_use_sma': False, 'bear_use_ema': True, 'bear_use_atr': True, 'bear_use_adx': False, 'bear_use_spike': True, 'bear_rsi_required': False, 'sideways_strategy': 'breakout', 'sideways_bb_std_mult': 1.4311244603977475, 'sideways_rsi_os': 17, 'sideways_rsi_ob': 89, 'sideways_adx_thresh': 17.448051410593997, 'sideways_atr_min_pct': 0.003920160831312691, 'sideways_atr_max_pct': 0.05403870544666511, 'sideways_tp_mult': 1.2064828570598432, 'sideways_tsl_mult': 0.31292676237736217, 'sideways_time_stop': 5, 'sideways_use_sma': True, 'sideways_use_ema': False, 'sideways_use_atr': True, 'sideways_use_adx': True, 'sideways_use_spike': False, 'sideways_rsi_required': True}.
[I 2025-08-31 11:53:29,216] Trial 452 finished with values: [-1000000000.0, 1000000000.0] and parameters: {'p_sma': 13, 'p_std': 45, 'p_atr': 13, 'p_adx': 27, 'rsi_period': 53, 'ema1': 29, 'ema2': 35, 'slip_atr_k': 0.021641285100630073, 'slip_spread_k': 0.16644977242161688, 'spread_hl_frac': 0.0337762862883065, 'bb_std_mult': 0.8526574163305827, 'rsi_os': 31, 'rsi_ob': 69, 'vol_spike': 0.00013840668971087933, 'adx_thresh': 18.03568109129106, 'atr_min_pct': 0.004596730521880076, 'atr_max_pct': 0.02253695108081172, 'tp_mult': 1.0482963594536607, 'tsl_mult': 0.5549075672949381, 'strategy': 'breakout', 'time_stop': 227, 'use_sma': True, 'use_atr': True, 'use_adx': False, 'use_ema': False, 'use_spike': False, 'rsi_required': False, 'edge_k': 0.2110387783567263, 'edge_cap': 0.8642203598279209, 'bull_strategy': 'mean_reversion', 'bull_bb_std_mult': 2.350055454098476, 'bull_rsi_os': 18, 'bull_rsi_ob': 72, 'bull_adx_thresh': 27.416291316117007, 'bull_atr_min_pct': 0.011427996405505986, 'bull_atr_max_pct': 0.13836024327080937, 'bull_tp_mult': 1.511613472019036, 'bull_tsl_mult': 0.3496068442257325, 'bull_time_stop': 299, 'bull_use_sma': False, 'bull_use_ema': True, 'bull_use_atr': True, 'bull_use_adx': True, 'bull_use_spike': False, 'bull_rsi_required': True, 'bear_strategy': 'breakout', 'bear_bb_std_mult': 1.0429827787836081, 'bear_rsi_os': 33, 'bear_rsi_ob': 54, 'bear_adx_thresh': 30.836755235689107, 'bear_atr_min_pct': 0.00022805129099307854, 'bear_atr_max_pct': 0.046060727635410935, 'bear_tp_mult': 2.523623350886732, 'bear_tsl_mult': 0.336668668291885, 'bear_time_stop': 208, 'bear_use_sma': True, 'bear_use_ema': False, 'bear_use_atr': True, 'bear_use_adx': False, 'bear_use_spike': True, 'bear_rsi_required': False, 'sideways_strategy': 'mean_reversion', 'sideways_bb_std_mult': 1.427815463903624, 'sideways_rsi_os': 29, 'sideways_rsi_ob': 74, 'sideways_adx_thresh': 17.07039630749062, 'sideways_atr_min_pct': 0.001086653034939402, 'sideways_atr_max_pct': 0.04598360925910992, 'sideways_tp_mult': 2.696911111161918, 'sideways_tsl_mult': 0.12580528099058014, 'sideways_time_stop': 158, 'sideways_use_sma': True, 'sideways_use_ema': False, 'sideways_use_atr': True, 'sideways_use_adx': True, 'sideways_use_spike': True, 'sideways_rsi_required': True}.
[I 2025-08-31 11:54:07,471] Trial 456 finished with values: [-1000000000.0, 1000000000.0] and parameters: {'p_sma': 49, 'p_std': 7, 'p_atr': 14, 'p_adx': 25, 'rsi_period': 71, 'ema1': 25, 'ema2': 36, 'slip_atr_k': 0.04238274489103879, 'slip_spread_k': 0.1329703419355915, 'spread_hl_frac': 0.049794550669908025, 'bb_std_mult': 0.752971174639919, 'rsi_os': 38, 'rsi_ob': 72, 'vol_spike': 0.015375368899903735, 'adx_thresh': 27.49878969633521, 'atr_min_pct': 0.010204496335227499, 'atr_max_pct': 0.019514384660449264, 'tp_mult': 1.2047460914122872, 'tsl_mult': 0.6724015404104413, 'strategy': 'breakout', 'time_stop': 72, 'use_sma': False, 'use_atr': True, 'use_adx': True, 'use_ema': False, 'use_spike': True, 'rsi_required': True, 'edge_k': 1.7165393581159367, 'edge_cap': 0.8449411460506717, 'bull_strategy': 'breakout', 'bull_bb_std_mult': 1.805051953711784, 'bull_rsi_os': 22, 'bull_rsi_ob': 63, 'bull_adx_thresh': 13.356190924473584, 'bull_atr_min_pct': 0.010501388773458672, 'bull_atr_max_pct': 0.1161904973770767, 'bull_tp_mult': 1.495981321168599, 'bull_tsl_mult': 0.26683264980358784, 'bull_time_stop': 165, 'bull_use_sma': True, 'bull_use_ema': True, 'bull_use_atr': True, 'bull_use_adx': True, 'bull_use_spike': False, 'bull_rsi_required': True, 'bear_strategy': 'breakout', 'bear_bb_std_mult': 0.9199602462041386, 'bear_rsi_os': 31, 'bear_rsi_ob': 53, 'bear_adx_thresh': 28.278045660961656, 'bear_atr_min_pct': 0.015244673158109229, 'bear_atr_max_pct': 0.11605336483455606, 'bear_tp_mult': 2.1380879966918234, 'bear_tsl_mult': 0.6358505938461406, 'bear_time_stop': 200, 'bear_use_sma': True, 'bear_use_ema': True, 'bear_use_atr': True, 'bear_use_adx': False, 'bear_use_spike': True, 'bear_rsi_required': False, 'sideways_strategy': 'mean_reversion', 'sideways_bb_std_mult': 1.5907092994511063, 'sideways_rsi_os': 32, 'sideways_rsi_ob': 50, 'sideways_adx_thresh': 34.99769069091407, 'sideways_atr_min_pct': 0.027397828395839246, 'sideways_atr_max_pct': 0.04879407137879443, 'sideways_tp_mult': 1.7700345836687033, 'sideways_tsl_mult': 0.8027388731278898, 'sideways_time_stop': 57, 'sideways_use_sma': True, 'sideways_use_ema': False, 'sideways_use_atr': False, 'sideways_use_adx': True, 'sideways_use_spike': True, 'sideways_rsi_required': False}.
[I 2025-08-31 11:54:08,043] Trial 455 finished with values: [-1000000000.0, 1000000000.0] and parameters: {'p_sma': 30, 'p_std': 18, 'p_atr': 23, 'p_adx': 25, 'rsi_period': 56, 'ema1': 14, 'ema2': 35, 'slip_atr_k': 0.07519713540962637, 'slip_spread_k': 0.5884873744685076, 'spread_hl_frac': 0.001675948631876022, 'bb_std_mult': 0.8867595935981097, 'rsi_os': 38, 'rsi_ob': 72, 'vol_spike': 0.014198973587137259, 'adx_thresh': 20.091683717364916, 'atr_min_pct': 0.005158604102393377, 'atr_max_pct': 0.019418907271517637, 'tp_mult': 1.1050027170295367, 'tsl_mult': 0.14838236706864816, 'strategy': 'breakout', 'time_stop': 211, 'use_sma': False, 'use_atr': True, 'use_adx': True, 'use_ema': False, 'use_spike': True, 'rsi_required': True, 'edge_k': 0.3263524763181073, 'edge_cap': 0.17700657212847748, 'bull_strategy': 'breakout', 'bull_bb_std_mult': 1.8543706387293815, 'bull_rsi_os': 22, 'bull_rsi_ob': 63, 'bull_adx_thresh': 6.425841015963957, 'bull_atr_min_pct': 0.010553983825201067, 'bull_atr_max_pct': 0.13730001789247875, 'bull_tp_mult': 1.5048875787471192, 'bull_tsl_mult': 0.26686042507491, 'bull_time_stop': 239, 'bull_use_sma': True, 'bull_use_ema': True, 'bull_use_atr': True, 'bull_use_adx': True, 'bull_use_spike': False, 'bull_rsi_required': True, 'bear_strategy': 'breakout', 'bear_bb_std_mult': 0.921939886070736, 'bear_rsi_os': 31, 'bear_rsi_ob': 54, 'bear_adx_thresh': 33.699575187595556, 'bear_atr_min_pct': 0.020176102602830173, 'bear_atr_max_pct': 0.06784325537172217, 'bear_tp_mult': 2.669330970105225, 'bear_tsl_mult': 0.33792956953646625, 'bear_time_stop': 174, 'bear_use_sma': True, 'bear_use_ema': True, 'bear_use_atr': True, 'bear_use_adx': False, 'bear_use_spike': True, 'bear_rsi_required': False, 'sideways_strategy': 'mean_reversion', 'sideways_bb_std_mult': 1.6112541142166013, 'sideways_rsi_os': 31, 'sideways_rsi_ob': 86, 'sideways_adx_thresh': 13.377681804409786, 'sideways_atr_min_pct': 0.0010795299813062592, 'sideways_atr_max_pct': 0.06758199424198524, 'sideways_tp_mult': 1.2954687282909256, 'sideways_tsl_mult': 0.3324028403428349, 'sideways_time_stop': 56, 'sideways_use_sma': True, 'sideways_use_ema': False, 'sideways_use_atr': False, 'sideways_use_adx': True, 'sideways_use_spike': True, 'sideways_rsi_required': False}.
[I 2025-08-31 11:54:08,480] Trial 453 finished with values: [-1000000000.0, 1000000000.0] and parameters: {'p_sma': 8, 'p_std': 18, 'p_atr': 23, 'p_adx': 25, 'rsi_period': 56, 'ema1': 11, 'ema2': 35, 'slip_atr_k': 0.04070575150325026, 'slip_spread_k': 0.9280006844045527, 'spread_hl_frac': 0.049748077272800985, 'bb_std_mult': 0.8932182059913261, 'rsi_os': 38, 'rsi_ob': 79, 'vol_spike': 0.28633715877244426, 'adx_thresh': 18.890589290555052, 'atr_min_pct': 0.005195589389453652, 'atr_max_pct': 0.02039345721282211, 'tp_mult': 2.242454390622653, 'tsl_mult': 0.2651585513798155, 'strategy': 'breakout', 'time_stop': 201, 'use_sma': False, 'use_atr': True, 'use_adx': True, 'use_ema': False, 'use_spike': True, 'rsi_required': True, 'edge_k': 0.8254165141536164, 'edge_cap': 0.8957647571052997, 'bull_strategy': 'breakout', 'bull_bb_std_mult': 2.271083834658437, 'bull_rsi_os': 52, 'bull_rsi_ob': 78, 'bull_adx_thresh': 13.492856202122093, 'bull_atr_min_pct': 0.006672865796570418, 'bull_atr_max_pct': 0.08187060452228127, 'bull_tp_mult': 1.533751981979522, 'bull_tsl_mult': 0.8583849891322599, 'bull_time_stop': 141, 'bull_use_sma': True, 'bull_use_ema': True, 'bull_use_atr': True, 'bull_use_adx': True, 'bull_use_spike': False, 'bull_rsi_required': True, 'bear_strategy': 'breakout', 'bear_bb_std_mult': 0.9306883037573939, 'bear_rsi_os': 40, 'bear_rsi_ob': 54, 'bear_adx_thresh': 31.03838605332795, 'bear_atr_min_pct': 0.021261344492903622, 'bear_atr_max_pct': 0.11587296038588549, 'bear_tp_mult': 2.5413562010371553, 'bear_tsl_mult': 0.9260706062621817, 'bear_time_stop': 177, 'bear_use_sma': True, 'bear_use_ema': True, 'bear_use_atr': True, 'bear_use_adx': False, 'bear_use_spike': True, 'bear_rsi_required': False, 'sideways_strategy': 'mean_reversion', 'sideways_bb_std_mult': 1.8603006087780556, 'sideways_rsi_os': 31, 'sideways_rsi_ob': 81, 'sideways_adx_thresh': 11.909238651593592, 'sideways_atr_min_pct': 0.0011184000938772708, 'sideways_atr_max_pct': 0.06196057835160711, 'sideways_tp_mult': 1.28028492165104, 'sideways_tsl_mult': 0.7953784598911726, 'sideways_time_stop': 16, 'sideways_use_sma': True, 'sideways_use_ema': False, 'sideways_use_atr': False, 'sideways_use_adx': True, 'sideways_use_spike': True, 'sideways_rsi_required': False}.
[I 2025-08-31 11:54:08,616] Trial 454 finished with values: [-0.38819781581633483, 0.38817787893432376] and parameters: {'p_sma': 32, 'p_std': 18, 'p_atr': 23, 'p_adx': 25, 'rsi_period': 75, 'ema1': 25, 'ema2': 35, 'slip_atr_k': 0.0402860982267511, 'slip_spread_k': 0.27326651453277684, 'spread_hl_frac': 0.001509441255405306, 'bb_std_mult': 0.8926167736161091, 'rsi_os': 28, 'rsi_ob': 56, 'vol_spike': 0.01628501987413633, 'adx_thresh': 5.910828296500647, 'atr_min_pct': 0.017402355462956876, 'atr_max_pct': 0.018679304076573335, 'tp_mult': 1.097190632391372, 'tsl_mult': 9.325339464766325e-05, 'strategy': 'breakout', 'time_stop': 60, 'use_sma': False, 'use_atr': True, 'use_adx': True, 'use_ema': False, 'use_spike': True, 'rsi_required': True, 'edge_k': 1.587150003352608, 'edge_cap': 0.8923637966981499, 'bull_strategy': 'breakout', 'bull_bb_std_mult': 1.3654275422332964, 'bull_rsi_os': 19, 'bull_rsi_ob': 95, 'bull_adx_thresh': 20.15449985803465, 'bull_atr_min_pct': 0.01149613667233125, 'bull_atr_max_pct': 0.0400371064841245, 'bull_tp_mult': 1.5055974922226891, 'bull_tsl_mult': 0.5431289181591186, 'bull_time_stop': 238, 'bull_use_sma': True, 'bull_use_ema': True, 'bull_use_atr': True, 'bull_use_adx': True, 'bull_use_spike': False, 'bull_rsi_required': True, 'bear_strategy': 'breakout', 'bear_bb_std_mult': 0.938554264174998, 'bear_rsi_os': 52, 'bear_rsi_ob': 54, 'bear_adx_thresh': 16.6372580652063, 'bear_atr_min_pct': 0.01563310108587998, 'bear_atr_max_pct': 0.03816329967891132, 'bear_tp_mult': 2.7653890326413175, 'bear_tsl_mult': 0.432740650867942, 'bear_time_stop': 138, 'bear_use_sma': True, 'bear_use_ema': True, 'bear_use_atr': True, 'bear_use_adx': False, 'bear_use_spike': True, 'bear_rsi_required': False, 'sideways_strategy': 'mean_reversion', 'sideways_bb_std_mult': 1.8244662241601226, 'sideways_rsi_os': 9, 'sideways_rsi_ob': 50, 'sideways_adx_thresh': 9.466231115281591, 'sideways_atr_min_pct': 0.0010364048397437545, 'sideways_atr_max_pct': 0.11575856962925948, 'sideways_tp_mult': 1.6447098217053455, 'sideways_tsl_mult': 0.8647162934706218, 'sideways_time_stop': 208, 'sideways_use_sma': True, 'sideways_use_ema': False, 'sideways_use_atr': False, 'sideways_use_adx': True, 'sideways_use_spike': True, 'sideways_rsi_required': False}.
[I 2025-08-31 11:54:40,323] Trial 457 finished with values: [-1000000000.0, 1000000000.0] and parameters: {'p_sma': 30, 'p_std': 18, 'p_atr': 28, 'p_adx': 26, 'rsi_period': 78, 'ema1': 14, 'ema2': 36, 'slip_atr_k': 0.0349571981936912, 'slip_spread_k': 0.08618277015768978, 'spread_hl_frac': 0.01218854864854472, 'bb_std_mult': 1.8495847878464617, 'rsi_os': 28, 'rsi_ob': 52, 'vol_spike': 0.043711309655701996, 'adx_thresh': 24.50975291468525, 'atr_min_pct': 0.006691967515260404, 'atr_max_pct': 0.020280925170354368, 'tp_mult': 2.4541597838258244, 'tsl_mult': 0.2686154429597325, 'strategy': 'breakout', 'time_stop': 56, 'use_sma': False, 'use_atr': True, 'use_adx': True, 'use_ema': False, 'use_spike': True, 'rsi_required': True, 'edge_k': 0.34052613212154914, 'edge_cap': 0.8916797902521845, 'bull_strategy': 'breakout', 'bull_bb_std_mult': 1.350044138191556, 'bull_rsi_os': 15, 'bull_rsi_ob': 94, 'bull_adx_thresh': 20.479306858357337, 'bull_atr_min_pct': 0.009539399351860807, 'bull_atr_max_pct': 0.14450823776680474, 'bull_tp_mult': 1.871343533995429, 'bull_tsl_mult': 0.29983481314594146, 'bull_time_stop': 241, 'bull_use_sma': True, 'bull_use_ema': True, 'bull_use_atr': True, 'bull_use_adx': True, 'bull_use_spike': False, 'bull_rsi_required': True, 'bear_strategy': 'breakout', 'bear_bb_std_mult': 1.531096139020816, 'bear_rsi_os': 40, 'bear_rsi_ob': 62, 'bear_adx_thresh': 32.85692288136042, 'bear_atr_min_pct': 0.004849859609405966, 'bear_atr_max_pct': 0.039086836630381754, 'bear_tp_mult': 2.6676793686895026, 'bear_tsl_mult': 0.4380903930865974, 'bear_time_stop': 175, 'bear_use_sma': False, 'bear_use_ema': True, 'bear_use_atr': True, 'bear_use_adx': False, 'bear_use_spike': True, 'bear_rsi_required': False, 'sideways_strategy': 'breakout', 'sideways_bb_std_mult': 1.834447255057251, 'sideways_rsi_os': 31, 'sideways_rsi_ob': 71, 'sideways_adx_thresh': 13.083264606919972, 'sideways_atr_min_pct': 0.006530375535405518, 'sideways_atr_max_pct': 0.03769455814137809, 'sideways_tp_mult': 2.4936684176432, 'sideways_tsl_mult': 0.0012136201981378658, 'sideways_time_stop': 16, 'sideways_use_sma': True, 'sideways_use_ema': False, 'sideways_use_atr': False, 'sideways_use_adx': True, 'sideways_use_spike': False, 'sideways_rsi_required': True}.
[I 2025-08-31 11:54:40,492] Trial 460 finished with values: [-1000000000.0, 1000000000.0] and parameters: {'p_sma': 30, 'p_std': 39, 'p_atr': 20, 'p_adx': 26, 'rsi_period': 48, 'ema1': 10, 'ema2': 37, 'slip_atr_k': 0.04855840399951534, 'slip_spread_k': 0.08700082187233052, 'spread_hl_frac': 0.0034549180908878593, 'bb_std_mult': 1.6844946995930703, 'rsi_os': 42, 'rsi_ob': 70, 'vol_spike': 0.17395229886748065, 'adx_thresh': 26.447096344097556, 'atr_min_pct': 0.0024955481046154138, 'atr_max_pct': 0.02471090827713079, 'tp_mult': 2.4584222720101874, 'tsl_mult': 0.27788396159590756, 'strategy': 'breakout', 'time_stop': 29, 'use_sma': True, 'use_atr': True, 'use_adx': True, 'use_ema': False, 'use_spike': True, 'rsi_required': True, 'edge_k': 0.43418226586792297, 'edge_cap': 0.8312056877051214, 'bull_strategy': 'mean_reversion', 'bull_bb_std_mult': 2.7777843076898945, 'bull_rsi_os': 46, 'bull_rsi_ob': 60, 'bull_adx_thresh': 29.734555489022682, 'bull_atr_min_pct': 0.005240568684465681, 'bull_atr_max_pct': 0.14424947562004523, 'bull_tp_mult': 2.0763206057173207, 'bull_tsl_mult': 0.3168322020776162, 'bull_time_stop': 160, 'bull_use_sma': False, 'bull_use_ema': True, 'bull_use_atr': True, 'bull_use_adx': True, 'bull_use_spike': False, 'bull_rsi_required': False, 'bear_strategy': 'breakout', 'bear_bb_std_mult': 0.8193085491226337, 'bear_rsi_os': 6, 'bear_rsi_ob': 52, 'bear_adx_thresh': 23.243422613378808, 'bear_atr_min_pct': 0.01599551685960772, 'bear_atr_max_pct': 0.1466138129259001, 'bear_tp_mult': 2.6109082979830314, 'bear_tsl_mult': 0.36972710268033904, 'bear_time_stop': 190, 'bear_use_sma': False, 'bear_use_ema': True, 'bear_use_atr': True, 'bear_use_adx': True, 'bear_use_spike': True, 'bear_rsi_required': False, 'sideways_strategy': 'breakout', 'sideways_bb_std_mult': 1.7307234945545207, 'sideways_rsi_os': 41, 'sideways_rsi_ob': 77, 'sideways_adx_thresh': 8.510311466814093, 'sideways_atr_min_pct': 0.016647556608037798, 'sideways_atr_max_pct': 0.09402468915380524, 'sideways_tp_mult': 1.464665725788765, 'sideways_tsl_mult': 0.30152037282436034, 'sideways_time_stop': 24, 'sideways_use_sma': True, 'sideways_use_ema': False, 'sideways_use_atr': True, 'sideways_use_adx': True, 'sideways_use_spike': False, 'sideways_rsi_required': True}.
