[I 2025-08-31 11:48:05,363] Trial 414 finished with values: [-1000000000.0, 1000000000.0] and parameters: {'p_sma': 30, 'p_std': 32, 'p_atr': 15, 'p_adx': 18, 'rsi_period': 9, 'ema1': 11, 'ema2': 26, 'slip_atr_k': 0.16699012722256762, 'slip_spread_k': 0.15568744260555856, 'spread_hl_frac': 4.5404623775946885e-06, 'bb_std_mult': 1.1066244832312155, 'rsi_os': 9, 'rsi_ob': 74, 'vol_spike': 0.20794351433167169, 'adx_thresh': 26.1313896682191, 'atr_min_pct': 0.003536798364750695, 'atr_max_pct': 0.02035076615960574, 'tp_mult': 1.4127107965068393, 'tsl_mult': 0.3287800887732789, 'strategy': 'breakout', 'time_stop': 94, 'use_sma': False, 'use_atr': True, 'use_adx': True, 'use_ema': False, 'use_spike': False, 'rsi_required': False, 'edge_k': 0.9185578204285526, 'edge_cap': 0.8183163231974695, 'bull_strategy': 'breakout', 'bull_bb_std_mult': 3.57236329376991, 'bull_rsi_os': 22, 'bull_rsi_ob': 89, 'bull_adx_thresh': 14.162955876995353, 'bull_atr_min_pct': 0.02899876162666961, 'bull_atr_max_pct': 0.14276447934401848, 'bull_tp_mult': 1.480033183707156, 'bull_tsl_mult': 0.744086046518587, 'bull_time_stop': 122, 'bull_use_sma': True, 'bull_use_ema': True, 'bull_use_atr': True, 'bull_use_adx': True, 'bull_use_spike': False, 'bull_rsi_required': True, 'bear_strategy': 'breakout', 'bear_bb_std_mult': 1.072894394535511, 'bear_rsi_os': 31, 'bear_rsi_ob': 53, 'bear_adx_thresh': 14.681797640904854, 'bear_atr_min_pct': 0.018658529466197914, 'bear_atr_max_pct': 0.11880721059286399, 'bear_tp_mult': 2.694358536871438, 'bear_tsl_mult': 0.7558559856821279, 'bear_time_stop': 178, 'bear_use_sma': False, 'bear_use_ema': True, 'bear_use_atr': True, 'bear_use_adx': True, 'bear_use_spike': True, 'bear_rsi_required': False, 'sideways_strategy': 'mean_reversion', 'sideways_bb_std_mult': 1.5243623857162547, 'sideways_rsi_os': 31, 'sideways_rsi_ob': 72, 'sideways_adx_thresh': 31.431834697018623, 'sideways_atr_min_pct': 0.003461285806316201, 'sideways_atr_max_pct': 0.031356545812689034, 'sideways_tp_mult': 2.3947757414839086, 'sideways_tsl_mult': 0.3254729473707358, 'sideways_time_stop': 5, 'sideways_use_sma': True, 'sideways_use_ema': False, 'sideways_use_atr': True, 'sideways_use_adx': False, 'sideways_use_spike': False, 'sideways_rsi_required': True}.
[I 2025-08-31 11:48:09,408] Trial 415 finished with values: [-1000000000.0, 1000000000.0] and parameters: {'p_sma': 12, 'p_std': 18, 'p_atr': 30, 'p_adx': 18, 'rsi_period': 29, 'ema1': 11, 'ema2': 57, 'slip_atr_k': 0.042072926556656357, 'slip_spread_k': 0.776060098956189, 'spread_hl_frac': 0.0033206190937483393, 'bb_std_mult': 1.302778248723791, 'rsi_os': 34, 'rsi_ob': 74, 'vol_spike': 0.14433671314492277, 'adx_thresh': 26.08384484918405, 'atr_min_pct': 0.0035946838419055388, 'atr_max_pct': 0.023578180313539754, 'tp_mult': 1.0850628772807625, 'tsl_mult': 0.283709672037653, 'strategy': 'breakout', 'time_stop': 132, 'use_sma': False, 'use_atr': True, 'use_adx': True, 'use_ema': False, 'use_spike': False, 'rsi_required': False, 'edge_k': 0.9280907536668968, 'edge_cap': 0.8201486435577992, 'bull_strategy': 'breakout', 'bull_bb_std_mult': 3.450949709856953, 'bull_rsi_os': 21, 'bull_rsi_ob': 60, 'bull_adx_thresh': 22.064251083642343, 'bull_atr_min_pct': 0.02891002181382586, 'bull_atr_max_pct': 0.1429676553432097, 'bull_tp_mult': 1.4761470618471597, 'bull_tsl_mult': 0.29244845133700054, 'bull_time_stop': 173, 'bull_use_sma': True, 'bull_use_ema': True, 'bull_use_atr': True, 'bull_use_adx': True, 'bull_use_spike': False, 'bull_rsi_required': True, 'bear_strategy': 'breakout', 'bear_bb_std_mult': 1.3158556503679502, 'bear_rsi_os': 20, 'bear_rsi_ob': 53, 'bear_adx_thresh': 33.4361893449562, 'bear_atr_min_pct': 0.015371952732370619, 'bear_atr_max_pct': 0.11794258415576349, 'bear_tp_mult': 2.1656337604220965, 'bear_tsl_mult': 0.40051074222735744, 'bear_time_stop': 183, 'bear_use_sma': False, 'bear_use_ema': True, 'bear_use_atr': True, 'bear_use_adx': True, 'bear_use_spike': True, 'bear_rsi_required': False, 'sideways_strategy': 'mean_reversion', 'sideways_bb_std_mult': 1.8816752552312617, 'sideways_rsi_os': 31, 'sideways_rsi_ob': 73, 'sideways_adx_thresh': 8.790588653448506, 'sideways_atr_min_pct': 0.01911273302289534, 'sideways_atr_max_pct': 0.0455963719714452, 'sideways_tp_mult': 1.2079043147132564, 'sideways_tsl_mult': 0.06174060894262151, 'sideways_time_stop': 77, 'sideways_use_sma': True, 'sideways_use_ema': False, 'sideways_use_atr': True, 'sideways_use_adx': False, 'sideways_use_spike': False, 'sideways_rsi_required': True}.
[I 2025-08-31 11:48:39,145] Trial 416 finished with values: [-1000000000.0, 1000000000.0] and parameters: {'p_sma': 30, 'p_std': 15, 'p_atr': 22, 'p_adx': 25, 'rsi_period': 50, 'ema1': 10, 'ema2': 24, 'slip_atr_k': 0.16737080455404038, 'slip_spread_k': 0.24051274663585132, 'spread_hl_frac': 0.0017512838044247735, 'bb_std_mult': 1.5826672049584212, 'rsi_os': 34, 'rsi_ob': 89, 'vol_spike': 0.14670057670109013, 'adx_thresh': 26.221436025851986, 'atr_min_pct': 0.003867819196335473, 'atr_max_pct': 0.013061338603004746, 'tp_mult': 1.4131462559691381, 'tsl_mult': 0.19015828094200626, 'strategy': 'breakout', 'time_stop': 94, 'use_sma': False, 'use_atr': True, 'use_adx': True, 'use_ema': False, 'use_spike': False, 'rsi_required': False, 'edge_k': 0.19840461982211854, 'edge_cap': 0.8212755849840152, 'bull_strategy': 'breakout', 'bull_bb_std_mult': 2.046050949330084, 'bull_rsi_os': 20, 'bull_rsi_ob': 61, 'bull_adx_thresh': 14.079444560505367, 'bull_atr_min_pct': 0.006422139135242165, 'bull_atr_max_pct': 0.04494169408569112, 'bull_tp_mult': 1.6238778779645053, 'bull_tsl_mult': 0.3436017189023147, 'bull_time_stop': 134, 'bull_use_sma': True, 'bull_use_ema': True, 'bull_use_atr': True, 'bull_use_adx': True, 'bull_use_spike': False, 'bull_rsi_required': True, 'bear_strategy': 'breakout', 'bear_bb_std_mult': 1.3198024539249942, 'bear_rsi_os': 31, 'bear_rsi_ob': 53, 'bear_adx_thresh': 33.17913281223399, 'bear_atr_min_pct': 0.015383172135126012, 'bear_atr_max_pct': 0.11826539120200591, 'bear_tp_mult': 2.600841400713428, 'bear_tsl_mult': 0.8058602882484598, 'bear_time_stop': 186, 'bear_use_sma': False, 'bear_use_ema': True, 'bear_use_atr': True, 'bear_use_adx': False, 'bear_use_spike': True, 'bear_rsi_required': False, 'sideways_strategy': 'mean_reversion', 'sideways_bb_std_mult': 3.5332689468899665, 'sideways_rsi_os': 34, 'sideways_rsi_ob': 79, 'sideways_adx_thresh': 14.169885449154197, 'sideways_atr_min_pct': 0.0022122636600430488, 'sideways_atr_max_pct': 0.1201552452059831, 'sideways_tp_mult': 1.5701185152994785, 'sideways_tsl_mult': 0.3617591793513973, 'sideways_time_stop': 5, 'sideways_use_sma': True, 'sideways_use_ema': False, 'sideways_use_atr': True, 'sideways_use_adx': True, 'sideways_use_spike': False, 'sideways_rsi_required': True}.
[I 2025-08-31 11:48:41,721] Trial 417 finished with values: [-0.02353680147877857, 0.02387442821485133] and parameters: {'p_sma': 30, 'p_std': 18, 'p_atr': 30, 'p_adx': 26, 'rsi_period': 51, 'ema1': 11, 'ema2': 39, 'slip_atr_k': 0.00044460737156980235, 'slip_spread_k': 0.1264454438078634, 'spread_hl_frac': 3.28113746599271e-05, 'bb_std_mult': 2.1529691153373003, 'rsi_os': 9, 'rsi_ob': 74, 'vol_spike': 0.14803931528001354, 'adx_thresh': 14.814031859630742, 'atr_min_pct': 0.0035127454876852917, 'atr_max_pct': 0.035259773675822864, 'tp_mult': 1.1406756589597296, 'tsl_mult': 0.2834255024532803, 'strategy': 'breakout', 'time_stop': 295, 'use_sma': False, 'use_atr': True, 'use_adx': True, 'use_ema': False, 'use_spike': False, 'rsi_required': True, 'edge_k': 0.5901205584092601, 'edge_cap': 0.16279238930131096, 'bull_strategy': 'breakout', 'bull_bb_std_mult': 2.656665202944662, 'bull_rsi_os': 6, 'bull_rsi_ob': 47, 'bull_adx_thresh': 14.285510100544164, 'bull_atr_min_pct': 0.002628334574397472, 'bull_atr_max_pct': 0.07374501386245037, 'bull_tp_mult': 1.487220342436149, 'bull_tsl_mult': 0.2561103671892735, 'bull_time_stop': 166, 'bull_use_sma': True, 'bull_use_ema': True, 'bull_use_atr': True, 'bull_use_adx': False, 'bull_use_spike': False, 'bull_rsi_required': True, 'bear_strategy': 'breakout', 'bear_bb_std_mult': 2.0652171703623012, 'bear_rsi_os': 31, 'bear_rsi_ob': 59, 'bear_adx_thresh': 29.737262340682, 'bear_atr_min_pct': 0.009162357103325872, 'bear_atr_max_pct': 0.11751559123074311, 'bear_tp_mult': 2.591738436829106, 'bear_tsl_mult': 0.5955573294048555, 'bear_time_stop': 295, 'bear_use_sma': True, 'bear_use_ema': True, 'bear_use_atr': True, 'bear_use_adx': False, 'bear_use_spike': True, 'bear_rsi_required': False, 'sideways_strategy': 'mean_reversion', 'sideways_bb_std_mult': 1.5343911310132168, 'sideways_rsi_os': 34, 'sideways_rsi_ob': 74, 'sideways_adx_thresh': 21.704504280318165, 'sideways_atr_min_pct': 0.0023450994955692725, 'sideways_atr_max_pct': 0.03271655927391606, 'sideways_tp_mult': 1.1975767789173732, 'sideways_tsl_mult': 0.051427889624354406, 'sideways_time_stop': 45, 'sideways_use_sma': True, 'sideways_use_ema': False, 'sideways_use_atr': True, 'sideways_use_adx': True, 'sideways_use_spike': True, 'sideways_rsi_required': True}.
[I 2025-08-31 11:48:41,992] Trial 418 finished with values: [-0.024456925358859682, 0.024428632848881436] and parameters: {'p_sma': 31, 'p_std': 52, 'p_atr': 14, 'p_adx': 12, 'rsi_period': 50, 'ema1': 10, 'ema2': 23, 'slip_atr_k': 0.040685599044757, 'slip_spread_k': 0.24476620865531884, 'spread_hl_frac': 0.02432470038851152, 'bb_std_mult': 2.104868257895652, 'rsi_os': 32, 'rsi_ob': 51, 'vol_spike': 0.14415942093734288, 'adx_thresh': 23.855691041722107, 'atr_min_pct': 0.012812974232268534, 'atr_max_pct': 0.023490796306112297, 'tp_mult': 1.1364931954716748, 'tsl_mult': 0.1976047273838047, 'strategy': 'breakout', 'time_stop': 293, 'use_sma': False, 'use_atr': True, 'use_adx': True, 'use_ema': False, 'use_spike': False, 'rsi_required': True, 'edge_k': 1.402464911603524, 'edge_cap': 0.8426526752404556, 'bull_strategy': 'breakout', 'bull_bb_std_mult': 3.4716976855445547, 'bull_rsi_os': 20, 'bull_rsi_ob': 66, 'bull_adx_thresh': 14.833029352932375, 'bull_atr_min_pct': 0.0024466659612878074, 'bull_atr_max_pct': 0.07338494450925363, 'bull_tp_mult': 1.3722605479065566, 'bull_tsl_mult': 0.26710168957072705, 'bull_time_stop': 136, 'bull_use_sma': True, 'bull_use_ema': True, 'bull_use_atr': True, 'bull_use_adx': False, 'bull_use_spike': False, 'bull_rsi_required': True, 'bear_strategy': 'breakout', 'bear_bb_std_mult': 1.3362155006355563, 'bear_rsi_os': 10, 'bear_rsi_ob': 71, 'bear_adx_thresh': 30.13082240139727, 'bear_atr_min_pct': 0.014394965902024541, 'bear_atr_max_pct': 0.11317632370480876, 'bear_tp_mult': 2.8985166186756306, 'bear_tsl_mult': 0.2662899542984618, 'bear_time_stop': 293, 'bear_use_sma': True, 'bear_use_ema': True, 'bear_use_atr': True, 'bear_use_adx': False, 'bear_use_spike': True, 'bear_rsi_required': False, 'sideways_strategy': 'mean_reversion', 'sideways_bb_std_mult': 1.72418726267389, 'sideways_rsi_os': 34, 'sideways_rsi_ob': 74, 'sideways_adx_thresh': 14.270707895682392, 'sideways_atr_min_pct': 0.0023212983578088835, 'sideways_atr_max_pct': 0.04507066929107584, 'sideways_tp_mult': 1.2096707602896486, 'sideways_tsl_mult': 0.36341114959015647, 'sideways_time_stop': 92, 'sideways_use_sma': True, 'sideways_use_ema': False, 'sideways_use_atr': True, 'sideways_use_adx': True, 'sideways_use_spike': True, 'sideways_rsi_required': True}.
[I 2025-08-31 11:48:42,691] Trial 419 finished with values: [-0.01143705625228264, 0.011694624094034298] and parameters: {'p_sma': 31, 'p_std': 60, 'p_atr': 12, 'p_adx': 26, 'rsi_period': 51, 'ema1': 28, 'ema2': 39, 'slip_atr_k': 0.05293088885883862, 'slip_spread_k': 0.12821429240921578, 'spread_hl_frac': 0.024223327580192067, 'bb_std_mult': 0.6821370897928155, 'rsi_os': 17, 'rsi_ob': 86, 'vol_spike': 0.10948994528943176, 'adx_thresh': 23.828103955298953, 'atr_min_pct': 0.005232286918322903, 'atr_max_pct': 0.035377649296848244, 'tp_mult': 1.1418412967477118, 'tsl_mult': 0.4045132152037823, 'strategy': 'breakout', 'time_stop': 294, 'use_sma': False, 'use_atr': True, 'use_adx': True, 'use_ema': False, 'use_spike': True, 'rsi_required': True, 'edge_k': 1.4609493731957266, 'edge_cap': 0.8486378249592005, 'bull_strategy': 'breakout', 'bull_bb_std_mult': 2.6629295745236634, 'bull_rsi_os': 6, 'bull_rsi_ob': 61, 'bull_adx_thresh': 32.32354856197202, 'bull_atr_min_pct': 0.013792634190252236, 'bull_atr_max_pct': 0.08995587324304155, 'bull_tp_mult': 2.3623109061483762, 'bull_tsl_mult': 0.2570661824411812, 'bull_time_stop': 79, 'bull_use_sma': True, 'bull_use_ema': True, 'bull_use_atr': True, 'bull_use_adx': False, 'bull_use_spike': False, 'bull_rsi_required': True, 'bear_strategy': 'breakout', 'bear_bb_std_mult': 1.1651144232492323, 'bear_rsi_os': 30, 'bear_rsi_ob': 87, 'bear_adx_thresh': 32.99010457758373, 'bear_atr_min_pct': 0.023344226423470373, 'bear_atr_max_pct': 0.11482101231653917, 'bear_tp_mult': 2.6328124512307554, 'bear_tsl_mult': 0.36596688321430076, 'bear_time_stop': 291, 'bear_use_sma': True, 'bear_use_ema': True, 'bear_use_atr': True, 'bear_use_adx': False, 'bear_use_spike': True, 'bear_rsi_required': True, 'sideways_strategy': 'breakout', 'sideways_bb_std_mult': 1.7389361453943872, 'sideways_rsi_os': 34, 'sideways_rsi_ob': 93, 'sideways_adx_thresh': 21.816314825587465, 'sideways_atr_min_pct': 0.0024821483986743427, 'sideways_atr_max_pct': 0.04461202372704998, 'sideways_tp_mult': 1.5624188486686046, 'sideways_tsl_mult': 0.35871939166938216, 'sideways_time_stop': 238, 'sideways_use_sma': True, 'sideways_use_ema': False, 'sideways_use_atr': True, 'sideways_use_adx': True, 'sideways_use_spike': True, 'sideways_rsi_required': False}.
[I 2025-08-31 11:49:17,736] Trial 423 finished with values: [-1000000000.0, 1000000000.0] and parameters: {'p_sma': 33, 'p_std': 60, 'p_atr': 14, 'p_adx': 26, 'rsi_period': 52, 'ema1': 12, 'ema2': 36, 'slip_atr_k': 0.06894519037719676, 'slip_spread_k': 0.09308210164035213, 'spread_hl_frac': 0.001959836121160578, 'bb_std_mult': 0.6588003661448499, 'rsi_os': 33, 'rsi_ob': 49, 'vol_spike': 0.11901344933367734, 'adx_thresh': 24.879219970130126, 'atr_min_pct': 0.0052689713624628565, 'atr_max_pct': 0.027691710406555235, 'tp_mult': 2.3257550654764443, 'tsl_mult': 0.40578569291051764, 'strategy': 'breakout', 'time_stop': 116, 'use_sma': False, 'use_atr': False, 'use_adx': True, 'use_ema': False, 'use_spike': True, 'rsi_required': True, 'edge_k': 0.3734122202743555, 'edge_cap': 0.8764640538264601, 'bull_strategy': 'breakout', 'bull_bb_std_mult': 2.3117062034843445, 'bull_rsi_os': 23, 'bull_rsi_ob': 92, 'bull_adx_thresh': 17.354735273724092, 'bull_atr_min_pct': 0.0033112421030436507, 'bull_atr_max_pct': 0.09200923108582584, 'bull_tp_mult': 2.013012625636717, 'bull_tsl_mult': 0.6393151837201865, 'bull_time_stop': 139, 'bull_use_sma': True, 'bull_use_ema': True, 'bull_use_atr': True, 'bull_use_adx': True, 'bull_use_spike': False, 'bull_rsi_required': True, 'bear_strategy': 'breakout', 'bear_bb_std_mult': 0.9853684894398319, 'bear_rsi_os': 29, 'bear_rsi_ob': 49, 'bear_adx_thresh': 12.687514587276116, 'bear_atr_min_pct': 0.02351320052144599, 'bear_atr_max_pct': 0.13784419577117624, 'bear_tp_mult': 2.7357399214725264, 'bear_tsl_mult': 0.36452607400630266, 'bear_time_stop': 190, 'bear_use_sma': False, 'bear_use_ema': True, 'bear_use_atr': True, 'bear_use_adx': False, 'bear_use_spike': True, 'bear_rsi_required': True, 'sideways_strategy': 'breakout', 'sideways_bb_std_mult': 1.73696922669646, 'sideways_rsi_os': 25, 'sideways_rsi_ob': 71, 'sideways_adx_thresh': 23.86239541679718, 'sideways_atr_min_pct': 0.013155281130395624, 'sideways_atr_max_pct': 0.039575770833565366, 'sideways_tp_mult': 1.5562470223304805, 'sideways_tsl_mult': 0.9858865499365974, 'sideways_time_stop': 118, 'sideways_use_sma': True, 'sideways_use_ema': False, 'sideways_use_atr': True, 'sideways_use_adx': True, 'sideways_use_spike': False, 'sideways_rsi_required': False}.
[I 2025-08-31 11:49:18,065] Trial 422 finished with values: [-1000000000.0, 1000000000.0] and parameters: {'p_sma': 59, 'p_std': 43, 'p_atr': 12, 'p_adx': 14, 'rsi_period': 52, 'ema1': 21, 'ema2': 45, 'slip_atr_k': 0.05176694020649197, 'slip_spread_k': 0.0918589007319496, 'spread_hl_frac': 0.0017182574560780407, 'bb_std_mult': 0.6697406115416972, 'rsi_os': 26, 'rsi_ob': 78, 'vol_spike': 0.1093509412576542, 'adx_thresh': 8.456812828882944, 'atr_min_pct': 0.005271064800768971, 'atr_max_pct': 0.025304408540486326, 'tp_mult': 1.974383958821554, 'tsl_mult': 0.36573910948297667, 'strategy': 'breakout', 'time_stop': 295, 'use_sma': True, 'use_atr': False, 'use_adx': True, 'use_ema': False, 'use_spike': True, 'rsi_required': True, 'edge_k': 1.1090543867084623, 'edge_cap': 0.8849337112168147, 'bull_strategy': 'mean_reversion', 'bull_bb_std_mult': 1.4528846479483124, 'bull_rsi_os': 23, 'bull_rsi_ob': 49, 'bull_adx_thresh': 15.583017463350384, 'bull_atr_min_pct': 0.003666375519233573, 'bull_atr_max_pct': 0.1471891267437588, 'bull_tp_mult': 1.5232747475841117, 'bull_tsl_mult': 0.9582243992618906, 'bull_time_stop': 79, 'bull_use_sma': True, 'bull_use_ema': True, 'bull_use_atr': True, 'bull_use_adx': True, 'bull_use_spike': False, 'bull_rsi_required': True, 'bear_strategy': 'breakout', 'bear_bb_std_mult': 1.6765207292185278, 'bear_rsi_os': 29, 'bear_rsi_ob': 55, 'bear_adx_thresh': 31.916819232211715, 'bear_atr_min_pct': 0.01365073220614663, 'bear_atr_max_pct': 0.021393745271603343, 'bear_tp_mult': 2.0861246999779968, 'bear_tsl_mult': 0.3681824492706335, 'bear_time_stop': 127, 'bear_use_sma': False, 'bear_use_ema': True, 'bear_use_atr': True, 'bear_use_adx': False, 'bear_use_spike': True, 'bear_rsi_required': True, 'sideways_strategy': 'breakout', 'sideways_bb_std_mult': 1.3106888349552468, 'sideways_rsi_os': 33, 'sideways_rsi_ob': 71, 'sideways_adx_thresh': 9.702709082474284, 'sideways_atr_min_pct': 0.022623377448766746, 'sideways_atr_max_pct': 0.03930972255110569, 'sideways_tp_mult': 1.3810172833690368, 'sideways_tsl_mult': 0.9951541682135234, 'sideways_time_stop': 16, 'sideways_use_sma': True, 'sideways_use_ema': False, 'sideways_use_atr': True, 'sideways_use_adx': True, 'sideways_use_spike': False, 'sideways_rsi_required': False}.
[I 2025-08-31 11:49:18,430] Trial 420 finished with values: [-1000000000.0, 1000000000.0] and parameters: {'p_sma': 5, 'p_std': 52, 'p_atr': 14, 'p_adx': 11, 'rsi_period': 51, 'ema1': 12, 'ema2': 40, 'slip_atr_k': 0.05118403687517505, 'slip_spread_k': 0.12102018311381497, 'spread_hl_frac': 0.002072258240191998, 'bb_std_mult': 0.6863976805506435, 'rsi_os': 17, 'rsi_ob': 86, 'vol_spike': 0.05856348820723435, 'adx_thresh': 8.635253585987229, 'atr_min_pct': 0.013070156267014792, 'atr_max_pct': 0.03451247348522097, 'tp_mult': 2.184932825978383, 'tsl_mult': 0.48854744969374164, 'strategy': 'breakout', 'time_stop': 114, 'use_sma': False, 'use_atr': True, 'use_adx': True, 'use_ema': False, 'use_spike': True, 'rsi_required': True, 'edge_k': 0.36289976277302977, 'edge_cap': 0.8472314696616436, 'bull_strategy': 'breakout', 'bull_bb_std_mult': 2.6607798892456636, 'bull_rsi_os': 6, 'bull_rsi_ob': 66, 'bull_adx_thresh': 15.320345805764294, 'bull_atr_min_pct': 0.013962139888196024, 'bull_atr_max_pct': 0.14710423246603455, 'bull_tp_mult': 2.123487266956438, 'bull_tsl_mult': 0.7174634764384173, 'bull_time_stop': 82, 'bull_use_sma': True, 'bull_use_ema': True, 'bull_use_atr': True, 'bull_use_adx': False, 'bull_use_spike': False, 'bull_rsi_required': True, 'bear_strategy': 'breakout', 'bear_bb_std_mult': 2.0648619216205057, 'bear_rsi_os': 46, 'bear_rsi_ob': 59, 'bear_adx_thresh': 30.212192025772982, 'bear_atr_min_pct': 0.013773192310940981, 'bear_atr_max_pct': 0.11386894037228615, 'bear_tp_mult': 2.6214437006165237, 'bear_tsl_mult': 0.3660113232631384, 'bear_time_stop': 293, 'bear_use_sma': True, 'bear_use_ema': True, 'bear_use_atr': True, 'bear_use_adx': False, 'bear_use_spike': True, 'bear_rsi_required': True, 'sideways_strategy': 'breakout', 'sideways_bb_std_mult': 1.3072660535848508, 'sideways_rsi_os': 25, 'sideways_rsi_ob': 74, 'sideways_adx_thresh': 23.866132687607294, 'sideways_atr_min_pct': 0.013121002182299705, 'sideways_atr_max_pct': 0.039193863040373714, 'sideways_tp_mult': 2.995637789534636, 'sideways_tsl_mult': 0.3865677575332222, 'sideways_time_stop': 92, 'sideways_use_sma': True, 'sideways_use_ema': False, 'sideways_use_atr': True, 'sideways_use_adx': True, 'sideways_use_spike': True, 'sideways_rsi_required': False}.
