[I 2025-08-31 11:27:38,488] Trial 242 finished with values: [-1000000000.0, 1000000000.0] and parameters: {'p_sma': 31, 'p_std': 8, 'p_atr': 23, 'p_adx': 26, 'rsi_period': 68, 'ema1': 12, 'ema2': 28, 'slip_atr_k': 0.041842254134794706, 'slip_spread_k': 0.2367377090901323, 'spread_hl_frac': 0.0023386955042742266, 'bb_std_mult': 0.6410985177023969, 'rsi_os': 31, 'rsi_ob': 70, 'vol_spike': 0.15404943385617434, 'adx_thresh': 23.09515313749967, 'atr_min_pct': 0.0045767081416707754, 'atr_max_pct': 0.020966683299166736, 'tp_mult': 2.650650750769514, 'tsl_mult': 0.2734835281009458, 'strategy': 'breakout', 'time_stop': 290, 'use_sma': True, 'use_atr': True, 'use_adx': True, 'use_ema': False, 'use_spike': True, 'rsi_required': True, 'edge_k': 0.4339695615339383, 'edge_cap': 0.8071859603044951, 'bull_strategy': 'breakout', 'bull_bb_std_mult': 2.6200713116337706, 'bull_rsi_os': 55, 'bull_rsi_ob': 62, 'bull_adx_thresh': 16.692585650530763, 'bull_atr_min_pct': 0.011745097866415886, 'bull_atr_max_pct': 0.028696571505177793, 'bull_tp_mult': 1.9992085658550354, 'bull_tsl_mult': 0.15227307055779332, 'bull_time_stop': 292, 'bull_use_sma': True, 'bull_use_ema': True, 'bull_use_atr': True, 'bull_use_adx': True, 'bull_use_spike': False, 'bull_rsi_required': True, 'bear_strategy': 'mean_reversion', 'bear_bb_std_mult': 1.0386517731833678, 'bear_rsi_os': 30, 'bear_rsi_ob': 49, 'bear_adx_thresh': 31.653974113264834, 'bear_atr_min_pct': 0.016980175263369195, 'bear_atr_max_pct': 0.11967883103768462, 'bear_tp_mult': 2.8527893184546014, 'bear_tsl_mult': 0.2253242816370295, 'bear_time_stop': 227, 'bear_use_sma': False, 'bear_use_ema': True, 'bear_use_atr': True, 'bear_use_adx': False, 'bear_use_spike': True, 'bear_rsi_required': False, 'sideways_strategy': 'breakout', 'sideways_bb_std_mult': 1.7334824661043364, 'sideways_rsi_os': 33, 'sideways_rsi_ob': 76, 'sideways_adx_thresh': 8.871913180594746, 'sideways_atr_min_pct': 0.005065873874452119, 'sideways_atr_max_pct': 0.0444691310094151, 'sideways_tp_mult': 1.5138598259260916, 'sideways_tsl_mult': 0.2847702059076044, 'sideways_time_stop': 5, 'sideways_use_sma': True, 'sideways_use_ema': False, 'sideways_use_atr': True, 'sideways_use_adx': True, 'sideways_use_spike': False, 'sideways_rsi_required': True}.
[I 2025-08-31 11:27:38,627] Trial 243 finished with values: [-0.03158934251477208, 0.031303570257991783] and parameters: {'p_sma': 26, 'p_std': 25, 'p_atr': 22, 'p_adx': 26, 'rsi_period': 51, 'ema1': 11, 'ema2': 35, 'slip_atr_k': 0.16248896610784416, 'slip_spread_k': 0.3082815597544759, 'spread_hl_frac': 0.00010244116950512867, 'bb_std_mult': 0.804313155507406, 'rsi_os': 33, 'rsi_ob': 72, 'vol_spike': 0.14917692757157952, 'adx_thresh': 25.17572032865558, 'atr_min_pct': 0.006253822300148185, 'atr_max_pct': 0.025510955521945197, 'tp_mult': 1.0777641794595703, 'tsl_mult': 0.32686220068174743, 'strategy': 'breakout', 'time_stop': 126, 'use_sma': False, 'use_atr': True, 'use_adx': True, 'use_ema': False, 'use_spike': True, 'rsi_required': True, 'edge_k': 0.4268887888669749, 'edge_cap': 0.8421383588215323, 'bull_strategy': 'breakout', 'bull_bb_std_mult': 2.581473677181778, 'bull_rsi_os': 55, 'bull_rsi_ob': 66, 'bull_adx_thresh': 16.44227322854901, 'bull_atr_min_pct': 0.012155593863691208, 'bull_atr_max_pct': 0.14145108196634762, 'bull_tp_mult': 1.2125545543974936, 'bull_tsl_mult': 0.1469851193931463, 'bull_time_stop': 138, 'bull_use_sma': True, 'bull_use_ema': True, 'bull_use_atr': True, 'bull_use_adx': True, 'bull_use_spike': False, 'bull_rsi_required': True, 'bear_strategy': 'mean_reversion', 'bear_bb_std_mult': 1.8628527746577246, 'bear_rsi_os': 29, 'bear_rsi_ob': 53, 'bear_adx_thresh': 32.241305283253155, 'bear_atr_min_pct': 0.01936617242775264, 'bear_atr_max_pct': 0.11546839134299239, 'bear_tp_mult': 2.834123040943149, 'bear_tsl_mult': 0.5489735864448715, 'bear_time_stop': 230, 'bear_use_sma': False, 'bear_use_ema': True, 'bear_use_atr': True, 'bear_use_adx': False, 'bear_use_spike': True, 'bear_rsi_required': False, 'sideways_strategy': 'breakout', 'sideways_bb_std_mult': 1.7196098499059536, 'sideways_rsi_os': 39, 'sideways_rsi_ob': 76, 'sideways_adx_thresh': 8.677387323803275, 'sideways_atr_min_pct': 0.002438012674682819, 'sideways_atr_max_pct': 0.048119098243975734, 'sideways_tp_mult': 1.1175743303030765, 'sideways_tsl_mult': 0.2749347402882673, 'sideways_time_stop': 5, 'sideways_use_sma': True, 'sideways_use_ema': False, 'sideways_use_atr': True, 'sideways_use_adx': True, 'sideways_use_spike': False, 'sideways_rsi_required': True}.
[I 2025-08-31 11:27:38,705] Trial 244 finished with values: [-0.020930530489436938, 0.02105052142084363] and parameters: {'p_sma': 26, 'p_std': 12, 'p_atr': 10, 'p_adx': 26, 'rsi_period': 51, 'ema1': 12, 'ema2': 35, 'slip_atr_k': 0.050700527801460414, 'slip_spread_k': 0.30574360507301623, 'spread_hl_frac': 0.0003078152265933691, 'bb_std_mult': 0.8476151580753499, 'rsi_os': 33, 'rsi_ob': 72, 'vol_spike': 0.14806407933424787, 'adx_thresh': 25.184198604197434, 'atr_min_pct': 0.004780293982224807, 'atr_max_pct': 0.02460246018505563, 'tp_mult': 1.075515413552191, 'tsl_mult': 0.21549582609767706, 'strategy': 'breakout', 'time_stop': 295, 'use_sma': False, 'use_atr': True, 'use_adx': True, 'use_ema': False, 'use_spike': True, 'rsi_required': True, 'edge_k': 1.2157901857471685, 'edge_cap': 0.844531278205209, 'bull_strategy': 'mean_reversion', 'bull_bb_std_mult': 2.6448526103694676, 'bull_rsi_os': 21, 'bull_rsi_ob': 83, 'bull_adx_thresh': 16.19609257831229, 'bull_atr_min_pct': 0.0067247896771172565, 'bull_atr_max_pct': 0.03147762927058995, 'bull_tp_mult': 2.785393740276103, 'bull_tsl_mult': 0.7541123330566222, 'bull_time_stop': 114, 'bull_use_sma': True, 'bull_use_ema': True, 'bull_use_atr': True, 'bull_use_adx': True, 'bull_use_spike': False, 'bull_rsi_required': True, 'bear_strategy': 'mean_reversion', 'bear_bb_std_mult': 1.2437424232102943, 'bear_rsi_os': 33, 'bear_rsi_ob': 72, 'bear_adx_thresh': 32.062957901992334, 'bear_atr_min_pct': 0.02080439376841087, 'bear_atr_max_pct': 0.12056130138570878, 'bear_tp_mult': 2.768386104923086, 'bear_tsl_mult': 0.21550078955898028, 'bear_time_stop': 229, 'bear_use_sma': False, 'bear_use_ema': True, 'bear_use_atr': True, 'bear_use_adx': False, 'bear_use_spike': True, 'bear_rsi_required': False, 'sideways_strategy': 'breakout', 'sideways_bb_std_mult': 1.706753438815021, 'sideways_rsi_os': 33, 'sideways_rsi_ob': 72, 'sideways_adx_thresh': 8.824451523163004, 'sideways_atr_min_pct': 0.0023255811138312944, 'sideways_atr_max_pct': 0.03354281466395714, 'sideways_tp_mult': 1.4208669759148205, 'sideways_tsl_mult': 0.1496578541616422, 'sideways_time_stop': 293, 'sideways_use_sma': True, 'sideways_use_ema': False, 'sideways_use_atr': True, 'sideways_use_adx': True, 'sideways_use_spike': False, 'sideways_rsi_required': True}.
[I 2025-08-31 11:28:10,624] Trial 246 finished with values: [-1000000000.0, 1000000000.0] and parameters: {'p_sma': 26, 'p_std': 31, 'p_atr': 29, 'p_adx': 26, 'rsi_period': 52, 'ema1': 9, 'ema2': 40, 'slip_atr_k': 0.21034929764007232, 'slip_spread_k': 0.057123472897862966, 'spread_hl_frac': 0.001187830069732504, 'bb_std_mult': 0.8776841801273361, 'rsi_os': 35, 'rsi_ob': 72, 'vol_spike': 0.13879218220915102, 'adx_thresh': 25.214999977438715, 'atr_min_pct': 0.004357147398234838, 'atr_max_pct': 0.01841371129897959, 'tp_mult': 2.569151803583752, 'tsl_mult': 0.31996794859289845, 'strategy': 'breakout', 'time_stop': 295, 'use_sma': False, 'use_atr': True, 'use_adx': True, 'use_ema': True, 'use_spike': True, 'rsi_required': True, 'edge_k': 1.5851559338240246, 'edge_cap': 0.8376995514011828, 'bull_strategy': 'breakout', 'bull_bb_std_mult': 2.7959682284253797, 'bull_rsi_os': 21, 'bull_rsi_ob': 83, 'bull_adx_thresh': 20.454809382573984, 'bull_atr_min_pct': 0.009123393756362997, 'bull_atr_max_pct': 0.1460381945101962, 'bull_tp_mult': 1.2228929095533512, 'bull_tsl_mult': 0.8344610551799596, 'bull_time_stop': 215, 'bull_use_sma': False, 'bull_use_ema': True, 'bull_use_atr': True, 'bull_use_adx': True, 'bull_use_spike': False, 'bull_rsi_required': True, 'bear_strategy': 'breakout', 'bear_bb_std_mult': 1.8562446315415897, 'bear_rsi_os': 33, 'bear_rsi_ob': 78, 'bear_adx_thresh': 30.722093726068287, 'bear_atr_min_pct': 0.012263161311735273, 'bear_atr_max_pct': 0.11119747285671969, 'bear_tp_mult': 2.7968129608561725, 'bear_tsl_mult': 0.3363999476268643, 'bear_time_stop': 232, 'bear_use_sma': False, 'bear_use_ema': True, 'bear_use_atr': True, 'bear_use_adx': False, 'bear_use_spike': True, 'bear_rsi_required': True, 'sideways_strategy': 'breakout', 'sideways_bb_std_mult': 1.6089611446937913, 'sideways_rsi_os': 31, 'sideways_rsi_ob': 75, 'sideways_adx_thresh': 8.817410513042999, 'sideways_atr_min_pct': 0.002494176854771171, 'sideways_atr_max_pct': 0.034875170680110396, 'sideways_tp_mult': 1.4134461561489375, 'sideways_tsl_mult': 0.2634707878101169, 'sideways_time_stop': 8, 'sideways_use_sma': True, 'sideways_use_ema': False, 'sideways_use_atr': True, 'sideways_use_adx': True, 'sideways_use_spike': False, 'sideways_rsi_required': True}.
[I 2025-08-31 11:28:10,785] Trial 247 finished with values: [-1000000000.0, 1000000000.0] and parameters: {'p_sma': 29, 'p_std': 46, 'p_atr': 22, 'p_adx': 27, 'rsi_period': 51, 'ema1': 29, 'ema2': 40, 'slip_atr_k': 0.16194652829921213, 'slip_spread_k': 0.05905654333801441, 'spread_hl_frac': 0.001031706526802837, 'bb_std_mult': 0.905980065803759, 'rsi_os': 35, 'rsi_ob': 72, 'vol_spike': 0.13845834706811772, 'adx_thresh': 25.221772659203154, 'atr_min_pct': 0.0050297402692755806, 'atr_max_pct': 0.0185165088886314, 'tp_mult': 2.2501752301982902, 'tsl_mult': 0.3193864756429412, 'strategy': 'breakout', 'time_stop': 295, 'use_sma': False, 'use_atr': True, 'use_adx': False, 'use_ema': True, 'use_spike': True, 'rsi_required': True, 'edge_k': 0.49276979907119894, 'edge_cap': 0.8374065365061485, 'bull_strategy': 'breakout', 'bull_bb_std_mult': 2.367834600480217, 'bull_rsi_os': 21, 'bull_rsi_ob': 83, 'bull_adx_thresh': 20.273154330638512, 'bull_atr_min_pct': 0.013669670582980329, 'bull_atr_max_pct': 0.14512584706615572, 'bull_tp_mult': 2.411932738929557, 'bull_tsl_mult': 0.18291585317848602, 'bull_time_stop': 110, 'bull_use_sma': False, 'bull_use_ema': True, 'bull_use_atr': True, 'bull_use_adx': True, 'bull_use_spike': False, 'bull_rsi_required': True, 'bear_strategy': 'breakout', 'bear_bb_std_mult': 1.8439982646472626, 'bear_rsi_os': 33, 'bear_rsi_ob': 52, 'bear_adx_thresh': 30.59055981291041, 'bear_atr_min_pct': 0.012277391796325893, 'bear_atr_max_pct': 0.11596454119729663, 'bear_tp_mult': 2.9986006620701686, 'bear_tsl_mult': 0.40021827068719307, 'bear_time_stop': 168, 'bear_use_sma': False, 'bear_use_ema': True, 'bear_use_atr': True, 'bear_use_adx': True, 'bear_use_spike': False, 'bear_rsi_required': True, 'sideways_strategy': 'breakout', 'sideways_bb_std_mult': 1.8867533181013456, 'sideways_rsi_os': 18, 'sideways_rsi_ob': 75, 'sideways_adx_thresh': 22.238131313821416, 'sideways_atr_min_pct': 0.012107960172305497, 'sideways_atr_max_pct': 0.03402495098741348, 'sideways_tp_mult': 1.4159716949059606, 'sideways_tsl_mult': 0.3417817687558332, 'sideways_time_stop': 183, 'sideways_use_sma': True, 'sideways_use_ema': False, 'sideways_use_atr': True, 'sideways_use_adx': True, 'sideways_use_spike': False, 'sideways_rsi_required': False}.
[I 2025-08-31 11:28:11,260] Trial 249 finished with values: [-1000000000.0, 1000000000.0] and parameters: {'p_sma': 29, 'p_std': 19, 'p_atr': 11, 'p_adx': 28, 'rsi_period': 52, 'ema1': 12, 'ema2': 42, 'slip_atr_k': 0.15693601278609837, 'slip_spread_k': 0.0034579499490862975, 'spread_hl_frac': 0.0046877752314238175, 'bb_std_mult': 0.8633559270523823, 'rsi_os': 35, 'rsi_ob': 72, 'vol_spike': 0.14277058510107532, 'adx_thresh': 24.356157083311587, 'atr_min_pct': 0.004803115306121419, 'atr_max_pct': 0.018583740838600805, 'tp_mult': 2.256516571833857, 'tsl_mult': 0.2182334473149065, 'strategy': 'breakout', 'time_stop': 110, 'use_sma': False, 'use_atr': False, 'use_adx': True, 'use_ema': True, 'use_spike': True, 'rsi_required': True, 'edge_k': 1.989536663035604, 'edge_cap': 0.8625238902519411, 'bull_strategy': 'mean_reversion', 'bull_bb_std_mult': 3.081352566471206, 'bull_rsi_os': 24, 'bull_rsi_ob': 64, 'bull_adx_thresh': 20.455806573338357, 'bull_atr_min_pct': 0.0066691173789122805, 'bull_atr_max_pct': 0.14528560056083858, 'bull_tp_mult': 1.5105174503122913, 'bull_tsl_mult': 0.46540779941928295, 'bull_time_stop': 162, 'bull_use_sma': False, 'bull_use_ema': True, 'bull_use_atr': True, 'bull_use_adx': False, 'bull_use_spike': False, 'bull_rsi_required': False, 'bear_strategy': 'breakout', 'bear_bb_std_mult': 1.1473447771752499, 'bear_rsi_os': 33, 'bear_rsi_ob': 72, 'bear_adx_thresh': 25.0777098903426, 'bear_atr_min_pct': 0.02365082212093063, 'bear_atr_max_pct': 0.11663215889760552, 'bear_tp_mult': 2.6878531946058075, 'bear_tsl_mult': 0.33991649385321965, 'bear_time_stop': 214, 'bear_use_sma': False, 'bear_use_ema': True, 'bear_use_atr': True, 'bear_use_adx': True, 'bear_use_spike': False, 'bear_rsi_required': True, 'sideways_strategy': 'mean_reversion', 'sideways_bb_std_mult': 1.8142727532847618, 'sideways_rsi_os': 31, 'sideways_rsi_ob': 74, 'sideways_adx_thresh': 11.238319062273757, 'sideways_atr_min_pct': 0.003941040519455093, 'sideways_atr_max_pct': 0.042002196233269666, 'sideways_tp_mult': 1.4159017871959159, 'sideways_tsl_mult': 0.19095650622118776, 'sideways_time_stop': 19, 'sideways_use_sma': True, 'sideways_use_ema': True, 'sideways_use_atr': True, 'sideways_use_adx': False, 'sideways_use_spike': True, 'sideways_rsi_required': True}.
[I 2025-08-31 11:28:11,443] Trial 248 finished with values: [-1000000000.0, 1000000000.0] and parameters: {'p_sma': 29, 'p_std': 18, 'p_atr': 11, 'p_adx': 28, 'rsi_period': 51, 'ema1': 12, 'ema2': 45, 'slip_atr_k': 0.04815018141595177, 'slip_spread_k': 0.00801049460240505, 'spread_hl_frac': 0.0011070755987616753, 'bb_std_mult': 0.8563881679299976, 'rsi_os': 29, 'rsi_ob': 72, 'vol_spike': 0.14192523747801752, 'adx_thresh': 24.323188524167033, 'atr_min_pct': 0.004914680040014578, 'atr_max_pct': 0.02352029441479752, 'tp_mult': 2.578273602036182, 'tsl_mult': 0.21371692046511992, 'strategy': 'breakout', 'time_stop': 256, 'use_sma': False, 'use_atr': False, 'use_adx': True, 'use_ema': True, 'use_spike': True, 'rsi_required': True, 'edge_k': 1.217338629868252, 'edge_cap': 0.868869094037799, 'bull_strategy': 'mean_reversion', 'bull_bb_std_mult': 3.1783513013337163, 'bull_rsi_os': 24, 'bull_rsi_ob': 64, 'bull_adx_thresh': 14.915971726631224, 'bull_atr_min_pct': 0.0053622311977993475, 'bull_atr_max_pct': 0.1451213673278097, 'bull_tp_mult': 1.3495975140169114, 'bull_tsl_mult': 0.8273778675248878, 'bull_time_stop': 155, 'bull_use_sma': False, 'bull_use_ema': True, 'bull_use_atr': True, 'bull_use_adx': False, 'bull_use_spike': False, 'bull_rsi_required': False, 'bear_strategy': 'breakout', 'bear_bb_std_mult': 1.1492522952656106, 'bear_rsi_os': 33, 'bear_rsi_ob': 88, 'bear_adx_thresh': 30.779087270003345, 'bear_atr_min_pct': 0.012348760335417932, 'bear_atr_max_pct': 0.11711655135280458, 'bear_tp_mult': 2.6506808858839275, 'bear_tsl_mult': 0.34419772494298706, 'bear_time_stop': 170, 'bear_use_sma': False, 'bear_use_ema': True, 'bear_use_atr': True, 'bear_use_adx': True, 'bear_use_spike': False, 'bear_rsi_required': True, 'sideways_strategy': 'mean_reversion', 'sideways_bb_std_mult': 1.6093306870694943, 'sideways_rsi_os': 31, 'sideways_rsi_ob': 73, 'sideways_adx_thresh': 24.196975603711277, 'sideways_atr_min_pct': 0.027016565585097164, 'sideways_atr_max_pct': 0.0341262691359233, 'sideways_tp_mult': 1.4190765463218948, 'sideways_tsl_mult': 0.18362131559654543, 'sideways_time_stop': 85, 'sideways_use_sma': True, 'sideways_use_ema': True, 'sideways_use_atr': True, 'sideways_use_adx': False, 'sideways_use_spike': True, 'sideways_rsi_required': True}.
[I 2025-08-31 11:28:44,685] Trial 253 finished with values: [-1000000000.0, 1000000000.0] and parameters: {'p_sma': 32, 'p_std': 55, 'p_atr': 16, 'p_adx': 27, 'rsi_period': 46, 'ema1': 12, 'ema2': 42, 'slip_atr_k': 0.04994274469776784, 'slip_spread_k': 0.332413030553633, 'spread_hl_frac': 0.0037497214451007333, 'bb_std_mult': 0.7119103374636436, 'rsi_os': 30, 'rsi_ob': 71, 'vol_spike': 0.14798755407497982, 'adx_thresh': 26.307320484322542, 'atr_min_pct': 0.004534617196633505, 'atr_max_pct': 0.023299907166058256, 'tp_mult': 1.2475435748140244, 'tsl_mult': 0.20061413107971948, 'strategy': 'mean_reversion', 'time_stop': 219, 'use_sma': True, 'use_atr': True, 'use_adx': True, 'use_ema': False, 'use_spike': True, 'rsi_required': False, 'edge_k': 1.9413948918240742, 'edge_cap': 0.8192227392605598, 'bull_strategy': 'breakout', 'bull_bb_std_mult': 2.191505396315791, 'bull_rsi_os': 26, 'bull_rsi_ob': 63, 'bull_adx_thresh': 13.685958213927737, 'bull_atr_min_pct': 0.003974096952074996, 'bull_atr_max_pct': 0.02037203355029954, 'bull_tp_mult': 1.444158503180043, 'bull_tsl_mult': 0.4071874300736228, 'bull_time_stop': 146, 'bull_use_sma': True, 'bull_use_ema': True, 'bull_use_atr': False, 'bull_use_adx': True, 'bull_use_spike': True, 'bull_rsi_required': True, 'bear_strategy': 'breakout', 'bear_bb_std_mult': 1.2241216157117176, 'bear_rsi_os': 31, 'bear_rsi_ob': 54, 'bear_adx_thresh': 32.11255434605814, 'bear_atr_min_pct': 0.018105566399780167, 'bear_atr_max_pct': 0.030271793633461705, 'bear_tp_mult': 1.3381742769070297, 'bear_tsl_mult': 0.1708155501673102, 'bear_time_stop': 190, 'bear_use_sma': False, 'bear_use_ema': True, 'bear_use_atr': False, 'bear_use_adx': False, 'bear_use_spike': True, 'bear_rsi_required': False, 'sideways_strategy': 'breakout', 'sideways_bb_std_mult': 1.7163974402622006, 'sideways_rsi_os': 28, 'sideways_rsi_ob': 51, 'sideways_adx_thresh': 12.365001254001918, 'sideways_atr_min_pct': 0.027998818497402274, 'sideways_atr_max_pct': 0.05791980935271943, 'sideways_tp_mult': 1.3102385934642646, 'sideways_tsl_mult': 0.4823421936607358, 'sideways_time_stop': 300, 'sideways_use_sma': True, 'sideways_use_ema': False, 'sideways_use_atr': True, 'sideways_use_adx': True, 'sideways_use_spike': False, 'sideways_rsi_required': True}.
[I 2025-08-31 11:28:45,135] Trial 252 finished with values: [-1000000000.0, 1000000000.0] and parameters: {'p_sma': 32, 'p_std': 57, 'p_atr': 17, 'p_adx': 27, 'rsi_period': 52, 'ema1': 12, 'ema2': 45, 'slip_atr_k': 0.14321674494895678, 'slip_spread_k': 0.15144700266144218, 'spread_hl_frac': 0.0015672651673749117, 'bb_std_mult': 0.697744086646357, 'rsi_os': 29, 'rsi_ob': 71, 'vol_spike': 0.14577249084847207, 'adx_thresh': 26.216350546501964, 'atr_min_pct': 0.004196790579000326, 'atr_max_pct': 0.023338002013650803, 'tp_mult': 1.9449170687112385, 'tsl_mult': 0.3670524400411196, 'strategy': 'mean_reversion', 'time_stop': 179, 'use_sma': False, 'use_atr': False, 'use_adx': True, 'use_ema': False, 'use_spike': True, 'rsi_required': False, 'edge_k': 1.3493610009518946, 'edge_cap': 0.2919705483083803, 'bull_strategy': 'breakout', 'bull_bb_std_mult': 3.297801694935485, 'bull_rsi_os': 23, 'bull_rsi_ob': 63, 'bull_adx_thresh': 14.957434299254704, 'bull_atr_min_pct': 0.005469408802464853, 'bull_atr_max_pct': 0.045773391403132344, 'bull_tp_mult': 1.4458657199544933, 'bull_tsl_mult': 0.552556427835877, 'bull_time_stop': 225, 'bull_use_sma': True, 'bull_use_ema': True, 'bull_use_atr': False, 'bull_use_adx': True, 'bull_use_spike': True, 'bull_rsi_required': True, 'bear_strategy': 'breakout', 'bear_bb_std_mult': 1.209639765003611, 'bear_rsi_os': 32, 'bear_rsi_ob': 54, 'bear_adx_thresh': 31.994229917840915, 'bear_atr_min_pct': 0.014969091067314777, 'bear_atr_max_pct': 0.11904232105011642, 'bear_tp_mult': 2.6362025944996255, 'bear_tsl_mult': 0.7413884662372838, 'bear_time_stop': 150, 'bear_use_sma': False, 'bear_use_ema': True, 'bear_use_atr': False, 'bear_use_adx': False, 'bear_use_spike': True, 'bear_rsi_required': False, 'sideways_strategy': 'mean_reversion', 'sideways_bb_std_mult': 1.7188035604906424, 'sideways_rsi_os': 12, 'sideways_rsi_ob': 53, 'sideways_adx_thresh': 26.597278726526433, 'sideways_atr_min_pct': 0.02719573751478907, 'sideways_atr_max_pct': 0.059350523942196295, 'sideways_tp_mult': 1.294216171728628, 'sideways_tsl_mult': 0.4235522129819454, 'sideways_time_stop': 83, 'sideways_use_sma': True, 'sideways_use_ema': False, 'sideways_use_atr': True, 'sideways_use_adx': False, 'sideways_use_spike': True, 'sideways_rsi_required': True}.
