[I 2025-08-31 11:23:51,630] Trial 216 finished with values: [-0.373107174439962, 0.37292977235974245] and parameters: {'p_sma': 44, 'p_std': 20, 'p_atr': 12, 'p_adx': 20, 'rsi_period': 30, 'ema1': 13, 'ema2': 39, 'slip_atr_k': 0.22306307259774216, 'slip_spread_k': 0.196913007727203, 'spread_hl_frac': 0.04669137922023829, 'bb_std_mult': 2.6712296135299995, 'rsi_os': 38, 'rsi_ob': 82, 'vol_spike': 0.19488015022421706, 'adx_thresh': 16.075400136580605, 'atr_min_pct': 0.0031279869606960003, 'atr_max_pct': 0.09202568556818559, 'tp_mult': 1.010843515322037, 'tsl_mult': 0.08111464638754315, 'strategy': 'breakout', 'time_stop': 5, 'use_sma': True, 'use_atr': True, 'use_adx': True, 'use_ema': False, 'use_spike': False, 'rsi_required': True, 'edge_k': 1.0877810715271354, 'edge_cap': 0.9196062426227773, 'bull_strategy': 'breakout', 'bull_bb_std_mult': 0.5503883339589436, 'bull_rsi_os': 22, 'bull_rsi_ob': 61, 'bull_adx_thresh': 10.83379733261313, 'bull_atr_min_pct': 0.019195363692163278, 'bull_atr_max_pct': 0.13706093857956805, 'bull_tp_mult': 1.4404877865071524, 'bull_tsl_mult': 0.966646816203411, 'bull_time_stop': 197, 'bull_use_sma': False, 'bull_use_ema': False, 'bull_use_atr': True, 'bull_use_adx': True, 'bull_use_spike': True, 'bull_rsi_required': True, 'bear_strategy': 'breakout', 'bear_bb_std_mult': 1.3351790046571892, 'bear_rsi_os': 16, 'bear_rsi_ob': 68, 'bear_adx_thresh': 33.31350584521879, 'bear_atr_min_pct': 0.011371542380672561, 'bear_atr_max_pct': 0.10605277437757427, 'bear_tp_mult': 2.90872172106127, 'bear_tsl_mult': 0.4088135534068852, 'bear_time_stop': 6, 'bear_use_sma': True, 'bear_use_ema': False, 'bear_use_atr': False, 'bear_use_adx': False, 'bear_use_spike': True, 'bear_rsi_required': False, 'sideways_strategy': 'breakout', 'sideways_bb_std_mult': 1.093527860356781, 'sideways_rsi_os': 47, 'sideways_rsi_ob': 88, 'sideways_adx_thresh': 7.371959590963452, 'sideways_atr_min_pct': 0.001197088922379897, 'sideways_atr_max_pct': 0.01656601780794453, 'sideways_tp_mult': 1.0193291352071525, 'sideways_tsl_mult': 0.7674940837141797, 'sideways_time_stop': 190, 'sideways_use_sma': False, 'sideways_use_ema': False, 'sideways_use_atr': False, 'sideways_use_adx': True, 'sideways_use_spike': False, 'sideways_rsi_required': True}.
[I 2025-08-31 11:24:23,018] Trial 218 finished with values: [-0.1424135123594047, 0.1422557760044226] and parameters: {'p_sma': 42, 'p_std': 19, 'p_atr': 26, 'p_adx': 19, 'rsi_period': 30, 'ema1': 24, 'ema2': 14, 'slip_atr_k': 0.061110124163972684, 'slip_spread_k': 0.1992395248591607, 'spread_hl_frac': 0.04390235450126997, 'bb_std_mult': 2.996352943948011, 'rsi_os': 42, 'rsi_ob': 82, 'vol_spike': 0.20461879426245824, 'adx_thresh': 7.499887452128842, 'atr_min_pct': 0.02220747643903769, 'atr_max_pct': 0.0811244551857312, 'tp_mult': 1.0990165812930706, 'tsl_mult': 0.03803289302517696, 'strategy': 'breakout', 'time_stop': 5, 'use_sma': False, 'use_atr': True, 'use_adx': False, 'use_ema': False, 'use_spike': False, 'rsi_required': True, 'edge_k': 1.1040840502199538, 'edge_cap': 0.587670271643132, 'bull_strategy': 'breakout', 'bull_bb_std_mult': 1.5369628886557307, 'bull_rsi_os': 22, 'bull_rsi_ob': 87, 'bull_adx_thresh': 9.824858951663241, 'bull_atr_min_pct': 0.017325639618312613, 'bull_atr_max_pct': 0.14733816325824545, 'bull_tp_mult': 2.7405999828695693, 'bull_tsl_mult': 0.959683745100993, 'bull_time_stop': 84, 'bull_use_sma': False, 'bull_use_ema': False, 'bull_use_atr': True, 'bull_use_adx': True, 'bull_use_spike': False, 'bull_rsi_required': True, 'bear_strategy': 'breakout', 'bear_bb_std_mult': 0.8293929631963083, 'bear_rsi_os': 16, 'bear_rsi_ob': 57, 'bear_adx_thresh': 33.171980289262464, 'bear_atr_min_pct': 0.010264547407390506, 'bear_atr_max_pct': 0.11274555560553876, 'bear_tp_mult': 2.5810356999667237, 'bear_tsl_mult': 0.37249432725021225, 'bear_time_stop': 293, 'bear_use_sma': True, 'bear_use_ema': False, 'bear_use_atr': True, 'bear_use_adx': False, 'bear_use_spike': True, 'bear_rsi_required': False, 'sideways_strategy': 'breakout', 'sideways_bb_std_mult': 1.0442632024416734, 'sideways_rsi_os': 48, 'sideways_rsi_ob': 67, 'sideways_adx_thresh': 7.298917524016896, 'sideways_atr_min_pct': 0.0018597123761464563, 'sideways_atr_max_pct': 0.016331419689966743, 'sideways_tp_mult': 1.01155614531201, 'sideways_tsl_mult': 0.2850376166680452, 'sideways_time_stop': 218, 'sideways_use_sma': False, 'sideways_use_ema': False, 'sideways_use_atr': False, 'sideways_use_adx': True, 'sideways_use_spike': False, 'sideways_rsi_required': False}.
[I 2025-08-31 11:24:23,330] Trial 217 finished with values: [-0.027830746546934626, 0.027841656454101728] and parameters: {'p_sma': 8, 'p_std': 13, 'p_atr': 26, 'p_adx': 12, 'rsi_period': 57, 'ema1': 15, 'ema2': 39, 'slip_atr_k': 0.22455380045858053, 'slip_spread_k': 0.6258637622723341, 'spread_hl_frac': 0.047924140604984115, 'bb_std_mult': 2.4530245290671044, 'rsi_os': 14, 'rsi_ob': 82, 'vol_spike': 0.13453174001873244, 'adx_thresh': 16.954440955145763, 'atr_min_pct': 0.023307352473853803, 'atr_max_pct': 0.11885422167807322, 'tp_mult': 1.1046633156615187, 'tsl_mult': 0.8719438025426676, 'strategy': 'breakout', 'time_stop': 11, 'use_sma': False, 'use_atr': True, 'use_adx': False, 'use_ema': False, 'use_spike': False, 'rsi_required': True, 'edge_k': 1.0929847657151357, 'edge_cap': 0.9539698693815888, 'bull_strategy': 'breakout', 'bull_bb_std_mult': 0.5385842401631603, 'bull_rsi_os': 22, 'bull_rsi_ob': 73, 'bull_adx_thresh': 9.827384587953542, 'bull_atr_min_pct': 0.018726343970282985, 'bull_atr_max_pct': 0.13834868458552627, 'bull_tp_mult': 2.4720626194865774, 'bull_tsl_mult': 0.3181565940299875, 'bull_time_stop': 110, 'bull_use_sma': False, 'bull_use_ema': False, 'bull_use_atr': True, 'bull_use_adx': True, 'bull_use_spike': False, 'bull_rsi_required': True, 'bear_strategy': 'breakout', 'bear_bb_std_mult': 2.556466504516082, 'bear_rsi_os': 16, 'bear_rsi_ob': 56, 'bear_adx_thresh': 34.562272095906835, 'bear_atr_min_pct': 0.010061622579426364, 'bear_atr_max_pct': 0.11277778769871874, 'bear_tp_mult': 2.933851956641755, 'bear_tsl_mult': 0.4021216582248919, 'bear_time_stop': 15, 'bear_use_sma': True, 'bear_use_ema': False, 'bear_use_atr': True, 'bear_use_adx': False, 'bear_use_spike': True, 'bear_rsi_required': False, 'sideways_strategy': 'breakout', 'sideways_bb_std_mult': 2.3534615117873456, 'sideways_rsi_os': 39, 'sideways_rsi_ob': 68, 'sideways_adx_thresh': 25.539074622998633, 'sideways_atr_min_pct': 0.0019050274532374217, 'sideways_atr_max_pct': 0.01696939245304376, 'sideways_tp_mult': 1.0543193609915846, 'sideways_tsl_mult': 0.7590025846000762, 'sideways_time_stop': 30, 'sideways_use_sma': False, 'sideways_use_ema': False, 'sideways_use_atr': False, 'sideways_use_adx': True, 'sideways_use_spike': False, 'sideways_rsi_required': False}.
[I 2025-08-31 11:24:23,597] Trial 220 finished with values: [-1000000000.0, 1000000000.0] and parameters: {'p_sma': 42, 'p_std': 18, 'p_atr': 19, 'p_adx': 24, 'rsi_period': 57, 'ema1': 16, 'ema2': 14, 'slip_atr_k': 0.029427395857495153, 'slip_spread_k': 0.615399661315971, 'spread_hl_frac': 0.043867601125170415, 'bb_std_mult': 2.4437127483068637, 'rsi_os': 9, 'rsi_ob': 56, 'vol_spike': 0.13956036206145528, 'adx_thresh': 34.99478113995481, 'atr_min_pct': 0.007126299920905913, 'atr_max_pct': 0.031015042111112362, 'tp_mult': 1.0955406452984855, 'tsl_mult': 0.8743859201091431, 'strategy': 'breakout', 'time_stop': 291, 'use_sma': False, 'use_atr': True, 'use_adx': False, 'use_ema': False, 'use_spike': True, 'rsi_required': True, 'edge_k': 0.4863951322588729, 'edge_cap': 0.8862007621033468, 'bull_strategy': 'breakout', 'bull_bb_std_mult': 1.076913403403024, 'bull_rsi_os': 22, 'bull_rsi_ob': 58, 'bull_adx_thresh': 15.829979006942278, 'bull_atr_min_pct': 0.00860285525448479, 'bull_atr_max_pct': 0.1468418104158468, 'bull_tp_mult': 2.7204862285433955, 'bull_tsl_mult': 0.5150793266711782, 'bull_time_stop': 13, 'bull_use_sma': False, 'bull_use_ema': True, 'bull_use_atr': True, 'bull_use_adx': True, 'bull_use_spike': False, 'bull_rsi_required': True, 'bear_strategy': 'breakout', 'bear_bb_std_mult': 3.2140982404122225, 'bear_rsi_os': 16, 'bear_rsi_ob': 57, 'bear_adx_thresh': 32.255562325305156, 'bear_atr_min_pct': 0.01043680084847719, 'bear_atr_max_pct': 0.1130345464408658, 'bear_tp_mult': 2.761738356505549, 'bear_tsl_mult': 0.3731069039985407, 'bear_time_stop': 67, 'bear_use_sma': False, 'bear_use_ema': True, 'bear_use_atr': True, 'bear_use_adx': False, 'bear_use_spike': True, 'bear_rsi_required': False, 'sideways_strategy': 'breakout', 'sideways_bb_std_mult': 2.006592961663607, 'sideways_rsi_os': 45, 'sideways_rsi_ob': 67, 'sideways_adx_thresh': 8.42316624905912, 'sideways_atr_min_pct': 0.02033981921510869, 'sideways_atr_max_pct': 0.014256624199257276, 'sideways_tp_mult': 2.521985674527238, 'sideways_tsl_mult': 0.2526305605842159, 'sideways_time_stop': 36, 'sideways_use_sma': False, 'sideways_use_ema': False, 'sideways_use_atr': False, 'sideways_use_adx': True, 'sideways_use_spike': False, 'sideways_rsi_required': False}.
[I 2025-08-31 11:24:23,819] Trial 219 finished with values: [-0.07495298613250545, 0.07461918914916323] and parameters: {'p_sma': 7, 'p_std': 13, 'p_atr': 19, 'p_adx': 11, 'rsi_period': 51, 'ema1': 15, 'ema2': 39, 'slip_atr_k': 0.030999413423290427, 'slip_spread_k': 0.6486842153703403, 'spread_hl_frac': 0.047811712062523125, 'bb_std_mult': 2.9789415805511488, 'rsi_os': 8, 'rsi_ob': 81, 'vol_spike': 0.14513013151267848, 'adx_thresh': 16.650131756550202, 'atr_min_pct': 0.002902909812499829, 'atr_max_pct': 0.03005808605566035, 'tp_mult': 1.0774653797244615, 'tsl_mult': 0.8709530233981246, 'strategy': 'breakout', 'time_stop': 116, 'use_sma': False, 'use_atr': True, 'use_adx': False, 'use_ema': False, 'use_spike': False, 'rsi_required': True, 'edge_k': 1.4882851986779055, 'edge_cap': 0.9566481732195656, 'bull_strategy': 'breakout', 'bull_bb_std_mult': 1.8986209526552715, 'bull_rsi_os': 22, 'bull_rsi_ob': 74, 'bull_adx_thresh': 34.99219539826657, 'bull_atr_min_pct': 0.002908841874766111, 'bull_atr_max_pct': 0.1473825255895974, 'bull_tp_mult': 2.2341186270546824, 'bull_tsl_mult': 0.2857177956686461, 'bull_time_stop': 147, 'bull_use_sma': False, 'bull_use_ema': True, 'bull_use_atr': True, 'bull_use_adx': True, 'bull_use_spike': False, 'bull_rsi_required': True, 'bear_strategy': 'breakout', 'bear_bb_std_mult': 1.0687469860434082, 'bear_rsi_os': 16, 'bear_rsi_ob': 57, 'bear_adx_thresh': 8.207882317122372, 'bear_atr_min_pct': 0.011258674540782426, 'bear_atr_max_pct': 0.10515063061857481, 'bear_tp_mult': 2.846853462069487, 'bear_tsl_mult': 0.5837302668146706, 'bear_time_stop': 67, 'bear_use_sma': True, 'bear_use_ema': False, 'bear_use_atr': True, 'bear_use_adx': False, 'bear_use_spike': True, 'bear_rsi_required': False, 'sideways_strategy': 'breakout', 'sideways_bb_std_mult': 2.3528068875263006, 'sideways_rsi_os': 48, 'sideways_rsi_ob': 68, 'sideways_adx_thresh': 8.921662660399862, 'sideways_atr_min_pct': 0.0019341843210030597, 'sideways_atr_max_pct': 0.017449441005693494, 'sideways_tp_mult': 2.2604644583831677, 'sideways_tsl_mult': 0.5723086463445866, 'sideways_time_stop': 37, 'sideways_use_sma': False, 'sideways_use_ema': False, 'sideways_use_atr': False, 'sideways_use_adx': True, 'sideways_use_spike': False, 'sideways_rsi_required': False}.
[I 2025-08-31 11:24:55,782] Trial 223 finished with values: [-0.006171713249278565, 0.008910933480782677] and parameters: {'p_sma': 30, 'p_std': 16, 'p_atr': 14, 'p_adx': 26, 'rsi_period': 51, 'ema1': 12, 'ema2': 36, 'slip_atr_k': 0.046152092927533486, 'slip_spread_k': 0.10337873092360417, 'spread_hl_frac': 0.0009967724685887476, 'bb_std_mult': 0.7387775518601292, 'rsi_os': 34, 'rsi_ob': 71, 'vol_spike': 0.14604312783408813, 'adx_thresh': 25.641706166915498, 'atr_min_pct': 0.004421202615623536, 'atr_max_pct': 0.022630974977475883, 'tp_mult': 1.0646288816481098, 'tsl_mult': 0.2899790096821524, 'strategy': 'breakout', 'time_stop': 300, 'use_sma': False, 'use_atr': True, 'use_adx': True, 'use_ema': False, 'use_spike': True, 'rsi_required': True, 'edge_k': 0.3800407931148455, 'edge_cap': 0.8430284278694695, 'bull_strategy': 'breakout', 'bull_bb_std_mult': 2.583301770002521, 'bull_rsi_os': 23, 'bull_rsi_ob': 63, 'bull_adx_thresh': 14.330495122602443, 'bull_atr_min_pct': 0.00492814471281758, 'bull_atr_max_pct': 0.14272444708543505, 'bull_tp_mult': 1.4996246810784049, 'bull_tsl_mult': 0.28624495223900825, 'bull_time_stop': 146, 'bull_use_sma': True, 'bull_use_ema': True, 'bull_use_atr': True, 'bull_use_adx': True, 'bull_use_spike': False, 'bull_rsi_required': True, 'bear_strategy': 'breakout', 'bear_bb_std_mult': 1.0689428488563322, 'bear_rsi_os': 32, 'bear_rsi_ob': 54, 'bear_adx_thresh': 31.890234399461566, 'bear_atr_min_pct': 0.015159202282978578, 'bear_atr_max_pct': 0.11659364536587274, 'bear_tp_mult': 2.6605538100797936, 'bear_tsl_mult': 0.36059729705539484, 'bear_time_stop': 189, 'bear_use_sma': False, 'bear_use_ema': True, 'bear_use_atr': True, 'bear_use_adx': False, 'bear_use_spike': True, 'bear_rsi_required': False, 'sideways_strategy': 'breakout', 'sideways_bb_std_mult': 1.7778813553778723, 'sideways_rsi_os': 32, 'sideways_rsi_ob': 73, 'sideways_adx_thresh': 8.824882628020415, 'sideways_atr_min_pct': 0.002928037403865052, 'sideways_atr_max_pct': 0.04490251709889704, 'sideways_tp_mult': 1.3730887945582433, 'sideways_tsl_mult': 0.33642561370570373, 'sideways_time_stop': 11, 'sideways_use_sma': True, 'sideways_use_ema': False, 'sideways_use_atr': True, 'sideways_use_adx': True, 'sideways_use_spike': False, 'sideways_rsi_required': True}.
[I 2025-08-31 11:24:56,378] Trial 224 finished with values: [-1000000000.0, 1000000000.0] and parameters: {'p_sma': 29, 'p_std': 59, 'p_atr': 13, 'p_adx': 21, 'rsi_period': 54, 'ema1': 25, 'ema2': 58, 'slip_atr_k': 0.045996732665211426, 'slip_spread_k': 0.6344023737224036, 'spread_hl_frac': 0.04544398502488122, 'bb_std_mult': 1.9457148919470366, 'rsi_os': 14, 'rsi_ob': 83, 'vol_spike': 0.20973054858541212, 'adx_thresh': 32.092376128028754, 'atr_min_pct': 0.023258767562182564, 'atr_max_pct': 0.07438254054726273, 'tp_mult': 1.0109165856051423, 'tsl_mult': 0.22656687895740213, 'strategy': 'breakout', 'time_stop': 295, 'use_sma': False, 'use_atr': True, 'use_adx': True, 'use_ema': False, 'use_spike': False, 'rsi_required': True, 'edge_k': 0.3581330727087498, 'edge_cap': 0.41502480598264135, 'bull_strategy': 'breakout', 'bull_bb_std_mult': 2.546620236665175, 'bull_rsi_os': 37, 'bull_rsi_ob': 60, 'bull_adx_thresh': 10.258862886127227, 'bull_atr_min_pct': 0.018569806249301112, 'bull_atr_max_pct': 0.14290296270210703, 'bull_tp_mult': 1.6121349000386216, 'bull_tsl_mult': 0.9176186065977107, 'bull_time_stop': 59, 'bull_use_sma': True, 'bull_use_ema': False, 'bull_use_atr': True, 'bull_use_adx': True, 'bull_use_spike': False, 'bull_rsi_required': True, 'bear_strategy': 'breakout', 'bear_bb_std_mult': 0.9020798842697642, 'bear_rsi_os': 18, 'bear_rsi_ob': 55, 'bear_adx_thresh': 28.752035496961163, 'bear_atr_min_pct': 0.01511955059581381, 'bear_atr_max_pct': 0.11616574057293978, 'bear_tp_mult': 2.4801571777023512, 'bear_tsl_mult': 0.3524618147720671, 'bear_time_stop': 77, 'bear_use_sma': True, 'bear_use_ema': False, 'bear_use_atr': True, 'bear_use_adx': False, 'bear_use_spike': True, 'bear_rsi_required': False, 'sideways_strategy': 'breakout', 'sideways_bb_std_mult': 0.9724447077829562, 'sideways_rsi_os': 32, 'sideways_rsi_ob': 70, 'sideways_adx_thresh': 8.21182492800324, 'sideways_atr_min_pct': 0.010347351426406172, 'sideways_atr_max_pct': 0.014998597626438716, 'sideways_tp_mult': 2.1890132819635912, 'sideways_tsl_mult': 0.7237894667027504, 'sideways_time_stop': 30, 'sideways_use_sma': True, 'sideways_use_ema': False, 'sideways_use_atr': False, 'sideways_use_adx': True, 'sideways_use_spike': False, 'sideways_rsi_required': True}.
[I 2025-08-31 11:24:56,508] Trial 221 finished with values: [-1000000000.0, 1000000000.0] and parameters: {'p_sma': 37, 'p_std': 13, 'p_atr': 13, 'p_adx': 24, 'rsi_period': 84, 'ema1': 15, 'ema2': 43, 'slip_atr_k': 0.03346808950859133, 'slip_spread_k': 0.6262094505440821, 'spread_hl_frac': 0.04788714516099629, 'bb_std_mult': 2.00538836820576, 'rsi_os': 16, 'rsi_ob': 83, 'vol_spike': 0.23540682522355727, 'adx_thresh': 32.019612159776536, 'atr_min_pct': 0.009787732832914347, 'atr_max_pct': 0.07626971908621297, 'tp_mult': 1.087508461641047, 'tsl_mult': 0.8659008840651573, 'strategy': 'breakout', 'time_stop': 291, 'use_sma': False, 'use_atr': True, 'use_adx': False, 'use_ema': False, 'use_spike': True, 'rsi_required': True, 'edge_k': 0.2242258760123856, 'edge_cap': 0.4132130795488608, 'bull_strategy': 'breakout', 'bull_bb_std_mult': 1.128234638414668, 'bull_rsi_os': 23, 'bull_rsi_ob': 63, 'bull_adx_thresh': 15.667600302041336, 'bull_atr_min_pct': 0.005924286038045493, 'bull_atr_max_pct': 0.1472738016343694, 'bull_tp_mult': 2.2381481827808876, 'bull_tsl_mult': 0.2933164018136749, 'bull_time_stop': 205, 'bull_use_sma': True, 'bull_use_ema': True, 'bull_use_atr': True, 'bull_use_adx': True, 'bull_use_spike': False, 'bull_rsi_required': True, 'bear_strategy': 'breakout', 'bear_bb_std_mult': 2.2352686395942376, 'bear_rsi_os': 16, 'bear_rsi_ob': 55, 'bear_adx_thresh': 31.981479075210167, 'bear_atr_min_pct': 0.017691184599820053, 'bear_atr_max_pct': 0.11626178821031248, 'bear_tp_mult': 2.6550517501326265, 'bear_tsl_mult': 0.35280950252015164, 'bear_time_stop': 279, 'bear_use_sma': False, 'bear_use_ema': True, 'bear_use_atr': True, 'bear_use_adx': False, 'bear_use_spike': True, 'bear_rsi_required': False, 'sideways_strategy': 'breakout', 'sideways_bb_std_mult': 2.382824382361198, 'sideways_rsi_os': 32, 'sideways_rsi_ob': 70, 'sideways_adx_thresh': 8.58591814408086, 'sideways_atr_min_pct': 0.023148499371241298, 'sideways_atr_max_pct': 0.1172587893423016, 'sideways_tp_mult': 2.181153176372568, 'sideways_tsl_mult': 0.32468485983992135, 'sideways_time_stop': 36, 'sideways_use_sma': True, 'sideways_use_ema': False, 'sideways_use_atr': False, 'sideways_use_adx': True, 'sideways_use_spike': False, 'sideways_rsi_required': False}.
[I 2025-08-31 11:24:56,764] Trial 222 finished with values: [-1000000000.0, 1000000000.0] and parameters: {'p_sma': 60, 'p_std': 59, 'p_atr': 19, 'p_adx': 21, 'rsi_period': 35, 'ema1': 16, 'ema2': 16, 'slip_atr_k': 0.031247420406211174, 'slip_spread_k': 0.713984998200331, 'spread_hl_frac': 0.02797107277656719, 'bb_std_mult': 2.3834223779924812, 'rsi_os': 17, 'rsi_ob': 71, 'vol_spike': 0.1406350744539658, 'adx_thresh': 32.14255625290782, 'atr_min_pct': 0.00176944050370682, 'atr_max_pct': 0.031505327230452344, 'tp_mult': 1.0701961957325652, 'tsl_mult': 0.021288966640128554, 'strategy': 'breakout', 'time_stop': 292, 'use_sma': False, 'use_atr': True, 'use_adx': True, 'use_ema': False, 'use_spike': True, 'rsi_required': True, 'edge_k': 0.3896720911811822, 'edge_cap': 0.4138554245212197, 'bull_strategy': 'breakout', 'bull_bb_std_mult': 1.0896815468124, 'bull_rsi_os': 23, 'bull_rsi_ob': 58, 'bull_adx_thresh': 10.359177174979381, 'bull_atr_min_pct': 0.006109099558007947, 'bull_atr_max_pct': 0.14305082603096206, 'bull_tp_mult': 2.9391440105937923, 'bull_tsl_mult': 0.28897414005607003, 'bull_time_stop': 12, 'bull_use_sma': True, 'bull_use_ema': True, 'bull_use_atr': True, 'bull_use_adx': True, 'bull_use_spike': False, 'bull_rsi_required': True, 'bear_strategy': 'breakout', 'bear_bb_std_mult': 3.2087234659648507, 'bear_rsi_os': 18, 'bear_rsi_ob': 55, 'bear_adx_thresh': 28.622660390602256, 'bear_atr_min_pct': 0.01749254871575507, 'bear_atr_max_pct': 0.11703978029674547, 'bear_tp_mult': 1.2445913333858947, 'bear_tsl_mult': 0.3563481063251588, 'bear_time_stop': 65, 'bear_use_sma': False, 'bear_use_ema': True, 'bear_use_atr': True, 'bear_use_adx': False, 'bear_use_spike': True, 'bear_rsi_required': False, 'sideways_strategy': 'breakout', 'sideways_bb_std_mult': 1.1383107890033726, 'sideways_rsi_os': 10, 'sideways_rsi_ob': 73, 'sideways_adx_thresh': 8.334935553860584, 'sideways_atr_min_pct': 0.0031278457015825297, 'sideways_atr_max_pct': 0.012536724868383045, 'sideways_tp_mult': 2.2710547338655966, 'sideways_tsl_mult': 0.7192311876528039, 'sideways_time_stop': 138, 'sideways_use_sma': True, 'sideways_use_ema': False, 'sideways_use_atr': False, 'sideways_use_adx': True, 'sideways_use_spike': False, 'sideways_rsi_required': True}.
