[I 2025-08-31 11:16:57,479] Trial 164 finished with values: [-1000000000.0, 1000000000.0] and parameters: {'p_sma': 53, 'p_std': 5, 'p_atr': 14, 'p_adx': 21, 'rsi_period': 51, 'ema1': 25, 'ema2': 15, 'slip_atr_k': 0.2044887249752792, 'slip_spread_k': 0.6755290004508163, 'spread_hl_frac': 0.04310795396645804, 'bb_std_mult': 2.4786727865763605, 'rsi_os': 51, 'rsi_ob': 84, 'vol_spike': 0.17035066407611493, 'adx_thresh': 30.92613251882727, 'atr_min_pct': 0.00759309170392179, 'atr_max_pct': 0.08860126134431334, 'tp_mult': 1.0627256000790017, 'tsl_mult': 0.03173888860907395, 'strategy': 'mean_reversion', 'time_stop': 294, 'use_sma': False, 'use_atr': True, 'use_adx': False, 'use_ema': False, 'use_spike': True, 'rsi_required': True, 'edge_k': 0.5307599794180422, 'edge_cap': 0.8436389200669321, 'bull_strategy': 'breakout', 'bull_bb_std_mult': 1.0515342039028264, 'bull_rsi_os': 24, 'bull_rsi_ob': 58, 'bull_adx_thresh': 23.502784645965654, 'bull_atr_min_pct': 0.025148469037432557, 'bull_atr_max_pct': 0.13770963866208433, 'bull_tp_mult': 1.448521246119335, 'bull_tsl_mult': 0.3148036520809698, 'bull_time_stop': 20, 'bull_use_sma': True, 'bull_use_ema': False, 'bull_use_atr': True, 'bull_use_adx': True, 'bull_use_spike': False, 'bull_rsi_required': True, 'bear_strategy': 'mean_reversion', 'bear_bb_std_mult': 2.8527568978690256, 'bear_rsi_os': 16, 'bear_rsi_ob': 51, 'bear_adx_thresh': 27.288562924242136, 'bear_atr_min_pct': 0.016024093427436808, 'bear_atr_max_pct': 0.11477020960158703, 'bear_tp_mult': 1.84036431382601, 'bear_tsl_mult': 0.38268613217007336, 'bear_time_stop': 262, 'bear_use_sma': True, 'bear_use_ema': True, 'bear_use_atr': True, 'bear_use_adx': False, 'bear_use_spike': True, 'bear_rsi_required': False, 'sideways_strategy': 'mean_reversion', 'sideways_bb_std_mult': 0.9903530549304859, 'sideways_rsi_os': 14, 'sideways_rsi_ob': 68, 'sideways_adx_thresh': 33.29672809532522, 'sideways_atr_min_pct': 0.02205755606992434, 'sideways_atr_max_pct': 0.13825885345869546, 'sideways_tp_mult': 2.1663971782487867, 'sideways_tsl_mult': 0.6770316140035795, 'sideways_time_stop': 291, 'sideways_use_sma': False, 'sideways_use_ema': False, 'sideways_use_atr': False, 'sideways_use_adx': True, 'sideways_use_spike': True, 'sideways_rsi_required': False}.
[I 2025-08-31 11:17:27,641] Trial 162 finished with values: [-1000000000.0, 1000000000.0] and parameters: {'p_sma': 45, 'p_std': 5, 'p_atr': 14, 'p_adx': 19, 'rsi_period': 39, 'ema1': 30, 'ema2': 15, 'slip_atr_k': 0.20083637913707997, 'slip_spread_k': 0.6028346463878708, 'spread_hl_frac': 0.03828158470769916, 'bb_std_mult': 2.479970125660629, 'rsi_os': 8, 'rsi_ob': 84, 'vol_spike': 0.18936375480040218, 'adx_thresh': 30.722723598002496, 'atr_min_pct': 0.007685557164930728, 'atr_max_pct': 0.0880451331145925, 'tp_mult': 1.0977742770072019, 'tsl_mult': 0.03520257670096368, 'strategy': 'breakout', 'time_stop': 292, 'use_sma': True, 'use_atr': True, 'use_adx': True, 'use_ema': False, 'use_spike': True, 'rsi_required': True, 'edge_k': 0.4151397050731046, 'edge_cap': 0.9111788798206695, 'bull_strategy': 'breakout', 'bull_bb_std_mult': 0.5059181410954009, 'bull_rsi_os': 25, 'bull_rsi_ob': 48, 'bull_adx_thresh': 24.4930824825688, 'bull_atr_min_pct': 0.00554751618794682, 'bull_atr_max_pct': 0.14783044668689765, 'bull_tp_mult': 1.5206392569100018, 'bull_tsl_mult': 0.31396746828284533, 'bull_time_stop': 300, 'bull_use_sma': True, 'bull_use_ema': False, 'bull_use_atr': True, 'bull_use_adx': True, 'bull_use_spike': False, 'bull_rsi_required': True, 'bear_strategy': 'breakout', 'bear_bb_std_mult': 1.134780607463954, 'bear_rsi_os': 15, 'bear_rsi_ob': 90, 'bear_adx_thresh': 26.989109050719925, 'bear_atr_min_pct': 0.01645812673768228, 'bear_atr_max_pct': 0.11957983050518134, 'bear_tp_mult': 1.074284126247791, 'bear_tsl_mult': 0.08771914935253611, 'bear_time_stop': 278, 'bear_use_sma': True, 'bear_use_ema': True, 'bear_use_atr': True, 'bear_use_adx': False, 'bear_use_spike': True, 'bear_rsi_required': False, 'sideways_strategy': 'breakout', 'sideways_bb_std_mult': 0.9923587666956628, 'sideways_rsi_os': 32, 'sideways_rsi_ob': 66, 'sideways_adx_thresh': 29.352886806734524, 'sideways_atr_min_pct': 0.015767511215856424, 'sideways_atr_max_pct': 0.01350868096010136, 'sideways_tp_mult': 2.374493516881849, 'sideways_tsl_mult': 0.7921481758390734, 'sideways_time_stop': 184, 'sideways_use_sma': False, 'sideways_use_ema': False, 'sideways_use_atr': False, 'sideways_use_adx': True, 'sideways_use_spike': False, 'sideways_rsi_required': True}.
[I 2025-08-31 11:17:28,449] Trial 165 finished with values: [-1000000000.0, 1000000000.0] and parameters: {'p_sma': 56, 'p_std': 12, 'p_atr': 10, 'p_adx': 21, 'rsi_period': 51, 'ema1': 28, 'ema2': 16, 'slip_atr_k': 0.20234490783362424, 'slip_spread_k': 0.6800667217305011, 'spread_hl_frac': 0.043379512101400286, 'bb_std_mult': 2.4872420057347386, 'rsi_os': 51, 'rsi_ob': 81, 'vol_spike': 0.27488576438915413, 'adx_thresh': 31.608115651565758, 'atr_min_pct': 0.006203982715452064, 'atr_max_pct': 0.051903719993763156, 'tp_mult': 2.892711141155292, 'tsl_mult': 0.1153399350839176, 'strategy': 'breakout', 'time_stop': 295, 'use_sma': False, 'use_atr': True, 'use_adx': False, 'use_ema': False, 'use_spike': True, 'rsi_required': True, 'edge_k': 0.5435246371255977, 'edge_cap': 0.3766245097761205, 'bull_strategy': 'breakout', 'bull_bb_std_mult': 1.0503219735518747, 'bull_rsi_os': 24, 'bull_rsi_ob': 58, 'bull_adx_thresh': 32.097091171758684, 'bull_atr_min_pct': 0.02510447599874978, 'bull_atr_max_pct': 0.1395353572645266, 'bull_tp_mult': 1.449015616688434, 'bull_tsl_mult': 0.31010912618846254, 'bull_time_stop': 288, 'bull_use_sma': True, 'bull_use_ema': False, 'bull_use_atr': True, 'bull_use_adx': True, 'bull_use_spike': False, 'bull_rsi_required': True, 'bear_strategy': 'breakout', 'bear_bb_std_mult': 2.9782271405547656, 'bear_rsi_os': 16, 'bear_rsi_ob': 76, 'bear_adx_thresh': 33.603003963729506, 'bear_atr_min_pct': 0.013583396243959423, 'bear_atr_max_pct': 0.1172061445696404, 'bear_tp_mult': 1.0778907313571904, 'bear_tsl_mult': 0.004408352990100228, 'bear_time_stop': 207, 'bear_use_sma': True, 'bear_use_ema': True, 'bear_use_atr': True, 'bear_use_adx': False, 'bear_use_spike': True, 'bear_rsi_required': False, 'sideways_strategy': 'mean_reversion', 'sideways_bb_std_mult': 0.9899912884447476, 'sideways_rsi_os': 33, 'sideways_rsi_ob': 70, 'sideways_adx_thresh': 10.063241406538857, 'sideways_atr_min_pct': 0.015924713492737937, 'sideways_atr_max_pct': 0.1341003529362949, 'sideways_tp_mult': 2.153356886066753, 'sideways_tsl_mult': 0.662890732969125, 'sideways_time_stop': 281, 'sideways_use_sma': False, 'sideways_use_ema': False, 'sideways_use_atr': False, 'sideways_use_adx': True, 'sideways_use_spike': True, 'sideways_rsi_required': False}.
[I 2025-08-31 11:17:28,818] Trial 163 finished with values: [-1000000000.0, 1000000000.0] and parameters: {'p_sma': 54, 'p_std': 5, 'p_atr': 14, 'p_adx': 21, 'rsi_period': 51, 'ema1': 28, 'ema2': 15, 'slip_atr_k': 0.04547991950473781, 'slip_spread_k': 0.6856880099579157, 'spread_hl_frac': 0.043140229825567256, 'bb_std_mult': 2.489626232213053, 'rsi_os': 41, 'rsi_ob': 81, 'vol_spike': 0.28118207629756736, 'adx_thresh': 31.157654376929422, 'atr_min_pct': 0.006545194194039528, 'atr_max_pct': 0.08995707566588919, 'tp_mult': 2.44420750120833, 'tsl_mult': 0.7176576882871273, 'strategy': 'mean_reversion', 'time_stop': 294, 'use_sma': False, 'use_atr': True, 'use_adx': False, 'use_ema': False, 'use_spike': True, 'rsi_required': True, 'edge_k': 0.5385944660271594, 'edge_cap': 0.3932584908637301, 'bull_strategy': 'breakout', 'bull_bb_std_mult': 1.0832612108607533, 'bull_rsi_os': 24, 'bull_rsi_ob': 58, 'bull_adx_thresh': 19.618373874448345, 'bull_atr_min_pct': 0.025245135497342527, 'bull_atr_max_pct': 0.13870794548714366, 'bull_tp_mult': 1.5144128241860302, 'bull_tsl_mult': 0.3119091915870876, 'bull_time_stop': 263, 'bull_use_sma': True, 'bull_use_ema': False, 'bull_use_atr': True, 'bull_use_adx': True, 'bull_use_spike': False, 'bull_rsi_required': True, 'bear_strategy': 'mean_reversion', 'bear_bb_std_mult': 3.4348821129213567, 'bear_rsi_os': 16, 'bear_rsi_ob': 76, 'bear_adx_thresh': 27.295599052589722, 'bear_atr_min_pct': 0.01595993601539616, 'bear_atr_max_pct': 0.13188858485984395, 'bear_tp_mult': 1.8180279928332972, 'bear_tsl_mult': 0.5928218230388271, 'bear_time_stop': 260, 'bear_use_sma': True, 'bear_use_ema': True, 'bear_use_atr': True, 'bear_use_adx': False, 'bear_use_spike': True, 'bear_rsi_required': False, 'sideways_strategy': 'mean_reversion', 'sideways_bb_std_mult': 2.3596699760829734, 'sideways_rsi_os': 14, 'sideways_rsi_ob': 68, 'sideways_adx_thresh': 29.58568113290964, 'sideways_atr_min_pct': 0.02885455856452953, 'sideways_atr_max_pct': 0.10329496407036151, 'sideways_tp_mult': 2.1432382958465266, 'sideways_tsl_mult': 0.6744563556991547, 'sideways_time_stop': 277, 'sideways_use_sma': False, 'sideways_use_ema': False, 'sideways_use_atr': False, 'sideways_use_adx': True, 'sideways_use_spike': True, 'sideways_rsi_required': False}.
[I 2025-08-31 11:17:29,104] Trial 166 finished with values: [-1000000000.0, 1000000000.0] and parameters: {'p_sma': 45, 'p_std': 12, 'p_atr': 10, 'p_adx': 14, 'rsi_period': 53, 'ema1': 22, 'ema2': 56, 'slip_atr_k': 0.04522228244178628, 'slip_spread_k': 0.6655118588355047, 'spread_hl_frac': 0.047278882044921595, 'bb_std_mult': 2.95473267968414, 'rsi_os': 12, 'rsi_ob': 81, 'vol_spike': 0.28250229625030093, 'adx_thresh': 31.496544104722176, 'atr_min_pct': 0.0019479415014506004, 'atr_max_pct': 0.05461674125838292, 'tp_mult': 2.4434039010441695, 'tsl_mult': 0.3413408849358275, 'strategy': 'breakout', 'time_stop': 295, 'use_sma': False, 'use_atr': True, 'use_adx': True, 'use_ema': False, 'use_spike': True, 'rsi_required': True, 'edge_k': 1.9323921047359156, 'edge_cap': 0.9175811556121398, 'bull_strategy': 'breakout', 'bull_bb_std_mult': 1.2274466659901733, 'bull_rsi_os': 23, 'bull_rsi_ob': 60, 'bull_adx_thresh': 12.12507619277889, 'bull_atr_min_pct': 0.019803200500703194, 'bull_atr_max_pct': 0.09886029708733221, 'bull_tp_mult': 1.5072058024948285, 'bull_tsl_mult': 0.20948678931483805, 'bull_time_stop': 152, 'bull_use_sma': True, 'bull_use_ema': False, 'bull_use_atr': True, 'bull_use_adx': True, 'bull_use_spike': False, 'bull_rsi_required': False, 'bear_strategy': 'breakout', 'bear_bb_std_mult': 0.9754709958812801, 'bear_rsi_os': 15, 'bear_rsi_ob': 56, 'bear_adx_thresh': 33.345457634713654, 'bear_atr_min_pct': 0.0075975514226334145, 'bear_atr_max_pct': 0.1068530034661834, 'bear_tp_mult': 1.1219438093171243, 'bear_tsl_mult': 0.11533557180920911, 'bear_time_stop': 285, 'bear_use_sma': True, 'bear_use_ema': True, 'bear_use_atr': True, 'bear_use_adx': False, 'bear_use_spike': True, 'bear_rsi_required': False, 'sideways_strategy': 'breakout', 'sideways_bb_std_mult': 2.7878705882333223, 'sideways_rsi_os': 49, 'sideways_rsi_ob': 66, 'sideways_adx_thresh': 27.10597091482505, 'sideways_atr_min_pct': 0.019081095975986145, 'sideways_atr_max_pct': 0.013366558705778811, 'sideways_tp_mult': 2.450176059739627, 'sideways_tsl_mult': 0.7229324107788936, 'sideways_time_stop': 27, 'sideways_use_sma': False, 'sideways_use_ema': False, 'sideways_use_atr': False, 'sideways_use_adx': True, 'sideways_use_spike': False, 'sideways_rsi_required': True}.
[I 2025-08-31 11:17:59,056] Trial 168 finished with values: [-0.04677194281486008, 0.04650454698037975] and parameters: {'p_sma': 42, 'p_std': 10, 'p_atr': 15, 'p_adx': 14, 'rsi_period': 32, 'ema1': 26, 'ema2': 14, 'slip_atr_k': 0.03782148400613727, 'slip_spread_k': 0.5155810681805022, 'spread_hl_frac': 0.04120159035375028, 'bb_std_mult': 3.3879722110575465, 'rsi_os': 40, 'rsi_ob': 76, 'vol_spike': 0.15752135429085856, 'adx_thresh': 33.18317834161869, 'atr_min_pct': 0.001772446855053782, 'atr_max_pct': 0.08357366736899573, 'tp_mult': 2.7346221551713574, 'tsl_mult': 0.29696831560408055, 'strategy': 'breakout', 'time_stop': 278, 'use_sma': False, 'use_atr': True, 'use_adx': True, 'use_ema': False, 'use_spike': False, 'rsi_required': True, 'edge_k': 0.32523563232414066, 'edge_cap': 0.13472132506818196, 'bull_strategy': 'breakout', 'bull_bb_std_mult': 1.1791471388317034, 'bull_rsi_os': 23, 'bull_rsi_ob': 60, 'bull_adx_thresh': 28.94560579373036, 'bull_atr_min_pct': 0.0018460985097663116, 'bull_atr_max_pct': 0.11587575412687726, 'bull_tp_mult': 1.6189391891599896, 'bull_tsl_mult': 0.5687412498081761, 'bull_time_stop': 150, 'bull_use_sma': True, 'bull_use_ema': True, 'bull_use_atr': True, 'bull_use_adx': True, 'bull_use_spike': False, 'bull_rsi_required': False, 'bear_strategy': 'breakout', 'bear_bb_std_mult': 2.9293024589186323, 'bear_rsi_os': 14, 'bear_rsi_ob': 56, 'bear_adx_thresh': 19.66868606287448, 'bear_atr_min_pct': 0.00740446678970226, 'bear_atr_max_pct': 0.10810380998658632, 'bear_tp_mult': 2.6377376458562316, 'bear_tsl_mult': 0.12424551151328445, 'bear_time_stop': 66, 'bear_use_sma': True, 'bear_use_ema': False, 'bear_use_atr': True, 'bear_use_adx': False, 'bear_use_spike': True, 'bear_rsi_required': False, 'sideways_strategy': 'breakout', 'sideways_bb_std_mult': 1.1371073434662937, 'sideways_rsi_os': 31, 'sideways_rsi_ob': 66, 'sideways_adx_thresh': 26.76481608362238, 'sideways_atr_min_pct': 0.028698221379944117, 'sideways_atr_max_pct': 0.10633390430646929, 'sideways_tp_mult': 2.261999193305876, 'sideways_tsl_mult': 0.8794068609791361, 'sideways_time_stop': 28, 'sideways_use_sma': False, 'sideways_use_ema': False, 'sideways_use_atr': False, 'sideways_use_adx': True, 'sideways_use_spike': False, 'sideways_rsi_required': True}.
[I 2025-08-31 11:17:59,302] Trial 170 finished with values: [-0.035432394777885734, 0.03516212859638724] and parameters: {'p_sma': 41, 'p_std': 20, 'p_atr': 15, 'p_adx': 10, 'rsi_period': 70, 'ema1': 26, 'ema2': 10, 'slip_atr_k': 0.03745567039857425, 'slip_spread_k': 0.2571132372807895, 'spread_hl_frac': 0.03464458999617896, 'bb_std_mult': 2.1438690903136886, 'rsi_os': 42, 'rsi_ob': 79, 'vol_spike': 0.1503587510371183, 'adx_thresh': 32.92818929722104, 'atr_min_pct': 0.021277507444750664, 'atr_max_pct': 0.08303090317624542, 'tp_mult': 2.749905993911242, 'tsl_mult': 0.0855009183089469, 'strategy': 'breakout', 'time_stop': 278, 'use_sma': False, 'use_atr': True, 'use_adx': True, 'use_ema': False, 'use_spike': False, 'rsi_required': True, 'edge_k': 1.8301899165351712, 'edge_cap': 0.0977155221436935, 'bull_strategy': 'breakout', 'bull_bb_std_mult': 0.9294877496085237, 'bull_rsi_os': 22, 'bull_rsi_ob': 60, 'bull_adx_thresh': 28.863336163311764, 'bull_atr_min_pct': 0.002159288890901301, 'bull_atr_max_pct': 0.11509990873857345, 'bull_tp_mult': 1.6289416374842323, 'bull_tsl_mult': 0.5651232267377457, 'bull_time_stop': 133, 'bull_use_sma': False, 'bull_use_ema': True, 'bull_use_atr': True, 'bull_use_adx': True, 'bull_use_spike': False, 'bull_rsi_required': False, 'bear_strategy': 'breakout', 'bear_bb_std_mult': 1.476372029431483, 'bear_rsi_os': 40, 'bear_rsi_ob': 54, 'bear_adx_thresh': 19.28866465562929, 'bear_atr_min_pct': 0.012035316554445168, 'bear_atr_max_pct': 0.11075348449916983, 'bear_tp_mult': 2.624172137292324, 'bear_tsl_mult': 0.3986686465046127, 'bear_time_stop': 68, 'bear_use_sma': True, 'bear_use_ema': False, 'bear_use_atr': True, 'bear_use_adx': False, 'bear_use_spike': True, 'bear_rsi_required': False, 'sideways_strategy': 'breakout', 'sideways_bb_std_mult': 2.4949249664298416, 'sideways_rsi_os': 35, 'sideways_rsi_ob': 71, 'sideways_adx_thresh': 28.7673025861486, 'sideways_atr_min_pct': 0.011542342191981244, 'sideways_atr_max_pct': 0.12536947829990863, 'sideways_tp_mult': 2.252236936986064, 'sideways_tsl_mult': 0.7509056113405642, 'sideways_time_stop': 6, 'sideways_use_sma': False, 'sideways_use_ema': False, 'sideways_use_atr': False, 'sideways_use_adx': True, 'sideways_use_spike': False, 'sideways_rsi_required': True}.
[I 2025-08-31 11:17:59,416] Trial 167 finished with values: [-1000000000.0, 1000000000.0] and parameters: {'p_sma': 56, 'p_std': 10, 'p_atr': 15, 'p_adx': 14, 'rsi_period': 76, 'ema1': 22, 'ema2': 16, 'slip_atr_k': 0.03754514216706854, 'slip_spread_k': 0.6634851271904381, 'spread_hl_frac': 0.04705589611831312, 'bb_std_mult': 3.433410495065158, 'rsi_os': 40, 'rsi_ob': 81, 'vol_spike': 0.284013368506166, 'adx_thresh': 33.1384433851442, 'atr_min_pct': 0.02117694745455645, 'atr_max_pct': 0.05318517690329077, 'tp_mult': 2.4603423864072846, 'tsl_mult': 0.1215648374587251, 'strategy': 'breakout', 'time_stop': 286, 'use_sma': False, 'use_atr': True, 'use_adx': False, 'use_ema': False, 'use_spike': False, 'rsi_required': True, 'edge_k': 1.9688294249806377, 'edge_cap': 0.06465082653459758, 'bull_strategy': 'breakout', 'bull_bb_std_mult': 0.9841324452614706, 'bull_rsi_os': 23, 'bull_rsi_ob': 60, 'bull_adx_thresh': 19.641281541040925, 'bull_atr_min_pct': 0.019649434277501134, 'bull_atr_max_pct': 0.11026184189227026, 'bull_tp_mult': 1.632771666042943, 'bull_tsl_mult': 0.6810860480004988, 'bull_time_stop': 152, 'bull_use_sma': True, 'bull_use_ema': False, 'bull_use_atr': True, 'bull_use_adx': True, 'bull_use_spike': False, 'bull_rsi_required': False, 'bear_strategy': 'breakout', 'bear_bb_std_mult': 3.4396561855542087, 'bear_rsi_os': 14, 'bear_rsi_ob': 56, 'bear_adx_thresh': 33.43473334838102, 'bear_atr_min_pct': 0.013634455925148512, 'bear_atr_max_pct': 0.11153087917770231, 'bear_tp_mult': 2.5530941508965403, 'bear_tsl_mult': 0.22941754520087232, 'bear_time_stop': 217, 'bear_use_sma': True, 'bear_use_ema': False, 'bear_use_atr': True, 'bear_use_adx': False, 'bear_use_spike': True, 'bear_rsi_required': False, 'sideways_strategy': 'breakout', 'sideways_bb_std_mult': 2.789560611191771, 'sideways_rsi_os': 9, 'sideways_rsi_ob': 70, 'sideways_adx_thresh': 25.867141062153053, 'sideways_atr_min_pct': 0.011169845381884369, 'sideways_atr_max_pct': 0.10528031543300584, 'sideways_tp_mult': 2.4558972433076396, 'sideways_tsl_mult': 0.8775249006249138, 'sideways_time_stop': 277, 'sideways_use_sma': False, 'sideways_use_ema': False, 'sideways_use_atr': False, 'sideways_use_adx': True, 'sideways_use_spike': False, 'sideways_rsi_required': False}.
[I 2025-08-31 11:17:59,579] Trial 169 finished with values: [-1000000000.0, 1000000000.0] and parameters: {'p_sma': 42, 'p_std': 22, 'p_atr': 15, 'p_adx': 11, 'rsi_period': 64, 'ema1': 24, 'ema2': 14, 'slip_atr_k': 0.21890626653590334, 'slip_spread_k': 0.5103005145334212, 'spread_hl_frac': 0.03566836569756422, 'bb_std_mult': 1.9791425444214699, 'rsi_os': 44, 'rsi_ob': 78, 'vol_spike': 0.14933611873600106, 'adx_thresh': 32.773340132138415, 'atr_min_pct': 0.02312831340161998, 'atr_max_pct': 0.06421097713921334, 'tp_mult': 1.0525012760438108, 'tsl_mult': 0.3423659559079115, 'strategy': 'breakout', 'time_stop': 244, 'use_sma': False, 'use_atr': True, 'use_adx': True, 'use_ema': False, 'use_spike': False, 'rsi_required': True, 'edge_k': 0.3342697869965299, 'edge_cap': 0.12809755555900493, 'bull_strategy': 'breakout', 'bull_bb_std_mult': 0.929014741737196, 'bull_rsi_os': 23, 'bull_rsi_ob': 60, 'bull_adx_thresh': 28.557552340734333, 'bull_atr_min_pct': 0.018727394736784846, 'bull_atr_max_pct': 0.1345661490860793, 'bull_tp_mult': 1.614406265687056, 'bull_tsl_mult': 0.3447947528993042, 'bull_time_stop': 154, 'bull_use_sma': False, 'bull_use_ema': True, 'bull_use_atr': True, 'bull_use_adx': True, 'bull_use_spike': False, 'bull_rsi_required': False, 'bear_strategy': 'breakout', 'bear_bb_std_mult': 2.6089679916711064, 'bear_rsi_os': 14, 'bear_rsi_ob': 56, 'bear_adx_thresh': 21.117196840572134, 'bear_atr_min_pct': 0.011696899827080678, 'bear_atr_max_pct': 0.12843422509224417, 'bear_tp_mult': 2.5573301375584467, 'bear_tsl_mult': 0.1113057784218432, 'bear_time_stop': 67, 'bear_use_sma': True, 'bear_use_ema': False, 'bear_use_atr': True, 'bear_use_adx': False, 'bear_use_spike': True, 'bear_rsi_required': False, 'sideways_strategy': 'breakout', 'sideways_bb_std_mult': 1.1193071074318033, 'sideways_rsi_os': 9, 'sideways_rsi_ob': 66, 'sideways_adx_thresh': 28.496205442233546, 'sideways_atr_min_pct': 0.0030876933079510864, 'sideways_atr_max_pct': 0.1248599598788099, 'sideways_tp_mult': 2.211903214153867, 'sideways_tsl_mult': 0.7002891712594722, 'sideways_time_stop': 28, 'sideways_use_sma': False, 'sideways_use_ema': False, 'sideways_use_atr': False, 'sideways_use_adx': True, 'sideways_use_spike': False, 'sideways_rsi_required': True}.
