[I 2025-08-31 11:15:54,290] Trial 150 finished with values: [-1000000000.0, 1000000000.0] and parameters: {'p_sma': 40, 'p_std': 39, 'p_atr': 15, 'p_adx': 22, 'rsi_period': 54, 'ema1': 15, 'ema2': 15, 'slip_atr_k': 0.042078075974556546, 'slip_spread_k': 0.6394960929750665, 'spread_hl_frac': 0.04589398389038302, 'bb_std_mult': 2.6190062708261435, 'rsi_os': 39, 'rsi_ob': 46, 'vol_spike': 0.25695130525088744, 'adx_thresh': 32.52239140210229, 'atr_min_pct': 0.0023863326562121477, 'atr_max_pct': 0.061143349664307484, 'tp_mult': 1.1983522078480782, 'tsl_mult': 0.07001098010711986, 'strategy': 'breakout', 'time_stop': 300, 'use_sma': False, 'use_atr': False, 'use_adx': True, 'use_ema': False, 'use_spike': False, 'rsi_required': True, 'edge_k': 0.36769499008964973, 'edge_cap': 0.889511673280685, 'bull_strategy': 'breakout', 'bull_bb_std_mult': 3.4905272203674125, 'bull_rsi_os': 20, 'bull_rsi_ob': 94, 'bull_adx_thresh': 10.789572234802899, 'bull_atr_min_pct': 0.0181739382850385, 'bull_atr_max_pct': 0.1432949248828991, 'bull_tp_mult': 1.562937352381511, 'bull_tsl_mult': 0.29326482549287214, 'bull_time_stop': 147, 'bull_use_sma': False, 'bull_use_ema': True, 'bull_use_atr': True, 'bull_use_adx': True, 'bull_use_spike': False, 'bull_rsi_required': True, 'bear_strategy': 'breakout', 'bear_bb_std_mult': 3.3014974848117675, 'bear_rsi_os': 16, 'bear_rsi_ob': 55, 'bear_adx_thresh': 33.38849417616973, 'bear_atr_min_pct': 0.0019129786731185675, 'bear_atr_max_pct': 0.13544609901039745, 'bear_tp_mult': 2.7256816333039584, 'bear_tsl_mult': 0.42177269359534497, 'bear_time_stop': 45, 'bear_use_sma': True, 'bear_use_ema': False, 'bear_use_atr': True, 'bear_use_adx': True, 'bear_use_spike': True, 'bear_rsi_required': False, 'sideways_strategy': 'breakout', 'sideways_bb_std_mult': 0.9895433776767153, 'sideways_rsi_os': 53, 'sideways_rsi_ob': 69, 'sideways_adx_thresh': 34.46694421505979, 'sideways_atr_min_pct': 0.007560250810102488, 'sideways_atr_max_pct': 0.01622320199795919, 'sideways_tp_mult': 2.1898796495975152, 'sideways_tsl_mult': 0.6399048144956688, 'sideways_time_stop': 209, 'sideways_use_sma': False, 'sideways_use_ema': True, 'sideways_use_atr': False, 'sideways_use_adx': False, 'sideways_use_spike': False, 'sideways_rsi_required': True}.
[I 2025-08-31 11:16:25,120] Trial 156 finished with values: [-1000000000.0, 1000000000.0] and parameters: {'p_sma': 43, 'p_std': 16, 'p_atr': 12, 'p_adx': 20, 'rsi_period': 54, 'ema1': 13, 'ema2': 14, 'slip_atr_k': 0.023842170754935672, 'slip_spread_k': 0.6422430684518441, 'spread_hl_frac': 0.04478666928100727, 'bb_std_mult': 2.063896475814327, 'rsi_os': 39, 'rsi_ob': 84, 'vol_spike': 0.23772665614697386, 'adx_thresh': 33.902227448188555, 'atr_min_pct': 0.004830873131198862, 'atr_max_pct': 0.07314219847090402, 'tp_mult': 1.0459858543442109, 'tsl_mult': 0.05684508497386402, 'strategy': 'breakout', 'time_stop': 283, 'use_sma': False, 'use_atr': True, 'use_adx': True, 'use_ema': False, 'use_spike': False, 'rsi_required': True, 'edge_k': 0.2955185117113244, 'edge_cap': 0.936592605569001, 'bull_strategy': 'breakout', 'bull_bb_std_mult': 1.2759757160973253, 'bull_rsi_os': 31, 'bull_rsi_ob': 54, 'bull_adx_thresh': 11.705601477096021, 'bull_atr_min_pct': 0.01927469891153717, 'bull_atr_max_pct': 0.1316424188085195, 'bull_tp_mult': 1.5884939981991173, 'bull_tsl_mult': 0.33328812147531145, 'bull_time_stop': 143, 'bull_use_sma': True, 'bull_use_ema': False, 'bull_use_atr': True, 'bull_use_adx': True, 'bull_use_spike': False, 'bull_rsi_required': False, 'bear_strategy': 'breakout', 'bear_bb_std_mult': 1.4036980650409099, 'bear_rsi_os': 51, 'bear_rsi_ob': 52, 'bear_adx_thresh': 31.93367549387047, 'bear_atr_min_pct': 0.012826564798128303, 'bear_atr_max_pct': 0.12951179344414082, 'bear_tp_mult': 1.1785774296811122, 'bear_tsl_mult': 0.3419832749060051, 'bear_time_stop': 73, 'bear_use_sma': True, 'bear_use_ema': False, 'bear_use_atr': True, 'bear_use_adx': False, 'bear_use_spike': True, 'bear_rsi_required': False, 'sideways_strategy': 'breakout', 'sideways_bb_std_mult': 0.7843318019550978, 'sideways_rsi_os': 31, 'sideways_rsi_ob': 72, 'sideways_adx_thresh': 8.832543753578413, 'sideways_atr_min_pct': 0.00386947961302872, 'sideways_atr_max_pct': 0.010077724653931506, 'sideways_tp_mult': 2.344810838429576, 'sideways_tsl_mult': 0.6785470669505614, 'sideways_time_stop': 14, 'sideways_use_sma': False, 'sideways_use_ema': False, 'sideways_use_atr': False, 'sideways_use_adx': True, 'sideways_use_spike': False, 'sideways_rsi_required': True}.
[I 2025-08-31 11:16:25,405] Trial 157 finished with values: [-1000000000.0, 1000000000.0] and parameters: {'p_sma': 49, 'p_std': 17, 'p_atr': 13, 'p_adx': 20, 'rsi_period': 79, 'ema1': 13, 'ema2': 11, 'slip_atr_k': 0.022660270317663832, 'slip_spread_k': 0.1982364253479048, 'spread_hl_frac': 0.044369962218366525, 'bb_std_mult': 3.239806268493753, 'rsi_os': 43, 'rsi_ob': 82, 'vol_spike': 0.23470767670135728, 'adx_thresh': 33.59696793795562, 'atr_min_pct': 0.004945811336916635, 'atr_max_pct': 0.07992464728807747, 'tp_mult': 2.9865983364856197, 'tsl_mult': 0.8249822421334431, 'strategy': 'breakout', 'time_stop': 282, 'use_sma': False, 'use_atr': True, 'use_adx': True, 'use_ema': False, 'use_spike': False, 'rsi_required': True, 'edge_k': 0.2873380404871684, 'edge_cap': 0.19763508861546347, 'bull_strategy': 'breakout', 'bull_bb_std_mult': 0.6630796308177831, 'bull_rsi_os': 32, 'bull_rsi_ob': 45, 'bull_adx_thresh': 12.868939776786185, 'bull_atr_min_pct': 0.019127216535918642, 'bull_atr_max_pct': 0.13156921093217577, 'bull_tp_mult': 2.820435958108363, 'bull_tsl_mult': 0.34085385351324193, 'bull_time_stop': 137, 'bull_use_sma': True, 'bull_use_ema': False, 'bull_use_atr': True, 'bull_use_adx': True, 'bull_use_spike': False, 'bull_rsi_required': False, 'bear_strategy': 'breakout', 'bear_bb_std_mult': 1.3844010565221323, 'bear_rsi_os': 18, 'bear_rsi_ob': 53, 'bear_adx_thresh': 32.15869207973272, 'bear_atr_min_pct': 0.01268452639094874, 'bear_atr_max_pct': 0.1463792187038579, 'bear_tp_mult': 2.8264714521412233, 'bear_tsl_mult': 0.3252755161699611, 'bear_time_stop': 74, 'bear_use_sma': True, 'bear_use_ema': False, 'bear_use_atr': True, 'bear_use_adx': False, 'bear_use_spike': True, 'bear_rsi_required': False, 'sideways_strategy': 'breakout', 'sideways_bb_std_mult': 1.0643345417139582, 'sideways_rsi_os': 32, 'sideways_rsi_ob': 71, 'sideways_adx_thresh': 8.963593703001848, 'sideways_atr_min_pct': 0.003992987981446843, 'sideways_atr_max_pct': 0.010325446302585129, 'sideways_tp_mult': 2.303581644059099, 'sideways_tsl_mult': 0.7515355966784533, 'sideways_time_stop': 15, 'sideways_use_sma': False, 'sideways_use_ema': False, 'sideways_use_atr': False, 'sideways_use_adx': True, 'sideways_use_spike': False, 'sideways_rsi_required': True}.
[I 2025-08-31 11:16:25,752] Trial 155 finished with values: [-1000000000.0, 1000000000.0] and parameters: {'p_sma': 43, 'p_std': 16, 'p_atr': 13, 'p_adx': 20, 'rsi_period': 56, 'ema1': 13, 'ema2': 11, 'slip_atr_k': 0.04283396767976807, 'slip_spread_k': 0.6367593653219196, 'spread_hl_frac': 0.04179140623143629, 'bb_std_mult': 2.32560833317205, 'rsi_os': 39, 'rsi_ob': 82, 'vol_spike': 0.2512585432732283, 'adx_thresh': 31.697581337085417, 'atr_min_pct': 0.0025615543624589337, 'atr_max_pct': 0.07415868971336248, 'tp_mult': 1.0432795799592838, 'tsl_mult': 0.05433590921432215, 'strategy': 'breakout', 'time_stop': 281, 'use_sma': False, 'use_atr': True, 'use_adx': True, 'use_ema': False, 'use_spike': False, 'rsi_required': True, 'edge_k': 1.611572886227171, 'edge_cap': 0.9378418276599372, 'bull_strategy': 'breakout', 'bull_bb_std_mult': 0.6900485179802587, 'bull_rsi_os': 32, 'bull_rsi_ob': 45, 'bull_adx_thresh': 10.53947176072248, 'bull_atr_min_pct': 0.01944029688277532, 'bull_atr_max_pct': 0.11806785930097469, 'bull_tp_mult': 1.5766323118226417, 'bull_tsl_mult': 0.27821879360171675, 'bull_time_stop': 140, 'bull_use_sma': True, 'bull_use_ema': False, 'bull_use_atr': True, 'bull_use_adx': True, 'bull_use_spike': False, 'bull_rsi_required': False, 'bear_strategy': 'breakout', 'bear_bb_std_mult': 1.3803211375145445, 'bear_rsi_os': 53, 'bear_rsi_ob': 53, 'bear_adx_thresh': 32.14574783460698, 'bear_atr_min_pct': 0.010615915403204309, 'bear_atr_max_pct': 0.1446466913130024, 'bear_tp_mult': 1.6175603081260848, 'bear_tsl_mult': 0.3802962228536514, 'bear_time_stop': 71, 'bear_use_sma': True, 'bear_use_ema': False, 'bear_use_atr': True, 'bear_use_adx': False, 'bear_use_spike': True, 'bear_rsi_required': False, 'sideways_strategy': 'breakout', 'sideways_bb_std_mult': 0.5053099153103864, 'sideways_rsi_os': 7, 'sideways_rsi_ob': 72, 'sideways_adx_thresh': 8.862010844991739, 'sideways_atr_min_pct': 0.0238020862341239, 'sideways_atr_max_pct': 0.010398323493463108, 'sideways_tp_mult': 2.3246505661522816, 'sideways_tsl_mult': 0.7024050877540041, 'sideways_time_stop': 15, 'sideways_use_sma': False, 'sideways_use_ema': False, 'sideways_use_atr': False, 'sideways_use_adx': True, 'sideways_use_spike': False, 'sideways_rsi_required': True}.
[I 2025-08-31 11:16:26,105] Trial 154 finished with values: [-1000000000.0, 1000000000.0] and parameters: {'p_sma': 49, 'p_std': 19, 'p_atr': 13, 'p_adx': 20, 'rsi_period': 57, 'ema1': 13, 'ema2': 13, 'slip_atr_k': 0.023493876980706443, 'slip_spread_k': 0.6349406695730068, 'spread_hl_frac': 0.04998133172454685, 'bb_std_mult': 2.1955892422615455, 'rsi_os': 39, 'rsi_ob': 82, 'vol_spike': 0.2530975235197132, 'adx_thresh': 34.2916761966882, 'atr_min_pct': 0.0024340037939811813, 'atr_max_pct': 0.06755193364413395, 'tp_mult': 1.042499562272044, 'tsl_mult': 0.05537565303433158, 'strategy': 'breakout', 'time_stop': 270, 'use_sma': False, 'use_atr': True, 'use_adx': True, 'use_ema': False, 'use_spike': False, 'rsi_required': True, 'edge_k': 1.647001624652805, 'edge_cap': 0.9392029049031068, 'bull_strategy': 'breakout', 'bull_bb_std_mult': 0.6380573451025748, 'bull_rsi_os': 32, 'bull_rsi_ob': 45, 'bull_adx_thresh': 16.55401570502639, 'bull_atr_min_pct': 0.020275888680839585, 'bull_atr_max_pct': 0.11926209348832101, 'bull_tp_mult': 1.5680813318559863, 'bull_tsl_mult': 0.2850997003755391, 'bull_time_stop': 140, 'bull_use_sma': True, 'bull_use_ema': False, 'bull_use_atr': True, 'bull_use_adx': True, 'bull_use_spike': False, 'bull_rsi_required': True, 'bear_strategy': 'breakout', 'bear_bb_std_mult': 1.34844982126988, 'bear_rsi_os': 19, 'bear_rsi_ob': 53, 'bear_adx_thresh': 32.15406508102296, 'bear_atr_min_pct': 0.01069042002493621, 'bear_atr_max_pct': 0.11450912386668043, 'bear_tp_mult': 1.222546560554583, 'bear_tsl_mult': 0.3444819299198245, 'bear_time_stop': 75, 'bear_use_sma': True, 'bear_use_ema': False, 'bear_use_atr': True, 'bear_use_adx': False, 'bear_use_spike': True, 'bear_rsi_required': False, 'sideways_strategy': 'mean_reversion', 'sideways_bb_std_mult': 0.8347605510409504, 'sideways_rsi_os': 36, 'sideways_rsi_ob': 70, 'sideways_adx_thresh': 9.01017356097485, 'sideways_atr_min_pct': 0.00363586151070677, 'sideways_atr_max_pct': 0.014943468819675752, 'sideways_tp_mult': 2.3243024232893075, 'sideways_tsl_mult': 0.7379528121081596, 'sideways_time_stop': 11, 'sideways_use_sma': False, 'sideways_use_ema': False, 'sideways_use_atr': False, 'sideways_use_adx': True, 'sideways_use_spike': True, 'sideways_rsi_required': True}.
[I 2025-08-31 11:16:56,733] Trial 160 finished with values: [-0.0712192731161706, 0.07089352714251672] and parameters: {'p_sma': 48, 'p_std': 26, 'p_atr': 12, 'p_adx': 16, 'rsi_period': 60, 'ema1': 14, 'ema2': 13, 'slip_atr_k': 0.03067658404968801, 'slip_spread_k': 0.577074230397178, 'spread_hl_frac': 0.04785492848981855, 'bb_std_mult': 1.904445313624217, 'rsi_os': 6, 'rsi_ob': 83, 'vol_spike': 0.20539873597653785, 'adx_thresh': 34.18684663988381, 'atr_min_pct': 0.024582897035794693, 'atr_max_pct': 0.06620172634227553, 'tp_mult': 1.1320297127192653, 'tsl_mult': 0.935526832250088, 'strategy': 'mean_reversion', 'time_stop': 291, 'use_sma': True, 'use_atr': True, 'use_adx': True, 'use_ema': False, 'use_spike': False, 'rsi_required': True, 'edge_k': 0.2535572626544455, 'edge_cap': 0.919431018983157, 'bull_strategy': 'breakout', 'bull_bb_std_mult': 0.7692348278899419, 'bull_rsi_os': 36, 'bull_rsi_ob': 50, 'bull_adx_thresh': 30.728210333981394, 'bull_atr_min_pct': 0.022334730270206583, 'bull_atr_max_pct': 0.10232361322615542, 'bull_tp_mult': 1.4740743916313905, 'bull_tsl_mult': 0.238298382280966, 'bull_time_stop': 241, 'bull_use_sma': True, 'bull_use_ema': False, 'bull_use_atr': True, 'bull_use_adx': True, 'bull_use_spike': False, 'bull_rsi_required': True, 'bear_strategy': 'mean_reversion', 'bear_bb_std_mult': 1.195589328953407, 'bear_rsi_os': 20, 'bear_rsi_ob': 72, 'bear_adx_thresh': 29.272824801924735, 'bear_atr_min_pct': 0.011068674529656156, 'bear_atr_max_pct': 0.12224959103950744, 'bear_tp_mult': 2.518077530828235, 'bear_tsl_mult': 0.34480166801900447, 'bear_time_stop': 59, 'bear_use_sma': True, 'bear_use_ema': False, 'bear_use_atr': True, 'bear_use_adx': False, 'bear_use_spike': True, 'bear_rsi_required': False, 'sideways_strategy': 'breakout', 'sideways_bb_std_mult': 3.5254053627471533, 'sideways_rsi_os': 46, 'sideways_rsi_ob': 68, 'sideways_adx_thresh': 8.293272429292134, 'sideways_atr_min_pct': 0.002653535927003966, 'sideways_atr_max_pct': 0.018996176779269236, 'sideways_tp_mult': 2.24463393811932, 'sideways_tsl_mult': 0.8342601327306476, 'sideways_time_stop': 103, 'sideways_use_sma': False, 'sideways_use_ema': False, 'sideways_use_atr': False, 'sideways_use_adx': True, 'sideways_use_spike': False, 'sideways_rsi_required': True}.
[I 2025-08-31 11:16:56,910] Trial 159 finished with values: [-0.11864540997779371, 0.11830331229802102] and parameters: {'p_sma': 48, 'p_std': 26, 'p_atr': 12, 'p_adx': 19, 'rsi_period': 39, 'ema1': 14, 'ema2': 13, 'slip_atr_k': 0.23483811244407105, 'slip_spread_k': 0.5774494595655479, 'spread_hl_frac': 0.038537228233407564, 'bb_std_mult': 2.2579242333697542, 'rsi_os': 53, 'rsi_ob': 82, 'vol_spike': 0.19483111343809736, 'adx_thresh': 34.28561328389958, 'atr_min_pct': 0.003451161943692635, 'atr_max_pct': 0.07054251457850001, 'tp_mult': 1.1256728051323615, 'tsl_mult': 0.4017112975789777, 'strategy': 'breakout', 'time_stop': 290, 'use_sma': True, 'use_atr': True, 'use_adx': True, 'use_ema': False, 'use_spike': False, 'rsi_required': True, 'edge_k': 0.4303013899713263, 'edge_cap': 0.9335153334540247, 'bull_strategy': 'breakout', 'bull_bb_std_mult': 1.4143217218644926, 'bull_rsi_os': 35, 'bull_rsi_ob': 50, 'bull_adx_thresh': 10.313595994828903, 'bull_atr_min_pct': 0.02102138750578101, 'bull_atr_max_pct': 0.10292162779980812, 'bull_tp_mult': 1.2878359885589723, 'bull_tsl_mult': 0.2524699154240215, 'bull_time_stop': 137, 'bull_use_sma': True, 'bull_use_ema': False, 'bull_use_atr': True, 'bull_use_adx': True, 'bull_use_spike': False, 'bull_rsi_required': True, 'bear_strategy': 'breakout', 'bear_bb_std_mult': 1.1777530788217931, 'bear_rsi_os': 5, 'bear_rsi_ob': 53, 'bear_adx_thresh': 30.818943477377715, 'bear_atr_min_pct': 0.010963051466633294, 'bear_atr_max_pct': 0.12502456097529874, 'bear_tp_mult': 1.8836710246895028, 'bear_tsl_mult': 0.07581940976360774, 'bear_time_stop': 60, 'bear_use_sma': True, 'bear_use_ema': False, 'bear_use_atr': True, 'bear_use_adx': False, 'bear_use_spike': True, 'bear_rsi_required': False, 'sideways_strategy': 'breakout', 'sideways_bb_std_mult': 0.5128913301109619, 'sideways_rsi_os': 46, 'sideways_rsi_ob': 72, 'sideways_adx_thresh': 8.326924077924431, 'sideways_atr_min_pct': 0.002600033922896992, 'sideways_atr_max_pct': 0.01399036476463697, 'sideways_tp_mult': 2.3627399802529996, 'sideways_tsl_mult': 0.7934309164656376, 'sideways_time_stop': 7, 'sideways_use_sma': False, 'sideways_use_ema': False, 'sideways_use_atr': False, 'sideways_use_adx': True, 'sideways_use_spike': False, 'sideways_rsi_required': True}.
[I 2025-08-31 11:16:57,014] Trial 158 finished with values: [-1000000000.0, 1000000000.0] and parameters: {'p_sma': 49, 'p_std': 8, 'p_atr': 13, 'p_adx': 19, 'rsi_period': 60, 'ema1': 14, 'ema2': 13, 'slip_atr_k': 0.03457971204842118, 'slip_spread_k': 0.5702459157345234, 'spread_hl_frac': 0.04828709557794504, 'bb_std_mult': 3.2766502041065473, 'rsi_os': 7, 'rsi_ob': 82, 'vol_spike': 0.20722726814540124, 'adx_thresh': 34.168573211126606, 'atr_min_pct': 0.029890555584010724, 'atr_max_pct': 0.08043196233884253, 'tp_mult': 1.1361831406071423, 'tsl_mult': 0.03948997792253599, 'strategy': 'breakout', 'time_stop': 287, 'use_sma': False, 'use_atr': True, 'use_adx': True, 'use_ema': False, 'use_spike': False, 'rsi_required': True, 'edge_k': 1.6085277563123186, 'edge_cap': 0.9052388935817639, 'bull_strategy': 'breakout', 'bull_bb_std_mult': 0.7673174411773371, 'bull_rsi_os': 33, 'bull_rsi_ob': 50, 'bull_adx_thresh': 30.378446959370805, 'bull_atr_min_pct': 0.021221946168010614, 'bull_atr_max_pct': 0.11910966342250302, 'bull_tp_mult': 2.8292323518341025, 'bull_tsl_mult': 0.25249652341221784, 'bull_time_stop': 139, 'bull_use_sma': True, 'bull_use_ema': False, 'bull_use_atr': True, 'bull_use_adx': True, 'bull_use_spike': False, 'bull_rsi_required': True, 'bear_strategy': 'breakout', 'bear_bb_std_mult': 1.1094738668309685, 'bear_rsi_os': 20, 'bear_rsi_ob': 89, 'bear_adx_thresh': 32.18428944220708, 'bear_atr_min_pct': 0.010999234823429297, 'bear_atr_max_pct': 0.12273079096529718, 'bear_tp_mult': 2.514318839974388, 'bear_tsl_mult': 0.33381878535954773, 'bear_time_stop': 72, 'bear_use_sma': True, 'bear_use_ema': False, 'bear_use_atr': True, 'bear_use_adx': False, 'bear_use_spike': True, 'bear_rsi_required': False, 'sideways_strategy': 'breakout', 'sideways_bb_std_mult': 1.0868984222067175, 'sideways_rsi_os': 32, 'sideways_rsi_ob': 71, 'sideways_adx_thresh': 8.340874646259845, 'sideways_atr_min_pct': 0.0024751515877542134, 'sideways_atr_max_pct': 0.01932852424697899, 'sideways_tp_mult': 2.3767398081793663, 'sideways_tsl_mult': 0.7943789172358254, 'sideways_time_stop': 18, 'sideways_use_sma': False, 'sideways_use_ema': False, 'sideways_use_atr': False, 'sideways_use_adx': True, 'sideways_use_spike': False, 'sideways_rsi_required': True}.
[I 2025-08-31 11:16:57,086] Trial 161 finished with values: [-0.03687801828464121, 0.036341745169386215] and parameters: {'p_sma': 45, 'p_std': 5, 'p_atr': 12, 'p_adx': 19, 'rsi_period': 39, 'ema1': 14, 'ema2': 15, 'slip_atr_k': 0.239933513512408, 'slip_spread_k': 0.6013125363627116, 'spread_hl_frac': 0.04832018174497009, 'bb_std_mult': 1.977456080759826, 'rsi_os': 41, 'rsi_ob': 83, 'vol_spike': 0.20668973271798508, 'adx_thresh': 30.903701033716985, 'atr_min_pct': 0.024711561041212846, 'atr_max_pct': 0.08863142099795589, 'tp_mult': 1.1066997994724692, 'tsl_mult': 0.026160495908489595, 'strategy': 'mean_reversion', 'time_stop': 292, 'use_sma': True, 'use_atr': True, 'use_adx': True, 'use_ema': False, 'use_spike': False, 'rsi_required': True, 'edge_k': 0.03736831108383465, 'edge_cap': 0.3403232329551417, 'bull_strategy': 'breakout', 'bull_bb_std_mult': 1.4053540994951788, 'bull_rsi_os': 35, 'bull_rsi_ob': 48, 'bull_adx_thresh': 11.59268640862449, 'bull_atr_min_pct': 0.02101200193149624, 'bull_atr_max_pct': 0.10202749650173329, 'bull_tp_mult': 1.2980984782427583, 'bull_tsl_mult': 0.2378953480296669, 'bull_time_stop': 115, 'bull_use_sma': True, 'bull_use_ema': False, 'bull_use_atr': True, 'bull_use_adx': True, 'bull_use_spike': False, 'bull_rsi_required': True, 'bear_strategy': 'mean_reversion', 'bear_bb_std_mult': 1.1125373054848153, 'bear_rsi_os': 5, 'bear_rsi_ob': 90, 'bear_adx_thresh': 27.124408866495987, 'bear_atr_min_pct': 0.015375259803954718, 'bear_atr_max_pct': 0.11999414317552538, 'bear_tp_mult': 1.8443269821212969, 'bear_tsl_mult': 0.07452415920198152, 'bear_time_stop': 59, 'bear_use_sma': True, 'bear_use_ema': False, 'bear_use_atr': True, 'bear_use_adx': False, 'bear_use_spike': True, 'bear_rsi_required': False, 'sideways_strategy': 'breakout', 'sideways_bb_std_mult': 2.301834570443315, 'sideways_rsi_os': 32, 'sideways_rsi_ob': 68, 'sideways_adx_thresh': 8.116588884805822, 'sideways_atr_min_pct': 0.002562311406321353, 'sideways_atr_max_pct': 0.1402253643468288, 'sideways_tp_mult': 2.3769951539107796, 'sideways_tsl_mult': 0.7853839816259542, 'sideways_time_stop': 20, 'sideways_use_sma': False, 'sideways_use_ema': False, 'sideways_use_atr': False, 'sideways_use_adx': True, 'sideways_use_spike': False, 'sideways_rsi_required': True}.
