[I 2025-08-31 11:13:47,279] Trial 135 finished with values: [-1000000000.0, 1000000000.0] and parameters: {'p_sma': 46, 'p_std': 40, 'p_atr': 16, 'p_adx': 23, 'rsi_period': 44, 'ema1': 15, 'ema2': 16, 'slip_atr_k': 0.05845433115906203, 'slip_spread_k': 0.6942045039448305, 'spread_hl_frac': 0.018215201918463257, 'bb_std_mult': 2.553457073889258, 'rsi_os': 40, 'rsi_ob': 84, 'vol_spike': 0.10388755591073251, 'adx_thresh': 32.44012675623471, 'atr_min_pct': 0.003009604740669318, 'atr_max_pct': 0.14486183474405992, 'tp_mult': 1.1623794117014303, 'tsl_mult': 0.14882082723309537, 'strategy': 'breakout', 'time_stop': 292, 'use_sma': False, 'use_atr': True, 'use_adx': False, 'use_ema': False, 'use_spike': True, 'rsi_required': True, 'edge_k': 0.132792898135613, 'edge_cap': 0.8558526333097263, 'bull_strategy': 'breakout', 'bull_bb_std_mult': 3.124601136669564, 'bull_rsi_os': 24, 'bull_rsi_ob': 63, 'bull_adx_thresh': 11.12707616017207, 'bull_atr_min_pct': 0.016074240315767863, 'bull_atr_max_pct': 0.05203189466207507, 'bull_tp_mult': 1.4983553596140347, 'bull_tsl_mult': 0.35991304869200397, 'bull_time_stop': 151, 'bull_use_sma': False, 'bull_use_ema': True, 'bull_use_atr': True, 'bull_use_adx': True, 'bull_use_spike': False, 'bull_rsi_required': False, 'bear_strategy': 'breakout', 'bear_bb_std_mult': 0.7149798689874886, 'bear_rsi_os': 42, 'bear_rsi_ob': 61, 'bear_adx_thresh': 33.854389643451135, 'bear_atr_min_pct': 0.006514715880652904, 'bear_atr_max_pct': 0.04344254423068958, 'bear_tp_mult': 2.694741799197345, 'bear_tsl_mult': 0.5119847450441731, 'bear_time_stop': 64, 'bear_use_sma': True, 'bear_use_ema': True, 'bear_use_atr': True, 'bear_use_adx': True, 'bear_use_spike': True, 'bear_rsi_required': False, 'sideways_strategy': 'mean_reversion', 'sideways_bb_std_mult': 1.192335380526223, 'sideways_rsi_os': 30, 'sideways_rsi_ob': 59, 'sideways_adx_thresh': 8.398871074263981, 'sideways_atr_min_pct': 0.015153447720797275, 'sideways_atr_max_pct': 0.03339644225965474, 'sideways_tp_mult': 2.146450610677854, 'sideways_tsl_mult': 0.5150878290767833, 'sideways_time_stop': 147, 'sideways_use_sma': False, 'sideways_use_ema': False, 'sideways_use_atr': False, 'sideways_use_adx': True, 'sideways_use_spike': True, 'sideways_rsi_required': False}.
[I 2025-08-31 11:13:47,382] Trial 136 finished with values: [-1000000000.0, 1000000000.0] and parameters: {'p_sma': 40, 'p_std': 42, 'p_atr': 16, 'p_adx': 22, 'rsi_period': 47, 'ema1': 15, 'ema2': 16, 'slip_atr_k': 0.060101740143357486, 'slip_spread_k': 0.6971927379523282, 'spread_hl_frac': 0.018321987326170713, 'bb_std_mult': 2.5123329769076914, 'rsi_os': 40, 'rsi_ob': 88, 'vol_spike': 0.13129231627005555, 'adx_thresh': 27.749801457478668, 'atr_min_pct': 0.0030799897098250147, 'atr_max_pct': 0.1499088798813865, 'tp_mult': 1.1637095221014684, 'tsl_mult': 0.16152996652342316, 'strategy': 'breakout', 'time_stop': 276, 'use_sma': False, 'use_atr': True, 'use_adx': False, 'use_ema': False, 'use_spike': True, 'rsi_required': True, 'edge_k': 0.15525504606767684, 'edge_cap': 0.8620039011260873, 'bull_strategy': 'breakout', 'bull_bb_std_mult': 2.8855630117500266, 'bull_rsi_os': 22, 'bull_rsi_ob': 63, 'bull_adx_thresh': 12.656823296213478, 'bull_atr_min_pct': 0.01637346894152665, 'bull_atr_max_pct': 0.054198965712594846, 'bull_tp_mult': 2.3141600738415034, 'bull_tsl_mult': 0.36124623012709806, 'bull_time_stop': 152, 'bull_use_sma': True, 'bull_use_ema': True, 'bull_use_atr': True, 'bull_use_adx': True, 'bull_use_spike': False, 'bull_rsi_required': False, 'bear_strategy': 'breakout', 'bear_bb_std_mult': 0.711518897513373, 'bear_rsi_os': 11, 'bear_rsi_ob': 62, 'bear_adx_thresh': 33.84752092707384, 'bear_atr_min_pct': 0.006662308151004078, 'bear_atr_max_pct': 0.06429985249278232, 'bear_tp_mult': 2.680554249187088, 'bear_tsl_mult': 0.5064501537238774, 'bear_time_stop': 37, 'bear_use_sma': True, 'bear_use_ema': True, 'bear_use_atr': True, 'bear_use_adx': True, 'bear_use_spike': True, 'bear_rsi_required': False, 'sideways_strategy': 'mean_reversion', 'sideways_bb_std_mult': 1.0266016083537997, 'sideways_rsi_os': 30, 'sideways_rsi_ob': 59, 'sideways_adx_thresh': 8.617845543093662, 'sideways_atr_min_pct': 0.020050419708007985, 'sideways_atr_max_pct': 0.035487213078340456, 'sideways_tp_mult': 1.993247349502981, 'sideways_tsl_mult': 0.5007055205440702, 'sideways_time_stop': 195, 'sideways_use_sma': False, 'sideways_use_ema': False, 'sideways_use_atr': False, 'sideways_use_adx': True, 'sideways_use_spike': True, 'sideways_rsi_required': False}.
[I 2025-08-31 11:13:47,497] Trial 134 finished with values: [-0.0783441358285567, 0.07819378181833116] and parameters: {'p_sma': 46, 'p_std': 40, 'p_atr': 16, 'p_adx': 23, 'rsi_period': 47, 'ema1': 15, 'ema2': 14, 'slip_atr_k': 0.04705746183715252, 'slip_spread_k': 0.7123941410227682, 'spread_hl_frac': 0.018900309704566288, 'bb_std_mult': 2.7296048695050197, 'rsi_os': 38, 'rsi_ob': 88, 'vol_spike': 0.13180823574861739, 'adx_thresh': 28.998873014936915, 'atr_min_pct': 2.3815687856439832e-05, 'atr_max_pct': 0.14698332400619096, 'tp_mult': 1.0765014491398053, 'tsl_mult': 0.09515841173447447, 'strategy': 'breakout', 'time_stop': 295, 'use_sma': False, 'use_atr': True, 'use_adx': False, 'use_ema': False, 'use_spike': False, 'rsi_required': True, 'edge_k': 0.14619611352921258, 'edge_cap': 0.8648389415302357, 'bull_strategy': 'breakout', 'bull_bb_std_mult': 2.9617489978044516, 'bull_rsi_os': 25, 'bull_rsi_ob': 63, 'bull_adx_thresh': 11.266290741695354, 'bull_atr_min_pct': 0.016368639720660674, 'bull_atr_max_pct': 0.0548918132381983, 'bull_tp_mult': 1.472286729089899, 'bull_tsl_mult': 0.3634058629630478, 'bull_time_stop': 157, 'bull_use_sma': True, 'bull_use_ema': False, 'bull_use_atr': True, 'bull_use_adx': True, 'bull_use_spike': False, 'bull_rsi_required': False, 'bear_strategy': 'breakout', 'bear_bb_std_mult': 0.6454270667196792, 'bear_rsi_os': 13, 'bear_rsi_ob': 61, 'bear_adx_thresh': 34.79417294298333, 'bear_atr_min_pct': 0.005005735845802592, 'bear_atr_max_pct': 0.04552943607542531, 'bear_tp_mult': 2.6696018456918718, 'bear_tsl_mult': 0.49921699291159094, 'bear_time_stop': 29, 'bear_use_sma': True, 'bear_use_ema': False, 'bear_use_atr': True, 'bear_use_adx': True, 'bear_use_spike': True, 'bear_rsi_required': False, 'sideways_strategy': 'mean_reversion', 'sideways_bb_std_mult': 1.1430108532060603, 'sideways_rsi_os': 29, 'sideways_rsi_ob': 62, 'sideways_adx_thresh': 7.283980765689204, 'sideways_atr_min_pct': 0.0014892712936284917, 'sideways_atr_max_pct': 0.015067100918361135, 'sideways_tp_mult': 2.16045611762033, 'sideways_tsl_mult': 0.5042746575293057, 'sideways_time_stop': 21, 'sideways_use_sma': False, 'sideways_use_ema': False, 'sideways_use_atr': False, 'sideways_use_adx': True, 'sideways_use_spike': True, 'sideways_rsi_required': False}.
[I 2025-08-31 11:14:17,185] Trial 138 finished with values: [-1000000000.0, 1000000000.0] and parameters: {'p_sma': 40, 'p_std': 42, 'p_atr': 17, 'p_adx': 22, 'rsi_period': 52, 'ema1': 13, 'ema2': 18, 'slip_atr_k': 0.03215619260329583, 'slip_spread_k': 0.7136606809401044, 'spread_hl_frac': 0.020178908602183895, 'bb_std_mult': 2.6126983678661007, 'rsi_os': 37, 'rsi_ob': 86, 'vol_spike': 0.0918625191116671, 'adx_thresh': 27.62813748539544, 'atr_min_pct': 3.629617617765147e-05, 'atr_max_pct': 0.06862676435150948, 'tp_mult': 1.0792057756833855, 'tsl_mult': 0.07221164472612733, 'strategy': 'breakout', 'time_stop': 276, 'use_sma': False, 'use_atr': True, 'use_adx': True, 'use_ema': False, 'use_spike': False, 'rsi_required': True, 'edge_k': 0.18925648716300622, 'edge_cap': 0.9206556103472767, 'bull_strategy': 'breakout', 'bull_bb_std_mult': 2.9095047359554345, 'bull_rsi_os': 27, 'bull_rsi_ob': 61, 'bull_adx_thresh': 12.446533464628086, 'bull_atr_min_pct': 0.015563472024909396, 'bull_atr_max_pct': 0.05583218381825626, 'bull_tp_mult': 1.4197154386944126, 'bull_tsl_mult': 0.37368656459841415, 'bull_time_stop': 186, 'bull_use_sma': True, 'bull_use_ema': False, 'bull_use_atr': True, 'bull_use_adx': True, 'bull_use_spike': False, 'bull_rsi_required': True, 'bear_strategy': 'breakout', 'bear_bb_std_mult': 0.6599966162725805, 'bear_rsi_os': 11, 'bear_rsi_ob': 59, 'bear_adx_thresh': 34.870099883204055, 'bear_atr_min_pct': 0.005736117292164247, 'bear_atr_max_pct': 0.037629016709955276, 'bear_tp_mult': 2.6174105874310936, 'bear_tsl_mult': 0.4042450130825607, 'bear_time_stop': 25, 'bear_use_sma': True, 'bear_use_ema': False, 'bear_use_atr': True, 'bear_use_adx': False, 'bear_use_spike': True, 'bear_rsi_required': False, 'sideways_strategy': 'breakout', 'sideways_bb_std_mult': 1.2076687704010005, 'sideways_rsi_os': 33, 'sideways_rsi_ob': 50, 'sideways_adx_thresh': 7.759563800355924, 'sideways_atr_min_pct': 0.020171673949685977, 'sideways_atr_max_pct': 0.021439866931492472, 'sideways_tp_mult': 2.039792651615944, 'sideways_tsl_mult': 0.7824708675080725, 'sideways_time_stop': 19, 'sideways_use_sma': False, 'sideways_use_ema': False, 'sideways_use_atr': False, 'sideways_use_adx': True, 'sideways_use_spike': False, 'sideways_rsi_required': True}.
[I 2025-08-31 11:14:17,826] Trial 139 finished with values: [-0.010064620283936399, 0.012130484396916353] and parameters: {'p_sma': 40, 'p_std': 42, 'p_atr': 17, 'p_adx': 22, 'rsi_period': 52, 'ema1': 14, 'ema2': 18, 'slip_atr_k': 0.046311574576423216, 'slip_spread_k': 0.7222810947209746, 'spread_hl_frac': 0.020089070386906244, 'bb_std_mult': 2.702478849255516, 'rsi_os': 37, 'rsi_ob': 86, 'vol_spike': 0.11611227598120846, 'adx_thresh': 29.029271584708894, 'atr_min_pct': 7.179206585262695e-05, 'atr_max_pct': 0.09277377587028965, 'tp_mult': 1.0847597425488158, 'tsl_mult': 0.16920479463026356, 'strategy': 'breakout', 'time_stop': 271, 'use_sma': False, 'use_atr': True, 'use_adx': True, 'use_ema': False, 'use_spike': False, 'rsi_required': True, 'edge_k': 0.33634937773892915, 'edge_cap': 0.9355820748163631, 'bull_strategy': 'breakout', 'bull_bb_std_mult': 2.9060570600006432, 'bull_rsi_os': 22, 'bull_rsi_ob': 62, 'bull_adx_thresh': 9.960103582123164, 'bull_atr_min_pct': 0.015626909136498196, 'bull_atr_max_pct': 0.054422301475715015, 'bull_tp_mult': 1.4320996482554544, 'bull_tsl_mult': 0.37452947850773344, 'bull_time_stop': 149, 'bull_use_sma': True, 'bull_use_ema': False, 'bull_use_atr': True, 'bull_use_adx': True, 'bull_use_spike': False, 'bull_rsi_required': True, 'bear_strategy': 'breakout', 'bear_bb_std_mult': 0.6337746784010535, 'bear_rsi_os': 11, 'bear_rsi_ob': 58, 'bear_adx_thresh': 31.237336545550317, 'bear_atr_min_pct': 0.004854108142501083, 'bear_atr_max_pct': 0.14523586250307088, 'bear_tp_mult': 2.585797114303744, 'bear_tsl_mult': 0.4078154363666088, 'bear_time_stop': 27, 'bear_use_sma': True, 'bear_use_ema': False, 'bear_use_atr': True, 'bear_use_adx': False, 'bear_use_spike': True, 'bear_rsi_required': False, 'sideways_strategy': 'breakout', 'sideways_bb_std_mult': 1.1166628679199775, 'sideways_rsi_os': 31, 'sideways_rsi_ob': 68, 'sideways_adx_thresh': 7.607435077276686, 'sideways_atr_min_pct': 0.0015371174151076236, 'sideways_atr_max_pct': 0.021992270743812107, 'sideways_tp_mult': 2.0489147569797006, 'sideways_tsl_mult': 0.7869747374713513, 'sideways_time_stop': 19, 'sideways_use_sma': False, 'sideways_use_ema': False, 'sideways_use_atr': False, 'sideways_use_adx': True, 'sideways_use_spike': False, 'sideways_rsi_required': True}.
[I 2025-08-31 11:14:18,183] Trial 141 finished with values: [-1000000000.0, 1000000000.0] and parameters: {'p_sma': 35, 'p_std': 42, 'p_atr': 17, 'p_adx': 19, 'rsi_period': 52, 'ema1': 14, 'ema2': 18, 'slip_atr_k': 0.052044616425113835, 'slip_spread_k': 0.7283301693269276, 'spread_hl_frac': 0.020346197779947315, 'bb_std_mult': 2.6725545729586795, 'rsi_os': 37, 'rsi_ob': 87, 'vol_spike': 0.1149605482834824, 'adx_thresh': 29.39092781857379, 'atr_min_pct': 0.0014152965130925417, 'atr_max_pct': 0.09468495029057783, 'tp_mult': 1.0953045863909452, 'tsl_mult': 0.11134243096575092, 'strategy': 'mean_reversion', 'time_stop': 276, 'use_sma': True, 'use_atr': False, 'use_adx': True, 'use_ema': False, 'use_spike': False, 'rsi_required': True, 'edge_k': 0.19896264721085022, 'edge_cap': 0.9354114912921476, 'bull_strategy': 'breakout', 'bull_bb_std_mult': 3.2800191794789857, 'bull_rsi_os': 21, 'bull_rsi_ob': 62, 'bull_adx_thresh': 9.725376068597491, 'bull_atr_min_pct': 0.015400721785130137, 'bull_atr_max_pct': 0.05872129621541668, 'bull_tp_mult': 1.4254797788211437, 'bull_tsl_mult': 0.38370407257004735, 'bull_time_stop': 168, 'bull_use_sma': True, 'bull_use_ema': False, 'bull_use_atr': True, 'bull_use_adx': True, 'bull_use_spike': False, 'bull_rsi_required': True, 'bear_strategy': 'mean_reversion', 'bear_bb_std_mult': 0.5770322100664245, 'bear_rsi_os': 49, 'bear_rsi_ob': 59, 'bear_adx_thresh': 31.279746393416303, 'bear_atr_min_pct': 0.003311821538566535, 'bear_atr_max_pct': 0.05748285328449252, 'bear_tp_mult': 2.5906735170311253, 'bear_tsl_mult': 0.40309773039926833, 'bear_time_stop': 54, 'bear_use_sma': True, 'bear_use_ema': False, 'bear_use_atr': True, 'bear_use_adx': False, 'bear_use_spike': True, 'bear_rsi_required': False, 'sideways_strategy': 'breakout', 'sideways_bb_std_mult': 2.454579949864698, 'sideways_rsi_os': 33, 'sideways_rsi_ob': 67, 'sideways_adx_thresh': 7.630389045662185, 'sideways_atr_min_pct': 0.02766597356780639, 'sideways_atr_max_pct': 0.022357654413755874, 'sideways_tp_mult': 2.0519251574277684, 'sideways_tsl_mult': 0.7697755754693498, 'sideways_time_stop': 229, 'sideways_use_sma': False, 'sideways_use_ema': True, 'sideways_use_atr': False, 'sideways_use_adx': False, 'sideways_use_spike': False, 'sideways_rsi_required': True}.
[I 2025-08-31 11:14:18,287] Trial 140 finished with values: [-0.08283468267594252, 0.08288056632373111] and parameters: {'p_sma': 35, 'p_std': 42, 'p_atr': 17, 'p_adx': 19, 'rsi_period': 52, 'ema1': 13, 'ema2': 18, 'slip_atr_k': 0.047906545064431955, 'slip_spread_k': 0.7217716184191305, 'spread_hl_frac': 0.020057295756336288, 'bb_std_mult': 2.6959368021506163, 'rsi_os': 37, 'rsi_ob': 86, 'vol_spike': 0.0908371992909537, 'adx_thresh': 28.940970424446494, 'atr_min_pct': 0.00016694679343181847, 'atr_max_pct': 0.09379601206996979, 'tp_mult': 1.078558460177753, 'tsl_mult': 0.027891944418103984, 'strategy': 'breakout', 'time_stop': 292, 'use_sma': True, 'use_atr': False, 'use_adx': True, 'use_ema': False, 'use_spike': False, 'rsi_required': True, 'edge_k': 0.19517498430296115, 'edge_cap': 0.9071255846891424, 'bull_strategy': 'breakout', 'bull_bb_std_mult': 2.9462604567647275, 'bull_rsi_os': 27, 'bull_rsi_ob': 61, 'bull_adx_thresh': 9.96486091266271, 'bull_atr_min_pct': 0.01576672720611673, 'bull_atr_max_pct': 0.03740908699737377, 'bull_tp_mult': 1.4125623593226648, 'bull_tsl_mult': 0.3787956457456542, 'bull_time_stop': 167, 'bull_use_sma': True, 'bull_use_ema': False, 'bull_use_atr': True, 'bull_use_adx': True, 'bull_use_spike': False, 'bull_rsi_required': True, 'bear_strategy': 'breakout', 'bear_bb_std_mult': 0.6274862670796835, 'bear_rsi_os': 49, 'bear_rsi_ob': 58, 'bear_adx_thresh': 31.327751077512506, 'bear_atr_min_pct': 0.003395602986153953, 'bear_atr_max_pct': 0.0513545169456336, 'bear_tp_mult': 2.6043580197647933, 'bear_tsl_mult': 0.45893151968518164, 'bear_time_stop': 51, 'bear_use_sma': True, 'bear_use_ema': False, 'bear_use_atr': True, 'bear_use_adx': False, 'bear_use_spike': True, 'bear_rsi_required': False, 'sideways_strategy': 'breakout', 'sideways_bb_std_mult': 1.1213415259316855, 'sideways_rsi_os': 39, 'sideways_rsi_ob': 68, 'sideways_adx_thresh': 7.528813063185467, 'sideways_atr_min_pct': 0.001532009098906424, 'sideways_atr_max_pct': 0.021747896295868333, 'sideways_tp_mult': 2.064928084901825, 'sideways_tsl_mult': 0.7657047877637962, 'sideways_time_stop': 246, 'sideways_use_sma': False, 'sideways_use_ema': True, 'sideways_use_atr': False, 'sideways_use_adx': True, 'sideways_use_spike': False, 'sideways_rsi_required': True}.
[I 2025-08-31 11:14:49,021] Trial 144 finished with values: [-0.011816054456656455, 0.01410312955667974] and parameters: {'p_sma': 40, 'p_std': 39, 'p_atr': 17, 'p_adx': 20, 'rsi_period': 49, 'ema1': 13, 'ema2': 12, 'slip_atr_k': 0.03754321419446963, 'slip_spread_k': 0.6692642093358588, 'spread_hl_frac': 0.01727156990375223, 'bb_std_mult': 2.82416730069106, 'rsi_os': 41, 'rsi_ob': 85, 'vol_spike': 0.0976466135720421, 'adx_thresh': 28.281541999166368, 'atr_min_pct': 0.0005490189211841246, 'atr_max_pct': 0.09059098497684104, 'tp_mult': 1.0205017374933212, 'tsl_mult': 0.17074620595927523, 'strategy': 'breakout', 'time_stop': 288, 'use_sma': False, 'use_atr': True, 'use_adx': True, 'use_ema': False, 'use_spike': False, 'rsi_required': True, 'edge_k': 0.2680689075099117, 'edge_cap': 0.962797794458008, 'bull_strategy': 'breakout', 'bull_bb_std_mult': 3.0871735698808913, 'bull_rsi_os': 23, 'bull_rsi_ob': 64, 'bull_adx_thresh': 10.833340179958661, 'bull_atr_min_pct': 0.0158015986588787, 'bull_atr_max_pct': 0.03751187534097369, 'bull_tp_mult': 1.1944167007342488, 'bull_tsl_mult': 0.4283070752786801, 'bull_time_stop': 142, 'bull_use_sma': True, 'bull_use_ema': False, 'bull_use_atr': True, 'bull_use_adx': True, 'bull_use_spike': False, 'bull_rsi_required': True, 'bear_strategy': 'breakout', 'bear_bb_std_mult': 0.6067922883726939, 'bear_rsi_os': 7, 'bear_rsi_ob': 55, 'bear_adx_thresh': 33.16755922600915, 'bear_atr_min_pct': 0.0035156757952541306, 'bear_atr_max_pct': 0.11253010153262794, 'bear_tp_mult': 2.57406298287883, 'bear_tsl_mult': 0.45146227569305186, 'bear_time_stop': 50, 'bear_use_sma': True, 'bear_use_ema': False, 'bear_use_atr': True, 'bear_use_adx': False, 'bear_use_spike': True, 'bear_rsi_required': False, 'sideways_strategy': 'breakout', 'sideways_bb_std_mult': 1.2657628843792181, 'sideways_rsi_os': 31, 'sideways_rsi_ob': 69, 'sideways_adx_thresh': 7.273750233258097, 'sideways_atr_min_pct': 0.0018455747488979417, 'sideways_atr_max_pct': 0.02565194056605895, 'sideways_tp_mult': 2.096351832506708, 'sideways_tsl_mult': 0.5397763001182795, 'sideways_time_stop': 212, 'sideways_use_sma': False, 'sideways_use_ema': False, 'sideways_use_atr': False, 'sideways_use_adx': True, 'sideways_use_spike': False, 'sideways_rsi_required': True}.
[I 2025-08-31 11:14:49,538] Trial 143 finished with values: [-1000000000.0, 1000000000.0] and parameters: {'p_sma': 35, 'p_std': 40, 'p_atr': 17, 'p_adx': 21, 'rsi_period': 52, 'ema1': 14, 'ema2': 18, 'slip_atr_k': 0.05253967185414593, 'slip_spread_k': 0.6673445480723866, 'spread_hl_frac': 0.01702491594643395, 'bb_std_mult': 2.721585516593015, 'rsi_os': 37, 'rsi_ob': 86, 'vol_spike': 0.11737730816682744, 'adx_thresh': 26.801240307712693, 'atr_min_pct': 0.0004814507799475458, 'atr_max_pct': 0.09243502635121814, 'tp_mult': 1.104927994359821, 'tsl_mult': 0.23663204414586936, 'strategy': 'breakout', 'time_stop': 285, 'use_sma': False, 'use_atr': True, 'use_adx': True, 'use_ema': False, 'use_spike': False, 'rsi_required': True, 'edge_k': 0.2641624804318848, 'edge_cap': 0.9752159714110904, 'bull_strategy': 'breakout', 'bull_bb_std_mult': 2.7444708357168253, 'bull_rsi_os': 21, 'bull_rsi_ob': 90, 'bull_adx_thresh': 9.73386168609914, 'bull_atr_min_pct': 0.015025397730345443, 'bull_atr_max_pct': 0.034861029544418214, 'bull_tp_mult': 1.3737303158516978, 'bull_tsl_mult': 0.4301029552859965, 'bull_time_stop': 170, 'bull_use_sma': True, 'bull_use_ema': False, 'bull_use_atr': True, 'bull_use_adx': True, 'bull_use_spike': False, 'bull_rsi_required': True, 'bear_strategy': 'breakout', 'bear_bb_std_mult': 0.6049488162806027, 'bear_rsi_os': 7, 'bear_rsi_ob': 58, 'bear_adx_thresh': 31.39381407001933, 'bear_atr_min_pct': 0.0032752225633795465, 'bear_atr_max_pct': 0.05901702347264041, 'bear_tp_mult': 2.572528311440997, 'bear_tsl_mult': 0.45891340357148097, 'bear_time_stop': 56, 'bear_use_sma': True, 'bear_use_ema': False, 'bear_use_atr': True, 'bear_use_adx': False, 'bear_use_spike': True, 'bear_rsi_required': False, 'sideways_strategy': 'breakout', 'sideways_bb_std_mult': 1.2589418206368188, 'sideways_rsi_os': 31, 'sideways_rsi_ob': 67, 'sideways_adx_thresh': 7.281688761669064, 'sideways_atr_min_pct': 0.002275918485741413, 'sideways_atr_max_pct': 0.029513849581227575, 'sideways_tp_mult': 2.107645218717724, 'sideways_tsl_mult': 0.6766227890872254, 'sideways_time_stop': 40, 'sideways_use_sma': False, 'sideways_use_ema': False, 'sideways_use_atr': False, 'sideways_use_adx': True, 'sideways_use_spike': False, 'sideways_rsi_required': True}.
