[I 2025-08-31 11:19:34,120] Trial 182 finished with values: [-0.025138459236172417, 0.0250540498302452] and parameters: {'p_sma': 44, 'p_std': 8, 'p_atr': 8, 'p_adx': 18, 'rsi_period': 49, 'ema1': 14, 'ema2': 49, 'slip_atr_k': 0.16456160898036695, 'slip_spread_k': 0.997998530620436, 'spread_hl_frac': 0.04660075307203073, 'bb_std_mult': 2.586092107532758, 'rsi_os': 20, 'rsi_ob': 85, 'vol_spike': 0.13712556657119276, 'adx_thresh': 22.855135918892117, 'atr_min_pct': 0.0026285493733914944, 'atr_max_pct': 0.039272131784403426, 'tp_mult': 1.0804752721778366, 'tsl_mult': 0.26890912499427855, 'strategy': 'breakout', 'time_stop': 289, 'use_sma': True, 'use_atr': True, 'use_adx': False, 'use_ema': False, 'use_spike': True, 'rsi_required': True, 'edge_k': 0.3553750301321402, 'edge_cap': 0.844894280249977, 'bull_strategy': 'breakout', 'bull_bb_std_mult': 1.2092500875909804, 'bull_rsi_os': 51, 'bull_rsi_ob': 61, 'bull_adx_thresh': 17.291234172855162, 'bull_atr_min_pct': 0.029799024297779017, 'bull_atr_max_pct': 0.028951656682426143, 'bull_tp_mult': 1.5928661095299192, 'bull_tsl_mult': 0.34516246429886943, 'bull_time_stop': 252, 'bull_use_sma': True, 'bull_use_ema': True, 'bull_use_atr': True, 'bull_use_adx': True, 'bull_use_spike': False, 'bull_rsi_required': True, 'bear_strategy': 'breakout', 'bear_bb_std_mult': 3.1300435466052585, 'bear_rsi_os': 45, 'bear_rsi_ob': 51, 'bear_adx_thresh': 22.78878141595239, 'bear_atr_min_pct': 0.022877410913117145, 'bear_atr_max_pct': 0.14428541350083635, 'bear_tp_mult': 2.502155108988487, 'bear_tsl_mult': 0.38067066116121473, 'bear_time_stop': 78, 'bear_use_sma': True, 'bear_use_ema': True, 'bear_use_atr': True, 'bear_use_adx': False, 'bear_use_spike': True, 'bear_rsi_required': False, 'sideways_strategy': 'breakout', 'sideways_bb_std_mult': 1.1122846286812287, 'sideways_rsi_os': 33, 'sideways_rsi_ob': 64, 'sideways_adx_thresh': 10.25074604084475, 'sideways_atr_min_pct': 0.0034280981388985316, 'sideways_atr_max_pct': 0.04116372503443099, 'sideways_tp_mult': 2.297006213959719, 'sideways_tsl_mult': 0.6616332706303705, 'sideways_time_stop': 34, 'sideways_use_sma': False, 'sideways_use_ema': False, 'sideways_use_atr': False, 'sideways_use_adx': True, 'sideways_use_spike': False, 'sideways_rsi_required': False}.
[I 2025-08-31 11:19:34,354] Trial 181 finished with values: [-1000000000.0, 1000000000.0] and parameters: {'p_sma': 44, 'p_std': 7, 'p_atr': 30, 'p_adx': 7, 'rsi_period': 82, 'ema1': 14, 'ema2': 60, 'slip_atr_k': 0.019425811785305613, 'slip_spread_k': 0.11765370250486207, 'spread_hl_frac': 0.04639594854453618, 'bb_std_mult': 0.7552747120948213, 'rsi_os': 16, 'rsi_ob': 80, 'vol_spike': 0.24242029106931468, 'adx_thresh': 22.914929359349962, 'atr_min_pct': 0.027931390928113982, 'atr_max_pct': 0.05874013814656939, 'tp_mult': 1.089659557173307, 'tsl_mult': 0.13021185905006818, 'strategy': 'breakout', 'time_stop': 290, 'use_sma': True, 'use_atr': True, 'use_adx': False, 'use_ema': False, 'use_spike': True, 'rsi_required': True, 'edge_k': 0.4688282242196893, 'edge_cap': 0.8512343204691453, 'bull_strategy': 'breakout', 'bull_bb_std_mult': 1.2283012817086383, 'bull_rsi_os': 25, 'bull_rsi_ob': 61, 'bull_adx_thresh': 13.686944953959966, 'bull_atr_min_pct': 0.017013840542413804, 'bull_atr_max_pct': 0.12931885279725291, 'bull_tp_mult': 2.4407568283786207, 'bull_tsl_mult': 0.3496651155031812, 'bull_time_stop': 250, 'bull_use_sma': True, 'bull_use_ema': True, 'bull_use_atr': True, 'bull_use_adx': True, 'bull_use_spike': False, 'bull_rsi_required': True, 'bear_strategy': 'breakout', 'bear_bb_std_mult': 1.6133746399736313, 'bear_rsi_os': 15, 'bear_rsi_ob': 52, 'bear_adx_thresh': 23.36745853848937, 'bear_atr_min_pct': 0.013865062283688528, 'bear_atr_max_pct': 0.10028135555422842, 'bear_tp_mult': 1.5812056788397348, 'bear_tsl_mult': 0.37614239324017296, 'bear_time_stop': 253, 'bear_use_sma': True, 'bear_use_ema': True, 'bear_use_atr': True, 'bear_use_adx': False, 'bear_use_spike': True, 'bear_rsi_required': False, 'sideways_strategy': 'breakout', 'sideways_bb_std_mult': 2.0664654188076623, 'sideways_rsi_os': 33, 'sideways_rsi_ob': 47, 'sideways_adx_thresh': 12.002543635078183, 'sideways_atr_min_pct': 0.003412976611683824, 'sideways_atr_max_pct': 0.1458542650492734, 'sideways_tp_mult': 2.242657770623275, 'sideways_tsl_mult': 0.7584987110486252, 'sideways_time_stop': 32, 'sideways_use_sma': False, 'sideways_use_ema': False, 'sideways_use_atr': False, 'sideways_use_adx': True, 'sideways_use_spike': False, 'sideways_rsi_required': False}.
[I 2025-08-31 11:19:34,492] Trial 180 finished with values: [-1000000000.0, 1000000000.0] and parameters: {'p_sma': 44, 'p_std': 7, 'p_atr': 8, 'p_adx': 25, 'rsi_period': 82, 'ema1': 14, 'ema2': 17, 'slip_atr_k': 0.2436955596089699, 'slip_spread_k': 0.5939863166455098, 'spread_hl_frac': 0.04647682869864341, 'bb_std_mult': 2.553447495864146, 'rsi_os': 36, 'rsi_ob': 69, 'vol_spike': 0.2249172407499044, 'adx_thresh': 22.370889900514094, 'atr_min_pct': 0.0021927019372893555, 'atr_max_pct': 0.06038325517901717, 'tp_mult': 1.0793803634559613, 'tsl_mult': 0.8145647221669197, 'strategy': 'breakout', 'time_stop': 299, 'use_sma': False, 'use_atr': True, 'use_adx': False, 'use_ema': False, 'use_spike': False, 'rsi_required': True, 'edge_k': 0.3609570110989756, 'edge_cap': 0.18915263397447446, 'bull_strategy': 'breakout', 'bull_bb_std_mult': 1.1980689997013563, 'bull_rsi_os': 21, 'bull_rsi_ob': 61, 'bull_adx_thresh': 21.80157279179376, 'bull_atr_min_pct': 0.02246039847826562, 'bull_atr_max_pct': 0.10685938683020255, 'bull_tp_mult': 2.103240150384679, 'bull_tsl_mult': 0.8636814594918933, 'bull_time_stop': 248, 'bull_use_sma': True, 'bull_use_ema': False, 'bull_use_atr': True, 'bull_use_adx': True, 'bull_use_spike': False, 'bull_rsi_required': True, 'bear_strategy': 'breakout', 'bear_bb_std_mult': 3.0953633067673145, 'bear_rsi_os': 42, 'bear_rsi_ob': 51, 'bear_adx_thresh': 24.392529711133896, 'bear_atr_min_pct': 0.017199600438552398, 'bear_atr_max_pct': 0.10570042528709113, 'bear_tp_mult': 1.3027881824166978, 'bear_tsl_mult': 0.38041390646889645, 'bear_time_stop': 200, 'bear_use_sma': True, 'bear_use_ema': False, 'bear_use_atr': True, 'bear_use_adx': False, 'bear_use_spike': True, 'bear_rsi_required': False, 'sideways_strategy': 'breakout', 'sideways_bb_std_mult': 0.9529129482055294, 'sideways_rsi_os': 29, 'sideways_rsi_ob': 46, 'sideways_adx_thresh': 10.197924395192366, 'sideways_atr_min_pct': 0.013052508268851022, 'sideways_atr_max_pct': 0.041295271949829154, 'sideways_tp_mult': 1.1583565350253289, 'sideways_tsl_mult': 0.9173754482303103, 'sideways_time_stop': 111, 'sideways_use_sma': False, 'sideways_use_ema': False, 'sideways_use_atr': False, 'sideways_use_adx': True, 'sideways_use_spike': False, 'sideways_rsi_required': False}.
[I 2025-08-31 11:20:05,698] Trial 185 finished with values: [-1000000000.0, 1000000000.0] and parameters: {'p_sma': 42, 'p_std': 15, 'p_atr': 8, 'p_adx': 17, 'rsi_period': 59, 'ema1': 23, 'ema2': 45, 'slip_atr_k': 0.18512761369586858, 'slip_spread_k': 0.5963303376293229, 'spread_hl_frac': 0.045194359606687225, 'bb_std_mult': 3.5372645469649417, 'rsi_os': 36, 'rsi_ob': 85, 'vol_spike': 0.16379770895631815, 'adx_thresh': 17.792331805647464, 'atr_min_pct': 0.002588617962034654, 'atr_max_pct': 0.037692724937953385, 'tp_mult': 2.5267314525454925, 'tsl_mult': 0.9775788750255977, 'strategy': 'breakout', 'time_stop': 60, 'use_sma': False, 'use_atr': True, 'use_adx': True, 'use_ema': False, 'use_spike': False, 'rsi_required': True, 'edge_k': 0.3655876039074448, 'edge_cap': 0.45333996908133584, 'bull_strategy': 'breakout', 'bull_bb_std_mult': 0.7182902098441288, 'bull_rsi_os': 24, 'bull_rsi_ob': 59, 'bull_adx_thresh': 11.245045547586788, 'bull_atr_min_pct': 0.02030113229575847, 'bull_atr_max_pct': 0.029677184330155745, 'bull_tp_mult': 1.0809886501895076, 'bull_tsl_mult': 0.3329791771865689, 'bull_time_stop': 279, 'bull_use_sma': True, 'bull_use_ema': False, 'bull_use_atr': True, 'bull_use_adx': True, 'bull_use_spike': False, 'bull_rsi_required': True, 'bear_strategy': 'breakout', 'bear_bb_std_mult': 1.2724171069727648, 'bear_rsi_os': 38, 'bear_rsi_ob': 53, 'bear_adx_thresh': 24.492227648732776, 'bear_atr_min_pct': 0.02298783215858516, 'bear_atr_max_pct': 0.14955958181552398, 'bear_tp_mult': 2.1271171144375645, 'bear_tsl_mult': 0.33066311216566113, 'bear_time_stop': 78, 'bear_use_sma': True, 'bear_use_ema': False, 'bear_use_atr': True, 'bear_use_adx': False, 'bear_use_spike': True, 'bear_rsi_required': False, 'sideways_strategy': 'breakout', 'sideways_bb_std_mult': 1.111377366761369, 'sideways_rsi_os': 34, 'sideways_rsi_ob': 69, 'sideways_adx_thresh': 7.915805008903988, 'sideways_atr_min_pct': 0.008487654940776395, 'sideways_atr_max_pct': 0.04092177116926911, 'sideways_tp_mult': 2.2915838267935293, 'sideways_tsl_mult': 0.6580399001345912, 'sideways_time_stop': 149, 'sideways_use_sma': False, 'sideways_use_ema': False, 'sideways_use_atr': False, 'sideways_use_adx': True, 'sideways_use_spike': False, 'sideways_rsi_required': True}.
[I 2025-08-31 11:20:06,237] Trial 184 finished with values: [-1000000000.0, 1000000000.0] and parameters: {'p_sma': 41, 'p_std': 8, 'p_atr': 8, 'p_adx': 18, 'rsi_period': 59, 'ema1': 14, 'ema2': 49, 'slip_atr_k': 0.044396670596978716, 'slip_spread_k': 0.4388617174601245, 'spread_hl_frac': 0.0465667384084993, 'bb_std_mult': 1.8198823615951003, 'rsi_os': 40, 'rsi_ob': 80, 'vol_spike': 0.13659055300367942, 'adx_thresh': 22.410931148339778, 'atr_min_pct': 0.00241354463548234, 'atr_max_pct': 0.0787594686450005, 'tp_mult': 1.0861069358202842, 'tsl_mult': 0.2636945483465255, 'strategy': 'breakout', 'time_stop': 288, 'use_sma': False, 'use_atr': True, 'use_adx': False, 'use_ema': False, 'use_spike': True, 'rsi_required': True, 'edge_k': 0.36248014378181187, 'edge_cap': 0.8244885318383335, 'bull_strategy': 'breakout', 'bull_bb_std_mult': 0.8512652110233908, 'bull_rsi_os': 25, 'bull_rsi_ob': 61, 'bull_adx_thresh': 17.605300054787786, 'bull_atr_min_pct': 0.022485899207914353, 'bull_atr_max_pct': 0.022371052862384756, 'bull_tp_mult': 1.4908646468294966, 'bull_tsl_mult': 0.3334056599769449, 'bull_time_stop': 160, 'bull_use_sma': True, 'bull_use_ema': True, 'bull_use_atr': True, 'bull_use_adx': True, 'bull_use_spike': False, 'bull_rsi_required': True, 'bear_strategy': 'breakout', 'bear_bb_std_mult': 3.1001375748967477, 'bear_rsi_os': 38, 'bear_rsi_ob': 51, 'bear_adx_thresh': 23.450697899757685, 'bear_atr_min_pct': 0.008031251829901893, 'bear_atr_max_pct': 0.10051406877809005, 'bear_tp_mult': 2.5016128992078923, 'bear_tsl_mult': 0.3269312417457986, 'bear_time_stop': 194, 'bear_use_sma': True, 'bear_use_ema': True, 'bear_use_atr': True, 'bear_use_adx': False, 'bear_use_spike': True, 'bear_rsi_required': False, 'sideways_strategy': 'breakout', 'sideways_bb_std_mult': 3.3621917797463015, 'sideways_rsi_os': 29, 'sideways_rsi_ob': 69, 'sideways_adx_thresh': 7.887909009239922, 'sideways_atr_min_pct': 0.014470214691726529, 'sideways_atr_max_pct': 0.14626408940596547, 'sideways_tp_mult': 2.239783169766207, 'sideways_tsl_mult': 0.7535878517608151, 'sideways_time_stop': 143, 'sideways_use_sma': False, 'sideways_use_ema': False, 'sideways_use_atr': False, 'sideways_use_adx': True, 'sideways_use_spike': False, 'sideways_rsi_required': False}.
[I 2025-08-31 11:20:06,249] Trial 186 finished with values: [-0.057442984966615596, 0.05712756541055615] and parameters: {'p_sma': 42, 'p_std': 17, 'p_atr': 28, 'p_adx': 17, 'rsi_period': 50, 'ema1': 23, 'ema2': 50, 'slip_atr_k': 0.18735098105165898, 'slip_spread_k': 0.4381037653871455, 'spread_hl_frac': 0.03162722475024614, 'bb_std_mult': 3.196351052767881, 'rsi_os': 40, 'rsi_ob': 85, 'vol_spike': 0.16558996667147802, 'adx_thresh': 23.788384965253535, 'atr_min_pct': 0.002664441899344829, 'atr_max_pct': 0.07880893112943235, 'tp_mult': 2.678112314574883, 'tsl_mult': 0.054645562077276395, 'strategy': 'breakout', 'time_stop': 59, 'use_sma': False, 'use_atr': True, 'use_adx': True, 'use_ema': False, 'use_spike': False, 'rsi_required': True, 'edge_k': 0.39302863495608337, 'edge_cap': 0.23461595096054738, 'bull_strategy': 'breakout', 'bull_bb_std_mult': 0.8738642139428453, 'bull_rsi_os': 24, 'bull_rsi_ob': 59, 'bull_adx_thresh': 11.116549515930954, 'bull_atr_min_pct': 0.027058599375336983, 'bull_atr_max_pct': 0.025512715815140335, 'bull_tp_mult': 1.5218461633795604, 'bull_tsl_mult': 0.7548541365078676, 'bull_time_stop': 143, 'bull_use_sma': False, 'bull_use_ema': True, 'bull_use_atr': True, 'bull_use_adx': True, 'bull_use_spike': False, 'bull_rsi_required': True, 'bear_strategy': 'breakout', 'bear_bb_std_mult': 1.2595756928043063, 'bear_rsi_os': 38, 'bear_rsi_ob': 84, 'bear_adx_thresh': 5.625783957507723, 'bear_atr_min_pct': 0.01299502287698658, 'bear_atr_max_pct': 0.11646398040242965, 'bear_tp_mult': 2.483317746459904, 'bear_tsl_mult': 0.42896646076947054, 'bear_time_stop': 234, 'bear_use_sma': True, 'bear_use_ema': False, 'bear_use_atr': True, 'bear_use_adx': False, 'bear_use_spike': True, 'bear_rsi_required': False, 'sideways_strategy': 'breakout', 'sideways_bb_std_mult': 2.946767874780721, 'sideways_rsi_os': 35, 'sideways_rsi_ob': 72, 'sideways_adx_thresh': 7.843869334104428, 'sideways_atr_min_pct': 0.0012346475416114267, 'sideways_atr_max_pct': 0.023075450019120994, 'sideways_tp_mult': 1.2824771516510907, 'sideways_tsl_mult': 0.3423878130621296, 'sideways_time_stop': 125, 'sideways_use_sma': False, 'sideways_use_ema': False, 'sideways_use_atr': False, 'sideways_use_adx': True, 'sideways_use_spike': False, 'sideways_rsi_required': True}.
[I 2025-08-31 11:20:06,541] Trial 183 finished with values: [-1000000000.0, 1000000000.0] and parameters: {'p_sma': 41, 'p_std': 8, 'p_atr': 30, 'p_adx': 9, 'rsi_period': 50, 'ema1': 14, 'ema2': 14, 'slip_atr_k': 0.019123224699009293, 'slip_spread_k': 0.0508008219032669, 'spread_hl_frac': 0.031313293618703816, 'bb_std_mult': 2.5617487070220726, 'rsi_os': 36, 'rsi_ob': 85, 'vol_spike': 0.16687840349664818, 'adx_thresh': 31.374348212490702, 'atr_min_pct': 0.0020872705592469188, 'atr_max_pct': 0.07785428334231052, 'tp_mult': 2.2124381341647754, 'tsl_mult': 0.13577161009100153, 'strategy': 'breakout', 'time_stop': 57, 'use_sma': False, 'use_atr': True, 'use_adx': False, 'use_ema': False, 'use_spike': True, 'rsi_required': True, 'edge_k': 1.4347329087077392, 'edge_cap': 0.8982602035408211, 'bull_strategy': 'breakout', 'bull_bb_std_mult': 0.5800445986128568, 'bull_rsi_os': 25, 'bull_rsi_ob': 59, 'bull_adx_thresh': 21.79701844972277, 'bull_atr_min_pct': 0.016947594093285924, 'bull_atr_max_pct': 0.09590407864764311, 'bull_tp_mult': 2.6254158793599, 'bull_tsl_mult': 0.32922207912521056, 'bull_time_stop': 282, 'bull_use_sma': True, 'bull_use_ema': True, 'bull_use_atr': True, 'bull_use_adx': True, 'bull_use_spike': False, 'bull_rsi_required': True, 'bear_strategy': 'breakout', 'bear_bb_std_mult': 3.2929329442985464, 'bear_rsi_os': 37, 'bear_rsi_ob': 78, 'bear_adx_thresh': 22.871267832389282, 'bear_atr_min_pct': 0.007970385722805706, 'bear_atr_max_pct': 0.11599581784004047, 'bear_tp_mult': 1.6242549123849597, 'bear_tsl_mult': 0.4227931571860879, 'bear_time_stop': 79, 'bear_use_sma': True, 'bear_use_ema': True, 'bear_use_atr': True, 'bear_use_adx': False, 'bear_use_spike': True, 'bear_rsi_required': False, 'sideways_strategy': 'breakout', 'sideways_bb_std_mult': 1.2578630727685618, 'sideways_rsi_os': 29, 'sideways_rsi_ob': 72, 'sideways_adx_thresh': 7.934910000193613, 'sideways_atr_min_pct': 0.003168708695967932, 'sideways_atr_max_pct': 0.1468743945373024, 'sideways_tp_mult': 1.2892590468834064, 'sideways_tsl_mult': 0.651729170182884, 'sideways_time_stop': 34, 'sideways_use_sma': False, 'sideways_use_ema': False, 'sideways_use_atr': False, 'sideways_use_adx': True, 'sideways_use_spike': False, 'sideways_rsi_required': False}.
[I 2025-08-31 11:20:36,647] Trial 190 finished with values: [-0.19954815486637867, 0.19885810308776916] and parameters: {'p_sma': 45, 'p_std': 18, 'p_atr': 24, 'p_adx': 21, 'rsi_period': 56, 'ema1': 13, 'ema2': 24, 'slip_atr_k': 0.17026300939253144, 'slip_spread_k': 0.909899764828634, 'spread_hl_frac': 0.004646356245211151, 'bb_std_mult': 2.305897265077009, 'rsi_os': 41, 'rsi_ob': 82, 'vol_spike': 0.19879680053538867, 'adx_thresh': 30.507210947020756, 'atr_min_pct': 0.0014397186075910933, 'atr_max_pct': 0.07461398320373992, 'tp_mult': 1.0164730120025836, 'tsl_mult': 0.10155592643317447, 'strategy': 'breakout', 'time_stop': 293, 'use_sma': True, 'use_atr': True, 'use_adx': True, 'use_ema': False, 'use_spike': False, 'rsi_required': True, 'edge_k': 1.3022711152461977, 'edge_cap': 0.9103471152357187, 'bull_strategy': 'breakout', 'bull_bb_std_mult': 1.1024975701144686, 'bull_rsi_os': 51, 'bull_rsi_ob': 58, 'bull_adx_thresh': 12.26731893878473, 'bull_atr_min_pct': 0.018970928042927555, 'bull_atr_max_pct': 0.010088086533730972, 'bull_tp_mult': 1.5961480316905565, 'bull_tsl_mult': 0.6486879492123105, 'bull_time_stop': 30, 'bull_use_sma': False, 'bull_use_ema': False, 'bull_use_atr': True, 'bull_use_adx': True, 'bull_use_spike': False, 'bull_rsi_required': False, 'bear_strategy': 'breakout', 'bear_bb_std_mult': 1.535424801181888, 'bear_rsi_os': 47, 'bear_rsi_ob': 57, 'bear_adx_thresh': 32.999230747727886, 'bear_atr_min_pct': 0.0007159435284629836, 'bear_atr_max_pct': 0.14552085015289218, 'bear_tp_mult': 2.016701797780934, 'bear_tsl_mult': 0.6309573617351991, 'bear_time_stop': 71, 'bear_use_sma': True, 'bear_use_ema': False, 'bear_use_atr': True, 'bear_use_adx': False, 'bear_use_spike': True, 'bear_rsi_required': False, 'sideways_strategy': 'breakout', 'sideways_bb_std_mult': 3.0845868286588702, 'sideways_rsi_os': 5, 'sideways_rsi_ob': 64, 'sideways_adx_thresh': 32.651500761625684, 'sideways_atr_min_pct': 0.017650713555566237, 'sideways_atr_max_pct': 0.01523850885275686, 'sideways_tp_mult': 2.1722941474359088, 'sideways_tsl_mult': 0.6900364489060143, 'sideways_time_stop': 163, 'sideways_use_sma': False, 'sideways_use_ema': False, 'sideways_use_atr': False, 'sideways_use_adx': True, 'sideways_use_spike': False, 'sideways_rsi_required': True}.
[I 2025-08-31 11:20:37,236] Trial 189 finished with values: [-0.12555291313329797, 0.1247791059603308] and parameters: {'p_sma': 46, 'p_std': 19, 'p_atr': 26, 'p_adx': 9, 'rsi_period': 56, 'ema1': 13, 'ema2': 23, 'slip_atr_k': 0.1483563060468211, 'slip_spread_k': 0.6173626564495442, 'spread_hl_frac': 0.042393503517696385, 'bb_std_mult': 2.6499786969064436, 'rsi_os': 41, 'rsi_ob': 84, 'vol_spike': 0.2900197974940739, 'adx_thresh': 30.477174777650582, 'atr_min_pct': 0.0014839257048513208, 'atr_max_pct': 0.10145897935682596, 'tp_mult': 1.0319972030133286, 'tsl_mult': 0.018837570407723284, 'strategy': 'breakout', 'time_stop': 294, 'use_sma': False, 'use_atr': True, 'use_adx': True, 'use_ema': False, 'use_spike': False, 'rsi_required': True, 'edge_k': 0.3249670925627651, 'edge_cap': 0.9008248332471902, 'bull_strategy': 'breakout', 'bull_bb_std_mult': 1.097711122853006, 'bull_rsi_os': 53, 'bull_rsi_ob': 58, 'bull_adx_thresh': 10.093129795743222, 'bull_atr_min_pct': 0.023325640672636486, 'bull_atr_max_pct': 0.09494929735132715, 'bull_tp_mult': 1.5992657299744784, 'bull_tsl_mult': 0.2750345384690752, 'bull_time_stop': 122, 'bull_use_sma': True, 'bull_use_ema': False, 'bull_use_atr': True, 'bull_use_adx': True, 'bull_use_spike': False, 'bull_rsi_required': False, 'bear_strategy': 'breakout', 'bear_bb_std_mult': 1.4512889186858273, 'bear_rsi_os': 35, 'bear_rsi_ob': 55, 'bear_adx_thresh': 33.63772157578471, 'bear_atr_min_pct': 0.0008591919982204668, 'bear_atr_max_pct': 0.010003009669057414, 'bear_tp_mult': 2.649611014920488, 'bear_tsl_mult': 0.6242870156484231, 'bear_time_stop': 65, 'bear_use_sma': True, 'bear_use_ema': False, 'bear_use_atr': True, 'bear_use_adx': False, 'bear_use_spike': True, 'bear_rsi_required': False, 'sideways_strategy': 'breakout', 'sideways_bb_std_mult': 1.2465108417047717, 'sideways_rsi_os': 50, 'sideways_rsi_ob': 71, 'sideways_adx_thresh': 9.123974713765428, 'sideways_atr_min_pct': 0.002888891582907926, 'sideways_atr_max_pct': 0.01566790941439817, 'sideways_tp_mult': 1.913130878104809, 'sideways_tsl_mult': 0.7205441882521997, 'sideways_time_stop': 157, 'sideways_use_sma': False, 'sideways_use_ema': False, 'sideways_use_atr': False, 'sideways_use_adx': True, 'sideways_use_spike': False, 'sideways_rsi_required': True}.
