[I 2025-08-31 11:18:30,298] Trial 174 finished with values: [-0.01739645767688469, 0.01864470307856808] and parameters: {'p_sma': 43, 'p_std': 29, 'p_atr': 27, 'p_adx': 7, 'rsi_period': 54, 'ema1': 15, 'ema2': 17, 'slip_atr_k': 0.005455554299066648, 'slip_spread_k': 0.5477273221332956, 'spread_hl_frac': 0.040516355975064644, 'bb_std_mult': 2.0961386324800495, 'rsi_os': 38, 'rsi_ob': 83, 'vol_spike': 0.29864045204255607, 'adx_thresh': 21.000291795058757, 'atr_min_pct': 0.003115580997236021, 'atr_max_pct': 0.059148208548156195, 'tp_mult': 1.0590081008786363, 'tsl_mult': 0.06614362131537849, 'strategy': 'breakout', 'time_stop': 288, 'use_sma': True, 'use_atr': True, 'use_adx': True, 'use_ema': False, 'use_spike': False, 'rsi_required': True, 'edge_k': 0.2545683545233015, 'edge_cap': 0.9991253118940693, 'bull_strategy': 'breakout', 'bull_bb_std_mult': 1.5243696938507671, 'bull_rsi_os': 25, 'bull_rsi_ob': 56, 'bull_adx_thresh': 9.295731789616884, 'bull_atr_min_pct': 0.004280700396890217, 'bull_atr_max_pct': 0.1494137644161343, 'bull_tp_mult': 2.739531833220906, 'bull_tsl_mult': 0.33853067253296953, 'bull_time_stop': 67, 'bull_use_sma': True, 'bull_use_ema': False, 'bull_use_atr': True, 'bull_use_adx': True, 'bull_use_spike': False, 'bull_rsi_required': True, 'bear_strategy': 'breakout', 'bear_bb_std_mult': 0.8906762800324478, 'bear_rsi_os': 18, 'bear_rsi_ob': 92, 'bear_adx_thresh': 34.01290790195099, 'bear_atr_min_pct': 0.02003433947768659, 'bear_atr_max_pct': 0.1035830957728031, 'bear_tp_mult': 2.454627464378621, 'bear_tsl_mult': 0.38533782861165805, 'bear_time_stop': 83, 'bear_use_sma': True, 'bear_use_ema': False, 'bear_use_atr': True, 'bear_use_adx': False, 'bear_use_spike': True, 'bear_rsi_required': False, 'sideways_strategy': 'breakout', 'sideways_bb_std_mult': 1.0637766172498786, 'sideways_rsi_os': 33, 'sideways_rsi_ob': 73, 'sideways_adx_thresh': 6.869953818210296, 'sideways_atr_min_pct': 0.0017817900910732881, 'sideways_atr_max_pct': 0.11148514150648567, 'sideways_tp_mult': 2.1835488736463615, 'sideways_tsl_mult': 0.20773209405979415, 'sideways_time_stop': 20, 'sideways_use_sma': False, 'sideways_use_ema': False, 'sideways_use_atr': False, 'sideways_use_adx': True, 'sideways_use_spike': False, 'sideways_rsi_required': True}.
[I 2025-08-31 11:18:30,424] Trial 172 finished with values: [-1000000000.0, 1000000000.0] and parameters: {'p_sma': 43, 'p_std': 25, 'p_atr': 11, 'p_adx': 20, 'rsi_period': 56, 'ema1': 20, 'ema2': 12, 'slip_atr_k': 0.006032355556180952, 'slip_spread_k': 0.006634898320125093, 'spread_hl_frac': 0.03997073017442443, 'bb_std_mult': 2.3797320817442356, 'rsi_os': 35, 'rsi_ob': 78, 'vol_spike': 0.29753631989458285, 'adx_thresh': 32.003379802216315, 'atr_min_pct': 0.004369437579819024, 'atr_max_pct': 0.027366611478824895, 'tp_mult': 2.6047043108296846, 'tsl_mult': 0.07571605348851107, 'strategy': 'breakout', 'time_stop': 44, 'use_sma': False, 'use_atr': True, 'use_adx': True, 'use_ema': False, 'use_spike': False, 'rsi_required': True, 'edge_k': 1.5405582875402863, 'edge_cap': 0.2993377833253661, 'bull_strategy': 'breakout', 'bull_bb_std_mult': 0.9779865709561111, 'bull_rsi_os': 26, 'bull_rsi_ob': 56, 'bull_adx_thresh': 15.548866161604852, 'bull_atr_min_pct': 0.0040245963945792496, 'bull_atr_max_pct': 0.14972310244799983, 'bull_tp_mult': 1.3775644359482566, 'bull_tsl_mult': 0.6944657676986433, 'bull_time_stop': 13, 'bull_use_sma': True, 'bull_use_ema': False, 'bull_use_atr': True, 'bull_use_adx': True, 'bull_use_spike': False, 'bull_rsi_required': True, 'bear_strategy': 'breakout', 'bear_bb_std_mult': 2.7736839022123547, 'bear_rsi_os': 18, 'bear_rsi_ob': 80, 'bear_adx_thresh': 17.896459530983332, 'bear_atr_min_pct': 0.02053834155038661, 'bear_atr_max_pct': 0.12857578197954106, 'bear_tp_mult': 2.458008787388951, 'bear_tsl_mult': 0.24975531082564856, 'bear_time_stop': 244, 'bear_use_sma': True, 'bear_use_ema': False, 'bear_use_atr': True, 'bear_use_adx': False, 'bear_use_spike': True, 'bear_rsi_required': False, 'sideways_strategy': 'breakout', 'sideways_bb_std_mult': 1.0427965733504543, 'sideways_rsi_os': 34, 'sideways_rsi_ob': 73, 'sideways_adx_thresh': 22.225044901187395, 'sideways_atr_min_pct': 0.009287097785293184, 'sideways_atr_max_pct': 0.021963899356782415, 'sideways_tp_mult': 2.1863289627220364, 'sideways_tsl_mult': 0.2060577463585448, 'sideways_time_stop': 22, 'sideways_use_sma': False, 'sideways_use_ema': False, 'sideways_use_atr': False, 'sideways_use_adx': True, 'sideways_use_spike': False, 'sideways_rsi_required': True}.
[I 2025-08-31 11:18:30,459] Trial 173 finished with values: [-1000000000.0, 1000000000.0] and parameters: {'p_sma': 59, 'p_std': 25, 'p_atr': 11, 'p_adx': 20, 'rsi_period': 63, 'ema1': 13, 'ema2': 12, 'slip_atr_k': 0.21782360172721088, 'slip_spread_k': 0.5525674845361008, 'spread_hl_frac': 0.039882580087501764, 'bb_std_mult': 0.51336736354587, 'rsi_os': 44, 'rsi_ob': 79, 'vol_spike': 0.1761346270141182, 'adx_thresh': 20.899403021905098, 'atr_min_pct': 0.004240487966656133, 'atr_max_pct': 0.06393740005412195, 'tp_mult': 2.2982981926264063, 'tsl_mult': 0.0705890259682365, 'strategy': 'breakout', 'time_stop': 41, 'use_sma': True, 'use_atr': True, 'use_adx': True, 'use_ema': False, 'use_spike': False, 'rsi_required': True, 'edge_k': 1.5373709882721263, 'edge_cap': 0.8675708011750165, 'bull_strategy': 'breakout', 'bull_bb_std_mult': 0.8782976660997168, 'bull_rsi_os': 25, 'bull_rsi_ob': 56, 'bull_adx_thresh': 34.221241899895944, 'bull_atr_min_pct': 0.018608398050402482, 'bull_atr_max_pct': 0.14940597711996922, 'bull_tp_mult': 2.995943583474076, 'bull_tsl_mult': 0.5267629505091397, 'bull_time_stop': 158, 'bull_use_sma': False, 'bull_use_ema': False, 'bull_use_atr': True, 'bull_use_adx': True, 'bull_use_spike': False, 'bull_rsi_required': True, 'bear_strategy': 'breakout', 'bear_bb_std_mult': 2.3742094266363205, 'bear_rsi_os': 18, 'bear_rsi_ob': 55, 'bear_adx_thresh': 20.737711630698055, 'bear_atr_min_pct': 0.011796968909976616, 'bear_atr_max_pct': 0.10278873803017652, 'bear_tp_mult': 2.447306951191665, 'bear_tsl_mult': 0.310954634380072, 'bear_time_stop': 84, 'bear_use_sma': True, 'bear_use_ema': False, 'bear_use_atr': True, 'bear_use_adx': False, 'bear_use_spike': True, 'bear_rsi_required': False, 'sideways_strategy': 'breakout', 'sideways_bb_std_mult': 1.0483125095858923, 'sideways_rsi_os': 28, 'sideways_rsi_ob': 73, 'sideways_adx_thresh': 31.60253468191052, 'sideways_atr_min_pct': 0.016985069364397705, 'sideways_atr_max_pct': 0.018205424184057288, 'sideways_tp_mult': 2.2011184809278137, 'sideways_tsl_mult': 0.696433113254952, 'sideways_time_stop': 259, 'sideways_use_sma': False, 'sideways_use_ema': False, 'sideways_use_atr': False, 'sideways_use_adx': True, 'sideways_use_spike': False, 'sideways_rsi_required': True}.
[I 2025-08-31 11:18:30,677] Trial 171 finished with values: [-0.03922596743558604, 0.0392033901714838] and parameters: {'p_sma': 31, 'p_std': 20, 'p_atr': 15, 'p_adx': 12, 'rsi_period': 56, 'ema1': 12, 'ema2': 10, 'slip_atr_k': 0.04041840239976668, 'slip_spread_k': 0.248790534928222, 'spread_hl_frac': 0.035018281012457256, 'bb_std_mult': 2.3858066263872937, 'rsi_os': 42, 'rsi_ob': 79, 'vol_spike': 0.14714968171525653, 'adx_thresh': 32.00452256534455, 'atr_min_pct': 0.0205224296343813, 'atr_max_pct': 0.07026148813597236, 'tp_mult': 2.2984543828493362, 'tsl_mult': 0.08382401141324769, 'strategy': 'breakout', 'time_stop': 42, 'use_sma': False, 'use_atr': True, 'use_adx': True, 'use_ema': False, 'use_spike': False, 'rsi_required': True, 'edge_k': 0.23605389642577673, 'edge_cap': 0.06522149494091112, 'bull_strategy': 'breakout', 'bull_bb_std_mult': 1.3465811061225208, 'bull_rsi_os': 26, 'bull_rsi_ob': 56, 'bull_adx_thresh': 10.207023448236935, 'bull_atr_min_pct': 0.0041019277751564946, 'bull_atr_max_pct': 0.10995800679869513, 'bull_tp_mult': 1.1762219984058968, 'bull_tsl_mult': 0.7272193057954964, 'bull_time_stop': 132, 'bull_use_sma': False, 'bull_use_ema': False, 'bull_use_atr': True, 'bull_use_adx': True, 'bull_use_spike': False, 'bull_rsi_required': True, 'bear_strategy': 'breakout', 'bear_bb_std_mult': 2.1872132016740333, 'bear_rsi_os': 18, 'bear_rsi_ob': 55, 'bear_adx_thresh': 6.616417626635105, 'bear_atr_min_pct': 0.011829831370992945, 'bear_atr_max_pct': 0.12562077566305552, 'bear_tp_mult': 2.5531940370692663, 'bear_tsl_mult': 0.4037586615834083, 'bear_time_stop': 86, 'bear_use_sma': True, 'bear_use_ema': False, 'bear_use_atr': True, 'bear_use_adx': False, 'bear_use_spike': True, 'bear_rsi_required': False, 'sideways_strategy': 'breakout', 'sideways_bb_std_mult': 1.052279316138844, 'sideways_rsi_os': 43, 'sideways_rsi_ob': 52, 'sideways_adx_thresh': 15.913992650585376, 'sideways_atr_min_pct': 0.0032297338225836954, 'sideways_atr_max_pct': 0.11486508612041046, 'sideways_tp_mult': 2.20150149001741, 'sideways_tsl_mult': 0.832590818111528, 'sideways_time_stop': 5, 'sideways_use_sma': False, 'sideways_use_ema': False, 'sideways_use_atr': False, 'sideways_use_adx': True, 'sideways_use_spike': False, 'sideways_rsi_required': True}.
[I 2025-08-31 11:19:02,269] Trial 177 finished with values: [-1000000000.0, 1000000000.0] and parameters: {'p_sma': 32, 'p_std': 28, 'p_atr': 9, 'p_adx': 16, 'rsi_period': 54, 'ema1': 15, 'ema2': 53, 'slip_atr_k': 0.049648579677709116, 'slip_spread_k': 0.22805763601105195, 'spread_hl_frac': 0.044809716990235136, 'bb_std_mult': 2.295151891629912, 'rsi_os': 38, 'rsi_ob': 83, 'vol_spike': 0.21541001112653171, 'adx_thresh': 19.29972187964904, 'atr_min_pct': 0.003217248340293282, 'atr_max_pct': 0.07051859834143362, 'tp_mult': 1.0491625939163276, 'tsl_mult': 0.09976747125248539, 'strategy': 'mean_reversion', 'time_stop': 15, 'use_sma': False, 'use_atr': True, 'use_adx': True, 'use_ema': False, 'use_spike': False, 'rsi_required': True, 'edge_k': 0.233970801574106, 'edge_cap': 0.8791838930840815, 'bull_strategy': 'breakout', 'bull_bb_std_mult': 1.3540701235455528, 'bull_rsi_os': 22, 'bull_rsi_ob': 59, 'bull_adx_thresh': 9.390848459851865, 'bull_atr_min_pct': 0.01786769922287291, 'bull_atr_max_pct': 0.12368410240481065, 'bull_tp_mult': 1.5450183540618543, 'bull_tsl_mult': 0.9732937648084737, 'bull_time_stop': 145, 'bull_use_sma': True, 'bull_use_ema': False, 'bull_use_atr': True, 'bull_use_adx': True, 'bull_use_spike': False, 'bull_rsi_required': True, 'bear_strategy': 'mean_reversion', 'bear_bb_std_mult': 2.3092033242909764, 'bear_rsi_os': 31, 'bear_rsi_ob': 54, 'bear_adx_thresh': 32.75529471238616, 'bear_atr_min_pct': 0.009588717919159566, 'bear_atr_max_pct': 0.14183456679377457, 'bear_tp_mult': 2.5940349739796726, 'bear_tsl_mult': 0.3494295986175723, 'bear_time_stop': 78, 'bear_use_sma': True, 'bear_use_ema': False, 'bear_use_atr': True, 'bear_use_adx': False, 'bear_use_spike': True, 'bear_rsi_required': False, 'sideways_strategy': 'mean_reversion', 'sideways_bb_std_mult': 0.907826532700581, 'sideways_rsi_os': 31, 'sideways_rsi_ob': 93, 'sideways_adx_thresh': 23.902006669277817, 'sideways_atr_min_pct': 0.0018258287298433488, 'sideways_atr_max_pct': 0.018637748132904575, 'sideways_tp_mult': 1.347188270798188, 'sideways_tsl_mult': 0.7312582441434213, 'sideways_time_stop': 5, 'sideways_use_sma': False, 'sideways_use_ema': False, 'sideways_use_atr': False, 'sideways_use_adx': True, 'sideways_use_spike': True, 'sideways_rsi_required': True}.
[I 2025-08-31 11:19:02,387] Trial 178 finished with values: [-1000000000.0, 1000000000.0] and parameters: {'p_sma': 43, 'p_std': 29, 'p_atr': 27, 'p_adx': 24, 'rsi_period': 54, 'ema1': 15, 'ema2': 53, 'slip_atr_k': 0.027552278046684406, 'slip_spread_k': 0.1577990207542817, 'spread_hl_frac': 0.04895393994954181, 'bb_std_mult': 2.0816265050414966, 'rsi_os': 38, 'rsi_ob': 83, 'vol_spike': 0.2637905398284055, 'adx_thresh': 6.232368257237173, 'atr_min_pct': 0.0033014004506035123, 'atr_max_pct': 0.07408343677248369, 'tp_mult': 1.0111507088287233, 'tsl_mult': 0.050770034324826935, 'strategy': 'mean_reversion', 'time_stop': 286, 'use_sma': True, 'use_atr': True, 'use_adx': True, 'use_ema': False, 'use_spike': False, 'rsi_required': True, 'edge_k': 0.2789498489038341, 'edge_cap': 0.9994331770601957, 'bull_strategy': 'breakout', 'bull_bb_std_mult': 1.5254434604034888, 'bull_rsi_os': 41, 'bull_rsi_ob': 85, 'bull_adx_thresh': 27.61663829783084, 'bull_atr_min_pct': 0.017684663010327707, 'bull_atr_max_pct': 0.12226236193908024, 'bull_tp_mult': 2.545691052389253, 'bull_tsl_mult': 0.4903072998416438, 'bull_time_stop': 64, 'bull_use_sma': True, 'bull_use_ema': False, 'bull_use_atr': True, 'bull_use_adx': True, 'bull_use_spike': False, 'bull_rsi_required': True, 'bear_strategy': 'mean_reversion', 'bear_bb_std_mult': 2.2991031796335566, 'bear_rsi_os': 17, 'bear_rsi_ob': 92, 'bear_adx_thresh': 34.3702111648316, 'bear_atr_min_pct': 0.009612865110430293, 'bear_atr_max_pct': 0.14094687782718474, 'bear_tp_mult': 2.5948549385289117, 'bear_tsl_mult': 0.3527672949173351, 'bear_time_stop': 97, 'bear_use_sma': True, 'bear_use_ema': False, 'bear_use_atr': True, 'bear_use_adx': False, 'bear_use_spike': True, 'bear_rsi_required': False, 'sideways_strategy': 'mean_reversion', 'sideways_bb_std_mult': 1.176766945440535, 'sideways_rsi_os': 31, 'sideways_rsi_ob': 71, 'sideways_adx_thresh': 6.822873255258974, 'sideways_atr_min_pct': 0.001994684683881125, 'sideways_atr_max_pct': 0.019580648470992605, 'sideways_tp_mult': 2.121894662944318, 'sideways_tsl_mult': 0.5953607669611036, 'sideways_time_stop': 238, 'sideways_use_sma': False, 'sideways_use_ema': False, 'sideways_use_atr': False, 'sideways_use_adx': True, 'sideways_use_spike': True, 'sideways_rsi_required': True}.
[I 2025-08-31 11:19:02,581] Trial 175 finished with values: [-1000000000.0, 1000000000.0] and parameters: {'p_sma': 31, 'p_std': 14, 'p_atr': 9, 'p_adx': 16, 'rsi_period': 54, 'ema1': 15, 'ema2': 17, 'slip_atr_k': 0.02745842914581252, 'slip_spread_k': 0.15983434799508622, 'spread_hl_frac': 0.04907946819422068, 'bb_std_mult': 2.0645286012347372, 'rsi_os': 38, 'rsi_ob': 69, 'vol_spike': 0.2141645273457991, 'adx_thresh': 32.02794797314924, 'atr_min_pct': 0.0033685454030005124, 'atr_max_pct': 0.07147177632800042, 'tp_mult': 2.111518401286181, 'tsl_mult': 0.7673551168951409, 'strategy': 'mean_reversion', 'time_stop': 299, 'use_sma': False, 'use_atr': True, 'use_adx': True, 'use_ema': False, 'use_spike': False, 'rsi_required': True, 'edge_k': 0.2997366235372124, 'edge_cap': 0.8797382987093824, 'bull_strategy': 'breakout', 'bull_bb_std_mult': 1.3552790203422593, 'bull_rsi_os': 55, 'bull_rsi_ob': 85, 'bull_adx_thresh': 25.337856869172462, 'bull_atr_min_pct': 0.01892043705697772, 'bull_atr_max_pct': 0.1080889596802184, 'bull_tp_mult': 2.276475690759495, 'bull_tsl_mult': 0.4832783584856972, 'bull_time_stop': 147, 'bull_use_sma': True, 'bull_use_ema': False, 'bull_use_atr': True, 'bull_use_adx': True, 'bull_use_spike': False, 'bull_rsi_required': True, 'bear_strategy': 'mean_reversion', 'bear_bb_std_mult': 3.591445810729841, 'bear_rsi_os': 42, 'bear_rsi_ob': 54, 'bear_adx_thresh': 32.740610949725124, 'bear_atr_min_pct': 0.009614110964453861, 'bear_atr_max_pct': 0.1395844670384446, 'bear_tp_mult': 1.2964647327858323, 'bear_tsl_mult': 0.35672134248007437, 'bear_time_stop': 85, 'bear_use_sma': True, 'bear_use_ema': False, 'bear_use_atr': True, 'bear_use_adx': False, 'bear_use_spike': True, 'bear_rsi_required': False, 'sideways_strategy': 'mean_reversion', 'sideways_bb_std_mult': 0.9365668121754593, 'sideways_rsi_os': 31, 'sideways_rsi_ob': 94, 'sideways_adx_thresh': 7.2620574399427955, 'sideways_atr_min_pct': 0.012773718150445026, 'sideways_atr_max_pct': 0.11293925555933979, 'sideways_tp_mult': 2.108961509800027, 'sideways_tsl_mult': 0.821946278460504, 'sideways_time_stop': 17, 'sideways_use_sma': False, 'sideways_use_ema': False, 'sideways_use_atr': False, 'sideways_use_adx': True, 'sideways_use_spike': True, 'sideways_rsi_required': True}.
[I 2025-08-31 11:19:02,581] Trial 176 finished with values: [-1000000000.0, 1000000000.0] and parameters: {'p_sma': 7, 'p_std': 33, 'p_atr': 9, 'p_adx': 16, 'rsi_period': 54, 'ema1': 15, 'ema2': 17, 'slip_atr_k': 0.031006589238030787, 'slip_spread_k': 0.15995806991210426, 'spread_hl_frac': 0.049039949590233556, 'bb_std_mult': 2.2524870404280524, 'rsi_os': 38, 'rsi_ob': 59, 'vol_spike': 0.22438177828402517, 'adx_thresh': 18.82970670638691, 'atr_min_pct': 0.003288686174512467, 'atr_max_pct': 0.07138925435232228, 'tp_mult': 1.0520964085899835, 'tsl_mult': 0.8677977089863453, 'strategy': 'mean_reversion', 'time_stop': 300, 'use_sma': False, 'use_atr': True, 'use_adx': True, 'use_ema': False, 'use_spike': False, 'rsi_required': True, 'edge_k': 0.2872931591781134, 'edge_cap': 0.8785148214102568, 'bull_strategy': 'breakout', 'bull_bb_std_mult': 0.7815615809448058, 'bull_rsi_os': 22, 'bull_rsi_ob': 62, 'bull_adx_thresh': 9.47467237686422, 'bull_atr_min_pct': 0.01815632128749044, 'bull_atr_max_pct': 0.12199779569206629, 'bull_tp_mult': 2.75597203159611, 'bull_tsl_mult': 0.8396280263637202, 'bull_time_stop': 234, 'bull_use_sma': True, 'bull_use_ema': False, 'bull_use_atr': True, 'bull_use_adx': True, 'bull_use_spike': False, 'bull_rsi_required': True, 'bear_strategy': 'mean_reversion', 'bear_bb_std_mult': 2.572480123229175, 'bear_rsi_os': 31, 'bear_rsi_ob': 87, 'bear_adx_thresh': 34.31262873210087, 'bear_atr_min_pct': 0.01777523003359338, 'bear_atr_max_pct': 0.10479203894629452, 'bear_tp_mult': 1.7290770440028558, 'bear_tsl_mult': 0.5354570885739464, 'bear_time_stop': 96, 'bear_use_sma': True, 'bear_use_ema': False, 'bear_use_atr': True, 'bear_use_adx': False, 'bear_use_spike': True, 'bear_rsi_required': False, 'sideways_strategy': 'mean_reversion', 'sideways_bb_std_mult': 0.9353173924709645, 'sideways_rsi_os': 30, 'sideways_rsi_ob': 52, 'sideways_adx_thresh': 6.7896524794790345, 'sideways_atr_min_pct': 0.022852154181281933, 'sideways_atr_max_pct': 0.019091900128554082, 'sideways_tp_mult': 2.1170134602992596, 'sideways_tsl_mult': 0.2987135843027994, 'sideways_time_stop': 174, 'sideways_use_sma': False, 'sideways_use_ema': False, 'sideways_use_atr': False, 'sideways_use_adx': True, 'sideways_use_spike': True, 'sideways_rsi_required': True}.
[I 2025-08-31 11:19:33,868] Trial 179 finished with values: [-1000000000.0, 1000000000.0] and parameters: {'p_sma': 44, 'p_std': 14, 'p_atr': 8, 'p_adx': 25, 'rsi_period': 82, 'ema1': 14, 'ema2': 60, 'slip_atr_k': 0.0305850609984899, 'slip_spread_k': 0.31387711683988023, 'spread_hl_frac': 0.049206580810034664, 'bb_std_mult': 2.0610914083234544, 'rsi_os': 12, 'rsi_ob': 59, 'vol_spike': 0.26343092371282795, 'adx_thresh': 30.220946479239426, 'atr_min_pct': 0.022087891712521637, 'atr_max_pct': 0.060348993807682424, 'tp_mult': 2.1276340124550637, 'tsl_mult': 0.7600905707954734, 'strategy': 'mean_reversion', 'time_stop': 300, 'use_sma': True, 'use_atr': True, 'use_adx': False, 'use_ema': False, 'use_spike': False, 'rsi_required': True, 'edge_k': 0.2810583546282383, 'edge_cap': 0.847990513192454, 'bull_strategy': 'breakout', 'bull_bb_std_mult': 1.1647392776724317, 'bull_rsi_os': 21, 'bull_rsi_ob': 61, 'bull_adx_thresh': 25.281201197622774, 'bull_atr_min_pct': 0.008049610367124841, 'bull_atr_max_pct': 0.10793783913921803, 'bull_tp_mult': 2.1256639816885263, 'bull_tsl_mult': 0.4921995800264381, 'bull_time_stop': 246, 'bull_use_sma': True, 'bull_use_ema': False, 'bull_use_atr': True, 'bull_use_adx': True, 'bull_use_spike': False, 'bull_rsi_required': True, 'bear_strategy': 'breakout', 'bear_bb_std_mult': 0.9045517152376744, 'bear_rsi_os': 17, 'bear_rsi_ob': 92, 'bear_adx_thresh': 34.36181223816791, 'bear_atr_min_pct': 0.007067288415836393, 'bear_atr_max_pct': 0.13290586609789995, 'bear_tp_mult': 2.4986457791209555, 'bear_tsl_mult': 0.38263120336899437, 'bear_time_stop': 96, 'bear_use_sma': True, 'bear_use_ema': False, 'bear_use_atr': True, 'bear_use_adx': False, 'bear_use_spike': True, 'bear_rsi_required': False, 'sideways_strategy': 'breakout', 'sideways_bb_std_mult': 2.2345854714985083, 'sideways_rsi_os': 33, 'sideways_rsi_ob': 57, 'sideways_adx_thresh': 6.982576467740281, 'sideways_atr_min_pct': 0.0021279091121155697, 'sideways_atr_max_pct': 0.013592344561411243, 'sideways_tp_mult': 2.1175706640477387, 'sideways_tsl_mult': 0.5955472422342404, 'sideways_time_stop': 175, 'sideways_use_sma': False, 'sideways_use_ema': False, 'sideways_use_atr': False, 'sideways_use_adx': True, 'sideways_use_spike': False, 'sideways_rsi_required': False}.
