[I 2025-08-31 11:08:58,943] Trial 100 finished with values: [-1000000000.0, 1000000000.0] and parameters: {'p_sma': 14, 'p_std': 29, 'p_atr': 23, 'p_adx': 29, 'rsi_period': 10, 'ema1': 9, 'ema2': 34, 'slip_atr_k': 0.1121947742380285, 'slip_spread_k': 0.07092958781446829, 'spread_hl_frac': 0.01421967359669462, 'bb_std_mult': 1.3569696623228433, 'rsi_os': 23, 'rsi_ob': 92, 'vol_spike': 0.007209250418575071, 'adx_thresh': 17.11432726221327, 'atr_min_pct': 0.004522052958417065, 'atr_max_pct': 0.14660135517081957, 'tp_mult': 1.7745265413119375, 'tsl_mult': 0.6137010210271806, 'strategy': 'mean_reversion', 'time_stop': 138, 'use_sma': True, 'use_atr': False, 'use_adx': True, 'use_ema': True, 'use_spike': True, 'rsi_required': False, 'edge_k': 1.1442681698267023, 'edge_cap': 0.6835359153406828, 'bull_strategy': 'mean_reversion', 'bull_bb_std_mult': 1.6085587262070065, 'bull_rsi_os': 8, 'bull_rsi_ob': 53, 'bull_adx_thresh': 5.0309970853076145, 'bull_atr_min_pct': 0.025962369290684302, 'bull_atr_max_pct': 0.08922999704552197, 'bull_tp_mult': 1.6020006001140046, 'bull_tsl_mult': 0.04066785894367863, 'bull_time_stop': 222, 'bull_use_sma': False, 'bull_use_ema': False, 'bull_use_atr': False, 'bull_use_adx': False, 'bull_use_spike': True, 'bull_rsi_required': True, 'bear_strategy': 'breakout', 'bear_bb_std_mult': 1.5387828486800692, 'bear_rsi_os': 21, 'bear_rsi_ob': 54, 'bear_adx_thresh': 9.539734138959158, 'bear_atr_min_pct': 0.026116119885057517, 'bear_atr_max_pct': 0.09184806334539852, 'bear_tp_mult': 1.5829836466750566, 'bear_tsl_mult': 0.7616665068079783, 'bear_time_stop': 10, 'bear_use_sma': False, 'bear_use_ema': True, 'bear_use_atr': False, 'bear_use_adx': True, 'bear_use_spike': False, 'bear_rsi_required': False, 'sideways_strategy': 'breakout', 'sideways_bb_std_mult': 1.6774289288429614, 'sideways_rsi_os': 11, 'sideways_rsi_ob': 87, 'sideways_adx_thresh': 9.423257230197981, 'sideways_atr_min_pct': 0.02373048381978638, 'sideways_atr_max_pct': 0.04894226747895542, 'sideways_tp_mult': 2.811798302366233, 'sideways_tsl_mult': 0.4499065195765912, 'sideways_time_stop': 35, 'sideways_use_sma': False, 'sideways_use_ema': True, 'sideways_use_atr': True, 'sideways_use_adx': False, 'sideways_use_spike': True, 'sideways_rsi_required': True}.
[I 2025-08-31 11:08:59,074] Trial 99 finished with values: [-1000000000.0, 1000000000.0] and parameters: {'p_sma': 21, 'p_std': 28, 'p_atr': 23, 'p_adx': 29, 'rsi_period': 10, 'ema1': 9, 'ema2': 34, 'slip_atr_k': 0.11122478524897274, 'slip_spread_k': 0.30305695875023186, 'spread_hl_frac': 0.014016789492099134, 'bb_std_mult': 1.3221541786759112, 'rsi_os': 23, 'rsi_ob': 94, 'vol_spike': 0.009161489957070126, 'adx_thresh': 9.312426249987853, 'atr_min_pct': 0.016692015747766076, 'atr_max_pct': 0.13495971047621264, 'tp_mult': 1.7794266015468096, 'tsl_mult': 0.6060147664090616, 'strategy': 'breakout', 'time_stop': 138, 'use_sma': False, 'use_atr': True, 'use_adx': True, 'use_ema': False, 'use_spike': False, 'rsi_required': False, 'edge_k': 0.8514890071924631, 'edge_cap': 0.6779485422744838, 'bull_strategy': 'mean_reversion', 'bull_bb_std_mult': 1.2301617443918054, 'bull_rsi_os': 8, 'bull_rsi_ob': 69, 'bull_adx_thresh': 5.276500021311167, 'bull_atr_min_pct': 0.023841774365421328, 'bull_atr_max_pct': 0.043836953633730975, 'bull_tp_mult': 2.648917960514719, 'bull_tsl_mult': 0.04931291916914693, 'bull_time_stop': 56, 'bull_use_sma': False, 'bull_use_ema': False, 'bull_use_atr': False, 'bull_use_adx': False, 'bull_use_spike': True, 'bull_rsi_required': False, 'bear_strategy': 'breakout', 'bear_bb_std_mult': 0.8434252964027278, 'bear_rsi_os': 19, 'bear_rsi_ob': 45, 'bear_adx_thresh': 14.834898585702923, 'bear_atr_min_pct': 0.026159550523899858, 'bear_atr_max_pct': 0.07101751956582823, 'bear_tp_mult': 1.267471278919548, 'bear_tsl_mult': 0.3593562361201922, 'bear_time_stop': 9, 'bear_use_sma': False, 'bear_use_ema': False, 'bear_use_atr': False, 'bear_use_adx': False, 'bear_use_spike': True, 'bear_rsi_required': False, 'sideways_strategy': 'mean_reversion', 'sideways_bb_std_mult': 1.715317656263049, 'sideways_rsi_os': 20, 'sideways_rsi_ob': 65, 'sideways_adx_thresh': 9.873063028381756, 'sideways_atr_min_pct': 0.011903141917447574, 'sideways_atr_max_pct': 0.08179742940698827, 'sideways_tp_mult': 1.9505957458601613, 'sideways_tsl_mult': 0.09455508278357881, 'sideways_time_stop': 167, 'sideways_use_sma': False, 'sideways_use_ema': True, 'sideways_use_atr': False, 'sideways_use_adx': True, 'sideways_use_spike': True, 'sideways_rsi_required': True}.
[I 2025-08-31 11:08:59,186] Trial 101 finished with values: [-0.04058573479165006, 0.03892251125981176] and parameters: {'p_sma': 17, 'p_std': 23, 'p_atr': 22, 'p_adx': 29, 'rsi_period': 50, 'ema1': 8, 'ema2': 20, 'slip_atr_k': 0.17615032449674373, 'slip_spread_k': 0.7791111897631575, 'spread_hl_frac': 0.010544947881017952, 'bb_std_mult': 1.3545621287732492, 'rsi_os': 25, 'rsi_ob': 92, 'vol_spike': 0.010623460564363245, 'adx_thresh': 11.570760559063684, 'atr_min_pct': 0.025754381677240947, 'atr_max_pct': 0.08237030694132781, 'tp_mult': 1.2834711605677245, 'tsl_mult': 0.5579486649813956, 'strategy': 'mean_reversion', 'time_stop': 137, 'use_sma': True, 'use_atr': False, 'use_adx': True, 'use_ema': True, 'use_spike': True, 'rsi_required': False, 'edge_k': 0.8421482222077203, 'edge_cap': 0.6798297167583869, 'bull_strategy': 'mean_reversion', 'bull_bb_std_mult': 2.7602062731740236, 'bull_rsi_os': 7, 'bull_rsi_ob': 69, 'bull_adx_thresh': 5.390832244440005, 'bull_atr_min_pct': 0.023789071985960124, 'bull_atr_max_pct': 0.04332176287898357, 'bull_tp_mult': 1.6152658060028067, 'bull_tsl_mult': 0.08141657215131619, 'bull_time_stop': 219, 'bull_use_sma': False, 'bull_use_ema': False, 'bull_use_atr': False, 'bull_use_adx': False, 'bull_use_spike': True, 'bull_rsi_required': True, 'bear_strategy': 'breakout', 'bear_bb_std_mult': 0.8447985144503998, 'bear_rsi_os': 44, 'bear_rsi_ob': 46, 'bear_adx_thresh': 9.935394344246408, 'bear_atr_min_pct': 0.004348369473038714, 'bear_atr_max_pct': 0.09215569656743579, 'bear_tp_mult': 2.251123484406947, 'bear_tsl_mult': 0.762265927629374, 'bear_time_stop': 118, 'bear_use_sma': False, 'bear_use_ema': True, 'bear_use_atr': False, 'bear_use_adx': True, 'bear_use_spike': False, 'bear_rsi_required': True, 'sideways_strategy': 'breakout', 'sideways_bb_std_mult': 1.8694442684832577, 'sideways_rsi_os': 17, 'sideways_rsi_ob': 64, 'sideways_adx_thresh': 6.703797703496884, 'sideways_atr_min_pct': 0.005763666624055006, 'sideways_atr_max_pct': 0.0466490291984339, 'sideways_tp_mult': 1.1324188640155723, 'sideways_tsl_mult': 0.4707206712168647, 'sideways_time_stop': 37, 'sideways_use_sma': True, 'sideways_use_ema': True, 'sideways_use_atr': True, 'sideways_use_adx': False, 'sideways_use_spike': True, 'sideways_rsi_required': True}.
[I 2025-08-31 11:09:29,938] Trial 102 finished with values: [-1000000000.0, 1000000000.0] and parameters: {'p_sma': 21, 'p_std': 53, 'p_atr': 10, 'p_adx': 29, 'rsi_period': 47, 'ema1': 28, 'ema2': 34, 'slip_atr_k': 0.12384103098466977, 'slip_spread_k': 0.4803328725356572, 'spread_hl_frac': 0.010688457418531458, 'bb_std_mult': 1.4842260369801479, 'rsi_os': 25, 'rsi_ob': 94, 'vol_spike': 0.12405177900263997, 'adx_thresh': 9.34526166601791, 'atr_min_pct': 0.026346643599319968, 'atr_max_pct': 0.14718175686389412, 'tp_mult': 1.281658732508472, 'tsl_mult': 0.5894403892731845, 'strategy': 'mean_reversion', 'time_stop': 133, 'use_sma': True, 'use_atr': False, 'use_adx': True, 'use_ema': True, 'use_spike': True, 'rsi_required': False, 'edge_k': 1.1284702499669554, 'edge_cap': 0.31673793565222597, 'bull_strategy': 'mean_reversion', 'bull_bb_std_mult': 2.033370524323904, 'bull_rsi_os': 31, 'bull_rsi_ob': 57, 'bull_adx_thresh': 9.317322464704688, 'bull_atr_min_pct': 0.011582879372806998, 'bull_atr_max_pct': 0.07090387702918853, 'bull_tp_mult': 1.6082182386173118, 'bull_tsl_mult': 0.14152977713432774, 'bull_time_stop': 220, 'bull_use_sma': False, 'bull_use_ema': True, 'bull_use_atr': False, 'bull_use_adx': False, 'bull_use_spike': True, 'bull_rsi_required': True, 'bear_strategy': 'breakout', 'bear_bb_std_mult': 1.1608851267565727, 'bear_rsi_os': 27, 'bear_rsi_ob': 78, 'bear_adx_thresh': 16.50408277723868, 'bear_atr_min_pct': 0.027548861265431303, 'bear_atr_max_pct': 0.09208437981123116, 'bear_tp_mult': 1.019426391698612, 'bear_tsl_mult': 0.7653458358405134, 'bear_time_stop': 19, 'bear_use_sma': True, 'bear_use_ema': True, 'bear_use_atr': False, 'bear_use_adx': True, 'bear_use_spike': False, 'bear_rsi_required': True, 'sideways_strategy': 'breakout', 'sideways_bb_std_mult': 1.869843281823738, 'sideways_rsi_os': 20, 'sideways_rsi_ob': 85, 'sideways_adx_thresh': 18.017686717382347, 'sideways_atr_min_pct': 0.005805952533149667, 'sideways_atr_max_pct': 0.09133950678348562, 'sideways_tp_mult': 2.652815680372592, 'sideways_tsl_mult': 0.06385428992772903, 'sideways_time_stop': 37, 'sideways_use_sma': True, 'sideways_use_ema': True, 'sideways_use_atr': True, 'sideways_use_adx': False, 'sideways_use_spike': False, 'sideways_rsi_required': True}.
[I 2025-08-31 11:09:30,073] Trial 104 finished with values: [-1000000000.0, 1000000000.0] and parameters: {'p_sma': 44, 'p_std': 55, 'p_atr': 8, 'p_adx': 27, 'rsi_period': 51, 'ema1': 10, 'ema2': 52, 'slip_atr_k': 0.1238501663662758, 'slip_spread_k': 0.7986935138662452, 'spread_hl_frac': 0.04781361628054408, 'bb_std_mult': 1.460581612491149, 'rsi_os': 25, 'rsi_ob': 66, 'vol_spike': 0.22064647067801763, 'adx_thresh': 12.710583789992182, 'atr_min_pct': 0.014913493758050619, 'atr_max_pct': 0.12925865590917568, 'tp_mult': 1.3249122075052633, 'tsl_mult': 0.5810627981221397, 'strategy': 'mean_reversion', 'time_stop': 52, 'use_sma': True, 'use_atr': False, 'use_adx': False, 'use_ema': True, 'use_spike': False, 'rsi_required': False, 'edge_k': 0.993317606566885, 'edge_cap': 0.7145997786430578, 'bull_strategy': 'breakout', 'bull_bb_std_mult': 2.0346650354848235, 'bull_rsi_os': 5, 'bull_rsi_ob': 62, 'bull_adx_thresh': 7.845641610479243, 'bull_atr_min_pct': 0.010499600748135968, 'bull_atr_max_pct': 0.11280830063319089, 'bull_tp_mult': 1.8384518786102482, 'bull_tsl_mult': 0.0077821746863111635, 'bull_time_stop': 200, 'bull_use_sma': True, 'bull_use_ema': True, 'bull_use_atr': False, 'bull_use_adx': False, 'bull_use_spike': True, 'bull_rsi_required': True, 'bear_strategy': 'breakout', 'bear_bb_std_mult': 1.2260900155179861, 'bear_rsi_os': 27, 'bear_rsi_ob': 67, 'bear_adx_thresh': 11.446987153715941, 'bear_atr_min_pct': 0.018441548202320343, 'bear_atr_max_pct': 0.08360466544327663, 'bear_tp_mult': 2.2027501576997155, 'bear_tsl_mult': 0.6221740180598367, 'bear_time_stop': 119, 'bear_use_sma': True, 'bear_use_ema': False, 'bear_use_atr': False, 'bear_use_adx': True, 'bear_use_spike': False, 'bear_rsi_required': True, 'sideways_strategy': 'breakout', 'sideways_bb_std_mult': 0.6420329132247686, 'sideways_rsi_os': 16, 'sideways_rsi_ob': 83, 'sideways_adx_thresh': 17.694886371195764, 'sideways_atr_min_pct': 0.0057369629922621075, 'sideways_atr_max_pct': 0.13062697757832448, 'sideways_tp_mult': 2.848169650753158, 'sideways_tsl_mult': 0.7757552546666038, 'sideways_time_stop': 46, 'sideways_use_sma': True, 'sideways_use_ema': False, 'sideways_use_atr': True, 'sideways_use_adx': False, 'sideways_use_spike': False, 'sideways_rsi_required': False}.
[I 2025-08-31 11:09:30,624] Trial 103 finished with values: [-1000000000.0, 1000000000.0] and parameters: {'p_sma': 21, 'p_std': 24, 'p_atr': 12, 'p_adx': 27, 'rsi_period': 50, 'ema1': 10, 'ema2': 43, 'slip_atr_k': 0.16085660042477729, 'slip_spread_k': 0.7876251486463834, 'spread_hl_frac': 0.010669849715619852, 'bb_std_mult': 1.4848272536244451, 'rsi_os': 28, 'rsi_ob': 89, 'vol_spike': 0.04533559970910721, 'adx_thresh': 9.375321120759951, 'atr_min_pct': 0.028245245355275294, 'atr_max_pct': 0.1309675042853068, 'tp_mult': 1.28241373415845, 'tsl_mult': 0.596350686167847, 'strategy': 'breakout', 'time_stop': 129, 'use_sma': True, 'use_atr': False, 'use_adx': True, 'use_ema': True, 'use_spike': True, 'rsi_required': False, 'edge_k': 1.0072649121566852, 'edge_cap': 0.9062623879459271, 'bull_strategy': 'breakout', 'bull_bb_std_mult': 2.133543932469185, 'bull_rsi_os': 31, 'bull_rsi_ob': 61, 'bull_adx_thresh': 9.614624561181511, 'bull_atr_min_pct': 0.0032869634347973808, 'bull_atr_max_pct': 0.09495416701034129, 'bull_tp_mult': 2.9472899182441346, 'bull_tsl_mult': 0.15126106795508337, 'bull_time_stop': 55, 'bull_use_sma': False, 'bull_use_ema': True, 'bull_use_atr': False, 'bull_use_adx': False, 'bull_use_spike': True, 'bull_rsi_required': True, 'bear_strategy': 'breakout', 'bear_bb_std_mult': 1.8288718398248316, 'bear_rsi_os': 27, 'bear_rsi_ob': 46, 'bear_adx_thresh': 8.654352512003474, 'bear_atr_min_pct': 0.01454341192146318, 'bear_atr_max_pct': 0.08316581236533883, 'bear_tp_mult': 1.011358050951983, 'bear_tsl_mult': 0.937565015532144, 'bear_time_stop': 212, 'bear_use_sma': True, 'bear_use_ema': True, 'bear_use_atr': False, 'bear_use_adx': True, 'bear_use_spike': False, 'bear_rsi_required': True, 'sideways_strategy': 'breakout', 'sideways_bb_std_mult': 3.5836685493216374, 'sideways_rsi_os': 19, 'sideways_rsi_ob': 93, 'sideways_adx_thresh': 15.375369438065622, 'sideways_atr_min_pct': 0.0059240884515289315, 'sideways_atr_max_pct': 0.11541371249246399, 'sideways_tp_mult': 2.6600958612165417, 'sideways_tsl_mult': 0.2535577261560906, 'sideways_time_stop': 25, 'sideways_use_sma': True, 'sideways_use_ema': True, 'sideways_use_atr': True, 'sideways_use_adx': False, 'sideways_use_spike': False, 'sideways_rsi_required': True}.
[I 2025-08-31 11:09:30,857] Trial 105 finished with values: [-0.051902724910732334, 0.05161853840052421] and parameters: {'p_sma': 44, 'p_std': 55, 'p_atr': 20, 'p_adx': 8, 'rsi_period': 7, 'ema1': 8, 'ema2': 43, 'slip_atr_k': 0.12160652230967443, 'slip_spread_k': 0.4772176081902418, 'spread_hl_frac': 0.010249013286336095, 'bb_std_mult': 1.4924382619070056, 'rsi_os': 25, 'rsi_ob': 52, 'vol_spike': 0.22009945355269728, 'adx_thresh': 12.790617125072067, 'atr_min_pct': 0.025559298309641928, 'atr_max_pct': 0.08571690494150834, 'tp_mult': 1.2881594504017762, 'tsl_mult': 0.5844015581055372, 'strategy': 'mean_reversion', 'time_stop': 237, 'use_sma': True, 'use_atr': False, 'use_adx': True, 'use_ema': True, 'use_spike': True, 'rsi_required': False, 'edge_k': 0.974329133730141, 'edge_cap': 0.6583048560558492, 'bull_strategy': 'breakout', 'bull_bb_std_mult': 2.017341933386458, 'bull_rsi_os': 17, 'bull_rsi_ob': 66, 'bull_adx_thresh': 9.368398700411952, 'bull_atr_min_pct': 0.0010570246323727862, 'bull_atr_max_pct': 0.11244103794877938, 'bull_tp_mult': 1.8391405483730763, 'bull_tsl_mult': 0.07947276567598568, 'bull_time_stop': 179, 'bull_use_sma': True, 'bull_use_ema': True, 'bull_use_atr': False, 'bull_use_adx': False, 'bull_use_spike': True, 'bull_rsi_required': True, 'bear_strategy': 'breakout', 'bear_bb_std_mult': 1.8097883776054193, 'bear_rsi_os': 36, 'bear_rsi_ob': 67, 'bear_adx_thresh': 11.289896722607613, 'bear_atr_min_pct': 0.014682097208573955, 'bear_atr_max_pct': 0.02337938599829685, 'bear_tp_mult': 2.2630726186746943, 'bear_tsl_mult': 0.3160696126443472, 'bear_time_stop': 237, 'bear_use_sma': True, 'bear_use_ema': True, 'bear_use_atr': False, 'bear_use_adx': True, 'bear_use_spike': False, 'bear_rsi_required': True, 'sideways_strategy': 'breakout', 'sideways_bb_std_mult': 1.4105920962582341, 'sideways_rsi_os': 35, 'sideways_rsi_ob': 83, 'sideways_adx_thresh': 5.8210603940352925, 'sideways_atr_min_pct': 0.004384315762818245, 'sideways_atr_max_pct': 0.07555083994150562, 'sideways_tp_mult': 2.653420050303393, 'sideways_tsl_mult': 0.06472875439156037, 'sideways_time_stop': 47, 'sideways_use_sma': True, 'sideways_use_ema': True, 'sideways_use_atr': True, 'sideways_use_adx': False, 'sideways_use_spike': False, 'sideways_rsi_required': True}.
[I 2025-08-31 11:10:01,451] Trial 106 finished with values: [-1000000000.0, 1000000000.0] and parameters: {'p_sma': 28, 'p_std': 23, 'p_atr': 20, 'p_adx': 13, 'rsi_period': 7, 'ema1': 10, 'ema2': 42, 'slip_atr_k': 0.10244936198818874, 'slip_spread_k': 0.7869139751087446, 'spread_hl_frac': 0.04252895708784962, 'bb_std_mult': 1.1850552499038058, 'rsi_os': 28, 'rsi_ob': 89, 'vol_spike': 0.21963991787520493, 'adx_thresh': 11.515915961065922, 'atr_min_pct': 0.011670162256369729, 'atr_max_pct': 0.12888879316493765, 'tp_mult': 1.3943638502342792, 'tsl_mult': 0.9557772624054384, 'strategy': 'breakout', 'time_stop': 236, 'use_sma': False, 'use_atr': False, 'use_adx': False, 'use_ema': True, 'use_spike': False, 'rsi_required': True, 'edge_k': 1.0192518466358822, 'edge_cap': 0.6612064720923226, 'bull_strategy': 'breakout', 'bull_bb_std_mult': 3.015989482951405, 'bull_rsi_os': 41, 'bull_rsi_ob': 94, 'bull_adx_thresh': 8.128820382288668, 'bull_atr_min_pct': 0.01674079427072741, 'bull_atr_max_pct': 0.08409969456943718, 'bull_tp_mult': 1.5230957364766426, 'bull_tsl_mult': 0.07961904366461187, 'bull_time_stop': 201, 'bull_use_sma': True, 'bull_use_ema': False, 'bull_use_atr': False, 'bull_use_adx': False, 'bull_use_spike': True, 'bull_rsi_required': True, 'bear_strategy': 'breakout', 'bear_bb_std_mult': 1.8149616100433743, 'bear_rsi_os': 33, 'bear_rsi_ob': 92, 'bear_adx_thresh': 9.781055640194348, 'bear_atr_min_pct': 0.01858695469259243, 'bear_atr_max_pct': 0.08446380708727423, 'bear_tp_mult': 2.2546051841618198, 'bear_tsl_mult': 0.1454411281755284, 'bear_time_stop': 125, 'bear_use_sma': False, 'bear_use_ema': False, 'bear_use_atr': False, 'bear_use_adx': True, 'bear_use_spike': False, 'bear_rsi_required': True, 'sideways_strategy': 'breakout', 'sideways_bb_std_mult': 1.4097624690568509, 'sideways_rsi_os': 36, 'sideways_rsi_ob': 83, 'sideways_adx_thresh': 19.44102102586254, 'sideways_atr_min_pct': 0.02988893967019722, 'sideways_atr_max_pct': 0.07606116009654287, 'sideways_tp_mult': 1.7717344136327564, 'sideways_tsl_mult': 0.5515262568592644, 'sideways_time_stop': 45, 'sideways_use_sma': True, 'sideways_use_ema': True, 'sideways_use_atr': True, 'sideways_use_adx': False, 'sideways_use_spike': False, 'sideways_rsi_required': False}.
[I 2025-08-31 11:10:01,804] Trial 108 finished with values: [-0.028753477118918847, 0.02831911696655942] and parameters: {'p_sma': 28, 'p_std': 50, 'p_atr': 20, 'p_adx': 8, 'rsi_period': 7, 'ema1': 18, 'ema2': 47, 'slip_atr_k': 0.17803102017335182, 'slip_spread_k': 0.8627405568382771, 'spread_hl_frac': 0.007108802333586168, 'bb_std_mult': 1.8294894478726798, 'rsi_os': 28, 'rsi_ob': 63, 'vol_spike': 0.09317108329031512, 'adx_thresh': 29.700821734598378, 'atr_min_pct': 0.010471776396871054, 'atr_max_pct': 0.14017675360887075, 'tp_mult': 1.425647520498428, 'tsl_mult': 0.10686141859449666, 'strategy': 'breakout', 'time_stop': 70, 'use_sma': False, 'use_atr': False, 'use_adx': True, 'use_ema': True, 'use_spike': False, 'rsi_required': True, 'edge_k': 1.7251982413895122, 'edge_cap': 0.7431153164850575, 'bull_strategy': 'mean_reversion', 'bull_bb_std_mult': 3.0237759045846206, 'bull_rsi_os': 27, 'bull_rsi_ob': 65, 'bull_adx_thresh': 6.194154481055264, 'bull_atr_min_pct': 0.016785881563881486, 'bull_atr_max_pct': 0.1267129057645942, 'bull_tp_mult': 1.762396930120305, 'bull_tsl_mult': 0.08531218541211157, 'bull_time_stop': 80, 'bull_use_sma': True, 'bull_use_ema': False, 'bull_use_atr': True, 'bull_use_adx': True, 'bull_use_spike': True, 'bull_rsi_required': True, 'bear_strategy': 'breakout', 'bear_bb_std_mult': 1.771349326700324, 'bear_rsi_os': 33, 'bear_rsi_ob': 60, 'bear_adx_thresh': 13.194672275385866, 'bear_atr_min_pct': 0.02927249120677034, 'bear_atr_max_pct': 0.023137532023155008, 'bear_tp_mult': 2.4192790018208385, 'bear_tsl_mult': 0.2963110569306396, 'bear_time_stop': 83, 'bear_use_sma': False, 'bear_use_ema': False, 'bear_use_atr': False, 'bear_use_adx': True, 'bear_use_spike': False, 'bear_rsi_required': True, 'sideways_strategy': 'breakout', 'sideways_bb_std_mult': 2.6625053794796694, 'sideways_rsi_os': 35, 'sideways_rsi_ob': 89, 'sideways_adx_thresh': 10.542474458024172, 'sideways_atr_min_pct': 0.0033067919364401016, 'sideways_atr_max_pct': 0.07494035685187478, 'sideways_tp_mult': 1.7445355143385237, 'sideways_tsl_mult': 0.5513894547176145, 'sideways_time_stop': 28, 'sideways_use_sma': True, 'sideways_use_ema': True, 'sideways_use_atr': True, 'sideways_use_adx': False, 'sideways_use_spike': False, 'sideways_rsi_required': True}.
