[I 2025-08-31 11:05:15,375] Trial 72 finished with values: [-1000000000.0, 1000000000.0] and parameters: {'p_sma': 23, 'p_std': 13, 'p_atr': 17, 'p_adx': 24, 'rsi_period': 84, 'ema1': 13, 'ema2': 38, 'slip_atr_k': 0.10507869561084217, 'slip_spread_k': 0.5666449121345067, 'spread_hl_frac': 0.00640787953882012, 'bb_std_mult': 0.8512316896087602, 'rsi_os': 13, 'rsi_ob': 60, 'vol_spike': 0.08169457811889888, 'adx_thresh': 12.3117331100146, 'atr_min_pct': 0.019073654927881614, 'atr_max_pct': 0.1333251269804757, 'tp_mult': 1.3029904219835187, 'tsl_mult': 0.4545288633803168, 'strategy': 'mean_reversion', 'time_stop': 6, 'use_sma': False, 'use_atr': False, 'use_adx': False, 'use_ema': True, 'use_spike': False, 'rsi_required': False, 'edge_k': 1.8958298816928885, 'edge_cap': 0.6929184294899386, 'bull_strategy': 'mean_reversion', 'bull_bb_std_mult': 0.7465758469487569, 'bull_rsi_os': 18, 'bull_rsi_ob': 49, 'bull_adx_thresh': 33.06783760691129, 'bull_atr_min_pct': 0.01809696875776516, 'bull_atr_max_pct': 0.10613834873898947, 'bull_tp_mult': 1.2097348452169756, 'bull_tsl_mult': 0.6661033156768723, 'bull_time_stop': 102, 'bull_use_sma': True, 'bull_use_ema': True, 'bull_use_atr': True, 'bull_use_adx': True, 'bull_use_spike': True, 'bull_rsi_required': True, 'bear_strategy': 'breakout', 'bear_bb_std_mult': 1.645003894327115, 'bear_rsi_os': 23, 'bear_rsi_ob': 60, 'bear_adx_thresh': 11.426587349917199, 'bear_atr_min_pct': 0.029015074508574348, 'bear_atr_max_pct': 0.045512276391187864, 'bear_tp_mult': 2.6566779063358457, 'bear_tsl_mult': 0.8067815680059318, 'bear_time_stop': 194, 'bear_use_sma': False, 'bear_use_ema': False, 'bear_use_atr': False, 'bear_use_adx': True, 'bear_use_spike': False, 'bear_rsi_required': False, 'sideways_strategy': 'breakout', 'sideways_bb_std_mult': 1.8217599881228579, 'sideways_rsi_os': 37, 'sideways_rsi_ob': 78, 'sideways_adx_thresh': 17.39075832010684, 'sideways_atr_min_pct': 0.00806600376527409, 'sideways_atr_max_pct': 0.07160197468562587, 'sideways_tp_mult': 1.2198414911132942, 'sideways_tsl_mult': 0.08306154950037509, 'sideways_time_stop': 297, 'sideways_use_sma': True, 'sideways_use_ema': False, 'sideways_use_atr': False, 'sideways_use_adx': False, 'sideways_use_spike': False, 'sideways_rsi_required': False}.
[I 2025-08-31 11:05:46,428] Trial 73 finished with values: [-1000000000.0, 1000000000.0] and parameters: {'p_sma': 22, 'p_std': 58, 'p_atr': 28, 'p_adx': 24, 'rsi_period': 13, 'ema1': 14, 'ema2': 37, 'slip_atr_k': 0.13683727778170146, 'slip_spread_k': 0.6301257442405003, 'spread_hl_frac': 0.00960119897601893, 'bb_std_mult': 1.438643249057021, 'rsi_os': 7, 'rsi_ob': 87, 'vol_spike': 0.08509574186373246, 'adx_thresh': 6.552586988090626, 'atr_min_pct': 0.021438522222997147, 'atr_max_pct': 0.13808296617878835, 'tp_mult': 1.6391374361758408, 'tsl_mult': 0.7940593095895481, 'strategy': 'breakout', 'time_stop': 82, 'use_sma': False, 'use_atr': False, 'use_adx': True, 'use_ema': True, 'use_spike': False, 'rsi_required': False, 'edge_k': 1.8282671046765566, 'edge_cap': 0.5821894543773449, 'bull_strategy': 'mean_reversion', 'bull_bb_std_mult': 0.674839573755994, 'bull_rsi_os': 18, 'bull_rsi_ob': 50, 'bull_adx_thresh': 11.732011509582486, 'bull_atr_min_pct': 0.017922348191617057, 'bull_atr_max_pct': 0.10563569605378932, 'bull_tp_mult': 1.8086565566547952, 'bull_tsl_mult': 0.19649598646546848, 'bull_time_stop': 134, 'bull_use_sma': True, 'bull_use_ema': False, 'bull_use_atr': True, 'bull_use_adx': False, 'bull_use_spike': True, 'bull_rsi_required': True, 'bear_strategy': 'breakout', 'bear_bb_std_mult': 1.8786779996140293, 'bear_rsi_os': 16, 'bear_rsi_ob': 52, 'bear_adx_thresh': 10.789956810523714, 'bear_atr_min_pct': 0.02036811804780051, 'bear_atr_max_pct': 0.048935813285376495, 'bear_tp_mult': 2.648797666416454, 'bear_tsl_mult': 0.80392964749943, 'bear_time_stop': 105, 'bear_use_sma': False, 'bear_use_ema': False, 'bear_use_atr': False, 'bear_use_adx': True, 'bear_use_spike': False, 'bear_rsi_required': True, 'sideways_strategy': 'breakout', 'sideways_bb_std_mult': 1.827708468242172, 'sideways_rsi_os': 18, 'sideways_rsi_ob': 80, 'sideways_adx_thresh': 34.28202356236006, 'sideways_atr_min_pct': 0.016812541117511053, 'sideways_atr_max_pct': 0.07257094511253918, 'sideways_tp_mult': 2.941228319060495, 'sideways_tsl_mult': 0.999321104940473, 'sideways_time_stop': 44, 'sideways_use_sma': True, 'sideways_use_ema': True, 'sideways_use_atr': False, 'sideways_use_adx': False, 'sideways_use_spike': False, 'sideways_rsi_required': True}.
[I 2025-08-31 11:05:46,744] Trial 75 finished with values: [-1000000000.0, 1000000000.0] and parameters: {'p_sma': 22, 'p_std': 58, 'p_atr': 23, 'p_adx': 29, 'rsi_period': 12, 'ema1': 25, 'ema2': 26, 'slip_atr_k': 0.19221916196556654, 'slip_spread_k': 0.9912416718260234, 'spread_hl_frac': 0.022873575674908803, 'bb_std_mult': 1.4795363742771983, 'rsi_os': 14, 'rsi_ob': 87, 'vol_spike': 0.0857780585489874, 'adx_thresh': 12.040016346370184, 'atr_min_pct': 0.013918832930131382, 'atr_max_pct': 0.13806906626431883, 'tp_mult': 1.9897533948148705, 'tsl_mult': 0.5449779488227403, 'strategy': 'breakout', 'time_stop': 160, 'use_sma': False, 'use_atr': False, 'use_adx': True, 'use_ema': False, 'use_spike': False, 'rsi_required': False, 'edge_k': 1.8919577163536365, 'edge_cap': 0.7069834134158928, 'bull_strategy': 'breakout', 'bull_bb_std_mult': 1.927191840386005, 'bull_rsi_os': 33, 'bull_rsi_ob': 55, 'bull_adx_thresh': 32.749794923955164, 'bull_atr_min_pct': 0.0192848579949641, 'bull_atr_max_pct': 0.07805867387104755, 'bull_tp_mult': 1.8125681239005724, 'bull_tsl_mult': 0.9319330295449602, 'bull_time_stop': 129, 'bull_use_sma': True, 'bull_use_ema': False, 'bull_use_atr': True, 'bull_use_adx': False, 'bull_use_spike': False, 'bull_rsi_required': False, 'bear_strategy': 'breakout', 'bear_bb_std_mult': 1.6782068113855417, 'bear_rsi_os': 8, 'bear_rsi_ob': 52, 'bear_adx_thresh': 10.863948784986732, 'bear_atr_min_pct': 0.02886826417467033, 'bear_atr_max_pct': 0.1406322992180326, 'bear_tp_mult': 1.711265194925331, 'bear_tsl_mult': 0.7966695448419111, 'bear_time_stop': 125, 'bear_use_sma': True, 'bear_use_ema': False, 'bear_use_atr': False, 'bear_use_adx': True, 'bear_use_spike': True, 'bear_rsi_required': True, 'sideways_strategy': 'breakout', 'sideways_bb_std_mult': 2.900148201868442, 'sideways_rsi_os': 22, 'sideways_rsi_ob': 84, 'sideways_adx_thresh': 27.917766544117576, 'sideways_atr_min_pct': 0.007808865856364481, 'sideways_atr_max_pct': 0.07293823925363292, 'sideways_tp_mult': 1.216157009689765, 'sideways_tsl_mult': 0.07610279491088576, 'sideways_time_stop': 30, 'sideways_use_sma': True, 'sideways_use_ema': True, 'sideways_use_atr': False, 'sideways_use_adx': False, 'sideways_use_spike': False, 'sideways_rsi_required': True}.
[I 2025-08-31 11:05:46,836] Trial 76 finished with values: [-1000000000.0, 1000000000.0] and parameters: {'p_sma': 39, 'p_std': 58, 'p_atr': 25, 'p_adx': 20, 'rsi_period': 12, 'ema1': 22, 'ema2': 34, 'slip_atr_k': 0.13393328980759167, 'slip_spread_k': 0.21644023351859093, 'spread_hl_frac': 0.01329264468597599, 'bb_std_mult': 1.4225553242825586, 'rsi_os': 48, 'rsi_ob': 87, 'vol_spike': 0.19447104203254084, 'adx_thresh': 10.537881302505998, 'atr_min_pct': 0.014152395534760337, 'atr_max_pct': 0.13807078356418434, 'tp_mult': 1.7431091391338303, 'tsl_mult': 0.787901837003278, 'strategy': 'breakout', 'time_stop': 160, 'use_sma': False, 'use_atr': False, 'use_adx': True, 'use_ema': False, 'use_spike': False, 'rsi_required': False, 'edge_k': 0.8830334487930384, 'edge_cap': 0.7525202840182013, 'bull_strategy': 'breakout', 'bull_bb_std_mult': 1.9685650939293426, 'bull_rsi_os': 15, 'bull_rsi_ob': 59, 'bull_adx_thresh': 11.997226905392132, 'bull_atr_min_pct': 0.019418111222174197, 'bull_atr_max_pct': 0.06864817067200105, 'bull_tp_mult': 1.7892920416734373, 'bull_tsl_mult': 0.8222487411124055, 'bull_time_stop': 134, 'bull_use_sma': True, 'bull_use_ema': False, 'bull_use_atr': False, 'bull_use_adx': False, 'bull_use_spike': False, 'bull_rsi_required': False, 'bear_strategy': 'breakout', 'bear_bb_std_mult': 3.4139460053578894, 'bear_rsi_os': 53, 'bear_rsi_ob': 52, 'bear_adx_thresh': 10.912016935580867, 'bear_atr_min_pct': 0.005240980868130811, 'bear_atr_max_pct': 0.09954240369237558, 'bear_tp_mult': 2.438077326018377, 'bear_tsl_mult': 0.9296567826352973, 'bear_time_stop': 124, 'bear_use_sma': True, 'bear_use_ema': False, 'bear_use_atr': False, 'bear_use_adx': True, 'bear_use_spike': True, 'bear_rsi_required': True, 'sideways_strategy': 'breakout', 'sideways_bb_std_mult': 1.7445239213886157, 'sideways_rsi_os': 23, 'sideways_rsi_ob': 84, 'sideways_adx_thresh': 29.24259953594291, 'sideways_atr_min_pct': 0.01738831444774609, 'sideways_atr_max_pct': 0.0475836636002981, 'sideways_tp_mult': 2.948760707613416, 'sideways_tsl_mult': 0.09124213422425406, 'sideways_time_stop': 42, 'sideways_use_sma': False, 'sideways_use_ema': True, 'sideways_use_atr': False, 'sideways_use_adx': False, 'sideways_use_spike': False, 'sideways_rsi_required': True}.
[I 2025-08-31 11:05:47,131] Trial 74 finished with values: [-1000000000.0, 1000000000.0] and parameters: {'p_sma': 22, 'p_std': 11, 'p_atr': 25, 'p_adx': 29, 'rsi_period': 13, 'ema1': 24, 'ema2': 26, 'slip_atr_k': 0.1357507246104909, 'slip_spread_k': 0.03409391916097987, 'spread_hl_frac': 0.006099180727861185, 'bb_std_mult': 1.9275226101987617, 'rsi_os': 14, 'rsi_ob': 57, 'vol_spike': 0.08597266438996101, 'adx_thresh': 12.261451122874693, 'atr_min_pct': 0.013778088981088617, 'atr_max_pct': 0.13938409893954326, 'tp_mult': 1.7128121846538806, 'tsl_mult': 0.7933705741724851, 'strategy': 'breakout', 'time_stop': 160, 'use_sma': False, 'use_atr': False, 'use_adx': True, 'use_ema': False, 'use_spike': False, 'rsi_required': False, 'edge_k': 1.8911907392169378, 'edge_cap': 0.7055939772035636, 'bull_strategy': 'breakout', 'bull_bb_std_mult': 1.9517631321585356, 'bull_rsi_os': 15, 'bull_rsi_ob': 55, 'bull_adx_thresh': 32.970263682532504, 'bull_atr_min_pct': 0.02160364283476189, 'bull_atr_max_pct': 0.06849312550915321, 'bull_tp_mult': 1.7906129432899245, 'bull_tsl_mult': 0.7613895604187486, 'bull_time_stop': 132, 'bull_use_sma': True, 'bull_use_ema': False, 'bull_use_atr': True, 'bull_use_adx': False, 'bull_use_spike': False, 'bull_rsi_required': False, 'bear_strategy': 'breakout', 'bear_bb_std_mult': 1.6397360965493035, 'bear_rsi_os': 8, 'bear_rsi_ob': 52, 'bear_adx_thresh': 10.179758718376284, 'bear_atr_min_pct': 0.005736975526671569, 'bear_atr_max_pct': 0.14177281350615478, 'bear_tp_mult': 2.630782664844343, 'bear_tsl_mult': 0.7974567551205212, 'bear_time_stop': 257, 'bear_use_sma': True, 'bear_use_ema': False, 'bear_use_atr': False, 'bear_use_adx': True, 'bear_use_spike': True, 'bear_rsi_required': True, 'sideways_strategy': 'breakout', 'sideways_bb_std_mult': 2.854675266532871, 'sideways_rsi_os': 52, 'sideways_rsi_ob': 84, 'sideways_adx_thresh': 30.56175740366503, 'sideways_atr_min_pct': 0.016054276621234716, 'sideways_atr_max_pct': 0.05546193702882217, 'sideways_tp_mult': 2.182931893315804, 'sideways_tsl_mult': 0.10527845162083697, 'sideways_time_stop': 15, 'sideways_use_sma': True, 'sideways_use_ema': True, 'sideways_use_atr': False, 'sideways_use_adx': False, 'sideways_use_spike': False, 'sideways_rsi_required': True}.
[I 2025-08-31 11:06:18,297] Trial 79 finished with values: [-1000000000.0, 1000000000.0] and parameters: {'p_sma': 44, 'p_std': 49, 'p_atr': 18, 'p_adx': 9, 'rsi_period': 8, 'ema1': 19, 'ema2': 12, 'slip_atr_k': 0.03884437062404929, 'slip_spread_k': 0.013942428483484426, 'spread_hl_frac': 0.009811258084401876, 'bb_std_mult': 1.2818413582396393, 'rsi_os': 55, 'rsi_ob': 57, 'vol_spike': 0.166888712486357, 'adx_thresh': 9.568791642319916, 'atr_min_pct': 0.015080152840646083, 'atr_max_pct': 0.03414245981784842, 'tp_mult': 1.5144950316705652, 'tsl_mult': 0.7064247875712574, 'strategy': 'breakout', 'time_stop': 143, 'use_sma': False, 'use_atr': False, 'use_adx': True, 'use_ema': False, 'use_spike': False, 'rsi_required': True, 'edge_k': 0.8399229387026719, 'edge_cap': 0.5303854626803233, 'bull_strategy': 'mean_reversion', 'bull_bb_std_mult': 1.767047305433014, 'bull_rsi_os': 12, 'bull_rsi_ob': 67, 'bull_adx_thresh': 16.39335393165908, 'bull_atr_min_pct': 0.02163336253568979, 'bull_atr_max_pct': 0.02637030336904001, 'bull_tp_mult': 1.8755655846988042, 'bull_tsl_mult': 0.23841054947948925, 'bull_time_stop': 24, 'bull_use_sma': True, 'bull_use_ema': False, 'bull_use_atr': False, 'bull_use_adx': False, 'bull_use_spike': True, 'bull_rsi_required': True, 'bear_strategy': 'mean_reversion', 'bear_bb_std_mult': 2.41962648430637, 'bear_rsi_os': 10, 'bear_rsi_ob': 94, 'bear_adx_thresh': 7.412143284184856, 'bear_atr_min_pct': 0.029925003942975856, 'bear_atr_max_pct': 0.10290927531664266, 'bear_tp_mult': 2.0362570686742743, 'bear_tsl_mult': 0.6852510183210448, 'bear_time_stop': 249, 'bear_use_sma': False, 'bear_use_ema': False, 'bear_use_atr': True, 'bear_use_adx': False, 'bear_use_spike': True, 'bear_rsi_required': True, 'sideways_strategy': 'mean_reversion', 'sideways_bb_std_mult': 2.7443278227995425, 'sideways_rsi_os': 28, 'sideways_rsi_ob': 89, 'sideways_adx_thresh': 14.10772262483706, 'sideways_atr_min_pct': 0.002822732169096991, 'sideways_atr_max_pct': 0.05534500918922853, 'sideways_tp_mult': 2.5579972710483485, 'sideways_tsl_mult': 0.6571459764609425, 'sideways_time_stop': 199, 'sideways_use_sma': False, 'sideways_use_ema': True, 'sideways_use_atr': True, 'sideways_use_adx': False, 'sideways_use_spike': False, 'sideways_rsi_required': True}.
[I 2025-08-31 11:06:18,698] Trial 78 finished with values: [-1000000000.0, 1000000000.0] and parameters: {'p_sma': 19, 'p_std': 49, 'p_atr': 25, 'p_adx': 28, 'rsi_period': 8, 'ema1': 21, 'ema2': 13, 'slip_atr_k': 0.12223585093389253, 'slip_spread_k': 0.4599202330055359, 'spread_hl_frac': 0.03343376731392762, 'bb_std_mult': 2.433267691705635, 'rsi_os': 49, 'rsi_ob': 57, 'vol_spike': 0.1627415530089829, 'adx_thresh': 9.900522740014274, 'atr_min_pct': 0.015245871966415948, 'atr_max_pct': 0.03243666999028051, 'tp_mult': 1.7244930052187704, 'tsl_mult': 0.6627375723407758, 'strategy': 'breakout', 'time_stop': 166, 'use_sma': False, 'use_atr': False, 'use_adx': True, 'use_ema': False, 'use_spike': False, 'rsi_required': False, 'edge_k': 0.9491382535738164, 'edge_cap': 0.7502107104497546, 'bull_strategy': 'breakout', 'bull_bb_std_mult': 3.1073153584910793, 'bull_rsi_os': 15, 'bull_rsi_ob': 67, 'bull_adx_thresh': 13.270764376167701, 'bull_atr_min_pct': 0.01966600406583207, 'bull_atr_max_pct': 0.08451667834972457, 'bull_tp_mult': 1.7516627061632626, 'bull_tsl_mult': 0.7786143053901311, 'bull_time_stop': 155, 'bull_use_sma': True, 'bull_use_ema': False, 'bull_use_atr': False, 'bull_use_adx': False, 'bull_use_spike': False, 'bull_rsi_required': False, 'bear_strategy': 'mean_reversion', 'bear_bb_std_mult': 2.674457137741643, 'bear_rsi_os': 52, 'bear_rsi_ob': 94, 'bear_adx_thresh': 22.93874833194783, 'bear_atr_min_pct': 0.02487257024798757, 'bear_atr_max_pct': 0.10128064083086875, 'bear_tp_mult': 2.4367480952938387, 'bear_tsl_mult': 0.9180594182804056, 'bear_time_stop': 271, 'bear_use_sma': True, 'bear_use_ema': False, 'bear_use_atr': True, 'bear_use_adx': False, 'bear_use_spike': True, 'bear_rsi_required': True, 'sideways_strategy': 'mean_reversion', 'sideways_bb_std_mult': 1.1561928557102021, 'sideways_rsi_os': 51, 'sideways_rsi_ob': 75, 'sideways_adx_thresh': 30.76650269605693, 'sideways_atr_min_pct': 0.003009812614550916, 'sideways_atr_max_pct': 0.06458242278389563, 'sideways_tp_mult': 2.0822281278219417, 'sideways_tsl_mult': 0.8128346493982128, 'sideways_time_stop': 11, 'sideways_use_sma': False, 'sideways_use_ema': True, 'sideways_use_atr': True, 'sideways_use_adx': False, 'sideways_use_spike': False, 'sideways_rsi_required': True}.
[I 2025-08-31 11:06:18,834] Trial 80 finished with values: [-1000000000.0, 1000000000.0] and parameters: {'p_sma': 19, 'p_std': 21, 'p_atr': 18, 'p_adx': 26, 'rsi_period': 9, 'ema1': 9, 'ema2': 13, 'slip_atr_k': 0.03924548718317365, 'slip_spread_k': 0.45918984585821276, 'spread_hl_frac': 0.021227924500781942, 'bb_std_mult': 1.2722412537954106, 'rsi_os': 55, 'rsi_ob': 91, 'vol_spike': 0.020684293766434634, 'adx_thresh': 9.972276884679193, 'atr_min_pct': 0.01527153087947228, 'atr_max_pct': 0.03584152711277292, 'tp_mult': 2.6397979242001375, 'tsl_mult': 0.6528055564272878, 'strategy': 'breakout', 'time_stop': 143, 'use_sma': True, 'use_atr': False, 'use_adx': True, 'use_ema': True, 'use_spike': True, 'rsi_required': True, 'edge_k': 0.6086737852003576, 'edge_cap': 0.9242449363456127, 'bull_strategy': 'mean_reversion', 'bull_bb_std_mult': 1.474658169411317, 'bull_rsi_os': 54, 'bull_rsi_ob': 67, 'bull_adx_thresh': 18.469439651249274, 'bull_atr_min_pct': 0.02007883740977588, 'bull_atr_max_pct': 0.02339685825516307, 'bull_tp_mult': 1.8657881437477801, 'bull_tsl_mult': 0.22694235118886963, 'bull_time_stop': 154, 'bull_use_sma': False, 'bull_use_ema': False, 'bull_use_atr': False, 'bull_use_adx': False, 'bull_use_spike': True, 'bull_rsi_required': True, 'bear_strategy': 'mean_reversion', 'bear_bb_std_mult': 2.725963773132862, 'bear_rsi_os': 20, 'bear_rsi_ob': 57, 'bear_adx_thresh': 15.7807516920805, 'bear_atr_min_pct': 0.029857271605634856, 'bear_atr_max_pct': 0.12859116183089359, 'bear_tp_mult': 2.0703874310853645, 'bear_tsl_mult': 0.893622253076002, 'bear_time_stop': 287, 'bear_use_sma': False, 'bear_use_ema': True, 'bear_use_atr': True, 'bear_use_adx': False, 'bear_use_spike': False, 'bear_rsi_required': True, 'sideways_strategy': 'mean_reversion', 'sideways_bb_std_mult': 1.1508697221168038, 'sideways_rsi_os': 28, 'sideways_rsi_ob': 61, 'sideways_adx_thresh': 14.5053557051252, 'sideways_atr_min_pct': 0.0011064745152336766, 'sideways_atr_max_pct': 0.06235621591754754, 'sideways_tp_mult': 2.4467256031897087, 'sideways_tsl_mult': 0.6366239782937031, 'sideways_time_stop': 140, 'sideways_use_sma': False, 'sideways_use_ema': True, 'sideways_use_atr': True, 'sideways_use_adx': False, 'sideways_use_spike': False, 'sideways_rsi_required': True}.
[I 2025-08-31 11:06:18,940] Trial 77 finished with values: [-0.15655116721835216, 0.15646102809048382] and parameters: {'p_sma': 20, 'p_std': 39, 'p_atr': 24, 'p_adx': 26, 'rsi_period': 8, 'ema1': 25, 'ema2': 26, 'slip_atr_k': 0.19131983926403084, 'slip_spread_k': 0.034766758621290195, 'spread_hl_frac': 0.02348604256058622, 'bb_std_mult': 1.2778643323689336, 'rsi_os': 49, 'rsi_ob': 91, 'vol_spike': 0.1854784480816582, 'adx_thresh': 10.981935724922774, 'atr_min_pct': 0.014126300079307774, 'atr_max_pct': 0.033468188940951105, 'tp_mult': 1.7098629647035106, 'tsl_mult': 0.5370833303773538, 'strategy': 'breakout', 'time_stop': 160, 'use_sma': False, 'use_atr': False, 'use_adx': True, 'use_ema': False, 'use_spike': False, 'rsi_required': False, 'edge_k': 0.8717101059729402, 'edge_cap': 0.7024909287909408, 'bull_strategy': 'breakout', 'bull_bb_std_mult': 1.93171216569337, 'bull_rsi_os': 34, 'bull_rsi_ob': 55, 'bull_adx_thresh': 13.673786323316662, 'bull_atr_min_pct': 0.021972548080496403, 'bull_atr_max_pct': 0.07750071217484288, 'bull_tp_mult': 1.8802827118013796, 'bull_tsl_mult': 0.4151292673652651, 'bull_time_stop': 129, 'bull_use_sma': True, 'bull_use_ema': False, 'bull_use_atr': False, 'bull_use_adx': False, 'bull_use_spike': False, 'bull_rsi_required': False, 'bear_strategy': 'breakout', 'bear_bb_std_mult': 2.708637533912296, 'bear_rsi_os': 51, 'bear_rsi_ob': 58, 'bear_adx_thresh': 33.59124591049709, 'bear_atr_min_pct': 0.006273546510721966, 'bear_atr_max_pct': 0.09927849503341551, 'bear_tp_mult': 2.0894052766070805, 'bear_tsl_mult': 0.9100271751353238, 'bear_time_stop': 124, 'bear_use_sma': True, 'bear_use_ema': False, 'bear_use_atr': False, 'bear_use_adx': True, 'bear_use_spike': True, 'bear_rsi_required': True, 'sideways_strategy': 'breakout', 'sideways_bb_std_mult': 2.8665196916201063, 'sideways_rsi_os': 23, 'sideways_rsi_ob': 84, 'sideways_adx_thresh': 14.18954368208984, 'sideways_atr_min_pct': 0.0011158901139763063, 'sideways_atr_max_pct': 0.06473447814603463, 'sideways_tp_mult': 2.223857669360056, 'sideways_tsl_mult': 0.6617625028379664, 'sideways_time_stop': 14, 'sideways_use_sma': False, 'sideways_use_ema': True, 'sideways_use_atr': False, 'sideways_use_adx': False, 'sideways_use_spike': False, 'sideways_rsi_required': True}.
