[I 2025-08-31 11:37:42,891] Trial 333 finished with values: [-0.0200192282231475, 0.01975228967629337] and parameters: {'p_sma': 29, 'p_std': 37, 'p_atr': 14, 'p_adx': 25, 'rsi_period': 47, 'ema1': 12, 'ema2': 20, 'slip_atr_k': 0.13365960721979409, 'slip_spread_k': 0.02752190017512829, 'spread_hl_frac': 0.012867400819058307, 'bb_std_mult': 2.9170142362491998, 'rsi_os': 31, 'rsi_ob': 72, 'vol_spike': 0.22847875989995658, 'adx_thresh': 24.586099181564474, 'atr_min_pct': 0.0244897834156964, 'atr_max_pct': 0.1305604112258686, 'tp_mult': 1.1263793292312625, 'tsl_mult': 0.2814966131076868, 'strategy': 'breakout', 'time_stop': 82, 'use_sma': False, 'use_atr': False, 'use_adx': True, 'use_ema': False, 'use_spike': True, 'rsi_required': False, 'edge_k': 0.37976574380535627, 'edge_cap': 0.8765363334993289, 'bull_strategy': 'breakout', 'bull_bb_std_mult': 2.56285705839647, 'bull_rsi_os': 24, 'bull_rsi_ob': 92, 'bull_adx_thresh': 15.729826045267084, 'bull_atr_min_pct': 0.005957976603893826, 'bull_atr_max_pct': 0.027208761786452672, 'bull_tp_mult': 1.476487386905851, 'bull_tsl_mult': 0.44897213861906493, 'bull_time_stop': 142, 'bull_use_sma': True, 'bull_use_ema': True, 'bull_use_atr': False, 'bull_use_adx': False, 'bull_use_spike': False, 'bull_rsi_required': False, 'bear_strategy': 'mean_reversion', 'bear_bb_std_mult': 0.9976649961368119, 'bear_rsi_os': 29, 'bear_rsi_ob': 53, 'bear_adx_thresh': 9.574717174286132, 'bear_atr_min_pct': 0.0018741082089228644, 'bear_atr_max_pct': 0.11669961810841219, 'bear_tp_mult': 1.6016958122575222, 'bear_tsl_mult': 0.38674164895964624, 'bear_time_stop': 236, 'bear_use_sma': False, 'bear_use_ema': True, 'bear_use_atr': True, 'bear_use_adx': False, 'bear_use_spike': True, 'bear_rsi_required': False, 'sideways_strategy': 'breakout', 'sideways_bb_std_mult': 1.6852102338544679, 'sideways_rsi_os': 30, 'sideways_rsi_ob': 71, 'sideways_adx_thresh': 9.972066979343237, 'sideways_atr_min_pct': 0.0017424959655533703, 'sideways_atr_max_pct': 0.044485450307621924, 'sideways_tp_mult': 1.2704190471019061, 'sideways_tsl_mult': 0.003889607330546052, 'sideways_time_stop': 199, 'sideways_use_sma': True, 'sideways_use_ema': True, 'sideways_use_atr': True, 'sideways_use_adx': True, 'sideways_use_spike': False, 'sideways_rsi_required': True}.
[I 2025-08-31 11:38:18,773] Trial 337 finished with values: [-0.052248008155206804, 0.05212627605458639] and parameters: {'p_sma': 39, 'p_std': 15, 'p_atr': 27, 'p_adx': 29, 'rsi_period': 12, 'ema1': 12, 'ema2': 41, 'slip_atr_k': 0.2207195347257173, 'slip_spread_k': 0.09388747002980943, 'spread_hl_frac': 0.023434619576593516, 'bb_std_mult': 1.546497003396155, 'rsi_os': 50, 'rsi_ob': 72, 'vol_spike': 0.16113305626328076, 'adx_thresh': 25.26527935682801, 'atr_min_pct': 0.014425897840871048, 'atr_max_pct': 0.026396060326891534, 'tp_mult': 1.0832871157301298, 'tsl_mult': 0.27465526522126604, 'strategy': 'breakout', 'time_stop': 68, 'use_sma': False, 'use_atr': True, 'use_adx': True, 'use_ema': False, 'use_spike': True, 'rsi_required': True, 'edge_k': 1.5915000904135301, 'edge_cap': 0.6942458214902034, 'bull_strategy': 'breakout', 'bull_bb_std_mult': 2.1816799025313554, 'bull_rsi_os': 52, 'bull_rsi_ob': 49, 'bull_adx_thresh': 14.133285238855962, 'bull_atr_min_pct': 0.002974767296027102, 'bull_atr_max_pct': 0.10112230067499514, 'bull_tp_mult': 1.444800446195666, 'bull_tsl_mult': 0.30967341772948614, 'bull_time_stop': 148, 'bull_use_sma': True, 'bull_use_ema': True, 'bull_use_atr': True, 'bull_use_adx': True, 'bull_use_spike': False, 'bull_rsi_required': True, 'bear_strategy': 'breakout', 'bear_bb_std_mult': 1.0397211741864705, 'bear_rsi_os': 48, 'bear_rsi_ob': 71, 'bear_adx_thresh': 6.895851816950005, 'bear_atr_min_pct': 0.016884287112329952, 'bear_atr_max_pct': 0.1192908074039764, 'bear_tp_mult': 2.6551704856929694, 'bear_tsl_mult': 0.35849209666328047, 'bear_time_stop': 188, 'bear_use_sma': False, 'bear_use_ema': True, 'bear_use_atr': True, 'bear_use_adx': False, 'bear_use_spike': True, 'bear_rsi_required': False, 'sideways_strategy': 'mean_reversion', 'sideways_bb_std_mult': 1.546012605090975, 'sideways_rsi_os': 34, 'sideways_rsi_ob': 74, 'sideways_adx_thresh': 8.505741669670341, 'sideways_atr_min_pct': 0.0030453709305747288, 'sideways_atr_max_pct': 0.13235920894190867, 'sideways_tp_mult': 1.3558544607224878, 'sideways_tsl_mult': 0.8416987469133583, 'sideways_time_stop': 8, 'sideways_use_sma': True, 'sideways_use_ema': False, 'sideways_use_atr': True, 'sideways_use_adx': False, 'sideways_use_spike': False, 'sideways_rsi_required': True}.
[I 2025-08-31 11:38:19,279] Trial 336 finished with values: [-1000000000.0, 1000000000.0] and parameters: {'p_sma': 53, 'p_std': 14, 'p_atr': 13, 'p_adx': 28, 'rsi_period': 30, 'ema1': 12, 'ema2': 20, 'slip_atr_k': 0.22972961815991688, 'slip_spread_k': 0.09856385787396393, 'spread_hl_frac': 0.006251188548828584, 'bb_std_mult': 1.408156373587253, 'rsi_os': 53, 'rsi_ob': 72, 'vol_spike': 0.21260557976203964, 'adx_thresh': 8.05582054447021, 'atr_min_pct': 0.02740923585910495, 'atr_max_pct': 0.029035322484143773, 'tp_mult': 1.963359047804802, 'tsl_mult': 0.28481284143883123, 'strategy': 'breakout', 'time_stop': 292, 'use_sma': False, 'use_atr': True, 'use_adx': True, 'use_ema': False, 'use_spike': True, 'rsi_required': False, 'edge_k': 1.861794357350229, 'edge_cap': 0.1209691268579593, 'bull_strategy': 'breakout', 'bull_bb_std_mult': 2.93797002920003, 'bull_rsi_os': 41, 'bull_rsi_ob': 53, 'bull_adx_thresh': 26.944047120365163, 'bull_atr_min_pct': 0.006423312306217399, 'bull_atr_max_pct': 0.04543559687735309, 'bull_tp_mult': 1.4873217035492705, 'bull_tsl_mult': 0.31153530020293985, 'bull_time_stop': 84, 'bull_use_sma': True, 'bull_use_ema': True, 'bull_use_atr': True, 'bull_use_adx': True, 'bull_use_spike': False, 'bull_rsi_required': True, 'bear_strategy': 'mean_reversion', 'bear_bb_std_mult': 2.204411967245405, 'bear_rsi_os': 30, 'bear_rsi_ob': 55, 'bear_adx_thresh': 7.563453167906861, 'bear_atr_min_pct': 0.015777753407250402, 'bear_atr_max_pct': 0.11756997123719207, 'bear_tp_mult': 2.6513423892630588, 'bear_tsl_mult': 0.36439679688777327, 'bear_time_stop': 188, 'bear_use_sma': False, 'bear_use_ema': True, 'bear_use_atr': True, 'bear_use_adx': False, 'bear_use_spike': True, 'bear_rsi_required': False, 'sideways_strategy': 'breakout', 'sideways_bb_std_mult': 1.5100239997429674, 'sideways_rsi_os': 15, 'sideways_rsi_ob': 71, 'sideways_adx_thresh': 9.281256435448109, 'sideways_atr_min_pct': 0.0014432067421935, 'sideways_atr_max_pct': 0.03817099951717001, 'sideways_tp_mult': 1.268486256141668, 'sideways_tsl_mult': 0.5555692911146417, 'sideways_time_stop': 15, 'sideways_use_sma': True, 'sideways_use_ema': False, 'sideways_use_atr': True, 'sideways_use_adx': True, 'sideways_use_spike': False, 'sideways_rsi_required': True}.
[I 2025-08-31 11:38:20,062] Trial 334 finished with values: [-0.01697460238996118, 0.017069362544852862] and parameters: {'p_sma': 29, 'p_std': 15, 'p_atr': 13, 'p_adx': 28, 'rsi_period': 44, 'ema1': 20, 'ema2': 57, 'slip_atr_k': 0.06964577443530358, 'slip_spread_k': 0.08479273092693773, 'spread_hl_frac': 0.012639164869141276, 'bb_std_mult': 1.150624122935179, 'rsi_os': 32, 'rsi_ob': 67, 'vol_spike': 0.21184836777921484, 'adx_thresh': 10.221499408587034, 'atr_min_pct': 0.0055068740976361285, 'atr_max_pct': 0.037726666464978534, 'tp_mult': 1.6709509202841355, 'tsl_mult': 0.31921435807744597, 'strategy': 'breakout', 'time_stop': 300, 'use_sma': False, 'use_atr': False, 'use_adx': True, 'use_ema': False, 'use_spike': True, 'rsi_required': False, 'edge_k': 0.3163697029849688, 'edge_cap': 0.64950228683537, 'bull_strategy': 'breakout', 'bull_bb_std_mult': 2.8610035241433627, 'bull_rsi_os': 21, 'bull_rsi_ob': 91, 'bull_adx_thresh': 15.188610963428733, 'bull_atr_min_pct': 0.007362487378425233, 'bull_atr_max_pct': 0.14466060351931023, 'bull_tp_mult': 2.2527994779724065, 'bull_tsl_mult': 0.3111715348169316, 'bull_time_stop': 141, 'bull_use_sma': True, 'bull_use_ema': True, 'bull_use_atr': False, 'bull_use_adx': False, 'bull_use_spike': False, 'bull_rsi_required': False, 'bear_strategy': 'mean_reversion', 'bear_bb_std_mult': 2.3969281741842003, 'bear_rsi_os': 29, 'bear_rsi_ob': 54, 'bear_adx_thresh': 9.315259014705642, 'bear_atr_min_pct': 0.014110499624971629, 'bear_atr_max_pct': 0.04234163585047922, 'bear_tp_mult': 2.5646779300305327, 'bear_tsl_mult': 0.3869393231226469, 'bear_time_stop': 187, 'bear_use_sma': False, 'bear_use_ema': True, 'bear_use_atr': True, 'bear_use_adx': False, 'bear_use_spike': True, 'bear_rsi_required': False, 'sideways_strategy': 'breakout', 'sideways_bb_std_mult': 1.7244136591585475, 'sideways_rsi_os': 30, 'sideways_rsi_ob': 74, 'sideways_adx_thresh': 9.255063611089678, 'sideways_atr_min_pct': 0.001406737627777576, 'sideways_atr_max_pct': 0.043851348148002636, 'sideways_tp_mult': 1.5429949551546038, 'sideways_tsl_mult': 0.2789096607010051, 'sideways_time_stop': 11, 'sideways_use_sma': True, 'sideways_use_ema': True, 'sideways_use_atr': True, 'sideways_use_adx': True, 'sideways_use_spike': False, 'sideways_rsi_required': True}.
[I 2025-08-31 11:38:20,197] Trial 335 finished with values: [-0.04928736094958419, 0.04931433858983634] and parameters: {'p_sma': 19, 'p_std': 15, 'p_atr': 26, 'p_adx': 26, 'rsi_period': 44, 'ema1': 12, 'ema2': 21, 'slip_atr_k': 0.14505805468526103, 'slip_spread_k': 0.09121840721045031, 'spread_hl_frac': 0.0008396774475550976, 'bb_std_mult': 1.4019715783328976, 'rsi_os': 31, 'rsi_ob': 72, 'vol_spike': 0.16111964900576914, 'adx_thresh': 8.187483759518875, 'atr_min_pct': 0.00559146497630672, 'atr_max_pct': 0.11703815692548597, 'tp_mult': 1.4605948526135777, 'tsl_mult': 0.2850837124962048, 'strategy': 'breakout', 'time_stop': 97, 'use_sma': False, 'use_atr': False, 'use_adx': True, 'use_ema': False, 'use_spike': True, 'rsi_required': False, 'edge_k': 0.3651905493139506, 'edge_cap': 0.22304811365875793, 'bull_strategy': 'breakout', 'bull_bb_std_mult': 2.2756452383340418, 'bull_rsi_os': 32, 'bull_rsi_ob': 64, 'bull_adx_thresh': 15.002296672570978, 'bull_atr_min_pct': 0.0062197668216818595, 'bull_atr_max_pct': 0.14446178580363833, 'bull_tp_mult': 1.4684446784589449, 'bull_tsl_mult': 0.3044450660173832, 'bull_time_stop': 143, 'bull_use_sma': True, 'bull_use_ema': True, 'bull_use_atr': True, 'bull_use_adx': True, 'bull_use_spike': False, 'bull_rsi_required': False, 'bear_strategy': 'mean_reversion', 'bear_bb_std_mult': 2.404540095282492, 'bear_rsi_os': 36, 'bear_rsi_ob': 54, 'bear_adx_thresh': 11.01279568163109, 'bear_atr_min_pct': 0.015554659031075729, 'bear_atr_max_pct': 0.11643930737240582, 'bear_tp_mult': 2.5966290814896587, 'bear_tsl_mult': 0.9640508482252932, 'bear_time_stop': 188, 'bear_use_sma': False, 'bear_use_ema': True, 'bear_use_atr': True, 'bear_use_adx': False, 'bear_use_spike': True, 'bear_rsi_required': False, 'sideways_strategy': 'breakout', 'sideways_bb_std_mult': 1.690412455440986, 'sideways_rsi_os': 34, 'sideways_rsi_ob': 71, 'sideways_adx_thresh': 9.287571117088675, 'sideways_atr_min_pct': 0.0013333419029244826, 'sideways_atr_max_pct': 0.04355958508067275, 'sideways_tp_mult': 1.266689154971615, 'sideways_tsl_mult': 0.3150792964732101, 'sideways_time_stop': 161, 'sideways_use_sma': True, 'sideways_use_ema': True, 'sideways_use_atr': True, 'sideways_use_adx': True, 'sideways_use_spike': False, 'sideways_rsi_required': True}.
[I 2025-08-31 11:38:59,331] Trial 339 finished with values: [-0.019513118333832957, 0.019991909755988118] and parameters: {'p_sma': 37, 'p_std': 49, 'p_atr': 13, 'p_adx': 11, 'rsi_period': 44, 'ema1': 18, 'ema2': 36, 'slip_atr_k': 0.025721558952425103, 'slip_spread_k': 0.42380104431573884, 'spread_hl_frac': 0.016443476276803988, 'bb_std_mult': 0.6093816980538209, 'rsi_os': 27, 'rsi_ob': 52, 'vol_spike': 0.057913809823214465, 'adx_thresh': 25.97252837799559, 'atr_min_pct': 0.00793542244044614, 'atr_max_pct': 0.046181767679813586, 'tp_mult': 2.752391928559734, 'tsl_mult': 0.46759712198671577, 'strategy': 'mean_reversion', 'time_stop': 131, 'use_sma': True, 'use_atr': True, 'use_adx': False, 'use_ema': False, 'use_spike': True, 'rsi_required': True, 'edge_k': 0.31037246899305115, 'edge_cap': 0.22032154340959598, 'bull_strategy': 'breakout', 'bull_bb_std_mult': 2.3145935164108176, 'bull_rsi_os': 32, 'bull_rsi_ob': 64, 'bull_adx_thresh': 13.175353303405613, 'bull_atr_min_pct': 0.003626466672791139, 'bull_atr_max_pct': 0.14497349615963928, 'bull_tp_mult': 2.603085506513668, 'bull_tsl_mult': 0.27053932753029036, 'bull_time_stop': 185, 'bull_use_sma': False, 'bull_use_ema': True, 'bull_use_atr': True, 'bull_use_adx': True, 'bull_use_spike': False, 'bull_rsi_required': True, 'bear_strategy': 'breakout', 'bear_bb_std_mult': 3.5106959205861092, 'bear_rsi_os': 11, 'bear_rsi_ob': 63, 'bear_adx_thresh': 28.110292857966378, 'bear_atr_min_pct': 0.014759966878541607, 'bear_atr_max_pct': 0.11196100948846541, 'bear_tp_mult': 2.588773008730513, 'bear_tsl_mult': 0.9646365318038412, 'bear_time_stop': 183, 'bear_use_sma': False, 'bear_use_ema': True, 'bear_use_atr': True, 'bear_use_adx': False, 'bear_use_spike': True, 'bear_rsi_required': True, 'sideways_strategy': 'breakout', 'sideways_bb_std_mult': 1.7785345173116647, 'sideways_rsi_os': 32, 'sideways_rsi_ob': 74, 'sideways_adx_thresh': 12.767201696304802, 'sideways_atr_min_pct': 0.0027916147161311314, 'sideways_atr_max_pct': 0.051673524831385834, 'sideways_tp_mult': 2.5072297913379105, 'sideways_tsl_mult': 0.9596379196725118, 'sideways_time_stop': 11, 'sideways_use_sma': True, 'sideways_use_ema': False, 'sideways_use_atr': True, 'sideways_use_adx': True, 'sideways_use_spike': False, 'sideways_rsi_required': False}.
[I 2025-08-31 11:38:59,332] Trial 338 finished with values: [-0.017412393470430998, 0.01714924148071972] and parameters: {'p_sma': 19, 'p_std': 49, 'p_atr': 13, 'p_adx': 28, 'rsi_period': 45, 'ema1': 12, 'ema2': 43, 'slip_atr_k': 0.031693566519179664, 'slip_spread_k': 0.4315222462816952, 'spread_hl_frac': 0.0030099743469900425, 'bb_std_mult': 1.1720653724008192, 'rsi_os': 24, 'rsi_ob': 75, 'vol_spike': 0.17464530570299727, 'adx_thresh': 25.712801717772933, 'atr_min_pct': 0.005524529611519341, 'atr_max_pct': 0.03784897777119319, 'tp_mult': 1.4647472836135464, 'tsl_mult': 0.5329303058601644, 'strategy': 'breakout', 'time_stop': 295, 'use_sma': True, 'use_atr': True, 'use_adx': False, 'use_ema': False, 'use_spike': True, 'rsi_required': True, 'edge_k': 0.3163369941630812, 'edge_cap': 0.6409792910628561, 'bull_strategy': 'breakout', 'bull_bb_std_mult': 2.960020258878411, 'bull_rsi_os': 25, 'bull_rsi_ob': 82, 'bull_adx_thresh': 14.680976025308505, 'bull_atr_min_pct': 0.0018688577149584083, 'bull_atr_max_pct': 0.14462674516609877, 'bull_tp_mult': 1.53499047584426, 'bull_tsl_mult': 0.2982881736031358, 'bull_time_stop': 133, 'bull_use_sma': False, 'bull_use_ema': True, 'bull_use_atr': True, 'bull_use_adx': True, 'bull_use_spike': False, 'bull_rsi_required': True, 'bear_strategy': 'breakout', 'bear_bb_std_mult': 1.0889781293131213, 'bear_rsi_os': 30, 'bear_rsi_ob': 81, 'bear_adx_thresh': 32.548313900474994, 'bear_atr_min_pct': 0.015727064724607293, 'bear_atr_max_pct': 0.11048375949087412, 'bear_tp_mult': 2.7788130829144193, 'bear_tsl_mult': 0.31991053068694664, 'bear_time_stop': 184, 'bear_use_sma': False, 'bear_use_ema': True, 'bear_use_atr': True, 'bear_use_adx': False, 'bear_use_spike': True, 'bear_rsi_required': False, 'sideways_strategy': 'breakout', 'sideways_bb_std_mult': 1.7996842943863505, 'sideways_rsi_os': 36, 'sideways_rsi_ob': 74, 'sideways_adx_thresh': 32.02005579095284, 'sideways_atr_min_pct': 0.006193790582244323, 'sideways_atr_max_pct': 0.03820046869919638, 'sideways_tp_mult': 2.9038917167358713, 'sideways_tsl_mult': 0.9671456418656109, 'sideways_time_stop': 180, 'sideways_use_sma': True, 'sideways_use_ema': False, 'sideways_use_atr': True, 'sideways_use_adx': True, 'sideways_use_spike': False, 'sideways_rsi_required': False}.
[I 2025-08-31 11:38:59,579] Trial 340 finished with values: [-1000000000.0, 1000000000.0] and parameters: {'p_sma': 30, 'p_std': 17, 'p_atr': 24, 'p_adx': 28, 'rsi_period': 50, 'ema1': 30, 'ema2': 37, 'slip_atr_k': 0.049227245746019485, 'slip_spread_k': 0.42849590140435234, 'spread_hl_frac': 0.005379938627264384, 'bb_std_mult': 0.5863947390255977, 'rsi_os': 32, 'rsi_ob': 71, 'vol_spike': 0.023863593182203408, 'adx_thresh': 10.09782179914064, 'atr_min_pct': 0.017957855610898996, 'atr_max_pct': 0.03753034327186466, 'tp_mult': 1.7000277753600186, 'tsl_mult': 0.34941553001723363, 'strategy': 'mean_reversion', 'time_stop': 300, 'use_sma': True, 'use_atr': True, 'use_adx': False, 'use_ema': True, 'use_spike': True, 'rsi_required': True, 'edge_k': 0.3102066641189928, 'edge_cap': 0.8504509863105201, 'bull_strategy': 'breakout', 'bull_bb_std_mult': 2.884129670632846, 'bull_rsi_os': 25, 'bull_rsi_ob': 65, 'bull_adx_thresh': 13.048765418645168, 'bull_atr_min_pct': 0.005090721531530028, 'bull_atr_max_pct': 0.1412356860686194, 'bull_tp_mult': 1.5301099636523237, 'bull_tsl_mult': 0.29020801122322004, 'bull_time_stop': 136, 'bull_use_sma': False, 'bull_use_ema': True, 'bull_use_atr': True, 'bull_use_adx': True, 'bull_use_spike': True, 'bull_rsi_required': True, 'bear_strategy': 'breakout', 'bear_bb_std_mult': 1.0680570083123457, 'bear_rsi_os': 33, 'bear_rsi_ob': 62, 'bear_adx_thresh': 32.31690104203103, 'bear_atr_min_pct': 0.014641454116063234, 'bear_atr_max_pct': 0.10988269180210812, 'bear_tp_mult': 1.0149385085269023, 'bear_tsl_mult': 0.323106132351753, 'bear_time_stop': 184, 'bear_use_sma': False, 'bear_use_ema': True, 'bear_use_atr': False, 'bear_use_adx': True, 'bear_use_spike': False, 'bear_rsi_required': True, 'sideways_strategy': 'breakout', 'sideways_bb_std_mult': 1.7967516332527498, 'sideways_rsi_os': 55, 'sideways_rsi_ob': 74, 'sideways_adx_thresh': 7.4484198908710315, 'sideways_atr_min_pct': 0.0215062600456361, 'sideways_atr_max_pct': 0.051325057262629675, 'sideways_tp_mult': 1.3422897860922665, 'sideways_tsl_mult': 0.3388909989211314, 'sideways_time_stop': 10, 'sideways_use_sma': True, 'sideways_use_ema': False, 'sideways_use_atr': True, 'sideways_use_adx': False, 'sideways_use_spike': True, 'sideways_rsi_required': False}.
[I 2025-08-31 11:38:59,866] Trial 341 finished with values: [-0.10186775080799393, 0.10154231050117392] and parameters: {'p_sma': 30, 'p_std': 17, 'p_atr': 13, 'p_adx': 11, 'rsi_period': 50, 'ema1': 7, 'ema2': 36, 'slip_atr_k': 0.16774684197771966, 'slip_spread_k': 0.41987885942533565, 'spread_hl_frac': 0.005438805645107177, 'bb_std_mult': 0.5808913118143039, 'rsi_os': 32, 'rsi_ob': 71, 'vol_spike': 0.0810240974561165, 'adx_thresh': 25.963407535076783, 'atr_min_pct': 0.028799210657295016, 'atr_max_pct': 0.03755468969804614, 'tp_mult': 2.917710599434179, 'tsl_mult': 0.9411695570425187, 'strategy': 'mean_reversion', 'time_stop': 213, 'use_sma': True, 'use_atr': True, 'use_adx': False, 'use_ema': True, 'use_spike': True, 'rsi_required': True, 'edge_k': 0.31479184588214887, 'edge_cap': 0.6527028519743263, 'bull_strategy': 'breakout', 'bull_bb_std_mult': 2.8774485605510516, 'bull_rsi_os': 25, 'bull_rsi_ob': 81, 'bull_adx_thresh': 12.953792286017649, 'bull_atr_min_pct': 0.0016208972381280343, 'bull_atr_max_pct': 0.14762639106548803, 'bull_tp_mult': 2.933034701178096, 'bull_tsl_mult': 0.2891485149105278, 'bull_time_stop': 27, 'bull_use_sma': False, 'bull_use_ema': True, 'bull_use_atr': True, 'bull_use_adx': True, 'bull_use_spike': True, 'bull_rsi_required': True, 'bear_strategy': 'breakout', 'bear_bb_std_mult': 0.8584609359605888, 'bear_rsi_os': 33, 'bear_rsi_ob': 95, 'bear_adx_thresh': 23.272365056774156, 'bear_atr_min_pct': 0.025642209226448612, 'bear_atr_max_pct': 0.10999564904661702, 'bear_tp_mult': 2.5736426583960585, 'bear_tsl_mult': 0.3748226935470893, 'bear_time_stop': 191, 'bear_use_sma': False, 'bear_use_ema': True, 'bear_use_atr': False, 'bear_use_adx': True, 'bear_use_spike': False, 'bear_rsi_required': True, 'sideways_strategy': 'breakout', 'sideways_bb_std_mult': 1.7844697970222652, 'sideways_rsi_os': 37, 'sideways_rsi_ob': 74, 'sideways_adx_thresh': 31.66525563345591, 'sideways_atr_min_pct': 0.0028136490980211807, 'sideways_atr_max_pct': 0.05277557996688245, 'sideways_tp_mult': 2.8929867279483865, 'sideways_tsl_mult': 0.3410184280207924, 'sideways_time_stop': 12, 'sideways_use_sma': True, 'sideways_use_ema': False, 'sideways_use_atr': True, 'sideways_use_adx': False, 'sideways_use_spike': True, 'sideways_rsi_required': False}.
