[I 2025-08-31 11:46:26,297] Trial 396 finished with values: [-1000000000.0, 1000000000.0] and parameters: {'p_sma': 30, 'p_std': 17, 'p_atr': 12, 'p_adx': 24, 'rsi_period': 47, 'ema1': 11, 'ema2': 30, 'slip_atr_k': 0.2346586626137908, 'slip_spread_k': 0.13324691808544298, 'spread_hl_frac': 0.029982619849066854, 'bb_std_mult': 0.6424344787656767, 'rsi_os': 33, 'rsi_ob': 53, 'vol_spike': 0.17163401891639046, 'adx_thresh': 22.616042637910404, 'atr_min_pct': 0.005701319501048441, 'atr_max_pct': 0.029651403714052487, 'tp_mult': 1.2295587417133778, 'tsl_mult': 0.32000794217694073, 'strategy': 'breakout', 'time_stop': 183, 'use_sma': True, 'use_atr': False, 'use_adx': True, 'use_ema': False, 'use_spike': True, 'rsi_required': True, 'edge_k': 0.41191726404059326, 'edge_cap': 0.5016153299006442, 'bull_strategy': 'mean_reversion', 'bull_bb_std_mult': 2.779283995358762, 'bull_rsi_os': 52, 'bull_rsi_ob': 45, 'bull_adx_thresh': 17.893779677359753, 'bull_atr_min_pct': 0.024712021018492895, 'bull_atr_max_pct': 0.1471242723158376, 'bull_tp_mult': 2.522521364476623, 'bull_tsl_mult': 0.29094033178379997, 'bull_time_stop': 130, 'bull_use_sma': False, 'bull_use_ema': True, 'bull_use_atr': True, 'bull_use_adx': True, 'bull_use_spike': False, 'bull_rsi_required': True, 'bear_strategy': 'breakout', 'bear_bb_std_mult': 1.0397559383953034, 'bear_rsi_os': 32, 'bear_rsi_ob': 52, 'bear_adx_thresh': 32.07311960731817, 'bear_atr_min_pct': 0.01305440663478997, 'bear_atr_max_pct': 0.1270250195874567, 'bear_tp_mult': 2.7381221524652766, 'bear_tsl_mult': 0.41124305478473366, 'bear_time_stop': 265, 'bear_use_sma': False, 'bear_use_ema': False, 'bear_use_atr': True, 'bear_use_adx': False, 'bear_use_spike': True, 'bear_rsi_required': False, 'sideways_strategy': 'breakout', 'sideways_bb_std_mult': 1.9525268818298551, 'sideways_rsi_os': 5, 'sideways_rsi_ob': 46, 'sideways_adx_thresh': 28.100590716670194, 'sideways_atr_min_pct': 0.0027251739057615786, 'sideways_atr_max_pct': 0.037351984460666274, 'sideways_tp_mult': 1.3774763008493125, 'sideways_tsl_mult': 0.37355912310029704, 'sideways_time_stop': 123, 'sideways_use_sma': True, 'sideways_use_ema': False, 'sideways_use_atr': False, 'sideways_use_adx': True, 'sideways_use_spike': False, 'sideways_rsi_required': False}.
[I 2025-08-31 11:46:26,483] Trial 394 finished with values: [-1000000000.0, 1000000000.0] and parameters: {'p_sma': 30, 'p_std': 54, 'p_atr': 14, 'p_adx': 27, 'rsi_period': 74, 'ema1': 24, 'ema2': 38, 'slip_atr_k': 0.23308330672815958, 'slip_spread_k': 0.3516379254307813, 'spread_hl_frac': 0.011098743518936428, 'bb_std_mult': 1.6831644768317404, 'rsi_os': 33, 'rsi_ob': 70, 'vol_spike': 0.2272967721860885, 'adx_thresh': 29.50326000927239, 'atr_min_pct': 0.005417218051135525, 'atr_max_pct': 0.1354381790759389, 'tp_mult': 1.0658030072786528, 'tsl_mult': 0.32349899864984305, 'strategy': 'breakout', 'time_stop': 231, 'use_sma': False, 'use_atr': True, 'use_adx': True, 'use_ema': False, 'use_spike': True, 'rsi_required': True, 'edge_k': 1.524047687375109, 'edge_cap': 0.519438202592256, 'bull_strategy': 'breakout', 'bull_bb_std_mult': 2.1351071083880875, 'bull_rsi_os': 18, 'bull_rsi_ob': 63, 'bull_adx_thresh': 12.927767560298985, 'bull_atr_min_pct': 0.007118436720382806, 'bull_atr_max_pct': 0.10990446307353008, 'bull_tp_mult': 2.555368940489285, 'bull_tsl_mult': 0.7904320162296214, 'bull_time_stop': 222, 'bull_use_sma': False, 'bull_use_ema': True, 'bull_use_atr': True, 'bull_use_adx': True, 'bull_use_spike': False, 'bull_rsi_required': True, 'bear_strategy': 'breakout', 'bear_bb_std_mult': 1.1798089489920738, 'bear_rsi_os': 33, 'bear_rsi_ob': 54, 'bear_adx_thresh': 5.298737180530507, 'bear_atr_min_pct': 0.006218438319908839, 'bear_atr_max_pct': 0.09049883797474338, 'bear_tp_mult': 1.5172313035548335, 'bear_tsl_mult': 0.418056040323559, 'bear_time_stop': 187, 'bear_use_sma': False, 'bear_use_ema': True, 'bear_use_atr': True, 'bear_use_adx': False, 'bear_use_spike': True, 'bear_rsi_required': False, 'sideways_strategy': 'breakout', 'sideways_bb_std_mult': 0.6205446194841147, 'sideways_rsi_os': 16, 'sideways_rsi_ob': 90, 'sideways_adx_thresh': 8.44999429563007, 'sideways_atr_min_pct': 0.0028780028941985595, 'sideways_atr_max_pct': 0.04610647218727454, 'sideways_tp_mult': 1.829528828254772, 'sideways_tsl_mult': 0.3734578488989665, 'sideways_time_stop': 31, 'sideways_use_sma': False, 'sideways_use_ema': False, 'sideways_use_atr': True, 'sideways_use_adx': True, 'sideways_use_spike': False, 'sideways_rsi_required': True}.
[I 2025-08-31 11:46:27,065] Trial 401 finished with values: [-1000000000.0, 1000000000.0] and parameters: {'p_sma': 32, 'p_std': 19, 'p_atr': 15, 'p_adx': 26, 'rsi_period': 27, 'ema1': 12, 'ema2': 36, 'slip_atr_k': 0.17428790100315206, 'slip_spread_k': 0.10152983150588765, 'spread_hl_frac': 0.000784056311964719, 'bb_std_mult': 0.5537314906165429, 'rsi_os': 51, 'rsi_ob': 60, 'vol_spike': 0.23821456459087853, 'adx_thresh': 25.534460413266018, 'atr_min_pct': 0.0029143823446029756, 'atr_max_pct': 0.033339187031814016, 'tp_mult': 1.0921502566612369, 'tsl_mult': 0.6449839497170617, 'strategy': 'mean_reversion', 'time_stop': 295, 'use_sma': False, 'use_atr': True, 'use_adx': True, 'use_ema': True, 'use_spike': False, 'rsi_required': False, 'edge_k': 1.6196846000612601, 'edge_cap': 0.908394074096229, 'bull_strategy': 'breakout', 'bull_bb_std_mult': 1.7904183199949053, 'bull_rsi_os': 23, 'bull_rsi_ob': 64, 'bull_adx_thresh': 15.502624863181754, 'bull_atr_min_pct': 0.011251097729524855, 'bull_atr_max_pct': 0.14494696175996802, 'bull_tp_mult': 1.4125443190938713, 'bull_tsl_mult': 0.2713613286207667, 'bull_time_stop': 137, 'bull_use_sma': True, 'bull_use_ema': True, 'bull_use_atr': False, 'bull_use_adx': False, 'bull_use_spike': True, 'bull_rsi_required': True, 'bear_strategy': 'mean_reversion', 'bear_bb_std_mult': 3.1620926995941625, 'bear_rsi_os': 36, 'bear_rsi_ob': 80, 'bear_adx_thresh': 11.910585551494522, 'bear_atr_min_pct': 0.0030120729064470574, 'bear_atr_max_pct': 0.13504704935890985, 'bear_tp_mult': 2.4096931728984163, 'bear_tsl_mult': 0.6239620292655776, 'bear_time_stop': 182, 'bear_use_sma': True, 'bear_use_ema': True, 'bear_use_atr': False, 'bear_use_adx': True, 'bear_use_spike': False, 'bear_rsi_required': True, 'sideways_strategy': 'mean_reversion', 'sideways_bb_std_mult': 2.6115361191149975, 'sideways_rsi_os': 10, 'sideways_rsi_ob': 71, 'sideways_adx_thresh': 18.324586297636884, 'sideways_atr_min_pct': 0.0268921954820293, 'sideways_atr_max_pct': 0.04228803666957345, 'sideways_tp_mult': 2.061475640683265, 'sideways_tsl_mult': 0.8162414330544088, 'sideways_time_stop': 296, 'sideways_use_sma': True, 'sideways_use_ema': False, 'sideways_use_atr': True, 'sideways_use_adx': False, 'sideways_use_spike': True, 'sideways_rsi_required': True}.
[I 2025-08-31 11:46:57,896] Trial 398 finished with values: [-0.035338688436509225, 0.03587789778502166] and parameters: {'p_sma': 32, 'p_std': 58, 'p_atr': 7, 'p_adx': 24, 'rsi_period': 73, 'ema1': 11, 'ema2': 38, 'slip_atr_k': 0.032925620938473066, 'slip_spread_k': 0.11610879279391595, 'spread_hl_frac': 0.0008944815743649057, 'bb_std_mult': 0.5798140875519281, 'rsi_os': 43, 'rsi_ob': 90, 'vol_spike': 0.025163574938488892, 'adx_thresh': 27.602178581694595, 'atr_min_pct': 0.0028921712921086244, 'atr_max_pct': 0.028555687258351996, 'tp_mult': 2.9734126509277194, 'tsl_mult': 0.27252526409536476, 'strategy': 'breakout', 'time_stop': 249, 'use_sma': False, 'use_atr': True, 'use_adx': True, 'use_ema': False, 'use_spike': False, 'rsi_required': True, 'edge_k': 0.39540530534497975, 'edge_cap': 0.7068987942819562, 'bull_strategy': 'breakout', 'bull_bb_std_mult': 2.5966984965691275, 'bull_rsi_os': 27, 'bull_rsi_ob': 63, 'bull_adx_thresh': 30.10123782743294, 'bull_atr_min_pct': 0.02457693746669854, 'bull_atr_max_pct': 0.059994245139050016, 'bull_tp_mult': 1.4208239200684056, 'bull_tsl_mult': 0.29251922383806983, 'bull_time_stop': 98, 'bull_use_sma': True, 'bull_use_ema': True, 'bull_use_atr': True, 'bull_use_adx': False, 'bull_use_spike': False, 'bull_rsi_required': True, 'bear_strategy': 'breakout', 'bear_bb_std_mult': 0.7651267374002078, 'bear_rsi_os': 43, 'bear_rsi_ob': 52, 'bear_adx_thresh': 32.746243974136114, 'bear_atr_min_pct': 0.0031229690496127165, 'bear_atr_max_pct': 0.12552723117159967, 'bear_tp_mult': 1.4065231976547785, 'bear_tsl_mult': 0.3734880954544394, 'bear_time_stop': 101, 'bear_use_sma': True, 'bear_use_ema': False, 'bear_use_atr': True, 'bear_use_adx': False, 'bear_use_spike': True, 'bear_rsi_required': False, 'sideways_strategy': 'mean_reversion', 'sideways_bb_std_mult': 2.6282570868793487, 'sideways_rsi_os': 31, 'sideways_rsi_ob': 46, 'sideways_adx_thresh': 33.93405898440514, 'sideways_atr_min_pct': 0.026677042235122902, 'sideways_atr_max_pct': 0.0422070463081804, 'sideways_tp_mult': 1.4667157611874642, 'sideways_tsl_mult': 0.5606827197874727, 'sideways_time_stop': 15, 'sideways_use_sma': True, 'sideways_use_ema': False, 'sideways_use_atr': True, 'sideways_use_adx': True, 'sideways_use_spike': True, 'sideways_rsi_required': True}.
[I 2025-08-31 11:46:58,204] Trial 400 finished with values: [-1000000000.0, 1000000000.0] and parameters: {'p_sma': 32, 'p_std': 19, 'p_atr': 16, 'p_adx': 27, 'rsi_period': 23, 'ema1': 27, 'ema2': 38, 'slip_atr_k': 0.2256619768125035, 'slip_spread_k': 0.09976333637431085, 'spread_hl_frac': 0.000982104581525374, 'bb_std_mult': 0.7854404481228846, 'rsi_os': 25, 'rsi_ob': 87, 'vol_spike': 0.028879731713007784, 'adx_thresh': 27.148668793965303, 'atr_min_pct': 0.0028485130831297396, 'atr_max_pct': 0.03842316862732334, 'tp_mult': 1.7377372663434698, 'tsl_mult': 0.2667272825371058, 'strategy': 'breakout', 'time_stop': 81, 'use_sma': False, 'use_atr': True, 'use_adx': True, 'use_ema': False, 'use_spike': False, 'rsi_required': False, 'edge_k': 1.5421909720509372, 'edge_cap': 0.9081535350505204, 'bull_strategy': 'breakout', 'bull_bb_std_mult': 2.597062826939168, 'bull_rsi_os': 27, 'bull_rsi_ob': 82, 'bull_adx_thresh': 14.383470440135794, 'bull_atr_min_pct': 0.007209069054022122, 'bull_atr_max_pct': 0.1256634715973, 'bull_tp_mult': 1.4143942856651757, 'bull_tsl_mult': 0.27187870893979804, 'bull_time_stop': 190, 'bull_use_sma': True, 'bull_use_ema': True, 'bull_use_atr': True, 'bull_use_adx': False, 'bull_use_spike': False, 'bull_rsi_required': True, 'bear_strategy': 'breakout', 'bear_bb_std_mult': 0.8839586452061438, 'bear_rsi_os': 36, 'bear_rsi_ob': 54, 'bear_adx_thresh': 30.85534884854859, 'bear_atr_min_pct': 0.006388547081181134, 'bear_atr_max_pct': 0.08996857052786437, 'bear_tp_mult': 2.6776775394421146, 'bear_tsl_mult': 0.3794171848030349, 'bear_time_stop': 274, 'bear_use_sma': True, 'bear_use_ema': True, 'bear_use_atr': True, 'bear_use_adx': True, 'bear_use_spike': True, 'bear_rsi_required': False, 'sideways_strategy': 'mean_reversion', 'sideways_bb_std_mult': 2.627122532455761, 'sideways_rsi_os': 23, 'sideways_rsi_ob': 70, 'sideways_adx_thresh': 18.26107264019828, 'sideways_atr_min_pct': 0.02849808761103734, 'sideways_atr_max_pct': 0.04268457793073922, 'sideways_tp_mult': 1.0541877038640355, 'sideways_tsl_mult': 0.5574977293511877, 'sideways_time_stop': 245, 'sideways_use_sma': True, 'sideways_use_ema': False, 'sideways_use_atr': True, 'sideways_use_adx': False, 'sideways_use_spike': True, 'sideways_rsi_required': True}.
[I 2025-08-31 11:46:58,586] Trial 399 finished with values: [-1000000000.0, 1000000000.0] and parameters: {'p_sma': 32, 'p_std': 58, 'p_atr': 20, 'p_adx': 27, 'rsi_period': 23, 'ema1': 27, 'ema2': 36, 'slip_atr_k': 0.03345977155708654, 'slip_spread_k': 0.024053079876297956, 'spread_hl_frac': 0.0010618796904044569, 'bb_std_mult': 0.5585072170882868, 'rsi_os': 23, 'rsi_ob': 60, 'vol_spike': 0.10268861975443114, 'adx_thresh': 34.5859732503999, 'atr_min_pct': 0.004480062776032098, 'atr_max_pct': 0.03912580535029844, 'tp_mult': 1.7323746840543184, 'tsl_mult': 0.2689931966311688, 'strategy': 'breakout', 'time_stop': 300, 'use_sma': False, 'use_atr': True, 'use_adx': True, 'use_ema': False, 'use_spike': False, 'rsi_required': False, 'edge_k': 1.5250065108936404, 'edge_cap': 0.32114968491733986, 'bull_strategy': 'breakout', 'bull_bb_std_mult': 2.5775841245582636, 'bull_rsi_os': 23, 'bull_rsi_ob': 64, 'bull_adx_thresh': 28.3612357791553, 'bull_atr_min_pct': 0.028472951408139942, 'bull_atr_max_pct': 0.1443272534538819, 'bull_tp_mult': 1.4175445508335376, 'bull_tsl_mult': 0.27042638963495896, 'bull_time_stop': 150, 'bull_use_sma': True, 'bull_use_ema': True, 'bull_use_atr': True, 'bull_use_adx': False, 'bull_use_spike': False, 'bull_rsi_required': True, 'bear_strategy': 'breakout', 'bear_bb_std_mult': 0.8900332047459609, 'bear_rsi_os': 48, 'bear_rsi_ob': 80, 'bear_adx_thresh': 30.86466415852215, 'bear_atr_min_pct': 0.017762335977078037, 'bear_atr_max_pct': 0.08911770606434176, 'bear_tp_mult': 1.1199490865973512, 'bear_tsl_mult': 0.3795157646581625, 'bear_time_stop': 182, 'bear_use_sma': True, 'bear_use_ema': True, 'bear_use_atr': True, 'bear_use_adx': True, 'bear_use_spike': True, 'bear_rsi_required': False, 'sideways_strategy': 'mean_reversion', 'sideways_bb_std_mult': 2.9060768388498968, 'sideways_rsi_os': 33, 'sideways_rsi_ob': 90, 'sideways_adx_thresh': 18.034589224792025, 'sideways_atr_min_pct': 0.001775913942971045, 'sideways_atr_max_pct': 0.04250173736298322, 'sideways_tp_mult': 1.2633566002773833, 'sideways_tsl_mult': 0.3461680967559269, 'sideways_time_stop': 293, 'sideways_use_sma': True, 'sideways_use_ema': False, 'sideways_use_atr': True, 'sideways_use_adx': False, 'sideways_use_spike': True, 'sideways_rsi_required': True}.
[I 2025-08-31 11:46:59,397] Trial 402 finished with values: [-1000000000.0, 1000000000.0] and parameters: {'p_sma': 18, 'p_std': 58, 'p_atr': 16, 'p_adx': 24, 'rsi_period': 82, 'ema1': 30, 'ema2': 43, 'slip_atr_k': 0.22457342156809526, 'slip_spread_k': 0.40174698461172276, 'spread_hl_frac': 0.0009771917186993492, 'bb_std_mult': 0.7897813149262599, 'rsi_os': 35, 'rsi_ob': 71, 'vol_spike': 0.02649750399446152, 'adx_thresh': 27.117464205576052, 'atr_min_pct': 0.00833770075564311, 'atr_max_pct': 0.046551777948363904, 'tp_mult': 1.1582421258906366, 'tsl_mult': 0.27794659885810247, 'strategy': 'breakout', 'time_stop': 300, 'use_sma': False, 'use_atr': True, 'use_adx': True, 'use_ema': False, 'use_spike': True, 'rsi_required': True, 'edge_k': 1.7899494586103948, 'edge_cap': 0.7008182787864957, 'bull_strategy': 'breakout', 'bull_bb_std_mult': 2.2335259869067428, 'bull_rsi_os': 44, 'bull_rsi_ob': 65, 'bull_adx_thresh': 33.91256196788244, 'bull_atr_min_pct': 0.0032850314191041905, 'bull_atr_max_pct': 0.12638871103987476, 'bull_tp_mult': 1.5255271615629478, 'bull_tsl_mult': 0.016233320040606403, 'bull_time_stop': 151, 'bull_use_sma': True, 'bull_use_ema': True, 'bull_use_atr': True, 'bull_use_adx': False, 'bull_use_spike': False, 'bull_rsi_required': True, 'bear_strategy': 'breakout', 'bear_bb_std_mult': 0.9242085147447747, 'bear_rsi_os': 37, 'bear_rsi_ob': 57, 'bear_adx_thresh': 30.761237675304965, 'bear_atr_min_pct': 0.014419755136353369, 'bear_atr_max_pct': 0.11498857107242436, 'bear_tp_mult': 1.6579609861598046, 'bear_tsl_mult': 0.38533030763623355, 'bear_time_stop': 204, 'bear_use_sma': True, 'bear_use_ema': True, 'bear_use_atr': True, 'bear_use_adx': False, 'bear_use_spike': True, 'bear_rsi_required': False, 'sideways_strategy': 'breakout', 'sideways_bb_std_mult': 2.883072758487871, 'sideways_rsi_os': 40, 'sideways_rsi_ob': 78, 'sideways_adx_thresh': 33.70848448995574, 'sideways_atr_min_pct': 0.01622937327495392, 'sideways_atr_max_pct': 0.04251830413128408, 'sideways_tp_mult': 1.4741376945049782, 'sideways_tsl_mult': 0.3490408950054076, 'sideways_time_stop': 67, 'sideways_use_sma': True, 'sideways_use_ema': False, 'sideways_use_atr': True, 'sideways_use_adx': True, 'sideways_use_spike': True, 'sideways_rsi_required': True}.
[I 2025-08-31 11:46:59,932] Trial 404 finished with values: [-1000000000.0, 1000000000.0] and parameters: {'p_sma': 29, 'p_std': 36, 'p_atr': 14, 'p_adx': 13, 'rsi_period': 49, 'ema1': 30, 'ema2': 43, 'slip_atr_k': 0.056853816100919705, 'slip_spread_k': 0.020997997410882818, 'spread_hl_frac': 0.01321766915827252, 'bb_std_mult': 0.7125577706742183, 'rsi_os': 37, 'rsi_ob': 72, 'vol_spike': 0.10118010704106614, 'adx_thresh': 26.41954659772637, 'atr_min_pct': 0.016534085387428052, 'atr_max_pct': 0.013682380152033135, 'tp_mult': 1.6721271092139838, 'tsl_mult': 0.2969755184226909, 'strategy': 'breakout', 'time_stop': 300, 'use_sma': True, 'use_atr': False, 'use_adx': True, 'use_ema': False, 'use_spike': True, 'rsi_required': True, 'edge_k': 1.7860564843804045, 'edge_cap': 0.8576158493518732, 'bull_strategy': 'mean_reversion', 'bull_bb_std_mult': 2.7166998993767444, 'bull_rsi_os': 22, 'bull_rsi_ob': 76, 'bull_adx_thresh': 33.58578797059963, 'bull_atr_min_pct': 0.0077082991693484555, 'bull_atr_max_pct': 0.14988696609141045, 'bull_tp_mult': 1.5117088754072432, 'bull_tsl_mult': 0.018433785006876757, 'bull_time_stop': 152, 'bull_use_sma': True, 'bull_use_ema': True, 'bull_use_atr': True, 'bull_use_adx': True, 'bull_use_spike': False, 'bull_rsi_required': True, 'bear_strategy': 'breakout', 'bear_bb_std_mult': 1.0580312624576258, 'bear_rsi_os': 48, 'bear_rsi_ob': 57, 'bear_adx_thresh': 31.29501119810352, 'bear_atr_min_pct': 0.0176541254626859, 'bear_atr_max_pct': 0.10526368927072799, 'bear_tp_mult': 2.011792194224518, 'bear_tsl_mult': 0.3151290364067699, 'bear_time_stop': 190, 'bear_use_sma': False, 'bear_use_ema': True, 'bear_use_atr': True, 'bear_use_adx': False, 'bear_use_spike': True, 'bear_rsi_required': True, 'sideways_strategy': 'breakout', 'sideways_bb_std_mult': 1.7779164512335668, 'sideways_rsi_os': 33, 'sideways_rsi_ob': 64, 'sideways_adx_thresh': 7.061491047183955, 'sideways_atr_min_pct': 0.001743454700347794, 'sideways_atr_max_pct': 0.09218962844172063, 'sideways_tp_mult': 1.2857946073467643, 'sideways_tsl_mult': 0.3436772686224665, 'sideways_time_stop': 25, 'sideways_use_sma': True, 'sideways_use_ema': False, 'sideways_use_atr': True, 'sideways_use_adx': True, 'sideways_use_spike': False, 'sideways_rsi_required': False}.
[I 2025-08-31 11:47:31,371] Trial 403 finished with values: [-1000000000.0, 1000000000.0] and parameters: {'p_sma': 29, 'p_std': 35, 'p_atr': 16, 'p_adx': 15, 'rsi_period': 67, 'ema1': 12, 'ema2': 60, 'slip_atr_k': 0.22466019955670202, 'slip_spread_k': 0.7430562552931264, 'spread_hl_frac': 0.01360684474541557, 'bb_std_mult': 0.7925896645607668, 'rsi_os': 22, 'rsi_ob': 72, 'vol_spike': 0.24998988008784415, 'adx_thresh': 26.792162532720248, 'atr_min_pct': 0.004643420278108048, 'atr_max_pct': 0.04667865052894401, 'tp_mult': 2.263407657622203, 'tsl_mult': 0.29438284857949215, 'strategy': 'breakout', 'time_stop': 300, 'use_sma': False, 'use_atr': True, 'use_adx': True, 'use_ema': False, 'use_spike': True, 'rsi_required': True, 'edge_k': 1.784895359422476, 'edge_cap': 0.3224397899346651, 'bull_strategy': 'mean_reversion', 'bull_bb_std_mult': 2.4160977623884365, 'bull_rsi_os': 44, 'bull_rsi_ob': 82, 'bull_adx_thresh': 28.114498142999377, 'bull_atr_min_pct': 0.0075356992455954475, 'bull_atr_max_pct': 0.13978848684066147, 'bull_tp_mult': 1.5254127645758884, 'bull_tsl_mult': 0.0036900078999461128, 'bull_time_stop': 153, 'bull_use_sma': True, 'bull_use_ema': True, 'bull_use_atr': True, 'bull_use_adx': True, 'bull_use_spike': False, 'bull_rsi_required': True, 'bear_strategy': 'breakout', 'bear_bb_std_mult': 0.8765917852077456, 'bear_rsi_os': 48, 'bear_rsi_ob': 74, 'bear_adx_thresh': 31.32859972817283, 'bear_atr_min_pct': 0.016014078565205918, 'bear_atr_max_pct': 0.11841758065791093, 'bear_tp_mult': 2.6519450540146345, 'bear_tsl_mult': 0.49864260453408027, 'bear_time_stop': 204, 'bear_use_sma': False, 'bear_use_ema': True, 'bear_use_atr': True, 'bear_use_adx': False, 'bear_use_spike': True, 'bear_rsi_required': False, 'sideways_strategy': 'breakout', 'sideways_bb_std_mult': 1.7856441150457338, 'sideways_rsi_os': 45, 'sideways_rsi_ob': 70, 'sideways_adx_thresh': 7.553908142543551, 'sideways_atr_min_pct': 0.02841597960227439, 'sideways_atr_max_pct': 0.05247927587812148, 'sideways_tp_mult': 1.2813648683102714, 'sideways_tsl_mult': 0.3527415764549479, 'sideways_time_stop': 24, 'sideways_use_sma': True, 'sideways_use_ema': False, 'sideways_use_atr': True, 'sideways_use_adx': True, 'sideways_use_spike': False, 'sideways_rsi_required': True}.
