[I 2025-08-31 11:44:01,307] Trial 379 finished with values: [-0.011574017595091579, 0.012226897518905284] and parameters: {'p_sma': 29, 'p_std': 17, 'p_atr': 15, 'p_adx': 27, 'rsi_period': 49, 'ema1': 28, 'ema2': 32, 'slip_atr_k': 0.028256764857757376, 'slip_spread_k': 0.3204749379839489, 'spread_hl_frac': 0.0018798979416048043, 'bb_std_mult': 0.7032714362449881, 'rsi_os': 33, 'rsi_ob': 66, 'vol_spike': 0.07074190145552375, 'adx_thresh': 27.579586748912376, 'atr_min_pct': 0.020862190817838272, 'atr_max_pct': 0.12490327343029314, 'tp_mult': 2.0883991109716553, 'tsl_mult': 0.4996440664545324, 'strategy': 'breakout', 'time_stop': 80, 'use_sma': False, 'use_atr': True, 'use_adx': True, 'use_ema': True, 'use_spike': False, 'rsi_required': True, 'edge_k': 0.008665093940714685, 'edge_cap': 0.09900471490101004, 'bull_strategy': 'breakout', 'bull_bb_std_mult': 2.6419219586457325, 'bull_rsi_os': 38, 'bull_rsi_ob': 77, 'bull_adx_thresh': 12.138189479758337, 'bull_atr_min_pct': 0.009965028560571375, 'bull_atr_max_pct': 0.1381708061573385, 'bull_tp_mult': 1.427291794570133, 'bull_tsl_mult': 0.29980255664434996, 'bull_time_stop': 295, 'bull_use_sma': True, 'bull_use_ema': False, 'bull_use_atr': False, 'bull_use_adx': False, 'bull_use_spike': True, 'bull_rsi_required': True, 'bear_strategy': 'breakout', 'bear_bb_std_mult': 0.7856252230810508, 'bear_rsi_os': 10, 'bear_rsi_ob': 67, 'bear_adx_thresh': 28.66734194230203, 'bear_atr_min_pct': 0.026477595618264453, 'bear_atr_max_pct': 0.06003595867499835, 'bear_tp_mult': 2.7191979154836923, 'bear_tsl_mult': 0.37138235923068846, 'bear_time_stop': 189, 'bear_use_sma': True, 'bear_use_ema': False, 'bear_use_atr': False, 'bear_use_adx': False, 'bear_use_spike': False, 'bear_rsi_required': True, 'sideways_strategy': 'breakout', 'sideways_bb_std_mult': 1.771825545380687, 'sideways_rsi_os': 34, 'sideways_rsi_ob': 62, 'sideways_adx_thresh': 7.996954334395773, 'sideways_atr_min_pct': 0.0029059065657476906, 'sideways_atr_max_pct': 0.04578876330395115, 'sideways_tp_mult': 1.2974555542277106, 'sideways_tsl_mult': 0.33845830614904915, 'sideways_time_stop': 20, 'sideways_use_sma': False, 'sideways_use_ema': False, 'sideways_use_atr': True, 'sideways_use_adx': True, 'sideways_use_spike': False, 'sideways_rsi_required': False}.
[I 2025-08-31 11:44:01,442] Trial 376 finished with values: [-0.03929846758590827, 0.03907551276297203] and parameters: {'p_sma': 27, 'p_std': 18, 'p_atr': 14, 'p_adx': 27, 'rsi_period': 49, 'ema1': 18, 'ema2': 32, 'slip_atr_k': 0.03684772455802434, 'slip_spread_k': 0.07270444381465224, 'spread_hl_frac': 0.025597435771142558, 'bb_std_mult': 0.7021839922634462, 'rsi_os': 53, 'rsi_ob': 66, 'vol_spike': 0.12958771665315297, 'adx_thresh': 26.023973803877563, 'atr_min_pct': 0.006460427806462625, 'atr_max_pct': 0.020118759263266284, 'tp_mult': 1.8215648204295571, 'tsl_mult': 0.5688448198054005, 'strategy': 'breakout', 'time_stop': 103, 'use_sma': False, 'use_atr': True, 'use_adx': True, 'use_ema': False, 'use_spike': False, 'rsi_required': True, 'edge_k': 1.1833828161855444, 'edge_cap': 0.0733691205464419, 'bull_strategy': 'breakout', 'bull_bb_std_mult': 2.6365303536160534, 'bull_rsi_os': 54, 'bull_rsi_ob': 62, 'bull_adx_thresh': 24.791187180024775, 'bull_atr_min_pct': 0.025620376637210934, 'bull_atr_max_pct': 0.08315178061845559, 'bull_tp_mult': 2.2883812284036704, 'bull_tsl_mult': 0.2952193762719451, 'bull_time_stop': 295, 'bull_use_sma': True, 'bull_use_ema': True, 'bull_use_atr': True, 'bull_use_adx': True, 'bull_use_spike': False, 'bull_rsi_required': True, 'bear_strategy': 'breakout', 'bear_bb_std_mult': 2.4743618845406177, 'bear_rsi_os': 30, 'bear_rsi_ob': 89, 'bear_adx_thresh': 28.828700822283277, 'bear_atr_min_pct': 0.01489744522891915, 'bear_atr_max_pct': 0.05552229033103748, 'bear_tp_mult': 2.971438442367258, 'bear_tsl_mult': 0.3681130436272032, 'bear_time_stop': 188, 'bear_use_sma': False, 'bear_use_ema': False, 'bear_use_atr': True, 'bear_use_adx': False, 'bear_use_spike': True, 'bear_rsi_required': False, 'sideways_strategy': 'breakout', 'sideways_bb_std_mult': 1.8611477137558703, 'sideways_rsi_os': 49, 'sideways_rsi_ob': 51, 'sideways_adx_thresh': 9.983800195332828, 'sideways_atr_min_pct': 0.003021588936394947, 'sideways_atr_max_pct': 0.04984775974086624, 'sideways_tp_mult': 1.3990024726624224, 'sideways_tsl_mult': 0.33688487368367337, 'sideways_time_stop': 5, 'sideways_use_sma': True, 'sideways_use_ema': False, 'sideways_use_atr': True, 'sideways_use_adx': True, 'sideways_use_spike': False, 'sideways_rsi_required': True}.
[I 2025-08-31 11:44:37,261] Trial 383 finished with values: [-1000000000.0, 1000000000.0] and parameters: {'p_sma': 31, 'p_std': 13, 'p_atr': 8, 'p_adx': 22, 'rsi_period': 78, 'ema1': 25, 'ema2': 45, 'slip_atr_k': 0.027661995031974262, 'slip_spread_k': 0.10503213470553807, 'spread_hl_frac': 0.021250140963833455, 'bb_std_mult': 0.7705994879959035, 'rsi_os': 34, 'rsi_ob': 88, 'vol_spike': 0.051913703229421154, 'adx_thresh': 25.19459239463321, 'atr_min_pct': 0.0047274442526898134, 'atr_max_pct': 0.05058878794538213, 'tp_mult': 1.359454273971505, 'tsl_mult': 0.7838813173846554, 'strategy': 'mean_reversion', 'time_stop': 256, 'use_sma': False, 'use_atr': True, 'use_adx': False, 'use_ema': True, 'use_spike': True, 'rsi_required': True, 'edge_k': 0.3814990613989381, 'edge_cap': 0.10515601999228785, 'bull_strategy': 'breakout', 'bull_bb_std_mult': 2.7024392366092758, 'bull_rsi_os': 37, 'bull_rsi_ob': 52, 'bull_adx_thresh': 15.06210195639098, 'bull_atr_min_pct': 0.010651001519238907, 'bull_atr_max_pct': 0.07860943079758866, 'bull_tp_mult': 1.414787822110273, 'bull_tsl_mult': 0.27763349431290596, 'bull_time_stop': 132, 'bull_use_sma': False, 'bull_use_ema': True, 'bull_use_atr': False, 'bull_use_adx': False, 'bull_use_spike': True, 'bull_rsi_required': False, 'bear_strategy': 'breakout', 'bear_bb_std_mult': 1.7438929347966443, 'bear_rsi_os': 27, 'bear_rsi_ob': 53, 'bear_adx_thresh': 31.44639218109702, 'bear_atr_min_pct': 0.013978616580046253, 'bear_atr_max_pct': 0.12430309421875506, 'bear_tp_mult': 2.7031844312243143, 'bear_tsl_mult': 0.32726464072063427, 'bear_time_stop': 200, 'bear_use_sma': False, 'bear_use_ema': True, 'bear_use_atr': False, 'bear_use_adx': True, 'bear_use_spike': False, 'bear_rsi_required': True, 'sideways_strategy': 'mean_reversion', 'sideways_bb_std_mult': 1.783590110547814, 'sideways_rsi_os': 32, 'sideways_rsi_ob': 71, 'sideways_adx_thresh': 25.155506741815998, 'sideways_atr_min_pct': 0.024025930671608832, 'sideways_atr_max_pct': 0.06646340579124406, 'sideways_tp_mult': 1.427060169264518, 'sideways_tsl_mult': 0.3306196774230621, 'sideways_time_stop': 176, 'sideways_use_sma': False, 'sideways_use_ema': False, 'sideways_use_atr': True, 'sideways_use_adx': False, 'sideways_use_spike': False, 'sideways_rsi_required': True}.
[I 2025-08-31 11:44:37,573] Trial 380 finished with values: [-1000000000.0, 1000000000.0] and parameters: {'p_sma': 31, 'p_std': 15, 'p_atr': 22, 'p_adx': 26, 'rsi_period': 49, 'ema1': 18, 'ema2': 32, 'slip_atr_k': 0.12516953927016247, 'slip_spread_k': 0.3334347803114127, 'spread_hl_frac': 0.02189939597459278, 'bb_std_mult': 2.868901794532614, 'rsi_os': 34, 'rsi_ob': 74, 'vol_spike': 0.19131683117439202, 'adx_thresh': 25.57815569461053, 'atr_min_pct': 0.006259282420857633, 'atr_max_pct': 0.03130339576140537, 'tp_mult': 1.0502138990119385, 'tsl_mult': 0.43149722345380465, 'strategy': 'breakout', 'time_stop': 294, 'use_sma': False, 'use_atr': True, 'use_adx': True, 'use_ema': False, 'use_spike': False, 'rsi_required': True, 'edge_k': 1.1789951862213217, 'edge_cap': 0.8507298469502229, 'bull_strategy': 'breakout', 'bull_bb_std_mult': 2.6250198332730847, 'bull_rsi_os': 38, 'bull_rsi_ob': 62, 'bull_adx_thresh': 14.939393519665023, 'bull_atr_min_pct': 0.022444978591819965, 'bull_atr_max_pct': 0.14291174209770416, 'bull_tp_mult': 1.4558943173488106, 'bull_tsl_mult': 0.3088819360036399, 'bull_time_stop': 148, 'bull_use_sma': True, 'bull_use_ema': True, 'bull_use_atr': True, 'bull_use_adx': False, 'bull_use_spike': False, 'bull_rsi_required': True, 'bear_strategy': 'breakout', 'bear_bb_std_mult': 1.2348025562965204, 'bear_rsi_os': 29, 'bear_rsi_ob': 53, 'bear_adx_thresh': 22.496204228112767, 'bear_atr_min_pct': 0.013933998566806998, 'bear_atr_max_pct': 0.010513952695900275, 'bear_tp_mult': 2.699190334770165, 'bear_tsl_mult': 0.33234170624829323, 'bear_time_stop': 188, 'bear_use_sma': False, 'bear_use_ema': False, 'bear_use_atr': True, 'bear_use_adx': False, 'bear_use_spike': True, 'bear_rsi_required': False, 'sideways_strategy': 'mean_reversion', 'sideways_bb_std_mult': 1.8360243430297, 'sideways_rsi_os': 34, 'sideways_rsi_ob': 62, 'sideways_adx_thresh': 9.189118809824235, 'sideways_atr_min_pct': 0.002952880320817558, 'sideways_atr_max_pct': 0.1111815197012674, 'sideways_tp_mult': 1.4199671148102277, 'sideways_tsl_mult': 0.8875812268707491, 'sideways_time_stop': 164, 'sideways_use_sma': True, 'sideways_use_ema': False, 'sideways_use_atr': True, 'sideways_use_adx': True, 'sideways_use_spike': False, 'sideways_rsi_required': True}.
[I 2025-08-31 11:44:37,573] Trial 381 finished with values: [-0.07032831644178716, 0.06996210069611411] and parameters: {'p_sma': 31, 'p_std': 15, 'p_atr': 25, 'p_adx': 18, 'rsi_period': 42, 'ema1': 13, 'ema2': 56, 'slip_atr_k': 0.12781385696399314, 'slip_spread_k': 0.816918623262074, 'spread_hl_frac': 0.0017949156418458202, 'bb_std_mult': 0.7239841407448029, 'rsi_os': 34, 'rsi_ob': 66, 'vol_spike': 0.06953012950283624, 'adx_thresh': 25.6441708660437, 'atr_min_pct': 0.004939620728432374, 'atr_max_pct': 0.1255118482047063, 'tp_mult': 2.722586653390908, 'tsl_mult': 0.5727478597814767, 'strategy': 'breakout', 'time_stop': 300, 'use_sma': False, 'use_atr': True, 'use_adx': True, 'use_ema': False, 'use_spike': True, 'rsi_required': True, 'edge_k': 0.37241790129239766, 'edge_cap': 0.35016113644272795, 'bull_strategy': 'breakout', 'bull_bb_std_mult': 2.687073473392677, 'bull_rsi_os': 22, 'bull_rsi_ob': 52, 'bull_adx_thresh': 14.987893189651219, 'bull_atr_min_pct': 0.021892764068373406, 'bull_atr_max_pct': 0.14144999043358966, 'bull_tp_mult': 2.2284248981425656, 'bull_tsl_mult': 0.266753264226653, 'bull_time_stop': 201, 'bull_use_sma': False, 'bull_use_ema': True, 'bull_use_atr': True, 'bull_use_adx': False, 'bull_use_spike': False, 'bull_rsi_required': True, 'bear_strategy': 'breakout', 'bear_bb_std_mult': 0.8049396753262097, 'bear_rsi_os': 31, 'bear_rsi_ob': 67, 'bear_adx_thresh': 31.768845116389382, 'bear_atr_min_pct': 0.01809241435905644, 'bear_atr_max_pct': 0.11020130269928304, 'bear_tp_mult': 2.705752611397951, 'bear_tsl_mult': 0.7788405840184529, 'bear_time_stop': 205, 'bear_use_sma': False, 'bear_use_ema': True, 'bear_use_atr': True, 'bear_use_adx': True, 'bear_use_spike': True, 'bear_rsi_required': False, 'sideways_strategy': 'mean_reversion', 'sideways_bb_std_mult': 1.8443473703468258, 'sideways_rsi_os': 33, 'sideways_rsi_ob': 62, 'sideways_adx_thresh': 9.02827887303686, 'sideways_atr_min_pct': 0.0017408756980482466, 'sideways_atr_max_pct': 0.10988865311739972, 'sideways_tp_mult': 1.4063818279343085, 'sideways_tsl_mult': 0.8888617874248993, 'sideways_time_stop': 165, 'sideways_use_sma': False, 'sideways_use_ema': False, 'sideways_use_atr': True, 'sideways_use_adx': False, 'sideways_use_spike': False, 'sideways_rsi_required': True}.
[I 2025-08-31 11:44:37,656] Trial 382 finished with values: [-0.22332546843940926, 0.2230879566645144] and parameters: {'p_sma': 31, 'p_std': 46, 'p_atr': 8, 'p_adx': 29, 'rsi_period': 13, 'ema1': 17, 'ema2': 44, 'slip_atr_k': 0.02792458274857371, 'slip_spread_k': 0.9379730140471995, 'spread_hl_frac': 0.02140052809243989, 'bb_std_mult': 0.7218269962663157, 'rsi_os': 34, 'rsi_ob': 66, 'vol_spike': 0.19145243043748622, 'adx_thresh': 18.711778396662854, 'atr_min_pct': 0.004809883782085787, 'atr_max_pct': 0.025724797176021837, 'tp_mult': 2.7203203142667625, 'tsl_mult': 0.7852266756799999, 'strategy': 'mean_reversion', 'time_stop': 176, 'use_sma': False, 'use_atr': True, 'use_adx': True, 'use_ema': True, 'use_spike': True, 'rsi_required': True, 'edge_k': 1.181293569405915, 'edge_cap': 0.0971397340421648, 'bull_strategy': 'breakout', 'bull_bb_std_mult': 3.1424575000090536, 'bull_rsi_os': 39, 'bull_rsi_ob': 73, 'bull_adx_thresh': 14.905862190349284, 'bull_atr_min_pct': 0.0101273494755477, 'bull_atr_max_pct': 0.1425737673027785, 'bull_tp_mult': 1.1331651552023798, 'bull_tsl_mult': 0.27105198629778526, 'bull_time_stop': 17, 'bull_use_sma': False, 'bull_use_ema': True, 'bull_use_atr': True, 'bull_use_adx': False, 'bull_use_spike': True, 'bull_rsi_required': True, 'bear_strategy': 'breakout', 'bear_bb_std_mult': 2.483072707841861, 'bear_rsi_os': 24, 'bear_rsi_ob': 67, 'bear_adx_thresh': 28.732921446939876, 'bear_atr_min_pct': 0.014003524146041429, 'bear_atr_max_pct': 0.10831735751755371, 'bear_tp_mult': 2.7083399991626154, 'bear_tsl_mult': 0.33072122807324056, 'bear_time_stop': 204, 'bear_use_sma': False, 'bear_use_ema': True, 'bear_use_atr': False, 'bear_use_adx': True, 'bear_use_spike': False, 'bear_rsi_required': True, 'sideways_strategy': 'mean_reversion', 'sideways_bb_std_mult': 1.8487253730698023, 'sideways_rsi_os': 9, 'sideways_rsi_ob': 76, 'sideways_adx_thresh': 9.208623181803349, 'sideways_atr_min_pct': 0.000602096917704725, 'sideways_atr_max_pct': 0.04464141570296804, 'sideways_tp_mult': 1.4254086128142147, 'sideways_tsl_mult': 0.07896887879071762, 'sideways_time_stop': 165, 'sideways_use_sma': True, 'sideways_use_ema': False, 'sideways_use_atr': True, 'sideways_use_adx': False, 'sideways_use_spike': False, 'sideways_rsi_required': True}.
[I 2025-08-31 11:44:38,285] Trial 385 finished with values: [-1000000000.0, 1000000000.0] and parameters: {'p_sma': 48, 'p_std': 31, 'p_atr': 15, 'p_adx': 28, 'rsi_period': 51, 'ema1': 12, 'ema2': 40, 'slip_atr_k': 0.0521759589493133, 'slip_spread_k': 0.10951007441042551, 'spread_hl_frac': 0.001865188039062475, 'bb_std_mult': 3.283179535665986, 'rsi_os': 45, 'rsi_ob': 46, 'vol_spike': 0.14181277834575556, 'adx_thresh': 11.990678060506449, 'atr_min_pct': 0.015605557326812415, 'atr_max_pct': 0.08662844810478536, 'tp_mult': 2.1269670890372447, 'tsl_mult': 0.25615497252781494, 'strategy': 'mean_reversion', 'time_stop': 74, 'use_sma': True, 'use_atr': False, 'use_adx': True, 'use_ema': True, 'use_spike': True, 'rsi_required': False, 'edge_k': 1.9999529588719418, 'edge_cap': 0.8126755718408397, 'bull_strategy': 'mean_reversion', 'bull_bb_std_mult': 3.1115333131315537, 'bull_rsi_os': 50, 'bull_rsi_ob': 70, 'bull_adx_thresh': 16.12568976584667, 'bull_atr_min_pct': 0.00989711336123238, 'bull_atr_max_pct': 0.02286595384031659, 'bull_tp_mult': 1.141342009606843, 'bull_tsl_mult': 0.24915373682416656, 'bull_time_stop': 13, 'bull_use_sma': True, 'bull_use_ema': True, 'bull_use_atr': False, 'bull_use_adx': True, 'bull_use_spike': True, 'bull_rsi_required': True, 'bear_strategy': 'mean_reversion', 'bear_bb_std_mult': 2.6656053313630235, 'bear_rsi_os': 30, 'bear_rsi_ob': 85, 'bear_adx_thresh': 32.95960168658837, 'bear_atr_min_pct': 0.016896992718139162, 'bear_atr_max_pct': 0.07678421662630322, 'bear_tp_mult': 2.607776739093366, 'bear_tsl_mult': 0.2511595345777921, 'bear_time_stop': 196, 'bear_use_sma': True, 'bear_use_ema': True, 'bear_use_atr': False, 'bear_use_adx': False, 'bear_use_spike': False, 'bear_rsi_required': True, 'sideways_strategy': 'breakout', 'sideways_bb_std_mult': 1.7168496124900203, 'sideways_rsi_os': 54, 'sideways_rsi_ob': 84, 'sideways_adx_thresh': 7.699644962190753, 'sideways_atr_min_pct': 0.003842238108694402, 'sideways_atr_max_pct': 0.043383244736263246, 'sideways_tp_mult': 2.6586271412525457, 'sideways_tsl_mult': 0.2965785031348516, 'sideways_time_stop': 20, 'sideways_use_sma': True, 'sideways_use_ema': False, 'sideways_use_atr': False, 'sideways_use_adx': True, 'sideways_use_spike': True, 'sideways_rsi_required': False}.
[I 2025-08-31 11:44:38,286] Trial 386 finished with values: [-1000000000.0, 1000000000.0] and parameters: {'p_sma': 33, 'p_std': 46, 'p_atr': 29, 'p_adx': 28, 'rsi_period': 56, 'ema1': 7, 'ema2': 28, 'slip_atr_k': 0.05439006371544397, 'slip_spread_k': 0.10880044221118434, 'spread_hl_frac': 0.0018994743927927661, 'bb_std_mult': 0.7835082836364512, 'rsi_os': 32, 'rsi_ob': 46, 'vol_spike': 0.21408649108501912, 'adx_thresh': 26.44293765924855, 'atr_min_pct': 0.02762130916390207, 'atr_max_pct': 0.025344213362691083, 'tp_mult': 2.1223569305932894, 'tsl_mult': 0.5969170690708662, 'strategy': 'mean_reversion', 'time_stop': 200, 'use_sma': True, 'use_atr': False, 'use_adx': True, 'use_ema': True, 'use_spike': True, 'rsi_required': False, 'edge_k': 0.28299558314942597, 'edge_cap': 0.8265569555841802, 'bull_strategy': 'mean_reversion', 'bull_bb_std_mult': 2.530472718368667, 'bull_rsi_os': 50, 'bull_rsi_ob': 84, 'bull_adx_thresh': 13.363184799844559, 'bull_atr_min_pct': 0.01000255925519426, 'bull_atr_max_pct': 0.1456768280215289, 'bull_tp_mult': 1.631705080608823, 'bull_tsl_mult': 0.24516311477875302, 'bull_time_stop': 91, 'bull_use_sma': True, 'bull_use_ema': True, 'bull_use_atr': False, 'bull_use_adx': True, 'bull_use_spike': True, 'bull_rsi_required': True, 'bear_strategy': 'mean_reversion', 'bear_bb_std_mult': 1.5177650408403587, 'bear_rsi_os': 30, 'bear_rsi_ob': 51, 'bear_adx_thresh': 30.509892330091862, 'bear_atr_min_pct': 0.016985609163350998, 'bear_atr_max_pct': 0.07972190744478687, 'bear_tp_mult': 2.6124624207136136, 'bear_tsl_mult': 0.9097923706439246, 'bear_time_stop': 197, 'bear_use_sma': True, 'bear_use_ema': True, 'bear_use_atr': False, 'bear_use_adx': False, 'bear_use_spike': False, 'bear_rsi_required': True, 'sideways_strategy': 'breakout', 'sideways_bb_std_mult': 1.471461780042037, 'sideways_rsi_os': 30, 'sideways_rsi_ob': 76, 'sideways_adx_thresh': 12.365548737965792, 'sideways_atr_min_pct': 0.0008462075315922978, 'sideways_atr_max_pct': 0.04596344236724999, 'sideways_tp_mult': 1.3660505986490326, 'sideways_tsl_mult': 0.2890902928173763, 'sideways_time_stop': 21, 'sideways_use_sma': True, 'sideways_use_ema': False, 'sideways_use_atr': False, 'sideways_use_adx': True, 'sideways_use_spike': True, 'sideways_rsi_required': False}.
[I 2025-08-31 11:45:12,683] Trial 384 finished with values: [-1000000000.0, 1000000000.0] and parameters: {'p_sma': 33, 'p_std': 15, 'p_atr': 15, 'p_adx': 26, 'rsi_period': 51, 'ema1': 13, 'ema2': 40, 'slip_atr_k': 0.15390450708507739, 'slip_spread_k': 0.3220803459292222, 'spread_hl_frac': 0.0015922353806120284, 'bb_std_mult': 0.7086388417273396, 'rsi_os': 27, 'rsi_ob': 73, 'vol_spike': 0.005506984382437713, 'adx_thresh': 26.699560548133284, 'atr_min_pct': 0.0041925213763825755, 'atr_max_pct': 0.08793587985894562, 'tp_mult': 1.0124175869079552, 'tsl_mult': 0.1654714377604098, 'strategy': 'breakout', 'time_stop': 295, 'use_sma': False, 'use_atr': True, 'use_adx': True, 'use_ema': False, 'use_spike': True, 'rsi_required': True, 'edge_k': 0.49108828645313884, 'edge_cap': 0.3472313142894861, 'bull_strategy': 'breakout', 'bull_bb_std_mult': 3.086194721412262, 'bull_rsi_os': 39, 'bull_rsi_ob': 84, 'bull_adx_thresh': 16.006260677509367, 'bull_atr_min_pct': 0.022169808064266164, 'bull_atr_max_pct': 0.1421042278095754, 'bull_tp_mult': 1.1319571813956921, 'bull_tsl_mult': 0.23830385314432856, 'bull_time_stop': 149, 'bull_use_sma': True, 'bull_use_ema': True, 'bull_use_atr': True, 'bull_use_adx': False, 'bull_use_spike': False, 'bull_rsi_required': True, 'bear_strategy': 'breakout', 'bear_bb_std_mult': 2.664530241332647, 'bear_rsi_os': 50, 'bear_rsi_ob': 84, 'bear_adx_thresh': 22.773645906911902, 'bear_atr_min_pct': 0.017018690538846828, 'bear_atr_max_pct': 0.07874761782552173, 'bear_tp_mult': 2.6084064842993895, 'bear_tsl_mult': 0.20002559446690332, 'bear_time_stop': 196, 'bear_use_sma': True, 'bear_use_ema': True, 'bear_use_atr': True, 'bear_use_adx': False, 'bear_use_spike': True, 'bear_rsi_required': False, 'sideways_strategy': 'mean_reversion', 'sideways_bb_std_mult': 1.7210844717935956, 'sideways_rsi_os': 31, 'sideways_rsi_ob': 72, 'sideways_adx_thresh': 9.20879693395049, 'sideways_atr_min_pct': 0.015201604585585844, 'sideways_atr_max_pct': 0.07559066428326361, 'sideways_tp_mult': 1.9909582705501916, 'sideways_tsl_mult': 0.8867826915843167, 'sideways_time_stop': 20, 'sideways_use_sma': True, 'sideways_use_ema': False, 'sideways_use_atr': True, 'sideways_use_adx': True, 'sideways_use_spike': True, 'sideways_rsi_required': True}.
