[I 2025-08-31 11:06:19,249] Trial 84 finished with values: [-1000000000.0, 1000000000.0] and parameters: {'p_sma': 27, 'p_std': 53, 'p_atr': 19, 'p_adx': 17, 'rsi_period': 40, 'ema1': 7, 'ema2': 40, 'slip_atr_k': 0.09762344672755868, 'slip_spread_k': 0.7072083020677133, 'spread_hl_frac': 0.02878239361474114, 'bb_std_mult': 1.5979261123763866, 'rsi_os': 33, 'rsi_ob': 46, 'vol_spike': 0.05312578830652148, 'adx_thresh': 28.757866211179707, 'atr_min_pct': 0.024447477246048184, 'atr_max_pct': 0.057369139974700195, 'tp_mult': 1.9300243920361009, 'tsl_mult': 0.006999686694096674, 'strategy': 'mean_reversion', 'time_stop': 119, 'use_sma': True, 'use_atr': True, 'use_adx': False, 'use_ema': True, 'use_spike': False, 'rsi_required': False, 'edge_k': 0.9264567542832922, 'edge_cap': 0.9896817500308794, 'bull_strategy': 'mean_reversion', 'bull_bb_std_mult': 1.295729344133206, 'bull_rsi_os': 47, 'bull_rsi_ob': 88, 'bull_adx_thresh': 7.891641351087234, 'bull_atr_min_pct': 0.013518575014673016, 'bull_atr_max_pct': 0.13722687218866575, 'bull_tp_mult': 2.0672858496599047, 'bull_tsl_mult': 0.12981117030263856, 'bull_time_stop': 110, 'bull_use_sma': False, 'bull_use_ema': False, 'bull_use_atr': False, 'bull_use_adx': False, 'bull_use_spike': True, 'bull_rsi_required': True, 'bear_strategy': 'breakout', 'bear_bb_std_mult': 1.4675399552194768, 'bear_rsi_os': 17, 'bear_rsi_ob': 63, 'bear_adx_thresh': 28.31298260355314, 'bear_atr_min_pct': 0.011975627585193013, 'bear_atr_max_pct': 0.14919450256373196, 'bear_tp_mult': 2.530677667452915, 'bear_tsl_mult': 0.12442545030399471, 'bear_time_stop': 153, 'bear_use_sma': False, 'bear_use_ema': False, 'bear_use_atr': False, 'bear_use_adx': True, 'bear_use_spike': False, 'bear_rsi_required': False, 'sideways_strategy': 'breakout', 'sideways_bb_std_mult': 1.638587626298139, 'sideways_rsi_os': 25, 'sideways_rsi_ob': 81, 'sideways_adx_thresh': 25.289092001397158, 'sideways_atr_min_pct': 0.004147449217471194, 'sideways_atr_max_pct': 0.08738538605671951, 'sideways_tp_mult': 2.749506541892728, 'sideways_tsl_mult': 0.4168013513248954, 'sideways_time_stop': 222, 'sideways_use_sma': True, 'sideways_use_ema': True, 'sideways_use_atr': True, 'sideways_use_adx': True, 'sideways_use_spike': False, 'sideways_rsi_required': False}.
[I 2025-08-31 11:06:50,817] Trial 81 finished with values: [-1000000000.0, 1000000000.0] and parameters: {'p_sma': 19, 'p_std': 56, 'p_atr': 19, 'p_adx': 17, 'rsi_period': 7, 'ema1': 9, 'ema2': 24, 'slip_atr_k': 0.09900537518112355, 'slip_spread_k': 0.4600248013136766, 'spread_hl_frac': 0.013507583119852442, 'bb_std_mult': 1.193401799368789, 'rsi_os': 33, 'rsi_ob': 90, 'vol_spike': 0.05845351619632368, 'adx_thresh': 22.51467009508942, 'atr_min_pct': 0.023838162227525286, 'atr_max_pct': 0.056363282404248996, 'tp_mult': 1.8953733561925443, 'tsl_mult': 0.6461614111799445, 'strategy': 'breakout', 'time_stop': 111, 'use_sma': True, 'use_atr': False, 'use_adx': True, 'use_ema': True, 'use_spike': True, 'rsi_required': False, 'edge_k': 0.9233129600333485, 'edge_cap': 0.3831255208148888, 'bull_strategy': 'mean_reversion', 'bull_bb_std_mult': 2.4766972894387957, 'bull_rsi_os': 53, 'bull_rsi_ob': 88, 'bull_adx_thresh': 13.164175286638734, 'bull_atr_min_pct': 0.013449873387598307, 'bull_atr_max_pct': 0.08510196742039494, 'bull_tp_mult': 2.0788967167358474, 'bull_tsl_mult': 0.08823925036782429, 'bull_time_stop': 158, 'bull_use_sma': False, 'bull_use_ema': False, 'bull_use_atr': False, 'bull_use_adx': False, 'bull_use_spike': True, 'bull_rsi_required': True, 'bear_strategy': 'mean_reversion', 'bear_bb_std_mult': 2.684505744006181, 'bear_rsi_os': 28, 'bear_rsi_ob': 58, 'bear_adx_thresh': 33.45498308520476, 'bear_atr_min_pct': 0.012392098254154922, 'bear_atr_max_pct': 0.11367742665046325, 'bear_tp_mult': 2.5360035738889635, 'bear_tsl_mult': 0.8972414532802192, 'bear_time_stop': 155, 'bear_use_sma': False, 'bear_use_ema': True, 'bear_use_atr': True, 'bear_use_adx': False, 'bear_use_spike': False, 'bear_rsi_required': True, 'sideways_strategy': 'mean_reversion', 'sideways_bb_std_mult': 3.0035154509911997, 'sideways_rsi_os': 25, 'sideways_rsi_ob': 75, 'sideways_adx_thresh': 5.044479229716288, 'sideways_atr_min_pct': 0.0010030543209670721, 'sideways_atr_max_pct': 0.0649297552327182, 'sideways_tp_mult': 2.76489451030995, 'sideways_tsl_mult': 0.1267557911333644, 'sideways_time_stop': 226, 'sideways_use_sma': True, 'sideways_use_ema': True, 'sideways_use_atr': True, 'sideways_use_adx': False, 'sideways_use_spike': False, 'sideways_rsi_required': True}.
[I 2025-08-31 11:06:50,984] Trial 82 finished with values: [-1000000000.0, 1000000000.0] and parameters: {'p_sma': 25, 'p_std': 39, 'p_atr': 19, 'p_adx': 17, 'rsi_period': 15, 'ema1': 18, 'ema2': 18, 'slip_atr_k': 0.09860488688963454, 'slip_spread_k': 0.5353497650859177, 'spread_hl_frac': 0.028592141407611547, 'bb_std_mult': 0.6673787581545927, 'rsi_os': 33, 'rsi_ob': 91, 'vol_spike': 0.019512967270651965, 'adx_thresh': 10.956906965729894, 'atr_min_pct': 0.01751252526355488, 'atr_max_pct': 0.1251683265796345, 'tp_mult': 2.626027042946304, 'tsl_mult': 0.02216244124523531, 'strategy': 'breakout', 'time_stop': 194, 'use_sma': True, 'use_atr': True, 'use_adx': True, 'use_ema': True, 'use_spike': True, 'rsi_required': True, 'edge_k': 1.3890142792103446, 'edge_cap': 0.43977191813423633, 'bull_strategy': 'mean_reversion', 'bull_bb_std_mult': 1.4811714549953048, 'bull_rsi_os': 6, 'bull_rsi_ob': 87, 'bull_adx_thresh': 18.245093312542735, 'bull_atr_min_pct': 0.011384201013316603, 'bull_atr_max_pct': 0.13693095834991514, 'bull_tp_mult': 2.905565049731937, 'bull_tsl_mult': 0.13053509710641908, 'bull_time_stop': 126, 'bull_use_sma': False, 'bull_use_ema': False, 'bull_use_atr': False, 'bull_use_adx': False, 'bull_use_spike': True, 'bull_rsi_required': True, 'bear_strategy': 'breakout', 'bear_bb_std_mult': 3.1597327102749007, 'bear_rsi_os': 46, 'bear_rsi_ob': 89, 'bear_adx_thresh': 15.51776381945626, 'bear_atr_min_pct': 0.02768011745099734, 'bear_atr_max_pct': 0.10830836666999853, 'bear_tp_mult': 2.951114316276881, 'bear_tsl_mult': 0.8895088434093685, 'bear_time_stop': 287, 'bear_use_sma': False, 'bear_use_ema': True, 'bear_use_atr': False, 'bear_use_adx': True, 'bear_use_spike': False, 'bear_rsi_required': True, 'sideways_strategy': 'breakout', 'sideways_bb_std_mult': 3.3248642808532645, 'sideways_rsi_os': 25, 'sideways_rsi_ob': 72, 'sideways_adx_thresh': 21.788648966148646, 'sideways_atr_min_pct': 0.003645053434827754, 'sideways_atr_max_pct': 0.028505623583968277, 'sideways_tp_mult': 2.7393423586898002, 'sideways_tsl_mult': 0.12529063541368937, 'sideways_time_stop': 180, 'sideways_use_sma': True, 'sideways_use_ema': True, 'sideways_use_atr': True, 'sideways_use_adx': True, 'sideways_use_spike': False, 'sideways_rsi_required': True}.
[I 2025-08-31 11:06:51,123] Trial 83 finished with values: [-1000000000.0, 1000000000.0] and parameters: {'p_sma': 25, 'p_std': 52, 'p_atr': 24, 'p_adx': 17, 'rsi_period': 15, 'ema1': 7, 'ema2': 41, 'slip_atr_k': 0.06642052942686519, 'slip_spread_k': 0.2665984908271228, 'spread_hl_frac': 0.013552848037227904, 'bb_std_mult': 3.0210987031162495, 'rsi_os': 44, 'rsi_ob': 92, 'vol_spike': 0.004169892755894966, 'adx_thresh': 15.638781561128056, 'atr_min_pct': 0.01764115175167804, 'atr_max_pct': 0.05826999974305365, 'tp_mult': 1.936704981578155, 'tsl_mult': 0.31541824888596104, 'strategy': 'mean_reversion', 'time_stop': 124, 'use_sma': True, 'use_atr': True, 'use_adx': True, 'use_ema': True, 'use_spike': True, 'rsi_required': False, 'edge_k': 1.3780842893124219, 'edge_cap': 0.44052017762727325, 'bull_strategy': 'mean_reversion', 'bull_bb_std_mult': 2.449800679136084, 'bull_rsi_os': 45, 'bull_rsi_ob': 86, 'bull_adx_thresh': 7.488935300164069, 'bull_atr_min_pct': 0.013912097432588613, 'bull_atr_max_pct': 0.13382383872341486, 'bull_tp_mult': 1.0915567361199217, 'bull_tsl_mult': 0.4029722748919248, 'bull_time_stop': 5, 'bull_use_sma': False, 'bull_use_ema': False, 'bull_use_atr': False, 'bull_use_adx': False, 'bull_use_spike': True, 'bull_rsi_required': True, 'bear_strategy': 'breakout', 'bear_bb_std_mult': 3.220090170926415, 'bear_rsi_os': 15, 'bear_rsi_ob': 88, 'bear_adx_thresh': 29.884807750078537, 'bear_atr_min_pct': 0.027470540837627514, 'bear_atr_max_pct': 0.10630250521935725, 'bear_tp_mult': 2.9725782368022804, 'bear_tsl_mult': 0.837149992695932, 'bear_time_stop': 156, 'bear_use_sma': False, 'bear_use_ema': True, 'bear_use_atr': False, 'bear_use_adx': True, 'bear_use_spike': False, 'bear_rsi_required': False, 'sideways_strategy': 'breakout', 'sideways_bb_std_mult': 2.9600275272164143, 'sideways_rsi_os': 25, 'sideways_rsi_ob': 81, 'sideways_adx_thresh': 5.049695576748977, 'sideways_atr_min_pct': 0.0043061134374008155, 'sideways_atr_max_pct': 0.04166893743041484, 'sideways_tp_mult': 2.7216172118606066, 'sideways_tsl_mult': 0.13256797486306743, 'sideways_time_stop': 188, 'sideways_use_sma': True, 'sideways_use_ema': True, 'sideways_use_atr': True, 'sideways_use_adx': True, 'sideways_use_spike': False, 'sideways_rsi_required': True}.
[I 2025-08-31 11:06:51,527] Trial 85 finished with values: [-1000000000.0, 1000000000.0] and parameters: {'p_sma': 25, 'p_std': 56, 'p_atr': 11, 'p_adx': 22, 'rsi_period': 15, 'ema1': 11, 'ema2': 24, 'slip_atr_k': 0.11831169347330336, 'slip_spread_k': 0.37744888867586435, 'spread_hl_frac': 0.026515660071537453, 'bb_std_mult': 0.6527279661667131, 'rsi_os': 17, 'rsi_ob': 65, 'vol_spike': 0.10264540832734606, 'adx_thresh': 25.521454956975845, 'atr_min_pct': 0.013184737052875855, 'atr_max_pct': 0.12407326678114272, 'tp_mult': 2.018278232087139, 'tsl_mult': 0.6032614036956674, 'strategy': 'breakout', 'time_stop': 196, 'use_sma': False, 'use_atr': False, 'use_adx': True, 'use_ema': True, 'use_spike': True, 'rsi_required': False, 'edge_k': 1.3778689275719702, 'edge_cap': 0.4208657655613227, 'bull_strategy': 'mean_reversion', 'bull_bb_std_mult': 2.4468851311070896, 'bull_rsi_os': 44, 'bull_rsi_ob': 80, 'bull_adx_thresh': 7.182407428754547, 'bull_atr_min_pct': 0.014323117978429774, 'bull_atr_max_pct': 0.01188578238825913, 'bull_tp_mult': 1.1352420086671047, 'bull_tsl_mult': 0.07690953707363962, 'bull_time_stop': 229, 'bull_use_sma': True, 'bull_use_ema': False, 'bull_use_atr': False, 'bull_use_adx': False, 'bull_use_spike': True, 'bull_rsi_required': True, 'bear_strategy': 'breakout', 'bear_bb_std_mult': 3.0182765713474553, 'bear_rsi_os': 46, 'bear_rsi_ob': 49, 'bear_adx_thresh': 26.0245707058336, 'bear_atr_min_pct': 0.010013253291317886, 'bear_atr_max_pct': 0.08793037759381032, 'bear_tp_mult': 2.9536895455518577, 'bear_tsl_mult': 0.838270233152031, 'bear_time_stop': 99, 'bear_use_sma': False, 'bear_use_ema': True, 'bear_use_atr': False, 'bear_use_adx': True, 'bear_use_spike': False, 'bear_rsi_required': True, 'sideways_strategy': 'breakout', 'sideways_bb_std_mult': 3.0992778503479266, 'sideways_rsi_os': 41, 'sideways_rsi_ob': 82, 'sideways_adx_thresh': 21.068830771057687, 'sideways_atr_min_pct': 0.01900379664716331, 'sideways_atr_max_pct': 0.032809316589990534, 'sideways_tp_mult': 2.6586862415473234, 'sideways_tsl_mult': 0.13877270773162959, 'sideways_time_stop': 29, 'sideways_use_sma': True, 'sideways_use_ema': True, 'sideways_use_atr': True, 'sideways_use_adx': False, 'sideways_use_spike': False, 'sideways_rsi_required': True}.
[I 2025-08-31 11:07:22,301] Trial 86 finished with values: [-0.05398955038204367, 0.05382682128635211] and parameters: {'p_sma': 17, 'p_std': 32, 'p_atr': 11, 'p_adx': 30, 'rsi_period': 15, 'ema1': 29, 'ema2': 19, 'slip_atr_k': 0.015453978032273857, 'slip_spread_k': 0.5316026042036464, 'spread_hl_frac': 0.016043726477344665, 'bb_std_mult': 0.6858465407908998, 'rsi_os': 43, 'rsi_ob': 92, 'vol_spike': 0.00092576107690788, 'adx_thresh': 11.879156389453227, 'atr_min_pct': 0.017445320396094047, 'atr_max_pct': 0.018097362492193195, 'tp_mult': 2.8046814847588117, 'tsl_mult': 0.4813505911645763, 'strategy': 'mean_reversion', 'time_stop': 21, 'use_sma': False, 'use_atr': True, 'use_adx': False, 'use_ema': True, 'use_spike': False, 'rsi_required': True, 'edge_k': 0.798468999378528, 'edge_cap': 0.7889262345421727, 'bull_strategy': 'mean_reversion', 'bull_bb_std_mult': 2.6622428219111267, 'bull_rsi_os': 5, 'bull_rsi_ob': 80, 'bull_adx_thresh': 7.015585166656756, 'bull_atr_min_pct': 0.028916979304302155, 'bull_atr_max_pct': 0.07721414587062818, 'bull_tp_mult': 1.1062984324418994, 'bull_tsl_mult': 0.0038476505338451705, 'bull_time_stop': 6, 'bull_use_sma': True, 'bull_use_ema': True, 'bull_use_atr': False, 'bull_use_adx': False, 'bull_use_spike': True, 'bull_rsi_required': True, 'bear_strategy': 'breakout', 'bear_bb_std_mult': 3.123121607455526, 'bear_rsi_os': 46, 'bear_rsi_ob': 50, 'bear_adx_thresh': 18.64103809376841, 'bear_atr_min_pct': 0.02757654635855242, 'bear_atr_max_pct': 0.09659468656254384, 'bear_tp_mult': 2.9700056761174127, 'bear_tsl_mult': 0.8342095356149912, 'bear_time_stop': 136, 'bear_use_sma': False, 'bear_use_ema': False, 'bear_use_atr': False, 'bear_use_adx': True, 'bear_use_spike': False, 'bear_rsi_required': True, 'sideways_strategy': 'breakout', 'sideways_bb_std_mult': 3.226260695474266, 'sideways_rsi_os': 35, 'sideways_rsi_ob': 54, 'sideways_adx_thresh': 20.128583044197264, 'sideways_atr_min_pct': 0.002205951770067915, 'sideways_atr_max_pct': 0.02811105263734104, 'sideways_tp_mult': 2.994671640701582, 'sideways_tsl_mult': 0.11684193044339475, 'sideways_time_stop': 82, 'sideways_use_sma': True, 'sideways_use_ema': False, 'sideways_use_atr': True, 'sideways_use_adx': True, 'sideways_use_spike': False, 'sideways_rsi_required': False}.
[I 2025-08-31 11:07:22,459] Trial 88 finished with values: [-0.05048971983736261, 0.05028604884450492] and parameters: {'p_sma': 16, 'p_std': 31, 'p_atr': 11, 'p_adx': 27, 'rsi_period': 65, 'ema1': 10, 'ema2': 59, 'slip_atr_k': 0.12110846151633738, 'slip_spread_k': 0.37982950251694225, 'spread_hl_frac': 0.002206687763318697, 'bb_std_mult': 1.7180287652473252, 'rsi_os': 26, 'rsi_ob': 94, 'vol_spike': 0.14028951922568966, 'adx_thresh': 26.07059002570476, 'atr_min_pct': 0.004875547932962862, 'atr_max_pct': 0.10495521501280651, 'tp_mult': 2.7914028713282524, 'tsl_mult': 0.6028247658284986, 'strategy': 'breakout', 'time_stop': 21, 'use_sma': False, 'use_atr': False, 'use_adx': False, 'use_ema': True, 'use_spike': False, 'rsi_required': False, 'edge_k': 0.7655584068541914, 'edge_cap': 0.7942997711008957, 'bull_strategy': 'breakout', 'bull_bb_std_mult': 2.6541526892138436, 'bull_rsi_os': 21, 'bull_rsi_ob': 82, 'bull_adx_thresh': 7.0797386656358645, 'bull_atr_min_pct': 0.0071677163511947375, 'bull_atr_max_pct': 0.07213615736643154, 'bull_tp_mult': 2.209295740395619, 'bull_tsl_mult': 0.9366179930397607, 'bull_time_stop': 229, 'bull_use_sma': True, 'bull_use_ema': True, 'bull_use_atr': True, 'bull_use_adx': True, 'bull_use_spike': True, 'bull_rsi_required': True, 'bear_strategy': 'breakout', 'bear_bb_std_mult': 2.00056324493825, 'bear_rsi_os': 18, 'bear_rsi_ob': 50, 'bear_adx_thresh': 25.55540897424922, 'bear_atr_min_pct': 0.010000192581581725, 'bear_atr_max_pct': 0.0960229449203462, 'bear_tp_mult': 2.3916356959491116, 'bear_tsl_mult': 0.9812700681758042, 'bear_time_stop': 99, 'bear_use_sma': True, 'bear_use_ema': False, 'bear_use_atr': False, 'bear_use_adx': True, 'bear_use_spike': False, 'bear_rsi_required': True, 'sideways_strategy': 'breakout', 'sideways_bb_std_mult': 1.3267560609127564, 'sideways_rsi_os': 42, 'sideways_rsi_ob': 82, 'sideways_adx_thresh': 20.513333954366438, 'sideways_atr_min_pct': 0.0019292672409525397, 'sideways_atr_max_pct': 0.07985082224316212, 'sideways_tp_mult': 1.6539472285300694, 'sideways_tsl_mult': 0.03628634394278042, 'sideways_time_stop': 32, 'sideways_use_sma': True, 'sideways_use_ema': False, 'sideways_use_atr': False, 'sideways_use_adx': False, 'sideways_use_spike': False, 'sideways_rsi_required': False}.
[I 2025-08-31 11:07:22,956] Trial 87 finished with values: [-0.08038824090566798, 0.08008427646214188] and parameters: {'p_sma': 16, 'p_std': 7, 'p_atr': 8, 'p_adx': 27, 'rsi_period': 53, 'ema1': 11, 'ema2': 52, 'slip_atr_k': 0.11851491771714644, 'slip_spread_k': 0.3708897923108123, 'spread_hl_frac': 0.026649993329117827, 'bb_std_mult': 3.5971787236036317, 'rsi_os': 40, 'rsi_ob': 66, 'vol_spike': 0.10236610395066031, 'adx_thresh': 15.609423094173202, 'atr_min_pct': 0.013292359040147835, 'atr_max_pct': 0.10560707355423016, 'tp_mult': 1.5212321400570112, 'tsl_mult': 0.3151395014556124, 'strategy': 'mean_reversion', 'time_stop': 223, 'use_sma': False, 'use_atr': False, 'use_adx': False, 'use_ema': True, 'use_spike': False, 'rsi_required': False, 'edge_k': 0.6519610172711225, 'edge_cap': 0.6372270159719663, 'bull_strategy': 'mean_reversion', 'bull_bb_std_mult': 2.628735093427279, 'bull_rsi_os': 44, 'bull_rsi_ob': 82, 'bull_adx_thresh': 7.712552239862962, 'bull_atr_min_pct': 0.010208148147257344, 'bull_atr_max_pct': 0.07731121372663594, 'bull_tp_mult': 2.7704536070296037, 'bull_tsl_mult': 0.0011705860929860853, 'bull_time_stop': 253, 'bull_use_sma': True, 'bull_use_ema': True, 'bull_use_atr': False, 'bull_use_adx': True, 'bull_use_spike': True, 'bull_rsi_required': True, 'bear_strategy': 'breakout', 'bear_bb_std_mult': 2.0856359254951626, 'bear_rsi_os': 18, 'bear_rsi_ob': 65, 'bear_adx_thresh': 25.397588457196186, 'bear_atr_min_pct': 0.00994264847083396, 'bear_atr_max_pct': 0.09573845426099727, 'bear_tp_mult': 2.384743070665987, 'bear_tsl_mult': 0.8494288470841449, 'bear_time_stop': 99, 'bear_use_sma': False, 'bear_use_ema': False, 'bear_use_atr': False, 'bear_use_adx': True, 'bear_use_spike': False, 'bear_rsi_required': False, 'sideways_strategy': 'breakout', 'sideways_bb_std_mult': 2.164053372477486, 'sideways_rsi_os': 42, 'sideways_rsi_ob': 82, 'sideways_adx_thresh': 20.480763949182876, 'sideways_atr_min_pct': 0.0023858566509432416, 'sideways_atr_max_pct': 0.05894673571532043, 'sideways_tp_mult': 2.8333828565499117, 'sideways_tsl_mult': 0.05260947913955452, 'sideways_time_stop': 92, 'sideways_use_sma': True, 'sideways_use_ema': False, 'sideways_use_atr': True, 'sideways_use_adx': False, 'sideways_use_spike': False, 'sideways_rsi_required': False}.
[I 2025-08-31 11:07:23,045] Trial 89 finished with values: [-0.08314262334029154, 0.08280956740791821] and parameters: {'p_sma': 51, 'p_std': 6, 'p_atr': 14, 'p_adx': 11, 'rsi_period': 81, 'ema1': 7, 'ema2': 50, 'slip_atr_k': 0.14347164892298261, 'slip_spread_k': 0.681145879012967, 'spread_hl_frac': 0.01961471951488947, 'bb_std_mult': 1.7159434496390427, 'rsi_os': 26, 'rsi_ob': 94, 'vol_spike': 0.07657783002016103, 'adx_thresh': 14.181664720571003, 'atr_min_pct': 0.011170579285393457, 'atr_max_pct': 0.10441761992785145, 'tp_mult': 1.5261624897363122, 'tsl_mult': 0.48164083996011064, 'strategy': 'mean_reversion', 'time_stop': 225, 'use_sma': False, 'use_atr': False, 'use_adx': False, 'use_ema': True, 'use_spike': False, 'rsi_required': False, 'edge_k': 0.7800676435323495, 'edge_cap': 0.641609972334662, 'bull_strategy': 'breakout', 'bull_bb_std_mult': 2.582731523912018, 'bull_rsi_os': 20, 'bull_rsi_ob': 83, 'bull_adx_thresh': 5.708954409494785, 'bull_atr_min_pct': 0.009782428118183674, 'bull_atr_max_pct': 0.07183855466132008, 'bull_tp_mult': 1.7203667373345635, 'bull_tsl_mult': 0.27582191407823137, 'bull_time_stop': 254, 'bull_use_sma': True, 'bull_use_ema': True, 'bull_use_atr': True, 'bull_use_adx': True, 'bull_use_spike': True, 'bull_rsi_required': True, 'bear_strategy': 'breakout', 'bear_bb_std_mult': 2.0848040333201574, 'bear_rsi_os': 18, 'bear_rsi_ob': 65, 'bear_adx_thresh': 12.208999526564192, 'bear_atr_min_pct': 0.0002133761426367127, 'bear_atr_max_pct': 0.09508162016818547, 'bear_tp_mult': 2.7940774813948246, 'bear_tsl_mult': 0.03770555295619504, 'bear_time_stop': 138, 'bear_use_sma': True, 'bear_use_ema': False, 'bear_use_atr': False, 'bear_use_adx': True, 'bear_use_spike': False, 'bear_rsi_required': True, 'sideways_strategy': 'breakout', 'sideways_bb_std_mult': 2.1439584777928387, 'sideways_rsi_os': 44, 'sideways_rsi_ob': 48, 'sideways_adx_thresh': 32.69526826377282, 'sideways_atr_min_pct': 0.0020143592984251746, 'sideways_atr_max_pct': 0.027612294556865896, 'sideways_tp_mult': 2.999466532339361, 'sideways_tsl_mult': 0.034455589866184216, 'sideways_time_stop': 88, 'sideways_use_sma': True, 'sideways_use_ema': False, 'sideways_use_atr': False, 'sideways_use_adx': False, 'sideways_use_spike': False, 'sideways_rsi_required': False}.
