[I 2025-08-31 11:04:12,683] Trial 65 finished with values: [-1000000000.0, 1000000000.0] and parameters: {'p_sma': 20, 'p_std': 34, 'p_atr': 20, 'p_adx': 28, 'rsi_period': 15, 'ema1': 27, 'ema2': 28, 'slip_atr_k': 0.23891713147601817, 'slip_spread_k': 0.4893558067884901, 'spread_hl_frac': 4.859702773534619e-05, 'bb_std_mult': 1.0875343763417686, 'rsi_os': 21, 'rsi_ob': 88, 'vol_spike': 0.15277579909292324, 'adx_thresh': 8.87906376916633, 'atr_min_pct': 0.015788215294001574, 'atr_max_pct': 0.012977040187335517, 'tp_mult': 1.7996236118545543, 'tsl_mult': 0.36712369220157104, 'strategy': 'breakout', 'time_stop': 153, 'use_sma': False, 'use_atr': False, 'use_adx': True, 'use_ema': True, 'use_spike': True, 'rsi_required': False, 'edge_k': 1.1810862523608046, 'edge_cap': 0.47686829231803896, 'bull_strategy': 'mean_reversion', 'bull_bb_std_mult': 2.3606374338112524, 'bull_rsi_os': 10, 'bull_rsi_ob': 61, 'bull_adx_thresh': 15.112879955144795, 'bull_atr_min_pct': 0.011041743238648979, 'bull_atr_max_pct': 0.06891082382546972, 'bull_tp_mult': 1.5599072504573142, 'bull_tsl_mult': 0.028092944037035356, 'bull_time_stop': 118, 'bull_use_sma': True, 'bull_use_ema': False, 'bull_use_atr': False, 'bull_use_adx': False, 'bull_use_spike': False, 'bull_rsi_required': True, 'bear_strategy': 'breakout', 'bear_bb_std_mult': 1.7209351234669086, 'bear_rsi_os': 14, 'bear_rsi_ob': 49, 'bear_adx_thresh': 8.991161285676773, 'bear_atr_min_pct': 0.026151863735416787, 'bear_atr_max_pct': 0.08403169824000917, 'bear_tp_mult': 1.5026965684827385, 'bear_tsl_mult': 0.8477480583260194, 'bear_time_stop': 143, 'bear_use_sma': False, 'bear_use_ema': True, 'bear_use_atr': True, 'bear_use_adx': True, 'bear_use_spike': False, 'bear_rsi_required': True, 'sideways_strategy': 'breakout', 'sideways_bb_std_mult': 1.2295371995352236, 'sideways_rsi_os': 30, 'sideways_rsi_ob': 74, 'sideways_adx_thresh': 22.493148588239453, 'sideways_atr_min_pct': 0.006851425594569534, 'sideways_atr_max_pct': 0.05307860388446946, 'sideways_tp_mult': 2.687118864376988, 'sideways_tsl_mult': 0.0012494199786836635, 'sideways_time_stop': 50, 'sideways_use_sma': True, 'sideways_use_ema': True, 'sideways_use_atr': True, 'sideways_use_adx': False, 'sideways_use_spike': False, 'sideways_rsi_required': True}.
[I 2025-08-31 11:04:42,169] Trial 62 finished with values: [-1000000000.0, 1000000000.0] and parameters: {'p_sma': 13, 'p_std': 34, 'p_atr': 20, 'p_adx': 30, 'rsi_period': 11, 'ema1': 11, 'ema2': 22, 'slip_atr_k': 0.21251649444669954, 'slip_spread_k': 0.5033357400181095, 'spread_hl_frac': 0.00010628415785939385, 'bb_std_mult': 1.0266848294961883, 'rsi_os': 19, 'rsi_ob': 93, 'vol_spike': 0.11228484596758394, 'adx_thresh': 14.973185081024111, 'atr_min_pct': 0.012292571407682345, 'atr_max_pct': 0.14261460670799758, 'tp_mult': 1.8140207088084903, 'tsl_mult': 0.5799811449999742, 'strategy': 'breakout', 'time_stop': 105, 'use_sma': True, 'use_atr': False, 'use_adx': True, 'use_ema': True, 'use_spike': True, 'rsi_required': True, 'edge_k': 1.0701167372005087, 'edge_cap': 0.48512453001780753, 'bull_strategy': 'mean_reversion', 'bull_bb_std_mult': 2.356072631197639, 'bull_rsi_os': 6, 'bull_rsi_ob': 65, 'bull_adx_thresh': 8.370753484107064, 'bull_atr_min_pct': 0.015223392789830266, 'bull_atr_max_pct': 0.05588049565154508, 'bull_tp_mult': 1.5206912360780076, 'bull_tsl_mult': 0.04573507113115223, 'bull_time_stop': 117, 'bull_use_sma': False, 'bull_use_ema': False, 'bull_use_atr': False, 'bull_use_adx': False, 'bull_use_spike': True, 'bull_rsi_required': False, 'bear_strategy': 'mean_reversion', 'bear_bb_std_mult': 2.0004002338816127, 'bear_rsi_os': 20, 'bear_rsi_ob': 47, 'bear_adx_thresh': 8.79560733304833, 'bear_atr_min_pct': 0.025315653526581643, 'bear_atr_max_pct': 0.07997696883738775, 'bear_tp_mult': 1.5209823434852117, 'bear_tsl_mult': 0.8636611809851065, 'bear_time_stop': 130, 'bear_use_sma': False, 'bear_use_ema': True, 'bear_use_atr': True, 'bear_use_adx': False, 'bear_use_spike': False, 'bear_rsi_required': True, 'sideways_strategy': 'mean_reversion', 'sideways_bb_std_mult': 1.2345014570696984, 'sideways_rsi_os': 30, 'sideways_rsi_ob': 82, 'sideways_adx_thresh': 18.992038240080884, 'sideways_atr_min_pct': 0.006286816820369861, 'sideways_atr_max_pct': 0.07079893149519882, 'sideways_tp_mult': 2.874527203715662, 'sideways_tsl_mult': 0.02203028197048503, 'sideways_time_stop': 58, 'sideways_use_sma': True, 'sideways_use_ema': True, 'sideways_use_atr': True, 'sideways_use_adx': False, 'sideways_use_spike': False, 'sideways_rsi_required': True}.
[I 2025-08-31 11:04:42,194] Trial 63 finished with values: [-1000000000.0, 1000000000.0] and parameters: {'p_sma': 15, 'p_std': 36, 'p_atr': 30, 'p_adx': 29, 'rsi_period': 19, 'ema1': 10, 'ema2': 29, 'slip_atr_k': 0.1549761400041014, 'slip_spread_k': 0.5177086665285618, 'spread_hl_frac': 0.008305984946177805, 'bb_std_mult': 1.0207368059923414, 'rsi_os': 21, 'rsi_ob': 93, 'vol_spike': 0.0010057345048314348, 'adx_thresh': 7.523611859509995, 'atr_min_pct': 0.016437411656224418, 'atr_max_pct': 0.14246506998540712, 'tp_mult': 1.840429234219331, 'tsl_mult': 0.35079940996992726, 'strategy': 'breakout', 'time_stop': 103, 'use_sma': True, 'use_atr': False, 'use_adx': True, 'use_ema': True, 'use_spike': True, 'rsi_required': True, 'edge_k': 1.0046577896528306, 'edge_cap': 0.4822769640173643, 'bull_strategy': 'mean_reversion', 'bull_bb_std_mult': 2.3288057683959806, 'bull_rsi_os': 13, 'bull_rsi_ob': 63, 'bull_adx_thresh': 14.750097147345416, 'bull_atr_min_pct': 0.01504285351847601, 'bull_atr_max_pct': 0.09072446103269433, 'bull_tp_mult': 2.0079833228902433, 'bull_tsl_mult': 0.028280790655996552, 'bull_time_stop': 62, 'bull_use_sma': False, 'bull_use_ema': False, 'bull_use_atr': False, 'bull_use_adx': False, 'bull_use_spike': False, 'bull_rsi_required': False, 'bear_strategy': 'breakout', 'bear_bb_std_mult': 1.7253943518882795, 'bear_rsi_os': 13, 'bear_rsi_ob': 47, 'bear_adx_thresh': 17.01091678687978, 'bear_atr_min_pct': 0.025608392375202033, 'bear_atr_max_pct': 0.08018631832228452, 'bear_tp_mult': 1.5118961408511158, 'bear_tsl_mult': 0.8580544941358381, 'bear_time_stop': 132, 'bear_use_sma': False, 'bear_use_ema': True, 'bear_use_atr': True, 'bear_use_adx': False, 'bear_use_spike': False, 'bear_rsi_required': True, 'sideways_strategy': 'mean_reversion', 'sideways_bb_std_mult': 1.4739874132006607, 'sideways_rsi_os': 33, 'sideways_rsi_ob': 86, 'sideways_adx_thresh': 18.59105074933227, 'sideways_atr_min_pct': 0.006841499775954523, 'sideways_atr_max_pct': 0.08527052592556847, 'sideways_tp_mult': 1.915526394449247, 'sideways_tsl_mult': 0.007658733030795596, 'sideways_time_stop': 48, 'sideways_use_sma': True, 'sideways_use_ema': True, 'sideways_use_atr': True, 'sideways_use_adx': False, 'sideways_use_spike': False, 'sideways_rsi_required': True}.
[I 2025-08-31 11:04:43,607] Trial 67 finished with values: [-1000000000.0, 1000000000.0] and parameters: {'p_sma': 50, 'p_std': 52, 'p_atr': 15, 'p_adx': 26, 'rsi_period': 18, 'ema1': 9, 'ema2': 32, 'slip_atr_k': 0.15303312346091869, 'slip_spread_k': 0.6012188755868636, 'spread_hl_frac': 0.017401026391738218, 'bb_std_mult': 3.318283660319989, 'rsi_os': 18, 'rsi_ob': 95, 'vol_spike': 0.04221855405650851, 'adx_thresh': 16.4761305621029, 'atr_min_pct': 0.01697327863089522, 'atr_max_pct': 0.13242578892547924, 'tp_mult': 1.1656149188271825, 'tsl_mult': 0.4219783545684534, 'strategy': 'breakout', 'time_stop': 175, 'use_sma': True, 'use_atr': True, 'use_adx': True, 'use_ema': True, 'use_spike': False, 'rsi_required': False, 'edge_k': 0.9808954984573249, 'edge_cap': 0.8747182858979223, 'bull_strategy': 'mean_reversion', 'bull_bb_std_mult': 1.0972485566211418, 'bull_rsi_os': 9, 'bull_rsi_ob': 63, 'bull_adx_thresh': 8.370058230373132, 'bull_atr_min_pct': 0.0020186398809881757, 'bull_atr_max_pct': 0.0923902171521256, 'bull_tp_mult': 1.9764799763547392, 'bull_tsl_mult': 0.10416109248616413, 'bull_time_stop': 145, 'bull_use_sma': False, 'bull_use_ema': True, 'bull_use_atr': False, 'bull_use_adx': False, 'bull_use_spike': True, 'bull_rsi_required': True, 'bear_strategy': 'breakout', 'bear_bb_std_mult': 2.491907129437656, 'bear_rsi_os': 8, 'bear_rsi_ob': 47, 'bear_adx_thresh': 11.799472253221246, 'bear_atr_min_pct': 0.0012909340371513554, 'bear_atr_max_pct': 0.09048060324975012, 'bear_tp_mult': 2.1526191040576927, 'bear_tsl_mult': 0.6523133304567084, 'bear_time_stop': 144, 'bear_use_sma': False, 'bear_use_ema': False, 'bear_use_atr': False, 'bear_use_adx': True, 'bear_use_spike': False, 'bear_rsi_required': True, 'sideways_strategy': 'breakout', 'sideways_bb_std_mult': 1.4675531022351076, 'sideways_rsi_os': 21, 'sideways_rsi_ob': 77, 'sideways_adx_thresh': 21.641941936960365, 'sideways_atr_min_pct': 0.0035236284957729453, 'sideways_atr_max_pct': 0.09248820640197836, 'sideways_tp_mult': 1.863734055002919, 'sideways_tsl_mult': 0.2231387112136038, 'sideways_time_stop': 63, 'sideways_use_sma': True, 'sideways_use_ema': False, 'sideways_use_atr': True, 'sideways_use_adx': True, 'sideways_use_spike': False, 'sideways_rsi_required': True}.
[I 2025-08-31 11:04:44,017] Trial 66 finished with values: [-1000000000.0, 1000000000.0] and parameters: {'p_sma': 8, 'p_std': 35, 'p_atr': 30, 'p_adx': 28, 'rsi_period': 18, 'ema1': 27, 'ema2': 31, 'slip_atr_k': 0.15240006348175672, 'slip_spread_k': 0.6028336438524371, 'spread_hl_frac': 0.001931719351436519, 'bb_std_mult': 1.0127654298430013, 'rsi_os': 18, 'rsi_ob': 95, 'vol_spike': 0.03565596892639477, 'adx_thresh': 13.458630965088917, 'atr_min_pct': 0.015802389465195382, 'atr_max_pct': 0.14901534137749173, 'tp_mult': 1.8660522075944288, 'tsl_mult': 0.497654356600856, 'strategy': 'breakout', 'time_stop': 152, 'use_sma': True, 'use_atr': True, 'use_adx': True, 'use_ema': True, 'use_spike': True, 'rsi_required': False, 'edge_k': 1.223812834916689, 'edge_cap': 0.5627258169027292, 'bull_strategy': 'mean_reversion', 'bull_bb_std_mult': 1.024280028899906, 'bull_rsi_os': 10, 'bull_rsi_ob': 63, 'bull_adx_thresh': 8.913404669281306, 'bull_atr_min_pct': 0.004895376209242481, 'bull_atr_max_pct': 0.09144468914230444, 'bull_tp_mult': 2.0181264219452286, 'bull_tsl_mult': 0.11394229236858552, 'bull_time_stop': 146, 'bull_use_sma': False, 'bull_use_ema': True, 'bull_use_atr': False, 'bull_use_adx': False, 'bull_use_spike': True, 'bull_rsi_required': True, 'bear_strategy': 'breakout', 'bear_bb_std_mult': 1.796656583629047, 'bear_rsi_os': 22, 'bear_rsi_ob': 48, 'bear_adx_thresh': 6.8607755696083546, 'bear_atr_min_pct': 0.026545271333553534, 'bear_atr_max_pct': 0.10869602122624968, 'bear_tp_mult': 1.9793156830504817, 'bear_tsl_mult': 0.8823691526518336, 'bear_time_stop': 142, 'bear_use_sma': False, 'bear_use_ema': True, 'bear_use_atr': False, 'bear_use_adx': True, 'bear_use_spike': False, 'bear_rsi_required': True, 'sideways_strategy': 'breakout', 'sideways_bb_std_mult': 1.470990560283417, 'sideways_rsi_os': 20, 'sideways_rsi_ob': 86, 'sideways_adx_thresh': 27.438273619141626, 'sideways_atr_min_pct': 0.006654894628374634, 'sideways_atr_max_pct': 0.0828722788157908, 'sideways_tp_mult': 2.6995519723521197, 'sideways_tsl_mult': 0.9536883893119412, 'sideways_time_stop': 64, 'sideways_use_sma': True, 'sideways_use_ema': True, 'sideways_use_atr': True, 'sideways_use_adx': False, 'sideways_use_spike': False, 'sideways_rsi_required': True}.
[I 2025-08-31 11:04:44,269] Trial 71 finished with values: [-1000000000.0, 1000000000.0] and parameters: {'p_sma': 16, 'p_std': 45, 'p_atr': 14, 'p_adx': 15, 'rsi_period': 24, 'ema1': 8, 'ema2': 19, 'slip_atr_k': 0.07312553885355746, 'slip_spread_k': 0.5595512745407807, 'spread_hl_frac': 0.016823490510796388, 'bb_std_mult': 1.871357301487739, 'rsi_os': 36, 'rsi_ob': 50, 'vol_spike': 0.06239674262561047, 'adx_thresh': 18.48205973690907, 'atr_min_pct': 0.01137381327935963, 'atr_max_pct': 0.044477773836554144, 'tp_mult': 1.5927956416177074, 'tsl_mult': 0.6125431303796619, 'strategy': 'mean_reversion', 'time_stop': 66, 'use_sma': False, 'use_atr': False, 'use_adx': False, 'use_ema': False, 'use_spike': False, 'rsi_required': False, 'edge_k': 0.7307923507658867, 'edge_cap': 0.8464597954547223, 'bull_strategy': 'breakout', 'bull_bb_std_mult': 3.38283065152082, 'bull_rsi_os': 7, 'bull_rsi_ob': 70, 'bull_adx_thresh': 10.453971875031517, 'bull_atr_min_pct': 0.016381905488278888, 'bull_atr_max_pct': 0.038899931721400896, 'bull_tp_mult': 1.6718059685241689, 'bull_tsl_mult': 0.157418353511224, 'bull_time_stop': 52, 'bull_use_sma': True, 'bull_use_ema': False, 'bull_use_atr': False, 'bull_use_adx': True, 'bull_use_spike': True, 'bull_rsi_required': True, 'bear_strategy': 'breakout', 'bear_bb_std_mult': 1.3937918427158653, 'bear_rsi_os': 16, 'bear_rsi_ob': 56, 'bear_adx_thresh': 14.053725286986587, 'bear_atr_min_pct': 0.027870752010695513, 'bear_atr_max_pct': 0.01627776659718061, 'bear_tp_mult': 2.343589778343091, 'bear_tsl_mult': 0.7340880335757054, 'bear_time_stop': 151, 'bear_use_sma': True, 'bear_use_ema': False, 'bear_use_atr': False, 'bear_use_adx': True, 'bear_use_spike': True, 'bear_rsi_required': False, 'sideways_strategy': 'breakout', 'sideways_bb_std_mult': 1.3465693367567524, 'sideways_rsi_os': 25, 'sideways_rsi_ob': 55, 'sideways_adx_thresh': 16.357248809728162, 'sideways_atr_min_pct': 0.005198122815372247, 'sideways_atr_max_pct': 0.017267269518333114, 'sideways_tp_mult': 2.7920343364368954, 'sideways_tsl_mult': 0.16182784021967814, 'sideways_time_stop': 33, 'sideways_use_sma': False, 'sideways_use_ema': False, 'sideways_use_atr': True, 'sideways_use_adx': True, 'sideways_use_spike': False, 'sideways_rsi_required': False}.
[I 2025-08-31 11:05:14,733] Trial 68 finished with values: [-1000000000.0, 1000000000.0] and parameters: {'p_sma': 9, 'p_std': 51, 'p_atr': 15, 'p_adx': 11, 'rsi_period': 25, 'ema1': 8, 'ema2': 32, 'slip_atr_k': 0.10796866301745547, 'slip_spread_k': 0.5929321738053555, 'spread_hl_frac': 0.01845950575462447, 'bb_std_mult': 1.69935619782999, 'rsi_os': 36, 'rsi_ob': 61, 'vol_spike': 0.039497350330157395, 'adx_thresh': 13.413834824500633, 'atr_min_pct': 0.019517621822850162, 'atr_max_pct': 0.1325744465226487, 'tp_mult': 1.1098711309929237, 'tsl_mult': 0.45370797937879154, 'strategy': 'mean_reversion', 'time_stop': 174, 'use_sma': False, 'use_atr': True, 'use_adx': False, 'use_ema': True, 'use_spike': False, 'rsi_required': False, 'edge_k': 0.7215147612088412, 'edge_cap': 0.8497177881294695, 'bull_strategy': 'mean_reversion', 'bull_bb_std_mult': 1.1460430578778036, 'bull_rsi_os': 10, 'bull_rsi_ob': 62, 'bull_adx_thresh': 10.223157440192441, 'bull_atr_min_pct': 0.004498209345008787, 'bull_atr_max_pct': 0.09692433129188338, 'bull_tp_mult': 1.3573972889177455, 'bull_tsl_mult': 0.10723318118261219, 'bull_time_stop': 102, 'bull_use_sma': True, 'bull_use_ema': True, 'bull_use_atr': False, 'bull_use_adx': True, 'bull_use_spike': True, 'bull_rsi_required': True, 'bear_strategy': 'breakout', 'bear_bb_std_mult': 2.248092879335301, 'bear_rsi_os': 22, 'bear_rsi_ob': 62, 'bear_adx_thresh': 14.381649477183254, 'bear_atr_min_pct': 0.026831765098261344, 'bear_atr_max_pct': 0.08968223047714938, 'bear_tp_mult': 2.175527914906116, 'bear_tsl_mult': 0.6409850759838915, 'bear_time_stop': 146, 'bear_use_sma': False, 'bear_use_ema': False, 'bear_use_atr': False, 'bear_use_adx': True, 'bear_use_spike': False, 'bear_rsi_required': False, 'sideways_strategy': 'breakout', 'sideways_bb_std_mult': 2.429894316305173, 'sideways_rsi_os': 5, 'sideways_rsi_ob': 77, 'sideways_adx_thresh': 16.774570655361373, 'sideways_atr_min_pct': 0.0049569382114812, 'sideways_atr_max_pct': 0.09453114128437763, 'sideways_tp_mult': 2.703568293213021, 'sideways_tsl_mult': 0.22594568963214562, 'sideways_time_stop': 68, 'sideways_use_sma': True, 'sideways_use_ema': False, 'sideways_use_atr': True, 'sideways_use_adx': True, 'sideways_use_spike': False, 'sideways_rsi_required': False}.
[I 2025-08-31 11:05:15,216] Trial 69 finished with values: [-1000000000.0, 1000000000.0] and parameters: {'p_sma': 9, 'p_std': 51, 'p_atr': 15, 'p_adx': 15, 'rsi_period': 23, 'ema1': 8, 'ema2': 32, 'slip_atr_k': 0.0795420037883209, 'slip_spread_k': 0.5913453440765781, 'spread_hl_frac': 0.017609304182360536, 'bb_std_mult': 0.8174574579763554, 'rsi_os': 36, 'rsi_ob': 95, 'vol_spike': 0.0317234807256416, 'adx_thresh': 12.928600358845925, 'atr_min_pct': 0.019567135046354052, 'atr_max_pct': 0.07272255321886355, 'tp_mult': 1.2057323378344835, 'tsl_mult': 0.42919299704149333, 'strategy': 'mean_reversion', 'time_stop': 8, 'use_sma': False, 'use_atr': True, 'use_adx': False, 'use_ema': True, 'use_spike': False, 'rsi_required': False, 'edge_k': 0.7519270927844556, 'edge_cap': 0.5687777601305307, 'bull_strategy': 'mean_reversion', 'bull_bb_std_mult': 1.1334025492908917, 'bull_rsi_os': 9, 'bull_rsi_ob': 51, 'bull_adx_thresh': 10.214073142646004, 'bull_atr_min_pct': 0.005724579148321423, 'bull_atr_max_pct': 0.09831545117243708, 'bull_tp_mult': 1.6590840489381273, 'bull_tsl_mult': 0.09885073967487884, 'bull_time_stop': 145, 'bull_use_sma': True, 'bull_use_ema': True, 'bull_use_atr': False, 'bull_use_adx': True, 'bull_use_spike': True, 'bull_rsi_required': True, 'bear_strategy': 'breakout', 'bear_bb_std_mult': 1.8797595191810363, 'bear_rsi_os': 15, 'bear_rsi_ob': 61, 'bear_adx_thresh': 11.351922558930132, 'bear_atr_min_pct': 0.02672863661462655, 'bear_atr_max_pct': 0.09150672379089538, 'bear_tp_mult': 2.152744960843636, 'bear_tsl_mult': 0.7414477124122, 'bear_time_stop': 147, 'bear_use_sma': False, 'bear_use_ema': False, 'bear_use_atr': False, 'bear_use_adx': True, 'bear_use_spike': False, 'bear_rsi_required': False, 'sideways_strategy': 'breakout', 'sideways_bb_std_mult': 1.3661389793491705, 'sideways_rsi_os': 19, 'sideways_rsi_ob': 77, 'sideways_adx_thresh': 16.327804919361895, 'sideways_atr_min_pct': 0.004999847450253241, 'sideways_atr_max_pct': 0.1438848121270921, 'sideways_tp_mult': 2.8060791467929915, 'sideways_tsl_mult': 0.9522676544604072, 'sideways_time_stop': 65, 'sideways_use_sma': True, 'sideways_use_ema': False, 'sideways_use_atr': True, 'sideways_use_adx': True, 'sideways_use_spike': False, 'sideways_rsi_required': False}.
[I 2025-08-31 11:05:15,216] Trial 70 finished with values: [-1000000000.0, 1000000000.0] and parameters: {'p_sma': 9, 'p_std': 45, 'p_atr': 17, 'p_adx': 15, 'rsi_period': 26, 'ema1': 8, 'ema2': 38, 'slip_atr_k': 0.10669252389966458, 'slip_spread_k': 0.5585528600905785, 'spread_hl_frac': 0.0022382048572085478, 'bb_std_mult': 0.8182419149531884, 'rsi_os': 36, 'rsi_ob': 62, 'vol_spike': 0.09929209885125333, 'adx_thresh': 13.54576760458407, 'atr_min_pct': 0.020244282569385985, 'atr_max_pct': 0.1494594649199162, 'tp_mult': 1.6165551800029347, 'tsl_mult': 0.5052164233286351, 'strategy': 'mean_reversion', 'time_stop': 57, 'use_sma': False, 'use_atr': True, 'use_adx': False, 'use_ema': True, 'use_spike': False, 'rsi_required': False, 'edge_k': 1.1967424180902442, 'edge_cap': 0.8340717519339755, 'bull_strategy': 'mean_reversion', 'bull_bb_std_mult': 2.7648326260418052, 'bull_rsi_os': 7, 'bull_rsi_ob': 70, 'bull_adx_thresh': 10.485978366475003, 'bull_atr_min_pct': 0.01745833500312541, 'bull_atr_max_pct': 0.10913301465610084, 'bull_tp_mult': 1.6782602272639784, 'bull_tsl_mult': 0.16066875492852392, 'bull_time_stop': 104, 'bull_use_sma': True, 'bull_use_ema': True, 'bull_use_atr': False, 'bull_use_adx': True, 'bull_use_spike': True, 'bull_rsi_required': True, 'bear_strategy': 'breakout', 'bear_bb_std_mult': 1.8222518005537771, 'bear_rsi_os': 22, 'bear_rsi_ob': 55, 'bear_adx_thresh': 14.206979742793704, 'bear_atr_min_pct': 0.02710442574340377, 'bear_atr_max_pct': 0.01730554013427711, 'bear_tp_mult': 1.1900204455851209, 'bear_tsl_mult': 0.29619673049633255, 'bear_time_stop': 108, 'bear_use_sma': False, 'bear_use_ema': False, 'bear_use_atr': False, 'bear_use_adx': True, 'bear_use_spike': False, 'bear_rsi_required': False, 'sideways_strategy': 'breakout', 'sideways_bb_std_mult': 2.420671580495313, 'sideways_rsi_os': 25, 'sideways_rsi_ob': 80, 'sideways_adx_thresh': 24.67786691110779, 'sideways_atr_min_pct': 0.005364989765938423, 'sideways_atr_max_pct': 0.1430793869835593, 'sideways_tp_mult': 1.4906126365744694, 'sideways_tsl_mult': 0.1638486866071982, 'sideways_time_stop': 39, 'sideways_use_sma': True, 'sideways_use_ema': False, 'sideways_use_atr': True, 'sideways_use_adx': True, 'sideways_use_spike': False, 'sideways_rsi_required': False}.
