[I 2025-08-31 11:34:16,899] Trial 308 finished with values: [-1000000000.0, 1000000000.0] and parameters: {'p_sma': 28, 'p_std': 15, 'p_atr': 28, 'p_adx': 25, 'rsi_period': 51, 'ema1': 6, 'ema2': 53, 'slip_atr_k': 0.03492612260239225, 'slip_spread_k': 0.1282565864508956, 'spread_hl_frac': 0.005457252724329483, 'bb_std_mult': 0.8886531786546632, 'rsi_os': 36, 'rsi_ob': 47, 'vol_spike': 0.19988458463690814, 'adx_thresh': 27.165820480712362, 'atr_min_pct': 0.025373702223448293, 'atr_max_pct': 0.055331283710920644, 'tp_mult': 2.5123889924713554, 'tsl_mult': 0.6630010008899506, 'strategy': 'mean_reversion', 'time_stop': 142, 'use_sma': False, 'use_atr': True, 'use_adx': True, 'use_ema': False, 'use_spike': True, 'rsi_required': True, 'edge_k': 0.27328622812511905, 'edge_cap': 0.48980366336426423, 'bull_strategy': 'breakout', 'bull_bb_std_mult': 2.55249815220594, 'bull_rsi_os': 22, 'bull_rsi_ob': 76, 'bull_adx_thresh': 25.147660622498222, 'bull_atr_min_pct': 0.005076559418339078, 'bull_atr_max_pct': 0.14146761498095933, 'bull_tp_mult': 2.9752603808634652, 'bull_tsl_mult': 0.7808006005428834, 'bull_time_stop': 244, 'bull_use_sma': True, 'bull_use_ema': True, 'bull_use_atr': True, 'bull_use_adx': True, 'bull_use_spike': False, 'bull_rsi_required': True, 'bear_strategy': 'breakout', 'bear_bb_std_mult': 2.928722361044657, 'bear_rsi_os': 22, 'bear_rsi_ob': 55, 'bear_adx_thresh': 31.789550686580306, 'bear_atr_min_pct': 0.015242548016754266, 'bear_atr_max_pct': 0.11425638680581579, 'bear_tp_mult': 1.8007193199753462, 'bear_tsl_mult': 0.3725803877537342, 'bear_time_stop': 116, 'bear_use_sma': False, 'bear_use_ema': True, 'bear_use_atr': True, 'bear_use_adx': False, 'bear_use_spike': True, 'bear_rsi_required': False, 'sideways_strategy': 'mean_reversion', 'sideways_bb_std_mult': 1.811117669413241, 'sideways_rsi_os': 52, 'sideways_rsi_ob': 88, 'sideways_adx_thresh': 33.12414482743806, 'sideways_atr_min_pct': 0.028281341368058543, 'sideways_atr_max_pct': 0.12140227580181309, 'sideways_tp_mult': 2.4130110905920157, 'sideways_tsl_mult': 0.3922939132579511, 'sideways_time_stop': 11, 'sideways_use_sma': True, 'sideways_use_ema': False, 'sideways_use_atr': True, 'sideways_use_adx': False, 'sideways_use_spike': True, 'sideways_rsi_required': True}.
[I 2025-08-31 11:34:45,484] Trial 306 finished with values: [-1000000000.0, 1000000000.0] and parameters: {'p_sma': 50, 'p_std': 18, 'p_atr': 28, 'p_adx': 25, 'rsi_period': 68, 'ema1': 11, 'ema2': 43, 'slip_atr_k': 0.10542320293340632, 'slip_spread_k': 0.12050967668589639, 'spread_hl_frac': 0.002371014936181996, 'bb_std_mult': 1.0493861878598196, 'rsi_os': 32, 'rsi_ob': 69, 'vol_spike': 0.12922171125971962, 'adx_thresh': 20.51841249801964, 'atr_min_pct': 0.013389051219760577, 'atr_max_pct': 0.05106313534286591, 'tp_mult': 2.4848534735818397, 'tsl_mult': 0.6594014268675892, 'strategy': 'mean_reversion', 'time_stop': 300, 'use_sma': False, 'use_atr': True, 'use_adx': True, 'use_ema': True, 'use_spike': True, 'rsi_required': False, 'edge_k': 1.287345352425763, 'edge_cap': 0.8218050282293509, 'bull_strategy': 'breakout', 'bull_bb_std_mult': 1.7546033703147135, 'bull_rsi_os': 20, 'bull_rsi_ob': 75, 'bull_adx_thresh': 24.798642536530547, 'bull_atr_min_pct': 0.0048665128302177495, 'bull_atr_max_pct': 0.13474359236201294, 'bull_tp_mult': 1.5228354720781732, 'bull_tsl_mult': 0.5310916566731209, 'bull_time_stop': 299, 'bull_use_sma': True, 'bull_use_ema': True, 'bull_use_atr': True, 'bull_use_adx': True, 'bull_use_spike': True, 'bull_rsi_required': True, 'bear_strategy': 'mean_reversion', 'bear_bb_std_mult': 2.9346520702504533, 'bear_rsi_os': 32, 'bear_rsi_ob': 91, 'bear_adx_thresh': 22.002984038310768, 'bear_atr_min_pct': 0.015117142899375593, 'bear_atr_max_pct': 0.11335062268814065, 'bear_tp_mult': 1.7963557545275666, 'bear_tsl_mult': 0.405752442776025, 'bear_time_stop': 185, 'bear_use_sma': False, 'bear_use_ema': True, 'bear_use_atr': False, 'bear_use_adx': True, 'bear_use_spike': False, 'bear_rsi_required': True, 'sideways_strategy': 'breakout', 'sideways_bb_std_mult': 1.821712688591463, 'sideways_rsi_os': 22, 'sideways_rsi_ob': 75, 'sideways_adx_thresh': 9.100005041624268, 'sideways_atr_min_pct': 0.00293658709376639, 'sideways_atr_max_pct': 0.13633014739882696, 'sideways_tp_mult': 2.6187474051366078, 'sideways_tsl_mult': 0.38600086697781055, 'sideways_time_stop': 126, 'sideways_use_sma': True, 'sideways_use_ema': False, 'sideways_use_atr': True, 'sideways_use_adx': True, 'sideways_use_spike': False, 'sideways_rsi_required': True}.
[I 2025-08-31 11:34:45,907] Trial 307 finished with values: [-1000000000.0, 1000000000.0] and parameters: {'p_sma': 24, 'p_std': 14, 'p_atr': 14, 'p_adx': 12, 'rsi_period': 51, 'ema1': 12, 'ema2': 48, 'slip_atr_k': 0.23604599453595843, 'slip_spread_k': 0.11771316623677062, 'spread_hl_frac': 0.0362683967378732, 'bb_std_mult': 3.0846363098966885, 'rsi_os': 13, 'rsi_ob': 69, 'vol_spike': 0.12895879007522137, 'adx_thresh': 20.457125115735746, 'atr_min_pct': 0.013456366585463292, 'atr_max_pct': 0.016002935573592683, 'tp_mult': 1.5616528592078494, 'tsl_mult': 0.3344291706768485, 'strategy': 'mean_reversion', 'time_stop': 175, 'use_sma': False, 'use_atr': True, 'use_adx': True, 'use_ema': False, 'use_spike': True, 'rsi_required': True, 'edge_k': 0.28887808979430485, 'edge_cap': 0.8298166731142775, 'bull_strategy': 'breakout', 'bull_bb_std_mult': 2.545959263980896, 'bull_rsi_os': 22, 'bull_rsi_ob': 75, 'bull_adx_thresh': 14.695315130115597, 'bull_atr_min_pct': 0.0244307986921092, 'bull_atr_max_pct': 0.14136539136775006, 'bull_tp_mult': 2.5734462515456515, 'bull_tsl_mult': 0.5290991775391515, 'bull_time_stop': 136, 'bull_use_sma': True, 'bull_use_ema': True, 'bull_use_atr': True, 'bull_use_adx': True, 'bull_use_spike': False, 'bull_rsi_required': True, 'bear_strategy': 'breakout', 'bear_bb_std_mult': 2.6961858645810777, 'bear_rsi_os': 53, 'bear_rsi_ob': 55, 'bear_adx_thresh': 31.794645987833384, 'bear_atr_min_pct': 0.017180004107768897, 'bear_atr_max_pct': 0.11477596072087448, 'bear_tp_mult': 1.8607245347570416, 'bear_tsl_mult': 0.37166915974531467, 'bear_time_stop': 159, 'bear_use_sma': False, 'bear_use_ema': True, 'bear_use_atr': True, 'bear_use_adx': False, 'bear_use_spike': True, 'bear_rsi_required': False, 'sideways_strategy': 'mean_reversion', 'sideways_bb_std_mult': 1.818948272017769, 'sideways_rsi_os': 51, 'sideways_rsi_ob': 88, 'sideways_adx_thresh': 32.889213729525636, 'sideways_atr_min_pct': 0.0038505232387933243, 'sideways_atr_max_pct': 0.04897768011417396, 'sideways_tp_mult': 2.614611771381327, 'sideways_tsl_mult': 0.38907444534576674, 'sideways_time_stop': 250, 'sideways_use_sma': True, 'sideways_use_ema': False, 'sideways_use_atr': True, 'sideways_use_adx': False, 'sideways_use_spike': True, 'sideways_rsi_required': True}.
[I 2025-08-31 11:34:48,892] Trial 310 finished with values: [-1000000000.0, 1000000000.0] and parameters: {'p_sma': 50, 'p_std': 17, 'p_atr': 15, 'p_adx': 12, 'rsi_period': 69, 'ema1': 12, 'ema2': 44, 'slip_atr_k': 0.12728362984841077, 'slip_spread_k': 0.11670084877179794, 'spread_hl_frac': 0.036003682100502844, 'bb_std_mult': 0.752063095703869, 'rsi_os': 9, 'rsi_ob': 69, 'vol_spike': 0.16561686276429932, 'adx_thresh': 25.9711422617264, 'atr_min_pct': 0.00441066060598953, 'atr_max_pct': 0.12026231857054273, 'tp_mult': 2.1014020527200445, 'tsl_mult': 0.29316315969576856, 'strategy': 'mean_reversion', 'time_stop': 37, 'use_sma': False, 'use_atr': True, 'use_adx': True, 'use_ema': False, 'use_spike': True, 'rsi_required': True, 'edge_k': 0.41325922923763486, 'edge_cap': 0.8614180001332229, 'bull_strategy': 'breakout', 'bull_bb_std_mult': 2.758583003800883, 'bull_rsi_os': 24, 'bull_rsi_ob': 61, 'bull_adx_thresh': 22.172883891437177, 'bull_atr_min_pct': 0.026617742418449306, 'bull_atr_max_pct': 0.1393730545544997, 'bull_tp_mult': 1.5720427074975003, 'bull_tsl_mult': 0.9386840785914068, 'bull_time_stop': 177, 'bull_use_sma': True, 'bull_use_ema': True, 'bull_use_atr': False, 'bull_use_adx': True, 'bull_use_spike': False, 'bull_rsi_required': True, 'bear_strategy': 'breakout', 'bear_bb_std_mult': 1.1164764298535212, 'bear_rsi_os': 31, 'bear_rsi_ob': 52, 'bear_adx_thresh': 31.906942419694353, 'bear_atr_min_pct': 0.014282054467331455, 'bear_atr_max_pct': 0.12057425550453767, 'bear_tp_mult': 1.8787126890153787, 'bear_tsl_mult': 0.3941579860937947, 'bear_time_stop': 192, 'bear_use_sma': False, 'bear_use_ema': True, 'bear_use_atr': True, 'bear_use_adx': False, 'bear_use_spike': True, 'bear_rsi_required': False, 'sideways_strategy': 'breakout', 'sideways_bb_std_mult': 3.377685086065181, 'sideways_rsi_os': 33, 'sideways_rsi_ob': 75, 'sideways_adx_thresh': 7.983110454996321, 'sideways_atr_min_pct': 0.0028766373548793993, 'sideways_atr_max_pct': 0.11239200995122461, 'sideways_tp_mult': 1.6671687517473153, 'sideways_tsl_mult': 0.32737154750658237, 'sideways_time_stop': 60, 'sideways_use_sma': True, 'sideways_use_ema': False, 'sideways_use_atr': True, 'sideways_use_adx': True, 'sideways_use_spike': False, 'sideways_rsi_required': True}.
[I 2025-08-31 11:34:48,975] Trial 309 finished with values: [-1000000000.0, 1000000000.0] and parameters: {'p_sma': 50, 'p_std': 15, 'p_atr': 28, 'p_adx': 25, 'rsi_period': 38, 'ema1': 10, 'ema2': 52, 'slip_atr_k': 0.1562727597009619, 'slip_spread_k': 0.12271711212438301, 'spread_hl_frac': 0.005537978850123697, 'bb_std_mult': 3.0588549195207744, 'rsi_os': 13, 'rsi_ob': 76, 'vol_spike': 0.16729577039030993, 'adx_thresh': 15.705969467347954, 'atr_min_pct': 0.006916747410451465, 'atr_max_pct': 0.1199138350213474, 'tp_mult': 2.2148661812621704, 'tsl_mult': 0.28961589827704715, 'strategy': 'mean_reversion', 'time_stop': 38, 'use_sma': False, 'use_atr': True, 'use_adx': True, 'use_ema': False, 'use_spike': True, 'rsi_required': True, 'edge_k': 0.29626461833880446, 'edge_cap': 0.48566924084442353, 'bull_strategy': 'breakout', 'bull_bb_std_mult': 2.5734737042979283, 'bull_rsi_os': 22, 'bull_rsi_ob': 61, 'bull_adx_thresh': 14.34601770788711, 'bull_atr_min_pct': 0.006142870388230226, 'bull_atr_max_pct': 0.14126517397597604, 'bull_tp_mult': 1.5746571283913318, 'bull_tsl_mult': 0.42091494780579586, 'bull_time_stop': 150, 'bull_use_sma': True, 'bull_use_ema': True, 'bull_use_atr': True, 'bull_use_adx': True, 'bull_use_spike': False, 'bull_rsi_required': True, 'bear_strategy': 'breakout', 'bear_bb_std_mult': 1.1200193607315285, 'bear_rsi_os': 52, 'bear_rsi_ob': 91, 'bear_adx_thresh': 31.90559927669332, 'bear_atr_min_pct': 0.015147906172518967, 'bear_atr_max_pct': 0.1199564805296484, 'bear_tp_mult': 2.7109787155587077, 'bear_tsl_mult': 0.5349317832932722, 'bear_time_stop': 161, 'bear_use_sma': False, 'bear_use_ema': True, 'bear_use_atr': True, 'bear_use_adx': False, 'bear_use_spike': True, 'bear_rsi_required': False, 'sideways_strategy': 'mean_reversion', 'sideways_bb_std_mult': 1.9401019507692505, 'sideways_rsi_os': 33, 'sideways_rsi_ob': 74, 'sideways_adx_thresh': 7.801257455210823, 'sideways_atr_min_pct': 0.009339327610038927, 'sideways_atr_max_pct': 0.07187862195905448, 'sideways_tp_mult': 2.4245218002377547, 'sideways_tsl_mult': 0.33111362285510887, 'sideways_time_stop': 11, 'sideways_use_sma': True, 'sideways_use_ema': False, 'sideways_use_atr': True, 'sideways_use_adx': False, 'sideways_use_spike': True, 'sideways_rsi_required': True}.
[I 2025-08-31 11:35:20,969] Trial 312 finished with values: [-1000000000.0, 1000000000.0] and parameters: {'p_sma': 22, 'p_std': 15, 'p_atr': 15, 'p_adx': 26, 'rsi_period': 54, 'ema1': 10, 'ema2': 26, 'slip_atr_k': 0.04470517278006999, 'slip_spread_k': 0.15601455034163264, 'spread_hl_frac': 0.03434975362064503, 'bb_std_mult': 0.7456106507398157, 'rsi_os': 18, 'rsi_ob': 76, 'vol_spike': 0.04817988152145883, 'adx_thresh': 15.285098349661261, 'atr_min_pct': 0.0043850198722229766, 'atr_max_pct': 0.040570468503611165, 'tp_mult': 2.2102493968167787, 'tsl_mult': 0.28999447664459993, 'strategy': 'breakout', 'time_stop': 195, 'use_sma': False, 'use_atr': False, 'use_adx': True, 'use_ema': False, 'use_spike': True, 'rsi_required': True, 'edge_k': 0.7997295233796757, 'edge_cap': 0.8554733906376134, 'bull_strategy': 'mean_reversion', 'bull_bb_std_mult': 2.7437210320399954, 'bull_rsi_os': 24, 'bull_rsi_ob': 61, 'bull_adx_thresh': 14.310346491878052, 'bull_atr_min_pct': 0.005722493048428546, 'bull_atr_max_pct': 0.13782408750524588, 'bull_tp_mult': 1.5753533485706555, 'bull_tsl_mult': 0.4156471173599064, 'bull_time_stop': 149, 'bull_use_sma': True, 'bull_use_ema': True, 'bull_use_atr': False, 'bull_use_adx': True, 'bull_use_spike': False, 'bull_rsi_required': True, 'bear_strategy': 'breakout', 'bear_bb_std_mult': 3.278859265965221, 'bear_rsi_os': 31, 'bear_rsi_ob': 65, 'bear_adx_thresh': 30.48787023129637, 'bear_atr_min_pct': 0.014337682953831152, 'bear_atr_max_pct': 0.13101281465682013, 'bear_tp_mult': 2.697183192087352, 'bear_tsl_mult': 0.6070415466120077, 'bear_time_stop': 281, 'bear_use_sma': False, 'bear_use_ema': True, 'bear_use_atr': True, 'bear_use_adx': False, 'bear_use_spike': True, 'bear_rsi_required': False, 'sideways_strategy': 'breakout', 'sideways_bb_std_mult': 1.9405729787229122, 'sideways_rsi_os': 33, 'sideways_rsi_ob': 59, 'sideways_adx_thresh': 7.84004766536074, 'sideways_atr_min_pct': 0.01787810039819595, 'sideways_atr_max_pct': 0.04221046206499384, 'sideways_tp_mult': 1.373373980603083, 'sideways_tsl_mult': 0.3210522425981887, 'sideways_time_stop': 60, 'sideways_use_sma': True, 'sideways_use_ema': True, 'sideways_use_atr': True, 'sideways_use_adx': True, 'sideways_use_spike': False, 'sideways_rsi_required': False}.
[I 2025-08-31 11:35:21,824] Trial 311 finished with values: [-1000000000.0, 1000000000.0] and parameters: {'p_sma': 8, 'p_std': 17, 'p_atr': 14, 'p_adx': 12, 'rsi_period': 51, 'ema1': 10, 'ema2': 50, 'slip_atr_k': 0.15058563030162395, 'slip_spread_k': 0.1523727748962902, 'spread_hl_frac': 0.03423520782562972, 'bb_std_mult': 1.6184142973826134, 'rsi_os': 16, 'rsi_ob': 70, 'vol_spike': 0.1667844583413411, 'adx_thresh': 15.05628811697223, 'atr_min_pct': 0.004457440529620626, 'atr_max_pct': 0.12343791038750779, 'tp_mult': 1.012136964401637, 'tsl_mult': 0.3273379037393094, 'strategy': 'breakout', 'time_stop': 194, 'use_sma': False, 'use_atr': False, 'use_adx': True, 'use_ema': False, 'use_spike': True, 'rsi_required': True, 'edge_k': 0.4790985537363222, 'edge_cap': 0.8565916147890447, 'bull_strategy': 'breakout', 'bull_bb_std_mult': 1.8994582298735478, 'bull_rsi_os': 6, 'bull_rsi_ob': 61, 'bull_adx_thresh': 14.401379780533397, 'bull_atr_min_pct': 0.006162187689303156, 'bull_atr_max_pct': 0.14010067359692757, 'bull_tp_mult': 1.5537479005145833, 'bull_tsl_mult': 0.9446065721835046, 'bull_time_stop': 148, 'bull_use_sma': True, 'bull_use_ema': True, 'bull_use_atr': False, 'bull_use_adx': True, 'bull_use_spike': False, 'bull_rsi_required': True, 'bear_strategy': 'breakout', 'bear_bb_std_mult': 1.1033438609585946, 'bear_rsi_os': 53, 'bear_rsi_ob': 66, 'bear_adx_thresh': 32.102183265680814, 'bear_atr_min_pct': 0.014529221475895217, 'bear_atr_max_pct': 0.047179021696741916, 'bear_tp_mult': 1.877170146634335, 'bear_tsl_mult': 0.6065016975690031, 'bear_time_stop': 202, 'bear_use_sma': False, 'bear_use_ema': True, 'bear_use_atr': True, 'bear_use_adx': False, 'bear_use_spike': True, 'bear_rsi_required': False, 'sideways_strategy': 'mean_reversion', 'sideways_bb_std_mult': 3.404545803478132, 'sideways_rsi_os': 33, 'sideways_rsi_ob': 74, 'sideways_adx_thresh': 8.1338343009014, 'sideways_atr_min_pct': 0.009440545130387386, 'sideways_atr_max_pct': 0.04904503134306027, 'sideways_tp_mult': 1.36048452397823, 'sideways_tsl_mult': 0.9401683251951747, 'sideways_time_stop': 249, 'sideways_use_sma': True, 'sideways_use_ema': False, 'sideways_use_atr': True, 'sideways_use_adx': False, 'sideways_use_spike': True, 'sideways_rsi_required': True}.
[I 2025-08-31 11:35:22,571] Trial 313 finished with values: [-1000000000.0, 1000000000.0] and parameters: {'p_sma': 21, 'p_std': 16, 'p_atr': 13, 'p_adx': 26, 'rsi_period': 52, 'ema1': 13, 'ema2': 40, 'slip_atr_k': 0.04672917917956169, 'slip_spread_k': 0.08536486776425355, 'spread_hl_frac': 0.0068216872378347605, 'bb_std_mult': 0.6507815768809393, 'rsi_os': 35, 'rsi_ob': 72, 'vol_spike': 0.04809649310052906, 'adx_thresh': 26.245667138554744, 'atr_min_pct': 0.005826625073027053, 'atr_max_pct': 0.031064810226024357, 'tp_mult': 1.2100346859626145, 'tsl_mult': 0.49749008903076436, 'strategy': 'breakout', 'time_stop': 193, 'use_sma': False, 'use_atr': False, 'use_adx': True, 'use_ema': False, 'use_spike': True, 'rsi_required': True, 'edge_k': 1.4433146423174097, 'edge_cap': 0.8721623829775992, 'bull_strategy': 'mean_reversion', 'bull_bb_std_mult': 3.4902340574887933, 'bull_rsi_os': 23, 'bull_rsi_ob': 62, 'bull_adx_thresh': 15.271070989445674, 'bull_atr_min_pct': 0.005301401992483543, 'bull_atr_max_pct': 0.1441584429021169, 'bull_tp_mult': 1.507581382795403, 'bull_tsl_mult': 0.4761898226219287, 'bull_time_stop': 169, 'bull_use_sma': True, 'bull_use_ema': True, 'bull_use_atr': False, 'bull_use_adx': True, 'bull_use_spike': False, 'bull_rsi_required': True, 'bear_strategy': 'breakout', 'bear_bb_std_mult': 0.9492408396234059, 'bear_rsi_os': 34, 'bear_rsi_ob': 73, 'bear_adx_thresh': 31.116591115102423, 'bear_atr_min_pct': 0.016219805838170818, 'bear_atr_max_pct': 0.0320135017999091, 'bear_tp_mult': 1.7068934096246946, 'bear_tsl_mult': 0.7566445111375486, 'bear_time_stop': 210, 'bear_use_sma': False, 'bear_use_ema': True, 'bear_use_atr': True, 'bear_use_adx': False, 'bear_use_spike': True, 'bear_rsi_required': False, 'sideways_strategy': 'breakout', 'sideways_bb_std_mult': 0.596596419491723, 'sideways_rsi_os': 31, 'sideways_rsi_ob': 72, 'sideways_adx_thresh': 19.71382789090184, 'sideways_atr_min_pct': 0.0024725947568353225, 'sideways_atr_max_pct': 0.14316269477145066, 'sideways_tp_mult': 1.3550033448973888, 'sideways_tsl_mult': 0.428884209813077, 'sideways_time_stop': 15, 'sideways_use_sma': True, 'sideways_use_ema': True, 'sideways_use_atr': True, 'sideways_use_adx': True, 'sideways_use_spike': False, 'sideways_rsi_required': False}.
[I 2025-08-31 11:35:22,716] Trial 314 finished with values: [-0.03584135614349704, 0.03556826112380799] and parameters: {'p_sma': 26, 'p_std': 53, 'p_atr': 13, 'p_adx': 26, 'rsi_period': 54, 'ema1': 13, 'ema2': 26, 'slip_atr_k': 0.0009144124006851967, 'slip_spread_k': 0.15293306124280137, 'spread_hl_frac': 0.009086517163116245, 'bb_std_mult': 1.2448966035963638, 'rsi_os': 35, 'rsi_ob': 72, 'vol_spike': 0.1730901030492705, 'adx_thresh': 26.412012585698914, 'atr_min_pct': 0.005190646845463434, 'atr_max_pct': 0.030686602316107724, 'tp_mult': 1.7663034140240068, 'tsl_mult': 0.2332427704836589, 'strategy': 'breakout', 'time_stop': 294, 'use_sma': False, 'use_atr': False, 'use_adx': True, 'use_ema': False, 'use_spike': True, 'rsi_required': True, 'edge_k': 0.7977970942735616, 'edge_cap': 0.08381167557127117, 'bull_strategy': 'mean_reversion', 'bull_bb_std_mult': 1.8530835868992812, 'bull_rsi_os': 49, 'bull_rsi_ob': 63, 'bull_adx_thresh': 15.509810677008995, 'bull_atr_min_pct': 0.00605509217131398, 'bull_atr_max_pct': 0.14363921159387186, 'bull_tp_mult': 1.514017304929999, 'bull_tsl_mult': 0.2856288756390455, 'bull_time_stop': 145, 'bull_use_sma': True, 'bull_use_ema': True, 'bull_use_atr': False, 'bull_use_adx': True, 'bull_use_spike': False, 'bull_rsi_required': True, 'bear_strategy': 'breakout', 'bear_bb_std_mult': 0.9392668604535718, 'bear_rsi_os': 34, 'bear_rsi_ob': 74, 'bear_adx_thresh': 19.791738067726897, 'bear_atr_min_pct': 0.014496416961674865, 'bear_atr_max_pct': 0.10760067537532525, 'bear_tp_mult': 1.6940343331773056, 'bear_tsl_mult': 0.29434347405782113, 'bear_time_stop': 211, 'bear_use_sma': False, 'bear_use_ema': True, 'bear_use_atr': True, 'bear_use_adx': False, 'bear_use_spike': True, 'bear_rsi_required': False, 'sideways_strategy': 'breakout', 'sideways_bb_std_mult': 1.7191178259181832, 'sideways_rsi_os': 44, 'sideways_rsi_ob': 72, 'sideways_adx_thresh': 17.745670258118615, 'sideways_atr_min_pct': 0.002461314554080235, 'sideways_atr_max_pct': 0.04249465273898797, 'sideways_tp_mult': 1.3715016621848455, 'sideways_tsl_mult': 0.9939253950949312, 'sideways_time_stop': 118, 'sideways_use_sma': True, 'sideways_use_ema': True, 'sideways_use_atr': True, 'sideways_use_adx': True, 'sideways_use_spike': False, 'sideways_rsi_required': False}.
