2025-08-31 10:56:07,190 WARNING: DATA SANITY: Extreme jumps >20*ATR200: 42
[I 2025-08-31 10:56:07,202] A new study created in memory with name: no-name-f125745d-bb55-4ec5-ad08-df9e2e15c01a
[I 2025-08-31 10:56:07,207] Trial 0 finished with values: [-1000000000.0, 1000000000.0] and parameters: {'p_sma': 51, 'p_std': 51, 'p_atr': 8, 'p_adx': 7, 'rsi_period': 36, 'ema1': 26, 'ema2': 60, 'slip_atr_k': 0.1417083889848627, 'slip_spread_k': 0.38658915781280456, 'spread_hl_frac': 0.027883586940381323, 'bb_std_mult': 0.9826550338964763, 'rsi_os': 10, 'rsi_ob': 50, 'vol_spike': 0.2260399396793928, 'adx_thresh': 31.22803485184913, 'atr_min_pct': 0.022254806487560206, 'atr_max_pct': 0.09741934124787288, 'tp_mult': 1.8426973094758905, 'tsl_mult': 0.6604096027594862, 'strategy': 'mean_reversion', 'time_stop': 64, 'use_sma': False, 'use_atr': True, 'use_adx': False, 'use_ema': False, 'use_spike': False, 'rsi_required': False, 'edge_k': 0.46288235251304544, 'edge_cap': 0.760272201774203, 'bull_strategy': 'breakout', 'bull_bb_std_mult': 1.664242536068416, 'bull_rsi_os': 36, 'bull_rsi_ob': 55, 'bull_adx_thresh': 7.5092232383113835, 'bull_atr_min_pct': 0.014241476725213278, 'bull_atr_max_pct': 0.09319358428987405, 'bull_tp_mult': 2.539264469145775, 'bull_tsl_mult': 0.5084512919761689, 'bull_time_stop': 280, 'bull_use_sma': True, 'bull_use_ema': False, 'bull_use_atr': False, 'bull_use_adx': True, 'bull_use_spike': True, 'bull_rsi_required': False, 'bear_strategy': 'breakout', 'bear_bb_std_mult': 2.6051653067172604, 'bear_rsi_os': 49, 'bear_rsi_ob': 64, 'bear_adx_thresh': 7.628177773188067, 'bear_atr_min_pct': 0.004808263696305641, 'bear_atr_max_pct': 0.14338292909637898, 'bear_tp_mult': 2.5973261125408578, 'bear_tsl_mult': 0.7079835195279127, 'bear_time_stop': 266, 'bear_use_sma': True, 'bear_use_ema': False, 'bear_use_atr': False, 'bear_use_adx': True, 'bear_use_spike': True, 'bear_rsi_required': True, 'sideways_strategy': 'breakout', 'sideways_bb_std_mult': 1.4373656751450838, 'sideways_rsi_os': 42, 'sideways_rsi_ob': 82, 'sideways_adx_thresh': 34.783472194478705, 'sideways_atr_min_pct': 0.0294520160842572, 'sideways_atr_max_pct': 0.08988120900959717, 'sideways_tp_mult': 2.481612059589288, 'sideways_tsl_mult': 0.6829764669313337, 'sideways_time_stop': 243, 'sideways_use_sma': True, 'sideways_use_ema': False, 'sideways_use_atr': False, 'sideways_use_adx': True, 'sideways_use_spike': False, 'sideways_rsi_required': False}.
[I 2025-08-31 10:56:37,182] Trial 1 finished with values: [-0.176821960922251, 0.17592689195273734] and parameters: {'p_sma': 30, 'p_std': 58, 'p_atr': 10, 'p_adx': 26, 'rsi_period': 28, 'ema1': 29, 'ema2': 44, 'slip_atr_k': 0.2496789089156222, 'slip_spread_k': 0.5365121164268765, 'spread_hl_frac': 0.014198920283638457, 'bb_std_mult': 3.231062055505403, 'rsi_os': 21, 'rsi_ob': 73, 'vol_spike': 0.14403979916234527, 'adx_thresh': 5.0947783614139555, 'atr_min_pct': 0.004716113315111524, 'atr_max_pct': 0.09351409669117249, 'tp_mult': 2.1510702046056362, 'tsl_mult': 0.15849778977420625, 'strategy': 'breakout', 'time_stop': 59, 'use_sma': False, 'use_atr': False, 'use_adx': True, 'use_ema': False, 'use_spike': False, 'rsi_required': True, 'edge_k': 0.019186367040474606, 'edge_cap': 0.11336228468882589, 'bull_strategy': 'mean_reversion', 'bull_bb_std_mult': 3.4503833033448417, 'bull_rsi_os': 45, 'bull_rsi_ob': 95, 'bull_adx_thresh': 22.703938957066814, 'bull_atr_min_pct': 0.0006819385377267339, 'bull_atr_max_pct': 0.019069145387577608, 'bull_tp_mult': 2.2644401275316524, 'bull_tsl_mult': 0.4124756251666333, 'bull_time_stop': 28, 'bull_use_sma': False, 'bull_use_ema': False, 'bull_use_atr': False, 'bull_use_adx': True, 'bull_use_spike': True, 'bull_rsi_required': False, 'bear_strategy': 'breakout', 'bear_bb_std_mult': 2.38660415390003, 'bear_rsi_os': 37, 'bear_rsi_ob': 86, 'bear_adx_thresh': 6.785131735436752, 'bear_atr_min_pct': 0.00030803671779950357, 'bear_atr_max_pct': 0.08097847293787232, 'bear_tp_mult': 1.818442987154874, 'bear_tsl_mult': 0.5820976757216532, 'bear_time_stop': 100, 'bear_use_sma': False, 'bear_use_ema': False, 'bear_use_atr': True, 'bear_use_adx': True, 'bear_use_spike': False, 'bear_rsi_required': True, 'sideways_strategy': 'mean_reversion', 'sideways_bb_std_mult': 0.8305191745910228, 'sideways_rsi_os': 51, 'sideways_rsi_ob': 62, 'sideways_adx_thresh': 17.801460649797555, 'sideways_atr_min_pct': 0.01041357862711644, 'sideways_atr_max_pct': 0.06951001090278783, 'sideways_tp_mult': 1.8186523803532098, 'sideways_tsl_mult': 0.99434243917537, 'sideways_time_stop': 190, 'sideways_use_sma': False, 'sideways_use_ema': False, 'sideways_use_atr': True, 'sideways_use_adx': False, 'sideways_use_spike': True, 'sideways_rsi_required': True}.
[I 2025-08-31 10:56:38,434] Trial 4 finished with values: [-1000000000.0, 1000000000.0] and parameters: {'p_sma': 52, 'p_std': 42, 'p_atr': 19, 'p_adx': 10, 'rsi_period': 55, 'ema1': 11, 'ema2': 35, 'slip_atr_k': 0.12180891029120317, 'slip_spread_k': 0.8206502301922535, 'spread_hl_frac': 0.023040626547818317, 'bb_std_mult': 2.00322274214089, 'rsi_os': 21, 'rsi_ob': 79, 'vol_spike': 0.2126751784570802, 'adx_thresh': 24.288535116150875, 'atr_min_pct': 0.007827489073214062, 'atr_max_pct': 0.017152680511278016, 'tp_mult': 2.937184155074423, 'tsl_mult': 0.4602958872156039, 'strategy': 'breakout', 'time_stop': 142, 'use_sma': True, 'use_atr': False, 'use_adx': True, 'use_ema': False, 'use_spike': True, 'rsi_required': True, 'edge_k': 1.7110671648640334, 'edge_cap': 0.9889318042438158, 'bull_strategy': 'breakout', 'bull_bb_std_mult': 0.8553643087629095, 'bull_rsi_os': 31, 'bull_rsi_ob': 81, 'bull_adx_thresh': 28.784200665968303, 'bull_atr_min_pct': 0.01597542459658178, 'bull_atr_max_pct': 0.09627225010050351, 'bull_tp_mult': 1.5886802297364673, 'bull_tsl_mult': 0.542322224665992, 'bull_time_stop': 158, 'bull_use_sma': False, 'bull_use_ema': False, 'bull_use_atr': False, 'bull_use_adx': False, 'bull_use_spike': True, 'bull_rsi_required': True, 'bear_strategy': 'breakout', 'bear_bb_std_mult': 1.7646202110098235, 'bear_rsi_os': 15, 'bear_rsi_ob': 67, 'bear_adx_thresh': 7.619259038752469, 'bear_atr_min_pct': 0.029908259560630448, 'bear_atr_max_pct': 0.06160340046191064, 'bear_tp_mult': 2.321871929673567, 'bear_tsl_mult': 0.728285097103726, 'bear_time_stop': 261, 'bear_use_sma': True, 'bear_use_ema': False, 'bear_use_atr': False, 'bear_use_adx': True, 'bear_use_spike': True, 'bear_rsi_required': True, 'sideways_strategy': 'mean_reversion', 'sideways_bb_std_mult': 2.722459309891523, 'sideways_rsi_os': 19, 'sideways_rsi_ob': 49, 'sideways_adx_thresh': 5.219159737495946, 'sideways_atr_min_pct': 0.026346921578922895, 'sideways_atr_max_pct': 0.07533975180712378, 'sideways_tp_mult': 2.440122767527065, 'sideways_tsl_mult': 0.9950909437283532, 'sideways_time_stop': 147, 'sideways_use_sma': True, 'sideways_use_ema': False, 'sideways_use_atr': False, 'sideways_use_adx': False, 'sideways_use_spike': True, 'sideways_rsi_required': False}.
[I 2025-08-31 10:56:38,734] Trial 3 finished with values: [-0.01737440155009229, 0.018226562148475896] and parameters: {'p_sma': 25, 'p_std': 55, 'p_atr': 16, 'p_adx': 27, 'rsi_period': 30, 'ema1': 5, 'ema2': 48, 'slip_atr_k': 0.09196349409851659, 'slip_spread_k': 0.7782413511418681, 'spread_hl_frac': 0.03995331902352431, 'bb_std_mult': 1.8241773139501654, 'rsi_os': 32, 'rsi_ob': 83, 'vol_spike': 0.28410264340485847, 'adx_thresh': 14.214416219798494, 'atr_min_pct': 0.015355240177511626, 'atr_max_pct': 0.13423863541580186, 'tp_mult': 2.1728314222910123, 'tsl_mult': 0.5789580804190391, 'strategy': 'breakout', 'time_stop': 212, 'use_sma': False, 'use_atr': False, 'use_adx': True, 'use_ema': True, 'use_spike': False, 'rsi_required': False, 'edge_k': 0.18986202417953524, 'edge_cap': 0.223211371875271, 'bull_strategy': 'mean_reversion', 'bull_bb_std_mult': 2.726980383704737, 'bull_rsi_os': 5, 'bull_rsi_ob': 79, 'bull_adx_thresh': 26.144733976574766, 'bull_atr_min_pct': 0.020190612896339263, 'bull_atr_max_pct': 0.10325955007836483, 'bull_tp_mult': 1.8786293834049184, 'bull_tsl_mult': 0.17554894256664233, 'bull_time_stop': 159, 'bull_use_sma': True, 'bull_use_ema': False, 'bull_use_atr': False, 'bull_use_adx': False, 'bull_use_spike': True, 'bull_rsi_required': True, 'bear_strategy': 'breakout', 'bear_bb_std_mult': 0.9367369712986686, 'bear_rsi_os': 32, 'bear_rsi_ob': 75, 'bear_adx_thresh': 11.529139377280295, 'bear_atr_min_pct': 0.024248247455507178, 'bear_atr_max_pct': 0.09702060228297625, 'bear_tp_mult': 2.6323133992559153, 'bear_tsl_mult': 0.9420648824908572, 'bear_time_stop': 87, 'bear_use_sma': False, 'bear_use_ema': False, 'bear_use_atr': False, 'bear_use_adx': True, 'bear_use_spike': False, 'bear_rsi_required': True, 'sideways_strategy': 'breakout', 'sideways_bb_std_mult': 1.8199742492142976, 'sideways_rsi_os': 23, 'sideways_rsi_ob': 84, 'sideways_adx_thresh': 8.970096296037417, 'sideways_atr_min_pct': 0.0004126100786018916, 'sideways_atr_max_pct': 0.061507910417089744, 'sideways_tp_mult': 2.648717563446196, 'sideways_tsl_mult': 0.10896270473309033, 'sideways_time_stop': 47, 'sideways_use_sma': True, 'sideways_use_ema': True, 'sideways_use_atr': True, 'sideways_use_adx': False, 'sideways_use_spike': True, 'sideways_rsi_required': True}.
[I 2025-08-31 10:56:38,906] Trial 2 finished with values: [-1000000000.0, 1000000000.0] and parameters: {'p_sma': 6, 'p_std': 21, 'p_atr': 29, 'p_adx': 9, 'rsi_period': 14, 'ema1': 19, 'ema2': 45, 'slip_atr_k': 0.13317454585450447, 'slip_spread_k': 0.17658940274997792, 'spread_hl_frac': 0.008110195653423814, 'bb_std_mult': 2.776829593554113, 'rsi_os': 27, 'rsi_ob': 85, 'vol_spike': 0.107240391757658, 'adx_thresh': 26.979761550983277, 'atr_min_pct': 0.0016907964520832385, 'atr_max_pct': 0.11189368606489863, 'tp_mult': 1.1757684309310092, 'tsl_mult': 0.010419909485681722, 'strategy': 'mean_reversion', 'time_stop': 171, 'use_sma': True, 'use_atr': False, 'use_adx': True, 'use_ema': False, 'use_spike': False, 'rsi_required': False, 'edge_k': 0.02977807701077473, 'edge_cap': 0.9032562683770172, 'bull_strategy': 'breakout', 'bull_bb_std_mult': 3.5186291671178966, 'bull_rsi_os': 25, 'bull_rsi_ob': 49, 'bull_adx_thresh': 7.166387079212364, 'bull_atr_min_pct': 0.025321412925303943, 'bull_atr_max_pct': 0.042497115833926, 'bull_tp_mult': 1.4372488330548876, 'bull_tsl_mult': 0.8912615046020661, 'bull_time_stop': 281, 'bull_use_sma': False, 'bull_use_ema': False, 'bull_use_atr': False, 'bull_use_adx': True, 'bull_use_spike': False, 'bull_rsi_required': True, 'bear_strategy': 'mean_reversion', 'bear_bb_std_mult': 1.9412037686009713, 'bear_rsi_os': 7, 'bear_rsi_ob': 91, 'bear_adx_thresh': 33.6021319143567, 'bear_atr_min_pct': 9.309467911767232e-05, 'bear_atr_max_pct': 0.07767962291481595, 'bear_tp_mult': 1.7424426694701605, 'bear_tsl_mult': 0.23757334519006257, 'bear_time_stop': 65, 'bear_use_sma': False, 'bear_use_ema': False, 'bear_use_atr': True, 'bear_use_adx': False, 'bear_use_spike': True, 'bear_rsi_required': False, 'sideways_strategy': 'breakout', 'sideways_bb_std_mult': 1.237034868234059, 'sideways_rsi_os': 34, 'sideways_rsi_ob': 60, 'sideways_adx_thresh': 17.05580668074468, 'sideways_atr_min_pct': 0.0031038370540768566, 'sideways_atr_max_pct': 0.03279845645578238, 'sideways_tp_mult': 1.4133388331791605, 'sideways_tsl_mult': 0.8568773281224461, 'sideways_time_stop': 118, 'sideways_use_sma': True, 'sideways_use_ema': True, 'sideways_use_atr': False, 'sideways_use_adx': False, 'sideways_use_spike': True, 'sideways_rsi_required': True}.
[I 2025-08-31 10:57:09,006] Trial 5 finished with values: [-1000000000.0, 1000000000.0] and parameters: {'p_sma': 27, 'p_std': 5, 'p_atr': 9, 'p_adx': 16, 'rsi_period': 53, 'ema1': 7, 'ema2': 36, 'slip_atr_k': 0.0216152741282164, 'slip_spread_k': 0.33121257381188307, 'spread_hl_frac': 0.017932009499336706, 'bb_std_mult': 3.337238687861973, 'rsi_os': 21, 'rsi_ob': 73, 'vol_spike': 0.21173096060460211, 'adx_thresh': 29.789945506394183, 'atr_min_pct': 0.026958336331276655, 'atr_max_pct': 0.04211838872375616, 'tp_mult': 2.9300655044763673, 'tsl_mult': 0.012444051755979513, 'strategy': 'breakout', 'time_stop': 285, 'use_sma': True, 'use_atr': False, 'use_adx': False, 'use_ema': True, 'use_spike': False, 'rsi_required': False, 'edge_k': 0.44829476142035385, 'edge_cap': 0.9478554785278344, 'bull_strategy': 'breakout', 'bull_bb_std_mult': 2.398911944516818, 'bull_rsi_os': 46, 'bull_rsi_ob': 70, 'bull_adx_thresh': 7.24814946677014, 'bull_atr_min_pct': 0.011337480824189174, 'bull_atr_max_pct': 0.030003416730908047, 'bull_tp_mult': 1.7030002875179762, 'bull_tsl_mult': 0.02643972501889924, 'bull_time_stop': 193, 'bull_use_sma': False, 'bull_use_ema': False, 'bull_use_atr': False, 'bull_use_adx': True, 'bull_use_spike': False, 'bull_rsi_required': True, 'bear_strategy': 'mean_reversion', 'bear_bb_std_mult': 1.5785008263039977, 'bear_rsi_os': 24, 'bear_rsi_ob': 79, 'bear_adx_thresh': 25.80785562717305, 'bear_atr_min_pct': 0.01715386025025026, 'bear_atr_max_pct': 0.1420774999057351, 'bear_tp_mult': 2.381792341213266, 'bear_tsl_mult': 0.3871842080195861, 'bear_time_stop': 112, 'bear_use_sma': True, 'bear_use_ema': False, 'bear_use_atr': False, 'bear_use_adx': False, 'bear_use_spike': False, 'bear_rsi_required': True, 'sideways_strategy': 'mean_reversion', 'sideways_bb_std_mult': 1.931128981909772, 'sideways_rsi_os': 26, 'sideways_rsi_ob': 84, 'sideways_adx_thresh': 5.951002633155652, 'sideways_atr_min_pct': 0.022874218391817927, 'sideways_atr_max_pct': 0.02874580828597857, 'sideways_tp_mult': 2.2772920257911977, 'sideways_tsl_mult': 0.23773059753141224, 'sideways_time_stop': 182, 'sideways_use_sma': False, 'sideways_use_ema': True, 'sideways_use_atr': False, 'sideways_use_adx': True, 'sideways_use_spike': True, 'sideways_rsi_required': True}.
[I 2025-08-31 10:57:09,131] Trial 9 finished with values: [-1000000000.0, 1000000000.0] and parameters: {'p_sma': 36, 'p_std': 57, 'p_atr': 25, 'p_adx': 22, 'rsi_period': 41, 'ema1': 28, 'ema2': 39, 'slip_atr_k': 0.07416059857485621, 'slip_spread_k': 0.7340132899771222, 'spread_hl_frac': 0.04875891184684738, 'bb_std_mult': 2.4209253860123594, 'rsi_os': 42, 'rsi_ob': 95, 'vol_spike': 0.277805034652361, 'adx_thresh': 28.233023164193632, 'atr_min_pct': 0.025987101637710442, 'atr_max_pct': 0.013109399752594784, 'tp_mult': 2.306433657469456, 'tsl_mult': 0.07046517712260048, 'strategy': 'mean_reversion', 'time_stop': 13, 'use_sma': False, 'use_atr': True, 'use_adx': True, 'use_ema': False, 'use_spike': True, 'rsi_required': False, 'edge_k': 0.7272115668661141, 'edge_cap': 0.6271457159470516, 'bull_strategy': 'mean_reversion', 'bull_bb_std_mult': 1.5839444997068641, 'bull_rsi_os': 33, 'bull_rsi_ob': 78, 'bull_adx_thresh': 30.996953070078746, 'bull_atr_min_pct': 0.027797371742078577, 'bull_atr_max_pct': 0.08068606618263077, 'bull_tp_mult': 2.566572566008909, 'bull_tsl_mult': 0.9181449369721312, 'bull_time_stop': 217, 'bull_use_sma': True, 'bull_use_ema': False, 'bull_use_atr': True, 'bull_use_adx': False, 'bull_use_spike': False, 'bull_rsi_required': True, 'bear_strategy': 'mean_reversion', 'bear_bb_std_mult': 0.9879909635019246, 'bear_rsi_os': 44, 'bear_rsi_ob': 88, 'bear_adx_thresh': 34.36218762469208, 'bear_atr_min_pct': 0.006147973964291786, 'bear_atr_max_pct': 0.12573487868706662, 'bear_tp_mult': 1.106630624013816, 'bear_tsl_mult': 0.9890616506532605, 'bear_time_stop': 211, 'bear_use_sma': False, 'bear_use_ema': False, 'bear_use_atr': True, 'bear_use_adx': False, 'bear_use_spike': True, 'bear_rsi_required': False, 'sideways_strategy': 'breakout', 'sideways_bb_std_mult': 2.7998166879155404, 'sideways_rsi_os': 10, 'sideways_rsi_ob': 81, 'sideways_adx_thresh': 11.18075330434664, 'sideways_atr_min_pct': 0.018119343632742542, 'sideways_atr_max_pct': 0.10829245723573615, 'sideways_tp_mult': 1.617002728050386, 'sideways_tsl_mult': 0.831704226351546, 'sideways_time_stop': 29, 'sideways_use_sma': False, 'sideways_use_ema': True, 'sideways_use_atr': False, 'sideways_use_adx': False, 'sideways_use_spike': True, 'sideways_rsi_required': True}.
[I 2025-08-31 10:57:09,679] Trial 6 finished with values: [-1000000000.0, 1000000000.0] and parameters: {'p_sma': 58, 'p_std': 23, 'p_atr': 28, 'p_adx': 23, 'rsi_period': 83, 'ema1': 27, 'ema2': 43, 'slip_atr_k': 0.1752222185395028, 'slip_spread_k': 0.38913684468300247, 'spread_hl_frac': 0.011327479190240991, 'bb_std_mult': 2.6415202570855847, 'rsi_os': 45, 'rsi_ob': 48, 'vol_spike': 0.009625918769100539, 'adx_thresh': 33.42291528490621, 'atr_min_pct': 0.016815562003442155, 'atr_max_pct': 0.016820031248737106, 'tp_mult': 2.12346762527068, 'tsl_mult': 0.7933207277924578, 'strategy': 'breakout', 'time_stop': 217, 'use_sma': False, 'use_atr': True, 'use_adx': False, 'use_ema': False, 'use_spike': False, 'rsi_required': True, 'edge_k': 0.5593987074401507, 'edge_cap': 0.8202801046544476, 'bull_strategy': 'breakout', 'bull_bb_std_mult': 2.990835975788484, 'bull_rsi_os': 5, 'bull_rsi_ob': 54, 'bull_adx_thresh': 31.225884540927748, 'bull_atr_min_pct': 0.006035858544891075, 'bull_atr_max_pct': 0.07766496547456843, 'bull_tp_mult': 2.346971060727077, 'bull_tsl_mult': 0.483375925351344, 'bull_time_stop': 258, 'bull_use_sma': True, 'bull_use_ema': False, 'bull_use_atr': False, 'bull_use_adx': True, 'bull_use_spike': False, 'bull_rsi_required': False, 'bear_strategy': 'breakout', 'bear_bb_std_mult': 2.4544889876255938, 'bear_rsi_os': 6, 'bear_rsi_ob': 83, 'bear_adx_thresh': 9.523353704892903, 'bear_atr_min_pct': 0.016192106815058057, 'bear_atr_max_pct': 0.04797664904499817, 'bear_tp_mult': 1.587517652008171, 'bear_tsl_mult': 0.9434969001697263, 'bear_time_stop': 207, 'bear_use_sma': True, 'bear_use_ema': True, 'bear_use_atr': True, 'bear_use_adx': True, 'bear_use_spike': False, 'bear_rsi_required': True, 'sideways_strategy': 'breakout', 'sideways_bb_std_mult': 2.253271947108186, 'sideways_rsi_os': 18, 'sideways_rsi_ob': 53, 'sideways_adx_thresh': 11.464213252900443, 'sideways_atr_min_pct': 0.029429539518640323, 'sideways_atr_max_pct': 0.1389302036916346, 'sideways_tp_mult': 1.745653925154176, 'sideways_tsl_mult': 0.4055691470344003, 'sideways_time_stop': 65, 'sideways_use_sma': True, 'sideways_use_ema': True, 'sideways_use_atr': False, 'sideways_use_adx': False, 'sideways_use_spike': False, 'sideways_rsi_required': False}.
[I 2025-08-31 10:57:10,099] Trial 7 finished with values: [-0.1850050836754894, 0.1847180201351205] and parameters: {'p_sma': 52, 'p_std': 15, 'p_atr': 27, 'p_adx': 10, 'rsi_period': 23, 'ema1': 17, 'ema2': 12, 'slip_atr_k': 0.15356115124073985, 'slip_spread_k': 0.8384097988740583, 'spread_hl_frac': 0.007586885920842135, 'bb_std_mult': 3.150577059271868, 'rsi_os': 39, 'rsi_ob': 81, 'vol_spike': 0.02382367280149338, 'adx_thresh': 21.591005994887453, 'atr_min_pct': 0.006637991198094154, 'atr_max_pct': 0.09803909240741823, 'tp_mult': 1.8262560003156472, 'tsl_mult': 0.6005919955822498, 'strategy': 'mean_reversion', 'time_stop': 16, 'use_sma': True, 'use_atr': True, 'use_adx': True, 'use_ema': True, 'use_spike': False, 'rsi_required': True, 'edge_k': 0.01120410843388342, 'edge_cap': 0.5968587629589469, 'bull_strategy': 'mean_reversion', 'bull_bb_std_mult': 3.0406007691187225, 'bull_rsi_os': 46, 'bull_rsi_ob': 91, 'bull_adx_thresh': 16.344850750004777, 'bull_atr_min_pct': 0.001439284300451955, 'bull_atr_max_pct': 0.04513015228151169, 'bull_tp_mult': 1.94000585906099, 'bull_tsl_mult': 0.5724637365151634, 'bull_time_stop': 279, 'bull_use_sma': True, 'bull_use_ema': False, 'bull_use_atr': True, 'bull_use_adx': False, 'bull_use_spike': True, 'bull_rsi_required': True, 'bear_strategy': 'mean_reversion', 'bear_bb_std_mult': 1.131179089275786, 'bear_rsi_os': 28, 'bear_rsi_ob': 84, 'bear_adx_thresh': 14.869663825107052, 'bear_atr_min_pct': 0.005911024155600854, 'bear_atr_max_pct': 0.1302372814010401, 'bear_tp_mult': 2.204778595153836, 'bear_tsl_mult': 0.16628671611843293, 'bear_time_stop': 119, 'bear_use_sma': True, 'bear_use_ema': True, 'bear_use_atr': True, 'bear_use_adx': False, 'bear_use_spike': False, 'bear_rsi_required': True, 'sideways_strategy': 'breakout', 'sideways_bb_std_mult': 2.3027804685671107, 'sideways_rsi_os': 44, 'sideways_rsi_ob': 76, 'sideways_adx_thresh': 34.92625083628361, 'sideways_atr_min_pct': 0.01850206753977184, 'sideways_atr_max_pct': 0.05490231525324027, 'sideways_tp_mult': 1.0533723218026045, 'sideways_tsl_mult': 0.8245477437760652, 'sideways_time_stop': 221, 'sideways_use_sma': True, 'sideways_use_ema': True, 'sideways_use_atr': True, 'sideways_use_adx': False, 'sideways_use_spike': True, 'sideways_rsi_required': False}.
