[I 2025-08-31 11:03:39,444] Trial 55 finished with values: [-0.013366546416988201, 0.013897112193594997] and parameters: {'p_sma': 19, 'p_std': 52, 'p_atr': 20, 'p_adx': 29, 'rsi_period': 8, 'ema1': 8, 'ema2': 32, 'slip_atr_k': 0.11226882819956904, 'slip_spread_k': 0.5664175005695902, 'spread_hl_frac': 0.012007068035440521, 'bb_std_mult': 1.454579339166079, 'rsi_os': 28, 'rsi_ob': 94, 'vol_spike': 0.04535498381890306, 'adx_thresh': 11.994657630404037, 'atr_min_pct': 0.014601900135437582, 'atr_max_pct': 0.14131908328741027, 'tp_mult': 1.742558733439894, 'tsl_mult': 0.5665913920249472, 'strategy': 'breakout', 'time_stop': 152, 'use_sma': False, 'use_atr': False, 'use_adx': True, 'use_ema': True, 'use_spike': False, 'rsi_required': False, 'edge_k': 0.8352293399356416, 'edge_cap': 0.684406166332305, 'bull_strategy': 'mean_reversion', 'bull_bb_std_mult': 2.1873253346346067, 'bull_rsi_os': 8, 'bull_rsi_ob': 65, 'bull_adx_thresh': 5.807023961656618, 'bull_atr_min_pct': 0.015151115275088485, 'bull_atr_max_pct': 0.08078910868880478, 'bull_tp_mult': 1.8075721215221179, 'bull_tsl_mult': 0.0564061759840675, 'bull_time_stop': 123, 'bull_use_sma': True, 'bull_use_ema': False, 'bull_use_atr': False, 'bull_use_adx': False, 'bull_use_spike': True, 'bull_rsi_required': True, 'bear_strategy': 'breakout', 'bear_bb_std_mult': 1.8828227852567214, 'bear_rsi_os': 18, 'bear_rsi_ob': 54, 'bear_adx_thresh': 11.96661807587671, 'bear_atr_min_pct': 0.028058545171958448, 'bear_atr_max_pct': 0.08830978301955023, 'bear_tp_mult': 2.383754932814315, 'bear_tsl_mult': 0.8731173474178431, 'bear_time_stop': 134, 'bear_use_sma': False, 'bear_use_ema': False, 'bear_use_atr': False, 'bear_use_adx': True, 'bear_use_spike': False, 'bear_rsi_required': True, 'sideways_strategy': 'breakout', 'sideways_bb_std_mult': 1.5556681928230218, 'sideways_rsi_os': 25, 'sideways_rsi_ob': 81, 'sideways_adx_thresh': 10.91872945714967, 'sideways_atr_min_pct': 0.003219515141080819, 'sideways_atr_max_pct': 0.06454859969287616, 'sideways_tp_mult': 2.8625541566891046, 'sideways_tsl_mult': 0.054946806275140245, 'sideways_time_stop': 40, 'sideways_use_sma': True, 'sideways_use_ema': True, 'sideways_use_atr': True, 'sideways_use_adx': False, 'sideways_use_spike': False, 'sideways_rsi_required': True}.
[I 2025-08-31 11:03:39,615] Trial 57 finished with values: [-1000000000.0, 1000000000.0] and parameters: {'p_sma': 17, 'p_std': 56, 'p_atr': 7, 'p_adx': 10, 'rsi_period': 30, 'ema1': 8, 'ema2': 32, 'slip_atr_k': 0.11243023534794715, 'slip_spread_k': 0.9245384590147543, 'spread_hl_frac': 0.011390311225966995, 'bb_std_mult': 3.198613252454913, 'rsi_os': 28, 'rsi_ob': 79, 'vol_spike': 0.28945416763491455, 'adx_thresh': 19.76232632216762, 'atr_min_pct': 0.009332979061140457, 'atr_max_pct': 0.049963318402944296, 'tp_mult': 1.645320915622241, 'tsl_mult': 0.0701431567855531, 'strategy': 'breakout', 'time_stop': 297, 'use_sma': False, 'use_atr': False, 'use_adx': True, 'use_ema': True, 'use_spike': False, 'rsi_required': False, 'edge_k': 0.8780607547900934, 'edge_cap': 0.7299365272742574, 'bull_strategy': 'mean_reversion', 'bull_bb_std_mult': 2.187369453448259, 'bull_rsi_os': 13, 'bull_rsi_ob': 56, 'bull_adx_thresh': 19.222302663490183, 'bull_atr_min_pct': 0.02632982668360522, 'bull_atr_max_pct': 0.12238812230438983, 'bull_tp_mult': 1.7350981223639537, 'bull_tsl_mult': 0.30042223616387687, 'bull_time_stop': 120, 'bull_use_sma': True, 'bull_use_ema': False, 'bull_use_atr': True, 'bull_use_adx': True, 'bull_use_spike': True, 'bull_rsi_required': True, 'bear_strategy': 'breakout', 'bear_bb_std_mult': 1.8881718278721644, 'bear_rsi_os': 6, 'bear_rsi_ob': 51, 'bear_adx_thresh': 27.074273012330767, 'bear_atr_min_pct': 0.02264919010673721, 'bear_atr_max_pct': 0.09970481475183325, 'bear_tp_mult': 2.3908606257175573, 'bear_tsl_mult': 0.8747916186784812, 'bear_time_stop': 196, 'bear_use_sma': False, 'bear_use_ema': False, 'bear_use_atr': False, 'bear_use_adx': True, 'bear_use_spike': False, 'bear_rsi_required': True, 'sideways_strategy': 'breakout', 'sideways_bb_std_mult': 0.7601884352182342, 'sideways_rsi_os': 16, 'sideways_rsi_ob': 80, 'sideways_adx_thresh': 23.575346156732316, 'sideways_atr_min_pct': 0.003194227382141812, 'sideways_atr_max_pct': 0.04441803234402581, 'sideways_tp_mult': 2.996895249591608, 'sideways_tsl_mult': 0.05853118039773501, 'sideways_time_stop': 42, 'sideways_use_sma': False, 'sideways_use_ema': True, 'sideways_use_atr': True, 'sideways_use_adx': False, 'sideways_use_spike': True, 'sideways_rsi_required': True}.
[I 2025-08-31 11:03:39,861] Trial 56 finished with values: [-0.04159274836894855, 0.04124700534979272] and parameters: {'p_sma': 18, 'p_std': 52, 'p_atr': 7, 'p_adx': 8, 'rsi_period': 7, 'ema1': 10, 'ema2': 22, 'slip_atr_k': 0.06811840993327295, 'slip_spread_k': 0.8992719127817455, 'spread_hl_frac': 0.011015808187158489, 'bb_std_mult': 0.9036746450548463, 'rsi_os': 18, 'rsi_ob': 95, 'vol_spike': 0.2913397869910949, 'adx_thresh': 14.945738392085472, 'atr_min_pct': 0.014421001877438932, 'atr_max_pct': 0.14940740374906716, 'tp_mult': 1.666504173680332, 'tsl_mult': 0.0603992966055118, 'strategy': 'breakout', 'time_stop': 234, 'use_sma': False, 'use_atr': False, 'use_adx': True, 'use_ema': True, 'use_spike': False, 'rsi_required': False, 'edge_k': 0.8549191680113031, 'edge_cap': 0.48172774267258645, 'bull_strategy': 'mean_reversion', 'bull_bb_std_mult': 3.4253733928513226, 'bull_rsi_os': 15, 'bull_rsi_ob': 65, 'bull_adx_thresh': 26.62269688779741, 'bull_atr_min_pct': 0.026376847697731007, 'bull_atr_max_pct': 0.12310496295514359, 'bull_tp_mult': 1.720693350402207, 'bull_tsl_mult': 0.3033044135382844, 'bull_time_stop': 151, 'bull_use_sma': True, 'bull_use_ema': False, 'bull_use_atr': False, 'bull_use_adx': False, 'bull_use_spike': True, 'bull_rsi_required': True, 'bear_strategy': 'breakout', 'bear_bb_std_mult': 1.801359052062022, 'bear_rsi_os': 18, 'bear_rsi_ob': 53, 'bear_adx_thresh': 12.66048440295033, 'bear_atr_min_pct': 0.02828114125900419, 'bear_atr_max_pct': 0.04072528191918367, 'bear_tp_mult': 2.4024012950536355, 'bear_tsl_mult': 0.8604669154022638, 'bear_time_stop': 128, 'bear_use_sma': False, 'bear_use_ema': False, 'bear_use_atr': False, 'bear_use_adx': True, 'bear_use_spike': False, 'bear_rsi_required': True, 'sideways_strategy': 'breakout', 'sideways_bb_std_mult': 1.5496398540520742, 'sideways_rsi_os': 16, 'sideways_rsi_ob': 81, 'sideways_adx_thresh': 25.082021684674967, 'sideways_atr_min_pct': 0.0028493155761903496, 'sideways_atr_max_pct': 0.026651498530605444, 'sideways_tp_mult': 1.9082431904544883, 'sideways_tsl_mult': 0.052626852910853505, 'sideways_time_stop': 34, 'sideways_use_sma': False, 'sideways_use_ema': True, 'sideways_use_atr': True, 'sideways_use_adx': False, 'sideways_use_spike': True, 'sideways_rsi_required': True}.
[I 2025-08-31 11:03:40,068] Trial 54 finished with values: [-0.022615607374911084, 0.0231596877525959] and parameters: {'p_sma': 24, 'p_std': 57, 'p_atr': 7, 'p_adx': 7, 'rsi_period': 27, 'ema1': 8, 'ema2': 21, 'slip_atr_k': 0.1603037755503775, 'slip_spread_k': 0.9179187706010377, 'spread_hl_frac': 0.02951774866931587, 'bb_std_mult': 1.4406351683228047, 'rsi_os': 18, 'rsi_ob': 94, 'vol_spike': 0.03385841885656421, 'adx_thresh': 12.450956884940146, 'atr_min_pct': 0.013746935898415573, 'atr_max_pct': 0.045236656983332416, 'tp_mult': 2.953448570236594, 'tsl_mult': 0.5651960524218329, 'strategy': 'breakout', 'time_stop': 297, 'use_sma': False, 'use_atr': False, 'use_adx': True, 'use_ema': True, 'use_spike': False, 'rsi_required': False, 'edge_k': 0.843989637285357, 'edge_cap': 0.4961393259200903, 'bull_strategy': 'mean_reversion', 'bull_bb_std_mult': 2.178069253898641, 'bull_rsi_os': 14, 'bull_rsi_ob': 50, 'bull_adx_thresh': 26.976321009613407, 'bull_atr_min_pct': 0.004924056384683047, 'bull_atr_max_pct': 0.08254633092619065, 'bull_tp_mult': 1.732522617842554, 'bull_tsl_mult': 0.18399040260062396, 'bull_time_stop': 263, 'bull_use_sma': True, 'bull_use_ema': True, 'bull_use_atr': False, 'bull_use_adx': False, 'bull_use_spike': True, 'bull_rsi_required': True, 'bear_strategy': 'breakout', 'bear_bb_std_mult': 3.008182608434015, 'bear_rsi_os': 19, 'bear_rsi_ob': 53, 'bear_adx_thresh': 12.365073467216254, 'bear_atr_min_pct': 0.027982947416501272, 'bear_atr_max_pct': 0.08692054581185055, 'bear_tp_mult': 2.410086856465511, 'bear_tsl_mult': 0.8545329773033434, 'bear_time_stop': 17, 'bear_use_sma': False, 'bear_use_ema': False, 'bear_use_atr': False, 'bear_use_adx': True, 'bear_use_spike': False, 'bear_rsi_required': False, 'sideways_strategy': 'breakout', 'sideways_bb_std_mult': 1.5369507558044824, 'sideways_rsi_os': 25, 'sideways_rsi_ob': 79, 'sideways_adx_thresh': 10.91427557813894, 'sideways_atr_min_pct': 0.003405394585162926, 'sideways_atr_max_pct': 0.11059751421384661, 'sideways_tp_mult': 1.6259398171063193, 'sideways_tsl_mult': 0.07193879320680513, 'sideways_time_stop': 39, 'sideways_use_sma': True, 'sideways_use_ema': True, 'sideways_use_atr': True, 'sideways_use_adx': False, 'sideways_use_spike': False, 'sideways_rsi_required': True}.
[I 2025-08-31 11:04:11,267] Trial 58 finished with values: [-1000000000.0, 1000000000.0] and parameters: {'p_sma': 18, 'p_std': 41, 'p_atr': 22, 'p_adx': 30, 'rsi_period': 10, 'ema1': 15, 'ema2': 21, 'slip_atr_k': 0.11469194397103215, 'slip_spread_k': 0.41819849485335425, 'spread_hl_frac': 0.01148116717024437, 'bb_std_mult': 1.3545910432066106, 'rsi_os': 10, 'rsi_ob': 94, 'vol_spike': 0.06755235284827166, 'adx_thresh': 11.368632494940456, 'atr_min_pct': 0.01456223318928265, 'atr_max_pct': 0.14364952725790867, 'tp_mult': 1.6809609056422845, 'tsl_mult': 0.1078674388620045, 'strategy': 'breakout', 'time_stop': 135, 'use_sma': False, 'use_atr': False, 'use_adx': True, 'use_ema': True, 'use_spike': False, 'rsi_required': False, 'edge_k': 0.8076588438881142, 'edge_cap': 0.6714173903745035, 'bull_strategy': 'mean_reversion', 'bull_bb_std_mult': 2.116450995291283, 'bull_rsi_os': 15, 'bull_rsi_ob': 57, 'bull_adx_thresh': 6.132363851749107, 'bull_atr_min_pct': 0.012589827935517063, 'bull_atr_max_pct': 0.08239309191342589, 'bull_tp_mult': 1.7673596364187516, 'bull_tsl_mult': 0.06708835877824611, 'bull_time_stop': 91, 'bull_use_sma': True, 'bull_use_ema': False, 'bull_use_atr': True, 'bull_use_adx': True, 'bull_use_spike': True, 'bull_rsi_required': True, 'bear_strategy': 'mean_reversion', 'bear_bb_std_mult': 1.8819200387436144, 'bear_rsi_os': 5, 'bear_rsi_ob': 53, 'bear_adx_thresh': 12.798417397493179, 'bear_atr_min_pct': 0.028268887702259445, 'bear_atr_max_pct': 0.06696660123297353, 'bear_tp_mult': 1.881498935755596, 'bear_tsl_mult': 0.24861394193580433, 'bear_time_stop': 166, 'bear_use_sma': False, 'bear_use_ema': False, 'bear_use_atr': False, 'bear_use_adx': True, 'bear_use_spike': False, 'bear_rsi_required': True, 'sideways_strategy': 'breakout', 'sideways_bb_std_mult': 0.7501968046770717, 'sideways_rsi_os': 16, 'sideways_rsi_ob': 60, 'sideways_adx_thresh': 23.840086302197246, 'sideways_atr_min_pct': 0.00914959178729494, 'sideways_atr_max_pct': 0.06206655240370252, 'sideways_tp_mult': 2.9653017123803105, 'sideways_tsl_mult': 0.05343882518619567, 'sideways_time_stop': 21, 'sideways_use_sma': False, 'sideways_use_ema': True, 'sideways_use_atr': True, 'sideways_use_adx': False, 'sideways_use_spike': False, 'sideways_rsi_required': True}.
[I 2025-08-31 11:04:11,971] Trial 60 finished with values: [-1000000000.0, 1000000000.0] and parameters: {'p_sma': 12, 'p_std': 41, 'p_atr': 22, 'p_adx': 30, 'rsi_period': 9, 'ema1': 11, 'ema2': 22, 'slip_atr_k': 0.20256706439156802, 'slip_spread_k': 0.40488499134795997, 'spread_hl_frac': 0.011640475795812823, 'bb_std_mult': 1.2736380828163476, 'rsi_os': 19, 'rsi_ob': 93, 'vol_spike': 0.11791956771885886, 'adx_thresh': 14.918058026211705, 'atr_min_pct': 0.012075881649650443, 'atr_max_pct': 0.1444557375722479, 'tp_mult': 1.4149080109280223, 'tsl_mult': 0.5699425707405805, 'strategy': 'breakout', 'time_stop': 135, 'use_sma': False, 'use_atr': False, 'use_adx': True, 'use_ema': True, 'use_spike': False, 'rsi_required': True, 'edge_k': 1.0671627829877433, 'edge_cap': 0.6576592283368425, 'bull_strategy': 'mean_reversion', 'bull_bb_std_mult': 2.0654133420674006, 'bull_rsi_os': 5, 'bull_rsi_ob': 65, 'bull_adx_thresh': 6.123170511006421, 'bull_atr_min_pct': 0.012538882463678637, 'bull_atr_max_pct': 0.08078322916482648, 'bull_tp_mult': 1.8837995633062272, 'bull_tsl_mult': 0.061410128481799914, 'bull_time_stop': 88, 'bull_use_sma': True, 'bull_use_ema': False, 'bull_use_atr': True, 'bull_use_adx': False, 'bull_use_spike': True, 'bull_rsi_required': True, 'bear_strategy': 'mean_reversion', 'bear_bb_std_mult': 1.988146044519093, 'bear_rsi_os': 19, 'bear_rsi_ob': 55, 'bear_adx_thresh': 12.974702059122825, 'bear_atr_min_pct': 0.02914234029448123, 'bear_atr_max_pct': 0.06628320499948133, 'bear_tp_mult': 1.8340100194779607, 'bear_tsl_mult': 0.23695851160418835, 'bear_time_stop': 164, 'bear_use_sma': False, 'bear_use_ema': False, 'bear_use_atr': False, 'bear_use_adx': False, 'bear_use_spike': False, 'bear_rsi_required': True, 'sideways_strategy': 'mean_reversion', 'sideways_bb_std_mult': 1.2337101345433168, 'sideways_rsi_os': 30, 'sideways_rsi_ob': 79, 'sideways_adx_thresh': 26.101920823037712, 'sideways_atr_min_pct': 0.00895985606661948, 'sideways_atr_max_pct': 0.11168152788192519, 'sideways_tp_mult': 2.8894422597697638, 'sideways_tsl_mult': 0.04700948456392182, 'sideways_time_stop': 20, 'sideways_use_sma': False, 'sideways_use_ema': True, 'sideways_use_atr': True, 'sideways_use_adx': False, 'sideways_use_spike': False, 'sideways_rsi_required': True}.
[I 2025-08-31 11:04:12,251] Trial 61 finished with values: [-1000000000.0, 1000000000.0] and parameters: {'p_sma': 13, 'p_std': 41, 'p_atr': 20, 'p_adx': 29, 'rsi_period': 19, 'ema1': 10, 'ema2': 22, 'slip_atr_k': 0.20863128424977437, 'slip_spread_k': 0.4226126275312405, 'spread_hl_frac': 0.012210634712539728, 'bb_std_mult': 1.3619285368040133, 'rsi_os': 27, 'rsi_ob': 93, 'vol_spike': 0.11427676908680123, 'adx_thresh': 14.631707164343387, 'atr_min_pct': 0.012927533192199657, 'atr_max_pct': 0.14379307859984752, 'tp_mult': 1.478987595164231, 'tsl_mult': 0.5751894850844417, 'strategy': 'breakout', 'time_stop': 131, 'use_sma': True, 'use_atr': False, 'use_adx': True, 'use_ema': True, 'use_spike': True, 'rsi_required': True, 'edge_k': 1.0612512530772147, 'edge_cap': 0.9532720605264127, 'bull_strategy': 'mean_reversion', 'bull_bb_std_mult': 1.5026619745359346, 'bull_rsi_os': 5, 'bull_rsi_ob': 64, 'bull_adx_thresh': 5.023147275356964, 'bull_atr_min_pct': 0.01255692840441374, 'bull_atr_max_pct': 0.08151231159937525, 'bull_tp_mult': 1.035831513432787, 'bull_tsl_mult': 0.06346942449257707, 'bull_time_stop': 86, 'bull_use_sma': False, 'bull_use_ema': False, 'bull_use_atr': True, 'bull_use_adx': True, 'bull_use_spike': True, 'bull_rsi_required': True, 'bear_strategy': 'mean_reversion', 'bear_bb_std_mult': 2.0014554913239695, 'bear_rsi_os': 18, 'bear_rsi_ob': 45, 'bear_adx_thresh': 12.986312458486333, 'bear_atr_min_pct': 0.029426023735525518, 'bear_atr_max_pct': 0.06549877694767288, 'bear_tp_mult': 1.8856929915343124, 'bear_tsl_mult': 0.2083828722955242, 'bear_time_stop': 162, 'bear_use_sma': False, 'bear_use_ema': True, 'bear_use_atr': False, 'bear_use_adx': False, 'bear_use_spike': False, 'bear_rsi_required': True, 'sideways_strategy': 'mean_reversion', 'sideways_bb_std_mult': 1.5397887737394351, 'sideways_rsi_os': 33, 'sideways_rsi_ob': 79, 'sideways_adx_thresh': 26.281556404328143, 'sideways_atr_min_pct': 0.006034070192431126, 'sideways_atr_max_pct': 0.06251133605714558, 'sideways_tp_mult': 2.8972547128552195, 'sideways_tsl_mult': 0.037966261514730905, 'sideways_time_stop': 23, 'sideways_use_sma': False, 'sideways_use_ema': True, 'sideways_use_atr': True, 'sideways_use_adx': False, 'sideways_use_spike': False, 'sideways_rsi_required': True}.
[I 2025-08-31 11:04:12,358] Trial 59 finished with values: [-1000000000.0, 1000000000.0] and parameters: {'p_sma': 15, 'p_std': 41, 'p_atr': 22, 'p_adx': 29, 'rsi_period': 10, 'ema1': 16, 'ema2': 23, 'slip_atr_k': 0.11542458135492935, 'slip_spread_k': 0.4205453188065857, 'spread_hl_frac': 0.008160258306860239, 'bb_std_mult': 1.407987741430409, 'rsi_os': 9, 'rsi_ob': 93, 'vol_spike': 0.11417375972240207, 'adx_thresh': 11.551491517500633, 'atr_min_pct': 0.01448284875862373, 'atr_max_pct': 0.14136676291906236, 'tp_mult': 1.4494976220277704, 'tsl_mult': 0.5668102706726541, 'strategy': 'breakout', 'time_stop': 135, 'use_sma': False, 'use_atr': False, 'use_adx': True, 'use_ema': True, 'use_spike': False, 'rsi_required': True, 'edge_k': 1.0502854879191916, 'edge_cap': 0.9552594033659981, 'bull_strategy': 'mean_reversion', 'bull_bb_std_mult': 2.078933854557304, 'bull_rsi_os': 13, 'bull_rsi_ob': 65, 'bull_adx_thresh': 6.467662254261274, 'bull_atr_min_pct': 0.012328752640768648, 'bull_atr_max_pct': 0.09224455316482964, 'bull_tp_mult': 1.0350304077241193, 'bull_tsl_mult': 0.062461770358968174, 'bull_time_stop': 86, 'bull_use_sma': True, 'bull_use_ema': False, 'bull_use_atr': False, 'bull_use_adx': False, 'bull_use_spike': True, 'bull_rsi_required': False, 'bear_strategy': 'mean_reversion', 'bear_bb_std_mult': 3.5346459797160694, 'bear_rsi_os': 19, 'bear_rsi_ob': 54, 'bear_adx_thresh': 12.982904917964, 'bear_atr_min_pct': 0.028306081024025716, 'bear_atr_max_pct': 0.03983494147120004, 'bear_tp_mult': 2.560197275714021, 'bear_tsl_mult': 0.4219571669015742, 'bear_time_stop': 163, 'bear_use_sma': False, 'bear_use_ema': False, 'bear_use_atr': False, 'bear_use_adx': False, 'bear_use_spike': False, 'bear_rsi_required': True, 'sideways_strategy': 'mean_reversion', 'sideways_bb_std_mult': 1.6004962740980277, 'sideways_rsi_os': 33, 'sideways_rsi_ob': 69, 'sideways_adx_thresh': 18.67324108413343, 'sideways_atr_min_pct': 0.02502878118579817, 'sideways_atr_max_pct': 0.10901615639583943, 'sideways_tp_mult': 2.869953485333894, 'sideways_tsl_mult': 0.07387357709517609, 'sideways_time_stop': 24, 'sideways_use_sma': True, 'sideways_use_ema': True, 'sideways_use_atr': True, 'sideways_use_adx': False, 'sideways_use_spike': False, 'sideways_rsi_required': True}.
[I 2025-08-31 11:04:12,678] Trial 64 finished with values: [-1000000000.0, 1000000000.0] and parameters: {'p_sma': 20, 'p_std': 48, 'p_atr': 29, 'p_adx': 28, 'rsi_period': 7, 'ema1': 10, 'ema2': 29, 'slip_atr_k': 0.23709001925745565, 'slip_spread_k': 0.5069569577618119, 'spread_hl_frac': 0.008166277583610222, 'bb_std_mult': 1.0480908874013979, 'rsi_os': 22, 'rsi_ob': 89, 'vol_spike': 0.15326920840631175, 'adx_thresh': 8.554413090756212, 'atr_min_pct': 0.01815748558152637, 'atr_max_pct': 0.012497569472501413, 'tp_mult': 1.8027918956545308, 'tsl_mult': 0.37817093656622963, 'strategy': 'breakout', 'time_stop': 101, 'use_sma': False, 'use_atr': False, 'use_adx': True, 'use_ema': True, 'use_spike': False, 'rsi_required': False, 'edge_k': 0.8147826109923139, 'edge_cap': 0.48092398768705136, 'bull_strategy': 'mean_reversion', 'bull_bb_std_mult': 2.31293078101306, 'bull_rsi_os': 13, 'bull_rsi_ob': 60, 'bull_adx_thresh': 15.134790519756772, 'bull_atr_min_pct': 0.015429060678350382, 'bull_atr_max_pct': 0.056463278612701145, 'bull_tp_mult': 1.5698484821120269, 'bull_tsl_mult': 0.0199133002804769, 'bull_time_stop': 118, 'bull_use_sma': True, 'bull_use_ema': False, 'bull_use_atr': False, 'bull_use_adx': False, 'bull_use_spike': False, 'bull_rsi_required': False, 'bear_strategy': 'breakout', 'bear_bb_std_mult': 3.56071941043348, 'bear_rsi_os': 12, 'bear_rsi_ob': 61, 'bear_adx_thresh': 9.51784905392338, 'bear_atr_min_pct': 0.025288174019633243, 'bear_atr_max_pct': 0.08123981417610761, 'bear_tp_mult': 2.5666484708727584, 'bear_tsl_mult': 0.4114282595760316, 'bear_time_stop': 130, 'bear_use_sma': False, 'bear_use_ema': False, 'bear_use_atr': True, 'bear_use_adx': True, 'bear_use_spike': False, 'bear_rsi_required': True, 'sideways_strategy': 'breakout', 'sideways_bb_std_mult': 1.5896640654066452, 'sideways_rsi_os': 30, 'sideways_rsi_ob': 82, 'sideways_adx_thresh': 18.69218149832025, 'sideways_atr_min_pct': 0.00465842019666094, 'sideways_atr_max_pct': 0.06963207918564081, 'sideways_tp_mult': 2.8335088610325343, 'sideways_tsl_mult': 0.0022446721650474302, 'sideways_time_stop': 52, 'sideways_use_sma': True, 'sideways_use_ema': True, 'sideways_use_atr': True, 'sideways_use_adx': False, 'sideways_use_spike': False, 'sideways_rsi_required': True}.
