[I 2025-08-31 11:14:49,994] Trial 145 finished with values: [-0.009921263996107488, 0.012144556096702145] and parameters: {'p_sma': 40, 'p_std': 39, 'p_atr': 14, 'p_adx': 20, 'rsi_period': 49, 'ema1': 14, 'ema2': 11, 'slip_atr_k': 0.03558672909568344, 'slip_spread_k': 0.6731023396103177, 'spread_hl_frac': 0.01709071702427587, 'bb_std_mult': 2.819467759536129, 'rsi_os': 39, 'rsi_ob': 86, 'vol_spike': 0.10054098095197694, 'adx_thresh': 28.255370654942936, 'atr_min_pct': 0.0024130626228539265, 'atr_max_pct': 0.0648253848690561, 'tp_mult': 1.015317358837754, 'tsl_mult': 0.17412970198145963, 'strategy': 'breakout', 'time_stop': 286, 'use_sma': False, 'use_atr': True, 'use_adx': True, 'use_ema': False, 'use_spike': False, 'rsi_required': True, 'edge_k': 0.26353165161138353, 'edge_cap': 0.976566891222495, 'bull_strategy': 'breakout', 'bull_bb_std_mult': 2.7242254576242386, 'bull_rsi_os': 23, 'bull_rsi_ob': 60, 'bull_adx_thresh': 10.275773995425023, 'bull_atr_min_pct': 0.016886232754710198, 'bull_atr_max_pct': 0.036863887793922495, 'bull_tp_mult': 1.5424498783478098, 'bull_tsl_mult': 0.43249935705379094, 'bull_time_stop': 139, 'bull_use_sma': True, 'bull_use_ema': False, 'bull_use_atr': True, 'bull_use_adx': True, 'bull_use_spike': False, 'bull_rsi_required': True, 'bear_strategy': 'breakout', 'bear_bb_std_mult': 0.8673255106607597, 'bear_rsi_os': 9, 'bear_rsi_ob': 55, 'bear_adx_thresh': 33.370860647968115, 'bear_atr_min_pct': 0.004777984434872759, 'bear_atr_max_pct': 0.14464967470777196, 'bear_tp_mult': 2.5626510851616535, 'bear_tsl_mult': 0.4306921843493536, 'bear_time_stop': 70, 'bear_use_sma': True, 'bear_use_ema': False, 'bear_use_atr': True, 'bear_use_adx': False, 'bear_use_spike': True, 'bear_rsi_required': False, 'sideways_strategy': 'breakout', 'sideways_bb_std_mult': 1.2536900843550718, 'sideways_rsi_os': 31, 'sideways_rsi_ob': 70, 'sideways_adx_thresh': 7.116652562440185, 'sideways_atr_min_pct': 0.0021292215128383748, 'sideways_atr_max_pct': 0.026645785862862988, 'sideways_tp_mult': 2.208867983721741, 'sideways_tsl_mult': 0.6403562145605595, 'sideways_time_stop': 39, 'sideways_use_sma': False, 'sideways_use_ema': False, 'sideways_use_atr': False, 'sideways_use_adx': True, 'sideways_use_spike': False, 'sideways_rsi_required': True}.
[I 2025-08-31 11:14:50,205] Trial 142 finished with values: [-0.07655918803133499, 0.0762335211648242] and parameters: {'p_sma': 36, 'p_std': 14, 'p_atr': 17, 'p_adx': 20, 'rsi_period': 42, 'ema1': 14, 'ema2': 11, 'slip_atr_k': 0.05267094290725507, 'slip_spread_k': 0.7285700281275189, 'spread_hl_frac': 0.017389740797273918, 'bb_std_mult': 2.8432780453628306, 'rsi_os': 43, 'rsi_ob': 86, 'vol_spike': 0.1168286844185479, 'adx_thresh': 5.396525181774727, 'atr_min_pct': 0.00148469983882174, 'atr_max_pct': 0.09490662586077733, 'tp_mult': 1.0258927745278863, 'tsl_mult': 0.03405212610623294, 'strategy': 'mean_reversion', 'time_stop': 286, 'use_sma': True, 'use_atr': False, 'use_adx': True, 'use_ema': False, 'use_spike': False, 'rsi_required': True, 'edge_k': 0.3274842359151281, 'edge_cap': 0.8367040073021685, 'bull_strategy': 'breakout', 'bull_bb_std_mult': 2.7435679659488503, 'bull_rsi_os': 23, 'bull_rsi_ob': 65, 'bull_adx_thresh': 9.902751406942986, 'bull_atr_min_pct': 0.015660635312091407, 'bull_atr_max_pct': 0.01862983184025331, 'bull_tp_mult': 2.6968778387104853, 'bull_tsl_mult': 0.43198636824280656, 'bull_time_stop': 140, 'bull_use_sma': True, 'bull_use_ema': False, 'bull_use_atr': True, 'bull_use_adx': True, 'bull_use_spike': False, 'bull_rsi_required': True, 'bear_strategy': 'mean_reversion', 'bear_bb_std_mult': 0.612021730004419, 'bear_rsi_os': 49, 'bear_rsi_ob': 58, 'bear_adx_thresh': 32.07567018915578, 'bear_atr_min_pct': 0.003474712019978945, 'bear_atr_max_pct': 0.06746988799753696, 'bear_tp_mult': 2.579593704481233, 'bear_tsl_mult': 0.4464197564253203, 'bear_time_stop': 53, 'bear_use_sma': True, 'bear_use_ema': False, 'bear_use_atr': True, 'bear_use_adx': False, 'bear_use_spike': True, 'bear_rsi_required': False, 'sideways_strategy': 'breakout', 'sideways_bb_std_mult': 3.3128226350109626, 'sideways_rsi_os': 38, 'sideways_rsi_ob': 67, 'sideways_adx_thresh': 7.743402322944473, 'sideways_atr_min_pct': 0.0020974258689023012, 'sideways_atr_max_pct': 0.03051178676795379, 'sideways_tp_mult': 2.1045266256379405, 'sideways_tsl_mult': 0.6317936846703606, 'sideways_time_stop': 247, 'sideways_use_sma': False, 'sideways_use_ema': True, 'sideways_use_atr': False, 'sideways_use_adx': False, 'sideways_use_spike': False, 'sideways_rsi_required': True}.
[I 2025-08-31 11:15:20,951] Trial 146 finished with values: [-0.011698757520822278, 0.013128686216095945] and parameters: {'p_sma': 43, 'p_std': 39, 'p_atr': 14, 'p_adx': 22, 'rsi_period': 49, 'ema1': 14, 'ema2': 11, 'slip_atr_k': 0.04141665496182007, 'slip_spread_k': 0.6494723442186381, 'spread_hl_frac': 0.01688198073480022, 'bb_std_mult': 2.8319022747280855, 'rsi_os': 39, 'rsi_ob': 82, 'vol_spike': 0.11594924314501229, 'adx_thresh': 32.18512379453935, 'atr_min_pct': 0.0023134037519098464, 'atr_max_pct': 0.09986346568800769, 'tp_mult': 1.0275084308242026, 'tsl_mult': 0.17598268128808023, 'strategy': 'breakout', 'time_stop': 286, 'use_sma': False, 'use_atr': True, 'use_adx': True, 'use_ema': False, 'use_spike': False, 'rsi_required': True, 'edge_k': 0.3357629297022527, 'edge_cap': 0.9757781900551102, 'bull_strategy': 'breakout', 'bull_bb_std_mult': 2.7857655070329104, 'bull_rsi_os': 23, 'bull_rsi_ob': 64, 'bull_adx_thresh': 10.61035546799903, 'bull_atr_min_pct': 0.015096490907196617, 'bull_atr_max_pct': 0.017151577227539225, 'bull_tp_mult': 1.2270463091088732, 'bull_tsl_mult': 0.29663979973443716, 'bull_time_stop': 148, 'bull_use_sma': True, 'bull_use_ema': False, 'bull_use_atr': True, 'bull_use_adx': True, 'bull_use_spike': False, 'bull_rsi_required': True, 'bear_strategy': 'breakout', 'bear_bb_std_mult': 0.9993182147462869, 'bear_rsi_os': 6, 'bear_rsi_ob': 58, 'bear_adx_thresh': 33.32389424332143, 'bear_atr_min_pct': 0.009140075481723508, 'bear_atr_max_pct': 0.14521761207101555, 'bear_tp_mult': 2.546179395295155, 'bear_tsl_mult': 0.43065538132101683, 'bear_time_stop': 70, 'bear_use_sma': True, 'bear_use_ema': False, 'bear_use_atr': True, 'bear_use_adx': False, 'bear_use_spike': True, 'bear_rsi_required': False, 'sideways_strategy': 'breakout', 'sideways_bb_std_mult': 1.2891754715816222, 'sideways_rsi_os': 31, 'sideways_rsi_ob': 70, 'sideways_adx_thresh': 9.05949995352532, 'sideways_atr_min_pct': 0.002047111562763046, 'sideways_atr_max_pct': 0.029589135888151638, 'sideways_tp_mult': 2.106812942940971, 'sideways_tsl_mult': 0.6285448029342181, 'sideways_time_stop': 41, 'sideways_use_sma': False, 'sideways_use_ema': False, 'sideways_use_atr': False, 'sideways_use_adx': True, 'sideways_use_spike': False, 'sideways_rsi_required': True}.
[I 2025-08-31 11:15:21,227] Trial 147 finished with values: [-0.00708655379373091, 0.010354349568990394] and parameters: {'p_sma': 43, 'p_std': 15, 'p_atr': 14, 'p_adx': 20, 'rsi_period': 54, 'ema1': 14, 'ema2': 15, 'slip_atr_k': 0.041507787141678756, 'slip_spread_k': 0.6443175294067245, 'spread_hl_frac': 0.04567510326563741, 'bb_std_mult': 2.425556224294991, 'rsi_os': 39, 'rsi_ob': 82, 'vol_spike': 0.1737397663600384, 'adx_thresh': 31.7943616802564, 'atr_min_pct': 0.0023398207729821378, 'atr_max_pct': 0.0750932654970802, 'tp_mult': 1.0114185243519267, 'tsl_mult': 0.06852738863046576, 'strategy': 'breakout', 'time_stop': 300, 'use_sma': False, 'use_atr': True, 'use_adx': True, 'use_ema': False, 'use_spike': False, 'rsi_required': True, 'edge_k': 0.3371138937278142, 'edge_cap': 0.8864904780259486, 'bull_strategy': 'breakout', 'bull_bb_std_mult': 0.9434588540388897, 'bull_rsi_os': 23, 'bull_rsi_ob': 60, 'bull_adx_thresh': 10.531220897413837, 'bull_atr_min_pct': 0.018409893989958133, 'bull_atr_max_pct': 0.14192254377156316, 'bull_tp_mult': 1.5610851509152819, 'bull_tsl_mult': 0.3254225853435231, 'bull_time_stop': 147, 'bull_use_sma': True, 'bull_use_ema': False, 'bull_use_atr': True, 'bull_use_adx': True, 'bull_use_spike': False, 'bull_rsi_required': True, 'bear_strategy': 'breakout', 'bear_bb_std_mult': 0.999777112337449, 'bear_rsi_os': 16, 'bear_rsi_ob': 55, 'bear_adx_thresh': 33.255768495990395, 'bear_atr_min_pct': 0.00906039505603953, 'bear_atr_max_pct': 0.11434074484963519, 'bear_tp_mult': 2.548609838814839, 'bear_tsl_mult': 0.36129631766881887, 'bear_time_stop': 71, 'bear_use_sma': True, 'bear_use_ema': False, 'bear_use_atr': True, 'bear_use_adx': False, 'bear_use_spike': True, 'bear_rsi_required': False, 'sideways_strategy': 'breakout', 'sideways_bb_std_mult': 1.0608368438080935, 'sideways_rsi_os': 32, 'sideways_rsi_ob': 70, 'sideways_adx_thresh': 8.175472744818137, 'sideways_atr_min_pct': 0.0023791907348990494, 'sideways_atr_max_pct': 0.015916152895804, 'sideways_tp_mult': 2.2114448447644377, 'sideways_tsl_mult': 0.719810436881135, 'sideways_time_stop': 17, 'sideways_use_sma': False, 'sideways_use_ema': False, 'sideways_use_atr': False, 'sideways_use_adx': True, 'sideways_use_spike': False, 'sideways_rsi_required': True}.
[I 2025-08-31 11:15:21,861] Trial 148 finished with values: [-0.07947604521465945, 0.07930517229845463] and parameters: {'p_sma': 40, 'p_std': 14, 'p_atr': 14, 'p_adx': 22, 'rsi_period': 54, 'ema1': 17, 'ema2': 19, 'slip_atr_k': 0.034388999197879425, 'slip_spread_k': 0.13933287569369257, 'spread_hl_frac': 0.04594272862624358, 'bb_std_mult': 2.802918692327258, 'rsi_os': 46, 'rsi_ob': 55, 'vol_spike': 0.10309372585107858, 'adx_thresh': 5.271006087498513, 'atr_min_pct': 0.004010008474231211, 'atr_max_pct': 0.06233559969063741, 'tp_mult': 1.0162381368739042, 'tsl_mult': 0.08075671663182216, 'strategy': 'mean_reversion', 'time_stop': 299, 'use_sma': False, 'use_atr': False, 'use_adx': True, 'use_ema': False, 'use_spike': False, 'rsi_required': True, 'edge_k': 0.33853333218683773, 'edge_cap': 0.886140935526343, 'bull_strategy': 'breakout', 'bull_bb_std_mult': 0.9680660684996938, 'bull_rsi_os': 20, 'bull_rsi_ob': 64, 'bull_adx_thresh': 14.16267447594402, 'bull_atr_min_pct': 4.587396533840306e-05, 'bull_atr_max_pct': 0.01622064443664341, 'bull_tp_mult': 1.232708018838971, 'bull_tsl_mult': 0.3272117722242338, 'bull_time_stop': 148, 'bull_use_sma': False, 'bull_use_ema': True, 'bull_use_atr': True, 'bull_use_adx': True, 'bull_use_spike': False, 'bull_rsi_required': True, 'bear_strategy': 'mean_reversion', 'bear_bb_std_mult': 1.0163177272163955, 'bear_rsi_os': 16, 'bear_rsi_ob': 95, 'bear_adx_thresh': 33.16103745917759, 'bear_atr_min_pct': 0.005600593237587038, 'bear_atr_max_pct': 0.03293317994234478, 'bear_tp_mult': 2.7262800369504525, 'bear_tsl_mult': 0.36201067526742864, 'bear_time_stop': 45, 'bear_use_sma': True, 'bear_use_ema': False, 'bear_use_atr': True, 'bear_use_adx': True, 'bear_use_spike': True, 'bear_rsi_required': False, 'sideways_strategy': 'breakout', 'sideways_bb_std_mult': 0.7386037042951632, 'sideways_rsi_os': 12, 'sideways_rsi_ob': 69, 'sideways_adx_thresh': 34.44716852715921, 'sideways_atr_min_pct': 0.010158033468733625, 'sideways_atr_max_pct': 0.0253801631382834, 'sideways_tp_mult': 2.210341447235526, 'sideways_tsl_mult': 0.6318943489701986, 'sideways_time_stop': 298, 'sideways_use_sma': False, 'sideways_use_ema': True, 'sideways_use_atr': False, 'sideways_use_adx': False, 'sideways_use_spike': False, 'sideways_rsi_required': True}.
[I 2025-08-31 11:15:22,063] Trial 149 finished with values: [-1000000000.0, 1000000000.0] and parameters: {'p_sma': 40, 'p_std': 39, 'p_atr': 14, 'p_adx': 22, 'rsi_period': 49, 'ema1': 17, 'ema2': 15, 'slip_atr_k': 0.04037740508026286, 'slip_spread_k': 0.6500455593127569, 'spread_hl_frac': 0.022874068906082123, 'bb_std_mult': 2.430821427230639, 'rsi_os': 46, 'rsi_ob': 47, 'vol_spike': 0.10224910550786417, 'adx_thresh': 32.09067186277596, 'atr_min_pct': 0.0009658717326450153, 'atr_max_pct': 0.07612482219136807, 'tp_mult': 1.1829683898762857, 'tsl_mult': 0.06946565268978286, 'strategy': 'breakout', 'time_stop': 299, 'use_sma': False, 'use_atr': False, 'use_adx': True, 'use_ema': False, 'use_spike': True, 'rsi_required': True, 'edge_k': 0.38601426725221116, 'edge_cap': 0.8852156164681906, 'bull_strategy': 'breakout', 'bull_bb_std_mult': 2.8190504344834304, 'bull_rsi_os': 20, 'bull_rsi_ob': 60, 'bull_adx_thresh': 11.718095496377666, 'bull_atr_min_pct': 0.027317113808384304, 'bull_atr_max_pct': 0.015173676550683607, 'bull_tp_mult': 2.400713172737873, 'bull_tsl_mult': 0.32020264191557524, 'bull_time_stop': 159, 'bull_use_sma': False, 'bull_use_ema': True, 'bull_use_atr': True, 'bull_use_adx': True, 'bull_use_spike': False, 'bull_rsi_required': True, 'bear_strategy': 'breakout', 'bear_bb_std_mult': 0.8797518374765922, 'bear_rsi_os': 17, 'bear_rsi_ob': 85, 'bear_adx_thresh': 33.05011170188669, 'bear_atr_min_pct': 0.008713066421901273, 'bear_atr_max_pct': 0.13682862057574852, 'bear_tp_mult': 2.531214247784384, 'bear_tsl_mult': 0.4185938633988035, 'bear_time_stop': 45, 'bear_use_sma': True, 'bear_use_ema': True, 'bear_use_atr': True, 'bear_use_adx': True, 'bear_use_spike': True, 'bear_rsi_required': False, 'sideways_strategy': 'breakout', 'sideways_bb_std_mult': 0.6779629066672164, 'sideways_rsi_os': 53, 'sideways_rsi_ob': 69, 'sideways_adx_thresh': 9.264703911828915, 'sideways_atr_min_pct': 0.013940885334489235, 'sideways_atr_max_pct': 0.026529208865324182, 'sideways_tp_mult': 2.2165982058229337, 'sideways_tsl_mult': 0.6357889705963594, 'sideways_time_stop': 208, 'sideways_use_sma': False, 'sideways_use_ema': True, 'sideways_use_atr': False, 'sideways_use_adx': False, 'sideways_use_spike': False, 'sideways_rsi_required': True}.
[I 2025-08-31 11:15:53,418] Trial 151 finished with values: [-1000000000.0, 1000000000.0] and parameters: {'p_sma': 46, 'p_std': 9, 'p_atr': 14, 'p_adx': 18, 'rsi_period': 49, 'ema1': 12, 'ema2': 12, 'slip_atr_k': 0.03441975100134239, 'slip_spread_k': 0.613588313570341, 'spread_hl_frac': 0.046037888671417046, 'bb_std_mult': 2.3707645730431177, 'rsi_os': 41, 'rsi_ob': 80, 'vol_spike': 0.17482035794713924, 'adx_thresh': 32.7062535567426, 'atr_min_pct': 0.0038397147777924183, 'atr_max_pct': 0.07672346608814858, 'tp_mult': 1.0107066680081453, 'tsl_mult': 0.0007288433533385735, 'strategy': 'mean_reversion', 'time_stop': 300, 'use_sma': False, 'use_atr': True, 'use_adx': False, 'use_ema': False, 'use_spike': True, 'rsi_required': True, 'edge_k': 0.3755587156216123, 'edge_cap': 0.890217956448509, 'bull_strategy': 'breakout', 'bull_bb_std_mult': 0.9214827289281595, 'bull_rsi_os': 29, 'bull_rsi_ob': 57, 'bull_adx_thresh': 10.748350701959081, 'bull_atr_min_pct': 0.018386559911041826, 'bull_atr_max_pct': 0.14372826354710835, 'bull_tp_mult': 1.5529400808808698, 'bull_tsl_mult': 0.292215853687466, 'bull_time_stop': 146, 'bull_use_sma': False, 'bull_use_ema': True, 'bull_use_atr': True, 'bull_use_adx': True, 'bull_use_spike': False, 'bull_rsi_required': True, 'bear_strategy': 'mean_reversion', 'bear_bb_std_mult': 1.033216125079286, 'bear_rsi_os': 17, 'bear_rsi_ob': 55, 'bear_adx_thresh': 28.884353780289345, 'bear_atr_min_pct': 0.008519466770636867, 'bear_atr_max_pct': 0.13680385551982097, 'bear_tp_mult': 2.5395517571738897, 'bear_tsl_mult': 0.3677275124167006, 'bear_time_stop': 89, 'bear_use_sma': True, 'bear_use_ema': True, 'bear_use_atr': True, 'bear_use_adx': False, 'bear_use_spike': True, 'bear_rsi_required': False, 'sideways_strategy': 'breakout', 'sideways_bb_std_mult': 0.9950885487319178, 'sideways_rsi_os': 52, 'sideways_rsi_ob': 69, 'sideways_adx_thresh': 9.621768943086563, 'sideways_atr_min_pct': 0.026473204239831134, 'sideways_atr_max_pct': 0.016678865184249998, 'sideways_tp_mult': 2.2250327283162257, 'sideways_tsl_mult': 0.7235393193883297, 'sideways_time_stop': 215, 'sideways_use_sma': False, 'sideways_use_ema': False, 'sideways_use_atr': False, 'sideways_use_adx': True, 'sideways_use_spike': False, 'sideways_rsi_required': False}.
[I 2025-08-31 11:15:53,767] Trial 153 finished with values: [-1000000000.0, 1000000000.0] and parameters: {'p_sma': 45, 'p_std': 19, 'p_atr': 13, 'p_adx': 18, 'rsi_period': 57, 'ema1': 12, 'ema2': 13, 'slip_atr_k': 0.02705579389187774, 'slip_spread_k': 0.6287120172136029, 'spread_hl_frac': 0.04983453907518806, 'bb_std_mult': 2.1896595875467364, 'rsi_os': 42, 'rsi_ob': 80, 'vol_spike': 0.19291941405610302, 'adx_thresh': 32.78466848394251, 'atr_min_pct': 0.003873262676473703, 'atr_max_pct': 0.06684622179358056, 'tp_mult': 1.011042522268579, 'tsl_mult': 0.009214654261942914, 'strategy': 'breakout', 'time_stop': 270, 'use_sma': True, 'use_atr': True, 'use_adx': False, 'use_ema': False, 'use_spike': False, 'rsi_required': True, 'edge_k': 0.49322006943422547, 'edge_cap': 0.9658745516336759, 'bull_strategy': 'breakout', 'bull_bb_std_mult': 0.5921975820643837, 'bull_rsi_os': 29, 'bull_rsi_ob': 57, 'bull_adx_thresh': 16.44565121692503, 'bull_atr_min_pct': 0.01834714287522533, 'bull_atr_max_pct': 0.14105412840672252, 'bull_tp_mult': 1.5529177036003032, 'bull_tsl_mult': 0.3049627160122486, 'bull_time_stop': 126, 'bull_use_sma': False, 'bull_use_ema': False, 'bull_use_atr': True, 'bull_use_adx': True, 'bull_use_spike': False, 'bull_rsi_required': True, 'bear_strategy': 'breakout', 'bear_bb_std_mult': 1.2808222623911232, 'bear_rsi_os': 19, 'bear_rsi_ob': 55, 'bear_adx_thresh': 30.343364279658417, 'bear_atr_min_pct': 0.008813763886251238, 'bear_atr_max_pct': 0.11297518503799409, 'bear_tp_mult': 1.4653026095806143, 'bear_tsl_mult': 0.36364091907926205, 'bear_time_stop': 89, 'bear_use_sma': True, 'bear_use_ema': False, 'bear_use_atr': True, 'bear_use_adx': False, 'bear_use_spike': True, 'bear_rsi_required': False, 'sideways_strategy': 'mean_reversion', 'sideways_bb_std_mult': 0.8476546234422406, 'sideways_rsi_os': 36, 'sideways_rsi_ob': 70, 'sideways_adx_thresh': 9.934912094485728, 'sideways_atr_min_pct': 0.025885267860091446, 'sideways_atr_max_pct': 0.01603122977859377, 'sideways_tp_mult': 2.2674406525620707, 'sideways_tsl_mult': 0.7379562205122755, 'sideways_time_stop': 11, 'sideways_use_sma': False, 'sideways_use_ema': False, 'sideways_use_atr': False, 'sideways_use_adx': True, 'sideways_use_spike': True, 'sideways_rsi_required': False}.
[I 2025-08-31 11:15:54,187] Trial 152 finished with values: [-1000000000.0, 1000000000.0] and parameters: {'p_sma': 44, 'p_std': 11, 'p_atr': 13, 'p_adx': 18, 'rsi_period': 57, 'ema1': 12, 'ema2': 12, 'slip_atr_k': 0.04139984492874385, 'slip_spread_k': 0.6148734795502057, 'spread_hl_frac': 0.0418144756055147, 'bb_std_mult': 2.3253619117324926, 'rsi_os': 39, 'rsi_ob': 80, 'vol_spike': 0.2506862550726873, 'adx_thresh': 32.27887636189975, 'atr_min_pct': 0.0023675420845749116, 'atr_max_pct': 0.07605606329433819, 'tp_mult': 1.010261945164273, 'tsl_mult': 0.0031636083469423204, 'strategy': 'breakout', 'time_stop': 300, 'use_sma': False, 'use_atr': True, 'use_adx': False, 'use_ema': False, 'use_spike': True, 'rsi_required': True, 'edge_k': 0.3990687375661582, 'edge_cap': 0.955814341372385, 'bull_strategy': 'breakout', 'bull_bb_std_mult': 0.5878597406457793, 'bull_rsi_os': 29, 'bull_rsi_ob': 59, 'bull_adx_thresh': 10.700918217390328, 'bull_atr_min_pct': 0.020330802226339914, 'bull_atr_max_pct': 0.1428264215634537, 'bull_tp_mult': 1.5505670782852403, 'bull_tsl_mult': 0.29002340336034926, 'bull_time_stop': 123, 'bull_use_sma': False, 'bull_use_ema': True, 'bull_use_atr': True, 'bull_use_adx': True, 'bull_use_spike': False, 'bull_rsi_required': True, 'bear_strategy': 'breakout', 'bear_bb_std_mult': 1.3165046401435103, 'bear_rsi_os': 17, 'bear_rsi_ob': 55, 'bear_adx_thresh': 30.075880753531173, 'bear_atr_min_pct': 0.009199786352443493, 'bear_atr_max_pct': 0.13791723953751067, 'bear_tp_mult': 2.638753389414127, 'bear_tsl_mult': 0.35901028548415753, 'bear_time_stop': 90, 'bear_use_sma': True, 'bear_use_ema': True, 'bear_use_atr': True, 'bear_use_adx': False, 'bear_use_spike': True, 'bear_rsi_required': False, 'sideways_strategy': 'mean_reversion', 'sideways_bb_std_mult': 0.8631686349270132, 'sideways_rsi_os': 7, 'sideways_rsi_ob': 70, 'sideways_adx_thresh': 9.557277287446503, 'sideways_atr_min_pct': 0.02392170118081112, 'sideways_atr_max_pct': 0.016153963961417595, 'sideways_tp_mult': 2.2737629249680724, 'sideways_tsl_mult': 0.7139699474628778, 'sideways_time_stop': 209, 'sideways_use_sma': False, 'sideways_use_ema': False, 'sideways_use_atr': False, 'sideways_use_adx': True, 'sideways_use_spike': True, 'sideways_rsi_required': False}.
