[I 2025-08-31 11:25:27,647] Trial 226 finished with values: [-1000000000.0, 1000000000.0] and parameters: {'p_sma': 30, 'p_std': 24, 'p_atr': 14, 'p_adx': 25, 'rsi_period': 48, 'ema1': 11, 'ema2': 36, 'slip_atr_k': 0.06323601086347795, 'slip_spread_k': 0.09033070897625657, 'spread_hl_frac': 0.0011781662453861398, 'bb_std_mult': 1.0826865836754425, 'rsi_os': 34, 'rsi_ob': 71, 'vol_spike': 0.15216373574992342, 'adx_thresh': 25.895990764479812, 'atr_min_pct': 0.011066327013713647, 'atr_max_pct': 0.020882388741558344, 'tp_mult': 1.1892274334812805, 'tsl_mult': 0.2649453508531884, 'strategy': 'breakout', 'time_stop': 299, 'use_sma': False, 'use_atr': True, 'use_adx': True, 'use_ema': False, 'use_spike': True, 'rsi_required': True, 'edge_k': 0.41728216082453773, 'edge_cap': 0.8213876446690612, 'bull_strategy': 'mean_reversion', 'bull_bb_std_mult': 2.6006059231064067, 'bull_rsi_os': 23, 'bull_rsi_ob': 64, 'bull_adx_thresh': 14.394199882460743, 'bull_atr_min_pct': 0.011046651438672388, 'bull_atr_max_pct': 0.14313335298517066, 'bull_tp_mult': 1.4020392514686535, 'bull_tsl_mult': 0.22314322913521367, 'bull_time_stop': 134, 'bull_use_sma': True, 'bull_use_ema': True, 'bull_use_atr': True, 'bull_use_adx': True, 'bull_use_spike': False, 'bull_rsi_required': True, 'bear_strategy': 'mean_reversion', 'bear_bb_std_mult': 1.933647034624403, 'bear_rsi_os': 32, 'bear_rsi_ob': 53, 'bear_adx_thresh': 30.78220503292394, 'bear_atr_min_pct': 0.018682716943704856, 'bear_atr_max_pct': 0.12129754208178838, 'bear_tp_mult': 2.7023713431305394, 'bear_tsl_mult': 0.04486893001112696, 'bear_time_stop': 187, 'bear_use_sma': False, 'bear_use_ema': True, 'bear_use_atr': True, 'bear_use_adx': False, 'bear_use_spike': True, 'bear_rsi_required': False, 'sideways_strategy': 'breakout', 'sideways_bb_std_mult': 1.7751729083486818, 'sideways_rsi_os': 22, 'sideways_rsi_ob': 74, 'sideways_adx_thresh': 9.134188111003207, 'sideways_atr_min_pct': 0.00440916405097551, 'sideways_atr_max_pct': 0.04363211800803508, 'sideways_tp_mult': 1.3649563589481786, 'sideways_tsl_mult': 0.32858440014924795, 'sideways_time_stop': 5, 'sideways_use_sma': True, 'sideways_use_ema': False, 'sideways_use_atr': True, 'sideways_use_adx': True, 'sideways_use_spike': False, 'sideways_rsi_required': True}.
[I 2025-08-31 11:25:28,581] Trial 225 finished with values: [-0.04875074621842845, 0.04853872341418082] and parameters: {'p_sma': 29, 'p_std': 24, 'p_atr': 14, 'p_adx': 26, 'rsi_period': 48, 'ema1': 11, 'ema2': 36, 'slip_atr_k': 0.05293405381104786, 'slip_spread_k': 0.0815454783173122, 'spread_hl_frac': 0.0012847406045711485, 'bb_std_mult': 0.7345201939827832, 'rsi_os': 34, 'rsi_ob': 72, 'vol_spike': 0.15159762624470233, 'adx_thresh': 25.76830006973936, 'atr_min_pct': 0.009818459811062368, 'atr_max_pct': 0.023672948909081934, 'tp_mult': 1.1723827039368537, 'tsl_mult': 0.2343267940008208, 'strategy': 'breakout', 'time_stop': 229, 'use_sma': False, 'use_atr': True, 'use_adx': True, 'use_ema': False, 'use_spike': True, 'rsi_required': True, 'edge_k': 0.4735737730343098, 'edge_cap': 0.815198016129489, 'bull_strategy': 'breakout', 'bull_bb_std_mult': 2.531491732738359, 'bull_rsi_os': 37, 'bull_rsi_ob': 64, 'bull_adx_thresh': 15.794545557702625, 'bull_atr_min_pct': 0.001194396014503914, 'bull_atr_max_pct': 0.14275494653468668, 'bull_tp_mult': 1.3949765752827654, 'bull_tsl_mult': 0.21795861312831083, 'bull_time_stop': 133, 'bull_use_sma': True, 'bull_use_ema': True, 'bull_use_atr': True, 'bull_use_adx': True, 'bull_use_spike': False, 'bull_rsi_required': True, 'bear_strategy': 'breakout', 'bear_bb_std_mult': 2.761485030830939, 'bear_rsi_os': 32, 'bear_rsi_ob': 52, 'bear_adx_thresh': 30.834867154986775, 'bear_atr_min_pct': 0.017099183007054385, 'bear_atr_max_pct': 0.11622008685131408, 'bear_tp_mult': 2.71587738613568, 'bear_tsl_mult': 0.3592259487218253, 'bear_time_stop': 186, 'bear_use_sma': False, 'bear_use_ema': True, 'bear_use_atr': True, 'bear_use_adx': False, 'bear_use_spike': True, 'bear_rsi_required': False, 'sideways_strategy': 'breakout', 'sideways_bb_std_mult': 1.7804618998043757, 'sideways_rsi_os': 32, 'sideways_rsi_ob': 75, 'sideways_adx_thresh': 10.349294722457335, 'sideways_atr_min_pct': 0.0041297986469903195, 'sideways_atr_max_pct': 0.05100966973109963, 'sideways_tp_mult': 1.3598432040730841, 'sideways_tsl_mult': 0.3944567380137941, 'sideways_time_stop': 5, 'sideways_use_sma': True, 'sideways_use_ema': False, 'sideways_use_atr': True, 'sideways_use_adx': True, 'sideways_use_spike': False, 'sideways_rsi_required': True}.
[I 2025-08-31 11:25:28,731] Trial 228 finished with values: [-1000000000.0, 1000000000.0] and parameters: {'p_sma': 30, 'p_std': 24, 'p_atr': 14, 'p_adx': 26, 'rsi_period': 48, 'ema1': 11, 'ema2': 36, 'slip_atr_k': 0.052926529712209416, 'slip_spread_k': 0.0891394337585894, 'spread_hl_frac': 0.0011955582232504945, 'bb_std_mult': 0.7361351386687953, 'rsi_os': 34, 'rsi_ob': 71, 'vol_spike': 0.15194111965390958, 'adx_thresh': 25.539807894769293, 'atr_min_pct': 0.012253629129097781, 'atr_max_pct': 0.02364907718187821, 'tp_mult': 1.174603338421862, 'tsl_mult': 0.28838055633301407, 'strategy': 'breakout', 'time_stop': 299, 'use_sma': False, 'use_atr': True, 'use_adx': True, 'use_ema': True, 'use_spike': True, 'rsi_required': True, 'edge_k': 0.5106408886535956, 'edge_cap': 0.8230198379436727, 'bull_strategy': 'mean_reversion', 'bull_bb_std_mult': 2.6181742075952146, 'bull_rsi_os': 19, 'bull_rsi_ob': 64, 'bull_adx_thresh': 15.282076358429954, 'bull_atr_min_pct': 0.010921221298280152, 'bull_atr_max_pct': 0.14000842167864086, 'bull_tp_mult': 1.3829079154109596, 'bull_tsl_mult': 0.22485947692075348, 'bull_time_stop': 236, 'bull_use_sma': True, 'bull_use_ema': True, 'bull_use_atr': True, 'bull_use_adx': False, 'bull_use_spike': False, 'bull_rsi_required': True, 'bear_strategy': 'mean_reversion', 'bear_bb_std_mult': 1.6757965015379657, 'bear_rsi_os': 32, 'bear_rsi_ob': 52, 'bear_adx_thresh': 30.581064570087094, 'bear_atr_min_pct': 0.01856157187538478, 'bear_atr_max_pct': 0.12200658254639576, 'bear_tp_mult': 2.713259455869223, 'bear_tsl_mult': 0.3941782208593899, 'bear_time_stop': 182, 'bear_use_sma': False, 'bear_use_ema': True, 'bear_use_atr': True, 'bear_use_adx': False, 'bear_use_spike': False, 'bear_rsi_required': True, 'sideways_strategy': 'mean_reversion', 'sideways_bb_std_mult': 1.788748178384737, 'sideways_rsi_os': 33, 'sideways_rsi_ob': 74, 'sideways_adx_thresh': 10.414479462099575, 'sideways_atr_min_pct': 0.003420739398965121, 'sideways_atr_max_pct': 0.05022045476483297, 'sideways_tp_mult': 1.380872157071755, 'sideways_tsl_mult': 0.4026083957106106, 'sideways_time_stop': 5, 'sideways_use_sma': True, 'sideways_use_ema': False, 'sideways_use_atr': True, 'sideways_use_adx': True, 'sideways_use_spike': True, 'sideways_rsi_required': True}.
[I 2025-08-31 11:25:28,951] Trial 227 finished with values: [-1000000000.0, 1000000000.0] and parameters: {'p_sma': 30, 'p_std': 30, 'p_atr': 14, 'p_adx': 26, 'rsi_period': 47, 'ema1': 11, 'ema2': 36, 'slip_atr_k': 0.05244732873482799, 'slip_spread_k': 0.10390712880554942, 'spread_hl_frac': 0.0009883475356826125, 'bb_std_mult': 0.7286462130962181, 'rsi_os': 34, 'rsi_ob': 71, 'vol_spike': 0.1462135868512355, 'adx_thresh': 25.54489866995506, 'atr_min_pct': 0.012275184830563637, 'atr_max_pct': 0.0209991723724103, 'tp_mult': 1.1757200746654028, 'tsl_mult': 0.24623343440447476, 'strategy': 'breakout', 'time_stop': 227, 'use_sma': False, 'use_atr': True, 'use_adx': True, 'use_ema': True, 'use_spike': True, 'rsi_required': True, 'edge_k': 0.4565016297167205, 'edge_cap': 0.8227867810570506, 'bull_strategy': 'mean_reversion', 'bull_bb_std_mult': 2.4674390537947373, 'bull_rsi_os': 20, 'bull_rsi_ob': 64, 'bull_adx_thresh': 14.41438654324231, 'bull_atr_min_pct': 0.010764560396382579, 'bull_atr_max_pct': 0.14382044096639524, 'bull_tp_mult': 1.4006676510586002, 'bull_tsl_mult': 0.2156092746847238, 'bull_time_stop': 135, 'bull_use_sma': True, 'bull_use_ema': True, 'bull_use_atr': True, 'bull_use_adx': True, 'bull_use_spike': False, 'bull_rsi_required': True, 'bear_strategy': 'mean_reversion', 'bear_bb_std_mult': 1.9174557578943618, 'bear_rsi_os': 32, 'bear_rsi_ob': 52, 'bear_adx_thresh': 30.46538561093568, 'bear_atr_min_pct': 0.016403247374482403, 'bear_atr_max_pct': 0.121820834691556, 'bear_tp_mult': 2.6888532195558588, 'bear_tsl_mult': 0.3844348740344528, 'bear_time_stop': 217, 'bear_use_sma': False, 'bear_use_ema': True, 'bear_use_atr': True, 'bear_use_adx': False, 'bear_use_spike': False, 'bear_rsi_required': True, 'sideways_strategy': 'mean_reversion', 'sideways_bb_std_mult': 1.7766248466645878, 'sideways_rsi_os': 43, 'sideways_rsi_ob': 74, 'sideways_adx_thresh': 10.596086466768, 'sideways_atr_min_pct': 0.00432242500659316, 'sideways_atr_max_pct': 0.050563423798741715, 'sideways_tp_mult': 1.3608717537645707, 'sideways_tsl_mult': 0.39168089410094487, 'sideways_time_stop': 7, 'sideways_use_sma': True, 'sideways_use_ema': False, 'sideways_use_atr': True, 'sideways_use_adx': True, 'sideways_use_spike': True, 'sideways_rsi_required': True}.
[I 2025-08-31 11:25:29,510] Trial 231 finished with values: [-1000000000.0, 1000000000.0] and parameters: {'p_sma': 30, 'p_std': 16, 'p_atr': 15, 'p_adx': 25, 'rsi_period': 45, 'ema1': 18, 'ema2': 33, 'slip_atr_k': 0.055291177667385935, 'slip_spread_k': 0.03246088226213244, 'spread_hl_frac': 0.0030209907192231826, 'bb_std_mult': 0.8322722499311659, 'rsi_os': 32, 'rsi_ob': 73, 'vol_spike': 0.14538992148068505, 'adx_thresh': 28.09824411619018, 'atr_min_pct': 0.017953649689451637, 'atr_max_pct': 0.01531804671904638, 'tp_mult': 1.1321301457087753, 'tsl_mult': 0.46112296622653215, 'strategy': 'mean_reversion', 'time_stop': 36, 'use_sma': False, 'use_atr': True, 'use_adx': True, 'use_ema': True, 'use_spike': True, 'rsi_required': False, 'edge_k': 0.43475059318780607, 'edge_cap': 0.8349564497437242, 'bull_strategy': 'breakout', 'bull_bb_std_mult': 2.4470252729413096, 'bull_rsi_os': 20, 'bull_rsi_ob': 63, 'bull_adx_thresh': 14.09487702137186, 'bull_atr_min_pct': 0.0046568705026609775, 'bull_atr_max_pct': 0.14951390533484105, 'bull_tp_mult': 1.4400038315191368, 'bull_tsl_mult': 0.1745697618968705, 'bull_time_stop': 142, 'bull_use_sma': True, 'bull_use_ema': True, 'bull_use_atr': False, 'bull_use_adx': True, 'bull_use_spike': True, 'bull_rsi_required': False, 'bear_strategy': 'breakout', 'bear_bb_std_mult': 0.6818955455118532, 'bear_rsi_os': 30, 'bear_rsi_ob': 51, 'bear_adx_thresh': 31.42030533956358, 'bear_atr_min_pct': 0.01644143614580595, 'bear_atr_max_pct': 0.12411261079757464, 'bear_tp_mult': 2.790096842628623, 'bear_tsl_mult': 0.25786271101472436, 'bear_time_stop': 209, 'bear_use_sma': False, 'bear_use_ema': True, 'bear_use_atr': False, 'bear_use_adx': False, 'bear_use_spike': False, 'bear_rsi_required': True, 'sideways_strategy': 'mean_reversion', 'sideways_bb_std_mult': 1.9102352379693837, 'sideways_rsi_os': 55, 'sideways_rsi_ob': 75, 'sideways_adx_thresh': 9.832754121438182, 'sideways_atr_min_pct': 0.0033248344978952455, 'sideways_atr_max_pct': 0.03674897467756252, 'sideways_tp_mult': 1.3213529947484346, 'sideways_tsl_mult': 0.23385937876242419, 'sideways_time_stop': 11, 'sideways_use_sma': True, 'sideways_use_ema': False, 'sideways_use_atr': True, 'sideways_use_adx': True, 'sideways_use_spike': True, 'sideways_rsi_required': True}.
[I 2025-08-31 11:25:59,902] Trial 232 finished with values: [-1000000000.0, 1000000000.0] and parameters: {'p_sma': 32, 'p_std': 27, 'p_atr': 15, 'p_adx': 27, 'rsi_period': 44, 'ema1': 18, 'ema2': 31, 'slip_atr_k': 0.05824102491706108, 'slip_spread_k': 0.13099377938931928, 'spread_hl_frac': 0.003400150290322903, 'bb_std_mult': 0.5645596525461691, 'rsi_os': 32, 'rsi_ob': 73, 'vol_spike': 0.140689251482715, 'adx_thresh': 27.29200112352828, 'atr_min_pct': 0.006886772876417395, 'atr_max_pct': 0.014696531995499196, 'tp_mult': 1.1394295997916992, 'tsl_mult': 0.3287166737970047, 'strategy': 'mean_reversion', 'time_stop': 198, 'use_sma': True, 'use_atr': True, 'use_adx': True, 'use_ema': False, 'use_spike': True, 'rsi_required': False, 'edge_k': 0.4421314990507808, 'edge_cap': 0.8297980296457315, 'bull_strategy': 'breakout', 'bull_bb_std_mult': 2.433944045797675, 'bull_rsi_os': 44, 'bull_rsi_ob': 63, 'bull_adx_thresh': 13.492738910363292, 'bull_atr_min_pct': 0.004762045264193583, 'bull_atr_max_pct': 0.1384756874687158, 'bull_tp_mult': 1.4498552506650606, 'bull_tsl_mult': 0.16410511077805806, 'bull_time_stop': 143, 'bull_use_sma': True, 'bull_use_ema': True, 'bull_use_atr': False, 'bull_use_adx': False, 'bull_use_spike': True, 'bull_rsi_required': False, 'bear_strategy': 'breakout', 'bear_bb_std_mult': 3.0324980014671254, 'bear_rsi_os': 30, 'bear_rsi_ob': 53, 'bear_adx_thresh': 30.02971440437124, 'bear_atr_min_pct': 0.01549128911873519, 'bear_atr_max_pct': 0.11890142016563277, 'bear_tp_mult': 2.7514210221888336, 'bear_tsl_mult': 0.603256649559644, 'bear_time_stop': 207, 'bear_use_sma': False, 'bear_use_ema': True, 'bear_use_atr': False, 'bear_use_adx': False, 'bear_use_spike': True, 'bear_rsi_required': False, 'sideways_strategy': 'breakout', 'sideways_bb_std_mult': 1.9439623814629603, 'sideways_rsi_os': 15, 'sideways_rsi_ob': 75, 'sideways_adx_thresh': 9.889739027704493, 'sideways_atr_min_pct': 0.0032792480098777716, 'sideways_atr_max_pct': 0.03678262643538041, 'sideways_tp_mult': 1.235859911808564, 'sideways_tsl_mult': 0.244379494286311, 'sideways_time_stop': 12, 'sideways_use_sma': True, 'sideways_use_ema': False, 'sideways_use_atr': True, 'sideways_use_adx': True, 'sideways_use_spike': False, 'sideways_rsi_required': True}.
[I 2025-08-31 11:26:00,646] Trial 230 finished with values: [-1000000000.0, 1000000000.0] and parameters: {'p_sma': 30, 'p_std': 28, 'p_atr': 14, 'p_adx': 26, 'rsi_period': 46, 'ema1': 11, 'ema2': 33, 'slip_atr_k': 0.05659446820575957, 'slip_spread_k': 0.1284454967522611, 'spread_hl_frac': 0.0031805154496216148, 'bb_std_mult': 0.8585326129833097, 'rsi_os': 32, 'rsi_ob': 70, 'vol_spike': 0.14349482864565735, 'adx_thresh': 27.54626057452231, 'atr_min_pct': 0.00883039841536305, 'atr_max_pct': 0.015062640079541702, 'tp_mult': 1.150370786945352, 'tsl_mult': 0.30198129607411855, 'strategy': 'mean_reversion', 'time_stop': 300, 'use_sma': False, 'use_atr': True, 'use_adx': True, 'use_ema': True, 'use_spike': True, 'rsi_required': False, 'edge_k': 0.4599133433618288, 'edge_cap': 0.8242197864642048, 'bull_strategy': 'mean_reversion', 'bull_bb_std_mult': 2.4698641678259254, 'bull_rsi_os': 20, 'bull_rsi_ob': 63, 'bull_adx_thresh': 14.524677893329345, 'bull_atr_min_pct': 0.002469129793705, 'bull_atr_max_pct': 0.1398209869979183, 'bull_tp_mult': 1.4275431680516544, 'bull_tsl_mult': 0.4566544042545362, 'bull_time_stop': 144, 'bull_use_sma': True, 'bull_use_ema': True, 'bull_use_atr': False, 'bull_use_adx': False, 'bull_use_spike': True, 'bull_rsi_required': False, 'bear_strategy': 'mean_reversion', 'bear_bb_std_mult': 1.6264673053198977, 'bear_rsi_os': 33, 'bear_rsi_ob': 51, 'bear_adx_thresh': 29.797784011175725, 'bear_atr_min_pct': 0.016452177854623468, 'bear_atr_max_pct': 0.12453442827388467, 'bear_tp_mult': 2.7481443551335687, 'bear_tsl_mult': 0.3872359181085118, 'bear_time_stop': 221, 'bear_use_sma': False, 'bear_use_ema': True, 'bear_use_atr': False, 'bear_use_adx': False, 'bear_use_spike': False, 'bear_rsi_required': True, 'sideways_strategy': 'mean_reversion', 'sideways_bb_std_mult': 1.9563054282350074, 'sideways_rsi_os': 16, 'sideways_rsi_ob': 74, 'sideways_adx_thresh': 10.422840723607335, 'sideways_atr_min_pct': 0.0035262505380796996, 'sideways_atr_max_pct': 0.05525317804171078, 'sideways_tp_mult': 1.2431689290908374, 'sideways_tsl_mult': 0.3558308438501352, 'sideways_time_stop': 9, 'sideways_use_sma': True, 'sideways_use_ema': False, 'sideways_use_atr': True, 'sideways_use_adx': True, 'sideways_use_spike': True, 'sideways_rsi_required': True}.
[I 2025-08-31 11:26:00,647] Trial 229 finished with values: [-1000000000.0, 1000000000.0] and parameters: {'p_sma': 30, 'p_std': 28, 'p_atr': 14, 'p_adx': 26, 'rsi_period': 47, 'ema1': 11, 'ema2': 35, 'slip_atr_k': 0.05266323853345865, 'slip_spread_k': 0.1276834548407494, 'spread_hl_frac': 0.0011009675721532432, 'bb_std_mult': 0.7626648835449346, 'rsi_os': 33, 'rsi_ob': 73, 'vol_spike': 0.14725109201922393, 'adx_thresh': 27.573491291886306, 'atr_min_pct': 0.01220699954567226, 'atr_max_pct': 0.015023618997798867, 'tp_mult': 1.1662319281312008, 'tsl_mult': 0.29493006801483374, 'strategy': 'mean_reversion', 'time_stop': 24, 'use_sma': False, 'use_atr': True, 'use_adx': True, 'use_ema': True, 'use_spike': True, 'rsi_required': False, 'edge_k': 0.4684445578396017, 'edge_cap': 0.8326420797933904, 'bull_strategy': 'mean_reversion', 'bull_bb_std_mult': 2.4957342660997526, 'bull_rsi_os': 19, 'bull_rsi_ob': 64, 'bull_adx_thresh': 14.127449220471549, 'bull_atr_min_pct': 0.004689265148161139, 'bull_atr_max_pct': 0.1395027099266069, 'bull_tp_mult': 1.3972847166915507, 'bull_tsl_mult': 0.19985178930601627, 'bull_time_stop': 237, 'bull_use_sma': True, 'bull_use_ema': True, 'bull_use_atr': False, 'bull_use_adx': False, 'bull_use_spike': True, 'bull_rsi_required': False, 'bear_strategy': 'breakout', 'bear_bb_std_mult': 3.0311157610661983, 'bear_rsi_os': 32, 'bear_rsi_ob': 53, 'bear_adx_thresh': 29.832814632675685, 'bear_atr_min_pct': 0.018099192766764177, 'bear_atr_max_pct': 0.12369412660582121, 'bear_tp_mult': 2.7347372744516343, 'bear_tsl_mult': 0.3077419123302312, 'bear_time_stop': 206, 'bear_use_sma': False, 'bear_use_ema': True, 'bear_use_atr': False, 'bear_use_adx': False, 'bear_use_spike': False, 'bear_rsi_required': True, 'sideways_strategy': 'mean_reversion', 'sideways_bb_std_mult': 1.9228302343464332, 'sideways_rsi_os': 43, 'sideways_rsi_ob': 74, 'sideways_adx_thresh': 10.23827116364896, 'sideways_atr_min_pct': 0.0033847790033392105, 'sideways_atr_max_pct': 0.03653252061437921, 'sideways_tp_mult': 1.332121022496868, 'sideways_tsl_mult': 0.3585107885491112, 'sideways_time_stop': 10, 'sideways_use_sma': True, 'sideways_use_ema': False, 'sideways_use_atr': True, 'sideways_use_adx': True, 'sideways_use_spike': True, 'sideways_rsi_required': True}.
[I 2025-08-31 11:26:01,586] Trial 233 finished with values: [-1000000000.0, 1000000000.0] and parameters: {'p_sma': 32, 'p_std': 17, 'p_atr': 13, 'p_adx': 27, 'rsi_period': 50, 'ema1': 7, 'ema2': 33, 'slip_atr_k': 0.047091787355321185, 'slip_spread_k': 0.2742599338208782, 'spread_hl_frac': 6.532259444133159e-05, 'bb_std_mult': 0.5982553734999283, 'rsi_os': 31, 'rsi_ob': 69, 'vol_spike': 0.13677505682174063, 'adx_thresh': 27.175081147061103, 'atr_min_pct': 0.008842847800694997, 'atr_max_pct': 0.02703601123378254, 'tp_mult': 2.507051524927981, 'tsl_mult': 0.3083365046566342, 'strategy': 'mean_reversion', 'time_stop': 121, 'use_sma': True, 'use_atr': True, 'use_adx': True, 'use_ema': False, 'use_spike': True, 'rsi_required': False, 'edge_k': 0.39160514418812065, 'edge_cap': 0.846137461916048, 'bull_strategy': 'breakout', 'bull_bb_std_mult': 2.395722613583195, 'bull_rsi_os': 25, 'bull_rsi_ob': 63, 'bull_adx_thresh': 18.269485821706382, 'bull_atr_min_pct': 0.00514436353527709, 'bull_atr_max_pct': 0.13999294497959652, 'bull_tp_mult': 1.3258715344126313, 'bull_tsl_mult': 0.19548724178876403, 'bull_time_stop': 25, 'bull_use_sma': True, 'bull_use_ema': True, 'bull_use_atr': False, 'bull_use_adx': False, 'bull_use_spike': True, 'bull_rsi_required': False, 'bear_strategy': 'breakout', 'bear_bb_std_mult': 1.1242626239585303, 'bear_rsi_os': 33, 'bear_rsi_ob': 53, 'bear_adx_thresh': 29.561060073845937, 'bear_atr_min_pct': 0.02053966540196745, 'bear_atr_max_pct': 0.11872311486445122, 'bear_tp_mult': 2.667774663170199, 'bear_tsl_mult': 0.05959830257012477, 'bear_time_stop': 159, 'bear_use_sma': False, 'bear_use_ema': True, 'bear_use_atr': False, 'bear_use_adx': False, 'bear_use_spike': True, 'bear_rsi_required': False, 'sideways_strategy': 'breakout', 'sideways_bb_std_mult': 1.966772953619716, 'sideways_rsi_os': 15, 'sideways_rsi_ob': 73, 'sideways_adx_thresh': 9.33774360675937, 'sideways_atr_min_pct': 0.0031189848297606022, 'sideways_atr_max_pct': 0.045439588297436447, 'sideways_tp_mult': 1.2450738666673924, 'sideways_tsl_mult': 0.3664785577264619, 'sideways_time_stop': 12, 'sideways_use_sma': True, 'sideways_use_ema': False, 'sideways_use_atr': True, 'sideways_use_adx': True, 'sideways_use_spike': False, 'sideways_rsi_required': True}.
