[I 2025-08-31 11:41:29,288] Trial 360 finished with values: [-0.027488296881812535, 0.02806113019500174] and parameters: {'p_sma': 29, 'p_std': 44, 'p_atr': 12, 'p_adx': 27, 'rsi_period': 62, 'ema1': 29, 'ema2': 41, 'slip_atr_k': 0.043402412778704824, 'slip_spread_k': 0.09228306078450707, 'spread_hl_frac': 0.0012884223514727801, 'bb_std_mult': 0.936332891323461, 'rsi_os': 5, 'rsi_ob': 62, 'vol_spike': 0.1616290804379461, 'adx_thresh': 25.830099209001894, 'atr_min_pct': 0.0046789497652157085, 'atr_max_pct': 0.1063691360738237, 'tp_mult': 1.1004423815686437, 'tsl_mult': 0.3701014996543834, 'strategy': 'breakout', 'time_stop': 280, 'use_sma': False, 'use_atr': True, 'use_adx': True, 'use_ema': True, 'use_spike': True, 'rsi_required': True, 'edge_k': 1.8182619785370533, 'edge_cap': 0.19372858875225019, 'bull_strategy': 'breakout', 'bull_bb_std_mult': 3.2143965839262356, 'bull_rsi_os': 26, 'bull_rsi_ob': 86, 'bull_adx_thresh': 21.37404543460595, 'bull_atr_min_pct': 0.0020402314840355183, 'bull_atr_max_pct': 0.13241739888199053, 'bull_tp_mult': 2.4469635004839514, 'bull_tsl_mult': 0.2836795834710156, 'bull_time_stop': 257, 'bull_use_sma': True, 'bull_use_ema': True, 'bull_use_atr': False, 'bull_use_adx': True, 'bull_use_spike': True, 'bull_rsi_required': True, 'bear_strategy': 'breakout', 'bear_bb_std_mult': 1.0492694014882047, 'bear_rsi_os': 33, 'bear_rsi_ob': 46, 'bear_adx_thresh': 32.37097997783681, 'bear_atr_min_pct': 0.0009196160596807931, 'bear_atr_max_pct': 0.06494192063286328, 'bear_tp_mult': 2.230873851535884, 'bear_tsl_mult': 0.8183247351664602, 'bear_time_stop': 201, 'bear_use_sma': False, 'bear_use_ema': True, 'bear_use_atr': False, 'bear_use_adx': False, 'bear_use_spike': False, 'bear_rsi_required': False, 'sideways_strategy': 'breakout', 'sideways_bb_std_mult': 1.7384776724212552, 'sideways_rsi_os': 31, 'sideways_rsi_ob': 82, 'sideways_adx_thresh': 7.98470158593223, 'sideways_atr_min_pct': 0.01720083436209487, 'sideways_atr_max_pct': 0.05042965394366827, 'sideways_tp_mult': 1.2290286378087782, 'sideways_tsl_mult': 0.3297460812002022, 'sideways_time_stop': 266, 'sideways_use_sma': True, 'sideways_use_ema': False, 'sideways_use_atr': True, 'sideways_use_adx': True, 'sideways_use_spike': False, 'sideways_rsi_required': False}.
[I 2025-08-31 11:41:30,182] Trial 364 finished with values: [-1000000000.0, 1000000000.0] and parameters: {'p_sma': 30, 'p_std': 16, 'p_atr': 23, 'p_adx': 29, 'rsi_period': 50, 'ema1': 13, 'ema2': 39, 'slip_atr_k': 0.24368996365614592, 'slip_spread_k': 0.07400734274155897, 'spread_hl_frac': 3.7194248261316395e-06, 'bb_std_mult': 0.7336285939468413, 'rsi_os': 33, 'rsi_ob': 56, 'vol_spike': 0.07773439431479184, 'adx_thresh': 9.638396575262915, 'atr_min_pct': 0.026408454008746057, 'atr_max_pct': 0.023071370981519203, 'tp_mult': 1.0583001801127474, 'tsl_mult': 0.31582286513784263, 'strategy': 'mean_reversion', 'time_stop': 54, 'use_sma': False, 'use_atr': True, 'use_adx': True, 'use_ema': False, 'use_spike': True, 'rsi_required': True, 'edge_k': 0.40060870777549873, 'edge_cap': 0.2853191793645291, 'bull_strategy': 'breakout', 'bull_bb_std_mult': 1.4936858537849589, 'bull_rsi_os': 49, 'bull_rsi_ob': 48, 'bull_adx_thresh': 29.427071473366958, 'bull_atr_min_pct': 0.001022032499836116, 'bull_atr_max_pct': 0.14913902854601474, 'bull_tp_mult': 1.4264553124068025, 'bull_tsl_mult': 0.29378270150884644, 'bull_time_stop': 146, 'bull_use_sma': False, 'bull_use_ema': True, 'bull_use_atr': False, 'bull_use_adx': False, 'bull_use_spike': False, 'bull_rsi_required': False, 'bear_strategy': 'breakout', 'bear_bb_std_mult': 1.3577942755069974, 'bear_rsi_os': 5, 'bear_rsi_ob': 61, 'bear_adx_thresh': 30.08848022254606, 'bear_atr_min_pct': 0.002706949331340275, 'bear_atr_max_pct': 0.12191857543577701, 'bear_tp_mult': 2.6633609421800952, 'bear_tsl_mult': 0.3933391197626014, 'bear_time_stop': 23, 'bear_use_sma': False, 'bear_use_ema': True, 'bear_use_atr': True, 'bear_use_adx': True, 'bear_use_spike': True, 'bear_rsi_required': True, 'sideways_strategy': 'mean_reversion', 'sideways_bb_std_mult': 1.3803412756558866, 'sideways_rsi_os': 34, 'sideways_rsi_ob': 75, 'sideways_adx_thresh': 28.98185028165534, 'sideways_atr_min_pct': 0.0021667623141571977, 'sideways_atr_max_pct': 0.1422528867652023, 'sideways_tp_mult': 1.9266906215751025, 'sideways_tsl_mult': 0.35260296713054046, 'sideways_time_stop': 15, 'sideways_use_sma': True, 'sideways_use_ema': False, 'sideways_use_atr': True, 'sideways_use_adx': False, 'sideways_use_spike': True, 'sideways_rsi_required': True}.
[I 2025-08-31 11:41:30,196] Trial 362 finished with values: [-1000000000.0, 1000000000.0] and parameters: {'p_sma': 32, 'p_std': 14, 'p_atr': 16, 'p_adx': 26, 'rsi_period': 50, 'ema1': 10, 'ema2': 42, 'slip_atr_k': 0.0405822061674008, 'slip_spread_k': 0.09094990466330571, 'spread_hl_frac': 0.002303439839236695, 'bb_std_mult': 0.7457181897293194, 'rsi_os': 32, 'rsi_ob': 70, 'vol_spike': 0.12549799825139926, 'adx_thresh': 21.871868734960824, 'atr_min_pct': 0.02650736644999819, 'atr_max_pct': 0.022532583278575984, 'tp_mult': 1.088927931502938, 'tsl_mult': 0.31388588341500356, 'strategy': 'mean_reversion', 'time_stop': 282, 'use_sma': False, 'use_atr': True, 'use_adx': True, 'use_ema': False, 'use_spike': True, 'rsi_required': True, 'edge_k': 0.40460832477949016, 'edge_cap': 0.7866336136693332, 'bull_strategy': 'breakout', 'bull_bb_std_mult': 2.3226402590401807, 'bull_rsi_os': 24, 'bull_rsi_ob': 61, 'bull_adx_thresh': 21.48079312748186, 'bull_atr_min_pct': 0.0019169394536672803, 'bull_atr_max_pct': 0.06401189385367234, 'bull_tp_mult': 2.4754525677048225, 'bull_tsl_mult': 0.2812531060277734, 'bull_time_stop': 145, 'bull_use_sma': False, 'bull_use_ema': True, 'bull_use_atr': False, 'bull_use_adx': False, 'bull_use_spike': False, 'bull_rsi_required': True, 'bear_strategy': 'breakout', 'bear_bb_std_mult': 1.059852485145934, 'bear_rsi_os': 32, 'bear_rsi_ob': 48, 'bear_adx_thresh': 30.18218127516258, 'bear_atr_min_pct': 0.0298611011824332, 'bear_atr_max_pct': 0.015401368875464838, 'bear_tp_mult': 2.674781728048048, 'bear_tsl_mult': 0.39167698290668895, 'bear_time_stop': 39, 'bear_use_sma': False, 'bear_use_ema': True, 'bear_use_atr': True, 'bear_use_adx': True, 'bear_use_spike': True, 'bear_rsi_required': True, 'sideways_strategy': 'mean_reversion', 'sideways_bb_std_mult': 2.8139914875328724, 'sideways_rsi_os': 17, 'sideways_rsi_ob': 75, 'sideways_adx_thresh': 14.495327443301209, 'sideways_atr_min_pct': 0.002436858202151778, 'sideways_atr_max_pct': 0.02864455863888614, 'sideways_tp_mult': 1.9318712783918914, 'sideways_tsl_mult': 0.3470203817821427, 'sideways_time_stop': 14, 'sideways_use_sma': True, 'sideways_use_ema': False, 'sideways_use_atr': True, 'sideways_use_adx': False, 'sideways_use_spike': False, 'sideways_rsi_required': True}.
[I 2025-08-31 11:42:03,046] Trial 363 finished with values: [-0.03647323698943361, 0.036282149796070425] and parameters: {'p_sma': 32, 'p_std': 16, 'p_atr': 20, 'p_adx': 29, 'rsi_period': 50, 'ema1': 10, 'ema2': 42, 'slip_atr_k': 0.039669239554201124, 'slip_spread_k': 0.0846752962545544, 'spread_hl_frac': 0.0028350901995653766, 'bb_std_mult': 0.7257759046175437, 'rsi_os': 32, 'rsi_ob': 70, 'vol_spike': 0.18542940281843434, 'adx_thresh': 25.927280418231796, 'atr_min_pct': 0.012699613801519115, 'atr_max_pct': 0.09569748490381333, 'tp_mult': 1.0945184156560441, 'tsl_mult': 0.3054890933602829, 'strategy': 'mean_reversion', 'time_stop': 156, 'use_sma': False, 'use_atr': True, 'use_adx': True, 'use_ema': False, 'use_spike': True, 'rsi_required': True, 'edge_k': 0.8415090844674709, 'edge_cap': 0.28614504347082464, 'bull_strategy': 'breakout', 'bull_bb_std_mult': 2.7322163959866286, 'bull_rsi_os': 24, 'bull_rsi_ob': 86, 'bull_adx_thresh': 21.225339376142575, 'bull_atr_min_pct': 0.02425791975238085, 'bull_atr_max_pct': 0.06235046822368716, 'bull_tp_mult': 2.4615781055366885, 'bull_tsl_mult': 0.2818679178544113, 'bull_time_stop': 146, 'bull_use_sma': False, 'bull_use_ema': True, 'bull_use_atr': False, 'bull_use_adx': False, 'bull_use_spike': False, 'bull_rsi_required': True, 'bear_strategy': 'breakout', 'bear_bb_std_mult': 1.0637435997597995, 'bear_rsi_os': 6, 'bear_rsi_ob': 61, 'bear_adx_thresh': 24.733225134803142, 'bear_atr_min_pct': 0.029597832962404376, 'bear_atr_max_pct': 0.015945482240185688, 'bear_tp_mult': 2.6669103439254314, 'bear_tsl_mult': 0.38838828798849145, 'bear_time_stop': 176, 'bear_use_sma': False, 'bear_use_ema': True, 'bear_use_atr': True, 'bear_use_adx': True, 'bear_use_spike': True, 'bear_rsi_required': True, 'sideways_strategy': 'mean_reversion', 'sideways_bb_std_mult': 3.2412121828400764, 'sideways_rsi_os': 31, 'sideways_rsi_ob': 60, 'sideways_adx_thresh': 9.462036338420077, 'sideways_atr_min_pct': 0.002433610871356951, 'sideways_atr_max_pct': 0.14070696769529048, 'sideways_tp_mult': 1.295415017265334, 'sideways_tsl_mult': 0.35169602533193917, 'sideways_time_stop': 14, 'sideways_use_sma': True, 'sideways_use_ema': False, 'sideways_use_atr': True, 'sideways_use_adx': False, 'sideways_use_spike': False, 'sideways_rsi_required': True}.
[I 2025-08-31 11:42:03,180] Trial 361 finished with values: [-0.056006618875730774, 0.056068501797236554] and parameters: {'p_sma': 30, 'p_std': 16, 'p_atr': 12, 'p_adx': 27, 'rsi_period': 61, 'ema1': 13, 'ema2': 42, 'slip_atr_k': 0.04703123424372897, 'slip_spread_k': 0.09062468795473776, 'spread_hl_frac': 0.0018437352772206553, 'bb_std_mult': 0.6348823051939688, 'rsi_os': 35, 'rsi_ob': 62, 'vol_spike': 0.16766571156692503, 'adx_thresh': 26.70888756630901, 'atr_min_pct': 0.004479910033489301, 'atr_max_pct': 0.03346317129316076, 'tp_mult': 1.0945924707317412, 'tsl_mult': 0.30219524241908485, 'strategy': 'breakout', 'time_stop': 295, 'use_sma': False, 'use_atr': True, 'use_adx': True, 'use_ema': True, 'use_spike': True, 'rsi_required': True, 'edge_k': 1.1337654740535699, 'edge_cap': 0.8411323832884832, 'bull_strategy': 'breakout', 'bull_bb_std_mult': 2.3149894618112907, 'bull_rsi_os': 24, 'bull_rsi_ob': 61, 'bull_adx_thresh': 33.1221946336832, 'bull_atr_min_pct': 0.00788259674189928, 'bull_atr_max_pct': 0.14833905114622198, 'bull_tp_mult': 1.4347586216943808, 'bull_tsl_mult': 0.27987206097203565, 'bull_time_stop': 255, 'bull_use_sma': True, 'bull_use_ema': True, 'bull_use_atr': False, 'bull_use_adx': False, 'bull_use_spike': True, 'bull_rsi_required': True, 'bear_strategy': 'breakout', 'bear_bb_std_mult': 1.066064329790715, 'bear_rsi_os': 26, 'bear_rsi_ob': 54, 'bear_adx_thresh': 32.454272512823394, 'bear_atr_min_pct': 0.016517964140749537, 'bear_atr_max_pct': 0.06557425669377057, 'bear_tp_mult': 2.6590057299791074, 'bear_tsl_mult': 0.39230855909100126, 'bear_time_stop': 177, 'bear_use_sma': False, 'bear_use_ema': True, 'bear_use_atr': False, 'bear_use_adx': False, 'bear_use_spike': False, 'bear_rsi_required': False, 'sideways_strategy': 'mean_reversion', 'sideways_bb_std_mult': 2.94750671104969, 'sideways_rsi_os': 27, 'sideways_rsi_ob': 54, 'sideways_adx_thresh': 28.892376278791822, 'sideways_atr_min_pct': 0.002200231287924509, 'sideways_atr_max_pct': 0.10077862002194929, 'sideways_tp_mult': 2.829637632141495, 'sideways_tsl_mult': 0.33283783056467514, 'sideways_time_stop': 14, 'sideways_use_sma': True, 'sideways_use_ema': False, 'sideways_use_atr': True, 'sideways_use_adx': True, 'sideways_use_spike': False, 'sideways_rsi_required': False}.
[I 2025-08-31 11:42:07,352] Trial 365 finished with values: [-1000000000.0, 1000000000.0] and parameters: {'p_sma': 32, 'p_std': 14, 'p_atr': 15, 'p_adx': 9, 'rsi_period': 51, 'ema1': 20, 'ema2': 37, 'slip_atr_k': 0.1406254641853797, 'slip_spread_k': 0.9753948538657033, 'spread_hl_frac': 0.0028445282059507094, 'bb_std_mult': 0.6323177236720832, 'rsi_os': 34, 'rsi_ob': 48, 'vol_spike': 0.18430784004072573, 'adx_thresh': 19.961352954078315, 'atr_min_pct': 0.004026136862367045, 'atr_max_pct': 0.02477363147140125, 'tp_mult': 1.082167574929966, 'tsl_mult': 0.9200887379098219, 'strategy': 'breakout', 'time_stop': 154, 'use_sma': False, 'use_atr': True, 'use_adx': True, 'use_ema': False, 'use_spike': True, 'rsi_required': True, 'edge_k': 0.6982904131011718, 'edge_cap': 0.7920319862765202, 'bull_strategy': 'breakout', 'bull_bb_std_mult': 2.356529095201012, 'bull_rsi_os': 24, 'bull_rsi_ob': 61, 'bull_adx_thresh': 33.10465004696581, 'bull_atr_min_pct': 0.007282177061247642, 'bull_atr_max_pct': 0.0623178741038246, 'bull_tp_mult': 1.4820806622951188, 'bull_tsl_mult': 0.33376059158280774, 'bull_time_stop': 139, 'bull_use_sma': True, 'bull_use_ema': True, 'bull_use_atr': True, 'bull_use_adx': False, 'bull_use_spike': False, 'bull_rsi_required': True, 'bear_strategy': 'breakout', 'bear_bb_std_mult': 2.282761841885587, 'bear_rsi_os': 41, 'bear_rsi_ob': 50, 'bear_adx_thresh': 24.174071563248194, 'bear_atr_min_pct': 0.02420581258699913, 'bear_atr_max_pct': 0.09740890945617825, 'bear_tp_mult': 2.627464221559518, 'bear_tsl_mult': 0.3678219211329076, 'bear_time_stop': 40, 'bear_use_sma': False, 'bear_use_ema': True, 'bear_use_atr': True, 'bear_use_adx': False, 'bear_use_spike': True, 'bear_rsi_required': False, 'sideways_strategy': 'mean_reversion', 'sideways_bb_std_mult': 1.3326052463418943, 'sideways_rsi_os': 31, 'sideways_rsi_ob': 93, 'sideways_adx_thresh': 19.057189710843595, 'sideways_atr_min_pct': 0.002356337227806312, 'sideways_atr_max_pct': 0.05449128172860714, 'sideways_tp_mult': 2.855436299476924, 'sideways_tsl_mult': 0.3484685036243748, 'sideways_time_stop': 278, 'sideways_use_sma': True, 'sideways_use_ema': False, 'sideways_use_atr': True, 'sideways_use_adx': True, 'sideways_use_spike': False, 'sideways_rsi_required': True}.
[I 2025-08-31 11:42:07,534] Trial 366 finished with values: [-1000000000.0, 1000000000.0] and parameters: {'p_sma': 32, 'p_std': 15, 'p_atr': 27, 'p_adx': 16, 'rsi_period': 40, 'ema1': 12, 'ema2': 52, 'slip_atr_k': 0.05267184689533691, 'slip_spread_k': 0.3768454339762575, 'spread_hl_frac': 0.002680504300297143, 'bb_std_mult': 1.9068487257348854, 'rsi_os': 34, 'rsi_ob': 74, 'vol_spike': 0.10413392081000755, 'adx_thresh': 14.264412006911382, 'atr_min_pct': 0.003898114903507903, 'atr_max_pct': 0.025386681175803512, 'tp_mult': 1.5184044878418597, 'tsl_mult': 0.2766324557395598, 'strategy': 'breakout', 'time_stop': 64, 'use_sma': False, 'use_atr': False, 'use_adx': True, 'use_ema': False, 'use_spike': True, 'rsi_required': False, 'edge_k': 0.714522953781989, 'edge_cap': 0.893201388290263, 'bull_strategy': 'mean_reversion', 'bull_bb_std_mult': 2.752974743567858, 'bull_rsi_os': 23, 'bull_rsi_ob': 64, 'bull_adx_thresh': 13.40822871467104, 'bull_atr_min_pct': 0.00790345562174674, 'bull_atr_max_pct': 0.11185486818910109, 'bull_tp_mult': 1.4931226377511928, 'bull_tsl_mult': 0.3275327276488, 'bull_time_stop': 131, 'bull_use_sma': True, 'bull_use_ema': True, 'bull_use_atr': True, 'bull_use_adx': True, 'bull_use_spike': False, 'bull_rsi_required': True, 'bear_strategy': 'breakout', 'bear_bb_std_mult': 0.9562122607720609, 'bear_rsi_os': 32, 'bear_rsi_ob': 73, 'bear_adx_thresh': 23.95360902772021, 'bear_atr_min_pct': 0.01636799174252632, 'bear_atr_max_pct': 0.11549816520590608, 'bear_tp_mult': 1.9298423448938642, 'bear_tsl_mult': 0.2779168526029203, 'bear_time_stop': 192, 'bear_use_sma': False, 'bear_use_ema': True, 'bear_use_atr': True, 'bear_use_adx': False, 'bear_use_spike': True, 'bear_rsi_required': False, 'sideways_strategy': 'breakout', 'sideways_bb_std_mult': 1.6735234024900614, 'sideways_rsi_os': 11, 'sideways_rsi_ob': 72, 'sideways_adx_thresh': 6.58895071436357, 'sideways_atr_min_pct': 0.004943379157376899, 'sideways_atr_max_pct': 0.03578939334048527, 'sideways_tp_mult': 2.8324203911627612, 'sideways_tsl_mult': 0.31912749426247855, 'sideways_time_stop': 22, 'sideways_use_sma': True, 'sideways_use_ema': False, 'sideways_use_atr': True, 'sideways_use_adx': True, 'sideways_use_spike': False, 'sideways_rsi_required': True}.
[I 2025-08-31 11:42:42,829] Trial 368 finished with values: [-1000000000.0, 1000000000.0] and parameters: {'p_sma': 30, 'p_std': 41, 'p_atr': 15, 'p_adx': 26, 'rsi_period': 52, 'ema1': 12, 'ema2': 37, 'slip_atr_k': 0.13906240002653056, 'slip_spread_k': 0.3736509212348506, 'spread_hl_frac': 0.00268009957138789, 'bb_std_mult': 0.8154880378070158, 'rsi_os': 15, 'rsi_ob': 58, 'vol_spike': 0.27894126309199546, 'adx_thresh': 9.044377058249916, 'atr_min_pct': 0.00381490455768116, 'atr_max_pct': 0.04361769896232416, 'tp_mult': 1.5296923379008067, 'tsl_mult': 0.2766396632324428, 'strategy': 'breakout', 'time_stop': 300, 'use_sma': True, 'use_atr': False, 'use_adx': False, 'use_ema': False, 'use_spike': True, 'rsi_required': False, 'edge_k': 0.7031391014189605, 'edge_cap': 0.8721952725346372, 'bull_strategy': 'mean_reversion', 'bull_bb_std_mult': 2.832378669585981, 'bull_rsi_os': 23, 'bull_rsi_ob': 64, 'bull_adx_thresh': 16.617476309679166, 'bull_atr_min_pct': 0.007090631662855337, 'bull_atr_max_pct': 0.0326545659264275, 'bull_tp_mult': 1.9733027134507193, 'bull_tsl_mult': 0.327221619159458, 'bull_time_stop': 215, 'bull_use_sma': True, 'bull_use_ema': True, 'bull_use_atr': True, 'bull_use_adx': True, 'bull_use_spike': False, 'bull_rsi_required': False, 'bear_strategy': 'mean_reversion', 'bear_bb_std_mult': 2.2920707639793934, 'bear_rsi_os': 32, 'bear_rsi_ob': 50, 'bear_adx_thresh': 24.03253142641489, 'bear_atr_min_pct': 0.016057738806293007, 'bear_atr_max_pct': 0.1297193704230469, 'bear_tp_mult': 2.615558424103066, 'bear_tsl_mult': 0.3230047000904784, 'bear_time_stop': 193, 'bear_use_sma': False, 'bear_use_ema': True, 'bear_use_atr': True, 'bear_use_adx': False, 'bear_use_spike': True, 'bear_rsi_required': False, 'sideways_strategy': 'breakout', 'sideways_bb_std_mult': 1.667428251019221, 'sideways_rsi_os': 14, 'sideways_rsi_ob': 72, 'sideways_adx_thresh': 19.943751956733216, 'sideways_atr_min_pct': 0.004976391121024314, 'sideways_atr_max_pct': 0.11764514467343229, 'sideways_tp_mult': 1.348636508220418, 'sideways_tsl_mult': 0.3156514526782265, 'sideways_time_stop': 257, 'sideways_use_sma': True, 'sideways_use_ema': True, 'sideways_use_atr': True, 'sideways_use_adx': True, 'sideways_use_spike': True, 'sideways_rsi_required': True}.
[I 2025-08-31 11:42:44,052] Trial 370 finished with values: [-1000000000.0, 1000000000.0] and parameters: {'p_sma': 30, 'p_std': 17, 'p_atr': 29, 'p_adx': 26, 'rsi_period': 71, 'ema1': 22, 'ema2': 27, 'slip_atr_k': 0.02144940352876186, 'slip_spread_k': 0.5188576331049558, 'spread_hl_frac': 0.0010726337017138998, 'bb_std_mult': 0.8142889460794186, 'rsi_os': 7, 'rsi_ob': 69, 'vol_spike': 0.20340441741571097, 'adx_thresh': 6.782064610757324, 'atr_min_pct': 0.005733373414825153, 'atr_max_pct': 0.013745949261842985, 'tp_mult': 2.5470959406225537, 'tsl_mult': 0.2721382309203135, 'strategy': 'breakout', 'time_stop': 300, 'use_sma': True, 'use_atr': False, 'use_adx': False, 'use_ema': False, 'use_spike': True, 'rsi_required': False, 'edge_k': 1.7330618037346763, 'edge_cap': 0.5802397731965936, 'bull_strategy': 'mean_reversion', 'bull_bb_std_mult': 2.486890516643131, 'bull_rsi_os': 9, 'bull_rsi_ob': 63, 'bull_adx_thresh': 14.542103407363486, 'bull_atr_min_pct': 0.0006492588663953303, 'bull_atr_max_pct': 0.14374226466871406, 'bull_tp_mult': 1.5417078776685353, 'bull_tsl_mult': 0.24527402239759685, 'bull_time_stop': 284, 'bull_use_sma': True, 'bull_use_ema': True, 'bull_use_atr': True, 'bull_use_adx': True, 'bull_use_spike': False, 'bull_rsi_required': False, 'bear_strategy': 'mean_reversion', 'bear_bb_std_mult': 1.1303028034874103, 'bear_rsi_os': 46, 'bear_rsi_ob': 79, 'bear_adx_thresh': 27.559264521479417, 'bear_atr_min_pct': 0.012838228013906484, 'bear_atr_max_pct': 0.11185739828142216, 'bear_tp_mult': 2.5792401318360545, 'bear_tsl_mult': 0.5482615674625845, 'bear_time_stop': 179, 'bear_use_sma': False, 'bear_use_ema': True, 'bear_use_atr': True, 'bear_use_adx': False, 'bear_use_spike': True, 'bear_rsi_required': False, 'sideways_strategy': 'breakout', 'sideways_bb_std_mult': 1.7815031473673864, 'sideways_rsi_os': 42, 'sideways_rsi_ob': 73, 'sideways_adx_thresh': 15.490544253593733, 'sideways_atr_min_pct': 0.003723142472568287, 'sideways_atr_max_pct': 0.14630649890076586, 'sideways_tp_mult': 1.3533376048824954, 'sideways_tsl_mult': 0.31433657699365014, 'sideways_time_stop': 255, 'sideways_use_sma': True, 'sideways_use_ema': True, 'sideways_use_atr': True, 'sideways_use_adx': True, 'sideways_use_spike': True, 'sideways_rsi_required': True}.
