[I 2025-08-31 11:42:44,382] Trial 367 finished with values: [-1000000000.0, 1000000000.0] and parameters: {'p_sma': 9, 'p_std': 49, 'p_atr': 7, 'p_adx': 16, 'rsi_period': 52, 'ema1': 22, 'ema2': 37, 'slip_atr_k': 0.05542946594150151, 'slip_spread_k': 0.8465669350162375, 'spread_hl_frac': 0.0008789405181036487, 'bb_std_mult': 0.8253294392053493, 'rsi_os': 15, 'rsi_ob': 69, 'vol_spike': 0.27970716766145026, 'adx_thresh': 23.552190980464747, 'atr_min_pct': 0.0038188581106393155, 'atr_max_pct': 0.040654882129870604, 'tp_mult': 1.172757932802411, 'tsl_mult': 0.28422900279006214, 'strategy': 'breakout', 'time_stop': 63, 'use_sma': True, 'use_atr': False, 'use_adx': False, 'use_ema': False, 'use_spike': True, 'rsi_required': False, 'edge_k': 1.965560391534463, 'edge_cap': 0.873213339952501, 'bull_strategy': 'mean_reversion', 'bull_bb_std_mult': 2.7992636724062496, 'bull_rsi_os': 23, 'bull_rsi_ob': 64, 'bull_adx_thresh': 16.784108938826925, 'bull_atr_min_pct': 0.01417759699354407, 'bull_atr_max_pct': 0.03261070574459199, 'bull_tp_mult': 1.7512434472929481, 'bull_tsl_mult': 0.3307694848732921, 'bull_time_stop': 137, 'bull_use_sma': True, 'bull_use_ema': True, 'bull_use_atr': True, 'bull_use_adx': True, 'bull_use_spike': False, 'bull_rsi_required': False, 'bear_strategy': 'mean_reversion', 'bear_bb_std_mult': 3.229728809449613, 'bear_rsi_os': 41, 'bear_rsi_ob': 57, 'bear_adx_thresh': 33.26998189238273, 'bear_atr_min_pct': 0.015971201203700016, 'bear_atr_max_pct': 0.11404922465186708, 'bear_tp_mult': 2.288972447404125, 'bear_tsl_mult': 0.5517110911221365, 'bear_time_stop': 193, 'bear_use_sma': False, 'bear_use_ema': True, 'bear_use_atr': True, 'bear_use_adx': False, 'bear_use_spike': True, 'bear_rsi_required': False, 'sideways_strategy': 'breakout', 'sideways_bb_std_mult': 1.9289210017431662, 'sideways_rsi_os': 42, 'sideways_rsi_ob': 72, 'sideways_adx_thresh': 19.125668436481906, 'sideways_atr_min_pct': 0.005421734039430602, 'sideways_atr_max_pct': 0.054445959544616084, 'sideways_tp_mult': 1.3386381822028157, 'sideways_tsl_mult': 0.3097871745590501, 'sideways_time_stop': 220, 'sideways_use_sma': True, 'sideways_use_ema': True, 'sideways_use_atr': True, 'sideways_use_adx': True, 'sideways_use_spike': True, 'sideways_rsi_required': True}.
[I 2025-08-31 11:42:44,756] Trial 369 finished with values: [-1000000000.0, 1000000000.0] and parameters: {'p_sma': 30, 'p_std': 38, 'p_atr': 21, 'p_adx': 25, 'rsi_period': 66, 'ema1': 11, 'ema2': 58, 'slip_atr_k': 0.08015908493264746, 'slip_spread_k': 0.16220999815580728, 'spread_hl_frac': 0.0010701795762807398, 'bb_std_mult': 3.197248544505509, 'rsi_os': 18, 'rsi_ob': 69, 'vol_spike': 0.2787167708004199, 'adx_thresh': 25.37826102032692, 'atr_min_pct': 0.0071392880044092175, 'atr_max_pct': 0.04258315802272966, 'tp_mult': 1.1704404588478412, 'tsl_mult': 0.9643794877158819, 'strategy': 'breakout', 'time_stop': 168, 'use_sma': True, 'use_atr': False, 'use_adx': False, 'use_ema': False, 'use_spike': True, 'rsi_required': False, 'edge_k': 0.7544317600563635, 'edge_cap': 0.8937785394368357, 'bull_strategy': 'mean_reversion', 'bull_bb_std_mult': 2.884175453998707, 'bull_rsi_os': 23, 'bull_rsi_ob': 64, 'bull_adx_thresh': 13.343570734383325, 'bull_atr_min_pct': 0.00013772607853949556, 'bull_atr_max_pct': 0.11641112566349995, 'bull_tp_mult': 1.534011098903664, 'bull_tsl_mult': 0.3229828412563705, 'bull_time_stop': 285, 'bull_use_sma': True, 'bull_use_ema': True, 'bull_use_atr': True, 'bull_use_adx': True, 'bull_use_spike': False, 'bull_rsi_required': False, 'bear_strategy': 'mean_reversion', 'bear_bb_std_mult': 3.262360064334352, 'bear_rsi_os': 32, 'bear_rsi_ob': 55, 'bear_adx_thresh': 30.882763531351284, 'bear_atr_min_pct': 0.016127064070426588, 'bear_atr_max_pct': 0.1159051529216587, 'bear_tp_mult': 2.5618540980480553, 'bear_tsl_mult': 0.33867607340897593, 'bear_time_stop': 193, 'bear_use_sma': False, 'bear_use_ema': True, 'bear_use_atr': True, 'bear_use_adx': False, 'bear_use_spike': True, 'bear_rsi_required': False, 'sideways_strategy': 'breakout', 'sideways_bb_std_mult': 1.6590525762588548, 'sideways_rsi_os': 44, 'sideways_rsi_ob': 72, 'sideways_adx_thresh': 5.009474375980197, 'sideways_atr_min_pct': 0.004936314537187935, 'sideways_atr_max_pct': 0.03638276559398319, 'sideways_tp_mult': 1.5112642901197468, 'sideways_tsl_mult': 0.3126166208060527, 'sideways_time_stop': 192, 'sideways_use_sma': True, 'sideways_use_ema': True, 'sideways_use_atr': True, 'sideways_use_adx': True, 'sideways_use_spike': True, 'sideways_rsi_required': True}.
[I 2025-08-31 11:42:45,567] Trial 374 finished with values: [-1000000000.0, 1000000000.0] and parameters: {'p_sma': 16, 'p_std': 15, 'p_atr': 13, 'p_adx': 10, 'rsi_period': 45, 'ema1': 26, 'ema2': 22, 'slip_atr_k': 0.046443513235534806, 'slip_spread_k': 0.7861906869162076, 'spread_hl_frac': 0.03950840130181441, 'bb_std_mult': 3.4257637359697912, 'rsi_os': 36, 'rsi_ob': 72, 'vol_spike': 0.12009350403125532, 'adx_thresh': 24.622903372276916, 'atr_min_pct': 0.018522757398761188, 'atr_max_pct': 0.01659862479416674, 'tp_mult': 1.0502872464053687, 'tsl_mult': 0.8528723809879193, 'strategy': 'mean_reversion', 'time_stop': 289, 'use_sma': False, 'use_atr': True, 'use_adx': True, 'use_ema': True, 'use_spike': True, 'rsi_required': True, 'edge_k': 0.3270464695694366, 'edge_cap': 0.46094114234003475, 'bull_strategy': 'breakout', 'bull_bb_std_mult': 2.399754300140355, 'bull_rsi_os': 21, 'bull_rsi_ob': 88, 'bull_adx_thresh': 15.537394766644546, 'bull_atr_min_pct': 0.027414436106109146, 'bull_atr_max_pct': 0.12858501039840503, 'bull_tp_mult': 1.5700862844726398, 'bull_tsl_mult': 0.2602018741245238, 'bull_time_stop': 160, 'bull_use_sma': False, 'bull_use_ema': False, 'bull_use_atr': True, 'bull_use_adx': True, 'bull_use_spike': True, 'bull_rsi_required': True, 'bear_strategy': 'breakout', 'bear_bb_std_mult': 3.3449402188969777, 'bear_rsi_os': 34, 'bear_rsi_ob': 53, 'bear_adx_thresh': 31.604077510663807, 'bear_atr_min_pct': 0.02498669802120422, 'bear_atr_max_pct': 0.0383526932796333, 'bear_tp_mult': 2.7289849439240603, 'bear_tsl_mult': 0.35370603779401166, 'bear_time_stop': 184, 'bear_use_sma': False, 'bear_use_ema': True, 'bear_use_atr': False, 'bear_use_adx': True, 'bear_use_spike': False, 'bear_rsi_required': True, 'sideways_strategy': 'breakout', 'sideways_bb_std_mult': 1.9580390442217932, 'sideways_rsi_os': 30, 'sideways_rsi_ob': 74, 'sideways_adx_thresh': 9.039555836483093, 'sideways_atr_min_pct': 0.0071826511646963815, 'sideways_atr_max_pct': 0.04285570532634944, 'sideways_tp_mult': 1.6821156799619676, 'sideways_tsl_mult': 0.36743902321729716, 'sideways_time_stop': 88, 'sideways_use_sma': True, 'sideways_use_ema': False, 'sideways_use_atr': True, 'sideways_use_adx': False, 'sideways_use_spike': False, 'sideways_rsi_required': False}.
[I 2025-08-31 11:43:20,707] Trial 372 finished with values: [-1000000000.0, 1000000000.0] and parameters: {'p_sma': 10, 'p_std': 49, 'p_atr': 13, 'p_adx': 24, 'rsi_period': 46, 'ema1': 9, 'ema2': 22, 'slip_atr_k': 0.046902096072824744, 'slip_spread_k': 0.17927916431060864, 'spread_hl_frac': 0.0007383256876909857, 'bb_std_mult': 0.9525101054295559, 'rsi_os': 18, 'rsi_ob': 72, 'vol_spike': 0.25517150028845487, 'adx_thresh': 23.441814655146292, 'atr_min_pct': 0.005299401113101473, 'atr_max_pct': 0.01622102911041758, 'tp_mult': 1.197598319590723, 'tsl_mult': 0.8495068219290746, 'strategy': 'breakout', 'time_stop': 137, 'use_sma': False, 'use_atr': True, 'use_adx': True, 'use_ema': False, 'use_spike': True, 'rsi_required': True, 'edge_k': 0.5437174590835564, 'edge_cap': 0.856975036331428, 'bull_strategy': 'breakout', 'bull_bb_std_mult': 1.3864439352818747, 'bull_rsi_os': 12, 'bull_rsi_ob': 67, 'bull_adx_thresh': 34.59358486568115, 'bull_atr_min_pct': 0.026222137919906244, 'bull_atr_max_pct': 0.13925620133777383, 'bull_tp_mult': 2.710359724926912, 'bull_tsl_mult': 0.7101568912281576, 'bull_time_stop': 140, 'bull_use_sma': True, 'bull_use_ema': True, 'bull_use_atr': True, 'bull_use_adx': True, 'bull_use_spike': False, 'bull_rsi_required': True, 'bear_strategy': 'breakout', 'bear_bb_std_mult': 3.348133635061571, 'bear_rsi_os': 34, 'bear_rsi_ob': 76, 'bear_adx_thresh': 25.457181271043034, 'bear_atr_min_pct': 0.014888539067391236, 'bear_atr_max_pct': 0.11574430223840554, 'bear_tp_mult': 1.7422039230724815, 'bear_tsl_mult': 0.13074487268397217, 'bear_time_stop': 181, 'bear_use_sma': False, 'bear_use_ema': True, 'bear_use_atr': True, 'bear_use_adx': False, 'bear_use_spike': True, 'bear_rsi_required': False, 'sideways_strategy': 'breakout', 'sideways_bb_std_mult': 2.1367061897785, 'sideways_rsi_os': 21, 'sideways_rsi_ob': 74, 'sideways_adx_thresh': 13.353480900319376, 'sideways_atr_min_pct': 0.007332869398765241, 'sideways_atr_max_pct': 0.042468438106211884, 'sideways_tp_mult': 2.7228573671027876, 'sideways_tsl_mult': 0.35560982643321026, 'sideways_time_stop': 130, 'sideways_use_sma': True, 'sideways_use_ema': False, 'sideways_use_atr': True, 'sideways_use_adx': True, 'sideways_use_spike': False, 'sideways_rsi_required': True}.
[I 2025-08-31 11:43:21,458] Trial 373 finished with values: [-1000000000.0, 1000000000.0] and parameters: {'p_sma': 27, 'p_std': 38, 'p_atr': 16, 'p_adx': 10, 'rsi_period': 45, 'ema1': 9, 'ema2': 59, 'slip_atr_k': 0.04759990006306326, 'slip_spread_k': 0.17483125651906734, 'spread_hl_frac': 0.037658148552855514, 'bb_std_mult': 3.193885883264521, 'rsi_os': 36, 'rsi_ob': 50, 'vol_spike': 0.15686295639548709, 'adx_thresh': 24.840999315420174, 'atr_min_pct': 0.005569393411453956, 'atr_max_pct': 0.01003361266988123, 'tp_mult': 2.3606959899179163, 'tsl_mult': 0.2377980336765268, 'strategy': 'breakout', 'time_stop': 169, 'use_sma': False, 'use_atr': True, 'use_adx': True, 'use_ema': False, 'use_spike': True, 'rsi_required': True, 'edge_k': 0.32191515635091816, 'edge_cap': 0.8150626851379544, 'bull_strategy': 'breakout', 'bull_bb_std_mult': 3.3280569423688515, 'bull_rsi_os': 54, 'bull_rsi_ob': 68, 'bull_adx_thresh': 14.061770047480865, 'bull_atr_min_pct': 0.027011522409299424, 'bull_atr_max_pct': 0.0978353967733205, 'bull_tp_mult': 1.5232997219435505, 'bull_tsl_mult': 0.56192196050144, 'bull_time_stop': 68, 'bull_use_sma': False, 'bull_use_ema': True, 'bull_use_atr': True, 'bull_use_adx': True, 'bull_use_spike': False, 'bull_rsi_required': True, 'bear_strategy': 'breakout', 'bear_bb_std_mult': 2.9746105907757876, 'bear_rsi_os': 34, 'bear_rsi_ob': 55, 'bear_adx_thresh': 25.373470452841204, 'bear_atr_min_pct': 0.014773485300495205, 'bear_atr_max_pct': 0.12187074776153664, 'bear_tp_mult': 2.043190775360869, 'bear_tsl_mult': 0.1307031310022604, 'bear_time_stop': 181, 'bear_use_sma': False, 'bear_use_ema': True, 'bear_use_atr': True, 'bear_use_adx': True, 'bear_use_spike': True, 'bear_rsi_required': False, 'sideways_strategy': 'breakout', 'sideways_bb_std_mult': 1.8767026651659455, 'sideways_rsi_os': 48, 'sideways_rsi_ob': 74, 'sideways_adx_thresh': 10.822536744429899, 'sideways_atr_min_pct': 0.027740622016281642, 'sideways_atr_max_pct': 0.04906833538123231, 'sideways_tp_mult': 1.5120367975322315, 'sideways_tsl_mult': 0.3677485344333705, 'sideways_time_stop': 193, 'sideways_use_sma': True, 'sideways_use_ema': False, 'sideways_use_atr': True, 'sideways_use_adx': False, 'sideways_use_spike': False, 'sideways_rsi_required': True}.
[I 2025-08-31 11:43:21,973] Trial 371 finished with values: [-1000000000.0, 1000000000.0] and parameters: {'p_sma': 10, 'p_std': 51, 'p_atr': 13, 'p_adx': 8, 'rsi_period': 54, 'ema1': 22, 'ema2': 24, 'slip_atr_k': 0.08169656732426207, 'slip_spread_k': 0.05935920644305141, 'spread_hl_frac': 0.03739475234633766, 'bb_std_mult': 3.2011997374774084, 'rsi_os': 53, 'rsi_ob': 69, 'vol_spike': 0.12154140629897367, 'adx_thresh': 6.555095077361804, 'atr_min_pct': 0.0073269814720156685, 'atr_max_pct': 0.013344508595462351, 'tp_mult': 1.1785495473318406, 'tsl_mult': 0.9658287938361289, 'strategy': 'breakout', 'time_stop': 294, 'use_sma': False, 'use_atr': True, 'use_adx': True, 'use_ema': False, 'use_spike': True, 'rsi_required': True, 'edge_k': 1.0640650199334458, 'edge_cap': 0.5802315190103906, 'bull_strategy': 'breakout', 'bull_bb_std_mult': 2.449402928180823, 'bull_rsi_os': 9, 'bull_rsi_ob': 63, 'bull_adx_thresh': 14.470690159014447, 'bull_atr_min_pct': 0.014505288016126675, 'bull_atr_max_pct': 0.0980633139509022, 'bull_tp_mult': 1.744793563041674, 'bull_tsl_mult': 0.2518006858439034, 'bull_time_stop': 241, 'bull_use_sma': True, 'bull_use_ema': True, 'bull_use_atr': True, 'bull_use_adx': True, 'bull_use_spike': False, 'bull_rsi_required': True, 'bear_strategy': 'mean_reversion', 'bear_bb_std_mult': 1.140989192754569, 'bear_rsi_os': 34, 'bear_rsi_ob': 65, 'bear_adx_thresh': 31.03449331420623, 'bear_atr_min_pct': 0.015007312076709668, 'bear_atr_max_pct': 0.05408278998606818, 'bear_tp_mult': 1.7459855410196299, 'bear_tsl_mult': 0.35459623826173503, 'bear_time_stop': 181, 'bear_use_sma': False, 'bear_use_ema': True, 'bear_use_atr': True, 'bear_use_adx': False, 'bear_use_spike': True, 'bear_rsi_required': False, 'sideways_strategy': 'breakout', 'sideways_bb_std_mult': 2.687670047030114, 'sideways_rsi_os': 33, 'sideways_rsi_ob': 74, 'sideways_adx_thresh': 10.520610594627886, 'sideways_atr_min_pct': 0.025947759255417487, 'sideways_atr_max_pct': 0.14724186259688193, 'sideways_tp_mult': 1.3801113834062635, 'sideways_tsl_mult': 0.36697645004960455, 'sideways_time_stop': 234, 'sideways_use_sma': True, 'sideways_use_ema': True, 'sideways_use_atr': True, 'sideways_use_adx': True, 'sideways_use_spike': False, 'sideways_rsi_required': True}.
[I 2025-08-31 11:43:22,887] Trial 375 finished with values: [-0.01825910227898564, 0.01800051311879123] and parameters: {'p_sma': 27, 'p_std': 18, 'p_atr': 14, 'p_adx': 24, 'rsi_period': 54, 'ema1': 9, 'ema2': 35, 'slip_atr_k': 0.037383236951773674, 'slip_spread_k': 0.05769002202571076, 'spread_hl_frac': 6.98203875188542e-05, 'bb_std_mult': 1.2257146750705559, 'rsi_os': 10, 'rsi_ob': 71, 'vol_spike': 0.13091549101071143, 'adx_thresh': 26.076580784207188, 'atr_min_pct': 0.0066208805762181955, 'atr_max_pct': 0.02155472460302265, 'tp_mult': 1.129099389242981, 'tsl_mult': 0.23490762364086826, 'strategy': 'breakout', 'time_stop': 107, 'use_sma': False, 'use_atr': True, 'use_adx': True, 'use_ema': False, 'use_spike': True, 'rsi_required': True, 'edge_k': 0.5399289159086651, 'edge_cap': 0.809641548260919, 'bull_strategy': 'breakout', 'bull_bb_std_mult': 3.420427950582316, 'bull_rsi_os': 54, 'bull_rsi_ob': 62, 'bull_adx_thresh': 14.090520077356814, 'bull_atr_min_pct': 0.003111190708283004, 'bull_atr_max_pct': 0.09865829098544983, 'bull_tp_mult': 1.5050926785611578, 'bull_tsl_mult': 0.5589248345927655, 'bull_time_stop': 66, 'bull_use_sma': True, 'bull_use_ema': True, 'bull_use_atr': True, 'bull_use_adx': True, 'bull_use_spike': False, 'bull_rsi_required': True, 'bear_strategy': 'breakout', 'bear_bb_std_mult': 0.9612524818802121, 'bear_rsi_os': 52, 'bear_rsi_ob': 59, 'bear_adx_thresh': 9.01169561134586, 'bear_atr_min_pct': 0.01503781179547224, 'bear_atr_max_pct': 0.10093545056042467, 'bear_tp_mult': 2.796252874810645, 'bear_tsl_mult': 0.5226281081139202, 'bear_time_stop': 179, 'bear_use_sma': False, 'bear_use_ema': True, 'bear_use_atr': True, 'bear_use_adx': False, 'bear_use_spike': True, 'bear_rsi_required': False, 'sideways_strategy': 'breakout', 'sideways_bb_std_mult': 2.679196467222425, 'sideways_rsi_os': 21, 'sideways_rsi_ob': 51, 'sideways_adx_thresh': 9.97846170725392, 'sideways_atr_min_pct': 0.01986959399863052, 'sideways_atr_max_pct': 0.04902820321765133, 'sideways_tp_mult': 1.3977861748203626, 'sideways_tsl_mult': 0.35959072213462107, 'sideways_time_stop': 5, 'sideways_use_sma': True, 'sideways_use_ema': False, 'sideways_use_atr': True, 'sideways_use_adx': True, 'sideways_use_spike': False, 'sideways_rsi_required': True}.
[I 2025-08-31 11:44:00,327] Trial 378 finished with values: [-0.023677276520157498, 0.023419757432781168] and parameters: {'p_sma': 29, 'p_std': 17, 'p_atr': 14, 'p_adx': 27, 'rsi_period': 25, 'ema1': 28, 'ema2': 32, 'slip_atr_k': 0.038125020098286326, 'slip_spread_k': 0.12691169737109148, 'spread_hl_frac': 1.728662633512421e-05, 'bb_std_mult': 0.6515781313188826, 'rsi_os': 33, 'rsi_ob': 71, 'vol_spike': 0.1340720021467305, 'adx_thresh': 27.700813318914044, 'atr_min_pct': 0.014121342704192364, 'atr_max_pct': 0.019738501068310065, 'tp_mult': 1.8031317126501787, 'tsl_mult': 0.29556310817962417, 'strategy': 'mean_reversion', 'time_stop': 104, 'use_sma': False, 'use_atr': True, 'use_adx': True, 'use_ema': True, 'use_spike': False, 'rsi_required': True, 'edge_k': 0.4519405089336869, 'edge_cap': 0.7656422139087553, 'bull_strategy': 'breakout', 'bull_bb_std_mult': 2.9448772439250512, 'bull_rsi_os': 42, 'bull_rsi_ob': 94, 'bull_adx_thresh': 12.40670276696935, 'bull_atr_min_pct': 0.003197728078529605, 'bull_atr_max_pct': 0.13656148019218325, 'bull_tp_mult': 2.7822942180221633, 'bull_tsl_mult': 0.29975458339018374, 'bull_time_stop': 179, 'bull_use_sma': True, 'bull_use_ema': False, 'bull_use_atr': False, 'bull_use_adx': True, 'bull_use_spike': True, 'bull_rsi_required': True, 'bear_strategy': 'breakout', 'bear_bb_std_mult': 0.988313584165926, 'bear_rsi_os': 10, 'bear_rsi_ob': 45, 'bear_adx_thresh': 6.370145036920647, 'bear_atr_min_pct': 0.02645691050730101, 'bear_atr_max_pct': 0.05875341847074326, 'bear_tp_mult': 2.764246342549142, 'bear_tsl_mult': 0.3695227573684929, 'bear_time_stop': 188, 'bear_use_sma': True, 'bear_use_ema': False, 'bear_use_atr': False, 'bear_use_adx': False, 'bear_use_spike': False, 'bear_rsi_required': True, 'sideways_strategy': 'breakout', 'sideways_bb_std_mult': 1.7653614316704362, 'sideways_rsi_os': 50, 'sideways_rsi_ob': 73, 'sideways_adx_thresh': 8.199579745026272, 'sideways_atr_min_pct': 0.019962568758513342, 'sideways_atr_max_pct': 0.046170047459434524, 'sideways_tp_mult': 1.2975686039637035, 'sideways_tsl_mult': 0.34293142432121265, 'sideways_time_stop': 5, 'sideways_use_sma': False, 'sideways_use_ema': False, 'sideways_use_atr': True, 'sideways_use_adx': True, 'sideways_use_spike': False, 'sideways_rsi_required': False}.
[I 2025-08-31 11:44:01,070] Trial 377 finished with values: [-0.02925383173113605, 0.029005593897753684] and parameters: {'p_sma': 29, 'p_std': 17, 'p_atr': 15, 'p_adx': 14, 'rsi_period': 49, 'ema1': 19, 'ema2': 32, 'slip_atr_k': 0.03897535346989428, 'slip_spread_k': 0.12668693619937113, 'spread_hl_frac': 5.161559989604449e-05, 'bb_std_mult': 3.5934290085843097, 'rsi_os': 50, 'rsi_ob': 71, 'vol_spike': 0.04008465636952048, 'adx_thresh': 5.77935868013572, 'atr_min_pct': 0.0027826766535525237, 'atr_max_pct': 0.030831440685155635, 'tp_mult': 2.0608856222237524, 'tsl_mult': 0.49860680916392824, 'strategy': 'breakout', 'time_stop': 23, 'use_sma': False, 'use_atr': True, 'use_adx': True, 'use_ema': False, 'use_spike': False, 'rsi_required': True, 'edge_k': 0.4484396741074977, 'edge_cap': 0.8489923728255855, 'bull_strategy': 'breakout', 'bull_bb_std_mult': 2.626357739693152, 'bull_rsi_os': 22, 'bull_rsi_ob': 62, 'bull_adx_thresh': 24.769883414999143, 'bull_atr_min_pct': 0.003085104764235784, 'bull_atr_max_pct': 0.13664710405135067, 'bull_tp_mult': 1.4692522430917558, 'bull_tsl_mult': 0.29998048556165857, 'bull_time_stop': 153, 'bull_use_sma': True, 'bull_use_ema': False, 'bull_use_atr': True, 'bull_use_adx': True, 'bull_use_spike': False, 'bull_rsi_required': True, 'bear_strategy': 'breakout', 'bear_bb_std_mult': 0.9665123030073934, 'bear_rsi_os': 29, 'bear_rsi_ob': 65, 'bear_adx_thresh': 8.40534581193888, 'bear_atr_min_pct': 0.01547840031329487, 'bear_atr_max_pct': 0.054909525323268406, 'bear_tp_mult': 2.9946302878727122, 'bear_tsl_mult': 0.5221608975195717, 'bear_time_stop': 188, 'bear_use_sma': False, 'bear_use_ema': False, 'bear_use_atr': True, 'bear_use_adx': False, 'bear_use_spike': True, 'bear_rsi_required': False, 'sideways_strategy': 'breakout', 'sideways_bb_std_mult': 1.5813669763054456, 'sideways_rsi_os': 34, 'sideways_rsi_ob': 51, 'sideways_adx_thresh': 9.990294910891736, 'sideways_atr_min_pct': 0.0029972623203415693, 'sideways_atr_max_pct': 0.11414061704313042, 'sideways_tp_mult': 1.1027898217758927, 'sideways_tsl_mult': 0.3348572074918337, 'sideways_time_stop': 9, 'sideways_use_sma': True, 'sideways_use_ema': False, 'sideways_use_atr': True, 'sideways_use_adx': True, 'sideways_use_spike': False, 'sideways_rsi_required': False}.
