[I 2025-08-31 11:45:14,033] Trial 387 finished with values: [-1000000000.0, 1000000000.0] and parameters: {'p_sma': 28, 'p_std': 16, 'p_atr': 15, 'p_adx': 25, 'rsi_period': 38, 'ema1': 12, 'ema2': 11, 'slip_atr_k': 0.0529786971048431, 'slip_spread_k': 0.2933155288818975, 'spread_hl_frac': 0.0018971194299793807, 'bb_std_mult': 0.7772402231358765, 'rsi_os': 32, 'rsi_ob': 73, 'vol_spike': 0.1412454249890008, 'adx_thresh': 24.13813178363752, 'atr_min_pct': 0.003533045544162519, 'atr_max_pct': 0.10131891124210105, 'tp_mult': 2.6144750903780616, 'tsl_mult': 0.595182565514679, 'strategy': 'breakout', 'time_stop': 45, 'use_sma': True, 'use_atr': False, 'use_adx': False, 'use_ema': False, 'use_spike': True, 'rsi_required': False, 'edge_k': 0.49536199857995733, 'edge_cap': 0.6779627502223994, 'bull_strategy': 'mean_reversion', 'bull_bb_std_mult': 2.5451011686860587, 'bull_rsi_os': 20, 'bull_rsi_ob': 77, 'bull_adx_thresh': 15.961175382197643, 'bull_atr_min_pct': 0.013316108713845826, 'bull_atr_max_pct': 0.017178034126340627, 'bull_tp_mult': 1.5592524286738967, 'bull_tsl_mult': 0.23722676802151166, 'bull_time_stop': 89, 'bull_use_sma': True, 'bull_use_ema': False, 'bull_use_atr': False, 'bull_use_adx': True, 'bull_use_spike': False, 'bull_rsi_required': False, 'bear_strategy': 'mean_reversion', 'bear_bb_std_mult': 1.1370421869613712, 'bear_rsi_os': 31, 'bear_rsi_ob': 56, 'bear_adx_thresh': 15.798446459973643, 'bear_atr_min_pct': 0.016968428936803788, 'bear_atr_max_pct': 0.12070393487258113, 'bear_tp_mult': 2.614610070043869, 'bear_tsl_mult': 0.9030080438496191, 'bear_time_stop': 32, 'bear_use_sma': True, 'bear_use_ema': True, 'bear_use_atr': True, 'bear_use_adx': False, 'bear_use_spike': True, 'bear_rsi_required': False, 'sideways_strategy': 'breakout', 'sideways_bb_std_mult': 1.717600413751846, 'sideways_rsi_os': 30, 'sideways_rsi_ob': 59, 'sideways_adx_thresh': 7.532589978347307, 'sideways_atr_min_pct': 0.003775279219304919, 'sideways_atr_max_pct': 0.07339413443126873, 'sideways_tp_mult': 1.5512377133075543, 'sideways_tsl_mult': 0.304920301509219, 'sideways_time_stop': 20, 'sideways_use_sma': True, 'sideways_use_ema': True, 'sideways_use_atr': False, 'sideways_use_adx': True, 'sideways_use_spike': True, 'sideways_rsi_required': False}.
[I 2025-08-31 11:45:15,671] Trial 388 finished with values: [-0.06740328770135706, 0.06714799711110511] and parameters: {'p_sma': 28, 'p_std': 16, 'p_atr': 24, 'p_adx': 30, 'rsi_period': 38, 'ema1': 12, 'ema2': 29, 'slip_atr_k': 0.04390716448167751, 'slip_spread_k': 0.13904686713925635, 'spread_hl_frac': 0.033025598842185755, 'bb_std_mult': 1.990075099403139, 'rsi_os': 36, 'rsi_ob': 73, 'vol_spike': 0.11069949853943208, 'adx_thresh': 24.289880014364577, 'atr_min_pct': 0.004083359940229588, 'atr_max_pct': 0.1000434527860522, 'tp_mult': 1.0642501102095208, 'tsl_mult': 0.34280403947919147, 'strategy': 'breakout', 'time_stop': 295, 'use_sma': False, 'use_atr': True, 'use_adx': False, 'use_ema': False, 'use_spike': True, 'rsi_required': True, 'edge_k': 0.3489148039153269, 'edge_cap': 0.6315753875778866, 'bull_strategy': 'breakout', 'bull_bb_std_mult': 2.4945976730471924, 'bull_rsi_os': 21, 'bull_rsi_ob': 65, 'bull_adx_thresh': 13.725257580700266, 'bull_atr_min_pct': 0.0014498775865850557, 'bull_atr_max_pct': 0.04945570158969695, 'bull_tp_mult': 1.690889383546239, 'bull_tsl_mult': 0.6594769869518443, 'bull_time_stop': 141, 'bull_use_sma': True, 'bull_use_ema': False, 'bull_use_atr': True, 'bull_use_adx': True, 'bull_use_spike': False, 'bull_rsi_required': False, 'bear_strategy': 'breakout', 'bear_bb_std_mult': 1.1122787254007345, 'bear_rsi_os': 31, 'bear_rsi_ob': 56, 'bear_adx_thresh': 11.315128042422643, 'bear_atr_min_pct': 0.015545335691607043, 'bear_atr_max_pct': 0.03423512069655209, 'bear_tp_mult': 2.344499413931863, 'bear_tsl_mult': 0.04205387922038051, 'bear_time_stop': 173, 'bear_use_sma': False, 'bear_use_ema': True, 'bear_use_atr': True, 'bear_use_adx': False, 'bear_use_spike': True, 'bear_rsi_required': False, 'sideways_strategy': 'breakout', 'sideways_bb_std_mult': 3.1169527487223574, 'sideways_rsi_os': 35, 'sideways_rsi_ob': 53, 'sideways_adx_thresh': 8.521734219401388, 'sideways_atr_min_pct': 0.02126591498522472, 'sideways_atr_max_pct': 0.04050572948290319, 'sideways_tp_mult': 2.5355699843522572, 'sideways_tsl_mult': 0.31798005800838886, 'sideways_time_stop': 272, 'sideways_use_sma': True, 'sideways_use_ema': True, 'sideways_use_atr': True, 'sideways_use_adx': True, 'sideways_use_spike': False, 'sideways_rsi_required': True}.
[I 2025-08-31 11:45:15,760] Trial 389 finished with values: [-1000000000.0, 1000000000.0] and parameters: {'p_sma': 28, 'p_std': 19, 'p_atr': 24, 'p_adx': 30, 'rsi_period': 38, 'ema1': 12, 'ema2': 11, 'slip_atr_k': 0.043618329805401486, 'slip_spread_k': 0.29423085360704143, 'spread_hl_frac': 0.017256402560978074, 'bb_std_mult': 2.9817362029425443, 'rsi_os': 36, 'rsi_ob': 63, 'vol_spike': 0.15378038087213508, 'adx_thresh': 13.14226913734027, 'atr_min_pct': 0.003703700134776653, 'atr_max_pct': 0.036555816478573706, 'tp_mult': 1.1203436809455236, 'tsl_mult': 0.3436138993584509, 'strategy': 'breakout', 'time_stop': 295, 'use_sma': False, 'use_atr': True, 'use_adx': False, 'use_ema': False, 'use_spike': True, 'rsi_required': True, 'edge_k': 0.33267932388562493, 'edge_cap': 0.6761267555109435, 'bull_strategy': 'breakout', 'bull_bb_std_mult': 2.4871882136693753, 'bull_rsi_os': 21, 'bull_rsi_ob': 60, 'bull_adx_thresh': 13.692020435543395, 'bull_atr_min_pct': 0.0067296498247484855, 'bull_atr_max_pct': 0.13932467859382922, 'bull_tp_mult': 1.6978219949136362, 'bull_tsl_mult': 0.7649490182339449, 'bull_time_stop': 158, 'bull_use_sma': True, 'bull_use_ema': False, 'bull_use_atr': True, 'bull_use_adx': True, 'bull_use_spike': False, 'bull_rsi_required': False, 'bear_strategy': 'breakout', 'bear_bb_std_mult': 1.1182409081697902, 'bear_rsi_os': 54, 'bear_rsi_ob': 55, 'bear_adx_thresh': 15.854269791068042, 'bear_atr_min_pct': 0.021989209389553534, 'bear_atr_max_pct': 0.12126925611977929, 'bear_tp_mult': 2.5553612728210724, 'bear_tsl_mult': 0.2979612769648211, 'bear_time_stop': 171, 'bear_use_sma': False, 'bear_use_ema': True, 'bear_use_atr': True, 'bear_use_adx': False, 'bear_use_spike': True, 'bear_rsi_required': False, 'sideways_strategy': 'breakout', 'sideways_bb_std_mult': 3.4414218105827272, 'sideways_rsi_os': 35, 'sideways_rsi_ob': 85, 'sideways_adx_thresh': 29.61722758592211, 'sideways_atr_min_pct': 0.014957482673882194, 'sideways_atr_max_pct': 0.06300858679539098, 'sideways_tp_mult': 1.7734202088540818, 'sideways_tsl_mult': 0.5117175380194072, 'sideways_time_stop': 147, 'sideways_use_sma': True, 'sideways_use_ema': True, 'sideways_use_atr': True, 'sideways_use_adx': True, 'sideways_use_spike': False, 'sideways_rsi_required': True}.
[I 2025-08-31 11:45:51,128] Trial 392 finished with values: [-1000000000.0, 1000000000.0] and parameters: {'p_sma': 57, 'p_std': 14, 'p_atr': 26, 'p_adx': 26, 'rsi_period': 52, 'ema1': 11, 'ema2': 51, 'slip_atr_k': 0.06427227138286519, 'slip_spread_k': 0.44470616786285744, 'spread_hl_frac': 0.02779333958582859, 'bb_std_mult': 1.5129612510369757, 'rsi_os': 35, 'rsi_ob': 77, 'vol_spike': 0.15058924220111813, 'adx_thresh': 24.7778513852277, 'atr_min_pct': 0.010717603977574215, 'atr_max_pct': 0.12176969530825424, 'tp_mult': 1.1202910202748677, 'tsl_mult': 0.2970204405399117, 'strategy': 'breakout', 'time_stop': 287, 'use_sma': False, 'use_atr': True, 'use_adx': True, 'use_ema': False, 'use_spike': False, 'rsi_required': True, 'edge_k': 0.003988644566565114, 'edge_cap': 0.8727047560391266, 'bull_strategy': 'breakout', 'bull_bb_std_mult': 0.5047678312370765, 'bull_rsi_os': 25, 'bull_rsi_ob': 60, 'bull_adx_thresh': 26.6987439112368, 'bull_atr_min_pct': 0.008281089077622022, 'bull_atr_max_pct': 0.13900818440119073, 'bull_tp_mult': 1.7920315718092323, 'bull_tsl_mult': 0.6806391563912878, 'bull_time_stop': 159, 'bull_use_sma': True, 'bull_use_ema': True, 'bull_use_atr': True, 'bull_use_adx': True, 'bull_use_spike': False, 'bull_rsi_required': True, 'bear_strategy': 'breakout', 'bear_bb_std_mult': 1.0144987557706509, 'bear_rsi_os': 7, 'bear_rsi_ob': 69, 'bear_adx_thresh': 33.58313650523728, 'bear_atr_min_pct': 0.014444125001933412, 'bear_atr_max_pct': 0.11718921010013056, 'bear_tp_mult': 2.551079937310119, 'bear_tsl_mult': 0.29401357432031905, 'bear_time_stop': 18, 'bear_use_sma': False, 'bear_use_ema': False, 'bear_use_atr': True, 'bear_use_adx': True, 'bear_use_spike': True, 'bear_rsi_required': False, 'sideways_strategy': 'breakout', 'sideways_bb_std_mult': 2.4097474202326525, 'sideways_rsi_os': 32, 'sideways_rsi_ob': 73, 'sideways_adx_thresh': 29.77458064109505, 'sideways_atr_min_pct': 0.0116894490932276, 'sideways_atr_max_pct': 0.05681985979010182, 'sideways_tp_mult': 1.320044970344283, 'sideways_tsl_mult': 0.34417078499974535, 'sideways_time_stop': 10, 'sideways_use_sma': False, 'sideways_use_ema': False, 'sideways_use_atr': True, 'sideways_use_adx': False, 'sideways_use_spike': False, 'sideways_rsi_required': True}.
[I 2025-08-31 11:45:51,463] Trial 393 finished with values: [-1000000000.0, 1000000000.0] and parameters: {'p_sma': 30, 'p_std': 13, 'p_atr': 14, 'p_adx': 25, 'rsi_period': 52, 'ema1': 11, 'ema2': 54, 'slip_atr_k': 0.09290193740472835, 'slip_spread_k': 0.09041712183904362, 'spread_hl_frac': 0.003146481470762907, 'bb_std_mult': 0.8652923593896751, 'rsi_os': 47, 'rsi_ob': 70, 'vol_spike': 0.2008649966611326, 'adx_thresh': 25.14802217168455, 'atr_min_pct': 0.017437616952224497, 'atr_max_pct': 0.13506099176426833, 'tp_mult': 1.0512717983189404, 'tsl_mult': 0.7422270624663034, 'strategy': 'breakout', 'time_stop': 285, 'use_sma': False, 'use_atr': True, 'use_adx': True, 'use_ema': False, 'use_spike': False, 'rsi_required': True, 'edge_k': 0.017453522724256487, 'edge_cap': 0.8758391477628251, 'bull_strategy': 'breakout', 'bull_bb_std_mult': 1.6243091602509865, 'bull_rsi_os': 36, 'bull_rsi_ob': 55, 'bull_adx_thresh': 14.283530346405518, 'bull_atr_min_pct': 0.008462632477064178, 'bull_atr_max_pct': 0.1089445823501598, 'bull_tp_mult': 2.9198363989329166, 'bull_tsl_mult': 0.678647248004655, 'bull_time_stop': 163, 'bull_use_sma': False, 'bull_use_ema': True, 'bull_use_atr': True, 'bull_use_adx': True, 'bull_use_spike': False, 'bull_rsi_required': True, 'bear_strategy': 'breakout', 'bear_bb_std_mult': 1.9904284245058652, 'bear_rsi_os': 33, 'bear_rsi_ob': 54, 'bear_adx_thresh': 5.420271145588108, 'bear_atr_min_pct': 0.02749195607386889, 'bear_atr_max_pct': 0.08513419350248397, 'bear_tp_mult': 2.6563607099565414, 'bear_tsl_mult': 0.3560377293402312, 'bear_time_stop': 186, 'bear_use_sma': False, 'bear_use_ema': True, 'bear_use_atr': True, 'bear_use_adx': True, 'bear_use_spike': True, 'bear_rsi_required': False, 'sideways_strategy': 'breakout', 'sideways_bb_std_mult': 1.6065375422092554, 'sideways_rsi_os': 32, 'sideways_rsi_ob': 86, 'sideways_adx_thresh': 8.457778384425405, 'sideways_atr_min_pct': 0.029936602510296242, 'sideways_atr_max_pct': 0.0461395021644098, 'sideways_tp_mult': 1.311521449160516, 'sideways_tsl_mult': 0.028529975320264966, 'sideways_time_stop': 98, 'sideways_use_sma': False, 'sideways_use_ema': False, 'sideways_use_atr': True, 'sideways_use_adx': False, 'sideways_use_spike': False, 'sideways_rsi_required': True}.
[I 2025-08-31 11:45:52,418] Trial 390 finished with values: [-1000000000.0, 1000000000.0] and parameters: {'p_sma': 28, 'p_std': 54, 'p_atr': 14, 'p_adx': 25, 'rsi_period': 52, 'ema1': 24, 'ema2': 11, 'slip_atr_k': 0.043905874599553016, 'slip_spread_k': 0.49278348850404463, 'spread_hl_frac': 0.010481267795147936, 'bb_std_mult': 0.8774879445747006, 'rsi_os': 33, 'rsi_ob': 70, 'vol_spike': 0.1525926363770981, 'adx_thresh': 24.21448464835441, 'atr_min_pct': 0.020757224195768326, 'atr_max_pct': 0.13483102732725166, 'tp_mult': 1.1142190998701182, 'tsl_mult': 0.3505348205745172, 'strategy': 'breakout', 'time_stop': 124, 'use_sma': False, 'use_atr': True, 'use_adx': False, 'use_ema': False, 'use_spike': True, 'rsi_required': True, 'edge_k': 0.3479624702823151, 'edge_cap': 0.8360772599262754, 'bull_strategy': 'breakout', 'bull_bb_std_mult': 1.9376576081686188, 'bull_rsi_os': 11, 'bull_rsi_ob': 65, 'bull_adx_thresh': 26.377734681689276, 'bull_atr_min_pct': 0.006657608796070555, 'bull_atr_max_pct': 0.016374605808507706, 'bull_tp_mult': 2.9165372522056225, 'bull_tsl_mult': 0.31179224389751903, 'bull_time_stop': 223, 'bull_use_sma': True, 'bull_use_ema': False, 'bull_use_atr': True, 'bull_use_adx': True, 'bull_use_spike': False, 'bull_rsi_required': False, 'bear_strategy': 'breakout', 'bear_bb_std_mult': 1.1462293881187935, 'bear_rsi_os': 7, 'bear_rsi_ob': 56, 'bear_adx_thresh': 21.521961668648043, 'bear_atr_min_pct': 0.015560778345948151, 'bear_atr_max_pct': 0.12139766517844068, 'bear_tp_mult': 2.656400948039489, 'bear_tsl_mult': 0.3534992247384398, 'bear_time_stop': 172, 'bear_use_sma': False, 'bear_use_ema': True, 'bear_use_atr': True, 'bear_use_adx': False, 'bear_use_spike': True, 'bear_rsi_required': False, 'sideways_strategy': 'breakout', 'sideways_bb_std_mult': 0.5111854677267194, 'sideways_rsi_os': 13, 'sideways_rsi_ob': 73, 'sideways_adx_thresh': 8.371915274782328, 'sideways_atr_min_pct': 0.003879024801991365, 'sideways_atr_max_pct': 0.07287334155847869, 'sideways_tp_mult': 1.3239108337692818, 'sideways_tsl_mult': 0.5121536070588303, 'sideways_time_stop': 10, 'sideways_use_sma': False, 'sideways_use_ema': True, 'sideways_use_atr': True, 'sideways_use_adx': True, 'sideways_use_spike': False, 'sideways_rsi_required': True}.
[I 2025-08-31 11:45:52,690] Trial 391 finished with values: [-1000000000.0, 1000000000.0] and parameters: {'p_sma': 29, 'p_std': 54, 'p_atr': 14, 'p_adx': 25, 'rsi_period': 31, 'ema1': 12, 'ema2': 30, 'slip_atr_k': 0.04393905351882147, 'slip_spread_k': 0.13443651268135268, 'spread_hl_frac': 0.027281711493525086, 'bb_std_mult': 1.4699823368502432, 'rsi_os': 36, 'rsi_ob': 70, 'vol_spike': 0.15301537649826782, 'adx_thresh': 24.57941395068311, 'atr_min_pct': 0.010930878457464262, 'atr_max_pct': 0.13562673377357126, 'tp_mult': 2.477251652707699, 'tsl_mult': 0.35663958710801524, 'strategy': 'breakout', 'time_stop': 183, 'use_sma': False, 'use_atr': True, 'use_adx': False, 'use_ema': False, 'use_spike': True, 'rsi_required': True, 'edge_k': 0.3537048056067083, 'edge_cap': 0.8351863081331063, 'bull_strategy': 'breakout', 'bull_bb_std_mult': 1.303434611874871, 'bull_rsi_os': 11, 'bull_rsi_ob': 79, 'bull_adx_thresh': 13.739408388927622, 'bull_atr_min_pct': 0.006851815947828353, 'bull_atr_max_pct': 0.04982481978027897, 'bull_tp_mult': 1.4903908320284245, 'bull_tsl_mult': 0.7696460198703438, 'bull_time_stop': 158, 'bull_use_sma': True, 'bull_use_ema': False, 'bull_use_atr': True, 'bull_use_adx': True, 'bull_use_spike': False, 'bull_rsi_required': False, 'bear_strategy': 'breakout', 'bear_bb_std_mult': 1.0392242915070835, 'bear_rsi_os': 33, 'bear_rsi_ob': 55, 'bear_adx_thresh': 33.28574922185976, 'bear_atr_min_pct': 0.02750421459532467, 'bear_atr_max_pct': 0.11714404930584457, 'bear_tp_mult': 2.5458202652845516, 'bear_tsl_mult': 0.34715735154830746, 'bear_time_stop': 174, 'bear_use_sma': False, 'bear_use_ema': True, 'bear_use_atr': True, 'bear_use_adx': False, 'bear_use_spike': True, 'bear_rsi_required': False, 'sideways_strategy': 'breakout', 'sideways_bb_std_mult': 2.394587325931562, 'sideways_rsi_os': 32, 'sideways_rsi_ob': 73, 'sideways_adx_thresh': 8.383671392465876, 'sideways_atr_min_pct': 0.029879039352726143, 'sideways_atr_max_pct': 0.12786896922272828, 'sideways_tp_mult': 1.816680626637105, 'sideways_tsl_mult': 0.3776751342937735, 'sideways_time_stop': 31, 'sideways_use_sma': False, 'sideways_use_ema': True, 'sideways_use_atr': True, 'sideways_use_adx': True, 'sideways_use_spike': False, 'sideways_rsi_required': True}.
[I 2025-08-31 11:46:26,160] Trial 397 finished with values: [-1000000000.0, 1000000000.0] and parameters: {'p_sma': 51, 'p_std': 17, 'p_atr': 13, 'p_adx': 27, 'rsi_period': 47, 'ema1': 13, 'ema2': 34, 'slip_atr_k': 0.05999233865779567, 'slip_spread_k': 0.06968405100909131, 'spread_hl_frac': 0.002922757252072918, 'bb_std_mult': 0.6574057387042134, 'rsi_os': 33, 'rsi_ob': 53, 'vol_spike': 0.17928823359401683, 'adx_thresh': 22.5797770147219, 'atr_min_pct': 0.005460131940447798, 'atr_max_pct': 0.05367105802239233, 'tp_mult': 1.0581691620930596, 'tsl_mult': 0.8915943792919722, 'strategy': 'mean_reversion', 'time_stop': 216, 'use_sma': True, 'use_atr': False, 'use_adx': True, 'use_ema': True, 'use_spike': True, 'rsi_required': False, 'edge_k': 0.42626692549961137, 'edge_cap': 0.1346077212652808, 'bull_strategy': 'mean_reversion', 'bull_bb_std_mult': 2.8147703566957856, 'bull_rsi_os': 15, 'bull_rsi_ob': 63, 'bull_adx_thresh': 12.599493964405518, 'bull_atr_min_pct': 0.0020657216986755683, 'bull_atr_max_pct': 0.04202725150821138, 'bull_tp_mult': 2.526356188333945, 'bull_tsl_mult': 0.7983169410136647, 'bull_time_stop': 278, 'bull_use_sma': False, 'bull_use_ema': True, 'bull_use_atr': False, 'bull_use_adx': True, 'bull_use_spike': True, 'bull_rsi_required': True, 'bear_strategy': 'mean_reversion', 'bear_bb_std_mult': 2.1728455199582624, 'bear_rsi_os': 32, 'bear_rsi_ob': 72, 'bear_adx_thresh': 31.786795928667466, 'bear_atr_min_pct': 0.013283691038381113, 'bear_atr_max_pct': 0.11282924686897579, 'bear_tp_mult': 1.0475722273976142, 'bear_tsl_mult': 0.420579797753604, 'bear_time_stop': 192, 'bear_use_sma': False, 'bear_use_ema': False, 'bear_use_atr': False, 'bear_use_adx': False, 'bear_use_spike': False, 'bear_rsi_required': True, 'sideways_strategy': 'breakout', 'sideways_bb_std_mult': 1.9731408213419281, 'sideways_rsi_os': 5, 'sideways_rsi_ob': 75, 'sideways_adx_thresh': 9.540274988944255, 'sideways_atr_min_pct': 0.0028813532679673837, 'sideways_atr_max_pct': 0.13612500089920523, 'sideways_tp_mult': 1.375159653523736, 'sideways_tsl_mult': 0.5854195416704415, 'sideways_time_stop': 14, 'sideways_use_sma': True, 'sideways_use_ema': False, 'sideways_use_atr': False, 'sideways_use_adx': True, 'sideways_use_spike': False, 'sideways_rsi_required': False}.
[I 2025-08-31 11:46:26,195] Trial 395 finished with values: [-0.04235035671857601, 0.04204781631561513] and parameters: {'p_sma': 30, 'p_std': 17, 'p_atr': 13, 'p_adx': 23, 'rsi_period': 59, 'ema1': 13, 'ema2': 34, 'slip_atr_k': 0.12137497548820639, 'slip_spread_k': 0.4902181126167488, 'spread_hl_frac': 0.010982887854675289, 'bb_std_mult': 0.6468475502988856, 'rsi_os': 13, 'rsi_ob': 72, 'vol_spike': 0.16879274634083188, 'adx_thresh': 26.19575774435655, 'atr_min_pct': 0.023136780021490312, 'atr_max_pct': 0.09290154618112922, 'tp_mult': 1.0117208087594278, 'tsl_mult': 0.318737815205685, 'strategy': 'breakout', 'time_stop': 290, 'use_sma': False, 'use_atr': True, 'use_adx': True, 'use_ema': False, 'use_spike': True, 'rsi_required': True, 'edge_k': 0.42818010653309674, 'edge_cap': 0.833478903316241, 'bull_strategy': 'breakout', 'bull_bb_std_mult': 2.7777740154634696, 'bull_rsi_os': 11, 'bull_rsi_ob': 63, 'bull_adx_thresh': 22.492645385619625, 'bull_atr_min_pct': 0.002247081307120905, 'bull_atr_max_pct': 0.14692954140152992, 'bull_tp_mult': 2.5493041298949057, 'bull_tsl_mult': 0.9066338208757208, 'bull_time_stop': 144, 'bull_use_sma': True, 'bull_use_ema': True, 'bull_use_atr': True, 'bull_use_adx': True, 'bull_use_spike': False, 'bull_rsi_required': True, 'bear_strategy': 'breakout', 'bear_bb_std_mult': 1.2644573439425144, 'bear_rsi_os': 32, 'bear_rsi_ob': 53, 'bear_adx_thresh': 31.67795539933923, 'bear_atr_min_pct': 0.005430724567803061, 'bear_atr_max_pct': 0.11251854614107608, 'bear_tp_mult': 2.7450533591131623, 'bear_tsl_mult': 0.42200747743150296, 'bear_time_stop': 106, 'bear_use_sma': False, 'bear_use_ema': True, 'bear_use_atr': True, 'bear_use_adx': False, 'bear_use_spike': True, 'bear_rsi_required': False, 'sideways_strategy': 'breakout', 'sideways_bb_std_mult': 1.9534651837076655, 'sideways_rsi_os': 13, 'sideways_rsi_ob': 75, 'sideways_adx_thresh': 8.184265888681837, 'sideways_atr_min_pct': 0.012396078845619492, 'sideways_atr_max_pct': 0.037817659772623864, 'sideways_tp_mult': 2.4699469270597207, 'sideways_tsl_mult': 0.32727493505687805, 'sideways_time_stop': 10, 'sideways_use_sma': True, 'sideways_use_ema': False, 'sideways_use_atr': False, 'sideways_use_adx': True, 'sideways_use_spike': False, 'sideways_rsi_required': True}.
