[I 2025-08-31 11:32:34,635] Trial 288 finished with values: [-1000000000.0, 1000000000.0] and parameters: {'p_sma': 22, 'p_std': 17, 'p_atr': 14, 'p_adx': 25, 'rsi_period': 46, 'ema1': 13, 'ema2': 38, 'slip_atr_k': 0.044115765267784046, 'slip_spread_k': 0.06217994684143988, 'spread_hl_frac': 0.025129159836495933, 'bb_std_mult': 0.6171443146336928, 'rsi_os': 34, 'rsi_ob': 61, 'vol_spike': 0.18795660470419562, 'adx_thresh': 26.894984761600814, 'atr_min_pct': 0.028010608558900307, 'atr_max_pct': 0.042716566472442874, 'tp_mult': 1.9186942573492562, 'tsl_mult': 0.27876274255526745, 'strategy': 'breakout', 'time_stop': 190, 'use_sma': False, 'use_atr': True, 'use_adx': True, 'use_ema': True, 'use_spike': True, 'rsi_required': True, 'edge_k': 1.4993144705106651, 'edge_cap': 0.3945025040924842, 'bull_strategy': 'breakout', 'bull_bb_std_mult': 2.5028581021204306, 'bull_rsi_os': 47, 'bull_rsi_ob': 62, 'bull_adx_thresh': 14.209740284230014, 'bull_atr_min_pct': 0.004464046404417648, 'bull_atr_max_pct': 0.14370517199994473, 'bull_tp_mult': 2.0853892850598097, 'bull_tsl_mult': 0.10294814279593495, 'bull_time_stop': 143, 'bull_use_sma': True, 'bull_use_ema': True, 'bull_use_atr': True, 'bull_use_adx': True, 'bull_use_spike': False, 'bull_rsi_required': True, 'bear_strategy': 'breakout', 'bear_bb_std_mult': 1.0532631269869757, 'bear_rsi_os': 31, 'bear_rsi_ob': 55, 'bear_adx_thresh': 32.648976466392135, 'bear_atr_min_pct': 0.014931120505884304, 'bear_atr_max_pct': 0.012165824009438317, 'bear_tp_mult': 1.4688426044572225, 'bear_tsl_mult': 0.5745810886893472, 'bear_time_stop': 166, 'bear_use_sma': False, 'bear_use_ema': True, 'bear_use_atr': True, 'bear_use_adx': False, 'bear_use_spike': True, 'bear_rsi_required': True, 'sideways_strategy': 'breakout', 'sideways_bb_std_mult': 1.790906391161529, 'sideways_rsi_os': 38, 'sideways_rsi_ob': 74, 'sideways_adx_thresh': 9.653197362753684, 'sideways_atr_min_pct': 0.012593776398169275, 'sideways_atr_max_pct': 0.10143147801354432, 'sideways_tp_mult': 1.3770791519856531, 'sideways_tsl_mult': 0.2715672526620338, 'sideways_time_stop': 10, 'sideways_use_sma': True, 'sideways_use_ema': False, 'sideways_use_atr': True, 'sideways_use_adx': True, 'sideways_use_spike': True, 'sideways_rsi_required': True}.
[I 2025-08-31 11:32:35,282] Trial 290 finished with values: [-1000000000.0, 1000000000.0] and parameters: {'p_sma': 20, 'p_std': 15, 'p_atr': 13, 'p_adx': 27, 'rsi_period': 46, 'ema1': 12, 'ema2': 31, 'slip_atr_k': 0.19752728238068556, 'slip_spread_k': 0.10218554303939917, 'spread_hl_frac': 0.024715670964939197, 'bb_std_mult': 0.6967678931379759, 'rsi_os': 6, 'rsi_ob': 68, 'vol_spike': 0.0001570120808415676, 'adx_thresh': 25.929537210263824, 'atr_min_pct': 0.019829455047707546, 'atr_max_pct': 0.012337925302773304, 'tp_mult': 1.0449436141345545, 'tsl_mult': 0.2511640978146417, 'strategy': 'breakout', 'time_stop': 300, 'use_sma': False, 'use_atr': True, 'use_adx': True, 'use_ema': False, 'use_spike': True, 'rsi_required': False, 'edge_k': 0.39464011036782143, 'edge_cap': 0.5320500064488305, 'bull_strategy': 'breakout', 'bull_bb_std_mult': 2.4901838977655952, 'bull_rsi_os': 10, 'bull_rsi_ob': 62, 'bull_adx_thresh': 22.64563992047961, 'bull_atr_min_pct': 0.005075203136761433, 'bull_atr_max_pct': 0.1424989065175778, 'bull_tp_mult': 1.0641256196078581, 'bull_tsl_mult': 0.22053676150798412, 'bull_time_stop': 143, 'bull_use_sma': True, 'bull_use_ema': True, 'bull_use_atr': True, 'bull_use_adx': True, 'bull_use_spike': False, 'bull_rsi_required': False, 'bear_strategy': 'breakout', 'bear_bb_std_mult': 1.1388094225780594, 'bear_rsi_os': 31, 'bear_rsi_ob': 56, 'bear_adx_thresh': 8.14643510321001, 'bear_atr_min_pct': 0.015124852175644757, 'bear_atr_max_pct': 0.11861421225219693, 'bear_tp_mult': 1.5520814174305042, 'bear_tsl_mult': 0.3840295172972275, 'bear_time_stop': 165, 'bear_use_sma': False, 'bear_use_ema': True, 'bear_use_atr': True, 'bear_use_adx': False, 'bear_use_spike': True, 'bear_rsi_required': False, 'sideways_strategy': 'mean_reversion', 'sideways_bb_std_mult': 2.209160137607581, 'sideways_rsi_os': 38, 'sideways_rsi_ob': 92, 'sideways_adx_thresh': 28.33057332311704, 'sideways_atr_min_pct': 0.005396177345839508, 'sideways_atr_max_pct': 0.044033654247312835, 'sideways_tp_mult': 1.887233698428623, 'sideways_tsl_mult': 0.35776659806072725, 'sideways_time_stop': 221, 'sideways_use_sma': True, 'sideways_use_ema': False, 'sideways_use_atr': True, 'sideways_use_adx': True, 'sideways_use_spike': True, 'sideways_rsi_required': True}.
[I 2025-08-31 11:32:35,326] Trial 291 finished with values: [-1000000000.0, 1000000000.0] and parameters: {'p_sma': 56, 'p_std': 14, 'p_atr': 13, 'p_adx': 28, 'rsi_period': 46, 'ema1': 12, 'ema2': 51, 'slip_atr_k': 0.19920339489977495, 'slip_spread_k': 0.06165065692471011, 'spread_hl_frac': 0.03082045224462421, 'bb_std_mult': 0.6945742999967157, 'rsi_os': 34, 'rsi_ob': 68, 'vol_spike': 0.2953964125697929, 'adx_thresh': 6.3063021576232625, 'atr_min_pct': 0.020035866510447926, 'atr_max_pct': 0.012610796404510152, 'tp_mult': 1.062393902150887, 'tsl_mult': 0.25530249292618534, 'strategy': 'mean_reversion', 'time_stop': 286, 'use_sma': False, 'use_atr': True, 'use_adx': True, 'use_ema': True, 'use_spike': True, 'rsi_required': False, 'edge_k': 1.4950558045451225, 'edge_cap': 0.8848717433478334, 'bull_strategy': 'breakout', 'bull_bb_std_mult': 2.596071796579801, 'bull_rsi_os': 10, 'bull_rsi_ob': 63, 'bull_adx_thresh': 13.574749042488207, 'bull_atr_min_pct': 0.0049907979625296965, 'bull_atr_max_pct': 0.14008957641978897, 'bull_tp_mult': 1.5461679886826498, 'bull_tsl_mult': 0.2756037476706604, 'bull_time_stop': 146, 'bull_use_sma': True, 'bull_use_ema': True, 'bull_use_atr': True, 'bull_use_adx': True, 'bull_use_spike': True, 'bull_rsi_required': False, 'bear_strategy': 'breakout', 'bear_bb_std_mult': 1.1631763729112092, 'bear_rsi_os': 50, 'bear_rsi_ob': 56, 'bear_adx_thresh': 24.90637197069492, 'bear_atr_min_pct': 0.015185376416428292, 'bear_atr_max_pct': 0.12253280859699428, 'bear_tp_mult': 1.4780698448768095, 'bear_tsl_mult': 0.5709240375982544, 'bear_time_stop': 175, 'bear_use_sma': False, 'bear_use_ema': True, 'bear_use_atr': False, 'bear_use_adx': True, 'bear_use_spike': False, 'bear_rsi_required': True, 'sideways_strategy': 'mean_reversion', 'sideways_bb_std_mult': 2.1983761861166737, 'sideways_rsi_os': 31, 'sideways_rsi_ob': 47, 'sideways_adx_thresh': 7.969589686273373, 'sideways_atr_min_pct': 0.012991007993704, 'sideways_atr_max_pct': 0.04071760497258784, 'sideways_tp_mult': 1.447285739554, 'sideways_tsl_mult': 0.356081576465686, 'sideways_time_stop': 232, 'sideways_use_sma': True, 'sideways_use_ema': False, 'sideways_use_atr': True, 'sideways_use_adx': True, 'sideways_use_spike': True, 'sideways_rsi_required': True}.
[I 2025-08-31 11:32:35,370] Trial 292 finished with values: [-1000000000.0, 1000000000.0] and parameters: {'p_sma': 36, 'p_std': 14, 'p_atr': 13, 'p_adx': 28, 'rsi_period': 53, 'ema1': 30, 'ema2': 43, 'slip_atr_k': 0.19944582595650975, 'slip_spread_k': 0.10460844015046696, 'spread_hl_frac': 0.003383294477968204, 'bb_std_mult': 0.7033223241668656, 'rsi_os': 50, 'rsi_ob': 58, 'vol_spike': 0.1266589496092361, 'adx_thresh': 25.68422056187822, 'atr_min_pct': 0.02379389882046474, 'atr_max_pct': 0.010008973280128028, 'tp_mult': 1.0345636496401147, 'tsl_mult': 0.8120579262952237, 'strategy': 'mean_reversion', 'time_stop': 286, 'use_sma': False, 'use_atr': True, 'use_adx': True, 'use_ema': False, 'use_spike': True, 'rsi_required': False, 'edge_k': 0.39270676905050156, 'edge_cap': 0.8848357818719339, 'bull_strategy': 'breakout', 'bull_bb_std_mult': 2.4815984318405384, 'bull_rsi_os': 30, 'bull_rsi_ob': 51, 'bull_adx_thresh': 33.61467575591627, 'bull_atr_min_pct': 0.0051228808663386655, 'bull_atr_max_pct': 0.13955679113542513, 'bull_tp_mult': 1.8980199781238964, 'bull_tsl_mult': 0.6636115484871316, 'bull_time_stop': 157, 'bull_use_sma': True, 'bull_use_ema': True, 'bull_use_atr': False, 'bull_use_adx': True, 'bull_use_spike': True, 'bull_rsi_required': False, 'bear_strategy': 'breakout', 'bear_bb_std_mult': 3.3546723104345113, 'bear_rsi_os': 50, 'bear_rsi_ob': 56, 'bear_adx_thresh': 31.16883894357772, 'bear_atr_min_pct': 0.01646856758665062, 'bear_atr_max_pct': 0.11872779781545344, 'bear_tp_mult': 2.6572857809806, 'bear_tsl_mult': 0.38221014269374537, 'bear_time_stop': 191, 'bear_use_sma': False, 'bear_use_ema': True, 'bear_use_atr': False, 'bear_use_adx': True, 'bear_use_spike': False, 'bear_rsi_required': False, 'sideways_strategy': 'mean_reversion', 'sideways_bb_std_mult': 1.6283536133314873, 'sideways_rsi_os': 30, 'sideways_rsi_ob': 90, 'sideways_adx_thresh': 8.27278656074248, 'sideways_atr_min_pct': 0.008100184490376982, 'sideways_atr_max_pct': 0.04239401288763825, 'sideways_tp_mult': 1.873666896096568, 'sideways_tsl_mult': 0.3559277455900285, 'sideways_time_stop': 23, 'sideways_use_sma': True, 'sideways_use_ema': False, 'sideways_use_atr': True, 'sideways_use_adx': False, 'sideways_use_spike': True, 'sideways_rsi_required': True}.
[I 2025-08-31 11:32:53,308] Trial 289 finished with values: [-1000000000.0, 1000000000.0] and parameters: {'p_sma': 19, 'p_std': 17, 'p_atr': 14, 'p_adx': 26, 'rsi_period': 54, 'ema1': 24, 'ema2': 22, 'slip_atr_k': 0.19905992382147475, 'slip_spread_k': 0.10373704918398222, 'spread_hl_frac': 0.0038368515139065185, 'bb_std_mult': 0.6815484318070087, 'rsi_os': 6, 'rsi_ob': 68, 'vol_spike': 0.18053800804045358, 'adx_thresh': 25.73347522053699, 'atr_min_pct': 0.023865639155400187, 'atr_max_pct': 0.041495116400760604, 'tp_mult': 1.0409560789637082, 'tsl_mult': 0.27619922865680974, 'strategy': 'breakout', 'time_stop': 300, 'use_sma': False, 'use_atr': True, 'use_adx': True, 'use_ema': True, 'use_spike': True, 'rsi_required': True, 'edge_k': 0.6533860097817645, 'edge_cap': 0.4290407476489312, 'bull_strategy': 'breakout', 'bull_bb_std_mult': 2.4852774009270995, 'bull_rsi_os': 40, 'bull_rsi_ob': 51, 'bull_adx_thresh': 13.363835010312005, 'bull_atr_min_pct': 0.004282402815311177, 'bull_atr_max_pct': 0.14348988694578585, 'bull_tp_mult': 1.9038569924799216, 'bull_tsl_mult': 0.38109001512577345, 'bull_time_stop': 72, 'bull_use_sma': False, 'bull_use_ema': True, 'bull_use_atr': True, 'bull_use_adx': True, 'bull_use_spike': False, 'bull_rsi_required': True, 'bear_strategy': 'breakout', 'bear_bb_std_mult': 1.0550680658799407, 'bear_rsi_os': 31, 'bear_rsi_ob': 54, 'bear_adx_thresh': 14.605740213951638, 'bear_atr_min_pct': 0.015008701897135046, 'bear_atr_max_pct': 0.11171090573980828, 'bear_tp_mult': 1.561848839447347, 'bear_tsl_mult': 0.5764896580948785, 'bear_time_stop': 208, 'bear_use_sma': False, 'bear_use_ema': True, 'bear_use_atr': True, 'bear_use_adx': False, 'bear_use_spike': True, 'bear_rsi_required': True, 'sideways_strategy': 'mean_reversion', 'sideways_bb_std_mult': 3.2770327124463297, 'sideways_rsi_os': 40, 'sideways_rsi_ob': 92, 'sideways_adx_thresh': 9.973002232543736, 'sideways_atr_min_pct': 0.007914207350951729, 'sideways_atr_max_pct': 0.0843391051507966, 'sideways_tp_mult': 1.3881752906810183, 'sideways_tsl_mult': 0.359084850555102, 'sideways_time_stop': 23, 'sideways_use_sma': True, 'sideways_use_ema': False, 'sideways_use_atr': True, 'sideways_use_adx': True, 'sideways_use_spike': True, 'sideways_rsi_required': True}.
[I 2025-08-31 11:33:10,354] Trial 293 finished with values: [-1000000000.0, 1000000000.0] and parameters: {'p_sma': 23, 'p_std': 14, 'p_atr': 13, 'p_adx': 28, 'rsi_period': 53, 'ema1': 11, 'ema2': 34, 'slip_atr_k': 0.03591444948751076, 'slip_spread_k': 0.09982940780203849, 'spread_hl_frac': 0.006616381263140187, 'bb_std_mult': 0.7417404666264001, 'rsi_os': 32, 'rsi_ob': 58, 'vol_spike': 0.18199303955343443, 'adx_thresh': 14.514843289430933, 'atr_min_pct': 0.01563084935707393, 'atr_max_pct': 0.03641795097387368, 'tp_mult': 1.0363190529624662, 'tsl_mult': 0.8240768979185749, 'strategy': 'mean_reversion', 'time_stop': 285, 'use_sma': False, 'use_atr': False, 'use_adx': True, 'use_ema': False, 'use_spike': True, 'rsi_required': True, 'edge_k': 0.34095140839159654, 'edge_cap': 0.4659455545734771, 'bull_strategy': 'breakout', 'bull_bb_std_mult': 2.588568229580158, 'bull_rsi_os': 24, 'bull_rsi_ob': 67, 'bull_adx_thresh': 13.328636574685904, 'bull_atr_min_pct': 0.005830712871889121, 'bull_atr_max_pct': 0.1383906612837786, 'bull_tp_mult': 1.5412579077054167, 'bull_tsl_mult': 0.6703736702707433, 'bull_time_stop': 282, 'bull_use_sma': True, 'bull_use_ema': True, 'bull_use_atr': False, 'bull_use_adx': True, 'bull_use_spike': True, 'bull_rsi_required': True, 'bear_strategy': 'breakout', 'bear_bb_std_mult': 3.478152354056106, 'bear_rsi_os': 32, 'bear_rsi_ob': 54, 'bear_adx_thresh': 23.901796486234034, 'bear_atr_min_pct': 0.016472038939457836, 'bear_atr_max_pct': 0.1222096125097131, 'bear_tp_mult': 2.136662798330135, 'bear_tsl_mult': 0.3522061525773781, 'bear_time_stop': 175, 'bear_use_sma': False, 'bear_use_ema': True, 'bear_use_atr': False, 'bear_use_adx': True, 'bear_use_spike': False, 'bear_rsi_required': False, 'sideways_strategy': 'mean_reversion', 'sideways_bb_std_mult': 3.478413919237983, 'sideways_rsi_os': 30, 'sideways_rsi_ob': 46, 'sideways_adx_thresh': 7.678656521947412, 'sideways_atr_min_pct': 0.00334704090123464, 'sideways_atr_max_pct': 0.08556587917006528, 'sideways_tp_mult': 1.4525696274525095, 'sideways_tsl_mult': 0.3395155151714584, 'sideways_time_stop': 21, 'sideways_use_sma': True, 'sideways_use_ema': True, 'sideways_use_atr': True, 'sideways_use_adx': False, 'sideways_use_spike': False, 'sideways_rsi_required': True}.
[I 2025-08-31 11:33:10,608] Trial 294 finished with values: [-1000000000.0, 1000000000.0] and parameters: {'p_sma': 52, 'p_std': 16, 'p_atr': 14, 'p_adx': 26, 'rsi_period': 61, 'ema1': 11, 'ema2': 34, 'slip_atr_k': 0.05096645505036955, 'slip_spread_k': 0.09914695518457453, 'spread_hl_frac': 0.0051638378371230975, 'bb_std_mult': 1.8676861050058284, 'rsi_os': 24, 'rsi_ob': 51, 'vol_spike': 0.12528868958494302, 'adx_thresh': 24.801674466333857, 'atr_min_pct': 0.023855799790849577, 'atr_max_pct': 0.04745022764838587, 'tp_mult': 1.041024901539562, 'tsl_mult': 0.8155335572747362, 'strategy': 'mean_reversion', 'time_stop': 294, 'use_sma': False, 'use_atr': False, 'use_adx': True, 'use_ema': False, 'use_spike': True, 'rsi_required': True, 'edge_k': 0.3368337565289972, 'edge_cap': 0.14401077936663714, 'bull_strategy': 'mean_reversion', 'bull_bb_std_mult': 3.357695345264805, 'bull_rsi_os': 35, 'bull_rsi_ob': 67, 'bull_adx_thresh': 13.28249599844002, 'bull_atr_min_pct': 0.00554647353462313, 'bull_atr_max_pct': 0.1376542128277046, 'bull_tp_mult': 2.3383743545600058, 'bull_tsl_mult': 0.8073734119126842, 'bull_time_stop': 155, 'bull_use_sma': True, 'bull_use_ema': True, 'bull_use_atr': False, 'bull_use_adx': True, 'bull_use_spike': False, 'bull_rsi_required': True, 'bear_strategy': 'breakout', 'bear_bb_std_mult': 0.859308508489122, 'bear_rsi_os': 9, 'bear_rsi_ob': 54, 'bear_adx_thresh': 14.350458339563664, 'bear_atr_min_pct': 0.016510492920784683, 'bear_atr_max_pct': 0.11811951883977635, 'bear_tp_mult': 2.67202093262881, 'bear_tsl_mult': 0.3445371958758621, 'bear_time_stop': 186, 'bear_use_sma': False, 'bear_use_ema': True, 'bear_use_atr': True, 'bear_use_adx': False, 'bear_use_spike': True, 'bear_rsi_required': False, 'sideways_strategy': 'breakout', 'sideways_bb_std_mult': 3.291923082643515, 'sideways_rsi_os': 29, 'sideways_rsi_ob': 73, 'sideways_adx_thresh': 13.994309439753938, 'sideways_atr_min_pct': 0.007022860323636413, 'sideways_atr_max_pct': 0.1252742544181216, 'sideways_tp_mult': 1.312307319533045, 'sideways_tsl_mult': 0.38140724118070035, 'sideways_time_stop': 24, 'sideways_use_sma': True, 'sideways_use_ema': True, 'sideways_use_atr': True, 'sideways_use_adx': False, 'sideways_use_spike': False, 'sideways_rsi_required': False}.
[I 2025-08-31 11:33:10,810] Trial 295 finished with values: [-1000000000.0, 1000000000.0] and parameters: {'p_sma': 11, 'p_std': 16, 'p_atr': 14, 'p_adx': 11, 'rsi_period': 22, 'ema1': 5, 'ema2': 41, 'slip_atr_k': 0.050803338622116445, 'slip_spread_k': 0.8853979055271586, 'spread_hl_frac': 0.0071186695951362304, 'bb_std_mult': 1.7730022098274327, 'rsi_os': 33, 'rsi_ob': 51, 'vol_spike': 0.17997262230585312, 'adx_thresh': 8.722652307883845, 'atr_min_pct': 0.0037315819595826446, 'atr_max_pct': 0.03727743410387607, 'tp_mult': 1.160827712754637, 'tsl_mult': 0.6385316582897557, 'strategy': 'breakout', 'time_stop': 155, 'use_sma': False, 'use_atr': False, 'use_adx': True, 'use_ema': False, 'use_spike': True, 'rsi_required': True, 'edge_k': 0.3499072173924638, 'edge_cap': 0.5608968145956265, 'bull_strategy': 'mean_reversion', 'bull_bb_std_mult': 3.3908323375329736, 'bull_rsi_os': 22, 'bull_rsi_ob': 95, 'bull_adx_thresh': 13.119067435488628, 'bull_atr_min_pct': 0.0055539551908767365, 'bull_atr_max_pct': 0.14612054859348206, 'bull_tp_mult': 1.3791411451602436, 'bull_tsl_mult': 0.3805250569803026, 'bull_time_stop': 79, 'bull_use_sma': True, 'bull_use_ema': True, 'bull_use_atr': False, 'bull_use_adx': True, 'bull_use_spike': False, 'bull_rsi_required': True, 'bear_strategy': 'breakout', 'bear_bb_std_mult': 1.0070306794717272, 'bear_rsi_os': 26, 'bear_rsi_ob': 54, 'bear_adx_thresh': 8.783470906587953, 'bear_atr_min_pct': 0.01566242210299116, 'bear_atr_max_pct': 0.019550299551062564, 'bear_tp_mult': 2.6749850167491496, 'bear_tsl_mult': 0.3551167172846841, 'bear_time_stop': 133, 'bear_use_sma': False, 'bear_use_ema': True, 'bear_use_atr': True, 'bear_use_adx': False, 'bear_use_spike': True, 'bear_rsi_required': False, 'sideways_strategy': 'breakout', 'sideways_bb_std_mult': 3.5033396394009237, 'sideways_rsi_os': 34, 'sideways_rsi_ob': 73, 'sideways_adx_thresh': 18.27963673940691, 'sideways_atr_min_pct': 0.0034654169180955508, 'sideways_atr_max_pct': 0.04717202689309242, 'sideways_tp_mult': 1.3188202695615177, 'sideways_tsl_mult': 0.333676660142439, 'sideways_time_stop': 142, 'sideways_use_sma': True, 'sideways_use_ema': True, 'sideways_use_atr': True, 'sideways_use_adx': True, 'sideways_use_spike': False, 'sideways_rsi_required': False}.
[I 2025-08-31 11:33:27,219] Trial 296 finished with values: [-1000000000.0, 1000000000.0] and parameters: {'p_sma': 38, 'p_std': 16, 'p_atr': 15, 'p_adx': 26, 'rsi_period': 34, 'ema1': 29, 'ema2': 55, 'slip_atr_k': 0.050257459387823084, 'slip_spread_k': 0.08828691420226355, 'spread_hl_frac': 0.011756787850529336, 'bb_std_mult': 0.7980410349019229, 'rsi_os': 33, 'rsi_ob': 71, 'vol_spike': 0.06487365280611684, 'adx_thresh': 24.542898755719875, 'atr_min_pct': 0.0036135631441277533, 'atr_max_pct': 0.03254082791099275, 'tp_mult': 1.1621931723522338, 'tsl_mult': 0.7720623272545746, 'strategy': 'breakout', 'time_stop': 292, 'use_sma': False, 'use_atr': False, 'use_adx': True, 'use_ema': False, 'use_spike': True, 'rsi_required': True, 'edge_k': 0.3364288563440965, 'edge_cap': 0.8216247080230126, 'bull_strategy': 'mean_reversion', 'bull_bb_std_mult': 2.601099555459882, 'bull_rsi_os': 24, 'bull_rsi_ob': 64, 'bull_adx_thresh': 30.993425532799954, 'bull_atr_min_pct': 0.005628236158237147, 'bull_atr_max_pct': 0.02512172440159699, 'bull_tp_mult': 1.4079699714235614, 'bull_tsl_mult': 0.8511353933908754, 'bull_time_stop': 155, 'bull_use_sma': True, 'bull_use_ema': True, 'bull_use_atr': False, 'bull_use_adx': True, 'bull_use_spike': False, 'bull_rsi_required': True, 'bear_strategy': 'breakout', 'bear_bb_std_mult': 0.9931188508939254, 'bear_rsi_os': 9, 'bear_rsi_ob': 83, 'bear_adx_thresh': 18.356640062517926, 'bear_atr_min_pct': 0.015805402771552245, 'bear_atr_max_pct': 0.019659357068653814, 'bear_tp_mult': 1.067293613100942, 'bear_tsl_mult': 0.986912486647177, 'bear_time_stop': 132, 'bear_use_sma': False, 'bear_use_ema': True, 'bear_use_atr': True, 'bear_use_adx': False, 'bear_use_spike': True, 'bear_rsi_required': False, 'sideways_strategy': 'breakout', 'sideways_bb_std_mult': 1.748291894298217, 'sideways_rsi_os': 29, 'sideways_rsi_ob': 73, 'sideways_adx_thresh': 16.74447458514995, 'sideways_atr_min_pct': 0.0034589753155679654, 'sideways_atr_max_pct': 0.046914096409758604, 'sideways_tp_mult': 1.8001076344592954, 'sideways_tsl_mult': 0.9067424932248065, 'sideways_time_stop': 5, 'sideways_use_sma': True, 'sideways_use_ema': True, 'sideways_use_atr': True, 'sideways_use_adx': False, 'sideways_use_spike': False, 'sideways_rsi_required': False}.
