[I 2025-08-31 10:59:53,360] Trial 29 finished with values: [-0.027059567269733464, 0.027047466254821635] and parameters: {'p_sma': 29, 'p_std': 43, 'p_atr': 24, 'p_adx': 24, 'rsi_period': 22, 'ema1': 8, 'ema2': 42, 'slip_atr_k': 0.10107997330948801, 'slip_spread_k': 0.6896040945473374, 'spread_hl_frac': 0.0014696291695466754, 'bb_std_mult': 1.3229959237663151, 'rsi_os': 29, 'rsi_ob': 81, 'vol_spike': 0.27467677987532657, 'adx_thresh': 10.903565925458784, 'atr_min_pct': 0.028321634841643326, 'atr_max_pct': 0.107441241041869, 'tp_mult': 1.9820691087867675, 'tsl_mult': 0.477351263303175, 'strategy': 'mean_reversion', 'time_stop': 139, 'use_sma': True, 'use_atr': False, 'use_adx': False, 'use_ema': False, 'use_spike': True, 'rsi_required': True, 'edge_k': 0.6758731569900793, 'edge_cap': 0.1516649950323231, 'bull_strategy': 'breakout', 'bull_bb_std_mult': 1.3698648591317095, 'bull_rsi_os': 25, 'bull_rsi_ob': 58, 'bull_adx_thresh': 28.164003241418794, 'bull_atr_min_pct': 0.025056040450275374, 'bull_atr_max_pct': 0.07336229986365812, 'bull_tp_mult': 1.8026640631131174, 'bull_tsl_mult': 0.1636955387576952, 'bull_time_stop': 171, 'bull_use_sma': False, 'bull_use_ema': False, 'bull_use_atr': False, 'bull_use_adx': True, 'bull_use_spike': False, 'bull_rsi_required': False, 'bear_strategy': 'breakout', 'bear_bb_std_mult': 2.019890420943813, 'bear_rsi_os': 41, 'bear_rsi_ob': 69, 'bear_adx_thresh': 27.986466595476852, 'bear_atr_min_pct': 0.013393615005640807, 'bear_atr_max_pct': 0.09415574368285304, 'bear_tp_mult': 1.029879291409768, 'bear_tsl_mult': 0.906189955172499, 'bear_time_stop': 232, 'bear_use_sma': True, 'bear_use_ema': True, 'bear_use_atr': True, 'bear_use_adx': False, 'bear_use_spike': True, 'bear_rsi_required': True, 'sideways_strategy': 'mean_reversion', 'sideways_bb_std_mult': 2.0566661021838994, 'sideways_rsi_os': 22, 'sideways_rsi_ob': 56, 'sideways_adx_thresh': 20.071696204554357, 'sideways_atr_min_pct': 0.0026304875141916224, 'sideways_atr_max_pct': 0.033063502278870206, 'sideways_tp_mult': 1.8170877897104822, 'sideways_tsl_mult': 0.5395202095129914, 'sideways_time_stop': 121, 'sideways_use_sma': False, 'sideways_use_ema': False, 'sideways_use_atr': True, 'sideways_use_adx': False, 'sideways_use_spike': True, 'sideways_rsi_required': False}.
[I 2025-08-31 10:59:53,962] Trial 28 finished with values: [-1000000000.0, 1000000000.0] and parameters: {'p_sma': 26, 'p_std': 45, 'p_atr': 24, 'p_adx': 25, 'rsi_period': 21, 'ema1': 9, 'ema2': 42, 'slip_atr_k': 0.10239385614190519, 'slip_spread_k': 0.24563331824188483, 'spread_hl_frac': 0.019821561205424682, 'bb_std_mult': 1.2379582202503228, 'rsi_os': 29, 'rsi_ob': 82, 'vol_spike': 0.2823439833126036, 'adx_thresh': 10.284922164975354, 'atr_min_pct': 0.029214565155399063, 'atr_max_pct': 0.10942319474109098, 'tp_mult': 1.9311413852370902, 'tsl_mult': 0.28558296969462527, 'strategy': 'mean_reversion', 'time_stop': 123, 'use_sma': True, 'use_atr': False, 'use_adx': False, 'use_ema': True, 'use_spike': True, 'rsi_required': True, 'edge_k': 0.6363662654911952, 'edge_cap': 0.17022647818663195, 'bull_strategy': 'breakout', 'bull_bb_std_mult': 1.3900202264413566, 'bull_rsi_os': 26, 'bull_rsi_ob': 58, 'bull_adx_thresh': 28.161592965639173, 'bull_atr_min_pct': 0.024765167592373113, 'bull_atr_max_pct': 0.06424937298098393, 'bull_tp_mult': 2.4963607971815946, 'bull_tsl_mult': 0.15496185581194358, 'bull_time_stop': 178, 'bull_use_sma': True, 'bull_use_ema': False, 'bull_use_atr': False, 'bull_use_adx': True, 'bull_use_spike': False, 'bull_rsi_required': True, 'bear_strategy': 'breakout', 'bear_bb_std_mult': 2.0499052579558867, 'bear_rsi_os': 40, 'bear_rsi_ob': 45, 'bear_adx_thresh': 15.152307818180017, 'bear_atr_min_pct': 0.014411175693050102, 'bear_atr_max_pct': 0.09401287440268813, 'bear_tp_mult': 1.4327344831550866, 'bear_tsl_mult': 0.9224582578658646, 'bear_time_stop': 134, 'bear_use_sma': True, 'bear_use_ema': True, 'bear_use_atr': True, 'bear_use_adx': False, 'bear_use_spike': False, 'bear_rsi_required': True, 'sideways_strategy': 'breakout', 'sideways_bb_std_mult': 2.585138676322388, 'sideways_rsi_os': 54, 'sideways_rsi_ob': 76, 'sideways_adx_thresh': 8.810202784229112, 'sideways_atr_min_pct': 0.007111677913235557, 'sideways_atr_max_pct': 0.1499779095809914, 'sideways_tp_mult': 1.707435397716547, 'sideways_tsl_mult': 0.5228318858356557, 'sideways_time_stop': 203, 'sideways_use_sma': True, 'sideways_use_ema': True, 'sideways_use_atr': True, 'sideways_use_adx': False, 'sideways_use_spike': True, 'sideways_rsi_required': False}.
[I 2025-08-31 10:59:54,046] Trial 27 finished with values: [-1000000000.0, 1000000000.0] and parameters: {'p_sma': 24, 'p_std': 51, 'p_atr': 13, 'p_adx': 25, 'rsi_period': 21, 'ema1': 23, 'ema2': 40, 'slip_atr_k': 0.09974176865199538, 'slip_spread_k': 0.884832302914966, 'spread_hl_frac': 0.020290192741029747, 'bb_std_mult': 3.4744381936171704, 'rsi_os': 29, 'rsi_ob': 81, 'vol_spike': 0.27644908034135635, 'adx_thresh': 9.62202129346668, 'atr_min_pct': 0.029978056637783874, 'atr_max_pct': 0.10878021861090621, 'tp_mult': 1.9004323722463277, 'tsl_mult': 0.27178649563967533, 'strategy': 'mean_reversion', 'time_stop': 118, 'use_sma': True, 'use_atr': False, 'use_adx': False, 'use_ema': True, 'use_spike': True, 'rsi_required': True, 'edge_k': 0.6962530407109525, 'edge_cap': 0.17088432672810516, 'bull_strategy': 'breakout', 'bull_bb_std_mult': 1.3155195800681363, 'bull_rsi_os': 26, 'bull_rsi_ob': 59, 'bull_adx_thresh': 12.19755329496481, 'bull_atr_min_pct': 0.024600307391836596, 'bull_atr_max_pct': 0.06778323085895002, 'bull_tp_mult': 1.8429561878849958, 'bull_tsl_mult': 0.12945012419409255, 'bull_time_stop': 185, 'bull_use_sma': True, 'bull_use_ema': False, 'bull_use_atr': False, 'bull_use_adx': True, 'bull_use_spike': False, 'bull_rsi_required': True, 'bear_strategy': 'breakout', 'bear_bb_std_mult': 0.7509630091927582, 'bear_rsi_os': 42, 'bear_rsi_ob': 58, 'bear_adx_thresh': 23.77691512794865, 'bear_atr_min_pct': 0.013558865188555959, 'bear_atr_max_pct': 0.07248894767490177, 'bear_tp_mult': 1.935391033593167, 'bear_tsl_mult': 0.9026824131012744, 'bear_time_stop': 298, 'bear_use_sma': True, 'bear_use_ema': True, 'bear_use_atr': True, 'bear_use_adx': False, 'bear_use_spike': False, 'bear_rsi_required': True, 'sideways_strategy': 'breakout', 'sideways_bb_std_mult': 2.549726895986854, 'sideways_rsi_os': 40, 'sideways_rsi_ob': 79, 'sideways_adx_thresh': 20.21135493888518, 'sideways_atr_min_pct': 0.011069044614176893, 'sideways_atr_max_pct': 0.10220868955636438, 'sideways_tp_mult': 1.3056899314473789, 'sideways_tsl_mult': 0.49459525056114634, 'sideways_time_stop': 209, 'sideways_use_sma': True, 'sideways_use_ema': True, 'sideways_use_atr': True, 'sideways_use_adx': False, 'sideways_use_spike': True, 'sideways_rsi_required': False}.
[I 2025-08-31 11:00:24,562] Trial 33 finished with values: [-0.06645365368744993, 0.0661409435476541] and parameters: {'p_sma': 58, 'p_std': 53, 'p_atr': 7, 'p_adx': 19, 'rsi_period': 11, 'ema1': 7, 'ema2': 16, 'slip_atr_k': 0.14190205586835303, 'slip_spread_k': 0.6795195049402095, 'spread_hl_frac': 0.025026646807391542, 'bb_std_mult': 0.7737139686418961, 'rsi_os': 15, 'rsi_ob': 57, 'vol_spike': 0.22746348106251002, 'adx_thresh': 11.801461956352412, 'atr_min_pct': 0.014056625623409902, 'atr_max_pct': 0.13542815955243118, 'tp_mult': 1.7066872634717933, 'tsl_mult': 0.5354528121720071, 'strategy': 'mean_reversion', 'time_stop': 161, 'use_sma': False, 'use_atr': True, 'use_adx': False, 'use_ema': False, 'use_spike': False, 'rsi_required': False, 'edge_k': 0.5036444499076609, 'edge_cap': 0.6986490674592993, 'bull_strategy': 'breakout', 'bull_bb_std_mult': 3.14114848765431, 'bull_rsi_os': 37, 'bull_rsi_ob': 78, 'bull_adx_thresh': 31.575580059652346, 'bull_atr_min_pct': 0.013996076455341244, 'bull_atr_max_pct': 0.14931799033039644, 'bull_tp_mult': 1.7730230547188601, 'bull_tsl_mult': 0.4507206083546501, 'bull_time_stop': 227, 'bull_use_sma': True, 'bull_use_ema': True, 'bull_use_atr': False, 'bull_use_adx': False, 'bull_use_spike': True, 'bull_rsi_required': False, 'bear_strategy': 'breakout', 'bear_bb_std_mult': 2.818485499058782, 'bear_rsi_os': 27, 'bear_rsi_ob': 66, 'bear_adx_thresh': 10.84036724812733, 'bear_atr_min_pct': 0.027289309606555106, 'bear_atr_max_pct': 0.09799934739847156, 'bear_tp_mult': 2.469265689914205, 'bear_tsl_mult': 0.9987939988830659, 'bear_time_stop': 238, 'bear_use_sma': True, 'bear_use_ema': False, 'bear_use_atr': False, 'bear_use_adx': True, 'bear_use_spike': True, 'bear_rsi_required': False, 'sideways_strategy': 'breakout', 'sideways_bb_std_mult': 3.0402246465211826, 'sideways_rsi_os': 24, 'sideways_rsi_ob': 84, 'sideways_adx_thresh': 30.398608546189088, 'sideways_atr_min_pct': 0.0024406848627383845, 'sideways_atr_max_pct': 0.03187866563185503, 'sideways_tp_mult': 2.5396736254349217, 'sideways_tsl_mult': 0.09885662455756686, 'sideways_time_stop': 35, 'sideways_use_sma': True, 'sideways_use_ema': False, 'sideways_use_atr': False, 'sideways_use_adx': True, 'sideways_use_spike': False, 'sideways_rsi_required': False}.
[I 2025-08-31 11:00:24,839] Trial 31 finished with values: [-1000000000.0, 1000000000.0] and parameters: {'p_sma': 26, 'p_std': 44, 'p_atr': 18, 'p_adx': 24, 'rsi_period': 23, 'ema1': 9, 'ema2': 40, 'slip_atr_k': 0.11603397640160534, 'slip_spread_k': 0.8961563620552737, 'spread_hl_frac': 0.02221784391157166, 'bb_std_mult': 1.2287414361067721, 'rsi_os': 39, 'rsi_ob': 81, 'vol_spike': 0.28444995362113823, 'adx_thresh': 11.129364176795217, 'atr_min_pct': 0.0291618258311471, 'atr_max_pct': 0.11023505471982376, 'tp_mult': 1.025430472519058, 'tsl_mult': 0.47960971850421996, 'strategy': 'mean_reversion', 'time_stop': 128, 'use_sma': True, 'use_atr': False, 'use_adx': False, 'use_ema': True, 'use_spike': True, 'rsi_required': False, 'edge_k': 0.6024709247745134, 'edge_cap': 0.15732911488037526, 'bull_strategy': 'breakout', 'bull_bb_std_mult': 2.870488712190338, 'bull_rsi_os': 24, 'bull_rsi_ob': 78, 'bull_adx_thresh': 27.324008252041615, 'bull_atr_min_pct': 0.013303976768112175, 'bull_atr_max_pct': 0.14277492704356337, 'bull_tp_mult': 1.8340474315056825, 'bull_tsl_mult': 0.13243520703586842, 'bull_time_stop': 234, 'bull_use_sma': True, 'bull_use_ema': False, 'bull_use_atr': False, 'bull_use_adx': False, 'bull_use_spike': False, 'bull_rsi_required': True, 'bear_strategy': 'breakout', 'bear_bb_std_mult': 0.9024366236455386, 'bear_rsi_os': 40, 'bear_rsi_ob': 69, 'bear_adx_thresh': 27.76817309135542, 'bear_atr_min_pct': 0.027318301874000105, 'bear_atr_max_pct': 0.09469418027216177, 'bear_tp_mult': 2.491110555569319, 'bear_tsl_mult': 0.9110729832392541, 'bear_time_stop': 298, 'bear_use_sma': True, 'bear_use_ema': True, 'bear_use_atr': False, 'bear_use_adx': False, 'bear_use_spike': True, 'bear_rsi_required': True, 'sideways_strategy': 'breakout', 'sideways_bb_std_mult': 2.574145785532213, 'sideways_rsi_os': 23, 'sideways_rsi_ob': 56, 'sideways_adx_thresh': 9.326956582850926, 'sideways_atr_min_pct': 0.0025967852286349303, 'sideways_atr_max_pct': 0.03341772217012922, 'sideways_tp_mult': 1.3310717343602623, 'sideways_tsl_mult': 0.4684664368044207, 'sideways_time_stop': 35, 'sideways_use_sma': True, 'sideways_use_ema': True, 'sideways_use_atr': True, 'sideways_use_adx': False, 'sideways_use_spike': True, 'sideways_rsi_required': False}.
[I 2025-08-31 11:00:25,387] Trial 32 finished with values: [-0.08853761114345038, 0.08829167616982664] and parameters: {'p_sma': 36, 'p_std': 54, 'p_atr': 7, 'p_adx': 7, 'rsi_period': 7, 'ema1': 7, 'ema2': 60, 'slip_atr_k': 0.1544952114109763, 'slip_spread_k': 0.8867889771055483, 'spread_hl_frac': 0.027214974854578904, 'bb_std_mult': 0.8987464727783598, 'rsi_os': 17, 'rsi_ob': 53, 'vol_spike': 0.23039975286377817, 'adx_thresh': 12.034592931421141, 'atr_min_pct': 0.013391758666910723, 'atr_max_pct': 0.13630573116340192, 'tp_mult': 1.7263622981158837, 'tsl_mult': 0.4844103760169069, 'strategy': 'mean_reversion', 'time_stop': 89, 'use_sma': False, 'use_atr': False, 'use_adx': False, 'use_ema': False, 'use_spike': False, 'rsi_required': False, 'edge_k': 0.9127867830548482, 'edge_cap': 0.7218151917731087, 'bull_strategy': 'breakout', 'bull_bb_std_mult': 3.2193372468645434, 'bull_rsi_os': 21, 'bull_rsi_ob': 48, 'bull_adx_thresh': 12.044573909528998, 'bull_atr_min_pct': 0.014148750521115663, 'bull_atr_max_pct': 0.146105687297097, 'bull_tp_mult': 1.7203568257545736, 'bull_tsl_mult': 0.1112839200566636, 'bull_time_stop': 240, 'bull_use_sma': True, 'bull_use_ema': False, 'bull_use_atr': False, 'bull_use_adx': False, 'bull_use_spike': True, 'bull_rsi_required': True, 'bear_strategy': 'breakout', 'bear_bb_std_mult': 2.8813241661608506, 'bear_rsi_os': 17, 'bear_rsi_ob': 64, 'bear_adx_thresh': 27.95150185287016, 'bear_atr_min_pct': 0.024072783992425958, 'bear_atr_max_pct': 0.14966722569660382, 'bear_tp_mult': 2.4044136972368855, 'bear_tsl_mult': 0.9988229908781532, 'bear_time_stop': 298, 'bear_use_sma': True, 'bear_use_ema': False, 'bear_use_atr': False, 'bear_use_adx': True, 'bear_use_spike': True, 'bear_rsi_required': True, 'sideways_strategy': 'breakout', 'sideways_bb_std_mult': 3.1598644904348943, 'sideways_rsi_os': 24, 'sideways_rsi_ob': 81, 'sideways_adx_thresh': 20.54187310240974, 'sideways_atr_min_pct': 0.002746025876154882, 'sideways_atr_max_pct': 0.03217828135357303, 'sideways_tp_mult': 1.3604635768948963, 'sideways_tsl_mult': 0.1133517292569784, 'sideways_time_stop': 34, 'sideways_use_sma': True, 'sideways_use_ema': True, 'sideways_use_atr': False, 'sideways_use_adx': False, 'sideways_use_spike': False, 'sideways_rsi_required': False}.
[I 2025-08-31 11:00:25,589] Trial 30 finished with values: [-1000000000.0, 1000000000.0] and parameters: {'p_sma': 26, 'p_std': 54, 'p_atr': 25, 'p_adx': 27, 'rsi_period': 25, 'ema1': 9, 'ema2': 42, 'slip_atr_k': 0.249934520634628, 'slip_spread_k': 0.8852970203977844, 'spread_hl_frac': 0.02082276522925224, 'bb_std_mult': 1.1517017020135947, 'rsi_os': 39, 'rsi_ob': 81, 'vol_spike': 0.27834766839964037, 'adx_thresh': 10.577405609780385, 'atr_min_pct': 0.02913798886683254, 'atr_max_pct': 0.11066100968060015, 'tp_mult': 1.994487183180805, 'tsl_mult': 0.5206091502475648, 'strategy': 'mean_reversion', 'time_stop': 94, 'use_sma': True, 'use_atr': False, 'use_adx': False, 'use_ema': False, 'use_spike': True, 'rsi_required': True, 'edge_k': 0.6715255506440431, 'edge_cap': 0.15941914454379166, 'bull_strategy': 'breakout', 'bull_bb_std_mult': 3.32134010777311, 'bull_rsi_os': 24, 'bull_rsi_ob': 46, 'bull_adx_thresh': 28.16204707144826, 'bull_atr_min_pct': 0.02444811920137607, 'bull_atr_max_pct': 0.14777904370909356, 'bull_tp_mult': 1.821567722281482, 'bull_tsl_mult': 0.09496275353882183, 'bull_time_stop': 244, 'bull_use_sma': True, 'bull_use_ema': False, 'bull_use_atr': False, 'bull_use_adx': True, 'bull_use_spike': False, 'bull_rsi_required': True, 'bear_strategy': 'breakout', 'bear_bb_std_mult': 0.9475256167329513, 'bear_rsi_os': 41, 'bear_rsi_ob': 68, 'bear_adx_thresh': 29.637209965486303, 'bear_atr_min_pct': 0.027097179329660385, 'bear_atr_max_pct': 0.09321510499332303, 'bear_tp_mult': 2.4680337660161364, 'bear_tsl_mult': 0.9104951609067635, 'bear_time_stop': 241, 'bear_use_sma': True, 'bear_use_ema': True, 'bear_use_atr': True, 'bear_use_adx': False, 'bear_use_spike': True, 'bear_rsi_required': True, 'sideways_strategy': 'breakout', 'sideways_bb_std_mult': 1.252345773980491, 'sideways_rsi_os': 23, 'sideways_rsi_ob': 67, 'sideways_adx_thresh': 19.773529121180143, 'sideways_atr_min_pct': 0.006076529349896062, 'sideways_atr_max_pct': 0.1497217146073037, 'sideways_tp_mult': 1.768459481085939, 'sideways_tsl_mult': 0.5001618691618708, 'sideways_time_stop': 215, 'sideways_use_sma': True, 'sideways_use_ema': True, 'sideways_use_atr': True, 'sideways_use_adx': False, 'sideways_use_spike': True, 'sideways_rsi_required': False}.
[I 2025-08-31 11:00:56,480] Trial 37 finished with values: [-1000000000.0, 1000000000.0] and parameters: {'p_sma': 18, 'p_std': 11, 'p_atr': 18, 'p_adx': 28, 'rsi_period': 36, 'ema1': 7, 'ema2': 54, 'slip_atr_k': 0.14153927577488995, 'slip_spread_k': 0.6695630451789437, 'spread_hl_frac': 0.04555254168015839, 'bb_std_mult': 1.8249123874449205, 'rsi_os': 15, 'rsi_ob': 77, 'vol_spike': 0.23096914267014657, 'adx_thresh': 8.046321075179838, 'atr_min_pct': 0.015787579871620043, 'atr_max_pct': 0.1214479381177627, 'tp_mult': 2.358168855448094, 'tsl_mult': 0.5385526972321236, 'strategy': 'breakout', 'time_stop': 163, 'use_sma': False, 'use_atr': True, 'use_adx': True, 'use_ema': False, 'use_spike': False, 'rsi_required': False, 'edge_k': 0.12294659898886628, 'edge_cap': 0.5618229398238277, 'bull_strategy': 'mean_reversion', 'bull_bb_std_mult': 2.323288091078391, 'bull_rsi_os': 53, 'bull_rsi_ob': 53, 'bull_adx_thresh': 31.557990691336673, 'bull_atr_min_pct': 0.01846170338482201, 'bull_atr_max_pct': 0.08817785707649596, 'bull_tp_mult': 2.151633405574952, 'bull_tsl_mult': 0.4446029500116272, 'bull_time_stop': 142, 'bull_use_sma': False, 'bull_use_ema': True, 'bull_use_atr': False, 'bull_use_adx': False, 'bull_use_spike': True, 'bull_rsi_required': False, 'bear_strategy': 'breakout', 'bear_bb_std_mult': 1.7836210684749576, 'bear_rsi_os': 27, 'bear_rsi_ob': 79, 'bear_adx_thresh': 10.596162410258108, 'bear_atr_min_pct': 0.00999305723458074, 'bear_atr_max_pct': 0.12104959371232327, 'bear_tp_mult': 1.045241232938376, 'bear_tsl_mult': 0.82479632509417, 'bear_time_stop': 34, 'bear_use_sma': False, 'bear_use_ema': False, 'bear_use_atr': False, 'bear_use_adx': True, 'bear_use_spike': True, 'bear_rsi_required': False, 'sideways_strategy': 'mean_reversion', 'sideways_bb_std_mult': 1.451261284482194, 'sideways_rsi_os': 28, 'sideways_rsi_ob': 91, 'sideways_adx_thresh': 29.868447635208966, 'sideways_atr_min_pct': 0.022685128031516233, 'sideways_atr_max_pct': 0.05905024690445582, 'sideways_tp_mult': 2.5017911393292196, 'sideways_tsl_mult': 0.27444273080032466, 'sideways_time_stop': 118, 'sideways_use_sma': False, 'sideways_use_ema': False, 'sideways_use_atr': False, 'sideways_use_adx': True, 'sideways_use_spike': False, 'sideways_rsi_required': True}.
[I 2025-08-31 11:00:56,711] Trial 35 finished with values: [-1000000000.0, 1000000000.0] and parameters: {'p_sma': 37, 'p_std': 54, 'p_atr': 7, 'p_adx': 28, 'rsi_period': 37, 'ema1': 7, 'ema2': 60, 'slip_atr_k': 0.14641695500386834, 'slip_spread_k': 0.6949899001513409, 'spread_hl_frac': 0.026494322303398817, 'bb_std_mult': 1.7873924569434827, 'rsi_os': 15, 'rsi_ob': 45, 'vol_spike': 0.22745693756643728, 'adx_thresh': 21.746354751601366, 'atr_min_pct': 0.013817436405768862, 'atr_max_pct': 0.13561141455827957, 'tp_mult': 1.7477678616578307, 'tsl_mult': 0.5317524206271933, 'strategy': 'breakout', 'time_stop': 86, 'use_sma': False, 'use_atr': False, 'use_adx': True, 'use_ema': False, 'use_spike': False, 'rsi_required': False, 'edge_k': 0.4167324709145699, 'edge_cap': 0.5216221894144931, 'bull_strategy': 'mean_reversion', 'bull_bb_std_mult': 3.2096916113322225, 'bull_rsi_os': 35, 'bull_rsi_ob': 46, 'bull_adx_thresh': 31.619937999410798, 'bull_atr_min_pct': 0.013866264727722812, 'bull_atr_max_pct': 0.09472911606322812, 'bull_tp_mult': 2.139231478607185, 'bull_tsl_mult': 0.4636521568753059, 'bull_time_stop': 130, 'bull_use_sma': True, 'bull_use_ema': True, 'bull_use_atr': False, 'bull_use_adx': False, 'bull_use_spike': True, 'bull_rsi_required': False, 'bear_strategy': 'breakout', 'bear_bb_std_mult': 2.5952702227425544, 'bear_rsi_os': 14, 'bear_rsi_ob': 64, 'bear_adx_thresh': 10.292620421500134, 'bear_atr_min_pct': 0.003246072306193854, 'bear_atr_max_pct': 0.14798563633415088, 'bear_tp_mult': 2.496445877693803, 'bear_tsl_mult': 0.9978774112892747, 'bear_time_stop': 36, 'bear_use_sma': False, 'bear_use_ema': False, 'bear_use_atr': False, 'bear_use_adx': True, 'bear_use_spike': True, 'bear_rsi_required': False, 'sideways_strategy': 'breakout', 'sideways_bb_std_mult': 1.3696542282691744, 'sideways_rsi_os': 23, 'sideways_rsi_ob': 66, 'sideways_adx_thresh': 31.763532905286304, 'sideways_atr_min_pct': 0.0023164512529706416, 'sideways_atr_max_pct': 0.05733573223474494, 'sideways_tp_mult': 2.5048837371175154, 'sideways_tsl_mult': 0.1097151817196369, 'sideways_time_stop': 7, 'sideways_use_sma': True, 'sideways_use_ema': False, 'sideways_use_atr': False, 'sideways_use_adx': False, 'sideways_use_spike': False, 'sideways_rsi_required': True}.
