[I 2025-08-31 11:28:45,453] Trial 250 finished with values: [-1000000000.0, 1000000000.0] and parameters: {'p_sma': 32, 'p_std': 20, 'p_atr': 11, 'p_adx': 28, 'rsi_period': 28, 'ema1': 12, 'ema2': 42, 'slip_atr_k': 0.05042610865617451, 'slip_spread_k': 0.15120478773925627, 'spread_hl_frac': 0.0015234516625825581, 'bb_std_mult': 0.6994259492717044, 'rsi_os': 29, 'rsi_ob': 71, 'vol_spike': 0.14337740516828246, 'adx_thresh': 24.241449457170706, 'atr_min_pct': 0.0047710096701200685, 'atr_max_pct': 0.023942172796833264, 'tp_mult': 2.8348767644637287, 'tsl_mult': 0.21365357252496786, 'strategy': 'mean_reversion', 'time_stop': 300, 'use_sma': False, 'use_atr': False, 'use_adx': True, 'use_ema': False, 'use_spike': True, 'rsi_required': False, 'edge_k': 0.953568229008791, 'edge_cap': 0.8610665324368695, 'bull_strategy': 'mean_reversion', 'bull_bb_std_mult': 3.1733552410534336, 'bull_rsi_os': 25, 'bull_rsi_ob': 64, 'bull_adx_thresh': 14.887792655654932, 'bull_atr_min_pct': 0.005631842719609381, 'bull_atr_max_pct': 0.13318342866948127, 'bull_tp_mult': 1.4431260939996648, 'bull_tsl_mult': 0.5410685078344906, 'bull_time_stop': 160, 'bull_use_sma': True, 'bull_use_ema': True, 'bull_use_atr': False, 'bull_use_adx': False, 'bull_use_spike': True, 'bull_rsi_required': False, 'bear_strategy': 'breakout', 'bear_bb_std_mult': 1.157933117135114, 'bear_rsi_os': 35, 'bear_rsi_ob': 87, 'bear_adx_thresh': 15.30233128366961, 'bear_atr_min_pct': 0.014675362651254067, 'bear_atr_max_pct': 0.11803620967519704, 'bear_tp_mult': 2.6715986792587083, 'bear_tsl_mult': 0.3483817006601139, 'bear_time_stop': 213, 'bear_use_sma': False, 'bear_use_ema': True, 'bear_use_atr': False, 'bear_use_adx': True, 'bear_use_spike': False, 'bear_rsi_required': False, 'sideways_strategy': 'mean_reversion', 'sideways_bb_std_mult': 1.7994419492911953, 'sideways_rsi_os': 31, 'sideways_rsi_ob': 73, 'sideways_adx_thresh': 9.588417968560341, 'sideways_atr_min_pct': 0.016711285184201386, 'sideways_atr_max_pct': 0.059323931824736456, 'sideways_tp_mult': 1.3097417408244536, 'sideways_tsl_mult': 0.3799234382114426, 'sideways_time_stop': 105, 'sideways_use_sma': True, 'sideways_use_ema': True, 'sideways_use_atr': True, 'sideways_use_adx': False, 'sideways_use_spike': True, 'sideways_rsi_required': True}.
[I 2025-08-31 11:28:45,806] Trial 251 finished with values: [-1000000000.0, 1000000000.0] and parameters: {'p_sma': 29, 'p_std': 21, 'p_atr': 11, 'p_adx': 28, 'rsi_period': 52, 'ema1': 12, 'ema2': 42, 'slip_atr_k': 0.05093055127002481, 'slip_spread_k': 0.009940318475241627, 'spread_hl_frac': 0.004675687814088874, 'bb_std_mult': 0.6988181949632322, 'rsi_os': 29, 'rsi_ob': 71, 'vol_spike': 0.1455260230713693, 'adx_thresh': 24.19858402826652, 'atr_min_pct': 0.004717971897295242, 'atr_max_pct': 0.02382591713602168, 'tp_mult': 1.8283592982434749, 'tsl_mult': 0.20936328599289222, 'strategy': 'mean_reversion', 'time_stop': 252, 'use_sma': False, 'use_atr': False, 'use_adx': True, 'use_ema': False, 'use_spike': True, 'rsi_required': False, 'edge_k': 0.3766825862173102, 'edge_cap': 0.8631268241836808, 'bull_strategy': 'mean_reversion', 'bull_bb_std_mult': 3.093567663213926, 'bull_rsi_os': 25, 'bull_rsi_ob': 64, 'bull_adx_thresh': 13.69149053977368, 'bull_atr_min_pct': 0.0054360253636595275, 'bull_atr_max_pct': 0.02266520412261807, 'bull_tp_mult': 1.4500795570237242, 'bull_tsl_mult': 0.7005475066353682, 'bull_time_stop': 157, 'bull_use_sma': True, 'bull_use_ema': True, 'bull_use_atr': False, 'bull_use_adx': False, 'bull_use_spike': True, 'bull_rsi_required': False, 'bear_strategy': 'breakout', 'bear_bb_std_mult': 1.218454118241893, 'bear_rsi_os': 35, 'bear_rsi_ob': 70, 'bear_adx_thresh': 5.816245090800933, 'bear_atr_min_pct': 0.02360355815512509, 'bear_atr_max_pct': 0.11793848900773221, 'bear_tp_mult': 2.66323156276248, 'bear_tsl_mult': 0.17634860386843088, 'bear_time_stop': 213, 'bear_use_sma': False, 'bear_use_ema': True, 'bear_use_atr': False, 'bear_use_adx': True, 'bear_use_spike': False, 'bear_rsi_required': False, 'sideways_strategy': 'mean_reversion', 'sideways_bb_std_mult': 1.818074670850888, 'sideways_rsi_os': 31, 'sideways_rsi_ob': 73, 'sideways_adx_thresh': 11.391737480575788, 'sideways_atr_min_pct': 0.006512778052054255, 'sideways_atr_max_pct': 0.04154590036354431, 'sideways_tp_mult': 1.3889289204973552, 'sideways_tsl_mult': 0.315714777530998, 'sideways_time_stop': 168, 'sideways_use_sma': True, 'sideways_use_ema': True, 'sideways_use_atr': True, 'sideways_use_adx': False, 'sideways_use_spike': True, 'sideways_rsi_required': True}.
[I 2025-08-31 11:29:18,868] Trial 255 finished with values: [-1000000000.0, 1000000000.0] and parameters: {'p_sma': 27, 'p_std': 20, 'p_atr': 12, 'p_adx': 25, 'rsi_period': 24, 'ema1': 12, 'ema2': 47, 'slip_atr_k': 0.060266595009232954, 'slip_spread_k': 0.1724030879713176, 'spread_hl_frac': 0.0005815164350909258, 'bb_std_mult': 0.7810717119920592, 'rsi_os': 34, 'rsi_ob': 69, 'vol_spike': 0.16183939426697055, 'adx_thresh': 27.9989404163629, 'atr_min_pct': 0.005579893974808935, 'atr_max_pct': 0.02720845293873627, 'tp_mult': 1.8405603590896915, 'tsl_mult': 0.34549378263504105, 'strategy': 'breakout', 'time_stop': 296, 'use_sma': False, 'use_atr': True, 'use_adx': False, 'use_ema': False, 'use_spike': True, 'rsi_required': True, 'edge_k': 0.8867208885287333, 'edge_cap': 0.2082051483415464, 'bull_strategy': 'breakout', 'bull_bb_std_mult': 2.6772698620201973, 'bull_rsi_os': 25, 'bull_rsi_ob': 62, 'bull_adx_thresh': 18.847735996496482, 'bull_atr_min_pct': 0.003250476956481646, 'bull_atr_max_pct': 0.01343955685661287, 'bull_tp_mult': 2.6847909694185628, 'bull_tsl_mult': 0.26678068182143744, 'bull_time_stop': 139, 'bull_use_sma': True, 'bull_use_ema': True, 'bull_use_atr': True, 'bull_use_adx': True, 'bull_use_spike': False, 'bull_rsi_required': True, 'bear_strategy': 'mean_reversion', 'bear_bb_std_mult': 1.0041683293846875, 'bear_rsi_os': 35, 'bear_rsi_ob': 70, 'bear_adx_thresh': 15.409207684425143, 'bear_atr_min_pct': 0.015652677990244498, 'bear_atr_max_pct': 0.11840158270108775, 'bear_tp_mult': 2.0721665716472186, 'bear_tsl_mult': 0.6571886770723081, 'bear_time_stop': 222, 'bear_use_sma': False, 'bear_use_ema': True, 'bear_use_atr': True, 'bear_use_adx': False, 'bear_use_spike': True, 'bear_rsi_required': False, 'sideways_strategy': 'breakout', 'sideways_bb_std_mult': 1.809302649386038, 'sideways_rsi_os': 35, 'sideways_rsi_ob': 72, 'sideways_adx_thresh': 15.07629347550876, 'sideways_atr_min_pct': 0.021618110984368073, 'sideways_atr_max_pct': 0.05233387076839479, 'sideways_tp_mult': 1.383273001577618, 'sideways_tsl_mult': 0.23144159145570134, 'sideways_time_stop': 169, 'sideways_use_sma': True, 'sideways_use_ema': False, 'sideways_use_atr': True, 'sideways_use_adx': True, 'sideways_use_spike': False, 'sideways_rsi_required': False}.
[I 2025-08-31 11:29:19,167] Trial 254 finished with values: [-1000000000.0, 1000000000.0] and parameters: {'p_sma': 27, 'p_std': 20, 'p_atr': 12, 'p_adx': 10, 'rsi_period': 52, 'ema1': 12, 'ema2': 41, 'slip_atr_k': 0.1824198734354964, 'slip_spread_k': 0.15110034526139798, 'spread_hl_frac': 1.097534287999944e-06, 'bb_std_mult': 0.7866207927844887, 'rsi_os': 32, 'rsi_ob': 69, 'vol_spike': 0.14640054611862968, 'adx_thresh': 28.419724337403245, 'atr_min_pct': 0.004035628734026442, 'atr_max_pct': 0.028682613449199264, 'tp_mult': 1.1362984110435188, 'tsl_mult': 0.36169305990542666, 'strategy': 'mean_reversion', 'time_stop': 300, 'use_sma': False, 'use_atr': True, 'use_adx': False, 'use_ema': False, 'use_spike': True, 'rsi_required': False, 'edge_k': 0.9196215938890979, 'edge_cap': 0.08026069638212435, 'bull_strategy': 'breakout', 'bull_bb_std_mult': 3.2575447659863737, 'bull_rsi_os': 23, 'bull_rsi_ob': 65, 'bull_adx_thresh': 19.30006824507865, 'bull_atr_min_pct': 0.006135579614425799, 'bull_atr_max_pct': 0.03519778898289307, 'bull_tp_mult': 2.6665284582968467, 'bull_tsl_mult': 0.23869189165412252, 'bull_time_stop': 139, 'bull_use_sma': True, 'bull_use_ema': True, 'bull_use_atr': False, 'bull_use_adx': True, 'bull_use_spike': True, 'bull_rsi_required': True, 'bear_strategy': 'breakout', 'bear_bb_std_mult': 0.9927837029483446, 'bear_rsi_os': 35, 'bear_rsi_ob': 66, 'bear_adx_thresh': 15.20342908564426, 'bear_atr_min_pct': 0.014601885108404815, 'bear_atr_max_pct': 0.12063612506195225, 'bear_tp_mult': 2.662480731561549, 'bear_tsl_mult': 0.3156528899155147, 'bear_time_stop': 152, 'bear_use_sma': False, 'bear_use_ema': True, 'bear_use_atr': False, 'bear_use_adx': False, 'bear_use_spike': True, 'bear_rsi_required': False, 'sideways_strategy': 'breakout', 'sideways_bb_std_mult': 1.8499246661872608, 'sideways_rsi_os': 12, 'sideways_rsi_ob': 72, 'sideways_adx_thresh': 26.633861569616172, 'sideways_atr_min_pct': 0.01067885915128439, 'sideways_atr_max_pct': 0.06007151282760979, 'sideways_tp_mult': 1.3737810819481817, 'sideways_tsl_mult': 0.4261776387019617, 'sideways_time_stop': 107, 'sideways_use_sma': True, 'sideways_use_ema': False, 'sideways_use_atr': True, 'sideways_use_adx': True, 'sideways_use_spike': False, 'sideways_rsi_required': False}.
[I 2025-08-31 11:29:19,432] Trial 257 finished with values: [-0.020457844501769795, 0.021346017810078107] and parameters: {'p_sma': 31, 'p_std': 26, 'p_atr': 17, 'p_adx': 7, 'rsi_period': 50, 'ema1': 11, 'ema2': 27, 'slip_atr_k': 0.05872317915714955, 'slip_spread_k': 0.17463198615306996, 'spread_hl_frac': 0.0002522929751693114, 'bb_std_mult': 0.7793847875510259, 'rsi_os': 36, 'rsi_ob': 70, 'vol_spike': 0.16104273659695503, 'adx_thresh': 28.61431536385162, 'atr_min_pct': 0.005630772660026849, 'atr_max_pct': 0.027869981547778776, 'tp_mult': 1.1178142229054921, 'tsl_mult': 0.3432003620687064, 'strategy': 'breakout', 'time_stop': 241, 'use_sma': True, 'use_atr': True, 'use_adx': False, 'use_ema': False, 'use_spike': True, 'rsi_required': True, 'edge_k': 0.31442085650152285, 'edge_cap': 0.24330764023448548, 'bull_strategy': 'breakout', 'bull_bb_std_mult': 2.660422050566095, 'bull_rsi_os': 23, 'bull_rsi_ob': 93, 'bull_adx_thresh': 12.612220228596087, 'bull_atr_min_pct': 0.0032579600680607756, 'bull_atr_max_pct': 0.05110081201236233, 'bull_tp_mult': 1.4881845978770256, 'bull_tsl_mult': 0.8744384802045674, 'bull_time_stop': 139, 'bull_use_sma': True, 'bull_use_ema': True, 'bull_use_atr': True, 'bull_use_adx': True, 'bull_use_spike': False, 'bull_rsi_required': True, 'bear_strategy': 'mean_reversion', 'bear_bb_std_mult': 0.9672556093876723, 'bear_rsi_os': 30, 'bear_rsi_ob': 52, 'bear_adx_thresh': 17.59110799562172, 'bear_atr_min_pct': 0.020946987432149386, 'bear_atr_max_pct': 0.11501989078585059, 'bear_tp_mult': 2.722277450794894, 'bear_tsl_mult': 0.31876898536782455, 'bear_time_stop': 237, 'bear_use_sma': False, 'bear_use_ema': True, 'bear_use_atr': True, 'bear_use_adx': False, 'bear_use_spike': True, 'bear_rsi_required': False, 'sideways_strategy': 'breakout', 'sideways_bb_std_mult': 1.8529137887401215, 'sideways_rsi_os': 24, 'sideways_rsi_ob': 95, 'sideways_adx_thresh': 21.281304950575414, 'sideways_atr_min_pct': 0.004032957515350294, 'sideways_atr_max_pct': 0.05335940680511131, 'sideways_tp_mult': 1.343597140140816, 'sideways_tsl_mult': 0.5364841523232688, 'sideways_time_stop': 15, 'sideways_use_sma': True, 'sideways_use_ema': False, 'sideways_use_atr': True, 'sideways_use_adx': True, 'sideways_use_spike': False, 'sideways_rsi_required': False}.
[I 2025-08-31 11:29:19,432] Trial 256 finished with values: [-1000000000.0, 1000000000.0] and parameters: {'p_sma': 27, 'p_std': 21, 'p_atr': 27, 'p_adx': 24, 'rsi_period': 24, 'ema1': 12, 'ema2': 32, 'slip_atr_k': 0.1822447955423483, 'slip_spread_k': 0.17834036983295845, 'spread_hl_frac': 1.2544279072372383e-05, 'bb_std_mult': 0.8048058884762218, 'rsi_os': 36, 'rsi_ob': 69, 'vol_spike': 0.15123211814303172, 'adx_thresh': 28.377033816851636, 'atr_min_pct': 0.0055094315625750095, 'atr_max_pct': 0.02691333724630075, 'tp_mult': 1.1299458823357789, 'tsl_mult': 0.2390455279734934, 'strategy': 'breakout', 'time_stop': 300, 'use_sma': False, 'use_atr': True, 'use_adx': False, 'use_ema': False, 'use_spike': True, 'rsi_required': True, 'edge_k': 1.0348651265965203, 'edge_cap': 0.8135368008296571, 'bull_strategy': 'breakout', 'bull_bb_std_mult': 2.6987627210651635, 'bull_rsi_os': 23, 'bull_rsi_ob': 47, 'bull_adx_thresh': 15.596470533205757, 'bull_atr_min_pct': 0.0032022064707205346, 'bull_atr_max_pct': 0.04063966297848541, 'bull_tp_mult': 2.659838983163395, 'bull_tsl_mult': 0.6965985846153596, 'bull_time_stop': 139, 'bull_use_sma': True, 'bull_use_ema': True, 'bull_use_atr': True, 'bull_use_adx': True, 'bull_use_spike': False, 'bull_rsi_required': True, 'bear_strategy': 'mean_reversion', 'bear_bb_std_mult': 0.982475197106736, 'bear_rsi_os': 32, 'bear_rsi_ob': 70, 'bear_adx_thresh': 6.161083099525557, 'bear_atr_min_pct': 0.02062069105864697, 'bear_atr_max_pct': 0.025731539536724288, 'bear_tp_mult': 2.7558224176061192, 'bear_tsl_mult': 0.305733536371016, 'bear_time_stop': 157, 'bear_use_sma': False, 'bear_use_ema': True, 'bear_use_atr': True, 'bear_use_adx': False, 'bear_use_spike': True, 'bear_rsi_required': False, 'sideways_strategy': 'breakout', 'sideways_bb_std_mult': 1.8808370261790717, 'sideways_rsi_os': 35, 'sideways_rsi_ob': 45, 'sideways_adx_thresh': 15.876353571614178, 'sideways_atr_min_pct': 0.021907960946778063, 'sideways_atr_max_pct': 0.038703606996042125, 'sideways_tp_mult': 1.4383156584451802, 'sideways_tsl_mult': 0.5308083527499564, 'sideways_time_stop': 194, 'sideways_use_sma': True, 'sideways_use_ema': False, 'sideways_use_atr': True, 'sideways_use_adx': True, 'sideways_use_spike': False, 'sideways_rsi_required': False}.
[I 2025-08-31 11:29:20,041] Trial 259 finished with values: [-1000000000.0, 1000000000.0] and parameters: {'p_sma': 31, 'p_std': 17, 'p_atr': 17, 'p_adx': 7, 'rsi_period': 48, 'ema1': 11, 'ema2': 31, 'slip_atr_k': 0.043648187041093245, 'slip_spread_k': 0.10805084741819934, 'spread_hl_frac': 0.002625562471308066, 'bb_std_mult': 0.6212989742810082, 'rsi_os': 36, 'rsi_ob': 74, 'vol_spike': 0.1626083353472757, 'adx_thresh': 23.309261722356652, 'atr_min_pct': 0.02519619356668171, 'atr_max_pct': 0.021117552954257247, 'tp_mult': 2.0251830629151177, 'tsl_mult': 0.2512518410436443, 'strategy': 'breakout', 'time_stop': 282, 'use_sma': True, 'use_atr': True, 'use_adx': True, 'use_ema': False, 'use_spike': True, 'rsi_required': True, 'edge_k': 1.0394882918522055, 'edge_cap': 0.8225310465134011, 'bull_strategy': 'breakout', 'bull_bb_std_mult': 2.9061033135122165, 'bull_rsi_os': 18, 'bull_rsi_ob': 46, 'bull_adx_thresh': 16.012673244787557, 'bull_atr_min_pct': 0.004253196154301425, 'bull_atr_max_pct': 0.13906205750565845, 'bull_tp_mult': 2.792556890083302, 'bull_tsl_mult': 0.11608140532660197, 'bull_time_stop': 151, 'bull_use_sma': True, 'bull_use_ema': True, 'bull_use_atr': True, 'bull_use_adx': True, 'bull_use_spike': False, 'bull_rsi_required': True, 'bear_strategy': 'mean_reversion', 'bear_bb_std_mult': 1.0924093954757355, 'bear_rsi_os': 32, 'bear_rsi_ob': 52, 'bear_adx_thresh': 31.057241365948723, 'bear_atr_min_pct': 0.020644849603078483, 'bear_atr_max_pct': 0.1139113839186813, 'bear_tp_mult': 2.7654075868044834, 'bear_tsl_mult': 0.37310688874885684, 'bear_time_stop': 158, 'bear_use_sma': False, 'bear_use_ema': True, 'bear_use_atr': True, 'bear_use_adx': False, 'bear_use_spike': True, 'bear_rsi_required': False, 'sideways_strategy': 'breakout', 'sideways_bb_std_mult': 1.766224383972281, 'sideways_rsi_os': 33, 'sideways_rsi_ob': 60, 'sideways_adx_thresh': 21.51102159266607, 'sideways_atr_min_pct': 0.029248850848466797, 'sideways_atr_max_pct': 0.031188349664705788, 'sideways_tp_mult': 1.4449298394330452, 'sideways_tsl_mult': 0.5309400920429801, 'sideways_time_stop': 13, 'sideways_use_sma': True, 'sideways_use_ema': False, 'sideways_use_atr': True, 'sideways_use_adx': True, 'sideways_use_spike': False, 'sideways_rsi_required': True}.
[I 2025-08-31 11:29:52,259] Trial 258 finished with values: [-1000000000.0, 1000000000.0] and parameters: {'p_sma': 31, 'p_std': 34, 'p_atr': 9, 'p_adx': 25, 'rsi_period': 66, 'ema1': 11, 'ema2': 32, 'slip_atr_k': 0.04482420481528008, 'slip_spread_k': 0.04279640959092185, 'spread_hl_frac': 0.0031136189091319493, 'bb_std_mult': 0.7793127682933114, 'rsi_os': 32, 'rsi_ob': 73, 'vol_spike': 0.12899412244142014, 'adx_thresh': 21.22752854203365, 'atr_min_pct': 0.0036828477589833093, 'atr_max_pct': 0.02984501441777532, 'tp_mult': 1.1341216454365997, 'tsl_mult': 0.24768329611418766, 'strategy': 'breakout', 'time_stop': 65, 'use_sma': True, 'use_atr': True, 'use_adx': False, 'use_ema': False, 'use_spike': True, 'rsi_required': True, 'edge_k': 0.3082278657229466, 'edge_cap': 0.8120164093190583, 'bull_strategy': 'breakout', 'bull_bb_std_mult': 2.8463501569832457, 'bull_rsi_os': 23, 'bull_rsi_ob': 75, 'bull_adx_thresh': 15.993420830783645, 'bull_atr_min_pct': 0.00441990594916515, 'bull_atr_max_pct': 0.03594918486267956, 'bull_tp_mult': 1.5157134527077347, 'bull_tsl_mult': 0.12829561778968557, 'bull_time_stop': 102, 'bull_use_sma': True, 'bull_use_ema': True, 'bull_use_atr': True, 'bull_use_adx': True, 'bull_use_spike': False, 'bull_rsi_required': True, 'bear_strategy': 'mean_reversion', 'bear_bb_std_mult': 0.9483337579006357, 'bear_rsi_os': 30, 'bear_rsi_ob': 67, 'bear_adx_thresh': 31.11619424316127, 'bear_atr_min_pct': 0.020677215418228458, 'bear_atr_max_pct': 0.11425918456376183, 'bear_tp_mult': 2.753292273328202, 'bear_tsl_mult': 0.3051174448950045, 'bear_time_stop': 252, 'bear_use_sma': False, 'bear_use_ema': True, 'bear_use_atr': True, 'bear_use_adx': False, 'bear_use_spike': True, 'bear_rsi_required': False, 'sideways_strategy': 'breakout', 'sideways_bb_std_mult': 1.674182467125816, 'sideways_rsi_os': 33, 'sideways_rsi_ob': 74, 'sideways_adx_thresh': 15.807124506579164, 'sideways_atr_min_pct': 0.010925440530747114, 'sideways_atr_max_pct': 0.038660628762607174, 'sideways_tp_mult': 1.3502063349372915, 'sideways_tsl_mult': 0.4571004011175306, 'sideways_time_stop': 13, 'sideways_use_sma': True, 'sideways_use_ema': False, 'sideways_use_atr': True, 'sideways_use_adx': True, 'sideways_use_spike': False, 'sideways_rsi_required': False}.
[I 2025-08-31 11:29:52,643] Trial 260 finished with values: [-1000000000.0, 1000000000.0] and parameters: {'p_sma': 31, 'p_std': 23, 'p_atr': 17, 'p_adx': 7, 'rsi_period': 37, 'ema1': 11, 'ema2': 27, 'slip_atr_k': 0.044421507940739124, 'slip_spread_k': 0.10786516011985808, 'spread_hl_frac': 0.0027307054363305146, 'bb_std_mult': 0.6203673493284135, 'rsi_os': 34, 'rsi_ob': 73, 'vol_spike': 0.1611901682649541, 'adx_thresh': 26.77470401530353, 'atr_min_pct': 0.004086986724085779, 'atr_max_pct': 0.021212210876689033, 'tp_mult': 2.780662575793127, 'tsl_mult': 0.2867798891618307, 'strategy': 'breakout', 'time_stop': 265, 'use_sma': True, 'use_atr': True, 'use_adx': True, 'use_ema': False, 'use_spike': True, 'rsi_required': True, 'edge_k': 1.8753706989576004, 'edge_cap': 0.17674300471412646, 'bull_strategy': 'breakout', 'bull_bb_std_mult': 2.5255248635660053, 'bull_rsi_os': 21, 'bull_rsi_ob': 93, 'bull_adx_thresh': 15.93727516020723, 'bull_atr_min_pct': 0.004295951662520697, 'bull_atr_max_pct': 0.13853908103912788, 'bull_tp_mult': 1.1620955181467958, 'bull_tsl_mult': 0.20530418652863536, 'bull_time_stop': 65, 'bull_use_sma': True, 'bull_use_ema': True, 'bull_use_atr': True, 'bull_use_adx': True, 'bull_use_spike': False, 'bull_rsi_required': True, 'bear_strategy': 'breakout', 'bear_bb_std_mult': 1.0842092384683921, 'bear_rsi_os': 28, 'bear_rsi_ob': 52, 'bear_adx_thresh': 31.069334424659516, 'bear_atr_min_pct': 0.019756634120061393, 'bear_atr_max_pct': 0.1145291462909605, 'bear_tp_mult': 2.6963600489389186, 'bear_tsl_mult': 0.3724644134842859, 'bear_time_stop': 238, 'bear_use_sma': False, 'bear_use_ema': True, 'bear_use_atr': True, 'bear_use_adx': False, 'bear_use_spike': True, 'bear_rsi_required': True, 'sideways_strategy': 'breakout', 'sideways_bb_std_mult': 1.6688101883351014, 'sideways_rsi_os': 53, 'sideways_rsi_ob': 95, 'sideways_adx_thresh': 9.773615524419768, 'sideways_atr_min_pct': 0.024402188758085433, 'sideways_atr_max_pct': 0.04600422572034849, 'sideways_tp_mult': 1.3456269096683346, 'sideways_tsl_mult': 0.25431987737743567, 'sideways_time_stop': 12, 'sideways_use_sma': True, 'sideways_use_ema': False, 'sideways_use_atr': True, 'sideways_use_adx': True, 'sideways_use_spike': False, 'sideways_rsi_required': True}.
