[I 2025-08-31 10:57:10,357] Trial 8 finished with values: [-0.02899240453937746, 0.028965543172191306] and parameters: {'p_sma': 50, 'p_std': 36, 'p_atr': 10, 'p_adx': 27, 'rsi_period': 65, 'ema1': 5, 'ema2': 19, 'slip_atr_k': 0.2260631284832495, 'slip_spread_k': 0.37406937338508617, 'spread_hl_frac': 0.04083024561050299, 'bb_std_mult': 3.008203547018895, 'rsi_os': 39, 'rsi_ob': 87, 'vol_spike': 0.23299511426954964, 'adx_thresh': 20.24627977874034, 'atr_min_pct': 0.023723882058846405, 'atr_max_pct': 0.07843335810138148, 'tp_mult': 1.2634462256677075, 'tsl_mult': 0.5426621690042512, 'strategy': 'mean_reversion', 'time_stop': 46, 'use_sma': True, 'use_atr': False, 'use_adx': True, 'use_ema': False, 'use_spike': False, 'rsi_required': False, 'edge_k': 1.1228677381144305, 'edge_cap': 0.8428487600145551, 'bull_strategy': 'breakout', 'bull_bb_std_mult': 0.8363232163919823, 'bull_rsi_os': 25, 'bull_rsi_ob': 92, 'bull_adx_thresh': 32.451693055996905, 'bull_atr_min_pct': 0.008445088595896075, 'bull_atr_max_pct': 0.14833103721013324, 'bull_tp_mult': 1.0951423973576941, 'bull_tsl_mult': 0.5449938967326691, 'bull_time_stop': 172, 'bull_use_sma': True, 'bull_use_ema': True, 'bull_use_atr': True, 'bull_use_adx': False, 'bull_use_spike': True, 'bull_rsi_required': False, 'bear_strategy': 'mean_reversion', 'bear_bb_std_mult': 3.228242328696375, 'bear_rsi_os': 12, 'bear_rsi_ob': 79, 'bear_adx_thresh': 6.285140247815276, 'bear_atr_min_pct': 0.005428548126452275, 'bear_atr_max_pct': 0.08532264901839534, 'bear_tp_mult': 1.668105022576443, 'bear_tsl_mult': 0.05304343142304124, 'bear_time_stop': 130, 'bear_use_sma': True, 'bear_use_ema': False, 'bear_use_atr': False, 'bear_use_adx': False, 'bear_use_spike': True, 'bear_rsi_required': False, 'sideways_strategy': 'breakout', 'sideways_bb_std_mult': 1.3742220082446317, 'sideways_rsi_os': 33, 'sideways_rsi_ob': 46, 'sideways_adx_thresh': 9.977232072186906, 'sideways_atr_min_pct': 0.00041418277832677486, 'sideways_atr_max_pct': 0.04190466219625312, 'sideways_tp_mult': 1.546211727701512, 'sideways_tsl_mult': 0.4379135624282223, 'sideways_time_stop': 16, 'sideways_use_sma': True, 'sideways_use_ema': True, 'sideways_use_atr': False, 'sideways_use_adx': False, 'sideways_use_spike': False, 'sideways_rsi_required': False}.
[I 2025-08-31 10:57:40,511] Trial 10 finished with values: [-1000000000.0, 1000000000.0] and parameters: {'p_sma': 31, 'p_std': 6, 'p_atr': 29, 'p_adx': 16, 'rsi_period': 83, 'ema1': 11, 'ema2': 20, 'slip_atr_k': 0.010797301409949417, 'slip_spread_k': 0.04230060967416016, 'spread_hl_frac': 0.04090415090011715, 'bb_std_mult': 0.5717031385465938, 'rsi_os': 19, 'rsi_ob': 48, 'vol_spike': 0.29555523491104835, 'adx_thresh': 5.057020235881997, 'atr_min_pct': 0.012346187446414459, 'atr_max_pct': 0.14375364889791284, 'tp_mult': 1.2839568916018693, 'tsl_mult': 0.8968987283296126, 'strategy': 'breakout', 'time_stop': 155, 'use_sma': True, 'use_atr': False, 'use_adx': False, 'use_ema': False, 'use_spike': False, 'rsi_required': True, 'edge_k': 0.948333093287133, 'edge_cap': 0.9940768722351897, 'bull_strategy': 'mean_reversion', 'bull_bb_std_mult': 2.5657068486570775, 'bull_rsi_os': 55, 'bull_rsi_ob': 67, 'bull_adx_thresh': 10.976106264252875, 'bull_atr_min_pct': 0.0062521406519809, 'bull_atr_max_pct': 0.0637631602817352, 'bull_tp_mult': 1.4754440864462528, 'bull_tsl_mult': 0.6677844814384009, 'bull_time_stop': 222, 'bull_use_sma': True, 'bull_use_ema': False, 'bull_use_atr': True, 'bull_use_adx': False, 'bull_use_spike': True, 'bull_rsi_required': False, 'bear_strategy': 'breakout', 'bear_bb_std_mult': 0.82314459423337, 'bear_rsi_os': 49, 'bear_rsi_ob': 87, 'bear_adx_thresh': 11.760085959026089, 'bear_atr_min_pct': 0.010935453140150517, 'bear_atr_max_pct': 0.10378189683326366, 'bear_tp_mult': 2.348931864533761, 'bear_tsl_mult': 0.8157777701084105, 'bear_time_stop': 174, 'bear_use_sma': True, 'bear_use_ema': False, 'bear_use_atr': True, 'bear_use_adx': True, 'bear_use_spike': True, 'bear_rsi_required': True, 'sideways_strategy': 'breakout', 'sideways_bb_std_mult': 3.4356368146446297, 'sideways_rsi_os': 34, 'sideways_rsi_ob': 89, 'sideways_adx_thresh': 17.77963937627156, 'sideways_atr_min_pct': 0.01618923177252719, 'sideways_atr_max_pct': 0.11544070641256629, 'sideways_tp_mult': 2.58960610843734, 'sideways_tsl_mult': 0.19596544904043833, 'sideways_time_stop': 93, 'sideways_use_sma': True, 'sideways_use_ema': False, 'sideways_use_atr': False, 'sideways_use_adx': True, 'sideways_use_spike': True, 'sideways_rsi_required': False}.
[I 2025-08-31 10:57:41,452] Trial 13 finished with values: [-1000000000.0, 1000000000.0] and parameters: {'p_sma': 15, 'p_std': 47, 'p_atr': 16, 'p_adx': 17, 'rsi_period': 7, 'ema1': 13, 'ema2': 57, 'slip_atr_k': 0.009289641702809978, 'slip_spread_k': 0.9774363399537871, 'spread_hl_frac': 0.03483553017393853, 'bb_std_mult': 1.4700674125722444, 'rsi_os': 54, 'rsi_ob': 60, 'vol_spike': 0.2914560084872179, 'adx_thresh': 12.61152792198183, 'atr_min_pct': 0.013581750280002141, 'atr_max_pct': 0.14792736714426413, 'tp_mult': 2.507239777914701, 'tsl_mult': 0.9165293089866786, 'strategy': 'breakout', 'time_stop': 299, 'use_sma': False, 'use_atr': False, 'use_adx': False, 'use_ema': True, 'use_spike': True, 'rsi_required': False, 'edge_k': 1.2840096046857183, 'edge_cap': 0.23491088318878017, 'bull_strategy': 'mean_reversion', 'bull_bb_std_mult': 2.390283869208723, 'bull_rsi_os': 6, 'bull_rsi_ob': 66, 'bull_adx_thresh': 21.427597588610357, 'bull_atr_min_pct': 0.020775466037640546, 'bull_atr_max_pct': 0.13314002211476095, 'bull_tp_mult': 1.0363298914897894, 'bull_tsl_mult': 0.011823529150821965, 'bull_time_stop': 77, 'bull_use_sma': True, 'bull_use_ema': True, 'bull_use_atr': True, 'bull_use_adx': False, 'bull_use_spike': True, 'bull_rsi_required': True, 'bear_strategy': 'breakout', 'bear_bb_std_mult': 0.5667496838131949, 'bear_rsi_os': 36, 'bear_rsi_ob': 52, 'bear_adx_thresh': 18.78238879996556, 'bear_atr_min_pct': 0.025307361799169974, 'bear_atr_max_pct': 0.011036483556285753, 'bear_tp_mult': 2.8067778347704464, 'bear_tsl_mult': 0.8250725887731979, 'bear_time_stop': 19, 'bear_use_sma': False, 'bear_use_ema': True, 'bear_use_atr': False, 'bear_use_adx': True, 'bear_use_spike': False, 'bear_rsi_required': False, 'sideways_strategy': 'mean_reversion', 'sideways_bb_std_mult': 3.451233337493832, 'sideways_rsi_os': 5, 'sideways_rsi_ob': 94, 'sideways_adx_thresh': 26.245589064154274, 'sideways_atr_min_pct': 0.008210172186588031, 'sideways_atr_max_pct': 0.11935488737827321, 'sideways_tp_mult': 2.915539800280774, 'sideways_tsl_mult': 0.018335806178755854, 'sideways_time_stop': 97, 'sideways_use_sma': False, 'sideways_use_ema': False, 'sideways_use_atr': True, 'sideways_use_adx': True, 'sideways_use_spike': False, 'sideways_rsi_required': True}.
[I 2025-08-31 10:57:42,043] Trial 11 finished with values: [-1000000000.0, 1000000000.0] and parameters: {'p_sma': 31, 'p_std': 20, 'p_atr': 10, 'p_adx': 29, 'rsi_period': 53, 'ema1': 29, 'ema2': 55, 'slip_atr_k': 0.2174370820120271, 'slip_spread_k': 0.015310627777144092, 'spread_hl_frac': 0.005359745490470042, 'bb_std_mult': 0.9148686278842062, 'rsi_os': 25, 'rsi_ob': 93, 'vol_spike': 0.20109781201124205, 'adx_thresh': 33.69178223652169, 'atr_min_pct': 0.025524251321430744, 'atr_max_pct': 0.030350383715648396, 'tp_mult': 2.823744993781495, 'tsl_mult': 0.16193169589763812, 'strategy': 'mean_reversion', 'time_stop': 20, 'use_sma': True, 'use_atr': False, 'use_adx': False, 'use_ema': True, 'use_spike': True, 'rsi_required': True, 'edge_k': 0.7999628690103007, 'edge_cap': 0.25501012516592286, 'bull_strategy': 'mean_reversion', 'bull_bb_std_mult': 3.47441244759005, 'bull_rsi_os': 46, 'bull_rsi_ob': 71, 'bull_adx_thresh': 23.518503844711137, 'bull_atr_min_pct': 0.0050767967051709596, 'bull_atr_max_pct': 0.0867808358903543, 'bull_tp_mult': 1.7485011962494315, 'bull_tsl_mult': 0.5391986589153048, 'bull_time_stop': 163, 'bull_use_sma': True, 'bull_use_ema': False, 'bull_use_atr': False, 'bull_use_adx': True, 'bull_use_spike': False, 'bull_rsi_required': True, 'bear_strategy': 'breakout', 'bear_bb_std_mult': 1.5589294613731306, 'bear_rsi_os': 10, 'bear_rsi_ob': 81, 'bear_adx_thresh': 8.847727775553498, 'bear_atr_min_pct': 0.011330024541685458, 'bear_atr_max_pct': 0.08806488930477453, 'bear_tp_mult': 1.7922435928674363, 'bear_tsl_mult': 0.5245654796225426, 'bear_time_stop': 135, 'bear_use_sma': False, 'bear_use_ema': True, 'bear_use_atr': False, 'bear_use_adx': False, 'bear_use_spike': True, 'bear_rsi_required': True, 'sideways_strategy': 'breakout', 'sideways_bb_std_mult': 2.8505542121454996, 'sideways_rsi_os': 28, 'sideways_rsi_ob': 47, 'sideways_adx_thresh': 11.726815150858611, 'sideways_atr_min_pct': 0.007975776825094887, 'sideways_atr_max_pct': 0.13011191203471786, 'sideways_tp_mult': 2.8557656841085386, 'sideways_tsl_mult': 0.6168968092626358, 'sideways_time_stop': 188, 'sideways_use_sma': False, 'sideways_use_ema': True, 'sideways_use_atr': False, 'sideways_use_adx': False, 'sideways_use_spike': True, 'sideways_rsi_required': True}.
[I 2025-08-31 10:57:42,253] Trial 12 finished with values: [-1000000000.0, 1000000000.0] and parameters: {'p_sma': 41, 'p_std': 5, 'p_atr': 30, 'p_adx': 16, 'rsi_period': 69, 'ema1': 10, 'ema2': 35, 'slip_atr_k': 0.10906022631443724, 'slip_spread_k': 0.6571161894562039, 'spread_hl_frac': 0.00978392730849393, 'bb_std_mult': 1.3836717650616996, 'rsi_os': 24, 'rsi_ob': 64, 'vol_spike': 0.17970720749978095, 'adx_thresh': 24.03226287610522, 'atr_min_pct': 0.015162548271466595, 'atr_max_pct': 0.07199677347480114, 'tp_mult': 2.080373879416742, 'tsl_mult': 0.0753178067561251, 'strategy': 'mean_reversion', 'time_stop': 66, 'use_sma': False, 'use_atr': False, 'use_adx': True, 'use_ema': False, 'use_spike': False, 'rsi_required': True, 'edge_k': 0.3724815914073938, 'edge_cap': 0.09844463322573149, 'bull_strategy': 'mean_reversion', 'bull_bb_std_mult': 3.05879367824763, 'bull_rsi_os': 5, 'bull_rsi_ob': 73, 'bull_adx_thresh': 5.081878176198085, 'bull_atr_min_pct': 0.0025887858729885392, 'bull_atr_max_pct': 0.03880566039335731, 'bull_tp_mult': 1.558773455771885, 'bull_tsl_mult': 0.05929985980163488, 'bull_time_stop': 45, 'bull_use_sma': False, 'bull_use_ema': True, 'bull_use_atr': False, 'bull_use_adx': True, 'bull_use_spike': True, 'bull_rsi_required': False, 'bear_strategy': 'breakout', 'bear_bb_std_mult': 2.88170220850395, 'bear_rsi_os': 29, 'bear_rsi_ob': 62, 'bear_adx_thresh': 30.564665462764513, 'bear_atr_min_pct': 0.02303864307299939, 'bear_atr_max_pct': 0.1348913242754797, 'bear_tp_mult': 1.798396330976754, 'bear_tsl_mult': 0.5983653516141124, 'bear_time_stop': 202, 'bear_use_sma': False, 'bear_use_ema': False, 'bear_use_atr': True, 'bear_use_adx': True, 'bear_use_spike': True, 'bear_rsi_required': True, 'sideways_strategy': 'mean_reversion', 'sideways_bb_std_mult': 0.8950460834529274, 'sideways_rsi_os': 50, 'sideways_rsi_ob': 71, 'sideways_adx_thresh': 12.642199837934701, 'sideways_atr_min_pct': 0.015262869133564996, 'sideways_atr_max_pct': 0.04400736963472805, 'sideways_tp_mult': 2.3570289002127507, 'sideways_tsl_mult': 0.6532581787392966, 'sideways_time_stop': 132, 'sideways_use_sma': True, 'sideways_use_ema': True, 'sideways_use_atr': True, 'sideways_use_adx': False, 'sideways_use_spike': True, 'sideways_rsi_required': True}.
[I 2025-08-31 10:58:15,028] Trial 14 finished with values: [-1000000000.0, 1000000000.0] and parameters: {'p_sma': 15, 'p_std': 40, 'p_atr': 16, 'p_adx': 30, 'rsi_period': 16, 'ema1': 5, 'ema2': 58, 'slip_atr_k': 0.07844547000941679, 'slip_spread_k': 0.9497494209753907, 'spread_hl_frac': 0.03513339105561362, 'bb_std_mult': 1.5428054579280153, 'rsi_os': 54, 'rsi_ob': 60, 'vol_spike': 0.2584638758679717, 'adx_thresh': 14.131855509855928, 'atr_min_pct': 0.017363009485657804, 'atr_max_pct': 0.14707272197579108, 'tp_mult': 2.562803767311392, 'tsl_mult': 0.383382170331927, 'strategy': 'breakout', 'time_stop': 251, 'use_sma': False, 'use_atr': False, 'use_adx': True, 'use_ema': True, 'use_spike': True, 'rsi_required': False, 'edge_k': 1.4684802384990605, 'edge_cap': 0.2208917299109764, 'bull_strategy': 'mean_reversion', 'bull_bb_std_mult': 2.1799037304364854, 'bull_rsi_os': 7, 'bull_rsi_ob': 82, 'bull_adx_thresh': 24.52324398058769, 'bull_atr_min_pct': 0.02083496944108394, 'bull_atr_max_pct': 0.14284001814195352, 'bull_tp_mult': 1.1561913483042696, 'bull_tsl_mult': 0.08182318714537623, 'bull_time_stop': 79, 'bull_use_sma': True, 'bull_use_ema': True, 'bull_use_atr': False, 'bull_use_adx': False, 'bull_use_spike': True, 'bull_rsi_required': True, 'bear_strategy': 'breakout', 'bear_bb_std_mult': 3.4867427956624963, 'bear_rsi_os': 37, 'bear_rsi_ob': 50, 'bear_adx_thresh': 17.648652369685898, 'bear_atr_min_pct': 0.025718448830093575, 'bear_atr_max_pct': 0.013663071156605061, 'bear_tp_mult': 2.995504886181467, 'bear_tsl_mult': 0.4706930299057157, 'bear_time_stop': 5, 'bear_use_sma': False, 'bear_use_ema': True, 'bear_use_atr': False, 'bear_use_adx': True, 'bear_use_spike': False, 'bear_rsi_required': False, 'sideways_strategy': 'breakout', 'sideways_bb_std_mult': 1.6137589858624288, 'sideways_rsi_os': 7, 'sideways_rsi_ob': 94, 'sideways_adx_thresh': 26.31771390998771, 'sideways_atr_min_pct': 0.0012044116440407268, 'sideways_atr_max_pct': 0.04918434403837982, 'sideways_tp_mult': 2.978394011830666, 'sideways_tsl_mult': 0.04070091828458175, 'sideways_time_stop': 12, 'sideways_use_sma': True, 'sideways_use_ema': True, 'sideways_use_atr': True, 'sideways_use_adx': False, 'sideways_use_spike': False, 'sideways_rsi_required': True}.
[I 2025-08-31 10:58:15,500] Trial 15 finished with values: [-1000000000.0, 1000000000.0] and parameters: {'p_sma': 21, 'p_std': 38, 'p_atr': 16, 'p_adx': 28, 'rsi_period': 67, 'ema1': 5, 'ema2': 49, 'slip_atr_k': 0.08562973208125108, 'slip_spread_k': 0.6187951806232467, 'spread_hl_frac': 0.04826640036720023, 'bb_std_mult': 1.6737023703202372, 'rsi_os': 33, 'rsi_ob': 91, 'vol_spike': 0.2449314029299801, 'adx_thresh': 14.163539204399484, 'atr_min_pct': 0.017954517751601756, 'atr_max_pct': 0.12259793237663254, 'tp_mult': 1.5498150735955567, 'tsl_mult': 0.32320777719663785, 'strategy': 'breakout', 'time_stop': 230, 'use_sma': False, 'use_atr': False, 'use_adx': True, 'use_ema': True, 'use_spike': True, 'rsi_required': False, 'edge_k': 1.3942179671905623, 'edge_cap': 0.3566328583086572, 'bull_strategy': 'mean_reversion', 'bull_bb_std_mult': 1.7896866419387165, 'bull_rsi_os': 16, 'bull_rsi_ob': 81, 'bull_adx_thresh': 26.123863790213385, 'bull_atr_min_pct': 0.020570792671090035, 'bull_atr_max_pct': 0.12938188526234048, 'bull_tp_mult': 2.9852009307162075, 'bull_tsl_mult': 0.22917091063734996, 'bull_time_stop': 109, 'bull_use_sma': True, 'bull_use_ema': True, 'bull_use_atr': False, 'bull_use_adx': False, 'bull_use_spike': True, 'bull_rsi_required': True, 'bear_strategy': 'breakout', 'bear_bb_std_mult': 3.2157157062512347, 'bear_rsi_os': 23, 'bear_rsi_ob': 73, 'bear_adx_thresh': 21.58313393385657, 'bear_atr_min_pct': 0.022016336546476847, 'bear_atr_max_pct': 0.10353893722906032, 'bear_tp_mult': 2.8913677427529687, 'bear_tsl_mult': 0.01607288818593866, 'bear_time_stop': 29, 'bear_use_sma': False, 'bear_use_ema': True, 'bear_use_atr': False, 'bear_use_adx': True, 'bear_use_spike': False, 'bear_rsi_required': False, 'sideways_strategy': 'breakout', 'sideways_bb_std_mult': 1.7106789409035095, 'sideways_rsi_os': 24, 'sideways_rsi_ob': 72, 'sideways_adx_thresh': 10.83160341009007, 'sideways_atr_min_pct': 0.0006233473982007337, 'sideways_atr_max_pct': 0.045645170296744794, 'sideways_tp_mult': 2.927817599211861, 'sideways_tsl_mult': 0.07366805695326933, 'sideways_time_stop': 288, 'sideways_use_sma': True, 'sideways_use_ema': True, 'sideways_use_atr': True, 'sideways_use_adx': False, 'sideways_use_spike': False, 'sideways_rsi_required': True}.
[I 2025-08-31 10:58:15,726] Trial 16 finished with values: [-1000000000.0, 1000000000.0] and parameters: {'p_sma': 22, 'p_std': 37, 'p_atr': 16, 'p_adx': 30, 'rsi_period': 70, 'ema1': 5, 'ema2': 29, 'slip_atr_k': 0.07949077134324226, 'slip_spread_k': 0.5803477808221409, 'spread_hl_frac': 0.04690338377283261, 'bb_std_mult': 1.7719736024084627, 'rsi_os': 34, 'rsi_ob': 64, 'vol_spike': 0.25879593511132193, 'adx_thresh': 14.165274705794648, 'atr_min_pct': 0.019360802773996925, 'atr_max_pct': 0.0637174685697906, 'tp_mult': 1.572474951592367, 'tsl_mult': 0.4224141026164723, 'strategy': 'breakout', 'time_stop': 232, 'use_sma': False, 'use_atr': False, 'use_adx': True, 'use_ema': True, 'use_spike': False, 'rsi_required': False, 'edge_k': 1.4215756540151017, 'edge_cap': 0.40970456129771504, 'bull_strategy': 'mean_reversion', 'bull_bb_std_mult': 0.658870458432194, 'bull_rsi_os': 16, 'bull_rsi_ob': 86, 'bull_adx_thresh': 26.425180286073893, 'bull_atr_min_pct': 0.02119736833185384, 'bull_atr_max_pct': 0.12719902016755924, 'bull_tp_mult': 2.8160278048884764, 'bull_tsl_mult': 0.21931874820173897, 'bull_time_stop': 94, 'bull_use_sma': True, 'bull_use_ema': True, 'bull_use_atr': False, 'bull_use_adx': False, 'bull_use_spike': True, 'bull_rsi_required': True, 'bear_strategy': 'breakout', 'bear_bb_std_mult': 3.331539420478312, 'bear_rsi_os': 21, 'bear_rsi_ob': 72, 'bear_adx_thresh': 20.682446769049196, 'bear_atr_min_pct': 0.021820494101439256, 'bear_atr_max_pct': 0.10928818500265726, 'bear_tp_mult': 2.9962214870961383, 'bear_tsl_mult': 0.03407834463908871, 'bear_time_stop': 49, 'bear_use_sma': False, 'bear_use_ema': False, 'bear_use_atr': False, 'bear_use_adx': True, 'bear_use_spike': False, 'bear_rsi_required': False, 'sideways_strategy': 'breakout', 'sideways_bb_std_mult': 1.7896203030732853, 'sideways_rsi_os': 17, 'sideways_rsi_ob': 71, 'sideways_adx_thresh': 23.638393194533247, 'sideways_atr_min_pct': 1.501274928968348e-05, 'sideways_atr_max_pct': 0.010002716314742928, 'sideways_tp_mult': 2.131081032551452, 'sideways_tsl_mult': 0.004954723468560546, 'sideways_time_stop': 288, 'sideways_use_sma': True, 'sideways_use_ema': True, 'sideways_use_atr': True, 'sideways_use_adx': False, 'sideways_use_spike': False, 'sideways_rsi_required': True}.
[I 2025-08-31 10:58:15,964] Trial 17 finished with values: [-1000000000.0, 1000000000.0] and parameters: {'p_sma': 20, 'p_std': 38, 'p_atr': 16, 'p_adx': 29, 'rsi_period': 28, 'ema1': 5, 'ema2': 51, 'slip_atr_k': 0.07249699868659733, 'slip_spread_k': 0.9520677949595608, 'spread_hl_frac': 0.049623914175126294, 'bb_std_mult': 1.9376904198849607, 'rsi_os': 35, 'rsi_ob': 88, 'vol_spike': 0.25143105775998886, 'adx_thresh': 15.456869954023944, 'atr_min_pct': 0.020265232502444316, 'atr_max_pct': 0.12330592964108539, 'tp_mult': 1.564712964132314, 'tsl_mult': 0.4071175024442248, 'strategy': 'breakout', 'time_stop': 229, 'use_sma': False, 'use_atr': False, 'use_adx': True, 'use_ema': True, 'use_spike': False, 'rsi_required': False, 'edge_k': 1.3014880255036616, 'edge_cap': 0.40589170305001376, 'bull_strategy': 'mean_reversion', 'bull_bb_std_mult': 0.5174107254885003, 'bull_rsi_os': 18, 'bull_rsi_ob': 84, 'bull_adx_thresh': 34.92624242926451, 'bull_atr_min_pct': 0.021632031994790753, 'bull_atr_max_pct': 0.12620760291621363, 'bull_tp_mult': 2.860073366994217, 'bull_tsl_mult': 0.20418220595131104, 'bull_time_stop': 99, 'bull_use_sma': True, 'bull_use_ema': True, 'bull_use_atr': False, 'bull_use_adx': False, 'bull_use_spike': True, 'bull_rsi_required': True, 'bear_strategy': 'breakout', 'bear_bb_std_mult': 3.3134897686112286, 'bear_rsi_os': 22, 'bear_rsi_ob': 73, 'bear_adx_thresh': 17.98391885181605, 'bear_atr_min_pct': 0.021194615775041222, 'bear_atr_max_pct': 0.10509082014814354, 'bear_tp_mult': 2.8092368870893014, 'bear_tsl_mult': 0.36896273094960896, 'bear_time_stop': 54, 'bear_use_sma': False, 'bear_use_ema': False, 'bear_use_atr': False, 'bear_use_adx': True, 'bear_use_spike': False, 'bear_rsi_required': False, 'sideways_strategy': 'breakout', 'sideways_bb_std_mult': 1.5458119208098013, 'sideways_rsi_os': 19, 'sideways_rsi_ob': 95, 'sideways_adx_thresh': 28.825058329342525, 'sideways_atr_min_pct': 0.00046385730909776477, 'sideways_atr_max_pct': 0.06123905400998968, 'sideways_tp_mult': 2.123338949667057, 'sideways_tsl_mult': 0.007123456284420293, 'sideways_time_stop': 19, 'sideways_use_sma': True, 'sideways_use_ema': True, 'sideways_use_atr': True, 'sideways_use_adx': False, 'sideways_use_spike': False, 'sideways_rsi_required': True}.
