[I 2025-08-31 11:35:56,289] Trial 317 finished with values: [-1000000000.0, 1000000000.0] and parameters: {'p_sma': 25, 'p_std': 51, 'p_atr': 14, 'p_adx': 22, 'rsi_period': 48, 'ema1': 28, 'ema2': 25, 'slip_atr_k': 0.05960233127294513, 'slip_spread_k': 0.09037532450867967, 'spread_hl_frac': 0.008051512291159562, 'bb_std_mult': 0.5629545990344769, 'rsi_os': 33, 'rsi_ob': 65, 'vol_spike': 0.21937262893689236, 'adx_thresh': 5.771423983177142, 'atr_min_pct': 0.005199701667327398, 'atr_max_pct': 0.016195814907936423, 'tp_mult': 2.310037452970244, 'tsl_mult': 0.26226695796279814, 'strategy': 'breakout', 'time_stop': 294, 'use_sma': True, 'use_atr': True, 'use_adx': False, 'use_ema': True, 'use_spike': True, 'rsi_required': False, 'edge_k': 0.6194868137618732, 'edge_cap': 0.7446289216943283, 'bull_strategy': 'breakout', 'bull_bb_std_mult': 2.647023856363655, 'bull_rsi_os': 25, 'bull_rsi_ob': 64, 'bull_adx_thresh': 23.788729714847474, 'bull_atr_min_pct': 0.004471005969977265, 'bull_atr_max_pct': 0.11395857238828055, 'bull_tp_mult': 2.4160065449003723, 'bull_tsl_mult': 0.2814644504582968, 'bull_time_stop': 220, 'bull_use_sma': True, 'bull_use_ema': True, 'bull_use_atr': True, 'bull_use_adx': False, 'bull_use_spike': True, 'bull_rsi_required': True, 'bear_strategy': 'mean_reversion', 'bear_bb_std_mult': 0.9017350983657934, 'bear_rsi_os': 55, 'bear_rsi_ob': 54, 'bear_adx_thresh': 19.821016829007917, 'bear_atr_min_pct': 0.01550973812597128, 'bear_atr_max_pct': 0.08966278993812506, 'bear_tp_mult': 1.3080140252795025, 'bear_tsl_mult': 0.2911523374777072, 'bear_time_stop': 13, 'bear_use_sma': False, 'bear_use_ema': True, 'bear_use_atr': False, 'bear_use_adx': True, 'bear_use_spike': False, 'bear_rsi_required': True, 'sideways_strategy': 'breakout', 'sideways_bb_std_mult': 2.7437496418844556, 'sideways_rsi_os': 26, 'sideways_rsi_ob': 73, 'sideways_adx_thresh': 23.37207891442424, 'sideways_atr_min_pct': 0.001688571071027967, 'sideways_atr_max_pct': 0.11716843422941803, 'sideways_tp_mult': 1.498603026467809, 'sideways_tsl_mult': 0.2580894419696036, 'sideways_time_stop': 187, 'sideways_use_sma': True, 'sideways_use_ema': False, 'sideways_use_atr': True, 'sideways_use_adx': True, 'sideways_use_spike': False, 'sideways_rsi_required': True}.
[I 2025-08-31 11:35:56,692] Trial 315 finished with values: [-0.05662238304463629, 0.05633351981191167] and parameters: {'p_sma': 13, 'p_std': 16, 'p_atr': 13, 'p_adx': 27, 'rsi_period': 48, 'ema1': 13, 'ema2': 25, 'slip_atr_k': 0.05915152500595426, 'slip_spread_k': 0.08429082007144922, 'spread_hl_frac': 0.0016408314388154442, 'bb_std_mult': 1.6476241953097261, 'rsi_os': 16, 'rsi_ob': 70, 'vol_spike': 0.22039906351560834, 'adx_thresh': 26.34521415571165, 'atr_min_pct': 0.006001570703529484, 'atr_max_pct': 0.03097970304700446, 'tp_mult': 1.198227424855423, 'tsl_mult': 0.23405154345433565, 'strategy': 'breakout', 'time_stop': 294, 'use_sma': False, 'use_atr': False, 'use_adx': True, 'use_ema': False, 'use_spike': True, 'rsi_required': True, 'edge_k': 1.4395493021118628, 'edge_cap': 0.7525544438931081, 'bull_strategy': 'breakout', 'bull_bb_std_mult': 1.8638431706421976, 'bull_rsi_os': 28, 'bull_rsi_ob': 47, 'bull_adx_thresh': 15.214880895376249, 'bull_atr_min_pct': 0.00469069181013905, 'bull_atr_max_pct': 0.085975271135217, 'bull_tp_mult': 1.5114819396155832, 'bull_tsl_mult': 0.27558992789400455, 'bull_time_stop': 143, 'bull_use_sma': True, 'bull_use_ema': True, 'bull_use_atr': True, 'bull_use_adx': True, 'bull_use_spike': False, 'bull_rsi_required': True, 'bear_strategy': 'breakout', 'bear_bb_std_mult': 0.9343828957435847, 'bear_rsi_os': 34, 'bear_rsi_ob': 68, 'bear_adx_thresh': 33.20759427038605, 'bear_atr_min_pct': 0.016305074594017317, 'bear_atr_max_pct': 0.12354906959557221, 'bear_tp_mult': 1.3141460967712308, 'bear_tsl_mult': 0.35745674926829046, 'bear_time_stop': 111, 'bear_use_sma': False, 'bear_use_ema': True, 'bear_use_atr': True, 'bear_use_adx': False, 'bear_use_spike': True, 'bear_rsi_required': False, 'sideways_strategy': 'breakout', 'sideways_bb_std_mult': 1.7220252732344026, 'sideways_rsi_os': 47, 'sideways_rsi_ob': 72, 'sideways_adx_thresh': 14.878709783289178, 'sideways_atr_min_pct': 0.0024220593872990915, 'sideways_atr_max_pct': 0.05252322116782708, 'sideways_tp_mult': 2.6936371389193727, 'sideways_tsl_mult': 0.36744182173166096, 'sideways_time_stop': 271, 'sideways_use_sma': True, 'sideways_use_ema': True, 'sideways_use_atr': True, 'sideways_use_adx': True, 'sideways_use_spike': False, 'sideways_rsi_required': True}.
[I 2025-08-31 11:35:56,860] Trial 318 finished with values: [-1000000000.0, 1000000000.0] and parameters: {'p_sma': 36, 'p_std': 47, 'p_atr': 14, 'p_adx': 23, 'rsi_period': 14, 'ema1': 27, 'ema2': 36, 'slip_atr_k': 0.06101214598083545, 'slip_spread_k': 0.9325245877793515, 'spread_hl_frac': 0.0018017210307536297, 'bb_std_mult': 0.5855571298084804, 'rsi_os': 45, 'rsi_ob': 73, 'vol_spike': 0.09799033248044418, 'adx_thresh': 23.918363405288286, 'atr_min_pct': 0.022521261399278163, 'atr_max_pct': 0.10388663030037351, 'tp_mult': 2.2915155603607515, 'tsl_mult': 0.263490991389189, 'strategy': 'breakout', 'time_stop': 182, 'use_sma': True, 'use_atr': True, 'use_adx': False, 'use_ema': True, 'use_spike': True, 'rsi_required': False, 'edge_k': 0.37080862329510683, 'edge_cap': 0.8026336046179884, 'bull_strategy': 'breakout', 'bull_bb_std_mult': 2.6187416144727225, 'bull_rsi_os': 26, 'bull_rsi_ob': 64, 'bull_adx_thresh': 32.57092720928463, 'bull_atr_min_pct': 0.004570758432134146, 'bull_atr_max_pct': 0.057564506083509215, 'bull_tp_mult': 2.3789499464017148, 'bull_tsl_mult': 0.3617600015713971, 'bull_time_stop': 56, 'bull_use_sma': True, 'bull_use_ema': True, 'bull_use_atr': True, 'bull_use_adx': False, 'bull_use_spike': True, 'bull_rsi_required': True, 'bear_strategy': 'mean_reversion', 'bear_bb_std_mult': 1.2902910896905313, 'bear_rsi_os': 33, 'bear_rsi_ob': 68, 'bear_adx_thresh': 33.19150657474009, 'bear_atr_min_pct': 0.016287048982971782, 'bear_atr_max_pct': 0.12432962468125879, 'bear_tp_mult': 2.6221200809539815, 'bear_tsl_mult': 0.7898785818635063, 'bear_time_stop': 171, 'bear_use_sma': False, 'bear_use_ema': True, 'bear_use_atr': False, 'bear_use_adx': True, 'bear_use_spike': False, 'bear_rsi_required': True, 'sideways_strategy': 'breakout', 'sideways_bb_std_mult': 1.6434371754328219, 'sideways_rsi_os': 26, 'sideways_rsi_ob': 73, 'sideways_adx_thresh': 33.99970939290017, 'sideways_atr_min_pct': 0.011290050040648241, 'sideways_atr_max_pct': 0.04102047437516677, 'sideways_tp_mult': 1.4775315326897331, 'sideways_tsl_mult': 0.3745214500807735, 'sideways_time_stop': 5, 'sideways_use_sma': True, 'sideways_use_ema': False, 'sideways_use_atr': True, 'sideways_use_adx': True, 'sideways_use_spike': False, 'sideways_rsi_required': True}.
[I 2025-08-31 11:35:57,316] Trial 316 finished with values: [-1000000000.0, 1000000000.0] and parameters: {'p_sma': 26, 'p_std': 16, 'p_atr': 13, 'p_adx': 22, 'rsi_period': 41, 'ema1': 27, 'ema2': 25, 'slip_atr_k': 0.046798558063216984, 'slip_spread_k': 0.07293050641556828, 'spread_hl_frac': 0.001970792274105925, 'bb_std_mult': 0.6499883035569993, 'rsi_os': 33, 'rsi_ob': 72, 'vol_spike': 0.0855015559243875, 'adx_thresh': 13.667042558090472, 'atr_min_pct': 0.006158053004565518, 'atr_max_pct': 0.03081417009483911, 'tp_mult': 1.7761375442824547, 'tsl_mult': 0.2369941217267651, 'strategy': 'breakout', 'time_stop': 294, 'use_sma': True, 'use_atr': True, 'use_adx': False, 'use_ema': False, 'use_spike': True, 'rsi_required': True, 'edge_k': 0.6125076026920162, 'edge_cap': 0.7645814508612805, 'bull_strategy': 'mean_reversion', 'bull_bb_std_mult': 1.567044736778402, 'bull_rsi_os': 23, 'bull_rsi_ob': 63, 'bull_adx_thresh': 23.938058317212228, 'bull_atr_min_pct': 0.02342853698499566, 'bull_atr_max_pct': 0.1495693287386144, 'bull_tp_mult': 2.396338429218354, 'bull_tsl_mult': 0.2820166119436724, 'bull_time_stop': 58, 'bull_use_sma': True, 'bull_use_ema': True, 'bull_use_atr': True, 'bull_use_adx': False, 'bull_use_spike': False, 'bull_rsi_required': True, 'bear_strategy': 'breakout', 'bear_bb_std_mult': 1.270642343693511, 'bear_rsi_os': 34, 'bear_rsi_ob': 87, 'bear_adx_thresh': 13.690057281629542, 'bear_atr_min_pct': 0.01615372356751411, 'bear_atr_max_pct': 0.0630069794474599, 'bear_tp_mult': 1.6932268856958175, 'bear_tsl_mult': 0.020862157194182995, 'bear_time_stop': 210, 'bear_use_sma': False, 'bear_use_ema': True, 'bear_use_atr': True, 'bear_use_adx': False, 'bear_use_spike': True, 'bear_rsi_required': False, 'sideways_strategy': 'breakout', 'sideways_bb_std_mult': 0.5663358387719271, 'sideways_rsi_os': 31, 'sideways_rsi_ob': 72, 'sideways_adx_thresh': 10.340506369801654, 'sideways_atr_min_pct': 0.01187860745162807, 'sideways_atr_max_pct': 0.0403826211527793, 'sideways_tp_mult': 2.9519610679192874, 'sideways_tsl_mult': 0.43608334452013997, 'sideways_time_stop': 5, 'sideways_use_sma': True, 'sideways_use_ema': True, 'sideways_use_atr': True, 'sideways_use_adx': True, 'sideways_use_spike': False, 'sideways_rsi_required': False}.
[I 2025-08-31 11:36:30,082] Trial 321 finished with values: [-1000000000.0, 1000000000.0] and parameters: {'p_sma': 15, 'p_std': 14, 'p_atr': 15, 'p_adx': 28, 'rsi_period': 50, 'ema1': 12, 'ema2': 30, 'slip_atr_k': 0.08834553748854099, 'slip_spread_k': 0.46229740488691745, 'spread_hl_frac': 0.026317350700592854, 'bb_std_mult': 0.8687372681498469, 'rsi_os': 34, 'rsi_ob': 56, 'vol_spike': 0.07307211043755747, 'adx_thresh': 25.591857493112116, 'atr_min_pct': 0.003398810049849198, 'atr_max_pct': 0.03525759774676345, 'tp_mult': 1.3218278348670465, 'tsl_mult': 0.31109254075485276, 'strategy': 'breakout', 'time_stop': 300, 'use_sma': False, 'use_atr': True, 'use_adx': True, 'use_ema': False, 'use_spike': True, 'rsi_required': True, 'edge_k': 0.4072851833758221, 'edge_cap': 0.37441800366746014, 'bull_strategy': 'breakout', 'bull_bb_std_mult': 1.5946499776025729, 'bull_rsi_os': 17, 'bull_rsi_ob': 63, 'bull_adx_thresh': 13.653807270977602, 'bull_atr_min_pct': 0.023141058538604757, 'bull_atr_max_pct': 0.08069332608546367, 'bull_tp_mult': 1.452637219983205, 'bull_tsl_mult': 0.304958437623739, 'bull_time_stop': 128, 'bull_use_sma': False, 'bull_use_ema': True, 'bull_use_atr': True, 'bull_use_adx': True, 'bull_use_spike': False, 'bull_rsi_required': False, 'bear_strategy': 'breakout', 'bear_bb_std_mult': 1.0458583560929053, 'bear_rsi_os': 30, 'bear_rsi_ob': 51, 'bear_adx_thresh': 13.618028156269718, 'bear_atr_min_pct': 0.01336480924409809, 'bear_atr_max_pct': 0.10351275133937558, 'bear_tp_mult': 1.262249928720585, 'bear_tsl_mult': 0.2406332661001579, 'bear_time_stop': 273, 'bear_use_sma': False, 'bear_use_ema': True, 'bear_use_atr': True, 'bear_use_adx': False, 'bear_use_spike': True, 'bear_rsi_required': False, 'sideways_strategy': 'breakout', 'sideways_bb_std_mult': 2.8484445445972213, 'sideways_rsi_os': 32, 'sideways_rsi_ob': 48, 'sideways_adx_thresh': 9.308293580960163, 'sideways_atr_min_pct': 0.0032589003631864986, 'sideways_atr_max_pct': 0.045074844511928405, 'sideways_tp_mult': 1.2848244061054113, 'sideways_tsl_mult': 0.30197380681588104, 'sideways_time_stop': 98, 'sideways_use_sma': True, 'sideways_use_ema': False, 'sideways_use_atr': True, 'sideways_use_adx': True, 'sideways_use_spike': False, 'sideways_rsi_required': True}.
[I 2025-08-31 11:36:30,134] Trial 320 finished with values: [-1000000000.0, 1000000000.0] and parameters: {'p_sma': 28, 'p_std': 47, 'p_atr': 14, 'p_adx': 23, 'rsi_period': 84, 'ema1': 12, 'ema2': 23, 'slip_atr_k': 0.08718098537429436, 'slip_spread_k': 0.4634206178909192, 'spread_hl_frac': 0.002096335682593086, 'bb_std_mult': 0.8468908999695333, 'rsi_os': 21, 'rsi_ob': 73, 'vol_spike': 0.08981137229015046, 'adx_thresh': 25.42269487938113, 'atr_min_pct': 0.0036225382571850075, 'atr_max_pct': 0.10408279473778434, 'tp_mult': 2.02699477902045, 'tsl_mult': 0.26392913779708455, 'strategy': 'breakout', 'time_stop': 233, 'use_sma': True, 'use_atr': True, 'use_adx': False, 'use_ema': False, 'use_spike': True, 'rsi_required': False, 'edge_k': 0.3742366489650507, 'edge_cap': 0.8072700343043987, 'bull_strategy': 'breakout', 'bull_bb_std_mult': 2.503964490984321, 'bull_rsi_os': 21, 'bull_rsi_ob': 64, 'bull_adx_thresh': 13.68276401253097, 'bull_atr_min_pct': 0.003727645142021025, 'bull_atr_max_pct': 0.019549357122838035, 'bull_tp_mult': 1.943274433376271, 'bull_tsl_mult': 0.22702370287141205, 'bull_time_stop': 125, 'bull_use_sma': False, 'bull_use_ema': True, 'bull_use_atr': True, 'bull_use_adx': False, 'bull_use_spike': False, 'bull_rsi_required': False, 'bear_strategy': 'mean_reversion', 'bear_bb_std_mult': 3.5946230990491914, 'bear_rsi_os': 45, 'bear_rsi_ob': 47, 'bear_adx_thresh': 13.602311400334393, 'bear_atr_min_pct': 5.159549568211491e-05, 'bear_atr_max_pct': 0.06179438784471539, 'bear_tp_mult': 2.6343368255844415, 'bear_tsl_mult': 0.4883905242354066, 'bear_time_stop': 147, 'bear_use_sma': False, 'bear_use_ema': True, 'bear_use_atr': True, 'bear_use_adx': False, 'bear_use_spike': True, 'bear_rsi_required': False, 'sideways_strategy': 'breakout', 'sideways_bb_std_mult': 2.447049043519713, 'sideways_rsi_os': 32, 'sideways_rsi_ob': 48, 'sideways_adx_thresh': 10.361667460149441, 'sideways_atr_min_pct': 0.003620450098137897, 'sideways_atr_max_pct': 0.10590046914433389, 'sideways_tp_mult': 1.4503710819482667, 'sideways_tsl_mult': 0.3462921941870358, 'sideways_time_stop': 10, 'sideways_use_sma': True, 'sideways_use_ema': False, 'sideways_use_atr': True, 'sideways_use_adx': True, 'sideways_use_spike': False, 'sideways_rsi_required': True}.
[I 2025-08-31 11:36:30,521] Trial 322 finished with values: [-0.024193086117016538, 0.025247249454683346] and parameters: {'p_sma': 28, 'p_std': 60, 'p_atr': 15, 'p_adx': 9, 'rsi_period': 20, 'ema1': 24, 'ema2': 30, 'slip_atr_k': 0.04072554045514777, 'slip_spread_k': 0.3907570930253315, 'spread_hl_frac': 6.321153585572424e-05, 'bb_std_mult': 3.153035065230723, 'rsi_os': 34, 'rsi_ob': 45, 'vol_spike': 0.29970233037246125, 'adx_thresh': 25.449057029637828, 'atr_min_pct': 0.003416020271084573, 'atr_max_pct': 0.12836660862277832, 'tp_mult': 2.6370830467857713, 'tsl_mult': 0.29829317585966353, 'strategy': 'breakout', 'time_stop': 27, 'use_sma': False, 'use_atr': True, 'use_adx': True, 'use_ema': False, 'use_spike': True, 'rsi_required': True, 'edge_k': 0.4113638896513849, 'edge_cap': 0.37547598218733513, 'bull_strategy': 'breakout', 'bull_bb_std_mult': 2.507579770863915, 'bull_rsi_os': 17, 'bull_rsi_ob': 65, 'bull_adx_thresh': 13.742440229805574, 'bull_atr_min_pct': 0.0034758290358956785, 'bull_atr_max_pct': 0.05402536344639768, 'bull_tp_mult': 1.3003621946239083, 'bull_tsl_mult': 0.9807061003220564, 'bull_time_stop': 125, 'bull_use_sma': False, 'bull_use_ema': True, 'bull_use_atr': True, 'bull_use_adx': True, 'bull_use_spike': False, 'bull_rsi_required': False, 'bear_strategy': 'breakout', 'bear_bb_std_mult': 1.0581811485728538, 'bear_rsi_os': 44, 'bear_rsi_ob': 51, 'bear_adx_thresh': 32.31137381319518, 'bear_atr_min_pct': 0.013289815797658571, 'bear_atr_max_pct': 0.11785497638286502, 'bear_tp_mult': 1.1108607914972144, 'bear_tsl_mult': 0.41952676052438775, 'bear_time_stop': 147, 'bear_use_sma': False, 'bear_use_ema': True, 'bear_use_atr': True, 'bear_use_adx': False, 'bear_use_spike': True, 'bear_rsi_required': False, 'sideways_strategy': 'mean_reversion', 'sideways_bb_std_mult': 2.459118124042441, 'sideways_rsi_os': 11, 'sideways_rsi_ob': 48, 'sideways_adx_thresh': 8.521124300965354, 'sideways_atr_min_pct': 0.0038123937129592392, 'sideways_atr_max_pct': 0.09868236764765426, 'sideways_tp_mult': 1.4279373192206466, 'sideways_tsl_mult': 0.3028947787139552, 'sideways_time_stop': 26, 'sideways_use_sma': True, 'sideways_use_ema': False, 'sideways_use_atr': True, 'sideways_use_adx': False, 'sideways_use_spike': True, 'sideways_rsi_required': True}.
[I 2025-08-31 11:36:30,674] Trial 319 finished with values: [-1000000000.0, 1000000000.0] and parameters: {'p_sma': 13, 'p_std': 19, 'p_atr': 13, 'p_adx': 17, 'rsi_period': 63, 'ema1': 12, 'ema2': 37, 'slip_atr_k': 0.053765399457345646, 'slip_spread_k': 0.47273087592993246, 'spread_hl_frac': 0.0020330009136254787, 'bb_std_mult': 0.6564228863895193, 'rsi_os': 36, 'rsi_ob': 74, 'vol_spike': 0.10055004099213043, 'adx_thresh': 23.987603191604702, 'atr_min_pct': 0.022617882389777078, 'atr_max_pct': 0.03582239165889275, 'tp_mult': 2.0012261150357418, 'tsl_mult': 0.2680816302773941, 'strategy': 'breakout', 'time_stop': 300, 'use_sma': True, 'use_atr': True, 'use_adx': False, 'use_ema': False, 'use_spike': True, 'rsi_required': True, 'edge_k': 1.9294721554991794, 'edge_cap': 0.802435591135632, 'bull_strategy': 'breakout', 'bull_bb_std_mult': 1.6786122783054283, 'bull_rsi_os': 16, 'bull_rsi_ob': 63, 'bull_adx_thresh': 13.862423662291244, 'bull_atr_min_pct': 0.02328213472773763, 'bull_atr_max_pct': 0.05660496148762073, 'bull_tp_mult': 1.3134143801954747, 'bull_tsl_mult': 0.22442388892614923, 'bull_time_stop': 59, 'bull_use_sma': False, 'bull_use_ema': True, 'bull_use_atr': True, 'bull_use_adx': True, 'bull_use_spike': False, 'bull_rsi_required': True, 'bear_strategy': 'breakout', 'bear_bb_std_mult': 1.3011922155181121, 'bear_rsi_os': 45, 'bear_rsi_ob': 88, 'bear_adx_thresh': 32.92033491051314, 'bear_atr_min_pct': 0.016244209547707715, 'bear_atr_max_pct': 0.12362708039816869, 'bear_tp_mult': 2.643715461102651, 'bear_tsl_mult': 0.6497570109039805, 'bear_time_stop': 174, 'bear_use_sma': False, 'bear_use_ema': True, 'bear_use_atr': True, 'bear_use_adx': False, 'bear_use_spike': True, 'bear_rsi_required': False, 'sideways_strategy': 'breakout', 'sideways_bb_std_mult': 1.640481959760557, 'sideways_rsi_os': 32, 'sideways_rsi_ob': 65, 'sideways_adx_thresh': 9.422362513721833, 'sideways_atr_min_pct': 0.0038108569037450563, 'sideways_atr_max_pct': 0.10615969677855921, 'sideways_tp_mult': 2.9443471627211477, 'sideways_tsl_mult': 0.3702393879772121, 'sideways_time_stop': 9, 'sideways_use_sma': True, 'sideways_use_ema': False, 'sideways_use_atr': True, 'sideways_use_adx': True, 'sideways_use_spike': False, 'sideways_rsi_required': True}.
[I 2025-08-31 11:36:31,624] Trial 324 finished with values: [-1000000000.0, 1000000000.0] and parameters: {'p_sma': 22, 'p_std': 19, 'p_atr': 15, 'p_adx': 17, 'rsi_period': 64, 'ema1': 23, 'ema2': 33, 'slip_atr_k': 0.0553550334885584, 'slip_spread_k': 0.10408076497968068, 'spread_hl_frac': 0.01435226767620955, 'bb_std_mult': 0.7221904062366404, 'rsi_os': 36, 'rsi_ob': 45, 'vol_spike': 0.11661878111897961, 'adx_thresh': 27.156624015676446, 'atr_min_pct': 0.004178033615731792, 'atr_max_pct': 0.012338357024548857, 'tp_mult': 1.0668705961530973, 'tsl_mult': 0.7877455987826093, 'strategy': 'mean_reversion', 'time_stop': 279, 'use_sma': False, 'use_atr': True, 'use_adx': True, 'use_ema': False, 'use_spike': True, 'rsi_required': True, 'edge_k': 0.17263741770369023, 'edge_cap': 0.8328205120971561, 'bull_strategy': 'breakout', 'bull_bb_std_mult': 1.683327404982641, 'bull_rsi_os': 38, 'bull_rsi_ob': 62, 'bull_adx_thresh': 12.584908967473364, 'bull_atr_min_pct': 0.0052663089769545484, 'bull_atr_max_pct': 0.013634944680152236, 'bull_tp_mult': 1.3268860422231055, 'bull_tsl_mult': 0.16752023537809735, 'bull_time_stop': 160, 'bull_use_sma': True, 'bull_use_ema': True, 'bull_use_atr': True, 'bull_use_adx': True, 'bull_use_spike': False, 'bull_rsi_required': True, 'bear_strategy': 'breakout', 'bear_bb_std_mult': 0.8217654809581951, 'bear_rsi_os': 32, 'bear_rsi_ob': 93, 'bear_adx_thresh': 32.45292580386896, 'bear_atr_min_pct': 0.015258259531328339, 'bear_atr_max_pct': 0.06983505892320514, 'bear_tp_mult': 2.742795097990509, 'bear_tsl_mult': 0.4631198096369118, 'bear_time_stop': 179, 'bear_use_sma': False, 'bear_use_ema': True, 'bear_use_atr': True, 'bear_use_adx': False, 'bear_use_spike': True, 'bear_rsi_required': True, 'sideways_strategy': 'mean_reversion', 'sideways_bb_std_mult': 1.8975323728869522, 'sideways_rsi_os': 31, 'sideways_rsi_ob': 65, 'sideways_adx_thresh': 8.53297549617977, 'sideways_atr_min_pct': 0.019512838057707052, 'sideways_atr_max_pct': 0.03650616832941435, 'sideways_tp_mult': 1.4199823796698263, 'sideways_tsl_mult': 0.8685935409029587, 'sideways_time_stop': 26, 'sideways_use_sma': True, 'sideways_use_ema': False, 'sideways_use_atr': True, 'sideways_use_adx': False, 'sideways_use_spike': True, 'sideways_rsi_required': True}.
