[I 2025-08-31 11:52:19,609] Trial 442 finished with values: [-0.04452184095899536, 0.044179567243511436] and parameters: {'p_sma': 29, 'p_std': 20, 'p_atr': 22, 'p_adx': 25, 'rsi_period': 64, 'ema1': 14, 'ema2': 37, 'slip_atr_k': 0.04576064497698656, 'slip_spread_k': 0.8121891600559599, 'spread_hl_frac': 0.0034370734841644227, 'bb_std_mult': 2.805174133550903, 'rsi_os': 37, 'rsi_ob': 47, 'vol_spike': 0.06438016943269002, 'adx_thresh': 26.72681883755319, 'atr_min_pct': 0.004189999996408518, 'atr_max_pct': 0.1088914744493633, 'tp_mult': 1.0128873814289396, 'tsl_mult': 0.8358948205726235, 'strategy': 'breakout', 'time_stop': 14, 'use_sma': False, 'use_atr': True, 'use_adx': True, 'use_ema': False, 'use_spike': True, 'rsi_required': True, 'edge_k': 0.39847268061242447, 'edge_cap': 0.8614247133486336, 'bull_strategy': 'breakout', 'bull_bb_std_mult': 2.8541455847701833, 'bull_rsi_os': 25, 'bull_rsi_ob': 51, 'bull_adx_thresh': 15.918391582423508, 'bull_atr_min_pct': 0.004513524484266678, 'bull_atr_max_pct': 0.10152015163774124, 'bull_tp_mult': 2.868783455784227, 'bull_tsl_mult': 0.8918152216086841, 'bull_time_stop': 148, 'bull_use_sma': True, 'bull_use_ema': True, 'bull_use_atr': True, 'bull_use_adx': True, 'bull_use_spike': False, 'bull_rsi_required': False, 'bear_strategy': 'breakout', 'bear_bb_std_mult': 1.0923250660283959, 'bear_rsi_os': 30, 'bear_rsi_ob': 77, 'bear_adx_thresh': 9.003378020963895, 'bear_atr_min_pct': 0.010691501781919969, 'bear_atr_max_pct': 0.1195459655124529, 'bear_tp_mult': 2.641601483777121, 'bear_tsl_mult': 0.28846690601097613, 'bear_time_stop': 24, 'bear_use_sma': False, 'bear_use_ema': True, 'bear_use_atr': True, 'bear_use_adx': False, 'bear_use_spike': True, 'bear_rsi_required': True, 'sideways_strategy': 'breakout', 'sideways_bb_std_mult': 2.998119479086446, 'sideways_rsi_os': 55, 'sideways_rsi_ob': 75, 'sideways_adx_thresh': 22.39094552419919, 'sideways_atr_min_pct': 0.0027762577618681778, 'sideways_atr_max_pct': 0.05686175896918173, 'sideways_tp_mult': 1.2662151414957523, 'sideways_tsl_mult': 0.3778810104810263, 'sideways_time_stop': 19, 'sideways_use_sma': True, 'sideways_use_ema': False, 'sideways_use_atr': False, 'sideways_use_adx': True, 'sideways_use_spike': False, 'sideways_rsi_required': False}.
[I 2025-08-31 11:52:19,789] Trial 441 finished with values: [-0.013616300434663442, 0.013965134374780032] and parameters: {'p_sma': 14, 'p_std': 56, 'p_atr': 13, 'p_adx': 27, 'rsi_period': 40, 'ema1': 14, 'ema2': 36, 'slip_atr_k': 0.06344174904153413, 'slip_spread_k': 0.797762077888885, 'spread_hl_frac': 3.2170202897722046e-05, 'bb_std_mult': 3.5303521454636715, 'rsi_os': 29, 'rsi_ob': 73, 'vol_spike': 0.1171082734559991, 'adx_thresh': 25.83818937200558, 'atr_min_pct': 0.003233568665051892, 'atr_max_pct': 0.02531178562472282, 'tp_mult': 2.581485937882566, 'tsl_mult': 0.5527546785012913, 'strategy': 'breakout', 'time_stop': 295, 'use_sma': False, 'use_atr': True, 'use_adx': True, 'use_ema': False, 'use_spike': True, 'rsi_required': True, 'edge_k': 0.9857745304977572, 'edge_cap': 0.615671997389679, 'bull_strategy': 'breakout', 'bull_bb_std_mult': 2.8320867335150997, 'bull_rsi_os': 29, 'bull_rsi_ob': 87, 'bull_adx_thresh': 30.621209647032813, 'bull_atr_min_pct': 0.01282188011378834, 'bull_atr_max_pct': 0.1375543601943806, 'bull_tp_mult': 1.8807118382805348, 'bull_tsl_mult': 0.27780839707495986, 'bull_time_stop': 33, 'bull_use_sma': True, 'bull_use_ema': True, 'bull_use_atr': True, 'bull_use_adx': True, 'bull_use_spike': False, 'bull_rsi_required': False, 'bear_strategy': 'breakout', 'bear_bb_std_mult': 1.096412130084626, 'bear_rsi_os': 31, 'bear_rsi_ob': 53, 'bear_adx_thresh': 18.173485945550837, 'bear_atr_min_pct': 0.015678122324263848, 'bear_atr_max_pct': 0.026046950955892656, 'bear_tp_mult': 2.7394464846991773, 'bear_tsl_mult': 0.23305357920170056, 'bear_time_stop': 183, 'bear_use_sma': True, 'bear_use_ema': True, 'bear_use_atr': True, 'bear_use_adx': False, 'bear_use_spike': True, 'bear_rsi_required': True, 'sideways_strategy': 'breakout', 'sideways_bb_std_mult': 1.408142711760219, 'sideways_rsi_os': 33, 'sideways_rsi_ob': 66, 'sideways_adx_thresh': 15.286767836593022, 'sideways_atr_min_pct': 0.0028310017799071286, 'sideways_atr_max_pct': 0.05615673546070574, 'sideways_tp_mult': 1.5814692938360255, 'sideways_tsl_mult': 0.32396592781776556, 'sideways_time_stop': 17, 'sideways_use_sma': True, 'sideways_use_ema': False, 'sideways_use_atr': False, 'sideways_use_adx': True, 'sideways_use_spike': True, 'sideways_rsi_required': False}.
[I 2025-08-31 11:52:19,970] Trial 443 finished with values: [-0.026280329668345814, 0.026019652225415614] and parameters: {'p_sma': 51, 'p_std': 12, 'p_atr': 14, 'p_adx': 25, 'rsi_period': 50, 'ema1': 12, 'ema2': 35, 'slip_atr_k': 0.04608591837284599, 'slip_spread_k': 7.180106670950925e-05, 'spread_hl_frac': 1.3217459712556046e-05, 'bb_std_mult': 0.8035349442258231, 'rsi_os': 37, 'rsi_ob': 47, 'vol_spike': 0.12015569778049101, 'adx_thresh': 25.81004020430684, 'atr_min_pct': 0.00905664536809652, 'atr_max_pct': 0.025589391930941945, 'tp_mult': 2.5694059479835047, 'tsl_mult': 0.7233331485300816, 'strategy': 'breakout', 'time_stop': 19, 'use_sma': False, 'use_atr': False, 'use_adx': True, 'use_ema': False, 'use_spike': True, 'rsi_required': True, 'edge_k': 0.4059269809856105, 'edge_cap': 0.21232219243056877, 'bull_strategy': 'breakout', 'bull_bb_std_mult': 2.655849374786003, 'bull_rsi_os': 24, 'bull_rsi_ob': 93, 'bull_adx_thresh': 30.750048600582225, 'bull_atr_min_pct': 0.0030046960300864362, 'bull_atr_max_pct': 0.14511923019600795, 'bull_tp_mult': 1.0746957225345395, 'bull_tsl_mult': 0.24349174859868053, 'bull_time_stop': 201, 'bull_use_sma': True, 'bull_use_ema': True, 'bull_use_atr': True, 'bull_use_adx': True, 'bull_use_spike': False, 'bull_rsi_required': False, 'bear_strategy': 'mean_reversion', 'bear_bb_std_mult': 1.1747079484787357, 'bear_rsi_os': 9, 'bear_rsi_ob': 53, 'bear_adx_thresh': 32.00260762728351, 'bear_atr_min_pct': 0.01466993847921467, 'bear_atr_max_pct': 0.11131542646602532, 'bear_tp_mult': 2.6342458970982228, 'bear_tsl_mult': 0.34843498295905745, 'bear_time_stop': 184, 'bear_use_sma': False, 'bear_use_ema': True, 'bear_use_atr': True, 'bear_use_adx': True, 'bear_use_spike': True, 'bear_rsi_required': False, 'sideways_strategy': 'breakout', 'sideways_bb_std_mult': 2.217673661680295, 'sideways_rsi_os': 33, 'sideways_rsi_ob': 93, 'sideways_adx_thresh': 7.261834774253028, 'sideways_atr_min_pct': 0.002687933931082738, 'sideways_atr_max_pct': 0.05689533367842494, 'sideways_tp_mult': 1.878721387126159, 'sideways_tsl_mult': 0.3690867481547381, 'sideways_time_stop': 18, 'sideways_use_sma': True, 'sideways_use_ema': False, 'sideways_use_atr': True, 'sideways_use_adx': False, 'sideways_use_spike': False, 'sideways_rsi_required': False}.
[I 2025-08-31 11:52:20,255] Trial 444 finished with values: [-0.022690727567695634, 0.022988789989463014] and parameters: {'p_sma': 33, 'p_std': 11, 'p_atr': 21, 'p_adx': 25, 'rsi_period': 50, 'ema1': 17, 'ema2': 37, 'slip_atr_k': 0.06283284302884325, 'slip_spread_k': 0.10956192792510985, 'spread_hl_frac': 0.001600217377917288, 'bb_std_mult': 2.8274872644210696, 'rsi_os': 37, 'rsi_ob': 71, 'vol_spike': 0.11729644576840323, 'adx_thresh': 23.145746808299506, 'atr_min_pct': 0.00414154493539833, 'atr_max_pct': 0.11173504621252504, 'tp_mult': 1.159974158912113, 'tsl_mult': 0.2375942876724479, 'strategy': 'mean_reversion', 'time_stop': 300, 'use_sma': False, 'use_atr': False, 'use_adx': True, 'use_ema': True, 'use_spike': True, 'rsi_required': True, 'edge_k': 0.7600847594815292, 'edge_cap': 0.928847411250942, 'bull_strategy': 'breakout', 'bull_bb_std_mult': 2.659199044539998, 'bull_rsi_os': 24, 'bull_rsi_ob': 87, 'bull_adx_thresh': 16.054318357514408, 'bull_atr_min_pct': 0.027600714262346462, 'bull_atr_max_pct': 0.1496994943849585, 'bull_tp_mult': 1.9365852893019622, 'bull_tsl_mult': 0.25259322137893087, 'bull_time_stop': 22, 'bull_use_sma': True, 'bull_use_ema': False, 'bull_use_atr': False, 'bull_use_adx': True, 'bull_use_spike': True, 'bull_rsi_required': False, 'bear_strategy': 'mean_reversion', 'bear_bb_std_mult': 1.1807973509341356, 'bear_rsi_os': 30, 'bear_rsi_ob': 55, 'bear_adx_thresh': 32.18653484091947, 'bear_atr_min_pct': 0.014750597124487654, 'bear_atr_max_pct': 0.11947091618709674, 'bear_tp_mult': 2.631292889091932, 'bear_tsl_mult': 0.2958998827167677, 'bear_time_stop': 184, 'bear_use_sma': False, 'bear_use_ema': True, 'bear_use_atr': False, 'bear_use_adx': True, 'bear_use_spike': False, 'bear_rsi_required': True, 'sideways_strategy': 'breakout', 'sideways_bb_std_mult': 2.336844446075251, 'sideways_rsi_os': 33, 'sideways_rsi_ob': 75, 'sideways_adx_thresh': 8.103739486869838, 'sideways_atr_min_pct': 0.0018298637501643715, 'sideways_atr_max_pct': 0.03576303327686048, 'sideways_tp_mult': 2.5548097147482576, 'sideways_tsl_mult': 0.09248594813842859, 'sideways_time_stop': 143, 'sideways_use_sma': False, 'sideways_use_ema': True, 'sideways_use_atr': True, 'sideways_use_adx': False, 'sideways_use_spike': False, 'sideways_rsi_required': True}.
[I 2025-08-31 11:52:55,256] Trial 448 finished with values: [-1000000000.0, 1000000000.0] and parameters: {'p_sma': 28, 'p_std': 14, 'p_atr': 14, 'p_adx': 27, 'rsi_period': 46, 'ema1': 10, 'ema2': 35, 'slip_atr_k': 0.05701318134252922, 'slip_spread_k': 0.14140818351698495, 'spread_hl_frac': 0.002636971535350269, 'bb_std_mult': 0.6076857805720062, 'rsi_os': 30, 'rsi_ob': 63, 'vol_spike': 0.15583434265401896, 'adx_thresh': 25.79999146845836, 'atr_min_pct': 0.005729414105038859, 'atr_max_pct': 0.021560934248511975, 'tp_mult': 1.478108405583451, 'tsl_mult': 0.3066067558006255, 'strategy': 'mean_reversion', 'time_stop': 258, 'use_sma': False, 'use_atr': True, 'use_adx': True, 'use_ema': True, 'use_spike': True, 'rsi_required': True, 'edge_k': 0.4816974182675636, 'edge_cap': 0.8307748430710521, 'bull_strategy': 'breakout', 'bull_bb_std_mult': 2.455803270030959, 'bull_rsi_os': 22, 'bull_rsi_ob': 64, 'bull_adx_thresh': 15.527313637345085, 'bull_atr_min_pct': 0.007739537672209976, 'bull_atr_max_pct': 0.034983570180213044, 'bull_tp_mult': 1.3375858098419604, 'bull_tsl_mult': 0.2795423189391602, 'bull_time_stop': 146, 'bull_use_sma': True, 'bull_use_ema': False, 'bull_use_atr': False, 'bull_use_adx': False, 'bull_use_spike': True, 'bull_rsi_required': True, 'bear_strategy': 'breakout', 'bear_bb_std_mult': 0.9639843523806153, 'bear_rsi_os': 21, 'bear_rsi_ob': 53, 'bear_adx_thresh': 30.56094742776698, 'bear_atr_min_pct': 0.014148080114393294, 'bear_atr_max_pct': 0.0259698254428122, 'bear_tp_mult': 2.697218222220876, 'bear_tsl_mult': 0.8305182349160085, 'bear_time_stop': 168, 'bear_use_sma': False, 'bear_use_ema': True, 'bear_use_atr': False, 'bear_use_adx': False, 'bear_use_spike': False, 'bear_rsi_required': False, 'sideways_strategy': 'breakout', 'sideways_bb_std_mult': 1.6752293975608588, 'sideways_rsi_os': 35, 'sideways_rsi_ob': 72, 'sideways_adx_thresh': 19.927743558369116, 'sideways_atr_min_pct': 0.02074195548228994, 'sideways_atr_max_pct': 0.04064697604942384, 'sideways_tp_mult': 1.2939779961206672, 'sideways_tsl_mult': 0.6452525368389974, 'sideways_time_stop': 28, 'sideways_use_sma': False, 'sideways_use_ema': True, 'sideways_use_atr': True, 'sideways_use_adx': True, 'sideways_use_spike': False, 'sideways_rsi_required': True}.
[I 2025-08-31 11:52:55,585] Trial 446 finished with values: [-0.08624603161240263, 0.086070928758022] and parameters: {'p_sma': 34, 'p_std': 13, 'p_atr': 14, 'p_adx': 25, 'rsi_period': 50, 'ema1': 12, 'ema2': 35, 'slip_atr_k': 0.0575691255136557, 'slip_spread_k': 0.1136037139162821, 'spread_hl_frac': 0.03088698277702779, 'bb_std_mult': 1.3519411944118422, 'rsi_os': 30, 'rsi_ob': 71, 'vol_spike': 0.15618236469770375, 'adx_thresh': 25.8392069643468, 'atr_min_pct': 0.01599948294631049, 'atr_max_pct': 0.02332283967114499, 'tp_mult': 2.088372424814818, 'tsl_mult': 0.7257329055754224, 'strategy': 'mean_reversion', 'time_stop': 300, 'use_sma': False, 'use_atr': False, 'use_adx': True, 'use_ema': True, 'use_spike': True, 'rsi_required': True, 'edge_k': 0.45677779435294696, 'edge_cap': 0.8085234363536424, 'bull_strategy': 'breakout', 'bull_bb_std_mult': 1.2394318340766255, 'bull_rsi_os': 24, 'bull_rsi_ob': 87, 'bull_adx_thresh': 15.40178091234127, 'bull_atr_min_pct': 5.3780718483227574e-05, 'bull_atr_max_pct': 0.14957908424341984, 'bull_tp_mult': 1.9403775258459288, 'bull_tsl_mult': 0.24365200164071496, 'bull_time_stop': 146, 'bull_use_sma': True, 'bull_use_ema': False, 'bull_use_atr': False, 'bull_use_adx': True, 'bull_use_spike': True, 'bull_rsi_required': False, 'bear_strategy': 'mean_reversion', 'bear_bb_std_mult': 1.2535568298925588, 'bear_rsi_os': 12, 'bear_rsi_ob': 55, 'bear_adx_thresh': 31.844450361407745, 'bear_atr_min_pct': 0.01464466120369712, 'bear_atr_max_pct': 0.12040705689723263, 'bear_tp_mult': 1.849215956791329, 'bear_tsl_mult': 0.3541660925108281, 'bear_time_stop': 184, 'bear_use_sma': False, 'bear_use_ema': True, 'bear_use_atr': False, 'bear_use_adx': False, 'bear_use_spike': False, 'bear_rsi_required': False, 'sideways_strategy': 'breakout', 'sideways_bb_std_mult': 2.223369856405987, 'sideways_rsi_os': 11, 'sideways_rsi_ob': 70, 'sideways_adx_thresh': 5.531132594767657, 'sideways_atr_min_pct': 0.0016441564600732834, 'sideways_atr_max_pct': 0.1351234372637325, 'sideways_tp_mult': 2.6130832449677857, 'sideways_tsl_mult': 0.6377499780493292, 'sideways_time_stop': 36, 'sideways_use_sma': False, 'sideways_use_ema': True, 'sideways_use_atr': True, 'sideways_use_adx': False, 'sideways_use_spike': False, 'sideways_rsi_required': True}.
[I 2025-08-31 11:52:55,610] Trial 445 finished with values: [-1000000000.0, 1000000000.0] and parameters: {'p_sma': 28, 'p_std': 50, 'p_atr': 14, 'p_adx': 25, 'rsi_period': 50, 'ema1': 12, 'ema2': 37, 'slip_atr_k': 0.21591885207574413, 'slip_spread_k': 0.10306046808826204, 'spread_hl_frac': 0.00021846655706653283, 'bb_std_mult': 0.8147263920392771, 'rsi_os': 30, 'rsi_ob': 59, 'vol_spike': 0.11840151170623593, 'adx_thresh': 23.180694891998904, 'atr_min_pct': 0.00598132112112363, 'atr_max_pct': 0.025970123439077526, 'tp_mult': 1.1502147257366842, 'tsl_mult': 0.24913175502898383, 'strategy': 'mean_reversion', 'time_stop': 300, 'use_sma': True, 'use_atr': False, 'use_adx': True, 'use_ema': True, 'use_spike': True, 'rsi_required': True, 'edge_k': 0.46116175715752467, 'edge_cap': 0.805786626640053, 'bull_strategy': 'mean_reversion', 'bull_bb_std_mult': 2.462771344480722, 'bull_rsi_os': 24, 'bull_rsi_ob': 64, 'bull_adx_thresh': 15.315970896435244, 'bull_atr_min_pct': 0.003076631715431068, 'bull_atr_max_pct': 0.08989903745447995, 'bull_tp_mult': 1.277598095120752, 'bull_tsl_mult': 0.24762053523544947, 'bull_time_stop': 145, 'bull_use_sma': False, 'bull_use_ema': False, 'bull_use_atr': False, 'bull_use_adx': True, 'bull_use_spike': True, 'bull_rsi_required': False, 'bear_strategy': 'mean_reversion', 'bear_bb_std_mult': 1.1906460255889924, 'bear_rsi_os': 9, 'bear_rsi_ob': 52, 'bear_adx_thresh': 7.8129618354755515, 'bear_atr_min_pct': 0.014760435043951596, 'bear_atr_max_pct': 0.09944526583417265, 'bear_tp_mult': 1.2917262665122888, 'bear_tsl_mult': 0.4781098774614223, 'bear_time_stop': 184, 'bear_use_sma': False, 'bear_use_ema': True, 'bear_use_atr': False, 'bear_use_adx': True, 'bear_use_spike': False, 'bear_rsi_required': False, 'sideways_strategy': 'breakout', 'sideways_bb_std_mult': 2.1901219007625348, 'sideways_rsi_os': 33, 'sideways_rsi_ob': 65, 'sideways_adx_thresh': 8.163539190664741, 'sideways_atr_min_pct': 0.02580341843228306, 'sideways_atr_max_pct': 0.05462722386759765, 'sideways_tp_mult': 1.0918308701329797, 'sideways_tsl_mult': 0.3644426048458563, 'sideways_time_stop': 261, 'sideways_use_sma': False, 'sideways_use_ema': True, 'sideways_use_atr': True, 'sideways_use_adx': False, 'sideways_use_spike': False, 'sideways_rsi_required': True}.
[I 2025-08-31 11:52:55,791] Trial 447 finished with values: [-1000000000.0, 1000000000.0] and parameters: {'p_sma': 28, 'p_std': 5, 'p_atr': 7, 'p_adx': 27, 'rsi_period': 50, 'ema1': 12, 'ema2': 38, 'slip_atr_k': 0.06320841089607881, 'slip_spread_k': 0.10908902113314468, 'spread_hl_frac': 0.009519666290242302, 'bb_std_mult': 0.6030992331616342, 'rsi_os': 30, 'rsi_ob': 71, 'vol_spike': 0.15649823083037342, 'adx_thresh': 25.06384013882571, 'atr_min_pct': 0.003143711488550874, 'atr_max_pct': 0.02307976408515755, 'tp_mult': 1.182401460659264, 'tsl_mult': 0.2979631245363204, 'strategy': 'mean_reversion', 'time_stop': 275, 'use_sma': False, 'use_atr': True, 'use_adx': True, 'use_ema': True, 'use_spike': True, 'rsi_required': True, 'edge_k': 0.0523440033789907, 'edge_cap': 0.9242015613942065, 'bull_strategy': 'breakout', 'bull_bb_std_mult': 2.448483850701233, 'bull_rsi_os': 21, 'bull_rsi_ob': 64, 'bull_adx_thresh': 6.945095908867238, 'bull_atr_min_pct': 0.012888945580919898, 'bull_atr_max_pct': 0.06621996781150392, 'bull_tp_mult': 1.3559393221324778, 'bull_tsl_mult': 0.28045956765905206, 'bull_time_stop': 32, 'bull_use_sma': True, 'bull_use_ema': False, 'bull_use_atr': False, 'bull_use_adx': False, 'bull_use_spike': True, 'bull_rsi_required': True, 'bear_strategy': 'mean_reversion', 'bear_bb_std_mult': 1.2398239930204862, 'bear_rsi_os': 34, 'bear_rsi_ob': 55, 'bear_adx_thresh': 6.340674018223703, 'bear_atr_min_pct': 0.014240971646760432, 'bear_atr_max_pct': 0.11932207932686008, 'bear_tp_mult': 2.6922557558790885, 'bear_tsl_mult': 0.307235640003692, 'bear_time_stop': 277, 'bear_use_sma': False, 'bear_use_ema': True, 'bear_use_atr': False, 'bear_use_adx': False, 'bear_use_spike': False, 'bear_rsi_required': True, 'sideways_strategy': 'breakout', 'sideways_bb_std_mult': 1.6920694382441939, 'sideways_rsi_os': 48, 'sideways_rsi_ob': 70, 'sideways_adx_thresh': 8.19647636299965, 'sideways_atr_min_pct': 0.02580361619078827, 'sideways_atr_max_pct': 0.05306471313720045, 'sideways_tp_mult': 1.2436157509680352, 'sideways_tsl_mult': 0.08534155975737884, 'sideways_time_stop': 262, 'sideways_use_sma': False, 'sideways_use_ema': True, 'sideways_use_atr': True, 'sideways_use_adx': True, 'sideways_use_spike': False, 'sideways_rsi_required': True}.
[I 2025-08-31 11:53:28,677] Trial 450 finished with values: [-1000000000.0, 1000000000.0] and parameters: {'p_sma': 14, 'p_std': 16, 'p_atr': 7, 'p_adx': 27, 'rsi_period': 53, 'ema1': 12, 'ema2': 38, 'slip_atr_k': 0.02439062277599943, 'slip_spread_k': 0.08449930530049846, 'spread_hl_frac': 0.009560663529100547, 'bb_std_mult': 0.6898853185029106, 'rsi_os': 31, 'rsi_ob': 69, 'vol_spike': 0.16390885327552637, 'adx_thresh': 11.493372399196017, 'atr_min_pct': 0.0031584509939406712, 'atr_max_pct': 0.022395283853258334, 'tp_mult': 1.05936628293355, 'tsl_mult': 0.2938020572600025, 'strategy': 'breakout', 'time_stop': 276, 'use_sma': False, 'use_atr': True, 'use_adx': False, 'use_ema': False, 'use_spike': False, 'rsi_required': False, 'edge_k': 0.05466245336187814, 'edge_cap': 0.6143761999451564, 'bull_strategy': 'breakout', 'bull_bb_std_mult': 2.3486754788594566, 'bull_rsi_os': 8, 'bull_rsi_ob': 56, 'bull_adx_thresh': 27.124402662374155, 'bull_atr_min_pct': 0.004009682127294775, 'bull_atr_max_pct': 0.06609037064205328, 'bull_tp_mult': 1.2054748296085402, 'bull_tsl_mult': 0.9781460541045689, 'bull_time_stop': 155, 'bull_use_sma': True, 'bull_use_ema': True, 'bull_use_atr': True, 'bull_use_adx': False, 'bull_use_spike': False, 'bull_rsi_required': True, 'bear_strategy': 'breakout', 'bear_bb_std_mult': 1.0433559346061094, 'bear_rsi_os': 33, 'bear_rsi_ob': 56, 'bear_adx_thresh': 6.929613943197763, 'bear_atr_min_pct': 0.01580785574257708, 'bear_atr_max_pct': 0.04438601559555654, 'bear_tp_mult': 1.2553531952462045, 'bear_tsl_mult': 0.31603039521922477, 'bear_time_stop': 205, 'bear_use_sma': False, 'bear_use_ema': False, 'bear_use_atr': True, 'bear_use_adx': False, 'bear_use_spike': True, 'bear_rsi_required': True, 'sideways_strategy': 'breakout', 'sideways_bb_std_mult': 1.9385907216651694, 'sideways_rsi_os': 18, 'sideways_rsi_ob': 89, 'sideways_adx_thresh': 17.08584548158732, 'sideways_atr_min_pct': 0.004249573323229604, 'sideways_atr_max_pct': 0.14985454529385986, 'sideways_tp_mult': 2.6835246099329373, 'sideways_tsl_mult': 0.31376459602980966, 'sideways_time_stop': 157, 'sideways_use_sma': True, 'sideways_use_ema': False, 'sideways_use_atr': True, 'sideways_use_adx': True, 'sideways_use_spike': False, 'sideways_rsi_required': True}.
