[I 2025-08-31 11:49:18,681] Trial 421 finished with values: [-0.08903082113273064, 0.08883285882529947] and parameters: {'p_sma': 31, 'p_std': 12, 'p_atr': 14, 'p_adx': 7, 'rsi_period': 52, 'ema1': 12, 'ema2': 35, 'slip_atr_k': 0.14745956633188587, 'slip_spread_k': 0.09652700605461745, 'spread_hl_frac': 0.0018910197097849173, 'bb_std_mult': 0.6183639028352412, 'rsi_os': 33, 'rsi_ob': 71, 'vol_spike': 0.07380654753399721, 'adx_thresh': 23.75850813825532, 'atr_min_pct': 0.012873136357954972, 'atr_max_pct': 0.1386510567183038, 'tp_mult': 1.954114727579695, 'tsl_mult': 0.3807152605700647, 'strategy': 'breakout', 'time_stop': 294, 'use_sma': False, 'use_atr': True, 'use_adx': True, 'use_ema': False, 'use_spike': True, 'rsi_required': True, 'edge_k': 0.3677421561182555, 'edge_cap': 0.8459288713707104, 'bull_strategy': 'breakout', 'bull_bb_std_mult': 2.312936208345556, 'bull_rsi_os': 48, 'bull_rsi_ob': 49, 'bull_adx_thresh': 32.611576784045454, 'bull_atr_min_pct': 0.00044696411592065003, 'bull_atr_max_pct': 0.14674701509665414, 'bull_tp_mult': 2.1451285665516355, 'bull_tsl_mult': 0.26118618958860595, 'bull_time_stop': 76, 'bull_use_sma': True, 'bull_use_ema': True, 'bull_use_atr': True, 'bull_use_adx': False, 'bull_use_spike': False, 'bull_rsi_required': True, 'bear_strategy': 'breakout', 'bear_bb_std_mult': 0.9993230612235312, 'bear_rsi_os': 34, 'bear_rsi_ob': 49, 'bear_adx_thresh': 30.264239888378125, 'bear_atr_min_pct': 0.01369032045462865, 'bear_atr_max_pct': 0.12376142300829185, 'bear_tp_mult': 2.6366664796252475, 'bear_tsl_mult': 0.3661448410687147, 'bear_time_stop': 128, 'bear_use_sma': True, 'bear_use_ema': True, 'bear_use_atr': True, 'bear_use_adx': False, 'bear_use_spike': True, 'bear_rsi_required': True, 'sideways_strategy': 'breakout', 'sideways_bb_std_mult': 2.5095386480842987, 'sideways_rsi_os': 33, 'sideways_rsi_ob': 71, 'sideways_adx_thresh': 9.591460418212888, 'sideways_atr_min_pct': 0.024907635863469703, 'sideways_atr_max_pct': 0.045211495408162286, 'sideways_tp_mult': 1.3795196546343582, 'sideways_tsl_mult': 0.9819300768721397, 'sideways_time_stop': 16, 'sideways_use_sma': True, 'sideways_use_ema': False, 'sideways_use_atr': True, 'sideways_use_adx': True, 'sideways_use_spike': True, 'sideways_rsi_required': False}.
[I 2025-08-31 11:49:52,054] Trial 427 finished with values: [-0.23443650473413802, 0.23416722518336378] and parameters: {'p_sma': 27, 'p_std': 21, 'p_atr': 14, 'p_adx': 26, 'rsi_period': 20, 'ema1': 8, 'ema2': 36, 'slip_atr_k': 0.15945763465862206, 'slip_spread_k': 0.11543307535909912, 'spread_hl_frac': 0.03879491319158549, 'bb_std_mult': 0.7656653183623459, 'rsi_os': 7, 'rsi_ob': 55, 'vol_spike': 0.1362353345276993, 'adx_thresh': 27.859058404880344, 'atr_min_pct': 0.005990992393313875, 'atr_max_pct': 0.14346135746356853, 'tp_mult': 2.3892704499944175, 'tsl_mult': 0.8012823999910834, 'strategy': 'mean_reversion', 'time_stop': 289, 'use_sma': False, 'use_atr': True, 'use_adx': False, 'use_ema': True, 'use_spike': True, 'rsi_required': True, 'edge_k': 0.42767180250387676, 'edge_cap': 0.9774746448308613, 'bull_strategy': 'breakout', 'bull_bb_std_mult': 2.4690067190200384, 'bull_rsi_os': 33, 'bull_rsi_ob': 63, 'bull_adx_thresh': 16.961040615553618, 'bull_atr_min_pct': 0.021523316658821803, 'bull_atr_max_pct': 0.021195314299593468, 'bull_tp_mult': 1.557545449628287, 'bull_tsl_mult': 0.22175576384083362, 'bull_time_stop': 43, 'bull_use_sma': True, 'bull_use_ema': False, 'bull_use_atr': False, 'bull_use_adx': True, 'bull_use_spike': True, 'bull_rsi_required': False, 'bear_strategy': 'mean_reversion', 'bear_bb_std_mult': 1.4423887494570504, 'bear_rsi_os': 32, 'bear_rsi_ob': 55, 'bear_adx_thresh': 32.634622327337546, 'bear_atr_min_pct': 0.028233202655313254, 'bear_atr_max_pct': 0.1209782035341441, 'bear_tp_mult': 2.676929389017581, 'bear_tsl_mult': 0.6631881715741201, 'bear_time_stop': 11, 'bear_use_sma': False, 'bear_use_ema': False, 'bear_use_atr': False, 'bear_use_adx': False, 'bear_use_spike': False, 'bear_rsi_required': False, 'sideways_strategy': 'breakout', 'sideways_bb_std_mult': 1.8265600030749674, 'sideways_rsi_os': 51, 'sideways_rsi_ob': 76, 'sideways_adx_thresh': 7.954027862721433, 'sideways_atr_min_pct': 0.0015016708690869887, 'sideways_atr_max_pct': 0.04891209617909797, 'sideways_tp_mult': 1.621908994457849, 'sideways_tsl_mult': 0.31475296714792583, 'sideways_time_stop': 103, 'sideways_use_sma': False, 'sideways_use_ema': True, 'sideways_use_atr': False, 'sideways_use_adx': True, 'sideways_use_spike': False, 'sideways_rsi_required': True}.
[I 2025-08-31 11:49:52,578] Trial 426 finished with values: [-0.0637425041501658, 0.06286681299861549] and parameters: {'p_sma': 27, 'p_std': 21, 'p_atr': 14, 'p_adx': 26, 'rsi_period': 19, 'ema1': 19, 'ema2': 36, 'slip_atr_k': 0.1574692518378266, 'slip_spread_k': 0.5676565431299798, 'spread_hl_frac': 0.039195954209532854, 'bb_std_mult': 0.7385526254595212, 'rsi_os': 5, 'rsi_ob': 71, 'vol_spike': 0.13378224394970242, 'adx_thresh': 10.454549150006255, 'atr_min_pct': 0.019441065659182077, 'atr_max_pct': 0.1385799968981617, 'tp_mult': 1.0369964443571986, 'tsl_mult': 0.8063517638132445, 'strategy': 'mean_reversion', 'time_stop': 300, 'use_sma': False, 'use_atr': True, 'use_adx': True, 'use_ema': True, 'use_spike': True, 'rsi_required': True, 'edge_k': 1.4720077744806512, 'edge_cap': 0.9690505723429594, 'bull_strategy': 'breakout', 'bull_bb_std_mult': 2.5179301743043934, 'bull_rsi_os': 31, 'bull_rsi_ob': 63, 'bull_adx_thresh': 16.824709944289907, 'bull_atr_min_pct': 0.006052013079747842, 'bull_atr_max_pct': 0.10618206646959592, 'bull_tp_mult': 2.350046765162716, 'bull_tsl_mult': 0.3013461805975419, 'bull_time_stop': 272, 'bull_use_sma': True, 'bull_use_ema': False, 'bull_use_atr': False, 'bull_use_adx': True, 'bull_use_spike': True, 'bull_rsi_required': False, 'bear_strategy': 'mean_reversion', 'bear_bb_std_mult': 1.0188167847815364, 'bear_rsi_os': 33, 'bear_rsi_ob': 55, 'bear_adx_thresh': 32.685097086626, 'bear_atr_min_pct': 0.0023342122580187214, 'bear_atr_max_pct': 0.12234474948690927, 'bear_tp_mult': 2.6749114069767814, 'bear_tsl_mult': 0.4473554305681874, 'bear_time_stop': 188, 'bear_use_sma': False, 'bear_use_ema': False, 'bear_use_atr': False, 'bear_use_adx': False, 'bear_use_spike': False, 'bear_rsi_required': False, 'sideways_strategy': 'breakout', 'sideways_bb_std_mult': 1.8302597058836327, 'sideways_rsi_os': 38, 'sideways_rsi_ob': 76, 'sideways_adx_thresh': 7.895673040475693, 'sideways_atr_min_pct': 0.025019657494437977, 'sideways_atr_max_pct': 0.04799673347100497, 'sideways_tp_mult': 1.698205811259843, 'sideways_tsl_mult': 0.9389079264102252, 'sideways_time_stop': 182, 'sideways_use_sma': False, 'sideways_use_ema': True, 'sideways_use_atr': False, 'sideways_use_adx': True, 'sideways_use_spike': False, 'sideways_rsi_required': True}.
[I 2025-08-31 11:49:52,578] Trial 424 finished with values: [-0.16912315609344664, 0.16893875975168554] and parameters: {'p_sma': 5, 'p_std': 13, 'p_atr': 14, 'p_adx': 26, 'rsi_period': 48, 'ema1': 8, 'ema2': 35, 'slip_atr_k': 0.051905443667076494, 'slip_spread_k': 0.08638308337924784, 'spread_hl_frac': 0.002071676479939706, 'bb_std_mult': 0.7532787051306481, 'rsi_os': 26, 'rsi_ob': 70, 'vol_spike': 0.1373587222203927, 'adx_thresh': 10.103409854681598, 'atr_min_pct': 0.00516452559338759, 'atr_max_pct': 0.1392618789761121, 'tp_mult': 2.170248510329492, 'tsl_mult': 0.37923746574118233, 'strategy': 'mean_reversion', 'time_stop': 286, 'use_sma': False, 'use_atr': True, 'use_adx': True, 'use_ema': True, 'use_spike': True, 'rsi_required': True, 'edge_k': 0.3919601564155787, 'edge_cap': 0.890646315948715, 'bull_strategy': 'breakout', 'bull_bb_std_mult': 2.5136635454299183, 'bull_rsi_os': 24, 'bull_rsi_ob': 63, 'bull_adx_thresh': 32.38962652217998, 'bull_atr_min_pct': 0.013960519379826428, 'bull_atr_max_pct': 0.146556543695334, 'bull_tp_mult': 2.1939250114487447, 'bull_tsl_mult': 0.22430081130431634, 'bull_time_stop': 147, 'bull_use_sma': True, 'bull_use_ema': False, 'bull_use_atr': False, 'bull_use_adx': True, 'bull_use_spike': True, 'bull_rsi_required': True, 'bear_strategy': 'mean_reversion', 'bear_bb_std_mult': 1.626248813086838, 'bear_rsi_os': 51, 'bear_rsi_ob': 47, 'bear_adx_thresh': 32.94174019000895, 'bear_atr_min_pct': 0.01355719850051147, 'bear_atr_max_pct': 0.10747328314073203, 'bear_tp_mult': 1.9592001360347617, 'bear_tsl_mult': 0.16967404664572666, 'bear_time_stop': 188, 'bear_use_sma': False, 'bear_use_ema': True, 'bear_use_atr': False, 'bear_use_adx': False, 'bear_use_spike': False, 'bear_rsi_required': True, 'sideways_strategy': 'breakout', 'sideways_bb_std_mult': 1.8788824030090612, 'sideways_rsi_os': 52, 'sideways_rsi_ob': 76, 'sideways_adx_thresh': 9.646908203725372, 'sideways_atr_min_pct': 0.0010572160439962335, 'sideways_atr_max_pct': 0.047527281168865385, 'sideways_tp_mult': 1.5237238150396557, 'sideways_tsl_mult': 0.929773438056166, 'sideways_time_stop': 171, 'sideways_use_sma': False, 'sideways_use_ema': True, 'sideways_use_atr': True, 'sideways_use_adx': True, 'sideways_use_spike': False, 'sideways_rsi_required': False}.
[I 2025-08-31 11:49:52,742] Trial 425 finished with values: [-1000000000.0, 1000000000.0] and parameters: {'p_sma': 31, 'p_std': 48, 'p_atr': 14, 'p_adx': 26, 'rsi_period': 84, 'ema1': 8, 'ema2': 35, 'slip_atr_k': 0.15938363167825115, 'slip_spread_k': 0.10194666738349188, 'spread_hl_frac': 0.0023934827079960617, 'bb_std_mult': 0.7488867119059508, 'rsi_os': 7, 'rsi_ob': 71, 'vol_spike': 0.13835727915633952, 'adx_thresh': 28.103718496088486, 'atr_min_pct': 0.01819976370958021, 'atr_max_pct': 0.03319091533868541, 'tp_mult': 2.401112576428316, 'tsl_mult': 0.30425822187735063, 'strategy': 'mean_reversion', 'time_stop': 300, 'use_sma': False, 'use_atr': True, 'use_adx': True, 'use_ema': True, 'use_spike': True, 'rsi_required': True, 'edge_k': 1.4748232766721336, 'edge_cap': 0.8437041558447563, 'bull_strategy': 'breakout', 'bull_bb_std_mult': 2.5208032265236135, 'bull_rsi_os': 48, 'bull_rsi_ob': 63, 'bull_adx_thresh': 12.104758207566169, 'bull_atr_min_pct': 0.02160377699063205, 'bull_atr_max_pct': 0.14442757209644844, 'bull_tp_mult': 2.1631494423067794, 'bull_tsl_mult': 0.7143466335982147, 'bull_time_stop': 147, 'bull_use_sma': True, 'bull_use_ema': False, 'bull_use_atr': False, 'bull_use_adx': True, 'bull_use_spike': True, 'bull_rsi_required': False, 'bear_strategy': 'mean_reversion', 'bear_bb_std_mult': 1.0129519139250318, 'bear_rsi_os': 27, 'bear_rsi_ob': 87, 'bear_adx_thresh': 32.82991533549705, 'bear_atr_min_pct': 0.016497850128401263, 'bear_atr_max_pct': 0.12307020918112899, 'bear_tp_mult': 1.5921207841587732, 'bear_tsl_mult': 0.6692074647789537, 'bear_time_stop': 12, 'bear_use_sma': True, 'bear_use_ema': True, 'bear_use_atr': False, 'bear_use_adx': False, 'bear_use_spike': False, 'bear_rsi_required': False, 'sideways_strategy': 'breakout', 'sideways_bb_std_mult': 0.7821765317063736, 'sideways_rsi_os': 51, 'sideways_rsi_ob': 75, 'sideways_adx_thresh': 9.536179271437017, 'sideways_atr_min_pct': 0.005922206156388412, 'sideways_atr_max_pct': 0.04698838267987778, 'sideways_tp_mult': 1.1474537827858247, 'sideways_tsl_mult': 0.9262560885085225, 'sideways_time_stop': 172, 'sideways_use_sma': False, 'sideways_use_ema': True, 'sideways_use_atr': False, 'sideways_use_adx': True, 'sideways_use_spike': True, 'sideways_rsi_required': True}.
[I 2025-08-31 11:49:53,413] Trial 428 finished with values: [-1000000000.0, 1000000000.0] and parameters: {'p_sma': 28, 'p_std': 15, 'p_atr': 14, 'p_adx': 26, 'rsi_period': 48, 'ema1': 13, 'ema2': 35, 'slip_atr_k': 0.13131294567901747, 'slip_spread_k': 0.20625849781311867, 'spread_hl_frac': 0.029207763969586825, 'bb_std_mult': 2.0343893398532096, 'rsi_os': 32, 'rsi_ob': 70, 'vol_spike': 0.1785488667437657, 'adx_thresh': 24.65703288477506, 'atr_min_pct': 0.01505856671945025, 'atr_max_pct': 0.01125979232152351, 'tp_mult': 1.0437118572068247, 'tsl_mult': 0.6855399155415712, 'strategy': 'mean_reversion', 'time_stop': 237, 'use_sma': False, 'use_atr': True, 'use_adx': True, 'use_ema': True, 'use_spike': True, 'rsi_required': True, 'edge_k': 1.032003372496079, 'edge_cap': 0.7403611200593503, 'bull_strategy': 'breakout', 'bull_bb_std_mult': 2.51766259360814, 'bull_rsi_os': 31, 'bull_rsi_ob': 65, 'bull_adx_thresh': 16.62889979703822, 'bull_atr_min_pct': 0.006079459136033916, 'bull_atr_max_pct': 0.026094929926282387, 'bull_tp_mult': 2.1950531129990134, 'bull_tsl_mult': 0.4987780272424567, 'bull_time_stop': 272, 'bull_use_sma': True, 'bull_use_ema': False, 'bull_use_atr': False, 'bull_use_adx': True, 'bull_use_spike': True, 'bull_rsi_required': False, 'bear_strategy': 'mean_reversion', 'bear_bb_std_mult': 2.593355497124596, 'bear_rsi_os': 33, 'bear_rsi_ob': 52, 'bear_adx_thresh': 31.187307634207492, 'bear_atr_min_pct': 0.016504022150955838, 'bear_atr_max_pct': 0.10770173245239131, 'bear_tp_mult': 1.8076770112145393, 'bear_tsl_mult': 0.1673283459436719, 'bear_time_stop': 186, 'bear_use_sma': False, 'bear_use_ema': True, 'bear_use_atr': False, 'bear_use_adx': False, 'bear_use_spike': False, 'bear_rsi_required': False, 'sideways_strategy': 'breakout', 'sideways_bb_std_mult': 1.897106237356249, 'sideways_rsi_os': 36, 'sideways_rsi_ob': 95, 'sideways_adx_thresh': 6.439499004170013, 'sideways_atr_min_pct': 0.008218074247151482, 'sideways_atr_max_pct': 0.09848589785184154, 'sideways_tp_mult': 1.5077710704670966, 'sideways_tsl_mult': 0.2934175327025291, 'sideways_time_stop': 185, 'sideways_use_sma': False, 'sideways_use_ema': True, 'sideways_use_atr': True, 'sideways_use_adx': True, 'sideways_use_spike': False, 'sideways_rsi_required': True}.
[I 2025-08-31 11:50:28,597] Trial 431 finished with values: [-1000000000.0, 1000000000.0] and parameters: {'p_sma': 33, 'p_std': 15, 'p_atr': 19, 'p_adx': 26, 'rsi_period': 58, 'ema1': 16, 'ema2': 37, 'slip_atr_k': 0.05693073964112669, 'slip_spread_k': 0.0701206016701438, 'spread_hl_frac': 0.02879787181556627, 'bb_std_mult': 3.0315982058694173, 'rsi_os': 19, 'rsi_ob': 92, 'vol_spike': 0.1839671149316101, 'adx_thresh': 5.023924888972754, 'atr_min_pct': 0.004767390258659772, 'atr_max_pct': 0.013022803250085185, 'tp_mult': 2.7950637995515644, 'tsl_mult': 0.6145608416685473, 'strategy': 'breakout', 'time_stop': 267, 'use_sma': True, 'use_atr': False, 'use_adx': False, 'use_ema': False, 'use_spike': True, 'rsi_required': False, 'edge_k': 1.3355686469416292, 'edge_cap': 0.47457853411315765, 'bull_strategy': 'mean_reversion', 'bull_bb_std_mult': 3.0442426317433995, 'bull_rsi_os': 24, 'bull_rsi_ob': 69, 'bull_adx_thresh': 19.142734743477074, 'bull_atr_min_pct': 0.025282177365868894, 'bull_atr_max_pct': 0.13052202801136353, 'bull_tp_mult': 1.6569977661476494, 'bull_tsl_mult': 0.0637897813867837, 'bull_time_stop': 128, 'bull_use_sma': False, 'bull_use_ema': True, 'bull_use_atr': True, 'bull_use_adx': True, 'bull_use_spike': False, 'bull_rsi_required': True, 'bear_strategy': 'breakout', 'bear_bb_std_mult': 1.9229027719270901, 'bear_rsi_os': 42, 'bear_rsi_ob': 63, 'bear_adx_thresh': 31.17415052945923, 'bear_atr_min_pct': 0.011574639679663623, 'bear_atr_max_pct': 0.13107952808161277, 'bear_tp_mult': 1.4290200501858226, 'bear_tsl_mult': 0.33605576566242207, 'bear_time_stop': 198, 'bear_use_sma': False, 'bear_use_ema': True, 'bear_use_atr': True, 'bear_use_adx': True, 'bear_use_spike': True, 'bear_rsi_required': False, 'sideways_strategy': 'breakout', 'sideways_bb_std_mult': 1.7046709143886074, 'sideways_rsi_os': 32, 'sideways_rsi_ob': 52, 'sideways_adx_thresh': 26.312838473263184, 'sideways_atr_min_pct': 0.014262107306113846, 'sideways_atr_max_pct': 0.10796443693150173, 'sideways_tp_mult': 1.2593100342340402, 'sideways_tsl_mult': 0.2832087300563354, 'sideways_time_stop': 284, 'sideways_use_sma': True, 'sideways_use_ema': False, 'sideways_use_atr': True, 'sideways_use_adx': False, 'sideways_use_spike': False, 'sideways_rsi_required': True}.
[I 2025-08-31 11:50:29,469] Trial 429 finished with values: [-1000000000.0, 1000000000.0] and parameters: {'p_sma': 17, 'p_std': 41, 'p_atr': 23, 'p_adx': 26, 'rsi_period': 84, 'ema1': 28, 'ema2': 37, 'slip_atr_k': 0.24766290090405554, 'slip_spread_k': 0.5307149087921156, 'spread_hl_frac': 0.026187261614948762, 'bb_std_mult': 0.5021330527759444, 'rsi_os': 46, 'rsi_ob': 72, 'vol_spike': 0.19478649015750424, 'adx_thresh': 21.419423184528675, 'atr_min_pct': 0.00491636683236146, 'atr_max_pct': 0.03056435656612129, 'tp_mult': 1.0942271347489971, 'tsl_mult': 0.622868585017244, 'strategy': 'breakout', 'time_stop': 238, 'use_sma': True, 'use_atr': False, 'use_adx': True, 'use_ema': False, 'use_spike': True, 'rsi_required': True, 'edge_k': 1.6598556797621145, 'edge_cap': 0.7815736257038048, 'bull_strategy': 'mean_reversion', 'bull_bb_std_mult': 2.7214505284628645, 'bull_rsi_os': 19, 'bull_rsi_ob': 65, 'bull_adx_thresh': 29.086534644225843, 'bull_atr_min_pct': 0.007992640618712969, 'bull_atr_max_pct': 0.1436349292735508, 'bull_tp_mult': 1.6113595326352974, 'bull_tsl_mult': 0.32971762174600927, 'bull_time_stop': 115, 'bull_use_sma': False, 'bull_use_ema': True, 'bull_use_atr': True, 'bull_use_adx': True, 'bull_use_spike': False, 'bull_rsi_required': True, 'bear_strategy': 'breakout', 'bear_bb_std_mult': 0.5080114349075509, 'bear_rsi_os': 32, 'bear_rsi_ob': 58, 'bear_adx_thresh': 31.35642211348955, 'bear_atr_min_pct': 0.016476251241428673, 'bear_atr_max_pct': 0.14372632100207472, 'bear_tp_mult': 1.6018941642672024, 'bear_tsl_mult': 0.34486552926097197, 'bear_time_stop': 112, 'bear_use_sma': False, 'bear_use_ema': True, 'bear_use_atr': True, 'bear_use_adx': True, 'bear_use_spike': True, 'bear_rsi_required': False, 'sideways_strategy': 'breakout', 'sideways_bb_std_mult': 3.193466659479535, 'sideways_rsi_os': 32, 'sideways_rsi_ob': 52, 'sideways_adx_thresh': 30.675767744117945, 'sideways_atr_min_pct': 0.01104494681202035, 'sideways_atr_max_pct': 0.08186719940737437, 'sideways_tp_mult': 1.136727515583015, 'sideways_tsl_mult': 0.2821907309081084, 'sideways_time_stop': 151, 'sideways_use_sma': True, 'sideways_use_ema': False, 'sideways_use_atr': True, 'sideways_use_adx': False, 'sideways_use_spike': False, 'sideways_rsi_required': True}.
[I 2025-08-31 11:50:29,494] Trial 430 finished with values: [-1000000000.0, 1000000000.0] and parameters: {'p_sma': 29, 'p_std': 15, 'p_atr': 15, 'p_adx': 26, 'rsi_period': 84, 'ema1': 28, 'ema2': 37, 'slip_atr_k': 0.24653038241759812, 'slip_spread_k': 0.21478509523607298, 'spread_hl_frac': 0.022699319742133583, 'bb_std_mult': 0.9708845522732815, 'rsi_os': 32, 'rsi_ob': 72, 'vol_spike': 0.19590679057436416, 'adx_thresh': 24.566286197898286, 'atr_min_pct': 0.004973072709401863, 'atr_max_pct': 0.010132830132087309, 'tp_mult': 1.1101299362874615, 'tsl_mult': 0.9940419803480469, 'strategy': 'breakout', 'time_stop': 300, 'use_sma': True, 'use_atr': False, 'use_adx': True, 'use_ema': False, 'use_spike': True, 'rsi_required': True, 'edge_k': 0.2983005964949683, 'edge_cap': 0.8641247857457395, 'bull_strategy': 'mean_reversion', 'bull_bb_std_mult': 2.7209864010502804, 'bull_rsi_os': 40, 'bull_rsi_ob': 65, 'bull_adx_thresh': 12.050827090450479, 'bull_atr_min_pct': 0.006554030918322457, 'bull_atr_max_pct': 0.025257456513162975, 'bull_tp_mult': 1.6081754629064768, 'bull_tsl_mult': 0.4878790915330742, 'bull_time_stop': 107, 'bull_use_sma': False, 'bull_use_ema': True, 'bull_use_atr': True, 'bull_use_adx': True, 'bull_use_spike': False, 'bull_rsi_required': True, 'bear_strategy': 'breakout', 'bear_bb_std_mult': 0.7067967461126055, 'bear_rsi_os': 32, 'bear_rsi_ob': 58, 'bear_adx_thresh': 31.638340129875495, 'bear_atr_min_pct': 0.016632768563746507, 'bear_atr_max_pct': 0.11206233664447893, 'bear_tp_mult': 1.5867875467102797, 'bear_tsl_mult': 0.3379199645806824, 'bear_time_stop': 199, 'bear_use_sma': False, 'bear_use_ema': True, 'bear_use_atr': True, 'bear_use_adx': True, 'bear_use_spike': True, 'bear_rsi_required': False, 'sideways_strategy': 'breakout', 'sideways_bb_std_mult': 0.676349384861221, 'sideways_rsi_os': 27, 'sideways_rsi_ob': 52, 'sideways_adx_thresh': 6.578996599628654, 'sideways_atr_min_pct': 0.00274661630450318, 'sideways_atr_max_pct': 0.08341421941289161, 'sideways_tp_mult': 1.24231318426905, 'sideways_tsl_mult': 0.29538673064351156, 'sideways_time_stop': 18, 'sideways_use_sma': True, 'sideways_use_ema': False, 'sideways_use_atr': True, 'sideways_use_adx': False, 'sideways_use_spike': False, 'sideways_rsi_required': True}.
