[I 2025-08-31 11:00:56,800] Trial 36 finished with values: [-1000000000.0, 1000000000.0] and parameters: {'p_sma': 18, 'p_std': 54, 'p_atr': 24, 'p_adx': 12, 'rsi_period': 38, 'ema1': 7, 'ema2': 48, 'slip_atr_k': 0.13838391123545854, 'slip_spread_k': 0.6940542535693692, 'spread_hl_frac': 0.027579309990642842, 'bb_std_mult': 1.7639663018376572, 'rsi_os': 39, 'rsi_ob': 53, 'vol_spike': 0.2999604379301558, 'adx_thresh': 21.54171355800688, 'atr_min_pct': 0.00819164409754651, 'atr_max_pct': 0.13636180888425498, 'tp_mult': 2.385725299503696, 'tsl_mult': 0.5686966887893532, 'strategy': 'breakout', 'time_stop': 168, 'use_sma': False, 'use_atr': True, 'use_adx': True, 'use_ema': False, 'use_spike': False, 'rsi_required': False, 'edge_k': 0.40607044855953855, 'edge_cap': 0.5440239030576974, 'bull_strategy': 'mean_reversion', 'bull_bb_std_mult': 3.1962965152085365, 'bull_rsi_os': 37, 'bull_rsi_ob': 45, 'bull_adx_thresh': 31.4956203602718, 'bull_atr_min_pct': 0.01865085961646215, 'bull_atr_max_pct': 0.11732911459179765, 'bull_tp_mult': 2.077697400783255, 'bull_tsl_mult': 0.44876289170587025, 'bull_time_stop': 144, 'bull_use_sma': False, 'bull_use_ema': True, 'bull_use_atr': False, 'bull_use_adx': True, 'bull_use_spike': True, 'bull_rsi_required': False, 'bear_strategy': 'breakout', 'bear_bb_std_mult': 2.8080893142978782, 'bear_rsi_os': 27, 'bear_rsi_ob': 80, 'bear_adx_thresh': 9.981162387206322, 'bear_atr_min_pct': 0.003603157272459684, 'bear_atr_max_pct': 0.09503158747272615, 'bear_tp_mult': 2.49153373774217, 'bear_tsl_mult': 0.8211026316626442, 'bear_time_stop': 41, 'bear_use_sma': False, 'bear_use_ema': False, 'bear_use_atr': False, 'bear_use_adx': True, 'bear_use_spike': True, 'bear_rsi_required': False, 'sideways_strategy': 'breakout', 'sideways_bb_std_mult': 1.3786972342876593, 'sideways_rsi_os': 28, 'sideways_rsi_ob': 67, 'sideways_adx_thresh': 6.659838195024204, 'sideways_atr_min_pct': 0.022301690126710072, 'sideways_atr_max_pct': 0.05824768527115331, 'sideways_tp_mult': 2.503397903335329, 'sideways_tsl_mult': 0.27032043746504497, 'sideways_time_stop': 6, 'sideways_use_sma': True, 'sideways_use_ema': False, 'sideways_use_atr': False, 'sideways_use_adx': True, 'sideways_use_spike': False, 'sideways_rsi_required': True}.
[I 2025-08-31 11:00:56,890] Trial 34 finished with values: [-0.055871328187345304, 0.05555551522867581] and parameters: {'p_sma': 36, 'p_std': 43, 'p_atr': 7, 'p_adx': 28, 'rsi_period': 7, 'ema1': 7, 'ema2': 15, 'slip_atr_k': 0.13772739950797902, 'slip_spread_k': 0.694412936493599, 'spread_hl_frac': 0.027058659535150294, 'bb_std_mult': 1.7453768900450406, 'rsi_os': 39, 'rsi_ob': 53, 'vol_spike': 0.23166028099009395, 'adx_thresh': 11.386773645889217, 'atr_min_pct': 0.015037219308138996, 'atr_max_pct': 0.13703257093907464, 'tp_mult': 2.38953383246199, 'tsl_mult': 0.5268960827755106, 'strategy': 'breakout', 'time_stop': 161, 'use_sma': False, 'use_atr': False, 'use_adx': True, 'use_ema': False, 'use_spike': False, 'rsi_required': False, 'edge_k': 0.4625251592918568, 'edge_cap': 0.7879407684478971, 'bull_strategy': 'mean_reversion', 'bull_bb_std_mult': 3.2372942978821015, 'bull_rsi_os': 34, 'bull_rsi_ob': 78, 'bull_adx_thresh': 25.47939680897897, 'bull_atr_min_pct': 0.013392675945567154, 'bull_atr_max_pct': 0.14651921768037957, 'bull_tp_mult': 1.826058008830165, 'bull_tsl_mult': 0.4566339275108699, 'bull_time_stop': 131, 'bull_use_sma': True, 'bull_use_ema': False, 'bull_use_atr': False, 'bull_use_adx': False, 'bull_use_spike': True, 'bull_rsi_required': True, 'bear_strategy': 'breakout', 'bear_bb_std_mult': 2.6956812570878195, 'bear_rsi_os': 27, 'bear_rsi_ob': 65, 'bear_adx_thresh': 28.176244980505093, 'bear_atr_min_pct': 0.008310741035823398, 'bear_atr_max_pct': 0.09128676249356095, 'bear_tp_mult': 2.5292812200000485, 'bear_tsl_mult': 0.9818103086886004, 'bear_time_stop': 39, 'bear_use_sma': False, 'bear_use_ema': False, 'bear_use_atr': False, 'bear_use_adx': True, 'bear_use_spike': True, 'bear_rsi_required': True, 'sideways_strategy': 'breakout', 'sideways_bb_std_mult': 1.3945154197537077, 'sideways_rsi_os': 23, 'sideways_rsi_ob': 57, 'sideways_adx_thresh': 31.3879867282578, 'sideways_atr_min_pct': 0.0024349353485422767, 'sideways_atr_max_pct': 0.03593208524682335, 'sideways_tp_mult': 2.500225928106122, 'sideways_tsl_mult': 0.10548922404449235, 'sideways_time_stop': 34, 'sideways_use_sma': True, 'sideways_use_ema': True, 'sideways_use_atr': False, 'sideways_use_adx': False, 'sideways_use_spike': False, 'sideways_rsi_required': True}.
[I 2025-08-31 11:01:28,561] Trial 38 finished with values: [-0.10605164093285224, 0.10588697267727222] and parameters: {'p_sma': 36, 'p_std': 54, 'p_atr': 23, 'p_adx': 19, 'rsi_period': 13, 'ema1': 12, 'ema2': 48, 'slip_atr_k': 0.025492194654681416, 'slip_spread_k': 0.7236113678800653, 'spread_hl_frac': 0.015264768119163385, 'bb_std_mult': 2.5460101787122404, 'rsi_os': 5, 'rsi_ob': 54, 'vol_spike': 0.13375851420566368, 'adx_thresh': 21.94778854049524, 'atr_min_pct': 0.024025144436803557, 'atr_max_pct': 0.13975560338274567, 'tp_mult': 2.0814738216196016, 'tsl_mult': 0.68209319146066, 'strategy': 'breakout', 'time_stop': 183, 'use_sma': False, 'use_atr': False, 'use_adx': True, 'use_ema': False, 'use_spike': False, 'rsi_required': False, 'edge_k': 0.4203394492186194, 'edge_cap': 0.8724002377391387, 'bull_strategy': 'mean_reversion', 'bull_bb_std_mult': 1.8516106614669114, 'bull_rsi_os': 36, 'bull_rsi_ob': 68, 'bull_adx_thresh': 25.32075939249142, 'bull_atr_min_pct': 0.019283720774514606, 'bull_atr_max_pct': 0.11794996977885104, 'bull_tp_mult': 1.6416305347672069, 'bull_tsl_mult': 0.9859035675824939, 'bull_time_stop': 45, 'bull_use_sma': False, 'bull_use_ema': False, 'bull_use_atr': False, 'bull_use_adx': True, 'bull_use_spike': True, 'bull_rsi_required': False, 'bear_strategy': 'mean_reversion', 'bear_bb_std_mult': 1.5926685645787804, 'bear_rsi_os': 47, 'bear_rsi_ob': 64, 'bear_adx_thresh': 8.17973423257801, 'bear_atr_min_pct': 0.0035676031692116663, 'bear_atr_max_pct': 0.02437286258838517, 'bear_tp_mult': 2.7099054628518116, 'bear_tsl_mult': 0.7917706497835284, 'bear_time_stop': 89, 'bear_use_sma': False, 'bear_use_ema': False, 'bear_use_atr': False, 'bear_use_adx': True, 'bear_use_spike': False, 'bear_rsi_required': False, 'sideways_strategy': 'breakout', 'sideways_bb_std_mult': 2.1010593020334123, 'sideways_rsi_os': 44, 'sideways_rsi_ob': 84, 'sideways_adx_thresh': 6.419075114227525, 'sideways_atr_min_pct': 0.0020854133109824077, 'sideways_atr_max_pct': 0.022300379264863383, 'sideways_tp_mult': 2.7616188580872687, 'sideways_tsl_mult': 0.7196148758319952, 'sideways_time_stop': 152, 'sideways_use_sma': True, 'sideways_use_ema': False, 'sideways_use_atr': False, 'sideways_use_adx': False, 'sideways_use_spike': True, 'sideways_rsi_required': True}.
[I 2025-08-31 11:01:29,207] Trial 39 finished with values: [-1000000000.0, 1000000000.0] and parameters: {'p_sma': 47, 'p_std': 56, 'p_atr': 23, 'p_adx': 18, 'rsi_period': 13, 'ema1': 12, 'ema2': 48, 'slip_atr_k': 0.026094692741419998, 'slip_spread_k': 0.7758471260796946, 'spread_hl_frac': 0.01478856997596852, 'bb_std_mult': 2.6275365767473557, 'rsi_os': 26, 'rsi_ob': 55, 'vol_spike': 0.13803833397040582, 'adx_thresh': 24.59138496514649, 'atr_min_pct': 0.003028201219043656, 'atr_max_pct': 0.1000260557605641, 'tp_mult': 2.0982476615927808, 'tsl_mult': 0.8505888275544955, 'strategy': 'breakout', 'time_stop': 244, 'use_sma': False, 'use_atr': False, 'use_adx': True, 'use_ema': True, 'use_spike': False, 'rsi_required': False, 'edge_k': 0.1368386144982528, 'edge_cap': 0.8977171278366457, 'bull_strategy': 'mean_reversion', 'bull_bb_std_mult': 3.5878098185955207, 'bull_rsi_os': 39, 'bull_rsi_ob': 68, 'bull_adx_thresh': 24.22850992506474, 'bull_atr_min_pct': 0.018564440681139677, 'bull_atr_max_pct': 0.0510550179801348, 'bull_tp_mult': 1.9109877813370384, 'bull_tsl_mult': 0.5845461313156795, 'bull_time_stop': 156, 'bull_use_sma': False, 'bull_use_ema': False, 'bull_use_atr': False, 'bull_use_adx': True, 'bull_use_spike': True, 'bull_rsi_required': True, 'bear_strategy': 'mean_reversion', 'bear_bb_std_mult': 1.7295590425533967, 'bear_rsi_os': 26, 'bear_rsi_ob': 80, 'bear_adx_thresh': 8.017018043428829, 'bear_atr_min_pct': 0.002226946439707611, 'bear_atr_max_pct': 0.097748661349429, 'bear_tp_mult': 2.7410119664565373, 'bear_tsl_mult': 0.7720291468976519, 'bear_time_stop': 90, 'bear_use_sma': False, 'bear_use_ema': False, 'bear_use_atr': False, 'bear_use_adx': True, 'bear_use_spike': False, 'bear_rsi_required': True, 'sideways_strategy': 'mean_reversion', 'sideways_bb_std_mult': 2.0639859157159828, 'sideways_rsi_os': 13, 'sideways_rsi_ob': 58, 'sideways_adx_thresh': 6.04775895306072, 'sideways_atr_min_pct': 0.023953077793127733, 'sideways_atr_max_pct': 0.07603680109657544, 'sideways_tp_mult': 2.781550860760036, 'sideways_tsl_mult': 0.7485234703043623, 'sideways_time_stop': 156, 'sideways_use_sma': True, 'sideways_use_ema': True, 'sideways_use_atr': False, 'sideways_use_adx': False, 'sideways_use_spike': True, 'sideways_rsi_required': True}.
[I 2025-08-31 11:01:29,365] Trial 40 finished with values: [-1000000000.0, 1000000000.0] and parameters: {'p_sma': 47, 'p_std': 60, 'p_atr': 19, 'p_adx': 19, 'rsi_period': 49, 'ema1': 12, 'ema2': 37, 'slip_atr_k': 0.02971742902242988, 'slip_spread_k': 0.758251732246071, 'spread_hl_frac': 0.015412525159273091, 'bb_std_mult': 2.6414684876799024, 'rsi_os': 25, 'rsi_ob': 91, 'vol_spike': 0.1282151998185595, 'adx_thresh': 24.594478822164238, 'atr_min_pct': 0.003313009088929354, 'atr_max_pct': 0.09796049079246559, 'tp_mult': 2.150429559687917, 'tsl_mult': 0.7008431355581778, 'strategy': 'breakout', 'time_stop': 250, 'use_sma': False, 'use_atr': False, 'use_adx': True, 'use_ema': True, 'use_spike': False, 'rsi_required': False, 'edge_k': 0.0930966506560391, 'edge_cap': 0.8260965166047489, 'bull_strategy': 'mean_reversion', 'bull_bb_std_mult': 0.9320107983871757, 'bull_rsi_os': 31, 'bull_rsi_ob': 68, 'bull_adx_thresh': 19.19168733729084, 'bull_atr_min_pct': 0.02668882107444494, 'bull_atr_max_pct': 0.07456359362262138, 'bull_tp_mult': 1.5965613027048846, 'bull_tsl_mult': 0.3121169346467786, 'bull_time_stop': 297, 'bull_use_sma': False, 'bull_use_ema': False, 'bull_use_atr': True, 'bull_use_adx': True, 'bull_use_spike': True, 'bull_rsi_required': True, 'bear_strategy': 'mean_reversion', 'bear_bb_std_mult': 1.5169503615479476, 'bear_rsi_os': 47, 'bear_rsi_ob': 91, 'bear_adx_thresh': 16.886387355642928, 'bear_atr_min_pct': 0.008425161837172495, 'bear_atr_max_pct': 0.028585976917566473, 'bear_tp_mult': 2.750507407685355, 'bear_tsl_mult': 0.769217460751352, 'bear_time_stop': 92, 'bear_use_sma': False, 'bear_use_ema': False, 'bear_use_atr': False, 'bear_use_adx': True, 'bear_use_spike': False, 'bear_rsi_required': True, 'sideways_strategy': 'mean_reversion', 'sideways_bb_std_mult': 2.0236138025813784, 'sideways_rsi_os': 14, 'sideways_rsi_ob': 84, 'sideways_adx_thresh': 13.24368585431062, 'sideways_atr_min_pct': 0.027536465566375436, 'sideways_atr_max_pct': 0.07769768511176046, 'sideways_tp_mult': 2.365929714318371, 'sideways_tsl_mult': 0.7341607368162284, 'sideways_time_stop': 161, 'sideways_use_sma': False, 'sideways_use_ema': True, 'sideways_use_atr': True, 'sideways_use_adx': False, 'sideways_use_spike': True, 'sideways_rsi_required': True}.
[I 2025-08-31 11:01:29,681] Trial 41 finished with values: [-1000000000.0, 1000000000.0] and parameters: {'p_sma': 47, 'p_std': 60, 'p_atr': 11, 'p_adx': 23, 'rsi_period': 57, 'ema1': 13, 'ema2': 35, 'slip_atr_k': 0.12223469680462129, 'slip_spread_k': 0.10217292795186672, 'spread_hl_frac': 0.04345296221288002, 'bb_std_mult': 2.6921630521163897, 'rsi_os': 24, 'rsi_ob': 68, 'vol_spike': 0.13211850796511296, 'adx_thresh': 24.531472613257243, 'atr_min_pct': 0.0025330553749531217, 'atr_max_pct': 0.09943644645086339, 'tp_mult': 2.157880843940586, 'tsl_mult': 0.6838491430659573, 'strategy': 'breakout', 'time_stop': 252, 'use_sma': True, 'use_atr': False, 'use_adx': True, 'use_ema': True, 'use_spike': False, 'rsi_required': True, 'edge_k': 0.09467744800630065, 'edge_cap': 0.7859211223983618, 'bull_strategy': 'mean_reversion', 'bull_bb_std_mult': 1.91117454240507, 'bull_rsi_os': 41, 'bull_rsi_ob': 69, 'bull_adx_thresh': 24.131992487758232, 'bull_atr_min_pct': 0.02297379437999434, 'bull_atr_max_pct': 0.05093406497004815, 'bull_tp_mult': 1.6350242134353288, 'bull_tsl_mult': 0.9923177419619049, 'bull_time_stop': 293, 'bull_use_sma': False, 'bull_use_ema': False, 'bull_use_atr': True, 'bull_use_adx': True, 'bull_use_spike': True, 'bull_rsi_required': True, 'bear_strategy': 'mean_reversion', 'bear_bb_std_mult': 1.5954727016581296, 'bear_rsi_os': 49, 'bear_rsi_ob': 91, 'bear_adx_thresh': 15.79844660935564, 'bear_atr_min_pct': 0.016810619309110063, 'bear_atr_max_pct': 0.059024173577514924, 'bear_tp_mult': 2.731439145525289, 'bear_tsl_mult': 0.7768017374574983, 'bear_time_stop': 91, 'bear_use_sma': False, 'bear_use_ema': False, 'bear_use_atr': True, 'bear_use_adx': True, 'bear_use_spike': False, 'bear_rsi_required': True, 'sideways_strategy': 'mean_reversion', 'sideways_bb_std_mult': 1.9418954216426145, 'sideways_rsi_os': 14, 'sideways_rsi_ob': 57, 'sideways_adx_thresh': 5.265111771383948, 'sideways_atr_min_pct': 0.028982220717017823, 'sideways_atr_max_pct': 0.07598888093115651, 'sideways_tp_mult': 2.7475846135202855, 'sideways_tsl_mult': 0.7532373606910854, 'sideways_time_stop': 156, 'sideways_use_sma': False, 'sideways_use_ema': True, 'sideways_use_atr': True, 'sideways_use_adx': False, 'sideways_use_spike': True, 'sideways_rsi_required': True}.
[I 2025-08-31 11:02:01,982] Trial 43 finished with values: [-1000000000.0, 1000000000.0] and parameters: {'p_sma': 29, 'p_std': 26, 'p_atr': 19, 'p_adx': 13, 'rsi_period': 63, 'ema1': 19, 'ema2': 33, 'slip_atr_k': 0.12723977383602922, 'slip_spread_k': 0.11440125422542263, 'spread_hl_frac': 0.03073697148737259, 'bb_std_mult': 2.7937983266512263, 'rsi_os': 22, 'rsi_ob': 67, 'vol_spike': 0.20049604427925988, 'adx_thresh': 30.67386130554626, 'atr_min_pct': 0.018538135956243647, 'atr_max_pct': 0.03952039455024328, 'tp_mult': 2.6807710472565303, 'tsl_mult': 0.6828156652975614, 'strategy': 'breakout', 'time_stop': 214, 'use_sma': True, 'use_atr': False, 'use_adx': True, 'use_ema': True, 'use_spike': False, 'rsi_required': True, 'edge_k': 0.07725126488604983, 'edge_cap': 0.7930869665093168, 'bull_strategy': 'mean_reversion', 'bull_bb_std_mult': 2.5054202170773925, 'bull_rsi_os': 29, 'bull_rsi_ob': 52, 'bull_adx_thresh': 22.815816730009583, 'bull_atr_min_pct': 0.00998093381268442, 'bull_atr_max_pct': 0.011332896431149458, 'bull_tp_mult': 1.462025899319483, 'bull_tsl_mult': 0.32202400628293226, 'bull_time_stop': 205, 'bull_use_sma': True, 'bull_use_ema': False, 'bull_use_atr': True, 'bull_use_adx': False, 'bull_use_spike': False, 'bull_rsi_required': True, 'bear_strategy': 'mean_reversion', 'bear_bb_std_mult': 1.0631168277477836, 'bear_rsi_os': 30, 'bear_rsi_ob': 83, 'bear_adx_thresh': 15.70562266113565, 'bear_atr_min_pct': 0.007622312789001027, 'bear_atr_max_pct': 0.05500757655268081, 'bear_tp_mult': 2.239280875952981, 'bear_tsl_mult': 0.09175887700247348, 'bear_time_stop': 120, 'bear_use_sma': False, 'bear_use_ema': False, 'bear_use_atr': True, 'bear_use_adx': False, 'bear_use_spike': False, 'bear_rsi_required': True, 'sideways_strategy': 'mean_reversion', 'sideways_bb_std_mult': 1.930684197846508, 'sideways_rsi_os': 37, 'sideways_rsi_ob': 51, 'sideways_adx_thresh': 10.222794719147078, 'sideways_atr_min_pct': 0.026886543472951878, 'sideways_atr_max_pct': 0.08093296762881806, 'sideways_tp_mult': 2.311912464422278, 'sideways_tsl_mult': 0.9108270459629517, 'sideways_time_stop': 77, 'sideways_use_sma': False, 'sideways_use_ema': True, 'sideways_use_atr': True, 'sideways_use_adx': False, 'sideways_use_spike': True, 'sideways_rsi_required': True}.
[I 2025-08-31 11:02:02,202] Trial 42 finished with values: [-1000000000.0, 1000000000.0] and parameters: {'p_sma': 29, 'p_std': 60, 'p_atr': 9, 'p_adx': 23, 'rsi_period': 62, 'ema1': 30, 'ema2': 35, 'slip_atr_k': 0.12859234260133717, 'slip_spread_k': 0.09375643690448981, 'spread_hl_frac': 0.04394442485385991, 'bb_std_mult': 2.9204418400742336, 'rsi_os': 24, 'rsi_ob': 69, 'vol_spike': 0.26408741855038825, 'adx_thresh': 25.02957905960948, 'atr_min_pct': 0.0118767148125685, 'atr_max_pct': 0.1026073137480642, 'tp_mult': 1.374181051901364, 'tsl_mult': 0.8484981800598584, 'strategy': 'breakout', 'time_stop': 252, 'use_sma': True, 'use_atr': False, 'use_adx': True, 'use_ema': True, 'use_spike': False, 'rsi_required': True, 'edge_k': 0.05027192740533465, 'edge_cap': 0.7869572965312605, 'bull_strategy': 'mean_reversion', 'bull_bb_std_mult': 3.5791147830927263, 'bull_rsi_os': 29, 'bull_rsi_ob': 84, 'bull_adx_thresh': 23.180987559798563, 'bull_atr_min_pct': 0.023118179661155147, 'bull_atr_max_pct': 0.04906358829713423, 'bull_tp_mult': 1.9393203101775294, 'bull_tsl_mult': 0.601006213032023, 'bull_time_stop': 207, 'bull_use_sma': False, 'bull_use_ema': False, 'bull_use_atr': True, 'bull_use_adx': False, 'bull_use_spike': False, 'bull_rsi_required': True, 'bear_strategy': 'mean_reversion', 'bear_bb_std_mult': 1.4649843306254753, 'bear_rsi_os': 31, 'bear_rsi_ob': 84, 'bear_adx_thresh': 31.88553094585406, 'bear_atr_min_pct': 0.008077777099450359, 'bear_atr_max_pct': 0.05696616804194067, 'bear_tp_mult': 2.2971167809886714, 'bear_tsl_mult': 0.673500397308401, 'bear_time_stop': 117, 'bear_use_sma': False, 'bear_use_ema': False, 'bear_use_atr': True, 'bear_use_adx': False, 'bear_use_spike': False, 'bear_rsi_required': True, 'sideways_strategy': 'mean_reversion', 'sideways_bb_std_mult': 2.038507451032824, 'sideways_rsi_os': 37, 'sideways_rsi_ob': 58, 'sideways_adx_thresh': 13.511845295799091, 'sideways_atr_min_pct': 0.02940224471311792, 'sideways_atr_max_pct': 0.07828513109015743, 'sideways_tp_mult': 2.3388395497043484, 'sideways_tsl_mult': 0.8946575967390987, 'sideways_time_stop': 235, 'sideways_use_sma': False, 'sideways_use_ema': True, 'sideways_use_atr': True, 'sideways_use_adx': False, 'sideways_use_spike': True, 'sideways_rsi_required': True}.
[I 2025-08-31 11:02:02,235] Trial 45 finished with values: [-1000000000.0, 1000000000.0] and parameters: {'p_sma': 57, 'p_std': 24, 'p_atr': 9, 'p_adx': 14, 'rsi_period': 59, 'ema1': 30, 'ema2': 16, 'slip_atr_k': 0.06511933324119647, 'slip_spread_k': 0.35572538613641036, 'spread_hl_frac': 0.03720479370545369, 'bb_std_mult': 2.121995266573543, 'rsi_os': 31, 'rsi_ob': 76, 'vol_spike': 0.2664643248598279, 'adx_thresh': 7.855816364790089, 'atr_min_pct': 0.008088115572603364, 'atr_max_pct': 0.024900836171443494, 'tp_mult': 2.7309397338872152, 'tsl_mult': 0.8396290953792032, 'strategy': 'mean_reversion', 'time_stop': 34, 'use_sma': True, 'use_atr': True, 'use_adx': True, 'use_ema': True, 'use_spike': False, 'rsi_required': True, 'edge_k': 0.5342885172443583, 'edge_cap': 0.280832692172186, 'bull_strategy': 'breakout', 'bull_bb_std_mult': 2.544507347486518, 'bull_rsi_os': 28, 'bull_rsi_ob': 92, 'bull_adx_thresh': 22.36548832694833, 'bull_atr_min_pct': 0.009236509698566193, 'bull_atr_max_pct': 0.10048216313435833, 'bull_tp_mult': 1.4654596419489767, 'bull_tsl_mult': 0.6261420092612449, 'bull_time_stop': 212, 'bull_use_sma': True, 'bull_use_ema': False, 'bull_use_atr': False, 'bull_use_adx': False, 'bull_use_spike': False, 'bull_rsi_required': True, 'bear_strategy': 'breakout', 'bear_bb_std_mult': 1.1041228672404457, 'bear_rsi_os': 30, 'bear_rsi_ob': 71, 'bear_adx_thresh': 31.925268638414167, 'bear_atr_min_pct': 0.007946932275324205, 'bear_atr_max_pct': 0.07310131312304358, 'bear_tp_mult': 2.264022282904476, 'bear_tsl_mult': 0.08446974459581802, 'bear_time_stop': 180, 'bear_use_sma': True, 'bear_use_ema': False, 'bear_use_atr': True, 'bear_use_adx': False, 'bear_use_spike': False, 'bear_rsi_required': True, 'sideways_strategy': 'breakout', 'sideways_bb_std_mult': 0.9982888378641523, 'sideways_rsi_os': 21, 'sideways_rsi_ob': 50, 'sideways_adx_thresh': 33.33127955892754, 'sideways_atr_min_pct': 0.01297110301280752, 'sideways_atr_max_pct': 0.05017117604948776, 'sideways_tp_mult': 2.2282195088627295, 'sideways_tsl_mult': 0.43055390071481625, 'sideways_time_stop': 242, 'sideways_use_sma': True, 'sideways_use_ema': True, 'sideways_use_atr': True, 'sideways_use_adx': True, 'sideways_use_spike': True, 'sideways_rsi_required': False}.
