[I 2025-08-31 11:54:40,704] Trial 458 finished with values: [-1000000000.0, 1000000000.0] and parameters: {'p_sma': 9, 'p_std': 15, 'p_atr': 19, 'p_adx': 26, 'rsi_period': 48, 'ema1': 10, 'ema2': 37, 'slip_atr_k': 0.13593263849550152, 'slip_spread_k': 0.07932169612950858, 'spread_hl_frac': 0.0037018203588766565, 'bb_std_mult': 0.6786821321053854, 'rsi_os': 39, 'rsi_ob': 79, 'vol_spike': 0.14910324013776935, 'adx_thresh': 24.252082410352447, 'atr_min_pct': 0.024137126446247825, 'atr_max_pct': 0.024800266337312617, 'tp_mult': 1.6582256750174418, 'tsl_mult': 0.2605720804603733, 'strategy': 'breakout', 'time_stop': 294, 'use_sma': False, 'use_atr': True, 'use_adx': True, 'use_ema': False, 'use_spike': True, 'rsi_required': True, 'edge_k': 0.517822777031886, 'edge_cap': 0.8895152516814369, 'bull_strategy': 'breakout', 'bull_bb_std_mult': 1.3267059611527314, 'bull_rsi_os': 15, 'bull_rsi_ob': 95, 'bull_adx_thresh': 13.61992440831721, 'bull_atr_min_pct': 0.009618652739580711, 'bull_atr_max_pct': 0.14432696924824728, 'bull_tp_mult': 1.575366164102322, 'bull_tsl_mult': 0.32002700235886605, 'bull_time_stop': 215, 'bull_use_sma': True, 'bull_use_ema': True, 'bull_use_atr': True, 'bull_use_adx': True, 'bull_use_spike': False, 'bull_rsi_required': True, 'bear_strategy': 'breakout', 'bear_bb_std_mult': 0.8153543437415505, 'bear_rsi_os': 22, 'bear_rsi_ob': 64, 'bear_adx_thresh': 11.708661381829227, 'bear_atr_min_pct': 0.007189992959719013, 'bear_atr_max_pct': 0.1107197095795168, 'bear_tp_mult': 2.7537576780898805, 'bear_tsl_mult': 0.4199643440328188, 'bear_time_stop': 189, 'bear_use_sma': False, 'bear_use_ema': True, 'bear_use_atr': True, 'bear_use_adx': True, 'bear_use_spike': True, 'bear_rsi_required': False, 'sideways_strategy': 'breakout', 'sideways_bb_std_mult': 1.836374665677793, 'sideways_rsi_os': 39, 'sideways_rsi_ob': 71, 'sideways_adx_thresh': 9.276769729990237, 'sideways_atr_min_pct': 0.021807742747950783, 'sideways_atr_max_pct': 0.09423545079042378, 'sideways_tp_mult': 1.5832368820029217, 'sideways_tsl_mult': 0.19025122723345117, 'sideways_time_stop': 300, 'sideways_use_sma': True, 'sideways_use_ema': False, 'sideways_use_atr': True, 'sideways_use_adx': True, 'sideways_use_spike': False, 'sideways_rsi_required': True}.
[I 2025-08-31 11:54:40,898] Trial 459 finished with values: [-1000000000.0, 1000000000.0] and parameters: {'p_sma': 32, 'p_std': 15, 'p_atr': 15, 'p_adx': 26, 'rsi_period': 48, 'ema1': 23, 'ema2': 36, 'slip_atr_k': 0.04814762448130627, 'slip_spread_k': 0.08589923297958806, 'spread_hl_frac': 3.250369994505875e-05, 'bb_std_mult': 1.6705880834433315, 'rsi_os': 28, 'rsi_ob': 70, 'vol_spike': 0.258885427967658, 'adx_thresh': 5.897356838721008, 'atr_min_pct': 0.022683159159380673, 'atr_max_pct': 0.025931657546252665, 'tp_mult': 2.5249844404515756, 'tsl_mult': 0.2857224023032372, 'strategy': 'breakout', 'time_stop': 58, 'use_sma': False, 'use_atr': True, 'use_adx': True, 'use_ema': False, 'use_spike': True, 'rsi_required': True, 'edge_k': 0.43144282508214943, 'edge_cap': 0.8312956943732682, 'bull_strategy': 'breakout', 'bull_bb_std_mult': 2.794416858439835, 'bull_rsi_os': 15, 'bull_rsi_ob': 66, 'bull_adx_thresh': 14.722931284225572, 'bull_atr_min_pct': 0.005559235786594412, 'bull_atr_max_pct': 0.14381868678044674, 'bull_tp_mult': 1.8251360649204373, 'bull_tsl_mult': 0.2966333392117803, 'bull_time_stop': 216, 'bull_use_sma': True, 'bull_use_ema': True, 'bull_use_atr': True, 'bull_use_adx': True, 'bull_use_spike': False, 'bull_rsi_required': False, 'bear_strategy': 'breakout', 'bear_bb_std_mult': 1.5496580335536234, 'bear_rsi_os': 30, 'bear_rsi_ob': 46, 'bear_adx_thresh': 29.1719557434856, 'bear_atr_min_pct': 0.015446913245123312, 'bear_atr_max_pct': 0.11329735142780231, 'bear_tp_mult': 2.7438927859588773, 'bear_tsl_mult': 0.43736950981157163, 'bear_time_stop': 193, 'bear_use_sma': False, 'bear_use_ema': True, 'bear_use_atr': True, 'bear_use_adx': True, 'bear_use_spike': True, 'bear_rsi_required': False, 'sideways_strategy': 'breakout', 'sideways_bb_std_mult': 3.0633714645559005, 'sideways_rsi_os': 23, 'sideways_rsi_ob': 71, 'sideways_adx_thresh': 15.331776485192607, 'sideways_atr_min_pct': 0.010442223724757664, 'sideways_atr_max_pct': 0.09463229219173733, 'sideways_tp_mult': 1.4480157729469012, 'sideways_tsl_mult': 0.30084867442401697, 'sideways_time_stop': 198, 'sideways_use_sma': True, 'sideways_use_ema': False, 'sideways_use_atr': True, 'sideways_use_adx': True, 'sideways_use_spike': False, 'sideways_rsi_required': True}.
