[I 2025-08-31 11:26:34,421] Trial 237 finished with values: [-1000000000.0, 1000000000.0] and parameters: {'p_sma': 27, 'p_std': 15, 'p_atr': 15, 'p_adx': 25, 'rsi_period': 50, 'ema1': 17, 'ema2': 38, 'slip_atr_k': 0.047416803579248906, 'slip_spread_k': 0.4010273473242708, 'spread_hl_frac': 0.0018357933853128258, 'bb_std_mult': 0.988908739318742, 'rsi_os': 35, 'rsi_ob': 68, 'vol_spike': 0.13424057146164725, 'adx_thresh': 23.72006406554427, 'atr_min_pct': 0.006355515799588093, 'atr_max_pct': 0.03887093805255974, 'tp_mult': 1.5697459853119429, 'tsl_mult': 0.35394007015377416, 'strategy': 'breakout', 'time_stop': 53, 'use_sma': False, 'use_atr': True, 'use_adx': False, 'use_ema': False, 'use_spike': True, 'rsi_required': True, 'edge_k': 0.39453431027658686, 'edge_cap': 0.849947625592749, 'bull_strategy': 'breakout', 'bull_bb_std_mult': 2.720606498084196, 'bull_rsi_os': 39, 'bull_rsi_ob': 65, 'bull_adx_thresh': 13.195187004704358, 'bull_atr_min_pct': 0.007974899812924097, 'bull_atr_max_pct': 0.14531900938678002, 'bull_tp_mult': 1.4978142361656281, 'bull_tsl_mult': 0.9970763696425136, 'bull_time_stop': 39, 'bull_use_sma': False, 'bull_use_ema': True, 'bull_use_atr': True, 'bull_use_adx': True, 'bull_use_spike': False, 'bull_rsi_required': True, 'bear_strategy': 'breakout', 'bear_bb_std_mult': 2.815943935652399, 'bear_rsi_os': 34, 'bear_rsi_ob': 54, 'bear_adx_thresh': 30.990901485161302, 'bear_atr_min_pct': 0.021546216493030564, 'bear_atr_max_pct': 0.11381327401713064, 'bear_tp_mult': 2.8274160121317493, 'bear_tsl_mult': 0.47965251694419253, 'bear_time_stop': 177, 'bear_use_sma': False, 'bear_use_ema': True, 'bear_use_atr': True, 'bear_use_adx': False, 'bear_use_spike': True, 'bear_rsi_required': False, 'sideways_strategy': 'breakout', 'sideways_bb_std_mult': 1.661251491730577, 'sideways_rsi_os': 30, 'sideways_rsi_ob': 73, 'sideways_adx_thresh': 25.53006431672207, 'sideways_atr_min_pct': 0.02613585091402207, 'sideways_atr_max_pct': 0.043086333782981164, 'sideways_tp_mult': 1.0720999336352017, 'sideways_tsl_mult': 0.42761777581056715, 'sideways_time_stop': 17, 'sideways_use_sma': True, 'sideways_use_ema': False, 'sideways_use_atr': True, 'sideways_use_adx': True, 'sideways_use_spike': False, 'sideways_rsi_required': False}.
[I 2025-08-31 11:26:34,625] Trial 235 finished with values: [-0.07467488021800495, 0.07436829587283354] and parameters: {'p_sma': 28, 'p_std': 15, 'p_atr': 13, 'p_adx': 24, 'rsi_period': 50, 'ema1': 10, 'ema2': 38, 'slip_atr_k': 0.04733941381956691, 'slip_spread_k': 0.36460785912582877, 'spread_hl_frac': 0.0023112236027463557, 'bb_std_mult': 0.9688668033346668, 'rsi_os': 33, 'rsi_ob': 68, 'vol_spike': 0.13349686646278563, 'adx_thresh': 23.709224446433723, 'atr_min_pct': 0.007558843647841438, 'atr_max_pct': 0.037852695965680035, 'tp_mult': 1.2361530191369408, 'tsl_mult': 0.18580723248570152, 'strategy': 'breakout', 'time_stop': 300, 'use_sma': False, 'use_atr': True, 'use_adx': False, 'use_ema': False, 'use_spike': True, 'rsi_required': True, 'edge_k': 0.386534288293757, 'edge_cap': 0.8484019287515892, 'bull_strategy': 'breakout', 'bull_bb_std_mult': 2.7047020793236776, 'bull_rsi_os': 25, 'bull_rsi_ob': 65, 'bull_adx_thresh': 13.171907386307252, 'bull_atr_min_pct': 0.00025025409704439953, 'bull_atr_max_pct': 0.14543305525774614, 'bull_tp_mult': 1.4739153562268026, 'bull_tsl_mult': 0.42201015821561494, 'bull_time_stop': 41, 'bull_use_sma': False, 'bull_use_ema': True, 'bull_use_atr': True, 'bull_use_adx': True, 'bull_use_spike': False, 'bull_rsi_required': True, 'bear_strategy': 'breakout', 'bear_bb_std_mult': 2.127860298958162, 'bear_rsi_os': 34, 'bear_rsi_ob': 54, 'bear_adx_thresh': 31.579044789372695, 'bear_atr_min_pct': 0.021491135643779406, 'bear_atr_max_pct': 0.1134151827203954, 'bear_tp_mult': 2.9190138886910417, 'bear_tsl_mult': 0.4768034948015895, 'bear_time_stop': 163, 'bear_use_sma': False, 'bear_use_ema': True, 'bear_use_atr': True, 'bear_use_adx': False, 'bear_use_spike': True, 'bear_rsi_required': False, 'sideways_strategy': 'breakout', 'sideways_bb_std_mult': 1.653445593069716, 'sideways_rsi_os': 30, 'sideways_rsi_ob': 73, 'sideways_adx_thresh': 9.432642057149362, 'sideways_atr_min_pct': 0.02631258448907363, 'sideways_atr_max_pct': 0.04688730816301546, 'sideways_tp_mult': 1.584738553362188, 'sideways_tsl_mult': 0.44161810839105703, 'sideways_time_stop': 122, 'sideways_use_sma': True, 'sideways_use_ema': False, 'sideways_use_atr': True, 'sideways_use_adx': True, 'sideways_use_spike': False, 'sideways_rsi_required': False}.
[I 2025-08-31 11:26:35,016] Trial 234 finished with values: [-0.02621314277651199, 0.026195909477826136] and parameters: {'p_sma': 27, 'p_std': 15, 'p_atr': 15, 'p_adx': 26, 'rsi_period': 50, 'ema1': 10, 'ema2': 35, 'slip_atr_k': 0.04811695240771051, 'slip_spread_k': 0.3582491637440195, 'spread_hl_frac': 0.002409720364664695, 'bb_std_mult': 0.887582768126171, 'rsi_os': 31, 'rsi_ob': 69, 'vol_spike': 0.13424964806147377, 'adx_thresh': 23.65227914482925, 'atr_min_pct': 0.006227425579283707, 'atr_max_pct': 0.028050942724618805, 'tp_mult': 1.2449761720675394, 'tsl_mult': 0.3604886384429526, 'strategy': 'breakout', 'time_stop': 126, 'use_sma': False, 'use_atr': True, 'use_adx': False, 'use_ema': False, 'use_spike': True, 'rsi_required': True, 'edge_k': 0.37841940761862747, 'edge_cap': 0.8459852935372921, 'bull_strategy': 'breakout', 'bull_bb_std_mult': 2.7289699597941466, 'bull_rsi_os': 25, 'bull_rsi_ob': 65, 'bull_adx_thresh': 18.594832391352888, 'bull_atr_min_pct': 0.0025525017209872356, 'bull_atr_max_pct': 0.13845177217285004, 'bull_tp_mult': 1.4936205347059315, 'bull_tsl_mult': 0.44396887086428816, 'bull_time_stop': 113, 'bull_use_sma': False, 'bull_use_ema': True, 'bull_use_atr': True, 'bull_use_adx': True, 'bull_use_spike': False, 'bull_rsi_required': True, 'bear_strategy': 'breakout', 'bear_bb_std_mult': 2.112691513127687, 'bear_rsi_os': 33, 'bear_rsi_ob': 75, 'bear_adx_thresh': 31.471062980166888, 'bear_atr_min_pct': 0.02169340131548262, 'bear_atr_max_pct': 0.11419706212277961, 'bear_tp_mult': 2.811845667675734, 'bear_tsl_mult': 0.3086568233129212, 'bear_time_stop': 178, 'bear_use_sma': False, 'bear_use_ema': True, 'bear_use_atr': True, 'bear_use_adx': False, 'bear_use_spike': True, 'bear_rsi_required': False, 'sideways_strategy': 'breakout', 'sideways_bb_std_mult': 1.6335118828738153, 'sideways_rsi_os': 30, 'sideways_rsi_ob': 73, 'sideways_adx_thresh': 9.251041280657118, 'sideways_atr_min_pct': 0.02655306581371201, 'sideways_atr_max_pct': 0.05531996343046536, 'sideways_tp_mult': 1.5966364295626434, 'sideways_tsl_mult': 0.4481506624140392, 'sideways_time_stop': 13, 'sideways_use_sma': True, 'sideways_use_ema': False, 'sideways_use_atr': True, 'sideways_use_adx': True, 'sideways_use_spike': False, 'sideways_rsi_required': True}.
[I 2025-08-31 11:26:35,017] Trial 236 finished with values: [-0.047753224290481344, 0.0474379076558759] and parameters: {'p_sma': 28, 'p_std': 15, 'p_atr': 13, 'p_adx': 24, 'rsi_period': 50, 'ema1': 10, 'ema2': 38, 'slip_atr_k': 0.046834973393708346, 'slip_spread_k': 0.28299479042417763, 'spread_hl_frac': 0.0002217801020669148, 'bb_std_mult': 0.9879470860025623, 'rsi_os': 33, 'rsi_ob': 68, 'vol_spike': 0.13298041087564694, 'adx_thresh': 26.534138136465245, 'atr_min_pct': 0.005949732819362462, 'atr_max_pct': 0.028061484741750325, 'tp_mult': 2.3392071070108043, 'tsl_mult': 0.4418146607731962, 'strategy': 'breakout', 'time_stop': 300, 'use_sma': False, 'use_atr': True, 'use_adx': False, 'use_ema': False, 'use_spike': True, 'rsi_required': True, 'edge_k': 0.39446336627420037, 'edge_cap': 0.8468060853068247, 'bull_strategy': 'breakout', 'bull_bb_std_mult': 2.137346256617679, 'bull_rsi_os': 39, 'bull_rsi_ob': 65, 'bull_adx_thresh': 18.418772357400698, 'bull_atr_min_pct': 0.001512395367137936, 'bull_atr_max_pct': 0.13468316523573856, 'bull_tp_mult': 1.4993374330753615, 'bull_tsl_mult': 0.4260090247259369, 'bull_time_stop': 150, 'bull_use_sma': False, 'bull_use_ema': True, 'bull_use_atr': True, 'bull_use_adx': True, 'bull_use_spike': False, 'bull_rsi_required': True, 'bear_strategy': 'breakout', 'bear_bb_std_mult': 1.4164691976176922, 'bear_rsi_os': 34, 'bear_rsi_ob': 75, 'bear_adx_thresh': 31.74995062123205, 'bear_atr_min_pct': 0.013176687521646415, 'bear_atr_max_pct': 0.11310296915007861, 'bear_tp_mult': 2.9411464404899235, 'bear_tsl_mult': 0.0007624310496324171, 'bear_time_stop': 176, 'bear_use_sma': False, 'bear_use_ema': True, 'bear_use_atr': True, 'bear_use_adx': False, 'bear_use_spike': True, 'bear_rsi_required': False, 'sideways_strategy': 'breakout', 'sideways_bb_std_mult': 1.6662429637380982, 'sideways_rsi_os': 30, 'sideways_rsi_ob': 73, 'sideways_adx_thresh': 9.060090241443138, 'sideways_atr_min_pct': 0.0028000425384446755, 'sideways_atr_max_pct': 0.03952982687171172, 'sideways_tp_mult': 1.5905264510785435, 'sideways_tsl_mult': 0.4551879467662795, 'sideways_time_stop': 16, 'sideways_use_sma': True, 'sideways_use_ema': False, 'sideways_use_atr': True, 'sideways_use_adx': True, 'sideways_use_spike': False, 'sideways_rsi_required': False}.
[I 2025-08-31 11:27:06,202] Trial 238 finished with values: [-1000000000.0, 1000000000.0] and parameters: {'p_sma': 33, 'p_std': 6, 'p_atr': 15, 'p_adx': 23, 'rsi_period': 49, 'ema1': 12, 'ema2': 37, 'slip_atr_k': 0.07191214285986006, 'slip_spread_k': 0.029971108835037452, 'spread_hl_frac': 0.0023473451409726314, 'bb_std_mult': 1.1244752796746496, 'rsi_os': 35, 'rsi_ob': 75, 'vol_spike': 0.15855966035108304, 'adx_thresh': 26.632802229535248, 'atr_min_pct': 0.00525952077826298, 'atr_max_pct': 0.010458849782721116, 'tp_mult': 1.1023756094594226, 'tsl_mult': 0.4482687076899352, 'strategy': 'breakout', 'time_stop': 288, 'use_sma': False, 'use_atr': True, 'use_adx': True, 'use_ema': False, 'use_spike': True, 'rsi_required': True, 'edge_k': 0.35937143994077664, 'edge_cap': 0.7905516776068672, 'bull_strategy': 'breakout', 'bull_bb_std_mult': 2.2895795874026263, 'bull_rsi_os': 23, 'bull_rsi_ob': 63, 'bull_adx_thresh': 15.031653348431743, 'bull_atr_min_pct': 0.009301808569897877, 'bull_atr_max_pct': 0.13521029273842514, 'bull_tp_mult': 1.489842999550792, 'bull_tsl_mult': 0.44703208548123907, 'bull_time_stop': 152, 'bull_use_sma': True, 'bull_use_ema': True, 'bull_use_atr': True, 'bull_use_adx': True, 'bull_use_spike': False, 'bull_rsi_required': True, 'bear_strategy': 'breakout', 'bear_bb_std_mult': 2.542361613378883, 'bear_rsi_os': 31, 'bear_rsi_ob': 75, 'bear_adx_thresh': 31.34596662350986, 'bear_atr_min_pct': 0.01315668941118171, 'bear_atr_max_pct': 0.03911215280234975, 'bear_tp_mult': 2.30810503651809, 'bear_tsl_mult': 0.37270798639832836, 'bear_time_stop': 245, 'bear_use_sma': False, 'bear_use_ema': True, 'bear_use_atr': True, 'bear_use_adx': False, 'bear_use_spike': True, 'bear_rsi_required': False, 'sideways_strategy': 'breakout', 'sideways_bb_std_mult': 1.8385782082341766, 'sideways_rsi_os': 32, 'sideways_rsi_ob': 73, 'sideways_adx_thresh': 9.352323779785952, 'sideways_atr_min_pct': 0.029942924678948147, 'sideways_atr_max_pct': 0.03942344511821311, 'sideways_tp_mult': 1.1793236080996958, 'sideways_tsl_mult': 0.4878392393766959, 'sideways_time_stop': 14, 'sideways_use_sma': True, 'sideways_use_ema': False, 'sideways_use_atr': True, 'sideways_use_adx': True, 'sideways_use_spike': False, 'sideways_rsi_required': True}.
[I 2025-08-31 11:27:07,031] Trial 241 finished with values: [-1000000000.0, 1000000000.0] and parameters: {'p_sma': 34, 'p_std': 7, 'p_atr': 23, 'p_adx': 25, 'rsi_period': 49, 'ema1': 12, 'ema2': 30, 'slip_atr_k': 0.042271948891365, 'slip_spread_k': 0.21902788947338536, 'spread_hl_frac': 0.0024618259965796616, 'bb_std_mult': 0.6741733389509079, 'rsi_os': 31, 'rsi_ob': 75, 'vol_spike': 0.15728349617120135, 'adx_thresh': 22.039586809075956, 'atr_min_pct': 0.0051590448025246455, 'atr_max_pct': 0.02126049688680345, 'tp_mult': 1.122880481642696, 'tsl_mult': 0.2763027825093625, 'strategy': 'breakout', 'time_stop': 290, 'use_sma': True, 'use_atr': True, 'use_adx': True, 'use_ema': False, 'use_spike': True, 'rsi_required': True, 'edge_k': 1.8396917420081773, 'edge_cap': 0.7947864408650362, 'bull_strategy': 'breakout', 'bull_bb_std_mult': 2.2766979722926792, 'bull_rsi_os': 52, 'bull_rsi_ob': 63, 'bull_adx_thresh': 16.6358087260792, 'bull_atr_min_pct': 0.012886577115725899, 'bull_atr_max_pct': 0.1499575024493032, 'bull_tp_mult': 1.4906666051415913, 'bull_tsl_mult': 0.2501838502554982, 'bull_time_stop': 149, 'bull_use_sma': True, 'bull_use_ema': True, 'bull_use_atr': True, 'bull_use_adx': True, 'bull_use_spike': False, 'bull_rsi_required': True, 'bear_strategy': 'breakout', 'bear_bb_std_mult': 1.0612803304640772, 'bear_rsi_os': 31, 'bear_rsi_ob': 54, 'bear_adx_thresh': 31.569398057117503, 'bear_atr_min_pct': 0.024380305537345902, 'bear_atr_max_pct': 0.04030289147731964, 'bear_tp_mult': 2.872773276036513, 'bear_tsl_mult': 0.7812663845706866, 'bear_time_stop': 192, 'bear_use_sma': False, 'bear_use_ema': True, 'bear_use_atr': True, 'bear_use_adx': False, 'bear_use_spike': True, 'bear_rsi_required': False, 'sideways_strategy': 'breakout', 'sideways_bb_std_mult': 1.7297298238264585, 'sideways_rsi_os': 33, 'sideways_rsi_ob': 76, 'sideways_adx_thresh': 9.11565358778953, 'sideways_atr_min_pct': 0.013656074300823115, 'sideways_atr_max_pct': 0.04464925874342315, 'sideways_tp_mult': 1.168369929919504, 'sideways_tsl_mult': 0.29475645977286674, 'sideways_time_stop': 90, 'sideways_use_sma': True, 'sideways_use_ema': False, 'sideways_use_atr': True, 'sideways_use_adx': True, 'sideways_use_spike': False, 'sideways_rsi_required': True}.
[I 2025-08-31 11:27:07,052] Trial 240 finished with values: [-1000000000.0, 1000000000.0] and parameters: {'p_sma': 33, 'p_std': 9, 'p_atr': 18, 'p_adx': 25, 'rsi_period': 49, 'ema1': 12, 'ema2': 30, 'slip_atr_k': 0.04105471319546908, 'slip_spread_k': 0.22261696941580897, 'spread_hl_frac': 0.002375645803785492, 'bb_std_mult': 0.669930064096877, 'rsi_os': 31, 'rsi_ob': 70, 'vol_spike': 0.15474853279145123, 'adx_thresh': 28.39102762692695, 'atr_min_pct': 0.0053791307150815705, 'atr_max_pct': 0.02088935573813875, 'tp_mult': 1.104011712944305, 'tsl_mult': 0.2753421837456875, 'strategy': 'breakout', 'time_stop': 289, 'use_sma': True, 'use_atr': True, 'use_adx': True, 'use_ema': False, 'use_spike': True, 'rsi_required': True, 'edge_k': 0.3505863810066565, 'edge_cap': 0.8040768992581309, 'bull_strategy': 'breakout', 'bull_bb_std_mult': 2.274866288839466, 'bull_rsi_os': 49, 'bull_rsi_ob': 62, 'bull_adx_thresh': 17.570601741441696, 'bull_atr_min_pct': 0.0073903928361501075, 'bull_atr_max_pct': 0.14926474050215222, 'bull_tp_mult': 1.9874485230499357, 'bull_tsl_mult': 0.789002069561686, 'bull_time_stop': 289, 'bull_use_sma': True, 'bull_use_ema': True, 'bull_use_atr': True, 'bull_use_adx': True, 'bull_use_spike': False, 'bull_rsi_required': True, 'bear_strategy': 'breakout', 'bear_bb_std_mult': 1.0323946869879426, 'bear_rsi_os': 31, 'bear_rsi_ob': 54, 'bear_adx_thresh': 31.379119774083087, 'bear_atr_min_pct': 0.014835996384451398, 'bear_atr_max_pct': 0.11764247965804793, 'bear_tp_mult': 2.7795345222601164, 'bear_tsl_mult': 0.36468359486096363, 'bear_time_stop': 200, 'bear_use_sma': False, 'bear_use_ema': True, 'bear_use_atr': True, 'bear_use_adx': False, 'bear_use_spike': True, 'bear_rsi_required': False, 'sideways_strategy': 'breakout', 'sideways_bb_std_mult': 1.8359745602740565, 'sideways_rsi_os': 8, 'sideways_rsi_ob': 72, 'sideways_adx_thresh': 19.405953228279945, 'sideways_atr_min_pct': 0.008621683249083995, 'sideways_atr_max_pct': 0.05275598911850138, 'sideways_tp_mult': 1.163961994123115, 'sideways_tsl_mult': 0.3012197594098632, 'sideways_time_stop': 115, 'sideways_use_sma': True, 'sideways_use_ema': False, 'sideways_use_atr': True, 'sideways_use_adx': True, 'sideways_use_spike': False, 'sideways_rsi_required': True}.
[I 2025-08-31 11:27:07,135] Trial 239 finished with values: [-0.07032011385569892, 0.07015291863255711] and parameters: {'p_sma': 28, 'p_std': 6, 'p_atr': 15, 'p_adx': 23, 'rsi_period': 49, 'ema1': 12, 'ema2': 37, 'slip_atr_k': 0.04072202236110148, 'slip_spread_k': 0.22263734156432913, 'spread_hl_frac': 0.0022050911563261137, 'bb_std_mult': 0.6460025993391423, 'rsi_os': 35, 'rsi_ob': 70, 'vol_spike': 0.1565053546215939, 'adx_thresh': 21.604999825789196, 'atr_min_pct': 0.0059087206580023715, 'atr_max_pct': 0.026610405601416372, 'tp_mult': 2.340005580606464, 'tsl_mult': 0.41070988175907647, 'strategy': 'breakout', 'time_stop': 289, 'use_sma': False, 'use_atr': True, 'use_adx': True, 'use_ema': False, 'use_spike': True, 'rsi_required': True, 'edge_k': 0.42228646070221676, 'edge_cap': 0.7847491085487472, 'bull_strategy': 'breakout', 'bull_bb_std_mult': 2.119487467878096, 'bull_rsi_os': 50, 'bull_rsi_ob': 66, 'bull_adx_thresh': 17.868751255821056, 'bull_atr_min_pct': 0.0036727185901261226, 'bull_atr_max_pct': 0.1356950050152964, 'bull_tp_mult': 2.494856582849686, 'bull_tsl_mult': 0.2515855433684094, 'bull_time_stop': 292, 'bull_use_sma': True, 'bull_use_ema': True, 'bull_use_atr': True, 'bull_use_adx': True, 'bull_use_spike': False, 'bull_rsi_required': True, 'bear_strategy': 'breakout', 'bear_bb_std_mult': 2.5468526085744827, 'bear_rsi_os': 31, 'bear_rsi_ob': 75, 'bear_adx_thresh': 31.586901683596903, 'bear_atr_min_pct': 0.02474834213939056, 'bear_atr_max_pct': 0.11525547118219387, 'bear_tp_mult': 2.8755096323471707, 'bear_tsl_mult': 0.00036423281492220516, 'bear_time_stop': 201, 'bear_use_sma': False, 'bear_use_ema': True, 'bear_use_atr': True, 'bear_use_adx': False, 'bear_use_spike': True, 'bear_rsi_required': False, 'sideways_strategy': 'breakout', 'sideways_bb_std_mult': 1.845315359950338, 'sideways_rsi_os': 51, 'sideways_rsi_ob': 76, 'sideways_adx_thresh': 27.94252613876115, 'sideways_atr_min_pct': 0.0028130257752852655, 'sideways_atr_max_pct': 0.05485520586775709, 'sideways_tp_mult': 1.1622179787751312, 'sideways_tsl_mult': 0.2829512696399521, 'sideways_time_stop': 13, 'sideways_use_sma': True, 'sideways_use_ema': False, 'sideways_use_atr': True, 'sideways_use_adx': True, 'sideways_use_spike': False, 'sideways_rsi_required': True}.
[I 2025-08-31 11:27:38,268] Trial 245 finished with values: [-1000000000.0, 1000000000.0] and parameters: {'p_sma': 31, 'p_std': 12, 'p_atr': 10, 'p_adx': 26, 'rsi_period': 51, 'ema1': 11, 'ema2': 35, 'slip_atr_k': 0.14879879045692168, 'slip_spread_k': 0.17790043815058587, 'spread_hl_frac': 0.00023912997953967944, 'bb_std_mult': 0.8004115571580557, 'rsi_os': 33, 'rsi_ob': 67, 'vol_spike': 0.1494076832795624, 'adx_thresh': 22.889904368370328, 'atr_min_pct': 0.00449477570427837, 'atr_max_pct': 0.02572751296818087, 'tp_mult': 1.0730811316377231, 'tsl_mult': 0.25680064374408684, 'strategy': 'breakout', 'time_stop': 295, 'use_sma': False, 'use_atr': True, 'use_adx': True, 'use_ema': False, 'use_spike': True, 'rsi_required': True, 'edge_k': 0.3557726494410237, 'edge_cap': 0.8548131590428653, 'bull_strategy': 'mean_reversion', 'bull_bb_std_mult': 2.6026243401687057, 'bull_rsi_os': 30, 'bull_rsi_ob': 62, 'bull_adx_thresh': 12.748075439236873, 'bull_atr_min_pct': 0.012212887991346878, 'bull_atr_max_pct': 0.1414588812042183, 'bull_tp_mult': 2.3396473224976377, 'bull_tsl_mult': 0.7554381429808716, 'bull_time_stop': 145, 'bull_use_sma': True, 'bull_use_ema': True, 'bull_use_atr': True, 'bull_use_adx': True, 'bull_use_spike': False, 'bull_rsi_required': True, 'bear_strategy': 'mean_reversion', 'bear_bb_std_mult': 2.476549832673465, 'bear_rsi_os': 29, 'bear_rsi_ob': 83, 'bear_adx_thresh': 32.1682849176327, 'bear_atr_min_pct': 0.01936744675260527, 'bear_atr_max_pct': 0.12042878935798955, 'bear_tp_mult': 2.8407875336990656, 'bear_tsl_mult': 0.2129942321655281, 'bear_time_stop': 227, 'bear_use_sma': False, 'bear_use_ema': True, 'bear_use_atr': True, 'bear_use_adx': False, 'bear_use_spike': True, 'bear_rsi_required': False, 'sideways_strategy': 'breakout', 'sideways_bb_std_mult': 1.75563373382743, 'sideways_rsi_os': 6, 'sideways_rsi_ob': 72, 'sideways_adx_thresh': 17.40019312535461, 'sideways_atr_min_pct': 0.015350072350637052, 'sideways_atr_max_pct': 0.0482266162696278, 'sideways_tp_mult': 1.534479561620011, 'sideways_tsl_mult': 0.15582121164135065, 'sideways_time_stop': 292, 'sideways_use_sma': True, 'sideways_use_ema': False, 'sideways_use_atr': True, 'sideways_use_adx': True, 'sideways_use_spike': False, 'sideways_rsi_required': True}.
