[I 2025-08-31 11:22:46,747] Trial 207 finished with values: [-0.01515992718043746, 0.01628106511736904] and parameters: {'p_sma': 41, 'p_std': 15, 'p_atr': 22, 'p_adx': 19, 'rsi_period': 74, 'ema1': 14, 'ema2': 16, 'slip_atr_k': 0.19340361254238073, 'slip_spread_k': 0.7441033643834901, 'spread_hl_frac': 0.0454820091075814, 'bb_std_mult': 2.755952520544136, 'rsi_os': 14, 'rsi_ob': 82, 'vol_spike': 0.22995852966199526, 'adx_thresh': 30.910450028599897, 'atr_min_pct': 0.02516766806719581, 'atr_max_pct': 0.0809828888449777, 'tp_mult': 1.102525884835411, 'tsl_mult': 0.043295121079200485, 'strategy': 'breakout', 'time_stop': 244, 'use_sma': False, 'use_atr': True, 'use_adx': True, 'use_ema': False, 'use_spike': False, 'rsi_required': True, 'edge_k': 0.3478205248924882, 'edge_cap': 0.36319882147654464, 'bull_strategy': 'breakout', 'bull_bb_std_mult': 1.3080168010420694, 'bull_rsi_os': 40, 'bull_rsi_ob': 93, 'bull_adx_thresh': 9.91342221227366, 'bull_atr_min_pct': 0.01659855694032331, 'bull_atr_max_pct': 0.14133169053404063, 'bull_tp_mult': 1.5519691512149885, 'bull_tsl_mult': 0.32214045830551297, 'bull_time_stop': 142, 'bull_use_sma': True, 'bull_use_ema': False, 'bull_use_atr': True, 'bull_use_adx': True, 'bull_use_spike': False, 'bull_rsi_required': True, 'bear_strategy': 'breakout', 'bear_bb_std_mult': 0.8560876357534911, 'bear_rsi_os': 19, 'bear_rsi_ob': 95, 'bear_adx_thresh': 33.63877376212777, 'bear_atr_min_pct': 0.021029162568783538, 'bear_atr_max_pct': 0.12285473510575115, 'bear_tp_mult': 1.5420646324112843, 'bear_tsl_mult': 0.3348655944573177, 'bear_time_stop': 52, 'bear_use_sma': True, 'bear_use_ema': False, 'bear_use_atr': True, 'bear_use_adx': False, 'bear_use_spike': True, 'bear_rsi_required': False, 'sideways_strategy': 'breakout', 'sideways_bb_std_mult': 1.0406324093312729, 'sideways_rsi_os': 34, 'sideways_rsi_ob': 69, 'sideways_adx_thresh': 14.980460296881567, 'sideways_atr_min_pct': 0.000822632847634182, 'sideways_atr_max_pct': 0.017670619936580402, 'sideways_tp_mult': 1.966686072626293, 'sideways_tsl_mult': 0.6961561768339497, 'sideways_time_stop': 252, 'sideways_use_sma': False, 'sideways_use_ema': False, 'sideways_use_atr': False, 'sideways_use_adx': True, 'sideways_use_spike': False, 'sideways_rsi_required': True}.
[I 2025-08-31 11:23:18,868] Trial 208 finished with values: [-1000000000.0, 1000000000.0] and parameters: {'p_sma': 41, 'p_std': 10, 'p_atr': 9, 'p_adx': 15, 'rsi_period': 20, 'ema1': 14, 'ema2': 13, 'slip_atr_k': 0.23222460262082187, 'slip_spread_k': 0.5760902637587726, 'spread_hl_frac': 0.04553828321918487, 'bb_std_mult': 2.531716405384721, 'rsi_os': 40, 'rsi_ob': 84, 'vol_spike': 0.2462952815965877, 'adx_thresh': 24.288379534596167, 'atr_min_pct': 0.019692716143850278, 'atr_max_pct': 0.0815407459993264, 'tp_mult': 1.0506878624458336, 'tsl_mult': 0.39574636548237563, 'strategy': 'mean_reversion', 'time_stop': 245, 'use_sma': False, 'use_atr': True, 'use_adx': True, 'use_ema': False, 'use_spike': False, 'rsi_required': False, 'edge_k': 0.3199838325420805, 'edge_cap': 0.5493744357002093, 'bull_strategy': 'breakout', 'bull_bb_std_mult': 0.7424215612012195, 'bull_rsi_os': 24, 'bull_rsi_ob': 57, 'bull_adx_thresh': 23.049216232174807, 'bull_atr_min_pct': 0.025806369098347003, 'bull_atr_max_pct': 0.087378051651265, 'bull_tp_mult': 1.5538747264992774, 'bull_tsl_mult': 0.3456557906432267, 'bull_time_stop': 141, 'bull_use_sma': True, 'bull_use_ema': False, 'bull_use_atr': True, 'bull_use_adx': False, 'bull_use_spike': False, 'bull_rsi_required': False, 'bear_strategy': 'mean_reversion', 'bear_bb_std_mult': 1.2046836462698243, 'bear_rsi_os': 19, 'bear_rsi_ob': 56, 'bear_adx_thresh': 16.278971448075563, 'bear_atr_min_pct': 0.004869867810259004, 'bear_atr_max_pct': 0.12302324915986486, 'bear_tp_mult': 2.5249413293592453, 'bear_tsl_mult': 0.34191996498328003, 'bear_time_stop': 51, 'bear_use_sma': True, 'bear_use_ema': False, 'bear_use_atr': True, 'bear_use_adx': False, 'bear_use_spike': True, 'bear_rsi_required': False, 'sideways_strategy': 'breakout', 'sideways_bb_std_mult': 0.8733812629417531, 'sideways_rsi_os': 32, 'sideways_rsi_ob': 71, 'sideways_adx_thresh': 33.52125728077984, 'sideways_atr_min_pct': 0.018595430783246335, 'sideways_atr_max_pct': 0.02117178920041651, 'sideways_tp_mult': 2.145294165464312, 'sideways_tsl_mult': 0.8046019645826155, 'sideways_time_stop': 234, 'sideways_use_sma': False, 'sideways_use_ema': False, 'sideways_use_atr': False, 'sideways_use_adx': True, 'sideways_use_spike': True, 'sideways_rsi_required': True}.
[I 2025-08-31 11:23:19,052] Trial 209 finished with values: [-1000000000.0, 1000000000.0] and parameters: {'p_sma': 40, 'p_std': 10, 'p_atr': 9, 'p_adx': 13, 'rsi_period': 78, 'ema1': 14, 'ema2': 13, 'slip_atr_k': 0.22971177407900548, 'slip_spread_k': 0.49671863561208435, 'spread_hl_frac': 0.04509107255451987, 'bb_std_mult': 2.535071135097173, 'rsi_os': 40, 'rsi_ob': 84, 'vol_spike': 0.2466224530180759, 'adx_thresh': 24.847191729448078, 'atr_min_pct': 0.002167705661987449, 'atr_max_pct': 0.011054201154036145, 'tp_mult': 2.06938932031483, 'tsl_mult': 0.38222745260040075, 'strategy': 'mean_reversion', 'time_stop': 287, 'use_sma': False, 'use_atr': True, 'use_adx': True, 'use_ema': False, 'use_spike': False, 'rsi_required': False, 'edge_k': 0.3202671093777712, 'edge_cap': 0.8375858435640222, 'bull_strategy': 'breakout', 'bull_bb_std_mult': 1.4559552616776692, 'bull_rsi_os': 24, 'bull_rsi_ob': 59, 'bull_adx_thresh': 17.081219291897018, 'bull_atr_min_pct': 0.018938406219091725, 'bull_atr_max_pct': 0.09126977563676253, 'bull_tp_mult': 1.546056793238214, 'bull_tsl_mult': 0.3434589000498428, 'bull_time_stop': 141, 'bull_use_sma': True, 'bull_use_ema': False, 'bull_use_atr': True, 'bull_use_adx': False, 'bull_use_spike': False, 'bull_rsi_required': False, 'bear_strategy': 'mean_reversion', 'bear_bb_std_mult': 1.4380767124450795, 'bear_rsi_os': 19, 'bear_rsi_ob': 95, 'bear_adx_thresh': 16.110125443858706, 'bear_atr_min_pct': 0.019220951322332445, 'bear_atr_max_pct': 0.12158833516248314, 'bear_tp_mult': 2.4498689015889887, 'bear_tsl_mult': 0.33277173030256346, 'bear_time_stop': 51, 'bear_use_sma': True, 'bear_use_ema': False, 'bear_use_atr': True, 'bear_use_adx': False, 'bear_use_spike': True, 'bear_rsi_required': False, 'sideways_strategy': 'breakout', 'sideways_bb_std_mult': 3.505966329517035, 'sideways_rsi_os': 32, 'sideways_rsi_ob': 71, 'sideways_adx_thresh': 11.156708075014652, 'sideways_atr_min_pct': 0.003691037016677493, 'sideways_atr_max_pct': 0.021159798390386463, 'sideways_tp_mult': 1.438275039204767, 'sideways_tsl_mult': 0.6943515053715094, 'sideways_time_stop': 228, 'sideways_use_sma': False, 'sideways_use_ema': False, 'sideways_use_atr': False, 'sideways_use_adx': True, 'sideways_use_spike': True, 'sideways_rsi_required': True}.
[I 2025-08-31 11:23:19,162] Trial 210 finished with values: [-1000000000.0, 1000000000.0] and parameters: {'p_sma': 41, 'p_std': 10, 'p_atr': 12, 'p_adx': 15, 'rsi_period': 79, 'ema1': 14, 'ema2': 13, 'slip_atr_k': 0.037485279648268255, 'slip_spread_k': 0.4963511132610898, 'spread_hl_frac': 0.04273540017438775, 'bb_std_mult': 2.750004158975964, 'rsi_os': 40, 'rsi_ob': 75, 'vol_spike': 0.2447119053065478, 'adx_thresh': 24.73729362129717, 'atr_min_pct': 0.002093751141432052, 'atr_max_pct': 0.11248462510457166, 'tp_mult': 1.0427089523824324, 'tsl_mult': 0.06875088470966029, 'strategy': 'mean_reversion', 'time_stop': 287, 'use_sma': False, 'use_atr': True, 'use_adx': True, 'use_ema': False, 'use_spike': False, 'rsi_required': False, 'edge_k': 0.2585688858194357, 'edge_cap': 0.2746380944585436, 'bull_strategy': 'breakout', 'bull_bb_std_mult': 1.1737203548542747, 'bull_rsi_os': 24, 'bull_rsi_ob': 57, 'bull_adx_thresh': 17.156035713474058, 'bull_atr_min_pct': 0.025872512007192906, 'bull_atr_max_pct': 0.09157109893090255, 'bull_tp_mult': 1.5523962110913254, 'bull_tsl_mult': 0.3420891491567655, 'bull_time_stop': 139, 'bull_use_sma': True, 'bull_use_ema': False, 'bull_use_atr': False, 'bull_use_adx': False, 'bull_use_spike': False, 'bull_rsi_required': False, 'bear_strategy': 'mean_reversion', 'bear_bb_std_mult': 1.1935590815030448, 'bear_rsi_os': 19, 'bear_rsi_ob': 86, 'bear_adx_thresh': 16.54342825196479, 'bear_atr_min_pct': 0.004877835429723733, 'bear_atr_max_pct': 0.09723175327780097, 'bear_tp_mult': 2.5330362257294845, 'bear_tsl_mult': 0.3342934582701911, 'bear_time_stop': 70, 'bear_use_sma': True, 'bear_use_ema': False, 'bear_use_atr': True, 'bear_use_adx': False, 'bear_use_spike': True, 'bear_rsi_required': False, 'sideways_strategy': 'mean_reversion', 'sideways_bb_std_mult': 0.8742055693913122, 'sideways_rsi_os': 34, 'sideways_rsi_ob': 71, 'sideways_adx_thresh': 16.68012557323257, 'sideways_atr_min_pct': 0.003894908529819382, 'sideways_atr_max_pct': 0.0212990883807734, 'sideways_tp_mult': 1.4639000151641912, 'sideways_tsl_mult': 0.6542840122242507, 'sideways_time_stop': 18, 'sideways_use_sma': False, 'sideways_use_ema': False, 'sideways_use_atr': False, 'sideways_use_adx': True, 'sideways_use_spike': True, 'sideways_rsi_required': True}.
[I 2025-08-31 11:23:19,315] Trial 211 finished with values: [-1000000000.0, 1000000000.0] and parameters: {'p_sma': 41, 'p_std': 11, 'p_atr': 16, 'p_adx': 15, 'rsi_period': 79, 'ema1': 30, 'ema2': 13, 'slip_atr_k': 0.007477750201376081, 'slip_spread_k': 0.680828922831714, 'spread_hl_frac': 0.045731120434154025, 'bb_std_mult': 2.762064863779581, 'rsi_os': 40, 'rsi_ob': 84, 'vol_spike': 0.12603196422185073, 'adx_thresh': 31.007590462550688, 'atr_min_pct': 0.0018879513336370628, 'atr_max_pct': 0.06345006698974195, 'tp_mult': 1.0442161112486006, 'tsl_mult': 0.10800025017637993, 'strategy': 'mean_reversion', 'time_stop': 77, 'use_sma': False, 'use_atr': True, 'use_adx': True, 'use_ema': False, 'use_spike': False, 'rsi_required': False, 'edge_k': 0.32162503251488855, 'edge_cap': 0.26103282839445074, 'bull_strategy': 'breakout', 'bull_bb_std_mult': 0.7227457539298241, 'bull_rsi_os': 24, 'bull_rsi_ob': 52, 'bull_adx_thresh': 9.133115384286741, 'bull_atr_min_pct': 0.020892846175098196, 'bull_atr_max_pct': 0.14154501373051886, 'bull_tp_mult': 1.5609805926080615, 'bull_tsl_mult': 0.34348823215249713, 'bull_time_stop': 267, 'bull_use_sma': True, 'bull_use_ema': False, 'bull_use_atr': False, 'bull_use_adx': False, 'bull_use_spike': False, 'bull_rsi_required': False, 'bear_strategy': 'mean_reversion', 'bear_bb_std_mult': 2.925523146109486, 'bear_rsi_os': 25, 'bear_rsi_ob': 63, 'bear_adx_thresh': 16.384638407992274, 'bear_atr_min_pct': 0.008302773031457121, 'bear_atr_max_pct': 0.11303533049708202, 'bear_tp_mult': 1.5444472299977334, 'bear_tsl_mult': 0.3310132187066015, 'bear_time_stop': 83, 'bear_use_sma': True, 'bear_use_ema': False, 'bear_use_atr': True, 'bear_use_adx': False, 'bear_use_spike': True, 'bear_rsi_required': False, 'sideways_strategy': 'mean_reversion', 'sideways_bb_std_mult': 2.5312812976381363, 'sideways_rsi_os': 34, 'sideways_rsi_ob': 71, 'sideways_adx_thresh': 6.261220061699406, 'sideways_atr_min_pct': 0.01921949750065597, 'sideways_atr_max_pct': 0.02187824615206156, 'sideways_tp_mult': 1.4586273662022857, 'sideways_tsl_mult': 0.21213353755899605, 'sideways_time_stop': 17, 'sideways_use_sma': False, 'sideways_use_ema': False, 'sideways_use_atr': False, 'sideways_use_adx': True, 'sideways_use_spike': True, 'sideways_rsi_required': True}.
[I 2025-08-31 11:23:19,846] Trial 212 finished with values: [-1000000000.0, 1000000000.0] and parameters: {'p_sma': 47, 'p_std': 11, 'p_atr': 16, 'p_adx': 13, 'rsi_period': 75, 'ema1': 13, 'ema2': 18, 'slip_atr_k': 0.03752197192022047, 'slip_spread_k': 0.8333023222541596, 'spread_hl_frac': 0.04700337110773285, 'bb_std_mult': 2.7658232024862457, 'rsi_os': 39, 'rsi_ob': 45, 'vol_spike': 0.17892454895409907, 'adx_thresh': 30.204485966009592, 'atr_min_pct': 0.0023698989666875742, 'atr_max_pct': 0.11291777311073739, 'tp_mult': 2.058454126760683, 'tsl_mult': 0.07758698639011892, 'strategy': 'mean_reversion', 'time_stop': 100, 'use_sma': True, 'use_atr': True, 'use_adx': True, 'use_ema': False, 'use_spike': False, 'rsi_required': False, 'edge_k': 0.6291599298235507, 'edge_cap': 0.1516782720704839, 'bull_strategy': 'breakout', 'bull_bb_std_mult': 1.4432868076201044, 'bull_rsi_os': 24, 'bull_rsi_ob': 59, 'bull_adx_thresh': 29.867148744210454, 'bull_atr_min_pct': 0.02080468915160635, 'bull_atr_max_pct': 0.1368937751897218, 'bull_tp_mult': 1.5477267648025619, 'bull_tsl_mult': 0.3252426054942973, 'bull_time_stop': 262, 'bull_use_sma': True, 'bull_use_ema': False, 'bull_use_atr': False, 'bull_use_adx': False, 'bull_use_spike': False, 'bull_rsi_required': False, 'bear_strategy': 'breakout', 'bear_bb_std_mult': 1.5791831592835741, 'bear_rsi_os': 25, 'bear_rsi_ob': 64, 'bear_adx_thresh': 31.773682141284763, 'bear_atr_min_pct': 0.023490485085293455, 'bear_atr_max_pct': 0.11009812469616397, 'bear_tp_mult': 1.1457509368121632, 'bear_tsl_mult': 0.3308212303180702, 'bear_time_stop': 73, 'bear_use_sma': True, 'bear_use_ema': False, 'bear_use_atr': True, 'bear_use_adx': False, 'bear_use_spike': True, 'bear_rsi_required': False, 'sideways_strategy': 'mean_reversion', 'sideways_bb_std_mult': 0.9882877153742375, 'sideways_rsi_os': 36, 'sideways_rsi_ob': 69, 'sideways_adx_thresh': 23.265984566732246, 'sideways_atr_min_pct': 0.0035999069839821223, 'sideways_atr_max_pct': 0.015029974637439384, 'sideways_tp_mult': 2.2204842507258027, 'sideways_tsl_mult': 0.6938235617710291, 'sideways_time_stop': 269, 'sideways_use_sma': False, 'sideways_use_ema': False, 'sideways_use_atr': False, 'sideways_use_adx': True, 'sideways_use_spike': False, 'sideways_rsi_required': True}.
[I 2025-08-31 11:23:50,317] Trial 215 finished with values: [-1000000000.0, 1000000000.0] and parameters: {'p_sma': 44, 'p_std': 20, 'p_atr': 11, 'p_adx': 20, 'rsi_period': 53, 'ema1': 13, 'ema2': 18, 'slip_atr_k': 0.05497480397072865, 'slip_spread_k': 0.8349663419380888, 'spread_hl_frac': 0.04667892863350593, 'bb_std_mult': 2.682505965306416, 'rsi_os': 38, 'rsi_ob': 81, 'vol_spike': 0.19557002025922954, 'adx_thresh': 32.79011959296655, 'atr_min_pct': 0.0028170610578853953, 'atr_max_pct': 0.07258640405912335, 'tp_mult': 1.010614592261138, 'tsl_mult': 0.07875325186040107, 'strategy': 'breakout', 'time_stop': 104, 'use_sma': True, 'use_atr': True, 'use_adx': True, 'use_ema': False, 'use_spike': False, 'rsi_required': True, 'edge_k': 0.3702513024851512, 'edge_cap': 0.3393383466799538, 'bull_strategy': 'breakout', 'bull_bb_std_mult': 1.6461963168390694, 'bull_rsi_os': 26, 'bull_rsi_ob': 60, 'bull_adx_thresh': 11.060386941325046, 'bull_atr_min_pct': 0.019369464731144943, 'bull_atr_max_pct': 0.13634429738469644, 'bull_tp_mult': 2.2925237301164985, 'bull_tsl_mult': 0.3195384561273264, 'bull_time_stop': 150, 'bull_use_sma': True, 'bull_use_ema': False, 'bull_use_atr': True, 'bull_use_adx': True, 'bull_use_spike': True, 'bull_rsi_required': True, 'bear_strategy': 'breakout', 'bear_bb_std_mult': 2.632020962107032, 'bear_rsi_os': 23, 'bear_rsi_ob': 55, 'bear_adx_thresh': 33.36552320757745, 'bear_atr_min_pct': 0.005945086993087811, 'bear_atr_max_pct': 0.10924367688885486, 'bear_tp_mult': 1.1694961343607972, 'bear_tsl_mult': 0.15259498551490425, 'bear_time_stop': 73, 'bear_use_sma': True, 'bear_use_ema': False, 'bear_use_atr': False, 'bear_use_adx': False, 'bear_use_spike': True, 'bear_rsi_required': False, 'sideways_strategy': 'breakout', 'sideways_bb_std_mult': 1.1321640688882704, 'sideways_rsi_os': 30, 'sideways_rsi_ob': 70, 'sideways_adx_thresh': 12.95035284447004, 'sideways_atr_min_pct': 0.00962586168800982, 'sideways_atr_max_pct': 0.13390779339278075, 'sideways_tp_mult': 2.2162367115367214, 'sideways_tsl_mult': 0.6944342514638278, 'sideways_time_stop': 9, 'sideways_use_sma': False, 'sideways_use_ema': False, 'sideways_use_atr': False, 'sideways_use_adx': True, 'sideways_use_spike': False, 'sideways_rsi_required': True}.
[I 2025-08-31 11:23:50,344] Trial 214 finished with values: [-0.08191470320178817, 0.08158641450834413] and parameters: {'p_sma': 44, 'p_std': 15, 'p_atr': 16, 'p_adx': 20, 'rsi_period': 42, 'ema1': 13, 'ema2': 17, 'slip_atr_k': 0.24745932081961336, 'slip_spread_k': 0.6788144706131611, 'spread_hl_frac': 0.04668484629977001, 'bb_std_mult': 2.659357213931958, 'rsi_os': 38, 'rsi_ob': 61, 'vol_spike': 0.12555283510199663, 'adx_thresh': 26.447122163172658, 'atr_min_pct': 0.0033906430422297584, 'atr_max_pct': 0.09083425921829563, 'tp_mult': 2.596690012010032, 'tsl_mult': 0.6931293237712748, 'strategy': 'breakout', 'time_stop': 99, 'use_sma': True, 'use_atr': True, 'use_adx': True, 'use_ema': False, 'use_spike': False, 'rsi_required': True, 'edge_k': 0.3970304448938086, 'edge_cap': 0.46406299934107453, 'bull_strategy': 'breakout', 'bull_bb_std_mult': 1.2980635454084504, 'bull_rsi_os': 26, 'bull_rsi_ob': 61, 'bull_adx_thresh': 9.125247450321448, 'bull_atr_min_pct': 0.02096290814995859, 'bull_atr_max_pct': 0.14148998179446043, 'bull_tp_mult': 1.4670793383754182, 'bull_tsl_mult': 0.2811114203083423, 'bull_time_stop': 266, 'bull_use_sma': True, 'bull_use_ema': False, 'bull_use_atr': False, 'bull_use_adx': True, 'bull_use_spike': True, 'bull_rsi_required': True, 'bear_strategy': 'breakout', 'bear_bb_std_mult': 1.305047619945017, 'bear_rsi_os': 14, 'bear_rsi_ob': 64, 'bear_adx_thresh': 22.08919564651319, 'bear_atr_min_pct': 0.008073561885904782, 'bear_atr_max_pct': 0.1151070715279187, 'bear_tp_mult': 2.191952510458491, 'bear_tsl_mult': 0.725886864992721, 'bear_time_stop': 82, 'bear_use_sma': True, 'bear_use_ema': False, 'bear_use_atr': False, 'bear_use_adx': False, 'bear_use_spike': True, 'bear_rsi_required': False, 'sideways_strategy': 'breakout', 'sideways_bb_std_mult': 2.5156535306773105, 'sideways_rsi_os': 34, 'sideways_rsi_ob': 70, 'sideways_adx_thresh': 13.078820681248466, 'sideways_atr_min_pct': 0.001241306519825914, 'sideways_atr_max_pct': 0.12995347568917032, 'sideways_tp_mult': 2.2181906292833053, 'sideways_tsl_mult': 0.20928486550601688, 'sideways_time_stop': 17, 'sideways_use_sma': False, 'sideways_use_ema': False, 'sideways_use_atr': False, 'sideways_use_adx': True, 'sideways_use_spike': False, 'sideways_rsi_required': True}.
[I 2025-08-31 11:23:50,648] Trial 213 finished with values: [-1000000000.0, 1000000000.0] and parameters: {'p_sma': 47, 'p_std': 21, 'p_atr': 12, 'p_adx': 20, 'rsi_period': 41, 'ema1': 13, 'ema2': 18, 'slip_atr_k': 0.24990329378442688, 'slip_spread_k': 0.8333797296304136, 'spread_hl_frac': 0.04648000617911876, 'bb_std_mult': 2.7556172346790744, 'rsi_os': 38, 'rsi_ob': 82, 'vol_spike': 0.20187407197195212, 'adx_thresh': 32.92902702089215, 'atr_min_pct': 0.0037201062132310547, 'atr_max_pct': 0.11681021406640066, 'tp_mult': 1.119254166741146, 'tsl_mult': 0.11413468127594775, 'strategy': 'breakout', 'time_stop': 274, 'use_sma': True, 'use_atr': True, 'use_adx': True, 'use_ema': False, 'use_spike': False, 'rsi_required': True, 'edge_k': 0.2607655176408813, 'edge_cap': 0.5796958157614279, 'bull_strategy': 'breakout', 'bull_bb_std_mult': 0.9527934820196511, 'bull_rsi_os': 42, 'bull_rsi_ob': 61, 'bull_adx_thresh': 23.92660347147068, 'bull_atr_min_pct': 0.020568829833224368, 'bull_atr_max_pct': 0.13710497956604856, 'bull_tp_mult': 1.4582833954371033, 'bull_tsl_mult': 0.3282463016782846, 'bull_time_stop': 265, 'bull_use_sma': True, 'bull_use_ema': False, 'bull_use_atr': False, 'bull_use_adx': True, 'bull_use_spike': True, 'bull_rsi_required': True, 'bear_strategy': 'breakout', 'bear_bb_std_mult': 1.566928987068394, 'bear_rsi_os': 14, 'bear_rsi_ob': 63, 'bear_adx_thresh': 34.87689653300299, 'bear_atr_min_pct': 0.008206518819179711, 'bear_atr_max_pct': 0.11051720440044611, 'bear_tp_mult': 2.1923926685449224, 'bear_tsl_mult': 0.3155216597258916, 'bear_time_stop': 5, 'bear_use_sma': True, 'bear_use_ema': False, 'bear_use_atr': False, 'bear_use_adx': False, 'bear_use_spike': True, 'bear_rsi_required': False, 'sideways_strategy': 'mean_reversion', 'sideways_bb_std_mult': 0.9855899920494026, 'sideways_rsi_os': 34, 'sideways_rsi_ob': 69, 'sideways_adx_thresh': 7.295481285150542, 'sideways_atr_min_pct': 0.007394018718829835, 'sideways_atr_max_pct': 0.13000165895557705, 'sideways_tp_mult': 1.1158154413839703, 'sideways_tsl_mult': 0.6994235534731446, 'sideways_time_stop': 263, 'sideways_use_sma': False, 'sideways_use_ema': False, 'sideways_use_atr': False, 'sideways_use_adx': True, 'sideways_use_spike': False, 'sideways_rsi_required': True}.
