[I 2025-08-31 11:47:31,868] Trial 405 finished with values: [-1000000000.0, 1000000000.0] and parameters: {'p_sma': 7, 'p_std': 36, 'p_atr': 13, 'p_adx': 13, 'rsi_period': 81, 'ema1': 20, 'ema2': 53, 'slip_atr_k': 0.1934860724290122, 'slip_spread_k': 0.744610350330916, 'spread_hl_frac': 0.0023250549611172596, 'bb_std_mult': 0.7322888113427689, 'rsi_os': 31, 'rsi_ob': 72, 'vol_spike': 0.16142635430138946, 'adx_thresh': 26.710992957694554, 'atr_min_pct': 0.004480874086816394, 'atr_max_pct': 0.06230610584683895, 'tp_mult': 2.8947000292541176, 'tsl_mult': 0.3001861064466752, 'strategy': 'mean_reversion', 'time_stop': 281, 'use_sma': True, 'use_atr': False, 'use_adx': True, 'use_ema': True, 'use_spike': True, 'rsi_required': True, 'edge_k': 0.3153430786669448, 'edge_cap': 0.859375196961933, 'bull_strategy': 'mean_reversion', 'bull_bb_std_mult': 2.3946933432223414, 'bull_rsi_os': 47, 'bull_rsi_ob': 67, 'bull_adx_thresh': 14.546780939692926, 'bull_atr_min_pct': 0.0036601638405650717, 'bull_atr_max_pct': 0.1391600247017185, 'bull_tp_mult': 1.5162999504523178, 'bull_tsl_mult': 0.9987092812643896, 'bull_time_stop': 152, 'bull_use_sma': True, 'bull_use_ema': False, 'bull_use_atr': False, 'bull_use_adx': True, 'bull_use_spike': True, 'bull_rsi_required': True, 'bear_strategy': 'mean_reversion', 'bear_bb_std_mult': 0.9567234848772863, 'bear_rsi_os': 31, 'bear_rsi_ob': 57, 'bear_adx_thresh': 31.486582292958815, 'bear_atr_min_pct': 0.014585954500401002, 'bear_atr_max_pct': 0.11532609149885001, 'bear_tp_mult': 1.6394569400096994, 'bear_tsl_mult': 0.3218363799219995, 'bear_time_stop': 203, 'bear_use_sma': False, 'bear_use_ema': True, 'bear_use_atr': False, 'bear_use_adx': False, 'bear_use_spike': False, 'bear_rsi_required': True, 'sideways_strategy': 'breakout', 'sideways_bb_std_mult': 1.7788956017216475, 'sideways_rsi_os': 29, 'sideways_rsi_ob': 92, 'sideways_adx_thresh': 6.11022419117325, 'sideways_atr_min_pct': 0.0043825265950695755, 'sideways_atr_max_pct': 0.08633585103673475, 'sideways_tp_mult': 1.348279177714233, 'sideways_tsl_mult': 0.2990872473907043, 'sideways_time_stop': 25, 'sideways_use_sma': True, 'sideways_use_ema': True, 'sideways_use_atr': True, 'sideways_use_adx': True, 'sideways_use_spike': False, 'sideways_rsi_required': False}.
[I 2025-08-31 11:47:32,149] Trial 406 finished with values: [-0.0536203686516199, 0.05356628786242625] and parameters: {'p_sma': 29, 'p_std': 36, 'p_atr': 13, 'p_adx': 13, 'rsi_period': 49, 'ema1': 12, 'ema2': 53, 'slip_atr_k': 0.049313291784616735, 'slip_spread_k': 0.052574078022386776, 'spread_hl_frac': 0.0318434146181368, 'bb_std_mult': 0.7082236482564408, 'rsi_os': 37, 'rsi_ob': 68, 'vol_spike': 0.16299892920594217, 'adx_thresh': 19.516698644032466, 'atr_min_pct': 0.004339830991916059, 'atr_max_pct': 0.06279716677192582, 'tp_mult': 2.668461938893349, 'tsl_mult': 0.2949782161404143, 'strategy': 'mean_reversion', 'time_stop': 279, 'use_sma': True, 'use_atr': False, 'use_adx': False, 'use_ema': True, 'use_spike': True, 'rsi_required': True, 'edge_k': 0.3158156694228109, 'edge_cap': 0.8605279551330444, 'bull_strategy': 'mean_reversion', 'bull_bb_std_mult': 2.4318160016026824, 'bull_rsi_os': 24, 'bull_rsi_ob': 61, 'bull_adx_thresh': 8.138316568618729, 'bull_atr_min_pct': 0.0011791906329200724, 'bull_atr_max_pct': 0.13867826740012826, 'bull_tp_mult': 1.5656279834570792, 'bull_tsl_mult': 0.31066626858978735, 'bull_time_stop': 249, 'bull_use_sma': True, 'bull_use_ema': False, 'bull_use_atr': False, 'bull_use_adx': True, 'bull_use_spike': True, 'bull_rsi_required': False, 'bear_strategy': 'mean_reversion', 'bear_bb_std_mult': 3.463596515469929, 'bear_rsi_os': 23, 'bear_rsi_ob': 51, 'bear_adx_thresh': 32.636249582972006, 'bear_atr_min_pct': 0.016021581337531118, 'bear_atr_max_pct': 0.05197727348257056, 'bear_tp_mult': 2.0118019640065428, 'bear_tsl_mult': 0.31567348067986695, 'bear_time_stop': 193, 'bear_use_sma': False, 'bear_use_ema': True, 'bear_use_atr': False, 'bear_use_adx': False, 'bear_use_spike': False, 'bear_rsi_required': True, 'sideways_strategy': 'breakout', 'sideways_bb_std_mult': 1.794922461045054, 'sideways_rsi_os': 45, 'sideways_rsi_ob': 74, 'sideways_adx_thresh': 21.089230822638047, 'sideways_atr_min_pct': 0.018195140663158384, 'sideways_atr_max_pct': 0.05078660569340664, 'sideways_tp_mult': 1.3453549484645078, 'sideways_tsl_mult': 0.30105624278488796, 'sideways_time_stop': 24, 'sideways_use_sma': True, 'sideways_use_ema': True, 'sideways_use_atr': False, 'sideways_use_adx': True, 'sideways_use_spike': False, 'sideways_rsi_required': False}.
[I 2025-08-31 11:47:33,110] Trial 407 finished with values: [-0.021795233198244612, 0.021470187552936514] and parameters: {'p_sma': 7, 'p_std': 34, 'p_atr': 13, 'p_adx': 29, 'rsi_period': 67, 'ema1': 12, 'ema2': 50, 'slip_atr_k': 0.1943217868090102, 'slip_spread_k': 0.04512378276073656, 'spread_hl_frac': 0.01853532428521724, 'bb_std_mult': 0.8339332271271517, 'rsi_os': 31, 'rsi_ob': 57, 'vol_spike': 0.16143163172169683, 'adx_thresh': 25.52804832277199, 'atr_min_pct': 0.004299727220924211, 'atr_max_pct': 0.01742831963322888, 'tp_mult': 1.0115463531149318, 'tsl_mult': 0.2252449763861708, 'strategy': 'mean_reversion', 'time_stop': 278, 'use_sma': True, 'use_atr': False, 'use_adx': False, 'use_ema': True, 'use_spike': True, 'rsi_required': True, 'edge_k': 0.12835746681050253, 'edge_cap': 0.7998598519095306, 'bull_strategy': 'mean_reversion', 'bull_bb_std_mult': 2.3841588869416084, 'bull_rsi_os': 24, 'bull_rsi_ob': 62, 'bull_adx_thresh': 8.30918900307354, 'bull_atr_min_pct': 0.0013531435968695397, 'bull_atr_max_pct': 0.05340866571114808, 'bull_tp_mult': 1.5910777367798925, 'bull_tsl_mult': 0.3136734944869193, 'bull_time_stop': 50, 'bull_use_sma': True, 'bull_use_ema': False, 'bull_use_atr': False, 'bull_use_adx': True, 'bull_use_spike': True, 'bull_rsi_required': False, 'bear_strategy': 'mean_reversion', 'bear_bb_std_mult': 3.4728322737168176, 'bear_rsi_os': 35, 'bear_rsi_ob': 74, 'bear_adx_thresh': 32.239109149940695, 'bear_atr_min_pct': 0.01601621900207654, 'bear_atr_max_pct': 0.04840595296306883, 'bear_tp_mult': 2.6448434586578244, 'bear_tsl_mult': 0.10699713621861323, 'bear_time_stop': 196, 'bear_use_sma': False, 'bear_use_ema': False, 'bear_use_atr': False, 'bear_use_adx': False, 'bear_use_spike': False, 'bear_rsi_required': False, 'sideways_strategy': 'breakout', 'sideways_bb_std_mult': 1.7823466663629781, 'sideways_rsi_os': 45, 'sideways_rsi_ob': 55, 'sideways_adx_thresh': 7.7379490379700195, 'sideways_atr_min_pct': 0.004315521389551263, 'sideways_atr_max_pct': 0.052365281922522836, 'sideways_tp_mult': 1.346439900581019, 'sideways_tsl_mult': 0.3086306129194889, 'sideways_time_stop': 12, 'sideways_use_sma': True, 'sideways_use_ema': True, 'sideways_use_atr': False, 'sideways_use_adx': True, 'sideways_use_spike': False, 'sideways_rsi_required': True}.
[I 2025-08-31 11:47:33,637] Trial 410 finished with values: [-1000000000.0, 1000000000.0] and parameters: {'p_sma': 53, 'p_std': 14, 'p_atr': 26, 'p_adx': 23, 'rsi_period': 56, 'ema1': 26, 'ema2': 47, 'slip_atr_k': 0.18578977584687745, 'slip_spread_k': 0.07785695209458922, 'spread_hl_frac': 0.018493151377849373, 'bb_std_mult': 0.9124503528774437, 'rsi_os': 35, 'rsi_ob': 71, 'vol_spike': 0.08405201008256499, 'adx_thresh': 25.35720215829039, 'atr_min_pct': 0.0219014753537346, 'atr_max_pct': 0.016962163648237577, 'tp_mult': 1.318288189084687, 'tsl_mult': 0.25326441375867, 'strategy': 'breakout', 'time_stop': 289, 'use_sma': False, 'use_atr': True, 'use_adx': False, 'use_ema': False, 'use_spike': True, 'rsi_required': True, 'edge_k': 0.45989876137033037, 'edge_cap': 0.789970681590442, 'bull_strategy': 'breakout', 'bull_bb_std_mult': 0.613193513915705, 'bull_rsi_os': 25, 'bull_rsi_ob': 62, 'bull_adx_thresh': 13.16000285987596, 'bull_atr_min_pct': 0.011975713902111659, 'bull_atr_max_pct': 0.13497975307627677, 'bull_tp_mult': 2.647630495838166, 'bull_tsl_mult': 0.9261132815734281, 'bull_time_stop': 142, 'bull_use_sma': False, 'bull_use_ema': True, 'bull_use_atr': True, 'bull_use_adx': True, 'bull_use_spike': False, 'bull_rsi_required': False, 'bear_strategy': 'breakout', 'bear_bb_std_mult': 1.2194622638542856, 'bear_rsi_os': 28, 'bear_rsi_ob': 82, 'bear_adx_thresh': 32.15933483881989, 'bear_atr_min_pct': 0.007666148445618429, 'bear_atr_max_pct': 0.11020869575261519, 'bear_tp_mult': 1.9025807913421187, 'bear_tsl_mult': 0.6918643967768705, 'bear_time_stop': 197, 'bear_use_sma': False, 'bear_use_ema': False, 'bear_use_atr': True, 'bear_use_adx': False, 'bear_use_spike': True, 'bear_rsi_required': False, 'sideways_strategy': 'breakout', 'sideways_bb_std_mult': 1.8933078307556297, 'sideways_rsi_os': 19, 'sideways_rsi_ob': 57, 'sideways_adx_thresh': 11.28454271472496, 'sideways_atr_min_pct': 2.2174641352158686e-05, 'sideways_atr_max_pct': 0.04720607579263338, 'sideways_tp_mult': 1.3917648365537416, 'sideways_tsl_mult': 0.8480434383201068, 'sideways_time_stop': 12, 'sideways_use_sma': False, 'sideways_use_ema': False, 'sideways_use_atr': False, 'sideways_use_adx': True, 'sideways_use_spike': False, 'sideways_rsi_required': True}.
[I 2025-08-31 11:47:33,658] Trial 408 finished with values: [-1000000000.0, 1000000000.0] and parameters: {'p_sma': 55, 'p_std': 14, 'p_atr': 13, 'p_adx': 29, 'rsi_period': 54, 'ema1': 20, 'ema2': 49, 'slip_atr_k': 0.0479053359096526, 'slip_spread_k': 0.04925153708885476, 'spread_hl_frac': 0.016140663714573254, 'bb_std_mult': 0.8678233390062502, 'rsi_os': 35, 'rsi_ob': 68, 'vol_spike': 0.1353823951946297, 'adx_thresh': 25.666425023402414, 'atr_min_pct': 0.025927953279478097, 'atr_max_pct': 0.016583822398006657, 'tp_mult': 1.891053161751354, 'tsl_mult': 0.24749307885099292, 'strategy': 'mean_reversion', 'time_stop': 282, 'use_sma': True, 'use_atr': False, 'use_adx': False, 'use_ema': True, 'use_spike': True, 'rsi_required': True, 'edge_k': 1.924955174662066, 'edge_cap': 0.7986848358178255, 'bull_strategy': 'breakout', 'bull_bb_std_mult': 2.3689764149860517, 'bull_rsi_os': 25, 'bull_rsi_ob': 67, 'bull_adx_thresh': 34.96656152682553, 'bull_atr_min_pct': 0.015119939643889647, 'bull_atr_max_pct': 0.13516186395164884, 'bull_tp_mult': 2.635878009125984, 'bull_tsl_mult': 0.8203456487665965, 'bull_time_stop': 234, 'bull_use_sma': False, 'bull_use_ema': False, 'bull_use_atr': False, 'bull_use_adx': True, 'bull_use_spike': True, 'bull_rsi_required': False, 'bear_strategy': 'mean_reversion', 'bear_bb_std_mult': 2.3638488021327615, 'bear_rsi_os': 39, 'bear_rsi_ob': 90, 'bear_adx_thresh': 32.44834356325642, 'bear_atr_min_pct': 0.01535874673112557, 'bear_atr_max_pct': 0.04201395228328317, 'bear_tp_mult': 2.777268923977924, 'bear_tsl_mult': 0.3452319032243225, 'bear_time_stop': 193, 'bear_use_sma': False, 'bear_use_ema': False, 'bear_use_atr': False, 'bear_use_adx': False, 'bear_use_spike': False, 'bear_rsi_required': True, 'sideways_strategy': 'breakout', 'sideways_bb_std_mult': 1.6558373665672335, 'sideways_rsi_os': 29, 'sideways_rsi_ob': 55, 'sideways_adx_thresh': 10.704589957503511, 'sideways_atr_min_pct': 0.004416394830925168, 'sideways_atr_max_pct': 0.04978222132101904, 'sideways_tp_mult': 1.3466066878714131, 'sideways_tsl_mult': 0.32831075645753266, 'sideways_time_stop': 11, 'sideways_use_sma': True, 'sideways_use_ema': True, 'sideways_use_atr': False, 'sideways_use_adx': True, 'sideways_use_spike': False, 'sideways_rsi_required': False}.
[I 2025-08-31 11:47:33,669] Trial 409 finished with values: [-1000000000.0, 1000000000.0] and parameters: {'p_sma': 53, 'p_std': 16, 'p_atr': 21, 'p_adx': 28, 'rsi_period': 54, 'ema1': 13, 'ema2': 33, 'slip_atr_k': 0.18529091715125703, 'slip_spread_k': 0.07694038998407186, 'spread_hl_frac': 0.016013925139690105, 'bb_std_mult': 0.8571068923137888, 'rsi_os': 35, 'rsi_ob': 68, 'vol_spike': 0.26509459176786937, 'adx_thresh': 25.40228297668421, 'atr_min_pct': 0.02938753276773471, 'atr_max_pct': 0.017685684102576663, 'tp_mult': 1.890850023457852, 'tsl_mult': 0.22735992371315045, 'strategy': 'mean_reversion', 'time_stop': 290, 'use_sma': False, 'use_atr': True, 'use_adx': False, 'use_ema': True, 'use_spike': True, 'rsi_required': True, 'edge_k': 1.914723281171102, 'edge_cap': 0.5466073010719935, 'bull_strategy': 'breakout', 'bull_bb_std_mult': 2.939016369610482, 'bull_rsi_os': 25, 'bull_rsi_ob': 74, 'bull_adx_thresh': 13.260117508088806, 'bull_atr_min_pct': 0.008686327245760631, 'bull_atr_max_pct': 0.1357258096818984, 'bull_tp_mult': 1.5691749642663628, 'bull_tsl_mult': 0.31788724293230786, 'bull_time_stop': 143, 'bull_use_sma': False, 'bull_use_ema': False, 'bull_use_atr': False, 'bull_use_adx': True, 'bull_use_spike': True, 'bull_rsi_required': False, 'bear_strategy': 'mean_reversion', 'bear_bb_std_mult': 2.3954020539650522, 'bear_rsi_os': 35, 'bear_rsi_ob': 90, 'bear_adx_thresh': 18.93828105799349, 'bear_atr_min_pct': 0.0036798214517875082, 'bear_atr_max_pct': 0.030403700858675546, 'bear_tp_mult': 2.792926094903079, 'bear_tsl_mult': 0.3464129279550007, 'bear_time_stop': 283, 'bear_use_sma': False, 'bear_use_ema': False, 'bear_use_atr': False, 'bear_use_adx': False, 'bear_use_spike': False, 'bear_rsi_required': False, 'sideways_strategy': 'breakout', 'sideways_bb_std_mult': 1.673965166026151, 'sideways_rsi_os': 46, 'sideways_rsi_ob': 57, 'sideways_adx_thresh': 8.988856673191615, 'sideways_atr_min_pct': 0.018252438875596876, 'sideways_atr_max_pct': 0.04936046441134962, 'sideways_tp_mult': 2.968828626479871, 'sideways_tsl_mult': 0.6162258965425297, 'sideways_time_stop': 12, 'sideways_use_sma': False, 'sideways_use_ema': True, 'sideways_use_atr': False, 'sideways_use_adx': True, 'sideways_use_spike': False, 'sideways_rsi_required': True}.
[I 2025-08-31 11:47:34,550] Trial 412 finished with values: [-1000000000.0, 1000000000.0] and parameters: {'p_sma': 55, 'p_std': 16, 'p_atr': 28, 'p_adx': 8, 'rsi_period': 54, 'ema1': 13, 'ema2': 33, 'slip_atr_k': 0.04822750818308955, 'slip_spread_k': 0.19330269687563095, 'spread_hl_frac': 0.03525944789109894, 'bb_std_mult': 3.3860889573262396, 'rsi_os': 48, 'rsi_ob': 69, 'vol_spike': 0.09454631431367251, 'adx_thresh': 24.943278927412106, 'atr_min_pct': 0.02479915707717571, 'atr_max_pct': 0.021070018963131588, 'tp_mult': 1.8634110990725616, 'tsl_mult': 0.46908373476837023, 'strategy': 'breakout', 'time_stop': 291, 'use_sma': False, 'use_atr': True, 'use_adx': True, 'use_ema': False, 'use_spike': True, 'rsi_required': False, 'edge_k': 0.38984671620955075, 'edge_cap': 0.4496215016276772, 'bull_strategy': 'breakout', 'bull_bb_std_mult': 2.873276060353054, 'bull_rsi_os': 41, 'bull_rsi_ob': 64, 'bull_adx_thresh': 12.14907690248764, 'bull_atr_min_pct': 0.012624038127263077, 'bull_atr_max_pct': 0.08612630014259859, 'bull_tp_mult': 1.4603148755553468, 'bull_tsl_mult': 0.8240261067298116, 'bull_time_stop': 123, 'bull_use_sma': False, 'bull_use_ema': True, 'bull_use_atr': True, 'bull_use_adx': True, 'bull_use_spike': False, 'bull_rsi_required': True, 'bear_strategy': 'breakout', 'bear_bb_std_mult': 1.0831767200639952, 'bear_rsi_os': 33, 'bear_rsi_ob': 54, 'bear_adx_thresh': 7.443111916684066, 'bear_atr_min_pct': 0.003791453566921423, 'bear_atr_max_pct': 0.09446481709063821, 'bear_tp_mult': 2.694915706887258, 'bear_tsl_mult': 0.02503963942356252, 'bear_time_stop': 177, 'bear_use_sma': False, 'bear_use_ema': True, 'bear_use_atr': True, 'bear_use_adx': True, 'bear_use_spike': True, 'bear_rsi_required': False, 'sideways_strategy': 'breakout', 'sideways_bb_std_mult': 1.6432813449921877, 'sideways_rsi_os': 7, 'sideways_rsi_ob': 72, 'sideways_adx_thresh': 9.750920577134117, 'sideways_atr_min_pct': 0.003300465071490431, 'sideways_atr_max_pct': 0.07939211366466625, 'sideways_tp_mult': 1.4402522327424148, 'sideways_tsl_mult': 0.32399743454948876, 'sideways_time_stop': 227, 'sideways_use_sma': True, 'sideways_use_ema': False, 'sideways_use_atr': True, 'sideways_use_adx': False, 'sideways_use_spike': False, 'sideways_rsi_required': True}.
[I 2025-08-31 11:47:57,405] Trial 411 finished with values: [-0.04024538498862562, 0.039983448562973804] and parameters: {'p_sma': 53, 'p_std': 14, 'p_atr': 14, 'p_adx': 9, 'rsi_period': 9, 'ema1': 5, 'ema2': 27, 'slip_atr_k': 0.23958110928032794, 'slip_spread_k': 0.15811668021936243, 'spread_hl_frac': 0.002889602462297661, 'bb_std_mult': 1.0651706421100133, 'rsi_os': 35, 'rsi_ob': 71, 'vol_spike': 0.08358913415092077, 'adx_thresh': 17.065873898649862, 'atr_min_pct': 0.009728899780275387, 'atr_max_pct': 0.020846256973087812, 'tp_mult': 1.0812997431746458, 'tsl_mult': 0.2562283127051858, 'strategy': 'breakout', 'time_stop': 142, 'use_sma': False, 'use_atr': True, 'use_adx': True, 'use_ema': False, 'use_spike': True, 'rsi_required': True, 'edge_k': 0.4667783606451733, 'edge_cap': 0.44976712513823547, 'bull_strategy': 'breakout', 'bull_bb_std_mult': 2.915646319278294, 'bull_rsi_os': 22, 'bull_rsi_ob': 73, 'bull_adx_thresh': 25.51448944762741, 'bull_atr_min_pct': 0.012089130965363237, 'bull_atr_max_pct': 0.010039497563004679, 'bull_tp_mult': 1.4791544530305467, 'bull_tsl_mult': 0.2914061532812937, 'bull_time_stop': 143, 'bull_use_sma': False, 'bull_use_ema': True, 'bull_use_atr': True, 'bull_use_adx': True, 'bull_use_spike': False, 'bull_rsi_required': True, 'bear_strategy': 'breakout', 'bear_bb_std_mult': 1.2042557636258095, 'bear_rsi_os': 12, 'bear_rsi_ob': 54, 'bear_adx_thresh': 14.37216332978268, 'bear_atr_min_pct': 0.015053203806510394, 'bear_atr_max_pct': 0.10990565091107496, 'bear_tp_mult': 2.8080547433528724, 'bear_tsl_mult': 0.6874302632461058, 'bear_time_stop': 178, 'bear_use_sma': False, 'bear_use_ema': False, 'bear_use_atr': True, 'bear_use_adx': True, 'bear_use_spike': True, 'bear_rsi_required': False, 'sideways_strategy': 'breakout', 'sideways_bb_std_mult': 1.647113621709779, 'sideways_rsi_os': 31, 'sideways_rsi_ob': 72, 'sideways_adx_thresh': 11.410822004455765, 'sideways_atr_min_pct': 0.0034524023484099426, 'sideways_atr_max_pct': 0.13162691261339513, 'sideways_tp_mult': 2.3909854774043295, 'sideways_tsl_mult': 0.613834717629784, 'sideways_time_stop': 228, 'sideways_use_sma': False, 'sideways_use_ema': False, 'sideways_use_atr': True, 'sideways_use_adx': False, 'sideways_use_spike': False, 'sideways_rsi_required': True}.
[I 2025-08-31 11:48:04,674] Trial 413 finished with values: [-1000000000.0, 1000000000.0] and parameters: {'p_sma': 15, 'p_std': 16, 'p_atr': 15, 'p_adx': 28, 'rsi_period': 16, 'ema1': 13, 'ema2': 27, 'slip_atr_k': 0.23958287402041692, 'slip_spread_k': 0.15336348896456736, 'spread_hl_frac': 0.0032764192871696015, 'bb_std_mult': 3.4004308322870362, 'rsi_os': 21, 'rsi_ob': 69, 'vol_spike': 0.1255638115979262, 'adx_thresh': 26.1158411488522, 'atr_min_pct': 0.024854203378852864, 'atr_max_pct': 0.11524847234506275, 'tp_mult': 1.4189494505380873, 'tsl_mult': 0.30768559183458166, 'strategy': 'breakout', 'time_stop': 32, 'use_sma': False, 'use_atr': True, 'use_adx': True, 'use_ema': False, 'use_spike': True, 'rsi_required': False, 'edge_k': 0.2872140261944543, 'edge_cap': 0.8180155980221517, 'bull_strategy': 'breakout', 'bull_bb_std_mult': 1.7120784718699007, 'bull_rsi_os': 22, 'bull_rsi_ob': 71, 'bull_adx_thresh': 25.51170470967896, 'bull_atr_min_pct': 0.029019817982365283, 'bull_atr_max_pct': 0.04453106570029216, 'bull_tp_mult': 1.4592091486552223, 'bull_tsl_mult': 0.28430796188251556, 'bull_time_stop': 175, 'bull_use_sma': True, 'bull_use_ema': True, 'bull_use_atr': True, 'bull_use_adx': True, 'bull_use_spike': False, 'bull_rsi_required': True, 'bear_strategy': 'breakout', 'bear_bb_std_mult': 1.0877240240692336, 'bear_rsi_os': 55, 'bear_rsi_ob': 54, 'bear_adx_thresh': 14.230908844897165, 'bear_atr_min_pct': 0.015182740824683676, 'bear_atr_max_pct': 0.0938424457540938, 'bear_tp_mult': 1.1794950753885525, 'bear_tsl_mult': 0.8504580694173003, 'bear_time_stop': 180, 'bear_use_sma': False, 'bear_use_ema': True, 'bear_use_atr': True, 'bear_use_adx': True, 'bear_use_spike': True, 'bear_rsi_required': False, 'sideways_strategy': 'breakout', 'sideways_bb_std_mult': 2.7722111100970883, 'sideways_rsi_os': 31, 'sideways_rsi_ob': 87, 'sideways_adx_thresh': 8.886960674927282, 'sideways_atr_min_pct': 0.018934493002720508, 'sideways_atr_max_pct': 0.12356426944475825, 'sideways_tp_mult': 1.4299988238505406, 'sideways_tsl_mult': 0.3302626944441178, 'sideways_time_stop': 18, 'sideways_use_sma': False, 'sideways_use_ema': False, 'sideways_use_atr': True, 'sideways_use_adx': False, 'sideways_use_spike': False, 'sideways_rsi_required': True}.
