[I 2025-08-31 11:10:02,123] Trial 109 finished with values: [-0.3066496401867955, 0.3064846870776078] and parameters: {'p_sma': 17, 'p_std': 21, 'p_atr': 20, 'p_adx': 22, 'rsi_period': 60, 'ema1': 8, 'ema2': 19, 'slip_atr_k': 0.1775770399771542, 'slip_spread_k': 0.5789868528044114, 'spread_hl_frac': 0.008821171382762689, 'bb_std_mult': 1.18973111986198, 'rsi_os': 28, 'rsi_ob': 78, 'vol_spike': 0.09298912113117172, 'adx_thresh': 29.779155905471086, 'atr_min_pct': 0.014640708921267594, 'atr_max_pct': 0.1404003788828411, 'tp_mult': 1.8706027807530852, 'tsl_mult': 0.6227071180424038, 'strategy': 'breakout', 'time_stop': 156, 'use_sma': False, 'use_atr': False, 'use_adx': True, 'use_ema': True, 'use_spike': False, 'rsi_required': True, 'edge_k': 0.8287640838318817, 'edge_cap': 0.6498164869090598, 'bull_strategy': 'mean_reversion', 'bull_bb_std_mult': 3.0047459848978955, 'bull_rsi_os': 17, 'bull_rsi_ob': 64, 'bull_adx_thresh': 27.23101623794126, 'bull_atr_min_pct': 0.0205889979457094, 'bull_atr_max_pct': 0.08345229914047392, 'bull_tp_mult': 1.533456577982781, 'bull_tsl_mult': 0.08463845998912074, 'bull_time_stop': 180, 'bull_use_sma': True, 'bull_use_ema': False, 'bull_use_atr': True, 'bull_use_adx': True, 'bull_use_spike': True, 'bull_rsi_required': True, 'bear_strategy': 'breakout', 'bear_bb_std_mult': 2.503459874610653, 'bear_rsi_os': 34, 'bear_rsi_ob': 56, 'bear_adx_thresh': 22.33795133814019, 'bear_atr_min_pct': 0.029346207393571785, 'bear_atr_max_pct': 0.07495081418279075, 'bear_tp_mult': 2.2692891855917217, 'bear_tsl_mult': 0.1706781508924209, 'bear_time_stop': 184, 'bear_use_sma': False, 'bear_use_ema': False, 'bear_use_atr': False, 'bear_use_adx': True, 'bear_use_spike': False, 'bear_rsi_required': True, 'sideways_strategy': 'breakout', 'sideways_bb_std_mult': 1.2966660454251047, 'sideways_rsi_os': 49, 'sideways_rsi_ob': 81, 'sideways_adx_thresh': 22.815272154648415, 'sideways_atr_min_pct': 0.0004885721409470046, 'sideways_atr_max_pct': 0.07441351748223493, 'sideways_tp_mult': 1.5593880271245795, 'sideways_tsl_mult': 0.3940000080223083, 'sideways_time_stop': 286, 'sideways_use_sma': True, 'sideways_use_ema': True, 'sideways_use_atr': True, 'sideways_use_adx': False, 'sideways_use_spike': False, 'sideways_rsi_required': True}.
[I 2025-08-31 11:10:02,221] Trial 107 finished with values: [-0.3500897559918038, 0.3499441233896108] and parameters: {'p_sma': 27, 'p_std': 23, 'p_atr': 20, 'p_adx': 12, 'rsi_period': 7, 'ema1': 18, 'ema2': 20, 'slip_atr_k': 0.10549388190986801, 'slip_spread_k': 0.6689777045610177, 'spread_hl_frac': 0.018607082839982227, 'bb_std_mult': 2.053675192758242, 'rsi_os': 28, 'rsi_ob': 89, 'vol_spike': 0.15937363382622852, 'adx_thresh': 11.640122410543913, 'atr_min_pct': 0.010668542287346778, 'atr_max_pct': 0.0848870201559869, 'tp_mult': 1.4254218531437304, 'tsl_mult': 0.13012586442588286, 'strategy': 'breakout', 'time_stop': 234, 'use_sma': False, 'use_atr': False, 'use_adx': True, 'use_ema': True, 'use_spike': False, 'rsi_required': True, 'edge_k': 1.7492411536991748, 'edge_cap': 0.6665940229745575, 'bull_strategy': 'mean_reversion', 'bull_bb_std_mult': 3.0534616557712586, 'bull_rsi_os': 14, 'bull_rsi_ob': 66, 'bull_adx_thresh': 6.090188679420178, 'bull_atr_min_pct': 0.0030678081288434984, 'bull_atr_max_pct': 0.12830365434293348, 'bull_tp_mult': 2.9442973290063756, 'bull_tsl_mult': 0.07588703115131093, 'bull_time_stop': 179, 'bull_use_sma': True, 'bull_use_ema': False, 'bull_use_atr': False, 'bull_use_adx': False, 'bull_use_spike': True, 'bull_rsi_required': True, 'bear_strategy': 'breakout', 'bear_bb_std_mult': 1.823193951929244, 'bear_rsi_os': 14, 'bear_rsi_ob': 59, 'bear_adx_thresh': 9.810635240193243, 'bear_atr_min_pct': 0.014570815014467485, 'bear_atr_max_pct': 0.06335532154476448, 'bear_tp_mult': 2.268320778494947, 'bear_tsl_mult': 0.6988208255849601, 'bear_time_stop': 187, 'bear_use_sma': False, 'bear_use_ema': False, 'bear_use_atr': False, 'bear_use_adx': True, 'bear_use_spike': False, 'bear_rsi_required': True, 'sideways_strategy': 'breakout', 'sideways_bb_std_mult': 1.2818813485277412, 'sideways_rsi_os': 18, 'sideways_rsi_ob': 83, 'sideways_adx_thresh': 19.569707306753575, 'sideways_atr_min_pct': 0.00014736373959202452, 'sideways_atr_max_pct': 0.010821386360833948, 'sideways_tp_mult': 2.0533851380861217, 'sideways_tsl_mult': 0.268498402502205, 'sideways_time_stop': 24, 'sideways_use_sma': True, 'sideways_use_ema': True, 'sideways_use_atr': True, 'sideways_use_adx': False, 'sideways_use_spike': False, 'sideways_rsi_required': True}.
[I 2025-08-31 11:10:34,247] Trial 111 finished with values: [-1000000000.0, 1000000000.0] and parameters: {'p_sma': 18, 'p_std': 52, 'p_atr': 22, 'p_adx': 20, 'rsi_period': 22, 'ema1': 16, 'ema2': 39, 'slip_atr_k': 0.17762428781708203, 'slip_spread_k': 0.9237877212949317, 'spread_hl_frac': 0.008631983212365737, 'bb_std_mult': 2.7827153552582407, 'rsi_os': 26, 'rsi_ob': 78, 'vol_spike': 0.06230475839943936, 'adx_thresh': 29.86123757545029, 'atr_min_pct': 0.010358210149710879, 'atr_max_pct': 0.08189974438039996, 'tp_mult': 1.8663511461221474, 'tsl_mult': 0.11897889371650627, 'strategy': 'breakout', 'time_stop': 284, 'use_sma': False, 'use_atr': False, 'use_adx': True, 'use_ema': True, 'use_spike': False, 'rsi_required': True, 'edge_k': 1.72444017311006, 'edge_cap': 0.7327475319139974, 'bull_strategy': 'mean_reversion', 'bull_bb_std_mult': 2.2311342549566433, 'bull_rsi_os': 26, 'bull_rsi_ob': 66, 'bull_adx_thresh': 6.010159971734051, 'bull_atr_min_pct': 0.01565309955507549, 'bull_atr_max_pct': 0.1265499979051223, 'bull_tp_mult': 1.322941819250183, 'bull_tsl_mult': 0.6405363089763647, 'bull_time_stop': 75, 'bull_use_sma': True, 'bull_use_ema': False, 'bull_use_atr': True, 'bull_use_adx': True, 'bull_use_spike': False, 'bull_rsi_required': True, 'bear_strategy': 'breakout', 'bear_bb_std_mult': 2.519547512942986, 'bear_rsi_os': 16, 'bear_rsi_ob': 56, 'bear_adx_thresh': 13.087483262007181, 'bear_atr_min_pct': 0.02947641061665676, 'bear_atr_max_pct': 0.011278334155272837, 'bear_tp_mult': 2.2932251162714197, 'bear_tsl_mult': 0.8277950696771612, 'bear_time_stop': 113, 'bear_use_sma': False, 'bear_use_ema': False, 'bear_use_atr': True, 'bear_use_adx': True, 'bear_use_spike': False, 'bear_rsi_required': True, 'sideways_strategy': 'breakout', 'sideways_bb_std_mult': 3.4356650078458335, 'sideways_rsi_os': 31, 'sideways_rsi_ob': 90, 'sideways_adx_thresh': 10.691943238544527, 'sideways_atr_min_pct': 0.004488239727590982, 'sideways_atr_max_pct': 0.06098969855601144, 'sideways_tp_mult': 1.5449119213236255, 'sideways_tsl_mult': 0.17382841616697983, 'sideways_time_stop': 134, 'sideways_use_sma': True, 'sideways_use_ema': True, 'sideways_use_atr': True, 'sideways_use_adx': False, 'sideways_use_spike': False, 'sideways_rsi_required': True}.
[I 2025-08-31 11:10:34,443] Trial 113 finished with values: [-1000000000.0, 1000000000.0] and parameters: {'p_sma': 23, 'p_std': 50, 'p_atr': 22, 'p_adx': 8, 'rsi_period': 73, 'ema1': 6, 'ema2': 27, 'slip_atr_k': 0.00048562228850437816, 'slip_spread_k': 0.958680394576616, 'spread_hl_frac': 0.03307947832343314, 'bb_std_mult': 0.9288173670690949, 'rsi_os': 26, 'rsi_ob': 95, 'vol_spike': 0.055880417582712796, 'adx_thresh': 10.444923614843455, 'atr_min_pct': 0.01724493702322327, 'atr_max_pct': 0.04516848274355947, 'tp_mult': 1.9676918425639922, 'tsl_mult': 0.8698629060433865, 'strategy': 'breakout', 'time_stop': 180, 'use_sma': False, 'use_atr': False, 'use_adx': True, 'use_ema': True, 'use_spike': True, 'rsi_required': False, 'edge_k': 1.317843352695256, 'edge_cap': 0.7652051084606729, 'bull_strategy': 'mean_reversion', 'bull_bb_std_mult': 2.218590019777956, 'bull_rsi_os': 6, 'bull_rsi_ob': 47, 'bull_adx_thresh': 6.299604035903392, 'bull_atr_min_pct': 0.014436745502518031, 'bull_atr_max_pct': 0.12331168390996247, 'bull_tp_mult': 1.4139257342364795, 'bull_tsl_mult': 0.026697423478632867, 'bull_time_stop': 97, 'bull_use_sma': True, 'bull_use_ema': False, 'bull_use_atr': True, 'bull_use_adx': True, 'bull_use_spike': False, 'bull_rsi_required': True, 'bear_strategy': 'breakout', 'bear_bb_std_mult': 0.5933384339545844, 'bear_rsi_os': 29, 'bear_rsi_ob': 54, 'bear_adx_thresh': 12.970108573151814, 'bear_atr_min_pct': 0.027980425895278962, 'bear_atr_max_pct': 0.029155247474532485, 'bear_tp_mult': 2.429047713468796, 'bear_tsl_mult': 0.3218466336174929, 'bear_time_stop': 130, 'bear_use_sma': False, 'bear_use_ema': True, 'bear_use_atr': True, 'bear_use_adx': True, 'bear_use_spike': False, 'bear_rsi_required': True, 'sideways_strategy': 'breakout', 'sideways_bb_std_mult': 1.981410965739228, 'sideways_rsi_os': 45, 'sideways_rsi_ob': 78, 'sideways_adx_thresh': 10.851356460902306, 'sideways_atr_min_pct': 0.004377132498813547, 'sideways_atr_max_pct': 0.0524910527570248, 'sideways_tp_mult': 2.400803409347243, 'sideways_tsl_mult': 0.020152536352647667, 'sideways_time_stop': 132, 'sideways_use_sma': True, 'sideways_use_ema': False, 'sideways_use_atr': True, 'sideways_use_adx': False, 'sideways_use_spike': True, 'sideways_rsi_required': True}.
[I 2025-08-31 11:10:34,751] Trial 112 finished with values: [-1000000000.0, 1000000000.0] and parameters: {'p_sma': 23, 'p_std': 50, 'p_atr': 20, 'p_adx': 8, 'rsi_period': 72, 'ema1': 6, 'ema2': 47, 'slip_atr_k': 0.09268651718710103, 'slip_spread_k': 0.8546080127047029, 'spread_hl_frac': 0.007254722093268177, 'bb_std_mult': 0.954211868589419, 'rsi_os': 32, 'rsi_ob': 95, 'vol_spike': 0.0552222320709895, 'adx_thresh': 10.677492698015454, 'atr_min_pct': 0.010593487959965044, 'atr_max_pct': 0.08681578748848462, 'tp_mult': 1.9820632824817859, 'tsl_mult': 0.13055667439120572, 'strategy': 'breakout', 'time_stop': 72, 'use_sma': False, 'use_atr': False, 'use_adx': True, 'use_ema': True, 'use_spike': False, 'rsi_required': False, 'edge_k': 1.2726878033130533, 'edge_cap': 0.7298969235506797, 'bull_strategy': 'mean_reversion', 'bull_bb_std_mult': 2.2671376788742292, 'bull_rsi_os': 9, 'bull_rsi_ob': 66, 'bull_adx_thresh': 21.64200266457692, 'bull_atr_min_pct': 0.01455674646769209, 'bull_atr_max_pct': 0.07498139537416525, 'bull_tp_mult': 2.57588973215109, 'bull_tsl_mult': 0.021475284305079154, 'bull_time_stop': 95, 'bull_use_sma': True, 'bull_use_ema': False, 'bull_use_atr': False, 'bull_use_adx': True, 'bull_use_spike': False, 'bull_rsi_required': True, 'bear_strategy': 'breakout', 'bear_bb_std_mult': 1.7466831762514208, 'bear_rsi_os': 16, 'bear_rsi_ob': 54, 'bear_adx_thresh': 13.089056375074321, 'bear_atr_min_pct': 0.027768347110615918, 'bear_atr_max_pct': 0.02719343339812272, 'bear_tp_mult': 2.3561968971504994, 'bear_tsl_mult': 0.8297124889311671, 'bear_time_stop': 47, 'bear_use_sma': False, 'bear_use_ema': False, 'bear_use_atr': True, 'bear_use_adx': True, 'bear_use_spike': False, 'bear_rsi_required': True, 'sideways_strategy': 'breakout', 'sideways_bb_std_mult': 2.6405012382828663, 'sideways_rsi_os': 39, 'sideways_rsi_ob': 80, 'sideways_adx_thresh': 27.89525130024144, 'sideways_atr_min_pct': 0.003683236276798199, 'sideways_atr_max_pct': 0.06714155928883496, 'sideways_tp_mult': 1.3957762379312966, 'sideways_tsl_mult': 0.1760154304780503, 'sideways_time_stop': 127, 'sideways_use_sma': True, 'sideways_use_ema': True, 'sideways_use_atr': True, 'sideways_use_adx': False, 'sideways_use_spike': True, 'sideways_rsi_required': True}.
[I 2025-08-31 11:10:34,896] Trial 110 finished with values: [-0.009567801345635396, 0.014175615328142578] and parameters: {'p_sma': 38, 'p_std': 38, 'p_atr': 20, 'p_adx': 20, 'rsi_period': 59, 'ema1': 16, 'ema2': 20, 'slip_atr_k': 0.09342646835904224, 'slip_spread_k': 0.7589503066733503, 'spread_hl_frac': 0.018562690871183115, 'bb_std_mult': 2.842143097875825, 'rsi_os': 32, 'rsi_ob': 95, 'vol_spike': 0.09618378808400863, 'adx_thresh': 30.545390916110854, 'atr_min_pct': 0.0023645467280629124, 'atr_max_pct': 0.1407696585463902, 'tp_mult': 1.4541486710266747, 'tsl_mult': 0.12573684461771012, 'strategy': 'breakout', 'time_stop': 156, 'use_sma': False, 'use_atr': False, 'use_adx': True, 'use_ema': True, 'use_spike': False, 'rsi_required': True, 'edge_k': 0.3587049332528667, 'edge_cap': 0.7390712922099919, 'bull_strategy': 'mean_reversion', 'bull_bb_std_mult': 2.2702484064894284, 'bull_rsi_os': 14, 'bull_rsi_ob': 66, 'bull_adx_thresh': 6.239934894371621, 'bull_atr_min_pct': 0.017399451550476997, 'bull_atr_max_pct': 0.07570139024969147, 'bull_tp_mult': 1.750762854982445, 'bull_tsl_mult': 0.026512305275242343, 'bull_time_stop': 177, 'bull_use_sma': True, 'bull_use_ema': False, 'bull_use_atr': True, 'bull_use_adx': True, 'bull_use_spike': False, 'bull_rsi_required': True, 'bear_strategy': 'breakout', 'bear_bb_std_mult': 0.5694259715235921, 'bear_rsi_os': 16, 'bear_rsi_ob': 56, 'bear_adx_thresh': 32.952379907803255, 'bear_atr_min_pct': 0.0021262424654090555, 'bear_atr_max_pct': 0.052597573551245794, 'bear_tp_mult': 2.354490566386043, 'bear_tsl_mult': 0.31555690034011785, 'bear_time_stop': 84, 'bear_use_sma': False, 'bear_use_ema': False, 'bear_use_atr': True, 'bear_use_adx': True, 'bear_use_spike': False, 'bear_rsi_required': True, 'sideways_strategy': 'breakout', 'sideways_bb_std_mult': 1.2998082626581957, 'sideways_rsi_os': 31, 'sideways_rsi_ob': 79, 'sideways_adx_thresh': 5.865284500232639, 'sideways_atr_min_pct': 0.00013958821230416162, 'sideways_atr_max_pct': 0.012095825999666604, 'sideways_tp_mult': 2.072350616520823, 'sideways_tsl_mult': 0.8536162933042187, 'sideways_time_stop': 27, 'sideways_use_sma': True, 'sideways_use_ema': True, 'sideways_use_atr': True, 'sideways_use_adx': False, 'sideways_use_spike': False, 'sideways_rsi_required': True}.
[I 2025-08-31 11:11:06,294] Trial 114 finished with values: [-1000000000.0, 1000000000.0] and parameters: {'p_sma': 14, 'p_std': 48, 'p_atr': 19, 'p_adx': 8, 'rsi_period': 29, 'ema1': 8, 'ema2': 27, 'slip_atr_k': 0.11768990217322182, 'slip_spread_k': 0.3380970286942524, 'spread_hl_frac': 0.006496512931150927, 'bb_std_mult': 0.9336959030404117, 'rsi_os': 26, 'rsi_ob': 95, 'vol_spike': 0.05241215701439727, 'adx_thresh': 7.034932733023682, 'atr_min_pct': 0.003751476740388511, 'atr_max_pct': 0.04921006577358207, 'tp_mult': 2.5452308109718, 'tsl_mult': 0.5452980030194801, 'strategy': 'breakout', 'time_stop': 70, 'use_sma': False, 'use_atr': False, 'use_adx': True, 'use_ema': True, 'use_spike': True, 'rsi_required': False, 'edge_k': 0.3290336739981067, 'edge_cap': 0.7475227202761248, 'bull_strategy': 'mean_reversion', 'bull_bb_std_mult': 1.7144411927253946, 'bull_rsi_os': 9, 'bull_rsi_ob': 71, 'bull_adx_thresh': 20.57085554004039, 'bull_atr_min_pct': 0.01723876136809586, 'bull_atr_max_pct': 0.07969649975354708, 'bull_tp_mult': 2.587998499806172, 'bull_tsl_mult': 0.03240188945998415, 'bull_time_stop': 94, 'bull_use_sma': True, 'bull_use_ema': False, 'bull_use_atr': False, 'bull_use_adx': False, 'bull_use_spike': True, 'bull_rsi_required': True, 'bear_strategy': 'breakout', 'bear_bb_std_mult': 1.7536539677303462, 'bear_rsi_os': 9, 'bear_rsi_ob': 54, 'bear_adx_thresh': 11.855923709949135, 'bear_atr_min_pct': 0.0012853104668888102, 'bear_atr_max_pct': 0.026695731984575845, 'bear_tp_mult': 2.4216153207197575, 'bear_tsl_mult': 0.3063135075390201, 'bear_time_stop': 149, 'bear_use_sma': False, 'bear_use_ema': True, 'bear_use_atr': False, 'bear_use_adx': True, 'bear_use_spike': False, 'bear_rsi_required': True, 'sideways_strategy': 'breakout', 'sideways_bb_std_mult': 1.880057864643027, 'sideways_rsi_os': 26, 'sideways_rsi_ob': 78, 'sideways_adx_thresh': 24.541906706630193, 'sideways_atr_min_pct': 0.003268933355652598, 'sideways_atr_max_pct': 0.06733034976880364, 'sideways_tp_mult': 1.4088155561015658, 'sideways_tsl_mult': 0.8497447122581615, 'sideways_time_stop': 60, 'sideways_use_sma': True, 'sideways_use_ema': False, 'sideways_use_atr': True, 'sideways_use_adx': False, 'sideways_use_spike': True, 'sideways_rsi_required': True}.
[I 2025-08-31 11:11:07,010] Trial 117 finished with values: [-0.0355737002217551, 0.03578615798910305] and parameters: {'p_sma': 38, 'p_std': 38, 'p_atr': 18, 'p_adx': 20, 'rsi_period': 58, 'ema1': 14, 'ema2': 20, 'slip_atr_k': 0.06654495257925708, 'slip_spread_k': 0.7591074091786028, 'spread_hl_frac': 0.021438018281973455, 'bb_std_mult': 3.079884306474023, 'rsi_os': 41, 'rsi_ob': 93, 'vol_spike': 0.12133493256213926, 'adx_thresh': 31.404299479878183, 'atr_min_pct': 0.0015805475748368225, 'atr_max_pct': 0.14154822472543274, 'tp_mult': 1.122675827394463, 'tsl_mult': 0.052554128084567164, 'strategy': 'breakout', 'time_stop': 94, 'use_sma': False, 'use_atr': False, 'use_adx': True, 'use_ema': True, 'use_spike': False, 'rsi_required': True, 'edge_k': 0.35827805923476624, 'edge_cap': 0.8075546294208908, 'bull_strategy': 'mean_reversion', 'bull_bb_std_mult': 0.8389485007271893, 'bull_rsi_os': 16, 'bull_rsi_ob': 68, 'bull_adx_thresh': 8.407397899055123, 'bull_atr_min_pct': 0.017496786564798025, 'bull_atr_max_pct': 0.06128347789469498, 'bull_tp_mult': 1.6472141668820768, 'bull_tsl_mult': 0.0379767403974145, 'bull_time_stop': 185, 'bull_use_sma': True, 'bull_use_ema': False, 'bull_use_atr': True, 'bull_use_adx': True, 'bull_use_spike': False, 'bull_rsi_required': True, 'bear_strategy': 'mean_reversion', 'bear_bb_std_mult': 0.7977410680689961, 'bear_rsi_os': 10, 'bear_rsi_ob': 57, 'bear_adx_thresh': 32.70746340800164, 'bear_atr_min_pct': 0.001111171706455472, 'bear_atr_max_pct': 0.05493834763325714, 'bear_tp_mult': 2.350990987359218, 'bear_tsl_mult': 0.2964867160909405, 'bear_time_stop': 76, 'bear_use_sma': False, 'bear_use_ema': False, 'bear_use_atr': True, 'bear_use_adx': False, 'bear_use_spike': False, 'bear_rsi_required': True, 'sideways_strategy': 'breakout', 'sideways_bb_std_mult': 0.9378278124931656, 'sideways_rsi_os': 32, 'sideways_rsi_ob': 75, 'sideways_adx_thresh': 5.72916038944703, 'sideways_atr_min_pct': 1.2828095797895353e-05, 'sideways_atr_max_pct': 0.020406853197588982, 'sideways_tp_mult': 1.8462296539262637, 'sideways_tsl_mult': 0.8559818995987837, 'sideways_time_stop': 5, 'sideways_use_sma': True, 'sideways_use_ema': True, 'sideways_use_atr': True, 'sideways_use_adx': False, 'sideways_use_spike': False, 'sideways_rsi_required': True}.
[I 2025-08-31 11:11:07,137] Trial 116 finished with values: [-1000000000.0, 1000000000.0] and parameters: {'p_sma': 14, 'p_std': 48, 'p_atr': 18, 'p_adx': 29, 'rsi_period': 17, 'ema1': 8, 'ema2': 31, 'slip_atr_k': 0.2273046020709203, 'slip_spread_k': 0.34497230574858306, 'spread_hl_frac': 0.03947919136777099, 'bb_std_mult': 2.3767175128060116, 'rsi_os': 31, 'rsi_ob': 63, 'vol_spike': 0.024965544228811865, 'adx_thresh': 25.95712728390678, 'atr_min_pct': 0.022776230644076, 'atr_max_pct': 0.14158813403825576, 'tp_mult': 1.6104210740021112, 'tsl_mult': 0.5536998060694677, 'strategy': 'mean_reversion', 'time_stop': 168, 'use_sma': False, 'use_atr': False, 'use_adx': False, 'use_ema': True, 'use_spike': False, 'rsi_required': False, 'edge_k': 0.706124641856236, 'edge_cap': 0.6872005034124543, 'bull_strategy': 'mean_reversion', 'bull_bb_std_mult': 0.8456740084627434, 'bull_rsi_os': 51, 'bull_rsi_ob': 60, 'bull_adx_thresh': 8.881670159783203, 'bull_atr_min_pct': 0.013090163616183896, 'bull_atr_max_pct': 0.08076344784652854, 'bull_tp_mult': 1.7679170236983763, 'bull_tsl_mult': 0.05102706934716874, 'bull_time_stop': 79, 'bull_use_sma': True, 'bull_use_ema': False, 'bull_use_atr': False, 'bull_use_adx': False, 'bull_use_spike': True, 'bull_rsi_required': True, 'bear_strategy': 'mean_reversion', 'bear_bb_std_mult': 1.6629449527305056, 'bear_rsi_os': 36, 'bear_rsi_ob': 50, 'bear_adx_thresh': 12.024708012360882, 'bear_atr_min_pct': 0.007205568327130397, 'bear_atr_max_pct': 0.02147945686180014, 'bear_tp_mult': 2.3759186330964464, 'bear_tsl_mult': 0.8741898341587699, 'bear_time_stop': 139, 'bear_use_sma': False, 'bear_use_ema': False, 'bear_use_atr': False, 'bear_use_adx': False, 'bear_use_spike': False, 'bear_rsi_required': True, 'sideways_strategy': 'mean_reversion', 'sideways_bb_std_mult': 1.4209425019836692, 'sideways_rsi_os': 29, 'sideways_rsi_ob': 69, 'sideways_adx_thresh': 8.762623656226808, 'sideways_atr_min_pct': 0.002884361483853478, 'sideways_atr_max_pct': 0.05715451791471012, 'sideways_tp_mult': 1.0240029463723537, 'sideways_tsl_mult': 0.34871176213248256, 'sideways_time_stop': 53, 'sideways_use_sma': True, 'sideways_use_ema': True, 'sideways_use_atr': True, 'sideways_use_adx': False, 'sideways_use_spike': False, 'sideways_rsi_required': False}.
