[I 2025-08-31 11:31:36,983] Trial 280 finished with values: [-1000000000.0, 1000000000.0] and parameters: {'p_sma': 23, 'p_std': 16, 'p_atr': 14, 'p_adx': 27, 'rsi_period': 18, 'ema1': 12, 'ema2': 46, 'slip_atr_k': 0.03835241700346471, 'slip_spread_k': 0.12086795377065593, 'spread_hl_frac': 0.009182416554612674, 'bb_std_mult': 3.3500364183697102, 'rsi_os': 35, 'rsi_ob': 71, 'vol_spike': 0.11408999452520233, 'adx_thresh': 26.325703617639366, 'atr_min_pct': 0.020694912329491444, 'atr_max_pct': 0.014020634483706607, 'tp_mult': 1.2061099606815762, 'tsl_mult': 0.2922663938859916, 'strategy': 'breakout', 'time_stop': 91, 'use_sma': True, 'use_atr': True, 'use_adx': False, 'use_ema': False, 'use_spike': True, 'rsi_required': True, 'edge_k': 0.42369193714499254, 'edge_cap': 0.8054120106497791, 'bull_strategy': 'mean_reversion', 'bull_bb_std_mult': 2.568791075184357, 'bull_rsi_os': 23, 'bull_rsi_ob': 77, 'bull_adx_thresh': 15.276595482116987, 'bull_atr_min_pct': 0.003695145237435549, 'bull_atr_max_pct': 0.13667024811197676, 'bull_tp_mult': 1.566435327839475, 'bull_tsl_mult': 0.7349586096417983, 'bull_time_stop': 121, 'bull_use_sma': False, 'bull_use_ema': True, 'bull_use_atr': True, 'bull_use_adx': False, 'bull_use_spike': False, 'bull_rsi_required': True, 'bear_strategy': 'breakout', 'bear_bb_std_mult': 0.9216031483284877, 'bear_rsi_os': 33, 'bear_rsi_ob': 53, 'bear_adx_thresh': 31.86268387456492, 'bear_atr_min_pct': 0.015096076983455721, 'bear_atr_max_pct': 0.06745776438911771, 'bear_tp_mult': 2.7236383819678727, 'bear_tsl_mult': 0.9373636029599286, 'bear_time_stop': 24, 'bear_use_sma': False, 'bear_use_ema': True, 'bear_use_atr': True, 'bear_use_adx': False, 'bear_use_spike': True, 'bear_rsi_required': False, 'sideways_strategy': 'breakout', 'sideways_bb_std_mult': 2.0925012482552168, 'sideways_rsi_os': 29, 'sideways_rsi_ob': 49, 'sideways_adx_thresh': 8.86169313397953, 'sideways_atr_min_pct': 0.025316883767023818, 'sideways_atr_max_pct': 0.13936926100565325, 'sideways_tp_mult': 1.4865793286729034, 'sideways_tsl_mult': 0.344666138324641, 'sideways_time_stop': 19, 'sideways_use_sma': True, 'sideways_use_ema': False, 'sideways_use_atr': True, 'sideways_use_adx': True, 'sideways_use_spike': False, 'sideways_rsi_required': True}.
[I 2025-08-31 11:31:37,719] Trial 283 finished with values: [-1000000000.0, 1000000000.0] and parameters: {'p_sma': 25, 'p_std': 16, 'p_atr': 14, 'p_adx': 24, 'rsi_period': 43, 'ema1': 11, 'ema2': 28, 'slip_atr_k': 0.09694643056735082, 'slip_spread_k': 0.1235875638443715, 'spread_hl_frac': 0.004863354663128244, 'bb_std_mult': 0.8187379088909791, 'rsi_os': 34, 'rsi_ob': 53, 'vol_spike': 0.12422263968376933, 'adx_thresh': 26.267584841208738, 'atr_min_pct': 0.021785801224786613, 'atr_max_pct': 0.01963973610189676, 'tp_mult': 1.0799229073810221, 'tsl_mult': 0.33739046694726654, 'strategy': 'breakout', 'time_stop': 282, 'use_sma': True, 'use_atr': True, 'use_adx': False, 'use_ema': True, 'use_spike': True, 'rsi_required': True, 'edge_k': 0.7284955659718533, 'edge_cap': 0.10846528800481225, 'bull_strategy': 'mean_reversion', 'bull_bb_std_mult': 2.3455610649218777, 'bull_rsi_os': 23, 'bull_rsi_ob': 62, 'bull_adx_thresh': 26.10059297339982, 'bull_atr_min_pct': 0.006211548024290282, 'bull_atr_max_pct': 0.1451042379709432, 'bull_tp_mult': 1.4174174018610148, 'bull_tsl_mult': 0.40925221595763894, 'bull_time_stop': 164, 'bull_use_sma': False, 'bull_use_ema': True, 'bull_use_atr': True, 'bull_use_adx': True, 'bull_use_spike': False, 'bull_rsi_required': True, 'bear_strategy': 'breakout', 'bear_bb_std_mult': 1.1245791984314344, 'bear_rsi_os': 36, 'bear_rsi_ob': 51, 'bear_adx_thresh': 31.775127790956375, 'bear_atr_min_pct': 0.014184666801533779, 'bear_atr_max_pct': 0.11669104814610057, 'bear_tp_mult': 2.72828132554376, 'bear_tsl_mult': 0.3240017955807537, 'bear_time_stop': 172, 'bear_use_sma': False, 'bear_use_ema': True, 'bear_use_atr': True, 'bear_use_adx': False, 'bear_use_spike': True, 'bear_rsi_required': False, 'sideways_strategy': 'breakout', 'sideways_bb_std_mult': 3.0205105362461633, 'sideways_rsi_os': 17, 'sideways_rsi_ob': 75, 'sideways_adx_thresh': 20.418595257098637, 'sideways_atr_min_pct': 0.002203881329458476, 'sideways_atr_max_pct': 0.05054692042817611, 'sideways_tp_mult': 1.321564676369687, 'sideways_tsl_mult': 0.41214248335029596, 'sideways_time_stop': 5, 'sideways_use_sma': True, 'sideways_use_ema': False, 'sideways_use_atr': True, 'sideways_use_adx': True, 'sideways_use_spike': False, 'sideways_rsi_required': True}.
[I 2025-08-31 11:31:45,372] Trial 284 finished with values: [-1000000000.0, 1000000000.0] and parameters: {'p_sma': 24, 'p_std': 16, 'p_atr': 14, 'p_adx': 24, 'rsi_period': 70, 'ema1': 11, 'ema2': 33, 'slip_atr_k': 0.0635350973971604, 'slip_spread_k': 0.11224142840151408, 'spread_hl_frac': 0.004125855611011947, 'bb_std_mult': 0.9113065651844268, 'rsi_os': 32, 'rsi_ob': 66, 'vol_spike': 0.1685512038756407, 'adx_thresh': 24.788154758624476, 'atr_min_pct': 0.02696226709810641, 'atr_max_pct': 0.022745814063818995, 'tp_mult': 1.4407264360086969, 'tsl_mult': 0.30389957973133525, 'strategy': 'breakout', 'time_stop': 147, 'use_sma': False, 'use_atr': True, 'use_adx': True, 'use_ema': False, 'use_spike': True, 'rsi_required': True, 'edge_k': 0.09620122817143295, 'edge_cap': 0.8557779135134247, 'bull_strategy': 'breakout', 'bull_bb_std_mult': 2.438354315704367, 'bull_rsi_os': 28, 'bull_rsi_ob': 64, 'bull_adx_thresh': 13.672991776674976, 'bull_atr_min_pct': 0.005687414885985375, 'bull_atr_max_pct': 0.14986445358067255, 'bull_tp_mult': 1.4639821962142197, 'bull_tsl_mult': 0.39660101050547003, 'bull_time_stop': 154, 'bull_use_sma': True, 'bull_use_ema': True, 'bull_use_atr': True, 'bull_use_adx': True, 'bull_use_spike': False, 'bull_rsi_required': True, 'bear_strategy': 'breakout', 'bear_bb_std_mult': 0.9492569942270099, 'bear_rsi_os': 48, 'bear_rsi_ob': 81, 'bear_adx_thresh': 30.342395443250577, 'bear_atr_min_pct': 0.016022076643939138, 'bear_atr_max_pct': 0.10728295637536606, 'bear_tp_mult': 1.9256102380126887, 'bear_tsl_mult': 0.2674339789124879, 'bear_time_stop': 222, 'bear_use_sma': False, 'bear_use_ema': True, 'bear_use_atr': True, 'bear_use_adx': False, 'bear_use_spike': True, 'bear_rsi_required': False, 'sideways_strategy': 'breakout', 'sideways_bb_std_mult': 2.904152928462702, 'sideways_rsi_os': 10, 'sideways_rsi_ob': 77, 'sideways_adx_thresh': 22.942492997569772, 'sideways_atr_min_pct': 0.01965706574995585, 'sideways_atr_max_pct': 0.044213144433517385, 'sideways_tp_mult': 1.424751948377256, 'sideways_tsl_mult': 0.3997789461579301, 'sideways_time_stop': 154, 'sideways_use_sma': True, 'sideways_use_ema': False, 'sideways_use_atr': True, 'sideways_use_adx': True, 'sideways_use_spike': False, 'sideways_rsi_required': True}.
[I 2025-08-31 11:31:59,312] Trial 279 finished with values: [-0.018809070145755724, 0.018993868137277287] and parameters: {'p_sma': 25, 'p_std': 16, 'p_atr': 12, 'p_adx': 22, 'rsi_period': 33, 'ema1': 12, 'ema2': 47, 'slip_atr_k': 0.04076117055772628, 'slip_spread_k': 0.11885185812610038, 'spread_hl_frac': 0.004822338479885453, 'bb_std_mult': 3.3253035012670544, 'rsi_os': 35, 'rsi_ob': 64, 'vol_spike': 0.11397839179512576, 'adx_thresh': 26.395583881994423, 'atr_min_pct': 0.020178350638145624, 'atr_max_pct': 0.020329075996861828, 'tp_mult': 1.9044320493508717, 'tsl_mult': 0.2902368109993138, 'strategy': 'breakout', 'time_stop': 148, 'use_sma': True, 'use_atr': True, 'use_adx': False, 'use_ema': False, 'use_spike': True, 'rsi_required': True, 'edge_k': 0.4950233297217719, 'edge_cap': 0.43744085332959975, 'bull_strategy': 'mean_reversion', 'bull_bb_std_mult': 2.7731281307022546, 'bull_rsi_os': 28, 'bull_rsi_ob': 95, 'bull_adx_thresh': 25.995895518854006, 'bull_atr_min_pct': 0.006092281022956, 'bull_atr_max_pct': 0.14746071515003728, 'bull_tp_mult': 1.4311949085819553, 'bull_tsl_mult': 0.40363413376475393, 'bull_time_stop': 143, 'bull_use_sma': False, 'bull_use_ema': True, 'bull_use_atr': True, 'bull_use_adx': False, 'bull_use_spike': False, 'bull_rsi_required': True, 'bear_strategy': 'breakout', 'bear_bb_std_mult': 0.9412094603961343, 'bear_rsi_os': 43, 'bear_rsi_ob': 77, 'bear_adx_thresh': 31.830339215782118, 'bear_atr_min_pct': 0.015004447328866632, 'bear_atr_max_pct': 0.06874513739070476, 'bear_tp_mult': 2.117257300307399, 'bear_tsl_mult': 0.3379846987864047, 'bear_time_stop': 165, 'bear_use_sma': False, 'bear_use_ema': True, 'bear_use_atr': True, 'bear_use_adx': False, 'bear_use_spike': True, 'bear_rsi_required': False, 'sideways_strategy': 'breakout', 'sideways_bb_std_mult': 2.069700786381052, 'sideways_rsi_os': 29, 'sideways_rsi_ob': 72, 'sideways_adx_thresh': 9.163399764009592, 'sideways_atr_min_pct': 0.0022000408938775413, 'sideways_atr_max_pct': 0.13788499442149676, 'sideways_tp_mult': 1.8027099222422645, 'sideways_tsl_mult': 0.4022136082657301, 'sideways_time_stop': 5, 'sideways_use_sma': True, 'sideways_use_ema': False, 'sideways_use_atr': True, 'sideways_use_adx': True, 'sideways_use_spike': False, 'sideways_rsi_required': True}.
[I 2025-08-31 11:32:00,211] Trial 281 finished with values: [-0.019748258295079868, 0.019923828973828002] and parameters: {'p_sma': 24, 'p_std': 16, 'p_atr': 14, 'p_adx': 27, 'rsi_period': 33, 'ema1': 23, 'ema2': 46, 'slip_atr_k': 0.06148588759711715, 'slip_spread_k': 0.12570367502889973, 'spread_hl_frac': 0.0046897572759937245, 'bb_std_mult': 0.813908658675031, 'rsi_os': 35, 'rsi_ob': 65, 'vol_spike': 0.088412212078878, 'adx_thresh': 26.568286121779835, 'atr_min_pct': 0.004273049860990308, 'atr_max_pct': 0.01323136899791616, 'tp_mult': 2.4125775057860332, 'tsl_mult': 0.29254822714100653, 'strategy': 'breakout', 'time_stop': 284, 'use_sma': True, 'use_atr': True, 'use_adx': False, 'use_ema': False, 'use_spike': True, 'rsi_required': True, 'edge_k': 0.44065590713579744, 'edge_cap': 0.8053773927589204, 'bull_strategy': 'mean_reversion', 'bull_bb_std_mult': 2.544338364498848, 'bull_rsi_os': 23, 'bull_rsi_ob': 78, 'bull_adx_thresh': 13.549485377796382, 'bull_atr_min_pct': 0.005646466075009444, 'bull_atr_max_pct': 0.13701911651186435, 'bull_tp_mult': 2.0521180204267186, 'bull_tsl_mult': 0.8875395041807855, 'bull_time_stop': 74, 'bull_use_sma': False, 'bull_use_ema': True, 'bull_use_atr': True, 'bull_use_adx': False, 'bull_use_spike': False, 'bull_rsi_required': True, 'bear_strategy': 'breakout', 'bear_bb_std_mult': 0.9362368566021024, 'bear_rsi_os': 37, 'bear_rsi_ob': 53, 'bear_adx_thresh': 31.87711653526293, 'bear_atr_min_pct': 0.015037232789841693, 'bear_atr_max_pct': 0.11527021291549872, 'bear_tp_mult': 2.7284139731643653, 'bear_tsl_mult': 0.711913801072455, 'bear_time_stop': 120, 'bear_use_sma': False, 'bear_use_ema': True, 'bear_use_atr': True, 'bear_use_adx': False, 'bear_use_spike': True, 'bear_rsi_required': False, 'sideways_strategy': 'breakout', 'sideways_bb_std_mult': 2.2653680148413207, 'sideways_rsi_os': 29, 'sideways_rsi_ob': 49, 'sideways_adx_thresh': 23.03446560934653, 'sideways_atr_min_pct': 0.0020313917698367807, 'sideways_atr_max_pct': 0.08877176796914547, 'sideways_tp_mult': 2.5792665875958356, 'sideways_tsl_mult': 0.4084881038378513, 'sideways_time_stop': 18, 'sideways_use_sma': True, 'sideways_use_ema': False, 'sideways_use_atr': True, 'sideways_use_adx': True, 'sideways_use_spike': False, 'sideways_rsi_required': True}.
[I 2025-08-31 11:32:00,906] Trial 282 finished with values: [-1000000000.0, 1000000000.0] and parameters: {'p_sma': 25, 'p_std': 16, 'p_atr': 14, 'p_adx': 27, 'rsi_period': 32, 'ema1': 23, 'ema2': 40, 'slip_atr_k': 0.09681992113765754, 'slip_spread_k': 0.13490319982665783, 'spread_hl_frac': 0.004532491450184996, 'bb_std_mult': 3.5304101719175556, 'rsi_os': 35, 'rsi_ob': 64, 'vol_spike': 0.11473118475908277, 'adx_thresh': 26.410657761650263, 'atr_min_pct': 0.004444190700669426, 'atr_max_pct': 0.021175614942415252, 'tp_mult': 1.0912283069516107, 'tsl_mult': 0.30631674536959524, 'strategy': 'breakout', 'time_stop': 281, 'use_sma': True, 'use_atr': True, 'use_adx': False, 'use_ema': False, 'use_spike': True, 'rsi_required': True, 'edge_k': 0.4393884195543014, 'edge_cap': 0.3536551730818867, 'bull_strategy': 'mean_reversion', 'bull_bb_std_mult': 2.562250623453896, 'bull_rsi_os': 23, 'bull_rsi_ob': 54, 'bull_adx_thresh': 26.07802771540251, 'bull_atr_min_pct': 0.005906465456890292, 'bull_atr_max_pct': 0.14734136846955573, 'bull_tp_mult': 2.1596730293788315, 'bull_tsl_mult': 0.8801579292575712, 'bull_time_stop': 165, 'bull_use_sma': False, 'bull_use_ema': True, 'bull_use_atr': True, 'bull_use_adx': False, 'bull_use_spike': False, 'bull_rsi_required': True, 'bear_strategy': 'breakout', 'bear_bb_std_mult': 0.9243444875554928, 'bear_rsi_os': 32, 'bear_rsi_ob': 48, 'bear_adx_thresh': 31.951912693880587, 'bear_atr_min_pct': 0.014190959730173402, 'bear_atr_max_pct': 0.11665084221761275, 'bear_tp_mult': 2.7173630457901807, 'bear_tsl_mult': 0.7032650881983509, 'bear_time_stop': 190, 'bear_use_sma': False, 'bear_use_ema': True, 'bear_use_atr': True, 'bear_use_adx': False, 'bear_use_spike': True, 'bear_rsi_required': False, 'sideways_strategy': 'breakout', 'sideways_bb_std_mult': 1.9928415118467147, 'sideways_rsi_os': 32, 'sideways_rsi_ob': 75, 'sideways_adx_thresh': 27.505406927049915, 'sideways_atr_min_pct': 0.020645952091875988, 'sideways_atr_max_pct': 0.05060773518825745, 'sideways_tp_mult': 1.4910734300910078, 'sideways_tsl_mult': 0.41070738739346635, 'sideways_time_stop': 153, 'sideways_use_sma': True, 'sideways_use_ema': False, 'sideways_use_atr': True, 'sideways_use_adx': True, 'sideways_use_spike': False, 'sideways_rsi_required': True}.
[I 2025-08-31 11:32:25,563] Trial 285 finished with values: [-1000000000.0, 1000000000.0] and parameters: {'p_sma': 28, 'p_std': 17, 'p_atr': 14, 'p_adx': 25, 'rsi_period': 51, 'ema1': 13, 'ema2': 47, 'slip_atr_k': 0.18910566956375188, 'slip_spread_k': 0.13727199261184236, 'spread_hl_frac': 0.004532877294961686, 'bb_std_mult': 3.5680356601405583, 'rsi_os': 35, 'rsi_ob': 73, 'vol_spike': 0.1891187487477431, 'adx_thresh': 26.859755544627877, 'atr_min_pct': 0.028973248340872743, 'atr_max_pct': 0.029129852474152874, 'tp_mult': 2.420139668424997, 'tsl_mult': 0.9503027288159878, 'strategy': 'breakout', 'time_stop': 33, 'use_sma': False, 'use_atr': True, 'use_adx': True, 'use_ema': False, 'use_spike': True, 'rsi_required': True, 'edge_k': 0.4524666144109535, 'edge_cap': 0.39652239009327633, 'bull_strategy': 'breakout', 'bull_bb_std_mult': 2.5544510910510874, 'bull_rsi_os': 21, 'bull_rsi_ob': 64, 'bull_adx_thresh': 14.13430772398731, 'bull_atr_min_pct': 0.008176217054388053, 'bull_atr_max_pct': 0.016519368666657458, 'bull_tp_mult': 2.15559741787684, 'bull_tsl_mult': 0.10020412222246114, 'bull_time_stop': 32, 'bull_use_sma': True, 'bull_use_ema': True, 'bull_use_atr': True, 'bull_use_adx': True, 'bull_use_spike': False, 'bull_rsi_required': True, 'bear_strategy': 'breakout', 'bear_bb_std_mult': 1.0717469108363065, 'bear_rsi_os': 43, 'bear_rsi_ob': 55, 'bear_adx_thresh': 32.71057003936646, 'bear_atr_min_pct': 0.01447649177601794, 'bear_atr_max_pct': 0.1155026130714616, 'bear_tp_mult': 2.6051543954380065, 'bear_tsl_mult': 0.34913731780494695, 'bear_time_stop': 165, 'bear_use_sma': False, 'bear_use_ema': True, 'bear_use_atr': True, 'bear_use_adx': False, 'bear_use_spike': True, 'bear_rsi_required': False, 'sideways_strategy': 'breakout', 'sideways_bb_std_mult': 1.6860623066071627, 'sideways_rsi_os': 36, 'sideways_rsi_ob': 72, 'sideways_adx_thresh': 9.392559707477089, 'sideways_atr_min_pct': 0.022362619714649073, 'sideways_atr_max_pct': 0.0393443329244641, 'sideways_tp_mult': 2.5694931081742474, 'sideways_tsl_mult': 0.9701468007494717, 'sideways_time_stop': 9, 'sideways_use_sma': True, 'sideways_use_ema': False, 'sideways_use_atr': True, 'sideways_use_adx': True, 'sideways_use_spike': False, 'sideways_rsi_required': True}.
[I 2025-08-31 11:32:33,673] Trial 287 finished with values: [-1000000000.0, 1000000000.0] and parameters: {'p_sma': 36, 'p_std': 17, 'p_atr': 14, 'p_adx': 25, 'rsi_period': 26, 'ema1': 25, 'ema2': 23, 'slip_atr_k': 0.04361174132609982, 'slip_spread_k': 0.1372866179846662, 'spread_hl_frac': 0.004161088580248893, 'bb_std_mult': 0.6127813823880479, 'rsi_os': 35, 'rsi_ob': 61, 'vol_spike': 0.09778936778794133, 'adx_thresh': 26.471075323475915, 'atr_min_pct': 0.004394144989864761, 'atr_max_pct': 0.04234485288413169, 'tp_mult': 2.430094378668238, 'tsl_mult': 0.28151631202882643, 'strategy': 'breakout', 'time_stop': 167, 'use_sma': False, 'use_atr': True, 'use_adx': True, 'use_ema': True, 'use_spike': True, 'rsi_required': True, 'edge_k': 0.45242239643434645, 'edge_cap': 0.4307074384253153, 'bull_strategy': 'breakout', 'bull_bb_std_mult': 2.530473516576941, 'bull_rsi_os': 27, 'bull_rsi_ob': 88, 'bull_adx_thresh': 14.11722207038873, 'bull_atr_min_pct': 0.004432223436780953, 'bull_atr_max_pct': 0.143317846501876, 'bull_tp_mult': 2.0532239346492984, 'bull_tsl_mult': 0.9138632013315181, 'bull_time_stop': 19, 'bull_use_sma': False, 'bull_use_ema': True, 'bull_use_atr': True, 'bull_use_adx': False, 'bull_use_spike': False, 'bull_rsi_required': True, 'bear_strategy': 'breakout', 'bear_bb_std_mult': 1.06842240203741, 'bear_rsi_os': 40, 'bear_rsi_ob': 54, 'bear_adx_thresh': 32.74089953194297, 'bear_atr_min_pct': 0.01448930688499422, 'bear_atr_max_pct': 0.11238658741520854, 'bear_tp_mult': 1.7554062210606216, 'bear_tsl_mult': 0.09949845337133989, 'bear_time_stop': 205, 'bear_use_sma': False, 'bear_use_ema': True, 'bear_use_atr': True, 'bear_use_adx': False, 'bear_use_spike': True, 'bear_rsi_required': True, 'sideways_strategy': 'breakout', 'sideways_bb_std_mult': 1.7880290119352853, 'sideways_rsi_os': 32, 'sideways_rsi_ob': 85, 'sideways_adx_thresh': 9.717334406587435, 'sideways_atr_min_pct': 0.020711977490044706, 'sideways_atr_max_pct': 0.08912902166928682, 'sideways_tp_mult': 1.3756841321444764, 'sideways_tsl_mult': 0.27538224258889493, 'sideways_time_stop': 9, 'sideways_use_sma': True, 'sideways_use_ema': False, 'sideways_use_atr': True, 'sideways_use_adx': True, 'sideways_use_spike': False, 'sideways_rsi_required': True}.
[I 2025-08-31 11:32:33,963] Trial 286 finished with values: [-1000000000.0, 1000000000.0] and parameters: {'p_sma': 54, 'p_std': 17, 'p_atr': 14, 'p_adx': 27, 'rsi_period': 26, 'ema1': 13, 'ema2': 31, 'slip_atr_k': 0.18967737193541132, 'slip_spread_k': 0.13563018011143044, 'spread_hl_frac': 0.004450396976410535, 'bb_std_mult': 0.5992383246737434, 'rsi_os': 22, 'rsi_ob': 62, 'vol_spike': 0.08771972816462527, 'adx_thresh': 26.29652824852032, 'atr_min_pct': 0.004403508754531186, 'atr_max_pct': 0.029431169837603466, 'tp_mult': 1.1433146326903119, 'tsl_mult': 0.2845659727793105, 'strategy': 'breakout', 'time_stop': 300, 'use_sma': True, 'use_atr': True, 'use_adx': False, 'use_ema': False, 'use_spike': True, 'rsi_required': True, 'edge_k': 0.6639608229654411, 'edge_cap': 0.5340904069519945, 'bull_strategy': 'breakout', 'bull_bb_std_mult': 2.756143429908853, 'bull_rsi_os': 47, 'bull_rsi_ob': 91, 'bull_adx_thresh': 14.065699762441, 'bull_atr_min_pct': 0.004483845514842458, 'bull_atr_max_pct': 0.1435626274631093, 'bull_tp_mult': 1.0507182772617987, 'bull_tsl_mult': 0.1331727851212835, 'bull_time_stop': 136, 'bull_use_sma': False, 'bull_use_ema': True, 'bull_use_atr': True, 'bull_use_adx': False, 'bull_use_spike': False, 'bull_rsi_required': True, 'bear_strategy': 'breakout', 'bear_bb_std_mult': 1.0648934961768766, 'bear_rsi_os': 41, 'bear_rsi_ob': 55, 'bear_adx_thresh': 32.72480646895273, 'bear_atr_min_pct': 0.01429597787072287, 'bear_atr_max_pct': 0.11203895580117706, 'bear_tp_mult': 2.6017505595252803, 'bear_tsl_mult': 0.712167760811887, 'bear_time_stop': 205, 'bear_use_sma': False, 'bear_use_ema': True, 'bear_use_atr': True, 'bear_use_adx': False, 'bear_use_spike': True, 'bear_rsi_required': False, 'sideways_strategy': 'breakout', 'sideways_bb_std_mult': 2.0075465205438032, 'sideways_rsi_os': 32, 'sideways_rsi_ob': 85, 'sideways_adx_thresh': 9.760951632091913, 'sideways_atr_min_pct': 0.005402982614249895, 'sideways_atr_max_pct': 0.14982666839264286, 'sideways_tp_mult': 1.3499504442959667, 'sideways_tsl_mult': 0.2699493224475545, 'sideways_time_stop': 225, 'sideways_use_sma': True, 'sideways_use_ema': False, 'sideways_use_atr': True, 'sideways_use_adx': True, 'sideways_use_spike': False, 'sideways_rsi_required': True}.
