[I 2025-08-31 11:07:53,853] Trial 92 finished with values: [-1000000000.0, 1000000000.0] and parameters: {'p_sma': 51, 'p_std': 32, 'p_atr': 21, 'p_adx': 30, 'rsi_period': 66, 'ema1': 29, 'ema2': 28, 'slip_atr_k': 0.013721563574945292, 'slip_spread_k': 0.7371699913139388, 'spread_hl_frac': 0.010143436355836607, 'bb_std_mult': 1.7034707007612426, 'rsi_os': 27, 'rsi_ob': 94, 'vol_spike': 0.07140481482629882, 'adx_thresh': 23.427228403554977, 'atr_min_pct': 0.008947935935744809, 'atr_max_pct': 0.0943913553643914, 'tp_mult': 2.193542452611205, 'tsl_mult': 0.8990618080104578, 'strategy': 'breakout', 'time_stop': 173, 'use_sma': False, 'use_atr': False, 'use_adx': True, 'use_ema': True, 'use_spike': False, 'rsi_required': True, 'edge_k': 0.7669044437983135, 'edge_cap': 0.120596392582622, 'bull_strategy': 'mean_reversion', 'bull_bb_std_mult': 2.2454966008296386, 'bull_rsi_os': 11, 'bull_rsi_ob': 59, 'bull_adx_thresh': 5.6977028649518235, 'bull_atr_min_pct': 0.007582635805859931, 'bull_atr_max_pct': 0.06516635194863986, 'bull_tp_mult': 1.7135423346051493, 'bull_tsl_mult': 0.2604882416901827, 'bull_time_stop': 43, 'bull_use_sma': True, 'bull_use_ema': False, 'bull_use_atr': True, 'bull_use_adx': True, 'bull_use_spike': True, 'bull_rsi_required': True, 'bear_strategy': 'breakout', 'bear_bb_std_mult': 2.2639253894598523, 'bear_rsi_os': 24, 'bear_rsi_ob': 69, 'bear_adx_thresh': 18.46056707429422, 'bear_atr_min_pct': 0.00010822259903200959, 'bear_atr_max_pct': 0.08374172077024866, 'bear_tp_mult': 2.3255625521069967, 'bear_tsl_mult': 0.026028460565793665, 'bear_time_stop': 75, 'bear_use_sma': True, 'bear_use_ema': False, 'bear_use_atr': False, 'bear_use_adx': True, 'bear_use_spike': False, 'bear_rsi_required': True, 'sideways_strategy': 'breakout', 'sideways_bb_std_mult': 1.3419596216015035, 'sideways_rsi_os': 7, 'sideways_rsi_ob': 95, 'sideways_adx_thresh': 31.874541430036267, 'sideways_atr_min_pct': 0.014624585223541167, 'sideways_atr_max_pct': 0.09765981477194369, 'sideways_tp_mult': 2.927404738424773, 'sideways_tsl_mult': 0.030141004933132372, 'sideways_time_stop': 266, 'sideways_use_sma': True, 'sideways_use_ema': False, 'sideways_use_atr': True, 'sideways_use_adx': False, 'sideways_use_spike': False, 'sideways_rsi_required': True}.
[I 2025-08-31 11:07:54,142] Trial 91 finished with values: [-1000000000.0, 1000000000.0] and parameters: {'p_sma': 16, 'p_std': 46, 'p_atr': 21, 'p_adx': 30, 'rsi_period': 63, 'ema1': 29, 'ema2': 30, 'slip_atr_k': 0.01531417062623519, 'slip_spread_k': 0.6249745107260511, 'spread_hl_frac': 0.009701776150306082, 'bb_std_mult': 1.6986711848270146, 'rsi_os': 27, 'rsi_ob': 50, 'vol_spike': 0.07399159529336989, 'adx_thresh': 14.152022701143714, 'atr_min_pct': 0.009327564558599705, 'atr_max_pct': 0.1454279994703184, 'tp_mult': 2.8383953681693646, 'tsl_mult': 0.48296888230659957, 'strategy': 'breakout', 'time_stop': 221, 'use_sma': False, 'use_atr': False, 'use_adx': False, 'use_ema': True, 'use_spike': False, 'rsi_required': True, 'edge_k': 0.673564689247633, 'edge_cap': 0.7871108951956661, 'bull_strategy': 'mean_reversion', 'bull_bb_std_mult': 2.681729419132833, 'bull_rsi_os': 12, 'bull_rsi_ob': 83, 'bull_adx_thresh': 5.687599270552334, 'bull_atr_min_pct': 0.02860726444454075, 'bull_atr_max_pct': 0.07764104542589233, 'bull_tp_mult': 2.19176971634113, 'bull_tsl_mult': 0.5503742721977106, 'bull_time_stop': 36, 'bull_use_sma': True, 'bull_use_ema': True, 'bull_use_atr': True, 'bull_use_adx': True, 'bull_use_spike': True, 'bull_rsi_required': True, 'bear_strategy': 'breakout', 'bear_bb_std_mult': 2.0732760340070837, 'bear_rsi_os': 24, 'bear_rsi_ob': 69, 'bear_adx_thresh': 12.420364162864802, 'bear_atr_min_pct': 0.023089252670072585, 'bear_atr_max_pct': 0.09566228401194629, 'bear_tp_mult': 1.391395675459223, 'bear_tsl_mult': 0.5691303301855014, 'bear_time_stop': 136, 'bear_use_sma': False, 'bear_use_ema': False, 'bear_use_atr': False, 'bear_use_adx': True, 'bear_use_spike': False, 'bear_rsi_required': True, 'sideways_strategy': 'breakout', 'sideways_bb_std_mult': 2.1656036387629127, 'sideways_rsi_os': 35, 'sideways_rsi_ob': 54, 'sideways_adx_thresh': 8.026486805785549, 'sideways_atr_min_pct': 0.028264645330885508, 'sideways_atr_max_pct': 0.09876389750080396, 'sideways_tp_mult': 2.9173617651447517, 'sideways_tsl_mult': 0.03578937851206347, 'sideways_time_stop': 78, 'sideways_use_sma': True, 'sideways_use_ema': False, 'sideways_use_atr': True, 'sideways_use_adx': False, 'sideways_use_spike': False, 'sideways_rsi_required': False}.
[I 2025-08-31 11:07:54,277] Trial 90 finished with values: [-0.1484894025017771, 0.1482174635383001] and parameters: {'p_sma': 17, 'p_std': 6, 'p_atr': 21, 'p_adx': 30, 'rsi_period': 68, 'ema1': 10, 'ema2': 50, 'slip_atr_k': 0.01546356805074911, 'slip_spread_k': 0.6320372886348758, 'spread_hl_frac': 0.016258063348017694, 'bb_std_mult': 1.6865926529693187, 'rsi_os': 30, 'rsi_ob': 83, 'vol_spike': 0.07459950620818041, 'adx_thresh': 18.948674067600546, 'atr_min_pct': 0.009485221525385449, 'atr_max_pct': 0.07073906121614905, 'tp_mult': 1.5347011047649366, 'tsl_mult': 0.9035287717711694, 'strategy': 'breakout', 'time_stop': 208, 'use_sma': False, 'use_atr': False, 'use_adx': False, 'use_ema': True, 'use_spike': False, 'rsi_required': True, 'edge_k': 0.7754137113472213, 'edge_cap': 0.8102921162730784, 'bull_strategy': 'breakout', 'bull_bb_std_mult': 2.672144578075969, 'bull_rsi_os': 11, 'bull_rsi_ob': 77, 'bull_adx_thresh': 5.677562606877161, 'bull_atr_min_pct': 0.008877635957697784, 'bull_atr_max_pct': 0.07787339003787118, 'bull_tp_mult': 1.7069842911336242, 'bull_tsl_mult': 0.2726540578322951, 'bull_time_stop': 32, 'bull_use_sma': True, 'bull_use_ema': True, 'bull_use_atr': True, 'bull_use_adx': True, 'bull_use_spike': True, 'bull_rsi_required': True, 'bear_strategy': 'breakout', 'bear_bb_std_mult': 2.3352312137251414, 'bear_rsi_os': 12, 'bear_rsi_ob': 74, 'bear_adx_thresh': 18.74595862151392, 'bear_atr_min_pct': 0.02854179886007354, 'bear_atr_max_pct': 0.0779323136394224, 'bear_tp_mult': 2.77662461081985, 'bear_tsl_mult': 0.03609803502254183, 'bear_time_stop': 136, 'bear_use_sma': True, 'bear_use_ema': False, 'bear_use_atr': False, 'bear_use_adx': True, 'bear_use_spike': False, 'bear_rsi_required': True, 'sideways_strategy': 'breakout', 'sideways_bb_std_mult': 2.1500906684022048, 'sideways_rsi_os': 55, 'sideways_rsi_ob': 48, 'sideways_adx_thresh': 7.815216879663368, 'sideways_atr_min_pct': 0.0019406466238912532, 'sideways_atr_max_pct': 0.0586469716177721, 'sideways_tp_mult': 2.549056682451634, 'sideways_tsl_mult': 0.0528613007139527, 'sideways_time_stop': 93, 'sideways_use_sma': True, 'sideways_use_ema': False, 'sideways_use_atr': True, 'sideways_use_adx': False, 'sideways_use_spike': False, 'sideways_rsi_required': False}.
[I 2025-08-31 11:07:54,521] Trial 93 finished with values: [-1000000000.0, 1000000000.0] and parameters: {'p_sma': 31, 'p_std': 46, 'p_atr': 21, 'p_adx': 30, 'rsi_period': 67, 'ema1': 5, 'ema2': 36, 'slip_atr_k': 0.0846407143004019, 'slip_spread_k': 0.7342887496662966, 'spread_hl_frac': 0.01581489234272931, 'bb_std_mult': 1.566562525381136, 'rsi_os': 30, 'rsi_ob': 49, 'vol_spike': 0.14460286133394212, 'adx_thresh': 23.259463098638104, 'atr_min_pct': 0.0056829446883222105, 'atr_max_pct': 0.114612312152227, 'tp_mult': 1.6648153984893774, 'tsl_mult': 0.24720547228856316, 'strategy': 'breakout', 'time_stop': 172, 'use_sma': False, 'use_atr': False, 'use_adx': True, 'use_ema': True, 'use_spike': False, 'rsi_required': True, 'edge_k': 0.5882857938827029, 'edge_cap': 0.09352867541589266, 'bull_strategy': 'mean_reversion', 'bull_bb_std_mult': 1.835590765043285, 'bull_rsi_os': 11, 'bull_rsi_ob': 58, 'bull_adx_thresh': 6.766719036490933, 'bull_atr_min_pct': 0.028690452277261774, 'bull_atr_max_pct': 0.06517688306516926, 'bull_tp_mult': 2.190590071259105, 'bull_tsl_mult': 0.18768917860329246, 'bull_time_stop': 39, 'bull_use_sma': True, 'bull_use_ema': False, 'bull_use_atr': True, 'bull_use_adx': False, 'bull_use_spike': False, 'bull_rsi_required': True, 'bear_strategy': 'mean_reversion', 'bear_bb_std_mult': 2.2412077232206022, 'bear_rsi_os': 13, 'bear_rsi_ob': 69, 'bear_adx_thresh': 13.61423182557946, 'bear_atr_min_pct': 0.02145008691701446, 'bear_atr_max_pct': 0.07760387657959168, 'bear_tp_mult': 1.3608336669083116, 'bear_tsl_mult': 0.5650462642375372, 'bear_time_stop': 55, 'bear_use_sma': False, 'bear_use_ema': False, 'bear_use_atr': True, 'bear_use_adx': True, 'bear_use_spike': False, 'bear_rsi_required': True, 'sideways_strategy': 'breakout', 'sideways_bb_std_mult': 1.5213613235424253, 'sideways_rsi_os': 27, 'sideways_rsi_ob': 78, 'sideways_adx_thresh': 12.593920743930413, 'sideways_atr_min_pct': 0.009873716525535703, 'sideways_atr_max_pct': 0.09848148127938455, 'sideways_tp_mult': 1.6748193473885578, 'sideways_tsl_mult': 0.8099967345375612, 'sideways_time_stop': 78, 'sideways_use_sma': True, 'sideways_use_ema': True, 'sideways_use_atr': True, 'sideways_use_adx': False, 'sideways_use_spike': False, 'sideways_rsi_required': True}.
[I 2025-08-31 11:08:26,312] Trial 94 finished with values: [-1000000000.0, 1000000000.0] and parameters: {'p_sma': 54, 'p_std': 44, 'p_atr': 28, 'p_adx': 30, 'rsi_period': 11, 'ema1': 5, 'ema2': 46, 'slip_atr_k': 0.12837243181878877, 'slip_spread_k': 0.5296688343746719, 'spread_hl_frac': 0.015739790647457612, 'bb_std_mult': 1.5558787430303629, 'rsi_os': 30, 'rsi_ob': 71, 'vol_spike': 0.027408688939510276, 'adx_thresh': 33.17264521594429, 'atr_min_pct': 0.012878960331676804, 'atr_max_pct': 0.11435827348037274, 'tp_mult': 2.7912795502331402, 'tsl_mult': 0.5099212917470659, 'strategy': 'breakout', 'time_stop': 149, 'use_sma': False, 'use_atr': False, 'use_adx': True, 'use_ema': True, 'use_spike': False, 'rsi_required': False, 'edge_k': 1.5149693265092, 'edge_cap': 0.7776637615062001, 'bull_strategy': 'mean_reversion', 'bull_bb_std_mult': 1.8131567169017004, 'bull_rsi_os': 23, 'bull_rsi_ob': 71, 'bull_adx_thresh': 6.7862940888977885, 'bull_atr_min_pct': 0.02901108291375299, 'bull_atr_max_pct': 0.05911092605096529, 'bull_tp_mult': 1.9536557549046472, 'bull_tsl_mult': 0.9391788992869388, 'bull_time_stop': 192, 'bull_use_sma': True, 'bull_use_ema': False, 'bull_use_atr': False, 'bull_use_adx': False, 'bull_use_spike': False, 'bull_rsi_required': True, 'bear_strategy': 'mean_reversion', 'bear_bb_std_mult': 1.953955403614227, 'bear_rsi_os': 12, 'bear_rsi_ob': 74, 'bear_adx_thresh': 12.412695648317708, 'bear_atr_min_pct': 0.028525924770246985, 'bear_atr_max_pct': 0.03535789347120141, 'bear_tp_mult': 1.7608554224511916, 'bear_tsl_mult': 0.5573009208866122, 'bear_time_stop': 171, 'bear_use_sma': False, 'bear_use_ema': False, 'bear_use_atr': True, 'bear_use_adx': True, 'bear_use_spike': False, 'bear_rsi_required': True, 'sideways_strategy': 'breakout', 'sideways_bb_std_mult': 1.5346988166966837, 'sideways_rsi_os': 55, 'sideways_rsi_ob': 70, 'sideways_adx_thresh': 7.998658697419179, 'sideways_atr_min_pct': 0.020965403506250622, 'sideways_atr_max_pct': 0.06828490511237806, 'sideways_tp_mult': 1.6147814664537337, 'sideways_tsl_mult': 0.6904757629506298, 'sideways_time_stop': 102, 'sideways_use_sma': True, 'sideways_use_ema': True, 'sideways_use_atr': True, 'sideways_use_adx': False, 'sideways_use_spike': False, 'sideways_rsi_required': True}.
[I 2025-08-31 11:08:26,490] Trial 95 finished with values: [-1000000000.0, 1000000000.0] and parameters: {'p_sma': 11, 'p_std': 44, 'p_atr': 26, 'p_adx': 28, 'rsi_period': 11, 'ema1': 5, 'ema2': 58, 'slip_atr_k': 0.0809319922004895, 'slip_spread_k': 0.5438180544541084, 'spread_hl_frac': 0.015320295451811515, 'bb_std_mult': 3.429187594986515, 'rsi_os': 30, 'rsi_ob': 89, 'vol_spike': 0.14232524555725118, 'adx_thresh': 33.34488442283404, 'atr_min_pct': 0.005834442220323035, 'atr_max_pct': 0.01795131616239897, 'tp_mult': 1.011964011434543, 'tsl_mult': 0.5142854362285517, 'strategy': 'breakout', 'time_stop': 30, 'use_sma': False, 'use_atr': True, 'use_adx': True, 'use_ema': False, 'use_spike': False, 'rsi_required': False, 'edge_k': 0.5799223369872812, 'edge_cap': 0.6039673057906098, 'bull_strategy': 'breakout', 'bull_bb_std_mult': 2.1690680560410867, 'bull_rsi_os': 38, 'bull_rsi_ob': 74, 'bull_adx_thresh': 6.728026104173997, 'bull_atr_min_pct': 0.006781044528536968, 'bull_atr_max_pct': 0.08234149757041956, 'bull_tp_mult': 2.3816915050356218, 'bull_tsl_mult': 0.9492924874444224, 'bull_time_stop': 273, 'bull_use_sma': True, 'bull_use_ema': False, 'bull_use_atr': False, 'bull_use_adx': False, 'bull_use_spike': False, 'bull_rsi_required': False, 'bear_strategy': 'mean_reversion', 'bear_bb_std_mult': 1.917871667249021, 'bear_rsi_os': 12, 'bear_rsi_ob': 82, 'bear_adx_thresh': 13.648649708553709, 'bear_atr_min_pct': 0.02841160214023382, 'bear_atr_max_pct': 0.035096637590490476, 'bear_tp_mult': 1.1029767704547144, 'bear_tsl_mult': 0.9416573727647681, 'bear_time_stop': 172, 'bear_use_sma': False, 'bear_use_ema': False, 'bear_use_atr': True, 'bear_use_adx': False, 'bear_use_spike': True, 'bear_rsi_required': True, 'sideways_strategy': 'mean_reversion', 'sideways_bb_std_mult': 1.520423757026637, 'sideways_rsi_os': 27, 'sideways_rsi_ob': 45, 'sideways_adx_thresh': 11.235056407571927, 'sideways_atr_min_pct': 0.021679474642991126, 'sideways_atr_max_pct': 0.10222872071047749, 'sideways_tp_mult': 1.680234445129305, 'sideways_tsl_mult': 0.8099112935032066, 'sideways_time_stop': 58, 'sideways_use_sma': True, 'sideways_use_ema': True, 'sideways_use_atr': False, 'sideways_use_adx': True, 'sideways_use_spike': False, 'sideways_rsi_required': True}.
[I 2025-08-31 11:08:26,635] Trial 96 finished with values: [-1000000000.0, 1000000000.0] and parameters: {'p_sma': 5, 'p_std': 27, 'p_atr': 26, 'p_adx': 28, 'rsi_period': 34, 'ema1': 5, 'ema2': 10, 'slip_atr_k': 0.1301541156034629, 'slip_spread_k': 0.2831905713824444, 'spread_hl_frac': 0.012516235980291094, 'bb_std_mult': 1.5656505403738479, 'rsi_os': 29, 'rsi_ob': 72, 'vol_spike': 0.14310885171329887, 'adx_thresh': 20.6008515388103, 'atr_min_pct': 0.01609463511058515, 'atr_max_pct': 0.1347576896730131, 'tp_mult': 2.3523374784849858, 'tsl_mult': 0.5166619527967845, 'strategy': 'breakout', 'time_stop': 27, 'use_sma': False, 'use_atr': True, 'use_adx': True, 'use_ema': False, 'use_spike': False, 'rsi_required': False, 'edge_k': 0.5788996545272804, 'edge_cap': 0.5197182749010582, 'bull_strategy': 'mean_reversion', 'bull_bb_std_mult': 1.8317200785624719, 'bull_rsi_os': 38, 'bull_rsi_ob': 74, 'bull_adx_thresh': 6.909183581344611, 'bull_atr_min_pct': 0.006559891252371226, 'bull_atr_max_pct': 0.08859338916357497, 'bull_tp_mult': 2.35977038086712, 'bull_tsl_mult': 0.17743929779575796, 'bull_time_stop': 189, 'bull_use_sma': True, 'bull_use_ema': False, 'bull_use_atr': False, 'bull_use_adx': False, 'bull_use_spike': False, 'bull_rsi_required': False, 'bear_strategy': 'mean_reversion', 'bear_bb_std_mult': 1.9714845417090003, 'bear_rsi_os': 19, 'bear_rsi_ob': 82, 'bear_adx_thresh': 20.27945421754137, 'bear_atr_min_pct': 0.024567057375839856, 'bear_atr_max_pct': 0.06977596335440098, 'bear_tp_mult': 1.9495312746090798, 'bear_tsl_mult': 0.9788807746771874, 'bear_time_stop': 171, 'bear_use_sma': False, 'bear_use_ema': False, 'bear_use_atr': True, 'bear_use_adx': False, 'bear_use_spike': True, 'bear_rsi_required': False, 'sideways_strategy': 'mean_reversion', 'sideways_bb_std_mult': 1.505103284462112, 'sideways_rsi_os': 29, 'sideways_rsi_ob': 79, 'sideways_adx_thresh': 11.529439527895196, 'sideways_atr_min_pct': 0.025483703416112335, 'sideways_atr_max_pct': 0.08027362436355437, 'sideways_tp_mult': 1.6444300856164553, 'sideways_tsl_mult': 0.08983604102981846, 'sideways_time_stop': 257, 'sideways_use_sma': False, 'sideways_use_ema': True, 'sideways_use_atr': False, 'sideways_use_adx': True, 'sideways_use_spike': True, 'sideways_rsi_required': True}.
[I 2025-08-31 11:08:26,905] Trial 97 finished with values: [-1000000000.0, 1000000000.0] and parameters: {'p_sma': 12, 'p_std': 30, 'p_atr': 23, 'p_adx': 28, 'rsi_period': 11, 'ema1': 9, 'ema2': 58, 'slip_atr_k': 0.1115508155325842, 'slip_spread_k': 0.07544939003754059, 'spread_hl_frac': 0.012697009345609096, 'bb_std_mult': 1.122883041301906, 'rsi_os': 23, 'rsi_ob': 92, 'vol_spike': 0.20684004308309317, 'adx_thresh': 16.84193295873762, 'atr_min_pct': 0.012683761736989277, 'atr_max_pct': 0.02339165433625018, 'tp_mult': 1.7866182501525103, 'tsl_mult': 0.5191332422856304, 'strategy': 'breakout', 'time_stop': 150, 'use_sma': False, 'use_atr': True, 'use_adx': True, 'use_ema': False, 'use_spike': False, 'rsi_required': False, 'edge_k': 1.4709347807745814, 'edge_cap': 0.6135101029574627, 'bull_strategy': 'mean_reversion', 'bull_bb_std_mult': 1.585117123738108, 'bull_rsi_os': 38, 'bull_rsi_ob': 53, 'bull_adx_thresh': 7.131846288355523, 'bull_atr_min_pct': 0.006900644456823613, 'bull_atr_max_pct': 0.058017314904531776, 'bull_tp_mult': 1.9600493940497008, 'bull_tsl_mult': 0.4810581959190493, 'bull_time_stop': 269, 'bull_use_sma': True, 'bull_use_ema': False, 'bull_use_atr': False, 'bull_use_adx': False, 'bull_use_spike': True, 'bull_rsi_required': False, 'bear_strategy': 'mean_reversion', 'bear_bb_std_mult': 1.9107682902558483, 'bear_rsi_os': 21, 'bear_rsi_ob': 82, 'bear_adx_thresh': 14.800093978774406, 'bear_atr_min_pct': 0.02624108930320157, 'bear_atr_max_pct': 0.12409101177084461, 'bear_tp_mult': 1.9646800906317332, 'bear_tsl_mult': 0.3910495213721445, 'bear_time_stop': 170, 'bear_use_sma': False, 'bear_use_ema': False, 'bear_use_atr': False, 'bear_use_adx': False, 'bear_use_spike': True, 'bear_rsi_required': False, 'sideways_strategy': 'mean_reversion', 'sideways_bb_std_mult': 1.6946503146781011, 'sideways_rsi_os': 22, 'sideways_rsi_ob': 87, 'sideways_adx_thresh': 9.1963590569771, 'sideways_atr_min_pct': 0.012350906503598873, 'sideways_atr_max_pct': 0.08131354264759849, 'sideways_tp_mult': 1.480855456652011, 'sideways_tsl_mult': 0.10158414838932645, 'sideways_time_stop': 167, 'sideways_use_sma': False, 'sideways_use_ema': True, 'sideways_use_atr': False, 'sideways_use_adx': True, 'sideways_use_spike': True, 'sideways_rsi_required': True}.
[I 2025-08-31 11:08:58,644] Trial 98 finished with values: [-1000000000.0, 1000000000.0] and parameters: {'p_sma': 12, 'p_std': 43, 'p_atr': 23, 'p_adx': 28, 'rsi_period': 34, 'ema1': 9, 'ema2': 15, 'slip_atr_k': 0.05286329391995773, 'slip_spread_k': 0.1847311164941619, 'spread_hl_frac': 0.01432795465981028, 'bb_std_mult': 1.3521627795720899, 'rsi_os': 23, 'rsi_ob': 92, 'vol_spike': 0.012793039463430508, 'adx_thresh': 11.65394630016958, 'atr_min_pct': 0.016362981014972085, 'atr_max_pct': 0.1346116625117363, 'tp_mult': 2.055509533232849, 'tsl_mult': 0.5530807046290394, 'strategy': 'breakout', 'time_stop': 30, 'use_sma': False, 'use_atr': True, 'use_adx': True, 'use_ema': False, 'use_spike': False, 'rsi_required': False, 'edge_k': 0.4747794566946625, 'edge_cap': 0.6009607498932683, 'bull_strategy': 'mean_reversion', 'bull_bb_std_mult': 2.790264886010739, 'bull_rsi_os': 7, 'bull_rsi_ob': 69, 'bull_adx_thresh': 5.028266307909671, 'bull_atr_min_pct': 0.016014517941989912, 'bull_atr_max_pct': 0.04263818192823727, 'bull_tp_mult': 1.9097470836329997, 'bull_tsl_mult': 0.7151408883809237, 'bull_time_stop': 288, 'bull_use_sma': True, 'bull_use_ema': False, 'bull_use_atr': False, 'bull_use_adx': False, 'bull_use_spike': True, 'bull_rsi_required': False, 'bear_strategy': 'breakout', 'bear_bb_std_mult': 1.5622160704686967, 'bear_rsi_os': 44, 'bear_rsi_ob': 50, 'bear_adx_thresh': 20.223805489584784, 'bear_atr_min_pct': 0.025970888834862368, 'bear_atr_max_pct': 0.0882354770004726, 'bear_tp_mult': 1.961369908573953, 'bear_tsl_mult': 0.9730726718997305, 'bear_time_stop': 112, 'bear_use_sma': False, 'bear_use_ema': False, 'bear_use_atr': False, 'bear_use_adx': False, 'bear_use_spike': True, 'bear_rsi_required': False, 'sideways_strategy': 'mean_reversion', 'sideways_bb_std_mult': 1.6065774587022066, 'sideways_rsi_os': 32, 'sideways_rsi_ob': 65, 'sideways_adx_thresh': 6.8035599914645095, 'sideways_atr_min_pct': 0.024988889057373204, 'sideways_atr_max_pct': 0.04750608983299247, 'sideways_tp_mult': 1.0803680357011172, 'sideways_tsl_mult': 0.44713935029656077, 'sideways_time_stop': 55, 'sideways_use_sma': False, 'sideways_use_ema': True, 'sideways_use_atr': False, 'sideways_use_adx': True, 'sideways_use_spike': True, 'sideways_rsi_required': True}.
