[I 2025-08-31 04:32:53,627] Trial 385 finished with values: [-1000000000.0, 1000000000.0] and parameters: {'p_sma': 18, 'p_std': 15, 'p_atr': 25, 'p_adx': 8, 'rsi_period': 25, 'ema1': 15, 'ema2': 45, 'slip_atr_k': 0.019171379290583712, 'slip_spread_k': 0.001635536288429787, 'spread_hl_frac': 0.02142692956866322, 'bb_std_mult': 2.244314926305707, 'rsi_os': 25, 'rsi_ob': 53, 'vol_spike': 0.044104797991016575, 'adx_thresh': 17.439735018788145, 'atr_min_pct': 0.006353012841074859, 'atr_max_pct': 0.12226504671868128, 'tp_mult': 2.7397854756645383, 'tsl_mult': 0.6031259027496468, 'strategy': 'breakout', 'time_stop': 39, 'use_sma': True, 'use_atr': True, 'use_adx': False, 'use_ema': False, 'use_spike': True, 'rsi_required': False, 'edge_k': 1.4556163039374361, 'edge_cap': 0.99995983826755, 'bull_strategy': 'mean_reversion', 'bull_bb_std_mult': 3.519144413304143, 'bull_rsi_os': 31, 'bull_rsi_ob': 81, 'bull_adx_thresh': 8.90178409421805, 'bull_atr_min_pct': 0.0028440759000509393, 'bull_atr_max_pct': 0.08953085153890644, 'bull_tp_mult': 2.6040252242311897, 'bull_tsl_mult': 0.8625286891158211, 'bull_time_stop': 43, 'bull_use_sma': False, 'bull_use_ema': True, 'bull_use_atr': False, 'bull_use_adx': True, 'bull_use_spike': False, 'bull_rsi_required': False, 'bear_strategy': 'mean_reversion', 'bear_bb_std_mult': 2.861530507213569, 'bear_rsi_os': 11, 'bear_rsi_ob': 49, 'bear_adx_thresh': 19.326613818035696, 'bear_atr_min_pct': 0.02526272408500512, 'bear_atr_max_pct': 0.07222870146468967, 'bear_tp_mult': 2.5263766327106763, 'bear_tsl_mult': 0.40066554788343656, 'bear_time_stop': 190, 'bear_use_sma': True, 'bear_use_ema': False, 'bear_use_atr': False, 'bear_use_adx': True, 'bear_use_spike': False, 'bear_rsi_required': False, 'sideways_strategy': 'mean_reversion', 'sideways_bb_std_mult': 0.8446790268640907, 'sideways_rsi_os': 25, 'sideways_rsi_ob': 52, 'sideways_adx_thresh': 12.40680460832347, 'sideways_atr_min_pct': 0.015016159262622345, 'sideways_atr_max_pct': 0.11574380056863114, 'sideways_tp_mult': 1.410412557223779, 'sideways_tsl_mult': 0.6796347154518151, 'sideways_time_stop': 86, 'sideways_use_sma': False, 'sideways_use_ema': False, 'sideways_use_atr': False, 'sideways_use_adx': False, 'sideways_use_spike': True, 'sideways_rsi_required': True}.
[I 2025-08-31 04:32:54,326] Trial 388 finished with values: [-1000000000.0, 1000000000.0] and parameters: {'p_sma': 34, 'p_std': 36, 'p_atr': 29, 'p_adx': 9, 'rsi_period': 20, 'ema1': 15, 'ema2': 55, 'slip_atr_k': 0.01947241272980618, 'slip_spread_k': 0.992967583111473, 'spread_hl_frac': 0.001126219438541045, 'bb_std_mult': 1.729268361274806, 'rsi_os': 43, 'rsi_ob': 59, 'vol_spike': 0.041260935912659266, 'adx_thresh': 17.42423141682862, 'atr_min_pct': 0.025878780459082387, 'atr_max_pct': 0.09234322196767537, 'tp_mult': 2.537090053501813, 'tsl_mult': 0.8467139445323236, 'strategy': 'mean_reversion', 'time_stop': 38, 'use_sma': True, 'use_atr': True, 'use_adx': False, 'use_ema': False, 'use_spike': True, 'rsi_required': False, 'edge_k': 0.8201924162933534, 'edge_cap': 0.37730590837016953, 'bull_strategy': 'mean_reversion', 'bull_bb_std_mult': 3.1921694232563684, 'bull_rsi_os': 15, 'bull_rsi_ob': 73, 'bull_adx_thresh': 32.674035663575715, 'bull_atr_min_pct': 0.0037122305203217947, 'bull_atr_max_pct': 0.06036418301664816, 'bull_tp_mult': 1.0159840623631866, 'bull_tsl_mult': 0.8689332128068623, 'bull_time_stop': 253, 'bull_use_sma': False, 'bull_use_ema': False, 'bull_use_atr': False, 'bull_use_adx': False, 'bull_use_spike': False, 'bull_rsi_required': False, 'bear_strategy': 'mean_reversion', 'bear_bb_std_mult': 2.866027780309336, 'bear_rsi_os': 9, 'bear_rsi_ob': 71, 'bear_adx_thresh': 21.361953351236146, 'bear_atr_min_pct': 0.02528250184962552, 'bear_atr_max_pct': 0.039044169635758415, 'bear_tp_mult': 2.2706829372834876, 'bear_tsl_mult': 0.5139267044184549, 'bear_time_stop': 174, 'bear_use_sma': False, 'bear_use_ema': True, 'bear_use_atr': False, 'bear_use_adx': True, 'bear_use_spike': True, 'bear_rsi_required': False, 'sideways_strategy': 'breakout', 'sideways_bb_std_mult': 1.0157902176674665, 'sideways_rsi_os': 29, 'sideways_rsi_ob': 56, 'sideways_adx_thresh': 10.964590204629072, 'sideways_atr_min_pct': 0.013069654067097144, 'sideways_atr_max_pct': 0.11014121536345804, 'sideways_tp_mult': 1.7885717356637705, 'sideways_tsl_mult': 0.6660225239071231, 'sideways_time_stop': 52, 'sideways_use_sma': True, 'sideways_use_ema': False, 'sideways_use_atr': False, 'sideways_use_adx': False, 'sideways_use_spike': True, 'sideways_rsi_required': False}.
[I 2025-08-31 04:32:55,184] Trial 389 finished with values: [-1000000000.0, 1000000000.0] and parameters: {'p_sma': 20, 'p_std': 17, 'p_atr': 25, 'p_adx': 8, 'rsi_period': 19, 'ema1': 15, 'ema2': 47, 'slip_atr_k': 0.1534029372396004, 'slip_spread_k': 0.060062116055190795, 'spread_hl_frac': 0.017364690980615115, 'bb_std_mult': 1.7508968936819582, 'rsi_os': 51, 'rsi_ob': 61, 'vol_spike': 0.1566672536660773, 'adx_thresh': 12.642803821609675, 'atr_min_pct': 0.02300630468707211, 'atr_max_pct': 0.12201259439422757, 'tp_mult': 2.5441333251607308, 'tsl_mult': 0.8559450321201926, 'strategy': 'mean_reversion', 'time_stop': 252, 'use_sma': True, 'use_atr': True, 'use_adx': False, 'use_ema': False, 'use_spike': True, 'rsi_required': False, 'edge_k': 0.14953780266462535, 'edge_cap': 0.9786815346838591, 'bull_strategy': 'mean_reversion', 'bull_bb_std_mult': 2.847979148301485, 'bull_rsi_os': 14, 'bull_rsi_ob': 73, 'bull_adx_thresh': 14.5524673169637, 'bull_atr_min_pct': 0.0019391229280342683, 'bull_atr_max_pct': 0.0614767341105969, 'bull_tp_mult': 1.5634432494116821, 'bull_tsl_mult': 0.8685266388785988, 'bull_time_stop': 213, 'bull_use_sma': False, 'bull_use_ema': False, 'bull_use_atr': False, 'bull_use_adx': True, 'bull_use_spike': False, 'bull_rsi_required': False, 'bear_strategy': 'mean_reversion', 'bear_bb_std_mult': 2.2794023674603245, 'bear_rsi_os': 9, 'bear_rsi_ob': 47, 'bear_adx_thresh': 21.200691158110743, 'bear_atr_min_pct': 0.02539849275400076, 'bear_atr_max_pct': 0.040318650020379175, 'bear_tp_mult': 1.7126671898580366, 'bear_tsl_mult': 0.273756185726381, 'bear_time_stop': 202, 'bear_use_sma': True, 'bear_use_ema': True, 'bear_use_atr': True, 'bear_use_adx': True, 'bear_use_spike': True, 'bear_rsi_required': True, 'sideways_strategy': 'breakout', 'sideways_bb_std_mult': 0.7102087683409046, 'sideways_rsi_os': 25, 'sideways_rsi_ob': 52, 'sideways_adx_thresh': 12.697591055937146, 'sideways_atr_min_pct': 0.012846745073416991, 'sideways_atr_max_pct': 0.04445362779102671, 'sideways_tp_mult': 1.0603514326031487, 'sideways_tsl_mult': 0.6794361532276283, 'sideways_time_stop': 83, 'sideways_use_sma': False, 'sideways_use_ema': False, 'sideways_use_atr': False, 'sideways_use_adx': False, 'sideways_use_spike': True, 'sideways_rsi_required': True}.
[I 2025-08-31 04:33:45,496] Trial 390 finished with values: [-0.01420767113050947, 0.014168876785286647] and parameters: {'p_sma': 53, 'p_std': 17, 'p_atr': 25, 'p_adx': 8, 'rsi_period': 20, 'ema1': 15, 'ema2': 29, 'slip_atr_k': 0.2024895893535038, 'slip_spread_k': 0.0548375910829515, 'spread_hl_frac': 0.004722247754874415, 'bb_std_mult': 2.243660691753135, 'rsi_os': 46, 'rsi_ob': 61, 'vol_spike': 0.15550238300420224, 'adx_thresh': 13.470960010495448, 'atr_min_pct': 9.226675352389142e-05, 'atr_max_pct': 0.12212394180349458, 'tp_mult': 2.4156756905344077, 'tsl_mult': 0.8823115819699509, 'strategy': 'mean_reversion', 'time_stop': 9, 'use_sma': False, 'use_atr': False, 'use_adx': False, 'use_ema': False, 'use_spike': True, 'rsi_required': False, 'edge_k': 0.817004559673641, 'edge_cap': 0.3324963956401854, 'bull_strategy': 'mean_reversion', 'bull_bb_std_mult': 3.394956916336104, 'bull_rsi_os': 14, 'bull_rsi_ob': 57, 'bull_adx_thresh': 14.468495326563474, 'bull_atr_min_pct': 0.001937581810359868, 'bull_atr_max_pct': 0.07252965448933577, 'bull_tp_mult': 1.1020822221412878, 'bull_tsl_mult': 0.3168698893978983, 'bull_time_stop': 190, 'bull_use_sma': False, 'bull_use_ema': False, 'bull_use_atr': True, 'bull_use_adx': True, 'bull_use_spike': False, 'bull_rsi_required': True, 'bear_strategy': 'mean_reversion', 'bear_bb_std_mult': 2.8248029271681214, 'bear_rsi_os': 9, 'bear_rsi_ob': 47, 'bear_adx_thresh': 7.79325608288322, 'bear_atr_min_pct': 0.02268674200605037, 'bear_atr_max_pct': 0.03873810606882574, 'bear_tp_mult': 1.0849198538202163, 'bear_tsl_mult': 0.5190446075243728, 'bear_time_stop': 200, 'bear_use_sma': True, 'bear_use_ema': True, 'bear_use_atr': True, 'bear_use_adx': True, 'bear_use_spike': True, 'bear_rsi_required': True, 'sideways_strategy': 'breakout', 'sideways_bb_std_mult': 0.5533416728605383, 'sideways_rsi_os': 25, 'sideways_rsi_ob': 56, 'sideways_adx_thresh': 12.58310316271137, 'sideways_atr_min_pct': 0.013093758146885286, 'sideways_atr_max_pct': 0.04469266026247733, 'sideways_tp_mult': 2.1119069606894336, 'sideways_tsl_mult': 0.6717771827012653, 'sideways_time_stop': 89, 'sideways_use_sma': False, 'sideways_use_ema': False, 'sideways_use_atr': False, 'sideways_use_adx': True, 'sideways_use_spike': True, 'sideways_rsi_required': True}.
[I 2025-08-31 04:33:46,394] Trial 392 finished with values: [-1000000000.0, 1000000000.0] and parameters: {'p_sma': 23, 'p_std': 18, 'p_atr': 24, 'p_adx': 10, 'rsi_period': 17, 'ema1': 13, 'ema2': 29, 'slip_atr_k': 0.15391323864684026, 'slip_spread_k': 0.060077896873780526, 'spread_hl_frac': 0.034466793285303485, 'bb_std_mult': 2.0418616824682463, 'rsi_os': 29, 'rsi_ob': 61, 'vol_spike': 0.25309457815591746, 'adx_thresh': 13.382174019447135, 'atr_min_pct': 0.00010299302156548291, 'atr_max_pct': 0.13878003779852166, 'tp_mult': 2.441173019455865, 'tsl_mult': 0.881260275637805, 'strategy': 'mean_reversion', 'time_stop': 289, 'use_sma': False, 'use_atr': False, 'use_adx': False, 'use_ema': False, 'use_spike': True, 'rsi_required': False, 'edge_k': 1.4021532471892668, 'edge_cap': 0.3479651513614823, 'bull_strategy': 'breakout', 'bull_bb_std_mult': 2.8065046842117862, 'bull_rsi_os': 14, 'bull_rsi_ob': 76, 'bull_adx_thresh': 14.367263387646972, 'bull_atr_min_pct': 0.0018815295735690445, 'bull_atr_max_pct': 0.05072947011271882, 'bull_tp_mult': 1.0849904903352892, 'bull_tsl_mult': 0.31964062547050454, 'bull_time_stop': 188, 'bull_use_sma': False, 'bull_use_ema': False, 'bull_use_atr': True, 'bull_use_adx': True, 'bull_use_spike': False, 'bull_rsi_required': True, 'bear_strategy': 'mean_reversion', 'bear_bb_std_mult': 1.677271791942558, 'bear_rsi_os': 7, 'bear_rsi_ob': 47, 'bear_adx_thresh': 22.42519596485809, 'bear_atr_min_pct': 0.023540679268703565, 'bear_atr_max_pct': 0.04246091104521009, 'bear_tp_mult': 1.0881479174280408, 'bear_tsl_mult': 0.15000346859478436, 'bear_time_stop': 200, 'bear_use_sma': True, 'bear_use_ema': True, 'bear_use_atr': True, 'bear_use_adx': True, 'bear_use_spike': True, 'bear_rsi_required': True, 'sideways_strategy': 'breakout', 'sideways_bb_std_mult': 1.8154247630566027, 'sideways_rsi_os': 26, 'sideways_rsi_ob': 95, 'sideways_adx_thresh': 21.05636906655111, 'sideways_atr_min_pct': 0.012704349389798234, 'sideways_atr_max_pct': 0.1085298173734324, 'sideways_tp_mult': 2.1051720935276896, 'sideways_tsl_mult': 0.31989859063002657, 'sideways_time_stop': 239, 'sideways_use_sma': False, 'sideways_use_ema': False, 'sideways_use_atr': False, 'sideways_use_adx': True, 'sideways_use_spike': True, 'sideways_rsi_required': True}.
[I 2025-08-31 04:33:47,366] Trial 391 finished with values: [-1000000000.0, 1000000000.0] and parameters: {'p_sma': 53, 'p_std': 18, 'p_atr': 10, 'p_adx': 16, 'rsi_period': 42, 'ema1': 10, 'ema2': 55, 'slip_atr_k': 0.20056259094274756, 'slip_spread_k': 0.06060073789736459, 'spread_hl_frac': 0.011258103753616034, 'bb_std_mult': 1.5912970289949393, 'rsi_os': 22, 'rsi_ob': 61, 'vol_spike': 0.2542460670906155, 'adx_thresh': 13.538018758467999, 'atr_min_pct': 0.02379692940695826, 'atr_max_pct': 0.13264079917138, 'tp_mult': 2.5369202491714216, 'tsl_mult': 0.16855923817757146, 'strategy': 'mean_reversion', 'time_stop': 157, 'use_sma': False, 'use_atr': False, 'use_adx': False, 'use_ema': False, 'use_spike': True, 'rsi_required': False, 'edge_k': 1.4032085543049588, 'edge_cap': 0.9472788213504849, 'bull_strategy': 'breakout', 'bull_bb_std_mult': 3.3868869364708907, 'bull_rsi_os': 14, 'bull_rsi_ob': 76, 'bull_adx_thresh': 16.7627018522286, 'bull_atr_min_pct': 0.016153460776059815, 'bull_atr_max_pct': 0.1135967839626311, 'bull_tp_mult': 1.4392507295526535, 'bull_tsl_mult': 0.9209598646555823, 'bull_time_stop': 130, 'bull_use_sma': False, 'bull_use_ema': False, 'bull_use_atr': True, 'bull_use_adx': True, 'bull_use_spike': False, 'bull_rsi_required': True, 'bear_strategy': 'mean_reversion', 'bear_bb_std_mult': 0.9258819404387845, 'bear_rsi_os': 54, 'bear_rsi_ob': 47, 'bear_adx_thresh': 20.156526304216005, 'bear_atr_min_pct': 0.02254828527457333, 'bear_atr_max_pct': 0.03972613949695111, 'bear_tp_mult': 2.288355931997308, 'bear_tsl_mult': 0.27898689985974845, 'bear_time_stop': 198, 'bear_use_sma': True, 'bear_use_ema': True, 'bear_use_atr': True, 'bear_use_adx': True, 'bear_use_spike': True, 'bear_rsi_required': True, 'sideways_strategy': 'breakout', 'sideways_bb_std_mult': 2.642389920008757, 'sideways_rsi_os': 26, 'sideways_rsi_ob': 56, 'sideways_adx_thresh': 11.212339273181238, 'sideways_atr_min_pct': 0.012903960955922477, 'sideways_atr_max_pct': 0.10981930281650147, 'sideways_tp_mult': 1.0626002872604126, 'sideways_tsl_mult': 0.3256076926845507, 'sideways_time_stop': 139, 'sideways_use_sma': False, 'sideways_use_ema': False, 'sideways_use_atr': False, 'sideways_use_adx': True, 'sideways_use_spike': True, 'sideways_rsi_required': True}.
[I 2025-08-31 04:33:47,367] Trial 393 finished with values: [-1000000000.0, 1000000000.0] and parameters: {'p_sma': 23, 'p_std': 51, 'p_atr': 10, 'p_adx': 10, 'rsi_period': 42, 'ema1': 9, 'ema2': 29, 'slip_atr_k': 0.19960881207988818, 'slip_spread_k': 0.6277562285704767, 'spread_hl_frac': 0.03425001298416788, 'bb_std_mult': 2.0561439925394662, 'rsi_os': 45, 'rsi_ob': 51, 'vol_spike': 0.01780900365713392, 'adx_thresh': 13.690712326295266, 'atr_min_pct': 0.02389477402591402, 'atr_max_pct': 0.13018241699296035, 'tp_mult': 2.431132673379183, 'tsl_mult': 0.9225937752661376, 'strategy': 'breakout', 'time_stop': 9, 'use_sma': False, 'use_atr': False, 'use_adx': False, 'use_ema': True, 'use_spike': False, 'rsi_required': False, 'edge_k': 1.3936197175370169, 'edge_cap': 0.9518159949447178, 'bull_strategy': 'breakout', 'bull_bb_std_mult': 3.394912909011401, 'bull_rsi_os': 28, 'bull_rsi_ob': 76, 'bull_adx_thresh': 25.336099303472917, 'bull_atr_min_pct': 0.0008149027117042653, 'bull_atr_max_pct': 0.05243076679015332, 'bull_tp_mult': 1.646025478927444, 'bull_tsl_mult': 0.6646614960880339, 'bull_time_stop': 130, 'bull_use_sma': False, 'bull_use_ema': False, 'bull_use_atr': True, 'bull_use_adx': True, 'bull_use_spike': True, 'bull_rsi_required': True, 'bear_strategy': 'mean_reversion', 'bear_bb_std_mult': 1.7102586010394936, 'bear_rsi_os': 7, 'bear_rsi_ob': 51, 'bear_adx_thresh': 22.600947044382345, 'bear_atr_min_pct': 0.022613481175278283, 'bear_atr_max_pct': 0.10237318181393906, 'bear_tp_mult': 1.7934127913807492, 'bear_tsl_mult': 0.09246614777814127, 'bear_time_stop': 201, 'bear_use_sma': True, 'bear_use_ema': True, 'bear_use_atr': True, 'bear_use_adx': True, 'bear_use_spike': True, 'bear_rsi_required': True, 'sideways_strategy': 'mean_reversion', 'sideways_bb_std_mult': 3.5227310710868878, 'sideways_rsi_os': 27, 'sideways_rsi_ob': 58, 'sideways_adx_thresh': 11.42249296758339, 'sideways_atr_min_pct': 0.009080646653911315, 'sideways_atr_max_pct': 0.08422751095027695, 'sideways_tp_mult': 2.118124069894559, 'sideways_tsl_mult': 0.5311333058868127, 'sideways_time_stop': 239, 'sideways_use_sma': False, 'sideways_use_ema': False, 'sideways_use_atr': False, 'sideways_use_adx': True, 'sideways_use_spike': True, 'sideways_rsi_required': True}.
[I 2025-08-31 04:34:34,452] Trial 397 finished with values: [-1000000000.0, 1000000000.0] and parameters: {'p_sma': 56, 'p_std': 58, 'p_atr': 18, 'p_adx': 27, 'rsi_period': 38, 'ema1': 14, 'ema2': 13, 'slip_atr_k': 0.02798127433541337, 'slip_spread_k': 0.6894556415553748, 'spread_hl_frac': 0.008986278073571592, 'bb_std_mult': 3.0815847565859467, 'rsi_os': 29, 'rsi_ob': 58, 'vol_spike': 0.024535122679383393, 'adx_thresh': 10.580794303141403, 'atr_min_pct': 0.02291966927384375, 'atr_max_pct': 0.12472473324122467, 'tp_mult': 1.6543730381486594, 'tsl_mult': 0.9579053953755556, 'strategy': 'breakout', 'time_stop': 43, 'use_sma': False, 'use_atr': False, 'use_adx': False, 'use_ema': True, 'use_spike': False, 'rsi_required': False, 'edge_k': 1.4864184990961984, 'edge_cap': 0.42018129876446775, 'bull_strategy': 'mean_reversion', 'bull_bb_std_mult': 3.425899900607994, 'bull_rsi_os': 35, 'bull_rsi_ob': 78, 'bull_adx_thresh': 6.0576621182071815, 'bull_atr_min_pct': 0.00019606035716786003, 'bull_atr_max_pct': 0.0709884813538994, 'bull_tp_mult': 1.5753272927466362, 'bull_tsl_mult': 0.15646030160030394, 'bull_time_stop': 275, 'bull_use_sma': False, 'bull_use_ema': False, 'bull_use_atr': True, 'bull_use_adx': True, 'bull_use_spike': True, 'bull_rsi_required': True, 'bear_strategy': 'mean_reversion', 'bear_bb_std_mult': 2.1783399566401354, 'bear_rsi_os': 10, 'bear_rsi_ob': 45, 'bear_adx_thresh': 20.42771874976129, 'bear_atr_min_pct': 0.02349072986445068, 'bear_atr_max_pct': 0.04604323718182672, 'bear_tp_mult': 1.616321501798938, 'bear_tsl_mult': 0.06283438794943064, 'bear_time_stop': 182, 'bear_use_sma': True, 'bear_use_ema': True, 'bear_use_atr': True, 'bear_use_adx': False, 'bear_use_spike': True, 'bear_rsi_required': True, 'sideways_strategy': 'mean_reversion', 'sideways_bb_std_mult': 0.9284738559216374, 'sideways_rsi_os': 29, 'sideways_rsi_ob': 59, 'sideways_adx_thresh': 28.87836294903902, 'sideways_atr_min_pct': 0.014108919090851173, 'sideways_atr_max_pct': 0.11420757279817384, 'sideways_tp_mult': 2.0190373122437553, 'sideways_tsl_mult': 0.5817709390314827, 'sideways_time_stop': 176, 'sideways_use_sma': False, 'sideways_use_ema': False, 'sideways_use_atr': False, 'sideways_use_adx': True, 'sideways_use_spike': True, 'sideways_rsi_required': True}.
[I 2025-08-31 04:34:35,669] Trial 396 finished with values: [-1000000000.0, 1000000000.0] and parameters: {'p_sma': 57, 'p_std': 23, 'p_atr': 18, 'p_adx': 9, 'rsi_period': 21, 'ema1': 27, 'ema2': 28, 'slip_atr_k': 0.027968738357801032, 'slip_spread_k': 0.10515138202862834, 'spread_hl_frac': 0.03250266965310855, 'bb_std_mult': 1.989602358716963, 'rsi_os': 29, 'rsi_ob': 58, 'vol_spike': 0.024328626225997827, 'adx_thresh': 10.762647834664028, 'atr_min_pct': 0.023099913829823373, 'atr_max_pct': 0.12458470332264919, 'tp_mult': 1.135351470889396, 'tsl_mult': 0.9522585663107578, 'strategy': 'breakout', 'time_stop': 216, 'use_sma': False, 'use_atr': False, 'use_adx': False, 'use_ema': True, 'use_spike': False, 'rsi_required': False, 'edge_k': 1.5227829060434344, 'edge_cap': 0.8567133066689598, 'bull_strategy': 'mean_reversion', 'bull_bb_std_mult': 3.4513860148227327, 'bull_rsi_os': 35, 'bull_rsi_ob': 57, 'bull_adx_thresh': 26.376837731358005, 'bull_atr_min_pct': 0.02733395639377876, 'bull_atr_max_pct': 0.019846848520082783, 'bull_tp_mult': 2.925202224457365, 'bull_tsl_mult': 0.9040101545550191, 'bull_time_stop': 109, 'bull_use_sma': False, 'bull_use_ema': False, 'bull_use_atr': True, 'bull_use_adx': True, 'bull_use_spike': True, 'bull_rsi_required': True, 'bear_strategy': 'mean_reversion', 'bear_bb_std_mult': 1.0015576574946459, 'bear_rsi_os': 10, 'bear_rsi_ob': 48, 'bear_adx_thresh': 5.921829847104457, 'bear_atr_min_pct': 0.004627026029792404, 'bear_atr_max_pct': 0.1210059892176561, 'bear_tp_mult': 2.9991111731402995, 'bear_tsl_mult': 0.06447965966813957, 'bear_time_stop': 217, 'bear_use_sma': True, 'bear_use_ema': True, 'bear_use_atr': True, 'bear_use_adx': False, 'bear_use_spike': True, 'bear_rsi_required': True, 'sideways_strategy': 'mean_reversion', 'sideways_bb_std_mult': 0.9291503100390933, 'sideways_rsi_os': 29, 'sideways_rsi_ob': 49, 'sideways_adx_thresh': 11.986922400092167, 'sideways_atr_min_pct': 0.0198181466652694, 'sideways_atr_max_pct': 0.11379317232393332, 'sideways_tp_mult': 1.967762454383446, 'sideways_tsl_mult': 0.355754540895898, 'sideways_time_stop': 146, 'sideways_use_sma': False, 'sideways_use_ema': False, 'sideways_use_atr': False, 'sideways_use_adx': True, 'sideways_use_spike': True, 'sideways_rsi_required': True}.
