[I 2025-08-31 03:40:11,024] Trial 55 finished with values: [-1000000000.0, 1000000000.0] and parameters: {'p_sma': 60, 'p_std': 8, 'p_atr': 7, 'p_adx': 28, 'rsi_period': 46, 'ema1': 18, 'ema2': 20, 'slip_atr_k': 0.15172020419558174, 'slip_spread_k': 0.5174385308035183, 'spread_hl_frac': 0.04262131059284694, 'bb_std_mult': 2.0826608164885494, 'rsi_os': 21, 'rsi_ob': 61, 'vol_spike': 0.2801269368307364, 'adx_thresh': 7.102241106012519, 'atr_min_pct': 0.025630687506275437, 'atr_max_pct': 0.055861558033772726, 'tp_mult': 2.3627379988724257, 'tsl_mult': 0.4118402028367839, 'strategy': 'breakout', 'time_stop': 107, 'use_sma': True, 'use_atr': True, 'use_adx': True, 'use_ema': True, 'use_spike': True, 'rsi_required': False, 'edge_k': 1.1191991694051768, 'edge_cap': 0.42266708176763057, 'bull_strategy': 'mean_reversion', 'bull_bb_std_mult': 1.0158300028016174, 'bull_rsi_os': 48, 'bull_rsi_ob': 45, 'bull_adx_thresh': 17.286749495006053, 'bull_atr_min_pct': 0.027744373601086506, 'bull_atr_max_pct': 0.06633802641970776, 'bull_tp_mult': 2.4555100188160623, 'bull_tsl_mult': 0.6105894933048482, 'bull_time_stop': 73, 'bull_use_sma': False, 'bull_use_ema': True, 'bull_use_atr': True, 'bull_use_adx': True, 'bull_use_spike': True, 'bull_rsi_required': True, 'bear_strategy': 'breakout', 'bear_bb_std_mult': 1.9626046112144995, 'bear_rsi_os': 7, 'bear_rsi_ob': 74, 'bear_adx_thresh': 17.532782213386653, 'bear_atr_min_pct': 0.0016032600690965605, 'bear_atr_max_pct': 0.1405952055675145, 'bear_tp_mult': 1.7291056728127874, 'bear_tsl_mult': 0.5286922705297887, 'bear_time_stop': 51, 'bear_use_sma': True, 'bear_use_ema': False, 'bear_use_atr': True, 'bear_use_adx': False, 'bear_use_spike': True, 'bear_rsi_required': True, 'sideways_strategy': 'mean_reversion', 'sideways_bb_std_mult': 1.6308370577698765, 'sideways_rsi_os': 47, 'sideways_rsi_ob': 57, 'sideways_adx_thresh': 6.944803684280412, 'sideways_atr_min_pct': 0.012835472936323642, 'sideways_atr_max_pct': 0.06842486899774547, 'sideways_tp_mult': 1.8158908425637, 'sideways_tsl_mult': 0.27092212315531844, 'sideways_time_stop': 225, 'sideways_use_sma': False, 'sideways_use_ema': False, 'sideways_use_atr': False, 'sideways_use_adx': True, 'sideways_use_spike': True, 'sideways_rsi_required': True}.
[I 2025-08-31 03:40:11,113] Trial 56 finished with values: [-1000000000.0, 1000000000.0] and parameters: {'p_sma': 40, 'p_std': 9, 'p_atr': 19, 'p_adx': 28, 'rsi_period': 46, 'ema1': 6, 'ema2': 19, 'slip_atr_k': 0.1270275004170478, 'slip_spread_k': 0.006890546382497698, 'spread_hl_frac': 0.04256807694993646, 'bb_std_mult': 1.7910336543107341, 'rsi_os': 44, 'rsi_ob': 48, 'vol_spike': 0.13186638001944523, 'adx_thresh': 7.043508708749254, 'atr_min_pct': 0.026096088771559764, 'atr_max_pct': 0.05220100674767496, 'tp_mult': 1.0888822781353649, 'tsl_mult': 0.04431262258782159, 'strategy': 'breakout', 'time_stop': 110, 'use_sma': True, 'use_atr': True, 'use_adx': False, 'use_ema': False, 'use_spike': True, 'rsi_required': True, 'edge_k': 1.086748643727262, 'edge_cap': 0.9337689376885355, 'bull_strategy': 'mean_reversion', 'bull_bb_std_mult': 0.6622301764003522, 'bull_rsi_os': 31, 'bull_rsi_ob': 45, 'bull_adx_thresh': 18.21406527636629, 'bull_atr_min_pct': 0.02081592129264507, 'bull_atr_max_pct': 0.06472718660392841, 'bull_tp_mult': 2.2238232901707886, 'bull_tsl_mult': 0.9157674297110432, 'bull_time_stop': 71, 'bull_use_sma': False, 'bull_use_ema': False, 'bull_use_atr': False, 'bull_use_adx': True, 'bull_use_spike': True, 'bull_rsi_required': True, 'bear_strategy': 'mean_reversion', 'bear_bb_std_mult': 2.0362112604909886, 'bear_rsi_os': 22, 'bear_rsi_ob': 74, 'bear_adx_thresh': 16.528651799774064, 'bear_atr_min_pct': 0.01016488527492556, 'bear_atr_max_pct': 0.138325536753149, 'bear_tp_mult': 1.735162071157904, 'bear_tsl_mult': 0.5380969036283959, 'bear_time_stop': 182, 'bear_use_sma': True, 'bear_use_ema': True, 'bear_use_atr': True, 'bear_use_adx': False, 'bear_use_spike': True, 'bear_rsi_required': False, 'sideways_strategy': 'mean_reversion', 'sideways_bb_std_mult': 0.9243749047085017, 'sideways_rsi_os': 29, 'sideways_rsi_ob': 92, 'sideways_adx_thresh': 10.19882716677275, 'sideways_atr_min_pct': 0.011783988182670742, 'sideways_atr_max_pct': 0.06787854010416398, 'sideways_tp_mult': 1.0900269654572723, 'sideways_tsl_mult': 0.5539537357867927, 'sideways_time_stop': 84, 'sideways_use_sma': False, 'sideways_use_ema': False, 'sideways_use_atr': False, 'sideways_use_adx': True, 'sideways_use_spike': True, 'sideways_rsi_required': True}.
[I 2025-08-31 03:40:11,297] Trial 57 finished with values: [-1000000000.0, 1000000000.0] and parameters: {'p_sma': 60, 'p_std': 5, 'p_atr': 19, 'p_adx': 28, 'rsi_period': 46, 'ema1': 11, 'ema2': 24, 'slip_atr_k': 0.0997644619494226, 'slip_spread_k': 0.014588737371790339, 'spread_hl_frac': 0.003039886137162863, 'bb_std_mult': 2.3875372295477253, 'rsi_os': 45, 'rsi_ob': 49, 'vol_spike': 0.2811091560786052, 'adx_thresh': 33.43628636762006, 'atr_min_pct': 0.025824095835933675, 'atr_max_pct': 0.10145698049060742, 'tp_mult': 1.0907823620017065, 'tsl_mult': 0.4054057131593123, 'strategy': 'breakout', 'time_stop': 275, 'use_sma': True, 'use_atr': True, 'use_adx': False, 'use_ema': False, 'use_spike': True, 'rsi_required': False, 'edge_k': 1.1079268686156367, 'edge_cap': 0.6278875306989642, 'bull_strategy': 'mean_reversion', 'bull_bb_std_mult': 1.2911605999743672, 'bull_rsi_os': 25, 'bull_rsi_ob': 81, 'bull_adx_thresh': 16.382554233159418, 'bull_atr_min_pct': 0.02813026273798277, 'bull_atr_max_pct': 0.11770139998927498, 'bull_tp_mult': 2.2480542164945976, 'bull_tsl_mult': 0.6102698207618587, 'bull_time_stop': 76, 'bull_use_sma': False, 'bull_use_ema': False, 'bull_use_atr': True, 'bull_use_adx': True, 'bull_use_spike': True, 'bull_rsi_required': True, 'bear_strategy': 'mean_reversion', 'bear_bb_std_mult': 1.320775902371345, 'bear_rsi_os': 22, 'bear_rsi_ob': 64, 'bear_adx_thresh': 16.764142801764194, 'bear_atr_min_pct': 0.010347596087597399, 'bear_atr_max_pct': 0.1383871997183065, 'bear_tp_mult': 2.295488039588955, 'bear_tsl_mult': 0.5260477964505809, 'bear_time_stop': 273, 'bear_use_sma': True, 'bear_use_ema': True, 'bear_use_atr': True, 'bear_use_adx': False, 'bear_use_spike': True, 'bear_rsi_required': True, 'sideways_strategy': 'mean_reversion', 'sideways_bb_std_mult': 0.5185446981384532, 'sideways_rsi_os': 29, 'sideways_rsi_ob': 57, 'sideways_adx_thresh': 10.305928237102446, 'sideways_atr_min_pct': 0.015637620325048462, 'sideways_atr_max_pct': 0.0684957258234587, 'sideways_tp_mult': 1.0771800126816604, 'sideways_tsl_mult': 0.5434258234125745, 'sideways_time_stop': 294, 'sideways_use_sma': False, 'sideways_use_ema': False, 'sideways_use_atr': False, 'sideways_use_adx': True, 'sideways_use_spike': True, 'sideways_rsi_required': True}.
[I 2025-08-31 03:40:11,546] Trial 54 finished with values: [-1000000000.0, 1000000000.0] and parameters: {'p_sma': 40, 'p_std': 5, 'p_atr': 19, 'p_adx': 29, 'rsi_period': 79, 'ema1': 5, 'ema2': 29, 'slip_atr_k': 0.09950671536018879, 'slip_spread_k': 0.0063855214853171804, 'spread_hl_frac': 0.04224966291373309, 'bb_std_mult': 2.379797619407933, 'rsi_os': 22, 'rsi_ob': 72, 'vol_spike': 0.1044336323933171, 'adx_thresh': 30.174265675659775, 'atr_min_pct': 0.02848494019868193, 'atr_max_pct': 0.0564828993202038, 'tp_mult': 1.1261729086324477, 'tsl_mult': 0.42835338419638697, 'strategy': 'breakout', 'time_stop': 114, 'use_sma': True, 'use_atr': True, 'use_adx': True, 'use_ema': True, 'use_spike': True, 'rsi_required': False, 'edge_k': 1.1085376893002203, 'edge_cap': 0.9400047945423513, 'bull_strategy': 'breakout', 'bull_bb_std_mult': 1.0162797313060463, 'bull_rsi_os': 10, 'bull_rsi_ob': 71, 'bull_adx_thresh': 27.867711452646482, 'bull_atr_min_pct': 0.027770803484839873, 'bull_atr_max_pct': 0.07167444762909146, 'bull_tp_mult': 2.2548483675369897, 'bull_tsl_mult': 0.4743075657734317, 'bull_time_stop': 68, 'bull_use_sma': False, 'bull_use_ema': True, 'bull_use_atr': True, 'bull_use_adx': False, 'bull_use_spike': False, 'bull_rsi_required': True, 'bear_strategy': 'breakout', 'bear_bb_std_mult': 1.019825393610598, 'bear_rsi_os': 23, 'bear_rsi_ob': 49, 'bear_adx_thresh': 17.21333611934535, 'bear_atr_min_pct': 0.019239083326991036, 'bear_atr_max_pct': 0.03807794450739157, 'bear_tp_mult': 2.529994920950941, 'bear_tsl_mult': 0.6674680971615299, 'bear_time_stop': 276, 'bear_use_sma': False, 'bear_use_ema': False, 'bear_use_atr': False, 'bear_use_adx': False, 'bear_use_spike': False, 'bear_rsi_required': True, 'sideways_strategy': 'mean_reversion', 'sideways_bb_std_mult': 1.7360954015008037, 'sideways_rsi_os': 46, 'sideways_rsi_ob': 69, 'sideways_adx_thresh': 6.42868430803715, 'sideways_atr_min_pct': 0.012355216363752447, 'sideways_atr_max_pct': 0.13795279542324543, 'sideways_tp_mult': 1.0204287965537842, 'sideways_tsl_mult': 0.5410755241050612, 'sideways_time_stop': 299, 'sideways_use_sma': False, 'sideways_use_ema': True, 'sideways_use_atr': False, 'sideways_use_adx': True, 'sideways_use_spike': True, 'sideways_rsi_required': True}.
[I 2025-08-31 03:40:40,399] Trial 59 finished with values: [-1000000000.0, 1000000000.0] and parameters: {'p_sma': 54, 'p_std': 57, 'p_atr': 20, 'p_adx': 17, 'rsi_period': 29, 'ema1': 24, 'ema2': 25, 'slip_atr_k': 0.10280031162531915, 'slip_spread_k': 0.1656948229736735, 'spread_hl_frac': 0.0027931328412257525, 'bb_std_mult': 2.362616007067412, 'rsi_os': 47, 'rsi_ob': 81, 'vol_spike': 0.15933406328746086, 'adx_thresh': 32.97972119523777, 'atr_min_pct': 0.02855127517000844, 'atr_max_pct': 0.09614035736139634, 'tp_mult': 2.4933839451267694, 'tsl_mult': 0.6877543996008736, 'strategy': 'breakout', 'time_stop': 277, 'use_sma': True, 'use_atr': True, 'use_adx': False, 'use_ema': False, 'use_spike': True, 'rsi_required': False, 'edge_k': 0.2977159616956906, 'edge_cap': 0.6376103633850088, 'bull_strategy': 'mean_reversion', 'bull_bb_std_mult': 0.5095236125788198, 'bull_rsi_os': 40, 'bull_rsi_ob': 81, 'bull_adx_thresh': 33.213758647330906, 'bull_atr_min_pct': 0.005843629551762715, 'bull_atr_max_pct': 0.07673179794863814, 'bull_tp_mult': 2.3117722192670764, 'bull_tsl_mult': 0.12587395786410205, 'bull_time_stop': 133, 'bull_use_sma': False, 'bull_use_ema': False, 'bull_use_atr': False, 'bull_use_adx': True, 'bull_use_spike': False, 'bull_rsi_required': True, 'bear_strategy': 'mean_reversion', 'bear_bb_std_mult': 1.3273188173098154, 'bear_rsi_os': 33, 'bear_rsi_ob': 63, 'bear_adx_thresh': 18.776017908260215, 'bear_atr_min_pct': 0.011682342316906581, 'bear_atr_max_pct': 0.1124558260877059, 'bear_tp_mult': 2.308407101007587, 'bear_tsl_mult': 0.34484476841453804, 'bear_time_stop': 278, 'bear_use_sma': True, 'bear_use_ema': True, 'bear_use_atr': False, 'bear_use_adx': True, 'bear_use_spike': True, 'bear_rsi_required': True, 'sideways_strategy': 'mean_reversion', 'sideways_bb_std_mult': 1.3346999721985195, 'sideways_rsi_os': 51, 'sideways_rsi_ob': 83, 'sideways_adx_thresh': 25.48635370045792, 'sideways_atr_min_pct': 0.015400823778951692, 'sideways_atr_max_pct': 0.07813568899048459, 'sideways_tp_mult': 2.1526748094554478, 'sideways_tsl_mult': 0.0758833842487327, 'sideways_time_stop': 297, 'sideways_use_sma': False, 'sideways_use_ema': False, 'sideways_use_atr': False, 'sideways_use_adx': True, 'sideways_use_spike': True, 'sideways_rsi_required': False}.
[I 2025-08-31 03:40:41,055] Trial 58 finished with values: [-1000000000.0, 1000000000.0] and parameters: {'p_sma': 54, 'p_std': 5, 'p_atr': 20, 'p_adx': 17, 'rsi_period': 78, 'ema1': 11, 'ema2': 24, 'slip_atr_k': 0.09288621524132844, 'slip_spread_k': 0.16320179189817113, 'spread_hl_frac': 0.0035660653012174748, 'bb_std_mult': 2.3005875181863855, 'rsi_os': 52, 'rsi_ob': 82, 'vol_spike': 0.19352097517694897, 'adx_thresh': 25.87237378518772, 'atr_min_pct': 0.01979219135068675, 'atr_max_pct': 0.04061173405975068, 'tp_mult': 2.5049240778884796, 'tsl_mult': 0.17015304961623184, 'strategy': 'breakout', 'time_stop': 300, 'use_sma': True, 'use_atr': True, 'use_adx': False, 'use_ema': False, 'use_spike': True, 'rsi_required': False, 'edge_k': 0.9479387808312228, 'edge_cap': 0.8499149913620947, 'bull_strategy': 'mean_reversion', 'bull_bb_std_mult': 1.3484764925807897, 'bull_rsi_os': 41, 'bull_rsi_ob': 81, 'bull_adx_thresh': 33.97490063282658, 'bull_atr_min_pct': 0.009285661364147314, 'bull_atr_max_pct': 0.07627927634164233, 'bull_tp_mult': 2.6992947825523945, 'bull_tsl_mult': 0.2725199699682611, 'bull_time_stop': 134, 'bull_use_sma': False, 'bull_use_ema': False, 'bull_use_atr': False, 'bull_use_adx': True, 'bull_use_spike': False, 'bull_rsi_required': True, 'bear_strategy': 'mean_reversion', 'bear_bb_std_mult': 1.2907731821823762, 'bear_rsi_os': 33, 'bear_rsi_ob': 47, 'bear_adx_thresh': 6.369568894350849, 'bear_atr_min_pct': 0.019480867098926342, 'bear_atr_max_pct': 0.11284912168653338, 'bear_tp_mult': 2.298976568975067, 'bear_tsl_mult': 0.3894844481987343, 'bear_time_stop': 272, 'bear_use_sma': True, 'bear_use_ema': True, 'bear_use_atr': False, 'bear_use_adx': True, 'bear_use_spike': True, 'bear_rsi_required': True, 'sideways_strategy': 'mean_reversion', 'sideways_bb_std_mult': 1.3774508012357651, 'sideways_rsi_os': 33, 'sideways_rsi_ob': 83, 'sideways_adx_thresh': 33.07335193492828, 'sideways_atr_min_pct': 0.0007944535031742632, 'sideways_atr_max_pct': 0.1431858313169376, 'sideways_tp_mult': 2.0289880722103555, 'sideways_tsl_mult': 0.08390146477686411, 'sideways_time_stop': 290, 'sideways_use_sma': False, 'sideways_use_ema': False, 'sideways_use_atr': False, 'sideways_use_adx': True, 'sideways_use_spike': True, 'sideways_rsi_required': False}.
[I 2025-08-31 03:40:41,073] Trial 61 finished with values: [-1000000000.0, 1000000000.0] and parameters: {'p_sma': 29, 'p_std': 33, 'p_atr': 14, 'p_adx': 26, 'rsi_period': 29, 'ema1': 30, 'ema2': 58, 'slip_atr_k': 0.17454352147850194, 'slip_spread_k': 0.1662939803432676, 'spread_hl_frac': 0.011157484791549639, 'bb_std_mult': 2.892623111299052, 'rsi_os': 29, 'rsi_ob': 45, 'vol_spike': 0.18991554776682393, 'adx_thresh': 23.524140767643058, 'atr_min_pct': 0.015652344775478742, 'atr_max_pct': 0.0936569788740463, 'tp_mult': 1.5538845446873093, 'tsl_mult': 0.7050644483028652, 'strategy': 'breakout', 'time_stop': 244, 'use_sma': True, 'use_atr': False, 'use_adx': False, 'use_ema': False, 'use_spike': False, 'rsi_required': True, 'edge_k': 0.9471446241494825, 'edge_cap': 0.8447944148164894, 'bull_strategy': 'mean_reversion', 'bull_bb_std_mult': 3.1828977902513174, 'bull_rsi_os': 41, 'bull_rsi_ob': 87, 'bull_adx_thresh': 33.97681701205077, 'bull_atr_min_pct': 0.009299968314328982, 'bull_atr_max_pct': 0.054013920025300394, 'bull_tp_mult': 2.091383766962624, 'bull_tsl_mult': 0.2627845686516139, 'bull_time_stop': 88, 'bull_use_sma': False, 'bull_use_ema': False, 'bull_use_atr': False, 'bull_use_adx': True, 'bull_use_spike': True, 'bull_rsi_required': False, 'bear_strategy': 'mean_reversion', 'bear_bb_std_mult': 2.2395360041439965, 'bear_rsi_os': 33, 'bear_rsi_ob': 64, 'bear_adx_thresh': 25.98678876053353, 'bear_atr_min_pct': 0.016436234686989522, 'bear_atr_max_pct': 0.11001506859300418, 'bear_tp_mult': 1.941069667786868, 'bear_tsl_mult': 0.3719869922684429, 'bear_time_stop': 198, 'bear_use_sma': True, 'bear_use_ema': True, 'bear_use_atr': False, 'bear_use_adx': True, 'bear_use_spike': True, 'bear_rsi_required': False, 'sideways_strategy': 'mean_reversion', 'sideways_bb_std_mult': 1.3635859814861142, 'sideways_rsi_os': 52, 'sideways_rsi_ob': 83, 'sideways_adx_thresh': 25.135480915817215, 'sideways_atr_min_pct': 0.01725764246142058, 'sideways_atr_max_pct': 0.07729247850045418, 'sideways_tp_mult': 2.0369686276413606, 'sideways_tsl_mult': 0.08698726009602242, 'sideways_time_stop': 113, 'sideways_use_sma': True, 'sideways_use_ema': False, 'sideways_use_atr': True, 'sideways_use_adx': False, 'sideways_use_spike': True, 'sideways_rsi_required': False}.
[I 2025-08-31 03:40:41,369] Trial 60 finished with values: [-1000000000.0, 1000000000.0] and parameters: {'p_sma': 29, 'p_std': 56, 'p_atr': 10, 'p_adx': 17, 'rsi_period': 27, 'ema1': 30, 'ema2': 57, 'slip_atr_k': 0.002264614358031769, 'slip_spread_k': 0.176845212968054, 'spread_hl_frac': 0.00815160554958828, 'bb_std_mult': 2.3276766275120067, 'rsi_os': 29, 'rsi_ob': 81, 'vol_spike': 0.19238645220701195, 'adx_thresh': 24.311443262353897, 'atr_min_pct': 0.027690899092576094, 'atr_max_pct': 0.08315853742903662, 'tp_mult': 2.511466174687215, 'tsl_mult': 0.06794628273799941, 'strategy': 'breakout', 'time_stop': 297, 'use_sma': True, 'use_atr': True, 'use_adx': False, 'use_ema': True, 'use_spike': False, 'rsi_required': True, 'edge_k': 0.3080156981808434, 'edge_cap': 0.5268107498158857, 'bull_strategy': 'mean_reversion', 'bull_bb_std_mult': 3.1747375648241043, 'bull_rsi_os': 40, 'bull_rsi_ob': 72, 'bull_adx_thresh': 33.964348266977744, 'bull_atr_min_pct': 0.005597024057210891, 'bull_atr_max_pct': 0.08007901114834642, 'bull_tp_mult': 2.7018759138935717, 'bull_tsl_mult': 0.27568518407849857, 'bull_time_stop': 134, 'bull_use_sma': False, 'bull_use_ema': True, 'bull_use_atr': False, 'bull_use_adx': False, 'bull_use_spike': False, 'bull_rsi_required': True, 'bear_strategy': 'mean_reversion', 'bear_bb_std_mult': 2.2192328507287398, 'bear_rsi_os': 47, 'bear_rsi_ob': 63, 'bear_adx_thresh': 6.687565356687873, 'bear_atr_min_pct': 0.019927020125609173, 'bear_atr_max_pct': 0.08095662557355437, 'bear_tp_mult': 2.6013617207180517, 'bear_tsl_mult': 0.8145231855597322, 'bear_time_stop': 199, 'bear_use_sma': False, 'bear_use_ema': False, 'bear_use_atr': False, 'bear_use_adx': True, 'bear_use_spike': False, 'bear_rsi_required': False, 'sideways_strategy': 'mean_reversion', 'sideways_bb_std_mult': 1.3995070513840178, 'sideways_rsi_os': 53, 'sideways_rsi_ob': 84, 'sideways_adx_thresh': 33.021096842498885, 'sideways_atr_min_pct': 0.01792093595772194, 'sideways_atr_max_pct': 0.1392393753404936, 'sideways_tp_mult': 2.5315712859016024, 'sideways_tsl_mult': 0.22270110064310727, 'sideways_time_stop': 196, 'sideways_use_sma': False, 'sideways_use_ema': True, 'sideways_use_atr': False, 'sideways_use_adx': False, 'sideways_use_spike': True, 'sideways_rsi_required': False}.
[I 2025-08-31 03:40:41,619] Trial 62 finished with values: [-1000000000.0, 1000000000.0] and parameters: {'p_sma': 29, 'p_std': 33, 'p_atr': 11, 'p_adx': 14, 'rsi_period': 26, 'ema1': 30, 'ema2': 44, 'slip_atr_k': 0.0884335864905332, 'slip_spread_k': 0.2745469576078532, 'spread_hl_frac': 0.025197944727388823, 'bb_std_mult': 3.1802540478509447, 'rsi_os': 30, 'rsi_ob': 45, 'vol_spike': 0.19803861456845492, 'adx_thresh': 23.927805115102032, 'atr_min_pct': 0.020032738887847634, 'atr_max_pct': 0.04181697203665524, 'tp_mult': 1.551990757885534, 'tsl_mult': 0.06380625168101944, 'strategy': 'mean_reversion', 'time_stop': 176, 'use_sma': False, 'use_atr': False, 'use_adx': False, 'use_ema': True, 'use_spike': False, 'rsi_required': True, 'edge_k': 0.9435540650275355, 'edge_cap': 0.051250607461871045, 'bull_strategy': 'mean_reversion', 'bull_bb_std_mult': 1.673770393007205, 'bull_rsi_os': 18, 'bull_rsi_ob': 51, 'bull_adx_thresh': 34.109962076231774, 'bull_atr_min_pct': 0.009317252258563984, 'bull_atr_max_pct': 0.05327667485937089, 'bull_tp_mult': 2.1081769152528427, 'bull_tsl_mult': 0.2867340742001023, 'bull_time_stop': 97, 'bull_use_sma': True, 'bull_use_ema': True, 'bull_use_atr': False, 'bull_use_adx': True, 'bull_use_spike': True, 'bull_rsi_required': False, 'bear_strategy': 'mean_reversion', 'bear_bb_std_mult': 2.267609871159286, 'bear_rsi_os': 46, 'bear_rsi_ob': 47, 'bear_adx_thresh': 26.26741010159469, 'bear_atr_min_pct': 0.007279348042470493, 'bear_atr_max_pct': 0.07973922592421087, 'bear_tp_mult': 1.2763589928979828, 'bear_tsl_mult': 0.7861921922044597, 'bear_time_stop': 197, 'bear_use_sma': False, 'bear_use_ema': False, 'bear_use_atr': False, 'bear_use_adx': True, 'bear_use_spike': False, 'bear_rsi_required': False, 'sideways_strategy': 'breakout', 'sideways_bb_std_mult': 2.168281325945255, 'sideways_rsi_os': 11, 'sideways_rsi_ob': 95, 'sideways_adx_thresh': 33.577399912712956, 'sideways_atr_min_pct': 0.0016257606025169256, 'sideways_atr_max_pct': 0.09056325554707854, 'sideways_tp_mult': 2.017661790466846, 'sideways_tsl_mult': 0.21501539813824588, 'sideways_time_stop': 113, 'sideways_use_sma': True, 'sideways_use_ema': True, 'sideways_use_atr': True, 'sideways_use_adx': False, 'sideways_use_spike': False, 'sideways_rsi_required': False}.
