[I 2025-08-31 04:24:34,165] Trial 345 finished with values: [-1000000000.0, 1000000000.0] and parameters: {'p_sma': 53, 'p_std': 16, 'p_atr': 24, 'p_adx': 18, 'rsi_period': 41, 'ema1': 29, 'ema2': 27, 'slip_atr_k': 0.0011944861480086312, 'slip_spread_k': 0.5592705543325667, 'spread_hl_frac': 0.011080849974491087, 'bb_std_mult': 2.0557589913057686, 'rsi_os': 30, 'rsi_ob': 59, 'vol_spike': 0.024971007640844308, 'adx_thresh': 7.822563496867327, 'atr_min_pct': 0.024312004325057444, 'atr_max_pct': 0.11496687958003746, 'tp_mult': 2.576729886560992, 'tsl_mult': 0.22237778268958147, 'strategy': 'breakout', 'time_stop': 64, 'use_sma': False, 'use_atr': True, 'use_adx': True, 'use_ema': True, 'use_spike': False, 'rsi_required': True, 'edge_k': 1.4885659797455424, 'edge_cap': 0.9396270908087214, 'bull_strategy': 'mean_reversion', 'bull_bb_std_mult': 3.2639749921833845, 'bull_rsi_os': 12, 'bull_rsi_ob': 81, 'bull_adx_thresh': 24.333303157351107, 'bull_atr_min_pct': 0.023296866777930015, 'bull_atr_max_pct': 0.05141488970858751, 'bull_tp_mult': 1.7592402247879315, 'bull_tsl_mult': 0.1867615627458622, 'bull_time_stop': 91, 'bull_use_sma': True, 'bull_use_ema': True, 'bull_use_atr': True, 'bull_use_adx': False, 'bull_use_spike': True, 'bull_rsi_required': True, 'bear_strategy': 'breakout', 'bear_bb_std_mult': 0.8672143174437884, 'bear_rsi_os': 38, 'bear_rsi_ob': 95, 'bear_adx_thresh': 14.42012791353902, 'bear_atr_min_pct': 0.01398543010156504, 'bear_atr_max_pct': 0.010045411796604828, 'bear_tp_mult': 1.04182087805179, 'bear_tsl_mult': 0.4202552090258242, 'bear_time_stop': 194, 'bear_use_sma': False, 'bear_use_ema': False, 'bear_use_atr': True, 'bear_use_adx': True, 'bear_use_spike': False, 'bear_rsi_required': True, 'sideways_strategy': 'mean_reversion', 'sideways_bb_std_mult': 1.188827052889286, 'sideways_rsi_os': 17, 'sideways_rsi_ob': 53, 'sideways_adx_thresh': 10.9407516583974, 'sideways_atr_min_pct': 0.01918583040452961, 'sideways_atr_max_pct': 0.1180648885498106, 'sideways_tp_mult': 2.0765403107744147, 'sideways_tsl_mult': 0.45610877535909256, 'sideways_time_stop': 96, 'sideways_use_sma': True, 'sideways_use_ema': True, 'sideways_use_atr': True, 'sideways_use_adx': True, 'sideways_use_spike': False, 'sideways_rsi_required': False}.
[I 2025-08-31 04:24:34,456] Trial 342 finished with values: [-1000000000.0, 1000000000.0] and parameters: {'p_sma': 53, 'p_std': 57, 'p_atr': 24, 'p_adx': 7, 'rsi_period': 21, 'ema1': 26, 'ema2': 28, 'slip_atr_k': 0.010708715078233504, 'slip_spread_k': 0.6829534370248227, 'spread_hl_frac': 0.0288683342588384, 'bb_std_mult': 2.7977040448728308, 'rsi_os': 31, 'rsi_ob': 72, 'vol_spike': 0.2006865521505115, 'adx_thresh': 7.641555841603703, 'atr_min_pct': 0.0242138440038219, 'atr_max_pct': 0.05718070012170244, 'tp_mult': 1.226828577181466, 'tsl_mult': 0.8992470973146902, 'strategy': 'breakout', 'time_stop': 62, 'use_sma': False, 'use_atr': True, 'use_adx': True, 'use_ema': True, 'use_spike': False, 'rsi_required': True, 'edge_k': 0.9524469397072809, 'edge_cap': 0.06804258969935889, 'bull_strategy': 'mean_reversion', 'bull_bb_std_mult': 1.3102447921793097, 'bull_rsi_os': 12, 'bull_rsi_ob': 78, 'bull_adx_thresh': 11.710848485529322, 'bull_atr_min_pct': 0.0009434866541228536, 'bull_atr_max_pct': 0.10528103376512335, 'bull_tp_mult': 2.654550060988486, 'bull_tsl_mult': 0.9223956207324407, 'bull_time_stop': 116, 'bull_use_sma': True, 'bull_use_ema': True, 'bull_use_atr': True, 'bull_use_adx': False, 'bull_use_spike': True, 'bull_rsi_required': True, 'bear_strategy': 'breakout', 'bear_bb_std_mult': 1.4543782056973011, 'bear_rsi_os': 16, 'bear_rsi_ob': 95, 'bear_adx_thresh': 14.811549125420399, 'bear_atr_min_pct': 0.005085454865857847, 'bear_atr_max_pct': 0.023177578429409554, 'bear_tp_mult': 1.6399054928255574, 'bear_tsl_mult': 0.23421875736324588, 'bear_time_stop': 195, 'bear_use_sma': False, 'bear_use_ema': False, 'bear_use_atr': True, 'bear_use_adx': True, 'bear_use_spike': False, 'bear_rsi_required': True, 'sideways_strategy': 'mean_reversion', 'sideways_bb_std_mult': 2.574275146283086, 'sideways_rsi_os': 15, 'sideways_rsi_ob': 54, 'sideways_adx_thresh': 28.264055309055582, 'sideways_atr_min_pct': 0.01309102180099368, 'sideways_atr_max_pct': 0.11842730876418694, 'sideways_tp_mult': 2.0833260570487555, 'sideways_tsl_mult': 0.6174825165456884, 'sideways_time_stop': 55, 'sideways_use_sma': True, 'sideways_use_ema': True, 'sideways_use_atr': True, 'sideways_use_adx': True, 'sideways_use_spike': False, 'sideways_rsi_required': False}.
[I 2025-08-31 04:24:34,558] Trial 343 finished with values: [-1000000000.0, 1000000000.0] and parameters: {'p_sma': 53, 'p_std': 16, 'p_atr': 24, 'p_adx': 7, 'rsi_period': 22, 'ema1': 18, 'ema2': 28, 'slip_atr_k': 0.010010201284691142, 'slip_spread_k': 0.1974223130628524, 'spread_hl_frac': 0.028803066797984795, 'bb_std_mult': 2.818330917795612, 'rsi_os': 31, 'rsi_ob': 70, 'vol_spike': 0.2301437503314836, 'adx_thresh': 14.798673178184117, 'atr_min_pct': 0.024151300056465548, 'atr_max_pct': 0.035255291617849495, 'tp_mult': 2.5492341893146087, 'tsl_mult': 0.911910532871768, 'strategy': 'breakout', 'time_stop': 281, 'use_sma': False, 'use_atr': True, 'use_adx': True, 'use_ema': True, 'use_spike': False, 'rsi_required': True, 'edge_k': 0.850582408230665, 'edge_cap': 0.06596322755051165, 'bull_strategy': 'mean_reversion', 'bull_bb_std_mult': 3.550752889771264, 'bull_rsi_os': 13, 'bull_rsi_ob': 78, 'bull_adx_thresh': 10.923330482396445, 'bull_atr_min_pct': 0.005378150204073472, 'bull_atr_max_pct': 0.050248664602393155, 'bull_tp_mult': 1.648382279700607, 'bull_tsl_mult': 0.14745370768048294, 'bull_time_stop': 152, 'bull_use_sma': True, 'bull_use_ema': True, 'bull_use_atr': True, 'bull_use_adx': False, 'bull_use_spike': True, 'bull_rsi_required': True, 'bear_strategy': 'breakout', 'bear_bb_std_mult': 3.4668177280467076, 'bear_rsi_os': 38, 'bear_rsi_ob': 86, 'bear_adx_thresh': 5.1525828413503465, 'bear_atr_min_pct': 0.005090224737896288, 'bear_atr_max_pct': 0.03741399343549302, 'bear_tp_mult': 1.4103885598230543, 'bear_tsl_mult': 0.94185353664419, 'bear_time_stop': 79, 'bear_use_sma': False, 'bear_use_ema': False, 'bear_use_atr': True, 'bear_use_adx': True, 'bear_use_spike': False, 'bear_rsi_required': True, 'sideways_strategy': 'mean_reversion', 'sideways_bb_std_mult': 2.572269695493951, 'sideways_rsi_os': 15, 'sideways_rsi_ob': 54, 'sideways_adx_thresh': 20.243055146155893, 'sideways_atr_min_pct': 0.004853893388024078, 'sideways_atr_max_pct': 0.14457865393424602, 'sideways_tp_mult': 2.0787271108133143, 'sideways_tsl_mult': 0.6167422431682243, 'sideways_time_stop': 54, 'sideways_use_sma': True, 'sideways_use_ema': True, 'sideways_use_atr': True, 'sideways_use_adx': True, 'sideways_use_spike': False, 'sideways_rsi_required': False}.
[I 2025-08-31 04:24:34,747] Trial 344 finished with values: [-1000000000.0, 1000000000.0] and parameters: {'p_sma': 53, 'p_std': 16, 'p_atr': 24, 'p_adx': 18, 'rsi_period': 22, 'ema1': 29, 'ema2': 28, 'slip_atr_k': 0.08903306518803228, 'slip_spread_k': 0.0814787860949409, 'spread_hl_frac': 0.029099828914686772, 'bb_std_mult': 2.801185361834504, 'rsi_os': 30, 'rsi_ob': 46, 'vol_spike': 0.20489419789650895, 'adx_thresh': 20.283590086854915, 'atr_min_pct': 0.024211130505520533, 'atr_max_pct': 0.09047767011151028, 'tp_mult': 2.8113806227440334, 'tsl_mult': 0.3658825941464091, 'strategy': 'breakout', 'time_stop': 60, 'use_sma': False, 'use_atr': True, 'use_adx': True, 'use_ema': True, 'use_spike': False, 'rsi_required': True, 'edge_k': 1.4429605091794624, 'edge_cap': 0.967010017338288, 'bull_strategy': 'mean_reversion', 'bull_bb_std_mult': 3.27038486822246, 'bull_rsi_os': 6, 'bull_rsi_ob': 78, 'bull_adx_thresh': 12.962946879630517, 'bull_atr_min_pct': 0.018213070647875407, 'bull_atr_max_pct': 0.051233621943139726, 'bull_tp_mult': 1.1781311678707342, 'bull_tsl_mult': 0.9204157525546784, 'bull_time_stop': 158, 'bull_use_sma': True, 'bull_use_ema': True, 'bull_use_atr': True, 'bull_use_adx': False, 'bull_use_spike': True, 'bull_rsi_required': True, 'bear_strategy': 'breakout', 'bear_bb_std_mult': 1.3795857546118535, 'bear_rsi_os': 16, 'bear_rsi_ob': 45, 'bear_adx_thresh': 29.40268914274718, 'bear_atr_min_pct': 0.023264729738972645, 'bear_atr_max_pct': 0.037630980787830365, 'bear_tp_mult': 2.643996415184721, 'bear_tsl_mult': 0.6959617041115804, 'bear_time_stop': 5, 'bear_use_sma': False, 'bear_use_ema': False, 'bear_use_atr': True, 'bear_use_adx': True, 'bear_use_spike': False, 'bear_rsi_required': True, 'sideways_strategy': 'mean_reversion', 'sideways_bb_std_mult': 1.1716819356329302, 'sideways_rsi_os': 34, 'sideways_rsi_ob': 54, 'sideways_adx_thresh': 8.070562793470913, 'sideways_atr_min_pct': 0.01321942991602264, 'sideways_atr_max_pct': 0.11900827425700815, 'sideways_tp_mult': 2.2278431382271955, 'sideways_tsl_mult': 0.6177957089594012, 'sideways_time_stop': 93, 'sideways_use_sma': True, 'sideways_use_ema': True, 'sideways_use_atr': True, 'sideways_use_adx': True, 'sideways_use_spike': False, 'sideways_rsi_required': False}.
[I 2025-08-31 04:25:20,979] Trial 346 finished with values: [-1000000000.0, 1000000000.0] and parameters: {'p_sma': 37, 'p_std': 25, 'p_atr': 29, 'p_adx': 10, 'rsi_period': 22, 'ema1': 19, 'ema2': 28, 'slip_atr_k': 0.08855961354063766, 'slip_spread_k': 0.051090306445125466, 'spread_hl_frac': 0.04031688650945348, 'bb_std_mult': 1.9819241690326856, 'rsi_os': 17, 'rsi_ob': 70, 'vol_spike': 0.20420273378285295, 'adx_thresh': 11.966670851103522, 'atr_min_pct': 0.0231261415373438, 'atr_max_pct': 0.08997814425713004, 'tp_mult': 1.0451918169701022, 'tsl_mult': 0.05427420136354222, 'strategy': 'breakout', 'time_stop': 60, 'use_sma': False, 'use_atr': False, 'use_adx': True, 'use_ema': False, 'use_spike': True, 'rsi_required': True, 'edge_k': 1.450803838843623, 'edge_cap': 0.30651401975843223, 'bull_strategy': 'mean_reversion', 'bull_bb_std_mult': 3.0769547781154363, 'bull_rsi_os': 6, 'bull_rsi_ob': 76, 'bull_adx_thresh': 11.734569327325167, 'bull_atr_min_pct': 0.00557072775750931, 'bull_atr_max_pct': 0.04809221642179937, 'bull_tp_mult': 2.3957857762456167, 'bull_tsl_mult': 0.9542727815042621, 'bull_time_stop': 160, 'bull_use_sma': True, 'bull_use_ema': True, 'bull_use_atr': True, 'bull_use_adx': True, 'bull_use_spike': False, 'bull_rsi_required': True, 'bear_strategy': 'breakout', 'bear_bb_std_mult': 2.979035641667292, 'bear_rsi_os': 19, 'bear_rsi_ob': 94, 'bear_adx_thresh': 25.759853435718522, 'bear_atr_min_pct': 0.02080945857708704, 'bear_atr_max_pct': 0.03754113221045136, 'bear_tp_mult': 2.6336038638716155, 'bear_tsl_mult': 0.7039760937201501, 'bear_time_stop': 196, 'bear_use_sma': True, 'bear_use_ema': False, 'bear_use_atr': True, 'bear_use_adx': False, 'bear_use_spike': False, 'bear_rsi_required': True, 'sideways_strategy': 'mean_reversion', 'sideways_bb_std_mult': 2.5481205105748153, 'sideways_rsi_os': 18, 'sideways_rsi_ob': 93, 'sideways_adx_thresh': 13.446300193059624, 'sideways_atr_min_pct': 0.013077312488315737, 'sideways_atr_max_pct': 0.11164145096215468, 'sideways_tp_mult': 2.889778983333576, 'sideways_tsl_mult': 0.9741465268968881, 'sideways_time_stop': 159, 'sideways_use_sma': False, 'sideways_use_ema': True, 'sideways_use_atr': True, 'sideways_use_adx': True, 'sideways_use_spike': False, 'sideways_rsi_required': True}.
[I 2025-08-31 04:25:21,943] Trial 348 finished with values: [-1000000000.0, 1000000000.0] and parameters: {'p_sma': 26, 'p_std': 25, 'p_atr': 23, 'p_adx': 17, 'rsi_period': 73, 'ema1': 12, 'ema2': 26, 'slip_atr_k': 0.14834581728856028, 'slip_spread_k': 0.07591916298909838, 'spread_hl_frac': 0.013640679795573322, 'bb_std_mult': 1.083652376677332, 'rsi_os': 28, 'rsi_ob': 46, 'vol_spike': 0.031752808410323616, 'adx_thresh': 10.575896524327064, 'atr_min_pct': 0.023444251474164516, 'atr_max_pct': 0.13144897427481134, 'tp_mult': 2.4682612076708748, 'tsl_mult': 0.8190694350923967, 'strategy': 'breakout', 'time_stop': 45, 'use_sma': False, 'use_atr': False, 'use_adx': False, 'use_ema': False, 'use_spike': True, 'rsi_required': False, 'edge_k': 1.3609517227745778, 'edge_cap': 0.3097555155337682, 'bull_strategy': 'mean_reversion', 'bull_bb_std_mult': 0.6479160635713801, 'bull_rsi_os': 6, 'bull_rsi_ob': 63, 'bull_adx_thresh': 13.510074972320183, 'bull_atr_min_pct': 0.017452942961910908, 'bull_atr_max_pct': 0.058014427463644505, 'bull_tp_mult': 2.408016426767359, 'bull_tsl_mult': 0.28876129664326833, 'bull_time_stop': 132, 'bull_use_sma': False, 'bull_use_ema': False, 'bull_use_atr': True, 'bull_use_adx': True, 'bull_use_spike': False, 'bull_rsi_required': True, 'bear_strategy': 'mean_reversion', 'bear_bb_std_mult': 1.026897810580027, 'bear_rsi_os': 8, 'bear_rsi_ob': 64, 'bear_adx_thresh': 25.858729910185744, 'bear_atr_min_pct': 0.021071341070444345, 'bear_atr_max_pct': 0.08384365736068994, 'bear_tp_mult': 2.637399487000294, 'bear_tsl_mult': 0.6988178883765178, 'bear_time_stop': 259, 'bear_use_sma': True, 'bear_use_ema': True, 'bear_use_atr': False, 'bear_use_adx': False, 'bear_use_spike': True, 'bear_rsi_required': False, 'sideways_strategy': 'mean_reversion', 'sideways_bb_std_mult': 0.9768601169857164, 'sideways_rsi_os': 18, 'sideways_rsi_ob': 87, 'sideways_adx_thresh': 14.123279580219755, 'sideways_atr_min_pct': 0.0006420373083605383, 'sideways_atr_max_pct': 0.11154558719059818, 'sideways_tp_mult': 2.2187222366597568, 'sideways_tsl_mult': 0.6812988125523334, 'sideways_time_stop': 124, 'sideways_use_sma': False, 'sideways_use_ema': False, 'sideways_use_atr': False, 'sideways_use_adx': False, 'sideways_use_spike': True, 'sideways_rsi_required': True}.
[I 2025-08-31 04:25:21,952] Trial 349 finished with values: [-1000000000.0, 1000000000.0] and parameters: {'p_sma': 55, 'p_std': 14, 'p_atr': 25, 'p_adx': 10, 'rsi_period': 25, 'ema1': 12, 'ema2': 24, 'slip_atr_k': 0.05032930204272104, 'slip_spread_k': 0.8793769289260617, 'spread_hl_frac': 0.008612495128635956, 'bb_std_mult': 2.0058369230001487, 'rsi_os': 28, 'rsi_ob': 76, 'vol_spike': 0.2834793009695282, 'adx_thresh': 20.960470558771497, 'atr_min_pct': 0.0232665439615037, 'atr_max_pct': 0.11116856426756323, 'tp_mult': 1.7083526306727963, 'tsl_mult': 0.8523082627893009, 'strategy': 'breakout', 'time_stop': 44, 'use_sma': False, 'use_atr': False, 'use_adx': False, 'use_ema': False, 'use_spike': True, 'rsi_required': False, 'edge_k': 1.4390954993366674, 'edge_cap': 0.9582511478342806, 'bull_strategy': 'breakout', 'bull_bb_std_mult': 1.4850481484218616, 'bull_rsi_os': 33, 'bull_rsi_ob': 63, 'bull_adx_thresh': 11.597601675952646, 'bull_atr_min_pct': 0.02236380421664531, 'bull_atr_max_pct': 0.04710845360245167, 'bull_tp_mult': 1.619477311055029, 'bull_tsl_mult': 0.9551884945483409, 'bull_time_stop': 135, 'bull_use_sma': False, 'bull_use_ema': False, 'bull_use_atr': True, 'bull_use_adx': True, 'bull_use_spike': False, 'bull_rsi_required': True, 'bear_strategy': 'mean_reversion', 'bear_bb_std_mult': 0.7924718614121953, 'bear_rsi_os': 41, 'bear_rsi_ob': 47, 'bear_adx_thresh': 18.190007367306244, 'bear_atr_min_pct': 0.02385172250535756, 'bear_atr_max_pct': 0.04684983436092196, 'bear_tp_mult': 2.8293527025683725, 'bear_tsl_mult': 0.029669421203402935, 'bear_time_stop': 144, 'bear_use_sma': True, 'bear_use_ema': True, 'bear_use_atr': False, 'bear_use_adx': False, 'bear_use_spike': True, 'bear_rsi_required': False, 'sideways_strategy': 'mean_reversion', 'sideways_bb_std_mult': 0.9925098056399708, 'sideways_rsi_os': 35, 'sideways_rsi_ob': 93, 'sideways_adx_thresh': 27.10975986810975, 'sideways_atr_min_pct': 0.028656634578818035, 'sideways_atr_max_pct': 0.10186171388506972, 'sideways_tp_mult': 1.9505475688953573, 'sideways_tsl_mult': 0.6648381144112835, 'sideways_time_stop': 63, 'sideways_use_sma': False, 'sideways_use_ema': False, 'sideways_use_atr': False, 'sideways_use_adx': False, 'sideways_use_spike': True, 'sideways_rsi_required': True}.
[I 2025-08-31 04:25:22,558] Trial 347 finished with values: [-1000000000.0, 1000000000.0] and parameters: {'p_sma': 55, 'p_std': 25, 'p_atr': 23, 'p_adx': 10, 'rsi_period': 73, 'ema1': 7, 'ema2': 26, 'slip_atr_k': 0.0966268760711009, 'slip_spread_k': 0.08337552915566343, 'spread_hl_frac': 0.0370543197961196, 'bb_std_mult': 3.011586730722331, 'rsi_os': 28, 'rsi_ob': 46, 'vol_spike': 0.2201268279474605, 'adx_thresh': 20.495953882082695, 'atr_min_pct': 0.023443803475184623, 'atr_max_pct': 0.11229728645002139, 'tp_mult': 2.4673756885951224, 'tsl_mult': 0.36376414533793805, 'strategy': 'breakout', 'time_stop': 47, 'use_sma': False, 'use_atr': False, 'use_adx': False, 'use_ema': False, 'use_spike': True, 'rsi_required': False, 'edge_k': 1.4445552385361582, 'edge_cap': 0.960484774463014, 'bull_strategy': 'mean_reversion', 'bull_bb_std_mult': 3.397701010006194, 'bull_rsi_os': 6, 'bull_rsi_ob': 76, 'bull_adx_thresh': 13.244818215431089, 'bull_atr_min_pct': 0.022077255112500388, 'bull_atr_max_pct': 0.0465946018226393, 'bull_tp_mult': 1.617877789933802, 'bull_tsl_mult': 0.9497671846162584, 'bull_time_stop': 160, 'bull_use_sma': False, 'bull_use_ema': False, 'bull_use_atr': True, 'bull_use_adx': True, 'bull_use_spike': False, 'bull_rsi_required': True, 'bear_strategy': 'mean_reversion', 'bear_bb_std_mult': 0.7972409540260341, 'bear_rsi_os': 8, 'bear_rsi_ob': 45, 'bear_adx_thresh': 28.34067430068642, 'bear_atr_min_pct': 0.0015749674534297608, 'bear_atr_max_pct': 0.04476762748974712, 'bear_tp_mult': 2.14499667260456, 'bear_tsl_mult': 0.5767045204136017, 'bear_time_stop': 272, 'bear_use_sma': True, 'bear_use_ema': True, 'bear_use_atr': False, 'bear_use_adx': False, 'bear_use_spike': True, 'bear_rsi_required': False, 'sideways_strategy': 'mean_reversion', 'sideways_bb_std_mult': 0.7961276362527736, 'sideways_rsi_os': 24, 'sideways_rsi_ob': 65, 'sideways_adx_thresh': 18.894686620371782, 'sideways_atr_min_pct': 0.005899954905929318, 'sideways_atr_max_pct': 0.07167201574655754, 'sideways_tp_mult': 1.9017047459085343, 'sideways_tsl_mult': 0.38723097470339796, 'sideways_time_stop': 62, 'sideways_use_sma': False, 'sideways_use_ema': False, 'sideways_use_atr': False, 'sideways_use_adx': False, 'sideways_use_spike': True, 'sideways_rsi_required': True}.
[I 2025-08-31 04:26:11,469] Trial 352 finished with values: [-1000000000.0, 1000000000.0] and parameters: {'p_sma': 55, 'p_std': 15, 'p_atr': 21, 'p_adx': 8, 'rsi_period': 58, 'ema1': 14, 'ema2': 26, 'slip_atr_k': 0.022870748541408567, 'slip_spread_k': 0.10400172273095218, 'spread_hl_frac': 0.037336509402007625, 'bb_std_mult': 1.37068299843668, 'rsi_os': 28, 'rsi_ob': 65, 'vol_spike': 0.2202302114265729, 'adx_thresh': 23.218778335851493, 'atr_min_pct': 0.002332913571452499, 'atr_max_pct': 0.01792113905202236, 'tp_mult': 2.376724493720274, 'tsl_mult': 0.3904492903227602, 'strategy': 'mean_reversion', 'time_stop': 15, 'use_sma': False, 'use_atr': False, 'use_adx': False, 'use_ema': False, 'use_spike': True, 'rsi_required': False, 'edge_k': 1.502050229800468, 'edge_cap': 0.9134135863614057, 'bull_strategy': 'mean_reversion', 'bull_bb_std_mult': 3.3859817232839173, 'bull_rsi_os': 17, 'bull_rsi_ob': 76, 'bull_adx_thresh': 29.322478415822918, 'bull_atr_min_pct': 0.00829846037293275, 'bull_atr_max_pct': 0.04526037003666744, 'bull_tp_mult': 1.5833106601508362, 'bull_tsl_mult': 0.729499001833657, 'bull_time_stop': 142, 'bull_use_sma': False, 'bull_use_ema': False, 'bull_use_atr': True, 'bull_use_adx': True, 'bull_use_spike': False, 'bull_rsi_required': True, 'bear_strategy': 'mean_reversion', 'bear_bb_std_mult': 0.902133651756643, 'bear_rsi_os': 11, 'bear_rsi_ob': 50, 'bear_adx_thresh': 19.770725344839352, 'bear_atr_min_pct': 0.02405545176691873, 'bear_atr_max_pct': 0.06498908062644003, 'bear_tp_mult': 2.7590370529020216, 'bear_tsl_mult': 0.8184676691894067, 'bear_time_stop': 200, 'bear_use_sma': True, 'bear_use_ema': True, 'bear_use_atr': True, 'bear_use_adx': True, 'bear_use_spike': True, 'bear_rsi_required': True, 'sideways_strategy': 'breakout', 'sideways_bb_std_mult': 3.2748097161096057, 'sideways_rsi_os': 22, 'sideways_rsi_ob': 69, 'sideways_adx_thresh': 10.35730527767, 'sideways_atr_min_pct': 0.013936691489428821, 'sideways_atr_max_pct': 0.10640472671479587, 'sideways_tp_mult': 2.14585527914444, 'sideways_tsl_mult': 0.09376365305401052, 'sideways_time_stop': 75, 'sideways_use_sma': False, 'sideways_use_ema': False, 'sideways_use_atr': False, 'sideways_use_adx': True, 'sideways_use_spike': True, 'sideways_rsi_required': True}.
