[I 2025-08-31 04:09:08,329] Trial 267 finished with values: [-1000000000.0, 1000000000.0] and parameters: {'p_sma': 55, 'p_std': 19, 'p_atr': 25, 'p_adx': 9, 'rsi_period': 25, 'ema1': 14, 'ema2': 22, 'slip_atr_k': 0.03311393267618449, 'slip_spread_k': 0.09749806844022009, 'spread_hl_frac': 0.03848957481069483, 'bb_std_mult': 3.2671925455376476, 'rsi_os': 55, 'rsi_ob': 57, 'vol_spike': 0.29633823085773625, 'adx_thresh': 14.122913820104369, 'atr_min_pct': 0.018936366672274337, 'atr_max_pct': 0.03526136937284882, 'tp_mult': 2.54833921560891, 'tsl_mult': 0.8789473218011956, 'strategy': 'breakout', 'time_stop': 243, 'use_sma': False, 'use_atr': True, 'use_adx': False, 'use_ema': False, 'use_spike': True, 'rsi_required': False, 'edge_k': 1.5531671440272927, 'edge_cap': 0.9995619436270171, 'bull_strategy': 'mean_reversion', 'bull_bb_std_mult': 1.8373556914069613, 'bull_rsi_os': 44, 'bull_rsi_ob': 62, 'bull_adx_thresh': 8.605840132531718, 'bull_atr_min_pct': 0.015682897321127987, 'bull_atr_max_pct': 0.05295105162946845, 'bull_tp_mult': 1.5114796349731632, 'bull_tsl_mult': 0.21955025099015663, 'bull_time_stop': 148, 'bull_use_sma': False, 'bull_use_ema': False, 'bull_use_atr': True, 'bull_use_adx': True, 'bull_use_spike': False, 'bull_rsi_required': True, 'bear_strategy': 'mean_reversion', 'bear_bb_std_mult': 0.9343907705416895, 'bear_rsi_os': 7, 'bear_rsi_ob': 45, 'bear_adx_thresh': 21.166608381807404, 'bear_atr_min_pct': 0.025205695068092417, 'bear_atr_max_pct': 0.03243948050940601, 'bear_tp_mult': 1.9993860722517547, 'bear_tsl_mult': 0.21785966079647923, 'bear_time_stop': 194, 'bear_use_sma': True, 'bear_use_ema': True, 'bear_use_atr': True, 'bear_use_adx': True, 'bear_use_spike': True, 'bear_rsi_required': False, 'sideways_strategy': 'mean_reversion', 'sideways_bb_std_mult': 1.136356858684225, 'sideways_rsi_os': 25, 'sideways_rsi_ob': 51, 'sideways_adx_thresh': 10.765766706360287, 'sideways_atr_min_pct': 0.003632273375290382, 'sideways_atr_max_pct': 0.07787534669087491, 'sideways_tp_mult': 2.1052905249276463, 'sideways_tsl_mult': 0.587917813721754, 'sideways_time_stop': 67, 'sideways_use_sma': False, 'sideways_use_ema': False, 'sideways_use_atr': False, 'sideways_use_adx': True, 'sideways_use_spike': True, 'sideways_rsi_required': True}.
[I 2025-08-31 04:09:57,871] Trial 272 finished with values: [-1000000000.0, 1000000000.0] and parameters: {'p_sma': 55, 'p_std': 16, 'p_atr': 29, 'p_adx': 10, 'rsi_period': 65, 'ema1': 7, 'ema2': 19, 'slip_atr_k': 0.022234582332979338, 'slip_spread_k': 0.15472770890197318, 'spread_hl_frac': 0.034851217758528584, 'bb_std_mult': 1.8528900499040228, 'rsi_os': 34, 'rsi_ob': 61, 'vol_spike': 0.23596489195218584, 'adx_thresh': 18.384644722121106, 'atr_min_pct': 0.01906544139693642, 'atr_max_pct': 0.14012287697056547, 'tp_mult': 2.616151180635161, 'tsl_mult': 0.9296576931669353, 'strategy': 'breakout', 'time_stop': 44, 'use_sma': True, 'use_atr': False, 'use_adx': False, 'use_ema': False, 'use_spike': True, 'rsi_required': False, 'edge_k': 1.547725315889648, 'edge_cap': 0.9577132057991472, 'bull_strategy': 'mean_reversion', 'bull_bb_std_mult': 1.4900070236472094, 'bull_rsi_os': 16, 'bull_rsi_ob': 82, 'bull_adx_thresh': 10.925359685130342, 'bull_atr_min_pct': 0.01864811211153357, 'bull_atr_max_pct': 0.03816530242654792, 'bull_tp_mult': 1.676081758121191, 'bull_tsl_mult': 0.9390836229458115, 'bull_time_stop': 124, 'bull_use_sma': False, 'bull_use_ema': False, 'bull_use_atr': True, 'bull_use_adx': True, 'bull_use_spike': False, 'bull_rsi_required': True, 'bear_strategy': 'mean_reversion', 'bear_bb_std_mult': 2.237169255424018, 'bear_rsi_os': 10, 'bear_rsi_ob': 50, 'bear_adx_thresh': 19.039781590528232, 'bear_atr_min_pct': 0.024312130919369835, 'bear_atr_max_pct': 0.04666539488790189, 'bear_tp_mult': 1.7787257265738103, 'bear_tsl_mult': 0.21009821811159277, 'bear_time_stop': 183, 'bear_use_sma': True, 'bear_use_ema': True, 'bear_use_atr': True, 'bear_use_adx': True, 'bear_use_spike': True, 'bear_rsi_required': True, 'sideways_strategy': 'mean_reversion', 'sideways_bb_std_mult': 1.0244642974484786, 'sideways_rsi_os': 20, 'sideways_rsi_ob': 54, 'sideways_adx_thresh': 19.233563327645456, 'sideways_atr_min_pct': 0.014596139921337993, 'sideways_atr_max_pct': 0.13012020634994384, 'sideways_tp_mult': 2.0606806518233856, 'sideways_tsl_mult': 0.6455296198483165, 'sideways_time_stop': 66, 'sideways_use_sma': False, 'sideways_use_ema': False, 'sideways_use_atr': False, 'sideways_use_adx': True, 'sideways_use_spike': True, 'sideways_rsi_required': True}.
[I 2025-08-31 04:09:58,199] Trial 273 finished with values: [-1000000000.0, 1000000000.0] and parameters: {'p_sma': 26, 'p_std': 16, 'p_atr': 22, 'p_adx': 10, 'rsi_period': 64, 'ema1': 13, 'ema2': 19, 'slip_atr_k': 0.1398181598750061, 'slip_spread_k': 0.1514382942423103, 'spread_hl_frac': 0.0069857703877742, 'bb_std_mult': 1.8599420697046265, 'rsi_os': 35, 'rsi_ob': 77, 'vol_spike': 0.10902428594129351, 'adx_thresh': 31.21616702376899, 'atr_min_pct': 0.023064909920049764, 'atr_max_pct': 0.04522363081682011, 'tp_mult': 2.6125328820515152, 'tsl_mult': 0.0008672758640741463, 'strategy': 'mean_reversion', 'time_stop': 41, 'use_sma': True, 'use_atr': False, 'use_adx': False, 'use_ema': False, 'use_spike': True, 'rsi_required': False, 'edge_k': 1.4739550722555779, 'edge_cap': 0.5991550906272002, 'bull_strategy': 'mean_reversion', 'bull_bb_std_mult': 3.46314541284457, 'bull_rsi_os': 34, 'bull_rsi_ob': 62, 'bull_adx_thresh': 6.667882562992383, 'bull_atr_min_pct': 0.015522445221286998, 'bull_atr_max_pct': 0.04717204759013801, 'bull_tp_mult': 1.6630608740409805, 'bull_tsl_mult': 0.8735332318003399, 'bull_time_stop': 156, 'bull_use_sma': False, 'bull_use_ema': False, 'bull_use_atr': True, 'bull_use_adx': True, 'bull_use_spike': False, 'bull_rsi_required': True, 'bear_strategy': 'breakout', 'bear_bb_std_mult': 2.8486936903786604, 'bear_rsi_os': 10, 'bear_rsi_ob': 47, 'bear_adx_thresh': 19.117695186110364, 'bear_atr_min_pct': 0.024265891496157287, 'bear_atr_max_pct': 0.050382809314342906, 'bear_tp_mult': 1.7578818031225936, 'bear_tsl_mult': 0.2341516284510185, 'bear_time_stop': 185, 'bear_use_sma': True, 'bear_use_ema': True, 'bear_use_atr': True, 'bear_use_adx': True, 'bear_use_spike': True, 'bear_rsi_required': True, 'sideways_strategy': 'breakout', 'sideways_bb_std_mult': 1.0369843951089903, 'sideways_rsi_os': 20, 'sideways_rsi_ob': 55, 'sideways_adx_thresh': 5.157675973385182, 'sideways_atr_min_pct': 0.014447076357813988, 'sideways_atr_max_pct': 0.11100326006660818, 'sideways_tp_mult': 2.036853488072564, 'sideways_tsl_mult': 0.6486753688103605, 'sideways_time_stop': 60, 'sideways_use_sma': False, 'sideways_use_ema': False, 'sideways_use_atr': False, 'sideways_use_adx': True, 'sideways_use_spike': True, 'sideways_rsi_required': True}.
[I 2025-08-31 04:09:58,456] Trial 271 finished with values: [-1000000000.0, 1000000000.0] and parameters: {'p_sma': 57, 'p_std': 16, 'p_atr': 22, 'p_adx': 10, 'rsi_period': 65, 'ema1': 14, 'ema2': 19, 'slip_atr_k': 0.1403023091390051, 'slip_spread_k': 0.12327296424555027, 'spread_hl_frac': 0.012238387000838378, 'bb_std_mult': 3.5901117106364215, 'rsi_os': 35, 'rsi_ob': 92, 'vol_spike': 0.2377710281100428, 'adx_thresh': 9.186973927011048, 'atr_min_pct': 0.023087893708608684, 'atr_max_pct': 0.13630208567239008, 'tp_mult': 2.621883702859644, 'tsl_mult': 0.9141295792780902, 'strategy': 'breakout', 'time_stop': 185, 'use_sma': True, 'use_atr': True, 'use_adx': False, 'use_ema': False, 'use_spike': True, 'rsi_required': False, 'edge_k': 1.568727917606556, 'edge_cap': 0.9527856058622146, 'bull_strategy': 'mean_reversion', 'bull_bb_std_mult': 3.4605026620262365, 'bull_rsi_os': 16, 'bull_rsi_ob': 52, 'bull_adx_thresh': 6.595189653406612, 'bull_atr_min_pct': 0.011970327364185945, 'bull_atr_max_pct': 0.03902577069046657, 'bull_tp_mult': 1.6717239648380313, 'bull_tsl_mult': 0.3541823950526357, 'bull_time_stop': 156, 'bull_use_sma': False, 'bull_use_ema': False, 'bull_use_atr': True, 'bull_use_adx': True, 'bull_use_spike': False, 'bull_rsi_required': True, 'bear_strategy': 'mean_reversion', 'bear_bb_std_mult': 2.2520575957922135, 'bear_rsi_os': 10, 'bear_rsi_ob': 50, 'bear_adx_thresh': 20.91016078101554, 'bear_atr_min_pct': 0.024033767633351095, 'bear_atr_max_pct': 0.03166717683840467, 'bear_tp_mult': 1.9929865888740603, 'bear_tsl_mult': 0.24033575290294462, 'bear_time_stop': 184, 'bear_use_sma': True, 'bear_use_ema': True, 'bear_use_atr': True, 'bear_use_adx': True, 'bear_use_spike': True, 'bear_rsi_required': True, 'sideways_strategy': 'mean_reversion', 'sideways_bb_std_mult': 0.9564024443661584, 'sideways_rsi_os': 28, 'sideways_rsi_ob': 52, 'sideways_adx_thresh': 6.3867983765067, 'sideways_atr_min_pct': 0.014639267164842635, 'sideways_atr_max_pct': 0.05914298571275396, 'sideways_tp_mult': 1.348630012671547, 'sideways_tsl_mult': 0.5843538104766233, 'sideways_time_stop': 99, 'sideways_use_sma': False, 'sideways_use_ema': False, 'sideways_use_atr': False, 'sideways_use_adx': True, 'sideways_use_spike': True, 'sideways_rsi_required': True}.
[I 2025-08-31 04:09:58,684] Trial 274 finished with values: [-1000000000.0, 1000000000.0] and parameters: {'p_sma': 26, 'p_std': 15, 'p_atr': 24, 'p_adx': 10, 'rsi_period': 65, 'ema1': 13, 'ema2': 19, 'slip_atr_k': 0.1360182068027227, 'slip_spread_k': 0.1876564741424772, 'spread_hl_frac': 0.011253210787371801, 'bb_std_mult': 1.8581293878687404, 'rsi_os': 27, 'rsi_ob': 52, 'vol_spike': 0.018966116132572514, 'adx_thresh': 9.020750386674088, 'atr_min_pct': 0.01729122233696921, 'atr_max_pct': 0.14073011142887465, 'tp_mult': 2.6220641219471443, 'tsl_mult': 0.8511655307905266, 'strategy': 'mean_reversion', 'time_stop': 43, 'use_sma': True, 'use_atr': False, 'use_adx': False, 'use_ema': False, 'use_spike': True, 'rsi_required': False, 'edge_k': 1.4756805549259768, 'edge_cap': 0.9517441953251636, 'bull_strategy': 'mean_reversion', 'bull_bb_std_mult': 3.47432934245829, 'bull_rsi_os': 16, 'bull_rsi_ob': 78, 'bull_adx_thresh': 6.690031047304815, 'bull_atr_min_pct': 0.012074651427769895, 'bull_atr_max_pct': 0.03832066055176289, 'bull_tp_mult': 1.666133233411345, 'bull_tsl_mult': 0.906144302877792, 'bull_time_stop': 129, 'bull_use_sma': False, 'bull_use_ema': False, 'bull_use_atr': False, 'bull_use_adx': True, 'bull_use_spike': False, 'bull_rsi_required': True, 'bear_strategy': 'breakout', 'bear_bb_std_mult': 1.4241662949475504, 'bear_rsi_os': 10, 'bear_rsi_ob': 50, 'bear_adx_thresh': 16.725237192612397, 'bear_atr_min_pct': 0.024299335155689786, 'bear_atr_max_pct': 0.047041608357696746, 'bear_tp_mult': 2.807697310728621, 'bear_tsl_mult': 0.4428925297076696, 'bear_time_stop': 184, 'bear_use_sma': True, 'bear_use_ema': True, 'bear_use_atr': True, 'bear_use_adx': True, 'bear_use_spike': True, 'bear_rsi_required': True, 'sideways_strategy': 'breakout', 'sideways_bb_std_mult': 0.9510401695888288, 'sideways_rsi_os': 28, 'sideways_rsi_ob': 55, 'sideways_adx_thresh': 20.79385612589359, 'sideways_atr_min_pct': 0.01466563798387895, 'sideways_atr_max_pct': 0.05904604749557303, 'sideways_tp_mult': 2.053988512070998, 'sideways_tsl_mult': 0.6465153398159392, 'sideways_time_stop': 222, 'sideways_use_sma': False, 'sideways_use_ema': False, 'sideways_use_atr': False, 'sideways_use_adx': True, 'sideways_use_spike': True, 'sideways_rsi_required': True}.
[I 2025-08-31 04:10:49,337] Trial 277 finished with values: [-1000000000.0, 1000000000.0] and parameters: {'p_sma': 57, 'p_std': 15, 'p_atr': 24, 'p_adx': 15, 'rsi_period': 79, 'ema1': 15, 'ema2': 16, 'slip_atr_k': 0.01215199502244995, 'slip_spread_k': 0.09402333264649873, 'spread_hl_frac': 0.008580118741797165, 'bb_std_mult': 2.840333985249541, 'rsi_os': 27, 'rsi_ob': 61, 'vol_spike': 0.03370411040742623, 'adx_thresh': 7.545915024675523, 'atr_min_pct': 0.01741805288431187, 'atr_max_pct': 0.054760243527223716, 'tp_mult': 2.9098782281256357, 'tsl_mult': 0.805573597687776, 'strategy': 'mean_reversion', 'time_stop': 295, 'use_sma': False, 'use_atr': False, 'use_adx': True, 'use_ema': False, 'use_spike': True, 'rsi_required': True, 'edge_k': 1.9959976702264255, 'edge_cap': 0.9832800286416736, 'bull_strategy': 'mean_reversion', 'bull_bb_std_mult': 3.483568092245604, 'bull_rsi_os': 51, 'bull_rsi_ob': 66, 'bull_adx_thresh': 15.181167760382284, 'bull_atr_min_pct': 0.0026772751461402603, 'bull_atr_max_pct': 0.04615527042591845, 'bull_tp_mult': 2.504014396444135, 'bull_tsl_mult': 0.0007065973007056026, 'bull_time_stop': 253, 'bull_use_sma': True, 'bull_use_ema': True, 'bull_use_atr': False, 'bull_use_adx': False, 'bull_use_spike': False, 'bull_rsi_required': True, 'bear_strategy': 'breakout', 'bear_bb_std_mult': 2.691059312844123, 'bear_rsi_os': 11, 'bear_rsi_ob': 78, 'bear_adx_thresh': 20.460495326381853, 'bear_atr_min_pct': 0.023180815334330016, 'bear_atr_max_pct': 0.09124512723262368, 'bear_tp_mult': 2.61217247949779, 'bear_tsl_mult': 0.9761435458526266, 'bear_time_stop': 290, 'bear_use_sma': False, 'bear_use_ema': False, 'bear_use_atr': False, 'bear_use_adx': True, 'bear_use_spike': False, 'bear_rsi_required': True, 'sideways_strategy': 'breakout', 'sideways_bb_std_mult': 2.6706806378590224, 'sideways_rsi_os': 14, 'sideways_rsi_ob': 94, 'sideways_adx_thresh': 34.984052271631676, 'sideways_atr_min_pct': 0.013415289339138234, 'sideways_atr_max_pct': 0.12388971228504086, 'sideways_tp_mult': 1.9958773690602645, 'sideways_tsl_mult': 0.6275481351713643, 'sideways_time_stop': 36, 'sideways_use_sma': False, 'sideways_use_ema': True, 'sideways_use_atr': True, 'sideways_use_adx': False, 'sideways_use_spike': False, 'sideways_rsi_required': False}.
[I 2025-08-31 04:10:49,346] Trial 276 finished with values: [-1000000000.0, 1000000000.0] and parameters: {'p_sma': 57, 'p_std': 13, 'p_atr': 24, 'p_adx': 8, 'rsi_period': 20, 'ema1': 13, 'ema2': 26, 'slip_atr_k': 0.13543499705638198, 'slip_spread_k': 0.03176341964515095, 'spread_hl_frac': 0.008101894897833254, 'bb_std_mult': 1.7180109644336312, 'rsi_os': 30, 'rsi_ob': 61, 'vol_spike': 0.034365052032091954, 'adx_thresh': 9.07990507681064, 'atr_min_pct': 0.023794532204407415, 'atr_max_pct': 0.11549940066860619, 'tp_mult': 2.364491097157249, 'tsl_mult': 0.6401913685860914, 'strategy': 'breakout', 'time_stop': 35, 'use_sma': False, 'use_atr': False, 'use_adx': False, 'use_ema': False, 'use_spike': True, 'rsi_required': False, 'edge_k': 1.9941976272333346, 'edge_cap': 0.9386629600054349, 'bull_strategy': 'mean_reversion', 'bull_bb_std_mult': 2.141175554046839, 'bull_rsi_os': 15, 'bull_rsi_ob': 52, 'bull_adx_thresh': 15.911183333862418, 'bull_atr_min_pct': 0.012109792796794114, 'bull_atr_max_pct': 0.04585304431264891, 'bull_tp_mult': 1.625459074615612, 'bull_tsl_mult': 0.8988507423498227, 'bull_time_stop': 129, 'bull_use_sma': False, 'bull_use_ema': True, 'bull_use_atr': False, 'bull_use_adx': False, 'bull_use_spike': False, 'bull_rsi_required': True, 'bear_strategy': 'mean_reversion', 'bear_bb_std_mult': 2.7238022444740513, 'bear_rsi_os': 6, 'bear_rsi_ob': 77, 'bear_adx_thresh': 20.583501817852717, 'bear_atr_min_pct': 0.023250782002255905, 'bear_atr_max_pct': 0.04372627083374727, 'bear_tp_mult': 2.632295814886107, 'bear_tsl_mult': 0.26363453911099066, 'bear_time_stop': 207, 'bear_use_sma': False, 'bear_use_ema': False, 'bear_use_atr': False, 'bear_use_adx': True, 'bear_use_spike': False, 'bear_rsi_required': True, 'sideways_strategy': 'mean_reversion', 'sideways_bb_std_mult': 1.8702726082578125, 'sideways_rsi_os': 43, 'sideways_rsi_ob': 76, 'sideways_adx_thresh': 11.831139962824675, 'sideways_atr_min_pct': 0.013417314497501082, 'sideways_atr_max_pct': 0.117171191637642, 'sideways_tp_mult': 2.0060520450655694, 'sideways_tsl_mult': 0.5624680099860417, 'sideways_time_stop': 79, 'sideways_use_sma': False, 'sideways_use_ema': False, 'sideways_use_atr': False, 'sideways_use_adx': False, 'sideways_use_spike': True, 'sideways_rsi_required': False}.
[I 2025-08-31 04:10:49,781] Trial 275 finished with values: [-1000000000.0, 1000000000.0] and parameters: {'p_sma': 57, 'p_std': 60, 'p_atr': 24, 'p_adx': 8, 'rsi_period': 20, 'ema1': 13, 'ema2': 16, 'slip_atr_k': 0.21990189398930315, 'slip_spread_k': 0.036150637915292674, 'spread_hl_frac': 0.008066597049133829, 'bb_std_mult': 1.724354845694444, 'rsi_os': 27, 'rsi_ob': 59, 'vol_spike': 0.24380274361667625, 'adx_thresh': 9.033477612326445, 'atr_min_pct': 0.02296468816841939, 'atr_max_pct': 0.11659776568799995, 'tp_mult': 2.5951130976625008, 'tsl_mult': 0.8071534283666086, 'strategy': 'mean_reversion', 'time_stop': 188, 'use_sma': True, 'use_atr': False, 'use_adx': False, 'use_ema': False, 'use_spike': True, 'rsi_required': False, 'edge_k': 1.4891223465839205, 'edge_cap': 0.9357122258562851, 'bull_strategy': 'mean_reversion', 'bull_bb_std_mult': 3.478173188326627, 'bull_rsi_os': 15, 'bull_rsi_ob': 52, 'bull_adx_thresh': 15.234459317874641, 'bull_atr_min_pct': 0.002760206949079422, 'bull_atr_max_pct': 0.04716441082330238, 'bull_tp_mult': 1.6594582068437356, 'bull_tsl_mult': 0.9053279545269632, 'bull_time_stop': 105, 'bull_use_sma': False, 'bull_use_ema': False, 'bull_use_atr': False, 'bull_use_adx': True, 'bull_use_spike': False, 'bull_rsi_required': True, 'bear_strategy': 'breakout', 'bear_bb_std_mult': 2.8043604605385335, 'bear_rsi_os': 10, 'bear_rsi_ob': 77, 'bear_adx_thresh': 28.257868800485827, 'bear_atr_min_pct': 0.024042676709761287, 'bear_atr_max_pct': 0.0999839370006313, 'bear_tp_mult': 1.7439745376024733, 'bear_tsl_mult': 0.9975031167803631, 'bear_time_stop': 210, 'bear_use_sma': True, 'bear_use_ema': True, 'bear_use_atr': True, 'bear_use_adx': True, 'bear_use_spike': True, 'bear_rsi_required': True, 'sideways_strategy': 'breakout', 'sideways_bb_std_mult': 0.9371857252202215, 'sideways_rsi_os': 28, 'sideways_rsi_ob': 55, 'sideways_adx_thresh': 20.99698131667538, 'sideways_atr_min_pct': 0.013876575341248991, 'sideways_atr_max_pct': 0.12306738586227042, 'sideways_tp_mult': 2.014923547805321, 'sideways_tsl_mult': 0.6317652103887232, 'sideways_time_stop': 36, 'sideways_use_sma': False, 'sideways_use_ema': False, 'sideways_use_atr': False, 'sideways_use_adx': True, 'sideways_use_spike': True, 'sideways_rsi_required': True}.
[I 2025-08-31 04:10:50,199] Trial 278 finished with values: [-1000000000.0, 1000000000.0] and parameters: {'p_sma': 57, 'p_std': 13, 'p_atr': 23, 'p_adx': 23, 'rsi_period': 21, 'ema1': 15, 'ema2': 46, 'slip_atr_k': 0.012121724250185317, 'slip_spread_k': 0.08091956600207165, 'spread_hl_frac': 0.008273214026471753, 'bb_std_mult': 1.9712140087684538, 'rsi_os': 29, 'rsi_ob': 75, 'vol_spike': 0.0339792945212892, 'adx_thresh': 19.069403135562233, 'atr_min_pct': 0.023983184760154336, 'atr_max_pct': 0.11678444369310653, 'tp_mult': 2.7375475957649136, 'tsl_mult': 0.8004099432615576, 'strategy': 'breakout', 'time_stop': 34, 'use_sma': False, 'use_atr': False, 'use_adx': True, 'use_ema': False, 'use_spike': True, 'rsi_required': True, 'edge_k': 1.374230170962866, 'edge_cap': 0.16472343390143596, 'bull_strategy': 'mean_reversion', 'bull_bb_std_mult': 3.3977125579226337, 'bull_rsi_os': 7, 'bull_rsi_ob': 66, 'bull_adx_thresh': 11.629032598908012, 'bull_atr_min_pct': 0.008010268975753788, 'bull_atr_max_pct': 0.04586901481765213, 'bull_tp_mult': 1.608022034154324, 'bull_tsl_mult': 0.8955139996121301, 'bull_time_stop': 137, 'bull_use_sma': True, 'bull_use_ema': True, 'bull_use_atr': False, 'bull_use_adx': False, 'bull_use_spike': False, 'bull_rsi_required': True, 'bear_strategy': 'mean_reversion', 'bear_bb_std_mult': 0.9933753411059252, 'bear_rsi_os': 6, 'bear_rsi_ob': 80, 'bear_adx_thresh': 6.435198819962055, 'bear_atr_min_pct': 0.023161617620240924, 'bear_atr_max_pct': 0.09949156935385499, 'bear_tp_mult': 2.905532311172606, 'bear_tsl_mult': 0.2822052587891317, 'bear_time_stop': 199, 'bear_use_sma': False, 'bear_use_ema': False, 'bear_use_atr': False, 'bear_use_adx': True, 'bear_use_spike': False, 'bear_rsi_required': False, 'sideways_strategy': 'mean_reversion', 'sideways_bb_std_mult': 2.6712096444647773, 'sideways_rsi_os': 5, 'sideways_rsi_ob': 53, 'sideways_adx_thresh': 33.860244147920596, 'sideways_atr_min_pct': 0.013619014941514672, 'sideways_atr_max_pct': 0.11769534593550038, 'sideways_tp_mult': 1.97238032119722, 'sideways_tsl_mult': 0.5510504062572213, 'sideways_time_stop': 163, 'sideways_use_sma': False, 'sideways_use_ema': True, 'sideways_use_atr': True, 'sideways_use_adx': False, 'sideways_use_spike': False, 'sideways_rsi_required': False}.
