[I 2025-08-31 05:07:14,974] Trial 566 finished with values: [-1000000000.0, 1000000000.0] and parameters: {'p_sma': 56, 'p_std': 59, 'p_atr': 24, 'p_adx': 25, 'rsi_period': 24, 'ema1': 7, 'ema2': 27, 'slip_atr_k': 0.19223031297548288, 'slip_spread_k': 0.06308146888071013, 'spread_hl_frac': 0.016504228088539838, 'bb_std_mult': 1.942801299899254, 'rsi_os': 24, 'rsi_ob': 56, 'vol_spike': 0.16722380762841477, 'adx_thresh': 13.239223948683613, 'atr_min_pct': 0.023692684114257234, 'atr_max_pct': 0.13307436267298406, 'tp_mult': 1.1520132257047893, 'tsl_mult': 0.5712182363270452, 'strategy': 'mean_reversion', 'time_stop': 74, 'use_sma': False, 'use_atr': False, 'use_adx': False, 'use_ema': True, 'use_spike': False, 'rsi_required': False, 'edge_k': 1.3144946845651728, 'edge_cap': 0.16875895969833477, 'bull_strategy': 'mean_reversion', 'bull_bb_std_mult': 1.539904103724459, 'bull_rsi_os': 15, 'bull_rsi_ob': 95, 'bull_adx_thresh': 11.540270819022819, 'bull_atr_min_pct': 0.0028401321878522914, 'bull_atr_max_pct': 0.11090428726901391, 'bull_tp_mult': 1.612906672485637, 'bull_tsl_mult': 0.8866555628655629, 'bull_time_stop': 240, 'bull_use_sma': False, 'bull_use_ema': False, 'bull_use_atr': True, 'bull_use_adx': True, 'bull_use_spike': True, 'bull_rsi_required': True, 'bear_strategy': 'mean_reversion', 'bear_bb_std_mult': 0.857348595253625, 'bear_rsi_os': 34, 'bear_rsi_ob': 89, 'bear_adx_thresh': 19.587080094156075, 'bear_atr_min_pct': 0.023317396954798852, 'bear_atr_max_pct': 0.03935403820719292, 'bear_tp_mult': 1.545825190448974, 'bear_tsl_mult': 0.2667211842826048, 'bear_time_stop': 87, 'bear_use_sma': True, 'bear_use_ema': True, 'bear_use_atr': False, 'bear_use_adx': True, 'bear_use_spike': True, 'bear_rsi_required': False, 'sideways_strategy': 'breakout', 'sideways_bb_std_mult': 1.2203256213729217, 'sideways_rsi_os': 26, 'sideways_rsi_ob': 86, 'sideways_adx_thresh': 10.50493759574074, 'sideways_atr_min_pct': 0.012039316734690008, 'sideways_atr_max_pct': 0.11527681032129812, 'sideways_tp_mult': 1.8741786448462123, 'sideways_tsl_mult': 0.2227630008210379, 'sideways_time_stop': 245, 'sideways_use_sma': True, 'sideways_use_ema': False, 'sideways_use_atr': False, 'sideways_use_adx': True, 'sideways_use_spike': True, 'sideways_rsi_required': True}.
[I 2025-08-31 05:08:08,047] Trial 569 finished with values: [-1000000000.0, 1000000000.0] and parameters: {'p_sma': 56, 'p_std': 49, 'p_atr': 15, 'p_adx': 10, 'rsi_period': 24, 'ema1': 14, 'ema2': 27, 'slip_atr_k': 0.024361649740192313, 'slip_spread_k': 0.1287903588911794, 'spread_hl_frac': 0.011400581955076126, 'bb_std_mult': 1.9575027668091418, 'rsi_os': 22, 'rsi_ob': 57, 'vol_spike': 0.044649367074744234, 'adx_thresh': 20.926386195221145, 'atr_min_pct': 0.0009759415936610814, 'atr_max_pct': 0.05262261301504526, 'tp_mult': 2.555347424389604, 'tsl_mult': 0.37149072361783664, 'strategy': 'breakout', 'time_stop': 23, 'use_sma': True, 'use_atr': True, 'use_adx': False, 'use_ema': True, 'use_spike': False, 'rsi_required': False, 'edge_k': 1.9936019578490232, 'edge_cap': 0.23231420127400715, 'bull_strategy': 'mean_reversion', 'bull_bb_std_mult': 3.4565667258608173, 'bull_rsi_os': 16, 'bull_rsi_ob': 94, 'bull_adx_thresh': 11.51062650664747, 'bull_atr_min_pct': 0.002626600934620455, 'bull_atr_max_pct': 0.08524588314421072, 'bull_tp_mult': 1.3831913309583863, 'bull_tsl_mult': 0.8864111694065232, 'bull_time_stop': 166, 'bull_use_sma': False, 'bull_use_ema': True, 'bull_use_atr': False, 'bull_use_adx': True, 'bull_use_spike': True, 'bull_rsi_required': True, 'bear_strategy': 'breakout', 'bear_bb_std_mult': 0.8558597781170668, 'bear_rsi_os': 11, 'bear_rsi_ob': 48, 'bear_adx_thresh': 18.848575074561722, 'bear_atr_min_pct': 0.017648147963712287, 'bear_atr_max_pct': 0.02463518953660434, 'bear_tp_mult': 2.2067368888480856, 'bear_tsl_mult': 0.16293813852923644, 'bear_time_stop': 134, 'bear_use_sma': True, 'bear_use_ema': False, 'bear_use_atr': False, 'bear_use_adx': True, 'bear_use_spike': True, 'bear_rsi_required': False, 'sideways_strategy': 'mean_reversion', 'sideways_bb_std_mult': 1.5429000138348492, 'sideways_rsi_os': 26, 'sideways_rsi_ob': 54, 'sideways_adx_thresh': 11.208887519897658, 'sideways_atr_min_pct': 0.016923834518453806, 'sideways_atr_max_pct': 0.11780991218627898, 'sideways_tp_mult': 2.0188376421360865, 'sideways_tsl_mult': 0.617054348460336, 'sideways_time_stop': 64, 'sideways_use_sma': True, 'sideways_use_ema': False, 'sideways_use_atr': False, 'sideways_use_adx': False, 'sideways_use_spike': True, 'sideways_rsi_required': True}.
[I 2025-08-31 05:08:08,567] Trial 571 finished with values: [-1000000000.0, 1000000000.0] and parameters: {'p_sma': 20, 'p_std': 9, 'p_atr': 13, 'p_adx': 10, 'rsi_period': 43, 'ema1': 23, 'ema2': 33, 'slip_atr_k': 0.07076385279704828, 'slip_spread_k': 0.4677475899824448, 'spread_hl_frac': 0.011095916495154743, 'bb_std_mult': 1.9502977784836237, 'rsi_os': 29, 'rsi_ob': 59, 'vol_spike': 0.044979336034250285, 'adx_thresh': 20.917253209527125, 'atr_min_pct': 0.015244067852102607, 'atr_max_pct': 0.12529400616511865, 'tp_mult': 2.5396283686755527, 'tsl_mult': 0.9052618043391505, 'strategy': 'breakout', 'time_stop': 25, 'use_sma': True, 'use_atr': True, 'use_adx': False, 'use_ema': False, 'use_spike': True, 'rsi_required': False, 'edge_k': 1.4828593224182796, 'edge_cap': 0.9428314412428722, 'bull_strategy': 'mean_reversion', 'bull_bb_std_mult': 3.455771763545105, 'bull_rsi_os': 16, 'bull_rsi_ob': 53, 'bull_adx_thresh': 10.904006862363278, 'bull_atr_min_pct': 0.00888680825198862, 'bull_atr_max_pct': 0.08152709802682429, 'bull_tp_mult': 1.460189439917016, 'bull_tsl_mult': 0.05417038683304093, 'bull_time_stop': 153, 'bull_use_sma': False, 'bull_use_ema': False, 'bull_use_atr': False, 'bull_use_adx': True, 'bull_use_spike': False, 'bull_rsi_required': True, 'bear_strategy': 'breakout', 'bear_bb_std_mult': 0.949508478215924, 'bear_rsi_os': 37, 'bear_rsi_ob': 48, 'bear_adx_thresh': 6.444070071490671, 'bear_atr_min_pct': 0.021721185286500348, 'bear_atr_max_pct': 0.1281749699256255, 'bear_tp_mult': 2.1864361377095074, 'bear_tsl_mult': 0.21447338094178883, 'bear_time_stop': 46, 'bear_use_sma': True, 'bear_use_ema': True, 'bear_use_atr': False, 'bear_use_adx': True, 'bear_use_spike': True, 'bear_rsi_required': False, 'sideways_strategy': 'mean_reversion', 'sideways_bb_std_mult': 3.008378965769883, 'sideways_rsi_os': 27, 'sideways_rsi_ob': 81, 'sideways_adx_thresh': 11.23376155221509, 'sideways_atr_min_pct': 0.015371339043372031, 'sideways_atr_max_pct': 0.12002089796508583, 'sideways_tp_mult': 1.9126113934702258, 'sideways_tsl_mult': 0.61474578317798, 'sideways_time_stop': 47, 'sideways_use_sma': False, 'sideways_use_ema': False, 'sideways_use_atr': False, 'sideways_use_adx': False, 'sideways_use_spike': True, 'sideways_rsi_required': True}.
[I 2025-08-31 05:08:09,134] Trial 568 finished with values: [-1000000000.0, 1000000000.0] and parameters: {'p_sma': 10, 'p_std': 9, 'p_atr': 13, 'p_adx': 10, 'rsi_period': 24, 'ema1': 6, 'ema2': 27, 'slip_atr_k': 0.07300621087092701, 'slip_spread_k': 0.13063857611811935, 'spread_hl_frac': 0.016873847987092547, 'bb_std_mult': 1.8145031330155716, 'rsi_os': 25, 'rsi_ob': 57, 'vol_spike': 0.20860526681310468, 'adx_thresh': 30.04648346978808, 'atr_min_pct': 0.012516903338101947, 'atr_max_pct': 0.12588495402278294, 'tp_mult': 2.560604582157817, 'tsl_mult': 0.2911580194773832, 'strategy': 'breakout', 'time_stop': 51, 'use_sma': True, 'use_atr': True, 'use_adx': False, 'use_ema': True, 'use_spike': False, 'rsi_required': False, 'edge_k': 1.4861799933396898, 'edge_cap': 0.7345302262061982, 'bull_strategy': 'mean_reversion', 'bull_bb_std_mult': 3.4594519096567358, 'bull_rsi_os': 16, 'bull_rsi_ob': 77, 'bull_adx_thresh': 32.51697324061692, 'bull_atr_min_pct': 0.009172472046095899, 'bull_atr_max_pct': 0.11519506925268388, 'bull_tp_mult': 1.8242065737129556, 'bull_tsl_mult': 0.8877373407242132, 'bull_time_stop': 144, 'bull_use_sma': False, 'bull_use_ema': True, 'bull_use_atr': False, 'bull_use_adx': True, 'bull_use_spike': True, 'bull_rsi_required': True, 'bear_strategy': 'breakout', 'bear_bb_std_mult': 0.8580986639409648, 'bear_rsi_os': 34, 'bear_rsi_ob': 91, 'bear_adx_thresh': 11.291020492547458, 'bear_atr_min_pct': 0.021556421937990462, 'bear_atr_max_pct': 0.0723627172629544, 'bear_tp_mult': 2.7983627936313953, 'bear_tsl_mult': 0.1710472492842477, 'bear_time_stop': 19, 'bear_use_sma': True, 'bear_use_ema': False, 'bear_use_atr': False, 'bear_use_adx': True, 'bear_use_spike': True, 'bear_rsi_required': False, 'sideways_strategy': 'mean_reversion', 'sideways_bb_std_mult': 1.0099531770758918, 'sideways_rsi_os': 27, 'sideways_rsi_ob': 86, 'sideways_adx_thresh': 11.318748907100407, 'sideways_atr_min_pct': 0.011802473005988738, 'sideways_atr_max_pct': 0.118439335924656, 'sideways_tp_mult': 1.4751087333048132, 'sideways_tsl_mult': 0.6178524762505191, 'sideways_time_stop': 63, 'sideways_use_sma': True, 'sideways_use_ema': False, 'sideways_use_atr': False, 'sideways_use_adx': False, 'sideways_use_spike': True, 'sideways_rsi_required': True}.
[I 2025-08-31 05:08:09,364] Trial 570 finished with values: [-1000000000.0, 1000000000.0] and parameters: {'p_sma': 56, 'p_std': 50, 'p_atr': 13, 'p_adx': 18, 'rsi_period': 24, 'ema1': 14, 'ema2': 27, 'slip_atr_k': 0.1918945954090001, 'slip_spread_k': 0.12587461323960009, 'spread_hl_frac': 0.011147174149944629, 'bb_std_mult': 1.9263204809512753, 'rsi_os': 29, 'rsi_ob': 45, 'vol_spike': 0.04381318813653649, 'adx_thresh': 21.21508766106613, 'atr_min_pct': 0.0008300887001804064, 'atr_max_pct': 0.12539039316103004, 'tp_mult': 2.5603877880774872, 'tsl_mult': 0.36389112120356515, 'strategy': 'breakout', 'time_stop': 53, 'use_sma': True, 'use_atr': True, 'use_adx': False, 'use_ema': True, 'use_spike': False, 'rsi_required': False, 'edge_k': 1.1013454794589521, 'edge_cap': 0.3998587224818113, 'bull_strategy': 'mean_reversion', 'bull_bb_std_mult': 3.4588508160955884, 'bull_rsi_os': 48, 'bull_rsi_ob': 53, 'bull_adx_thresh': 11.659311091477615, 'bull_atr_min_pct': 0.008581280179164947, 'bull_atr_max_pct': 0.04069211301200889, 'bull_tp_mult': 1.6586605258513483, 'bull_tsl_mult': 0.8771031819791962, 'bull_time_stop': 65, 'bull_use_sma': False, 'bull_use_ema': False, 'bull_use_atr': False, 'bull_use_adx': True, 'bull_use_spike': True, 'bull_rsi_required': True, 'bear_strategy': 'breakout', 'bear_bb_std_mult': 1.1930505565067016, 'bear_rsi_os': 34, 'bear_rsi_ob': 48, 'bear_adx_thresh': 18.848959904536866, 'bear_atr_min_pct': 0.02345514416662966, 'bear_atr_max_pct': 0.023931665022002044, 'bear_tp_mult': 2.7436785749601427, 'bear_tsl_mult': 0.30044676600293846, 'bear_time_stop': 23, 'bear_use_sma': True, 'bear_use_ema': True, 'bear_use_atr': False, 'bear_use_adx': True, 'bear_use_spike': True, 'bear_rsi_required': False, 'sideways_strategy': 'mean_reversion', 'sideways_bb_std_mult': 3.027764638285714, 'sideways_rsi_os': 27, 'sideways_rsi_ob': 87, 'sideways_adx_thresh': 16.353071948095586, 'sideways_atr_min_pct': 0.011929869569465975, 'sideways_atr_max_pct': 0.09990614652015563, 'sideways_tp_mult': 1.8911656208584107, 'sideways_tsl_mult': 0.39164667895705835, 'sideways_time_stop': 274, 'sideways_use_sma': True, 'sideways_use_ema': False, 'sideways_use_atr': False, 'sideways_use_adx': False, 'sideways_use_spike': True, 'sideways_rsi_required': True}.
[I 2025-08-31 05:08:59,405] Trial 574 finished with values: [-1000000000.0, 1000000000.0] and parameters: {'p_sma': 52, 'p_std': 19, 'p_atr': 24, 'p_adx': 18, 'rsi_period': 84, 'ema1': 14, 'ema2': 54, 'slip_atr_k': 0.0303039133258115, 'slip_spread_k': 0.8617428480343003, 'spread_hl_frac': 0.01005305542160721, 'bb_std_mult': 1.7837383036435894, 'rsi_os': 28, 'rsi_ob': 62, 'vol_spike': 0.016197381626422754, 'adx_thresh': 23.582077714990778, 'atr_min_pct': 0.02496859596036944, 'atr_max_pct': 0.12990323374741594, 'tp_mult': 2.8764883663968766, 'tsl_mult': 0.9600636888427101, 'strategy': 'breakout', 'time_stop': 213, 'use_sma': False, 'use_atr': False, 'use_adx': False, 'use_ema': False, 'use_spike': True, 'rsi_required': False, 'edge_k': 1.0731609998063332, 'edge_cap': 0.9994992348876632, 'bull_strategy': 'mean_reversion', 'bull_bb_std_mult': 3.541349131822255, 'bull_rsi_os': 13, 'bull_rsi_ob': 77, 'bull_adx_thresh': 28.767278446170025, 'bull_atr_min_pct': 0.010725545743247904, 'bull_atr_max_pct': 0.04101004775488665, 'bull_tp_mult': 1.2688693740016874, 'bull_tsl_mult': 0.3535084823432173, 'bull_time_stop': 72, 'bull_use_sma': False, 'bull_use_ema': False, 'bull_use_atr': True, 'bull_use_adx': True, 'bull_use_spike': False, 'bull_rsi_required': True, 'bear_strategy': 'mean_reversion', 'bear_bb_std_mult': 1.1789933037290798, 'bear_rsi_os': 51, 'bear_rsi_ob': 46, 'bear_adx_thresh': 13.835013851537823, 'bear_atr_min_pct': 0.0019627629958627775, 'bear_atr_max_pct': 0.0639257762665661, 'bear_tp_mult': 2.7409158185583107, 'bear_tsl_mult': 0.24468009211469385, 'bear_time_stop': 190, 'bear_use_sma': True, 'bear_use_ema': True, 'bear_use_atr': True, 'bear_use_adx': True, 'bear_use_spike': True, 'bear_rsi_required': True, 'sideways_strategy': 'mean_reversion', 'sideways_bb_std_mult': 1.4517109713835539, 'sideways_rsi_os': 29, 'sideways_rsi_ob': 84, 'sideways_adx_thresh': 9.633017471086301, 'sideways_atr_min_pct': 0.01310660176084874, 'sideways_atr_max_pct': 0.12410680735944477, 'sideways_tp_mult': 1.0355563434277326, 'sideways_tsl_mult': 0.3896043572062235, 'sideways_time_stop': 68, 'sideways_use_sma': False, 'sideways_use_ema': False, 'sideways_use_atr': False, 'sideways_use_adx': True, 'sideways_use_spike': True, 'sideways_rsi_required': True}.
[I 2025-08-31 05:08:59,706] Trial 575 finished with values: [-1000000000.0, 1000000000.0] and parameters: {'p_sma': 52, 'p_std': 47, 'p_atr': 24, 'p_adx': 8, 'rsi_period': 83, 'ema1': 13, 'ema2': 24, 'slip_atr_k': 0.023466075075543803, 'slip_spread_k': 0.34708964642238205, 'spread_hl_frac': 0.009994535839663646, 'bb_std_mult': 1.87479805308777, 'rsi_os': 28, 'rsi_ob': 59, 'vol_spike': 0.01331441709502229, 'adx_thresh': 10.992559046024672, 'atr_min_pct': 0.024816036409986378, 'atr_max_pct': 0.12895968799719587, 'tp_mult': 1.3857241310453978, 'tsl_mult': 0.9311818549248515, 'strategy': 'breakout', 'time_stop': 214, 'use_sma': False, 'use_atr': False, 'use_adx': False, 'use_ema': False, 'use_spike': True, 'rsi_required': False, 'edge_k': 1.4324741959690048, 'edge_cap': 0.9999048118333638, 'bull_strategy': 'mean_reversion', 'bull_bb_std_mult': 3.2714738033579893, 'bull_rsi_os': 9, 'bull_rsi_ob': 77, 'bull_adx_thresh': 27.92856609590389, 'bull_atr_min_pct': 0.006680678321203054, 'bull_atr_max_pct': 0.05139169284420496, 'bull_tp_mult': 1.733349703977744, 'bull_tsl_mult': 0.8607460765475516, 'bull_time_stop': 132, 'bull_use_sma': False, 'bull_use_ema': False, 'bull_use_atr': True, 'bull_use_adx': True, 'bull_use_spike': False, 'bull_rsi_required': True, 'bear_strategy': 'mean_reversion', 'bear_bb_std_mult': 0.5011608110203951, 'bear_rsi_os': 7, 'bear_rsi_ob': 46, 'bear_adx_thresh': 31.626127645534545, 'bear_atr_min_pct': 0.00737930614736561, 'bear_atr_max_pct': 0.04049678474001997, 'bear_tp_mult': 2.75002220223818, 'bear_tsl_mult': 0.2401567564862642, 'bear_time_stop': 192, 'bear_use_sma': True, 'bear_use_ema': True, 'bear_use_atr': True, 'bear_use_adx': True, 'bear_use_spike': True, 'bear_rsi_required': True, 'sideways_strategy': 'mean_reversion', 'sideways_bb_std_mult': 2.722812888461972, 'sideways_rsi_os': 17, 'sideways_rsi_ob': 53, 'sideways_adx_thresh': 11.825074694184979, 'sideways_atr_min_pct': 0.013986192497673841, 'sideways_atr_max_pct': 0.1071026297097151, 'sideways_tp_mult': 1.8005409644232233, 'sideways_tsl_mult': 0.08732019901701327, 'sideways_time_stop': 70, 'sideways_use_sma': False, 'sideways_use_ema': False, 'sideways_use_atr': False, 'sideways_use_adx': True, 'sideways_use_spike': True, 'sideways_rsi_required': True}.
[I 2025-08-31 05:09:00,003] Trial 573 finished with values: [-1000000000.0, 1000000000.0] and parameters: {'p_sma': 55, 'p_std': 19, 'p_atr': 23, 'p_adx': 8, 'rsi_period': 52, 'ema1': 14, 'ema2': 23, 'slip_atr_k': 0.027044364670816487, 'slip_spread_k': 0.12264310699621411, 'spread_hl_frac': 0.013522996897425555, 'bb_std_mult': 1.8675571800960349, 'rsi_os': 37, 'rsi_ob': 88, 'vol_spike': 0.013377358536269103, 'adx_thresh': 23.712204234094152, 'atr_min_pct': 0.025254220998219473, 'atr_max_pct': 0.13024279372226732, 'tp_mult': 1.2079130493947825, 'tsl_mult': 0.9635071645798299, 'strategy': 'breakout', 'time_stop': 279, 'use_sma': False, 'use_atr': False, 'use_adx': False, 'use_ema': False, 'use_spike': True, 'rsi_required': False, 'edge_k': 1.440543313206948, 'edge_cap': 0.9836070472906756, 'bull_strategy': 'mean_reversion', 'bull_bb_std_mult': 3.547181929291728, 'bull_rsi_os': 13, 'bull_rsi_ob': 77, 'bull_adx_thresh': 28.846542560429988, 'bull_atr_min_pct': 0.006707939963023202, 'bull_atr_max_pct': 0.041364671116280435, 'bull_tp_mult': 1.5140426995461806, 'bull_tsl_mult': 0.08129598119440279, 'bull_time_stop': 78, 'bull_use_sma': False, 'bull_use_ema': False, 'bull_use_atr': True, 'bull_use_adx': True, 'bull_use_spike': False, 'bull_rsi_required': True, 'bear_strategy': 'mean_reversion', 'bear_bb_std_mult': 1.0027787778553212, 'bear_rsi_os': 7, 'bear_rsi_ob': 46, 'bear_adx_thresh': 11.123722126276553, 'bear_atr_min_pct': 0.023871327182314654, 'bear_atr_max_pct': 0.04080650265617743, 'bear_tp_mult': 2.7345503562001303, 'bear_tsl_mult': 0.31109173895171366, 'bear_time_stop': 191, 'bear_use_sma': True, 'bear_use_ema': True, 'bear_use_atr': True, 'bear_use_adx': True, 'bear_use_spike': True, 'bear_rsi_required': True, 'sideways_strategy': 'mean_reversion', 'sideways_bb_std_mult': 2.7151396528401475, 'sideways_rsi_os': 23, 'sideways_rsi_ob': 76, 'sideways_adx_thresh': 9.919852144537645, 'sideways_atr_min_pct': 0.020779723935797946, 'sideways_atr_max_pct': 0.0778175500732399, 'sideways_tp_mult': 1.8005459953848626, 'sideways_tsl_mult': 0.9438208927635687, 'sideways_time_stop': 70, 'sideways_use_sma': False, 'sideways_use_ema': False, 'sideways_use_atr': False, 'sideways_use_adx': True, 'sideways_use_spike': True, 'sideways_rsi_required': True}.
[I 2025-08-31 05:09:00,201] Trial 572 finished with values: [-1000000000.0, 1000000000.0] and parameters: {'p_sma': 20, 'p_std': 40, 'p_atr': 23, 'p_adx': 18, 'rsi_period': 38, 'ema1': 22, 'ema2': 20, 'slip_atr_k': 0.03017182871688475, 'slip_spread_k': 0.27225990122986626, 'spread_hl_frac': 0.013809060275594729, 'bb_std_mult': 1.7846801585070322, 'rsi_os': 28, 'rsi_ob': 59, 'vol_spike': 0.2074797887686351, 'adx_thresh': 9.6242474504184, 'atr_min_pct': 0.02510924084788625, 'atr_max_pct': 0.12552604333533368, 'tp_mult': 2.563469762425994, 'tsl_mult': 0.9075978864461035, 'strategy': 'breakout', 'time_stop': 52, 'use_sma': True, 'use_atr': True, 'use_adx': False, 'use_ema': False, 'use_spike': True, 'rsi_required': False, 'edge_k': 1.4837493263066623, 'edge_cap': 0.9419594888375356, 'bull_strategy': 'mean_reversion', 'bull_bb_std_mult': 3.2785579964794507, 'bull_rsi_os': 44, 'bull_rsi_ob': 54, 'bull_adx_thresh': 10.85664777891409, 'bull_atr_min_pct': 0.027045147830192136, 'bull_atr_max_pct': 0.11506887287480398, 'bull_tp_mult': 1.216749416770178, 'bull_tsl_mult': 0.4167556704680335, 'bull_time_stop': 146, 'bull_use_sma': False, 'bull_use_ema': False, 'bull_use_atr': False, 'bull_use_adx': True, 'bull_use_spike': False, 'bull_rsi_required': True, 'bear_strategy': 'breakout', 'bear_bb_std_mult': 2.45100402121223, 'bear_rsi_os': 7, 'bear_rsi_ob': 47, 'bear_adx_thresh': 19.92844297833716, 'bear_atr_min_pct': 0.0032029568732687246, 'bear_atr_max_pct': 0.11445379193766085, 'bear_tp_mult': 2.7380584555988694, 'bear_tsl_mult': 0.2194433277031902, 'bear_time_stop': 193, 'bear_use_sma': True, 'bear_use_ema': True, 'bear_use_atr': True, 'bear_use_adx': True, 'bear_use_spike': True, 'bear_rsi_required': True, 'sideways_strategy': 'mean_reversion', 'sideways_bb_std_mult': 1.4565071000862297, 'sideways_rsi_os': 22, 'sideways_rsi_ob': 53, 'sideways_adx_thresh': 9.773677888926317, 'sideways_atr_min_pct': 0.014127198719196026, 'sideways_atr_max_pct': 0.12360245109506543, 'sideways_tp_mult': 1.9163590827691264, 'sideways_tsl_mult': 0.9156243572982989, 'sideways_time_stop': 67, 'sideways_use_sma': False, 'sideways_use_ema': False, 'sideways_use_atr': False, 'sideways_use_adx': False, 'sideways_use_spike': True, 'sideways_rsi_required': True}.
