[I 2025-08-31 05:09:01,319] Trial 576 finished with values: [-1000000000.0, 1000000000.0] and parameters: {'p_sma': 55, 'p_std': 33, 'p_atr': 10, 'p_adx': 9, 'rsi_period': 74, 'ema1': 14, 'ema2': 20, 'slip_atr_k': 0.015382897383161148, 'slip_spread_k': 0.9504929764809812, 'spread_hl_frac': 0.029461926419580467, 'bb_std_mult': 1.8597469546178982, 'rsi_os': 37, 'rsi_ob': 48, 'vol_spike': 0.00538762699627825, 'adx_thresh': 9.83026761045706, 'atr_min_pct': 0.021744293323173836, 'atr_max_pct': 0.07913773051089595, 'tp_mult': 2.6679202782180687, 'tsl_mult': 0.7801885642428723, 'strategy': 'mean_reversion', 'time_stop': 59, 'use_sma': False, 'use_atr': False, 'use_adx': False, 'use_ema': False, 'use_spike': True, 'rsi_required': False, 'edge_k': 1.6272382283716431, 'edge_cap': 0.14260636612810623, 'bull_strategy': 'breakout', 'bull_bb_std_mult': 1.0007991259829538, 'bull_rsi_os': 31, 'bull_rsi_ob': 78, 'bull_adx_thresh': 12.6731409757701, 'bull_atr_min_pct': 0.02829920730741352, 'bull_atr_max_pct': 0.049071611440995345, 'bull_tp_mult': 1.5704549920576656, 'bull_tsl_mult': 0.7524817803324786, 'bull_time_stop': 117, 'bull_use_sma': False, 'bull_use_ema': False, 'bull_use_atr': True, 'bull_use_adx': True, 'bull_use_spike': False, 'bull_rsi_required': True, 'bear_strategy': 'mean_reversion', 'bear_bb_std_mult': 0.9743220464850115, 'bear_rsi_os': 42, 'bear_rsi_ob': 53, 'bear_adx_thresh': 20.81179781991055, 'bear_atr_min_pct': 0.025047624485292616, 'bear_atr_max_pct': 0.043184695922392956, 'bear_tp_mult': 2.6682629702058276, 'bear_tsl_mult': 0.6939606319014809, 'bear_time_stop': 198, 'bear_use_sma': True, 'bear_use_ema': True, 'bear_use_atr': True, 'bear_use_adx': True, 'bear_use_spike': False, 'bear_rsi_required': True, 'sideways_strategy': 'breakout', 'sideways_bb_std_mult': 0.9689813098632616, 'sideways_rsi_os': 16, 'sideways_rsi_ob': 60, 'sideways_adx_thresh': 9.923254140890199, 'sideways_atr_min_pct': 0.008668949467889701, 'sideways_atr_max_pct': 0.07770662874182252, 'sideways_tp_mult': 2.0014108454585107, 'sideways_tsl_mult': 0.432321153265599, 'sideways_time_stop': 53, 'sideways_use_sma': False, 'sideways_use_ema': False, 'sideways_use_atr': False, 'sideways_use_adx': True, 'sideways_use_spike': True, 'sideways_rsi_required': True}.
[I 2025-08-31 05:09:45,086] Trial 578 finished with values: [-1000000000.0, 1000000000.0] and parameters: {'p_sma': 54, 'p_std': 16, 'p_atr': 7, 'p_adx': 17, 'rsi_period': 16, 'ema1': 15, 'ema2': 26, 'slip_atr_k': 0.01453554530419649, 'slip_spread_k': 0.27133685970261856, 'spread_hl_frac': 0.007291991978228236, 'bb_std_mult': 2.002897889628591, 'rsi_os': 16, 'rsi_ob': 78, 'vol_spike': 0.006338554476502271, 'adx_thresh': 9.645667227083152, 'atr_min_pct': 0.021705945479812597, 'atr_max_pct': 0.0773529308496416, 'tp_mult': 2.4862126380396936, 'tsl_mult': 0.8435982157396686, 'strategy': 'mean_reversion', 'time_stop': 38, 'use_sma': False, 'use_atr': False, 'use_adx': True, 'use_ema': False, 'use_spike': True, 'rsi_required': False, 'edge_k': 1.5484061504320776, 'edge_cap': 0.9361560547971122, 'bull_strategy': 'breakout', 'bull_bb_std_mult': 2.3575322366622835, 'bull_rsi_os': 20, 'bull_rsi_ob': 64, 'bull_adx_thresh': 13.223564164918699, 'bull_atr_min_pct': 0.02727808496911923, 'bull_atr_max_pct': 0.018809783166267184, 'bull_tp_mult': 1.5436287407930418, 'bull_tsl_mult': 0.6812917055431971, 'bull_time_stop': 150, 'bull_use_sma': True, 'bull_use_ema': False, 'bull_use_atr': True, 'bull_use_adx': False, 'bull_use_spike': False, 'bull_rsi_required': True, 'bear_strategy': 'mean_reversion', 'bear_bb_std_mult': 1.0908301077885143, 'bear_rsi_os': 43, 'bear_rsi_ob': 49, 'bear_adx_thresh': 20.886767005456324, 'bear_atr_min_pct': 0.02482714629445806, 'bear_atr_max_pct': 0.04320870414357643, 'bear_tp_mult': 2.6589198223551596, 'bear_tsl_mult': 0.13399722099421513, 'bear_time_stop': 204, 'bear_use_sma': False, 'bear_use_ema': True, 'bear_use_atr': True, 'bear_use_adx': False, 'bear_use_spike': False, 'bear_rsi_required': True, 'sideways_strategy': 'breakout', 'sideways_bb_std_mult': 1.6544054880878363, 'sideways_rsi_os': 35, 'sideways_rsi_ob': 60, 'sideways_adx_thresh': 15.782329318783486, 'sideways_atr_min_pct': 0.019731107000336975, 'sideways_atr_max_pct': 0.11026658417520632, 'sideways_tp_mult': 2.006101663699602, 'sideways_tsl_mult': 0.4428449908555352, 'sideways_time_stop': 161, 'sideways_use_sma': False, 'sideways_use_ema': True, 'sideways_use_atr': True, 'sideways_use_adx': True, 'sideways_use_spike': False, 'sideways_rsi_required': False}.
[I 2025-08-31 05:09:45,871] Trial 579 finished with values: [-1000000000.0, 1000000000.0] and parameters: {'p_sma': 58, 'p_std': 16, 'p_atr': 10, 'p_adx': 24, 'rsi_period': 22, 'ema1': 15, 'ema2': 59, 'slip_atr_k': 0.013876897214571426, 'slip_spread_k': 0.5581371773692722, 'spread_hl_frac': 0.04622673181436185, 'bb_std_mult': 2.014971176933713, 'rsi_os': 31, 'rsi_ob': 59, 'vol_spike': 0.12692343950528523, 'adx_thresh': 14.440376787394985, 'atr_min_pct': 0.023625476454328772, 'atr_max_pct': 0.08029829018330095, 'tp_mult': 2.6665646573714894, 'tsl_mult': 0.8392768022629249, 'strategy': 'mean_reversion', 'time_stop': 204, 'use_sma': False, 'use_atr': False, 'use_adx': True, 'use_ema': False, 'use_spike': True, 'rsi_required': True, 'edge_k': 1.2411893820167863, 'edge_cap': 0.599934072957315, 'bull_strategy': 'breakout', 'bull_bb_std_mult': 1.0907071005976545, 'bull_rsi_os': 20, 'bull_rsi_ob': 78, 'bull_adx_thresh': 12.330284299310108, 'bull_atr_min_pct': 0.0011474087196588862, 'bull_atr_max_pct': 0.056659032439204574, 'bull_tp_mult': 1.5586492406689212, 'bull_tsl_mult': 0.7470989645121524, 'bull_time_stop': 132, 'bull_use_sma': True, 'bull_use_ema': False, 'bull_use_atr': True, 'bull_use_adx': False, 'bull_use_spike': False, 'bull_rsi_required': False, 'bear_strategy': 'mean_reversion', 'bear_bb_std_mult': 1.0959554697431337, 'bear_rsi_os': 40, 'bear_rsi_ob': 56, 'bear_adx_thresh': 34.38577540200887, 'bear_atr_min_pct': 0.009434854370023171, 'bear_atr_max_pct': 0.05106413962665859, 'bear_tp_mult': 1.9826022539226618, 'bear_tsl_mult': 0.13418466985099287, 'bear_time_stop': 205, 'bear_use_sma': False, 'bear_use_ema': True, 'bear_use_atr': True, 'bear_use_adx': False, 'bear_use_spike': False, 'bear_rsi_required': True, 'sideways_strategy': 'breakout', 'sideways_bb_std_mult': 2.0179564394717953, 'sideways_rsi_os': 11, 'sideways_rsi_ob': 64, 'sideways_adx_thresh': 12.21456827461753, 'sideways_atr_min_pct': 0.022435406522718415, 'sideways_atr_max_pct': 0.0908618145974372, 'sideways_tp_mult': 1.9960402158061326, 'sideways_tsl_mult': 0.6569892443559615, 'sideways_time_stop': 55, 'sideways_use_sma': False, 'sideways_use_ema': True, 'sideways_use_atr': True, 'sideways_use_adx': True, 'sideways_use_spike': False, 'sideways_rsi_required': False}.
[I 2025-08-31 05:09:46,316] Trial 577 finished with values: [-1000000000.0, 1000000000.0] and parameters: {'p_sma': 54, 'p_std': 16, 'p_atr': 10, 'p_adx': 30, 'rsi_period': 74, 'ema1': 22, 'ema2': 59, 'slip_atr_k': 0.014010834494690379, 'slip_spread_k': 0.55602386881692, 'spread_hl_frac': 0.013627024636670503, 'bb_std_mult': 1.8738583032735179, 'rsi_os': 30, 'rsi_ob': 82, 'vol_spike': 0.23717896799844715, 'adx_thresh': 9.980571069717135, 'atr_min_pct': 0.024010921711933603, 'atr_max_pct': 0.12030691041995523, 'tp_mult': 2.6614547586838757, 'tsl_mult': 0.6004616935189717, 'strategy': 'mean_reversion', 'time_stop': 279, 'use_sma': False, 'use_atr': False, 'use_adx': False, 'use_ema': False, 'use_spike': True, 'rsi_required': False, 'edge_k': 1.2382463358368034, 'edge_cap': 0.055497977625904193, 'bull_strategy': 'breakout', 'bull_bb_std_mult': 2.2904818184871925, 'bull_rsi_os': 13, 'bull_rsi_ob': 50, 'bull_adx_thresh': 34.903461841277476, 'bull_atr_min_pct': 0.0012039926635376576, 'bull_atr_max_pct': 0.049441738755649806, 'bull_tp_mult': 1.510002890008884, 'bull_tsl_mult': 0.7898587828570284, 'bull_time_stop': 78, 'bull_use_sma': False, 'bull_use_ema': False, 'bull_use_atr': True, 'bull_use_adx': True, 'bull_use_spike': False, 'bull_rsi_required': True, 'bear_strategy': 'mean_reversion', 'bear_bb_std_mult': 2.446336476150482, 'bear_rsi_os': 8, 'bear_rsi_ob': 65, 'bear_adx_thresh': 32.69401288957112, 'bear_atr_min_pct': 0.02479086271840794, 'bear_atr_max_pct': 0.11368333746069806, 'bear_tp_mult': 2.6881100300396037, 'bear_tsl_mult': 0.6136655449009817, 'bear_time_stop': 272, 'bear_use_sma': True, 'bear_use_ema': True, 'bear_use_atr': True, 'bear_use_adx': True, 'bear_use_spike': False, 'bear_rsi_required': True, 'sideways_strategy': 'breakout', 'sideways_bb_std_mult': 3.380977997503921, 'sideways_rsi_os': 29, 'sideways_rsi_ob': 55, 'sideways_adx_thresh': 9.996875419146484, 'sideways_atr_min_pct': 0.022436902977808024, 'sideways_atr_max_pct': 0.11012950380078503, 'sideways_tp_mult': 1.578057379643038, 'sideways_tsl_mult': 0.6527020827531385, 'sideways_time_stop': 56, 'sideways_use_sma': False, 'sideways_use_ema': False, 'sideways_use_atr': False, 'sideways_use_adx': True, 'sideways_use_spike': True, 'sideways_rsi_required': True}.
[I 2025-08-31 05:09:46,796] Trial 580 finished with values: [-1000000000.0, 1000000000.0] and parameters: {'p_sma': 54, 'p_std': 54, 'p_atr': 25, 'p_adx': 17, 'rsi_period': 13, 'ema1': 13, 'ema2': 18, 'slip_atr_k': 0.020991498477879796, 'slip_spread_k': 0.5547846742110571, 'spread_hl_frac': 0.02088167551209437, 'bb_std_mult': 2.000668785488386, 'rsi_os': 31, 'rsi_ob': 77, 'vol_spike': 0.027953212995027548, 'adx_thresh': 14.602445740917826, 'atr_min_pct': 0.024073149381766273, 'atr_max_pct': 0.1208869158217222, 'tp_mult': 2.257402559851675, 'tsl_mult': 0.8488042325853136, 'strategy': 'mean_reversion', 'time_stop': 42, 'use_sma': False, 'use_atr': False, 'use_adx': True, 'use_ema': False, 'use_spike': True, 'rsi_required': True, 'edge_k': 1.5463022438055367, 'edge_cap': 0.9816420719880208, 'bull_strategy': 'mean_reversion', 'bull_bb_std_mult': 2.332978876258718, 'bull_rsi_os': 8, 'bull_rsi_ob': 50, 'bull_adx_thresh': 24.274638774336676, 'bull_atr_min_pct': 0.0020453095775719815, 'bull_atr_max_pct': 0.05686714075415971, 'bull_tp_mult': 1.668754977018793, 'bull_tsl_mult': 0.7870795926228438, 'bull_time_stop': 132, 'bull_use_sma': True, 'bull_use_ema': True, 'bull_use_atr': True, 'bull_use_adx': False, 'bull_use_spike': False, 'bull_rsi_required': False, 'bear_strategy': 'mean_reversion', 'bear_bb_std_mult': 1.0672116808826844, 'bear_rsi_os': 43, 'bear_rsi_ob': 80, 'bear_adx_thresh': 25.61290497583422, 'bear_atr_min_pct': 0.02309000688012512, 'bear_atr_max_pct': 0.04178513816878854, 'bear_tp_mult': 2.685778790109554, 'bear_tsl_mult': 0.21005717534300794, 'bear_time_stop': 205, 'bear_use_sma': False, 'bear_use_ema': False, 'bear_use_atr': True, 'bear_use_adx': False, 'bear_use_spike': False, 'bear_rsi_required': True, 'sideways_strategy': 'breakout', 'sideways_bb_std_mult': 3.2564664809576214, 'sideways_rsi_os': 29, 'sideways_rsi_ob': 90, 'sideways_adx_thresh': 12.198112634838468, 'sideways_atr_min_pct': 0.015477650850866411, 'sideways_atr_max_pct': 0.11564128431413599, 'sideways_tp_mult': 2.2787398200551845, 'sideways_tsl_mult': 0.7848265937485581, 'sideways_time_stop': 95, 'sideways_use_sma': False, 'sideways_use_ema': True, 'sideways_use_atr': True, 'sideways_use_adx': True, 'sideways_use_spike': False, 'sideways_rsi_required': False}.
[I 2025-08-31 05:10:29,956] Trial 583 finished with values: [-1000000000.0, 1000000000.0] and parameters: {'p_sma': 46, 'p_std': 12, 'p_atr': 25, 'p_adx': 8, 'rsi_period': 18, 'ema1': 13, 'ema2': 24, 'slip_atr_k': 0.060892378760425095, 'slip_spread_k': 0.08219922151159614, 'spread_hl_frac': 0.021339983279598, 'bb_std_mult': 0.9819266036072076, 'rsi_os': 27, 'rsi_ob': 60, 'vol_spike': 0.03190307824684896, 'adx_thresh': 10.807478782974648, 'atr_min_pct': 0.0162976832558185, 'atr_max_pct': 0.1162330979152695, 'tp_mult': 2.5001222678969963, 'tsl_mult': 0.8576030454290964, 'strategy': 'breakout', 'time_stop': 46, 'use_sma': False, 'use_atr': False, 'use_adx': False, 'use_ema': False, 'use_spike': True, 'rsi_required': True, 'edge_k': 0.9830549730888034, 'edge_cap': 0.981437058392673, 'bull_strategy': 'mean_reversion', 'bull_bb_std_mult': 2.4747328104437205, 'bull_rsi_os': 15, 'bull_rsi_ob': 48, 'bull_adx_thresh': 9.607057761336643, 'bull_atr_min_pct': 0.014200823421777963, 'bull_atr_max_pct': 0.06942608348356866, 'bull_tp_mult': 1.6763450853599136, 'bull_tsl_mult': 0.9255045594932048, 'bull_time_stop': 274, 'bull_use_sma': False, 'bull_use_ema': True, 'bull_use_atr': True, 'bull_use_adx': True, 'bull_use_spike': False, 'bull_rsi_required': False, 'bear_strategy': 'mean_reversion', 'bear_bb_std_mult': 0.7419479580699069, 'bear_rsi_os': 14, 'bear_rsi_ob': 70, 'bear_adx_thresh': 16.682410041357652, 'bear_atr_min_pct': 0.02002414853199063, 'bear_atr_max_pct': 0.048041814906582034, 'bear_tp_mult': 2.7950671927650577, 'bear_tsl_mult': 0.9972907915455176, 'bear_time_stop': 184, 'bear_use_sma': True, 'bear_use_ema': False, 'bear_use_atr': True, 'bear_use_adx': True, 'bear_use_spike': True, 'bear_rsi_required': True, 'sideways_strategy': 'mean_reversion', 'sideways_bb_std_mult': 1.0856935962589063, 'sideways_rsi_os': 52, 'sideways_rsi_ob': 57, 'sideways_adx_thresh': 28.494872682693973, 'sideways_atr_min_pct': 0.007609794673529404, 'sideways_atr_max_pct': 0.1147198087942541, 'sideways_tp_mult': 2.3157573244635477, 'sideways_tsl_mult': 0.7972616113401312, 'sideways_time_stop': 76, 'sideways_use_sma': False, 'sideways_use_ema': False, 'sideways_use_atr': False, 'sideways_use_adx': True, 'sideways_use_spike': True, 'sideways_rsi_required': True}.
[I 2025-08-31 05:10:30,388] Trial 582 finished with values: [-0.014794927828101767, 0.014774669483946502] and parameters: {'p_sma': 54, 'p_std': 13, 'p_atr': 25, 'p_adx': 8, 'rsi_period': 18, 'ema1': 13, 'ema2': 24, 'slip_atr_k': 0.17380209969468977, 'slip_spread_k': 0.08427610808887404, 'spread_hl_frac': 0.021249166557502797, 'bb_std_mult': 0.9884659013257875, 'rsi_os': 30, 'rsi_ob': 93, 'vol_spike': 0.029030325633976343, 'adx_thresh': 10.627543188327255, 'atr_min_pct': 0.024128391542606993, 'atr_max_pct': 0.060442113232643487, 'tp_mult': 2.5043111285801767, 'tsl_mult': 0.7551129806158516, 'strategy': 'breakout', 'time_stop': 99, 'use_sma': False, 'use_atr': False, 'use_adx': False, 'use_ema': False, 'use_spike': True, 'rsi_required': False, 'edge_k': 1.5223938350451118, 'edge_cap': 0.9826385943408698, 'bull_strategy': 'mean_reversion', 'bull_bb_std_mult': 3.50274917767316, 'bull_rsi_os': 15, 'bull_rsi_ob': 51, 'bull_adx_thresh': 9.616365973805818, 'bull_atr_min_pct': 0.01774346004042263, 'bull_atr_max_pct': 0.045819104168053106, 'bull_tp_mult': 1.6842589225926365, 'bull_tsl_mult': 0.7949418382281014, 'bull_time_stop': 181, 'bull_use_sma': False, 'bull_use_ema': True, 'bull_use_atr': True, 'bull_use_adx': True, 'bull_use_spike': False, 'bull_rsi_required': True, 'bear_strategy': 'mean_reversion', 'bear_bb_std_mult': 0.7478913469993642, 'bear_rsi_os': 10, 'bear_rsi_ob': 47, 'bear_adx_thresh': 25.137340788302012, 'bear_atr_min_pct': 0.02320052913514236, 'bear_atr_max_pct': 0.04804749111143656, 'bear_tp_mult': 2.6869234636717207, 'bear_tsl_mult': 0.717235768627106, 'bear_time_stop': 186, 'bear_use_sma': True, 'bear_use_ema': False, 'bear_use_atr': True, 'bear_use_adx': True, 'bear_use_spike': True, 'bear_rsi_required': True, 'sideways_strategy': 'mean_reversion', 'sideways_bb_std_mult': 3.2528793226108084, 'sideways_rsi_os': 29, 'sideways_rsi_ob': 57, 'sideways_adx_thresh': 10.984616210073433, 'sideways_atr_min_pct': 0.0022063184238221064, 'sideways_atr_max_pct': 0.14250427151133138, 'sideways_tp_mult': 1.5527464048050759, 'sideways_tsl_mult': 0.7943636432677171, 'sideways_time_stop': 100, 'sideways_use_sma': False, 'sideways_use_ema': False, 'sideways_use_atr': False, 'sideways_use_adx': True, 'sideways_use_spike': True, 'sideways_rsi_required': True}.
[I 2025-08-31 05:10:30,664] Trial 584 finished with values: [-1000000000.0, 1000000000.0] and parameters: {'p_sma': 7, 'p_std': 11, 'p_atr': 24, 'p_adx': 8, 'rsi_period': 29, 'ema1': 29, 'ema2': 49, 'slip_atr_k': 0.09682793098355218, 'slip_spread_k': 0.0828295283435445, 'spread_hl_frac': 0.036395869745077344, 'bb_std_mult': 1.9274547002532894, 'rsi_os': 55, 'rsi_ob': 60, 'vol_spike': 0.03415575862434708, 'adx_thresh': 34.267131333427194, 'atr_min_pct': 0.004170026724128018, 'atr_max_pct': 0.06783625545090922, 'tp_mult': 2.504305421119059, 'tsl_mult': 0.6639182432530077, 'strategy': 'breakout', 'time_stop': 187, 'use_sma': False, 'use_atr': False, 'use_adx': False, 'use_ema': True, 'use_spike': False, 'rsi_required': False, 'edge_k': 1.5165654810558091, 'edge_cap': 0.6641738946834403, 'bull_strategy': 'mean_reversion', 'bull_bb_std_mult': 3.5036320928555007, 'bull_rsi_os': 15, 'bull_rsi_ob': 73, 'bull_adx_thresh': 13.553310724186698, 'bull_atr_min_pct': 0.017667889064524118, 'bull_atr_max_pct': 0.046006485722787344, 'bull_tp_mult': 2.4732684977380295, 'bull_tsl_mult': 0.843066492566861, 'bull_time_stop': 157, 'bull_use_sma': False, 'bull_use_ema': True, 'bull_use_atr': True, 'bull_use_adx': True, 'bull_use_spike': True, 'bull_rsi_required': True, 'bear_strategy': 'mean_reversion', 'bear_bb_std_mult': 0.7455465666318137, 'bear_rsi_os': 20, 'bear_rsi_ob': 62, 'bear_adx_thresh': 19.81968833081962, 'bear_atr_min_pct': 0.010688797682726788, 'bear_atr_max_pct': 0.04750412554258821, 'bear_tp_mult': 2.781961425546527, 'bear_tsl_mult': 0.05477882464123285, 'bear_time_stop': 186, 'bear_use_sma': True, 'bear_use_ema': False, 'bear_use_atr': False, 'bear_use_adx': True, 'bear_use_spike': True, 'bear_rsi_required': True, 'sideways_strategy': 'mean_reversion', 'sideways_bb_std_mult': 1.0969116482754269, 'sideways_rsi_os': 43, 'sideways_rsi_ob': 54, 'sideways_adx_thresh': 11.126395902008547, 'sideways_atr_min_pct': 0.006750130797378439, 'sideways_atr_max_pct': 0.051368067334420286, 'sideways_tp_mult': 1.9418641748391556, 'sideways_tsl_mult': 0.1791172539888175, 'sideways_time_stop': 264, 'sideways_use_sma': True, 'sideways_use_ema': False, 'sideways_use_atr': False, 'sideways_use_adx': True, 'sideways_use_spike': True, 'sideways_rsi_required': True}.
[I 2025-08-31 05:10:30,860] Trial 581 finished with values: [-1000000000.0, 1000000000.0] and parameters: {'p_sma': 18, 'p_std': 13, 'p_atr': 22, 'p_adx': 21, 'rsi_period': 22, 'ema1': 13, 'ema2': 60, 'slip_atr_k': 0.02163402960503906, 'slip_spread_k': 0.08289953741410636, 'spread_hl_frac': 0.008959456381971598, 'bb_std_mult': 1.9190484545932853, 'rsi_os': 30, 'rsi_ob': 77, 'vol_spike': 0.02806177124743821, 'adx_thresh': 10.953692802184753, 'atr_min_pct': 0.02406606900725369, 'atr_max_pct': 0.12081175117231419, 'tp_mult': 2.97160080227697, 'tsl_mult': 0.7582380454557689, 'strategy': 'breakout', 'time_stop': 235, 'use_sma': False, 'use_atr': False, 'use_adx': False, 'use_ema': False, 'use_spike': True, 'rsi_required': True, 'edge_k': 0.344531109866022, 'edge_cap': 0.05309914837811963, 'bull_strategy': 'mean_reversion', 'bull_bb_std_mult': 3.5957818668009613, 'bull_rsi_os': 15, 'bull_rsi_ob': 48, 'bull_adx_thresh': 12.24886409082876, 'bull_atr_min_pct': 0.0012192748897365598, 'bull_atr_max_pct': 0.04658907210093362, 'bull_tp_mult': 2.4846644446180446, 'bull_tsl_mult': 0.7947175960135315, 'bull_time_stop': 182, 'bull_use_sma': False, 'bull_use_ema': True, 'bull_use_atr': True, 'bull_use_adx': True, 'bull_use_spike': False, 'bull_rsi_required': False, 'bear_strategy': 'mean_reversion', 'bear_bb_std_mult': 0.7623064754946766, 'bear_rsi_os': 50, 'bear_rsi_ob': 59, 'bear_adx_thresh': 25.32606884353664, 'bear_atr_min_pct': 0.010802089911615699, 'bear_atr_max_pct': 0.050282242340057334, 'bear_tp_mult': 1.9841729378817314, 'bear_tsl_mult': 0.7206064469897138, 'bear_time_stop': 184, 'bear_use_sma': True, 'bear_use_ema': False, 'bear_use_atr': True, 'bear_use_adx': False, 'bear_use_spike': True, 'bear_rsi_required': True, 'sideways_strategy': 'mean_reversion', 'sideways_bb_std_mult': 3.3825728698614173, 'sideways_rsi_os': 29, 'sideways_rsi_ob': 55, 'sideways_adx_thresh': 11.84502853657307, 'sideways_atr_min_pct': 0.022226886203035555, 'sideways_atr_max_pct': 0.024484666000733138, 'sideways_tp_mult': 2.9043337928167463, 'sideways_tsl_mult': 0.6558825733184869, 'sideways_time_stop': 56, 'sideways_use_sma': False, 'sideways_use_ema': True, 'sideways_use_atr': False, 'sideways_use_adx': True, 'sideways_use_spike': True, 'sideways_rsi_required': True}.
