[I 2025-08-31 04:52:28,319] Trial 484 finished with values: [-1000000000.0, 1000000000.0] and parameters: {'p_sma': 9, 'p_std': 18, 'p_atr': 13, 'p_adx': 9, 'rsi_period': 67, 'ema1': 21, 'ema2': 29, 'slip_atr_k': 0.021434604336068946, 'slip_spread_k': 0.2712585104374716, 'spread_hl_frac': 0.0007009103872399822, 'bb_std_mult': 2.9759772799254907, 'rsi_os': 37, 'rsi_ob': 82, 'vol_spike': 0.01854468326666798, 'adx_thresh': 10.74946177474902, 'atr_min_pct': 0.021240014897691367, 'atr_max_pct': 0.12065719623996969, 'tp_mult': 2.3621679339401354, 'tsl_mult': 0.7987702933710226, 'strategy': 'breakout', 'time_stop': 164, 'use_sma': False, 'use_atr': False, 'use_adx': False, 'use_ema': False, 'use_spike': True, 'rsi_required': False, 'edge_k': 0.22313600978328996, 'edge_cap': 0.5184633134339122, 'bull_strategy': 'mean_reversion', 'bull_bb_std_mult': 3.4659574686632677, 'bull_rsi_os': 34, 'bull_rsi_ob': 75, 'bull_adx_thresh': 5.721644234563403, 'bull_atr_min_pct': 0.015089461158893626, 'bull_atr_max_pct': 0.11137762422470358, 'bull_tp_mult': 1.655188487687894, 'bull_tsl_mult': 0.7749005769339734, 'bull_time_stop': 123, 'bull_use_sma': False, 'bull_use_ema': False, 'bull_use_atr': True, 'bull_use_adx': True, 'bull_use_spike': False, 'bull_rsi_required': True, 'bear_strategy': 'mean_reversion', 'bear_bb_std_mult': 0.955895512948889, 'bear_rsi_os': 33, 'bear_rsi_ob': 79, 'bear_adx_thresh': 17.389651240835555, 'bear_atr_min_pct': 0.022528719674333078, 'bear_atr_max_pct': 0.04892693731565212, 'bear_tp_mult': 2.6070452091729015, 'bear_tsl_mult': 0.7114139289452384, 'bear_time_stop': 45, 'bear_use_sma': True, 'bear_use_ema': True, 'bear_use_atr': True, 'bear_use_adx': True, 'bear_use_spike': True, 'bear_rsi_required': True, 'sideways_strategy': 'mean_reversion', 'sideways_bb_std_mult': 1.1962747244958514, 'sideways_rsi_os': 13, 'sideways_rsi_ob': 52, 'sideways_adx_thresh': 11.717671329556591, 'sideways_atr_min_pct': 0.02433866187528501, 'sideways_atr_max_pct': 0.11520354022620076, 'sideways_tp_mult': 2.0265881118785494, 'sideways_tsl_mult': 0.46157293913657294, 'sideways_time_stop': 79, 'sideways_use_sma': False, 'sideways_use_ema': False, 'sideways_use_atr': False, 'sideways_use_adx': True, 'sideways_use_spike': True, 'sideways_rsi_required': True}.
[I 2025-08-31 04:53:11,823] Trial 487 finished with values: [-1000000000.0, 1000000000.0] and parameters: {'p_sma': 54, 'p_std': 28, 'p_atr': 17, 'p_adx': 22, 'rsi_period': 22, 'ema1': 13, 'ema2': 50, 'slip_atr_k': 0.11579876769020025, 'slip_spread_k': 0.09809826475234704, 'spread_hl_frac': 0.009328137336248231, 'bb_std_mult': 0.8120686906511223, 'rsi_os': 29, 'rsi_ob': 80, 'vol_spike': 0.19007431368753844, 'adx_thresh': 24.83159575633055, 'atr_min_pct': 0.02595312941279926, 'atr_max_pct': 0.12058294165044263, 'tp_mult': 2.468952597516344, 'tsl_mult': 0.45268224916089833, 'strategy': 'breakout', 'time_stop': 277, 'use_sma': False, 'use_atr': False, 'use_adx': False, 'use_ema': False, 'use_spike': True, 'rsi_required': False, 'edge_k': 0.2346019725367645, 'edge_cap': 0.7108533501342452, 'bull_strategy': 'mean_reversion', 'bull_bb_std_mult': 3.3537006673352403, 'bull_rsi_os': 44, 'bull_rsi_ob': 74, 'bull_adx_thresh': 10.3580914915869, 'bull_atr_min_pct': 0.005544265113172955, 'bull_atr_max_pct': 0.05308195237873753, 'bull_tp_mult': 2.0112085026644597, 'bull_tsl_mult': 0.8512894329527497, 'bull_time_stop': 46, 'bull_use_sma': False, 'bull_use_ema': False, 'bull_use_atr': True, 'bull_use_adx': True, 'bull_use_spike': False, 'bull_rsi_required': True, 'bear_strategy': 'mean_reversion', 'bear_bb_std_mult': 0.9505435866077098, 'bear_rsi_os': 7, 'bear_rsi_ob': 71, 'bear_adx_thresh': 20.6706635764395, 'bear_atr_min_pct': 0.024237135850526993, 'bear_atr_max_pct': 0.04940393959826535, 'bear_tp_mult': 2.6043004924267863, 'bear_tsl_mult': 0.4696562980598797, 'bear_time_stop': 190, 'bear_use_sma': True, 'bear_use_ema': True, 'bear_use_atr': True, 'bear_use_adx': True, 'bear_use_spike': True, 'bear_rsi_required': True, 'sideways_strategy': 'mean_reversion', 'sideways_bb_std_mult': 1.018418356378502, 'sideways_rsi_os': 48, 'sideways_rsi_ob': 66, 'sideways_adx_thresh': 28.99646469540542, 'sideways_atr_min_pct': 0.013188365158223001, 'sideways_atr_max_pct': 0.12896952949079804, 'sideways_tp_mult': 2.327657551893114, 'sideways_tsl_mult': 0.6392330481685949, 'sideways_time_stop': 45, 'sideways_use_sma': False, 'sideways_use_ema': False, 'sideways_use_atr': False, 'sideways_use_adx': True, 'sideways_use_spike': True, 'sideways_rsi_required': True}.
[I 2025-08-31 04:53:12,979] Trial 489 finished with values: [-1000000000.0, 1000000000.0] and parameters: {'p_sma': 50, 'p_std': 45, 'p_atr': 15, 'p_adx': 13, 'rsi_period': 19, 'ema1': 24, 'ema2': 29, 'slip_atr_k': 0.02709433206947847, 'slip_spread_k': 0.07083951352066975, 'spread_hl_frac': 0.009766889396573752, 'bb_std_mult': 1.9890555760495976, 'rsi_os': 46, 'rsi_ob': 83, 'vol_spike': 0.19006877341379536, 'adx_thresh': 33.79790205005344, 'atr_min_pct': 0.01583340971379099, 'atr_max_pct': 0.06238467506953915, 'tp_mult': 2.5783136886441804, 'tsl_mult': 0.8027604067820279, 'strategy': 'breakout', 'time_stop': 52, 'use_sma': False, 'use_atr': False, 'use_adx': False, 'use_ema': False, 'use_spike': True, 'rsi_required': False, 'edge_k': 1.5990572606557063, 'edge_cap': 0.7062288823254393, 'bull_strategy': 'breakout', 'bull_bb_std_mult': 3.494111759384936, 'bull_rsi_os': 36, 'bull_rsi_ob': 79, 'bull_adx_thresh': 18.10489181881723, 'bull_atr_min_pct': 0.000559851664798645, 'bull_atr_max_pct': 0.05322641304717011, 'bull_tp_mult': 1.5629337185782146, 'bull_tsl_mult': 0.9011107350537545, 'bull_time_stop': 74, 'bull_use_sma': False, 'bull_use_ema': True, 'bull_use_atr': True, 'bull_use_adx': True, 'bull_use_spike': False, 'bull_rsi_required': True, 'bear_strategy': 'mean_reversion', 'bear_bb_std_mult': 0.768056743406316, 'bear_rsi_os': 11, 'bear_rsi_ob': 48, 'bear_adx_thresh': 28.98817788480393, 'bear_atr_min_pct': 0.02434833311133116, 'bear_atr_max_pct': 0.06968990662675656, 'bear_tp_mult': 2.8545396223349973, 'bear_tsl_mult': 0.25197581530591945, 'bear_time_stop': 235, 'bear_use_sma': True, 'bear_use_ema': False, 'bear_use_atr': True, 'bear_use_adx': True, 'bear_use_spike': False, 'bear_rsi_required': True, 'sideways_strategy': 'mean_reversion', 'sideways_bb_std_mult': 1.0111758577789554, 'sideways_rsi_os': 27, 'sideways_rsi_ob': 53, 'sideways_adx_thresh': 12.025952476165447, 'sideways_atr_min_pct': 0.012895606870805985, 'sideways_atr_max_pct': 0.12926058509039792, 'sideways_tp_mult': 2.0423768805836673, 'sideways_tsl_mult': 0.6367189337479675, 'sideways_time_stop': 43, 'sideways_use_sma': False, 'sideways_use_ema': False, 'sideways_use_atr': False, 'sideways_use_adx': True, 'sideways_use_spike': True, 'sideways_rsi_required': True}.
[I 2025-08-31 04:53:13,202] Trial 488 finished with values: [-1000000000.0, 1000000000.0] and parameters: {'p_sma': 50, 'p_std': 28, 'p_atr': 12, 'p_adx': 17, 'rsi_period': 22, 'ema1': 14, 'ema2': 29, 'slip_atr_k': 0.11439959433882355, 'slip_spread_k': 0.07014626564865507, 'spread_hl_frac': 0.013570026347160636, 'bb_std_mult': 1.9494077904594187, 'rsi_os': 36, 'rsi_ob': 61, 'vol_spike': 0.010072149028378073, 'adx_thresh': 33.904919907448644, 'atr_min_pct': 0.02567395718401117, 'atr_max_pct': 0.12033202632175849, 'tp_mult': 1.6747594833487858, 'tsl_mult': 0.45885267524578255, 'strategy': 'breakout', 'time_stop': 52, 'use_sma': False, 'use_atr': False, 'use_adx': False, 'use_ema': False, 'use_spike': True, 'rsi_required': False, 'edge_k': 1.4647710522066282, 'edge_cap': 0.24915718324224956, 'bull_strategy': 'breakout', 'bull_bb_std_mult': 3.339414496013086, 'bull_rsi_os': 36, 'bull_rsi_ob': 79, 'bull_adx_thresh': 8.644911385720825, 'bull_atr_min_pct': 0.023444044801365305, 'bull_atr_max_pct': 0.045346984918350715, 'bull_tp_mult': 1.5717344888511025, 'bull_tsl_mult': 0.9006261736099999, 'bull_time_stop': 156, 'bull_use_sma': False, 'bull_use_ema': False, 'bull_use_atr': True, 'bull_use_adx': True, 'bull_use_spike': False, 'bull_rsi_required': True, 'bear_strategy': 'mean_reversion', 'bear_bb_std_mult': 0.7661168112462331, 'bear_rsi_os': 11, 'bear_rsi_ob': 71, 'bear_adx_thresh': 21.531313685738393, 'bear_atr_min_pct': 0.019850016173214115, 'bear_atr_max_pct': 0.04911332535626265, 'bear_tp_mult': 2.8581098701257734, 'bear_tsl_mult': 0.33477291155541644, 'bear_time_stop': 189, 'bear_use_sma': True, 'bear_use_ema': True, 'bear_use_atr': True, 'bear_use_adx': True, 'bear_use_spike': True, 'bear_rsi_required': True, 'sideways_strategy': 'mean_reversion', 'sideways_bb_std_mult': 1.0397959932993974, 'sideways_rsi_os': 50, 'sideways_rsi_ob': 77, 'sideways_adx_thresh': 23.971714632620255, 'sideways_atr_min_pct': 0.008973046947151137, 'sideways_atr_max_pct': 0.05545592909334141, 'sideways_tp_mult': 2.0291188200456953, 'sideways_tsl_mult': 0.635386597353602, 'sideways_time_stop': 150, 'sideways_use_sma': False, 'sideways_use_ema': False, 'sideways_use_atr': False, 'sideways_use_adx': True, 'sideways_use_spike': True, 'sideways_rsi_required': True}.
[I 2025-08-31 04:53:13,380] Trial 490 finished with values: [-1000000000.0, 1000000000.0] and parameters: {'p_sma': 51, 'p_std': 14, 'p_atr': 14, 'p_adx': 15, 'rsi_period': 20, 'ema1': 14, 'ema2': 60, 'slip_atr_k': 0.026165571304718763, 'slip_spread_k': 0.0696374713183241, 'spread_hl_frac': 0.013798272817771597, 'bb_std_mult': 1.968527121744839, 'rsi_os': 29, 'rsi_ob': 61, 'vol_spike': 0.19109230853768516, 'adx_thresh': 10.339194989255688, 'atr_min_pct': 0.015787713559889564, 'atr_max_pct': 0.07528418447749997, 'tp_mult': 1.8112525137352524, 'tsl_mult': 0.45666588051129897, 'strategy': 'breakout', 'time_stop': 54, 'use_sma': False, 'use_atr': False, 'use_adx': False, 'use_ema': True, 'use_spike': False, 'rsi_required': False, 'edge_k': 0.11369067309883774, 'edge_cap': 0.073563713905681, 'bull_strategy': 'breakout', 'bull_bb_std_mult': 0.6069429754484901, 'bull_rsi_os': 11, 'bull_rsi_ob': 78, 'bull_adx_thresh': 8.780766846972163, 'bull_atr_min_pct': 0.0006235831005026869, 'bull_atr_max_pct': 0.04528540127022508, 'bull_tp_mult': 1.9997771610961101, 'bull_tsl_mult': 0.8978683850114282, 'bull_time_stop': 293, 'bull_use_sma': False, 'bull_use_ema': True, 'bull_use_atr': True, 'bull_use_adx': True, 'bull_use_spike': True, 'bull_rsi_required': True, 'bear_strategy': 'mean_reversion', 'bear_bb_std_mult': 0.797709656034175, 'bear_rsi_os': 54, 'bear_rsi_ob': 48, 'bear_adx_thresh': 21.483019377798893, 'bear_atr_min_pct': 0.0242809589579942, 'bear_atr_max_pct': 0.04545889905253779, 'bear_tp_mult': 1.1562619471253541, 'bear_tsl_mult': 0.26501504785436947, 'bear_time_stop': 152, 'bear_use_sma': True, 'bear_use_ema': False, 'bear_use_atr': True, 'bear_use_adx': True, 'bear_use_spike': False, 'bear_rsi_required': True, 'sideways_strategy': 'mean_reversion', 'sideways_bb_std_mult': 3.24378142224717, 'sideways_rsi_os': 27, 'sideways_rsi_ob': 66, 'sideways_adx_thresh': 12.22262027441839, 'sideways_atr_min_pct': 0.012900854533718765, 'sideways_atr_max_pct': 0.1228545920091127, 'sideways_tp_mult': 2.2951692320223707, 'sideways_tsl_mult': 0.6437100452656102, 'sideways_time_stop': 152, 'sideways_use_sma': False, 'sideways_use_ema': False, 'sideways_use_atr': False, 'sideways_use_adx': True, 'sideways_use_spike': True, 'sideways_rsi_required': True}.
[I 2025-08-31 04:53:56,282] Trial 491 finished with values: [-1000000000.0, 1000000000.0] and parameters: {'p_sma': 43, 'p_std': 55, 'p_atr': 23, 'p_adx': 7, 'rsi_period': 19, 'ema1': 14, 'ema2': 26, 'slip_atr_k': 0.1711713199304341, 'slip_spread_k': 0.062032960759722214, 'spread_hl_frac': 0.045062036163060024, 'bb_std_mult': 1.9753746299993282, 'rsi_os': 32, 'rsi_ob': 61, 'vol_spike': 0.007409636588048536, 'adx_thresh': 10.156662031864958, 'atr_min_pct': 0.023361891420736487, 'atr_max_pct': 0.07544553102845784, 'tp_mult': 1.2256415943706913, 'tsl_mult': 0.002443668741827998, 'strategy': 'breakout', 'time_stop': 6, 'use_sma': True, 'use_atr': True, 'use_adx': True, 'use_ema': True, 'use_spike': False, 'rsi_required': False, 'edge_k': 1.2107169467745944, 'edge_cap': 0.24911407480497283, 'bull_strategy': 'breakout', 'bull_bb_std_mult': 3.5405526574702453, 'bull_rsi_os': 13, 'bull_rsi_ob': 83, 'bull_adx_thresh': 18.339280756491366, 'bull_atr_min_pct': 0.004533283510510692, 'bull_atr_max_pct': 0.045899467353262155, 'bull_tp_mult': 2.716700847055859, 'bull_tsl_mult': 0.8933459442911181, 'bull_time_stop': 131, 'bull_use_sma': True, 'bull_use_ema': True, 'bull_use_atr': False, 'bull_use_adx': False, 'bull_use_spike': True, 'bull_rsi_required': True, 'bear_strategy': 'breakout', 'bear_bb_std_mult': 0.8484011078372358, 'bear_rsi_os': 10, 'bear_rsi_ob': 49, 'bear_adx_thresh': 21.19454764239099, 'bear_atr_min_pct': 0.011458168130710936, 'bear_atr_max_pct': 0.07443727462319152, 'bear_tp_mult': 2.8470352652663244, 'bear_tsl_mult': 0.2543354694949757, 'bear_time_stop': 119, 'bear_use_sma': False, 'bear_use_ema': False, 'bear_use_atr': True, 'bear_use_adx': True, 'bear_use_spike': False, 'bear_rsi_required': True, 'sideways_strategy': 'mean_reversion', 'sideways_bb_std_mult': 0.9714695001717263, 'sideways_rsi_os': 30, 'sideways_rsi_ob': 82, 'sideways_adx_thresh': 12.159360310689548, 'sideways_atr_min_pct': 0.013763053441482981, 'sideways_atr_max_pct': 0.12208804337696905, 'sideways_tp_mult': 1.9818007989860704, 'sideways_tsl_mult': 0.7427050553759913, 'sideways_time_stop': 58, 'sideways_use_sma': True, 'sideways_use_ema': True, 'sideways_use_atr': True, 'sideways_use_adx': False, 'sideways_use_spike': False, 'sideways_rsi_required': False}.
[I 2025-08-31 04:53:56,784] Trial 493 finished with values: [-1000000000.0, 1000000000.0] and parameters: {'p_sma': 52, 'p_std': 14, 'p_atr': 24, 'p_adx': 8, 'rsi_period': 20, 'ema1': 14, 'ema2': 26, 'slip_atr_k': 0.012844457371393269, 'slip_spread_k': 0.11156346763977261, 'spread_hl_frac': 0.011034135399110606, 'bb_std_mult': 1.2679933451767018, 'rsi_os': 27, 'rsi_ob': 72, 'vol_spike': 0.14386279079136924, 'adx_thresh': 11.43853781867914, 'atr_min_pct': 0.0005736976831805067, 'atr_max_pct': 0.1301196939263858, 'tp_mult': 2.472258136496517, 'tsl_mult': 0.854462447635483, 'strategy': 'mean_reversion', 'time_stop': 41, 'use_sma': True, 'use_atr': True, 'use_adx': True, 'use_ema': True, 'use_spike': False, 'rsi_required': True, 'edge_k': 0.12140851187836588, 'edge_cap': 0.7797006718708095, 'bull_strategy': 'mean_reversion', 'bull_bb_std_mult': 3.4096302648085692, 'bull_rsi_os': 17, 'bull_rsi_ob': 83, 'bull_adx_thresh': 9.149789866648746, 'bull_atr_min_pct': 0.001691784846702825, 'bull_atr_max_pct': 0.08565999916072022, 'bull_tp_mult': 2.757948692333186, 'bull_tsl_mult': 0.8800707374727692, 'bull_time_stop': 131, 'bull_use_sma': True, 'bull_use_ema': True, 'bull_use_atr': False, 'bull_use_adx': False, 'bull_use_spike': True, 'bull_rsi_required': False, 'bear_strategy': 'breakout', 'bear_bb_std_mult': 1.7450163412363406, 'bear_rsi_os': 9, 'bear_rsi_ob': 48, 'bear_adx_thresh': 34.92036963816758, 'bear_atr_min_pct': 0.023124124855883506, 'bear_atr_max_pct': 0.057064674784735606, 'bear_tp_mult': 2.3050129087533717, 'bear_tsl_mult': 0.17646789304020355, 'bear_time_stop': 296, 'bear_use_sma': False, 'bear_use_ema': False, 'bear_use_atr': True, 'bear_use_adx': False, 'bear_use_spike': False, 'bear_rsi_required': False, 'sideways_strategy': 'breakout', 'sideways_bb_std_mult': 0.9580148622762096, 'sideways_rsi_os': 23, 'sideways_rsi_ob': 54, 'sideways_adx_thresh': 31.26932391902326, 'sideways_atr_min_pct': 0.01587110199103391, 'sideways_atr_max_pct': 0.12090547921706835, 'sideways_tp_mult': 1.9777116609480458, 'sideways_tsl_mult': 0.9251182230072872, 'sideways_time_stop': 58, 'sideways_use_sma': True, 'sideways_use_ema': True, 'sideways_use_atr': True, 'sideways_use_adx': False, 'sideways_use_spike': False, 'sideways_rsi_required': False}.
[I 2025-08-31 04:53:57,136] Trial 492 finished with values: [-1000000000.0, 1000000000.0] and parameters: {'p_sma': 25, 'p_std': 14, 'p_atr': 28, 'p_adx': 17, 'rsi_period': 74, 'ema1': 14, 'ema2': 26, 'slip_atr_k': 0.03770117488496367, 'slip_spread_k': 0.010611502625939448, 'spread_hl_frac': 0.044292449876932524, 'bb_std_mult': 1.322943056549231, 'rsi_os': 32, 'rsi_ob': 61, 'vol_spike': 0.2257042872989714, 'adx_thresh': 9.971749191005813, 'atr_min_pct': 0.02314452579912667, 'atr_max_pct': 0.1145684350934294, 'tp_mult': 1.6740699381072683, 'tsl_mult': 0.8551462611552549, 'strategy': 'breakout', 'time_stop': 42, 'use_sma': True, 'use_atr': True, 'use_adx': True, 'use_ema': True, 'use_spike': False, 'rsi_required': True, 'edge_k': 1.4578773330254788, 'edge_cap': 0.967679774611694, 'bull_strategy': 'breakout', 'bull_bb_std_mult': 0.5652817419554823, 'bull_rsi_os': 17, 'bull_rsi_ob': 48, 'bull_adx_thresh': 15.295207927014065, 'bull_atr_min_pct': 0.0016483184124602029, 'bull_atr_max_pct': 0.04490592669308257, 'bull_tp_mult': 2.7201376447992196, 'bull_tsl_mult': 0.6831444751363064, 'bull_time_stop': 140, 'bull_use_sma': True, 'bull_use_ema': True, 'bull_use_atr': True, 'bull_use_adx': False, 'bull_use_spike': True, 'bull_rsi_required': True, 'bear_strategy': 'breakout', 'bear_bb_std_mult': 0.8666136128984496, 'bear_rsi_os': 48, 'bear_rsi_ob': 48, 'bear_adx_thresh': 21.182573929018524, 'bear_atr_min_pct': 0.011192618499164877, 'bear_atr_max_pct': 0.0799022963162093, 'bear_tp_mult': 2.7773968717571895, 'bear_tsl_mult': 0.27020006304231836, 'bear_time_stop': 186, 'bear_use_sma': False, 'bear_use_ema': False, 'bear_use_atr': True, 'bear_use_adx': False, 'bear_use_spike': False, 'bear_rsi_required': True, 'sideways_strategy': 'mean_reversion', 'sideways_bb_std_mult': 0.9545511575164135, 'sideways_rsi_os': 23, 'sideways_rsi_ob': 82, 'sideways_adx_thresh': 10.684460785737329, 'sideways_atr_min_pct': 0.0027445618034226335, 'sideways_atr_max_pct': 0.1223345390831386, 'sideways_tp_mult': 1.9824094450915886, 'sideways_tsl_mult': 0.7395021479332029, 'sideways_time_stop': 220, 'sideways_use_sma': True, 'sideways_use_ema': True, 'sideways_use_atr': True, 'sideways_use_adx': False, 'sideways_use_spike': False, 'sideways_rsi_required': False}.
[I 2025-08-31 04:53:57,464] Trial 494 finished with values: [-1000000000.0, 1000000000.0] and parameters: {'p_sma': 55, 'p_std': 15, 'p_atr': 21, 'p_adx': 7, 'rsi_period': 48, 'ema1': 19, 'ema2': 35, 'slip_atr_k': 0.23462682740691715, 'slip_spread_k': 0.11719007696349089, 'spread_hl_frac': 0.04529999153472895, 'bb_std_mult': 0.9351025492198628, 'rsi_os': 32, 'rsi_ob': 62, 'vol_spike': 0.07719448427276623, 'adx_thresh': 14.043684869406786, 'atr_min_pct': 0.01951063824665474, 'atr_max_pct': 0.12937506303349708, 'tp_mult': 2.487567323832873, 'tsl_mult': 0.8775997146284538, 'strategy': 'mean_reversion', 'time_stop': 41, 'use_sma': True, 'use_atr': True, 'use_adx': True, 'use_ema': True, 'use_spike': False, 'rsi_required': True, 'edge_k': 1.483410787678101, 'edge_cap': 0.8999319917564712, 'bull_strategy': 'mean_reversion', 'bull_bb_std_mult': 3.536630016571816, 'bull_rsi_os': 47, 'bull_rsi_ob': 77, 'bull_adx_thresh': 7.653446478971709, 'bull_atr_min_pct': 0.012938938524837755, 'bull_atr_max_pct': 0.019563341178612137, 'bull_tp_mult': 1.7027413818688626, 'bull_tsl_mult': 0.9248661141171471, 'bull_time_stop': 133, 'bull_use_sma': True, 'bull_use_ema': False, 'bull_use_atr': False, 'bull_use_adx': False, 'bull_use_spike': True, 'bull_rsi_required': False, 'bear_strategy': 'breakout', 'bear_bb_std_mult': 0.8604988141082676, 'bear_rsi_os': 9, 'bear_rsi_ob': 49, 'bear_adx_thresh': 19.495884737670057, 'bear_atr_min_pct': 0.021673069867345178, 'bear_atr_max_pct': 0.07451413906101965, 'bear_tp_mult': 2.7759359239577663, 'bear_tsl_mult': 0.22296433868917076, 'bear_time_stop': 58, 'bear_use_sma': False, 'bear_use_ema': True, 'bear_use_atr': True, 'bear_use_adx': False, 'bear_use_spike': True, 'bear_rsi_required': False, 'sideways_strategy': 'breakout', 'sideways_bb_std_mult': 1.9700116618233472, 'sideways_rsi_os': 30, 'sideways_rsi_ob': 54, 'sideways_adx_thresh': 31.137050125155024, 'sideways_atr_min_pct': 0.0025443984876406863, 'sideways_atr_max_pct': 0.11074404558910432, 'sideways_tp_mult': 1.9897501399126216, 'sideways_tsl_mult': 0.8722246812402508, 'sideways_time_stop': 219, 'sideways_use_sma': True, 'sideways_use_ema': True, 'sideways_use_atr': True, 'sideways_use_adx': False, 'sideways_use_spike': False, 'sideways_rsi_required': False}.
