[I 2025-08-31 03:45:10,075] Trial 102 finished with values: [-1000000000.0, 1000000000.0] and parameters: {'p_sma': 56, 'p_std': 35, 'p_atr': 17, 'p_adx': 10, 'rsi_period': 9, 'ema1': 9, 'ema2': 36, 'slip_atr_k': 0.12217430617759314, 'slip_spread_k': 0.8194850068602392, 'spread_hl_frac': 0.04090762829330556, 'bb_std_mult': 0.9663145652241194, 'rsi_os': 51, 'rsi_ob': 82, 'vol_spike': 0.020479768843373575, 'adx_thresh': 21.974335447965707, 'atr_min_pct': 0.0075146220477477, 'atr_max_pct': 0.1167804665920979, 'tp_mult': 2.3401219391772807, 'tsl_mult': 0.20702561995862712, 'strategy': 'mean_reversion', 'time_stop': 84, 'use_sma': False, 'use_atr': False, 'use_adx': True, 'use_ema': False, 'use_spike': True, 'rsi_required': False, 'edge_k': 1.619031927299428, 'edge_cap': 0.4160378395734128, 'bull_strategy': 'breakout', 'bull_bb_std_mult': 2.176914285780536, 'bull_rsi_os': 21, 'bull_rsi_ob': 88, 'bull_adx_thresh': 28.390953275115223, 'bull_atr_min_pct': 0.002433369560933619, 'bull_atr_max_pct': 0.1241962991794966, 'bull_tp_mult': 1.3738063550183086, 'bull_tsl_mult': 0.836002826757877, 'bull_time_stop': 41, 'bull_use_sma': True, 'bull_use_ema': False, 'bull_use_atr': True, 'bull_use_adx': False, 'bull_use_spike': False, 'bull_rsi_required': False, 'bear_strategy': 'breakout', 'bear_bb_std_mult': 1.5000354344400275, 'bear_rsi_os': 25, 'bear_rsi_ob': 57, 'bear_adx_thresh': 7.461447227707165, 'bear_atr_min_pct': 0.0009134328381700252, 'bear_atr_max_pct': 0.07349875193816818, 'bear_tp_mult': 1.80087739229204, 'bear_tsl_mult': 0.5985094871464215, 'bear_time_stop': 238, 'bear_use_sma': False, 'bear_use_ema': True, 'bear_use_atr': True, 'bear_use_adx': False, 'bear_use_spike': True, 'bear_rsi_required': True, 'sideways_strategy': 'breakout', 'sideways_bb_std_mult': 3.5721179188746954, 'sideways_rsi_os': 22, 'sideways_rsi_ob': 69, 'sideways_adx_thresh': 24.44617564486984, 'sideways_atr_min_pct': 0.02044349241980891, 'sideways_atr_max_pct': 0.10009590848592492, 'sideways_tp_mult': 2.397901101220125, 'sideways_tsl_mult': 0.8387244522128171, 'sideways_time_stop': 281, 'sideways_use_sma': True, 'sideways_use_ema': True, 'sideways_use_atr': False, 'sideways_use_adx': False, 'sideways_use_spike': False, 'sideways_rsi_required': False}.
[I 2025-08-31 03:45:38,714] Trial 103 finished with values: [-1000000000.0, 1000000000.0] and parameters: {'p_sma': 20, 'p_std': 43, 'p_atr': 25, 'p_adx': 8, 'rsi_period': 14, 'ema1': 7, 'ema2': 33, 'slip_atr_k': 0.17453211648194272, 'slip_spread_k': 0.7749615367049472, 'spread_hl_frac': 0.03294077786387533, 'bb_std_mult': 1.1818456167702234, 'rsi_os': 13, 'rsi_ob': 80, 'vol_spike': 0.12380022073955084, 'adx_thresh': 21.47781924636966, 'atr_min_pct': 0.008834278055546745, 'atr_max_pct': 0.08570576540778115, 'tp_mult': 1.4351780672537169, 'tsl_mult': 0.15863980405814504, 'strategy': 'mean_reversion', 'time_stop': 53, 'use_sma': False, 'use_atr': False, 'use_adx': True, 'use_ema': True, 'use_spike': False, 'rsi_required': True, 'edge_k': 0.498011742420149, 'edge_cap': 0.16421559531243202, 'bull_strategy': 'breakout', 'bull_bb_std_mult': 2.9681553522111566, 'bull_rsi_os': 31, 'bull_rsi_ob': 67, 'bull_adx_thresh': 7.384094114404046, 'bull_atr_min_pct': 0.0014390841749302333, 'bull_atr_max_pct': 0.10011617845397947, 'bull_tp_mult': 1.2831920664134273, 'bull_tsl_mult': 0.8226323465575257, 'bull_time_stop': 253, 'bull_use_sma': True, 'bull_use_ema': True, 'bull_use_atr': True, 'bull_use_adx': False, 'bull_use_spike': True, 'bull_rsi_required': False, 'bear_strategy': 'breakout', 'bear_bb_std_mult': 1.6566051709620064, 'bear_rsi_os': 18, 'bear_rsi_ob': 61, 'bear_adx_thresh': 10.677048968199207, 'bear_atr_min_pct': 0.024294598830076175, 'bear_atr_max_pct': 0.045140146096507655, 'bear_tp_mult': 2.7704275258051556, 'bear_tsl_mult': 0.6405435279303008, 'bear_time_stop': 18, 'bear_use_sma': False, 'bear_use_ema': False, 'bear_use_atr': True, 'bear_use_adx': False, 'bear_use_spike': False, 'bear_rsi_required': False, 'sideways_strategy': 'breakout', 'sideways_bb_std_mult': 3.208790105439628, 'sideways_rsi_os': 53, 'sideways_rsi_ob': 74, 'sideways_adx_thresh': 26.03588727494849, 'sideways_atr_min_pct': 0.028850976035182517, 'sideways_atr_max_pct': 0.058098068734769776, 'sideways_tp_mult': 2.9238490189908033, 'sideways_tsl_mult': 0.7915008857469826, 'sideways_time_stop': 23, 'sideways_use_sma': False, 'sideways_use_ema': False, 'sideways_use_atr': True, 'sideways_use_adx': False, 'sideways_use_spike': False, 'sideways_rsi_required': False}.
[I 2025-08-31 03:45:39,195] Trial 99 finished with values: [-0.01931410461528793, 0.01912537036400797] and parameters: {'p_sma': 56, 'p_std': 35, 'p_atr': 17, 'p_adx': 7, 'rsi_period': 14, 'ema1': 27, 'ema2': 39, 'slip_atr_k': 0.17515727953025376, 'slip_spread_k': 0.9386454856802914, 'spread_hl_frac': 0.03321073827907756, 'bb_std_mult': 0.9101568547954472, 'rsi_os': 24, 'rsi_ob': 69, 'vol_spike': 0.07311000874519208, 'adx_thresh': 22.140504334682014, 'atr_min_pct': 0.007502884407347938, 'atr_max_pct': 0.02964913537881894, 'tp_mult': 2.3436807142189053, 'tsl_mult': 0.20569633926519537, 'strategy': 'mean_reversion', 'time_stop': 54, 'use_sma': False, 'use_atr': False, 'use_adx': True, 'use_ema': True, 'use_spike': False, 'rsi_required': True, 'edge_k': 1.2545984335879585, 'edge_cap': 0.1508446333493199, 'bull_strategy': 'breakout', 'bull_bb_std_mult': 2.749321351751474, 'bull_rsi_os': 21, 'bull_rsi_ob': 67, 'bull_adx_thresh': 23.042560447484092, 'bull_atr_min_pct': 0.0013329792608336153, 'bull_atr_max_pct': 0.12338274290462792, 'bull_tp_mult': 1.3794390304838484, 'bull_tsl_mult': 0.8326852104903207, 'bull_time_stop': 238, 'bull_use_sma': True, 'bull_use_ema': True, 'bull_use_atr': True, 'bull_use_adx': False, 'bull_use_spike': True, 'bull_rsi_required': False, 'bear_strategy': 'breakout', 'bear_bb_std_mult': 1.6759093956298787, 'bear_rsi_os': 17, 'bear_rsi_ob': 65, 'bear_adx_thresh': 14.14306100651347, 'bear_atr_min_pct': 0.0009290501100145381, 'bear_atr_max_pct': 0.07005324477675329, 'bear_tp_mult': 1.434321795618566, 'bear_tsl_mult': 0.6834775952252716, 'bear_time_stop': 41, 'bear_use_sma': False, 'bear_use_ema': False, 'bear_use_atr': True, 'bear_use_adx': False, 'bear_use_spike': False, 'bear_rsi_required': False, 'sideways_strategy': 'breakout', 'sideways_bb_std_mult': 3.220514514091154, 'sideways_rsi_os': 53, 'sideways_rsi_ob': 70, 'sideways_adx_thresh': 25.878801958241723, 'sideways_atr_min_pct': 0.020085102535944598, 'sideways_atr_max_pct': 0.05766391311034096, 'sideways_tp_mult': 2.907117893991051, 'sideways_tsl_mult': 0.9411283778852371, 'sideways_time_stop': 300, 'sideways_use_sma': True, 'sideways_use_ema': True, 'sideways_use_atr': True, 'sideways_use_adx': False, 'sideways_use_spike': False, 'sideways_rsi_required': False}.
[I 2025-08-31 03:45:39,438] Trial 101 finished with values: [-1000000000.0, 1000000000.0] and parameters: {'p_sma': 20, 'p_std': 20, 'p_atr': 17, 'p_adx': 10, 'rsi_period': 14, 'ema1': 27, 'ema2': 36, 'slip_atr_k': 0.12308772502402372, 'slip_spread_k': 0.8095543195121306, 'spread_hl_frac': 0.038818906793072566, 'bb_std_mult': 0.7150508427951295, 'rsi_os': 13, 'rsi_ob': 82, 'vol_spike': 0.12561353581728116, 'adx_thresh': 22.17866865257048, 'atr_min_pct': 0.008581345209552805, 'atr_max_pct': 0.11609281671446783, 'tp_mult': 1.6998188228529383, 'tsl_mult': 0.19918304155931205, 'strategy': 'mean_reversion', 'time_stop': 49, 'use_sma': False, 'use_atr': False, 'use_adx': True, 'use_ema': True, 'use_spike': False, 'rsi_required': False, 'edge_k': 1.8047589843610927, 'edge_cap': 0.5501113471519556, 'bull_strategy': 'breakout', 'bull_bb_std_mult': 2.1812382468055223, 'bull_rsi_os': 31, 'bull_rsi_ob': 66, 'bull_adx_thresh': 25.09571825572321, 'bull_atr_min_pct': 0.0022692541546217968, 'bull_atr_max_pct': 0.12449341522447419, 'bull_tp_mult': 1.4330835445794483, 'bull_tsl_mult': 0.821817879471291, 'bull_time_stop': 235, 'bull_use_sma': True, 'bull_use_ema': True, 'bull_use_atr': True, 'bull_use_adx': False, 'bull_use_spike': True, 'bull_rsi_required': False, 'bear_strategy': 'breakout', 'bear_bb_std_mult': 1.8863908706140615, 'bear_rsi_os': 18, 'bear_rsi_ob': 56, 'bear_adx_thresh': 10.485858313026295, 'bear_atr_min_pct': 0.009610712227245351, 'bear_atr_max_pct': 0.06872873777663564, 'bear_tp_mult': 2.777709429469145, 'bear_tsl_mult': 0.645732141609239, 'bear_time_stop': 18, 'bear_use_sma': False, 'bear_use_ema': False, 'bear_use_atr': True, 'bear_use_adx': False, 'bear_use_spike': False, 'bear_rsi_required': False, 'sideways_strategy': 'breakout', 'sideways_bb_std_mult': 3.1253756199831875, 'sideways_rsi_os': 15, 'sideways_rsi_ob': 71, 'sideways_adx_thresh': 25.808402319423433, 'sideways_atr_min_pct': 0.028846174210508203, 'sideways_atr_max_pct': 0.05707257688992931, 'sideways_tp_mult': 2.3862008284902725, 'sideways_tsl_mult': 0.8447311857312508, 'sideways_time_stop': 255, 'sideways_use_sma': True, 'sideways_use_ema': True, 'sideways_use_atr': True, 'sideways_use_adx': False, 'sideways_use_spike': False, 'sideways_rsi_required': False}.
[I 2025-08-31 03:45:39,537] Trial 100 finished with values: [-1000000000.0, 1000000000.0] and parameters: {'p_sma': 52, 'p_std': 20, 'p_atr': 29, 'p_adx': 23, 'rsi_period': 14, 'ema1': 27, 'ema2': 16, 'slip_atr_k': 0.1237027131797098, 'slip_spread_k': 0.7815253457034628, 'spread_hl_frac': 0.032531060946639524, 'bb_std_mult': 2.6202186861915866, 'rsi_os': 13, 'rsi_ob': 69, 'vol_spike': 0.1231012202824666, 'adx_thresh': 26.677794127729967, 'atr_min_pct': 0.008809559077731908, 'atr_max_pct': 0.029794642218710803, 'tp_mult': 2.6919748492309097, 'tsl_mult': 0.20249587207690978, 'strategy': 'mean_reversion', 'time_stop': 221, 'use_sma': False, 'use_atr': False, 'use_adx': True, 'use_ema': True, 'use_spike': False, 'rsi_required': True, 'edge_k': 0.47431324819899573, 'edge_cap': 0.15722707531978497, 'bull_strategy': 'breakout', 'bull_bb_std_mult': 2.5998756729277948, 'bull_rsi_os': 22, 'bull_rsi_ob': 67, 'bull_adx_thresh': 31.236363167217604, 'bull_atr_min_pct': 0.00143288158781904, 'bull_atr_max_pct': 0.12219908270930904, 'bull_tp_mult': 1.3747454505015022, 'bull_tsl_mult': 0.8306954857455726, 'bull_time_stop': 201, 'bull_use_sma': True, 'bull_use_ema': True, 'bull_use_atr': True, 'bull_use_adx': False, 'bull_use_spike': True, 'bull_rsi_required': False, 'bear_strategy': 'breakout', 'bear_bb_std_mult': 1.9099104760459975, 'bear_rsi_os': 18, 'bear_rsi_ob': 57, 'bear_adx_thresh': 32.09348778648304, 'bear_atr_min_pct': 0.0169314682264862, 'bear_atr_max_pct': 0.0678534966694213, 'bear_tp_mult': 1.4307807196082558, 'bear_tsl_mult': 0.648031324941057, 'bear_time_stop': 138, 'bear_use_sma': False, 'bear_use_ema': False, 'bear_use_atr': True, 'bear_use_adx': False, 'bear_use_spike': False, 'bear_rsi_required': False, 'sideways_strategy': 'breakout', 'sideways_bb_std_mult': 3.1321131553011945, 'sideways_rsi_os': 23, 'sideways_rsi_ob': 69, 'sideways_adx_thresh': 28.793061066198433, 'sideways_atr_min_pct': 0.022611406832634205, 'sideways_atr_max_pct': 0.08737307092827953, 'sideways_tp_mult': 2.9056427312476907, 'sideways_tsl_mult': 0.9423011669572552, 'sideways_time_stop': 258, 'sideways_use_sma': True, 'sideways_use_ema': True, 'sideways_use_atr': True, 'sideways_use_adx': False, 'sideways_use_spike': False, 'sideways_rsi_required': False}.
[I 2025-08-31 03:46:09,056] Trial 107 finished with values: [-1000000000.0, 1000000000.0] and parameters: {'p_sma': 56, 'p_std': 14, 'p_atr': 27, 'p_adx': 7, 'rsi_period': 49, 'ema1': 20, 'ema2': 41, 'slip_atr_k': 0.18407034411878953, 'slip_spread_k': 0.9446029906100876, 'spread_hl_frac': 0.005198142295650427, 'bb_std_mult': 1.5408373085980234, 'rsi_os': 9, 'rsi_ob': 80, 'vol_spike': 0.0581104322189579, 'adx_thresh': 19.86844224435613, 'atr_min_pct': 0.004401544058160881, 'atr_max_pct': 0.047452355610616004, 'tp_mult': 1.0517185280286536, 'tsl_mult': 0.07488713973916772, 'strategy': 'breakout', 'time_stop': 165, 'use_sma': True, 'use_atr': True, 'use_adx': False, 'use_ema': False, 'use_spike': True, 'rsi_required': True, 'edge_k': 0.19907905248208801, 'edge_cap': 0.515534984701949, 'bull_strategy': 'breakout', 'bull_bb_std_mult': 1.924866838938641, 'bull_rsi_os': 7, 'bull_rsi_ob': 76, 'bull_adx_thresh': 33.68312840492866, 'bull_atr_min_pct': 0.018939681436932934, 'bull_atr_max_pct': 0.08890906993529721, 'bull_tp_mult': 2.8940827773273075, 'bull_tsl_mult': 0.682964957442288, 'bull_time_stop': 265, 'bull_use_sma': False, 'bull_use_ema': False, 'bull_use_atr': False, 'bull_use_adx': True, 'bull_use_spike': False, 'bull_rsi_required': True, 'bear_strategy': 'breakout', 'bear_bb_std_mult': 1.4346936265680972, 'bear_rsi_os': 27, 'bear_rsi_ob': 85, 'bear_adx_thresh': 9.01102613886235, 'bear_atr_min_pct': 0.006490059376627612, 'bear_atr_max_pct': 0.07848209547902651, 'bear_tp_mult': 1.8093351866178613, 'bear_tsl_mult': 0.6808046381751757, 'bear_time_stop': 42, 'bear_use_sma': True, 'bear_use_ema': True, 'bear_use_atr': True, 'bear_use_adx': True, 'bear_use_spike': True, 'bear_rsi_required': True, 'sideways_strategy': 'mean_reversion', 'sideways_bb_std_mult': 2.8390473161160754, 'sideways_rsi_os': 54, 'sideways_rsi_ob': 58, 'sideways_adx_thresh': 26.683044702308365, 'sideways_atr_min_pct': 0.023923496999892067, 'sideways_atr_max_pct': 0.0654366421229255, 'sideways_tp_mult': 1.7332333581190509, 'sideways_tsl_mult': 0.8078175895024385, 'sideways_time_stop': 41, 'sideways_use_sma': True, 'sideways_use_ema': False, 'sideways_use_atr': False, 'sideways_use_adx': True, 'sideways_use_spike': True, 'sideways_rsi_required': True}.
[I 2025-08-31 03:46:09,531] Trial 104 finished with values: [-1000000000.0, 1000000000.0] and parameters: {'p_sma': 52, 'p_std': 12, 'p_atr': 28, 'p_adx': 23, 'rsi_period': 59, 'ema1': 27, 'ema2': 41, 'slip_atr_k': 0.17680732217125442, 'slip_spread_k': 0.213018872875389, 'spread_hl_frac': 0.028244271862570728, 'bb_std_mult': 0.7308669351102384, 'rsi_os': 10, 'rsi_ob': 82, 'vol_spike': 0.05616397028181655, 'adx_thresh': 26.265703498282207, 'atr_min_pct': 0.008774872452735574, 'atr_max_pct': 0.12689938603394252, 'tp_mult': 1.5266030234938002, 'tsl_mult': 0.23279607616827755, 'strategy': 'mean_reversion', 'time_stop': 222, 'use_sma': False, 'use_atr': False, 'use_adx': True, 'use_ema': True, 'use_spike': False, 'rsi_required': True, 'edge_k': 1.8432324760635368, 'edge_cap': 0.45732891084758065, 'bull_strategy': 'breakout', 'bull_bb_std_mult': 2.595243537143588, 'bull_rsi_os': 7, 'bull_rsi_ob': 94, 'bull_adx_thresh': 24.940591515144718, 'bull_atr_min_pct': 0.0009086003376367445, 'bull_atr_max_pct': 0.13735554870017036, 'bull_tp_mult': 1.117268199498712, 'bull_tsl_mult': 0.6828477131876932, 'bull_time_stop': 201, 'bull_use_sma': True, 'bull_use_ema': True, 'bull_use_atr': True, 'bull_use_adx': False, 'bull_use_spike': True, 'bull_rsi_required': False, 'bear_strategy': 'breakout', 'bear_bb_std_mult': 1.9152507434167994, 'bear_rsi_os': 20, 'bear_rsi_ob': 85, 'bear_adx_thresh': 5.202385091467102, 'bear_atr_min_pct': 0.009493969450766852, 'bear_atr_max_pct': 0.0682017436839912, 'bear_tp_mult': 1.1864820923907637, 'bear_tsl_mult': 0.681844956100188, 'bear_time_stop': 42, 'bear_use_sma': False, 'bear_use_ema': False, 'bear_use_atr': True, 'bear_use_adx': False, 'bear_use_spike': False, 'bear_rsi_required': False, 'sideways_strategy': 'breakout', 'sideways_bb_std_mult': 3.1293380881665493, 'sideways_rsi_os': 36, 'sideways_rsi_ob': 62, 'sideways_adx_thresh': 28.84876120359245, 'sideways_atr_min_pct': 0.022587945935045574, 'sideways_atr_max_pct': 0.05201596742210011, 'sideways_tp_mult': 1.7332582982882832, 'sideways_tsl_mult': 0.8979475188382062, 'sideways_time_stop': 300, 'sideways_use_sma': True, 'sideways_use_ema': True, 'sideways_use_atr': True, 'sideways_use_adx': False, 'sideways_use_spike': False, 'sideways_rsi_required': False}.
[I 2025-08-31 03:46:09,607] Trial 105 finished with values: [-1000000000.0, 1000000000.0] and parameters: {'p_sma': 58, 'p_std': 14, 'p_atr': 28, 'p_adx': 23, 'rsi_period': 49, 'ema1': 20, 'ema2': 41, 'slip_atr_k': 0.1831913807453834, 'slip_spread_k': 0.9428375359976335, 'spread_hl_frac': 0.028105735882441498, 'bb_std_mult': 0.7113708274380279, 'rsi_os': 12, 'rsi_ob': 82, 'vol_spike': 0.060613025386500055, 'adx_thresh': 27.0987049846128, 'atr_min_pct': 0.007037964219661303, 'atr_max_pct': 0.029041503863347473, 'tp_mult': 2.702367558906375, 'tsl_mult': 0.9412911288648028, 'strategy': 'mean_reversion', 'time_stop': 163, 'use_sma': False, 'use_atr': True, 'use_adx': True, 'use_ema': True, 'use_spike': False, 'rsi_required': False, 'edge_k': 0.27274572810694, 'edge_cap': 0.5100617144878488, 'bull_strategy': 'breakout', 'bull_bb_std_mult': 3.0683825304104735, 'bull_rsi_os': 32, 'bull_rsi_ob': 64, 'bull_adx_thresh': 24.78226315304282, 'bull_atr_min_pct': 0.01906992365728682, 'bull_atr_max_pct': 0.13963752372415095, 'bull_tp_mult': 1.1005390660933156, 'bull_tsl_mult': 0.36137316253879215, 'bull_time_stop': 276, 'bull_use_sma': True, 'bull_use_ema': True, 'bull_use_atr': True, 'bull_use_adx': False, 'bull_use_spike': True, 'bull_rsi_required': True, 'bear_strategy': 'breakout', 'bear_bb_std_mult': 1.4290694057203648, 'bear_rsi_os': 5, 'bear_rsi_ob': 65, 'bear_adx_thresh': 32.2073406822128, 'bear_atr_min_pct': 0.017267767256962177, 'bear_atr_max_pct': 0.07859539859138107, 'bear_tp_mult': 2.0796357190297012, 'bear_tsl_mult': 0.6559427651836428, 'bear_time_stop': 43, 'bear_use_sma': False, 'bear_use_ema': False, 'bear_use_atr': True, 'bear_use_adx': False, 'bear_use_spike': False, 'bear_rsi_required': False, 'sideways_strategy': 'breakout', 'sideways_bb_std_mult': 3.121004753179106, 'sideways_rsi_os': 15, 'sideways_rsi_ob': 56, 'sideways_adx_thresh': 28.66761338253156, 'sideways_atr_min_pct': 0.00916750682674938, 'sideways_atr_max_pct': 0.05259074055423532, 'sideways_tp_mult': 1.7044615046573242, 'sideways_tsl_mult': 0.9127280631288921, 'sideways_time_stop': 255, 'sideways_use_sma': True, 'sideways_use_ema': True, 'sideways_use_atr': True, 'sideways_use_adx': True, 'sideways_use_spike': False, 'sideways_rsi_required': False}.
[I 2025-08-31 03:46:09,723] Trial 106 finished with values: [-1000000000.0, 1000000000.0] and parameters: {'p_sma': 56, 'p_std': 13, 'p_atr': 12, 'p_adx': 23, 'rsi_period': 65, 'ema1': 20, 'ema2': 41, 'slip_atr_k': 0.18488588709758774, 'slip_spread_k': 0.8891274072942141, 'spread_hl_frac': 0.025762828572747958, 'bb_std_mult': 1.3077798652464279, 'rsi_os': 24, 'rsi_ob': 80, 'vol_spike': 0.14746333544609314, 'adx_thresh': 26.374773176294237, 'atr_min_pct': 0.0249655794693083, 'atr_max_pct': 0.055031348748417905, 'tp_mult': 1.5205490448635697, 'tsl_mult': 0.9360181150967605, 'strategy': 'mean_reversion', 'time_stop': 70, 'use_sma': True, 'use_atr': True, 'use_adx': True, 'use_ema': False, 'use_spike': True, 'rsi_required': True, 'edge_k': 1.3101647245891035, 'edge_cap': 0.423330630513405, 'bull_strategy': 'breakout', 'bull_bb_std_mult': 2.5855051083640714, 'bull_rsi_os': 22, 'bull_rsi_ob': 77, 'bull_adx_thresh': 26.96143832768249, 'bull_atr_min_pct': 0.01861760595034483, 'bull_atr_max_pct': 0.08813928318021072, 'bull_tp_mult': 1.5710242247131516, 'bull_tsl_mult': 0.679443705086587, 'bull_time_stop': 274, 'bull_use_sma': True, 'bull_use_ema': False, 'bull_use_atr': False, 'bull_use_adx': True, 'bull_use_spike': False, 'bull_rsi_required': True, 'bear_strategy': 'breakout', 'bear_bb_std_mult': 1.9376900262951295, 'bear_rsi_os': 28, 'bear_rsi_ob': 62, 'bear_adx_thresh': 5.138239497834515, 'bear_atr_min_pct': 0.017179836040849786, 'bear_atr_max_pct': 0.07974652389141844, 'bear_tp_mult': 1.427512898797694, 'bear_tsl_mult': 0.04655247170582988, 'bear_time_stop': 40, 'bear_use_sma': True, 'bear_use_ema': True, 'bear_use_atr': True, 'bear_use_adx': True, 'bear_use_spike': True, 'bear_rsi_required': True, 'sideways_strategy': 'breakout', 'sideways_bb_std_mult': 2.792811534921881, 'sideways_rsi_os': 45, 'sideways_rsi_ob': 55, 'sideways_adx_thresh': 29.042385768374093, 'sideways_atr_min_pct': 0.022794625159642562, 'sideways_atr_max_pct': 0.051905661417212076, 'sideways_tp_mult': 1.7327608777738293, 'sideways_tsl_mult': 0.9416320753121216, 'sideways_time_stop': 58, 'sideways_use_sma': True, 'sideways_use_ema': True, 'sideways_use_atr': True, 'sideways_use_adx': True, 'sideways_use_spike': False, 'sideways_rsi_required': True}.
