[I 2025-08-31 04:18:50,560] Trial 312 finished with values: [-0.016446611937392164, 0.01637989672167492] and parameters: {'p_sma': 41, 'p_std': 15, 'p_atr': 11, 'p_adx': 15, 'rsi_period': 20, 'ema1': 11, 'ema2': 23, 'slip_atr_k': 0.02235685350726497, 'slip_spread_k': 0.10654600105044856, 'spread_hl_frac': 0.010483899443540612, 'bb_std_mult': 1.8401269232668396, 'rsi_os': 30, 'rsi_ob': 60, 'vol_spike': 0.016779177879918443, 'adx_thresh': 6.270760878889188, 'atr_min_pct': 0.022082318354550764, 'atr_max_pct': 0.07837588985360432, 'tp_mult': 1.8360667192957587, 'tsl_mult': 0.5025788962518534, 'strategy': 'breakout', 'time_stop': 61, 'use_sma': False, 'use_atr': True, 'use_adx': True, 'use_ema': False, 'use_spike': True, 'rsi_required': True, 'edge_k': 1.851338458592614, 'edge_cap': 0.6491766940702037, 'bull_strategy': 'mean_reversion', 'bull_bb_std_mult': 2.016624830655391, 'bull_rsi_os': 16, 'bull_rsi_ob': 75, 'bull_adx_thresh': 16.27582525763334, 'bull_atr_min_pct': 0.0017022122371539341, 'bull_atr_max_pct': 0.04297168747000453, 'bull_tp_mult': 1.6334895767828588, 'bull_tsl_mult': 0.8782973220922067, 'bull_time_stop': 94, 'bull_use_sma': True, 'bull_use_ema': False, 'bull_use_atr': True, 'bull_use_adx': True, 'bull_use_spike': False, 'bull_rsi_required': True, 'bear_strategy': 'mean_reversion', 'bear_bb_std_mult': 2.124287246892161, 'bear_rsi_os': 51, 'bear_rsi_ob': 49, 'bear_adx_thresh': 21.030300398611914, 'bear_atr_min_pct': 0.023105996199997158, 'bear_atr_max_pct': 0.10542853887983739, 'bear_tp_mult': 2.7055474094773553, 'bear_tsl_mult': 0.66800652415943, 'bear_time_stop': 91, 'bear_use_sma': True, 'bear_use_ema': True, 'bear_use_atr': True, 'bear_use_adx': True, 'bear_use_spike': True, 'bear_rsi_required': False, 'sideways_strategy': 'mean_reversion', 'sideways_bb_std_mult': 2.825119756926733, 'sideways_rsi_os': 19, 'sideways_rsi_ob': 54, 'sideways_adx_thresh': 11.27203923088225, 'sideways_atr_min_pct': 0.0025070491491044847, 'sideways_atr_max_pct': 0.11577146667697812, 'sideways_tp_mult': 2.02031652132896, 'sideways_tsl_mult': 0.6327029880310568, 'sideways_time_stop': 77, 'sideways_use_sma': False, 'sideways_use_ema': True, 'sideways_use_atr': True, 'sideways_use_adx': True, 'sideways_use_spike': False, 'sideways_rsi_required': True}.
[I 2025-08-31 04:18:50,871] Trial 313 finished with values: [-0.013822396043158713, 0.01377869692437138] and parameters: {'p_sma': 28, 'p_std': 15, 'p_atr': 25, 'p_adx': 19, 'rsi_period': 79, 'ema1': 14, 'ema2': 23, 'slip_atr_k': 0.022093992621200317, 'slip_spread_k': 0.11661507531669574, 'spread_hl_frac': 0.010590626767316248, 'bb_std_mult': 1.8324878849803106, 'rsi_os': 30, 'rsi_ob': 52, 'vol_spike': 0.014344186332740583, 'adx_thresh': 30.818918602800256, 'atr_min_pct': 0.022030866768843325, 'atr_max_pct': 0.12945538171763674, 'tp_mult': 1.8132670508329836, 'tsl_mult': 0.8883302241424019, 'strategy': 'breakout', 'time_stop': 80, 'use_sma': False, 'use_atr': True, 'use_adx': True, 'use_ema': False, 'use_spike': True, 'rsi_required': True, 'edge_k': 1.4507055983637063, 'edge_cap': 0.9489068858058822, 'bull_strategy': 'mean_reversion', 'bull_bb_std_mult': 3.5150885587717307, 'bull_rsi_os': 16, 'bull_rsi_ob': 76, 'bull_adx_thresh': 16.252344070105398, 'bull_atr_min_pct': 0.0016254365798434043, 'bull_atr_max_pct': 0.04407305021907831, 'bull_tp_mult': 2.687785242564655, 'bull_tsl_mult': 0.8832351546979258, 'bull_time_stop': 95, 'bull_use_sma': True, 'bull_use_ema': False, 'bull_use_atr': True, 'bull_use_adx': True, 'bull_use_spike': False, 'bull_rsi_required': True, 'bear_strategy': 'mean_reversion', 'bear_bb_std_mult': 1.0171498496286793, 'bear_rsi_os': 7, 'bear_rsi_ob': 49, 'bear_adx_thresh': 7.857764178378744, 'bear_atr_min_pct': 0.023235179446374512, 'bear_atr_max_pct': 0.1162695500755828, 'bear_tp_mult': 2.716417802798861, 'bear_tsl_mult': 0.9482750841791687, 'bear_time_stop': 79, 'bear_use_sma': True, 'bear_use_ema': True, 'bear_use_atr': True, 'bear_use_adx': True, 'bear_use_spike': True, 'bear_rsi_required': False, 'sideways_strategy': 'mean_reversion', 'sideways_bb_std_mult': 1.2770688106736432, 'sideways_rsi_os': 12, 'sideways_rsi_ob': 73, 'sideways_adx_thresh': 19.95921071317007, 'sideways_atr_min_pct': 0.014917008736925258, 'sideways_atr_max_pct': 0.13328259741127152, 'sideways_tp_mult': 2.0169601755393924, 'sideways_tsl_mult': 0.41679386368389365, 'sideways_time_stop': 74, 'sideways_use_sma': False, 'sideways_use_ema': True, 'sideways_use_atr': True, 'sideways_use_adx': True, 'sideways_use_spike': False, 'sideways_rsi_required': True}.
[I 2025-08-31 04:19:42,062] Trial 319 finished with values: [-1000000000.0, 1000000000.0] and parameters: {'p_sma': 53, 'p_std': 16, 'p_atr': 26, 'p_adx': 9, 'rsi_period': 26, 'ema1': 14, 'ema2': 26, 'slip_atr_k': 0.02218449953417096, 'slip_spread_k': 0.06942645686230103, 'spread_hl_frac': 0.010342299229523805, 'bb_std_mult': 2.0165695384002738, 'rsi_os': 30, 'rsi_ob': 52, 'vol_spike': 0.015905693091849554, 'adx_thresh': 31.744724020543472, 'atr_min_pct': 0.02790265086520073, 'atr_max_pct': 0.11922632447754786, 'tp_mult': 1.9708003815397375, 'tsl_mult': 0.9060759145067171, 'strategy': 'breakout', 'time_stop': 234, 'use_sma': False, 'use_atr': False, 'use_adx': False, 'use_ema': False, 'use_spike': True, 'rsi_required': False, 'edge_k': 1.509166320298019, 'edge_cap': 0.5054620001092057, 'bull_strategy': 'breakout', 'bull_bb_std_mult': 3.3655451141418418, 'bull_rsi_os': 13, 'bull_rsi_ob': 64, 'bull_adx_thresh': 13.918255693549042, 'bull_atr_min_pct': 0.002021372774495618, 'bull_atr_max_pct': 0.10821104843885897, 'bull_tp_mult': 1.6273098682875433, 'bull_tsl_mult': 0.8925449862550078, 'bull_time_stop': 122, 'bull_use_sma': False, 'bull_use_ema': False, 'bull_use_atr': True, 'bull_use_adx': True, 'bull_use_spike': False, 'bull_rsi_required': True, 'bear_strategy': 'mean_reversion', 'bear_bb_std_mult': 2.1635780435869303, 'bear_rsi_os': 7, 'bear_rsi_ob': 52, 'bear_adx_thresh': 21.143944524959572, 'bear_atr_min_pct': 0.024249248159659183, 'bear_atr_max_pct': 0.03654574699811439, 'bear_tp_mult': 2.7061072120752434, 'bear_tsl_mult': 0.22198447351609718, 'bear_time_stop': 193, 'bear_use_sma': True, 'bear_use_ema': True, 'bear_use_atr': True, 'bear_use_adx': True, 'bear_use_spike': True, 'bear_rsi_required': True, 'sideways_strategy': 'mean_reversion', 'sideways_bb_std_mult': 1.1978360910552823, 'sideways_rsi_os': 31, 'sideways_rsi_ob': 55, 'sideways_adx_thresh': 10.931476318585913, 'sideways_atr_min_pct': 0.012805051736583577, 'sideways_atr_max_pct': 0.0762309761990078, 'sideways_tp_mult': 2.07059070148189, 'sideways_tsl_mult': 0.6567220283761936, 'sideways_time_stop': 59, 'sideways_use_sma': False, 'sideways_use_ema': False, 'sideways_use_atr': False, 'sideways_use_adx': True, 'sideways_use_spike': True, 'sideways_rsi_required': True}.
[I 2025-08-31 04:19:42,408] Trial 318 finished with values: [-1000000000.0, 1000000000.0] and parameters: {'p_sma': 41, 'p_std': 10, 'p_atr': 21, 'p_adx': 9, 'rsi_period': 26, 'ema1': 14, 'ema2': 54, 'slip_atr_k': 0.01991155290747231, 'slip_spread_k': 0.07030050532471786, 'spread_hl_frac': 0.010478077261877314, 'bb_std_mult': 2.5045658562398807, 'rsi_os': 30, 'rsi_ob': 67, 'vol_spike': 0.030213963081426348, 'adx_thresh': 10.260713868534278, 'atr_min_pct': 0.022597251986784396, 'atr_max_pct': 0.12092650258454365, 'tp_mult': 2.876635226491832, 'tsl_mult': 0.023003413298552933, 'strategy': 'breakout', 'time_stop': 43, 'use_sma': False, 'use_atr': False, 'use_adx': False, 'use_ema': False, 'use_spike': True, 'rsi_required': False, 'edge_k': 0.6338106337294354, 'edge_cap': 0.6995279573505917, 'bull_strategy': 'breakout', 'bull_bb_std_mult': 3.360011338096774, 'bull_rsi_os': 27, 'bull_rsi_ob': 76, 'bull_adx_thresh': 10.413048349162706, 'bull_atr_min_pct': 0.006026432915439988, 'bull_atr_max_pct': 0.06015547360015464, 'bull_tp_mult': 1.6375132444840854, 'bull_tsl_mult': 0.6717412651527277, 'bull_time_stop': 34, 'bull_use_sma': False, 'bull_use_ema': False, 'bull_use_atr': True, 'bull_use_adx': True, 'bull_use_spike': False, 'bull_rsi_required': True, 'bear_strategy': 'mean_reversion', 'bear_bb_std_mult': 3.0477294268070922, 'bear_rsi_os': 7, 'bear_rsi_ob': 47, 'bear_adx_thresh': 21.062316255083523, 'bear_atr_min_pct': 0.024204016451652818, 'bear_atr_max_pct': 0.03684751987354226, 'bear_tp_mult': 2.7244368428161243, 'bear_tsl_mult': 0.21755792210096667, 'bear_time_stop': 189, 'bear_use_sma': True, 'bear_use_ema': True, 'bear_use_atr': True, 'bear_use_adx': True, 'bear_use_spike': True, 'bear_rsi_required': True, 'sideways_strategy': 'mean_reversion', 'sideways_bb_std_mult': 2.8268136780325888, 'sideways_rsi_os': 36, 'sideways_rsi_ob': 73, 'sideways_adx_thresh': 6.233532161072061, 'sideways_atr_min_pct': 0.014907742228092378, 'sideways_atr_max_pct': 0.09088939561545903, 'sideways_tp_mult': 1.308422106063429, 'sideways_tsl_mult': 0.6574617896917379, 'sideways_time_stop': 152, 'sideways_use_sma': False, 'sideways_use_ema': False, 'sideways_use_atr': False, 'sideways_use_adx': True, 'sideways_use_spike': True, 'sideways_rsi_required': True}.
[I 2025-08-31 04:19:42,610] Trial 320 finished with values: [-1000000000.0, 1000000000.0] and parameters: {'p_sma': 42, 'p_std': 15, 'p_atr': 16, 'p_adx': 10, 'rsi_period': 39, 'ema1': 8, 'ema2': 26, 'slip_atr_k': 0.019717966437085028, 'slip_spread_k': 0.06339699122149851, 'spread_hl_frac': 0.010660313321329253, 'bb_std_mult': 1.9895250152215758, 'rsi_os': 30, 'rsi_ob': 52, 'vol_spike': 0.10270696311759694, 'adx_thresh': 28.876107771489966, 'atr_min_pct': 0.02221500290645803, 'atr_max_pct': 0.11873371376222258, 'tp_mult': 1.8298081876195407, 'tsl_mult': 0.7697867486719393, 'strategy': 'breakout', 'time_stop': 53, 'use_sma': False, 'use_atr': False, 'use_adx': False, 'use_ema': False, 'use_spike': True, 'rsi_required': False, 'edge_k': 1.505844614450435, 'edge_cap': 0.9784266762995358, 'bull_strategy': 'breakout', 'bull_bb_std_mult': 3.5146189629945477, 'bull_rsi_os': 13, 'bull_rsi_ob': 65, 'bull_adx_thresh': 8.169174884065967, 'bull_atr_min_pct': 0.016723543560015635, 'bull_atr_max_pct': 0.02163368200965418, 'bull_tp_mult': 1.618309013526736, 'bull_tsl_mult': 0.90027750439503, 'bull_time_stop': 122, 'bull_use_sma': False, 'bull_use_ema': False, 'bull_use_atr': True, 'bull_use_adx': True, 'bull_use_spike': False, 'bull_rsi_required': True, 'bear_strategy': 'mean_reversion', 'bear_bb_std_mult': 0.9954213284982504, 'bear_rsi_os': 7, 'bear_rsi_ob': 89, 'bear_adx_thresh': 21.067764981610594, 'bear_atr_min_pct': 0.024099489138644594, 'bear_atr_max_pct': 0.028585847414067403, 'bear_tp_mult': 2.718758167526466, 'bear_tsl_mult': 0.29757754013877824, 'bear_time_stop': 190, 'bear_use_sma': True, 'bear_use_ema': True, 'bear_use_atr': True, 'bear_use_adx': True, 'bear_use_spike': True, 'bear_rsi_required': True, 'sideways_strategy': 'mean_reversion', 'sideways_bb_std_mult': 0.8904559560413492, 'sideways_rsi_os': 27, 'sideways_rsi_ob': 55, 'sideways_adx_thresh': 10.671540820594556, 'sideways_atr_min_pct': 0.01476866334009238, 'sideways_atr_max_pct': 0.11017722544011048, 'sideways_tp_mult': 1.3188145179348858, 'sideways_tsl_mult': 0.6481569207691616, 'sideways_time_stop': 73, 'sideways_use_sma': False, 'sideways_use_ema': False, 'sideways_use_atr': False, 'sideways_use_adx': True, 'sideways_use_spike': True, 'sideways_rsi_required': True}.
[I 2025-08-31 04:19:43,812] Trial 317 finished with values: [-1000000000.0, 1000000000.0] and parameters: {'p_sma': 42, 'p_std': 17, 'p_atr': 21, 'p_adx': 9, 'rsi_period': 26, 'ema1': 14, 'ema2': 26, 'slip_atr_k': 0.020053944029498498, 'slip_spread_k': 0.022140193240189385, 'spread_hl_frac': 0.01274815444356505, 'bb_std_mult': 1.9973132386939878, 'rsi_os': 50, 'rsi_ob': 58, 'vol_spike': 0.047179241527427335, 'adx_thresh': 7.048222216019235, 'atr_min_pct': 0.02263498230941046, 'atr_max_pct': 0.12072143555232165, 'tp_mult': 2.4520119951194213, 'tsl_mult': 0.8828860216085673, 'strategy': 'breakout', 'time_stop': 80, 'use_sma': False, 'use_atr': False, 'use_adx': False, 'use_ema': False, 'use_spike': True, 'rsi_required': False, 'edge_k': 1.3145127759371433, 'edge_cap': 0.6398675677261789, 'bull_strategy': 'breakout', 'bull_bb_std_mult': 3.3569744715430025, 'bull_rsi_os': 26, 'bull_rsi_ob': 76, 'bull_adx_thresh': 8.488585909654505, 'bull_atr_min_pct': 0.028431710523188373, 'bull_atr_max_pct': 0.043865831846787336, 'bull_tp_mult': 1.623095955080083, 'bull_tsl_mult': 0.03824946791332118, 'bull_time_stop': 34, 'bull_use_sma': False, 'bull_use_ema': False, 'bull_use_atr': True, 'bull_use_adx': True, 'bull_use_spike': False, 'bull_rsi_required': True, 'bear_strategy': 'mean_reversion', 'bear_bb_std_mult': 0.9002089076168229, 'bear_rsi_os': 7, 'bear_rsi_ob': 75, 'bear_adx_thresh': 12.10022218889862, 'bear_atr_min_pct': 0.023598474605008902, 'bear_atr_max_pct': 0.027854008430486472, 'bear_tp_mult': 2.77030438350132, 'bear_tsl_mult': 0.13971978183321376, 'bear_time_stop': 190, 'bear_use_sma': True, 'bear_use_ema': True, 'bear_use_atr': True, 'bear_use_adx': True, 'bear_use_spike': True, 'bear_rsi_required': False, 'sideways_strategy': 'mean_reversion', 'sideways_bb_std_mult': 1.2566907996225951, 'sideways_rsi_os': 31, 'sideways_rsi_ob': 61, 'sideways_adx_thresh': 5.979717390708023, 'sideways_atr_min_pct': 0.01488762355478093, 'sideways_atr_max_pct': 0.07573860105056267, 'sideways_tp_mult': 2.134123919198099, 'sideways_tsl_mult': 0.6559601327128006, 'sideways_time_stop': 152, 'sideways_use_sma': False, 'sideways_use_ema': False, 'sideways_use_atr': False, 'sideways_use_adx': True, 'sideways_use_spike': True, 'sideways_rsi_required': True}.
[I 2025-08-31 04:20:32,618] Trial 322 finished with values: [-1000000000.0, 1000000000.0] and parameters: {'p_sma': 55, 'p_std': 15, 'p_atr': 16, 'p_adx': 19, 'rsi_period': 21, 'ema1': 30, 'ema2': 26, 'slip_atr_k': 0.01434714163655372, 'slip_spread_k': 0.5797725335468964, 'spread_hl_frac': 0.01283617522396825, 'bb_std_mult': 3.518509752434316, 'rsi_os': 45, 'rsi_ob': 58, 'vol_spike': 0.007727069629095001, 'adx_thresh': 29.117451737682202, 'atr_min_pct': 0.014013153493587652, 'atr_max_pct': 0.12992964257706957, 'tp_mult': 2.176349502709108, 'tsl_mult': 0.7762700526259388, 'strategy': 'mean_reversion', 'time_stop': 55, 'use_sma': True, 'use_atr': False, 'use_adx': False, 'use_ema': False, 'use_spike': True, 'rsi_required': False, 'edge_k': 1.3249896271055062, 'edge_cap': 0.983220040123817, 'bull_strategy': 'mean_reversion', 'bull_bb_std_mult': 3.5089221004951954, 'bull_rsi_os': 34, 'bull_rsi_ob': 78, 'bull_adx_thresh': 12.027116617513324, 'bull_atr_min_pct': 0.016374057888571058, 'bull_atr_max_pct': 0.039644008206421145, 'bull_tp_mult': 1.6919847659474982, 'bull_tsl_mult': 0.9075408816148538, 'bull_time_stop': 155, 'bull_use_sma': False, 'bull_use_ema': False, 'bull_use_atr': False, 'bull_use_adx': True, 'bull_use_spike': False, 'bull_rsi_required': False, 'bear_strategy': 'breakout', 'bear_bb_std_mult': 0.9066160055021486, 'bear_rsi_os': 10, 'bear_rsi_ob': 79, 'bear_adx_thresh': 34.8380723930327, 'bear_atr_min_pct': 0.02154774306933034, 'bear_atr_max_pct': 0.04574690282860607, 'bear_tp_mult': 2.6686123867416685, 'bear_tsl_mult': 0.29823349026710533, 'bear_time_stop': 199, 'bear_use_sma': True, 'bear_use_ema': True, 'bear_use_atr': True, 'bear_use_adx': True, 'bear_use_spike': True, 'bear_rsi_required': True, 'sideways_strategy': 'breakout', 'sideways_bb_std_mult': 1.2663028289901281, 'sideways_rsi_os': 21, 'sideways_rsi_ob': 54, 'sideways_adx_thresh': 19.652961950226945, 'sideways_atr_min_pct': 0.009481399491469665, 'sideways_atr_max_pct': 0.11056122384199363, 'sideways_tp_mult': 1.3694300472203922, 'sideways_tsl_mult': 0.6212371342597744, 'sideways_time_stop': 73, 'sideways_use_sma': False, 'sideways_use_ema': False, 'sideways_use_atr': False, 'sideways_use_adx': True, 'sideways_use_spike': True, 'sideways_rsi_required': True}.
[I 2025-08-31 04:20:33,698] Trial 324 finished with values: [-1000000000.0, 1000000000.0] and parameters: {'p_sma': 35, 'p_std': 14, 'p_atr': 25, 'p_adx': 8, 'rsi_period': 22, 'ema1': 13, 'ema2': 25, 'slip_atr_k': 0.02807904709288965, 'slip_spread_k': 0.08587857353635903, 'spread_hl_frac': 0.019055746201998066, 'bb_std_mult': 3.216011159214525, 'rsi_os': 27, 'rsi_ob': 78, 'vol_spike': 0.023910607253454973, 'adx_thresh': 18.823241782574296, 'atr_min_pct': 0.019667805134837298, 'atr_max_pct': 0.1294672142017781, 'tp_mult': 2.172303234575479, 'tsl_mult': 0.6250462379049025, 'strategy': 'mean_reversion', 'time_stop': 35, 'use_sma': True, 'use_atr': False, 'use_adx': False, 'use_ema': False, 'use_spike': True, 'rsi_required': False, 'edge_k': 1.4248278036394877, 'edge_cap': 0.9993561162860931, 'bull_strategy': 'mean_reversion', 'bull_bb_std_mult': 3.4596833562081786, 'bull_rsi_os': 11, 'bull_rsi_ob': 78, 'bull_adx_thresh': 19.078610041963707, 'bull_atr_min_pct': 0.02167101280348254, 'bull_atr_max_pct': 0.014380280279104832, 'bull_tp_mult': 1.7010685381292288, 'bull_tsl_mult': 0.45538154336825776, 'bull_time_stop': 49, 'bull_use_sma': False, 'bull_use_ema': False, 'bull_use_atr': False, 'bull_use_adx': True, 'bull_use_spike': False, 'bull_rsi_required': False, 'bear_strategy': 'breakout', 'bear_bb_std_mult': 2.4940919855048334, 'bear_rsi_os': 21, 'bear_rsi_ob': 73, 'bear_adx_thresh': 16.35697913822368, 'bear_atr_min_pct': 0.019711478421465853, 'bear_atr_max_pct': 0.04531311756054963, 'bear_tp_mult': 2.7467836554513765, 'bear_tsl_mult': 0.32822418614828097, 'bear_time_stop': 200, 'bear_use_sma': True, 'bear_use_ema': True, 'bear_use_atr': False, 'bear_use_adx': False, 'bear_use_spike': True, 'bear_rsi_required': True, 'sideways_strategy': 'breakout', 'sideways_bb_std_mult': 1.028533940596904, 'sideways_rsi_os': 32, 'sideways_rsi_ob': 91, 'sideways_adx_thresh': 12.508202943182171, 'sideways_atr_min_pct': 0.017563732389783294, 'sideways_atr_max_pct': 0.1406637904804636, 'sideways_tp_mult': 1.9274884786693842, 'sideways_tsl_mult': 0.6174325963848504, 'sideways_time_stop': 53, 'sideways_use_sma': False, 'sideways_use_ema': False, 'sideways_use_atr': False, 'sideways_use_adx': True, 'sideways_use_spike': True, 'sideways_rsi_required': True}.
[I 2025-08-31 04:20:33,698] Trial 323 finished with values: [-0.015612274289772188, 0.01554776307162572] and parameters: {'p_sma': 55, 'p_std': 13, 'p_atr': 25, 'p_adx': 19, 'rsi_period': 22, 'ema1': 13, 'ema2': 25, 'slip_atr_k': 0.03232558746506185, 'slip_spread_k': 0.09278104610648889, 'spread_hl_frac': 0.012489491717638345, 'bb_std_mult': 3.53970068747208, 'rsi_os': 27, 'rsi_ob': 78, 'vol_spike': 0.0252148396381816, 'adx_thresh': 16.350289076143223, 'atr_min_pct': 0.020777348553953648, 'atr_max_pct': 0.1308527304516736, 'tp_mult': 2.430485122991536, 'tsl_mult': 0.8351325898929429, 'strategy': 'mean_reversion', 'time_stop': 35, 'use_sma': True, 'use_atr': False, 'use_adx': False, 'use_ema': False, 'use_spike': True, 'rsi_required': False, 'edge_k': 1.430427187106043, 'edge_cap': 0.6504530313817197, 'bull_strategy': 'mean_reversion', 'bull_bb_std_mult': 3.59799152982969, 'bull_rsi_os': 16, 'bull_rsi_ob': 78, 'bull_adx_thresh': 12.303488611440502, 'bull_atr_min_pct': 0.0013429086416818978, 'bull_atr_max_pct': 0.046988961550746874, 'bull_tp_mult': 1.1444196429126303, 'bull_tsl_mult': 0.11268848054967512, 'bull_time_stop': 153, 'bull_use_sma': False, 'bull_use_ema': False, 'bull_use_atr': False, 'bull_use_adx': True, 'bull_use_spike': False, 'bull_rsi_required': False, 'bear_strategy': 'breakout', 'bear_bb_std_mult': 0.886941498899476, 'bear_rsi_os': 10, 'bear_rsi_ob': 73, 'bear_adx_thresh': 5.059936692254302, 'bear_atr_min_pct': 0.003013767051564354, 'bear_atr_max_pct': 0.045331213891987646, 'bear_tp_mult': 2.6722803386996143, 'bear_tsl_mult': 0.2575375008844054, 'bear_time_stop': 199, 'bear_use_sma': True, 'bear_use_ema': True, 'bear_use_atr': False, 'bear_use_adx': False, 'bear_use_spike': True, 'bear_rsi_required': False, 'sideways_strategy': 'breakout', 'sideways_bb_std_mult': 1.2971015674427346, 'sideways_rsi_os': 32, 'sideways_rsi_ob': 63, 'sideways_adx_thresh': 19.93836255503885, 'sideways_atr_min_pct': 0.022228385139525336, 'sideways_atr_max_pct': 0.14970804832027734, 'sideways_tp_mult': 1.9324627269747818, 'sideways_tsl_mult': 0.054316576745083445, 'sideways_time_stop': 42, 'sideways_use_sma': False, 'sideways_use_ema': False, 'sideways_use_atr': False, 'sideways_use_adx': True, 'sideways_use_spike': True, 'sideways_rsi_required': True}.
