[I 2025-08-31 05:15:52,935] Trial 612 finished with values: [-1000000000.0, 1000000000.0] and parameters: {'p_sma': 58, 'p_std': 15, 'p_atr': 18, 'p_adx': 9, 'rsi_period': 19, 'ema1': 25, 'ema2': 25, 'slip_atr_k': 0.02916857775860554, 'slip_spread_k': 0.6012742718545712, 'spread_hl_frac': 0.006588987380745474, 'bb_std_mult': 2.135819961800624, 'rsi_os': 23, 'rsi_ob': 59, 'vol_spike': 0.012389026135327993, 'adx_thresh': 9.88283681965835, 'atr_min_pct': 0.024758394560548087, 'atr_max_pct': 0.1000739016388606, 'tp_mult': 2.3266174637934642, 'tsl_mult': 0.7682005807916483, 'strategy': 'mean_reversion', 'time_stop': 29, 'use_sma': False, 'use_atr': True, 'use_adx': False, 'use_ema': False, 'use_spike': True, 'rsi_required': True, 'edge_k': 0.33148952448620994, 'edge_cap': 0.7681364648824047, 'bull_strategy': 'mean_reversion', 'bull_bb_std_mult': 0.8713758730175014, 'bull_rsi_os': 45, 'bull_rsi_ob': 82, 'bull_adx_thresh': 7.822770710377857, 'bull_atr_min_pct': 0.009517637619378884, 'bull_atr_max_pct': 0.06439529561779538, 'bull_tp_mult': 1.8068279436264663, 'bull_tsl_mult': 0.9632057307253657, 'bull_time_stop': 232, 'bull_use_sma': False, 'bull_use_ema': False, 'bull_use_atr': True, 'bull_use_adx': True, 'bull_use_spike': False, 'bull_rsi_required': False, 'bear_strategy': 'breakout', 'bear_bb_std_mult': 0.7677455874165316, 'bear_rsi_os': 11, 'bear_rsi_ob': 73, 'bear_adx_thresh': 24.14997157916729, 'bear_atr_min_pct': 0.009115510064930325, 'bear_atr_max_pct': 0.049625178863624164, 'bear_tp_mult': 1.1153430955763026, 'bear_tsl_mult': 0.23166512380038268, 'bear_time_stop': 287, 'bear_use_sma': True, 'bear_use_ema': True, 'bear_use_atr': True, 'bear_use_adx': False, 'bear_use_spike': False, 'bear_rsi_required': True, 'sideways_strategy': 'breakout', 'sideways_bb_std_mult': 1.1759537051980435, 'sideways_rsi_os': 41, 'sideways_rsi_ob': 56, 'sideways_adx_thresh': 24.726280889662856, 'sideways_atr_min_pct': 0.015797731368924886, 'sideways_atr_max_pct': 0.028326624437046526, 'sideways_tp_mult': 2.157025992497221, 'sideways_tsl_mult': 0.45499837376278945, 'sideways_time_stop': 193, 'sideways_use_sma': False, 'sideways_use_ema': True, 'sideways_use_atr': False, 'sideways_use_adx': False, 'sideways_use_spike': True, 'sideways_rsi_required': True}.
[I 2025-08-31 05:15:53,103] Trial 613 finished with values: [-1000000000.0, 1000000000.0] and parameters: {'p_sma': 58, 'p_std': 14, 'p_atr': 18, 'p_adx': 9, 'rsi_period': 19, 'ema1': 26, 'ema2': 22, 'slip_atr_k': 0.02956701511451583, 'slip_spread_k': 0.5941525910125476, 'spread_hl_frac': 0.009176940581175182, 'bb_std_mult': 2.141693366993486, 'rsi_os': 23, 'rsi_ob': 59, 'vol_spike': 0.0007507471132242247, 'adx_thresh': 10.581252978789271, 'atr_min_pct': 0.024657904816951595, 'atr_max_pct': 0.09475545941907423, 'tp_mult': 2.330709752912453, 'tsl_mult': 0.8156575877278796, 'strategy': 'mean_reversion', 'time_stop': 28, 'use_sma': False, 'use_atr': True, 'use_adx': False, 'use_ema': False, 'use_spike': True, 'rsi_required': True, 'edge_k': 0.3222982874251028, 'edge_cap': 0.774401965438832, 'bull_strategy': 'mean_reversion', 'bull_bb_std_mult': 0.8748303471585415, 'bull_rsi_os': 54, 'bull_rsi_ob': 79, 'bull_adx_thresh': 7.772079933232193, 'bull_atr_min_pct': 0.009523755460515187, 'bull_atr_max_pct': 0.06059534804842276, 'bull_tp_mult': 1.7986447164792883, 'bull_tsl_mult': 0.9588563798479268, 'bull_time_stop': 297, 'bull_use_sma': False, 'bull_use_ema': False, 'bull_use_atr': True, 'bull_use_adx': True, 'bull_use_spike': False, 'bull_rsi_required': False, 'bear_strategy': 'breakout', 'bear_bb_std_mult': 0.7773035332520778, 'bear_rsi_os': 13, 'bear_rsi_ob': 72, 'bear_adx_thresh': 27.74735730612326, 'bear_atr_min_pct': 0.009266969890008744, 'bear_atr_max_pct': 0.04938132953887785, 'bear_tp_mult': 1.1040025996042329, 'bear_tsl_mult': 0.22114319412632844, 'bear_time_stop': 243, 'bear_use_sma': True, 'bear_use_ema': True, 'bear_use_atr': True, 'bear_use_adx': False, 'bear_use_spike': False, 'bear_rsi_required': True, 'sideways_strategy': 'breakout', 'sideways_bb_std_mult': 1.3849788164443764, 'sideways_rsi_os': 41, 'sideways_rsi_ob': 57, 'sideways_adx_thresh': 24.467327040742706, 'sideways_atr_min_pct': 0.0146014948992198, 'sideways_atr_max_pct': 0.029368848982076194, 'sideways_tp_mult': 2.1489507177309037, 'sideways_tsl_mult': 0.4505916667853901, 'sideways_time_stop': 191, 'sideways_use_sma': False, 'sideways_use_ema': True, 'sideways_use_atr': False, 'sideways_use_adx': False, 'sideways_use_spike': True, 'sideways_rsi_required': True}.
[I 2025-08-31 05:16:38,664] Trial 615 finished with values: [-1000000000.0, 1000000000.0] and parameters: {'p_sma': 59, 'p_std': 11, 'p_atr': 18, 'p_adx': 9, 'rsi_period': 19, 'ema1': 26, 'ema2': 25, 'slip_atr_k': 0.02678199456725148, 'slip_spread_k': 0.6921090803778205, 'spread_hl_frac': 0.009212568245596424, 'bb_std_mult': 1.9960512117172358, 'rsi_os': 19, 'rsi_ob': 57, 'vol_spike': 0.00015767391758997676, 'adx_thresh': 10.197479007409187, 'atr_min_pct': 0.023104770924140216, 'atr_max_pct': 0.11237532746984312, 'tp_mult': 2.344564875081618, 'tsl_mult': 0.7710232648943507, 'strategy': 'mean_reversion', 'time_stop': 30, 'use_sma': False, 'use_atr': True, 'use_adx': False, 'use_ema': False, 'use_spike': True, 'rsi_required': True, 'edge_k': 0.6428956378901761, 'edge_cap': 0.7644776524312925, 'bull_strategy': 'mean_reversion', 'bull_bb_std_mult': 0.8895459775400801, 'bull_rsi_os': 50, 'bull_rsi_ob': 82, 'bull_adx_thresh': 9.305712094543296, 'bull_atr_min_pct': 0.01670936409646079, 'bull_atr_max_pct': 0.059445699525977, 'bull_tp_mult': 1.7797264815342668, 'bull_tsl_mult': 0.9127785537440134, 'bull_time_stop': 295, 'bull_use_sma': False, 'bull_use_ema': False, 'bull_use_atr': True, 'bull_use_adx': True, 'bull_use_spike': False, 'bull_rsi_required': False, 'bear_strategy': 'breakout', 'bear_bb_std_mult': 0.6292901187636916, 'bear_rsi_os': 10, 'bear_rsi_ob': 83, 'bear_adx_thresh': 13.80921686411505, 'bear_atr_min_pct': 0.009311285559780292, 'bear_atr_max_pct': 0.04277751957847806, 'bear_tp_mult': 1.3831451631545737, 'bear_tsl_mult': 0.23028112709672902, 'bear_time_stop': 258, 'bear_use_sma': True, 'bear_use_ema': True, 'bear_use_atr': True, 'bear_use_adx': False, 'bear_use_spike': False, 'bear_rsi_required': True, 'sideways_strategy': 'breakout', 'sideways_bb_std_mult': 1.27139514076883, 'sideways_rsi_os': 41, 'sideways_rsi_ob': 55, 'sideways_adx_thresh': 27.01641533120751, 'sideways_atr_min_pct': 0.015412352813221012, 'sideways_atr_max_pct': 0.026207678124215636, 'sideways_tp_mult': 2.1725848416463256, 'sideways_tsl_mult': 0.5126632550667192, 'sideways_time_stop': 202, 'sideways_use_sma': False, 'sideways_use_ema': True, 'sideways_use_atr': False, 'sideways_use_adx': False, 'sideways_use_spike': True, 'sideways_rsi_required': True}.
[I 2025-08-31 05:16:40,975] Trial 614 finished with values: [-1000000000.0, 1000000000.0] and parameters: {'p_sma': 60, 'p_std': 15, 'p_atr': 18, 'p_adx': 9, 'rsi_period': 19, 'ema1': 26, 'ema2': 25, 'slip_atr_k': 0.02745098686634588, 'slip_spread_k': 0.5984772288441811, 'spread_hl_frac': 0.005968666687660053, 'bb_std_mult': 1.9929471440364386, 'rsi_os': 23, 'rsi_ob': 58, 'vol_spike': 0.014718672761176197, 'adx_thresh': 10.164569436041711, 'atr_min_pct': 0.023147375763847098, 'atr_max_pct': 0.09525939271527241, 'tp_mult': 2.3785200064120104, 'tsl_mult': 0.8206153207690706, 'strategy': 'mean_reversion', 'time_stop': 13, 'use_sma': False, 'use_atr': True, 'use_adx': False, 'use_ema': False, 'use_spike': True, 'rsi_required': True, 'edge_k': 0.41685439302761895, 'edge_cap': 0.7694071683673475, 'bull_strategy': 'mean_reversion', 'bull_bb_std_mult': 0.84628526291734, 'bull_rsi_os': 50, 'bull_rsi_ob': 79, 'bull_adx_thresh': 7.745728973109761, 'bull_atr_min_pct': 0.014698971353343417, 'bull_atr_max_pct': 0.06224299816355865, 'bull_tp_mult': 1.7960680253504773, 'bull_tsl_mult': 0.9477044344583653, 'bull_time_stop': 297, 'bull_use_sma': False, 'bull_use_ema': False, 'bull_use_atr': True, 'bull_use_adx': True, 'bull_use_spike': False, 'bull_rsi_required': False, 'bear_strategy': 'breakout', 'bear_bb_std_mult': 0.8266354005014387, 'bear_rsi_os': 10, 'bear_rsi_ob': 79, 'bear_adx_thresh': 10.04318945555719, 'bear_atr_min_pct': 0.009051565849032528, 'bear_atr_max_pct': 0.04969469503277982, 'bear_tp_mult': 1.1141353146915556, 'bear_tsl_mult': 0.1787319689247591, 'bear_time_stop': 242, 'bear_use_sma': True, 'bear_use_ema': True, 'bear_use_atr': True, 'bear_use_adx': False, 'bear_use_spike': False, 'bear_rsi_required': True, 'sideways_strategy': 'breakout', 'sideways_bb_std_mult': 1.2413332357448708, 'sideways_rsi_os': 37, 'sideways_rsi_ob': 57, 'sideways_adx_thresh': 24.2341766282995, 'sideways_atr_min_pct': 0.01574589390434501, 'sideways_atr_max_pct': 0.025385254230144216, 'sideways_tp_mult': 2.160148454175268, 'sideways_tsl_mult': 0.44148711646484057, 'sideways_time_stop': 199, 'sideways_use_sma': False, 'sideways_use_ema': True, 'sideways_use_atr': False, 'sideways_use_adx': False, 'sideways_use_spike': True, 'sideways_rsi_required': True}.
[I 2025-08-31 05:16:40,997] Trial 617 finished with values: [-1000000000.0, 1000000000.0] and parameters: {'p_sma': 60, 'p_std': 15, 'p_atr': 15, 'p_adx': 8, 'rsi_period': 18, 'ema1': 24, 'ema2': 25, 'slip_atr_k': 0.02606202751930969, 'slip_spread_k': 0.7585642570374942, 'spread_hl_frac': 0.006691929063794615, 'bb_std_mult': 2.046043154013046, 'rsi_os': 21, 'rsi_ob': 63, 'vol_spike': 0.01644923585520837, 'adx_thresh': 10.157228188668043, 'atr_min_pct': 0.0229038641269733, 'atr_max_pct': 0.111174927059832, 'tp_mult': 2.454087608286952, 'tsl_mult': 0.7835092113092514, 'strategy': 'mean_reversion', 'time_stop': 23, 'use_sma': False, 'use_atr': True, 'use_adx': False, 'use_ema': False, 'use_spike': True, 'rsi_required': True, 'edge_k': 0.6730127743607968, 'edge_cap': 0.7194057066197791, 'bull_strategy': 'mean_reversion', 'bull_bb_std_mult': 0.7865878618233063, 'bull_rsi_os': 50, 'bull_rsi_ob': 78, 'bull_adx_thresh': 9.325113411260887, 'bull_atr_min_pct': 0.011114936884901942, 'bull_atr_max_pct': 0.03492471221839683, 'bull_tp_mult': 1.6641422242851918, 'bull_tsl_mult': 0.913713461084341, 'bull_time_stop': 300, 'bull_use_sma': False, 'bull_use_ema': False, 'bull_use_atr': True, 'bull_use_adx': True, 'bull_use_spike': False, 'bull_rsi_required': False, 'bear_strategy': 'breakout', 'bear_bb_std_mult': 0.8421791638460773, 'bear_rsi_os': 14, 'bear_rsi_ob': 81, 'bear_adx_thresh': 9.804417362025278, 'bear_atr_min_pct': 0.009697727039582126, 'bear_atr_max_pct': 0.04320177374868811, 'bear_tp_mult': 1.278423745042224, 'bear_tsl_mult': 0.24020046516344462, 'bear_time_stop': 234, 'bear_use_sma': True, 'bear_use_ema': True, 'bear_use_atr': True, 'bear_use_adx': False, 'bear_use_spike': False, 'bear_rsi_required': True, 'sideways_strategy': 'breakout', 'sideways_bb_std_mult': 1.3398680345357414, 'sideways_rsi_os': 37, 'sideways_rsi_ob': 55, 'sideways_adx_thresh': 26.957186839540398, 'sideways_atr_min_pct': 0.014247139356899165, 'sideways_atr_max_pct': 0.025137154400998424, 'sideways_tp_mult': 2.182110549947306, 'sideways_tsl_mult': 0.5137718620458605, 'sideways_time_stop': 200, 'sideways_use_sma': False, 'sideways_use_ema': True, 'sideways_use_atr': False, 'sideways_use_adx': False, 'sideways_use_spike': True, 'sideways_rsi_required': True}.
[I 2025-08-31 05:16:41,001] Trial 616 finished with values: [-1000000000.0, 1000000000.0] and parameters: {'p_sma': 57, 'p_std': 14, 'p_atr': 18, 'p_adx': 9, 'rsi_period': 20, 'ema1': 24, 'ema2': 23, 'slip_atr_k': 0.02752715584319252, 'slip_spread_k': 0.7939737509238406, 'spread_hl_frac': 0.009276664932686333, 'bb_std_mult': 1.988900305715651, 'rsi_os': 35, 'rsi_ob': 56, 'vol_spike': 0.0025070919231099022, 'adx_thresh': 10.486263643782284, 'atr_min_pct': 0.02306157190573553, 'atr_max_pct': 0.11341874126741257, 'tp_mult': 2.3749516795041536, 'tsl_mult': 0.8201445237287333, 'strategy': 'mean_reversion', 'time_stop': 17, 'use_sma': False, 'use_atr': True, 'use_adx': False, 'use_ema': False, 'use_spike': True, 'rsi_required': True, 'edge_k': 0.6408692650462322, 'edge_cap': 0.7244170627548211, 'bull_strategy': 'mean_reversion', 'bull_bb_std_mult': 0.7986056170830395, 'bull_rsi_os': 53, 'bull_rsi_ob': 78, 'bull_adx_thresh': 9.20049812007827, 'bull_atr_min_pct': 0.015224352544246351, 'bull_atr_max_pct': 0.034715600407993784, 'bull_tp_mult': 1.6692686610108722, 'bull_tsl_mult': 0.9127012369871184, 'bull_time_stop': 294, 'bull_use_sma': False, 'bull_use_ema': False, 'bull_use_atr': True, 'bull_use_adx': True, 'bull_use_spike': False, 'bull_rsi_required': False, 'bear_strategy': 'breakout', 'bear_bb_std_mult': 0.6025687095656729, 'bear_rsi_os': 13, 'bear_rsi_ob': 79, 'bear_adx_thresh': 13.869838502886047, 'bear_atr_min_pct': 0.009539574478640891, 'bear_atr_max_pct': 0.042509649373292255, 'bear_tp_mult': 1.2655210346848595, 'bear_tsl_mult': 0.1931606635173121, 'bear_time_stop': 260, 'bear_use_sma': True, 'bear_use_ema': True, 'bear_use_atr': True, 'bear_use_adx': False, 'bear_use_spike': False, 'bear_rsi_required': True, 'sideways_strategy': 'breakout', 'sideways_bb_std_mult': 1.3820082277030035, 'sideways_rsi_os': 34, 'sideways_rsi_ob': 57, 'sideways_adx_thresh': 23.983607151691242, 'sideways_atr_min_pct': 0.015345255489669465, 'sideways_atr_max_pct': 0.02544450692047779, 'sideways_tp_mult': 2.175950710098195, 'sideways_tsl_mult': 0.5117780794923855, 'sideways_time_stop': 201, 'sideways_use_sma': False, 'sideways_use_ema': True, 'sideways_use_atr': False, 'sideways_use_adx': False, 'sideways_use_spike': True, 'sideways_rsi_required': True}.
[I 2025-08-31 05:17:32,172] Trial 620 finished with values: [-1000000000.0, 1000000000.0] and parameters: {'p_sma': 57, 'p_std': 13, 'p_atr': 14, 'p_adx': 8, 'rsi_period': 17, 'ema1': 24, 'ema2': 21, 'slip_atr_k': 0.03548199723843733, 'slip_spread_k': 0.7033004514010359, 'spread_hl_frac': 0.00727928449402387, 'bb_std_mult': 1.9805924604198273, 'rsi_os': 41, 'rsi_ob': 60, 'vol_spike': 0.01682226243889194, 'adx_thresh': 11.478831326826855, 'atr_min_pct': 0.02381196629375656, 'atr_max_pct': 0.13701987534217888, 'tp_mult': 2.450800224028595, 'tsl_mult': 0.8283511586557087, 'strategy': 'mean_reversion', 'time_stop': 21, 'use_sma': False, 'use_atr': True, 'use_adx': False, 'use_ema': False, 'use_spike': True, 'rsi_required': True, 'edge_k': 0.2534435966921674, 'edge_cap': 0.7347638845567727, 'bull_strategy': 'mean_reversion', 'bull_bb_std_mult': 0.9664286196936873, 'bull_rsi_os': 43, 'bull_rsi_ob': 78, 'bull_adx_thresh': 8.179812276378417, 'bull_atr_min_pct': 0.013479899469924587, 'bull_atr_max_pct': 0.01741105372531722, 'bull_tp_mult': 1.6553549698660723, 'bull_tsl_mult': 0.9350559470784319, 'bull_time_stop': 254, 'bull_use_sma': False, 'bull_use_ema': False, 'bull_use_atr': True, 'bull_use_adx': True, 'bull_use_spike': False, 'bull_rsi_required': False, 'bear_strategy': 'breakout', 'bear_bb_std_mult': 0.7125902262143314, 'bear_rsi_os': 10, 'bear_rsi_ob': 77, 'bear_adx_thresh': 17.180345472023888, 'bear_atr_min_pct': 0.006577197533261825, 'bear_atr_max_pct': 0.043891250690564605, 'bear_tp_mult': 1.0571382393812467, 'bear_tsl_mult': 0.24808031590683643, 'bear_time_stop': 276, 'bear_use_sma': True, 'bear_use_ema': True, 'bear_use_atr': True, 'bear_use_adx': False, 'bear_use_spike': False, 'bear_rsi_required': True, 'sideways_strategy': 'breakout', 'sideways_bb_std_mult': 1.3176498520539695, 'sideways_rsi_os': 40, 'sideways_rsi_ob': 55, 'sideways_adx_thresh': 28.381982021458278, 'sideways_atr_min_pct': 0.014377219142664172, 'sideways_atr_max_pct': 0.03556197639931253, 'sideways_tp_mult': 2.0757704397556007, 'sideways_tsl_mult': 0.4731185004745498, 'sideways_time_stop': 226, 'sideways_use_sma': False, 'sideways_use_ema': True, 'sideways_use_atr': False, 'sideways_use_adx': False, 'sideways_use_spike': True, 'sideways_rsi_required': True}.
[I 2025-08-31 05:17:33,636] Trial 621 finished with values: [-1000000000.0, 1000000000.0] and parameters: {'p_sma': 57, 'p_std': 12, 'p_atr': 14, 'p_adx': 8, 'rsi_period': 16, 'ema1': 22, 'ema2': 22, 'slip_atr_k': 0.02415220772919932, 'slip_spread_k': 0.747005343748065, 'spread_hl_frac': 0.0076280529061194605, 'bb_std_mult': 1.9779971199383348, 'rsi_os': 41, 'rsi_ob': 60, 'vol_spike': 0.009240970219325725, 'adx_thresh': 11.639391290035482, 'atr_min_pct': 0.02388107556942854, 'atr_max_pct': 0.1382470721699584, 'tp_mult': 2.4543461495552603, 'tsl_mult': 0.8260922015532925, 'strategy': 'mean_reversion', 'time_stop': 12, 'use_sma': False, 'use_atr': True, 'use_adx': False, 'use_ema': False, 'use_spike': True, 'rsi_required': True, 'edge_k': 0.3963882389694161, 'edge_cap': 0.7877708078121126, 'bull_strategy': 'mean_reversion', 'bull_bb_std_mult': 0.9512392782046902, 'bull_rsi_os': 43, 'bull_rsi_ob': 78, 'bull_adx_thresh': 8.287690196525464, 'bull_atr_min_pct': 0.013682087735473436, 'bull_atr_max_pct': 0.03305707640698971, 'bull_tp_mult': 1.6520274312895136, 'bull_tsl_mult': 0.9296222969114583, 'bull_time_stop': 250, 'bull_use_sma': False, 'bull_use_ema': False, 'bull_use_atr': True, 'bull_use_adx': True, 'bull_use_spike': False, 'bull_rsi_required': False, 'bear_strategy': 'breakout', 'bear_bb_std_mult': 0.7041239601813212, 'bear_rsi_os': 10, 'bear_rsi_ob': 77, 'bear_adx_thresh': 28.530281491220173, 'bear_atr_min_pct': 0.0067544573472361836, 'bear_atr_max_pct': 0.04059575775587896, 'bear_tp_mult': 1.2086504198874075, 'bear_tsl_mult': 0.24209477698657692, 'bear_time_stop': 226, 'bear_use_sma': True, 'bear_use_ema': True, 'bear_use_atr': True, 'bear_use_adx': False, 'bear_use_spike': False, 'bear_rsi_required': True, 'sideways_strategy': 'breakout', 'sideways_bb_std_mult': 1.155869859314227, 'sideways_rsi_os': 34, 'sideways_rsi_ob': 55, 'sideways_adx_thresh': 23.268529299985016, 'sideways_atr_min_pct': 0.014280623228282477, 'sideways_atr_max_pct': 0.048192765354296244, 'sideways_tp_mult': 2.085324682120556, 'sideways_tsl_mult': 0.4839638461999083, 'sideways_time_stop': 224, 'sideways_use_sma': False, 'sideways_use_ema': True, 'sideways_use_atr': False, 'sideways_use_adx': False, 'sideways_use_spike': True, 'sideways_rsi_required': True}.
[I 2025-08-31 05:17:33,677] Trial 619 finished with values: [-1000000000.0, 1000000000.0] and parameters: {'p_sma': 57, 'p_std': 13, 'p_atr': 17, 'p_adx': 7, 'rsi_period': 15, 'ema1': 24, 'ema2': 24, 'slip_atr_k': 0.025489718394380863, 'slip_spread_k': 0.7726186705462375, 'spread_hl_frac': 0.00903916061385559, 'bb_std_mult': 1.974282430186718, 'rsi_os': 42, 'rsi_ob': 60, 'vol_spike': 0.007802685586323634, 'adx_thresh': 11.571000082952633, 'atr_min_pct': 0.024003494498521148, 'atr_max_pct': 0.13614080497834422, 'tp_mult': 2.4564246136841, 'tsl_mult': 0.8159110567260558, 'strategy': 'mean_reversion', 'time_stop': 17, 'use_sma': False, 'use_atr': True, 'use_adx': False, 'use_ema': False, 'use_spike': True, 'rsi_required': True, 'edge_k': 0.28226071506490114, 'edge_cap': 0.7278469226978574, 'bull_strategy': 'mean_reversion', 'bull_bb_std_mult': 0.9487223777483135, 'bull_rsi_os': 53, 'bull_rsi_ob': 81, 'bull_adx_thresh': 8.35450391997022, 'bull_atr_min_pct': 0.012367060729320811, 'bull_atr_max_pct': 0.018965378226110857, 'bull_tp_mult': 1.660516362581503, 'bull_tsl_mult': 0.9355334463789607, 'bull_time_stop': 251, 'bull_use_sma': False, 'bull_use_ema': False, 'bull_use_atr': True, 'bull_use_adx': True, 'bull_use_spike': False, 'bull_rsi_required': False, 'bear_strategy': 'breakout', 'bear_bb_std_mult': 0.736761015280842, 'bear_rsi_os': 13, 'bear_rsi_ob': 77, 'bear_adx_thresh': 6.0506853589169936, 'bear_atr_min_pct': 0.010044852893894498, 'bear_atr_max_pct': 0.04138601439998152, 'bear_tp_mult': 1.211678415079491, 'bear_tsl_mult': 0.19024577045410251, 'bear_time_stop': 228, 'bear_use_sma': True, 'bear_use_ema': True, 'bear_use_atr': True, 'bear_use_adx': False, 'bear_use_spike': False, 'bear_rsi_required': True, 'sideways_strategy': 'breakout', 'sideways_bb_std_mult': 1.2940363520458609, 'sideways_rsi_os': 38, 'sideways_rsi_ob': 55, 'sideways_adx_thresh': 25.92674446958934, 'sideways_atr_min_pct': 0.015090440873609869, 'sideways_atr_max_pct': 0.016245963408178812, 'sideways_tp_mult': 2.0728627568333327, 'sideways_tsl_mult': 0.4823222804858818, 'sideways_time_stop': 226, 'sideways_use_sma': False, 'sideways_use_ema': True, 'sideways_use_atr': False, 'sideways_use_adx': False, 'sideways_use_spike': True, 'sideways_rsi_required': True}.
