[I 2025-08-31 05:21:24,109] Trial 641 finished with values: [-1000000000.0, 1000000000.0] and parameters: {'p_sma': 57, 'p_std': 16, 'p_atr': 15, 'p_adx': 26, 'rsi_period': 20, 'ema1': 23, 'ema2': 26, 'slip_atr_k': 0.05102135755822208, 'slip_spread_k': 0.6804707072700498, 'spread_hl_frac': 0.009782470451390137, 'bb_std_mult': 1.9425704392789873, 'rsi_os': 34, 'rsi_ob': 59, 'vol_spike': 0.020658366705004795, 'adx_thresh': 9.831061086897401, 'atr_min_pct': 0.0234385075567593, 'atr_max_pct': 0.10827740668434221, 'tp_mult': 2.4206622974409195, 'tsl_mult': 0.8344222898898892, 'strategy': 'mean_reversion', 'time_stop': 33, 'use_sma': True, 'use_atr': True, 'use_adx': False, 'use_ema': False, 'use_spike': True, 'rsi_required': True, 'edge_k': 0.2805642944891794, 'edge_cap': 0.7568014614206782, 'bull_strategy': 'mean_reversion', 'bull_bb_std_mult': 0.8520504379271424, 'bull_rsi_os': 49, 'bull_rsi_ob': 77, 'bull_adx_thresh': 9.056891146881972, 'bull_atr_min_pct': 0.012679900461753883, 'bull_atr_max_pct': 0.03627301137960041, 'bull_tp_mult': 1.6250772654810068, 'bull_tsl_mult': 0.9491561106794263, 'bull_time_stop': 283, 'bull_use_sma': False, 'bull_use_ema': False, 'bull_use_atr': False, 'bull_use_adx': True, 'bull_use_spike': False, 'bull_rsi_required': False, 'bear_strategy': 'breakout', 'bear_bb_std_mult': 0.8398755923621912, 'bear_rsi_os': 13, 'bear_rsi_ob': 76, 'bear_adx_thresh': 28.741669387176852, 'bear_atr_min_pct': 0.007618651160810741, 'bear_atr_max_pct': 0.05127488088185079, 'bear_tp_mult': 1.481100921230847, 'bear_tsl_mult': 0.20944026682327185, 'bear_time_stop': 240, 'bear_use_sma': True, 'bear_use_ema': True, 'bear_use_atr': False, 'bear_use_adx': False, 'bear_use_spike': False, 'bear_rsi_required': True, 'sideways_strategy': 'breakout', 'sideways_bb_std_mult': 1.1908458591738889, 'sideways_rsi_os': 38, 'sideways_rsi_ob': 54, 'sideways_adx_thresh': 24.309557772111013, 'sideways_atr_min_pct': 0.014404054904257538, 'sideways_atr_max_pct': 0.03719630844086877, 'sideways_tp_mult': 2.207133695366851, 'sideways_tsl_mult': 0.5076888983063528, 'sideways_time_stop': 195, 'sideways_use_sma': True, 'sideways_use_ema': True, 'sideways_use_atr': False, 'sideways_use_adx': False, 'sideways_use_spike': True, 'sideways_rsi_required': True}.
[I 2025-08-31 05:21:24,861] Trial 640 finished with values: [-1000000000.0, 1000000000.0] and parameters: {'p_sma': 57, 'p_std': 16, 'p_atr': 15, 'p_adx': 11, 'rsi_period': 20, 'ema1': 23, 'ema2': 26, 'slip_atr_k': 0.04423833914231946, 'slip_spread_k': 0.6778461588642759, 'spread_hl_frac': 0.010380821977700117, 'bb_std_mult': 1.9656153209776142, 'rsi_os': 35, 'rsi_ob': 59, 'vol_spike': 0.02176217548884852, 'adx_thresh': 11.530267370973517, 'atr_min_pct': 0.023391268614123748, 'atr_max_pct': 0.11406854093832035, 'tp_mult': 2.425245954945254, 'tsl_mult': 0.8357287730178637, 'strategy': 'mean_reversion', 'time_stop': 34, 'use_sma': True, 'use_atr': True, 'use_adx': False, 'use_ema': False, 'use_spike': True, 'rsi_required': True, 'edge_k': 0.1400495450104714, 'edge_cap': 0.7791696603113634, 'bull_strategy': 'mean_reversion', 'bull_bb_std_mult': 0.876527976297968, 'bull_rsi_os': 49, 'bull_rsi_ob': 77, 'bull_adx_thresh': 9.090563832283031, 'bull_atr_min_pct': 0.01835739718905772, 'bull_atr_max_pct': 0.0119164792674206, 'bull_tp_mult': 1.6186888764414786, 'bull_tsl_mult': 0.3897237615602385, 'bull_time_stop': 244, 'bull_use_sma': False, 'bull_use_ema': False, 'bull_use_atr': False, 'bull_use_adx': True, 'bull_use_spike': False, 'bull_rsi_required': False, 'bear_strategy': 'breakout', 'bear_bb_std_mult': 0.7159149915912764, 'bear_rsi_os': 14, 'bear_rsi_ob': 86, 'bear_adx_thresh': 9.259357022797202, 'bear_atr_min_pct': 0.007534409377879072, 'bear_atr_max_pct': 0.05071778299968521, 'bear_tp_mult': 1.4978451093533338, 'bear_tsl_mult': 0.6669623732925646, 'bear_time_stop': 239, 'bear_use_sma': True, 'bear_use_ema': True, 'bear_use_atr': False, 'bear_use_adx': False, 'bear_use_spike': False, 'bear_rsi_required': True, 'sideways_strategy': 'breakout', 'sideways_bb_std_mult': 1.3370164472819637, 'sideways_rsi_os': 33, 'sideways_rsi_ob': 54, 'sideways_adx_thresh': 24.063354631545785, 'sideways_atr_min_pct': 0.016841220323206667, 'sideways_atr_max_pct': 0.020460156680489935, 'sideways_tp_mult': 2.1222731590411956, 'sideways_tsl_mult': 0.4650766191936792, 'sideways_time_stop': 196, 'sideways_use_sma': True, 'sideways_use_ema': True, 'sideways_use_atr': False, 'sideways_use_adx': False, 'sideways_use_spike': True, 'sideways_rsi_required': True}.
[I 2025-08-31 05:21:25,350] Trial 639 finished with values: [-1000000000.0, 1000000000.0] and parameters: {'p_sma': 57, 'p_std': 16, 'p_atr': 15, 'p_adx': 10, 'rsi_period': 20, 'ema1': 23, 'ema2': 26, 'slip_atr_k': 0.045248957750308724, 'slip_spread_k': 0.6777337266900202, 'spread_hl_frac': 0.010294814722296574, 'bb_std_mult': 1.9436473009233142, 'rsi_os': 49, 'rsi_ob': 71, 'vol_spike': 0.0067124621434660435, 'adx_thresh': 11.727320049987767, 'atr_min_pct': 0.02334710550334754, 'atr_max_pct': 0.10397147261762112, 'tp_mult': 2.4380128131375765, 'tsl_mult': 0.8335550003294869, 'strategy': 'mean_reversion', 'time_stop': 5, 'use_sma': True, 'use_atr': True, 'use_adx': False, 'use_ema': False, 'use_spike': True, 'rsi_required': True, 'edge_k': 0.7427481023099214, 'edge_cap': 0.7800958298472835, 'bull_strategy': 'mean_reversion', 'bull_bb_std_mult': 0.8407059591446495, 'bull_rsi_os': 47, 'bull_rsi_ob': 77, 'bull_adx_thresh': 8.964894701477716, 'bull_atr_min_pct': 0.016183107472496606, 'bull_atr_max_pct': 0.03667643320875944, 'bull_tp_mult': 2.033399861918305, 'bull_tsl_mult': 0.9501991178210804, 'bull_time_stop': 242, 'bull_use_sma': False, 'bull_use_ema': False, 'bull_use_atr': False, 'bull_use_adx': True, 'bull_use_spike': False, 'bull_rsi_required': False, 'bear_strategy': 'breakout', 'bear_bb_std_mult': 0.887368060547209, 'bear_rsi_os': 9, 'bear_rsi_ob': 86, 'bear_adx_thresh': 27.324052292703698, 'bear_atr_min_pct': 0.007581000811016216, 'bear_atr_max_pct': 0.05419758545517028, 'bear_tp_mult': 1.488074674097362, 'bear_tsl_mult': 0.16830712513523888, 'bear_time_stop': 237, 'bear_use_sma': True, 'bear_use_ema': True, 'bear_use_atr': False, 'bear_use_adx': False, 'bear_use_spike': False, 'bear_rsi_required': True, 'sideways_strategy': 'breakout', 'sideways_bb_std_mult': 1.0973119345535312, 'sideways_rsi_os': 38, 'sideways_rsi_ob': 80, 'sideways_adx_thresh': 22.17840112168727, 'sideways_atr_min_pct': 0.014600616714562212, 'sideways_atr_max_pct': 0.020134532847714257, 'sideways_tp_mult': 2.1806973667409473, 'sideways_tsl_mult': 0.47358905896486686, 'sideways_time_stop': 214, 'sideways_use_sma': True, 'sideways_use_ema': True, 'sideways_use_atr': False, 'sideways_use_adx': False, 'sideways_use_spike': True, 'sideways_rsi_required': True}.
[I 2025-08-31 05:22:10,074] Trial 642 finished with values: [-1000000000.0, 1000000000.0] and parameters: {'p_sma': 58, 'p_std': 16, 'p_atr': 18, 'p_adx': 11, 'rsi_period': 20, 'ema1': 25, 'ema2': 26, 'slip_atr_k': 0.032597372169443695, 'slip_spread_k': 0.8275247397985445, 'spread_hl_frac': 0.01007270260738596, 'bb_std_mult': 1.9946736516016987, 'rsi_os': 34, 'rsi_ob': 80, 'vol_spike': 0.021774831922151267, 'adx_thresh': 9.96731435863845, 'atr_min_pct': 0.023272586372662243, 'atr_max_pct': 0.1338488824024856, 'tp_mult': 2.455586349154037, 'tsl_mult': 0.8360586390359726, 'strategy': 'mean_reversion', 'time_stop': 34, 'use_sma': False, 'use_atr': True, 'use_adx': False, 'use_ema': True, 'use_spike': False, 'rsi_required': True, 'edge_k': 0.6817842788115842, 'edge_cap': 0.726992139016845, 'bull_strategy': 'mean_reversion', 'bull_bb_std_mult': 0.8382353133233829, 'bull_rsi_os': 54, 'bull_rsi_ob': 80, 'bull_adx_thresh': 9.006153990357525, 'bull_atr_min_pct': 0.015919661789016586, 'bull_atr_max_pct': 0.036465973388343884, 'bull_tp_mult': 1.620668722430215, 'bull_tsl_mult': 0.9542385276863081, 'bull_time_stop': 284, 'bull_use_sma': False, 'bull_use_ema': False, 'bull_use_atr': True, 'bull_use_adx': True, 'bull_use_spike': True, 'bull_rsi_required': False, 'bear_strategy': 'breakout', 'bear_bb_std_mult': 0.8278577589187599, 'bear_rsi_os': 9, 'bear_rsi_ob': 76, 'bear_adx_thresh': 29.52686030119161, 'bear_atr_min_pct': 0.006968483208464834, 'bear_atr_max_pct': 0.05129723512866122, 'bear_tp_mult': 1.2450782699318301, 'bear_tsl_mult': 0.2830956975908041, 'bear_time_stop': 246, 'bear_use_sma': True, 'bear_use_ema': True, 'bear_use_atr': False, 'bear_use_adx': False, 'bear_use_spike': False, 'bear_rsi_required': True, 'sideways_strategy': 'breakout', 'sideways_bb_std_mult': 1.3444695323656117, 'sideways_rsi_os': 45, 'sideways_rsi_ob': 54, 'sideways_adx_thresh': 23.677218109063705, 'sideways_atr_min_pct': 0.016885029592728418, 'sideways_atr_max_pct': 0.03083105790542582, 'sideways_tp_mult': 2.1726624079718264, 'sideways_tsl_mult': 0.4894583788132229, 'sideways_time_stop': 195, 'sideways_use_sma': True, 'sideways_use_ema': True, 'sideways_use_atr': False, 'sideways_use_adx': False, 'sideways_use_spike': True, 'sideways_rsi_required': True}.
[I 2025-08-31 05:22:10,675] Trial 643 finished with values: [-1000000000.0, 1000000000.0] and parameters: {'p_sma': 56, 'p_std': 16, 'p_atr': 15, 'p_adx': 9, 'rsi_period': 21, 'ema1': 25, 'ema2': 26, 'slip_atr_k': 0.0326178693790468, 'slip_spread_k': 0.8409982908718219, 'spread_hl_frac': 0.007004867167189288, 'bb_std_mult': 2.013432647403021, 'rsi_os': 20, 'rsi_ob': 59, 'vol_spike': 0.022172903310369994, 'adx_thresh': 12.155382018812597, 'atr_min_pct': 0.023372075804565445, 'atr_max_pct': 0.11467155799926132, 'tp_mult': 2.423188334541318, 'tsl_mult': 0.8040465714171576, 'strategy': 'mean_reversion', 'time_stop': 35, 'use_sma': False, 'use_atr': True, 'use_adx': False, 'use_ema': True, 'use_spike': False, 'rsi_required': True, 'edge_k': 0.5307576177146682, 'edge_cap': 0.7117151160601558, 'bull_strategy': 'mean_reversion', 'bull_bb_std_mult': 0.8970792229088445, 'bull_rsi_os': 47, 'bull_rsi_ob': 80, 'bull_adx_thresh': 9.075167108662864, 'bull_atr_min_pct': 0.02055221646367788, 'bull_atr_max_pct': 0.01655415153130315, 'bull_tp_mult': 2.325857696959391, 'bull_tsl_mult': 0.917253445559459, 'bull_time_stop': 216, 'bull_use_sma': False, 'bull_use_ema': False, 'bull_use_atr': True, 'bull_use_adx': True, 'bull_use_spike': True, 'bull_rsi_required': False, 'bear_strategy': 'breakout', 'bear_bb_std_mult': 0.8102291999509862, 'bear_rsi_os': 9, 'bear_rsi_ob': 75, 'bear_adx_thresh': 16.754831157868466, 'bear_atr_min_pct': 0.009812411413670659, 'bear_atr_max_pct': 0.048880066082851545, 'bear_tp_mult': 1.300459440814731, 'bear_tsl_mult': 0.27478972624603426, 'bear_time_stop': 243, 'bear_use_sma': True, 'bear_use_ema': True, 'bear_use_atr': True, 'bear_use_adx': False, 'bear_use_spike': False, 'bear_rsi_required': True, 'sideways_strategy': 'breakout', 'sideways_bb_std_mult': 1.09268784140734, 'sideways_rsi_os': 44, 'sideways_rsi_ob': 54, 'sideways_adx_thresh': 23.87729901603706, 'sideways_atr_min_pct': 0.013546256215478123, 'sideways_atr_max_pct': 0.0485497581208482, 'sideways_tp_mult': 2.1451669864274474, 'sideways_tsl_mult': 0.49090360345867784, 'sideways_time_stop': 218, 'sideways_use_sma': True, 'sideways_use_ema': True, 'sideways_use_atr': False, 'sideways_use_adx': False, 'sideways_use_spike': True, 'sideways_rsi_required': True}.
[I 2025-08-31 05:22:11,627] Trial 645 finished with values: [-1000000000.0, 1000000000.0] and parameters: {'p_sma': 56, 'p_std': 42, 'p_atr': 13, 'p_adx': 9, 'rsi_period': 21, 'ema1': 25, 'ema2': 25, 'slip_atr_k': 0.032992503962991124, 'slip_spread_k': 0.5803712367452883, 'spread_hl_frac': 0.006453784731597523, 'bb_std_mult': 2.0377813804715306, 'rsi_os': 24, 'rsi_ob': 60, 'vol_spike': 0.021319183555924052, 'adx_thresh': 12.204222628606505, 'atr_min_pct': 0.010853108035998427, 'atr_max_pct': 0.13507896717712367, 'tp_mult': 2.486736205324342, 'tsl_mult': 0.804147952601429, 'strategy': 'mean_reversion', 'time_stop': 15, 'use_sma': False, 'use_atr': True, 'use_adx': False, 'use_ema': True, 'use_spike': False, 'rsi_required': True, 'edge_k': 0.3304648447282081, 'edge_cap': 0.7101048867035077, 'bull_strategy': 'breakout', 'bull_bb_std_mult': 1.0475783167293486, 'bull_rsi_os': 54, 'bull_rsi_ob': 80, 'bull_adx_thresh': 7.277411239977804, 'bull_atr_min_pct': 0.009133443062420268, 'bull_atr_max_pct': 0.0789900545800296, 'bull_tp_mult': 2.334392144043953, 'bull_tsl_mult': 0.9229681877756226, 'bull_time_stop': 259, 'bull_use_sma': False, 'bull_use_ema': False, 'bull_use_atr': True, 'bull_use_adx': True, 'bull_use_spike': True, 'bull_rsi_required': False, 'bear_strategy': 'breakout', 'bear_bb_std_mult': 0.7708501237893564, 'bear_rsi_os': 11, 'bear_rsi_ob': 74, 'bear_adx_thresh': 16.26648549975596, 'bear_atr_min_pct': 0.009858746372378853, 'bear_atr_max_pct': 0.04434071932241884, 'bear_tp_mult': 1.2387449924079652, 'bear_tsl_mult': 0.2278111608344639, 'bear_time_stop': 248, 'bear_use_sma': True, 'bear_use_ema': True, 'bear_use_atr': True, 'bear_use_adx': False, 'bear_use_spike': False, 'bear_rsi_required': False, 'sideways_strategy': 'breakout', 'sideways_bb_std_mult': 1.1951987181941495, 'sideways_rsi_os': 45, 'sideways_rsi_ob': 56, 'sideways_adx_thresh': 25.333872271144934, 'sideways_atr_min_pct': 0.01354630343698479, 'sideways_atr_max_pct': 0.03094362015679518, 'sideways_tp_mult': 2.156309907314413, 'sideways_tsl_mult': 0.49012900569928536, 'sideways_time_stop': 218, 'sideways_use_sma': False, 'sideways_use_ema': True, 'sideways_use_atr': False, 'sideways_use_adx': False, 'sideways_use_spike': True, 'sideways_rsi_required': True}.
[I 2025-08-31 05:22:12,009] Trial 644 finished with values: [-1000000000.0, 1000000000.0] and parameters: {'p_sma': 59, 'p_std': 15, 'p_atr': 13, 'p_adx': 9, 'rsi_period': 21, 'ema1': 24, 'ema2': 25, 'slip_atr_k': 0.03202022309214047, 'slip_spread_k': 0.8583360919782064, 'spread_hl_frac': 0.040915925479521595, 'bb_std_mult': 2.031470803970257, 'rsi_os': 38, 'rsi_ob': 60, 'vol_spike': 0.024636516259240755, 'adx_thresh': 12.184999489675858, 'atr_min_pct': 0.02262490445165137, 'atr_max_pct': 0.1337947882181984, 'tp_mult': 2.4884636292987574, 'tsl_mult': 0.8071666686841982, 'strategy': 'mean_reversion', 'time_stop': 35, 'use_sma': False, 'use_atr': True, 'use_adx': False, 'use_ema': True, 'use_spike': False, 'rsi_required': True, 'edge_k': 0.42334632479171014, 'edge_cap': 0.711389559658037, 'bull_strategy': 'breakout', 'bull_bb_std_mult': 0.9007393155136848, 'bull_rsi_os': 42, 'bull_rsi_ob': 81, 'bull_adx_thresh': 9.366286953326295, 'bull_atr_min_pct': 0.01986284699870752, 'bull_atr_max_pct': 0.06942450535502705, 'bull_tp_mult': 2.790592596671881, 'bull_tsl_mult': 0.614643715027589, 'bull_time_stop': 259, 'bull_use_sma': False, 'bull_use_ema': False, 'bull_use_atr': True, 'bull_use_adx': True, 'bull_use_spike': True, 'bull_rsi_required': False, 'bear_strategy': 'breakout', 'bear_bb_std_mult': 0.7624100094556963, 'bear_rsi_os': 11, 'bear_rsi_ob': 74, 'bear_adx_thresh': 16.416820447838777, 'bear_atr_min_pct': 0.010163451929880047, 'bear_atr_max_pct': 0.07039128052184916, 'bear_tp_mult': 1.2316702961759518, 'bear_tsl_mult': 0.23623374703090913, 'bear_time_stop': 257, 'bear_use_sma': True, 'bear_use_ema': True, 'bear_use_atr': True, 'bear_use_adx': False, 'bear_use_spike': False, 'bear_rsi_required': False, 'sideways_strategy': 'breakout', 'sideways_bb_std_mult': 1.1773704196334855, 'sideways_rsi_os': 36, 'sideways_rsi_ob': 56, 'sideways_adx_thresh': 25.275561685250345, 'sideways_atr_min_pct': 0.01348407700146138, 'sideways_atr_max_pct': 0.04700162240582185, 'sideways_tp_mult': 2.1528455983654786, 'sideways_tsl_mult': 0.4983894405719287, 'sideways_time_stop': 231, 'sideways_use_sma': False, 'sideways_use_ema': True, 'sideways_use_atr': False, 'sideways_use_adx': False, 'sideways_use_spike': True, 'sideways_rsi_required': True}.
[I 2025-08-31 05:22:53,584] Trial 649 finished with values: [-1000000000.0, 1000000000.0] and parameters: {'p_sma': 58, 'p_std': 12, 'p_atr': 16, 'p_adx': 22, 'rsi_period': 17, 'ema1': 24, 'ema2': 23, 'slip_atr_k': 0.025711630174179483, 'slip_spread_k': 0.5083434250949511, 'spread_hl_frac': 0.043825349711938605, 'bb_std_mult': 1.917705153715876, 'rsi_os': 39, 'rsi_ob': 73, 'vol_spike': 0.013324651019036512, 'adx_thresh': 11.019268425716195, 'atr_min_pct': 0.002830327821971724, 'atr_max_pct': 0.1120363433738784, 'tp_mult': 2.3844930947016785, 'tsl_mult': 0.7923087073233634, 'strategy': 'mean_reversion', 'time_stop': 27, 'use_sma': False, 'use_atr': True, 'use_adx': True, 'use_ema': False, 'use_spike': True, 'rsi_required': True, 'edge_k': 0.5686601408424863, 'edge_cap': 0.748185956154541, 'bull_strategy': 'mean_reversion', 'bull_bb_std_mult': 0.9936808090780285, 'bull_rsi_os': 44, 'bull_rsi_ob': 78, 'bull_adx_thresh': 9.891852765194859, 'bull_atr_min_pct': 0.024638158924998377, 'bull_atr_max_pct': 0.06288154272595843, 'bull_tp_mult': 1.6630198268561902, 'bull_tsl_mult': 0.004641006978318485, 'bull_time_stop': 234, 'bull_use_sma': True, 'bull_use_ema': False, 'bull_use_atr': True, 'bull_use_adx': False, 'bull_use_spike': False, 'bull_rsi_required': False, 'bear_strategy': 'breakout', 'bear_bb_std_mult': 0.8942194222319731, 'bear_rsi_os': 9, 'bear_rsi_ob': 84, 'bear_adx_thresh': 10.517882489247178, 'bear_atr_min_pct': 0.008431483722370167, 'bear_atr_max_pct': 0.06017245048070213, 'bear_tp_mult': 1.329099088981076, 'bear_tsl_mult': 0.2051012102443141, 'bear_time_stop': 228, 'bear_use_sma': False, 'bear_use_ema': True, 'bear_use_atr': True, 'bear_use_adx': False, 'bear_use_spike': False, 'bear_rsi_required': True, 'sideways_strategy': 'breakout', 'sideways_bb_std_mult': 1.2759618358508027, 'sideways_rsi_os': 40, 'sideways_rsi_ob': 55, 'sideways_adx_thresh': 29.236376300311278, 'sideways_atr_min_pct': 0.015214107480217846, 'sideways_atr_max_pct': 0.017656700232129518, 'sideways_tp_mult': 2.049182201052678, 'sideways_tsl_mult': 0.5211783484217895, 'sideways_time_stop': 201, 'sideways_use_sma': False, 'sideways_use_ema': True, 'sideways_use_atr': True, 'sideways_use_adx': False, 'sideways_use_spike': False, 'sideways_rsi_required': False}.
[I 2025-08-31 05:22:54,604] Trial 647 finished with values: [-1000000000.0, 1000000000.0] and parameters: {'p_sma': 56, 'p_std': 51, 'p_atr': 16, 'p_adx': 22, 'rsi_period': 17, 'ema1': 24, 'ema2': 23, 'slip_atr_k': 0.025820239917847924, 'slip_spread_k': 0.8589496803212923, 'spread_hl_frac': 0.008689998285724108, 'bb_std_mult': 3.5086529585662545, 'rsi_os': 39, 'rsi_ob': 61, 'vol_spike': 0.013618897721873247, 'adx_thresh': 11.06017379831881, 'atr_min_pct': 0.0227851140032947, 'atr_max_pct': 0.13991621631358558, 'tp_mult': 2.488836856849164, 'tsl_mult': 0.8057464298126513, 'strategy': 'mean_reversion', 'time_stop': 15, 'use_sma': False, 'use_atr': True, 'use_adx': True, 'use_ema': False, 'use_spike': True, 'rsi_required': True, 'edge_k': 0.3503267246242186, 'edge_cap': 0.7343329038643214, 'bull_strategy': 'breakout', 'bull_bb_std_mult': 1.0345151596234476, 'bull_rsi_os': 45, 'bull_rsi_ob': 82, 'bull_adx_thresh': 9.930458985282147, 'bull_atr_min_pct': 0.020113017035413787, 'bull_atr_max_pct': 0.02871150551958427, 'bull_tp_mult': 1.6662573679954586, 'bull_tsl_mult': 0.6127353811028531, 'bull_time_stop': 264, 'bull_use_sma': True, 'bull_use_ema': False, 'bull_use_atr': True, 'bull_use_adx': False, 'bull_use_spike': False, 'bull_rsi_required': False, 'bear_strategy': 'breakout', 'bear_bb_std_mult': 0.7585398653073145, 'bear_rsi_os': 37, 'bear_rsi_ob': 70, 'bear_adx_thresh': 14.98326807471335, 'bear_atr_min_pct': 0.00821079266877493, 'bear_atr_max_pct': 0.04470521101190826, 'bear_tp_mult': 1.2201548256037413, 'bear_tsl_mult': 0.23075160466491904, 'bear_time_stop': 259, 'bear_use_sma': False, 'bear_use_ema': True, 'bear_use_atr': True, 'bear_use_adx': False, 'bear_use_spike': False, 'bear_rsi_required': False, 'sideways_strategy': 'breakout', 'sideways_bb_std_mult': 1.1873909827607902, 'sideways_rsi_os': 41, 'sideways_rsi_ob': 56, 'sideways_adx_thresh': 25.260946863255462, 'sideways_atr_min_pct': 0.015314648827396868, 'sideways_atr_max_pct': 0.07046815669522094, 'sideways_tp_mult': 2.0500398213498925, 'sideways_tsl_mult': 0.5354913926380113, 'sideways_time_stop': 229, 'sideways_use_sma': False, 'sideways_use_ema': True, 'sideways_use_atr': True, 'sideways_use_adx': False, 'sideways_use_spike': False, 'sideways_rsi_required': False}.
