[I 2025-08-31 03:52:04,969] Trial 154 finished with values: [-1000000000.0, 1000000000.0] and parameters: {'p_sma': 58, 'p_std': 14, 'p_atr': 21, 'p_adx': 11, 'rsi_period': 32, 'ema1': 15, 'ema2': 41, 'slip_atr_k': 0.19355961446028866, 'slip_spread_k': 0.4849705070722106, 'spread_hl_frac': 0.021818097445695284, 'bb_std_mult': 0.8028119210591983, 'rsi_os': 41, 'rsi_ob': 61, 'vol_spike': 0.02759841739809677, 'adx_thresh': 12.86544217727472, 'atr_min_pct': 0.023400214116006856, 'atr_max_pct': 0.14268341502330692, 'tp_mult': 1.3715642461592488, 'tsl_mult': 0.30823926804704893, 'strategy': 'breakout', 'time_stop': 128, 'use_sma': True, 'use_atr': False, 'use_adx': False, 'use_ema': True, 'use_spike': False, 'rsi_required': False, 'edge_k': 1.5701301457103285, 'edge_cap': 0.7920269020196888, 'bull_strategy': 'breakout', 'bull_bb_std_mult': 0.6876193157627342, 'bull_rsi_os': 15, 'bull_rsi_ob': 89, 'bull_adx_thresh': 23.512878288574765, 'bull_atr_min_pct': 0.02271001027985562, 'bull_atr_max_pct': 0.11527693573736447, 'bull_tp_mult': 1.8196880683958272, 'bull_tsl_mult': 0.5961868318691886, 'bull_time_stop': 184, 'bull_use_sma': False, 'bull_use_ema': False, 'bull_use_atr': False, 'bull_use_adx': True, 'bull_use_spike': True, 'bull_rsi_required': False, 'bear_strategy': 'mean_reversion', 'bear_bb_std_mult': 3.185082503038429, 'bear_rsi_os': 33, 'bear_rsi_ob': 61, 'bear_adx_thresh': 19.639766523608497, 'bear_atr_min_pct': 0.011209071456003708, 'bear_atr_max_pct': 0.13023908904420345, 'bear_tp_mult': 2.558822890648526, 'bear_tsl_mult': 0.7626271287558374, 'bear_time_stop': 159, 'bear_use_sma': True, 'bear_use_ema': True, 'bear_use_atr': True, 'bear_use_adx': False, 'bear_use_spike': True, 'bear_rsi_required': True, 'sideways_strategy': 'mean_reversion', 'sideways_bb_std_mult': 2.426742527490215, 'sideways_rsi_os': 49, 'sideways_rsi_ob': 83, 'sideways_adx_thresh': 25.59989977030736, 'sideways_atr_min_pct': 0.00978854320600993, 'sideways_atr_max_pct': 0.022080797736123724, 'sideways_tp_mult': 2.741017283089248, 'sideways_tsl_mult': 0.19886396098206338, 'sideways_time_stop': 188, 'sideways_use_sma': True, 'sideways_use_ema': False, 'sideways_use_atr': False, 'sideways_use_adx': False, 'sideways_use_spike': True, 'sideways_rsi_required': True}.
[I 2025-08-31 03:52:05,170] Trial 156 finished with values: [-1000000000.0, 1000000000.0] and parameters: {'p_sma': 57, 'p_std': 14, 'p_atr': 25, 'p_adx': 18, 'rsi_period': 33, 'ema1': 15, 'ema2': 41, 'slip_atr_k': 0.18461167829066014, 'slip_spread_k': 0.49131884931091213, 'spread_hl_frac': 0.022943960101099947, 'bb_std_mult': 0.6005324014201106, 'rsi_os': 11, 'rsi_ob': 61, 'vol_spike': 0.03731891930940229, 'adx_thresh': 26.384620482008437, 'atr_min_pct': 0.02501248697555866, 'atr_max_pct': 0.13985923843421744, 'tp_mult': 2.3400886590637393, 'tsl_mult': 0.3971489143102642, 'strategy': 'breakout', 'time_stop': 126, 'use_sma': False, 'use_atr': False, 'use_adx': False, 'use_ema': True, 'use_spike': False, 'rsi_required': False, 'edge_k': 1.5853588800878624, 'edge_cap': 0.7662839705720345, 'bull_strategy': 'breakout', 'bull_bb_std_mult': 0.752833132099739, 'bull_rsi_os': 17, 'bull_rsi_ob': 89, 'bull_adx_thresh': 24.043064923771727, 'bull_atr_min_pct': 0.02246925859396839, 'bull_atr_max_pct': 0.11690052379646564, 'bull_tp_mult': 1.8132410707662077, 'bull_tsl_mult': 0.5810232806146641, 'bull_time_stop': 181, 'bull_use_sma': False, 'bull_use_ema': False, 'bull_use_atr': True, 'bull_use_adx': True, 'bull_use_spike': True, 'bull_rsi_required': False, 'bear_strategy': 'mean_reversion', 'bear_bb_std_mult': 3.059373701254587, 'bear_rsi_os': 31, 'bear_rsi_ob': 61, 'bear_adx_thresh': 21.448860201620036, 'bear_atr_min_pct': 0.011578262053556948, 'bear_atr_max_pct': 0.12306265296444797, 'bear_tp_mult': 2.554558967987175, 'bear_tsl_mult': 0.1911203652886816, 'bear_time_stop': 155, 'bear_use_sma': True, 'bear_use_ema': True, 'bear_use_atr': True, 'bear_use_adx': False, 'bear_use_spike': True, 'bear_rsi_required': True, 'sideways_strategy': 'mean_reversion', 'sideways_bb_std_mult': 2.1843269296022507, 'sideways_rsi_os': 9, 'sideways_rsi_ob': 83, 'sideways_adx_thresh': 25.59545188181182, 'sideways_atr_min_pct': 0.010049284924595702, 'sideways_atr_max_pct': 0.022241786030877897, 'sideways_tp_mult': 2.868563635398943, 'sideways_tsl_mult': 0.19153391060677083, 'sideways_time_stop': 189, 'sideways_use_sma': True, 'sideways_use_ema': False, 'sideways_use_atr': False, 'sideways_use_adx': False, 'sideways_use_spike': True, 'sideways_rsi_required': True}.
[I 2025-08-31 03:52:05,664] Trial 155 finished with values: [-1000000000.0, 1000000000.0] and parameters: {'p_sma': 58, 'p_std': 10, 'p_atr': 20, 'p_adx': 11, 'rsi_period': 33, 'ema1': 15, 'ema2': 41, 'slip_atr_k': 0.1927434379159462, 'slip_spread_k': 0.48730971592725697, 'spread_hl_frac': 0.023193560146941516, 'bb_std_mult': 0.5044710983925487, 'rsi_os': 44, 'rsi_ob': 94, 'vol_spike': 0.027344163265168385, 'adx_thresh': 24.826235929360045, 'atr_min_pct': 0.02657156531220867, 'atr_max_pct': 0.13235438356298374, 'tp_mult': 1.4836002131846875, 'tsl_mult': 0.29697056750130657, 'strategy': 'breakout', 'time_stop': 129, 'use_sma': True, 'use_atr': False, 'use_adx': False, 'use_ema': True, 'use_spike': False, 'rsi_required': False, 'edge_k': 1.7432490605294055, 'edge_cap': 0.7668862759913107, 'bull_strategy': 'breakout', 'bull_bb_std_mult': 1.1829060117781445, 'bull_rsi_os': 17, 'bull_rsi_ob': 89, 'bull_adx_thresh': 23.758964552764077, 'bull_atr_min_pct': 0.0013835958473148889, 'bull_atr_max_pct': 0.11672727282063071, 'bull_tp_mult': 1.8170409133855512, 'bull_tsl_mult': 0.5823514415113489, 'bull_time_stop': 182, 'bull_use_sma': False, 'bull_use_ema': False, 'bull_use_atr': False, 'bull_use_adx': True, 'bull_use_spike': True, 'bull_rsi_required': False, 'bear_strategy': 'mean_reversion', 'bear_bb_std_mult': 3.202505880318049, 'bear_rsi_os': 31, 'bear_rsi_ob': 60, 'bear_adx_thresh': 22.215726973802145, 'bear_atr_min_pct': 0.011492400629655845, 'bear_atr_max_pct': 0.12200924299233724, 'bear_tp_mult': 2.5443348913264066, 'bear_tsl_mult': 0.7923504584735707, 'bear_time_stop': 157, 'bear_use_sma': True, 'bear_use_ema': True, 'bear_use_atr': True, 'bear_use_adx': False, 'bear_use_spike': True, 'bear_rsi_required': True, 'sideways_strategy': 'mean_reversion', 'sideways_bb_std_mult': 2.1931636566968984, 'sideways_rsi_os': 48, 'sideways_rsi_ob': 80, 'sideways_adx_thresh': 25.491216367862897, 'sideways_atr_min_pct': 0.004276518384646262, 'sideways_atr_max_pct': 0.021972493161354197, 'sideways_tp_mult': 2.863235191334632, 'sideways_tsl_mult': 0.18909622448887126, 'sideways_time_stop': 14, 'sideways_use_sma': True, 'sideways_use_ema': False, 'sideways_use_atr': False, 'sideways_use_adx': False, 'sideways_use_spike': True, 'sideways_rsi_required': True}.
[I 2025-08-31 03:52:05,734] Trial 153 finished with values: [-1000000000.0, 1000000000.0] and parameters: {'p_sma': 31, 'p_std': 14, 'p_atr': 23, 'p_adx': 11, 'rsi_period': 28, 'ema1': 17, 'ema2': 42, 'slip_atr_k': 0.22541757169251306, 'slip_spread_k': 0.484624610591817, 'spread_hl_frac': 0.002040669502191731, 'bb_std_mult': 0.5945344581570298, 'rsi_os': 28, 'rsi_ob': 86, 'vol_spike': 0.017071600136470876, 'adx_thresh': 27.469409536059583, 'atr_min_pct': 0.023393377771694514, 'atr_max_pct': 0.13265157580784934, 'tp_mult': 1.4871515577120717, 'tsl_mult': 0.30422623861284726, 'strategy': 'breakout', 'time_stop': 123, 'use_sma': True, 'use_atr': False, 'use_adx': False, 'use_ema': True, 'use_spike': False, 'rsi_required': False, 'edge_k': 1.7405658947467113, 'edge_cap': 0.8607590748231257, 'bull_strategy': 'breakout', 'bull_bb_std_mult': 1.0729205155283108, 'bull_rsi_os': 15, 'bull_rsi_ob': 89, 'bull_adx_thresh': 23.526240067115562, 'bull_atr_min_pct': 0.012571835810318937, 'bull_atr_max_pct': 0.11587836189533257, 'bull_tp_mult': 1.8202010887563822, 'bull_tsl_mult': 0.528487394479325, 'bull_time_stop': 181, 'bull_use_sma': False, 'bull_use_ema': False, 'bull_use_atr': False, 'bull_use_adx': True, 'bull_use_spike': True, 'bull_rsi_required': False, 'bear_strategy': 'mean_reversion', 'bear_bb_std_mult': 3.3655138119069736, 'bear_rsi_os': 35, 'bear_rsi_ob': 61, 'bear_adx_thresh': 18.409223693938074, 'bear_atr_min_pct': 0.010518790334529703, 'bear_atr_max_pct': 0.13116426067455295, 'bear_tp_mult': 2.3225082472128755, 'bear_tsl_mult': 0.1837211794741952, 'bear_time_stop': 156, 'bear_use_sma': True, 'bear_use_ema': True, 'bear_use_atr': True, 'bear_use_adx': True, 'bear_use_spike': True, 'bear_rsi_required': True, 'sideways_strategy': 'mean_reversion', 'sideways_bb_std_mult': 2.1869830553280436, 'sideways_rsi_os': 49, 'sideways_rsi_ob': 83, 'sideways_adx_thresh': 22.99433669682936, 'sideways_atr_min_pct': 0.009869802271880994, 'sideways_atr_max_pct': 0.02911580262693819, 'sideways_tp_mult': 2.745715957152553, 'sideways_tsl_mult': 0.19490947570281603, 'sideways_time_stop': 151, 'sideways_use_sma': True, 'sideways_use_ema': False, 'sideways_use_atr': False, 'sideways_use_adx': False, 'sideways_use_spike': True, 'sideways_rsi_required': True}.
[I 2025-08-31 03:52:35,005] Trial 159 finished with values: [-1000000000.0, 1000000000.0] and parameters: {'p_sma': 27, 'p_std': 13, 'p_atr': 22, 'p_adx': 12, 'rsi_period': 37, 'ema1': 16, 'ema2': 22, 'slip_atr_k': 0.0804914432306548, 'slip_spread_k': 0.394347240044227, 'spread_hl_frac': 0.04430024442523039, 'bb_std_mult': 0.8047090676706088, 'rsi_os': 31, 'rsi_ob': 70, 'vol_spike': 0.011693201289998519, 'adx_thresh': 26.329117025021848, 'atr_min_pct': 0.0253045952410867, 'atr_max_pct': 0.14624806913967042, 'tp_mult': 1.3275306746304443, 'tsl_mult': 0.2649150159322883, 'strategy': 'breakout', 'time_stop': 88, 'use_sma': False, 'use_atr': True, 'use_adx': False, 'use_ema': True, 'use_spike': False, 'rsi_required': False, 'edge_k': 1.4898099858964329, 'edge_cap': 0.842590931685185, 'bull_strategy': 'mean_reversion', 'bull_bb_std_mult': 1.2854502420953193, 'bull_rsi_os': 20, 'bull_rsi_ob': 85, 'bull_adx_thresh': 20.169745434318717, 'bull_atr_min_pct': 0.006596317436228245, 'bull_atr_max_pct': 0.1218513769687461, 'bull_tp_mult': 1.9027431713618759, 'bull_tsl_mult': 0.551528030173647, 'bull_time_stop': 209, 'bull_use_sma': False, 'bull_use_ema': False, 'bull_use_atr': True, 'bull_use_adx': True, 'bull_use_spike': True, 'bull_rsi_required': True, 'bear_strategy': 'mean_reversion', 'bear_bb_std_mult': 3.047592704184598, 'bear_rsi_os': 30, 'bear_rsi_ob': 54, 'bear_adx_thresh': 20.29961595783155, 'bear_atr_min_pct': 0.012646165934516682, 'bear_atr_max_pct': 0.11444876800606774, 'bear_tp_mult': 2.269330888168435, 'bear_tsl_mult': 0.7295389711745912, 'bear_time_stop': 177, 'bear_use_sma': True, 'bear_use_ema': True, 'bear_use_atr': False, 'bear_use_adx': False, 'bear_use_spike': True, 'bear_rsi_required': True, 'sideways_strategy': 'mean_reversion', 'sideways_bb_std_mult': 2.0934379427851773, 'sideways_rsi_os': 50, 'sideways_rsi_ob': 85, 'sideways_adx_thresh': 23.686319557202594, 'sideways_atr_min_pct': 0.015687874426791155, 'sideways_atr_max_pct': 0.012237381580250948, 'sideways_tp_mult': 2.725821902317707, 'sideways_tsl_mult': 0.22820040985024967, 'sideways_time_stop': 295, 'sideways_use_sma': False, 'sideways_use_ema': False, 'sideways_use_atr': False, 'sideways_use_adx': False, 'sideways_use_spike': True, 'sideways_rsi_required': True}.
[I 2025-08-31 03:52:35,195] Trial 157 finished with values: [-1000000000.0, 1000000000.0] and parameters: {'p_sma': 37, 'p_std': 51, 'p_atr': 25, 'p_adx': 10, 'rsi_period': 33, 'ema1': 14, 'ema2': 22, 'slip_atr_k': 0.18512037302954834, 'slip_spread_k': 0.36779562201937593, 'spread_hl_frac': 0.023475737517806454, 'bb_std_mult': 2.2353514778347896, 'rsi_os': 45, 'rsi_ob': 85, 'vol_spike': 0.000526687183020097, 'adx_thresh': 24.786438919448628, 'atr_min_pct': 0.02539465656797979, 'atr_max_pct': 0.13390045191462652, 'tp_mult': 2.3538461808983886, 'tsl_mult': 0.3993025519709482, 'strategy': 'breakout', 'time_stop': 125, 'use_sma': False, 'use_atr': False, 'use_adx': False, 'use_ema': True, 'use_spike': False, 'rsi_required': False, 'edge_k': 1.5971955737919379, 'edge_cap': 0.7697978812206303, 'bull_strategy': 'breakout', 'bull_bb_std_mult': 1.0731836606202603, 'bull_rsi_os': 17, 'bull_rsi_ob': 82, 'bull_adx_thresh': 23.939859346139567, 'bull_atr_min_pct': 0.0007366762748370222, 'bull_atr_max_pct': 0.12235512670900262, 'bull_tp_mult': 1.8257491108360924, 'bull_tsl_mult': 0.504928040552722, 'bull_time_stop': 181, 'bull_use_sma': False, 'bull_use_ema': False, 'bull_use_atr': True, 'bull_use_adx': True, 'bull_use_spike': True, 'bull_rsi_required': False, 'bear_strategy': 'mean_reversion', 'bear_bb_std_mult': 3.1094753033927205, 'bear_rsi_os': 30, 'bear_rsi_ob': 60, 'bear_adx_thresh': 21.78908595232195, 'bear_atr_min_pct': 0.011494725019482755, 'bear_atr_max_pct': 0.11492600266714639, 'bear_tp_mult': 2.290448117439498, 'bear_tsl_mult': 0.31316472026363207, 'bear_time_stop': 180, 'bear_use_sma': True, 'bear_use_ema': True, 'bear_use_atr': True, 'bear_use_adx': False, 'bear_use_spike': True, 'bear_rsi_required': True, 'sideways_strategy': 'mean_reversion', 'sideways_bb_std_mult': 2.065495092836664, 'sideways_rsi_os': 48, 'sideways_rsi_ob': 83, 'sideways_adx_thresh': 13.792588073411661, 'sideways_atr_min_pct': 0.004414746565842391, 'sideways_atr_max_pct': 0.01210888646363899, 'sideways_tp_mult': 2.8774205002895403, 'sideways_tsl_mult': 0.22952912651753637, 'sideways_time_stop': 41, 'sideways_use_sma': False, 'sideways_use_ema': False, 'sideways_use_atr': False, 'sideways_use_adx': False, 'sideways_use_spike': True, 'sideways_rsi_required': True}.
[I 2025-08-31 03:52:35,404] Trial 158 finished with values: [-1000000000.0, 1000000000.0] and parameters: {'p_sma': 31, 'p_std': 49, 'p_atr': 22, 'p_adx': 10, 'rsi_period': 34, 'ema1': 16, 'ema2': 22, 'slip_atr_k': 0.08287467179966879, 'slip_spread_k': 0.39992995005183707, 'spread_hl_frac': 0.04642591099330307, 'bb_std_mult': 0.5176109278352893, 'rsi_os': 44, 'rsi_ob': 85, 'vol_spike': 0.014273234740911741, 'adx_thresh': 24.850165392610027, 'atr_min_pct': 0.02134511107161805, 'atr_max_pct': 0.13335293871272078, 'tp_mult': 2.4617353488639653, 'tsl_mult': 0.2769624021677102, 'strategy': 'breakout', 'time_stop': 89, 'use_sma': False, 'use_atr': False, 'use_adx': False, 'use_ema': True, 'use_spike': False, 'rsi_required': False, 'edge_k': 1.502563974863151, 'edge_cap': 0.8484921902528714, 'bull_strategy': 'breakout', 'bull_bb_std_mult': 1.095197918891893, 'bull_rsi_os': 20, 'bull_rsi_ob': 83, 'bull_adx_thresh': 20.60231771361601, 'bull_atr_min_pct': 0.0063451820134833165, 'bull_atr_max_pct': 0.12229123047976473, 'bull_tp_mult': 1.9085988551353266, 'bull_tsl_mult': 0.562842545772555, 'bull_time_stop': 207, 'bull_use_sma': False, 'bull_use_ema': False, 'bull_use_atr': True, 'bull_use_adx': True, 'bull_use_spike': True, 'bull_rsi_required': False, 'bear_strategy': 'mean_reversion', 'bear_bb_std_mult': 3.320958381468418, 'bear_rsi_os': 30, 'bear_rsi_ob': 60, 'bear_adx_thresh': 21.803654473261222, 'bear_atr_min_pct': 0.01298605790283498, 'bear_atr_max_pct': 0.11343456138754471, 'bear_tp_mult': 2.28425338573556, 'bear_tsl_mult': 0.8643670551384849, 'bear_time_stop': 181, 'bear_use_sma': True, 'bear_use_ema': True, 'bear_use_atr': True, 'bear_use_adx': False, 'bear_use_spike': True, 'bear_rsi_required': True, 'sideways_strategy': 'mean_reversion', 'sideways_bb_std_mult': 2.3164748678756943, 'sideways_rsi_os': 48, 'sideways_rsi_ob': 86, 'sideways_adx_thresh': 23.4579027100538, 'sideways_atr_min_pct': 0.004353256919321398, 'sideways_atr_max_pct': 0.028615610102324236, 'sideways_tp_mult': 2.7278544190954697, 'sideways_tsl_mult': 0.16965005613320877, 'sideways_time_stop': 295, 'sideways_use_sma': False, 'sideways_use_ema': False, 'sideways_use_atr': False, 'sideways_use_adx': False, 'sideways_use_spike': True, 'sideways_rsi_required': True}.
[I 2025-08-31 03:52:35,558] Trial 160 finished with values: [-1000000000.0, 1000000000.0] and parameters: {'p_sma': 60, 'p_std': 50, 'p_atr': 22, 'p_adx': 12, 'rsi_period': 37, 'ema1': 14, 'ema2': 59, 'slip_atr_k': 0.010207905037108209, 'slip_spread_k': 0.3641760561466019, 'spread_hl_frac': 0.04108557333336127, 'bb_std_mult': 2.2625361893256084, 'rsi_os': 8, 'rsi_ob': 71, 'vol_spike': 0.0483294584838153, 'adx_thresh': 26.038273226564804, 'atr_min_pct': 0.021747144322312024, 'atr_max_pct': 0.146121354149136, 'tp_mult': 2.2870966084414883, 'tsl_mult': 0.8545282277783935, 'strategy': 'breakout', 'time_stop': 90, 'use_sma': False, 'use_atr': True, 'use_adx': False, 'use_ema': True, 'use_spike': False, 'rsi_required': False, 'edge_k': 1.6703534943277065, 'edge_cap': 0.8439524954375284, 'bull_strategy': 'mean_reversion', 'bull_bb_std_mult': 1.0789468417875243, 'bull_rsi_os': 20, 'bull_rsi_ob': 83, 'bull_adx_thresh': 20.60730149180606, 'bull_atr_min_pct': 0.006533935977899115, 'bull_atr_max_pct': 0.12245711972196517, 'bull_tp_mult': 2.011029964454628, 'bull_tsl_mult': 0.5605106579161191, 'bull_time_stop': 206, 'bull_use_sma': False, 'bull_use_ema': False, 'bull_use_atr': True, 'bull_use_adx': True, 'bull_use_spike': True, 'bull_rsi_required': True, 'bear_strategy': 'mean_reversion', 'bear_bb_std_mult': 3.1107234054398845, 'bear_rsi_os': 30, 'bear_rsi_ob': 55, 'bear_adx_thresh': 21.822583947643174, 'bear_atr_min_pct': 0.012667002653988568, 'bear_atr_max_pct': 0.11192830170601746, 'bear_tp_mult': 2.3418397904390975, 'bear_tsl_mult': 0.8558366460990867, 'bear_time_stop': 178, 'bear_use_sma': True, 'bear_use_ema': True, 'bear_use_atr': False, 'bear_use_adx': False, 'bear_use_spike': True, 'bear_rsi_required': True, 'sideways_strategy': 'mean_reversion', 'sideways_bb_std_mult': 2.089475363265771, 'sideways_rsi_os': 12, 'sideways_rsi_ob': 85, 'sideways_adx_thresh': 7.6396854893659185, 'sideways_atr_min_pct': 0.016140827580898333, 'sideways_atr_max_pct': 0.016301343491192926, 'sideways_tp_mult': 2.7159367075568794, 'sideways_tsl_mult': 0.22725349709141188, 'sideways_time_stop': 295, 'sideways_use_sma': False, 'sideways_use_ema': False, 'sideways_use_atr': False, 'sideways_use_adx': False, 'sideways_use_spike': True, 'sideways_rsi_required': True}.
[I 2025-08-31 03:53:04,640] Trial 163 finished with values: [-1000000000.0, 1000000000.0] and parameters: {'p_sma': 60, 'p_std': 15, 'p_atr': 21, 'p_adx': 9, 'rsi_period': 38, 'ema1': 14, 'ema2': 55, 'slip_atr_k': 0.05123740568825119, 'slip_spread_k': 0.5395338588082151, 'spread_hl_frac': 0.04127308878070936, 'bb_std_mult': 1.6126385486511199, 'rsi_os': 8, 'rsi_ob': 89, 'vol_spike': 0.046622989295891815, 'adx_thresh': 26.86388209799561, 'atr_min_pct': 0.022113737653612693, 'atr_max_pct': 0.1494897775283179, 'tp_mult': 1.3775672865615618, 'tsl_mult': 0.7917902485161898, 'strategy': 'breakout', 'time_stop': 103, 'use_sma': False, 'use_atr': False, 'use_adx': False, 'use_ema': True, 'use_spike': False, 'rsi_required': False, 'edge_k': 1.6578598131166749, 'edge_cap': 0.8825484289080149, 'bull_strategy': 'breakout', 'bull_bb_std_mult': 1.4408676194475558, 'bull_rsi_os': 13, 'bull_rsi_ob': 70, 'bull_adx_thresh': 22.11945848402711, 'bull_atr_min_pct': 0.0016690352380907165, 'bull_atr_max_pct': 0.10785382363249094, 'bull_tp_mult': 1.719122970229196, 'bull_tsl_mult': 0.19114682040823833, 'bull_time_stop': 176, 'bull_use_sma': False, 'bull_use_ema': False, 'bull_use_atr': True, 'bull_use_adx': True, 'bull_use_spike': True, 'bull_rsi_required': False, 'bear_strategy': 'mean_reversion', 'bear_bb_std_mult': 3.5307461519387453, 'bear_rsi_os': 33, 'bear_rsi_ob': 58, 'bear_adx_thresh': 23.397565358578184, 'bear_atr_min_pct': 0.00958949142191021, 'bear_atr_max_pct': 0.1361528680000781, 'bear_tp_mult': 2.3364236818972426, 'bear_tsl_mult': 0.9226379086695631, 'bear_time_stop': 147, 'bear_use_sma': True, 'bear_use_ema': True, 'bear_use_atr': False, 'bear_use_adx': False, 'bear_use_spike': True, 'bear_rsi_required': True, 'sideways_strategy': 'mean_reversion', 'sideways_bb_std_mult': 1.863571434109354, 'sideways_rsi_os': 39, 'sideways_rsi_ob': 79, 'sideways_adx_thresh': 20.718748678107804, 'sideways_atr_min_pct': 0.017733577590037818, 'sideways_atr_max_pct': 0.01606989281308854, 'sideways_tp_mult': 2.786183971922257, 'sideways_tsl_mult': 0.26414098748697973, 'sideways_time_stop': 274, 'sideways_use_sma': True, 'sideways_use_ema': False, 'sideways_use_atr': False, 'sideways_use_adx': True, 'sideways_use_spike': True, 'sideways_rsi_required': True}.
