[I 2025-08-31 04:34:36,510] Trial 395 finished with values: [-0.011586248822638812, 0.01152314868108567] and parameters: {'p_sma': 53, 'p_std': 15, 'p_atr': 18, 'p_adx': 17, 'rsi_period': 38, 'ema1': 26, 'ema2': 29, 'slip_atr_k': 0.02738036926267894, 'slip_spread_k': 0.3949872470479643, 'spread_hl_frac': 0.039532442189152875, 'bb_std_mult': 2.871949104541418, 'rsi_os': 46, 'rsi_ob': 58, 'vol_spike': 0.269177047311352, 'adx_thresh': 9.175477558442552, 'atr_min_pct': 0.02386299926480968, 'atr_max_pct': 0.12380583351115935, 'tp_mult': 2.43194808752315, 'tsl_mult': 0.1696451224252284, 'strategy': 'breakout', 'time_stop': 144, 'use_sma': False, 'use_atr': False, 'use_adx': False, 'use_ema': True, 'use_spike': False, 'rsi_required': False, 'edge_k': 0.8764063201663996, 'edge_cap': 0.8612387017516483, 'bull_strategy': 'breakout', 'bull_bb_std_mult': 3.3796000573843186, 'bull_rsi_os': 34, 'bull_rsi_ob': 78, 'bull_adx_thresh': 16.55684138583536, 'bull_atr_min_pct': 0.0003727512493658428, 'bull_atr_max_pct': 0.07250242945227592, 'bull_tp_mult': 1.6552070854078882, 'bull_tsl_mult': 0.9309365462999577, 'bull_time_stop': 109, 'bull_use_sma': False, 'bull_use_ema': False, 'bull_use_atr': True, 'bull_use_adx': True, 'bull_use_spike': True, 'bull_rsi_required': True, 'bear_strategy': 'mean_reversion', 'bear_bb_std_mult': 1.2072289936416984, 'bear_rsi_os': 20, 'bear_rsi_ob': 45, 'bear_adx_thresh': 9.236751294486101, 'bear_atr_min_pct': 0.02290439451414222, 'bear_atr_max_pct': 0.10276484014429423, 'bear_tp_mult': 2.998442930023541, 'bear_tsl_mult': 0.09470439100863426, 'bear_time_stop': 185, 'bear_use_sma': True, 'bear_use_ema': True, 'bear_use_atr': True, 'bear_use_adx': False, 'bear_use_spike': True, 'bear_rsi_required': True, 'sideways_strategy': 'mean_reversion', 'sideways_bb_std_mult': 0.9231356090138264, 'sideways_rsi_os': 27, 'sideways_rsi_ob': 50, 'sideways_adx_thresh': 8.62888551613131, 'sideways_atr_min_pct': 0.026034349728785208, 'sideways_atr_max_pct': 0.1420401674581922, 'sideways_tp_mult': 1.9745776079650965, 'sideways_tsl_mult': 0.44230305164512473, 'sideways_time_stop': 191, 'sideways_use_sma': False, 'sideways_use_ema': False, 'sideways_use_atr': False, 'sideways_use_adx': True, 'sideways_use_spike': True, 'sideways_rsi_required': True}.
[I 2025-08-31 04:34:36,674] Trial 394 finished with values: [-0.015228861721643283, 0.01515572511705879] and parameters: {'p_sma': 48, 'p_std': 18, 'p_atr': 24, 'p_adx': 10, 'rsi_period': 42, 'ema1': 14, 'ema2': 29, 'slip_atr_k': 0.20297066116758097, 'slip_spread_k': 0.38241759958785304, 'spread_hl_frac': 0.011376077820137349, 'bb_std_mult': 2.082078047253342, 'rsi_os': 29, 'rsi_ob': 58, 'vol_spike': 0.022074773701349505, 'adx_thresh': 10.796272974274247, 'atr_min_pct': 0.023512362637795513, 'atr_max_pct': 0.12521351334373282, 'tp_mult': 2.4286249118671424, 'tsl_mult': 0.9173225211362734, 'strategy': 'breakout', 'time_stop': 12, 'use_sma': False, 'use_atr': False, 'use_adx': False, 'use_ema': True, 'use_spike': False, 'rsi_required': False, 'edge_k': 1.3823634677608718, 'edge_cap': 0.24916913719121564, 'bull_strategy': 'breakout', 'bull_bb_std_mult': 3.3552469406630583, 'bull_rsi_os': 35, 'bull_rsi_ob': 57, 'bull_adx_thresh': 17.098775462252284, 'bull_atr_min_pct': 0.0007928631269377372, 'bull_atr_max_pct': 0.05226369137563661, 'bull_tp_mult': 1.6347605241912848, 'bull_tsl_mult': 0.6642942340600352, 'bull_time_stop': 188, 'bull_use_sma': False, 'bull_use_ema': False, 'bull_use_atr': True, 'bull_use_adx': True, 'bull_use_spike': True, 'bull_rsi_required': True, 'bear_strategy': 'mean_reversion', 'bear_bb_std_mult': 1.2204291294872434, 'bear_rsi_os': 20, 'bear_rsi_ob': 45, 'bear_adx_thresh': 20.24298359636579, 'bear_atr_min_pct': 0.006369017083892552, 'bear_atr_max_pct': 0.04305572998866918, 'bear_tp_mult': 1.094423196772281, 'bear_tsl_mult': 0.055924408727706654, 'bear_time_stop': 183, 'bear_use_sma': True, 'bear_use_ema': True, 'bear_use_atr': True, 'bear_use_adx': True, 'bear_use_spike': True, 'bear_rsi_required': True, 'sideways_strategy': 'mean_reversion', 'sideways_bb_std_mult': 3.5228558575038864, 'sideways_rsi_os': 26, 'sideways_rsi_ob': 49, 'sideways_adx_thresh': 11.396914149100462, 'sideways_atr_min_pct': 0.026013585305825513, 'sideways_atr_max_pct': 0.1411891340956082, 'sideways_tp_mult': 1.965895300770411, 'sideways_tsl_mult': 0.02081912418215215, 'sideways_time_stop': 145, 'sideways_use_sma': False, 'sideways_use_ema': False, 'sideways_use_atr': False, 'sideways_use_adx': True, 'sideways_use_spike': True, 'sideways_rsi_required': True}.
[I 2025-08-31 04:35:32,352] Trial 401 finished with values: [-1000000000.0, 1000000000.0] and parameters: {'p_sma': 55, 'p_std': 14, 'p_atr': 23, 'p_adx': 22, 'rsi_period': 53, 'ema1': 13, 'ema2': 31, 'slip_atr_k': 0.11791663471383082, 'slip_spread_k': 0.654813129760368, 'spread_hl_frac': 0.012783844868704673, 'bb_std_mult': 2.957928602222651, 'rsi_os': 30, 'rsi_ob': 64, 'vol_spike': 0.27058583135633923, 'adx_thresh': 11.834613270688044, 'atr_min_pct': 0.004152600996888816, 'atr_max_pct': 0.12199259026286145, 'tp_mult': 2.4615987492158973, 'tsl_mult': 0.7516018669824471, 'strategy': 'breakout', 'time_stop': 180, 'use_sma': False, 'use_atr': False, 'use_adx': False, 'use_ema': False, 'use_spike': True, 'rsi_required': False, 'edge_k': 0.001053860103328641, 'edge_cap': 0.09266488623532132, 'bull_strategy': 'mean_reversion', 'bull_bb_std_mult': 1.7606698273863746, 'bull_rsi_os': 15, 'bull_rsi_ob': 59, 'bull_adx_thresh': 28.473618178394513, 'bull_atr_min_pct': 0.02853919525325625, 'bull_atr_max_pct': 0.048597920108320945, 'bull_tp_mult': 1.5572772820034584, 'bull_tsl_mult': 0.36282694210296207, 'bull_time_stop': 143, 'bull_use_sma': False, 'bull_use_ema': False, 'bull_use_atr': True, 'bull_use_adx': False, 'bull_use_spike': False, 'bull_rsi_required': True, 'bear_strategy': 'breakout', 'bear_bb_std_mult': 0.8883204276539429, 'bear_rsi_os': 8, 'bear_rsi_ob': 88, 'bear_adx_thresh': 17.700391787916242, 'bear_atr_min_pct': 0.024384582566919027, 'bear_atr_max_pct': 0.037215333409844065, 'bear_tp_mult': 2.425883346781362, 'bear_tsl_mult': 0.22157808874562307, 'bear_time_stop': 204, 'bear_use_sma': False, 'bear_use_ema': True, 'bear_use_atr': True, 'bear_use_adx': True, 'bear_use_spike': True, 'bear_rsi_required': True, 'sideways_strategy': 'mean_reversion', 'sideways_bb_std_mult': 0.5578091466773296, 'sideways_rsi_os': 27, 'sideways_rsi_ob': 47, 'sideways_adx_thresh': 5.7224506922186436, 'sideways_atr_min_pct': 0.005487331290737644, 'sideways_atr_max_pct': 0.10438014211697488, 'sideways_tp_mult': 1.916998349458978, 'sideways_tsl_mult': 0.44917304983360323, 'sideways_time_stop': 169, 'sideways_use_sma': True, 'sideways_use_ema': False, 'sideways_use_atr': False, 'sideways_use_adx': True, 'sideways_use_spike': True, 'sideways_rsi_required': False}.
[I 2025-08-31 04:35:32,628] Trial 399 finished with values: [-1000000000.0, 1000000000.0] and parameters: {'p_sma': 25, 'p_std': 15, 'p_atr': 16, 'p_adx': 9, 'rsi_period': 24, 'ema1': 17, 'ema2': 12, 'slip_atr_k': 0.012176176252035114, 'slip_spread_k': 0.12315878485731979, 'spread_hl_frac': 0.03977320313515445, 'bb_std_mult': 2.185168496921133, 'rsi_os': 34, 'rsi_ob': 50, 'vol_spike': 0.2700525125259383, 'adx_thresh': 7.61071653346084, 'atr_min_pct': 0.013640991742533885, 'atr_max_pct': 0.12043105400719332, 'tp_mult': 2.877384801008233, 'tsl_mult': 0.8868983635977076, 'strategy': 'breakout', 'time_stop': 66, 'use_sma': False, 'use_atr': False, 'use_adx': False, 'use_ema': False, 'use_spike': True, 'rsi_required': True, 'edge_k': 1.9039159031687962, 'edge_cap': 0.49040200103818904, 'bull_strategy': 'mean_reversion', 'bull_bb_std_mult': 2.321021011648171, 'bull_rsi_os': 16, 'bull_rsi_ob': 78, 'bull_adx_thresh': 13.21275946247308, 'bull_atr_min_pct': 0.009145475963785683, 'bull_atr_max_pct': 0.047218886319871776, 'bull_tp_mult': 2.515223263657455, 'bull_tsl_mult': 0.9359109451492338, 'bull_time_stop': 222, 'bull_use_sma': False, 'bull_use_ema': False, 'bull_use_atr': True, 'bull_use_adx': True, 'bull_use_spike': False, 'bull_rsi_required': True, 'bear_strategy': 'breakout', 'bear_bb_std_mult': 0.6196042599838543, 'bear_rsi_os': 37, 'bear_rsi_ob': 88, 'bear_adx_thresh': 8.981361996247138, 'bear_atr_min_pct': 0.023883465892883492, 'bear_atr_max_pct': 0.03683575566061199, 'bear_tp_mult': 2.455296772698443, 'bear_tsl_mult': 0.21982279776673258, 'bear_time_stop': 121, 'bear_use_sma': True, 'bear_use_ema': True, 'bear_use_atr': True, 'bear_use_adx': True, 'bear_use_spike': True, 'bear_rsi_required': True, 'sideways_strategy': 'mean_reversion', 'sideways_bb_std_mult': 1.4104994878865331, 'sideways_rsi_os': 28, 'sideways_rsi_ob': 47, 'sideways_adx_thresh': 10.598023954205916, 'sideways_atr_min_pct': 0.011522742925075833, 'sideways_atr_max_pct': 0.1219087842508903, 'sideways_tp_mult': 1.9166289246813462, 'sideways_tsl_mult': 0.9543811909732955, 'sideways_time_stop': 57, 'sideways_use_sma': True, 'sideways_use_ema': False, 'sideways_use_atr': False, 'sideways_use_adx': True, 'sideways_use_spike': True, 'sideways_rsi_required': True}.
[I 2025-08-31 04:35:33,345] Trial 398 finished with values: [-0.01524766701318514, 0.015261243137158341] and parameters: {'p_sma': 57, 'p_std': 14, 'p_atr': 15, 'p_adx': 11, 'rsi_period': 21, 'ema1': 13, 'ema2': 28, 'slip_atr_k': 0.011131690261258475, 'slip_spread_k': 0.10099633727067236, 'spread_hl_frac': 0.004576069105722121, 'bb_std_mult': 2.8832863763068506, 'rsi_os': 41, 'rsi_ob': 90, 'vol_spike': 0.27754946706309414, 'adx_thresh': 15.281654639310506, 'atr_min_pct': 0.023437877168121814, 'atr_max_pct': 0.12310992624515381, 'tp_mult': 2.796537480517641, 'tsl_mult': 0.641023306101584, 'strategy': 'breakout', 'time_stop': 217, 'use_sma': False, 'use_atr': False, 'use_adx': False, 'use_ema': False, 'use_spike': True, 'rsi_required': True, 'edge_k': 1.104563635769363, 'edge_cap': 0.9746414002159781, 'bull_strategy': 'mean_reversion', 'bull_bb_std_mult': 1.7642803149482535, 'bull_rsi_os': 16, 'bull_rsi_ob': 78, 'bull_adx_thresh': 28.459225350555325, 'bull_atr_min_pct': 0.0009027179227714404, 'bull_atr_max_pct': 0.04625357577436013, 'bull_tp_mult': 1.6424091888902317, 'bull_tsl_mult': 0.4741725597788228, 'bull_time_stop': 229, 'bull_use_sma': False, 'bull_use_ema': False, 'bull_use_atr': True, 'bull_use_adx': True, 'bull_use_spike': False, 'bull_rsi_required': True, 'bear_strategy': 'breakout', 'bear_bb_std_mult': 0.6258826140628961, 'bear_rsi_os': 8, 'bear_rsi_ob': 78, 'bear_adx_thresh': 7.717162535446333, 'bear_atr_min_pct': 0.024369166432181684, 'bear_atr_max_pct': 0.0504102559485434, 'bear_tp_mult': 2.44787160111424, 'bear_tsl_mult': 0.4796803243783697, 'bear_time_stop': 216, 'bear_use_sma': True, 'bear_use_ema': True, 'bear_use_atr': True, 'bear_use_adx': True, 'bear_use_spike': True, 'bear_rsi_required': True, 'sideways_strategy': 'mean_reversion', 'sideways_bb_std_mult': 1.4539972275448352, 'sideways_rsi_os': 27, 'sideways_rsi_ob': 49, 'sideways_adx_thresh': 11.975880352373254, 'sideways_atr_min_pct': 0.02579341082912394, 'sideways_atr_max_pct': 0.10469526932898965, 'sideways_tp_mult': 1.9691928015374411, 'sideways_tsl_mult': 0.3681021306827792, 'sideways_time_stop': 59, 'sideways_use_sma': True, 'sideways_use_ema': False, 'sideways_use_atr': False, 'sideways_use_adx': True, 'sideways_use_spike': True, 'sideways_rsi_required': True}.
[I 2025-08-31 04:35:33,542] Trial 400 finished with values: [-0.012280200248938833, 0.012231158510294025] and parameters: {'p_sma': 55, 'p_std': 14, 'p_atr': 23, 'p_adx': 24, 'rsi_period': 22, 'ema1': 22, 'ema2': 12, 'slip_atr_k': 0.053306356162936774, 'slip_spread_k': 0.4045044323516029, 'spread_hl_frac': 0.012979855176244354, 'bb_std_mult': 2.1362847351853382, 'rsi_os': 20, 'rsi_ob': 77, 'vol_spike': 0.08300267250746537, 'adx_thresh': 12.099293533090067, 'atr_min_pct': 0.023458387030288942, 'atr_max_pct': 0.12150863330361714, 'tp_mult': 2.7941311197703618, 'tsl_mult': 0.9127163673999021, 'strategy': 'breakout', 'time_stop': 144, 'use_sma': False, 'use_atr': False, 'use_adx': False, 'use_ema': False, 'use_spike': True, 'rsi_required': False, 'edge_k': 0.9230956213733365, 'edge_cap': 0.9999923069426324, 'bull_strategy': 'mean_reversion', 'bull_bb_std_mult': 1.7714168370947139, 'bull_rsi_os': 11, 'bull_rsi_ob': 78, 'bull_adx_thresh': 28.423396053820845, 'bull_atr_min_pct': 0.0010800814617244342, 'bull_atr_max_pct': 0.10885662967541834, 'bull_tp_mult': 2.5353801938234777, 'bull_tsl_mult': 0.363354113574586, 'bull_time_stop': 231, 'bull_use_sma': False, 'bull_use_ema': False, 'bull_use_atr': True, 'bull_use_adx': False, 'bull_use_spike': False, 'bull_rsi_required': True, 'bear_strategy': 'mean_reversion', 'bear_bb_std_mult': 1.8333562687352185, 'bear_rsi_os': 8, 'bear_rsi_ob': 45, 'bear_adx_thresh': 19.83210522103949, 'bear_atr_min_pct': 0.02422520534022519, 'bear_atr_max_pct': 0.07711736292173484, 'bear_tp_mult': 1.9741905241324404, 'bear_tsl_mult': 0.9051745366082247, 'bear_time_stop': 184, 'bear_use_sma': False, 'bear_use_ema': True, 'bear_use_atr': True, 'bear_use_adx': True, 'bear_use_spike': True, 'bear_rsi_required': True, 'sideways_strategy': 'mean_reversion', 'sideways_bb_std_mult': 2.156787253405943, 'sideways_rsi_os': 27, 'sideways_rsi_ob': 49, 'sideways_adx_thresh': 10.64797719701529, 'sideways_atr_min_pct': 0.015863029606520494, 'sideways_atr_max_pct': 0.12365114532953199, 'sideways_tp_mult': 2.0315299688926447, 'sideways_tsl_mult': 0.022360326495983074, 'sideways_time_stop': 66, 'sideways_use_sma': True, 'sideways_use_ema': False, 'sideways_use_atr': False, 'sideways_use_adx': True, 'sideways_use_spike': True, 'sideways_rsi_required': False}.
[I 2025-08-31 04:36:28,105] Trial 402 finished with values: [-1000000000.0, 1000000000.0] and parameters: {'p_sma': 6, 'p_std': 44, 'p_atr': 15, 'p_adx': 11, 'rsi_period': 23, 'ema1': 24, 'ema2': 60, 'slip_atr_k': 0.018444508142300038, 'slip_spread_k': 0.544541337872951, 'spread_hl_frac': 0.010852091649531841, 'bb_std_mult': 1.7832066074987616, 'rsi_os': 41, 'rsi_ob': 91, 'vol_spike': 0.1672251488142844, 'adx_thresh': 12.093530842946787, 'atr_min_pct': 0.0215216750528876, 'atr_max_pct': 0.11954063448581542, 'tp_mult': 2.1216922464814787, 'tsl_mult': 0.01574361784097983, 'strategy': 'breakout', 'time_stop': 65, 'use_sma': False, 'use_atr': False, 'use_adx': False, 'use_ema': False, 'use_spike': True, 'rsi_required': True, 'edge_k': 0.39153003466167624, 'edge_cap': 0.9999533961353434, 'bull_strategy': 'mean_reversion', 'bull_bb_std_mult': 0.8689998800337775, 'bull_rsi_os': 44, 'bull_rsi_ob': 78, 'bull_adx_thresh': 13.280494210936592, 'bull_atr_min_pct': 0.026461036230994505, 'bull_atr_max_pct': 0.04050017923497628, 'bull_tp_mult': 1.2078659340532174, 'bull_tsl_mult': 0.46985778101737624, 'bull_time_stop': 100, 'bull_use_sma': False, 'bull_use_ema': True, 'bull_use_atr': True, 'bull_use_adx': True, 'bull_use_spike': False, 'bull_rsi_required': True, 'bear_strategy': 'mean_reversion', 'bear_bb_std_mult': 3.030985461801776, 'bear_rsi_os': 12, 'bear_rsi_ob': 93, 'bear_adx_thresh': 7.82168002217681, 'bear_atr_min_pct': 0.008534174915519383, 'bear_atr_max_pct': 0.07494385832946979, 'bear_tp_mult': 2.227909802082324, 'bear_tsl_mult': 0.21345989507961396, 'bear_time_stop': 185, 'bear_use_sma': True, 'bear_use_ema': False, 'bear_use_atr': True, 'bear_use_adx': True, 'bear_use_spike': False, 'bear_rsi_required': True, 'sideways_strategy': 'mean_reversion', 'sideways_bb_std_mult': 1.0826665508768696, 'sideways_rsi_os': 28, 'sideways_rsi_ob': 60, 'sideways_adx_thresh': 10.645149025847251, 'sideways_atr_min_pct': 0.011412383517921884, 'sideways_atr_max_pct': 0.11990908908149711, 'sideways_tp_mult': 2.029501575116973, 'sideways_tsl_mult': 0.6001607992643122, 'sideways_time_stop': 68, 'sideways_use_sma': True, 'sideways_use_ema': False, 'sideways_use_atr': False, 'sideways_use_adx': True, 'sideways_use_spike': True, 'sideways_rsi_required': True}.
[I 2025-08-31 04:36:28,512] Trial 403 finished with values: [-1000000000.0, 1000000000.0] and parameters: {'p_sma': 5, 'p_std': 14, 'p_atr': 24, 'p_adx': 11, 'rsi_period': 23, 'ema1': 14, 'ema2': 39, 'slip_atr_k': 0.21514108725074005, 'slip_spread_k': 0.1006686722703098, 'spread_hl_frac': 0.027762953936609783, 'bb_std_mult': 3.154239317383528, 'rsi_os': 39, 'rsi_ob': 63, 'vol_spike': 0.1641166802321313, 'adx_thresh': 12.020003358452506, 'atr_min_pct': 0.02147183016263149, 'atr_max_pct': 0.12285747048801239, 'tp_mult': 2.8085277870178444, 'tsl_mult': 0.6379051565905696, 'strategy': 'mean_reversion', 'time_stop': 190, 'use_sma': False, 'use_atr': False, 'use_adx': False, 'use_ema': False, 'use_spike': True, 'rsi_required': False, 'edge_k': 0.8985674065906716, 'edge_cap': 0.7744644967938958, 'bull_strategy': 'mean_reversion', 'bull_bb_std_mult': 0.8822535053465475, 'bull_rsi_os': 11, 'bull_rsi_ob': 77, 'bull_adx_thresh': 9.946389090011074, 'bull_atr_min_pct': 0.026497360185047936, 'bull_atr_max_pct': 0.13609530081208546, 'bull_tp_mult': 1.613846494788341, 'bull_tsl_mult': 0.8420133683556629, 'bull_time_stop': 231, 'bull_use_sma': False, 'bull_use_ema': True, 'bull_use_atr': True, 'bull_use_adx': True, 'bull_use_spike': False, 'bull_rsi_required': True, 'bear_strategy': 'mean_reversion', 'bear_bb_std_mult': 2.4879977308175003, 'bear_rsi_os': 12, 'bear_rsi_ob': 47, 'bear_adx_thresh': 7.906352732495776, 'bear_atr_min_pct': 0.02336017253982427, 'bear_atr_max_pct': 0.049746843801876786, 'bear_tp_mult': 2.521851226238414, 'bear_tsl_mult': 0.2671498888538556, 'bear_time_stop': 187, 'bear_use_sma': True, 'bear_use_ema': False, 'bear_use_atr': True, 'bear_use_adx': False, 'bear_use_spike': False, 'bear_rsi_required': True, 'sideways_strategy': 'breakout', 'sideways_bb_std_mult': 1.0912865155081561, 'sideways_rsi_os': 28, 'sideways_rsi_ob': 58, 'sideways_adx_thresh': 10.22377014439505, 'sideways_atr_min_pct': 0.01351688278829463, 'sideways_atr_max_pct': 0.1243692651116158, 'sideways_tp_mult': 2.025685259593579, 'sideways_tsl_mult': 0.8803549256659928, 'sideways_time_stop': 67, 'sideways_use_sma': False, 'sideways_use_ema': False, 'sideways_use_atr': False, 'sideways_use_adx': True, 'sideways_use_spike': True, 'sideways_rsi_required': True}.
[I 2025-08-31 04:36:28,791] Trial 404 finished with values: [-1000000000.0, 1000000000.0] and parameters: {'p_sma': 54, 'p_std': 16, 'p_atr': 23, 'p_adx': 8, 'rsi_period': 83, 'ema1': 14, 'ema2': 23, 'slip_atr_k': 0.018406445389123147, 'slip_spread_k': 0.534404297856302, 'spread_hl_frac': 0.008134505935252386, 'bb_std_mult': 3.164832738607402, 'rsi_os': 46, 'rsi_ob': 77, 'vol_spike': 0.08400654385827282, 'adx_thresh': 11.929987034304792, 'atr_min_pct': 0.021561223228624537, 'atr_max_pct': 0.12085044345572327, 'tp_mult': 2.4725088366272105, 'tsl_mult': 0.8764223928592209, 'strategy': 'mean_reversion', 'time_stop': 120, 'use_sma': True, 'use_atr': True, 'use_adx': True, 'use_ema': False, 'use_spike': True, 'rsi_required': False, 'edge_k': 0.907903446982359, 'edge_cap': 0.8357807450778209, 'bull_strategy': 'mean_reversion', 'bull_bb_std_mult': 1.4100133692502015, 'bull_rsi_os': 8, 'bull_rsi_ob': 53, 'bull_adx_thresh': 9.617918030736869, 'bull_atr_min_pct': 0.002267557288559756, 'bull_atr_max_pct': 0.04042736341723331, 'bull_tp_mult': 1.3496792467185776, 'bull_tsl_mult': 0.4346026743856638, 'bull_time_stop': 135, 'bull_use_sma': True, 'bull_use_ema': True, 'bull_use_atr': False, 'bull_use_adx': False, 'bull_use_spike': False, 'bull_rsi_required': False, 'bear_strategy': 'mean_reversion', 'bear_bb_std_mult': 1.1683472418996228, 'bear_rsi_os': 12, 'bear_rsi_ob': 47, 'bear_adx_thresh': 18.356512782563303, 'bear_atr_min_pct': 0.023294980657951467, 'bear_atr_max_pct': 0.026585443316758703, 'bear_tp_mult': 1.989797237681465, 'bear_tsl_mult': 0.2028328157386874, 'bear_time_stop': 187, 'bear_use_sma': False, 'bear_use_ema': False, 'bear_use_atr': True, 'bear_use_adx': False, 'bear_use_spike': False, 'bear_rsi_required': True, 'sideways_strategy': 'breakout', 'sideways_bb_std_mult': 1.0046382971734273, 'sideways_rsi_os': 28, 'sideways_rsi_ob': 58, 'sideways_adx_thresh': 8.454297032897944, 'sideways_atr_min_pct': 0.015640241417212607, 'sideways_atr_max_pct': 0.11880841173341498, 'sideways_tp_mult': 2.024936979311174, 'sideways_tsl_mult': 0.29177760965943955, 'sideways_time_stop': 68, 'sideways_use_sma': False, 'sideways_use_ema': True, 'sideways_use_atr': True, 'sideways_use_adx': False, 'sideways_use_spike': False, 'sideways_rsi_required': False}.
