[I 2025-08-31 06:00:01,816] Trial 853 finished with values: [-1000000000.0, 1000000000.0] and parameters: {'p_sma': 30, 'p_std': 47, 'p_atr': 13, 'p_adx': 25, 'rsi_period': 17, 'ema1': 17, 'ema2': 20, 'slip_atr_k': 0.013192502100995292, 'slip_spread_k': 0.8717864467271512, 'spread_hl_frac': 0.0010318838717185965, 'bb_std_mult': 3.4671938848383546, 'rsi_os': 49, 'rsi_ob': 70, 'vol_spike': 0.09836714102735661, 'adx_thresh': 8.227080604366822, 'atr_min_pct': 0.008763971154068358, 'atr_max_pct': 0.11844463007454453, 'tp_mult': 2.1068723763900397, 'tsl_mult': 0.4173401749076603, 'strategy': 'mean_reversion', 'time_stop': 21, 'use_sma': True, 'use_atr': True, 'use_adx': False, 'use_ema': False, 'use_spike': False, 'rsi_required': True, 'edge_k': 0.9804861248781828, 'edge_cap': 0.378265859502871, 'bull_strategy': 'breakout', 'bull_bb_std_mult': 1.7138413450297774, 'bull_rsi_os': 33, 'bull_rsi_ob': 71, 'bull_adx_thresh': 34.0191152866654, 'bull_atr_min_pct': 0.01688223055970441, 'bull_atr_max_pct': 0.08253786456274091, 'bull_tp_mult': 1.3826777229372218, 'bull_tsl_mult': 0.6939238856746769, 'bull_time_stop': 198, 'bull_use_sma': False, 'bull_use_ema': True, 'bull_use_atr': False, 'bull_use_adx': False, 'bull_use_spike': False, 'bull_rsi_required': False, 'bear_strategy': 'breakout', 'bear_bb_std_mult': 2.3937971310262145, 'bear_rsi_os': 5, 'bear_rsi_ob': 60, 'bear_adx_thresh': 15.430840333301042, 'bear_atr_min_pct': 1.7235349759194907e-05, 'bear_atr_max_pct': 0.12556511778767787, 'bear_tp_mult': 1.1628076073533142, 'bear_tsl_mult': 0.04773579718383103, 'bear_time_stop': 238, 'bear_use_sma': True, 'bear_use_ema': False, 'bear_use_atr': True, 'bear_use_adx': False, 'bear_use_spike': False, 'bear_rsi_required': False, 'sideways_strategy': 'breakout', 'sideways_bb_std_mult': 1.6336610062739017, 'sideways_rsi_os': 44, 'sideways_rsi_ob': 47, 'sideways_adx_thresh': 21.813185031319428, 'sideways_atr_min_pct': 0.0032515855281769115, 'sideways_atr_max_pct': 0.04702111972676061, 'sideways_tp_mult': 2.4626680651540735, 'sideways_tsl_mult': 0.2988422239521328, 'sideways_time_stop': 128, 'sideways_use_sma': True, 'sideways_use_ema': True, 'sideways_use_atr': False, 'sideways_use_adx': False, 'sideways_use_spike': True, 'sideways_rsi_required': False}.
[I 2025-08-31 06:00:02,562] Trial 855 finished with values: [-1000000000.0, 1000000000.0] and parameters: {'p_sma': 30, 'p_std': 46, 'p_atr': 13, 'p_adx': 26, 'rsi_period': 17, 'ema1': 16, 'ema2': 20, 'slip_atr_k': 0.011641742316742608, 'slip_spread_k': 0.8460185194772344, 'spread_hl_frac': 0.000619199147401151, 'bb_std_mult': 3.4876889423284263, 'rsi_os': 49, 'rsi_ob': 73, 'vol_spike': 0.09858960222898074, 'adx_thresh': 8.754623387763765, 'atr_min_pct': 0.008634542943439794, 'atr_max_pct': 0.11878033538246674, 'tp_mult': 2.121567976554413, 'tsl_mult': 0.4510909490512015, 'strategy': 'mean_reversion', 'time_stop': 20, 'use_sma': True, 'use_atr': True, 'use_adx': False, 'use_ema': False, 'use_spike': False, 'rsi_required': True, 'edge_k': 0.9308127203674204, 'edge_cap': 0.3605511741953757, 'bull_strategy': 'breakout', 'bull_bb_std_mult': 1.6998912513321847, 'bull_rsi_os': 33, 'bull_rsi_ob': 71, 'bull_adx_thresh': 33.23076515538926, 'bull_atr_min_pct': 0.016915714742896035, 'bull_atr_max_pct': 0.08217277199162237, 'bull_tp_mult': 1.362621697787108, 'bull_tsl_mult': 0.690085007238839, 'bull_time_stop': 199, 'bull_use_sma': False, 'bull_use_ema': True, 'bull_use_atr': False, 'bull_use_adx': False, 'bull_use_spike': False, 'bull_rsi_required': False, 'bear_strategy': 'breakout', 'bear_bb_std_mult': 2.3938374560337525, 'bear_rsi_os': 5, 'bear_rsi_ob': 58, 'bear_adx_thresh': 15.276764927569028, 'bear_atr_min_pct': 7.202543898108941e-05, 'bear_atr_max_pct': 0.12084707289742505, 'bear_tp_mult': 1.1707264279090577, 'bear_tsl_mult': 0.050742457191007416, 'bear_time_stop': 238, 'bear_use_sma': False, 'bear_use_ema': False, 'bear_use_atr': True, 'bear_use_adx': False, 'bear_use_spike': False, 'bear_rsi_required': False, 'sideways_strategy': 'breakout', 'sideways_bb_std_mult': 1.697509582829059, 'sideways_rsi_os': 45, 'sideways_rsi_ob': 47, 'sideways_adx_thresh': 21.655887633594652, 'sideways_atr_min_pct': 0.0034118547795782416, 'sideways_atr_max_pct': 0.04605330998421507, 'sideways_tp_mult': 2.339930247945144, 'sideways_tsl_mult': 0.30681566481899075, 'sideways_time_stop': 119, 'sideways_use_sma': True, 'sideways_use_ema': True, 'sideways_use_atr': False, 'sideways_use_adx': False, 'sideways_use_spike': True, 'sideways_rsi_required': False}.
[I 2025-08-31 06:00:50,729] Trial 858 finished with values: [-1000000000.0, 1000000000.0] and parameters: {'p_sma': 30, 'p_std': 47, 'p_atr': 13, 'p_adx': 25, 'rsi_period': 51, 'ema1': 16, 'ema2': 20, 'slip_atr_k': 0.013110200658556745, 'slip_spread_k': 0.8713258278457255, 'spread_hl_frac': 0.00015619880608806064, 'bb_std_mult': 3.5827690795978406, 'rsi_os': 46, 'rsi_ob': 72, 'vol_spike': 0.10545363088336233, 'adx_thresh': 8.10393991932868, 'atr_min_pct': 0.008728350741955998, 'atr_max_pct': 0.11909774718368195, 'tp_mult': 2.0951723377251232, 'tsl_mult': 0.4465206834028194, 'strategy': 'mean_reversion', 'time_stop': 20, 'use_sma': True, 'use_atr': True, 'use_adx': True, 'use_ema': False, 'use_spike': False, 'rsi_required': True, 'edge_k': 0.9168558014890185, 'edge_cap': 0.3602852774351452, 'bull_strategy': 'breakout', 'bull_bb_std_mult': 1.7098678919336847, 'bull_rsi_os': 34, 'bull_rsi_ob': 70, 'bull_adx_thresh': 33.33512175372985, 'bull_atr_min_pct': 0.0166707030717717, 'bull_atr_max_pct': 0.0869560782519275, 'bull_tp_mult': 1.386647405738475, 'bull_tsl_mult': 0.7254610382035779, 'bull_time_stop': 195, 'bull_use_sma': True, 'bull_use_ema': True, 'bull_use_atr': False, 'bull_use_adx': False, 'bull_use_spike': False, 'bull_rsi_required': False, 'bear_strategy': 'breakout', 'bear_bb_std_mult': 2.307560609031387, 'bear_rsi_os': 5, 'bear_rsi_ob': 60, 'bear_adx_thresh': 15.54298765175458, 'bear_atr_min_pct': 0.0014943008170823255, 'bear_atr_max_pct': 0.12702955354376722, 'bear_tp_mult': 1.1453121651798481, 'bear_tsl_mult': 0.04979147351026485, 'bear_time_stop': 253, 'bear_use_sma': True, 'bear_use_ema': False, 'bear_use_atr': True, 'bear_use_adx': False, 'bear_use_spike': False, 'bear_rsi_required': False, 'sideways_strategy': 'breakout', 'sideways_bb_std_mult': 1.6270608556674262, 'sideways_rsi_os': 45, 'sideways_rsi_ob': 48, 'sideways_adx_thresh': 21.422481715067374, 'sideways_atr_min_pct': 0.0032587765843819384, 'sideways_atr_max_pct': 0.0475436666878243, 'sideways_tp_mult': 2.471643538201393, 'sideways_tsl_mult': 0.3042005157724186, 'sideways_time_stop': 129, 'sideways_use_sma': True, 'sideways_use_ema': True, 'sideways_use_atr': True, 'sideways_use_adx': False, 'sideways_use_spike': False, 'sideways_rsi_required': False}.
[I 2025-08-31 06:00:51,204] Trial 857 finished with values: [-1000000000.0, 1000000000.0] and parameters: {'p_sma': 30, 'p_std': 45, 'p_atr': 13, 'p_adx': 26, 'rsi_period': 17, 'ema1': 16, 'ema2': 20, 'slip_atr_k': 0.013293493950795897, 'slip_spread_k': 0.8785929581692815, 'spread_hl_frac': 0.00015526427475712925, 'bb_std_mult': 3.4967549886396414, 'rsi_os': 46, 'rsi_ob': 69, 'vol_spike': 0.0968830943321578, 'adx_thresh': 8.794881080707913, 'atr_min_pct': 0.008767811847480293, 'atr_max_pct': 0.11886383653636051, 'tp_mult': 2.0935779082301877, 'tsl_mult': 0.4464143188754404, 'strategy': 'mean_reversion', 'time_stop': 19, 'use_sma': True, 'use_atr': True, 'use_adx': False, 'use_ema': False, 'use_spike': False, 'rsi_required': True, 'edge_k': 0.9369647544070989, 'edge_cap': 0.3606363161358033, 'bull_strategy': 'breakout', 'bull_bb_std_mult': 1.7302570813436002, 'bull_rsi_os': 32, 'bull_rsi_ob': 72, 'bull_adx_thresh': 33.35338319471425, 'bull_atr_min_pct': 0.01720208131734048, 'bull_atr_max_pct': 0.08388569583621165, 'bull_tp_mult': 1.3204411444960238, 'bull_tsl_mult': 0.6890275409880384, 'bull_time_stop': 200, 'bull_use_sma': False, 'bull_use_ema': True, 'bull_use_atr': False, 'bull_use_adx': False, 'bull_use_spike': False, 'bull_rsi_required': False, 'bear_strategy': 'breakout', 'bear_bb_std_mult': 2.332437780057159, 'bear_rsi_os': 5, 'bear_rsi_ob': 60, 'bear_adx_thresh': 15.572398597774423, 'bear_atr_min_pct': 0.0014060678862895574, 'bear_atr_max_pct': 0.12557911107207614, 'bear_tp_mult': 1.1763316014722593, 'bear_tsl_mult': 0.02651383278327197, 'bear_time_stop': 249, 'bear_use_sma': True, 'bear_use_ema': False, 'bear_use_atr': True, 'bear_use_adx': False, 'bear_use_spike': False, 'bear_rsi_required': False, 'sideways_strategy': 'breakout', 'sideways_bb_std_mult': 1.712936713020516, 'sideways_rsi_os': 44, 'sideways_rsi_ob': 47, 'sideways_adx_thresh': 21.672853765856402, 'sideways_atr_min_pct': 0.003243973181962314, 'sideways_atr_max_pct': 0.04724484582563167, 'sideways_tp_mult': 2.337839459794692, 'sideways_tsl_mult': 0.3046012039460091, 'sideways_time_stop': 122, 'sideways_use_sma': True, 'sideways_use_ema': True, 'sideways_use_atr': False, 'sideways_use_adx': False, 'sideways_use_spike': True, 'sideways_rsi_required': False}.
[I 2025-08-31 06:00:51,766] Trial 859 finished with values: [-0.01181472533528849, 0.011783138994023558] and parameters: {'p_sma': 29, 'p_std': 45, 'p_atr': 12, 'p_adx': 25, 'rsi_period': 17, 'ema1': 16, 'ema2': 19, 'slip_atr_k': 0.012860705609791294, 'slip_spread_k': 0.8866604865493608, 'spread_hl_frac': 0.00019965167837307748, 'bb_std_mult': 3.545368176194918, 'rsi_os': 46, 'rsi_ob': 71, 'vol_spike': 0.10966436283319136, 'adx_thresh': 8.104839096401651, 'atr_min_pct': 0.00861083618873877, 'atr_max_pct': 0.11886663377528028, 'tp_mult': 2.082406971569218, 'tsl_mult': 0.4471071148691067, 'strategy': 'mean_reversion', 'time_stop': 19, 'use_sma': True, 'use_atr': True, 'use_adx': True, 'use_ema': False, 'use_spike': False, 'rsi_required': True, 'edge_k': 0.925180815069664, 'edge_cap': 0.356790990899824, 'bull_strategy': 'breakout', 'bull_bb_std_mult': 1.7291019388623, 'bull_rsi_os': 32, 'bull_rsi_ob': 70, 'bull_adx_thresh': 33.290192496921904, 'bull_atr_min_pct': 0.01685674263306576, 'bull_atr_max_pct': 0.08595973741840221, 'bull_tp_mult': 1.3310700047390507, 'bull_tsl_mult': 0.7278264092040063, 'bull_time_stop': 202, 'bull_use_sma': True, 'bull_use_ema': True, 'bull_use_atr': False, 'bull_use_adx': False, 'bull_use_spike': False, 'bull_rsi_required': False, 'bear_strategy': 'breakout', 'bear_bb_std_mult': 2.3133443919152135, 'bear_rsi_os': 5, 'bear_rsi_ob': 58, 'bear_adx_thresh': 15.642495850103778, 'bear_atr_min_pct': 0.0012372612096684717, 'bear_atr_max_pct': 0.12786233678369754, 'bear_tp_mult': 1.1261920156511267, 'bear_tsl_mult': 0.025293788822662894, 'bear_time_stop': 248, 'bear_use_sma': True, 'bear_use_ema': False, 'bear_use_atr': False, 'bear_use_adx': False, 'bear_use_spike': False, 'bear_rsi_required': False, 'sideways_strategy': 'breakout', 'sideways_bb_std_mult': 1.6063349125544941, 'sideways_rsi_os': 45, 'sideways_rsi_ob': 47, 'sideways_adx_thresh': 22.48871917575514, 'sideways_atr_min_pct': 0.0020370393687354892, 'sideways_atr_max_pct': 0.047184847555811676, 'sideways_tp_mult': 2.3877082824198985, 'sideways_tsl_mult': 0.2745519398388881, 'sideways_time_stop': 115, 'sideways_use_sma': True, 'sideways_use_ema': True, 'sideways_use_atr': True, 'sideways_use_adx': False, 'sideways_use_spike': False, 'sideways_rsi_required': False}.
[I 2025-08-31 06:00:52,928] Trial 860 finished with values: [-0.015119857947575421, 0.015056927136937896] and parameters: {'p_sma': 28, 'p_std': 45, 'p_atr': 12, 'p_adx': 25, 'rsi_period': 18, 'ema1': 17, 'ema2': 19, 'slip_atr_k': 0.015566840477982898, 'slip_spread_k': 0.8789272726010776, 'spread_hl_frac': 0.000570066017581364, 'bb_std_mult': 3.598664327341513, 'rsi_os': 46, 'rsi_ob': 72, 'vol_spike': 0.10422069671309793, 'adx_thresh': 7.922019627810307, 'atr_min_pct': 0.00793327029173284, 'atr_max_pct': 0.11889794916685721, 'tp_mult': 2.17761173475715, 'tsl_mult': 0.4400246495527225, 'strategy': 'mean_reversion', 'time_stop': 21, 'use_sma': True, 'use_atr': True, 'use_adx': True, 'use_ema': False, 'use_spike': False, 'rsi_required': True, 'edge_k': 0.9200988020598829, 'edge_cap': 0.3539222307437911, 'bull_strategy': 'breakout', 'bull_bb_std_mult': 1.7472023836835973, 'bull_rsi_os': 34, 'bull_rsi_ob': 69, 'bull_adx_thresh': 33.339289954134074, 'bull_atr_min_pct': 0.016727077584943875, 'bull_atr_max_pct': 0.08691818273992456, 'bull_tp_mult': 1.3291816667100154, 'bull_tsl_mult': 0.7239072942706882, 'bull_time_stop': 195, 'bull_use_sma': True, 'bull_use_ema': True, 'bull_use_atr': False, 'bull_use_adx': False, 'bull_use_spike': False, 'bull_rsi_required': False, 'bear_strategy': 'breakout', 'bear_bb_std_mult': 2.290089182904913, 'bear_rsi_os': 5, 'bear_rsi_ob': 58, 'bear_adx_thresh': 15.624833593420785, 'bear_atr_min_pct': 0.0014685577689612433, 'bear_atr_max_pct': 0.1263930279132761, 'bear_tp_mult': 1.127781365585537, 'bear_tsl_mult': 0.061181964035506915, 'bear_time_stop': 250, 'bear_use_sma': True, 'bear_use_ema': False, 'bear_use_atr': False, 'bear_use_adx': False, 'bear_use_spike': False, 'bear_rsi_required': False, 'sideways_strategy': 'breakout', 'sideways_bb_std_mult': 1.609515130347433, 'sideways_rsi_os': 43, 'sideways_rsi_ob': 47, 'sideways_adx_thresh': 21.24143897668328, 'sideways_atr_min_pct': 0.001885160295812903, 'sideways_atr_max_pct': 0.047727546038398905, 'sideways_tp_mult': 2.3889372701689586, 'sideways_tsl_mult': 0.26401826566785613, 'sideways_time_stop': 131, 'sideways_use_sma': True, 'sideways_use_ema': True, 'sideways_use_atr': True, 'sideways_use_adx': False, 'sideways_use_spike': False, 'sideways_rsi_required': False}.
[I 2025-08-31 06:01:47,034] Trial 861 finished with values: [-0.01730958695487861, 0.017260652600435723] and parameters: {'p_sma': 28, 'p_std': 45, 'p_atr': 12, 'p_adx': 24, 'rsi_period': 17, 'ema1': 17, 'ema2': 19, 'slip_atr_k': 0.2325797232987037, 'slip_spread_k': 0.8989141300124912, 'spread_hl_frac': 0.00024016167402881239, 'bb_std_mult': 3.5567344714001186, 'rsi_os': 46, 'rsi_ob': 71, 'vol_spike': 0.10492558589690294, 'adx_thresh': 8.292844650671121, 'atr_min_pct': 0.00821362708178485, 'atr_max_pct': 0.1201697436374016, 'tp_mult': 2.0619478348961175, 'tsl_mult': 0.4340478124441702, 'strategy': 'mean_reversion', 'time_stop': 21, 'use_sma': True, 'use_atr': True, 'use_adx': False, 'use_ema': True, 'use_spike': False, 'rsi_required': True, 'edge_k': 0.9098743516884722, 'edge_cap': 0.3520726997176923, 'bull_strategy': 'breakout', 'bull_bb_std_mult': 1.613646308424619, 'bull_rsi_os': 34, 'bull_rsi_ob': 69, 'bull_adx_thresh': 34.387767635437946, 'bull_atr_min_pct': 0.01661881537202537, 'bull_atr_max_pct': 0.08491435724168196, 'bull_tp_mult': 1.320290607647107, 'bull_tsl_mult': 0.7201636879947627, 'bull_time_stop': 200, 'bull_use_sma': False, 'bull_use_ema': True, 'bull_use_atr': False, 'bull_use_adx': False, 'bull_use_spike': True, 'bull_rsi_required': False, 'bear_strategy': 'breakout', 'bear_bb_std_mult': 2.305735589575568, 'bear_rsi_os': 6, 'bear_rsi_ob': 59, 'bear_adx_thresh': 15.69283045214394, 'bear_atr_min_pct': 0.0014933780925355106, 'bear_atr_max_pct': 0.12315304376286852, 'bear_tp_mult': 1.1181908686073774, 'bear_tsl_mult': 0.029859517991775983, 'bear_time_stop': 248, 'bear_use_sma': True, 'bear_use_ema': False, 'bear_use_atr': False, 'bear_use_adx': False, 'bear_use_spike': False, 'bear_rsi_required': False, 'sideways_strategy': 'breakout', 'sideways_bb_std_mult': 1.5819276757874159, 'sideways_rsi_os': 43, 'sideways_rsi_ob': 47, 'sideways_adx_thresh': 22.312842644750017, 'sideways_atr_min_pct': 0.002298901955914134, 'sideways_atr_max_pct': 0.04777165085679655, 'sideways_tp_mult': 2.3965514089321656, 'sideways_tsl_mult': 0.28176207588227853, 'sideways_time_stop': 115, 'sideways_use_sma': True, 'sideways_use_ema': True, 'sideways_use_atr': False, 'sideways_use_adx': False, 'sideways_use_spike': True, 'sideways_rsi_required': False}.
[I 2025-08-31 06:01:47,015] Trial 862 finished with values: [-0.010413599071135149, 0.010377542360067604] and parameters: {'p_sma': 27, 'p_std': 45, 'p_atr': 12, 'p_adx': 25, 'rsi_period': 62, 'ema1': 17, 'ema2': 19, 'slip_atr_k': 0.06735518466322789, 'slip_spread_k': 0.8889995734918367, 'spread_hl_frac': 0.0010464431650853815, 'bb_std_mult': 3.553051485847247, 'rsi_os': 48, 'rsi_ob': 71, 'vol_spike': 0.10672271309842958, 'adx_thresh': 7.643142757852516, 'atr_min_pct': 0.007865118389524169, 'atr_max_pct': 0.12022735916937102, 'tp_mult': 2.1617530084184473, 'tsl_mult': 0.40431467930949, 'strategy': 'mean_reversion', 'time_stop': 18, 'use_sma': True, 'use_atr': True, 'use_adx': True, 'use_ema': True, 'use_spike': False, 'rsi_required': True, 'edge_k': 0.895196278449427, 'edge_cap': 0.3489459389937259, 'bull_strategy': 'breakout', 'bull_bb_std_mult': 1.7802952827343392, 'bull_rsi_os': 34, 'bull_rsi_ob': 69, 'bull_adx_thresh': 34.41419612497897, 'bull_atr_min_pct': 0.01587627959542905, 'bull_atr_max_pct': 0.08793078443330572, 'bull_tp_mult': 1.324469139034052, 'bull_tsl_mult': 0.7230221056510329, 'bull_time_stop': 204, 'bull_use_sma': True, 'bull_use_ema': True, 'bull_use_atr': False, 'bull_use_adx': False, 'bull_use_spike': True, 'bull_rsi_required': False, 'bear_strategy': 'breakout', 'bear_bb_std_mult': 2.292634817071594, 'bear_rsi_os': 6, 'bear_rsi_ob': 58, 'bear_adx_thresh': 14.402100784870479, 'bear_atr_min_pct': 0.0008313168079121172, 'bear_atr_max_pct': 0.12201665141590877, 'bear_tp_mult': 1.1170089536454613, 'bear_tsl_mult': 0.02175321616648119, 'bear_time_stop': 249, 'bear_use_sma': True, 'bear_use_ema': False, 'bear_use_atr': False, 'bear_use_adx': False, 'bear_use_spike': False, 'bear_rsi_required': False, 'sideways_strategy': 'breakout', 'sideways_bb_std_mult': 1.5909337587708139, 'sideways_rsi_os': 43, 'sideways_rsi_ob': 47, 'sideways_adx_thresh': 22.401092767810624, 'sideways_atr_min_pct': 0.001946618898312098, 'sideways_atr_max_pct': 0.04353511132193849, 'sideways_tp_mult': 2.409102050352721, 'sideways_tsl_mult': 0.2710796258743496, 'sideways_time_stop': 115, 'sideways_use_sma': True, 'sideways_use_ema': True, 'sideways_use_atr': True, 'sideways_use_adx': False, 'sideways_use_spike': False, 'sideways_rsi_required': False}.
[I 2025-08-31 06:01:49,103] Trial 864 finished with values: [-0.008053155244738264, 0.008085341195564076] and parameters: {'p_sma': 28, 'p_std': 46, 'p_atr': 12, 'p_adx': 24, 'rsi_period': 17, 'ema1': 17, 'ema2': 21, 'slip_atr_k': 0.012887417478821233, 'slip_spread_k': 0.8372336460811426, 'spread_hl_frac': 0.001297163827745685, 'bb_std_mult': 3.5179473516397177, 'rsi_os': 48, 'rsi_ob': 69, 'vol_spike': 0.0919043557684925, 'adx_thresh': 7.340717930783155, 'atr_min_pct': 0.008272697292693015, 'atr_max_pct': 0.11962535987872315, 'tp_mult': 2.151193034285295, 'tsl_mult': 0.400003863818476, 'strategy': 'mean_reversion', 'time_stop': 19, 'use_sma': True, 'use_atr': True, 'use_adx': False, 'use_ema': True, 'use_spike': False, 'rsi_required': True, 'edge_k': 0.9590139011702282, 'edge_cap': 0.3856184913626063, 'bull_strategy': 'breakout', 'bull_bb_std_mult': 1.5859662843524815, 'bull_rsi_os': 34, 'bull_rsi_ob': 72, 'bull_adx_thresh': 34.27991057143568, 'bull_atr_min_pct': 0.015857980670122913, 'bull_atr_max_pct': 0.08779415359527766, 'bull_tp_mult': 1.3926115611254823, 'bull_tsl_mult': 0.7095021537783989, 'bull_time_stop': 203, 'bull_use_sma': False, 'bull_use_ema': True, 'bull_use_atr': False, 'bull_use_adx': False, 'bull_use_spike': True, 'bull_rsi_required': False, 'bear_strategy': 'breakout', 'bear_bb_std_mult': 2.4437697703320045, 'bear_rsi_os': 6, 'bear_rsi_ob': 59, 'bear_adx_thresh': 14.435621255998619, 'bear_atr_min_pct': 0.0007988933527893272, 'bear_atr_max_pct': 0.12172537559236021, 'bear_tp_mult': 1.0942719794351117, 'bear_tsl_mult': 0.061363027376846874, 'bear_time_stop': 245, 'bear_use_sma': False, 'bear_use_ema': False, 'bear_use_atr': True, 'bear_use_adx': False, 'bear_use_spike': False, 'bear_rsi_required': False, 'sideways_strategy': 'breakout', 'sideways_bb_std_mult': 1.746700394062545, 'sideways_rsi_os': 43, 'sideways_rsi_ob': 46, 'sideways_adx_thresh': 22.47672284688855, 'sideways_atr_min_pct': 0.002613714344641834, 'sideways_atr_max_pct': 0.04367458057539306, 'sideways_tp_mult': 2.2837541859411883, 'sideways_tsl_mult': 0.2877372871263138, 'sideways_time_stop': 125, 'sideways_use_sma': True, 'sideways_use_ema': True, 'sideways_use_atr': False, 'sideways_use_adx': False, 'sideways_use_spike': True, 'sideways_rsi_required': False}.
