[I 2025-08-31 05:01:04,819] Trial 530 finished with values: [-1000000000.0, 1000000000.0] and parameters: {'p_sma': 52, 'p_std': 56, 'p_atr': 29, 'p_adx': 7, 'rsi_period': 18, 'ema1': 13, 'ema2': 26, 'slip_atr_k': 0.023960279639499336, 'slip_spread_k': 0.13530204763992995, 'spread_hl_frac': 0.004478862777611201, 'bb_std_mult': 1.0791464586119932, 'rsi_os': 42, 'rsi_ob': 60, 'vol_spike': 0.017846801118276016, 'adx_thresh': 27.96767676218332, 'atr_min_pct': 0.00381801780901082, 'atr_max_pct': 0.04193850757614854, 'tp_mult': 2.5468126323198517, 'tsl_mult': 0.859938925803095, 'strategy': 'breakout', 'time_stop': 271, 'use_sma': False, 'use_atr': False, 'use_adx': False, 'use_ema': False, 'use_spike': True, 'rsi_required': True, 'edge_k': 0.49951372713904796, 'edge_cap': 0.9445842247347318, 'bull_strategy': 'mean_reversion', 'bull_bb_std_mult': 3.47495566299809, 'bull_rsi_os': 13, 'bull_rsi_ob': 75, 'bull_adx_thresh': 11.138065399258862, 'bull_atr_min_pct': 0.0016323099559245368, 'bull_atr_max_pct': 0.04657238572151465, 'bull_tp_mult': 1.698060320331105, 'bull_tsl_mult': 0.09731094362901832, 'bull_time_stop': 136, 'bull_use_sma': False, 'bull_use_ema': False, 'bull_use_atr': True, 'bull_use_adx': True, 'bull_use_spike': False, 'bull_rsi_required': True, 'bear_strategy': 'breakout', 'bear_bb_std_mult': 0.979375528864913, 'bear_rsi_os': 22, 'bear_rsi_ob': 48, 'bear_adx_thresh': 32.21348311996248, 'bear_atr_min_pct': 0.0168369736563017, 'bear_atr_max_pct': 0.060723180806777605, 'bear_tp_mult': 1.9099384120615914, 'bear_tsl_mult': 0.21823108096629004, 'bear_time_stop': 262, 'bear_use_sma': True, 'bear_use_ema': True, 'bear_use_atr': True, 'bear_use_adx': True, 'bear_use_spike': True, 'bear_rsi_required': True, 'sideways_strategy': 'mean_reversion', 'sideways_bb_std_mult': 0.6303123332876417, 'sideways_rsi_os': 47, 'sideways_rsi_ob': 53, 'sideways_adx_thresh': 10.008717094902305, 'sideways_atr_min_pct': 0.00593341243753558, 'sideways_atr_max_pct': 0.043185019849642306, 'sideways_tp_mult': 2.050053446030644, 'sideways_tsl_mult': 0.6298474945684757, 'sideways_time_stop': 132, 'sideways_use_sma': False, 'sideways_use_ema': False, 'sideways_use_atr': False, 'sideways_use_adx': True, 'sideways_use_spike': True, 'sideways_rsi_required': True}.
[I 2025-08-31 05:01:05,258] Trial 531 finished with values: [-0.02435254823888866, 0.024274141411690316] and parameters: {'p_sma': 58, 'p_std': 18, 'p_atr': 14, 'p_adx': 23, 'rsi_period': 72, 'ema1': 17, 'ema2': 24, 'slip_atr_k': 0.24076318759459772, 'slip_spread_k': 0.11048061664375092, 'spread_hl_frac': 0.011191331328311502, 'bb_std_mult': 1.8491557446833502, 'rsi_os': 9, 'rsi_ob': 70, 'vol_spike': 0.13735375976183828, 'adx_thresh': 8.989340604729549, 'atr_min_pct': 0.023845454390082694, 'atr_max_pct': 0.06380275911663383, 'tp_mult': 2.7344699090299813, 'tsl_mult': 0.8855378156921409, 'strategy': 'mean_reversion', 'time_stop': 248, 'use_sma': False, 'use_atr': False, 'use_adx': True, 'use_ema': False, 'use_spike': True, 'rsi_required': True, 'edge_k': 1.473881791871226, 'edge_cap': 0.9275876606533646, 'bull_strategy': 'mean_reversion', 'bull_bb_std_mult': 3.3491626912819603, 'bull_rsi_os': 51, 'bull_rsi_ob': 74, 'bull_adx_thresh': 10.240008644174653, 'bull_atr_min_pct': 0.0018030509482761636, 'bull_atr_max_pct': 0.0460582608924223, 'bull_tp_mult': 1.6867676896214532, 'bull_tsl_mult': 0.5480145044847313, 'bull_time_stop': 93, 'bull_use_sma': True, 'bull_use_ema': False, 'bull_use_atr': True, 'bull_use_adx': False, 'bull_use_spike': False, 'bull_rsi_required': False, 'bear_strategy': 'breakout', 'bear_bb_std_mult': 1.0723125338775312, 'bear_rsi_os': 24, 'bear_rsi_ob': 48, 'bear_adx_thresh': 14.195008131206498, 'bear_atr_min_pct': 0.0025715845200834572, 'bear_atr_max_pct': 0.039212025503443514, 'bear_tp_mult': 2.6392590855663967, 'bear_tsl_mult': 0.7786479198186312, 'bear_time_stop': 181, 'bear_use_sma': False, 'bear_use_ema': True, 'bear_use_atr': False, 'bear_use_adx': False, 'bear_use_spike': True, 'bear_rsi_required': True, 'sideways_strategy': 'breakout', 'sideways_bb_std_mult': 0.9046244859584114, 'sideways_rsi_os': 42, 'sideways_rsi_ob': 53, 'sideways_adx_thresh': 27.331284720081847, 'sideways_atr_min_pct': 0.013968182372706053, 'sideways_atr_max_pct': 0.09424613657163707, 'sideways_tp_mult': 1.6208382430633512, 'sideways_tsl_mult': 0.6102968555652968, 'sideways_time_stop': 73, 'sideways_use_sma': False, 'sideways_use_ema': True, 'sideways_use_atr': True, 'sideways_use_adx': True, 'sideways_use_spike': False, 'sideways_rsi_required': False}.
[I 2025-08-31 05:01:50,195] Trial 533 finished with values: [-0.01814113156579822, 0.01807615773822902] and parameters: {'p_sma': 52, 'p_std': 18, 'p_atr': 23, 'p_adx': 7, 'rsi_period': 30, 'ema1': 11, 'ema2': 24, 'slip_atr_k': 0.027540135735796462, 'slip_spread_k': 0.10754944177735584, 'spread_hl_frac': 0.004730016797908292, 'bb_std_mult': 1.8403821666415723, 'rsi_os': 29, 'rsi_ob': 70, 'vol_spike': 0.0182618479817315, 'adx_thresh': 22.51915116407345, 'atr_min_pct': 0.025088674133156623, 'atr_max_pct': 0.08808564534787416, 'tp_mult': 2.725459071207672, 'tsl_mult': 0.8605923444680316, 'strategy': 'mean_reversion', 'time_stop': 43, 'use_sma': True, 'use_atr': True, 'use_adx': True, 'use_ema': True, 'use_spike': False, 'rsi_required': True, 'edge_k': 1.7478675799351713, 'edge_cap': 0.9640104641182643, 'bull_strategy': 'mean_reversion', 'bull_bb_std_mult': 1.6670234572667344, 'bull_rsi_os': 16, 'bull_rsi_ob': 74, 'bull_adx_thresh': 12.237791140209602, 'bull_atr_min_pct': 0.001622068802204295, 'bull_atr_max_pct': 0.04656812079807418, 'bull_tp_mult': 2.667332325876133, 'bull_tsl_mult': 0.8599509069791416, 'bull_time_stop': 209, 'bull_use_sma': True, 'bull_use_ema': False, 'bull_use_atr': False, 'bull_use_adx': False, 'bull_use_spike': True, 'bull_rsi_required': False, 'bear_strategy': 'breakout', 'bear_bb_std_mult': 1.0261912999655847, 'bear_rsi_os': 10, 'bear_rsi_ob': 78, 'bear_adx_thresh': 21.534370005751153, 'bear_atr_min_pct': 0.02878613064947898, 'bear_atr_max_pct': 0.04551737520860976, 'bear_tp_mult': 2.396063499370774, 'bear_tsl_mult': 0.2301617957491638, 'bear_time_stop': 183, 'bear_use_sma': False, 'bear_use_ema': True, 'bear_use_atr': False, 'bear_use_adx': False, 'bear_use_spike': True, 'bear_rsi_required': True, 'sideways_strategy': 'breakout', 'sideways_bb_std_mult': 2.889991306432364, 'sideways_rsi_os': 41, 'sideways_rsi_ob': 54, 'sideways_adx_thresh': 6.1977706566311515, 'sideways_atr_min_pct': 0.014188541477054797, 'sideways_atr_max_pct': 0.11385239587108988, 'sideways_tp_mult': 1.322182357336089, 'sideways_tsl_mult': 0.6090501165332494, 'sideways_time_stop': 203, 'sideways_use_sma': False, 'sideways_use_ema': True, 'sideways_use_atr': True, 'sideways_use_adx': False, 'sideways_use_spike': False, 'sideways_rsi_required': False}.
[I 2025-08-31 05:01:50,604] Trial 536 finished with values: [-1000000000.0, 1000000000.0] and parameters: {'p_sma': 17, 'p_std': 6, 'p_atr': 26, 'p_adx': 16, 'rsi_period': 21, 'ema1': 15, 'ema2': 32, 'slip_atr_k': 0.02718268915331876, 'slip_spread_k': 0.05488098759094685, 'spread_hl_frac': 0.022134767784789823, 'bb_std_mult': 3.2826095079584734, 'rsi_os': 17, 'rsi_ob': 68, 'vol_spike': 0.11447151789931956, 'adx_thresh': 10.223996309752676, 'atr_min_pct': 0.023237182270342393, 'atr_max_pct': 0.12959870795002165, 'tp_mult': 2.1628540114856767, 'tsl_mult': 0.2213344943073397, 'strategy': 'breakout', 'time_stop': 46, 'use_sma': True, 'use_atr': True, 'use_adx': False, 'use_ema': True, 'use_spike': False, 'rsi_required': False, 'edge_k': 1.7908230972394776, 'edge_cap': 0.9654324001161516, 'bull_strategy': 'breakout', 'bull_bb_std_mult': 2.863819573963577, 'bull_rsi_os': 16, 'bull_rsi_ob': 58, 'bull_adx_thresh': 12.160618501918877, 'bull_atr_min_pct': 0.006137598276211924, 'bull_atr_max_pct': 0.04263710621113595, 'bull_tp_mult': 2.683476995787008, 'bull_tsl_mult': 0.8902117999814133, 'bull_time_stop': 119, 'bull_use_sma': False, 'bull_use_ema': False, 'bull_use_atr': False, 'bull_use_adx': True, 'bull_use_spike': True, 'bull_rsi_required': True, 'bear_strategy': 'mean_reversion', 'bear_bb_std_mult': 0.5567054655030983, 'bear_rsi_os': 7, 'bear_rsi_ob': 61, 'bear_adx_thresh': 19.854335149854712, 'bear_atr_min_pct': 0.029989534569040008, 'bear_atr_max_pct': 0.04617209308978442, 'bear_tp_mult': 1.6116436118421693, 'bear_tsl_mult': 0.1857861897658697, 'bear_time_stop': 300, 'bear_use_sma': True, 'bear_use_ema': True, 'bear_use_atr': True, 'bear_use_adx': True, 'bear_use_spike': False, 'bear_rsi_required': False, 'sideways_strategy': 'mean_reversion', 'sideways_bb_std_mult': 1.192406924665725, 'sideways_rsi_os': 24, 'sideways_rsi_ob': 56, 'sideways_adx_thresh': 11.900137712985202, 'sideways_atr_min_pct': 0.012035244488233225, 'sideways_atr_max_pct': 0.11451491440635822, 'sideways_tp_mult': 1.3140735286091998, 'sideways_tsl_mult': 0.6491067139052566, 'sideways_time_stop': 33, 'sideways_use_sma': True, 'sideways_use_ema': False, 'sideways_use_atr': False, 'sideways_use_adx': False, 'sideways_use_spike': True, 'sideways_rsi_required': True}.
[I 2025-08-31 05:01:50,989] Trial 534 finished with values: [-0.012156626938501724, 0.012100519013751466] and parameters: {'p_sma': 52, 'p_std': 18, 'p_atr': 28, 'p_adx': 16, 'rsi_period': 59, 'ema1': 16, 'ema2': 11, 'slip_atr_k': 0.024956168940772565, 'slip_spread_k': 0.1350918928988231, 'spread_hl_frac': 0.022070964134597856, 'bb_std_mult': 3.2969138124311854, 'rsi_os': 29, 'rsi_ob': 60, 'vol_spike': 0.1978535602962388, 'adx_thresh': 11.840406178827017, 'atr_min_pct': 0.021150770352757784, 'atr_max_pct': 0.12165849035202972, 'tp_mult': 2.4874561672543645, 'tsl_mult': 0.880611693058369, 'strategy': 'breakout', 'time_stop': 218, 'use_sma': True, 'use_atr': True, 'use_adx': False, 'use_ema': True, 'use_spike': False, 'rsi_required': True, 'edge_k': 1.4593187763088913, 'edge_cap': 0.49362891406458076, 'bull_strategy': 'mean_reversion', 'bull_bb_std_mult': 3.365843687480078, 'bull_rsi_os': 16, 'bull_rsi_ob': 77, 'bull_adx_thresh': 11.936663487124894, 'bull_atr_min_pct': 0.0017386818410972187, 'bull_atr_max_pct': 0.0665897428386351, 'bull_tp_mult': 1.5979444934822167, 'bull_tsl_mult': 0.9363346639251855, 'bull_time_stop': 133, 'bull_use_sma': False, 'bull_use_ema': False, 'bull_use_atr': False, 'bull_use_adx': True, 'bull_use_spike': True, 'bull_rsi_required': True, 'bear_strategy': 'mean_reversion', 'bear_bb_std_mult': 0.5477948844039024, 'bear_rsi_os': 31, 'bear_rsi_ob': 78, 'bear_adx_thresh': 19.900750748233236, 'bear_atr_min_pct': 0.023223703759212917, 'bear_atr_max_pct': 0.03355906308619536, 'bear_tp_mult': 2.7524016147938437, 'bear_tsl_mult': 0.1864829440181458, 'bear_time_stop': 220, 'bear_use_sma': True, 'bear_use_ema': True, 'bear_use_atr': True, 'bear_use_adx': True, 'bear_use_spike': False, 'bear_rsi_required': True, 'sideways_strategy': 'mean_reversion', 'sideways_bb_std_mult': 0.9174219183805861, 'sideways_rsi_os': 40, 'sideways_rsi_ob': 56, 'sideways_adx_thresh': 12.062580849370104, 'sideways_atr_min_pct': 0.014121794311862446, 'sideways_atr_max_pct': 0.050608841424800086, 'sideways_tp_mult': 1.5198938042313903, 'sideways_tsl_mult': 0.6513609871994934, 'sideways_time_stop': 271, 'sideways_use_sma': True, 'sideways_use_ema': False, 'sideways_use_atr': False, 'sideways_use_adx': False, 'sideways_use_spike': True, 'sideways_rsi_required': True}.
[I 2025-08-31 05:01:51,304] Trial 535 finished with values: [-1000000000.0, 1000000000.0] and parameters: {'p_sma': 58, 'p_std': 18, 'p_atr': 25, 'p_adx': 8, 'rsi_period': 21, 'ema1': 23, 'ema2': 25, 'slip_atr_k': 0.21832295732815668, 'slip_spread_k': 0.04638498062037145, 'spread_hl_frac': 0.011187974545440578, 'bb_std_mult': 1.8432332396439954, 'rsi_os': 17, 'rsi_ob': 68, 'vol_spike': 0.008869300800171748, 'adx_thresh': 22.49692928500383, 'atr_min_pct': 0.010377487267549092, 'atr_max_pct': 0.06458281766846277, 'tp_mult': 2.1491959641605947, 'tsl_mult': 0.886777432794958, 'strategy': 'mean_reversion', 'time_stop': 43, 'use_sma': True, 'use_atr': True, 'use_adx': False, 'use_ema': True, 'use_spike': False, 'rsi_required': False, 'edge_k': 1.4662721498768911, 'edge_cap': 0.965581078505448, 'bull_strategy': 'breakout', 'bull_bb_std_mult': 0.6717772742976118, 'bull_rsi_os': 16, 'bull_rsi_ob': 58, 'bull_adx_thresh': 12.209051967309849, 'bull_atr_min_pct': 0.0031746717459577196, 'bull_atr_max_pct': 0.06731323442025726, 'bull_tp_mult': 1.5999607394489215, 'bull_tsl_mult': 0.5382586273917872, 'bull_time_stop': 211, 'bull_use_sma': False, 'bull_use_ema': False, 'bull_use_atr': False, 'bull_use_adx': True, 'bull_use_spike': True, 'bull_rsi_required': True, 'bear_strategy': 'mean_reversion', 'bear_bb_std_mult': 1.0640732730799776, 'bear_rsi_os': 30, 'bear_rsi_ob': 45, 'bear_adx_thresh': 19.979225303996014, 'bear_atr_min_pct': 0.023345013899662297, 'bear_atr_max_pct': 0.016380199759411906, 'bear_tp_mult': 1.734579826898404, 'bear_tsl_mult': 0.78435280167154, 'bear_time_stop': 181, 'bear_use_sma': True, 'bear_use_ema': True, 'bear_use_atr': False, 'bear_use_adx': False, 'bear_use_spike': False, 'bear_rsi_required': False, 'sideways_strategy': 'breakout', 'sideways_bb_std_mult': 1.1758301138876632, 'sideways_rsi_os': 24, 'sideways_rsi_ob': 56, 'sideways_adx_thresh': 13.889315028149216, 'sideways_atr_min_pct': 0.014215100467642468, 'sideways_atr_max_pct': 0.1146470499958019, 'sideways_tp_mult': 1.5164617268749765, 'sideways_tsl_mult': 0.6452726019078437, 'sideways_time_stop': 70, 'sideways_use_sma': True, 'sideways_use_ema': False, 'sideways_use_atr': False, 'sideways_use_adx': False, 'sideways_use_spike': True, 'sideways_rsi_required': True}.
[I 2025-08-31 05:02:35,012] Trial 537 finished with values: [-1000000000.0, 1000000000.0] and parameters: {'p_sma': 56, 'p_std': 16, 'p_atr': 25, 'p_adx': 16, 'rsi_period': 59, 'ema1': 10, 'ema2': 38, 'slip_atr_k': 0.222668252494593, 'slip_spread_k': 0.04995691954042549, 'spread_hl_frac': 0.01286360988841893, 'bb_std_mult': 3.30108967331802, 'rsi_os': 28, 'rsi_ob': 61, 'vol_spike': 0.11659457466183407, 'adx_thresh': 31.14712883269089, 'atr_min_pct': 0.023300463749412314, 'atr_max_pct': 0.12300587019608283, 'tp_mult': 1.2866058846067774, 'tsl_mult': 0.08136048169920507, 'strategy': 'breakout', 'time_stop': 220, 'use_sma': True, 'use_atr': True, 'use_adx': False, 'use_ema': True, 'use_spike': False, 'rsi_required': False, 'edge_k': 1.9169270426475693, 'edge_cap': 0.9984026428384521, 'bull_strategy': 'breakout', 'bull_bb_std_mult': 3.413723814538003, 'bull_rsi_os': 27, 'bull_rsi_ob': 77, 'bull_adx_thresh': 11.517223264761295, 'bull_atr_min_pct': 0.002462250622409316, 'bull_atr_max_pct': 0.03784460360125526, 'bull_tp_mult': 1.6011413276707445, 'bull_tsl_mult': 0.9432108657991, 'bull_time_stop': 142, 'bull_use_sma': False, 'bull_use_ema': False, 'bull_use_atr': False, 'bull_use_adx': True, 'bull_use_spike': True, 'bull_rsi_required': True, 'bear_strategy': 'mean_reversion', 'bear_bb_std_mult': 0.855416263756407, 'bear_rsi_os': 7, 'bear_rsi_ob': 95, 'bear_adx_thresh': 20.127635109055056, 'bear_atr_min_pct': 0.02633267782340195, 'bear_atr_max_pct': 0.016478085778328044, 'bear_tp_mult': 2.76196930486577, 'bear_tsl_mult': 0.010362559008974037, 'bear_time_stop': 167, 'bear_use_sma': True, 'bear_use_ema': True, 'bear_use_atr': True, 'bear_use_adx': True, 'bear_use_spike': False, 'bear_rsi_required': False, 'sideways_strategy': 'mean_reversion', 'sideways_bb_std_mult': 2.1873967691985046, 'sideways_rsi_os': 24, 'sideways_rsi_ob': 48, 'sideways_adx_thresh': 29.550850353137896, 'sideways_atr_min_pct': 0.022950630271587957, 'sideways_atr_max_pct': 0.11689410218177892, 'sideways_tp_mult': 2.1045176920109028, 'sideways_tsl_mult': 0.6507665824153278, 'sideways_time_stop': 32, 'sideways_use_sma': True, 'sideways_use_ema': False, 'sideways_use_atr': False, 'sideways_use_adx': False, 'sideways_use_spike': True, 'sideways_rsi_required': True}.
[I 2025-08-31 05:02:36,409] Trial 538 finished with values: [-1000000000.0, 1000000000.0] and parameters: {'p_sma': 57, 'p_std': 13, 'p_atr': 17, 'p_adx': 8, 'rsi_period': 59, 'ema1': 24, 'ema2': 42, 'slip_atr_k': 0.22031848691874212, 'slip_spread_k': 0.518894277583174, 'spread_hl_frac': 0.042372443243259214, 'bb_std_mult': 1.755927995933409, 'rsi_os': 28, 'rsi_ob': 61, 'vol_spike': 0.010516196928885918, 'adx_thresh': 12.608031635012946, 'atr_min_pct': 0.021318573742085203, 'atr_max_pct': 0.12200190178564056, 'tp_mult': 2.4825497843097413, 'tsl_mult': 0.8841613203620804, 'strategy': 'breakout', 'time_stop': 62, 'use_sma': False, 'use_atr': False, 'use_adx': False, 'use_ema': False, 'use_spike': True, 'rsi_required': False, 'edge_k': 1.4238439375091283, 'edge_cap': 0.9993673950288052, 'bull_strategy': 'breakout', 'bull_bb_std_mult': 1.8919936865900713, 'bull_rsi_os': 18, 'bull_rsi_ob': 78, 'bull_adx_thresh': 9.89187362322695, 'bull_atr_min_pct': 0.002983705419621445, 'bull_atr_max_pct': 0.10275523956802646, 'bull_tp_mult': 1.6070660213834997, 'bull_tsl_mult': 0.9248138167786086, 'bull_time_stop': 141, 'bull_use_sma': False, 'bull_use_ema': True, 'bull_use_atr': True, 'bull_use_adx': True, 'bull_use_spike': False, 'bull_rsi_required': True, 'bear_strategy': 'mean_reversion', 'bear_bb_std_mult': 0.8869341382650335, 'bear_rsi_os': 9, 'bear_rsi_ob': 45, 'bear_adx_thresh': 19.978476443951234, 'bear_atr_min_pct': 0.023401951524203927, 'bear_atr_max_pct': 0.031776140114140344, 'bear_tp_mult': 1.5054529426010377, 'bear_tsl_mult': 0.5085320867436779, 'bear_time_stop': 218, 'bear_use_sma': True, 'bear_use_ema': False, 'bear_use_atr': True, 'bear_use_adx': True, 'bear_use_spike': False, 'bear_rsi_required': True, 'sideways_strategy': 'mean_reversion', 'sideways_bb_std_mult': 2.535232819575619, 'sideways_rsi_os': 49, 'sideways_rsi_ob': 59, 'sideways_adx_thresh': 34.16120171142157, 'sideways_atr_min_pct': 0.014808268160110773, 'sideways_atr_max_pct': 0.13894725016665707, 'sideways_tp_mult': 2.0079551317885027, 'sideways_tsl_mult': 0.6453220711110953, 'sideways_time_stop': 64, 'sideways_use_sma': True, 'sideways_use_ema': False, 'sideways_use_atr': False, 'sideways_use_adx': True, 'sideways_use_spike': True, 'sideways_rsi_required': True}.
[I 2025-08-31 05:02:36,788] Trial 540 finished with values: [-1000000000.0, 1000000000.0] and parameters: {'p_sma': 56, 'p_std': 16, 'p_atr': 24, 'p_adx': 15, 'rsi_period': 59, 'ema1': 8, 'ema2': 37, 'slip_atr_k': 0.03705682160036769, 'slip_spread_k': 0.8064747219365271, 'spread_hl_frac': 0.04287146847204974, 'bb_std_mult': 1.5470550363011009, 'rsi_os': 28, 'rsi_ob': 59, 'vol_spike': 0.03826650599634938, 'adx_thresh': 11.117958056152084, 'atr_min_pct': 0.028430817130713555, 'atr_max_pct': 0.12416916930043204, 'tp_mult': 2.4907675921419923, 'tsl_mult': 0.4892677403349746, 'strategy': 'breakout', 'time_stop': 65, 'use_sma': False, 'use_atr': False, 'use_adx': False, 'use_ema': False, 'use_spike': True, 'rsi_required': False, 'edge_k': 1.4196655956966564, 'edge_cap': 0.484424108614816, 'bull_strategy': 'mean_reversion', 'bull_bb_std_mult': 3.1915978658466795, 'bull_rsi_os': 55, 'bull_rsi_ob': 87, 'bull_adx_thresh': 11.473158623765078, 'bull_atr_min_pct': 0.0024219555246333883, 'bull_atr_max_pct': 0.04302813055976842, 'bull_tp_mult': 2.375452844306808, 'bull_tsl_mult': 0.931109732436184, 'bull_time_stop': 265, 'bull_use_sma': False, 'bull_use_ema': False, 'bull_use_atr': True, 'bull_use_adx': True, 'bull_use_spike': False, 'bull_rsi_required': True, 'bear_strategy': 'mean_reversion', 'bear_bb_std_mult': 0.8746872812025055, 'bear_rsi_os': 26, 'bear_rsi_ob': 46, 'bear_adx_thresh': 24.006239803392564, 'bear_atr_min_pct': 0.005217576659405294, 'bear_atr_max_pct': 0.032946229702998306, 'bear_tp_mult': 2.7378533748410514, 'bear_tsl_mult': 0.38560160508286023, 'bear_time_stop': 218, 'bear_use_sma': True, 'bear_use_ema': True, 'bear_use_atr': True, 'bear_use_adx': True, 'bear_use_spike': True, 'bear_rsi_required': True, 'sideways_strategy': 'mean_reversion', 'sideways_bb_std_mult': 0.9134294869972289, 'sideways_rsi_os': 7, 'sideways_rsi_ob': 75, 'sideways_adx_thresh': 34.1726552093224, 'sideways_atr_min_pct': 0.00802999243474448, 'sideways_atr_max_pct': 0.05828161532315236, 'sideways_tp_mult': 1.9093275711037592, 'sideways_tsl_mult': 0.6258571616789793, 'sideways_time_stop': 67, 'sideways_use_sma': False, 'sideways_use_ema': False, 'sideways_use_atr': False, 'sideways_use_adx': True, 'sideways_use_spike': True, 'sideways_rsi_required': True}.
