[I 2025-08-31 04:29:40,493] Trial 369 finished with values: [-0.0114391333874313, 0.011396377390362394] and parameters: {'p_sma': 56, 'p_std': 7, 'p_atr': 30, 'p_adx': 30, 'rsi_period': 23, 'ema1': 13, 'ema2': 28, 'slip_atr_k': 0.008073633406145368, 'slip_spread_k': 0.03390346981979597, 'spread_hl_frac': 0.04359666581509035, 'bb_std_mult': 1.1867818030048176, 'rsi_os': 29, 'rsi_ob': 82, 'vol_spike': 0.030849187779683956, 'adx_thresh': 12.902915220035137, 'atr_min_pct': 0.003265000505774638, 'atr_max_pct': 0.13589675623202302, 'tp_mult': 2.0637669713376465, 'tsl_mult': 0.8530925323084677, 'strategy': 'mean_reversion', 'time_stop': 264, 'use_sma': False, 'use_atr': False, 'use_adx': False, 'use_ema': False, 'use_spike': True, 'rsi_required': False, 'edge_k': 1.4163603176555921, 'edge_cap': 0.8795601964456743, 'bull_strategy': 'mean_reversion', 'bull_bb_std_mult': 3.32283514823179, 'bull_rsi_os': 12, 'bull_rsi_ob': 79, 'bull_adx_thresh': 28.521962566193594, 'bull_atr_min_pct': 0.00045288318985113466, 'bull_atr_max_pct': 0.05174388204283018, 'bull_tp_mult': 1.7919770204252612, 'bull_tsl_mult': 0.09834646961691151, 'bull_time_stop': 145, 'bull_use_sma': False, 'bull_use_ema': False, 'bull_use_atr': True, 'bull_use_adx': True, 'bull_use_spike': False, 'bull_rsi_required': True, 'bear_strategy': 'mean_reversion', 'bear_bb_std_mult': 0.8246403876065952, 'bear_rsi_os': 10, 'bear_rsi_ob': 72, 'bear_adx_thresh': 27.065829331833598, 'bear_atr_min_pct': 0.006370847710832758, 'bear_atr_max_pct': 0.03949968065546462, 'bear_tp_mult': 1.521676258215368, 'bear_tsl_mult': 0.22481478778142008, 'bear_time_stop': 32, 'bear_use_sma': True, 'bear_use_ema': True, 'bear_use_atr': True, 'bear_use_adx': False, 'bear_use_spike': True, 'bear_rsi_required': True, 'sideways_strategy': 'breakout', 'sideways_bb_std_mult': 0.9458211990487289, 'sideways_rsi_os': 28, 'sideways_rsi_ob': 61, 'sideways_adx_thresh': 9.444381890313146, 'sideways_atr_min_pct': 0.01816273953527402, 'sideways_atr_max_pct': 0.12953948890628042, 'sideways_tp_mult': 1.9721624697584041, 'sideways_tsl_mult': 0.6099312987959917, 'sideways_time_stop': 17, 'sideways_use_sma': False, 'sideways_use_ema': False, 'sideways_use_atr': False, 'sideways_use_adx': True, 'sideways_use_spike': True, 'sideways_rsi_required': True}.
[I 2025-08-31 04:29:41,597] Trial 371 finished with values: [-1000000000.0, 1000000000.0] and parameters: {'p_sma': 51, 'p_std': 20, 'p_atr': 20, 'p_adx': 23, 'rsi_period': 23, 'ema1': 13, 'ema2': 58, 'slip_atr_k': 0.032598232219568195, 'slip_spread_k': 0.0823050512474929, 'spread_hl_frac': 0.012149480166916193, 'bb_std_mult': 3.5239059100819787, 'rsi_os': 29, 'rsi_ob': 48, 'vol_spike': 0.03002492074918091, 'adx_thresh': 19.44727382789603, 'atr_min_pct': 0.01575319272390974, 'atr_max_pct': 0.13479905065516315, 'tp_mult': 1.524607476275471, 'tsl_mult': 0.8638968934110495, 'strategy': 'mean_reversion', 'time_stop': 262, 'use_sma': False, 'use_atr': False, 'use_adx': False, 'use_ema': False, 'use_spike': True, 'rsi_required': False, 'edge_k': 1.4144371719260624, 'edge_cap': 0.9783003404497718, 'bull_strategy': 'mean_reversion', 'bull_bb_std_mult': 3.508725016981261, 'bull_rsi_os': 25, 'bull_rsi_ob': 74, 'bull_adx_thresh': 11.69886504672021, 'bull_atr_min_pct': 0.014772120217890171, 'bull_atr_max_pct': 0.03831962094167714, 'bull_tp_mult': 1.6818253618933086, 'bull_tsl_mult': 0.24431356780393598, 'bull_time_stop': 145, 'bull_use_sma': False, 'bull_use_ema': False, 'bull_use_atr': True, 'bull_use_adx': False, 'bull_use_spike': False, 'bull_rsi_required': True, 'bear_strategy': 'mean_reversion', 'bear_bb_std_mult': 2.7531278414748224, 'bear_rsi_os': 8, 'bear_rsi_ob': 46, 'bear_adx_thresh': 23.95703070904329, 'bear_atr_min_pct': 0.013490246843592232, 'bear_atr_max_pct': 0.08939280991766661, 'bear_tp_mult': 2.73824994331105, 'bear_tsl_mult': 0.45985849374287396, 'bear_time_stop': 137, 'bear_use_sma': False, 'bear_use_ema': True, 'bear_use_atr': True, 'bear_use_adx': True, 'bear_use_spike': True, 'bear_rsi_required': True, 'sideways_strategy': 'breakout', 'sideways_bb_std_mult': 1.0554496183366537, 'sideways_rsi_os': 26, 'sideways_rsi_ob': 53, 'sideways_adx_thresh': 12.868200278980106, 'sideways_atr_min_pct': 0.022880246431340838, 'sideways_atr_max_pct': 0.061385713671564195, 'sideways_tp_mult': 2.512675360717214, 'sideways_tsl_mult': 0.21692282430896642, 'sideways_time_stop': 8, 'sideways_use_sma': True, 'sideways_use_ema': False, 'sideways_use_atr': False, 'sideways_use_adx': True, 'sideways_use_spike': True, 'sideways_rsi_required': False}.
[I 2025-08-31 04:30:25,792] Trial 372 finished with values: [-1000000000.0, 1000000000.0] and parameters: {'p_sma': 28, 'p_std': 19, 'p_atr': 23, 'p_adx': 8, 'rsi_period': 23, 'ema1': 13, 'ema2': 25, 'slip_atr_k': 0.034283991292436825, 'slip_spread_k': 0.084536891366265, 'spread_hl_frac': 0.04343622964120797, 'bb_std_mult': 1.6607096781028536, 'rsi_os': 29, 'rsi_ob': 62, 'vol_spike': 0.02718512149811846, 'adx_thresh': 19.180824274417404, 'atr_min_pct': 0.003275803232300971, 'atr_max_pct': 0.08512815059265397, 'tp_mult': 2.5892520476805356, 'tsl_mult': 0.08147134965776759, 'strategy': 'mean_reversion', 'time_stop': 40, 'use_sma': False, 'use_atr': False, 'use_adx': False, 'use_ema': False, 'use_spike': True, 'rsi_required': False, 'edge_k': 1.4143313701263152, 'edge_cap': 0.8856838820000066, 'bull_strategy': 'mean_reversion', 'bull_bb_std_mult': 3.4504024489337186, 'bull_rsi_os': 25, 'bull_rsi_ob': 79, 'bull_adx_thresh': 27.445137624996978, 'bull_atr_min_pct': 0.0038024982219199486, 'bull_atr_max_pct': 0.03797203254152229, 'bull_tp_mult': 1.9679694746487595, 'bull_tsl_mult': 0.2510200257801444, 'bull_time_stop': 146, 'bull_use_sma': False, 'bull_use_ema': True, 'bull_use_atr': True, 'bull_use_adx': False, 'bull_use_spike': False, 'bull_rsi_required': True, 'bear_strategy': 'mean_reversion', 'bear_bb_std_mult': 1.0427029865656832, 'bear_rsi_os': 12, 'bear_rsi_ob': 84, 'bear_adx_thresh': 24.25344777561994, 'bear_atr_min_pct': 0.022248716494484733, 'bear_atr_max_pct': 0.060600563785123206, 'bear_tp_mult': 2.547887643412416, 'bear_tsl_mult': 0.27348259109501555, 'bear_time_stop': 182, 'bear_use_sma': False, 'bear_use_ema': False, 'bear_use_atr': True, 'bear_use_adx': True, 'bear_use_spike': False, 'bear_rsi_required': True, 'sideways_strategy': 'breakout', 'sideways_bb_std_mult': 1.0397365713742919, 'sideways_rsi_os': 26, 'sideways_rsi_ob': 53, 'sideways_adx_thresh': 10.193059952604028, 'sideways_atr_min_pct': 0.026646050199148667, 'sideways_atr_max_pct': 0.06812051962219329, 'sideways_tp_mult': 2.5097569767840455, 'sideways_tsl_mult': 0.6890856982328055, 'sideways_time_stop': 58, 'sideways_use_sma': True, 'sideways_use_ema': False, 'sideways_use_atr': False, 'sideways_use_adx': True, 'sideways_use_spike': True, 'sideways_rsi_required': False}.
[I 2025-08-31 04:30:26,221] Trial 373 finished with values: [-1000000000.0, 1000000000.0] and parameters: {'p_sma': 51, 'p_std': 46, 'p_atr': 19, 'p_adx': 25, 'rsi_period': 18, 'ema1': 14, 'ema2': 22, 'slip_atr_k': 0.04666317512703856, 'slip_spread_k': 0.07610765348994454, 'spread_hl_frac': 0.04710597362144811, 'bb_std_mult': 1.5421336844330287, 'rsi_os': 47, 'rsi_ob': 62, 'vol_spike': 0.02973287505806597, 'adx_thresh': 19.147085142803682, 'atr_min_pct': 0.012844123196803059, 'atr_max_pct': 0.04375647158412093, 'tp_mult': 2.5719661351114893, 'tsl_mult': 0.9999931218714169, 'strategy': 'mean_reversion', 'time_stop': 100, 'use_sma': False, 'use_atr': False, 'use_adx': False, 'use_ema': False, 'use_spike': True, 'rsi_required': False, 'edge_k': 1.5611457542460172, 'edge_cap': 0.22206365391730498, 'bull_strategy': 'mean_reversion', 'bull_bb_std_mult': 3.3166348735690825, 'bull_rsi_os': 25, 'bull_rsi_ob': 80, 'bull_adx_thresh': 7.206985593186443, 'bull_atr_min_pct': 0.011430230020050607, 'bull_atr_max_pct': 0.03409826964261586, 'bull_tp_mult': 1.7887463766657774, 'bull_tsl_mult': 0.24617715215434566, 'bull_time_stop': 146, 'bull_use_sma': False, 'bull_use_ema': True, 'bull_use_atr': True, 'bull_use_adx': False, 'bull_use_spike': False, 'bull_rsi_required': True, 'bear_strategy': 'mean_reversion', 'bear_bb_std_mult': 2.9104206255218985, 'bear_rsi_os': 43, 'bear_rsi_ob': 46, 'bear_adx_thresh': 21.843959178104342, 'bear_atr_min_pct': 0.022471539849827873, 'bear_atr_max_pct': 0.0448533834410448, 'bear_tp_mult': 2.564691917216603, 'bear_tsl_mult': 0.4374564628093374, 'bear_time_stop': 137, 'bear_use_sma': False, 'bear_use_ema': False, 'bear_use_atr': True, 'bear_use_adx': True, 'bear_use_spike': False, 'bear_rsi_required': True, 'sideways_strategy': 'breakout', 'sideways_bb_std_mult': 1.0728032192708243, 'sideways_rsi_os': 26, 'sideways_rsi_ob': 53, 'sideways_adx_thresh': 26.279013001332963, 'sideways_atr_min_pct': 0.0163101566484116, 'sideways_atr_max_pct': 0.11226322727088814, 'sideways_tp_mult': 1.8231298174968495, 'sideways_tsl_mult': 0.5072025480022853, 'sideways_time_stop': 9, 'sideways_use_sma': True, 'sideways_use_ema': False, 'sideways_use_atr': False, 'sideways_use_adx': True, 'sideways_use_spike': True, 'sideways_rsi_required': False}.
[I 2025-08-31 04:30:26,517] Trial 370 finished with values: [-1000000000.0, 1000000000.0] and parameters: {'p_sma': 51, 'p_std': 20, 'p_atr': 20, 'p_adx': 25, 'rsi_period': 23, 'ema1': 8, 'ema2': 58, 'slip_atr_k': 0.033379313488705625, 'slip_spread_k': 0.09201290573593493, 'spread_hl_frac': 0.04371811807749215, 'bb_std_mult': 1.5490086419094293, 'rsi_os': 29, 'rsi_ob': 66, 'vol_spike': 0.029054429211444598, 'adx_thresh': 5.100606307079524, 'atr_min_pct': 0.0015186782607948326, 'atr_max_pct': 0.13506420221338392, 'tp_mult': 2.5935750916000413, 'tsl_mult': 0.8671763502440271, 'strategy': 'mean_reversion', 'time_stop': 48, 'use_sma': False, 'use_atr': False, 'use_adx': False, 'use_ema': False, 'use_spike': True, 'rsi_required': False, 'edge_k': 1.543927566304432, 'edge_cap': 0.9810612303514706, 'bull_strategy': 'mean_reversion', 'bull_bb_std_mult': 3.325736562087931, 'bull_rsi_os': 12, 'bull_rsi_ob': 74, 'bull_adx_thresh': 13.836380027723624, 'bull_atr_min_pct': 0.003311690144200884, 'bull_atr_max_pct': 0.044963775377544694, 'bull_tp_mult': 1.9786354421230057, 'bull_tsl_mult': 0.8803068756459455, 'bull_time_stop': 146, 'bull_use_sma': False, 'bull_use_ema': False, 'bull_use_atr': True, 'bull_use_adx': False, 'bull_use_spike': False, 'bull_rsi_required': True, 'bear_strategy': 'mean_reversion', 'bear_bb_std_mult': 0.7444823361323127, 'bear_rsi_os': 47, 'bear_rsi_ob': 46, 'bear_adx_thresh': 21.883573156959713, 'bear_atr_min_pct': 0.024489015239026104, 'bear_atr_max_pct': 0.04490092856934598, 'bear_tp_mult': 1.5416336011375855, 'bear_tsl_mult': 0.23132148306382128, 'bear_time_stop': 198, 'bear_use_sma': False, 'bear_use_ema': True, 'bear_use_atr': True, 'bear_use_adx': True, 'bear_use_spike': True, 'bear_rsi_required': True, 'sideways_strategy': 'breakout', 'sideways_bb_std_mult': 1.0659450821057253, 'sideways_rsi_os': 26, 'sideways_rsi_ob': 91, 'sideways_adx_thresh': 7.444935848561174, 'sideways_atr_min_pct': 0.004038568787244413, 'sideways_atr_max_pct': 0.09446284492880133, 'sideways_tp_mult': 1.719028238224326, 'sideways_tsl_mult': 0.6518358833669319, 'sideways_time_stop': 60, 'sideways_use_sma': True, 'sideways_use_ema': False, 'sideways_use_atr': False, 'sideways_use_adx': True, 'sideways_use_spike': True, 'sideways_rsi_required': False}.
[I 2025-08-31 04:30:26,647] Trial 374 finished with values: [-1000000000.0, 1000000000.0] and parameters: {'p_sma': 28, 'p_std': 41, 'p_atr': 28, 'p_adx': 8, 'rsi_period': 33, 'ema1': 28, 'ema2': 31, 'slip_atr_k': 0.012482874317056853, 'slip_spread_k': 0.09131102152941789, 'spread_hl_frac': 0.030719736523354194, 'bb_std_mult': 1.6819766386468435, 'rsi_os': 32, 'rsi_ob': 62, 'vol_spike': 0.035147557392036115, 'adx_thresh': 18.036686339068176, 'atr_min_pct': 0.0053030894455357094, 'atr_max_pct': 0.1052008951999101, 'tp_mult': 2.5658926703328473, 'tsl_mult': 0.902392640946566, 'strategy': 'breakout', 'time_stop': 49, 'use_sma': False, 'use_atr': False, 'use_adx': False, 'use_ema': False, 'use_spike': True, 'rsi_required': False, 'edge_k': 0.6516817375128469, 'edge_cap': 0.9631047561960424, 'bull_strategy': 'mean_reversion', 'bull_bb_std_mult': 3.30681315060146, 'bull_rsi_os': 49, 'bull_rsi_ob': 79, 'bull_adx_thresh': 14.908886844648478, 'bull_atr_min_pct': 0.004560305180408687, 'bull_atr_max_pct': 0.03377063162684762, 'bull_tp_mult': 1.5814605922658258, 'bull_tsl_mult': 0.8843976416012616, 'bull_time_stop': 50, 'bull_use_sma': False, 'bull_use_ema': True, 'bull_use_atr': True, 'bull_use_adx': True, 'bull_use_spike': False, 'bull_rsi_required': True, 'bear_strategy': 'mean_reversion', 'bear_bb_std_mult': 0.7358129767909307, 'bear_rsi_os': 43, 'bear_rsi_ob': 46, 'bear_adx_thresh': 16.84128376056908, 'bear_atr_min_pct': 0.007296126059875532, 'bear_atr_max_pct': 0.051427167877257894, 'bear_tp_mult': 2.57739998992099, 'bear_tsl_mult': 0.8818563574177134, 'bear_time_stop': 184, 'bear_use_sma': True, 'bear_use_ema': False, 'bear_use_atr': True, 'bear_use_adx': True, 'bear_use_spike': False, 'bear_rsi_required': True, 'sideways_strategy': 'mean_reversion', 'sideways_bb_std_mult': 2.9185046446053033, 'sideways_rsi_os': 27, 'sideways_rsi_ob': 53, 'sideways_adx_thresh': 10.074670552957038, 'sideways_atr_min_pct': 0.025106211173555423, 'sideways_atr_max_pct': 0.11272927164518055, 'sideways_tp_mult': 1.5249402469215543, 'sideways_tsl_mult': 0.6925521830610104, 'sideways_time_stop': 199, 'sideways_use_sma': False, 'sideways_use_ema': False, 'sideways_use_atr': False, 'sideways_use_adx': True, 'sideways_use_spike': True, 'sideways_rsi_required': True}.
[I 2025-08-31 04:31:15,010] Trial 377 finished with values: [-1000000000.0, 1000000000.0] and parameters: {'p_sma': 56, 'p_std': 16, 'p_atr': 13, 'p_adx': 10, 'rsi_period': 29, 'ema1': 14, 'ema2': 30, 'slip_atr_k': 0.15809790762131873, 'slip_spread_k': 0.28470924480133286, 'spread_hl_frac': 0.010432318141889486, 'bb_std_mult': 2.0914650878631416, 'rsi_os': 31, 'rsi_ob': 81, 'vol_spike': 0.26007417089540563, 'adx_thresh': 24.26658999203872, 'atr_min_pct': 0.023595556828382543, 'atr_max_pct': 0.11495948846557581, 'tp_mult': 2.0498047357865716, 'tsl_mult': 0.4075055524410063, 'strategy': 'breakout', 'time_stop': 43, 'use_sma': True, 'use_atr': True, 'use_adx': False, 'use_ema': True, 'use_spike': False, 'rsi_required': False, 'edge_k': 1.774143868918098, 'edge_cap': 0.9863567288553341, 'bull_strategy': 'breakout', 'bull_bb_std_mult': 3.448049331959271, 'bull_rsi_os': 48, 'bull_rsi_ob': 77, 'bull_adx_thresh': 5.959153230909264, 'bull_atr_min_pct': 0.0025207872578824567, 'bull_atr_max_pct': 0.05110224579461718, 'bull_tp_mult': 1.8402528422200528, 'bull_tsl_mult': 0.9031412083041185, 'bull_time_stop': 263, 'bull_use_sma': False, 'bull_use_ema': False, 'bull_use_atr': False, 'bull_use_adx': True, 'bull_use_spike': True, 'bull_rsi_required': False, 'bear_strategy': 'mean_reversion', 'bear_bb_std_mult': 1.077414255101037, 'bear_rsi_os': 6, 'bear_rsi_ob': 82, 'bear_adx_thresh': 15.701699417208037, 'bear_atr_min_pct': 0.014697559107586725, 'bear_atr_max_pct': 0.04209847055385196, 'bear_tp_mult': 2.883604270459294, 'bear_tsl_mult': 0.22053333316709056, 'bear_time_stop': 32, 'bear_use_sma': True, 'bear_use_ema': True, 'bear_use_atr': True, 'bear_use_adx': True, 'bear_use_spike': True, 'bear_rsi_required': True, 'sideways_strategy': 'mean_reversion', 'sideways_bb_std_mult': 3.16187883618092, 'sideways_rsi_os': 27, 'sideways_rsi_ob': 45, 'sideways_adx_thresh': 11.579842315258986, 'sideways_atr_min_pct': 0.013912445677747565, 'sideways_atr_max_pct': 0.12052789104496127, 'sideways_tp_mult': 2.8368584827065604, 'sideways_tsl_mult': 0.7295028800610901, 'sideways_time_stop': 71, 'sideways_use_sma': False, 'sideways_use_ema': False, 'sideways_use_atr': False, 'sideways_use_adx': False, 'sideways_use_spike': True, 'sideways_rsi_required': True}.
[I 2025-08-31 04:31:15,327] Trial 378 finished with values: [-1000000000.0, 1000000000.0] and parameters: {'p_sma': 56, 'p_std': 16, 'p_atr': 24, 'p_adx': 10, 'rsi_period': 28, 'ema1': 14, 'ema2': 29, 'slip_atr_k': 0.05814686648622798, 'slip_spread_k': 0.28659383278036366, 'spread_hl_frac': 0.014221281941218487, 'bb_std_mult': 2.1188628966707315, 'rsi_os': 31, 'rsi_ob': 81, 'vol_spike': 0.020936053534993525, 'adx_thresh': 29.50458298004087, 'atr_min_pct': 0.023724543839471274, 'atr_max_pct': 0.14587999446822442, 'tp_mult': 2.067271809606346, 'tsl_mult': 0.8933341812471294, 'strategy': 'breakout', 'time_stop': 57, 'use_sma': True, 'use_atr': True, 'use_adx': False, 'use_ema': True, 'use_spike': False, 'rsi_required': False, 'edge_k': 1.4761336336733835, 'edge_cap': 0.9859506681917009, 'bull_strategy': 'breakout', 'bull_bb_std_mult': 3.4447865525296253, 'bull_rsi_os': 13, 'bull_rsi_ob': 49, 'bull_adx_thresh': 5.147462424153492, 'bull_atr_min_pct': 0.024048512210116325, 'bull_atr_max_pct': 0.07945638680260801, 'bull_tp_mult': 1.6486603719924935, 'bull_tsl_mult': 0.9007515630483197, 'bull_time_stop': 126, 'bull_use_sma': False, 'bull_use_ema': False, 'bull_use_atr': False, 'bull_use_adx': True, 'bull_use_spike': True, 'bull_rsi_required': False, 'bear_strategy': 'mean_reversion', 'bear_bb_std_mult': 1.1195774569438133, 'bear_rsi_os': 6, 'bear_rsi_ob': 47, 'bear_adx_thresh': 18.676700154334608, 'bear_atr_min_pct': 0.023696463264537462, 'bear_atr_max_pct': 0.018137988535530558, 'bear_tp_mult': 2.8739795421916874, 'bear_tsl_mult': 0.34536878084271294, 'bear_time_stop': 207, 'bear_use_sma': True, 'bear_use_ema': True, 'bear_use_atr': True, 'bear_use_adx': True, 'bear_use_spike': True, 'bear_rsi_required': True, 'sideways_strategy': 'mean_reversion', 'sideways_bb_std_mult': 1.9293788571569972, 'sideways_rsi_os': 27, 'sideways_rsi_ob': 57, 'sideways_adx_thresh': 11.607327628064796, 'sideways_atr_min_pct': 0.013597658467708315, 'sideways_atr_max_pct': 0.13064569221944808, 'sideways_tp_mult': 1.9941659433873458, 'sideways_tsl_mult': 0.5478581712500991, 'sideways_time_stop': 34, 'sideways_use_sma': False, 'sideways_use_ema': False, 'sideways_use_atr': False, 'sideways_use_adx': False, 'sideways_use_spike': True, 'sideways_rsi_required': True}.
[I 2025-08-31 04:31:15,612] Trial 375 finished with values: [-1000000000.0, 1000000000.0] and parameters: {'p_sma': 56, 'p_std': 52, 'p_atr': 28, 'p_adx': 9, 'rsi_period': 28, 'ema1': 14, 'ema2': 22, 'slip_atr_k': 0.013885206495565846, 'slip_spread_k': 0.7224991830685479, 'spread_hl_frac': 0.011444186226676258, 'bb_std_mult': 2.6061407809173494, 'rsi_os': 31, 'rsi_ob': 93, 'vol_spike': 0.12061588217108268, 'adx_thresh': 23.938647170192475, 'atr_min_pct': 0.02144592568931674, 'atr_max_pct': 0.10450232658539854, 'tp_mult': 2.4866156692467127, 'tsl_mult': 0.8957543589084082, 'strategy': 'breakout', 'time_stop': 45, 'use_sma': False, 'use_atr': False, 'use_adx': False, 'use_ema': True, 'use_spike': False, 'rsi_required': False, 'edge_k': 1.5447539517127964, 'edge_cap': 0.9610307801347768, 'bull_strategy': 'mean_reversion', 'bull_bb_std_mult': 3.3133247194007587, 'bull_rsi_os': 49, 'bull_rsi_ob': 77, 'bull_adx_thresh': 15.38543501847271, 'bull_atr_min_pct': 0.01882251393512895, 'bull_atr_max_pct': 0.03243010790551438, 'bull_tp_mult': 1.5853242901348774, 'bull_tsl_mult': 0.8852624031123596, 'bull_time_stop': 126, 'bull_use_sma': False, 'bull_use_ema': False, 'bull_use_atr': True, 'bull_use_adx': True, 'bull_use_spike': True, 'bull_rsi_required': True, 'bear_strategy': 'mean_reversion', 'bear_bb_std_mult': 0.7912957168683427, 'bear_rsi_os': 6, 'bear_rsi_ob': 46, 'bear_adx_thresh': 16.886619128603385, 'bear_atr_min_pct': 0.014785791737448453, 'bear_atr_max_pct': 0.03455511477862234, 'bear_tp_mult': 2.8713383782053454, 'bear_tsl_mult': 0.21768492066969378, 'bear_time_stop': 30, 'bear_use_sma': True, 'bear_use_ema': True, 'bear_use_atr': True, 'bear_use_adx': True, 'bear_use_spike': True, 'bear_rsi_required': True, 'sideways_strategy': 'mean_reversion', 'sideways_bb_std_mult': 1.1974858942724775, 'sideways_rsi_os': 27, 'sideways_rsi_ob': 50, 'sideways_adx_thresh': 11.428084675188082, 'sideways_atr_min_pct': 0.013920922464589588, 'sideways_atr_max_pct': 0.11206753414835428, 'sideways_tp_mult': 1.1287253028014255, 'sideways_tsl_mult': 0.5591961362013604, 'sideways_time_stop': 199, 'sideways_use_sma': False, 'sideways_use_ema': False, 'sideways_use_atr': False, 'sideways_use_adx': True, 'sideways_use_spike': True, 'sideways_rsi_required': True}.
