[I 2025-08-31 04:11:39,789] Trial 280 finished with values: [-1000000000.0, 1000000000.0] and parameters: {'p_sma': 53, 'p_std': 17, 'p_atr': 10, 'p_adx': 21, 'rsi_period': 21, 'ema1': 14, 'ema2': 30, 'slip_atr_k': 0.22446214946342838, 'slip_spread_k': 0.9966989227428122, 'spread_hl_frac': 0.003104957694486498, 'bb_std_mult': 1.9206097440938448, 'rsi_os': 29, 'rsi_ob': 48, 'vol_spike': 0.24464582870919283, 'adx_thresh': 19.94556238952933, 'atr_min_pct': 0.022528162484345353, 'atr_max_pct': 0.1200070253402907, 'tp_mult': 2.76133845777706, 'tsl_mult': 0.8967528641092047, 'strategy': 'breakout', 'time_stop': 47, 'use_sma': False, 'use_atr': False, 'use_adx': True, 'use_ema': False, 'use_spike': True, 'rsi_required': True, 'edge_k': 1.3756500014840758, 'edge_cap': 0.07232264038940672, 'bull_strategy': 'mean_reversion', 'bull_bb_std_mult': 3.2679596139258362, 'bull_rsi_os': 14, 'bull_rsi_ob': 75, 'bull_adx_thresh': 18.517873400241374, 'bull_atr_min_pct': 0.029375505956228214, 'bull_atr_max_pct': 0.04289461458904449, 'bull_tp_mult': 1.5786078599912006, 'bull_tsl_mult': 0.45803728646529107, 'bull_time_stop': 138, 'bull_use_sma': True, 'bull_use_ema': False, 'bull_use_atr': True, 'bull_use_adx': True, 'bull_use_spike': False, 'bull_rsi_required': True, 'bear_strategy': 'mean_reversion', 'bear_bb_std_mult': 1.0034188400986297, 'bear_rsi_os': 9, 'bear_rsi_ob': 48, 'bear_adx_thresh': 19.58067029291146, 'bear_atr_min_pct': 0.005937454597319175, 'bear_atr_max_pct': 0.0992148867373562, 'bear_tp_mult': 2.903504848206191, 'bear_tsl_mult': 0.9125616785036488, 'bear_time_stop': 215, 'bear_use_sma': True, 'bear_use_ema': True, 'bear_use_atr': True, 'bear_use_adx': True, 'bear_use_spike': True, 'bear_rsi_required': False, 'sideways_strategy': 'mean_reversion', 'sideways_bb_std_mult': 1.2617522703146495, 'sideways_rsi_os': 24, 'sideways_rsi_ob': 65, 'sideways_adx_thresh': 10.159586725868262, 'sideways_atr_min_pct': 0.015536981458448756, 'sideways_atr_max_pct': 0.11176539832500508, 'sideways_tp_mult': 1.0983057123449425, 'sideways_tsl_mult': 0.6151235536922763, 'sideways_time_stop': 164, 'sideways_use_sma': False, 'sideways_use_ema': True, 'sideways_use_atr': True, 'sideways_use_adx': True, 'sideways_use_spike': False, 'sideways_rsi_required': True}.
[I 2025-08-31 04:11:39,797] Trial 282 finished with values: [-1000000000.0, 1000000000.0] and parameters: {'p_sma': 53, 'p_std': 17, 'p_atr': 25, 'p_adx': 9, 'rsi_period': 22, 'ema1': 14, 'ema2': 30, 'slip_atr_k': 0.025661111594984395, 'slip_spread_k': 0.5578547677336881, 'spread_hl_frac': 0.01069366770035231, 'bb_std_mult': 2.635181076916187, 'rsi_os': 28, 'rsi_ob': 79, 'vol_spike': 0.18480760565400126, 'adx_thresh': 19.945716523122474, 'atr_min_pct': 0.022484728860019145, 'atr_max_pct': 0.07429734989009126, 'tp_mult': 2.439298630540242, 'tsl_mult': 0.8911732520954466, 'strategy': 'breakout', 'time_stop': 49, 'use_sma': False, 'use_atr': False, 'use_adx': False, 'use_ema': False, 'use_spike': True, 'rsi_required': False, 'edge_k': 1.4192529348408078, 'edge_cap': 0.9846084626422437, 'bull_strategy': 'mean_reversion', 'bull_bb_std_mult': 3.5644837421426043, 'bull_rsi_os': 14, 'bull_rsi_ob': 77, 'bull_adx_thresh': 12.374764268452981, 'bull_atr_min_pct': 0.02922086944954038, 'bull_atr_max_pct': 0.0497829912745599, 'bull_tp_mult': 1.3531207154952698, 'bull_tsl_mult': 0.8693509041922727, 'bull_time_stop': 137, 'bull_use_sma': False, 'bull_use_ema': False, 'bull_use_atr': True, 'bull_use_adx': True, 'bull_use_spike': False, 'bull_rsi_required': True, 'bear_strategy': 'mean_reversion', 'bear_bb_std_mult': 2.558895588768752, 'bear_rsi_os': 9, 'bear_rsi_ob': 48, 'bear_adx_thresh': 26.908514663769026, 'bear_atr_min_pct': 0.006015510565314611, 'bear_atr_max_pct': 0.03622193769112954, 'bear_tp_mult': 2.687179868207008, 'bear_tsl_mult': 0.18115391997193825, 'bear_time_stop': 193, 'bear_use_sma': True, 'bear_use_ema': True, 'bear_use_atr': True, 'bear_use_adx': True, 'bear_use_spike': True, 'bear_rsi_required': False, 'sideways_strategy': 'mean_reversion', 'sideways_bb_std_mult': 1.088110322922226, 'sideways_rsi_os': 10, 'sideways_rsi_ob': 70, 'sideways_adx_thresh': 8.498007599596102, 'sideways_atr_min_pct': 0.015340780098847822, 'sideways_atr_max_pct': 0.14628744258172188, 'sideways_tp_mult': 1.8446424496765046, 'sideways_tsl_mult': 0.019740320482531604, 'sideways_time_stop': 71, 'sideways_use_sma': True, 'sideways_use_ema': False, 'sideways_use_atr': False, 'sideways_use_adx': True, 'sideways_use_spike': True, 'sideways_rsi_required': True}.
[I 2025-08-31 04:11:40,480] Trial 279 finished with values: [-1000000000.0, 1000000000.0] and parameters: {'p_sma': 53, 'p_std': 17, 'p_atr': 23, 'p_adx': 14, 'rsi_period': 21, 'ema1': 14, 'ema2': 30, 'slip_atr_k': 0.0244558048852315, 'slip_spread_k': 0.0825242998388024, 'spread_hl_frac': 0.04034902514385498, 'bb_std_mult': 1.9666621230108583, 'rsi_os': 29, 'rsi_ob': 64, 'vol_spike': 0.24388902010439012, 'adx_thresh': 29.894576857171298, 'atr_min_pct': 0.022656566971763773, 'atr_max_pct': 0.11992630182103055, 'tp_mult': 2.430641154188579, 'tsl_mult': 0.5348394062409837, 'strategy': 'breakout', 'time_stop': 205, 'use_sma': False, 'use_atr': False, 'use_adx': True, 'use_ema': False, 'use_spike': True, 'rsi_required': True, 'edge_k': 1.4171242720277224, 'edge_cap': 0.5279308009812462, 'bull_strategy': 'mean_reversion', 'bull_bb_std_mult': 3.5679502185113785, 'bull_rsi_os': 7, 'bull_rsi_ob': 77, 'bull_adx_thresh': 11.965731249999891, 'bull_atr_min_pct': 0.029228056554197183, 'bull_atr_max_pct': 0.049220363717280766, 'bull_tp_mult': 1.3575922098967967, 'bull_tsl_mult': 0.8729115047700566, 'bull_time_stop': 102, 'bull_use_sma': True, 'bull_use_ema': False, 'bull_use_atr': True, 'bull_use_adx': True, 'bull_use_spike': False, 'bull_rsi_required': True, 'bear_strategy': 'mean_reversion', 'bear_bb_std_mult': 2.966159565672037, 'bear_rsi_os': 51, 'bear_rsi_ob': 46, 'bear_adx_thresh': 6.803678061145227, 'bear_atr_min_pct': 0.02271945105544779, 'bear_atr_max_pct': 0.03887175962635792, 'bear_tp_mult': 2.9089049373610414, 'bear_tsl_mult': 0.92570745819944, 'bear_time_stop': 215, 'bear_use_sma': True, 'bear_use_ema': True, 'bear_use_atr': True, 'bear_use_adx': True, 'bear_use_spike': True, 'bear_rsi_required': False, 'sideways_strategy': 'mean_reversion', 'sideways_bb_std_mult': 1.075824880104339, 'sideways_rsi_os': 10, 'sideways_rsi_ob': 53, 'sideways_adx_thresh': 8.805001794463175, 'sideways_atr_min_pct': 0.01038561108252015, 'sideways_atr_max_pct': 0.11135327912571563, 'sideways_tp_mult': 1.4361208880513094, 'sideways_tsl_mult': 0.6911404930389571, 'sideways_time_stop': 59, 'sideways_use_sma': False, 'sideways_use_ema': True, 'sideways_use_atr': True, 'sideways_use_adx': True, 'sideways_use_spike': False, 'sideways_rsi_required': True}.
[I 2025-08-31 04:11:40,851] Trial 281 finished with values: [-0.027591823852067154, 0.027528805578690956] and parameters: {'p_sma': 21, 'p_std': 17, 'p_atr': 23, 'p_adx': 9, 'rsi_period': 75, 'ema1': 14, 'ema2': 47, 'slip_atr_k': 0.02402446889194694, 'slip_spread_k': 0.08101578880705909, 'spread_hl_frac': 0.03215950714335164, 'bb_std_mult': 1.980224899592436, 'rsi_os': 29, 'rsi_ob': 47, 'vol_spike': 0.18474030436586397, 'adx_thresh': 5.882245993696831, 'atr_min_pct': 0.024101346584878797, 'atr_max_pct': 0.02879864723357623, 'tp_mult': 2.434806362828987, 'tsl_mult': 0.893733044547783, 'strategy': 'breakout', 'time_stop': 206, 'use_sma': False, 'use_atr': False, 'use_adx': True, 'use_ema': False, 'use_spike': True, 'rsi_required': True, 'edge_k': 1.4268698272007432, 'edge_cap': 0.9995344990538438, 'bull_strategy': 'mean_reversion', 'bull_bb_std_mult': 3.558523400109441, 'bull_rsi_os': 14, 'bull_rsi_ob': 76, 'bull_adx_thresh': 12.04559447097174, 'bull_atr_min_pct': 0.0019497370777132373, 'bull_atr_max_pct': 0.10291441672649196, 'bull_tp_mult': 1.5719459102881843, 'bull_tsl_mult': 0.48532493296785456, 'bull_time_stop': 77, 'bull_use_sma': True, 'bull_use_ema': False, 'bull_use_atr': True, 'bull_use_adx': True, 'bull_use_spike': False, 'bull_rsi_required': True, 'bear_strategy': 'mean_reversion', 'bear_bb_std_mult': 0.992705854480812, 'bear_rsi_os': 9, 'bear_rsi_ob': 46, 'bear_adx_thresh': 6.520254885160906, 'bear_atr_min_pct': 0.000870283369073405, 'bear_atr_max_pct': 0.037793873546757124, 'bear_tp_mult': 2.910657227736491, 'bear_tsl_mult': 0.08669365219632119, 'bear_time_stop': 148, 'bear_use_sma': True, 'bear_use_ema': True, 'bear_use_atr': True, 'bear_use_adx': True, 'bear_use_spike': True, 'bear_rsi_required': False, 'sideways_strategy': 'mean_reversion', 'sideways_bb_std_mult': 1.0616780801572718, 'sideways_rsi_os': 33, 'sideways_rsi_ob': 53, 'sideways_adx_thresh': 9.812965339771376, 'sideways_atr_min_pct': 0.011336108187927539, 'sideways_atr_max_pct': 0.04978988158771694, 'sideways_tp_mult': 1.0899516752019283, 'sideways_tsl_mult': 0.3802311675129828, 'sideways_time_stop': 172, 'sideways_use_sma': False, 'sideways_use_ema': True, 'sideways_use_atr': True, 'sideways_use_adx': True, 'sideways_use_spike': False, 'sideways_rsi_required': True}.
[I 2025-08-31 04:12:34,548] Trial 284 finished with values: [-1000000000.0, 1000000000.0] and parameters: {'p_sma': 54, 'p_std': 38, 'p_atr': 23, 'p_adx': 9, 'rsi_period': 72, 'ema1': 27, 'ema2': 38, 'slip_atr_k': 0.01874251771623326, 'slip_spread_k': 0.07336034903412897, 'spread_hl_frac': 0.009868971799185146, 'bb_std_mult': 1.6261989649522361, 'rsi_os': 32, 'rsi_ob': 64, 'vol_spike': 0.02832740423582504, 'adx_thresh': 33.75506969506867, 'atr_min_pct': 0.0017911908353883087, 'atr_max_pct': 0.04138002706053926, 'tp_mult': 2.500235875943213, 'tsl_mult': 0.5312964202350092, 'strategy': 'breakout', 'time_stop': 69, 'use_sma': False, 'use_atr': False, 'use_adx': False, 'use_ema': False, 'use_spike': True, 'rsi_required': False, 'edge_k': 1.4302514584403205, 'edge_cap': 0.2799407085571778, 'bull_strategy': 'mean_reversion', 'bull_bb_std_mult': 3.543970175001428, 'bull_rsi_os': 11, 'bull_rsi_ob': 76, 'bull_adx_thresh': 14.454928918632655, 'bull_atr_min_pct': 0.01461972497875026, 'bull_atr_max_pct': 0.08289421065998763, 'bull_tp_mult': 1.7347445100088583, 'bull_tsl_mult': 0.8781938016428372, 'bull_time_stop': 56, 'bull_use_sma': False, 'bull_use_ema': False, 'bull_use_atr': True, 'bull_use_adx': True, 'bull_use_spike': False, 'bull_rsi_required': True, 'bear_strategy': 'mean_reversion', 'bear_bb_std_mult': 1.0982069780937505, 'bear_rsi_os': 46, 'bear_rsi_ob': 46, 'bear_adx_thresh': 22.185060944546787, 'bear_atr_min_pct': 0.022728130970628747, 'bear_atr_max_pct': 0.03845791933853106, 'bear_tp_mult': 2.1871481821743206, 'bear_tsl_mult': 0.2555444397765395, 'bear_time_stop': 267, 'bear_use_sma': True, 'bear_use_ema': True, 'bear_use_atr': True, 'bear_use_adx': True, 'bear_use_spike': True, 'bear_rsi_required': True, 'sideways_strategy': 'mean_reversion', 'sideways_bb_std_mult': 1.0446645147740405, 'sideways_rsi_os': 33, 'sideways_rsi_ob': 89, 'sideways_adx_thresh': 10.829046950269761, 'sideways_atr_min_pct': 0.010515396910711149, 'sideways_atr_max_pct': 0.1113459706322939, 'sideways_tp_mult': 1.7694459444086672, 'sideways_tsl_mult': 0.6750308513808272, 'sideways_time_stop': 205, 'sideways_use_sma': False, 'sideways_use_ema': False, 'sideways_use_atr': False, 'sideways_use_adx': True, 'sideways_use_spike': True, 'sideways_rsi_required': True}.
[I 2025-08-31 04:12:34,972] Trial 286 finished with values: [-1000000000.0, 1000000000.0] and parameters: {'p_sma': 54, 'p_std': 31, 'p_atr': 25, 'p_adx': 26, 'rsi_period': 24, 'ema1': 27, 'ema2': 37, 'slip_atr_k': 0.017935921576431892, 'slip_spread_k': 0.11997833627270255, 'spread_hl_frac': 0.009339108616384102, 'bb_std_mult': 1.3311895466864547, 'rsi_os': 32, 'rsi_ob': 94, 'vol_spike': 0.041160072416523565, 'adx_thresh': 15.570520752523688, 'atr_min_pct': 0.021212062069358738, 'atr_max_pct': 0.10084561304390345, 'tp_mult': 1.6820917618010252, 'tsl_mult': 0.4186494264209565, 'strategy': 'breakout', 'time_stop': 69, 'use_sma': False, 'use_atr': True, 'use_adx': False, 'use_ema': False, 'use_spike': True, 'rsi_required': False, 'edge_k': 1.2890466922050734, 'edge_cap': 0.9989654015609791, 'bull_strategy': 'mean_reversion', 'bull_bb_std_mult': 0.6918469705682144, 'bull_rsi_os': 42, 'bull_rsi_ob': 72, 'bull_adx_thresh': 14.36440277156955, 'bull_atr_min_pct': 0.001788890737930281, 'bull_atr_max_pct': 0.05584533673692932, 'bull_tp_mult': 1.6082052849408215, 'bull_tsl_mult': 0.9197889221962547, 'bull_time_stop': 57, 'bull_use_sma': False, 'bull_use_ema': False, 'bull_use_atr': True, 'bull_use_adx': True, 'bull_use_spike': False, 'bull_rsi_required': True, 'bear_strategy': 'mean_reversion', 'bear_bb_std_mult': 1.093389336371234, 'bear_rsi_os': 11, 'bear_rsi_ob': 85, 'bear_adx_thresh': 17.308840430049706, 'bear_atr_min_pct': 0.02357143488158305, 'bear_atr_max_pct': 0.04493703538166377, 'bear_tp_mult': 1.212797036194892, 'bear_tsl_mult': 0.24510166502060773, 'bear_time_stop': 265, 'bear_use_sma': True, 'bear_use_ema': True, 'bear_use_atr': True, 'bear_use_adx': True, 'bear_use_spike': True, 'bear_rsi_required': True, 'sideways_strategy': 'mean_reversion', 'sideways_bb_std_mult': 0.9978918008164895, 'sideways_rsi_os': 16, 'sideways_rsi_ob': 54, 'sideways_adx_thresh': 16.214597510274963, 'sideways_atr_min_pct': 0.012433349842358533, 'sideways_atr_max_pct': 0.10839862810370762, 'sideways_tp_mult': 1.751653000561406, 'sideways_tsl_mult': 0.6588207225609879, 'sideways_time_stop': 65, 'sideways_use_sma': True, 'sideways_use_ema': False, 'sideways_use_atr': False, 'sideways_use_adx': False, 'sideways_use_spike': True, 'sideways_rsi_required': True}.
[I 2025-08-31 04:12:35,378] Trial 283 finished with values: [-1000000000.0, 1000000000.0] and parameters: {'p_sma': 15, 'p_std': 8, 'p_atr': 23, 'p_adx': 9, 'rsi_period': 75, 'ema1': 6, 'ema2': 37, 'slip_atr_k': 0.11151964153231643, 'slip_spread_k': 0.727381342534357, 'spread_hl_frac': 0.009895067095704648, 'bb_std_mult': 1.6332560127999205, 'rsi_os': 32, 'rsi_ob': 59, 'vol_spike': 0.028520365362469963, 'adx_thresh': 33.48373742736014, 'atr_min_pct': 0.020892065619312894, 'atr_max_pct': 0.027903148891788097, 'tp_mult': 1.6708598383302413, 'tsl_mult': 0.5367905206605733, 'strategy': 'breakout', 'time_stop': 204, 'use_sma': False, 'use_atr': False, 'use_adx': False, 'use_ema': False, 'use_spike': True, 'rsi_required': False, 'edge_k': 1.4280588154036808, 'edge_cap': 0.2775600048898076, 'bull_strategy': 'mean_reversion', 'bull_bb_std_mult': 3.579629192359034, 'bull_rsi_os': 12, 'bull_rsi_ob': 76, 'bull_adx_thresh': 24.58627272185113, 'bull_atr_min_pct': 0.001750560727596212, 'bull_atr_max_pct': 0.10368359747403522, 'bull_tp_mult': 1.6022126310932079, 'bull_tsl_mult': 0.8775901160753699, 'bull_time_stop': 226, 'bull_use_sma': False, 'bull_use_ema': False, 'bull_use_atr': True, 'bull_use_adx': True, 'bull_use_spike': False, 'bull_rsi_required': True, 'bear_strategy': 'mean_reversion', 'bear_bb_std_mult': 1.0878068673543357, 'bear_rsi_os': 46, 'bear_rsi_ob': 46, 'bear_adx_thresh': 24.849628760638353, 'bear_atr_min_pct': 0.022061257331926105, 'bear_atr_max_pct': 0.03913427030574152, 'bear_tp_mult': 2.7116888910491284, 'bear_tsl_mult': 0.2471499581412364, 'bear_time_stop': 200, 'bear_use_sma': True, 'bear_use_ema': True, 'bear_use_atr': True, 'bear_use_adx': True, 'bear_use_spike': True, 'bear_rsi_required': True, 'sideways_strategy': 'mean_reversion', 'sideways_bb_std_mult': 1.0501751077157824, 'sideways_rsi_os': 18, 'sideways_rsi_ob': 54, 'sideways_adx_thresh': 10.666592861835401, 'sideways_atr_min_pct': 0.012639622505709658, 'sideways_atr_max_pct': 0.08334789540771353, 'sideways_tp_mult': 2.1752076570862604, 'sideways_tsl_mult': 0.6874713421996633, 'sideways_time_stop': 60, 'sideways_use_sma': False, 'sideways_use_ema': False, 'sideways_use_atr': False, 'sideways_use_adx': True, 'sideways_use_spike': True, 'sideways_rsi_required': True}.
[I 2025-08-31 04:12:35,555] Trial 285 finished with values: [-0.02087720182932995, 0.020827534223228767] and parameters: {'p_sma': 21, 'p_std': 15, 'p_atr': 25, 'p_adx': 26, 'rsi_period': 76, 'ema1': 23, 'ema2': 33, 'slip_atr_k': 0.11277530705843122, 'slip_spread_k': 0.11803594366411473, 'spread_hl_frac': 0.009871860686372783, 'bb_std_mult': 3.039592737309574, 'rsi_os': 40, 'rsi_ob': 94, 'vol_spike': 0.28051200007234345, 'adx_thresh': 14.500465881186248, 'atr_min_pct': 0.02343789748040683, 'atr_max_pct': 0.029248176653863686, 'tp_mult': 2.504120775146428, 'tsl_mult': 0.8681718182577586, 'strategy': 'breakout', 'time_stop': 55, 'use_sma': False, 'use_atr': True, 'use_adx': False, 'use_ema': False, 'use_spike': True, 'rsi_required': False, 'edge_k': 0.8293440342398215, 'edge_cap': 0.9998137902639982, 'bull_strategy': 'mean_reversion', 'bull_bb_std_mult': 3.397113928925068, 'bull_rsi_os': 46, 'bull_rsi_ob': 70, 'bull_adx_thresh': 14.317542611858089, 'bull_atr_min_pct': 0.0016832930393073907, 'bull_atr_max_pct': 0.08294976008246686, 'bull_tp_mult': 1.74700904413705, 'bull_tsl_mult': 0.27492508827349715, 'bull_time_stop': 60, 'bull_use_sma': False, 'bull_use_ema': False, 'bull_use_atr': True, 'bull_use_adx': True, 'bull_use_spike': False, 'bull_rsi_required': True, 'bear_strategy': 'mean_reversion', 'bear_bb_std_mult': 1.0888015446819743, 'bear_rsi_os': 8, 'bear_rsi_ob': 47, 'bear_adx_thresh': 22.1610609110568, 'bear_atr_min_pct': 0.0008617390989608155, 'bear_atr_max_pct': 0.015058914928118616, 'bear_tp_mult': 2.810367829747724, 'bear_tsl_mult': 0.24837104467753007, 'bear_time_stop': 275, 'bear_use_sma': True, 'bear_use_ema': True, 'bear_use_atr': True, 'bear_use_adx': True, 'bear_use_spike': True, 'bear_rsi_required': True, 'sideways_strategy': 'mean_reversion', 'sideways_bb_std_mult': 1.00904168109715, 'sideways_rsi_os': 31, 'sideways_rsi_ob': 89, 'sideways_adx_thresh': 16.194823839267418, 'sideways_atr_min_pct': 0.009112968887063217, 'sideways_atr_max_pct': 0.1374894765109222, 'sideways_tp_mult': 2.1949570169335604, 'sideways_tsl_mult': 0.5725189506518661, 'sideways_time_stop': 172, 'sideways_use_sma': True, 'sideways_use_ema': False, 'sideways_use_atr': False, 'sideways_use_adx': True, 'sideways_use_spike': True, 'sideways_rsi_required': True}.
[I 2025-08-31 04:13:30,172] Trial 288 finished with values: [-1000000000.0, 1000000000.0] and parameters: {'p_sma': 14, 'p_std': 15, 'p_atr': 24, 'p_adx': 8, 'rsi_period': 24, 'ema1': 23, 'ema2': 34, 'slip_atr_k': 0.029778369089043, 'slip_spread_k': 0.7317076381923124, 'spread_hl_frac': 0.04774219615980083, 'bb_std_mult': 3.4151828591186426, 'rsi_os': 46, 'rsi_ob': 59, 'vol_spike': 0.19876834095130644, 'adx_thresh': 20.523943280150174, 'atr_min_pct': 0.023418414775042216, 'atr_max_pct': 0.09634581800489755, 'tp_mult': 2.5042098369542667, 'tsl_mult': 0.8615695144014777, 'strategy': 'mean_reversion', 'time_stop': 25, 'use_sma': False, 'use_atr': False, 'use_adx': False, 'use_ema': False, 'use_spike': True, 'rsi_required': False, 'edge_k': 0.6929821510278069, 'edge_cap': 0.35688986010672263, 'bull_strategy': 'mean_reversion', 'bull_bb_std_mult': 2.2787739941626337, 'bull_rsi_os': 17, 'bull_rsi_ob': 45, 'bull_adx_thresh': 9.215703604290749, 'bull_atr_min_pct': 0.0010805981355906601, 'bull_atr_max_pct': 0.04264017478514989, 'bull_tp_mult': 1.6011644677250736, 'bull_tsl_mult': 0.8484299898497183, 'bull_time_stop': 131, 'bull_use_sma': False, 'bull_use_ema': True, 'bull_use_atr': True, 'bull_use_adx': False, 'bull_use_spike': False, 'bull_rsi_required': True, 'bear_strategy': 'breakout', 'bear_bb_std_mult': 0.7830513879801677, 'bear_rsi_os': 8, 'bear_rsi_ob': 71, 'bear_adx_thresh': 20.03467469447504, 'bear_atr_min_pct': 0.015401231421621914, 'bear_atr_max_pct': 0.10966384863896067, 'bear_tp_mult': 2.7201546065635114, 'bear_tsl_mult': 0.3075981818583916, 'bear_time_stop': 191, 'bear_use_sma': False, 'bear_use_ema': False, 'bear_use_atr': False, 'bear_use_adx': True, 'bear_use_spike': False, 'bear_rsi_required': True, 'sideways_strategy': 'breakout', 'sideways_bb_std_mult': 1.2205409960034859, 'sideways_rsi_os': 37, 'sideways_rsi_ob': 54, 'sideways_adx_thresh': 14.13322556546391, 'sideways_atr_min_pct': 0.012954994474105499, 'sideways_atr_max_pct': 0.1381801510889615, 'sideways_tp_mult': 1.9162227697670782, 'sideways_tsl_mult': 0.9991985008769242, 'sideways_time_stop': 16, 'sideways_use_sma': False, 'sideways_use_ema': False, 'sideways_use_atr': False, 'sideways_use_adx': True, 'sideways_use_spike': True, 'sideways_rsi_required': False}.
