[I 2025-08-31 03:35:39,210] Trial 17 finished with values: [-1000000000.0, 1000000000.0] and parameters: {'p_sma': 5, 'p_std': 38, 'p_atr': 18, 'p_adx': 10, 'rsi_period': 42, 'ema1': 10, 'ema2': 18, 'slip_atr_k': 0.18323330515805375, 'slip_spread_k': 0.6696496940150964, 'spread_hl_frac': 0.0015162770150322982, 'bb_std_mult': 1.9450703256796262, 'rsi_os': 6, 'rsi_ob': 83, 'vol_spike': 0.11876469050777355, 'adx_thresh': 34.904648882441364, 'atr_min_pct': 0.009700549408507474, 'atr_max_pct': 0.0766380618373065, 'tp_mult': 2.4486935879241707, 'tsl_mult': 0.21237317355089552, 'strategy': 'breakout', 'time_stop': 290, 'use_sma': False, 'use_atr': True, 'use_adx': True, 'use_ema': False, 'use_spike': True, 'rsi_required': True, 'edge_k': 0.49960932978883443, 'edge_cap': 0.6669797526546067, 'bull_strategy': 'mean_reversion', 'bull_bb_std_mult': 2.6703366567510787, 'bull_rsi_os': 19, 'bull_rsi_ob': 56, 'bull_adx_thresh': 28.923583814764047, 'bull_atr_min_pct': 0.009069591260242175, 'bull_atr_max_pct': 0.07044834865384232, 'bull_tp_mult': 2.9423273097050906, 'bull_tsl_mult': 0.7257446281263928, 'bull_time_stop': 87, 'bull_use_sma': False, 'bull_use_ema': False, 'bull_use_atr': True, 'bull_use_adx': False, 'bull_use_spike': True, 'bull_rsi_required': True, 'bear_strategy': 'mean_reversion', 'bear_bb_std_mult': 1.1447242205060415, 'bear_rsi_os': 5, 'bear_rsi_ob': 49, 'bear_adx_thresh': 19.462415964524002, 'bear_atr_min_pct': 0.01115197359853336, 'bear_atr_max_pct': 0.07216405150953739, 'bear_tp_mult': 2.997235726054263, 'bear_tsl_mult': 0.06248972031037009, 'bear_time_stop': 99, 'bear_use_sma': False, 'bear_use_ema': True, 'bear_use_atr': True, 'bear_use_adx': True, 'bear_use_spike': False, 'bear_rsi_required': True, 'sideways_strategy': 'breakout', 'sideways_bb_std_mult': 2.7104808949483967, 'sideways_rsi_os': 55, 'sideways_rsi_ob': 94, 'sideways_adx_thresh': 11.486705793792831, 'sideways_atr_min_pct': 0.029282873086786867, 'sideways_atr_max_pct': 0.1472796558438227, 'sideways_tp_mult': 2.4396250812417675, 'sideways_tsl_mult': 0.32745664153176884, 'sideways_time_stop': 282, 'sideways_use_sma': False, 'sideways_use_ema': True, 'sideways_use_atr': True, 'sideways_use_adx': True, 'sideways_use_spike': False, 'sideways_rsi_required': True}.
[I 2025-08-31 03:36:07,882] Trial 19 finished with values: [-1000000000.0, 1000000000.0] and parameters: {'p_sma': 45, 'p_std': 23, 'p_atr': 18, 'p_adx': 18, 'rsi_period': 25, 'ema1': 18, 'ema2': 59, 'slip_atr_k': 0.034374459042601654, 'slip_spread_k': 0.6979434498279361, 'spread_hl_frac': 0.009332763778507069, 'bb_std_mult': 1.9173243037166383, 'rsi_os': 26, 'rsi_ob': 84, 'vol_spike': 0.1427157618946788, 'adx_thresh': 12.62332647253881, 'atr_min_pct': 0.022966691081621388, 'atr_max_pct': 0.07777334306636687, 'tp_mult': 1.8174489344381932, 'tsl_mult': 0.198868431000236, 'strategy': 'mean_reversion', 'time_stop': 63, 'use_sma': False, 'use_atr': False, 'use_adx': True, 'use_ema': False, 'use_spike': True, 'rsi_required': True, 'edge_k': 0.4259011889493045, 'edge_cap': 0.3203847877358368, 'bull_strategy': 'mean_reversion', 'bull_bb_std_mult': 0.510276652717996, 'bull_rsi_os': 46, 'bull_rsi_ob': 53, 'bull_adx_thresh': 17.218727563637657, 'bull_atr_min_pct': 0.008064886852687147, 'bull_atr_max_pct': 0.13459155403985676, 'bull_tp_mult': 2.9818762528195775, 'bull_tsl_mult': 0.6613892988448768, 'bull_time_stop': 79, 'bull_use_sma': True, 'bull_use_ema': False, 'bull_use_atr': True, 'bull_use_adx': False, 'bull_use_spike': False, 'bull_rsi_required': True, 'bear_strategy': 'mean_reversion', 'bear_bb_std_mult': 1.235025904554889, 'bear_rsi_os': 35, 'bear_rsi_ob': 48, 'bear_adx_thresh': 34.92566352880196, 'bear_atr_min_pct': 0.01636532214544951, 'bear_atr_max_pct': 0.08027090483186988, 'bear_tp_mult': 2.1498332283818575, 'bear_tsl_mult': 0.5878473589191723, 'bear_time_stop': 86, 'bear_use_sma': True, 'bear_use_ema': True, 'bear_use_atr': True, 'bear_use_adx': True, 'bear_use_spike': False, 'bear_rsi_required': False, 'sideways_strategy': 'breakout', 'sideways_bb_std_mult': 2.262790846421088, 'sideways_rsi_os': 55, 'sideways_rsi_ob': 55, 'sideways_adx_thresh': 34.84152396527169, 'sideways_atr_min_pct': 0.029979973867033827, 'sideways_atr_max_pct': 0.09681215050869482, 'sideways_tp_mult': 1.7060827827478788, 'sideways_tsl_mult': 0.9905557992737021, 'sideways_time_stop': 252, 'sideways_use_sma': True, 'sideways_use_ema': True, 'sideways_use_atr': True, 'sideways_use_adx': False, 'sideways_use_spike': False, 'sideways_rsi_required': True}.
[I 2025-08-31 03:36:08,448] Trial 20 finished with values: [-1000000000.0, 1000000000.0] and parameters: {'p_sma': 46, 'p_std': 21, 'p_atr': 18, 'p_adx': 18, 'rsi_period': 30, 'ema1': 17, 'ema2': 17, 'slip_atr_k': 0.034718816214645065, 'slip_spread_k': 0.9981527164701274, 'spread_hl_frac': 0.009163470440042301, 'bb_std_mult': 1.835606159370832, 'rsi_os': 5, 'rsi_ob': 86, 'vol_spike': 0.14672193125325855, 'adx_thresh': 24.997443059187304, 'atr_min_pct': 0.024155557929876108, 'atr_max_pct': 0.07711354710016846, 'tp_mult': 1.7817048154295412, 'tsl_mult': 0.48484232483129003, 'strategy': 'breakout', 'time_stop': 62, 'use_sma': False, 'use_atr': True, 'use_adx': True, 'use_ema': True, 'use_spike': False, 'rsi_required': False, 'edge_k': 0.47415560352400643, 'edge_cap': 0.8033088426668792, 'bull_strategy': 'mean_reversion', 'bull_bb_std_mult': 0.7246476885211508, 'bull_rsi_os': 27, 'bull_rsi_ob': 95, 'bull_adx_thresh': 30.56449686194119, 'bull_atr_min_pct': 0.02203316542460113, 'bull_atr_max_pct': 0.14719832258673393, 'bull_tp_mult': 2.041353165943283, 'bull_tsl_mult': 0.6713140709630403, 'bull_time_stop': 209, 'bull_use_sma': True, 'bull_use_ema': True, 'bull_use_atr': True, 'bull_use_adx': False, 'bull_use_spike': True, 'bull_rsi_required': False, 'bear_strategy': 'mean_reversion', 'bear_bb_std_mult': 1.1652839333329972, 'bear_rsi_os': 35, 'bear_rsi_ob': 45, 'bear_adx_thresh': 10.34326814956858, 'bear_atr_min_pct': 0.015771437971100307, 'bear_atr_max_pct': 0.07503690345671217, 'bear_tp_mult': 1.5390407807111335, 'bear_tsl_mult': 0.2134922283959531, 'bear_time_stop': 99, 'bear_use_sma': True, 'bear_use_ema': False, 'bear_use_atr': True, 'bear_use_adx': False, 'bear_use_spike': False, 'bear_rsi_required': True, 'sideways_strategy': 'breakout', 'sideways_bb_std_mult': 3.067220330638759, 'sideways_rsi_os': 24, 'sideways_rsi_ob': 54, 'sideways_adx_thresh': 11.92300689227397, 'sideways_atr_min_pct': 0.029073302986659312, 'sideways_atr_max_pct': 0.09403439223636782, 'sideways_tp_mult': 1.7062923184441126, 'sideways_tsl_mult': 0.33929690555524683, 'sideways_time_stop': 59, 'sideways_use_sma': False, 'sideways_use_ema': True, 'sideways_use_atr': True, 'sideways_use_adx': False, 'sideways_use_spike': False, 'sideways_rsi_required': True}.
[I 2025-08-31 03:36:10,403] Trial 22 finished with values: [-1000000000.0, 1000000000.0] and parameters: {'p_sma': 47, 'p_std': 59, 'p_atr': 10, 'p_adx': 18, 'rsi_period': 51, 'ema1': 19, 'ema2': 34, 'slip_atr_k': 0.1421409555396697, 'slip_spread_k': 0.9798886246557373, 'spread_hl_frac': 0.02421745908419544, 'bb_std_mult': 2.5334822144818303, 'rsi_os': 25, 'rsi_ob': 64, 'vol_spike': 0.20342427517619033, 'adx_thresh': 12.250497305586979, 'atr_min_pct': 0.02220297135932401, 'atr_max_pct': 0.037052719963817905, 'tp_mult': 1.7716447725143696, 'tsl_mult': 0.5770934328091089, 'strategy': 'mean_reversion', 'time_stop': 60, 'use_sma': False, 'use_atr': False, 'use_adx': True, 'use_ema': True, 'use_spike': False, 'rsi_required': False, 'edge_k': 0.34706054620861904, 'edge_cap': 0.7987051194042728, 'bull_strategy': 'breakout', 'bull_bb_std_mult': 1.106860248106536, 'bull_rsi_os': 28, 'bull_rsi_ob': 53, 'bull_adx_thresh': 31.242226944379627, 'bull_atr_min_pct': 0.021895137028196503, 'bull_atr_max_pct': 0.1483527233730433, 'bull_tp_mult': 2.1614365879741997, 'bull_tsl_mult': 0.5947136950376307, 'bull_time_stop': 207, 'bull_use_sma': True, 'bull_use_ema': True, 'bull_use_atr': False, 'bull_use_adx': True, 'bull_use_spike': False, 'bull_rsi_required': False, 'bear_strategy': 'breakout', 'bear_bb_std_mult': 2.7870159029160626, 'bear_rsi_os': 36, 'bear_rsi_ob': 67, 'bear_adx_thresh': 5.261964215089273, 'bear_atr_min_pct': 0.00638685132298283, 'bear_atr_max_pct': 0.09301736648070584, 'bear_tp_mult': 1.4382193098950724, 'bear_tsl_mult': 0.19955387000979818, 'bear_time_stop': 233, 'bear_use_sma': True, 'bear_use_ema': False, 'bear_use_atr': False, 'bear_use_adx': False, 'bear_use_spike': False, 'bear_rsi_required': False, 'sideways_strategy': 'mean_reversion', 'sideways_bb_std_mult': 2.2675802346893876, 'sideways_rsi_os': 42, 'sideways_rsi_ob': 53, 'sideways_adx_thresh': 13.413117785819178, 'sideways_atr_min_pct': 0.01621430202430013, 'sideways_atr_max_pct': 0.059853133968542395, 'sideways_tp_mult': 2.9794611801871502, 'sideways_tsl_mult': 0.9838368936256083, 'sideways_time_stop': 69, 'sideways_use_sma': True, 'sideways_use_ema': True, 'sideways_use_atr': False, 'sideways_use_adx': False, 'sideways_use_spike': False, 'sideways_rsi_required': True}.
[I 2025-08-31 03:36:10,405] Trial 21 finished with values: [-1000000000.0, 1000000000.0] and parameters: {'p_sma': 48, 'p_std': 20, 'p_atr': 16, 'p_adx': 18, 'rsi_period': 35, 'ema1': 19, 'ema2': 60, 'slip_atr_k': 0.13083960988488286, 'slip_spread_k': 0.9562028253819959, 'spread_hl_frac': 0.023398329836257212, 'bb_std_mult': 2.4255015060995726, 'rsi_os': 28, 'rsi_ob': 87, 'vol_spike': 0.14727883022975155, 'adx_thresh': 25.67756544151159, 'atr_min_pct': 0.024074186121809053, 'atr_max_pct': 0.11508565611413493, 'tp_mult': 2.577884893588824, 'tsl_mult': 0.15622128311948963, 'strategy': 'mean_reversion', 'time_stop': 68, 'use_sma': False, 'use_atr': False, 'use_adx': True, 'use_ema': True, 'use_spike': False, 'rsi_required': False, 'edge_k': 0.3526922569141945, 'edge_cap': 0.7855029983103146, 'bull_strategy': 'breakout', 'bull_bb_std_mult': 1.1430333248935727, 'bull_rsi_os': 27, 'bull_rsi_ob': 53, 'bull_adx_thresh': 30.616373299787142, 'bull_atr_min_pct': 0.022488846956203696, 'bull_atr_max_pct': 0.1454840054779996, 'bull_tp_mult': 2.898295616994181, 'bull_tsl_mult': 0.6409301246642749, 'bull_time_stop': 210, 'bull_use_sma': False, 'bull_use_ema': True, 'bull_use_atr': True, 'bull_use_adx': False, 'bull_use_spike': False, 'bull_rsi_required': False, 'bear_strategy': 'mean_reversion', 'bear_bb_std_mult': 3.073446613972825, 'bear_rsi_os': 34, 'bear_rsi_ob': 95, 'bear_adx_thresh': 20.26934519128575, 'bear_atr_min_pct': 0.00646465432632139, 'bear_atr_max_pct': 0.07065346413183451, 'bear_tp_mult': 1.6243328565243547, 'bear_tsl_mult': 0.17383966672459794, 'bear_time_stop': 85, 'bear_use_sma': True, 'bear_use_ema': False, 'bear_use_atr': False, 'bear_use_adx': True, 'bear_use_spike': False, 'bear_rsi_required': True, 'sideways_strategy': 'mean_reversion', 'sideways_bb_std_mult': 2.291782897595832, 'sideways_rsi_os': 42, 'sideways_rsi_ob': 52, 'sideways_adx_thresh': 11.626232983291729, 'sideways_atr_min_pct': 0.016583046979540814, 'sideways_atr_max_pct': 0.09468334212109605, 'sideways_tp_mult': 2.9368339096756113, 'sideways_tsl_mult': 0.2305814212807915, 'sideways_time_stop': 259, 'sideways_use_sma': True, 'sideways_use_ema': True, 'sideways_use_atr': True, 'sideways_use_adx': False, 'sideways_use_spike': False, 'sideways_rsi_required': True}.
[I 2025-08-31 03:36:38,904] Trial 23 finished with values: [-1000000000.0, 1000000000.0] and parameters: {'p_sma': 32, 'p_std': 16, 'p_atr': 10, 'p_adx': 27, 'rsi_period': 51, 'ema1': 26, 'ema2': 33, 'slip_atr_k': 0.14403164382115094, 'slip_spread_k': 0.9645459601982234, 'spread_hl_frac': 0.020223955436263378, 'bb_std_mult': 2.49455941108316, 'rsi_os': 27, 'rsi_ob': 63, 'vol_spike': 0.012200360109527714, 'adx_thresh': 24.993610373563556, 'atr_min_pct': 0.02414903979683173, 'atr_max_pct': 0.035430965005277044, 'tp_mult': 2.605403245095296, 'tsl_mult': 0.5891307226916629, 'strategy': 'mean_reversion', 'time_stop': 58, 'use_sma': False, 'use_atr': False, 'use_adx': True, 'use_ema': True, 'use_spike': False, 'rsi_required': False, 'edge_k': 1.7196579682930557, 'edge_cap': 0.8048666829756319, 'bull_strategy': 'breakout', 'bull_bb_std_mult': 1.2181755599316773, 'bull_rsi_os': 29, 'bull_rsi_ob': 79, 'bull_adx_thresh': 30.515327462895673, 'bull_atr_min_pct': 0.022097160563766885, 'bull_atr_max_pct': 0.14834704120820097, 'bull_tp_mult': 2.0211784369191794, 'bull_tsl_mult': 0.8599069808794513, 'bull_time_stop': 210, 'bull_use_sma': False, 'bull_use_ema': True, 'bull_use_atr': False, 'bull_use_adx': True, 'bull_use_spike': True, 'bull_rsi_required': False, 'bear_strategy': 'breakout', 'bear_bb_std_mult': 3.1499075128746816, 'bear_rsi_os': 44, 'bear_rsi_ob': 66, 'bear_adx_thresh': 12.719725961717552, 'bear_atr_min_pct': 0.00595570811818419, 'bear_atr_max_pct': 0.09979961461458903, 'bear_tp_mult': 1.6114575024914395, 'bear_tsl_mult': 0.22035084196089622, 'bear_time_stop': 168, 'bear_use_sma': True, 'bear_use_ema': False, 'bear_use_atr': False, 'bear_use_adx': False, 'bear_use_spike': False, 'bear_rsi_required': False, 'sideways_strategy': 'mean_reversion', 'sideways_bb_std_mult': 3.1400869448773046, 'sideways_rsi_os': 23, 'sideways_rsi_ob': 78, 'sideways_adx_thresh': 13.062792078109304, 'sideways_atr_min_pct': 0.01693433104186323, 'sideways_atr_max_pct': 0.062040546431593985, 'sideways_tp_mult': 2.99124622552578, 'sideways_tsl_mult': 0.1222427466061643, 'sideways_time_stop': 70, 'sideways_use_sma': True, 'sideways_use_ema': False, 'sideways_use_atr': False, 'sideways_use_adx': False, 'sideways_use_spike': True, 'sideways_rsi_required': True}.
[I 2025-08-31 03:36:40,689] Trial 24 finished with values: [-1000000000.0, 1000000000.0] and parameters: {'p_sma': 32, 'p_std': 58, 'p_atr': 12, 'p_adx': 27, 'rsi_period': 52, 'ema1': 26, 'ema2': 32, 'slip_atr_k': 0.13825636745461115, 'slip_spread_k': 0.23785150093539736, 'spread_hl_frac': 0.0378656855740405, 'bb_std_mult': 2.5668421082183572, 'rsi_os': 25, 'rsi_ob': 53, 'vol_spike': 0.0086128943416168, 'adx_thresh': 26.846106365285628, 'atr_min_pct': 0.004398603375342758, 'atr_max_pct': 0.12235880014858055, 'tp_mult': 2.6148789625940223, 'tsl_mult': 0.13038788254649758, 'strategy': 'mean_reversion', 'time_stop': 258, 'use_sma': True, 'use_atr': False, 'use_adx': False, 'use_ema': True, 'use_spike': False, 'rsi_required': False, 'edge_k': 1.7017776696338647, 'edge_cap': 0.5788275562791749, 'bull_strategy': 'breakout', 'bull_bb_std_mult': 1.2251237772307226, 'bull_rsi_os': 33, 'bull_rsi_ob': 78, 'bull_adx_thresh': 24.280886855880055, 'bull_atr_min_pct': 0.019904385733640804, 'bull_atr_max_pct': 0.028504794739077438, 'bull_tp_mult': 2.205873515422199, 'bull_tsl_mult': 0.842526173619229, 'bull_time_stop': 127, 'bull_use_sma': False, 'bull_use_ema': True, 'bull_use_atr': False, 'bull_use_adx': True, 'bull_use_spike': True, 'bull_rsi_required': False, 'bear_strategy': 'breakout', 'bear_bb_std_mult': 3.5070528796812077, 'bear_rsi_os': 44, 'bear_rsi_ob': 66, 'bear_adx_thresh': 30.72225459870537, 'bear_atr_min_pct': 0.005865938604863502, 'bear_atr_max_pct': 0.1023227065599354, 'bear_tp_mult': 1.6234482844126585, 'bear_tsl_mult': 0.4301614548623088, 'bear_time_stop': 299, 'bear_use_sma': True, 'bear_use_ema': False, 'bear_use_atr': False, 'bear_use_adx': False, 'bear_use_spike': True, 'bear_rsi_required': True, 'sideways_strategy': 'mean_reversion', 'sideways_bb_std_mult': 1.5401361043605122, 'sideways_rsi_os': 46, 'sideways_rsi_ob': 79, 'sideways_adx_thresh': 24.445582244364374, 'sideways_atr_min_pct': 0.00821966036261116, 'sideways_atr_max_pct': 0.060272960296878425, 'sideways_tp_mult': 2.9731091099806353, 'sideways_tsl_mult': 0.14174001008647175, 'sideways_time_stop': 130, 'sideways_use_sma': True, 'sideways_use_ema': True, 'sideways_use_atr': False, 'sideways_use_adx': False, 'sideways_use_spike': True, 'sideways_rsi_required': True}.
[I 2025-08-31 03:36:41,733] Trial 26 finished with values: [-1000000000.0, 1000000000.0] and parameters: {'p_sma': 31, 'p_std': 30, 'p_atr': 11, 'p_adx': 30, 'rsi_period': 16, 'ema1': 25, 'ema2': 31, 'slip_atr_k': 0.20607851774327202, 'slip_spread_k': 0.22673688076797, 'spread_hl_frac': 0.039197204007265236, 'bb_std_mult': 3.0419029288501025, 'rsi_os': 50, 'rsi_ob': 52, 'vol_spike': 0.002392426911372425, 'adx_thresh': 16.341866877299104, 'atr_min_pct': 0.0297485204325851, 'atr_max_pct': 0.12588133858277675, 'tp_mult': 2.664470087088798, 'tsl_mult': 0.11076118523617479, 'strategy': 'breakout', 'time_stop': 239, 'use_sma': True, 'use_atr': False, 'use_adx': False, 'use_ema': True, 'use_spike': False, 'rsi_required': False, 'edge_k': 1.709530636347454, 'edge_cap': 0.5782494112735826, 'bull_strategy': 'mean_reversion', 'bull_bb_std_mult': 2.3868175759755714, 'bull_rsi_os': 33, 'bull_rsi_ob': 79, 'bull_adx_thresh': 24.291936402306057, 'bull_atr_min_pct': 0.011846730033310158, 'bull_atr_max_pct': 0.03353930177607057, 'bull_tp_mult': 2.5827555998877014, 'bull_tsl_mult': 0.8644716578462873, 'bull_time_stop': 7, 'bull_use_sma': False, 'bull_use_ema': True, 'bull_use_atr': False, 'bull_use_adx': True, 'bull_use_spike': True, 'bull_rsi_required': True, 'bear_strategy': 'breakout', 'bear_bb_std_mult': 3.4664847468021973, 'bear_rsi_os': 45, 'bear_rsi_ob': 54, 'bear_adx_thresh': 30.52881373049914, 'bear_atr_min_pct': 0.02548125231785865, 'bear_atr_max_pct': 0.10556613742376383, 'bear_tp_mult': 2.721206224348596, 'bear_tsl_mult': 0.4917933438858608, 'bear_time_stop': 299, 'bear_use_sma': False, 'bear_use_ema': False, 'bear_use_atr': False, 'bear_use_adx': False, 'bear_use_spike': True, 'bear_rsi_required': True, 'sideways_strategy': 'mean_reversion', 'sideways_bb_std_mult': 1.506299700572157, 'sideways_rsi_os': 13, 'sideways_rsi_ob': 79, 'sideways_adx_thresh': 23.06269987825718, 'sideways_atr_min_pct': 0.007944639749314225, 'sideways_atr_max_pct': 0.11712701245376198, 'sideways_tp_mult': 2.7394185135598152, 'sideways_tsl_mult': 0.16587715711366557, 'sideways_time_stop': 206, 'sideways_use_sma': True, 'sideways_use_ema': False, 'sideways_use_atr': False, 'sideways_use_adx': True, 'sideways_use_spike': True, 'sideways_rsi_required': False}.
[I 2025-08-31 03:36:41,747] Trial 25 finished with values: [-1000000000.0, 1000000000.0] and parameters: {'p_sma': 31, 'p_std': 28, 'p_atr': 13, 'p_adx': 27, 'rsi_period': 15, 'ema1': 26, 'ema2': 45, 'slip_atr_k': 0.0946001656158683, 'slip_spread_k': 0.2524465205333013, 'spread_hl_frac': 0.040119326107625725, 'bb_std_mult': 2.998741023652775, 'rsi_os': 48, 'rsi_ob': 52, 'vol_spike': 0.002896711757473802, 'adx_thresh': 16.36570065450625, 'atr_min_pct': 0.004402347116679049, 'atr_max_pct': 0.12005062553547094, 'tp_mult': 2.9977482329357708, 'tsl_mult': 0.0957922289437334, 'strategy': 'breakout', 'time_stop': 262, 'use_sma': True, 'use_atr': False, 'use_adx': False, 'use_ema': True, 'use_spike': False, 'rsi_required': False, 'edge_k': 1.7382606116924397, 'edge_cap': 0.570687851138138, 'bull_strategy': 'mean_reversion', 'bull_bb_std_mult': 2.2554784242728503, 'bull_rsi_os': 35, 'bull_rsi_ob': 80, 'bull_adx_thresh': 8.786975284508125, 'bull_atr_min_pct': 0.012585769450720232, 'bull_atr_max_pct': 0.025513719697336297, 'bull_tp_mult': 2.5631157828863538, 'bull_tsl_mult': 0.8655657463037829, 'bull_time_stop': 9, 'bull_use_sma': False, 'bull_use_ema': True, 'bull_use_atr': False, 'bull_use_adx': True, 'bull_use_spike': True, 'bull_rsi_required': True, 'bear_strategy': 'breakout', 'bear_bb_std_mult': 3.5718415534053634, 'bear_rsi_os': 43, 'bear_rsi_ob': 53, 'bear_adx_thresh': 30.99834665070118, 'bear_atr_min_pct': 0.025213278866500273, 'bear_atr_max_pct': 0.10283958002724519, 'bear_tp_mult': 1.2496480018281602, 'bear_tsl_mult': 0.43293192042562983, 'bear_time_stop': 293, 'bear_use_sma': False, 'bear_use_ema': False, 'bear_use_atr': False, 'bear_use_adx': False, 'bear_use_spike': True, 'bear_rsi_required': True, 'sideways_strategy': 'mean_reversion', 'sideways_bb_std_mult': 1.410788880525533, 'sideways_rsi_os': 49, 'sideways_rsi_ob': 79, 'sideways_adx_thresh': 22.969874723582905, 'sideways_atr_min_pct': 0.009330845420399445, 'sideways_atr_max_pct': 0.10794718848898882, 'sideways_tp_mult': 2.6388551992369145, 'sideways_tsl_mult': 0.11970783061108115, 'sideways_time_stop': 208, 'sideways_use_sma': True, 'sideways_use_ema': False, 'sideways_use_atr': False, 'sideways_use_adx': True, 'sideways_use_spike': True, 'sideways_rsi_required': False}.
