[I 2025-08-31 05:12:51,984] Trial 597 finished with values: [-0.010420803471665185, 0.01037553843135764] and parameters: {'p_sma': 57, 'p_std': 15, 'p_atr': 16, 'p_adx': 9, 'rsi_period': 20, 'ema1': 24, 'ema2': 25, 'slip_atr_k': 0.025317765796449607, 'slip_spread_k': 0.6721185295317199, 'spread_hl_frac': 0.009430222952674169, 'bb_std_mult': 1.974173044650366, 'rsi_os': 31, 'rsi_ob': 60, 'vol_spike': 0.016589236026927665, 'adx_thresh': 11.15727367583708, 'atr_min_pct': 0.023211627603995883, 'atr_max_pct': 0.11833965302291287, 'tp_mult': 2.456305815565294, 'tsl_mult': 0.8234573795788542, 'strategy': 'mean_reversion', 'time_stop': 32, 'use_sma': False, 'use_atr': True, 'use_adx': False, 'use_ema': False, 'use_spike': True, 'rsi_required': True, 'edge_k': 0.46255918263793094, 'edge_cap': 0.7678667818817078, 'bull_strategy': 'mean_reversion', 'bull_bb_std_mult': 0.9174267172169659, 'bull_rsi_os': 50, 'bull_rsi_ob': 78, 'bull_adx_thresh': 9.091138267775715, 'bull_atr_min_pct': 0.002165951235408745, 'bull_atr_max_pct': 0.04202739611244604, 'bull_tp_mult': 1.6503699847686049, 'bull_tsl_mult': 0.9066255863224977, 'bull_time_stop': 280, 'bull_use_sma': False, 'bull_use_ema': False, 'bull_use_atr': True, 'bull_use_adx': True, 'bull_use_spike': False, 'bull_rsi_required': False, 'bear_strategy': 'breakout', 'bear_bb_std_mult': 0.8419625746628411, 'bear_rsi_os': 10, 'bear_rsi_ob': 78, 'bear_adx_thresh': 18.1907629997748, 'bear_atr_min_pct': 0.008196661648573259, 'bear_atr_max_pct': 0.043838164101660027, 'bear_tp_mult': 1.1785357363160616, 'bear_tsl_mult': 0.22886706791896916, 'bear_time_stop': 252, 'bear_use_sma': True, 'bear_use_ema': True, 'bear_use_atr': True, 'bear_use_adx': False, 'bear_use_spike': False, 'bear_rsi_required': True, 'sideways_strategy': 'breakout', 'sideways_bb_std_mult': 1.14560571478956, 'sideways_rsi_os': 38, 'sideways_rsi_ob': 55, 'sideways_adx_thresh': 25.679037654901457, 'sideways_atr_min_pct': 0.014271406102178806, 'sideways_atr_max_pct': 0.018388939314708155, 'sideways_tp_mult': 2.0801079304950414, 'sideways_tsl_mult': 0.48569730609645034, 'sideways_time_stop': 206, 'sideways_use_sma': False, 'sideways_use_ema': True, 'sideways_use_atr': False, 'sideways_use_adx': False, 'sideways_use_spike': True, 'sideways_rsi_required': True}.
[I 2025-08-31 05:12:52,440] Trial 596 finished with values: [-1000000000.0, 1000000000.0] and parameters: {'p_sma': 56, 'p_std': 22, 'p_atr': 23, 'p_adx': 24, 'rsi_period': 44, 'ema1': 14, 'ema2': 22, 'slip_atr_k': 0.034820158271903504, 'slip_spread_k': 0.1502111087576859, 'spread_hl_frac': 0.00916100516835301, 'bb_std_mult': 2.8301181558276842, 'rsi_os': 29, 'rsi_ob': 87, 'vol_spike': 0.052993728474654694, 'adx_thresh': 12.835973804058437, 'atr_min_pct': 0.023304536955290497, 'atr_max_pct': 0.03967665539032335, 'tp_mult': 1.2516673732322747, 'tsl_mult': 0.8229620795027761, 'strategy': 'mean_reversion', 'time_stop': 298, 'use_sma': False, 'use_atr': False, 'use_adx': False, 'use_ema': False, 'use_spike': True, 'rsi_required': True, 'edge_k': 1.4271269240250064, 'edge_cap': 0.9840851255656795, 'bull_strategy': 'breakout', 'bull_bb_std_mult': 3.537742274474974, 'bull_rsi_os': 39, 'bull_rsi_ob': 76, 'bull_adx_thresh': 9.03007374252726, 'bull_atr_min_pct': 0.02064641708492613, 'bull_atr_max_pct': 0.04221602013613797, 'bull_tp_mult': 1.6438692995607067, 'bull_tsl_mult': 0.8999648128308503, 'bull_time_stop': 98, 'bull_use_sma': False, 'bull_use_ema': False, 'bull_use_atr': True, 'bull_use_adx': True, 'bull_use_spike': False, 'bull_rsi_required': False, 'bear_strategy': 'mean_reversion', 'bear_bb_std_mult': 3.2054750765699853, 'bear_rsi_os': 45, 'bear_rsi_ob': 54, 'bear_adx_thresh': 21.019012459896313, 'bear_atr_min_pct': 0.023335237255940795, 'bear_atr_max_pct': 0.04383084188291342, 'bear_tp_mult': 2.7784179533374185, 'bear_tsl_mult': 0.22850318548608484, 'bear_time_stop': 119, 'bear_use_sma': True, 'bear_use_ema': True, 'bear_use_atr': True, 'bear_use_adx': False, 'bear_use_spike': False, 'bear_rsi_required': True, 'sideways_strategy': 'breakout', 'sideways_bb_std_mult': 1.136900184832434, 'sideways_rsi_os': 25, 'sideways_rsi_ob': 83, 'sideways_adx_thresh': 6.965652373446932, 'sideways_atr_min_pct': 0.0130292270179438, 'sideways_atr_max_pct': 0.1496160447110419, 'sideways_tp_mult': 2.3496307103606924, 'sideways_tsl_mult': 0.27045486675217023, 'sideways_time_stop': 206, 'sideways_use_sma': False, 'sideways_use_ema': True, 'sideways_use_atr': False, 'sideways_use_adx': True, 'sideways_use_spike': True, 'sideways_rsi_required': True}.
[I 2025-08-31 05:12:52,734] Trial 594 finished with values: [-1000000000.0, 1000000000.0] and parameters: {'p_sma': 51, 'p_std': 15, 'p_atr': 23, 'p_adx': 9, 'rsi_period': 22, 'ema1': 14, 'ema2': 22, 'slip_atr_k': 0.08063708775354558, 'slip_spread_k': 0.10442127050902161, 'spread_hl_frac': 0.03385502156314326, 'bb_std_mult': 2.8226742368538345, 'rsi_os': 27, 'rsi_ob': 58, 'vol_spike': 0.07526141034084136, 'adx_thresh': 19.624069317390997, 'atr_min_pct': 0.02317882796029043, 'atr_max_pct': 0.08770550220851918, 'tp_mult': 2.6038518512107434, 'tsl_mult': 0.5471441510972821, 'strategy': 'mean_reversion', 'time_stop': 32, 'use_sma': False, 'use_atr': False, 'use_adx': False, 'use_ema': False, 'use_spike': True, 'rsi_required': True, 'edge_k': 1.4188082129616386, 'edge_cap': 0.7749828448710084, 'bull_strategy': 'mean_reversion', 'bull_bb_std_mult': 3.5296385923196234, 'bull_rsi_os': 12, 'bull_rsi_ob': 76, 'bull_adx_thresh': 33.50299402307086, 'bull_atr_min_pct': 0.002159333173380776, 'bull_atr_max_pct': 0.1356646502116792, 'bull_tp_mult': 2.406010482821566, 'bull_tsl_mult': 0.8993317443422668, 'bull_time_stop': 249, 'bull_use_sma': False, 'bull_use_ema': False, 'bull_use_atr': True, 'bull_use_adx': True, 'bull_use_spike': False, 'bull_rsi_required': False, 'bear_strategy': 'mean_reversion', 'bear_bb_std_mult': 0.8252753933047015, 'bear_rsi_os': 11, 'bear_rsi_ob': 47, 'bear_adx_thresh': 21.173288316853807, 'bear_atr_min_pct': 0.026284574445110676, 'bear_atr_max_pct': 0.13314427891837669, 'bear_tp_mult': 1.4160454916408, 'bear_tsl_mult': 0.935500360174376, 'bear_time_stop': 120, 'bear_use_sma': True, 'bear_use_ema': True, 'bear_use_atr': True, 'bear_use_adx': False, 'bear_use_spike': True, 'bear_rsi_required': True, 'sideways_strategy': 'breakout', 'sideways_bb_std_mult': 1.1216099202707155, 'sideways_rsi_os': 25, 'sideways_rsi_ob': 48, 'sideways_adx_thresh': 13.298395219882666, 'sideways_atr_min_pct': 0.014323285587046552, 'sideways_atr_max_pct': 0.10846221683482361, 'sideways_tp_mult': 2.040271366989287, 'sideways_tsl_mult': 0.607137665789293, 'sideways_time_stop': 48, 'sideways_use_sma': False, 'sideways_use_ema': True, 'sideways_use_atr': False, 'sideways_use_adx': True, 'sideways_use_spike': True, 'sideways_rsi_required': True}.
[I 2025-08-31 05:12:52,862] Trial 595 finished with values: [-0.012597409656710634, 0.012540354444960964] and parameters: {'p_sma': 55, 'p_std': 37, 'p_atr': 25, 'p_adx': 14, 'rsi_period': 22, 'ema1': 17, 'ema2': 23, 'slip_atr_k': 0.03409865277024033, 'slip_spread_k': 0.669172054562557, 'spread_hl_frac': 0.044198562716945985, 'bb_std_mult': 1.8199476467859526, 'rsi_os': 41, 'rsi_ob': 60, 'vol_spike': 0.27821527520452094, 'adx_thresh': 13.800739704460607, 'atr_min_pct': 0.00939771650971788, 'atr_max_pct': 0.05631218927053458, 'tp_mult': 2.4650982301340476, 'tsl_mult': 0.8256596575268158, 'strategy': 'mean_reversion', 'time_stop': 265, 'use_sma': False, 'use_atr': False, 'use_adx': False, 'use_ema': False, 'use_spike': True, 'rsi_required': True, 'edge_k': 1.030930591799409, 'edge_cap': 0.7790926540835181, 'bull_strategy': 'mean_reversion', 'bull_bb_std_mult': 2.8478133148482763, 'bull_rsi_os': 38, 'bull_rsi_ob': 76, 'bull_adx_thresh': 8.845099464693853, 'bull_atr_min_pct': 0.026057223745192787, 'bull_atr_max_pct': 0.09125669515069261, 'bull_tp_mult': 1.6520536272963675, 'bull_tsl_mult': 0.3908946216343069, 'bull_time_stop': 97, 'bull_use_sma': False, 'bull_use_ema': False, 'bull_use_atr': True, 'bull_use_adx': True, 'bull_use_spike': False, 'bull_rsi_required': False, 'bear_strategy': 'mean_reversion', 'bear_bb_std_mult': 2.3609487070916324, 'bear_rsi_os': 11, 'bear_rsi_ob': 47, 'bear_adx_thresh': 21.159021088140836, 'bear_atr_min_pct': 0.02216393827954896, 'bear_atr_max_pct': 0.04303158212081624, 'bear_tp_mult': 1.4236551045596229, 'bear_tsl_mult': 0.23344255508818174, 'bear_time_stop': 177, 'bear_use_sma': True, 'bear_use_ema': True, 'bear_use_atr': True, 'bear_use_adx': False, 'bear_use_spike': False, 'bear_rsi_required': True, 'sideways_strategy': 'breakout', 'sideways_bb_std_mult': 1.1500910167487317, 'sideways_rsi_os': 25, 'sideways_rsi_ob': 67, 'sideways_adx_thresh': 5.883277131236111, 'sideways_atr_min_pct': 0.0005824042609654575, 'sideways_atr_max_pct': 0.017473035868680528, 'sideways_tp_mult': 2.3658935610882774, 'sideways_tsl_mult': 0.2636917439171022, 'sideways_time_stop': 149, 'sideways_use_sma': False, 'sideways_use_ema': True, 'sideways_use_atr': False, 'sideways_use_adx': True, 'sideways_use_spike': True, 'sideways_rsi_required': True}.
[I 2025-08-31 05:13:37,599] Trial 600 finished with values: [-1000000000.0, 1000000000.0] and parameters: {'p_sma': 59, 'p_std': 12, 'p_atr': 15, 'p_adx': 10, 'rsi_period': 17, 'ema1': 24, 'ema2': 23, 'slip_atr_k': 0.03741109334393569, 'slip_spread_k': 0.6766096885405163, 'spread_hl_frac': 0.006912270364148496, 'bb_std_mult': 2.0464855725894027, 'rsi_os': 41, 'rsi_ob': 60, 'vol_spike': 0.006225921801607489, 'adx_thresh': 10.393639783593837, 'atr_min_pct': 0.024231441835823493, 'atr_max_pct': 0.10354347534953767, 'tp_mult': 2.397236846339941, 'tsl_mult': 0.7817429047249643, 'strategy': 'mean_reversion', 'time_stop': 19, 'use_sma': False, 'use_atr': True, 'use_adx': False, 'use_ema': False, 'use_spike': True, 'rsi_required': True, 'edge_k': 0.47471465152304226, 'edge_cap': 0.7590536445356204, 'bull_strategy': 'mean_reversion', 'bull_bb_std_mult': 0.9099514589421835, 'bull_rsi_os': 50, 'bull_rsi_ob': 81, 'bull_adx_thresh': 8.416148999249003, 'bull_atr_min_pct': 0.00795039493810076, 'bull_atr_max_pct': 0.029891730796730354, 'bull_tp_mult': 1.711066401538213, 'bull_tsl_mult': 0.9721089246533898, 'bull_time_stop': 278, 'bull_use_sma': False, 'bull_use_ema': False, 'bull_use_atr': True, 'bull_use_adx': True, 'bull_use_spike': False, 'bull_rsi_required': False, 'bear_strategy': 'breakout', 'bear_bb_std_mult': 0.6726046042352372, 'bear_rsi_os': 13, 'bear_rsi_ob': 78, 'bear_adx_thresh': 12.833517535668392, 'bear_atr_min_pct': 0.008669132665983806, 'bear_atr_max_pct': 0.04884654042816881, 'bear_tp_mult': 1.1496157062665993, 'bear_tsl_mult': 0.1813762610356606, 'bear_time_stop': 253, 'bear_use_sma': True, 'bear_use_ema': True, 'bear_use_atr': True, 'bear_use_adx': False, 'bear_use_spike': False, 'bear_rsi_required': True, 'sideways_strategy': 'breakout', 'sideways_bb_std_mult': 1.2923351015892062, 'sideways_rsi_os': 38, 'sideways_rsi_ob': 56, 'sideways_adx_thresh': 25.586470820171247, 'sideways_atr_min_pct': 0.015156959573757445, 'sideways_atr_max_pct': 0.012407059587395356, 'sideways_tp_mult': 2.1667775749983536, 'sideways_tsl_mult': 0.4865540233411286, 'sideways_time_stop': 202, 'sideways_use_sma': False, 'sideways_use_ema': True, 'sideways_use_atr': False, 'sideways_use_adx': False, 'sideways_use_spike': True, 'sideways_rsi_required': True}.
[I 2025-08-31 05:13:37,845] Trial 598 finished with values: [-1000000000.0, 1000000000.0] and parameters: {'p_sma': 60, 'p_std': 13, 'p_atr': 15, 'p_adx': 9, 'rsi_period': 16, 'ema1': 24, 'ema2': 23, 'slip_atr_k': 0.03735331091600824, 'slip_spread_k': 0.6732387698944038, 'spread_hl_frac': 0.007503982909001877, 'bb_std_mult': 2.1049562499165497, 'rsi_os': 21, 'rsi_ob': 59, 'vol_spike': 0.005777159931034493, 'adx_thresh': 10.60321048612701, 'atr_min_pct': 0.024515675043353453, 'atr_max_pct': 0.10985368739358231, 'tp_mult': 2.3792014626386537, 'tsl_mult': 0.8011922458604237, 'strategy': 'mean_reversion', 'time_stop': 21, 'use_sma': False, 'use_atr': True, 'use_adx': False, 'use_ema': False, 'use_spike': True, 'rsi_required': True, 'edge_k': 0.4616992085404211, 'edge_cap': 0.7767801251496664, 'bull_strategy': 'mean_reversion', 'bull_bb_std_mult': 0.8909383373151921, 'bull_rsi_os': 52, 'bull_rsi_ob': 81, 'bull_adx_thresh': 7.968814661082632, 'bull_atr_min_pct': 0.007912821257925216, 'bull_atr_max_pct': 0.029636540556782328, 'bull_tp_mult': 1.6959105093870706, 'bull_tsl_mult': 0.9444445075992788, 'bull_time_stop': 283, 'bull_use_sma': False, 'bull_use_ema': False, 'bull_use_atr': True, 'bull_use_adx': True, 'bull_use_spike': False, 'bull_rsi_required': False, 'bear_strategy': 'breakout', 'bear_bb_std_mult': 0.6653570513058349, 'bear_rsi_os': 12, 'bear_rsi_ob': 78, 'bear_adx_thresh': 14.522451826654073, 'bear_atr_min_pct': 0.008639996279381657, 'bear_atr_max_pct': 0.0527939956827058, 'bear_tp_mult': 1.1721852718262156, 'bear_tsl_mult': 0.1849039609788102, 'bear_time_stop': 250, 'bear_use_sma': True, 'bear_use_ema': True, 'bear_use_atr': True, 'bear_use_adx': False, 'bear_use_spike': False, 'bear_rsi_required': True, 'sideways_strategy': 'breakout', 'sideways_bb_std_mult': 1.2874115221146, 'sideways_rsi_os': 37, 'sideways_rsi_ob': 57, 'sideways_adx_thresh': 25.918370229534553, 'sideways_atr_min_pct': 0.01569249517881456, 'sideways_atr_max_pct': 0.018202107817331996, 'sideways_tp_mult': 2.142900411548908, 'sideways_tsl_mult': 0.47716739778128653, 'sideways_time_stop': 205, 'sideways_use_sma': False, 'sideways_use_ema': True, 'sideways_use_atr': False, 'sideways_use_adx': False, 'sideways_use_spike': True, 'sideways_rsi_required': True}.
[I 2025-08-31 05:13:38,325] Trial 599 finished with values: [-1000000000.0, 1000000000.0] and parameters: {'p_sma': 60, 'p_std': 12, 'p_atr': 16, 'p_adx': 9, 'rsi_period': 19, 'ema1': 24, 'ema2': 23, 'slip_atr_k': 0.03710851274070601, 'slip_spread_k': 0.6701280308569981, 'spread_hl_frac': 0.006288758047938277, 'bb_std_mult': 2.075229927740752, 'rsi_os': 36, 'rsi_ob': 60, 'vol_spike': 0.004515703296951537, 'adx_thresh': 10.426967109203611, 'atr_min_pct': 0.024463597844040886, 'atr_max_pct': 0.1106341000373695, 'tp_mult': 2.397789717608025, 'tsl_mult': 0.7790298861744385, 'strategy': 'mean_reversion', 'time_stop': 18, 'use_sma': False, 'use_atr': True, 'use_adx': False, 'use_ema': False, 'use_spike': True, 'rsi_required': True, 'edge_k': 0.4919843943105789, 'edge_cap': 0.7741940873397191, 'bull_strategy': 'mean_reversion', 'bull_bb_std_mult': 0.9219786010242119, 'bull_rsi_os': 52, 'bull_rsi_ob': 80, 'bull_adx_thresh': 8.669834720564031, 'bull_atr_min_pct': 0.008247496781383836, 'bull_atr_max_pct': 0.03054722675892229, 'bull_tp_mult': 1.7422183764483443, 'bull_tsl_mult': 0.9752114702677991, 'bull_time_stop': 291, 'bull_use_sma': False, 'bull_use_ema': False, 'bull_use_atr': True, 'bull_use_adx': True, 'bull_use_spike': False, 'bull_rsi_required': False, 'bear_strategy': 'breakout', 'bear_bb_std_mult': 0.6708844715383997, 'bear_rsi_os': 13, 'bear_rsi_ob': 78, 'bear_adx_thresh': 14.459155324447863, 'bear_atr_min_pct': 0.00831926426909695, 'bear_atr_max_pct': 0.05291593032535845, 'bear_tp_mult': 1.163122018821454, 'bear_tsl_mult': 0.17411210355316603, 'bear_time_stop': 250, 'bear_use_sma': True, 'bear_use_ema': True, 'bear_use_atr': True, 'bear_use_adx': False, 'bear_use_spike': False, 'bear_rsi_required': True, 'sideways_strategy': 'breakout', 'sideways_bb_std_mult': 1.2942427622509913, 'sideways_rsi_os': 38, 'sideways_rsi_ob': 58, 'sideways_adx_thresh': 25.501458445427026, 'sideways_atr_min_pct': 0.015527954275116, 'sideways_atr_max_pct': 0.013354697150931478, 'sideways_tp_mult': 2.21046776967373, 'sideways_tsl_mult': 0.48072390511956076, 'sideways_time_stop': 205, 'sideways_use_sma': False, 'sideways_use_ema': True, 'sideways_use_atr': False, 'sideways_use_adx': False, 'sideways_use_spike': True, 'sideways_rsi_required': True}.
[I 2025-08-31 05:13:38,437] Trial 601 finished with values: [-1000000000.0, 1000000000.0] and parameters: {'p_sma': 59, 'p_std': 12, 'p_atr': 16, 'p_adx': 10, 'rsi_period': 17, 'ema1': 24, 'ema2': 23, 'slip_atr_k': 0.04112149500075754, 'slip_spread_k': 0.6698590756553389, 'spread_hl_frac': 0.0072170298775074485, 'bb_std_mult': 2.042146240219624, 'rsi_os': 36, 'rsi_ob': 60, 'vol_spike': 0.0014429975019184752, 'adx_thresh': 10.430038982290698, 'atr_min_pct': 0.024394907876150163, 'atr_max_pct': 0.10827862654403654, 'tp_mult': 2.3770911782064026, 'tsl_mult': 0.7940790375841054, 'strategy': 'mean_reversion', 'time_stop': 19, 'use_sma': False, 'use_atr': True, 'use_adx': False, 'use_ema': False, 'use_spike': True, 'rsi_required': True, 'edge_k': 0.46060682606084447, 'edge_cap': 0.7596214756267049, 'bull_strategy': 'mean_reversion', 'bull_bb_std_mult': 0.9215303453546038, 'bull_rsi_os': 52, 'bull_rsi_ob': 81, 'bull_adx_thresh': 8.382692152284125, 'bull_atr_min_pct': 0.005576671354097231, 'bull_atr_max_pct': 0.02627157870616357, 'bull_tp_mult': 1.7457008856021414, 'bull_tsl_mult': 0.9442805765686224, 'bull_time_stop': 280, 'bull_use_sma': False, 'bull_use_ema': False, 'bull_use_atr': True, 'bull_use_adx': True, 'bull_use_spike': False, 'bull_rsi_required': False, 'bear_strategy': 'breakout', 'bear_bb_std_mult': 0.6539551549499684, 'bear_rsi_os': 11, 'bear_rsi_ob': 78, 'bear_adx_thresh': 13.47559570904643, 'bear_atr_min_pct': 0.008117981530244366, 'bear_atr_max_pct': 0.051363352718093516, 'bear_tp_mult': 1.1797984058481668, 'bear_tsl_mult': 0.18649596918667405, 'bear_time_stop': 236, 'bear_use_sma': True, 'bear_use_ema': True, 'bear_use_atr': True, 'bear_use_adx': False, 'bear_use_spike': False, 'bear_rsi_required': True, 'sideways_strategy': 'breakout', 'sideways_bb_std_mult': 1.2900195782193982, 'sideways_rsi_os': 38, 'sideways_rsi_ob': 57, 'sideways_adx_thresh': 25.339557479575912, 'sideways_atr_min_pct': 0.015380076805938787, 'sideways_atr_max_pct': 0.019380816053590006, 'sideways_tp_mult': 2.173287309098107, 'sideways_tsl_mult': 0.4747164520449863, 'sideways_time_stop': 202, 'sideways_use_sma': False, 'sideways_use_ema': True, 'sideways_use_atr': False, 'sideways_use_adx': False, 'sideways_use_spike': True, 'sideways_rsi_required': True}.
[I 2025-08-31 05:14:22,760] Trial 602 finished with values: [-1000000000.0, 1000000000.0] and parameters: {'p_sma': 59, 'p_std': 13, 'p_atr': 16, 'p_adx': 8, 'rsi_period': 16, 'ema1': 23, 'ema2': 24, 'slip_atr_k': 0.04057967187448569, 'slip_spread_k': 0.6612547326324343, 'spread_hl_frac': 0.008068273932006117, 'bb_std_mult': 2.1005642151308193, 'rsi_os': 36, 'rsi_ob': 59, 'vol_spike': 0.004202341357915253, 'adx_thresh': 11.109386319573932, 'atr_min_pct': 0.02362052916370928, 'atr_max_pct': 0.10182443262503466, 'tp_mult': 2.3622680667879212, 'tsl_mult': 0.7989042095961956, 'strategy': 'mean_reversion', 'time_stop': 19, 'use_sma': False, 'use_atr': True, 'use_adx': False, 'use_ema': False, 'use_spike': True, 'rsi_required': True, 'edge_k': 0.4060929275879204, 'edge_cap': 0.7842020653278405, 'bull_strategy': 'mean_reversion', 'bull_bb_std_mult': 0.9242890493840193, 'bull_rsi_os': 52, 'bull_rsi_ob': 80, 'bull_adx_thresh': 8.83924136212314, 'bull_atr_min_pct': 0.013754749371725555, 'bull_atr_max_pct': 0.026731455958762862, 'bull_tp_mult': 1.7566721372112788, 'bull_tsl_mult': 0.9461972293407639, 'bull_time_stop': 284, 'bull_use_sma': False, 'bull_use_ema': False, 'bull_use_atr': True, 'bull_use_adx': True, 'bull_use_spike': False, 'bull_rsi_required': False, 'bear_strategy': 'breakout', 'bear_bb_std_mult': 0.7389117331665782, 'bear_rsi_os': 12, 'bear_rsi_ob': 76, 'bear_adx_thresh': 14.537054222920627, 'bear_atr_min_pct': 0.00809968346725588, 'bear_atr_max_pct': 0.05174578990036541, 'bear_tp_mult': 1.2397125374825293, 'bear_tsl_mult': 0.20067750828587083, 'bear_time_stop': 250, 'bear_use_sma': True, 'bear_use_ema': True, 'bear_use_atr': True, 'bear_use_adx': False, 'bear_use_spike': False, 'bear_rsi_required': True, 'sideways_strategy': 'breakout', 'sideways_bb_std_mult': 1.2394255819475244, 'sideways_rsi_os': 39, 'sideways_rsi_ob': 58, 'sideways_adx_thresh': 26.281261888828517, 'sideways_atr_min_pct': 0.015175048513919674, 'sideways_atr_max_pct': 0.019458313592195006, 'sideways_tp_mult': 2.110975176739953, 'sideways_tsl_mult': 0.469801080037087, 'sideways_time_stop': 210, 'sideways_use_sma': False, 'sideways_use_ema': True, 'sideways_use_atr': False, 'sideways_use_adx': False, 'sideways_use_spike': True, 'sideways_rsi_required': True}.
