[I 2025-08-31 03:44:09,907] Trial 89 finished with values: [-1000000000.0, 1000000000.0] and parameters: {'p_sma': 57, 'p_std': 15, 'p_atr': 15, 'p_adx': 9, 'rsi_period': 7, 'ema1': 21, 'ema2': 36, 'slip_atr_k': 0.1499787585361984, 'slip_spread_k': 0.8011093991985212, 'spread_hl_frac': 0.029869809116990234, 'bb_std_mult': 1.1307759998819877, 'rsi_os': 8, 'rsi_ob': 78, 'vol_spike': 0.16486869830110856, 'adx_thresh': 22.64577667770464, 'atr_min_pct': 0.008063188197832942, 'atr_max_pct': 0.051593797035737445, 'tp_mult': 1.4906960634749016, 'tsl_mult': 0.10534519235514485, 'strategy': 'mean_reversion', 'time_stop': 185, 'use_sma': False, 'use_atr': False, 'use_adx': True, 'use_ema': True, 'use_spike': False, 'rsi_required': True, 'edge_k': 0.24503311092488037, 'edge_cap': 0.5082235888751843, 'bull_strategy': 'breakout', 'bull_bb_std_mult': 2.5352520033453456, 'bull_rsi_os': 29, 'bull_rsi_ob': 90, 'bull_adx_thresh': 34.50428057003524, 'bull_atr_min_pct': 0.0037031299210396507, 'bull_atr_max_pct': 0.144785107520187, 'bull_tp_mult': 2.730578561238995, 'bull_tsl_mult': 0.9080569469878892, 'bull_time_stop': 260, 'bull_use_sma': True, 'bull_use_ema': True, 'bull_use_atr': True, 'bull_use_adx': False, 'bull_use_spike': True, 'bull_rsi_required': False, 'bear_strategy': 'breakout', 'bear_bb_std_mult': 1.9954364898684498, 'bear_rsi_os': 13, 'bear_rsi_ob': 59, 'bear_adx_thresh': 12.560813455602538, 'bear_atr_min_pct': 0.012744941234982796, 'bear_atr_max_pct': 0.08368052699652105, 'bear_tp_mult': 1.2014876494097748, 'bear_tsl_mult': 0.6183367351405834, 'bear_time_stop': 64, 'bear_use_sma': False, 'bear_use_ema': False, 'bear_use_atr': True, 'bear_use_adx': False, 'bear_use_spike': False, 'bear_rsi_required': False, 'sideways_strategy': 'breakout', 'sideways_bb_std_mult': 2.959405856042298, 'sideways_rsi_os': 51, 'sideways_rsi_ob': 80, 'sideways_adx_thresh': 27.787962409032776, 'sideways_atr_min_pct': 0.0271134216172893, 'sideways_atr_max_pct': 0.06288279430035872, 'sideways_tp_mult': 2.762027823604207, 'sideways_tsl_mult': 0.7145116761522682, 'sideways_time_stop': 284, 'sideways_use_sma': True, 'sideways_use_ema': True, 'sideways_use_atr': True, 'sideways_use_adx': False, 'sideways_use_spike': False, 'sideways_rsi_required': False}.
[I 2025-08-31 03:44:39,505] Trial 94 finished with values: [-1000000000.0, 1000000000.0] and parameters: {'p_sma': 53, 'p_std': 18, 'p_atr': 14, 'p_adx': 11, 'rsi_period': 11, 'ema1': 22, 'ema2': 38, 'slip_atr_k': 0.18041741228589245, 'slip_spread_k': 0.06198704584182979, 'spread_hl_frac': 0.024836989649445248, 'bb_std_mult': 0.5750846946690651, 'rsi_os': 7, 'rsi_ob': 67, 'vol_spike': 0.16634098716040643, 'adx_thresh': 25.321614955218795, 'atr_min_pct': 0.013022763968762001, 'atr_max_pct': 0.0658854246716696, 'tp_mult': 1.2927320468089472, 'tsl_mult': 0.13474098170708965, 'strategy': 'mean_reversion', 'time_stop': 149, 'use_sma': False, 'use_atr': False, 'use_adx': True, 'use_ema': True, 'use_spike': False, 'rsi_required': True, 'edge_k': 0.1627522614066081, 'edge_cap': 0.39453222347153605, 'bull_strategy': 'breakout', 'bull_bb_std_mult': 2.330884179511684, 'bull_rsi_os': 24, 'bull_rsi_ob': 93, 'bull_adx_thresh': 33.13595249813769, 'bull_atr_min_pct': 0.0008815329712237457, 'bull_atr_max_pct': 0.14795511857478072, 'bull_tp_mult': 2.9455743539681887, 'bull_tsl_mult': 0.7917136232746815, 'bull_time_stop': 294, 'bull_use_sma': True, 'bull_use_ema': True, 'bull_use_atr': True, 'bull_use_adx': False, 'bull_use_spike': True, 'bull_rsi_required': False, 'bear_strategy': 'breakout', 'bear_bb_std_mult': 2.111754917136177, 'bear_rsi_os': 31, 'bear_rsi_ob': 62, 'bear_adx_thresh': 11.481561393512557, 'bear_atr_min_pct': 0.015714660907080284, 'bear_atr_max_pct': 0.09657301794687638, 'bear_tp_mult': 1.3738587984141837, 'bear_tsl_mult': 0.45757549622348775, 'bear_time_stop': 30, 'bear_use_sma': False, 'bear_use_ema': False, 'bear_use_atr': True, 'bear_use_adx': False, 'bear_use_spike': False, 'bear_rsi_required': False, 'sideways_strategy': 'breakout', 'sideways_bb_std_mult': 3.3253321226640544, 'sideways_rsi_os': 53, 'sideways_rsi_ob': 77, 'sideways_adx_thresh': 26.696772470871533, 'sideways_atr_min_pct': 0.025771755793244935, 'sideways_atr_max_pct': 0.0719206298285218, 'sideways_tp_mult': 2.687810473743853, 'sideways_tsl_mult': 0.7751910703573799, 'sideways_time_stop': 270, 'sideways_use_sma': True, 'sideways_use_ema': True, 'sideways_use_atr': True, 'sideways_use_adx': False, 'sideways_use_spike': False, 'sideways_rsi_required': False}.
[I 2025-08-31 03:44:39,506] Trial 93 finished with values: [-1000000000.0, 1000000000.0] and parameters: {'p_sma': 54, 'p_std': 18, 'p_atr': 14, 'p_adx': 11, 'rsi_period': 11, 'ema1': 24, 'ema2': 39, 'slip_atr_k': 0.16038543653479986, 'slip_spread_k': 0.8669941900077082, 'spread_hl_frac': 0.02432969895044319, 'bb_std_mult': 0.5493900353967645, 'rsi_os': 7, 'rsi_ob': 65, 'vol_spike': 0.1677018622636473, 'adx_thresh': 24.92038622102676, 'atr_min_pct': 0.013487154228102764, 'atr_max_pct': 0.06736459816763732, 'tp_mult': 1.8255482065757194, 'tsl_mult': 0.29421647348489, 'strategy': 'mean_reversion', 'time_stop': 128, 'use_sma': False, 'use_atr': False, 'use_adx': True, 'use_ema': True, 'use_spike': False, 'rsi_required': True, 'edge_k': 0.1148997242530505, 'edge_cap': 0.3913678488149049, 'bull_strategy': 'breakout', 'bull_bb_std_mult': 2.713276997025716, 'bull_rsi_os': 25, 'bull_rsi_ob': 93, 'bull_adx_thresh': 33.41688300704644, 'bull_atr_min_pct': 0.0009348500396781731, 'bull_atr_max_pct': 0.1394265522121892, 'bull_tp_mult': 2.9341722314476817, 'bull_tsl_mult': 0.7947229191927212, 'bull_time_stop': 295, 'bull_use_sma': True, 'bull_use_ema': True, 'bull_use_atr': True, 'bull_use_adx': False, 'bull_use_spike': True, 'bull_rsi_required': False, 'bear_strategy': 'breakout', 'bear_bb_std_mult': 2.1427044983902612, 'bear_rsi_os': 31, 'bear_rsi_ob': 63, 'bear_adx_thresh': 11.425734420463673, 'bear_atr_min_pct': 0.015889710294749455, 'bear_atr_max_pct': 0.08891072892054903, 'bear_tp_mult': 1.3320173838684626, 'bear_tsl_mult': 0.4828183331552335, 'bear_time_stop': 75, 'bear_use_sma': False, 'bear_use_ema': False, 'bear_use_atr': True, 'bear_use_adx': False, 'bear_use_spike': False, 'bear_rsi_required': False, 'sideways_strategy': 'breakout', 'sideways_bb_std_mult': 3.28722642492575, 'sideways_rsi_os': 52, 'sideways_rsi_ob': 77, 'sideways_adx_thresh': 32.13666572980361, 'sideways_atr_min_pct': 0.026260348767059932, 'sideways_atr_max_pct': 0.06540853724035775, 'sideways_tp_mult': 2.6883199528345645, 'sideways_tsl_mult': 0.8419914529095655, 'sideways_time_stop': 277, 'sideways_use_sma': True, 'sideways_use_ema': True, 'sideways_use_atr': True, 'sideways_use_adx': False, 'sideways_use_spike': False, 'sideways_rsi_required': False}.
[I 2025-08-31 03:44:39,658] Trial 92 finished with values: [-1000000000.0, 1000000000.0] and parameters: {'p_sma': 54, 'p_std': 18, 'p_atr': 14, 'p_adx': 11, 'rsi_period': 11, 'ema1': 22, 'ema2': 38, 'slip_atr_k': 0.16044347756189709, 'slip_spread_k': 0.8678337671479985, 'spread_hl_frac': 0.024544259110598193, 'bb_std_mult': 0.5687385767579651, 'rsi_os': 7, 'rsi_ob': 74, 'vol_spike': 0.18531564994420344, 'adx_thresh': 24.807435895769697, 'atr_min_pct': 0.011007436299458166, 'atr_max_pct': 0.06584222457923, 'tp_mult': 1.297069359791104, 'tsl_mult': 0.13977710570293742, 'strategy': 'mean_reversion', 'time_stop': 148, 'use_sma': False, 'use_atr': False, 'use_adx': True, 'use_ema': True, 'use_spike': False, 'rsi_required': True, 'edge_k': 0.3193590468068692, 'edge_cap': 0.39967763615489577, 'bull_strategy': 'breakout', 'bull_bb_std_mult': 2.7038939635490338, 'bull_rsi_os': 27, 'bull_rsi_ob': 93, 'bull_adx_thresh': 33.16810941339278, 'bull_atr_min_pct': 0.0009294582108309922, 'bull_atr_max_pct': 0.1499128709473799, 'bull_tp_mult': 2.9378265804755435, 'bull_tsl_mult': 0.8005253389991109, 'bull_time_stop': 294, 'bull_use_sma': True, 'bull_use_ema': True, 'bull_use_atr': True, 'bull_use_adx': False, 'bull_use_spike': True, 'bull_rsi_required': False, 'bear_strategy': 'breakout', 'bear_bb_std_mult': 2.134802308073347, 'bear_rsi_os': 30, 'bear_rsi_ob': 63, 'bear_adx_thresh': 11.754508404130139, 'bear_atr_min_pct': 0.011135448459639857, 'bear_atr_max_pct': 0.08983595895881367, 'bear_tp_mult': 1.3435324747355266, 'bear_tsl_mult': 0.4559441890170828, 'bear_time_stop': 31, 'bear_use_sma': False, 'bear_use_ema': False, 'bear_use_atr': True, 'bear_use_adx': False, 'bear_use_spike': False, 'bear_rsi_required': False, 'sideways_strategy': 'breakout', 'sideways_bb_std_mult': 3.286281171884985, 'sideways_rsi_os': 52, 'sideways_rsi_ob': 77, 'sideways_adx_thresh': 25.03162653644808, 'sideways_atr_min_pct': 0.025357169222047993, 'sideways_atr_max_pct': 0.07251237038689404, 'sideways_tp_mult': 2.4930595900827512, 'sideways_tsl_mult': 0.7656723675012418, 'sideways_time_stop': 271, 'sideways_use_sma': True, 'sideways_use_ema': True, 'sideways_use_atr': True, 'sideways_use_adx': False, 'sideways_use_spike': False, 'sideways_rsi_required': False}.
[I 2025-08-31 03:44:39,730] Trial 91 finished with values: [-1000000000.0, 1000000000.0] and parameters: {'p_sma': 55, 'p_std': 18, 'p_atr': 15, 'p_adx': 9, 'rsi_period': 11, 'ema1': 24, 'ema2': 32, 'slip_atr_k': 0.1609131058284871, 'slip_spread_k': 0.8779454964600865, 'spread_hl_frac': 0.029695192062304282, 'bb_std_mult': 0.538605535048247, 'rsi_os': 7, 'rsi_ob': 65, 'vol_spike': 0.16706135919233597, 'adx_thresh': 25.706717287642586, 'atr_min_pct': 0.009511840430312602, 'atr_max_pct': 0.07403271667649981, 'tp_mult': 1.819067889287938, 'tsl_mult': 0.09512180777904089, 'strategy': 'mean_reversion', 'time_stop': 184, 'use_sma': False, 'use_atr': False, 'use_adx': True, 'use_ema': True, 'use_spike': False, 'rsi_required': True, 'edge_k': 0.10382209552628213, 'edge_cap': 0.5497909444175434, 'bull_strategy': 'breakout', 'bull_bb_std_mult': 2.34279537132972, 'bull_rsi_os': 28, 'bull_rsi_ob': 90, 'bull_adx_thresh': 34.786646079011554, 'bull_atr_min_pct': 0.004963350330543901, 'bull_atr_max_pct': 0.1420945180184776, 'bull_tp_mult': 2.7173021043261163, 'bull_tsl_mult': 0.886061698583292, 'bull_time_stop': 269, 'bull_use_sma': True, 'bull_use_ema': True, 'bull_use_atr': True, 'bull_use_adx': False, 'bull_use_spike': True, 'bull_rsi_required': False, 'bear_strategy': 'breakout', 'bear_bb_std_mult': 2.0451393394981316, 'bear_rsi_os': 30, 'bear_rsi_ob': 63, 'bear_adx_thresh': 11.219938818043786, 'bear_atr_min_pct': 0.012898465185945743, 'bear_atr_max_pct': 0.08219195458356797, 'bear_tp_mult': 1.3553729622380395, 'bear_tsl_mult': 0.4743887559727962, 'bear_time_stop': 75, 'bear_use_sma': False, 'bear_use_ema': False, 'bear_use_atr': True, 'bear_use_adx': False, 'bear_use_spike': False, 'bear_rsi_required': False, 'sideways_strategy': 'breakout', 'sideways_bb_std_mult': 2.9957948758687376, 'sideways_rsi_os': 52, 'sideways_rsi_ob': 80, 'sideways_adx_thresh': 27.339775777987327, 'sideways_atr_min_pct': 0.026708194483929165, 'sideways_atr_max_pct': 0.07391623243111194, 'sideways_tp_mult': 2.4744033778403134, 'sideways_tsl_mult': 0.7011332593330017, 'sideways_time_stop': 268, 'sideways_use_sma': True, 'sideways_use_ema': True, 'sideways_use_atr': True, 'sideways_use_adx': False, 'sideways_use_spike': False, 'sideways_rsi_required': False}.
[I 2025-08-31 03:45:09,484] Trial 98 finished with values: [-1000000000.0, 1000000000.0] and parameters: {'p_sma': 59, 'p_std': 28, 'p_atr': 13, 'p_adx': 10, 'rsi_period': 16, 'ema1': 17, 'ema2': 31, 'slip_atr_k': 0.1390274138940734, 'slip_spread_k': 0.9093498744976765, 'spread_hl_frac': 0.03672213224970128, 'bb_std_mult': 1.1075426240437103, 'rsi_os': 5, 'rsi_ob': 73, 'vol_spike': 0.15290623042689114, 'adx_thresh': 24.0560070700438, 'atr_min_pct': 0.016809132771362652, 'atr_max_pct': 0.07652431900774824, 'tp_mult': 1.1544635175021836, 'tsl_mult': 0.2769745134418271, 'strategy': 'mean_reversion', 'time_stop': 270, 'use_sma': False, 'use_atr': False, 'use_adx': True, 'use_ema': True, 'use_spike': False, 'rsi_required': True, 'edge_k': 0.5788135257987024, 'edge_cap': 0.4711110906251099, 'bull_strategy': 'breakout', 'bull_bb_std_mult': 2.8847552676781874, 'bull_rsi_os': 30, 'bull_rsi_ob': 95, 'bull_adx_thresh': 30.79287281624474, 'bull_atr_min_pct': 0.00022637145867537953, 'bull_atr_max_pct': 0.13626854573370897, 'bull_tp_mult': 1.9356963995643013, 'bull_tsl_mult': 0.7147853915912279, 'bull_time_stop': 181, 'bull_use_sma': True, 'bull_use_ema': True, 'bull_use_atr': True, 'bull_use_adx': False, 'bull_use_spike': True, 'bull_rsi_required': False, 'bear_strategy': 'breakout', 'bear_bb_std_mult': 2.3723042165742987, 'bear_rsi_os': 35, 'bear_rsi_ob': 65, 'bear_adx_thresh': 13.565628047900308, 'bear_atr_min_pct': 0.0247810425770243, 'bear_atr_max_pct': 0.0554116240534634, 'bear_tp_mult': 1.286259313726595, 'bear_tsl_mult': 0.5609651630027827, 'bear_time_stop': 57, 'bear_use_sma': False, 'bear_use_ema': False, 'bear_use_atr': True, 'bear_use_adx': False, 'bear_use_spike': False, 'bear_rsi_required': False, 'sideways_strategy': 'breakout', 'sideways_bb_std_mult': 3.393598765447159, 'sideways_rsi_os': 55, 'sideways_rsi_ob': 51, 'sideways_adx_thresh': 15.633187301212015, 'sideways_atr_min_pct': 0.02202293759987963, 'sideways_atr_max_pct': 0.08119986423570678, 'sideways_tp_mult': 2.556256765778195, 'sideways_tsl_mult': 0.7531952677980045, 'sideways_time_stop': 291, 'sideways_use_sma': True, 'sideways_use_ema': True, 'sideways_use_atr': True, 'sideways_use_adx': False, 'sideways_use_spike': False, 'sideways_rsi_required': False}.
[I 2025-08-31 03:45:09,496] Trial 95 finished with values: [-1000000000.0, 1000000000.0] and parameters: {'p_sma': 58, 'p_std': 17, 'p_atr': 11, 'p_adx': 8, 'rsi_period': 16, 'ema1': 18, 'ema2': 31, 'slip_atr_k': 0.164926190841625, 'slip_spread_k': 0.9075267373110664, 'spread_hl_frac': 0.035657890435154646, 'bb_std_mult': 1.103648765776192, 'rsi_os': 5, 'rsi_ob': 74, 'vol_spike': 0.18039716339938722, 'adx_thresh': 24.321724936829998, 'atr_min_pct': 0.006311872318136139, 'atr_max_pct': 0.07610147598373962, 'tp_mult': 2.0065014728045067, 'tsl_mult': 0.1305379820779261, 'strategy': 'mean_reversion', 'time_stop': 179, 'use_sma': False, 'use_atr': False, 'use_adx': True, 'use_ema': True, 'use_spike': False, 'rsi_required': True, 'edge_k': 0.33517683250653485, 'edge_cap': 0.478845228608673, 'bull_strategy': 'breakout', 'bull_bb_std_mult': 2.858830962554785, 'bull_rsi_os': 27, 'bull_rsi_ob': 95, 'bull_adx_thresh': 34.95149209825146, 'bull_atr_min_pct': 3.335261371975324e-05, 'bull_atr_max_pct': 0.14985166479162915, 'bull_tp_mult': 2.8003666419824533, 'bull_tsl_mult': 0.707870262449818, 'bull_time_stop': 18, 'bull_use_sma': True, 'bull_use_ema': True, 'bull_use_atr': True, 'bull_use_adx': False, 'bull_use_spike': True, 'bull_rsi_required': False, 'bear_strategy': 'breakout', 'bear_bb_std_mult': 2.3674514905165385, 'bear_rsi_os': 41, 'bear_rsi_ob': 64, 'bear_adx_thresh': 13.226241453625327, 'bear_atr_min_pct': 0.011227309793589314, 'bear_atr_max_pct': 0.08206760465938773, 'bear_tp_mult': 1.072623372938162, 'bear_tsl_mult': 0.559344513035948, 'bear_time_stop': 161, 'bear_use_sma': False, 'bear_use_ema': False, 'bear_use_atr': True, 'bear_use_adx': False, 'bear_use_spike': False, 'bear_rsi_required': False, 'sideways_strategy': 'breakout', 'sideways_bb_std_mult': 3.0403626767551906, 'sideways_rsi_os': 55, 'sideways_rsi_ob': 73, 'sideways_adx_thresh': 30.9443189718545, 'sideways_atr_min_pct': 0.024983429235903652, 'sideways_atr_max_pct': 0.07730311288533953, 'sideways_tp_mult': 2.5763921801355343, 'sideways_tsl_mult': 0.8079709249038141, 'sideways_time_stop': 294, 'sideways_use_sma': True, 'sideways_use_ema': True, 'sideways_use_atr': True, 'sideways_use_adx': False, 'sideways_use_spike': False, 'sideways_rsi_required': False}.
[I 2025-08-31 03:45:09,656] Trial 97 finished with values: [-0.01834433762031351, 0.018308988881893105] and parameters: {'p_sma': 59, 'p_std': 17, 'p_atr': 17, 'p_adx': 10, 'rsi_period': 17, 'ema1': 17, 'ema2': 33, 'slip_atr_k': 0.14511619647941043, 'slip_spread_k': 0.9053001416957995, 'spread_hl_frac': 0.0321288567294131, 'bb_std_mult': 0.729371586022968, 'rsi_os': 13, 'rsi_ob': 80, 'vol_spike': 0.15326520868526827, 'adx_thresh': 21.676332854214724, 'atr_min_pct': 0.00680798897110667, 'atr_max_pct': 0.027175534724505505, 'tp_mult': 2.0192955819380582, 'tsl_mult': 0.29499936044974095, 'strategy': 'mean_reversion', 'time_stop': 268, 'use_sma': False, 'use_atr': False, 'use_adx': True, 'use_ema': True, 'use_spike': False, 'rsi_required': True, 'edge_k': 1.2933650097805092, 'edge_cap': 0.4844036093074901, 'bull_strategy': 'breakout', 'bull_bb_std_mult': 2.8580124499257225, 'bull_rsi_os': 22, 'bull_rsi_ob': 62, 'bull_adx_thresh': 31.250900884684395, 'bull_atr_min_pct': 0.00023288041081412619, 'bull_atr_max_pct': 0.13731661918412022, 'bull_tp_mult': 2.7968224656747402, 'bull_tsl_mult': 0.7142486728767395, 'bull_time_stop': 242, 'bull_use_sma': True, 'bull_use_ema': True, 'bull_use_atr': True, 'bull_use_adx': False, 'bull_use_spike': True, 'bull_rsi_required': False, 'bear_strategy': 'breakout', 'bear_bb_std_mult': 2.3876190325872426, 'bear_rsi_os': 18, 'bear_rsi_ob': 65, 'bear_adx_thresh': 13.444008439956308, 'bear_atr_min_pct': 0.0006058059403059608, 'bear_atr_max_pct': 0.055038453440493226, 'bear_tp_mult': 1.054810076251304, 'bear_tsl_mult': 0.5592743799336841, 'bear_time_stop': 41, 'bear_use_sma': False, 'bear_use_ema': False, 'bear_use_atr': True, 'bear_use_adx': False, 'bear_use_spike': False, 'bear_rsi_required': False, 'sideways_strategy': 'breakout', 'sideways_bb_std_mult': 3.1702636578744787, 'sideways_rsi_os': 55, 'sideways_rsi_ob': 51, 'sideways_adx_thresh': 30.768550799268443, 'sideways_atr_min_pct': 0.024003209866869258, 'sideways_atr_max_pct': 0.05788073149671286, 'sideways_tp_mult': 2.558628347056479, 'sideways_tsl_mult': 0.8020049559225825, 'sideways_time_stop': 292, 'sideways_use_sma': True, 'sideways_use_ema': True, 'sideways_use_atr': True, 'sideways_use_adx': False, 'sideways_use_spike': False, 'sideways_rsi_required': False}.
[I 2025-08-31 03:45:09,793] Trial 96 finished with values: [-1000000000.0, 1000000000.0] and parameters: {'p_sma': 59, 'p_std': 17, 'p_atr': 11, 'p_adx': 8, 'rsi_period': 16, 'ema1': 18, 'ema2': 31, 'slip_atr_k': 0.14441284694837841, 'slip_spread_k': 0.8690566253306706, 'spread_hl_frac': 0.035763884390324574, 'bb_std_mult': 1.073039271441945, 'rsi_os': 13, 'rsi_ob': 74, 'vol_spike': 0.15307647711605668, 'adx_thresh': 24.12834874043757, 'atr_min_pct': 0.011143894761100255, 'atr_max_pct': 0.03160996323352754, 'tp_mult': 1.7102856709446315, 'tsl_mult': 0.2802991530608939, 'strategy': 'mean_reversion', 'time_stop': 268, 'use_sma': False, 'use_atr': False, 'use_adx': True, 'use_ema': True, 'use_spike': False, 'rsi_required': True, 'edge_k': 0.32369190030400435, 'edge_cap': 0.539094854437235, 'bull_strategy': 'breakout', 'bull_bb_std_mult': 2.8826480468800737, 'bull_rsi_os': 27, 'bull_rsi_ob': 95, 'bull_adx_thresh': 30.94840183790037, 'bull_atr_min_pct': 0.00023033154158531128, 'bull_atr_max_pct': 0.1491666283243277, 'bull_tp_mult': 2.7916249728576785, 'bull_tsl_mult': 0.7189000391072129, 'bull_time_stop': 241, 'bull_use_sma': True, 'bull_use_ema': True, 'bull_use_atr': True, 'bull_use_adx': False, 'bull_use_spike': True, 'bull_rsi_required': False, 'bear_strategy': 'breakout', 'bear_bb_std_mult': 1.8841081824357215, 'bear_rsi_os': 42, 'bear_rsi_ob': 64, 'bear_adx_thresh': 13.997443608317376, 'bear_atr_min_pct': 0.011080819389041676, 'bear_atr_max_pct': 0.08214245278026136, 'bear_tp_mult': 1.0840143753434566, 'bear_tsl_mult': 0.5696896806483779, 'bear_time_stop': 58, 'bear_use_sma': False, 'bear_use_ema': False, 'bear_use_atr': True, 'bear_use_adx': False, 'bear_use_spike': False, 'bear_rsi_required': False, 'sideways_strategy': 'breakout', 'sideways_bb_std_mult': 3.0406852586706803, 'sideways_rsi_os': 55, 'sideways_rsi_ob': 72, 'sideways_adx_thresh': 30.608377175188124, 'sideways_atr_min_pct': 0.025164217642059623, 'sideways_atr_max_pct': 0.07453001431370601, 'sideways_tp_mult': 2.5494763268443075, 'sideways_tsl_mult': 0.7475278524261791, 'sideways_time_stop': 293, 'sideways_use_sma': True, 'sideways_use_ema': True, 'sideways_use_atr': True, 'sideways_use_adx': False, 'sideways_use_spike': False, 'sideways_rsi_required': False}.
