[I 2025-08-31 05:32:33,375] Trial 710 finished with values: [-1000000000.0, 1000000000.0] and parameters: {'p_sma': 34, 'p_std': 13, 'p_atr': 19, 'p_adx': 9, 'rsi_period': 39, 'ema1': 25, 'ema2': 38, 'slip_atr_k': 0.028910679665525088, 'slip_spread_k': 0.6111764702632534, 'spread_hl_frac': 0.03748470084624386, 'bb_std_mult': 1.8598173169821426, 'rsi_os': 18, 'rsi_ob': 54, 'vol_spike': 0.013371577859340237, 'adx_thresh': 15.88707317616889, 'atr_min_pct': 0.014826411032878736, 'atr_max_pct': 0.10731327012531477, 'tp_mult': 2.4382586701167703, 'tsl_mult': 0.6797484632181457, 'strategy': 'mean_reversion', 'time_stop': 164, 'use_sma': False, 'use_atr': True, 'use_adx': False, 'use_ema': False, 'use_spike': True, 'rsi_required': True, 'edge_k': 0.6624946577402947, 'edge_cap': 0.7849791910398527, 'bull_strategy': 'mean_reversion', 'bull_bb_std_mult': 0.940452027249099, 'bull_rsi_os': 40, 'bull_rsi_ob': 77, 'bull_adx_thresh': 10.444223260164538, 'bull_atr_min_pct': 0.010594278113153385, 'bull_atr_max_pct': 0.06501815095315634, 'bull_tp_mult': 1.4219357690140542, 'bull_tsl_mult': 0.14213150117227336, 'bull_time_stop': 218, 'bull_use_sma': False, 'bull_use_ema': True, 'bull_use_atr': True, 'bull_use_adx': True, 'bull_use_spike': False, 'bull_rsi_required': False, 'bear_strategy': 'breakout', 'bear_bb_std_mult': 0.6724345915326775, 'bear_rsi_os': 28, 'bear_rsi_ob': 78, 'bear_adx_thresh': 14.632921507528593, 'bear_atr_min_pct': 0.006717107882994235, 'bear_atr_max_pct': 0.042002074666393295, 'bear_tp_mult': 1.1521576739429882, 'bear_tsl_mult': 0.6872194394645386, 'bear_time_stop': 56, 'bear_use_sma': True, 'bear_use_ema': False, 'bear_use_atr': True, 'bear_use_adx': False, 'bear_use_spike': False, 'bear_rsi_required': False, 'sideways_strategy': 'breakout', 'sideways_bb_std_mult': 3.206600212181727, 'sideways_rsi_os': 33, 'sideways_rsi_ob': 54, 'sideways_adx_thresh': 24.562563194496736, 'sideways_atr_min_pct': 0.018172590843225603, 'sideways_atr_max_pct': 0.055622941083558336, 'sideways_tp_mult': 2.0214772095257145, 'sideways_tsl_mult': 0.48798963779822124, 'sideways_time_stop': 198, 'sideways_use_sma': True, 'sideways_use_ema': True, 'sideways_use_atr': False, 'sideways_use_adx': False, 'sideways_use_spike': True, 'sideways_rsi_required': True}.
[I 2025-08-31 05:32:34,138] Trial 711 finished with values: [-1000000000.0, 1000000000.0] and parameters: {'p_sma': 35, 'p_std': 18, 'p_atr': 14, 'p_adx': 9, 'rsi_period': 22, 'ema1': 24, 'ema2': 57, 'slip_atr_k': 0.022989234360221267, 'slip_spread_k': 0.5703894582901077, 'spread_hl_frac': 0.00872397504414902, 'bb_std_mult': 1.8348928900050923, 'rsi_os': 44, 'rsi_ob': 71, 'vol_spike': 0.1267497584268234, 'adx_thresh': 15.909892153794228, 'atr_min_pct': 0.01267480410763267, 'atr_max_pct': 0.10645403815567031, 'tp_mult': 2.439247563899921, 'tsl_mult': 0.3035358737385865, 'strategy': 'mean_reversion', 'time_stop': 165, 'use_sma': False, 'use_atr': True, 'use_adx': False, 'use_ema': False, 'use_spike': True, 'rsi_required': True, 'edge_k': 0.6462319303167939, 'edge_cap': 0.7806004509920894, 'bull_strategy': 'breakout', 'bull_bb_std_mult': 0.940163123703713, 'bull_rsi_os': 48, 'bull_rsi_ob': 60, 'bull_adx_thresh': 10.519072452589631, 'bull_atr_min_pct': 0.010499930305134119, 'bull_atr_max_pct': 0.03928397584994323, 'bull_tp_mult': 1.6612528389408172, 'bull_tsl_mult': 0.9249685805648655, 'bull_time_stop': 199, 'bull_use_sma': False, 'bull_use_ema': False, 'bull_use_atr': True, 'bull_use_adx': True, 'bull_use_spike': False, 'bull_rsi_required': False, 'bear_strategy': 'breakout', 'bear_bb_std_mult': 1.4107401505328825, 'bear_rsi_os': 55, 'bear_rsi_ob': 78, 'bear_adx_thresh': 14.730232129508861, 'bear_atr_min_pct': 0.008233288759907425, 'bear_atr_max_pct': 0.052927930940964235, 'bear_tp_mult': 1.657205816902282, 'bear_tsl_mult': 0.24568375986854452, 'bear_time_stop': 11, 'bear_use_sma': True, 'bear_use_ema': True, 'bear_use_atr': True, 'bear_use_adx': False, 'bear_use_spike': False, 'bear_rsi_required': False, 'sideways_strategy': 'breakout', 'sideways_bb_std_mult': 1.230075252934302, 'sideways_rsi_os': 48, 'sideways_rsi_ob': 68, 'sideways_adx_thresh': 24.5240478491097, 'sideways_atr_min_pct': 0.014384675012696265, 'sideways_atr_max_pct': 0.05659416257046017, 'sideways_tp_mult': 1.6010016838893335, 'sideways_tsl_mult': 0.45315027346588127, 'sideways_time_stop': 179, 'sideways_use_sma': True, 'sideways_use_ema': True, 'sideways_use_atr': False, 'sideways_use_adx': False, 'sideways_use_spike': True, 'sideways_rsi_required': True}.
[I 2025-08-31 05:33:19,268] Trial 716 finished with values: [-1000000000.0, 1000000000.0] and parameters: {'p_sma': 57, 'p_std': 16, 'p_atr': 18, 'p_adx': 9, 'rsi_period': 18, 'ema1': 24, 'ema2': 16, 'slip_atr_k': 0.03569852050975198, 'slip_spread_k': 0.865917363226057, 'spread_hl_frac': 0.010036302252855475, 'bb_std_mult': 2.0580040581235326, 'rsi_os': 47, 'rsi_ob': 60, 'vol_spike': 0.202691091023256, 'adx_thresh': 11.033447488555325, 'atr_min_pct': 9.643981061150525e-05, 'atr_max_pct': 0.08897992041395951, 'tp_mult': 2.4935578631934208, 'tsl_mult': 0.5883474730616792, 'strategy': 'mean_reversion', 'time_stop': 19, 'use_sma': True, 'use_atr': True, 'use_adx': False, 'use_ema': False, 'use_spike': True, 'rsi_required': True, 'edge_k': 0.8570266426791552, 'edge_cap': 0.7542626795630923, 'bull_strategy': 'mean_reversion', 'bull_bb_std_mult': 0.6088091804331739, 'bull_rsi_os': 36, 'bull_rsi_ob': 78, 'bull_adx_thresh': 31.49598839128262, 'bull_atr_min_pct': 0.008978478175438422, 'bull_atr_max_pct': 0.030634516873391887, 'bull_tp_mult': 1.5909397881199951, 'bull_tsl_mult': 0.055000338482801336, 'bull_time_stop': 267, 'bull_use_sma': False, 'bull_use_ema': False, 'bull_use_atr': False, 'bull_use_adx': True, 'bull_use_spike': False, 'bull_rsi_required': False, 'bear_strategy': 'breakout', 'bear_bb_std_mult': 1.7491295045177169, 'bear_rsi_os': 24, 'bear_rsi_ob': 84, 'bear_adx_thresh': 30.037443561938083, 'bear_atr_min_pct': 0.012845057003040079, 'bear_atr_max_pct': 0.04608226086703199, 'bear_tp_mult': 1.4862793776243375, 'bear_tsl_mult': 0.16589418177413126, 'bear_time_stop': 221, 'bear_use_sma': True, 'bear_use_ema': True, 'bear_use_atr': True, 'bear_use_adx': False, 'bear_use_spike': False, 'bear_rsi_required': True, 'sideways_strategy': 'breakout', 'sideways_bb_std_mult': 1.1194324558170514, 'sideways_rsi_os': 42, 'sideways_rsi_ob': 53, 'sideways_adx_thresh': 23.407647686535995, 'sideways_atr_min_pct': 0.013312403738866437, 'sideways_atr_max_pct': 0.030169100617170347, 'sideways_tp_mult': 2.5700958292570375, 'sideways_tsl_mult': 0.11287717319409662, 'sideways_time_stop': 211, 'sideways_use_sma': False, 'sideways_use_ema': True, 'sideways_use_atr': False, 'sideways_use_adx': False, 'sideways_use_spike': True, 'sideways_rsi_required': True}.
[I 2025-08-31 05:33:21,094] Trial 715 finished with values: [-1000000000.0, 1000000000.0] and parameters: {'p_sma': 57, 'p_std': 16, 'p_atr': 16, 'p_adx': 9, 'rsi_period': 60, 'ema1': 24, 'ema2': 26, 'slip_atr_k': 0.11574315732516119, 'slip_spread_k': 0.5768820638753539, 'spread_hl_frac': 0.008855256953822855, 'bb_std_mult': 1.483872026533222, 'rsi_os': 45, 'rsi_ob': 71, 'vol_spike': 0.2024961883695776, 'adx_thresh': 10.984926800490818, 'atr_min_pct': 0.022966600857576847, 'atr_max_pct': 0.08864960755402575, 'tp_mult': 2.4952289084180492, 'tsl_mult': 0.8562483299730994, 'strategy': 'mean_reversion', 'time_stop': 185, 'use_sma': False, 'use_atr': True, 'use_adx': False, 'use_ema': False, 'use_spike': True, 'rsi_required': True, 'edge_k': 0.5901150595267889, 'edge_cap': 0.7579516696700276, 'bull_strategy': 'breakout', 'bull_bb_std_mult': 0.7923279546748988, 'bull_rsi_os': 48, 'bull_rsi_ob': 45, 'bull_adx_thresh': 19.552104005649795, 'bull_atr_min_pct': 0.011701894464788868, 'bull_atr_max_pct': 0.12481830929563419, 'bull_tp_mult': 2.0374371442735844, 'bull_tsl_mult': 0.9216982925211684, 'bull_time_stop': 268, 'bull_use_sma': False, 'bull_use_ema': False, 'bull_use_atr': True, 'bull_use_adx': True, 'bull_use_spike': False, 'bull_rsi_required': False, 'bear_strategy': 'breakout', 'bear_bb_std_mult': 0.934855105564118, 'bear_rsi_os': 13, 'bear_rsi_ob': 81, 'bear_adx_thresh': 25.93573144393912, 'bear_atr_min_pct': 0.008481570441079953, 'bear_atr_max_pct': 0.02684571688360414, 'bear_tp_mult': 1.4604369934186938, 'bear_tsl_mult': 0.17110496458315372, 'bear_time_stop': 275, 'bear_use_sma': True, 'bear_use_ema': True, 'bear_use_atr': True, 'bear_use_adx': False, 'bear_use_spike': False, 'bear_rsi_required': True, 'sideways_strategy': 'breakout', 'sideways_bb_std_mult': 1.1087274465001398, 'sideways_rsi_os': 36, 'sideways_rsi_ob': 57, 'sideways_adx_thresh': 23.73916436993526, 'sideways_atr_min_pct': 0.013376829281459678, 'sideways_atr_max_pct': 0.03024658313381918, 'sideways_tp_mult': 1.4674808128424606, 'sideways_tsl_mult': 0.49806063273764384, 'sideways_time_stop': 212, 'sideways_use_sma': False, 'sideways_use_ema': True, 'sideways_use_atr': False, 'sideways_use_adx': False, 'sideways_use_spike': True, 'sideways_rsi_required': True}.
[I 2025-08-31 05:33:22,426] Trial 714 finished with values: [-1000000000.0, 1000000000.0] and parameters: {'p_sma': 57, 'p_std': 16, 'p_atr': 16, 'p_adx': 9, 'rsi_period': 61, 'ema1': 24, 'ema2': 26, 'slip_atr_k': 0.06236509770082707, 'slip_spread_k': 0.5694651281397209, 'spread_hl_frac': 0.008867961388014982, 'bb_std_mult': 2.062900276258294, 'rsi_os': 44, 'rsi_ob': 62, 'vol_spike': 0.005339657298672527, 'adx_thresh': 22.732210178275395, 'atr_min_pct': 0.0004292515184015997, 'atr_max_pct': 0.13267630739034214, 'tp_mult': 1.3954822784950367, 'tsl_mult': 0.048357592526978965, 'strategy': 'mean_reversion', 'time_stop': 152, 'use_sma': False, 'use_atr': True, 'use_adx': False, 'use_ema': False, 'use_spike': True, 'rsi_required': True, 'edge_k': 0.42066761429909494, 'edge_cap': 0.7760300786232259, 'bull_strategy': 'breakout', 'bull_bb_std_mult': 1.0752078728968195, 'bull_rsi_os': 29, 'bull_rsi_ob': 78, 'bull_adx_thresh': 7.327508101748697, 'bull_atr_min_pct': 0.018624248583246274, 'bull_atr_max_pct': 0.03152835979821218, 'bull_tp_mult': 1.595990245897546, 'bull_tsl_mult': 0.9150547369419681, 'bull_time_stop': 268, 'bull_use_sma': False, 'bull_use_ema': False, 'bull_use_atr': True, 'bull_use_adx': True, 'bull_use_spike': False, 'bull_rsi_required': False, 'bear_strategy': 'breakout', 'bear_bb_std_mult': 3.196607932709479, 'bear_rsi_os': 13, 'bear_rsi_ob': 76, 'bear_adx_thresh': 26.00651067022573, 'bear_atr_min_pct': 0.008177784673458428, 'bear_atr_max_pct': 0.036474475780153476, 'bear_tp_mult': 1.3040913324731318, 'bear_tsl_mult': 0.24539588976786958, 'bear_time_stop': 279, 'bear_use_sma': True, 'bear_use_ema': True, 'bear_use_atr': True, 'bear_use_adx': False, 'bear_use_spike': False, 'bear_rsi_required': True, 'sideways_strategy': 'breakout', 'sideways_bb_std_mult': 1.1221368619431036, 'sideways_rsi_os': 42, 'sideways_rsi_ob': 52, 'sideways_adx_thresh': 27.28890257212018, 'sideways_atr_min_pct': 0.013400468942595502, 'sideways_atr_max_pct': 0.031633688765045756, 'sideways_tp_mult': 2.29251680791028, 'sideways_tsl_mult': 0.5004464695803459, 'sideways_time_stop': 147, 'sideways_use_sma': False, 'sideways_use_ema': True, 'sideways_use_atr': False, 'sideways_use_adx': False, 'sideways_use_spike': True, 'sideways_rsi_required': True}.
[I 2025-08-31 05:33:22,431] Trial 713 finished with values: [-1000000000.0, 1000000000.0] and parameters: {'p_sma': 57, 'p_std': 16, 'p_atr': 16, 'p_adx': 9, 'rsi_period': 15, 'ema1': 24, 'ema2': 26, 'slip_atr_k': 0.017941591331182054, 'slip_spread_k': 0.868023287252943, 'spread_hl_frac': 0.008486749160267332, 'bb_std_mult': 2.0724638007880167, 'rsi_os': 32, 'rsi_ob': 71, 'vol_spike': 0.0007873376631619272, 'adx_thresh': 10.957723941549837, 'atr_min_pct': 0.027136578410120113, 'atr_max_pct': 0.1175492936909234, 'tp_mult': 2.4994029826247055, 'tsl_mult': 0.8245486415407249, 'strategy': 'mean_reversion', 'time_stop': 95, 'use_sma': False, 'use_atr': True, 'use_adx': False, 'use_ema': False, 'use_spike': True, 'rsi_required': True, 'edge_k': 0.4954246107901871, 'edge_cap': 0.7751480099608382, 'bull_strategy': 'breakout', 'bull_bb_std_mult': 0.7848759247108164, 'bull_rsi_os': 48, 'bull_rsi_ob': 78, 'bull_adx_thresh': 7.346689482310207, 'bull_atr_min_pct': 0.011653744674143075, 'bull_atr_max_pct': 0.12575913366025654, 'bull_tp_mult': 1.5964156436137402, 'bull_tsl_mult': 0.9224546492920894, 'bull_time_stop': 264, 'bull_use_sma': False, 'bull_use_ema': False, 'bull_use_atr': True, 'bull_use_adx': True, 'bull_use_spike': False, 'bull_rsi_required': False, 'bear_strategy': 'breakout', 'bear_bb_std_mult': 1.7396438208877818, 'bear_rsi_os': 47, 'bear_rsi_ob': 81, 'bear_adx_thresh': 6.534608859816526, 'bear_atr_min_pct': 0.007921763124587701, 'bear_atr_max_pct': 0.026941706536338733, 'bear_tp_mult': 1.0506865197224555, 'bear_tsl_mult': 0.17889386000282836, 'bear_time_stop': 274, 'bear_use_sma': True, 'bear_use_ema': True, 'bear_use_atr': True, 'bear_use_adx': False, 'bear_use_spike': False, 'bear_rsi_required': True, 'sideways_strategy': 'breakout', 'sideways_bb_std_mult': 1.1053725414668767, 'sideways_rsi_os': 42, 'sideways_rsi_ob': 52, 'sideways_adx_thresh': 31.027260559791834, 'sideways_atr_min_pct': 0.008081250131901582, 'sideways_atr_max_pct': 0.010267086921442167, 'sideways_tp_mult': 1.4947990262650144, 'sideways_tsl_mult': 0.5509659182989673, 'sideways_time_stop': 211, 'sideways_use_sma': False, 'sideways_use_ema': True, 'sideways_use_atr': False, 'sideways_use_adx': False, 'sideways_use_spike': True, 'sideways_rsi_required': True}.
[I 2025-08-31 05:34:12,277] Trial 717 finished with values: [-1000000000.0, 1000000000.0] and parameters: {'p_sma': 39, 'p_std': 27, 'p_atr': 15, 'p_adx': 14, 'rsi_period': 50, 'ema1': 21, 'ema2': 50, 'slip_atr_k': 0.047792121061187715, 'slip_spread_k': 0.8076240374547445, 'spread_hl_frac': 0.009028388895191536, 'bb_std_mult': 2.421271226815597, 'rsi_os': 32, 'rsi_ob': 62, 'vol_spike': 0.00016060426172385261, 'adx_thresh': 9.831357033792752, 'atr_min_pct': 0.0271651950328105, 'atr_max_pct': 0.030406097880433886, 'tp_mult': 2.5226008193194653, 'tsl_mult': 0.8558193093238909, 'strategy': 'mean_reversion', 'time_stop': 181, 'use_sma': False, 'use_atr': True, 'use_adx': False, 'use_ema': False, 'use_spike': True, 'rsi_required': True, 'edge_k': 0.6041765147414574, 'edge_cap': 0.8012645855241362, 'bull_strategy': 'mean_reversion', 'bull_bb_std_mult': 1.0332469860220364, 'bull_rsi_os': 47, 'bull_rsi_ob': 93, 'bull_adx_thresh': 7.513243559302857, 'bull_atr_min_pct': 0.014416588769083392, 'bull_atr_max_pct': 0.12587056442289596, 'bull_tp_mult': 2.0353330672117105, 'bull_tsl_mult': 0.8803039847353106, 'bull_time_stop': 257, 'bull_use_sma': False, 'bull_use_ema': False, 'bull_use_atr': True, 'bull_use_adx': True, 'bull_use_spike': False, 'bull_rsi_required': False, 'bear_strategy': 'breakout', 'bear_bb_std_mult': 0.921994810562458, 'bear_rsi_os': 47, 'bear_rsi_ob': 81, 'bear_adx_thresh': 6.432258627467714, 'bear_atr_min_pct': 0.007376173395487195, 'bear_atr_max_pct': 0.0368219687968887, 'bear_tp_mult': 1.0661540278444588, 'bear_tsl_mult': 0.983571380534382, 'bear_time_stop': 80, 'bear_use_sma': True, 'bear_use_ema': True, 'bear_use_atr': True, 'bear_use_adx': False, 'bear_use_spike': False, 'bear_rsi_required': True, 'sideways_strategy': 'breakout', 'sideways_bb_std_mult': 2.2561921310312374, 'sideways_rsi_os': 43, 'sideways_rsi_ob': 52, 'sideways_adx_thresh': 27.30730859486156, 'sideways_atr_min_pct': 0.010396872505013779, 'sideways_atr_max_pct': 0.042337379896722135, 'sideways_tp_mult': 2.9415257873827567, 'sideways_tsl_mult': 0.5474725467627962, 'sideways_time_stop': 186, 'sideways_use_sma': False, 'sideways_use_ema': True, 'sideways_use_atr': False, 'sideways_use_adx': False, 'sideways_use_spike': True, 'sideways_rsi_required': True}.
[I 2025-08-31 05:34:12,997] Trial 718 finished with values: [-1000000000.0, 1000000000.0] and parameters: {'p_sma': 18, 'p_std': 25, 'p_atr': 16, 'p_adx': 8, 'rsi_period': 20, 'ema1': 21, 'ema2': 12, 'slip_atr_k': 0.033371978785270255, 'slip_spread_k': 0.9394944330324171, 'spread_hl_frac': 0.014802241344622663, 'bb_std_mult': 2.1187427176922156, 'rsi_os': 32, 'rsi_ob': 62, 'vol_spike': 0.1751748854995982, 'adx_thresh': 9.735574768070041, 'atr_min_pct': 0.02715043423663454, 'atr_max_pct': 0.06593795155963317, 'tp_mult': 2.5463235078029736, 'tsl_mult': 0.8241789426706202, 'strategy': 'mean_reversion', 'time_stop': 227, 'use_sma': False, 'use_atr': True, 'use_adx': False, 'use_ema': False, 'use_spike': True, 'rsi_required': True, 'edge_k': 0.5029053691137633, 'edge_cap': 0.854948860561699, 'bull_strategy': 'mean_reversion', 'bull_bb_std_mult': 1.0342899400591503, 'bull_rsi_os': 29, 'bull_rsi_ob': 77, 'bull_adx_thresh': 7.666389761226656, 'bull_atr_min_pct': 0.01858973850784857, 'bull_atr_max_pct': 0.018334833621890693, 'bull_tp_mult': 2.6964167146577678, 'bull_tsl_mult': 0.881530733477678, 'bull_time_stop': 288, 'bull_use_sma': False, 'bull_use_ema': False, 'bull_use_atr': True, 'bull_use_adx': True, 'bull_use_spike': False, 'bull_rsi_required': False, 'bear_strategy': 'breakout', 'bear_bb_std_mult': 0.853422237293022, 'bear_rsi_os': 8, 'bear_rsi_ob': 79, 'bear_adx_thresh': 5.164780138655592, 'bear_atr_min_pct': 0.007302362237151359, 'bear_atr_max_pct': 0.036375046190285885, 'bear_tp_mult': 1.0483878817018573, 'bear_tsl_mult': 0.189979511581525, 'bear_time_stop': 280, 'bear_use_sma': True, 'bear_use_ema': True, 'bear_use_atr': True, 'bear_use_adx': False, 'bear_use_spike': False, 'bear_rsi_required': True, 'sideways_strategy': 'breakout', 'sideways_bb_std_mult': 1.2040833635030692, 'sideways_rsi_os': 34, 'sideways_rsi_ob': 55, 'sideways_adx_thresh': 25.41162872025513, 'sideways_atr_min_pct': 0.008598500970756323, 'sideways_atr_max_pct': 0.081998591515448, 'sideways_tp_mult': 2.950466212660587, 'sideways_tsl_mult': 0.9801823012306902, 'sideways_time_stop': 219, 'sideways_use_sma': False, 'sideways_use_ema': True, 'sideways_use_atr': False, 'sideways_use_adx': False, 'sideways_use_spike': True, 'sideways_rsi_required': True}.
[I 2025-08-31 05:34:13,523] Trial 719 finished with values: [-1000000000.0, 1000000000.0] and parameters: {'p_sma': 55, 'p_std': 14, 'p_atr': 13, 'p_adx': 8, 'rsi_period': 15, 'ema1': 22, 'ema2': 22, 'slip_atr_k': 0.01826785206958821, 'slip_spread_k': 0.8115319447846171, 'spread_hl_frac': 0.009680761426729145, 'bb_std_mult': 2.4131337924386367, 'rsi_os': 19, 'rsi_ob': 67, 'vol_spike': 0.000776184484201331, 'adx_thresh': 9.756923920301235, 'atr_min_pct': 0.026010447155280256, 'atr_max_pct': 0.13033332891646213, 'tp_mult': 2.5386399029374713, 'tsl_mult': 0.829663908969182, 'strategy': 'mean_reversion', 'time_stop': 93, 'use_sma': False, 'use_atr': True, 'use_adx': False, 'use_ema': False, 'use_spike': True, 'rsi_required': True, 'edge_k': 0.7321225628411943, 'edge_cap': 0.7996299450619596, 'bull_strategy': 'mean_reversion', 'bull_bb_std_mult': 0.8708334703254993, 'bull_rsi_os': 45, 'bull_rsi_ob': 92, 'bull_adx_thresh': 8.631198740080341, 'bull_atr_min_pct': 0.015657763611970417, 'bull_atr_max_pct': 0.06075737062112047, 'bull_tp_mult': 1.711357349664649, 'bull_tsl_mult': 0.891862277970877, 'bull_time_stop': 284, 'bull_use_sma': False, 'bull_use_ema': False, 'bull_use_atr': True, 'bull_use_adx': True, 'bull_use_spike': False, 'bull_rsi_required': False, 'bear_strategy': 'breakout', 'bear_bb_std_mult': 1.9745316361302345, 'bear_rsi_os': 16, 'bear_rsi_ob': 75, 'bear_adx_thresh': 5.134686920087066, 'bear_atr_min_pct': 0.007303280567302124, 'bear_atr_max_pct': 0.07423961421005978, 'bear_tp_mult': 1.4097638939520112, 'bear_tsl_mult': 0.9444151759475383, 'bear_time_stop': 241, 'bear_use_sma': True, 'bear_use_ema': True, 'bear_use_atr': True, 'bear_use_adx': False, 'bear_use_spike': False, 'bear_rsi_required': True, 'sideways_strategy': 'breakout', 'sideways_bb_std_mult': 1.4469989180910747, 'sideways_rsi_os': 34, 'sideways_rsi_ob': 92, 'sideways_adx_thresh': 25.758301960439827, 'sideways_atr_min_pct': 0.013897192377520708, 'sideways_atr_max_pct': 0.010196351574974406, 'sideways_tp_mult': 1.6897735736687267, 'sideways_tsl_mult': 0.4221852571319979, 'sideways_time_stop': 187, 'sideways_use_sma': False, 'sideways_use_ema': True, 'sideways_use_atr': False, 'sideways_use_adx': False, 'sideways_use_spike': True, 'sideways_rsi_required': True}.
