[I 2025-08-31 05:58:23,218] Trial 847 finished with values: [-0.008319152556942155, 0.008252692740333452] and parameters: {'p_sma': 29, 'p_std': 46, 'p_atr': 12, 'p_adx': 25, 'rsi_period': 16, 'ema1': 17, 'ema2': 20, 'slip_atr_k': 0.012215237379432729, 'slip_spread_k': 0.8713937775421852, 'spread_hl_frac': 0.0006740610584154481, 'bb_std_mult': 3.5050219318374385, 'rsi_os': 48, 'rsi_ob': 70, 'vol_spike': 0.09460289793019755, 'adx_thresh': 8.519627477670284, 'atr_min_pct': 0.008452323758798683, 'atr_max_pct': 0.11855502901952521, 'tp_mult': 2.1434811457671796, 'tsl_mult': 0.42770767247902886, 'strategy': 'mean_reversion', 'time_stop': 21, 'use_sma': True, 'use_atr': True, 'use_adx': True, 'use_ema': False, 'use_spike': False, 'rsi_required': True, 'edge_k': 0.9442632283126456, 'edge_cap': 0.3668775370703493, 'bull_strategy': 'breakout', 'bull_bb_std_mult': 1.6392398260422918, 'bull_rsi_os': 33, 'bull_rsi_ob': 71, 'bull_adx_thresh': 33.49672234379301, 'bull_atr_min_pct': 0.016450636549748564, 'bull_atr_max_pct': 0.0828691432630862, 'bull_tp_mult': 1.3503182454094749, 'bull_tsl_mult': 0.7088780140716594, 'bull_time_stop': 196, 'bull_use_sma': True, 'bull_use_ema': True, 'bull_use_atr': False, 'bull_use_adx': False, 'bull_use_spike': False, 'bull_rsi_required': False, 'bear_strategy': 'breakout', 'bear_bb_std_mult': 2.390463424534188, 'bear_rsi_os': 5, 'bear_rsi_ob': 59, 'bear_adx_thresh': 14.903080505393703, 'bear_atr_min_pct': 0.0008360438196475084, 'bear_atr_max_pct': 0.12371863149553713, 'bear_tp_mult': 1.1707690017328987, 'bear_tsl_mult': 0.05331634378295075, 'bear_time_stop': 241, 'bear_use_sma': False, 'bear_use_ema': False, 'bear_use_atr': True, 'bear_use_adx': False, 'bear_use_spike': False, 'bear_rsi_required': False, 'sideways_strategy': 'breakout', 'sideways_bb_std_mult': 1.6541518037645921, 'sideways_rsi_os': 45, 'sideways_rsi_ob': 47, 'sideways_adx_thresh': 21.90908868304849, 'sideways_atr_min_pct': 0.00263336168278782, 'sideways_atr_max_pct': 0.04495942254685809, 'sideways_tp_mult': 2.4132161304545003, 'sideways_tsl_mult': 0.30387442393440517, 'sideways_time_stop': 124, 'sideways_use_sma': True, 'sideways_use_ema': True, 'sideways_use_atr': True, 'sideways_use_adx': False, 'sideways_use_spike': False, 'sideways_rsi_required': False}.
[I 2025-08-31 05:58:23,230] Trial 846 finished with values: [-0.007238749455364846, 0.007352366576096528] and parameters: {'p_sma': 29, 'p_std': 46, 'p_atr': 12, 'p_adx': 25, 'rsi_period': 17, 'ema1': 17, 'ema2': 20, 'slip_atr_k': 0.011268288207253608, 'slip_spread_k': 0.8584303336828366, 'spread_hl_frac': 0.0006224021695597709, 'bb_std_mult': 3.4905614535763396, 'rsi_os': 47, 'rsi_ob': 70, 'vol_spike': 0.09458720516391915, 'adx_thresh': 8.398670275024923, 'atr_min_pct': 0.008578273385317295, 'atr_max_pct': 0.11792211031906681, 'tp_mult': 2.136733883094431, 'tsl_mult': 0.42759249961847146, 'strategy': 'mean_reversion', 'time_stop': 20, 'use_sma': True, 'use_atr': True, 'use_adx': True, 'use_ema': False, 'use_spike': False, 'rsi_required': True, 'edge_k': 0.9499719817131935, 'edge_cap': 0.3759957348815718, 'bull_strategy': 'breakout', 'bull_bb_std_mult': 1.6452075779262523, 'bull_rsi_os': 33, 'bull_rsi_ob': 71, 'bull_adx_thresh': 33.448247393302914, 'bull_atr_min_pct': 0.01655448403110888, 'bull_atr_max_pct': 0.08407177920332869, 'bull_tp_mult': 1.3553980305797342, 'bull_tsl_mult': 0.7050925160355137, 'bull_time_stop': 201, 'bull_use_sma': True, 'bull_use_ema': True, 'bull_use_atr': False, 'bull_use_adx': False, 'bull_use_spike': False, 'bull_rsi_required': False, 'bear_strategy': 'breakout', 'bear_bb_std_mult': 2.333870587137893, 'bear_rsi_os': 5, 'bear_rsi_ob': 59, 'bear_adx_thresh': 15.178696770759858, 'bear_atr_min_pct': 0.0008359079191760665, 'bear_atr_max_pct': 0.1246501712638868, 'bear_tp_mult': 1.1678615328207953, 'bear_tsl_mult': 0.06439855819416783, 'bear_time_stop': 243, 'bear_use_sma': True, 'bear_use_ema': False, 'bear_use_atr': True, 'bear_use_adx': False, 'bear_use_spike': False, 'bear_rsi_required': False, 'sideways_strategy': 'breakout', 'sideways_bb_std_mult': 1.6428445803171152, 'sideways_rsi_os': 44, 'sideways_rsi_ob': 47, 'sideways_adx_thresh': 21.875161074881433, 'sideways_atr_min_pct': 0.0027328215617693982, 'sideways_atr_max_pct': 0.045993496106633565, 'sideways_tp_mult': 2.409699466472316, 'sideways_tsl_mult': 0.2866834853027456, 'sideways_time_stop': 127, 'sideways_use_sma': True, 'sideways_use_ema': True, 'sideways_use_atr': True, 'sideways_use_adx': False, 'sideways_use_spike': False, 'sideways_rsi_required': False}.
[I 2025-08-31 05:58:25,347] Trial 851 finished with values: [-1000000000.0, 1000000000.0] and parameters: {'p_sma': 29, 'p_std': 47, 'p_atr': 12, 'p_adx': 25, 'rsi_period': 17, 'ema1': 17, 'ema2': 20, 'slip_atr_k': 0.0133051516106766, 'slip_spread_k': 0.877295154792646, 'spread_hl_frac': 0.0009780075529268915, 'bb_std_mult': 3.574610121044873, 'rsi_os': 50, 'rsi_ob': 71, 'vol_spike': 0.09767498601541673, 'adx_thresh': 8.557147322712346, 'atr_min_pct': 0.008339285943983992, 'atr_max_pct': 0.11872261601082267, 'tp_mult': 2.167411701426628, 'tsl_mult': 0.40272536766365336, 'strategy': 'mean_reversion', 'time_stop': 18, 'use_sma': True, 'use_atr': True, 'use_adx': False, 'use_ema': False, 'use_spike': False, 'rsi_required': True, 'edge_k': 0.9309664399936439, 'edge_cap': 0.3857945712598962, 'bull_strategy': 'breakout', 'bull_bb_std_mult': 1.7110619451958102, 'bull_rsi_os': 34, 'bull_rsi_ob': 72, 'bull_adx_thresh': 33.13573226555856, 'bull_atr_min_pct': 0.016557188391185237, 'bull_atr_max_pct': 0.08373673195480436, 'bull_tp_mult': 1.3365872603788564, 'bull_tsl_mult': 0.7207027002327665, 'bull_time_stop': 201, 'bull_use_sma': False, 'bull_use_ema': True, 'bull_use_atr': False, 'bull_use_adx': False, 'bull_use_spike': False, 'bull_rsi_required': False, 'bear_strategy': 'breakout', 'bear_bb_std_mult': 2.387819914443111, 'bear_rsi_os': 5, 'bear_rsi_ob': 60, 'bear_adx_thresh': 15.499654328504217, 'bear_atr_min_pct': 0.0011119438802452823, 'bear_atr_max_pct': 0.1213290299890006, 'bear_tp_mult': 1.1202400648351556, 'bear_tsl_mult': 0.0400083387704256, 'bear_time_stop': 246, 'bear_use_sma': False, 'bear_use_ema': False, 'bear_use_atr': True, 'bear_use_adx': False, 'bear_use_spike': False, 'bear_rsi_required': False, 'sideways_strategy': 'breakout', 'sideways_bb_std_mult': 1.6749976784279672, 'sideways_rsi_os': 44, 'sideways_rsi_ob': 47, 'sideways_adx_thresh': 22.409917143272196, 'sideways_atr_min_pct': 0.00265117943297725, 'sideways_atr_max_pct': 0.04504801641799039, 'sideways_tp_mult': 2.4546068339360514, 'sideways_tsl_mult': 0.3138130192837696, 'sideways_time_stop': 120, 'sideways_use_sma': True, 'sideways_use_ema': True, 'sideways_use_atr': False, 'sideways_use_adx': False, 'sideways_use_spike': True, 'sideways_rsi_required': False}.
[I 2025-08-31 05:59:10,630] Trial 848 finished with values: [-0.009032989080041132, 0.009001241097423507] and parameters: {'p_sma': 29, 'p_std': 46, 'p_atr': 12, 'p_adx': 25, 'rsi_period': 16, 'ema1': 17, 'ema2': 20, 'slip_atr_k': 0.013279529674174905, 'slip_spread_k': 0.8739976430446074, 'spread_hl_frac': 0.000813321371336554, 'bb_std_mult': 3.598515408953094, 'rsi_os': 48, 'rsi_ob': 71, 'vol_spike': 0.0974070931570295, 'adx_thresh': 8.467416374905689, 'atr_min_pct': 0.00859415637330564, 'atr_max_pct': 0.1183982043066801, 'tp_mult': 2.1582108292265314, 'tsl_mult': 0.41670990174581946, 'strategy': 'mean_reversion', 'time_stop': 20, 'use_sma': True, 'use_atr': True, 'use_adx': False, 'use_ema': False, 'use_spike': False, 'rsi_required': True, 'edge_k': 0.9800528542432301, 'edge_cap': 0.3783794598282595, 'bull_strategy': 'breakout', 'bull_bb_std_mult': 1.6971165279582243, 'bull_rsi_os': 33, 'bull_rsi_ob': 71, 'bull_adx_thresh': 33.41361093296566, 'bull_atr_min_pct': 0.016449625661888602, 'bull_atr_max_pct': 0.08326495283481458, 'bull_tp_mult': 1.3838747380230847, 'bull_tsl_mult': 0.7114675014943684, 'bull_time_stop': 200, 'bull_use_sma': False, 'bull_use_ema': True, 'bull_use_atr': False, 'bull_use_adx': False, 'bull_use_spike': False, 'bull_rsi_required': False, 'bear_strategy': 'breakout', 'bear_bb_std_mult': 2.393509737297201, 'bear_rsi_os': 5, 'bear_rsi_ob': 58, 'bear_adx_thresh': 15.167801743867923, 'bear_atr_min_pct': 0.0009063319182315851, 'bear_atr_max_pct': 0.12270673547622803, 'bear_tp_mult': 1.1703414858566337, 'bear_tsl_mult': 0.050417681065727485, 'bear_time_stop': 238, 'bear_use_sma': False, 'bear_use_ema': False, 'bear_use_atr': True, 'bear_use_adx': False, 'bear_use_spike': False, 'bear_rsi_required': False, 'sideways_strategy': 'breakout', 'sideways_bb_std_mult': 1.681336133022609, 'sideways_rsi_os': 44, 'sideways_rsi_ob': 47, 'sideways_adx_thresh': 21.87463400729843, 'sideways_atr_min_pct': 0.0023926425759395026, 'sideways_atr_max_pct': 0.0454365224786444, 'sideways_tp_mult': 2.444721509723481, 'sideways_tsl_mult': 0.29005347296632666, 'sideways_time_stop': 121, 'sideways_use_sma': True, 'sideways_use_ema': True, 'sideways_use_atr': False, 'sideways_use_adx': False, 'sideways_use_spike': True, 'sideways_rsi_required': False}.
[I 2025-08-31 05:59:11,224] Trial 850 finished with values: [-0.007790923334972111, 0.007759255403640798] and parameters: {'p_sma': 29, 'p_std': 46, 'p_atr': 12, 'p_adx': 25, 'rsi_period': 17, 'ema1': 17, 'ema2': 20, 'slip_atr_k': 0.011669672613578898, 'slip_spread_k': 0.8729242128016975, 'spread_hl_frac': 0.0009696953854568583, 'bb_std_mult': 3.586209492732329, 'rsi_os': 49, 'rsi_ob': 70, 'vol_spike': 0.09796183886547705, 'adx_thresh': 8.400694100844486, 'atr_min_pct': 0.008589507070403669, 'atr_max_pct': 0.11876516444983615, 'tp_mult': 2.1637988403522157, 'tsl_mult': 0.40753774758131334, 'strategy': 'mean_reversion', 'time_stop': 19, 'use_sma': True, 'use_atr': True, 'use_adx': False, 'use_ema': False, 'use_spike': False, 'rsi_required': True, 'edge_k': 0.9212534531747474, 'edge_cap': 0.3739403804281605, 'bull_strategy': 'breakout', 'bull_bb_std_mult': 1.6929148988900045, 'bull_rsi_os': 34, 'bull_rsi_ob': 72, 'bull_adx_thresh': 33.21185925628403, 'bull_atr_min_pct': 0.016861339071905793, 'bull_atr_max_pct': 0.08276753892488331, 'bull_tp_mult': 1.339418305828254, 'bull_tsl_mult': 0.6928226100258279, 'bull_time_stop': 200, 'bull_use_sma': False, 'bull_use_ema': True, 'bull_use_atr': False, 'bull_use_adx': False, 'bull_use_spike': False, 'bull_rsi_required': False, 'bear_strategy': 'breakout', 'bear_bb_std_mult': 2.3947182629804407, 'bear_rsi_os': 5, 'bear_rsi_ob': 60, 'bear_adx_thresh': 15.450469556022794, 'bear_atr_min_pct': 0.001145848394847232, 'bear_atr_max_pct': 0.12139411799129535, 'bear_tp_mult': 1.1733341137460402, 'bear_tsl_mult': 0.048988573135159835, 'bear_time_stop': 241, 'bear_use_sma': False, 'bear_use_ema': False, 'bear_use_atr': True, 'bear_use_adx': False, 'bear_use_spike': False, 'bear_rsi_required': False, 'sideways_strategy': 'breakout', 'sideways_bb_std_mult': 1.625954735605553, 'sideways_rsi_os': 44, 'sideways_rsi_ob': 47, 'sideways_adx_thresh': 22.359063405704234, 'sideways_atr_min_pct': 0.0025012961887833883, 'sideways_atr_max_pct': 0.04712738962763544, 'sideways_tp_mult': 2.323370697388917, 'sideways_tsl_mult': 0.3038458419588611, 'sideways_time_stop': 122, 'sideways_use_sma': True, 'sideways_use_ema': True, 'sideways_use_atr': False, 'sideways_use_adx': False, 'sideways_use_spike': True, 'sideways_rsi_required': False}.
[I 2025-08-31 05:59:11,707] Trial 852 finished with values: [-0.00915922620549936, 0.009127594733292005] and parameters: {'p_sma': 30, 'p_std': 46, 'p_atr': 12, 'p_adx': 25, 'rsi_period': 18, 'ema1': 16, 'ema2': 20, 'slip_atr_k': 0.01200142037972978, 'slip_spread_k': 0.87208096812053, 'spread_hl_frac': 0.0006622214158896141, 'bb_std_mult': 3.487123549123471, 'rsi_os': 48, 'rsi_ob': 70, 'vol_spike': 0.10005202564153601, 'adx_thresh': 8.23780693488568, 'atr_min_pct': 0.008684621930849276, 'atr_max_pct': 0.11953721722824072, 'tp_mult': 2.104339860263826, 'tsl_mult': 0.4148245484004491, 'strategy': 'mean_reversion', 'time_stop': 18, 'use_sma': True, 'use_atr': True, 'use_adx': False, 'use_ema': False, 'use_spike': False, 'rsi_required': True, 'edge_k': 0.921252297003305, 'edge_cap': 0.3797271572155636, 'bull_strategy': 'breakout', 'bull_bb_std_mult': 1.7188050068303558, 'bull_rsi_os': 33, 'bull_rsi_ob': 71, 'bull_adx_thresh': 34.363393837608704, 'bull_atr_min_pct': 0.01689061116148826, 'bull_atr_max_pct': 0.08377166403715813, 'bull_tp_mult': 1.3838699353935273, 'bull_tsl_mult': 0.6899120725438136, 'bull_time_stop': 198, 'bull_use_sma': False, 'bull_use_ema': True, 'bull_use_atr': False, 'bull_use_adx': False, 'bull_use_spike': False, 'bull_rsi_required': False, 'bear_strategy': 'breakout', 'bear_bb_std_mult': 2.3418808750586932, 'bear_rsi_os': 5, 'bear_rsi_ob': 58, 'bear_adx_thresh': 15.48035962562061, 'bear_atr_min_pct': 0.0010187751933087323, 'bear_atr_max_pct': 0.12600872969206556, 'bear_tp_mult': 1.1589103670839194, 'bear_tsl_mult': 0.05060606748337862, 'bear_time_stop': 239, 'bear_use_sma': False, 'bear_use_ema': False, 'bear_use_atr': True, 'bear_use_adx': False, 'bear_use_spike': False, 'bear_rsi_required': False, 'sideways_strategy': 'breakout', 'sideways_bb_std_mult': 1.6267850631288994, 'sideways_rsi_os': 44, 'sideways_rsi_ob': 47, 'sideways_adx_thresh': 21.902708758363662, 'sideways_atr_min_pct': 0.0023637847579807735, 'sideways_atr_max_pct': 0.04711485580756383, 'sideways_tp_mult': 2.3265911129259593, 'sideways_tsl_mult': 0.30537606255065064, 'sideways_time_stop': 119, 'sideways_use_sma': True, 'sideways_use_ema': True, 'sideways_use_atr': False, 'sideways_use_adx': False, 'sideways_use_spike': True, 'sideways_rsi_required': False}.
[I 2025-08-31 05:59:12,963] Trial 849 finished with values: [-0.009263216385534512, 0.009231435580028343] and parameters: {'p_sma': 29, 'p_std': 46, 'p_atr': 12, 'p_adx': 25, 'rsi_period': 16, 'ema1': 17, 'ema2': 20, 'slip_atr_k': 0.013827253934100522, 'slip_spread_k': 0.870348295725295, 'spread_hl_frac': 0.0007595328676090305, 'bb_std_mult': 3.578595236345718, 'rsi_os': 49, 'rsi_ob': 70, 'vol_spike': 0.09816573084171208, 'adx_thresh': 8.570037994639346, 'atr_min_pct': 0.008433187203103253, 'atr_max_pct': 0.11926726062976013, 'tp_mult': 2.1626779978663957, 'tsl_mult': 0.4211484947433022, 'strategy': 'mean_reversion', 'time_stop': 20, 'use_sma': True, 'use_atr': True, 'use_adx': False, 'use_ema': False, 'use_spike': False, 'rsi_required': True, 'edge_k': 0.90388640942222, 'edge_cap': 0.38193167540073675, 'bull_strategy': 'breakout', 'bull_bb_std_mult': 1.7210798903116427, 'bull_rsi_os': 34, 'bull_rsi_ob': 71, 'bull_adx_thresh': 33.314015255907954, 'bull_atr_min_pct': 0.016831786518616252, 'bull_atr_max_pct': 0.08526068131627047, 'bull_tp_mult': 1.342932322249904, 'bull_tsl_mult': 0.7175709463525011, 'bull_time_stop': 201, 'bull_use_sma': False, 'bull_use_ema': True, 'bull_use_atr': False, 'bull_use_adx': False, 'bull_use_spike': False, 'bull_rsi_required': False, 'bear_strategy': 'breakout', 'bear_bb_std_mult': 2.407681705271208, 'bear_rsi_os': 5, 'bear_rsi_ob': 60, 'bear_adx_thresh': 15.263023060948655, 'bear_atr_min_pct': 0.001236751390179211, 'bear_atr_max_pct': 0.12146761977408498, 'bear_tp_mult': 1.171785672622839, 'bear_tsl_mult': 0.04160852366295193, 'bear_time_stop': 240, 'bear_use_sma': False, 'bear_use_ema': False, 'bear_use_atr': True, 'bear_use_adx': False, 'bear_use_spike': False, 'bear_rsi_required': False, 'sideways_strategy': 'breakout', 'sideways_bb_std_mult': 1.6232891025521623, 'sideways_rsi_os': 44, 'sideways_rsi_ob': 47, 'sideways_adx_thresh': 21.46918212378875, 'sideways_atr_min_pct': 0.0024217700100314663, 'sideways_atr_max_pct': 0.044727515291686205, 'sideways_tp_mult': 2.4475036857642243, 'sideways_tsl_mult': 0.31018697315203414, 'sideways_time_stop': 119, 'sideways_use_sma': True, 'sideways_use_ema': True, 'sideways_use_atr': False, 'sideways_use_adx': False, 'sideways_use_spike': True, 'sideways_rsi_required': False}.
[I 2025-08-31 05:59:59,729] Trial 856 finished with values: [-1000000000.0, 1000000000.0] and parameters: {'p_sma': 30, 'p_std': 46, 'p_atr': 12, 'p_adx': 26, 'rsi_period': 17, 'ema1': 16, 'ema2': 20, 'slip_atr_k': 0.013467526598010114, 'slip_spread_k': 0.8480629837078123, 'spread_hl_frac': 0.0007660904099745674, 'bb_std_mult': 3.4872202377221084, 'rsi_os': 49, 'rsi_ob': 73, 'vol_spike': 0.09949680429296585, 'adx_thresh': 8.618160291312517, 'atr_min_pct': 0.008564522618906709, 'atr_max_pct': 0.11933664718022224, 'tp_mult': 2.168059087967953, 'tsl_mult': 0.4374842247462313, 'strategy': 'mean_reversion', 'time_stop': 21, 'use_sma': True, 'use_atr': True, 'use_adx': False, 'use_ema': False, 'use_spike': False, 'rsi_required': True, 'edge_k': 0.9772386908211113, 'edge_cap': 0.3798975134500942, 'bull_strategy': 'breakout', 'bull_bb_std_mult': 1.697397217782633, 'bull_rsi_os': 33, 'bull_rsi_ob': 71, 'bull_adx_thresh': 33.3120350662154, 'bull_atr_min_pct': 0.01695618264004796, 'bull_atr_max_pct': 0.08335935976277935, 'bull_tp_mult': 1.3643204204653872, 'bull_tsl_mult': 0.6926906168730491, 'bull_time_stop': 198, 'bull_use_sma': False, 'bull_use_ema': True, 'bull_use_atr': False, 'bull_use_adx': False, 'bull_use_spike': False, 'bull_rsi_required': False, 'bear_strategy': 'breakout', 'bear_bb_std_mult': 2.382608062133262, 'bear_rsi_os': 5, 'bear_rsi_ob': 58, 'bear_adx_thresh': 15.385675857690654, 'bear_atr_min_pct': 0.000102248259783864, 'bear_atr_max_pct': 0.12010568368597475, 'bear_tp_mult': 1.1491717485703465, 'bear_tsl_mult': 0.04801176032626264, 'bear_time_stop': 239, 'bear_use_sma': False, 'bear_use_ema': False, 'bear_use_atr': True, 'bear_use_adx': False, 'bear_use_spike': False, 'bear_rsi_required': False, 'sideways_strategy': 'breakout', 'sideways_bb_std_mult': 1.6881354800364794, 'sideways_rsi_os': 45, 'sideways_rsi_ob': 47, 'sideways_adx_thresh': 22.117806315883666, 'sideways_atr_min_pct': 0.0030127906029656874, 'sideways_atr_max_pct': 0.044264142984311076, 'sideways_tp_mult': 2.3232715872338634, 'sideways_tsl_mult': 0.3044446593043693, 'sideways_time_stop': 120, 'sideways_use_sma': True, 'sideways_use_ema': True, 'sideways_use_atr': False, 'sideways_use_adx': False, 'sideways_use_spike': True, 'sideways_rsi_required': False}.
[I 2025-08-31 06:00:00,803] Trial 854 finished with values: [-1000000000.0, 1000000000.0] and parameters: {'p_sma': 30, 'p_std': 45, 'p_atr': 12, 'p_adx': 26, 'rsi_period': 17, 'ema1': 17, 'ema2': 20, 'slip_atr_k': 0.01102707131977452, 'slip_spread_k': 0.8485965992154553, 'spread_hl_frac': 0.0007070647929283685, 'bb_std_mult': 3.488487350609614, 'rsi_os': 49, 'rsi_ob': 69, 'vol_spike': 0.09960286000171573, 'adx_thresh': 8.683297808239796, 'atr_min_pct': 0.008728528184151018, 'atr_max_pct': 0.1196035578919494, 'tp_mult': 2.103319476887615, 'tsl_mult': 0.41576200783300216, 'strategy': 'mean_reversion', 'time_stop': 20, 'use_sma': True, 'use_atr': True, 'use_adx': False, 'use_ema': False, 'use_spike': False, 'rsi_required': True, 'edge_k': 0.9822840483692259, 'edge_cap': 0.3771680893637653, 'bull_strategy': 'breakout', 'bull_bb_std_mult': 1.611655185190837, 'bull_rsi_os': 33, 'bull_rsi_ob': 71, 'bull_adx_thresh': 34.402141590963986, 'bull_atr_min_pct': 0.01735167507921866, 'bull_atr_max_pct': 0.0826072132179241, 'bull_tp_mult': 1.3617300888677988, 'bull_tsl_mult': 0.6991253975183827, 'bull_time_stop': 199, 'bull_use_sma': False, 'bull_use_ema': True, 'bull_use_atr': False, 'bull_use_adx': False, 'bull_use_spike': False, 'bull_rsi_required': False, 'bear_strategy': 'breakout', 'bear_bb_std_mult': 2.305378060774395, 'bear_rsi_os': 5, 'bear_rsi_ob': 60, 'bear_adx_thresh': 15.209356169824625, 'bear_atr_min_pct': 2.3783646928709264e-05, 'bear_atr_max_pct': 0.12018467091720014, 'bear_tp_mult': 1.17879725042014, 'bear_tsl_mult': 0.039456398569546525, 'bear_time_stop': 238, 'bear_use_sma': True, 'bear_use_ema': False, 'bear_use_atr': True, 'bear_use_adx': False, 'bear_use_spike': False, 'bear_rsi_required': False, 'sideways_strategy': 'breakout', 'sideways_bb_std_mult': 1.6970934647513607, 'sideways_rsi_os': 44, 'sideways_rsi_ob': 47, 'sideways_adx_thresh': 21.676942283366195, 'sideways_atr_min_pct': 0.003195146197854037, 'sideways_atr_max_pct': 0.044694304702672875, 'sideways_tp_mult': 2.3246144757780947, 'sideways_tsl_mult': 0.2894999856162528, 'sideways_time_stop': 122, 'sideways_use_sma': True, 'sideways_use_ema': True, 'sideways_use_atr': False, 'sideways_use_adx': False, 'sideways_use_spike': True, 'sideways_rsi_required': False}.
