[I 2025-08-31 05:52:33,520] Trial 817 finished with values: [-0.021386000875397437, 0.021324197585133035] and parameters: {'p_sma': 33, 'p_std': 45, 'p_atr': 12, 'p_adx': 25, 'rsi_period': 16, 'ema1': 18, 'ema2': 19, 'slip_atr_k': 0.0005254050939438097, 'slip_spread_k': 0.8071467789413689, 'spread_hl_frac': 0.004873329437562993, 'bb_std_mult': 3.2548460067567793, 'rsi_os': 45, 'rsi_ob': 68, 'vol_spike': 0.08657321743387628, 'adx_thresh': 7.582675614888501, 'atr_min_pct': 0.012348359642317777, 'atr_max_pct': 0.1084974056371498, 'tp_mult': 2.1226699151086437, 'tsl_mult': 0.20880594656686727, 'strategy': 'mean_reversion', 'time_stop': 12, 'use_sma': False, 'use_atr': True, 'use_adx': False, 'use_ema': False, 'use_spike': False, 'rsi_required': True, 'edge_k': 0.8654121022976607, 'edge_cap': 0.3673516198959551, 'bull_strategy': 'breakout', 'bull_bb_std_mult': 1.580912779769739, 'bull_rsi_os': 30, 'bull_rsi_ob': 71, 'bull_adx_thresh': 31.056509760472224, 'bull_atr_min_pct': 0.02072745273507116, 'bull_atr_max_pct': 0.087945333019167, 'bull_tp_mult': 1.532741202050874, 'bull_tsl_mult': 0.7770036270923983, 'bull_time_stop': 192, 'bull_use_sma': False, 'bull_use_ema': True, 'bull_use_atr': False, 'bull_use_adx': False, 'bull_use_spike': False, 'bull_rsi_required': False, 'bear_strategy': 'breakout', 'bear_bb_std_mult': 2.1363575139738025, 'bear_rsi_os': 6, 'bear_rsi_ob': 59, 'bear_adx_thresh': 16.239887283890024, 'bear_atr_min_pct': 0.002578009244663327, 'bear_atr_max_pct': 0.12791321321671634, 'bear_tp_mult': 1.052341570912569, 'bear_tsl_mult': 0.16200934256473495, 'bear_time_stop': 246, 'bear_use_sma': True, 'bear_use_ema': False, 'bear_use_atr': True, 'bear_use_adx': False, 'bear_use_spike': False, 'bear_rsi_required': False, 'sideways_strategy': 'breakout', 'sideways_bb_std_mult': 1.5290628273402085, 'sideways_rsi_os': 39, 'sideways_rsi_ob': 45, 'sideways_adx_thresh': 24.307133382346198, 'sideways_atr_min_pct': 0.001413254119335605, 'sideways_atr_max_pct': 0.06640372651509269, 'sideways_tp_mult': 2.462244346215427, 'sideways_tsl_mult': 0.2967781746907113, 'sideways_time_stop': 170, 'sideways_use_sma': True, 'sideways_use_ema': True, 'sideways_use_atr': False, 'sideways_use_adx': False, 'sideways_use_spike': True, 'sideways_rsi_required': False}.
[I 2025-08-31 05:53:21,599] Trial 822 finished with values: [-1000000000.0, 1000000000.0] and parameters: {'p_sma': 32, 'p_std': 42, 'p_atr': 11, 'p_adx': 26, 'rsi_period': 16, 'ema1': 17, 'ema2': 19, 'slip_atr_k': 0.010047151771383649, 'slip_spread_k': 0.802835929787745, 'spread_hl_frac': 0.0027868115385359053, 'bb_std_mult': 3.3607811424855174, 'rsi_os': 48, 'rsi_ob': 72, 'vol_spike': 0.08736336372444671, 'adx_thresh': 6.528217906289741, 'atr_min_pct': 0.009937666567574902, 'atr_max_pct': 0.11613542112556845, 'tp_mult': 2.07250772471183, 'tsl_mult': 0.4107677968495218, 'strategy': 'mean_reversion', 'time_stop': 5, 'use_sma': False, 'use_atr': True, 'use_adx': False, 'use_ema': False, 'use_spike': False, 'rsi_required': True, 'edge_k': 0.8144890801879219, 'edge_cap': 0.33219690414875264, 'bull_strategy': 'breakout', 'bull_bb_std_mult': 1.7573085964952546, 'bull_rsi_os': 37, 'bull_rsi_ob': 72, 'bull_adx_thresh': 34.18327385419162, 'bull_atr_min_pct': 0.015823029885247815, 'bull_atr_max_pct': 0.08809624732003875, 'bull_tp_mult': 1.4236899970448316, 'bull_tsl_mult': 0.6864227838369211, 'bull_time_stop': 184, 'bull_use_sma': False, 'bull_use_ema': True, 'bull_use_atr': False, 'bull_use_adx': True, 'bull_use_spike': False, 'bull_rsi_required': False, 'bear_strategy': 'breakout', 'bear_bb_std_mult': 1.9507898226752547, 'bear_rsi_os': 5, 'bear_rsi_ob': 53, 'bear_adx_thresh': 14.197625935983078, 'bear_atr_min_pct': 0.0012696118808347642, 'bear_atr_max_pct': 0.1280252942468513, 'bear_tp_mult': 1.1214712464324441, 'bear_tsl_mult': 0.10957747905963637, 'bear_time_stop': 248, 'bear_use_sma': True, 'bear_use_ema': False, 'bear_use_atr': True, 'bear_use_adx': False, 'bear_use_spike': False, 'bear_rsi_required': False, 'sideways_strategy': 'breakout', 'sideways_bb_std_mult': 1.5515584895182408, 'sideways_rsi_os': 42, 'sideways_rsi_ob': 45, 'sideways_adx_thresh': 18.819919398057053, 'sideways_atr_min_pct': 0.00530149827076536, 'sideways_atr_max_pct': 0.052126418759611, 'sideways_tp_mult': 2.8066568338557167, 'sideways_tsl_mult': 0.23208503231463967, 'sideways_time_stop': 143, 'sideways_use_sma': True, 'sideways_use_ema': True, 'sideways_use_atr': False, 'sideways_use_adx': False, 'sideways_use_spike': True, 'sideways_rsi_required': True}.
[I 2025-08-31 05:53:23,092] Trial 820 finished with values: [-0.019129431035100453, 0.019066135325398977] and parameters: {'p_sma': 33, 'p_std': 44, 'p_atr': 11, 'p_adx': 25, 'rsi_period': 16, 'ema1': 18, 'ema2': 19, 'slip_atr_k': 0.005905349892793645, 'slip_spread_k': 0.7996587642101929, 'spread_hl_frac': 0.0027120941128577045, 'bb_std_mult': 3.4474407712727286, 'rsi_os': 47, 'rsi_ob': 69, 'vol_spike': 0.08897972968054838, 'adx_thresh': 8.567064525676294, 'atr_min_pct': 0.011273546185487095, 'atr_max_pct': 0.11334493799951602, 'tp_mult': 1.9921905709808347, 'tsl_mult': 0.3988631172190121, 'strategy': 'mean_reversion', 'time_stop': 12, 'use_sma': False, 'use_atr': True, 'use_adx': False, 'use_ema': False, 'use_spike': True, 'rsi_required': True, 'edge_k': 0.8861860368777119, 'edge_cap': 0.31631845975917405, 'bull_strategy': 'breakout', 'bull_bb_std_mult': 1.4350748027429094, 'bull_rsi_os': 29, 'bull_rsi_ob': 66, 'bull_adx_thresh': 32.29743484406037, 'bull_atr_min_pct': 0.018703451483767935, 'bull_atr_max_pct': 0.08717001583217444, 'bull_tp_mult': 1.5415500238565922, 'bull_tsl_mult': 0.727023990052246, 'bull_time_stop': 172, 'bull_use_sma': False, 'bull_use_ema': True, 'bull_use_atr': False, 'bull_use_adx': True, 'bull_use_spike': False, 'bull_rsi_required': False, 'bear_strategy': 'breakout', 'bear_bb_std_mult': 2.0789205716355954, 'bear_rsi_os': 7, 'bear_rsi_ob': 56, 'bear_adx_thresh': 14.513523185785122, 'bear_atr_min_pct': 0.013114482587788478, 'bear_atr_max_pct': 0.10802048625801665, 'bear_tp_mult': 1.0999637549686183, 'bear_tsl_mult': 0.1643026211023968, 'bear_time_stop': 245, 'bear_use_sma': True, 'bear_use_ema': False, 'bear_use_atr': True, 'bear_use_adx': False, 'bear_use_spike': False, 'bear_rsi_required': False, 'sideways_strategy': 'breakout', 'sideways_bb_std_mult': 1.5268379060623967, 'sideways_rsi_os': 39, 'sideways_rsi_ob': 45, 'sideways_adx_thresh': 24.462961806863152, 'sideways_atr_min_pct': 0.0015653521655621455, 'sideways_atr_max_pct': 0.06526667319791872, 'sideways_tp_mult': 2.517668004182869, 'sideways_tsl_mult': 0.2305082199036291, 'sideways_time_stop': 146, 'sideways_use_sma': True, 'sideways_use_ema': True, 'sideways_use_atr': False, 'sideways_use_adx': False, 'sideways_use_spike': True, 'sideways_rsi_required': False}.
[I 2025-08-31 05:53:23,091] Trial 821 finished with values: [-0.02887614923208459, 0.02881325613254607] and parameters: {'p_sma': 32, 'p_std': 44, 'p_atr': 11, 'p_adx': 26, 'rsi_period': 15, 'ema1': 17, 'ema2': 19, 'slip_atr_k': 0.008953347578913473, 'slip_spread_k': 0.8098021921753714, 'spread_hl_frac': 0.003184995189999015, 'bb_std_mult': 3.3717281211009578, 'rsi_os': 48, 'rsi_ob': 70, 'vol_spike': 0.08907557056873386, 'adx_thresh': 6.277858828488794, 'atr_min_pct': 0.01027138113004208, 'atr_max_pct': 0.11700593298337829, 'tp_mult': 2.134540994868012, 'tsl_mult': 0.4243669436853303, 'strategy': 'mean_reversion', 'time_stop': 11, 'use_sma': False, 'use_atr': True, 'use_adx': False, 'use_ema': False, 'use_spike': False, 'rsi_required': True, 'edge_k': 0.824347516204549, 'edge_cap': 0.31449927274775724, 'bull_strategy': 'breakout', 'bull_bb_std_mult': 1.75938799910642, 'bull_rsi_os': 36, 'bull_rsi_ob': 70, 'bull_adx_thresh': 34.289874825470434, 'bull_atr_min_pct': 0.0158110513206196, 'bull_atr_max_pct': 0.0879467496445642, 'bull_tp_mult': 1.4427992826426135, 'bull_tsl_mult': 0.6788023393735299, 'bull_time_stop': 184, 'bull_use_sma': False, 'bull_use_ema': True, 'bull_use_atr': False, 'bull_use_adx': False, 'bull_use_spike': False, 'bull_rsi_required': False, 'bear_strategy': 'breakout', 'bear_bb_std_mult': 2.0653586104580834, 'bear_rsi_os': 5, 'bear_rsi_ob': 55, 'bear_adx_thresh': 14.404817494276285, 'bear_atr_min_pct': 0.0011632884000894292, 'bear_atr_max_pct': 0.12781228319936525, 'bear_tp_mult': 1.1447920096925064, 'bear_tsl_mult': 0.09604859321419532, 'bear_time_stop': 253, 'bear_use_sma': True, 'bear_use_ema': False, 'bear_use_atr': True, 'bear_use_adx': False, 'bear_use_spike': False, 'bear_rsi_required': False, 'sideways_strategy': 'breakout', 'sideways_bb_std_mult': 1.548443599373664, 'sideways_rsi_os': 42, 'sideways_rsi_ob': 45, 'sideways_adx_thresh': 19.416302715591506, 'sideways_atr_min_pct': 0.0013225782280392975, 'sideways_atr_max_pct': 0.05170177017895047, 'sideways_tp_mult': 2.4381050394076214, 'sideways_tsl_mult': 0.234655157894126, 'sideways_time_stop': 144, 'sideways_use_sma': True, 'sideways_use_ema': True, 'sideways_use_atr': False, 'sideways_use_adx': False, 'sideways_use_spike': True, 'sideways_rsi_required': False}.
[I 2025-08-31 05:53:23,861] Trial 823 finished with values: [-1000000000.0, 1000000000.0] and parameters: {'p_sma': 31, 'p_std': 42, 'p_atr': 11, 'p_adx': 26, 'rsi_period': 16, 'ema1': 17, 'ema2': 16, 'slip_atr_k': 0.009446945176133217, 'slip_spread_k': 0.8026824646588091, 'spread_hl_frac': 0.002112110050517209, 'bb_std_mult': 3.3769143378272632, 'rsi_os': 49, 'rsi_ob': 71, 'vol_spike': 0.07683010388605888, 'adx_thresh': 6.342804283387719, 'atr_min_pct': 0.009974696462655443, 'atr_max_pct': 0.11616847049808586, 'tp_mult': 2.1951246642261055, 'tsl_mult': 0.4064814460444953, 'strategy': 'mean_reversion', 'time_stop': 11, 'use_sma': False, 'use_atr': True, 'use_adx': False, 'use_ema': False, 'use_spike': True, 'rsi_required': True, 'edge_k': 0.8259937063033852, 'edge_cap': 0.31497854986617546, 'bull_strategy': 'breakout', 'bull_bb_std_mult': 1.8648844468910852, 'bull_rsi_os': 36, 'bull_rsi_ob': 70, 'bull_adx_thresh': 34.21686036844314, 'bull_atr_min_pct': 0.01544830179333952, 'bull_atr_max_pct': 0.0900566655817937, 'bull_tp_mult': 1.4283472685355219, 'bull_tsl_mult': 0.6656429273881431, 'bull_time_stop': 183, 'bull_use_sma': False, 'bull_use_ema': True, 'bull_use_atr': False, 'bull_use_adx': True, 'bull_use_spike': False, 'bull_rsi_required': False, 'bear_strategy': 'breakout', 'bear_bb_std_mult': 1.9692681104993828, 'bear_rsi_os': 5, 'bear_rsi_ob': 57, 'bear_adx_thresh': 14.029941050476932, 'bear_atr_min_pct': 0.0012320572382716495, 'bear_atr_max_pct': 0.130507044353799, 'bear_tp_mult': 1.1485860274050186, 'bear_tsl_mult': 0.10810126427337724, 'bear_time_stop': 248, 'bear_use_sma': True, 'bear_use_ema': False, 'bear_use_atr': True, 'bear_use_adx': False, 'bear_use_spike': False, 'bear_rsi_required': False, 'sideways_strategy': 'breakout', 'sideways_bb_std_mult': 1.4885873663406064, 'sideways_rsi_os': 42, 'sideways_rsi_ob': 45, 'sideways_adx_thresh': 18.448878670902968, 'sideways_atr_min_pct': 0.005630914560801286, 'sideways_atr_max_pct': 0.05244809300446208, 'sideways_tp_mult': 2.730593587479622, 'sideways_tsl_mult': 0.225912232773825, 'sideways_time_stop': 142, 'sideways_use_sma': True, 'sideways_use_ema': True, 'sideways_use_atr': False, 'sideways_use_adx': False, 'sideways_use_spike': True, 'sideways_rsi_required': True}.
[I 2025-08-31 05:54:11,511] Trial 827 finished with values: [-1000000000.0, 1000000000.0] and parameters: {'p_sma': 32, 'p_std': 42, 'p_atr': 12, 'p_adx': 27, 'rsi_period': 16, 'ema1': 17, 'ema2': 20, 'slip_atr_k': 0.009005264358305832, 'slip_spread_k': 0.7815818904828986, 'spread_hl_frac': 0.0017116291662961072, 'bb_std_mult': 3.3152250288926233, 'rsi_os': 48, 'rsi_ob': 72, 'vol_spike': 0.07968783200443773, 'adx_thresh': 7.266901238649759, 'atr_min_pct': 0.009776771186517234, 'atr_max_pct': 0.11639782105210626, 'tp_mult': 2.224142500662421, 'tsl_mult': 0.44859612352063205, 'strategy': 'mean_reversion', 'time_stop': 5, 'use_sma': True, 'use_atr': True, 'use_adx': True, 'use_ema': True, 'use_spike': True, 'rsi_required': True, 'edge_k': 0.8616364102274547, 'edge_cap': 0.29613292049176004, 'bull_strategy': 'breakout', 'bull_bb_std_mult': 1.6581082082088356, 'bull_rsi_os': 36, 'bull_rsi_ob': 71, 'bull_adx_thresh': 34.89723734555563, 'bull_atr_min_pct': 0.016221523370231174, 'bull_atr_max_pct': 0.0913371970482546, 'bull_tp_mult': 1.4651059906640194, 'bull_tsl_mult': 0.6046591973129848, 'bull_time_stop': 187, 'bull_use_sma': True, 'bull_use_ema': True, 'bull_use_atr': False, 'bull_use_adx': True, 'bull_use_spike': True, 'bull_rsi_required': False, 'bear_strategy': 'breakout', 'bear_bb_std_mult': 2.0621819187337715, 'bear_rsi_os': 5, 'bear_rsi_ob': 54, 'bear_adx_thresh': 13.528705579820338, 'bear_atr_min_pct': 0.0017777827695699873, 'bear_atr_max_pct': 0.12459381467282828, 'bear_tp_mult': 1.1490279081314092, 'bear_tsl_mult': 0.11572099105859279, 'bear_time_stop': 251, 'bear_use_sma': False, 'bear_use_ema': False, 'bear_use_atr': False, 'bear_use_adx': False, 'bear_use_spike': False, 'bear_rsi_required': False, 'sideways_strategy': 'breakout', 'sideways_bb_std_mult': 1.450938082647642, 'sideways_rsi_os': 41, 'sideways_rsi_ob': 45, 'sideways_adx_thresh': 19.496495720557636, 'sideways_atr_min_pct': 0.004645987156201207, 'sideways_atr_max_pct': 0.0534660229751213, 'sideways_tp_mult': 2.3931095648104033, 'sideways_tsl_mult': 0.2601738391080143, 'sideways_time_stop': 135, 'sideways_use_sma': True, 'sideways_use_ema': True, 'sideways_use_atr': True, 'sideways_use_adx': False, 'sideways_use_spike': False, 'sideways_rsi_required': True}.
[I 2025-08-31 05:54:13,008] Trial 824 finished with values: [-1000000000.0, 1000000000.0] and parameters: {'p_sma': 31, 'p_std': 43, 'p_atr': 11, 'p_adx': 27, 'rsi_period': 16, 'ema1': 17, 'ema2': 20, 'slip_atr_k': 0.008203193418352649, 'slip_spread_k': 0.7989199158838552, 'spread_hl_frac': 0.0017059665348992607, 'bb_std_mult': 3.3281852662583704, 'rsi_os': 49, 'rsi_ob': 72, 'vol_spike': 0.07282544059156668, 'adx_thresh': 7.087899232863045, 'atr_min_pct': 0.009937018888729545, 'atr_max_pct': 0.11620207738930037, 'tp_mult': 2.2056257220840547, 'tsl_mult': 0.424829676842569, 'strategy': 'mean_reversion', 'time_stop': 10, 'use_sma': False, 'use_atr': True, 'use_adx': False, 'use_ema': False, 'use_spike': True, 'rsi_required': True, 'edge_k': 0.8370916634567849, 'edge_cap': 0.32202910067928087, 'bull_strategy': 'breakout', 'bull_bb_std_mult': 1.6686755415268268, 'bull_rsi_os': 36, 'bull_rsi_ob': 70, 'bull_adx_thresh': 34.69968372349748, 'bull_atr_min_pct': 0.015311947517211523, 'bull_atr_max_pct': 0.09105044992946519, 'bull_tp_mult': 1.4482501845233375, 'bull_tsl_mult': 0.6568209952533279, 'bull_time_stop': 183, 'bull_use_sma': False, 'bull_use_ema': True, 'bull_use_atr': False, 'bull_use_adx': True, 'bull_use_spike': False, 'bull_rsi_required': False, 'bear_strategy': 'breakout', 'bear_bb_std_mult': 2.0640365597310275, 'bear_rsi_os': 5, 'bear_rsi_ob': 55, 'bear_adx_thresh': 14.21423665310285, 'bear_atr_min_pct': 0.0017357538105351568, 'bear_atr_max_pct': 0.13069637505988868, 'bear_tp_mult': 1.144019747929776, 'bear_tsl_mult': 0.0900375675046553, 'bear_time_stop': 250, 'bear_use_sma': True, 'bear_use_ema': False, 'bear_use_atr': False, 'bear_use_adx': False, 'bear_use_spike': False, 'bear_rsi_required': False, 'sideways_strategy': 'breakout', 'sideways_bb_std_mult': 1.4737332265385932, 'sideways_rsi_os': 42, 'sideways_rsi_ob': 45, 'sideways_adx_thresh': 19.59779889453251, 'sideways_atr_min_pct': 0.004563796871149975, 'sideways_atr_max_pct': 0.05325605993918753, 'sideways_tp_mult': 2.7248180216208664, 'sideways_tsl_mult': 0.22715615576793513, 'sideways_time_stop': 146, 'sideways_use_sma': True, 'sideways_use_ema': True, 'sideways_use_atr': False, 'sideways_use_adx': False, 'sideways_use_spike': True, 'sideways_rsi_required': True}.
[I 2025-08-31 05:54:14,446] Trial 825 finished with values: [-1000000000.0, 1000000000.0] and parameters: {'p_sma': 31, 'p_std': 42, 'p_atr': 12, 'p_adx': 27, 'rsi_period': 16, 'ema1': 16, 'ema2': 18, 'slip_atr_k': 0.010531804333961024, 'slip_spread_k': 0.7965083954930957, 'spread_hl_frac': 0.0021166043354019335, 'bb_std_mult': 3.3175063413833468, 'rsi_os': 49, 'rsi_ob': 72, 'vol_spike': 0.07478112640474292, 'adx_thresh': 7.012213623666092, 'atr_min_pct': 0.009816018465180813, 'atr_max_pct': 0.11545594827159558, 'tp_mult': 2.2334039482454604, 'tsl_mult': 0.45310120818590205, 'strategy': 'mean_reversion', 'time_stop': 11, 'use_sma': False, 'use_atr': True, 'use_adx': True, 'use_ema': True, 'use_spike': True, 'rsi_required': True, 'edge_k': 0.8385533160590295, 'edge_cap': 0.30296596372805307, 'bull_strategy': 'breakout', 'bull_bb_std_mult': 1.8537164915308215, 'bull_rsi_os': 36, 'bull_rsi_ob': 70, 'bull_adx_thresh': 34.45323178843155, 'bull_atr_min_pct': 0.015303304620851322, 'bull_atr_max_pct': 0.09085056015327228, 'bull_tp_mult': 1.4534414536549969, 'bull_tsl_mult': 0.6376495867236999, 'bull_time_stop': 185, 'bull_use_sma': True, 'bull_use_ema': True, 'bull_use_atr': False, 'bull_use_adx': True, 'bull_use_spike': True, 'bull_rsi_required': False, 'bear_strategy': 'breakout', 'bear_bb_std_mult': 2.0736765470795397, 'bear_rsi_os': 5, 'bear_rsi_ob': 54, 'bear_adx_thresh': 14.008751033285924, 'bear_atr_min_pct': 0.0037670686752120375, 'bear_atr_max_pct': 0.1308126227811543, 'bear_tp_mult': 1.148507218132642, 'bear_tsl_mult': 0.11661315516940776, 'bear_time_stop': 250, 'bear_use_sma': False, 'bear_use_ema': False, 'bear_use_atr': False, 'bear_use_adx': False, 'bear_use_spike': False, 'bear_rsi_required': False, 'sideways_strategy': 'breakout', 'sideways_bb_std_mult': 1.4675159272197666, 'sideways_rsi_os': 42, 'sideways_rsi_ob': 45, 'sideways_adx_thresh': 20.43455567361076, 'sideways_atr_min_pct': 0.003780439155677136, 'sideways_atr_max_pct': 0.054153723997412265, 'sideways_tp_mult': 2.366727068778277, 'sideways_tsl_mult': 0.19673699428533675, 'sideways_time_stop': 136, 'sideways_use_sma': True, 'sideways_use_ema': True, 'sideways_use_atr': True, 'sideways_use_adx': False, 'sideways_use_spike': False, 'sideways_rsi_required': True}.
[I 2025-08-31 05:54:15,180] Trial 826 finished with values: [-1000000000.0, 1000000000.0] and parameters: {'p_sma': 31, 'p_std': 42, 'p_atr': 12, 'p_adx': 27, 'rsi_period': 16, 'ema1': 16, 'ema2': 16, 'slip_atr_k': 0.010213923330499697, 'slip_spread_k': 0.8255566600631117, 'spread_hl_frac': 0.0020917153638040017, 'bb_std_mult': 3.312566031843073, 'rsi_os': 49, 'rsi_ob': 72, 'vol_spike': 0.07765906259281714, 'adx_thresh': 6.879765350455152, 'atr_min_pct': 0.009816623916624828, 'atr_max_pct': 0.11587687653874154, 'tp_mult': 2.0579515507124877, 'tsl_mult': 0.4517882367681514, 'strategy': 'mean_reversion', 'time_stop': 5, 'use_sma': False, 'use_atr': True, 'use_adx': True, 'use_ema': True, 'use_spike': True, 'rsi_required': True, 'edge_k': 0.8461214496956826, 'edge_cap': 0.29657500352097005, 'bull_strategy': 'breakout', 'bull_bb_std_mult': 1.6659697363441874, 'bull_rsi_os': 36, 'bull_rsi_ob': 70, 'bull_adx_thresh': 34.95055128854237, 'bull_atr_min_pct': 0.01594233828975846, 'bull_atr_max_pct': 0.09128682783147268, 'bull_tp_mult': 1.4577425884612785, 'bull_tsl_mult': 0.6672871605432755, 'bull_time_stop': 186, 'bull_use_sma': True, 'bull_use_ema': True, 'bull_use_atr': False, 'bull_use_adx': True, 'bull_use_spike': True, 'bull_rsi_required': False, 'bear_strategy': 'breakout', 'bear_bb_std_mult': 1.9992409085700706, 'bear_rsi_os': 5, 'bear_rsi_ob': 54, 'bear_adx_thresh': 14.087560627647438, 'bear_atr_min_pct': 0.0019096600455142105, 'bear_atr_max_pct': 0.13238412217393591, 'bear_tp_mult': 1.162064062555249, 'bear_tsl_mult': 0.09342257316342706, 'bear_time_stop': 251, 'bear_use_sma': False, 'bear_use_ema': False, 'bear_use_atr': False, 'bear_use_adx': False, 'bear_use_spike': False, 'bear_rsi_required': False, 'sideways_strategy': 'breakout', 'sideways_bb_std_mult': 1.446848170827669, 'sideways_rsi_os': 42, 'sideways_rsi_ob': 45, 'sideways_adx_thresh': 20.225960666406664, 'sideways_atr_min_pct': 0.004009672201676631, 'sideways_atr_max_pct': 0.05413553006362263, 'sideways_tp_mult': 2.7338889167687386, 'sideways_tsl_mult': 0.1982117040510466, 'sideways_time_stop': 135, 'sideways_use_sma': True, 'sideways_use_ema': True, 'sideways_use_atr': True, 'sideways_use_adx': False, 'sideways_use_spike': False, 'sideways_rsi_required': True}.
