[I 2025-08-31 03:46:37,855] Trial 109 finished with values: [-1000000000.0, 1000000000.0] and parameters: {'p_sma': 58, 'p_std': 47, 'p_atr': 8, 'p_adx': 9, 'rsi_period': 43, 'ema1': 21, 'ema2': 12, 'slip_atr_k': 0.06556845081594659, 'slip_spread_k': 0.8936503781388522, 'spread_hl_frac': 0.0168021608830109, 'bb_std_mult': 0.8475837086848672, 'rsi_os': 6, 'rsi_ob': 86, 'vol_spike': 0.06871557686482917, 'adx_thresh': 10.958632108937406, 'atr_min_pct': 0.006949242027137668, 'atr_max_pct': 0.055150878845740325, 'tp_mult': 1.581017308581773, 'tsl_mult': 0.9543252408048026, 'strategy': 'breakout', 'time_stop': 73, 'use_sma': True, 'use_atr': True, 'use_adx': True, 'use_ema': False, 'use_spike': True, 'rsi_required': False, 'edge_k': 0.42223070747774866, 'edge_cap': 0.3405484109190118, 'bull_strategy': 'mean_reversion', 'bull_bb_std_mult': 3.065418760802193, 'bull_rsi_os': 25, 'bull_rsi_ob': 92, 'bull_adx_thresh': 23.11275001321763, 'bull_atr_min_pct': 0.021050097997702386, 'bull_atr_max_pct': 0.03657448059280864, 'bull_tp_mult': 2.6640256560389366, 'bull_tsl_mult': 0.7824874610193971, 'bull_time_stop': 280, 'bull_use_sma': True, 'bull_use_ema': False, 'bull_use_atr': False, 'bull_use_adx': True, 'bull_use_spike': False, 'bull_rsi_required': True, 'bear_strategy': 'mean_reversion', 'bear_bb_std_mult': 3.00075404346214, 'bear_rsi_os': 9, 'bear_rsi_ob': 65, 'bear_adx_thresh': 9.660030753589444, 'bear_atr_min_pct': 0.008244135348542635, 'bear_atr_max_pct': 0.06253523717878706, 'bear_tp_mult': 2.087338849665399, 'bear_tsl_mult': 0.5044260515441902, 'bear_time_stop': 50, 'bear_use_sma': True, 'bear_use_ema': True, 'bear_use_atr': False, 'bear_use_adx': True, 'bear_use_spike': True, 'bear_rsi_required': True, 'sideways_strategy': 'mean_reversion', 'sideways_bb_std_mult': 2.74895213383223, 'sideways_rsi_os': 44, 'sideways_rsi_ob': 66, 'sideways_adx_thresh': 28.25551462085572, 'sideways_atr_min_pct': 0.01980698538293638, 'sideways_atr_max_pct': 0.018743763450132102, 'sideways_tp_mult': 1.220553575046995, 'sideways_tsl_mult': 0.286509123662971, 'sideways_time_stop': 283, 'sideways_use_sma': False, 'sideways_use_ema': False, 'sideways_use_atr': False, 'sideways_use_adx': True, 'sideways_use_spike': False, 'sideways_rsi_required': True}.
[I 2025-08-31 03:46:38,580] Trial 111 finished with values: [-1000000000.0, 1000000000.0] and parameters: {'p_sma': 60, 'p_std': 47, 'p_atr': 13, 'p_adx': 9, 'rsi_period': 73, 'ema1': 15, 'ema2': 39, 'slip_atr_k': 0.19072730138043173, 'slip_spread_k': 0.9767144506467005, 'spread_hl_frac': 0.01665174303711669, 'bb_std_mult': 2.1200866821861437, 'rsi_os': 34, 'rsi_ob': 85, 'vol_spike': 0.1340880076472663, 'adx_thresh': 23.64840970980298, 'atr_min_pct': 0.02687256621143602, 'atr_max_pct': 0.0714308482662039, 'tp_mult': 1.5828156328218248, 'tsl_mult': 0.5604920727906344, 'strategy': 'breakout', 'time_stop': 172, 'use_sma': False, 'use_atr': False, 'use_adx': False, 'use_ema': True, 'use_spike': False, 'rsi_required': False, 'edge_k': 0.05785340113472259, 'edge_cap': 0.3486630416127409, 'bull_strategy': 'mean_reversion', 'bull_bb_std_mult': 2.7306224140122306, 'bull_rsi_os': 54, 'bull_rsi_ob': 62, 'bull_adx_thresh': 20.943859518494474, 'bull_atr_min_pct': 0.015565350269358685, 'bull_atr_max_pct': 0.14477934550363541, 'bull_tp_mult': 2.570969713057705, 'bull_tsl_mult': 0.8587789668596277, 'bull_time_stop': 299, 'bull_use_sma': False, 'bull_use_ema': False, 'bull_use_atr': True, 'bull_use_adx': True, 'bull_use_spike': True, 'bull_rsi_required': False, 'bear_strategy': 'mean_reversion', 'bear_bb_std_mult': 3.3984885943660883, 'bear_rsi_os': 45, 'bear_rsi_ob': 67, 'bear_adx_thresh': 20.08685475520096, 'bear_atr_min_pct': 0.01497101761228793, 'bear_atr_max_pct': 0.025911993956482277, 'bear_tp_mult': 1.4779902130664486, 'bear_tsl_mult': 0.5021830573278132, 'bear_time_stop': 69, 'bear_use_sma': True, 'bear_use_ema': True, 'bear_use_atr': False, 'bear_use_adx': False, 'bear_use_spike': True, 'bear_rsi_required': False, 'sideways_strategy': 'mean_reversion', 'sideways_bb_std_mult': 1.0206929133062663, 'sideways_rsi_os': 40, 'sideways_rsi_ob': 50, 'sideways_adx_thresh': 12.029334096944089, 'sideways_atr_min_pct': 0.010486566211620446, 'sideways_atr_max_pct': 0.12176248336261494, 'sideways_tp_mult': 2.204119869826187, 'sideways_tsl_mult': 0.2778006165850335, 'sideways_time_stop': 281, 'sideways_use_sma': False, 'sideways_use_ema': False, 'sideways_use_atr': False, 'sideways_use_adx': False, 'sideways_use_spike': True, 'sideways_rsi_required': True}.
[I 2025-08-31 03:46:38,818] Trial 110 finished with values: [-1000000000.0, 1000000000.0] and parameters: {'p_sma': 60, 'p_std': 24, 'p_atr': 12, 'p_adx': 21, 'rsi_period': 9, 'ema1': 15, 'ema2': 12, 'slip_atr_k': 0.15523141644313043, 'slip_spread_k': 0.7536363098821457, 'spread_hl_frac': 0.019678232771844894, 'bb_std_mult': 1.2938240873767732, 'rsi_os': 42, 'rsi_ob': 80, 'vol_spike': 0.14563989321301174, 'adx_thresh': 28.34786440166929, 'atr_min_pct': 0.014360009650133891, 'atr_max_pct': 0.01750964203662974, 'tp_mult': 1.5875975472374344, 'tsl_mult': 0.5616092375265032, 'strategy': 'breakout', 'time_stop': 237, 'use_sma': True, 'use_atr': True, 'use_adx': False, 'use_ema': False, 'use_spike': True, 'rsi_required': True, 'edge_k': 0.4181887560598962, 'edge_cap': 0.9622174046667225, 'bull_strategy': 'mean_reversion', 'bull_bb_std_mult': 2.806164135245338, 'bull_rsi_os': 26, 'bull_rsi_ob': 54, 'bull_adx_thresh': 9.745913173907859, 'bull_atr_min_pct': 0.014286502415313151, 'bull_atr_max_pct': 0.019326079042477476, 'bull_tp_mult': 2.6627480738651936, 'bull_tsl_mult': 0.7729294594085732, 'bull_time_stop': 281, 'bull_use_sma': False, 'bull_use_ema': False, 'bull_use_atr': False, 'bull_use_adx': True, 'bull_use_spike': False, 'bull_rsi_required': True, 'bear_strategy': 'mean_reversion', 'bear_bb_std_mult': 1.8124970916298977, 'bear_rsi_os': 45, 'bear_rsi_ob': 69, 'bear_adx_thresh': 9.578525507187697, 'bear_atr_min_pct': 0.01511979662879902, 'bear_atr_max_pct': 0.07248251851662901, 'bear_tp_mult': 1.0132620488406001, 'bear_tsl_mult': 0.23789283092100888, 'bear_time_stop': 26, 'bear_use_sma': True, 'bear_use_ema': True, 'bear_use_atr': False, 'bear_use_adx': True, 'bear_use_spike': True, 'bear_rsi_required': True, 'sideways_strategy': 'mean_reversion', 'sideways_bb_std_mult': 2.7353356257417403, 'sideways_rsi_os': 53, 'sideways_rsi_ob': 85, 'sideways_adx_thresh': 29.577819569533585, 'sideways_atr_min_pct': 0.020087864515703387, 'sideways_atr_max_pct': 0.11249189824106376, 'sideways_tp_mult': 1.4892825253450077, 'sideways_tsl_mult': 0.2977004135903192, 'sideways_time_stop': 67, 'sideways_use_sma': False, 'sideways_use_ema': False, 'sideways_use_atr': False, 'sideways_use_adx': False, 'sideways_use_spike': True, 'sideways_rsi_required': True}.
[I 2025-08-31 03:46:38,941] Trial 108 finished with values: [-1000000000.0, 1000000000.0] and parameters: {'p_sma': 58, 'p_std': 47, 'p_atr': 8, 'p_adx': 10, 'rsi_period': 43, 'ema1': 21, 'ema2': 39, 'slip_atr_k': 0.15473952184032835, 'slip_spread_k': 0.9185408711119951, 'spread_hl_frac': 0.02835497194252316, 'bb_std_mult': 0.8531265148745153, 'rsi_os': 26, 'rsi_ob': 86, 'vol_spike': 0.07092999358693922, 'adx_thresh': 34.27447528341227, 'atr_min_pct': 0.014126070788573527, 'atr_max_pct': 0.016280734497706756, 'tp_mult': 1.5208634591803725, 'tsl_mult': 0.9356637261594133, 'strategy': 'mean_reversion', 'time_stop': 237, 'use_sma': False, 'use_atr': True, 'use_adx': True, 'use_ema': True, 'use_spike': False, 'rsi_required': False, 'edge_k': 0.2715191018763363, 'edge_cap': 0.48796746693598264, 'bull_strategy': 'mean_reversion', 'bull_bb_std_mult': 3.0554189800166904, 'bull_rsi_os': 25, 'bull_rsi_ob': 54, 'bull_adx_thresh': 23.456981861802486, 'bull_atr_min_pct': 0.023419385246919083, 'bull_atr_max_pct': 0.1384697286823167, 'bull_tp_mult': 2.5851998271591734, 'bull_tsl_mult': 0.7816786571874657, 'bull_time_stop': 282, 'bull_use_sma': True, 'bull_use_ema': True, 'bull_use_atr': True, 'bull_use_adx': True, 'bull_use_spike': True, 'bull_rsi_required': True, 'bear_strategy': 'mean_reversion', 'bear_bb_std_mult': 1.8278738578189204, 'bear_rsi_os': 45, 'bear_rsi_ob': 65, 'bear_adx_thresh': 9.836941083738317, 'bear_atr_min_pct': 0.007876617546142871, 'bear_atr_max_pct': 0.06291708627348513, 'bear_tp_mult': 1.0645289618085751, 'bear_tsl_mult': 0.6787846545852646, 'bear_time_stop': 24, 'bear_use_sma': True, 'bear_use_ema': False, 'bear_use_atr': False, 'bear_use_adx': False, 'bear_use_spike': False, 'bear_rsi_required': False, 'sideways_strategy': 'breakout', 'sideways_bb_std_mult': 2.760315131298078, 'sideways_rsi_os': 36, 'sideways_rsi_ob': 84, 'sideways_adx_thresh': 12.505927383089539, 'sideways_atr_min_pct': 0.019717034647429143, 'sideways_atr_max_pct': 0.05189623540907858, 'sideways_tp_mult': 1.6670334296108773, 'sideways_tsl_mult': 0.28890494925578514, 'sideways_time_stop': 282, 'sideways_use_sma': False, 'sideways_use_ema': True, 'sideways_use_atr': True, 'sideways_use_adx': True, 'sideways_use_spike': False, 'sideways_rsi_required': True}.
[I 2025-08-31 03:47:08,024] Trial 112 finished with values: [-1000000000.0, 1000000000.0] and parameters: {'p_sma': 9, 'p_std': 24, 'p_atr': 13, 'p_adx': 10, 'rsi_period': 18, 'ema1': 15, 'ema2': 39, 'slip_atr_k': 0.1781949066098787, 'slip_spread_k': 0.9754397092088464, 'spread_hl_frac': 0.02187095053433878, 'bb_std_mult': 0.985314909292646, 'rsi_os': 19, 'rsi_ob': 83, 'vol_spike': 0.13296244771061502, 'adx_thresh': 28.27932746858266, 'atr_min_pct': 0.01418622923581331, 'atr_max_pct': 0.07148479276594795, 'tp_mult': 1.333867696231977, 'tsl_mult': 0.1119422469993533, 'strategy': 'breakout', 'time_stop': 190, 'use_sma': False, 'use_atr': False, 'use_adx': False, 'use_ema': True, 'use_spike': False, 'rsi_required': True, 'edge_k': 0.05985218569281614, 'edge_cap': 0.09515238480565757, 'bull_strategy': 'mean_reversion', 'bull_bb_std_mult': 2.816508862537371, 'bull_rsi_os': 12, 'bull_rsi_ob': 61, 'bull_adx_thresh': 29.92494043346731, 'bull_atr_min_pct': 0.01470988286876442, 'bull_atr_max_pct': 0.023040544078924627, 'bull_tp_mult': 2.8763758414702254, 'bull_tsl_mult': 0.1551768894419135, 'bull_time_stop': 59, 'bull_use_sma': False, 'bull_use_ema': True, 'bull_use_atr': True, 'bull_use_adx': False, 'bull_use_spike': True, 'bull_rsi_required': False, 'bear_strategy': 'mean_reversion', 'bear_bb_std_mult': 1.7920176150288987, 'bear_rsi_os': 46, 'bear_rsi_ob': 52, 'bear_adx_thresh': 29.8250055439794, 'bear_atr_min_pct': 0.01520027486822871, 'bear_atr_max_pct': 0.12348406855779301, 'bear_tp_mult': 1.4851536365190146, 'bear_tsl_mult': 0.5413178408678236, 'bear_time_stop': 24, 'bear_use_sma': False, 'bear_use_ema': False, 'bear_use_atr': False, 'bear_use_adx': False, 'bear_use_spike': False, 'bear_rsi_required': False, 'sideways_strategy': 'mean_reversion', 'sideways_bb_std_mult': 2.894618035852965, 'sideways_rsi_os': 49, 'sideways_rsi_ob': 82, 'sideways_adx_thresh': 29.72122218434885, 'sideways_atr_min_pct': 0.021551727285537066, 'sideways_atr_max_pct': 0.09643753079306328, 'sideways_tp_mult': 2.092168937113788, 'sideways_tsl_mult': 0.43296702415655874, 'sideways_time_stop': 89, 'sideways_use_sma': False, 'sideways_use_ema': False, 'sideways_use_atr': False, 'sideways_use_adx': False, 'sideways_use_spike': True, 'sideways_rsi_required': False}.
[I 2025-08-31 03:47:08,176] Trial 115 finished with values: [-1000000000.0, 1000000000.0] and parameters: {'p_sma': 55, 'p_std': 17, 'p_atr': 13, 'p_adx': 8, 'rsi_period': 17, 'ema1': 19, 'ema2': 37, 'slip_atr_k': 0.16449560583072467, 'slip_spread_k': 0.31251887123093397, 'spread_hl_frac': 0.013448645949617961, 'bb_std_mult': 0.9189292686166316, 'rsi_os': 8, 'rsi_ob': 83, 'vol_spike': 0.17951875374772877, 'adx_thresh': 5.1880692294554365, 'atr_min_pct': 0.010361095328389516, 'atr_max_pct': 0.09167847005799792, 'tp_mult': 1.3324401799090106, 'tsl_mult': 0.11317088957642125, 'strategy': 'mean_reversion', 'time_stop': 287, 'use_sma': False, 'use_atr': False, 'use_adx': True, 'use_ema': True, 'use_spike': False, 'rsi_required': True, 'edge_k': 1.97605826463478, 'edge_cap': 0.3719644129199619, 'bull_strategy': 'breakout', 'bull_bb_std_mult': 1.7334171268818461, 'bull_rsi_os': 12, 'bull_rsi_ob': 94, 'bull_adx_thresh': 29.977619490210156, 'bull_atr_min_pct': 0.011959249557076492, 'bull_atr_max_pct': 0.14582896361828535, 'bull_tp_mult': 2.875160309464138, 'bull_tsl_mult': 0.7498278562580929, 'bull_time_stop': 142, 'bull_use_sma': True, 'bull_use_ema': True, 'bull_use_atr': True, 'bull_use_adx': False, 'bull_use_spike': True, 'bull_rsi_required': False, 'bear_strategy': 'breakout', 'bear_bb_std_mult': 1.7148543268408998, 'bear_rsi_os': 14, 'bear_rsi_ob': 90, 'bear_adx_thresh': 13.193760036436478, 'bear_atr_min_pct': 0.012091940175220368, 'bear_atr_max_pct': 0.10582495296531172, 'bear_tp_mult': 2.2296947936719227, 'bear_tsl_mult': 0.5758904080941957, 'bear_time_stop': 223, 'bear_use_sma': False, 'bear_use_ema': False, 'bear_use_atr': True, 'bear_use_adx': False, 'bear_use_spike': False, 'bear_rsi_required': False, 'sideways_strategy': 'breakout', 'sideways_bb_std_mult': 2.892101811020849, 'sideways_rsi_os': 49, 'sideways_rsi_ob': 47, 'sideways_adx_thresh': 26.626228509275496, 'sideways_atr_min_pct': 0.029924286887020216, 'sideways_atr_max_pct': 0.08076404725379213, 'sideways_tp_mult': 2.329483652018724, 'sideways_tsl_mult': 0.8679004638794559, 'sideways_time_stop': 78, 'sideways_use_sma': True, 'sideways_use_ema': True, 'sideways_use_atr': True, 'sideways_use_adx': False, 'sideways_use_spike': False, 'sideways_rsi_required': False}.
[I 2025-08-31 03:47:08,557] Trial 114 finished with values: [-1000000000.0, 1000000000.0] and parameters: {'p_sma': 55, 'p_std': 17, 'p_atr': 22, 'p_adx': 8, 'rsi_period': 17, 'ema1': 19, 'ema2': 37, 'slip_atr_k': 0.1667586650010027, 'slip_spread_k': 0.32050910606331384, 'spread_hl_frac': 0.021242232142137402, 'bb_std_mult': 0.9484788112350038, 'rsi_os': 19, 'rsi_ob': 83, 'vol_spike': 0.1711861633254775, 'adx_thresh': 34.433439551508556, 'atr_min_pct': 0.010627282226909146, 'atr_max_pct': 0.06053186512966829, 'tp_mult': 1.4646061937255817, 'tsl_mult': 0.11395883728809839, 'strategy': 'mean_reversion', 'time_stop': 289, 'use_sma': False, 'use_atr': False, 'use_adx': True, 'use_ema': True, 'use_spike': False, 'rsi_required': True, 'edge_k': 1.9396743052438459, 'edge_cap': 0.4884943936297191, 'bull_strategy': 'breakout', 'bull_bb_std_mult': 2.7386527813784265, 'bull_rsi_os': 28, 'bull_rsi_ob': 94, 'bull_adx_thresh': 15.341541804623937, 'bull_atr_min_pct': 0.01738857811467005, 'bull_atr_max_pct': 0.14608004552325152, 'bull_tp_mult': 2.8840709590021936, 'bull_tsl_mult': 0.7494049114905905, 'bull_time_stop': 292, 'bull_use_sma': True, 'bull_use_ema': True, 'bull_use_atr': True, 'bull_use_adx': False, 'bull_use_spike': True, 'bull_rsi_required': False, 'bear_strategy': 'breakout', 'bear_bb_std_mult': 1.6761536543171403, 'bear_rsi_os': 34, 'bear_rsi_ob': 92, 'bear_adx_thresh': 13.166611945229313, 'bear_atr_min_pct': 0.02097063712122725, 'bear_atr_max_pct': 0.11755476512396709, 'bear_tp_mult': 2.222837974949705, 'bear_tsl_mult': 0.5928743180240724, 'bear_time_stop': 33, 'bear_use_sma': False, 'bear_use_ema': False, 'bear_use_atr': True, 'bear_use_adx': False, 'bear_use_spike': False, 'bear_rsi_required': False, 'sideways_strategy': 'breakout', 'sideways_bb_std_mult': 2.9229836170493955, 'sideways_rsi_os': 51, 'sideways_rsi_ob': 81, 'sideways_adx_thresh': 27.01097099755637, 'sideways_atr_min_pct': 0.00688310914088637, 'sideways_atr_max_pct': 0.09663242393247079, 'sideways_tp_mult': 2.3237486672231484, 'sideways_tsl_mult': 0.43495997210368376, 'sideways_time_stop': 85, 'sideways_use_sma': True, 'sideways_use_ema': True, 'sideways_use_atr': True, 'sideways_use_adx': False, 'sideways_use_spike': False, 'sideways_rsi_required': False}.
[I 2025-08-31 03:47:08,767] Trial 113 finished with values: [-1000000000.0, 1000000000.0] and parameters: {'p_sma': 55, 'p_std': 17, 'p_atr': 13, 'p_adx': 8, 'rsi_period': 9, 'ema1': 14, 'ema2': 37, 'slip_atr_k': 0.15431475110515958, 'slip_spread_k': 0.662273284687009, 'spread_hl_frac': 0.048805443669677685, 'bb_std_mult': 2.4753893220397236, 'rsi_os': 8, 'rsi_ob': 78, 'vol_spike': 0.1741222596109587, 'adx_thresh': 34.25948473371267, 'atr_min_pct': 0.010418265983057142, 'atr_max_pct': 0.04359029327191265, 'tp_mult': 1.6662102460629695, 'tsl_mult': 0.6478055714322681, 'strategy': 'mean_reversion', 'time_stop': 237, 'use_sma': False, 'use_atr': False, 'use_adx': False, 'use_ema': True, 'use_spike': False, 'rsi_required': True, 'edge_k': 1.2583961525357414, 'edge_cap': 0.48948723275822115, 'bull_strategy': 'breakout', 'bull_bb_std_mult': 2.827575369402252, 'bull_rsi_os': 47, 'bull_rsi_ob': 92, 'bull_adx_thresh': 9.854471918269978, 'bull_atr_min_pct': 0.014092773483578151, 'bull_atr_max_pct': 0.1463839040349514, 'bull_tp_mult': 2.8825863391061533, 'bull_tsl_mult': 0.16289251954577205, 'bull_time_stop': 223, 'bull_use_sma': False, 'bull_use_ema': True, 'bull_use_atr': True, 'bull_use_adx': False, 'bull_use_spike': True, 'bull_rsi_required': False, 'bear_strategy': 'mean_reversion', 'bear_bb_std_mult': 1.7973903558369073, 'bear_rsi_os': 14, 'bear_rsi_ob': 52, 'bear_adx_thresh': 29.565347029125718, 'bear_atr_min_pct': 0.026382609397475252, 'bear_atr_max_pct': 0.07284350197883364, 'bear_tp_mult': 1.0127568393680315, 'bear_tsl_mult': 0.230426272337369, 'bear_time_stop': 25, 'bear_use_sma': False, 'bear_use_ema': False, 'bear_use_atr': False, 'bear_use_adx': False, 'bear_use_spike': False, 'bear_rsi_required': False, 'sideways_strategy': 'breakout', 'sideways_bb_std_mult': 2.892554299259382, 'sideways_rsi_os': 19, 'sideways_rsi_ob': 46, 'sideways_adx_thresh': 26.637244809419723, 'sideways_atr_min_pct': 0.029597102718527137, 'sideways_atr_max_pct': 0.06555848278324533, 'sideways_tp_mult': 1.9631414075675138, 'sideways_tsl_mult': 0.8745893166515761, 'sideways_time_stop': 78, 'sideways_use_sma': False, 'sideways_use_ema': True, 'sideways_use_atr': True, 'sideways_use_adx': False, 'sideways_use_spike': True, 'sideways_rsi_required': False}.
[I 2025-08-31 03:47:37,952] Trial 116 finished with values: [-1000000000.0, 1000000000.0] and parameters: {'p_sma': 25, 'p_std': 54, 'p_atr': 29, 'p_adx': 8, 'rsi_period': 17, 'ema1': 19, 'ema2': 37, 'slip_atr_k': 0.16537906281873652, 'slip_spread_k': 0.32159117879081145, 'spread_hl_frac': 0.013665002081117206, 'bb_std_mult': 3.3609140907508657, 'rsi_os': 10, 'rsi_ob': 84, 'vol_spike': 0.2904374428382761, 'adx_thresh': 8.782519960018488, 'atr_min_pct': 0.010498290630044968, 'atr_max_pct': 0.058331078787429824, 'tp_mult': 2.936480673877317, 'tsl_mult': 0.6284909662635595, 'strategy': 'mean_reversion', 'time_stop': 154, 'use_sma': False, 'use_atr': False, 'use_adx': True, 'use_ema': True, 'use_spike': False, 'rsi_required': True, 'edge_k': 0.35838404710000304, 'edge_cap': 0.7677052120577721, 'bull_strategy': 'breakout', 'bull_bb_std_mult': 2.750429648309101, 'bull_rsi_os': 28, 'bull_rsi_ob': 94, 'bull_adx_thresh': 32.760659359438414, 'bull_atr_min_pct': 0.002761445057199744, 'bull_atr_max_pct': 0.13447262235361113, 'bull_tp_mult': 2.764103737396791, 'bull_tsl_mult': 0.7434569254872972, 'bull_time_stop': 118, 'bull_use_sma': True, 'bull_use_ema': True, 'bull_use_atr': True, 'bull_use_adx': False, 'bull_use_spike': True, 'bull_rsi_required': False, 'bear_strategy': 'breakout', 'bear_bb_std_mult': 1.7081192871381523, 'bear_rsi_os': 15, 'bear_rsi_ob': 92, 'bear_adx_thresh': 11.974491841717319, 'bear_atr_min_pct': 0.0007683994826086522, 'bear_atr_max_pct': 0.10459870735728788, 'bear_tp_mult': 2.2411699039133968, 'bear_tsl_mult': 0.582595246365872, 'bear_time_stop': 225, 'bear_use_sma': False, 'bear_use_ema': False, 'bear_use_atr': True, 'bear_use_adx': False, 'bear_use_spike': False, 'bear_rsi_required': False, 'sideways_strategy': 'breakout', 'sideways_bb_std_mult': 3.1922241500473607, 'sideways_rsi_os': 55, 'sideways_rsi_ob': 88, 'sideways_adx_thresh': 26.25553232928919, 'sideways_atr_min_pct': 0.029651815492680866, 'sideways_atr_max_pct': 0.08148446843822643, 'sideways_tp_mult': 2.3544098424793964, 'sideways_tsl_mult': 0.8639085877162163, 'sideways_time_stop': 157, 'sideways_use_sma': True, 'sideways_use_ema': True, 'sideways_use_atr': True, 'sideways_use_adx': False, 'sideways_use_spike': False, 'sideways_rsi_required': False}.
