[I 2025-08-31 06:03:33,029] Trial 874 finished with values: [-1000000000.0, 1000000000.0] and parameters: {'p_sma': 27, 'p_std': 45, 'p_atr': 13, 'p_adx': 25, 'rsi_period': 62, 'ema1': 18, 'ema2': 20, 'slip_atr_k': 0.011536144676924261, 'slip_spread_k': 0.8932430937259681, 'spread_hl_frac': 0.0012007139391317118, 'bb_std_mult': 3.5241128299676316, 'rsi_os': 50, 'rsi_ob': 70, 'vol_spike': 0.11079905714433591, 'adx_thresh': 8.52191127811687, 'atr_min_pct': 0.009059926650154782, 'atr_max_pct': 0.11683662498478291, 'tp_mult': 2.026202434856726, 'tsl_mult': 0.4269912752862423, 'strategy': 'mean_reversion', 'time_stop': 16, 'use_sma': True, 'use_atr': True, 'use_adx': False, 'use_ema': False, 'use_spike': False, 'rsi_required': True, 'edge_k': 0.9395883517369746, 'edge_cap': 0.34485303943213275, 'bull_strategy': 'breakout', 'bull_bb_std_mult': 1.8120903534669208, 'bull_rsi_os': 33, 'bull_rsi_ob': 69, 'bull_adx_thresh': 33.69993481224534, 'bull_atr_min_pct': 0.016589600287842208, 'bull_atr_max_pct': 0.08523793020187925, 'bull_tp_mult': 1.2897636130353813, 'bull_tsl_mult': 0.7367250375166313, 'bull_time_stop': 192, 'bull_use_sma': False, 'bull_use_ema': True, 'bull_use_atr': False, 'bull_use_adx': False, 'bull_use_spike': False, 'bull_rsi_required': False, 'bear_strategy': 'breakout', 'bear_bb_std_mult': 2.4463956480844447, 'bear_rsi_os': 5, 'bear_rsi_ob': 61, 'bear_adx_thresh': 13.790942049782194, 'bear_atr_min_pct': 0.001185609128758347, 'bear_atr_max_pct': 0.1291617380972588, 'bear_tp_mult': 1.1735353875078611, 'bear_tsl_mult': 0.051114884590865384, 'bear_time_stop': 256, 'bear_use_sma': True, 'bear_use_ema': False, 'bear_use_atr': True, 'bear_use_adx': False, 'bear_use_spike': False, 'bear_rsi_required': False, 'sideways_strategy': 'breakout', 'sideways_bb_std_mult': 1.6670158796630294, 'sideways_rsi_os': 44, 'sideways_rsi_ob': 47, 'sideways_adx_thresh': 21.317314843153905, 'sideways_atr_min_pct': 0.0017252163917845236, 'sideways_atr_max_pct': 0.04921006439724865, 'sideways_tp_mult': 2.3557998381944114, 'sideways_tsl_mult': 0.2559878927079022, 'sideways_time_stop': 118, 'sideways_use_sma': True, 'sideways_use_ema': True, 'sideways_use_atr': False, 'sideways_use_adx': False, 'sideways_use_spike': True, 'sideways_rsi_required': False}.
[I 2025-08-31 06:03:33,405] Trial 876 finished with values: [-1000000000.0, 1000000000.0] and parameters: {'p_sma': 27, 'p_std': 45, 'p_atr': 13, 'p_adx': 25, 'rsi_period': 68, 'ema1': 18, 'ema2': 19, 'slip_atr_k': 0.16722970203165027, 'slip_spread_k': 0.8684536187113755, 'spread_hl_frac': 3.5743643626716295e-06, 'bb_std_mult': 3.4163592745048987, 'rsi_os': 50, 'rsi_ob': 72, 'vol_spike': 0.10795268933201367, 'adx_thresh': 8.354566329019425, 'atr_min_pct': 0.007230881601639895, 'atr_max_pct': 0.11660442220837111, 'tp_mult': 2.180890787190722, 'tsl_mult': 0.4385239827762009, 'strategy': 'mean_reversion', 'time_stop': 16, 'use_sma': True, 'use_atr': True, 'use_adx': False, 'use_ema': False, 'use_spike': False, 'rsi_required': True, 'edge_k': 0.9340231591034951, 'edge_cap': 0.36737314033554935, 'bull_strategy': 'breakout', 'bull_bb_std_mult': 1.5564327512333693, 'bull_rsi_os': 35, 'bull_rsi_ob': 69, 'bull_adx_thresh': 33.91180422767032, 'bull_atr_min_pct': 0.017195090543726484, 'bull_atr_max_pct': 0.08271230594605675, 'bull_tp_mult': 1.2940421091820244, 'bull_tsl_mult': 0.7339380456404695, 'bull_time_stop': 195, 'bull_use_sma': False, 'bull_use_ema': True, 'bull_use_atr': False, 'bull_use_adx': False, 'bull_use_spike': False, 'bull_rsi_required': False, 'bear_strategy': 'breakout', 'bear_bb_std_mult': 2.258762726481139, 'bear_rsi_os': 6, 'bear_rsi_ob': 58, 'bear_adx_thresh': 13.712321465617642, 'bear_atr_min_pct': 0.0012491537481940864, 'bear_atr_max_pct': 0.12758965892953475, 'bear_tp_mult': 1.163920843968065, 'bear_tsl_mult': 0.04272984534362945, 'bear_time_stop': 252, 'bear_use_sma': True, 'bear_use_ema': False, 'bear_use_atr': True, 'bear_use_adx': False, 'bear_use_spike': False, 'bear_rsi_required': False, 'sideways_strategy': 'breakout', 'sideways_bb_std_mult': 1.6700948107517006, 'sideways_rsi_os': 45, 'sideways_rsi_ob': 47, 'sideways_adx_thresh': 21.162060811012395, 'sideways_atr_min_pct': 0.0017470834858937115, 'sideways_atr_max_pct': 0.048984531949962634, 'sideways_tp_mult': 2.3504564533599415, 'sideways_tsl_mult': 0.2504130675543056, 'sideways_time_stop': 135, 'sideways_use_sma': True, 'sideways_use_ema': True, 'sideways_use_atr': False, 'sideways_use_adx': False, 'sideways_use_spike': True, 'sideways_rsi_required': False}.
[I 2025-08-31 06:04:17,875] Trial 875 finished with values: [-0.016715851571696305, 0.01667100688743201] and parameters: {'p_sma': 28, 'p_std': 45, 'p_atr': 13, 'p_adx': 25, 'rsi_period': 75, 'ema1': 18, 'ema2': 19, 'slip_atr_k': 0.19441373804220502, 'slip_spread_k': 0.8650515043291708, 'spread_hl_frac': 0.0009329190570315201, 'bb_std_mult': 3.4213514286489968, 'rsi_os': 47, 'rsi_ob': 70, 'vol_spike': 0.1054271266071477, 'adx_thresh': 8.297716149741696, 'atr_min_pct': 0.009274149016960625, 'atr_max_pct': 0.11697267281110597, 'tp_mult': 2.1935298574202506, 'tsl_mult': 0.4264602126093145, 'strategy': 'mean_reversion', 'time_stop': 256, 'use_sma': True, 'use_atr': True, 'use_adx': False, 'use_ema': False, 'use_spike': False, 'rsi_required': True, 'edge_k': 0.9723295488341068, 'edge_cap': 0.3456998874128105, 'bull_strategy': 'breakout', 'bull_bb_std_mult': 1.7635352727825837, 'bull_rsi_os': 33, 'bull_rsi_ob': 72, 'bull_adx_thresh': 33.589992177294334, 'bull_atr_min_pct': 0.017142441347909716, 'bull_atr_max_pct': 0.08351166418690686, 'bull_tp_mult': 1.301882655236288, 'bull_tsl_mult': 0.6936305797858613, 'bull_time_stop': 195, 'bull_use_sma': False, 'bull_use_ema': True, 'bull_use_atr': False, 'bull_use_adx': False, 'bull_use_spike': False, 'bull_rsi_required': False, 'bear_strategy': 'breakout', 'bear_bb_std_mult': 2.275982075443501, 'bear_rsi_os': 5, 'bear_rsi_ob': 58, 'bear_adx_thresh': 15.94925839396628, 'bear_atr_min_pct': 0.0010407679032741809, 'bear_atr_max_pct': 0.1269419511886026, 'bear_tp_mult': 1.1517042502187613, 'bear_tsl_mult': 0.0615035488570467, 'bear_time_stop': 253, 'bear_use_sma': True, 'bear_use_ema': False, 'bear_use_atr': True, 'bear_use_adx': False, 'bear_use_spike': False, 'bear_rsi_required': False, 'sideways_strategy': 'breakout', 'sideways_bb_std_mult': 1.6590749226255899, 'sideways_rsi_os': 46, 'sideways_rsi_ob': 47, 'sideways_adx_thresh': 21.131242561441393, 'sideways_atr_min_pct': 0.0017342197919297787, 'sideways_atr_max_pct': 0.04934402711842848, 'sideways_tp_mult': 2.437056775591, 'sideways_tsl_mult': 0.25642332011134633, 'sideways_time_stop': 134, 'sideways_use_sma': True, 'sideways_use_ema': True, 'sideways_use_atr': False, 'sideways_use_adx': False, 'sideways_use_spike': True, 'sideways_rsi_required': False}.
[I 2025-08-31 06:04:17,898] Trial 873 finished with values: [-0.011592463543452114, 0.011551808348964436] and parameters: {'p_sma': 31, 'p_std': 45, 'p_atr': 12, 'p_adx': 25, 'rsi_period': 75, 'ema1': 18, 'ema2': 20, 'slip_atr_k': 0.013419779705172693, 'slip_spread_k': 0.8590999753097055, 'spread_hl_frac': 4.576683960333081e-05, 'bb_std_mult': 3.4927286739969174, 'rsi_os': 45, 'rsi_ob': 71, 'vol_spike': 0.10939862656243018, 'adx_thresh': 8.784429804037222, 'atr_min_pct': 0.009243660031067425, 'atr_max_pct': 0.11706746700800406, 'tp_mult': 2.0436406815386383, 'tsl_mult': 0.4196446794558136, 'strategy': 'mean_reversion', 'time_stop': 212, 'use_sma': True, 'use_atr': True, 'use_adx': False, 'use_ema': False, 'use_spike': False, 'rsi_required': True, 'edge_k': 0.9532630563735823, 'edge_cap': 0.3421008123985116, 'bull_strategy': 'breakout', 'bull_bb_std_mult': 1.7834490653543675, 'bull_rsi_os': 33, 'bull_rsi_ob': 70, 'bull_adx_thresh': 34.963619935884445, 'bull_atr_min_pct': 0.01631873517713698, 'bull_atr_max_pct': 0.08441702681065706, 'bull_tp_mult': 1.3100529038880655, 'bull_tsl_mult': 0.7015543994305999, 'bull_time_stop': 193, 'bull_use_sma': False, 'bull_use_ema': True, 'bull_use_atr': False, 'bull_use_adx': False, 'bull_use_spike': False, 'bull_rsi_required': False, 'bear_strategy': 'breakout', 'bear_bb_std_mult': 2.4330827640250163, 'bear_rsi_os': 5, 'bear_rsi_ob': 61, 'bear_adx_thresh': 13.711501646985068, 'bear_atr_min_pct': 0.0011189575387340988, 'bear_atr_max_pct': 0.12856912064855866, 'bear_tp_mult': 1.1679151458584824, 'bear_tsl_mult': 0.04905231100238102, 'bear_time_stop': 254, 'bear_use_sma': True, 'bear_use_ema': False, 'bear_use_atr': True, 'bear_use_adx': False, 'bear_use_spike': False, 'bear_rsi_required': False, 'sideways_strategy': 'breakout', 'sideways_bb_std_mult': 1.6504043393333105, 'sideways_rsi_os': 44, 'sideways_rsi_ob': 47, 'sideways_adx_thresh': 21.143494523442314, 'sideways_atr_min_pct': 0.0016074116268215116, 'sideways_atr_max_pct': 0.04735912300233048, 'sideways_tp_mult': 2.4300319852370267, 'sideways_tsl_mult': 0.25303771933531916, 'sideways_time_stop': 124, 'sideways_use_sma': True, 'sideways_use_ema': True, 'sideways_use_atr': False, 'sideways_use_adx': False, 'sideways_use_spike': True, 'sideways_rsi_required': False}.
[I 2025-08-31 06:04:20,474] Trial 878 finished with values: [-1000000000.0, 1000000000.0] and parameters: {'p_sma': 30, 'p_std': 45, 'p_atr': 12, 'p_adx': 25, 'rsi_period': 40, 'ema1': 17, 'ema2': 19, 'slip_atr_k': 0.13428679617788775, 'slip_spread_k': 0.8623259760125654, 'spread_hl_frac': 0.0003809149923898463, 'bb_std_mult': 3.415432694620373, 'rsi_os': 47, 'rsi_ob': 70, 'vol_spike': 0.10136293418397536, 'adx_thresh': 8.375661989791299, 'atr_min_pct': 0.008291623399441082, 'atr_max_pct': 0.1210463785979071, 'tp_mult': 2.1189008963309646, 'tsl_mult': 0.41551127744143357, 'strategy': 'mean_reversion', 'time_stop': 132, 'use_sma': True, 'use_atr': True, 'use_adx': False, 'use_ema': False, 'use_spike': False, 'rsi_required': True, 'edge_k': 0.9972423401349716, 'edge_cap': 0.3836333504926095, 'bull_strategy': 'breakout', 'bull_bb_std_mult': 1.750025420264128, 'bull_rsi_os': 35, 'bull_rsi_ob': 72, 'bull_adx_thresh': 34.03191425206108, 'bull_atr_min_pct': 0.01725466246325764, 'bull_atr_max_pct': 0.08856438372980881, 'bull_tp_mult': 1.3438988091840585, 'bull_tsl_mult': 0.6882041460389725, 'bull_time_stop': 196, 'bull_use_sma': False, 'bull_use_ema': True, 'bull_use_atr': False, 'bull_use_adx': False, 'bull_use_spike': False, 'bull_rsi_required': False, 'bear_strategy': 'breakout', 'bear_bb_std_mult': 2.2508459853917477, 'bear_rsi_os': 5, 'bear_rsi_ob': 58, 'bear_adx_thresh': 15.795792038442523, 'bear_atr_min_pct': 0.0019381732548575128, 'bear_atr_max_pct': 0.11751153102175459, 'bear_tp_mult': 1.128187251312316, 'bear_tsl_mult': 0.08150130447883835, 'bear_time_stop': 247, 'bear_use_sma': True, 'bear_use_ema': False, 'bear_use_atr': False, 'bear_use_adx': False, 'bear_use_spike': False, 'bear_rsi_required': False, 'sideways_strategy': 'breakout', 'sideways_bb_std_mult': 1.5700926282428846, 'sideways_rsi_os': 46, 'sideways_rsi_ob': 45, 'sideways_adx_thresh': 21.898712298936196, 'sideways_atr_min_pct': 0.003725721929497475, 'sideways_atr_max_pct': 0.0462853392205374, 'sideways_tp_mult': 2.4284766245048095, 'sideways_tsl_mult': 0.3093385933757833, 'sideways_time_stop': 129, 'sideways_use_sma': True, 'sideways_use_ema': True, 'sideways_use_atr': False, 'sideways_use_adx': False, 'sideways_use_spike': True, 'sideways_rsi_required': False}.
[I 2025-08-31 06:04:20,567] Trial 877 finished with values: [-1000000000.0, 1000000000.0] and parameters: {'p_sma': 30, 'p_std': 45, 'p_atr': 12, 'p_adx': 25, 'rsi_period': 38, 'ema1': 17, 'ema2': 19, 'slip_atr_k': 0.012592853374504758, 'slip_spread_k': 0.8574327383861677, 'spread_hl_frac': 0.0003660647142941972, 'bb_std_mult': 3.421738574656103, 'rsi_os': 47, 'rsi_ob': 70, 'vol_spike': 0.10367488186943004, 'adx_thresh': 8.146849690633891, 'atr_min_pct': 0.007339482128124043, 'atr_max_pct': 0.11654689484123135, 'tp_mult': 2.191938044050114, 'tsl_mult': 0.42568220747571445, 'strategy': 'mean_reversion', 'time_stop': 132, 'use_sma': True, 'use_atr': True, 'use_adx': False, 'use_ema': False, 'use_spike': False, 'rsi_required': True, 'edge_k': 0.9868241321424213, 'edge_cap': 0.3974624263400993, 'bull_strategy': 'breakout', 'bull_bb_std_mult': 1.7560244126552567, 'bull_rsi_os': 35, 'bull_rsi_ob': 71, 'bull_adx_thresh': 33.9524493609284, 'bull_atr_min_pct': 0.017434114995021142, 'bull_atr_max_pct': 0.0817426657607313, 'bull_tp_mult': 1.3433337786262338, 'bull_tsl_mult': 0.7317122254873865, 'bull_time_stop': 195, 'bull_use_sma': False, 'bull_use_ema': True, 'bull_use_atr': False, 'bull_use_adx': False, 'bull_use_spike': False, 'bull_rsi_required': False, 'bear_strategy': 'breakout', 'bear_bb_std_mult': 2.26707416039456, 'bear_rsi_os': 6, 'bear_rsi_ob': 58, 'bear_adx_thresh': 16.05462588367129, 'bear_atr_min_pct': 0.0017922565792743584, 'bear_atr_max_pct': 0.12492260336394605, 'bear_tp_mult': 1.1386438566007957, 'bear_tsl_mult': 0.052352443742922694, 'bear_time_stop': 245, 'bear_use_sma': True, 'bear_use_ema': False, 'bear_use_atr': False, 'bear_use_adx': False, 'bear_use_spike': False, 'bear_rsi_required': False, 'sideways_strategy': 'breakout', 'sideways_bb_std_mult': 1.7246687543625603, 'sideways_rsi_os': 45, 'sideways_rsi_ob': 45, 'sideways_adx_thresh': 21.851732114098727, 'sideways_atr_min_pct': 0.003610754292614867, 'sideways_atr_max_pct': 0.04598292879780689, 'sideways_tp_mult': 2.4202979384765664, 'sideways_tsl_mult': 0.2539882145037383, 'sideways_time_stop': 136, 'sideways_use_sma': True, 'sideways_use_ema': True, 'sideways_use_atr': False, 'sideways_use_adx': False, 'sideways_use_spike': True, 'sideways_rsi_required': False}.
[I 2025-08-31 06:05:08,406] Trial 880 finished with values: [-1000000000.0, 1000000000.0] and parameters: {'p_sma': 30, 'p_std': 44, 'p_atr': 12, 'p_adx': 25, 'rsi_period': 18, 'ema1': 17, 'ema2': 19, 'slip_atr_k': 0.21932194595541255, 'slip_spread_k': 0.9024654885530101, 'spread_hl_frac': 0.00010157695968649777, 'bb_std_mult': 3.4452463878080275, 'rsi_os': 47, 'rsi_ob': 73, 'vol_spike': 0.09999031691817221, 'adx_thresh': 7.596258915724744, 'atr_min_pct': 0.007997551528119052, 'atr_max_pct': 0.12043427271440584, 'tp_mult': 2.092616668776149, 'tsl_mult': 0.38563792284973564, 'strategy': 'mean_reversion', 'time_stop': 155, 'use_sma': True, 'use_atr': True, 'use_adx': True, 'use_ema': False, 'use_spike': False, 'rsi_required': True, 'edge_k': 0.8629934775395276, 'edge_cap': 0.39881433640552527, 'bull_strategy': 'breakout', 'bull_bb_std_mult': 1.5936938815703463, 'bull_rsi_os': 35, 'bull_rsi_ob': 71, 'bull_adx_thresh': 34.134951094340586, 'bull_atr_min_pct': 0.017467900381377334, 'bull_atr_max_pct': 0.08772673759991587, 'bull_tp_mult': 1.3819170028300691, 'bull_tsl_mult': 0.731864313304845, 'bull_time_stop': 200, 'bull_use_sma': True, 'bull_use_ema': True, 'bull_use_atr': False, 'bull_use_adx': False, 'bull_use_spike': False, 'bull_rsi_required': False, 'bear_strategy': 'breakout', 'bear_bb_std_mult': 2.3102305734715958, 'bear_rsi_os': 6, 'bear_rsi_ob': 58, 'bear_adx_thresh': 15.891872339215995, 'bear_atr_min_pct': 0.001966004565213629, 'bear_atr_max_pct': 0.11792980765499363, 'bear_tp_mult': 1.0729548841095518, 'bear_tsl_mult': 0.07590475934149266, 'bear_time_stop': 247, 'bear_use_sma': True, 'bear_use_ema': False, 'bear_use_atr': False, 'bear_use_adx': False, 'bear_use_spike': False, 'bear_rsi_required': False, 'sideways_strategy': 'breakout', 'sideways_bb_std_mult': 1.5583356405901503, 'sideways_rsi_os': 45, 'sideways_rsi_ob': 45, 'sideways_adx_thresh': 22.86114220635263, 'sideways_atr_min_pct': 0.0036520170690384044, 'sideways_atr_max_pct': 0.046451901620429954, 'sideways_tp_mult': 2.379628130258717, 'sideways_tsl_mult': 0.29773714266421825, 'sideways_time_stop': 128, 'sideways_use_sma': True, 'sideways_use_ema': True, 'sideways_use_atr': True, 'sideways_use_adx': False, 'sideways_use_spike': False, 'sideways_rsi_required': False}.
