[I 2025-08-31 03:37:41,758] Trial 38 finished with values: [-1000000000.0, 1000000000.0] and parameters: {'p_sma': 27, 'p_std': 10, 'p_atr': 24, 'p_adx': 15, 'rsi_period': 34, 'ema1': 20, 'ema2': 14, 'slip_atr_k': 0.22553538035013282, 'slip_spread_k': 0.8753448317676376, 'spread_hl_frac': 0.018112613351064052, 'bb_std_mult': 2.2138242746713064, 'rsi_os': 54, 'rsi_ob': 79, 'vol_spike': 0.06107545144753189, 'adx_thresh': 5.667278631059178, 'atr_min_pct': 0.019307315770243427, 'atr_max_pct': 0.14182779942847507, 'tp_mult': 1.6827812929131176, 'tsl_mult': 0.4453032904794891, 'strategy': 'mean_reversion', 'time_stop': 159, 'use_sma': False, 'use_atr': False, 'use_adx': True, 'use_ema': True, 'use_spike': False, 'rsi_required': False, 'edge_k': 0.1662850419472507, 'edge_cap': 0.2088253917784635, 'bull_strategy': 'breakout', 'bull_bb_std_mult': 1.858505252404249, 'bull_rsi_os': 23, 'bull_rsi_ob': 60, 'bull_adx_thresh': 14.64201302104917, 'bull_atr_min_pct': 0.0190418704549323, 'bull_atr_max_pct': 0.12407625301055311, 'bull_tp_mult': 2.417712616495649, 'bull_tsl_mult': 0.315540281939765, 'bull_time_stop': 280, 'bull_use_sma': True, 'bull_use_ema': True, 'bull_use_atr': False, 'bull_use_adx': False, 'bull_use_spike': True, 'bull_rsi_required': False, 'bear_strategy': 'breakout', 'bear_bb_std_mult': 0.8040887621917117, 'bear_rsi_os': 11, 'bear_rsi_ob': 94, 'bear_adx_thresh': 10.767274388296757, 'bear_atr_min_pct': 0.013272437406840719, 'bear_atr_max_pct': 0.09233089929277047, 'bear_tp_mult': 1.4561592210395524, 'bear_tsl_mult': 0.5584504557841083, 'bear_time_stop': 65, 'bear_use_sma': False, 'bear_use_ema': False, 'bear_use_atr': False, 'bear_use_adx': False, 'bear_use_spike': False, 'bear_rsi_required': True, 'sideways_strategy': 'mean_reversion', 'sideways_bb_std_mult': 2.4594831987549086, 'sideways_rsi_os': 27, 'sideways_rsi_ob': 73, 'sideways_adx_thresh': 30.244781541648273, 'sideways_atr_min_pct': 0.004618507645632739, 'sideways_atr_max_pct': 0.04999643049567953, 'sideways_tp_mult': 1.5509772025105537, 'sideways_tsl_mult': 0.026703497242981766, 'sideways_time_stop': 49, 'sideways_use_sma': True, 'sideways_use_ema': False, 'sideways_use_atr': False, 'sideways_use_adx': False, 'sideways_use_spike': True, 'sideways_rsi_required': True}.
[I 2025-08-31 03:37:41,769] Trial 36 finished with values: [-1000000000.0, 1000000000.0] and parameters: {'p_sma': 42, 'p_std': 52, 'p_atr': 24, 'p_adx': 16, 'rsi_period': 64, 'ema1': 10, 'ema2': 37, 'slip_atr_k': 0.014995495712747775, 'slip_spread_k': 0.8856443811562177, 'spread_hl_frac': 0.018808886254415128, 'bb_std_mult': 0.8199811601750193, 'rsi_os': 55, 'rsi_ob': 79, 'vol_spike': 0.04576156648910998, 'adx_thresh': 31.437282122421543, 'atr_min_pct': 0.01761116241993905, 'atr_max_pct': 0.14611294177234535, 'tp_mult': 2.1073576807663454, 'tsl_mult': 0.5307015361408938, 'strategy': 'mean_reversion', 'time_stop': 90, 'use_sma': False, 'use_atr': False, 'use_adx': True, 'use_ema': True, 'use_spike': False, 'rsi_required': False, 'edge_k': 0.21625503389072853, 'edge_cap': 0.417795589047568, 'bull_strategy': 'breakout', 'bull_bb_std_mult': 1.6466252387039504, 'bull_rsi_os': 23, 'bull_rsi_ob': 59, 'bull_adx_thresh': 14.814105246102773, 'bull_atr_min_pct': 0.026682561946466975, 'bull_atr_max_pct': 0.1104470129166092, 'bull_tp_mult': 1.5033496302563636, 'bull_tsl_mult': 0.3147418947379341, 'bull_time_stop': 52, 'bull_use_sma': True, 'bull_use_ema': True, 'bull_use_atr': False, 'bull_use_adx': False, 'bull_use_spike': True, 'bull_rsi_required': False, 'bear_strategy': 'breakout', 'bear_bb_std_mult': 2.706570215993881, 'bear_rsi_os': 20, 'bear_rsi_ob': 93, 'bear_adx_thresh': 11.947589368541179, 'bear_atr_min_pct': 0.012666804583316729, 'bear_atr_max_pct': 0.14381490880178327, 'bear_tp_mult': 1.4421682522945525, 'bear_tsl_mult': 0.901220596631199, 'bear_time_stop': 266, 'bear_use_sma': False, 'bear_use_ema': False, 'bear_use_atr': False, 'bear_use_adx': False, 'bear_use_spike': False, 'bear_rsi_required': True, 'sideways_strategy': 'breakout', 'sideways_bb_std_mult': 2.0508040163153174, 'sideways_rsi_os': 26, 'sideways_rsi_ob': 73, 'sideways_adx_thresh': 31.234808771779726, 'sideways_atr_min_pct': 0.02091517230757719, 'sideways_atr_max_pct': 0.1330141991436627, 'sideways_tp_mult': 1.4726937661306447, 'sideways_tsl_mult': 0.03377242658951124, 'sideways_time_stop': 239, 'sideways_use_sma': True, 'sideways_use_ema': False, 'sideways_use_atr': False, 'sideways_use_adx': False, 'sideways_use_spike': False, 'sideways_rsi_required': True}.
[I 2025-08-31 03:38:08,761] Trial 35 finished with values: [-1000000000.0, 1000000000.0] and parameters: {'p_sma': 23, 'p_std': 55, 'p_atr': 23, 'p_adx': 24, 'rsi_period': 34, 'ema1': 16, 'ema2': 37, 'slip_atr_k': 0.22930808285821547, 'slip_spread_k': 0.8298905830362036, 'spread_hl_frac': 0.018302889524297906, 'bb_std_mult': 0.8470604982647127, 'rsi_os': 32, 'rsi_ob': 91, 'vol_spike': 0.07771514658386662, 'adx_thresh': 6.034941576431665, 'atr_min_pct': 0.01856139161847557, 'atr_max_pct': 0.04620731705724434, 'tp_mult': 1.2042584783040327, 'tsl_mult': 0.506648332636986, 'strategy': 'mean_reversion', 'time_stop': 92, 'use_sma': False, 'use_atr': False, 'use_adx': True, 'use_ema': True, 'use_spike': False, 'rsi_required': False, 'edge_k': 1.18011890334972, 'edge_cap': 0.21694618976792884, 'bull_strategy': 'breakout', 'bull_bb_std_mult': 1.5218877340824375, 'bull_rsi_os': 50, 'bull_rsi_ob': 60, 'bull_adx_thresh': 14.563598505935316, 'bull_atr_min_pct': 0.026944905424106554, 'bull_atr_max_pct': 0.10617465971156763, 'bull_tp_mult': 1.4789420324015095, 'bull_tsl_mult': 0.5609196245214902, 'bull_time_stop': 146, 'bull_use_sma': True, 'bull_use_ema': False, 'bull_use_atr': True, 'bull_use_adx': False, 'bull_use_spike': False, 'bull_rsi_required': False, 'bear_strategy': 'breakout', 'bear_bb_std_mult': 0.8531413859000185, 'bear_rsi_os': 19, 'bear_rsi_ob': 94, 'bear_adx_thresh': 11.173418887026273, 'bear_atr_min_pct': 0.00859557008878081, 'bear_atr_max_pct': 0.09095367998479209, 'bear_tp_mult': 1.4041024899630772, 'bear_tsl_mult': 0.10098055182406956, 'bear_time_stop': 175, 'bear_use_sma': True, 'bear_use_ema': False, 'bear_use_atr': True, 'bear_use_adx': False, 'bear_use_spike': False, 'bear_rsi_required': True, 'sideways_strategy': 'breakout', 'sideways_bb_std_mult': 2.4746563855791353, 'sideways_rsi_os': 26, 'sideways_rsi_ob': 86, 'sideways_adx_thresh': 30.104249991524288, 'sideways_atr_min_pct': 0.02254750499208329, 'sideways_atr_max_pct': 0.08464447677513182, 'sideways_tp_mult': 1.5704599676023738, 'sideways_tsl_mult': 0.028510991242061023, 'sideways_time_stop': 51, 'sideways_use_sma': True, 'sideways_use_ema': True, 'sideways_use_atr': True, 'sideways_use_adx': False, 'sideways_use_spike': False, 'sideways_rsi_required': True}.
[I 2025-08-31 03:38:10,600] Trial 39 finished with values: [-1000000000.0, 1000000000.0] and parameters: {'p_sma': 52, 'p_std': 13, 'p_atr': 25, 'p_adx': 16, 'rsi_period': 69, 'ema1': 21, 'ema2': 12, 'slip_atr_k': 0.24611736786565908, 'slip_spread_k': 0.8883640892629502, 'spread_hl_frac': 0.027392294751887005, 'bb_std_mult': 1.1559576966100402, 'rsi_os': 22, 'rsi_ob': 67, 'vol_spike': 0.03238626879203191, 'adx_thresh': 31.42601887275479, 'atr_min_pct': 0.0072994528302135035, 'atr_max_pct': 0.01256687492834306, 'tp_mult': 1.7075904728773765, 'tsl_mult': 0.9580237998272578, 'strategy': 'mean_reversion', 'time_stop': 39, 'use_sma': True, 'use_atr': False, 'use_adx': True, 'use_ema': True, 'use_spike': True, 'rsi_required': False, 'edge_k': 1.0204594383665102, 'edge_cap': 0.23963403051602533, 'bull_strategy': 'mean_reversion', 'bull_bb_std_mult': 1.8466773998530859, 'bull_rsi_os': 23, 'bull_rsi_ob': 58, 'bull_adx_thresh': 25.82349864124228, 'bull_atr_min_pct': 0.018062955409146736, 'bull_atr_max_pct': 0.016649911933780626, 'bull_tp_mult': 1.0262041528593546, 'bull_tsl_mult': 0.33483210073721775, 'bull_time_stop': 49, 'bull_use_sma': False, 'bull_use_ema': True, 'bull_use_atr': True, 'bull_use_adx': False, 'bull_use_spike': False, 'bull_rsi_required': True, 'bear_strategy': 'breakout', 'bear_bb_std_mult': 0.8770634569759921, 'bear_rsi_os': 10, 'bear_rsi_ob': 95, 'bear_adx_thresh': 27.38389534542536, 'bear_atr_min_pct': 0.009096036308060912, 'bear_atr_max_pct': 0.09348009243891058, 'bear_tp_mult': 1.970433240378678, 'bear_tsl_mult': 0.5888928026618087, 'bear_time_stop': 126, 'bear_use_sma': False, 'bear_use_ema': True, 'bear_use_atr': False, 'bear_use_adx': True, 'bear_use_spike': True, 'bear_rsi_required': True, 'sideways_strategy': 'mean_reversion', 'sideways_bb_std_mult': 1.1138416122973611, 'sideways_rsi_os': 8, 'sideways_rsi_ob': 71, 'sideways_adx_thresh': 8.706926491900905, 'sideways_atr_min_pct': 0.0033809858127731, 'sideways_atr_max_pct': 0.12955845459005652, 'sideways_tp_mult': 1.4357923321991954, 'sideways_tsl_mult': 0.008674596049354055, 'sideways_time_stop': 145, 'sideways_use_sma': True, 'sideways_use_ema': False, 'sideways_use_atr': False, 'sideways_use_adx': False, 'sideways_use_spike': True, 'sideways_rsi_required': True}.
[I 2025-08-31 03:38:11,324] Trial 41 finished with values: [-1000000000.0, 1000000000.0] and parameters: {'p_sma': 57, 'p_std': 25, 'p_atr': 8, 'p_adx': 12, 'rsi_period': 47, 'ema1': 22, 'ema2': 10, 'slip_atr_k': 0.110797934283227, 'slip_spread_k': 0.29394243148139954, 'spread_hl_frac': 0.028068308305009223, 'bb_std_mult': 1.1134228570893274, 'rsi_os': 11, 'rsi_ob': 75, 'vol_spike': 0.23752051457429543, 'adx_thresh': 13.976321002090426, 'atr_min_pct': 0.0064486920702796924, 'atr_max_pct': 0.012549944498015081, 'tp_mult': 1.4698224908331805, 'tsl_mult': 0.983410128137749, 'strategy': 'breakout', 'time_stop': 95, 'use_sma': True, 'use_atr': True, 'use_adx': False, 'use_ema': False, 'use_spike': True, 'rsi_required': False, 'edge_k': 1.8468265624044815, 'edge_cap': 0.2359894826135665, 'bull_strategy': 'mean_reversion', 'bull_bb_std_mult': 0.8152466753437382, 'bull_rsi_os': 45, 'bull_rsi_ob': 74, 'bull_adx_thresh': 32.487702012874806, 'bull_atr_min_pct': 0.00675077402497414, 'bull_atr_max_pct': 0.015621815871988881, 'bull_tp_mult': 1.0300561039953113, 'bull_tsl_mult': 0.7650397686647545, 'bull_time_stop': 192, 'bull_use_sma': False, 'bull_use_ema': False, 'bull_use_atr': True, 'bull_use_adx': True, 'bull_use_spike': False, 'bull_rsi_required': True, 'bear_strategy': 'breakout', 'bear_bb_std_mult': 2.068660286626506, 'bear_rsi_os': 39, 'bear_rsi_ob': 87, 'bear_adx_thresh': 27.399032752292822, 'bear_atr_min_pct': 0.008901488681357586, 'bear_atr_max_pct': 0.04616544429923647, 'bear_tp_mult': 1.0163759261214182, 'bear_tsl_mult': 0.5832502077568158, 'bear_time_stop': 126, 'bear_use_sma': True, 'bear_use_ema': True, 'bear_use_atr': False, 'bear_use_adx': True, 'bear_use_spike': True, 'bear_rsi_required': True, 'sideways_strategy': 'mean_reversion', 'sideways_bb_std_mult': 1.1690226993562807, 'sideways_rsi_os': 7, 'sideways_rsi_ob': 49, 'sideways_adx_thresh': 26.283381206662728, 'sideways_atr_min_pct': 0.005178292920458244, 'sideways_atr_max_pct': 0.03653979280185493, 'sideways_tp_mult': 1.894391801626334, 'sideways_tsl_mult': 0.9244455703304539, 'sideways_time_stop': 151, 'sideways_use_sma': False, 'sideways_use_ema': False, 'sideways_use_atr': False, 'sideways_use_adx': True, 'sideways_use_spike': True, 'sideways_rsi_required': False}.
[I 2025-08-31 03:38:11,441] Trial 40 finished with values: [-1000000000.0, 1000000000.0] and parameters: {'p_sma': 42, 'p_std': 25, 'p_atr': 25, 'p_adx': 11, 'rsi_period': 69, 'ema1': 22, 'ema2': 10, 'slip_atr_k': 0.2444193682402548, 'slip_spread_k': 0.7942000379805434, 'spread_hl_frac': 0.028122776299315526, 'bb_std_mult': 0.8725012682112607, 'rsi_os': 13, 'rsi_ob': 48, 'vol_spike': 0.028303542304402046, 'adx_thresh': 13.49344869769046, 'atr_min_pct': 0.0062193690819028966, 'atr_max_pct': 0.012075400795303476, 'tp_mult': 1.4393622160720354, 'tsl_mult': 0.9817648110071933, 'strategy': 'breakout', 'time_stop': 40, 'use_sma': True, 'use_atr': True, 'use_adx': False, 'use_ema': True, 'use_spike': True, 'rsi_required': False, 'edge_k': 0.6635293134497326, 'edge_cap': 0.2525513117519197, 'bull_strategy': 'mean_reversion', 'bull_bb_std_mult': 2.1477530788661925, 'bull_rsi_os': 43, 'bull_rsi_ob': 76, 'bull_adx_thresh': 25.858101427175498, 'bull_atr_min_pct': 0.006902882017297629, 'bull_atr_max_pct': 0.0182036831450699, 'bull_tp_mult': 2.782450365176065, 'bull_tsl_mult': 0.7960839247468516, 'bull_time_stop': 53, 'bull_use_sma': False, 'bull_use_ema': True, 'bull_use_atr': True, 'bull_use_adx': True, 'bull_use_spike': False, 'bull_rsi_required': True, 'bear_strategy': 'breakout', 'bear_bb_std_mult': 2.78100452024497, 'bear_rsi_os': 39, 'bear_rsi_ob': 70, 'bear_adx_thresh': 17.94639418885609, 'bear_atr_min_pct': 0.02354921729534943, 'bear_atr_max_pct': 0.11663981368085959, 'bear_tp_mult': 2.841345404860907, 'bear_tsl_mult': 0.2797302558285419, 'bear_time_stop': 119, 'bear_use_sma': False, 'bear_use_ema': True, 'bear_use_atr': False, 'bear_use_adx': True, 'bear_use_spike': True, 'bear_rsi_required': True, 'sideways_strategy': 'breakout', 'sideways_bb_std_mult': 1.1269196683435436, 'sideways_rsi_os': 8, 'sideways_rsi_ob': 60, 'sideways_adx_thresh': 8.931254983865218, 'sideways_atr_min_pct': 0.01957922633485877, 'sideways_atr_max_pct': 0.03772735427142649, 'sideways_tp_mult': 1.3953314431315682, 'sideways_tsl_mult': 0.9322477309968098, 'sideways_time_stop': 142, 'sideways_use_sma': False, 'sideways_use_ema': False, 'sideways_use_atr': False, 'sideways_use_adx': True, 'sideways_use_spike': True, 'sideways_rsi_required': False}.
[I 2025-08-31 03:38:39,176] Trial 42 finished with values: [-1000000000.0, 1000000000.0] and parameters: {'p_sma': 51, 'p_std': 26, 'p_atr': 21, 'p_adx': 12, 'rsi_period': 68, 'ema1': 23, 'ema2': 14, 'slip_atr_k': 0.1177052711111079, 'slip_spread_k': 0.4696411797734926, 'spread_hl_frac': 0.029131883914875825, 'bb_std_mult': 1.2674512712612789, 'rsi_os': 12, 'rsi_ob': 74, 'vol_spike': 0.22781534274115528, 'adx_thresh': 14.097938254782772, 'atr_min_pct': 0.007118231232342301, 'atr_max_pct': 0.1104561151994803, 'tp_mult': 1.4072541497025406, 'tsl_mult': 0.9958380948437715, 'strategy': 'breakout', 'time_stop': 37, 'use_sma': True, 'use_atr': True, 'use_adx': False, 'use_ema': False, 'use_spike': True, 'rsi_required': True, 'edge_k': 1.0248283252591195, 'edge_cap': 0.2574082385843516, 'bull_strategy': 'mean_reversion', 'bull_bb_std_mult': 2.0535994509546205, 'bull_rsi_os': 45, 'bull_rsi_ob': 74, 'bull_adx_thresh': 26.58304831040961, 'bull_atr_min_pct': 0.016784924191024477, 'bull_atr_max_pct': 0.010300227564149972, 'bull_tp_mult': 1.162953204346219, 'bull_tsl_mult': 0.3816606125259093, 'bull_time_stop': 231, 'bull_use_sma': False, 'bull_use_ema': True, 'bull_use_atr': True, 'bull_use_adx': True, 'bull_use_spike': False, 'bull_rsi_required': True, 'bear_strategy': 'mean_reversion', 'bear_bb_std_mult': 1.4260051772245022, 'bear_rsi_os': 31, 'bear_rsi_ob': 88, 'bear_adx_thresh': 27.887822691072778, 'bear_atr_min_pct': 0.008679448092946504, 'bear_atr_max_pct': 0.050913095145194, 'bear_tp_mult': 2.4770754903894097, 'bear_tsl_mult': 0.26631403996975483, 'bear_time_stop': 128, 'bear_use_sma': False, 'bear_use_ema': True, 'bear_use_atr': False, 'bear_use_adx': True, 'bear_use_spike': True, 'bear_rsi_required': True, 'sideways_strategy': 'mean_reversion', 'sideways_bb_std_mult': 1.2395284800918056, 'sideways_rsi_os': 9, 'sideways_rsi_ob': 60, 'sideways_adx_thresh': 8.08025817606071, 'sideways_atr_min_pct': 0.019322505375805113, 'sideways_atr_max_pct': 0.05066703094402134, 'sideways_tp_mult': 1.8948879738759612, 'sideways_tsl_mult': 0.26817410704122313, 'sideways_time_stop': 135, 'sideways_use_sma': False, 'sideways_use_ema': False, 'sideways_use_atr': False, 'sideways_use_adx': True, 'sideways_use_spike': True, 'sideways_rsi_required': False}.
[I 2025-08-31 03:38:40,324] Trial 43 finished with values: [-1000000000.0, 1000000000.0] and parameters: {'p_sma': 52, 'p_std': 25, 'p_atr': 9, 'p_adx': 12, 'rsi_period': 68, 'ema1': 23, 'ema2': 56, 'slip_atr_k': 0.11405072893018596, 'slip_spread_k': 0.7594100906871623, 'spread_hl_frac': 0.028955021032463373, 'bb_std_mult': 3.336433913641508, 'rsi_os': 14, 'rsi_ob': 75, 'vol_spike': 0.23211020720445324, 'adx_thresh': 20.542064941370366, 'atr_min_pct': 0.025967835262273354, 'atr_max_pct': 0.11148539923208309, 'tp_mult': 1.4465950676860548, 'tsl_mult': 0.9894847764317121, 'strategy': 'breakout', 'time_stop': 172, 'use_sma': True, 'use_atr': True, 'use_adx': False, 'use_ema': False, 'use_spike': True, 'rsi_required': True, 'edge_k': 1.5552951340625603, 'edge_cap': 0.12290856311891324, 'bull_strategy': 'mean_reversion', 'bull_bb_std_mult': 2.044627405906223, 'bull_rsi_os': 44, 'bull_rsi_ob': 75, 'bull_adx_thresh': 32.90796419502337, 'bull_atr_min_pct': 0.016054310101186204, 'bull_atr_max_pct': 0.053645857880175486, 'bull_tp_mult': 2.7963599417620433, 'bull_tsl_mult': 0.765003919371444, 'bull_time_stop': 189, 'bull_use_sma': False, 'bull_use_ema': False, 'bull_use_atr': True, 'bull_use_adx': True, 'bull_use_spike': False, 'bull_rsi_required': True, 'bear_strategy': 'mean_reversion', 'bear_bb_std_mult': 2.9875661710194445, 'bear_rsi_os': 39, 'bear_rsi_ob': 70, 'bear_adx_thresh': 24.513540127564962, 'bear_atr_min_pct': 0.003579820907018848, 'bear_atr_max_pct': 0.02167280812811214, 'bear_tp_mult': 2.8546252632544284, 'bear_tsl_mult': 0.3068523290975136, 'bear_time_stop': 216, 'bear_use_sma': True, 'bear_use_ema': True, 'bear_use_atr': False, 'bear_use_adx': True, 'bear_use_spike': True, 'bear_rsi_required': False, 'sideways_strategy': 'mean_reversion', 'sideways_bb_std_mult': 2.8632894511155715, 'sideways_rsi_os': 21, 'sideways_rsi_ob': 60, 'sideways_adx_thresh': 26.721203658613355, 'sideways_atr_min_pct': 0.005194491340467202, 'sideways_atr_max_pct': 0.039306572764752586, 'sideways_tp_mult': 1.9447712616142916, 'sideways_tsl_mult': 0.9245179858434027, 'sideways_time_stop': 126, 'sideways_use_sma': False, 'sideways_use_ema': False, 'sideways_use_atr': False, 'sideways_use_adx': True, 'sideways_use_spike': True, 'sideways_rsi_required': False}.
[I 2025-08-31 03:38:40,691] Trial 44 finished with values: [-1000000000.0, 1000000000.0] and parameters: {'p_sma': 35, 'p_std': 18, 'p_atr': 21, 'p_adx': 20, 'rsi_period': 69, 'ema1': 23, 'ema2': 50, 'slip_atr_k': 0.19014287038618544, 'slip_spread_k': 0.4705805739262152, 'spread_hl_frac': 0.01451496624282024, 'bb_std_mult': 2.7620310222112607, 'rsi_os': 41, 'rsi_ob': 57, 'vol_spike': 0.17450017991952138, 'adx_thresh': 27.63209014826193, 'atr_min_pct': 0.0027594545871911964, 'atr_max_pct': 0.11138226923566846, 'tp_mult': 2.7654316744432705, 'tsl_mult': 0.8780608230761285, 'strategy': 'breakout', 'time_stop': 212, 'use_sma': True, 'use_atr': True, 'use_adx': False, 'use_ema': False, 'use_spike': True, 'rsi_required': True, 'edge_k': 0.6286835026926243, 'edge_cap': 0.9914471889007778, 'bull_strategy': 'mean_reversion', 'bull_bb_std_mult': 2.0125881031099873, 'bull_rsi_os': 16, 'bull_rsi_ob': 86, 'bull_adx_thresh': 5.0138948206828235, 'bull_atr_min_pct': 0.011000567235539556, 'bull_atr_max_pct': 0.039104914843953884, 'bull_tp_mult': 2.757813292640221, 'bull_tsl_mult': 0.3932254045134433, 'bull_time_stop': 231, 'bull_use_sma': False, 'bull_use_ema': False, 'bull_use_atr': True, 'bull_use_adx': True, 'bull_use_spike': False, 'bull_rsi_required': True, 'bear_strategy': 'mean_reversion', 'bear_bb_std_mult': 2.9734332262416525, 'bear_rsi_os': 16, 'bear_rsi_ob': 70, 'bear_adx_thresh': 24.358677487206222, 'bear_atr_min_pct': 0.023106209292207216, 'bear_atr_max_pct': 0.021543842223950276, 'bear_tp_mult': 1.13393607457283, 'bear_tsl_mult': 0.2709445894090322, 'bear_time_stop': 214, 'bear_use_sma': False, 'bear_use_ema': True, 'bear_use_atr': False, 'bear_use_adx': True, 'bear_use_spike': True, 'bear_rsi_required': False, 'sideways_strategy': 'mean_reversion', 'sideways_bb_std_mult': 2.8560923249299606, 'sideways_rsi_os': 30, 'sideways_rsi_ob': 60, 'sideways_adx_thresh': 14.446105109840369, 'sideways_atr_min_pct': 0.01872929100098979, 'sideways_atr_max_pct': 0.05425252524374309, 'sideways_tp_mult': 2.2546978554085695, 'sideways_tsl_mult': 0.8188317746669294, 'sideways_time_stop': 127, 'sideways_use_sma': False, 'sideways_use_ema': False, 'sideways_use_atr': True, 'sideways_use_adx': True, 'sideways_use_spike': True, 'sideways_rsi_required': False}.
