[I 2025-08-31 04:59:30,916] Trial 521 finished with values: [-1000000000.0, 1000000000.0] and parameters: {'p_sma': 31, 'p_std': 8, 'p_atr': 23, 'p_adx': 8, 'rsi_period': 54, 'ema1': 15, 'ema2': 13, 'slip_atr_k': 0.12192951994913198, 'slip_spread_k': 0.2231148942735266, 'spread_hl_frac': 0.04675318363259789, 'bb_std_mult': 1.7402887911160765, 'rsi_os': 31, 'rsi_ob': 56, 'vol_spike': 0.09019961044697086, 'adx_thresh': 12.14294898614274, 'atr_min_pct': 0.022892616840221015, 'atr_max_pct': 0.1215594374349682, 'tp_mult': 1.548630201276921, 'tsl_mult': 0.6523401526929131, 'strategy': 'breakout', 'time_stop': 52, 'use_sma': False, 'use_atr': False, 'use_adx': False, 'use_ema': False, 'use_spike': True, 'rsi_required': False, 'edge_k': 1.0107736855426237, 'edge_cap': 0.1939989945480139, 'bull_strategy': 'breakout', 'bull_bb_std_mult': 1.0510604694621029, 'bull_rsi_os': 43, 'bull_rsi_ob': 52, 'bull_adx_thresh': 7.2437437012923365, 'bull_atr_min_pct': 0.016456282446557256, 'bull_atr_max_pct': 0.08799393258763404, 'bull_tp_mult': 2.8692611955018554, 'bull_tsl_mult': 0.702510952638435, 'bull_time_stop': 247, 'bull_use_sma': False, 'bull_use_ema': True, 'bull_use_atr': True, 'bull_use_adx': True, 'bull_use_spike': False, 'bull_rsi_required': True, 'bear_strategy': 'mean_reversion', 'bear_bb_std_mult': 1.355102898884324, 'bear_rsi_os': 12, 'bear_rsi_ob': 66, 'bear_adx_thresh': 18.986060050851645, 'bear_atr_min_pct': 0.009876309590631864, 'bear_atr_max_pct': 0.07773295556440593, 'bear_tp_mult': 2.675778100160515, 'bear_tsl_mult': 0.20232412352815976, 'bear_time_stop': 210, 'bear_use_sma': True, 'bear_use_ema': False, 'bear_use_atr': True, 'bear_use_adx': True, 'bear_use_spike': False, 'bear_rsi_required': False, 'sideways_strategy': 'mean_reversion', 'sideways_bb_std_mult': 2.956692041033043, 'sideways_rsi_os': 29, 'sideways_rsi_ob': 52, 'sideways_adx_thresh': 10.83207347337557, 'sideways_atr_min_pct': 0.01511741427967759, 'sideways_atr_max_pct': 0.11189775120591819, 'sideways_tp_mult': 1.91415577425952, 'sideways_tsl_mult': 0.5180567342861708, 'sideways_time_stop': 59, 'sideways_use_sma': False, 'sideways_use_ema': False, 'sideways_use_atr': False, 'sideways_use_adx': True, 'sideways_use_spike': True, 'sideways_rsi_required': True}.
[I 2025-08-31 04:59:31,052] Trial 522 finished with values: [-1000000000.0, 1000000000.0] and parameters: {'p_sma': 11, 'p_std': 13, 'p_atr': 23, 'p_adx': 27, 'rsi_period': 22, 'ema1': 15, 'ema2': 27, 'slip_atr_k': 0.02072602164665012, 'slip_spread_k': 0.06895889832918267, 'spread_hl_frac': 0.014564766548649915, 'bb_std_mult': 2.1752465770341365, 'rsi_os': 31, 'rsi_ob': 55, 'vol_spike': 0.05200138874443837, 'adx_thresh': 33.06643076765156, 'atr_min_pct': 0.014063631687973522, 'atr_max_pct': 0.01987750241489164, 'tp_mult': 1.5572820864281036, 'tsl_mult': 0.81470460927464, 'strategy': 'breakout', 'time_stop': 50, 'use_sma': False, 'use_atr': False, 'use_adx': False, 'use_ema': False, 'use_spike': True, 'rsi_required': False, 'edge_k': 1.39651674190633, 'edge_cap': 0.1858865697127009, 'bull_strategy': 'breakout', 'bull_bb_std_mult': 2.044866837355324, 'bull_rsi_os': 46, 'bull_rsi_ob': 65, 'bull_adx_thresh': 12.128528726126461, 'bull_atr_min_pct': 6.052339803810621e-05, 'bull_atr_max_pct': 0.06042325931269249, 'bull_tp_mult': 1.5567592590428025, 'bull_tsl_mult': 0.31741137251443685, 'bull_time_stop': 146, 'bull_use_sma': False, 'bull_use_ema': True, 'bull_use_atr': True, 'bull_use_adx': True, 'bull_use_spike': False, 'bull_rsi_required': True, 'bear_strategy': 'mean_reversion', 'bear_bb_std_mult': 0.7294244523670241, 'bear_rsi_os': 12, 'bear_rsi_ob': 55, 'bear_adx_thresh': 18.999999885944465, 'bear_atr_min_pct': 0.025014226307076937, 'bear_atr_max_pct': 0.020952545670368625, 'bear_tp_mult': 2.6838899687678603, 'bear_tsl_mult': 0.14712942060909534, 'bear_time_stop': 207, 'bear_use_sma': True, 'bear_use_ema': False, 'bear_use_atr': True, 'bear_use_adx': True, 'bear_use_spike': False, 'bear_rsi_required': False, 'sideways_strategy': 'mean_reversion', 'sideways_bb_std_mult': 1.0969821493455838, 'sideways_rsi_os': 8, 'sideways_rsi_ob': 55, 'sideways_adx_thresh': 18.634632691147644, 'sideways_atr_min_pct': 0.021071179455836447, 'sideways_atr_max_pct': 0.06859255940942213, 'sideways_tp_mult': 2.6654872809919556, 'sideways_tsl_mult': 0.6527355905801814, 'sideways_time_stop': 57, 'sideways_use_sma': False, 'sideways_use_ema': False, 'sideways_use_atr': False, 'sideways_use_adx': True, 'sideways_use_spike': True, 'sideways_rsi_required': True}.
[I 2025-08-31 04:59:31,214] Trial 523 finished with values: [-1000000000.0, 1000000000.0] and parameters: {'p_sma': 54, 'p_std': 15, 'p_atr': 9, 'p_adx': 27, 'rsi_period': 16, 'ema1': 15, 'ema2': 27, 'slip_atr_k': 0.020285667058370677, 'slip_spread_k': 0.0707128523063355, 'spread_hl_frac': 0.01869010083914178, 'bb_std_mult': 1.8320094087542291, 'rsi_os': 14, 'rsi_ob': 76, 'vol_spike': 0.028867255390260076, 'adx_thresh': 33.29420651140087, 'atr_min_pct': 0.02293376863856229, 'atr_max_pct': 0.12006826852866193, 'tp_mult': 1.4374849551890094, 'tsl_mult': 0.3199713399036711, 'strategy': 'breakout', 'time_stop': 51, 'use_sma': False, 'use_atr': False, 'use_adx': False, 'use_ema': False, 'use_spike': True, 'rsi_required': False, 'edge_k': 0.037407119679215284, 'edge_cap': 0.9802409406129202, 'bull_strategy': 'breakout', 'bull_bb_std_mult': 3.4192553894622497, 'bull_rsi_os': 22, 'bull_rsi_ob': 71, 'bull_adx_thresh': 19.389634288577792, 'bull_atr_min_pct': 0.014241035461944523, 'bull_atr_max_pct': 0.058477171182867584, 'bull_tp_mult': 1.4765338378211295, 'bull_tsl_mult': 0.3073907397070176, 'bull_time_stop': 147, 'bull_use_sma': False, 'bull_use_ema': True, 'bull_use_atr': True, 'bull_use_adx': True, 'bull_use_spike': False, 'bull_rsi_required': True, 'bear_strategy': 'mean_reversion', 'bear_bb_std_mult': 0.93770833943316, 'bear_rsi_os': 12, 'bear_rsi_ob': 46, 'bear_adx_thresh': 31.023830561580795, 'bear_atr_min_pct': 0.014432865063004811, 'bear_atr_max_pct': 0.01011921247508614, 'bear_tp_mult': 2.078045770243042, 'bear_tsl_mult': 0.16524961110299552, 'bear_time_stop': 72, 'bear_use_sma': True, 'bear_use_ema': False, 'bear_use_atr': True, 'bear_use_adx': True, 'bear_use_spike': False, 'bear_rsi_required': False, 'sideways_strategy': 'mean_reversion', 'sideways_bb_std_mult': 1.1089627653404859, 'sideways_rsi_os': 29, 'sideways_rsi_ob': 55, 'sideways_adx_thresh': 10.754283772328622, 'sideways_atr_min_pct': 0.015980350398443262, 'sideways_atr_max_pct': 0.06817619847948105, 'sideways_tp_mult': 2.8166141111763476, 'sideways_tsl_mult': 0.06989346965177629, 'sideways_time_stop': 60, 'sideways_use_sma': False, 'sideways_use_ema': False, 'sideways_use_atr': False, 'sideways_use_adx': True, 'sideways_use_spike': True, 'sideways_rsi_required': True}.
[I 2025-08-31 05:00:14,176] Trial 527 finished with values: [-1000000000.0, 1000000000.0] and parameters: {'p_sma': 54, 'p_std': 15, 'p_atr': 25, 'p_adx': 11, 'rsi_period': 23, 'ema1': 12, 'ema2': 18, 'slip_atr_k': 0.10209064836935869, 'slip_spread_k': 0.8389051722660792, 'spread_hl_frac': 0.033990520140989446, 'bb_std_mult': 3.5987789571491215, 'rsi_os': 26, 'rsi_ob': 62, 'vol_spike': 0.02740929462567977, 'adx_thresh': 26.439358629929707, 'atr_min_pct': 0.022473448623094434, 'atr_max_pct': 0.12772194397938488, 'tp_mult': 1.0917426585316643, 'tsl_mult': 0.9211966630234257, 'strategy': 'breakout', 'time_stop': 57, 'use_sma': False, 'use_atr': False, 'use_adx': False, 'use_ema': False, 'use_spike': True, 'rsi_required': False, 'edge_k': 1.6385682070428909, 'edge_cap': 0.9815698886947973, 'bull_strategy': 'mean_reversion', 'bull_bb_std_mult': 2.9657211515011723, 'bull_rsi_os': 32, 'bull_rsi_ob': 80, 'bull_adx_thresh': 11.493964104870162, 'bull_atr_min_pct': 0.01218702451719392, 'bull_atr_max_pct': 0.05064572121426109, 'bull_tp_mult': 2.08030992316075, 'bull_tsl_mult': 0.877274524372017, 'bull_time_stop': 161, 'bull_use_sma': False, 'bull_use_ema': False, 'bull_use_atr': True, 'bull_use_adx': True, 'bull_use_spike': False, 'bull_rsi_required': True, 'bear_strategy': 'mean_reversion', 'bear_bb_std_mult': 0.9068927966572772, 'bear_rsi_os': 44, 'bear_rsi_ob': 82, 'bear_adx_thresh': 20.823592145984282, 'bear_atr_min_pct': 0.021973594495016693, 'bear_atr_max_pct': 0.14093475642874576, 'bear_tp_mult': 2.565933867859016, 'bear_tsl_mult': 0.9502446398187365, 'bear_time_stop': 72, 'bear_use_sma': True, 'bear_use_ema': True, 'bear_use_atr': True, 'bear_use_adx': True, 'bear_use_spike': True, 'bear_rsi_required': True, 'sideways_strategy': 'mean_reversion', 'sideways_bb_std_mult': 1.1160658169527595, 'sideways_rsi_os': 28, 'sideways_rsi_ob': 89, 'sideways_adx_thresh': 31.897165870667898, 'sideways_atr_min_pct': 0.016003131187601403, 'sideways_atr_max_pct': 0.12583261599196216, 'sideways_tp_mult': 1.3778326923954083, 'sideways_tsl_mult': 0.6232995440752029, 'sideways_time_stop': 66, 'sideways_use_sma': False, 'sideways_use_ema': False, 'sideways_use_atr': False, 'sideways_use_adx': True, 'sideways_use_spike': True, 'sideways_rsi_required': True}.
[I 2025-08-31 05:00:14,656] Trial 525 finished with values: [-1000000000.0, 1000000000.0] and parameters: {'p_sma': 55, 'p_std': 21, 'p_atr': 9, 'p_adx': 11, 'rsi_period': 63, 'ema1': 13, 'ema2': 47, 'slip_atr_k': 0.1094768071260875, 'slip_spread_k': 0.07184447544205981, 'spread_hl_frac': 0.010311300272884653, 'bb_std_mult': 2.47302580698268, 'rsi_os': 30, 'rsi_ob': 59, 'vol_spike': 0.1554712861237204, 'adx_thresh': 33.0592146036028, 'atr_min_pct': 0.022389909537689223, 'atr_max_pct': 0.11774727616726403, 'tp_mult': 1.4303400934162014, 'tsl_mult': 0.3132444664690844, 'strategy': 'breakout', 'time_stop': 121, 'use_sma': False, 'use_atr': False, 'use_adx': False, 'use_ema': False, 'use_spike': True, 'rsi_required': False, 'edge_k': 1.4008149948763353, 'edge_cap': 0.9801768214604146, 'bull_strategy': 'mean_reversion', 'bull_bb_std_mult': 2.0449851383383972, 'bull_rsi_os': 22, 'bull_rsi_ob': 80, 'bull_adx_thresh': 11.771754168113752, 'bull_atr_min_pct': 0.001094496657091683, 'bull_atr_max_pct': 0.04995118091108385, 'bull_tp_mult': 1.4853787856214937, 'bull_tsl_mult': 0.27207292783265136, 'bull_time_stop': 147, 'bull_use_sma': False, 'bull_use_ema': True, 'bull_use_atr': True, 'bull_use_adx': True, 'bull_use_spike': False, 'bull_rsi_required': True, 'bear_strategy': 'mean_reversion', 'bear_bb_std_mult': 2.2159540020881403, 'bear_rsi_os': 38, 'bear_rsi_ob': 82, 'bear_adx_thresh': 20.689451633602857, 'bear_atr_min_pct': 0.025046825005317137, 'bear_atr_max_pct': 0.06721789628915117, 'bear_tp_mult': 2.0672030807232993, 'bear_tsl_mult': 0.2766655473991757, 'bear_time_stop': 200, 'bear_use_sma': True, 'bear_use_ema': False, 'bear_use_atr': True, 'bear_use_adx': True, 'bear_use_spike': True, 'bear_rsi_required': True, 'sideways_strategy': 'mean_reversion', 'sideways_bb_std_mult': 1.093077032287085, 'sideways_rsi_os': 28, 'sideways_rsi_ob': 54, 'sideways_adx_thresh': 7.69333127820626, 'sideways_atr_min_pct': 0.01591952680866007, 'sideways_atr_max_pct': 0.08020713056445553, 'sideways_tp_mult': 2.3821958719644556, 'sideways_tsl_mult': 0.625503387172061, 'sideways_time_stop': 66, 'sideways_use_sma': False, 'sideways_use_ema': False, 'sideways_use_atr': False, 'sideways_use_adx': True, 'sideways_use_spike': True, 'sideways_rsi_required': True}.
[I 2025-08-31 05:00:14,773] Trial 528 finished with values: [-1000000000.0, 1000000000.0] and parameters: {'p_sma': 55, 'p_std': 16, 'p_atr': 29, 'p_adx': 11, 'rsi_period': 64, 'ema1': 12, 'ema2': 25, 'slip_atr_k': 0.027242356709808777, 'slip_spread_k': 0.13241993445463257, 'spread_hl_frac': 0.010473048280005542, 'bb_std_mult': 3.0108785845862505, 'rsi_os': 35, 'rsi_ob': 62, 'vol_spike': 0.2743102116397691, 'adx_thresh': 26.52825434362417, 'atr_min_pct': 0.02238220441804731, 'atr_max_pct': 0.12748537144347627, 'tp_mult': 1.0890042733760494, 'tsl_mult': 0.9261810377645738, 'strategy': 'breakout', 'time_stop': 119, 'use_sma': False, 'use_atr': False, 'use_adx': False, 'use_ema': False, 'use_spike': True, 'rsi_required': False, 'edge_k': 0.2717061386902113, 'edge_cap': 0.9514818933004517, 'bull_strategy': 'mean_reversion', 'bull_bb_std_mult': 3.4761176920183736, 'bull_rsi_os': 34, 'bull_rsi_ob': 76, 'bull_adx_thresh': 10.734459575871586, 'bull_atr_min_pct': 0.01224616941295238, 'bull_atr_max_pct': 0.049588760443545536, 'bull_tp_mult': 2.5745663691342706, 'bull_tsl_mult': 0.28061051987980673, 'bull_time_stop': 138, 'bull_use_sma': False, 'bull_use_ema': False, 'bull_use_atr': True, 'bull_use_adx': True, 'bull_use_spike': False, 'bull_rsi_required': True, 'bear_strategy': 'mean_reversion', 'bear_bb_std_mult': 0.6475070119087418, 'bear_rsi_os': 8, 'bear_rsi_ob': 82, 'bear_adx_thresh': 20.68630977067747, 'bear_atr_min_pct': 0.02458005561594264, 'bear_atr_max_pct': 0.13967404308246453, 'bear_tp_mult': 2.996054139588549, 'bear_tsl_mult': 0.21685600643833608, 'bear_time_stop': 200, 'bear_use_sma': True, 'bear_use_ema': True, 'bear_use_atr': True, 'bear_use_adx': True, 'bear_use_spike': True, 'bear_rsi_required': True, 'sideways_strategy': 'mean_reversion', 'sideways_bb_std_mult': 2.3866111564416226, 'sideways_rsi_os': 13, 'sideways_rsi_ob': 89, 'sideways_adx_thresh': 7.424978795220879, 'sideways_atr_min_pct': 0.027650249407329318, 'sideways_atr_max_pct': 0.1252117601622702, 'sideways_tp_mult': 1.9751141342738532, 'sideways_tsl_mult': 0.6305515438197727, 'sideways_time_stop': 280, 'sideways_use_sma': False, 'sideways_use_ema': False, 'sideways_use_atr': False, 'sideways_use_adx': True, 'sideways_use_spike': True, 'sideways_rsi_required': True}.
[I 2025-08-31 05:00:14,908] Trial 526 finished with values: [-0.017395028766808207, 0.017325087616889237] and parameters: {'p_sma': 54, 'p_std': 15, 'p_atr': 9, 'p_adx': 11, 'rsi_period': 23, 'ema1': 12, 'ema2': 26, 'slip_atr_k': 0.06379085765724023, 'slip_spread_k': 0.8420283451179003, 'spread_hl_frac': 0.009700773052652847, 'bb_std_mult': 1.0634592555157774, 'rsi_os': 42, 'rsi_ob': 62, 'vol_spike': 0.02757835444670321, 'adx_thresh': 12.3264534002399, 'atr_min_pct': 0.005030119730124228, 'atr_max_pct': 0.11874292648270011, 'tp_mult': 1.4564699202482851, 'tsl_mult': 0.5324534618274062, 'strategy': 'breakout', 'time_stop': 18, 'use_sma': False, 'use_atr': False, 'use_adx': False, 'use_ema': False, 'use_spike': True, 'rsi_required': False, 'edge_k': 1.484996843727168, 'edge_cap': 0.08398981629260549, 'bull_strategy': 'mean_reversion', 'bull_bb_std_mult': 2.9823146802590745, 'bull_rsi_os': 13, 'bull_rsi_ob': 80, 'bull_adx_thresh': 10.98962158868411, 'bull_atr_min_pct': 0.001044801322226664, 'bull_atr_max_pct': 0.05006431068960293, 'bull_tp_mult': 2.071691146483204, 'bull_tsl_mult': 0.8771325976717098, 'bull_time_stop': 158, 'bull_use_sma': False, 'bull_use_ema': False, 'bull_use_atr': True, 'bull_use_adx': True, 'bull_use_spike': False, 'bull_rsi_required': True, 'bear_strategy': 'mean_reversion', 'bear_bb_std_mult': 0.6715175604535684, 'bear_rsi_os': 41, 'bear_rsi_ob': 82, 'bear_adx_thresh': 26.205646167584007, 'bear_atr_min_pct': 0.006325922274753294, 'bear_atr_max_pct': 0.04747442222478818, 'bear_tp_mult': 2.058650650331675, 'bear_tsl_mult': 0.27020577758065917, 'bear_time_stop': 73, 'bear_use_sma': True, 'bear_use_ema': True, 'bear_use_atr': True, 'bear_use_adx': True, 'bear_use_spike': True, 'bear_rsi_required': True, 'sideways_strategy': 'mean_reversion', 'sideways_bb_std_mult': 1.9195026617288218, 'sideways_rsi_os': 28, 'sideways_rsi_ob': 71, 'sideways_adx_thresh': 21.942420319599854, 'sideways_atr_min_pct': 0.010341026715822708, 'sideways_atr_max_pct': 0.043741807014981156, 'sideways_tp_mult': 2.8022901241208484, 'sideways_tsl_mult': 0.6293919165651337, 'sideways_time_stop': 281, 'sideways_use_sma': False, 'sideways_use_ema': False, 'sideways_use_atr': False, 'sideways_use_adx': True, 'sideways_use_spike': True, 'sideways_rsi_required': True}.
[I 2025-08-31 05:01:03,746] Trial 529 finished with values: [-0.017603845156551, 0.01753233450965388] and parameters: {'p_sma': 55, 'p_std': 17, 'p_atr': 16, 'p_adx': 12, 'rsi_period': 72, 'ema1': 5, 'ema2': 47, 'slip_atr_k': 0.05086946262711517, 'slip_spread_k': 0.9984646659365037, 'spread_hl_frac': 0.028067815163837766, 'bb_std_mult': 3.0210109969305754, 'rsi_os': 9, 'rsi_ob': 81, 'vol_spike': 0.15446517754115077, 'adx_thresh': 19.98716735322072, 'atr_min_pct': 0.023885447619649322, 'atr_max_pct': 0.11692429772629749, 'tp_mult': 2.4059710150017266, 'tsl_mult': 0.5311802156190867, 'strategy': 'breakout', 'time_stop': 199, 'use_sma': False, 'use_atr': False, 'use_adx': False, 'use_ema': False, 'use_spike': True, 'rsi_required': False, 'edge_k': 1.4882273726074973, 'edge_cap': 0.9242239034733717, 'bull_strategy': 'mean_reversion', 'bull_bb_std_mult': 3.4826383235639824, 'bull_rsi_os': 13, 'bull_rsi_ob': 76, 'bull_adx_thresh': 10.968668076590205, 'bull_atr_min_pct': 0.0009447300437619697, 'bull_atr_max_pct': 0.022646779381598592, 'bull_tp_mult': 1.7020381432355258, 'bull_tsl_mult': 0.2818066470807789, 'bull_time_stop': 137, 'bull_use_sma': False, 'bull_use_ema': False, 'bull_use_atr': True, 'bull_use_adx': True, 'bull_use_spike': False, 'bull_rsi_required': True, 'bear_strategy': 'breakout', 'bear_bb_std_mult': 0.9734827003206888, 'bear_rsi_os': 21, 'bear_rsi_ob': 48, 'bear_adx_thresh': 7.0088718266288925, 'bear_atr_min_pct': 0.024379852846920624, 'bear_atr_max_pct': 0.03862640670733719, 'bear_tp_mult': 1.8906277118274821, 'bear_tsl_mult': 0.21369035681875545, 'bear_time_stop': 261, 'bear_use_sma': True, 'bear_use_ema': True, 'bear_use_atr': True, 'bear_use_adx': True, 'bear_use_spike': True, 'bear_rsi_required': True, 'sideways_strategy': 'mean_reversion', 'sideways_bb_std_mult': 1.0288061311434005, 'sideways_rsi_os': 26, 'sideways_rsi_ob': 53, 'sideways_adx_thresh': 10.180857591189419, 'sideways_atr_min_pct': 0.01830912834441697, 'sideways_atr_max_pct': 0.14859131134002387, 'sideways_tp_mult': 1.9671977667103597, 'sideways_tsl_mult': 0.6301948567027393, 'sideways_time_stop': 75, 'sideways_use_sma': False, 'sideways_use_ema': False, 'sideways_use_atr': False, 'sideways_use_adx': True, 'sideways_use_spike': True, 'sideways_rsi_required': True}.
[I 2025-08-31 05:01:04,319] Trial 532 finished with values: [-1000000000.0, 1000000000.0] and parameters: {'p_sma': 39, 'p_std': 18, 'p_atr': 15, 'p_adx': 7, 'rsi_period': 33, 'ema1': 13, 'ema2': 24, 'slip_atr_k': 0.19737391643644842, 'slip_spread_k': 0.11002405838227959, 'spread_hl_frac': 0.004573712455144811, 'bb_std_mult': 1.9659650457274052, 'rsi_os': 9, 'rsi_ob': 60, 'vol_spike': 0.018305280294672127, 'adx_thresh': 10.763755445559713, 'atr_min_pct': 0.011218313864910089, 'atr_max_pct': 0.12182332600679487, 'tp_mult': 2.5262075115711586, 'tsl_mult': 0.8630464178851625, 'strategy': 'mean_reversion', 'time_stop': 246, 'use_sma': False, 'use_atr': False, 'use_adx': True, 'use_ema': False, 'use_spike': True, 'rsi_required': True, 'edge_k': 1.5485683302322262, 'edge_cap': 0.7556254542316434, 'bull_strategy': 'mean_reversion', 'bull_bb_std_mult': 3.2969391241070234, 'bull_rsi_os': 51, 'bull_rsi_ob': 74, 'bull_adx_thresh': 10.368815220859647, 'bull_atr_min_pct': 0.009626143654977805, 'bull_atr_max_pct': 0.045854001009075156, 'bull_tp_mult': 1.696743467261133, 'bull_tsl_mult': 0.8524792705001, 'bull_time_stop': 90, 'bull_use_sma': True, 'bull_use_ema': False, 'bull_use_atr': True, 'bull_use_adx': False, 'bull_use_spike': False, 'bull_rsi_required': False, 'bear_strategy': 'breakout', 'bear_bb_std_mult': 0.9847542138610821, 'bear_rsi_os': 24, 'bear_rsi_ob': 48, 'bear_adx_thresh': 33.27460447959562, 'bear_atr_min_pct': 0.028547542730184398, 'bear_atr_max_pct': 0.12337580821501666, 'bear_tp_mult': 1.8867409132415225, 'bear_tsl_mult': 0.22647163248314167, 'bear_time_stop': 262, 'bear_use_sma': False, 'bear_use_ema': True, 'bear_use_atr': False, 'bear_use_adx': False, 'bear_use_spike': True, 'bear_rsi_required': True, 'sideways_strategy': 'breakout', 'sideways_bb_std_mult': 2.624494891123989, 'sideways_rsi_os': 42, 'sideways_rsi_ob': 53, 'sideways_adx_thresh': 6.513630082883406, 'sideways_atr_min_pct': 0.02186572625106108, 'sideways_atr_max_pct': 0.11957055141365722, 'sideways_tp_mult': 1.6398571903020323, 'sideways_tsl_mult': 0.6088557686134055, 'sideways_time_stop': 76, 'sideways_use_sma': False, 'sideways_use_ema': True, 'sideways_use_atr': True, 'sideways_use_adx': True, 'sideways_use_spike': False, 'sideways_rsi_required': False}.
