[I 2025-08-31 05:10:31,960] Trial 588 finished with values: [-1000000000.0, 1000000000.0] and parameters: {'p_sma': 57, 'p_std': 18, 'p_atr': 23, 'p_adx': 10, 'rsi_period': 25, 'ema1': 14, 'ema2': 34, 'slip_atr_k': 0.23748668642736215, 'slip_spread_k': 0.23377207261774946, 'spread_hl_frac': 0.005973295836810591, 'bb_std_mult': 1.7803920189421647, 'rsi_os': 29, 'rsi_ob': 53, 'vol_spike': 0.022415117535965114, 'adx_thresh': 12.058018517986621, 'atr_min_pct': 0.023109794457232647, 'atr_max_pct': 0.01748224972149537, 'tp_mult': 2.4493560296908727, 'tsl_mult': 0.8973000030539057, 'strategy': 'breakout', 'time_stop': 48, 'use_sma': True, 'use_atr': True, 'use_adx': False, 'use_ema': True, 'use_spike': False, 'rsi_required': False, 'edge_k': 0.8578516659001839, 'edge_cap': 0.9521808808199206, 'bull_strategy': 'mean_reversion', 'bull_bb_std_mult': 1.9290636753222499, 'bull_rsi_os': 18, 'bull_rsi_ob': 70, 'bull_adx_thresh': 10.888328085556438, 'bull_atr_min_pct': 0.022203712782171862, 'bull_atr_max_pct': 0.051800155720374316, 'bull_tp_mult': 1.89486458873301, 'bull_tsl_mult': 0.9002830736157267, 'bull_time_stop': 45, 'bull_use_sma': False, 'bull_use_ema': False, 'bull_use_atr': False, 'bull_use_adx': True, 'bull_use_spike': True, 'bull_rsi_required': True, 'bear_strategy': 'breakout', 'bear_bb_std_mult': 0.9226997378535979, 'bear_rsi_os': 9, 'bear_rsi_ob': 45, 'bear_adx_thresh': 15.850515389407114, 'bear_atr_min_pct': 0.02397840936685845, 'bear_atr_max_pct': 0.05535422428483075, 'bear_tp_mult': 2.7246419107289643, 'bear_tsl_mult': 0.26496198854028225, 'bear_time_stop': 241, 'bear_use_sma': True, 'bear_use_ema': True, 'bear_use_atr': False, 'bear_use_adx': True, 'bear_use_spike': True, 'bear_rsi_required': False, 'sideways_strategy': 'mean_reversion', 'sideways_bb_std_mult': 0.9854590500664091, 'sideways_rsi_os': 36, 'sideways_rsi_ob': 54, 'sideways_adx_thresh': 8.754389753725405, 'sideways_atr_min_pct': 0.024480469198991925, 'sideways_atr_max_pct': 0.1199175978146743, 'sideways_tp_mult': 1.9721470228852942, 'sideways_tsl_mult': 0.6293077896300828, 'sideways_time_stop': 40, 'sideways_use_sma': True, 'sideways_use_ema': False, 'sideways_use_atr': False, 'sideways_use_adx': False, 'sideways_use_spike': True, 'sideways_rsi_required': True}.
[I 2025-08-31 05:11:19,363] Trial 587 finished with values: [-1000000000.0, 1000000000.0] and parameters: {'p_sma': 57, 'p_std': 57, 'p_atr': 24, 'p_adx': 10, 'rsi_period': 26, 'ema1': 14, 'ema2': 26, 'slip_atr_k': 0.1535202023018508, 'slip_spread_k': 0.6240635776079868, 'spread_hl_frac': 0.011768116696827988, 'bb_std_mult': 2.5405376593654627, 'rsi_os': 5, 'rsi_ob': 61, 'vol_spike': 0.28543444531507206, 'adx_thresh': 11.962513647389889, 'atr_min_pct': 0.026225309634250092, 'atr_max_pct': 0.12289702107830386, 'tp_mult': 2.336637029354877, 'tsl_mult': 0.8978843947021311, 'strategy': 'breakout', 'time_stop': 47, 'use_sma': True, 'use_atr': True, 'use_adx': False, 'use_ema': True, 'use_spike': False, 'rsi_required': False, 'edge_k': 1.6884025684006545, 'edge_cap': 0.91238350186183, 'bull_strategy': 'mean_reversion', 'bull_bb_std_mult': 1.8376092239894493, 'bull_rsi_os': 14, 'bull_rsi_ob': 70, 'bull_adx_thresh': 18.80967076732706, 'bull_atr_min_pct': 0.022718961796553805, 'bull_atr_max_pct': 0.03798853417296518, 'bull_tp_mult': 1.897915409362509, 'bull_tsl_mult': 0.25273840132407527, 'bull_time_stop': 141, 'bull_use_sma': False, 'bull_use_ema': False, 'bull_use_atr': False, 'bull_use_adx': True, 'bull_use_spike': True, 'bull_rsi_required': True, 'bear_strategy': 'breakout', 'bear_bb_std_mult': 0.9208857890231289, 'bear_rsi_os': 50, 'bear_rsi_ob': 85, 'bear_adx_thresh': 9.022058050055787, 'bear_atr_min_pct': 0.02401818987793494, 'bear_atr_max_pct': 0.03465402819097253, 'bear_tp_mult': 2.717077053259248, 'bear_tsl_mult': 0.26519332351728503, 'bear_time_stop': 143, 'bear_use_sma': True, 'bear_use_ema': True, 'bear_use_atr': True, 'bear_use_adx': True, 'bear_use_spike': True, 'bear_rsi_required': False, 'sideways_strategy': 'mean_reversion', 'sideways_bb_std_mult': 1.0141784744893871, 'sideways_rsi_os': 27, 'sideways_rsi_ob': 70, 'sideways_adx_thresh': 11.55610143843547, 'sideways_atr_min_pct': 0.01764452524378765, 'sideways_atr_max_pct': 0.02762217447779316, 'sideways_tp_mult': 1.6681928855386383, 'sideways_tsl_mult': 0.6353100489720676, 'sideways_time_stop': 60, 'sideways_use_sma': False, 'sideways_use_ema': False, 'sideways_use_atr': False, 'sideways_use_adx': False, 'sideways_use_spike': True, 'sideways_rsi_required': True}.
[I 2025-08-31 05:11:19,374] Trial 585 finished with values: [-1000000000.0, 1000000000.0] and parameters: {'p_sma': 29, 'p_std': 14, 'p_atr': 22, 'p_adx': 21, 'rsi_period': 68, 'ema1': 9, 'ema2': 26, 'slip_atr_k': 0.15838848585516496, 'slip_spread_k': 0.3807768781062576, 'spread_hl_frac': 0.011882680601773467, 'bb_std_mult': 1.914718605585831, 'rsi_os': 55, 'rsi_ob': 62, 'vol_spike': 0.02461212353607522, 'adx_thresh': 12.018608004139175, 'atr_min_pct': 0.02044873476736193, 'atr_max_pct': 0.12290180293473615, 'tp_mult': 2.3805024754089916, 'tsl_mult': 0.1121576246188064, 'strategy': 'breakout', 'time_stop': 100, 'use_sma': False, 'use_atr': False, 'use_adx': False, 'use_ema': True, 'use_spike': False, 'rsi_required': False, 'edge_k': 1.6735916377045101, 'edge_cap': 0.9563552616769477, 'bull_strategy': 'mean_reversion', 'bull_bb_std_mult': 3.0656690906587043, 'bull_rsi_os': 37, 'bull_rsi_ob': 92, 'bull_adx_thresh': 26.45630830794041, 'bull_atr_min_pct': 0.022719182361471302, 'bull_atr_max_pct': 0.04521353886479254, 'bull_tp_mult': 1.6168711696332898, 'bull_tsl_mult': 0.8429440426974493, 'bull_time_stop': 157, 'bull_use_sma': False, 'bull_use_ema': False, 'bull_use_atr': True, 'bull_use_adx': True, 'bull_use_spike': True, 'bull_rsi_required': True, 'bear_strategy': 'mean_reversion', 'bear_bb_std_mult': 2.7118314481929775, 'bear_rsi_os': 9, 'bear_rsi_ob': 45, 'bear_adx_thresh': 20.023362041012035, 'bear_atr_min_pct': 0.023740408645181125, 'bear_atr_max_pct': 0.036799307630786274, 'bear_tp_mult': 2.723668202034616, 'bear_tsl_mult': 0.05399490987473571, 'bear_time_stop': 240, 'bear_use_sma': True, 'bear_use_ema': True, 'bear_use_atr': False, 'bear_use_adx': True, 'bear_use_spike': True, 'bear_rsi_required': False, 'sideways_strategy': 'mean_reversion', 'sideways_bb_std_mult': 3.593355244425773, 'sideways_rsi_os': 14, 'sideways_rsi_ob': 70, 'sideways_adx_thresh': 10.857463054895902, 'sideways_atr_min_pct': 0.005366552821811825, 'sideways_atr_max_pct': 0.11640706621274778, 'sideways_tp_mult': 2.9016666132525764, 'sideways_tsl_mult': 0.17470736244512597, 'sideways_time_stop': 61, 'sideways_use_sma': True, 'sideways_use_ema': False, 'sideways_use_atr': False, 'sideways_use_adx': True, 'sideways_use_spike': True, 'sideways_rsi_required': True}.
[I 2025-08-31 05:11:19,804] Trial 586 finished with values: [-1000000000.0, 1000000000.0] and parameters: {'p_sma': 29, 'p_std': 29, 'p_atr': 22, 'p_adx': 13, 'rsi_period': 68, 'ema1': 9, 'ema2': 26, 'slip_atr_k': 0.15918549400075915, 'slip_spread_k': 0.699200338118884, 'spread_hl_frac': 0.03689701529089503, 'bb_std_mult': 1.9241431367518795, 'rsi_os': 39, 'rsi_ob': 83, 'vol_spike': 0.023829085113322452, 'adx_thresh': 12.098646931407801, 'atr_min_pct': 0.004352980304935056, 'atr_max_pct': 0.12298280229706296, 'tp_mult': 2.3381542953353214, 'tsl_mult': 0.8998157274014316, 'strategy': 'breakout', 'time_stop': 37, 'use_sma': True, 'use_atr': True, 'use_adx': False, 'use_ema': True, 'use_spike': False, 'rsi_required': False, 'edge_k': 0.1733863377199888, 'edge_cap': 0.8681627922744694, 'bull_strategy': 'mean_reversion', 'bull_bb_std_mult': 3.431897038464931, 'bull_rsi_os': 42, 'bull_rsi_ob': 73, 'bull_adx_thresh': 20.19532066911121, 'bull_atr_min_pct': 0.02206739934481941, 'bull_atr_max_pct': 0.038835679767683165, 'bull_tp_mult': 1.6120297289566614, 'bull_tsl_mult': 0.20792656782662128, 'bull_time_stop': 141, 'bull_use_sma': False, 'bull_use_ema': False, 'bull_use_atr': False, 'bull_use_adx': True, 'bull_use_spike': True, 'bull_rsi_required': True, 'bear_strategy': 'breakout', 'bear_bb_std_mult': 0.9338561731969395, 'bear_rsi_os': 49, 'bear_rsi_ob': 84, 'bear_adx_thresh': 29.677822189597713, 'bear_atr_min_pct': 0.024045575946984647, 'bear_atr_max_pct': 0.1443329519431468, 'bear_tp_mult': 2.3278748399742026, 'bear_tsl_mult': 0.3533994909605425, 'bear_time_stop': 213, 'bear_use_sma': True, 'bear_use_ema': True, 'bear_use_atr': False, 'bear_use_adx': True, 'bear_use_spike': True, 'bear_rsi_required': False, 'sideways_strategy': 'mean_reversion', 'sideways_bb_std_mult': 3.5291526796711405, 'sideways_rsi_os': 27, 'sideways_rsi_ob': 54, 'sideways_adx_thresh': 11.743398975689402, 'sideways_atr_min_pct': 0.006769663034157011, 'sideways_atr_max_pct': 0.11953530934445761, 'sideways_tp_mult': 1.9544251328997284, 'sideways_tsl_mult': 0.18653873968964202, 'sideways_time_stop': 263, 'sideways_use_sma': True, 'sideways_use_ema': False, 'sideways_use_atr': False, 'sideways_use_adx': False, 'sideways_use_spike': True, 'sideways_rsi_required': True}.
[I 2025-08-31 05:11:20,003] Trial 589 finished with values: [-1000000000.0, 1000000000.0] and parameters: {'p_sma': 59, 'p_std': 7, 'p_atr': 24, 'p_adx': 9, 'rsi_period': 66, 'ema1': 15, 'ema2': 26, 'slip_atr_k': 0.14799503338831477, 'slip_spread_k': 0.04360543860678059, 'spread_hl_frac': 0.010266237392901383, 'bb_std_mult': 2.493640566102324, 'rsi_os': 26, 'rsi_ob': 62, 'vol_spike': 0.06308680447794321, 'adx_thresh': 12.022186693850191, 'atr_min_pct': 0.022523307393422686, 'atr_max_pct': 0.1236598725260266, 'tp_mult': 2.3666579088309803, 'tsl_mult': 0.8984974941552335, 'strategy': 'breakout', 'time_stop': 40, 'use_sma': False, 'use_atr': False, 'use_adx': True, 'use_ema': False, 'use_spike': True, 'rsi_required': False, 'edge_k': 1.708105240019574, 'edge_cap': 0.9171001347508457, 'bull_strategy': 'mean_reversion', 'bull_bb_std_mult': 3.409212592959755, 'bull_rsi_os': 14, 'bull_rsi_ob': 60, 'bull_adx_thresh': 26.685982026002854, 'bull_atr_min_pct': 0.002914215569635337, 'bull_atr_max_pct': 0.014346827633318834, 'bull_tp_mult': 1.6127701753867818, 'bull_tsl_mult': 0.8640153847157915, 'bull_time_stop': 201, 'bull_use_sma': True, 'bull_use_ema': False, 'bull_use_atr': True, 'bull_use_adx': False, 'bull_use_spike': False, 'bull_rsi_required': True, 'bear_strategy': 'mean_reversion', 'bear_bb_std_mult': 0.9202606651158832, 'bear_rsi_os': 9, 'bear_rsi_ob': 57, 'bear_adx_thresh': 20.218472796676203, 'bear_atr_min_pct': 0.024134954618610198, 'bear_atr_max_pct': 0.03908233121955389, 'bear_tp_mult': 2.7234915875961394, 'bear_tsl_mult': 0.24559706960098168, 'bear_time_stop': 144, 'bear_use_sma': False, 'bear_use_ema': True, 'bear_use_atr': True, 'bear_use_adx': True, 'bear_use_spike': True, 'bear_rsi_required': False, 'sideways_strategy': 'mean_reversion', 'sideways_bb_std_mult': 3.593412569592987, 'sideways_rsi_os': 27, 'sideways_rsi_ob': 52, 'sideways_adx_thresh': 27.800754963027288, 'sideways_atr_min_pct': 0.017854678145491, 'sideways_atr_max_pct': 0.054469565226247046, 'sideways_tp_mult': 2.1455533786130765, 'sideways_tsl_mult': 0.601888961958652, 'sideways_time_stop': 253, 'sideways_use_sma': False, 'sideways_use_ema': False, 'sideways_use_atr': True, 'sideways_use_adx': True, 'sideways_use_spike': False, 'sideways_rsi_required': False}.
[I 2025-08-31 05:12:03,133] Trial 592 finished with values: [-1000000000.0, 1000000000.0] and parameters: {'p_sma': 53, 'p_std': 25, 'p_atr': 24, 'p_adx': 9, 'rsi_period': 34, 'ema1': 15, 'ema2': 10, 'slip_atr_k': 0.13439500030064958, 'slip_spread_k': 0.023872585907462995, 'spread_hl_frac': 0.010329816794613747, 'bb_std_mult': 3.1503098165009433, 'rsi_os': 11, 'rsi_ob': 65, 'vol_spike': 0.012315433075126458, 'adx_thresh': 31.17304674861466, 'atr_min_pct': 0.013113713257908464, 'atr_max_pct': 0.12527061404099976, 'tp_mult': 2.7858201903490496, 'tsl_mult': 0.9312760989632841, 'strategy': 'breakout', 'time_stop': 57, 'use_sma': False, 'use_atr': False, 'use_adx': True, 'use_ema': False, 'use_spike': True, 'rsi_required': False, 'edge_k': 0.022534922627677534, 'edge_cap': 0.42980682817649574, 'bull_strategy': 'breakout', 'bull_bb_std_mult': 1.2115563769829913, 'bull_rsi_os': 24, 'bull_rsi_ob': 75, 'bull_adx_thresh': 21.517032658098667, 'bull_atr_min_pct': 0.0031114044037720287, 'bull_atr_max_pct': 0.04960084122529009, 'bull_tp_mult': 1.5827411455313274, 'bull_tsl_mult': 0.8702368227693157, 'bull_time_stop': 204, 'bull_use_sma': True, 'bull_use_ema': False, 'bull_use_atr': True, 'bull_use_adx': False, 'bull_use_spike': False, 'bull_rsi_required': True, 'bear_strategy': 'mean_reversion', 'bear_bb_std_mult': 2.0552475593642527, 'bear_rsi_os': 29, 'bear_rsi_ob': 50, 'bear_adx_thresh': 19.26864260676997, 'bear_atr_min_pct': 0.02274161846068303, 'bear_atr_max_pct': 0.10416479861716138, 'bear_tp_mult': 1.2801023744310627, 'bear_tsl_mult': 0.21394288142969392, 'bear_time_stop': 292, 'bear_use_sma': False, 'bear_use_ema': True, 'bear_use_atr': True, 'bear_use_adx': True, 'bear_use_spike': True, 'bear_rsi_required': True, 'sideways_strategy': 'mean_reversion', 'sideways_bb_std_mult': 0.8999811447250128, 'sideways_rsi_os': 31, 'sideways_rsi_ob': 88, 'sideways_adx_thresh': 10.550305914443493, 'sideways_atr_min_pct': 0.018752215194511625, 'sideways_atr_max_pct': 0.064686291916129, 'sideways_tp_mult': 2.1403336910320387, 'sideways_tsl_mult': 0.8746368079108573, 'sideways_time_stop': 137, 'sideways_use_sma': False, 'sideways_use_ema': False, 'sideways_use_atr': True, 'sideways_use_adx': True, 'sideways_use_spike': False, 'sideways_rsi_required': False}.
[I 2025-08-31 05:12:03,572] Trial 590 finished with values: [-1000000000.0, 1000000000.0] and parameters: {'p_sma': 35, 'p_std': 29, 'p_atr': 17, 'p_adx': 9, 'rsi_period': 40, 'ema1': 15, 'ema2': 29, 'slip_atr_k': 0.07987067938479647, 'slip_spread_k': 0.03697560802455591, 'spread_hl_frac': 0.03503202921050552, 'bb_std_mult': 1.8117455772548976, 'rsi_os': 27, 'rsi_ob': 58, 'vol_spike': 0.22790881214369857, 'adx_thresh': 18.78443741694347, 'atr_min_pct': 0.022479566354097532, 'atr_max_pct': 0.12799864560242552, 'tp_mult': 2.6179857057768294, 'tsl_mult': 0.9307295716742586, 'strategy': 'breakout', 'time_stop': 36, 'use_sma': False, 'use_atr': False, 'use_adx': True, 'use_ema': False, 'use_spike': True, 'rsi_required': False, 'edge_k': 0.010413149421962364, 'edge_cap': 0.6959863477812298, 'bull_strategy': 'mean_reversion', 'bull_bb_std_mult': 3.4360928109548743, 'bull_rsi_os': 24, 'bull_rsi_ob': 75, 'bull_adx_thresh': 11.922689676212396, 'bull_atr_min_pct': 0.003035563983528459, 'bull_atr_max_pct': 0.1358715305005362, 'bull_tp_mult': 1.5934076961290897, 'bull_tsl_mult': 0.2016039508416, 'bull_time_stop': 197, 'bull_use_sma': True, 'bull_use_ema': False, 'bull_use_atr': True, 'bull_use_adx': False, 'bull_use_spike': False, 'bull_rsi_required': True, 'bear_strategy': 'mean_reversion', 'bear_bb_std_mult': 0.8005675272695704, 'bear_rsi_os': 29, 'bear_rsi_ob': 49, 'bear_adx_thresh': 22.290867477795256, 'bear_atr_min_pct': 0.011744097177139725, 'bear_atr_max_pct': 0.10657707838327156, 'bear_tp_mult': 1.2896306411452825, 'bear_tsl_mult': 0.35272813109179546, 'bear_time_stop': 213, 'bear_use_sma': False, 'bear_use_ema': True, 'bear_use_atr': True, 'bear_use_adx': True, 'bear_use_spike': True, 'bear_rsi_required': True, 'sideways_strategy': 'mean_reversion', 'sideways_bb_std_mult': 0.9207696864432704, 'sideways_rsi_os': 27, 'sideways_rsi_ob': 62, 'sideways_adx_thresh': 10.667638787706423, 'sideways_atr_min_pct': 0.02605883976983017, 'sideways_atr_max_pct': 0.10654541035053719, 'sideways_tp_mult': 2.1377137517565568, 'sideways_tsl_mult': 0.6032166630665176, 'sideways_time_stop': 48, 'sideways_use_sma': False, 'sideways_use_ema': False, 'sideways_use_atr': True, 'sideways_use_adx': True, 'sideways_use_spike': False, 'sideways_rsi_required': False}.
[I 2025-08-31 05:12:04,055] Trial 591 finished with values: [-1000000000.0, 1000000000.0] and parameters: {'p_sma': 53, 'p_std': 37, 'p_atr': 17, 'p_adx': 13, 'rsi_period': 9, 'ema1': 14, 'ema2': 29, 'slip_atr_k': 0.04742742062964975, 'slip_spread_k': 0.10569001929284264, 'spread_hl_frac': 0.034824995023239234, 'bb_std_mult': 1.2381260433457795, 'rsi_os': 33, 'rsi_ob': 60, 'vol_spike': 0.22573407070750603, 'adx_thresh': 13.834982115876254, 'atr_min_pct': 0.02233310467122179, 'atr_max_pct': 0.11728424077840768, 'tp_mult': 2.604025006455864, 'tsl_mult': 0.552920252739579, 'strategy': 'breakout', 'time_stop': 254, 'use_sma': False, 'use_atr': False, 'use_adx': True, 'use_ema': False, 'use_spike': True, 'rsi_required': False, 'edge_k': 0.004483682384049836, 'edge_cap': 0.683051958930096, 'bull_strategy': 'mean_reversion', 'bull_bb_std_mult': 3.408948367398749, 'bull_rsi_os': 10, 'bull_rsi_ob': 75, 'bull_adx_thresh': 20.086525258415094, 'bull_atr_min_pct': 0.002961193465854714, 'bull_atr_max_pct': 0.1305763423574922, 'bull_tp_mult': 1.723361343779912, 'bull_tsl_mult': 0.8719844071711268, 'bull_time_stop': 136, 'bull_use_sma': True, 'bull_use_ema': False, 'bull_use_atr': True, 'bull_use_adx': False, 'bull_use_spike': False, 'bull_rsi_required': True, 'bear_strategy': 'mean_reversion', 'bear_bb_std_mult': 1.4331386427122992, 'bear_rsi_os': 21, 'bear_rsi_ob': 50, 'bear_adx_thresh': 22.493177118010653, 'bear_atr_min_pct': 0.02634979647555455, 'bear_atr_max_pct': 0.08969753816497181, 'bear_tp_mult': 1.4670475613152965, 'bear_tsl_mult': 0.9648888366713506, 'bear_time_stop': 212, 'bear_use_sma': False, 'bear_use_ema': True, 'bear_use_atr': True, 'bear_use_adx': True, 'bear_use_spike': True, 'bear_rsi_required': True, 'sideways_strategy': 'mean_reversion', 'sideways_bb_std_mult': 0.8972243782454077, 'sideways_rsi_os': 31, 'sideways_rsi_ob': 74, 'sideways_adx_thresh': 27.640854963369875, 'sideways_atr_min_pct': 0.012587470505868576, 'sideways_atr_max_pct': 0.054095139586380805, 'sideways_tp_mult': 2.148536368446538, 'sideways_tsl_mult': 0.5979499084014057, 'sideways_time_stop': 191, 'sideways_use_sma': False, 'sideways_use_ema': False, 'sideways_use_atr': True, 'sideways_use_adx': True, 'sideways_use_spike': False, 'sideways_rsi_required': False}.
[I 2025-08-31 05:12:04,294] Trial 593 finished with values: [-1000000000.0, 1000000000.0] and parameters: {'p_sma': 51, 'p_std': 20, 'p_atr': 17, 'p_adx': 9, 'rsi_period': 22, 'ema1': 8, 'ema2': 28, 'slip_atr_k': 0.03490546995623866, 'slip_spread_k': 0.8173610470539956, 'spread_hl_frac': 0.008336040328561086, 'bb_std_mult': 1.8194086147194417, 'rsi_os': 27, 'rsi_ob': 58, 'vol_spike': 0.22142011863521166, 'adx_thresh': 31.21422683919309, 'atr_min_pct': 0.016946878703835065, 'atr_max_pct': 0.08685749355700192, 'tp_mult': 2.6131437030013616, 'tsl_mult': 0.40416863309557216, 'strategy': 'breakout', 'time_stop': 58, 'use_sma': False, 'use_atr': False, 'use_adx': True, 'use_ema': False, 'use_spike': True, 'rsi_required': False, 'edge_k': 0.07798385191658763, 'edge_cap': 0.4318778241671425, 'bull_strategy': 'breakout', 'bull_bb_std_mult': 1.4403940069616334, 'bull_rsi_os': 24, 'bull_rsi_ob': 76, 'bull_adx_thresh': 11.926251769677044, 'bull_atr_min_pct': 0.019242893685918118, 'bull_atr_max_pct': 0.14618966301808112, 'bull_tp_mult': 1.714768249016269, 'bull_tsl_mult': 0.12863566587631164, 'bull_time_stop': 266, 'bull_use_sma': True, 'bull_use_ema': False, 'bull_use_atr': True, 'bull_use_adx': False, 'bull_use_spike': False, 'bull_rsi_required': True, 'bear_strategy': 'mean_reversion', 'bear_bb_std_mult': 2.027809708768843, 'bear_rsi_os': 6, 'bear_rsi_ob': 50, 'bear_adx_thresh': 21.178635966587493, 'bear_atr_min_pct': 5.698002826717494e-05, 'bear_atr_max_pct': 0.08888712530159575, 'bear_tp_mult': 2.8015444914007714, 'bear_tsl_mult': 0.9676688220102887, 'bear_time_stop': 197, 'bear_use_sma': False, 'bear_use_ema': True, 'bear_use_atr': True, 'bear_use_adx': False, 'bear_use_spike': True, 'bear_rsi_required': True, 'sideways_strategy': 'mean_reversion', 'sideways_bb_std_mult': 2.846573668044421, 'sideways_rsi_os': 28, 'sideways_rsi_ob': 83, 'sideways_adx_thresh': 10.537257786997955, 'sideways_atr_min_pct': 0.01278227836796427, 'sideways_atr_max_pct': 0.11175316992020412, 'sideways_tp_mult': 2.2024624726688784, 'sideways_tsl_mult': 0.8578422998334795, 'sideways_time_stop': 47, 'sideways_use_sma': False, 'sideways_use_ema': True, 'sideways_use_atr': True, 'sideways_use_adx': True, 'sideways_use_spike': False, 'sideways_rsi_required': False}.
