[I 2025-08-31 05:26:35,897] Trial 677 finished with values: [-1000000000.0, 1000000000.0] and parameters: {'p_sma': 58, 'p_std': 58, 'p_atr': 12, 'p_adx': 23, 'rsi_period': 21, 'ema1': 27, 'ema2': 36, 'slip_atr_k': 0.02108280938120993, 'slip_spread_k': 0.7415587779573043, 'spread_hl_frac': 0.00879323650182578, 'bb_std_mult': 3.2083681408709586, 'rsi_os': 11, 'rsi_ob': 49, 'vol_spike': 0.01808322581423978, 'adx_thresh': 8.82020261906155, 'atr_min_pct': 0.02484225613248145, 'atr_max_pct': 0.027444224739978956, 'tp_mult': 2.5068721969693946, 'tsl_mult': 0.7848341954192919, 'strategy': 'mean_reversion', 'time_stop': 24, 'use_sma': False, 'use_atr': True, 'use_adx': False, 'use_ema': False, 'use_spike': False, 'rsi_required': True, 'edge_k': 0.5046815997584096, 'edge_cap': 0.802048931244727, 'bull_strategy': 'mean_reversion', 'bull_bb_std_mult': 0.9667865588931321, 'bull_rsi_os': 40, 'bull_rsi_ob': 69, 'bull_adx_thresh': 10.154021351795766, 'bull_atr_min_pct': 0.009160662182778626, 'bull_atr_max_pct': 0.03806194496974176, 'bull_tp_mult': 1.686033548180231, 'bull_tsl_mult': 0.23634851767260717, 'bull_time_stop': 237, 'bull_use_sma': False, 'bull_use_ema': True, 'bull_use_atr': True, 'bull_use_adx': True, 'bull_use_spike': True, 'bull_rsi_required': False, 'bear_strategy': 'breakout', 'bear_bb_std_mult': 1.7991958108733195, 'bear_rsi_os': 13, 'bear_rsi_ob': 68, 'bear_adx_thresh': 31.800959682831863, 'bear_atr_min_pct': 0.006302448772017075, 'bear_atr_max_pct': 0.06488402912224765, 'bear_tp_mult': 1.4043235732674728, 'bear_tsl_mult': 0.020175970808853694, 'bear_time_stop': 291, 'bear_use_sma': True, 'bear_use_ema': False, 'bear_use_atr': True, 'bear_use_adx': False, 'bear_use_spike': False, 'bear_rsi_required': True, 'sideways_strategy': 'breakout', 'sideways_bb_std_mult': 1.2951216142949311, 'sideways_rsi_os': 38, 'sideways_rsi_ob': 54, 'sideways_adx_thresh': 21.924556564209116, 'sideways_atr_min_pct': 0.013979809848458794, 'sideways_atr_max_pct': 0.05493702006522428, 'sideways_tp_mult': 2.2577915940793223, 'sideways_tsl_mult': 0.4127445931040966, 'sideways_time_stop': 232, 'sideways_use_sma': False, 'sideways_use_ema': True, 'sideways_use_atr': False, 'sideways_use_adx': False, 'sideways_use_spike': True, 'sideways_rsi_required': True}.
[I 2025-08-31 05:26:52,428] Trial 675 finished with values: [-1000000000.0, 1000000000.0] and parameters: {'p_sma': 56, 'p_std': 56, 'p_atr': 16, 'p_adx': 23, 'rsi_period': 21, 'ema1': 26, 'ema2': 24, 'slip_atr_k': 0.14241557232002677, 'slip_spread_k': 0.691962549333839, 'spread_hl_frac': 0.00934747910583348, 'bb_std_mult': 3.223964177759396, 'rsi_os': 36, 'rsi_ob': 56, 'vol_spike': 0.017736393929659304, 'adx_thresh': 9.053943408702068, 'atr_min_pct': 0.02463653874257766, 'atr_max_pct': 0.1466918480393504, 'tp_mult': 2.5068105241394982, 'tsl_mult': 0.01807796508155146, 'strategy': 'mean_reversion', 'time_stop': 39, 'use_sma': False, 'use_atr': True, 'use_adx': False, 'use_ema': False, 'use_spike': True, 'rsi_required': True, 'edge_k': 0.519598505929118, 'edge_cap': 0.7493986411232407, 'bull_strategy': 'mean_reversion', 'bull_bb_std_mult': 0.8016867396354761, 'bull_rsi_os': 39, 'bull_rsi_ob': 80, 'bull_adx_thresh': 10.260739306544437, 'bull_atr_min_pct': 0.004063317173677392, 'bull_atr_max_pct': 0.03536028633502587, 'bull_tp_mult': 2.101857529283994, 'bull_tsl_mult': 0.6467109548329123, 'bull_time_stop': 240, 'bull_use_sma': False, 'bull_use_ema': True, 'bull_use_atr': True, 'bull_use_adx': True, 'bull_use_spike': True, 'bull_rsi_required': False, 'bear_strategy': 'breakout', 'bear_bb_std_mult': 0.927560802807256, 'bear_rsi_os': 12, 'bear_rsi_ob': 68, 'bear_adx_thresh': 29.1510293742017, 'bear_atr_min_pct': 0.006129074967027651, 'bear_atr_max_pct': 0.06581585380130983, 'bear_tp_mult': 1.1371292264355444, 'bear_tsl_mult': 0.18369770616387693, 'bear_time_stop': 250, 'bear_use_sma': True, 'bear_use_ema': False, 'bear_use_atr': True, 'bear_use_adx': False, 'bear_use_spike': False, 'bear_rsi_required': True, 'sideways_strategy': 'breakout', 'sideways_bb_std_mult': 1.2819224230136381, 'sideways_rsi_os': 38, 'sideways_rsi_ob': 63, 'sideways_adx_thresh': 24.475728305101615, 'sideways_atr_min_pct': 0.02008460234267482, 'sideways_atr_max_pct': 0.04220611445279197, 'sideways_tp_mult': 1.738678690706486, 'sideways_tsl_mult': 0.45659898660967047, 'sideways_time_stop': 230, 'sideways_use_sma': False, 'sideways_use_ema': True, 'sideways_use_atr': False, 'sideways_use_adx': False, 'sideways_use_spike': True, 'sideways_rsi_required': True}.
[I 2025-08-31 05:27:18,557] Trial 678 finished with values: [-1000000000.0, 1000000000.0] and parameters: {'p_sma': 58, 'p_std': 55, 'p_atr': 20, 'p_adx': 9, 'rsi_period': 21, 'ema1': 22, 'ema2': 25, 'slip_atr_k': 0.020063884043438264, 'slip_spread_k': 0.7230174877662272, 'spread_hl_frac': 0.011383319036183556, 'bb_std_mult': 2.66457241235127, 'rsi_os': 12, 'rsi_ob': 92, 'vol_spike': 0.016982878409780508, 'adx_thresh': 11.467473791021913, 'atr_min_pct': 0.02494335063636552, 'atr_max_pct': 0.08184727278237668, 'tp_mult': 1.316700831965413, 'tsl_mult': 0.7900933413331783, 'strategy': 'mean_reversion', 'time_stop': 23, 'use_sma': False, 'use_atr': True, 'use_adx': False, 'use_ema': False, 'use_spike': False, 'rsi_required': True, 'edge_k': 0.43525653940742015, 'edge_cap': 0.7933184668421509, 'bull_strategy': 'mean_reversion', 'bull_bb_std_mult': 0.9598761648365086, 'bull_rsi_os': 39, 'bull_rsi_ob': 79, 'bull_adx_thresh': 10.110472235273937, 'bull_atr_min_pct': 0.02999488967011374, 'bull_atr_max_pct': 0.03731440699933362, 'bull_tp_mult': 2.153192463367465, 'bull_tsl_mult': 0.5322532503574796, 'bull_time_stop': 241, 'bull_use_sma': False, 'bull_use_ema': True, 'bull_use_atr': True, 'bull_use_adx': True, 'bull_use_spike': True, 'bull_rsi_required': False, 'bear_strategy': 'breakout', 'bear_bb_std_mult': 0.8427090219362902, 'bear_rsi_os': 38, 'bear_rsi_ob': 71, 'bear_adx_thresh': 11.24157091127514, 'bear_atr_min_pct': 0.006433251023264748, 'bear_atr_max_pct': 0.12672012017015563, 'bear_tp_mult': 1.4126586057021686, 'bear_tsl_mult': 0.45897427878117475, 'bear_time_stop': 254, 'bear_use_sma': True, 'bear_use_ema': False, 'bear_use_atr': True, 'bear_use_adx': False, 'bear_use_spike': False, 'bear_rsi_required': True, 'sideways_strategy': 'breakout', 'sideways_bb_std_mult': 1.293114584040489, 'sideways_rsi_os': 38, 'sideways_rsi_ob': 62, 'sideways_adx_thresh': 27.105242355545364, 'sideways_atr_min_pct': 0.013913857462589524, 'sideways_atr_max_pct': 0.07594127934372502, 'sideways_tp_mult': 2.0850744138315904, 'sideways_tsl_mult': 0.420890915034308, 'sideways_time_stop': 233, 'sideways_use_sma': False, 'sideways_use_ema': True, 'sideways_use_atr': False, 'sideways_use_adx': False, 'sideways_use_spike': True, 'sideways_rsi_required': True}.
[I 2025-08-31 05:27:18,708] Trial 676 finished with values: [-1000000000.0, 1000000000.0] and parameters: {'p_sma': 58, 'p_std': 46, 'p_atr': 17, 'p_adx': 9, 'rsi_period': 21, 'ema1': 26, 'ema2': 39, 'slip_atr_k': 0.022258983558039975, 'slip_spread_k': 0.7111753466575295, 'spread_hl_frac': 0.008489769409743253, 'bb_std_mult': 3.0968134554401807, 'rsi_os': 22, 'rsi_ob': 56, 'vol_spike': 0.09335849888136498, 'adx_thresh': 9.093150819908706, 'atr_min_pct': 0.0247145929035748, 'atr_max_pct': 0.03568361465000403, 'tp_mult': 2.5076510167371695, 'tsl_mult': 0.7925003321687091, 'strategy': 'mean_reversion', 'time_stop': 39, 'use_sma': False, 'use_atr': True, 'use_adx': False, 'use_ema': False, 'use_spike': False, 'rsi_required': True, 'edge_k': 0.5269913961537784, 'edge_cap': 0.8091217974459677, 'bull_strategy': 'mean_reversion', 'bull_bb_std_mult': 0.9899142719718657, 'bull_rsi_os': 46, 'bull_rsi_ob': 80, 'bull_adx_thresh': 10.2840707896493, 'bull_atr_min_pct': 0.024344946268463143, 'bull_atr_max_pct': 0.03589208403409419, 'bull_tp_mult': 2.097208571474598, 'bull_tsl_mult': 0.4779411657180053, 'bull_time_stop': 270, 'bull_use_sma': False, 'bull_use_ema': True, 'bull_use_atr': True, 'bull_use_adx': True, 'bull_use_spike': True, 'bull_rsi_required': False, 'bear_strategy': 'breakout', 'bear_bb_std_mult': 1.6344638675325718, 'bear_rsi_os': 12, 'bear_rsi_ob': 69, 'bear_adx_thresh': 11.010846934458577, 'bear_atr_min_pct': 0.006266979856869696, 'bear_atr_max_pct': 0.06720388285425787, 'bear_tp_mult': 1.1372023374296414, 'bear_tsl_mult': 0.2199485565592884, 'bear_time_stop': 297, 'bear_use_sma': True, 'bear_use_ema': False, 'bear_use_atr': True, 'bear_use_adx': False, 'bear_use_spike': False, 'bear_rsi_required': True, 'sideways_strategy': 'breakout', 'sideways_bb_std_mult': 1.3022812591426849, 'sideways_rsi_os': 38, 'sideways_rsi_ob': 74, 'sideways_adx_thresh': 25.031874758318644, 'sideways_atr_min_pct': 0.02163596074536804, 'sideways_atr_max_pct': 0.03978174536432644, 'sideways_tp_mult': 2.083067032524268, 'sideways_tsl_mult': 0.41143542711466446, 'sideways_time_stop': 231, 'sideways_use_sma': False, 'sideways_use_ema': True, 'sideways_use_atr': False, 'sideways_use_adx': False, 'sideways_use_spike': True, 'sideways_rsi_required': True}.
[I 2025-08-31 05:27:20,003] Trial 679 finished with values: [-1000000000.0, 1000000000.0] and parameters: {'p_sma': 60, 'p_std': 36, 'p_atr': 14, 'p_adx': 9, 'rsi_period': 17, 'ema1': 22, 'ema2': 25, 'slip_atr_k': 0.08881673817357269, 'slip_spread_k': 0.8782565845454513, 'spread_hl_frac': 0.011249825981713056, 'bb_std_mult': 1.878786322089579, 'rsi_os': 35, 'rsi_ob': 60, 'vol_spike': 0.007396973103438618, 'adx_thresh': 9.429242652909569, 'atr_min_pct': 0.02263776652310512, 'atr_max_pct': 0.09636084872799972, 'tp_mult': 2.4286637141062646, 'tsl_mult': 0.16265621968306432, 'strategy': 'mean_reversion', 'time_stop': 156, 'use_sma': False, 'use_atr': True, 'use_adx': False, 'use_ema': True, 'use_spike': False, 'rsi_required': True, 'edge_k': 0.9272628787410971, 'edge_cap': 0.7671607419270524, 'bull_strategy': 'mean_reversion', 'bull_bb_std_mult': 0.9406653844852371, 'bull_rsi_os': 47, 'bull_rsi_ob': 79, 'bull_adx_thresh': 5.047519835106106, 'bull_atr_min_pct': 0.018967845623339957, 'bull_atr_max_pct': 0.08744806918602696, 'bull_tp_mult': 2.118345533988291, 'bull_tsl_mult': 0.8923788332479597, 'bull_time_stop': 273, 'bull_use_sma': False, 'bull_use_ema': False, 'bull_use_atr': True, 'bull_use_adx': True, 'bull_use_spike': True, 'bull_rsi_required': False, 'bear_strategy': 'breakout', 'bear_bb_std_mult': 1.629656780831464, 'bear_rsi_os': 8, 'bear_rsi_ob': 87, 'bear_adx_thresh': 29.9733461615912, 'bear_atr_min_pct': 0.009660679282901737, 'bear_atr_max_pct': 0.046395225616600734, 'bear_tp_mult': 1.121173595078841, 'bear_tsl_mult': 0.24780890215120613, 'bear_time_stop': 226, 'bear_use_sma': True, 'bear_use_ema': True, 'bear_use_atr': True, 'bear_use_adx': False, 'bear_use_spike': False, 'bear_rsi_required': True, 'sideways_strategy': 'breakout', 'sideways_bb_std_mult': 1.2239917842312167, 'sideways_rsi_os': 44, 'sideways_rsi_ob': 74, 'sideways_adx_thresh': 25.021134604317588, 'sideways_atr_min_pct': 0.02535522266047947, 'sideways_atr_max_pct': 0.07378317747359982, 'sideways_tp_mult': 2.846468221428967, 'sideways_tsl_mult': 0.46992275175654846, 'sideways_time_stop': 215, 'sideways_use_sma': False, 'sideways_use_ema': True, 'sideways_use_atr': False, 'sideways_use_adx': False, 'sideways_use_spike': True, 'sideways_rsi_required': True}.
[I 2025-08-31 05:27:24,354] Trial 682 finished with values: [-1000000000.0, 1000000000.0] and parameters: {'p_sma': 22, 'p_std': 14, 'p_atr': 14, 'p_adx': 9, 'rsi_period': 17, 'ema1': 23, 'ema2': 32, 'slip_atr_k': 0.24376809699093466, 'slip_spread_k': 0.7710737689609826, 'spread_hl_frac': 0.02238069645959357, 'bb_std_mult': 0.7797248103615435, 'rsi_os': 7, 'rsi_ob': 60, 'vol_spike': 0.008967607789098997, 'adx_thresh': 17.033780209509807, 'atr_min_pct': 0.026412088848911955, 'atr_max_pct': 0.01962406537132369, 'tp_mult': 2.4186401908995014, 'tsl_mult': 0.7600661455126538, 'strategy': 'mean_reversion', 'time_stop': 31, 'use_sma': False, 'use_atr': True, 'use_adx': True, 'use_ema': True, 'use_spike': True, 'rsi_required': True, 'edge_k': 0.3930577004127148, 'edge_cap': 0.7656977023245292, 'bull_strategy': 'mean_reversion', 'bull_bb_std_mult': 0.8999000617390543, 'bull_rsi_os': 55, 'bull_rsi_ob': 86, 'bull_adx_thresh': 7.556024893620608, 'bull_atr_min_pct': 0.019331665542849815, 'bull_atr_max_pct': 0.06834076371906225, 'bull_tp_mult': 1.1566559961855083, 'bull_tsl_mult': 0.11566090146900637, 'bull_time_stop': 274, 'bull_use_sma': True, 'bull_use_ema': False, 'bull_use_atr': True, 'bull_use_adx': False, 'bull_use_spike': False, 'bull_rsi_required': False, 'bear_strategy': 'breakout', 'bear_bb_std_mult': 0.7015189808840512, 'bear_rsi_os': 27, 'bear_rsi_ob': 66, 'bear_adx_thresh': 7.263807245720724, 'bear_atr_min_pct': 0.008224370683086353, 'bear_atr_max_pct': 0.03819327142197377, 'bear_tp_mult': 1.0423609961508116, 'bear_tsl_mult': 0.25300275929954924, 'bear_time_stop': 261, 'bear_use_sma': False, 'bear_use_ema': True, 'bear_use_atr': False, 'bear_use_adx': False, 'bear_use_spike': False, 'bear_rsi_required': True, 'sideways_strategy': 'breakout', 'sideways_bb_std_mult': 2.6677088897585812, 'sideways_rsi_os': 35, 'sideways_rsi_ob': 57, 'sideways_adx_thresh': 25.61456585851915, 'sideways_atr_min_pct': 0.014312089201219645, 'sideways_atr_max_pct': 0.017389640974676226, 'sideways_tp_mult': 2.0228438565927354, 'sideways_tsl_mult': 0.5432889411715675, 'sideways_time_stop': 217, 'sideways_use_sma': True, 'sideways_use_ema': True, 'sideways_use_atr': True, 'sideways_use_adx': False, 'sideways_use_spike': False, 'sideways_rsi_required': False}.
[I 2025-08-31 05:27:34,757] Trial 680 finished with values: [-1000000000.0, 1000000000.0] and parameters: {'p_sma': 37, 'p_std': 5, 'p_atr': 15, 'p_adx': 9, 'rsi_period': 16, 'ema1': 22, 'ema2': 13, 'slip_atr_k': 0.13259639405528587, 'slip_spread_k': 0.8088327964622657, 'spread_hl_frac': 0.01777963502189526, 'bb_std_mult': 3.4358782716920953, 'rsi_os': 42, 'rsi_ob': 60, 'vol_spike': 0.006932693332820672, 'adx_thresh': 30.48500084126774, 'atr_min_pct': 0.02257441980284354, 'atr_max_pct': 0.03397129398891433, 'tp_mult': 2.4263315916696553, 'tsl_mult': 0.8541293141389602, 'strategy': 'mean_reversion', 'time_stop': 31, 'use_sma': False, 'use_atr': True, 'use_adx': True, 'use_ema': True, 'use_spike': False, 'rsi_required': True, 'edge_k': 0.5720561779418082, 'edge_cap': 0.7626280569617467, 'bull_strategy': 'mean_reversion', 'bull_bb_std_mult': 0.9508375569032483, 'bull_rsi_os': 50, 'bull_rsi_ob': 46, 'bull_adx_thresh': 9.190066606845217, 'bull_atr_min_pct': 0.029561294588648916, 'bull_atr_max_pct': 0.06832903454056351, 'bull_tp_mult': 1.71630771248812, 'bull_tsl_mult': 0.5232704851188441, 'bull_time_stop': 292, 'bull_use_sma': True, 'bull_use_ema': False, 'bull_use_atr': True, 'bull_use_adx': False, 'bull_use_spike': False, 'bull_rsi_required': False, 'bear_strategy': 'breakout', 'bear_bb_std_mult': 0.7485139937835281, 'bear_rsi_os': 8, 'bear_rsi_ob': 78, 'bear_adx_thresh': 14.33802622182331, 'bear_atr_min_pct': 0.00822315264518002, 'bear_atr_max_pct': 0.11963745675515075, 'bear_tp_mult': 1.0555635059328092, 'bear_tsl_mult': 0.25855099287787664, 'bear_time_stop': 300, 'bear_use_sma': False, 'bear_use_ema': True, 'bear_use_atr': False, 'bear_use_adx': False, 'bear_use_spike': False, 'bear_rsi_required': True, 'sideways_strategy': 'breakout', 'sideways_bb_std_mult': 1.1411897137790947, 'sideways_rsi_os': 41, 'sideways_rsi_ob': 58, 'sideways_adx_thresh': 25.161385226708912, 'sideways_atr_min_pct': 0.014207494340404093, 'sideways_atr_max_pct': 0.016964670062714574, 'sideways_tp_mult': 2.08610340363298, 'sideways_tsl_mult': 0.5136428625185185, 'sideways_time_stop': 212, 'sideways_use_sma': False, 'sideways_use_ema': True, 'sideways_use_atr': True, 'sideways_use_adx': False, 'sideways_use_spike': False, 'sideways_rsi_required': False}.
[I 2025-08-31 05:28:02,662] Trial 681 finished with values: [-1000000000.0, 1000000000.0] and parameters: {'p_sma': 57, 'p_std': 12, 'p_atr': 14, 'p_adx': 9, 'rsi_period': 49, 'ema1': 28, 'ema2': 13, 'slip_atr_k': 0.054758975170145274, 'slip_spread_k': 0.8908173085120618, 'spread_hl_frac': 0.0493309666708522, 'bb_std_mult': 3.346415731587795, 'rsi_os': 33, 'rsi_ob': 60, 'vol_spike': 0.29937227590141435, 'adx_thresh': 9.595660198462106, 'atr_min_pct': 0.022791497039493368, 'atr_max_pct': 0.13647774247321787, 'tp_mult': 2.285053033469674, 'tsl_mult': 0.8524145842176959, 'strategy': 'mean_reversion', 'time_stop': 28, 'use_sma': False, 'use_atr': True, 'use_adx': True, 'use_ema': True, 'use_spike': True, 'rsi_required': True, 'edge_k': 0.29771203269909025, 'edge_cap': 0.7621432072794165, 'bull_strategy': 'mean_reversion', 'bull_bb_std_mult': 0.9567060498685873, 'bull_rsi_os': 54, 'bull_rsi_ob': 78, 'bull_adx_thresh': 7.524106788691499, 'bull_atr_min_pct': 0.007862094199694499, 'bull_atr_max_pct': 0.011621525895839892, 'bull_tp_mult': 1.7323462720633303, 'bull_tsl_mult': 0.9420945757998795, 'bull_time_stop': 271, 'bull_use_sma': True, 'bull_use_ema': False, 'bull_use_atr': True, 'bull_use_adx': False, 'bull_use_spike': False, 'bull_rsi_required': False, 'bear_strategy': 'breakout', 'bear_bb_std_mult': 0.6992897274092017, 'bear_rsi_os': 45, 'bear_rsi_ob': 80, 'bear_adx_thresh': 26.330692545327317, 'bear_atr_min_pct': 0.009608941222215752, 'bear_atr_max_pct': 0.046472671000029754, 'bear_tp_mult': 1.0718317037457852, 'bear_tsl_mult': 0.25782657729988595, 'bear_time_stop': 224, 'bear_use_sma': False, 'bear_use_ema': True, 'bear_use_atr': False, 'bear_use_adx': False, 'bear_use_spike': False, 'bear_rsi_required': True, 'sideways_strategy': 'breakout', 'sideways_bb_std_mult': 1.21739824706974, 'sideways_rsi_os': 41, 'sideways_rsi_ob': 57, 'sideways_adx_thresh': 25.038744115085215, 'sideways_atr_min_pct': 0.014324354818998238, 'sideways_atr_max_pct': 0.014852272760304264, 'sideways_tp_mult': 2.025514356579382, 'sideways_tsl_mult': 0.5417551708572037, 'sideways_time_stop': 219, 'sideways_use_sma': True, 'sideways_use_ema': True, 'sideways_use_atr': True, 'sideways_use_adx': False, 'sideways_use_spike': False, 'sideways_rsi_required': False}.
[I 2025-08-31 05:28:03,266] Trial 683 finished with values: [-1000000000.0, 1000000000.0] and parameters: {'p_sma': 22, 'p_std': 12, 'p_atr': 15, 'p_adx': 10, 'rsi_period': 16, 'ema1': 23, 'ema2': 32, 'slip_atr_k': 0.24599649545853308, 'slip_spread_k': 0.9262577559682901, 'spread_hl_frac': 0.026467220179398426, 'bb_std_mult': 0.7812887520861762, 'rsi_os': 44, 'rsi_ob': 57, 'vol_spike': 0.14448810692043906, 'adx_thresh': 12.575649397217253, 'atr_min_pct': 0.007109666239228941, 'atr_max_pct': 0.046874711945462694, 'tp_mult': 2.3600989685107034, 'tsl_mult': 0.8505120512000975, 'strategy': 'mean_reversion', 'time_stop': 32, 'use_sma': False, 'use_atr': True, 'use_adx': True, 'use_ema': True, 'use_spike': True, 'rsi_required': True, 'edge_k': 0.29964502479790756, 'edge_cap': 0.7706913273016867, 'bull_strategy': 'mean_reversion', 'bull_bb_std_mult': 0.8996745141248367, 'bull_rsi_os': 55, 'bull_rsi_ob': 78, 'bull_adx_thresh': 9.172830795361975, 'bull_atr_min_pct': 0.004548856251256539, 'bull_atr_max_pct': 0.011548769027015585, 'bull_tp_mult': 1.2973122866229492, 'bull_tsl_mult': 0.9459632553576905, 'bull_time_stop': 197, 'bull_use_sma': True, 'bull_use_ema': False, 'bull_use_atr': True, 'bull_use_adx': False, 'bull_use_spike': False, 'bull_rsi_required': False, 'bear_strategy': 'breakout', 'bear_bb_std_mult': 0.7210720043687203, 'bear_rsi_os': 27, 'bear_rsi_ob': 80, 'bear_adx_thresh': 10.423304464003154, 'bear_atr_min_pct': 0.00839672968361951, 'bear_atr_max_pct': 0.11074342721240227, 'bear_tp_mult': 1.3461025713087178, 'bear_tsl_mult': 0.25370919592532665, 'bear_time_stop': 264, 'bear_use_sma': False, 'bear_use_ema': True, 'bear_use_atr': False, 'bear_use_adx': False, 'bear_use_spike': False, 'bear_rsi_required': True, 'sideways_strategy': 'breakout', 'sideways_bb_std_mult': 1.7087274901141556, 'sideways_rsi_os': 41, 'sideways_rsi_ob': 55, 'sideways_adx_thresh': 26.240974112119638, 'sideways_atr_min_pct': 0.014360755321886933, 'sideways_atr_max_pct': 0.016901154437218766, 'sideways_tp_mult': 2.04649513033279, 'sideways_tsl_mult': 0.5416844704182706, 'sideways_time_stop': 211, 'sideways_use_sma': True, 'sideways_use_ema': True, 'sideways_use_atr': True, 'sideways_use_adx': False, 'sideways_use_spike': False, 'sideways_rsi_required': False}.
