[I 2025-08-31 04:06:04,687] Trial 249 finished with values: [-0.01369530410013542, 0.013624612454888765] and parameters: {'p_sma': 24, 'p_std': 16, 'p_atr': 16, 'p_adx': 9, 'rsi_period': 25, 'ema1': 27, 'ema2': 15, 'slip_atr_k': 0.08679426061487572, 'slip_spread_k': 0.0925297903246195, 'spread_hl_frac': 0.04612927934213912, 'bb_std_mult': 1.8020138930406082, 'rsi_os': 27, 'rsi_ob': 60, 'vol_spike': 0.01394279950754274, 'adx_thresh': 15.452661456769626, 'atr_min_pct': 0.0236113529457322, 'atr_max_pct': 0.12754397607739007, 'tp_mult': 2.53407804059699, 'tsl_mult': 0.9014308152236811, 'strategy': 'breakout', 'time_stop': 51, 'use_sma': False, 'use_atr': True, 'use_adx': False, 'use_ema': False, 'use_spike': True, 'rsi_required': False, 'edge_k': 1.9820160302398566, 'edge_cap': 0.9529286788053947, 'bull_strategy': 'mean_reversion', 'bull_bb_std_mult': 3.393397485006336, 'bull_rsi_os': 51, 'bull_rsi_ob': 76, 'bull_adx_thresh': 13.636191239294476, 'bull_atr_min_pct': 0.001261883885918218, 'bull_atr_max_pct': 0.043496463975324334, 'bull_tp_mult': 2.6030547015835155, 'bull_tsl_mult': 0.907270559245091, 'bull_time_stop': 25, 'bull_use_sma': False, 'bull_use_ema': False, 'bull_use_atr': True, 'bull_use_adx': True, 'bull_use_spike': False, 'bull_rsi_required': True, 'bear_strategy': 'mean_reversion', 'bear_bb_std_mult': 0.8230721945850898, 'bear_rsi_os': 7, 'bear_rsi_ob': 48, 'bear_adx_thresh': 8.846488390246234, 'bear_atr_min_pct': 0.022957813437606125, 'bear_atr_max_pct': 0.036885659609757, 'bear_tp_mult': 2.936560664087608, 'bear_tsl_mult': 0.049321687379798695, 'bear_time_stop': 69, 'bear_use_sma': True, 'bear_use_ema': True, 'bear_use_atr': True, 'bear_use_adx': True, 'bear_use_spike': True, 'bear_rsi_required': False, 'sideways_strategy': 'mean_reversion', 'sideways_bb_std_mult': 0.9743205397418824, 'sideways_rsi_os': 39, 'sideways_rsi_ob': 55, 'sideways_adx_thresh': 20.23591635217945, 'sideways_atr_min_pct': 0.014997495946588935, 'sideways_atr_max_pct': 0.0936912891442976, 'sideways_tp_mult': 1.9424211492493897, 'sideways_tsl_mult': 0.5865406764054214, 'sideways_time_stop': 70, 'sideways_use_sma': False, 'sideways_use_ema': False, 'sideways_use_atr': False, 'sideways_use_adx': True, 'sideways_use_spike': True, 'sideways_rsi_required': True}.
[I 2025-08-31 04:06:50,120] Trial 254 finished with values: [-1000000000.0, 1000000000.0] and parameters: {'p_sma': 9, 'p_std': 54, 'p_atr': 28, 'p_adx': 10, 'rsi_period': 22, 'ema1': 14, 'ema2': 11, 'slip_atr_k': 0.023862385168523646, 'slip_spread_k': 0.2364019948411773, 'spread_hl_frac': 0.010988427041040544, 'bb_std_mult': 2.5498053362005924, 'rsi_os': 30, 'rsi_ob': 59, 'vol_spike': 0.012187085215762767, 'adx_thresh': 5.129134370521054, 'atr_min_pct': 0.023386722898475695, 'atr_max_pct': 0.09226336630261002, 'tp_mult': 2.8372056881114944, 'tsl_mult': 0.5858212605429205, 'strategy': 'breakout', 'time_stop': 82, 'use_sma': True, 'use_atr': False, 'use_adx': False, 'use_ema': False, 'use_spike': True, 'rsi_required': True, 'edge_k': 1.456400040964299, 'edge_cap': 0.6806029711408705, 'bull_strategy': 'mean_reversion', 'bull_bb_std_mult': 0.5099770600740596, 'bull_rsi_os': 14, 'bull_rsi_ob': 80, 'bull_adx_thresh': 11.942832501883576, 'bull_atr_min_pct': 0.002911173444739841, 'bull_atr_max_pct': 0.04903457973708471, 'bull_tp_mult': 1.0336348527515784, 'bull_tsl_mult': 0.08025316735293747, 'bull_time_stop': 133, 'bull_use_sma': False, 'bull_use_ema': False, 'bull_use_atr': False, 'bull_use_adx': True, 'bull_use_spike': False, 'bull_rsi_required': True, 'bear_strategy': 'mean_reversion', 'bear_bb_std_mult': 2.4923858206373803, 'bear_rsi_os': 40, 'bear_rsi_ob': 53, 'bear_adx_thresh': 8.966365320335445, 'bear_atr_min_pct': 0.024266613797424872, 'bear_atr_max_pct': 0.03900924323866166, 'bear_tp_mult': 2.590776573393904, 'bear_tsl_mult': 0.2410240534380326, 'bear_time_stop': 206, 'bear_use_sma': True, 'bear_use_ema': True, 'bear_use_atr': True, 'bear_use_adx': True, 'bear_use_spike': True, 'bear_rsi_required': True, 'sideways_strategy': 'mean_reversion', 'sideways_bb_std_mult': 1.0576678802271093, 'sideways_rsi_os': 29, 'sideways_rsi_ob': 68, 'sideways_adx_thresh': 12.736607186575654, 'sideways_atr_min_pct': 0.013983487932524732, 'sideways_atr_max_pct': 0.12067463917985867, 'sideways_tp_mult': 1.9393605630512758, 'sideways_tsl_mult': 0.6453098563873892, 'sideways_time_stop': 63, 'sideways_use_sma': False, 'sideways_use_ema': False, 'sideways_use_atr': False, 'sideways_use_adx': True, 'sideways_use_spike': True, 'sideways_rsi_required': True}.
[I 2025-08-31 04:06:50,801] Trial 253 finished with values: [-1000000000.0, 1000000000.0] and parameters: {'p_sma': 24, 'p_std': 58, 'p_atr': 10, 'p_adx': 8, 'rsi_period': 24, 'ema1': 14, 'ema2': 11, 'slip_atr_k': 0.028928575402702748, 'slip_spread_k': 0.23001803101377144, 'spread_hl_frac': 0.03645232301243578, 'bb_std_mult': 1.908102792144638, 'rsi_os': 30, 'rsi_ob': 58, 'vol_spike': 0.031863068250749346, 'adx_thresh': 14.74888047653098, 'atr_min_pct': 0.02331499153469694, 'atr_max_pct': 0.1288707464455391, 'tp_mult': 2.4079605399365374, 'tsl_mult': 0.8531285248682934, 'strategy': 'breakout', 'time_stop': 60, 'use_sma': True, 'use_atr': True, 'use_adx': False, 'use_ema': False, 'use_spike': True, 'rsi_required': False, 'edge_k': 1.454827828041321, 'edge_cap': 0.9988804014628976, 'bull_strategy': 'mean_reversion', 'bull_bb_std_mult': 2.0093071345974467, 'bull_rsi_os': 16, 'bull_rsi_ob': 76, 'bull_adx_thresh': 11.890263936238762, 'bull_atr_min_pct': 0.01695194248169057, 'bull_atr_max_pct': 0.04805715383765126, 'bull_tp_mult': 1.062685802063939, 'bull_tsl_mult': 0.07019518618304776, 'bull_time_stop': 133, 'bull_use_sma': False, 'bull_use_ema': False, 'bull_use_atr': False, 'bull_use_adx': True, 'bull_use_spike': False, 'bull_rsi_required': True, 'bear_strategy': 'mean_reversion', 'bear_bb_std_mult': 0.8201620748041616, 'bear_rsi_os': 8, 'bear_rsi_ob': 93, 'bear_adx_thresh': 18.66473427528296, 'bear_atr_min_pct': 0.02212713983484759, 'bear_atr_max_pct': 0.04644904204829104, 'bear_tp_mult': 2.8496239761735978, 'bear_tsl_mult': 0.23387245253830086, 'bear_time_stop': 68, 'bear_use_sma': True, 'bear_use_ema': True, 'bear_use_atr': True, 'bear_use_adx': True, 'bear_use_spike': True, 'bear_rsi_required': False, 'sideways_strategy': 'mean_reversion', 'sideways_bb_std_mult': 1.0683646647147784, 'sideways_rsi_os': 29, 'sideways_rsi_ob': 68, 'sideways_adx_thresh': 20.13018102678808, 'sideways_atr_min_pct': 0.014996821002580672, 'sideways_atr_max_pct': 0.10746950619975469, 'sideways_tp_mult': 2.262245581443254, 'sideways_tsl_mult': 0.9661520964196483, 'sideways_time_stop': 63, 'sideways_use_sma': False, 'sideways_use_ema': False, 'sideways_use_atr': False, 'sideways_use_adx': True, 'sideways_use_spike': True, 'sideways_rsi_required': True}.
[I 2025-08-31 04:06:51,201] Trial 255 finished with values: [-1000000000.0, 1000000000.0] and parameters: {'p_sma': 56, 'p_std': 14, 'p_atr': 16, 'p_adx': 18, 'rsi_period': 71, 'ema1': 10, 'ema2': 11, 'slip_atr_k': 0.08464902225960255, 'slip_spread_k': 0.0741632645463755, 'spread_hl_frac': 0.010900664890100576, 'bb_std_mult': 2.544650775742, 'rsi_os': 27, 'rsi_ob': 59, 'vol_spike': 0.03139630344146141, 'adx_thresh': 9.179911454694045, 'atr_min_pct': 0.016533040567167815, 'atr_max_pct': 0.10862076598524008, 'tp_mult': 2.4054764607747035, 'tsl_mult': 0.8550226650228641, 'strategy': 'breakout', 'time_stop': 49, 'use_sma': True, 'use_atr': False, 'use_adx': False, 'use_ema': False, 'use_spike': True, 'rsi_required': True, 'edge_k': 1.459729995979458, 'edge_cap': 0.9984678861681214, 'bull_strategy': 'mean_reversion', 'bull_bb_std_mult': 3.4679985313068475, 'bull_rsi_os': 14, 'bull_rsi_ob': 80, 'bull_adx_thresh': 9.710182965379975, 'bull_atr_min_pct': 0.002668111595128408, 'bull_atr_max_pct': 0.04866881781844907, 'bull_tp_mult': 1.033342092798094, 'bull_tsl_mult': 0.4168423530194403, 'bull_time_stop': 135, 'bull_use_sma': False, 'bull_use_ema': False, 'bull_use_atr': False, 'bull_use_adx': True, 'bull_use_spike': False, 'bull_rsi_required': True, 'bear_strategy': 'mean_reversion', 'bear_bb_std_mult': 2.4354405254813623, 'bear_rsi_os': 10, 'bear_rsi_ob': 53, 'bear_adx_thresh': 8.527897477162433, 'bear_atr_min_pct': 0.024329145519627674, 'bear_atr_max_pct': 0.09485722580596286, 'bear_tp_mult': 2.60974687814355, 'bear_tsl_mult': 0.8934180832599221, 'bear_time_stop': 141, 'bear_use_sma': True, 'bear_use_ema': True, 'bear_use_atr': True, 'bear_use_adx': True, 'bear_use_spike': True, 'bear_rsi_required': True, 'sideways_strategy': 'mean_reversion', 'sideways_bb_std_mult': 1.0733571858877216, 'sideways_rsi_os': 31, 'sideways_rsi_ob': 53, 'sideways_adx_thresh': 12.953485877121478, 'sideways_atr_min_pct': 0.02818093381205695, 'sideways_atr_max_pct': 0.12040490644323992, 'sideways_tp_mult': 1.9379615719689895, 'sideways_tsl_mult': 0.6440472846706421, 'sideways_time_stop': 63, 'sideways_use_sma': False, 'sideways_use_ema': False, 'sideways_use_atr': False, 'sideways_use_adx': True, 'sideways_use_spike': True, 'sideways_rsi_required': True}.
[I 2025-08-31 04:06:51,491] Trial 256 finished with values: [-1000000000.0, 1000000000.0] and parameters: {'p_sma': 56, 'p_std': 14, 'p_atr': 28, 'p_adx': 18, 'rsi_period': 22, 'ema1': 10, 'ema2': 59, 'slip_atr_k': 0.024917227304834283, 'slip_spread_k': 0.22899750549267384, 'spread_hl_frac': 0.01081976044171198, 'bb_std_mult': 2.017776803076631, 'rsi_os': 30, 'rsi_ob': 62, 'vol_spike': 0.012449028152402437, 'adx_thresh': 8.222893221821256, 'atr_min_pct': 0.023438210758474024, 'atr_max_pct': 0.0933329568907395, 'tp_mult': 2.410576894325434, 'tsl_mult': 0.44622908545864015, 'strategy': 'breakout', 'time_stop': 49, 'use_sma': True, 'use_atr': False, 'use_adx': False, 'use_ema': False, 'use_spike': True, 'rsi_required': True, 'edge_k': 1.447669005492759, 'edge_cap': 0.21643828049437802, 'bull_strategy': 'mean_reversion', 'bull_bb_std_mult': 1.5173522221359412, 'bull_rsi_os': 24, 'bull_rsi_ob': 80, 'bull_adx_thresh': 26.14165368811564, 'bull_atr_min_pct': 0.0030076307455687177, 'bull_atr_max_pct': 0.048219359421883115, 'bull_tp_mult': 1.124507310572251, 'bull_tsl_mult': 0.07461693452073764, 'bull_time_stop': 133, 'bull_use_sma': False, 'bull_use_ema': False, 'bull_use_atr': False, 'bull_use_adx': True, 'bull_use_spike': False, 'bull_rsi_required': True, 'bear_strategy': 'mean_reversion', 'bear_bb_std_mult': 0.7292259059949474, 'bear_rsi_os': 55, 'bear_rsi_ob': 53, 'bear_adx_thresh': 30.772224118430664, 'bear_atr_min_pct': 0.02226768194711062, 'bear_atr_max_pct': 0.0943284256906435, 'bear_tp_mult': 2.571222379547874, 'bear_tsl_mult': 0.2258284177492096, 'bear_time_stop': 139, 'bear_use_sma': True, 'bear_use_ema': True, 'bear_use_atr': True, 'bear_use_adx': True, 'bear_use_spike': True, 'bear_rsi_required': True, 'sideways_strategy': 'mean_reversion', 'sideways_bb_std_mult': 1.0881828297086795, 'sideways_rsi_os': 29, 'sideways_rsi_ob': 53, 'sideways_adx_thresh': 12.415529251405603, 'sideways_atr_min_pct': 0.02837171500132308, 'sideways_atr_max_pct': 0.11973536236127671, 'sideways_tp_mult': 1.9546670243400928, 'sideways_tsl_mult': 0.6412349754837766, 'sideways_time_stop': 74, 'sideways_use_sma': False, 'sideways_use_ema': False, 'sideways_use_atr': False, 'sideways_use_adx': True, 'sideways_use_spike': True, 'sideways_rsi_required': True}.
[I 2025-08-31 04:07:32,718] Trial 257 finished with values: [-1000000000.0, 1000000000.0] and parameters: {'p_sma': 56, 'p_std': 14, 'p_atr': 25, 'p_adx': 29, 'rsi_period': 24, 'ema1': 14, 'ema2': 60, 'slip_atr_k': 0.08832674538667526, 'slip_spread_k': 0.08413201167135655, 'spread_hl_frac': 0.009874632044071577, 'bb_std_mult': 2.4468479629106366, 'rsi_os': 26, 'rsi_ob': 63, 'vol_spike': 0.06338640259760905, 'adx_thresh': 15.067956948390611, 'atr_min_pct': 0.003823420161846775, 'atr_max_pct': 0.10883633171328881, 'tp_mult': 1.0680040009150589, 'tsl_mult': 0.6623695776641214, 'strategy': 'breakout', 'time_stop': 48, 'use_sma': False, 'use_atr': False, 'use_adx': False, 'use_ema': False, 'use_spike': True, 'rsi_required': False, 'edge_k': 1.9500482462722144, 'edge_cap': 0.9960347549458453, 'bull_strategy': 'mean_reversion', 'bull_bb_std_mult': 3.428084465011498, 'bull_rsi_os': 15, 'bull_rsi_ob': 79, 'bull_adx_thresh': 9.668066783315885, 'bull_atr_min_pct': 0.002177819210917527, 'bull_atr_max_pct': 0.04206402339535205, 'bull_tp_mult': 1.0844635965933112, 'bull_tsl_mult': 0.41705187419569467, 'bull_time_stop': 135, 'bull_use_sma': False, 'bull_use_ema': False, 'bull_use_atr': True, 'bull_use_adx': False, 'bull_use_spike': False, 'bull_rsi_required': True, 'bear_strategy': 'mean_reversion', 'bear_bb_std_mult': 1.0376809849391448, 'bear_rsi_os': 10, 'bear_rsi_ob': 93, 'bear_adx_thresh': 32.70663868472107, 'bear_atr_min_pct': 0.023223518589165364, 'bear_atr_max_pct': 0.04543738801969295, 'bear_tp_mult': 2.5525246227683307, 'bear_tsl_mult': 0.8884426126331793, 'bear_time_stop': 233, 'bear_use_sma': False, 'bear_use_ema': True, 'bear_use_atr': True, 'bear_use_adx': True, 'bear_use_spike': True, 'bear_rsi_required': True, 'sideways_strategy': 'mean_reversion', 'sideways_bb_std_mult': 1.0690118265452533, 'sideways_rsi_os': 15, 'sideways_rsi_ob': 53, 'sideways_adx_thresh': 32.80940494234649, 'sideways_atr_min_pct': 0.021057790038735702, 'sideways_atr_max_pct': 0.11346906576874857, 'sideways_tp_mult': 1.9480579801996742, 'sideways_tsl_mult': 0.6220031216776273, 'sideways_time_stop': 75, 'sideways_use_sma': False, 'sideways_use_ema': False, 'sideways_use_atr': False, 'sideways_use_adx': True, 'sideways_use_spike': True, 'sideways_rsi_required': False}.
[I 2025-08-31 04:07:33,026] Trial 258 finished with values: [-1000000000.0, 1000000000.0] and parameters: {'p_sma': 56, 'p_std': 30, 'p_atr': 23, 'p_adx': 27, 'rsi_period': 68, 'ema1': 27, 'ema2': 59, 'slip_atr_k': 0.016651482460275056, 'slip_spread_k': 0.07193823801382593, 'spread_hl_frac': 0.0459989926551357, 'bb_std_mult': 2.435064483605582, 'rsi_os': 54, 'rsi_ob': 61, 'vol_spike': 0.02280315998875722, 'adx_thresh': 8.27457548797088, 'atr_min_pct': 0.006597723295777996, 'atr_max_pct': 0.11321499578079053, 'tp_mult': 2.4646537680312903, 'tsl_mult': 0.44244231772455284, 'strategy': 'breakout', 'time_stop': 47, 'use_sma': False, 'use_atr': False, 'use_adx': False, 'use_ema': False, 'use_spike': True, 'rsi_required': True, 'edge_k': 1.250038832061967, 'edge_cap': 0.9493633688823082, 'bull_strategy': 'mean_reversion', 'bull_bb_std_mult': 2.2233975056569046, 'bull_rsi_os': 24, 'bull_rsi_ob': 72, 'bull_adx_thresh': 8.221008004577584, 'bull_atr_min_pct': 0.002109391078396745, 'bull_atr_max_pct': 0.04052253511948375, 'bull_tp_mult': 1.7021276390918316, 'bull_tsl_mult': 0.621058673266581, 'bull_time_stop': 240, 'bull_use_sma': False, 'bull_use_ema': True, 'bull_use_atr': True, 'bull_use_adx': False, 'bull_use_spike': False, 'bull_rsi_required': True, 'bear_strategy': 'mean_reversion', 'bear_bb_std_mult': 2.9152275524760283, 'bear_rsi_os': 43, 'bear_rsi_ob': 45, 'bear_adx_thresh': 19.466098275608076, 'bear_atr_min_pct': 0.023527248614124044, 'bear_atr_max_pct': 0.041148193343558244, 'bear_tp_mult': 2.607709458774742, 'bear_tsl_mult': 0.26566072668333546, 'bear_time_stop': 232, 'bear_use_sma': False, 'bear_use_ema': False, 'bear_use_atr': True, 'bear_use_adx': True, 'bear_use_spike': False, 'bear_rsi_required': True, 'sideways_strategy': 'mean_reversion', 'sideways_bb_std_mult': 1.0725834505208744, 'sideways_rsi_os': 41, 'sideways_rsi_ob': 63, 'sideways_adx_thresh': 32.79522385407594, 'sideways_atr_min_pct': 0.012856228512464499, 'sideways_atr_max_pct': 0.11463287632405271, 'sideways_tp_mult': 1.95929948881811, 'sideways_tsl_mult': 0.6209682956320296, 'sideways_time_stop': 212, 'sideways_use_sma': False, 'sideways_use_ema': False, 'sideways_use_atr': False, 'sideways_use_adx': True, 'sideways_use_spike': True, 'sideways_rsi_required': False}.
[I 2025-08-31 04:07:33,188] Trial 260 finished with values: [-0.02570635456874537, 0.02567245700161667] and parameters: {'p_sma': 54, 'p_std': 24, 'p_atr': 8, 'p_adx': 27, 'rsi_period': 20, 'ema1': 6, 'ema2': 32, 'slip_atr_k': 0.016265473937619665, 'slip_spread_k': 0.6458510335874152, 'spread_hl_frac': 0.04630982144122593, 'bb_std_mult': 1.80701410960325, 'rsi_os': 28, 'rsi_ob': 71, 'vol_spike': 0.023443891256401037, 'adx_thresh': 15.1912369568583, 'atr_min_pct': 0.024023213805484913, 'atr_max_pct': 0.1130991078701639, 'tp_mult': 1.9874659468389908, 'tsl_mult': 0.8167465828552858, 'strategy': 'breakout', 'time_stop': 39, 'use_sma': False, 'use_atr': False, 'use_adx': False, 'use_ema': False, 'use_spike': True, 'rsi_required': False, 'edge_k': 0.06843284821452122, 'edge_cap': 0.9679790790527609, 'bull_strategy': 'mean_reversion', 'bull_bb_std_mult': 3.4131371575165046, 'bull_rsi_os': 14, 'bull_rsi_ob': 54, 'bull_adx_thresh': 25.39454087873814, 'bull_atr_min_pct': 0.01952667364238129, 'bull_atr_max_pct': 0.04113982199462719, 'bull_tp_mult': 2.1286970408076122, 'bull_tsl_mult': 0.8934621309430052, 'bull_time_stop': 73, 'bull_use_sma': False, 'bull_use_ema': True, 'bull_use_atr': True, 'bull_use_adx': False, 'bull_use_spike': False, 'bull_rsi_required': True, 'bear_strategy': 'mean_reversion', 'bear_bb_std_mult': 1.0390225796353547, 'bear_rsi_os': 42, 'bear_rsi_ob': 47, 'bear_adx_thresh': 26.30393475380431, 'bear_atr_min_pct': 0.023459733280622834, 'bear_atr_max_pct': 0.04177624327157978, 'bear_tp_mult': 1.8563311075237472, 'bear_tsl_mult': 0.25611782864274013, 'bear_time_stop': 202, 'bear_use_sma': False, 'bear_use_ema': False, 'bear_use_atr': True, 'bear_use_adx': True, 'bear_use_spike': False, 'bear_rsi_required': True, 'sideways_strategy': 'mean_reversion', 'sideways_bb_std_mult': 1.0010133384408546, 'sideways_rsi_os': 26, 'sideways_rsi_ob': 54, 'sideways_adx_thresh': 18.412984202345996, 'sideways_atr_min_pct': 0.0017835597253619846, 'sideways_atr_max_pct': 0.1142340440773171, 'sideways_tp_mult': 1.9643600845948381, 'sideways_tsl_mult': 0.6213265534416194, 'sideways_time_stop': 107, 'sideways_use_sma': False, 'sideways_use_ema': False, 'sideways_use_atr': False, 'sideways_use_adx': True, 'sideways_use_spike': True, 'sideways_rsi_required': False}.
[I 2025-08-31 04:07:33,197] Trial 259 finished with values: [-1000000000.0, 1000000000.0] and parameters: {'p_sma': 34, 'p_std': 24, 'p_atr': 9, 'p_adx': 9, 'rsi_period': 23, 'ema1': 12, 'ema2': 31, 'slip_atr_k': 0.09996675632709386, 'slip_spread_k': 0.09259210175468521, 'spread_hl_frac': 0.00956773108041505, 'bb_std_mult': 1.7849671447683064, 'rsi_os': 25, 'rsi_ob': 62, 'vol_spike': 0.025721260501535406, 'adx_thresh': 8.104195415840785, 'atr_min_pct': 0.007782048327798454, 'atr_max_pct': 0.1129755018402008, 'tp_mult': 2.4596086361698437, 'tsl_mult': 0.9959524259986898, 'strategy': 'breakout', 'time_stop': 39, 'use_sma': False, 'use_atr': False, 'use_adx': False, 'use_ema': False, 'use_spike': True, 'rsi_required': False, 'edge_k': 0.0027512973949708197, 'edge_cap': 0.9518562916563195, 'bull_strategy': 'mean_reversion', 'bull_bb_std_mult': 2.3761609726662045, 'bull_rsi_os': 15, 'bull_rsi_ob': 79, 'bull_adx_thresh': 26.159023659366284, 'bull_atr_min_pct': 0.019455181918355678, 'bull_atr_max_pct': 0.040991269777813644, 'bull_tp_mult': 1.2718311110702958, 'bull_tsl_mult': 0.8783934697712585, 'bull_time_stop': 145, 'bull_use_sma': False, 'bull_use_ema': True, 'bull_use_atr': True, 'bull_use_adx': False, 'bull_use_spike': False, 'bull_rsi_required': True, 'bear_strategy': 'mean_reversion', 'bear_bb_std_mult': 1.0336026933189475, 'bear_rsi_os': 50, 'bear_rsi_ob': 47, 'bear_adx_thresh': 30.76430594090936, 'bear_atr_min_pct': 0.016476778051427315, 'bear_atr_max_pct': 0.04131261824492526, 'bear_tp_mult': 1.8769142621626305, 'bear_tsl_mult': 0.19354990130535893, 'bear_time_stop': 232, 'bear_use_sma': False, 'bear_use_ema': False, 'bear_use_atr': True, 'bear_use_adx': True, 'bear_use_spike': False, 'bear_rsi_required': True, 'sideways_strategy': 'mean_reversion', 'sideways_bb_std_mult': 1.004253089243194, 'sideways_rsi_os': 34, 'sideways_rsi_ob': 54, 'sideways_adx_thresh': 11.518308601159807, 'sideways_atr_min_pct': 0.021171590151091074, 'sideways_atr_max_pct': 0.114070353902205, 'sideways_tp_mult': 1.9712905169675623, 'sideways_tsl_mult': 0.622566623122776, 'sideways_time_stop': 74, 'sideways_use_sma': False, 'sideways_use_ema': False, 'sideways_use_atr': False, 'sideways_use_adx': True, 'sideways_use_spike': True, 'sideways_rsi_required': False}.
