[I 2025-08-31 03:55:03,792] Trial 177 finished with values: [-1000000000.0, 1000000000.0] and parameters: {'p_sma': 7, 'p_std': 15, 'p_atr': 25, 'p_adx': 21, 'rsi_period': 29, 'ema1': 15, 'ema2': 29, 'slip_atr_k': 0.16830453013373714, 'slip_spread_k': 0.3852933657124651, 'spread_hl_frac': 0.02674138749342665, 'bb_std_mult': 2.5849004655993695, 'rsi_os': 21, 'rsi_ob': 57, 'vol_spike': 0.00033591563708994243, 'adx_thresh': 27.892362139197612, 'atr_min_pct': 0.00018145678006393356, 'atr_max_pct': 0.1499704616335248, 'tp_mult': 2.319082309028901, 'tsl_mult': 0.6824555834247465, 'strategy': 'breakout', 'time_stop': 14, 'use_sma': True, 'use_atr': False, 'use_adx': False, 'use_ema': True, 'use_spike': False, 'rsi_required': False, 'edge_k': 1.706159038244166, 'edge_cap': 0.9113414681750395, 'bull_strategy': 'breakout', 'bull_bb_std_mult': 1.1185870736605619, 'bull_rsi_os': 39, 'bull_rsi_ob': 68, 'bull_adx_thresh': 22.046516809979, 'bull_atr_min_pct': 0.00122635080832088, 'bull_atr_max_pct': 0.06203734018036047, 'bull_tp_mult': 2.279478959831475, 'bull_tsl_mult': 0.9911570658277008, 'bull_time_stop': 165, 'bull_use_sma': False, 'bull_use_ema': False, 'bull_use_atr': False, 'bull_use_adx': True, 'bull_use_spike': True, 'bull_rsi_required': False, 'bear_strategy': 'mean_reversion', 'bear_bb_std_mult': 0.5027544988514998, 'bear_rsi_os': 20, 'bear_rsi_ob': 95, 'bear_adx_thresh': 21.30497324705861, 'bear_atr_min_pct': 0.007803964412892414, 'bear_atr_max_pct': 0.13903793682878957, 'bear_tp_mult': 2.871282180673801, 'bear_tsl_mult': 0.12006573820310551, 'bear_time_stop': 203, 'bear_use_sma': True, 'bear_use_ema': True, 'bear_use_atr': True, 'bear_use_adx': False, 'bear_use_spike': True, 'bear_rsi_required': True, 'sideways_strategy': 'mean_reversion', 'sideways_bb_std_mult': 2.3149995973087334, 'sideways_rsi_os': 14, 'sideways_rsi_ob': 50, 'sideways_adx_thresh': 14.958297642885263, 'sideways_atr_min_pct': 0.015888261973313292, 'sideways_atr_max_pct': 0.1435594001134288, 'sideways_tp_mult': 2.0865761318210607, 'sideways_tsl_mult': 0.5220868072121475, 'sideways_time_stop': 276, 'sideways_use_sma': False, 'sideways_use_ema': False, 'sideways_use_atr': False, 'sideways_use_adx': True, 'sideways_use_spike': True, 'sideways_rsi_required': True}.
[I 2025-08-31 03:55:33,225] Trial 184 finished with values: [-0.016517280671304646, 0.016465567376609785] and parameters: {'p_sma': 58, 'p_std': 34, 'p_atr': 18, 'p_adx': 9, 'rsi_period': 26, 'ema1': 16, 'ema2': 27, 'slip_atr_k': 0.12874845663074128, 'slip_spread_k': 0.3472165113417529, 'spread_hl_frac': 0.004090391136787774, 'bb_std_mult': 1.6848458874409293, 'rsi_os': 16, 'rsi_ob': 69, 'vol_spike': 0.013911289160305582, 'adx_thresh': 25.49650095600766, 'atr_min_pct': 0.022836535884365836, 'atr_max_pct': 0.02509962864436617, 'tp_mult': 2.2450159992769265, 'tsl_mult': 0.5493413501045343, 'strategy': 'breakout', 'time_stop': 45, 'use_sma': False, 'use_atr': False, 'use_adx': False, 'use_ema': True, 'use_spike': False, 'rsi_required': False, 'edge_k': 1.6393129115849607, 'edge_cap': 0.9442492257828897, 'bull_strategy': 'mean_reversion', 'bull_bb_std_mult': 0.9535319814297063, 'bull_rsi_os': 19, 'bull_rsi_ob': 71, 'bull_adx_thresh': 21.23983653963941, 'bull_atr_min_pct': 0.0005777963155837239, 'bull_atr_max_pct': 0.12391526957923978, 'bull_tp_mult': 2.079335235689692, 'bull_tsl_mult': 0.8838870851847649, 'bull_time_stop': 138, 'bull_use_sma': False, 'bull_use_ema': False, 'bull_use_atr': True, 'bull_use_adx': True, 'bull_use_spike': True, 'bull_rsi_required': True, 'bear_strategy': 'mean_reversion', 'bear_bb_std_mult': 0.6647358379841521, 'bear_rsi_os': 28, 'bear_rsi_ob': 59, 'bear_adx_thresh': 7.198516355229646, 'bear_atr_min_pct': 0.00928627187031896, 'bear_atr_max_pct': 0.04246125550772494, 'bear_tp_mult': 2.499661385413761, 'bear_tsl_mult': 0.25013157503954075, 'bear_time_stop': 184, 'bear_use_sma': True, 'bear_use_ema': True, 'bear_use_atr': True, 'bear_use_adx': False, 'bear_use_spike': True, 'bear_rsi_required': True, 'sideways_strategy': 'mean_reversion', 'sideways_bb_std_mult': 2.246083980169483, 'sideways_rsi_os': 30, 'sideways_rsi_ob': 56, 'sideways_adx_thresh': 11.193026826270533, 'sideways_atr_min_pct': 0.013932233079400263, 'sideways_atr_max_pct': 0.015185275747421206, 'sideways_tp_mult': 2.6905604928489155, 'sideways_tsl_mult': 0.18775868981744218, 'sideways_time_stop': 140, 'sideways_use_sma': False, 'sideways_use_ema': False, 'sideways_use_atr': False, 'sideways_use_adx': True, 'sideways_use_spike': True, 'sideways_rsi_required': True}.
[I 2025-08-31 03:55:33,532] Trial 181 finished with values: [-1000000000.0, 1000000000.0] and parameters: {'p_sma': 57, 'p_std': 13, 'p_atr': 26, 'p_adx': 17, 'rsi_period': 56, 'ema1': 29, 'ema2': 11, 'slip_atr_k': 0.12921373322721946, 'slip_spread_k': 0.20720864808795025, 'spread_hl_frac': 0.004472006081608155, 'bb_std_mult': 1.7758267552753961, 'rsi_os': 15, 'rsi_ob': 62, 'vol_spike': 0.24993735855702506, 'adx_thresh': 13.064784392964246, 'atr_min_pct': 0.01806400198565024, 'atr_max_pct': 0.1498183105070432, 'tp_mult': 2.6149718381472087, 'tsl_mult': 0.7444862538441436, 'strategy': 'breakout', 'time_stop': 131, 'use_sma': False, 'use_atr': False, 'use_adx': False, 'use_ema': True, 'use_spike': False, 'rsi_required': False, 'edge_k': 1.6357508763764148, 'edge_cap': 0.9995245924038575, 'bull_strategy': 'breakout', 'bull_bb_std_mult': 2.0979499589882127, 'bull_rsi_os': 39, 'bull_rsi_ob': 80, 'bull_adx_thresh': 8.333313912983028, 'bull_atr_min_pct': 0.00127224649513134, 'bull_atr_max_pct': 0.12360518232667547, 'bull_tp_mult': 1.235414203029789, 'bull_tsl_mult': 0.8533548961799574, 'bull_time_stop': 165, 'bull_use_sma': False, 'bull_use_ema': False, 'bull_use_atr': True, 'bull_use_adx': True, 'bull_use_spike': True, 'bull_rsi_required': False, 'bear_strategy': 'mean_reversion', 'bear_bb_std_mult': 0.6648376732704513, 'bear_rsi_os': 17, 'bear_rsi_ob': 95, 'bear_adx_thresh': 25.350821888389422, 'bear_atr_min_pct': 0.010700605282721378, 'bear_atr_max_pct': 0.13927653940095777, 'bear_tp_mult': 2.4294915588320127, 'bear_tsl_mult': 0.12324562605298903, 'bear_time_stop': 185, 'bear_use_sma': True, 'bear_use_ema': True, 'bear_use_atr': True, 'bear_use_adx': False, 'bear_use_spike': True, 'bear_rsi_required': True, 'sideways_strategy': 'mean_reversion', 'sideways_bb_std_mult': 2.231820349425574, 'sideways_rsi_os': 31, 'sideways_rsi_ob': 66, 'sideways_adx_thresh': 7.129776037288531, 'sideways_atr_min_pct': 0.015469642977302678, 'sideways_atr_max_pct': 0.10157649170226558, 'sideways_tp_mult': 2.616133235668308, 'sideways_tsl_mult': 0.11340523192484495, 'sideways_time_stop': 29, 'sideways_use_sma': False, 'sideways_use_ema': False, 'sideways_use_atr': False, 'sideways_use_adx': True, 'sideways_use_spike': True, 'sideways_rsi_required': True}.
[I 2025-08-31 03:55:33,689] Trial 183 finished with values: [-0.011510622908711632, 0.011446790471239553] and parameters: {'p_sma': 57, 'p_std': 16, 'p_atr': 25, 'p_adx': 9, 'rsi_period': 26, 'ema1': 15, 'ema2': 28, 'slip_atr_k': 0.022050460115814144, 'slip_spread_k': 0.09798038383943708, 'spread_hl_frac': 0.01041609197811003, 'bb_std_mult': 1.7877778394829045, 'rsi_os': 28, 'rsi_ob': 60, 'vol_spike': 0.015998542980635827, 'adx_thresh': 25.985780137287538, 'atr_min_pct': 0.022793461004671355, 'atr_max_pct': 0.1434021628265753, 'tp_mult': 2.4343624736336515, 'tsl_mult': 0.8805160659968485, 'strategy': 'breakout', 'time_stop': 159, 'use_sma': False, 'use_atr': False, 'use_adx': False, 'use_ema': True, 'use_spike': False, 'rsi_required': False, 'edge_k': 1.5839296938874194, 'edge_cap': 0.998221173254926, 'bull_strategy': 'breakout', 'bull_bb_std_mult': 3.238100228891713, 'bull_rsi_os': 15, 'bull_rsi_ob': 78, 'bull_adx_thresh': 8.897027454886143, 'bull_atr_min_pct': 0.0007422707816179783, 'bull_atr_max_pct': 0.045417830934347855, 'bull_tp_mult': 1.5989672626430291, 'bull_tsl_mult': 0.8735637064651617, 'bull_time_stop': 138, 'bull_use_sma': False, 'bull_use_ema': False, 'bull_use_atr': True, 'bull_use_adx': True, 'bull_use_spike': True, 'bull_rsi_required': False, 'bear_strategy': 'mean_reversion', 'bear_bb_std_mult': 0.70078531767043, 'bear_rsi_os': 22, 'bear_rsi_ob': 48, 'bear_adx_thresh': 21.181578718334052, 'bear_atr_min_pct': 0.029238706257608528, 'bear_atr_max_pct': 0.04078519273674092, 'bear_tp_mult': 2.626182827382425, 'bear_tsl_mult': 0.2545836444749733, 'bear_time_stop': 184, 'bear_use_sma': True, 'bear_use_ema': True, 'bear_use_atr': True, 'bear_use_adx': False, 'bear_use_spike': True, 'bear_rsi_required': True, 'sideways_strategy': 'mean_reversion', 'sideways_bb_std_mult': 1.165018790051616, 'sideways_rsi_os': 15, 'sideways_rsi_ob': 56, 'sideways_adx_thresh': 10.904232548838571, 'sideways_atr_min_pct': 0.014479529028653524, 'sideways_atr_max_pct': 0.11331371819199816, 'sideways_tp_mult': 2.0856796350399534, 'sideways_tsl_mult': 0.512455164783942, 'sideways_time_stop': 56, 'sideways_use_sma': False, 'sideways_use_ema': False, 'sideways_use_atr': False, 'sideways_use_adx': True, 'sideways_use_spike': True, 'sideways_rsi_required': True}.
[I 2025-08-31 03:55:33,760] Trial 182 finished with values: [-1000000000.0, 1000000000.0] and parameters: {'p_sma': 57, 'p_std': 13, 'p_atr': 26, 'p_adx': 9, 'rsi_period': 27, 'ema1': 15, 'ema2': 30, 'slip_atr_k': 0.13013934742780106, 'slip_spread_k': 0.3373255060644177, 'spread_hl_frac': 0.0043770967441234265, 'bb_std_mult': 3.077537184278429, 'rsi_os': 16, 'rsi_ob': 60, 'vol_spike': 0.014343577791615053, 'adx_thresh': 13.50974504598809, 'atr_min_pct': 0.02294489507277242, 'atr_max_pct': 0.11351620366499647, 'tp_mult': 2.434195846977038, 'tsl_mult': 0.5399976478375861, 'strategy': 'breakout', 'time_stop': 12, 'use_sma': False, 'use_atr': False, 'use_adx': False, 'use_ema': True, 'use_spike': False, 'rsi_required': False, 'edge_k': 1.5942626472832402, 'edge_cap': 0.8849866570264353, 'bull_strategy': 'breakout', 'bull_bb_std_mult': 3.288346859797278, 'bull_rsi_os': 55, 'bull_rsi_ob': 80, 'bull_adx_thresh': 18.89498651948324, 'bull_atr_min_pct': 0.0037104033046889105, 'bull_atr_max_pct': 0.1236679477459646, 'bull_tp_mult': 1.2356197187979787, 'bull_tsl_mult': 0.8573306188684764, 'bull_time_stop': 64, 'bull_use_sma': False, 'bull_use_ema': False, 'bull_use_atr': True, 'bull_use_adx': True, 'bull_use_spike': True, 'bull_rsi_required': False, 'bear_strategy': 'mean_reversion', 'bear_bb_std_mult': 0.6502326950415139, 'bear_rsi_os': 22, 'bear_rsi_ob': 51, 'bear_adx_thresh': 21.257176190903326, 'bear_atr_min_pct': 0.02910662982595768, 'bear_atr_max_pct': 0.1467275492825795, 'bear_tp_mult': 2.8149284774164336, 'bear_tsl_mult': 0.4047430606512672, 'bear_time_stop': 119, 'bear_use_sma': True, 'bear_use_ema': True, 'bear_use_atr': True, 'bear_use_adx': False, 'bear_use_spike': True, 'bear_rsi_required': True, 'sideways_strategy': 'mean_reversion', 'sideways_bb_std_mult': 1.165295636509262, 'sideways_rsi_os': 15, 'sideways_rsi_ob': 57, 'sideways_adx_thresh': 7.400232079361553, 'sideways_atr_min_pct': 0.014124722138022953, 'sideways_atr_max_pct': 0.10512638974512632, 'sideways_tp_mult': 2.622749725048396, 'sideways_tsl_mult': 0.06840562895254726, 'sideways_time_stop': 48, 'sideways_use_sma': False, 'sideways_use_ema': False, 'sideways_use_atr': False, 'sideways_use_adx': True, 'sideways_use_spike': True, 'sideways_rsi_required': True}.
[I 2025-08-31 03:56:02,260] Trial 185 finished with values: [-1000000000.0, 1000000000.0] and parameters: {'p_sma': 57, 'p_std': 35, 'p_atr': 18, 'p_adx': 18, 'rsi_period': 25, 'ema1': 16, 'ema2': 23, 'slip_atr_k': 0.18135670948096375, 'slip_spread_k': 0.33954102925968666, 'spread_hl_frac': 0.0039780268458098275, 'bb_std_mult': 2.06642608510821, 'rsi_os': 16, 'rsi_ob': 60, 'vol_spike': 0.24305634164540546, 'adx_thresh': 26.12818125653606, 'atr_min_pct': 0.017926930105160492, 'atr_max_pct': 0.14390295250026475, 'tp_mult': 2.4325416730477576, 'tsl_mult': 0.7455458842917132, 'strategy': 'breakout', 'time_stop': 122, 'use_sma': False, 'use_atr': False, 'use_adx': False, 'use_ema': True, 'use_spike': False, 'rsi_required': False, 'edge_k': 1.6495367454287917, 'edge_cap': 0.9999796190536909, 'bull_strategy': 'breakout', 'bull_bb_std_mult': 1.3682010960538256, 'bull_rsi_os': 55, 'bull_rsi_ob': 49, 'bull_adx_thresh': 8.478570024466265, 'bull_atr_min_pct': 0.0007482809564560975, 'bull_atr_max_pct': 0.0564422979264491, 'bull_tp_mult': 2.09501714823706, 'bull_tsl_mult': 0.9003508868785824, 'bull_time_stop': 66, 'bull_use_sma': False, 'bull_use_ema': False, 'bull_use_atr': True, 'bull_use_adx': True, 'bull_use_spike': True, 'bull_rsi_required': False, 'bear_strategy': 'mean_reversion', 'bear_bb_std_mult': 0.6775949876106566, 'bear_rsi_os': 9, 'bear_rsi_ob': 47, 'bear_adx_thresh': 31.311084011424946, 'bear_atr_min_pct': 0.02867620062501902, 'bear_atr_max_pct': 0.14324130669992807, 'bear_tp_mult': 2.494009983920255, 'bear_tsl_mult': 0.45150079019971884, 'bear_time_stop': 294, 'bear_use_sma': True, 'bear_use_ema': True, 'bear_use_atr': True, 'bear_use_adx': True, 'bear_use_spike': True, 'bear_rsi_required': True, 'sideways_strategy': 'mean_reversion', 'sideways_bb_std_mult': 2.227814039597046, 'sideways_rsi_os': 28, 'sideways_rsi_ob': 56, 'sideways_adx_thresh': 10.43887573310064, 'sideways_atr_min_pct': 0.020471303157040738, 'sideways_atr_max_pct': 0.0368161716503894, 'sideways_tp_mult': 2.637096904568496, 'sideways_tsl_mult': 0.05980489887838891, 'sideways_time_stop': 265, 'sideways_use_sma': False, 'sideways_use_ema': False, 'sideways_use_atr': False, 'sideways_use_adx': True, 'sideways_use_spike': True, 'sideways_rsi_required': True}.
[I 2025-08-31 03:56:02,399] Trial 186 finished with values: [-1000000000.0, 1000000000.0] and parameters: {'p_sma': 13, 'p_std': 15, 'p_atr': 18, 'p_adx': 9, 'rsi_period': 24, 'ema1': 16, 'ema2': 21, 'slip_atr_k': 0.04078022067446796, 'slip_spread_k': 0.34809160633886627, 'spread_hl_frac': 0.02471177281010927, 'bb_std_mult': 1.660744759181025, 'rsi_os': 17, 'rsi_ob': 62, 'vol_spike': 0.08406345569845279, 'adx_thresh': 25.9677551071801, 'atr_min_pct': 0.02193113800595331, 'atr_max_pct': 0.026712971153375516, 'tp_mult': 2.4321989293969484, 'tsl_mult': 0.5554962248578456, 'strategy': 'breakout', 'time_stop': 161, 'use_sma': False, 'use_atr': False, 'use_adx': False, 'use_ema': False, 'use_spike': True, 'rsi_required': False, 'edge_k': 1.592395649343257, 'edge_cap': 0.9407743306554418, 'bull_strategy': 'mean_reversion', 'bull_bb_std_mult': 1.3693280468180205, 'bull_rsi_os': 55, 'bull_rsi_ob': 47, 'bull_adx_thresh': 14.055955304175964, 'bull_atr_min_pct': 0.0037739573136031717, 'bull_atr_max_pct': 0.048899729184392324, 'bull_tp_mult': 2.055693131202281, 'bull_tsl_mult': 0.8952008062663659, 'bull_time_stop': 103, 'bull_use_sma': False, 'bull_use_ema': False, 'bull_use_atr': True, 'bull_use_adx': True, 'bull_use_spike': False, 'bull_rsi_required': False, 'bear_strategy': 'mean_reversion', 'bear_bb_std_mult': 0.6507546581382238, 'bear_rsi_os': 36, 'bear_rsi_ob': 60, 'bear_adx_thresh': 21.199195054117034, 'bear_atr_min_pct': 0.00946603879217435, 'bear_atr_max_pct': 0.04357061255889896, 'bear_tp_mult': 2.483612749349674, 'bear_tsl_mult': 0.40312976635320635, 'bear_time_stop': 179, 'bear_use_sma': True, 'bear_use_ema': True, 'bear_use_atr': True, 'bear_use_adx': True, 'bear_use_spike': True, 'bear_rsi_required': True, 'sideways_strategy': 'mean_reversion', 'sideways_bb_std_mult': 0.6016745061761186, 'sideways_rsi_os': 28, 'sideways_rsi_ob': 56, 'sideways_adx_thresh': 10.38258534355418, 'sideways_atr_min_pct': 0.0202868236515562, 'sideways_atr_max_pct': 0.1126110560360338, 'sideways_tp_mult': 1.9156986510649658, 'sideways_tsl_mult': 0.18370266678865638, 'sideways_time_stop': 266, 'sideways_use_sma': False, 'sideways_use_ema': False, 'sideways_use_atr': False, 'sideways_use_adx': True, 'sideways_use_spike': True, 'sideways_rsi_required': True}.
[I 2025-08-31 03:56:02,622] Trial 188 finished with values: [-0.010428600886335015, 0.010373152984902208] and parameters: {'p_sma': 55, 'p_std': 16, 'p_atr': 24, 'p_adx': 9, 'rsi_period': 23, 'ema1': 14, 'ema2': 26, 'slip_atr_k': 0.020026881987980357, 'slip_spread_k': 0.09219971282051745, 'spread_hl_frac': 0.010467044516436295, 'bb_std_mult': 1.890078835149012, 'rsi_os': 29, 'rsi_ob': 60, 'vol_spike': 0.022706334558910576, 'adx_thresh': 11.606381873110967, 'atr_min_pct': 0.022961759788007293, 'atr_max_pct': 0.12328402289531909, 'tp_mult': 2.502047281201034, 'tsl_mult': 0.8766467527269319, 'strategy': 'breakout', 'time_stop': 46, 'use_sma': False, 'use_atr': False, 'use_adx': False, 'use_ema': False, 'use_spike': True, 'rsi_required': False, 'edge_k': 1.4638481185197545, 'edge_cap': 0.9983187971665654, 'bull_strategy': 'mean_reversion', 'bull_bb_std_mult': 3.4784958334862606, 'bull_rsi_os': 14, 'bull_rsi_ob': 77, 'bull_adx_thresh': 11.252528693639057, 'bull_atr_min_pct': 0.0019564116027154395, 'bull_atr_max_pct': 0.04632294229872496, 'bull_tp_mult': 1.6099978082540647, 'bull_tsl_mult': 0.8910001785874911, 'bull_time_stop': 138, 'bull_use_sma': False, 'bull_use_ema': False, 'bull_use_atr': True, 'bull_use_adx': True, 'bull_use_spike': False, 'bull_rsi_required': True, 'bear_strategy': 'mean_reversion', 'bear_bb_std_mult': 0.9123236357683443, 'bear_rsi_os': 9, 'bear_rsi_ob': 47, 'bear_adx_thresh': 20.38255242724084, 'bear_atr_min_pct': 0.023736585975539706, 'bear_atr_max_pct': 0.042590417435269, 'bear_tp_mult': 2.7353713334860035, 'bear_tsl_mult': 0.23823782273413108, 'bear_time_stop': 196, 'bear_use_sma': True, 'bear_use_ema': True, 'bear_use_atr': True, 'bear_use_adx': True, 'bear_use_spike': True, 'bear_rsi_required': True, 'sideways_strategy': 'mean_reversion', 'sideways_bb_std_mult': 1.0491744304798707, 'sideways_rsi_os': 27, 'sideways_rsi_ob': 54, 'sideways_adx_thresh': 11.182287335185416, 'sideways_atr_min_pct': 0.013825564556639422, 'sideways_atr_max_pct': 0.11475793323889455, 'sideways_tp_mult': 1.9820359652923507, 'sideways_tsl_mult': 0.6243961279549886, 'sideways_time_stop': 64, 'sideways_use_sma': False, 'sideways_use_ema': False, 'sideways_use_atr': False, 'sideways_use_adx': True, 'sideways_use_spike': True, 'sideways_rsi_required': True}.
[I 2025-08-31 03:56:02,718] Trial 187 finished with values: [-0.010564018517947305, 0.010508454090033127] and parameters: {'p_sma': 55, 'p_std': 18, 'p_atr': 24, 'p_adx': 9, 'rsi_period': 23, 'ema1': 13, 'ema2': 27, 'slip_atr_k': 0.022371945665781743, 'slip_spread_k': 0.07966637872823762, 'spread_hl_frac': 0.009414253405403203, 'bb_std_mult': 1.8663674673898858, 'rsi_os': 29, 'rsi_ob': 60, 'vol_spike': 0.02628692258986874, 'adx_thresh': 11.947324104673452, 'atr_min_pct': 0.023043878528028867, 'atr_max_pct': 0.13593585899948418, 'tp_mult': 2.509827510635849, 'tsl_mult': 0.8932839642553037, 'strategy': 'breakout', 'time_stop': 179, 'use_sma': False, 'use_atr': False, 'use_adx': False, 'use_ema': False, 'use_spike': True, 'rsi_required': False, 'edge_k': 1.4412284625918428, 'edge_cap': 0.9997690128649361, 'bull_strategy': 'mean_reversion', 'bull_bb_std_mult': 3.493170571454977, 'bull_rsi_os': 11, 'bull_rsi_ob': 78, 'bull_adx_thresh': 13.670363473920409, 'bull_atr_min_pct': 0.0019394605541370935, 'bull_atr_max_pct': 0.020918567513881117, 'bull_tp_mult': 1.6028713620130628, 'bull_tsl_mult': 0.896576382438349, 'bull_time_stop': 138, 'bull_use_sma': False, 'bull_use_ema': False, 'bull_use_atr': True, 'bull_use_adx': True, 'bull_use_spike': False, 'bull_rsi_required': True, 'bear_strategy': 'mean_reversion', 'bear_bb_std_mult': 0.9339567263016628, 'bear_rsi_os': 15, 'bear_rsi_ob': 47, 'bear_adx_thresh': 20.441161711290217, 'bear_atr_min_pct': 0.02685815489331934, 'bear_atr_max_pct': 0.04203974277611898, 'bear_tp_mult': 2.7330218730916287, 'bear_tsl_mult': 0.2611347201027061, 'bear_time_stop': 196, 'bear_use_sma': True, 'bear_use_ema': True, 'bear_use_atr': True, 'bear_use_adx': True, 'bear_use_spike': True, 'bear_rsi_required': True, 'sideways_strategy': 'mean_reversion', 'sideways_bb_std_mult': 0.6327050718076912, 'sideways_rsi_os': 29, 'sideways_rsi_ob': 55, 'sideways_adx_thresh': 11.182384346400852, 'sideways_atr_min_pct': 0.013726513583123715, 'sideways_atr_max_pct': 0.1138427707214861, 'sideways_tp_mult': 1.9814693596620603, 'sideways_tsl_mult': 0.6804968845734328, 'sideways_time_stop': 67, 'sideways_use_sma': False, 'sideways_use_ema': False, 'sideways_use_atr': False, 'sideways_use_adx': True, 'sideways_use_spike': True, 'sideways_rsi_required': True}.
