[I 2025-08-31 05:39:48,344] Trial 753 finished with values: [-1000000000.0, 1000000000.0] and parameters: {'p_sma': 40, 'p_std': 6, 'p_atr': 17, 'p_adx': 9, 'rsi_period': 73, 'ema1': 24, 'ema2': 24, 'slip_atr_k': 0.01609632736478958, 'slip_spread_k': 0.7024126936716315, 'spread_hl_frac': 0.04835804127772054, 'bb_std_mult': 1.981046986449314, 'rsi_os': 23, 'rsi_ob': 63, 'vol_spike': 0.03960941620889013, 'adx_thresh': 25.08781019745914, 'atr_min_pct': 0.020147734303193016, 'atr_max_pct': 0.03897664170212759, 'tp_mult': 2.3935891417599424, 'tsl_mult': 0.5728119980724219, 'strategy': 'mean_reversion', 'time_stop': 16, 'use_sma': False, 'use_atr': True, 'use_adx': False, 'use_ema': False, 'use_spike': True, 'rsi_required': True, 'edge_k': 1.0288297672953903, 'edge_cap': 0.7853866447077699, 'bull_strategy': 'breakout', 'bull_bb_std_mult': 0.7302745698217099, 'bull_rsi_os': 44, 'bull_rsi_ob': 80, 'bull_adx_thresh': 9.14473205853446, 'bull_atr_min_pct': 0.02295028424783996, 'bull_atr_max_pct': 0.129236149505422, 'bull_tp_mult': 2.741075183497407, 'bull_tsl_mult': 0.8956751826209075, 'bull_time_stop': 204, 'bull_use_sma': False, 'bull_use_ema': False, 'bull_use_atr': True, 'bull_use_adx': True, 'bull_use_spike': False, 'bull_rsi_required': False, 'bear_strategy': 'breakout', 'bear_bb_std_mult': 0.6343423986081311, 'bear_rsi_os': 10, 'bear_rsi_ob': 61, 'bear_adx_thresh': 8.62297434485592, 'bear_atr_min_pct': 0.0280900046352753, 'bear_atr_max_pct': 0.023066551081672562, 'bear_tp_mult': 1.4719836679728622, 'bear_tsl_mult': 0.195304838494098, 'bear_time_stop': 126, 'bear_use_sma': True, 'bear_use_ema': True, 'bear_use_atr': True, 'bear_use_adx': False, 'bear_use_spike': False, 'bear_rsi_required': False, 'sideways_strategy': 'breakout', 'sideways_bb_std_mult': 2.7646198877386166, 'sideways_rsi_os': 35, 'sideways_rsi_ob': 55, 'sideways_adx_thresh': 20.916548767942146, 'sideways_atr_min_pct': 0.025558119646570725, 'sideways_atr_max_pct': 0.061354655087882695, 'sideways_tp_mult': 2.7593267421403604, 'sideways_tsl_mult': 0.4658833557884004, 'sideways_time_stop': 185, 'sideways_use_sma': True, 'sideways_use_ema': True, 'sideways_use_atr': False, 'sideways_use_adx': False, 'sideways_use_spike': True, 'sideways_rsi_required': True}.
[I 2025-08-31 05:40:33,420] Trial 757 finished with values: [-1000000000.0, 1000000000.0] and parameters: {'p_sma': 56, 'p_std': 14, 'p_atr': 14, 'p_adx': 11, 'rsi_period': 23, 'ema1': 24, 'ema2': 31, 'slip_atr_k': 0.15477497206021926, 'slip_spread_k': 0.6680682208186816, 'spread_hl_frac': 0.017420960536024058, 'bb_std_mult': 2.0969736824758622, 'rsi_os': 26, 'rsi_ob': 62, 'vol_spike': 0.2857380145271175, 'adx_thresh': 10.798813373838827, 'atr_min_pct': 0.021558441350000485, 'atr_max_pct': 0.09367785699822366, 'tp_mult': 2.5146024609017634, 'tsl_mult': 0.411806362329204, 'strategy': 'mean_reversion', 'time_stop': 19, 'use_sma': False, 'use_atr': True, 'use_adx': False, 'use_ema': False, 'use_spike': True, 'rsi_required': True, 'edge_k': 0.8214678975409411, 'edge_cap': 0.5333344294632887, 'bull_strategy': 'breakout', 'bull_bb_std_mult': 2.6766504237224544, 'bull_rsi_os': 38, 'bull_rsi_ob': 69, 'bull_adx_thresh': 6.763989687449946, 'bull_atr_min_pct': 0.018133940613367962, 'bull_atr_max_pct': 0.019990064178772683, 'bull_tp_mult': 1.6207551176581938, 'bull_tsl_mult': 0.29869766325092256, 'bull_time_stop': 285, 'bull_use_sma': False, 'bull_use_ema': False, 'bull_use_atr': True, 'bull_use_adx': True, 'bull_use_spike': False, 'bull_rsi_required': False, 'bear_strategy': 'breakout', 'bear_bb_std_mult': 2.2756210848385434, 'bear_rsi_os': 21, 'bear_rsi_ob': 79, 'bear_adx_thresh': 22.626380507888996, 'bear_atr_min_pct': 0.028180313926269136, 'bear_atr_max_pct': 0.09829335752349487, 'bear_tp_mult': 1.4544794791815465, 'bear_tsl_mult': 0.1895006379348396, 'bear_time_stop': 5, 'bear_use_sma': True, 'bear_use_ema': True, 'bear_use_atr': True, 'bear_use_adx': False, 'bear_use_spike': False, 'bear_rsi_required': True, 'sideways_strategy': 'breakout', 'sideways_bb_std_mult': 2.338491952015736, 'sideways_rsi_os': 36, 'sideways_rsi_ob': 55, 'sideways_adx_thresh': 23.443100269087672, 'sideways_atr_min_pct': 0.0038162633232919994, 'sideways_atr_max_pct': 0.018645961392951882, 'sideways_tp_mult': 2.4891130350725206, 'sideways_tsl_mult': 0.4771218920976317, 'sideways_time_stop': 198, 'sideways_use_sma': True, 'sideways_use_ema': True, 'sideways_use_atr': False, 'sideways_use_adx': False, 'sideways_use_spike': True, 'sideways_rsi_required': True}.
[I 2025-08-31 05:40:34,732] Trial 759 finished with values: [-1000000000.0, 1000000000.0] and parameters: {'p_sma': 55, 'p_std': 13, 'p_atr': 14, 'p_adx': 10, 'rsi_period': 55, 'ema1': 11, 'ema2': 22, 'slip_atr_k': 0.031522462541755635, 'slip_spread_k': 0.5369616635566105, 'spread_hl_frac': 0.016923603172058238, 'bb_std_mult': 2.112846574961603, 'rsi_os': 8, 'rsi_ob': 62, 'vol_spike': 0.016915637781150922, 'adx_thresh': 11.25670253774003, 'atr_min_pct': 0.02366907023302976, 'atr_max_pct': 0.1159455994272918, 'tp_mult': 1.8467287131820644, 'tsl_mult': 0.8053789460803956, 'strategy': 'mean_reversion', 'time_stop': 18, 'use_sma': False, 'use_atr': True, 'use_adx': False, 'use_ema': False, 'use_spike': True, 'rsi_required': True, 'edge_k': 0.8265384617964381, 'edge_cap': 0.5264870050736733, 'bull_strategy': 'mean_reversion', 'bull_bb_std_mult': 1.3337729454631178, 'bull_rsi_os': 48, 'bull_rsi_ob': 74, 'bull_adx_thresh': 9.072147807267736, 'bull_atr_min_pct': 0.024207767002986436, 'bull_atr_max_pct': 0.10988256527675251, 'bull_tp_mult': 2.6498679347392926, 'bull_tsl_mult': 0.38687937413082407, 'bull_time_stop': 275, 'bull_use_sma': False, 'bull_use_ema': False, 'bull_use_atr': True, 'bull_use_adx': True, 'bull_use_spike': False, 'bull_rsi_required': False, 'bear_strategy': 'breakout', 'bear_bb_std_mult': 2.8635404716322, 'bear_rsi_os': 7, 'bear_rsi_ob': 65, 'bear_adx_thresh': 24.010790853335617, 'bear_atr_min_pct': 0.007642524936950483, 'bear_atr_max_pct': 0.09389213261793326, 'bear_tp_mult': 2.322120308840621, 'bear_tsl_mult': 0.5520665937587202, 'bear_time_stop': 261, 'bear_use_sma': True, 'bear_use_ema': True, 'bear_use_atr': True, 'bear_use_adx': False, 'bear_use_spike': False, 'bear_rsi_required': True, 'sideways_strategy': 'breakout', 'sideways_bb_std_mult': 1.215310732152, 'sideways_rsi_os': 43, 'sideways_rsi_ob': 48, 'sideways_adx_thresh': 24.19609995324919, 'sideways_atr_min_pct': 0.018570142362715106, 'sideways_atr_max_pct': 0.023108625680222532, 'sideways_tp_mult': 2.1679675992969165, 'sideways_tsl_mult': 0.3237239857185543, 'sideways_time_stop': 216, 'sideways_use_sma': False, 'sideways_use_ema': True, 'sideways_use_atr': False, 'sideways_use_adx': False, 'sideways_use_spike': True, 'sideways_rsi_required': True}.
[I 2025-08-31 05:40:35,601] Trial 758 finished with values: [-0.009498816873591887, 0.009429117608002913] and parameters: {'p_sma': 56, 'p_std': 40, 'p_atr': 14, 'p_adx': 25, 'rsi_period': 15, 'ema1': 20, 'ema2': 24, 'slip_atr_k': 0.006216505196850833, 'slip_spread_k': 0.7340878903382082, 'spread_hl_frac': 0.007295328230409092, 'bb_std_mult': 3.13207656314954, 'rsi_os': 37, 'rsi_ob': 63, 'vol_spike': 0.09784674237518254, 'adx_thresh': 11.280436748734346, 'atr_min_pct': 0.01345885956649684, 'atr_max_pct': 0.1150009836241028, 'tp_mult': 2.5127609746661985, 'tsl_mult': 0.8068641439299064, 'strategy': 'mean_reversion', 'time_stop': 18, 'use_sma': False, 'use_atr': True, 'use_adx': False, 'use_ema': False, 'use_spike': True, 'rsi_required': True, 'edge_k': 0.8601443263467732, 'edge_cap': 0.3983079664533681, 'bull_strategy': 'mean_reversion', 'bull_bb_std_mult': 1.3299167746348481, 'bull_rsi_os': 48, 'bull_rsi_ob': 79, 'bull_adx_thresh': 8.831222377778474, 'bull_atr_min_pct': 0.01602574297581911, 'bull_atr_max_pct': 0.0798659408756611, 'bull_tp_mult': 1.6256904832204322, 'bull_tsl_mult': 0.8152207439164294, 'bull_time_stop': 212, 'bull_use_sma': False, 'bull_use_ema': False, 'bull_use_atr': True, 'bull_use_adx': True, 'bull_use_spike': False, 'bull_rsi_required': False, 'bear_strategy': 'breakout', 'bear_bb_std_mult': 2.1119813225721407, 'bear_rsi_os': 8, 'bear_rsi_ob': 67, 'bear_adx_thresh': 18.025762186349155, 'bear_atr_min_pct': 0.006875244050169961, 'bear_atr_max_pct': 0.04324484592961071, 'bear_tp_mult': 1.0139879470827373, 'bear_tsl_mult': 0.18819804501182721, 'bear_time_stop': 226, 'bear_use_sma': True, 'bear_use_ema': True, 'bear_use_atr': True, 'bear_use_adx': False, 'bear_use_spike': False, 'bear_rsi_required': True, 'sideways_strategy': 'breakout', 'sideways_bb_std_mult': 1.2089646760758193, 'sideways_rsi_os': 39, 'sideways_rsi_ob': 46, 'sideways_adx_thresh': 25.47885571403883, 'sideways_atr_min_pct': 0.0023623023567784715, 'sideways_atr_max_pct': 0.06499859221432615, 'sideways_tp_mult': 2.599913884592547, 'sideways_tsl_mult': 0.46001177333075205, 'sideways_time_stop': 197, 'sideways_use_sma': False, 'sideways_use_ema': True, 'sideways_use_atr': False, 'sideways_use_adx': False, 'sideways_use_spike': True, 'sideways_rsi_required': True}.
[I 2025-08-31 05:40:36,112] Trial 760 finished with values: [-1000000000.0, 1000000000.0] and parameters: {'p_sma': 11, 'p_std': 17, 'p_atr': 17, 'p_adx': 10, 'rsi_period': 21, 'ema1': 11, 'ema2': 31, 'slip_atr_k': 0.030593932114521997, 'slip_spread_k': 0.7952212836134697, 'spread_hl_frac': 0.010188471813512576, 'bb_std_mult': 1.7419649296601938, 'rsi_os': 33, 'rsi_ob': 62, 'vol_spike': 0.028061729984364375, 'adx_thresh': 11.160425515907964, 'atr_min_pct': 0.013795258758559999, 'atr_max_pct': 0.09466155420549714, 'tp_mult': 2.5189308844573928, 'tsl_mult': 0.8177484699781674, 'strategy': 'mean_reversion', 'time_stop': 266, 'use_sma': False, 'use_atr': True, 'use_adx': False, 'use_ema': False, 'use_spike': True, 'rsi_required': True, 'edge_k': 0.8867238176633486, 'edge_cap': 0.767423109259212, 'bull_strategy': 'mean_reversion', 'bull_bb_std_mult': 2.4962693142937615, 'bull_rsi_os': 42, 'bull_rsi_ob': 76, 'bull_adx_thresh': 16.82838764688865, 'bull_atr_min_pct': 0.016259148765836163, 'bull_atr_max_pct': 0.11104602096865529, 'bull_tp_mult': 1.623300850040169, 'bull_tsl_mult': 0.5959101248418975, 'bull_time_stop': 167, 'bull_use_sma': False, 'bull_use_ema': False, 'bull_use_atr': True, 'bull_use_adx': True, 'bull_use_spike': False, 'bull_rsi_required': False, 'bear_strategy': 'breakout', 'bear_bb_std_mult': 0.9689523473788741, 'bear_rsi_os': 8, 'bear_rsi_ob': 79, 'bear_adx_thresh': 23.991197721418114, 'bear_atr_min_pct': 0.00694416488941641, 'bear_atr_max_pct': 0.04192137952592955, 'bear_tp_mult': 1.4059404051444222, 'bear_tsl_mult': 0.23911816555902726, 'bear_time_stop': 250, 'bear_use_sma': True, 'bear_use_ema': True, 'bear_use_atr': True, 'bear_use_adx': False, 'bear_use_spike': False, 'bear_rsi_required': True, 'sideways_strategy': 'breakout', 'sideways_bb_std_mult': 2.9189022402490292, 'sideways_rsi_os': 33, 'sideways_rsi_ob': 46, 'sideways_adx_thresh': 25.711066671826334, 'sideways_atr_min_pct': 0.028533976425783508, 'sideways_atr_max_pct': 0.017665276968730468, 'sideways_tp_mult': 2.867699808608151, 'sideways_tsl_mult': 0.370966323614804, 'sideways_time_stop': 5, 'sideways_use_sma': False, 'sideways_use_ema': True, 'sideways_use_atr': False, 'sideways_use_adx': False, 'sideways_use_spike': True, 'sideways_rsi_required': True}.
[I 2025-08-31 05:40:36,887] Trial 761 finished with values: [-1000000000.0, 1000000000.0] and parameters: {'p_sma': 55, 'p_std': 17, 'p_atr': 17, 'p_adx': 8, 'rsi_period': 11, 'ema1': 11, 'ema2': 22, 'slip_atr_k': 0.029157209905554295, 'slip_spread_k': 0.5555160993755319, 'spread_hl_frac': 0.018800109957628312, 'bb_std_mult': 2.207253460086599, 'rsi_os': 18, 'rsi_ob': 49, 'vol_spike': 0.01713630136062576, 'adx_thresh': 26.05606951610581, 'atr_min_pct': 0.005581901178350529, 'atr_max_pct': 0.11505286151798036, 'tp_mult': 2.4665993724704967, 'tsl_mult': 0.8161061117742384, 'strategy': 'mean_reversion', 'time_stop': 30, 'use_sma': False, 'use_atr': True, 'use_adx': False, 'use_ema': False, 'use_spike': True, 'rsi_required': True, 'edge_k': 1.7477476412663582, 'edge_cap': 0.8888861130656113, 'bull_strategy': 'mean_reversion', 'bull_bb_std_mult': 1.0675529523390699, 'bull_rsi_os': 48, 'bull_rsi_ob': 78, 'bull_adx_thresh': 10.525794702498041, 'bull_atr_min_pct': 0.004614269994116609, 'bull_atr_max_pct': 0.0336019018684025, 'bull_tp_mult': 1.707746441991973, 'bull_tsl_mult': 0.9159154597295196, 'bull_time_stop': 300, 'bull_use_sma': False, 'bull_use_ema': False, 'bull_use_atr': True, 'bull_use_adx': True, 'bull_use_spike': False, 'bull_rsi_required': False, 'bear_strategy': 'breakout', 'bear_bb_std_mult': 2.8643664358955085, 'bear_rsi_os': 30, 'bear_rsi_ob': 83, 'bear_adx_thresh': 11.352174623404363, 'bear_atr_min_pct': 0.006997447007633733, 'bear_atr_max_pct': 0.1380938347721987, 'bear_tp_mult': 1.6368676030544251, 'bear_tsl_mult': 0.23962877024313697, 'bear_time_stop': 259, 'bear_use_sma': True, 'bear_use_ema': True, 'bear_use_atr': True, 'bear_use_adx': False, 'bear_use_spike': False, 'bear_rsi_required': True, 'sideways_strategy': 'breakout', 'sideways_bb_std_mult': 2.9120334203737794, 'sideways_rsi_os': 39, 'sideways_rsi_ob': 90, 'sideways_adx_thresh': 15.378978148647029, 'sideways_atr_min_pct': 0.012011255616035388, 'sideways_atr_max_pct': 0.04938032555608145, 'sideways_tp_mult': 2.8568804463795376, 'sideways_tsl_mult': 0.42638282751557044, 'sideways_time_stop': 216, 'sideways_use_sma': False, 'sideways_use_ema': True, 'sideways_use_atr': False, 'sideways_use_adx': False, 'sideways_use_spike': True, 'sideways_rsi_required': True}.
[I 2025-08-31 05:40:36,996] Trial 762 finished with values: [-1000000000.0, 1000000000.0] and parameters: {'p_sma': 38, 'p_std': 17, 'p_atr': 20, 'p_adx': 8, 'rsi_period': 82, 'ema1': 23, 'ema2': 45, 'slip_atr_k': 0.006199349693483482, 'slip_spread_k': 0.21330734634650078, 'spread_hl_frac': 0.032223849249933795, 'bb_std_mult': 1.7529977563615762, 'rsi_os': 37, 'rsi_ob': 50, 'vol_spike': 0.07539807154620162, 'adx_thresh': 10.164362100051349, 'atr_min_pct': 0.013594103179142038, 'atr_max_pct': 0.12028615762146924, 'tp_mult': 2.4714704888464323, 'tsl_mult': 0.8246786867988, 'strategy': 'mean_reversion', 'time_stop': 37, 'use_sma': False, 'use_atr': True, 'use_adx': False, 'use_ema': False, 'use_spike': True, 'rsi_required': True, 'edge_k': 1.7454174654841301, 'edge_cap': 0.15802964253788426, 'bull_strategy': 'mean_reversion', 'bull_bb_std_mult': 1.0586721494433315, 'bull_rsi_os': 51, 'bull_rsi_ob': 79, 'bull_adx_thresh': 8.431659086810978, 'bull_atr_min_pct': 0.0046647559946972495, 'bull_atr_max_pct': 0.05689005852237116, 'bull_tp_mult': 1.0891173143362218, 'bull_tsl_mult': 0.9199847347202438, 'bull_time_stop': 215, 'bull_use_sma': False, 'bull_use_ema': True, 'bull_use_atr': True, 'bull_use_adx': True, 'bull_use_spike': False, 'bull_rsi_required': False, 'bear_strategy': 'breakout', 'bear_bb_std_mult': 0.961926642373623, 'bear_rsi_os': 8, 'bear_rsi_ob': 75, 'bear_adx_thresh': 32.952611682308564, 'bear_atr_min_pct': 0.019728224048359368, 'bear_atr_max_pct': 0.042659570568383265, 'bear_tp_mult': 1.0132745959196083, 'bear_tsl_mult': 0.2907915748804277, 'bear_time_stop': 36, 'bear_use_sma': True, 'bear_use_ema': False, 'bear_use_atr': True, 'bear_use_adx': False, 'bear_use_spike': False, 'bear_rsi_required': True, 'sideways_strategy': 'breakout', 'sideways_bb_std_mult': 2.653229860057116, 'sideways_rsi_os': 39, 'sideways_rsi_ob': 46, 'sideways_adx_thresh': 28.59185359445714, 'sideways_atr_min_pct': 0.015148889649611077, 'sideways_atr_max_pct': 0.050398185886478944, 'sideways_tp_mult': 2.228117076437965, 'sideways_tsl_mult': 0.4526741531906844, 'sideways_time_stop': 209, 'sideways_use_sma': False, 'sideways_use_ema': True, 'sideways_use_atr': False, 'sideways_use_adx': False, 'sideways_use_spike': True, 'sideways_rsi_required': True}.
[I 2025-08-31 05:41:22,773] Trial 763 finished with values: [-0.01400368524661566, 0.013940025830411241] and parameters: {'p_sma': 42, 'p_std': 40, 'p_atr': 11, 'p_adx': 25, 'rsi_period': 12, 'ema1': 19, 'ema2': 21, 'slip_atr_k': 0.004824125573054047, 'slip_spread_k': 0.7422260060575819, 'spread_hl_frac': 0.0052385474562760105, 'bb_std_mult': 3.137410608624011, 'rsi_os': 37, 'rsi_ob': 65, 'vol_spike': 0.11843695146215805, 'adx_thresh': 16.607056484622174, 'atr_min_pct': 0.01352066782841419, 'atr_max_pct': 0.08556525048488253, 'tp_mult': 2.5942707891416874, 'tsl_mult': 0.7581909644781456, 'strategy': 'mean_reversion', 'time_stop': 14, 'use_sma': True, 'use_atr': True, 'use_adx': True, 'use_ema': True, 'use_spike': False, 'rsi_required': True, 'edge_k': 0.9163510707848327, 'edge_cap': 0.43808567809403437, 'bull_strategy': 'breakout', 'bull_bb_std_mult': 1.435829892003771, 'bull_rsi_os': 30, 'bull_rsi_ob': 82, 'bull_adx_thresh': 7.472150418760881, 'bull_atr_min_pct': 0.026660007854859828, 'bull_atr_max_pct': 0.08107451860985482, 'bull_tp_mult': 2.4407458712560923, 'bull_tsl_mult': 0.8065077792196097, 'bull_time_stop': 213, 'bull_use_sma': True, 'bull_use_ema': True, 'bull_use_atr': False, 'bull_use_adx': False, 'bull_use_spike': True, 'bull_rsi_required': False, 'bear_strategy': 'breakout', 'bear_bb_std_mult': 2.086858134820356, 'bear_rsi_os': 6, 'bear_rsi_ob': 62, 'bear_adx_thresh': 31.499293320057923, 'bear_atr_min_pct': 0.005830477741563544, 'bear_atr_max_pct': 0.13461278551235553, 'bear_tp_mult': 1.0267172747852384, 'bear_tsl_mult': 0.1419867503775857, 'bear_time_stop': 221, 'bear_use_sma': False, 'bear_use_ema': False, 'bear_use_atr': False, 'bear_use_adx': False, 'bear_use_spike': False, 'bear_rsi_required': False, 'sideways_strategy': 'breakout', 'sideways_bb_std_mult': 1.3829474460252527, 'sideways_rsi_os': 39, 'sideways_rsi_ob': 46, 'sideways_adx_thresh': 25.429758530415878, 'sideways_atr_min_pct': 0.002040111657629241, 'sideways_atr_max_pct': 0.07197911521329, 'sideways_tp_mult': 2.5934740468759037, 'sideways_tsl_mult': 0.4127845778613828, 'sideways_time_stop': 192, 'sideways_use_sma': True, 'sideways_use_ema': True, 'sideways_use_atr': True, 'sideways_use_adx': False, 'sideways_use_spike': False, 'sideways_rsi_required': False}.
[I 2025-08-31 05:41:23,006] Trial 764 finished with values: [-1000000000.0, 1000000000.0] and parameters: {'p_sma': 20, 'p_std': 39, 'p_atr': 12, 'p_adx': 25, 'rsi_period': 12, 'ema1': 18, 'ema2': 21, 'slip_atr_k': 0.0031958147265702835, 'slip_spread_k': 0.7554117762842806, 'spread_hl_frac': 0.006994522532665727, 'bb_std_mult': 3.165701391662651, 'rsi_os': 37, 'rsi_ob': 66, 'vol_spike': 0.09886062454092923, 'adx_thresh': 22.34883382152987, 'atr_min_pct': 0.013249677569445045, 'atr_max_pct': 0.08629924102066533, 'tp_mult': 2.5981856088344277, 'tsl_mult': 0.7673404977332675, 'strategy': 'mean_reversion', 'time_stop': 5, 'use_sma': True, 'use_atr': True, 'use_adx': True, 'use_ema': True, 'use_spike': False, 'rsi_required': True, 'edge_k': 0.9125928478019676, 'edge_cap': 0.4088214868040897, 'bull_strategy': 'breakout', 'bull_bb_std_mult': 1.4104420236935584, 'bull_rsi_os': 34, 'bull_rsi_ob': 84, 'bull_adx_thresh': 7.299496833461542, 'bull_atr_min_pct': 0.021947740168437084, 'bull_atr_max_pct': 0.08054775052421222, 'bull_tp_mult': 1.055312746020281, 'bull_tsl_mult': 0.800876483406541, 'bull_time_stop': 213, 'bull_use_sma': True, 'bull_use_ema': True, 'bull_use_atr': False, 'bull_use_adx': False, 'bull_use_spike': True, 'bull_rsi_required': False, 'bear_strategy': 'breakout', 'bear_bb_std_mult': 2.0789201708153984, 'bear_rsi_os': 6, 'bear_rsi_ob': 62, 'bear_adx_thresh': 14.739456480488025, 'bear_atr_min_pct': 0.006057445105995573, 'bear_atr_max_pct': 0.07111581098362635, 'bear_tp_mult': 1.025014826613962, 'bear_tsl_mult': 0.14792234050129777, 'bear_time_stop': 221, 'bear_use_sma': False, 'bear_use_ema': False, 'bear_use_atr': False, 'bear_use_adx': False, 'bear_use_spike': False, 'bear_rsi_required': False, 'sideways_strategy': 'breakout', 'sideways_bb_std_mult': 1.3104945726034027, 'sideways_rsi_os': 39, 'sideways_rsi_ob': 45, 'sideways_adx_thresh': 25.45398440025645, 'sideways_atr_min_pct': 0.002806484259661626, 'sideways_atr_max_pct': 0.06593464697180704, 'sideways_tp_mult': 2.6454513340577517, 'sideways_tsl_mult': 0.4222804135167554, 'sideways_time_stop': 187, 'sideways_use_sma': True, 'sideways_use_ema': True, 'sideways_use_atr': True, 'sideways_use_adx': False, 'sideways_use_spike': False, 'sideways_rsi_required': False}.
