[I 2025-08-31 05:44:37,789] Trial 786 finished with values: [-1000000000.0, 1000000000.0] and parameters: {'p_sma': 55, 'p_std': 40, 'p_atr': 14, 'p_adx': 26, 'rsi_period': 12, 'ema1': 19, 'ema2': 23, 'slip_atr_k': 0.007342044906873071, 'slip_spread_k': 0.7734087373624055, 'spread_hl_frac': 0.004891675090856487, 'bb_std_mult': 3.111972743041952, 'rsi_os': 41, 'rsi_ob': 67, 'vol_spike': 0.0974056782511582, 'adx_thresh': 6.10171899203546, 'atr_min_pct': 0.014627575039277127, 'atr_max_pct': 0.010478498916914283, 'tp_mult': 1.462914842422744, 'tsl_mult': 0.7973100750742985, 'strategy': 'mean_reversion', 'time_stop': 5, 'use_sma': False, 'use_atr': True, 'use_adx': False, 'use_ema': False, 'use_spike': True, 'rsi_required': True, 'edge_k': 0.7959769888595526, 'edge_cap': 0.3733918603915925, 'bull_strategy': 'mean_reversion', 'bull_bb_std_mult': 1.2139703350152122, 'bull_rsi_os': 21, 'bull_rsi_ob': 86, 'bull_adx_thresh': 29.21963202207088, 'bull_atr_min_pct': 0.013907923480650595, 'bull_atr_max_pct': 0.08014439657988363, 'bull_tp_mult': 2.6927587351038023, 'bull_tsl_mult': 0.7572292484333584, 'bull_time_stop': 195, 'bull_use_sma': False, 'bull_use_ema': False, 'bull_use_atr': True, 'bull_use_adx': True, 'bull_use_spike': False, 'bull_rsi_required': False, 'bear_strategy': 'breakout', 'bear_bb_std_mult': 2.1158727335181573, 'bear_rsi_os': 5, 'bear_rsi_ob': 69, 'bear_adx_thresh': 17.19066463028316, 'bear_atr_min_pct': 0.006717193309075683, 'bear_atr_max_pct': 0.07768675625487068, 'bear_tp_mult': 1.0112318681047785, 'bear_tsl_mult': 0.1543226218187214, 'bear_time_stop': 221, 'bear_use_sma': True, 'bear_use_ema': True, 'bear_use_atr': True, 'bear_use_adx': False, 'bear_use_spike': False, 'bear_rsi_required': True, 'sideways_strategy': 'breakout', 'sideways_bb_std_mult': 1.2715850813746465, 'sideways_rsi_os': 41, 'sideways_rsi_ob': 46, 'sideways_adx_thresh': 24.705899389310407, 'sideways_atr_min_pct': 0.0042750446076378155, 'sideways_atr_max_pct': 0.0845814335763794, 'sideways_tp_mult': 2.5910110076977686, 'sideways_tsl_mult': 0.4247819461473311, 'sideways_time_stop': 188, 'sideways_use_sma': False, 'sideways_use_ema': True, 'sideways_use_atr': False, 'sideways_use_adx': False, 'sideways_use_spike': True, 'sideways_rsi_required': True}.
[I 2025-08-31 05:45:25,636] Trial 784 finished with values: [-1000000000.0, 1000000000.0] and parameters: {'p_sma': 25, 'p_std': 38, 'p_atr': 13, 'p_adx': 26, 'rsi_period': 11, 'ema1': 19, 'ema2': 21, 'slip_atr_k': 0.007260464338810468, 'slip_spread_k': 0.7153344345046271, 'spread_hl_frac': 0.0053803937274082905, 'bb_std_mult': 3.0034992144734916, 'rsi_os': 35, 'rsi_ob': 68, 'vol_spike': 0.08820982997397789, 'adx_thresh': 30.700086867695035, 'atr_min_pct': 0.0149664038261186, 'atr_max_pct': 0.10496516145073406, 'tp_mult': 2.5461667240061874, 'tsl_mult': 0.7159313069124529, 'strategy': 'mean_reversion', 'time_stop': 15, 'use_sma': False, 'use_atr': True, 'use_adx': True, 'use_ema': True, 'use_spike': False, 'rsi_required': True, 'edge_k': 0.7907978607338956, 'edge_cap': 0.3696634565310182, 'bull_strategy': 'mean_reversion', 'bull_bb_std_mult': 1.6806695377607355, 'bull_rsi_os': 43, 'bull_rsi_ob': 83, 'bull_adx_thresh': 20.418355758336897, 'bull_atr_min_pct': 0.018219212543209434, 'bull_atr_max_pct': 0.07516801664982195, 'bull_tp_mult': 1.394510397003684, 'bull_tsl_mult': 0.8005501950437581, 'bull_time_stop': 189, 'bull_use_sma': True, 'bull_use_ema': False, 'bull_use_atr': True, 'bull_use_adx': False, 'bull_use_spike': True, 'bull_rsi_required': False, 'bear_strategy': 'breakout', 'bear_bb_std_mult': 1.9648717468720602, 'bear_rsi_os': 5, 'bear_rsi_ob': 67, 'bear_adx_thresh': 16.86209216106951, 'bear_atr_min_pct': 0.006519565385912819, 'bear_atr_max_pct': 0.03626011366193563, 'bear_tp_mult': 1.068301585095237, 'bear_tsl_mult': 0.16971182838052692, 'bear_time_stop': 219, 'bear_use_sma': False, 'bear_use_ema': True, 'bear_use_atr': False, 'bear_use_adx': False, 'bear_use_spike': False, 'bear_rsi_required': True, 'sideways_strategy': 'breakout', 'sideways_bb_std_mult': 1.2605881560340022, 'sideways_rsi_os': 39, 'sideways_rsi_ob': 46, 'sideways_adx_thresh': 24.77889702194697, 'sideways_atr_min_pct': 0.004119327353641749, 'sideways_atr_max_pct': 0.07419798201842129, 'sideways_tp_mult': 2.592285584601584, 'sideways_tsl_mult': 0.4340082449405653, 'sideways_time_stop': 187, 'sideways_use_sma': False, 'sideways_use_ema': True, 'sideways_use_atr': True, 'sideways_use_adx': False, 'sideways_use_spike': False, 'sideways_rsi_required': False}.
[I 2025-08-31 05:45:26,731] Trial 785 finished with values: [-1000000000.0, 1000000000.0] and parameters: {'p_sma': 55, 'p_std': 41, 'p_atr': 10, 'p_adx': 26, 'rsi_period': 11, 'ema1': 19, 'ema2': 21, 'slip_atr_k': 0.00010411948941041645, 'slip_spread_k': 0.7366870931713382, 'spread_hl_frac': 0.005701133352040172, 'bb_std_mult': 3.0205516411232365, 'rsi_os': 38, 'rsi_ob': 68, 'vol_spike': 0.09702774488619305, 'adx_thresh': 20.61350004404277, 'atr_min_pct': 0.015174658065865862, 'atr_max_pct': 0.04548650883133074, 'tp_mult': 2.5863399073771887, 'tsl_mult': 0.7574836476488178, 'strategy': 'mean_reversion', 'time_stop': 16, 'use_sma': False, 'use_atr': True, 'use_adx': False, 'use_ema': False, 'use_spike': True, 'rsi_required': True, 'edge_k': 0.784015590460176, 'edge_cap': 0.3718465338971247, 'bull_strategy': 'mean_reversion', 'bull_bb_std_mult': 1.6572970273336818, 'bull_rsi_os': 38, 'bull_rsi_ob': 72, 'bull_adx_thresh': 8.531877092228195, 'bull_atr_min_pct': 0.018132024384761903, 'bull_atr_max_pct': 0.08061587812524418, 'bull_tp_mult': 2.7635341112549554, 'bull_tsl_mult': 0.7618841874513784, 'bull_time_stop': 201, 'bull_use_sma': False, 'bull_use_ema': False, 'bull_use_atr': True, 'bull_use_adx': True, 'bull_use_spike': False, 'bull_rsi_required': False, 'bear_strategy': 'breakout', 'bear_bb_std_mult': 2.1138771511236083, 'bear_rsi_os': 5, 'bear_rsi_ob': 69, 'bear_adx_thresh': 16.411123096941427, 'bear_atr_min_pct': 0.006547834588773847, 'bear_atr_max_pct': 0.14947237561274684, 'bear_tp_mult': 1.0493260473635686, 'bear_tsl_mult': 0.1155716117202687, 'bear_time_stop': 225, 'bear_use_sma': True, 'bear_use_ema': True, 'bear_use_atr': True, 'bear_use_adx': False, 'bear_use_spike': False, 'bear_rsi_required': True, 'sideways_strategy': 'breakout', 'sideways_bb_std_mult': 1.2637592221703178, 'sideways_rsi_os': 39, 'sideways_rsi_ob': 46, 'sideways_adx_thresh': 25.254262447409513, 'sideways_atr_min_pct': 0.006622715094615633, 'sideways_atr_max_pct': 0.08047775060067575, 'sideways_tp_mult': 2.5841436294516584, 'sideways_tsl_mult': 0.43406385124912805, 'sideways_time_stop': 199, 'sideways_use_sma': False, 'sideways_use_ema': True, 'sideways_use_atr': False, 'sideways_use_adx': False, 'sideways_use_spike': True, 'sideways_rsi_required': True}.
[I 2025-08-31 05:45:26,824] Trial 783 finished with values: [-1000000000.0, 1000000000.0] and parameters: {'p_sma': 30, 'p_std': 41, 'p_atr': 10, 'p_adx': 26, 'rsi_period': 11, 'ema1': 19, 'ema2': 23, 'slip_atr_k': 0.006406896362614406, 'slip_spread_k': 0.7145727192810908, 'spread_hl_frac': 0.005933351069281627, 'bb_std_mult': 3.031089799962731, 'rsi_os': 38, 'rsi_ob': 66, 'vol_spike': 0.09454593282700995, 'adx_thresh': 23.97805696922544, 'atr_min_pct': 0.015004440430539855, 'atr_max_pct': 0.027902251914912767, 'tp_mult': 2.5492858251188717, 'tsl_mult': 0.794357051306206, 'strategy': 'mean_reversion', 'time_stop': 17, 'use_sma': True, 'use_atr': True, 'use_adx': True, 'use_ema': True, 'use_spike': False, 'rsi_required': True, 'edge_k': 0.7900572336994199, 'edge_cap': 0.3957964055136783, 'bull_strategy': 'mean_reversion', 'bull_bb_std_mult': 1.6968052605309458, 'bull_rsi_os': 40, 'bull_rsi_ob': 86, 'bull_adx_thresh': 24.306243641887814, 'bull_atr_min_pct': 0.018847748942368698, 'bull_atr_max_pct': 0.07428914940137836, 'bull_tp_mult': 2.5736094404188066, 'bull_tsl_mult': 0.7979566277517578, 'bull_time_stop': 207, 'bull_use_sma': True, 'bull_use_ema': True, 'bull_use_atr': False, 'bull_use_adx': False, 'bull_use_spike': True, 'bull_rsi_required': False, 'bear_strategy': 'breakout', 'bear_bb_std_mult': 2.1099998897727494, 'bear_rsi_os': 7, 'bear_rsi_ob': 64, 'bear_adx_thresh': 17.16079632055226, 'bear_atr_min_pct': 0.005715402097880873, 'bear_atr_max_pct': 0.01650493433273098, 'bear_tp_mult': 1.0759220560700011, 'bear_tsl_mult': 0.17313993929394292, 'bear_time_stop': 219, 'bear_use_sma': False, 'bear_use_ema': False, 'bear_use_atr': False, 'bear_use_adx': False, 'bear_use_spike': False, 'bear_rsi_required': True, 'sideways_strategy': 'breakout', 'sideways_bb_std_mult': 1.303681198034652, 'sideways_rsi_os': 38, 'sideways_rsi_ob': 46, 'sideways_adx_thresh': 24.96645237257909, 'sideways_atr_min_pct': 0.004092821522878004, 'sideways_atr_max_pct': 0.05739274085400761, 'sideways_tp_mult': 2.5976666755619986, 'sideways_tsl_mult': 0.42720587670560484, 'sideways_time_stop': 183, 'sideways_use_sma': False, 'sideways_use_ema': True, 'sideways_use_atr': True, 'sideways_use_adx': False, 'sideways_use_spike': False, 'sideways_rsi_required': False}.
[I 2025-08-31 05:45:27,290] Trial 787 finished with values: [-1000000000.0, 1000000000.0] and parameters: {'p_sma': 55, 'p_std': 38, 'p_atr': 12, 'p_adx': 25, 'rsi_period': 9, 'ema1': 21, 'ema2': 23, 'slip_atr_k': 0.0077180519509509144, 'slip_spread_k': 0.7397536389688953, 'spread_hl_frac': 0.005804123506419456, 'bb_std_mult': 3.029361199277954, 'rsi_os': 45, 'rsi_ob': 64, 'vol_spike': 0.10996684887193657, 'adx_thresh': 8.269912844207987, 'atr_min_pct': 0.015546383864852232, 'atr_max_pct': 0.07811583713116872, 'tp_mult': 2.7101428621557564, 'tsl_mult': 0.7517336968380245, 'strategy': 'mean_reversion', 'time_stop': 15, 'use_sma': False, 'use_atr': True, 'use_adx': False, 'use_ema': False, 'use_spike': True, 'rsi_required': True, 'edge_k': 1.0189458021194766, 'edge_cap': 0.4354973498508034, 'bull_strategy': 'mean_reversion', 'bull_bb_std_mult': 1.70335515623471, 'bull_rsi_os': 40, 'bull_rsi_ob': 71, 'bull_adx_thresh': 34.94114731214371, 'bull_atr_min_pct': 0.01814564481490956, 'bull_atr_max_pct': 0.07615372968994805, 'bull_tp_mult': 1.560955402144041, 'bull_tsl_mult': 0.7958857817504971, 'bull_time_stop': 227, 'bull_use_sma': False, 'bull_use_ema': False, 'bull_use_atr': True, 'bull_use_adx': True, 'bull_use_spike': False, 'bull_rsi_required': False, 'bear_strategy': 'breakout', 'bear_bb_std_mult': 1.9773863766227673, 'bear_rsi_os': 7, 'bear_rsi_ob': 67, 'bear_adx_thresh': 17.65051723096736, 'bear_atr_min_pct': 0.006290136903727908, 'bear_atr_max_pct': 0.14947595628450538, 'bear_tp_mult': 1.0491894511927182, 'bear_tsl_mult': 0.17427683128722177, 'bear_time_stop': 226, 'bear_use_sma': True, 'bear_use_ema': True, 'bear_use_atr': True, 'bear_use_adx': False, 'bear_use_spike': False, 'bear_rsi_required': True, 'sideways_strategy': 'breakout', 'sideways_bb_std_mult': 1.2601534184552214, 'sideways_rsi_os': 39, 'sideways_rsi_ob': 46, 'sideways_adx_thresh': 24.908192175904436, 'sideways_atr_min_pct': 0.0063550153469164785, 'sideways_atr_max_pct': 0.08247171910416745, 'sideways_tp_mult': 2.6252262358875096, 'sideways_tsl_mult': 0.4154490702256459, 'sideways_time_stop': 198, 'sideways_use_sma': False, 'sideways_use_ema': True, 'sideways_use_atr': False, 'sideways_use_adx': False, 'sideways_use_spike': True, 'sideways_rsi_required': True}.
[I 2025-08-31 05:46:16,927] Trial 790 finished with values: [-0.020881970000754868, 0.020821796309174988] and parameters: {'p_sma': 41, 'p_std': 40, 'p_atr': 14, 'p_adx': 25, 'rsi_period': 15, 'ema1': 17, 'ema2': 23, 'slip_atr_k': 0.007852127863027589, 'slip_spread_k': 0.7428165717700336, 'spread_hl_frac': 0.00676387900459277, 'bb_std_mult': 3.137047850452652, 'rsi_os': 44, 'rsi_ob': 64, 'vol_spike': 0.11081033263353703, 'adx_thresh': 7.906181190493802, 'atr_min_pct': 0.012938533339493645, 'atr_max_pct': 0.0826842191091113, 'tp_mult': 2.724854688830447, 'tsl_mult': 0.13882238814743564, 'strategy': 'mean_reversion', 'time_stop': 16, 'use_sma': False, 'use_atr': True, 'use_adx': False, 'use_ema': False, 'use_spike': True, 'rsi_required': True, 'edge_k': 1.099517227119685, 'edge_cap': 0.42328906185629783, 'bull_strategy': 'mean_reversion', 'bull_bb_std_mult': 1.4012944547115889, 'bull_rsi_os': 25, 'bull_rsi_ob': 83, 'bull_adx_thresh': 8.416394066830009, 'bull_atr_min_pct': 0.01995448424875714, 'bull_atr_max_pct': 0.07769069679840394, 'bull_tp_mult': 1.4842658330982514, 'bull_tsl_mult': 0.8201987586004869, 'bull_time_stop': 224, 'bull_use_sma': False, 'bull_use_ema': False, 'bull_use_atr': True, 'bull_use_adx': True, 'bull_use_spike': False, 'bull_rsi_required': False, 'bear_strategy': 'breakout', 'bear_bb_std_mult': 2.0110542057074916, 'bear_rsi_os': 7, 'bear_rsi_ob': 66, 'bear_adx_thresh': 18.598634557411444, 'bear_atr_min_pct': 0.004174446939825023, 'bear_atr_max_pct': 0.038656612091082, 'bear_tp_mult': 1.0121055919936786, 'bear_tsl_mult': 0.17751623109103923, 'bear_time_stop': 140, 'bear_use_sma': True, 'bear_use_ema': True, 'bear_use_atr': True, 'bear_use_adx': False, 'bear_use_spike': False, 'bear_rsi_required': True, 'sideways_strategy': 'breakout', 'sideways_bb_std_mult': 1.2412567572169797, 'sideways_rsi_os': 41, 'sideways_rsi_ob': 48, 'sideways_adx_thresh': 25.586862531809132, 'sideways_atr_min_pct': 0.001491156028720377, 'sideways_atr_max_pct': 0.08733108651748428, 'sideways_tp_mult': 2.672760155175787, 'sideways_tsl_mult': 0.4622221237920928, 'sideways_time_stop': 199, 'sideways_use_sma': False, 'sideways_use_ema': True, 'sideways_use_atr': False, 'sideways_use_adx': False, 'sideways_use_spike': True, 'sideways_rsi_required': True}.
[I 2025-08-31 05:46:18,613] Trial 791 finished with values: [-1000000000.0, 1000000000.0] and parameters: {'p_sma': 38, 'p_std': 40, 'p_atr': 14, 'p_adx': 25, 'rsi_period': 14, 'ema1': 17, 'ema2': 23, 'slip_atr_k': 0.0076314178146951895, 'slip_spread_k': 0.7417256239981284, 'spread_hl_frac': 0.0068105547702775665, 'bb_std_mult': 3.1206568898286533, 'rsi_os': 43, 'rsi_ob': 64, 'vol_spike': 0.10180385935065374, 'adx_thresh': 13.144267884461586, 'atr_min_pct': 0.012805170826795716, 'atr_max_pct': 0.09705855118214397, 'tp_mult': 2.954459478894017, 'tsl_mult': 0.7944912591597091, 'strategy': 'mean_reversion', 'time_stop': 17, 'use_sma': False, 'use_atr': True, 'use_adx': False, 'use_ema': False, 'use_spike': True, 'rsi_required': True, 'edge_k': 1.059400681502971, 'edge_cap': 0.4287282953598588, 'bull_strategy': 'mean_reversion', 'bull_bb_std_mult': 1.2536377551214044, 'bull_rsi_os': 42, 'bull_rsi_ob': 82, 'bull_adx_thresh': 8.646380255109824, 'bull_atr_min_pct': 0.016529747577655837, 'bull_atr_max_pct': 0.07989594063190954, 'bull_tp_mult': 2.216633137364984, 'bull_tsl_mult': 0.8276718149690274, 'bull_time_stop': 217, 'bull_use_sma': False, 'bull_use_ema': False, 'bull_use_atr': True, 'bull_use_adx': True, 'bull_use_spike': False, 'bull_rsi_required': False, 'bear_strategy': 'breakout', 'bear_bb_std_mult': 2.0284860994672584, 'bear_rsi_os': 6, 'bear_rsi_ob': 68, 'bear_adx_thresh': 18.565634029321238, 'bear_atr_min_pct': 0.0042185370664326455, 'bear_atr_max_pct': 0.02195517036845788, 'bear_tp_mult': 1.0162084724040075, 'bear_tsl_mult': 0.13508422201219006, 'bear_time_stop': 210, 'bear_use_sma': True, 'bear_use_ema': True, 'bear_use_atr': True, 'bear_use_adx': False, 'bear_use_spike': False, 'bear_rsi_required': True, 'sideways_strategy': 'breakout', 'sideways_bb_std_mult': 1.413183417257823, 'sideways_rsi_os': 40, 'sideways_rsi_ob': 48, 'sideways_adx_thresh': 25.369287284879544, 'sideways_atr_min_pct': 0.007224200787230877, 'sideways_atr_max_pct': 0.06837030948490519, 'sideways_tp_mult': 2.6787048799361903, 'sideways_tsl_mult': 0.46615624267388617, 'sideways_time_stop': 193, 'sideways_use_sma': False, 'sideways_use_ema': True, 'sideways_use_atr': False, 'sideways_use_adx': False, 'sideways_use_spike': True, 'sideways_rsi_required': True}.
[I 2025-08-31 05:46:18,980] Trial 789 finished with values: [-1000000000.0, 1000000000.0] and parameters: {'p_sma': 45, 'p_std': 40, 'p_atr': 14, 'p_adx': 25, 'rsi_period': 14, 'ema1': 21, 'ema2': 23, 'slip_atr_k': 0.007473450070757667, 'slip_spread_k': 0.7359378545839883, 'spread_hl_frac': 0.006854761956999073, 'bb_std_mult': 3.1249246483211355, 'rsi_os': 44, 'rsi_ob': 64, 'vol_spike': 0.10179081401917514, 'adx_thresh': 23.031277209853325, 'atr_min_pct': 0.012918931083221374, 'atr_max_pct': 0.09459605104196675, 'tp_mult': 2.6847458133659936, 'tsl_mult': 0.25750951559124724, 'strategy': 'mean_reversion', 'time_stop': 15, 'use_sma': False, 'use_atr': True, 'use_adx': False, 'use_ema': False, 'use_spike': True, 'rsi_required': True, 'edge_k': 0.8520094072669601, 'edge_cap': 0.42581317897231774, 'bull_strategy': 'mean_reversion', 'bull_bb_std_mult': 1.2496126418588924, 'bull_rsi_os': 25, 'bull_rsi_ob': 73, 'bull_adx_thresh': 8.553515174533759, 'bull_atr_min_pct': 0.016312427894197772, 'bull_atr_max_pct': 0.07728414283674159, 'bull_tp_mult': 2.2272637296436706, 'bull_tsl_mult': 0.8167923878331506, 'bull_time_stop': 206, 'bull_use_sma': False, 'bull_use_ema': False, 'bull_use_atr': True, 'bull_use_adx': True, 'bull_use_spike': False, 'bull_rsi_required': False, 'bear_strategy': 'breakout', 'bear_bb_std_mult': 2.0357114636694584, 'bear_rsi_os': 7, 'bear_rsi_ob': 68, 'bear_adx_thresh': 17.49296830760109, 'bear_atr_min_pct': 0.006131918731601143, 'bear_atr_max_pct': 0.022011174543670395, 'bear_tp_mult': 1.0459276102561184, 'bear_tsl_mult': 0.14065972663195836, 'bear_time_stop': 61, 'bear_use_sma': True, 'bear_use_ema': True, 'bear_use_atr': True, 'bear_use_adx': False, 'bear_use_spike': False, 'bear_rsi_required': True, 'sideways_strategy': 'breakout', 'sideways_bb_std_mult': 1.3338145602621274, 'sideways_rsi_os': 41, 'sideways_rsi_ob': 48, 'sideways_adx_thresh': 25.450172648381518, 'sideways_atr_min_pct': 0.005939436216666129, 'sideways_atr_max_pct': 0.08167981835534978, 'sideways_tp_mult': 2.62807145230975, 'sideways_tsl_mult': 0.4629949011669268, 'sideways_time_stop': 192, 'sideways_use_sma': False, 'sideways_use_ema': True, 'sideways_use_atr': False, 'sideways_use_adx': False, 'sideways_use_spike': True, 'sideways_rsi_required': True}.
[I 2025-08-31 05:46:18,995] Trial 788 finished with values: [-1000000000.0, 1000000000.0] and parameters: {'p_sma': 55, 'p_std': 41, 'p_atr': 14, 'p_adx': 25, 'rsi_period': 15, 'ema1': 21, 'ema2': 14, 'slip_atr_k': 0.00818959841275475, 'slip_spread_k': 0.7384379494338443, 'spread_hl_frac': 0.006765040414704444, 'bb_std_mult': 3.1297257766233617, 'rsi_os': 38, 'rsi_ob': 64, 'vol_spike': 0.10046179123844988, 'adx_thresh': 24.05989792571758, 'atr_min_pct': 0.012845943212207415, 'atr_max_pct': 0.026268024440983008, 'tp_mult': 2.596937875264716, 'tsl_mult': 0.7458531385521124, 'strategy': 'mean_reversion', 'time_stop': 16, 'use_sma': False, 'use_atr': True, 'use_adx': False, 'use_ema': False, 'use_spike': True, 'rsi_required': True, 'edge_k': 0.7550584547306664, 'edge_cap': 0.43053803605639995, 'bull_strategy': 'mean_reversion', 'bull_bb_std_mult': 1.730905332260051, 'bull_rsi_os': 25, 'bull_rsi_ob': 82, 'bull_adx_thresh': 8.510632174319888, 'bull_atr_min_pct': 0.016326783810937284, 'bull_atr_max_pct': 0.0809881706692915, 'bull_tp_mult': 2.7741679317381767, 'bull_tsl_mult': 0.8254536392746145, 'bull_time_stop': 207, 'bull_use_sma': False, 'bull_use_ema': False, 'bull_use_atr': True, 'bull_use_adx': True, 'bull_use_spike': False, 'bull_rsi_required': False, 'bear_strategy': 'breakout', 'bear_bb_std_mult': 2.0581383655923533, 'bear_rsi_os': 7, 'bear_rsi_ob': 67, 'bear_adx_thresh': 17.4169387190293, 'bear_atr_min_pct': 0.005944412198954114, 'bear_atr_max_pct': 0.1267236425562377, 'bear_tp_mult': 1.010762226920371, 'bear_tsl_mult': 0.12209195240438026, 'bear_time_stop': 45, 'bear_use_sma': True, 'bear_use_ema': True, 'bear_use_atr': True, 'bear_use_adx': False, 'bear_use_spike': False, 'bear_rsi_required': True, 'sideways_strategy': 'breakout', 'sideways_bb_std_mult': 1.426422671822582, 'sideways_rsi_os': 40, 'sideways_rsi_ob': 48, 'sideways_adx_thresh': 25.299533121105114, 'sideways_atr_min_pct': 0.007054018386367484, 'sideways_atr_max_pct': 0.06825306388795184, 'sideways_tp_mult': 2.6309545949975814, 'sideways_tsl_mult': 0.4204422478508722, 'sideways_time_stop': 199, 'sideways_use_sma': False, 'sideways_use_ema': True, 'sideways_use_atr': False, 'sideways_use_adx': False, 'sideways_use_spike': True, 'sideways_rsi_required': True}.
