[I 2025-08-31 05:34:13,865] Trial 720 finished with values: [-1000000000.0, 1000000000.0] and parameters: {'p_sma': 55, 'p_std': 35, 'p_atr': 15, 'p_adx': 8, 'rsi_period': 9, 'ema1': 21, 'ema2': 34, 'slip_atr_k': 0.08412188586720366, 'slip_spread_k': 0.9571321137814403, 'spread_hl_frac': 0.010198639002333604, 'bb_std_mult': 1.0467196108876298, 'rsi_os': 36, 'rsi_ob': 57, 'vol_spike': 0.17467585934699983, 'adx_thresh': 9.781638978155561, 'atr_min_pct': 0.023009488773471292, 'atr_max_pct': 0.11390673776454531, 'tp_mult': 2.5304846021775513, 'tsl_mult': 0.7989023451738322, 'strategy': 'mean_reversion', 'time_stop': 27, 'use_sma': False, 'use_atr': True, 'use_adx': False, 'use_ema': False, 'use_spike': True, 'rsi_required': True, 'edge_k': 0.7312350394715341, 'edge_cap': 0.8069565462293916, 'bull_strategy': 'mean_reversion', 'bull_bb_std_mult': 0.8713819660831575, 'bull_rsi_os': 44, 'bull_rsi_ob': 83, 'bull_adx_thresh': 34.37642866334791, 'bull_atr_min_pct': 0.014375510186961142, 'bull_atr_max_pct': 0.14966067986281478, 'bull_tp_mult': 1.703732523315092, 'bull_tsl_mult': 0.25943458495157784, 'bull_time_stop': 287, 'bull_use_sma': False, 'bull_use_ema': False, 'bull_use_atr': True, 'bull_use_adx': True, 'bull_use_spike': False, 'bull_rsi_required': False, 'bear_strategy': 'breakout', 'bear_bb_std_mult': 0.8430068986528159, 'bear_rsi_os': 8, 'bear_rsi_ob': 60, 'bear_adx_thresh': 18.321327809471427, 'bear_atr_min_pct': 0.007267566491623514, 'bear_atr_max_pct': 0.07451979355515498, 'bear_tp_mult': 1.3535949474698503, 'bear_tsl_mult': 0.3720482262589736, 'bear_time_stop': 164, 'bear_use_sma': True, 'bear_use_ema': True, 'bear_use_atr': True, 'bear_use_adx': False, 'bear_use_spike': False, 'bear_rsi_required': True, 'sideways_strategy': 'breakout', 'sideways_bb_std_mult': 2.2538648661615306, 'sideways_rsi_os': 39, 'sideways_rsi_ob': 54, 'sideways_adx_thresh': 27.349003241413556, 'sideways_atr_min_pct': 0.010558957485021987, 'sideways_atr_max_pct': 0.04402862899440556, 'sideways_tp_mult': 2.0900250812423384, 'sideways_tsl_mult': 0.05575092889267502, 'sideways_time_stop': 218, 'sideways_use_sma': False, 'sideways_use_ema': True, 'sideways_use_atr': False, 'sideways_use_adx': False, 'sideways_use_spike': True, 'sideways_rsi_required': True}.
[I 2025-08-31 05:34:15,271] Trial 721 finished with values: [-1000000000.0, 1000000000.0] and parameters: {'p_sma': 55, 'p_std': 25, 'p_atr': 13, 'p_adx': 13, 'rsi_period': 20, 'ema1': 22, 'ema2': 25, 'slip_atr_k': 0.027820668115865154, 'slip_spread_k': 0.6591931187057888, 'spread_hl_frac': 0.031210074500574447, 'bb_std_mult': 1.378467143774969, 'rsi_os': 6, 'rsi_ob': 57, 'vol_spike': 0.05841363523671239, 'adx_thresh': 12.776210670450483, 'atr_min_pct': 0.02598823176872875, 'atr_max_pct': 0.01580196167151754, 'tp_mult': 2.3627290185744774, 'tsl_mult': 0.7932315199649427, 'strategy': 'mean_reversion', 'time_stop': 29, 'use_sma': True, 'use_atr': True, 'use_adx': False, 'use_ema': True, 'use_spike': False, 'rsi_required': True, 'edge_k': 0.111551552924127, 'edge_cap': 0.7322887416509003, 'bull_strategy': 'mean_reversion', 'bull_bb_std_mult': 0.8886786428311158, 'bull_rsi_os': 43, 'bull_rsi_ob': 83, 'bull_adx_thresh': 8.72075102018857, 'bull_atr_min_pct': 0.019630214585892924, 'bull_atr_max_pct': 0.056984438567993706, 'bull_tp_mult': 1.708871072970532, 'bull_tsl_mult': 0.8273703631875993, 'bull_time_stop': 276, 'bull_use_sma': False, 'bull_use_ema': False, 'bull_use_atr': False, 'bull_use_adx': True, 'bull_use_spike': True, 'bull_rsi_required': False, 'bear_strategy': 'breakout', 'bear_bb_std_mult': 0.8435213355266415, 'bear_rsi_os': 8, 'bear_rsi_ob': 91, 'bear_adx_thresh': 10.192726237962262, 'bear_atr_min_pct': 0.010234756876707118, 'bear_atr_max_pct': 0.047894512799245656, 'bear_tp_mult': 1.2126666207579397, 'bear_tsl_mult': 0.37145491297932653, 'bear_time_stop': 167, 'bear_use_sma': True, 'bear_use_ema': True, 'bear_use_atr': True, 'bear_use_adx': False, 'bear_use_spike': False, 'bear_rsi_required': True, 'sideways_strategy': 'breakout', 'sideways_bb_std_mult': 1.1901582221239382, 'sideways_rsi_os': 38, 'sideways_rsi_ob': 55, 'sideways_adx_thresh': 29.00918483362922, 'sideways_atr_min_pct': 0.011277936654322212, 'sideways_atr_max_pct': 0.020581502676477976, 'sideways_tp_mult': 2.6996007965736393, 'sideways_tsl_mult': 0.41287510397615124, 'sideways_time_stop': 219, 'sideways_use_sma': False, 'sideways_use_ema': True, 'sideways_use_atr': False, 'sideways_use_adx': False, 'sideways_use_spike': True, 'sideways_rsi_required': True}.
[I 2025-08-31 05:34:15,277] Trial 724 finished with values: [-1000000000.0, 1000000000.0] and parameters: {'p_sma': 31, 'p_std': 18, 'p_atr': 13, 'p_adx': 13, 'rsi_period': 47, 'ema1': 25, 'ema2': 25, 'slip_atr_k': 0.026740281684657134, 'slip_spread_k': 0.721085924038998, 'spread_hl_frac': 0.0069469268841602615, 'bb_std_mult': 1.9299482823012735, 'rsi_os': 51, 'rsi_ob': 69, 'vol_spike': 0.0207430356716988, 'adx_thresh': 34.1562470191318, 'atr_min_pct': 0.02206595521881595, 'atr_max_pct': 0.13607435463142237, 'tp_mult': 2.3539152004251505, 'tsl_mult': 0.22480501898785638, 'strategy': 'mean_reversion', 'time_stop': 41, 'use_sma': True, 'use_atr': True, 'use_adx': True, 'use_ema': True, 'use_spike': False, 'rsi_required': True, 'edge_k': 0.9745415268141332, 'edge_cap': 0.7448156096489883, 'bull_strategy': 'mean_reversion', 'bull_bb_std_mult': 0.8887464823115773, 'bull_rsi_os': 42, 'bull_rsi_ob': 80, 'bull_adx_thresh': 8.885122432057946, 'bull_atr_min_pct': 0.0071568985778759624, 'bull_atr_max_pct': 0.10286903059116623, 'bull_tp_mult': 1.6550339536383019, 'bull_tsl_mult': 0.4608208807088386, 'bull_time_stop': 278, 'bull_use_sma': True, 'bull_use_ema': True, 'bull_use_atr': False, 'bull_use_adx': False, 'bull_use_spike': True, 'bull_rsi_required': False, 'bear_strategy': 'breakout', 'bear_bb_std_mult': 1.0114033266121931, 'bear_rsi_os': 10, 'bear_rsi_ob': 91, 'bear_adx_thresh': 24.12687916269431, 'bear_atr_min_pct': 0.009885280568238345, 'bear_atr_max_pct': 0.04056645294896463, 'bear_tp_mult': 1.2362354028538305, 'bear_tsl_mult': 0.2656678307801346, 'bear_time_stop': 108, 'bear_use_sma': False, 'bear_use_ema': False, 'bear_use_atr': False, 'bear_use_adx': False, 'bear_use_spike': False, 'bear_rsi_required': True, 'sideways_strategy': 'breakout', 'sideways_bb_std_mult': 2.860895406918581, 'sideways_rsi_os': 5, 'sideways_rsi_ob': 81, 'sideways_adx_thresh': 19.48235253512035, 'sideways_atr_min_pct': 0.014656915024650571, 'sideways_atr_max_pct': 0.017450391685327932, 'sideways_tp_mult': 2.6948553738868672, 'sideways_tsl_mult': 0.472923979751601, 'sideways_time_stop': 202, 'sideways_use_sma': True, 'sideways_use_ema': True, 'sideways_use_atr': True, 'sideways_use_adx': False, 'sideways_use_spike': False, 'sideways_rsi_required': False}.
[I 2025-08-31 05:34:15,387] Trial 723 finished with values: [-1000000000.0, 1000000000.0] and parameters: {'p_sma': 59, 'p_std': 8, 'p_atr': 13, 'p_adx': 10, 'rsi_period': 8, 'ema1': 26, 'ema2': 47, 'slip_atr_k': 0.02711497779279276, 'slip_spread_k': 0.7202891447358084, 'spread_hl_frac': 0.010277862441899547, 'bb_std_mult': 1.9330246059825142, 'rsi_os': 36, 'rsi_ob': 57, 'vol_spike': 0.15822281468576951, 'adx_thresh': 12.827452120649067, 'atr_min_pct': 0.023044213469680865, 'atr_max_pct': 0.015972487275383765, 'tp_mult': 2.3552630861828967, 'tsl_mult': 0.7907223374889498, 'strategy': 'mean_reversion', 'time_stop': 28, 'use_sma': True, 'use_atr': True, 'use_adx': True, 'use_ema': True, 'use_spike': False, 'rsi_required': True, 'edge_k': 0.34587008270719577, 'edge_cap': 0.7311166375427083, 'bull_strategy': 'mean_reversion', 'bull_bb_std_mult': 2.9103905352279393, 'bull_rsi_os': 43, 'bull_rsi_ob': 80, 'bull_adx_thresh': 34.25631779197698, 'bull_atr_min_pct': 0.0063411504543096926, 'bull_atr_max_pct': 0.03541456614148617, 'bull_tp_mult': 1.189402705045915, 'bull_tsl_mult': 0.9650329869421179, 'bull_time_stop': 194, 'bull_use_sma': True, 'bull_use_ema': False, 'bull_use_atr': False, 'bull_use_adx': False, 'bull_use_spike': True, 'bull_rsi_required': False, 'bear_strategy': 'breakout', 'bear_bb_std_mult': 0.738418924192934, 'bear_rsi_os': 10, 'bear_rsi_ob': 94, 'bear_adx_thresh': 13.010838385290057, 'bear_atr_min_pct': 0.009907796468434508, 'bear_atr_max_pct': 0.047420712549029194, 'bear_tp_mult': 1.2272981205938995, 'bear_tsl_mult': 0.7375770462723698, 'bear_time_stop': 228, 'bear_use_sma': False, 'bear_use_ema': True, 'bear_use_atr': False, 'bear_use_adx': False, 'bear_use_spike': False, 'bear_rsi_required': True, 'sideways_strategy': 'breakout', 'sideways_bb_std_mult': 1.870904855376458, 'sideways_rsi_os': 39, 'sideways_rsi_ob': 54, 'sideways_adx_thresh': 19.02231967465559, 'sideways_atr_min_pct': 0.02120648403264147, 'sideways_atr_max_pct': 0.05011774673903281, 'sideways_tp_mult': 2.0988094698762843, 'sideways_tsl_mult': 0.4732173202994845, 'sideways_time_stop': 201, 'sideways_use_sma': True, 'sideways_use_ema': True, 'sideways_use_atr': True, 'sideways_use_adx': False, 'sideways_use_spike': False, 'sideways_rsi_required': False}.
[I 2025-08-31 05:34:55,446] Trial 722 finished with values: [-1000000000.0, 1000000000.0] and parameters: {'p_sma': 19, 'p_std': 8, 'p_atr': 13, 'p_adx': 10, 'rsi_period': 66, 'ema1': 26, 'ema2': 28, 'slip_atr_k': 0.028207322927177796, 'slip_spread_k': 0.720033116616676, 'spread_hl_frac': 0.00996344062347591, 'bb_std_mult': 1.9191542765384115, 'rsi_os': 15, 'rsi_ob': 57, 'vol_spike': 0.019352142383707818, 'adx_thresh': 12.381436834472224, 'atr_min_pct': 0.01615855139475315, 'atr_max_pct': 0.14610847275273045, 'tp_mult': 1.2010450958204868, 'tsl_mult': 0.44375904510443676, 'strategy': 'mean_reversion', 'time_stop': 28, 'use_sma': True, 'use_atr': True, 'use_adx': True, 'use_ema': True, 'use_spike': False, 'rsi_required': True, 'edge_k': 0.9730005864970519, 'edge_cap': 0.7368135677995856, 'bull_strategy': 'mean_reversion', 'bull_bb_std_mult': 1.6175422830139203, 'bull_rsi_os': 45, 'bull_rsi_ob': 83, 'bull_adx_thresh': 8.695888953391677, 'bull_atr_min_pct': 0.013682118725439377, 'bull_atr_max_pct': 0.054324993855355844, 'bull_tp_mult': 1.675761777592134, 'bull_tsl_mult': 0.2625640190811873, 'bull_time_stop': 276, 'bull_use_sma': True, 'bull_use_ema': False, 'bull_use_atr': False, 'bull_use_adx': False, 'bull_use_spike': True, 'bull_rsi_required': False, 'bear_strategy': 'breakout', 'bear_bb_std_mult': 0.7251945845578096, 'bear_rsi_os': 16, 'bear_rsi_ob': 85, 'bear_adx_thresh': 18.319233466879613, 'bear_atr_min_pct': 0.009936076201477644, 'bear_atr_max_pct': 0.04806844645023489, 'bear_tp_mult': 1.4166925950703089, 'bear_tsl_mult': 0.7377586038509688, 'bear_time_stop': 295, 'bear_use_sma': False, 'bear_use_ema': True, 'bear_use_atr': False, 'bear_use_adx': False, 'bear_use_spike': False, 'bear_rsi_required': True, 'sideways_strategy': 'breakout', 'sideways_bb_std_mult': 0.7331119535917525, 'sideways_rsi_os': 37, 'sideways_rsi_ob': 89, 'sideways_adx_thresh': 24.99559862322917, 'sideways_atr_min_pct': 0.020856044011922276, 'sideways_atr_max_pct': 0.052556845045645034, 'sideways_tp_mult': 2.0803772776995073, 'sideways_tsl_mult': 0.46619982923626524, 'sideways_time_stop': 208, 'sideways_use_sma': False, 'sideways_use_ema': True, 'sideways_use_atr': True, 'sideways_use_adx': False, 'sideways_use_spike': False, 'sideways_rsi_required': False}.
[I 2025-08-31 05:34:57,885] Trial 725 finished with values: [-1000000000.0, 1000000000.0] and parameters: {'p_sma': 15, 'p_std': 30, 'p_atr': 19, 'p_adx': 30, 'rsi_period': 65, 'ema1': 26, 'ema2': 28, 'slip_atr_k': 0.16246988269384705, 'slip_spread_k': 0.7802013240696972, 'spread_hl_frac': 0.01191731722562196, 'bb_std_mult': 1.939026131293953, 'rsi_os': 21, 'rsi_ob': 64, 'vol_spike': 0.027377730001842585, 'adx_thresh': 12.262397273123105, 'atr_min_pct': 0.023484736271637996, 'atr_max_pct': 0.05681285726246545, 'tp_mult': 2.446435017133172, 'tsl_mult': 0.12125028218745831, 'strategy': 'mean_reversion', 'time_stop': 82, 'use_sma': False, 'use_atr': True, 'use_adx': True, 'use_ema': False, 'use_spike': True, 'rsi_required': True, 'edge_k': 0.32815508637347424, 'edge_cap': 0.4589433343103939, 'bull_strategy': 'mean_reversion', 'bull_bb_std_mult': 2.8412008861383375, 'bull_rsi_os': 55, 'bull_rsi_ob': 66, 'bull_adx_thresh': 23.60912462116019, 'bull_atr_min_pct': 0.026632871644824425, 'bull_atr_max_pct': 0.03478677843067104, 'bull_tp_mult': 1.6657323928654064, 'bull_tsl_mult': 0.8985446095338613, 'bull_time_stop': 245, 'bull_use_sma': True, 'bull_use_ema': False, 'bull_use_atr': True, 'bull_use_adx': False, 'bull_use_spike': False, 'bull_rsi_required': False, 'bear_strategy': 'breakout', 'bear_bb_std_mult': 0.7509695293668349, 'bear_rsi_os': 12, 'bear_rsi_ob': 89, 'bear_adx_thresh': 12.929237430498247, 'bear_atr_min_pct': 0.017176408481891486, 'bear_atr_max_pct': 0.04401003819488465, 'bear_tp_mult': 1.715935411798934, 'bear_tsl_mult': 0.23817431743461898, 'bear_time_stop': 294, 'bear_use_sma': False, 'bear_use_ema': True, 'bear_use_atr': False, 'bear_use_adx': False, 'bear_use_spike': False, 'bear_rsi_required': True, 'sideways_strategy': 'breakout', 'sideways_bb_std_mult': 1.2628304455455501, 'sideways_rsi_os': 37, 'sideways_rsi_ob': 88, 'sideways_adx_thresh': 25.124056658953904, 'sideways_atr_min_pct': 0.013954809163208015, 'sideways_atr_max_pct': 0.0898577854260221, 'sideways_tp_mult': 2.1341214902443424, 'sideways_tsl_mult': 0.01253898726563496, 'sideways_time_stop': 206, 'sideways_use_sma': False, 'sideways_use_ema': True, 'sideways_use_atr': True, 'sideways_use_adx': False, 'sideways_use_spike': False, 'sideways_rsi_required': False}.
[I 2025-08-31 05:34:58,641] Trial 726 finished with values: [-1000000000.0, 1000000000.0] and parameters: {'p_sma': 59, 'p_std': 8, 'p_atr': 19, 'p_adx': 30, 'rsi_period': 7, 'ema1': 26, 'ema2': 28, 'slip_atr_k': 0.011904293777599911, 'slip_spread_k': 0.6137699452044566, 'spread_hl_frac': 0.01183958377620881, 'bb_std_mult': 2.2385487281259406, 'rsi_os': 24, 'rsi_ob': 64, 'vol_spike': 0.026428952884514918, 'adx_thresh': 21.863981532808427, 'atr_min_pct': 0.020731120327185843, 'atr_max_pct': 0.14564659907950106, 'tp_mult': 2.4668384950029516, 'tsl_mult': 0.10198347501772786, 'strategy': 'mean_reversion', 'time_stop': 34, 'use_sma': False, 'use_atr': True, 'use_adx': True, 'use_ema': False, 'use_spike': True, 'rsi_required': True, 'edge_k': 0.3288691367984489, 'edge_cap': 0.7616133650982821, 'bull_strategy': 'mean_reversion', 'bull_bb_std_mult': 1.0017328118210365, 'bull_rsi_os': 55, 'bull_rsi_ob': 66, 'bull_adx_thresh': 28.221846782065164, 'bull_atr_min_pct': 0.006260510110943359, 'bull_atr_max_pct': 0.053729934135937976, 'bull_tp_mult': 2.8406681593798875, 'bull_tsl_mult': 0.9037976498693586, 'bull_time_stop': 171, 'bull_use_sma': True, 'bull_use_ema': False, 'bull_use_atr': True, 'bull_use_adx': False, 'bull_use_spike': False, 'bull_rsi_required': False, 'bear_strategy': 'breakout', 'bear_bb_std_mult': 0.7640640263283448, 'bear_rsi_os': 20, 'bear_rsi_ob': 84, 'bear_adx_thresh': 22.68557265864165, 'bear_atr_min_pct': 0.01119613333030172, 'bear_atr_max_pct': 0.0439446595049694, 'bear_tp_mult': 1.5488602926553738, 'bear_tsl_mult': 0.24369099609389772, 'bear_time_stop': 294, 'bear_use_sma': False, 'bear_use_ema': True, 'bear_use_atr': False, 'bear_use_adx': False, 'bear_use_spike': False, 'bear_rsi_required': True, 'sideways_strategy': 'breakout', 'sideways_bb_std_mult': 1.0576794076307594, 'sideways_rsi_os': 36, 'sideways_rsi_ob': 72, 'sideways_adx_thresh': 31.763111484105732, 'sideways_atr_min_pct': 0.014048906856792191, 'sideways_atr_max_pct': 0.05243062932305666, 'sideways_tp_mult': 2.134687371666045, 'sideways_tsl_mult': 0.44884421950314823, 'sideways_time_stop': 241, 'sideways_use_sma': False, 'sideways_use_ema': True, 'sideways_use_atr': True, 'sideways_use_adx': False, 'sideways_use_spike': False, 'sideways_rsi_required': False}.
[I 2025-08-31 05:35:01,350] Trial 727 finished with values: [-0.017766454624976502, 0.017741258121042137] and parameters: {'p_sma': 56, 'p_std': 54, 'p_atr': 18, 'p_adx': 30, 'rsi_period': 22, 'ema1': 23, 'ema2': 28, 'slip_atr_k': 0.011370468207271014, 'slip_spread_k': 0.6885359885516704, 'spread_hl_frac': 0.012188704219257255, 'bb_std_mult': 1.9885365875023888, 'rsi_os': 20, 'rsi_ob': 60, 'vol_spike': 0.02639648031327896, 'adx_thresh': 26.755212129142265, 'atr_min_pct': 0.020922505292310416, 'atr_max_pct': 0.11822529193050646, 'tp_mult': 1.1944502009908153, 'tsl_mult': 0.6522312818757466, 'strategy': 'mean_reversion', 'time_stop': 300, 'use_sma': False, 'use_atr': True, 'use_adx': False, 'use_ema': False, 'use_spike': True, 'rsi_required': True, 'edge_k': 0.5386952893805479, 'edge_cap': 0.7595245731843648, 'bull_strategy': 'mean_reversion', 'bull_bb_std_mult': 1.6423080871140097, 'bull_rsi_os': 26, 'bull_rsi_ob': 47, 'bull_adx_thresh': 9.934774675417769, 'bull_atr_min_pct': 0.023891541495968196, 'bull_atr_max_pct': 0.053447852812334995, 'bull_tp_mult': 1.1336050260747623, 'bull_tsl_mult': 0.8978387849773469, 'bull_time_stop': 245, 'bull_use_sma': False, 'bull_use_ema': False, 'bull_use_atr': True, 'bull_use_adx': True, 'bull_use_spike': False, 'bull_rsi_required': False, 'bear_strategy': 'breakout', 'bear_bb_std_mult': 2.975243044201862, 'bear_rsi_os': 12, 'bear_rsi_ob': 85, 'bear_adx_thresh': 16.12896524567843, 'bear_atr_min_pct': 0.008687895125809704, 'bear_atr_max_pct': 0.04393117620933696, 'bear_tp_mult': 1.5497624390493205, 'bear_tsl_mult': 0.2064602287081625, 'bear_time_stop': 294, 'bear_use_sma': True, 'bear_use_ema': True, 'bear_use_atr': True, 'bear_use_adx': False, 'bear_use_spike': False, 'bear_rsi_required': True, 'sideways_strategy': 'breakout', 'sideways_bb_std_mult': 3.3167487125930837, 'sideways_rsi_os': 53, 'sideways_rsi_ob': 57, 'sideways_adx_thresh': 25.143381803585086, 'sideways_atr_min_pct': 0.0016200860913080685, 'sideways_atr_max_pct': 0.04704462192378, 'sideways_tp_mult': 2.1414163943537736, 'sideways_tsl_mult': 0.5328606662129409, 'sideways_time_stop': 193, 'sideways_use_sma': False, 'sideways_use_ema': True, 'sideways_use_atr': False, 'sideways_use_adx': False, 'sideways_use_spike': True, 'sideways_rsi_required': True}.
[I 2025-08-31 05:35:03,045] Trial 731 finished with values: [-1000000000.0, 1000000000.0] and parameters: {'p_sma': 58, 'p_std': 13, 'p_atr': 18, 'p_adx': 8, 'rsi_period': 23, 'ema1': 6, 'ema2': 23, 'slip_atr_k': 0.03376049350563609, 'slip_spread_k': 0.5447234507275894, 'spread_hl_frac': 0.010863087406101082, 'bb_std_mult': 3.544229621662564, 'rsi_os': 10, 'rsi_ob': 46, 'vol_spike': 0.03274361855641417, 'adx_thresh': 11.74682784051043, 'atr_min_pct': 0.02448449659551686, 'atr_max_pct': 0.10436230474826752, 'tp_mult': 2.4299060971598005, 'tsl_mult': 0.844049807734527, 'strategy': 'mean_reversion', 'time_stop': 261, 'use_sma': False, 'use_atr': True, 'use_adx': False, 'use_ema': False, 'use_spike': True, 'rsi_required': True, 'edge_k': 0.9213889356760739, 'edge_cap': 0.28795966691253116, 'bull_strategy': 'mean_reversion', 'bull_bb_std_mult': 1.2494061308946165, 'bull_rsi_os': 41, 'bull_rsi_ob': 77, 'bull_adx_thresh': 9.41737055678536, 'bull_atr_min_pct': 0.00010023511987621546, 'bull_atr_max_pct': 0.03975845381781314, 'bull_tp_mult': 1.3293816861993135, 'bull_tsl_mult': 0.01660473629929632, 'bull_time_stop': 252, 'bull_use_sma': False, 'bull_use_ema': True, 'bull_use_atr': True, 'bull_use_adx': True, 'bull_use_spike': False, 'bull_rsi_required': False, 'bear_strategy': 'breakout', 'bear_bb_std_mult': 2.4108878805385956, 'bear_rsi_os': 11, 'bear_rsi_ob': 76, 'bear_adx_thresh': 33.54793406728295, 'bear_atr_min_pct': 0.009053645388770931, 'bear_atr_max_pct': 0.03945099014019462, 'bear_tp_mult': 2.1545453733335784, 'bear_tsl_mult': 0.6374739340618597, 'bear_time_stop': 244, 'bear_use_sma': True, 'bear_use_ema': False, 'bear_use_atr': True, 'bear_use_adx': False, 'bear_use_spike': False, 'bear_rsi_required': False, 'sideways_strategy': 'breakout', 'sideways_bb_std_mult': 1.6338153332104, 'sideways_rsi_os': 7, 'sideways_rsi_ob': 56, 'sideways_adx_thresh': 24.03331649436332, 'sideways_atr_min_pct': 0.016073613345445808, 'sideways_atr_max_pct': 0.06967732361397354, 'sideways_tp_mult': 2.2517273530826474, 'sideways_tsl_mult': 0.8997090412857596, 'sideways_time_stop': 226, 'sideways_use_sma': True, 'sideways_use_ema': True, 'sideways_use_atr': False, 'sideways_use_adx': False, 'sideways_use_spike': True, 'sideways_rsi_required': True}.
