[I 2025-08-31 05:19:48,861] Trial 630 finished with values: [-1000000000.0, 1000000000.0] and parameters: {'p_sma': 57, 'p_std': 13, 'p_atr': 19, 'p_adx': 11, 'rsi_period': 18, 'ema1': 26, 'ema2': 25, 'slip_atr_k': 0.023261215654703966, 'slip_spread_k': 0.6245037201190672, 'spread_hl_frac': 0.009894311732801826, 'bb_std_mult': 1.9547808694357627, 'rsi_os': 20, 'rsi_ob': 61, 'vol_spike': 0.019492369371019967, 'adx_thresh': 11.768665890469666, 'atr_min_pct': 0.021957124093888006, 'atr_max_pct': 0.1434809950114599, 'tp_mult': 2.458476646499066, 'tsl_mult': 0.8182621925814412, 'strategy': 'mean_reversion', 'time_stop': 23, 'use_sma': False, 'use_atr': True, 'use_adx': False, 'use_ema': False, 'use_spike': True, 'rsi_required': True, 'edge_k': 0.6039732841902077, 'edge_cap': 0.813372484953484, 'bull_strategy': 'mean_reversion', 'bull_bb_std_mult': 0.9306189466386182, 'bull_rsi_os': 42, 'bull_rsi_ob': 79, 'bull_adx_thresh': 7.335869460699961, 'bull_atr_min_pct': 0.012031326094497283, 'bull_atr_max_pct': 0.07076678590062545, 'bull_tp_mult': 1.6311552039929782, 'bull_tsl_mult': 0.9312819827165477, 'bull_time_stop': 222, 'bull_use_sma': False, 'bull_use_ema': False, 'bull_use_atr': True, 'bull_use_adx': True, 'bull_use_spike': False, 'bull_rsi_required': False, 'bear_strategy': 'breakout', 'bear_bb_std_mult': 0.767088579285755, 'bear_rsi_os': 12, 'bear_rsi_ob': 73, 'bear_adx_thresh': 7.674131536363031, 'bear_atr_min_pct': 0.0063996155835720275, 'bear_atr_max_pct': 0.04361326252276815, 'bear_tp_mult': 1.3941466923231736, 'bear_tsl_mult': 0.2506464466434628, 'bear_time_stop': 294, 'bear_use_sma': True, 'bear_use_ema': True, 'bear_use_atr': True, 'bear_use_adx': False, 'bear_use_spike': False, 'bear_rsi_required': True, 'sideways_strategy': 'breakout', 'sideways_bb_std_mult': 1.2509014765127096, 'sideways_rsi_os': 39, 'sideways_rsi_ob': 55, 'sideways_adx_thresh': 26.989167815548928, 'sideways_atr_min_pct': 0.013819917677593033, 'sideways_atr_max_pct': 0.033470934155042695, 'sideways_tp_mult': 2.2198044901499028, 'sideways_tsl_mult': 0.46731798772613115, 'sideways_time_stop': 187, 'sideways_use_sma': False, 'sideways_use_ema': True, 'sideways_use_atr': False, 'sideways_use_adx': False, 'sideways_use_spike': True, 'sideways_rsi_required': True}.
[I 2025-08-31 05:19:49,962] Trial 633 finished with values: [-1000000000.0, 1000000000.0] and parameters: {'p_sma': 57, 'p_std': 16, 'p_atr': 16, 'p_adx': 20, 'rsi_period': 18, 'ema1': 23, 'ema2': 24, 'slip_atr_k': 0.030117455482365968, 'slip_spread_k': 0.7118286867033399, 'spread_hl_frac': 0.007501411352048872, 'bb_std_mult': 2.0061452302358425, 'rsi_os': 43, 'rsi_ob': 60, 'vol_spike': 0.01970228372338807, 'adx_thresh': 11.614524574946163, 'atr_min_pct': 0.00909186033181289, 'atr_max_pct': 0.13413445539902752, 'tp_mult': 2.4715547612516477, 'tsl_mult': 0.8207092952047175, 'strategy': 'mean_reversion', 'time_stop': 27, 'use_sma': False, 'use_atr': True, 'use_adx': False, 'use_ema': False, 'use_spike': True, 'rsi_required': True, 'edge_k': 0.614399446839123, 'edge_cap': 0.746672088352312, 'bull_strategy': 'mean_reversion', 'bull_bb_std_mult': 0.9968632769505891, 'bull_rsi_os': 51, 'bull_rsi_ob': 78, 'bull_adx_thresh': 9.601444464215344, 'bull_atr_min_pct': 0.010494122979600368, 'bull_atr_max_pct': 0.05981053970933209, 'bull_tp_mult': 1.6382261679456134, 'bull_tsl_mult': 0.9425068571184642, 'bull_time_stop': 231, 'bull_use_sma': False, 'bull_use_ema': False, 'bull_use_atr': True, 'bull_use_adx': True, 'bull_use_spike': False, 'bull_rsi_required': False, 'bear_strategy': 'breakout', 'bear_bb_std_mult': 0.879854274377329, 'bear_rsi_os': 12, 'bear_rsi_ob': 85, 'bear_adx_thresh': 24.60767741565868, 'bear_atr_min_pct': 0.008629353643301045, 'bear_atr_max_pct': 0.040425777155126796, 'bear_tp_mult': 1.0736095998621897, 'bear_tsl_mult': 0.2496696785594682, 'bear_time_stop': 276, 'bear_use_sma': True, 'bear_use_ema': True, 'bear_use_atr': True, 'bear_use_adx': False, 'bear_use_spike': False, 'bear_rsi_required': True, 'sideways_strategy': 'breakout', 'sideways_bb_std_mult': 1.1310886093548569, 'sideways_rsi_os': 40, 'sideways_rsi_ob': 55, 'sideways_adx_thresh': 26.59125356519158, 'sideways_atr_min_pct': 0.01567084845741372, 'sideways_atr_max_pct': 0.06144435127236799, 'sideways_tp_mult': 2.073050288822986, 'sideways_tsl_mult': 0.4958742840916074, 'sideways_time_stop': 197, 'sideways_use_sma': False, 'sideways_use_ema': True, 'sideways_use_atr': False, 'sideways_use_adx': False, 'sideways_use_spike': True, 'sideways_rsi_required': True}.
[I 2025-08-31 05:19:49,984] Trial 632 finished with values: [-1000000000.0, 1000000000.0] and parameters: {'p_sma': 57, 'p_std': 13, 'p_atr': 16, 'p_adx': 8, 'rsi_period': 19, 'ema1': 27, 'ema2': 24, 'slip_atr_k': 0.028683235274335514, 'slip_spread_k': 0.6526442350140755, 'spread_hl_frac': 0.00787157335418839, 'bb_std_mult': 2.0126555358333036, 'rsi_os': 16, 'rsi_ob': 60, 'vol_spike': 0.0001908350510107168, 'adx_thresh': 10.672234642100163, 'atr_min_pct': 0.009462283588032538, 'atr_max_pct': 0.11275464859084627, 'tp_mult': 2.4770678221678195, 'tsl_mult': 0.8286537984452075, 'strategy': 'mean_reversion', 'time_stop': 33, 'use_sma': False, 'use_atr': True, 'use_adx': False, 'use_ema': False, 'use_spike': True, 'rsi_required': True, 'edge_k': 0.3753484160378803, 'edge_cap': 0.8106737343876719, 'bull_strategy': 'mean_reversion', 'bull_bb_std_mult': 0.96750944793263, 'bull_rsi_os': 51, 'bull_rsi_ob': 78, 'bull_adx_thresh': 9.734389557455907, 'bull_atr_min_pct': 0.014417267204241788, 'bull_atr_max_pct': 0.02099777545253486, 'bull_tp_mult': 1.653379878674076, 'bull_tsl_mult': 0.9772659572773668, 'bull_time_stop': 230, 'bull_use_sma': False, 'bull_use_ema': False, 'bull_use_atr': True, 'bull_use_adx': True, 'bull_use_spike': False, 'bull_rsi_required': False, 'bear_strategy': 'breakout', 'bear_bb_std_mult': 0.8021533531764199, 'bear_rsi_os': 12, 'bear_rsi_ob': 81, 'bear_adx_thresh': 17.488903152012465, 'bear_atr_min_pct': 0.007310862980419763, 'bear_atr_max_pct': 0.040668960801430946, 'bear_tp_mult': 1.0770759537265058, 'bear_tsl_mult': 0.2540118825324747, 'bear_time_stop': 293, 'bear_use_sma': True, 'bear_use_ema': True, 'bear_use_atr': True, 'bear_use_adx': False, 'bear_use_spike': False, 'bear_rsi_required': True, 'sideways_strategy': 'breakout', 'sideways_bb_std_mult': 1.2533710121691486, 'sideways_rsi_os': 39, 'sideways_rsi_ob': 55, 'sideways_adx_thresh': 25.34085509790896, 'sideways_atr_min_pct': 0.013810343149364742, 'sideways_atr_max_pct': 0.06095652135979, 'sideways_tp_mult': 2.071901450694043, 'sideways_tsl_mult': 0.49576544687815166, 'sideways_time_stop': 218, 'sideways_use_sma': False, 'sideways_use_ema': True, 'sideways_use_atr': False, 'sideways_use_adx': False, 'sideways_use_spike': True, 'sideways_rsi_required': True}.
[I 2025-08-31 05:19:51,087] Trial 631 finished with values: [-1000000000.0, 1000000000.0] and parameters: {'p_sma': 57, 'p_std': 13, 'p_atr': 19, 'p_adx': 8, 'rsi_period': 17, 'ema1': 27, 'ema2': 24, 'slip_atr_k': 0.03098351193431407, 'slip_spread_k': 0.7113793321407426, 'spread_hl_frac': 0.007898104979617251, 'bb_std_mult': 2.164720496806094, 'rsi_os': 17, 'rsi_ob': 60, 'vol_spike': 0.01739323810367036, 'adx_thresh': 10.704129606013094, 'atr_min_pct': 0.00957715793255949, 'atr_max_pct': 0.11186689348373771, 'tp_mult': 2.475492363450247, 'tsl_mult': 0.8236838716796028, 'strategy': 'mean_reversion', 'time_stop': 22, 'use_sma': False, 'use_atr': True, 'use_adx': False, 'use_ema': False, 'use_spike': True, 'rsi_required': True, 'edge_k': 0.36660730174370526, 'edge_cap': 0.8193471767278017, 'bull_strategy': 'mean_reversion', 'bull_bb_std_mult': 0.9587825387884813, 'bull_rsi_os': 51, 'bull_rsi_ob': 78, 'bull_adx_thresh': 9.653193586840887, 'bull_atr_min_pct': 0.005103763274209968, 'bull_atr_max_pct': 0.059450959399944193, 'bull_tp_mult': 1.6337148387626208, 'bull_tsl_mult': 0.9771705076901385, 'bull_time_stop': 275, 'bull_use_sma': False, 'bull_use_ema': False, 'bull_use_atr': True, 'bull_use_adx': True, 'bull_use_spike': False, 'bull_rsi_required': False, 'bear_strategy': 'breakout', 'bear_bb_std_mult': 0.789423338491625, 'bear_rsi_os': 12, 'bear_rsi_ob': 81, 'bear_adx_thresh': 25.82052221995066, 'bear_atr_min_pct': 0.008734666588526802, 'bear_atr_max_pct': 0.039806761533746376, 'bear_tp_mult': 1.3095917865430549, 'bear_tsl_mult': 0.25164972875783403, 'bear_time_stop': 273, 'bear_use_sma': True, 'bear_use_ema': True, 'bear_use_atr': True, 'bear_use_adx': False, 'bear_use_spike': False, 'bear_rsi_required': True, 'sideways_strategy': 'breakout', 'sideways_bb_std_mult': 1.2228718170036685, 'sideways_rsi_os': 38, 'sideways_rsi_ob': 55, 'sideways_adx_thresh': 26.891376008871166, 'sideways_atr_min_pct': 0.013766315091087826, 'sideways_atr_max_pct': 0.045817446774461236, 'sideways_tp_mult': 2.0699633647809295, 'sideways_tsl_mult': 0.41331010035384175, 'sideways_time_stop': 186, 'sideways_use_sma': False, 'sideways_use_ema': True, 'sideways_use_atr': False, 'sideways_use_adx': False, 'sideways_use_spike': True, 'sideways_rsi_required': True}.
[I 2025-08-31 05:20:34,427] Trial 634 finished with values: [-1000000000.0, 1000000000.0] and parameters: {'p_sma': 57, 'p_std': 16, 'p_atr': 16, 'p_adx': 8, 'rsi_period': 16, 'ema1': 27, 'ema2': 26, 'slip_atr_k': 0.02847364490173238, 'slip_spread_k': 0.7048857424902794, 'spread_hl_frac': 0.00822497254716027, 'bb_std_mult': 2.2036672908438937, 'rsi_os': 18, 'rsi_ob': 57, 'vol_spike': 0.013131305915326243, 'adx_thresh': 10.53744082725182, 'atr_min_pct': 0.00929179246090249, 'atr_max_pct': 0.09829625118922333, 'tp_mult': 2.298969492230339, 'tsl_mult': 0.8314622675978699, 'strategy': 'mean_reversion', 'time_stop': 26, 'use_sma': False, 'use_atr': True, 'use_adx': False, 'use_ema': False, 'use_spike': True, 'rsi_required': True, 'edge_k': 0.48627374106488064, 'edge_cap': 0.745361043994082, 'bull_strategy': 'mean_reversion', 'bull_bb_std_mult': 0.9801768991145662, 'bull_rsi_os': 44, 'bull_rsi_ob': 78, 'bull_adx_thresh': 8.282241155518618, 'bull_atr_min_pct': 0.010858453685215465, 'bull_atr_max_pct': 0.05800819160196011, 'bull_tp_mult': 1.6902019727288655, 'bull_tsl_mult': 0.8881575761612938, 'bull_time_stop': 227, 'bull_use_sma': False, 'bull_use_ema': False, 'bull_use_atr': True, 'bull_use_adx': True, 'bull_use_spike': False, 'bull_rsi_required': False, 'bear_strategy': 'breakout', 'bear_bb_std_mult': 0.8742998248159682, 'bear_rsi_os': 10, 'bear_rsi_ob': 79, 'bear_adx_thresh': 30.475533149498766, 'bear_atr_min_pct': 0.008725200372177264, 'bear_atr_max_pct': 0.03880073226294828, 'bear_tp_mult': 1.1509282389196935, 'bear_tsl_mult': 0.2607901408224316, 'bear_time_stop': 274, 'bear_use_sma': True, 'bear_use_ema': True, 'bear_use_atr': True, 'bear_use_adx': False, 'bear_use_spike': False, 'bear_rsi_required': True, 'sideways_strategy': 'breakout', 'sideways_bb_std_mult': 1.134623178118055, 'sideways_rsi_os': 40, 'sideways_rsi_ob': 55, 'sideways_adx_thresh': 22.970183330856074, 'sideways_atr_min_pct': 0.0156506307487497, 'sideways_atr_max_pct': 0.04091721930729758, 'sideways_tp_mult': 2.0857226337864128, 'sideways_tsl_mult': 0.4388751959005599, 'sideways_time_stop': 184, 'sideways_use_sma': False, 'sideways_use_ema': True, 'sideways_use_atr': False, 'sideways_use_adx': False, 'sideways_use_spike': True, 'sideways_rsi_required': True}.
[I 2025-08-31 05:20:35,103] Trial 635 finished with values: [-1000000000.0, 1000000000.0] and parameters: {'p_sma': 60, 'p_std': 14, 'p_atr': 14, 'p_adx': 19, 'rsi_period': 15, 'ema1': 27, 'ema2': 22, 'slip_atr_k': 0.022589718905598962, 'slip_spread_k': 0.7486547167091347, 'spread_hl_frac': 0.008358850520107177, 'bb_std_mult': 2.180264784770504, 'rsi_os': 18, 'rsi_ob': 58, 'vol_spike': 0.0147981966057893, 'adx_thresh': 10.579518025299855, 'atr_min_pct': 0.024251734900165117, 'atr_max_pct': 0.10941590986498766, 'tp_mult': 2.337336918790084, 'tsl_mult': 0.7460655342576097, 'strategy': 'mean_reversion', 'time_stop': 23, 'use_sma': False, 'use_atr': True, 'use_adx': False, 'use_ema': False, 'use_spike': True, 'rsi_required': True, 'edge_k': 0.46861525302902984, 'edge_cap': 0.7683526883359274, 'bull_strategy': 'mean_reversion', 'bull_bb_std_mult': 0.7678426297798858, 'bull_rsi_os': 44, 'bull_rsi_ob': 78, 'bull_adx_thresh': 8.170473752565819, 'bull_atr_min_pct': 0.005029221256933935, 'bull_atr_max_pct': 0.058607510245873407, 'bull_tp_mult': 1.6840075737466895, 'bull_tsl_mult': 0.8931584393057772, 'bull_time_stop': 269, 'bull_use_sma': False, 'bull_use_ema': True, 'bull_use_atr': True, 'bull_use_adx': True, 'bull_use_spike': False, 'bull_rsi_required': False, 'bear_strategy': 'breakout', 'bear_bb_std_mult': 0.6792259270933731, 'bear_rsi_os': 10, 'bear_rsi_ob': 82, 'bear_adx_thresh': 25.9554084876714, 'bear_atr_min_pct': 0.008937328959055982, 'bear_atr_max_pct': 0.03869976150256084, 'bear_tp_mult': 1.1387569693022341, 'bear_tsl_mult': 0.19708008424924672, 'bear_time_stop': 253, 'bear_use_sma': True, 'bear_use_ema': False, 'bear_use_atr': True, 'bear_use_adx': False, 'bear_use_spike': False, 'bear_rsi_required': True, 'sideways_strategy': 'breakout', 'sideways_bb_std_mult': 1.1385578629460842, 'sideways_rsi_os': 37, 'sideways_rsi_ob': 57, 'sideways_adx_thresh': 28.671490508350608, 'sideways_atr_min_pct': 0.015442626052433583, 'sideways_atr_max_pct': 0.051598855474322025, 'sideways_tp_mult': 2.065842155108096, 'sideways_tsl_mult': 0.4317063738027542, 'sideways_time_stop': 204, 'sideways_use_sma': False, 'sideways_use_ema': True, 'sideways_use_atr': False, 'sideways_use_adx': False, 'sideways_use_spike': True, 'sideways_rsi_required': True}.
[I 2025-08-31 05:20:35,861] Trial 636 finished with values: [-1000000000.0, 1000000000.0] and parameters: {'p_sma': 60, 'p_std': 14, 'p_atr': 14, 'p_adx': 19, 'rsi_period': 17, 'ema1': 24, 'ema2': 22, 'slip_atr_k': 0.02110002728626361, 'slip_spread_k': 0.5395987546372383, 'spread_hl_frac': 0.00868882504246769, 'bb_std_mult': 2.175415701754191, 'rsi_os': 14, 'rsi_ob': 54, 'vol_spike': 0.00984962940067142, 'adx_thresh': 10.504967782835159, 'atr_min_pct': 0.0241686361774289, 'atr_max_pct': 0.10506964206574732, 'tp_mult': 2.348204428350388, 'tsl_mult': 0.7523202744364945, 'strategy': 'mean_reversion', 'time_stop': 23, 'use_sma': False, 'use_atr': True, 'use_adx': False, 'use_ema': False, 'use_spike': True, 'rsi_required': True, 'edge_k': 0.49861169315646875, 'edge_cap': 0.7780137558170563, 'bull_strategy': 'mean_reversion', 'bull_bb_std_mult': 0.7366559283979585, 'bull_rsi_os': 41, 'bull_rsi_ob': 78, 'bull_adx_thresh': 8.131449284326063, 'bull_atr_min_pct': 0.007819735275991835, 'bull_atr_max_pct': 0.03631078789639125, 'bull_tp_mult': 1.711879038826655, 'bull_tsl_mult': 0.8885530274044635, 'bull_time_stop': 267, 'bull_use_sma': False, 'bull_use_ema': True, 'bull_use_atr': True, 'bull_use_adx': True, 'bull_use_spike': False, 'bull_rsi_required': False, 'bear_strategy': 'breakout', 'bear_bb_std_mult': 0.8773545887049006, 'bear_rsi_os': 10, 'bear_rsi_ob': 80, 'bear_adx_thresh': 30.730694823468482, 'bear_atr_min_pct': 0.009171581194969317, 'bear_atr_max_pct': 0.0557503074952893, 'bear_tp_mult': 1.1609235998185632, 'bear_tsl_mult': 0.17151971242191008, 'bear_time_stop': 222, 'bear_use_sma': True, 'bear_use_ema': False, 'bear_use_atr': True, 'bear_use_adx': False, 'bear_use_spike': False, 'bear_rsi_required': True, 'sideways_strategy': 'breakout', 'sideways_bb_std_mult': 1.1384281763615578, 'sideways_rsi_os': 38, 'sideways_rsi_ob': 57, 'sideways_adx_thresh': 22.71928593512806, 'sideways_atr_min_pct': 0.014597723126861565, 'sideways_atr_max_pct': 0.041922947927089955, 'sideways_tp_mult': 2.063267874355748, 'sideways_tsl_mult': 0.471196835492808, 'sideways_time_stop': 182, 'sideways_use_sma': False, 'sideways_use_ema': True, 'sideways_use_atr': False, 'sideways_use_adx': False, 'sideways_use_spike': True, 'sideways_rsi_required': True}.
[I 2025-08-31 05:20:36,499] Trial 637 finished with values: [-1000000000.0, 1000000000.0] and parameters: {'p_sma': 60, 'p_std': 14, 'p_atr': 14, 'p_adx': 10, 'rsi_period': 20, 'ema1': 21, 'ema2': 22, 'slip_atr_k': 0.022283622888428133, 'slip_spread_k': 0.7550094852218308, 'spread_hl_frac': 0.006849704879543632, 'bb_std_mult': 2.1883951209155548, 'rsi_os': 35, 'rsi_ob': 57, 'vol_spike': 0.012745141031375784, 'adx_thresh': 11.79524057759078, 'atr_min_pct': 0.02429555774191063, 'atr_max_pct': 0.09814702356737683, 'tp_mult': 2.271684227365394, 'tsl_mult': 0.7400179201685518, 'strategy': 'mean_reversion', 'time_stop': 5, 'use_sma': True, 'use_atr': True, 'use_adx': False, 'use_ema': False, 'use_spike': True, 'rsi_required': True, 'edge_k': 0.49039182695136674, 'edge_cap': 0.7756826845929713, 'bull_strategy': 'mean_reversion', 'bull_bb_std_mult': 0.7709354661436714, 'bull_rsi_os': 41, 'bull_rsi_ob': 78, 'bull_adx_thresh': 8.444983045480901, 'bull_atr_min_pct': 0.018429999594625122, 'bull_atr_max_pct': 0.07423291922658089, 'bull_tp_mult': 1.6934897747623507, 'bull_tsl_mult': 0.8854054240213789, 'bull_time_stop': 246, 'bull_use_sma': False, 'bull_use_ema': True, 'bull_use_atr': False, 'bull_use_adx': True, 'bull_use_spike': False, 'bull_rsi_required': False, 'bear_strategy': 'breakout', 'bear_bb_std_mult': 0.7138704955829015, 'bear_rsi_os': 10, 'bear_rsi_ob': 79, 'bear_adx_thresh': 27.066710962586274, 'bear_atr_min_pct': 0.005687220244865493, 'bear_atr_max_pct': 0.05619633031243181, 'bear_tp_mult': 1.1406071516842142, 'bear_tsl_mult': 0.16891174393889202, 'bear_time_stop': 236, 'bear_use_sma': True, 'bear_use_ema': False, 'bear_use_atr': True, 'bear_use_adx': False, 'bear_use_spike': False, 'bear_rsi_required': True, 'sideways_strategy': 'breakout', 'sideways_bb_std_mult': 1.1314843535646637, 'sideways_rsi_os': 37, 'sideways_rsi_ob': 57, 'sideways_adx_thresh': 22.80911457931185, 'sideways_atr_min_pct': 0.014650433348037069, 'sideways_atr_max_pct': 0.04277585119272287, 'sideways_tp_mult': 2.0688267243956537, 'sideways_tsl_mult': 0.4342276364007192, 'sideways_time_stop': 204, 'sideways_use_sma': False, 'sideways_use_ema': True, 'sideways_use_atr': False, 'sideways_use_adx': False, 'sideways_use_spike': True, 'sideways_rsi_required': True}.
[I 2025-08-31 05:21:22,390] Trial 638 finished with values: [-1000000000.0, 1000000000.0] and parameters: {'p_sma': 57, 'p_std': 14, 'p_atr': 14, 'p_adx': 10, 'rsi_period': 20, 'ema1': 23, 'ema2': 22, 'slip_atr_k': 0.0209887262855241, 'slip_spread_k': 0.6879805811533102, 'spread_hl_frac': 0.009007575400561496, 'bb_std_mult': 1.9399770168558523, 'rsi_os': 14, 'rsi_ob': 58, 'vol_spike': 0.0066979007700145605, 'adx_thresh': 11.646032789831889, 'atr_min_pct': 0.02426774838602316, 'atr_max_pct': 0.10627009210152107, 'tp_mult': 2.4184327667040484, 'tsl_mult': 0.7714805615315637, 'strategy': 'mean_reversion', 'time_stop': 33, 'use_sma': True, 'use_atr': True, 'use_adx': False, 'use_ema': False, 'use_spike': True, 'rsi_required': True, 'edge_k': 0.15759234752845186, 'edge_cap': 0.7751960820195264, 'bull_strategy': 'mean_reversion', 'bull_bb_std_mult': 0.8469075013758921, 'bull_rsi_os': 40, 'bull_rsi_ob': 77, 'bull_adx_thresh': 8.938294303060639, 'bull_atr_min_pct': 0.01907172096094036, 'bull_atr_max_pct': 0.01467659038053552, 'bull_tp_mult': 1.7088382066601284, 'bull_tsl_mult': 0.892800925207924, 'bull_time_stop': 268, 'bull_use_sma': False, 'bull_use_ema': True, 'bull_use_atr': False, 'bull_use_adx': True, 'bull_use_spike': False, 'bull_rsi_required': False, 'bear_strategy': 'breakout', 'bear_bb_std_mult': 0.8803973209448166, 'bear_rsi_os': 10, 'bear_rsi_ob': 86, 'bear_adx_thresh': 27.321159141776874, 'bear_atr_min_pct': 0.007577371163233871, 'bear_atr_max_pct': 0.05459256076507282, 'bear_tp_mult': 1.1369414534557614, 'bear_tsl_mult': 0.6629432455996437, 'bear_time_stop': 223, 'bear_use_sma': True, 'bear_use_ema': False, 'bear_use_atr': False, 'bear_use_adx': False, 'bear_use_spike': False, 'bear_rsi_required': True, 'sideways_strategy': 'breakout', 'sideways_bb_std_mult': 1.1298368970976136, 'sideways_rsi_os': 33, 'sideways_rsi_ob': 57, 'sideways_adx_thresh': 28.353252739154332, 'sideways_atr_min_pct': 0.014490435709966318, 'sideways_atr_max_pct': 0.019542277337327323, 'sideways_tp_mult': 2.0972562334417493, 'sideways_tsl_mult': 0.4649593067347761, 'sideways_time_stop': 204, 'sideways_use_sma': False, 'sideways_use_ema': True, 'sideways_use_atr': False, 'sideways_use_adx': False, 'sideways_use_spike': True, 'sideways_rsi_required': True}.
