[I 2025-08-31 04:47:32,110] Trial 460 finished with values: [-1000000000.0, 1000000000.0] and parameters: {'p_sma': 54, 'p_std': 47, 'p_atr': 24, 'p_adx': 30, 'rsi_period': 46, 'ema1': 14, 'ema2': 17, 'slip_atr_k': 0.014037257825017135, 'slip_spread_k': 0.5143823777641526, 'spread_hl_frac': 0.012241979841811813, 'bb_std_mult': 0.5021487741464621, 'rsi_os': 29, 'rsi_ob': 58, 'vol_spike': 0.24755084814892583, 'adx_thresh': 12.130639960806064, 'atr_min_pct': 0.023778628626677224, 'atr_max_pct': 0.07043333943129151, 'tp_mult': 2.2378761375819494, 'tsl_mult': 0.8597746105593093, 'strategy': 'mean_reversion', 'time_stop': 19, 'use_sma': False, 'use_atr': False, 'use_adx': False, 'use_ema': True, 'use_spike': False, 'rsi_required': False, 'edge_k': 0.58286172033512, 'edge_cap': 0.5480174595524288, 'bull_strategy': 'breakout', 'bull_bb_std_mult': 3.0092454318440334, 'bull_rsi_os': 14, 'bull_rsi_ob': 68, 'bull_adx_thresh': 15.646996652362294, 'bull_atr_min_pct': 0.002263614286387549, 'bull_atr_max_pct': 0.09575437423383487, 'bull_tp_mult': 1.6856800115951511, 'bull_tsl_mult': 0.8374758881333588, 'bull_time_stop': 128, 'bull_use_sma': False, 'bull_use_ema': True, 'bull_use_atr': True, 'bull_use_adx': True, 'bull_use_spike': True, 'bull_rsi_required': False, 'bear_strategy': 'mean_reversion', 'bear_bb_std_mult': 1.548834279334684, 'bear_rsi_os': 20, 'bear_rsi_ob': 72, 'bear_adx_thresh': 19.553975750979447, 'bear_atr_min_pct': 0.012242415789856813, 'bear_atr_max_pct': 0.044655260144762614, 'bear_tp_mult': 2.575193660273672, 'bear_tsl_mult': 0.17783592522667258, 'bear_time_stop': 181, 'bear_use_sma': True, 'bear_use_ema': False, 'bear_use_atr': False, 'bear_use_adx': False, 'bear_use_spike': False, 'bear_rsi_required': False, 'sideways_strategy': 'breakout', 'sideways_bb_std_mult': 3.5957306892232683, 'sideways_rsi_os': 29, 'sideways_rsi_ob': 54, 'sideways_adx_thresh': 30.66945523382319, 'sideways_atr_min_pct': 0.016247546489807543, 'sideways_atr_max_pct': 0.1154593034949731, 'sideways_tp_mult': 1.8883248541722295, 'sideways_tsl_mult': 0.43640973525900884, 'sideways_time_stop': 13, 'sideways_use_sma': True, 'sideways_use_ema': False, 'sideways_use_atr': False, 'sideways_use_adx': True, 'sideways_use_spike': True, 'sideways_rsi_required': True}.
[I 2025-08-31 04:47:33,019] Trial 457 finished with values: [-0.02748837552759631, 0.027418603128188616] and parameters: {'p_sma': 56, 'p_std': 20, 'p_atr': 25, 'p_adx': 12, 'rsi_period': 46, 'ema1': 6, 'ema2': 24, 'slip_atr_k': 0.1468445540395985, 'slip_spread_k': 0.6753017616007178, 'spread_hl_frac': 0.012510741395994557, 'bb_std_mult': 1.941238591807413, 'rsi_os': 27, 'rsi_ob': 95, 'vol_spike': 0.10536713073038839, 'adx_thresh': 9.987160766918963, 'atr_min_pct': 0.02171640089294039, 'atr_max_pct': 0.06706331451485296, 'tp_mult': 2.8449852811337757, 'tsl_mult': 0.4818997929348513, 'strategy': 'mean_reversion', 'time_stop': 128, 'use_sma': False, 'use_atr': False, 'use_adx': True, 'use_ema': True, 'use_spike': False, 'rsi_required': False, 'edge_k': 1.4750208269815437, 'edge_cap': 0.9986827487044, 'bull_strategy': 'mean_reversion', 'bull_bb_std_mult': 3.5573152912303505, 'bull_rsi_os': 14, 'bull_rsi_ob': 85, 'bull_adx_thresh': 11.246100196922688, 'bull_atr_min_pct': 5.923462684256486e-06, 'bull_atr_max_pct': 0.09577904693234507, 'bull_tp_mult': 1.1153201798882297, 'bull_tsl_mult': 0.2718665269254701, 'bull_time_stop': 38, 'bull_use_sma': True, 'bull_use_ema': False, 'bull_use_atr': True, 'bull_use_adx': False, 'bull_use_spike': True, 'bull_rsi_required': False, 'bear_strategy': 'mean_reversion', 'bear_bb_std_mult': 0.8983205691370543, 'bear_rsi_os': 11, 'bear_rsi_ob': 90, 'bear_adx_thresh': 20.326011578322923, 'bear_atr_min_pct': 0.024097928086069517, 'bear_atr_max_pct': 0.014522640593192512, 'bear_tp_mult': 2.5815017876034045, 'bear_tsl_mult': 0.8013511559619968, 'bear_time_stop': 203, 'bear_use_sma': False, 'bear_use_ema': True, 'bear_use_atr': True, 'bear_use_adx': True, 'bear_use_spike': True, 'bear_rsi_required': False, 'sideways_strategy': 'breakout', 'sideways_bb_std_mult': 1.2016508950951366, 'sideways_rsi_os': 26, 'sideways_rsi_ob': 52, 'sideways_adx_thresh': 20.50211220505376, 'sideways_atr_min_pct': 0.013103609848167667, 'sideways_atr_max_pct': 0.032337514539749486, 'sideways_tp_mult': 1.9938182504075748, 'sideways_tsl_mult': 0.5927322369537545, 'sideways_time_stop': 62, 'sideways_use_sma': False, 'sideways_use_ema': True, 'sideways_use_atr': True, 'sideways_use_adx': True, 'sideways_use_spike': False, 'sideways_rsi_required': False}.
[I 2025-08-31 04:48:21,954] Trial 461 finished with values: [-1000000000.0, 1000000000.0] and parameters: {'p_sma': 54, 'p_std': 17, 'p_atr': 24, 'p_adx': 21, 'rsi_period': 46, 'ema1': 13, 'ema2': 38, 'slip_atr_k': 0.009830654125252265, 'slip_spread_k': 0.7400275265672053, 'spread_hl_frac': 0.012677466183201733, 'bb_std_mult': 1.5900438301011612, 'rsi_os': 15, 'rsi_ob': 55, 'vol_spike': 0.0033104199121422595, 'adx_thresh': 30.605063607534913, 'atr_min_pct': 0.023872209166784186, 'atr_max_pct': 0.11584436733921281, 'tp_mult': 1.051288694393354, 'tsl_mult': 0.8616078583018183, 'strategy': 'breakout', 'time_stop': 54, 'use_sma': False, 'use_atr': False, 'use_adx': False, 'use_ema': True, 'use_spike': False, 'rsi_required': False, 'edge_k': 1.4690521445969145, 'edge_cap': 0.9971731015619657, 'bull_strategy': 'mean_reversion', 'bull_bb_std_mult': 3.548147969839601, 'bull_rsi_os': 14, 'bull_rsi_ob': 90, 'bull_adx_thresh': 9.216765139392418, 'bull_atr_min_pct': 0.0011568895736842374, 'bull_atr_max_pct': 0.050816275991303665, 'bull_tp_mult': 2.0551846458184198, 'bull_tsl_mult': 0.8747501272658476, 'bull_time_stop': 143, 'bull_use_sma': False, 'bull_use_ema': True, 'bull_use_atr': True, 'bull_use_adx': True, 'bull_use_spike': True, 'bull_rsi_required': True, 'bear_strategy': 'mean_reversion', 'bear_bb_std_mult': 1.1377934574451374, 'bear_rsi_os': 10, 'bear_rsi_ob': 48, 'bear_adx_thresh': 18.9178737970799, 'bear_atr_min_pct': 0.012204647687706544, 'bear_atr_max_pct': 0.039436872899480904, 'bear_tp_mult': 2.0352618570027787, 'bear_tsl_mult': 0.8114935812605069, 'bear_time_stop': 188, 'bear_use_sma': True, 'bear_use_ema': False, 'bear_use_atr': False, 'bear_use_adx': False, 'bear_use_spike': False, 'bear_rsi_required': True, 'sideways_strategy': 'mean_reversion', 'sideways_bb_std_mult': 1.0848089517808983, 'sideways_rsi_os': 50, 'sideways_rsi_ob': 81, 'sideways_adx_thresh': 12.032671858088294, 'sideways_atr_min_pct': 0.001910017010715052, 'sideways_atr_max_pct': 0.1025534506131342, 'sideways_tp_mult': 1.830610357375299, 'sideways_tsl_mult': 0.5950086999693908, 'sideways_time_stop': 226, 'sideways_use_sma': True, 'sideways_use_ema': False, 'sideways_use_atr': False, 'sideways_use_adx': True, 'sideways_use_spike': True, 'sideways_rsi_required': True}.
[I 2025-08-31 04:48:22,218] Trial 462 finished with values: [-0.02080914717543314, 0.020746074999065122] and parameters: {'p_sma': 54, 'p_std': 20, 'p_atr': 30, 'p_adx': 21, 'rsi_period': 23, 'ema1': 13, 'ema2': 28, 'slip_atr_k': 0.009548253243327165, 'slip_spread_k': 0.7426979908082075, 'spread_hl_frac': 0.010100686079607431, 'bb_std_mult': 1.9339565736555107, 'rsi_os': 34, 'rsi_ob': 60, 'vol_spike': 0.033201255350214134, 'adx_thresh': 10.473762902803314, 'atr_min_pct': 0.023830936700202098, 'atr_max_pct': 0.0349852858728379, 'tp_mult': 1.3239065519545634, 'tsl_mult': 0.8544010216246416, 'strategy': 'breakout', 'time_stop': 52, 'use_sma': False, 'use_atr': False, 'use_adx': False, 'use_ema': False, 'use_spike': True, 'rsi_required': True, 'edge_k': 1.4641323367775698, 'edge_cap': 0.9997004170413578, 'bull_strategy': 'mean_reversion', 'bull_bb_std_mult': 3.461775171209943, 'bull_rsi_os': 14, 'bull_rsi_ob': 90, 'bull_adx_thresh': 11.264487382836267, 'bull_atr_min_pct': 0.0010854593593222395, 'bull_atr_max_pct': 0.04483768548376297, 'bull_tp_mult': 1.6954549182056737, 'bull_tsl_mult': 0.8394648261377026, 'bull_time_stop': 236, 'bull_use_sma': False, 'bull_use_ema': False, 'bull_use_atr': True, 'bull_use_adx': True, 'bull_use_spike': False, 'bull_rsi_required': True, 'bear_strategy': 'mean_reversion', 'bear_bb_std_mult': 0.939732096303024, 'bear_rsi_os': 10, 'bear_rsi_ob': 63, 'bear_adx_thresh': 20.25306797450099, 'bear_atr_min_pct': 0.02489554195769185, 'bear_atr_max_pct': 0.032890734559075686, 'bear_tp_mult': 2.653227241385054, 'bear_tsl_mult': 0.811723129847431, 'bear_time_stop': 36, 'bear_use_sma': True, 'bear_use_ema': True, 'bear_use_atr': False, 'bear_use_adx': False, 'bear_use_spike': True, 'bear_rsi_required': True, 'sideways_strategy': 'mean_reversion', 'sideways_bb_std_mult': 3.126389802091997, 'sideways_rsi_os': 6, 'sideways_rsi_ob': 64, 'sideways_adx_thresh': 29.88736060623969, 'sideways_atr_min_pct': 0.001767398885371382, 'sideways_atr_max_pct': 0.07746670558563545, 'sideways_tp_mult': 2.2508645799949383, 'sideways_tsl_mult': 0.8060508851661443, 'sideways_time_stop': 188, 'sideways_use_sma': False, 'sideways_use_ema': False, 'sideways_use_atr': False, 'sideways_use_adx': True, 'sideways_use_spike': True, 'sideways_rsi_required': True}.
[I 2025-08-31 04:48:22,469] Trial 463 finished with values: [-0.015232533012851879, 0.015167411295618887] and parameters: {'p_sma': 55, 'p_std': 20, 'p_atr': 23, 'p_adx': 9, 'rsi_period': 23, 'ema1': 27, 'ema2': 25, 'slip_atr_k': 0.009487703896369309, 'slip_spread_k': 0.31179983809485845, 'spread_hl_frac': 0.035511938957033695, 'bb_std_mult': 1.89814742757955, 'rsi_os': 47, 'rsi_ob': 60, 'vol_spike': 0.20935770542643856, 'adx_thresh': 10.655902657251763, 'atr_min_pct': 0.022739884074123792, 'atr_max_pct': 0.12240778423432559, 'tp_mult': 2.307388874823613, 'tsl_mult': 0.8894009261217181, 'strategy': 'breakout', 'time_stop': 68, 'use_sma': False, 'use_atr': False, 'use_adx': False, 'use_ema': False, 'use_spike': True, 'rsi_required': True, 'edge_k': 1.8903065864441766, 'edge_cap': 0.9988126884844064, 'bull_strategy': 'mean_reversion', 'bull_bb_std_mult': 2.5711450601491497, 'bull_rsi_os': 14, 'bull_rsi_ob': 77, 'bull_adx_thresh': 11.272270721959185, 'bull_atr_min_pct': 0.0013187999053189763, 'bull_atr_max_pct': 0.050720687371119455, 'bull_tp_mult': 1.9410056172692791, 'bull_tsl_mult': 0.8726984006188137, 'bull_time_stop': 142, 'bull_use_sma': False, 'bull_use_ema': False, 'bull_use_atr': True, 'bull_use_adx': True, 'bull_use_spike': False, 'bull_rsi_required': True, 'bear_strategy': 'mean_reversion', 'bear_bb_std_mult': 0.7187277962843492, 'bear_rsi_os': 10, 'bear_rsi_ob': 90, 'bear_adx_thresh': 12.300171891073932, 'bear_atr_min_pct': 0.02814571646907059, 'bear_atr_max_pct': 0.04088141847834703, 'bear_tp_mult': 1.0603996716061022, 'bear_tsl_mult': 0.8095274596218203, 'bear_time_stop': 22, 'bear_use_sma': True, 'bear_use_ema': True, 'bear_use_atr': False, 'bear_use_adx': True, 'bear_use_spike': True, 'bear_rsi_required': True, 'sideways_strategy': 'mean_reversion', 'sideways_bb_std_mult': 0.5750836244638116, 'sideways_rsi_os': 28, 'sideways_rsi_ob': 75, 'sideways_adx_thresh': 26.63871684096798, 'sideways_atr_min_pct': 0.0149847771184224, 'sideways_atr_max_pct': 0.13882881246928103, 'sideways_tp_mult': 2.1503063466642818, 'sideways_tsl_mult': 0.593278047932832, 'sideways_time_stop': 225, 'sideways_use_sma': False, 'sideways_use_ema': False, 'sideways_use_atr': False, 'sideways_use_adx': True, 'sideways_use_spike': True, 'sideways_rsi_required': True}.
[I 2025-08-31 04:48:22,650] Trial 464 finished with values: [-0.016764722373636354, 0.016709838745349412] and parameters: {'p_sma': 53, 'p_std': 23, 'p_atr': 30, 'p_adx': 21, 'rsi_period': 29, 'ema1': 13, 'ema2': 57, 'slip_atr_k': 0.10679180992231829, 'slip_spread_k': 0.849414023129033, 'spread_hl_frac': 0.00987731405780356, 'bb_std_mult': 1.5864510195708705, 'rsi_os': 33, 'rsi_ob': 60, 'vol_spike': 0.1812510505354583, 'adx_thresh': 30.5240006629062, 'atr_min_pct': 0.02272424276846877, 'atr_max_pct': 0.12222075497472719, 'tp_mult': 1.7281151306237068, 'tsl_mult': 0.8903802364122605, 'strategy': 'breakout', 'time_stop': 52, 'use_sma': False, 'use_atr': False, 'use_adx': False, 'use_ema': False, 'use_spike': True, 'rsi_required': True, 'edge_k': 1.34345202996803, 'edge_cap': 0.9994128392650651, 'bull_strategy': 'mean_reversion', 'bull_bb_std_mult': 3.468521359484794, 'bull_rsi_os': 12, 'bull_rsi_ob': 77, 'bull_adx_thresh': 13.504999079306259, 'bull_atr_min_pct': 0.0012595938364498372, 'bull_atr_max_pct': 0.04468431057752987, 'bull_tp_mult': 1.5416173578953893, 'bull_tsl_mult': 0.8016155620727932, 'bull_time_stop': 235, 'bull_use_sma': False, 'bull_use_ema': False, 'bull_use_atr': True, 'bull_use_adx': True, 'bull_use_spike': False, 'bull_rsi_required': True, 'bear_strategy': 'mean_reversion', 'bear_bb_std_mult': 1.106199742893555, 'bear_rsi_os': 10, 'bear_rsi_ob': 76, 'bear_adx_thresh': 12.344649944371804, 'bear_atr_min_pct': 0.02558131430526519, 'bear_atr_max_pct': 0.04060173481158327, 'bear_tp_mult': 2.802010368822197, 'bear_tsl_mult': 0.3154291712305583, 'bear_time_stop': 187, 'bear_use_sma': True, 'bear_use_ema': True, 'bear_use_atr': False, 'bear_use_adx': True, 'bear_use_spike': True, 'bear_rsi_required': True, 'sideways_strategy': 'mean_reversion', 'sideways_bb_std_mult': 0.5674027804677395, 'sideways_rsi_os': 28, 'sideways_rsi_ob': 64, 'sideways_adx_thresh': 11.911844299213186, 'sideways_atr_min_pct': 0.02686284289378872, 'sideways_atr_max_pct': 0.10254203922535451, 'sideways_tp_mult': 2.062100970431316, 'sideways_tsl_mult': 0.5284994245760131, 'sideways_time_stop': 178, 'sideways_use_sma': False, 'sideways_use_ema': False, 'sideways_use_atr': False, 'sideways_use_adx': True, 'sideways_use_spike': True, 'sideways_rsi_required': True}.
[I 2025-08-31 04:48:23,972] Trial 467 finished with values: [-1000000000.0, 1000000000.0] and parameters: {'p_sma': 53, 'p_std': 34, 'p_atr': 22, 'p_adx': 11, 'rsi_period': 19, 'ema1': 14, 'ema2': 12, 'slip_atr_k': 0.0230842706902231, 'slip_spread_k': 0.1015849795328788, 'spread_hl_frac': 0.00817879385620811, 'bb_std_mult': 2.055894475071283, 'rsi_os': 29, 'rsi_ob': 88, 'vol_spike': 0.012126916806654463, 'adx_thresh': 32.52087805043879, 'atr_min_pct': 0.022779837331899668, 'atr_max_pct': 0.021550055965900615, 'tp_mult': 2.559174308527719, 'tsl_mult': 0.33468769043680385, 'strategy': 'breakout', 'time_stop': 188, 'use_sma': False, 'use_atr': False, 'use_adx': False, 'use_ema': False, 'use_spike': True, 'rsi_required': False, 'edge_k': 1.3495339629886474, 'edge_cap': 0.9649609481525354, 'bull_strategy': 'mean_reversion', 'bull_bb_std_mult': 2.899794146935619, 'bull_rsi_os': 12, 'bull_rsi_ob': 79, 'bull_adx_thresh': 13.679196127149355, 'bull_atr_min_pct': 0.001954225314426795, 'bull_atr_max_pct': 0.041303298613120654, 'bull_tp_mult': 2.349129711061998, 'bull_tsl_mult': 0.9361769784903873, 'bull_time_stop': 125, 'bull_use_sma': False, 'bull_use_ema': False, 'bull_use_atr': True, 'bull_use_adx': True, 'bull_use_spike': False, 'bull_rsi_required': True, 'bear_strategy': 'mean_reversion', 'bear_bb_std_mult': 2.279183483737716, 'bear_rsi_os': 9, 'bear_rsi_ob': 69, 'bear_adx_thresh': 10.707605512466401, 'bear_atr_min_pct': 0.014024587741810268, 'bear_atr_max_pct': 0.13028884360632195, 'bear_tp_mult': 2.8293514383896725, 'bear_tsl_mult': 0.31126871082104357, 'bear_time_stop': 196, 'bear_use_sma': True, 'bear_use_ema': True, 'bear_use_atr': True, 'bear_use_adx': True, 'bear_use_spike': True, 'bear_rsi_required': True, 'sideways_strategy': 'mean_reversion', 'sideways_bb_std_mult': 1.1641966650844178, 'sideways_rsi_os': 27, 'sideways_rsi_ob': 68, 'sideways_adx_thresh': 12.900713012172371, 'sideways_atr_min_pct': 0.010922083827998199, 'sideways_atr_max_pct': 0.12585853958985188, 'sideways_tp_mult': 2.0858980656001536, 'sideways_tsl_mult': 0.6615942669265655, 'sideways_time_stop': 178, 'sideways_use_sma': False, 'sideways_use_ema': False, 'sideways_use_atr': False, 'sideways_use_adx': True, 'sideways_use_spike': True, 'sideways_rsi_required': True}.
[I 2025-08-31 04:48:24,401] Trial 469 finished with values: [-1000000000.0, 1000000000.0] and parameters: {'p_sma': 30, 'p_std': 16, 'p_atr': 18, 'p_adx': 25, 'rsi_period': 21, 'ema1': 15, 'ema2': 28, 'slip_atr_k': 0.24824751427481084, 'slip_spread_k': 0.6014856011178614, 'spread_hl_frac': 0.011016284892018353, 'bb_std_mult': 3.584235290883628, 'rsi_os': 44, 'rsi_ob': 51, 'vol_spike': 0.019425318143787895, 'adx_thresh': 11.500926088489688, 'atr_min_pct': 0.026474005794060586, 'atr_max_pct': 0.017869053000340196, 'tp_mult': 1.5942081624799953, 'tsl_mult': 0.5520078326470722, 'strategy': 'breakout', 'time_stop': 43, 'use_sma': True, 'use_atr': True, 'use_adx': False, 'use_ema': False, 'use_spike': True, 'rsi_required': False, 'edge_k': 1.9616360170772342, 'edge_cap': 0.9644773565552167, 'bull_strategy': 'mean_reversion', 'bull_bb_std_mult': 1.1437036639106624, 'bull_rsi_os': 17, 'bull_rsi_ob': 75, 'bull_adx_thresh': 10.10388900026355, 'bull_atr_min_pct': 0.0027934337492924806, 'bull_atr_max_pct': 0.030063089189089176, 'bull_tp_mult': 1.1759070020342999, 'bull_tsl_mult': 0.8950130512145968, 'bull_time_stop': 11, 'bull_use_sma': False, 'bull_use_ema': False, 'bull_use_atr': False, 'bull_use_adx': True, 'bull_use_spike': False, 'bull_rsi_required': True, 'bear_strategy': 'breakout', 'bear_bb_std_mult': 1.2180273440992138, 'bear_rsi_os': 7, 'bear_rsi_ob': 94, 'bear_adx_thresh': 20.171830578618632, 'bear_atr_min_pct': 0.027346619430212046, 'bear_atr_max_pct': 0.03676517406915068, 'bear_tp_mult': 2.6724529930823655, 'bear_tsl_mult': 0.24436485595423135, 'bear_time_stop': 75, 'bear_use_sma': True, 'bear_use_ema': True, 'bear_use_atr': True, 'bear_use_adx': True, 'bear_use_spike': True, 'bear_rsi_required': True, 'sideways_strategy': 'mean_reversion', 'sideways_bb_std_mult': 1.1103231424455164, 'sideways_rsi_os': 29, 'sideways_rsi_ob': 56, 'sideways_adx_thresh': 11.14465198648493, 'sideways_atr_min_pct': 0.009607906622470816, 'sideways_atr_max_pct': 0.08313688272536882, 'sideways_tp_mult': 2.0485138193753296, 'sideways_tsl_mult': 0.6336329892533554, 'sideways_time_stop': 68, 'sideways_use_sma': False, 'sideways_use_ema': False, 'sideways_use_atr': False, 'sideways_use_adx': False, 'sideways_use_spike': True, 'sideways_rsi_required': True}.
[I 2025-08-31 04:49:13,064] Trial 465 finished with values: [-1000000000.0, 1000000000.0] and parameters: {'p_sma': 24, 'p_std': 22, 'p_atr': 23, 'p_adx': 9, 'rsi_period': 29, 'ema1': 13, 'ema2': 28, 'slip_atr_k': 0.023005810500309545, 'slip_spread_k': 0.07110897042921412, 'spread_hl_frac': 0.03534358305050915, 'bb_std_mult': 2.2856165174987786, 'rsi_os': 33, 'rsi_ob': 60, 'vol_spike': 0.11860644852609833, 'adx_thresh': 10.952431850830312, 'atr_min_pct': 0.022640210861736183, 'atr_max_pct': 0.1219968051498217, 'tp_mult': 1.5829258474152788, 'tsl_mult': 0.35125223679716744, 'strategy': 'breakout', 'time_stop': 69, 'use_sma': False, 'use_atr': False, 'use_adx': False, 'use_ema': False, 'use_spike': True, 'rsi_required': True, 'edge_k': 1.3524190659611697, 'edge_cap': 0.9995365966191954, 'bull_strategy': 'mean_reversion', 'bull_bb_std_mult': 3.4710042171619175, 'bull_rsi_os': 12, 'bull_rsi_ob': 77, 'bull_adx_thresh': 13.532202824672785, 'bull_atr_min_pct': 0.0015484362582442515, 'bull_atr_max_pct': 0.04621193507859842, 'bull_tp_mult': 1.634552986422578, 'bull_tsl_mult': 0.798584145024251, 'bull_time_stop': 180, 'bull_use_sma': False, 'bull_use_ema': False, 'bull_use_atr': True, 'bull_use_adx': True, 'bull_use_spike': False, 'bull_rsi_required': True, 'bear_strategy': 'mean_reversion', 'bear_bb_std_mult': 3.36178601923598, 'bear_rsi_os': 27, 'bear_rsi_ob': 76, 'bear_adx_thresh': 16.14996091113938, 'bear_atr_min_pct': 0.02695967358879235, 'bear_atr_max_pct': 0.10554741705026968, 'bear_tp_mult': 2.6845544257411165, 'bear_tsl_mult': 0.19699647797454, 'bear_time_stop': 36, 'bear_use_sma': True, 'bear_use_ema': True, 'bear_use_atr': True, 'bear_use_adx': True, 'bear_use_spike': True, 'bear_rsi_required': True, 'sideways_strategy': 'mean_reversion', 'sideways_bb_std_mult': 2.9787706358910913, 'sideways_rsi_os': 28, 'sideways_rsi_ob': 69, 'sideways_adx_thresh': 11.146008657309503, 'sideways_atr_min_pct': 0.015068224274627715, 'sideways_atr_max_pct': 0.12131735608044295, 'sideways_tp_mult': 2.130180410608038, 'sideways_tsl_mult': 0.5307228610999065, 'sideways_time_stop': 177, 'sideways_use_sma': False, 'sideways_use_ema': False, 'sideways_use_atr': False, 'sideways_use_adx': True, 'sideways_use_spike': True, 'sideways_rsi_required': True}.
