[I 2025-08-31 04:56:26,647] Trial 503 finished with values: [-1000000000.0, 1000000000.0] and parameters: {'p_sma': 57, 'p_std': 46, 'p_atr': 8, 'p_adx': 10, 'rsi_period': 23, 'ema1': 27, 'ema2': 23, 'slip_atr_k': 0.031687636398083564, 'slip_spread_k': 0.6947672575630638, 'spread_hl_frac': 0.009626570635741398, 'bb_std_mult': 2.5697819792791905, 'rsi_os': 48, 'rsi_ob': 58, 'vol_spike': 0.04544226319520232, 'adx_thresh': 23.37195310758954, 'atr_min_pct': 0.018062477310557067, 'atr_max_pct': 0.03120460050487027, 'tp_mult': 1.1705511743283767, 'tsl_mult': 0.9242161902982753, 'strategy': 'breakout', 'time_stop': 57, 'use_sma': False, 'use_atr': False, 'use_adx': False, 'use_ema': False, 'use_spike': True, 'rsi_required': False, 'edge_k': 0.6732523469822278, 'edge_cap': 0.842745082822313, 'bull_strategy': 'mean_reversion', 'bull_bb_std_mult': 1.7986902541820506, 'bull_rsi_os': 15, 'bull_rsi_ob': 69, 'bull_adx_thresh': 12.73367634167147, 'bull_atr_min_pct': 0.01085909941631874, 'bull_atr_max_pct': 0.05147491498856679, 'bull_tp_mult': 1.5340471636788158, 'bull_tsl_mult': 0.7243505511897712, 'bull_time_stop': 172, 'bull_use_sma': False, 'bull_use_ema': False, 'bull_use_atr': True, 'bull_use_adx': True, 'bull_use_spike': False, 'bull_rsi_required': True, 'bear_strategy': 'mean_reversion', 'bear_bb_std_mult': 2.993578432158771, 'bear_rsi_os': 36, 'bear_rsi_ob': 47, 'bear_adx_thresh': 20.228387740355945, 'bear_atr_min_pct': 0.02276327593161583, 'bear_atr_max_pct': 0.044026099316254716, 'bear_tp_mult': 2.891476756963766, 'bear_tsl_mult': 0.104881486908392, 'bear_time_stop': 94, 'bear_use_sma': True, 'bear_use_ema': True, 'bear_use_atr': True, 'bear_use_adx': True, 'bear_use_spike': True, 'bear_rsi_required': True, 'sideways_strategy': 'mean_reversion', 'sideways_bb_std_mult': 1.3983491173712896, 'sideways_rsi_os': 26, 'sideways_rsi_ob': 55, 'sideways_adx_thresh': 10.977040521896418, 'sideways_atr_min_pct': 0.013929436447199075, 'sideways_atr_max_pct': 0.11918509953765144, 'sideways_tp_mult': 2.8754935073263965, 'sideways_tsl_mult': 0.5564818117633872, 'sideways_time_stop': 61, 'sideways_use_sma': False, 'sideways_use_ema': False, 'sideways_use_atr': False, 'sideways_use_adx': True, 'sideways_use_spike': True, 'sideways_rsi_required': True}.
[I 2025-08-31 04:56:27,020] Trial 505 finished with values: [-1000000000.0, 1000000000.0] and parameters: {'p_sma': 56, 'p_std': 37, 'p_atr': 8, 'p_adx': 10, 'rsi_period': 80, 'ema1': 29, 'ema2': 53, 'slip_atr_k': 0.0320895831076342, 'slip_spread_k': 0.18914110016649827, 'spread_hl_frac': 0.04062987030419611, 'bb_std_mult': 1.7794841114180597, 'rsi_os': 9, 'rsi_ob': 74, 'vol_spike': 0.01396992710863418, 'adx_thresh': 10.763876261167866, 'atr_min_pct': 0.01837762483680042, 'atr_max_pct': 0.03676306699183601, 'tp_mult': 2.556959263148093, 'tsl_mult': 0.14807746866451826, 'strategy': 'breakout', 'time_stop': 84, 'use_sma': False, 'use_atr': False, 'use_adx': False, 'use_ema': False, 'use_spike': True, 'rsi_required': False, 'edge_k': 0.3182726142359932, 'edge_cap': 0.8281987500398318, 'bull_strategy': 'mean_reversion', 'bull_bb_std_mult': 1.387044488559014, 'bull_rsi_os': 14, 'bull_rsi_ob': 88, 'bull_adx_thresh': 12.935872964899248, 'bull_atr_min_pct': 0.02072110206864419, 'bull_atr_max_pct': 0.04826253740720276, 'bull_tp_mult': 1.015572918192182, 'bull_tsl_mult': 0.8783903634651585, 'bull_time_stop': 26, 'bull_use_sma': False, 'bull_use_ema': False, 'bull_use_atr': True, 'bull_use_adx': True, 'bull_use_spike': False, 'bull_rsi_required': True, 'bear_strategy': 'mean_reversion', 'bear_bb_std_mult': 1.257551127861959, 'bear_rsi_os': 10, 'bear_rsi_ob': 47, 'bear_adx_thresh': 20.239949827296794, 'bear_atr_min_pct': 0.023805839921351164, 'bear_atr_max_pct': 0.04433989098202894, 'bear_tp_mult': 2.9045169443363337, 'bear_tsl_mult': 0.2841833395566634, 'bear_time_stop': 95, 'bear_use_sma': True, 'bear_use_ema': True, 'bear_use_atr': True, 'bear_use_adx': True, 'bear_use_spike': True, 'bear_rsi_required': True, 'sideways_strategy': 'mean_reversion', 'sideways_bb_std_mult': 1.0367669101996704, 'sideways_rsi_os': 26, 'sideways_rsi_ob': 73, 'sideways_adx_thresh': 21.24058730907565, 'sideways_atr_min_pct': 0.0039894247044899266, 'sideways_atr_max_pct': 0.06371448300044008, 'sideways_tp_mult': 2.062948683575339, 'sideways_tsl_mult': 0.567554321866644, 'sideways_time_stop': 23, 'sideways_use_sma': False, 'sideways_use_ema': False, 'sideways_use_atr': False, 'sideways_use_adx': True, 'sideways_use_spike': True, 'sideways_rsi_required': True}.
[I 2025-08-31 04:56:27,125] Trial 504 finished with values: [-0.017237310191246413, 0.01717439614914872] and parameters: {'p_sma': 56, 'p_std': 35, 'p_atr': 23, 'p_adx': 10, 'rsi_period': 80, 'ema1': 16, 'ema2': 23, 'slip_atr_k': 0.1862586882581711, 'slip_spread_k': 0.19072586744464312, 'spread_hl_frac': 0.030783897641528463, 'bb_std_mult': 1.7891357267642305, 'rsi_os': 30, 'rsi_ob': 58, 'vol_spike': 0.04303668503806882, 'adx_thresh': 10.776558681134855, 'atr_min_pct': 0.013039516157727898, 'atr_max_pct': 0.11818956910190057, 'tp_mult': 2.55858208186809, 'tsl_mult': 0.05933040887222024, 'strategy': 'breakout', 'time_stop': 34, 'use_sma': False, 'use_atr': False, 'use_adx': False, 'use_ema': False, 'use_spike': True, 'rsi_required': False, 'edge_k': 1.5689975474039226, 'edge_cap': 0.9610870266497763, 'bull_strategy': 'mean_reversion', 'bull_bb_std_mult': 3.2549278384055045, 'bull_rsi_os': 11, 'bull_rsi_ob': 92, 'bull_adx_thresh': 17.424330397731367, 'bull_atr_min_pct': 0.0009185763648665807, 'bull_atr_max_pct': 0.05066419921657693, 'bull_tp_mult': 1.0102108662048197, 'bull_tsl_mult': 0.15343173262695997, 'bull_time_stop': 173, 'bull_use_sma': False, 'bull_use_ema': False, 'bull_use_atr': True, 'bull_use_adx': True, 'bull_use_spike': False, 'bull_rsi_required': True, 'bear_strategy': 'mean_reversion', 'bear_bb_std_mult': 3.009478734942934, 'bear_rsi_os': 35, 'bear_rsi_ob': 47, 'bear_adx_thresh': 13.068647386565779, 'bear_atr_min_pct': 0.01802836220669851, 'bear_atr_max_pct': 0.043997166158467, 'bear_tp_mult': 1.3122227411298226, 'bear_tsl_mult': 0.3615011160353085, 'bear_time_stop': 202, 'bear_use_sma': True, 'bear_use_ema': True, 'bear_use_atr': True, 'bear_use_adx': True, 'bear_use_spike': True, 'bear_rsi_required': True, 'sideways_strategy': 'mean_reversion', 'sideways_bb_std_mult': 1.054168784532672, 'sideways_rsi_os': 26, 'sideways_rsi_ob': 73, 'sideways_adx_thresh': 11.439162468747194, 'sideways_atr_min_pct': 0.01393275914369729, 'sideways_atr_max_pct': 0.11833147683064095, 'sideways_tp_mult': 1.1018590850044423, 'sideways_tsl_mult': 0.5504597376057414, 'sideways_time_stop': 23, 'sideways_use_sma': False, 'sideways_use_ema': False, 'sideways_use_atr': False, 'sideways_use_adx': True, 'sideways_use_spike': True, 'sideways_rsi_required': True}.
[I 2025-08-31 04:56:28,150] Trial 510 finished with values: [-1000000000.0, 1000000000.0] and parameters: {'p_sma': 14, 'p_std': 17, 'p_atr': 24, 'p_adx': 9, 'rsi_period': 25, 'ema1': 15, 'ema2': 25, 'slip_atr_k': 0.015551890516664838, 'slip_spread_k': 0.08757642922658264, 'spread_hl_frac': 0.011370487468858393, 'bb_std_mult': 2.0274812600809926, 'rsi_os': 52, 'rsi_ob': 64, 'vol_spike': 0.02689664031173544, 'adx_thresh': 11.652205110874656, 'atr_min_pct': 0.023911925440506826, 'atr_max_pct': 0.08442228943889842, 'tp_mult': 2.504605129761311, 'tsl_mult': 0.8713305515211609, 'strategy': 'mean_reversion', 'time_stop': 48, 'use_sma': True, 'use_atr': True, 'use_adx': True, 'use_ema': True, 'use_spike': False, 'rsi_required': False, 'edge_k': 1.4457469426204277, 'edge_cap': 0.6119058664237078, 'bull_strategy': 'breakout', 'bull_bb_std_mult': 3.5977541146983136, 'bull_rsi_os': 13, 'bull_rsi_ob': 76, 'bull_adx_thresh': 15.744565811542849, 'bull_atr_min_pct': 0.02257751268704119, 'bull_atr_max_pct': 0.03550177748286085, 'bull_tp_mult': 1.6921627892373299, 'bull_tsl_mult': 0.004640201606746774, 'bull_time_stop': 226, 'bull_use_sma': True, 'bull_use_ema': True, 'bull_use_atr': False, 'bull_use_adx': False, 'bull_use_spike': True, 'bull_rsi_required': False, 'bear_strategy': 'breakout', 'bear_bb_std_mult': 1.5144155135188888, 'bear_rsi_os': 19, 'bear_rsi_ob': 45, 'bear_adx_thresh': 9.272279657302887, 'bear_atr_min_pct': 0.02218468466799004, 'bear_atr_max_pct': 0.03758383870999058, 'bear_tp_mult': 1.0127283184753466, 'bear_tsl_mult': 0.5357681785649844, 'bear_time_stop': 194, 'bear_use_sma': False, 'bear_use_ema': False, 'bear_use_atr': False, 'bear_use_adx': True, 'bear_use_spike': False, 'bear_rsi_required': False, 'sideways_strategy': 'breakout', 'sideways_bb_std_mult': 2.8012858492466592, 'sideways_rsi_os': 10, 'sideways_rsi_ob': 53, 'sideways_adx_thresh': 10.371657270925317, 'sideways_atr_min_pct': 0.01201004642872003, 'sideways_atr_max_pct': 0.11341239744864333, 'sideways_tp_mult': 2.007759027515796, 'sideways_tsl_mult': 0.6537088658503011, 'sideways_time_stop': 197, 'sideways_use_sma': True, 'sideways_use_ema': True, 'sideways_use_atr': True, 'sideways_use_adx': False, 'sideways_use_spike': False, 'sideways_rsi_required': False}.
[I 2025-08-31 04:56:28,151] Trial 509 finished with values: [-1000000000.0, 1000000000.0] and parameters: {'p_sma': 14, 'p_std': 17, 'p_atr': 19, 'p_adx': 9, 'rsi_period': 31, 'ema1': 15, 'ema2': 57, 'slip_atr_k': 0.04483274839691717, 'slip_spread_k': 0.5731888197129944, 'spread_hl_frac': 0.049881573189130286, 'bb_std_mult': 2.0331720800501074, 'rsi_os': 52, 'rsi_ob': 64, 'vol_spike': 0.02893534232604117, 'adx_thresh': 27.534358482306764, 'atr_min_pct': 0.009601322034827574, 'atr_max_pct': 0.08378531375438296, 'tp_mult': 2.5157991674778364, 'tsl_mult': 0.8705880383764946, 'strategy': 'mean_reversion', 'time_stop': 46, 'use_sma': True, 'use_atr': True, 'use_adx': True, 'use_ema': True, 'use_spike': False, 'rsi_required': False, 'edge_k': 1.447800667981176, 'edge_cap': 0.9819967331153265, 'bull_strategy': 'breakout', 'bull_bb_std_mult': 1.5565947351471539, 'bull_rsi_os': 53, 'bull_rsi_ob': 55, 'bull_adx_thresh': 9.983714123010072, 'bull_atr_min_pct': 0.007523536838106979, 'bull_atr_max_pct': 0.12956047974606094, 'bull_tp_mult': 2.9181634616370262, 'bull_tsl_mult': 0.8777826935935913, 'bull_time_stop': 153, 'bull_use_sma': True, 'bull_use_ema': True, 'bull_use_atr': False, 'bull_use_adx': False, 'bull_use_spike': True, 'bull_rsi_required': False, 'bear_strategy': 'breakout', 'bear_bb_std_mult': 0.9117112558555364, 'bear_rsi_os': 11, 'bear_rsi_ob': 45, 'bear_adx_thresh': 20.892130129507667, 'bear_atr_min_pct': 0.016354772026732106, 'bear_atr_max_pct': 0.04692013542629063, 'bear_tp_mult': 1.2079828144309355, 'bear_tsl_mult': 0.21178712274435163, 'bear_time_stop': 126, 'bear_use_sma': False, 'bear_use_ema': False, 'bear_use_atr': False, 'bear_use_adx': True, 'bear_use_spike': False, 'bear_rsi_required': False, 'sideways_strategy': 'breakout', 'sideways_bb_std_mult': 3.074663914731641, 'sideways_rsi_os': 44, 'sideways_rsi_ob': 53, 'sideways_adx_thresh': 10.303639831506416, 'sideways_atr_min_pct': 0.01510578815710265, 'sideways_atr_max_pct': 0.1140437719674568, 'sideways_tp_mult': 2.0149838290261584, 'sideways_tsl_mult': 0.9574418470330837, 'sideways_time_stop': 56, 'sideways_use_sma': True, 'sideways_use_ema': True, 'sideways_use_atr': True, 'sideways_use_adx': False, 'sideways_use_spike': False, 'sideways_rsi_required': False}.
[I 2025-08-31 04:57:13,252] Trial 508 finished with values: [-1000000000.0, 1000000000.0] and parameters: {'p_sma': 56, 'p_std': 35, 'p_atr': 24, 'p_adx': 10, 'rsi_period': 25, 'ema1': 30, 'ema2': 25, 'slip_atr_k': 0.18451404484859885, 'slip_spread_k': 0.08569378836991964, 'spread_hl_frac': 0.017678492238141802, 'bb_std_mult': 2.0207494998187423, 'rsi_os': 15, 'rsi_ob': 78, 'vol_spike': 0.013313416109544509, 'adx_thresh': 11.428064007667231, 'atr_min_pct': 0.02359847251796557, 'atr_max_pct': 0.08007879926052282, 'tp_mult': 2.5220907968809, 'tsl_mult': 0.8709520777217655, 'strategy': 'mean_reversion', 'time_stop': 46, 'use_sma': False, 'use_atr': False, 'use_adx': False, 'use_ema': False, 'use_spike': True, 'rsi_required': False, 'edge_k': 1.4381844129397852, 'edge_cap': 0.9522280315716456, 'bull_strategy': 'breakout', 'bull_bb_std_mult': 1.3901690233175417, 'bull_rsi_os': 11, 'bull_rsi_ob': 55, 'bull_adx_thresh': 33.01315959268287, 'bull_atr_min_pct': 0.021644736327131285, 'bull_atr_max_pct': 0.10100169575251475, 'bull_tp_mult': 2.9255811118068777, 'bull_tsl_mult': 0.6242955883942881, 'bull_time_stop': 225, 'bull_use_sma': False, 'bull_use_ema': True, 'bull_use_atr': True, 'bull_use_adx': True, 'bull_use_spike': False, 'bull_rsi_required': False, 'bear_strategy': 'mean_reversion', 'bear_bb_std_mult': 1.4528869943278466, 'bear_rsi_os': 19, 'bear_rsi_ob': 77, 'bear_adx_thresh': 33.94211743882789, 'bear_atr_min_pct': 0.02375812484901323, 'bear_atr_max_pct': 0.08822377536864048, 'bear_tp_mult': 2.561966622895963, 'bear_tsl_mult': 0.5337927534165505, 'bear_time_stop': 5, 'bear_use_sma': True, 'bear_use_ema': False, 'bear_use_atr': False, 'bear_use_adx': True, 'bear_use_spike': False, 'bear_rsi_required': False, 'sideways_strategy': 'breakout', 'sideways_bb_std_mult': 0.909742317039898, 'sideways_rsi_os': 44, 'sideways_rsi_ob': 61, 'sideways_adx_thresh': 21.202238711973404, 'sideways_atr_min_pct': 0.014492011950466914, 'sideways_atr_max_pct': 0.11325851850273626, 'sideways_tp_mult': 2.0047236521065392, 'sideways_tsl_mult': 0.9588057346342276, 'sideways_time_stop': 195, 'sideways_use_sma': False, 'sideways_use_ema': False, 'sideways_use_atr': False, 'sideways_use_adx': True, 'sideways_use_spike': True, 'sideways_rsi_required': True}.
[I 2025-08-31 04:57:14,386] Trial 507 finished with values: [-1000000000.0, 1000000000.0] and parameters: {'p_sma': 55, 'p_std': 58, 'p_atr': 8, 'p_adx': 10, 'rsi_period': 25, 'ema1': 28, 'ema2': 23, 'slip_atr_k': 0.0322293177964974, 'slip_spread_k': 0.584765485644959, 'spread_hl_frac': 0.03026012131948785, 'bb_std_mult': 2.0029657830770136, 'rsi_os': 30, 'rsi_ob': 93, 'vol_spike': 0.012753695049909537, 'adx_thresh': 11.425320459097389, 'atr_min_pct': 0.023753895872993504, 'atr_max_pct': 0.11832522386937494, 'tp_mult': 2.5091671464531977, 'tsl_mult': 0.10229530873024073, 'strategy': 'breakout', 'time_stop': 285, 'use_sma': False, 'use_atr': False, 'use_adx': False, 'use_ema': False, 'use_spike': True, 'rsi_required': False, 'edge_k': 1.440198530542649, 'edge_cap': 0.8587956561815286, 'bull_strategy': 'breakout', 'bull_bb_std_mult': 3.3042304510860765, 'bull_rsi_os': 15, 'bull_rsi_ob': 76, 'bull_adx_thresh': 13.050771307623283, 'bull_atr_min_pct': 0.007418939658936523, 'bull_atr_max_pct': 0.03546622905169038, 'bull_tp_mult': 1.526281205133338, 'bull_tsl_mult': 0.8644926085981526, 'bull_time_stop': 59, 'bull_use_sma': False, 'bull_use_ema': True, 'bull_use_atr': True, 'bull_use_adx': True, 'bull_use_spike': False, 'bull_rsi_required': True, 'bear_strategy': 'mean_reversion', 'bear_bb_std_mult': 2.9251763632163565, 'bear_rsi_os': 28, 'bear_rsi_ob': 47, 'bear_adx_thresh': 13.258980403299887, 'bear_atr_min_pct': 0.023808590822138584, 'bear_atr_max_pct': 0.04678463842159901, 'bear_tp_mult': 2.9060789721088702, 'bear_tsl_mult': 0.5345391098407414, 'bear_time_stop': 125, 'bear_use_sma': True, 'bear_use_ema': False, 'bear_use_atr': True, 'bear_use_adx': True, 'bear_use_spike': False, 'bear_rsi_required': True, 'sideways_strategy': 'mean_reversion', 'sideways_bb_std_mult': 1.2678381128766252, 'sideways_rsi_os': 45, 'sideways_rsi_ob': 95, 'sideways_adx_thresh': 11.494609411551725, 'sideways_atr_min_pct': 0.019818684162721117, 'sideways_atr_max_pct': 0.02864999717320653, 'sideways_tp_mult': 2.167750586617839, 'sideways_tsl_mult': 0.5710892476220615, 'sideways_time_stop': 196, 'sideways_use_sma': False, 'sideways_use_ema': False, 'sideways_use_atr': False, 'sideways_use_adx': True, 'sideways_use_spike': True, 'sideways_rsi_required': True}.
[I 2025-08-31 04:57:15,503] Trial 511 finished with values: [-1000000000.0, 1000000000.0] and parameters: {'p_sma': 28, 'p_std': 50, 'p_atr': 24, 'p_adx': 8, 'rsi_period': 21, 'ema1': 26, 'ema2': 28, 'slip_atr_k': 0.024342679724014517, 'slip_spread_k': 0.1617833259445589, 'spread_hl_frac': 0.036710978971159755, 'bb_std_mult': 1.8979160383976563, 'rsi_os': 29, 'rsi_ob': 89, 'vol_spike': 0.20249277764310478, 'adx_thresh': 11.304780310120648, 'atr_min_pct': 0.0223176132913956, 'atr_max_pct': 0.12164526242003718, 'tp_mult': 2.60490201927124, 'tsl_mult': 0.8396304751188075, 'strategy': 'breakout', 'time_stop': 25, 'use_sma': False, 'use_atr': False, 'use_adx': False, 'use_ema': False, 'use_spike': True, 'rsi_required': True, 'edge_k': 1.5141619558181838, 'edge_cap': 0.9366060542289324, 'bull_strategy': 'mean_reversion', 'bull_bb_std_mult': 2.3273342612919277, 'bull_rsi_os': 15, 'bull_rsi_ob': 62, 'bull_adx_thresh': 11.242849214129757, 'bull_atr_min_pct': 0.0038993200961101437, 'bull_atr_max_pct': 0.04278257931052589, 'bull_tp_mult': 1.5889225681541355, 'bull_tsl_mult': 0.06934338349568997, 'bull_time_stop': 136, 'bull_use_sma': False, 'bull_use_ema': False, 'bull_use_atr': True, 'bull_use_adx': True, 'bull_use_spike': False, 'bull_rsi_required': True, 'bear_strategy': 'mean_reversion', 'bear_bb_std_mult': 2.7363316015185903, 'bear_rsi_os': 14, 'bear_rsi_ob': 65, 'bear_adx_thresh': 16.440537644436496, 'bear_atr_min_pct': 0.02392259018608015, 'bear_atr_max_pct': 0.03822373238042836, 'bear_tp_mult': 1.1201508212538367, 'bear_tsl_mult': 0.5737664675312247, 'bear_time_stop': 214, 'bear_use_sma': True, 'bear_use_ema': True, 'bear_use_atr': True, 'bear_use_adx': False, 'bear_use_spike': True, 'bear_rsi_required': True, 'sideways_strategy': 'mean_reversion', 'sideways_bb_std_mult': 1.7361751662813811, 'sideways_rsi_os': 27, 'sideways_rsi_ob': 56, 'sideways_adx_thresh': 12.404400434532066, 'sideways_atr_min_pct': 0.01271221347142847, 'sideways_atr_max_pct': 0.035932895763268385, 'sideways_tp_mult': 1.9506023349999493, 'sideways_tsl_mult': 0.998811532095405, 'sideways_time_stop': 73, 'sideways_use_sma': False, 'sideways_use_ema': False, 'sideways_use_atr': False, 'sideways_use_adx': True, 'sideways_use_spike': True, 'sideways_rsi_required': True}.
[I 2025-08-31 04:57:16,020] Trial 512 finished with values: [-1000000000.0, 1000000000.0] and parameters: {'p_sma': 28, 'p_std': 19, 'p_atr': 24, 'p_adx': 8, 'rsi_period': 27, 'ema1': 28, 'ema2': 28, 'slip_atr_k': 0.02324518308005547, 'slip_spread_k': 0.16490159197375215, 'spread_hl_frac': 0.02569388767870661, 'bb_std_mult': 1.8991825312292034, 'rsi_os': 29, 'rsi_ob': 79, 'vol_spike': 0.21551749558709343, 'adx_thresh': 11.964324614281136, 'atr_min_pct': 0.0218624729334547, 'atr_max_pct': 0.11402191012162266, 'tp_mult': 2.68547779668047, 'tsl_mult': 0.6094192909334267, 'strategy': 'breakout', 'time_stop': 97, 'use_sma': False, 'use_atr': False, 'use_adx': False, 'use_ema': False, 'use_spike': True, 'rsi_required': True, 'edge_k': 0.9415672589521468, 'edge_cap': 0.5760693214700568, 'bull_strategy': 'mean_reversion', 'bull_bb_std_mult': 3.372969874149502, 'bull_rsi_os': 15, 'bull_rsi_ob': 62, 'bull_adx_thresh': 8.07266708950578, 'bull_atr_min_pct': 0.0034140695140109055, 'bull_atr_max_pct': 0.11779722844152934, 'bull_tp_mult': 1.8650368343782326, 'bull_tsl_mult': 0.6287932082956001, 'bull_time_stop': 83, 'bull_use_sma': False, 'bull_use_ema': False, 'bull_use_atr': True, 'bull_use_adx': True, 'bull_use_spike': False, 'bull_rsi_required': True, 'bear_strategy': 'mean_reversion', 'bear_bb_std_mult': 2.9229029535634776, 'bear_rsi_os': 29, 'bear_rsi_ob': 89, 'bear_adx_thresh': 5.580399938737088, 'bear_atr_min_pct': 0.0240142190713549, 'bear_atr_max_pct': 0.1497132370942447, 'bear_tp_mult': 1.3813159563911017, 'bear_tsl_mult': 0.8664950442610234, 'bear_time_stop': 186, 'bear_use_sma': True, 'bear_use_ema': True, 'bear_use_atr': True, 'bear_use_adx': False, 'bear_use_spike': True, 'bear_rsi_required': True, 'sideways_strategy': 'mean_reversion', 'sideways_bb_std_mult': 1.240322707000238, 'sideways_rsi_os': 27, 'sideways_rsi_ob': 61, 'sideways_adx_thresh': 12.496956376599455, 'sideways_atr_min_pct': 0.01440259456675606, 'sideways_atr_max_pct': 0.03535598809652421, 'sideways_tp_mult': 2.1872319217534404, 'sideways_tsl_mult': 0.15789428904311137, 'sideways_time_stop': 86, 'sideways_use_sma': False, 'sideways_use_ema': False, 'sideways_use_atr': False, 'sideways_use_adx': True, 'sideways_use_spike': True, 'sideways_rsi_required': True}.
