[I 2025-08-31 04:07:34,333] Trial 264 finished with values: [-1000000000.0, 1000000000.0] and parameters: {'p_sma': 54, 'p_std': 15, 'p_atr': 23, 'p_adx': 16, 'rsi_period': 22, 'ema1': 5, 'ema2': 25, 'slip_atr_k': 0.011602420405585165, 'slip_spread_k': 0.11806160266862772, 'spread_hl_frac': 0.041859446358696255, 'bb_std_mult': 1.9708580449700155, 'rsi_os': 29, 'rsi_ob': 45, 'vol_spike': 0.19232542446360906, 'adx_thresh': 17.506993103586176, 'atr_min_pct': 0.02224385967355933, 'atr_max_pct': 0.09749234534609799, 'tp_mult': 2.127826012860081, 'tsl_mult': 0.6147647304799283, 'strategy': 'mean_reversion', 'time_stop': 30, 'use_sma': False, 'use_atr': False, 'use_adx': True, 'use_ema': False, 'use_spike': True, 'rsi_required': False, 'edge_k': 1.5088096664414667, 'edge_cap': 0.9858190908611209, 'bull_strategy': 'mean_reversion', 'bull_bb_std_mult': 3.5235443077251825, 'bull_rsi_os': 13, 'bull_rsi_ob': 78, 'bull_adx_thresh': 7.725385981773298, 'bull_atr_min_pct': 0.0013774818052334958, 'bull_atr_max_pct': 0.04487508115146033, 'bull_tp_mult': 1.6245196830376056, 'bull_tsl_mult': 0.145470781975936, 'bull_time_stop': 123, 'bull_use_sma': True, 'bull_use_ema': False, 'bull_use_atr': True, 'bull_use_adx': True, 'bull_use_spike': False, 'bull_rsi_required': True, 'bear_strategy': 'breakout', 'bear_bb_std_mult': 0.8991427563673376, 'bear_rsi_os': 9, 'bear_rsi_ob': 49, 'bear_adx_thresh': 20.015811287740092, 'bear_atr_min_pct': 0.024586871475918558, 'bear_atr_max_pct': 0.038077250231671134, 'bear_tp_mult': 2.105533480149698, 'bear_tsl_mult': 0.3060594664721484, 'bear_time_stop': 181, 'bear_use_sma': True, 'bear_use_ema': True, 'bear_use_atr': False, 'bear_use_adx': True, 'bear_use_spike': True, 'bear_rsi_required': False, 'sideways_strategy': 'breakout', 'sideways_bb_std_mult': 1.15520221151385, 'sideways_rsi_os': 32, 'sideways_rsi_ob': 72, 'sideways_adx_thresh': 11.120274717774011, 'sideways_atr_min_pct': 0.013943546714716508, 'sideways_atr_max_pct': 0.031002301142949912, 'sideways_tp_mult': 1.5354687381512484, 'sideways_tsl_mult': 0.6022868489730727, 'sideways_time_stop': 53, 'sideways_use_sma': False, 'sideways_use_ema': True, 'sideways_use_atr': True, 'sideways_use_adx': True, 'sideways_use_spike': False, 'sideways_rsi_required': True}.
[I 2025-08-31 04:07:34,445] Trial 262 finished with values: [-1000000000.0, 1000000000.0] and parameters: {'p_sma': 20, 'p_std': 18, 'p_atr': 21, 'p_adx': 17, 'rsi_period': 19, 'ema1': 15, 'ema2': 31, 'slip_atr_k': 0.05674588392904731, 'slip_spread_k': 0.6376942030146785, 'spread_hl_frac': 0.033167948574420965, 'bb_std_mult': 1.7708183168134335, 'rsi_os': 51, 'rsi_ob': 69, 'vol_spike': 0.0274275812016435, 'adx_thresh': 17.625068368945335, 'atr_min_pct': 0.024207060607524686, 'atr_max_pct': 0.014937569463846875, 'tp_mult': 2.481386397930766, 'tsl_mult': 0.6983397885221025, 'strategy': 'mean_reversion', 'time_stop': 38, 'use_sma': False, 'use_atr': False, 'use_adx': True, 'use_ema': False, 'use_spike': True, 'rsi_required': False, 'edge_k': 1.5137506396518892, 'edge_cap': 0.9717222285382092, 'bull_strategy': 'mean_reversion', 'bull_bb_std_mult': 3.5551673573591844, 'bull_rsi_os': 13, 'bull_rsi_ob': 58, 'bull_adx_thresh': 7.4577725753893045, 'bull_atr_min_pct': 0.013128417896400742, 'bull_atr_max_pct': 0.04387296816975137, 'bull_tp_mult': 1.2812491063731024, 'bull_tsl_mult': 0.8259503883525406, 'bull_time_stop': 91, 'bull_use_sma': True, 'bull_use_ema': True, 'bull_use_atr': True, 'bull_use_adx': True, 'bull_use_spike': False, 'bull_rsi_required': True, 'bear_strategy': 'breakout', 'bear_bb_std_mult': 0.8996658248730045, 'bear_rsi_os': 9, 'bear_rsi_ob': 49, 'bear_adx_thresh': 20.052818162407593, 'bear_atr_min_pct': 0.01651510935886821, 'bear_atr_max_pct': 0.037749473880500345, 'bear_tp_mult': 2.083440404607448, 'bear_tsl_mult': 0.48212478071798776, 'bear_time_stop': 204, 'bear_use_sma': True, 'bear_use_ema': False, 'bear_use_atr': False, 'bear_use_adx': True, 'bear_use_spike': False, 'bear_rsi_required': True, 'sideways_strategy': 'breakout', 'sideways_bb_std_mult': 0.9949930422667492, 'sideways_rsi_os': 12, 'sideways_rsi_ob': 72, 'sideways_adx_thresh': 11.265795850463155, 'sideways_atr_min_pct': 0.0059970050597616155, 'sideways_atr_max_pct': 0.11646886429265249, 'sideways_tp_mult': 1.5273216289679998, 'sideways_tsl_mult': 0.666003251718997, 'sideways_time_stop': 54, 'sideways_use_sma': False, 'sideways_use_ema': True, 'sideways_use_atr': True, 'sideways_use_adx': True, 'sideways_use_spike': False, 'sideways_rsi_required': True}.
[I 2025-08-31 04:08:14,930] Trial 261 finished with values: [-1000000000.0, 1000000000.0] and parameters: {'p_sma': 11, 'p_std': 51, 'p_atr': 9, 'p_adx': 27, 'rsi_period': 82, 'ema1': 12, 'ema2': 32, 'slip_atr_k': 0.10076017748578611, 'slip_spread_k': 0.6367700372560502, 'spread_hl_frac': 0.04606652100668504, 'bb_std_mult': 2.1844816740781807, 'rsi_os': 25, 'rsi_ob': 71, 'vol_spike': 0.023669970131996117, 'adx_thresh': 17.610912124428094, 'atr_min_pct': 0.013658480654681242, 'atr_max_pct': 0.12623856128157135, 'tp_mult': 2.466522173801325, 'tsl_mult': 0.08046932464219653, 'strategy': 'breakout', 'time_stop': 31, 'use_sma': False, 'use_atr': False, 'use_adx': False, 'use_ema': False, 'use_spike': True, 'rsi_required': False, 'edge_k': 1.5115292646918832, 'edge_cap': 0.3207920714316358, 'bull_strategy': 'mean_reversion', 'bull_bb_std_mult': 3.5482763665006356, 'bull_rsi_os': 13, 'bull_rsi_ob': 58, 'bull_adx_thresh': 7.66876280784963, 'bull_atr_min_pct': 0.019519649436460704, 'bull_atr_max_pct': 0.043626726342118415, 'bull_tp_mult': 2.235086686757312, 'bull_tsl_mult': 0.829499374527557, 'bull_time_stop': 241, 'bull_use_sma': False, 'bull_use_ema': True, 'bull_use_atr': True, 'bull_use_adx': False, 'bull_use_spike': False, 'bull_rsi_required': True, 'bear_strategy': 'mean_reversion', 'bear_bb_std_mult': 0.8849101360149122, 'bear_rsi_os': 42, 'bear_rsi_ob': 47, 'bear_adx_thresh': 25.869498251976907, 'bear_atr_min_pct': 0.023573299107928703, 'bear_atr_max_pct': 0.04071402096753017, 'bear_tp_mult': 1.8394677187458857, 'bear_tsl_mult': 0.25906900473451977, 'bear_time_stop': 201, 'bear_use_sma': False, 'bear_use_ema': False, 'bear_use_atr': True, 'bear_use_adx': True, 'bear_use_spike': False, 'bear_rsi_required': True, 'sideways_strategy': 'mean_reversion', 'sideways_bb_std_mult': 1.142084678284528, 'sideways_rsi_os': 26, 'sideways_rsi_ob': 56, 'sideways_adx_thresh': 18.38299867396082, 'sideways_atr_min_pct': 0.007838762932802397, 'sideways_atr_max_pct': 0.10339912331155883, 'sideways_tp_mult': 1.9000230106403062, 'sideways_tsl_mult': 0.6716380859620743, 'sideways_time_stop': 52, 'sideways_use_sma': False, 'sideways_use_ema': False, 'sideways_use_atr': False, 'sideways_use_adx': True, 'sideways_use_spike': True, 'sideways_rsi_required': False}.
[I 2025-08-31 04:08:15,446] Trial 263 finished with values: [-0.022986979015443332, 0.022919349941411975] and parameters: {'p_sma': 54, 'p_std': 18, 'p_atr': 18, 'p_adx': 9, 'rsi_period': 26, 'ema1': 15, 'ema2': 24, 'slip_atr_k': 0.05461271130908851, 'slip_spread_k': 0.10101357153553625, 'spread_hl_frac': 0.009288942747376261, 'bb_std_mult': 1.7641043861402346, 'rsi_os': 25, 'rsi_ob': 57, 'vol_spike': 0.037337714802162754, 'adx_thresh': 17.71635342797247, 'atr_min_pct': 0.007725134296073475, 'atr_max_pct': 0.08151093074564147, 'tp_mult': 2.488945807241597, 'tsl_mult': 0.8807260924010039, 'strategy': 'mean_reversion', 'time_stop': 7, 'use_sma': False, 'use_atr': False, 'use_adx': True, 'use_ema': False, 'use_spike': True, 'rsi_required': False, 'edge_k': 0.8976048570867219, 'edge_cap': 0.3179482483549343, 'bull_strategy': 'mean_reversion', 'bull_bb_std_mult': 1.7995862165485383, 'bull_rsi_os': 13, 'bull_rsi_ob': 59, 'bull_adx_thresh': 12.699010072455463, 'bull_atr_min_pct': 0.0009717850219229775, 'bull_atr_max_pct': 0.04419521075618145, 'bull_tp_mult': 1.6300912515510284, 'bull_tsl_mult': 0.8396272907640295, 'bull_time_stop': 214, 'bull_use_sma': True, 'bull_use_ema': False, 'bull_use_atr': True, 'bull_use_adx': True, 'bull_use_spike': False, 'bull_rsi_required': True, 'bear_strategy': 'breakout', 'bear_bb_std_mult': 0.9043126179949507, 'bear_rsi_os': 9, 'bear_rsi_ob': 49, 'bear_adx_thresh': 19.805025503946503, 'bear_atr_min_pct': 0.015992696635608237, 'bear_atr_max_pct': 0.04997886904138074, 'bear_tp_mult': 2.1040296740603224, 'bear_tsl_mult': 0.29541307886613155, 'bear_time_stop': 207, 'bear_use_sma': True, 'bear_use_ema': True, 'bear_use_atr': False, 'bear_use_adx': True, 'bear_use_spike': True, 'bear_rsi_required': False, 'sideways_strategy': 'breakout', 'sideways_bb_std_mult': 1.1540469720999553, 'sideways_rsi_os': 16, 'sideways_rsi_ob': 56, 'sideways_adx_thresh': 11.167031383501522, 'sideways_atr_min_pct': 0.014060614735144309, 'sideways_atr_max_pct': 0.10373849055976997, 'sideways_tp_mult': 1.8802708925546818, 'sideways_tsl_mult': 0.6648170566155137, 'sideways_time_stop': 52, 'sideways_use_sma': False, 'sideways_use_ema': True, 'sideways_use_atr': True, 'sideways_use_adx': True, 'sideways_use_spike': False, 'sideways_rsi_required': True}.
[I 2025-08-31 04:08:15,858] Trial 266 finished with values: [-1000000000.0, 1000000000.0] and parameters: {'p_sma': 55, 'p_std': 48, 'p_atr': 24, 'p_adx': 9, 'rsi_period': 26, 'ema1': 28, 'ema2': 35, 'slip_atr_k': 0.03376528515048517, 'slip_spread_k': 0.10512927692072851, 'spread_hl_frac': 0.03886766004855727, 'bb_std_mult': 2.1997095764926553, 'rsi_os': 31, 'rsi_ob': 57, 'vol_spike': 0.298815602746903, 'adx_thresh': 13.876895659755512, 'atr_min_pct': 0.021233532494309162, 'atr_max_pct': 0.03289332954885407, 'tp_mult': 2.5396817285341586, 'tsl_mult': 0.8788112747179583, 'strategy': 'breakout', 'time_stop': 53, 'use_sma': False, 'use_atr': False, 'use_adx': False, 'use_ema': False, 'use_spike': True, 'rsi_required': False, 'edge_k': 1.119508102674887, 'edge_cap': 0.9767348397270249, 'bull_strategy': 'mean_reversion', 'bull_bb_std_mult': 1.832840175063249, 'bull_rsi_os': 11, 'bull_rsi_ob': 48, 'bull_adx_thresh': 12.30642903600644, 'bull_atr_min_pct': 0.007059208712154848, 'bull_atr_max_pct': 0.053715609015771805, 'bull_tp_mult': 1.506583924537467, 'bull_tsl_mult': 0.3974634241088674, 'bull_time_stop': 149, 'bull_use_sma': False, 'bull_use_ema': False, 'bull_use_atr': True, 'bull_use_adx': True, 'bull_use_spike': False, 'bull_rsi_required': True, 'bear_strategy': 'mean_reversion', 'bear_bb_std_mult': 0.8301089492149314, 'bear_rsi_os': 7, 'bear_rsi_ob': 45, 'bear_adx_thresh': 20.577597575336785, 'bear_atr_min_pct': 0.02535037748008665, 'bear_atr_max_pct': 0.04338311220639236, 'bear_tp_mult': 2.654684193261482, 'bear_tsl_mult': 0.21660788453299484, 'bear_time_stop': 194, 'bear_use_sma': True, 'bear_use_ema': True, 'bear_use_atr': True, 'bear_use_adx': True, 'bear_use_spike': True, 'bear_rsi_required': True, 'sideways_strategy': 'mean_reversion', 'sideways_bb_std_mult': 1.1372705981616882, 'sideways_rsi_os': 25, 'sideways_rsi_ob': 56, 'sideways_adx_thresh': 30.930681998187914, 'sideways_atr_min_pct': 0.007733848879692121, 'sideways_atr_max_pct': 0.03460379221830606, 'sideways_tp_mult': 1.256928925276954, 'sideways_tsl_mult': 0.5643346482422968, 'sideways_time_stop': 68, 'sideways_use_sma': False, 'sideways_use_ema': False, 'sideways_use_atr': False, 'sideways_use_adx': True, 'sideways_use_spike': True, 'sideways_rsi_required': True}.
[I 2025-08-31 04:08:16,088] Trial 265 finished with values: [-1000000000.0, 1000000000.0] and parameters: {'p_sma': 11, 'p_std': 18, 'p_atr': 23, 'p_adx': 9, 'rsi_period': 26, 'ema1': 13, 'ema2': 54, 'slip_atr_k': 0.11949195990181807, 'slip_spread_k': 0.6116085414089074, 'spread_hl_frac': 0.038479041570665354, 'bb_std_mult': 2.932938456480261, 'rsi_os': 51, 'rsi_ob': 69, 'vol_spike': 0.01501173531888024, 'adx_thresh': 13.953935963405488, 'atr_min_pct': 0.021819958612907885, 'atr_max_pct': 0.12691213186620243, 'tp_mult': 2.4982423456137215, 'tsl_mult': 0.874939147053807, 'strategy': 'breakout', 'time_stop': 6, 'use_sma': False, 'use_atr': False, 'use_adx': True, 'use_ema': False, 'use_spike': True, 'rsi_required': False, 'edge_k': 1.5376367113358183, 'edge_cap': 0.9737643947101193, 'bull_strategy': 'mean_reversion', 'bull_bb_std_mult': 1.8023752244469118, 'bull_rsi_os': 13, 'bull_rsi_ob': 48, 'bull_adx_thresh': 8.641151102862628, 'bull_atr_min_pct': 0.001675731229032081, 'bull_atr_max_pct': 0.052802233021732224, 'bull_tp_mult': 1.4937304131433555, 'bull_tsl_mult': 0.8316419092213109, 'bull_time_stop': 147, 'bull_use_sma': True, 'bull_use_ema': False, 'bull_use_atr': True, 'bull_use_adx': True, 'bull_use_spike': False, 'bull_rsi_required': True, 'bear_strategy': 'mean_reversion', 'bear_bb_std_mult': 0.8419807212885901, 'bear_rsi_os': 8, 'bear_rsi_ob': 48, 'bear_adx_thresh': 21.185068248908422, 'bear_atr_min_pct': 0.022643225020575784, 'bear_atr_max_pct': 0.04432870003506743, 'bear_tp_mult': 2.658731010731746, 'bear_tsl_mult': 0.1770595544334844, 'bear_time_stop': 197, 'bear_use_sma': True, 'bear_use_ema': True, 'bear_use_atr': False, 'bear_use_adx': True, 'bear_use_spike': True, 'bear_rsi_required': True, 'sideways_strategy': 'mean_reversion', 'sideways_bb_std_mult': 1.131234324693669, 'sideways_rsi_os': 36, 'sideways_rsi_ob': 56, 'sideways_adx_thresh': 11.603836519546476, 'sideways_atr_min_pct': 0.0219822285643635, 'sideways_atr_max_pct': 0.10376573286656306, 'sideways_tp_mult': 1.8975595583933051, 'sideways_tsl_mult': 0.6720636200537542, 'sideways_time_stop': 57, 'sideways_use_sma': False, 'sideways_use_ema': True, 'sideways_use_atr': True, 'sideways_use_adx': True, 'sideways_use_spike': False, 'sideways_rsi_required': True}.
[I 2025-08-31 04:09:05,951] Trial 270 finished with values: [-1000000000.0, 1000000000.0] and parameters: {'p_sma': 55, 'p_std': 44, 'p_atr': 25, 'p_adx': 8, 'rsi_period': 23, 'ema1': 14, 'ema2': 28, 'slip_atr_k': 0.019834451800923667, 'slip_spread_k': 0.06069894256188085, 'spread_hl_frac': 0.015549720849825675, 'bb_std_mult': 2.040909189821081, 'rsi_os': 42, 'rsi_ob': 60, 'vol_spike': 0.05292090954849746, 'adx_thresh': 6.642837459595631, 'atr_min_pct': 0.022299304706925024, 'atr_max_pct': 0.08720712349996701, 'tp_mult': 2.1839071609214566, 'tsl_mult': 0.914136865011589, 'strategy': 'breakout', 'time_stop': 61, 'use_sma': False, 'use_atr': True, 'use_adx': False, 'use_ema': False, 'use_spike': True, 'rsi_required': True, 'edge_k': 1.379677147923672, 'edge_cap': 0.995925886027987, 'bull_strategy': 'mean_reversion', 'bull_bb_std_mult': 3.324759874570722, 'bull_rsi_os': 38, 'bull_rsi_ob': 74, 'bull_adx_thresh': 10.311960288962402, 'bull_atr_min_pct': 0.004899329521545072, 'bull_atr_max_pct': 0.046965997995252265, 'bull_tp_mult': 1.5548521071335732, 'bull_tsl_mult': 0.2138498070328666, 'bull_time_stop': 139, 'bull_use_sma': False, 'bull_use_ema': False, 'bull_use_atr': False, 'bull_use_adx': True, 'bull_use_spike': False, 'bull_rsi_required': True, 'bear_strategy': 'mean_reversion', 'bear_bb_std_mult': 0.9589939385046183, 'bear_rsi_os': 38, 'bear_rsi_ob': 46, 'bear_adx_thresh': 21.776706358877142, 'bear_atr_min_pct': 0.024818848688510607, 'bear_atr_max_pct': 0.010731764637075814, 'bear_tp_mult': 2.846298003762901, 'bear_tsl_mult': 0.14702113957481167, 'bear_time_stop': 190, 'bear_use_sma': True, 'bear_use_ema': True, 'bear_use_atr': True, 'bear_use_adx': True, 'bear_use_spike': True, 'bear_rsi_required': False, 'sideways_strategy': 'mean_reversion', 'sideways_bb_std_mult': 1.0276876714431944, 'sideways_rsi_os': 22, 'sideways_rsi_ob': 51, 'sideways_adx_thresh': 12.44224561337581, 'sideways_atr_min_pct': 0.012985120559820944, 'sideways_atr_max_pct': 0.09885956997965048, 'sideways_tp_mult': 2.109390386703177, 'sideways_tsl_mult': 0.5951080232709073, 'sideways_time_stop': 232, 'sideways_use_sma': False, 'sideways_use_ema': False, 'sideways_use_atr': False, 'sideways_use_adx': True, 'sideways_use_spike': True, 'sideways_rsi_required': True}.
[I 2025-08-31 04:09:07,001] Trial 269 finished with values: [-1000000000.0, 1000000000.0] and parameters: {'p_sma': 7, 'p_std': 19, 'p_atr': 15, 'p_adx': 7, 'rsi_period': 23, 'ema1': 14, 'ema2': 28, 'slip_atr_k': 0.07669710188177636, 'slip_spread_k': 0.12904560400180254, 'spread_hl_frac': 0.012575716985971389, 'bb_std_mult': 1.4965356797707363, 'rsi_os': 55, 'rsi_ob': 60, 'vol_spike': 0.015210462041877787, 'adx_thresh': 6.420357320307815, 'atr_min_pct': 0.0218519755688537, 'atr_max_pct': 0.1344619970768049, 'tp_mult': 2.538091711189386, 'tsl_mult': 0.7637299246673166, 'strategy': 'breakout', 'time_stop': 54, 'use_sma': False, 'use_atr': True, 'use_adx': False, 'use_ema': False, 'use_spike': True, 'rsi_required': True, 'edge_k': 1.414965502350105, 'edge_cap': 0.7462523843989046, 'bull_strategy': 'mean_reversion', 'bull_bb_std_mult': 3.346617392241226, 'bull_rsi_os': 44, 'bull_rsi_ob': 77, 'bull_adx_thresh': 8.823644186339326, 'bull_atr_min_pct': 0.0050368325098314355, 'bull_atr_max_pct': 0.05086512968469266, 'bull_tp_mult': 1.551027053300149, 'bull_tsl_mult': 0.21472227591640464, 'bull_time_stop': 140, 'bull_use_sma': False, 'bull_use_ema': False, 'bull_use_atr': True, 'bull_use_adx': True, 'bull_use_spike': False, 'bull_rsi_required': True, 'bear_strategy': 'mean_reversion', 'bear_bb_std_mult': 0.7180832334866252, 'bear_rsi_os': 8, 'bear_rsi_ob': 88, 'bear_adx_thresh': 21.122498067436457, 'bear_atr_min_pct': 0.02239330418995941, 'bear_atr_max_pct': 0.03172420308991371, 'bear_tp_mult': 2.5322533419028295, 'bear_tsl_mult': 0.24145131470773423, 'bear_time_stop': 240, 'bear_use_sma': True, 'bear_use_ema': True, 'bear_use_atr': True, 'bear_use_adx': True, 'bear_use_spike': True, 'bear_rsi_required': True, 'sideways_strategy': 'mean_reversion', 'sideways_bb_std_mult': 3.440000685487334, 'sideways_rsi_os': 35, 'sideways_rsi_ob': 52, 'sideways_adx_thresh': 12.28692391176554, 'sideways_atr_min_pct': 0.02739555404348665, 'sideways_atr_max_pct': 0.10936784256881676, 'sideways_tp_mult': 2.114159406913583, 'sideways_tsl_mult': 0.5973927196823081, 'sideways_time_stop': 146, 'sideways_use_sma': False, 'sideways_use_ema': False, 'sideways_use_atr': False, 'sideways_use_adx': True, 'sideways_use_spike': True, 'sideways_rsi_required': True}.
[I 2025-08-31 04:09:07,950] Trial 268 finished with values: [-1000000000.0, 1000000000.0] and parameters: {'p_sma': 7, 'p_std': 44, 'p_atr': 29, 'p_adx': 30, 'rsi_period': 25, 'ema1': 7, 'ema2': 28, 'slip_atr_k': 0.03332470279073803, 'slip_spread_k': 0.061812458157643205, 'spread_hl_frac': 0.012346926586225585, 'bb_std_mult': 3.3070955582581565, 'rsi_os': 31, 'rsi_ob': 92, 'vol_spike': 0.013293032144832002, 'adx_thresh': 6.5464413221562685, 'atr_min_pct': 0.02237798883151103, 'atr_max_pct': 0.12318604966737408, 'tp_mult': 2.5434161164036735, 'tsl_mult': 0.911443353231495, 'strategy': 'breakout', 'time_stop': 58, 'use_sma': False, 'use_atr': True, 'use_adx': False, 'use_ema': False, 'use_spike': True, 'rsi_required': False, 'edge_k': 1.0918611626832277, 'edge_cap': 0.977856074167976, 'bull_strategy': 'mean_reversion', 'bull_bb_std_mult': 3.3844855965267757, 'bull_rsi_os': 12, 'bull_rsi_ob': 76, 'bull_adx_thresh': 10.087461999110412, 'bull_atr_min_pct': 0.025550527117405443, 'bull_atr_max_pct': 0.0521798800476663, 'bull_tp_mult': 1.5101937979048339, 'bull_tsl_mult': 0.9303680383940272, 'bull_time_stop': 149, 'bull_use_sma': False, 'bull_use_ema': False, 'bull_use_atr': True, 'bull_use_adx': True, 'bull_use_spike': False, 'bull_rsi_required': True, 'bear_strategy': 'mean_reversion', 'bear_bb_std_mult': 0.8210806631336006, 'bear_rsi_os': 8, 'bear_rsi_ob': 45, 'bear_adx_thresh': 21.64123424763706, 'bear_atr_min_pct': 0.025355145235275663, 'bear_atr_max_pct': 0.03205811950922643, 'bear_tp_mult': 2.998690687479474, 'bear_tsl_mult': 0.20914754626220042, 'bear_time_stop': 195, 'bear_use_sma': True, 'bear_use_ema': True, 'bear_use_atr': True, 'bear_use_adx': True, 'bear_use_spike': True, 'bear_rsi_required': True, 'sideways_strategy': 'mean_reversion', 'sideways_bb_std_mult': 3.4889697615174287, 'sideways_rsi_os': 10, 'sideways_rsi_ob': 51, 'sideways_adx_thresh': 30.977879973879553, 'sideways_atr_min_pct': 0.012876847359217045, 'sideways_atr_max_pct': 0.0897455380506715, 'sideways_tp_mult': 1.2275981456566654, 'sideways_tsl_mult': 0.5902904372266249, 'sideways_time_stop': 144, 'sideways_use_sma': False, 'sideways_use_ema': False, 'sideways_use_atr': False, 'sideways_use_adx': True, 'sideways_use_spike': True, 'sideways_rsi_required': True}.
