[I 2025-08-31 04:00:07,158] Trial 216 finished with values: [-1000000000.0, 1000000000.0] and parameters: {'p_sma': 52, 'p_std': 18, 'p_atr': 29, 'p_adx': 9, 'rsi_period': 18, 'ema1': 14, 'ema2': 26, 'slip_atr_k': 0.01332673963280485, 'slip_spread_k': 0.12408324659413131, 'spread_hl_frac': 0.00951083417393714, 'bb_std_mult': 1.846192909666154, 'rsi_os': 30, 'rsi_ob': 62, 'vol_spike': 0.050383524122909557, 'adx_thresh': 11.163097304263838, 'atr_min_pct': 0.024671999679669265, 'atr_max_pct': 0.049894434865913995, 'tp_mult': 2.5082672099173604, 'tsl_mult': 0.8696489995587389, 'strategy': 'breakout', 'time_stop': 31, 'use_sma': False, 'use_atr': False, 'use_adx': False, 'use_ema': False, 'use_spike': True, 'rsi_required': False, 'edge_k': 1.4632721396238482, 'edge_cap': 0.9778229132163136, 'bull_strategy': 'mean_reversion', 'bull_bb_std_mult': 3.1458114383616373, 'bull_rsi_os': 10, 'bull_rsi_ob': 74, 'bull_adx_thresh': 11.613381108842239, 'bull_atr_min_pct': 0.002025519370347267, 'bull_atr_max_pct': 0.07240417789419457, 'bull_tp_mult': 1.5573831021553544, 'bull_tsl_mult': 0.3734007976277517, 'bull_time_stop': 132, 'bull_use_sma': False, 'bull_use_ema': False, 'bull_use_atr': True, 'bull_use_adx': True, 'bull_use_spike': False, 'bull_rsi_required': True, 'bear_strategy': 'mean_reversion', 'bear_bb_std_mult': 2.638688786695635, 'bear_rsi_os': 9, 'bear_rsi_ob': 48, 'bear_adx_thresh': 21.38571885197579, 'bear_atr_min_pct': 0.021345797147035946, 'bear_atr_max_pct': 0.019771006326974115, 'bear_tp_mult': 2.8103615037381133, 'bear_tsl_mult': 0.2251377245186128, 'bear_time_stop': 200, 'bear_use_sma': True, 'bear_use_ema': True, 'bear_use_atr': True, 'bear_use_adx': True, 'bear_use_spike': True, 'bear_rsi_required': True, 'sideways_strategy': 'mean_reversion', 'sideways_bb_std_mult': 1.1033350007128073, 'sideways_rsi_os': 16, 'sideways_rsi_ob': 55, 'sideways_adx_thresh': 13.549665144775911, 'sideways_atr_min_pct': 0.013769728091148332, 'sideways_atr_max_pct': 0.12509831920691766, 'sideways_tp_mult': 1.9597764565958773, 'sideways_tsl_mult': 0.4992750880734421, 'sideways_time_stop': 90, 'sideways_use_sma': False, 'sideways_use_ema': False, 'sideways_use_atr': False, 'sideways_use_adx': True, 'sideways_use_spike': True, 'sideways_rsi_required': True}.
[I 2025-08-31 04:00:08,025] Trial 217 finished with values: [-1000000000.0, 1000000000.0] and parameters: {'p_sma': 52, 'p_std': 19, 'p_atr': 30, 'p_adx': 25, 'rsi_period': 66, 'ema1': 14, 'ema2': 27, 'slip_atr_k': 0.0036209818863604804, 'slip_spread_k': 0.6225066979731778, 'spread_hl_frac': 0.012534685958248281, 'bb_std_mult': 2.204393959604127, 'rsi_os': 30, 'rsi_ob': 76, 'vol_spike': 0.25768974849611814, 'adx_thresh': 7.962703393534431, 'atr_min_pct': 0.02322456107152081, 'atr_max_pct': 0.1296185339887973, 'tp_mult': 2.511798142725043, 'tsl_mult': 0.965713272102577, 'strategy': 'breakout', 'time_stop': 39, 'use_sma': False, 'use_atr': False, 'use_adx': False, 'use_ema': False, 'use_spike': True, 'rsi_required': False, 'edge_k': 1.4311141183093254, 'edge_cap': 0.9761471398502924, 'bull_strategy': 'mean_reversion', 'bull_bb_std_mult': 1.6098528688952067, 'bull_rsi_os': 10, 'bull_rsi_ob': 74, 'bull_adx_thresh': 11.43888205227102, 'bull_atr_min_pct': 0.02435148591598019, 'bull_atr_max_pct': 0.07362016186643963, 'bull_tp_mult': 1.6434421175186895, 'bull_tsl_mult': 0.2338708915867122, 'bull_time_stop': 96, 'bull_use_sma': False, 'bull_use_ema': False, 'bull_use_atr': False, 'bull_use_adx': True, 'bull_use_spike': False, 'bull_rsi_required': True, 'bear_strategy': 'mean_reversion', 'bear_bb_std_mult': 0.7624405915544011, 'bear_rsi_os': 9, 'bear_rsi_ob': 48, 'bear_adx_thresh': 8.175594138541692, 'bear_atr_min_pct': 0.023991348907030606, 'bear_atr_max_pct': 0.018139926379015965, 'bear_tp_mult': 2.8205588766177385, 'bear_tsl_mult': 0.21944526041878412, 'bear_time_stop': 204, 'bear_use_sma': True, 'bear_use_ema': True, 'bear_use_atr': True, 'bear_use_adx': True, 'bear_use_spike': True, 'bear_rsi_required': True, 'sideways_strategy': 'mean_reversion', 'sideways_bb_std_mult': 1.1230976844533274, 'sideways_rsi_os': 18, 'sideways_rsi_ob': 55, 'sideways_adx_thresh': 19.574660050666846, 'sideways_atr_min_pct': 0.013641319243185844, 'sideways_atr_max_pct': 0.12724707382213862, 'sideways_tp_mult': 1.9576940350025251, 'sideways_tsl_mult': 0.5483015976561971, 'sideways_time_stop': 54, 'sideways_use_sma': False, 'sideways_use_ema': False, 'sideways_use_atr': False, 'sideways_use_adx': True, 'sideways_use_spike': True, 'sideways_rsi_required': True}.
[I 2025-08-31 04:00:08,964] Trial 220 finished with values: [-1000000000.0, 1000000000.0] and parameters: {'p_sma': 49, 'p_std': 14, 'p_atr': 25, 'p_adx': 25, 'rsi_period': 62, 'ema1': 14, 'ema2': 33, 'slip_atr_k': 0.019072072922500075, 'slip_spread_k': 0.16214100869643366, 'spread_hl_frac': 0.010482828961549272, 'bb_std_mult': 1.5638099276088506, 'rsi_os': 27, 'rsi_ob': 63, 'vol_spike': 0.022107805483781516, 'adx_thresh': 12.137410636662457, 'atr_min_pct': 0.02348623599572024, 'atr_max_pct': 0.021303430377650062, 'tp_mult': 2.234828582550233, 'tsl_mult': 0.971009476159578, 'strategy': 'breakout', 'time_stop': 39, 'use_sma': True, 'use_atr': False, 'use_adx': False, 'use_ema': False, 'use_spike': True, 'rsi_required': False, 'edge_k': 1.436642557441049, 'edge_cap': 0.5830546952882609, 'bull_strategy': 'mean_reversion', 'bull_bb_std_mult': 1.6103234314395347, 'bull_rsi_os': 16, 'bull_rsi_ob': 55, 'bull_adx_thresh': 10.520356072363644, 'bull_atr_min_pct': 0.025655325242011896, 'bull_atr_max_pct': 0.07876975906756303, 'bull_tp_mult': 1.6455630459637711, 'bull_tsl_mult': 0.8958699905276061, 'bull_time_stop': 47, 'bull_use_sma': False, 'bull_use_ema': False, 'bull_use_atr': False, 'bull_use_adx': True, 'bull_use_spike': False, 'bull_rsi_required': True, 'bear_strategy': 'mean_reversion', 'bear_bb_std_mult': 0.904226813014742, 'bear_rsi_os': 5, 'bear_rsi_ob': 47, 'bear_adx_thresh': 20.09006743489407, 'bear_atr_min_pct': 0.023813418354469422, 'bear_atr_max_pct': 0.05953087106074568, 'bear_tp_mult': 2.7064972070976694, 'bear_tsl_mult': 0.2602509298417166, 'bear_time_stop': 187, 'bear_use_sma': True, 'bear_use_ema': True, 'bear_use_atr': True, 'bear_use_adx': True, 'bear_use_spike': True, 'bear_rsi_required': True, 'sideways_strategy': 'mean_reversion', 'sideways_bb_std_mult': 3.556576325006905, 'sideways_rsi_os': 18, 'sideways_rsi_ob': 53, 'sideways_adx_thresh': 9.173890430664496, 'sideways_atr_min_pct': 0.01489631429680488, 'sideways_atr_max_pct': 0.1139300777047051, 'sideways_tp_mult': 2.0103304726113445, 'sideways_tsl_mult': 0.7071735803571452, 'sideways_time_stop': 107, 'sideways_use_sma': False, 'sideways_use_ema': False, 'sideways_use_atr': False, 'sideways_use_adx': True, 'sideways_use_spike': True, 'sideways_rsi_required': True}.
[I 2025-08-31 04:00:09,010] Trial 218 finished with values: [-1000000000.0, 1000000000.0] and parameters: {'p_sma': 52, 'p_std': 56, 'p_atr': 25, 'p_adx': 16, 'rsi_period': 27, 'ema1': 14, 'ema2': 27, 'slip_atr_k': 0.004285268166521281, 'slip_spread_k': 0.16260303534022935, 'spread_hl_frac': 0.012891304607795308, 'bb_std_mult': 2.0937758319663136, 'rsi_os': 25, 'rsi_ob': 62, 'vol_spike': 0.07473321754024415, 'adx_thresh': 10.96441351829434, 'atr_min_pct': 0.015176739355753388, 'atr_max_pct': 0.010220222674704016, 'tp_mult': 2.2446398860054093, 'tsl_mult': 0.7890571807881435, 'strategy': 'breakout', 'time_stop': 76, 'use_sma': True, 'use_atr': False, 'use_adx': False, 'use_ema': False, 'use_spike': True, 'rsi_required': False, 'edge_k': 1.4388380568074297, 'edge_cap': 0.13459250234946407, 'bull_strategy': 'mean_reversion', 'bull_bb_std_mult': 3.1499727755753244, 'bull_rsi_os': 49, 'bull_rsi_ob': 81, 'bull_adx_thresh': 10.465986068898149, 'bull_atr_min_pct': 0.01254582620382039, 'bull_atr_max_pct': 0.07943893918938709, 'bull_tp_mult': 1.632106291047372, 'bull_tsl_mult': 0.19612201680533436, 'bull_time_stop': 140, 'bull_use_sma': False, 'bull_use_ema': False, 'bull_use_atr': False, 'bull_use_adx': True, 'bull_use_spike': False, 'bull_rsi_required': True, 'bear_strategy': 'mean_reversion', 'bear_bb_std_mult': 2.3202078461862317, 'bear_rsi_os': 5, 'bear_rsi_ob': 47, 'bear_adx_thresh': 20.286382715873682, 'bear_atr_min_pct': 0.025851811163552788, 'bear_atr_max_pct': 0.02104873149712053, 'bear_tp_mult': 2.036935408204005, 'bear_tsl_mult': 0.022930933283759836, 'bear_time_stop': 205, 'bear_use_sma': True, 'bear_use_ema': True, 'bear_use_atr': True, 'bear_use_adx': True, 'bear_use_spike': True, 'bear_rsi_required': True, 'sideways_strategy': 'mean_reversion', 'sideways_bb_std_mult': 1.5148265715862563, 'sideways_rsi_os': 17, 'sideways_rsi_ob': 55, 'sideways_adx_thresh': 9.299134868961875, 'sideways_atr_min_pct': 0.014916715271967671, 'sideways_atr_max_pct': 0.11356996702579661, 'sideways_tp_mult': 1.9688353566979035, 'sideways_tsl_mult': 0.499931973455325, 'sideways_time_stop': 68, 'sideways_use_sma': False, 'sideways_use_ema': False, 'sideways_use_atr': False, 'sideways_use_adx': True, 'sideways_use_spike': True, 'sideways_rsi_required': True}.
[I 2025-08-31 04:00:43,666] Trial 219 finished with values: [-1000000000.0, 1000000000.0] and parameters: {'p_sma': 52, 'p_std': 14, 'p_atr': 30, 'p_adx': 25, 'rsi_period': 62, 'ema1': 14, 'ema2': 33, 'slip_atr_k': 0.0009566317165707917, 'slip_spread_k': 0.1682605917396518, 'spread_hl_frac': 0.011463252889971857, 'bb_std_mult': 1.590213007055639, 'rsi_os': 29, 'rsi_ob': 62, 'vol_spike': 0.19766222450405208, 'adx_thresh': 11.105855552423959, 'atr_min_pct': 0.02336921728773366, 'atr_max_pct': 0.13546362957783817, 'tp_mult': 2.4294058704352404, 'tsl_mult': 0.9728013860405323, 'strategy': 'breakout', 'time_stop': 41, 'use_sma': True, 'use_atr': False, 'use_adx': False, 'use_ema': False, 'use_spike': True, 'rsi_required': False, 'edge_k': 1.412601722080662, 'edge_cap': 0.13483375443143575, 'bull_strategy': 'mean_reversion', 'bull_bb_std_mult': 3.1537000978973206, 'bull_rsi_os': 49, 'bull_rsi_ob': 74, 'bull_adx_thresh': 10.5548748690275, 'bull_atr_min_pct': 0.028691694898812813, 'bull_atr_max_pct': 0.07063791076010198, 'bull_tp_mult': 1.6279574658147764, 'bull_tsl_mult': 0.8921725857969622, 'bull_time_stop': 55, 'bull_use_sma': False, 'bull_use_ema': False, 'bull_use_atr': False, 'bull_use_adx': True, 'bull_use_spike': False, 'bull_rsi_required': True, 'bear_strategy': 'mean_reversion', 'bear_bb_std_mult': 0.9020525968234535, 'bear_rsi_os': 7, 'bear_rsi_ob': 48, 'bear_adx_thresh': 20.14696925586595, 'bear_atr_min_pct': 0.02173782699735214, 'bear_atr_max_pct': 0.020168593108407816, 'bear_tp_mult': 2.0322187826812352, 'bear_tsl_mult': 0.9710446448214294, 'bear_time_stop': 202, 'bear_use_sma': True, 'bear_use_ema': True, 'bear_use_atr': True, 'bear_use_adx': True, 'bear_use_spike': True, 'bear_rsi_required': True, 'sideways_strategy': 'mean_reversion', 'sideways_bb_std_mult': 1.5107153512293254, 'sideways_rsi_os': 17, 'sideways_rsi_ob': 55, 'sideways_adx_thresh': 9.326466696126328, 'sideways_atr_min_pct': 0.002637692664558088, 'sideways_atr_max_pct': 0.12590399808246686, 'sideways_tp_mult': 1.974113484256358, 'sideways_tsl_mult': 0.706332809162391, 'sideways_time_stop': 91, 'sideways_use_sma': False, 'sideways_use_ema': False, 'sideways_use_atr': False, 'sideways_use_adx': True, 'sideways_use_spike': True, 'sideways_rsi_required': True}.
[I 2025-08-31 04:00:44,347] Trial 221 finished with values: [-1000000000.0, 1000000000.0] and parameters: {'p_sma': 5, 'p_std': 56, 'p_atr': 25, 'p_adx': 22, 'rsi_period': 27, 'ema1': 15, 'ema2': 32, 'slip_atr_k': 0.03160553872568589, 'slip_spread_k': 0.05728286843753054, 'spread_hl_frac': 0.013152811014986337, 'bb_std_mult': 1.595060953389913, 'rsi_os': 26, 'rsi_ob': 60, 'vol_spike': 0.27441286418380484, 'adx_thresh': 11.864775571823778, 'atr_min_pct': 0.000953945796705196, 'atr_max_pct': 0.025448756162533878, 'tp_mult': 2.2113211547675338, 'tsl_mult': 0.8227197535099017, 'strategy': 'breakout', 'time_stop': 43, 'use_sma': True, 'use_atr': False, 'use_adx': False, 'use_ema': False, 'use_spike': True, 'rsi_required': False, 'edge_k': 1.5631022879116114, 'edge_cap': 0.999824795123565, 'bull_strategy': 'mean_reversion', 'bull_bb_std_mult': 1.909230093301281, 'bull_rsi_os': 42, 'bull_rsi_ob': 56, 'bull_adx_thresh': 10.495959417278048, 'bull_atr_min_pct': 0.0017692945386361557, 'bull_atr_max_pct': 0.017139760621454492, 'bull_tp_mult': 1.599071371549469, 'bull_tsl_mult': 0.8334735653363986, 'bull_time_stop': 142, 'bull_use_sma': False, 'bull_use_ema': False, 'bull_use_atr': False, 'bull_use_adx': True, 'bull_use_spike': False, 'bull_rsi_required': True, 'bear_strategy': 'mean_reversion', 'bear_bb_std_mult': 2.8400946558084366, 'bear_rsi_os': 5, 'bear_rsi_ob': 47, 'bear_adx_thresh': 20.026887132748012, 'bear_atr_min_pct': 0.027833925189321, 'bear_atr_max_pct': 0.05881072380854097, 'bear_tp_mult': 2.7080082354377, 'bear_tsl_mult': 0.254054809119978, 'bear_time_stop': 196, 'bear_use_sma': True, 'bear_use_ema': True, 'bear_use_atr': True, 'bear_use_adx': True, 'bear_use_spike': True, 'bear_rsi_required': True, 'sideways_strategy': 'mean_reversion', 'sideways_bb_std_mult': 1.536154788626465, 'sideways_rsi_os': 35, 'sideways_rsi_ob': 70, 'sideways_adx_thresh': 18.45438303668133, 'sideways_atr_min_pct': 0.003021835907255606, 'sideways_atr_max_pct': 0.11388402079598935, 'sideways_tp_mult': 2.0074165517598286, 'sideways_tsl_mult': 0.4265612331498742, 'sideways_time_stop': 68, 'sideways_use_sma': False, 'sideways_use_ema': False, 'sideways_use_atr': False, 'sideways_use_adx': True, 'sideways_use_spike': True, 'sideways_rsi_required': True}.
[I 2025-08-31 04:00:45,396] Trial 223 finished with values: [-1000000000.0, 1000000000.0] and parameters: {'p_sma': 5, 'p_std': 15, 'p_atr': 24, 'p_adx': 17, 'rsi_period': 20, 'ema1': 26, 'ema2': 52, 'slip_atr_k': 0.04441432258819346, 'slip_spread_k': 0.05389031108154074, 'spread_hl_frac': 0.011350946063713337, 'bb_std_mult': 1.795860785170624, 'rsi_os': 29, 'rsi_ob': 60, 'vol_spike': 0.27595588528454396, 'adx_thresh': 11.854234914316065, 'atr_min_pct': 0.02587438496993247, 'atr_max_pct': 0.1224164397168791, 'tp_mult': 2.4353490410221883, 'tsl_mult': 0.4808781984141541, 'strategy': 'breakout', 'time_stop': 260, 'use_sma': False, 'use_atr': False, 'use_adx': False, 'use_ema': False, 'use_spike': True, 'rsi_required': False, 'edge_k': 1.3867063982983752, 'edge_cap': 0.9432022482998211, 'bull_strategy': 'mean_reversion', 'bull_bb_std_mult': 1.9351001079485324, 'bull_rsi_os': 41, 'bull_rsi_ob': 50, 'bull_adx_thresh': 12.986908643709835, 'bull_atr_min_pct': 0.002273471162472737, 'bull_atr_max_pct': 0.06023995478883644, 'bull_tp_mult': 1.602964377524178, 'bull_tsl_mult': 0.8932501928041169, 'bull_time_stop': 246, 'bull_use_sma': False, 'bull_use_ema': False, 'bull_use_atr': True, 'bull_use_adx': True, 'bull_use_spike': False, 'bull_rsi_required': True, 'bear_strategy': 'mean_reversion', 'bear_bb_std_mult': 1.0214596127341322, 'bear_rsi_os': 14, 'bear_rsi_ob': 51, 'bear_adx_thresh': 31.984695590763593, 'bear_atr_min_pct': 0.027432148321979512, 'bear_atr_max_pct': 0.05676635382310804, 'bear_tp_mult': 2.6125113771073085, 'bear_tsl_mult': 0.20066907165610925, 'bear_time_stop': 94, 'bear_use_sma': True, 'bear_use_ema': True, 'bear_use_atr': True, 'bear_use_adx': True, 'bear_use_spike': True, 'bear_rsi_required': True, 'sideways_strategy': 'mean_reversion', 'sideways_bb_std_mult': 0.6129229044902009, 'sideways_rsi_os': 21, 'sideways_rsi_ob': 53, 'sideways_adx_thresh': 11.961877142352336, 'sideways_atr_min_pct': 0.01310945381065286, 'sideways_atr_max_pct': 0.11854900078515665, 'sideways_tp_mult': 2.971731206234953, 'sideways_tsl_mult': 0.39470134102397725, 'sideways_time_stop': 135, 'sideways_use_sma': False, 'sideways_use_ema': False, 'sideways_use_atr': False, 'sideways_use_adx': True, 'sideways_use_spike': True, 'sideways_rsi_required': True}.
[I 2025-08-31 04:00:45,542] Trial 222 finished with values: [-1000000000.0, 1000000000.0] and parameters: {'p_sma': 54, 'p_std': 15, 'p_atr': 24, 'p_adx': 26, 'rsi_period': 27, 'ema1': 26, 'ema2': 52, 'slip_atr_k': 0.0006189915250401565, 'slip_spread_k': 0.05911821099568196, 'spread_hl_frac': 0.013183449706326187, 'bb_std_mult': 2.9931756690665767, 'rsi_os': 52, 'rsi_ob': 57, 'vol_spike': 0.07718227932338785, 'adx_thresh': 33.47768795125979, 'atr_min_pct': 0.0006249176743274212, 'atr_max_pct': 0.1252006949079451, 'tp_mult': 2.076171996995459, 'tsl_mult': 0.7866614456579096, 'strategy': 'breakout', 'time_stop': 48, 'use_sma': True, 'use_atr': False, 'use_adx': False, 'use_ema': False, 'use_spike': True, 'rsi_required': False, 'edge_k': 1.5488824554662668, 'edge_cap': 0.9987529567986358, 'bull_strategy': 'mean_reversion', 'bull_bb_std_mult': 2.297206573238794, 'bull_rsi_os': 16, 'bull_rsi_ob': 80, 'bull_adx_thresh': 16.048829973520448, 'bull_atr_min_pct': 0.010632899715425468, 'bull_atr_max_pct': 0.06401652284152567, 'bull_tp_mult': 1.6088824226774947, 'bull_tsl_mult': 0.13260910415181332, 'bull_time_stop': 139, 'bull_use_sma': False, 'bull_use_ema': False, 'bull_use_atr': True, 'bull_use_adx': True, 'bull_use_spike': False, 'bull_rsi_required': True, 'bear_strategy': 'mean_reversion', 'bear_bb_std_mult': 1.0506869350522445, 'bear_rsi_os': 7, 'bear_rsi_ob': 47, 'bear_adx_thresh': 18.05447250069021, 'bear_atr_min_pct': 0.02796111161072526, 'bear_atr_max_pct': 0.057221858474963555, 'bear_tp_mult': 2.677294618996262, 'bear_tsl_mult': 0.2749005290608905, 'bear_time_stop': 96, 'bear_use_sma': True, 'bear_use_ema': True, 'bear_use_atr': True, 'bear_use_adx': True, 'bear_use_spike': True, 'bear_rsi_required': True, 'sideways_strategy': 'mean_reversion', 'sideways_bb_std_mult': 1.5356338097651951, 'sideways_rsi_os': 22, 'sideways_rsi_ob': 53, 'sideways_adx_thresh': 31.745737106137717, 'sideways_atr_min_pct': 0.0119009329403305, 'sideways_atr_max_pct': 0.11867801227985585, 'sideways_tp_mult': 2.154933401797802, 'sideways_tsl_mult': 0.400083146704573, 'sideways_time_stop': 66, 'sideways_use_sma': False, 'sideways_use_ema': False, 'sideways_use_atr': False, 'sideways_use_adx': True, 'sideways_use_spike': True, 'sideways_rsi_required': True}.
[I 2025-08-31 04:01:21,674] Trial 224 finished with values: [-1000000000.0, 1000000000.0] and parameters: {'p_sma': 16, 'p_std': 16, 'p_atr': 24, 'p_adx': 22, 'rsi_period': 31, 'ema1': 11, 'ema2': 52, 'slip_atr_k': 0.03030060647468946, 'slip_spread_k': 0.05168233508863663, 'spread_hl_frac': 0.043408950049248114, 'bb_std_mult': 1.9547650365678835, 'rsi_os': 27, 'rsi_ob': 59, 'vol_spike': 0.2725546396724738, 'adx_thresh': 15.406785874625893, 'atr_min_pct': 0.0010367117985724417, 'atr_max_pct': 0.1255065764399091, 'tp_mult': 2.03176810819687, 'tsl_mult': 0.4910505650387474, 'strategy': 'breakout', 'time_stop': 49, 'use_sma': False, 'use_atr': False, 'use_adx': False, 'use_ema': False, 'use_spike': True, 'rsi_required': False, 'edge_k': 1.5556772106171466, 'edge_cap': 0.9988665703260076, 'bull_strategy': 'mean_reversion', 'bull_bb_std_mult': 3.3523971630828995, 'bull_rsi_os': 14, 'bull_rsi_ob': 50, 'bull_adx_thresh': 12.918109988624785, 'bull_atr_min_pct': 0.0015951057673344, 'bull_atr_max_pct': 0.09699116349810596, 'bull_tp_mult': 1.5804180311357858, 'bull_tsl_mult': 0.8393606053932874, 'bull_time_stop': 5, 'bull_use_sma': False, 'bull_use_ema': False, 'bull_use_atr': True, 'bull_use_adx': True, 'bull_use_spike': False, 'bull_rsi_required': True, 'bear_strategy': 'mean_reversion', 'bear_bb_std_mult': 1.0018219267102477, 'bear_rsi_os': 14, 'bear_rsi_ob': 79, 'bear_adx_thresh': 17.91114310382733, 'bear_atr_min_pct': 0.01777974392520841, 'bear_atr_max_pct': 0.05629004701958153, 'bear_tp_mult': 2.6251542932364282, 'bear_tsl_mult': 0.2497791258921223, 'bear_time_stop': 196, 'bear_use_sma': True, 'bear_use_ema': True, 'bear_use_atr': True, 'bear_use_adx': True, 'bear_use_spike': True, 'bear_rsi_required': True, 'sideways_strategy': 'mean_reversion', 'sideways_bb_std_mult': 1.7740720903719516, 'sideways_rsi_os': 21, 'sideways_rsi_ob': 71, 'sideways_adx_thresh': 32.228528144873636, 'sideways_atr_min_pct': 0.01089587976127023, 'sideways_atr_max_pct': 0.11888360547281669, 'sideways_tp_mult': 1.9221416597231866, 'sideways_tsl_mult': 0.44452526846660523, 'sideways_time_stop': 141, 'sideways_use_sma': False, 'sideways_use_ema': False, 'sideways_use_atr': False, 'sideways_use_adx': True, 'sideways_use_spike': True, 'sideways_rsi_required': True}.
