[I 2025-08-31 05:36:38,703] Trial 737 finished with values: [-1000000000.0, 1000000000.0] and parameters: {'p_sma': 9, 'p_std': 15, 'p_atr': 8, 'p_adx': 10, 'rsi_period': 18, 'ema1': 18, 'ema2': 27, 'slip_atr_k': 0.01954372735860538, 'slip_spread_k': 0.369688513423442, 'spread_hl_frac': 0.035752773739490123, 'bb_std_mult': 1.199628640366069, 'rsi_os': 53, 'rsi_ob': 88, 'vol_spike': 0.009498095164861782, 'adx_thresh': 8.117994166067207, 'atr_min_pct': 0.016935071050486333, 'atr_max_pct': 0.14163847060576895, 'tp_mult': 2.7075054996163392, 'tsl_mult': 0.8620761812236573, 'strategy': 'mean_reversion', 'time_stop': 18, 'use_sma': True, 'use_atr': True, 'use_adx': False, 'use_ema': False, 'use_spike': True, 'rsi_required': True, 'edge_k': 1.1229105529213, 'edge_cap': 0.2053541753767828, 'bull_strategy': 'mean_reversion', 'bull_bb_std_mult': 0.986328744898296, 'bull_rsi_os': 33, 'bull_rsi_ob': 78, 'bull_adx_thresh': 10.32185459531048, 'bull_atr_min_pct': 0.008565822508364029, 'bull_atr_max_pct': 0.09536924114774238, 'bull_tp_mult': 1.6344501990249607, 'bull_tsl_mult': 0.8750072081986504, 'bull_time_stop': 235, 'bull_use_sma': False, 'bull_use_ema': False, 'bull_use_atr': False, 'bull_use_adx': True, 'bull_use_spike': False, 'bull_rsi_required': False, 'bear_strategy': 'breakout', 'bear_bb_std_mult': 0.8243335822048046, 'bear_rsi_os': 9, 'bear_rsi_ob': 69, 'bear_adx_thresh': 13.723574412938213, 'bear_atr_min_pct': 0.007715652348521293, 'bear_atr_max_pct': 0.11574029680676673, 'bear_tp_mult': 1.3611040246146189, 'bear_tsl_mult': 0.2682611516910103, 'bear_time_stop': 267, 'bear_use_sma': True, 'bear_use_ema': True, 'bear_use_atr': True, 'bear_use_adx': False, 'bear_use_spike': False, 'bear_rsi_required': True, 'sideways_strategy': 'breakout', 'sideways_bb_std_mult': 1.1589370334764573, 'sideways_rsi_os': 9, 'sideways_rsi_ob': 77, 'sideways_adx_thresh': 26.907193265655344, 'sideways_atr_min_pct': 0.006267378851000642, 'sideways_atr_max_pct': 0.033160467993507, 'sideways_tp_mult': 2.0611327604321907, 'sideways_tsl_mult': 0.7540439263375788, 'sideways_time_stop': 11, 'sideways_use_sma': True, 'sideways_use_ema': True, 'sideways_use_atr': False, 'sideways_use_adx': False, 'sideways_use_spike': True, 'sideways_rsi_required': True}.
[I 2025-08-31 05:36:39,323] Trial 740 finished with values: [-1000000000.0, 1000000000.0] and parameters: {'p_sma': 47, 'p_std': 19, 'p_atr': 16, 'p_adx': 10, 'rsi_period': 20, 'ema1': 27, 'ema2': 43, 'slip_atr_k': 0.21187472522310175, 'slip_spread_k': 0.49057191080729834, 'spread_hl_frac': 0.00950035002411096, 'bb_std_mult': 1.8249096895569017, 'rsi_os': 50, 'rsi_ob': 55, 'vol_spike': 0.022088340429469767, 'adx_thresh': 11.374651261183292, 'atr_min_pct': 0.024430534024959257, 'atr_max_pct': 0.05912285380418794, 'tp_mult': 1.7767554600244595, 'tsl_mult': 0.7754532678307648, 'strategy': 'mean_reversion', 'time_stop': 252, 'use_sma': True, 'use_atr': True, 'use_adx': False, 'use_ema': True, 'use_spike': False, 'rsi_required': True, 'edge_k': 0.4152449127668556, 'edge_cap': 0.8243496424436682, 'bull_strategy': 'mean_reversion', 'bull_bb_std_mult': 2.0927340803925, 'bull_rsi_os': 50, 'bull_rsi_ob': 75, 'bull_adx_thresh': 9.369235268219082, 'bull_atr_min_pct': 0.0040650332995187015, 'bull_atr_max_pct': 0.06299781078796325, 'bull_tp_mult': 2.5109965995765107, 'bull_tsl_mult': 0.9106460466249037, 'bull_time_stop': 40, 'bull_use_sma': False, 'bull_use_ema': False, 'bull_use_atr': False, 'bull_use_adx': True, 'bull_use_spike': True, 'bull_rsi_required': False, 'bear_strategy': 'breakout', 'bear_bb_std_mult': 0.8271822155859323, 'bear_rsi_os': 7, 'bear_rsi_ob': 79, 'bear_adx_thresh': 26.84543028755818, 'bear_atr_min_pct': 0.005889294109363601, 'bear_atr_max_pct': 0.061902039117382554, 'bear_tp_mult': 1.3667467728182383, 'bear_tsl_mult': 0.8546170460223832, 'bear_time_stop': 267, 'bear_use_sma': True, 'bear_use_ema': True, 'bear_use_atr': True, 'bear_use_adx': False, 'bear_use_spike': False, 'bear_rsi_required': True, 'sideways_strategy': 'breakout', 'sideways_bb_std_mult': 1.0659812276498652, 'sideways_rsi_os': 32, 'sideways_rsi_ob': 84, 'sideways_adx_thresh': 30.174404651270656, 'sideways_atr_min_pct': 0.013174032568288705, 'sideways_atr_max_pct': 0.01956116087005027, 'sideways_tp_mult': 2.0127415525684027, 'sideways_tsl_mult': 0.4401810794929687, 'sideways_time_stop': 213, 'sideways_use_sma': True, 'sideways_use_ema': True, 'sideways_use_atr': False, 'sideways_use_adx': False, 'sideways_use_spike': True, 'sideways_rsi_required': True}.
[I 2025-08-31 05:36:40,941] Trial 743 finished with values: [-1000000000.0, 1000000000.0] and parameters: {'p_sma': 44, 'p_std': 51, 'p_atr': 15, 'p_adx': 8, 'rsi_period': 21, 'ema1': 5, 'ema2': 25, 'slip_atr_k': 0.03159712435332062, 'slip_spread_k': 0.758136488641499, 'spread_hl_frac': 0.012903465491065563, 'bb_std_mult': 1.8814613039434103, 'rsi_os': 43, 'rsi_ob': 48, 'vol_spike': 0.016801111144972923, 'adx_thresh': 32.69757664838896, 'atr_min_pct': 0.003277986613466481, 'atr_max_pct': 0.0729379185900705, 'tp_mult': 2.4906001382463265, 'tsl_mult': 0.8399306700323063, 'strategy': 'mean_reversion', 'time_stop': 42, 'use_sma': False, 'use_atr': True, 'use_adx': True, 'use_ema': False, 'use_spike': True, 'rsi_required': True, 'edge_k': 0.27736330161870293, 'edge_cap': 0.7099722886105995, 'bull_strategy': 'mean_reversion', 'bull_bb_std_mult': 0.8036419761140178, 'bull_rsi_os': 51, 'bull_rsi_ob': 57, 'bull_adx_thresh': 6.103524384024247, 'bull_atr_min_pct': 0.025982979035539464, 'bull_atr_max_pct': 0.11334609174191532, 'bull_tp_mult': 1.5836461222713443, 'bull_tsl_mult': 0.6360263126764997, 'bull_time_stop': 29, 'bull_use_sma': True, 'bull_use_ema': False, 'bull_use_atr': True, 'bull_use_adx': False, 'bull_use_spike': False, 'bull_rsi_required': False, 'bear_strategy': 'breakout', 'bear_bb_std_mult': 2.198573868911167, 'bear_rsi_os': 9, 'bear_rsi_ob': 72, 'bear_adx_thresh': 15.61827575949834, 'bear_atr_min_pct': 0.011872037444159234, 'bear_atr_max_pct': 0.04614319881008062, 'bear_tp_mult': 1.498040443483283, 'bear_tsl_mult': 0.2189857839572639, 'bear_time_stop': 252, 'bear_use_sma': False, 'bear_use_ema': True, 'bear_use_atr': False, 'bear_use_adx': False, 'bear_use_spike': False, 'bear_rsi_required': True, 'sideways_strategy': 'breakout', 'sideways_bb_std_mult': 1.0869306607525477, 'sideways_rsi_os': 38, 'sideways_rsi_ob': 56, 'sideways_adx_thresh': 25.553041200514524, 'sideways_atr_min_pct': 0.01311822233424941, 'sideways_atr_max_pct': 0.07313447000256279, 'sideways_tp_mult': 2.002167551704408, 'sideways_tsl_mult': 0.29530604341528816, 'sideways_time_stop': 153, 'sideways_use_sma': False, 'sideways_use_ema': True, 'sideways_use_atr': True, 'sideways_use_adx': False, 'sideways_use_spike': False, 'sideways_rsi_required': False}.
[I 2025-08-31 05:37:20,376] Trial 739 finished with values: [-1000000000.0, 1000000000.0] and parameters: {'p_sma': 57, 'p_std': 17, 'p_atr': 15, 'p_adx': 10, 'rsi_period': 36, 'ema1': 5, 'ema2': 18, 'slip_atr_k': 0.21277949459934536, 'slip_spread_k': 0.29031517666612183, 'spread_hl_frac': 0.010778027726241006, 'bb_std_mult': 1.888385141144296, 'rsi_os': 43, 'rsi_ob': 63, 'vol_spike': 0.022580230056824562, 'adx_thresh': 11.319260963900266, 'atr_min_pct': 0.02374952050543245, 'atr_max_pct': 0.05963932117522828, 'tp_mult': 2.4868210040074006, 'tsl_mult': 0.8589639650877128, 'strategy': 'mean_reversion', 'time_stop': 114, 'use_sma': True, 'use_atr': True, 'use_adx': False, 'use_ema': True, 'use_spike': False, 'rsi_required': True, 'edge_k': 0.4050041608692595, 'edge_cap': 0.8253745593048142, 'bull_strategy': 'mean_reversion', 'bull_bb_std_mult': 2.0997766464591137, 'bull_rsi_os': 50, 'bull_rsi_ob': 64, 'bull_adx_thresh': 33.23313464905295, 'bull_atr_min_pct': 0.013164645308479751, 'bull_atr_max_pct': 0.09533598033167208, 'bull_tp_mult': 2.9052377241947633, 'bull_tsl_mult': 0.9102097190536375, 'bull_time_stop': 258, 'bull_use_sma': False, 'bull_use_ema': False, 'bull_use_atr': False, 'bull_use_adx': True, 'bull_use_spike': True, 'bull_rsi_required': False, 'bear_strategy': 'breakout', 'bear_bb_std_mult': 0.8181245526277625, 'bear_rsi_os': 7, 'bear_rsi_ob': 72, 'bear_adx_thresh': 17.418407078444663, 'bear_atr_min_pct': 0.005856716300407981, 'bear_atr_max_pct': 0.10305983561696327, 'bear_tp_mult': 1.9280353883272094, 'bear_tsl_mult': 0.8243325117469373, 'bear_time_stop': 233, 'bear_use_sma': True, 'bear_use_ema': True, 'bear_use_atr': True, 'bear_use_adx': False, 'bear_use_spike': False, 'bear_rsi_required': True, 'sideways_strategy': 'breakout', 'sideways_bb_std_mult': 1.0958311790484487, 'sideways_rsi_os': 18, 'sideways_rsi_ob': 55, 'sideways_adx_thresh': 29.9515218630641, 'sideways_atr_min_pct': 0.013024644663306112, 'sideways_atr_max_pct': 0.13716572955485556, 'sideways_tp_mult': 2.0567641856663887, 'sideways_tsl_mult': 0.44314802373068585, 'sideways_time_stop': 236, 'sideways_use_sma': False, 'sideways_use_ema': True, 'sideways_use_atr': False, 'sideways_use_adx': False, 'sideways_use_spike': True, 'sideways_rsi_required': True}.
[I 2025-08-31 05:37:23,117] Trial 741 finished with values: [-1000000000.0, 1000000000.0] and parameters: {'p_sma': 46, 'p_std': 21, 'p_atr': 16, 'p_adx': 10, 'rsi_period': 20, 'ema1': 5, 'ema2': 43, 'slip_atr_k': 0.03461926808732189, 'slip_spread_k': 0.5251268671394435, 'spread_hl_frac': 0.009456957317443586, 'bb_std_mult': 3.034491558854417, 'rsi_os': 49, 'rsi_ob': 61, 'vol_spike': 0.021288016249586292, 'adx_thresh': 11.46682927827671, 'atr_min_pct': 0.003128205883067864, 'atr_max_pct': 0.14177984931456267, 'tp_mult': 2.1655321225392385, 'tsl_mult': 0.32933794763599633, 'strategy': 'mean_reversion', 'time_stop': 115, 'use_sma': False, 'use_atr': True, 'use_adx': False, 'use_ema': False, 'use_spike': True, 'rsi_required': True, 'edge_k': 0.3858296960705263, 'edge_cap': 0.7053346752608532, 'bull_strategy': 'mean_reversion', 'bull_bb_std_mult': 1.0771510896633194, 'bull_rsi_os': 50, 'bull_rsi_ob': 75, 'bull_adx_thresh': 10.225635431550756, 'bull_atr_min_pct': 0.005483412467854078, 'bull_atr_max_pct': 0.06228684032511589, 'bull_tp_mult': 1.5788285692909005, 'bull_tsl_mult': 0.957894104934859, 'bull_time_stop': 24, 'bull_use_sma': False, 'bull_use_ema': False, 'bull_use_atr': True, 'bull_use_adx': True, 'bull_use_spike': False, 'bull_rsi_required': False, 'bear_strategy': 'breakout', 'bear_bb_std_mult': 1.0204129641743136, 'bear_rsi_os': 9, 'bear_rsi_ob': 73, 'bear_adx_thresh': 26.581456326556832, 'bear_atr_min_pct': 0.002792944956073712, 'bear_atr_max_pct': 0.06262234131597606, 'bear_tp_mult': 1.349150656748566, 'bear_tsl_mult': 0.21777750280591954, 'bear_time_stop': 266, 'bear_use_sma': True, 'bear_use_ema': True, 'bear_use_atr': True, 'bear_use_adx': False, 'bear_use_spike': False, 'bear_rsi_required': True, 'sideways_strategy': 'breakout', 'sideways_bb_std_mult': 1.2572713282565648, 'sideways_rsi_os': 20, 'sideways_rsi_ob': 55, 'sideways_adx_thresh': 17.692747086581576, 'sideways_atr_min_pct': 0.005426295342071879, 'sideways_atr_max_pct': 0.10093685596913995, 'sideways_tp_mult': 2.0149234616743192, 'sideways_tsl_mult': 0.7677285723369802, 'sideways_time_stop': 204, 'sideways_use_sma': False, 'sideways_use_ema': True, 'sideways_use_atr': False, 'sideways_use_adx': False, 'sideways_use_spike': True, 'sideways_rsi_required': True}.
[I 2025-08-31 05:37:24,195] Trial 742 finished with values: [-1000000000.0, 1000000000.0] and parameters: {'p_sma': 49, 'p_std': 19, 'p_atr': 15, 'p_adx': 8, 'rsi_period': 20, 'ema1': 25, 'ema2': 25, 'slip_atr_k': 0.23696840851729456, 'slip_spread_k': 0.4285673628145006, 'spread_hl_frac': 0.0014828849680391352, 'bb_std_mult': 1.797571389241557, 'rsi_os': 42, 'rsi_ob': 92, 'vol_spike': 0.023193969456803472, 'adx_thresh': 32.854279357639314, 'atr_min_pct': 0.0244565145044882, 'atr_max_pct': 0.07229948260170847, 'tp_mult': 2.47717476903428, 'tsl_mult': 0.3247408843448826, 'strategy': 'mean_reversion', 'time_stop': 44, 'use_sma': False, 'use_atr': True, 'use_adx': False, 'use_ema': True, 'use_spike': False, 'rsi_required': True, 'edge_k': 0.4146492471993056, 'edge_cap': 0.8345842874829772, 'bull_strategy': 'mean_reversion', 'bull_bb_std_mult': 1.9854803670956231, 'bull_rsi_os': 47, 'bull_rsi_ob': 75, 'bull_adx_thresh': 9.425413911662673, 'bull_atr_min_pct': 0.0054884965402967455, 'bull_atr_max_pct': 0.062261928679264666, 'bull_tp_mult': 1.5683962117672534, 'bull_tsl_mult': 0.9405583120174761, 'bull_time_stop': 257, 'bull_use_sma': False, 'bull_use_ema': False, 'bull_use_atr': True, 'bull_use_adx': True, 'bull_use_spike': True, 'bull_rsi_required': False, 'bear_strategy': 'breakout', 'bear_bb_std_mult': 0.9988558887562242, 'bear_rsi_os': 9, 'bear_rsi_ob': 86, 'bear_adx_thresh': 15.400532836306168, 'bear_atr_min_pct': 0.004629624364827251, 'bear_atr_max_pct': 0.10262521932420636, 'bear_tp_mult': 1.185875739327923, 'bear_tsl_mult': 0.2170990752517723, 'bear_time_stop': 287, 'bear_use_sma': True, 'bear_use_ema': True, 'bear_use_atr': True, 'bear_use_adx': False, 'bear_use_spike': False, 'bear_rsi_required': True, 'sideways_strategy': 'breakout', 'sideways_bb_std_mult': 1.0698587285514038, 'sideways_rsi_os': 12, 'sideways_rsi_ob': 84, 'sideways_adx_thresh': 30.13912495073474, 'sideways_atr_min_pct': 0.009302255564798842, 'sideways_atr_max_pct': 0.024890503114391928, 'sideways_tp_mult': 2.0028808668418625, 'sideways_tsl_mult': 0.9355887575141808, 'sideways_time_stop': 203, 'sideways_use_sma': False, 'sideways_use_ema': True, 'sideways_use_atr': False, 'sideways_use_adx': False, 'sideways_use_spike': True, 'sideways_rsi_required': True}.
[I 2025-08-31 05:37:27,350] Trial 744 finished with values: [-1000000000.0, 1000000000.0] and parameters: {'p_sma': 17, 'p_std': 18, 'p_atr': 15, 'p_adx': 18, 'rsi_period': 20, 'ema1': 25, 'ema2': 36, 'slip_atr_k': 0.03762430596378741, 'slip_spread_k': 0.9755361624893579, 'spread_hl_frac': 0.0013861603098837653, 'bb_std_mult': 0.5092184838996214, 'rsi_os': 34, 'rsi_ob': 78, 'vol_spike': 0.0231879644234797, 'adx_thresh': 11.836435942306094, 'atr_min_pct': 0.008693503609027858, 'atr_max_pct': 0.13410780461532562, 'tp_mult': 2.1453315906594175, 'tsl_mult': 0.8565146440543351, 'strategy': 'mean_reversion', 'time_stop': 33, 'use_sma': False, 'use_atr': True, 'use_adx': False, 'use_ema': False, 'use_spike': True, 'rsi_required': True, 'edge_k': 0.46663274400388577, 'edge_cap': 0.8451307976921326, 'bull_strategy': 'mean_reversion', 'bull_bb_std_mult': 2.2165841312950874, 'bull_rsi_os': 46, 'bull_rsi_ob': 76, 'bull_adx_thresh': 10.461234968186702, 'bull_atr_min_pct': 0.013133317462872277, 'bull_atr_max_pct': 0.0390986295856698, 'bull_tp_mult': 2.929965933929461, 'bull_tsl_mult': 0.9341254003845924, 'bull_time_stop': 261, 'bull_use_sma': False, 'bull_use_ema': False, 'bull_use_atr': True, 'bull_use_adx': True, 'bull_use_spike': False, 'bull_rsi_required': False, 'bear_strategy': 'breakout', 'bear_bb_std_mult': 1.0361390015472816, 'bear_rsi_os': 41, 'bear_rsi_ob': 74, 'bear_adx_thresh': 25.426215472642358, 'bear_atr_min_pct': 0.009315989484430255, 'bear_atr_max_pct': 0.10333836732365166, 'bear_tp_mult': 1.9405390054176763, 'bear_tsl_mult': 0.03693781730383311, 'bear_time_stop': 260, 'bear_use_sma': True, 'bear_use_ema': True, 'bear_use_atr': True, 'bear_use_adx': False, 'bear_use_spike': False, 'bear_rsi_required': True, 'sideways_strategy': 'breakout', 'sideways_bb_std_mult': 1.722173144704569, 'sideways_rsi_os': 20, 'sideways_rsi_ob': 58, 'sideways_adx_thresh': 32.86910700849899, 'sideways_atr_min_pct': 0.009637595020269443, 'sideways_atr_max_pct': 0.0262748703949352, 'sideways_tp_mult': 2.117724235345727, 'sideways_tsl_mult': 0.4857493854909669, 'sideways_time_stop': 203, 'sideways_use_sma': False, 'sideways_use_ema': True, 'sideways_use_atr': False, 'sideways_use_adx': False, 'sideways_use_spike': True, 'sideways_rsi_required': True}.
[I 2025-08-31 05:38:12,283] Trial 745 finished with values: [-1000000000.0, 1000000000.0] and parameters: {'p_sma': 49, 'p_std': 11, 'p_atr': 18, 'p_adx': 18, 'rsi_period': 20, 'ema1': 22, 'ema2': 25, 'slip_atr_k': 0.12440725629955625, 'slip_spread_k': 0.5994820537276632, 'spread_hl_frac': 0.009420551793235563, 'bb_std_mult': 2.5888598229517585, 'rsi_os': 35, 'rsi_ob': 61, 'vol_spike': 0.03253636691420315, 'adx_thresh': 12.090755383869407, 'atr_min_pct': 0.02545915412825775, 'atr_max_pct': 0.13329076727506112, 'tp_mult': 2.1666986251576255, 'tsl_mult': 0.3357507716381176, 'strategy': 'mean_reversion', 'time_stop': 236, 'use_sma': False, 'use_atr': True, 'use_adx': False, 'use_ema': False, 'use_spike': True, 'rsi_required': True, 'edge_k': 0.46881589443189686, 'edge_cap': 0.7822524476945736, 'bull_strategy': 'mean_reversion', 'bull_bb_std_mult': 2.7541638212844104, 'bull_rsi_os': 49, 'bull_rsi_ob': 95, 'bull_adx_thresh': 9.030562535663018, 'bull_atr_min_pct': 0.005299402713731225, 'bull_atr_max_pct': 0.0386548582382591, 'bull_tp_mult': 2.1799773217537726, 'bull_tsl_mult': 0.9560681220636836, 'bull_time_stop': 254, 'bull_use_sma': False, 'bull_use_ema': True, 'bull_use_atr': True, 'bull_use_adx': True, 'bull_use_spike': False, 'bull_rsi_required': False, 'bear_strategy': 'breakout', 'bear_bb_std_mult': 1.023885040233884, 'bear_rsi_os': 41, 'bear_rsi_ob': 74, 'bear_adx_thresh': 32.17756705495708, 'bear_atr_min_pct': 0.002494786996923669, 'bear_atr_max_pct': 0.05111887154557202, 'bear_tp_mult': 2.023094993635559, 'bear_tsl_mult': 0.23699061587519374, 'bear_time_stop': 225, 'bear_use_sma': True, 'bear_use_ema': False, 'bear_use_atr': True, 'bear_use_adx': False, 'bear_use_spike': False, 'bear_rsi_required': True, 'sideways_strategy': 'breakout', 'sideways_bb_std_mult': 1.2519871528990836, 'sideways_rsi_os': 40, 'sideways_rsi_ob': 80, 'sideways_adx_thresh': 17.82515509618488, 'sideways_atr_min_pct': 0.013860009750798718, 'sideways_atr_max_pct': 0.04207577144627429, 'sideways_tp_mult': 1.3893900415856328, 'sideways_tsl_mult': 0.48192373187421084, 'sideways_time_stop': 204, 'sideways_use_sma': False, 'sideways_use_ema': True, 'sideways_use_atr': False, 'sideways_use_adx': False, 'sideways_use_spike': True, 'sideways_rsi_required': True}.
[I 2025-08-31 05:38:12,869] Trial 747 finished with values: [-1000000000.0, 1000000000.0] and parameters: {'p_sma': 59, 'p_std': 11, 'p_atr': 12, 'p_adx': 9, 'rsi_period': 84, 'ema1': 22, 'ema2': 41, 'slip_atr_k': 0.02518867210044244, 'slip_spread_k': 0.3345028808226392, 'spread_hl_frac': 0.010564400201900932, 'bb_std_mult': 2.0360818882438823, 'rsi_os': 17, 'rsi_ob': 61, 'vol_spike': 0.1962013742896902, 'adx_thresh': 11.949570278414011, 'atr_min_pct': 0.02280089310305123, 'atr_max_pct': 0.08105467679762922, 'tp_mult': 1.5383175403253777, 'tsl_mult': 0.8354280693665018, 'strategy': 'mean_reversion', 'time_stop': 143, 'use_sma': False, 'use_atr': True, 'use_adx': True, 'use_ema': False, 'use_spike': True, 'rsi_required': True, 'edge_k': 0.46657557387415827, 'edge_cap': 0.2657527025365637, 'bull_strategy': 'mean_reversion', 'bull_bb_std_mult': 0.8431746588163915, 'bull_rsi_os': 39, 'bull_rsi_ob': 87, 'bull_adx_thresh': 8.904503946793659, 'bull_atr_min_pct': 0.01112257532796796, 'bull_atr_max_pct': 0.03921695528602697, 'bull_tp_mult': 1.7554140510048448, 'bull_tsl_mult': 0.21671687429696312, 'bull_time_stop': 295, 'bull_use_sma': True, 'bull_use_ema': True, 'bull_use_atr': True, 'bull_use_adx': False, 'bull_use_spike': False, 'bull_rsi_required': False, 'bear_strategy': 'breakout', 'bear_bb_std_mult': 0.8838741981291738, 'bear_rsi_os': 40, 'bear_rsi_ob': 80, 'bear_adx_thresh': 7.435883443464906, 'bear_atr_min_pct': 0.009264541119225991, 'bear_atr_max_pct': 0.08602702482135158, 'bear_tp_mult': 2.0099477803143744, 'bear_tsl_mult': 0.8801133525201853, 'bear_time_stop': 91, 'bear_use_sma': False, 'bear_use_ema': False, 'bear_use_atr': False, 'bear_use_adx': False, 'bear_use_spike': False, 'bear_rsi_required': True, 'sideways_strategy': 'breakout', 'sideways_bb_std_mult': 0.5829863741310182, 'sideways_rsi_os': 10, 'sideways_rsi_ob': 57, 'sideways_adx_thresh': 16.89893527778485, 'sideways_atr_min_pct': 0.027595141769006612, 'sideways_atr_max_pct': 0.04101084118344492, 'sideways_tp_mult': 2.114551582191908, 'sideways_tsl_mult': 0.8475432451423175, 'sideways_time_stop': 249, 'sideways_use_sma': False, 'sideways_use_ema': True, 'sideways_use_atr': True, 'sideways_use_adx': False, 'sideways_use_spike': False, 'sideways_rsi_required': False}.
