[I 2025-08-31 05:14:23,252] Trial 605 finished with values: [-1000000000.0, 1000000000.0] and parameters: {'p_sma': 58, 'p_std': 13, 'p_atr': 16, 'p_adx': 8, 'rsi_period': 15, 'ema1': 25, 'ema2': 24, 'slip_atr_k': 0.0327637407560529, 'slip_spread_k': 0.7013088912263992, 'spread_hl_frac': 0.007645283224871079, 'bb_std_mult': 2.015967706763164, 'rsi_os': 38, 'rsi_ob': 61, 'vol_spike': 0.009295960223561179, 'adx_thresh': 11.445830507099725, 'atr_min_pct': 0.02361781853426818, 'atr_max_pct': 0.09897283501723962, 'tp_mult': 2.4322994481772233, 'tsl_mult': 0.8048002479148343, 'strategy': 'mean_reversion', 'time_stop': 24, 'use_sma': False, 'use_atr': True, 'use_adx': False, 'use_ema': False, 'use_spike': True, 'rsi_required': True, 'edge_k': 0.5370081453901292, 'edge_cap': 0.7940922798226957, 'bull_strategy': 'mean_reversion', 'bull_bb_std_mult': 0.8115633173039065, 'bull_rsi_os': 47, 'bull_rsi_ob': 80, 'bull_adx_thresh': 8.842553054522421, 'bull_atr_min_pct': 0.010145643991266322, 'bull_atr_max_pct': 0.03233253115376583, 'bull_tp_mult': 1.71430239512086, 'bull_tsl_mult': 0.9207386607255208, 'bull_time_stop': 294, 'bull_use_sma': False, 'bull_use_ema': False, 'bull_use_atr': True, 'bull_use_adx': True, 'bull_use_spike': False, 'bull_rsi_required': False, 'bear_strategy': 'breakout', 'bear_bb_std_mult': 0.7110353379727152, 'bear_rsi_os': 12, 'bear_rsi_ob': 76, 'bear_adx_thresh': 16.3288932966858, 'bear_atr_min_pct': 0.007785054171584638, 'bear_atr_max_pct': 0.04681902123851597, 'bear_tp_mult': 1.0781193245001781, 'bear_tsl_mult': 0.21129518016082763, 'bear_time_stop': 256, 'bear_use_sma': True, 'bear_use_ema': True, 'bear_use_atr': True, 'bear_use_adx': False, 'bear_use_spike': False, 'bear_rsi_required': True, 'sideways_strategy': 'breakout', 'sideways_bb_std_mult': 1.2213618102137902, 'sideways_rsi_os': 40, 'sideways_rsi_ob': 58, 'sideways_adx_thresh': 26.50187985948794, 'sideways_atr_min_pct': 0.016434217258330674, 'sideways_atr_max_pct': 0.03277828923125134, 'sideways_tp_mult': 2.110863393386829, 'sideways_tsl_mult': 0.5103959220531133, 'sideways_time_stop': 209, 'sideways_use_sma': False, 'sideways_use_ema': True, 'sideways_use_atr': False, 'sideways_use_adx': False, 'sideways_use_spike': True, 'sideways_rsi_required': True}.
[I 2025-08-31 05:14:23,550] Trial 603 finished with values: [-1000000000.0, 1000000000.0] and parameters: {'p_sma': 59, 'p_std': 12, 'p_atr': 16, 'p_adx': 8, 'rsi_period': 17, 'ema1': 25, 'ema2': 23, 'slip_atr_k': 0.03332855138627533, 'slip_spread_k': 0.7271650685753324, 'spread_hl_frac': 0.0074255033521427585, 'bb_std_mult': 1.9729517220030914, 'rsi_os': 36, 'rsi_ob': 61, 'vol_spike': 0.00448810067280506, 'adx_thresh': 11.088649862282617, 'atr_min_pct': 0.023733997449302435, 'atr_max_pct': 0.1064206802938173, 'tp_mult': 2.3985664901670884, 'tsl_mult': 0.791893253247978, 'strategy': 'mean_reversion', 'time_stop': 27, 'use_sma': False, 'use_atr': True, 'use_adx': False, 'use_ema': False, 'use_spike': True, 'rsi_required': True, 'edge_k': 0.367055419596504, 'edge_cap': 0.7426015021355591, 'bull_strategy': 'mean_reversion', 'bull_bb_std_mult': 0.9464048371914727, 'bull_rsi_os': 49, 'bull_rsi_ob': 80, 'bull_adx_thresh': 8.653674646115594, 'bull_atr_min_pct': 0.005665308162571542, 'bull_atr_max_pct': 0.02500218058137324, 'bull_tp_mult': 1.7478056318313868, 'bull_tsl_mult': 0.9301458750445144, 'bull_time_stop': 262, 'bull_use_sma': False, 'bull_use_ema': False, 'bull_use_atr': True, 'bull_use_adx': True, 'bull_use_spike': False, 'bull_rsi_required': False, 'bear_strategy': 'breakout', 'bear_bb_std_mult': 0.7009936948435025, 'bear_rsi_os': 12, 'bear_rsi_ob': 76, 'bear_adx_thresh': 12.066904882540422, 'bear_atr_min_pct': 0.008051947304370081, 'bear_atr_max_pct': 0.04740216093914229, 'bear_tp_mult': 1.2339620415243644, 'bear_tsl_mult': 0.2006946711439578, 'bear_time_stop': 255, 'bear_use_sma': True, 'bear_use_ema': True, 'bear_use_atr': True, 'bear_use_adx': False, 'bear_use_spike': False, 'bear_rsi_required': True, 'sideways_strategy': 'breakout', 'sideways_bb_std_mult': 1.224565612322848, 'sideways_rsi_os': 39, 'sideways_rsi_ob': 58, 'sideways_adx_thresh': 26.459791914438927, 'sideways_atr_min_pct': 0.016483722311873616, 'sideways_atr_max_pct': 0.03840961810803167, 'sideways_tp_mult': 2.1146398918198903, 'sideways_tsl_mult': 0.4977095338236708, 'sideways_time_stop': 214, 'sideways_use_sma': False, 'sideways_use_ema': True, 'sideways_use_atr': False, 'sideways_use_adx': False, 'sideways_use_spike': True, 'sideways_rsi_required': True}.
[I 2025-08-31 05:14:24,957] Trial 604 finished with values: [-1000000000.0, 1000000000.0] and parameters: {'p_sma': 59, 'p_std': 13, 'p_atr': 16, 'p_adx': 8, 'rsi_period': 16, 'ema1': 25, 'ema2': 24, 'slip_atr_k': 0.041342061387120446, 'slip_spread_k': 0.7327137661892144, 'spread_hl_frac': 0.007779670204728438, 'bb_std_mult': 2.064050813951361, 'rsi_os': 35, 'rsi_ob': 62, 'vol_spike': 0.008980149786938639, 'adx_thresh': 11.172236163555135, 'atr_min_pct': 0.023583094424274323, 'atr_max_pct': 0.10634173099054639, 'tp_mult': 2.416443877074407, 'tsl_mult': 0.7949114049519671, 'strategy': 'mean_reversion', 'time_stop': 25, 'use_sma': False, 'use_atr': True, 'use_adx': False, 'use_ema': False, 'use_spike': True, 'rsi_required': True, 'edge_k': 0.524921261032633, 'edge_cap': 0.7522293680419295, 'bull_strategy': 'mean_reversion', 'bull_bb_std_mult': 0.8470836321025181, 'bull_rsi_os': 49, 'bull_rsi_ob': 80, 'bull_adx_thresh': 8.653391075356401, 'bull_atr_min_pct': 0.010164009597332588, 'bull_atr_max_pct': 0.022234973022890007, 'bull_tp_mult': 1.737106665298717, 'bull_tsl_mult': 0.9328048515007168, 'bull_time_stop': 257, 'bull_use_sma': False, 'bull_use_ema': False, 'bull_use_atr': True, 'bull_use_adx': True, 'bull_use_spike': False, 'bull_rsi_required': False, 'bear_strategy': 'breakout', 'bear_bb_std_mult': 0.7307131374233933, 'bear_rsi_os': 12, 'bear_rsi_ob': 77, 'bear_adx_thresh': 26.44168160265594, 'bear_atr_min_pct': 0.008179584324206712, 'bear_atr_max_pct': 0.044650148540181955, 'bear_tp_mult': 1.207898790496412, 'bear_tsl_mult': 0.20445459455381476, 'bear_time_stop': 233, 'bear_use_sma': True, 'bear_use_ema': True, 'bear_use_atr': True, 'bear_use_adx': False, 'bear_use_spike': False, 'bear_rsi_required': True, 'sideways_strategy': 'breakout', 'sideways_bb_std_mult': 1.2374112342746537, 'sideways_rsi_os': 39, 'sideways_rsi_ob': 58, 'sideways_adx_thresh': 26.406587545717958, 'sideways_atr_min_pct': 0.015000760771866455, 'sideways_atr_max_pct': 0.0102699837829867, 'sideways_tp_mult': 2.1101481885639948, 'sideways_tsl_mult': 0.49612290956948585, 'sideways_time_stop': 214, 'sideways_use_sma': False, 'sideways_use_ema': True, 'sideways_use_atr': False, 'sideways_use_adx': False, 'sideways_use_spike': True, 'sideways_rsi_required': True}.
[I 2025-08-31 05:15:07,936] Trial 606 finished with values: [-1000000000.0, 1000000000.0] and parameters: {'p_sma': 58, 'p_std': 14, 'p_atr': 16, 'p_adx': 10, 'rsi_period': 18, 'ema1': 25, 'ema2': 24, 'slip_atr_k': 0.033487517171257974, 'slip_spread_k': 0.7249820563024674, 'spread_hl_frac': 0.00804995189206167, 'bb_std_mult': 2.0177890586341176, 'rsi_os': 39, 'rsi_ob': 61, 'vol_spike': 0.01116712391368847, 'adx_thresh': 11.078697136469172, 'atr_min_pct': 0.023706115529591995, 'atr_max_pct': 0.10562978985631241, 'tp_mult': 2.4341103335109633, 'tsl_mult': 0.8062772924202237, 'strategy': 'mean_reversion', 'time_stop': 27, 'use_sma': False, 'use_atr': True, 'use_adx': False, 'use_ema': False, 'use_spike': True, 'rsi_required': True, 'edge_k': 0.5140205987979382, 'edge_cap': 0.7495001910215289, 'bull_strategy': 'mean_reversion', 'bull_bb_std_mult': 0.8276243312299805, 'bull_rsi_os': 48, 'bull_rsi_ob': 80, 'bull_adx_thresh': 8.980468028022212, 'bull_atr_min_pct': 0.010070651658869063, 'bull_atr_max_pct': 0.02326678134498421, 'bull_tp_mult': 1.7134166264285016, 'bull_tsl_mult': 0.9238561810921966, 'bull_time_stop': 261, 'bull_use_sma': False, 'bull_use_ema': False, 'bull_use_atr': True, 'bull_use_adx': True, 'bull_use_spike': False, 'bull_rsi_required': False, 'bear_strategy': 'breakout', 'bear_bb_std_mult': 0.7283897364869482, 'bear_rsi_os': 12, 'bear_rsi_ob': 81, 'bear_adx_thresh': 11.850884534413538, 'bear_atr_min_pct': 0.00703588422435214, 'bear_atr_max_pct': 0.04591489447240796, 'bear_tp_mult': 1.0513902664127526, 'bear_tsl_mult': 0.2057393802633727, 'bear_time_stop': 269, 'bear_use_sma': True, 'bear_use_ema': True, 'bear_use_atr': True, 'bear_use_adx': False, 'bear_use_spike': False, 'bear_rsi_required': True, 'sideways_strategy': 'breakout', 'sideways_bb_std_mult': 1.1374852402580524, 'sideways_rsi_os': 36, 'sideways_rsi_ob': 57, 'sideways_adx_thresh': 27.21906460314713, 'sideways_atr_min_pct': 0.016308831300724656, 'sideways_atr_max_pct': 0.032967505019613416, 'sideways_tp_mult': 2.1155914045816417, 'sideways_tsl_mult': 0.49515127446366985, 'sideways_time_stop': 212, 'sideways_use_sma': False, 'sideways_use_ema': True, 'sideways_use_atr': False, 'sideways_use_adx': False, 'sideways_use_spike': True, 'sideways_rsi_required': True}.
[I 2025-08-31 05:15:08,249] Trial 607 finished with values: [-1000000000.0, 1000000000.0] and parameters: {'p_sma': 58, 'p_std': 14, 'p_atr': 16, 'p_adx': 10, 'rsi_period': 17, 'ema1': 23, 'ema2': 24, 'slip_atr_k': 0.031931986854769626, 'slip_spread_k': 0.7279081651521792, 'spread_hl_frac': 0.008502357729342219, 'bb_std_mult': 2.0634503915492943, 'rsi_os': 39, 'rsi_ob': 62, 'vol_spike': 0.01028055190618591, 'adx_thresh': 10.940761465363622, 'atr_min_pct': 0.02381347438278998, 'atr_max_pct': 0.10683425927375954, 'tp_mult': 2.4157008428374764, 'tsl_mult': 0.7905649878413104, 'strategy': 'mean_reversion', 'time_stop': 27, 'use_sma': False, 'use_atr': True, 'use_adx': False, 'use_ema': False, 'use_spike': True, 'rsi_required': True, 'edge_k': 0.5763092411894702, 'edge_cap': 0.7433638639107468, 'bull_strategy': 'mean_reversion', 'bull_bb_std_mult': 0.9976961676076099, 'bull_rsi_os': 55, 'bull_rsi_ob': 79, 'bull_adx_thresh': 8.407946363149854, 'bull_atr_min_pct': 0.01603929776414908, 'bull_atr_max_pct': 0.020089000414183978, 'bull_tp_mult': 1.7013528977277734, 'bull_tsl_mult': 0.930043258427988, 'bull_time_stop': 261, 'bull_use_sma': False, 'bull_use_ema': False, 'bull_use_atr': True, 'bull_use_adx': True, 'bull_use_spike': False, 'bull_rsi_required': False, 'bear_strategy': 'breakout', 'bear_bb_std_mult': 0.7947044870671034, 'bear_rsi_os': 11, 'bear_rsi_ob': 74, 'bear_adx_thresh': 12.174468757511308, 'bear_atr_min_pct': 0.007361787726264366, 'bear_atr_max_pct': 0.045975247350585356, 'bear_tp_mult': 1.0357835379200044, 'bear_tsl_mult': 0.207864277367467, 'bear_time_stop': 269, 'bear_use_sma': True, 'bear_use_ema': True, 'bear_use_atr': True, 'bear_use_adx': False, 'bear_use_spike': False, 'bear_rsi_required': True, 'sideways_strategy': 'breakout', 'sideways_bb_std_mult': 1.2057772188751443, 'sideways_rsi_os': 39, 'sideways_rsi_ob': 56, 'sideways_adx_thresh': 24.87860807946351, 'sideways_atr_min_pct': 0.014852646178998953, 'sideways_atr_max_pct': 0.03894001394396083, 'sideways_tp_mult': 2.1065219326345144, 'sideways_tsl_mult': 0.4964118352744894, 'sideways_time_stop': 218, 'sideways_use_sma': False, 'sideways_use_ema': True, 'sideways_use_atr': False, 'sideways_use_adx': False, 'sideways_use_spike': True, 'sideways_rsi_required': True}.
[I 2025-08-31 05:15:08,277] Trial 608 finished with values: [-1000000000.0, 1000000000.0] and parameters: {'p_sma': 58, 'p_std': 14, 'p_atr': 14, 'p_adx': 10, 'rsi_period': 18, 'ema1': 23, 'ema2': 24, 'slip_atr_k': 0.032425685147342745, 'slip_spread_k': 0.6371321515531163, 'spread_hl_frac': 0.008235963121103938, 'bb_std_mult': 2.0395047829243245, 'rsi_os': 22, 'rsi_ob': 61, 'vol_spike': 0.016030803558842503, 'adx_thresh': 11.164596170788846, 'atr_min_pct': 0.02335114091087269, 'atr_max_pct': 0.10756488107552571, 'tp_mult': 2.4217041904068535, 'tsl_mult': 0.8138872536126482, 'strategy': 'mean_reversion', 'time_stop': 26, 'use_sma': False, 'use_atr': True, 'use_adx': False, 'use_ema': False, 'use_spike': True, 'rsi_required': True, 'edge_k': 0.5608965474973429, 'edge_cap': 0.7449057002112224, 'bull_strategy': 'mean_reversion', 'bull_bb_std_mult': 0.9926623162553633, 'bull_rsi_os': 47, 'bull_rsi_ob': 79, 'bull_adx_thresh': 9.136823287046454, 'bull_atr_min_pct': 0.011456604919806091, 'bull_atr_max_pct': 0.022499873928011133, 'bull_tp_mult': 1.68673149640133, 'bull_tsl_mult': 0.9241705349416814, 'bull_time_stop': 271, 'bull_use_sma': False, 'bull_use_ema': False, 'bull_use_atr': True, 'bull_use_adx': True, 'bull_use_spike': False, 'bull_rsi_required': False, 'bear_strategy': 'breakout', 'bear_bb_std_mult': 0.8018391137491738, 'bear_rsi_os': 11, 'bear_rsi_ob': 80, 'bear_adx_thresh': 26.513608164458148, 'bear_atr_min_pct': 0.007306661367299495, 'bear_atr_max_pct': 0.04586692753030698, 'bear_tp_mult': 1.3303453621054682, 'bear_tsl_mult': 0.21707316360502552, 'bear_time_stop': 268, 'bear_use_sma': True, 'bear_use_ema': True, 'bear_use_atr': True, 'bear_use_adx': False, 'bear_use_spike': False, 'bear_rsi_required': True, 'sideways_strategy': 'breakout', 'sideways_bb_std_mult': 1.204166152016871, 'sideways_rsi_os': 35, 'sideways_rsi_ob': 56, 'sideways_adx_thresh': 25.11020262539482, 'sideways_atr_min_pct': 0.01482353591849418, 'sideways_atr_max_pct': 0.037403925317510314, 'sideways_tp_mult': 2.090926584802945, 'sideways_tsl_mult': 0.5028059148871388, 'sideways_time_stop': 220, 'sideways_use_sma': False, 'sideways_use_ema': True, 'sideways_use_atr': False, 'sideways_use_adx': False, 'sideways_use_spike': True, 'sideways_rsi_required': True}.
[I 2025-08-31 05:15:10,166] Trial 609 finished with values: [-1000000000.0, 1000000000.0] and parameters: {'p_sma': 58, 'p_std': 14, 'p_atr': 14, 'p_adx': 10, 'rsi_period': 18, 'ema1': 23, 'ema2': 24, 'slip_atr_k': 0.030879442952003774, 'slip_spread_k': 0.6213234603579733, 'spread_hl_frac': 0.008425165561425587, 'bb_std_mult': 2.0437007131871066, 'rsi_os': 34, 'rsi_ob': 61, 'vol_spike': 0.010102545207507871, 'adx_thresh': 11.310877111376834, 'atr_min_pct': 0.023014339678429255, 'atr_max_pct': 0.10901036369520647, 'tp_mult': 2.422073856065105, 'tsl_mult': 0.8060239535175107, 'strategy': 'mean_reversion', 'time_stop': 25, 'use_sma': False, 'use_atr': True, 'use_adx': False, 'use_ema': False, 'use_spike': True, 'rsi_required': True, 'edge_k': 0.5796807292124334, 'edge_cap': 0.8054293245920415, 'bull_strategy': 'mean_reversion', 'bull_bb_std_mult': 1.0051777477858033, 'bull_rsi_os': 45, 'bull_rsi_ob': 79, 'bull_adx_thresh': 9.188396341044793, 'bull_atr_min_pct': 0.007383577172702623, 'bull_atr_max_pct': 0.06671293767474355, 'bull_tp_mult': 1.6861289937967459, 'bull_tsl_mult': 0.9664345156839973, 'bull_time_stop': 271, 'bull_use_sma': False, 'bull_use_ema': False, 'bull_use_atr': True, 'bull_use_adx': True, 'bull_use_spike': False, 'bull_rsi_required': False, 'bear_strategy': 'breakout', 'bear_bb_std_mult': 0.7959701034497597, 'bear_rsi_os': 11, 'bear_rsi_ob': 74, 'bear_adx_thresh': 23.86897518143911, 'bear_atr_min_pct': 0.0071697008803312725, 'bear_atr_max_pct': 0.04576315276854834, 'bear_tp_mult': 1.3317405448564144, 'bear_tsl_mult': 0.1565304285672251, 'bear_time_stop': 268, 'bear_use_sma': True, 'bear_use_ema': True, 'bear_use_atr': True, 'bear_use_adx': False, 'bear_use_spike': False, 'bear_rsi_required': True, 'sideways_strategy': 'breakout', 'sideways_bb_std_mult': 1.19459415125382, 'sideways_rsi_os': 36, 'sideways_rsi_ob': 56, 'sideways_adx_thresh': 25.05206865383061, 'sideways_atr_min_pct': 0.016071986737528306, 'sideways_atr_max_pct': 0.016144950503924553, 'sideways_tp_mult': 2.0974610637561635, 'sideways_tsl_mult': 0.4580339634559041, 'sideways_time_stop': 198, 'sideways_use_sma': False, 'sideways_use_ema': True, 'sideways_use_atr': False, 'sideways_use_adx': False, 'sideways_use_spike': True, 'sideways_rsi_required': True}.
[I 2025-08-31 05:15:50,450] Trial 610 finished with values: [-1000000000.0, 1000000000.0] and parameters: {'p_sma': 58, 'p_std': 14, 'p_atr': 15, 'p_adx': 9, 'rsi_period': 19, 'ema1': 23, 'ema2': 25, 'slip_atr_k': 0.03018493818019613, 'slip_spread_k': 0.6394420466452052, 'spread_hl_frac': 0.008612417125537371, 'bb_std_mult': 2.146779737666638, 'rsi_os': 34, 'rsi_ob': 59, 'vol_spike': 0.014857872441035855, 'adx_thresh': 11.314276108974104, 'atr_min_pct': 0.022877568489761302, 'atr_max_pct': 0.097088695905245, 'tp_mult': 2.3050661645757393, 'tsl_mult': 0.814916348090033, 'strategy': 'mean_reversion', 'time_stop': 27, 'use_sma': False, 'use_atr': True, 'use_adx': False, 'use_ema': False, 'use_spike': True, 'rsi_required': True, 'edge_k': 0.5947774217438591, 'edge_cap': 0.8026277403310084, 'bull_strategy': 'mean_reversion', 'bull_bb_std_mult': 1.0337077301993376, 'bull_rsi_os': 54, 'bull_rsi_ob': 79, 'bull_adx_thresh': 7.798712561474922, 'bull_atr_min_pct': 0.006217302737236934, 'bull_atr_max_pct': 0.06670624212943327, 'bull_tp_mult': 1.6843964679901857, 'bull_tsl_mult': 0.9202315886775134, 'bull_time_stop': 273, 'bull_use_sma': False, 'bull_use_ema': False, 'bull_use_atr': True, 'bull_use_adx': True, 'bull_use_spike': False, 'bull_rsi_required': False, 'bear_strategy': 'breakout', 'bear_bb_std_mult': 0.7955700917658444, 'bear_rsi_os': 11, 'bear_rsi_ob': 74, 'bear_adx_thresh': 23.512449763363932, 'bear_atr_min_pct': 0.007379998630549198, 'bear_atr_max_pct': 0.04465782823875437, 'bear_tp_mult': 1.340495377905333, 'bear_tsl_mult': 0.22367629852904206, 'bear_time_stop': 276, 'bear_use_sma': True, 'bear_use_ema': True, 'bear_use_atr': True, 'bear_use_adx': False, 'bear_use_spike': False, 'bear_rsi_required': True, 'sideways_strategy': 'breakout', 'sideways_bb_std_mult': 1.195144609504695, 'sideways_rsi_os': 41, 'sideways_rsi_ob': 56, 'sideways_adx_thresh': 24.901136197250874, 'sideways_atr_min_pct': 0.014595839569701369, 'sideways_atr_max_pct': 0.041109116074094, 'sideways_tp_mult': 2.0869731451095848, 'sideways_tsl_mult': 0.45493449624546517, 'sideways_time_stop': 192, 'sideways_use_sma': False, 'sideways_use_ema': True, 'sideways_use_atr': False, 'sideways_use_adx': False, 'sideways_use_spike': True, 'sideways_rsi_required': True}.
[I 2025-08-31 05:15:51,610] Trial 611 finished with values: [-1000000000.0, 1000000000.0] and parameters: {'p_sma': 58, 'p_std': 14, 'p_atr': 17, 'p_adx': 9, 'rsi_period': 19, 'ema1': 23, 'ema2': 25, 'slip_atr_k': 0.029901296136559556, 'slip_spread_k': 0.608154429606829, 'spread_hl_frac': 0.00864128101608711, 'bb_std_mult': 2.12230290627967, 'rsi_os': 22, 'rsi_ob': 59, 'vol_spike': 0.013579525099544442, 'adx_thresh': 11.355241074529665, 'atr_min_pct': 0.024650863692851962, 'atr_max_pct': 0.09488330905878428, 'tp_mult': 2.4209114892395656, 'tsl_mult': 0.8115111165752315, 'strategy': 'mean_reversion', 'time_stop': 29, 'use_sma': False, 'use_atr': True, 'use_adx': False, 'use_ema': False, 'use_spike': True, 'rsi_required': True, 'edge_k': 0.3140156754685761, 'edge_cap': 0.793826308201663, 'bull_strategy': 'mean_reversion', 'bull_bb_std_mult': 1.0077512977278722, 'bull_rsi_os': 45, 'bull_rsi_ob': 79, 'bull_adx_thresh': 7.757425945245293, 'bull_atr_min_pct': 0.007212895318119094, 'bull_atr_max_pct': 0.06500381952125615, 'bull_tp_mult': 1.6690935435852543, 'bull_tsl_mult': 0.9516538383217031, 'bull_time_stop': 267, 'bull_use_sma': False, 'bull_use_ema': False, 'bull_use_atr': True, 'bull_use_adx': True, 'bull_use_spike': False, 'bull_rsi_required': False, 'bear_strategy': 'breakout', 'bear_bb_std_mult': 0.8101289694076779, 'bear_rsi_os': 11, 'bear_rsi_ob': 80, 'bear_adx_thresh': 16.992503058867058, 'bear_atr_min_pct': 0.008759177626040617, 'bear_atr_max_pct': 0.049498707441478544, 'bear_tp_mult': 1.1115523754624073, 'bear_tsl_mult': 0.15996010785049372, 'bear_time_stop': 245, 'bear_use_sma': True, 'bear_use_ema': True, 'bear_use_atr': True, 'bear_use_adx': False, 'bear_use_spike': False, 'bear_rsi_required': True, 'sideways_strategy': 'breakout', 'sideways_bb_std_mult': 1.1923727098413814, 'sideways_rsi_os': 36, 'sideways_rsi_ob': 56, 'sideways_adx_thresh': 24.422489979530695, 'sideways_atr_min_pct': 0.014681188371716747, 'sideways_atr_max_pct': 0.030352602683111934, 'sideways_tp_mult': 2.093579950065246, 'sideways_tsl_mult': 0.45426156993961925, 'sideways_time_stop': 193, 'sideways_use_sma': False, 'sideways_use_ema': True, 'sideways_use_atr': False, 'sideways_use_adx': False, 'sideways_use_spike': True, 'sideways_rsi_required': True}.
