[I 2025-08-31 04:54:41,101] Trial 496 finished with values: [-1000000000.0, 1000000000.0] and parameters: {'p_sma': 22, 'p_std': 15, 'p_atr': 25, 'p_adx': 24, 'rsi_period': 49, 'ema1': 19, 'ema2': 35, 'slip_atr_k': 0.1279967803815088, 'slip_spread_k': 0.9391047024076984, 'spread_hl_frac': 0.00764101063795887, 'bb_std_mult': 1.3405663743688385, 'rsi_os': 30, 'rsi_ob': 59, 'vol_spike': 0.1731931812649005, 'adx_thresh': 13.959835954670345, 'atr_min_pct': 0.027722956690290318, 'atr_max_pct': 0.12372225182108673, 'tp_mult': 2.9133401826587835, 'tsl_mult': 0.8867084783873355, 'strategy': 'breakout', 'time_stop': 62, 'use_sma': False, 'use_atr': False, 'use_adx': False, 'use_ema': False, 'use_spike': True, 'rsi_required': True, 'edge_k': 1.4827879641238029, 'edge_cap': 0.8961426902487097, 'bull_strategy': 'mean_reversion', 'bull_bb_std_mult': 3.43208713931213, 'bull_rsi_os': 16, 'bull_rsi_ob': 56, 'bull_adx_thresh': 9.52215558347281, 'bull_atr_min_pct': 0.013015388664340953, 'bull_atr_max_pct': 0.14654211715329202, 'bull_tp_mult': 1.5946316990833607, 'bull_tsl_mult': 0.9280331960324203, 'bull_time_stop': 141, 'bull_use_sma': False, 'bull_use_ema': False, 'bull_use_atr': True, 'bull_use_adx': True, 'bull_use_spike': False, 'bull_rsi_required': True, 'bear_strategy': 'mean_reversion', 'bear_bb_std_mult': 3.269879081002469, 'bear_rsi_os': 48, 'bear_rsi_ob': 46, 'bear_adx_thresh': 19.551475971110467, 'bear_atr_min_pct': 0.023635438748049985, 'bear_atr_max_pct': 0.041872586621533064, 'bear_tp_mult': 2.751544782822924, 'bear_tsl_mult': 0.6143356839175278, 'bear_time_stop': 254, 'bear_use_sma': True, 'bear_use_ema': True, 'bear_use_atr': True, 'bear_use_adx': False, 'bear_use_spike': True, 'bear_rsi_required': True, 'sideways_strategy': 'mean_reversion', 'sideways_bb_std_mult': 1.1561857167158909, 'sideways_rsi_os': 28, 'sideways_rsi_ob': 51, 'sideways_adx_thresh': 13.210481036629405, 'sideways_atr_min_pct': 0.004699387736791544, 'sideways_atr_max_pct': 0.11039510208246858, 'sideways_tp_mult': 2.7577152050887888, 'sideways_tsl_mult': 0.5776138656621652, 'sideways_time_stop': 234, 'sideways_use_sma': False, 'sideways_use_ema': False, 'sideways_use_atr': False, 'sideways_use_adx': True, 'sideways_use_spike': True, 'sideways_rsi_required': True}.
[I 2025-08-31 04:54:41,337] Trial 498 finished with values: [-1000000000.0, 1000000000.0] and parameters: {'p_sma': 54, 'p_std': 17, 'p_atr': 25, 'p_adx': 27, 'rsi_period': 57, 'ema1': 5, 'ema2': 25, 'slip_atr_k': 0.06945161032982897, 'slip_spread_k': 0.08826451829626375, 'spread_hl_frac': 0.01190666826606422, 'bb_std_mult': 1.67211263906329, 'rsi_os': 30, 'rsi_ob': 45, 'vol_spike': 0.029707012394103637, 'adx_thresh': 21.492443146352365, 'atr_min_pct': 0.001356176087372457, 'atr_max_pct': 0.12352934827784534, 'tp_mult': 2.9599561045506477, 'tsl_mult': 0.513649740935381, 'strategy': 'breakout', 'time_stop': 263, 'use_sma': False, 'use_atr': False, 'use_adx': False, 'use_ema': False, 'use_spike': True, 'rsi_required': False, 'edge_k': 1.3980672024954492, 'edge_cap': 0.4370705594935972, 'bull_strategy': 'mean_reversion', 'bull_bb_std_mult': 3.0622839334759497, 'bull_rsi_os': 15, 'bull_rsi_ob': 56, 'bull_adx_thresh': 29.10047054970638, 'bull_atr_min_pct': 0.008374059095573509, 'bull_atr_max_pct': 0.04922866129990513, 'bull_tp_mult': 1.6024905508196288, 'bull_tsl_mult': 0.12131776526238791, 'bull_time_stop': 273, 'bull_use_sma': False, 'bull_use_ema': False, 'bull_use_atr': True, 'bull_use_adx': True, 'bull_use_spike': False, 'bull_rsi_required': True, 'bear_strategy': 'mean_reversion', 'bear_bb_std_mult': 3.257876806452363, 'bear_rsi_os': 49, 'bear_rsi_ob': 46, 'bear_adx_thresh': 20.122329325022328, 'bear_atr_min_pct': 0.023678890449814968, 'bear_atr_max_pct': 0.034451480746870905, 'bear_tp_mult': 1.6818958048052592, 'bear_tsl_mult': 0.18956971101634124, 'bear_time_stop': 195, 'bear_use_sma': True, 'bear_use_ema': True, 'bear_use_atr': False, 'bear_use_adx': True, 'bear_use_spike': True, 'bear_rsi_required': True, 'sideways_strategy': 'mean_reversion', 'sideways_bb_std_mult': 1.1408454624972229, 'sideways_rsi_os': 28, 'sideways_rsi_ob': 50, 'sideways_adx_thresh': 13.077507330720344, 'sideways_atr_min_pct': 0.011580042007274619, 'sideways_atr_max_pct': 0.11198195922474115, 'sideways_tp_mult': 2.109864092207923, 'sideways_tsl_mult': 0.6762835862912714, 'sideways_time_stop': 65, 'sideways_use_sma': False, 'sideways_use_ema': False, 'sideways_use_atr': False, 'sideways_use_adx': True, 'sideways_use_spike': True, 'sideways_rsi_required': True}.
[I 2025-08-31 04:54:41,650] Trial 495 finished with values: [-0.020011204396030213, 0.019959983940832465] and parameters: {'p_sma': 53, 'p_std': 15, 'p_atr': 24, 'p_adx': 8, 'rsi_period': 48, 'ema1': 13, 'ema2': 25, 'slip_atr_k': 0.12904598665351957, 'slip_spread_k': 0.0059427910840004206, 'spread_hl_frac': 0.0064303185443076154, 'bb_std_mult': 1.3084851245537066, 'rsi_os': 27, 'rsi_ob': 72, 'vol_spike': 0.14425450919330704, 'adx_thresh': 11.358999065765849, 'atr_min_pct': 0.027825569039762715, 'atr_max_pct': 0.1304478556337716, 'tp_mult': 2.491359815804301, 'tsl_mult': 0.9443958025060799, 'strategy': 'mean_reversion', 'time_stop': 115, 'use_sma': True, 'use_atr': True, 'use_adx': True, 'use_ema': False, 'use_spike': True, 'rsi_required': True, 'edge_k': 0.18131678192875, 'edge_cap': 0.12278294478490681, 'bull_strategy': 'mean_reversion', 'bull_bb_std_mult': 3.4172605689990756, 'bull_rsi_os': 17, 'bull_rsi_ob': 77, 'bull_adx_thresh': 10.780420137047093, 'bull_atr_min_pct': 0.0017270599034235699, 'bull_atr_max_pct': 0.12047906911898121, 'bull_tp_mult': 2.7556613211093817, 'bull_tsl_mult': 0.9287411965907889, 'bull_time_stop': 142, 'bull_use_sma': True, 'bull_use_ema': False, 'bull_use_atr': False, 'bull_use_adx': False, 'bull_use_spike': False, 'bull_rsi_required': False, 'bear_strategy': 'breakout', 'bear_bb_std_mult': 0.8755827562891865, 'bear_rsi_os': 9, 'bear_rsi_ob': 46, 'bear_adx_thresh': 19.51481216630391, 'bear_atr_min_pct': 0.023040821553115615, 'bear_atr_max_pct': 0.04083172684714455, 'bear_tp_mult': 2.7761039503507234, 'bear_tsl_mult': 0.23382826894983544, 'bear_time_stop': 280, 'bear_use_sma': False, 'bear_use_ema': True, 'bear_use_atr': True, 'bear_use_adx': False, 'bear_use_spike': True, 'bear_rsi_required': False, 'sideways_strategy': 'breakout', 'sideways_bb_std_mult': 1.1313550599618252, 'sideways_rsi_os': 6, 'sideways_rsi_ob': 51, 'sideways_adx_thresh': 13.040064362377926, 'sideways_atr_min_pct': 0.004937484357605611, 'sideways_atr_max_pct': 0.1113243642763097, 'sideways_tp_mult': 1.8883555250954953, 'sideways_tsl_mult': 0.676225722811129, 'sideways_time_stop': 116, 'sideways_use_sma': True, 'sideways_use_ema': True, 'sideways_use_atr': True, 'sideways_use_adx': False, 'sideways_use_spike': False, 'sideways_rsi_required': False}.
[I 2025-08-31 04:54:42,011] Trial 497 finished with values: [-1000000000.0, 1000000000.0] and parameters: {'p_sma': 54, 'p_std': 16, 'p_atr': 25, 'p_adx': 11, 'rsi_period': 56, 'ema1': 25, 'ema2': 39, 'slip_atr_k': 0.1272855952363969, 'slip_spread_k': 0.29802235893527795, 'spread_hl_frac': 0.007532583265814041, 'bb_std_mult': 1.8507312532577544, 'rsi_os': 12, 'rsi_ob': 63, 'vol_spike': 0.17499707735135345, 'adx_thresh': 12.464679818013227, 'atr_min_pct': 0.023025430045706424, 'atr_max_pct': 0.1237329808335864, 'tp_mult': 2.909518742590606, 'tsl_mult': 0.7525584388292421, 'strategy': 'mean_reversion', 'time_stop': 31, 'use_sma': False, 'use_atr': False, 'use_adx': False, 'use_ema': False, 'use_spike': True, 'rsi_required': False, 'edge_k': 1.8410302298216887, 'edge_cap': 0.15338490104407343, 'bull_strategy': 'mean_reversion', 'bull_bb_std_mult': 2.1459892818351216, 'bull_rsi_os': 24, 'bull_rsi_ob': 77, 'bull_adx_thresh': 24.59553611322605, 'bull_atr_min_pct': 0.012922945784386922, 'bull_atr_max_pct': 0.07200978627536773, 'bull_tp_mult': 2.5259187135569863, 'bull_tsl_mult': 0.962278316142434, 'bull_time_stop': 143, 'bull_use_sma': False, 'bull_use_ema': False, 'bull_use_atr': True, 'bull_use_adx': True, 'bull_use_spike': False, 'bull_rsi_required': False, 'bear_strategy': 'mean_reversion', 'bear_bb_std_mult': 1.633615842756467, 'bear_rsi_os': 8, 'bear_rsi_ob': 46, 'bear_adx_thresh': 19.685863203826877, 'bear_atr_min_pct': 0.021368810746130666, 'bear_atr_max_pct': 0.03498819240791815, 'bear_tp_mult': 1.651113886172448, 'bear_tsl_mult': 0.2306157140483045, 'bear_time_stop': 282, 'bear_use_sma': True, 'bear_use_ema': True, 'bear_use_atr': False, 'bear_use_adx': True, 'bear_use_spike': True, 'bear_rsi_required': False, 'sideways_strategy': 'breakout', 'sideways_bb_std_mult': 1.1573765715974047, 'sideways_rsi_os': 28, 'sideways_rsi_ob': 50, 'sideways_adx_thresh': 11.469565288628626, 'sideways_atr_min_pct': 0.011181717577198531, 'sideways_atr_max_pct': 0.1425181060449967, 'sideways_tp_mult': 2.5492554846235187, 'sideways_tsl_mult': 0.49295491078570547, 'sideways_time_stop': 64, 'sideways_use_sma': False, 'sideways_use_ema': False, 'sideways_use_atr': False, 'sideways_use_adx': True, 'sideways_use_spike': True, 'sideways_rsi_required': True}.
[I 2025-08-31 04:55:33,676] Trial 501 finished with values: [-1000000000.0, 1000000000.0] and parameters: {'p_sma': 35, 'p_std': 17, 'p_atr': 18, 'p_adx': 11, 'rsi_period': 24, 'ema1': 25, 'ema2': 28, 'slip_atr_k': 0.007783001166498254, 'slip_spread_k': 0.6314756164894625, 'spread_hl_frac': 0.010566404885531736, 'bb_std_mult': 1.6296300059498572, 'rsi_os': 12, 'rsi_ob': 48, 'vol_spike': 0.02327381977698556, 'adx_thresh': 12.5827568086001, 'atr_min_pct': 0.024460130390266555, 'atr_max_pct': 0.12721929683141106, 'tp_mult': 2.777025555412568, 'tsl_mult': 0.9045461625105626, 'strategy': 'breakout', 'time_stop': 142, 'use_sma': False, 'use_atr': False, 'use_adx': False, 'use_ema': False, 'use_spike': True, 'rsi_required': False, 'edge_k': 1.5134680046394937, 'edge_cap': 0.9845480072561221, 'bull_strategy': 'mean_reversion', 'bull_bb_std_mult': 3.5103254739565015, 'bull_rsi_os': 14, 'bull_rsi_ob': 72, 'bull_adx_thresh': 11.835976267195399, 'bull_atr_min_pct': 0.002486763530929323, 'bull_atr_max_pct': 0.04040529859493376, 'bull_tp_mult': 1.6336774559339187, 'bull_tsl_mult': 0.9549841149835557, 'bull_time_stop': 113, 'bull_use_sma': False, 'bull_use_ema': False, 'bull_use_atr': True, 'bull_use_adx': True, 'bull_use_spike': False, 'bull_rsi_required': True, 'bear_strategy': 'mean_reversion', 'bear_bb_std_mult': 1.0119878083827756, 'bear_rsi_os': 8, 'bear_rsi_ob': 54, 'bear_adx_thresh': 24.56182543477193, 'bear_atr_min_pct': 0.005878405256061394, 'bear_atr_max_pct': 0.11485156201609473, 'bear_tp_mult': 2.6562209715074463, 'bear_tsl_mult': 0.9734151953101984, 'bear_time_stop': 289, 'bear_use_sma': True, 'bear_use_ema': True, 'bear_use_atr': False, 'bear_use_adx': True, 'bear_use_spike': True, 'bear_rsi_required': True, 'sideways_strategy': 'mean_reversion', 'sideways_bb_std_mult': 1.0640002009239162, 'sideways_rsi_os': 25, 'sideways_rsi_ob': 91, 'sideways_adx_thresh': 5.514677679937618, 'sideways_atr_min_pct': 0.026395981290158237, 'sideways_atr_max_pct': 0.11820875865975358, 'sideways_tp_mult': 2.588500958943911, 'sideways_tsl_mult': 0.618857072807685, 'sideways_time_stop': 67, 'sideways_use_sma': False, 'sideways_use_ema': False, 'sideways_use_atr': False, 'sideways_use_adx': True, 'sideways_use_spike': True, 'sideways_rsi_required': True}.
[I 2025-08-31 04:55:33,700] Trial 502 finished with values: [-1000000000.0, 1000000000.0] and parameters: {'p_sma': 7, 'p_std': 52, 'p_atr': 20, 'p_adx': 9, 'rsi_period': 44, 'ema1': 20, 'ema2': 41, 'slip_atr_k': 0.009694604056595904, 'slip_spread_k': 0.0452592925796827, 'spread_hl_frac': 0.010653151340030045, 'bb_std_mult': 3.381372478449789, 'rsi_os': 29, 'rsi_ob': 60, 'vol_spike': 0.020947586058755352, 'adx_thresh': 9.349093011283717, 'atr_min_pct': 0.024216672513096074, 'atr_max_pct': 0.12568956852049373, 'tp_mult': 2.198271587808746, 'tsl_mult': 0.9038522084842384, 'strategy': 'breakout', 'time_stop': 48, 'use_sma': False, 'use_atr': False, 'use_adx': False, 'use_ema': False, 'use_spike': True, 'rsi_required': False, 'edge_k': 1.6838410290832875, 'edge_cap': 0.9792023846067454, 'bull_strategy': 'mean_reversion', 'bull_bb_std_mult': 0.7592514047418617, 'bull_rsi_os': 13, 'bull_rsi_ob': 75, 'bull_adx_thresh': 11.468698873531823, 'bull_atr_min_pct': 0.0024675275594786255, 'bull_atr_max_pct': 0.040414532606686475, 'bull_tp_mult': 2.1183082015813466, 'bull_tsl_mult': 0.8254779884222165, 'bull_time_stop': 280, 'bull_use_sma': False, 'bull_use_ema': False, 'bull_use_atr': True, 'bull_use_adx': True, 'bull_use_spike': False, 'bull_rsi_required': True, 'bear_strategy': 'mean_reversion', 'bear_bb_std_mult': 1.013158913780015, 'bear_rsi_os': 7, 'bear_rsi_ob': 61, 'bear_adx_thresh': 20.553640725315763, 'bear_atr_min_pct': 0.024821937885559385, 'bear_atr_max_pct': 0.10338025642088702, 'bear_tp_mult': 2.0221284713933843, 'bear_tsl_mult': 0.929785939571889, 'bear_time_stop': 176, 'bear_use_sma': True, 'bear_use_ema': True, 'bear_use_atr': True, 'bear_use_adx': True, 'bear_use_spike': True, 'bear_rsi_required': True, 'sideways_strategy': 'mean_reversion', 'sideways_bb_std_mult': 3.421468931528582, 'sideways_rsi_os': 25, 'sideways_rsi_ob': 79, 'sideways_adx_thresh': 10.552201028918098, 'sideways_atr_min_pct': 0.015294446909653253, 'sideways_atr_max_pct': 0.0746491821235457, 'sideways_tp_mult': 1.272692162903304, 'sideways_tsl_mult': 0.10244128914626993, 'sideways_time_stop': 73, 'sideways_use_sma': False, 'sideways_use_ema': False, 'sideways_use_atr': False, 'sideways_use_adx': True, 'sideways_use_spike': True, 'sideways_rsi_required': True}.
[I 2025-08-31 04:55:34,320] Trial 500 finished with values: [-1000000000.0, 1000000000.0] and parameters: {'p_sma': 57, 'p_std': 16, 'p_atr': 23, 'p_adx': 9, 'rsi_period': 23, 'ema1': 13, 'ema2': 27, 'slip_atr_k': 0.009090714058686711, 'slip_spread_k': 0.04660202956046292, 'spread_hl_frac': 0.006442078199275577, 'bb_std_mult': 3.387382363039875, 'rsi_os': 45, 'rsi_ob': 54, 'vol_spike': 0.1254161158537176, 'adx_thresh': 12.198311861908717, 'atr_min_pct': 0.023106033626573937, 'atr_max_pct': 0.13151016702587187, 'tp_mult': 2.4198638765268603, 'tsl_mult': 0.9420140302449885, 'strategy': 'breakout', 'time_stop': 32, 'use_sma': False, 'use_atr': False, 'use_adx': False, 'use_ema': False, 'use_spike': True, 'rsi_required': False, 'edge_k': 1.8594343161581597, 'edge_cap': 0.12156418937068497, 'bull_strategy': 'mean_reversion', 'bull_bb_std_mult': 2.1590968606963337, 'bull_rsi_os': 29, 'bull_rsi_ob': 77, 'bull_adx_thresh': 11.934204923060612, 'bull_atr_min_pct': 0.026904262555301525, 'bull_atr_max_pct': 0.04077066184035445, 'bull_tp_mult': 2.515213883680861, 'bull_tsl_mult': 0.9608307817050032, 'bull_time_stop': 113, 'bull_use_sma': False, 'bull_use_ema': False, 'bull_use_atr': True, 'bull_use_adx': True, 'bull_use_spike': False, 'bull_rsi_required': True, 'bear_strategy': 'mean_reversion', 'bear_bb_std_mult': 1.0043116578105789, 'bear_rsi_os': 5, 'bear_rsi_ob': 87, 'bear_adx_thresh': 11.467248414115367, 'bear_atr_min_pct': 0.015216115210337638, 'bear_atr_max_pct': 0.04122665786018744, 'bear_tp_mult': 2.6519399664701453, 'bear_tsl_mult': 0.09526304219912435, 'bear_time_stop': 281, 'bear_use_sma': True, 'bear_use_ema': True, 'bear_use_atr': True, 'bear_use_adx': True, 'bear_use_spike': True, 'bear_rsi_required': True, 'sideways_strategy': 'mean_reversion', 'sideways_bb_std_mult': 1.6507110684164528, 'sideways_rsi_os': 25, 'sideways_rsi_ob': 53, 'sideways_adx_thresh': 25.47566247304702, 'sideways_atr_min_pct': 0.01389375388579027, 'sideways_atr_max_pct': 0.11846639742533979, 'sideways_tp_mult': 1.0920154140200857, 'sideways_tsl_mult': 0.6077298146029345, 'sideways_time_stop': 117, 'sideways_use_sma': False, 'sideways_use_ema': False, 'sideways_use_atr': False, 'sideways_use_adx': True, 'sideways_use_spike': True, 'sideways_rsi_required': True}.
[I 2025-08-31 04:55:34,666] Trial 499 finished with values: [-1000000000.0, 1000000000.0] and parameters: {'p_sma': 57, 'p_std': 16, 'p_atr': 23, 'p_adx': 9, 'rsi_period': 14, 'ema1': 13, 'ema2': 27, 'slip_atr_k': 0.006675939408863386, 'slip_spread_k': 0.5467026830039033, 'spread_hl_frac': 0.03992102113765113, 'bb_std_mult': 1.6316524668599404, 'rsi_os': 20, 'rsi_ob': 60, 'vol_spike': 0.020477243241632432, 'adx_thresh': 12.271303827934961, 'atr_min_pct': 0.024576431659554508, 'atr_max_pct': 0.1272615641839816, 'tp_mult': 2.4201032960311095, 'tsl_mult': 0.1505614162846965, 'strategy': 'breakout', 'time_stop': 255, 'use_sma': False, 'use_atr': False, 'use_adx': False, 'use_ema': False, 'use_spike': True, 'rsi_required': False, 'edge_k': 0.8646964048807546, 'edge_cap': 0.9999547688336021, 'bull_strategy': 'mean_reversion', 'bull_bb_std_mult': 0.7466487280205056, 'bull_rsi_os': 13, 'bull_rsi_ob': 78, 'bull_adx_thresh': 10.735152888234575, 'bull_atr_min_pct': 0.019166003113255375, 'bull_atr_max_pct': 0.0775088089656475, 'bull_tp_mult': 1.2312955678710509, 'bull_tsl_mult': 0.9590293468859457, 'bull_time_stop': 193, 'bull_use_sma': False, 'bull_use_ema': False, 'bull_use_atr': True, 'bull_use_adx': True, 'bull_use_spike': False, 'bull_rsi_required': True, 'bear_strategy': 'mean_reversion', 'bear_bb_std_mult': 1.2558224579069694, 'bear_rsi_os': 8, 'bear_rsi_ob': 87, 'bear_adx_thresh': 24.59033089114936, 'bear_atr_min_pct': 0.015256151046688204, 'bear_atr_max_pct': 0.040421131550882894, 'bear_tp_mult': 2.6516443088660493, 'bear_tsl_mult': 0.1110068026596544, 'bear_time_stop': 279, 'bear_use_sma': True, 'bear_use_ema': True, 'bear_use_atr': True, 'bear_use_adx': True, 'bear_use_spike': True, 'bear_rsi_required': True, 'sideways_strategy': 'mean_reversion', 'sideways_bb_std_mult': 1.5150916377784842, 'sideways_rsi_os': 25, 'sideways_rsi_ob': 80, 'sideways_adx_thresh': 5.034419312705522, 'sideways_atr_min_pct': 0.004082774794068777, 'sideways_atr_max_pct': 0.07353100817413047, 'sideways_tp_mult': 1.8844225526090739, 'sideways_tsl_mult': 0.6190408377689481, 'sideways_time_stop': 65, 'sideways_use_sma': False, 'sideways_use_ema': False, 'sideways_use_atr': False, 'sideways_use_adx': True, 'sideways_use_spike': True, 'sideways_rsi_required': True}.
[I 2025-08-31 04:56:25,975] Trial 506 finished with values: [-1000000000.0, 1000000000.0] and parameters: {'p_sma': 5, 'p_std': 13, 'p_atr': 22, 'p_adx': 9, 'rsi_period': 23, 'ema1': 16, 'ema2': 53, 'slip_atr_k': 0.15652480943214786, 'slip_spread_k': 0.11440475568414737, 'spread_hl_frac': 0.009487878317320259, 'bb_std_mult': 1.7967263120396115, 'rsi_os': 27, 'rsi_ob': 58, 'vol_spike': 0.03257754176051879, 'adx_thresh': 11.005319710392548, 'atr_min_pct': 0.022477794839734562, 'atr_max_pct': 0.03778571862423484, 'tp_mult': 2.565855120025383, 'tsl_mult': 0.3923393977513016, 'strategy': 'breakout', 'time_stop': 65, 'use_sma': False, 'use_atr': False, 'use_adx': False, 'use_ema': False, 'use_spike': True, 'rsi_required': False, 'edge_k': 1.391839254022501, 'edge_cap': 0.8280721801422697, 'bull_strategy': 'mean_reversion', 'bull_bb_std_mult': 3.491865032713102, 'bull_rsi_os': 38, 'bull_rsi_ob': 49, 'bull_adx_thresh': 27.561605495085452, 'bull_atr_min_pct': 0.017469663530373564, 'bull_atr_max_pct': 0.04865474450656628, 'bull_tp_mult': 1.5548116307138335, 'bull_tsl_mult': 0.15139147817575632, 'bull_time_stop': 201, 'bull_use_sma': False, 'bull_use_ema': False, 'bull_use_atr': False, 'bull_use_adx': True, 'bull_use_spike': False, 'bull_rsi_required': True, 'bear_strategy': 'mean_reversion', 'bear_bb_std_mult': 0.9157476538307433, 'bear_rsi_os': 35, 'bear_rsi_ob': 47, 'bear_adx_thresh': 20.225698437615193, 'bear_atr_min_pct': 0.025145633197383416, 'bear_atr_max_pct': 0.0441393153894064, 'bear_tp_mult': 2.697138726185642, 'bear_tsl_mult': 0.7590625106953611, 'bear_time_stop': 208, 'bear_use_sma': True, 'bear_use_ema': True, 'bear_use_atr': True, 'bear_use_adx': True, 'bear_use_spike': True, 'bear_rsi_required': True, 'sideways_strategy': 'mean_reversion', 'sideways_bb_std_mult': 1.0385542723526076, 'sideways_rsi_os': 27, 'sideways_rsi_ob': 55, 'sideways_adx_thresh': 11.039438849845858, 'sideways_atr_min_pct': 0.013475242500898021, 'sideways_atr_max_pct': 0.10786917076523664, 'sideways_tp_mult': 2.074066772545611, 'sideways_tsl_mult': 0.5514424060647483, 'sideways_time_stop': 19, 'sideways_use_sma': False, 'sideways_use_ema': False, 'sideways_use_atr': False, 'sideways_use_adx': True, 'sideways_use_spike': True, 'sideways_rsi_required': True}.
