[I 2025-08-31 04:45:53,320] Trial 449 finished with values: [-1000000000.0, 1000000000.0] and parameters: {'p_sma': 47, 'p_std': 18, 'p_atr': 29, 'p_adx': 9, 'rsi_period': 25, 'ema1': 26, 'ema2': 27, 'slip_atr_k': 0.2121562415805287, 'slip_spread_k': 0.7146002501015267, 'spread_hl_frac': 0.01993028688581581, 'bb_std_mult': 2.4077299118878734, 'rsi_os': 31, 'rsi_ob': 59, 'vol_spike': 0.1716066632974934, 'adx_thresh': 11.261287990363194, 'atr_min_pct': 0.0029417041930044283, 'atr_max_pct': 0.13082784143622433, 'tp_mult': 2.4949024703632467, 'tsl_mult': 0.2821718945920334, 'strategy': 'breakout', 'time_stop': 210, 'use_sma': False, 'use_atr': False, 'use_adx': False, 'use_ema': False, 'use_spike': True, 'rsi_required': False, 'edge_k': 1.4924552729143084, 'edge_cap': 0.6846847458188704, 'bull_strategy': 'mean_reversion', 'bull_bb_std_mult': 3.5439418895493153, 'bull_rsi_os': 13, 'bull_rsi_ob': 80, 'bull_adx_thresh': 10.863168605178185, 'bull_atr_min_pct': 0.015946081184869038, 'bull_atr_max_pct': 0.042635943285248445, 'bull_tp_mult': 2.6501306688619777, 'bull_tsl_mult': 0.8901950082567486, 'bull_time_stop': 136, 'bull_use_sma': False, 'bull_use_ema': False, 'bull_use_atr': True, 'bull_use_adx': True, 'bull_use_spike': False, 'bull_rsi_required': True, 'bear_strategy': 'mean_reversion', 'bear_bb_std_mult': 3.5298153541695116, 'bear_rsi_os': 9, 'bear_rsi_ob': 49, 'bear_adx_thresh': 14.053915374657212, 'bear_atr_min_pct': 0.015688382908061304, 'bear_atr_max_pct': 0.04695883085482128, 'bear_tp_mult': 1.435748253922661, 'bear_tsl_mult': 0.25643801619344947, 'bear_time_stop': 211, 'bear_use_sma': True, 'bear_use_ema': True, 'bear_use_atr': True, 'bear_use_adx': True, 'bear_use_spike': True, 'bear_rsi_required': True, 'sideways_strategy': 'mean_reversion', 'sideways_bb_std_mult': 0.8400818540141196, 'sideways_rsi_os': 30, 'sideways_rsi_ob': 55, 'sideways_adx_thresh': 33.56466454123118, 'sideways_atr_min_pct': 0.0034673951399614225, 'sideways_atr_max_pct': 0.08700604492164984, 'sideways_tp_mult': 1.9323160297731743, 'sideways_tsl_mult': 0.7676452140114718, 'sideways_time_stop': 82, 'sideways_use_sma': False, 'sideways_use_ema': False, 'sideways_use_atr': False, 'sideways_use_adx': True, 'sideways_use_spike': True, 'sideways_rsi_required': True}.
[I 2025-08-31 04:45:53,639] Trial 452 finished with values: [-1000000000.0, 1000000000.0] and parameters: {'p_sma': 36, 'p_std': 6, 'p_atr': 29, 'p_adx': 9, 'rsi_period': 23, 'ema1': 9, 'ema2': 59, 'slip_atr_k': 0.04680641402146349, 'slip_spread_k': 0.11939348096302407, 'spread_hl_frac': 0.003426127318290697, 'bb_std_mult': 1.2120695571849147, 'rsi_os': 7, 'rsi_ob': 84, 'vol_spike': 0.027607194312174673, 'adx_thresh': 11.114490123804872, 'atr_min_pct': 0.006683087515723645, 'atr_max_pct': 0.12917208900194585, 'tp_mult': 2.5065190624970297, 'tsl_mult': 0.12648577075722534, 'strategy': 'breakout', 'time_stop': 209, 'use_sma': False, 'use_atr': False, 'use_adx': False, 'use_ema': False, 'use_spike': True, 'rsi_required': False, 'edge_k': 1.4990831532706852, 'edge_cap': 0.3865048684992997, 'bull_strategy': 'mean_reversion', 'bull_bb_std_mult': 3.472084712712819, 'bull_rsi_os': 24, 'bull_rsi_ob': 80, 'bull_adx_thresh': 10.02212723202509, 'bull_atr_min_pct': 0.024046958651997075, 'bull_atr_max_pct': 0.08215923698074408, 'bull_tp_mult': 1.5700550056555185, 'bull_tsl_mult': 0.8892734706180351, 'bull_time_stop': 118, 'bull_use_sma': False, 'bull_use_ema': False, 'bull_use_atr': True, 'bull_use_adx': True, 'bull_use_spike': False, 'bull_rsi_required': True, 'bear_strategy': 'mean_reversion', 'bear_bb_std_mult': 0.9987976561108121, 'bear_rsi_os': 9, 'bear_rsi_ob': 80, 'bear_adx_thresh': 22.01533293253278, 'bear_atr_min_pct': 0.02508525508953582, 'bear_atr_max_pct': 0.062392359495485085, 'bear_tp_mult': 1.39858532299424, 'bear_tsl_mult': 0.44885314362250284, 'bear_time_stop': 192, 'bear_use_sma': True, 'bear_use_ema': True, 'bear_use_atr': True, 'bear_use_adx': True, 'bear_use_spike': True, 'bear_rsi_required': True, 'sideways_strategy': 'mean_reversion', 'sideways_bb_std_mult': 1.4776827215864028, 'sideways_rsi_os': 24, 'sideways_rsi_ob': 55, 'sideways_adx_thresh': 33.767189410174154, 'sideways_atr_min_pct': 0.0033489404069719664, 'sideways_atr_max_pct': 0.11986327331642248, 'sideways_tp_mult': 1.65002126080656, 'sideways_tsl_mult': 0.7730625636626087, 'sideways_time_stop': 67, 'sideways_use_sma': False, 'sideways_use_ema': False, 'sideways_use_atr': False, 'sideways_use_adx': True, 'sideways_use_spike': True, 'sideways_rsi_required': True}.
[I 2025-08-31 04:45:53,908] Trial 450 finished with values: [-1000000000.0, 1000000000.0] and parameters: {'p_sma': 55, 'p_std': 59, 'p_atr': 13, 'p_adx': 9, 'rsi_period': 75, 'ema1': 9, 'ema2': 27, 'slip_atr_k': 0.032899381377963395, 'slip_spread_k': 0.11392297031455678, 'spread_hl_frac': 0.010101104528780387, 'bb_std_mult': 1.67463707806834, 'rsi_os': 7, 'rsi_ob': 67, 'vol_spike': 0.28840778028741787, 'adx_thresh': 28.404461539830308, 'atr_min_pct': 0.023264379931842594, 'atr_max_pct': 0.1292676111472966, 'tp_mult': 2.1479337105881227, 'tsl_mult': 0.6908091546510903, 'strategy': 'breakout', 'time_stop': 148, 'use_sma': False, 'use_atr': False, 'use_adx': False, 'use_ema': False, 'use_spike': True, 'rsi_required': False, 'edge_k': 1.0769062358680934, 'edge_cap': 0.4638483617659679, 'bull_strategy': 'mean_reversion', 'bull_bb_std_mult': 3.4204269077465104, 'bull_rsi_os': 13, 'bull_rsi_ob': 80, 'bull_adx_thresh': 10.727004174200667, 'bull_atr_min_pct': 0.0038563649801572155, 'bull_atr_max_pct': 0.04280207612817824, 'bull_tp_mult': 1.5889947540648823, 'bull_tsl_mult': 0.03453832737807172, 'bull_time_stop': 136, 'bull_use_sma': False, 'bull_use_ema': False, 'bull_use_atr': True, 'bull_use_adx': True, 'bull_use_spike': False, 'bull_rsi_required': True, 'bear_strategy': 'mean_reversion', 'bear_bb_std_mult': 3.5305894488058747, 'bear_rsi_os': 37, 'bear_rsi_ob': 92, 'bear_adx_thresh': 26.359077017517812, 'bear_atr_min_pct': 0.013257957110692782, 'bear_atr_max_pct': 0.04733926794024697, 'bear_tp_mult': 1.898186190654371, 'bear_tsl_mult': 0.896958008562319, 'bear_time_stop': 211, 'bear_use_sma': True, 'bear_use_ema': True, 'bear_use_atr': True, 'bear_use_adx': True, 'bear_use_spike': True, 'bear_rsi_required': True, 'sideways_strategy': 'mean_reversion', 'sideways_bb_std_mult': 0.6643866218238674, 'sideways_rsi_os': 11, 'sideways_rsi_ob': 55, 'sideways_adx_thresh': 7.676689245617161, 'sideways_atr_min_pct': 0.028279062242385723, 'sideways_atr_max_pct': 0.1100636157178279, 'sideways_tp_mult': 2.832693618036226, 'sideways_tsl_mult': 0.7153265019111557, 'sideways_time_stop': 65, 'sideways_use_sma': False, 'sideways_use_ema': False, 'sideways_use_atr': False, 'sideways_use_adx': True, 'sideways_use_spike': True, 'sideways_rsi_required': True}.
[I 2025-08-31 04:46:43,931] Trial 454 finished with values: [-0.02875600603897277, 0.02868356820224421] and parameters: {'p_sma': 57, 'p_std': 12, 'p_atr': 24, 'p_adx': 26, 'rsi_period': 84, 'ema1': 14, 'ema2': 26, 'slip_atr_k': 0.1945827830704558, 'slip_spread_k': 0.47115691461413534, 'spread_hl_frac': 0.003697993988453864, 'bb_std_mult': 3.2291853871500633, 'rsi_os': 26, 'rsi_ob': 84, 'vol_spike': 0.026698610569796895, 'adx_thresh': 13.142081811276679, 'atr_min_pct': 0.006660581162158112, 'atr_max_pct': 0.12951058429758092, 'tp_mult': 2.504010705972659, 'tsl_mult': 0.7726405795315726, 'strategy': 'breakout', 'time_stop': 248, 'use_sma': True, 'use_atr': True, 'use_adx': True, 'use_ema': False, 'use_spike': True, 'rsi_required': False, 'edge_k': 1.5418389877571124, 'edge_cap': 0.4742118229954811, 'bull_strategy': 'mean_reversion', 'bull_bb_std_mult': 3.383685403431728, 'bull_rsi_os': 12, 'bull_rsi_ob': 76, 'bull_adx_thresh': 12.070918679949086, 'bull_atr_min_pct': 0.0011741386210523906, 'bull_atr_max_pct': 0.04731756962404251, 'bull_tp_mult': 2.4336281970690035, 'bull_tsl_mult': 0.916057281638199, 'bull_time_stop': 144, 'bull_use_sma': True, 'bull_use_ema': False, 'bull_use_atr': False, 'bull_use_adx': False, 'bull_use_spike': False, 'bull_rsi_required': True, 'bear_strategy': 'breakout', 'bear_bb_std_mult': 0.9979232712792945, 'bear_rsi_os': 13, 'bear_rsi_ob': 47, 'bear_adx_thresh': 20.98133864757478, 'bear_atr_min_pct': 0.007796382307488061, 'bear_atr_max_pct': 0.1257974329230001, 'bear_tp_mult': 2.724205895417485, 'bear_tsl_mult': 0.22814382123668647, 'bear_time_stop': 192, 'bear_use_sma': False, 'bear_use_ema': True, 'bear_use_atr': True, 'bear_use_adx': True, 'bear_use_spike': True, 'bear_rsi_required': True, 'sideways_strategy': 'mean_reversion', 'sideways_bb_std_mult': 2.702596360011605, 'sideways_rsi_os': 24, 'sideways_rsi_ob': 53, 'sideways_adx_thresh': 32.31310947116239, 'sideways_atr_min_pct': 0.014238570283336017, 'sideways_atr_max_pct': 0.022018033897627548, 'sideways_tp_mult': 1.224189059690262, 'sideways_tsl_mult': 0.5603629104131428, 'sideways_time_stop': 166, 'sideways_use_sma': False, 'sideways_use_ema': True, 'sideways_use_atr': True, 'sideways_use_adx': False, 'sideways_use_spike': False, 'sideways_rsi_required': False}.
[I 2025-08-31 04:46:44,389] Trial 455 finished with values: [-1000000000.0, 1000000000.0] and parameters: {'p_sma': 12, 'p_std': 49, 'p_atr': 25, 'p_adx': 26, 'rsi_period': 21, 'ema1': 14, 'ema2': 26, 'slip_atr_k': 0.032734641521621574, 'slip_spread_k': 0.6662474159894944, 'spread_hl_frac': 0.01082913485387917, 'bb_std_mult': 1.7845431146092527, 'rsi_os': 39, 'rsi_ob': 65, 'vol_spike': 0.10558595086294192, 'adx_thresh': 9.702618070116143, 'atr_min_pct': 0.0215989258720279, 'atr_max_pct': 0.11904986330142224, 'tp_mult': 1.114878280588938, 'tsl_mult': 0.9297143698686201, 'strategy': 'breakout', 'time_stop': 282, 'use_sma': True, 'use_atr': True, 'use_adx': True, 'use_ema': False, 'use_spike': True, 'rsi_required': False, 'edge_k': 1.0540433318316236, 'edge_cap': 0.26759745248926375, 'bull_strategy': 'mean_reversion', 'bull_bb_std_mult': 3.387196464637272, 'bull_rsi_os': 14, 'bull_rsi_ob': 85, 'bull_adx_thresh': 12.02630425638623, 'bull_atr_min_pct': 0.00390994658030501, 'bull_atr_max_pct': 0.04725186714327724, 'bull_tp_mult': 2.4289887008804283, 'bull_tsl_mult': 0.9118759973238074, 'bull_time_stop': 36, 'bull_use_sma': True, 'bull_use_ema': False, 'bull_use_atr': False, 'bull_use_adx': False, 'bull_use_spike': False, 'bull_rsi_required': True, 'bear_strategy': 'breakout', 'bear_bb_std_mult': 0.9016367380501824, 'bear_rsi_os': 11, 'bear_rsi_ob': 74, 'bear_adx_thresh': 21.051278876038005, 'bear_atr_min_pct': 0.024058265941441243, 'bear_atr_max_pct': 0.12486615794545895, 'bear_tp_mult': 2.722009400946769, 'bear_tsl_mult': 0.23051425362957984, 'bear_time_stop': 204, 'bear_use_sma': False, 'bear_use_ema': True, 'bear_use_atr': True, 'bear_use_adx': True, 'bear_use_spike': True, 'bear_rsi_required': True, 'sideways_strategy': 'mean_reversion', 'sideways_bb_std_mult': 2.731151425547945, 'sideways_rsi_os': 25, 'sideways_rsi_ob': 53, 'sideways_adx_thresh': 6.866969949941993, 'sideways_atr_min_pct': 0.01739611175453068, 'sideways_atr_max_pct': 0.11118892685411637, 'sideways_tp_mult': 2.0149020632928454, 'sideways_tsl_mult': 0.5036069502549989, 'sideways_time_stop': 60, 'sideways_use_sma': False, 'sideways_use_ema': True, 'sideways_use_atr': True, 'sideways_use_adx': False, 'sideways_use_spike': False, 'sideways_rsi_required': False}.
[I 2025-08-31 04:46:44,881] Trial 453 finished with values: [-1000000000.0, 1000000000.0] and parameters: {'p_sma': 57, 'p_std': 12, 'p_atr': 24, 'p_adx': 12, 'rsi_period': 72, 'ema1': 14, 'ema2': 26, 'slip_atr_k': 0.03726482943552208, 'slip_spread_k': 0.8234207279130228, 'spread_hl_frac': 0.0033776642187895445, 'bb_std_mult': 3.210734293740148, 'rsi_os': 26, 'rsi_ob': 75, 'vol_spike': 0.024877470936169665, 'adx_thresh': 28.47354027993334, 'atr_min_pct': 0.0035816960149932207, 'atr_max_pct': 0.06636331156244138, 'tp_mult': 2.4974890603130886, 'tsl_mult': 0.12796979347948878, 'strategy': 'breakout', 'time_stop': 42, 'use_sma': True, 'use_atr': True, 'use_adx': True, 'use_ema': False, 'use_spike': True, 'rsi_required': False, 'edge_k': 0.34738978820547106, 'edge_cap': 0.38509186993919486, 'bull_strategy': 'mean_reversion', 'bull_bb_std_mult': 3.361868279271678, 'bull_rsi_os': 10, 'bull_rsi_ob': 71, 'bull_adx_thresh': 9.870763063211097, 'bull_atr_min_pct': 0.00960938141439833, 'bull_atr_max_pct': 0.08195936718140787, 'bull_tp_mult': 1.7897668121176236, 'bull_tsl_mult': 0.9047162726027901, 'bull_time_stop': 117, 'bull_use_sma': True, 'bull_use_ema': False, 'bull_use_atr': False, 'bull_use_adx': False, 'bull_use_spike': False, 'bull_rsi_required': True, 'bear_strategy': 'breakout', 'bear_bb_std_mult': 0.9781724008573072, 'bear_rsi_os': 13, 'bear_rsi_ob': 92, 'bear_adx_thresh': 21.057650274009326, 'bear_atr_min_pct': 0.007785771965766627, 'bear_atr_max_pct': 0.024239336461424406, 'bear_tp_mult': 2.7190851068082886, 'bear_tsl_mult': 0.6800671699168237, 'bear_time_stop': 193, 'bear_use_sma': False, 'bear_use_ema': True, 'bear_use_atr': True, 'bear_use_adx': True, 'bear_use_spike': True, 'bear_rsi_required': True, 'sideways_strategy': 'mean_reversion', 'sideways_bb_std_mult': 0.7491507591724679, 'sideways_rsi_os': 24, 'sideways_rsi_ob': 53, 'sideways_adx_thresh': 10.690710669210787, 'sideways_atr_min_pct': 0.013026621213169273, 'sideways_atr_max_pct': 0.11009189314426682, 'sideways_tp_mult': 2.002995557878852, 'sideways_tsl_mult': 0.5612519702518832, 'sideways_time_stop': 167, 'sideways_use_sma': False, 'sideways_use_ema': True, 'sideways_use_atr': True, 'sideways_use_adx': False, 'sideways_use_spike': False, 'sideways_rsi_required': False}.
[I 2025-08-31 04:46:46,205] Trial 456 finished with values: [-1000000000.0, 1000000000.0] and parameters: {'p_sma': 57, 'p_std': 15, 'p_atr': 25, 'p_adx': 19, 'rsi_period': 37, 'ema1': 18, 'ema2': 24, 'slip_atr_k': 0.22776947368605246, 'slip_spread_k': 0.14670092055635492, 'spread_hl_frac': 0.011029494192451436, 'bb_std_mult': 1.766240029148488, 'rsi_os': 26, 'rsi_ob': 62, 'vol_spike': 0.026763965714402774, 'adx_thresh': 9.693967096148224, 'atr_min_pct': 0.02177490330670597, 'atr_max_pct': 0.11949278040006113, 'tp_mult': 2.4786044789512145, 'tsl_mult': 0.9393261817140607, 'strategy': 'mean_reversion', 'time_stop': 127, 'use_sma': True, 'use_atr': True, 'use_adx': True, 'use_ema': False, 'use_spike': True, 'rsi_required': False, 'edge_k': 1.3012579706106604, 'edge_cap': 0.9652362760238796, 'bull_strategy': 'mean_reversion', 'bull_bb_std_mult': 3.357696851058314, 'bull_rsi_os': 15, 'bull_rsi_ob': 85, 'bull_adx_thresh': 12.057854660849038, 'bull_atr_min_pct': 0.02991758509079745, 'bull_atr_max_pct': 0.04734498694401271, 'bull_tp_mult': 1.6293183986851714, 'bull_tsl_mult': 0.9148884310977897, 'bull_time_stop': 62, 'bull_use_sma': True, 'bull_use_ema': False, 'bull_use_atr': False, 'bull_use_adx': False, 'bull_use_spike': False, 'bull_rsi_required': False, 'bear_strategy': 'breakout', 'bear_bb_std_mult': 0.894699086277601, 'bear_rsi_os': 13, 'bear_rsi_ob': 47, 'bear_adx_thresh': 21.0379834038948, 'bear_atr_min_pct': 0.02413906054984476, 'bear_atr_max_pct': 0.01887243480307573, 'bear_tp_mult': 2.732247531922148, 'bear_tsl_mult': 0.22440287440924356, 'bear_time_stop': 203, 'bear_use_sma': False, 'bear_use_ema': True, 'bear_use_atr': True, 'bear_use_adx': True, 'bear_use_spike': True, 'bear_rsi_required': False, 'sideways_strategy': 'breakout', 'sideways_bb_std_mult': 0.9783354487718605, 'sideways_rsi_os': 26, 'sideways_rsi_ob': 53, 'sideways_adx_thresh': 10.52069235731351, 'sideways_atr_min_pct': 0.017558609727914884, 'sideways_atr_max_pct': 0.04503231867864017, 'sideways_tp_mult': 2.0141391278263483, 'sideways_tsl_mult': 0.03942268765302198, 'sideways_time_stop': 60, 'sideways_use_sma': False, 'sideways_use_ema': True, 'sideways_use_atr': True, 'sideways_use_adx': False, 'sideways_use_spike': False, 'sideways_rsi_required': False}.
[I 2025-08-31 04:47:30,236] Trial 458 finished with values: [-1000000000.0, 1000000000.0] and parameters: {'p_sma': 8, 'p_std': 15, 'p_atr': 25, 'p_adx': 10, 'rsi_period': 59, 'ema1': 14, 'ema2': 49, 'slip_atr_k': 0.2202021478908433, 'slip_spread_k': 0.14983596132343568, 'spread_hl_frac': 0.011972690568635725, 'bb_std_mult': 2.0072812169624275, 'rsi_os': 27, 'rsi_ob': 58, 'vol_spike': 0.017524076692868498, 'adx_thresh': 12.276114820123537, 'atr_min_pct': 0.013319090265028349, 'atr_max_pct': 0.1257609383258751, 'tp_mult': 2.840810409045165, 'tsl_mult': 0.1759945819749426, 'strategy': 'mean_reversion', 'time_stop': 38, 'use_sma': False, 'use_atr': False, 'use_adx': False, 'use_ema': True, 'use_spike': False, 'rsi_required': False, 'edge_k': 0.993732857847982, 'edge_cap': 0.9570877039963849, 'bull_strategy': 'breakout', 'bull_bb_std_mult': 3.296697295529682, 'bull_rsi_os': 18, 'bull_rsi_ob': 93, 'bull_adx_thresh': 23.039803805179734, 'bull_atr_min_pct': 0.0021456014243583493, 'bull_atr_max_pct': 0.09548260704821834, 'bull_tp_mult': 1.812552153379695, 'bull_tsl_mult': 0.22955619324118248, 'bull_time_stop': 130, 'bull_use_sma': False, 'bull_use_ema': False, 'bull_use_atr': True, 'bull_use_adx': True, 'bull_use_spike': True, 'bull_rsi_required': False, 'bear_strategy': 'mean_reversion', 'bear_bb_std_mult': 1.0640049811758079, 'bear_rsi_os': 50, 'bear_rsi_ob': 66, 'bear_adx_thresh': 32.935005780717724, 'bear_atr_min_pct': 0.023612417128296526, 'bear_atr_max_pct': 0.04483688436668725, 'bear_tp_mult': 2.9178859618617543, 'bear_tsl_mult': 0.6791571093493325, 'bear_time_stop': 182, 'bear_use_sma': True, 'bear_use_ema': True, 'bear_use_atr': True, 'bear_use_adx': True, 'bear_use_spike': True, 'bear_rsi_required': False, 'sideways_strategy': 'breakout', 'sideways_bb_std_mult': 0.7608323353142838, 'sideways_rsi_os': 26, 'sideways_rsi_ob': 52, 'sideways_adx_thresh': 10.70168496634357, 'sideways_atr_min_pct': 0.013051120320149075, 'sideways_atr_max_pct': 0.11599214635725777, 'sideways_tp_mult': 1.410210434918, 'sideways_tsl_mult': 0.9035595628794784, 'sideways_time_stop': 14, 'sideways_use_sma': True, 'sideways_use_ema': False, 'sideways_use_atr': False, 'sideways_use_adx': True, 'sideways_use_spike': True, 'sideways_rsi_required': True}.
[I 2025-08-31 04:47:31,239] Trial 459 finished with values: [-1000000000.0, 1000000000.0] and parameters: {'p_sma': 56, 'p_std': 8, 'p_atr': 24, 'p_adx': 10, 'rsi_period': 37, 'ema1': 29, 'ema2': 17, 'slip_atr_k': 0.22821850290415596, 'slip_spread_k': 0.15687063374279875, 'spread_hl_frac': 0.012708398196204921, 'bb_std_mult': 1.0511986834439186, 'rsi_os': 42, 'rsi_ob': 77, 'vol_spike': 0.00303994061510357, 'adx_thresh': 11.896319665223102, 'atr_min_pct': 0.01768196954731412, 'atr_max_pct': 0.11571959609072326, 'tp_mult': 2.248164139312145, 'tsl_mult': 0.8796069838218178, 'strategy': 'mean_reversion', 'time_stop': 201, 'use_sma': False, 'use_atr': False, 'use_adx': False, 'use_ema': True, 'use_spike': False, 'rsi_required': False, 'edge_k': 1.737126623993129, 'edge_cap': 0.5455238771260809, 'bull_strategy': 'breakout', 'bull_bb_std_mult': 3.595705077683309, 'bull_rsi_os': 15, 'bull_rsi_ob': 93, 'bull_adx_thresh': 9.3127194622541, 'bull_atr_min_pct': 0.0024716489977619, 'bull_atr_max_pct': 0.04963351974009225, 'bull_tp_mult': 1.1226247315646691, 'bull_tsl_mult': 0.2261970371572108, 'bull_time_stop': 154, 'bull_use_sma': False, 'bull_use_ema': True, 'bull_use_atr': True, 'bull_use_adx': True, 'bull_use_spike': True, 'bull_rsi_required': False, 'bear_strategy': 'mean_reversion', 'bear_bb_std_mult': 0.9019753685280897, 'bear_rsi_os': 22, 'bear_rsi_ob': 87, 'bear_adx_thresh': 19.52213345402597, 'bear_atr_min_pct': 0.012341388981789846, 'bear_atr_max_pct': 0.036494130483781376, 'bear_tp_mult': 1.2914757336056062, 'bear_tsl_mult': 0.4221303626619241, 'bear_time_stop': 180, 'bear_use_sma': True, 'bear_use_ema': False, 'bear_use_atr': True, 'bear_use_adx': False, 'bear_use_spike': False, 'bear_rsi_required': False, 'sideways_strategy': 'breakout', 'sideways_bb_std_mult': 0.9666078172989329, 'sideways_rsi_os': 26, 'sideways_rsi_ob': 54, 'sideways_adx_thresh': 9.989039367602947, 'sideways_atr_min_pct': 0.016451140118730136, 'sideways_atr_max_pct': 0.14442029490046532, 'sideways_tp_mult': 1.8181253918047986, 'sideways_tsl_mult': 0.8918984384307587, 'sideways_time_stop': 59, 'sideways_use_sma': True, 'sideways_use_ema': False, 'sideways_use_atr': False, 'sideways_use_adx': True, 'sideways_use_spike': True, 'sideways_rsi_required': True}.
