[I 2025-08-31 03:53:04,922] Trial 161 finished with values: [-0.012418226483722483, 0.012363553512935267] and parameters: {'p_sma': 60, 'p_std': 15, 'p_atr': 25, 'p_adx': 10, 'rsi_period': 34, 'ema1': 16, 'ema2': 18, 'slip_atr_k': 0.17900123651789052, 'slip_spread_k': 0.36584849412762893, 'spread_hl_frac': 0.02463825469520902, 'bb_std_mult': 1.6409739014676556, 'rsi_os': 21, 'rsi_ob': 64, 'vol_spike': 0.0013796639359121288, 'adx_thresh': 25.98526944963421, 'atr_min_pct': 0.021616274386634743, 'atr_max_pct': 0.14989529823907058, 'tp_mult': 2.4125836931699363, 'tsl_mult': 0.7991717541889485, 'strategy': 'breakout', 'time_stop': 135, 'use_sma': False, 'use_atr': False, 'use_adx': False, 'use_ema': True, 'use_spike': False, 'rsi_required': False, 'edge_k': 1.6750063233419898, 'edge_cap': 0.929101651146885, 'bull_strategy': 'breakout', 'bull_bb_std_mult': 1.034712967573685, 'bull_rsi_os': 18, 'bull_rsi_ob': 83, 'bull_adx_thresh': 21.938344122534687, 'bull_atr_min_pct': 0.0008011413112065344, 'bull_atr_max_pct': 0.12548322266965622, 'bull_tp_mult': 2.010397433309602, 'bull_tsl_mult': 0.940811330736173, 'bull_time_stop': 172, 'bull_use_sma': False, 'bull_use_ema': False, 'bull_use_atr': True, 'bull_use_adx': True, 'bull_use_spike': True, 'bull_rsi_required': False, 'bear_strategy': 'mean_reversion', 'bear_bb_std_mult': 0.5086063121019826, 'bear_rsi_os': 27, 'bear_rsi_ob': 59, 'bear_adx_thresh': 21.800495665728395, 'bear_atr_min_pct': 0.00962936159735001, 'bear_atr_max_pct': 0.13610559111622275, 'bear_tp_mult': 2.458399108972145, 'bear_tsl_mult': 0.3372513705852823, 'bear_time_stop': 177, 'bear_use_sma': True, 'bear_use_ema': True, 'bear_use_atr': True, 'bear_use_adx': False, 'bear_use_spike': True, 'bear_rsi_required': True, 'sideways_strategy': 'mean_reversion', 'sideways_bb_std_mult': 2.3004570818406367, 'sideways_rsi_os': 12, 'sideways_rsi_ob': 59, 'sideways_adx_thresh': 9.564804114263595, 'sideways_atr_min_pct': 0.017540235780018346, 'sideways_atr_max_pct': 0.016907505256811603, 'sideways_tp_mult': 2.661503448279393, 'sideways_tsl_mult': 0.16838875607825965, 'sideways_time_stop': 272, 'sideways_use_sma': False, 'sideways_use_ema': False, 'sideways_use_atr': False, 'sideways_use_adx': True, 'sideways_use_spike': True, 'sideways_rsi_required': True}.
[I 2025-08-31 03:53:05,280] Trial 162 finished with values: [-1000000000.0, 1000000000.0] and parameters: {'p_sma': 60, 'p_std': 49, 'p_atr': 24, 'p_adx': 9, 'rsi_period': 35, 'ema1': 13, 'ema2': 58, 'slip_atr_k': 0.008385604600277083, 'slip_spread_k': 0.5264032083193908, 'spread_hl_frac': 1.8773461865465718e-05, 'bb_std_mult': 1.6104042923640025, 'rsi_os': 21, 'rsi_ob': 89, 'vol_spike': 0.2227077515790825, 'adx_thresh': 25.923680960412355, 'atr_min_pct': 0.021624275877578415, 'atr_max_pct': 0.1494112586670859, 'tp_mult': 1.3806425794005908, 'tsl_mult': 0.5110804732796207, 'strategy': 'breakout', 'time_stop': 104, 'use_sma': False, 'use_atr': False, 'use_adx': False, 'use_ema': True, 'use_spike': False, 'rsi_required': False, 'edge_k': 1.6703726273319028, 'edge_cap': 0.7324869824850829, 'bull_strategy': 'breakout', 'bull_bb_std_mult': 1.4267824955505781, 'bull_rsi_os': 13, 'bull_rsi_ob': 87, 'bull_adx_thresh': 20.87277926963631, 'bull_atr_min_pct': 0.0016566460074713143, 'bull_atr_max_pct': 0.12551315271192517, 'bull_tp_mult': 2.0250968026964853, 'bull_tsl_mult': 0.9428336738569078, 'bull_time_stop': 206, 'bull_use_sma': False, 'bull_use_ema': False, 'bull_use_atr': True, 'bull_use_adx': True, 'bull_use_spike': True, 'bull_rsi_required': False, 'bear_strategy': 'mean_reversion', 'bear_bb_std_mult': 3.3265388663317603, 'bear_rsi_os': 27, 'bear_rsi_ob': 59, 'bear_adx_thresh': 17.79371197794176, 'bear_atr_min_pct': 0.009634183886257693, 'bear_atr_max_pct': 0.13706590562896045, 'bear_tp_mult': 2.4768606480895636, 'bear_tsl_mult': 0.34354449895471384, 'bear_time_stop': 189, 'bear_use_sma': True, 'bear_use_ema': True, 'bear_use_atr': True, 'bear_use_adx': False, 'bear_use_spike': True, 'bear_rsi_required': True, 'sideways_strategy': 'mean_reversion', 'sideways_bb_std_mult': 2.3324340005237776, 'sideways_rsi_os': 13, 'sideways_rsi_ob': 81, 'sideways_adx_thresh': 6.5274371562333915, 'sideways_atr_min_pct': 0.01255269057245216, 'sideways_atr_max_pct': 0.016923101859284705, 'sideways_tp_mult': 2.6632930787616567, 'sideways_tsl_mult': 0.27664081538119323, 'sideways_time_stop': 271, 'sideways_use_sma': True, 'sideways_use_ema': False, 'sideways_use_atr': False, 'sideways_use_adx': True, 'sideways_use_spike': True, 'sideways_rsi_required': True}.
[I 2025-08-31 03:53:05,370] Trial 164 finished with values: [-0.019007958410399817, 0.018945764478686705] and parameters: {'p_sma': 22, 'p_std': 12, 'p_atr': 24, 'p_adx': 10, 'rsi_period': 35, 'ema1': 16, 'ema2': 14, 'slip_atr_k': 0.18762076312173048, 'slip_spread_k': 0.5395393284963597, 'spread_hl_frac': 0.024592617033952942, 'bb_std_mult': 3.1322165228893937, 'rsi_os': 23, 'rsi_ob': 63, 'vol_spike': 0.03652950576691604, 'adx_thresh': 26.891287550917816, 'atr_min_pct': 0.024150057445691816, 'atr_max_pct': 0.14834139835067311, 'tp_mult': 1.4373587936551115, 'tsl_mult': 0.3331672074315397, 'strategy': 'breakout', 'time_stop': 112, 'use_sma': False, 'use_atr': False, 'use_adx': False, 'use_ema': True, 'use_spike': False, 'rsi_required': False, 'edge_k': 1.6737051096017954, 'edge_cap': 0.8096311196439341, 'bull_strategy': 'breakout', 'bull_bb_std_mult': 1.4325294440942118, 'bull_rsi_os': 14, 'bull_rsi_ob': 87, 'bull_adx_thresh': 22.028596761154134, 'bull_atr_min_pct': 0.000643467480203118, 'bull_atr_max_pct': 0.12598260386306862, 'bull_tp_mult': 1.6678162875560503, 'bull_tsl_mult': 0.9503590773123364, 'bull_time_stop': 172, 'bull_use_sma': False, 'bull_use_ema': False, 'bull_use_atr': True, 'bull_use_adx': True, 'bull_use_spike': True, 'bull_rsi_required': False, 'bear_strategy': 'mean_reversion', 'bear_bb_std_mult': 3.2954951661323544, 'bear_rsi_os': 32, 'bear_rsi_ob': 59, 'bear_adx_thresh': 26.745863004381466, 'bear_atr_min_pct': 0.009735521390317432, 'bear_atr_max_pct': 0.12955277955956412, 'bear_tp_mult': 2.471348753487703, 'bear_tsl_mult': 0.8002732315577387, 'bear_time_stop': 190, 'bear_use_sma': True, 'bear_use_ema': True, 'bear_use_atr': True, 'bear_use_adx': False, 'bear_use_spike': True, 'bear_rsi_required': True, 'sideways_strategy': 'mean_reversion', 'sideways_bb_std_mult': 2.2450754371299806, 'sideways_rsi_os': 38, 'sideways_rsi_ob': 82, 'sideways_adx_thresh': 24.51361645735967, 'sideways_atr_min_pct': 0.006991400355105074, 'sideways_atr_max_pct': 0.016057809879619862, 'sideways_tp_mult': 2.6826431969419477, 'sideways_tsl_mult': 0.2564313241878944, 'sideways_time_stop': 273, 'sideways_use_sma': True, 'sideways_use_ema': False, 'sideways_use_atr': False, 'sideways_use_adx': True, 'sideways_use_spike': True, 'sideways_rsi_required': True}.
[I 2025-08-31 03:53:34,872] Trial 166 finished with values: [-1000000000.0, 1000000000.0] and parameters: {'p_sma': 60, 'p_std': 15, 'p_atr': 26, 'p_adx': 30, 'rsi_period': 43, 'ema1': 16, 'ema2': 19, 'slip_atr_k': 0.18001264983459522, 'slip_spread_k': 0.3483831913907573, 'spread_hl_frac': 0.027458148013595824, 'bb_std_mult': 2.142707410780138, 'rsi_os': 23, 'rsi_ob': 63, 'vol_spike': 0.002406989189093507, 'adx_thresh': 28.294956910100378, 'atr_min_pct': 0.020277967029219898, 'atr_max_pct': 0.13854570334449232, 'tp_mult': 2.4076334030291515, 'tsl_mult': 0.5134370407051596, 'strategy': 'breakout', 'time_stop': 135, 'use_sma': False, 'use_atr': False, 'use_adx': False, 'use_ema': True, 'use_spike': False, 'rsi_required': False, 'edge_k': 1.821097351917889, 'edge_cap': 0.9204238156886825, 'bull_strategy': 'breakout', 'bull_bb_std_mult': 1.1639144254485974, 'bull_rsi_os': 18, 'bull_rsi_ob': 79, 'bull_adx_thresh': 11.49081867915601, 'bull_atr_min_pct': 0.01967333300490935, 'bull_atr_max_pct': 0.1251200143782887, 'bull_tp_mult': 2.1677764290750776, 'bull_tsl_mult': 0.9481694399962146, 'bull_time_stop': 169, 'bull_use_sma': False, 'bull_use_ema': False, 'bull_use_atr': True, 'bull_use_adx': True, 'bull_use_spike': True, 'bull_rsi_required': False, 'bear_strategy': 'mean_reversion', 'bear_bb_std_mult': 0.5400893480370523, 'bear_rsi_os': 27, 'bear_rsi_ob': 87, 'bear_adx_thresh': 22.865361061243117, 'bear_atr_min_pct': 0.00858037578302303, 'bear_atr_max_pct': 0.14058235869437555, 'bear_tp_mult': 2.6467573479096647, 'bear_tsl_mult': 0.346951883168672, 'bear_time_stop': 187, 'bear_use_sma': True, 'bear_use_ema': True, 'bear_use_atr': True, 'bear_use_adx': False, 'bear_use_spike': True, 'bear_rsi_required': True, 'sideways_strategy': 'mean_reversion', 'sideways_bb_std_mult': 2.489297270026098, 'sideways_rsi_os': 17, 'sideways_rsi_ob': 59, 'sideways_adx_thresh': 5.9038208287623135, 'sideways_atr_min_pct': 0.01888825320389352, 'sideways_atr_max_pct': 0.02470822205728388, 'sideways_tp_mult': 2.664791062213703, 'sideways_tsl_mult': 0.15170193504944707, 'sideways_time_stop': 268, 'sideways_use_sma': False, 'sideways_use_ema': False, 'sideways_use_atr': False, 'sideways_use_adx': True, 'sideways_use_spike': True, 'sideways_rsi_required': True}.
[I 2025-08-31 03:53:35,029] Trial 167 finished with values: [-1000000000.0, 1000000000.0] and parameters: {'p_sma': 22, 'p_std': 57, 'p_atr': 26, 'p_adx': 30, 'rsi_period': 48, 'ema1': 16, 'ema2': 18, 'slip_atr_k': 0.18062242164867529, 'slip_spread_k': 0.3357228870979227, 'spread_hl_frac': 0.02550122005585626, 'bb_std_mult': 2.146321847689834, 'rsi_os': 24, 'rsi_ob': 63, 'vol_spike': 0.0033643528578969077, 'adx_thresh': 28.639039741514623, 'atr_min_pct': 0.020458069692602224, 'atr_max_pct': 0.13861177085135912, 'tp_mult': 2.3983977047310963, 'tsl_mult': 0.6696142848090768, 'strategy': 'breakout', 'time_stop': 135, 'use_sma': False, 'use_atr': False, 'use_adx': False, 'use_ema': True, 'use_spike': False, 'rsi_required': False, 'edge_k': 1.8251947343161745, 'edge_cap': 0.9271314801852769, 'bull_strategy': 'breakout', 'bull_bb_std_mult': 0.9939189767769078, 'bull_rsi_os': 21, 'bull_rsi_ob': 79, 'bull_adx_thresh': 21.9291537496604, 'bull_atr_min_pct': 0.027072607598188206, 'bull_atr_max_pct': 0.12629556002755243, 'bull_tp_mult': 2.183490630847975, 'bull_tsl_mult': 0.9583719141681192, 'bull_time_stop': 167, 'bull_use_sma': False, 'bull_use_ema': False, 'bull_use_atr': True, 'bull_use_adx': True, 'bull_use_spike': True, 'bull_rsi_required': False, 'bear_strategy': 'mean_reversion', 'bear_bb_std_mult': 0.5507602782431757, 'bear_rsi_os': 24, 'bear_rsi_ob': 56, 'bear_adx_thresh': 22.916935948144623, 'bear_atr_min_pct': 0.009001084180451379, 'bear_atr_max_pct': 0.14094371595832514, 'bear_tp_mult': 2.6881708523409404, 'bear_tsl_mult': 0.2507832827356013, 'bear_time_stop': 207, 'bear_use_sma': True, 'bear_use_ema': True, 'bear_use_atr': True, 'bear_use_adx': False, 'bear_use_spike': True, 'bear_rsi_required': True, 'sideways_strategy': 'mean_reversion', 'sideways_bb_std_mult': 2.5056983914175115, 'sideways_rsi_os': 25, 'sideways_rsi_ob': 59, 'sideways_adx_thresh': 9.46306276215902, 'sideways_atr_min_pct': 0.019125582564822004, 'sideways_atr_max_pct': 0.024230090232647026, 'sideways_tp_mult': 2.57605955969758, 'sideways_tsl_mult': 0.14990591841941917, 'sideways_time_stop': 270, 'sideways_use_sma': False, 'sideways_use_ema': False, 'sideways_use_atr': False, 'sideways_use_adx': True, 'sideways_use_spike': True, 'sideways_rsi_required': True}.
[I 2025-08-31 03:53:35,103] Trial 168 finished with values: [-1000000000.0, 1000000000.0] and parameters: {'p_sma': 60, 'p_std': 45, 'p_atr': 26, 'p_adx': 27, 'rsi_period': 48, 'ema1': 16, 'ema2': 19, 'slip_atr_k': 0.17916133780043408, 'slip_spread_k': 0.34510846411265994, 'spread_hl_frac': 0.02742186895342115, 'bb_std_mult': 2.140246586810336, 'rsi_os': 23, 'rsi_ob': 64, 'vol_spike': 0.0013344691163155633, 'adx_thresh': 26.95719545500747, 'atr_min_pct': 0.020341912339711207, 'atr_max_pct': 0.13866515366122834, 'tp_mult': 2.396170763020842, 'tsl_mult': 0.6076484746554622, 'strategy': 'breakout', 'time_stop': 134, 'use_sma': False, 'use_atr': False, 'use_adx': False, 'use_ema': False, 'use_spike': True, 'rsi_required': False, 'edge_k': 1.7739680515321936, 'edge_cap': 0.9323115098237498, 'bull_strategy': 'breakout', 'bull_bb_std_mult': 0.9901497297343032, 'bull_rsi_os': 21, 'bull_rsi_ob': 73, 'bull_adx_thresh': 19.69189705324337, 'bull_atr_min_pct': 0.02722058554201664, 'bull_atr_max_pct': 0.1272325598552834, 'bull_tp_mult': 2.185500037397719, 'bull_tsl_mult': 0.9664983317336835, 'bull_time_stop': 170, 'bull_use_sma': False, 'bull_use_ema': False, 'bull_use_atr': True, 'bull_use_adx': True, 'bull_use_spike': False, 'bull_rsi_required': False, 'bear_strategy': 'mean_reversion', 'bear_bb_std_mult': 0.7765347114918124, 'bear_rsi_os': 17, 'bear_rsi_ob': 55, 'bear_adx_thresh': 22.86020993902887, 'bear_atr_min_pct': 0.008839882329137757, 'bear_atr_max_pct': 0.139033644240571, 'bear_tp_mult': 2.645841221733569, 'bear_tsl_mult': 0.38742701291290665, 'bear_time_stop': 195, 'bear_use_sma': True, 'bear_use_ema': True, 'bear_use_atr': True, 'bear_use_adx': False, 'bear_use_spike': True, 'bear_rsi_required': True, 'sideways_strategy': 'mean_reversion', 'sideways_bb_std_mult': 2.3760476881846206, 'sideways_rsi_os': 25, 'sideways_rsi_ob': 59, 'sideways_adx_thresh': 5.51855775610867, 'sideways_atr_min_pct': 0.018603257526551294, 'sideways_atr_max_pct': 0.023783328588643203, 'sideways_tp_mult': 2.5988175473242854, 'sideways_tsl_mult': 0.10152988153765088, 'sideways_time_stop': 271, 'sideways_use_sma': False, 'sideways_use_ema': False, 'sideways_use_atr': False, 'sideways_use_adx': True, 'sideways_use_spike': True, 'sideways_rsi_required': True}.
[I 2025-08-31 03:53:35,188] Trial 165 finished with values: [-1000000000.0, 1000000000.0] and parameters: {'p_sma': 22, 'p_std': 45, 'p_atr': 24, 'p_adx': 27, 'rsi_period': 35, 'ema1': 16, 'ema2': 19, 'slip_atr_k': 0.18713598721914057, 'slip_spread_k': 0.03713365932066193, 'spread_hl_frac': 0.024421612271164378, 'bb_std_mult': 0.6393248296368075, 'rsi_os': 37, 'rsi_ob': 63, 'vol_spike': 0.033397225281703184, 'adx_thresh': 25.783294182505653, 'atr_min_pct': 0.023950437967626404, 'atr_max_pct': 0.1491122210896304, 'tp_mult': 1.431295254089869, 'tsl_mult': 0.3382991421633216, 'strategy': 'breakout', 'time_stop': 112, 'use_sma': False, 'use_atr': False, 'use_adx': False, 'use_ema': True, 'use_spike': False, 'rsi_required': False, 'edge_k': 1.793298619957198, 'edge_cap': 0.812532867769141, 'bull_strategy': 'mean_reversion', 'bull_bb_std_mult': 1.0007172388043557, 'bull_rsi_os': 18, 'bull_rsi_ob': 87, 'bull_adx_thresh': 23.087875869211096, 'bull_atr_min_pct': 0.0004979679597032347, 'bull_atr_max_pct': 0.12606982116238433, 'bull_tp_mult': 2.162820263266893, 'bull_tsl_mult': 0.5189755276802732, 'bull_time_stop': 172, 'bull_use_sma': False, 'bull_use_ema': False, 'bull_use_atr': True, 'bull_use_adx': True, 'bull_use_spike': True, 'bull_rsi_required': False, 'bear_strategy': 'mean_reversion', 'bear_bb_std_mult': 3.3057671321025968, 'bear_rsi_os': 32, 'bear_rsi_ob': 87, 'bear_adx_thresh': 20.980866759484584, 'bear_atr_min_pct': 0.01460674085215446, 'bear_atr_max_pct': 0.1281147045450531, 'bear_tp_mult': 2.460854812385159, 'bear_tsl_mult': 0.9911231713321786, 'bear_time_stop': 188, 'bear_use_sma': True, 'bear_use_ema': True, 'bear_use_atr': True, 'bear_use_adx': False, 'bear_use_spike': True, 'bear_rsi_required': True, 'sideways_strategy': 'mean_reversion', 'sideways_bb_std_mult': 1.602715616684574, 'sideways_rsi_os': 47, 'sideways_rsi_ob': 82, 'sideways_adx_thresh': 24.54466084659807, 'sideways_atr_min_pct': 0.012878293053156246, 'sideways_atr_max_pct': 0.025218604146173853, 'sideways_tp_mult': 2.6496410868347877, 'sideways_tsl_mult': 0.2428603669395442, 'sideways_time_stop': 285, 'sideways_use_sma': True, 'sideways_use_ema': False, 'sideways_use_atr': False, 'sideways_use_adx': True, 'sideways_use_spike': True, 'sideways_rsi_required': True}.
[I 2025-08-31 03:54:04,055] Trial 170 finished with values: [-1000000000.0, 1000000000.0] and parameters: {'p_sma': 10, 'p_std': 43, 'p_atr': 25, 'p_adx': 12, 'rsi_period': 52, 'ema1': 9, 'ema2': 14, 'slip_atr_k': 0.06844892265168989, 'slip_spread_k': 0.2792608448701087, 'spread_hl_frac': 0.02445983787877447, 'bb_std_mult': 1.4275246881362558, 'rsi_os': 18, 'rsi_ob': 65, 'vol_spike': 0.0004973459840600173, 'adx_thresh': 26.995857461333273, 'atr_min_pct': 0.019555360157557714, 'atr_max_pct': 0.14210151911449645, 'tp_mult': 2.475173828435274, 'tsl_mult': 0.7173692376848634, 'strategy': 'breakout', 'time_stop': 147, 'use_sma': False, 'use_atr': True, 'use_adx': False, 'use_ema': False, 'use_spike': True, 'rsi_required': False, 'edge_k': 1.9069702761349496, 'edge_cap': 0.9488378543738866, 'bull_strategy': 'mean_reversion', 'bull_bb_std_mult': 0.8023863409148877, 'bull_rsi_os': 18, 'bull_rsi_ob': 73, 'bull_adx_thresh': 19.729938032080906, 'bull_atr_min_pct': 0.0024708766307083643, 'bull_atr_max_pct': 0.07379233436434404, 'bull_tp_mult': 2.4014138091110806, 'bull_tsl_mult': 0.9730852207961932, 'bull_time_stop': 151, 'bull_use_sma': False, 'bull_use_ema': False, 'bull_use_atr': True, 'bull_use_adx': True, 'bull_use_spike': False, 'bull_rsi_required': True, 'bear_strategy': 'mean_reversion', 'bear_bb_std_mult': 0.777014432107281, 'bear_rsi_os': 23, 'bear_rsi_ob': 59, 'bear_adx_thresh': 24.192063079858265, 'bear_atr_min_pct': 0.008250634507555725, 'bear_atr_max_pct': 0.14557406188784242, 'bear_tp_mult': 2.512668470455597, 'bear_tsl_mult': 0.41414517480800506, 'bear_time_stop': 134, 'bear_use_sma': True, 'bear_use_ema': True, 'bear_use_atr': True, 'bear_use_adx': False, 'bear_use_spike': True, 'bear_rsi_required': True, 'sideways_strategy': 'mean_reversion', 'sideways_bb_std_mult': 2.3903913690291665, 'sideways_rsi_os': 21, 'sideways_rsi_ob': 62, 'sideways_adx_thresh': 8.236431203332467, 'sideways_atr_min_pct': 0.017998764631343367, 'sideways_atr_max_pct': 0.01987244241458077, 'sideways_tp_mult': 1.433421001554358, 'sideways_tsl_mult': 0.12711757673571367, 'sideways_time_stop': 252, 'sideways_use_sma': False, 'sideways_use_ema': False, 'sideways_use_atr': False, 'sideways_use_adx': True, 'sideways_use_spike': True, 'sideways_rsi_required': True}.
[I 2025-08-31 03:54:04,238] Trial 171 finished with values: [-1000000000.0, 1000000000.0] and parameters: {'p_sma': 47, 'p_std': 42, 'p_atr': 25, 'p_adx': 12, 'rsi_period': 53, 'ema1': 9, 'ema2': 14, 'slip_atr_k': 0.17564186793300496, 'slip_spread_k': 0.25374951136756707, 'spread_hl_frac': 0.025384042854576867, 'bb_std_mult': 1.4134251735470915, 'rsi_os': 18, 'rsi_ob': 68, 'vol_spike': 0.010004673110260806, 'adx_thresh': 6.691597086472868, 'atr_min_pct': 0.021033533532367234, 'atr_max_pct': 0.12796211293599458, 'tp_mult': 2.4577007806085485, 'tsl_mult': 0.9137430342578527, 'strategy': 'breakout', 'time_stop': 149, 'use_sma': False, 'use_atr': True, 'use_adx': False, 'use_ema': True, 'use_spike': False, 'rsi_required': False, 'edge_k': 1.8913839836474078, 'edge_cap': 0.9624310123765759, 'bull_strategy': 'mean_reversion', 'bull_bb_std_mult': 1.2159869434310013, 'bull_rsi_os': 18, 'bull_rsi_ob': 73, 'bull_adx_thresh': 22.96791863904733, 'bull_atr_min_pct': 0.002751816522461161, 'bull_atr_max_pct': 0.08214102117154182, 'bull_tp_mult': 1.4594263954802802, 'bull_tsl_mult': 0.9209294215330986, 'bull_time_stop': 151, 'bull_use_sma': False, 'bull_use_ema': False, 'bull_use_atr': True, 'bull_use_adx': True, 'bull_use_spike': True, 'bull_rsi_required': True, 'bear_strategy': 'mean_reversion', 'bear_bb_std_mult': 1.2271432476736952, 'bear_rsi_os': 23, 'bear_rsi_ob': 59, 'bear_adx_thresh': 26.71506598341635, 'bear_atr_min_pct': 0.009940499747116764, 'bear_atr_max_pct': 0.14474115914163282, 'bear_tp_mult': 2.460718578125374, 'bear_tsl_mult': 0.2895999302976338, 'bear_time_stop': 188, 'bear_use_sma': True, 'bear_use_ema': True, 'bear_use_atr': True, 'bear_use_adx': True, 'bear_use_spike': True, 'bear_rsi_required': True, 'sideways_strategy': 'mean_reversion', 'sideways_bb_std_mult': 1.580371009280399, 'sideways_rsi_os': 20, 'sideways_rsi_ob': 65, 'sideways_adx_thresh': 7.95123868533771, 'sideways_atr_min_pct': 0.01715592660946121, 'sideways_atr_max_pct': 0.1353188771998568, 'sideways_tp_mult': 2.6423112903370822, 'sideways_tsl_mult': 0.04817603838758994, 'sideways_time_stop': 258, 'sideways_use_sma': False, 'sideways_use_ema': False, 'sideways_use_atr': False, 'sideways_use_adx': True, 'sideways_use_spike': True, 'sideways_rsi_required': True}.
