[I 2025-08-31 05:41:24,886] Trial 765 finished with values: [-0.010672081430085911, 0.010608500185672413] and parameters: {'p_sma': 29, 'p_std': 40, 'p_atr': 11, 'p_adx': 25, 'rsi_period': 12, 'ema1': 19, 'ema2': 21, 'slip_atr_k': 0.0006084140630014953, 'slip_spread_k': 0.7378318397158441, 'spread_hl_frac': 0.00506365733246871, 'bb_std_mult': 3.1410352828611035, 'rsi_os': 37, 'rsi_ob': 66, 'vol_spike': 0.10003442933016216, 'adx_thresh': 31.390119182506773, 'atr_min_pct': 0.013001312078922663, 'atr_max_pct': 0.08985878519638071, 'tp_mult': 2.5876062376049824, 'tsl_mult': 0.7566059712113029, 'strategy': 'mean_reversion', 'time_stop': 5, 'use_sma': True, 'use_atr': True, 'use_adx': True, 'use_ema': True, 'use_spike': False, 'rsi_required': True, 'edge_k': 0.9067382393390832, 'edge_cap': 0.4001794326531489, 'bull_strategy': 'breakout', 'bull_bb_std_mult': 1.3910872586880585, 'bull_rsi_os': 35, 'bull_rsi_ob': 84, 'bull_adx_thresh': 7.544205094294978, 'bull_atr_min_pct': 0.027175588938925594, 'bull_atr_max_pct': 0.07960914974446298, 'bull_tp_mult': 1.0478206394433216, 'bull_tsl_mult': 0.8066904800974801, 'bull_time_stop': 211, 'bull_use_sma': True, 'bull_use_ema': True, 'bull_use_atr': False, 'bull_use_adx': False, 'bull_use_spike': True, 'bull_rsi_required': False, 'bear_strategy': 'breakout', 'bear_bb_std_mult': 2.0584623015954766, 'bear_rsi_os': 6, 'bear_rsi_ob': 66, 'bear_adx_thresh': 14.452736471537412, 'bear_atr_min_pct': 0.005854431126771985, 'bear_atr_max_pct': 0.1335146542178245, 'bear_tp_mult': 1.0245369845906107, 'bear_tsl_mult': 0.14079866509093197, 'bear_time_stop': 218, 'bear_use_sma': False, 'bear_use_ema': False, 'bear_use_atr': False, 'bear_use_adx': False, 'bear_use_spike': False, 'bear_rsi_required': False, 'sideways_strategy': 'breakout', 'sideways_bb_std_mult': 1.339406861873033, 'sideways_rsi_os': 39, 'sideways_rsi_ob': 45, 'sideways_adx_thresh': 25.261443750386647, 'sideways_atr_min_pct': 0.0021371086608374173, 'sideways_atr_max_pct': 0.0668507960302101, 'sideways_tp_mult': 2.606962536010878, 'sideways_tsl_mult': 0.3966172224138996, 'sideways_time_stop': 192, 'sideways_use_sma': True, 'sideways_use_ema': True, 'sideways_use_atr': True, 'sideways_use_adx': False, 'sideways_use_spike': False, 'sideways_rsi_required': False}.
[I 2025-08-31 05:41:24,891] Trial 766 finished with values: [-0.03115802621442254, 0.031110086405772532] and parameters: {'p_sma': 29, 'p_std': 40, 'p_atr': 12, 'p_adx': 25, 'rsi_period': 12, 'ema1': 18, 'ema2': 21, 'slip_atr_k': 9.035503829226809e-05, 'slip_spread_k': 0.7456229638418699, 'spread_hl_frac': 0.005000441304052316, 'bb_std_mult': 3.145139868632605, 'rsi_os': 39, 'rsi_ob': 66, 'vol_spike': 0.12023008741915664, 'adx_thresh': 32.12658468901327, 'atr_min_pct': 0.010978750258731153, 'atr_max_pct': 0.09070656256659043, 'tp_mult': 2.625179626783365, 'tsl_mult': 0.7600871900964858, 'strategy': 'mean_reversion', 'time_stop': 6, 'use_sma': True, 'use_atr': True, 'use_adx': True, 'use_ema': True, 'use_spike': False, 'rsi_required': True, 'edge_k': 0.9538106181309829, 'edge_cap': 0.39290188013813965, 'bull_strategy': 'breakout', 'bull_bb_std_mult': 1.4234588787038203, 'bull_rsi_os': 30, 'bull_rsi_ob': 85, 'bull_adx_thresh': 7.457160481204921, 'bull_atr_min_pct': 0.02031085020189968, 'bull_atr_max_pct': 0.0818629662785403, 'bull_tp_mult': 1.4974125826831592, 'bull_tsl_mult': 0.8092287764197797, 'bull_time_stop': 211, 'bull_use_sma': True, 'bull_use_ema': True, 'bull_use_atr': False, 'bull_use_adx': False, 'bull_use_spike': True, 'bull_rsi_required': False, 'bear_strategy': 'breakout', 'bear_bb_std_mult': 2.1070625077031377, 'bear_rsi_os': 7, 'bear_rsi_ob': 66, 'bear_adx_thresh': 16.174633253770345, 'bear_atr_min_pct': 0.005472282072621305, 'bear_atr_max_pct': 0.07006516655757673, 'bear_tp_mult': 1.0166198893144447, 'bear_tsl_mult': 0.15458872399391374, 'bear_time_stop': 223, 'bear_use_sma': False, 'bear_use_ema': False, 'bear_use_atr': False, 'bear_use_adx': False, 'bear_use_spike': False, 'bear_rsi_required': False, 'sideways_strategy': 'breakout', 'sideways_bb_std_mult': 1.2716570261618156, 'sideways_rsi_os': 39, 'sideways_rsi_ob': 45, 'sideways_adx_thresh': 25.35817080242225, 'sideways_atr_min_pct': 0.0009479520999852217, 'sideways_atr_max_pct': 0.06679883608324581, 'sideways_tp_mult': 2.5917169031870166, 'sideways_tsl_mult': 0.42578203566935235, 'sideways_time_stop': 190, 'sideways_use_sma': True, 'sideways_use_ema': True, 'sideways_use_atr': True, 'sideways_use_adx': False, 'sideways_use_spike': False, 'sideways_rsi_required': False}.
[I 2025-08-31 05:42:08,614] Trial 768 finished with values: [-0.00971890597380809, 0.00968768358409914] and parameters: {'p_sma': 36, 'p_std': 40, 'p_atr': 12, 'p_adx': 25, 'rsi_period': 13, 'ema1': 19, 'ema2': 21, 'slip_atr_k': 0.00396229595382157, 'slip_spread_k': 0.7327631933531852, 'spread_hl_frac': 0.005534398930236256, 'bb_std_mult': 3.1109060769367116, 'rsi_os': 38, 'rsi_ob': 66, 'vol_spike': 0.09527345307861841, 'adx_thresh': 15.13692039891039, 'atr_min_pct': 0.011059867375960732, 'atr_max_pct': 0.10059856700680847, 'tp_mult': 2.647042235431395, 'tsl_mult': 0.7444611553511741, 'strategy': 'mean_reversion', 'time_stop': 11, 'use_sma': True, 'use_atr': True, 'use_adx': True, 'use_ema': True, 'use_spike': False, 'rsi_required': True, 'edge_k': 0.9371968099186773, 'edge_cap': 0.3893641549554985, 'bull_strategy': 'breakout', 'bull_bb_std_mult': 1.350711753919214, 'bull_rsi_os': 35, 'bull_rsi_ob': 83, 'bull_adx_thresh': 7.748813124900936, 'bull_atr_min_pct': 0.02029893786910978, 'bull_atr_max_pct': 0.08091094244769322, 'bull_tp_mult': 1.492394538553106, 'bull_tsl_mult': 0.7889755598113359, 'bull_time_stop': 208, 'bull_use_sma': True, 'bull_use_ema': True, 'bull_use_atr': False, 'bull_use_adx': False, 'bull_use_spike': True, 'bull_rsi_required': False, 'bear_strategy': 'breakout', 'bear_bb_std_mult': 2.125582716367655, 'bear_rsi_os': 5, 'bear_rsi_ob': 66, 'bear_adx_thresh': 16.144168051694546, 'bear_atr_min_pct': 0.005744232834020573, 'bear_atr_max_pct': 0.08310750276308977, 'bear_tp_mult': 1.0328898623717622, 'bear_tsl_mult': 0.1601149309987597, 'bear_time_stop': 225, 'bear_use_sma': False, 'bear_use_ema': False, 'bear_use_atr': False, 'bear_use_adx': False, 'bear_use_spike': False, 'bear_rsi_required': False, 'sideways_strategy': 'breakout', 'sideways_bb_std_mult': 1.4089136102024296, 'sideways_rsi_os': 39, 'sideways_rsi_ob': 46, 'sideways_adx_thresh': 24.917433844993173, 'sideways_atr_min_pct': 0.002267096071148016, 'sideways_atr_max_pct': 0.0717942599135789, 'sideways_tp_mult': 2.597571081050351, 'sideways_tsl_mult': 0.40039641084910116, 'sideways_time_stop': 193, 'sideways_use_sma': True, 'sideways_use_ema': True, 'sideways_use_atr': True, 'sideways_use_adx': False, 'sideways_use_spike': False, 'sideways_rsi_required': False}.
[I 2025-08-31 05:42:09,189] Trial 767 finished with values: [-1000000000.0, 1000000000.0] and parameters: {'p_sma': 14, 'p_std': 41, 'p_atr': 11, 'p_adx': 25, 'rsi_period': 12, 'ema1': 19, 'ema2': 23, 'slip_atr_k': 0.0037349031651523947, 'slip_spread_k': 0.740891707656737, 'spread_hl_frac': 0.006347596801104617, 'bb_std_mult': 3.1369651428692147, 'rsi_os': 37, 'rsi_ob': 66, 'vol_spike': 0.09727983596266757, 'adx_thresh': 17.294802800075967, 'atr_min_pct': 0.013192746625203377, 'atr_max_pct': 0.0908687426953731, 'tp_mult': 2.5970866954991547, 'tsl_mult': 0.7552723025464092, 'strategy': 'mean_reversion', 'time_stop': 7, 'use_sma': True, 'use_atr': True, 'use_adx': True, 'use_ema': True, 'use_spike': False, 'rsi_required': True, 'edge_k': 0.9189615959989658, 'edge_cap': 0.39832988733566715, 'bull_strategy': 'breakout', 'bull_bb_std_mult': 1.4561656710623496, 'bull_rsi_os': 34, 'bull_rsi_ob': 82, 'bull_adx_thresh': 7.4665435643781635, 'bull_atr_min_pct': 0.02162258142047401, 'bull_atr_max_pct': 0.08058760075351261, 'bull_tp_mult': 2.4561079658965586, 'bull_tsl_mult': 0.8043980510797586, 'bull_time_stop': 211, 'bull_use_sma': True, 'bull_use_ema': True, 'bull_use_atr': False, 'bull_use_adx': False, 'bull_use_spike': True, 'bull_rsi_required': False, 'bear_strategy': 'breakout', 'bear_bb_std_mult': 2.0975182151834364, 'bear_rsi_os': 6, 'bear_rsi_ob': 67, 'bear_adx_thresh': 31.7703466601913, 'bear_atr_min_pct': 0.005867133345379749, 'bear_atr_max_pct': 0.08022332883506164, 'bear_tp_mult': 1.0139592425566473, 'bear_tsl_mult': 0.13819526786795616, 'bear_time_stop': 225, 'bear_use_sma': False, 'bear_use_ema': False, 'bear_use_atr': False, 'bear_use_adx': False, 'bear_use_spike': False, 'bear_rsi_required': False, 'sideways_strategy': 'breakout', 'sideways_bb_std_mult': 1.2944046927707096, 'sideways_rsi_os': 39, 'sideways_rsi_ob': 45, 'sideways_adx_thresh': 25.268738164138625, 'sideways_atr_min_pct': 0.00239202977670173, 'sideways_atr_max_pct': 0.06690219915493881, 'sideways_tp_mult': 2.604612428948797, 'sideways_tsl_mult': 0.41976290922242043, 'sideways_time_stop': 190, 'sideways_use_sma': True, 'sideways_use_ema': True, 'sideways_use_atr': True, 'sideways_use_adx': False, 'sideways_use_spike': False, 'sideways_rsi_required': False}.
[I 2025-08-31 05:42:10,487] Trial 770 finished with values: [-0.014896240343893807, 0.014832727904657296] and parameters: {'p_sma': 43, 'p_std': 40, 'p_atr': 11, 'p_adx': 25, 'rsi_period': 13, 'ema1': 19, 'ema2': 22, 'slip_atr_k': 0.003967843259234093, 'slip_spread_k': 0.7315859830278135, 'spread_hl_frac': 0.004604278113971034, 'bb_std_mult': 3.086619214916815, 'rsi_os': 40, 'rsi_ob': 65, 'vol_spike': 0.10108436559654362, 'adx_thresh': 15.335825275382138, 'atr_min_pct': 0.012991048542957363, 'atr_max_pct': 0.0998942505939963, 'tp_mult': 2.590050124203665, 'tsl_mult': 0.7306477278835166, 'strategy': 'mean_reversion', 'time_stop': 11, 'use_sma': True, 'use_atr': True, 'use_adx': True, 'use_ema': True, 'use_spike': False, 'rsi_required': True, 'edge_k': 0.871534815764963, 'edge_cap': 0.35879623777985625, 'bull_strategy': 'breakout', 'bull_bb_std_mult': 1.2939852158920213, 'bull_rsi_os': 39, 'bull_rsi_ob': 81, 'bull_adx_thresh': 7.3539689320193995, 'bull_atr_min_pct': 0.02691689081713273, 'bull_atr_max_pct': 0.07982772915410756, 'bull_tp_mult': 1.4453996566999534, 'bull_tsl_mult': 0.8095047648339114, 'bull_time_stop': 208, 'bull_use_sma': True, 'bull_use_ema': True, 'bull_use_atr': False, 'bull_use_adx': False, 'bull_use_spike': True, 'bull_rsi_required': False, 'bear_strategy': 'breakout', 'bear_bb_std_mult': 2.147348805811364, 'bear_rsi_os': 6, 'bear_rsi_ob': 67, 'bear_adx_thresh': 17.957247218329268, 'bear_atr_min_pct': 0.006028974220555518, 'bear_atr_max_pct': 0.08249660131002234, 'bear_tp_mult': 1.0421925824426155, 'bear_tsl_mult': 0.1308006305023725, 'bear_time_stop': 216, 'bear_use_sma': False, 'bear_use_ema': False, 'bear_use_atr': False, 'bear_use_adx': False, 'bear_use_spike': False, 'bear_rsi_required': False, 'sideways_strategy': 'breakout', 'sideways_bb_std_mult': 1.4176241387616209, 'sideways_rsi_os': 40, 'sideways_rsi_ob': 47, 'sideways_adx_thresh': 25.417148936674046, 'sideways_atr_min_pct': 0.0019763946479332303, 'sideways_atr_max_pct': 0.07724609351298065, 'sideways_tp_mult': 2.616592843463881, 'sideways_tsl_mult': 0.436065315366596, 'sideways_time_stop': 194, 'sideways_use_sma': True, 'sideways_use_ema': True, 'sideways_use_atr': True, 'sideways_use_adx': False, 'sideways_use_spike': False, 'sideways_rsi_required': False}.
[I 2025-08-31 05:42:10,501] Trial 769 finished with values: [-0.015087273633767273, 0.015023870677762034] and parameters: {'p_sma': 42, 'p_std': 40, 'p_atr': 11, 'p_adx': 25, 'rsi_period': 13, 'ema1': 19, 'ema2': 22, 'slip_atr_k': 0.0026117277217791875, 'slip_spread_k': 0.7226552699568953, 'spread_hl_frac': 0.004515568166858039, 'bb_std_mult': 3.069932511743789, 'rsi_os': 40, 'rsi_ob': 65, 'vol_spike': 0.09895059927200456, 'adx_thresh': 29.82226822551408, 'atr_min_pct': 0.013138286874705907, 'atr_max_pct': 0.09853324267270681, 'tp_mult': 2.578554239879818, 'tsl_mult': 0.7596593979230442, 'strategy': 'mean_reversion', 'time_stop': 11, 'use_sma': True, 'use_atr': True, 'use_adx': True, 'use_ema': True, 'use_spike': False, 'rsi_required': True, 'edge_k': 0.9978367649273687, 'edge_cap': 0.35439056052920326, 'bull_strategy': 'breakout', 'bull_bb_std_mult': 1.282432767031099, 'bull_rsi_os': 33, 'bull_rsi_ob': 83, 'bull_adx_thresh': 8.091649199399086, 'bull_atr_min_pct': 0.021205329242525602, 'bull_atr_max_pct': 0.0799081395718382, 'bull_tp_mult': 2.4404277882659726, 'bull_tsl_mult': 0.8089117260203338, 'bull_time_stop': 211, 'bull_use_sma': True, 'bull_use_ema': True, 'bull_use_atr': False, 'bull_use_adx': False, 'bull_use_spike': True, 'bull_rsi_required': False, 'bear_strategy': 'breakout', 'bear_bb_std_mult': 2.0103612497763175, 'bear_rsi_os': 6, 'bear_rsi_ob': 66, 'bear_adx_thresh': 16.78805600402327, 'bear_atr_min_pct': 0.005658569295400586, 'bear_atr_max_pct': 0.13216517670138822, 'bear_tp_mult': 1.0134644706650793, 'bear_tsl_mult': 0.14464809955471314, 'bear_time_stop': 215, 'bear_use_sma': False, 'bear_use_ema': False, 'bear_use_atr': False, 'bear_use_adx': False, 'bear_use_spike': False, 'bear_rsi_required': False, 'sideways_strategy': 'breakout', 'sideways_bb_std_mult': 1.3779268946813494, 'sideways_rsi_os': 40, 'sideways_rsi_ob': 47, 'sideways_adx_thresh': 25.513229902400496, 'sideways_atr_min_pct': 0.0019318139579164104, 'sideways_atr_max_pct': 0.07082750783417945, 'sideways_tp_mult': 2.61195410014047, 'sideways_tsl_mult': 0.40575561263147586, 'sideways_time_stop': 191, 'sideways_use_sma': True, 'sideways_use_ema': True, 'sideways_use_atr': True, 'sideways_use_adx': False, 'sideways_use_spike': False, 'sideways_rsi_required': False}.
[I 2025-08-31 05:43:00,567] Trial 774 finished with values: [-0.02513613711423679, 0.025076078484384878] and parameters: {'p_sma': 54, 'p_std': 38, 'p_atr': 13, 'p_adx': 26, 'rsi_period': 14, 'ema1': 20, 'ema2': 22, 'slip_atr_k': 0.0014781607090224112, 'slip_spread_k': 0.7292320247986099, 'spread_hl_frac': 0.006420387692213824, 'bb_std_mult': 3.223540740879052, 'rsi_os': 35, 'rsi_ob': 67, 'vol_spike': 0.0926154693271227, 'adx_thresh': 34.56562907965903, 'atr_min_pct': 0.014150584249590592, 'atr_max_pct': 0.10426039615151796, 'tp_mult': 2.6584945209845214, 'tsl_mult': 0.7720404451290921, 'strategy': 'mean_reversion', 'time_stop': 11, 'use_sma': True, 'use_atr': True, 'use_adx': True, 'use_ema': True, 'use_spike': False, 'rsi_required': True, 'edge_k': 1.0711858252312472, 'edge_cap': 0.3820014423122232, 'bull_strategy': 'breakout', 'bull_bb_std_mult': 1.3480960560954218, 'bull_rsi_os': 31, 'bull_rsi_ob': 85, 'bull_adx_thresh': 7.870721946434905, 'bull_atr_min_pct': 0.015403317763646696, 'bull_atr_max_pct': 0.07723570990799053, 'bull_tp_mult': 2.3028842871867905, 'bull_tsl_mult': 0.7878304373882545, 'bull_time_stop': 199, 'bull_use_sma': True, 'bull_use_ema': True, 'bull_use_atr': False, 'bull_use_adx': False, 'bull_use_spike': True, 'bull_rsi_required': False, 'bear_strategy': 'breakout', 'bear_bb_std_mult': 2.158552694286291, 'bear_rsi_os': 5, 'bear_rsi_ob': 66, 'bear_adx_thresh': 17.465906937150503, 'bear_atr_min_pct': 0.006199752486517882, 'bear_atr_max_pct': 0.031064176890339357, 'bear_tp_mult': 1.059444366696284, 'bear_tsl_mult': 0.15650757921205705, 'bear_time_stop': 227, 'bear_use_sma': False, 'bear_use_ema': False, 'bear_use_atr': False, 'bear_use_adx': False, 'bear_use_spike': False, 'bear_rsi_required': False, 'sideways_strategy': 'breakout', 'sideways_bb_std_mult': 1.3577111523402468, 'sideways_rsi_os': 38, 'sideways_rsi_ob': 46, 'sideways_adx_thresh': 24.802015174910593, 'sideways_atr_min_pct': 0.0012611933245610983, 'sideways_atr_max_pct': 0.07413266320083667, 'sideways_tp_mult': 2.5611219850320124, 'sideways_tsl_mult': 0.4364518157784974, 'sideways_time_stop': 185, 'sideways_use_sma': True, 'sideways_use_ema': True, 'sideways_use_atr': True, 'sideways_use_adx': False, 'sideways_use_spike': False, 'sideways_rsi_required': False}.
[I 2025-08-31 05:43:01,143] Trial 773 finished with values: [-1000000000.0, 1000000000.0] and parameters: {'p_sma': 54, 'p_std': 42, 'p_atr': 13, 'p_adx': 26, 'rsi_period': 10, 'ema1': 20, 'ema2': 20, 'slip_atr_k': 0.0007944889327508387, 'slip_spread_k': 0.7253125804900299, 'spread_hl_frac': 0.005714388411074171, 'bb_std_mult': 3.200106825209389, 'rsi_os': 39, 'rsi_ob': 67, 'vol_spike': 0.09277620141462134, 'adx_thresh': 31.38519576223419, 'atr_min_pct': 0.014465566895637034, 'atr_max_pct': 0.1029465797515591, 'tp_mult': 2.5705862207080967, 'tsl_mult': 0.7865147476126682, 'strategy': 'mean_reversion', 'time_stop': 11, 'use_sma': True, 'use_atr': True, 'use_adx': True, 'use_ema': True, 'use_spike': False, 'rsi_required': True, 'edge_k': 0.8783444084450773, 'edge_cap': 0.3808575610318974, 'bull_strategy': 'breakout', 'bull_bb_std_mult': 1.356001713707898, 'bull_rsi_os': 36, 'bull_rsi_ob': 85, 'bull_adx_thresh': 8.143460312374149, 'bull_atr_min_pct': 0.019071708765832845, 'bull_atr_max_pct': 0.07742592231892163, 'bull_tp_mult': 1.5576406531734048, 'bull_tsl_mult': 0.7788173692924705, 'bull_time_stop': 193, 'bull_use_sma': True, 'bull_use_ema': True, 'bull_use_atr': False, 'bull_use_adx': False, 'bull_use_spike': True, 'bull_rsi_required': False, 'bear_strategy': 'breakout', 'bear_bb_std_mult': 2.1745680651202637, 'bear_rsi_os': 5, 'bear_rsi_ob': 68, 'bear_adx_thresh': 17.864174378671418, 'bear_atr_min_pct': 0.004392116176011146, 'bear_atr_max_pct': 0.032690738669492424, 'bear_tp_mult': 1.056899168585899, 'bear_tsl_mult': 0.1593027405638199, 'bear_time_stop': 227, 'bear_use_sma': False, 'bear_use_ema': False, 'bear_use_atr': False, 'bear_use_adx': False, 'bear_use_spike': False, 'bear_rsi_required': False, 'sideways_strategy': 'breakout', 'sideways_bb_std_mult': 1.37307375370528, 'sideways_rsi_os': 38, 'sideways_rsi_ob': 46, 'sideways_adx_thresh': 24.861991628785056, 'sideways_atr_min_pct': 0.0037197372618610856, 'sideways_atr_max_pct': 0.06298453326376749, 'sideways_tp_mult': 2.552224150186748, 'sideways_tsl_mult': 0.4338547711744678, 'sideways_time_stop': 185, 'sideways_use_sma': True, 'sideways_use_ema': True, 'sideways_use_atr': True, 'sideways_use_adx': False, 'sideways_use_spike': False, 'sideways_rsi_required': False}.
[I 2025-08-31 05:43:01,157] Trial 771 finished with values: [-1000000000.0, 1000000000.0] and parameters: {'p_sma': 54, 'p_std': 41, 'p_atr': 13, 'p_adx': 25, 'rsi_period': 10, 'ema1': 19, 'ema2': 20, 'slip_atr_k': 0.0011101517210806433, 'slip_spread_k': 0.7312737921529752, 'spread_hl_frac': 0.006001065961581992, 'bb_std_mult': 3.087783859289554, 'rsi_os': 40, 'rsi_ob': 65, 'vol_spike': 0.09459840119518208, 'adx_thresh': 33.72085705780482, 'atr_min_pct': 0.012687396376014437, 'atr_max_pct': 0.10141798942013117, 'tp_mult': 2.6497826331114083, 'tsl_mult': 0.7323862885962625, 'strategy': 'mean_reversion', 'time_stop': 11, 'use_sma': True, 'use_atr': True, 'use_adx': True, 'use_ema': True, 'use_spike': False, 'rsi_required': True, 'edge_k': 0.8824676238479391, 'edge_cap': 0.3879840237520218, 'bull_strategy': 'breakout', 'bull_bb_std_mult': 1.3059315369391893, 'bull_rsi_os': 33, 'bull_rsi_ob': 84, 'bull_adx_thresh': 7.825150010017783, 'bull_atr_min_pct': 0.015913968943057164, 'bull_atr_max_pct': 0.07802663228984501, 'bull_tp_mult': 2.308319901025161, 'bull_tsl_mult': 0.7787661756793677, 'bull_time_stop': 193, 'bull_use_sma': True, 'bull_use_ema': True, 'bull_use_atr': False, 'bull_use_adx': False, 'bull_use_spike': True, 'bull_rsi_required': False, 'bear_strategy': 'breakout', 'bear_bb_std_mult': 2.1594410820932093, 'bear_rsi_os': 6, 'bear_rsi_ob': 67, 'bear_adx_thresh': 17.801549014111124, 'bear_atr_min_pct': 0.004767235465490124, 'bear_atr_max_pct': 0.03392821970085903, 'bear_tp_mult': 1.0447152385243887, 'bear_tsl_mult': 0.16066059806406396, 'bear_time_stop': 215, 'bear_use_sma': False, 'bear_use_ema': False, 'bear_use_atr': False, 'bear_use_adx': False, 'bear_use_spike': False, 'bear_rsi_required': False, 'sideways_strategy': 'breakout', 'sideways_bb_std_mult': 1.396852857224503, 'sideways_rsi_os': 40, 'sideways_rsi_ob': 47, 'sideways_adx_thresh': 25.015845747854613, 'sideways_atr_min_pct': 0.00335438820549002, 'sideways_atr_max_pct': 0.07082002199283224, 'sideways_tp_mult': 2.618832191118899, 'sideways_tsl_mult': 0.4387246918631443, 'sideways_time_stop': 194, 'sideways_use_sma': True, 'sideways_use_ema': True, 'sideways_use_atr': True, 'sideways_use_adx': False, 'sideways_use_spike': False, 'sideways_rsi_required': False}.
