[I 2025-08-31 04:50:48,304] Trial 478 finished with values: [-1000000000.0, 1000000000.0] and parameters: {'p_sma': 56, 'p_std': 53, 'p_atr': 25, 'p_adx': 10, 'rsi_period': 10, 'ema1': 15, 'ema2': 27, 'slip_atr_k': 0.029966382453145507, 'slip_spread_k': 0.3919939085703862, 'spread_hl_frac': 0.011574337183014326, 'bb_std_mult': 2.757408105784779, 'rsi_os': 29, 'rsi_ob': 59, 'vol_spike': 0.02413013902455463, 'adx_thresh': 27.24656922906716, 'atr_min_pct': 0.02210054413004773, 'atr_max_pct': 0.11730474223044801, 'tp_mult': 2.5219182219480687, 'tsl_mult': 0.875440621716982, 'strategy': 'mean_reversion', 'time_stop': 46, 'use_sma': False, 'use_atr': False, 'use_adx': False, 'use_ema': True, 'use_spike': False, 'rsi_required': False, 'edge_k': 0.43582390887732625, 'edge_cap': 0.41102970335316125, 'bull_strategy': 'mean_reversion', 'bull_bb_std_mult': 3.4201215593443557, 'bull_rsi_os': 13, 'bull_rsi_ob': 87, 'bull_adx_thresh': 12.483330819820193, 'bull_atr_min_pct': 0.0021226090868240177, 'bull_atr_max_pct': 0.025541561804424115, 'bull_tp_mult': 1.4896962985833302, 'bull_tsl_mult': 0.34591310150444776, 'bull_time_stop': 146, 'bull_use_sma': False, 'bull_use_ema': False, 'bull_use_atr': True, 'bull_use_adx': True, 'bull_use_spike': True, 'bull_rsi_required': False, 'bear_strategy': 'mean_reversion', 'bear_bb_std_mult': 2.1029357246190106, 'bear_rsi_os': 52, 'bear_rsi_ob': 51, 'bear_adx_thresh': 20.668559974033954, 'bear_atr_min_pct': 0.024644664180356272, 'bear_atr_max_pct': 0.14531423798039006, 'bear_tp_mult': 2.9315472578543376, 'bear_tsl_mult': 0.6433871588293492, 'bear_time_stop': 217, 'bear_use_sma': True, 'bear_use_ema': True, 'bear_use_atr': False, 'bear_use_adx': True, 'bear_use_spike': True, 'bear_rsi_required': False, 'sideways_strategy': 'breakout', 'sideways_bb_std_mult': 2.0558861030034574, 'sideways_rsi_os': 29, 'sideways_rsi_ob': 90, 'sideways_adx_thresh': 34.912691913408594, 'sideways_atr_min_pct': 0.012392043969820242, 'sideways_atr_max_pct': 0.11192574901656183, 'sideways_tp_mult': 1.97759074549023, 'sideways_tsl_mult': 0.6097354369525851, 'sideways_time_stop': 70, 'sideways_use_sma': False, 'sideways_use_ema': False, 'sideways_use_atr': False, 'sideways_use_adx': True, 'sideways_use_spike': True, 'sideways_rsi_required': True}.
[I 2025-08-31 04:50:48,322] Trial 475 finished with values: [-1000000000.0, 1000000000.0] and parameters: {'p_sma': 56, 'p_std': 38, 'p_atr': 27, 'p_adx': 10, 'rsi_period': 9, 'ema1': 6, 'ema2': 27, 'slip_atr_k': 0.01490921810376743, 'slip_spread_k': 0.13487927566312857, 'spread_hl_frac': 0.01665489919007833, 'bb_std_mult': 1.7158779903786445, 'rsi_os': 31, 'rsi_ob': 57, 'vol_spike': 0.05741865709693715, 'adx_thresh': 12.658991834266228, 'atr_min_pct': 0.024283965321483622, 'atr_max_pct': 0.058674503202373884, 'tp_mult': 2.460661995911544, 'tsl_mult': 0.8373110776708178, 'strategy': 'mean_reversion', 'time_stop': 46, 'use_sma': True, 'use_atr': True, 'use_adx': True, 'use_ema': False, 'use_spike': True, 'rsi_required': False, 'edge_k': 1.5105640389950319, 'edge_cap': 0.9440168469525838, 'bull_strategy': 'mean_reversion', 'bull_bb_std_mult': 3.1724579553410592, 'bull_rsi_os': 31, 'bull_rsi_ob': 73, 'bull_adx_thresh': 6.786592769669127, 'bull_atr_min_pct': 0.028742474849458653, 'bull_atr_max_pct': 0.03685069833436505, 'bull_tp_mult': 1.4946776514715125, 'bull_tsl_mult': 0.6491450152426258, 'bull_time_stop': 148, 'bull_use_sma': True, 'bull_use_ema': False, 'bull_use_atr': False, 'bull_use_adx': False, 'bull_use_spike': False, 'bull_rsi_required': False, 'bear_strategy': 'breakout', 'bear_bb_std_mult': 2.3583932489390285, 'bear_rsi_os': 44, 'bear_rsi_ob': 85, 'bear_adx_thresh': 25.208087336004937, 'bear_atr_min_pct': 0.02353426383385436, 'bear_atr_max_pct': 0.08399738180518941, 'bear_tp_mult': 2.760202746084717, 'bear_tsl_mult': 0.07990033546276332, 'bear_time_stop': 244, 'bear_use_sma': False, 'bear_use_ema': True, 'bear_use_atr': True, 'bear_use_adx': False, 'bear_use_spike': True, 'bear_rsi_required': False, 'sideways_strategy': 'breakout', 'sideways_bb_std_mult': 0.8643799572496291, 'sideways_rsi_os': 25, 'sideways_rsi_ob': 85, 'sideways_adx_thresh': 10.43151522965992, 'sideways_atr_min_pct': 0.0225292045547014, 'sideways_atr_max_pct': 0.10592948055723007, 'sideways_tp_mult': 1.7021625654366364, 'sideways_tsl_mult': 0.13445094511232913, 'sideways_time_stop': 243, 'sideways_use_sma': True, 'sideways_use_ema': True, 'sideways_use_atr': True, 'sideways_use_adx': False, 'sideways_use_spike': False, 'sideways_rsi_required': False}.
[I 2025-08-31 04:51:38,224] Trial 479 finished with values: [-1000000000.0, 1000000000.0] and parameters: {'p_sma': 33, 'p_std': 43, 'p_atr': 25, 'p_adx': 18, 'rsi_period': 20, 'ema1': 15, 'ema2': 24, 'slip_atr_k': 0.029288054224335912, 'slip_spread_k': 0.48951688130262766, 'spread_hl_frac': 0.010580312854596248, 'bb_std_mult': 2.868871340480341, 'rsi_os': 24, 'rsi_ob': 59, 'vol_spike': 0.02598862737401316, 'adx_thresh': 31.89904161302185, 'atr_min_pct': 0.005864406762799814, 'atr_max_pct': 0.12479330946286978, 'tp_mult': 2.5288119911781024, 'tsl_mult': 0.6710638208917085, 'strategy': 'mean_reversion', 'time_stop': 45, 'use_sma': False, 'use_atr': False, 'use_adx': False, 'use_ema': True, 'use_spike': False, 'rsi_required': False, 'edge_k': 1.4190249327465234, 'edge_cap': 0.33347765570200205, 'bull_strategy': 'mean_reversion', 'bull_bb_std_mult': 2.7808016792422965, 'bull_rsi_os': 10, 'bull_rsi_ob': 78, 'bull_adx_thresh': 32.29039982971369, 'bull_atr_min_pct': 0.0023632871509966995, 'bull_atr_max_pct': 0.04834605874104265, 'bull_tp_mult': 1.7365542758692953, 'bull_tsl_mult': 0.9863129565871324, 'bull_time_stop': 147, 'bull_use_sma': False, 'bull_use_ema': False, 'bull_use_atr': True, 'bull_use_adx': True, 'bull_use_spike': True, 'bull_rsi_required': False, 'bear_strategy': 'mean_reversion', 'bear_bb_std_mult': 2.5082811475336517, 'bear_rsi_os': 12, 'bear_rsi_ob': 64, 'bear_adx_thresh': 18.562357305785085, 'bear_atr_min_pct': 0.004630416607144123, 'bear_atr_max_pct': 0.03815470470710366, 'bear_tp_mult': 2.696449881884873, 'bear_tsl_mult': 0.6507176978322571, 'bear_time_stop': 131, 'bear_use_sma': True, 'bear_use_ema': True, 'bear_use_atr': False, 'bear_use_adx': True, 'bear_use_spike': True, 'bear_rsi_required': False, 'sideways_strategy': 'breakout', 'sideways_bb_std_mult': 1.091216754260206, 'sideways_rsi_os': 29, 'sideways_rsi_ob': 56, 'sideways_adx_thresh': 22.745564658510023, 'sideways_atr_min_pct': 0.015577275882207604, 'sideways_atr_max_pct': 0.11775635957611372, 'sideways_tp_mult': 1.9293495302617656, 'sideways_tsl_mult': 0.1818670276828634, 'sideways_time_stop': 256, 'sideways_use_sma': False, 'sideways_use_ema': False, 'sideways_use_atr': False, 'sideways_use_adx': True, 'sideways_use_spike': True, 'sideways_rsi_required': True}.
[I 2025-08-31 04:51:38,728] Trial 482 finished with values: [-1000000000.0, 1000000000.0] and parameters: {'p_sma': 41, 'p_std': 42, 'p_atr': 24, 'p_adx': 20, 'rsi_period': 27, 'ema1': 16, 'ema2': 24, 'slip_atr_k': 0.08428317494453313, 'slip_spread_k': 0.03418312928578737, 'spread_hl_frac': 0.02733884403787948, 'bb_std_mult': 2.1443418050572265, 'rsi_os': 28, 'rsi_ob': 69, 'vol_spike': 0.03791997897789033, 'adx_thresh': 11.985962994379621, 'atr_min_pct': 0.0044627996660809195, 'atr_max_pct': 0.04257218391165606, 'tp_mult': 2.5396332753943347, 'tsl_mult': 0.7281249888147442, 'strategy': 'breakout', 'time_stop': 38, 'use_sma': False, 'use_atr': False, 'use_adx': False, 'use_ema': False, 'use_spike': True, 'rsi_required': True, 'edge_k': 1.447549081175428, 'edge_cap': 0.9790996000103138, 'bull_strategy': 'mean_reversion', 'bull_bb_std_mult': 3.5945300948595413, 'bull_rsi_os': 15, 'bull_rsi_ob': 76, 'bull_adx_thresh': 30.493213813185044, 'bull_atr_min_pct': 0.016977288157881586, 'bull_atr_max_pct': 0.05159047552337616, 'bull_tp_mult': 1.761004985394889, 'bull_tsl_mult': 0.9864995741580185, 'bull_time_stop': 130, 'bull_use_sma': False, 'bull_use_ema': False, 'bull_use_atr': True, 'bull_use_adx': True, 'bull_use_spike': False, 'bull_rsi_required': True, 'bear_strategy': 'mean_reversion', 'bear_bb_std_mult': 2.5468846210421967, 'bear_rsi_os': 12, 'bear_rsi_ob': 45, 'bear_adx_thresh': 18.364966107611064, 'bear_atr_min_pct': 0.00898773675872434, 'bear_atr_max_pct': 0.038429721162295025, 'bear_tp_mult': 1.8133729967961472, 'bear_tsl_mult': 0.2728556954498156, 'bear_time_stop': 272, 'bear_use_sma': True, 'bear_use_ema': True, 'bear_use_atr': False, 'bear_use_adx': True, 'bear_use_spike': True, 'bear_rsi_required': True, 'sideways_strategy': 'mean_reversion', 'sideways_bb_std_mult': 1.0908985021856545, 'sideways_rsi_os': 44, 'sideways_rsi_ob': 56, 'sideways_adx_thresh': 19.709576635166, 'sideways_atr_min_pct': 0.029993777152951914, 'sideways_atr_max_pct': 0.010166070655051665, 'sideways_tp_mult': 1.9368044197112149, 'sideways_tsl_mult': 0.23018296522978532, 'sideways_time_stop': 63, 'sideways_use_sma': False, 'sideways_use_ema': False, 'sideways_use_atr': False, 'sideways_use_adx': True, 'sideways_use_spike': True, 'sideways_rsi_required': True}.
[I 2025-08-31 04:51:39,014] Trial 481 finished with values: [-1000000000.0, 1000000000.0] and parameters: {'p_sma': 38, 'p_std': 43, 'p_atr': 24, 'p_adx': 20, 'rsi_period': 66, 'ema1': 15, 'ema2': 24, 'slip_atr_k': 0.055434671567957325, 'slip_spread_k': 0.49247789104538847, 'spread_hl_frac': 0.022964198308279452, 'bb_std_mult': 1.507588102219392, 'rsi_os': 21, 'rsi_ob': 69, 'vol_spike': 0.13389912488124264, 'adx_thresh': 31.66117286309519, 'atr_min_pct': 0.020563375881858907, 'atr_max_pct': 0.12455097034663588, 'tp_mult': 2.3727307734472274, 'tsl_mult': 0.7266111853429118, 'strategy': 'breakout', 'time_stop': 35, 'use_sma': False, 'use_atr': False, 'use_adx': False, 'use_ema': False, 'use_spike': True, 'rsi_required': True, 'edge_k': 1.4203895756844895, 'edge_cap': 0.9804934230028429, 'bull_strategy': 'mean_reversion', 'bull_bb_std_mult': 3.4440895797632107, 'bull_rsi_os': 8, 'bull_rsi_ob': 76, 'bull_adx_thresh': 25.161864788004976, 'bull_atr_min_pct': 0.015180042485076508, 'bull_atr_max_pct': 0.11385494485062082, 'bull_tp_mult': 1.7283847223071318, 'bull_tsl_mult': 0.45200606312363073, 'bull_time_stop': 123, 'bull_use_sma': False, 'bull_use_ema': False, 'bull_use_atr': True, 'bull_use_adx': True, 'bull_use_spike': False, 'bull_rsi_required': True, 'bear_strategy': 'mean_reversion', 'bear_bb_std_mult': 2.520237783379187, 'bear_rsi_os': 33, 'bear_rsi_ob': 45, 'bear_adx_thresh': 18.14253637555916, 'bear_atr_min_pct': 0.02252363129285445, 'bear_atr_max_pct': 0.04215406646611712, 'bear_tp_mult': 2.698061252668197, 'bear_tsl_mult': 0.7258452811274738, 'bear_time_stop': 86, 'bear_use_sma': True, 'bear_use_ema': True, 'bear_use_atr': False, 'bear_use_adx': True, 'bear_use_spike': True, 'bear_rsi_required': True, 'sideways_strategy': 'mean_reversion', 'sideways_bb_std_mult': 1.082689104804158, 'sideways_rsi_os': 52, 'sideways_rsi_ob': 93, 'sideways_adx_thresh': 15.923862634569888, 'sideways_atr_min_pct': 0.013846710494494124, 'sideways_atr_max_pct': 0.11555721647982461, 'sideways_tp_mult': 1.9373621385309683, 'sideways_tsl_mult': 0.002995701296669706, 'sideways_time_stop': 90, 'sideways_use_sma': False, 'sideways_use_ema': False, 'sideways_use_atr': False, 'sideways_use_adx': True, 'sideways_use_spike': True, 'sideways_rsi_required': True}.
[I 2025-08-31 04:51:39,186] Trial 480 finished with values: [-0.06008901683611878, 0.060026157045521444] and parameters: {'p_sma': 56, 'p_std': 19, 'p_atr': 25, 'p_adx': 18, 'rsi_period': 26, 'ema1': 22, 'ema2': 23, 'slip_atr_k': 0.057256443441973615, 'slip_spread_k': 0.03538135539901497, 'spread_hl_frac': 0.023646406880226838, 'bb_std_mult': 2.877801695355605, 'rsi_os': 24, 'rsi_ob': 59, 'vol_spike': 0.05909653555637377, 'adx_thresh': 11.814760580423746, 'atr_min_pct': 0.021119777032762434, 'atr_max_pct': 0.11758778851782056, 'tp_mult': 2.530508840712981, 'tsl_mult': 0.428952616004905, 'strategy': 'breakout', 'time_stop': 299, 'use_sma': False, 'use_atr': False, 'use_adx': False, 'use_ema': False, 'use_spike': True, 'rsi_required': False, 'edge_k': 0.808854153084054, 'edge_cap': 0.9819259542474589, 'bull_strategy': 'mean_reversion', 'bull_bb_std_mult': 2.78211160347099, 'bull_rsi_os': 10, 'bull_rsi_ob': 76, 'bull_adx_thresh': 25.473913298223927, 'bull_atr_min_pct': 0.018266468416544418, 'bull_atr_max_pct': 0.0484878454968402, 'bull_tp_mult': 2.990308147651139, 'bull_tsl_mult': 0.8750034688949472, 'bull_time_stop': 147, 'bull_use_sma': False, 'bull_use_ema': False, 'bull_use_atr': True, 'bull_use_adx': True, 'bull_use_spike': False, 'bull_rsi_required': True, 'bear_strategy': 'mean_reversion', 'bear_bb_std_mult': 0.6932694056527863, 'bear_rsi_os': 6, 'bear_rsi_ob': 51, 'bear_adx_thresh': 18.6628100112362, 'bear_atr_min_pct': 0.010388451163327296, 'bear_atr_max_pct': 0.14717170605215474, 'bear_tp_mult': 1.8022399910364275, 'bear_tsl_mult': 0.6392375143719317, 'bear_time_stop': 206, 'bear_use_sma': True, 'bear_use_ema': True, 'bear_use_atr': False, 'bear_use_adx': True, 'bear_use_spike': True, 'bear_rsi_required': True, 'sideways_strategy': 'mean_reversion', 'sideways_bb_std_mult': 1.1061678369682717, 'sideways_rsi_os': 28, 'sideways_rsi_ob': 55, 'sideways_adx_thresh': 22.751571744998408, 'sideways_atr_min_pct': 0.000661353730494342, 'sideways_atr_max_pct': 0.11614654997244428, 'sideways_tp_mult': 1.9286292689259554, 'sideways_tsl_mult': 0.610013145703113, 'sideways_time_stop': 252, 'sideways_use_sma': False, 'sideways_use_ema': False, 'sideways_use_atr': False, 'sideways_use_adx': True, 'sideways_use_spike': True, 'sideways_rsi_required': True}.
[I 2025-08-31 04:52:27,035] Trial 483 finished with values: [-1000000000.0, 1000000000.0] and parameters: {'p_sma': 45, 'p_std': 26, 'p_atr': 7, 'p_adx': 20, 'rsi_period': 26, 'ema1': 15, 'ema2': 26, 'slip_atr_k': 0.01878716843864192, 'slip_spread_k': 0.030700615916737256, 'spread_hl_frac': 0.008946852623672806, 'bb_std_mult': 2.1274893424353456, 'rsi_os': 28, 'rsi_ob': 59, 'vol_spike': 0.036604865700116986, 'adx_thresh': 11.678478938115843, 'atr_min_pct': 0.020344714583794016, 'atr_max_pct': 0.025278211683859894, 'tp_mult': 2.3737347247876905, 'tsl_mult': 0.8559977622164957, 'strategy': 'breakout', 'time_stop': 24, 'use_sma': False, 'use_atr': False, 'use_adx': False, 'use_ema': False, 'use_spike': True, 'rsi_required': True, 'edge_k': 1.1206529664829934, 'edge_cap': 0.9852057733549288, 'bull_strategy': 'mean_reversion', 'bull_bb_std_mult': 1.272478766054747, 'bull_rsi_os': 28, 'bull_rsi_ob': 84, 'bull_adx_thresh': 21.229338108489298, 'bull_atr_min_pct': 0.011547340705956673, 'bull_atr_max_pct': 0.04271682594086334, 'bull_tp_mult': 1.6561647206792918, 'bull_tsl_mult': 0.769526867173974, 'bull_time_stop': 122, 'bull_use_sma': False, 'bull_use_ema': False, 'bull_use_atr': True, 'bull_use_adx': True, 'bull_use_spike': False, 'bull_rsi_required': True, 'bear_strategy': 'mean_reversion', 'bear_bb_std_mult': 3.07073802227828, 'bear_rsi_os': 6, 'bear_rsi_ob': 79, 'bear_adx_thresh': 19.07085189163626, 'bear_atr_min_pct': 0.0012473070319286052, 'bear_atr_max_pct': 0.09445914776600095, 'bear_tp_mult': 2.2304604181322256, 'bear_tsl_mult': 0.23144983747451053, 'bear_time_stop': 206, 'bear_use_sma': True, 'bear_use_ema': True, 'bear_use_atr': True, 'bear_use_adx': True, 'bear_use_spike': True, 'bear_rsi_required': True, 'sideways_strategy': 'mean_reversion', 'sideways_bb_std_mult': 0.990762821035732, 'sideways_rsi_os': 14, 'sideways_rsi_ob': 55, 'sideways_adx_thresh': 14.278301902216471, 'sideways_atr_min_pct': 0.014615406624643733, 'sideways_atr_max_pct': 0.11539615080150528, 'sideways_tp_mult': 1.9382639539163833, 'sideways_tsl_mult': 0.6711961984695591, 'sideways_time_stop': 78, 'sideways_use_sma': False, 'sideways_use_ema': False, 'sideways_use_atr': False, 'sideways_use_adx': True, 'sideways_use_spike': True, 'sideways_rsi_required': True}.
[I 2025-08-31 04:52:27,989] Trial 485 finished with values: [-1000000000.0, 1000000000.0] and parameters: {'p_sma': 9, 'p_std': 18, 'p_atr': 7, 'p_adx': 9, 'rsi_period': 26, 'ema1': 13, 'ema2': 14, 'slip_atr_k': 0.019169265748670124, 'slip_spread_k': 0.10168192958556133, 'spread_hl_frac': 0.008869927562177627, 'bb_std_mult': 1.8921411761998623, 'rsi_os': 28, 'rsi_ob': 94, 'vol_spike': 0.16204175341588825, 'adx_thresh': 10.859703111990136, 'atr_min_pct': 0.011567967929362075, 'atr_max_pct': 0.025942461959289176, 'tp_mult': 2.4313644718614853, 'tsl_mult': 0.37589193988751435, 'strategy': 'breakout', 'time_stop': 160, 'use_sma': False, 'use_atr': False, 'use_adx': False, 'use_ema': False, 'use_spike': True, 'rsi_required': False, 'edge_k': 1.3896508070143698, 'edge_cap': 0.9218077036070595, 'bull_strategy': 'mean_reversion', 'bull_bb_std_mult': 2.4960963777296774, 'bull_rsi_os': 51, 'bull_rsi_ob': 81, 'bull_adx_thresh': 10.282358784684398, 'bull_atr_min_pct': 0.005341892896402269, 'bull_atr_max_pct': 0.010113403951247699, 'bull_tp_mult': 1.662046051429976, 'bull_tsl_mult': 0.8552183010345109, 'bull_time_stop': 137, 'bull_use_sma': False, 'bull_use_ema': False, 'bull_use_atr': True, 'bull_use_adx': True, 'bull_use_spike': False, 'bull_rsi_required': True, 'bear_strategy': 'mean_reversion', 'bear_bb_std_mult': 0.9564239354109627, 'bear_rsi_os': 6, 'bear_rsi_ob': 81, 'bear_adx_thresh': 20.38557838790479, 'bear_atr_min_pct': 0.0013516444434955033, 'bear_atr_max_pct': 0.029496615109954112, 'bear_tp_mult': 2.6086490180128625, 'bear_tsl_mult': 0.47031836451143705, 'bear_time_stop': 10, 'bear_use_sma': True, 'bear_use_ema': True, 'bear_use_atr': True, 'bear_use_adx': True, 'bear_use_spike': True, 'bear_rsi_required': True, 'sideways_strategy': 'mean_reversion', 'sideways_bb_std_mult': 1.2019507151579765, 'sideways_rsi_os': 26, 'sideways_rsi_ob': 87, 'sideways_adx_thresh': 29.0680656774008, 'sideways_atr_min_pct': 0.014713676654191854, 'sideways_atr_max_pct': 0.11475779164351582, 'sideways_tp_mult': 1.8598248006103382, 'sideways_tsl_mult': 0.4619915138915588, 'sideways_time_stop': 210, 'sideways_use_sma': False, 'sideways_use_ema': False, 'sideways_use_atr': False, 'sideways_use_adx': True, 'sideways_use_spike': True, 'sideways_rsi_required': True}.
[I 2025-08-31 04:52:28,132] Trial 486 finished with values: [-1000000000.0, 1000000000.0] and parameters: {'p_sma': 17, 'p_std': 28, 'p_atr': 26, 'p_adx': 9, 'rsi_period': 22, 'ema1': 17, 'ema2': 42, 'slip_atr_k': 0.01996207035794528, 'slip_spread_k': 0.10409335417049391, 'spread_hl_frac': 0.0009313901950089506, 'bb_std_mult': 1.9001461375006412, 'rsi_os': 28, 'rsi_ob': 47, 'vol_spike': 0.017294114045377368, 'adx_thresh': 24.703511717439092, 'atr_min_pct': 0.025429805419623516, 'atr_max_pct': 0.054347529286537785, 'tp_mult': 2.113153807388831, 'tsl_mult': 0.8815425527088718, 'strategy': 'breakout', 'time_stop': 158, 'use_sma': False, 'use_atr': False, 'use_adx': False, 'use_ema': False, 'use_spike': True, 'rsi_required': False, 'edge_k': 0.5426824777622885, 'edge_cap': 0.9548152398658905, 'bull_strategy': 'mean_reversion', 'bull_bb_std_mult': 2.6669960614572488, 'bull_rsi_os': 40, 'bull_rsi_ob': 45, 'bull_adx_thresh': 5.649456076763229, 'bull_atr_min_pct': 0.01158099952538638, 'bull_atr_max_pct': 0.04192756743391502, 'bull_tp_mult': 2.275801604970245, 'bull_tsl_mult': 0.8570641184059811, 'bull_time_stop': 137, 'bull_use_sma': False, 'bull_use_ema': False, 'bull_use_atr': True, 'bull_use_adx': True, 'bull_use_spike': False, 'bull_rsi_required': True, 'bear_strategy': 'mean_reversion', 'bear_bb_std_mult': 0.9592878647301033, 'bear_rsi_os': 15, 'bear_rsi_ob': 81, 'bear_adx_thresh': 17.236228182346572, 'bear_atr_min_pct': 0.0035591328048813955, 'bear_atr_max_pct': 0.030697665581827575, 'bear_tp_mult': 2.611631172884237, 'bear_tsl_mult': 0.24333528561495393, 'bear_time_stop': 16, 'bear_use_sma': True, 'bear_use_ema': True, 'bear_use_atr': True, 'bear_use_adx': True, 'bear_use_spike': True, 'bear_rsi_required': True, 'sideways_strategy': 'mean_reversion', 'sideways_bb_std_mult': 1.2066167529308545, 'sideways_rsi_os': 26, 'sideways_rsi_ob': 52, 'sideways_adx_thresh': 23.72269411668449, 'sideways_atr_min_pct': 0.014524518254634116, 'sideways_atr_max_pct': 0.024932802898607352, 'sideways_tp_mult': 2.03565844166111, 'sideways_tsl_mult': 0.5779098927873954, 'sideways_time_stop': 78, 'sideways_use_sma': False, 'sideways_use_ema': False, 'sideways_use_atr': False, 'sideways_use_adx': True, 'sideways_use_spike': True, 'sideways_rsi_required': True}.
