[I 2025-08-31 05:28:06,843] Trial 686 finished with values: [-1000000000.0, 1000000000.0] and parameters: {'p_sma': 5, 'p_std': 15, 'p_atr': 17, 'p_adx': 8, 'rsi_period': 63, 'ema1': 20, 'ema2': 26, 'slip_atr_k': 0.043930175849360556, 'slip_spread_k': 0.5508520230311313, 'spread_hl_frac': 0.019765871954020492, 'bb_std_mult': 2.0113225853494074, 'rsi_os': 10, 'rsi_ob': 84, 'vol_spike': 0.14669155312687696, 'adx_thresh': 23.154462161540785, 'atr_min_pct': 0.02321606293751922, 'atr_max_pct': 0.022982819716256424, 'tp_mult': 2.3473329141599972, 'tsl_mult': 0.824305458831031, 'strategy': 'mean_reversion', 'time_stop': 20, 'use_sma': False, 'use_atr': True, 'use_adx': False, 'use_ema': False, 'use_spike': True, 'rsi_required': True, 'edge_k': 0.13112948029977145, 'edge_cap': 0.7850987491028228, 'bull_strategy': 'breakout', 'bull_bb_std_mult': 1.0101659418238262, 'bull_rsi_os': 44, 'bull_rsi_ob': 76, 'bull_adx_thresh': 8.280164810735942, 'bull_atr_min_pct': 0.013323227171885992, 'bull_atr_max_pct': 0.08320880696134347, 'bull_tp_mult': 2.282335297761976, 'bull_tsl_mult': 0.9334127052010721, 'bull_time_stop': 210, 'bull_use_sma': False, 'bull_use_ema': False, 'bull_use_atr': True, 'bull_use_adx': True, 'bull_use_spike': False, 'bull_rsi_required': False, 'bear_strategy': 'breakout', 'bear_bb_std_mult': 0.8717576208262513, 'bear_rsi_os': 19, 'bear_rsi_ob': 82, 'bear_adx_thresh': 13.415566433975215, 'bear_atr_min_pct': 0.0078558785409406, 'bear_atr_max_pct': 0.042323141626928684, 'bear_tp_mult': 1.3278216080191219, 'bear_tsl_mult': 0.7594295099023889, 'bear_time_stop': 272, 'bear_use_sma': True, 'bear_use_ema': True, 'bear_use_atr': True, 'bear_use_adx': False, 'bear_use_spike': False, 'bear_rsi_required': False, 'sideways_strategy': 'breakout', 'sideways_bb_std_mult': 2.9416688306667504, 'sideways_rsi_os': 43, 'sideways_rsi_ob': 55, 'sideways_adx_thresh': 27.236951653917032, 'sideways_atr_min_pct': 0.01921947626283518, 'sideways_atr_max_pct': 0.05270972809781579, 'sideways_tp_mult': 2.0408432575225497, 'sideways_tsl_mult': 0.48676076600785523, 'sideways_time_stop': 200, 'sideways_use_sma': False, 'sideways_use_ema': True, 'sideways_use_atr': False, 'sideways_use_adx': False, 'sideways_use_spike': True, 'sideways_rsi_required': True}.
[I 2025-08-31 05:28:07,576] Trial 684 finished with values: [-1000000000.0, 1000000000.0] and parameters: {'p_sma': 47, 'p_std': 12, 'p_atr': 17, 'p_adx': 15, 'rsi_period': 36, 'ema1': 28, 'ema2': 19, 'slip_atr_k': 0.05447740722278027, 'slip_spread_k': 0.5294112244920948, 'spread_hl_frac': 0.0265743498150128, 'bb_std_mult': 1.8860022632060403, 'rsi_os': 42, 'rsi_ob': 59, 'vol_spike': 0.2983660927303885, 'adx_thresh': 11.325397787416053, 'atr_min_pct': 0.0231937093710009, 'atr_max_pct': 0.04701921182942456, 'tp_mult': 2.9965488767932893, 'tsl_mult': 0.3409160434656323, 'strategy': 'mean_reversion', 'time_stop': 28, 'use_sma': False, 'use_atr': True, 'use_adx': True, 'use_ema': False, 'use_spike': True, 'rsi_required': True, 'edge_k': 0.5667419716191044, 'edge_cap': 0.7873358334805997, 'bull_strategy': 'mean_reversion', 'bull_bb_std_mult': 0.6805423776798387, 'bull_rsi_os': 54, 'bull_rsi_ob': 78, 'bull_adx_thresh': 9.201135311003478, 'bull_atr_min_pct': 0.005918690980672672, 'bull_atr_max_pct': 0.02893400183209062, 'bull_tp_mult': 2.254074752573157, 'bull_tsl_mult': 0.9405455347613897, 'bull_time_stop': 289, 'bull_use_sma': True, 'bull_use_ema': False, 'bull_use_atr': True, 'bull_use_adx': False, 'bull_use_spike': False, 'bull_rsi_required': False, 'bear_strategy': 'breakout', 'bear_bb_std_mult': 0.7615409066931855, 'bear_rsi_os': 11, 'bear_rsi_ob': 90, 'bear_adx_thresh': 33.9610245212414, 'bear_atr_min_pct': 0.00902812666206092, 'bear_atr_max_pct': 0.11111509602473066, 'bear_tp_mult': 1.1962373855141473, 'bear_tsl_mult': 0.2342461447980619, 'bear_time_stop': 238, 'bear_use_sma': False, 'bear_use_ema': True, 'bear_use_atr': False, 'bear_use_adx': False, 'bear_use_spike': False, 'bear_rsi_required': True, 'sideways_strategy': 'breakout', 'sideways_bb_std_mult': 2.7878592467966317, 'sideways_rsi_os': 42, 'sideways_rsi_ob': 55, 'sideways_adx_thresh': 22.224601420440678, 'sideways_atr_min_pct': 0.01573115191957626, 'sideways_atr_max_pct': 0.014174315656314797, 'sideways_tp_mult': 2.045659767556078, 'sideways_tsl_mult': 0.5113811610922582, 'sideways_time_stop': 213, 'sideways_use_sma': False, 'sideways_use_ema': True, 'sideways_use_atr': True, 'sideways_use_adx': False, 'sideways_use_spike': False, 'sideways_rsi_required': False}.
[I 2025-08-31 05:28:29,234] Trial 685 finished with values: [-1000000000.0, 1000000000.0] and parameters: {'p_sma': 57, 'p_std': 15, 'p_atr': 12, 'p_adx': 15, 'rsi_period': 32, 'ema1': 24, 'ema2': 42, 'slip_atr_k': 0.031168596695294926, 'slip_spread_k': 0.558056767980872, 'spread_hl_frac': 0.019745364259140856, 'bb_std_mult': 2.022044267428784, 'rsi_os': 33, 'rsi_ob': 63, 'vol_spike': 0.025968836506400125, 'adx_thresh': 11.229312165416863, 'atr_min_pct': 0.02317831029860652, 'atr_max_pct': 0.11668735074479816, 'tp_mult': 2.301285726607522, 'tsl_mult': 0.827724094817872, 'strategy': 'mean_reversion', 'time_stop': 192, 'use_sma': False, 'use_atr': True, 'use_adx': False, 'use_ema': False, 'use_spike': True, 'rsi_required': True, 'edge_k': 0.30959727700628936, 'edge_cap': 0.7925711740893763, 'bull_strategy': 'mean_reversion', 'bull_bb_std_mult': 0.6890440304328627, 'bull_rsi_os': 54, 'bull_rsi_ob': 78, 'bull_adx_thresh': 17.729216966025916, 'bull_atr_min_pct': 0.007784553177707829, 'bull_atr_max_pct': 0.01043591087965684, 'bull_tp_mult': 1.6543718009838555, 'bull_tsl_mult': 0.9539528220848885, 'bull_time_stop': 230, 'bull_use_sma': False, 'bull_use_ema': False, 'bull_use_atr': True, 'bull_use_adx': True, 'bull_use_spike': False, 'bull_rsi_required': False, 'bear_strategy': 'breakout', 'bear_bb_std_mult': 0.8013188763163192, 'bear_rsi_os': 10, 'bear_rsi_ob': 73, 'bear_adx_thresh': 6.603824007948218, 'bear_atr_min_pct': 0.005097185838419416, 'bear_atr_max_pct': 0.0424403426576121, 'bear_tp_mult': 1.3090821392788992, 'bear_tsl_mult': 0.22985146665977182, 'bear_time_stop': 276, 'bear_use_sma': True, 'bear_use_ema': True, 'bear_use_atr': True, 'bear_use_adx': False, 'bear_use_spike': False, 'bear_rsi_required': True, 'sideways_strategy': 'breakout', 'sideways_bb_std_mult': 1.120304429397302, 'sideways_rsi_os': 42, 'sideways_rsi_ob': 55, 'sideways_adx_thresh': 22.233809787329037, 'sideways_atr_min_pct': 0.004272192315693297, 'sideways_atr_max_pct': 0.013654380266141287, 'sideways_tp_mult': 2.049421020815105, 'sideways_tsl_mult': 0.48955796590570616, 'sideways_time_stop': 222, 'sideways_use_sma': True, 'sideways_use_ema': True, 'sideways_use_atr': False, 'sideways_use_adx': False, 'sideways_use_spike': True, 'sideways_rsi_required': True}.
[I 2025-08-31 05:28:45,055] Trial 687 finished with values: [-1000000000.0, 1000000000.0] and parameters: {'p_sma': 16, 'p_std': 15, 'p_atr': 17, 'p_adx': 26, 'rsi_period': 19, 'ema1': 24, 'ema2': 26, 'slip_atr_k': 0.03118768526598712, 'slip_spread_k': 0.552709382577359, 'spread_hl_frac': 0.009782286273347247, 'bb_std_mult': 2.0298706753859865, 'rsi_os': 20, 'rsi_ob': 62, 'vol_spike': 0.2338560308845366, 'adx_thresh': 25.92458441757026, 'atr_min_pct': 0.029830204177491933, 'atr_max_pct': 0.11697272933105257, 'tp_mult': 2.471741813038285, 'tsl_mult': 0.822188323860775, 'strategy': 'mean_reversion', 'time_stop': 23, 'use_sma': False, 'use_atr': True, 'use_adx': False, 'use_ema': False, 'use_spike': True, 'rsi_required': True, 'edge_k': 0.15948922601589438, 'edge_cap': 0.7877395099845941, 'bull_strategy': 'breakout', 'bull_bb_std_mult': 1.028474344799385, 'bull_rsi_os': 44, 'bull_rsi_ob': 76, 'bull_adx_thresh': 9.813034096063488, 'bull_atr_min_pct': 0.025363618572869076, 'bull_atr_max_pct': 0.08365925269529306, 'bull_tp_mult': 2.261501819253014, 'bull_tsl_mult': 0.44065920145066756, 'bull_time_stop': 263, 'bull_use_sma': False, 'bull_use_ema': False, 'bull_use_atr': True, 'bull_use_adx': True, 'bull_use_spike': False, 'bull_rsi_required': False, 'bear_strategy': 'breakout', 'bear_bb_std_mult': 0.8765054793636458, 'bear_rsi_os': 36, 'bear_rsi_ob': 89, 'bear_adx_thresh': 17.631496623847465, 'bear_atr_min_pct': 0.007501580816374511, 'bear_atr_max_pct': 0.12961274935310607, 'bear_tp_mult': 1.3248871990746858, 'bear_tsl_mult': 0.22781938357881817, 'bear_time_stop': 280, 'bear_use_sma': True, 'bear_use_ema': True, 'bear_use_atr': True, 'bear_use_adx': False, 'bear_use_spike': False, 'bear_rsi_required': False, 'sideways_strategy': 'breakout', 'sideways_bb_std_mult': 1.5922245566734463, 'sideways_rsi_os': 32, 'sideways_rsi_ob': 56, 'sideways_adx_thresh': 23.83733740481032, 'sideways_atr_min_pct': 0.01573860985197834, 'sideways_atr_max_pct': 0.02837143111877545, 'sideways_tp_mult': 2.040515098988863, 'sideways_tsl_mult': 0.4870518396568264, 'sideways_time_stop': 199, 'sideways_use_sma': False, 'sideways_use_ema': True, 'sideways_use_atr': False, 'sideways_use_adx': False, 'sideways_use_spike': True, 'sideways_rsi_required': True}.
[I 2025-08-31 05:28:46,529] Trial 688 finished with values: [-1000000000.0, 1000000000.0] and parameters: {'p_sma': 8, 'p_std': 17, 'p_atr': 12, 'p_adx': 15, 'rsi_period': 19, 'ema1': 25, 'ema2': 23, 'slip_atr_k': 0.22467982936847752, 'slip_spread_k': 0.5263148690893478, 'spread_hl_frac': 0.01004591475528018, 'bb_std_mult': 2.7649436823714955, 'rsi_os': 25, 'rsi_ob': 81, 'vol_spike': 0.02248601374465854, 'adx_thresh': 24.419800558543578, 'atr_min_pct': 0.0015265311013748506, 'atr_max_pct': 0.0528264092915728, 'tp_mult': 1.7522745815783167, 'tsl_mult': 0.07336953645031019, 'strategy': 'mean_reversion', 'time_stop': 221, 'use_sma': False, 'use_atr': True, 'use_adx': False, 'use_ema': False, 'use_spike': True, 'rsi_required': True, 'edge_k': 0.047849326130202985, 'edge_cap': 0.7461233592258837, 'bull_strategy': 'mean_reversion', 'bull_bb_std_mult': 0.6757790843575253, 'bull_rsi_os': 49, 'bull_rsi_ob': 76, 'bull_adx_thresh': 9.80372499231328, 'bull_atr_min_pct': 0.005848077988704256, 'bull_atr_max_pct': 0.030064183846767366, 'bull_tp_mult': 2.2120673741005863, 'bull_tsl_mult': 0.8589394020036538, 'bull_time_stop': 186, 'bull_use_sma': False, 'bull_use_ema': False, 'bull_use_atr': True, 'bull_use_adx': True, 'bull_use_spike': False, 'bull_rsi_required': False, 'bear_strategy': 'breakout', 'bear_bb_std_mult': 0.8221613916175575, 'bear_rsi_os': 14, 'bear_rsi_ob': 73, 'bear_adx_thresh': 17.106605183442287, 'bear_atr_min_pct': 0.008784739683220865, 'bear_atr_max_pct': 0.043653218597959335, 'bear_tp_mult': 1.7211230944831173, 'bear_tsl_mult': 0.3284315549171347, 'bear_time_stop': 241, 'bear_use_sma': True, 'bear_use_ema': True, 'bear_use_atr': True, 'bear_use_adx': False, 'bear_use_spike': False, 'bear_rsi_required': True, 'sideways_strategy': 'breakout', 'sideways_bb_std_mult': 1.103780083164155, 'sideways_rsi_os': 32, 'sideways_rsi_ob': 65, 'sideways_adx_thresh': 26.697356696182965, 'sideways_atr_min_pct': 0.004423863382911912, 'sideways_atr_max_pct': 0.026613702411387698, 'sideways_tp_mult': 1.3606751138420887, 'sideways_tsl_mult': 0.5081437468985845, 'sideways_time_stop': 209, 'sideways_use_sma': False, 'sideways_use_ema': True, 'sideways_use_atr': False, 'sideways_use_adx': False, 'sideways_use_spike': True, 'sideways_rsi_required': True}.
[I 2025-08-31 05:28:47,637] Trial 689 finished with values: [-1000000000.0, 1000000000.0] and parameters: {'p_sma': 55, 'p_std': 17, 'p_atr': 13, 'p_adx': 11, 'rsi_period': 81, 'ema1': 25, 'ema2': 23, 'slip_atr_k': 0.031177581856653567, 'slip_spread_k': 0.6316251700205163, 'spread_hl_frac': 0.009770939192952082, 'bb_std_mult': 1.9397719226101189, 'rsi_os': 19, 'rsi_ob': 81, 'vol_spike': 0.18589355310273065, 'adx_thresh': 11.155308154569715, 'atr_min_pct': 0.015473952775700114, 'atr_max_pct': 0.05323219017182343, 'tp_mult': 2.460447675279458, 'tsl_mult': 0.5044057795360026, 'strategy': 'mean_reversion', 'time_stop': 126, 'use_sma': False, 'use_atr': True, 'use_adx': False, 'use_ema': False, 'use_spike': True, 'rsi_required': True, 'edge_k': 1.0371321957098525, 'edge_cap': 0.7440020221898171, 'bull_strategy': 'mean_reversion', 'bull_bb_std_mult': 0.8423668693108974, 'bull_rsi_os': 52, 'bull_rsi_ob': 76, 'bull_adx_thresh': 9.760538127488154, 'bull_atr_min_pct': 0.01778862855126313, 'bull_atr_max_pct': 0.09938974766433872, 'bull_tp_mult': 1.6709345285671098, 'bull_tsl_mult': 0.8827804058206542, 'bull_time_stop': 262, 'bull_use_sma': False, 'bull_use_ema': False, 'bull_use_atr': True, 'bull_use_adx': True, 'bull_use_spike': False, 'bull_rsi_required': False, 'bear_strategy': 'breakout', 'bear_bb_std_mult': 0.8127341788709408, 'bear_rsi_os': 10, 'bear_rsi_ob': 76, 'bear_adx_thresh': 32.70507182647492, 'bear_atr_min_pct': 0.007491177505119136, 'bear_atr_max_pct': 0.042454492583359565, 'bear_tp_mult': 1.236109546522171, 'bear_tsl_mult': 0.21302329418458998, 'bear_time_stop': 217, 'bear_use_sma': True, 'bear_use_ema': True, 'bear_use_atr': True, 'bear_use_adx': False, 'bear_use_spike': False, 'bear_rsi_required': True, 'sideways_strategy': 'breakout', 'sideways_bb_std_mult': 1.131410262121799, 'sideways_rsi_os': 37, 'sideways_rsi_ob': 65, 'sideways_adx_thresh': 23.91422887216495, 'sideways_atr_min_pct': 0.0149601977949133, 'sideways_atr_max_pct': 0.02767351922567919, 'sideways_tp_mult': 2.111807954757394, 'sideways_tsl_mult': 0.47212892989191585, 'sideways_time_stop': 196, 'sideways_use_sma': False, 'sideways_use_ema': True, 'sideways_use_atr': False, 'sideways_use_adx': False, 'sideways_use_spike': True, 'sideways_rsi_required': True}.
[I 2025-08-31 05:29:15,070] Trial 690 finished with values: [-1000000000.0, 1000000000.0] and parameters: {'p_sma': 55, 'p_std': 17, 'p_atr': 16, 'p_adx': 8, 'rsi_period': 42, 'ema1': 19, 'ema2': 23, 'slip_atr_k': 0.016951396520981436, 'slip_spread_k': 0.45475931668895087, 'spread_hl_frac': 0.009493925576257835, 'bb_std_mult': 1.931501226009296, 'rsi_os': 38, 'rsi_ob': 62, 'vol_spike': 0.022871959964861577, 'adx_thresh': 24.30593674897537, 'atr_min_pct': 0.020679784093726564, 'atr_max_pct': 0.10143258648630843, 'tp_mult': 2.461099574114151, 'tsl_mult': 0.8228538654769539, 'strategy': 'mean_reversion', 'time_stop': 127, 'use_sma': False, 'use_atr': True, 'use_adx': False, 'use_ema': False, 'use_spike': True, 'rsi_required': True, 'edge_k': 0.18438763015226872, 'edge_cap': 0.7473414514149912, 'bull_strategy': 'breakout', 'bull_bb_std_mult': 0.8336410038344013, 'bull_rsi_os': 49, 'bull_rsi_ob': 76, 'bull_adx_thresh': 9.791160746688753, 'bull_atr_min_pct': 0.02530019035183353, 'bull_atr_max_pct': 0.1193369648547655, 'bull_tp_mult': 1.0613891843834116, 'bull_tsl_mult': 0.4367846238952975, 'bull_time_stop': 265, 'bull_use_sma': False, 'bull_use_ema': False, 'bull_use_atr': True, 'bull_use_adx': True, 'bull_use_spike': False, 'bull_rsi_required': False, 'bear_strategy': 'breakout', 'bear_bb_std_mult': 3.493388839766401, 'bear_rsi_os': 52, 'bear_rsi_ob': 83, 'bear_adx_thresh': 17.383381363549333, 'bear_atr_min_pct': 0.007542540954943681, 'bear_atr_max_pct': 0.12963786594818746, 'bear_tp_mult': 1.187567637396519, 'bear_tsl_mult': 0.19513375770670244, 'bear_time_stop': 284, 'bear_use_sma': True, 'bear_use_ema': True, 'bear_use_atr': True, 'bear_use_adx': False, 'bear_use_spike': False, 'bear_rsi_required': False, 'sideways_strategy': 'breakout', 'sideways_bb_std_mult': 1.114604710562645, 'sideways_rsi_os': 37, 'sideways_rsi_ob': 53, 'sideways_adx_thresh': 20.832630712261864, 'sideways_atr_min_pct': 0.01501417222364601, 'sideways_atr_max_pct': 0.027199654969647838, 'sideways_tp_mult': 2.758289599636786, 'sideways_tsl_mult': 0.5199686785169619, 'sideways_time_stop': 196, 'sideways_use_sma': False, 'sideways_use_ema': True, 'sideways_use_atr': False, 'sideways_use_adx': False, 'sideways_use_spike': True, 'sideways_rsi_required': True}.
[I 2025-08-31 05:29:30,876] Trial 693 finished with values: [-1000000000.0, 1000000000.0] and parameters: {'p_sma': 59, 'p_std': 7, 'p_atr': 16, 'p_adx': 10, 'rsi_period': 20, 'ema1': 21, 'ema2': 25, 'slip_atr_k': 0.01620598306378781, 'slip_spread_k': 0.4546779041847565, 'spread_hl_frac': 0.005709804437971387, 'bb_std_mult': 1.9276894021326922, 'rsi_os': 36, 'rsi_ob': 76, 'vol_spike': 0.1687936031456294, 'adx_thresh': 10.253416114632296, 'atr_min_pct': 0.022124976558845266, 'atr_max_pct': 0.10080414920346126, 'tp_mult': 2.540040890742672, 'tsl_mult': 0.8028395802437187, 'strategy': 'mean_reversion', 'time_stop': 139, 'use_sma': True, 'use_atr': True, 'use_adx': False, 'use_ema': False, 'use_spike': True, 'rsi_required': True, 'edge_k': 0.7533852397300208, 'edge_cap': 0.7216957191704448, 'bull_strategy': 'mean_reversion', 'bull_bb_std_mult': 0.808370834019448, 'bull_rsi_os': 37, 'bull_rsi_ob': 81, 'bull_adx_thresh': 8.112236776244604, 'bull_atr_min_pct': 0.009609419275665228, 'bull_atr_max_pct': 0.06261634368637935, 'bull_tp_mult': 1.6271194428129994, 'bull_tsl_mult': 0.668765506563723, 'bull_time_stop': 281, 'bull_use_sma': False, 'bull_use_ema': False, 'bull_use_atr': False, 'bull_use_adx': True, 'bull_use_spike': False, 'bull_rsi_required': False, 'bear_strategy': 'breakout', 'bear_bb_std_mult': 0.9606685596680671, 'bear_rsi_os': 10, 'bear_rsi_ob': 83, 'bear_adx_thresh': 25.385294232425274, 'bear_atr_min_pct': 0.00923227753410524, 'bear_atr_max_pct': 0.04908580573819113, 'bear_tp_mult': 1.1711717318884165, 'bear_tsl_mult': 0.18797896004963022, 'bear_time_stop': 228, 'bear_use_sma': True, 'bear_use_ema': True, 'bear_use_atr': True, 'bear_use_adx': False, 'bear_use_spike': False, 'bear_rsi_required': True, 'sideways_strategy': 'breakout', 'sideways_bb_std_mult': 1.1800246366438154, 'sideways_rsi_os': 39, 'sideways_rsi_ob': 71, 'sideways_adx_thresh': 30.524926838147387, 'sideways_atr_min_pct': 0.0058774121572941936, 'sideways_atr_max_pct': 0.0803409643841677, 'sideways_tp_mult': 2.161205757346187, 'sideways_tsl_mult': 0.43526046850165745, 'sideways_time_stop': 183, 'sideways_use_sma': False, 'sideways_use_ema': True, 'sideways_use_atr': False, 'sideways_use_adx': False, 'sideways_use_spike': True, 'sideways_rsi_required': True}.
[I 2025-08-31 05:29:31,547] Trial 691 finished with values: [-1000000000.0, 1000000000.0] and parameters: {'p_sma': 55, 'p_std': 17, 'p_atr': 16, 'p_adx': 11, 'rsi_period': 19, 'ema1': 25, 'ema2': 24, 'slip_atr_k': 0.21628429829914558, 'slip_spread_k': 0.5023097987033546, 'spread_hl_frac': 0.03827838223783246, 'bb_std_mult': 2.770666121941125, 'rsi_os': 48, 'rsi_ob': 81, 'vol_spike': 0.02389301406254862, 'adx_thresh': 28.821065640307573, 'atr_min_pct': 0.004967457723818954, 'atr_max_pct': 0.10167657719133298, 'tp_mult': 2.460765463439367, 'tsl_mult': 0.511161537796462, 'strategy': 'mean_reversion', 'time_stop': 137, 'use_sma': True, 'use_atr': True, 'use_adx': False, 'use_ema': False, 'use_spike': True, 'rsi_required': True, 'edge_k': 0.04917373349982146, 'edge_cap': 0.7465414903226063, 'bull_strategy': 'mean_reversion', 'bull_bb_std_mult': 1.099535439287934, 'bull_rsi_os': 49, 'bull_rsi_ob': 81, 'bull_adx_thresh': 32.053398307389834, 'bull_atr_min_pct': 0.017845754516470257, 'bull_atr_max_pct': 0.11936502139019364, 'bull_tp_mult': 1.6915264696807277, 'bull_tsl_mult': 0.1726351015505913, 'bull_time_stop': 294, 'bull_use_sma': False, 'bull_use_ema': False, 'bull_use_atr': False, 'bull_use_adx': True, 'bull_use_spike': False, 'bull_rsi_required': False, 'bear_strategy': 'breakout', 'bear_bb_std_mult': 0.9842307630821379, 'bear_rsi_os': 10, 'bear_rsi_ob': 83, 'bear_adx_thresh': 15.32510270033655, 'bear_atr_min_pct': 0.010260476104216817, 'bear_atr_max_pct': 0.04965245116236133, 'bear_tp_mult': 1.2168577705306973, 'bear_tsl_mult': 0.20534408688892375, 'bear_time_stop': 217, 'bear_use_sma': True, 'bear_use_ema': True, 'bear_use_atr': True, 'bear_use_adx': False, 'bear_use_spike': False, 'bear_rsi_required': True, 'sideways_strategy': 'breakout', 'sideways_bb_std_mult': 1.1478696378787236, 'sideways_rsi_os': 37, 'sideways_rsi_ob': 45, 'sideways_adx_thresh': 20.50123281179379, 'sideways_atr_min_pct': 0.026333612364470127, 'sideways_atr_max_pct': 0.02226893575669829, 'sideways_tp_mult': 2.127268230027135, 'sideways_tsl_mult': 0.44135763984593185, 'sideways_time_stop': 208, 'sideways_use_sma': False, 'sideways_use_ema': True, 'sideways_use_atr': False, 'sideways_use_adx': False, 'sideways_use_spike': True, 'sideways_rsi_required': True}.
