[I 2025-08-31 05:55:01,237] Trial 831 finished with values: [-1000000000.0, 1000000000.0] and parameters: {'p_sma': 33, 'p_std': 41, 'p_atr': 12, 'p_adx': 23, 'rsi_period': 14, 'ema1': 17, 'ema2': 17, 'slip_atr_k': 0.009724430105077814, 'slip_spread_k': 0.7652385984788912, 'spread_hl_frac': 0.0025789824850864724, 'bb_std_mult': 3.251843440987822, 'rsi_os': 48, 'rsi_ob': 71, 'vol_spike': 0.09166301312772869, 'adx_thresh': 7.7920386508426125, 'atr_min_pct': 0.010404798637047692, 'atr_max_pct': 0.1157713442036321, 'tp_mult': 2.087913304731674, 'tsl_mult': 0.49220121787106264, 'strategy': 'mean_reversion', 'time_stop': 13, 'use_sma': True, 'use_atr': True, 'use_adx': False, 'use_ema': False, 'use_spike': True, 'rsi_required': True, 'edge_k': 0.8096260721966335, 'edge_cap': 0.34439449099000397, 'bull_strategy': 'breakout', 'bull_bb_std_mult': 1.7980712449882466, 'bull_rsi_os': 35, 'bull_rsi_ob': 72, 'bull_adx_thresh': 33.84302698843494, 'bull_atr_min_pct': 0.01618211404330473, 'bull_atr_max_pct': 0.08401347085392893, 'bull_tp_mult': 1.483094908180071, 'bull_tsl_mult': 0.5565917394024414, 'bull_time_stop': 191, 'bull_use_sma': False, 'bull_use_ema': True, 'bull_use_atr': False, 'bull_use_adx': True, 'bull_use_spike': False, 'bull_rsi_required': False, 'bear_strategy': 'breakout', 'bear_bb_std_mult': 2.139331922141526, 'bear_rsi_os': 5, 'bear_rsi_ob': 57, 'bear_adx_thresh': 14.800821410627343, 'bear_atr_min_pct': 0.0026108346121417724, 'bear_atr_max_pct': 0.12130767173427631, 'bear_tp_mult': 1.1354618758202195, 'bear_tsl_mult': 0.12149162026242406, 'bear_time_stop': 243, 'bear_use_sma': True, 'bear_use_ema': False, 'bear_use_atr': True, 'bear_use_adx': False, 'bear_use_spike': False, 'bear_rsi_required': False, 'sideways_strategy': 'breakout', 'sideways_bb_std_mult': 1.493972873693132, 'sideways_rsi_os': 41, 'sideways_rsi_ob': 46, 'sideways_adx_thresh': 21.41077233934084, 'sideways_atr_min_pct': 0.008615383712042816, 'sideways_atr_max_pct': 0.05135764249977716, 'sideways_tp_mult': 2.334544788643315, 'sideways_tsl_mult': 0.17342901140429076, 'sideways_time_stop': 149, 'sideways_use_sma': True, 'sideways_use_ema': True, 'sideways_use_atr': False, 'sideways_use_adx': False, 'sideways_use_spike': True, 'sideways_rsi_required': True}.
[I 2025-08-31 05:55:02,661] Trial 829 finished with values: [-1000000000.0, 1000000000.0] and parameters: {'p_sma': 33, 'p_std': 41, 'p_atr': 12, 'p_adx': 24, 'rsi_period': 16, 'ema1': 16, 'ema2': 18, 'slip_atr_k': 0.009900576570562319, 'slip_spread_k': 0.8263855853130984, 'spread_hl_frac': 0.001953949062365531, 'bb_std_mult': 3.2852764293934795, 'rsi_os': 47, 'rsi_ob': 71, 'vol_spike': 0.08256180687198372, 'adx_thresh': 7.972554756646842, 'atr_min_pct': 0.010326328522881468, 'atr_max_pct': 0.11544772757734677, 'tp_mult': 2.0705367520976306, 'tsl_mult': 0.48532696573156786, 'strategy': 'mean_reversion', 'time_stop': 5, 'use_sma': False, 'use_atr': True, 'use_adx': True, 'use_ema': True, 'use_spike': True, 'rsi_required': True, 'edge_k': 0.8443923115017569, 'edge_cap': 0.3454166885831608, 'bull_strategy': 'breakout', 'bull_bb_std_mult': 1.8365030566841276, 'bull_rsi_os': 37, 'bull_rsi_ob': 72, 'bull_adx_thresh': 33.836073634533136, 'bull_atr_min_pct': 0.015105467426271004, 'bull_atr_max_pct': 0.08595897667078047, 'bull_tp_mult': 1.4707771067900794, 'bull_tsl_mult': 0.5896913022255275, 'bull_time_stop': 190, 'bull_use_sma': True, 'bull_use_ema': True, 'bull_use_atr': False, 'bull_use_adx': True, 'bull_use_spike': True, 'bull_rsi_required': False, 'bear_strategy': 'breakout', 'bear_bb_std_mult': 2.146464997966175, 'bear_rsi_os': 5, 'bear_rsi_ob': 53, 'bear_adx_thresh': 14.792977924975213, 'bear_atr_min_pct': 0.002306594043115823, 'bear_atr_max_pct': 0.13295202244361753, 'bear_tp_mult': 1.1381628147706349, 'bear_tsl_mult': 0.1251168243440643, 'bear_time_stop': 244, 'bear_use_sma': False, 'bear_use_ema': False, 'bear_use_atr': True, 'bear_use_adx': False, 'bear_use_spike': False, 'bear_rsi_required': False, 'sideways_strategy': 'breakout', 'sideways_bb_std_mult': 1.4843574172922347, 'sideways_rsi_os': 41, 'sideways_rsi_ob': 46, 'sideways_adx_thresh': 20.56286565583475, 'sideways_atr_min_pct': 0.0035861105157011085, 'sideways_atr_max_pct': 0.04829002359954442, 'sideways_tp_mult': 2.3662167492493813, 'sideways_tsl_mult': 0.16415559095633794, 'sideways_time_stop': 141, 'sideways_use_sma': True, 'sideways_use_ema': True, 'sideways_use_atr': True, 'sideways_use_adx': False, 'sideways_use_spike': False, 'sideways_rsi_required': True}.
[I 2025-08-31 05:55:03,588] Trial 830 finished with values: [-0.010980330473819966, 0.010948779912025216] and parameters: {'p_sma': 33, 'p_std': 41, 'p_atr': 12, 'p_adx': 23, 'rsi_period': 16, 'ema1': 16, 'ema2': 17, 'slip_atr_k': 0.010528811279240671, 'slip_spread_k': 0.7629548097545804, 'spread_hl_frac': 0.002467606664683135, 'bb_std_mult': 3.256272639047705, 'rsi_os': 48, 'rsi_ob': 71, 'vol_spike': 0.0925049366595622, 'adx_thresh': 7.866819931815794, 'atr_min_pct': 0.010347180018320527, 'atr_max_pct': 0.11445852866812627, 'tp_mult': 2.0412532596086854, 'tsl_mult': 0.49642043697360344, 'strategy': 'mean_reversion', 'time_stop': 5, 'use_sma': True, 'use_atr': True, 'use_adx': False, 'use_ema': False, 'use_spike': True, 'rsi_required': True, 'edge_k': 0.8712382087963468, 'edge_cap': 0.33768739886039933, 'bull_strategy': 'breakout', 'bull_bb_std_mult': 1.653200720079744, 'bull_rsi_os': 35, 'bull_rsi_ob': 72, 'bull_adx_thresh': 33.82437115478949, 'bull_atr_min_pct': 0.01617252390562724, 'bull_atr_max_pct': 0.08553522330642449, 'bull_tp_mult': 1.4749850141549234, 'bull_tsl_mult': 0.5850834342820831, 'bull_time_stop': 191, 'bull_use_sma': False, 'bull_use_ema': True, 'bull_use_atr': False, 'bull_use_adx': True, 'bull_use_spike': False, 'bull_rsi_required': False, 'bear_strategy': 'breakout', 'bear_bb_std_mult': 2.1381297621823405, 'bear_rsi_os': 5, 'bear_rsi_ob': 57, 'bear_adx_thresh': 14.764804406017172, 'bear_atr_min_pct': 0.0025869345850374212, 'bear_atr_max_pct': 0.1228031111989946, 'bear_tp_mult': 1.1033799169724035, 'bear_tsl_mult': 0.07461028274379894, 'bear_time_stop': 245, 'bear_use_sma': True, 'bear_use_ema': False, 'bear_use_atr': True, 'bear_use_adx': False, 'bear_use_spike': False, 'bear_rsi_required': False, 'sideways_strategy': 'breakout', 'sideways_bb_std_mult': 1.5770639858909148, 'sideways_rsi_os': 41, 'sideways_rsi_ob': 46, 'sideways_adx_thresh': 21.297327459605768, 'sideways_atr_min_pct': 0.0023543033812934823, 'sideways_atr_max_pct': 0.05040786199388449, 'sideways_tp_mult': 2.311150388053479, 'sideways_tsl_mult': 0.19939744619321095, 'sideways_time_stop': 138, 'sideways_use_sma': True, 'sideways_use_ema': True, 'sideways_use_atr': False, 'sideways_use_adx': False, 'sideways_use_spike': True, 'sideways_rsi_required': True}.
[I 2025-08-31 05:55:04,211] Trial 828 finished with values: [-1000000000.0, 1000000000.0] and parameters: {'p_sma': 33, 'p_std': 41, 'p_atr': 12, 'p_adx': 24, 'rsi_period': 15, 'ema1': 16, 'ema2': 18, 'slip_atr_k': 0.010536624506619394, 'slip_spread_k': 0.8218167305878108, 'spread_hl_frac': 0.0021070001769321377, 'bb_std_mult': 3.2420819164378125, 'rsi_os': 48, 'rsi_ob': 71, 'vol_spike': 0.07406604572101992, 'adx_thresh': 7.364394108554795, 'atr_min_pct': 0.010084193984366685, 'atr_max_pct': 0.11529577655561568, 'tp_mult': 2.084518312811837, 'tsl_mult': 0.495362325599277, 'strategy': 'mean_reversion', 'time_stop': 5, 'use_sma': False, 'use_atr': True, 'use_adx': False, 'use_ema': False, 'use_spike': True, 'rsi_required': True, 'edge_k': 0.8292106399222026, 'edge_cap': 0.3366585926027287, 'bull_strategy': 'breakout', 'bull_bb_std_mult': 1.6899083035025755, 'bull_rsi_os': 35, 'bull_rsi_ob': 70, 'bull_adx_thresh': 34.87524411292209, 'bull_atr_min_pct': 0.015084002104621578, 'bull_atr_max_pct': 0.09068479074571024, 'bull_tp_mult': 1.4686659150241705, 'bull_tsl_mult': 0.6491199861610848, 'bull_time_stop': 182, 'bull_use_sma': False, 'bull_use_ema': True, 'bull_use_atr': False, 'bull_use_adx': True, 'bull_use_spike': False, 'bull_rsi_required': False, 'bear_strategy': 'breakout', 'bear_bb_std_mult': 2.10436273299899, 'bear_rsi_os': 5, 'bear_rsi_ob': 57, 'bear_adx_thresh': 14.171556167290984, 'bear_atr_min_pct': 0.0021626567790276633, 'bear_atr_max_pct': 0.13219829635662772, 'bear_tp_mult': 1.149228588334588, 'bear_tsl_mult': 0.09695644236519929, 'bear_time_stop': 245, 'bear_use_sma': True, 'bear_use_ema': False, 'bear_use_atr': False, 'bear_use_adx': False, 'bear_use_spike': False, 'bear_rsi_required': False, 'sideways_strategy': 'breakout', 'sideways_bb_std_mult': 1.4722511247587993, 'sideways_rsi_os': 42, 'sideways_rsi_ob': 45, 'sideways_adx_thresh': 20.355860800724898, 'sideways_atr_min_pct': 0.003794747220465256, 'sideways_atr_max_pct': 0.0542844702831862, 'sideways_tp_mult': 2.3895279670566425, 'sideways_tsl_mult': 0.2421432189560635, 'sideways_time_stop': 134, 'sideways_use_sma': True, 'sideways_use_ema': True, 'sideways_use_atr': False, 'sideways_use_adx': False, 'sideways_use_spike': True, 'sideways_rsi_required': True}.
[I 2025-08-31 05:55:50,604] Trial 833 finished with values: [-0.00913774702875203, 0.00907911045821685] and parameters: {'p_sma': 34, 'p_std': 43, 'p_atr': 11, 'p_adx': 25, 'rsi_period': 16, 'ema1': 17, 'ema2': 20, 'slip_atr_k': 0.0059005413457627045, 'slip_spread_k': 0.7694908061000224, 'spread_hl_frac': 0.0007512753797369229, 'bb_std_mult': 3.2323925554827952, 'rsi_os': 47, 'rsi_ob': 70, 'vol_spike': 0.08297836138601643, 'adx_thresh': 8.307865396366438, 'atr_min_pct': 0.009198292909929599, 'atr_max_pct': 0.11357269071629746, 'tp_mult': 2.1661084261490724, 'tsl_mult': 0.3746095842744045, 'strategy': 'mean_reversion', 'time_stop': 16, 'use_sma': False, 'use_atr': True, 'use_adx': False, 'use_ema': False, 'use_spike': False, 'rsi_required': True, 'edge_k': 0.8688806471878787, 'edge_cap': 0.3387258004445486, 'bull_strategy': 'breakout', 'bull_bb_std_mult': 1.7069125859101366, 'bull_rsi_os': 37, 'bull_rsi_ob': 68, 'bull_adx_thresh': 33.947823700826305, 'bull_atr_min_pct': 0.01618940337368332, 'bull_atr_max_pct': 0.09424605048841578, 'bull_tp_mult': 1.4041458598563143, 'bull_tsl_mult': 0.7008950283889239, 'bull_time_stop': 177, 'bull_use_sma': False, 'bull_use_ema': True, 'bull_use_atr': False, 'bull_use_adx': False, 'bull_use_spike': False, 'bull_rsi_required': False, 'bear_strategy': 'breakout', 'bear_bb_std_mult': 2.1812160375965024, 'bear_rsi_os': 5, 'bear_rsi_ob': 56, 'bear_adx_thresh': 15.044914841747932, 'bear_atr_min_pct': 0.0029852609975614857, 'bear_atr_max_pct': 0.12588942612597995, 'bear_tp_mult': 1.104676449741442, 'bear_tsl_mult': 0.1280282976646352, 'bear_time_stop': 243, 'bear_use_sma': True, 'bear_use_ema': False, 'bear_use_atr': True, 'bear_use_adx': False, 'bear_use_spike': False, 'bear_rsi_required': False, 'sideways_strategy': 'breakout', 'sideways_bb_std_mult': 1.5934685636544594, 'sideways_rsi_os': 41, 'sideways_rsi_ob': 46, 'sideways_adx_thresh': 18.25261011930309, 'sideways_atr_min_pct': 0.002806068573421219, 'sideways_atr_max_pct': 0.05038008608686051, 'sideways_tp_mult': 2.419838234861728, 'sideways_tsl_mult': 0.20551555814330086, 'sideways_time_stop': 129, 'sideways_use_sma': True, 'sideways_use_ema': True, 'sideways_use_atr': False, 'sideways_use_adx': False, 'sideways_use_spike': True, 'sideways_rsi_required': True}.
[I 2025-08-31 05:55:53,073] Trial 832 finished with values: [-0.01271497597925586, 0.012683807475241267] and parameters: {'p_sma': 34, 'p_std': 41, 'p_atr': 12, 'p_adx': 24, 'rsi_period': 16, 'ema1': 17, 'ema2': 18, 'slip_atr_k': 0.006057625676395371, 'slip_spread_k': 0.7688253271607851, 'spread_hl_frac': 0.003003080763548021, 'bb_std_mult': 3.223382940451173, 'rsi_os': 47, 'rsi_ob': 70, 'vol_spike': 0.08433687704958107, 'adx_thresh': 7.891509386859541, 'atr_min_pct': 0.00940901851210443, 'atr_max_pct': 0.11377261723663115, 'tp_mult': 2.1662970181137062, 'tsl_mult': 0.3838710163492398, 'strategy': 'mean_reversion', 'time_stop': 16, 'use_sma': False, 'use_atr': True, 'use_adx': False, 'use_ema': False, 'use_spike': True, 'rsi_required': True, 'edge_k': 0.8547010101048108, 'edge_cap': 0.34339014118356426, 'bull_strategy': 'breakout', 'bull_bb_std_mult': 1.7264902051157158, 'bull_rsi_os': 37, 'bull_rsi_ob': 69, 'bull_adx_thresh': 33.77399056490237, 'bull_atr_min_pct': 0.015118550450113854, 'bull_atr_max_pct': 0.09445610468132878, 'bull_tp_mult': 1.484209728158346, 'bull_tsl_mult': 0.5724944851889711, 'bull_time_stop': 176, 'bull_use_sma': False, 'bull_use_ema': True, 'bull_use_atr': False, 'bull_use_adx': False, 'bull_use_spike': False, 'bull_rsi_required': False, 'bear_strategy': 'breakout', 'bear_bb_std_mult': 2.1345836905816298, 'bear_rsi_os': 5, 'bear_rsi_ob': 58, 'bear_adx_thresh': 14.837188885160591, 'bear_atr_min_pct': 0.0003192222682091748, 'bear_atr_max_pct': 0.12170323737695983, 'bear_tp_mult': 1.112951150004191, 'bear_tsl_mult': 0.0941681616349114, 'bear_time_stop': 244, 'bear_use_sma': True, 'bear_use_ema': False, 'bear_use_atr': True, 'bear_use_adx': False, 'bear_use_spike': False, 'bear_rsi_required': False, 'sideways_strategy': 'breakout', 'sideways_bb_std_mult': 1.5913167902890017, 'sideways_rsi_os': 41, 'sideways_rsi_ob': 46, 'sideways_adx_thresh': 20.668227766347574, 'sideways_atr_min_pct': 0.002209578485592013, 'sideways_atr_max_pct': 0.04910634999497505, 'sideways_tp_mult': 2.3747115588744045, 'sideways_tsl_mult': 0.15725105001580952, 'sideways_time_stop': 143, 'sideways_use_sma': True, 'sideways_use_ema': True, 'sideways_use_atr': False, 'sideways_use_adx': False, 'sideways_use_spike': True, 'sideways_rsi_required': True}.
[I 2025-08-31 05:55:53,637] Trial 835 finished with values: [-0.010255079630833275, 0.0102223120985762] and parameters: {'p_sma': 34, 'p_std': 43, 'p_atr': 11, 'p_adx': 25, 'rsi_period': 16, 'ema1': 17, 'ema2': 20, 'slip_atr_k': 0.005629734643332324, 'slip_spread_k': 0.8350606524364208, 'spread_hl_frac': 0.0029527237451376104, 'bb_std_mult': 3.4189393672430892, 'rsi_os': 47, 'rsi_ob': 70, 'vol_spike': 0.09137832293137044, 'adx_thresh': 7.955313173490406, 'atr_min_pct': 0.009097782530598973, 'atr_max_pct': 0.11350828728232218, 'tp_mult': 1.8396336083823666, 'tsl_mult': 0.3776322422640071, 'strategy': 'mean_reversion', 'time_stop': 16, 'use_sma': True, 'use_atr': True, 'use_adx': False, 'use_ema': False, 'use_spike': False, 'rsi_required': True, 'edge_k': 0.8736184097671876, 'edge_cap': 0.3511001059413805, 'bull_strategy': 'breakout', 'bull_bb_std_mult': 1.6283616236085345, 'bull_rsi_os': 37, 'bull_rsi_ob': 71, 'bull_adx_thresh': 34.00175701465633, 'bull_atr_min_pct': 0.01627258439218469, 'bull_atr_max_pct': 0.08565499285774789, 'bull_tp_mult': 1.4159806224869658, 'bull_tsl_mult': 0.6999122817123136, 'bull_time_stop': 175, 'bull_use_sma': False, 'bull_use_ema': True, 'bull_use_atr': False, 'bull_use_adx': False, 'bull_use_spike': False, 'bull_rsi_required': False, 'bear_strategy': 'breakout', 'bear_bb_std_mult': 2.2117570006128764, 'bear_rsi_os': 5, 'bear_rsi_ob': 56, 'bear_adx_thresh': 14.984815727613473, 'bear_atr_min_pct': 0.0008148546565819141, 'bear_atr_max_pct': 0.12392822864345907, 'bear_tp_mult': 1.1062543779542025, 'bear_tsl_mult': 0.11281462371072469, 'bear_time_stop': 245, 'bear_use_sma': True, 'bear_use_ema': False, 'bear_use_atr': True, 'bear_use_adx': False, 'bear_use_spike': False, 'bear_rsi_required': False, 'sideways_strategy': 'breakout', 'sideways_bb_std_mult': 1.6002873397451778, 'sideways_rsi_os': 41, 'sideways_rsi_ob': 46, 'sideways_adx_thresh': 22.086830213798436, 'sideways_atr_min_pct': 0.002454420640942173, 'sideways_atr_max_pct': 0.050267453502505874, 'sideways_tp_mult': 2.429720683837046, 'sideways_tsl_mult': 0.25212257137490907, 'sideways_time_stop': 143, 'sideways_use_sma': True, 'sideways_use_ema': True, 'sideways_use_atr': False, 'sideways_use_adx': False, 'sideways_use_spike': True, 'sideways_rsi_required': True}.
[I 2025-08-31 05:55:54,449] Trial 834 finished with values: [-0.01059702805513607, 0.010563834919979753] and parameters: {'p_sma': 34, 'p_std': 41, 'p_atr': 11, 'p_adx': 25, 'rsi_period': 14, 'ema1': 17, 'ema2': 20, 'slip_atr_k': 0.01057383896691248, 'slip_spread_k': 0.871100438785105, 'spread_hl_frac': 0.0031116282779939655, 'bb_std_mult': 3.236984207879618, 'rsi_os': 48, 'rsi_ob': 70, 'vol_spike': 0.09319945553702519, 'adx_thresh': 6.07333653966576, 'atr_min_pct': 0.010546025731859652, 'atr_max_pct': 0.11375416361912527, 'tp_mult': 1.9193751020343075, 'tsl_mult': 0.420356657957112, 'strategy': 'mean_reversion', 'time_stop': 15, 'use_sma': False, 'use_atr': True, 'use_adx': False, 'use_ema': False, 'use_spike': True, 'rsi_required': True, 'edge_k': 0.8959727389669061, 'edge_cap': 0.37161173467682534, 'bull_strategy': 'breakout', 'bull_bb_std_mult': 1.6268572817451128, 'bull_rsi_os': 34, 'bull_rsi_ob': 71, 'bull_adx_thresh': 34.161423411007235, 'bull_atr_min_pct': 0.01628766325928618, 'bull_atr_max_pct': 0.08589278207195448, 'bull_tp_mult': 1.4111847678154166, 'bull_tsl_mult': 0.7076353504915532, 'bull_time_stop': 178, 'bull_use_sma': False, 'bull_use_ema': True, 'bull_use_atr': False, 'bull_use_adx': False, 'bull_use_spike': False, 'bull_rsi_required': False, 'bear_strategy': 'breakout', 'bear_bb_std_mult': 2.1896944352234957, 'bear_rsi_os': 5, 'bear_rsi_ob': 56, 'bear_adx_thresh': 14.903244586762826, 'bear_atr_min_pct': 0.0008677132240855116, 'bear_atr_max_pct': 0.12383580077156128, 'bear_tp_mult': 1.111508986361752, 'bear_tsl_mult': 0.07580679792878992, 'bear_time_stop': 241, 'bear_use_sma': True, 'bear_use_ema': False, 'bear_use_atr': True, 'bear_use_adx': False, 'bear_use_spike': False, 'bear_rsi_required': False, 'sideways_strategy': 'breakout', 'sideways_bb_std_mult': 1.6090780711952166, 'sideways_rsi_os': 41, 'sideways_rsi_ob': 46, 'sideways_adx_thresh': 22.423418007752236, 'sideways_atr_min_pct': 0.00251427909516666, 'sideways_atr_max_pct': 0.05063844894585853, 'sideways_tp_mult': 2.417849887869889, 'sideways_tsl_mult': 0.2552595947685459, 'sideways_time_stop': 139, 'sideways_use_sma': True, 'sideways_use_ema': True, 'sideways_use_atr': False, 'sideways_use_adx': False, 'sideways_use_spike': True, 'sideways_rsi_required': True}.
[I 2025-08-31 05:56:39,555] Trial 839 finished with values: [-0.007287853708308867, 0.007462869839380533] and parameters: {'p_sma': 32, 'p_std': 43, 'p_atr': 12, 'p_adx': 25, 'rsi_period': 17, 'ema1': 17, 'ema2': 20, 'slip_atr_k': 0.006508142670433856, 'slip_spread_k': 0.849280707673221, 'spread_hl_frac': 0.0005751094395765833, 'bb_std_mult': 3.4013409686191878, 'rsi_os': 47, 'rsi_ob': 70, 'vol_spike': 0.09225575822571211, 'adx_thresh': 8.214183062961645, 'atr_min_pct': 0.00935546614459782, 'atr_max_pct': 0.11838297214264774, 'tp_mult': 2.1219069830296773, 'tsl_mult': 0.4314202403681507, 'strategy': 'mean_reversion', 'time_stop': 14, 'use_sma': True, 'use_atr': True, 'use_adx': False, 'use_ema': False, 'use_spike': False, 'rsi_required': True, 'edge_k': 0.8827844121089845, 'edge_cap': 0.3594838893845335, 'bull_strategy': 'breakout', 'bull_bb_std_mult': 1.6262275891469624, 'bull_rsi_os': 35, 'bull_rsi_ob': 71, 'bull_adx_thresh': 34.084230614316226, 'bull_atr_min_pct': 0.01598587964246002, 'bull_atr_max_pct': 0.08675106939605157, 'bull_tp_mult': 1.3791427840049129, 'bull_tsl_mult': 0.7087417591561705, 'bull_time_stop': 194, 'bull_use_sma': False, 'bull_use_ema': True, 'bull_use_atr': False, 'bull_use_adx': False, 'bull_use_spike': False, 'bull_rsi_required': False, 'bear_strategy': 'breakout', 'bear_bb_std_mult': 2.2008783547036868, 'bear_rsi_os': 5, 'bear_rsi_ob': 59, 'bear_adx_thresh': 15.167018368283038, 'bear_atr_min_pct': 0.0009523566848657951, 'bear_atr_max_pct': 0.12558361904042212, 'bear_tp_mult': 1.1009457493870909, 'bear_tsl_mult': 0.06669723083505258, 'bear_time_stop': 242, 'bear_use_sma': True, 'bear_use_ema': False, 'bear_use_atr': True, 'bear_use_adx': False, 'bear_use_spike': False, 'bear_rsi_required': False, 'sideways_strategy': 'breakout', 'sideways_bb_std_mult': 1.5863662287240372, 'sideways_rsi_os': 41, 'sideways_rsi_ob': 46, 'sideways_adx_thresh': 22.341105915068248, 'sideways_atr_min_pct': 0.002763808218756383, 'sideways_atr_max_pct': 0.049496413571142844, 'sideways_tp_mult': 2.4222368658553277, 'sideways_tsl_mult': 0.28616573395693906, 'sideways_time_stop': 128, 'sideways_use_sma': True, 'sideways_use_ema': True, 'sideways_use_atr': False, 'sideways_use_adx': False, 'sideways_use_spike': True, 'sideways_rsi_required': False}.
