[I 2025-08-31 05:05:41,345] Trial 557 finished with values: [-1000000000.0, 1000000000.0] and parameters: {'p_sma': 12, 'p_std': 15, 'p_atr': 27, 'p_adx': 9, 'rsi_period': 20, 'ema1': 15, 'ema2': 25, 'slip_atr_k': 0.005479120410438104, 'slip_spread_k': 0.09454513577158247, 'spread_hl_frac': 0.012553633428826358, 'bb_std_mult': 1.921949667094824, 'rsi_os': 6, 'rsi_ob': 60, 'vol_spike': 0.06781507375544953, 'adx_thresh': 11.85826463480452, 'atr_min_pct': 0.0063381695714731425, 'atr_max_pct': 0.010105735860798992, 'tp_mult': 2.515143356640229, 'tsl_mult': 0.6314786532669119, 'strategy': 'mean_reversion', 'time_stop': 42, 'use_sma': False, 'use_atr': False, 'use_adx': False, 'use_ema': False, 'use_spike': True, 'rsi_required': False, 'edge_k': 1.3917002288746099, 'edge_cap': 0.9815775203970609, 'bull_strategy': 'mean_reversion', 'bull_bb_std_mult': 0.8545599807524487, 'bull_rsi_os': 12, 'bull_rsi_ob': 79, 'bull_adx_thresh': 30.99883773886691, 'bull_atr_min_pct': 0.023789851967708227, 'bull_atr_max_pct': 0.0439160280981702, 'bull_tp_mult': 1.0838624984790597, 'bull_tsl_mult': 0.65610094636427, 'bull_time_stop': 126, 'bull_use_sma': False, 'bull_use_ema': True, 'bull_use_atr': True, 'bull_use_adx': True, 'bull_use_spike': False, 'bull_rsi_required': True, 'bear_strategy': 'mean_reversion', 'bear_bb_std_mult': 3.3265887307368036, 'bear_rsi_os': 39, 'bear_rsi_ob': 51, 'bear_adx_thresh': 20.342448900596583, 'bear_atr_min_pct': 0.025555938887143987, 'bear_atr_max_pct': 0.10143506921247115, 'bear_tp_mult': 2.691915972680897, 'bear_tsl_mult': 0.33233011420212694, 'bear_time_stop': 173, 'bear_use_sma': True, 'bear_use_ema': False, 'bear_use_atr': False, 'bear_use_adx': True, 'bear_use_spike': True, 'bear_rsi_required': True, 'sideways_strategy': 'breakout', 'sideways_bb_std_mult': 1.7876097866556169, 'sideways_rsi_os': 28, 'sideways_rsi_ob': 56, 'sideways_adx_thresh': 24.59120682535326, 'sideways_atr_min_pct': 0.027168179844453452, 'sideways_atr_max_pct': 0.11651038504131941, 'sideways_tp_mult': 2.5311684315643688, 'sideways_tsl_mult': 0.5839560067316473, 'sideways_time_stop': 69, 'sideways_use_sma': False, 'sideways_use_ema': False, 'sideways_use_atr': False, 'sideways_use_adx': True, 'sideways_use_spike': True, 'sideways_rsi_required': True}.
[I 2025-08-31 05:05:41,925] Trial 559 finished with values: [-1000000000.0, 1000000000.0] and parameters: {'p_sma': 49, 'p_std': 15, 'p_atr': 27, 'p_adx': 9, 'rsi_period': 28, 'ema1': 14, 'ema2': 30, 'slip_atr_k': 0.01788332347005772, 'slip_spread_k': 0.08463056565173772, 'spread_hl_frac': 0.012408936271787263, 'bb_std_mult': 1.8718158805222067, 'rsi_os': 30, 'rsi_ob': 59, 'vol_spike': 0.07943334563660968, 'adx_thresh': 11.713782741996825, 'atr_min_pct': 0.02356340516085371, 'atr_max_pct': 0.11943065225726895, 'tp_mult': 2.0799599017943464, 'tsl_mult': 0.8125729620011771, 'strategy': 'breakout', 'time_stop': 43, 'use_sma': False, 'use_atr': False, 'use_adx': True, 'use_ema': False, 'use_spike': True, 'rsi_required': False, 'edge_k': 1.3796650421498993, 'edge_cap': 0.798242062598021, 'bull_strategy': 'breakout', 'bull_bb_std_mult': 3.3300334755317884, 'bull_rsi_os': 17, 'bull_rsi_ob': 79, 'bull_adx_thresh': 30.99539568616235, 'bull_atr_min_pct': 0.003523917523481638, 'bull_atr_max_pct': 0.04748508545937936, 'bull_tp_mult': 1.6621216659946727, 'bull_tsl_mult': 0.5815456779778293, 'bull_time_stop': 123, 'bull_use_sma': True, 'bull_use_ema': False, 'bull_use_atr': True, 'bull_use_adx': False, 'bull_use_spike': False, 'bull_rsi_required': True, 'bear_strategy': 'mean_reversion', 'bear_bb_std_mult': 2.1570194018553854, 'bear_rsi_os': 7, 'bear_rsi_ob': 51, 'bear_adx_thresh': 27.60815164988621, 'bear_atr_min_pct': 0.02426156726816152, 'bear_atr_max_pct': 0.04485187908900738, 'bear_tp_mult': 2.6965976219242234, 'bear_tsl_mult': 0.22271802848581385, 'bear_time_stop': 195, 'bear_use_sma': False, 'bear_use_ema': True, 'bear_use_atr': True, 'bear_use_adx': False, 'bear_use_spike': True, 'bear_rsi_required': True, 'sideways_strategy': 'mean_reversion', 'sideways_bb_std_mult': 0.8439606486687823, 'sideways_rsi_os': 40, 'sideways_rsi_ob': 55, 'sideways_adx_thresh': 14.656263161202137, 'sideways_atr_min_pct': 0.01340538699941087, 'sideways_atr_max_pct': 0.10450256783151507, 'sideways_tp_mult': 2.431896897454259, 'sideways_tsl_mult': 0.5854929000345845, 'sideways_time_stop': 78, 'sideways_use_sma': False, 'sideways_use_ema': True, 'sideways_use_atr': True, 'sideways_use_adx': True, 'sideways_use_spike': False, 'sideways_rsi_required': False}.
[I 2025-08-31 05:06:26,882] Trial 563 finished with values: [-1000000000.0, 1000000000.0] and parameters: {'p_sma': 59, 'p_std': 44, 'p_atr': 21, 'p_adx': 8, 'rsi_period': 21, 'ema1': 18, 'ema2': 40, 'slip_atr_k': 0.027019866891497615, 'slip_spread_k': 0.4243812084869994, 'spread_hl_frac': 0.01502808591973869, 'bb_std_mult': 1.9604261189433307, 'rsi_os': 32, 'rsi_ob': 58, 'vol_spike': 0.023798766263549938, 'adx_thresh': 32.36637333219059, 'atr_min_pct': 0.022581649325147075, 'atr_max_pct': 0.028650844368937084, 'tp_mult': 2.4757872949649515, 'tsl_mult': 0.8495925431905627, 'strategy': 'breakout', 'time_stop': 167, 'use_sma': False, 'use_atr': False, 'use_adx': True, 'use_ema': False, 'use_spike': True, 'rsi_required': True, 'edge_k': 1.4180885384235176, 'edge_cap': 0.34161776961796936, 'bull_strategy': 'breakout', 'bull_bb_std_mult': 3.5408253704735477, 'bull_rsi_os': 30, 'bull_rsi_ob': 68, 'bull_adx_thresh': 26.019216656346362, 'bull_atr_min_pct': 0.0022782132959953565, 'bull_atr_max_pct': 0.12273048240693363, 'bull_tp_mult': 2.193808558176999, 'bull_tsl_mult': 0.17305108686633536, 'bull_time_stop': 137, 'bull_use_sma': True, 'bull_use_ema': False, 'bull_use_atr': True, 'bull_use_adx': False, 'bull_use_spike': False, 'bull_rsi_required': False, 'bear_strategy': 'mean_reversion', 'bear_bb_std_mult': 0.7268365051284267, 'bear_rsi_os': 10, 'bear_rsi_ob': 86, 'bear_adx_thresh': 5.052623893350118, 'bear_atr_min_pct': 0.018613014510215985, 'bear_atr_max_pct': 0.050187566731929936, 'bear_tp_mult': 2.2604641922706863, 'bear_tsl_mult': 0.49587229368253605, 'bear_time_stop': 63, 'bear_use_sma': False, 'bear_use_ema': True, 'bear_use_atr': True, 'bear_use_adx': False, 'bear_use_spike': False, 'bear_rsi_required': True, 'sideways_strategy': 'mean_reversion', 'sideways_bb_std_mult': 1.0632699467170939, 'sideways_rsi_os': 54, 'sideways_rsi_ob': 53, 'sideways_adx_thresh': 12.826778680626035, 'sideways_atr_min_pct': 0.010822885238307035, 'sideways_atr_max_pct': 0.11244375730623461, 'sideways_tp_mult': 2.720090189333015, 'sideways_tsl_mult': 0.6711110346990015, 'sideways_time_stop': 232, 'sideways_use_sma': False, 'sideways_use_ema': True, 'sideways_use_atr': True, 'sideways_use_adx': True, 'sideways_use_spike': False, 'sideways_rsi_required': False}.
[I 2025-08-31 05:06:27,691] Trial 561 finished with values: [-1000000000.0, 1000000000.0] and parameters: {'p_sma': 54, 'p_std': 45, 'p_atr': 21, 'p_adx': 9, 'rsi_period': 21, 'ema1': 11, 'ema2': 26, 'slip_atr_k': 0.018839338903877772, 'slip_spread_k': 0.20572650247392127, 'spread_hl_frac': 0.008871169114884782, 'bb_std_mult': 1.841844569472859, 'rsi_os': 27, 'rsi_ob': 52, 'vol_spike': 0.08562985014915862, 'adx_thresh': 9.03121376035416, 'atr_min_pct': 0.02263191282943528, 'atr_max_pct': 0.11288111476314662, 'tp_mult': 1.7310259527949894, 'tsl_mult': 0.8816459168724652, 'strategy': 'breakout', 'time_stop': 132, 'use_sma': False, 'use_atr': False, 'use_adx': True, 'use_ema': False, 'use_spike': True, 'rsi_required': True, 'edge_k': 0.7400616293610179, 'edge_cap': 0.9675106094655403, 'bull_strategy': 'breakout', 'bull_bb_std_mult': 3.359113477354502, 'bull_rsi_os': 11, 'bull_rsi_ob': 79, 'bull_adx_thresh': 10.231174982881, 'bull_atr_min_pct': 0.003561073321816208, 'bull_atr_max_pct': 0.047607403873965386, 'bull_tp_mult': 2.142376443091115, 'bull_tsl_mult': 0.9455449097539826, 'bull_time_stop': 137, 'bull_use_sma': True, 'bull_use_ema': True, 'bull_use_atr': True, 'bull_use_adx': False, 'bull_use_spike': False, 'bull_rsi_required': False, 'bear_strategy': 'mean_reversion', 'bear_bb_std_mult': 3.3250328203500867, 'bear_rsi_os': 10, 'bear_rsi_ob': 69, 'bear_adx_thresh': 21.751413233155674, 'bear_atr_min_pct': 0.024166997725296017, 'bear_atr_max_pct': 0.04727841896592027, 'bear_tp_mult': 2.694908693048389, 'bear_tsl_mult': 0.5617569272520655, 'bear_time_stop': 156, 'bear_use_sma': False, 'bear_use_ema': False, 'bear_use_atr': True, 'bear_use_adx': False, 'bear_use_spike': False, 'bear_rsi_required': True, 'sideways_strategy': 'mean_reversion', 'sideways_bb_std_mult': 1.1386576460210784, 'sideways_rsi_os': 40, 'sideways_rsi_ob': 52, 'sideways_adx_thresh': 18.237519601305635, 'sideways_atr_min_pct': 0.010994281866891581, 'sideways_atr_max_pct': 0.11213220604549747, 'sideways_tp_mult': 2.060653686212791, 'sideways_tsl_mult': 0.594071509097967, 'sideways_time_stop': 81, 'sideways_use_sma': False, 'sideways_use_ema': True, 'sideways_use_atr': True, 'sideways_use_adx': True, 'sideways_use_spike': False, 'sideways_rsi_required': False}.
[I 2025-08-31 05:06:28,045] Trial 562 finished with values: [-1000000000.0, 1000000000.0] and parameters: {'p_sma': 15, 'p_std': 17, 'p_atr': 21, 'p_adx': 9, 'rsi_period': 27, 'ema1': 20, 'ema2': 40, 'slip_atr_k': 0.019261129507777284, 'slip_spread_k': 0.42423904085372616, 'spread_hl_frac': 0.010574478198312002, 'bb_std_mult': 1.8588447289141508, 'rsi_os': 34, 'rsi_ob': 95, 'vol_spike': 0.020680583822424305, 'adx_thresh': 8.901687500425115, 'atr_min_pct': 0.022849766659703147, 'atr_max_pct': 0.11923143378593651, 'tp_mult': 2.4656871343132063, 'tsl_mult': 0.8732650174615307, 'strategy': 'breakout', 'time_stop': 175, 'use_sma': False, 'use_atr': False, 'use_adx': True, 'use_ema': False, 'use_spike': True, 'rsi_required': True, 'edge_k': 1.544557083840001, 'edge_cap': 0.9670955236384197, 'bull_strategy': 'breakout', 'bull_bb_std_mult': 3.3483874796642654, 'bull_rsi_os': 14, 'bull_rsi_ob': 59, 'bull_adx_thresh': 10.190611971314594, 'bull_atr_min_pct': 0.0021833674124298015, 'bull_atr_max_pct': 0.033129220446102316, 'bull_tp_mult': 2.264310677594938, 'bull_tsl_mult': 0.9427792512177402, 'bull_time_stop': 138, 'bull_use_sma': True, 'bull_use_ema': False, 'bull_use_atr': True, 'bull_use_adx': False, 'bull_use_spike': False, 'bull_rsi_required': False, 'bear_strategy': 'mean_reversion', 'bear_bb_std_mult': 2.294374299221947, 'bear_rsi_os': 31, 'bear_rsi_ob': 92, 'bear_adx_thresh': 21.64108868853136, 'bear_atr_min_pct': 0.027781798722574955, 'bear_atr_max_pct': 0.045107547832059156, 'bear_tp_mult': 2.809685950157318, 'bear_tsl_mult': 0.8816248607147772, 'bear_time_stop': 157, 'bear_use_sma': False, 'bear_use_ema': True, 'bear_use_atr': True, 'bear_use_adx': False, 'bear_use_spike': False, 'bear_rsi_required': True, 'sideways_strategy': 'mean_reversion', 'sideways_bb_std_mult': 1.0551310673777985, 'sideways_rsi_os': 25, 'sideways_rsi_ob': 55, 'sideways_adx_thresh': 12.805307128527181, 'sideways_atr_min_pct': 0.013636791648604218, 'sideways_atr_max_pct': 0.1130802682101136, 'sideways_tp_mult': 1.2275312469272888, 'sideways_tsl_mult': 0.66925326392846, 'sideways_time_stop': 79, 'sideways_use_sma': False, 'sideways_use_ema': True, 'sideways_use_atr': True, 'sideways_use_adx': True, 'sideways_use_spike': False, 'sideways_rsi_required': False}.
[I 2025-08-31 05:06:28,347] Trial 560 finished with values: [-1000000000.0, 1000000000.0] and parameters: {'p_sma': 24, 'p_std': 38, 'p_atr': 24, 'p_adx': 9, 'rsi_period': 21, 'ema1': 27, 'ema2': 30, 'slip_atr_k': 0.0044760889457283615, 'slip_spread_k': 0.07372043677402551, 'spread_hl_frac': 0.008188359703096742, 'bb_std_mult': 1.8533282052559434, 'rsi_os': 32, 'rsi_ob': 50, 'vol_spike': 0.023071752080797012, 'adx_thresh': 11.63728375238865, 'atr_min_pct': 0.006028373658221052, 'atr_max_pct': 0.044325895743308946, 'tp_mult': 1.9934386299467766, 'tsl_mult': 0.874828004548091, 'strategy': 'breakout', 'time_stop': 176, 'use_sma': False, 'use_atr': False, 'use_adx': True, 'use_ema': False, 'use_spike': True, 'rsi_required': True, 'edge_k': 1.3837221053067559, 'edge_cap': 0.9676184141974449, 'bull_strategy': 'breakout', 'bull_bb_std_mult': 3.340740950112371, 'bull_rsi_os': 11, 'bull_rsi_ob': 79, 'bull_adx_thresh': 10.136334614320376, 'bull_atr_min_pct': 0.003522383629472315, 'bull_atr_max_pct': 0.04744002249029511, 'bull_tp_mult': 2.9620448964820887, 'bull_tsl_mult': 0.996862507829642, 'bull_time_stop': 5, 'bull_use_sma': True, 'bull_use_ema': False, 'bull_use_atr': True, 'bull_use_adx': False, 'bull_use_spike': False, 'bull_rsi_required': False, 'bear_strategy': 'mean_reversion', 'bear_bb_std_mult': 2.1464318643581635, 'bear_rsi_os': 9, 'bear_rsi_ob': 51, 'bear_adx_thresh': 21.55933023029623, 'bear_atr_min_pct': 0.013660364420509934, 'bear_atr_max_pct': 0.04483451806435166, 'bear_tp_mult': 1.5603309577540159, 'bear_tsl_mult': 0.26723972849266864, 'bear_time_stop': 110, 'bear_use_sma': False, 'bear_use_ema': True, 'bear_use_atr': True, 'bear_use_adx': False, 'bear_use_spike': True, 'bear_rsi_required': True, 'sideways_strategy': 'mean_reversion', 'sideways_bb_std_mult': 0.8326251170149694, 'sideways_rsi_os': 46, 'sideways_rsi_ob': 46, 'sideways_adx_thresh': 10.474974649008105, 'sideways_atr_min_pct': 0.013704897005474207, 'sideways_atr_max_pct': 0.1041373535725528, 'sideways_tp_mult': 2.998002445150958, 'sideways_tsl_mult': 0.5823007537118164, 'sideways_time_stop': 244, 'sideways_use_sma': False, 'sideways_use_ema': True, 'sideways_use_atr': True, 'sideways_use_adx': True, 'sideways_use_spike': False, 'sideways_rsi_required': False}.
[I 2025-08-31 05:07:13,712] Trial 567 finished with values: [-0.012854029627283658, 0.01278701918968886] and parameters: {'p_sma': 56, 'p_std': 19, 'p_atr': 23, 'p_adx': 8, 'rsi_period': 24, 'ema1': 14, 'ema2': 26, 'slip_atr_k': 0.03118763513086694, 'slip_spread_k': 0.8577947422986377, 'spread_hl_frac': 0.027091428991365202, 'bb_std_mult': 1.9478664328800093, 'rsi_os': 47, 'rsi_ob': 59, 'vol_spike': 0.042268423314807645, 'adx_thresh': 34.330541563717595, 'atr_min_pct': 0.018967535081194902, 'atr_max_pct': 0.12538357904138991, 'tp_mult': 2.5635172527910624, 'tsl_mult': 0.5594414126520617, 'strategy': 'mean_reversion', 'time_stop': 25, 'use_sma': True, 'use_atr': True, 'use_adx': False, 'use_ema': True, 'use_spike': False, 'rsi_required': False, 'edge_k': 1.3302461981822027, 'edge_cap': 0.39949190836437476, 'bull_strategy': 'mean_reversion', 'bull_bb_std_mult': 1.5111800060532015, 'bull_rsi_os': 15, 'bull_rsi_ob': 77, 'bull_adx_thresh': 34.993644008887856, 'bull_atr_min_pct': 0.0016413936584454409, 'bull_atr_max_pct': 0.08458619297722156, 'bull_tp_mult': 1.6167564849788327, 'bull_tsl_mult': 0.8497799711067634, 'bull_time_stop': 144, 'bull_use_sma': False, 'bull_use_ema': False, 'bull_use_atr': False, 'bull_use_adx': True, 'bull_use_spike': True, 'bull_rsi_required': True, 'bear_strategy': 'breakout', 'bear_bb_std_mult': 0.8542682764613577, 'bear_rsi_os': 11, 'bear_rsi_ob': 53, 'bear_adx_thresh': 19.583040273466963, 'bear_atr_min_pct': 0.021762335638423346, 'bear_atr_max_pct': 0.03927829612524244, 'bear_tp_mult': 2.741075267415978, 'bear_tsl_mult': 0.1718911240021645, 'bear_time_stop': 83, 'bear_use_sma': True, 'bear_use_ema': True, 'bear_use_atr': False, 'bear_use_adx': True, 'bear_use_spike': True, 'bear_rsi_required': False, 'sideways_strategy': 'breakout', 'sideways_bb_std_mult': 2.0038525056599195, 'sideways_rsi_os': 9, 'sideways_rsi_ob': 54, 'sideways_adx_thresh': 11.166689412569298, 'sideways_atr_min_pct': 0.01193906271362826, 'sideways_atr_max_pct': 0.09915674102204497, 'sideways_tp_mult': 1.8855965062386235, 'sideways_tsl_mult': 0.6354666163456189, 'sideways_time_stop': 162, 'sideways_use_sma': True, 'sideways_use_ema': False, 'sideways_use_atr': False, 'sideways_use_adx': False, 'sideways_use_spike': True, 'sideways_rsi_required': True}.
[I 2025-08-31 05:07:13,748] Trial 565 finished with values: [-0.018923129739507605, 0.01884394211844237] and parameters: {'p_sma': 56, 'p_std': 17, 'p_atr': 18, 'p_adx': 9, 'rsi_period': 78, 'ema1': 14, 'ema2': 44, 'slip_atr_k': 0.24939032216280022, 'slip_spread_k': 0.31272188200343737, 'spread_hl_frac': 0.026940874525894935, 'bb_std_mult': 1.9554023830699097, 'rsi_os': 19, 'rsi_ob': 61, 'vol_spike': 0.022148717012136446, 'adx_thresh': 13.298820891199195, 'atr_min_pct': 0.019058138401668135, 'atr_max_pct': 0.11657029974662352, 'tp_mult': 1.1356268220350068, 'tsl_mult': 0.04228878996491814, 'strategy': 'mean_reversion', 'time_stop': 77, 'use_sma': False, 'use_atr': False, 'use_adx': False, 'use_ema': True, 'use_spike': False, 'rsi_required': False, 'edge_k': 1.3324682080949122, 'edge_cap': 0.9992689505473485, 'bull_strategy': 'mean_reversion', 'bull_bb_std_mult': 1.3256391763182382, 'bull_rsi_os': 15, 'bull_rsi_ob': 76, 'bull_adx_thresh': 9.454793928902156, 'bull_atr_min_pct': 0.0015498732151312121, 'bull_atr_max_pct': 0.0338174939091633, 'bull_tp_mult': 1.6127093050092396, 'bull_tsl_mult': 0.8387118052154137, 'bull_time_stop': 241, 'bull_use_sma': False, 'bull_use_ema': False, 'bull_use_atr': True, 'bull_use_adx': True, 'bull_use_spike': True, 'bull_rsi_required': True, 'bear_strategy': 'mean_reversion', 'bear_bb_std_mult': 1.57607077840124, 'bear_rsi_os': 9, 'bear_rsi_ob': 45, 'bear_adx_thresh': 19.561477046735323, 'bear_atr_min_pct': 0.013246478071100213, 'bear_atr_max_pct': 0.05735680832742666, 'bear_tp_mult': 1.5456534221818379, 'bear_tsl_mult': 0.2596095844384169, 'bear_time_stop': 84, 'bear_use_sma': True, 'bear_use_ema': True, 'bear_use_atr': True, 'bear_use_adx': True, 'bear_use_spike': True, 'bear_rsi_required': True, 'sideways_strategy': 'breakout', 'sideways_bb_std_mult': 1.2397311961764745, 'sideways_rsi_os': 9, 'sideways_rsi_ob': 54, 'sideways_adx_thresh': 10.492746399701979, 'sideways_atr_min_pct': 0.013483836074421223, 'sideways_atr_max_pct': 0.11387592909087596, 'sideways_tp_mult': 1.2298217614724472, 'sideways_tsl_mult': 0.6401962584015872, 'sideways_time_stop': 60, 'sideways_use_sma': True, 'sideways_use_ema': False, 'sideways_use_atr': False, 'sideways_use_adx': True, 'sideways_use_spike': True, 'sideways_rsi_required': True}.
[I 2025-08-31 05:07:14,588] Trial 564 finished with values: [-1000000000.0, 1000000000.0] and parameters: {'p_sma': 22, 'p_std': 17, 'p_atr': 23, 'p_adx': 9, 'rsi_period': 26, 'ema1': 7, 'ema2': 27, 'slip_atr_k': 0.08691169010094515, 'slip_spread_k': 0.3119559573416544, 'spread_hl_frac': 0.009060200418509185, 'bb_std_mult': 1.833074795853867, 'rsi_os': 48, 'rsi_ob': 61, 'vol_spike': 0.1093107848601064, 'adx_thresh': 25.557587863211573, 'atr_min_pct': 0.022721302045315642, 'atr_max_pct': 0.11254594091437078, 'tp_mult': 1.9871134917503097, 'tsl_mult': 0.8762541434494701, 'strategy': 'breakout', 'time_stop': 78, 'use_sma': False, 'use_atr': False, 'use_adx': False, 'use_ema': False, 'use_spike': True, 'rsi_required': True, 'edge_k': 1.319858607256991, 'edge_cap': 0.9664603894625152, 'bull_strategy': 'mean_reversion', 'bull_bb_std_mult': 3.3564519456156754, 'bull_rsi_os': 14, 'bull_rsi_ob': 94, 'bull_adx_thresh': 10.096722352914803, 'bull_atr_min_pct': 0.001520720302422734, 'bull_atr_max_pct': 0.10894916375371337, 'bull_tp_mult': 2.96516026015008, 'bull_tsl_mult': 0.9427021085801914, 'bull_time_stop': 142, 'bull_use_sma': False, 'bull_use_ema': True, 'bull_use_atr': True, 'bull_use_adx': True, 'bull_use_spike': False, 'bull_rsi_required': False, 'bear_strategy': 'mean_reversion', 'bear_bb_std_mult': 0.884959415747149, 'bear_rsi_os': 11, 'bear_rsi_ob': 92, 'bear_adx_thresh': 21.777675009980868, 'bear_atr_min_pct': 0.013655497377492994, 'bear_atr_max_pct': 0.04690226153806798, 'bear_tp_mult': 2.7990787530541987, 'bear_tsl_mult': 0.8876174107640888, 'bear_time_stop': 135, 'bear_use_sma': True, 'bear_use_ema': False, 'bear_use_atr': True, 'bear_use_adx': True, 'bear_use_spike': False, 'bear_rsi_required': True, 'sideways_strategy': 'mean_reversion', 'sideways_bb_std_mult': 1.1643835076781759, 'sideways_rsi_os': 25, 'sideways_rsi_ob': 52, 'sideways_adx_thresh': 23.222891361695588, 'sideways_atr_min_pct': 0.014004782567680096, 'sideways_atr_max_pct': 0.11209639708903442, 'sideways_tp_mult': 2.0597569058936265, 'sideways_tsl_mult': 0.640862966658501, 'sideways_time_stop': 60, 'sideways_use_sma': False, 'sideways_use_ema': False, 'sideways_use_atr': False, 'sideways_use_adx': True, 'sideways_use_spike': True, 'sideways_rsi_required': True}.
