[I 2025-08-31 04:49:13,564] Trial 468 finished with values: [-1000000000.0, 1000000000.0] and parameters: {'p_sma': 52, 'p_std': 33, 'p_atr': 23, 'p_adx': 9, 'rsi_period': 17, 'ema1': 20, 'ema2': 12, 'slip_atr_k': 0.02411735314595973, 'slip_spread_k': 0.9749377348358581, 'spread_hl_frac': 0.008086269227030669, 'bb_std_mult': 2.0755397855274973, 'rsi_os': 55, 'rsi_ob': 87, 'vol_spike': 0.01620285626916604, 'adx_thresh': 22.92766712084099, 'atr_min_pct': 0.008074845452852166, 'atr_max_pct': 0.016090126051881787, 'tp_mult': 2.450904951113468, 'tsl_mult': 0.9110090711788884, 'strategy': 'breakout', 'time_stop': 181, 'use_sma': False, 'use_atr': False, 'use_adx': False, 'use_ema': False, 'use_spike': True, 'rsi_required': False, 'edge_k': 1.9730756684700712, 'edge_cap': 0.9730894894990189, 'bull_strategy': 'mean_reversion', 'bull_bb_std_mult': 1.1524894759066533, 'bull_rsi_os': 53, 'bull_rsi_ob': 75, 'bull_adx_thresh': 14.490757905212773, 'bull_atr_min_pct': 0.025066378904782416, 'bull_atr_max_pct': 0.03058366994967672, 'bull_tp_mult': 1.2890848610933707, 'bull_tsl_mult': 0.5200859573041603, 'bull_time_stop': 19, 'bull_use_sma': False, 'bull_use_ema': False, 'bull_use_atr': True, 'bull_use_adx': True, 'bull_use_spike': False, 'bull_rsi_required': True, 'bear_strategy': 'mean_reversion', 'bear_bb_std_mult': 0.8423494630602982, 'bear_rsi_os': 27, 'bear_rsi_ob': 46, 'bear_adx_thresh': 30.437264982367623, 'bear_atr_min_pct': 0.027001803769405162, 'bear_atr_max_pct': 0.13232752638170864, 'bear_tp_mult': 2.8398523158773856, 'bear_tsl_mult': 0.19958391760114924, 'bear_time_stop': 102, 'bear_use_sma': True, 'bear_use_ema': True, 'bear_use_atr': True, 'bear_use_adx': True, 'bear_use_spike': True, 'bear_rsi_required': True, 'sideways_strategy': 'mean_reversion', 'sideways_bb_std_mult': 1.7788891836906597, 'sideways_rsi_os': 27, 'sideways_rsi_ob': 57, 'sideways_adx_thresh': 11.200586220201796, 'sideways_atr_min_pct': 0.014151242624297662, 'sideways_atr_max_pct': 0.05941721607515003, 'sideways_tp_mult': 1.1504925148995224, 'sideways_tsl_mult': 0.27564507479266065, 'sideways_time_stop': 5, 'sideways_use_sma': False, 'sideways_use_ema': False, 'sideways_use_atr': False, 'sideways_use_adx': True, 'sideways_use_spike': True, 'sideways_rsi_required': True}.
[I 2025-08-31 04:49:13,774] Trial 466 finished with values: [-1000000000.0, 1000000000.0] and parameters: {'p_sma': 55, 'p_std': 23, 'p_atr': 23, 'p_adx': 9, 'rsi_period': 17, 'ema1': 23, 'ema2': 25, 'slip_atr_k': 0.022805525156558922, 'slip_spread_k': 0.06562235195024171, 'spread_hl_frac': 0.00966831896079692, 'bb_std_mult': 2.059275771797131, 'rsi_os': 33, 'rsi_ob': 61, 'vol_spike': 0.01460201559340959, 'adx_thresh': 11.504170628102894, 'atr_min_pct': 0.02275748495417972, 'atr_max_pct': 0.12324135783724953, 'tp_mult': 2.6451146343397727, 'tsl_mult': 0.9008788004193324, 'strategy': 'breakout', 'time_stop': 79, 'use_sma': False, 'use_atr': False, 'use_adx': False, 'use_ema': False, 'use_spike': True, 'rsi_required': True, 'edge_k': 1.3369927552387253, 'edge_cap': 0.9698229299200073, 'bull_strategy': 'mean_reversion', 'bull_bb_std_mult': 1.164626476578208, 'bull_rsi_os': 12, 'bull_rsi_ob': 77, 'bull_adx_thresh': 13.451979775777541, 'bull_atr_min_pct': 0.025572993346030012, 'bull_atr_max_pct': 0.06321875788078646, 'bull_tp_mult': 1.5379418326713656, 'bull_tsl_mult': 0.9343280631384753, 'bull_time_stop': 141, 'bull_use_sma': False, 'bull_use_ema': False, 'bull_use_atr': True, 'bull_use_adx': True, 'bull_use_spike': False, 'bull_rsi_required': True, 'bear_strategy': 'mean_reversion', 'bear_bb_std_mult': 2.67127448712758, 'bear_rsi_os': 17, 'bear_rsi_ob': 57, 'bear_adx_thresh': 22.30936706626912, 'bear_atr_min_pct': 0.025604546978543027, 'bear_atr_max_pct': 0.10784679156470119, 'bear_tp_mult': 2.8147457173116393, 'bear_tsl_mult': 0.21160402283451138, 'bear_time_stop': 199, 'bear_use_sma': True, 'bear_use_ema': True, 'bear_use_atr': True, 'bear_use_adx': True, 'bear_use_spike': True, 'bear_rsi_required': True, 'sideways_strategy': 'mean_reversion', 'sideways_bb_std_mult': 2.3666613723267216, 'sideways_rsi_os': 27, 'sideways_rsi_ob': 76, 'sideways_adx_thresh': 11.067343318807366, 'sideways_atr_min_pct': 0.014711092203714445, 'sideways_atr_max_pct': 0.08211785065693541, 'sideways_tp_mult': 2.0528925525191033, 'sideways_tsl_mult': 0.6544917565844424, 'sideways_time_stop': 77, 'sideways_use_sma': False, 'sideways_use_ema': False, 'sideways_use_atr': False, 'sideways_use_adx': True, 'sideways_use_spike': True, 'sideways_rsi_required': True}.
[I 2025-08-31 04:49:14,198] Trial 470 finished with values: [-1000000000.0, 1000000000.0] and parameters: {'p_sma': 19, 'p_std': 17, 'p_atr': 10, 'p_adx': 9, 'rsi_period': 40, 'ema1': 12, 'ema2': 48, 'slip_atr_k': 0.13617249329248585, 'slip_spread_k': 0.08231388353399974, 'spread_hl_frac': 0.001911305361727362, 'bb_std_mult': 2.2893340996190976, 'rsi_os': 30, 'rsi_ob': 62, 'vol_spike': 0.031960196176951165, 'adx_thresh': 34.97707586995578, 'atr_min_pct': 0.023454987973250088, 'atr_max_pct': 0.12739015069742532, 'tp_mult': 2.002711070033278, 'tsl_mult': 0.9157376373689325, 'strategy': 'breakout', 'time_stop': 183, 'use_sma': False, 'use_atr': False, 'use_adx': False, 'use_ema': False, 'use_spike': True, 'rsi_required': False, 'edge_k': 1.5603868706072552, 'edge_cap': 0.8102659320379535, 'bull_strategy': 'breakout', 'bull_bb_std_mult': 1.6185005464931064, 'bull_rsi_os': 26, 'bull_rsi_ob': 54, 'bull_adx_thresh': 16.849855322267857, 'bull_atr_min_pct': 0.025534239102028934, 'bull_atr_max_pct': 0.06885395078880475, 'bull_tp_mult': 1.6349699570459648, 'bull_tsl_mult': 0.19797502101666647, 'bull_time_stop': 178, 'bull_use_sma': False, 'bull_use_ema': True, 'bull_use_atr': True, 'bull_use_adx': True, 'bull_use_spike': False, 'bull_rsi_required': True, 'bear_strategy': 'mean_reversion', 'bear_bb_std_mult': 2.6601196008367722, 'bear_rsi_os': 8, 'bear_rsi_ob': 57, 'bear_adx_thresh': 22.18823222239081, 'bear_atr_min_pct': 0.022184503613744255, 'bear_atr_max_pct': 0.04299845932360696, 'bear_tp_mult': 2.6251566578600976, 'bear_tsl_mult': 0.2060537751451934, 'bear_time_stop': 170, 'bear_use_sma': True, 'bear_use_ema': False, 'bear_use_atr': True, 'bear_use_adx': True, 'bear_use_spike': False, 'bear_rsi_required': True, 'sideways_strategy': 'mean_reversion', 'sideways_bb_std_mult': 1.013703327315912, 'sideways_rsi_os': 27, 'sideways_rsi_ob': 45, 'sideways_adx_thresh': 24.789289901963887, 'sideways_atr_min_pct': 0.014181248847274189, 'sideways_atr_max_pct': 0.048214928211907274, 'sideways_tp_mult': 1.909941455088651, 'sideways_tsl_mult': 0.379903039361711, 'sideways_time_stop': 137, 'sideways_use_sma': False, 'sideways_use_ema': False, 'sideways_use_atr': False, 'sideways_use_adx': True, 'sideways_use_spike': True, 'sideways_rsi_required': True}.
[I 2025-08-31 04:49:58,614] Trial 471 finished with values: [-0.027349580595816603, 0.02740236738231638] and parameters: {'p_sma': 58, 'p_std': 57, 'p_atr': 20, 'p_adx': 8, 'rsi_period': 24, 'ema1': 12, 'ema2': 25, 'slip_atr_k': 0.029396263512267113, 'slip_spread_k': 0.7772974354189088, 'spread_hl_frac': 0.03286330866532123, 'bb_std_mult': 1.8271596100469627, 'rsi_os': 30, 'rsi_ob': 61, 'vol_spike': 0.03259343512053524, 'adx_thresh': 13.459441535383604, 'atr_min_pct': 0.00999339359526099, 'atr_max_pct': 0.12593405288280202, 'tp_mult': 2.615233992166277, 'tsl_mult': 0.9118813987369127, 'strategy': 'breakout', 'time_stop': 239, 'use_sma': False, 'use_atr': False, 'use_adx': False, 'use_ema': False, 'use_spike': True, 'rsi_required': False, 'edge_k': 1.5414999404368646, 'edge_cap': 0.3613183893159961, 'bull_strategy': 'breakout', 'bull_bb_std_mult': 1.9607155347488185, 'bull_rsi_os': 15, 'bull_rsi_ob': 59, 'bull_adx_thresh': 14.527790673626043, 'bull_atr_min_pct': 0.00659651506672914, 'bull_atr_max_pct': 0.14027068985940014, 'bull_tp_mult': 1.6077967059066094, 'bull_tsl_mult': 0.19120827744246927, 'bull_time_stop': 153, 'bull_use_sma': False, 'bull_use_ema': True, 'bull_use_atr': True, 'bull_use_adx': True, 'bull_use_spike': False, 'bull_rsi_required': True, 'bear_strategy': 'mean_reversion', 'bear_bb_std_mult': 0.8337643435597056, 'bear_rsi_os': 17, 'bear_rsi_ob': 46, 'bear_adx_thresh': 21.644881470494333, 'bear_atr_min_pct': 0.0003976952830485707, 'bear_atr_max_pct': 0.04429497948472199, 'bear_tp_mult': 1.2344133719781256, 'bear_tsl_mult': 0.20908114727393115, 'bear_time_stop': 104, 'bear_use_sma': True, 'bear_use_ema': False, 'bear_use_atr': True, 'bear_use_adx': True, 'bear_use_spike': False, 'bear_rsi_required': True, 'sideways_strategy': 'mean_reversion', 'sideways_bb_std_mult': 3.3042515147934237, 'sideways_rsi_os': 27, 'sideways_rsi_ob': 46, 'sideways_adx_thresh': 9.703302773403644, 'sideways_atr_min_pct': 0.014272717554589852, 'sideways_atr_max_pct': 0.11414088739473514, 'sideways_tp_mult': 2.480986434944273, 'sideways_tsl_mult': 0.30611186883942176, 'sideways_time_stop': 54, 'sideways_use_sma': False, 'sideways_use_ema': False, 'sideways_use_atr': False, 'sideways_use_adx': True, 'sideways_use_spike': True, 'sideways_rsi_required': True}.
[I 2025-08-31 04:49:59,254] Trial 472 finished with values: [-1000000000.0, 1000000000.0] and parameters: {'p_sma': 58, 'p_std': 14, 'p_atr': 27, 'p_adx': 8, 'rsi_period': 24, 'ema1': 12, 'ema2': 46, 'slip_atr_k': 0.017430901076120317, 'slip_spread_k': 0.7814187337068239, 'spread_hl_frac': 0.010139805520649615, 'bb_std_mult': 1.810068935880325, 'rsi_os': 18, 'rsi_ob': 62, 'vol_spike': 0.28134366500422703, 'adx_thresh': 13.477792496997196, 'atr_min_pct': 0.028836611414304644, 'atr_max_pct': 0.05922167453594378, 'tp_mult': 2.649342383740966, 'tsl_mult': 0.8314918582288804, 'strategy': 'breakout', 'time_stop': 36, 'use_sma': False, 'use_atr': True, 'use_adx': True, 'use_ema': False, 'use_spike': True, 'rsi_required': False, 'edge_k': 0.7330344392792858, 'edge_cap': 0.9453626330415555, 'bull_strategy': 'breakout', 'bull_bb_std_mult': 3.5133130444982665, 'bull_rsi_os': 26, 'bull_rsi_ob': 60, 'bull_adx_thresh': 6.260333153132327, 'bull_atr_min_pct': 0.02581672812632621, 'bull_atr_max_pct': 0.056572466931801256, 'bull_tp_mult': 1.6047101598168216, 'bull_tsl_mult': 0.7397373483175047, 'bull_time_stop': 138, 'bull_use_sma': True, 'bull_use_ema': True, 'bull_use_atr': True, 'bull_use_adx': False, 'bull_use_spike': False, 'bull_rsi_required': True, 'bear_strategy': 'mean_reversion', 'bear_bb_std_mult': 1.0452487339700793, 'bear_rsi_os': 8, 'bear_rsi_ob': 47, 'bear_adx_thresh': 6.2244650372618455, 'bear_atr_min_pct': 0.023560323489757926, 'bear_atr_max_pct': 0.1358752821258196, 'bear_tp_mult': 2.776208981921956, 'bear_tsl_mult': 0.03627954042595333, 'bear_time_stop': 199, 'bear_use_sma': False, 'bear_use_ema': False, 'bear_use_atr': True, 'bear_use_adx': True, 'bear_use_spike': False, 'bear_rsi_required': True, 'sideways_strategy': 'mean_reversion', 'sideways_bb_std_mult': 0.9029497782037648, 'sideways_rsi_os': 9, 'sideways_rsi_ob': 85, 'sideways_adx_thresh': 9.879729742209058, 'sideways_atr_min_pct': 0.013566659425475905, 'sideways_atr_max_pct': 0.10552892948673294, 'sideways_tp_mult': 2.9488506995095314, 'sideways_tsl_mult': 0.6960053314552823, 'sideways_time_stop': 51, 'sideways_use_sma': True, 'sideways_use_ema': True, 'sideways_use_atr': True, 'sideways_use_adx': False, 'sideways_use_spike': False, 'sideways_rsi_required': False}.
[I 2025-08-31 04:49:59,739] Trial 474 finished with values: [-1000000000.0, 1000000000.0] and parameters: {'p_sma': 59, 'p_std': 16, 'p_atr': 24, 'p_adx': 8, 'rsi_period': 24, 'ema1': 11, 'ema2': 44, 'slip_atr_k': 0.24250495444415304, 'slip_spread_k': 0.7771367047931426, 'spread_hl_frac': 0.032313006005080844, 'bb_std_mult': 0.6517146866481649, 'rsi_os': 31, 'rsi_ob': 90, 'vol_spike': 0.2825381247231341, 'adx_thresh': 12.692606381795661, 'atr_min_pct': 0.014563592775698738, 'atr_max_pct': 0.12625830688615178, 'tp_mult': 2.5830625982102196, 'tsl_mult': 0.8292006663425135, 'strategy': 'breakout', 'time_stop': 48, 'use_sma': True, 'use_atr': True, 'use_adx': True, 'use_ema': False, 'use_spike': True, 'rsi_required': False, 'edge_k': 1.5285612334661465, 'edge_cap': 0.2161599965728978, 'bull_strategy': 'breakout', 'bull_bb_std_mult': 0.9692743906464028, 'bull_rsi_os': 15, 'bull_rsi_ob': 79, 'bull_adx_thresh': 8.158448378860395, 'bull_atr_min_pct': 0.028849454950444026, 'bull_atr_max_pct': 0.1429283316377041, 'bull_tp_mult': 2.5996057815158227, 'bull_tsl_mult': 0.40045902099929787, 'bull_time_stop': 96, 'bull_use_sma': True, 'bull_use_ema': True, 'bull_use_atr': False, 'bull_use_adx': False, 'bull_use_spike': False, 'bull_rsi_required': True, 'bear_strategy': 'breakout', 'bear_bb_std_mult': 1.057483055780234, 'bear_rsi_os': 9, 'bear_rsi_ob': 47, 'bear_adx_thresh': 19.76950067201142, 'bear_atr_min_pct': 0.0019183296928463305, 'bear_atr_max_pct': 0.11966215364941843, 'bear_tp_mult': 1.5170924061861712, 'bear_tsl_mult': 0.03653069342600884, 'bear_time_stop': 196, 'bear_use_sma': False, 'bear_use_ema': False, 'bear_use_atr': True, 'bear_use_adx': False, 'bear_use_spike': False, 'bear_rsi_required': True, 'sideways_strategy': 'mean_reversion', 'sideways_bb_std_mult': 0.8574049160313792, 'sideways_rsi_os': 25, 'sideways_rsi_ob': 54, 'sideways_adx_thresh': 9.863528937279835, 'sideways_atr_min_pct': 0.013493795514476704, 'sideways_atr_max_pct': 0.10598129873904819, 'sideways_tp_mult': 2.475237247928533, 'sideways_tsl_mult': 0.6985938248974358, 'sideways_time_stop': 53, 'sideways_use_sma': True, 'sideways_use_ema': True, 'sideways_use_atr': True, 'sideways_use_adx': False, 'sideways_use_spike': False, 'sideways_rsi_required': False}.
[I 2025-08-31 04:50:00,102] Trial 473 finished with values: [-1000000000.0, 1000000000.0] and parameters: {'p_sma': 19, 'p_std': 13, 'p_atr': 24, 'p_adx': 8, 'rsi_period': 24, 'ema1': 14, 'ema2': 48, 'slip_atr_k': 0.13766082746309363, 'slip_spread_k': 0.09487289922389411, 'spread_hl_frac': 0.03291529818305267, 'bb_std_mult': 1.8274560283751453, 'rsi_os': 30, 'rsi_ob': 57, 'vol_spike': 0.26323573110495047, 'adx_thresh': 13.071740587922626, 'atr_min_pct': 0.02340152407809001, 'atr_max_pct': 0.12620346125901077, 'tp_mult': 2.4630145930463936, 'tsl_mult': 0.8246299857083725, 'strategy': 'breakout', 'time_stop': 240, 'use_sma': True, 'use_atr': True, 'use_adx': True, 'use_ema': False, 'use_spike': True, 'rsi_required': False, 'edge_k': 1.5378991967579458, 'edge_cap': 0.361055896015117, 'bull_strategy': 'breakout', 'bull_bb_std_mult': 3.5166250365165133, 'bull_rsi_os': 20, 'bull_rsi_ob': 76, 'bull_adx_thresh': 6.5494377077999975, 'bull_atr_min_pct': 0.003184566129385863, 'bull_atr_max_pct': 0.057411562386781516, 'bull_tp_mult': 1.6136012224362357, 'bull_tsl_mult': 0.41422742745162766, 'bull_time_stop': 217, 'bull_use_sma': True, 'bull_use_ema': True, 'bull_use_atr': False, 'bull_use_adx': False, 'bull_use_spike': False, 'bull_rsi_required': True, 'bear_strategy': 'breakout', 'bear_bb_std_mult': 1.3884021208168917, 'bear_rsi_os': 46, 'bear_rsi_ob': 47, 'bear_adx_thresh': 19.689197977526366, 'bear_atr_min_pct': 0.023376183044114568, 'bear_atr_max_pct': 0.1359338272884355, 'bear_tp_mult': 1.962295525237058, 'bear_tsl_mult': 0.2419721301514558, 'bear_time_stop': 198, 'bear_use_sma': False, 'bear_use_ema': False, 'bear_use_atr': True, 'bear_use_adx': False, 'bear_use_spike': False, 'bear_rsi_required': True, 'sideways_strategy': 'mean_reversion', 'sideways_bb_std_mult': 0.90290939362286, 'sideways_rsi_os': 25, 'sideways_rsi_ob': 45, 'sideways_adx_thresh': 10.003991117737145, 'sideways_atr_min_pct': 0.013608250843431851, 'sideways_atr_max_pct': 0.06956571252087657, 'sideways_tp_mult': 2.483739293254811, 'sideways_tsl_mult': 0.3086467229035851, 'sideways_time_stop': 53, 'sideways_use_sma': True, 'sideways_use_ema': True, 'sideways_use_atr': True, 'sideways_use_adx': False, 'sideways_use_spike': False, 'sideways_rsi_required': False}.
[I 2025-08-31 04:50:46,556] Trial 477 finished with values: [-1000000000.0, 1000000000.0] and parameters: {'p_sma': 55, 'p_std': 39, 'p_atr': 9, 'p_adx': 10, 'rsi_period': 22, 'ema1': 14, 'ema2': 27, 'slip_atr_k': 0.014950760572988003, 'slip_spread_k': 0.13323901177155173, 'spread_hl_frac': 0.011280068549270321, 'bb_std_mult': 1.7125906890862537, 'rsi_os': 29, 'rsi_ob': 57, 'vol_spike': 0.023025780181543016, 'adx_thresh': 12.90048947098942, 'atr_min_pct': 0.0221042522638805, 'atr_max_pct': 0.12062645540909135, 'tp_mult': 1.9484700100205021, 'tsl_mult': 0.8708483305191714, 'strategy': 'mean_reversion', 'time_stop': 60, 'use_sma': True, 'use_atr': False, 'use_adx': False, 'use_ema': True, 'use_spike': False, 'rsi_required': False, 'edge_k': 0.4094583497879858, 'edge_cap': 0.42217666514270025, 'bull_strategy': 'mean_reversion', 'bull_bb_std_mult': 3.2667331995705386, 'bull_rsi_os': 13, 'bull_rsi_ob': 66, 'bull_adx_thresh': 12.676737739443396, 'bull_atr_min_pct': 0.0031505201100255776, 'bull_atr_max_pct': 0.03786324993748742, 'bull_tp_mult': 1.0564743536880763, 'bull_tsl_mult': 0.5746150450515095, 'bull_time_stop': 133, 'bull_use_sma': False, 'bull_use_ema': False, 'bull_use_atr': False, 'bull_use_adx': True, 'bull_use_spike': True, 'bull_rsi_required': False, 'bear_strategy': 'breakout', 'bear_bb_std_mult': 0.5856110141386865, 'bear_rsi_os': 39, 'bear_rsi_ob': 48, 'bear_adx_thresh': 31.587050564530983, 'bear_atr_min_pct': 0.024752094889699948, 'bear_atr_max_pct': 0.0457260286429051, 'bear_tp_mult': 2.7538084077487635, 'bear_tsl_mult': 0.27471573203487637, 'bear_time_stop': 246, 'bear_use_sma': True, 'bear_use_ema': True, 'bear_use_atr': True, 'bear_use_adx': False, 'bear_use_spike': True, 'bear_rsi_required': False, 'sideways_strategy': 'breakout', 'sideways_bb_std_mult': 2.068324640345528, 'sideways_rsi_os': 29, 'sideways_rsi_ob': 54, 'sideways_adx_thresh': 17.800644624832813, 'sideways_atr_min_pct': 0.012482295917230782, 'sideways_atr_max_pct': 0.11186871692441808, 'sideways_tp_mult': 1.978926661543933, 'sideways_tsl_mult': 0.1326990655319163, 'sideways_time_stop': 69, 'sideways_use_sma': False, 'sideways_use_ema': False, 'sideways_use_atr': False, 'sideways_use_adx': True, 'sideways_use_spike': True, 'sideways_rsi_required': True}.
[I 2025-08-31 04:50:47,392] Trial 476 finished with values: [-1000000000.0, 1000000000.0] and parameters: {'p_sma': 13, 'p_std': 16, 'p_atr': 24, 'p_adx': 10, 'rsi_period': 21, 'ema1': 14, 'ema2': 36, 'slip_atr_k': 0.01667649194265988, 'slip_spread_k': 0.1316505460978895, 'spread_hl_frac': 0.03176140167947107, 'bb_std_mult': 1.732832515125213, 'rsi_os': 31, 'rsi_ob': 57, 'vol_spike': 0.024517071099171776, 'adx_thresh': 12.945306611835873, 'atr_min_pct': 0.022146311028950448, 'atr_max_pct': 0.11930445117433433, 'tp_mult': 1.9404735490717702, 'tsl_mult': 0.02907398480878426, 'strategy': 'mean_reversion', 'time_stop': 59, 'use_sma': True, 'use_atr': True, 'use_adx': True, 'use_ema': True, 'use_spike': False, 'rsi_required': False, 'edge_k': 0.4308420668316685, 'edge_cap': 0.21834998571514602, 'bull_strategy': 'mean_reversion', 'bull_bb_std_mult': 3.13547856812735, 'bull_rsi_os': 18, 'bull_rsi_ob': 78, 'bull_adx_thresh': 19.856679944277527, 'bull_atr_min_pct': 0.0031579596056288536, 'bull_atr_max_pct': 0.14374470772155018, 'bull_tp_mult': 1.3854480422094073, 'bull_tsl_mult': 0.36561732065822417, 'bull_time_stop': 215, 'bull_use_sma': True, 'bull_use_ema': False, 'bull_use_atr': False, 'bull_use_adx': False, 'bull_use_spike': True, 'bull_rsi_required': False, 'bear_strategy': 'breakout', 'bear_bb_std_mult': 2.0981001126190333, 'bear_rsi_os': 9, 'bear_rsi_ob': 53, 'bear_adx_thresh': 28.232291843140985, 'bear_atr_min_pct': 0.004512432402374372, 'bear_atr_max_pct': 0.012511529766919896, 'bear_tp_mult': 1.9434249874264018, 'bear_tsl_mult': 0.154849723532011, 'bear_time_stop': 247, 'bear_use_sma': False, 'bear_use_ema': True, 'bear_use_atr': True, 'bear_use_adx': False, 'bear_use_spike': True, 'bear_rsi_required': False, 'sideways_strategy': 'breakout', 'sideways_bb_std_mult': 1.3296927855233003, 'sideways_rsi_os': 29, 'sideways_rsi_ob': 54, 'sideways_adx_thresh': 32.8021186622742, 'sideways_atr_min_pct': 0.01232860484575474, 'sideways_atr_max_pct': 0.11898302308418017, 'sideways_tp_mult': 1.7024916133504497, 'sideways_tsl_mult': 0.34576698260586913, 'sideways_time_stop': 69, 'sideways_use_sma': True, 'sideways_use_ema': True, 'sideways_use_atr': True, 'sideways_use_adx': False, 'sideways_use_spike': False, 'sideways_rsi_required': False}.
