[I 2025-08-31 04:31:15,795] Trial 376 finished with values: [-1000000000.0, 1000000000.0] and parameters: {'p_sma': 46, 'p_std': 41, 'p_atr': 24, 'p_adx': 21, 'rsi_period': 27, 'ema1': 28, 'ema2': 30, 'slip_atr_k': 0.012294760249070686, 'slip_spread_k': 0.7830490530887924, 'spread_hl_frac': 0.03147497844178187, 'bb_std_mult': 2.103698406703856, 'rsi_os': 32, 'rsi_ob': 66, 'vol_spike': 0.020465506467783202, 'adx_thresh': 24.033760531344218, 'atr_min_pct': 0.0054289972228641105, 'atr_max_pct': 0.03270093485514435, 'tp_mult': 1.0105138180940463, 'tsl_mult': 0.9031478929594818, 'strategy': 'breakout', 'time_stop': 49, 'use_sma': False, 'use_atr': False, 'use_adx': False, 'use_ema': True, 'use_spike': False, 'rsi_required': False, 'edge_k': 0.6605031175619007, 'edge_cap': 0.9839633298035738, 'bull_strategy': 'mean_reversion', 'bull_bb_std_mult': 3.4608694978846137, 'bull_rsi_os': 48, 'bull_rsi_ob': 77, 'bull_adx_thresh': 15.243555070992507, 'bull_atr_min_pct': 0.004681845515897912, 'bull_atr_max_pct': 0.07918544232995785, 'bull_tp_mult': 1.5015762122834095, 'bull_tsl_mult': 0.7641363817462892, 'bull_time_stop': 118, 'bull_use_sma': False, 'bull_use_ema': False, 'bull_use_atr': True, 'bull_use_adx': True, 'bull_use_spike': True, 'bull_rsi_required': True, 'bear_strategy': 'mean_reversion', 'bear_bb_std_mult': 0.7770785089652539, 'bear_rsi_os': 6, 'bear_rsi_ob': 45, 'bear_adx_thresh': 15.89600302298417, 'bear_atr_min_pct': 4.395215569712174e-06, 'bear_atr_max_pct': 0.034553344997076095, 'bear_tp_mult': 2.4268280820650747, 'bear_tsl_mult': 0.1873045359807321, 'bear_time_stop': 209, 'bear_use_sma': True, 'bear_use_ema': True, 'bear_use_atr': True, 'bear_use_adx': True, 'bear_use_spike': True, 'bear_rsi_required': True, 'sideways_strategy': 'mean_reversion', 'sideways_bb_std_mult': 2.906483850214029, 'sideways_rsi_os': 27, 'sideways_rsi_ob': 50, 'sideways_adx_thresh': 34.23469667589809, 'sideways_atr_min_pct': 0.013816121763180617, 'sideways_atr_max_pct': 0.1205743458778124, 'sideways_tp_mult': 1.9953547742761726, 'sideways_tsl_mult': 0.7253692434317692, 'sideways_time_stop': 71, 'sideways_use_sma': False, 'sideways_use_ema': False, 'sideways_use_atr': False, 'sideways_use_adx': True, 'sideways_use_spike': True, 'sideways_rsi_required': True}.
[I 2025-08-31 04:32:09,491] Trial 381 finished with values: [-1000000000.0, 1000000000.0] and parameters: {'p_sma': 52, 'p_std': 32, 'p_atr': 23, 'p_adx': 9, 'rsi_period': 15, 'ema1': 30, 'ema2': 29, 'slip_atr_k': 0.01855251440978937, 'slip_spread_k': 0.0398555474396074, 'spread_hl_frac': 0.006547665015749944, 'bb_std_mult': 1.6449913544439325, 'rsi_os': 27, 'rsi_ob': 74, 'vol_spike': 0.01066218535120228, 'adx_thresh': 15.209132419028421, 'atr_min_pct': 0.00989309550592235, 'atr_max_pct': 0.1085417050331827, 'tp_mult': 2.643750302669297, 'tsl_mult': 0.8012321609533004, 'strategy': 'breakout', 'time_stop': 69, 'use_sma': False, 'use_atr': False, 'use_adx': True, 'use_ema': False, 'use_spike': True, 'rsi_required': True, 'edge_k': 1.3526411752618652, 'edge_cap': 0.9990928430826868, 'bull_strategy': 'mean_reversion', 'bull_bb_std_mult': 2.4978823626952114, 'bull_rsi_os': 13, 'bull_rsi_ob': 82, 'bull_adx_thresh': 14.145572689164572, 'bull_atr_min_pct': 0.0023150201313589225, 'bull_atr_max_pct': 0.14896195575890703, 'bull_tp_mult': 1.608091719356741, 'bull_tsl_mult': 0.8176545266139115, 'bull_time_stop': 138, 'bull_use_sma': True, 'bull_use_ema': False, 'bull_use_atr': True, 'bull_use_adx': True, 'bull_use_spike': False, 'bull_rsi_required': True, 'bear_strategy': 'breakout', 'bear_bb_std_mult': 2.546085877891393, 'bear_rsi_os': 8, 'bear_rsi_ob': 68, 'bear_adx_thresh': 20.61768302667405, 'bear_atr_min_pct': 0.024381375096092325, 'bear_atr_max_pct': 0.11598201445761802, 'bear_tp_mult': 2.3543838217531534, 'bear_tsl_mult': 0.2974203827118043, 'bear_time_stop': 229, 'bear_use_sma': True, 'bear_use_ema': True, 'bear_use_atr': True, 'bear_use_adx': False, 'bear_use_spike': True, 'bear_rsi_required': True, 'sideways_strategy': 'mean_reversion', 'sideways_bb_std_mult': 0.9152737611859225, 'sideways_rsi_os': 28, 'sideways_rsi_ob': 54, 'sideways_adx_thresh': 10.522647071093527, 'sideways_atr_min_pct': 0.015584619741973995, 'sideways_atr_max_pct': 0.05333634139819299, 'sideways_tp_mult': 1.8900892535923546, 'sideways_tsl_mult': 0.5378467267720678, 'sideways_time_stop': 65, 'sideways_use_sma': False, 'sideways_use_ema': True, 'sideways_use_atr': True, 'sideways_use_adx': True, 'sideways_use_spike': False, 'sideways_rsi_required': True}.
[I 2025-08-31 04:32:10,088] Trial 379 finished with values: [-1000000000.0, 1000000000.0] and parameters: {'p_sma': 30, 'p_std': 49, 'p_atr': 24, 'p_adx': 30, 'rsi_period': 27, 'ema1': 5, 'ema2': 22, 'slip_atr_k': 0.027581907170138906, 'slip_spread_k': 0.14675654418787545, 'spread_hl_frac': 0.01443114450649851, 'bb_std_mult': 2.3629066706304536, 'rsi_os': 30, 'rsi_ob': 59, 'vol_spike': 0.13604932758065086, 'adx_thresh': 29.619864096406495, 'atr_min_pct': 0.01166373314900939, 'atr_max_pct': 0.09981496059268904, 'tp_mult': 2.4932189713019315, 'tsl_mult': 0.8152162966770699, 'strategy': 'breakout', 'time_stop': 57, 'use_sma': False, 'use_atr': False, 'use_adx': True, 'use_ema': True, 'use_spike': False, 'rsi_required': True, 'edge_k': 1.3446900138494864, 'edge_cap': 0.968772634677154, 'bull_strategy': 'breakout', 'bull_bb_std_mult': 2.450363137178568, 'bull_rsi_os': 13, 'bull_rsi_ob': 49, 'bull_adx_thresh': 5.176141621601852, 'bull_atr_min_pct': 0.019000054695156084, 'bull_atr_max_pct': 0.14342509822482027, 'bull_tp_mult': 1.5197914881349206, 'bull_tsl_mult': 0.8166860090076264, 'bull_time_stop': 122, 'bull_use_sma': True, 'bull_use_ema': False, 'bull_use_atr': True, 'bull_use_adx': True, 'bull_use_spike': True, 'bull_rsi_required': True, 'bear_strategy': 'mean_reversion', 'bear_bb_std_mult': 2.6703294078985484, 'bear_rsi_os': 40, 'bear_rsi_ob': 49, 'bear_adx_thresh': 18.687656641685994, 'bear_atr_min_pct': 0.023728390593664394, 'bear_atr_max_pct': 0.05509680578589073, 'bear_tp_mult': 2.3636137547022633, 'bear_tsl_mult': 0.1828339466892433, 'bear_time_stop': 209, 'bear_use_sma': True, 'bear_use_ema': True, 'bear_use_atr': True, 'bear_use_adx': True, 'bear_use_spike': True, 'bear_rsi_required': True, 'sideways_strategy': 'mean_reversion', 'sideways_bb_std_mult': 1.172598311082176, 'sideways_rsi_os': 28, 'sideways_rsi_ob': 75, 'sideways_adx_thresh': 10.704451585557184, 'sideways_atr_min_pct': 0.01820381469934929, 'sideways_atr_max_pct': 0.1310365412890967, 'sideways_tp_mult': 1.88550839654209, 'sideways_tsl_mult': 0.544774418297647, 'sideways_time_stop': 206, 'sideways_use_sma': False, 'sideways_use_ema': True, 'sideways_use_atr': True, 'sideways_use_adx': True, 'sideways_use_spike': False, 'sideways_rsi_required': True}.
[I 2025-08-31 04:32:10,283] Trial 382 finished with values: [-1000000000.0, 1000000000.0] and parameters: {'p_sma': 31, 'p_std': 29, 'p_atr': 23, 'p_adx': 28, 'rsi_period': 15, 'ema1': 16, 'ema2': 23, 'slip_atr_k': 0.02687418345121849, 'slip_spread_k': 0.1478120677092069, 'spread_hl_frac': 0.0064051509799693904, 'bb_std_mult': 1.6447354526064248, 'rsi_os': 27, 'rsi_ob': 74, 'vol_spike': 0.06265347346533164, 'adx_thresh': 31.696063231602704, 'atr_min_pct': 0.0177196708911295, 'atr_max_pct': 0.06297961345340286, 'tp_mult': 2.646934819739239, 'tsl_mult': 0.26570895921868937, 'strategy': 'breakout', 'time_stop': 239, 'use_sma': False, 'use_atr': False, 'use_adx': True, 'use_ema': False, 'use_spike': True, 'rsi_required': True, 'edge_k': 1.4913525788468152, 'edge_cap': 0.6975425149515339, 'bull_strategy': 'mean_reversion', 'bull_bb_std_mult': 3.532673308592541, 'bull_rsi_os': 12, 'bull_rsi_ob': 71, 'bull_adx_thresh': 7.886312091179619, 'bull_atr_min_pct': 0.02048659221050271, 'bull_atr_max_pct': 0.06626950497723262, 'bull_tp_mult': 1.6101945259848747, 'bull_tsl_mult': 0.8535763246570647, 'bull_time_stop': 136, 'bull_use_sma': True, 'bull_use_ema': False, 'bull_use_atr': True, 'bull_use_adx': True, 'bull_use_spike': False, 'bull_rsi_required': True, 'bear_strategy': 'breakout', 'bear_bb_std_mult': 0.8674027322127416, 'bear_rsi_os': 8, 'bear_rsi_ob': 48, 'bear_adx_thresh': 13.768782962352159, 'bear_atr_min_pct': 0.016012932582159266, 'bear_atr_max_pct': 0.11677577655126062, 'bear_tp_mult': 2.359496538593551, 'bear_tsl_mult': 0.2976400528928014, 'bear_time_stop': 239, 'bear_use_sma': True, 'bear_use_ema': True, 'bear_use_atr': True, 'bear_use_adx': False, 'bear_use_spike': True, 'bear_rsi_required': True, 'sideways_strategy': 'mean_reversion', 'sideways_bb_std_mult': 1.1436401506997111, 'sideways_rsi_os': 28, 'sideways_rsi_ob': 54, 'sideways_adx_thresh': 16.594923930140197, 'sideways_atr_min_pct': 0.009926274325277415, 'sideways_atr_max_pct': 0.05183217652887892, 'sideways_tp_mult': 1.2461417776347963, 'sideways_tsl_mult': 0.48483333209227714, 'sideways_time_stop': 64, 'sideways_use_sma': False, 'sideways_use_ema': True, 'sideways_use_atr': True, 'sideways_use_adx': True, 'sideways_use_spike': False, 'sideways_rsi_required': True}.
[I 2025-08-31 04:32:10,562] Trial 380 finished with values: [-1000000000.0, 1000000000.0] and parameters: {'p_sma': 18, 'p_std': 17, 'p_atr': 24, 'p_adx': 30, 'rsi_period': 49, 'ema1': 16, 'ema2': 22, 'slip_atr_k': 0.14322380468154372, 'slip_spread_k': 0.14730953246229817, 'spread_hl_frac': 0.011595464447608292, 'bb_std_mult': 2.342169189945123, 'rsi_os': 27, 'rsi_ob': 57, 'vol_spike': 0.00924644251049798, 'adx_thresh': 8.523844634986744, 'atr_min_pct': 0.021636610692796453, 'atr_max_pct': 0.031320558693122315, 'tp_mult': 2.4920212147536422, 'tsl_mult': 0.8191723390094299, 'strategy': 'breakout', 'time_stop': 52, 'use_sma': False, 'use_atr': False, 'use_adx': True, 'use_ema': False, 'use_spike': True, 'rsi_required': True, 'edge_k': 1.3353703663185328, 'edge_cap': 0.961895715603546, 'bull_strategy': 'mean_reversion', 'bull_bb_std_mult': 3.4930834047286528, 'bull_rsi_os': 13, 'bull_rsi_ob': 82, 'bull_adx_thresh': 7.679437655898454, 'bull_atr_min_pct': 0.025156054381431467, 'bull_atr_max_pct': 0.1476677189200755, 'bull_tp_mult': 1.512882219248597, 'bull_tsl_mult': 0.8191581179651399, 'bull_time_stop': 42, 'bull_use_sma': True, 'bull_use_ema': False, 'bull_use_atr': True, 'bull_use_adx': True, 'bull_use_spike': False, 'bull_rsi_required': True, 'bear_strategy': 'breakout', 'bear_bb_std_mult': 0.8443567708412187, 'bear_rsi_os': 40, 'bear_rsi_ob': 90, 'bear_adx_thresh': 20.477402349405857, 'bear_atr_min_pct': 0.02462009818507024, 'bear_atr_max_pct': 0.1167927776830847, 'bear_tp_mult': 2.394698459244941, 'bear_tsl_mult': 0.18561901525764923, 'bear_time_stop': 206, 'bear_use_sma': True, 'bear_use_ema': True, 'bear_use_atr': True, 'bear_use_adx': False, 'bear_use_spike': True, 'bear_rsi_required': True, 'sideways_strategy': 'mean_reversion', 'sideways_bb_std_mult': 1.1615278448989057, 'sideways_rsi_os': 28, 'sideways_rsi_ob': 74, 'sideways_adx_thresh': 34.61714859195965, 'sideways_atr_min_pct': 0.01792959080762336, 'sideways_atr_max_pct': 0.05335961476846206, 'sideways_tp_mult': 1.1178724286947528, 'sideways_tsl_mult': 0.5682462914471303, 'sideways_time_stop': 207, 'sideways_use_sma': False, 'sideways_use_ema': True, 'sideways_use_atr': True, 'sideways_use_adx': True, 'sideways_use_spike': False, 'sideways_rsi_required': True}.
[I 2025-08-31 04:32:11,131] Trial 383 finished with values: [-1000000000.0, 1000000000.0] and parameters: {'p_sma': 15, 'p_std': 15, 'p_atr': 22, 'p_adx': 7, 'rsi_period': 25, 'ema1': 16, 'ema2': 23, 'slip_atr_k': 0.14275481382970703, 'slip_spread_k': 0.8307274294023758, 'spread_hl_frac': 0.010260585829740954, 'bb_std_mult': 2.342890401113171, 'rsi_os': 48, 'rsi_ob': 57, 'vol_spike': 0.061155656663840124, 'adx_thresh': 18.626436112733657, 'atr_min_pct': 0.022066316128921556, 'atr_max_pct': 0.012340982362854594, 'tp_mult': 2.4847073506682555, 'tsl_mult': 0.8702373695409176, 'strategy': 'breakout', 'time_stop': 26, 'use_sma': False, 'use_atr': False, 'use_adx': True, 'use_ema': False, 'use_spike': True, 'rsi_required': True, 'edge_k': 1.483282496046043, 'edge_cap': 0.559087516694117, 'bull_strategy': 'breakout', 'bull_bb_std_mult': 3.5291898493141467, 'bull_rsi_os': 29, 'bull_rsi_ob': 90, 'bull_adx_thresh': 7.044607988342754, 'bull_atr_min_pct': 0.013984432506843714, 'bull_atr_max_pct': 0.06536526679903625, 'bull_tp_mult': 2.684620260004066, 'bull_tsl_mult': 0.09272683176487012, 'bull_time_stop': 135, 'bull_use_sma': True, 'bull_use_ema': True, 'bull_use_atr': True, 'bull_use_adx': True, 'bull_use_spike': False, 'bull_rsi_required': True, 'bear_strategy': 'mean_reversion', 'bear_bb_std_mult': 0.866077503448018, 'bear_rsi_os': 45, 'bear_rsi_ob': 91, 'bear_adx_thresh': 19.25370045198636, 'bear_atr_min_pct': 0.02995369718897597, 'bear_atr_max_pct': 0.07083153658309674, 'bear_tp_mult': 2.9492554834263007, 'bear_tsl_mult': 0.9806591151646249, 'bear_time_stop': 192, 'bear_use_sma': True, 'bear_use_ema': False, 'bear_use_atr': True, 'bear_use_adx': True, 'bear_use_spike': False, 'bear_rsi_required': True, 'sideways_strategy': 'mean_reversion', 'sideways_bb_std_mult': 1.153378125201702, 'sideways_rsi_os': 28, 'sideways_rsi_ob': 54, 'sideways_adx_thresh': 6.726158264538434, 'sideways_atr_min_pct': 0.01477780114129436, 'sideways_atr_max_pct': 0.11653831126866393, 'sideways_tp_mult': 2.052479842547217, 'sideways_tsl_mult': 0.5116951532947086, 'sideways_time_stop': 17, 'sideways_use_sma': False, 'sideways_use_ema': True, 'sideways_use_atr': True, 'sideways_use_adx': True, 'sideways_use_spike': False, 'sideways_rsi_required': True}.
[I 2025-08-31 04:32:11,708] Trial 384 finished with values: [-1000000000.0, 1000000000.0] and parameters: {'p_sma': 57, 'p_std': 29, 'p_atr': 22, 'p_adx': 9, 'rsi_period': 25, 'ema1': 16, 'ema2': 23, 'slip_atr_k': 0.2448678613193868, 'slip_spread_k': 0.12233495614738335, 'spread_hl_frac': 0.02154046247575082, 'bb_std_mult': 2.029772505629121, 'rsi_os': 28, 'rsi_ob': 57, 'vol_spike': 0.17843357987024416, 'adx_thresh': 8.447238513339768, 'atr_min_pct': 0.02220817306655872, 'atr_max_pct': 0.01338284056464395, 'tp_mult': 1.2774555300155181, 'tsl_mult': 0.25671388870266976, 'strategy': 'breakout', 'time_stop': 277, 'use_sma': False, 'use_atr': False, 'use_adx': False, 'use_ema': False, 'use_spike': True, 'rsi_required': False, 'edge_k': 0.46775018918880906, 'edge_cap': 0.13948590876395078, 'bull_strategy': 'mean_reversion', 'bull_bb_std_mult': 3.5322935658788768, 'bull_rsi_os': 10, 'bull_rsi_ob': 81, 'bull_adx_thresh': 8.37470971376723, 'bull_atr_min_pct': 0.002918979997997841, 'bull_atr_max_pct': 0.09192540516042164, 'bull_tp_mult': 2.0197279563520656, 'bull_tsl_mult': 0.09154226044692726, 'bull_time_stop': 22, 'bull_use_sma': False, 'bull_use_ema': True, 'bull_use_atr': True, 'bull_use_adx': True, 'bull_use_spike': False, 'bull_rsi_required': True, 'bear_strategy': 'breakout', 'bear_bb_std_mult': 3.1296424201122965, 'bear_rsi_os': 11, 'bear_rsi_ob': 49, 'bear_adx_thresh': 19.354046701175704, 'bear_atr_min_pct': 0.021667150588339498, 'bear_atr_max_pct': 0.14936564664349178, 'bear_tp_mult': 2.96940608311599, 'bear_tsl_mult': 0.24483838041603206, 'bear_time_stop': 194, 'bear_use_sma': True, 'bear_use_ema': False, 'bear_use_atr': False, 'bear_use_adx': False, 'bear_use_spike': False, 'bear_rsi_required': False, 'sideways_strategy': 'mean_reversion', 'sideways_bb_std_mult': 1.1459027882222346, 'sideways_rsi_os': 25, 'sideways_rsi_ob': 74, 'sideways_adx_thresh': 9.437279455956627, 'sideways_atr_min_pct': 0.014767323274600059, 'sideways_atr_max_pct': 0.11732825955543175, 'sideways_tp_mult': 1.655877400466654, 'sideways_tsl_mult': 0.5711401554700702, 'sideways_time_stop': 62, 'sideways_use_sma': False, 'sideways_use_ema': False, 'sideways_use_atr': False, 'sideways_use_adx': True, 'sideways_use_spike': True, 'sideways_rsi_required': True}.
[I 2025-08-31 04:32:52,925] Trial 386 finished with values: [-1000000000.0, 1000000000.0] and parameters: {'p_sma': 35, 'p_std': 36, 'p_atr': 22, 'p_adx': 9, 'rsi_period': 24, 'ema1': 15, 'ema2': 45, 'slip_atr_k': 0.1306176499380985, 'slip_spread_k': 0.5869051650983006, 'spread_hl_frac': 0.010203041652270036, 'bb_std_mult': 1.1995291230217409, 'rsi_os': 54, 'rsi_ob': 59, 'vol_spike': 0.03969663101023589, 'adx_thresh': 14.336391884361426, 'atr_min_pct': 0.025458579346242727, 'atr_max_pct': 0.09238034077792696, 'tp_mult': 1.2921052197291703, 'tsl_mult': 0.8740265855604896, 'strategy': 'breakout', 'time_stop': 33, 'use_sma': True, 'use_atr': True, 'use_adx': False, 'use_ema': False, 'use_spike': True, 'rsi_required': False, 'edge_k': 0.472044094909258, 'edge_cap': 0.9989446490613844, 'bull_strategy': 'mean_reversion', 'bull_bb_std_mult': 3.0172566554728615, 'bull_rsi_os': 32, 'bull_rsi_ob': 78, 'bull_adx_thresh': 7.138073674045615, 'bull_atr_min_pct': 0.0027058522494185777, 'bull_atr_max_pct': 0.08809993680072511, 'bull_tp_mult': 1.6812836019449036, 'bull_tsl_mult': 0.975665229179451, 'bull_time_stop': 141, 'bull_use_sma': False, 'bull_use_ema': True, 'bull_use_atr': False, 'bull_use_adx': False, 'bull_use_spike': False, 'bull_rsi_required': False, 'bear_strategy': 'mean_reversion', 'bear_bb_std_mult': 1.0336618054324078, 'bear_rsi_os': 18, 'bear_rsi_ob': 49, 'bear_adx_thresh': 19.331651127497352, 'bear_atr_min_pct': 0.027512065696261793, 'bear_atr_max_pct': 0.11014461088529934, 'bear_tp_mult': 2.497044154047251, 'bear_tsl_mult': 0.2450156220291909, 'bear_time_stop': 191, 'bear_use_sma': False, 'bear_use_ema': False, 'bear_use_atr': False, 'bear_use_adx': True, 'bear_use_spike': False, 'bear_rsi_required': False, 'sideways_strategy': 'mean_reversion', 'sideways_bb_std_mult': 3.3590786265735746, 'sideways_rsi_os': 29, 'sideways_rsi_ob': 61, 'sideways_adx_thresh': 9.657433083364106, 'sideways_atr_min_pct': 0.014792041252948345, 'sideways_atr_max_pct': 0.11751075687440377, 'sideways_tp_mult': 2.0557237869125724, 'sideways_tsl_mult': 0.7012457066872442, 'sideways_time_stop': 52, 'sideways_use_sma': True, 'sideways_use_ema': False, 'sideways_use_atr': False, 'sideways_use_adx': False, 'sideways_use_spike': True, 'sideways_rsi_required': False}.
[I 2025-08-31 04:32:53,253] Trial 387 finished with values: [-1000000000.0, 1000000000.0] and parameters: {'p_sma': 34, 'p_std': 36, 'p_atr': 25, 'p_adx': 8, 'rsi_period': 20, 'ema1': 21, 'ema2': 49, 'slip_atr_k': 0.13289364332085682, 'slip_spread_k': 0.5015007829981589, 'spread_hl_frac': 0.008671627396652452, 'bb_std_mult': 1.718434460615862, 'rsi_os': 53, 'rsi_ob': 59, 'vol_spike': 0.0404717452943608, 'adx_thresh': 12.780698983330655, 'atr_min_pct': 0.02240757153002947, 'atr_max_pct': 0.054427255718806224, 'tp_mult': 2.735888540352494, 'tsl_mult': 0.8491450931343477, 'strategy': 'breakout', 'time_stop': 198, 'use_sma': True, 'use_atr': True, 'use_adx': False, 'use_ema': False, 'use_spike': True, 'rsi_required': False, 'edge_k': 0.14307313600144944, 'edge_cap': 0.1348345659186191, 'bull_strategy': 'mean_reversion', 'bull_bb_std_mult': 1.5586546589529893, 'bull_rsi_os': 40, 'bull_rsi_ob': 80, 'bull_adx_thresh': 15.973840965258216, 'bull_atr_min_pct': 0.002659210627625764, 'bull_atr_max_pct': 0.09292085381597741, 'bull_tp_mult': 1.6860070042862338, 'bull_tsl_mult': 0.8698177913559851, 'bull_time_stop': 251, 'bull_use_sma': False, 'bull_use_ema': True, 'bull_use_atr': False, 'bull_use_adx': False, 'bull_use_spike': False, 'bull_rsi_required': False, 'bear_strategy': 'mean_reversion', 'bear_bb_std_mult': 3.118011280198865, 'bear_rsi_os': 11, 'bear_rsi_ob': 72, 'bear_adx_thresh': 21.2199484813405, 'bear_atr_min_pct': 0.025251328305478354, 'bear_atr_max_pct': 0.047947473850983545, 'bear_tp_mult': 2.605345994744299, 'bear_tsl_mult': 0.23488504623024054, 'bear_time_stop': 174, 'bear_use_sma': False, 'bear_use_ema': False, 'bear_use_atr': False, 'bear_use_adx': True, 'bear_use_spike': False, 'bear_rsi_required': False, 'sideways_strategy': 'mean_reversion', 'sideways_bb_std_mult': 3.374531541980874, 'sideways_rsi_os': 25, 'sideways_rsi_ob': 52, 'sideways_adx_thresh': 29.86092660951716, 'sideways_atr_min_pct': 0.024625627213198262, 'sideways_atr_max_pct': 0.11740170994735352, 'sideways_tp_mult': 1.7898680211380391, 'sideways_tsl_mult': 0.27016656022103025, 'sideways_time_stop': 52, 'sideways_use_sma': True, 'sideways_use_ema': False, 'sideways_use_atr': False, 'sideways_use_adx': False, 'sideways_use_spike': True, 'sideways_rsi_required': False}.
