[I 2025-08-31 05:25:10,655] Trial 665 finished with values: [-1000000000.0, 1000000000.0] and parameters: {'p_sma': 12, 'p_std': 14, 'p_atr': 14, 'p_adx': 9, 'rsi_period': 19, 'ema1': 24, 'ema2': 27, 'slip_atr_k': 0.03588386719474438, 'slip_spread_k': 0.8212264640774976, 'spread_hl_frac': 0.010532404081430502, 'bb_std_mult': 0.5482020076673955, 'rsi_os': 45, 'rsi_ob': 61, 'vol_spike': 0.025478157934333907, 'adx_thresh': 11.407343457420293, 'atr_min_pct': 0.02196542539922279, 'atr_max_pct': 0.104967559077647, 'tp_mult': 1.4878533997176346, 'tsl_mult': 0.8450261380699144, 'strategy': 'mean_reversion', 'time_stop': 15, 'use_sma': False, 'use_atr': True, 'use_adx': False, 'use_ema': False, 'use_spike': True, 'rsi_required': True, 'edge_k': 0.41167989174589337, 'edge_cap': 0.8409510222556872, 'bull_strategy': 'breakout', 'bull_bb_std_mult': 0.8509159699962021, 'bull_rsi_os': 50, 'bull_rsi_ob': 77, 'bull_adx_thresh': 9.443918717969295, 'bull_atr_min_pct': 0.011182364362370844, 'bull_atr_max_pct': 0.09223577997068692, 'bull_tp_mult': 1.3522701390530758, 'bull_tsl_mult': 0.9084914464417125, 'bull_time_stop': 249, 'bull_use_sma': False, 'bull_use_ema': False, 'bull_use_atr': True, 'bull_use_adx': True, 'bull_use_spike': False, 'bull_rsi_required': False, 'bear_strategy': 'breakout', 'bear_bb_std_mult': 0.8242104252405158, 'bear_rsi_os': 9, 'bear_rsi_ob': 80, 'bear_adx_thresh': 5.860136583394759, 'bear_atr_min_pct': 0.008884481891787475, 'bear_atr_max_pct': 0.040426131349443666, 'bear_tp_mult': 1.61851147737014, 'bear_tsl_mult': 0.5972430635676262, 'bear_time_stop': 278, 'bear_use_sma': True, 'bear_use_ema': True, 'bear_use_atr': True, 'bear_use_adx': False, 'bear_use_spike': False, 'bear_rsi_required': False, 'sideways_strategy': 'breakout', 'sideways_bb_std_mult': 1.1603925606123247, 'sideways_rsi_os': 35, 'sideways_rsi_ob': 47, 'sideways_adx_thresh': 28.633377200480282, 'sideways_atr_min_pct': 0.023415148357762906, 'sideways_atr_max_pct': 0.045105098821883606, 'sideways_tp_mult': 2.1399174393783778, 'sideways_tsl_mult': 0.5296162822262782, 'sideways_time_stop': 192, 'sideways_use_sma': False, 'sideways_use_ema': True, 'sideways_use_atr': False, 'sideways_use_adx': False, 'sideways_use_spike': True, 'sideways_rsi_required': True}.
[I 2025-08-31 05:25:11,626] Trial 669 finished with values: [-1000000000.0, 1000000000.0] and parameters: {'p_sma': 13, 'p_std': 16, 'p_atr': 12, 'p_adx': 8, 'rsi_period': 22, 'ema1': 24, 'ema2': 21, 'slip_atr_k': 0.01896800930069062, 'slip_spread_k': 0.5949070629301692, 'spread_hl_frac': 0.010466316678202758, 'bb_std_mult': 2.0669991908242, 'rsi_os': 53, 'rsi_ob': 61, 'vol_spike': 0.01089485595218889, 'adx_thresh': 20.228939389215416, 'atr_min_pct': 0.0035262699128912438, 'atr_max_pct': 0.07159371013017483, 'tp_mult': 2.3881775472279885, 'tsl_mult': 0.8398667064139185, 'strategy': 'mean_reversion', 'time_stop': 17, 'use_sma': False, 'use_atr': True, 'use_adx': False, 'use_ema': False, 'use_spike': True, 'rsi_required': True, 'edge_k': 0.17611291319685085, 'edge_cap': 0.838883662048305, 'bull_strategy': 'breakout', 'bull_bb_std_mult': 1.0607214792279551, 'bull_rsi_os': 53, 'bull_rsi_ob': 78, 'bull_adx_thresh': 10.203504904391652, 'bull_atr_min_pct': 0.023429841173643644, 'bull_atr_max_pct': 0.01729649604137887, 'bull_tp_mult': 1.776302972688489, 'bull_tsl_mult': 0.9390709223036255, 'bull_time_stop': 247, 'bull_use_sma': False, 'bull_use_ema': False, 'bull_use_atr': True, 'bull_use_adx': True, 'bull_use_spike': False, 'bull_rsi_required': False, 'bear_strategy': 'breakout', 'bear_bb_std_mult': 0.9585146815353227, 'bear_rsi_os': 10, 'bear_rsi_ob': 77, 'bear_adx_thresh': 31.200150841398724, 'bear_atr_min_pct': 0.008691882579603126, 'bear_atr_max_pct': 0.03654256767585614, 'bear_tp_mult': 1.0134440083674692, 'bear_tsl_mult': 0.5562427728164138, 'bear_time_stop': 291, 'bear_use_sma': True, 'bear_use_ema': True, 'bear_use_atr': True, 'bear_use_adx': False, 'bear_use_spike': False, 'bear_rsi_required': False, 'sideways_strategy': 'breakout', 'sideways_bb_std_mult': 2.595356894217585, 'sideways_rsi_os': 40, 'sideways_rsi_ob': 57, 'sideways_adx_thresh': 21.378043725980667, 'sideways_atr_min_pct': 0.027895954964035026, 'sideways_atr_max_pct': 0.018477680436658567, 'sideways_tp_mult': 2.041759549982593, 'sideways_tsl_mult': 0.48845789330558986, 'sideways_time_stop': 191, 'sideways_use_sma': False, 'sideways_use_ema': True, 'sideways_use_atr': False, 'sideways_use_adx': False, 'sideways_use_spike': True, 'sideways_rsi_required': True}.
[I 2025-08-31 05:25:39,566] Trial 668 finished with values: [-1000000000.0, 1000000000.0] and parameters: {'p_sma': 13, 'p_std': 39, 'p_atr': 16, 'p_adx': 8, 'rsi_period': 16, 'ema1': 24, 'ema2': 46, 'slip_atr_k': 0.06743066297458017, 'slip_spread_k': 0.8226757536476216, 'spread_hl_frac': 0.010616494846755921, 'bb_std_mult': 2.1174258886060033, 'rsi_os': 16, 'rsi_ob': 62, 'vol_spike': 0.026566271757470686, 'adx_thresh': 10.806364831121044, 'atr_min_pct': 0.011689541559350727, 'atr_max_pct': 0.10977714883042101, 'tp_mult': 1.8933601384866112, 'tsl_mult': 0.835905573830508, 'strategy': 'mean_reversion', 'time_stop': 12, 'use_sma': False, 'use_atr': True, 'use_adx': True, 'use_ema': False, 'use_spike': True, 'rsi_required': True, 'edge_k': 0.6183311044340927, 'edge_cap': 0.8245354768929716, 'bull_strategy': 'breakout', 'bull_bb_std_mult': 0.8779032968878584, 'bull_rsi_os': 43, 'bull_rsi_ob': 77, 'bull_adx_thresh': 8.917132924586491, 'bull_atr_min_pct': 0.009950180547822937, 'bull_atr_max_pct': 0.06628062185320714, 'bull_tp_mult': 1.7740800116297373, 'bull_tsl_mult': 0.9028284134191855, 'bull_time_stop': 249, 'bull_use_sma': True, 'bull_use_ema': False, 'bull_use_atr': True, 'bull_use_adx': False, 'bull_use_spike': False, 'bull_rsi_required': False, 'bear_strategy': 'breakout', 'bear_bb_std_mult': 3.3699066299235465, 'bear_rsi_os': 10, 'bear_rsi_ob': 81, 'bear_adx_thresh': 18.04451412762713, 'bear_atr_min_pct': 0.008825758259418889, 'bear_atr_max_pct': 0.04486504643181473, 'bear_tp_mult': 1.2741257372795927, 'bear_tsl_mult': 0.5984941010530118, 'bear_time_stop': 243, 'bear_use_sma': False, 'bear_use_ema': True, 'bear_use_atr': True, 'bear_use_adx': False, 'bear_use_spike': False, 'bear_rsi_required': False, 'sideways_strategy': 'breakout', 'sideways_bb_std_mult': 2.5842981778066334, 'sideways_rsi_os': 40, 'sideways_rsi_ob': 53, 'sideways_adx_thresh': 28.494182049317264, 'sideways_atr_min_pct': 0.014812980550878178, 'sideways_atr_max_pct': 0.05799282445658744, 'sideways_tp_mult': 2.1250293019765008, 'sideways_tsl_mult': 0.4956758231547005, 'sideways_time_stop': 187, 'sideways_use_sma': False, 'sideways_use_ema': True, 'sideways_use_atr': True, 'sideways_use_adx': False, 'sideways_use_spike': False, 'sideways_rsi_required': False}.
[I 2025-08-31 05:25:39,901] Trial 666 finished with values: [-1000000000.0, 1000000000.0] and parameters: {'p_sma': 59, 'p_std': 39, 'p_atr': 16, 'p_adx': 25, 'rsi_period': 56, 'ema1': 24, 'ema2': 27, 'slip_atr_k': 0.03804595242438706, 'slip_spread_k': 0.6000946851583979, 'spread_hl_frac': 0.028172746122667455, 'bb_std_mult': 2.1270217584113986, 'rsi_os': 19, 'rsi_ob': 61, 'vol_spike': 0.02556629500268987, 'adx_thresh': 20.283787306750504, 'atr_min_pct': 0.02207178435158375, 'atr_max_pct': 0.05601120285746318, 'tp_mult': 2.104878198347739, 'tsl_mult': 0.8459641365124851, 'strategy': 'mean_reversion', 'time_stop': 12, 'use_sma': False, 'use_atr': True, 'use_adx': False, 'use_ema': True, 'use_spike': True, 'rsi_required': True, 'edge_k': 0.8331148749709297, 'edge_cap': 0.8331483430591697, 'bull_strategy': 'breakout', 'bull_bb_std_mult': 0.8724339038929783, 'bull_rsi_os': 43, 'bull_rsi_ob': 77, 'bull_adx_thresh': 9.295360877623624, 'bull_atr_min_pct': 0.023280297398646392, 'bull_atr_max_pct': 0.026851187176177783, 'bull_tp_mult': 2.6042768582023994, 'bull_tsl_mult': 0.911832461938907, 'bull_time_stop': 250, 'bull_use_sma': False, 'bull_use_ema': False, 'bull_use_atr': True, 'bull_use_adx': True, 'bull_use_spike': False, 'bull_rsi_required': False, 'bear_strategy': 'breakout', 'bear_bb_std_mult': 3.057772485634495, 'bear_rsi_os': 10, 'bear_rsi_ob': 75, 'bear_adx_thresh': 5.680468331800855, 'bear_atr_min_pct': 0.010599611126627209, 'bear_atr_max_pct': 0.04044975838993837, 'bear_tp_mult': 1.2712436567646541, 'bear_tsl_mult': 0.860814969882947, 'bear_time_stop': 232, 'bear_use_sma': True, 'bear_use_ema': True, 'bear_use_atr': True, 'bear_use_adx': False, 'bear_use_spike': False, 'bear_rsi_required': False, 'sideways_strategy': 'breakout', 'sideways_bb_std_mult': 1.2022287889093608, 'sideways_rsi_os': 35, 'sideways_rsi_ob': 77, 'sideways_adx_thresh': 28.377053826417377, 'sideways_atr_min_pct': 0.003022140654529175, 'sideways_atr_max_pct': 0.059040338529913, 'sideways_tp_mult': 2.1391500627753657, 'sideways_tsl_mult': 0.43500675546819234, 'sideways_time_stop': 190, 'sideways_use_sma': False, 'sideways_use_ema': True, 'sideways_use_atr': False, 'sideways_use_adx': False, 'sideways_use_spike': True, 'sideways_rsi_required': True}.
[I 2025-08-31 05:25:50,141] Trial 670 finished with values: [-1000000000.0, 1000000000.0] and parameters: {'p_sma': 38, 'p_std': 16, 'p_atr': 16, 'p_adx': 8, 'rsi_period': 22, 'ema1': 25, 'ema2': 25, 'slip_atr_k': 0.020613050732598774, 'slip_spread_k': 0.654868366375299, 'spread_hl_frac': 0.009794736448677281, 'bb_std_mult': 2.0722949010027185, 'rsi_os': 15, 'rsi_ob': 60, 'vol_spike': 0.010750117937238925, 'adx_thresh': 10.613986309121774, 'atr_min_pct': 0.023747425403341526, 'atr_max_pct': 0.10984905864791868, 'tp_mult': 2.3980338304643922, 'tsl_mult': 0.8102473530023009, 'strategy': 'mean_reversion', 'time_stop': 288, 'use_sma': True, 'use_atr': True, 'use_adx': False, 'use_ema': False, 'use_spike': True, 'rsi_required': True, 'edge_k': 0.615239963919749, 'edge_cap': 0.823008693138075, 'bull_strategy': 'mean_reversion', 'bull_bb_std_mult': 1.0591189743765907, 'bull_rsi_os': 53, 'bull_rsi_ob': 78, 'bull_adx_thresh': 8.972446103961367, 'bull_atr_min_pct': 0.023205992674086517, 'bull_atr_max_pct': 0.01918426278109529, 'bull_tp_mult': 2.8631291998720863, 'bull_tsl_mult': 0.969459005587611, 'bull_time_stop': 214, 'bull_use_sma': False, 'bull_use_ema': False, 'bull_use_atr': False, 'bull_use_adx': True, 'bull_use_spike': False, 'bull_rsi_required': False, 'bear_strategy': 'breakout', 'bear_bb_std_mult': 1.4904061191451496, 'bear_rsi_os': 31, 'bear_rsi_ob': 85, 'bear_adx_thresh': 31.13394937575645, 'bear_atr_min_pct': 0.007141006007240021, 'bear_atr_max_pct': 0.03547921258949654, 'bear_tp_mult': 1.5239338405775098, 'bear_tsl_mult': 0.2844492008982801, 'bear_time_stop': 244, 'bear_use_sma': True, 'bear_use_ema': True, 'bear_use_atr': True, 'bear_use_adx': False, 'bear_use_spike': False, 'bear_rsi_required': True, 'sideways_strategy': 'breakout', 'sideways_bb_std_mult': 2.5669902408254095, 'sideways_rsi_os': 40, 'sideways_rsi_ob': 56, 'sideways_adx_thresh': 21.503095591130755, 'sideways_atr_min_pct': 0.014741826361278833, 'sideways_atr_max_pct': 0.05993696717520636, 'sideways_tp_mult': 2.6124970607479407, 'sideways_tsl_mult': 0.49255868687709325, 'sideways_time_stop': 204, 'sideways_use_sma': False, 'sideways_use_ema': True, 'sideways_use_atr': False, 'sideways_use_adx': False, 'sideways_use_spike': True, 'sideways_rsi_required': True}.
[I 2025-08-31 05:26:02,301] Trial 671 finished with values: [-1000000000.0, 1000000000.0] and parameters: {'p_sma': 57, 'p_std': 48, 'p_atr': 13, 'p_adx': 7, 'rsi_period': 56, 'ema1': 25, 'ema2': 58, 'slip_atr_k': 0.025992021233293316, 'slip_spread_k': 0.6492259024209943, 'spread_hl_frac': 0.002050049084323078, 'bb_std_mult': 1.9669920650727013, 'rsi_os': 23, 'rsi_ob': 75, 'vol_spike': 0.10374907786380078, 'adx_thresh': 10.613210885950512, 'atr_min_pct': 0.023689528043130067, 'atr_max_pct': 0.10909631365615252, 'tp_mult': 2.4543301191156424, 'tsl_mult': 0.8093655019678371, 'strategy': 'mean_reversion', 'time_stop': 264, 'use_sma': True, 'use_atr': True, 'use_adx': True, 'use_ema': False, 'use_spike': True, 'rsi_required': True, 'edge_k': 0.8322301171014792, 'edge_cap': 0.7255821380580285, 'bull_strategy': 'mean_reversion', 'bull_bb_std_mult': 0.9008174625654305, 'bull_rsi_os': 36, 'bull_rsi_ob': 63, 'bull_adx_thresh': 8.823455276564756, 'bull_atr_min_pct': 0.015358165872550617, 'bull_atr_max_pct': 0.055288202331486014, 'bull_tp_mult': 1.5829384172257732, 'bull_tsl_mult': 0.0350554036031091, 'bull_time_stop': 255, 'bull_use_sma': True, 'bull_use_ema': False, 'bull_use_atr': False, 'bull_use_adx': False, 'bull_use_spike': False, 'bull_rsi_required': False, 'bear_strategy': 'breakout', 'bear_bb_std_mult': 3.0563195118939808, 'bear_rsi_os': 8, 'bear_rsi_ob': 75, 'bear_adx_thresh': 24.710507483548792, 'bear_atr_min_pct': 0.0072316095008180415, 'bear_atr_max_pct': 0.04527519658376373, 'bear_tp_mult': 1.301192203275669, 'bear_tsl_mult': 0.2847055807893931, 'bear_time_stop': 246, 'bear_use_sma': False, 'bear_use_ema': True, 'bear_use_atr': True, 'bear_use_adx': False, 'bear_use_spike': False, 'bear_rsi_required': True, 'sideways_strategy': 'breakout', 'sideways_bb_std_mult': 1.0554021541174563, 'sideways_rsi_os': 47, 'sideways_rsi_ob': 53, 'sideways_adx_thresh': 30.064299256844386, 'sideways_atr_min_pct': 0.014775088947581609, 'sideways_atr_max_pct': 0.03775263935943209, 'sideways_tp_mult': 2.1873484417629094, 'sideways_tsl_mult': 0.4746085323863886, 'sideways_time_stop': 174, 'sideways_use_sma': False, 'sideways_use_ema': True, 'sideways_use_atr': True, 'sideways_use_adx': False, 'sideways_use_spike': False, 'sideways_rsi_required': False}.
[I 2025-08-31 05:26:29,552] Trial 672 finished with values: [-1000000000.0, 1000000000.0] and parameters: {'p_sma': 56, 'p_std': 16, 'p_atr': 16, 'p_adx': 10, 'rsi_period': 22, 'ema1': 25, 'ema2': 24, 'slip_atr_k': 0.02662733125602303, 'slip_spread_k': 0.6941506266711657, 'spread_hl_frac': 0.00669480293364311, 'bb_std_mult': 1.972252030399638, 'rsi_os': 13, 'rsi_ob': 64, 'vol_spike': 0.1052027463792998, 'adx_thresh': 11.883848895461854, 'atr_min_pct': 0.02404609114984306, 'atr_max_pct': 0.131913113545423, 'tp_mult': 2.4705885159231187, 'tsl_mult': 0.8099695520984741, 'strategy': 'mean_reversion', 'time_stop': 38, 'use_sma': True, 'use_atr': True, 'use_adx': False, 'use_ema': False, 'use_spike': True, 'rsi_required': True, 'edge_k': 0.31766556026650583, 'edge_cap': 0.7305821935924576, 'bull_strategy': 'mean_reversion', 'bull_bb_std_mult': 0.8080522976166057, 'bull_rsi_os': 34, 'bull_rsi_ob': 63, 'bull_adx_thresh': 8.45451885295109, 'bull_atr_min_pct': 0.016480991769942218, 'bull_atr_max_pct': 0.027125203893894168, 'bull_tp_mult': 1.5850230351959818, 'bull_tsl_mult': 0.29409281135245546, 'bull_time_stop': 283, 'bull_use_sma': False, 'bull_use_ema': False, 'bull_use_atr': False, 'bull_use_adx': True, 'bull_use_spike': False, 'bull_rsi_required': False, 'bear_strategy': 'breakout', 'bear_bb_std_mult': 0.9258980165481324, 'bear_rsi_os': 31, 'bear_rsi_ob': 85, 'bear_adx_thresh': 24.28005857233821, 'bear_atr_min_pct': 0.007143950265786788, 'bear_atr_max_pct': 0.04203436835808734, 'bear_tp_mult': 1.5168005262173554, 'bear_tsl_mult': 0.28941257592602365, 'bear_time_stop': 271, 'bear_use_sma': True, 'bear_use_ema': True, 'bear_use_atr': True, 'bear_use_adx': False, 'bear_use_spike': False, 'bear_rsi_required': True, 'sideways_strategy': 'breakout', 'sideways_bb_std_mult': 1.0537893392589994, 'sideways_rsi_os': 46, 'sideways_rsi_ob': 56, 'sideways_adx_thresh': 24.391464715437372, 'sideways_atr_min_pct': 0.013160674651984006, 'sideways_atr_max_pct': 0.06008078044801064, 'sideways_tp_mult': 2.1993730997198697, 'sideways_tsl_mult': 0.45174617363573005, 'sideways_time_stop': 202, 'sideways_use_sma': False, 'sideways_use_ema': True, 'sideways_use_atr': False, 'sideways_use_adx': False, 'sideways_use_spike': True, 'sideways_rsi_required': True}.
[I 2025-08-31 05:26:29,979] Trial 673 finished with values: [-1000000000.0, 1000000000.0] and parameters: {'p_sma': 56, 'p_std': 53, 'p_atr': 18, 'p_adx': 29, 'rsi_period': 21, 'ema1': 25, 'ema2': 48, 'slip_atr_k': 0.025840150181067136, 'slip_spread_k': 0.6585920096417721, 'spread_hl_frac': 0.006801153627568343, 'bb_std_mult': 1.1521267937525161, 'rsi_os': 23, 'rsi_ob': 89, 'vol_spike': 0.24316744050250777, 'adx_thresh': 29.423676095444392, 'atr_min_pct': 0.023820648273612566, 'atr_max_pct': 0.10845358047022616, 'tp_mult': 2.0280981658414206, 'tsl_mult': 0.002807498332553282, 'strategy': 'mean_reversion', 'time_stop': 37, 'use_sma': True, 'use_atr': True, 'use_adx': False, 'use_ema': False, 'use_spike': True, 'rsi_required': True, 'edge_k': 0.7113939358710986, 'edge_cap': 0.730821362339398, 'bull_strategy': 'mean_reversion', 'bull_bb_std_mult': 0.7952944536057956, 'bull_rsi_os': 34, 'bull_rsi_ob': 63, 'bull_adx_thresh': 8.588959380537297, 'bull_atr_min_pct': 0.016513460049697597, 'bull_atr_max_pct': 0.06154481494695728, 'bull_tp_mult': 1.58924546082032, 'bull_tsl_mult': 0.5788078615499948, 'bull_time_stop': 192, 'bull_use_sma': False, 'bull_use_ema': False, 'bull_use_atr': False, 'bull_use_adx': True, 'bull_use_spike': False, 'bull_rsi_required': False, 'bear_strategy': 'breakout', 'bear_bb_std_mult': 0.9161952509612077, 'bear_rsi_os': 12, 'bear_rsi_ob': 69, 'bear_adx_thresh': 24.711941930229358, 'bear_atr_min_pct': 0.007143442991657616, 'bear_atr_max_pct': 0.04902719643965141, 'bear_tp_mult': 1.6766010044128818, 'bear_tsl_mult': 0.2183564355219215, 'bear_time_stop': 248, 'bear_use_sma': True, 'bear_use_ema': True, 'bear_use_atr': True, 'bear_use_adx': False, 'bear_use_spike': False, 'bear_rsi_required': True, 'sideways_strategy': 'breakout', 'sideways_bb_std_mult': 1.069701993563889, 'sideways_rsi_os': 32, 'sideways_rsi_ob': 95, 'sideways_adx_thresh': 29.861084167996392, 'sideways_atr_min_pct': 0.013245817239916935, 'sideways_atr_max_pct': 0.03236550664943487, 'sideways_tp_mult': 1.7426009743788626, 'sideways_tsl_mult': 0.4534692479624951, 'sideways_time_stop': 204, 'sideways_use_sma': False, 'sideways_use_ema': True, 'sideways_use_atr': False, 'sideways_use_adx': False, 'sideways_use_spike': True, 'sideways_rsi_required': True}.
[I 2025-08-31 05:26:32,350] Trial 674 finished with values: [-1000000000.0, 1000000000.0] and parameters: {'p_sma': 31, 'p_std': 44, 'p_atr': 18, 'p_adx': 10, 'rsi_period': 71, 'ema1': 26, 'ema2': 26, 'slip_atr_k': 0.026936981730191666, 'slip_spread_k': 0.6999043074150653, 'spread_hl_frac': 0.008993588233739185, 'bb_std_mult': 1.971296429928827, 'rsi_os': 24, 'rsi_ob': 59, 'vol_spike': 0.015358706174313027, 'adx_thresh': 11.882562284659265, 'atr_min_pct': 0.023102991379287507, 'atr_max_pct': 0.08796736640676077, 'tp_mult': 1.9513608514213612, 'tsl_mult': 0.8171650538477937, 'strategy': 'mean_reversion', 'time_stop': 38, 'use_sma': True, 'use_atr': True, 'use_adx': False, 'use_ema': False, 'use_spike': True, 'rsi_required': True, 'edge_k': 0.5255025619196624, 'edge_cap': 0.738361848283208, 'bull_strategy': 'mean_reversion', 'bull_bb_std_mult': 1.0429633087397794, 'bull_rsi_os': 35, 'bull_rsi_ob': 80, 'bull_adx_thresh': 8.487186092715735, 'bull_atr_min_pct': 0.016628133210928393, 'bull_atr_max_pct': 0.05464808022800116, 'bull_tp_mult': 1.5883006858335662, 'bull_tsl_mult': 0.4836376614986529, 'bull_time_stop': 257, 'bull_use_sma': False, 'bull_use_ema': True, 'bull_use_atr': False, 'bull_use_adx': True, 'bull_use_spike': False, 'bull_rsi_required': False, 'bear_strategy': 'breakout', 'bear_bb_std_mult': 2.2286071363999413, 'bear_rsi_os': 12, 'bear_rsi_ob': 82, 'bear_adx_thresh': 24.62918606948881, 'bear_atr_min_pct': 0.00602167889866599, 'bear_atr_max_pct': 0.0659483639978386, 'bear_tp_mult': 1.3723044908777644, 'bear_tsl_mult': 0.18092151404118778, 'bear_time_stop': 289, 'bear_use_sma': True, 'bear_use_ema': False, 'bear_use_atr': True, 'bear_use_adx': False, 'bear_use_spike': False, 'bear_rsi_required': True, 'sideways_strategy': 'breakout', 'sideways_bb_std_mult': 3.100475796178851, 'sideways_rsi_os': 38, 'sideways_rsi_ob': 54, 'sideways_adx_thresh': 24.262343436706388, 'sideways_atr_min_pct': 0.013359581211262473, 'sideways_atr_max_pct': 0.03961376367622894, 'sideways_tp_mult': 2.197858093124767, 'sideways_tsl_mult': 0.45569300380826444, 'sideways_time_stop': 175, 'sideways_use_sma': False, 'sideways_use_ema': True, 'sideways_use_atr': False, 'sideways_use_adx': False, 'sideways_use_spike': True, 'sideways_rsi_required': True}.
