[I 2025-08-31 05:24:18,662] Trial 656 finished with values: [-1000000000.0, 1000000000.0] and parameters: {'p_sma': 59, 'p_std': 13, 'p_atr': 19, 'p_adx': 10, 'rsi_period': 21, 'ema1': 26, 'ema2': 25, 'slip_atr_k': 0.12117940087871987, 'slip_spread_k': 0.7718266053678602, 'spread_hl_frac': 0.007949493710110922, 'bb_std_mult': 1.8996670937692295, 'rsi_os': 25, 'rsi_ob': 66, 'vol_spike': 0.2685608205816747, 'adx_thresh': 10.003904056378376, 'atr_min_pct': 0.017533104886203216, 'atr_max_pct': 0.0925171521330367, 'tp_mult': 2.438454897871826, 'tsl_mult': 0.8321630845375294, 'strategy': 'mean_reversion', 'time_stop': 37, 'use_sma': True, 'use_atr': True, 'use_adx': False, 'use_ema': False, 'use_spike': True, 'rsi_required': True, 'edge_k': 0.10004138593677758, 'edge_cap': 0.7617180562893763, 'bull_strategy': 'mean_reversion', 'bull_bb_std_mult': 0.8127991422107221, 'bull_rsi_os': 49, 'bull_rsi_ob': 88, 'bull_adx_thresh': 7.872847873755594, 'bull_atr_min_pct': 0.005284720284001858, 'bull_atr_max_pct': 0.0215549880736506, 'bull_tp_mult': 1.8408397122260975, 'bull_tsl_mult': 0.9199934506623297, 'bull_time_stop': 279, 'bull_use_sma': False, 'bull_use_ema': True, 'bull_use_atr': False, 'bull_use_adx': True, 'bull_use_spike': False, 'bull_rsi_required': False, 'bear_strategy': 'breakout', 'bear_bb_std_mult': 0.6647844273433311, 'bear_rsi_os': 53, 'bear_rsi_ob': 67, 'bear_adx_thresh': 8.403431901340085, 'bear_atr_min_pct': 0.007837731235623603, 'bear_atr_max_pct': 0.04780485178506734, 'bear_tp_mult': 1.0960701071638779, 'bear_tsl_mult': 0.1464197141697962, 'bear_time_stop': 266, 'bear_use_sma': True, 'bear_use_ema': False, 'bear_use_atr': True, 'bear_use_adx': False, 'bear_use_spike': False, 'bear_rsi_required': True, 'sideways_strategy': 'breakout', 'sideways_bb_std_mult': 1.939970810953452, 'sideways_rsi_os': 39, 'sideways_rsi_ob': 72, 'sideways_adx_thresh': 26.202404372652573, 'sideways_atr_min_pct': 0.013880980232576272, 'sideways_atr_max_pct': 0.02362932472672993, 'sideways_tp_mult': 2.0448680929656975, 'sideways_tsl_mult': 0.4711934291050982, 'sideways_time_stop': 224, 'sideways_use_sma': False, 'sideways_use_ema': True, 'sideways_use_atr': False, 'sideways_use_adx': False, 'sideways_use_spike': True, 'sideways_rsi_required': True}.
[I 2025-08-31 05:24:23,220] Trial 658 finished with values: [-1000000000.0, 1000000000.0] and parameters: {'p_sma': 57, 'p_std': 13, 'p_atr': 19, 'p_adx': 10, 'rsi_period': 21, 'ema1': 21, 'ema2': 26, 'slip_atr_k': 0.017690067724634807, 'slip_spread_k': 0.7863431410205852, 'spread_hl_frac': 0.007777361281039162, 'bb_std_mult': 1.9956726230081632, 'rsi_os': 21, 'rsi_ob': 58, 'vol_spike': 0.1331979554838587, 'adx_thresh': 11.501732513931056, 'atr_min_pct': 0.023663529582037122, 'atr_max_pct': 0.11489539367256876, 'tp_mult': 2.2125551021837717, 'tsl_mult': 0.8184834195101803, 'strategy': 'mean_reversion', 'time_stop': 37, 'use_sma': True, 'use_atr': True, 'use_adx': False, 'use_ema': False, 'use_spike': True, 'rsi_required': True, 'edge_k': 0.4568968825244969, 'edge_cap': 0.7610686648442206, 'bull_strategy': 'mean_reversion', 'bull_bb_std_mult': 1.1201564828307717, 'bull_rsi_os': 48, 'bull_rsi_ob': 79, 'bull_adx_thresh': 7.855873382037747, 'bull_atr_min_pct': 0.017282852139872705, 'bull_atr_max_pct': 0.021632793742550394, 'bull_tp_mult': 2.566529621234389, 'bull_tsl_mult': 0.9361585453459293, 'bull_time_stop': 289, 'bull_use_sma': False, 'bull_use_ema': False, 'bull_use_atr': False, 'bull_use_adx': True, 'bull_use_spike': False, 'bull_rsi_required': False, 'bear_strategy': 'breakout', 'bear_bb_std_mult': 2.592348789324416, 'bear_rsi_os': 22, 'bear_rsi_ob': 78, 'bear_adx_thresh': 33.32913957577746, 'bear_atr_min_pct': 0.008173881848456684, 'bear_atr_max_pct': 0.07931295793639008, 'bear_tp_mult': 1.5821926913201159, 'bear_tsl_mult': 0.2681874410377735, 'bear_time_stop': 269, 'bear_use_sma': True, 'bear_use_ema': True, 'bear_use_atr': True, 'bear_use_adx': False, 'bear_use_spike': False, 'bear_rsi_required': True, 'sideways_strategy': 'breakout', 'sideways_bb_std_mult': 2.323532170909734, 'sideways_rsi_os': 43, 'sideways_rsi_ob': 55, 'sideways_adx_thresh': 24.68623540985381, 'sideways_atr_min_pct': 0.01429870751493981, 'sideways_atr_max_pct': 0.050969827670292, 'sideways_tp_mult': 2.036633345092016, 'sideways_tsl_mult': 0.47858671607415887, 'sideways_time_stop': 223, 'sideways_use_sma': False, 'sideways_use_ema': True, 'sideways_use_atr': False, 'sideways_use_adx': False, 'sideways_use_spike': True, 'sideways_rsi_required': True}.
[I 2025-08-31 05:24:24,143] Trial 659 finished with values: [-1000000000.0, 1000000000.0] and parameters: {'p_sma': 57, 'p_std': 17, 'p_atr': 15, 'p_adx': 10, 'rsi_period': 21, 'ema1': 21, 'ema2': 15, 'slip_atr_k': 0.02910948872331106, 'slip_spread_k': 0.7909876539551537, 'spread_hl_frac': 0.007804188876748396, 'bb_std_mult': 0.6545575866627196, 'rsi_os': 21, 'rsi_ob': 58, 'vol_spike': 0.006971529147805158, 'adx_thresh': 27.79310990743823, 'atr_min_pct': 0.018526444799832384, 'atr_max_pct': 0.11503076289528813, 'tp_mult': 2.199067905169635, 'tsl_mult': 0.8121453137984309, 'strategy': 'mean_reversion', 'time_stop': 37, 'use_sma': False, 'use_atr': True, 'use_adx': False, 'use_ema': False, 'use_spike': True, 'rsi_required': True, 'edge_k': 0.09776455657185124, 'edge_cap': 0.7665424736964662, 'bull_strategy': 'mean_reversion', 'bull_bb_std_mult': 0.9675242555740841, 'bull_rsi_os': 48, 'bull_rsi_ob': 77, 'bull_adx_thresh': 6.9635185162719555, 'bull_atr_min_pct': 0.01285853813712036, 'bull_atr_max_pct': 0.07373843160376373, 'bull_tp_mult': 2.5418176650425184, 'bull_tsl_mult': 0.875901723592003, 'bull_time_stop': 221, 'bull_use_sma': False, 'bull_use_ema': False, 'bull_use_atr': True, 'bull_use_adx': True, 'bull_use_spike': False, 'bull_rsi_required': False, 'bear_strategy': 'breakout', 'bear_bb_std_mult': 0.8972337474372009, 'bear_rsi_os': 23, 'bear_rsi_ob': 73, 'bear_adx_thresh': 23.130511832946375, 'bear_atr_min_pct': 0.007872014680673244, 'bear_atr_max_pct': 0.04735276597500504, 'bear_tp_mult': 1.0975094085903487, 'bear_tsl_mult': 0.07951279694674745, 'bear_time_stop': 222, 'bear_use_sma': True, 'bear_use_ema': True, 'bear_use_atr': False, 'bear_use_adx': False, 'bear_use_spike': False, 'bear_rsi_required': True, 'sideways_strategy': 'breakout', 'sideways_bb_std_mult': 1.3801777827741704, 'sideways_rsi_os': 34, 'sideways_rsi_ob': 55, 'sideways_adx_thresh': 26.637268165163874, 'sideways_atr_min_pct': 0.029384399036374267, 'sideways_atr_max_pct': 0.06671606070755089, 'sideways_tp_mult': 2.1927972737799126, 'sideways_tsl_mult': 0.48382836091756753, 'sideways_time_stop': 223, 'sideways_use_sma': False, 'sideways_use_ema': True, 'sideways_use_atr': False, 'sideways_use_adx': False, 'sideways_use_spike': True, 'sideways_rsi_required': True}.
[I 2025-08-31 05:24:24,489] Trial 660 finished with values: [-1000000000.0, 1000000000.0] and parameters: {'p_sma': 57, 'p_std': 17, 'p_atr': 15, 'p_adx': 28, 'rsi_period': 19, 'ema1': 23, 'ema2': 15, 'slip_atr_k': 0.029918619147944178, 'slip_spread_k': 0.48205166599395455, 'spread_hl_frac': 0.008690516281672368, 'bb_std_mult': 0.6997028519715698, 'rsi_os': 51, 'rsi_ob': 59, 'vol_spike': 0.2780265876990106, 'adx_thresh': 8.300587745376392, 'atr_min_pct': 0.018516325494297436, 'atr_max_pct': 0.1142435590467011, 'tp_mult': 2.352610681191357, 'tsl_mult': 0.8237078629721687, 'strategy': 'mean_reversion', 'time_stop': 32, 'use_sma': False, 'use_atr': True, 'use_adx': False, 'use_ema': False, 'use_spike': True, 'rsi_required': True, 'edge_k': 0.8911863754587239, 'edge_cap': 0.7355205655431063, 'bull_strategy': 'mean_reversion', 'bull_bb_std_mult': 0.9724424838642624, 'bull_rsi_os': 52, 'bull_rsi_ob': 61, 'bull_adx_thresh': 6.973542855544816, 'bull_atr_min_pct': 0.0063158627502474095, 'bull_atr_max_pct': 0.07269607048833687, 'bull_tp_mult': 1.6429234739046468, 'bull_tsl_mult': 0.8673575016371797, 'bull_time_stop': 222, 'bull_use_sma': False, 'bull_use_ema': False, 'bull_use_atr': True, 'bull_use_adx': True, 'bull_use_spike': False, 'bull_rsi_required': False, 'bear_strategy': 'breakout', 'bear_bb_std_mult': 2.6290470060711137, 'bear_rsi_os': 9, 'bear_rsi_ob': 83, 'bear_adx_thresh': 23.651024926345265, 'bear_atr_min_pct': 0.008063674205546847, 'bear_atr_max_pct': 0.012903153535541681, 'bear_tp_mult': 1.185322384359696, 'bear_tsl_mult': 0.8315575030131964, 'bear_time_stop': 222, 'bear_use_sma': True, 'bear_use_ema': True, 'bear_use_atr': False, 'bear_use_adx': False, 'bear_use_spike': False, 'bear_rsi_required': True, 'sideways_strategy': 'breakout', 'sideways_bb_std_mult': 1.3477506859360873, 'sideways_rsi_os': 34, 'sideways_rsi_ob': 55, 'sideways_adx_thresh': 23.24241917764714, 'sideways_atr_min_pct': 0.02869116855530146, 'sideways_atr_max_pct': 0.06636179791889202, 'sideways_tp_mult': 2.0690113388887053, 'sideways_tsl_mult': 0.508177651091135, 'sideways_time_stop': 181, 'sideways_use_sma': True, 'sideways_use_ema': True, 'sideways_use_atr': False, 'sideways_use_adx': False, 'sideways_use_spike': True, 'sideways_rsi_required': True}.
[I 2025-08-31 05:24:25,855] Trial 662 finished with values: [-1000000000.0, 1000000000.0] and parameters: {'p_sma': 40, 'p_std': 17, 'p_atr': 15, 'p_adx': 9, 'rsi_period': 19, 'ema1': 23, 'ema2': 53, 'slip_atr_k': 0.029448638549066004, 'slip_spread_k': 0.4778852534071669, 'spread_hl_frac': 0.009318445261631765, 'bb_std_mult': 0.6717448385278524, 'rsi_os': 50, 'rsi_ob': 62, 'vol_spike': 0.019702027659269525, 'adx_thresh': 12.403981203714842, 'atr_min_pct': 0.02868187190556265, 'atr_max_pct': 0.132453042243942, 'tp_mult': 2.513321652360695, 'tsl_mult': 0.7844280419776893, 'strategy': 'mean_reversion', 'time_stop': 30, 'use_sma': False, 'use_atr': True, 'use_adx': False, 'use_ema': True, 'use_spike': False, 'rsi_required': True, 'edge_k': 0.29083160609158165, 'edge_cap': 0.7783528498363415, 'bull_strategy': 'mean_reversion', 'bull_bb_std_mult': 1.0122855006880704, 'bull_rsi_os': 51, 'bull_rsi_ob': 65, 'bull_adx_thresh': 6.962618056781965, 'bull_atr_min_pct': 0.007219935572015173, 'bull_atr_max_pct': 0.07139308611923158, 'bull_tp_mult': 1.6358138683906542, 'bull_tsl_mult': 0.8752344575828872, 'bull_time_stop': 224, 'bull_use_sma': False, 'bull_use_ema': False, 'bull_use_atr': True, 'bull_use_adx': True, 'bull_use_spike': True, 'bull_rsi_required': False, 'bear_strategy': 'breakout', 'bear_bb_std_mult': 0.9057199534259619, 'bear_rsi_os': 15, 'bear_rsi_ob': 84, 'bear_adx_thresh': 28.120884187625578, 'bear_atr_min_pct': 0.009424199903393486, 'bear_atr_max_pct': 0.01246479287190698, 'bear_tp_mult': 1.18191491752733, 'bear_tsl_mult': 0.2448984972964459, 'bear_time_stop': 252, 'bear_use_sma': True, 'bear_use_ema': True, 'bear_use_atr': False, 'bear_use_adx': False, 'bear_use_spike': False, 'bear_rsi_required': True, 'sideways_strategy': 'breakout', 'sideways_bb_std_mult': 1.837565181176815, 'sideways_rsi_os': 37, 'sideways_rsi_ob': 54, 'sideways_adx_thresh': 23.20937340294327, 'sideways_atr_min_pct': 0.009942384889383465, 'sideways_atr_max_pct': 0.06515942781954877, 'sideways_tp_mult': 2.2304886221593243, 'sideways_tsl_mult': 0.508165062096344, 'sideways_time_stop': 200, 'sideways_use_sma': True, 'sideways_use_ema': True, 'sideways_use_atr': False, 'sideways_use_adx': False, 'sideways_use_spike': True, 'sideways_rsi_required': True}.
[I 2025-08-31 05:25:03,198] Trial 661 finished with values: [-1000000000.0, 1000000000.0] and parameters: {'p_sma': 25, 'p_std': 31, 'p_atr': 15, 'p_adx': 9, 'rsi_period': 19, 'ema1': 23, 'ema2': 26, 'slip_atr_k': 0.11127223167589238, 'slip_spread_k': 0.47479352313212025, 'spread_hl_frac': 0.03951631632712901, 'bb_std_mult': 2.0011927953067974, 'rsi_os': 41, 'rsi_ob': 59, 'vol_spike': 0.018909555923387104, 'adx_thresh': 11.560014790045015, 'atr_min_pct': 0.018838796625263877, 'atr_max_pct': 0.10372013654876837, 'tp_mult': 2.502279841212447, 'tsl_mult': 0.8203104380315657, 'strategy': 'mean_reversion', 'time_stop': 29, 'use_sma': False, 'use_atr': True, 'use_adx': False, 'use_ema': False, 'use_spike': True, 'rsi_required': True, 'edge_k': 0.7678115118751578, 'edge_cap': 0.7826562345668884, 'bull_strategy': 'mean_reversion', 'bull_bb_std_mult': 1.1382702890468397, 'bull_rsi_os': 55, 'bull_rsi_ob': 61, 'bull_adx_thresh': 9.617830205023767, 'bull_atr_min_pct': 0.01723221063709417, 'bull_atr_max_pct': 0.09017319539325228, 'bull_tp_mult': 1.6444582429717711, 'bull_tsl_mult': 0.8759346932550065, 'bull_time_stop': 223, 'bull_use_sma': False, 'bull_use_ema': False, 'bull_use_atr': True, 'bull_use_adx': True, 'bull_use_spike': False, 'bull_rsi_required': False, 'bear_strategy': 'breakout', 'bear_bb_std_mult': 2.619113845758404, 'bear_rsi_os': 9, 'bear_rsi_ob': 79, 'bear_adx_thresh': 32.23389755472334, 'bear_atr_min_pct': 0.008146766654657554, 'bear_atr_max_pct': 0.08155645522853565, 'bear_tp_mult': 1.588520091014427, 'bear_tsl_mult': 0.3856231301585501, 'bear_time_stop': 252, 'bear_use_sma': True, 'bear_use_ema': True, 'bear_use_atr': False, 'bear_use_adx': False, 'bear_use_spike': False, 'bear_rsi_required': True, 'sideways_strategy': 'breakout', 'sideways_bb_std_mult': 1.3759709878032742, 'sideways_rsi_os': 34, 'sideways_rsi_ob': 55, 'sideways_adx_thresh': 23.361565654316916, 'sideways_atr_min_pct': 0.009074448578663906, 'sideways_atr_max_pct': 0.05069116634322269, 'sideways_tp_mult': 2.0605629242254313, 'sideways_tsl_mult': 0.536436434549629, 'sideways_time_stop': 237, 'sideways_use_sma': True, 'sideways_use_ema': True, 'sideways_use_atr': False, 'sideways_use_adx': False, 'sideways_use_spike': True, 'sideways_rsi_required': True}.
[I 2025-08-31 05:25:06,470] Trial 664 finished with values: [-1000000000.0, 1000000000.0] and parameters: {'p_sma': 43, 'p_std': 14, 'p_atr': 14, 'p_adx': 9, 'rsi_period': 19, 'ema1': 28, 'ema2': 35, 'slip_atr_k': 0.10928774781735276, 'slip_spread_k': 0.7317462295161141, 'spread_hl_frac': 0.010748342720737032, 'bb_std_mult': 2.3287300173031875, 'rsi_os': 46, 'rsi_ob': 86, 'vol_spike': 0.17931800689859956, 'adx_thresh': 12.375039873438412, 'atr_min_pct': 0.028654864659788393, 'atr_max_pct': 0.10411189568278509, 'tp_mult': 1.5056776141462578, 'tsl_mult': 0.7957784444139685, 'strategy': 'mean_reversion', 'time_stop': 29, 'use_sma': False, 'use_atr': True, 'use_adx': False, 'use_ema': True, 'use_spike': False, 'rsi_required': True, 'edge_k': 0.3933917328891595, 'edge_cap': 0.7844781765832636, 'bull_strategy': 'mean_reversion', 'bull_bb_std_mult': 0.8281891762184099, 'bull_rsi_os': 51, 'bull_rsi_ob': 89, 'bull_adx_thresh': 9.414868052942179, 'bull_atr_min_pct': 0.02168177121400351, 'bull_atr_max_pct': 0.024558957377346508, 'bull_tp_mult': 2.6237342768443868, 'bull_tsl_mult': 0.7296059366054874, 'bull_time_stop': 208, 'bull_use_sma': False, 'bull_use_ema': False, 'bull_use_atr': True, 'bull_use_adx': True, 'bull_use_spike': True, 'bull_rsi_required': False, 'bear_strategy': 'breakout', 'bear_bb_std_mult': 0.8134297980411522, 'bear_rsi_os': 9, 'bear_rsi_ob': 76, 'bear_adx_thresh': 5.7091155976085695, 'bear_atr_min_pct': 0.00932868941380204, 'bear_atr_max_pct': 0.04031107650267786, 'bear_tp_mult': 1.6258708026849156, 'bear_tsl_mult': 0.9096834439684293, 'bear_time_stop': 276, 'bear_use_sma': True, 'bear_use_ema': True, 'bear_use_atr': True, 'bear_use_adx': False, 'bear_use_spike': False, 'bear_rsi_required': True, 'sideways_strategy': 'breakout', 'sideways_bb_std_mult': 1.1631534686068488, 'sideways_rsi_os': 32, 'sideways_rsi_ob': 47, 'sideways_adx_thresh': 25.85178600031914, 'sideways_atr_min_pct': 0.013153638030125755, 'sideways_atr_max_pct': 0.045499276974394216, 'sideways_tp_mult': 2.1417900902035387, 'sideways_tsl_mult': 0.5342372335219348, 'sideways_time_stop': 195, 'sideways_use_sma': True, 'sideways_use_ema': True, 'sideways_use_atr': False, 'sideways_use_adx': False, 'sideways_use_spike': True, 'sideways_rsi_required': True}.
[I 2025-08-31 05:25:07,220] Trial 663 finished with values: [-1000000000.0, 1000000000.0] and parameters: {'p_sma': 56, 'p_std': 31, 'p_atr': 17, 'p_adx': 9, 'rsi_period': 19, 'ema1': 23, 'ema2': 27, 'slip_atr_k': 0.03603863436474453, 'slip_spread_k': 0.4752727832845526, 'spread_hl_frac': 0.009205942029908383, 'bb_std_mult': 2.3415172291774224, 'rsi_os': 49, 'rsi_ob': 86, 'vol_spike': 0.01952627375475441, 'adx_thresh': 21.645490552104373, 'atr_min_pct': 0.0023560580089587845, 'atr_max_pct': 0.1454507061998487, 'tp_mult': 2.1132247862335998, 'tsl_mult': 0.7821424994838244, 'strategy': 'mean_reversion', 'time_stop': 31, 'use_sma': False, 'use_atr': True, 'use_adx': False, 'use_ema': True, 'use_spike': False, 'rsi_required': True, 'edge_k': 0.7686778527505936, 'edge_cap': 0.7829010864149007, 'bull_strategy': 'mean_reversion', 'bull_bb_std_mult': 0.9656519074013464, 'bull_rsi_os': 43, 'bull_rsi_ob': 66, 'bull_adx_thresh': 9.65422025173164, 'bull_atr_min_pct': 0.01122320352034412, 'bull_atr_max_pct': 0.09257268207401527, 'bull_tp_mult': 1.6353341683750355, 'bull_tsl_mult': 0.9159369695032435, 'bull_time_stop': 264, 'bull_use_sma': False, 'bull_use_ema': False, 'bull_use_atr': True, 'bull_use_adx': True, 'bull_use_spike': True, 'bull_rsi_required': False, 'bear_strategy': 'breakout', 'bear_bb_std_mult': 0.8451819972170703, 'bear_rsi_os': 9, 'bear_rsi_ob': 79, 'bear_adx_thresh': 25.073634981989713, 'bear_atr_min_pct': 0.010760529119287522, 'bear_atr_max_pct': 0.012700939469316955, 'bear_tp_mult': 1.179281525643565, 'bear_tsl_mult': 0.24385937998238424, 'bear_time_stop': 234, 'bear_use_sma': True, 'bear_use_ema': True, 'bear_use_atr': False, 'bear_use_adx': False, 'bear_use_spike': False, 'bear_rsi_required': True, 'sideways_strategy': 'breakout', 'sideways_bb_std_mult': 1.16753950838449, 'sideways_rsi_os': 37, 'sideways_rsi_ob': 54, 'sideways_adx_thresh': 25.69049122425653, 'sideways_atr_min_pct': 0.003315274091767127, 'sideways_atr_max_pct': 0.028796620455059884, 'sideways_tp_mult': 2.083773220362767, 'sideways_tsl_mult': 0.5124170660588298, 'sideways_time_stop': 198, 'sideways_use_sma': True, 'sideways_use_ema': True, 'sideways_use_atr': False, 'sideways_use_adx': False, 'sideways_use_spike': True, 'sideways_rsi_required': True}.
[I 2025-08-31 05:25:09,814] Trial 667 finished with values: [-1000000000.0, 1000000000.0] and parameters: {'p_sma': 59, 'p_std': 10, 'p_atr': 17, 'p_adx': 30, 'rsi_period': 17, 'ema1': 20, 'ema2': 24, 'slip_atr_k': 0.03615662092718935, 'slip_spread_k': 0.7419934639971071, 'spread_hl_frac': 0.02815950151068309, 'bb_std_mult': 2.1269302471952583, 'rsi_os': 16, 'rsi_ob': 50, 'vol_spike': 0.000206572558773703, 'adx_thresh': 10.860854207403065, 'atr_min_pct': 0.01154178874932789, 'atr_max_pct': 0.08402070471789681, 'tp_mult': 2.4637432111074262, 'tsl_mult': 0.8503870541752923, 'strategy': 'mean_reversion', 'time_stop': 12, 'use_sma': False, 'use_atr': True, 'use_adx': True, 'use_ema': False, 'use_spike': True, 'rsi_required': True, 'edge_k': 0.5923405772319075, 'edge_cap': 0.743910122564575, 'bull_strategy': 'breakout', 'bull_bb_std_mult': 0.8760598075180235, 'bull_rsi_os': 42, 'bull_rsi_ob': 77, 'bull_adx_thresh': 9.726687081256781, 'bull_atr_min_pct': 0.010568474051990382, 'bull_atr_max_pct': 0.06536894538873134, 'bull_tp_mult': 1.686794790843452, 'bull_tsl_mult': 0.9091236985831667, 'bull_time_stop': 274, 'bull_use_sma': True, 'bull_use_ema': False, 'bull_use_atr': True, 'bull_use_adx': False, 'bull_use_spike': False, 'bull_rsi_required': False, 'bear_strategy': 'breakout', 'bear_bb_std_mult': 3.3770902521758863, 'bear_rsi_os': 47, 'bear_rsi_ob': 73, 'bear_adx_thresh': 17.921447155901255, 'bear_atr_min_pct': 0.01076325318593305, 'bear_atr_max_pct': 0.09517232550277982, 'bear_tp_mult': 1.2571056855635558, 'bear_tsl_mult': 0.21878834646992865, 'bear_time_stop': 232, 'bear_use_sma': False, 'bear_use_ema': True, 'bear_use_atr': True, 'bear_use_adx': False, 'bear_use_spike': False, 'bear_rsi_required': False, 'sideways_strategy': 'breakout', 'sideways_bb_std_mult': 1.2697882204412831, 'sideways_rsi_os': 42, 'sideways_rsi_ob': 91, 'sideways_adx_thresh': 28.664176802046118, 'sideways_atr_min_pct': 0.023366679219430184, 'sideways_atr_max_pct': 0.010026538349947225, 'sideways_tp_mult': 2.103494627574189, 'sideways_tsl_mult': 0.43414419349238903, 'sideways_time_stop': 213, 'sideways_use_sma': False, 'sideways_use_ema': True, 'sideways_use_atr': True, 'sideways_use_adx': False, 'sideways_use_spike': False, 'sideways_rsi_required': False}.
