[I 2025-08-31 05:22:55,192] Trial 648 finished with values: [-1000000000.0, 1000000000.0] and parameters: {'p_sma': 58, 'p_std': 27, 'p_atr': 16, 'p_adx': 8, 'rsi_period': 18, 'ema1': 24, 'ema2': 24, 'slip_atr_k': 0.025176001486281734, 'slip_spread_k': 0.6526196644105761, 'spread_hl_frac': 0.04118469547254482, 'bb_std_mult': 2.918403984986619, 'rsi_os': 39, 'rsi_ob': 73, 'vol_spike': 0.013011631777187376, 'adx_thresh': 10.942483500194324, 'atr_min_pct': 0.005533181433572936, 'atr_max_pct': 0.10978006585731592, 'tp_mult': 2.370894588559461, 'tsl_mult': 0.7836680473941078, 'strategy': 'mean_reversion', 'time_stop': 28, 'use_sma': False, 'use_atr': True, 'use_adx': True, 'use_ema': False, 'use_spike': True, 'rsi_required': True, 'edge_k': 0.5366923554316095, 'edge_cap': 0.7435938012569923, 'bull_strategy': 'breakout', 'bull_bb_std_mult': 1.0177713124383387, 'bull_rsi_os': 45, 'bull_rsi_ob': 82, 'bull_adx_thresh': 9.599475245209755, 'bull_atr_min_pct': 0.026357299728527475, 'bull_atr_max_pct': 0.029069609239996703, 'bull_tp_mult': 2.787891806509826, 'bull_tsl_mult': 0.3310670212996214, 'bull_time_stop': 235, 'bull_use_sma': True, 'bull_use_ema': False, 'bull_use_atr': True, 'bull_use_adx': False, 'bull_use_spike': False, 'bull_rsi_required': False, 'bear_strategy': 'breakout', 'bear_bb_std_mult': 0.9011611272690794, 'bear_rsi_os': 11, 'bear_rsi_ob': 70, 'bear_adx_thresh': 15.077858071446553, 'bear_atr_min_pct': 0.009224280350791272, 'bear_atr_max_pct': 0.042044975532410434, 'bear_tp_mult': 1.0609940337605714, 'bear_tsl_mult': 0.2039730982924971, 'bear_time_stop': 257, 'bear_use_sma': False, 'bear_use_ema': True, 'bear_use_atr': True, 'bear_use_adx': False, 'bear_use_spike': False, 'bear_rsi_required': False, 'sideways_strategy': 'breakout', 'sideways_bb_std_mult': 1.2478441209131066, 'sideways_rsi_os': 36, 'sideways_rsi_ob': 56, 'sideways_adx_thresh': 26.089521180301933, 'sideways_atr_min_pct': 0.015264740301641967, 'sideways_atr_max_pct': 0.071893608740709, 'sideways_tp_mult': 2.041492553613248, 'sideways_tsl_mult': 0.5334938080649176, 'sideways_time_stop': 211, 'sideways_use_sma': False, 'sideways_use_ema': True, 'sideways_use_atr': True, 'sideways_use_adx': False, 'sideways_use_spike': False, 'sideways_rsi_required': False}.
[I 2025-08-31 05:22:56,239] Trial 646 finished with values: [-1000000000.0, 1000000000.0] and parameters: {'p_sma': 56, 'p_std': 15, 'p_atr': 13, 'p_adx': 9, 'rsi_period': 18, 'ema1': 25, 'ema2': 24, 'slip_atr_k': 0.024900576828614768, 'slip_spread_k': 0.5103614627373755, 'spread_hl_frac': 0.041114156162969734, 'bb_std_mult': 2.0517189798729576, 'rsi_os': 40, 'rsi_ob': 60, 'vol_spike': 0.014303025962157507, 'adx_thresh': 27.082454720492255, 'atr_min_pct': 0.022608284427456327, 'atr_max_pct': 0.13888004014429803, 'tp_mult': 2.4905638177912643, 'tsl_mult': 0.8091828326651659, 'strategy': 'mean_reversion', 'time_stop': 36, 'use_sma': False, 'use_atr': True, 'use_adx': True, 'use_ema': True, 'use_spike': False, 'rsi_required': True, 'edge_k': 0.3592925847668278, 'edge_cap': 0.7093085847200837, 'bull_strategy': 'breakout', 'bull_bb_std_mult': 0.9064371055284564, 'bull_rsi_os': 46, 'bull_rsi_ob': 81, 'bull_adx_thresh': 9.808217403121091, 'bull_atr_min_pct': 0.0260454118915634, 'bull_atr_max_pct': 0.07774419144307407, 'bull_tp_mult': 1.6702030362867706, 'bull_tsl_mult': 0.3340139950739459, 'bull_time_stop': 256, 'bull_use_sma': True, 'bull_use_ema': False, 'bull_use_atr': True, 'bull_use_adx': False, 'bull_use_spike': True, 'bull_rsi_required': False, 'bear_strategy': 'breakout', 'bear_bb_std_mult': 0.7537089167534974, 'bear_rsi_os': 11, 'bear_rsi_ob': 71, 'bear_adx_thresh': 16.627292468950113, 'bear_atr_min_pct': 0.009927863466980946, 'bear_atr_max_pct': 0.04428437340456642, 'bear_tp_mult': 1.2939170832932247, 'bear_tsl_mult': 0.23041559383162952, 'bear_time_stop': 259, 'bear_use_sma': False, 'bear_use_ema': True, 'bear_use_atr': True, 'bear_use_adx': False, 'bear_use_spike': False, 'bear_rsi_required': False, 'sideways_strategy': 'breakout', 'sideways_bb_std_mult': 1.178281968870477, 'sideways_rsi_os': 36, 'sideways_rsi_ob': 93, 'sideways_adx_thresh': 29.456891444446192, 'sideways_atr_min_pct': 0.013469323564399586, 'sideways_atr_max_pct': 0.02836784404240309, 'sideways_tp_mult': 2.0456957200197907, 'sideways_tsl_mult': 0.5089404578427147, 'sideways_time_stop': 218, 'sideways_use_sma': False, 'sideways_use_ema': True, 'sideways_use_atr': True, 'sideways_use_adx': False, 'sideways_use_spike': False, 'sideways_rsi_required': False}.
[I 2025-08-31 05:23:36,383] Trial 650 finished with values: [-1000000000.0, 1000000000.0] and parameters: {'p_sma': 56, 'p_std': 34, 'p_atr': 16, 'p_adx': 8, 'rsi_period': 18, 'ema1': 22, 'ema2': 23, 'slip_atr_k': 0.025468486923579718, 'slip_spread_k': 0.6172340804334026, 'spread_hl_frac': 0.00904097675479531, 'bb_std_mult': 2.098742702483013, 'rsi_os': 33, 'rsi_ob': 67, 'vol_spike': 0.19646934780110772, 'adx_thresh': 25.116495139731878, 'atr_min_pct': 0.0226813256317921, 'atr_max_pct': 0.09979840720929384, 'tp_mult': 1.7003362148010701, 'tsl_mult': 0.8353109159656803, 'strategy': 'mean_reversion', 'time_stop': 27, 'use_sma': False, 'use_atr': True, 'use_adx': True, 'use_ema': False, 'use_spike': True, 'rsi_required': True, 'edge_k': 0.35108757153597075, 'edge_cap': 0.7968712153309059, 'bull_strategy': 'mean_reversion', 'bull_bb_std_mult': 0.9286900314092488, 'bull_rsi_os': 46, 'bull_rsi_ob': 77, 'bull_adx_thresh': 10.066643492581154, 'bull_atr_min_pct': 0.014901474884501123, 'bull_atr_max_pct': 0.03286467723189532, 'bull_tp_mult': 1.9780069148753858, 'bull_tsl_mult': 0.7066378775897455, 'bull_time_stop': 238, 'bull_use_sma': True, 'bull_use_ema': False, 'bull_use_atr': True, 'bull_use_adx': False, 'bull_use_spike': False, 'bull_rsi_required': False, 'bear_strategy': 'breakout', 'bear_bb_std_mult': 1.340948214941172, 'bear_rsi_os': 11, 'bear_rsi_ob': 70, 'bear_adx_thresh': 13.359144012908022, 'bear_atr_min_pct': 0.008471835839838902, 'bear_atr_max_pct': 0.08556215088939934, 'bear_tp_mult': 1.2079395506019686, 'bear_tsl_mult': 0.20153025906398014, 'bear_time_stop': 261, 'bear_use_sma': False, 'bear_use_ema': True, 'bear_use_atr': True, 'bear_use_adx': False, 'bear_use_spike': False, 'bear_rsi_required': True, 'sideways_strategy': 'breakout', 'sideways_bb_std_mult': 1.0989920118899057, 'sideways_rsi_os': 41, 'sideways_rsi_ob': 58, 'sideways_adx_thresh': 27.77306087045675, 'sideways_atr_min_pct': 0.015150947376249562, 'sideways_atr_max_pct': 0.07031756435324156, 'sideways_tp_mult': 2.1001365129060847, 'sideways_tsl_mult': 0.44929716925809515, 'sideways_time_stop': 213, 'sideways_use_sma': False, 'sideways_use_ema': True, 'sideways_use_atr': True, 'sideways_use_adx': False, 'sideways_use_spike': False, 'sideways_rsi_required': False}.
[I 2025-08-31 05:23:37,747] Trial 651 finished with values: [-1000000000.0, 1000000000.0] and parameters: {'p_sma': 56, 'p_std': 15, 'p_atr': 18, 'p_adx': 8, 'rsi_period': 19, 'ema1': 22, 'ema2': 24, 'slip_atr_k': 0.022547557201385564, 'slip_spread_k': 0.6156302406098002, 'spread_hl_frac': 0.010661223236835386, 'bb_std_mult': 2.3965766976347185, 'rsi_os': 43, 'rsi_ob': 61, 'vol_spike': 0.2512593220293907, 'adx_thresh': 5.749275862977848, 'atr_min_pct': 0.027394744972462845, 'atr_max_pct': 0.11114309774722529, 'tp_mult': 1.0112305872055636, 'tsl_mult': 0.764987513189364, 'strategy': 'mean_reversion', 'time_stop': 29, 'use_sma': False, 'use_atr': True, 'use_adx': False, 'use_ema': False, 'use_spike': True, 'rsi_required': True, 'edge_k': 0.6736486450547463, 'edge_cap': 0.7958038365894721, 'bull_strategy': 'mean_reversion', 'bull_bb_std_mult': 0.9127380010346642, 'bull_rsi_os': 38, 'bull_rsi_ob': 84, 'bull_adx_thresh': 8.463160445526597, 'bull_atr_min_pct': 0.00863965275317171, 'bull_atr_max_pct': 0.032611622532995016, 'bull_tp_mult': 1.611568499134779, 'bull_tsl_mult': 0.33673359221198196, 'bull_time_stop': 277, 'bull_use_sma': False, 'bull_use_ema': False, 'bull_use_atr': True, 'bull_use_adx': True, 'bull_use_spike': False, 'bull_rsi_required': False, 'bear_strategy': 'breakout', 'bear_bb_std_mult': 2.357555377273223, 'bear_rsi_os': 17, 'bear_rsi_ob': 80, 'bear_adx_thresh': 11.417543926687628, 'bear_atr_min_pct': 0.006745171211909155, 'bear_atr_max_pct': 0.04242876152851875, 'bear_tp_mult': 1.0531951119552307, 'bear_tsl_mult': 0.19871821091407216, 'bear_time_stop': 300, 'bear_use_sma': True, 'bear_use_ema': True, 'bear_use_atr': True, 'bear_use_adx': False, 'bear_use_spike': False, 'bear_rsi_required': True, 'sideways_strategy': 'breakout', 'sideways_bb_std_mult': 1.074296209383727, 'sideways_rsi_os': 36, 'sideways_rsi_ob': 94, 'sideways_adx_thresh': 27.372578720764412, 'sideways_atr_min_pct': 0.016004357156268564, 'sideways_atr_max_pct': 0.034127499891757146, 'sideways_tp_mult': 2.1140108483818336, 'sideways_tsl_mult': 0.5074469558335787, 'sideways_time_stop': 207, 'sideways_use_sma': False, 'sideways_use_ema': True, 'sideways_use_atr': False, 'sideways_use_adx': False, 'sideways_use_spike': True, 'sideways_rsi_required': True}.
[I 2025-08-31 05:23:39,544] Trial 653 finished with values: [-0.058680829668724566, 0.05865578329568284] and parameters: {'p_sma': 58, 'p_std': 15, 'p_atr': 17, 'p_adx': 16, 'rsi_period': 15, 'ema1': 22, 'ema2': 50, 'slip_atr_k': 0.02035316613317574, 'slip_spread_k': 0.627606582740054, 'spread_hl_frac': 0.010503860662228868, 'bb_std_mult': 2.608193253529914, 'rsi_os': 43, 'rsi_ob': 64, 'vol_spike': 0.1621156304323242, 'adx_thresh': 34.94840451912698, 'atr_min_pct': 0.02129717370290668, 'atr_max_pct': 0.09965311376689137, 'tp_mult': 1.6975787276227483, 'tsl_mult': 0.7742774692124252, 'strategy': 'mean_reversion', 'time_stop': 19, 'use_sma': False, 'use_atr': True, 'use_adx': False, 'use_ema': False, 'use_spike': True, 'rsi_required': True, 'edge_k': 0.2513690327647131, 'edge_cap': 0.8021022738602412, 'bull_strategy': 'mean_reversion', 'bull_bb_std_mult': 0.7810911985409446, 'bull_rsi_os': 38, 'bull_rsi_ob': 79, 'bull_adx_thresh': 8.400440772146261, 'bull_atr_min_pct': 0.014944918742631123, 'bull_atr_max_pct': 0.03203414345203066, 'bull_tp_mult': 1.6009265780651, 'bull_tsl_mult': 0.8942757967760835, 'bull_time_stop': 300, 'bull_use_sma': False, 'bull_use_ema': True, 'bull_use_atr': True, 'bull_use_adx': True, 'bull_use_spike': False, 'bull_rsi_required': False, 'bear_strategy': 'breakout', 'bear_bb_std_mult': 0.6065540613464127, 'bear_rsi_os': 13, 'bear_rsi_ob': 77, 'bear_adx_thresh': 12.920823989220004, 'bear_atr_min_pct': 0.007054421341096587, 'bear_atr_max_pct': 0.0371613366911557, 'bear_tp_mult': 1.4507337454909586, 'bear_tsl_mult': 0.4880893605807235, 'bear_time_stop': 285, 'bear_use_sma': True, 'bear_use_ema': False, 'bear_use_atr': True, 'bear_use_adx': False, 'bear_use_spike': False, 'bear_rsi_required': True, 'sideways_strategy': 'breakout', 'sideways_bb_std_mult': 1.0986659942999124, 'sideways_rsi_os': 42, 'sideways_rsi_ob': 58, 'sideways_adx_thresh': 27.470160720832396, 'sideways_atr_min_pct': 0.00034737612382089444, 'sideways_atr_max_pct': 0.010255051576703084, 'sideways_tp_mult': 2.1019211730208767, 'sideways_tsl_mult': 0.45026232632758306, 'sideways_time_stop': 207, 'sideways_use_sma': False, 'sideways_use_ema': True, 'sideways_use_atr': False, 'sideways_use_adx': False, 'sideways_use_spike': True, 'sideways_rsi_required': True}.
[I 2025-08-31 05:23:39,552] Trial 652 finished with values: [-1000000000.0, 1000000000.0] and parameters: {'p_sma': 56, 'p_std': 15, 'p_atr': 18, 'p_adx': 9, 'rsi_period': 14, 'ema1': 22, 'ema2': 41, 'slip_atr_k': 0.020277578244069443, 'slip_spread_k': 0.6188651391297811, 'spread_hl_frac': 0.031456069938523804, 'bb_std_mult': 1.9245627848756888, 'rsi_os': 33, 'rsi_ob': 90, 'vol_spike': 0.005260936188935139, 'adx_thresh': 5.783395608396468, 'atr_min_pct': 0.02142977726097291, 'atr_max_pct': 0.0991914151504484, 'tp_mult': 1.8233397263609104, 'tsl_mult': 0.7728860710695418, 'strategy': 'mean_reversion', 'time_stop': 23, 'use_sma': False, 'use_atr': True, 'use_adx': False, 'use_ema': False, 'use_spike': True, 'rsi_required': True, 'edge_k': 0.6655022557420378, 'edge_cap': 0.8002729152011411, 'bull_strategy': 'mean_reversion', 'bull_bb_std_mult': 0.9194979480566068, 'bull_rsi_os': 52, 'bull_rsi_ob': 84, 'bull_adx_thresh': 8.689747880089032, 'bull_atr_min_pct': 0.008226465087544056, 'bull_atr_max_pct': 0.03374071020124662, 'bull_tp_mult': 1.6031086252524638, 'bull_tsl_mult': 0.9964576301523047, 'bull_time_stop': 300, 'bull_use_sma': False, 'bull_use_ema': False, 'bull_use_atr': True, 'bull_use_adx': True, 'bull_use_spike': False, 'bull_rsi_required': False, 'bear_strategy': 'breakout', 'bear_bb_std_mult': 1.3143907462038595, 'bear_rsi_os': 11, 'bear_rsi_ob': 82, 'bear_adx_thresh': 12.49003261677414, 'bear_atr_min_pct': 0.005920895492221653, 'bear_atr_max_pct': 0.1383509480326984, 'bear_tp_mult': 1.4436740692666357, 'bear_tsl_mult': 0.4255068030181457, 'bear_time_stop': 282, 'bear_use_sma': True, 'bear_use_ema': True, 'bear_use_atr': True, 'bear_use_adx': False, 'bear_use_spike': False, 'bear_rsi_required': True, 'sideways_strategy': 'breakout', 'sideways_bb_std_mult': 1.095572222261782, 'sideways_rsi_os': 33, 'sideways_rsi_ob': 93, 'sideways_adx_thresh': 27.747136443178306, 'sideways_atr_min_pct': 0.01609848969619129, 'sideways_atr_max_pct': 0.056746235382292044, 'sideways_tp_mult': 2.1061593916052805, 'sideways_tsl_mult': 0.41414476547277645, 'sideways_time_stop': 210, 'sideways_use_sma': False, 'sideways_use_ema': True, 'sideways_use_atr': False, 'sideways_use_adx': False, 'sideways_use_spike': True, 'sideways_rsi_required': True}.
[I 2025-08-31 05:23:40,433] Trial 654 finished with values: [-1000000000.0, 1000000000.0] and parameters: {'p_sma': 58, 'p_std': 15, 'p_atr': 18, 'p_adx': 14, 'rsi_period': 13, 'ema1': 26, 'ema2': 25, 'slip_atr_k': 0.12114721058335513, 'slip_spread_k': 0.5670518858117765, 'spread_hl_frac': 2.175815304366821e-05, 'bb_std_mult': 1.8870136969779647, 'rsi_os': 25, 'rsi_ob': 47, 'vol_spike': 0.25701846402329515, 'adx_thresh': 10.080741301037769, 'atr_min_pct': 0.01765439560317168, 'atr_max_pct': 0.09251492220661969, 'tp_mult': 1.6441849804972692, 'tsl_mult': 0.8390674237864405, 'strategy': 'mean_reversion', 'time_stop': 23, 'use_sma': False, 'use_atr': True, 'use_adx': False, 'use_ema': False, 'use_spike': True, 'rsi_required': True, 'edge_k': 0.6569550610653634, 'edge_cap': 0.7612029362640815, 'bull_strategy': 'mean_reversion', 'bull_bb_std_mult': 0.7505450972889893, 'bull_rsi_os': 53, 'bull_rsi_ob': 78, 'bull_adx_thresh': 8.478931236714898, 'bull_atr_min_pct': 0.014101479166589687, 'bull_atr_max_pct': 0.05646450383763303, 'bull_tp_mult': 1.841746328679832, 'bull_tsl_mult': 0.8957915274743253, 'bull_time_stop': 300, 'bull_use_sma': False, 'bull_use_ema': True, 'bull_use_atr': True, 'bull_use_adx': True, 'bull_use_spike': False, 'bull_rsi_required': False, 'bear_strategy': 'breakout', 'bear_bb_std_mult': 0.6597209622224266, 'bear_rsi_os': 26, 'bear_rsi_ob': 88, 'bear_adx_thresh': 8.825364178078164, 'bear_atr_min_pct': 0.006853867212238708, 'bear_atr_max_pct': 0.020297702347766344, 'bear_tp_mult': 1.4543088130565873, 'bear_tsl_mult': 0.14394017564540892, 'bear_time_stop': 232, 'bear_use_sma': True, 'bear_use_ema': False, 'bear_use_atr': True, 'bear_use_adx': False, 'bear_use_spike': False, 'bear_rsi_required': True, 'sideways_strategy': 'breakout', 'sideways_bb_std_mult': 1.0961715372584815, 'sideways_rsi_os': 39, 'sideways_rsi_ob': 54, 'sideways_adx_thresh': 26.388741122636706, 'sideways_atr_min_pct': 0.0005064371853722247, 'sideways_atr_max_pct': 0.03493378476173051, 'sideways_tp_mult': 2.12288333317007, 'sideways_tsl_mult': 0.4541550260749788, 'sideways_time_stop': 207, 'sideways_use_sma': False, 'sideways_use_ema': True, 'sideways_use_atr': False, 'sideways_use_adx': False, 'sideways_use_spike': True, 'sideways_rsi_required': True}.
[I 2025-08-31 05:23:41,004] Trial 657 finished with values: [-1000000000.0, 1000000000.0] and parameters: {'p_sma': 59, 'p_std': 13, 'p_atr': 19, 'p_adx': 27, 'rsi_period': 21, 'ema1': 26, 'ema2': 17, 'slip_atr_k': 0.017960354566988832, 'slip_spread_k': 0.5701244310441079, 'spread_hl_frac': 0.005264737803072678, 'bb_std_mult': 1.8964566561176106, 'rsi_os': 37, 'rsi_ob': 47, 'vol_spike': 0.12041525592363986, 'adx_thresh': 10.025219142432189, 'atr_min_pct': 0.013613148844736965, 'atr_max_pct': 0.09241047504432467, 'tp_mult': 2.4196671064229394, 'tsl_mult': 0.8329942473827936, 'strategy': 'mean_reversion', 'time_stop': 36, 'use_sma': True, 'use_atr': True, 'use_adx': False, 'use_ema': False, 'use_spike': True, 'rsi_required': True, 'edge_k': 0.45148762437062767, 'edge_cap': 0.7558288665214182, 'bull_strategy': 'mean_reversion', 'bull_bb_std_mult': 0.7205161708541807, 'bull_rsi_os': 50, 'bull_rsi_ob': 79, 'bull_adx_thresh': 7.82646120805782, 'bull_atr_min_pct': 0.005461021338274068, 'bull_atr_max_pct': 0.022930839654244653, 'bull_tp_mult': 1.716917990077298, 'bull_tsl_mult': 0.9229345321475301, 'bull_time_stop': 291, 'bull_use_sma': False, 'bull_use_ema': True, 'bull_use_atr': False, 'bull_use_adx': True, 'bull_use_spike': False, 'bull_rsi_required': False, 'bear_strategy': 'breakout', 'bear_bb_std_mult': 0.8459209598939279, 'bear_rsi_os': 53, 'bear_rsi_ob': 88, 'bear_adx_thresh': 8.688658650354085, 'bear_atr_min_pct': 0.009122063928893243, 'bear_atr_max_pct': 0.09808681620707146, 'bear_tp_mult': 1.348875716086249, 'bear_tsl_mult': 0.2645219319146599, 'bear_time_stop': 267, 'bear_use_sma': True, 'bear_use_ema': False, 'bear_use_atr': True, 'bear_use_adx': False, 'bear_use_spike': False, 'bear_rsi_required': True, 'sideways_strategy': 'breakout', 'sideways_bb_std_mult': 1.2410541202480592, 'sideways_rsi_os': 39, 'sideways_rsi_ob': 67, 'sideways_adx_thresh': 24.782688231481128, 'sideways_atr_min_pct': 0.01422727961410959, 'sideways_atr_max_pct': 0.023189603975021844, 'sideways_tp_mult': 2.0399782521643948, 'sideways_tsl_mult': 0.4662952947083563, 'sideways_time_stop': 190, 'sideways_use_sma': False, 'sideways_use_ema': True, 'sideways_use_atr': False, 'sideways_use_adx': False, 'sideways_use_spike': True, 'sideways_rsi_required': True}.
[I 2025-08-31 05:24:18,526] Trial 655 finished with values: [-1000000000.0, 1000000000.0] and parameters: {'p_sma': 58, 'p_std': 13, 'p_atr': 17, 'p_adx': 27, 'rsi_period': 14, 'ema1': 21, 'ema2': 56, 'slip_atr_k': 0.23309524142449245, 'slip_spread_k': 0.5371770938114068, 'spread_hl_frac': 0.00012316255454673797, 'bb_std_mult': 1.9276049837458031, 'rsi_os': 37, 'rsi_ob': 58, 'vol_spike': 0.004582739787197216, 'adx_thresh': 18.149597442298514, 'atr_min_pct': 0.007911294071871819, 'atr_max_pct': 0.09205899228791571, 'tp_mult': 1.8172612734683764, 'tsl_mult': 0.8402439146044256, 'strategy': 'mean_reversion', 'time_stop': 21, 'use_sma': False, 'use_atr': True, 'use_adx': False, 'use_ema': False, 'use_spike': True, 'rsi_required': True, 'edge_k': 0.25265529741430337, 'edge_cap': 0.7607440883275243, 'bull_strategy': 'mean_reversion', 'bull_bb_std_mult': 0.7282372381325879, 'bull_rsi_os': 48, 'bull_rsi_ob': 79, 'bull_adx_thresh': 7.924892247991644, 'bull_atr_min_pct': 0.013103328348202417, 'bull_atr_max_pct': 0.05637699768346838, 'bull_tp_mult': 1.7281119573830004, 'bull_tsl_mult': 0.8921536875913089, 'bull_time_stop': 285, 'bull_use_sma': False, 'bull_use_ema': True, 'bull_use_atr': True, 'bull_use_adx': True, 'bull_use_spike': False, 'bull_rsi_required': False, 'bear_strategy': 'breakout', 'bear_bb_std_mult': 0.5644054598808395, 'bear_rsi_os': 54, 'bear_rsi_ob': 78, 'bear_adx_thresh': 11.82912485691282, 'bear_atr_min_pct': 0.005594646859891415, 'bear_atr_max_pct': 0.07708915974306417, 'bear_tp_mult': 1.4412103100368139, 'bear_tsl_mult': 0.4207304400298756, 'bear_time_stop': 282, 'bear_use_sma': True, 'bear_use_ema': False, 'bear_use_atr': True, 'bear_use_adx': False, 'bear_use_spike': False, 'bear_rsi_required': True, 'sideways_strategy': 'breakout', 'sideways_bb_std_mult': 1.0866028103158127, 'sideways_rsi_os': 43, 'sideways_rsi_ob': 68, 'sideways_adx_thresh': 26.609536487628787, 'sideways_atr_min_pct': 0.014166741080806598, 'sideways_atr_max_pct': 0.03638444485654409, 'sideways_tp_mult': 2.094060498314532, 'sideways_tsl_mult': 0.4081871049876607, 'sideways_time_stop': 200, 'sideways_use_sma': False, 'sideways_use_ema': True, 'sideways_use_atr': False, 'sideways_use_adx': False, 'sideways_use_spike': True, 'sideways_rsi_required': True}.
