[I 2025-08-31 04:57:59,704] Trial 514 finished with values: [-1000000000.0, 1000000000.0] and parameters: {'p_sma': 53, 'p_std': 19, 'p_atr': 24, 'p_adx': 25, 'rsi_period': 21, 'ema1': 7, 'ema2': 30, 'slip_atr_k': 0.07897773733706889, 'slip_spread_k': 0.16777443932840225, 'spread_hl_frac': 0.008341287906059628, 'bb_std_mult': 3.1011673151829156, 'rsi_os': 22, 'rsi_ob': 85, 'vol_spike': 0.21721331218273582, 'adx_thresh': 13.238401976518334, 'atr_min_pct': 0.021996493375829998, 'atr_max_pct': 0.11428345522562289, 'tp_mult': 2.5974830004711924, 'tsl_mult': 0.8458378263175445, 'strategy': 'breakout', 'time_stop': 193, 'use_sma': False, 'use_atr': False, 'use_adx': False, 'use_ema': False, 'use_spike': True, 'rsi_required': True, 'edge_k': 1.5077944156739724, 'edge_cap': 0.5723337780115529, 'bull_strategy': 'mean_reversion', 'bull_bb_std_mult': 3.3778103448535615, 'bull_rsi_os': 16, 'bull_rsi_ob': 78, 'bull_adx_thresh': 16.49807910103512, 'bull_atr_min_pct': 0.003709655664153167, 'bull_atr_max_pct': 0.04448871195710291, 'bull_tp_mult': 1.583871334243749, 'bull_tsl_mult': 0.9128274684408743, 'bull_time_stop': 254, 'bull_use_sma': False, 'bull_use_ema': False, 'bull_use_atr': True, 'bull_use_adx': True, 'bull_use_spike': False, 'bull_rsi_required': True, 'bear_strategy': 'mean_reversion', 'bear_bb_std_mult': 2.4071200085407645, 'bear_rsi_os': 10, 'bear_rsi_ob': 68, 'bear_adx_thresh': 21.768266801407712, 'bear_atr_min_pct': 0.024318468269090093, 'bear_atr_max_pct': 0.03601620238163712, 'bear_tp_mult': 2.7273573561322983, 'bear_tsl_mult': 0.24814765191343807, 'bear_time_stop': 201, 'bear_use_sma': True, 'bear_use_ema': True, 'bear_use_atr': True, 'bear_use_adx': False, 'bear_use_spike': True, 'bear_rsi_required': True, 'sideways_strategy': 'mean_reversion', 'sideways_bb_std_mult': 3.1638645384821675, 'sideways_rsi_os': 27, 'sideways_rsi_ob': 57, 'sideways_adx_thresh': 17.43064692774643, 'sideways_atr_min_pct': 0.012731322746244923, 'sideways_atr_max_pct': 0.1160496461814078, 'sideways_tp_mult': 1.9538116318703964, 'sideways_tsl_mult': 0.41527885231083245, 'sideways_time_stop': 72, 'sideways_use_sma': False, 'sideways_use_ema': False, 'sideways_use_atr': False, 'sideways_use_adx': True, 'sideways_use_spike': True, 'sideways_rsi_required': True}.
[I 2025-08-31 04:58:00,772] Trial 513 finished with values: [-0.014968113409577155, 0.014902120020556919] and parameters: {'p_sma': 55, 'p_std': 10, 'p_atr': 24, 'p_adx': 8, 'rsi_period': 28, 'ema1': 26, 'ema2': 55, 'slip_atr_k': 0.20929749291789818, 'slip_spread_k': 0.45264065510828483, 'spread_hl_frac': 0.00833093355639536, 'bb_std_mult': 1.8949358498627351, 'rsi_os': 40, 'rsi_ob': 62, 'vol_spike': 0.2325120770458617, 'adx_thresh': 13.473786421009034, 'atr_min_pct': 0.017243295052641352, 'atr_max_pct': 0.04950552467019352, 'tp_mult': 2.4467854908442312, 'tsl_mult': 0.8451091567050836, 'strategy': 'breakout', 'time_stop': 40, 'use_sma': False, 'use_atr': False, 'use_adx': False, 'use_ema': False, 'use_spike': True, 'rsi_required': True, 'edge_k': 0.950013111791177, 'edge_cap': 0.6749288757874207, 'bull_strategy': 'mean_reversion', 'bull_bb_std_mult': 0.5023785166875725, 'bull_rsi_os': 41, 'bull_rsi_ob': 75, 'bull_adx_thresh': 8.402828612514064, 'bull_atr_min_pct': 0.001980695717460009, 'bull_atr_max_pct': 0.0432406392243532, 'bull_tp_mult': 1.8574833027435287, 'bull_tsl_mult': 0.9083484604818944, 'bull_time_stop': 136, 'bull_use_sma': False, 'bull_use_ema': False, 'bull_use_atr': True, 'bull_use_adx': True, 'bull_use_spike': False, 'bull_rsi_required': True, 'bear_strategy': 'mean_reversion', 'bear_bb_std_mult': 1.8939912261315097, 'bear_rsi_os': 51, 'bear_rsi_ob': 50, 'bear_adx_thresh': 15.26681842183227, 'bear_atr_min_pct': 0.02586411775880413, 'bear_atr_max_pct': 0.05188958790059471, 'bear_tp_mult': 2.800771161593743, 'bear_tsl_mult': 0.9063809600866533, 'bear_time_stop': 28, 'bear_use_sma': True, 'bear_use_ema': True, 'bear_use_atr': True, 'bear_use_adx': False, 'bear_use_spike': True, 'bear_rsi_required': True, 'sideways_strategy': 'mean_reversion', 'sideways_bb_std_mult': 0.7944650674558155, 'sideways_rsi_os': 27, 'sideways_rsi_ob': 57, 'sideways_adx_thresh': 12.504571501931624, 'sideways_atr_min_pct': 0.006742590497138726, 'sideways_atr_max_pct': 0.04084788296107178, 'sideways_tp_mult': 1.9441342703888749, 'sideways_tsl_mult': 0.5918482454379979, 'sideways_time_stop': 87, 'sideways_use_sma': False, 'sideways_use_ema': False, 'sideways_use_atr': False, 'sideways_use_adx': True, 'sideways_use_spike': True, 'sideways_rsi_required': True}.
[I 2025-08-31 04:58:00,773] Trial 516 finished with values: [-1000000000.0, 1000000000.0] and parameters: {'p_sma': 53, 'p_std': 32, 'p_atr': 24, 'p_adx': 19, 'rsi_period': 61, 'ema1': 14, 'ema2': 56, 'slip_atr_k': 0.2091112726476636, 'slip_spread_k': 0.12238853181514035, 'spread_hl_frac': 0.008453646079571716, 'bb_std_mult': 0.7234832874623109, 'rsi_os': 40, 'rsi_ob': 51, 'vol_spike': 0.003414035491220893, 'adx_thresh': 10.414054754083754, 'atr_min_pct': 0.008438225837800729, 'atr_max_pct': 0.1224220198092595, 'tp_mult': 2.4594557481932413, 'tsl_mult': 0.8917430337319259, 'strategy': 'breakout', 'time_stop': 38, 'use_sma': False, 'use_atr': False, 'use_adx': False, 'use_ema': False, 'use_spike': True, 'rsi_required': False, 'edge_k': 1.3764146874582046, 'edge_cap': 0.9666881515211172, 'bull_strategy': 'mean_reversion', 'bull_bb_std_mult': 3.4574060564463442, 'bull_rsi_os': 7, 'bull_rsi_ob': 78, 'bull_adx_thresh': 16.50478354469608, 'bull_atr_min_pct': 0.0017082504308961416, 'bull_atr_max_pct': 0.01641545477430674, 'bull_tp_mult': 2.315630100584517, 'bull_tsl_mult': 0.905315233078195, 'bull_time_stop': 258, 'bull_use_sma': False, 'bull_use_ema': False, 'bull_use_atr': True, 'bull_use_adx': True, 'bull_use_spike': False, 'bull_rsi_required': True, 'bear_strategy': 'mean_reversion', 'bear_bb_std_mult': 1.1299745718874288, 'bear_rsi_os': 10, 'bear_rsi_ob': 49, 'bear_adx_thresh': 15.269412682259535, 'bear_atr_min_pct': 0.02294411949537902, 'bear_atr_max_pct': 0.0857324055065912, 'bear_tp_mult': 2.726790958449831, 'bear_tsl_mult': 0.24984964372803545, 'bear_time_stop': 229, 'bear_use_sma': True, 'bear_use_ema': True, 'bear_use_atr': True, 'bear_use_adx': True, 'bear_use_spike': True, 'bear_rsi_required': True, 'sideways_strategy': 'mean_reversion', 'sideways_bb_std_mult': 3.158198689859459, 'sideways_rsi_os': 53, 'sideways_rsi_ob': 57, 'sideways_adx_thresh': 16.9118992777875, 'sideways_atr_min_pct': 0.013379178848543668, 'sideways_atr_max_pct': 0.11665458605861208, 'sideways_tp_mult': 1.1985000668042964, 'sideways_tsl_mult': 0.599709572694674, 'sideways_time_stop': 101, 'sideways_use_sma': False, 'sideways_use_ema': False, 'sideways_use_atr': False, 'sideways_use_adx': True, 'sideways_use_spike': True, 'sideways_rsi_required': True}.
[I 2025-08-31 04:58:00,937] Trial 515 finished with values: [-1000000000.0, 1000000000.0] and parameters: {'p_sma': 26, 'p_std': 5, 'p_atr': 24, 'p_adx': 30, 'rsi_period': 27, 'ema1': 18, 'ema2': 58, 'slip_atr_k': 0.14922869769011615, 'slip_spread_k': 0.43960476987158653, 'spread_hl_frac': 0.025703493988206958, 'bb_std_mult': 1.9171876551458429, 'rsi_os': 28, 'rsi_ob': 85, 'vol_spike': 0.01967857872028373, 'adx_thresh': 13.234668262186041, 'atr_min_pct': 0.02156022804281961, 'atr_max_pct': 0.06974798956215746, 'tp_mult': 2.4598513583051873, 'tsl_mult': 0.8970757655422783, 'strategy': 'breakout', 'time_stop': 231, 'use_sma': False, 'use_atr': False, 'use_adx': False, 'use_ema': False, 'use_spike': True, 'rsi_required': True, 'edge_k': 0.6277219571282405, 'edge_cap': 0.5791827472617856, 'bull_strategy': 'mean_reversion', 'bull_bb_std_mult': 2.433179027363426, 'bull_rsi_os': 14, 'bull_rsi_ob': 79, 'bull_adx_thresh': 14.971622817942782, 'bull_atr_min_pct': 0.002265835858532327, 'bull_atr_max_pct': 0.09121015088559577, 'bull_tp_mult': 1.6531133380383416, 'bull_tsl_mult': 0.9131240784141785, 'bull_time_stop': 150, 'bull_use_sma': False, 'bull_use_ema': False, 'bull_use_atr': True, 'bull_use_adx': True, 'bull_use_spike': False, 'bull_rsi_required': True, 'bear_strategy': 'mean_reversion', 'bear_bb_std_mult': 1.9120245978316723, 'bear_rsi_os': 9, 'bear_rsi_ob': 74, 'bear_adx_thresh': 15.262825648848088, 'bear_atr_min_pct': 0.02286707594488405, 'bear_atr_max_pct': 0.05361183949192485, 'bear_tp_mult': 2.728257328450796, 'bear_tsl_mult': 0.24175261755171126, 'bear_time_stop': 229, 'bear_use_sma': True, 'bear_use_ema': True, 'bear_use_atr': True, 'bear_use_adx': False, 'bear_use_spike': True, 'bear_rsi_required': True, 'sideways_strategy': 'mean_reversion', 'sideways_bb_std_mult': 0.8071072074920337, 'sideways_rsi_os': 28, 'sideways_rsi_ob': 55, 'sideways_adx_thresh': 8.992328110900253, 'sideways_atr_min_pct': 0.014335760629210563, 'sideways_atr_max_pct': 0.08819634827445237, 'sideways_tp_mult': 2.2413530718960386, 'sideways_tsl_mult': 0.6017533242853197, 'sideways_time_stop': 86, 'sideways_use_sma': False, 'sideways_use_ema': False, 'sideways_use_atr': False, 'sideways_use_adx': True, 'sideways_use_spike': True, 'sideways_rsi_required': True}.
[I 2025-08-31 04:58:47,095] Trial 520 finished with values: [-0.02010176860274715, 0.020050597181636685] and parameters: {'p_sma': 58, 'p_std': 24, 'p_atr': 25, 'p_adx': 9, 'rsi_period': 69, 'ema1': 14, 'ema2': 33, 'slip_atr_k': 0.0002530912536164165, 'slip_spread_k': 0.09671375314800464, 'spread_hl_frac': 0.011947550887512317, 'bb_std_mult': 0.6032528411938363, 'rsi_os': 27, 'rsi_ob': 59, 'vol_spike': 0.09785303258446085, 'adx_thresh': 9.605408621546978, 'atr_min_pct': 0.023174364800647905, 'atr_max_pct': 0.12483763901277241, 'tp_mult': 1.8626115710890494, 'tsl_mult': 0.7772609037228665, 'strategy': 'mean_reversion', 'time_stop': 57, 'use_sma': True, 'use_atr': True, 'use_adx': True, 'use_ema': True, 'use_spike': False, 'rsi_required': False, 'edge_k': 1.1493739561265748, 'edge_cap': 0.9999833293713114, 'bull_strategy': 'mean_reversion', 'bull_bb_std_mult': 3.5407184094287394, 'bull_rsi_os': 12, 'bull_rsi_ob': 67, 'bull_adx_thresh': 14.143306188871161, 'bull_atr_min_pct': 0.0011255602841057557, 'bull_atr_max_pct': 0.054602207917515216, 'bull_tp_mult': 1.6291069220609273, 'bull_tsl_mult': 0.4887628854880521, 'bull_time_stop': 126, 'bull_use_sma': True, 'bull_use_ema': False, 'bull_use_atr': False, 'bull_use_adx': False, 'bull_use_spike': True, 'bull_rsi_required': False, 'bear_strategy': 'breakout', 'bear_bb_std_mult': 2.5943318601442513, 'bear_rsi_os': 8, 'bear_rsi_ob': 84, 'bear_adx_thresh': 28.009592500366907, 'bear_atr_min_pct': 0.01916496914146093, 'bear_atr_max_pct': 0.09666061104540923, 'bear_tp_mult': 2.8169130744128115, 'bear_tsl_mult': 0.29972242034445584, 'bear_time_stop': 193, 'bear_use_sma': False, 'bear_use_ema': True, 'bear_use_atr': False, 'bear_use_adx': True, 'bear_use_spike': True, 'bear_rsi_required': False, 'sideways_strategy': 'breakout', 'sideways_bb_std_mult': 0.9775710117722178, 'sideways_rsi_os': 31, 'sideways_rsi_ob': 54, 'sideways_adx_thresh': 11.610440449466399, 'sideways_atr_min_pct': 0.025564232605911726, 'sideways_atr_max_pct': 0.1083491867573224, 'sideways_tp_mult': 1.8856287856003284, 'sideways_tsl_mult': 0.8314655667016172, 'sideways_time_stop': 50, 'sideways_use_sma': True, 'sideways_use_ema': True, 'sideways_use_atr': True, 'sideways_use_adx': False, 'sideways_use_spike': False, 'sideways_rsi_required': False}.
[I 2025-08-31 04:58:47,308] Trial 518 finished with values: [-1000000000.0, 1000000000.0] and parameters: {'p_sma': 40, 'p_std': 48, 'p_atr': 26, 'p_adx': 9, 'rsi_period': 82, 'ema1': 14, 'ema2': 45, 'slip_atr_k': 0.014316820768945453, 'slip_spread_k': 0.3311340650135882, 'spread_hl_frac': 0.012098066125195893, 'bb_std_mult': 0.5873529918431752, 'rsi_os': 28, 'rsi_ob': 66, 'vol_spike': 0.0361415992584009, 'adx_thresh': 22.05939640283885, 'atr_min_pct': 0.0028503801848298437, 'atr_max_pct': 0.12468674926633477, 'tp_mult': 2.3399364083271514, 'tsl_mult': 0.8976774821937739, 'strategy': 'mean_reversion', 'time_stop': 229, 'use_sma': True, 'use_atr': True, 'use_adx': True, 'use_ema': True, 'use_spike': False, 'rsi_required': False, 'edge_k': 1.5884625568394029, 'edge_cap': 0.9996159107394419, 'bull_strategy': 'mean_reversion', 'bull_bb_std_mult': 3.540939946392373, 'bull_rsi_os': 23, 'bull_rsi_ob': 73, 'bull_adx_thresh': 9.53548924779553, 'bull_atr_min_pct': 0.0028064455855987226, 'bull_atr_max_pct': 0.0472121127463504, 'bull_tp_mult': 1.644275204939237, 'bull_tsl_mult': 0.8342945190037342, 'bull_time_stop': 128, 'bull_use_sma': True, 'bull_use_ema': False, 'bull_use_atr': False, 'bull_use_adx': False, 'bull_use_spike': True, 'bull_rsi_required': False, 'bear_strategy': 'breakout', 'bear_bb_std_mult': 0.821469249643674, 'bear_rsi_os': 9, 'bear_rsi_ob': 63, 'bear_adx_thresh': 22.875390165777, 'bear_atr_min_pct': 0.02318161039028048, 'bear_atr_max_pct': 0.04154884650468306, 'bear_tp_mult': 2.94772249579202, 'bear_tsl_mult': 0.40894466430845533, 'bear_time_stop': 192, 'bear_use_sma': False, 'bear_use_ema': True, 'bear_use_atr': False, 'bear_use_adx': True, 'bear_use_spike': True, 'bear_rsi_required': True, 'sideways_strategy': 'breakout', 'sideways_bb_std_mult': 0.9795195820422409, 'sideways_rsi_os': 24, 'sideways_rsi_ob': 84, 'sideways_adx_thresh': 9.250525837004634, 'sideways_atr_min_pct': 0.013390570623823324, 'sideways_atr_max_pct': 0.10877494636082607, 'sideways_tp_mult': 1.8402413270017899, 'sideways_tsl_mult': 0.8220772142618047, 'sideways_time_stop': 261, 'sideways_use_sma': True, 'sideways_use_ema': True, 'sideways_use_atr': True, 'sideways_use_adx': False, 'sideways_use_spike': False, 'sideways_rsi_required': False}.
[I 2025-08-31 04:58:47,466] Trial 517 finished with values: [-1000000000.0, 1000000000.0] and parameters: {'p_sma': 26, 'p_std': 24, 'p_atr': 22, 'p_adx': 19, 'rsi_period': 40, 'ema1': 14, 'ema2': 45, 'slip_atr_k': 0.014998294986014005, 'slip_spread_k': 0.25286182127697404, 'spread_hl_frac': 0.012198272102973666, 'bb_std_mult': 3.469600314580381, 'rsi_os': 50, 'rsi_ob': 51, 'vol_spike': 0.09921987648931849, 'adx_thresh': 29.858461984363352, 'atr_min_pct': 0.008420432749072252, 'atr_max_pct': 0.05009510174279441, 'tp_mult': 1.8640311072910698, 'tsl_mult': 0.9724955857589697, 'strategy': 'breakout', 'time_stop': 38, 'use_sma': True, 'use_atr': True, 'use_adx': True, 'use_ema': True, 'use_spike': False, 'rsi_required': False, 'edge_k': 0.6225805536548339, 'edge_cap': 0.9708353077989198, 'bull_strategy': 'mean_reversion', 'bull_bb_std_mult': 3.4568431282806804, 'bull_rsi_os': 41, 'bull_rsi_ob': 79, 'bull_adx_thresh': 14.737182768266043, 'bull_atr_min_pct': 0.0020736755428860756, 'bull_atr_max_pct': 0.05490144326014786, 'bull_tp_mult': 1.6402348892774055, 'bull_tsl_mult': 0.9005027049631583, 'bull_time_stop': 128, 'bull_use_sma': True, 'bull_use_ema': False, 'bull_use_atr': False, 'bull_use_adx': False, 'bull_use_spike': True, 'bull_rsi_required': True, 'bear_strategy': 'mean_reversion', 'bear_bb_std_mult': 1.1401369015611162, 'bear_rsi_os': 53, 'bear_rsi_ob': 49, 'bear_adx_thresh': 22.90512506286771, 'bear_atr_min_pct': 0.019446637609278387, 'bear_atr_max_pct': 0.05325799749685668, 'bear_tp_mult': 2.8111023655902887, 'bear_tsl_mult': 0.3078551483705995, 'bear_time_stop': 190, 'bear_use_sma': False, 'bear_use_ema': True, 'bear_use_atr': True, 'bear_use_adx': True, 'bear_use_spike': True, 'bear_rsi_required': True, 'sideways_strategy': 'mean_reversion', 'sideways_bb_std_mult': 0.9779033377348018, 'sideways_rsi_os': 31, 'sideways_rsi_ob': 54, 'sideways_adx_thresh': 9.140335397050567, 'sideways_atr_min_pct': 0.013491334356349463, 'sideways_atr_max_pct': 0.08761966264316777, 'sideways_tp_mult': 1.7813087763166462, 'sideways_tsl_mult': 0.25730118479757513, 'sideways_time_stop': 49, 'sideways_use_sma': True, 'sideways_use_ema': True, 'sideways_use_atr': True, 'sideways_use_adx': False, 'sideways_use_spike': False, 'sideways_rsi_required': False}.
[I 2025-08-31 04:58:47,469] Trial 519 finished with values: [-1000000000.0, 1000000000.0] and parameters: {'p_sma': 37, 'p_std': 30, 'p_atr': 10, 'p_adx': 14, 'rsi_period': 35, 'ema1': 22, 'ema2': 26, 'slip_atr_k': 0.015082951606308011, 'slip_spread_k': 0.09689314033014067, 'spread_hl_frac': 0.02069881123398873, 'bb_std_mult': 2.1030213801155413, 'rsi_os': 18, 'rsi_ob': 60, 'vol_spike': 0.2579195559000884, 'adx_thresh': 9.626526955685224, 'atr_min_pct': 0.022815608869753937, 'atr_max_pct': 0.1248762927335974, 'tp_mult': 2.308761103058185, 'tsl_mult': 0.9998515904985326, 'strategy': 'mean_reversion', 'time_stop': 73, 'use_sma': True, 'use_atr': True, 'use_adx': True, 'use_ema': True, 'use_spike': False, 'rsi_required': False, 'edge_k': 1.3134815061613283, 'edge_cap': 0.9996918737321403, 'bull_strategy': 'mean_reversion', 'bull_bb_std_mult': 3.5311303416383946, 'bull_rsi_os': 14, 'bull_rsi_ob': 67, 'bull_adx_thresh': 14.76545921440064, 'bull_atr_min_pct': 0.002828049732564416, 'bull_atr_max_pct': 0.046568642647254126, 'bull_tp_mult': 1.651740244073231, 'bull_tsl_mult': 0.8350087390479435, 'bull_time_stop': 127, 'bull_use_sma': True, 'bull_use_ema': False, 'bull_use_atr': False, 'bull_use_adx': False, 'bull_use_spike': True, 'bull_rsi_required': False, 'bear_strategy': 'breakout', 'bear_bb_std_mult': 0.8390275910412266, 'bear_rsi_os': 7, 'bear_rsi_ob': 48, 'bear_adx_thresh': 22.842223742416664, 'bear_atr_min_pct': 0.008426823082616558, 'bear_atr_max_pct': 0.042132780091180724, 'bear_tp_mult': 2.496380674304046, 'bear_tsl_mult': 0.40446999967801434, 'bear_time_stop': 140, 'bear_use_sma': False, 'bear_use_ema': True, 'bear_use_atr': False, 'bear_use_adx': True, 'bear_use_spike': True, 'bear_rsi_required': True, 'sideways_strategy': 'breakout', 'sideways_bb_std_mult': 0.9758651722497624, 'sideways_rsi_os': 16, 'sideways_rsi_ob': 52, 'sideways_adx_thresh': 11.618774229933804, 'sideways_atr_min_pct': 0.01339677921620885, 'sideways_atr_max_pct': 0.09721362447917338, 'sideways_tp_mult': 1.850009751433054, 'sideways_tsl_mult': 0.8219800946383142, 'sideways_time_stop': 49, 'sideways_use_sma': True, 'sideways_use_ema': True, 'sideways_use_atr': True, 'sideways_use_adx': False, 'sideways_use_spike': False, 'sideways_rsi_required': False}.
[I 2025-08-31 04:59:30,919] Trial 524 finished with values: [-0.014387100311047063, 0.014345416726566295] and parameters: {'p_sma': 30, 'p_std': 13, 'p_atr': 9, 'p_adx': 23, 'rsi_period': 54, 'ema1': 15, 'ema2': 27, 'slip_atr_k': 0.1035268686098771, 'slip_spread_k': 0.0691412168647674, 'spread_hl_frac': 0.018844377942295203, 'bb_std_mult': 1.8154223951683122, 'rsi_os': 31, 'rsi_ob': 55, 'vol_spike': 0.025622414240971617, 'adx_thresh': 12.178199605547764, 'atr_min_pct': 0.014046127549860357, 'atr_max_pct': 0.12168855805343572, 'tp_mult': 2.5466242368282845, 'tsl_mult': 0.8631104977135873, 'strategy': 'breakout', 'time_stop': 14, 'use_sma': False, 'use_atr': False, 'use_adx': False, 'use_ema': False, 'use_spike': True, 'rsi_required': False, 'edge_k': 0.285824186139397, 'edge_cap': 0.9795459121109577, 'bull_strategy': 'breakout', 'bull_bb_std_mult': 2.036468669817916, 'bull_rsi_os': 46, 'bull_rsi_ob': 71, 'bull_adx_thresh': 12.011556861995476, 'bull_atr_min_pct': 0.000959051614790575, 'bull_atr_max_pct': 0.14954923599905498, 'bull_tp_mult': 1.5597203610392507, 'bull_tsl_mult': 0.5548446170036934, 'bull_time_stop': 146, 'bull_use_sma': False, 'bull_use_ema': True, 'bull_use_atr': True, 'bull_use_adx': True, 'bull_use_spike': False, 'bull_rsi_required': True, 'bear_strategy': 'mean_reversion', 'bear_bb_std_mult': 0.9546668100377192, 'bear_rsi_os': 12, 'bear_rsi_ob': 55, 'bear_adx_thresh': 18.951593379717252, 'bear_atr_min_pct': 0.014394430899891503, 'bear_atr_max_pct': 0.12231592690340504, 'bear_tp_mult': 2.683880140869178, 'bear_tsl_mult': 0.0012978041359046344, 'bear_time_stop': 208, 'bear_use_sma': True, 'bear_use_ema': False, 'bear_use_atr': True, 'bear_use_adx': True, 'bear_use_spike': False, 'bear_rsi_required': False, 'sideways_strategy': 'mean_reversion', 'sideways_bb_std_mult': 1.1062961446786204, 'sideways_rsi_os': 29, 'sideways_rsi_ob': 52, 'sideways_adx_thresh': 10.839176309527673, 'sideways_atr_min_pct': 0.015231505711612695, 'sideways_atr_max_pct': 0.11247496487434022, 'sideways_tp_mult': 1.981670683565308, 'sideways_tsl_mult': 0.6532840913826602, 'sideways_time_stop': 58, 'sideways_use_sma': False, 'sideways_use_ema': False, 'sideways_use_atr': False, 'sideways_use_adx': True, 'sideways_use_spike': True, 'sideways_rsi_required': True}.
