[I 2025-08-31 04:02:54,939] Trial 236 finished with values: [-0.010601739077177208, 0.010547517126623947] and parameters: {'p_sma': 56, 'p_std': 36, 'p_atr': 23, 'p_adx': 24, 'rsi_period': 25, 'ema1': 15, 'ema2': 13, 'slip_atr_k': 0.025219706779512574, 'slip_spread_k': 0.6454418750097751, 'spread_hl_frac': 0.012190762106176443, 'bb_std_mult': 2.709037931485379, 'rsi_os': 28, 'rsi_ob': 59, 'vol_spike': 0.21535848828541992, 'adx_thresh': 6.0289936260872565, 'atr_min_pct': 0.0228095594563112, 'atr_max_pct': 0.09847513435663585, 'tp_mult': 2.4513237645102124, 'tsl_mult': 0.8825320366588514, 'strategy': 'breakout', 'time_stop': 43, 'use_sma': False, 'use_atr': False, 'use_adx': False, 'use_ema': False, 'use_spike': True, 'rsi_required': False, 'edge_k': 1.4195020989576375, 'edge_cap': 0.9834534118577781, 'bull_strategy': 'mean_reversion', 'bull_bb_std_mult': 3.575291578391941, 'bull_rsi_os': 13, 'bull_rsi_ob': 59, 'bull_adx_thresh': 6.568939193200097, 'bull_atr_min_pct': 0.0015472432365136266, 'bull_atr_max_pct': 0.024704282842299273, 'bull_tp_mult': 1.6715121561347699, 'bull_tsl_mult': 0.036338632687829386, 'bull_time_stop': 133, 'bull_use_sma': False, 'bull_use_ema': False, 'bull_use_atr': True, 'bull_use_adx': True, 'bull_use_spike': False, 'bull_rsi_required': True, 'bear_strategy': 'mean_reversion', 'bear_bb_std_mult': 0.8800581564582662, 'bear_rsi_os': 8, 'bear_rsi_ob': 46, 'bear_adx_thresh': 28.137860099998747, 'bear_atr_min_pct': 0.02423346063573126, 'bear_atr_max_pct': 0.0427225061897973, 'bear_tp_mult': 2.9379690257644517, 'bear_tsl_mult': 0.20664337372966354, 'bear_time_stop': 190, 'bear_use_sma': True, 'bear_use_ema': True, 'bear_use_atr': True, 'bear_use_adx': True, 'bear_use_spike': True, 'bear_rsi_required': True, 'sideways_strategy': 'mean_reversion', 'sideways_bb_std_mult': 1.1952904639354116, 'sideways_rsi_os': 39, 'sideways_rsi_ob': 75, 'sideways_adx_thresh': 11.729326135929373, 'sideways_atr_min_pct': 0.006637145507954802, 'sideways_atr_max_pct': 0.1123879773209337, 'sideways_tp_mult': 1.7777222292778976, 'sideways_tsl_mult': 0.516648746470587, 'sideways_time_stop': 73, 'sideways_use_sma': False, 'sideways_use_ema': False, 'sideways_use_atr': False, 'sideways_use_adx': True, 'sideways_use_spike': True, 'sideways_rsi_required': True}.
[I 2025-08-31 04:02:55,279] Trial 235 finished with values: [-0.012785938207776737, 0.01272154591221583] and parameters: {'p_sma': 56, 'p_std': 17, 'p_atr': 23, 'p_adx': 8, 'rsi_period': 24, 'ema1': 15, 'ema2': 13, 'slip_atr_k': 0.008104858814187042, 'slip_spread_k': 0.11436779905125746, 'spread_hl_frac': 0.011883786664416043, 'bb_std_mult': 2.712519042623212, 'rsi_os': 28, 'rsi_ob': 59, 'vol_spike': 0.02498864196736831, 'adx_thresh': 5.8363246665020885, 'atr_min_pct': 0.02276797296270733, 'atr_max_pct': 0.07804432877695724, 'tp_mult': 1.9510576605653727, 'tsl_mult': 0.9250648664551838, 'strategy': 'breakout', 'time_stop': 42, 'use_sma': False, 'use_atr': False, 'use_adx': False, 'use_ema': False, 'use_spike': True, 'rsi_required': False, 'edge_k': 0.8953131536517163, 'edge_cap': 0.9837245177163616, 'bull_strategy': 'mean_reversion', 'bull_bb_std_mult': 3.5904324469156155, 'bull_rsi_os': 13, 'bull_rsi_ob': 77, 'bull_adx_thresh': 17.058376928715486, 'bull_atr_min_pct': 0.0016482235035184273, 'bull_atr_max_pct': 0.05037270899321357, 'bull_tp_mult': 1.6641552908864083, 'bull_tsl_mult': 0.8577001713040787, 'bull_time_stop': 112, 'bull_use_sma': False, 'bull_use_ema': False, 'bull_use_atr': True, 'bull_use_adx': True, 'bull_use_spike': False, 'bull_rsi_required': True, 'bear_strategy': 'mean_reversion', 'bear_bb_std_mult': 0.8629513423933409, 'bear_rsi_os': 8, 'bear_rsi_ob': 46, 'bear_adx_thresh': 8.699520147154645, 'bear_atr_min_pct': 0.02442338410697995, 'bear_atr_max_pct': 0.04627840190388236, 'bear_tp_mult': 2.7176231703781473, 'bear_tsl_mult': 0.20355398188778548, 'bear_time_stop': 190, 'bear_use_sma': True, 'bear_use_ema': True, 'bear_use_atr': True, 'bear_use_adx': True, 'bear_use_spike': True, 'bear_rsi_required': True, 'sideways_strategy': 'mean_reversion', 'sideways_bb_std_mult': 1.3653735006251666, 'sideways_rsi_os': 39, 'sideways_rsi_ob': 55, 'sideways_adx_thresh': 11.703861305392353, 'sideways_atr_min_pct': 0.015205831918099707, 'sideways_atr_max_pct': 0.1332109602674289, 'sideways_tp_mult': 2.0341315753381526, 'sideways_tsl_mult': 0.6953250824949894, 'sideways_time_stop': 61, 'sideways_use_sma': False, 'sideways_use_ema': False, 'sideways_use_atr': False, 'sideways_use_adx': True, 'sideways_use_spike': True, 'sideways_rsi_required': True}.
[I 2025-08-31 04:02:55,442] Trial 234 finished with values: [-1000000000.0, 1000000000.0] and parameters: {'p_sma': 54, 'p_std': 36, 'p_atr': 23, 'p_adx': 8, 'rsi_period': 21, 'ema1': 24, 'ema2': 28, 'slip_atr_k': 0.02497476740693535, 'slip_spread_k': 0.7007260214329167, 'spread_hl_frac': 0.011952442659681031, 'bb_std_mult': 2.7640237902775824, 'rsi_os': 31, 'rsi_ob': 59, 'vol_spike': 0.023765564817979003, 'adx_thresh': 12.764185119543608, 'atr_min_pct': 0.02281893654428697, 'atr_max_pct': 0.07854582549046008, 'tp_mult': 1.8730941061854764, 'tsl_mult': 0.8770529296240721, 'strategy': 'breakout', 'time_stop': 44, 'use_sma': False, 'use_atr': False, 'use_adx': False, 'use_ema': False, 'use_spike': True, 'rsi_required': False, 'edge_k': 1.4144118027120447, 'edge_cap': 0.6270403154648811, 'bull_strategy': 'mean_reversion', 'bull_bb_std_mult': 3.5940904198897505, 'bull_rsi_os': 13, 'bull_rsi_ob': 46, 'bull_adx_thresh': 26.978407720202483, 'bull_atr_min_pct': 0.027957260100767357, 'bull_atr_max_pct': 0.046616131400523494, 'bull_tp_mult': 1.1634494157036115, 'bull_tsl_mult': 0.0371366376866607, 'bull_time_stop': 234, 'bull_use_sma': False, 'bull_use_ema': False, 'bull_use_atr': True, 'bull_use_adx': True, 'bull_use_spike': False, 'bull_rsi_required': True, 'bear_strategy': 'mean_reversion', 'bear_bb_std_mult': 0.8576054827771732, 'bear_rsi_os': 8, 'bear_rsi_ob': 46, 'bear_adx_thresh': 19.627804770809355, 'bear_atr_min_pct': 0.02449539722221704, 'bear_atr_max_pct': 0.04556673693404711, 'bear_tp_mult': 2.767607956358948, 'bear_tsl_mult': 0.20678781300620763, 'bear_time_stop': 107, 'bear_use_sma': True, 'bear_use_ema': True, 'bear_use_atr': True, 'bear_use_adx': True, 'bear_use_spike': True, 'bear_rsi_required': True, 'sideways_strategy': 'mean_reversion', 'sideways_bb_std_mult': 0.516573745189643, 'sideways_rsi_os': 37, 'sideways_rsi_ob': 55, 'sideways_adx_thresh': 11.194715864640905, 'sideways_atr_min_pct': 0.01535385165219148, 'sideways_atr_max_pct': 0.11122377535967591, 'sideways_tp_mult': 1.0371925335227292, 'sideways_tsl_mult': 0.7344528104135088, 'sideways_time_stop': 62, 'sideways_use_sma': False, 'sideways_use_ema': False, 'sideways_use_atr': False, 'sideways_use_adx': True, 'sideways_use_spike': True, 'sideways_rsi_required': True}.
[I 2025-08-31 04:03:41,480] Trial 238 finished with values: [-1000000000.0, 1000000000.0] and parameters: {'p_sma': 56, 'p_std': 34, 'p_atr': 23, 'p_adx': 24, 'rsi_period': 21, 'ema1': 14, 'ema2': 23, 'slip_atr_k': 0.10657427729602752, 'slip_spread_k': 0.7110909779278886, 'spread_hl_frac': 0.011934433473424672, 'bb_std_mult': 2.101865504964295, 'rsi_os': 35, 'rsi_ob': 61, 'vol_spike': 0.21817006319167684, 'adx_thresh': 5.799778710282423, 'atr_min_pct': 0.022811194988930732, 'atr_max_pct': 0.11778023632246219, 'tp_mult': 2.4564876395414728, 'tsl_mult': 0.0186000977192316, 'strategy': 'breakout', 'time_stop': 55, 'use_sma': False, 'use_atr': False, 'use_adx': False, 'use_ema': False, 'use_spike': True, 'rsi_required': False, 'edge_k': 1.1657389806816296, 'edge_cap': 0.18141155975554207, 'bull_strategy': 'mean_reversion', 'bull_bb_std_mult': 1.7113319228557433, 'bull_rsi_os': 13, 'bull_rsi_ob': 46, 'bull_adx_thresh': 16.89107928218659, 'bull_atr_min_pct': 0.005927779971497064, 'bull_atr_max_pct': 0.04888271338576568, 'bull_tp_mult': 1.6790738176436881, 'bull_tsl_mult': 0.8607108261053884, 'bull_time_stop': 115, 'bull_use_sma': False, 'bull_use_ema': False, 'bull_use_atr': True, 'bull_use_adx': True, 'bull_use_spike': False, 'bull_rsi_required': True, 'bear_strategy': 'mean_reversion', 'bear_bb_std_mult': 2.7509051379206904, 'bear_rsi_os': 9, 'bear_rsi_ob': 46, 'bear_adx_thresh': 27.67924376489196, 'bear_atr_min_pct': 0.02309198431417064, 'bear_atr_max_pct': 0.04492601062667852, 'bear_tp_mult': 2.9834244840694786, 'bear_tsl_mult': 0.20989958015767446, 'bear_time_stop': 130, 'bear_use_sma': True, 'bear_use_ema': True, 'bear_use_atr': True, 'bear_use_adx': True, 'bear_use_spike': True, 'bear_rsi_required': True, 'sideways_strategy': 'mean_reversion', 'sideways_bb_std_mult': 1.3608480990486642, 'sideways_rsi_os': 11, 'sideways_rsi_ob': 56, 'sideways_adx_thresh': 11.941467963309364, 'sideways_atr_min_pct': 0.012995936367564423, 'sideways_atr_max_pct': 0.13319244695261645, 'sideways_tp_mult': 1.9141932953201486, 'sideways_tsl_mult': 0.6317912255771602, 'sideways_time_stop': 74, 'sideways_use_sma': False, 'sideways_use_ema': False, 'sideways_use_atr': False, 'sideways_use_adx': True, 'sideways_use_spike': True, 'sideways_rsi_required': True}.
[I 2025-08-31 04:03:42,238] Trial 239 finished with values: [-1000000000.0, 1000000000.0] and parameters: {'p_sma': 56, 'p_std': 17, 'p_atr': 23, 'p_adx': 8, 'rsi_period': 21, 'ema1': 14, 'ema2': 13, 'slip_atr_k': 0.007236163353254025, 'slip_spread_k': 0.563840590235449, 'spread_hl_frac': 0.01209130425584133, 'bb_std_mult': 2.0893786233022857, 'rsi_os': 28, 'rsi_ob': 61, 'vol_spike': 0.02866827976382677, 'adx_thresh': 6.5068996401878145, 'atr_min_pct': 0.02287393951214178, 'atr_max_pct': 0.11657244596519761, 'tp_mult': 2.4480568265697573, 'tsl_mult': 0.05465390169013945, 'strategy': 'breakout', 'time_stop': 56, 'use_sma': True, 'use_atr': False, 'use_adx': False, 'use_ema': False, 'use_spike': True, 'rsi_required': True, 'edge_k': 1.1797250110726551, 'edge_cap': 0.9855013581045325, 'bull_strategy': 'mean_reversion', 'bull_bb_std_mult': 1.7213188457093704, 'bull_rsi_os': 53, 'bull_rsi_ob': 77, 'bull_adx_thresh': 17.186272768000848, 'bull_atr_min_pct': 0.02655752346221553, 'bull_atr_max_pct': 0.047299940507663285, 'bull_tp_mult': 1.6484175515809556, 'bull_tsl_mult': 0.8567999178823092, 'bull_time_stop': 151, 'bull_use_sma': False, 'bull_use_ema': True, 'bull_use_atr': False, 'bull_use_adx': True, 'bull_use_spike': False, 'bull_rsi_required': True, 'bear_strategy': 'mean_reversion', 'bear_bb_std_mult': 0.8687269225748064, 'bear_rsi_os': 9, 'bear_rsi_ob': 46, 'bear_adx_thresh': 19.536705467038562, 'bear_atr_min_pct': 0.023757486313232944, 'bear_atr_max_pct': 0.0421195652628982, 'bear_tp_mult': 2.969430690573984, 'bear_tsl_mult': 0.27833960790761364, 'bear_time_stop': 126, 'bear_use_sma': True, 'bear_use_ema': False, 'bear_use_atr': True, 'bear_use_adx': True, 'bear_use_spike': False, 'bear_rsi_required': True, 'sideways_strategy': 'mean_reversion', 'sideways_bb_std_mult': 3.3648347699998142, 'sideways_rsi_os': 13, 'sideways_rsi_ob': 76, 'sideways_adx_thresh': 11.784008548008714, 'sideways_atr_min_pct': 0.013478880323650662, 'sideways_atr_max_pct': 0.11595073348304301, 'sideways_tp_mult': 1.7983406088261398, 'sideways_tsl_mult': 0.6928271182510788, 'sideways_time_stop': 157, 'sideways_use_sma': False, 'sideways_use_ema': False, 'sideways_use_atr': False, 'sideways_use_adx': True, 'sideways_use_spike': True, 'sideways_rsi_required': True}.
[I 2025-08-31 04:03:43,096] Trial 240 finished with values: [-1000000000.0, 1000000000.0] and parameters: {'p_sma': 56, 'p_std': 6, 'p_atr': 25, 'p_adx': 24, 'rsi_period': 57, 'ema1': 30, 'ema2': 13, 'slip_atr_k': 0.027469441741482567, 'slip_spread_k': 0.0013845169456538214, 'spread_hl_frac': 0.04790236049730574, 'bb_std_mult': 2.0911445247016687, 'rsi_os': 29, 'rsi_ob': 61, 'vol_spike': 0.21420210366388925, 'adx_thresh': 5.594967937308639, 'atr_min_pct': 0.0022132059496349655, 'atr_max_pct': 0.11858247919049077, 'tp_mult': 1.014621460894594, 'tsl_mult': 0.042277025692029624, 'strategy': 'breakout', 'time_stop': 267, 'use_sma': True, 'use_atr': False, 'use_adx': False, 'use_ema': False, 'use_spike': True, 'rsi_required': True, 'edge_k': 0.8005490568894658, 'edge_cap': 0.9842753974645262, 'bull_strategy': 'mean_reversion', 'bull_bb_std_mult': 3.4448652933098187, 'bull_rsi_os': 13, 'bull_rsi_ob': 77, 'bull_adx_thresh': 28.789152368967983, 'bull_atr_min_pct': 0.0016931480701838047, 'bull_atr_max_pct': 0.048001106504812666, 'bull_tp_mult': 2.5381907808058117, 'bull_tsl_mult': 0.8604037021445875, 'bull_time_stop': 224, 'bull_use_sma': False, 'bull_use_ema': True, 'bull_use_atr': False, 'bull_use_adx': True, 'bull_use_spike': False, 'bull_rsi_required': True, 'bear_strategy': 'mean_reversion', 'bear_bb_std_mult': 0.891724574012538, 'bear_rsi_os': 9, 'bear_rsi_ob': 90, 'bear_adx_thresh': 27.745430379404006, 'bear_atr_min_pct': 0.023541697238422102, 'bear_atr_max_pct': 0.04342217826814779, 'bear_tp_mult': 2.9732387508489118, 'bear_tsl_mult': 0.2787710766192543, 'bear_time_stop': 256, 'bear_use_sma': True, 'bear_use_ema': False, 'bear_use_atr': True, 'bear_use_adx': True, 'bear_use_spike': False, 'bear_rsi_required': True, 'sideways_strategy': 'mean_reversion', 'sideways_bb_std_mult': 1.196281545339378, 'sideways_rsi_os': 14, 'sideways_rsi_ob': 53, 'sideways_adx_thresh': 11.871120121892405, 'sideways_atr_min_pct': 0.013518362769454425, 'sideways_atr_max_pct': 0.11637005593809975, 'sideways_tp_mult': 1.9304217205140035, 'sideways_tsl_mult': 0.6342639268827462, 'sideways_time_stop': 181, 'sideways_use_sma': False, 'sideways_use_ema': False, 'sideways_use_atr': False, 'sideways_use_adx': True, 'sideways_use_spike': True, 'sideways_rsi_required': True}.
[I 2025-08-31 04:03:44,094] Trial 237 finished with values: [-1000000000.0, 1000000000.0] and parameters: {'p_sma': 56, 'p_std': 17, 'p_atr': 23, 'p_adx': 24, 'rsi_period': 21, 'ema1': 14, 'ema2': 23, 'slip_atr_k': 0.007754750792222442, 'slip_spread_k': 0.7028192710090412, 'spread_hl_frac': 0.011879304183335184, 'bb_std_mult': 2.107192543683756, 'rsi_os': 29, 'rsi_ob': 95, 'vol_spike': 0.02657549254896448, 'adx_thresh': 11.3744409256185, 'atr_min_pct': 0.022772532859454332, 'atr_max_pct': 0.09894171955605129, 'tp_mult': 2.525029351978797, 'tsl_mult': 0.8349199201714845, 'strategy': 'breakout', 'time_stop': 44, 'use_sma': False, 'use_atr': False, 'use_adx': False, 'use_ema': False, 'use_spike': True, 'rsi_required': True, 'edge_k': 1.349568883186188, 'edge_cap': 0.9822745036224539, 'bull_strategy': 'mean_reversion', 'bull_bb_std_mult': 3.5878303091834196, 'bull_rsi_os': 13, 'bull_rsi_ob': 77, 'bull_adx_thresh': 17.12669761069555, 'bull_atr_min_pct': 0.00984419322569156, 'bull_atr_max_pct': 0.02526015924462236, 'bull_tp_mult': 1.6540915940943497, 'bull_tsl_mult': 0.8587401188205369, 'bull_time_stop': 132, 'bull_use_sma': False, 'bull_use_ema': True, 'bull_use_atr': True, 'bull_use_adx': True, 'bull_use_spike': False, 'bull_rsi_required': True, 'bear_strategy': 'mean_reversion', 'bear_bb_std_mult': 0.8788787453078096, 'bear_rsi_os': 9, 'bear_rsi_ob': 46, 'bear_adx_thresh': 27.567519670446018, 'bear_atr_min_pct': 0.02378516232362534, 'bear_atr_max_pct': 0.04219493522602508, 'bear_tp_mult': 2.728835632517898, 'bear_tsl_mult': 0.21082938269329216, 'bear_time_stop': 282, 'bear_use_sma': True, 'bear_use_ema': False, 'bear_use_atr': True, 'bear_use_adx': True, 'bear_use_spike': False, 'bear_rsi_required': True, 'sideways_strategy': 'mean_reversion', 'sideways_bb_std_mult': 1.7580517166946317, 'sideways_rsi_os': 6, 'sideways_rsi_ob': 56, 'sideways_adx_thresh': 11.835015512980478, 'sideways_atr_min_pct': 0.013256279834770592, 'sideways_atr_max_pct': 0.1159681937564238, 'sideways_tp_mult': 1.790446435613036, 'sideways_tsl_mult': 0.6886614094129612, 'sideways_time_stop': 44, 'sideways_use_sma': False, 'sideways_use_ema': False, 'sideways_use_atr': False, 'sideways_use_adx': True, 'sideways_use_spike': True, 'sideways_rsi_required': True}.
[I 2025-08-31 04:04:29,281] Trial 241 finished with values: [-1000000000.0, 1000000000.0] and parameters: {'p_sma': 56, 'p_std': 17, 'p_atr': 25, 'p_adx': 9, 'rsi_period': 57, 'ema1': 30, 'ema2': 24, 'slip_atr_k': 0.008433446002434921, 'slip_spread_k': 0.0383568794086947, 'spread_hl_frac': 0.00837840727656949, 'bb_std_mult': 3.3732597182670365, 'rsi_os': 29, 'rsi_ob': 64, 'vol_spike': 0.025562938682274338, 'adx_thresh': 7.221124205682019, 'atr_min_pct': 0.004788754098391501, 'atr_max_pct': 0.13690488085746322, 'tp_mult': 1.9421803006877691, 'tsl_mult': 0.8377928563761796, 'strategy': 'breakout', 'time_stop': 44, 'use_sma': True, 'use_atr': False, 'use_adx': False, 'use_ema': False, 'use_spike': True, 'rsi_required': True, 'edge_k': 1.3468520058369153, 'edge_cap': 0.9992920861118519, 'bull_strategy': 'mean_reversion', 'bull_bb_std_mult': 3.422281501779636, 'bull_rsi_os': 53, 'bull_rsi_ob': 77, 'bull_adx_thresh': 28.95237121692315, 'bull_atr_min_pct': 0.0016749322387292803, 'bull_atr_max_pct': 0.046732028331206425, 'bull_tp_mult': 1.5884415178474258, 'bull_tsl_mult': 0.17650150556178834, 'bull_time_stop': 150, 'bull_use_sma': False, 'bull_use_ema': True, 'bull_use_atr': False, 'bull_use_adx': True, 'bull_use_spike': False, 'bull_rsi_required': True, 'bear_strategy': 'mean_reversion', 'bear_bb_std_mult': 0.8941164599900507, 'bear_rsi_os': 9, 'bear_rsi_ob': 49, 'bear_adx_thresh': 20.487551820078018, 'bear_atr_min_pct': 0.023764061654792782, 'bear_atr_max_pct': 0.0432348093618909, 'bear_tp_mult': 2.9221117145764355, 'bear_tsl_mult': 0.2798542603194867, 'bear_time_stop': 194, 'bear_use_sma': True, 'bear_use_ema': False, 'bear_use_atr': True, 'bear_use_adx': True, 'bear_use_spike': False, 'bear_rsi_required': True, 'sideways_strategy': 'mean_reversion', 'sideways_bb_std_mult': 1.209806836630889, 'sideways_rsi_os': 41, 'sideways_rsi_ob': 52, 'sideways_adx_thresh': 17.169020036788414, 'sideways_atr_min_pct': 0.013549636494073737, 'sideways_atr_max_pct': 0.11684119312829189, 'sideways_tp_mult': 1.8300697976715312, 'sideways_tsl_mult': 0.5189360786849561, 'sideways_time_stop': 127, 'sideways_use_sma': False, 'sideways_use_ema': False, 'sideways_use_atr': False, 'sideways_use_adx': True, 'sideways_use_spike': True, 'sideways_rsi_required': True}.
[I 2025-08-31 04:04:29,870] Trial 242 finished with values: [-1000000000.0, 1000000000.0] and parameters: {'p_sma': 54, 'p_std': 6, 'p_atr': 25, 'p_adx': 9, 'rsi_period': 58, 'ema1': 8, 'ema2': 31, 'slip_atr_k': 0.0485166990717498, 'slip_spread_k': 0.11459646932706656, 'spread_hl_frac': 0.008713359027356312, 'bb_std_mult': 2.0155062879320114, 'rsi_os': 29, 'rsi_ob': 73, 'vol_spike': 0.04270223448611403, 'adx_thresh': 7.293520006068428, 'atr_min_pct': 0.004748678379252131, 'atr_max_pct': 0.12093941464163067, 'tp_mult': 1.7467965922962934, 'tsl_mult': 0.8390329861858083, 'strategy': 'breakout', 'time_stop': 43, 'use_sma': False, 'use_atr': False, 'use_adx': False, 'use_ema': False, 'use_spike': True, 'rsi_required': False, 'edge_k': 1.4454530978768754, 'edge_cap': 0.984715709105473, 'bull_strategy': 'mean_reversion', 'bull_bb_std_mult': 3.4071041891073053, 'bull_rsi_os': 6, 'bull_rsi_ob': 75, 'bull_adx_thresh': 5.670138165975114, 'bull_atr_min_pct': 0.003581794469733354, 'bull_atr_max_pct': 0.05112342288025083, 'bull_tp_mult': 1.5990609771880755, 'bull_tsl_mult': 0.8818853119810559, 'bull_time_stop': 41, 'bull_use_sma': False, 'bull_use_ema': True, 'bull_use_atr': True, 'bull_use_adx': False, 'bull_use_spike': False, 'bull_rsi_required': True, 'bear_strategy': 'mean_reversion', 'bear_bb_std_mult': 0.909333867236326, 'bear_rsi_os': 11, 'bear_rsi_ob': 91, 'bear_adx_thresh': 20.694387370955678, 'bear_atr_min_pct': 0.023916113529286312, 'bear_atr_max_pct': 0.04146794184635634, 'bear_tp_mult': 2.868035415387213, 'bear_tsl_mult': 0.5234195191098117, 'bear_time_stop': 279, 'bear_use_sma': False, 'bear_use_ema': False, 'bear_use_atr': True, 'bear_use_adx': True, 'bear_use_spike': False, 'bear_rsi_required': True, 'sideways_strategy': 'mean_reversion', 'sideways_bb_std_mult': 1.1895443835834203, 'sideways_rsi_os': 43, 'sideways_rsi_ob': 52, 'sideways_adx_thresh': 17.038323424526133, 'sideways_atr_min_pct': 0.013718711379313022, 'sideways_atr_max_pct': 0.10500642097063786, 'sideways_tp_mult': 1.994254829236934, 'sideways_tsl_mult': 0.48421970699438505, 'sideways_time_stop': 46, 'sideways_use_sma': False, 'sideways_use_ema': False, 'sideways_use_atr': False, 'sideways_use_adx': True, 'sideways_use_spike': True, 'sideways_rsi_required': False}.
