[I 2025-08-31 04:44:19,799] Trial 440 finished with values: [-0.014801811866526848, 0.014749123443392867] and parameters: {'p_sma': 27, 'p_std': 15, 'p_atr': 16, 'p_adx': 27, 'rsi_period': 27, 'ema1': 15, 'ema2': 15, 'slip_atr_k': 0.019392019210949053, 'slip_spread_k': 0.13343173184417836, 'spread_hl_frac': 0.03791272192820051, 'bb_std_mult': 1.9730822178665297, 'rsi_os': 28, 'rsi_ob': 63, 'vol_spike': 0.24016250631164562, 'adx_thresh': 11.699362330220847, 'atr_min_pct': 0.024688729686634867, 'atr_max_pct': 0.12546207601275625, 'tp_mult': 1.8814540667460409, 'tsl_mult': 0.6198328916739022, 'strategy': 'mean_reversion', 'time_stop': 136, 'use_sma': True, 'use_atr': False, 'use_adx': False, 'use_ema': False, 'use_spike': True, 'rsi_required': False, 'edge_k': 1.243719101111676, 'edge_cap': 0.16519267775663993, 'bull_strategy': 'breakout', 'bull_bb_std_mult': 3.421409583161162, 'bull_rsi_os': 5, 'bull_rsi_ob': 76, 'bull_adx_thresh': 8.143498696537916, 'bull_atr_min_pct': 0.0006038010493331139, 'bull_atr_max_pct': 0.1331799311843216, 'bull_tp_mult': 1.5151533029754818, 'bull_tsl_mult': 0.9514255760210367, 'bull_time_stop': 79, 'bull_use_sma': False, 'bull_use_ema': True, 'bull_use_atr': True, 'bull_use_adx': True, 'bull_use_spike': False, 'bull_rsi_required': False, 'bear_strategy': 'breakout', 'bear_bb_std_mult': 2.9637919310686294, 'bear_rsi_os': 11, 'bear_rsi_ob': 49, 'bear_adx_thresh': 6.84522886743286, 'bear_atr_min_pct': 0.02341754011363749, 'bear_atr_max_pct': 0.0385052136968251, 'bear_tp_mult': 1.7018266856934714, 'bear_tsl_mult': 0.7512586456536388, 'bear_time_stop': 265, 'bear_use_sma': True, 'bear_use_ema': False, 'bear_use_atr': True, 'bear_use_adx': False, 'bear_use_spike': False, 'bear_rsi_required': True, 'sideways_strategy': 'breakout', 'sideways_bb_std_mult': 2.494673650125133, 'sideways_rsi_os': 52, 'sideways_rsi_ob': 55, 'sideways_adx_thresh': 26.058710105186186, 'sideways_atr_min_pct': 0.019264784495743727, 'sideways_atr_max_pct': 0.11343666657130923, 'sideways_tp_mult': 1.2882091860372893, 'sideways_tsl_mult': 0.6625135126716909, 'sideways_time_stop': 72, 'sideways_use_sma': False, 'sideways_use_ema': False, 'sideways_use_atr': False, 'sideways_use_adx': True, 'sideways_use_spike': True, 'sideways_rsi_required': True}.
[I 2025-08-31 04:44:19,806] Trial 443 finished with values: [-1000000000.0, 1000000000.0] and parameters: {'p_sma': 50, 'p_std': 16, 'p_atr': 16, 'p_adx': 28, 'rsi_period': 54, 'ema1': 24, 'ema2': 26, 'slip_atr_k': 0.018574774573896065, 'slip_spread_k': 0.08004258420632461, 'spread_hl_frac': 0.04903485800764425, 'bb_std_mult': 2.099608166522936, 'rsi_os': 28, 'rsi_ob': 79, 'vol_spike': 0.11259828127815694, 'adx_thresh': 10.28505436421003, 'atr_min_pct': 0.024896685734949544, 'atr_max_pct': 0.1229830415238897, 'tp_mult': 2.539023684146458, 'tsl_mult': 0.8046930838951568, 'strategy': 'breakout', 'time_stop': 40, 'use_sma': True, 'use_atr': False, 'use_adx': False, 'use_ema': False, 'use_spike': True, 'rsi_required': False, 'edge_k': 1.2656186931461317, 'edge_cap': 0.9825530768698645, 'bull_strategy': 'breakout', 'bull_bb_std_mult': 3.3172889652962922, 'bull_rsi_os': 5, 'bull_rsi_ob': 70, 'bull_adx_thresh': 27.823261918490456, 'bull_atr_min_pct': 0.0028035341504137755, 'bull_atr_max_pct': 0.13325829316035054, 'bull_tp_mult': 1.5295852420801648, 'bull_tsl_mult': 0.9183037842057657, 'bull_time_stop': 104, 'bull_use_sma': False, 'bull_use_ema': True, 'bull_use_atr': True, 'bull_use_adx': True, 'bull_use_spike': False, 'bull_rsi_required': True, 'bear_strategy': 'breakout', 'bear_bb_std_mult': 0.9086557654105887, 'bear_rsi_os': 42, 'bear_rsi_ob': 48, 'bear_adx_thresh': 14.9850115793599, 'bear_atr_min_pct': 0.024662067934249226, 'bear_atr_max_pct': 0.04701313148469266, 'bear_tp_mult': 1.598528990289383, 'bear_tsl_mult': 0.20238403722234433, 'bear_time_stop': 185, 'bear_use_sma': True, 'bear_use_ema': False, 'bear_use_atr': True, 'bear_use_adx': False, 'bear_use_spike': False, 'bear_rsi_required': True, 'sideways_strategy': 'mean_reversion', 'sideways_bb_std_mult': 1.044304358923461, 'sideways_rsi_os': 7, 'sideways_rsi_ob': 56, 'sideways_adx_thresh': 14.955239610693688, 'sideways_atr_min_pct': 0.013803578694741418, 'sideways_atr_max_pct': 0.11387717975076032, 'sideways_tp_mult': 2.0684270773574567, 'sideways_tsl_mult': 0.08217021082001325, 'sideways_time_stop': 95, 'sideways_use_sma': False, 'sideways_use_ema': False, 'sideways_use_atr': False, 'sideways_use_adx': True, 'sideways_use_spike': True, 'sideways_rsi_required': True}.
[I 2025-08-31 04:44:20,209] Trial 442 finished with values: [-1000000000.0, 1000000000.0] and parameters: {'p_sma': 53, 'p_std': 16, 'p_atr': 11, 'p_adx': 16, 'rsi_period': 27, 'ema1': 10, 'ema2': 46, 'slip_atr_k': 0.019591982174543263, 'slip_spread_k': 0.08396994869490114, 'spread_hl_frac': 0.04876389666956498, 'bb_std_mult': 1.4462108457085856, 'rsi_os': 28, 'rsi_ob': 60, 'vol_spike': 0.03546295206460602, 'adx_thresh': 10.203286287474427, 'atr_min_pct': 0.02433352372909815, 'atr_max_pct': 0.122917293354432, 'tp_mult': 2.5468309083892375, 'tsl_mult': 0.5839199934918189, 'strategy': 'mean_reversion', 'time_stop': 136, 'use_sma': False, 'use_atr': False, 'use_adx': False, 'use_ema': False, 'use_spike': True, 'rsi_required': False, 'edge_k': 1.788625796470709, 'edge_cap': 0.9798159649351121, 'bull_strategy': 'breakout', 'bull_bb_std_mult': 1.4867277302583566, 'bull_rsi_os': 55, 'bull_rsi_ob': 63, 'bull_adx_thresh': 16.22151114562268, 'bull_atr_min_pct': 0.0027423105344791237, 'bull_atr_max_pct': 0.053224327923388194, 'bull_tp_mult': 1.6368499148581601, 'bull_tsl_mult': 0.9541783425203202, 'bull_time_stop': 53, 'bull_use_sma': False, 'bull_use_ema': True, 'bull_use_atr': True, 'bull_use_adx': True, 'bull_use_spike': False, 'bull_rsi_required': False, 'bear_strategy': 'mean_reversion', 'bear_bb_std_mult': 2.0610937977915724, 'bear_rsi_os': 42, 'bear_rsi_ob': 48, 'bear_adx_thresh': 14.904217242660302, 'bear_atr_min_pct': 0.029233817268535293, 'bear_atr_max_pct': 0.10074572220421511, 'bear_tp_mult': 2.1175741901262017, 'bear_tsl_mult': 0.5605547703897429, 'bear_time_stop': 198, 'bear_use_sma': True, 'bear_use_ema': False, 'bear_use_atr': True, 'bear_use_adx': False, 'bear_use_spike': False, 'bear_rsi_required': True, 'sideways_strategy': 'breakout', 'sideways_bb_std_mult': 1.0366476234277155, 'sideways_rsi_os': 46, 'sideways_rsi_ob': 72, 'sideways_adx_thresh': 15.235907291815955, 'sideways_atr_min_pct': 0.013561257045035496, 'sideways_atr_max_pct': 0.040242247145984705, 'sideways_tp_mult': 2.0905201544201537, 'sideways_tsl_mult': 0.623351689159874, 'sideways_time_stop': 38, 'sideways_use_sma': False, 'sideways_use_ema': False, 'sideways_use_atr': False, 'sideways_use_adx': True, 'sideways_use_spike': True, 'sideways_rsi_required': True}.
[I 2025-08-31 04:44:21,029] Trial 445 finished with values: [-1000000000.0, 1000000000.0] and parameters: {'p_sma': 58, 'p_std': 51, 'p_atr': 25, 'p_adx': 16, 'rsi_period': 21, 'ema1': 10, 'ema2': 54, 'slip_atr_k': 0.02436728099078361, 'slip_spread_k': 0.08674089375820487, 'spread_hl_frac': 0.0089325957072157, 'bb_std_mult': 1.9677162657601437, 'rsi_os': 30, 'rsi_ob': 53, 'vol_spike': 0.035668905141260906, 'adx_thresh': 11.918613444483372, 'atr_min_pct': 0.023575390332807717, 'atr_max_pct': 0.010329593002793763, 'tp_mult': 2.4116478843078277, 'tsl_mult': 0.40917422262872927, 'strategy': 'breakout', 'time_stop': 93, 'use_sma': False, 'use_atr': False, 'use_adx': False, 'use_ema': True, 'use_spike': False, 'rsi_required': True, 'edge_k': 0.8667158468843914, 'edge_cap': 0.9808574417861508, 'bull_strategy': 'mean_reversion', 'bull_bb_std_mult': 0.7254361791449806, 'bull_rsi_os': 16, 'bull_rsi_ob': 47, 'bull_adx_thresh': 20.64359683109897, 'bull_atr_min_pct': 0.008802087101194431, 'bull_atr_max_pct': 0.053988934977028925, 'bull_tp_mult': 1.4461185349920933, 'bull_tsl_mult': 0.8327888190362985, 'bull_time_stop': 270, 'bull_use_sma': False, 'bull_use_ema': False, 'bull_use_atr': True, 'bull_use_adx': True, 'bull_use_spike': True, 'bull_rsi_required': True, 'bear_strategy': 'mean_reversion', 'bear_bb_std_mult': 2.2105105599503387, 'bear_rsi_os': 8, 'bear_rsi_ob': 46, 'bear_adx_thresh': 19.35050297645603, 'bear_atr_min_pct': 0.02295608419474175, 'bear_atr_max_pct': 0.11063878751235943, 'bear_tp_mult': 2.120058500686432, 'bear_tsl_mult': 0.4932216072628495, 'bear_time_stop': 113, 'bear_use_sma': True, 'bear_use_ema': True, 'bear_use_atr': False, 'bear_use_adx': True, 'bear_use_spike': True, 'bear_rsi_required': False, 'sideways_strategy': 'mean_reversion', 'sideways_bb_std_mult': 1.8793471620122788, 'sideways_rsi_os': 27, 'sideways_rsi_ob': 51, 'sideways_adx_thresh': 11.462664234587638, 'sideways_atr_min_pct': 0.02039033827295855, 'sideways_atr_max_pct': 0.09806404287824085, 'sideways_tp_mult': 1.9665362466177818, 'sideways_tsl_mult': 0.6140988443539582, 'sideways_time_stop': 38, 'sideways_use_sma': True, 'sideways_use_ema': False, 'sideways_use_atr': False, 'sideways_use_adx': True, 'sideways_use_spike': True, 'sideways_rsi_required': True}.
[I 2025-08-31 04:45:01,680] Trial 446 finished with values: [-1000000000.0, 1000000000.0] and parameters: {'p_sma': 54, 'p_std': 54, 'p_atr': 24, 'p_adx': 8, 'rsi_period': 64, 'ema1': 19, 'ema2': 25, 'slip_atr_k': 0.02454505807219172, 'slip_spread_k': 0.9515601294079479, 'spread_hl_frac': 0.009017176101416969, 'bb_std_mult': 1.4383231974652242, 'rsi_os': 49, 'rsi_ob': 60, 'vol_spike': 0.013201912390854307, 'adx_thresh': 33.15049766487523, 'atr_min_pct': 0.023610747313024844, 'atr_max_pct': 0.11958667434833689, 'tp_mult': 2.4071055088189186, 'tsl_mult': 0.8217192194897314, 'strategy': 'breakout', 'time_stop': 292, 'use_sma': False, 'use_atr': False, 'use_adx': False, 'use_ema': True, 'use_spike': False, 'rsi_required': True, 'edge_k': 1.424289906746082, 'edge_cap': 0.9857707583581782, 'bull_strategy': 'mean_reversion', 'bull_bb_std_mult': 2.078258116770106, 'bull_rsi_os': 16, 'bull_rsi_ob': 78, 'bull_adx_thresh': 12.982814345656791, 'bull_atr_min_pct': 0.002046365608927517, 'bull_atr_max_pct': 0.10499322188114815, 'bull_tp_mult': 2.8963688354387034, 'bull_tsl_mult': 0.3119058101801504, 'bull_time_stop': 260, 'bull_use_sma': False, 'bull_use_ema': False, 'bull_use_atr': True, 'bull_use_adx': True, 'bull_use_spike': True, 'bull_rsi_required': True, 'bear_strategy': 'mean_reversion', 'bear_bb_std_mult': 0.7882144350402652, 'bear_rsi_os': 8, 'bear_rsi_ob': 46, 'bear_adx_thresh': 23.563089753413557, 'bear_atr_min_pct': 0.022936200314034764, 'bear_atr_max_pct': 0.05103693348229903, 'bear_tp_mult': 1.7595479130264797, 'bear_tsl_mult': 0.26434074269848273, 'bear_time_stop': 198, 'bear_use_sma': True, 'bear_use_ema': True, 'bear_use_atr': False, 'bear_use_adx': True, 'bear_use_spike': True, 'bear_rsi_required': False, 'sideways_strategy': 'mean_reversion', 'sideways_bb_std_mult': 1.1142790365563982, 'sideways_rsi_os': 27, 'sideways_rsi_ob': 51, 'sideways_adx_thresh': 11.558038599890889, 'sideways_atr_min_pct': 0.006235492089501058, 'sideways_atr_max_pct': 0.03804078245339748, 'sideways_tp_mult': 1.963829032936642, 'sideways_tsl_mult': 0.6167387702061077, 'sideways_time_stop': 51, 'sideways_use_sma': True, 'sideways_use_ema': False, 'sideways_use_atr': False, 'sideways_use_adx': True, 'sideways_use_spike': True, 'sideways_rsi_required': True}.
[I 2025-08-31 04:45:02,555] Trial 447 finished with values: [-1000000000.0, 1000000000.0] and parameters: {'p_sma': 47, 'p_std': 31, 'p_atr': 24, 'p_adx': 8, 'rsi_period': 79, 'ema1': 11, 'ema2': 25, 'slip_atr_k': 0.012808881099850018, 'slip_spread_k': 0.7145961176228003, 'spread_hl_frac': 0.018523686083690635, 'bb_std_mult': 3.0500303908004742, 'rsi_os': 30, 'rsi_ob': 57, 'vol_spike': 0.013213927160761174, 'adx_thresh': 13.066975654732277, 'atr_min_pct': 0.018828205003992224, 'atr_max_pct': 0.050594767545253175, 'tp_mult': 2.356288123621364, 'tsl_mult': 0.97512470037187, 'strategy': 'breakout', 'time_stop': 47, 'use_sma': False, 'use_atr': False, 'use_adx': False, 'use_ema': True, 'use_spike': False, 'rsi_required': True, 'edge_k': 1.4257001978691144, 'edge_cap': 0.9283672003894196, 'bull_strategy': 'mean_reversion', 'bull_bb_std_mult': 3.5633966569423534, 'bull_rsi_os': 16, 'bull_rsi_ob': 47, 'bull_adx_thresh': 13.05819968842241, 'bull_atr_min_pct': 0.0017367313988098977, 'bull_atr_max_pct': 0.10497772427526436, 'bull_tp_mult': 1.902430475516222, 'bull_tsl_mult': 0.8882274207259626, 'bull_time_stop': 283, 'bull_use_sma': False, 'bull_use_ema': False, 'bull_use_atr': True, 'bull_use_adx': True, 'bull_use_spike': True, 'bull_rsi_required': True, 'bear_strategy': 'mean_reversion', 'bear_bb_std_mult': 0.7931651174449728, 'bear_rsi_os': 45, 'bear_rsi_ob': 46, 'bear_adx_thresh': 23.36678818458411, 'bear_atr_min_pct': 0.022872486504753542, 'bear_atr_max_pct': 0.11246259855671062, 'bear_tp_mult': 1.4663467247744426, 'bear_tsl_mult': 0.2527155456165691, 'bear_time_stop': 113, 'bear_use_sma': True, 'bear_use_ema': True, 'bear_use_atr': False, 'bear_use_adx': True, 'bear_use_spike': True, 'bear_rsi_required': False, 'sideways_strategy': 'mean_reversion', 'sideways_bb_std_mult': 1.8629329589433754, 'sideways_rsi_os': 29, 'sideways_rsi_ob': 62, 'sideways_adx_thresh': 11.480437324227054, 'sideways_atr_min_pct': 0.020436655130974604, 'sideways_atr_max_pct': 0.10802418621730357, 'sideways_tp_mult': 1.959088926868361, 'sideways_tsl_mult': 0.6932902162071942, 'sideways_time_stop': 31, 'sideways_use_sma': True, 'sideways_use_ema': False, 'sideways_use_atr': False, 'sideways_use_adx': True, 'sideways_use_spike': True, 'sideways_rsi_required': True}.
[I 2025-08-31 04:45:02,683] Trial 444 finished with values: [-0.08528293004039678, 0.08522290858879587] and parameters: {'p_sma': 27, 'p_std': 16, 'p_atr': 26, 'p_adx': 28, 'rsi_period': 25, 'ema1': 21, 'ema2': 26, 'slip_atr_k': 0.017928248068295707, 'slip_spread_k': 0.08602076231038165, 'spread_hl_frac': 0.04727743181433326, 'bb_std_mult': 3.471673857331697, 'rsi_os': 28, 'rsi_ob': 53, 'vol_spike': 0.24030549857985775, 'adx_thresh': 11.900917640321968, 'atr_min_pct': 0.020503538805635612, 'atr_max_pct': 0.1226056685314029, 'tp_mult': 2.405863770172238, 'tsl_mult': 0.6920622748949821, 'strategy': 'breakout', 'time_stop': 153, 'use_sma': False, 'use_atr': False, 'use_adx': False, 'use_ema': False, 'use_spike': True, 'rsi_required': True, 'edge_k': 1.424994905081504, 'edge_cap': 0.9843450046705247, 'bull_strategy': 'breakout', 'bull_bb_std_mult': 3.416251487110529, 'bull_rsi_os': 16, 'bull_rsi_ob': 78, 'bull_adx_thresh': 25.88066642765922, 'bull_atr_min_pct': 0.002799539322388724, 'bull_atr_max_pct': 0.13276646720141985, 'bull_tp_mult': 1.446199787055358, 'bull_tsl_mult': 0.9269335481014194, 'bull_time_stop': 108, 'bull_use_sma': False, 'bull_use_ema': True, 'bull_use_atr': True, 'bull_use_adx': True, 'bull_use_spike': False, 'bull_rsi_required': True, 'bear_strategy': 'mean_reversion', 'bear_bb_std_mult': 0.921042312967662, 'bear_rsi_os': 8, 'bear_rsi_ob': 49, 'bear_adx_thresh': 22.955733479855745, 'bear_atr_min_pct': 0.029402172545681116, 'bear_atr_max_pct': 0.048676694838211854, 'bear_tp_mult': 2.1211975525811533, 'bear_tsl_mult': 0.25644887353028745, 'bear_time_stop': 177, 'bear_use_sma': True, 'bear_use_ema': False, 'bear_use_atr': True, 'bear_use_adx': False, 'bear_use_spike': False, 'bear_rsi_required': True, 'sideways_strategy': 'mean_reversion', 'sideways_bb_std_mult': 2.483391527951697, 'sideways_rsi_os': 27, 'sideways_rsi_ob': 56, 'sideways_adx_thresh': 11.462845460441166, 'sideways_atr_min_pct': 6.285845809169376e-05, 'sideways_atr_max_pct': 0.11373402030468713, 'sideways_tp_mult': 1.9526526969016973, 'sideways_tsl_mult': 0.6170658931652618, 'sideways_time_stop': 97, 'sideways_use_sma': False, 'sideways_use_ema': False, 'sideways_use_atr': False, 'sideways_use_adx': True, 'sideways_use_spike': True, 'sideways_rsi_required': True}.
[I 2025-08-31 04:45:02,981] Trial 448 finished with values: [-0.016205990151353045, 0.016144019165430852] and parameters: {'p_sma': 48, 'p_std': 18, 'p_atr': 26, 'p_adx': 8, 'rsi_period': 25, 'ema1': 14, 'ema2': 27, 'slip_atr_k': 0.21288374916881286, 'slip_spread_k': 0.2401478573845125, 'spread_hl_frac': 0.019978507643847187, 'bb_std_mult': 1.7079597948968035, 'rsi_os': 50, 'rsi_ob': 60, 'vol_spike': 0.08900956886035588, 'adx_thresh': 12.617904482449728, 'atr_min_pct': 0.0019295513995883536, 'atr_max_pct': 0.04645675439169701, 'tp_mult': 2.689291735811944, 'tsl_mult': 0.8940496789767062, 'strategy': 'breakout', 'time_stop': 49, 'use_sma': False, 'use_atr': False, 'use_adx': False, 'use_ema': False, 'use_spike': True, 'rsi_required': True, 'edge_k': 1.413396501704399, 'edge_cap': 0.9389850008523138, 'bull_strategy': 'mean_reversion', 'bull_bb_std_mult': 1.8853782920814899, 'bull_rsi_os': 39, 'bull_rsi_ob': 78, 'bull_adx_thresh': 14.980119167401977, 'bull_atr_min_pct': 0.0017045813225656937, 'bull_atr_max_pct': 0.04227793410216462, 'bull_tp_mult': 1.5828215808643016, 'bull_tsl_mult': 0.03677758562042105, 'bull_time_stop': 135, 'bull_use_sma': False, 'bull_use_ema': False, 'bull_use_atr': True, 'bull_use_adx': True, 'bull_use_spike': False, 'bull_rsi_required': True, 'bear_strategy': 'mean_reversion', 'bear_bb_std_mult': 0.7897051094123422, 'bear_rsi_os': 31, 'bear_rsi_ob': 49, 'bear_adx_thresh': 17.782517852770813, 'bear_atr_min_pct': 0.022177938942364056, 'bear_atr_max_pct': 0.05142660354423782, 'bear_tp_mult': 1.7530319720633605, 'bear_tsl_mult': 0.2586369462704617, 'bear_time_stop': 212, 'bear_use_sma': True, 'bear_use_ema': True, 'bear_use_atr': False, 'bear_use_adx': True, 'bear_use_spike': True, 'bear_rsi_required': True, 'sideways_strategy': 'mean_reversion', 'sideways_bb_std_mult': 2.8540143697951796, 'sideways_rsi_os': 30, 'sideways_rsi_ob': 62, 'sideways_adx_thresh': 16.930851947670135, 'sideways_atr_min_pct': 0.028162757046025166, 'sideways_atr_max_pct': 0.10847594466212614, 'sideways_tp_mult': 2.9072434181635973, 'sideways_tsl_mult': 0.6680246186692522, 'sideways_time_stop': 51, 'sideways_use_sma': False, 'sideways_use_ema': False, 'sideways_use_atr': False, 'sideways_use_adx': True, 'sideways_use_spike': True, 'sideways_rsi_required': True}.
[I 2025-08-31 04:45:53,103] Trial 451 finished with values: [-1000000000.0, 1000000000.0] and parameters: {'p_sma': 52, 'p_std': 18, 'p_atr': 17, 'p_adx': 15, 'rsi_period': 34, 'ema1': 30, 'ema2': 28, 'slip_atr_k': 2.7355395832914797e-06, 'slip_spread_k': 0.11781006693595886, 'spread_hl_frac': 0.04256628245301955, 'bb_std_mult': 2.435201917614179, 'rsi_os': 7, 'rsi_ob': 67, 'vol_spike': 0.2919424686188848, 'adx_thresh': 11.046064852460063, 'atr_min_pct': 0.023176581977483235, 'atr_max_pct': 0.04684624566021913, 'tp_mult': 1.7621421802152528, 'tsl_mult': 0.28316960344635655, 'strategy': 'breakout', 'time_stop': 59, 'use_sma': False, 'use_atr': False, 'use_adx': False, 'use_ema': False, 'use_spike': True, 'rsi_required': False, 'edge_k': 1.5010567568486413, 'edge_cap': 0.6029594296346873, 'bull_strategy': 'mean_reversion', 'bull_bb_std_mult': 3.4855561081152873, 'bull_rsi_os': 43, 'bull_rsi_ob': 58, 'bull_adx_thresh': 7.46146899946763, 'bull_atr_min_pct': 0.024372002678303008, 'bull_atr_max_pct': 0.04541328010435777, 'bull_tp_mult': 1.5775605106785566, 'bull_tsl_mult': 0.5453278701896198, 'bull_time_stop': 88, 'bull_use_sma': False, 'bull_use_ema': False, 'bull_use_atr': True, 'bull_use_adx': True, 'bull_use_spike': False, 'bull_rsi_required': True, 'bear_strategy': 'mean_reversion', 'bear_bb_std_mult': 1.0245075472513838, 'bear_rsi_os': 30, 'bear_rsi_ob': 55, 'bear_adx_thresh': 21.653812295661925, 'bear_atr_min_pct': 0.015875604586311393, 'bear_atr_max_pct': 0.06389982427866651, 'bear_tp_mult': 2.6134175809086786, 'bear_tsl_mult': 0.22273977211239698, 'bear_time_stop': 220, 'bear_use_sma': True, 'bear_use_ema': True, 'bear_use_atr': True, 'bear_use_adx': True, 'bear_use_spike': True, 'bear_rsi_required': True, 'sideways_strategy': 'mean_reversion', 'sideways_bb_std_mult': 2.62007018180231, 'sideways_rsi_os': 11, 'sideways_rsi_ob': 78, 'sideways_adx_thresh': 10.264559980792757, 'sideways_atr_min_pct': 0.015336667071817495, 'sideways_atr_max_pct': 0.12034266019814503, 'sideways_tp_mult': 1.9057898881502713, 'sideways_tsl_mult': 0.7176200854780586, 'sideways_time_stop': 82, 'sideways_use_sma': False, 'sideways_use_ema': False, 'sideways_use_atr': False, 'sideways_use_adx': True, 'sideways_use_spike': True, 'sideways_rsi_required': True}.
