[I 2025-08-31 05:04:05,664] Trial 550 finished with values: [-1000000000.0, 1000000000.0] and parameters: {'p_sma': 33, 'p_std': 31, 'p_atr': 26, 'p_adx': 12, 'rsi_period': 22, 'ema1': 16, 'ema2': 26, 'slip_atr_k': 0.1668951666165127, 'slip_spread_k': 0.11969259994947123, 'spread_hl_frac': 0.0023548734470528673, 'bb_std_mult': 1.9811239431770205, 'rsi_os': 27, 'rsi_ob': 61, 'vol_spike': 0.29463459955991117, 'adx_thresh': 12.889622177336292, 'atr_min_pct': 0.0019421095429131893, 'atr_max_pct': 0.11969002951080308, 'tp_mult': 1.6207371454759572, 'tsl_mult': 0.7090928291299912, 'strategy': 'breakout', 'time_stop': 56, 'use_sma': False, 'use_atr': False, 'use_adx': False, 'use_ema': False, 'use_spike': True, 'rsi_required': False, 'edge_k': 1.4555312051729403, 'edge_cap': 0.50735210618158, 'bull_strategy': 'mean_reversion', 'bull_bb_std_mult': 2.552602037295195, 'bull_rsi_os': 14, 'bull_rsi_ob': 45, 'bull_adx_thresh': 23.15811061685695, 'bull_atr_min_pct': 0.024824565597079754, 'bull_atr_max_pct': 0.07646458643328578, 'bull_tp_mult': 1.1758748018365046, 'bull_tsl_mult': 0.8508254102159224, 'bull_time_stop': 104, 'bull_use_sma': False, 'bull_use_ema': False, 'bull_use_atr': True, 'bull_use_adx': True, 'bull_use_spike': False, 'bull_rsi_required': True, 'bear_strategy': 'mean_reversion', 'bear_bb_std_mult': 2.8329859153077606, 'bear_rsi_os': 10, 'bear_rsi_ob': 49, 'bear_adx_thresh': 19.492135607473717, 'bear_atr_min_pct': 0.020955184664594104, 'bear_atr_max_pct': 0.036122091823539655, 'bear_tp_mult': 2.6958715080236284, 'bear_tsl_mult': 0.2803870558493905, 'bear_time_stop': 202, 'bear_use_sma': True, 'bear_use_ema': True, 'bear_use_atr': True, 'bear_use_adx': True, 'bear_use_spike': True, 'bear_rsi_required': False, 'sideways_strategy': 'mean_reversion', 'sideways_bb_std_mult': 1.025654756509197, 'sideways_rsi_os': 27, 'sideways_rsi_ob': 78, 'sideways_adx_thresh': 30.33184076680024, 'sideways_atr_min_pct': 0.009619821230443849, 'sideways_atr_max_pct': 0.12088003458342036, 'sideways_tp_mult': 2.956094367196375, 'sideways_tsl_mult': 0.6625177544230509, 'sideways_time_stop': 54, 'sideways_use_sma': False, 'sideways_use_ema': False, 'sideways_use_atr': False, 'sideways_use_adx': True, 'sideways_use_spike': True, 'sideways_rsi_required': True}.
[I 2025-08-31 05:04:05,918] Trial 549 finished with values: [-0.010479950108068459, 0.010433250708915794] and parameters: {'p_sma': 54, 'p_std': 11, 'p_atr': 23, 'p_adx': 24, 'rsi_period': 19, 'ema1': 13, 'ema2': 28, 'slip_atr_k': 0.01176652139517716, 'slip_spread_k': 0.6125610912629165, 'spread_hl_frac': 0.038710085329072025, 'bb_std_mult': 1.9390799803353567, 'rsi_os': 26, 'rsi_ob': 60, 'vol_spike': 0.030208212508013924, 'adx_thresh': 12.724919353308179, 'atr_min_pct': 0.026778469297309385, 'atr_max_pct': 0.11972832275758213, 'tp_mult': 2.643370599305293, 'tsl_mult': 0.704916314386018, 'strategy': 'breakout', 'time_stop': 52, 'use_sma': True, 'use_atr': True, 'use_adx': False, 'use_ema': True, 'use_spike': False, 'rsi_required': True, 'edge_k': 0.701990724810821, 'edge_cap': 0.7355622092101789, 'bull_strategy': 'mean_reversion', 'bull_bb_std_mult': 2.580221655713925, 'bull_rsi_os': 15, 'bull_rsi_ob': 77, 'bull_adx_thresh': 12.685108860565913, 'bull_atr_min_pct': 0.0020919304836756088, 'bull_atr_max_pct': 0.0985114789269437, 'bull_tp_mult': 2.62661698620543, 'bull_tsl_mult': 0.375238428848895, 'bull_time_stop': 153, 'bull_use_sma': False, 'bull_use_ema': False, 'bull_use_atr': False, 'bull_use_adx': True, 'bull_use_spike': True, 'bull_rsi_required': True, 'bear_strategy': 'breakout', 'bear_bb_std_mult': 3.181993762497143, 'bear_rsi_os': 10, 'bear_rsi_ob': 49, 'bear_adx_thresh': 19.546929439353338, 'bear_atr_min_pct': 0.025478598305431678, 'bear_atr_max_pct': 0.04961343015918905, 'bear_tp_mult': 2.764012637558382, 'bear_tsl_mult': 0.48952294034000154, 'bear_time_stop': 205, 'bear_use_sma': True, 'bear_use_ema': True, 'bear_use_atr': True, 'bear_use_adx': True, 'bear_use_spike': True, 'bear_rsi_required': True, 'sideways_strategy': 'mean_reversion', 'sideways_bb_std_mult': 1.8045928114812886, 'sideways_rsi_os': 40, 'sideways_rsi_ob': 87, 'sideways_adx_thresh': 11.143319165300626, 'sideways_atr_min_pct': 0.013660395342011264, 'sideways_atr_max_pct': 0.08462510004556505, 'sideways_tp_mult': 1.1551830923426387, 'sideways_tsl_mult': 0.6287304958555158, 'sideways_time_stop': 142, 'sideways_use_sma': False, 'sideways_use_ema': False, 'sideways_use_atr': False, 'sideways_use_adx': False, 'sideways_use_spike': True, 'sideways_rsi_required': True}.
[I 2025-08-31 05:04:48,673] Trial 553 finished with values: [-1000000000.0, 1000000000.0] and parameters: {'p_sma': 45, 'p_std': 41, 'p_atr': 20, 'p_adx': 26, 'rsi_period': 23, 'ema1': 13, 'ema2': 28, 'slip_atr_k': 0.022812611488309063, 'slip_spread_k': 0.02186816305648341, 'spread_hl_frac': 0.008858657710528432, 'bb_std_mult': 0.8550995502484382, 'rsi_os': 20, 'rsi_ob': 63, 'vol_spike': 0.032288841144136764, 'adx_thresh': 29.09086293044397, 'atr_min_pct': 0.022209488644985335, 'atr_max_pct': 0.1241822315667211, 'tp_mult': 1.0380222217128852, 'tsl_mult': 0.9490258450709498, 'strategy': 'breakout', 'time_stop': 50, 'use_sma': True, 'use_atr': True, 'use_adx': False, 'use_ema': True, 'use_spike': False, 'rsi_required': False, 'edge_k': 1.5008387326016395, 'edge_cap': 0.9522414048013806, 'bull_strategy': 'breakout', 'bull_bb_std_mult': 3.419863345870439, 'bull_rsi_os': 15, 'bull_rsi_ob': 91, 'bull_adx_thresh': 12.640447461789254, 'bull_atr_min_pct': 0.015726133008175998, 'bull_atr_max_pct': 0.048340762580717414, 'bull_tp_mult': 1.570556903495331, 'bull_tsl_mult': 0.44093972690897354, 'bull_time_stop': 152, 'bull_use_sma': False, 'bull_use_ema': False, 'bull_use_atr': False, 'bull_use_adx': True, 'bull_use_spike': True, 'bull_rsi_required': True, 'bear_strategy': 'breakout', 'bear_bb_std_mult': 0.921273599291855, 'bear_rsi_os': 55, 'bear_rsi_ob': 52, 'bear_adx_thresh': 17.890709778880417, 'bear_atr_min_pct': 0.023615986242358368, 'bear_atr_max_pct': 0.038540255623581224, 'bear_tp_mult': 2.771906282354802, 'bear_tsl_mult': 0.23963212476313597, 'bear_time_stop': 202, 'bear_use_sma': True, 'bear_use_ema': True, 'bear_use_atr': True, 'bear_use_adx': True, 'bear_use_spike': False, 'bear_rsi_required': True, 'sideways_strategy': 'mean_reversion', 'sideways_bb_std_mult': 0.9236029015638271, 'sideways_rsi_os': 12, 'sideways_rsi_ob': 58, 'sideways_adx_thresh': 9.585796029707328, 'sideways_atr_min_pct': 0.02391060544672143, 'sideways_atr_max_pct': 0.02143816097362264, 'sideways_tp_mult': 1.9772126608581406, 'sideways_tsl_mult': 0.36911779552618185, 'sideways_time_stop': 62, 'sideways_use_sma': True, 'sideways_use_ema': False, 'sideways_use_atr': False, 'sideways_use_adx': False, 'sideways_use_spike': True, 'sideways_rsi_required': True}.
[I 2025-08-31 05:04:48,948] Trial 551 finished with values: [-0.021649507592714, 0.021597343903597334] and parameters: {'p_sma': 33, 'p_std': 19, 'p_atr': 19, 'p_adx': 12, 'rsi_period': 23, 'ema1': 16, 'ema2': 28, 'slip_atr_k': 0.16627594789632863, 'slip_spread_k': 0.11836100720023822, 'spread_hl_frac': 0.011435397367483, 'bb_std_mult': 0.8825108643627129, 'rsi_os': 26, 'rsi_ob': 63, 'vol_spike': 0.029115625833862735, 'adx_thresh': 12.710202957504515, 'atr_min_pct': 0.02204860667171064, 'atr_max_pct': 0.02287898868853492, 'tp_mult': 2.613458175176654, 'tsl_mult': 0.7069099175312235, 'strategy': 'breakout', 'time_stop': 56, 'use_sma': False, 'use_atr': True, 'use_adx': False, 'use_ema': False, 'use_spike': True, 'rsi_required': False, 'edge_k': 1.4490339354338757, 'edge_cap': 0.5070314139992237, 'bull_strategy': 'mean_reversion', 'bull_bb_std_mult': 2.616153836992726, 'bull_rsi_os': 15, 'bull_rsi_ob': 77, 'bull_adx_thresh': 12.951298703226124, 'bull_atr_min_pct': 0.0006191822402983555, 'bull_atr_max_pct': 0.09885811427567702, 'bull_tp_mult': 1.6179903716853674, 'bull_tsl_mult': 0.46232114974513355, 'bull_time_stop': 300, 'bull_use_sma': False, 'bull_use_ema': False, 'bull_use_atr': True, 'bull_use_adx': True, 'bull_use_spike': False, 'bull_rsi_required': True, 'bear_strategy': 'mean_reversion', 'bear_bb_std_mult': 3.1275451029253762, 'bear_rsi_os': 8, 'bear_rsi_ob': 49, 'bear_adx_thresh': 19.33413440722269, 'bear_atr_min_pct': 0.004087779746045272, 'bear_atr_max_pct': 0.03745302127360255, 'bear_tp_mult': 2.775982729981257, 'bear_tsl_mult': 0.2842068707084835, 'bear_time_stop': 207, 'bear_use_sma': True, 'bear_use_ema': True, 'bear_use_atr': True, 'bear_use_adx': True, 'bear_use_spike': True, 'bear_rsi_required': False, 'sideways_strategy': 'mean_reversion', 'sideways_bb_std_mult': 1.0172015979270208, 'sideways_rsi_os': 30, 'sideways_rsi_ob': 78, 'sideways_adx_thresh': 19.285500830896268, 'sideways_atr_min_pct': 0.014106015150254784, 'sideways_atr_max_pct': 0.12103853661017841, 'sideways_tp_mult': 1.992059649596174, 'sideways_tsl_mult': 0.3402653097735473, 'sideways_time_stop': 141, 'sideways_use_sma': False, 'sideways_use_ema': False, 'sideways_use_atr': False, 'sideways_use_adx': False, 'sideways_use_spike': True, 'sideways_rsi_required': True}.
[I 2025-08-31 05:04:49,290] Trial 554 finished with values: [-1000000000.0, 1000000000.0] and parameters: {'p_sma': 36, 'p_std': 52, 'p_atr': 25, 'p_adx': 28, 'rsi_period': 23, 'ema1': 30, 'ema2': 22, 'slip_atr_k': 0.17849613533800296, 'slip_spread_k': 0.7586294354237715, 'spread_hl_frac': 0.024240210601260567, 'bb_std_mult': 1.8925048207831885, 'rsi_os': 51, 'rsi_ob': 63, 'vol_spike': 0.03168347590081525, 'adx_thresh': 12.249209278821084, 'atr_min_pct': 0.02679833032858343, 'atr_max_pct': 0.12281232652173532, 'tp_mult': 2.586214951637174, 'tsl_mult': 0.42165535931751996, 'strategy': 'breakout', 'time_stop': 49, 'use_sma': True, 'use_atr': True, 'use_adx': False, 'use_ema': True, 'use_spike': False, 'rsi_required': False, 'edge_k': 1.507445884361571, 'edge_cap': 0.27503953589540664, 'bull_strategy': 'mean_reversion', 'bull_bb_std_mult': 3.427128028984607, 'bull_rsi_os': 13, 'bull_rsi_ob': 76, 'bull_adx_thresh': 34.23566900885963, 'bull_atr_min_pct': 0.0005795642869444249, 'bull_atr_max_pct': 0.1402151100797013, 'bull_tp_mult': 1.5783197116103198, 'bull_tsl_mult': 0.913270258494991, 'bull_time_stop': 10, 'bull_use_sma': False, 'bull_use_ema': False, 'bull_use_atr': False, 'bull_use_adx': True, 'bull_use_spike': True, 'bull_rsi_required': True, 'bear_strategy': 'breakout', 'bear_bb_std_mult': 1.6752799048494333, 'bear_rsi_os': 5, 'bear_rsi_ob': 94, 'bear_adx_thresh': 20.434484662049474, 'bear_atr_min_pct': 0.004070498835489605, 'bear_atr_max_pct': 0.11882035596120777, 'bear_tp_mult': 2.7699264602946654, 'bear_tsl_mult': 0.2359755770809533, 'bear_time_stop': 177, 'bear_use_sma': True, 'bear_use_ema': True, 'bear_use_atr': True, 'bear_use_adx': True, 'bear_use_spike': False, 'bear_rsi_required': True, 'sideways_strategy': 'mean_reversion', 'sideways_bb_std_mult': 0.929191512862393, 'sideways_rsi_os': 30, 'sideways_rsi_ob': 51, 'sideways_adx_thresh': 10.574216904308969, 'sideways_atr_min_pct': 0.014721021198819611, 'sideways_atr_max_pct': 0.046648812588826256, 'sideways_tp_mult': 1.9409378886324369, 'sideways_tsl_mult': 0.3274564728078483, 'sideways_time_stop': 122, 'sideways_use_sma': True, 'sideways_use_ema': False, 'sideways_use_atr': False, 'sideways_use_adx': False, 'sideways_use_spike': True, 'sideways_rsi_required': True}.
[I 2025-08-31 05:04:49,426] Trial 552 finished with values: [-1000000000.0, 1000000000.0] and parameters: {'p_sma': 33, 'p_std': 21, 'p_atr': 20, 'p_adx': 28, 'rsi_period': 23, 'ema1': 13, 'ema2': 28, 'slip_atr_k': 0.1415356757342248, 'slip_spread_k': 0.6079260805537435, 'spread_hl_frac': 0.02419977721330863, 'bb_std_mult': 0.8607062166147252, 'rsi_os': 38, 'rsi_ob': 61, 'vol_spike': 0.030998292134028636, 'adx_thresh': 12.528072906063093, 'atr_min_pct': 0.021918467730335112, 'atr_max_pct': 0.0725858282607449, 'tp_mult': 2.634772201803395, 'tsl_mult': 0.7062141933106161, 'strategy': 'breakout', 'time_stop': 149, 'use_sma': True, 'use_atr': True, 'use_adx': False, 'use_ema': True, 'use_spike': False, 'rsi_required': False, 'edge_k': 1.4616849533206364, 'edge_cap': 0.9539336065420936, 'bull_strategy': 'mean_reversion', 'bull_bb_std_mult': 2.6151314197717896, 'bull_rsi_os': 49, 'bull_rsi_ob': 46, 'bull_adx_thresh': 30.11768315423204, 'bull_atr_min_pct': 0.0015087779003580357, 'bull_atr_max_pct': 0.12680962688216396, 'bull_tp_mult': 1.5729778208883, 'bull_tsl_mult': 0.9139173403102308, 'bull_time_stop': 106, 'bull_use_sma': False, 'bull_use_ema': False, 'bull_use_atr': False, 'bull_use_adx': True, 'bull_use_spike': True, 'bull_rsi_required': True, 'bear_strategy': 'breakout', 'bear_bb_std_mult': 2.8079734400371583, 'bear_rsi_os': 8, 'bear_rsi_ob': 47, 'bear_adx_thresh': 17.862816944620704, 'bear_atr_min_pct': 0.02369371923760942, 'bear_atr_max_pct': 0.03551913133459038, 'bear_tp_mult': 2.7679653747248927, 'bear_tsl_mult': 0.2842954028583444, 'bear_time_stop': 203, 'bear_use_sma': True, 'bear_use_ema': True, 'bear_use_atr': True, 'bear_use_adx': True, 'bear_use_spike': True, 'bear_rsi_required': False, 'sideways_strategy': 'mean_reversion', 'sideways_bb_std_mult': 0.6969654402285657, 'sideways_rsi_os': 27, 'sideways_rsi_ob': 51, 'sideways_adx_thresh': 25.968240383966165, 'sideways_atr_min_pct': 0.014647348719670291, 'sideways_atr_max_pct': 0.02146027784534174, 'sideways_tp_mult': 1.9501711401746515, 'sideways_tsl_mult': 0.640073552859577, 'sideways_time_stop': 43, 'sideways_use_sma': True, 'sideways_use_ema': False, 'sideways_use_atr': False, 'sideways_use_adx': False, 'sideways_use_spike': True, 'sideways_rsi_required': True}.
[I 2025-08-31 05:04:50,774] Trial 558 finished with values: [-1000000000.0, 1000000000.0] and parameters: {'p_sma': 54, 'p_std': 26, 'p_atr': 23, 'p_adx': 9, 'rsi_period': 76, 'ema1': 15, 'ema2': 25, 'slip_atr_k': 0.010281967175075027, 'slip_spread_k': 0.09795431737372323, 'spread_hl_frac': 0.010102527731019082, 'bb_std_mult': 1.9206451998743663, 'rsi_os': 31, 'rsi_ob': 60, 'vol_spike': 0.001632670973848959, 'adx_thresh': 10.598693629346728, 'atr_min_pct': 0.02325196600911426, 'atr_max_pct': 0.014542048103662483, 'tp_mult': 2.5146570564133595, 'tsl_mult': 0.8896461942474105, 'strategy': 'mean_reversion', 'time_stop': 293, 'use_sma': False, 'use_atr': False, 'use_adx': False, 'use_ema': False, 'use_spike': True, 'rsi_required': False, 'edge_k': 0.8166523608464944, 'edge_cap': 0.9993611122293269, 'bull_strategy': 'mean_reversion', 'bull_bb_std_mult': 3.4995822442882103, 'bull_rsi_os': 12, 'bull_rsi_ob': 82, 'bull_adx_thresh': 9.177670710019862, 'bull_atr_min_pct': 0.029332253980467272, 'bull_atr_max_pct': 0.04309647660636118, 'bull_tp_mult': 2.63528512420894, 'bull_tsl_mult': 0.8734429223082071, 'bull_time_stop': 32, 'bull_use_sma': False, 'bull_use_ema': True, 'bull_use_atr': True, 'bull_use_adx': True, 'bull_use_spike': False, 'bull_rsi_required': True, 'bear_strategy': 'mean_reversion', 'bear_bb_std_mult': 1.0454529528275858, 'bear_rsi_os': 16, 'bear_rsi_ob': 75, 'bear_adx_thresh': 29.01656088917632, 'bear_atr_min_pct': 0.025409109273710376, 'bear_atr_max_pct': 0.10932681301384539, 'bear_tp_mult': 2.7079820661255534, 'bear_tsl_mult': 0.7416552540542385, 'bear_time_stop': 185, 'bear_use_sma': True, 'bear_use_ema': False, 'bear_use_atr': False, 'bear_use_adx': True, 'bear_use_spike': True, 'bear_rsi_required': True, 'sideways_strategy': 'breakout', 'sideways_bb_std_mult': 2.4316905517853895, 'sideways_rsi_os': 28, 'sideways_rsi_ob': 56, 'sideways_adx_thresh': 11.220473224413052, 'sideways_atr_min_pct': 0.026936155360999643, 'sideways_atr_max_pct': 0.06284957755273149, 'sideways_tp_mult': 2.0815789753665506, 'sideways_tsl_mult': 0.6218969624336351, 'sideways_time_stop': 71, 'sideways_use_sma': False, 'sideways_use_ema': False, 'sideways_use_atr': False, 'sideways_use_adx': True, 'sideways_use_spike': True, 'sideways_rsi_required': True}.
[I 2025-08-31 05:05:40,740] Trial 556 finished with values: [-1000000000.0, 1000000000.0] and parameters: {'p_sma': 6, 'p_std': 15, 'p_atr': 25, 'p_adx': 9, 'rsi_period': 7, 'ema1': 13, 'ema2': 25, 'slip_atr_k': 0.01108362382619694, 'slip_spread_k': 0.9748518921434868, 'spread_hl_frac': 0.012296267724107322, 'bb_std_mult': 1.9053537542230254, 'rsi_os': 30, 'rsi_ob': 65, 'vol_spike': 0.015445031021219685, 'adx_thresh': 10.646628591924486, 'atr_min_pct': 0.02329722277970253, 'atr_max_pct': 0.12313824779109811, 'tp_mult': 2.0640201489857772, 'tsl_mult': 0.6263161639020521, 'strategy': 'breakout', 'time_stop': 43, 'use_sma': True, 'use_atr': False, 'use_adx': False, 'use_ema': False, 'use_spike': True, 'rsi_required': False, 'edge_k': 0.5555486090780775, 'edge_cap': 0.9794721680309739, 'bull_strategy': 'mean_reversion', 'bull_bb_std_mult': 3.496819782963545, 'bull_rsi_os': 13, 'bull_rsi_ob': 75, 'bull_adx_thresh': 11.184842614155906, 'bull_atr_min_pct': 0.02363580183213116, 'bull_atr_max_pct': 0.04422511236266555, 'bull_tp_mult': 1.65215931212615, 'bull_tsl_mult': 0.9054819975933721, 'bull_time_stop': 123, 'bull_use_sma': False, 'bull_use_ema': False, 'bull_use_atr': False, 'bull_use_adx': True, 'bull_use_spike': False, 'bull_rsi_required': True, 'bear_strategy': 'breakout', 'bear_bb_std_mult': 1.6909146483371713, 'bear_rsi_os': 6, 'bear_rsi_ob': 47, 'bear_adx_thresh': 20.45283874633884, 'bear_atr_min_pct': 0.0006822235859126075, 'bear_atr_max_pct': 0.08239725777398771, 'bear_tp_mult': 2.722423812450966, 'bear_tsl_mult': 0.2353585356148653, 'bear_time_stop': 193, 'bear_use_sma': True, 'bear_use_ema': True, 'bear_use_atr': True, 'bear_use_adx': True, 'bear_use_spike': True, 'bear_rsi_required': True, 'sideways_strategy': 'mean_reversion', 'sideways_bb_std_mult': 1.7819514901274025, 'sideways_rsi_os': 28, 'sideways_rsi_ob': 51, 'sideways_adx_thresh': 14.505046469633166, 'sideways_atr_min_pct': 0.014836181584911626, 'sideways_atr_max_pct': 0.11726193746330606, 'sideways_tp_mult': 1.9478990411508397, 'sideways_tsl_mult': 0.6246587574287471, 'sideways_time_stop': 172, 'sideways_use_sma': False, 'sideways_use_ema': False, 'sideways_use_atr': False, 'sideways_use_adx': True, 'sideways_use_spike': True, 'sideways_rsi_required': True}.
[I 2025-08-31 05:05:41,145] Trial 555 finished with values: [-0.019612121403140947, 0.019542860492241215] and parameters: {'p_sma': 48, 'p_std': 15, 'p_atr': 30, 'p_adx': 9, 'rsi_period': 20, 'ema1': 30, 'ema2': 25, 'slip_atr_k': 0.17989904512285354, 'slip_spread_k': 0.10237378279230322, 'spread_hl_frac': 0.007273886530953677, 'bb_std_mult': 1.8948648069488745, 'rsi_os': 26, 'rsi_ob': 60, 'vol_spike': 0.01695705832934405, 'adx_thresh': 12.530682120893426, 'atr_min_pct': 0.0071621763483450795, 'atr_max_pct': 0.03285742994599004, 'tp_mult': 2.5285921607868054, 'tsl_mult': 0.8209981907519718, 'strategy': 'breakout', 'time_stop': 146, 'use_sma': False, 'use_atr': False, 'use_adx': False, 'use_ema': False, 'use_spike': True, 'rsi_required': False, 'edge_k': 1.3828494447807174, 'edge_cap': 0.10821362980281252, 'bull_strategy': 'mean_reversion', 'bull_bb_std_mult': 2.7029863607039575, 'bull_rsi_os': 28, 'bull_rsi_ob': 75, 'bull_adx_thresh': 29.794837416841563, 'bull_atr_min_pct': 0.0004073926035133859, 'bull_atr_max_pct': 0.044159841249206654, 'bull_tp_mult': 1.6266185249938734, 'bull_tsl_mult': 0.9118893105567776, 'bull_time_stop': 126, 'bull_use_sma': False, 'bull_use_ema': False, 'bull_use_atr': True, 'bull_use_adx': True, 'bull_use_spike': False, 'bull_rsi_required': True, 'bear_strategy': 'mean_reversion', 'bear_bb_std_mult': 1.7720157868384887, 'bear_rsi_os': 8, 'bear_rsi_ob': 75, 'bear_adx_thresh': 20.49872456420005, 'bear_atr_min_pct': 0.025518206716716008, 'bear_atr_max_pct': 0.10029958339481213, 'bear_tp_mult': 2.7577708579976257, 'bear_tsl_mult': 0.23328884484793228, 'bear_time_stop': 212, 'bear_use_sma': True, 'bear_use_ema': True, 'bear_use_atr': True, 'bear_use_adx': True, 'bear_use_spike': True, 'bear_rsi_required': False, 'sideways_strategy': 'mean_reversion', 'sideways_bb_std_mult': 2.4362010846040274, 'sideways_rsi_os': 30, 'sideways_rsi_ob': 56, 'sideways_adx_thresh': 24.336696532373903, 'sideways_atr_min_pct': 0.014699892693562788, 'sideways_atr_max_pct': 0.08444564314991815, 'sideways_tp_mult': 2.5223031491655306, 'sideways_tsl_mult': 0.2894041198160829, 'sideways_time_stop': 124, 'sideways_use_sma': False, 'sideways_use_ema': False, 'sideways_use_atr': False, 'sideways_use_adx': True, 'sideways_use_spike': True, 'sideways_rsi_required': True}.
