[I 2025-08-31 04:38:15,645] Trial 414 finished with values: [-1000000000.0, 1000000000.0] and parameters: {'p_sma': 11, 'p_std': 17, 'p_atr': 23, 'p_adx': 9, 'rsi_period': 7, 'ema1': 13, 'ema2': 52, 'slip_atr_k': 0.04115476923443388, 'slip_spread_k': 0.12434805746719416, 'spread_hl_frac': 0.0360205179446908, 'bb_std_mult': 1.2948351490505654, 'rsi_os': 26, 'rsi_ob': 62, 'vol_spike': 0.1867006155796812, 'adx_thresh': 12.925674777875265, 'atr_min_pct': 0.024492043197698522, 'atr_max_pct': 0.11828035314981582, 'tp_mult': 2.565632580286245, 'tsl_mult': 0.23343881346841105, 'strategy': 'breakout', 'time_stop': 233, 'use_sma': False, 'use_atr': False, 'use_adx': False, 'use_ema': True, 'use_spike': False, 'rsi_required': True, 'edge_k': 1.2980211932282595, 'edge_cap': 0.10459711846209813, 'bull_strategy': 'mean_reversion', 'bull_bb_std_mult': 3.4764439911281473, 'bull_rsi_os': 50, 'bull_rsi_ob': 51, 'bull_adx_thresh': 10.214853327288303, 'bull_atr_min_pct': 0.00245234581572386, 'bull_atr_max_pct': 0.048819378254365706, 'bull_tp_mult': 1.5444863587279836, 'bull_tsl_mult': 0.9381245039209117, 'bull_time_stop': 156, 'bull_use_sma': False, 'bull_use_ema': False, 'bull_use_atr': True, 'bull_use_adx': True, 'bull_use_spike': True, 'bull_rsi_required': True, 'bear_strategy': 'breakout', 'bear_bb_std_mult': 1.014844538413307, 'bear_rsi_os': 9, 'bear_rsi_ob': 56, 'bear_adx_thresh': 11.485772879278224, 'bear_atr_min_pct': 0.01667148983533347, 'bear_atr_max_pct': 0.14202727382806832, 'bear_tp_mult': 1.853615141766577, 'bear_tsl_mult': 0.8458553354781544, 'bear_time_stop': 130, 'bear_use_sma': True, 'bear_use_ema': True, 'bear_use_atr': True, 'bear_use_adx': True, 'bear_use_spike': True, 'bear_rsi_required': True, 'sideways_strategy': 'mean_reversion', 'sideways_bb_std_mult': 1.2263044768006348, 'sideways_rsi_os': 29, 'sideways_rsi_ob': 53, 'sideways_adx_thresh': 11.93812134392466, 'sideways_atr_min_pct': 0.012166439856562053, 'sideways_atr_max_pct': 0.0795243620523451, 'sideways_tp_mult': 2.073729609982246, 'sideways_tsl_mult': 0.9302799007986855, 'sideways_time_stop': 61, 'sideways_use_sma': False, 'sideways_use_ema': False, 'sideways_use_atr': False, 'sideways_use_adx': True, 'sideways_use_spike': True, 'sideways_rsi_required': True}.
[I 2025-08-31 04:39:03,685] Trial 415 finished with values: [-1000000000.0, 1000000000.0] and parameters: {'p_sma': 52, 'p_std': 10, 'p_atr': 14, 'p_adx': 9, 'rsi_period': 56, 'ema1': 22, 'ema2': 52, 'slip_atr_k': 0.0051536990784947796, 'slip_spread_k': 0.09157099949781213, 'spread_hl_frac': 0.045313924223485624, 'bb_std_mult': 1.1278039573560106, 'rsi_os': 25, 'rsi_ob': 55, 'vol_spike': 0.01770337582886221, 'adx_thresh': 10.210885373715893, 'atr_min_pct': 0.01084984195549945, 'atr_max_pct': 0.11896562367360625, 'tp_mult': 2.57086005714701, 'tsl_mult': 0.9023624774344183, 'strategy': 'breakout', 'time_stop': 40, 'use_sma': False, 'use_atr': False, 'use_adx': False, 'use_ema': True, 'use_spike': False, 'rsi_required': True, 'edge_k': 1.5206331633873276, 'edge_cap': 0.18354802533571712, 'bull_strategy': 'mean_reversion', 'bull_bb_std_mult': 3.5915970995567577, 'bull_rsi_os': 14, 'bull_rsi_ob': 61, 'bull_adx_thresh': 30.96089006939515, 'bull_atr_min_pct': 0.0022876437449897606, 'bull_atr_max_pct': 0.04848397395502024, 'bull_tp_mult': 1.4054403318613564, 'bull_tsl_mult': 0.9336140900719216, 'bull_time_stop': 128, 'bull_use_sma': False, 'bull_use_ema': False, 'bull_use_atr': True, 'bull_use_adx': True, 'bull_use_spike': True, 'bull_rsi_required': True, 'bear_strategy': 'breakout', 'bear_bb_std_mult': 1.0199762701308437, 'bear_rsi_os': 10, 'bear_rsi_ob': 48, 'bear_adx_thresh': 29.78583138995702, 'bear_atr_min_pct': 0.001424475764584699, 'bear_atr_max_pct': 0.04033942906635055, 'bear_tp_mult': 1.8536583476446988, 'bear_tsl_mult': 0.8407403483011393, 'bear_time_stop': 291, 'bear_use_sma': True, 'bear_use_ema': True, 'bear_use_atr': True, 'bear_use_adx': True, 'bear_use_spike': True, 'bear_rsi_required': True, 'sideways_strategy': 'mean_reversion', 'sideways_bb_std_mult': 2.7750098195943504, 'sideways_rsi_os': 29, 'sideways_rsi_ob': 70, 'sideways_adx_thresh': 22.951071496874903, 'sideways_atr_min_pct': 0.013340435239918576, 'sideways_atr_max_pct': 0.11210718266479501, 'sideways_tp_mult': 1.9390174638982962, 'sideways_tsl_mult': 0.6003424530300864, 'sideways_time_stop': 107, 'sideways_use_sma': True, 'sideways_use_ema': False, 'sideways_use_atr': False, 'sideways_use_adx': True, 'sideways_use_spike': True, 'sideways_rsi_required': True}.
[I 2025-08-31 04:39:04,678] Trial 416 finished with values: [-1000000000.0, 1000000000.0] and parameters: {'p_sma': 52, 'p_std': 56, 'p_atr': 23, 'p_adx': 13, 'rsi_period': 8, 'ema1': 13, 'ema2': 26, 'slip_atr_k': 0.005911349270246148, 'slip_spread_k': 0.41310761585219125, 'spread_hl_frac': 0.01097954389877, 'bb_std_mult': 1.6135180156675577, 'rsi_os': 25, 'rsi_ob': 62, 'vol_spike': 0.1251871096100981, 'adx_thresh': 11.610576793883185, 'atr_min_pct': 0.010753832213009889, 'atr_max_pct': 0.11802208521527792, 'tp_mult': 2.9965517530651606, 'tsl_mult': 0.23503243896187603, 'strategy': 'breakout', 'time_stop': 42, 'use_sma': False, 'use_atr': False, 'use_adx': False, 'use_ema': True, 'use_spike': False, 'rsi_required': True, 'edge_k': 0.713763743925219, 'edge_cap': 0.2052054796430322, 'bull_strategy': 'mean_reversion', 'bull_bb_std_mult': 0.5131388784200723, 'bull_rsi_os': 50, 'bull_rsi_ob': 46, 'bull_adx_thresh': 10.463043025479822, 'bull_atr_min_pct': 0.013628136207033667, 'bull_atr_max_pct': 0.1098652368966973, 'bull_tp_mult': 1.4872186379984709, 'bull_tsl_mult': 0.5673264028776842, 'bull_time_stop': 69, 'bull_use_sma': False, 'bull_use_ema': False, 'bull_use_atr': True, 'bull_use_adx': True, 'bull_use_spike': True, 'bull_rsi_required': True, 'bear_strategy': 'breakout', 'bear_bb_std_mult': 1.0022109911849966, 'bear_rsi_os': 48, 'bear_rsi_ob': 69, 'bear_adx_thresh': 26.94689901971539, 'bear_atr_min_pct': 0.023993520608623826, 'bear_atr_max_pct': 0.07744855027918411, 'bear_tp_mult': 2.8389768646286058, 'bear_tsl_mult': 0.26414181896447037, 'bear_time_stop': 107, 'bear_use_sma': True, 'bear_use_ema': True, 'bear_use_atr': True, 'bear_use_adx': True, 'bear_use_spike': True, 'bear_rsi_required': True, 'sideways_strategy': 'mean_reversion', 'sideways_bb_std_mult': 2.1512141338549884, 'sideways_rsi_os': 5, 'sideways_rsi_ob': 53, 'sideways_adx_thresh': 11.880907391496773, 'sideways_atr_min_pct': 0.007332845610436458, 'sideways_atr_max_pct': 0.10867341115786401, 'sideways_tp_mult': 1.4920970216523797, 'sideways_tsl_mult': 0.6589049673644531, 'sideways_time_stop': 119, 'sideways_use_sma': False, 'sideways_use_ema': False, 'sideways_use_atr': False, 'sideways_use_adx': True, 'sideways_use_spike': True, 'sideways_rsi_required': True}.
[I 2025-08-31 04:39:05,199] Trial 417 finished with values: [-1000000000.0, 1000000000.0] and parameters: {'p_sma': 21, 'p_std': 15, 'p_atr': 19, 'p_adx': 9, 'rsi_period': 21, 'ema1': 8, 'ema2': 26, 'slip_atr_k': 0.003703675519902961, 'slip_spread_k': 0.7982648664008314, 'spread_hl_frac': 0.012941476803535789, 'bb_std_mult': 1.7880438045147102, 'rsi_os': 5, 'rsi_ob': 49, 'vol_spike': 0.017388861510432632, 'adx_thresh': 11.456395331892429, 'atr_min_pct': 0.015387860111281276, 'atr_max_pct': 0.11841733557808859, 'tp_mult': 2.9070065571676666, 'tsl_mult': 0.5663586697846803, 'strategy': 'breakout', 'time_stop': 44, 'use_sma': False, 'use_atr': False, 'use_adx': False, 'use_ema': False, 'use_spike': True, 'rsi_required': True, 'edge_k': 1.5730518372126878, 'edge_cap': 0.626898278810927, 'bull_strategy': 'mean_reversion', 'bull_bb_std_mult': 3.595984934566893, 'bull_rsi_os': 14, 'bull_rsi_ob': 79, 'bull_adx_thresh': 6.603645949691826, 'bull_atr_min_pct': 0.007561373775438738, 'bull_atr_max_pct': 0.10737689922585703, 'bull_tp_mult': 2.466975620438152, 'bull_tsl_mult': 0.8772996939297748, 'bull_time_stop': 143, 'bull_use_sma': False, 'bull_use_ema': False, 'bull_use_atr': True, 'bull_use_adx': True, 'bull_use_spike': False, 'bull_rsi_required': True, 'bear_strategy': 'mean_reversion', 'bear_bb_std_mult': 1.810409413703186, 'bear_rsi_os': 26, 'bear_rsi_ob': 48, 'bear_adx_thresh': 21.689357243267494, 'bear_atr_min_pct': 0.02463723262381612, 'bear_atr_max_pct': 0.09095540264189662, 'bear_tp_mult': 2.8246816713889094, 'bear_tsl_mult': 0.8693935500609541, 'bear_time_stop': 198, 'bear_use_sma': True, 'bear_use_ema': True, 'bear_use_atr': True, 'bear_use_adx': True, 'bear_use_spike': True, 'bear_rsi_required': True, 'sideways_strategy': 'mean_reversion', 'sideways_bb_std_mult': 2.1584283171386907, 'sideways_rsi_os': 27, 'sideways_rsi_ob': 68, 'sideways_adx_thresh': 9.823270427044326, 'sideways_atr_min_pct': 0.004550561028134028, 'sideways_atr_max_pct': 0.1118973708805164, 'sideways_tp_mult': 1.938555928659772, 'sideways_tsl_mult': 0.6026636222894274, 'sideways_time_stop': 89, 'sideways_use_sma': True, 'sideways_use_ema': False, 'sideways_use_atr': False, 'sideways_use_adx': True, 'sideways_use_spike': True, 'sideways_rsi_required': True}.
[I 2025-08-31 04:39:05,800] Trial 418 finished with values: [-1000000000.0, 1000000000.0] and parameters: {'p_sma': 21, 'p_std': 9, 'p_atr': 19, 'p_adx': 18, 'rsi_period': 60, 'ema1': 26, 'ema2': 26, 'slip_atr_k': 0.004717013466565445, 'slip_spread_k': 0.32864728022713424, 'spread_hl_frac': 0.01208164209616551, 'bb_std_mult': 1.7918330434313479, 'rsi_os': 32, 'rsi_ob': 80, 'vol_spike': 0.23331914154923414, 'adx_thresh': 11.555974550375886, 'atr_min_pct': 0.022514480462803937, 'atr_max_pct': 0.11933241792527309, 'tp_mult': 1.973114385924965, 'tsl_mult': 0.8754231883184372, 'strategy': 'breakout', 'time_stop': 44, 'use_sma': False, 'use_atr': False, 'use_adx': False, 'use_ema': False, 'use_spike': True, 'rsi_required': True, 'edge_k': 1.0333587675412284, 'edge_cap': 0.9555408871720319, 'bull_strategy': 'mean_reversion', 'bull_bb_std_mult': 3.5541047848673926, 'bull_rsi_os': 15, 'bull_rsi_ob': 61, 'bull_adx_thresh': 10.566924648989236, 'bull_atr_min_pct': 0.0020510742630988122, 'bull_atr_max_pct': 0.046849695833303694, 'bull_tp_mult': 2.4667105761609682, 'bull_tsl_mult': 0.689590846745513, 'bull_time_stop': 142, 'bull_use_sma': False, 'bull_use_ema': False, 'bull_use_atr': True, 'bull_use_adx': True, 'bull_use_spike': False, 'bull_rsi_required': True, 'bear_strategy': 'mean_reversion', 'bear_bb_std_mult': 1.8355108440539194, 'bear_rsi_os': 7, 'bear_rsi_ob': 48, 'bear_adx_thresh': 27.03201492849254, 'bear_atr_min_pct': 0.021830383815579807, 'bear_atr_max_pct': 0.053865826691853795, 'bear_tp_mult': 2.823133038002366, 'bear_tsl_mult': 0.35424296312252823, 'bear_time_stop': 197, 'bear_use_sma': True, 'bear_use_ema': True, 'bear_use_atr': True, 'bear_use_adx': True, 'bear_use_spike': True, 'bear_rsi_required': True, 'sideways_strategy': 'mean_reversion', 'sideways_bb_std_mult': 0.8800359285998298, 'sideways_rsi_os': 27, 'sideways_rsi_ob': 70, 'sideways_adx_thresh': 18.17924766920405, 'sideways_atr_min_pct': 0.01324864657395764, 'sideways_atr_max_pct': 0.11219881931235628, 'sideways_tp_mult': 1.9089588770496964, 'sideways_tsl_mult': 0.6062351831496556, 'sideways_time_stop': 105, 'sideways_use_sma': True, 'sideways_use_ema': False, 'sideways_use_atr': False, 'sideways_use_adx': True, 'sideways_use_spike': True, 'sideways_rsi_required': True}.
[I 2025-08-31 04:39:56,006] Trial 419 finished with values: [-1000000000.0, 1000000000.0] and parameters: {'p_sma': 56, 'p_std': 15, 'p_atr': 25, 'p_adx': 20, 'rsi_period': 31, 'ema1': 8, 'ema2': 26, 'slip_atr_k': 0.021297176182011296, 'slip_spread_k': 0.4167586633794057, 'spread_hl_frac': 0.01324390689982279, 'bb_std_mult': 0.5676620336061142, 'rsi_os': 32, 'rsi_ob': 49, 'vol_spike': 0.008360893981261197, 'adx_thresh': 11.64990260794903, 'atr_min_pct': 0.022430868252124127, 'atr_max_pct': 0.12092423599238147, 'tp_mult': 2.407291501637519, 'tsl_mult': 0.8731748065786036, 'strategy': 'breakout', 'time_stop': 45, 'use_sma': False, 'use_atr': False, 'use_adx': False, 'use_ema': False, 'use_spike': True, 'rsi_required': False, 'edge_k': 1.5843463007299112, 'edge_cap': 0.9168556605080149, 'bull_strategy': 'mean_reversion', 'bull_bb_std_mult': 3.3703187022167787, 'bull_rsi_os': 15, 'bull_rsi_ob': 79, 'bull_adx_thresh': 23.837858997620923, 'bull_atr_min_pct': 0.013472096531902988, 'bull_atr_max_pct': 0.10810553238691759, 'bull_tp_mult': 2.8284969716386157, 'bull_tsl_mult': 0.6205917258420557, 'bull_time_stop': 69, 'bull_use_sma': False, 'bull_use_ema': False, 'bull_use_atr': True, 'bull_use_adx': True, 'bull_use_spike': False, 'bull_rsi_required': True, 'bear_strategy': 'mean_reversion', 'bear_bb_std_mult': 1.8393328877904491, 'bear_rsi_os': 7, 'bear_rsi_ob': 52, 'bear_adx_thresh': 27.114762374418262, 'bear_atr_min_pct': 0.024674990239751688, 'bear_atr_max_pct': 0.054079839773540535, 'bear_tp_mult': 2.84280144123429, 'bear_tsl_mult': 0.19783784325182763, 'bear_time_stop': 202, 'bear_use_sma': True, 'bear_use_ema': True, 'bear_use_atr': True, 'bear_use_adx': True, 'bear_use_spike': True, 'bear_rsi_required': True, 'sideways_strategy': 'mean_reversion', 'sideways_bb_std_mult': 0.8793405369109151, 'sideways_rsi_os': 27, 'sideways_rsi_ob': 53, 'sideways_adx_thresh': 11.032192118456386, 'sideways_atr_min_pct': 0.008303660466474315, 'sideways_atr_max_pct': 0.1102138345481217, 'sideways_tp_mult': 1.4900551125696069, 'sideways_tsl_mult': 0.7081128474834397, 'sideways_time_stop': 56, 'sideways_use_sma': False, 'sideways_use_ema': False, 'sideways_use_atr': False, 'sideways_use_adx': True, 'sideways_use_spike': True, 'sideways_rsi_required': True}.
[I 2025-08-31 04:39:56,678] Trial 420 finished with values: [-1000000000.0, 1000000000.0] and parameters: {'p_sma': 21, 'p_std': 15, 'p_atr': 12, 'p_adx': 10, 'rsi_period': 32, 'ema1': 20, 'ema2': 26, 'slip_atr_k': 0.11215887666476076, 'slip_spread_k': 0.11436993757596844, 'spread_hl_frac': 0.01183788578930735, 'bb_std_mult': 1.7794543492657056, 'rsi_os': 5, 'rsi_ob': 60, 'vol_spike': 0.007064788451733819, 'adx_thresh': 11.528978602602963, 'atr_min_pct': 0.026753270848190996, 'atr_max_pct': 0.12148389685375294, 'tp_mult': 2.5188329840445944, 'tsl_mult': 0.874975285097095, 'strategy': 'breakout', 'time_stop': 47, 'use_sma': False, 'use_atr': True, 'use_adx': True, 'use_ema': False, 'use_spike': True, 'rsi_required': False, 'edge_k': 1.5671758228363517, 'edge_cap': 0.6293833271111232, 'bull_strategy': 'mean_reversion', 'bull_bb_std_mult': 3.362826583583369, 'bull_rsi_os': 16, 'bull_rsi_ob': 79, 'bull_adx_thresh': 23.828653168921104, 'bull_atr_min_pct': 0.011107356945318938, 'bull_atr_max_pct': 0.03623836920731094, 'bull_tp_mult': 2.8166932339835014, 'bull_tsl_mult': 0.8779335914332881, 'bull_time_stop': 142, 'bull_use_sma': True, 'bull_use_ema': False, 'bull_use_atr': False, 'bull_use_adx': False, 'bull_use_spike': False, 'bull_rsi_required': True, 'bear_strategy': 'mean_reversion', 'bear_bb_std_mult': 1.0831645044596925, 'bear_rsi_os': 7, 'bear_rsi_ob': 46, 'bear_adx_thresh': 21.986580943110695, 'bear_atr_min_pct': 0.024745426752433696, 'bear_atr_max_pct': 0.09109261323251233, 'bear_tp_mult': 2.8306792004993575, 'bear_tsl_mult': 0.9996537184213509, 'bear_time_stop': 203, 'bear_use_sma': False, 'bear_use_ema': True, 'bear_use_atr': True, 'bear_use_adx': True, 'bear_use_spike': True, 'bear_rsi_required': True, 'sideways_strategy': 'mean_reversion', 'sideways_bb_std_mult': 2.0218051175180776, 'sideways_rsi_os': 27, 'sideways_rsi_ob': 80, 'sideways_adx_thresh': 13.43959609261767, 'sideways_atr_min_pct': 0.013307787271730953, 'sideways_atr_max_pct': 0.12808242165344336, 'sideways_tp_mult': 1.9936293025207248, 'sideways_tsl_mult': 0.9855487883800119, 'sideways_time_stop': 57, 'sideways_use_sma': True, 'sideways_use_ema': True, 'sideways_use_atr': True, 'sideways_use_adx': False, 'sideways_use_spike': False, 'sideways_rsi_required': False}.
[I 2025-08-31 04:39:56,782] Trial 422 finished with values: [-1000000000.0, 1000000000.0] and parameters: {'p_sma': 56, 'p_std': 17, 'p_atr': 13, 'p_adx': 21, 'rsi_period': 67, 'ema1': 15, 'ema2': 25, 'slip_atr_k': 0.23054876060429913, 'slip_spread_k': 0.1113677951436826, 'spread_hl_frac': 0.011531716124471101, 'bb_std_mult': 1.975462453590767, 'rsi_os': 28, 'rsi_ob': 60, 'vol_spike': 0.010550008485595506, 'adx_thresh': 12.392024112428786, 'atr_min_pct': 0.019999297934626202, 'atr_max_pct': 0.12197961922390718, 'tp_mult': 2.536378801859924, 'tsl_mult': 0.7158785889421547, 'strategy': 'mean_reversion', 'time_stop': 225, 'use_sma': True, 'use_atr': True, 'use_adx': True, 'use_ema': False, 'use_spike': True, 'rsi_required': False, 'edge_k': 1.483848576038097, 'edge_cap': 0.051331478302629296, 'bull_strategy': 'breakout', 'bull_bb_std_mult': 2.3905693089088897, 'bull_rsi_os': 45, 'bull_rsi_ob': 76, 'bull_adx_thresh': 14.667193734117298, 'bull_atr_min_pct': 0.0013003745454412837, 'bull_atr_max_pct': 0.07447405565021445, 'bull_tp_mult': 2.82521512599896, 'bull_tsl_mult': 0.7885074369937797, 'bull_time_stop': 121, 'bull_use_sma': True, 'bull_use_ema': True, 'bull_use_atr': False, 'bull_use_adx': False, 'bull_use_spike': False, 'bull_rsi_required': True, 'bear_strategy': 'mean_reversion', 'bear_bb_std_mult': 0.8891305950294646, 'bear_rsi_os': 8, 'bear_rsi_ob': 52, 'bear_adx_thresh': 30.94884280761323, 'bear_atr_min_pct': 0.023143976259856303, 'bear_atr_max_pct': 0.0353109841589231, 'bear_tp_mult': 2.6322889637180666, 'bear_tsl_mult': 0.3182861927305731, 'bear_time_stop': 205, 'bear_use_sma': False, 'bear_use_ema': False, 'bear_use_atr': False, 'bear_use_adx': False, 'bear_use_spike': False, 'bear_rsi_required': True, 'sideways_strategy': 'breakout', 'sideways_bb_std_mult': 1.0765714520305811, 'sideways_rsi_os': 24, 'sideways_rsi_ob': 54, 'sideways_adx_thresh': 31.587051512851183, 'sideways_atr_min_pct': 0.015156234345008972, 'sideways_atr_max_pct': 0.10072693649745582, 'sideways_tp_mult': 2.0069004873199194, 'sideways_tsl_mult': 0.6450039987113481, 'sideways_time_stop': 57, 'sideways_use_sma': False, 'sideways_use_ema': True, 'sideways_use_atr': True, 'sideways_use_adx': False, 'sideways_use_spike': False, 'sideways_rsi_required': False}.
[I 2025-08-31 04:39:57,141] Trial 421 finished with values: [-1000000000.0, 1000000000.0] and parameters: {'p_sma': 39, 'p_std': 48, 'p_atr': 12, 'p_adx': 10, 'rsi_period': 22, 'ema1': 18, 'ema2': 26, 'slip_atr_k': 0.02248877863417602, 'slip_spread_k': 0.10332909271770259, 'spread_hl_frac': 0.011554301459481456, 'bb_std_mult': 2.695789993969609, 'rsi_os': 28, 'rsi_ob': 59, 'vol_spike': 0.009381262243664323, 'adx_thresh': 10.77654710484721, 'atr_min_pct': 0.014613464104193162, 'atr_max_pct': 0.1281318304255567, 'tp_mult': 2.5223661622861977, 'tsl_mult': 0.8673437866022283, 'strategy': 'breakout', 'time_stop': 49, 'use_sma': True, 'use_atr': True, 'use_adx': True, 'use_ema': False, 'use_spike': True, 'rsi_required': False, 'edge_k': 1.4884856266685234, 'edge_cap': 0.9024093128468452, 'bull_strategy': 'breakout', 'bull_bb_std_mult': 2.3926222743568437, 'bull_rsi_os': 45, 'bull_rsi_ob': 67, 'bull_adx_thresh': 23.873007764486474, 'bull_atr_min_pct': 0.0013105536374461628, 'bull_atr_max_pct': 0.04551066705093053, 'bull_tp_mult': 2.809915676643951, 'bull_tsl_mult': 0.911382428441657, 'bull_time_stop': 123, 'bull_use_sma': True, 'bull_use_ema': False, 'bull_use_atr': False, 'bull_use_adx': False, 'bull_use_spike': False, 'bull_rsi_required': True, 'bear_strategy': 'mean_reversion', 'bear_bb_std_mult': 0.9063083924292366, 'bear_rsi_os': 7, 'bear_rsi_ob': 46, 'bear_adx_thresh': 19.926216846498413, 'bear_atr_min_pct': 0.021647507506744944, 'bear_atr_max_pct': 0.037085782146208175, 'bear_tp_mult': 2.638751261394475, 'bear_tsl_mult': 0.9615217854287551, 'bear_time_stop': 205, 'bear_use_sma': False, 'bear_use_ema': True, 'bear_use_atr': True, 'bear_use_adx': False, 'bear_use_spike': True, 'bear_rsi_required': True, 'sideways_strategy': 'mean_reversion', 'sideways_bb_std_mult': 1.0606061507666429, 'sideways_rsi_os': 28, 'sideways_rsi_ob': 94, 'sideways_adx_thresh': 11.037590839747196, 'sideways_atr_min_pct': 0.008275824350797576, 'sideways_atr_max_pct': 0.06188426653036343, 'sideways_tp_mult': 2.002050817698752, 'sideways_tsl_mult': 0.9774277384069197, 'sideways_time_stop': 54, 'sideways_use_sma': False, 'sideways_use_ema': True, 'sideways_use_atr': True, 'sideways_use_adx': False, 'sideways_use_spike': False, 'sideways_rsi_required': False}.
