[I 2025-08-31 04:36:28,944] Trial 405 finished with values: [-1000000000.0, 1000000000.0] and parameters: {'p_sma': 54, 'p_std': 16, 'p_atr': 24, 'p_adx': 8, 'rsi_period': 23, 'ema1': 23, 'ema2': 40, 'slip_atr_k': 0.162133144587553, 'slip_spread_k': 0.17391164177932883, 'spread_hl_frac': 0.041239148478995985, 'bb_std_mult': 1.714637532227759, 'rsi_os': 28, 'rsi_ob': 76, 'vol_spike': 0.08154258644161187, 'adx_thresh': 12.195268792984873, 'atr_min_pct': 0.012266490615910754, 'atr_max_pct': 0.12082762402029272, 'tp_mult': 2.4780663516341117, 'tsl_mult': 0.8288341792229067, 'strategy': 'mean_reversion', 'time_stop': 143, 'use_sma': True, 'use_atr': True, 'use_adx': True, 'use_ema': False, 'use_spike': True, 'rsi_required': False, 'edge_k': 1.2092050844002942, 'edge_cap': 0.4476350943840066, 'bull_strategy': 'mean_reversion', 'bull_bb_std_mult': 1.1961650486362216, 'bull_rsi_os': 11, 'bull_rsi_ob': 79, 'bull_adx_thresh': 19.11209621907761, 'bull_atr_min_pct': 0.006262261741200115, 'bull_atr_max_pct': 0.13791026876246143, 'bull_tp_mult': 1.6025294301941786, 'bull_tsl_mult': 0.8460095162595135, 'bull_time_stop': 134, 'bull_use_sma': True, 'bull_use_ema': True, 'bull_use_atr': False, 'bull_use_adx': False, 'bull_use_spike': False, 'bull_rsi_required': True, 'bear_strategy': 'mean_reversion', 'bear_bb_std_mult': 0.9202059703509085, 'bear_rsi_os': 5, 'bear_rsi_ob': 93, 'bear_adx_thresh': 18.42163689565324, 'bear_atr_min_pct': 0.012788512789833152, 'bear_atr_max_pct': 0.04579840780930198, 'bear_tp_mult': 2.5280471503642805, 'bear_tsl_mult': 0.7349028868190485, 'bear_time_stop': 251, 'bear_use_sma': False, 'bear_use_ema': False, 'bear_use_atr': True, 'bear_use_adx': False, 'bear_use_spike': False, 'bear_rsi_required': True, 'sideways_strategy': 'breakout', 'sideways_bb_std_mult': 1.028873047997924, 'sideways_rsi_os': 27, 'sideways_rsi_ob': 54, 'sideways_adx_thresh': 8.376512969281618, 'sideways_atr_min_pct': 0.016776422741852343, 'sideways_atr_max_pct': 0.11904922515188748, 'sideways_tp_mult': 2.041708614592233, 'sideways_tsl_mult': 0.658007229254199, 'sideways_time_stop': 68, 'sideways_use_sma': False, 'sideways_use_ema': True, 'sideways_use_atr': True, 'sideways_use_adx': False, 'sideways_use_spike': False, 'sideways_rsi_required': False}.
[I 2025-08-31 04:36:29,935] Trial 406 finished with values: [-1000000000.0, 1000000000.0] and parameters: {'p_sma': 54, 'p_std': 16, 'p_atr': 24, 'p_adx': 17, 'rsi_period': 23, 'ema1': 19, 'ema2': 40, 'slip_atr_k': 0.1621164759605653, 'slip_spread_k': 0.19140136206019148, 'spread_hl_frac': 0.04147277781879103, 'bb_std_mult': 0.9872659051773216, 'rsi_os': 28, 'rsi_ob': 45, 'vol_spike': 0.211067895624547, 'adx_thresh': 12.121465647979122, 'atr_min_pct': 0.012314828214889405, 'atr_max_pct': 0.12581262600358356, 'tp_mult': 2.482417907728907, 'tsl_mult': 0.4425110074464497, 'strategy': 'mean_reversion', 'time_stop': 33, 'use_sma': True, 'use_atr': True, 'use_adx': True, 'use_ema': False, 'use_spike': True, 'rsi_required': False, 'edge_k': 1.4458479757636142, 'edge_cap': 0.9717601351360758, 'bull_strategy': 'mean_reversion', 'bull_bb_std_mult': 3.2344919220112773, 'bull_rsi_os': 11, 'bull_rsi_ob': 75, 'bull_adx_thresh': 19.21839089757099, 'bull_atr_min_pct': 0.0033866709966590535, 'bull_atr_max_pct': 0.13713107680534875, 'bull_tp_mult': 1.5972367863091896, 'bull_tsl_mult': 0.9089453652711341, 'bull_time_stop': 207, 'bull_use_sma': True, 'bull_use_ema': True, 'bull_use_atr': False, 'bull_use_adx': False, 'bull_use_spike': False, 'bull_rsi_required': False, 'bear_strategy': 'mean_reversion', 'bear_bb_std_mult': 1.153094026468819, 'bear_rsi_os': 5, 'bear_rsi_ob': 47, 'bear_adx_thresh': 10.668896700325723, 'bear_atr_min_pct': 0.0037033855730258334, 'bear_atr_max_pct': 0.04596663081222914, 'bear_tp_mult': 2.5425324211406863, 'bear_tsl_mult': 0.593455950997098, 'bear_time_stop': 160, 'bear_use_sma': False, 'bear_use_ema': False, 'bear_use_atr': True, 'bear_use_adx': False, 'bear_use_spike': False, 'bear_rsi_required': False, 'sideways_strategy': 'breakout', 'sideways_bb_std_mult': 0.9873613854552123, 'sideways_rsi_os': 27, 'sideways_rsi_ob': 86, 'sideways_adx_thresh': 8.38370004466385, 'sideways_atr_min_pct': 0.016962211386120935, 'sideways_atr_max_pct': 0.05652962158295483, 'sideways_tp_mult': 2.018408813994051, 'sideways_tsl_mult': 0.8231717958355065, 'sideways_time_stop': 65, 'sideways_use_sma': False, 'sideways_use_ema': True, 'sideways_use_atr': True, 'sideways_use_adx': False, 'sideways_use_spike': False, 'sideways_rsi_required': False}.
[I 2025-08-31 04:37:18,928] Trial 409 finished with values: [-1000000000.0, 1000000000.0] and parameters: {'p_sma': 55, 'p_std': 17, 'p_atr': 24, 'p_adx': 17, 'rsi_period': 26, 'ema1': 14, 'ema2': 21, 'slip_atr_k': 0.052944031693611504, 'slip_spread_k': 0.07269707503857054, 'spread_hl_frac': 0.012062655761482244, 'bb_std_mult': 1.0060457071557338, 'rsi_os': 30, 'rsi_ob': 83, 'vol_spike': 0.09979980970248185, 'adx_thresh': 11.084950893864578, 'atr_min_pct': 0.0009915914003291136, 'atr_max_pct': 0.12601832394424017, 'tp_mult': 1.5573032805546916, 'tsl_mult': 0.043299300548742925, 'strategy': 'breakout', 'time_stop': 165, 'use_sma': False, 'use_atr': False, 'use_adx': False, 'use_ema': False, 'use_spike': True, 'rsi_required': False, 'edge_k': 1.435665899810514, 'edge_cap': 0.9713122036331838, 'bull_strategy': 'breakout', 'bull_bb_std_mult': 1.8610762159574843, 'bull_rsi_os': 20, 'bull_rsi_ob': 77, 'bull_adx_thresh': 13.982663714565044, 'bull_atr_min_pct': 0.003326166470143088, 'bull_atr_max_pct': 0.04367108784460257, 'bull_tp_mult': 1.7079716745385796, 'bull_tsl_mult': 0.909500075542426, 'bull_time_stop': 243, 'bull_use_sma': False, 'bull_use_ema': False, 'bull_use_atr': True, 'bull_use_adx': True, 'bull_use_spike': False, 'bull_rsi_required': False, 'bear_strategy': 'mean_reversion', 'bear_bb_std_mult': 2.7870702007258785, 'bear_rsi_os': 29, 'bear_rsi_ob': 62, 'bear_adx_thresh': 28.52439898212208, 'bear_atr_min_pct': 0.019866401735518336, 'bear_atr_max_pct': 0.03030086446591746, 'bear_tp_mult': 2.602931555587266, 'bear_tsl_mult': 0.5891493063582367, 'bear_time_stop': 164, 'bear_use_sma': True, 'bear_use_ema': True, 'bear_use_atr': False, 'bear_use_adx': True, 'bear_use_spike': True, 'bear_rsi_required': False, 'sideways_strategy': 'mean_reversion', 'sideways_bb_std_mult': 0.9687752073091846, 'sideways_rsi_os': 26, 'sideways_rsi_ob': 55, 'sideways_adx_thresh': 25.201366255846413, 'sideways_atr_min_pct': 0.013987698406128828, 'sideways_atr_max_pct': 0.11568356331443977, 'sideways_tp_mult': 1.6105652361725524, 'sideways_tsl_mult': 0.5732860384015247, 'sideways_time_stop': 191, 'sideways_use_sma': False, 'sideways_use_ema': False, 'sideways_use_atr': False, 'sideways_use_adx': True, 'sideways_use_spike': True, 'sideways_rsi_required': True}.
[I 2025-08-31 04:37:20,135] Trial 410 finished with values: [-1000000000.0, 1000000000.0] and parameters: {'p_sma': 14, 'p_std': 19, 'p_atr': 24, 'p_adx': 9, 'rsi_period': 26, 'ema1': 14, 'ema2': 21, 'slip_atr_k': 0.024193736447102883, 'slip_spread_k': 0.07546342741588541, 'spread_hl_frac': 0.009117948626231448, 'bb_std_mult': 1.9889775004767403, 'rsi_os': 30, 'rsi_ob': 60, 'vol_spike': 0.034327378992887486, 'adx_thresh': 11.143834369006626, 'atr_min_pct': 0.029834061535845488, 'atr_max_pct': 0.12637088798005752, 'tp_mult': 2.208847977663692, 'tsl_mult': 0.13825160977293233, 'strategy': 'breakout', 'time_stop': 22, 'use_sma': False, 'use_atr': False, 'use_adx': False, 'use_ema': True, 'use_spike': False, 'rsi_required': False, 'edge_k': 1.5182209751554354, 'edge_cap': 0.9998366554706656, 'bull_strategy': 'breakout', 'bull_bb_std_mult': 2.950344798817582, 'bull_rsi_os': 15, 'bull_rsi_ob': 77, 'bull_adx_thresh': 15.621855389305631, 'bull_atr_min_pct': 0.0014836426633064246, 'bull_atr_max_pct': 0.027427770866694748, 'bull_tp_mult': 2.1035248690361805, 'bull_tsl_mult': 0.8896220556176658, 'bull_time_stop': 115, 'bull_use_sma': False, 'bull_use_ema': False, 'bull_use_atr': True, 'bull_use_adx': True, 'bull_use_spike': True, 'bull_rsi_required': True, 'bear_strategy': 'mean_reversion', 'bear_bb_std_mult': 1.918305966276653, 'bear_rsi_os': 22, 'bear_rsi_ob': 50, 'bear_adx_thresh': 19.753020145651682, 'bear_atr_min_pct': 0.028551571234641165, 'bear_atr_max_pct': 0.03240951927770641, 'bear_tp_mult': 1.5027431414238586, 'bear_tsl_mult': 0.25644859074839843, 'bear_time_stop': 97, 'bear_use_sma': True, 'bear_use_ema': True, 'bear_use_atr': False, 'bear_use_adx': True, 'bear_use_spike': True, 'bear_rsi_required': False, 'sideways_strategy': 'mean_reversion', 'sideways_bb_std_mult': 1.1112739810904348, 'sideways_rsi_os': 26, 'sideways_rsi_ob': 55, 'sideways_adx_thresh': 10.882063076682176, 'sideways_atr_min_pct': 0.014175487984988761, 'sideways_atr_max_pct': 0.11471782280845144, 'sideways_tp_mult': 1.592884928078958, 'sideways_tsl_mult': 0.1445974389021133, 'sideways_time_stop': 46, 'sideways_use_sma': False, 'sideways_use_ema': False, 'sideways_use_atr': False, 'sideways_use_adx': True, 'sideways_use_spike': True, 'sideways_rsi_required': True}.
[I 2025-08-31 04:37:20,658] Trial 407 finished with values: [-1000000000.0, 1000000000.0] and parameters: {'p_sma': 54, 'p_std': 16, 'p_atr': 24, 'p_adx': 14, 'rsi_period': 26, 'ema1': 14, 'ema2': 24, 'slip_atr_k': 0.16430973706085178, 'slip_spread_k': 0.17288680682321117, 'spread_hl_frac': 0.00912124764757877, 'bb_std_mult': 1.7143618390579172, 'rsi_os': 17, 'rsi_ob': 60, 'vol_spike': 0.03446164137770351, 'adx_thresh': 9.284046920276227, 'atr_min_pct': 0.019286060213613922, 'atr_max_pct': 0.12433074002051578, 'tp_mult': 2.481901220703849, 'tsl_mult': 0.8319282820289129, 'strategy': 'mean_reversion', 'time_stop': 56, 'use_sma': True, 'use_atr': True, 'use_adx': True, 'use_ema': False, 'use_spike': True, 'rsi_required': False, 'edge_k': 1.4471962064634556, 'edge_cap': 0.9718949181711577, 'bull_strategy': 'mean_reversion', 'bull_bb_std_mult': 3.2298924405328977, 'bull_rsi_os': 12, 'bull_rsi_ob': 53, 'bull_adx_thresh': 24.7832729998459, 'bull_atr_min_pct': 0.0033608494881336784, 'bull_atr_max_pct': 0.08426994829314569, 'bull_tp_mult': 1.3356183728568294, 'bull_tsl_mult': 0.4273939415497088, 'bull_time_stop': 244, 'bull_use_sma': True, 'bull_use_ema': False, 'bull_use_atr': False, 'bull_use_adx': False, 'bull_use_spike': False, 'bull_rsi_required': False, 'bear_strategy': 'mean_reversion', 'bear_bb_std_mult': 0.9231380368160048, 'bear_rsi_os': 53, 'bear_rsi_ob': 67, 'bear_adx_thresh': 27.462277586718393, 'bear_atr_min_pct': 0.018774753504712943, 'bear_atr_max_pct': 0.0449663309176276, 'bear_tp_mult': 1.9534687290721788, 'bear_tsl_mult': 0.5913327594891878, 'bear_time_stop': 161, 'bear_use_sma': False, 'bear_use_ema': True, 'bear_use_atr': False, 'bear_use_adx': True, 'bear_use_spike': True, 'bear_rsi_required': False, 'sideways_strategy': 'breakout', 'sideways_bb_std_mult': 1.007278066823274, 'sideways_rsi_os': 26, 'sideways_rsi_ob': 54, 'sideways_adx_thresh': 8.728122816042303, 'sideways_atr_min_pct': 0.015632445557433806, 'sideways_atr_max_pct': 0.11466109104209575, 'sideways_tp_mult': 1.8695371427435041, 'sideways_tsl_mult': 0.5773928400975588, 'sideways_time_stop': 72, 'sideways_use_sma': False, 'sideways_use_ema': True, 'sideways_use_atr': True, 'sideways_use_adx': False, 'sideways_use_spike': False, 'sideways_rsi_required': False}.
[I 2025-08-31 04:37:20,915] Trial 408 finished with values: [-1000000000.0, 1000000000.0] and parameters: {'p_sma': 55, 'p_std': 5, 'p_atr': 24, 'p_adx': 14, 'rsi_period': 25, 'ema1': 14, 'ema2': 24, 'slip_atr_k': 0.07412817036636332, 'slip_spread_k': 0.9202805414442525, 'spread_hl_frac': 0.009422566808514702, 'bb_std_mult': 2.143407531324545, 'rsi_os': 30, 'rsi_ob': 68, 'vol_spike': 0.15032898728977012, 'adx_thresh': 11.19700392800585, 'atr_min_pct': 0.029831429890971713, 'atr_max_pct': 0.1260832187443112, 'tp_mult': 2.321851567072409, 'tsl_mult': 0.790619393725026, 'strategy': 'breakout', 'time_stop': 56, 'use_sma': False, 'use_atr': False, 'use_adx': False, 'use_ema': False, 'use_spike': True, 'rsi_required': False, 'edge_k': 1.437886048550845, 'edge_cap': 0.9803655034271427, 'bull_strategy': 'breakout', 'bull_bb_std_mult': 3.1037152703401327, 'bull_rsi_os': 12, 'bull_rsi_ob': 75, 'bull_adx_thresh': 8.78848878364024, 'bull_atr_min_pct': 0.003361742769666075, 'bull_atr_max_pct': 0.042943001787211325, 'bull_tp_mult': 2.227039421896093, 'bull_tsl_mult': 0.8943281856461016, 'bull_time_stop': 205, 'bull_use_sma': False, 'bull_use_ema': False, 'bull_use_atr': True, 'bull_use_adx': True, 'bull_use_spike': False, 'bull_rsi_required': False, 'bear_strategy': 'mean_reversion', 'bear_bb_std_mult': 2.7927437261473385, 'bear_rsi_os': 52, 'bear_rsi_ob': 62, 'bear_adx_thresh': 21.003549277651068, 'bear_atr_min_pct': 0.01894771819451049, 'bear_atr_max_pct': 0.044996919758255864, 'bear_tp_mult': 2.6011606767590294, 'bear_tsl_mult': 0.913210384074483, 'bear_time_stop': 78, 'bear_use_sma': True, 'bear_use_ema': True, 'bear_use_atr': False, 'bear_use_adx': True, 'bear_use_spike': True, 'bear_rsi_required': False, 'sideways_strategy': 'mean_reversion', 'sideways_bb_std_mult': 1.6783339178954768, 'sideways_rsi_os': 26, 'sideways_rsi_ob': 86, 'sideways_adx_thresh': 14.003832778722003, 'sideways_atr_min_pct': 0.013995639464841583, 'sideways_atr_max_pct': 0.03405956699276049, 'sideways_tp_mult': 1.8578186869238138, 'sideways_tsl_mult': 0.06706718098654452, 'sideways_time_stop': 79, 'sideways_use_sma': False, 'sideways_use_ema': False, 'sideways_use_atr': False, 'sideways_use_adx': True, 'sideways_use_spike': True, 'sideways_rsi_required': True}.
[I 2025-08-31 04:38:15,010] Trial 412 finished with values: [-1000000000.0, 1000000000.0] and parameters: {'p_sma': 10, 'p_std': 21, 'p_atr': 24, 'p_adx': 7, 'rsi_period': 70, 'ema1': 7, 'ema2': 24, 'slip_atr_k': 0.03966473364101865, 'slip_spread_k': 0.13192920353253465, 'spread_hl_frac': 0.00992660067901313, 'bb_std_mult': 2.137564966660046, 'rsi_os': 20, 'rsi_ob': 88, 'vol_spike': 0.14925834411955577, 'adx_thresh': 9.500631889595764, 'atr_min_pct': 0.009193405815490736, 'atr_max_pct': 0.12324343986409281, 'tp_mult': 2.4003867467192435, 'tsl_mult': 0.5188237055489553, 'strategy': 'breakout', 'time_stop': 56, 'use_sma': False, 'use_atr': False, 'use_adx': False, 'use_ema': False, 'use_spike': True, 'rsi_required': False, 'edge_k': 0.6064972386812639, 'edge_cap': 0.9822641928076785, 'bull_strategy': 'mean_reversion', 'bull_bb_std_mult': 3.4886262852556325, 'bull_rsi_os': 18, 'bull_rsi_ob': 51, 'bull_adx_thresh': 8.888599249743182, 'bull_atr_min_pct': 0.015353211896550131, 'bull_atr_max_pct': 0.0978221924305946, 'bull_tp_mult': 2.2267016236723065, 'bull_tsl_mult': 0.8887400004995925, 'bull_time_stop': 29, 'bull_use_sma': False, 'bull_use_ema': False, 'bull_use_atr': True, 'bull_use_adx': True, 'bull_use_spike': False, 'bull_rsi_required': True, 'bear_strategy': 'mean_reversion', 'bear_bb_std_mult': 0.820089624424017, 'bear_rsi_os': 9, 'bear_rsi_ob': 67, 'bear_adx_thresh': 20.83872159885532, 'bear_atr_min_pct': 0.017408689655654036, 'bear_atr_max_pct': 0.1431461052036006, 'bear_tp_mult': 2.0665778636980563, 'bear_tsl_mult': 0.2348467927406556, 'bear_time_stop': 13, 'bear_use_sma': True, 'bear_use_ema': True, 'bear_use_atr': True, 'bear_use_adx': True, 'bear_use_spike': True, 'bear_rsi_required': True, 'sideways_strategy': 'mean_reversion', 'sideways_bb_std_mult': 1.2294578030661363, 'sideways_rsi_os': 25, 'sideways_rsi_ob': 77, 'sideways_adx_thresh': 22.068741850848475, 'sideways_atr_min_pct': 0.014422692408991881, 'sideways_atr_max_pct': 0.14639011223258203, 'sideways_tp_mult': 1.8662424557949657, 'sideways_tsl_mult': 0.42217081324165034, 'sideways_time_stop': 231, 'sideways_use_sma': False, 'sideways_use_ema': False, 'sideways_use_atr': False, 'sideways_use_adx': True, 'sideways_use_spike': True, 'sideways_rsi_required': True}.
[I 2025-08-31 04:38:15,302] Trial 411 finished with values: [-0.01284861390427705, 0.012803879131677435] and parameters: {'p_sma': 37, 'p_std': 21, 'p_atr': 24, 'p_adx': 13, 'rsi_period': 55, 'ema1': 20, 'ema2': 24, 'slip_atr_k': 0.02537725853416146, 'slip_spread_k': 0.7969566963399692, 'spread_hl_frac': 0.00920003382472721, 'bb_std_mult': 2.633499075672274, 'rsi_os': 20, 'rsi_ob': 60, 'vol_spike': 0.299436057752436, 'adx_thresh': 10.262334885246089, 'atr_min_pct': 0.022367619197950994, 'atr_max_pct': 0.12403148604766866, 'tp_mult': 2.204887709754056, 'tsl_mult': 0.5204964239797564, 'strategy': 'breakout', 'time_stop': 56, 'use_sma': False, 'use_atr': False, 'use_adx': False, 'use_ema': True, 'use_spike': False, 'rsi_required': False, 'edge_k': 1.5097875082080694, 'edge_cap': 0.3284459369037609, 'bull_strategy': 'mean_reversion', 'bull_bb_std_mult': 3.4850144043240334, 'bull_rsi_os': 38, 'bull_rsi_ob': 75, 'bull_adx_thresh': 8.36562689555613, 'bull_atr_min_pct': 0.0014146392737332122, 'bull_atr_max_pct': 0.10164195108607194, 'bull_tp_mult': 1.5426890109851075, 'bull_tsl_mult': 0.8872305358534818, 'bull_time_stop': 117, 'bull_use_sma': False, 'bull_use_ema': False, 'bull_use_atr': True, 'bull_use_adx': True, 'bull_use_spike': True, 'bull_rsi_required': True, 'bear_strategy': 'mean_reversion', 'bear_bb_std_mult': 0.8164112788958166, 'bear_rsi_os': 52, 'bear_rsi_ob': 50, 'bear_adx_thresh': 26.82712026992848, 'bear_atr_min_pct': 0.024750172488564152, 'bear_atr_max_pct': 0.042501293388562685, 'bear_tp_mult': 2.8527177649164686, 'bear_tsl_mult': 0.2622557499548321, 'bear_time_stop': 15, 'bear_use_sma': True, 'bear_use_ema': True, 'bear_use_atr': False, 'bear_use_adx': True, 'bear_use_spike': True, 'bear_rsi_required': True, 'sideways_strategy': 'mean_reversion', 'sideways_bb_std_mult': 1.2488350741667225, 'sideways_rsi_os': 26, 'sideways_rsi_ob': 53, 'sideways_adx_thresh': 27.921415549477985, 'sideways_atr_min_pct': 0.0073281704510749085, 'sideways_atr_max_pct': 0.13530654979544163, 'sideways_tp_mult': 1.9358956483875345, 'sideways_tsl_mult': 0.6044064843787806, 'sideways_time_stop': 218, 'sideways_use_sma': False, 'sideways_use_ema': False, 'sideways_use_atr': False, 'sideways_use_adx': True, 'sideways_use_spike': True, 'sideways_rsi_required': True}.
[I 2025-08-31 04:38:15,645] Trial 413 finished with values: [-1000000000.0, 1000000000.0] and parameters: {'p_sma': 53, 'p_std': 33, 'p_atr': 23, 'p_adx': 13, 'rsi_period': 70, 'ema1': 7, 'ema2': 51, 'slip_atr_k': 0.07528619526270836, 'slip_spread_k': 0.9223584712388608, 'spread_hl_frac': 0.010459488016165473, 'bb_std_mult': 1.127681371506827, 'rsi_os': 25, 'rsi_ob': 62, 'vol_spike': 0.15006028045343628, 'adx_thresh': 13.122176157741661, 'atr_min_pct': 0.0090299432284728, 'atr_max_pct': 0.12375397040450606, 'tp_mult': 2.565138898785579, 'tsl_mult': 0.9025577707685618, 'strategy': 'breakout', 'time_stop': 40, 'use_sma': False, 'use_atr': False, 'use_adx': False, 'use_ema': False, 'use_spike': True, 'rsi_required': False, 'edge_k': 1.9472723869242605, 'edge_cap': 0.32689460836357326, 'bull_strategy': 'mean_reversion', 'bull_bb_std_mult': 3.456309444259474, 'bull_rsi_os': 38, 'bull_rsi_ob': 51, 'bull_adx_thresh': 8.719947282453155, 'bull_atr_min_pct': 0.016955710873937175, 'bull_atr_max_pct': 0.10131033409383693, 'bull_tp_mult': 2.2403881575559037, 'bull_tsl_mult': 0.92830799498068, 'bull_time_stop': 156, 'bull_use_sma': False, 'bull_use_ema': False, 'bull_use_atr': True, 'bull_use_adx': True, 'bull_use_spike': False, 'bull_rsi_required': True, 'bear_strategy': 'breakout', 'bear_bb_std_mult': 0.8132796546951161, 'bear_rsi_os': 14, 'bear_rsi_ob': 64, 'bear_adx_thresh': 29.571378907502684, 'bear_atr_min_pct': 0.017601286700805123, 'bear_atr_max_pct': 0.04132390138743167, 'bear_tp_mult': 1.8388486031732953, 'bear_tsl_mult': 0.841343740514133, 'bear_time_stop': 81, 'bear_use_sma': True, 'bear_use_ema': True, 'bear_use_atr': True, 'bear_use_adx': True, 'bear_use_spike': True, 'bear_rsi_required': True, 'sideways_strategy': 'mean_reversion', 'sideways_bb_std_mult': 1.70311414723186, 'sideways_rsi_os': 29, 'sideways_rsi_ob': 66, 'sideways_adx_thresh': 11.778510319733012, 'sideways_atr_min_pct': 0.007551923521898067, 'sideways_atr_max_pct': 0.07359037372536928, 'sideways_tp_mult': 2.9973004767187614, 'sideways_tsl_mult': 0.6526664283718439, 'sideways_time_stop': 76, 'sideways_use_sma': False, 'sideways_use_ema': False, 'sideways_use_atr': False, 'sideways_use_adx': True, 'sideways_use_spike': True, 'sideways_rsi_required': True}.
