[I 2025-08-31 05:29:31,771] Trial 692 finished with values: [-1000000000.0, 1000000000.0] and parameters: {'p_sma': 55, 'p_std': 17, 'p_atr': 19, 'p_adx': 8, 'rsi_period': 53, 'ema1': 27, 'ema2': 52, 'slip_atr_k': 0.015408374032913078, 'slip_spread_k': 0.4494990111465063, 'spread_hl_frac': 0.0055814867854466176, 'bb_std_mult': 1.9333233973419646, 'rsi_os': 38, 'rsi_ob': 79, 'vol_spike': 0.012972434078668424, 'adx_thresh': 28.664311014231885, 'atr_min_pct': 0.021641595819040002, 'atr_max_pct': 0.11268222096538782, 'tp_mult': 2.529487229575495, 'tsl_mult': 0.5185160092533231, 'strategy': 'mean_reversion', 'time_stop': 39, 'use_sma': True, 'use_atr': True, 'use_adx': False, 'use_ema': False, 'use_spike': True, 'rsi_required': True, 'edge_k': 0.18485026292171325, 'edge_cap': 0.8117332541775947, 'bull_strategy': 'mean_reversion', 'bull_bb_std_mult': 0.821378955048503, 'bull_rsi_os': 32, 'bull_rsi_ob': 81, 'bull_adx_thresh': 8.155675594952784, 'bull_atr_min_pct': 0.028343517262748735, 'bull_atr_max_pct': 0.09813076078090359, 'bull_tp_mult': 1.6854149059596655, 'bull_tsl_mult': 0.8889072381410817, 'bull_time_stop': 281, 'bull_use_sma': False, 'bull_use_ema': False, 'bull_use_atr': False, 'bull_use_adx': True, 'bull_use_spike': False, 'bull_rsi_required': False, 'bear_strategy': 'breakout', 'bear_bb_std_mult': 3.5158360696120408, 'bear_rsi_os': 41, 'bear_rsi_ob': 77, 'bear_adx_thresh': 34.877682092059615, 'bear_atr_min_pct': 0.007661909264891413, 'bear_atr_max_pct': 0.038696775488091945, 'bear_tp_mult': 1.3733555974158527, 'bear_tsl_mult': 0.5767782585068121, 'bear_time_stop': 231, 'bear_use_sma': True, 'bear_use_ema': True, 'bear_use_atr': True, 'bear_use_adx': False, 'bear_use_spike': False, 'bear_rsi_required': True, 'sideways_strategy': 'breakout', 'sideways_bb_std_mult': 1.1482375224670758, 'sideways_rsi_os': 37, 'sideways_rsi_ob': 53, 'sideways_adx_thresh': 27.915970337387773, 'sideways_atr_min_pct': 0.01490462234915506, 'sideways_atr_max_pct': 0.048795008902772025, 'sideways_tp_mult': 2.1058659760570206, 'sideways_tsl_mult': 0.43651072248785205, 'sideways_time_stop': 184, 'sideways_use_sma': False, 'sideways_use_ema': True, 'sideways_use_atr': False, 'sideways_use_adx': False, 'sideways_use_spike': True, 'sideways_rsi_required': True}.
[I 2025-08-31 05:29:35,086] Trial 697 finished with values: [-1000000000.0, 1000000000.0] and parameters: {'p_sma': 45, 'p_std': 14, 'p_atr': 18, 'p_adx': 20, 'rsi_period': 76, 'ema1': 23, 'ema2': 27, 'slip_atr_k': 0.02592355656417907, 'slip_spread_k': 0.4094335900000551, 'spread_hl_frac': 0.007952949541657386, 'bb_std_mult': 1.8722374381654523, 'rsi_os': 52, 'rsi_ob': 52, 'vol_spike': 0.29065043206440927, 'adx_thresh': 12.108643510411325, 'atr_min_pct': 0.024131552717224072, 'atr_max_pct': 0.14155252549299366, 'tp_mult': 2.3810976103511954, 'tsl_mult': 0.8492837011526883, 'strategy': 'mean_reversion', 'time_stop': 34, 'use_sma': False, 'use_atr': True, 'use_adx': False, 'use_ema': False, 'use_spike': False, 'rsi_required': True, 'edge_k': 0.4481920446654398, 'edge_cap': 0.7736423042104827, 'bull_strategy': 'mean_reversion', 'bull_bb_std_mult': 0.9064577317806299, 'bull_rsi_os': 41, 'bull_rsi_ob': 79, 'bull_adx_thresh': 8.67402449546119, 'bull_atr_min_pct': 0.006664253543801022, 'bull_atr_max_pct': 0.10562600784944713, 'bull_tp_mult': 1.238332185690183, 'bull_tsl_mult': 0.9189057326867087, 'bull_time_stop': 257, 'bull_use_sma': False, 'bull_use_ema': True, 'bull_use_atr': True, 'bull_use_adx': True, 'bull_use_spike': True, 'bull_rsi_required': False, 'bear_strategy': 'breakout', 'bear_bb_std_mult': 1.9157832985829921, 'bear_rsi_os': 8, 'bear_rsi_ob': 71, 'bear_adx_thresh': 9.430681197138119, 'bear_atr_min_pct': 0.006864436155718331, 'bear_atr_max_pct': 0.04551007175294337, 'bear_tp_mult': 1.7744865551960936, 'bear_tsl_mult': 0.622000163696658, 'bear_time_stop': 252, 'bear_use_sma': True, 'bear_use_ema': False, 'bear_use_atr': True, 'bear_use_adx': False, 'bear_use_spike': False, 'bear_rsi_required': True, 'sideways_strategy': 'breakout', 'sideways_bb_std_mult': 1.0457698462816296, 'sideways_rsi_os': 33, 'sideways_rsi_ob': 54, 'sideways_adx_thresh': 28.02533042496031, 'sideways_atr_min_pct': 0.013755404939069875, 'sideways_atr_max_pct': 0.031326046278508005, 'sideways_tp_mult': 1.081519884522906, 'sideways_tsl_mult': 0.4700934295373084, 'sideways_time_stop': 205, 'sideways_use_sma': False, 'sideways_use_ema': True, 'sideways_use_atr': False, 'sideways_use_adx': False, 'sideways_use_spike': True, 'sideways_rsi_required': True}.
[I 2025-08-31 05:29:35,194] Trial 696 finished with values: [-1000000000.0, 1000000000.0] and parameters: {'p_sma': 57, 'p_std': 14, 'p_atr': 18, 'p_adx': 8, 'rsi_period': 22, 'ema1': 24, 'ema2': 27, 'slip_atr_k': 0.17309502564376494, 'slip_spread_k': 0.7675133325089948, 'spread_hl_frac': 0.007530303168862001, 'bb_std_mult': 2.0968463867276705, 'rsi_os': 34, 'rsi_ob': 95, 'vol_spike': 0.01325971877545454, 'adx_thresh': 12.242686236706348, 'atr_min_pct': 0.021773671914071844, 'atr_max_pct': 0.013161586558888438, 'tp_mult': 2.4059594144218006, 'tsl_mult': 0.42795686770488744, 'strategy': 'mean_reversion', 'time_stop': 40, 'use_sma': False, 'use_atr': True, 'use_adx': False, 'use_ema': False, 'use_spike': False, 'rsi_required': True, 'edge_k': 0.4474978033060077, 'edge_cap': 0.8187025829129413, 'bull_strategy': 'mean_reversion', 'bull_bb_std_mult': 0.9277133415264278, 'bull_rsi_os': 32, 'bull_rsi_ob': 77, 'bull_adx_thresh': 8.321958406794554, 'bull_atr_min_pct': 0.021131686917478083, 'bull_atr_max_pct': 0.058797196251802075, 'bull_tp_mult': 1.9472226264596124, 'bull_tsl_mult': 0.897064582783582, 'bull_time_stop': 215, 'bull_use_sma': False, 'bull_use_ema': True, 'bull_use_atr': True, 'bull_use_adx': True, 'bull_use_spike': True, 'bull_rsi_required': False, 'bear_strategy': 'breakout', 'bear_bb_std_mult': 2.9001120544964167, 'bear_rsi_os': 8, 'bear_rsi_ob': 77, 'bear_adx_thresh': 23.314227614127866, 'bear_atr_min_pct': 0.008503757500093063, 'bear_atr_max_pct': 0.09204046076811279, 'bear_tp_mult': 1.3756231462567636, 'bear_tsl_mult': 0.23658285213620944, 'bear_time_stop': 257, 'bear_use_sma': True, 'bear_use_ema': False, 'bear_use_atr': True, 'bear_use_adx': False, 'bear_use_spike': False, 'bear_rsi_required': True, 'sideways_strategy': 'breakout', 'sideways_bb_std_mult': 0.6496614338205373, 'sideways_rsi_os': 36, 'sideways_rsi_ob': 54, 'sideways_adx_thresh': 28.092174783832462, 'sideways_atr_min_pct': 0.013623738948403913, 'sideways_atr_max_pct': 0.047783004431292915, 'sideways_tp_mult': 1.062343978753817, 'sideways_tsl_mult': 0.4738758643268664, 'sideways_time_stop': 205, 'sideways_use_sma': False, 'sideways_use_ema': True, 'sideways_use_atr': False, 'sideways_use_adx': False, 'sideways_use_spike': True, 'sideways_rsi_required': True}.
[I 2025-08-31 05:29:37,757] Trial 699 finished with values: [-1000000000.0, 1000000000.0] and parameters: {'p_sma': 60, 'p_std': 41, 'p_atr': 15, 'p_adx': 12, 'rsi_period': 70, 'ema1': 27, 'ema2': 26, 'slip_atr_k': 0.19846233293461102, 'slip_spread_k': 0.5874922522059957, 'spread_hl_frac': 0.011341828029292546, 'bb_std_mult': 0.935324227894271, 'rsi_os': 37, 'rsi_ob': 45, 'vol_spike': 0.030346625425887078, 'adx_thresh': 10.294288183774162, 'atr_min_pct': 0.02357466581892827, 'atr_max_pct': 0.13103167461562806, 'tp_mult': 2.5154755618881066, 'tsl_mult': 0.7277572308091651, 'strategy': 'mean_reversion', 'time_stop': 109, 'use_sma': False, 'use_atr': True, 'use_adx': False, 'use_ema': False, 'use_spike': True, 'rsi_required': True, 'edge_k': 0.7960279034512792, 'edge_cap': 0.8003296726262978, 'bull_strategy': 'breakout', 'bull_bb_std_mult': 0.7593066527981582, 'bull_rsi_os': 51, 'bull_rsi_ob': 90, 'bull_adx_thresh': 20.976147468155556, 'bull_atr_min_pct': 0.013993757133753379, 'bull_atr_max_pct': 0.01572284846109454, 'bull_tp_mult': 2.36762920857257, 'bull_tsl_mult': 0.40575986625936, 'bull_time_stop': 245, 'bull_use_sma': False, 'bull_use_ema': False, 'bull_use_atr': True, 'bull_use_adx': True, 'bull_use_spike': False, 'bull_rsi_required': False, 'bear_strategy': 'breakout', 'bear_bb_std_mult': 1.8632732990986929, 'bear_rsi_os': 9, 'bear_rsi_ob': 79, 'bear_adx_thresh': 26.846598906044903, 'bear_atr_min_pct': 0.010286843565805788, 'bear_atr_max_pct': 0.034300037899470934, 'bear_tp_mult': 1.1059290086084608, 'bear_tsl_mult': 0.2728433918658609, 'bear_time_stop': 270, 'bear_use_sma': True, 'bear_use_ema': True, 'bear_use_atr': True, 'bear_use_adx': False, 'bear_use_spike': False, 'bear_rsi_required': False, 'sideways_strategy': 'breakout', 'sideways_bb_std_mult': 1.5028344533978597, 'sideways_rsi_os': 34, 'sideways_rsi_ob': 56, 'sideways_adx_thresh': 25.80991025037718, 'sideways_atr_min_pct': 0.01652224118391557, 'sideways_atr_max_pct': 0.04387897921715883, 'sideways_tp_mult': 2.0812506029393343, 'sideways_tsl_mult': 0.5015621800235717, 'sideways_time_stop': 223, 'sideways_use_sma': True, 'sideways_use_ema': True, 'sideways_use_atr': False, 'sideways_use_adx': False, 'sideways_use_spike': True, 'sideways_rsi_required': True}.
[I 2025-08-31 05:30:00,721] Trial 694 finished with values: [-1000000000.0, 1000000000.0] and parameters: {'p_sma': 60, 'p_std': 14, 'p_atr': 18, 'p_adx': 10, 'rsi_period': 52, 'ema1': 21, 'ema2': 21, 'slip_atr_k': 0.016056276304181133, 'slip_spread_k': 0.505060035798949, 'spread_hl_frac': 0.007501967727472776, 'bb_std_mult': 2.261025705166435, 'rsi_os': 13, 'rsi_ob': 59, 'vol_spike': 0.13898808440883814, 'adx_thresh': 10.527557906698314, 'atr_min_pct': 0.021715481463457337, 'atr_max_pct': 0.13897344756354968, 'tp_mult': 2.402455386025409, 'tsl_mult': 0.848385223783173, 'strategy': 'mean_reversion', 'time_stop': 107, 'use_sma': True, 'use_atr': True, 'use_adx': False, 'use_ema': False, 'use_spike': True, 'rsi_required': True, 'edge_k': 0.7852055830667196, 'edge_cap': 0.8011820372209131, 'bull_strategy': 'mean_reversion', 'bull_bb_std_mult': 0.9152437650379345, 'bull_rsi_os': 32, 'bull_rsi_ob': 81, 'bull_adx_thresh': 24.68589399394435, 'bull_atr_min_pct': 0.009741694239903967, 'bull_atr_max_pct': 0.10586390295092778, 'bull_tp_mult': 2.430978750142274, 'bull_tsl_mult': 0.9183865979119247, 'bull_time_stop': 280, 'bull_use_sma': False, 'bull_use_ema': False, 'bull_use_atr': False, 'bull_use_adx': True, 'bull_use_spike': False, 'bull_rsi_required': False, 'bear_strategy': 'breakout', 'bear_bb_std_mult': 0.9646213460636103, 'bear_rsi_os': 18, 'bear_rsi_ob': 77, 'bear_adx_thresh': 23.58486111666943, 'bear_atr_min_pct': 0.00960698978842663, 'bear_atr_max_pct': 0.04945345405674943, 'bear_tp_mult': 1.404384151741576, 'bear_tsl_mult': 0.2040680673568546, 'bear_time_stop': 257, 'bear_use_sma': True, 'bear_use_ema': True, 'bear_use_atr': True, 'bear_use_adx': False, 'bear_use_spike': False, 'bear_rsi_required': True, 'sideways_strategy': 'breakout', 'sideways_bb_std_mult': 1.1953267952103341, 'sideways_rsi_os': 39, 'sideways_rsi_ob': 53, 'sideways_adx_thresh': 27.981641328561224, 'sideways_atr_min_pct': 0.026388966453720387, 'sideways_atr_max_pct': 0.035742869883742284, 'sideways_tp_mult': 2.160170832081486, 'sideways_tsl_mult': 0.4366994233067575, 'sideways_time_stop': 206, 'sideways_use_sma': False, 'sideways_use_ema': True, 'sideways_use_atr': False, 'sideways_use_adx': False, 'sideways_use_spike': True, 'sideways_rsi_required': True}.
[I 2025-08-31 05:30:10,609] Trial 695 finished with values: [-1000000000.0, 1000000000.0] and parameters: {'p_sma': 56, 'p_std': 18, 'p_atr': 19, 'p_adx': 20, 'rsi_period': 18, 'ema1': 27, 'ema2': 44, 'slip_atr_k': 0.17221310195775524, 'slip_spread_k': 0.3993646097696769, 'spread_hl_frac': 0.007767963160961961, 'bb_std_mult': 1.8811974631009476, 'rsi_os': 48, 'rsi_ob': 58, 'vol_spike': 0.02924010835352147, 'adx_thresh': 28.33987606784866, 'atr_min_pct': 0.021474068933759208, 'atr_max_pct': 0.11527626145437672, 'tp_mult': 2.3909369679647465, 'tsl_mult': 0.8412883139605742, 'strategy': 'mean_reversion', 'time_stop': 272, 'use_sma': True, 'use_atr': True, 'use_adx': False, 'use_ema': False, 'use_spike': True, 'rsi_required': True, 'edge_k': 0.47303177547681974, 'edge_cap': 0.8136767586019289, 'bull_strategy': 'mean_reversion', 'bull_bb_std_mult': 1.10280144511552, 'bull_rsi_os': 32, 'bull_rsi_ob': 91, 'bull_adx_thresh': 8.663059398154978, 'bull_atr_min_pct': 0.01572303490864533, 'bull_atr_max_pct': 0.10622920378655581, 'bull_tp_mult': 1.692975047731136, 'bull_tsl_mult': 0.8945421508938549, 'bull_time_stop': 205, 'bull_use_sma': False, 'bull_use_ema': True, 'bull_use_atr': False, 'bull_use_adx': True, 'bull_use_spike': False, 'bull_rsi_required': False, 'bear_strategy': 'breakout', 'bear_bb_std_mult': 0.9888715583070119, 'bear_rsi_os': 11, 'bear_rsi_ob': 71, 'bear_adx_thresh': 34.887324229107115, 'bear_atr_min_pct': 0.0105006330917169, 'bear_atr_max_pct': 0.03965109672550372, 'bear_tp_mult': 1.1006254184282938, 'bear_tsl_mult': 0.11326017825242096, 'bear_time_stop': 254, 'bear_use_sma': True, 'bear_use_ema': False, 'bear_use_atr': True, 'bear_use_adx': False, 'bear_use_spike': False, 'bear_rsi_required': True, 'sideways_strategy': 'breakout', 'sideways_bb_std_mult': 0.666595106493918, 'sideways_rsi_os': 39, 'sideways_rsi_ob': 79, 'sideways_adx_thresh': 25.816940425996737, 'sideways_atr_min_pct': 0.013680289093261277, 'sideways_atr_max_pct': 0.022318455557748255, 'sideways_tp_mult': 1.2719131587581365, 'sideways_tsl_mult': 0.4663454355972775, 'sideways_time_stop': 205, 'sideways_use_sma': False, 'sideways_use_ema': True, 'sideways_use_atr': False, 'sideways_use_adx': False, 'sideways_use_spike': True, 'sideways_rsi_required': True}.
[I 2025-08-31 05:30:14,182] Trial 698 finished with values: [-1000000000.0, 1000000000.0] and parameters: {'p_sma': 60, 'p_std': 60, 'p_atr': 15, 'p_adx': 10, 'rsi_period': 22, 'ema1': 24, 'ema2': 21, 'slip_atr_k': 0.023781743282639014, 'slip_spread_k': 0.5896975063379395, 'spread_hl_frac': 0.046894343997561844, 'bb_std_mult': 2.08313288044067, 'rsi_os': 40, 'rsi_ob': 58, 'vol_spike': 0.214374004256624, 'adx_thresh': 10.258673488315921, 'atr_min_pct': 0.01019612932290135, 'atr_max_pct': 0.13864113342802525, 'tp_mult': 2.859456163737722, 'tsl_mult': 0.7771211081644306, 'strategy': 'mean_reversion', 'time_stop': 34, 'use_sma': False, 'use_atr': True, 'use_adx': False, 'use_ema': False, 'use_spike': True, 'rsi_required': True, 'edge_k': 0.7098880742753007, 'edge_cap': 0.6904100419820389, 'bull_strategy': 'breakout', 'bull_bb_std_mult': 0.7585946404146618, 'bull_rsi_os': 46, 'bull_rsi_ob': 77, 'bull_adx_thresh': 29.524488598923696, 'bull_atr_min_pct': 0.012362411887990398, 'bull_atr_max_pct': 0.13864062971266394, 'bull_tp_mult': 1.9455618408596433, 'bull_tsl_mult': 0.9007489897011156, 'bull_time_stop': 206, 'bull_use_sma': False, 'bull_use_ema': False, 'bull_use_atr': True, 'bull_use_adx': True, 'bull_use_spike': False, 'bull_rsi_required': False, 'bear_strategy': 'breakout', 'bear_bb_std_mult': 0.904095988997706, 'bear_rsi_os': 11, 'bear_rsi_ob': 81, 'bear_adx_thresh': 23.371435221499873, 'bear_atr_min_pct': 0.008759159460754465, 'bear_atr_max_pct': 0.03896338228117604, 'bear_tp_mult': 1.0940341824626252, 'bear_tsl_mult': 0.30324941117167425, 'bear_time_stop': 150, 'bear_use_sma': True, 'bear_use_ema': True, 'bear_use_atr': True, 'bear_use_adx': False, 'bear_use_spike': False, 'bear_rsi_required': False, 'sideways_strategy': 'breakout', 'sideways_bb_std_mult': 2.4825160679916904, 'sideways_rsi_os': 44, 'sideways_rsi_ob': 54, 'sideways_adx_thresh': 25.86086111577174, 'sideways_atr_min_pct': 0.012926137775480353, 'sideways_atr_max_pct': 0.035340178342912254, 'sideways_tp_mult': 2.453268433780198, 'sideways_tsl_mult': 0.3917279075254692, 'sideways_time_stop': 222, 'sideways_use_sma': True, 'sideways_use_ema': True, 'sideways_use_atr': False, 'sideways_use_adx': False, 'sideways_use_spike': True, 'sideways_rsi_required': True}.
[I 2025-08-31 05:30:18,600] Trial 700 finished with values: [-1000000000.0, 1000000000.0] and parameters: {'p_sma': 41, 'p_std': 16, 'p_atr': 15, 'p_adx': 10, 'rsi_period': 79, 'ema1': 23, 'ema2': 25, 'slip_atr_k': 0.04161484321179155, 'slip_spread_k': 0.7419946679795058, 'spread_hl_frac': 0.0034778458962997465, 'bb_std_mult': 2.0037162777122903, 'rsi_os': 46, 'rsi_ob': 61, 'vol_spike': 0.2634087166587984, 'adx_thresh': 10.746472941368753, 'atr_min_pct': 0.02250287887816431, 'atr_max_pct': 0.13343076796020964, 'tp_mult': 2.8175889296072096, 'tsl_mult': 0.4719769428293269, 'strategy': 'mean_reversion', 'time_stop': 26, 'use_sma': False, 'use_atr': True, 'use_adx': False, 'use_ema': True, 'use_spike': True, 'rsi_required': True, 'edge_k': 0.8880935323151399, 'edge_cap': 0.7731865871139771, 'bull_strategy': 'mean_reversion', 'bull_bb_std_mult': 1.0238278030394403, 'bull_rsi_os': 45, 'bull_rsi_ob': 57, 'bull_adx_thresh': 22.45049825172475, 'bull_atr_min_pct': 0.012490773982589068, 'bull_atr_max_pct': 0.13874963123343453, 'bull_tp_mult': 1.6303110250457016, 'bull_tsl_mult': 0.3642824086452048, 'bull_time_stop': 286, 'bull_use_sma': False, 'bull_use_ema': False, 'bull_use_atr': True, 'bull_use_adx': True, 'bull_use_spike': False, 'bull_rsi_required': False, 'bear_strategy': 'breakout', 'bear_bb_std_mult': 0.8733066047194364, 'bear_rsi_os': 11, 'bear_rsi_ob': 74, 'bear_adx_thresh': 15.860570729594372, 'bear_atr_min_pct': 0.009579550064423886, 'bear_atr_max_pct': 0.1350281940865583, 'bear_tp_mult': 1.0109334097361795, 'bear_tsl_mult': 0.30648731354887676, 'bear_time_stop': 236, 'bear_use_sma': True, 'bear_use_ema': True, 'bear_use_atr': True, 'bear_use_adx': False, 'bear_use_spike': False, 'bear_rsi_required': True, 'sideways_strategy': 'breakout', 'sideways_bb_std_mult': 3.4812812461268754, 'sideways_rsi_os': 44, 'sideways_rsi_ob': 60, 'sideways_adx_thresh': 26.378309654902395, 'sideways_atr_min_pct': 0.012542241018631335, 'sideways_atr_max_pct': 0.03458338637676642, 'sideways_tp_mult': 2.6610943482495393, 'sideways_tsl_mult': 0.4951440972265572, 'sideways_time_stop': 216, 'sideways_use_sma': False, 'sideways_use_ema': True, 'sideways_use_atr': False, 'sideways_use_adx': False, 'sideways_use_spike': True, 'sideways_rsi_required': True}.
[I 2025-08-31 05:30:42,338] Trial 701 finished with values: [-1000000000.0, 1000000000.0] and parameters: {'p_sma': 58, 'p_std': 60, 'p_atr': 15, 'p_adx': 7, 'rsi_period': 79, 'ema1': 23, 'ema2': 20, 'slip_atr_k': 0.09658476557728277, 'slip_spread_k': 0.7515656492660105, 'spread_hl_frac': 0.024955355847548596, 'bb_std_mult': 2.0160191353620953, 'rsi_os': 40, 'rsi_ob': 58, 'vol_spike': 0.06649697046586571, 'adx_thresh': 11.711770043607418, 'atr_min_pct': 0.02253371734731475, 'atr_max_pct': 0.042288834524785754, 'tp_mult': 2.7669310593502137, 'tsl_mult': 0.758171168032317, 'strategy': 'mean_reversion', 'time_stop': 33, 'use_sma': False, 'use_atr': True, 'use_adx': True, 'use_ema': True, 'use_spike': True, 'rsi_required': True, 'edge_k': 0.25076312685627233, 'edge_cap': 0.7655741338137234, 'bull_strategy': 'mean_reversion', 'bull_bb_std_mult': 1.1128047337273892, 'bull_rsi_os': 47, 'bull_rsi_ob': 72, 'bull_adx_thresh': 22.31525950555477, 'bull_atr_min_pct': 0.012383855328194263, 'bull_atr_max_pct': 0.03859441440038361, 'bull_tp_mult': 1.629014982066504, 'bull_tsl_mult': 0.8569611145697373, 'bull_time_stop': 227, 'bull_use_sma': True, 'bull_use_ema': False, 'bull_use_atr': True, 'bull_use_adx': False, 'bull_use_spike': False, 'bull_rsi_required': False, 'bear_strategy': 'breakout', 'bear_bb_std_mult': 0.8867979635678281, 'bear_rsi_os': 39, 'bear_rsi_ob': 74, 'bear_adx_thresh': 28.136722664390142, 'bear_atr_min_pct': 0.008889866597628691, 'bear_atr_max_pct': 0.1430100942208422, 'bear_tp_mult': 1.2821340969278217, 'bear_tsl_mult': 0.10631356111283685, 'bear_time_stop': 100, 'bear_use_sma': False, 'bear_use_ema': True, 'bear_use_atr': False, 'bear_use_adx': False, 'bear_use_spike': False, 'bear_rsi_required': True, 'sideways_strategy': 'breakout', 'sideways_bb_std_mult': 1.2368274861835087, 'sideways_rsi_os': 44, 'sideways_rsi_ob': 87, 'sideways_adx_thresh': 26.393588240840984, 'sideways_atr_min_pct': 0.01265886239327153, 'sideways_atr_max_pct': 0.06276727368098367, 'sideways_tp_mult': 2.431492560084112, 'sideways_tsl_mult': 0.5291997947926315, 'sideways_time_stop': 168, 'sideways_use_sma': False, 'sideways_use_ema': True, 'sideways_use_atr': True, 'sideways_use_adx': False, 'sideways_use_spike': False, 'sideways_rsi_required': False}.
