[I 2025-08-31 03:57:44,726] Trial 199 finished with values: [-1000000000.0, 1000000000.0] and parameters: {'p_sma': 43, 'p_std': 33, 'p_atr': 23, 'p_adx': 24, 'rsi_period': 27, 'ema1': 14, 'ema2': 23, 'slip_atr_k': 0.011281929055755768, 'slip_spread_k': 0.10607629981164005, 'spread_hl_frac': 0.012495532798084848, 'bb_std_mult': 1.8080273473533064, 'rsi_os': 27, 'rsi_ob': 62, 'vol_spike': 0.025746129820078886, 'adx_thresh': 12.411076984106447, 'atr_min_pct': 0.022716679957119727, 'atr_max_pct': 0.10213854565034979, 'tp_mult': 2.5230604073845817, 'tsl_mult': 0.8319844254735098, 'strategy': 'breakout', 'time_stop': 52, 'use_sma': True, 'use_atr': False, 'use_adx': False, 'use_ema': False, 'use_spike': True, 'rsi_required': False, 'edge_k': 1.4678347484363095, 'edge_cap': 0.9560891906594641, 'bull_strategy': 'mean_reversion', 'bull_bb_std_mult': 3.5836063175093513, 'bull_rsi_os': 14, 'bull_rsi_ob': 76, 'bull_adx_thresh': 13.323947136722358, 'bull_atr_min_pct': 0.002050129702855135, 'bull_atr_max_pct': 0.06822109079064992, 'bull_tp_mult': 1.5788364399308685, 'bull_tsl_mult': 0.34874224284635813, 'bull_time_stop': 133, 'bull_use_sma': False, 'bull_use_ema': False, 'bull_use_atr': False, 'bull_use_adx': True, 'bull_use_spike': False, 'bull_rsi_required': True, 'bear_strategy': 'mean_reversion', 'bear_bb_std_mult': 0.9783001059367904, 'bear_rsi_os': 10, 'bear_rsi_ob': 47, 'bear_adx_thresh': 17.102108661282635, 'bear_atr_min_pct': 0.024067760013682223, 'bear_atr_max_pct': 0.029936644125624565, 'bear_tp_mult': 2.675569468727603, 'bear_tsl_mult': 0.2284181378699523, 'bear_time_stop': 210, 'bear_use_sma': True, 'bear_use_ema': True, 'bear_use_atr': True, 'bear_use_adx': True, 'bear_use_spike': True, 'bear_rsi_required': True, 'sideways_strategy': 'mean_reversion', 'sideways_bb_std_mult': 0.7385861564503884, 'sideways_rsi_os': 40, 'sideways_rsi_ob': 54, 'sideways_adx_thresh': 10.041148661523584, 'sideways_atr_min_pct': 0.012991988055942353, 'sideways_atr_max_pct': 0.11488315360237109, 'sideways_tp_mult': 1.9185390898161472, 'sideways_tsl_mult': 0.5630181364781845, 'sideways_time_stop': 73, 'sideways_use_sma': False, 'sideways_use_ema': False, 'sideways_use_atr': False, 'sideways_use_adx': True, 'sideways_use_spike': True, 'sideways_rsi_required': True}.
[I 2025-08-31 03:57:45,007] Trial 197 finished with values: [-1000000000.0, 1000000000.0] and parameters: {'p_sma': 43, 'p_std': 32, 'p_atr': 23, 'p_adx': 9, 'rsi_period': 27, 'ema1': 13, 'ema2': 24, 'slip_atr_k': 0.014317938209960007, 'slip_spread_k': 0.13925009263987992, 'spread_hl_frac': 0.008957336125566852, 'bb_std_mult': 1.8448564822239923, 'rsi_os': 30, 'rsi_ob': 61, 'vol_spike': 0.20643453972753348, 'adx_thresh': 10.995128540925519, 'atr_min_pct': 0.023579206855103504, 'atr_max_pct': 0.09709714204076504, 'tp_mult': 2.4945025543342925, 'tsl_mult': 0.8373107825018758, 'strategy': 'breakout', 'time_stop': 60, 'use_sma': True, 'use_atr': False, 'use_adx': False, 'use_ema': False, 'use_spike': True, 'rsi_required': False, 'edge_k': 1.4395038614946312, 'edge_cap': 0.9528474823341402, 'bull_strategy': 'mean_reversion', 'bull_bb_std_mult': 3.230954260985259, 'bull_rsi_os': 13, 'bull_rsi_ob': 76, 'bull_adx_thresh': 13.057535647947539, 'bull_atr_min_pct': 0.0020871555536551914, 'bull_atr_max_pct': 0.030478792451864363, 'bull_tp_mult': 1.528449017867154, 'bull_tsl_mult': 0.30143373749998803, 'bull_time_stop': 141, 'bull_use_sma': False, 'bull_use_ema': False, 'bull_use_atr': False, 'bull_use_adx': True, 'bull_use_spike': False, 'bull_rsi_required': True, 'bear_strategy': 'mean_reversion', 'bear_bb_std_mult': 0.9903032650017372, 'bear_rsi_os': 11, 'bear_rsi_ob': 46, 'bear_adx_thresh': 20.166530288646143, 'bear_atr_min_pct': 0.024568200323374652, 'bear_atr_max_pct': 0.03105836307847714, 'bear_tp_mult': 2.8957492772374147, 'bear_tsl_mult': 0.23216255227901725, 'bear_time_stop': 211, 'bear_use_sma': True, 'bear_use_ema': True, 'bear_use_atr': True, 'bear_use_adx': True, 'bear_use_spike': True, 'bear_rsi_required': True, 'sideways_strategy': 'mean_reversion', 'sideways_bb_std_mult': 0.6921406913962904, 'sideways_rsi_os': 30, 'sideways_rsi_ob': 54, 'sideways_adx_thresh': 12.160816954540223, 'sideways_atr_min_pct': 0.013347547191122047, 'sideways_atr_max_pct': 0.11529329655591945, 'sideways_tp_mult': 2.011682011084477, 'sideways_tsl_mult': 0.5831766922345706, 'sideways_time_stop': 70, 'sideways_use_sma': False, 'sideways_use_ema': False, 'sideways_use_atr': False, 'sideways_use_adx': True, 'sideways_use_spike': True, 'sideways_rsi_required': True}.
[I 2025-08-31 03:57:45,248] Trial 198 finished with values: [-1000000000.0, 1000000000.0] and parameters: {'p_sma': 44, 'p_std': 17, 'p_atr': 23, 'p_adx': 9, 'rsi_period': 77, 'ema1': 12, 'ema2': 32, 'slip_atr_k': 0.016363326846591225, 'slip_spread_k': 0.14066236471892896, 'spread_hl_frac': 0.011961215239705962, 'bb_std_mult': 1.7994577786674635, 'rsi_os': 30, 'rsi_ob': 59, 'vol_spike': 0.02335837295737213, 'adx_thresh': 12.40320713232142, 'atr_min_pct': 0.023880079763159933, 'atr_max_pct': 0.11911693384998724, 'tp_mult': 2.555516640230474, 'tsl_mult': 0.912553976303998, 'strategy': 'breakout', 'time_stop': 37, 'use_sma': True, 'use_atr': False, 'use_adx': False, 'use_ema': False, 'use_spike': True, 'rsi_required': False, 'edge_k': 1.446047271300242, 'edge_cap': 0.9636903657028498, 'bull_strategy': 'mean_reversion', 'bull_bb_std_mult': 3.226197739533083, 'bull_rsi_os': 9, 'bull_rsi_ob': 76, 'bull_adx_thresh': 10.6761719989554, 'bull_atr_min_pct': 0.004349919049573702, 'bull_atr_max_pct': 0.06811496030086249, 'bull_tp_mult': 1.681013151039001, 'bull_tsl_mult': 0.053469664294090835, 'bull_time_stop': 139, 'bull_use_sma': False, 'bull_use_ema': False, 'bull_use_atr': False, 'bull_use_adx': True, 'bull_use_spike': False, 'bull_rsi_required': True, 'bear_strategy': 'mean_reversion', 'bear_bb_std_mult': 1.0308848261687438, 'bear_rsi_os': 10, 'bear_rsi_ob': 46, 'bear_adx_thresh': 19.8115878452533, 'bear_atr_min_pct': 0.025020755711283434, 'bear_atr_max_pct': 0.02873853903771277, 'bear_tp_mult': 2.6917939638849786, 'bear_tsl_mult': 0.23541385775503698, 'bear_time_stop': 210, 'bear_use_sma': True, 'bear_use_ema': True, 'bear_use_atr': True, 'bear_use_adx': True, 'bear_use_spike': True, 'bear_rsi_required': True, 'sideways_strategy': 'mean_reversion', 'sideways_bb_std_mult': 1.1520030649299449, 'sideways_rsi_os': 42, 'sideways_rsi_ob': 54, 'sideways_adx_thresh': 10.738427751332916, 'sideways_atr_min_pct': 0.013292156847876746, 'sideways_atr_max_pct': 0.11495441562021627, 'sideways_tp_mult': 2.0031711552510143, 'sideways_tsl_mult': 0.562371921693542, 'sideways_time_stop': 73, 'sideways_use_sma': False, 'sideways_use_ema': False, 'sideways_use_atr': False, 'sideways_use_adx': True, 'sideways_use_spike': True, 'sideways_rsi_required': True}.
[I 2025-08-31 03:58:18,741] Trial 203 finished with values: [-1000000000.0, 1000000000.0] and parameters: {'p_sma': 46, 'p_std': 52, 'p_atr': 9, 'p_adx': 8, 'rsi_period': 20, 'ema1': 12, 'ema2': 21, 'slip_atr_k': 0.028081412705373402, 'slip_spread_k': 0.047034852701281105, 'spread_hl_frac': 0.01114382375947202, 'bb_std_mult': 2.03235409590046, 'rsi_os': 33, 'rsi_ob': 57, 'vol_spike': 0.024163170680976565, 'adx_thresh': 12.45916393884522, 'atr_min_pct': 0.024432275477460005, 'atr_max_pct': 0.08942526457362782, 'tp_mult': 2.549292230136136, 'tsl_mult': 0.922733508706562, 'strategy': 'breakout', 'time_stop': 40, 'use_sma': False, 'use_atr': False, 'use_adx': False, 'use_ema': False, 'use_spike': True, 'rsi_required': False, 'edge_k': 1.5195037078815643, 'edge_cap': 0.9875434375359151, 'bull_strategy': 'mean_reversion', 'bull_bb_std_mult': 3.529179004823769, 'bull_rsi_os': 8, 'bull_rsi_ob': 75, 'bull_adx_thresh': 9.15604508069299, 'bull_atr_min_pct': 0.004437704115750377, 'bull_atr_max_pct': 0.08661903433166464, 'bull_tp_mult': 1.6260188228785033, 'bull_tsl_mult': 0.8479089321448761, 'bull_time_stop': 111, 'bull_use_sma': False, 'bull_use_ema': False, 'bull_use_atr': True, 'bull_use_adx': True, 'bull_use_spike': False, 'bull_rsi_required': True, 'bear_strategy': 'mean_reversion', 'bear_bb_std_mult': 1.1723138602313163, 'bear_rsi_os': 8, 'bear_rsi_ob': 46, 'bear_adx_thresh': 18.54927304631525, 'bear_atr_min_pct': 0.025525551565682363, 'bear_atr_max_pct': 0.04743500564196244, 'bear_tp_mult': 2.7003626018417335, 'bear_tsl_mult': 0.2663610028010979, 'bear_time_stop': 200, 'bear_use_sma': True, 'bear_use_ema': True, 'bear_use_atr': False, 'bear_use_adx': True, 'bear_use_spike': True, 'bear_rsi_required': True, 'sideways_strategy': 'mean_reversion', 'sideways_bb_std_mult': 1.296889664274656, 'sideways_rsi_os': 22, 'sideways_rsi_ob': 51, 'sideways_adx_thresh': 10.85507782678987, 'sideways_atr_min_pct': 0.015056621787905594, 'sideways_atr_max_pct': 0.1123581399273465, 'sideways_tp_mult': 2.1245388819676574, 'sideways_tsl_mult': 0.5173271350550444, 'sideways_time_stop': 82, 'sideways_use_sma': False, 'sideways_use_ema': False, 'sideways_use_atr': False, 'sideways_use_adx': True, 'sideways_use_spike': True, 'sideways_rsi_required': True}.
[I 2025-08-31 03:58:19,334] Trial 201 finished with values: [-1000000000.0, 1000000000.0] and parameters: {'p_sma': 44, 'p_std': 31, 'p_atr': 23, 'p_adx': 8, 'rsi_period': 25, 'ema1': 12, 'ema2': 20, 'slip_atr_k': 0.010075740979670804, 'slip_spread_k': 0.10858198112470058, 'spread_hl_frac': 0.012521004497117193, 'bb_std_mult': 2.0185547919022797, 'rsi_os': 28, 'rsi_ob': 58, 'vol_spike': 0.20497371139481055, 'adx_thresh': 12.232178231041354, 'atr_min_pct': 0.027655966970783343, 'atr_max_pct': 0.09085163423097882, 'tp_mult': 2.5398462618296533, 'tsl_mult': 0.8378954757786705, 'strategy': 'breakout', 'time_stop': 34, 'use_sma': True, 'use_atr': False, 'use_adx': False, 'use_ema': False, 'use_spike': True, 'rsi_required': False, 'edge_k': 1.44434025104033, 'edge_cap': 0.9614426090314897, 'bull_strategy': 'mean_reversion', 'bull_bb_std_mult': 3.5986092955727935, 'bull_rsi_os': 14, 'bull_rsi_ob': 75, 'bull_adx_thresh': 9.145361531184335, 'bull_atr_min_pct': 0.004069337376511696, 'bull_atr_max_pct': 0.08638044972189896, 'bull_tp_mult': 1.5920355577179142, 'bull_tsl_mult': 0.30008817904302076, 'bull_time_stop': 137, 'bull_use_sma': False, 'bull_use_ema': False, 'bull_use_atr': False, 'bull_use_adx': True, 'bull_use_spike': False, 'bull_rsi_required': True, 'bear_strategy': 'mean_reversion', 'bear_bb_std_mult': 1.0651783389999108, 'bear_rsi_os': 8, 'bear_rsi_ob': 46, 'bear_adx_thresh': 7.154934955879934, 'bear_atr_min_pct': 0.025177460231413425, 'bear_atr_max_pct': 0.025769566772829648, 'bear_tp_mult': 2.6996139405813198, 'bear_tsl_mult': 0.2250994377419723, 'bear_time_stop': 212, 'bear_use_sma': True, 'bear_use_ema': True, 'bear_use_atr': True, 'bear_use_adx': True, 'bear_use_spike': True, 'bear_rsi_required': True, 'sideways_strategy': 'mean_reversion', 'sideways_bb_std_mult': 1.325687567913514, 'sideways_rsi_os': 30, 'sideways_rsi_ob': 51, 'sideways_adx_thresh': 10.65621710343585, 'sideways_atr_min_pct': 0.014730966827417272, 'sideways_atr_max_pct': 0.1134357670832336, 'sideways_tp_mult': 1.9920228553294903, 'sideways_tsl_mult': 0.6020116456025021, 'sideways_time_stop': 48, 'sideways_use_sma': False, 'sideways_use_ema': False, 'sideways_use_atr': False, 'sideways_use_adx': True, 'sideways_use_spike': True, 'sideways_rsi_required': True}.
[I 2025-08-31 03:58:19,530] Trial 202 finished with values: [-1000000000.0, 1000000000.0] and parameters: {'p_sma': 46, 'p_std': 53, 'p_atr': 23, 'p_adx': 8, 'rsi_period': 25, 'ema1': 14, 'ema2': 20, 'slip_atr_k': 0.026669746572655903, 'slip_spread_k': 0.11174689445158259, 'spread_hl_frac': 0.010775067159029181, 'bb_std_mult': 2.015882047814285, 'rsi_os': 28, 'rsi_ob': 61, 'vol_spike': 0.024096380503597716, 'adx_thresh': 12.272457911184864, 'atr_min_pct': 0.028102064506610767, 'atr_max_pct': 0.08891352882900315, 'tp_mult': 2.5503737981545154, 'tsl_mult': 0.9187619443496151, 'strategy': 'breakout', 'time_stop': 63, 'use_sma': False, 'use_atr': False, 'use_adx': False, 'use_ema': False, 'use_spike': True, 'rsi_required': False, 'edge_k': 1.5196486982457769, 'edge_cap': 0.9993128567755473, 'bull_strategy': 'mean_reversion', 'bull_bb_std_mult': 3.2662991816135283, 'bull_rsi_os': 15, 'bull_rsi_ob': 75, 'bull_adx_thresh': 11.965026936026767, 'bull_atr_min_pct': 0.017375199938794196, 'bull_atr_max_pct': 0.01538371215993379, 'bull_tp_mult': 1.6183764091436588, 'bull_tsl_mult': 0.8471234379559719, 'bull_time_stop': 143, 'bull_use_sma': False, 'bull_use_ema': False, 'bull_use_atr': True, 'bull_use_adx': True, 'bull_use_spike': False, 'bull_rsi_required': True, 'bear_strategy': 'mean_reversion', 'bear_bb_std_mult': 0.7633761411827775, 'bear_rsi_os': 8, 'bear_rsi_ob': 46, 'bear_adx_thresh': 18.74269695808401, 'bear_atr_min_pct': 0.025342338439106313, 'bear_atr_max_pct': 0.025528370509288772, 'bear_tp_mult': 2.7078470577752274, 'bear_tsl_mult': 0.20647744306957058, 'bear_time_stop': 240, 'bear_use_sma': True, 'bear_use_ema': True, 'bear_use_atr': True, 'bear_use_adx': True, 'bear_use_spike': True, 'bear_rsi_required': True, 'sideways_strategy': 'mean_reversion', 'sideways_bb_std_mult': 1.3018668346441458, 'sideways_rsi_os': 30, 'sideways_rsi_ob': 57, 'sideways_adx_thresh': 10.755763803996032, 'sideways_atr_min_pct': 0.014648415237718702, 'sideways_atr_max_pct': 0.12110080795432912, 'sideways_tp_mult': 1.9944515291142009, 'sideways_tsl_mult': 0.5958853980287488, 'sideways_time_stop': 43, 'sideways_use_sma': False, 'sideways_use_ema': False, 'sideways_use_atr': False, 'sideways_use_adx': True, 'sideways_use_spike': True, 'sideways_rsi_required': True}.
[I 2025-08-31 03:58:19,727] Trial 204 finished with values: [-1000000000.0, 1000000000.0] and parameters: {'p_sma': 36, 'p_std': 20, 'p_atr': 24, 'p_adx': 22, 'rsi_period': 20, 'ema1': 14, 'ema2': 20, 'slip_atr_k': 0.029818472203006596, 'slip_spread_k': 0.04782976065748599, 'spread_hl_frac': 0.010111141840436976, 'bb_std_mult': 2.0597756789868926, 'rsi_os': 28, 'rsi_ob': 58, 'vol_spike': 0.016250465758885696, 'adx_thresh': 11.713659689880387, 'atr_min_pct': 0.0024463155028006493, 'atr_max_pct': 0.08975225473308746, 'tp_mult': 2.531992354849333, 'tsl_mult': 0.9182373553963797, 'strategy': 'breakout', 'time_stop': 42, 'use_sma': False, 'use_atr': False, 'use_adx': False, 'use_ema': False, 'use_spike': True, 'rsi_required': False, 'edge_k': 1.5295409885944398, 'edge_cap': 0.990482406705417, 'bull_strategy': 'mean_reversion', 'bull_bb_std_mult': 3.440630868323627, 'bull_rsi_os': 15, 'bull_rsi_ob': 78, 'bull_adx_thresh': 11.931338881894225, 'bull_atr_min_pct': 0.003016881625408377, 'bull_atr_max_pct': 0.01042338333871927, 'bull_tp_mult': 1.6267458061798215, 'bull_tsl_mult': 0.9074476766235621, 'bull_time_stop': 146, 'bull_use_sma': False, 'bull_use_ema': False, 'bull_use_atr': True, 'bull_use_adx': True, 'bull_use_spike': False, 'bull_rsi_required': True, 'bear_strategy': 'mean_reversion', 'bear_bb_std_mult': 1.1157549590487705, 'bear_rsi_os': 15, 'bear_rsi_ob': 49, 'bear_adx_thresh': 7.358597355703786, 'bear_atr_min_pct': 0.02003045416988479, 'bear_atr_max_pct': 0.053318579655824, 'bear_tp_mult': 2.8375688963999415, 'bear_tsl_mult': 0.2696327757024142, 'bear_time_stop': 193, 'bear_use_sma': True, 'bear_use_ema': True, 'bear_use_atr': False, 'bear_use_adx': True, 'bear_use_spike': True, 'bear_rsi_required': True, 'sideways_strategy': 'mean_reversion', 'sideways_bb_std_mult': 1.4180366992254074, 'sideways_rsi_os': 31, 'sideways_rsi_ob': 56, 'sideways_adx_thresh': 10.945124807313855, 'sideways_atr_min_pct': 0.014344122325075348, 'sideways_atr_max_pct': 0.12148548472859609, 'sideways_tp_mult': 2.113689272290715, 'sideways_tsl_mult': 0.5993109177443725, 'sideways_time_stop': 51, 'sideways_use_sma': False, 'sideways_use_ema': False, 'sideways_use_atr': False, 'sideways_use_adx': True, 'sideways_use_spike': True, 'sideways_rsi_required': True}.
[I 2025-08-31 03:58:53,087] Trial 207 finished with values: [-1000000000.0, 1000000000.0] and parameters: {'p_sma': 36, 'p_std': 20, 'p_atr': 24, 'p_adx': 20, 'rsi_period': 84, 'ema1': 14, 'ema2': 54, 'slip_atr_k': 0.005474274631884241, 'slip_spread_k': 0.0909438758669057, 'spread_hl_frac': 0.009893617855769843, 'bb_std_mult': 1.7201060990028532, 'rsi_os': 29, 'rsi_ob': 59, 'vol_spike': 0.10602444481628981, 'adx_thresh': 11.542068571751484, 'atr_min_pct': 0.023119112497283174, 'atr_max_pct': 0.10696521884531103, 'tp_mult': 2.4840660992459673, 'tsl_mult': 0.8851383981537231, 'strategy': 'breakout', 'time_stop': 46, 'use_sma': False, 'use_atr': True, 'use_adx': False, 'use_ema': False, 'use_spike': True, 'rsi_required': False, 'edge_k': 1.3648672323242628, 'edge_cap': 0.6874898783513155, 'bull_strategy': 'mean_reversion', 'bull_bb_std_mult': 3.439777141000821, 'bull_rsi_os': 45, 'bull_rsi_ob': 78, 'bull_adx_thresh': 12.530894940434784, 'bull_atr_min_pct': 0.0028757153150160797, 'bull_atr_max_pct': 0.03322078069632949, 'bull_tp_mult': 1.467742192292779, 'bull_tsl_mult': 0.9083515654352083, 'bull_time_stop': 146, 'bull_use_sma': False, 'bull_use_ema': False, 'bull_use_atr': True, 'bull_use_adx': True, 'bull_use_spike': False, 'bull_rsi_required': True, 'bear_strategy': 'mean_reversion', 'bear_bb_std_mult': 0.8793277800795486, 'bear_rsi_os': 15, 'bear_rsi_ob': 50, 'bear_adx_thresh': 28.870933571903933, 'bear_atr_min_pct': 0.020586925611701737, 'bear_atr_max_pct': 0.05401508168331789, 'bear_tp_mult': 2.655717710525874, 'bear_tsl_mult': 0.27700755636677526, 'bear_time_stop': 190, 'bear_use_sma': True, 'bear_use_ema': True, 'bear_use_atr': True, 'bear_use_adx': True, 'bear_use_spike': True, 'bear_rsi_required': True, 'sideways_strategy': 'mean_reversion', 'sideways_bb_std_mult': 1.4372331125887536, 'sideways_rsi_os': 19, 'sideways_rsi_ob': 56, 'sideways_adx_thresh': 11.340092112087202, 'sideways_atr_min_pct': 0.012260051116179454, 'sideways_atr_max_pct': 0.11752678624508794, 'sideways_tp_mult': 1.9478989334833698, 'sideways_tsl_mult': 0.630066617641847, 'sideways_time_stop': 62, 'sideways_use_sma': False, 'sideways_use_ema': False, 'sideways_use_atr': False, 'sideways_use_adx': True, 'sideways_use_spike': True, 'sideways_rsi_required': True}.
[I 2025-08-31 03:58:53,448] Trial 206 finished with values: [-1000000000.0, 1000000000.0] and parameters: {'p_sma': 36, 'p_std': 20, 'p_atr': 7, 'p_adx': 8, 'rsi_period': 71, 'ema1': 14, 'ema2': 17, 'slip_atr_k': 0.02544118593736154, 'slip_spread_k': 0.1017584333603088, 'spread_hl_frac': 0.010573192285798567, 'bb_std_mult': 3.562587027381081, 'rsi_os': 29, 'rsi_ob': 59, 'vol_spike': 0.017885073752017863, 'adx_thresh': 11.572271914544439, 'atr_min_pct': 0.0038205999536121624, 'atr_max_pct': 0.10650734797976559, 'tp_mult': 2.709528531687553, 'tsl_mult': 0.8941923795125429, 'strategy': 'breakout', 'time_stop': 64, 'use_sma': False, 'use_atr': True, 'use_adx': False, 'use_ema': False, 'use_spike': True, 'rsi_required': False, 'edge_k': 1.520552167833026, 'edge_cap': 0.9992752955884956, 'bull_strategy': 'mean_reversion', 'bull_bb_std_mult': 3.44076238953207, 'bull_rsi_os': 15, 'bull_rsi_ob': 78, 'bull_adx_thresh': 12.411623120672486, 'bull_atr_min_pct': 0.0032738434292224707, 'bull_atr_max_pct': 0.03405183850136515, 'bull_tp_mult': 1.4703927594169612, 'bull_tsl_mult': 0.9052592110573241, 'bull_time_stop': 145, 'bull_use_sma': False, 'bull_use_ema': False, 'bull_use_atr': True, 'bull_use_adx': True, 'bull_use_spike': False, 'bull_rsi_required': True, 'bear_strategy': 'mean_reversion', 'bear_bb_std_mult': 2.464933357881134, 'bear_rsi_os': 15, 'bear_rsi_ob': 49, 'bear_adx_thresh': 20.660213167391017, 'bear_atr_min_pct': 0.021404566644461442, 'bear_atr_max_pct': 0.05264559963566591, 'bear_tp_mult': 2.6403900485756155, 'bear_tsl_mult': 0.2025085239408131, 'bear_time_stop': 193, 'bear_use_sma': True, 'bear_use_ema': True, 'bear_use_atr': True, 'bear_use_adx': True, 'bear_use_spike': True, 'bear_rsi_required': True, 'sideways_strategy': 'mean_reversion', 'sideways_bb_std_mult': 1.4228494534248415, 'sideways_rsi_os': 38, 'sideways_rsi_ob': 57, 'sideways_adx_thresh': 11.376932441895159, 'sideways_atr_min_pct': 0.014294981483770156, 'sideways_atr_max_pct': 0.121324533158212, 'sideways_tp_mult': 1.856165255780291, 'sideways_tsl_mult': 0.6241245709619785, 'sideways_time_stop': 60, 'sideways_use_sma': False, 'sideways_use_ema': False, 'sideways_use_atr': False, 'sideways_use_adx': True, 'sideways_use_spike': True, 'sideways_rsi_required': True}.
