[I 2025-08-31 03:56:33,817] Trial 189 finished with values: [-1000000000.0, 1000000000.0] and parameters: {'p_sma': 55, 'p_std': 18, 'p_atr': 25, 'p_adx': 8, 'rsi_period': 23, 'ema1': 14, 'ema2': 27, 'slip_atr_k': 0.06273174839962603, 'slip_spread_k': 0.12117667942958982, 'spread_hl_frac': 0.010342863005175255, 'bb_std_mult': 1.67087801310989, 'rsi_os': 28, 'rsi_ob': 60, 'vol_spike': 0.02812909348479942, 'adx_thresh': 25.327470476594797, 'atr_min_pct': 0.023077116791507347, 'atr_max_pct': 0.12245483424813472, 'tp_mult': 2.5153753814820945, 'tsl_mult': 0.8874650558493047, 'strategy': 'breakout', 'time_stop': 172, 'use_sma': False, 'use_atr': False, 'use_adx': False, 'use_ema': False, 'use_spike': True, 'rsi_required': False, 'edge_k': 1.4631526372462333, 'edge_cap': 0.9996170008051424, 'bull_strategy': 'mean_reversion', 'bull_bb_std_mult': 3.450036391017583, 'bull_rsi_os': 14, 'bull_rsi_ob': 78, 'bull_adx_thresh': 5.0447225949207315, 'bull_atr_min_pct': 0.011622540072504822, 'bull_atr_max_pct': 0.050939590583645826, 'bull_tp_mult': 1.6263577367201776, 'bull_tsl_mult': 0.8792556267027973, 'bull_time_stop': 138, 'bull_use_sma': False, 'bull_use_ema': False, 'bull_use_atr': True, 'bull_use_adx': True, 'bull_use_spike': False, 'bull_rsi_required': True, 'bear_strategy': 'mean_reversion', 'bear_bb_std_mult': 0.9031618323967733, 'bear_rsi_os': 19, 'bear_rsi_ob': 46, 'bear_adx_thresh': 5.869116818327139, 'bear_atr_min_pct': 0.02606801254472405, 'bear_atr_max_pct': 0.040882888392516865, 'bear_tp_mult': 2.736666476736549, 'bear_tsl_mult': 0.3014040317312845, 'bear_time_stop': 195, 'bear_use_sma': True, 'bear_use_ema': True, 'bear_use_atr': True, 'bear_use_adx': True, 'bear_use_spike': True, 'bear_rsi_required': True, 'sideways_strategy': 'mean_reversion', 'sideways_bb_std_mult': 0.5192047859173414, 'sideways_rsi_os': 12, 'sideways_rsi_ob': 55, 'sideways_adx_thresh': 11.472471093822435, 'sideways_atr_min_pct': 0.014533533659810806, 'sideways_atr_max_pct': 0.11415059985010297, 'sideways_tp_mult': 1.946812419011326, 'sideways_tsl_mult': 0.616357615083231, 'sideways_time_stop': 66, 'sideways_use_sma': False, 'sideways_use_ema': False, 'sideways_use_atr': False, 'sideways_use_adx': True, 'sideways_use_spike': True, 'sideways_rsi_required': True}.
[I 2025-08-31 03:56:34,116] Trial 192 finished with values: [-1000000000.0, 1000000000.0] and parameters: {'p_sma': 54, 'p_std': 18, 'p_atr': 24, 'p_adx': 8, 'rsi_period': 22, 'ema1': 13, 'ema2': 26, 'slip_atr_k': 0.022389243997107806, 'slip_spread_k': 0.08521731196731037, 'spread_hl_frac': 0.00999839795341416, 'bb_std_mult': 1.8553446135394023, 'rsi_os': 29, 'rsi_ob': 56, 'vol_spike': 0.028385702005167348, 'adx_thresh': 11.901674113502501, 'atr_min_pct': 0.01510175627113914, 'atr_max_pct': 0.10906816534484445, 'tp_mult': 2.6446616883800846, 'tsl_mult': 0.8852600813664528, 'strategy': 'breakout', 'time_stop': 46, 'use_sma': True, 'use_atr': False, 'use_adx': False, 'use_ema': False, 'use_spike': True, 'rsi_required': False, 'edge_k': 1.3314587286964108, 'edge_cap': 0.9993591533889216, 'bull_strategy': 'mean_reversion', 'bull_bb_std_mult': 3.496089587097972, 'bull_rsi_os': 12, 'bull_rsi_ob': 77, 'bull_adx_thresh': 11.162508495701996, 'bull_atr_min_pct': 0.013434061379602315, 'bull_atr_max_pct': 0.022362615508312433, 'bull_tp_mult': 1.5960097316487674, 'bull_tsl_mult': 0.893829390728168, 'bull_time_stop': 127, 'bull_use_sma': False, 'bull_use_ema': False, 'bull_use_atr': False, 'bull_use_adx': True, 'bull_use_spike': False, 'bull_rsi_required': True, 'bear_strategy': 'mean_reversion', 'bear_bb_std_mult': 0.9292011186875049, 'bear_rsi_os': 8, 'bear_rsi_ob': 48, 'bear_adx_thresh': 19.0174987881458, 'bear_atr_min_pct': 0.026520901674216387, 'bear_atr_max_pct': 0.04045654155131346, 'bear_tp_mult': 2.738397960358248, 'bear_tsl_mult': 0.2562930872609738, 'bear_time_stop': 211, 'bear_use_sma': True, 'bear_use_ema': True, 'bear_use_atr': False, 'bear_use_adx': True, 'bear_use_spike': True, 'bear_rsi_required': True, 'sideways_strategy': 'mean_reversion', 'sideways_bb_std_mult': 1.0487176729251007, 'sideways_rsi_os': 37, 'sideways_rsi_ob': 54, 'sideways_adx_thresh': 11.168381506386577, 'sideways_atr_min_pct': 0.013848355525916496, 'sideways_atr_max_pct': 0.1177479480331637, 'sideways_tp_mult': 1.9889519064063583, 'sideways_tsl_mult': 0.6509409771490272, 'sideways_time_stop': 64, 'sideways_use_sma': False, 'sideways_use_ema': False, 'sideways_use_atr': False, 'sideways_use_adx': True, 'sideways_use_spike': True, 'sideways_rsi_required': True}.
[I 2025-08-31 03:56:34,346] Trial 190 finished with values: [-0.010553253592043288, 0.010497896276912567] and parameters: {'p_sma': 55, 'p_std': 16, 'p_atr': 24, 'p_adx': 8, 'rsi_period': 23, 'ema1': 14, 'ema2': 27, 'slip_atr_k': 0.018598239803518612, 'slip_spread_k': 0.08479738180703005, 'spread_hl_frac': 0.010563680274095264, 'bb_std_mult': 1.886041384866205, 'rsi_os': 29, 'rsi_ob': 60, 'vol_spike': 0.026354648613883286, 'adx_thresh': 25.495512014614658, 'atr_min_pct': 0.023730204439516612, 'atr_max_pct': 0.13624921774750204, 'tp_mult': 2.505862586922703, 'tsl_mult': 0.8721820771200023, 'strategy': 'breakout', 'time_stop': 178, 'use_sma': False, 'use_atr': False, 'use_adx': False, 'use_ema': False, 'use_spike': True, 'rsi_required': False, 'edge_k': 1.4747057721328711, 'edge_cap': 0.9977176500485966, 'bull_strategy': 'mean_reversion', 'bull_bb_std_mult': 3.2307170223768433, 'bull_rsi_os': 11, 'bull_rsi_ob': 76, 'bull_adx_thresh': 16.85882597382153, 'bull_atr_min_pct': 0.0019655911871017833, 'bull_atr_max_pct': 0.04444509538525713, 'bull_tp_mult': 1.5981959392134557, 'bull_tsl_mult': 0.870695184987343, 'bull_time_stop': 138, 'bull_use_sma': False, 'bull_use_ema': False, 'bull_use_atr': True, 'bull_use_adx': True, 'bull_use_spike': False, 'bull_rsi_required': True, 'bear_strategy': 'mean_reversion', 'bear_bb_std_mult': 0.9568371908509303, 'bear_rsi_os': 15, 'bear_rsi_ob': 48, 'bear_adx_thresh': 20.41729150621539, 'bear_atr_min_pct': 0.023721449843759627, 'bear_atr_max_pct': 0.04119748652541347, 'bear_tp_mult': 2.639648408168611, 'bear_tsl_mult': 0.2537486686728952, 'bear_time_stop': 195, 'bear_use_sma': True, 'bear_use_ema': True, 'bear_use_atr': False, 'bear_use_adx': False, 'bear_use_spike': True, 'bear_rsi_required': True, 'sideways_strategy': 'mean_reversion', 'sideways_bb_std_mult': 1.6608494866903698, 'sideways_rsi_os': 34, 'sideways_rsi_ob': 54, 'sideways_adx_thresh': 11.470279821717657, 'sideways_atr_min_pct': 0.013803665034399153, 'sideways_atr_max_pct': 0.11781607863289825, 'sideways_tp_mult': 2.006632022419191, 'sideways_tsl_mult': 0.674929914664878, 'sideways_time_stop': 65, 'sideways_use_sma': False, 'sideways_use_ema': False, 'sideways_use_atr': False, 'sideways_use_adx': True, 'sideways_use_spike': True, 'sideways_rsi_required': True}.
[I 2025-08-31 03:56:34,483] Trial 191 finished with values: [-1000000000.0, 1000000000.0] and parameters: {'p_sma': 47, 'p_std': 18, 'p_atr': 24, 'p_adx': 8, 'rsi_period': 22, 'ema1': 13, 'ema2': 27, 'slip_atr_k': 0.021121417732143495, 'slip_spread_k': 0.09054160926927887, 'spread_hl_frac': 0.015518902729328994, 'bb_std_mult': 1.9036631973956661, 'rsi_os': 29, 'rsi_ob': 60, 'vol_spike': 0.02648231601643136, 'adx_thresh': 11.9087466370797, 'atr_min_pct': 0.022969590722770678, 'atr_max_pct': 0.12425841025220428, 'tp_mult': 2.6246446746147734, 'tsl_mult': 0.8841057706854469, 'strategy': 'breakout', 'time_stop': 47, 'use_sma': False, 'use_atr': True, 'use_adx': False, 'use_ema': False, 'use_spike': True, 'rsi_required': False, 'edge_k': 1.3314027640039143, 'edge_cap': 0.9795427176814373, 'bull_strategy': 'mean_reversion', 'bull_bb_std_mult': 3.530533978025563, 'bull_rsi_os': 11, 'bull_rsi_ob': 77, 'bull_adx_thresh': 16.554583667637353, 'bull_atr_min_pct': 0.011367715797615568, 'bull_atr_max_pct': 0.020815520685059256, 'bull_tp_mult': 1.6022111382897146, 'bull_tsl_mult': 0.8859138128757534, 'bull_time_stop': 129, 'bull_use_sma': False, 'bull_use_ema': False, 'bull_use_atr': True, 'bull_use_adx': True, 'bull_use_spike': False, 'bull_rsi_required': True, 'bear_strategy': 'mean_reversion', 'bear_bb_std_mult': 0.9284195660716351, 'bear_rsi_os': 5, 'bear_rsi_ob': 48, 'bear_adx_thresh': 19.205715791045503, 'bear_atr_min_pct': 0.02661498794570738, 'bear_atr_max_pct': 0.04067728360716131, 'bear_tp_mult': 2.741104115673632, 'bear_tsl_mult': 0.2605058102299986, 'bear_time_stop': 219, 'bear_use_sma': True, 'bear_use_ema': True, 'bear_use_atr': False, 'bear_use_adx': True, 'bear_use_spike': True, 'bear_rsi_required': True, 'sideways_strategy': 'mean_reversion', 'sideways_bb_std_mult': 1.0657476834492627, 'sideways_rsi_os': 36, 'sideways_rsi_ob': 53, 'sideways_adx_thresh': 11.688348199283821, 'sideways_atr_min_pct': 0.012019313758034658, 'sideways_atr_max_pct': 0.11901658378501827, 'sideways_tp_mult': 1.974307829009269, 'sideways_tsl_mult': 0.661963388834599, 'sideways_time_stop': 64, 'sideways_use_sma': False, 'sideways_use_ema': False, 'sideways_use_atr': False, 'sideways_use_adx': True, 'sideways_use_spike': True, 'sideways_rsi_required': True}.
[I 2025-08-31 03:57:10,778] Trial 194 finished with values: [-1000000000.0, 1000000000.0] and parameters: {'p_sma': 53, 'p_std': 16, 'p_atr': 24, 'p_adx': 9, 'rsi_period': 21, 'ema1': 13, 'ema2': 28, 'slip_atr_k': 0.019811861003506168, 'slip_spread_k': 0.06714200702289656, 'spread_hl_frac': 0.00691342801357713, 'bb_std_mult': 1.895660911025859, 'rsi_os': 31, 'rsi_ob': 60, 'vol_spike': 0.03784885085931152, 'adx_thresh': 10.770381353262986, 'atr_min_pct': 0.005316113818687974, 'atr_max_pct': 0.09463584634218161, 'tp_mult': 2.5957784458042266, 'tsl_mult': 0.8644805051585651, 'strategy': 'breakout', 'time_stop': 44, 'use_sma': False, 'use_atr': True, 'use_adx': False, 'use_ema': False, 'use_spike': True, 'rsi_required': False, 'edge_k': 1.3995190910676598, 'edge_cap': 0.9788561463251237, 'bull_strategy': 'mean_reversion', 'bull_bb_std_mult': 3.3524559523701902, 'bull_rsi_os': 11, 'bull_rsi_ob': 71, 'bull_adx_thresh': 9.930427948091417, 'bull_atr_min_pct': 0.015099452943949829, 'bull_atr_max_pct': 0.07764747342754677, 'bull_tp_mult': 1.671824375688257, 'bull_tsl_mult': 0.8703562261473191, 'bull_time_stop': 127, 'bull_use_sma': False, 'bull_use_ema': False, 'bull_use_atr': True, 'bull_use_adx': True, 'bull_use_spike': False, 'bull_rsi_required': True, 'bear_strategy': 'mean_reversion', 'bear_bb_std_mult': 0.8505934901045762, 'bear_rsi_os': 6, 'bear_rsi_ob': 48, 'bear_adx_thresh': 20.29492380014972, 'bear_atr_min_pct': 0.02165879561483261, 'bear_atr_max_pct': 0.034986949279796176, 'bear_tp_mult': 2.782796512766397, 'bear_tsl_mult': 0.24004210968231246, 'bear_time_stop': 200, 'bear_use_sma': True, 'bear_use_ema': True, 'bear_use_atr': True, 'bear_use_adx': True, 'bear_use_spike': True, 'bear_rsi_required': True, 'sideways_strategy': 'mean_reversion', 'sideways_bb_std_mult': 0.8057888337344059, 'sideways_rsi_os': 34, 'sideways_rsi_ob': 52, 'sideways_adx_thresh': 12.436267594980764, 'sideways_atr_min_pct': 0.013958656375051162, 'sideways_atr_max_pct': 0.10954296127461172, 'sideways_tp_mult': 2.058031541846684, 'sideways_tsl_mult': 0.6900317899912407, 'sideways_time_stop': 56, 'sideways_use_sma': False, 'sideways_use_ema': False, 'sideways_use_atr': False, 'sideways_use_adx': True, 'sideways_use_spike': True, 'sideways_rsi_required': True}.
[I 2025-08-31 03:57:11,058] Trial 195 finished with values: [-1000000000.0, 1000000000.0] and parameters: {'p_sma': 47, 'p_std': 16, 'p_atr': 24, 'p_adx': 9, 'rsi_period': 22, 'ema1': 13, 'ema2': 28, 'slip_atr_k': 0.020755371624632667, 'slip_spread_k': 0.07105845326057926, 'spread_hl_frac': 0.008936760200250493, 'bb_std_mult': 1.9137875234411812, 'rsi_os': 31, 'rsi_ob': 60, 'vol_spike': 0.03714219220766936, 'adx_thresh': 11.05856174289117, 'atr_min_pct': 0.023974458241929033, 'atr_max_pct': 0.09365922234494893, 'tp_mult': 2.5921063174210768, 'tsl_mult': 0.8734614811977734, 'strategy': 'breakout', 'time_stop': 56, 'use_sma': False, 'use_atr': False, 'use_adx': False, 'use_ema': False, 'use_spike': True, 'rsi_required': False, 'edge_k': 1.4114246596982993, 'edge_cap': 0.9785254095632001, 'bull_strategy': 'mean_reversion', 'bull_bb_std_mult': 3.3697432986971005, 'bull_rsi_os': 11, 'bull_rsi_ob': 78, 'bull_adx_thresh': 9.610337706835233, 'bull_atr_min_pct': 0.0032733718804105983, 'bull_atr_max_pct': 0.04482907603764694, 'bull_tp_mult': 1.5264902303342114, 'bull_tsl_mult': 0.8762986765176864, 'bull_time_stop': 127, 'bull_use_sma': False, 'bull_use_ema': False, 'bull_use_atr': True, 'bull_use_adx': True, 'bull_use_spike': False, 'bull_rsi_required': True, 'bear_strategy': 'mean_reversion', 'bear_bb_std_mult': 0.8454859033037914, 'bear_rsi_os': 6, 'bear_rsi_ob': 49, 'bear_adx_thresh': 20.325453829410222, 'bear_atr_min_pct': 0.023152894248182298, 'bear_atr_max_pct': 0.03392893381239342, 'bear_tp_mult': 2.78674158372652, 'bear_tsl_mult': 0.25433012298200314, 'bear_time_stop': 219, 'bear_use_sma': True, 'bear_use_ema': True, 'bear_use_atr': False, 'bear_use_adx': True, 'bear_use_spike': True, 'bear_rsi_required': True, 'sideways_strategy': 'mean_reversion', 'sideways_bb_std_mult': 0.8664752451394129, 'sideways_rsi_os': 34, 'sideways_rsi_ob': 52, 'sideways_adx_thresh': 12.119933633105564, 'sideways_atr_min_pct': 0.013752807984826023, 'sideways_atr_max_pct': 0.11888914834070649, 'sideways_tp_mult': 2.0427320494791723, 'sideways_tsl_mult': 0.6693026031822513, 'sideways_time_stop': 73, 'sideways_use_sma': False, 'sideways_use_ema': False, 'sideways_use_atr': False, 'sideways_use_adx': True, 'sideways_use_spike': True, 'sideways_rsi_required': True}.
[I 2025-08-31 03:57:11,257] Trial 196 finished with values: [-1000000000.0, 1000000000.0] and parameters: {'p_sma': 38, 'p_std': 17, 'p_atr': 24, 'p_adx': 9, 'rsi_period': 26, 'ema1': 12, 'ema2': 30, 'slip_atr_k': 0.016921179350002327, 'slip_spread_k': 0.059047724207355545, 'spread_hl_frac': 0.009016523245966489, 'bb_std_mult': 1.8878554312345843, 'rsi_os': 31, 'rsi_ob': 59, 'vol_spike': 0.038565831149689256, 'adx_thresh': 11.270429171139408, 'atr_min_pct': 0.023759539252340804, 'atr_max_pct': 0.11851038271097944, 'tp_mult': 2.593367957037504, 'tsl_mult': 0.8620201710860298, 'strategy': 'breakout', 'time_stop': 58, 'use_sma': False, 'use_atr': False, 'use_adx': False, 'use_ema': False, 'use_spike': True, 'rsi_required': False, 'edge_k': 1.3959076215593211, 'edge_cap': 0.9735636665425359, 'bull_strategy': 'mean_reversion', 'bull_bb_std_mult': 3.3522457733262736, 'bull_rsi_os': 9, 'bull_rsi_ob': 76, 'bull_adx_thresh': 10.224895108650918, 'bull_atr_min_pct': 0.0032259476033876526, 'bull_atr_max_pct': 0.04475559341619706, 'bull_tp_mult': 1.6672375097848, 'bull_tsl_mult': 0.10378822918479669, 'bull_time_stop': 140, 'bull_use_sma': False, 'bull_use_ema': False, 'bull_use_atr': True, 'bull_use_adx': True, 'bull_use_spike': False, 'bull_rsi_required': True, 'bear_strategy': 'mean_reversion', 'bear_bb_std_mult': 0.8467504218365332, 'bear_rsi_os': 11, 'bear_rsi_ob': 45, 'bear_adx_thresh': 19.76502821244769, 'bear_atr_min_pct': 0.022423725696058522, 'bear_atr_max_pct': 0.0347720111428831, 'bear_tp_mult': 2.7924996668036948, 'bear_tsl_mult': 0.24595303552241016, 'bear_time_stop': 197, 'bear_use_sma': True, 'bear_use_ema': True, 'bear_use_atr': True, 'bear_use_adx': True, 'bear_use_spike': True, 'bear_rsi_required': True, 'sideways_strategy': 'mean_reversion', 'sideways_bb_std_mult': 0.866886221062287, 'sideways_rsi_os': 33, 'sideways_rsi_ob': 52, 'sideways_adx_thresh': 12.32113952162004, 'sideways_atr_min_pct': 0.01360547393020453, 'sideways_atr_max_pct': 0.10996686566077254, 'sideways_tp_mult': 2.03824812912651, 'sideways_tsl_mult': 0.6837657832002783, 'sideways_time_stop': 56, 'sideways_use_sma': False, 'sideways_use_ema': False, 'sideways_use_atr': False, 'sideways_use_adx': True, 'sideways_use_spike': True, 'sideways_rsi_required': True}.
[I 2025-08-31 03:57:11,415] Trial 193 finished with values: [-1000000000.0, 1000000000.0] and parameters: {'p_sma': 53, 'p_std': 16, 'p_atr': 24, 'p_adx': 9, 'rsi_period': 21, 'ema1': 13, 'ema2': 24, 'slip_atr_k': 0.015723839499615002, 'slip_spread_k': 0.08717812226316614, 'spread_hl_frac': 0.013738460093134472, 'bb_std_mult': 1.8977500129071159, 'rsi_os': 30, 'rsi_ob': 60, 'vol_spike': 0.03746259681083447, 'adx_thresh': 10.585877242661288, 'atr_min_pct': 0.023841507861127074, 'atr_max_pct': 0.09600759684271581, 'tp_mult': 2.5942978192778603, 'tsl_mult': 0.8667198648113289, 'strategy': 'breakout', 'time_stop': 57, 'use_sma': False, 'use_atr': True, 'use_adx': False, 'use_ema': False, 'use_spike': True, 'rsi_required': False, 'edge_k': 1.3972980660439096, 'edge_cap': 0.9751648118439771, 'bull_strategy': 'mean_reversion', 'bull_bb_std_mult': 3.3534052099770646, 'bull_rsi_os': 11, 'bull_rsi_ob': 76, 'bull_adx_thresh': 9.962456731983089, 'bull_atr_min_pct': 0.0155358530470906, 'bull_atr_max_pct': 0.06675179793890088, 'bull_tp_mult': 1.669663046281912, 'bull_tsl_mult': 0.1017753725621009, 'bull_time_stop': 129, 'bull_use_sma': False, 'bull_use_ema': False, 'bull_use_atr': True, 'bull_use_adx': True, 'bull_use_spike': False, 'bull_rsi_required': True, 'bear_strategy': 'mean_reversion', 'bear_bb_std_mult': 0.9689837489271316, 'bear_rsi_os': 6, 'bear_rsi_ob': 48, 'bear_adx_thresh': 20.257468578251363, 'bear_atr_min_pct': 0.023426921162899572, 'bear_atr_max_pct': 0.03472276755165027, 'bear_tp_mult': 2.7797977691350773, 'bear_tsl_mult': 0.2471673889685844, 'bear_time_stop': 197, 'bear_use_sma': True, 'bear_use_ema': True, 'bear_use_atr': True, 'bear_use_adx': True, 'bear_use_spike': True, 'bear_rsi_required': True, 'sideways_strategy': 'mean_reversion', 'sideways_bb_std_mult': 0.8388950958926433, 'sideways_rsi_os': 33, 'sideways_rsi_ob': 52, 'sideways_adx_thresh': 12.192964019240643, 'sideways_atr_min_pct': 0.01354827775086602, 'sideways_atr_max_pct': 0.10973437448721456, 'sideways_tp_mult': 2.039926085816625, 'sideways_tsl_mult': 0.6760760765147337, 'sideways_time_stop': 56, 'sideways_use_sma': False, 'sideways_use_ema': False, 'sideways_use_atr': False, 'sideways_use_adx': True, 'sideways_use_spike': True, 'sideways_rsi_required': True}.
[I 2025-08-31 03:57:44,494] Trial 200 finished with values: [-1000000000.0, 1000000000.0] and parameters: {'p_sma': 44, 'p_std': 38, 'p_atr': 23, 'p_adx': 7, 'rsi_period': 77, 'ema1': 14, 'ema2': 23, 'slip_atr_k': 0.03380445245443642, 'slip_spread_k': 0.13773554431263707, 'spread_hl_frac': 0.011569914407551401, 'bb_std_mult': 1.8172960999954153, 'rsi_os': 27, 'rsi_ob': 62, 'vol_spike': 0.22204523525292255, 'adx_thresh': 9.816554635556534, 'atr_min_pct': 0.022734262800433724, 'atr_max_pct': 0.11250140159749096, 'tp_mult': 2.496181181798471, 'tsl_mult': 0.8976095753264326, 'strategy': 'breakout', 'time_stop': 38, 'use_sma': True, 'use_atr': False, 'use_adx': False, 'use_ema': False, 'use_spike': True, 'rsi_required': False, 'edge_k': 1.4586541740807228, 'edge_cap': 0.9496782508869468, 'bull_strategy': 'mean_reversion', 'bull_bb_std_mult': 3.202896734374243, 'bull_rsi_os': 13, 'bull_rsi_ob': 78, 'bull_adx_thresh': 10.921117794270083, 'bull_atr_min_pct': 0.0019990627538821752, 'bull_atr_max_pct': 0.029185695152091455, 'bull_tp_mult': 1.5497744324959768, 'bull_tsl_mult': 0.9094227334555, 'bull_time_stop': 119, 'bull_use_sma': False, 'bull_use_ema': False, 'bull_use_atr': False, 'bull_use_adx': True, 'bull_use_spike': False, 'bull_rsi_required': True, 'bear_strategy': 'mean_reversion', 'bear_bb_std_mult': 1.0025120024627348, 'bear_rsi_os': 13, 'bear_rsi_ob': 46, 'bear_adx_thresh': 19.61672477765873, 'bear_atr_min_pct': 0.024242822975154156, 'bear_atr_max_pct': 0.049369862482660724, 'bear_tp_mult': 2.889092951903984, 'bear_tsl_mult': 0.19266882429937957, 'bear_time_stop': 209, 'bear_use_sma': True, 'bear_use_ema': True, 'bear_use_atr': True, 'bear_use_adx': True, 'bear_use_spike': True, 'bear_rsi_required': True, 'sideways_strategy': 'mean_reversion', 'sideways_bb_std_mult': 0.6829687317306645, 'sideways_rsi_os': 27, 'sideways_rsi_ob': 54, 'sideways_adx_thresh': 9.82103045558491, 'sideways_atr_min_pct': 0.01273203873680609, 'sideways_atr_max_pct': 0.11519794273803975, 'sideways_tp_mult': 1.923303775612055, 'sideways_tsl_mult': 0.575849671285473, 'sideways_time_stop': 72, 'sideways_use_sma': False, 'sideways_use_ema': False, 'sideways_use_atr': False, 'sideways_use_adx': True, 'sideways_use_spike': True, 'sideways_rsi_required': True}.
