[I 2025-08-31 03:49:36,316] Trial 135 finished with values: [-0.014228688894447838, 0.014180348610623852] and parameters: {'p_sma': 60, 'p_std': 14, 'p_atr': 24, 'p_adx': 9, 'rsi_period': 61, 'ema1': 16, 'ema2': 43, 'slip_atr_k': 0.2065975607880777, 'slip_spread_k': 0.48408969524174983, 'spread_hl_frac': 0.02259667679582826, 'bb_std_mult': 0.7572941494737716, 'rsi_os': 49, 'rsi_ob': 90, 'vol_spike': 0.026107370119202555, 'adx_thresh': 24.647207567334217, 'atr_min_pct': 0.020800652172504167, 'atr_max_pct': 0.14635456063862334, 'tp_mult': 1.3655987820117343, 'tsl_mult': 0.26383701964452005, 'strategy': 'breakout', 'time_stop': 86, 'use_sma': False, 'use_atr': False, 'use_adx': False, 'use_ema': True, 'use_spike': False, 'rsi_required': False, 'edge_k': 0.29555891001312307, 'edge_cap': 0.9140085512792118, 'bull_strategy': 'breakout', 'bull_bb_std_mult': 0.9668871848447844, 'bull_rsi_os': 14, 'bull_rsi_ob': 87, 'bull_adx_thresh': 19.373017276446397, 'bull_atr_min_pct': 4.116844748824574e-06, 'bull_atr_max_pct': 0.12626397638852582, 'bull_tp_mult': 1.954127726811618, 'bull_tsl_mult': 0.504266479800018, 'bull_time_stop': 190, 'bull_use_sma': False, 'bull_use_ema': False, 'bull_use_atr': True, 'bull_use_adx': True, 'bull_use_spike': True, 'bull_rsi_required': False, 'bear_strategy': 'mean_reversion', 'bear_bb_std_mult': 3.5922554087527945, 'bear_rsi_os': 32, 'bear_rsi_ob': 59, 'bear_adx_thresh': 20.812077958898954, 'bear_atr_min_pct': 0.01035263905115362, 'bear_atr_max_pct': 0.14863953214181017, 'bear_tp_mult': 2.6515395976168135, 'bear_tsl_mult': 0.7764315033648603, 'bear_time_stop': 206, 'bear_use_sma': True, 'bear_use_ema': True, 'bear_use_atr': True, 'bear_use_adx': False, 'bear_use_spike': True, 'bear_rsi_required': False, 'sideways_strategy': 'mean_reversion', 'sideways_bb_std_mult': 2.249477481180417, 'sideways_rsi_os': 50, 'sideways_rsi_ob': 82, 'sideways_adx_thresh': 23.698011597838217, 'sideways_atr_min_pct': 0.006154424462935463, 'sideways_atr_max_pct': 0.014355301849921981, 'sideways_tp_mult': 2.7998100350453323, 'sideways_tsl_mult': 0.1968931246937112, 'sideways_time_stop': 298, 'sideways_use_sma': True, 'sideways_use_ema': False, 'sideways_use_atr': False, 'sideways_use_adx': True, 'sideways_use_spike': True, 'sideways_rsi_required': True}.
[I 2025-08-31 03:49:36,394] Trial 134 finished with values: [-0.01408834162328676, 0.014025040844221076] and parameters: {'p_sma': 60, 'p_std': 14, 'p_atr': 22, 'p_adx': 9, 'rsi_period': 64, 'ema1': 25, 'ema2': 43, 'slip_atr_k': 0.2038738148579548, 'slip_spread_k': 0.49511019278927054, 'spread_hl_frac': 0.02328992536094489, 'bb_std_mult': 0.6176512730604259, 'rsi_os': 12, 'rsi_ob': 89, 'vol_spike': 0.031925452686535835, 'adx_thresh': 32.29762707888235, 'atr_min_pct': 0.020703340416760786, 'atr_max_pct': 0.14953652075340418, 'tp_mult': 1.3659123575550771, 'tsl_mult': 0.25408606981674203, 'strategy': 'breakout', 'time_stop': 118, 'use_sma': True, 'use_atr': False, 'use_adx': False, 'use_ema': False, 'use_spike': True, 'rsi_required': False, 'edge_k': 1.4591779189560983, 'edge_cap': 0.6900542880861357, 'bull_strategy': 'breakout', 'bull_bb_std_mult': 0.9346786788872865, 'bull_rsi_os': 15, 'bull_rsi_ob': 87, 'bull_adx_thresh': 22.37471877454166, 'bull_atr_min_pct': 0.0002432123476803257, 'bull_atr_max_pct': 0.11334795407991334, 'bull_tp_mult': 1.5558592626479983, 'bull_tsl_mult': 0.510009038750737, 'bull_time_stop': 216, 'bull_use_sma': False, 'bull_use_ema': False, 'bull_use_atr': False, 'bull_use_adx': True, 'bull_use_spike': False, 'bull_rsi_required': False, 'bear_strategy': 'mean_reversion', 'bear_bb_std_mult': 3.4973571124426797, 'bear_rsi_os': 34, 'bear_rsi_ob': 59, 'bear_adx_thresh': 22.39351373771467, 'bear_atr_min_pct': 0.014267570326907082, 'bear_atr_max_pct': 0.14898045268225332, 'bear_tp_mult': 2.3727969690966835, 'bear_tsl_mult': 0.7638810163418335, 'bear_time_stop': 207, 'bear_use_sma': True, 'bear_use_ema': True, 'bear_use_atr': True, 'bear_use_adx': True, 'bear_use_spike': True, 'bear_rsi_required': False, 'sideways_strategy': 'mean_reversion', 'sideways_bb_std_mult': 2.1327218137558512, 'sideways_rsi_os': 50, 'sideways_rsi_ob': 82, 'sideways_adx_thresh': 23.865295373081636, 'sideways_atr_min_pct': 0.0021249072763766426, 'sideways_atr_max_pct': 0.014912149763500597, 'sideways_tp_mult': 2.794735413948446, 'sideways_tsl_mult': 0.056077030352037927, 'sideways_time_stop': 295, 'sideways_use_sma': True, 'sideways_use_ema': False, 'sideways_use_atr': False, 'sideways_use_adx': False, 'sideways_use_spike': True, 'sideways_rsi_required': True}.
[I 2025-08-31 03:50:07,154] Trial 139 finished with values: [-0.01403053412625499, 0.01398229997027049] and parameters: {'p_sma': 59, 'p_std': 14, 'p_atr': 24, 'p_adx': 10, 'rsi_period': 54, 'ema1': 16, 'ema2': 43, 'slip_atr_k': 0.19355357694772457, 'slip_spread_k': 0.4566937094120978, 'spread_hl_frac': 0.04625381205057128, 'bb_std_mult': 2.2234099086413366, 'rsi_os': 9, 'rsi_ob': 86, 'vol_spike': 0.018977788283069147, 'adx_thresh': 25.440781145361402, 'atr_min_pct': 0.023831633604158534, 'atr_max_pct': 0.14538443106321852, 'tp_mult': 1.3694516893831545, 'tsl_mult': 0.3075684418308257, 'strategy': 'breakout', 'time_stop': 115, 'use_sma': False, 'use_atr': False, 'use_adx': False, 'use_ema': True, 'use_spike': False, 'rsi_required': False, 'edge_k': 0.2965135815599434, 'edge_cap': 0.8745443407744524, 'bull_strategy': 'breakout', 'bull_bb_std_mult': 0.9267104683636926, 'bull_rsi_os': 15, 'bull_rsi_ob': 84, 'bull_adx_thresh': 22.358812779507787, 'bull_atr_min_pct': 0.00019255780052212227, 'bull_atr_max_pct': 0.12582699622179494, 'bull_tp_mult': 1.8584903498455216, 'bull_tsl_mult': 0.4801950265709381, 'bull_time_stop': 187, 'bull_use_sma': False, 'bull_use_ema': False, 'bull_use_atr': True, 'bull_use_adx': True, 'bull_use_spike': True, 'bull_rsi_required': False, 'bear_strategy': 'mean_reversion', 'bear_bb_std_mult': 3.2485426804627893, 'bear_rsi_os': 32, 'bear_rsi_ob': 60, 'bear_adx_thresh': 23.99895368580923, 'bear_atr_min_pct': 0.008160655165271527, 'bear_atr_max_pct': 0.14415985207414167, 'bear_tp_mult': 2.569147174930018, 'bear_tsl_mult': 0.7900070939174345, 'bear_time_stop': 159, 'bear_use_sma': True, 'bear_use_ema': True, 'bear_use_atr': True, 'bear_use_adx': False, 'bear_use_spike': True, 'bear_rsi_required': True, 'sideways_strategy': 'mean_reversion', 'sideways_bb_std_mult': 2.229942359258903, 'sideways_rsi_os': 51, 'sideways_rsi_ob': 83, 'sideways_adx_thresh': 24.286386887822907, 'sideways_atr_min_pct': 0.009628914216180305, 'sideways_atr_max_pct': 0.013796797231618113, 'sideways_tp_mult': 2.714729433302917, 'sideways_tsl_mult': 0.058731550460892235, 'sideways_time_stop': 290, 'sideways_use_sma': True, 'sideways_use_ema': False, 'sideways_use_atr': False, 'sideways_use_adx': True, 'sideways_use_spike': True, 'sideways_rsi_required': True}.
[I 2025-08-31 03:50:07,155] Trial 137 finished with values: [-0.014035166560627976, 0.013971507231144212] and parameters: {'p_sma': 59, 'p_std': 14, 'p_atr': 24, 'p_adx': 9, 'rsi_period': 36, 'ema1': 16, 'ema2': 42, 'slip_atr_k': 0.19051105062851084, 'slip_spread_k': 0.45180379578563673, 'spread_hl_frac': 0.021533066165229434, 'bb_std_mult': 0.7700690163023817, 'rsi_os': 12, 'rsi_ob': 91, 'vol_spike': 0.023704144529029865, 'adx_thresh': 25.653018614949474, 'atr_min_pct': 0.023523072982498568, 'atr_max_pct': 0.1498686483906535, 'tp_mult': 1.4035517592965143, 'tsl_mult': 0.2981210381703724, 'strategy': 'breakout', 'time_stop': 113, 'use_sma': False, 'use_atr': False, 'use_adx': False, 'use_ema': True, 'use_spike': False, 'rsi_required': False, 'edge_k': 0.29737652312690277, 'edge_cap': 0.7812261154098942, 'bull_strategy': 'breakout', 'bull_bb_std_mult': 0.970756694554938, 'bull_rsi_os': 17, 'bull_rsi_ob': 85, 'bull_adx_thresh': 22.408267020460592, 'bull_atr_min_pct': 2.5737801343505727e-05, 'bull_atr_max_pct': 0.120469387091642, 'bull_tp_mult': 1.896400990332181, 'bull_tsl_mult': 0.4964228788000979, 'bull_time_stop': 194, 'bull_use_sma': False, 'bull_use_ema': False, 'bull_use_atr': True, 'bull_use_adx': True, 'bull_use_spike': True, 'bull_rsi_required': False, 'bear_strategy': 'mean_reversion', 'bear_bb_std_mult': 3.47696874322758, 'bear_rsi_os': 32, 'bear_rsi_ob': 60, 'bear_adx_thresh': 23.898198658104313, 'bear_atr_min_pct': 0.013977158612667125, 'bear_atr_max_pct': 0.14649018168425038, 'bear_tp_mult': 2.3719271236567323, 'bear_tsl_mult': 0.7681087488221309, 'bear_time_stop': 170, 'bear_use_sma': True, 'bear_use_ema': True, 'bear_use_atr': True, 'bear_use_adx': False, 'bear_use_spike': True, 'bear_rsi_required': True, 'sideways_strategy': 'mean_reversion', 'sideways_bb_std_mult': 2.2187613419107817, 'sideways_rsi_os': 47, 'sideways_rsi_ob': 81, 'sideways_adx_thresh': 23.63496277192807, 'sideways_atr_min_pct': 0.005688204172463809, 'sideways_atr_max_pct': 0.015322718455511785, 'sideways_tp_mult': 2.7972002533322033, 'sideways_tsl_mult': 0.31308745595946275, 'sideways_time_stop': 296, 'sideways_use_sma': True, 'sideways_use_ema': False, 'sideways_use_atr': False, 'sideways_use_adx': True, 'sideways_use_spike': True, 'sideways_rsi_required': True}.
[I 2025-08-31 03:50:07,155] Trial 140 finished with values: [-1000000000.0, 1000000000.0] and parameters: {'p_sma': 59, 'p_std': 9, 'p_atr': 23, 'p_adx': 26, 'rsi_period': 63, 'ema1': 25, 'ema2': 45, 'slip_atr_k': 0.22063844184283654, 'slip_spread_k': 0.4527919285544305, 'spread_hl_frac': 0.02284149240989956, 'bb_std_mult': 0.6295458700045049, 'rsi_os': 14, 'rsi_ob': 91, 'vol_spike': 0.02178918652246034, 'adx_thresh': 32.10512457262325, 'atr_min_pct': 0.01638200510524309, 'atr_max_pct': 0.14466104899304483, 'tp_mult': 1.383734934062335, 'tsl_mult': 0.2897670793239172, 'strategy': 'breakout', 'time_stop': 118, 'use_sma': True, 'use_atr': False, 'use_adx': False, 'use_ema': False, 'use_spike': True, 'rsi_required': False, 'edge_k': 1.471364591594432, 'edge_cap': 0.7063489931043189, 'bull_strategy': 'breakout', 'bull_bb_std_mult': 0.9981548472234607, 'bull_rsi_os': 17, 'bull_rsi_ob': 84, 'bull_adx_thresh': 22.469886810798105, 'bull_atr_min_pct': 0.00018245758822861365, 'bull_atr_max_pct': 0.10024316168252581, 'bull_tp_mult': 1.563059821476837, 'bull_tsl_mult': 0.5510734567463577, 'bull_time_stop': 218, 'bull_use_sma': False, 'bull_use_ema': False, 'bull_use_atr': False, 'bull_use_adx': True, 'bull_use_spike': False, 'bull_rsi_required': False, 'bear_strategy': 'mean_reversion', 'bear_bb_std_mult': 3.4972259697032166, 'bear_rsi_os': 34, 'bear_rsi_ob': 55, 'bear_adx_thresh': 23.831550973293208, 'bear_atr_min_pct': 0.014195389901003334, 'bear_atr_max_pct': 0.14304243876480296, 'bear_tp_mult': 2.3586651204273914, 'bear_tsl_mult': 0.7738069404925627, 'bear_time_stop': 250, 'bear_use_sma': True, 'bear_use_ema': True, 'bear_use_atr': True, 'bear_use_adx': True, 'bear_use_spike': True, 'bear_rsi_required': True, 'sideways_strategy': 'mean_reversion', 'sideways_bb_std_mult': 2.25678797103533, 'sideways_rsi_os': 49, 'sideways_rsi_ob': 82, 'sideways_adx_thresh': 22.101902992429082, 'sideways_atr_min_pct': 0.0022339498328201885, 'sideways_atr_max_pct': 0.022948986493227175, 'sideways_tp_mult': 2.8552281725321267, 'sideways_tsl_mult': 0.0008498073790249236, 'sideways_time_stop': 294, 'sideways_use_sma': True, 'sideways_use_ema': False, 'sideways_use_atr': False, 'sideways_use_adx': True, 'sideways_use_spike': True, 'sideways_rsi_required': True}.
[I 2025-08-31 03:50:07,275] Trial 138 finished with values: [-0.013941300690700542, 0.013886534903024203] and parameters: {'p_sma': 59, 'p_std': 14, 'p_atr': 23, 'p_adx': 10, 'rsi_period': 35, 'ema1': 16, 'ema2': 42, 'slip_atr_k': 0.1927416391349072, 'slip_spread_k': 0.4548019603991236, 'spread_hl_frac': 0.02302395159699797, 'bb_std_mult': 0.7541533562874441, 'rsi_os': 9, 'rsi_ob': 86, 'vol_spike': 0.021958054230824385, 'adx_thresh': 25.272976729669914, 'atr_min_pct': 0.023953083779400097, 'atr_max_pct': 0.14996349174376833, 'tp_mult': 1.3865978654469866, 'tsl_mult': 0.2956962568925945, 'strategy': 'breakout', 'time_stop': 117, 'use_sma': False, 'use_atr': False, 'use_adx': False, 'use_ema': True, 'use_spike': False, 'rsi_required': False, 'edge_k': 1.6516064935722037, 'edge_cap': 0.8200655614305319, 'bull_strategy': 'breakout', 'bull_bb_std_mult': 0.9731151504282185, 'bull_rsi_os': 17, 'bull_rsi_ob': 89, 'bull_adx_thresh': 22.23551884806358, 'bull_atr_min_pct': 1.8034879872442914e-05, 'bull_atr_max_pct': 0.11882953177242454, 'bull_tp_mult': 1.8694319261086965, 'bull_tsl_mult': 0.5475013594422928, 'bull_time_stop': 186, 'bull_use_sma': False, 'bull_use_ema': False, 'bull_use_atr': True, 'bull_use_adx': True, 'bull_use_spike': True, 'bull_rsi_required': False, 'bear_strategy': 'mean_reversion', 'bear_bb_std_mult': 3.2426321661048405, 'bear_rsi_os': 32, 'bear_rsi_ob': 60, 'bear_adx_thresh': 20.62017002375038, 'bear_atr_min_pct': 0.012179810376636756, 'bear_atr_max_pct': 0.1254602892611383, 'bear_tp_mult': 2.3726063801837123, 'bear_tsl_mult': 0.7644607031206705, 'bear_time_stop': 171, 'bear_use_sma': True, 'bear_use_ema': True, 'bear_use_atr': True, 'bear_use_adx': False, 'bear_use_spike': True, 'bear_rsi_required': True, 'sideways_strategy': 'mean_reversion', 'sideways_bb_std_mult': 2.2348544620225157, 'sideways_rsi_os': 49, 'sideways_rsi_ob': 83, 'sideways_adx_thresh': 24.31045233774379, 'sideways_atr_min_pct': 0.009764703060748073, 'sideways_atr_max_pct': 0.015081310023511124, 'sideways_tp_mult': 2.7127892304394017, 'sideways_tsl_mult': 0.24742448496291997, 'sideways_time_stop': 292, 'sideways_use_sma': True, 'sideways_use_ema': False, 'sideways_use_atr': False, 'sideways_use_adx': False, 'sideways_use_spike': True, 'sideways_rsi_required': True}.
[I 2025-08-31 03:50:36,772] Trial 144 finished with values: [-0.021845329474739827, 0.02177206075952777] and parameters: {'p_sma': 59, 'p_std': 12, 'p_atr': 24, 'p_adx': 10, 'rsi_period': 36, 'ema1': 16, 'ema2': 48, 'slip_atr_k': 0.19068381804887732, 'slip_spread_k': 0.4329938650750547, 'spread_hl_frac': 0.01803265485331633, 'bb_std_mult': 0.6226468694710596, 'rsi_os': 49, 'rsi_ob': 90, 'vol_spike': 0.012366568302486256, 'adx_thresh': 25.548943361207655, 'atr_min_pct': 0.024313685601064207, 'atr_max_pct': 0.14890408169395147, 'tp_mult': 1.425575819579236, 'tsl_mult': 0.3405611326326183, 'strategy': 'breakout', 'time_stop': 108, 'use_sma': False, 'use_atr': True, 'use_adx': False, 'use_ema': True, 'use_spike': False, 'rsi_required': False, 'edge_k': 1.6303700384990816, 'edge_cap': 0.8262183823869199, 'bull_strategy': 'mean_reversion', 'bull_bb_std_mult': 0.9394400764298267, 'bull_rsi_os': 19, 'bull_rsi_ob': 86, 'bull_adx_thresh': 21.51224274328018, 'bull_atr_min_pct': 7.45470869177537e-05, 'bull_atr_max_pct': 0.1194482688665604, 'bull_tp_mult': 1.8783282467185711, 'bull_tsl_mult': 0.5239164231832301, 'bull_time_stop': 188, 'bull_use_sma': False, 'bull_use_ema': False, 'bull_use_atr': True, 'bull_use_adx': True, 'bull_use_spike': True, 'bull_rsi_required': True, 'bear_strategy': 'mean_reversion', 'bear_bb_std_mult': 3.3096399672886503, 'bear_rsi_os': 32, 'bear_rsi_ob': 58, 'bear_adx_thresh': 20.691825410970264, 'bear_atr_min_pct': 0.011836246130952893, 'bear_atr_max_pct': 0.1277821436538213, 'bear_tp_mult': 2.4753440899960304, 'bear_tsl_mult': 0.8291393128219509, 'bear_time_stop': 160, 'bear_use_sma': True, 'bear_use_ema': True, 'bear_use_atr': True, 'bear_use_adx': False, 'bear_use_spike': True, 'bear_rsi_required': True, 'sideways_strategy': 'mean_reversion', 'sideways_bb_std_mult': 2.2272897604280497, 'sideways_rsi_os': 46, 'sideways_rsi_ob': 82, 'sideways_adx_thresh': 24.076203189775168, 'sideways_atr_min_pct': 0.013327235346593807, 'sideways_atr_max_pct': 0.01487483768628738, 'sideways_tp_mult': 2.7010691169291787, 'sideways_tsl_mult': 0.24587507235756922, 'sideways_time_stop': 291, 'sideways_use_sma': True, 'sideways_use_ema': False, 'sideways_use_atr': False, 'sideways_use_adx': True, 'sideways_use_spike': True, 'sideways_rsi_required': True}.
[I 2025-08-31 03:50:36,797] Trial 142 finished with values: [-0.014805929031096676, 0.014757928357567354] and parameters: {'p_sma': 59, 'p_std': 12, 'p_atr': 24, 'p_adx': 10, 'rsi_period': 36, 'ema1': 16, 'ema2': 43, 'slip_atr_k': 0.19078317667990446, 'slip_spread_k': 0.42894338955196715, 'spread_hl_frac': 0.046340934658757035, 'bb_std_mult': 0.7576604597369063, 'rsi_os': 14, 'rsi_ob': 94, 'vol_spike': 0.015347516083989658, 'adx_thresh': 28.95653555527503, 'atr_min_pct': 0.024002604788822608, 'atr_max_pct': 0.14930395010779796, 'tp_mult': 2.0342779980502868, 'tsl_mult': 0.3418854207496202, 'strategy': 'breakout', 'time_stop': 109, 'use_sma': False, 'use_atr': False, 'use_adx': False, 'use_ema': True, 'use_spike': False, 'rsi_required': False, 'edge_k': 0.15299890059047716, 'edge_cap': 0.8258949698773147, 'bull_strategy': 'breakout', 'bull_bb_std_mult': 0.9111060094085052, 'bull_rsi_os': 19, 'bull_rsi_ob': 83, 'bull_adx_thresh': 21.794135906738468, 'bull_atr_min_pct': 0.0002761072461259667, 'bull_atr_max_pct': 0.11974746848901413, 'bull_tp_mult': 1.869596953895117, 'bull_tsl_mult': 0.5254900215095627, 'bull_time_stop': 187, 'bull_use_sma': False, 'bull_use_ema': False, 'bull_use_atr': True, 'bull_use_adx': True, 'bull_use_spike': True, 'bull_rsi_required': False, 'bear_strategy': 'mean_reversion', 'bear_bb_std_mult': 3.255604357055482, 'bear_rsi_os': 32, 'bear_rsi_ob': 60, 'bear_adx_thresh': 25.740807989923887, 'bear_atr_min_pct': 0.011984312698755769, 'bear_atr_max_pct': 0.14563337320773415, 'bear_tp_mult': 2.563283413867936, 'bear_tsl_mult': 0.8272663659513304, 'bear_time_stop': 171, 'bear_use_sma': True, 'bear_use_ema': True, 'bear_use_atr': True, 'bear_use_adx': False, 'bear_use_spike': True, 'bear_rsi_required': True, 'sideways_strategy': 'mean_reversion', 'sideways_bb_std_mult': 2.2223091177442558, 'sideways_rsi_os': 38, 'sideways_rsi_ob': 79, 'sideways_adx_thresh': 20.61390871438826, 'sideways_atr_min_pct': 0.005434529895731548, 'sideways_atr_max_pct': 0.014131288180183985, 'sideways_tp_mult': 2.8765871863121983, 'sideways_tsl_mult': 0.2474372072369183, 'sideways_time_stop': 288, 'sideways_use_sma': True, 'sideways_use_ema': False, 'sideways_use_atr': False, 'sideways_use_adx': True, 'sideways_use_spike': True, 'sideways_rsi_required': True}.
[I 2025-08-31 03:50:36,918] Trial 141 finished with values: [-0.014462863608589172, 0.014415512086640693] and parameters: {'p_sma': 59, 'p_std': 12, 'p_atr': 24, 'p_adx': 10, 'rsi_period': 36, 'ema1': 16, 'ema2': 43, 'slip_atr_k': 0.18908960265965413, 'slip_spread_k': 0.440572777831601, 'spread_hl_frac': 0.01867731725060131, 'bb_std_mult': 0.7858812708941301, 'rsi_os': 15, 'rsi_ob': 94, 'vol_spike': 0.010458378496421769, 'adx_thresh': 29.05151239470475, 'atr_min_pct': 0.024761929701371515, 'atr_max_pct': 0.14987561596555685, 'tp_mult': 2.018262815977312, 'tsl_mult': 0.35169414039805214, 'strategy': 'breakout', 'time_stop': 107, 'use_sma': False, 'use_atr': False, 'use_adx': False, 'use_ema': True, 'use_spike': False, 'rsi_required': False, 'edge_k': 0.22407666757165112, 'edge_cap': 0.8172838003676948, 'bull_strategy': 'breakout', 'bull_bb_std_mult': 0.9247760245186707, 'bull_rsi_os': 19, 'bull_rsi_ob': 83, 'bull_adx_thresh': 21.509689836844462, 'bull_atr_min_pct': 0.00015085378502050932, 'bull_atr_max_pct': 0.1175952178457408, 'bull_tp_mult': 1.8732905184903021, 'bull_tsl_mult': 0.48223636788027735, 'bull_time_stop': 188, 'bull_use_sma': False, 'bull_use_ema': False, 'bull_use_atr': True, 'bull_use_adx': True, 'bull_use_spike': True, 'bull_rsi_required': False, 'bear_strategy': 'mean_reversion', 'bear_bb_std_mult': 3.406982812229917, 'bear_rsi_os': 32, 'bear_rsi_ob': 58, 'bear_adx_thresh': 25.52686741179168, 'bear_atr_min_pct': 0.013131602423881436, 'bear_atr_max_pct': 0.1464807585855152, 'bear_tp_mult': 2.5456109740744375, 'bear_tsl_mult': 0.8281468167972718, 'bear_time_stop': 159, 'bear_use_sma': True, 'bear_use_ema': True, 'bear_use_atr': True, 'bear_use_adx': False, 'bear_use_spike': True, 'bear_rsi_required': True, 'sideways_strategy': 'mean_reversion', 'sideways_bb_std_mult': 2.2784513339002324, 'sideways_rsi_os': 38, 'sideways_rsi_ob': 79, 'sideways_adx_thresh': 21.36746913499194, 'sideways_atr_min_pct': 0.005225171944617142, 'sideways_atr_max_pct': 0.013204980906259042, 'sideways_tp_mult': 2.8819896460036984, 'sideways_tsl_mult': 0.24771519008759602, 'sideways_time_stop': 294, 'sideways_use_sma': True, 'sideways_use_ema': False, 'sideways_use_atr': False, 'sideways_use_adx': True, 'sideways_use_spike': True, 'sideways_rsi_required': True}.
