[I 2025-08-31 05:43:01,412] Trial 772 finished with values: [-1000000000.0, 1000000000.0] and parameters: {'p_sma': 54, 'p_std': 40, 'p_atr': 12, 'p_adx': 25, 'rsi_period': 14, 'ema1': 20, 'ema2': 22, 'slip_atr_k': 0.0035379448636679678, 'slip_spread_k': 0.7323452123262392, 'spread_hl_frac': 0.005032852227752162, 'bb_std_mult': 3.0642463960518915, 'rsi_os': 40, 'rsi_ob': 65, 'vol_spike': 0.10186262891315691, 'adx_thresh': 33.806359230721114, 'atr_min_pct': 0.014174984710356067, 'atr_max_pct': 0.10081394778423824, 'tp_mult': 2.56390876224281, 'tsl_mult': 0.7407277208098736, 'strategy': 'mean_reversion', 'time_stop': 11, 'use_sma': True, 'use_atr': True, 'use_adx': True, 'use_ema': True, 'use_spike': False, 'rsi_required': True, 'edge_k': 0.861277538303368, 'edge_cap': 0.3802600839369595, 'bull_strategy': 'breakout', 'bull_bb_std_mult': 1.317302074746729, 'bull_rsi_os': 36, 'bull_rsi_ob': 84, 'bull_adx_thresh': 7.853831520234614, 'bull_atr_min_pct': 0.016910170132838274, 'bull_atr_max_pct': 0.07858779213750709, 'bull_tp_mult': 1.5556439381341625, 'bull_tsl_mult': 0.7821525846800368, 'bull_time_stop': 201, 'bull_use_sma': True, 'bull_use_ema': True, 'bull_use_atr': False, 'bull_use_adx': False, 'bull_use_spike': True, 'bull_rsi_required': False, 'bear_strategy': 'breakout', 'bear_bb_std_mult': 2.1296395824151446, 'bear_rsi_os': 6, 'bear_rsi_ob': 66, 'bear_adx_thresh': 17.838274120955337, 'bear_atr_min_pct': 0.006415716333498143, 'bear_atr_max_pct': 0.0845294466747612, 'bear_tp_mult': 1.0514992359595356, 'bear_tsl_mult': 0.12850972903959024, 'bear_time_stop': 223, 'bear_use_sma': False, 'bear_use_ema': False, 'bear_use_atr': False, 'bear_use_adx': False, 'bear_use_spike': False, 'bear_rsi_required': False, 'sideways_strategy': 'breakout', 'sideways_bb_std_mult': 1.4981222374077756, 'sideways_rsi_os': 40, 'sideways_rsi_ob': 47, 'sideways_adx_thresh': 24.830007604754513, 'sideways_atr_min_pct': 0.00491002538685022, 'sideways_atr_max_pct': 0.07604470273839173, 'sideways_tp_mult': 2.565440290633425, 'sideways_tsl_mult': 0.39710321097519313, 'sideways_time_stop': 195, 'sideways_use_sma': True, 'sideways_use_ema': True, 'sideways_use_atr': True, 'sideways_use_adx': False, 'sideways_use_spike': False, 'sideways_rsi_required': False}.
[I 2025-08-31 05:43:48,074] Trial 777 finished with values: [-1000000000.0, 1000000000.0] and parameters: {'p_sma': 48, 'p_std': 38, 'p_atr': 12, 'p_adx': 24, 'rsi_period': 13, 'ema1': 18, 'ema2': 22, 'slip_atr_k': 0.006995851933781452, 'slip_spread_k': 0.7564838307198631, 'spread_hl_frac': 0.005505921609714204, 'bb_std_mult': 3.1625651741482628, 'rsi_os': 43, 'rsi_ob': 65, 'vol_spike': 0.10606899867695295, 'adx_thresh': 21.29040870253107, 'atr_min_pct': 0.012554818468130186, 'atr_max_pct': 0.10822703374889862, 'tp_mult': 2.579689655110829, 'tsl_mult': 0.7766943433233443, 'strategy': 'mean_reversion', 'time_stop': 6, 'use_sma': True, 'use_atr': True, 'use_adx': True, 'use_ema': True, 'use_spike': False, 'rsi_required': True, 'edge_k': 0.8436715219630486, 'edge_cap': 0.41928993458706404, 'bull_strategy': 'breakout', 'bull_bb_std_mult': 1.3722085899052199, 'bull_rsi_os': 28, 'bull_rsi_ob': 83, 'bull_adx_thresh': 5.898716423873353, 'bull_atr_min_pct': 0.017055256905018898, 'bull_atr_max_pct': 0.08569308720463466, 'bull_tp_mult': 1.2228436441280823, 'bull_tsl_mult': 0.8124091908508113, 'bull_time_stop': 221, 'bull_use_sma': True, 'bull_use_ema': True, 'bull_use_atr': False, 'bull_use_adx': False, 'bull_use_spike': True, 'bull_rsi_required': False, 'bear_strategy': 'breakout', 'bear_bb_std_mult': 2.0481356824511656, 'bear_rsi_os': 6, 'bear_rsi_ob': 66, 'bear_adx_thresh': 18.205673219077063, 'bear_atr_min_pct': 0.0063665001143427226, 'bear_atr_max_pct': 0.08886632656911166, 'bear_tp_mult': 1.0116347519519768, 'bear_tsl_mult': 0.1687584301311577, 'bear_time_stop': 235, 'bear_use_sma': False, 'bear_use_ema': False, 'bear_use_atr': False, 'bear_use_adx': False, 'bear_use_spike': False, 'bear_rsi_required': False, 'sideways_strategy': 'breakout', 'sideways_bb_std_mult': 1.344174704655785, 'sideways_rsi_os': 39, 'sideways_rsi_ob': 48, 'sideways_adx_thresh': 25.991871934181596, 'sideways_atr_min_pct': 0.0049721877576538315, 'sideways_atr_max_pct': 0.06419759662609399, 'sideways_tp_mult': 2.653666098788364, 'sideways_tsl_mult': 0.45042179856520514, 'sideways_time_stop': 197, 'sideways_use_sma': True, 'sideways_use_ema': True, 'sideways_use_atr': True, 'sideways_use_adx': False, 'sideways_use_spike': False, 'sideways_rsi_required': False}.
[I 2025-08-31 05:43:48,255] Trial 778 finished with values: [-0.023170523564301715, 0.023124029039726417] and parameters: {'p_sma': 12, 'p_std': 39, 'p_atr': 13, 'p_adx': 25, 'rsi_period': 13, 'ema1': 18, 'ema2': 22, 'slip_atr_k': 0.007309360515936215, 'slip_spread_k': 0.7612288631872234, 'spread_hl_frac': 0.006122152033294616, 'bb_std_mult': 3.180369508145217, 'rsi_os': 42, 'rsi_ob': 64, 'vol_spike': 0.1069630247923849, 'adx_thresh': 27.105401608179804, 'atr_min_pct': 0.012135809759795948, 'atr_max_pct': 0.1087017272481637, 'tp_mult': 2.629351131640664, 'tsl_mult': 0.7829252962723928, 'strategy': 'mean_reversion', 'time_stop': 8, 'use_sma': True, 'use_atr': True, 'use_adx': True, 'use_ema': True, 'use_spike': False, 'rsi_required': True, 'edge_k': 0.9929922665114184, 'edge_cap': 0.41173060307765097, 'bull_strategy': 'breakout', 'bull_bb_std_mult': 1.4860431645962464, 'bull_rsi_os': 35, 'bull_rsi_ob': 83, 'bull_adx_thresh': 26.1404273385254, 'bull_atr_min_pct': 0.017778652414127866, 'bull_atr_max_pct': 0.08457711139748514, 'bull_tp_mult': 2.8748667711216243, 'bull_tsl_mult': 0.817694940575268, 'bull_time_stop': 220, 'bull_use_sma': True, 'bull_use_ema': True, 'bull_use_atr': False, 'bull_use_adx': False, 'bull_use_spike': True, 'bull_rsi_required': False, 'bear_strategy': 'breakout', 'bear_bb_std_mult': 2.0449872382355867, 'bear_rsi_os': 7, 'bear_rsi_ob': 65, 'bear_adx_thresh': 18.430315078496918, 'bear_atr_min_pct': 0.0064473305992457, 'bear_atr_max_pct': 0.09068147496036955, 'bear_tp_mult': 1.0113015867644415, 'bear_tsl_mult': 0.16808693332446834, 'bear_time_stop': 237, 'bear_use_sma': False, 'bear_use_ema': False, 'bear_use_atr': False, 'bear_use_adx': False, 'bear_use_spike': False, 'bear_rsi_required': False, 'sideways_strategy': 'breakout', 'sideways_bb_std_mult': 1.3103031529190976, 'sideways_rsi_os': 39, 'sideways_rsi_ob': 48, 'sideways_adx_thresh': 25.492709454335053, 'sideways_atr_min_pct': 0.0006859002518440247, 'sideways_atr_max_pct': 0.06441634147249929, 'sideways_tp_mult': 2.6479495734566076, 'sideways_tsl_mult': 0.45751654255724716, 'sideways_time_stop': 195, 'sideways_use_sma': True, 'sideways_use_ema': True, 'sideways_use_atr': True, 'sideways_use_adx': False, 'sideways_use_spike': False, 'sideways_rsi_required': False}.
[I 2025-08-31 05:43:48,516] Trial 775 finished with values: [-1000000000.0, 1000000000.0] and parameters: {'p_sma': 54, 'p_std': 42, 'p_atr': 12, 'p_adx': 24, 'rsi_period': 14, 'ema1': 20, 'ema2': 20, 'slip_atr_k': 0.00434680619292366, 'slip_spread_k': 0.7570992514572354, 'spread_hl_frac': 0.0063206627729278176, 'bb_std_mult': 3.188946981641575, 'rsi_os': 39, 'rsi_ob': 65, 'vol_spike': 0.1066603739446654, 'adx_thresh': 27.15774862742297, 'atr_min_pct': 0.01243663937364924, 'atr_max_pct': 0.10909620288469507, 'tp_mult': 2.5655217439592763, 'tsl_mult': 0.7791587114944022, 'strategy': 'mean_reversion', 'time_stop': 8, 'use_sma': True, 'use_atr': True, 'use_adx': True, 'use_ema': True, 'use_spike': False, 'rsi_required': True, 'edge_k': 0.8692463685404715, 'edge_cap': 0.4117634625776102, 'bull_strategy': 'breakout', 'bull_bb_std_mult': 1.4964067389058833, 'bull_rsi_os': 36, 'bull_rsi_ob': 84, 'bull_adx_thresh': 5.552060353040202, 'bull_atr_min_pct': 0.016902150670695067, 'bull_atr_max_pct': 0.08391069884359584, 'bull_tp_mult': 2.371624992228624, 'bull_tsl_mult': 0.7872977836459812, 'bull_time_stop': 220, 'bull_use_sma': True, 'bull_use_ema': True, 'bull_use_atr': False, 'bull_use_adx': False, 'bull_use_spike': True, 'bull_rsi_required': False, 'bear_strategy': 'breakout', 'bear_bb_std_mult': 2.180184909763869, 'bear_rsi_os': 6, 'bear_rsi_ob': 68, 'bear_adx_thresh': 18.028766325104883, 'bear_atr_min_pct': 0.004928363718194783, 'bear_atr_max_pct': 0.09229226559417567, 'bear_tp_mult': 1.011170450088041, 'bear_tsl_mult': 0.16252325167023537, 'bear_time_stop': 232, 'bear_use_sma': False, 'bear_use_ema': False, 'bear_use_atr': False, 'bear_use_adx': False, 'bear_use_spike': False, 'bear_rsi_required': False, 'sideways_strategy': 'breakout', 'sideways_bb_std_mult': 1.3590337507977996, 'sideways_rsi_os': 40, 'sideways_rsi_ob': 47, 'sideways_adx_thresh': 25.99525233143314, 'sideways_atr_min_pct': 0.0049093352831216545, 'sideways_atr_max_pct': 0.06401267427843008, 'sideways_tp_mult': 2.5541357065594483, 'sideways_tsl_mult': 0.399360903733862, 'sideways_time_stop': 194, 'sideways_use_sma': True, 'sideways_use_ema': True, 'sideways_use_atr': True, 'sideways_use_adx': False, 'sideways_use_spike': False, 'sideways_rsi_required': False}.
[I 2025-08-31 05:43:48,624] Trial 776 finished with values: [-1000000000.0, 1000000000.0] and parameters: {'p_sma': 16, 'p_std': 39, 'p_atr': 12, 'p_adx': 24, 'rsi_period': 14, 'ema1': 20, 'ema2': 22, 'slip_atr_k': 0.00658334631738817, 'slip_spread_k': 0.7572420819386418, 'spread_hl_frac': 0.005669172714434611, 'bb_std_mult': 3.089372038346267, 'rsi_os': 42, 'rsi_ob': 64, 'vol_spike': 0.10332072641232283, 'adx_thresh': 19.661374066158036, 'atr_min_pct': 0.013921371836985235, 'atr_max_pct': 0.10833940257452751, 'tp_mult': 2.642969721082433, 'tsl_mult': 0.7833733226262257, 'strategy': 'mean_reversion', 'time_stop': 10, 'use_sma': True, 'use_atr': True, 'use_adx': True, 'use_ema': True, 'use_spike': False, 'rsi_required': True, 'edge_k': 0.9717056936716602, 'edge_cap': 0.4109280189880375, 'bull_strategy': 'breakout', 'bull_bb_std_mult': 1.5488071139161002, 'bull_rsi_os': 35, 'bull_rsi_ob': 85, 'bull_adx_thresh': 7.88759184580498, 'bull_atr_min_pct': 0.015803656268798552, 'bull_atr_max_pct': 0.08333831682921929, 'bull_tp_mult': 1.9784511871505142, 'bull_tsl_mult': 0.7826935370233663, 'bull_time_stop': 219, 'bull_use_sma': True, 'bull_use_ema': True, 'bull_use_atr': False, 'bull_use_adx': False, 'bull_use_spike': True, 'bull_rsi_required': False, 'bear_strategy': 'breakout', 'bear_bb_std_mult': 2.043919480814465, 'bear_rsi_os': 7, 'bear_rsi_ob': 65, 'bear_adx_thresh': 18.30208920535791, 'bear_atr_min_pct': 0.004932425002443345, 'bear_atr_max_pct': 0.01011566965421673, 'bear_tp_mult': 1.0452696311535898, 'bear_tsl_mult': 0.16844976776025408, 'bear_time_stop': 234, 'bear_use_sma': False, 'bear_use_ema': False, 'bear_use_atr': False, 'bear_use_adx': False, 'bear_use_spike': False, 'bear_rsi_required': False, 'sideways_strategy': 'breakout', 'sideways_bb_std_mult': 1.357169793693648, 'sideways_rsi_os': 40, 'sideways_rsi_ob': 47, 'sideways_adx_thresh': 26.10745822252686, 'sideways_atr_min_pct': 0.004804232155098582, 'sideways_atr_max_pct': 0.07009484866245182, 'sideways_tp_mult': 2.6498794098040177, 'sideways_tsl_mult': 0.4494336049067618, 'sideways_time_stop': 196, 'sideways_use_sma': True, 'sideways_use_ema': True, 'sideways_use_atr': True, 'sideways_use_adx': False, 'sideways_use_spike': False, 'sideways_rsi_required': False}.
[I 2025-08-31 05:44:35,095] Trial 779 finished with values: [-1000000000.0, 1000000000.0] and parameters: {'p_sma': 21, 'p_std': 42, 'p_atr': 13, 'p_adx': 24, 'rsi_period': 11, 'ema1': 20, 'ema2': 23, 'slip_atr_k': 0.004162531111808472, 'slip_spread_k': 0.7611623743707877, 'spread_hl_frac': 0.004047933175309191, 'bb_std_mult': 3.244804935091178, 'rsi_os': 36, 'rsi_ob': 68, 'vol_spike': 0.0893296560337831, 'adx_thresh': 19.95018697281885, 'atr_min_pct': 0.011937607965298186, 'atr_max_pct': 0.11063051034558381, 'tp_mult': 2.6389782135351316, 'tsl_mult': 0.7810767050515901, 'strategy': 'mean_reversion', 'time_stop': 14, 'use_sma': True, 'use_atr': True, 'use_adx': True, 'use_ema': True, 'use_spike': False, 'rsi_required': True, 'edge_k': 0.9586807465862273, 'edge_cap': 0.4077871545720509, 'bull_strategy': 'breakout', 'bull_bb_std_mult': 1.486805580371374, 'bull_rsi_os': 27, 'bull_rsi_ob': 82, 'bull_adx_thresh': 7.050084040584975, 'bull_atr_min_pct': 0.014919364722749032, 'bull_atr_max_pct': 0.08277954992175664, 'bull_tp_mult': 1.2866481162516297, 'bull_tsl_mult': 0.8244074471757629, 'bull_time_stop': 219, 'bull_use_sma': True, 'bull_use_ema': True, 'bull_use_atr': False, 'bull_use_adx': False, 'bull_use_spike': True, 'bull_rsi_required': False, 'bear_strategy': 'breakout', 'bear_bb_std_mult': 2.2148050415239275, 'bear_rsi_os': 7, 'bear_rsi_ob': 68, 'bear_adx_thresh': 18.32164009258875, 'bear_atr_min_pct': 0.005398888048240335, 'bear_atr_max_pct': 0.10801218155028537, 'bear_tp_mult': 1.07433080581591, 'bear_tsl_mult': 0.17702202792828062, 'bear_time_stop': 233, 'bear_use_sma': False, 'bear_use_ema': False, 'bear_use_atr': False, 'bear_use_adx': False, 'bear_use_spike': False, 'bear_rsi_required': False, 'sideways_strategy': 'breakout', 'sideways_bb_std_mult': 1.288621632036112, 'sideways_rsi_os': 38, 'sideways_rsi_ob': 45, 'sideways_adx_thresh': 25.8016479193899, 'sideways_atr_min_pct': 0.002634819589679728, 'sideways_atr_max_pct': 0.06697527393858914, 'sideways_tp_mult': 2.5460389503262726, 'sideways_tsl_mult': 0.45251715804303755, 'sideways_time_stop': 194, 'sideways_use_sma': True, 'sideways_use_ema': True, 'sideways_use_atr': True, 'sideways_use_adx': False, 'sideways_use_spike': False, 'sideways_rsi_required': False}.
[I 2025-08-31 05:44:36,273] Trial 782 finished with values: [-0.03116330296098746, 0.031125622560363067] and parameters: {'p_sma': 36, 'p_std': 41, 'p_atr': 13, 'p_adx': 25, 'rsi_period': 10, 'ema1': 18, 'ema2': 23, 'slip_atr_k': 0.0006248061791242505, 'slip_spread_k': 0.7117054350212294, 'spread_hl_frac': 0.00603974304289019, 'bb_std_mult': 3.2482310664404306, 'rsi_os': 36, 'rsi_ob': 66, 'vol_spike': 0.09467935768042914, 'adx_thresh': 18.095891796137064, 'atr_min_pct': 0.013486625921505579, 'atr_max_pct': 0.031921133476978614, 'tp_mult': 2.540616640971539, 'tsl_mult': 0.791428888694063, 'strategy': 'mean_reversion', 'time_stop': 14, 'use_sma': True, 'use_atr': True, 'use_adx': True, 'use_ema': True, 'use_spike': False, 'rsi_required': True, 'edge_k': 0.9482692064343785, 'edge_cap': 0.39694983220999325, 'bull_strategy': 'mean_reversion', 'bull_bb_std_mult': 1.5674607206331315, 'bull_rsi_os': 38, 'bull_rsi_ob': 82, 'bull_adx_thresh': 24.0593938411916, 'bull_atr_min_pct': 0.01925930923770411, 'bull_atr_max_pct': 0.07571952336007567, 'bull_tp_mult': 1.9055355742496243, 'bull_tsl_mult': 0.8267474779748202, 'bull_time_stop': 198, 'bull_use_sma': True, 'bull_use_ema': True, 'bull_use_atr': False, 'bull_use_adx': False, 'bull_use_spike': True, 'bull_rsi_required': False, 'bear_strategy': 'breakout', 'bear_bb_std_mult': 2.1044705844997087, 'bear_rsi_os': 7, 'bear_rsi_ob': 64, 'bear_adx_thresh': 17.199574760108504, 'bear_atr_min_pct': 0.005328890443402488, 'bear_atr_max_pct': 0.11261927009148254, 'bear_tp_mult': 1.074055468652174, 'bear_tsl_mult': 0.13558792744839643, 'bear_time_stop': 215, 'bear_use_sma': False, 'bear_use_ema': False, 'bear_use_atr': False, 'bear_use_adx': False, 'bear_use_spike': False, 'bear_rsi_required': False, 'sideways_strategy': 'breakout', 'sideways_bb_std_mult': 1.2818050664516796, 'sideways_rsi_os': 38, 'sideways_rsi_ob': 45, 'sideways_adx_thresh': 25.9665193488936, 'sideways_atr_min_pct': 0.0009175548436685318, 'sideways_atr_max_pct': 0.05810822312853334, 'sideways_tp_mult': 2.529359542493314, 'sideways_tsl_mult': 0.44392498406656494, 'sideways_time_stop': 187, 'sideways_use_sma': False, 'sideways_use_ema': True, 'sideways_use_atr': True, 'sideways_use_adx': False, 'sideways_use_spike': False, 'sideways_rsi_required': False}.
[I 2025-08-31 05:44:36,610] Trial 781 finished with values: [-1000000000.0, 1000000000.0] and parameters: {'p_sma': 31, 'p_std': 39, 'p_atr': 13, 'p_adx': 25, 'rsi_period': 14, 'ema1': 19, 'ema2': 23, 'slip_atr_k': 0.006504591561432428, 'slip_spread_k': 0.715001695441918, 'spread_hl_frac': 0.0065991084172372545, 'bb_std_mult': 3.2781653179727446, 'rsi_os': 35, 'rsi_ob': 66, 'vol_spike': 0.08909934139237596, 'adx_thresh': 28.116177833082844, 'atr_min_pct': 0.013847103731530662, 'atr_max_pct': 0.10569644763076913, 'tp_mult': 2.545840167545072, 'tsl_mult': 0.7899177251568241, 'strategy': 'mean_reversion', 'time_stop': 15, 'use_sma': True, 'use_atr': True, 'use_adx': True, 'use_ema': True, 'use_spike': False, 'rsi_required': True, 'edge_k': 0.9509025709779291, 'edge_cap': 0.4013486308930477, 'bull_strategy': 'mean_reversion', 'bull_bb_std_mult': 1.5614450844355576, 'bull_rsi_os': 23, 'bull_rsi_ob': 82, 'bull_adx_thresh': 6.589181884445081, 'bull_atr_min_pct': 0.015293007668537674, 'bull_atr_max_pct': 0.07508539009848417, 'bull_tp_mult': 2.568105821860522, 'bull_tsl_mult': 0.8180420163604815, 'bull_time_stop': 206, 'bull_use_sma': True, 'bull_use_ema': True, 'bull_use_atr': False, 'bull_use_adx': False, 'bull_use_spike': True, 'bull_rsi_required': False, 'bear_strategy': 'breakout', 'bear_bb_std_mult': 2.221541566976782, 'bear_rsi_os': 7, 'bear_rsi_ob': 64, 'bear_adx_thresh': 16.9325841048484, 'bear_atr_min_pct': 0.005018726774025036, 'bear_atr_max_pct': 0.036647100154968915, 'bear_tp_mult': 1.0760991468412167, 'bear_tsl_mult': 0.17230625791894325, 'bear_time_stop': 216, 'bear_use_sma': False, 'bear_use_ema': False, 'bear_use_atr': False, 'bear_use_adx': False, 'bear_use_spike': False, 'bear_rsi_required': False, 'sideways_strategy': 'breakout', 'sideways_bb_std_mult': 1.2743420427756822, 'sideways_rsi_os': 38, 'sideways_rsi_ob': 45, 'sideways_adx_thresh': 25.95802045956025, 'sideways_atr_min_pct': 0.0029602467960369258, 'sideways_atr_max_pct': 0.05808535994309147, 'sideways_tp_mult': 2.5270465172161054, 'sideways_tsl_mult': 0.4523058539470224, 'sideways_time_stop': 181, 'sideways_use_sma': True, 'sideways_use_ema': True, 'sideways_use_atr': True, 'sideways_use_adx': False, 'sideways_use_spike': False, 'sideways_rsi_required': False}.
[I 2025-08-31 05:44:36,754] Trial 780 finished with values: [-0.04178978821303114, 0.04174233126861335] and parameters: {'p_sma': 25, 'p_std': 42, 'p_atr': 10, 'p_adx': 24, 'rsi_period': 11, 'ema1': 20, 'ema2': 22, 'slip_atr_k': 0.00025076612595960855, 'slip_spread_k': 0.7171988901135258, 'spread_hl_frac': 0.004016877621727336, 'bb_std_mult': 3.009863221404714, 'rsi_os': 38, 'rsi_ob': 64, 'vol_spike': 0.08857736864021049, 'adx_thresh': 30.64631195573412, 'atr_min_pct': 0.014989624831611838, 'atr_max_pct': 0.04520141571317988, 'tp_mult': 2.5388794829765096, 'tsl_mult': 0.7637343211887344, 'strategy': 'mean_reversion', 'time_stop': 15, 'use_sma': True, 'use_atr': True, 'use_adx': True, 'use_ema': True, 'use_spike': False, 'rsi_required': True, 'edge_k': 0.9561286788001002, 'edge_cap': 0.40717441664028947, 'bull_strategy': 'breakout', 'bull_bb_std_mult': 1.5944041457784623, 'bull_rsi_os': 23, 'bull_rsi_ob': 72, 'bull_adx_thresh': 6.789912281640586, 'bull_atr_min_pct': 0.015044200776836455, 'bull_atr_max_pct': 0.08402595128733346, 'bull_tp_mult': 2.388458607165903, 'bull_tsl_mult': 0.7999954889645172, 'bull_time_stop': 205, 'bull_use_sma': True, 'bull_use_ema': True, 'bull_use_atr': False, 'bull_use_adx': False, 'bull_use_spike': True, 'bull_rsi_required': False, 'bear_strategy': 'breakout', 'bear_bb_std_mult': 2.209745510696116, 'bear_rsi_os': 7, 'bear_rsi_ob': 64, 'bear_adx_thresh': 16.77032707962726, 'bear_atr_min_pct': 0.005246222255052818, 'bear_atr_max_pct': 0.017069586166470307, 'bear_tp_mult': 1.0781758641104688, 'bear_tsl_mult': 0.16994462179341235, 'bear_time_stop': 231, 'bear_use_sma': False, 'bear_use_ema': False, 'bear_use_atr': False, 'bear_use_adx': False, 'bear_use_spike': False, 'bear_rsi_required': False, 'sideways_strategy': 'breakout', 'sideways_bb_std_mult': 1.2964894703547267, 'sideways_rsi_os': 38, 'sideways_rsi_ob': 45, 'sideways_adx_thresh': 26.069992309564103, 'sideways_atr_min_pct': 7.027242963550048e-06, 'sideways_atr_max_pct': 0.059281528594791466, 'sideways_tp_mult': 2.5351560526869488, 'sideways_tsl_mult': 0.44997389214162065, 'sideways_time_stop': 182, 'sideways_use_sma': True, 'sideways_use_ema': True, 'sideways_use_atr': True, 'sideways_use_adx': False, 'sideways_use_spike': False, 'sideways_rsi_required': False}.
