[I 2025-08-31 03:43:09,642] Trial 82 finished with values: [-0.027894657782270738, 0.0278463463625544] and parameters: {'p_sma': 50, 'p_std': 22, 'p_atr': 14, 'p_adx': 13, 'rsi_period': 31, 'ema1': 18, 'ema2': 44, 'slip_atr_k': 0.16334707591580874, 'slip_spread_k': 0.8565244105482911, 'spread_hl_frac': 0.016664303483634076, 'bb_std_mult': 1.2216491862395569, 'rsi_os': 11, 'rsi_ob': 84, 'vol_spike': 0.14172302316006363, 'adx_thresh': 18.978107676284562, 'atr_min_pct': 0.009935139642594175, 'atr_max_pct': 0.05944959884389699, 'tp_mult': 1.1504397759398957, 'tsl_mult': 0.38132314503564857, 'strategy': 'mean_reversion', 'time_stop': 249, 'use_sma': False, 'use_atr': False, 'use_adx': True, 'use_ema': True, 'use_spike': False, 'rsi_required': True, 'edge_k': 0.45081450292574693, 'edge_cap': 0.2835136598470369, 'bull_strategy': 'breakout', 'bull_bb_std_mult': 2.7288007478820147, 'bull_rsi_os': 36, 'bull_rsi_ob': 94, 'bull_adx_thresh': 31.893204697591354, 'bull_atr_min_pct': 0.0013112379857190732, 'bull_atr_max_pct': 0.1337347416481341, 'bull_tp_mult': 2.8455948193105733, 'bull_tsl_mult': 0.634210633043966, 'bull_time_stop': 290, 'bull_use_sma': True, 'bull_use_ema': True, 'bull_use_atr': True, 'bull_use_adx': False, 'bull_use_spike': True, 'bull_rsi_required': False, 'bear_strategy': 'breakout', 'bear_bb_std_mult': 1.7489467810337633, 'bear_rsi_os': 37, 'bear_rsi_ob': 66, 'bear_adx_thresh': 19.112506643473676, 'bear_atr_min_pct': 0.0029518969492477974, 'bear_atr_max_pct': 0.06677075479264992, 'bear_tp_mult': 1.6186842392324734, 'bear_tsl_mult': 0.7406689964832507, 'bear_time_stop': 22, 'bear_use_sma': False, 'bear_use_ema': False, 'bear_use_atr': True, 'bear_use_adx': False, 'bear_use_spike': False, 'bear_rsi_required': False, 'sideways_strategy': 'breakout', 'sideways_bb_std_mult': 2.7705437370351333, 'sideways_rsi_os': 51, 'sideways_rsi_ob': 91, 'sideways_adx_thresh': 24.359388901615787, 'sideways_atr_min_pct': 0.02573033568935945, 'sideways_atr_max_pct': 0.04652255660470767, 'sideways_tp_mult': 2.308651020793306, 'sideways_tsl_mult': 0.8329718674626089, 'sideways_time_stop': 266, 'sideways_use_sma': True, 'sideways_use_ema': True, 'sideways_use_atr': True, 'sideways_use_adx': False, 'sideways_use_spike': False, 'sideways_rsi_required': False}.
[I 2025-08-31 03:43:09,756] Trial 81 finished with values: [-1000000000.0, 1000000000.0] and parameters: {'p_sma': 50, 'p_std': 22, 'p_atr': 14, 'p_adx': 19, 'rsi_period': 32, 'ema1': 18, 'ema2': 44, 'slip_atr_k': 0.23896082922058262, 'slip_spread_k': 0.844504802668804, 'spread_hl_frac': 0.016835172843602322, 'bb_std_mult': 1.2239752232215921, 'rsi_os': 11, 'rsi_ob': 85, 'vol_spike': 0.0992051303064342, 'adx_thresh': 19.340689217720193, 'atr_min_pct': 0.010197899285790511, 'atr_max_pct': 0.06159466880177645, 'tp_mult': 1.6360159964313896, 'tsl_mult': 0.37713990983522205, 'strategy': 'mean_reversion', 'time_stop': 252, 'use_sma': False, 'use_atr': False, 'use_adx': True, 'use_ema': True, 'use_spike': False, 'rsi_required': True, 'edge_k': 0.4679097524888618, 'edge_cap': 0.29125498411623135, 'bull_strategy': 'breakout', 'bull_bb_std_mult': 3.13042558878605, 'bull_rsi_os': 37, 'bull_rsi_ob': 94, 'bull_adx_thresh': 32.205101222785146, 'bull_atr_min_pct': 0.0019109651103825223, 'bull_atr_max_pct': 0.13318448148616166, 'bull_tp_mult': 2.8429270057128564, 'bull_tsl_mult': 0.643467763671045, 'bull_time_stop': 288, 'bull_use_sma': True, 'bull_use_ema': True, 'bull_use_atr': True, 'bull_use_adx': False, 'bull_use_spike': True, 'bull_rsi_required': False, 'bear_strategy': 'breakout', 'bear_bb_std_mult': 1.8875794538047037, 'bear_rsi_os': 49, 'bear_rsi_ob': 66, 'bear_adx_thresh': 18.982043383324953, 'bear_atr_min_pct': 0.004283631628513918, 'bear_atr_max_pct': 0.06418718295816779, 'bear_tp_mult': 1.650148749372109, 'bear_tsl_mult': 0.7487557183031148, 'bear_time_stop': 21, 'bear_use_sma': False, 'bear_use_ema': False, 'bear_use_atr': True, 'bear_use_adx': False, 'bear_use_spike': False, 'bear_rsi_required': False, 'sideways_strategy': 'breakout', 'sideways_bb_std_mult': 2.651400673119422, 'sideways_rsi_os': 51, 'sideways_rsi_ob': 90, 'sideways_adx_thresh': 24.208120701077625, 'sideways_atr_min_pct': 0.02580938436745367, 'sideways_atr_max_pct': 0.04700121209363331, 'sideways_tp_mult': 2.297651409453188, 'sideways_tsl_mult': 0.8909319636831863, 'sideways_time_stop': 234, 'sideways_use_sma': True, 'sideways_use_ema': True, 'sideways_use_atr': True, 'sideways_use_adx': False, 'sideways_use_spike': False, 'sideways_rsi_required': False}.
[I 2025-08-31 03:43:38,910] Trial 83 finished with values: [-1000000000.0, 1000000000.0] and parameters: {'p_sma': 51, 'p_std': 23, 'p_atr': 13, 'p_adx': 16, 'rsi_period': 31, 'ema1': 20, 'ema2': 38, 'slip_atr_k': 0.16881537731512838, 'slip_spread_k': 0.9085762331605584, 'spread_hl_frac': 0.025110721892945255, 'bb_std_mult': 0.8895653052857165, 'rsi_os': 11, 'rsi_ob': 84, 'vol_spike': 0.1389686874650655, 'adx_thresh': 17.3712167901715, 'atr_min_pct': 0.008233566727276181, 'atr_max_pct': 0.06762499591154823, 'tp_mult': 1.1503358320594055, 'tsl_mult': 0.2130581648020531, 'strategy': 'mean_reversion', 'time_stop': 205, 'use_sma': False, 'use_atr': False, 'use_adx': True, 'use_ema': True, 'use_spike': False, 'rsi_required': True, 'edge_k': 0.36704032434620465, 'edge_cap': 0.4352591052515487, 'bull_strategy': 'breakout', 'bull_bb_std_mult': 2.6856453048296243, 'bull_rsi_os': 34, 'bull_rsi_ob': 95, 'bull_adx_thresh': 32.142126736553955, 'bull_atr_min_pct': 0.0018381710174924458, 'bull_atr_max_pct': 0.13191861515863565, 'bull_tp_mult': 2.643287319457942, 'bull_tsl_mult': 0.5714778258595743, 'bull_time_stop': 286, 'bull_use_sma': True, 'bull_use_ema': True, 'bull_use_atr': True, 'bull_use_adx': False, 'bull_use_spike': True, 'bull_rsi_required': False, 'bear_strategy': 'breakout', 'bear_bb_std_mult': 1.775375057384857, 'bear_rsi_os': 24, 'bear_rsi_ob': 66, 'bear_adx_thresh': 12.01524948802809, 'bear_atr_min_pct': 0.004662107817230955, 'bear_atr_max_pct': 0.09709698460911588, 'bear_tp_mult': 1.5977456122759188, 'bear_tsl_mult': 0.8410082267501794, 'bear_time_stop': 35, 'bear_use_sma': False, 'bear_use_ema': False, 'bear_use_atr': True, 'bear_use_adx': False, 'bear_use_spike': False, 'bear_rsi_required': False, 'sideways_strategy': 'breakout', 'sideways_bb_std_mult': 3.032387394662649, 'sideways_rsi_os': 54, 'sideways_rsi_ob': 90, 'sideways_adx_thresh': 34.10374940266388, 'sideways_atr_min_pct': 0.024385829621948317, 'sideways_atr_max_pct': 0.04597706613042609, 'sideways_tp_mult': 2.579421320271907, 'sideways_tsl_mult': 0.8225216712931048, 'sideways_time_stop': 287, 'sideways_use_sma': True, 'sideways_use_ema': True, 'sideways_use_atr': True, 'sideways_use_adx': False, 'sideways_use_spike': False, 'sideways_rsi_required': False}.
[I 2025-08-31 03:43:39,131] Trial 86 finished with values: [-0.016488267782251542, 0.016438510619131118] and parameters: {'p_sma': 57, 'p_std': 17, 'p_atr': 13, 'p_adx': 9, 'rsi_period': 13, 'ema1': 20, 'ema2': 38, 'slip_atr_k': 0.1675787985656344, 'slip_spread_k': 0.9032362321252176, 'spread_hl_frac': 0.02643108124578416, 'bb_std_mult': 0.9285367793292174, 'rsi_os': 7, 'rsi_ob': 83, 'vol_spike': 0.15348433964601105, 'adx_thresh': 22.510296049072494, 'atr_min_pct': 0.01015455879365311, 'atr_max_pct': 0.06683627504186583, 'tp_mult': 1.3725717751521107, 'tsl_mult': 0.19203498432899269, 'strategy': 'mean_reversion', 'time_stop': 201, 'use_sma': False, 'use_atr': False, 'use_adx': True, 'use_ema': True, 'use_spike': False, 'rsi_required': True, 'edge_k': 0.37056648080748233, 'edge_cap': 0.44166893725110756, 'bull_strategy': 'breakout', 'bull_bb_std_mult': 2.7371003727983525, 'bull_rsi_os': 29, 'bull_rsi_ob': 95, 'bull_adx_thresh': 32.98032791765353, 'bull_atr_min_pct': 0.0007886208711930264, 'bull_atr_max_pct': 0.14192143353520545, 'bull_tp_mult': 2.8595269924553377, 'bull_tsl_mult': 0.7528248633368699, 'bull_time_stop': 291, 'bull_use_sma': True, 'bull_use_ema': True, 'bull_use_atr': True, 'bull_use_adx': False, 'bull_use_spike': True, 'bull_rsi_required': False, 'bear_strategy': 'breakout', 'bear_bb_std_mult': 1.7896119133479895, 'bear_rsi_os': 37, 'bear_rsi_ob': 65, 'bear_adx_thresh': 12.476434374130385, 'bear_atr_min_pct': 0.0055696663389158164, 'bear_atr_max_pct': 0.07607619107725586, 'bear_tp_mult': 1.3524194622369183, 'bear_tsl_mult': 0.6317337084872672, 'bear_time_stop': 37, 'bear_use_sma': False, 'bear_use_ema': False, 'bear_use_atr': True, 'bear_use_adx': False, 'bear_use_spike': False, 'bear_rsi_required': False, 'sideways_strategy': 'breakout', 'sideways_bb_std_mult': 3.040000802368774, 'sideways_rsi_os': 55, 'sideways_rsi_ob': 86, 'sideways_adx_thresh': 27.590427120113322, 'sideways_atr_min_pct': 0.024511767828083324, 'sideways_atr_max_pct': 0.06359361109359146, 'sideways_tp_mult': 2.4770545232173786, 'sideways_tsl_mult': 0.8307240894884917, 'sideways_time_stop': 286, 'sideways_use_sma': True, 'sideways_use_ema': True, 'sideways_use_atr': True, 'sideways_use_adx': False, 'sideways_use_spike': False, 'sideways_rsi_required': False}.
[I 2025-08-31 03:43:39,243] Trial 85 finished with values: [-1000000000.0, 1000000000.0] and parameters: {'p_sma': 50, 'p_std': 22, 'p_atr': 13, 'p_adx': 19, 'rsi_period': 13, 'ema1': 20, 'ema2': 44, 'slip_atr_k': 0.1714025037140461, 'slip_spread_k': 0.9609058864770185, 'spread_hl_frac': 0.016684220196552697, 'bb_std_mult': 0.9120327657869586, 'rsi_os': 7, 'rsi_ob': 83, 'vol_spike': 0.1395010388070955, 'adx_thresh': 22.64275293602303, 'atr_min_pct': 0.010005579389782441, 'atr_max_pct': 0.06710879894612407, 'tp_mult': 1.3552298220194017, 'tsl_mult': 0.1967910887224697, 'strategy': 'mean_reversion', 'time_stop': 200, 'use_sma': False, 'use_atr': False, 'use_adx': True, 'use_ema': True, 'use_spike': False, 'rsi_required': True, 'edge_k': 0.39437491062475627, 'edge_cap': 0.44913670250166005, 'bull_strategy': 'breakout', 'bull_bb_std_mult': 2.7862910813478363, 'bull_rsi_os': 34, 'bull_rsi_ob': 95, 'bull_adx_thresh': 32.390140007903675, 'bull_atr_min_pct': 0.0019039388366653216, 'bull_atr_max_pct': 0.13249030438795933, 'bull_tp_mult': 2.831477955873731, 'bull_tsl_mult': 0.7368212096893, 'bull_time_stop': 289, 'bull_use_sma': True, 'bull_use_ema': True, 'bull_use_atr': True, 'bull_use_adx': False, 'bull_use_spike': True, 'bull_rsi_required': False, 'bear_strategy': 'breakout', 'bear_bb_std_mult': 1.7738195416887883, 'bear_rsi_os': 44, 'bear_rsi_ob': 66, 'bear_adx_thresh': 12.574548187953756, 'bear_atr_min_pct': 0.004721403457734624, 'bear_atr_max_pct': 0.07578910158345428, 'bear_tp_mult': 1.6438667739534423, 'bear_tsl_mult': 0.6171142990210926, 'bear_time_stop': 44, 'bear_use_sma': False, 'bear_use_ema': False, 'bear_use_atr': True, 'bear_use_adx': False, 'bear_use_spike': False, 'bear_rsi_required': False, 'sideways_strategy': 'breakout', 'sideways_bb_std_mult': 2.6042503348535915, 'sideways_rsi_os': 54, 'sideways_rsi_ob': 90, 'sideways_adx_thresh': 25.965864624954666, 'sideways_atr_min_pct': 0.02422774084900924, 'sideways_atr_max_pct': 0.031852302850531276, 'sideways_tp_mult': 2.168789634317424, 'sideways_tsl_mult': 0.8262528014431627, 'sideways_time_stop': 230, 'sideways_use_sma': True, 'sideways_use_ema': True, 'sideways_use_atr': True, 'sideways_use_adx': False, 'sideways_use_spike': False, 'sideways_rsi_required': False}.
[I 2025-08-31 03:43:39,396] Trial 84 finished with values: [-1000000000.0, 1000000000.0] and parameters: {'p_sma': 50, 'p_std': 21, 'p_atr': 13, 'p_adx': 16, 'rsi_period': 13, 'ema1': 20, 'ema2': 44, 'slip_atr_k': 0.1695632855374848, 'slip_spread_k': 0.8994436819318027, 'spread_hl_frac': 0.02092414195693304, 'bb_std_mult': 0.9255657284041711, 'rsi_os': 11, 'rsi_ob': 84, 'vol_spike': 0.14369497594605599, 'adx_thresh': 22.965688516779764, 'atr_min_pct': 0.008253497696843096, 'atr_max_pct': 0.08031689277853653, 'tp_mult': 1.5080273037894234, 'tsl_mult': 0.2219984683521731, 'strategy': 'mean_reversion', 'time_stop': 201, 'use_sma': False, 'use_atr': False, 'use_adx': True, 'use_ema': True, 'use_spike': False, 'rsi_required': True, 'edge_k': 0.40159603125419285, 'edge_cap': 0.4440124857280647, 'bull_strategy': 'breakout', 'bull_bb_std_mult': 2.5064834210033697, 'bull_rsi_os': 29, 'bull_rsi_ob': 94, 'bull_adx_thresh': 32.419850601382784, 'bull_atr_min_pct': 0.002000705569731151, 'bull_atr_max_pct': 0.13181475861233563, 'bull_tp_mult': 2.851885255626201, 'bull_tsl_mult': 0.5699996480665428, 'bull_time_stop': 288, 'bull_use_sma': True, 'bull_use_ema': True, 'bull_use_atr': True, 'bull_use_adx': False, 'bull_use_spike': True, 'bull_rsi_required': False, 'bear_strategy': 'breakout', 'bear_bb_std_mult': 1.7465480350114995, 'bear_rsi_os': 37, 'bear_rsi_ob': 66, 'bear_adx_thresh': 12.640033282646337, 'bear_atr_min_pct': 0.005365987755851442, 'bear_atr_max_pct': 0.07620192724156157, 'bear_tp_mult': 1.6850034658703077, 'bear_tsl_mult': 0.7399485450357971, 'bear_time_stop': 37, 'bear_use_sma': False, 'bear_use_ema': False, 'bear_use_atr': True, 'bear_use_adx': False, 'bear_use_spike': False, 'bear_rsi_required': False, 'sideways_strategy': 'breakout', 'sideways_bb_std_mult': 2.9535255200104573, 'sideways_rsi_os': 54, 'sideways_rsi_ob': 90, 'sideways_adx_thresh': 34.34305226766604, 'sideways_atr_min_pct': 0.024389628127498036, 'sideways_atr_max_pct': 0.04030977840525159, 'sideways_tp_mult': 2.3073978004174847, 'sideways_tsl_mult': 0.9003596468588206, 'sideways_time_stop': 236, 'sideways_use_sma': True, 'sideways_use_ema': True, 'sideways_use_atr': True, 'sideways_use_adx': False, 'sideways_use_spike': False, 'sideways_rsi_required': False}.
[I 2025-08-31 03:44:09,143] Trial 90 finished with values: [-1000000000.0, 1000000000.0] and parameters: {'p_sma': 58, 'p_std': 15, 'p_atr': 17, 'p_adx': 9, 'rsi_period': 7, 'ema1': 15, 'ema2': 35, 'slip_atr_k': 0.1517601418008854, 'slip_spread_k': 0.8030449529099376, 'spread_hl_frac': 0.026949025886022576, 'bb_std_mult': 0.7767014470750162, 'rsi_os': 8, 'rsi_ob': 77, 'vol_spike': 0.157717682987185, 'adx_thresh': 22.959785415696615, 'atr_min_pct': 0.005443530720339183, 'atr_max_pct': 0.05185351356399612, 'tp_mult': 1.7537321116710625, 'tsl_mult': 0.17649130712788458, 'strategy': 'mean_reversion', 'time_stop': 167, 'use_sma': False, 'use_atr': False, 'use_adx': True, 'use_ema': True, 'use_spike': False, 'rsi_required': True, 'edge_k': 0.2580632798910588, 'edge_cap': 0.4966780523634895, 'bull_strategy': 'breakout', 'bull_bb_std_mult': 2.557540566669552, 'bull_rsi_os': 29, 'bull_rsi_ob': 91, 'bull_adx_thresh': 33.178310613141946, 'bull_atr_min_pct': 0.0034389355484271086, 'bull_atr_max_pct': 0.14476550092971924, 'bull_tp_mult': 2.749471597085275, 'bull_tsl_mult': 0.7651734118668742, 'bull_time_stop': 260, 'bull_use_sma': True, 'bull_use_ema': True, 'bull_use_atr': True, 'bull_use_adx': False, 'bull_use_spike': True, 'bull_rsi_required': False, 'bear_strategy': 'breakout', 'bear_bb_std_mult': 1.9487497212420921, 'bear_rsi_os': 38, 'bear_rsi_ob': 61, 'bear_adx_thresh': 10.289879670587942, 'bear_atr_min_pct': 0.013950870410505583, 'bear_atr_max_pct': 0.08870316125182964, 'bear_tp_mult': 1.2026531610416593, 'bear_tsl_mult': 0.6119829693236292, 'bear_time_stop': 60, 'bear_use_sma': False, 'bear_use_ema': False, 'bear_use_atr': True, 'bear_use_adx': False, 'bear_use_spike': False, 'bear_rsi_required': False, 'sideways_strategy': 'breakout', 'sideways_bb_std_mult': 3.100129609644397, 'sideways_rsi_os': 50, 'sideways_rsi_ob': 86, 'sideways_adx_thresh': 27.541422327767776, 'sideways_atr_min_pct': 0.02830840585410442, 'sideways_atr_max_pct': 0.06165803457471196, 'sideways_tp_mult': 2.739672086393001, 'sideways_tsl_mult': 0.7097253265190077, 'sideways_time_stop': 284, 'sideways_use_sma': True, 'sideways_use_ema': True, 'sideways_use_atr': True, 'sideways_use_adx': False, 'sideways_use_spike': False, 'sideways_rsi_required': False}.
[I 2025-08-31 03:44:09,834] Trial 87 finished with values: [-1000000000.0, 1000000000.0] and parameters: {'p_sma': 55, 'p_std': 15, 'p_atr': 10, 'p_adx': 19, 'rsi_period': 24, 'ema1': 22, 'ema2': 44, 'slip_atr_k': 0.149689227360832, 'slip_spread_k': 0.9598129625530512, 'spread_hl_frac': 0.020615112944543403, 'bb_std_mult': 0.764969049398872, 'rsi_os': 15, 'rsi_ob': 92, 'vol_spike': 0.14842719563625112, 'adx_thresh': 23.162658248594887, 'atr_min_pct': 0.009882574698437917, 'atr_max_pct': 0.08043908350712556, 'tp_mult': 1.3898665853962253, 'tsl_mult': 0.17792756895074902, 'strategy': 'mean_reversion', 'time_stop': 195, 'use_sma': False, 'use_atr': False, 'use_adx': True, 'use_ema': True, 'use_spike': False, 'rsi_required': True, 'edge_k': 0.3816179907728162, 'edge_cap': 0.3591549717260267, 'bull_strategy': 'breakout', 'bull_bb_std_mult': 2.493279372369253, 'bull_rsi_os': 29, 'bull_rsi_ob': 90, 'bull_adx_thresh': 30.4224540388443, 'bull_atr_min_pct': 0.00337093313932078, 'bull_atr_max_pct': 0.14169183762362333, 'bull_tp_mult': 2.839296511741707, 'bull_tsl_mult': 0.7626237864898695, 'bull_time_stop': 271, 'bull_use_sma': True, 'bull_use_ema': True, 'bull_use_atr': True, 'bull_use_adx': False, 'bull_use_spike': True, 'bull_rsi_required': False, 'bear_strategy': 'breakout', 'bear_bb_std_mult': 1.7291209580953575, 'bear_rsi_os': 37, 'bear_rsi_ob': 69, 'bear_adx_thresh': 12.57264310843781, 'bear_atr_min_pct': 0.0026586690908191545, 'bear_atr_max_pct': 0.06063459985382731, 'bear_tp_mult': 1.682330871319067, 'bear_tsl_mult': 0.6189429194194327, 'bear_time_stop': 45, 'bear_use_sma': False, 'bear_use_ema': False, 'bear_use_atr': True, 'bear_use_adx': False, 'bear_use_spike': False, 'bear_rsi_required': False, 'sideways_strategy': 'breakout', 'sideways_bb_std_mult': 2.7885539235678016, 'sideways_rsi_os': 55, 'sideways_rsi_ob': 86, 'sideways_adx_thresh': 27.320548362128086, 'sideways_atr_min_pct': 0.02660515782745642, 'sideways_atr_max_pct': 0.060778040929627394, 'sideways_tp_mult': 2.471487778116006, 'sideways_tsl_mult': 0.7318101822665409, 'sideways_time_stop': 267, 'sideways_use_sma': True, 'sideways_use_ema': True, 'sideways_use_atr': True, 'sideways_use_adx': False, 'sideways_use_spike': False, 'sideways_rsi_required': False}.
[I 2025-08-31 03:44:09,896] Trial 88 finished with values: [-1000000000.0, 1000000000.0] and parameters: {'p_sma': 57, 'p_std': 15, 'p_atr': 15, 'p_adx': 9, 'rsi_period': 13, 'ema1': 21, 'ema2': 35, 'slip_atr_k': 0.13430202352933185, 'slip_spread_k': 0.9611259210817829, 'spread_hl_frac': 0.027073638855583403, 'bb_std_mult': 0.7994780656710851, 'rsi_os': 6, 'rsi_ob': 95, 'vol_spike': 0.15418569707029608, 'adx_thresh': 23.136203722042254, 'atr_min_pct': 0.0096863918309602, 'atr_max_pct': 0.07476878399621306, 'tp_mult': 1.397835184366854, 'tsl_mult': 0.1848443439671562, 'strategy': 'mean_reversion', 'time_stop': 161, 'use_sma': False, 'use_atr': False, 'use_adx': True, 'use_ema': True, 'use_spike': False, 'rsi_required': True, 'edge_k': 0.25458438698810637, 'edge_cap': 0.4432352012740355, 'bull_strategy': 'breakout', 'bull_bb_std_mult': 2.4230750347965184, 'bull_rsi_os': 29, 'bull_rsi_ob': 91, 'bull_adx_thresh': 34.951062341546255, 'bull_atr_min_pct': 0.004667285495720061, 'bull_atr_max_pct': 0.14146274232986178, 'bull_tp_mult': 2.8549768606445305, 'bull_tsl_mult': 0.7506873842728546, 'bull_time_stop': 271, 'bull_use_sma': True, 'bull_use_ema': True, 'bull_use_atr': True, 'bull_use_adx': False, 'bull_use_spike': True, 'bull_rsi_required': False, 'bear_strategy': 'breakout', 'bear_bb_std_mult': 1.9982767304489555, 'bear_rsi_os': 38, 'bear_rsi_ob': 60, 'bear_adx_thresh': 12.605439844856367, 'bear_atr_min_pct': 0.013280213126395888, 'bear_atr_max_pct': 0.07562682149351863, 'bear_tp_mult': 1.2329905997454305, 'bear_tsl_mult': 0.6224715310354599, 'bear_time_stop': 47, 'bear_use_sma': False, 'bear_use_ema': False, 'bear_use_atr': True, 'bear_use_adx': False, 'bear_use_spike': False, 'bear_rsi_required': False, 'sideways_strategy': 'breakout', 'sideways_bb_std_mult': 2.955238725133471, 'sideways_rsi_os': 50, 'sideways_rsi_ob': 80, 'sideways_adx_thresh': 27.82134684236789, 'sideways_atr_min_pct': 0.027767924056764183, 'sideways_atr_max_pct': 0.06313372780605463, 'sideways_tp_mult': 2.4571419899438127, 'sideways_tsl_mult': 0.7277410273061021, 'sideways_time_stop': 287, 'sideways_use_sma': True, 'sideways_use_ema': True, 'sideways_use_atr': True, 'sideways_use_adx': False, 'sideways_use_spike': False, 'sideways_rsi_required': False}.
