[I 2025-08-31 05:35:42,678] Trial 729 finished with values: [-1000000000.0, 1000000000.0] and parameters: {'p_sma': 56, 'p_std': 12, 'p_atr': 28, 'p_adx': 22, 'rsi_period': 32, 'ema1': 23, 'ema2': 23, 'slip_atr_k': 0.011090654510967728, 'slip_spread_k': 0.6161814281781771, 'spread_hl_frac': 0.015761907688558598, 'bb_std_mult': 2.0106254600287974, 'rsi_os': 24, 'rsi_ob': 60, 'vol_spike': 0.03593091393379761, 'adx_thresh': 18.54198900405192, 'atr_min_pct': 0.019506659115218115, 'atr_max_pct': 0.11829775305872338, 'tp_mult': 2.424477512644509, 'tsl_mult': 0.6528017394484706, 'strategy': 'mean_reversion', 'time_stop': 35, 'use_sma': False, 'use_atr': True, 'use_adx': False, 'use_ema': False, 'use_spike': True, 'rsi_required': True, 'edge_k': 0.2072077660359219, 'edge_cap': 0.7613503030485456, 'bull_strategy': 'mean_reversion', 'bull_bb_std_mult': 0.8264776797556017, 'bull_rsi_os': 41, 'bull_rsi_ob': 77, 'bull_adx_thresh': 32.658006366484386, 'bull_atr_min_pct': 0.005000431564639935, 'bull_atr_max_pct': 0.014623489279657703, 'bull_tp_mult': 1.3796834106285296, 'bull_tsl_mult': 0.023075499969974378, 'bull_time_stop': 185, 'bull_use_sma': False, 'bull_use_ema': True, 'bull_use_atr': True, 'bull_use_adx': True, 'bull_use_spike': False, 'bull_rsi_required': False, 'bear_strategy': 'breakout', 'bear_bb_std_mult': 1.2618417471381747, 'bear_rsi_os': 11, 'bear_rsi_ob': 80, 'bear_adx_thresh': 9.64275623657529, 'bear_atr_min_pct': 0.008708040794746888, 'bear_atr_max_pct': 0.030293526280095802, 'bear_tp_mult': 1.1021305531742793, 'bear_tsl_mult': 0.19591196255776766, 'bear_time_stop': 244, 'bear_use_sma': True, 'bear_use_ema': False, 'bear_use_atr': True, 'bear_use_adx': False, 'bear_use_spike': False, 'bear_rsi_required': False, 'sideways_strategy': 'breakout', 'sideways_bb_std_mult': 1.0416320407272808, 'sideways_rsi_os': 55, 'sideways_rsi_ob': 50, 'sideways_adx_thresh': 21.741740029869263, 'sideways_atr_min_pct': 0.016349971836665998, 'sideways_atr_max_pct': 0.09698049690252805, 'sideways_tp_mult': 2.3559766822212844, 'sideways_tsl_mult': 0.24521800680987804, 'sideways_time_stop': 165, 'sideways_use_sma': False, 'sideways_use_ema': True, 'sideways_use_atr': False, 'sideways_use_adx': False, 'sideways_use_spike': True, 'sideways_rsi_required': True}.
[I 2025-08-31 05:35:43,887] Trial 730 finished with values: [-1000000000.0, 1000000000.0] and parameters: {'p_sma': 56, 'p_std': 14, 'p_atr': 30, 'p_adx': 28, 'rsi_period': 23, 'ema1': 19, 'ema2': 23, 'slip_atr_k': 0.22797504512880715, 'slip_spread_k': 0.6853535379433313, 'spread_hl_frac': 0.008009021273984108, 'bb_std_mult': 2.01051052561797, 'rsi_os': 26, 'rsi_ob': 60, 'vol_spike': 0.0170957911567632, 'adx_thresh': 7.270157808287907, 'atr_min_pct': 0.007697575534314944, 'atr_max_pct': 0.11807633335809342, 'tp_mult': 2.4105842571269473, 'tsl_mult': 0.6472585335888427, 'strategy': 'mean_reversion', 'time_stop': 39, 'use_sma': False, 'use_atr': True, 'use_adx': False, 'use_ema': False, 'use_spike': True, 'rsi_required': True, 'edge_k': 0.5398792661844017, 'edge_cap': 0.3715668921661442, 'bull_strategy': 'mean_reversion', 'bull_bb_std_mult': 1.2247397229267758, 'bull_rsi_os': 26, 'bull_rsi_ob': 76, 'bull_adx_thresh': 9.855317897991013, 'bull_atr_min_pct': 0.028796495947389283, 'bull_atr_max_pct': 0.01569260793513762, 'bull_tp_mult': 1.5278002336114176, 'bull_tsl_mult': 0.6948214056533348, 'bull_time_stop': 185, 'bull_use_sma': False, 'bull_use_ema': True, 'bull_use_atr': True, 'bull_use_adx': True, 'bull_use_spike': False, 'bull_rsi_required': False, 'bear_strategy': 'breakout', 'bear_bb_std_mult': 2.5104517971915947, 'bear_rsi_os': 11, 'bear_rsi_ob': 75, 'bear_adx_thresh': 33.698063704677445, 'bear_atr_min_pct': 0.00855592828578127, 'bear_atr_max_pct': 0.10776498888341914, 'bear_tp_mult': 1.3117807740175134, 'bear_tsl_mult': 0.47612377750137297, 'bear_time_stop': 249, 'bear_use_sma': True, 'bear_use_ema': False, 'bear_use_atr': True, 'bear_use_adx': False, 'bear_use_spike': False, 'bear_rsi_required': False, 'sideways_strategy': 'breakout', 'sideways_bb_std_mult': 1.337320110080758, 'sideways_rsi_os': 15, 'sideways_rsi_ob': 57, 'sideways_adx_thresh': 21.735433804947096, 'sideways_atr_min_pct': 0.01613223316805808, 'sideways_atr_max_pct': 0.06801630720976931, 'sideways_tp_mult': 2.0700190068907776, 'sideways_tsl_mult': 0.5266811300156184, 'sideways_time_stop': 28, 'sideways_use_sma': False, 'sideways_use_ema': True, 'sideways_use_atr': False, 'sideways_use_adx': False, 'sideways_use_spike': True, 'sideways_rsi_required': True}.
[I 2025-08-31 05:35:44,126] Trial 728 finished with values: [-1000000000.0, 1000000000.0] and parameters: {'p_sma': 56, 'p_std': 12, 'p_atr': 11, 'p_adx': 9, 'rsi_period': 23, 'ema1': 23, 'ema2': 23, 'slip_atr_k': 0.13830000227084954, 'slip_spread_k': 0.7813192036919872, 'spread_hl_frac': 0.011641473596890288, 'bb_std_mult': 3.5258693638453655, 'rsi_os': 21, 'rsi_ob': 60, 'vol_spike': 0.11197913697189545, 'adx_thresh': 12.02891770844225, 'atr_min_pct': 0.023329057884649895, 'atr_max_pct': 0.1033878564640269, 'tp_mult': 2.42233591301077, 'tsl_mult': 0.09510779222461374, 'strategy': 'mean_reversion', 'time_stop': 41, 'use_sma': False, 'use_atr': True, 'use_adx': False, 'use_ema': False, 'use_spike': True, 'rsi_required': True, 'edge_k': 0.54023878603307, 'edge_cap': 0.7592836372365216, 'bull_strategy': 'mean_reversion', 'bull_bb_std_mult': 2.8278882521863116, 'bull_rsi_os': 41, 'bull_rsi_ob': 77, 'bull_adx_thresh': 30.378867427127943, 'bull_atr_min_pct': 2.5473756341661425e-05, 'bull_atr_max_pct': 0.014839098120407845, 'bull_tp_mult': 1.8102969968678764, 'bull_tsl_mult': 0.7684698685435123, 'bull_time_stop': 243, 'bull_use_sma': False, 'bull_use_ema': True, 'bull_use_atr': True, 'bull_use_adx': True, 'bull_use_spike': False, 'bull_rsi_required': False, 'bear_strategy': 'breakout', 'bear_bb_std_mult': 0.9406141979026859, 'bear_rsi_os': 12, 'bear_rsi_ob': 76, 'bear_adx_thresh': 33.51213592883112, 'bear_atr_min_pct': 0.008784983127840587, 'bear_atr_max_pct': 0.04299087654189939, 'bear_tp_mult': 1.112598623397578, 'bear_tsl_mult': 0.20315299763888775, 'bear_time_stop': 244, 'bear_use_sma': True, 'bear_use_ema': False, 'bear_use_atr': True, 'bear_use_adx': False, 'bear_use_spike': False, 'bear_rsi_required': False, 'sideways_strategy': 'breakout', 'sideways_bb_std_mult': 3.312787039032197, 'sideways_rsi_os': 35, 'sideways_rsi_ob': 50, 'sideways_adx_thresh': 24.010970206703796, 'sideways_atr_min_pct': 0.013869165702413509, 'sideways_atr_max_pct': 0.09177403184105515, 'sideways_tp_mult': 2.1358034098013445, 'sideways_tsl_mult': 0.5355123716190681, 'sideways_time_stop': 190, 'sideways_use_sma': False, 'sideways_use_ema': True, 'sideways_use_atr': False, 'sideways_use_adx': False, 'sideways_use_spike': True, 'sideways_rsi_required': True}.
[I 2025-08-31 05:35:46,000] Trial 732 finished with values: [-1000000000.0, 1000000000.0] and parameters: {'p_sma': 6, 'p_std': 14, 'p_atr': 11, 'p_adx': 9, 'rsi_period': 57, 'ema1': 25, 'ema2': 25, 'slip_atr_k': 0.07431763921462901, 'slip_spread_k': 0.8373138939428892, 'spread_hl_frac': 0.044575311608107675, 'bb_std_mult': 2.897069816348654, 'rsi_os': 25, 'rsi_ob': 59, 'vol_spike': 0.2750651809735448, 'adx_thresh': 30.10459674786494, 'atr_min_pct': 0.02800233565996836, 'atr_max_pct': 0.11146784281558263, 'tp_mult': 1.9025518607146135, 'tsl_mult': 0.811021960400076, 'strategy': 'mean_reversion', 'time_stop': 40, 'use_sma': False, 'use_atr': True, 'use_adx': False, 'use_ema': False, 'use_spike': True, 'rsi_required': True, 'edge_k': 0.0764361415869918, 'edge_cap': 0.6124914168606795, 'bull_strategy': 'breakout', 'bull_bb_std_mult': 0.7127005016405782, 'bull_rsi_os': 53, 'bull_rsi_ob': 89, 'bull_adx_thresh': 18.445837552690726, 'bull_atr_min_pct': 0.02226829563932457, 'bull_atr_max_pct': 0.01486752263650093, 'bull_tp_mult': 1.8191081174218922, 'bull_tsl_mult': 0.9388072554645093, 'bull_time_stop': 211, 'bull_use_sma': False, 'bull_use_ema': False, 'bull_use_atr': True, 'bull_use_adx': True, 'bull_use_spike': False, 'bull_rsi_required': False, 'bear_strategy': 'breakout', 'bear_bb_std_mult': 0.9389827405101463, 'bear_rsi_os': 10, 'bear_rsi_ob': 71, 'bear_adx_thresh': 9.354616859623436, 'bear_atr_min_pct': 0.016206831254700182, 'bear_atr_max_pct': 0.04165650751095015, 'bear_tp_mult': 1.1343272353795029, 'bear_tsl_mult': 0.5173126513533375, 'bear_time_stop': 41, 'bear_use_sma': True, 'bear_use_ema': True, 'bear_use_atr': True, 'bear_use_adx': False, 'bear_use_spike': False, 'bear_rsi_required': False, 'sideways_strategy': 'breakout', 'sideways_bb_std_mult': 1.1595708847550517, 'sideways_rsi_os': 15, 'sideways_rsi_ob': 54, 'sideways_adx_thresh': 23.299765878587014, 'sideways_atr_min_pct': 0.02975975045574218, 'sideways_atr_max_pct': 0.03847722393485159, 'sideways_tp_mult': 2.071724517394574, 'sideways_tsl_mult': 0.25207133539341986, 'sideways_time_stop': 27, 'sideways_use_sma': False, 'sideways_use_ema': True, 'sideways_use_atr': False, 'sideways_use_adx': False, 'sideways_use_spike': True, 'sideways_rsi_required': True}.
[I 2025-08-31 05:36:35,633] Trial 733 finished with values: [-1000000000.0, 1000000000.0] and parameters: {'p_sma': 58, 'p_std': 43, 'p_atr': 17, 'p_adx': 9, 'rsi_period': 17, 'ema1': 28, 'ema2': 60, 'slip_atr_k': 0.07374331424532779, 'slip_spread_k': 0.6581989651381274, 'spread_hl_frac': 0.008163696428967483, 'bb_std_mult': 2.5036511659994707, 'rsi_os': 38, 'rsi_ob': 59, 'vol_spike': 0.016631561140557572, 'adx_thresh': 10.339522752142507, 'atr_min_pct': 0.022833459050070545, 'atr_max_pct': 0.11252762704388725, 'tp_mult': 1.9056418379773077, 'tsl_mult': 0.815569659853831, 'strategy': 'mean_reversion', 'time_stop': 206, 'use_sma': False, 'use_atr': True, 'use_adx': False, 'use_ema': False, 'use_spike': True, 'rsi_required': True, 'edge_k': 1.9235616661871187, 'edge_cap': 0.7835247773752172, 'bull_strategy': 'breakout', 'bull_bb_std_mult': 1.5091654856361627, 'bull_rsi_os': 7, 'bull_rsi_ob': 79, 'bull_adx_thresh': 7.994182639928089, 'bull_atr_min_pct': 0.028976575698503027, 'bull_atr_max_pct': 0.027359017835281423, 'bull_tp_mult': 1.8122892365382648, 'bull_tsl_mult': 0.7171885183166541, 'bull_time_stop': 15, 'bull_use_sma': False, 'bull_use_ema': False, 'bull_use_atr': True, 'bull_use_adx': True, 'bull_use_spike': False, 'bull_rsi_required': False, 'bear_strategy': 'breakout', 'bear_bb_std_mult': 0.5549459366896092, 'bear_rsi_os': 35, 'bear_rsi_ob': 67, 'bear_adx_thresh': 10.576503680702093, 'bear_atr_min_pct': 0.006859068765256914, 'bear_atr_max_pct': 0.12488541809893827, 'bear_tp_mult': 1.3032830351227278, 'bear_tsl_mult': 0.9235558333086116, 'bear_time_stop': 66, 'bear_use_sma': True, 'bear_use_ema': True, 'bear_use_atr': True, 'bear_use_adx': False, 'bear_use_spike': False, 'bear_rsi_required': True, 'sideways_strategy': 'breakout', 'sideways_bb_std_mult': 1.411851484621901, 'sideways_rsi_os': 41, 'sideways_rsi_ob': 53, 'sideways_adx_thresh': 5.7326969452498595, 'sideways_atr_min_pct': 0.007439419632070334, 'sideways_atr_max_pct': 0.0753042384721139, 'sideways_tp_mult': 2.1791668642877666, 'sideways_tsl_mult': 0.5239831344486564, 'sideways_time_stop': 192, 'sideways_use_sma': False, 'sideways_use_ema': True, 'sideways_use_atr': False, 'sideways_use_adx': False, 'sideways_use_spike': True, 'sideways_rsi_required': True}.
[I 2025-08-31 05:36:36,063] Trial 735 finished with values: [-1000000000.0, 1000000000.0] and parameters: {'p_sma': 58, 'p_std': 47, 'p_atr': 17, 'p_adx': 12, 'rsi_period': 17, 'ema1': 17, 'ema2': 54, 'slip_atr_k': 0.023297067954076028, 'slip_spread_k': 0.8309490220296001, 'spread_hl_frac': 0.006641753111700302, 'bb_std_mult': 2.5051041051179794, 'rsi_os': 38, 'rsi_ob': 59, 'vol_spike': 0.009237936979398686, 'adx_thresh': 19.372848271444408, 'atr_min_pct': 0.02230170159114469, 'atr_max_pct': 0.13016615978774648, 'tp_mult': 2.238328302846741, 'tsl_mult': 0.8127489561027252, 'strategy': 'mean_reversion', 'time_stop': 21, 'use_sma': False, 'use_atr': True, 'use_adx': False, 'use_ema': False, 'use_spike': True, 'rsi_required': True, 'edge_k': 0.07590821430789307, 'edge_cap': 0.6226182735730276, 'bull_strategy': 'breakout', 'bull_bb_std_mult': 0.9914843155170711, 'bull_rsi_os': 53, 'bull_rsi_ob': 79, 'bull_adx_thresh': 18.379744234786052, 'bull_atr_min_pct': 0.02487410939631675, 'bull_atr_max_pct': 0.019592167859401932, 'bull_tp_mult': 1.6411874001290132, 'bull_tsl_mult': 0.8710527623906454, 'bull_time_stop': 235, 'bull_use_sma': False, 'bull_use_ema': False, 'bull_use_atr': True, 'bull_use_adx': True, 'bull_use_spike': False, 'bull_rsi_required': False, 'bear_strategy': 'breakout', 'bear_bb_std_mult': 0.5684849160100136, 'bear_rsi_os': 49, 'bear_rsi_ob': 69, 'bear_adx_thresh': 10.990923977094155, 'bear_atr_min_pct': 0.007740972862111805, 'bear_atr_max_pct': 0.04024158091468943, 'bear_tp_mult': 1.604922355818788, 'bear_tsl_mult': 0.26227494822096686, 'bear_time_stop': 218, 'bear_use_sma': True, 'bear_use_ema': True, 'bear_use_atr': True, 'bear_use_adx': False, 'bear_use_spike': False, 'bear_rsi_required': True, 'sideways_strategy': 'breakout', 'sideways_bb_std_mult': 1.1625285764198392, 'sideways_rsi_os': 46, 'sideways_rsi_ob': 53, 'sideways_adx_thresh': 26.34946989145431, 'sideways_atr_min_pct': 0.014630630535225437, 'sideways_atr_max_pct': 0.022810261455061223, 'sideways_tp_mult': 2.1866865156472377, 'sideways_tsl_mult': 0.15167576019890822, 'sideways_time_stop': 131, 'sideways_use_sma': False, 'sideways_use_ema': True, 'sideways_use_atr': False, 'sideways_use_adx': False, 'sideways_use_spike': True, 'sideways_rsi_required': True}.
[I 2025-08-31 05:36:36,411] Trial 736 finished with values: [-1000000000.0, 1000000000.0] and parameters: {'p_sma': 8, 'p_std': 15, 'p_atr': 14, 'p_adx': 21, 'rsi_period': 18, 'ema1': 28, 'ema2': 27, 'slip_atr_k': 0.01937842123083769, 'slip_spread_k': 0.7641919078510129, 'spread_hl_frac': 0.006673118463586803, 'bb_std_mult': 2.1520580693872473, 'rsi_os': 33, 'rsi_ob': 88, 'vol_spike': 0.007578445500515228, 'adx_thresh': 10.49328925525827, 'atr_min_pct': 0.022149131370029863, 'atr_max_pct': 0.12953735244779813, 'tp_mult': 1.1239068537049928, 'tsl_mult': 0.7469022268642231, 'strategy': 'mean_reversion', 'time_stop': 23, 'use_sma': False, 'use_atr': True, 'use_adx': False, 'use_ema': False, 'use_spike': True, 'rsi_required': True, 'edge_k': 1.8876661351984816, 'edge_cap': 0.5510490203398962, 'bull_strategy': 'breakout', 'bull_bb_std_mult': 0.9742142225003899, 'bull_rsi_os': 37, 'bull_rsi_ob': 79, 'bull_adx_thresh': 7.908399264699929, 'bull_atr_min_pct': 0.0084018394960518, 'bull_atr_max_pct': 0.07145549425106787, 'bull_tp_mult': 2.9975976097434236, 'bull_tsl_mult': 0.8772399543915879, 'bull_time_stop': 234, 'bull_use_sma': False, 'bull_use_ema': False, 'bull_use_atr': True, 'bull_use_adx': True, 'bull_use_spike': False, 'bull_rsi_required': False, 'bear_strategy': 'breakout', 'bear_bb_std_mult': 3.275088843104237, 'bear_rsi_os': 49, 'bear_rsi_ob': 82, 'bear_adx_thresh': 13.830679821349628, 'bear_atr_min_pct': 0.006695664440930906, 'bear_atr_max_pct': 0.12138409239745024, 'bear_tp_mult': 2.251075124639717, 'bear_tsl_mult': 0.2302691034525342, 'bear_time_stop': 219, 'bear_use_sma': True, 'bear_use_ema': True, 'bear_use_atr': True, 'bear_use_adx': False, 'bear_use_spike': False, 'bear_rsi_required': True, 'sideways_strategy': 'breakout', 'sideways_bb_std_mult': 1.1746158159169056, 'sideways_rsi_os': 47, 'sideways_rsi_ob': 53, 'sideways_adx_thresh': 26.027357752253018, 'sideways_atr_min_pct': 0.01490444138488967, 'sideways_atr_max_pct': 0.014846737886295272, 'sideways_tp_mult': 2.2045555316458474, 'sideways_tsl_mult': 0.499654419157109, 'sideways_time_stop': 287, 'sideways_use_sma': True, 'sideways_use_ema': True, 'sideways_use_atr': False, 'sideways_use_adx': False, 'sideways_use_spike': True, 'sideways_rsi_required': True}.
[I 2025-08-31 05:36:37,357] Trial 734 finished with values: [-1000000000.0, 1000000000.0] and parameters: {'p_sma': 6, 'p_std': 15, 'p_atr': 17, 'p_adx': 9, 'rsi_period': 17, 'ema1': 17, 'ema2': 27, 'slip_atr_k': 0.00016255474260425118, 'slip_spread_k': 0.8378186371642705, 'spread_hl_frac': 0.023695773269131457, 'bb_std_mult': 1.12297818995341, 'rsi_os': 39, 'rsi_ob': 59, 'vol_spike': 0.2715332430244995, 'adx_thresh': 10.34708175842095, 'atr_min_pct': 0.023497152601979536, 'atr_max_pct': 0.11044408134006624, 'tp_mult': 2.0398153714443055, 'tsl_mult': 0.9847499808407287, 'strategy': 'mean_reversion', 'time_stop': 23, 'use_sma': False, 'use_atr': True, 'use_adx': False, 'use_ema': False, 'use_spike': True, 'rsi_required': True, 'edge_k': 0.8010914759004796, 'edge_cap': 0.6210325406970981, 'bull_strategy': 'breakout', 'bull_bb_std_mult': 1.7377265504152888, 'bull_rsi_os': 35, 'bull_rsi_ob': 54, 'bull_adx_thresh': 8.289894175084935, 'bull_atr_min_pct': 0.008379198620194955, 'bull_atr_max_pct': 0.0702109024050027, 'bull_tp_mult': 1.6102931050438898, 'bull_tsl_mult': 0.7656416466354541, 'bull_time_stop': 237, 'bull_use_sma': False, 'bull_use_ema': False, 'bull_use_atr': True, 'bull_use_adx': True, 'bull_use_spike': False, 'bull_rsi_required': False, 'bear_strategy': 'breakout', 'bear_bb_std_mult': 0.5717717813117724, 'bear_rsi_os': 49, 'bear_rsi_ob': 82, 'bear_adx_thresh': 13.794468083159845, 'bear_atr_min_pct': 0.01501406376972831, 'bear_atr_max_pct': 0.041153230558916176, 'bear_tp_mult': 1.1472256827008205, 'bear_tsl_mult': 0.269765132427191, 'bear_time_stop': 257, 'bear_use_sma': True, 'bear_use_ema': True, 'bear_use_atr': True, 'bear_use_adx': False, 'bear_use_spike': False, 'bear_rsi_required': True, 'sideways_strategy': 'breakout', 'sideways_bb_std_mult': 1.179900084255704, 'sideways_rsi_os': 46, 'sideways_rsi_ob': 54, 'sideways_adx_thresh': 26.30368595426364, 'sideways_atr_min_pct': 0.01462413612019712, 'sideways_atr_max_pct': 0.136729092690076, 'sideways_tp_mult': 2.0537053332084794, 'sideways_tsl_mult': 0.5049481904325105, 'sideways_time_stop': 289, 'sideways_use_sma': False, 'sideways_use_ema': True, 'sideways_use_atr': False, 'sideways_use_adx': False, 'sideways_use_spike': True, 'sideways_rsi_required': True}.
[I 2025-08-31 05:36:38,607] Trial 738 finished with values: [-1000000000.0, 1000000000.0] and parameters: {'p_sma': 57, 'p_std': 15, 'p_atr': 14, 'p_adx': 11, 'rsi_period': 41, 'ema1': 27, 'ema2': 46, 'slip_atr_k': 0.018463193986943197, 'slip_spread_k': 0.6318147199088776, 'spread_hl_frac': 0.04192095033724524, 'bb_std_mult': 2.131600189967837, 'rsi_os': 53, 'rsi_ob': 61, 'vol_spike': 0.24751795568522816, 'adx_thresh': 11.21873451699506, 'atr_min_pct': 0.006538969900257581, 'atr_max_pct': 0.04929286721225941, 'tp_mult': 1.7823119136012475, 'tsl_mult': 0.742739142603627, 'strategy': 'mean_reversion', 'time_stop': 33, 'use_sma': True, 'use_atr': True, 'use_adx': False, 'use_ema': True, 'use_spike': False, 'rsi_required': True, 'edge_k': 1.1393202214338742, 'edge_cap': 0.09563351335062559, 'bull_strategy': 'mean_reversion', 'bull_bb_std_mult': 0.9225021279570711, 'bull_rsi_os': 37, 'bull_rsi_ob': 78, 'bull_adx_thresh': 17.382887517761933, 'bull_atr_min_pct': 0.007607207500506266, 'bull_atr_max_pct': 0.05855706741297452, 'bull_tp_mult': 1.617382067901991, 'bull_tsl_mult': 0.8691082990473393, 'bull_time_stop': 39, 'bull_use_sma': False, 'bull_use_ema': False, 'bull_use_atr': False, 'bull_use_adx': True, 'bull_use_spike': True, 'bull_rsi_required': False, 'bear_strategy': 'breakout', 'bear_bb_std_mult': 0.8268610787505372, 'bear_rsi_os': 25, 'bear_rsi_ob': 93, 'bear_adx_thresh': 17.08930163146765, 'bear_atr_min_pct': 0.018377548035963455, 'bear_atr_max_pct': 0.11723723970293745, 'bear_tp_mult': 2.2773347890159155, 'bear_tsl_mult': 0.28082270989488745, 'bear_time_stop': 270, 'bear_use_sma': True, 'bear_use_ema': True, 'bear_use_atr': True, 'bear_use_adx': False, 'bear_use_spike': False, 'bear_rsi_required': True, 'sideways_strategy': 'breakout', 'sideways_bb_std_mult': 3.059983778728456, 'sideways_rsi_os': 50, 'sideways_rsi_ob': 55, 'sideways_adx_thresh': 26.64722226757437, 'sideways_atr_min_pct': 0.014995676785803942, 'sideways_atr_max_pct': 0.0329852261773582, 'sideways_tp_mult': 1.013200599207824, 'sideways_tsl_mult': 0.21159663152483066, 'sideways_time_stop': 213, 'sideways_use_sma': True, 'sideways_use_ema': True, 'sideways_use_atr': False, 'sideways_use_adx': False, 'sideways_use_spike': True, 'sideways_rsi_required': True}.
