[I 2025-08-31 04:42:36,520] Trial 432 finished with values: [-1000000000.0, 1000000000.0] and parameters: {'p_sma': 53, 'p_std': 17, 'p_atr': 21, 'p_adx': 9, 'rsi_period': 24, 'ema1': 13, 'ema2': 28, 'slip_atr_k': 0.12238816207026931, 'slip_spread_k': 0.08840927453424262, 'spread_hl_frac': 0.009463003373588713, 'bb_std_mult': 2.5492786449421336, 'rsi_os': 23, 'rsi_ob': 58, 'vol_spike': 0.14085968300363266, 'adx_thresh': 11.326310626710866, 'atr_min_pct': 0.022108448177889317, 'atr_max_pct': 0.12088021174593572, 'tp_mult': 1.1860920032784423, 'tsl_mult': 0.20434835303986965, 'strategy': 'breakout', 'time_stop': 172, 'use_sma': False, 'use_atr': False, 'use_adx': False, 'use_ema': False, 'use_spike': True, 'rsi_required': True, 'edge_k': 1.3723221982501366, 'edge_cap': 0.5061961535655712, 'bull_strategy': 'mean_reversion', 'bull_bb_std_mult': 2.165840630682697, 'bull_rsi_os': 9, 'bull_rsi_ob': 74, 'bull_adx_thresh': 13.852804175649643, 'bull_atr_min_pct': 0.02299282882334893, 'bull_atr_max_pct': 0.03745914570379413, 'bull_tp_mult': 2.55514815645644, 'bull_tsl_mult': 0.1708305606959336, 'bull_time_stop': 140, 'bull_use_sma': False, 'bull_use_ema': False, 'bull_use_atr': True, 'bull_use_adx': True, 'bull_use_spike': False, 'bull_rsi_required': True, 'bear_strategy': 'mean_reversion', 'bear_bb_std_mult': 3.4299365807075315, 'bear_rsi_os': 9, 'bear_rsi_ob': 50, 'bear_adx_thresh': 21.257319194042775, 'bear_atr_min_pct': 0.01079911370925676, 'bear_atr_max_pct': 0.043467646105755486, 'bear_tp_mult': 2.7942805841022142, 'bear_tsl_mult': 0.2908284948016916, 'bear_time_stop': 146, 'bear_use_sma': True, 'bear_use_ema': True, 'bear_use_atr': False, 'bear_use_adx': True, 'bear_use_spike': True, 'bear_rsi_required': True, 'sideways_strategy': 'mean_reversion', 'sideways_bb_std_mult': 1.5797818304037043, 'sideways_rsi_os': 28, 'sideways_rsi_ob': 54, 'sideways_adx_thresh': 10.661484120542122, 'sideways_atr_min_pct': 0.012052687344614494, 'sideways_atr_max_pct': 0.02726732890958207, 'sideways_tp_mult': 2.410795877793245, 'sideways_tsl_mult': 0.5891680098194476, 'sideways_time_stop': 126, 'sideways_use_sma': True, 'sideways_use_ema': False, 'sideways_use_atr': False, 'sideways_use_adx': True, 'sideways_use_spike': True, 'sideways_rsi_required': True}.
[I 2025-08-31 04:42:36,894] Trial 433 finished with values: [-1000000000.0, 1000000000.0] and parameters: {'p_sma': 16, 'p_std': 17, 'p_atr': 14, 'p_adx': 9, 'rsi_period': 13, 'ema1': 13, 'ema2': 36, 'slip_atr_k': 0.09752952220749114, 'slip_spread_k': 0.024057775339663204, 'spread_hl_frac': 0.005486985532169489, 'bb_std_mult': 2.217843503541116, 'rsi_os': 16, 'rsi_ob': 92, 'vol_spike': 0.04860150929847462, 'adx_thresh': 11.141031477088886, 'atr_min_pct': 0.02212569202764632, 'atr_max_pct': 0.12081107343407338, 'tp_mult': 1.623620176958655, 'tsl_mult': 0.20449121561667805, 'strategy': 'breakout', 'time_stop': 52, 'use_sma': False, 'use_atr': False, 'use_adx': False, 'use_ema': False, 'use_spike': True, 'rsi_required': True, 'edge_k': 1.6255122598474114, 'edge_cap': 0.965785621351307, 'bull_strategy': 'mean_reversion', 'bull_bb_std_mult': 3.502187674493, 'bull_rsi_os': 22, 'bull_rsi_ob': 74, 'bull_adx_thresh': 11.518581532054657, 'bull_atr_min_pct': 0.002630860002042818, 'bull_atr_max_pct': 0.03934825931341678, 'bull_tp_mult': 1.611715812322572, 'bull_tsl_mult': 0.3899502047952778, 'bull_time_stop': 140, 'bull_use_sma': False, 'bull_use_ema': False, 'bull_use_atr': True, 'bull_use_adx': True, 'bull_use_spike': False, 'bull_rsi_required': True, 'bear_strategy': 'mean_reversion', 'bear_bb_std_mult': 0.958334549606522, 'bear_rsi_os': 9, 'bear_rsi_ob': 50, 'bear_adx_thresh': 21.418677709471343, 'bear_atr_min_pct': 0.006921027824384808, 'bear_atr_max_pct': 0.043005278035031166, 'bear_tp_mult': 2.794310419924565, 'bear_tsl_mult': 0.29110857593930684, 'bear_time_stop': 146, 'bear_use_sma': True, 'bear_use_ema': True, 'bear_use_atr': False, 'bear_use_adx': True, 'bear_use_spike': True, 'bear_rsi_required': True, 'sideways_strategy': 'mean_reversion', 'sideways_bb_std_mult': 1.0328545466683672, 'sideways_rsi_os': 28, 'sideways_rsi_ob': 54, 'sideways_adx_thresh': 28.286655008139864, 'sideways_atr_min_pct': 0.012735214545686262, 'sideways_atr_max_pct': 0.09212903048941622, 'sideways_tp_mult': 2.4082092517457068, 'sideways_tsl_mult': 0.20949350992177596, 'sideways_time_stop': 47, 'sideways_use_sma': True, 'sideways_use_ema': False, 'sideways_use_atr': False, 'sideways_use_adx': True, 'sideways_use_spike': True, 'sideways_rsi_required': True}.
[I 2025-08-31 04:42:37,047] Trial 431 finished with values: [-1000000000.0, 1000000000.0] and parameters: {'p_sma': 57, 'p_std': 14, 'p_atr': 24, 'p_adx': 23, 'rsi_period': 44, 'ema1': 13, 'ema2': 27, 'slip_atr_k': 0.024885517732994952, 'slip_spread_k': 0.8935107841574068, 'spread_hl_frac': 0.0070563492752162, 'bb_std_mult': 2.2150018670835783, 'rsi_os': 29, 'rsi_ob': 64, 'vol_spike': 0.021221518854445835, 'adx_thresh': 12.495786476312318, 'atr_min_pct': 0.023909255019864465, 'atr_max_pct': 0.12372482328304472, 'tp_mult': 2.5004594671273295, 'tsl_mult': 0.8960224045000401, 'strategy': 'breakout', 'time_stop': 172, 'use_sma': False, 'use_atr': False, 'use_adx': False, 'use_ema': True, 'use_spike': False, 'rsi_required': False, 'edge_k': 1.3855075021444183, 'edge_cap': 0.9538659153299414, 'bull_strategy': 'mean_reversion', 'bull_bb_std_mult': 3.524782844815085, 'bull_rsi_os': 52, 'bull_rsi_ob': 65, 'bull_adx_thresh': 33.85241447150255, 'bull_atr_min_pct': 0.021300083238034347, 'bull_atr_max_pct': 0.03989015880710522, 'bull_tp_mult': 2.1765685571182343, 'bull_tsl_mult': 0.8935041572731066, 'bull_time_stop': 148, 'bull_use_sma': False, 'bull_use_ema': False, 'bull_use_atr': True, 'bull_use_adx': True, 'bull_use_spike': True, 'bull_rsi_required': True, 'bear_strategy': 'mean_reversion', 'bear_bb_std_mult': 0.9691953186508571, 'bear_rsi_os': 33, 'bear_rsi_ob': 50, 'bear_adx_thresh': 20.50199958010547, 'bear_atr_min_pct': 0.006728367115057211, 'bear_atr_max_pct': 0.04331590698397788, 'bear_tp_mult': 2.672281730353603, 'bear_tsl_mult': 0.28962430245059684, 'bear_time_stop': 67, 'bear_use_sma': True, 'bear_use_ema': True, 'bear_use_atr': True, 'bear_use_adx': True, 'bear_use_spike': True, 'bear_rsi_required': False, 'sideways_strategy': 'mean_reversion', 'sideways_bb_std_mult': 0.9379401032626475, 'sideways_rsi_os': 28, 'sideways_rsi_ob': 57, 'sideways_adx_thresh': 28.059691829751007, 'sideways_atr_min_pct': 0.023423737588228334, 'sideways_atr_max_pct': 0.12436032420363868, 'sideways_tp_mult': 1.7464919707549973, 'sideways_tsl_mult': 0.587253365710759, 'sideways_time_stop': 127, 'sideways_use_sma': False, 'sideways_use_ema': False, 'sideways_use_atr': False, 'sideways_use_adx': True, 'sideways_use_spike': True, 'sideways_rsi_required': True}.
[I 2025-08-31 04:42:38,104] Trial 438 finished with values: [-1000000000.0, 1000000000.0] and parameters: {'p_sma': 55, 'p_std': 41, 'p_atr': 23, 'p_adx': 10, 'rsi_period': 20, 'ema1': 15, 'ema2': 25, 'slip_atr_k': 0.011216316244600111, 'slip_spread_k': 0.05589559373817773, 'spread_hl_frac': 0.010946475300077613, 'bb_std_mult': 3.267949881027312, 'rsi_os': 54, 'rsi_ob': 61, 'vol_spike': 0.015992731647441888, 'adx_thresh': 11.005274312028392, 'atr_min_pct': 0.022899460660820294, 'atr_max_pct': 0.127433612759188, 'tp_mult': 2.6008026577761134, 'tsl_mult': 0.095551036765957, 'strategy': 'mean_reversion', 'time_stop': 258, 'use_sma': False, 'use_atr': True, 'use_adx': True, 'use_ema': False, 'use_spike': True, 'rsi_required': False, 'edge_k': 1.4488432119669383, 'edge_cap': 0.5792751683740868, 'bull_strategy': 'mean_reversion', 'bull_bb_std_mult': 1.0365277907915753, 'bull_rsi_os': 33, 'bull_rsi_ob': 78, 'bull_adx_thresh': 9.571651730708082, 'bull_atr_min_pct': 0.002101394238811766, 'bull_atr_max_pct': 0.04994622677176409, 'bull_tp_mult': 1.7247208512043777, 'bull_tsl_mult': 0.8632396253558536, 'bull_time_stop': 299, 'bull_use_sma': True, 'bull_use_ema': False, 'bull_use_atr': False, 'bull_use_adx': False, 'bull_use_spike': False, 'bull_rsi_required': False, 'bear_strategy': 'mean_reversion', 'bear_bb_std_mult': 0.6866649001210223, 'bear_rsi_os': 39, 'bear_rsi_ob': 47, 'bear_adx_thresh': 32.21929860855944, 'bear_atr_min_pct': 0.0024473981863205943, 'bear_atr_max_pct': 0.12788840746636088, 'bear_tp_mult': 2.8631913847593364, 'bear_tsl_mult': 0.2209132806740564, 'bear_time_stop': 238, 'bear_use_sma': False, 'bear_use_ema': True, 'bear_use_atr': True, 'bear_use_adx': True, 'bear_use_spike': True, 'bear_rsi_required': True, 'sideways_strategy': 'breakout', 'sideways_bb_std_mult': 3.0314156449727365, 'sideways_rsi_os': 26, 'sideways_rsi_ob': 92, 'sideways_adx_thresh': 9.255231971759114, 'sideways_atr_min_pct': 0.014645661602820617, 'sideways_atr_max_pct': 0.11760282941461586, 'sideways_tp_mult': 1.9052390235423502, 'sideways_tsl_mult': 0.39920869235011675, 'sideways_time_stop': 63, 'sideways_use_sma': False, 'sideways_use_ema': True, 'sideways_use_atr': True, 'sideways_use_adx': False, 'sideways_use_spike': False, 'sideways_rsi_required': False}.
[I 2025-08-31 04:43:29,183] Trial 435 finished with values: [-1000000000.0, 1000000000.0] and parameters: {'p_sma': 55, 'p_std': 14, 'p_atr': 23, 'p_adx': 23, 'rsi_period': 12, 'ema1': 17, 'ema2': 56, 'slip_atr_k': 0.09179880132365403, 'slip_spread_k': 0.05405037224029364, 'spread_hl_frac': 0.02993297142088424, 'bb_std_mult': 1.8871408160814958, 'rsi_os': 52, 'rsi_ob': 58, 'vol_spike': 0.019684138004273904, 'adx_thresh': 11.081384288722196, 'atr_min_pct': 0.022455845486122825, 'atr_max_pct': 0.11713963564215553, 'tp_mult': 1.4639003716500218, 'tsl_mult': 0.20497069554900615, 'strategy': 'breakout', 'time_stop': 61, 'use_sma': False, 'use_atr': True, 'use_adx': True, 'use_ema': False, 'use_spike': True, 'rsi_required': False, 'edge_k': 1.463015526804447, 'edge_cap': 0.2949861550299323, 'bull_strategy': 'mean_reversion', 'bull_bb_std_mult': 0.6358506596278295, 'bull_rsi_os': 14, 'bull_rsi_ob': 74, 'bull_adx_thresh': 11.748229833367716, 'bull_atr_min_pct': 0.021087082503895627, 'bull_atr_max_pct': 0.049676813407059255, 'bull_tp_mult': 2.1706330662515256, 'bull_tsl_mult': 0.8607864549874721, 'bull_time_stop': 166, 'bull_use_sma': True, 'bull_use_ema': False, 'bull_use_atr': False, 'bull_use_adx': False, 'bull_use_spike': False, 'bull_rsi_required': True, 'bear_strategy': 'mean_reversion', 'bear_bb_std_mult': 3.4241853758311134, 'bear_rsi_os': 10, 'bear_rsi_ob': 83, 'bear_adx_thresh': 9.903812730599618, 'bear_atr_min_pct': 0.006894315700505464, 'bear_atr_max_pct': 0.05856730077452042, 'bear_tp_mult': 2.6691078420954173, 'bear_tsl_mult': 0.28579912125042434, 'bear_time_stop': 195, 'bear_use_sma': False, 'bear_use_ema': True, 'bear_use_atr': True, 'bear_use_adx': True, 'bear_use_spike': True, 'bear_rsi_required': True, 'sideways_strategy': 'mean_reversion', 'sideways_bb_std_mult': 1.1362278629727958, 'sideways_rsi_os': 28, 'sideways_rsi_ob': 57, 'sideways_adx_thresh': 9.359296335857389, 'sideways_atr_min_pct': 0.011958423220523907, 'sideways_atr_max_pct': 0.11767466856870261, 'sideways_tp_mult': 2.1878775118939857, 'sideways_tsl_mult': 0.11283638048233091, 'sideways_time_stop': 62, 'sideways_use_sma': True, 'sideways_use_ema': True, 'sideways_use_atr': True, 'sideways_use_adx': False, 'sideways_use_spike': False, 'sideways_rsi_required': False}.
[I 2025-08-31 04:43:29,437] Trial 436 finished with values: [-1000000000.0, 1000000000.0] and parameters: {'p_sma': 55, 'p_std': 18, 'p_atr': 23, 'p_adx': 10, 'rsi_period': 51, 'ema1': 25, 'ema2': 24, 'slip_atr_k': 0.01006182248445267, 'slip_spread_k': 0.05458726764734589, 'spread_hl_frac': 0.014022171406839075, 'bb_std_mult': 1.869683405214943, 'rsi_os': 19, 'rsi_ob': 61, 'vol_spike': 0.022307612929082704, 'adx_thresh': 12.88354307182812, 'atr_min_pct': 0.02271260368750408, 'atr_max_pct': 0.1164749434058808, 'tp_mult': 1.5024398974251787, 'tsl_mult': 0.8660758326585308, 'strategy': 'breakout', 'time_stop': 103, 'use_sma': False, 'use_atr': True, 'use_adx': True, 'use_ema': False, 'use_spike': True, 'rsi_required': False, 'edge_k': 1.6167703616508617, 'edge_cap': 0.877640745611147, 'bull_strategy': 'mean_reversion', 'bull_bb_std_mult': 3.4970784221427875, 'bull_rsi_os': 21, 'bull_rsi_ob': 91, 'bull_adx_thresh': 33.285993433338916, 'bull_atr_min_pct': 0.017981743280221316, 'bull_atr_max_pct': 0.013294032090012523, 'bull_tp_mult': 1.5823954344483295, 'bull_tsl_mult': 0.8536976100077014, 'bull_time_stop': 162, 'bull_use_sma': True, 'bull_use_ema': False, 'bull_use_atr': False, 'bull_use_adx': False, 'bull_use_spike': False, 'bull_rsi_required': True, 'bear_strategy': 'mean_reversion', 'bear_bb_std_mult': 0.9563031735256441, 'bear_rsi_os': 35, 'bear_rsi_ob': 47, 'bear_adx_thresh': 20.65337901630312, 'bear_atr_min_pct': 0.0055982621679846745, 'bear_atr_max_pct': 0.04145888802148938, 'bear_tp_mult': 2.878134603648506, 'bear_tsl_mult': 0.2696031788617035, 'bear_time_stop': 226, 'bear_use_sma': False, 'bear_use_ema': True, 'bear_use_atr': True, 'bear_use_adx': True, 'bear_use_spike': True, 'bear_rsi_required': True, 'sideways_strategy': 'mean_reversion', 'sideways_bb_std_mult': 1.2690553278433754, 'sideways_rsi_os': 26, 'sideways_rsi_ob': 53, 'sideways_adx_thresh': 9.121525316690057, 'sideways_atr_min_pct': 0.013699988489922401, 'sideways_atr_max_pct': 0.1171952005706047, 'sideways_tp_mult': 1.7442600958216152, 'sideways_tsl_mult': 0.4745849189884879, 'sideways_time_stop': 64, 'sideways_use_sma': False, 'sideways_use_ema': True, 'sideways_use_atr': True, 'sideways_use_adx': False, 'sideways_use_spike': False, 'sideways_rsi_required': False}.
[I 2025-08-31 04:43:29,836] Trial 439 finished with values: [-0.02490199590635933, 0.02484540637496414] and parameters: {'p_sma': 56, 'p_std': 15, 'p_atr': 23, 'p_adx': 7, 'rsi_period': 51, 'ema1': 15, 'ema2': 24, 'slip_atr_k': 0.09220332302194721, 'slip_spread_k': 0.2150152028518149, 'spread_hl_frac': 0.03791492089516184, 'bb_std_mult': 1.8679101893441148, 'rsi_os': 27, 'rsi_ob': 63, 'vol_spike': 0.06977365386299106, 'adx_thresh': 12.014804079554146, 'atr_min_pct': 0.02746511742315826, 'atr_max_pct': 0.12677343858620954, 'tp_mult': 1.5033974025091785, 'tsl_mult': 0.8626292282033289, 'strategy': 'breakout', 'time_stop': 265, 'use_sma': True, 'use_atr': True, 'use_adx': True, 'use_ema': False, 'use_spike': True, 'rsi_required': False, 'edge_k': 1.5062143318878414, 'edge_cap': 0.2900379598529373, 'bull_strategy': 'mean_reversion', 'bull_bb_std_mult': 3.4478212711373226, 'bull_rsi_os': 14, 'bull_rsi_ob': 76, 'bull_adx_thresh': 31.495652102293164, 'bull_atr_min_pct': 0.0007718112323114625, 'bull_atr_max_pct': 0.047466260739687814, 'bull_tp_mult': 1.497640210574655, 'bull_tsl_mult': 0.7526091993370938, 'bull_time_stop': 163, 'bull_use_sma': True, 'bull_use_ema': False, 'bull_use_atr': False, 'bull_use_adx': False, 'bull_use_spike': False, 'bull_rsi_required': True, 'bear_strategy': 'breakout', 'bear_bb_std_mult': 1.9567405284483144, 'bear_rsi_os': 55, 'bear_rsi_ob': 83, 'bear_adx_thresh': 9.710076916717682, 'bear_atr_min_pct': 0.02105592742829601, 'bear_atr_max_pct': 0.04016868179056571, 'bear_tp_mult': 1.138217043870017, 'bear_tsl_mult': 0.39255357807460056, 'bear_time_stop': 267, 'bear_use_sma': False, 'bear_use_ema': True, 'bear_use_atr': True, 'bear_use_adx': True, 'bear_use_spike': True, 'bear_rsi_required': True, 'sideways_strategy': 'mean_reversion', 'sideways_bb_std_mult': 1.161879804172642, 'sideways_rsi_os': 26, 'sideways_rsi_ob': 53, 'sideways_adx_thresh': 19.143533114312667, 'sideways_atr_min_pct': 0.019127939079764424, 'sideways_atr_max_pct': 0.06616225649333168, 'sideways_tp_mult': 2.562919388038619, 'sideways_tsl_mult': 0.644631150367783, 'sideways_time_stop': 72, 'sideways_use_sma': False, 'sideways_use_ema': True, 'sideways_use_atr': True, 'sideways_use_adx': False, 'sideways_use_spike': False, 'sideways_rsi_required': False}.
[I 2025-08-31 04:43:30,063] Trial 437 finished with values: [-0.02415810516970518, 0.024119017218980278] and parameters: {'p_sma': 56, 'p_std': 14, 'p_atr': 23, 'p_adx': 10, 'rsi_period': 50, 'ema1': 15, 'ema2': 27, 'slip_atr_k': 0.09203464798233987, 'slip_spread_k': 0.05323996146823842, 'spread_hl_frac': 0.013527346551489672, 'bb_std_mult': 1.8490043871337358, 'rsi_os': 29, 'rsi_ob': 61, 'vol_spike': 0.024031262895604585, 'adx_thresh': 12.676329521088569, 'atr_min_pct': 0.022628443823859718, 'atr_max_pct': 0.11689358181859025, 'tp_mult': 2.5946392182742084, 'tsl_mult': 0.5863027747128753, 'strategy': 'mean_reversion', 'time_stop': 104, 'use_sma': False, 'use_atr': True, 'use_adx': True, 'use_ema': False, 'use_spike': True, 'rsi_required': False, 'edge_k': 1.461402480098511, 'edge_cap': 0.8780805522369775, 'bull_strategy': 'mean_reversion', 'bull_bb_std_mult': 1.4556269241318929, 'bull_rsi_os': 33, 'bull_rsi_ob': 64, 'bull_adx_thresh': 31.6338513937076, 'bull_atr_min_pct': 0.00045795282046494053, 'bull_atr_max_pct': 0.013291423848067252, 'bull_tp_mult': 1.7188727839202462, 'bull_tsl_mult': 0.863808414212187, 'bull_time_stop': 126, 'bull_use_sma': True, 'bull_use_ema': False, 'bull_use_atr': False, 'bull_use_adx': False, 'bull_use_spike': False, 'bull_rsi_required': False, 'bear_strategy': 'mean_reversion', 'bear_bb_std_mult': 2.4309492098792744, 'bear_rsi_os': 10, 'bear_rsi_ob': 47, 'bear_adx_thresh': 18.898618021774297, 'bear_atr_min_pct': 0.023490360806270826, 'bear_atr_max_pct': 0.09790915812182302, 'bear_tp_mult': 2.885238316482335, 'bear_tsl_mult': 0.22235859893909654, 'bear_time_stop': 197, 'bear_use_sma': False, 'bear_use_ema': True, 'bear_use_atr': True, 'bear_use_adx': True, 'bear_use_spike': True, 'bear_rsi_required': True, 'sideways_strategy': 'breakout', 'sideways_bb_std_mult': 1.2640626115681766, 'sideways_rsi_os': 26, 'sideways_rsi_ob': 90, 'sideways_adx_thresh': 21.692610360064396, 'sideways_atr_min_pct': 0.014574758711360398, 'sideways_atr_max_pct': 0.11650931135770297, 'sideways_tp_mult': 1.0101495895681096, 'sideways_tsl_mult': 0.6399835886047746, 'sideways_time_stop': 72, 'sideways_use_sma': False, 'sideways_use_ema': True, 'sideways_use_atr': True, 'sideways_use_adx': False, 'sideways_use_spike': False, 'sideways_rsi_required': False}.
[I 2025-08-31 04:44:19,231] Trial 441 finished with values: [-1000000000.0, 1000000000.0] and parameters: {'p_sma': 53, 'p_std': 11, 'p_atr': 11, 'p_adx': 7, 'rsi_period': 19, 'ema1': 15, 'ema2': 15, 'slip_atr_k': 0.020646587561820078, 'slip_spread_k': 0.5677090101476077, 'spread_hl_frac': 0.039164047795793855, 'bb_std_mult': 1.8324199895519946, 'rsi_os': 35, 'rsi_ob': 63, 'vol_spike': 0.07077375181379846, 'adx_thresh': 10.148371213896468, 'atr_min_pct': 0.024716397686320814, 'atr_max_pct': 0.12560775654356152, 'tp_mult': 2.553220958223683, 'tsl_mult': 0.9198739317089358, 'strategy': 'mean_reversion', 'time_stop': 37, 'use_sma': True, 'use_atr': False, 'use_adx': False, 'use_ema': False, 'use_spike': True, 'rsi_required': False, 'edge_k': 0.512362933555942, 'edge_cap': 0.982714209181774, 'bull_strategy': 'breakout', 'bull_bb_std_mult': 3.3348139528126883, 'bull_rsi_os': 12, 'bull_rsi_ob': 63, 'bull_adx_thresh': 29.864222342466128, 'bull_atr_min_pct': 0.014573924874330117, 'bull_atr_max_pct': 0.1164055195865082, 'bull_tp_mult': 1.6368321198230398, 'bull_tsl_mult': 0.8797989289513658, 'bull_time_stop': 135, 'bull_use_sma': False, 'bull_use_ema': True, 'bull_use_atr': True, 'bull_use_adx': True, 'bull_use_spike': False, 'bull_rsi_required': False, 'bear_strategy': 'breakout', 'bear_bb_std_mult': 2.0042659940469996, 'bear_rsi_os': 41, 'bear_rsi_ob': 48, 'bear_adx_thresh': 33.72492892128442, 'bear_atr_min_pct': 0.02068110217502135, 'bear_atr_max_pct': 0.03955677383011978, 'bear_tp_mult': 1.5670060014092746, 'bear_tsl_mult': 0.1966799563498503, 'bear_time_stop': 187, 'bear_use_sma': True, 'bear_use_ema': False, 'bear_use_atr': True, 'bear_use_adx': False, 'bear_use_spike': False, 'bear_rsi_required': True, 'sideways_strategy': 'breakout', 'sideways_bb_std_mult': 1.0379613777223995, 'sideways_rsi_os': 46, 'sideways_rsi_ob': 72, 'sideways_adx_thresh': 15.133042440583733, 'sideways_atr_min_pct': 0.018646822820131442, 'sideways_atr_max_pct': 0.11323842766083198, 'sideways_tp_mult': 2.779817949041826, 'sideways_tsl_mult': 0.6420173773043597, 'sideways_time_stop': 73, 'sideways_use_sma': False, 'sideways_use_ema': False, 'sideways_use_atr': False, 'sideways_use_adx': True, 'sideways_use_spike': True, 'sideways_rsi_required': True}.
