[I 2025-08-31 04:01:22,257] Trial 227 finished with values: [-0.0116374969063332, 0.011567643104611372] and parameters: {'p_sma': 49, 'p_std': 16, 'p_atr': 24, 'p_adx': 14, 'rsi_period': 25, 'ema1': 24, 'ema2': 18, 'slip_atr_k': 0.07304722237445879, 'slip_spread_k': 0.09458664985294375, 'spread_hl_frac': 0.014392189393851909, 'bb_std_mult': 1.871685038448775, 'rsi_os': 27, 'rsi_ob': 49, 'vol_spike': 0.0173672008349466, 'adx_thresh': 13.795906044792886, 'atr_min_pct': 0.016093868612873704, 'atr_max_pct': 0.0450143845055419, 'tp_mult': 2.566592196678744, 'tsl_mult': 0.8529952947116899, 'strategy': 'breakout', 'time_stop': 281, 'use_sma': False, 'use_atr': True, 'use_adx': False, 'use_ema': False, 'use_spike': True, 'rsi_required': False, 'edge_k': 1.4710511953485563, 'edge_cap': 0.9667211521603342, 'bull_strategy': 'mean_reversion', 'bull_bb_std_mult': 3.3826843283403445, 'bull_rsi_os': 14, 'bull_rsi_ob': 76, 'bull_adx_thresh': 9.005197610547864, 'bull_atr_min_pct': 0.002006060664199708, 'bull_atr_max_pct': 0.09447646276960621, 'bull_tp_mult': 1.0102487799416169, 'bull_tsl_mult': 0.4328473886610643, 'bull_time_stop': 153, 'bull_use_sma': False, 'bull_use_ema': False, 'bull_use_atr': True, 'bull_use_adx': True, 'bull_use_spike': False, 'bull_rsi_required': True, 'bear_strategy': 'mean_reversion', 'bear_bb_std_mult': 0.8317133057071597, 'bear_rsi_os': 13, 'bear_rsi_ob': 85, 'bear_adx_thresh': 27.94767653268961, 'bear_atr_min_pct': 0.020958219543047066, 'bear_atr_max_pct': 0.04814039169174009, 'bear_tp_mult': 2.130071997259704, 'bear_tsl_mult': 0.25098417351474517, 'bear_time_stop': 132, 'bear_use_sma': True, 'bear_use_ema': True, 'bear_use_atr': True, 'bear_use_adx': True, 'bear_use_spike': True, 'bear_rsi_required': True, 'sideways_strategy': 'mean_reversion', 'sideways_bb_std_mult': 1.7931304898322609, 'sideways_rsi_os': 29, 'sideways_rsi_ob': 51, 'sideways_adx_thresh': 10.387197793074334, 'sideways_atr_min_pct': 0.014258278711750252, 'sideways_atr_max_pct': 0.1404487993849397, 'sideways_tp_mult': 1.7782082406046724, 'sideways_tsl_mult': 0.7556413460606476, 'sideways_time_stop': 59, 'sideways_use_sma': False, 'sideways_use_ema': False, 'sideways_use_atr': False, 'sideways_use_adx': True, 'sideways_use_spike': True, 'sideways_rsi_required': True}.
[I 2025-08-31 04:01:22,449] Trial 225 finished with values: [-1000000000.0, 1000000000.0] and parameters: {'p_sma': 17, 'p_std': 15, 'p_atr': 24, 'p_adx': 7, 'rsi_period': 30, 'ema1': 11, 'ema2': 15, 'slip_atr_k': 0.11532091722318862, 'slip_spread_k': 0.07323435470913255, 'spread_hl_frac': 0.011198476679820185, 'bb_std_mult': 1.9665873259238522, 'rsi_os': 52, 'rsi_ob': 60, 'vol_spike': 0.18576197885238255, 'adx_thresh': 13.95624990436215, 'atr_min_pct': 0.022802965582489218, 'atr_max_pct': 0.12454633320164465, 'tp_mult': 1.7945679774663785, 'tsl_mult': 0.8480227417803141, 'strategy': 'breakout', 'time_stop': 57, 'use_sma': False, 'use_atr': True, 'use_adx': False, 'use_ema': False, 'use_spike': True, 'rsi_required': False, 'edge_k': 1.4809318918894063, 'edge_cap': 0.052948379551461255, 'bull_strategy': 'mean_reversion', 'bull_bb_std_mult': 3.380866202264777, 'bull_rsi_os': 14, 'bull_rsi_ob': 76, 'bull_adx_thresh': 12.943469892008281, 'bull_atr_min_pct': 0.002217075738292917, 'bull_atr_max_pct': 0.09489608180231113, 'bull_tp_mult': 1.679442305076337, 'bull_tsl_mult': 0.8918066257671092, 'bull_time_stop': 152, 'bull_use_sma': False, 'bull_use_ema': False, 'bull_use_atr': True, 'bull_use_adx': True, 'bull_use_spike': False, 'bull_rsi_required': True, 'bear_strategy': 'mean_reversion', 'bear_bb_std_mult': 1.089188529981869, 'bear_rsi_os': 7, 'bear_rsi_ob': 78, 'bear_adx_thresh': 31.47676330451319, 'bear_atr_min_pct': 0.022895703083898197, 'bear_atr_max_pct': 0.049115678482389805, 'bear_tp_mult': 2.668896878931398, 'bear_tsl_mult': 0.9213130657244921, 'bear_time_stop': 300, 'bear_use_sma': True, 'bear_use_ema': True, 'bear_use_atr': True, 'bear_use_adx': True, 'bear_use_spike': True, 'bear_rsi_required': True, 'sideways_strategy': 'mean_reversion', 'sideways_bb_std_mult': 0.5997782429763658, 'sideways_rsi_os': 43, 'sideways_rsi_ob': 53, 'sideways_adx_thresh': 31.959686404072706, 'sideways_atr_min_pct': 0.01309806077811038, 'sideways_atr_max_pct': 0.11854426502581544, 'sideways_tp_mult': 1.6334790067186584, 'sideways_tsl_mult': 0.7633425983637296, 'sideways_time_stop': 169, 'sideways_use_sma': False, 'sideways_use_ema': False, 'sideways_use_atr': False, 'sideways_use_adx': True, 'sideways_use_spike': True, 'sideways_rsi_required': True}.
[I 2025-08-31 04:01:22,658] Trial 226 finished with values: [-0.0130194371409883, 0.0129539441973017] and parameters: {'p_sma': 54, 'p_std': 17, 'p_atr': 24, 'p_adx': 26, 'rsi_period': 58, 'ema1': 5, 'ema2': 15, 'slip_atr_k': 0.01901423996696378, 'slip_spread_k': 0.6560447011701215, 'spread_hl_frac': 0.014484577004315404, 'bb_std_mult': 1.8580695182630311, 'rsi_os': 51, 'rsi_ob': 59, 'vol_spike': 0.18591129381302055, 'adx_thresh': 14.067209210638222, 'atr_min_pct': 0.02277557984980719, 'atr_max_pct': 0.045800005653235026, 'tp_mult': 2.0215541077981696, 'tsl_mult': 0.8481494650357772, 'strategy': 'breakout', 'time_stop': 48, 'use_sma': False, 'use_atr': True, 'use_adx': False, 'use_ema': False, 'use_spike': True, 'rsi_required': False, 'edge_k': 0.8964961520601679, 'edge_cap': 0.05911490057847113, 'bull_strategy': 'mean_reversion', 'bull_bb_std_mult': 3.3735583275259837, 'bull_rsi_os': 14, 'bull_rsi_ob': 76, 'bull_adx_thresh': 7.993796667414932, 'bull_atr_min_pct': 0.0016655488447324222, 'bull_atr_max_pct': 0.09700298979174182, 'bull_tp_mult': 1.4202398396651812, 'bull_tsl_mult': 0.14547075561231526, 'bull_time_stop': 38, 'bull_use_sma': False, 'bull_use_ema': False, 'bull_use_atr': True, 'bull_use_adx': True, 'bull_use_spike': False, 'bull_rsi_required': True, 'bear_strategy': 'mean_reversion', 'bear_bb_std_mult': 2.7719737724251563, 'bear_rsi_os': 10, 'bear_rsi_ob': 49, 'bear_adx_thresh': 21.29966618456826, 'bear_atr_min_pct': 0.024673795723124427, 'bear_atr_max_pct': 0.03790526915755862, 'bear_tp_mult': 2.66157955272471, 'bear_tsl_mult': 0.9243912111671422, 'bear_time_stop': 187, 'bear_use_sma': True, 'bear_use_ema': True, 'bear_use_atr': True, 'bear_use_adx': True, 'bear_use_spike': True, 'bear_rsi_required': True, 'sideways_strategy': 'mean_reversion', 'sideways_bb_std_mult': 1.7839012297854633, 'sideways_rsi_os': 43, 'sideways_rsi_ob': 51, 'sideways_adx_thresh': 32.522827788591385, 'sideways_atr_min_pct': 0.014151559705544745, 'sideways_atr_max_pct': 0.11670788010949586, 'sideways_tp_mult': 1.15889092348575, 'sideways_tsl_mult': 0.7470362657853875, 'sideways_time_stop': 59, 'sideways_use_sma': False, 'sideways_use_ema': False, 'sideways_use_atr': False, 'sideways_use_adx': True, 'sideways_use_spike': True, 'sideways_rsi_required': True}.
[I 2025-08-31 04:02:08,287] Trial 231 finished with values: [-1000000000.0, 1000000000.0] and parameters: {'p_sma': 55, 'p_std': 17, 'p_atr': 24, 'p_adx': 10, 'rsi_period': 22, 'ema1': 13, 'ema2': 21, 'slip_atr_k': 0.01911172446939671, 'slip_spread_k': 0.0901867849114449, 'spread_hl_frac': 0.034313478495238955, 'bb_std_mult': 1.6977514017899957, 'rsi_os': 48, 'rsi_ob': 49, 'vol_spike': 0.23068697004740965, 'adx_thresh': 32.2068225497657, 'atr_min_pct': 0.02186107000597106, 'atr_max_pct': 0.04043093210750044, 'tp_mult': 2.565348473711306, 'tsl_mult': 0.8741327249716565, 'strategy': 'breakout', 'time_stop': 20, 'use_sma': False, 'use_atr': True, 'use_adx': False, 'use_ema': False, 'use_spike': True, 'rsi_required': False, 'edge_k': 1.4890048048497764, 'edge_cap': 0.9650207712001124, 'bull_strategy': 'mean_reversion', 'bull_bb_std_mult': 3.4834816143167617, 'bull_rsi_os': 14, 'bull_rsi_ob': 79, 'bull_adx_thresh': 9.232591032411634, 'bull_atr_min_pct': 0.0025659437567500843, 'bull_atr_max_pct': 0.056435733203464046, 'bull_tp_mult': 1.4324312312898253, 'bull_tsl_mult': 0.9552701125651143, 'bull_time_stop': 127, 'bull_use_sma': False, 'bull_use_ema': False, 'bull_use_atr': True, 'bull_use_adx': True, 'bull_use_spike': False, 'bull_rsi_required': True, 'bear_strategy': 'mean_reversion', 'bear_bb_std_mult': 0.9461277723416496, 'bear_rsi_os': 10, 'bear_rsi_ob': 49, 'bear_adx_thresh': 33.33234757142702, 'bear_atr_min_pct': 0.023531904405334647, 'bear_atr_max_pct': 0.03984069881421505, 'bear_tp_mult': 1.8112902044791812, 'bear_tsl_mult': 0.06824403695148207, 'bear_time_stop': 187, 'bear_use_sma': True, 'bear_use_ema': True, 'bear_use_atr': False, 'bear_use_adx': True, 'bear_use_spike': True, 'bear_rsi_required': True, 'sideways_strategy': 'mean_reversion', 'sideways_bb_std_mult': 0.7644858780590278, 'sideways_rsi_os': 32, 'sideways_rsi_ob': 54, 'sideways_adx_thresh': 10.40874014571158, 'sideways_atr_min_pct': 0.014193295870270229, 'sideways_atr_max_pct': 0.11564797251186294, 'sideways_tp_mult': 1.141138248497357, 'sideways_tsl_mult': 0.3463025882931087, 'sideways_time_stop': 219, 'sideways_use_sma': False, 'sideways_use_ema': False, 'sideways_use_atr': False, 'sideways_use_adx': True, 'sideways_use_spike': True, 'sideways_rsi_required': True}.
[I 2025-08-31 04:02:09,077] Trial 228 finished with values: [-1000000000.0, 1000000000.0] and parameters: {'p_sma': 27, 'p_std': 40, 'p_atr': 24, 'p_adx': 15, 'rsi_period': 74, 'ema1': 15, 'ema2': 18, 'slip_atr_k': 0.021178185345056853, 'slip_spread_k': 0.07706303550984243, 'spread_hl_frac': 0.014607674898595449, 'bb_std_mult': 1.8635488187162064, 'rsi_os': 49, 'rsi_ob': 51, 'vol_spike': 0.016293317641249555, 'adx_thresh': 32.28076303510675, 'atr_min_pct': 0.005679189283906608, 'atr_max_pct': 0.04403501681227079, 'tp_mult': 2.571196623652039, 'tsl_mult': 0.8536010587346782, 'strategy': 'breakout', 'time_stop': 282, 'use_sma': False, 'use_atr': True, 'use_adx': False, 'use_ema': False, 'use_spike': True, 'rsi_required': False, 'edge_k': 1.4960463918639042, 'edge_cap': 0.96072934930055, 'bull_strategy': 'mean_reversion', 'bull_bb_std_mult': 3.388038662731283, 'bull_rsi_os': 14, 'bull_rsi_ob': 61, 'bull_adx_thresh': 9.199048102275496, 'bull_atr_min_pct': 0.0024583278323124296, 'bull_atr_max_pct': 0.05658598645170701, 'bull_tp_mult': 1.693551851545808, 'bull_tsl_mult': 0.9183285059231204, 'bull_time_stop': 36, 'bull_use_sma': False, 'bull_use_ema': False, 'bull_use_atr': True, 'bull_use_adx': True, 'bull_use_spike': False, 'bull_rsi_required': True, 'bear_strategy': 'mean_reversion', 'bear_bb_std_mult': 0.8018393988061057, 'bear_rsi_os': 10, 'bear_rsi_ob': 45, 'bear_adx_thresh': 21.1566946014101, 'bear_atr_min_pct': 0.02111578431445473, 'bear_atr_max_pct': 0.048909577782383154, 'bear_tp_mult': 2.129384317027337, 'bear_tsl_mult': 0.004833965680724195, 'bear_time_stop': 248, 'bear_use_sma': True, 'bear_use_ema': True, 'bear_use_atr': False, 'bear_use_adx': True, 'bear_use_spike': True, 'bear_rsi_required': True, 'sideways_strategy': 'mean_reversion', 'sideways_bb_std_mult': 0.7359957272819951, 'sideways_rsi_os': 29, 'sideways_rsi_ob': 51, 'sideways_adx_thresh': 10.400524663928508, 'sideways_atr_min_pct': 0.014261140850365471, 'sideways_atr_max_pct': 0.09977961527847265, 'sideways_tp_mult': 1.1711635195500631, 'sideways_tsl_mult': 0.33741949651758835, 'sideways_time_stop': 58, 'sideways_use_sma': False, 'sideways_use_ema': False, 'sideways_use_atr': False, 'sideways_use_adx': True, 'sideways_use_spike': True, 'sideways_rsi_required': True}.
[I 2025-08-31 04:02:10,227] Trial 230 finished with values: [-1000000000.0, 1000000000.0] and parameters: {'p_sma': 55, 'p_std': 40, 'p_atr': 20, 'p_adx': 14, 'rsi_period': 24, 'ema1': 13, 'ema2': 18, 'slip_atr_k': 0.018988326880612666, 'slip_spread_k': 0.09011255887232589, 'spread_hl_frac': 0.03964592809199742, 'bb_std_mult': 1.6820698973906318, 'rsi_os': 49, 'rsi_ob': 50, 'vol_spike': 0.016645098525376188, 'adx_thresh': 10.738956039005512, 'atr_min_pct': 0.005829931965707342, 'atr_max_pct': 0.11112046073807964, 'tp_mult': 2.577033117101319, 'tsl_mult': 0.9009322993413378, 'strategy': 'breakout', 'time_stop': 35, 'use_sma': False, 'use_atr': True, 'use_adx': False, 'use_ema': False, 'use_spike': True, 'rsi_required': False, 'edge_k': 1.489482908006087, 'edge_cap': 0.9606766971510219, 'bull_strategy': 'mean_reversion', 'bull_bb_std_mult': 3.484572194208912, 'bull_rsi_os': 14, 'bull_rsi_ob': 79, 'bull_adx_thresh': 8.77613396951728, 'bull_atr_min_pct': 0.0024751542946564106, 'bull_atr_max_pct': 0.04226671961917968, 'bull_tp_mult': 1.405820220427045, 'bull_tsl_mult': 0.4393006509014792, 'bull_time_stop': 126, 'bull_use_sma': False, 'bull_use_ema': False, 'bull_use_atr': True, 'bull_use_adx': True, 'bull_use_spike': False, 'bull_rsi_required': True, 'bear_strategy': 'mean_reversion', 'bear_bb_std_mult': 0.9353265353099729, 'bear_rsi_os': 10, 'bear_rsi_ob': 84, 'bear_adx_thresh': 21.431535734819008, 'bear_atr_min_pct': 0.029843926120689278, 'bear_atr_max_pct': 0.03830907261654262, 'bear_tp_mult': 1.904840043906601, 'bear_tsl_mult': 0.23729390543136936, 'bear_time_stop': 269, 'bear_use_sma': True, 'bear_use_ema': True, 'bear_use_atr': False, 'bear_use_adx': True, 'bear_use_spike': True, 'bear_rsi_required': True, 'sideways_strategy': 'mean_reversion', 'sideways_bb_std_mult': 1.0246954670663053, 'sideways_rsi_os': 32, 'sideways_rsi_ob': 54, 'sideways_adx_thresh': 8.58655647580494, 'sideways_atr_min_pct': 0.014253678518147022, 'sideways_atr_max_pct': 0.14760804354797258, 'sideways_tp_mult': 2.1991318569195926, 'sideways_tsl_mult': 0.6592482671515284, 'sideways_time_stop': 6, 'sideways_use_sma': False, 'sideways_use_ema': False, 'sideways_use_atr': False, 'sideways_use_adx': True, 'sideways_use_spike': True, 'sideways_rsi_required': True}.
[I 2025-08-31 04:02:10,608] Trial 229 finished with values: [-1000000000.0, 1000000000.0] and parameters: {'p_sma': 55, 'p_std': 40, 'p_atr': 24, 'p_adx': 10, 'rsi_period': 21, 'ema1': 24, 'ema2': 29, 'slip_atr_k': 0.020671055721075218, 'slip_spread_k': 0.07974681294073618, 'spread_hl_frac': 0.010529970571740299, 'bb_std_mult': 1.6722033818898332, 'rsi_os': 31, 'rsi_ob': 50, 'vol_spike': 0.01802030957790733, 'adx_thresh': 12.722816386846427, 'atr_min_pct': 0.021787216767775737, 'atr_max_pct': 0.10283610731787807, 'tp_mult': 2.5766096079009864, 'tsl_mult': 0.871815491639286, 'strategy': 'breakout', 'time_stop': 295, 'use_sma': False, 'use_atr': True, 'use_adx': False, 'use_ema': False, 'use_spike': True, 'rsi_required': False, 'edge_k': 1.4878885010005654, 'edge_cap': 0.6224981661029787, 'bull_strategy': 'mean_reversion', 'bull_bb_std_mult': 3.4856565945545324, 'bull_rsi_os': 14, 'bull_rsi_ob': 76, 'bull_adx_thresh': 7.987311088167715, 'bull_atr_min_pct': 0.018101559711786064, 'bull_atr_max_pct': 0.05843058155382027, 'bull_tp_mult': 1.5233887100933596, 'bull_tsl_mult': 0.956310495472136, 'bull_time_stop': 13, 'bull_use_sma': False, 'bull_use_ema': False, 'bull_use_atr': True, 'bull_use_adx': True, 'bull_use_spike': False, 'bull_rsi_required': True, 'bear_strategy': 'mean_reversion', 'bear_bb_std_mult': 0.9517598148969735, 'bear_rsi_os': 10, 'bear_rsi_ob': 51, 'bear_adx_thresh': 21.015937868211452, 'bear_atr_min_pct': 0.029767494115351078, 'bear_atr_max_pct': 0.03906356708018749, 'bear_tp_mult': 2.775016636773605, 'bear_tsl_mult': 0.24333354452377157, 'bear_time_stop': 217, 'bear_use_sma': True, 'bear_use_ema': True, 'bear_use_atr': False, 'bear_use_adx': True, 'bear_use_spike': True, 'bear_rsi_required': True, 'sideways_strategy': 'mean_reversion', 'sideways_bb_std_mult': 1.01613981245591, 'sideways_rsi_os': 37, 'sideways_rsi_ob': 54, 'sideways_adx_thresh': 11.143850052499596, 'sideways_atr_min_pct': 0.01442351112099509, 'sideways_atr_max_pct': 0.14062793047113603, 'sideways_tp_mult': 1.6615341179636554, 'sideways_tsl_mult': 0.7270334514801202, 'sideways_time_stop': 59, 'sideways_use_sma': False, 'sideways_use_ema': False, 'sideways_use_atr': False, 'sideways_use_adx': True, 'sideways_use_spike': True, 'sideways_rsi_required': True}.
[I 2025-08-31 04:02:11,024] Trial 232 finished with values: [-1000000000.0, 1000000000.0] and parameters: {'p_sma': 54, 'p_std': 40, 'p_atr': 20, 'p_adx': 9, 'rsi_period': 24, 'ema1': 28, 'ema2': 18, 'slip_atr_k': 0.07287477420024557, 'slip_spread_k': 0.10939600426845081, 'spread_hl_frac': 0.014079775384625327, 'bb_std_mult': 1.860338367688952, 'rsi_os': 31, 'rsi_ob': 59, 'vol_spike': 0.01635615315715279, 'adx_thresh': 12.750669061463244, 'atr_min_pct': 0.02385763712048031, 'atr_max_pct': 0.02007594394725845, 'tp_mult': 2.376739723259656, 'tsl_mult': 0.904411020617183, 'strategy': 'breakout', 'time_stop': 276, 'use_sma': False, 'use_atr': False, 'use_adx': False, 'use_ema': False, 'use_spike': True, 'rsi_required': False, 'edge_k': 0.9768262575617317, 'edge_cap': 0.9803529762679644, 'bull_strategy': 'mean_reversion', 'bull_bb_std_mult': 3.487565325504027, 'bull_rsi_os': 15, 'bull_rsi_ob': 65, 'bull_adx_thresh': 27.548940739901433, 'bull_atr_min_pct': 0.0016529481625713119, 'bull_atr_max_pct': 0.04228032070725438, 'bull_tp_mult': 1.5339809393284973, 'bull_tsl_mult': 0.9159958555542975, 'bull_time_stop': 234, 'bull_use_sma': False, 'bull_use_ema': False, 'bull_use_atr': True, 'bull_use_adx': True, 'bull_use_spike': False, 'bull_rsi_required': True, 'bear_strategy': 'mean_reversion', 'bear_bb_std_mult': 0.8212089357723407, 'bear_rsi_os': 8, 'bear_rsi_ob': 84, 'bear_adx_thresh': 21.38393457335549, 'bear_atr_min_pct': 0.024544826515115473, 'bear_atr_max_pct': 0.047025371572266175, 'bear_tp_mult': 2.786993146987159, 'bear_tsl_mult': 0.2400160680639569, 'bear_time_stop': 105, 'bear_use_sma': True, 'bear_use_ema': True, 'bear_use_atr': False, 'bear_use_adx': True, 'bear_use_spike': True, 'bear_rsi_required': True, 'sideways_strategy': 'mean_reversion', 'sideways_bb_std_mult': 1.018971723750936, 'sideways_rsi_os': 20, 'sideways_rsi_ob': 54, 'sideways_adx_thresh': 11.081653388365737, 'sideways_atr_min_pct': 0.014202230426485973, 'sideways_atr_max_pct': 0.11069133950736218, 'sideways_tp_mult': 2.028211841508745, 'sideways_tsl_mult': 0.5777427284477942, 'sideways_time_stop': 57, 'sideways_use_sma': False, 'sideways_use_ema': False, 'sideways_use_atr': False, 'sideways_use_adx': True, 'sideways_use_spike': True, 'sideways_rsi_required': True}.
[I 2025-08-31 04:02:54,098] Trial 233 finished with values: [-1000000000.0, 1000000000.0] and parameters: {'p_sma': 55, 'p_std': 16, 'p_atr': 20, 'p_adx': 19, 'rsi_period': 24, 'ema1': 15, 'ema2': 29, 'slip_atr_k': 0.01788385502396456, 'slip_spread_k': 0.10966671250637015, 'spread_hl_frac': 0.010578503183814555, 'bb_std_mult': 2.7503587675313343, 'rsi_os': 28, 'rsi_ob': 59, 'vol_spike': 0.02683418585075605, 'adx_thresh': 12.482250474630455, 'atr_min_pct': 0.015927937160630446, 'atr_max_pct': 0.11094190150447139, 'tp_mult': 1.8717799328667946, 'tsl_mult': 0.9316112683942764, 'strategy': 'breakout', 'time_stop': 66, 'use_sma': False, 'use_atr': False, 'use_adx': False, 'use_ema': False, 'use_spike': True, 'rsi_required': False, 'edge_k': 0.9000529613184095, 'edge_cap': 0.9803618102894611, 'bull_strategy': 'mean_reversion', 'bull_bb_std_mult': 3.48825749072663, 'bull_rsi_os': 15, 'bull_rsi_ob': 59, 'bull_adx_thresh': 27.305509149408728, 'bull_atr_min_pct': 0.027845766719263462, 'bull_atr_max_pct': 0.04213196950713413, 'bull_tp_mult': 1.5236605571066497, 'bull_tsl_mult': 0.022717352830610604, 'bull_time_stop': 112, 'bull_use_sma': False, 'bull_use_ema': False, 'bull_use_atr': True, 'bull_use_adx': True, 'bull_use_spike': False, 'bull_rsi_required': True, 'bear_strategy': 'mean_reversion', 'bear_bb_std_mult': 0.8533380014463142, 'bear_rsi_os': 8, 'bear_rsi_ob': 51, 'bear_adx_thresh': 20.70151292611441, 'bear_atr_min_pct': 0.02458992545590979, 'bear_atr_max_pct': 0.046665485185963265, 'bear_tp_mult': 2.909882152391448, 'bear_tsl_mult': 0.24242800505349038, 'bear_time_stop': 216, 'bear_use_sma': True, 'bear_use_ema': True, 'bear_use_atr': True, 'bear_use_adx': True, 'bear_use_spike': True, 'bear_rsi_required': True, 'sideways_strategy': 'mean_reversion', 'sideways_bb_std_mult': 0.5092341351421308, 'sideways_rsi_os': 35, 'sideways_rsi_ob': 54, 'sideways_adx_thresh': 11.292915713176335, 'sideways_atr_min_pct': 0.015236363141563795, 'sideways_atr_max_pct': 0.11193863179954519, 'sideways_tp_mult': 1.0536880189386504, 'sideways_tsl_mult': 0.6661854906764668, 'sideways_time_stop': 62, 'sideways_use_sma': False, 'sideways_use_ema': False, 'sideways_use_atr': False, 'sideways_use_adx': True, 'sideways_use_spike': True, 'sideways_rsi_required': True}.
