[I 2025-08-31 05:17:34,199] Trial 618 finished with values: [-1000000000.0, 1000000000.0] and parameters: {'p_sma': 57, 'p_std': 15, 'p_atr': 15, 'p_adx': 7, 'rsi_period': 19, 'ema1': 24, 'ema2': 23, 'slip_atr_k': 0.0258574889214504, 'slip_spread_k': 0.7643502552465079, 'spread_hl_frac': 0.0057988762451621, 'bb_std_mult': 1.9930875194819713, 'rsi_os': 40, 'rsi_ob': 58, 'vol_spike': 0.015875992976618725, 'adx_thresh': 10.259475010183664, 'atr_min_pct': 0.023049741944499273, 'atr_max_pct': 0.13628338791269357, 'tp_mult': 2.447047961220412, 'tsl_mult': 0.8248992020010308, 'strategy': 'mean_reversion', 'time_stop': 14, 'use_sma': False, 'use_atr': True, 'use_adx': False, 'use_ema': False, 'use_spike': True, 'rsi_required': True, 'edge_k': 0.4131645501326876, 'edge_cap': 0.7342683280730935, 'bull_strategy': 'mean_reversion', 'bull_bb_std_mult': 0.8146170450687087, 'bull_rsi_os': 53, 'bull_rsi_ob': 78, 'bull_adx_thresh': 9.21079563637479, 'bull_atr_min_pct': 0.005954300449257587, 'bull_atr_max_pct': 0.03246203394949574, 'bull_tp_mult': 1.6495096176907211, 'bull_tsl_mult': 0.9106267560545599, 'bull_time_stop': 252, 'bull_use_sma': False, 'bull_use_ema': False, 'bull_use_atr': True, 'bull_use_adx': True, 'bull_use_spike': False, 'bull_rsi_required': False, 'bear_strategy': 'breakout', 'bear_bb_std_mult': 0.5995180692692545, 'bear_rsi_os': 10, 'bear_rsi_ob': 83, 'bear_adx_thresh': 9.816660712032661, 'bear_atr_min_pct': 0.009993604626973896, 'bear_atr_max_pct': 0.04155439291082953, 'bear_tp_mult': 1.261097967515398, 'bear_tsl_mult': 0.18425247074727524, 'bear_time_stop': 236, 'bear_use_sma': True, 'bear_use_ema': True, 'bear_use_atr': True, 'bear_use_adx': False, 'bear_use_spike': False, 'bear_rsi_required': True, 'sideways_strategy': 'breakout', 'sideways_bb_std_mult': 1.305556855248809, 'sideways_rsi_os': 34, 'sideways_rsi_ob': 57, 'sideways_adx_thresh': 23.48216655658796, 'sideways_atr_min_pct': 0.014270878094659847, 'sideways_atr_max_pct': 0.024920206404478007, 'sideways_tp_mult': 2.0805755759604296, 'sideways_tsl_mult': 0.48247771212126317, 'sideways_time_stop': 223, 'sideways_use_sma': False, 'sideways_use_ema': True, 'sideways_use_atr': False, 'sideways_use_adx': False, 'sideways_use_spike': True, 'sideways_rsi_required': True}.
[I 2025-08-31 05:18:16,786] Trial 624 finished with values: [-1000000000.0, 1000000000.0] and parameters: {'p_sma': 59, 'p_std': 15, 'p_atr': 15, 'p_adx': 10, 'rsi_period': 20, 'ema1': 25, 'ema2': 23, 'slip_atr_k': 0.03361469688287806, 'slip_spread_k': 0.5184052393149512, 'spread_hl_frac': 0.008538564488240103, 'bb_std_mult': 2.049531248187283, 'rsi_os': 47, 'rsi_ob': 62, 'vol_spike': 0.017249552302654923, 'adx_thresh': 11.024616613854553, 'atr_min_pct': 0.022494913123604784, 'atr_max_pct': 0.10328917220440355, 'tp_mult': 2.3896491670110964, 'tsl_mult': 0.7878892986799602, 'strategy': 'mean_reversion', 'time_stop': 34, 'use_sma': False, 'use_atr': True, 'use_adx': False, 'use_ema': False, 'use_spike': True, 'rsi_required': True, 'edge_k': 0.7136841434934198, 'edge_cap': 0.7582353194355729, 'bull_strategy': 'mean_reversion', 'bull_bb_std_mult': 0.8512103044136009, 'bull_rsi_os': 48, 'bull_rsi_ob': 80, 'bull_adx_thresh': 9.560892450605213, 'bull_atr_min_pct': 0.0061001632023789075, 'bull_atr_max_pct': 0.030704557740880323, 'bull_tp_mult': 1.7181796791108617, 'bull_tsl_mult': 0.9076290938890674, 'bull_time_stop': 289, 'bull_use_sma': False, 'bull_use_ema': False, 'bull_use_atr': True, 'bull_use_adx': True, 'bull_use_spike': False, 'bull_rsi_required': False, 'bear_strategy': 'breakout', 'bear_bb_std_mult': 0.8350860192884362, 'bear_rsi_os': 11, 'bear_rsi_ob': 75, 'bear_adx_thresh': 15.826301225661638, 'bear_atr_min_pct': 0.007914629923025667, 'bear_atr_max_pct': 0.046298238298457924, 'bear_tp_mult': 1.4299839372561256, 'bear_tsl_mult': 0.21311212891836934, 'bear_time_stop': 255, 'bear_use_sma': True, 'bear_use_ema': True, 'bear_use_atr': True, 'bear_use_adx': False, 'bear_use_spike': False, 'bear_rsi_required': True, 'sideways_strategy': 'breakout', 'sideways_bb_std_mult': 1.1679203789751655, 'sideways_rsi_os': 42, 'sideways_rsi_ob': 56, 'sideways_adx_thresh': 22.368059533512945, 'sideways_atr_min_pct': 0.014167576895120958, 'sideways_atr_max_pct': 0.057028695341419106, 'sideways_tp_mult': 2.1125882536545957, 'sideways_tsl_mult': 0.42461613405047827, 'sideways_time_stop': 210, 'sideways_use_sma': False, 'sideways_use_ema': True, 'sideways_use_atr': False, 'sideways_use_adx': False, 'sideways_use_spike': True, 'sideways_rsi_required': True}.
[I 2025-08-31 05:18:18,738] Trial 622 finished with values: [-1000000000.0, 1000000000.0] and parameters: {'p_sma': 59, 'p_std': 15, 'p_atr': 17, 'p_adx': 7, 'rsi_period': 14, 'ema1': 25, 'ema2': 24, 'slip_atr_k': 0.026572104852452635, 'slip_spread_k': 0.5822826900110457, 'spread_hl_frac': 0.009607990687703636, 'bb_std_mult': 2.073758792653053, 'rsi_os': 43, 'rsi_ob': 63, 'vol_spike': 0.011001109043397041, 'adx_thresh': 11.135843324516374, 'atr_min_pct': 0.025579965307662794, 'atr_max_pct': 0.09072511393671606, 'tp_mult': 2.4404105475604245, 'tsl_mult': 0.7925100440093902, 'strategy': 'mean_reversion', 'time_stop': 31, 'use_sma': False, 'use_atr': True, 'use_adx': False, 'use_ema': False, 'use_spike': True, 'rsi_required': True, 'edge_k': 0.4469198591998356, 'edge_cap': 0.7840631536637264, 'bull_strategy': 'mean_reversion', 'bull_bb_std_mult': 1.0666359197410777, 'bull_rsi_os': 46, 'bull_rsi_ob': 81, 'bull_adx_thresh': 8.756402226550628, 'bull_atr_min_pct': 0.006736923392824966, 'bull_atr_max_pct': 0.03152633114136073, 'bull_tp_mult': 1.7042238812003203, 'bull_tsl_mult': 0.9028002393643962, 'bull_time_stop': 244, 'bull_use_sma': False, 'bull_use_ema': False, 'bull_use_atr': True, 'bull_use_adx': True, 'bull_use_spike': False, 'bull_rsi_required': False, 'bear_strategy': 'breakout', 'bear_bb_std_mult': 0.8493508476822532, 'bear_rsi_os': 11, 'bear_rsi_ob': 84, 'bear_adx_thresh': 8.2508129820943, 'bear_atr_min_pct': 0.008601980340270708, 'bear_atr_max_pct': 0.0468575221796743, 'bear_tp_mult': 1.187616123275256, 'bear_tsl_mult': 0.19144981515462445, 'bear_time_stop': 229, 'bear_use_sma': True, 'bear_use_ema': True, 'bear_use_atr': True, 'bear_use_adx': False, 'bear_use_spike': False, 'bear_rsi_required': True, 'sideways_strategy': 'breakout', 'sideways_bb_std_mult': 1.170847265471453, 'sideways_rsi_os': 43, 'sideways_rsi_ob': 56, 'sideways_adx_thresh': 25.968941464003592, 'sideways_atr_min_pct': 0.014951665439673974, 'sideways_atr_max_pct': 0.022328251872169434, 'sideways_tp_mult': 2.1274905147357184, 'sideways_tsl_mult': 0.47901412865630993, 'sideways_time_stop': 209, 'sideways_use_sma': False, 'sideways_use_ema': True, 'sideways_use_atr': False, 'sideways_use_adx': False, 'sideways_use_spike': True, 'sideways_rsi_required': True}.
[I 2025-08-31 05:18:19,565] Trial 623 finished with values: [-1000000000.0, 1000000000.0] and parameters: {'p_sma': 59, 'p_std': 15, 'p_atr': 15, 'p_adx': 10, 'rsi_period': 20, 'ema1': 25, 'ema2': 23, 'slip_atr_k': 0.04221711963282597, 'slip_spread_k': 0.6488843420879985, 'spread_hl_frac': 0.009496910248598816, 'bb_std_mult': 2.0712208128708185, 'rsi_os': 47, 'rsi_ob': 62, 'vol_spike': 0.016799757468764692, 'adx_thresh': 11.22039136006247, 'atr_min_pct': 0.025199798995144098, 'atr_max_pct': 0.10183811727452012, 'tp_mult': 2.3975999134158137, 'tsl_mult': 0.7909698843422256, 'strategy': 'mean_reversion', 'time_stop': 31, 'use_sma': False, 'use_atr': True, 'use_adx': False, 'use_ema': False, 'use_spike': True, 'rsi_required': True, 'edge_k': 0.7193701122789459, 'edge_cap': 0.7866228278960673, 'bull_strategy': 'mean_reversion', 'bull_bb_std_mult': 1.0969727313644213, 'bull_rsi_os': 48, 'bull_rsi_ob': 80, 'bull_adx_thresh': 9.399698596441057, 'bull_atr_min_pct': 0.008743545903195163, 'bull_atr_max_pct': 0.024961627278774906, 'bull_tp_mult': 1.7478039346523824, 'bull_tsl_mult': 0.9018360699906063, 'bull_time_stop': 288, 'bull_use_sma': False, 'bull_use_ema': False, 'bull_use_atr': True, 'bull_use_adx': True, 'bull_use_spike': False, 'bull_rsi_required': False, 'bear_strategy': 'breakout', 'bear_bb_std_mult': 0.8489990986663734, 'bear_rsi_os': 11, 'bear_rsi_ob': 75, 'bear_adx_thresh': 15.699785386998517, 'bear_atr_min_pct': 0.007813710855901431, 'bear_atr_max_pct': 0.04717157752215552, 'bear_tp_mult': 1.4454398936462252, 'bear_tsl_mult': 0.21199923572259982, 'bear_time_stop': 263, 'bear_use_sma': True, 'bear_use_ema': True, 'bear_use_atr': True, 'bear_use_adx': False, 'bear_use_spike': False, 'bear_rsi_required': True, 'sideways_strategy': 'breakout', 'sideways_bb_std_mult': 1.1738040468646558, 'sideways_rsi_os': 43, 'sideways_rsi_ob': 56, 'sideways_adx_thresh': 27.70743975338671, 'sideways_atr_min_pct': 0.014042246236382911, 'sideways_atr_max_pct': 0.022392459175741817, 'sideways_tp_mult': 2.1275540968806346, 'sideways_tsl_mult': 0.5237762389719987, 'sideways_time_stop': 209, 'sideways_use_sma': False, 'sideways_use_ema': True, 'sideways_use_atr': False, 'sideways_use_adx': False, 'sideways_use_spike': True, 'sideways_rsi_required': True}.
[I 2025-08-31 05:18:20,321] Trial 625 finished with values: [-1000000000.0, 1000000000.0] and parameters: {'p_sma': 59, 'p_std': 15, 'p_atr': 17, 'p_adx': 9, 'rsi_period': 20, 'ema1': 22, 'ema2': 25, 'slip_atr_k': 0.03573583314276838, 'slip_spread_k': 0.5310914734611141, 'spread_hl_frac': 0.009480228067723827, 'bb_std_mult': 2.086914023187524, 'rsi_os': 37, 'rsi_ob': 63, 'vol_spike': 0.008468111450775122, 'adx_thresh': 11.00422210013187, 'atr_min_pct': 0.025573913576785637, 'atr_max_pct': 0.09163750496746041, 'tp_mult': 2.393243759557042, 'tsl_mult': 0.792741188310345, 'strategy': 'mean_reversion', 'time_stop': 30, 'use_sma': False, 'use_atr': True, 'use_adx': False, 'use_ema': False, 'use_spike': True, 'rsi_required': True, 'edge_k': 0.21645876079131243, 'edge_cap': 0.7620253345357044, 'bull_strategy': 'mean_reversion', 'bull_bb_std_mult': 1.0815481686838968, 'bull_rsi_os': 46, 'bull_rsi_ob': 80, 'bull_adx_thresh': 9.572345947504495, 'bull_atr_min_pct': 0.0069259037610806505, 'bull_atr_max_pct': 0.02872314094103994, 'bull_tp_mult': 1.7423694527760385, 'bull_tsl_mult': 0.9053616310326207, 'bull_time_stop': 289, 'bull_use_sma': False, 'bull_use_ema': False, 'bull_use_atr': True, 'bull_use_adx': True, 'bull_use_spike': False, 'bull_rsi_required': False, 'bear_strategy': 'breakout', 'bear_bb_std_mult': 0.8316151204622663, 'bear_rsi_os': 11, 'bear_rsi_ob': 72, 'bear_adx_thresh': 15.699341157751968, 'bear_atr_min_pct': 0.00805772759395353, 'bear_atr_max_pct': 0.04667325955148472, 'bear_tp_mult': 1.010470925054706, 'bear_tsl_mult': 0.21647005292612667, 'bear_time_stop': 286, 'bear_use_sma': True, 'bear_use_ema': True, 'bear_use_atr': True, 'bear_use_adx': False, 'bear_use_spike': False, 'bear_rsi_required': True, 'sideways_strategy': 'breakout', 'sideways_bb_std_mult': 1.1739948923877797, 'sideways_rsi_os': 42, 'sideways_rsi_ob': 56, 'sideways_adx_thresh': 25.76931310283705, 'sideways_atr_min_pct': 0.014764931307082224, 'sideways_atr_max_pct': 0.014854071273761172, 'sideways_tp_mult': 2.1273742114616057, 'sideways_tsl_mult': 0.43757992488202835, 'sideways_time_stop': 208, 'sideways_use_sma': False, 'sideways_use_ema': True, 'sideways_use_atr': False, 'sideways_use_adx': False, 'sideways_use_spike': True, 'sideways_rsi_required': True}.
[I 2025-08-31 05:19:03,733] Trial 626 finished with values: [-1000000000.0, 1000000000.0] and parameters: {'p_sma': 58, 'p_std': 11, 'p_atr': 17, 'p_adx': 10, 'rsi_period': 20, 'ema1': 22, 'ema2': 25, 'slip_atr_k': 0.0380399149809961, 'slip_spread_k': 0.5830916673518676, 'spread_hl_frac': 0.008843622648908919, 'bb_std_mult': 2.06082809776592, 'rsi_os': 45, 'rsi_ob': 63, 'vol_spike': 0.011831079734213488, 'adx_thresh': 9.346396623007143, 'atr_min_pct': 0.02514491499820891, 'atr_max_pct': 0.10179761844078411, 'tp_mult': 2.42037947669734, 'tsl_mult': 0.7991962130299737, 'strategy': 'mean_reversion', 'time_stop': 30, 'use_sma': False, 'use_atr': True, 'use_adx': False, 'use_ema': False, 'use_spike': True, 'rsi_required': True, 'edge_k': 0.19903279752765013, 'edge_cap': 0.7921039853087294, 'bull_strategy': 'mean_reversion', 'bull_bb_std_mult': 1.0490450573025711, 'bull_rsi_os': 47, 'bull_rsi_ob': 79, 'bull_adx_thresh': 8.751881571670102, 'bull_atr_min_pct': 0.017087760996998876, 'bull_atr_max_pct': 0.02485386268706273, 'bull_tp_mult': 1.735941122911438, 'bull_tsl_mult': 0.9079041120019912, 'bull_time_stop': 236, 'bull_use_sma': False, 'bull_use_ema': False, 'bull_use_atr': True, 'bull_use_adx': True, 'bull_use_spike': False, 'bull_rsi_required': False, 'bear_strategy': 'breakout', 'bear_bb_std_mult': 0.8368383627728304, 'bear_rsi_os': 10, 'bear_rsi_ob': 83, 'bear_adx_thresh': 12.647896350693852, 'bear_atr_min_pct': 0.008460695442932618, 'bear_atr_max_pct': 0.047643322956590996, 'bear_tp_mult': 1.0133894981284348, 'bear_tsl_mult': 0.22522842840015095, 'bear_time_stop': 264, 'bear_use_sma': True, 'bear_use_ema': True, 'bear_use_atr': True, 'bear_use_adx': False, 'bear_use_spike': False, 'bear_rsi_required': True, 'sideways_strategy': 'breakout', 'sideways_bb_std_mult': 1.1634485631180536, 'sideways_rsi_os': 35, 'sideways_rsi_ob': 59, 'sideways_adx_thresh': 25.88887721484962, 'sideways_atr_min_pct': 0.014907139378177578, 'sideways_atr_max_pct': 0.01263860401129225, 'sideways_tp_mult': 2.1400415160032322, 'sideways_tsl_mult': 0.5244545205613295, 'sideways_time_stop': 207, 'sideways_use_sma': False, 'sideways_use_ema': True, 'sideways_use_atr': False, 'sideways_use_adx': False, 'sideways_use_spike': True, 'sideways_rsi_required': True}.
[I 2025-08-31 05:19:04,922] Trial 628 finished with values: [-1000000000.0, 1000000000.0] and parameters: {'p_sma': 58, 'p_std': 11, 'p_atr': 17, 'p_adx': 9, 'rsi_period': 18, 'ema1': 26, 'ema2': 25, 'slip_atr_k': 0.03792411156195677, 'slip_spread_k': 0.7988871723550359, 'spread_hl_frac': 0.00982456046992924, 'bb_std_mult': 1.9557447051071237, 'rsi_os': 38, 'rsi_ob': 61, 'vol_spike': 0.008282399618153394, 'adx_thresh': 9.372516258094414, 'atr_min_pct': 0.022080118529204426, 'atr_max_pct': 0.142364427741228, 'tp_mult': 2.4624911729833534, 'tsl_mult': 0.7649460932968526, 'strategy': 'mean_reversion', 'time_stop': 31, 'use_sma': False, 'use_atr': True, 'use_adx': False, 'use_ema': False, 'use_spike': True, 'rsi_required': True, 'edge_k': 0.21656023752878384, 'edge_cap': 0.803482250862613, 'bull_strategy': 'mean_reversion', 'bull_bb_std_mult': 0.9433478510003935, 'bull_rsi_os': 55, 'bull_rsi_ob': 79, 'bull_adx_thresh': 8.581524244041194, 'bull_atr_min_pct': 0.0213112018230918, 'bull_atr_max_pct': 0.012519450870808493, 'bull_tp_mult': 1.6778608390486203, 'bull_tsl_mult': 0.922106018327535, 'bull_time_stop': 221, 'bull_use_sma': False, 'bull_use_ema': False, 'bull_use_atr': True, 'bull_use_adx': True, 'bull_use_spike': False, 'bull_rsi_required': False, 'bear_strategy': 'breakout', 'bear_bb_std_mult': 0.7711125237524576, 'bear_rsi_os': 10, 'bear_rsi_ob': 72, 'bear_adx_thresh': 10.770460791847146, 'bear_atr_min_pct': 0.006351461745300396, 'bear_atr_max_pct': 0.04440570652319181, 'bear_tp_mult': 1.3586785530695686, 'bear_tsl_mult': 0.23239770210149194, 'bear_time_stop': 285, 'bear_use_sma': True, 'bear_use_ema': True, 'bear_use_atr': True, 'bear_use_adx': False, 'bear_use_spike': False, 'bear_rsi_required': True, 'sideways_strategy': 'breakout', 'sideways_bb_std_mult': 1.251377071912226, 'sideways_rsi_os': 36, 'sideways_rsi_ob': 55, 'sideways_adx_thresh': 27.26062941643123, 'sideways_atr_min_pct': 0.014870825479978977, 'sideways_atr_max_pct': 0.015117901401677602, 'sideways_tp_mult': 2.0711527322123127, 'sideways_tsl_mult': 0.460117914634628, 'sideways_time_stop': 217, 'sideways_use_sma': False, 'sideways_use_ema': True, 'sideways_use_atr': False, 'sideways_use_adx': False, 'sideways_use_spike': True, 'sideways_rsi_required': True}.
[I 2025-08-31 05:19:05,183] Trial 629 finished with values: [-1000000000.0, 1000000000.0] and parameters: {'p_sma': 58, 'p_std': 14, 'p_atr': 17, 'p_adx': 9, 'rsi_period': 18, 'ema1': 26, 'ema2': 25, 'slip_atr_k': 0.023166673067858076, 'slip_spread_k': 0.8000317282978899, 'spread_hl_frac': 0.009754133121705507, 'bb_std_mult': 1.9627939347110919, 'rsi_os': 24, 'rsi_ob': 61, 'vol_spike': 0.019688238957835662, 'adx_thresh': 9.437159204077515, 'atr_min_pct': 0.02243730267414732, 'atr_max_pct': 0.14273383846665638, 'tp_mult': 2.467207923712496, 'tsl_mult': 0.8085265828363875, 'strategy': 'mean_reversion', 'time_stop': 22, 'use_sma': False, 'use_atr': True, 'use_adx': False, 'use_ema': False, 'use_spike': True, 'rsi_required': True, 'edge_k': 0.7827631002866016, 'edge_cap': 0.7613770579784, 'bull_strategy': 'mean_reversion', 'bull_bb_std_mult': 0.8844029878286672, 'bull_rsi_os': 55, 'bull_rsi_ob': 79, 'bull_adx_thresh': 7.312614125947016, 'bull_atr_min_pct': 0.011877846277622738, 'bull_atr_max_pct': 0.06264926516263322, 'bull_tp_mult': 1.6414258739886105, 'bull_tsl_mult': 0.9272908245604297, 'bull_time_stop': 279, 'bull_use_sma': False, 'bull_use_ema': False, 'bull_use_atr': True, 'bull_use_adx': True, 'bull_use_spike': False, 'bull_rsi_required': False, 'bear_strategy': 'breakout', 'bear_bb_std_mult': 0.7681456036412835, 'bear_rsi_os': 10, 'bear_rsi_ob': 70, 'bear_adx_thresh': 7.4415309984768605, 'bear_atr_min_pct': 0.006392570456536251, 'bear_atr_max_pct': 0.0436036746240678, 'bear_tp_mult': 1.3722691801309879, 'bear_tsl_mult': 0.2346097512676636, 'bear_time_stop': 247, 'bear_use_sma': True, 'bear_use_ema': True, 'bear_use_atr': True, 'bear_use_adx': False, 'bear_use_spike': False, 'bear_rsi_required': True, 'sideways_strategy': 'breakout', 'sideways_bb_std_mult': 1.2397455320304145, 'sideways_rsi_os': 35, 'sideways_rsi_ob': 59, 'sideways_adx_thresh': 23.62347152895026, 'sideways_atr_min_pct': 0.013888903550142124, 'sideways_atr_max_pct': 0.011951453428468747, 'sideways_tp_mult': 2.233016422073131, 'sideways_tsl_mult': 0.5242651525778035, 'sideways_time_stop': 188, 'sideways_use_sma': False, 'sideways_use_ema': True, 'sideways_use_atr': False, 'sideways_use_adx': False, 'sideways_use_spike': True, 'sideways_rsi_required': True}.
[I 2025-08-31 05:19:05,940] Trial 627 finished with values: [-1000000000.0, 1000000000.0] and parameters: {'p_sma': 58, 'p_std': 11, 'p_atr': 17, 'p_adx': 9, 'rsi_period': 20, 'ema1': 22, 'ema2': 25, 'slip_atr_k': 0.038102003298807835, 'slip_spread_k': 0.640028821650457, 'spread_hl_frac': 0.00969744106338742, 'bb_std_mult': 2.0841051101955976, 'rsi_os': 45, 'rsi_ob': 62, 'vol_spike': 0.018644825202094574, 'adx_thresh': 10.778592493024926, 'atr_min_pct': 0.02215481225395641, 'atr_max_pct': 0.14402046475280836, 'tp_mult': 2.3876662144028398, 'tsl_mult': 0.7992435088682506, 'strategy': 'mean_reversion', 'time_stop': 33, 'use_sma': False, 'use_atr': True, 'use_adx': False, 'use_ema': False, 'use_spike': True, 'rsi_required': True, 'edge_k': 0.2165692303579087, 'edge_cap': 0.818936332246358, 'bull_strategy': 'mean_reversion', 'bull_bb_std_mult': 0.9186164754697397, 'bull_rsi_os': 40, 'bull_rsi_ob': 79, 'bull_adx_thresh': 8.972250378422018, 'bull_atr_min_pct': 0.011691225572608672, 'bull_atr_max_pct': 0.02682447791554416, 'bull_tp_mult': 1.7510309025742443, 'bull_tsl_mult': 0.9047289460470278, 'bull_time_stop': 277, 'bull_use_sma': False, 'bull_use_ema': False, 'bull_use_atr': True, 'bull_use_adx': True, 'bull_use_spike': False, 'bull_rsi_required': False, 'bear_strategy': 'breakout', 'bear_bb_std_mult': 0.8031806365264106, 'bear_rsi_os': 12, 'bear_rsi_ob': 72, 'bear_adx_thresh': 6.967916529135675, 'bear_atr_min_pct': 0.007614588156173137, 'bear_atr_max_pct': 0.04382830012652642, 'bear_tp_mult': 1.3929238721811608, 'bear_tsl_mult': 0.22672913029668973, 'bear_time_stop': 264, 'bear_use_sma': True, 'bear_use_ema': True, 'bear_use_atr': True, 'bear_use_adx': False, 'bear_use_spike': False, 'bear_rsi_required': True, 'sideways_strategy': 'breakout', 'sideways_bb_std_mult': 1.231047387493171, 'sideways_rsi_os': 35, 'sideways_rsi_ob': 59, 'sideways_adx_thresh': 27.816182490123442, 'sideways_atr_min_pct': 0.013960692624757512, 'sideways_atr_max_pct': 0.014092928788897546, 'sideways_tp_mult': 2.125785419177619, 'sideways_tsl_mult': 0.5224979036048167, 'sideways_time_stop': 216, 'sideways_use_sma': False, 'sideways_use_ema': True, 'sideways_use_atr': False, 'sideways_use_adx': False, 'sideways_use_spike': True, 'sideways_rsi_required': True}.
