[I 2025-08-31 05:38:13,196] Trial 746 finished with values: [-1000000000.0, 1000000000.0] and parameters: {'p_sma': 55, 'p_std': 16, 'p_atr': 12, 'p_adx': 29, 'rsi_period': 77, 'ema1': 25, 'ema2': 49, 'slip_atr_k': 0.024666685939250754, 'slip_spread_k': 0.9985434073256896, 'spread_hl_frac': 0.0013983600816809272, 'bb_std_mult': 0.53015738484515, 'rsi_os': 5, 'rsi_ob': 92, 'vol_spike': 0.03226253800767938, 'adx_thresh': 12.140236123949057, 'atr_min_pct': 0.024971261836803524, 'atr_max_pct': 0.13455368873337087, 'tp_mult': 2.308415836170303, 'tsl_mult': 0.8381439025044016, 'strategy': 'mean_reversion', 'time_stop': 32, 'use_sma': False, 'use_atr': True, 'use_adx': False, 'use_ema': False, 'use_spike': True, 'rsi_required': True, 'edge_k': 0.6166997475019735, 'edge_cap': 0.26566717507347204, 'bull_strategy': 'mean_reversion', 'bull_bb_std_mult': 0.8504817857868594, 'bull_rsi_os': 47, 'bull_rsi_ob': 87, 'bull_adx_thresh': 25.036368030546928, 'bull_atr_min_pct': 0.01710788103047262, 'bull_atr_max_pct': 0.037603757580646706, 'bull_tp_mult': 1.7539854842384364, 'bull_tsl_mult': 0.9350936524942943, 'bull_time_stop': 299, 'bull_use_sma': False, 'bull_use_ema': True, 'bull_use_atr': True, 'bull_use_adx': True, 'bull_use_spike': False, 'bull_rsi_required': False, 'bear_strategy': 'breakout', 'bear_bb_std_mult': 0.8969472620318085, 'bear_rsi_os': 5, 'bear_rsi_ob': 88, 'bear_adx_thresh': 30.50543178252451, 'bear_atr_min_pct': 0.004886776831313071, 'bear_atr_max_pct': 0.14657140114086584, 'bear_tp_mult': 1.1944652637163273, 'bear_tsl_mult': 0.2366685824892244, 'bear_time_stop': 286, 'bear_use_sma': True, 'bear_use_ema': False, 'bear_use_atr': True, 'bear_use_adx': False, 'bear_use_spike': False, 'bear_rsi_required': True, 'sideways_strategy': 'breakout', 'sideways_bb_std_mult': 1.7335209491844505, 'sideways_rsi_os': 13, 'sideways_rsi_ob': 57, 'sideways_adx_thresh': 34.73011086787594, 'sideways_atr_min_pct': 0.014273363889331871, 'sideways_atr_max_pct': 0.027082192733410032, 'sideways_tp_mult': 2.1072173319697383, 'sideways_tsl_mult': 0.8460371471950866, 'sideways_time_stop': 229, 'sideways_use_sma': False, 'sideways_use_ema': True, 'sideways_use_atr': False, 'sideways_use_adx': False, 'sideways_use_spike': True, 'sideways_rsi_required': True}.
[I 2025-08-31 05:38:13,776] Trial 748 finished with values: [-1000000000.0, 1000000000.0] and parameters: {'p_sma': 55, 'p_std': 16, 'p_atr': 18, 'p_adx': 26, 'rsi_period': 22, 'ema1': 22, 'ema2': 10, 'slip_atr_k': 0.02246186886756361, 'slip_spread_k': 0.32661476663119704, 'spread_hl_frac': 0.0336997241315796, 'bb_std_mult': 3.4157431625311228, 'rsi_os': 40, 'rsi_ob': 61, 'vol_spike': 0.09114780944872587, 'adx_thresh': 12.22941939794077, 'atr_min_pct': 0.025484259115488263, 'atr_max_pct': 0.11415560294679605, 'tp_mult': 2.5637514705334796, 'tsl_mult': 0.6118337819122708, 'strategy': 'mean_reversion', 'time_stop': 35, 'use_sma': False, 'use_atr': True, 'use_adx': True, 'use_ema': False, 'use_spike': True, 'rsi_required': True, 'edge_k': 0.6226509843471435, 'edge_cap': 0.8025429619301201, 'bull_strategy': 'mean_reversion', 'bull_bb_std_mult': 1.181544102201777, 'bull_rsi_os': 40, 'bull_rsi_ob': 78, 'bull_adx_thresh': 21.76254054535324, 'bull_atr_min_pct': 0.014812881623991216, 'bull_atr_max_pct': 0.040774421376038025, 'bull_tp_mult': 1.7387202460309075, 'bull_tsl_mult': 0.2240746415474934, 'bull_time_stop': 59, 'bull_use_sma': True, 'bull_use_ema': True, 'bull_use_atr': True, 'bull_use_adx': False, 'bull_use_spike': False, 'bull_rsi_required': False, 'bear_strategy': 'breakout', 'bear_bb_std_mult': 0.893900628654707, 'bear_rsi_os': 14, 'bear_rsi_ob': 77, 'bear_adx_thresh': 28.730730893748273, 'bear_atr_min_pct': 0.00812816116049774, 'bear_atr_max_pct': 0.04487015250762411, 'bear_tp_mult': 1.1971631625306216, 'bear_tsl_mult': 0.0816204000675112, 'bear_time_stop': 90, 'bear_use_sma': False, 'bear_use_ema': False, 'bear_use_atr': False, 'bear_use_adx': False, 'bear_use_spike': False, 'bear_rsi_required': True, 'sideways_strategy': 'breakout', 'sideways_bb_std_mult': 0.5729078232803977, 'sideways_rsi_os': 40, 'sideways_rsi_ob': 66, 'sideways_adx_thresh': 27.768223909112407, 'sideways_atr_min_pct': 0.027681133890176082, 'sideways_atr_max_pct': 0.07910041245026932, 'sideways_tp_mult': 2.099400581277814, 'sideways_tsl_mult': 0.835057696068082, 'sideways_time_stop': 111, 'sideways_use_sma': False, 'sideways_use_ema': True, 'sideways_use_atr': True, 'sideways_use_adx': False, 'sideways_use_spike': False, 'sideways_rsi_required': False}.
[I 2025-08-31 05:38:57,706] Trial 749 finished with values: [-1000000000.0, 1000000000.0] and parameters: {'p_sma': 59, 'p_std': 16, 'p_atr': 16, 'p_adx': 29, 'rsi_period': 22, 'ema1': 29, 'ema2': 26, 'slip_atr_k': 0.023449157204867208, 'slip_spread_k': 0.9224354080900332, 'spread_hl_frac': 0.039270444836748686, 'bb_std_mult': 2.0442365301795276, 'rsi_os': 46, 'rsi_ob': 58, 'vol_spike': 0.01296229999216747, 'adx_thresh': 11.016743332225062, 'atr_min_pct': 0.02278264605715751, 'atr_max_pct': 0.023949224688155066, 'tp_mult': 2.3140636176172804, 'tsl_mult': 0.616295150814574, 'strategy': 'mean_reversion', 'time_stop': 36, 'use_sma': False, 'use_atr': True, 'use_adx': True, 'use_ema': False, 'use_spike': True, 'rsi_required': True, 'edge_k': 0.5706544676545048, 'edge_cap': 0.2626359416016033, 'bull_strategy': 'mean_reversion', 'bull_bb_std_mult': 0.8467756884926301, 'bull_rsi_os': 5, 'bull_rsi_ob': 87, 'bull_adx_thresh': 8.436073266447831, 'bull_atr_min_pct': 0.01979793090886344, 'bull_atr_max_pct': 0.14136260515643828, 'bull_tp_mult': 1.671270669525029, 'bull_tsl_mult': 0.8420291875484277, 'bull_time_stop': 295, 'bull_use_sma': True, 'bull_use_ema': False, 'bull_use_atr': True, 'bull_use_adx': False, 'bull_use_spike': False, 'bull_rsi_required': False, 'bear_strategy': 'breakout', 'bear_bb_std_mult': 0.8979962847975475, 'bear_rsi_os': 14, 'bear_rsi_ob': 77, 'bear_adx_thresh': 30.457442836856686, 'bear_atr_min_pct': 0.029548651645657453, 'bear_atr_max_pct': 0.14622914609022036, 'bear_tp_mult': 1.850076417570577, 'bear_tsl_mult': 0.15595521606377644, 'bear_time_stop': 238, 'bear_use_sma': False, 'bear_use_ema': True, 'bear_use_atr': False, 'bear_use_adx': False, 'bear_use_spike': False, 'bear_rsi_required': False, 'sideways_strategy': 'breakout', 'sideways_bb_std_mult': 2.087828781538063, 'sideways_rsi_os': 41, 'sideways_rsi_ob': 66, 'sideways_adx_thresh': 28.303144650038377, 'sideways_atr_min_pct': 0.015518394829683884, 'sideways_atr_max_pct': 0.04619011375146394, 'sideways_tp_mult': 2.0934244932010593, 'sideways_tsl_mult': 0.4994342156306639, 'sideways_time_stop': 226, 'sideways_use_sma': False, 'sideways_use_ema': True, 'sideways_use_atr': True, 'sideways_use_adx': False, 'sideways_use_spike': False, 'sideways_rsi_required': False}.
[I 2025-08-31 05:38:58,015] Trial 750 finished with values: [-1000000000.0, 1000000000.0] and parameters: {'p_sma': 23, 'p_std': 52, 'p_atr': 7, 'p_adx': 9, 'rsi_period': 34, 'ema1': 23, 'ema2': 26, 'slip_atr_k': 0.023097401585153582, 'slip_spread_k': 0.8953693046625602, 'spread_hl_frac': 0.039155906909711456, 'bb_std_mult': 1.9772198275766664, 'rsi_os': 22, 'rsi_ob': 58, 'vol_spike': 0.01320292803478676, 'adx_thresh': 27.580864886723443, 'atr_min_pct': 0.0021089459654234158, 'atr_max_pct': 0.03982080191373468, 'tp_mult': 2.553757640419529, 'tsl_mult': 0.6037368150307586, 'strategy': 'mean_reversion', 'time_stop': 10, 'use_sma': False, 'use_atr': True, 'use_adx': False, 'use_ema': False, 'use_spike': True, 'rsi_required': True, 'edge_k': 0.5783849988620547, 'edge_cap': 0.6643241477645785, 'bull_strategy': 'mean_reversion', 'bull_bb_std_mult': 1.1850089469016285, 'bull_rsi_os': 52, 'bull_rsi_ob': 51, 'bull_adx_thresh': 9.85536918167148, 'bull_atr_min_pct': 0.017405504096547286, 'bull_atr_max_pct': 0.1310608984384876, 'bull_tp_mult': 1.4635530731029371, 'bull_tsl_mult': 0.8447774145152626, 'bull_time_stop': 272, 'bull_use_sma': False, 'bull_use_ema': False, 'bull_use_atr': True, 'bull_use_adx': True, 'bull_use_spike': False, 'bull_rsi_required': False, 'bear_strategy': 'breakout', 'bear_bb_std_mult': 0.9248162518243825, 'bear_rsi_os': 5, 'bear_rsi_ob': 77, 'bear_adx_thresh': 30.55922299421856, 'bear_atr_min_pct': 0.006394209610488546, 'bear_atr_max_pct': 0.03868161109617569, 'bear_tp_mult': 1.1901266273064046, 'bear_tsl_mult': 0.4529621950330605, 'bear_time_stop': 284, 'bear_use_sma': True, 'bear_use_ema': True, 'bear_use_atr': True, 'bear_use_adx': False, 'bear_use_spike': False, 'bear_rsi_required': False, 'sideways_strategy': 'breakout', 'sideways_bb_std_mult': 0.502664045645534, 'sideways_rsi_os': 13, 'sideways_rsi_ob': 73, 'sideways_adx_thresh': 20.967121488451454, 'sideways_atr_min_pct': 0.024880152752982512, 'sideways_atr_max_pct': 0.078529457595416, 'sideways_tp_mult': 1.3263513373313582, 'sideways_tsl_mult': 0.5572549672033611, 'sideways_time_stop': 225, 'sideways_use_sma': False, 'sideways_use_ema': True, 'sideways_use_atr': False, 'sideways_use_adx': False, 'sideways_use_spike': True, 'sideways_rsi_required': True}.
[I 2025-08-31 05:38:58,461] Trial 752 finished with values: [-1000000000.0, 1000000000.0] and parameters: {'p_sma': 28, 'p_std': 34, 'p_atr': 21, 'p_adx': 9, 'rsi_period': 34, 'ema1': 10, 'ema2': 26, 'slip_atr_k': 0.2499435264478057, 'slip_spread_k': 0.6930759451572507, 'spread_hl_frac': 0.008217486549813923, 'bb_std_mult': 1.943794838294442, 'rsi_os': 23, 'rsi_ob': 58, 'vol_spike': 0.01156717785602225, 'adx_thresh': 12.831052869742267, 'atr_min_pct': 0.029322214537293178, 'atr_max_pct': 0.04030054485187765, 'tp_mult': 2.381900260546103, 'tsl_mult': 0.5749561195051948, 'strategy': 'mean_reversion', 'time_stop': 27, 'use_sma': False, 'use_atr': True, 'use_adx': False, 'use_ema': False, 'use_spike': True, 'rsi_required': True, 'edge_k': 0.6912439370367751, 'edge_cap': 0.7452612344220229, 'bull_strategy': 'mean_reversion', 'bull_bb_std_mult': 0.7528838642959993, 'bull_rsi_os': 44, 'bull_rsi_ob': 80, 'bull_adx_thresh': 9.868192357442322, 'bull_atr_min_pct': 0.007016165405949218, 'bull_atr_max_pct': 0.0871413380498525, 'bull_tp_mult': 1.6773633566020398, 'bull_tsl_mult': 0.997015085027185, 'bull_time_stop': 200, 'bull_use_sma': False, 'bull_use_ema': False, 'bull_use_atr': True, 'bull_use_adx': True, 'bull_use_spike': False, 'bull_rsi_required': False, 'bear_strategy': 'breakout', 'bear_bb_std_mult': 0.6599535895975639, 'bear_rsi_os': 10, 'bear_rsi_ob': 84, 'bear_adx_thresh': 8.737217493819205, 'bear_atr_min_pct': 0.003523932926403515, 'bear_atr_max_pct': 0.038977117742131535, 'bear_tp_mult': 1.7612085970651934, 'bear_tsl_mult': 0.14921038073964854, 'bear_time_stop': 130, 'bear_use_sma': True, 'bear_use_ema': True, 'bear_use_atr': True, 'bear_use_adx': False, 'bear_use_spike': False, 'bear_rsi_required': False, 'sideways_strategy': 'breakout', 'sideways_bb_std_mult': 2.15223383141853, 'sideways_rsi_os': 38, 'sideways_rsi_ob': 75, 'sideways_adx_thresh': 24.66848835236093, 'sideways_atr_min_pct': 0.015580673081528508, 'sideways_atr_max_pct': 0.06081249191735409, 'sideways_tp_mult': 1.1904985958610528, 'sideways_tsl_mult': 0.5040304105891196, 'sideways_time_stop': 173, 'sideways_use_sma': True, 'sideways_use_ema': True, 'sideways_use_atr': False, 'sideways_use_adx': False, 'sideways_use_spike': True, 'sideways_rsi_required': True}.
[I 2025-08-31 05:38:58,590] Trial 751 finished with values: [-0.05716142435440941, 0.05710426405825593] and parameters: {'p_sma': 23, 'p_std': 57, 'p_atr': 16, 'p_adx': 9, 'rsi_period': 30, 'ema1': 24, 'ema2': 10, 'slip_atr_k': 0.015425761355798016, 'slip_spread_k': 0.8848202626912265, 'spread_hl_frac': 0.008527850981261383, 'bb_std_mult': 1.958987749881673, 'rsi_os': 41, 'rsi_ob': 58, 'vol_spike': 0.011573653942940808, 'adx_thresh': 25.100388336171466, 'atr_min_pct': 0.012246359968010342, 'atr_max_pct': 0.10659706935506374, 'tp_mult': 2.561074360194281, 'tsl_mult': 0.168398156237273, 'strategy': 'mean_reversion', 'time_stop': 291, 'use_sma': False, 'use_atr': True, 'use_adx': True, 'use_ema': False, 'use_spike': True, 'rsi_required': True, 'edge_k': 0.12820314256339915, 'edge_cap': 0.7929255422299704, 'bull_strategy': 'mean_reversion', 'bull_bb_std_mult': 0.7646679307694553, 'bull_rsi_os': 52, 'bull_rsi_ob': 51, 'bull_adx_thresh': 21.77355316973813, 'bull_atr_min_pct': 0.028072817554277502, 'bull_atr_max_pct': 0.029370345493471506, 'bull_tp_mult': 1.668751695192962, 'bull_tsl_mult': 0.4964164867465194, 'bull_time_stop': 87, 'bull_use_sma': True, 'bull_use_ema': False, 'bull_use_atr': True, 'bull_use_adx': False, 'bull_use_spike': False, 'bull_rsi_required': False, 'bear_strategy': 'breakout', 'bear_bb_std_mult': 0.6758700993623974, 'bear_rsi_os': 10, 'bear_rsi_ob': 84, 'bear_adx_thresh': 28.97140933208076, 'bear_atr_min_pct': 0.008319352285867871, 'bear_atr_max_pct': 0.04506798077260446, 'bear_tp_mult': 1.055545399312408, 'bear_tsl_mult': 0.3348580738029331, 'bear_time_stop': 131, 'bear_use_sma': False, 'bear_use_ema': True, 'bear_use_atr': False, 'bear_use_adx': False, 'bear_use_spike': False, 'bear_rsi_required': False, 'sideways_strategy': 'breakout', 'sideways_bb_std_mult': 0.9917287816649311, 'sideways_rsi_os': 51, 'sideways_rsi_ob': 64, 'sideways_adx_thresh': 27.85933141437748, 'sideways_atr_min_pct': 8.060818544253917e-06, 'sideways_atr_max_pct': 0.0373348616319171, 'sideways_tp_mult': 1.337480979742368, 'sideways_tsl_mult': 0.5025503593743278, 'sideways_time_stop': 222, 'sideways_use_sma': False, 'sideways_use_ema': True, 'sideways_use_atr': True, 'sideways_use_adx': False, 'sideways_use_spike': False, 'sideways_rsi_required': False}.
[I 2025-08-31 05:39:47,016] Trial 756 finished with values: [-1000000000.0, 1000000000.0] and parameters: {'p_sma': 57, 'p_std': 49, 'p_atr': 28, 'p_adx': 14, 'rsi_period': 18, 'ema1': 19, 'ema2': 24, 'slip_atr_k': 0.05870133177808795, 'slip_spread_k': 0.6416334202288211, 'spread_hl_frac': 0.0108551970444478, 'bb_std_mult': 1.8995891832762373, 'rsi_os': 12, 'rsi_ob': 60, 'vol_spike': 0.005489993910337276, 'adx_thresh': 10.703650686206975, 'atr_min_pct': 0.020019626197520922, 'atr_max_pct': 0.1279371663553169, 'tp_mult': 2.4542206175512042, 'tsl_mult': 0.7819643533855568, 'strategy': 'mean_reversion', 'time_stop': 42, 'use_sma': True, 'use_atr': True, 'use_adx': False, 'use_ema': True, 'use_spike': False, 'rsi_required': True, 'edge_k': 0.24464628622081097, 'edge_cap': 0.4812374723644738, 'bull_strategy': 'breakout', 'bull_bb_std_mult': 0.9131194740336956, 'bull_rsi_os': 54, 'bull_rsi_ob': 77, 'bull_adx_thresh': 8.181526913888844, 'bull_atr_min_pct': 0.009626527150717636, 'bull_atr_max_pct': 0.05254054537582551, 'bull_tp_mult': 1.5284466802191736, 'bull_tsl_mult': 0.8916089949011753, 'bull_time_stop': 66, 'bull_use_sma': False, 'bull_use_ema': False, 'bull_use_atr': False, 'bull_use_adx': True, 'bull_use_spike': True, 'bull_rsi_required': False, 'bear_strategy': 'breakout', 'bear_bb_std_mult': 0.8025215624324218, 'bear_rsi_os': 11, 'bear_rsi_ob': 63, 'bear_adx_thresh': 27.469288560774995, 'bear_atr_min_pct': 0.0010383962669172023, 'bear_atr_max_pct': 0.04829914219059657, 'bear_tp_mult': 1.2764217691442536, 'bear_tsl_mult': 0.2533755011742027, 'bear_time_stop': 273, 'bear_use_sma': True, 'bear_use_ema': True, 'bear_use_atr': True, 'bear_use_adx': False, 'bear_use_spike': False, 'bear_rsi_required': True, 'sideways_strategy': 'breakout', 'sideways_bb_std_mult': 1.0173935421765785, 'sideways_rsi_os': 35, 'sideways_rsi_ob': 56, 'sideways_adx_thresh': 22.96665968228816, 'sideways_atr_min_pct': 0.013675897623214138, 'sideways_atr_max_pct': 0.013158899560505727, 'sideways_tp_mult': 1.5426511239052394, 'sideways_tsl_mult': 0.4059107589162813, 'sideways_time_stop': 210, 'sideways_use_sma': False, 'sideways_use_ema': True, 'sideways_use_atr': False, 'sideways_use_adx': False, 'sideways_use_spike': True, 'sideways_rsi_required': True}.
[I 2025-08-31 05:39:47,270] Trial 754 finished with values: [-1000000000.0, 1000000000.0] and parameters: {'p_sma': 57, 'p_std': 34, 'p_atr': 29, 'p_adx': 23, 'rsi_period': 23, 'ema1': 24, 'ema2': 52, 'slip_atr_k': 0.15414459768908417, 'slip_spread_k': 0.7008534691515368, 'spread_hl_frac': 0.008788089042486945, 'bb_std_mult': 1.948599190482239, 'rsi_os': 23, 'rsi_ob': 85, 'vol_spike': 0.005894944648762128, 'adx_thresh': 10.61196412215987, 'atr_min_pct': 0.021330860462929317, 'atr_max_pct': 0.09767550613980122, 'tp_mult': 1.346949337906433, 'tsl_mult': 0.17719821614106102, 'strategy': 'mean_reversion', 'time_stop': 26, 'use_sma': True, 'use_atr': True, 'use_adx': False, 'use_ema': False, 'use_spike': True, 'rsi_required': True, 'edge_k': 1.027397106716513, 'edge_cap': 0.786786032342508, 'bull_strategy': 'breakout', 'bull_bb_std_mult': 3.116113474510545, 'bull_rsi_os': 45, 'bull_rsi_ob': 77, 'bull_adx_thresh': 9.58294049025036, 'bull_atr_min_pct': 0.009385704478767336, 'bull_atr_max_pct': 0.021136952172295404, 'bull_tp_mult': 1.5255846281972087, 'bull_tsl_mult': 0.9980603571900019, 'bull_time_stop': 204, 'bull_use_sma': False, 'bull_use_ema': False, 'bull_use_atr': False, 'bull_use_adx': True, 'bull_use_spike': False, 'bull_rsi_required': False, 'bear_strategy': 'breakout', 'bear_bb_std_mult': 0.7022745901594423, 'bear_rsi_os': 21, 'bear_rsi_ob': 63, 'bear_adx_thresh': 16.699663345047355, 'bear_atr_min_pct': 0.0109318752151874, 'bear_atr_max_pct': 0.047636654314863754, 'bear_tp_mult': 1.4883701115810994, 'bear_tsl_mult': 0.4041457090439392, 'bear_time_stop': 128, 'bear_use_sma': True, 'bear_use_ema': True, 'bear_use_atr': True, 'bear_use_adx': False, 'bear_use_spike': False, 'bear_rsi_required': True, 'sideways_strategy': 'breakout', 'sideways_bb_std_mult': 1.3187072346916444, 'sideways_rsi_os': 36, 'sideways_rsi_ob': 61, 'sideways_adx_thresh': 23.250353783374425, 'sideways_atr_min_pct': 0.013684929507518637, 'sideways_atr_max_pct': 0.03786089675464195, 'sideways_tp_mult': 2.5033134949194196, 'sideways_tsl_mult': 0.000346919903559173, 'sideways_time_stop': 181, 'sideways_use_sma': True, 'sideways_use_ema': True, 'sideways_use_atr': False, 'sideways_use_adx': False, 'sideways_use_spike': True, 'sideways_rsi_required': True}.
[I 2025-08-31 05:39:47,530] Trial 755 finished with values: [-1000000000.0, 1000000000.0] and parameters: {'p_sma': 57, 'p_std': 14, 'p_atr': 28, 'p_adx': 8, 'rsi_period': 18, 'ema1': 20, 'ema2': 24, 'slip_atr_k': 0.14507316414375115, 'slip_spread_k': 0.666387020896532, 'spread_hl_frac': 0.048814099992286655, 'bb_std_mult': 2.68010049232993, 'rsi_os': 41, 'rsi_ob': 60, 'vol_spike': 0.04023636651050713, 'adx_thresh': 25.235231454060983, 'atr_min_pct': 0.020130999987958764, 'atr_max_pct': 0.10712970934656699, 'tp_mult': 1.3486302796018799, 'tsl_mult': 0.7834043407633067, 'strategy': 'mean_reversion', 'time_stop': 44, 'use_sma': True, 'use_atr': True, 'use_adx': False, 'use_ema': True, 'use_spike': False, 'rsi_required': True, 'edge_k': 0.13795356634759304, 'edge_cap': 0.4951231547548323, 'bull_strategy': 'breakout', 'bull_bb_std_mult': 0.9231402761558789, 'bull_rsi_os': 54, 'bull_rsi_ob': 77, 'bull_adx_thresh': 6.545175031666025, 'bull_atr_min_pct': 0.009926615704108513, 'bull_atr_max_pct': 0.020842415585643675, 'bull_tp_mult': 1.5247301232520898, 'bull_tsl_mult': 0.8948325158022772, 'bull_time_stop': 287, 'bull_use_sma': False, 'bull_use_ema': False, 'bull_use_atr': False, 'bull_use_adx': True, 'bull_use_spike': True, 'bull_rsi_required': False, 'bear_strategy': 'breakout', 'bear_bb_std_mult': 0.7187967374680244, 'bear_rsi_os': 10, 'bear_rsi_ob': 58, 'bear_adx_thresh': 22.932778202590598, 'bear_atr_min_pct': 0.008367562626999921, 'bear_atr_max_pct': 0.09852077356349667, 'bear_tp_mult': 1.4641964053741547, 'bear_tsl_mult': 0.3291342511596087, 'bear_time_stop': 230, 'bear_use_sma': True, 'bear_use_ema': True, 'bear_use_atr': True, 'bear_use_adx': False, 'bear_use_spike': False, 'bear_rsi_required': True, 'sideways_strategy': 'breakout', 'sideways_bb_std_mult': 1.3123397805471118, 'sideways_rsi_os': 35, 'sideways_rsi_ob': 56, 'sideways_adx_thresh': 23.492051004578833, 'sideways_atr_min_pct': 0.014482478387200343, 'sideways_atr_max_pct': 0.013025054036042365, 'sideways_tp_mult': 2.768608059371313, 'sideways_tsl_mult': 0.09580296134056798, 'sideways_time_stop': 196, 'sideways_use_sma': False, 'sideways_use_ema': True, 'sideways_use_atr': False, 'sideways_use_adx': False, 'sideways_use_spike': True, 'sideways_rsi_required': True}.
