[I 2025-08-31 03:41:10,978] Trial 64 finished with values: [-0.022717193460444096, 0.022857952581881197] and parameters: {'p_sma': 44, 'p_std': 12, 'p_atr': 11, 'p_adx': 14, 'rsi_period': 24, 'ema1': 20, 'ema2': 44, 'slip_atr_k': 0.19711565264191278, 'slip_spread_k': 0.9248993705157667, 'spread_hl_frac': 0.02552871748918873, 'bb_std_mult': 0.9883840757427975, 'rsi_os': 8, 'rsi_ob': 87, 'vol_spike': 0.1284061462482769, 'adx_thresh': 21.09443976429071, 'atr_min_pct': 0.010608198782457046, 'atr_max_pct': 0.07126092610079918, 'tp_mult': 1.3080957083252815, 'tsl_mult': 0.07372177576819905, 'strategy': 'mean_reversion', 'time_stop': 228, 'use_sma': False, 'use_atr': False, 'use_adx': True, 'use_ema': True, 'use_spike': False, 'rsi_required': True, 'edge_k': 0.5606516623251854, 'edge_cap': 0.5415379307600496, 'bull_strategy': 'breakout', 'bull_bb_std_mult': 2.9556110185211137, 'bull_rsi_os': 31, 'bull_rsi_ob': 93, 'bull_adx_thresh': 31.598921521029368, 'bull_atr_min_pct': 0.0007544272621238766, 'bull_atr_max_pct': 0.12855960125972374, 'bull_tp_mult': 2.8726316282776145, 'bull_tsl_mult': 0.6999868435657457, 'bull_time_stop': 297, 'bull_use_sma': True, 'bull_use_ema': True, 'bull_use_atr': True, 'bull_use_adx': False, 'bull_use_spike': True, 'bull_rsi_required': False, 'bear_strategy': 'breakout', 'bear_bb_std_mult': 1.608868986943266, 'bear_rsi_os': 53, 'bear_rsi_ob': 67, 'bear_adx_thresh': 15.617263743697588, 'bear_atr_min_pct': 0.004995070623430119, 'bear_atr_max_pct': 0.0815827894327097, 'bear_tp_mult': 1.540662747289242, 'bear_tsl_mult': 0.806105456994755, 'bear_time_stop': 77, 'bear_use_sma': False, 'bear_use_ema': False, 'bear_use_atr': True, 'bear_use_adx': False, 'bear_use_spike': False, 'bear_rsi_required': False, 'sideways_strategy': 'breakout', 'sideways_bb_std_mult': 2.364183350881577, 'sideways_rsi_os': 53, 'sideways_rsi_ob': 95, 'sideways_adx_thresh': 29.35327138424495, 'sideways_atr_min_pct': 0.02357480638978945, 'sideways_atr_max_pct': 0.04363728936772568, 'sideways_tp_mult': 2.5434848668285177, 'sideways_tsl_mult': 0.8623333416048943, 'sideways_time_stop': 226, 'sideways_use_sma': True, 'sideways_use_ema': True, 'sideways_use_atr': True, 'sideways_use_adx': False, 'sideways_use_spike': False, 'sideways_rsi_required': False}.
[I 2025-08-31 03:41:11,265] Trial 63 finished with values: [-1000000000.0, 1000000000.0] and parameters: {'p_sma': 7, 'p_std': 60, 'p_atr': 11, 'p_adx': 14, 'rsi_period': 24, 'ema1': 20, 'ema2': 43, 'slip_atr_k': 0.004959404691440197, 'slip_spread_k': 0.9239690464007305, 'spread_hl_frac': 0.025915783181232218, 'bb_std_mult': 1.0324406091497589, 'rsi_os': 15, 'rsi_ob': 55, 'vol_spike': 0.13454346753186347, 'adx_thresh': 14.961937974616426, 'atr_min_pct': 0.01062020152790801, 'atr_max_pct': 0.08235850935625462, 'tp_mult': 2.1604481258474397, 'tsl_mult': 0.5885359778980975, 'strategy': 'mean_reversion', 'time_stop': 229, 'use_sma': False, 'use_atr': False, 'use_adx': True, 'use_ema': True, 'use_spike': False, 'rsi_required': True, 'edge_k': 0.5708258775277452, 'edge_cap': 0.53353266313865, 'bull_strategy': 'breakout', 'bull_bb_std_mult': 2.255410693896681, 'bull_rsi_os': 18, 'bull_rsi_ob': 51, 'bull_adx_thresh': 12.282818118814857, 'bull_atr_min_pct': 0.017959405155579474, 'bull_atr_max_pct': 0.05805525989193333, 'bull_tp_mult': 2.8915406806124517, 'bull_tsl_mult': 0.992694831374149, 'bull_time_stop': 222, 'bull_use_sma': True, 'bull_use_ema': True, 'bull_use_atr': True, 'bull_use_adx': False, 'bull_use_spike': True, 'bull_rsi_required': False, 'bear_strategy': 'breakout', 'bear_bb_std_mult': 1.1115970013812329, 'bear_rsi_os': 47, 'bear_rsi_ob': 56, 'bear_adx_thresh': 28.666334611946397, 'bear_atr_min_pct': 0.004684471439634132, 'bear_atr_max_pct': 0.07804701474275018, 'bear_tp_mult': 2.601045995556115, 'bear_tsl_mult': 0.7800661463339031, 'bear_time_stop': 78, 'bear_use_sma': False, 'bear_use_ema': False, 'bear_use_atr': True, 'bear_use_adx': False, 'bear_use_spike': False, 'bear_rsi_required': False, 'sideways_strategy': 'breakout', 'sideways_bb_std_mult': 3.1882376755293587, 'sideways_rsi_os': 53, 'sideways_rsi_ob': 95, 'sideways_adx_thresh': 28.44296153145718, 'sideways_atr_min_pct': 0.003080713955337216, 'sideways_atr_max_pct': 0.043588567208729126, 'sideways_tp_mult': 2.527807160251311, 'sideways_tsl_mult': 0.3578982436883716, 'sideways_time_stop': 5, 'sideways_use_sma': True, 'sideways_use_ema': True, 'sideways_use_atr': True, 'sideways_use_adx': False, 'sideways_use_spike': False, 'sideways_rsi_required': False}.
[I 2025-08-31 03:41:11,464] Trial 65 finished with values: [-1000000000.0, 1000000000.0] and parameters: {'p_sma': 6, 'p_std': 37, 'p_atr': 12, 'p_adx': 14, 'rsi_period': 22, 'ema1': 20, 'ema2': 53, 'slip_atr_k': 0.19675763589392337, 'slip_spread_k': 0.39151091248672154, 'spread_hl_frac': 0.02636617215477984, 'bb_std_mult': 3.182523160152366, 'rsi_os': 7, 'rsi_ob': 86, 'vol_spike': 0.247379864994895, 'adx_thresh': 15.48614252191113, 'atr_min_pct': 0.010615644548283378, 'atr_max_pct': 0.07328542963376404, 'tp_mult': 1.0200407314988946, 'tsl_mult': 0.8316843116099897, 'strategy': 'mean_reversion', 'time_stop': 25, 'use_sma': False, 'use_atr': False, 'use_adx': True, 'use_ema': True, 'use_spike': False, 'rsi_required': True, 'edge_k': 0.5448022863982378, 'edge_cap': 0.36994489435478617, 'bull_strategy': 'breakout', 'bull_bb_std_mult': 2.8964743282992393, 'bull_rsi_os': 37, 'bull_rsi_ob': 51, 'bull_adx_thresh': 12.856626073125726, 'bull_atr_min_pct': 0.025179469206636357, 'bull_atr_max_pct': 0.12790209949109455, 'bull_tp_mult': 2.909897434682426, 'bull_tsl_mult': 0.9871786306218892, 'bull_time_stop': 300, 'bull_use_sma': True, 'bull_use_ema': True, 'bull_use_atr': True, 'bull_use_adx': False, 'bull_use_spike': True, 'bull_rsi_required': False, 'bear_strategy': 'breakout', 'bear_bb_std_mult': 1.1589187813700688, 'bear_rsi_os': 41, 'bear_rsi_ob': 67, 'bear_adx_thresh': 9.28150986561155, 'bear_atr_min_pct': 0.022133855197538438, 'bear_atr_max_pct': 0.017112621357017507, 'bear_tp_mult': 2.9356120464419693, 'bear_tsl_mult': 0.7764844470765224, 'bear_time_stop': 29, 'bear_use_sma': False, 'bear_use_ema': False, 'bear_use_atr': True, 'bear_use_adx': False, 'bear_use_spike': False, 'bear_rsi_required': False, 'sideways_strategy': 'breakout', 'sideways_bb_std_mult': 2.209306756945507, 'sideways_rsi_os': 11, 'sideways_rsi_ob': 95, 'sideways_adx_thresh': 29.10442308847663, 'sideways_atr_min_pct': 0.02074871870253353, 'sideways_atr_max_pct': 0.09010570703710846, 'sideways_tp_mult': 1.3177044894830885, 'sideways_tsl_mult': 0.1781977866691487, 'sideways_time_stop': 228, 'sideways_use_sma': True, 'sideways_use_ema': True, 'sideways_use_atr': True, 'sideways_use_adx': False, 'sideways_use_spike': False, 'sideways_rsi_required': True}.
[I 2025-08-31 03:41:11,711] Trial 66 finished with values: [-1000000000.0, 1000000000.0] and parameters: {'p_sma': 5, 'p_std': 60, 'p_atr': 22, 'p_adx': 10, 'rsi_period': 22, 'ema1': 17, 'ema2': 53, 'slip_atr_k': 0.03157381206374672, 'slip_spread_k': 0.931465523835302, 'spread_hl_frac': 0.011572693082579211, 'bb_std_mult': 2.0399876323103374, 'rsi_os': 8, 'rsi_ob': 77, 'vol_spike': 0.12767486540917528, 'adx_thresh': 16.001936831143425, 'atr_min_pct': 0.023414483879490855, 'atr_max_pct': 0.0713956351625834, 'tp_mult': 1.3358687712888198, 'tsl_mult': 0.8140938453965312, 'strategy': 'mean_reversion', 'time_stop': 25, 'use_sma': False, 'use_atr': False, 'use_adx': True, 'use_ema': True, 'use_spike': False, 'rsi_required': True, 'edge_k': 0.518778915379672, 'edge_cap': 0.6953336406379863, 'bull_strategy': 'breakout', 'bull_bb_std_mult': 2.929824758275652, 'bull_rsi_os': 30, 'bull_rsi_ob': 93, 'bull_adx_thresh': 12.55576747001237, 'bull_atr_min_pct': 0.0002457744483177326, 'bull_atr_max_pct': 0.05915032884814947, 'bull_tp_mult': 2.911320596563831, 'bull_tsl_mult': 0.4240640979818134, 'bull_time_stop': 298, 'bull_use_sma': True, 'bull_use_ema': True, 'bull_use_atr': True, 'bull_use_adx': False, 'bull_use_spike': True, 'bull_rsi_required': False, 'bear_strategy': 'breakout', 'bear_bb_std_mult': 2.6536984932327066, 'bear_rsi_os': 41, 'bear_rsi_ob': 68, 'bear_adx_thresh': 9.743932134811729, 'bear_atr_min_pct': 0.02261461631103725, 'bear_atr_max_pct': 0.05265655800343163, 'bear_tp_mult': 2.4332012368557483, 'bear_tsl_mult': 0.15759886058750405, 'bear_time_stop': 28, 'bear_use_sma': True, 'bear_use_ema': False, 'bear_use_atr': True, 'bear_use_adx': False, 'bear_use_spike': False, 'bear_rsi_required': False, 'sideways_strategy': 'breakout', 'sideways_bb_std_mult': 3.1767584235974704, 'sideways_rsi_os': 43, 'sideways_rsi_ob': 47, 'sideways_adx_thresh': 18.877758186952768, 'sideways_atr_min_pct': 0.02130420390223276, 'sideways_atr_max_pct': 0.1097417550896658, 'sideways_tp_mult': 1.344645269280198, 'sideways_tsl_mult': 0.8683728470259838, 'sideways_time_stop': 219, 'sideways_use_sma': True, 'sideways_use_ema': True, 'sideways_use_atr': True, 'sideways_use_adx': True, 'sideways_use_spike': False, 'sideways_rsi_required': True}.
[I 2025-08-31 03:41:40,766] Trial 69 finished with values: [-1000000000.0, 1000000000.0] and parameters: {'p_sma': 48, 'p_std': 11, 'p_atr': 9, 'p_adx': 15, 'rsi_period': 31, 'ema1': 19, 'ema2': 46, 'slip_atr_k': 0.21821698835888484, 'slip_spread_k': 0.9397207282181008, 'spread_hl_frac': 0.031110255745096335, 'bb_std_mult': 0.9961308530087905, 'rsi_os': 9, 'rsi_ob': 93, 'vol_spike': 0.16049379680093115, 'adx_thresh': 21.75553647188227, 'atr_min_pct': 0.014594420784377025, 'atr_max_pct': 0.06924002187976992, 'tp_mult': 1.3089812320183982, 'tsl_mult': 0.0005649802445147484, 'strategy': 'mean_reversion', 'time_stop': 252, 'use_sma': False, 'use_atr': False, 'use_adx': True, 'use_ema': True, 'use_spike': False, 'rsi_required': True, 'edge_k': 0.43140755228093774, 'edge_cap': 0.6684333624699085, 'bull_strategy': 'breakout', 'bull_bb_std_mult': 2.615225141015426, 'bull_rsi_os': 31, 'bull_rsi_ob': 93, 'bull_adx_thresh': 31.226293689761132, 'bull_atr_min_pct': 0.0014968922150822312, 'bull_atr_max_pct': 0.14316446019773707, 'bull_tp_mult': 2.828320396794165, 'bull_tsl_mult': 0.6947948230217204, 'bull_time_stop': 286, 'bull_use_sma': True, 'bull_use_ema': True, 'bull_use_atr': True, 'bull_use_adx': False, 'bull_use_spike': True, 'bull_rsi_required': False, 'bear_strategy': 'breakout', 'bear_bb_std_mult': 1.6400166969802747, 'bear_rsi_os': 53, 'bear_rsi_ob': 68, 'bear_adx_thresh': 15.720391808352044, 'bear_atr_min_pct': 0.005129950092192449, 'bear_atr_max_pct': 0.08575755365944913, 'bear_tp_mult': 1.540641187124014, 'bear_tsl_mult': 0.8842353521610163, 'bear_time_stop': 110, 'bear_use_sma': False, 'bear_use_ema': False, 'bear_use_atr': True, 'bear_use_adx': False, 'bear_use_spike': False, 'bear_rsi_required': False, 'sideways_strategy': 'breakout', 'sideways_bb_std_mult': 2.6350124299326256, 'sideways_rsi_os': 54, 'sideways_rsi_ob': 92, 'sideways_adx_thresh': 32.05769394056222, 'sideways_atr_min_pct': 0.021563193390720912, 'sideways_atr_max_pct': 0.042882371570168505, 'sideways_tp_mult': 2.6366761084834587, 'sideways_tsl_mult': 0.8547467063302567, 'sideways_time_stop': 257, 'sideways_use_sma': True, 'sideways_use_ema': True, 'sideways_use_atr': True, 'sideways_use_adx': False, 'sideways_use_spike': False, 'sideways_rsi_required': False}.
[I 2025-08-31 03:41:40,931] Trial 68 finished with values: [-0.05053943772251601, 0.05048025680446547] and parameters: {'p_sma': 49, 'p_std': 19, 'p_atr': 12, 'p_adx': 15, 'rsi_period': 21, 'ema1': 19, 'ema2': 47, 'slip_atr_k': 0.19567002418898266, 'slip_spread_k': 0.929352641194024, 'spread_hl_frac': 0.031079898080104217, 'bb_std_mult': 1.0403283261407275, 'rsi_os': 9, 'rsi_ob': 87, 'vol_spike': 0.11492966180311785, 'adx_thresh': 21.121178265866188, 'atr_min_pct': 0.011771852892945734, 'atr_max_pct': 0.07113938357127957, 'tp_mult': 1.2317755220850883, 'tsl_mult': 0.2549745736234079, 'strategy': 'mean_reversion', 'time_stop': 230, 'use_sma': False, 'use_atr': False, 'use_adx': True, 'use_ema': True, 'use_spike': False, 'rsi_required': True, 'edge_k': 0.7401149046419239, 'edge_cap': 0.37994420427996145, 'bull_strategy': 'breakout', 'bull_bb_std_mult': 2.927634861959627, 'bull_rsi_os': 32, 'bull_rsi_ob': 92, 'bull_adx_thresh': 31.545503614549496, 'bull_atr_min_pct': 0.0004319509282326722, 'bull_atr_max_pct': 0.12827826587747548, 'bull_tp_mult': 2.9866217654731857, 'bull_tsl_mult': 0.6877009309612022, 'bull_time_stop': 295, 'bull_use_sma': True, 'bull_use_ema': True, 'bull_use_atr': True, 'bull_use_adx': False, 'bull_use_spike': True, 'bull_rsi_required': False, 'bear_strategy': 'breakout', 'bear_bb_std_mult': 1.5833009681475405, 'bear_rsi_os': 53, 'bear_rsi_ob': 68, 'bear_adx_thresh': 15.849132417696492, 'bear_atr_min_pct': 0.0016450343684071347, 'bear_atr_max_pct': 0.07009052468022366, 'bear_tp_mult': 1.5503135119152538, 'bear_tsl_mult': 0.8850468284829591, 'bear_time_stop': 97, 'bear_use_sma': False, 'bear_use_ema': False, 'bear_use_atr': True, 'bear_use_adx': False, 'bear_use_spike': False, 'bear_rsi_required': False, 'sideways_strategy': 'breakout', 'sideways_bb_std_mult': 2.572455705410099, 'sideways_rsi_os': 55, 'sideways_rsi_ob': 92, 'sideways_adx_thresh': 29.493540608390703, 'sideways_atr_min_pct': 0.02341427761895347, 'sideways_atr_max_pct': 0.054449128307715255, 'sideways_tp_mult': 2.6378720866042746, 'sideways_tsl_mult': 0.8557191147893584, 'sideways_time_stop': 260, 'sideways_use_sma': True, 'sideways_use_ema': True, 'sideways_use_atr': True, 'sideways_use_adx': False, 'sideways_use_spike': False, 'sideways_rsi_required': False}.
[I 2025-08-31 03:41:40,932] Trial 67 finished with values: [-0.020422149619287677, 0.02042677946245385] and parameters: {'p_sma': 49, 'p_std': 19, 'p_atr': 12, 'p_adx': 14, 'rsi_period': 24, 'ema1': 20, 'ema2': 43, 'slip_atr_k': 0.19434310617831074, 'slip_spread_k': 0.9312649743556938, 'spread_hl_frac': 0.025350017209372827, 'bb_std_mult': 1.0208671610117261, 'rsi_os': 8, 'rsi_ob': 86, 'vol_spike': 0.1251016131513682, 'adx_thresh': 20.523140304655573, 'atr_min_pct': 0.010482442983166071, 'atr_max_pct': 0.07103999560727918, 'tp_mult': 1.3267274364333381, 'tsl_mult': 0.251242610675145, 'strategy': 'mean_reversion', 'time_stop': 229, 'use_sma': False, 'use_atr': False, 'use_adx': True, 'use_ema': True, 'use_spike': False, 'rsi_required': True, 'edge_k': 0.5512081739731887, 'edge_cap': 0.37916105686823387, 'bull_strategy': 'breakout', 'bull_bb_std_mult': 2.888574592322976, 'bull_rsi_os': 32, 'bull_rsi_ob': 93, 'bull_adx_thresh': 31.322165483978534, 'bull_atr_min_pct': 0.0008083567079413707, 'bull_atr_max_pct': 0.12752294062141728, 'bull_tp_mult': 2.8706198717955163, 'bull_tsl_mult': 0.6895209804490887, 'bull_time_stop': 297, 'bull_use_sma': True, 'bull_use_ema': True, 'bull_use_atr': True, 'bull_use_adx': False, 'bull_use_spike': True, 'bull_rsi_required': False, 'bear_strategy': 'breakout', 'bear_bb_std_mult': 1.6311891233269082, 'bear_rsi_os': 52, 'bear_rsi_ob': 68, 'bear_adx_thresh': 15.358627255715637, 'bear_atr_min_pct': 0.00470971528752588, 'bear_atr_max_pct': 0.07257935758941292, 'bear_tp_mult': 1.5213930227747716, 'bear_tsl_mult': 0.7728114287802494, 'bear_time_stop': 25, 'bear_use_sma': False, 'bear_use_ema': False, 'bear_use_atr': True, 'bear_use_adx': False, 'bear_use_spike': False, 'bear_rsi_required': False, 'sideways_strategy': 'breakout', 'sideways_bb_std_mult': 2.5787153568862675, 'sideways_rsi_os': 55, 'sideways_rsi_ob': 92, 'sideways_adx_thresh': 28.821418068804345, 'sideways_atr_min_pct': 0.023471086126330826, 'sideways_atr_max_pct': 0.04590965917189129, 'sideways_tp_mult': 2.4228062026160115, 'sideways_tsl_mult': 0.8761533002042191, 'sideways_time_stop': 257, 'sideways_use_sma': True, 'sideways_use_ema': True, 'sideways_use_atr': True, 'sideways_use_adx': False, 'sideways_use_spike': False, 'sideways_rsi_required': False}.
[I 2025-08-31 03:41:41,050] Trial 70 finished with values: [-0.0440462337961639, 0.043917640589917435] and parameters: {'p_sma': 48, 'p_std': 11, 'p_atr': 9, 'p_adx': 15, 'rsi_period': 31, 'ema1': 19, 'ema2': 47, 'slip_atr_k': 0.1988765810927469, 'slip_spread_k': 0.8265867545649096, 'spread_hl_frac': 0.031456326098651885, 'bb_std_mult': 1.0114346601302677, 'rsi_os': 10, 'rsi_ob': 88, 'vol_spike': 0.11746482886724675, 'adx_thresh': 21.162799372989454, 'atr_min_pct': 0.011988348467970273, 'atr_max_pct': 0.05889855742300973, 'tp_mult': 1.2463807297923921, 'tsl_mult': 0.23767118576755678, 'strategy': 'mean_reversion', 'time_stop': 251, 'use_sma': False, 'use_atr': False, 'use_adx': True, 'use_ema': True, 'use_spike': False, 'rsi_required': True, 'edge_k': 0.7586114859084807, 'edge_cap': 0.2935411264250184, 'bull_strategy': 'breakout', 'bull_bb_std_mult': 2.641549783065477, 'bull_rsi_os': 32, 'bull_rsi_ob': 92, 'bull_adx_thresh': 31.788446562654794, 'bull_atr_min_pct': 0.007469462591541391, 'bull_atr_max_pct': 0.12833995783713184, 'bull_tp_mult': 2.9748724123687946, 'bull_tsl_mult': 0.8232801192749686, 'bull_time_stop': 284, 'bull_use_sma': True, 'bull_use_ema': True, 'bull_use_atr': True, 'bull_use_adx': False, 'bull_use_spike': True, 'bull_rsi_required': False, 'bear_strategy': 'breakout', 'bear_bb_std_mult': 1.555370514692356, 'bear_rsi_os': 53, 'bear_rsi_ob': 68, 'bear_adx_thresh': 14.819950507120463, 'bear_atr_min_pct': 0.0015640283296322489, 'bear_atr_max_pct': 0.08527720054353258, 'bear_tp_mult': 1.5727837211876834, 'bear_tsl_mult': 0.7046129521363347, 'bear_time_stop': 103, 'bear_use_sma': False, 'bear_use_ema': False, 'bear_use_atr': True, 'bear_use_adx': False, 'bear_use_spike': False, 'bear_rsi_required': False, 'sideways_strategy': 'breakout', 'sideways_bb_std_mult': 1.9435558103589672, 'sideways_rsi_os': 48, 'sideways_rsi_ob': 92, 'sideways_adx_thresh': 29.291576865510365, 'sideways_atr_min_pct': 0.023004080172628283, 'sideways_atr_max_pct': 0.04330671659184134, 'sideways_tp_mult': 2.598190651261471, 'sideways_tsl_mult': 0.6348181631876273, 'sideways_time_stop': 242, 'sideways_use_sma': True, 'sideways_use_ema': True, 'sideways_use_atr': True, 'sideways_use_adx': False, 'sideways_use_spike': False, 'sideways_rsi_required': False}.
[I 2025-08-31 03:42:10,484] Trial 72 finished with values: [-0.04542763304580655, 0.0452294928885492] and parameters: {'p_sma': 45, 'p_std': 13, 'p_atr': 12, 'p_adx': 13, 'rsi_period': 19, 'ema1': 19, 'ema2': 42, 'slip_atr_k': 0.21549946818751534, 'slip_spread_k': 0.8323213894132917, 'spread_hl_frac': 0.02313561493285167, 'bb_std_mult': 1.4701535598012039, 'rsi_os': 6, 'rsi_ob': 88, 'vol_spike': 0.1154333673959557, 'adx_thresh': 20.936210922937768, 'atr_min_pct': 0.01252927681470178, 'atr_max_pct': 0.06098541678165008, 'tp_mult': 1.1944372606388618, 'tsl_mult': 0.15018582172056796, 'strategy': 'mean_reversion', 'time_stop': 230, 'use_sma': False, 'use_atr': False, 'use_adx': True, 'use_ema': True, 'use_spike': False, 'rsi_required': True, 'edge_k': 0.7478688339922078, 'edge_cap': 0.6033490024686425, 'bull_strategy': 'breakout', 'bull_bb_std_mult': 3.3960937629679515, 'bull_rsi_os': 26, 'bull_rsi_ob': 88, 'bull_adx_thresh': 29.674147098269728, 'bull_atr_min_pct': 0.0076770425849923855, 'bull_atr_max_pct': 0.11602536728805235, 'bull_tp_mult': 2.9798347937448297, 'bull_tsl_mult': 0.8013163577609672, 'bull_time_stop': 277, 'bull_use_sma': True, 'bull_use_ema': True, 'bull_use_atr': True, 'bull_use_adx': False, 'bull_use_spike': True, 'bull_rsi_required': False, 'bear_strategy': 'breakout', 'bear_bb_std_mult': 1.5947387425935797, 'bear_rsi_os': 52, 'bear_rsi_ob': 72, 'bear_adx_thresh': 21.796606910947375, 'bear_atr_min_pct': 0.0014925471846193162, 'bear_atr_max_pct': 0.07127378088036115, 'bear_tp_mult': 1.5491552661284362, 'bear_tsl_mult': 0.9442525655814218, 'bear_time_stop': 92, 'bear_use_sma': False, 'bear_use_ema': False, 'bear_use_atr': True, 'bear_use_adx': False, 'bear_use_spike': False, 'bear_rsi_required': False, 'sideways_strategy': 'breakout', 'sideways_bb_std_mult': 2.3458081726107816, 'sideways_rsi_os': 48, 'sideways_rsi_ob': 93, 'sideways_adx_thresh': 30.196085126579884, 'sideways_atr_min_pct': 0.023273217911072338, 'sideways_atr_max_pct': 0.055856845280922114, 'sideways_tp_mult': 2.4166088688213896, 'sideways_tsl_mult': 0.9624054566419338, 'sideways_time_stop': 246, 'sideways_use_sma': True, 'sideways_use_ema': True, 'sideways_use_atr': True, 'sideways_use_adx': False, 'sideways_use_spike': False, 'sideways_rsi_required': False}.
