[I 2025-08-31 05:47:12,401] Trial 793 finished with values: [-1000000000.0, 1000000000.0] and parameters: {'p_sma': 27, 'p_std': 39, 'p_atr': 11, 'p_adx': 24, 'rsi_period': 13, 'ema1': 21, 'ema2': 35, 'slip_atr_k': 0.004782246341205691, 'slip_spread_k': 0.7411945888254546, 'spread_hl_frac': 0.0070950819176536385, 'bb_std_mult': 3.198461814267137, 'rsi_os': 34, 'rsi_ob': 65, 'vol_spike': 0.10347010961254102, 'adx_thresh': 18.88724700818917, 'atr_min_pct': 0.01381229238692005, 'atr_max_pct': 0.02029586543799749, 'tp_mult': 1.6339893123616873, 'tsl_mult': 0.7715738777528769, 'strategy': 'mean_reversion', 'time_stop': 5, 'use_sma': False, 'use_atr': True, 'use_adx': False, 'use_ema': False, 'use_spike': True, 'rsi_required': True, 'edge_k': 0.8283471336009914, 'edge_cap': 0.34401201620668503, 'bull_strategy': 'mean_reversion', 'bull_bb_std_mult': 1.3931905116798107, 'bull_rsi_os': 45, 'bull_rsi_ob': 73, 'bull_adx_thresh': 32.13681559366414, 'bull_atr_min_pct': 0.014127449172658398, 'bull_atr_max_pct': 0.08205595613823437, 'bull_tp_mult': 1.1513128314377248, 'bull_tsl_mult': 0.8206897512564483, 'bull_time_stop': 211, 'bull_use_sma': False, 'bull_use_ema': False, 'bull_use_atr': True, 'bull_use_adx': True, 'bull_use_spike': False, 'bull_rsi_required': False, 'bear_strategy': 'breakout', 'bear_bb_std_mult': 2.2404253588598584, 'bear_rsi_os': 7, 'bear_rsi_ob': 65, 'bear_adx_thresh': 17.532306623404885, 'bear_atr_min_pct': 0.006734897637739879, 'bear_atr_max_pct': 0.12292220044935356, 'bear_tp_mult': 1.0105438247022565, 'bear_tsl_mult': 0.14848642917940202, 'bear_time_stop': 61, 'bear_use_sma': True, 'bear_use_ema': True, 'bear_use_atr': True, 'bear_use_adx': False, 'bear_use_spike': False, 'bear_rsi_required': True, 'sideways_strategy': 'breakout', 'sideways_bb_std_mult': 1.441199234662417, 'sideways_rsi_os': 41, 'sideways_rsi_ob': 47, 'sideways_adx_thresh': 26.64005390362928, 'sideways_atr_min_pct': 0.00535569257772508, 'sideways_atr_max_pct': 0.0722492505625665, 'sideways_tp_mult': 2.6338676020280847, 'sideways_tsl_mult': 0.4618495588765273, 'sideways_time_stop': 176, 'sideways_use_sma': False, 'sideways_use_ema': True, 'sideways_use_atr': False, 'sideways_use_adx': False, 'sideways_use_spike': True, 'sideways_rsi_required': True}.
[I 2025-08-31 05:47:12,392] Trial 794 finished with values: [-1000000000.0, 1000000000.0] and parameters: {'p_sma': 50, 'p_std': 37, 'p_atr': 11, 'p_adx': 24, 'rsi_period': 13, 'ema1': 20, 'ema2': 17, 'slip_atr_k': 0.00010136633520592929, 'slip_spread_k': 0.7537814281363914, 'spread_hl_frac': 0.0027774107713688517, 'bb_std_mult': 3.206931206564011, 'rsi_os': 41, 'rsi_ob': 66, 'vol_spike': 0.09555337115515974, 'adx_thresh': 18.93129648172175, 'atr_min_pct': 0.014402991629892782, 'atr_max_pct': 0.0990766634939314, 'tp_mult': 1.9655963393928384, 'tsl_mult': 0.7704713706929788, 'strategy': 'mean_reversion', 'time_stop': 10, 'use_sma': False, 'use_atr': True, 'use_adx': False, 'use_ema': False, 'use_spike': True, 'rsi_required': True, 'edge_k': 0.7535520704231953, 'edge_cap': 0.3861467686280418, 'bull_strategy': 'breakout', 'bull_bb_std_mult': 1.3737667628581944, 'bull_rsi_os': 37, 'bull_rsi_ob': 84, 'bull_adx_thresh': 28.25525018310772, 'bull_atr_min_pct': 0.014008079103811912, 'bull_atr_max_pct': 0.08586016451971126, 'bull_tp_mult': 2.154266341263674, 'bull_tsl_mult': 0.7709626564684849, 'bull_time_stop': 215, 'bull_use_sma': False, 'bull_use_ema': False, 'bull_use_atr': True, 'bull_use_adx': True, 'bull_use_spike': False, 'bull_rsi_required': False, 'bear_strategy': 'breakout', 'bear_bb_std_mult': 2.2361806722540485, 'bear_rsi_os': 6, 'bear_rsi_ob': 67, 'bear_adx_thresh': 17.556693932271177, 'bear_atr_min_pct': 0.006849313177650578, 'bear_atr_max_pct': 0.1224654545547942, 'bear_tp_mult': 1.079169131393955, 'bear_tsl_mult': 0.12823883118632193, 'bear_time_stop': 149, 'bear_use_sma': True, 'bear_use_ema': True, 'bear_use_atr': True, 'bear_use_adx': False, 'bear_use_spike': False, 'bear_rsi_required': True, 'sideways_strategy': 'breakout', 'sideways_bb_std_mult': 3.4198387876406686, 'sideways_rsi_os': 40, 'sideways_rsi_ob': 47, 'sideways_adx_thresh': 26.429756718369298, 'sideways_atr_min_pct': 0.0030218149180273237, 'sideways_atr_max_pct': 0.07338601219470658, 'sideways_tp_mult': 2.6319510215838315, 'sideways_tsl_mult': 0.4475490008768788, 'sideways_time_stop': 177, 'sideways_use_sma': False, 'sideways_use_ema': True, 'sideways_use_atr': False, 'sideways_use_adx': False, 'sideways_use_spike': True, 'sideways_rsi_required': True}.
[I 2025-08-31 05:47:12,921] Trial 792 finished with values: [-1000000000.0, 1000000000.0] and parameters: {'p_sma': 18, 'p_std': 39, 'p_atr': 14, 'p_adx': 24, 'rsi_period': 14, 'ema1': 18, 'ema2': 23, 'slip_atr_k': 0.007177017581632005, 'slip_spread_k': 0.7434300531865767, 'spread_hl_frac': 0.006997879293709778, 'bb_std_mult': 3.1364449615428436, 'rsi_os': 41, 'rsi_ob': 64, 'vol_spike': 0.10163098367287639, 'adx_thresh': 23.119102467261715, 'atr_min_pct': 0.014275664993936954, 'atr_max_pct': 0.020449764244597615, 'tp_mult': 1.302820797862643, 'tsl_mult': 0.7739286149380097, 'strategy': 'mean_reversion', 'time_stop': 8, 'use_sma': False, 'use_atr': True, 'use_adx': False, 'use_ema': False, 'use_spike': True, 'rsi_required': True, 'edge_k': 0.8394225035097289, 'edge_cap': 0.4255292492704856, 'bull_strategy': 'mean_reversion', 'bull_bb_std_mult': 1.2367588381942285, 'bull_rsi_os': 42, 'bull_rsi_ob': 73, 'bull_adx_thresh': 28.45244764664045, 'bull_atr_min_pct': 0.014304313992248395, 'bull_atr_max_pct': 0.08143556034467812, 'bull_tp_mult': 1.5805624504659612, 'bull_tsl_mult': 0.8202979104585025, 'bull_time_stop': 210, 'bull_use_sma': False, 'bull_use_ema': False, 'bull_use_atr': True, 'bull_use_adx': True, 'bull_use_spike': False, 'bull_rsi_required': False, 'bear_strategy': 'breakout', 'bear_bb_std_mult': 2.034254708741075, 'bear_rsi_os': 6, 'bear_rsi_ob': 68, 'bear_adx_thresh': 16.10983976808732, 'bear_atr_min_pct': 0.0059675108489040535, 'bear_atr_max_pct': 0.11803781274204331, 'bear_tp_mult': 1.043063523988953, 'bear_tsl_mult': 0.1293915061257715, 'bear_time_stop': 151, 'bear_use_sma': True, 'bear_use_ema': True, 'bear_use_atr': True, 'bear_use_adx': False, 'bear_use_spike': False, 'bear_rsi_required': True, 'sideways_strategy': 'breakout', 'sideways_bb_std_mult': 1.3230756128897991, 'sideways_rsi_os': 40, 'sideways_rsi_ob': 47, 'sideways_adx_thresh': 26.39629782591231, 'sideways_atr_min_pct': 0.0070614901935581315, 'sideways_atr_max_pct': 0.06788040228643076, 'sideways_tp_mult': 2.632639836916482, 'sideways_tsl_mult': 0.45284178289401394, 'sideways_time_stop': 200, 'sideways_use_sma': False, 'sideways_use_ema': True, 'sideways_use_atr': False, 'sideways_use_adx': False, 'sideways_use_spike': True, 'sideways_rsi_required': True}.
[I 2025-08-31 05:47:13,251] Trial 795 finished with values: [-1000000000.0, 1000000000.0] and parameters: {'p_sma': 37, 'p_std': 39, 'p_atr': 13, 'p_adx': 24, 'rsi_period': 13, 'ema1': 20, 'ema2': 56, 'slip_atr_k': 6.785510066682071e-05, 'slip_spread_k': 0.7730613728138842, 'spread_hl_frac': 0.0030234520492834066, 'bb_std_mult': 3.226347777024733, 'rsi_os': 41, 'rsi_ob': 67, 'vol_spike': 0.0943314811455844, 'adx_thresh': 29.012654964523186, 'atr_min_pct': 0.011671704270009216, 'atr_max_pct': 0.019865766874277623, 'tp_mult': 1.2889476687131762, 'tsl_mult': 0.03338968224380806, 'strategy': 'mean_reversion', 'time_stop': 5, 'use_sma': False, 'use_atr': True, 'use_adx': False, 'use_ema': False, 'use_spike': True, 'rsi_required': True, 'edge_k': 0.8451830286697034, 'edge_cap': 0.3525638803480206, 'bull_strategy': 'breakout', 'bull_bb_std_mult': 1.3692744032117807, 'bull_rsi_os': 46, 'bull_rsi_ob': 88, 'bull_adx_thresh': 30.690906484724593, 'bull_atr_min_pct': 0.01427136052973921, 'bull_atr_max_pct': 0.0848115072851353, 'bull_tp_mult': 2.1544665498534528, 'bull_tsl_mult': 0.7739606567569589, 'bull_time_stop': 190, 'bull_use_sma': False, 'bull_use_ema': False, 'bull_use_atr': True, 'bull_use_adx': True, 'bull_use_spike': False, 'bull_rsi_required': False, 'bear_strategy': 'breakout', 'bear_bb_std_mult': 2.2506207784246595, 'bear_rsi_os': 6, 'bear_rsi_ob': 66, 'bear_adx_thresh': 16.401115970791007, 'bear_atr_min_pct': 0.006645299825496663, 'bear_atr_max_pct': 0.04001324268023739, 'bear_tp_mult': 1.0903068678250287, 'bear_tsl_mult': 0.15582493853931006, 'bear_time_stop': 239, 'bear_use_sma': True, 'bear_use_ema': True, 'bear_use_atr': True, 'bear_use_adx': False, 'bear_use_spike': False, 'bear_rsi_required': True, 'sideways_strategy': 'breakout', 'sideways_bb_std_mult': 3.417990848562887, 'sideways_rsi_os': 39, 'sideways_rsi_ob': 47, 'sideways_adx_thresh': 26.454510038731158, 'sideways_atr_min_pct': 0.003477922389275928, 'sideways_atr_max_pct': 0.061891509624968075, 'sideways_tp_mult': 2.6956302377323165, 'sideways_tsl_mult': 0.37864060771646085, 'sideways_time_stop': 200, 'sideways_use_sma': True, 'sideways_use_ema': True, 'sideways_use_atr': False, 'sideways_use_adx': False, 'sideways_use_spike': True, 'sideways_rsi_required': True}.
[I 2025-08-31 05:48:03,588] Trial 799 finished with values: [-0.024278061132761986, 0.024236260097505246] and parameters: {'p_sma': 34, 'p_std': 42, 'p_atr': 12, 'p_adx': 25, 'rsi_period': 9, 'ema1': 18, 'ema2': 53, 'slip_atr_k': 0.009793157482786866, 'slip_spread_k': 0.7036851735013057, 'spread_hl_frac': 0.004840479738387339, 'bb_std_mult': 2.9626023461578477, 'rsi_os': 46, 'rsi_ob': 65, 'vol_spike': 0.08736261129960962, 'adx_thresh': 12.693888277268673, 'atr_min_pct': 0.012225672389075517, 'atr_max_pct': 0.11226490657888669, 'tp_mult': 2.8844292054579, 'tsl_mult': 0.8013771866155381, 'strategy': 'mean_reversion', 'time_stop': 18, 'use_sma': True, 'use_atr': True, 'use_adx': True, 'use_ema': True, 'use_spike': False, 'rsi_required': True, 'edge_k': 1.007394582408675, 'edge_cap': 0.3862446191841544, 'bull_strategy': 'mean_reversion', 'bull_bb_std_mult': 1.4759592699298698, 'bull_rsi_os': 6, 'bull_rsi_ob': 82, 'bull_adx_thresh': 27.346446208175813, 'bull_atr_min_pct': 0.017516399555419584, 'bull_atr_max_pct': 0.08791236113021467, 'bull_tp_mult': 1.541644371922962, 'bull_tsl_mult': 0.792894505614605, 'bull_time_stop': 196, 'bull_use_sma': True, 'bull_use_ema': True, 'bull_use_atr': False, 'bull_use_adx': True, 'bull_use_spike': True, 'bull_rsi_required': False, 'bear_strategy': 'breakout', 'bear_bb_std_mult': 2.152287780419781, 'bear_rsi_os': 8, 'bear_rsi_ob': 65, 'bear_adx_thresh': 18.717351257751382, 'bear_atr_min_pct': 0.005641322963983033, 'bear_atr_max_pct': 0.05438166783967818, 'bear_tp_mult': 1.0504335282119033, 'bear_tsl_mult': 0.18326143945199136, 'bear_time_stop': 79, 'bear_use_sma': True, 'bear_use_ema': False, 'bear_use_atr': False, 'bear_use_adx': False, 'bear_use_spike': False, 'bear_rsi_required': False, 'sideways_strategy': 'breakout', 'sideways_bb_std_mult': 1.2527662798762944, 'sideways_rsi_os': 38, 'sideways_rsi_ob': 45, 'sideways_adx_thresh': 25.945536831570415, 'sideways_atr_min_pct': 0.001222617352773945, 'sideways_atr_max_pct': 0.05452644706858872, 'sideways_tp_mult': 2.561938571778966, 'sideways_tsl_mult': 0.40376955826913796, 'sideways_time_stop': 189, 'sideways_use_sma': True, 'sideways_use_ema': True, 'sideways_use_atr': True, 'sideways_use_adx': False, 'sideways_use_spike': False, 'sideways_rsi_required': True}.
[I 2025-08-31 05:48:07,013] Trial 797 finished with values: [-1000000000.0, 1000000000.0] and parameters: {'p_sma': 32, 'p_std': 42, 'p_atr': 12, 'p_adx': 25, 'rsi_period': 15, 'ema1': 20, 'ema2': 56, 'slip_atr_k': 0.005408131422859589, 'slip_spread_k': 0.775097547466401, 'spread_hl_frac': 0.005337264476885796, 'bb_std_mult': 3.292773072867693, 'rsi_os': 34, 'rsi_ob': 68, 'vol_spike': 0.08864209580604565, 'adx_thresh': 26.147861091565304, 'atr_min_pct': 0.011227783607184301, 'atr_max_pct': 0.11272376074710183, 'tp_mult': 2.5317893127105187, 'tsl_mult': 0.8010510936280655, 'strategy': 'mean_reversion', 'time_stop': 11, 'use_sma': False, 'use_atr': True, 'use_adx': False, 'use_ema': False, 'use_spike': True, 'rsi_required': True, 'edge_k': 1.0100888334960583, 'edge_cap': 0.390806005453057, 'bull_strategy': 'breakout', 'bull_bb_std_mult': 1.777419614502112, 'bull_rsi_os': 39, 'bull_rsi_ob': 84, 'bull_adx_thresh': 21.089697885781284, 'bull_atr_min_pct': 0.014650980564393302, 'bull_atr_max_pct': 0.0875096756102651, 'bull_tp_mult': 1.5859078552290091, 'bull_tsl_mult': 0.7874161347270722, 'bull_time_stop': 188, 'bull_use_sma': False, 'bull_use_ema': True, 'bull_use_atr': False, 'bull_use_adx': True, 'bull_use_spike': False, 'bull_rsi_required': False, 'bear_strategy': 'breakout', 'bear_bb_std_mult': 2.1590814407142047, 'bear_rsi_os': 6, 'bear_rsi_ob': 65, 'bear_adx_thresh': 16.488891735104247, 'bear_atr_min_pct': 0.00558953194595279, 'bear_atr_max_pct': 0.10537471623624182, 'bear_tp_mult': 1.0524952357733863, 'bear_tsl_mult': 0.1508330645270745, 'bear_time_stop': 101, 'bear_use_sma': True, 'bear_use_ema': False, 'bear_use_atr': True, 'bear_use_adx': False, 'bear_use_spike': False, 'bear_rsi_required': False, 'sideways_strategy': 'breakout', 'sideways_bb_std_mult': 1.329155350019971, 'sideways_rsi_os': 39, 'sideways_rsi_ob': 45, 'sideways_adx_thresh': 26.32442286509155, 'sideways_atr_min_pct': 0.0033694015737459736, 'sideways_atr_max_pct': 0.06171150333602271, 'sideways_tp_mult': 2.5656679445647512, 'sideways_tsl_mult': 0.39816852944528447, 'sideways_time_stop': 300, 'sideways_use_sma': True, 'sideways_use_ema': True, 'sideways_use_atr': False, 'sideways_use_adx': False, 'sideways_use_spike': True, 'sideways_rsi_required': True}.
[I 2025-08-31 05:48:07,452] Trial 798 finished with values: [-0.009774731335983389, 0.009743488876540593] and parameters: {'p_sma': 56, 'p_std': 43, 'p_atr': 12, 'p_adx': 25, 'rsi_period': 15, 'ema1': 18, 'ema2': 58, 'slip_atr_k': 0.00423953557255027, 'slip_spread_k': 0.7207371467867956, 'spread_hl_frac': 0.0056223546459556245, 'bb_std_mult': 2.9504167010266733, 'rsi_os': 46, 'rsi_ob': 69, 'vol_spike': 0.11228446727711512, 'adx_thresh': 26.545898393368244, 'atr_min_pct': 0.01214515204651688, 'atr_max_pct': 0.11243594920171177, 'tp_mult': 2.886648582744564, 'tsl_mult': 0.8034102147919348, 'strategy': 'mean_reversion', 'time_stop': 19, 'use_sma': True, 'use_atr': True, 'use_adx': True, 'use_ema': True, 'use_spike': False, 'rsi_required': True, 'edge_k': 0.9003353799500409, 'edge_cap': 0.45338845020650764, 'bull_strategy': 'mean_reversion', 'bull_bb_std_mult': 1.4757083087313805, 'bull_rsi_os': 28, 'bull_rsi_ob': 82, 'bull_adx_thresh': 8.19272411539913, 'bull_atr_min_pct': 0.01334017449176559, 'bull_atr_max_pct': 0.07855519039293399, 'bull_tp_mult': 1.9963047987499498, 'bull_tsl_mult': 0.8052072316009885, 'bull_time_stop': 180, 'bull_use_sma': True, 'bull_use_ema': True, 'bull_use_atr': False, 'bull_use_adx': True, 'bull_use_spike': True, 'bull_rsi_required': False, 'bear_strategy': 'breakout', 'bear_bb_std_mult': 2.167662228334823, 'bear_rsi_os': 8, 'bear_rsi_ob': 65, 'bear_adx_thresh': 18.254968052031046, 'bear_atr_min_pct': 0.006755823561022325, 'bear_atr_max_pct': 0.0764989589330481, 'bear_tp_mult': 1.0572946238606762, 'bear_tsl_mult': 0.18051123468826993, 'bear_time_stop': 97, 'bear_use_sma': True, 'bear_use_ema': False, 'bear_use_atr': False, 'bear_use_adx': False, 'bear_use_spike': False, 'bear_rsi_required': False, 'sideways_strategy': 'breakout', 'sideways_bb_std_mult': 1.2239333296533323, 'sideways_rsi_os': 38, 'sideways_rsi_ob': 45, 'sideways_adx_thresh': 24.305898447045863, 'sideways_atr_min_pct': 0.0023538853906726834, 'sideways_atr_max_pct': 0.05359810022870727, 'sideways_tp_mult': 2.5687904064888545, 'sideways_tsl_mult': 0.4019621709273765, 'sideways_time_stop': 192, 'sideways_use_sma': True, 'sideways_use_ema': True, 'sideways_use_atr': True, 'sideways_use_adx': False, 'sideways_use_spike': False, 'sideways_rsi_required': True}.
[I 2025-08-31 05:48:08,089] Trial 796 finished with values: [-0.00819582779255179, 0.008164830462080339] and parameters: {'p_sma': 34, 'p_std': 42, 'p_atr': 12, 'p_adx': 25, 'rsi_period': 15, 'ema1': 18, 'ema2': 19, 'slip_atr_k': 0.00044637939613582835, 'slip_spread_k': 0.7714100374632809, 'spread_hl_frac': 0.005429301513587152, 'bb_std_mult': 3.2703135821786042, 'rsi_os': 46, 'rsi_ob': 68, 'vol_spike': 0.08695372357517349, 'adx_thresh': 8.902703452799654, 'atr_min_pct': 0.01185374196557877, 'atr_max_pct': 0.1125028311893827, 'tp_mult': 2.075963310021571, 'tsl_mult': 0.3588870529157342, 'strategy': 'mean_reversion', 'time_stop': 11, 'use_sma': False, 'use_atr': True, 'use_adx': False, 'use_ema': False, 'use_spike': True, 'rsi_required': True, 'edge_k': 0.9043015771239458, 'edge_cap': 0.3601918035635197, 'bull_strategy': 'breakout', 'bull_bb_std_mult': 1.5054255779802328, 'bull_rsi_os': 39, 'bull_rsi_ob': 70, 'bull_adx_thresh': 33.65312656236343, 'bull_atr_min_pct': 0.01732018737776769, 'bull_atr_max_pct': 0.08796947136672659, 'bull_tp_mult': 1.5803223252544814, 'bull_tsl_mult': 0.7899932580342752, 'bull_time_stop': 192, 'bull_use_sma': False, 'bull_use_ema': True, 'bull_use_atr': False, 'bull_use_adx': True, 'bull_use_spike': False, 'bull_rsi_required': False, 'bear_strategy': 'breakout', 'bear_bb_std_mult': 2.1516747136865986, 'bear_rsi_os': 8, 'bear_rsi_ob': 65, 'bear_adx_thresh': 16.383697467732702, 'bear_atr_min_pct': 0.005734234568594154, 'bear_atr_max_pct': 0.11812529856209328, 'bear_tp_mult': 1.0562000144355606, 'bear_tsl_mult': 0.17726459032534314, 'bear_time_stop': 231, 'bear_use_sma': True, 'bear_use_ema': False, 'bear_use_atr': True, 'bear_use_adx': False, 'bear_use_spike': False, 'bear_rsi_required': False, 'sideways_strategy': 'breakout', 'sideways_bb_std_mult': 1.3375493050297609, 'sideways_rsi_os': 39, 'sideways_rsi_ob': 46, 'sideways_adx_thresh': 24.39481093289716, 'sideways_atr_min_pct': 0.0023792794339891326, 'sideways_atr_max_pct': 0.06143717887525571, 'sideways_tp_mult': 2.5732776126847066, 'sideways_tsl_mult': 0.3848096695861709, 'sideways_time_stop': 190, 'sideways_use_sma': True, 'sideways_use_ema': True, 'sideways_use_atr': False, 'sideways_use_adx': False, 'sideways_use_spike': True, 'sideways_rsi_required': True}.
[I 2025-08-31 05:48:56,828] Trial 800 finished with values: [-1000000000.0, 1000000000.0] and parameters: {'p_sma': 7, 'p_std': 41, 'p_atr': 14, 'p_adx': 26, 'rsi_period': 15, 'ema1': 19, 'ema2': 33, 'slip_atr_k': 0.00603407088411468, 'slip_spread_k': 0.7123294251562626, 'spread_hl_frac': 0.00382128375622149, 'bb_std_mult': 3.2792433099672658, 'rsi_os': 36, 'rsi_ob': 69, 'vol_spike': 0.08291461793605609, 'adx_thresh': 21.78355752262936, 'atr_min_pct': 0.011231373252675281, 'atr_max_pct': 0.05060328810920808, 'tp_mult': 2.082806021719054, 'tsl_mult': 0.8000018061072093, 'strategy': 'mean_reversion', 'time_stop': 10, 'use_sma': False, 'use_atr': True, 'use_adx': False, 'use_ema': False, 'use_spike': True, 'rsi_required': True, 'edge_k': 1.0056508421606327, 'edge_cap': 0.4478970226432499, 'bull_strategy': 'mean_reversion', 'bull_bb_std_mult': 1.822864879862409, 'bull_rsi_os': 27, 'bull_rsi_ob': 84, 'bull_adx_thresh': 18.85044286828214, 'bull_atr_min_pct': 0.020407867513823057, 'bull_atr_max_pct': 0.07845072461924804, 'bull_tp_mult': 1.5916299547839652, 'bull_tsl_mult': 0.7991408778024658, 'bull_time_stop': 224, 'bull_use_sma': False, 'bull_use_ema': False, 'bull_use_atr': True, 'bull_use_adx': False, 'bull_use_spike': False, 'bull_rsi_required': False, 'bear_strategy': 'breakout', 'bear_bb_std_mult': 2.163024771622377, 'bear_rsi_os': 8, 'bear_rsi_ob': 70, 'bear_adx_thresh': 18.161280072100144, 'bear_atr_min_pct': 0.006763345260454153, 'bear_atr_max_pct': 0.041617224107675085, 'bear_tp_mult': 1.0446337591888253, 'bear_tsl_mult': 0.18474486446393237, 'bear_time_stop': 229, 'bear_use_sma': False, 'bear_use_ema': True, 'bear_use_atr': True, 'bear_use_adx': False, 'bear_use_spike': False, 'bear_rsi_required': False, 'sideways_strategy': 'breakout', 'sideways_bb_std_mult': 1.9206346932226739, 'sideways_rsi_os': 39, 'sideways_rsi_ob': 46, 'sideways_adx_thresh': 24.572639246410947, 'sideways_atr_min_pct': 0.002188586917322394, 'sideways_atr_max_pct': 0.07934291027679345, 'sideways_tp_mult': 2.580039307846381, 'sideways_tsl_mult': 0.4711172225587306, 'sideways_time_stop': 275, 'sideways_use_sma': False, 'sideways_use_ema': True, 'sideways_use_atr': False, 'sideways_use_adx': False, 'sideways_use_spike': True, 'sideways_rsi_required': False}.
