[I 2025-08-31 03:42:10,655] Trial 74 finished with values: [-1000000000.0, 1000000000.0] and parameters: {'p_sma': 45, 'p_std': 19, 'p_atr': 12, 'p_adx': 15, 'rsi_period': 19, 'ema1': 21, 'ema2': 42, 'slip_atr_k': 0.21515349215596208, 'slip_spread_k': 0.9854376442383841, 'spread_hl_frac': 0.022841056224113705, 'bb_std_mult': 1.3958972117921817, 'rsi_os': 5, 'rsi_ob': 88, 'vol_spike': 0.11530994051137576, 'adx_thresh': 20.596306408875858, 'atr_min_pct': 0.011309732052473088, 'atr_max_pct': 0.06385342001530693, 'tp_mult': 1.2127517514348094, 'tsl_mult': 0.24615620751909173, 'strategy': 'mean_reversion', 'time_stop': 230, 'use_sma': False, 'use_atr': False, 'use_adx': True, 'use_ema': True, 'use_spike': False, 'rsi_required': True, 'edge_k': 0.7452623504359116, 'edge_cap': 0.299139550945427, 'bull_strategy': 'breakout', 'bull_bb_std_mult': 2.980481547877132, 'bull_rsi_os': 33, 'bull_rsi_ob': 89, 'bull_adx_thresh': 29.592046049534474, 'bull_atr_min_pct': 0.002861231148780964, 'bull_atr_max_pct': 0.1161025776852635, 'bull_tp_mult': 2.530723509490147, 'bull_tsl_mult': 0.6678462388249802, 'bull_time_stop': 279, 'bull_use_sma': True, 'bull_use_ema': True, 'bull_use_atr': True, 'bull_use_adx': False, 'bull_use_spike': True, 'bull_rsi_required': False, 'bear_strategy': 'breakout', 'bear_bb_std_mult': 1.5786215294686976, 'bear_rsi_os': 52, 'bear_rsi_ob': 72, 'bear_adx_thresh': 14.456580673225492, 'bear_atr_min_pct': 0.007553188638552582, 'bear_atr_max_pct': 0.07414084898826874, 'bear_tp_mult': 1.5129263387085767, 'bear_tsl_mult': 0.7022108969321128, 'bear_time_stop': 79, 'bear_use_sma': False, 'bear_use_ema': False, 'bear_use_atr': True, 'bear_use_adx': False, 'bear_use_spike': False, 'bear_rsi_required': False, 'sideways_strategy': 'breakout', 'sideways_bb_std_mult': 2.375459546425681, 'sideways_rsi_os': 48, 'sideways_rsi_ob': 88, 'sideways_adx_thresh': 22.218052611793162, 'sideways_atr_min_pct': 0.02342143470401496, 'sideways_atr_max_pct': 0.056103856494349, 'sideways_tp_mult': 2.443828972865012, 'sideways_tsl_mult': 0.9779238415897641, 'sideways_time_stop': 248, 'sideways_use_sma': True, 'sideways_use_ema': True, 'sideways_use_atr': True, 'sideways_use_adx': False, 'sideways_use_spike': False, 'sideways_rsi_required': False}.
[I 2025-08-31 03:42:10,753] Trial 73 finished with values: [-1000000000.0, 1000000000.0] and parameters: {'p_sma': 45, 'p_std': 20, 'p_atr': 15, 'p_adx': 11, 'rsi_period': 19, 'ema1': 21, 'ema2': 34, 'slip_atr_k': 0.21016696921004768, 'slip_spread_k': 0.9976999845837645, 'spread_hl_frac': 0.023703218262742572, 'bb_std_mult': 1.3664998245702464, 'rsi_os': 5, 'rsi_ob': 88, 'vol_spike': 0.11313152441249949, 'adx_thresh': 20.479952817127103, 'atr_min_pct': 0.011922941067315514, 'atr_max_pct': 0.131797883892808, 'tp_mult': 1.250508694311757, 'tsl_mult': 0.29432213200333235, 'strategy': 'mean_reversion', 'time_stop': 229, 'use_sma': False, 'use_atr': False, 'use_adx': True, 'use_ema': True, 'use_spike': False, 'rsi_required': True, 'edge_k': 0.7039199222877732, 'edge_cap': 0.3973261846340179, 'bull_strategy': 'breakout', 'bull_bb_std_mult': 3.4143017308016232, 'bull_rsi_os': 26, 'bull_rsi_ob': 91, 'bull_adx_thresh': 29.277944004178718, 'bull_atr_min_pct': 0.0029669560405223058, 'bull_atr_max_pct': 0.12683617499614858, 'bull_tp_mult': 2.6652200215757467, 'bull_tsl_mult': 0.7347582307572841, 'bull_time_stop': 278, 'bull_use_sma': True, 'bull_use_ema': True, 'bull_use_atr': True, 'bull_use_adx': False, 'bull_use_spike': True, 'bull_rsi_required': False, 'bear_strategy': 'breakout', 'bear_bb_std_mult': 1.5726087145861825, 'bear_rsi_os': 52, 'bear_rsi_ob': 72, 'bear_adx_thresh': 14.591174409334588, 'bear_atr_min_pct': 0.007458387667068002, 'bear_atr_max_pct': 0.07070103633119042, 'bear_tp_mult': 1.3326181462013447, 'bear_tsl_mult': 0.7058123681040981, 'bear_time_stop': 54, 'bear_use_sma': False, 'bear_use_ema': False, 'bear_use_atr': True, 'bear_use_adx': False, 'bear_use_spike': False, 'bear_rsi_required': False, 'sideways_strategy': 'breakout', 'sideways_bb_std_mult': 2.401497337014518, 'sideways_rsi_os': 48, 'sideways_rsi_ob': 88, 'sideways_adx_thresh': 22.055843367424735, 'sideways_atr_min_pct': 0.02350965523855402, 'sideways_atr_max_pct': 0.034367233383152195, 'sideways_tp_mult': 2.409369539475164, 'sideways_tsl_mult': 0.9631766084935556, 'sideways_time_stop': 265, 'sideways_use_sma': True, 'sideways_use_ema': True, 'sideways_use_atr': True, 'sideways_use_adx': False, 'sideways_use_spike': False, 'sideways_rsi_required': False}.
[I 2025-08-31 03:42:10,841] Trial 71 finished with values: [-0.04058537068554646, 0.040458782320697245] and parameters: {'p_sma': 45, 'p_std': 14, 'p_atr': 12, 'p_adx': 13, 'rsi_period': 18, 'ema1': 21, 'ema2': 42, 'slip_atr_k': 0.23784333347011324, 'slip_spread_k': 0.8373648150791886, 'spread_hl_frac': 0.016267241502556956, 'bb_std_mult': 1.237489459995434, 'rsi_os': 10, 'rsi_ob': 87, 'vol_spike': 0.11758133796703296, 'adx_thresh': 20.97433214107736, 'atr_min_pct': 0.012083541125737283, 'atr_max_pct': 0.06031972092379814, 'tp_mult': 1.2635635748080833, 'tsl_mult': 0.24409764805024808, 'strategy': 'mean_reversion', 'time_stop': 229, 'use_sma': False, 'use_atr': False, 'use_adx': True, 'use_ema': True, 'use_spike': False, 'rsi_required': True, 'edge_k': 0.748047666149336, 'edge_cap': 0.5974245215984023, 'bull_strategy': 'breakout', 'bull_bb_std_mult': 2.476277496381953, 'bull_rsi_os': 26, 'bull_rsi_ob': 88, 'bull_adx_thresh': 29.613574794651928, 'bull_atr_min_pct': 0.007558334689670545, 'bull_atr_max_pct': 0.1328389509240022, 'bull_tp_mult': 2.9846802318440973, 'bull_tsl_mult': 0.9028022095988804, 'bull_time_stop': 277, 'bull_use_sma': True, 'bull_use_ema': True, 'bull_use_atr': True, 'bull_use_adx': False, 'bull_use_spike': True, 'bull_rsi_required': False, 'bear_strategy': 'breakout', 'bear_bb_std_mult': 2.392898739296013, 'bear_rsi_os': 52, 'bear_rsi_ob': 71, 'bear_adx_thresh': 20.42808652475551, 'bear_atr_min_pct': 0.0020605753502155066, 'bear_atr_max_pct': 0.07078882757822179, 'bear_tp_mult': 1.5315130695860988, 'bear_tsl_mult': 0.9489246205005294, 'bear_time_stop': 92, 'bear_use_sma': False, 'bear_use_ema': False, 'bear_use_atr': True, 'bear_use_adx': False, 'bear_use_spike': False, 'bear_rsi_required': False, 'sideways_strategy': 'breakout', 'sideways_bb_std_mult': 2.3470788828434275, 'sideways_rsi_os': 48, 'sideways_rsi_ob': 93, 'sideways_adx_thresh': 30.116489655843907, 'sideways_atr_min_pct': 0.023398128894990218, 'sideways_atr_max_pct': 0.06314600112074002, 'sideways_tp_mult': 2.9141485333052666, 'sideways_tsl_mult': 0.724984651377637, 'sideways_time_stop': 246, 'sideways_use_sma': True, 'sideways_use_ema': True, 'sideways_use_atr': True, 'sideways_use_adx': False, 'sideways_use_spike': False, 'sideways_rsi_required': False}.
[I 2025-08-31 03:42:39,378] Trial 76 finished with values: [-0.03588806081655094, 0.03569497316469335] and parameters: {'p_sma': 50, 'p_std': 23, 'p_atr': 13, 'p_adx': 13, 'rsi_period': 19, 'ema1': 18, 'ema2': 45, 'slip_atr_k': 0.19670279389421813, 'slip_spread_k': 0.8390813970698109, 'spread_hl_frac': 0.020826782629840983, 'bb_std_mult': 0.9340030409458303, 'rsi_os': 10, 'rsi_ob': 84, 'vol_spike': 0.09454912546167321, 'adx_thresh': 19.04883169829904, 'atr_min_pct': 0.012156045283506316, 'atr_max_pct': 0.060266573825357286, 'tp_mult': 1.2726213783476181, 'tsl_mult': 0.2956657163702673, 'strategy': 'mean_reversion', 'time_stop': 223, 'use_sma': False, 'use_atr': False, 'use_adx': True, 'use_ema': True, 'use_spike': False, 'rsi_required': True, 'edge_k': 0.45998350696399604, 'edge_cap': 0.38833169730472483, 'bull_strategy': 'breakout', 'bull_bb_std_mult': 2.7363051888324126, 'bull_rsi_os': 35, 'bull_rsi_ob': 92, 'bull_adx_thresh': 32.12842956014838, 'bull_atr_min_pct': 0.007780214962559962, 'bull_atr_max_pct': 0.12491768876660576, 'bull_tp_mult': 2.9758905155943687, 'bull_tsl_mult': 0.7335486055220496, 'bull_time_stop': 259, 'bull_use_sma': True, 'bull_use_ema': True, 'bull_use_atr': True, 'bull_use_adx': False, 'bull_use_spike': True, 'bull_rsi_required': False, 'bear_strategy': 'breakout', 'bear_bb_std_mult': 1.7627915369100493, 'bear_rsi_os': 53, 'bear_rsi_ob': 71, 'bear_adx_thresh': 12.549177213140634, 'bear_atr_min_pct': 0.0022235478915008707, 'bear_atr_max_pct': 0.06800610661574263, 'bear_tp_mult': 1.658772325476003, 'bear_tsl_mult': 0.7444540770159539, 'bear_time_stop': 56, 'bear_use_sma': False, 'bear_use_ema': False, 'bear_use_atr': True, 'bear_use_adx': False, 'bear_use_spike': False, 'bear_rsi_required': False, 'sideways_strategy': 'breakout', 'sideways_bb_std_mult': 2.95854245665754, 'sideways_rsi_os': 55, 'sideways_rsi_ob': 91, 'sideways_adx_thresh': 34.82125534619788, 'sideways_atr_min_pct': 0.026206657969185688, 'sideways_atr_max_pct': 0.033153556758556815, 'sideways_tp_mult': 2.318376579807978, 'sideways_tsl_mult': 0.8944242535932235, 'sideways_time_stop': 263, 'sideways_use_sma': True, 'sideways_use_ema': True, 'sideways_use_atr': True, 'sideways_use_adx': False, 'sideways_use_spike': False, 'sideways_rsi_required': False}.
[I 2025-08-31 03:42:39,958] Trial 77 finished with values: [-0.04315806191698479, 0.04311072119464193] and parameters: {'p_sma': 50, 'p_std': 22, 'p_atr': 12, 'p_adx': 13, 'rsi_period': 31, 'ema1': 19, 'ema2': 44, 'slip_atr_k': 0.1968420744303489, 'slip_spread_k': 0.8564361989835891, 'spread_hl_frac': 0.020321519293542464, 'bb_std_mult': 0.9180666828847259, 'rsi_os': 10, 'rsi_ob': 84, 'vol_spike': 0.09029983931135337, 'adx_thresh': 18.859877168570062, 'atr_min_pct': 0.012629274833339402, 'atr_max_pct': 0.060161556588427166, 'tp_mult': 1.635045706298744, 'tsl_mult': 0.3769551923407265, 'strategy': 'mean_reversion', 'time_stop': 220, 'use_sma': False, 'use_atr': False, 'use_adx': True, 'use_ema': True, 'use_spike': False, 'rsi_required': True, 'edge_k': 0.5907803774247132, 'edge_cap': 0.2943042188490407, 'bull_strategy': 'breakout', 'bull_bb_std_mult': 2.7673769168472018, 'bull_rsi_os': 36, 'bull_rsi_ob': 94, 'bull_adx_thresh': 32.08107943016947, 'bull_atr_min_pct': 0.0008372983268899629, 'bull_atr_max_pct': 0.12992870107708873, 'bull_tp_mult': 2.9809932630186933, 'bull_tsl_mult': 0.6512734513004076, 'bull_time_stop': 286, 'bull_use_sma': True, 'bull_use_ema': True, 'bull_use_atr': True, 'bull_use_adx': False, 'bull_use_spike': True, 'bull_rsi_required': False, 'bear_strategy': 'breakout', 'bear_bb_std_mult': 1.7515913514480133, 'bear_rsi_os': 53, 'bear_rsi_ob': 66, 'bear_adx_thresh': 16.047382565396262, 'bear_atr_min_pct': 0.002461406512768001, 'bear_atr_max_pct': 0.06742631396291769, 'bear_tp_mult': 1.544453085857796, 'bear_tsl_mult': 0.7550103570826402, 'bear_time_stop': 55, 'bear_use_sma': False, 'bear_use_ema': False, 'bear_use_atr': True, 'bear_use_adx': False, 'bear_use_spike': False, 'bear_rsi_required': False, 'sideways_strategy': 'breakout', 'sideways_bb_std_mult': 1.9491908840527126, 'sideways_rsi_os': 55, 'sideways_rsi_ob': 92, 'sideways_adx_thresh': 34.34312603175725, 'sideways_atr_min_pct': 0.02401091789946318, 'sideways_atr_max_pct': 0.04629338645061929, 'sideways_tp_mult': 2.330724135114786, 'sideways_tsl_mult': 0.8967411194552694, 'sideways_time_stop': 249, 'sideways_use_sma': True, 'sideways_use_ema': True, 'sideways_use_atr': True, 'sideways_use_adx': False, 'sideways_use_spike': False, 'sideways_rsi_required': False}.
[I 2025-08-31 03:42:39,972] Trial 78 finished with values: [-0.02936882817599218, 0.029188221536440517] and parameters: {'p_sma': 49, 'p_std': 22, 'p_atr': 14, 'p_adx': 13, 'rsi_period': 20, 'ema1': 19, 'ema2': 47, 'slip_atr_k': 0.13752552869227166, 'slip_spread_k': 0.8501105077611821, 'spread_hl_frac': 0.020598695046468742, 'bb_std_mult': 0.9236258769497419, 'rsi_os': 10, 'rsi_ob': 67, 'vol_spike': 0.09203499478280906, 'adx_thresh': 22.726162972438342, 'atr_min_pct': 0.012619065761999223, 'atr_max_pct': 0.059592773121298945, 'tp_mult': 1.1612656091107387, 'tsl_mult': 0.19024476281872982, 'strategy': 'mean_reversion', 'time_stop': 252, 'use_sma': False, 'use_atr': False, 'use_adx': True, 'use_ema': True, 'use_spike': False, 'rsi_required': True, 'edge_k': 0.4281918740570573, 'edge_cap': 0.3794883625639001, 'bull_strategy': 'breakout', 'bull_bb_std_mult': 2.732076647478623, 'bull_rsi_os': 35, 'bull_rsi_ob': 94, 'bull_adx_thresh': 31.958266287326033, 'bull_atr_min_pct': 0.007532552094567781, 'bull_atr_max_pct': 0.13136756539221417, 'bull_tp_mult': 2.3169430865777323, 'bull_tsl_mult': 0.5700543687555482, 'bull_time_stop': 289, 'bull_use_sma': True, 'bull_use_ema': True, 'bull_use_atr': True, 'bull_use_adx': False, 'bull_use_spike': True, 'bull_rsi_required': False, 'bear_strategy': 'breakout', 'bear_bb_std_mult': 1.76788357385148, 'bear_rsi_os': 54, 'bear_rsi_ob': 66, 'bear_adx_thresh': 12.504068386268756, 'bear_atr_min_pct': 0.0023548714099882774, 'bear_atr_max_pct': 0.06615162595784331, 'bear_tp_mult': 1.6632839170781346, 'bear_tsl_mult': 0.7546419369868775, 'bear_time_stop': 25, 'bear_use_sma': False, 'bear_use_ema': False, 'bear_use_atr': True, 'bear_use_adx': False, 'bear_use_spike': False, 'bear_rsi_required': False, 'sideways_strategy': 'breakout', 'sideways_bb_std_mult': 2.599207253356945, 'sideways_rsi_os': 55, 'sideways_rsi_ob': 92, 'sideways_adx_thresh': 34.328890408919094, 'sideways_atr_min_pct': 0.026107078276773197, 'sideways_atr_max_pct': 0.04521483032965991, 'sideways_tp_mult': 2.3264721102964727, 'sideways_tsl_mult': 0.881954897239583, 'sideways_time_stop': 265, 'sideways_use_sma': True, 'sideways_use_ema': True, 'sideways_use_atr': True, 'sideways_use_adx': False, 'sideways_use_spike': False, 'sideways_rsi_required': False}.
[I 2025-08-31 03:42:40,046] Trial 75 finished with values: [-0.04239047978319499, 0.042200019447265334] and parameters: {'p_sma': 50, 'p_std': 19, 'p_atr': 14, 'p_adx': 13, 'rsi_period': 19, 'ema1': 18, 'ema2': 42, 'slip_atr_k': 0.19840800593758257, 'slip_spread_k': 0.8278594091581412, 'spread_hl_frac': 0.022255226350676657, 'bb_std_mult': 1.2252074897310026, 'rsi_os': 5, 'rsi_ob': 87, 'vol_spike': 0.11571085845003665, 'adx_thresh': 21.022090207855154, 'atr_min_pct': 0.012619945418973872, 'atr_max_pct': 0.06575256370774173, 'tp_mult': 1.1596639040072998, 'tsl_mult': 0.2537003147875734, 'strategy': 'mean_reversion', 'time_stop': 231, 'use_sma': False, 'use_atr': False, 'use_adx': True, 'use_ema': True, 'use_spike': False, 'rsi_required': True, 'edge_k': 0.7130314057438146, 'edge_cap': 0.29033874077978794, 'bull_strategy': 'breakout', 'bull_bb_std_mult': 2.705745381232277, 'bull_rsi_os': 33, 'bull_rsi_ob': 89, 'bull_adx_thresh': 29.593356770448704, 'bull_atr_min_pct': 0.0025047833033561184, 'bull_atr_max_pct': 0.1279408147326741, 'bull_tp_mult': 2.5071438773673043, 'bull_tsl_mult': 0.6583317129600111, 'bull_time_stop': 278, 'bull_use_sma': True, 'bull_use_ema': True, 'bull_use_atr': True, 'bull_use_adx': False, 'bull_use_spike': True, 'bull_rsi_required': False, 'bear_strategy': 'breakout', 'bear_bb_std_mult': 1.9319876271829854, 'bear_rsi_os': 52, 'bear_rsi_ob': 65, 'bear_adx_thresh': 14.90113733939193, 'bear_atr_min_pct': 0.0020847169203499025, 'bear_atr_max_pct': 0.07012204122470957, 'bear_tp_mult': 1.5737577005470405, 'bear_tsl_mult': 0.7107533963503202, 'bear_time_stop': 22, 'bear_use_sma': False, 'bear_use_ema': False, 'bear_use_atr': True, 'bear_use_adx': False, 'bear_use_spike': False, 'bear_rsi_required': False, 'sideways_strategy': 'breakout', 'sideways_bb_std_mult': 2.3659164619952624, 'sideways_rsi_os': 54, 'sideways_rsi_ob': 88, 'sideways_adx_thresh': 22.588378659119325, 'sideways_atr_min_pct': 0.02351305115369728, 'sideways_atr_max_pct': 0.05663749838589502, 'sideways_tp_mult': 2.414823877743513, 'sideways_tsl_mult': 0.8929504880880079, 'sideways_time_stop': 250, 'sideways_use_sma': True, 'sideways_use_ema': True, 'sideways_use_atr': True, 'sideways_use_adx': False, 'sideways_use_spike': False, 'sideways_rsi_required': False}.
[I 2025-08-31 03:43:08,805] Trial 80 finished with values: [-0.04628986329948981, 0.046215571780441035] and parameters: {'p_sma': 43, 'p_std': 13, 'p_atr': 14, 'p_adx': 13, 'rsi_period': 26, 'ema1': 18, 'ema2': 42, 'slip_atr_k': 0.23842087187794658, 'slip_spread_k': 0.8475222801071565, 'spread_hl_frac': 0.02237420055721626, 'bb_std_mult': 1.2363043102803828, 'rsi_os': 10, 'rsi_ob': 85, 'vol_spike': 0.0939844566339071, 'adx_thresh': 19.180247056649193, 'atr_min_pct': 0.012603808162398632, 'atr_max_pct': 0.05905844936906917, 'tp_mult': 1.6263624255753448, 'tsl_mult': 0.36760082423261736, 'strategy': 'mean_reversion', 'time_stop': 251, 'use_sma': False, 'use_atr': False, 'use_adx': True, 'use_ema': True, 'use_spike': False, 'rsi_required': True, 'edge_k': 0.4486958022869664, 'edge_cap': 0.2894954546780561, 'bull_strategy': 'breakout', 'bull_bb_std_mult': 3.1359416919790024, 'bull_rsi_os': 36, 'bull_rsi_ob': 94, 'bull_adx_thresh': 31.705435391932543, 'bull_atr_min_pct': 0.001027566778695947, 'bull_atr_max_pct': 0.13545657170053158, 'bull_tp_mult': 2.330325178938338, 'bull_tsl_mult': 0.6376407974059278, 'bull_time_stop': 258, 'bull_use_sma': True, 'bull_use_ema': True, 'bull_use_atr': True, 'bull_use_adx': False, 'bull_use_spike': True, 'bull_rsi_required': False, 'bear_strategy': 'breakout', 'bear_bb_std_mult': 1.8497968090014725, 'bear_rsi_os': 48, 'bear_rsi_ob': 71, 'bear_adx_thresh': 18.92142333529585, 'bear_atr_min_pct': 0.0026648936566929524, 'bear_atr_max_pct': 0.06646020220325426, 'bear_tp_mult': 1.4784684362117297, 'bear_tsl_mult': 0.7518665772084699, 'bear_time_stop': 21, 'bear_use_sma': False, 'bear_use_ema': False, 'bear_use_atr': True, 'bear_use_adx': False, 'bear_use_spike': False, 'bear_rsi_required': False, 'sideways_strategy': 'breakout', 'sideways_bb_std_mult': 2.7817711495436517, 'sideways_rsi_os': 52, 'sideways_rsi_ob': 90, 'sideways_adx_thresh': 23.733479761173022, 'sideways_atr_min_pct': 0.025899240262250142, 'sideways_atr_max_pct': 0.04714964352514154, 'sideways_tp_mult': 2.336348943640852, 'sideways_tsl_mult': 0.8858588019998153, 'sideways_time_stop': 265, 'sideways_use_sma': True, 'sideways_use_ema': True, 'sideways_use_atr': True, 'sideways_use_adx': False, 'sideways_use_spike': False, 'sideways_rsi_required': False}.
[I 2025-08-31 03:43:09,480] Trial 79 finished with values: [-0.037087443260584774, 0.03701784034828291] and parameters: {'p_sma': 50, 'p_std': 22, 'p_atr': 14, 'p_adx': 13, 'rsi_period': 25, 'ema1': 18, 'ema2': 45, 'slip_atr_k': 0.1505378901686322, 'slip_spread_k': 0.8986163731444283, 'spread_hl_frac': 0.02094481112670748, 'bb_std_mult': 1.2354425860169072, 'rsi_os': 10, 'rsi_ob': 84, 'vol_spike': 0.09257246541670364, 'adx_thresh': 22.87519552655444, 'atr_min_pct': 0.012884710936193412, 'atr_max_pct': 0.06611342254119616, 'tp_mult': 1.6431290975585413, 'tsl_mult': 0.1937136753401095, 'strategy': 'mean_reversion', 'time_stop': 249, 'use_sma': False, 'use_atr': False, 'use_adx': True, 'use_ema': True, 'use_spike': False, 'rsi_required': True, 'edge_k': 0.4789601335161465, 'edge_cap': 0.3856963638222933, 'bull_strategy': 'breakout', 'bull_bb_std_mult': 3.122989828314133, 'bull_rsi_os': 37, 'bull_rsi_ob': 94, 'bull_adx_thresh': 32.13088613263035, 'bull_atr_min_pct': 0.007448318393695583, 'bull_atr_max_pct': 0.1320219558251295, 'bull_tp_mult': 2.9903109786259923, 'bull_tsl_mult': 0.8090572470768925, 'bull_time_stop': 292, 'bull_use_sma': True, 'bull_use_ema': True, 'bull_use_atr': True, 'bull_use_adx': False, 'bull_use_spike': True, 'bull_rsi_required': False, 'bear_strategy': 'breakout', 'bear_bb_std_mult': 1.764161199892377, 'bear_rsi_os': 53, 'bear_rsi_ob': 65, 'bear_adx_thresh': 16.121643558670126, 'bear_atr_min_pct': 0.0017967601743840026, 'bear_atr_max_pct': 0.06592534430370484, 'bear_tp_mult': 1.5069912340777059, 'bear_tsl_mult': 0.7437070579017319, 'bear_time_stop': 23, 'bear_use_sma': False, 'bear_use_ema': False, 'bear_use_atr': True, 'bear_use_adx': False, 'bear_use_spike': False, 'bear_rsi_required': False, 'sideways_strategy': 'breakout', 'sideways_bb_std_mult': 2.588986365800264, 'sideways_rsi_os': 55, 'sideways_rsi_ob': 91, 'sideways_adx_thresh': 34.203790310906825, 'sideways_atr_min_pct': 0.02409000845564538, 'sideways_atr_max_pct': 0.047142196219148544, 'sideways_tp_mult': 2.3191675763462234, 'sideways_tsl_mult': 0.8957783152386802, 'sideways_time_stop': 263, 'sideways_use_sma': True, 'sideways_use_ema': True, 'sideways_use_atr': True, 'sideways_use_adx': False, 'sideways_use_spike': False, 'sideways_rsi_required': False}.
