[I 2025-08-31 03:54:04,367] Trial 169 finished with values: [-1000000000.0, 1000000000.0] and parameters: {'p_sma': 33, 'p_std': 29, 'p_atr': 26, 'p_adx': 12, 'rsi_period': 52, 'ema1': 16, 'ema2': 13, 'slip_atr_k': 0.1787611942025787, 'slip_spread_k': 0.28743910654513605, 'spread_hl_frac': 0.025150858084812582, 'bb_std_mult': 1.4013490761240355, 'rsi_os': 18, 'rsi_ob': 65, 'vol_spike': 0.007892991645153, 'adx_thresh': 26.963555325743616, 'atr_min_pct': 0.02034246964001487, 'atr_max_pct': 0.14341943285826306, 'tp_mult': 2.4081217842509655, 'tsl_mult': 0.6096087045107246, 'strategy': 'breakout', 'time_stop': 152, 'use_sma': False, 'use_atr': True, 'use_adx': False, 'use_ema': False, 'use_spike': True, 'rsi_required': False, 'edge_k': 1.5405330563372872, 'edge_cap': 0.9448114510699029, 'bull_strategy': 'mean_reversion', 'bull_bb_std_mult': 0.86338187468432, 'bull_rsi_os': 21, 'bull_rsi_ob': 73, 'bull_adx_thresh': 23.07539483537267, 'bull_atr_min_pct': 0.002625846428965719, 'bull_atr_max_pct': 0.127625683367259, 'bull_tp_mult': 2.3675208222033004, 'bull_tsl_mult': 0.883431823071863, 'bull_time_stop': 146, 'bull_use_sma': False, 'bull_use_ema': False, 'bull_use_atr': True, 'bull_use_adx': True, 'bull_use_spike': False, 'bull_rsi_required': False, 'bear_strategy': 'mean_reversion', 'bear_bb_std_mult': 1.071014361538976, 'bear_rsi_os': 24, 'bear_rsi_ob': 55, 'bear_adx_thresh': 24.216059087006688, 'bear_atr_min_pct': 0.009022757485466344, 'bear_atr_max_pct': 0.14180384117770922, 'bear_tp_mult': 2.4622898247301173, 'bear_tsl_mult': 0.28884000408415417, 'bear_time_stop': 193, 'bear_use_sma': True, 'bear_use_ema': True, 'bear_use_atr': True, 'bear_use_adx': False, 'bear_use_spike': True, 'bear_rsi_required': True, 'sideways_strategy': 'mean_reversion', 'sideways_bb_std_mult': 2.517497348247826, 'sideways_rsi_os': 25, 'sideways_rsi_ob': 62, 'sideways_adx_thresh': 9.543714514797285, 'sideways_atr_min_pct': 0.016940554398240288, 'sideways_atr_max_pct': 0.13633118900352256, 'sideways_tp_mult': 2.586557514857696, 'sideways_tsl_mult': 0.10105757840380779, 'sideways_time_stop': 254, 'sideways_use_sma': False, 'sideways_use_ema': False, 'sideways_use_atr': False, 'sideways_use_adx': True, 'sideways_use_spike': True, 'sideways_rsi_required': True}.
[I 2025-08-31 03:54:04,508] Trial 172 finished with values: [-1000000000.0, 1000000000.0] and parameters: {'p_sma': 58, 'p_std': 42, 'p_atr': 27, 'p_adx': 12, 'rsi_period': 45, 'ema1': 9, 'ema2': 15, 'slip_atr_k': 0.17653856543388854, 'slip_spread_k': 0.2919774610133197, 'spread_hl_frac': 0.011869847374513895, 'bb_std_mult': 1.4277461503358917, 'rsi_os': 18, 'rsi_ob': 66, 'vol_spike': 0.009579726531776956, 'adx_thresh': 14.592500804018712, 'atr_min_pct': 0.019665251008643258, 'atr_max_pct': 0.1285461915386102, 'tp_mult': 2.460679937971662, 'tsl_mult': 0.7169961429079327, 'strategy': 'breakout', 'time_stop': 151, 'use_sma': False, 'use_atr': True, 'use_adx': False, 'use_ema': False, 'use_spike': True, 'rsi_required': False, 'edge_k': 1.8730538292813834, 'edge_cap': 0.9683173505749585, 'bull_strategy': 'breakout', 'bull_bb_std_mult': 1.2275744017687207, 'bull_rsi_os': 18, 'bull_rsi_ob': 75, 'bull_adx_thresh': 25.982903528698596, 'bull_atr_min_pct': 0.002555697353052602, 'bull_atr_max_pct': 0.041038851100368506, 'bull_tp_mult': 2.394980486421059, 'bull_tsl_mult': 0.9279521549324989, 'bull_time_stop': 158, 'bull_use_sma': False, 'bull_use_ema': False, 'bull_use_atr': True, 'bull_use_adx': True, 'bull_use_spike': False, 'bull_rsi_required': True, 'bear_strategy': 'mean_reversion', 'bear_bb_std_mult': 1.0755872735334862, 'bear_rsi_os': 12, 'bear_rsi_ob': 76, 'bear_adx_thresh': 34.99963878084379, 'bear_atr_min_pct': 0.010126333580693463, 'bear_atr_max_pct': 0.13472046053657905, 'bear_tp_mult': 2.5227943761452094, 'bear_tsl_mult': 0.4287402400768099, 'bear_time_stop': 173, 'bear_use_sma': True, 'bear_use_ema': True, 'bear_use_atr': False, 'bear_use_adx': True, 'bear_use_spike': True, 'bear_rsi_required': True, 'sideways_strategy': 'mean_reversion', 'sideways_bb_std_mult': 2.2682251592336025, 'sideways_rsi_os': 23, 'sideways_rsi_ob': 52, 'sideways_adx_thresh': 13.065037155441608, 'sideways_atr_min_pct': 0.01720388651560738, 'sideways_atr_max_pct': 0.01813611023128196, 'sideways_tp_mult': 1.4964139711111193, 'sideways_tsl_mult': 0.168368104074219, 'sideways_time_stop': 253, 'sideways_use_sma': False, 'sideways_use_ema': False, 'sideways_use_atr': False, 'sideways_use_adx': True, 'sideways_use_spike': True, 'sideways_rsi_required': True}.
[I 2025-08-31 03:54:33,333] Trial 174 finished with values: [-1000000000.0, 1000000000.0] and parameters: {'p_sma': 15, 'p_std': 29, 'p_atr': 27, 'p_adx': 10, 'rsi_period': 45, 'ema1': 17, 'ema2': 25, 'slip_atr_k': 0.16982052271965242, 'slip_spread_k': 0.3755911631705992, 'spread_hl_frac': 0.03804901055571428, 'bb_std_mult': 1.9344127868359893, 'rsi_os': 26, 'rsi_ob': 66, 'vol_spike': 0.008572150766066995, 'adx_thresh': 14.433192428912598, 'atr_min_pct': 0.022456991051944552, 'atr_max_pct': 0.14576932776909599, 'tp_mult': 2.5510645630886963, 'tsl_mult': 0.8571361235654197, 'strategy': 'breakout', 'time_stop': 143, 'use_sma': True, 'use_atr': False, 'use_adx': False, 'use_ema': True, 'use_spike': False, 'rsi_required': False, 'edge_k': 1.372940270106752, 'edge_cap': 0.9822443863549478, 'bull_strategy': 'breakout', 'bull_bb_std_mult': 1.2705249246240653, 'bull_rsi_os': 5, 'bull_rsi_ob': 64, 'bull_adx_thresh': 21.216250361410207, 'bull_atr_min_pct': 0.02151994734430282, 'bull_atr_max_pct': 0.12992203164969243, 'bull_tp_mult': 1.656906033964799, 'bull_tsl_mult': 0.8762741848129104, 'bull_time_stop': 157, 'bull_use_sma': False, 'bull_use_ema': False, 'bull_use_atr': False, 'bull_use_adx': True, 'bull_use_spike': True, 'bull_rsi_required': False, 'bear_strategy': 'mean_reversion', 'bear_bb_std_mult': 0.5783837284355257, 'bear_rsi_os': 26, 'bear_rsi_ob': 89, 'bear_adx_thresh': 22.397302719038702, 'bear_atr_min_pct': 0.00923178589311183, 'bear_atr_max_pct': 0.13396050070881393, 'bear_tp_mult': 2.573559877778752, 'bear_tsl_mult': 0.21396989096611485, 'bear_time_stop': 172, 'bear_use_sma': True, 'bear_use_ema': True, 'bear_use_atr': False, 'bear_use_adx': False, 'bear_use_spike': True, 'bear_rsi_required': True, 'sideways_strategy': 'mean_reversion', 'sideways_bb_std_mult': 0.9421711419239647, 'sideways_rsi_os': 5, 'sideways_rsi_ob': 55, 'sideways_adx_thresh': 15.740617295283037, 'sideways_atr_min_pct': 0.01692466809539281, 'sideways_atr_max_pct': 0.01980112838755598, 'sideways_tp_mult': 1.4986175560543185, 'sideways_tsl_mult': 0.16852089011968577, 'sideways_time_stop': 121, 'sideways_use_sma': False, 'sideways_use_ema': False, 'sideways_use_atr': False, 'sideways_use_adx': True, 'sideways_use_spike': True, 'sideways_rsi_required': True}.
[I 2025-08-31 03:54:33,437] Trial 173 finished with values: [-1000000000.0, 1000000000.0] and parameters: {'p_sma': 33, 'p_std': 37, 'p_atr': 27, 'p_adx': 12, 'rsi_period': 45, 'ema1': 15, 'ema2': 26, 'slip_atr_k': 0.17726436199890386, 'slip_spread_k': 0.30095550363979495, 'spread_hl_frac': 0.025418734531754986, 'bb_std_mult': 1.7239810524035037, 'rsi_os': 26, 'rsi_ob': 68, 'vol_spike': 0.009945609555449606, 'adx_thresh': 10.382548967953277, 'atr_min_pct': 0.021016514121885266, 'atr_max_pct': 0.03722895737123387, 'tp_mult': 2.546925764393049, 'tsl_mult': 0.9121228490644504, 'strategy': 'breakout', 'time_stop': 152, 'use_sma': False, 'use_atr': True, 'use_adx': False, 'use_ema': True, 'use_spike': False, 'rsi_required': False, 'edge_k': 1.7140216609097907, 'edge_cap': 0.9626943047636053, 'bull_strategy': 'breakout', 'bull_bb_std_mult': 1.2599837544576027, 'bull_rsi_os': 19, 'bull_rsi_ob': 75, 'bull_adx_thresh': 7.070001597129549, 'bull_atr_min_pct': 0.02110664249248335, 'bull_atr_max_pct': 0.04084339747676942, 'bull_tp_mult': 1.0556178546665298, 'bull_tsl_mult': 0.9225456716546548, 'bull_time_stop': 153, 'bull_use_sma': False, 'bull_use_ema': False, 'bull_use_atr': True, 'bull_use_adx': True, 'bull_use_spike': True, 'bull_rsi_required': True, 'bear_strategy': 'mean_reversion', 'bear_bb_std_mult': 1.2438631362660693, 'bear_rsi_os': 25, 'bear_rsi_ob': 76, 'bear_adx_thresh': 26.68267129000777, 'bear_atr_min_pct': 0.009881798435089623, 'bear_atr_max_pct': 0.13307657521268446, 'bear_tp_mult': 2.513644074028035, 'bear_tsl_mult': 0.21598377242066047, 'bear_time_stop': 173, 'bear_use_sma': True, 'bear_use_ema': True, 'bear_use_atr': False, 'bear_use_adx': True, 'bear_use_spike': True, 'bear_rsi_required': True, 'sideways_strategy': 'mean_reversion', 'sideways_bb_std_mult': 2.5337131308660843, 'sideways_rsi_os': 10, 'sideways_rsi_ob': 53, 'sideways_adx_thresh': 16.617876571668972, 'sideways_atr_min_pct': 0.016738662104117508, 'sideways_atr_max_pct': 0.01883978148717883, 'sideways_tp_mult': 1.8709259475094517, 'sideways_tsl_mult': 0.16308561348379194, 'sideways_time_stop': 259, 'sideways_use_sma': False, 'sideways_use_ema': False, 'sideways_use_atr': False, 'sideways_use_adx': True, 'sideways_use_spike': True, 'sideways_rsi_required': True}.
[I 2025-08-31 03:54:33,489] Trial 175 finished with values: [-1000000000.0, 1000000000.0] and parameters: {'p_sma': 59, 'p_std': 17, 'p_atr': 27, 'p_adx': 10, 'rsi_period': 44, 'ema1': 5, 'ema2': 25, 'slip_atr_k': 0.16901290708886305, 'slip_spread_k': 0.37548444810063375, 'spread_hl_frac': 0.03731377663347869, 'bb_std_mult': 1.5141235225798635, 'rsi_os': 20, 'rsi_ob': 66, 'vol_spike': 0.013537384673485529, 'adx_thresh': 26.458134462144283, 'atr_min_pct': 0.022401955676113656, 'atr_max_pct': 0.14646513393345548, 'tp_mult': 2.5237143374640305, 'tsl_mult': 0.8434763459288958, 'strategy': 'breakout', 'time_stop': 139, 'use_sma': True, 'use_atr': False, 'use_adx': False, 'use_ema': True, 'use_spike': False, 'rsi_required': False, 'edge_k': 1.6953351446068115, 'edge_cap': 0.975382763496228, 'bull_strategy': 'breakout', 'bull_bb_std_mult': 1.8088059207707516, 'bull_rsi_os': 19, 'bull_rsi_ob': 77, 'bull_adx_thresh': 6.266555101115339, 'bull_atr_min_pct': 0.02122358084186647, 'bull_atr_max_pct': 0.035591633841593334, 'bull_tp_mult': 2.266809738061901, 'bull_tsl_mult': 0.9280879182191798, 'bull_time_stop': 163, 'bull_use_sma': False, 'bull_use_ema': False, 'bull_use_atr': False, 'bull_use_adx': True, 'bull_use_spike': True, 'bull_rsi_required': False, 'bear_strategy': 'mean_reversion', 'bear_bb_std_mult': 0.6040310725414091, 'bear_rsi_os': 25, 'bear_rsi_ob': 76, 'bear_adx_thresh': 22.343369195220884, 'bear_atr_min_pct': 0.010007558533037685, 'bear_atr_max_pct': 0.13296276334541055, 'bear_tp_mult': 2.5804050301512844, 'bear_tsl_mult': 0.20968113399789817, 'bear_time_stop': 176, 'bear_use_sma': True, 'bear_use_ema': True, 'bear_use_atr': False, 'bear_use_adx': False, 'bear_use_spike': True, 'bear_rsi_required': True, 'sideways_strategy': 'mean_reversion', 'sideways_bb_std_mult': 0.9814306921416509, 'sideways_rsi_os': 9, 'sideways_rsi_ob': 49, 'sideways_adx_thresh': 12.97871438479417, 'sideways_atr_min_pct': 0.01811955350140846, 'sideways_atr_max_pct': 0.14396900291897965, 'sideways_tp_mult': 1.2629266394697596, 'sideways_tsl_mult': 0.16416949049102936, 'sideways_time_stop': 279, 'sideways_use_sma': False, 'sideways_use_ema': False, 'sideways_use_atr': False, 'sideways_use_adx': True, 'sideways_use_spike': True, 'sideways_rsi_required': True}.
[I 2025-08-31 03:54:33,713] Trial 176 finished with values: [-1000000000.0, 1000000000.0] and parameters: {'p_sma': 59, 'p_std': 17, 'p_atr': 25, 'p_adx': 10, 'rsi_period': 45, 'ema1': 17, 'ema2': 29, 'slip_atr_k': 0.09377513244053173, 'slip_spread_k': 0.318826487823195, 'spread_hl_frac': 0.005643129869751608, 'bb_std_mult': 1.985342998056806, 'rsi_os': 27, 'rsi_ob': 58, 'vol_spike': 0.0001671079340123281, 'adx_thresh': 8.646750298821457, 'atr_min_pct': 0.02225860951232813, 'atr_max_pct': 0.03733691970398422, 'tp_mult': 2.305784550314853, 'tsl_mult': 0.8114841752158742, 'strategy': 'breakout', 'time_stop': 32, 'use_sma': True, 'use_atr': False, 'use_adx': False, 'use_ema': True, 'use_spike': False, 'rsi_required': False, 'edge_k': 1.7077106947690792, 'edge_cap': 0.985396518209943, 'bull_strategy': 'breakout', 'bull_bb_std_mult': 1.1344562223688015, 'bull_rsi_os': 17, 'bull_rsi_ob': 68, 'bull_adx_thresh': 6.960172323583494, 'bull_atr_min_pct': 0.020975898654682558, 'bull_atr_max_pct': 0.12937909816199225, 'bull_tp_mult': 1.3215684123096723, 'bull_tsl_mult': 0.9981154013247395, 'bull_time_stop': 174, 'bull_use_sma': False, 'bull_use_ema': False, 'bull_use_atr': False, 'bull_use_adx': True, 'bull_use_spike': True, 'bull_rsi_required': False, 'bear_strategy': 'mean_reversion', 'bear_bb_std_mult': 0.6005818233597086, 'bear_rsi_os': 26, 'bear_rsi_ob': 58, 'bear_adx_thresh': 22.1112763481846, 'bear_atr_min_pct': 0.007797358160055624, 'bear_atr_max_pct': 0.13285811523127772, 'bear_tp_mult': 2.571686938108299, 'bear_tsl_mult': 0.15832978010861443, 'bear_time_stop': 203, 'bear_use_sma': True, 'bear_use_ema': True, 'bear_use_atr': True, 'bear_use_adx': False, 'bear_use_spike': True, 'bear_rsi_required': True, 'sideways_strategy': 'mean_reversion', 'sideways_bb_std_mult': 2.284382418668442, 'sideways_rsi_os': 9, 'sideways_rsi_ob': 49, 'sideways_adx_thresh': 15.234005382870208, 'sideways_atr_min_pct': 0.016167042503421342, 'sideways_atr_max_pct': 0.013695856002606619, 'sideways_tp_mult': 1.3111822554102428, 'sideways_tsl_mult': 0.1690548008502687, 'sideways_time_stop': 94, 'sideways_use_sma': False, 'sideways_use_ema': False, 'sideways_use_atr': False, 'sideways_use_adx': True, 'sideways_use_spike': True, 'sideways_rsi_required': True}.
[I 2025-08-31 03:55:03,390] Trial 178 finished with values: [-1000000000.0, 1000000000.0] and parameters: {'p_sma': 60, 'p_std': 59, 'p_atr': 25, 'p_adx': 10, 'rsi_period': 29, 'ema1': 15, 'ema2': 10, 'slip_atr_k': 0.09339075304217218, 'slip_spread_k': 0.4075908232635169, 'spread_hl_frac': 0.02636776182963884, 'bb_std_mult': 2.4264282290168726, 'rsi_os': 21, 'rsi_ob': 58, 'vol_spike': 0.00016016378861894083, 'adx_thresh': 8.845055007360349, 'atr_min_pct': 0.021415017058993704, 'atr_max_pct': 0.14921291595029, 'tp_mult': 2.305208799968512, 'tsl_mult': 0.8164459080569051, 'strategy': 'breakout', 'time_stop': 22, 'use_sma': False, 'use_atr': False, 'use_adx': False, 'use_ema': True, 'use_spike': False, 'rsi_required': False, 'edge_k': 1.4230698411769098, 'edge_cap': 0.9095510069072305, 'bull_strategy': 'breakout', 'bull_bb_std_mult': 1.0479007510173253, 'bull_rsi_os': 22, 'bull_rsi_ob': 68, 'bull_adx_thresh': 22.187761029358366, 'bull_atr_min_pct': 0.005312286388248317, 'bull_atr_max_pct': 0.026293501031347255, 'bull_tp_mult': 1.318969972050119, 'bull_tsl_mult': 0.9903316747505084, 'bull_time_stop': 176, 'bull_use_sma': False, 'bull_use_ema': False, 'bull_use_atr': True, 'bull_use_adx': True, 'bull_use_spike': True, 'bull_rsi_required': False, 'bear_strategy': 'mean_reversion', 'bear_bb_std_mult': 0.5034609451370015, 'bear_rsi_os': 19, 'bear_rsi_ob': 58, 'bear_adx_thresh': 23.605841420711243, 'bear_atr_min_pct': 0.007968158882712975, 'bear_atr_max_pct': 0.13753293472033923, 'bear_tp_mult': 1.9503862442939688, 'bear_tsl_mult': 0.36646717147016655, 'bear_time_stop': 164, 'bear_use_sma': True, 'bear_use_ema': True, 'bear_use_atr': True, 'bear_use_adx': False, 'bear_use_spike': True, 'bear_rsi_required': True, 'sideways_strategy': 'mean_reversion', 'sideways_bb_std_mult': 2.310314773833887, 'sideways_rsi_os': 7, 'sideways_rsi_ob': 45, 'sideways_adx_thresh': 14.591455496196108, 'sideways_atr_min_pct': 0.01619515709934196, 'sideways_atr_max_pct': 0.010011791484622685, 'sideways_tp_mult': 2.5417169890009497, 'sideways_tsl_mult': 0.1318550401545239, 'sideways_time_stop': 241, 'sideways_use_sma': False, 'sideways_use_ema': False, 'sideways_use_atr': False, 'sideways_use_adx': True, 'sideways_use_spike': True, 'sideways_rsi_required': True}.
[I 2025-08-31 03:55:03,552] Trial 179 finished with values: [-1000000000.0, 1000000000.0] and parameters: {'p_sma': 60, 'p_std': 59, 'p_atr': 25, 'p_adx': 10, 'rsi_period': 29, 'ema1': 29, 'ema2': 10, 'slip_atr_k': 0.09516279759897675, 'slip_spread_k': 0.2570133388389774, 'spread_hl_frac': 0.026542631592267208, 'bb_std_mult': 2.6691424224432523, 'rsi_os': 21, 'rsi_ob': 58, 'vol_spike': 0.25246622086799136, 'adx_thresh': 27.702683223835653, 'atr_min_pct': 0.021498664312117985, 'atr_max_pct': 0.14934112956280038, 'tp_mult': 2.2910990441483747, 'tsl_mult': 0.8120287734050591, 'strategy': 'breakout', 'time_stop': 27, 'use_sma': False, 'use_atr': False, 'use_adx': False, 'use_ema': True, 'use_spike': False, 'rsi_required': False, 'edge_k': 1.7216276067941683, 'edge_cap': 0.9094847010519133, 'bull_strategy': 'breakout', 'bull_bb_std_mult': 1.1094192313411022, 'bull_rsi_os': 22, 'bull_rsi_ob': 69, 'bull_adx_thresh': 22.22754389126993, 'bull_atr_min_pct': 0.0014281508457910023, 'bull_atr_max_pct': 0.06219727539733837, 'bull_tp_mult': 1.5236826093167928, 'bull_tsl_mult': 0.9956648995045854, 'bull_time_stop': 176, 'bull_use_sma': False, 'bull_use_ema': False, 'bull_use_atr': True, 'bull_use_adx': True, 'bull_use_spike': True, 'bull_rsi_required': False, 'bear_strategy': 'mean_reversion', 'bear_bb_std_mult': 0.5083202637527973, 'bear_rsi_os': 7, 'bear_rsi_ob': 94, 'bear_adx_thresh': 23.577689382142125, 'bear_atr_min_pct': 0.008187539123500277, 'bear_atr_max_pct': 0.1362065546905019, 'bear_tp_mult': 2.4332102680099816, 'bear_tsl_mult': 0.13095387306789424, 'bear_time_stop': 203, 'bear_use_sma': True, 'bear_use_ema': True, 'bear_use_atr': True, 'bear_use_adx': False, 'bear_use_spike': True, 'bear_rsi_required': True, 'sideways_strategy': 'mean_reversion', 'sideways_bb_std_mult': 2.318044015499455, 'sideways_rsi_os': 7, 'sideways_rsi_ob': 66, 'sideways_adx_thresh': 14.904737994588833, 'sideways_atr_min_pct': 0.01595807223373436, 'sideways_atr_max_pct': 0.013244238214983406, 'sideways_tp_mult': 1.3924194337081517, 'sideways_tsl_mult': 0.12270426105999432, 'sideways_time_stop': 31, 'sideways_use_sma': False, 'sideways_use_ema': False, 'sideways_use_atr': False, 'sideways_use_adx': True, 'sideways_use_spike': True, 'sideways_rsi_required': True}.
[I 2025-08-31 03:55:03,641] Trial 180 finished with values: [-1000000000.0, 1000000000.0] and parameters: {'p_sma': 60, 'p_std': 13, 'p_atr': 26, 'p_adx': 21, 'rsi_period': 29, 'ema1': 29, 'ema2': 17, 'slip_atr_k': 0.18525258840102102, 'slip_spread_k': 0.4095960772611905, 'spread_hl_frac': 0.029025556720674375, 'bb_std_mult': 3.1193266519379774, 'rsi_os': 21, 'rsi_ob': 56, 'vol_spike': 0.25065453998669296, 'adx_thresh': 28.0060931564069, 'atr_min_pct': 0.0213792326667999, 'atr_max_pct': 0.14950561812199253, 'tp_mult': 2.372986946845899, 'tsl_mult': 0.4327109453135058, 'strategy': 'breakout', 'time_stop': 131, 'use_sma': False, 'use_atr': False, 'use_adx': False, 'use_ema': True, 'use_spike': False, 'rsi_required': False, 'edge_k': 0.9901773961158891, 'edge_cap': 0.8936744975816495, 'bull_strategy': 'breakout', 'bull_bb_std_mult': 2.0913513013605813, 'bull_rsi_os': 38, 'bull_rsi_ob': 80, 'bull_adx_thresh': 21.95921331489012, 'bull_atr_min_pct': 0.0012598096330851878, 'bull_atr_max_pct': 0.02693360041962218, 'bull_tp_mult': 2.447857152877485, 'bull_tsl_mult': 0.8530325631587601, 'bull_time_stop': 164, 'bull_use_sma': False, 'bull_use_ema': False, 'bull_use_atr': True, 'bull_use_adx': True, 'bull_use_spike': True, 'bull_rsi_required': False, 'bear_strategy': 'mean_reversion', 'bear_bb_std_mult': 0.507704503199908, 'bear_rsi_os': 17, 'bear_rsi_ob': 50, 'bear_adx_thresh': 25.463322404044682, 'bear_atr_min_pct': 0.010936012935855666, 'bear_atr_max_pct': 0.13742305506015348, 'bear_tp_mult': 1.962655801109279, 'bear_tsl_mult': 0.37044350510435153, 'bear_time_stop': 118, 'bear_use_sma': True, 'bear_use_ema': True, 'bear_use_atr': True, 'bear_use_adx': False, 'bear_use_spike': True, 'bear_rsi_required': True, 'sideways_strategy': 'mean_reversion', 'sideways_bb_std_mult': 2.305571017364214, 'sideways_rsi_os': 18, 'sideways_rsi_ob': 45, 'sideways_adx_thresh': 7.1536633586844065, 'sideways_atr_min_pct': 0.015351074158549482, 'sideways_atr_max_pct': 0.10650874929966482, 'sideways_tp_mult': 2.619849083901545, 'sideways_tsl_mult': 0.11346031390606784, 'sideways_time_stop': 243, 'sideways_use_sma': False, 'sideways_use_ema': False, 'sideways_use_atr': False, 'sideways_use_adx': True, 'sideways_use_spike': True, 'sideways_rsi_required': True}.
