[I 2025-08-31 05:50:42,535] Trial 808 finished with values: [-0.04790660044112627, 0.04786497442087004] and parameters: {'p_sma': 34, 'p_std': 43, 'p_atr': 12, 'p_adx': 26, 'rsi_period': 13, 'ema1': 17, 'ema2': 18, 'slip_atr_k': 0.0006274033769654535, 'slip_spread_k': 0.7866268787498845, 'spread_hl_frac': 0.003865968779799835, 'bb_std_mult': 3.341537169301028, 'rsi_os': 46, 'rsi_ob': 68, 'vol_spike': 0.0835269441951574, 'adx_thresh': 6.878575886344884, 'atr_min_pct': 0.011678273609223614, 'atr_max_pct': 0.11223855005309426, 'tp_mult': 2.0395578734345046, 'tsl_mult': 0.4673273610531775, 'strategy': 'mean_reversion', 'time_stop': 7, 'use_sma': False, 'use_atr': True, 'use_adx': False, 'use_ema': False, 'use_spike': True, 'rsi_required': True, 'edge_k': 0.933710982208623, 'edge_cap': 0.3498049019405473, 'bull_strategy': 'breakout', 'bull_bb_std_mult': 1.5067197699998205, 'bull_rsi_os': 31, 'bull_rsi_ob': 68, 'bull_adx_thresh': 32.970777054552705, 'bull_atr_min_pct': 0.017581314783237184, 'bull_atr_max_pct': 0.08948704579375702, 'bull_tp_mult': 1.5035030411493682, 'bull_tsl_mult': 0.7525606562414104, 'bull_time_stop': 178, 'bull_use_sma': False, 'bull_use_ema': True, 'bull_use_atr': False, 'bull_use_adx': True, 'bull_use_spike': False, 'bull_rsi_required': False, 'bear_strategy': 'breakout', 'bear_bb_std_mult': 2.197706615897772, 'bear_rsi_os': 8, 'bear_rsi_ob': 61, 'bear_adx_thresh': 15.139774798298468, 'bear_atr_min_pct': 0.0019764599806852113, 'bear_atr_max_pct': 0.11175975016298158, 'bear_tp_mult': 1.09050926868987, 'bear_tsl_mult': 0.12854610616918993, 'bear_time_stop': 235, 'bear_use_sma': True, 'bear_use_ema': False, 'bear_use_atr': False, 'bear_use_adx': False, 'bear_use_spike': False, 'bear_rsi_required': False, 'sideways_strategy': 'breakout', 'sideways_bb_std_mult': 1.4397489074347392, 'sideways_rsi_os': 40, 'sideways_rsi_ob': 49, 'sideways_adx_thresh': 23.88045129821875, 'sideways_atr_min_pct': 2.4932044751664693e-05, 'sideways_atr_max_pct': 0.05757052033923889, 'sideways_tp_mult': 2.4936780852668297, 'sideways_tsl_mult': 0.33354677520337983, 'sideways_time_stop': 154, 'sideways_use_sma': True, 'sideways_use_ema': True, 'sideways_use_atr': False, 'sideways_use_adx': False, 'sideways_use_spike': True, 'sideways_rsi_required': True}.
[I 2025-08-31 05:50:42,539] Trial 810 finished with values: [-1000000000.0, 1000000000.0] and parameters: {'p_sma': 35, 'p_std': 43, 'p_atr': 11, 'p_adx': 24, 'rsi_period': 13, 'ema1': 18, 'ema2': 19, 'slip_atr_k': 0.0017550285849976567, 'slip_spread_k': 0.7806942577642859, 'spread_hl_frac': 0.0044780927512622975, 'bb_std_mult': 3.415270977144479, 'rsi_os': 46, 'rsi_ob': 68, 'vol_spike': 0.08299473148469273, 'adx_thresh': 7.73774930903366, 'atr_min_pct': 0.011922312646392312, 'atr_max_pct': 0.11026794087744395, 'tp_mult': 2.0890749488845284, 'tsl_mult': 0.46361647508684134, 'strategy': 'mean_reversion', 'time_stop': 11, 'use_sma': False, 'use_atr': True, 'use_adx': False, 'use_ema': False, 'use_spike': True, 'rsi_required': True, 'edge_k': 0.9367919595928598, 'edge_cap': 0.3479222448475217, 'bull_strategy': 'breakout', 'bull_bb_std_mult': 1.4456318979914895, 'bull_rsi_os': 31, 'bull_rsi_ob': 69, 'bull_adx_thresh': 32.90020891559659, 'bull_atr_min_pct': 0.017479924848760157, 'bull_atr_max_pct': 0.09293859905476103, 'bull_tp_mult': 1.5121790603445864, 'bull_tsl_mult': 0.7582738178422537, 'bull_time_stop': 174, 'bull_use_sma': False, 'bull_use_ema': True, 'bull_use_atr': False, 'bull_use_adx': True, 'bull_use_spike': False, 'bull_rsi_required': False, 'bear_strategy': 'breakout', 'bear_bb_std_mult': 2.194675113928838, 'bear_rsi_os': 26, 'bear_rsi_ob': 60, 'bear_adx_thresh': 15.896200022618267, 'bear_atr_min_pct': 0.0007296274866377787, 'bear_atr_max_pct': 0.11022150899189881, 'bear_tp_mult': 1.1103942847974637, 'bear_tsl_mult': 0.15619743759567245, 'bear_time_stop': 235, 'bear_use_sma': True, 'bear_use_ema': False, 'bear_use_atr': True, 'bear_use_adx': False, 'bear_use_spike': False, 'bear_rsi_required': False, 'sideways_strategy': 'breakout', 'sideways_bb_std_mult': 1.4522066122326, 'sideways_rsi_os': 41, 'sideways_rsi_ob': 49, 'sideways_adx_thresh': 23.954317942673303, 'sideways_atr_min_pct': 0.007999210538005497, 'sideways_atr_max_pct': 0.05811204299032276, 'sideways_tp_mult': 2.5403564727428374, 'sideways_tsl_mult': 0.2725108724628727, 'sideways_time_stop': 154, 'sideways_use_sma': True, 'sideways_use_ema': True, 'sideways_use_atr': False, 'sideways_use_adx': False, 'sideways_use_spike': True, 'sideways_rsi_required': True}.
[I 2025-08-31 05:51:32,902] Trial 814 finished with values: [-1000000000.0, 1000000000.0] and parameters: {'p_sma': 36, 'p_std': 42, 'p_atr': 12, 'p_adx': 24, 'rsi_period': 15, 'ema1': 17, 'ema2': 17, 'slip_atr_k': 0.0041354754315498015, 'slip_spread_k': 0.7721438200320743, 'spread_hl_frac': 0.004508834924153321, 'bb_std_mult': 3.3097793350728395, 'rsi_os': 45, 'rsi_ob': 70, 'vol_spike': 0.07345153479105376, 'adx_thresh': 8.432068922730414, 'atr_min_pct': 0.010900939656706021, 'atr_max_pct': 0.1141523440623652, 'tp_mult': 1.9636559093539265, 'tsl_mult': 0.2460105344800731, 'strategy': 'mean_reversion', 'time_stop': 5, 'use_sma': False, 'use_atr': True, 'use_adx': True, 'use_ema': True, 'use_spike': False, 'rsi_required': True, 'edge_k': 0.8796489108949423, 'edge_cap': 0.304982537286071, 'bull_strategy': 'breakout', 'bull_bb_std_mult': 1.5925429352902216, 'bull_rsi_os': 37, 'bull_rsi_ob': 65, 'bull_adx_thresh': 30.03548272601852, 'bull_atr_min_pct': 0.016838561494790287, 'bull_atr_max_pct': 0.08666196062829815, 'bull_tp_mult': 1.5147874342883232, 'bull_tsl_mult': 0.7752046278578099, 'bull_time_stop': 191, 'bull_use_sma': True, 'bull_use_ema': True, 'bull_use_atr': False, 'bull_use_adx': True, 'bull_use_spike': True, 'bull_rsi_required': False, 'bear_strategy': 'breakout', 'bear_bb_std_mult': 2.352275791372728, 'bear_rsi_os': 5, 'bear_rsi_ob': 56, 'bear_adx_thresh': 16.11804854008299, 'bear_atr_min_pct': 6.600730668739323e-05, 'bear_atr_max_pct': 0.13146174343207748, 'bear_tp_mult': 1.080248179131315, 'bear_tsl_mult': 0.16723166992107663, 'bear_time_stop': 227, 'bear_use_sma': False, 'bear_use_ema': False, 'bear_use_atr': True, 'bear_use_adx': False, 'bear_use_spike': False, 'bear_rsi_required': False, 'sideways_strategy': 'breakout', 'sideways_bb_std_mult': 1.3928831420464767, 'sideways_rsi_os': 39, 'sideways_rsi_ob': 48, 'sideways_adx_thresh': 23.373047750595134, 'sideways_atr_min_pct': 0.003657353621137758, 'sideways_atr_max_pct': 0.06382749567299766, 'sideways_tp_mult': 2.5720215292570003, 'sideways_tsl_mult': 0.31203324670701865, 'sideways_time_stop': 162, 'sideways_use_sma': True, 'sideways_use_ema': True, 'sideways_use_atr': True, 'sideways_use_adx': False, 'sideways_use_spike': False, 'sideways_rsi_required': True}.
[I 2025-08-31 05:51:33,600] Trial 813 finished with values: [-0.024625129188126316, 0.024642931525279802] and parameters: {'p_sma': 36, 'p_std': 42, 'p_atr': 11, 'p_adx': 24, 'rsi_period': 12, 'ema1': 17, 'ema2': 19, 'slip_atr_k': 0.0034129170494459275, 'slip_spread_k': 0.7807045693254835, 'spread_hl_frac': 0.004614792225040089, 'bb_std_mult': 3.281856221171284, 'rsi_os': 47, 'rsi_ob': 70, 'vol_spike': 0.08486802788390319, 'adx_thresh': 5.69305841087688, 'atr_min_pct': 0.011069497195916522, 'atr_max_pct': 0.11459417969259479, 'tp_mult': 2.107600374012396, 'tsl_mult': 0.48082215466601247, 'strategy': 'mean_reversion', 'time_stop': 5, 'use_sma': False, 'use_atr': True, 'use_adx': True, 'use_ema': True, 'use_spike': True, 'rsi_required': True, 'edge_k': 0.8814450745500707, 'edge_cap': 0.3621806932399819, 'bull_strategy': 'breakout', 'bull_bb_std_mult': 1.6128488952500797, 'bull_rsi_os': 33, 'bull_rsi_ob': 67, 'bull_adx_thresh': 29.93277488768225, 'bull_atr_min_pct': 0.017237379603972057, 'bull_atr_max_pct': 0.09321528907554555, 'bull_tp_mult': 1.4763949064068764, 'bull_tsl_mult': 0.7760198334855258, 'bull_time_stop': 187, 'bull_use_sma': True, 'bull_use_ema': True, 'bull_use_atr': False, 'bull_use_adx': True, 'bull_use_spike': True, 'bull_rsi_required': False, 'bear_strategy': 'breakout', 'bear_bb_std_mult': 2.1595881572804823, 'bear_rsi_os': 37, 'bear_rsi_ob': 60, 'bear_adx_thresh': 14.756953861708105, 'bear_atr_min_pct': 0.0003437997304692403, 'bear_atr_max_pct': 0.1253674116422651, 'bear_tp_mult': 1.082576340775915, 'bear_tsl_mult': 0.12895833824836134, 'bear_time_stop': 232, 'bear_use_sma': False, 'bear_use_ema': False, 'bear_use_atr': True, 'bear_use_adx': False, 'bear_use_spike': False, 'bear_rsi_required': False, 'sideways_strategy': 'breakout', 'sideways_bb_std_mult': 1.4274473600661874, 'sideways_rsi_os': 40, 'sideways_rsi_ob': 48, 'sideways_adx_thresh': 24.183292683512313, 'sideways_atr_min_pct': 0.002840106492578336, 'sideways_atr_max_pct': 0.054625203042696004, 'sideways_tp_mult': 2.5660947721416107, 'sideways_tsl_mult': 0.2866776388295787, 'sideways_time_stop': 161, 'sideways_use_sma': True, 'sideways_use_ema': True, 'sideways_use_atr': True, 'sideways_use_adx': False, 'sideways_use_spike': False, 'sideways_rsi_required': True}.
[I 2025-08-31 05:51:34,498] Trial 815 finished with values: [-0.02364467234109091, 0.02361434621472191] and parameters: {'p_sma': 36, 'p_std': 45, 'p_atr': 12, 'p_adx': 24, 'rsi_period': 16, 'ema1': 17, 'ema2': 17, 'slip_atr_k': 0.00021470546198063835, 'slip_spread_k': 0.7750577824580771, 'spread_hl_frac': 0.0023530585012371337, 'bb_std_mult': 3.266790382534127, 'rsi_os': 45, 'rsi_ob': 70, 'vol_spike': 0.07290308356525464, 'adx_thresh': 7.332493892129813, 'atr_min_pct': 0.010484522589622994, 'atr_max_pct': 0.11512461844390448, 'tp_mult': 1.9433381122476137, 'tsl_mult': 0.24242770926025775, 'strategy': 'mean_reversion', 'time_stop': 5, 'use_sma': False, 'use_atr': True, 'use_adx': True, 'use_ema': True, 'use_spike': False, 'rsi_required': True, 'edge_k': 0.8683688018701121, 'edge_cap': 0.36087894098275475, 'bull_strategy': 'breakout', 'bull_bb_std_mult': 1.6059862370829363, 'bull_rsi_os': 30, 'bull_rsi_ob': 71, 'bull_adx_thresh': 34.54540906487708, 'bull_atr_min_pct': 0.01685793574805285, 'bull_atr_max_pct': 0.08608312052320725, 'bull_tp_mult': 1.5157131528816494, 'bull_tsl_mult': 0.7810139353487086, 'bull_time_stop': 190, 'bull_use_sma': True, 'bull_use_ema': True, 'bull_use_atr': False, 'bull_use_adx': True, 'bull_use_spike': True, 'bull_rsi_required': False, 'bear_strategy': 'breakout', 'bear_bb_std_mult': 2.340796602515773, 'bear_rsi_os': 36, 'bear_rsi_ob': 57, 'bear_adx_thresh': 16.17102581175876, 'bear_atr_min_pct': 0.0005453297860072695, 'bear_atr_max_pct': 0.12852298971907247, 'bear_tp_mult': 1.085140311212515, 'bear_tsl_mult': 0.16513103501934007, 'bear_time_stop': 247, 'bear_use_sma': False, 'bear_use_ema': False, 'bear_use_atr': True, 'bear_use_adx': False, 'bear_use_spike': False, 'bear_rsi_required': False, 'sideways_strategy': 'breakout', 'sideways_bb_std_mult': 1.3872230798400635, 'sideways_rsi_os': 39, 'sideways_rsi_ob': 48, 'sideways_adx_thresh': 24.328741456388048, 'sideways_atr_min_pct': 0.0023471670301877788, 'sideways_atr_max_pct': 0.0658155138762525, 'sideways_tp_mult': 2.585460041937174, 'sideways_tsl_mult': 0.2947866953028757, 'sideways_time_stop': 140, 'sideways_use_sma': True, 'sideways_use_ema': True, 'sideways_use_atr': True, 'sideways_use_adx': False, 'sideways_use_spike': False, 'sideways_rsi_required': True}.
[I 2025-08-31 05:51:34,987] Trial 812 finished with values: [-1000000000.0, 1000000000.0] and parameters: {'p_sma': 36, 'p_std': 43, 'p_atr': 12, 'p_adx': 24, 'rsi_period': 14, 'ema1': 17, 'ema2': 17, 'slip_atr_k': 0.003795199999815757, 'slip_spread_k': 0.7788176685509527, 'spread_hl_frac': 0.004252724310122157, 'bb_std_mult': 3.2967064165742106, 'rsi_os': 46, 'rsi_ob': 68, 'vol_spike': 0.08412453369540455, 'adx_thresh': 7.565049145785918, 'atr_min_pct': 0.012065453882911293, 'atr_max_pct': 0.11007928233317515, 'tp_mult': 2.0901749530068297, 'tsl_mult': 0.4688320886773363, 'strategy': 'mean_reversion', 'time_stop': 10, 'use_sma': False, 'use_atr': True, 'use_adx': False, 'use_ema': False, 'use_spike': True, 'rsi_required': True, 'edge_k': 0.9507943608399173, 'edge_cap': 0.3509718285873954, 'bull_strategy': 'breakout', 'bull_bb_std_mult': 1.5990322537160173, 'bull_rsi_os': 34, 'bull_rsi_ob': 67, 'bull_adx_thresh': 32.9293292541485, 'bull_atr_min_pct': 0.01573539206407294, 'bull_atr_max_pct': 0.09300475686689755, 'bull_tp_mult': 1.5103660798987648, 'bull_tsl_mult': 0.7701833081761633, 'bull_time_stop': 189, 'bull_use_sma': False, 'bull_use_ema': True, 'bull_use_atr': False, 'bull_use_adx': True, 'bull_use_spike': False, 'bull_rsi_required': False, 'bear_strategy': 'breakout', 'bear_bb_std_mult': 2.1639625336541974, 'bear_rsi_os': 5, 'bear_rsi_ob': 58, 'bear_adx_thresh': 15.816077069969426, 'bear_atr_min_pct': 0.0005466175331113026, 'bear_atr_max_pct': 0.12301733007232574, 'bear_tp_mult': 1.0822059102939947, 'bear_tsl_mult': 0.13645210180970369, 'bear_time_stop': 227, 'bear_use_sma': True, 'bear_use_ema': False, 'bear_use_atr': True, 'bear_use_adx': False, 'bear_use_spike': False, 'bear_rsi_required': False, 'sideways_strategy': 'breakout', 'sideways_bb_std_mult': 1.4176916286886785, 'sideways_rsi_os': 40, 'sideways_rsi_ob': 48, 'sideways_adx_thresh': 24.118677060050583, 'sideways_atr_min_pct': 0.002879194044498569, 'sideways_atr_max_pct': 0.055319955195623376, 'sideways_tp_mult': 2.5545058519237784, 'sideways_tsl_mult': 0.32932695100309606, 'sideways_time_stop': 170, 'sideways_use_sma': True, 'sideways_use_ema': True, 'sideways_use_atr': False, 'sideways_use_adx': False, 'sideways_use_spike': True, 'sideways_rsi_required': True}.
[I 2025-08-31 05:52:29,073] Trial 818 finished with values: [-1000000000.0, 1000000000.0] and parameters: {'p_sma': 32, 'p_std': 45, 'p_atr': 12, 'p_adx': 25, 'rsi_period': 13, 'ema1': 18, 'ema2': 19, 'slip_atr_k': 0.004700134013169087, 'slip_spread_k': 0.8174382956788921, 'spread_hl_frac': 0.00488102439006048, 'bb_std_mult': 3.267014198729689, 'rsi_os': 48, 'rsi_ob': 67, 'vol_spike': 0.08757574217124203, 'adx_thresh': 6.627469625989708, 'atr_min_pct': 0.012301394168022806, 'atr_max_pct': 0.10842067646402181, 'tp_mult': 2.1862411008501645, 'tsl_mult': 0.20882591494629604, 'strategy': 'mean_reversion', 'time_stop': 13, 'use_sma': True, 'use_atr': True, 'use_adx': False, 'use_ema': False, 'use_spike': True, 'rsi_required': True, 'edge_k': 0.8915015867261326, 'edge_cap': 0.3629390389297809, 'bull_strategy': 'breakout', 'bull_bb_std_mult': 1.5430078365322102, 'bull_rsi_os': 35, 'bull_rsi_ob': 71, 'bull_adx_thresh': 30.86677223480245, 'bull_atr_min_pct': 0.015632230518928383, 'bull_atr_max_pct': 0.08860026560312474, 'bull_tp_mult': 1.5243504663032814, 'bull_tsl_mult': 0.7372629722968376, 'bull_time_stop': 196, 'bull_use_sma': False, 'bull_use_ema': True, 'bull_use_atr': False, 'bull_use_adx': False, 'bull_use_spike': False, 'bull_rsi_required': False, 'bear_strategy': 'breakout', 'bear_bb_std_mult': 2.112072375130742, 'bear_rsi_os': 6, 'bear_rsi_ob': 59, 'bear_adx_thresh': 16.51184709670585, 'bear_atr_min_pct': 0.002540930701003341, 'bear_atr_max_pct': 0.12479038888564496, 'bear_tp_mult': 1.1072089951441582, 'bear_tsl_mult': 0.1465819026959565, 'bear_time_stop': 18, 'bear_use_sma': True, 'bear_use_ema': False, 'bear_use_atr': True, 'bear_use_adx': False, 'bear_use_spike': False, 'bear_rsi_required': False, 'sideways_strategy': 'breakout', 'sideways_bb_std_mult': 1.5393508342185074, 'sideways_rsi_os': 37, 'sideways_rsi_ob': 47, 'sideways_adx_thresh': 22.942752006865966, 'sideways_atr_min_pct': 0.006053520550754543, 'sideways_atr_max_pct': 0.0618325481259817, 'sideways_tp_mult': 2.5938793542987484, 'sideways_tsl_mult': 0.34924498417044114, 'sideways_time_stop': 170, 'sideways_use_sma': True, 'sideways_use_ema': True, 'sideways_use_atr': False, 'sideways_use_adx': False, 'sideways_use_spike': True, 'sideways_rsi_required': False}.
[I 2025-08-31 05:52:29,637] Trial 816 finished with values: [-0.007404987319750256, 0.007338979731477106] and parameters: {'p_sma': 33, 'p_std': 42, 'p_atr': 12, 'p_adx': 25, 'rsi_period': 16, 'ema1': 17, 'ema2': 19, 'slip_atr_k': 0.004773919895326719, 'slip_spread_k': 0.7791841064804933, 'spread_hl_frac': 0.0034639315542388657, 'bb_std_mult': 3.2835848145747493, 'rsi_os': 47, 'rsi_ob': 70, 'vol_spike': 0.08697394960135058, 'adx_thresh': 7.490416668817488, 'atr_min_pct': 0.01039189789437683, 'atr_max_pct': 0.11508667837675429, 'tp_mult': 2.097357158849207, 'tsl_mult': 0.4266362427258965, 'strategy': 'mean_reversion', 'time_stop': 10, 'use_sma': False, 'use_atr': True, 'use_adx': False, 'use_ema': False, 'use_spike': True, 'rsi_required': True, 'edge_k': 0.8701569767699711, 'edge_cap': 0.35250775795939204, 'bull_strategy': 'breakout', 'bull_bb_std_mult': 1.567231523428948, 'bull_rsi_os': 36, 'bull_rsi_ob': 71, 'bull_adx_thresh': 34.42469980298566, 'bull_atr_min_pct': 0.015818096703079675, 'bull_atr_max_pct': 0.0878307034052936, 'bull_tp_mult': 1.528659146178533, 'bull_tsl_mult': 0.7276390783590748, 'bull_time_stop': 188, 'bull_use_sma': False, 'bull_use_ema': True, 'bull_use_atr': False, 'bull_use_adx': True, 'bull_use_spike': False, 'bull_rsi_required': False, 'bear_strategy': 'breakout', 'bear_bb_std_mult': 2.1303727179668517, 'bear_rsi_os': 6, 'bear_rsi_ob': 59, 'bear_adx_thresh': 14.794574090389013, 'bear_atr_min_pct': 0.0011129659281981725, 'bear_atr_max_pct': 0.12518892311302282, 'bear_tp_mult': 1.0825085460688368, 'bear_tsl_mult': 0.1430281882004137, 'bear_time_stop': 244, 'bear_use_sma': True, 'bear_use_ema': False, 'bear_use_atr': True, 'bear_use_adx': False, 'bear_use_spike': False, 'bear_rsi_required': False, 'sideways_strategy': 'breakout', 'sideways_bb_std_mult': 1.404489091948752, 'sideways_rsi_os': 40, 'sideways_rsi_ob': 45, 'sideways_adx_thresh': 24.29241683117259, 'sideways_atr_min_pct': 0.0027082137362713764, 'sideways_atr_max_pct': 0.05417678531360212, 'sideways_tp_mult': 2.5666475479535706, 'sideways_tsl_mult': 0.284910999881294, 'sideways_time_stop': 143, 'sideways_use_sma': True, 'sideways_use_ema': True, 'sideways_use_atr': False, 'sideways_use_adx': False, 'sideways_use_spike': True, 'sideways_rsi_required': True}.
[I 2025-08-31 05:52:31,406] Trial 819 finished with values: [-1000000000.0, 1000000000.0] and parameters: {'p_sma': 33, 'p_std': 44, 'p_atr': 11, 'p_adx': 25, 'rsi_period': 16, 'ema1': 18, 'ema2': 19, 'slip_atr_k': 0.005338503109434116, 'slip_spread_k': 0.8108859445889525, 'spread_hl_frac': 0.004972978608120914, 'bb_std_mult': 3.445994425464722, 'rsi_os': 47, 'rsi_ob': 67, 'vol_spike': 0.08984177550909532, 'adx_thresh': 5.522008179704919, 'atr_min_pct': 0.012340616277926717, 'atr_max_pct': 0.10841237010895506, 'tp_mult': 2.1336942382301034, 'tsl_mult': 0.438690499957758, 'strategy': 'mean_reversion', 'time_stop': 12, 'use_sma': True, 'use_atr': True, 'use_adx': False, 'use_ema': False, 'use_spike': True, 'rsi_required': True, 'edge_k': 0.8897415283666704, 'edge_cap': 0.36395879332377407, 'bull_strategy': 'breakout', 'bull_bb_std_mult': 1.4382478215912526, 'bull_rsi_os': 35, 'bull_rsi_ob': 66, 'bull_adx_thresh': 30.651378072082803, 'bull_atr_min_pct': 0.01852773365056615, 'bull_atr_max_pct': 0.08612190012889971, 'bull_tp_mult': 1.5405563954678811, 'bull_tsl_mult': 0.7276445433289889, 'bull_time_stop': 197, 'bull_use_sma': False, 'bull_use_ema': True, 'bull_use_atr': False, 'bull_use_adx': False, 'bull_use_spike': False, 'bull_rsi_required': False, 'bear_strategy': 'breakout', 'bear_bb_std_mult': 2.1066055672433874, 'bear_rsi_os': 38, 'bear_rsi_ob': 62, 'bear_adx_thresh': 14.565223860014394, 'bear_atr_min_pct': 0.0030664875019280253, 'bear_atr_max_pct': 0.11722486626650028, 'bear_tp_mult': 1.1241524385848365, 'bear_tsl_mult': 0.15466905615404866, 'bear_time_stop': 18, 'bear_use_sma': True, 'bear_use_ema': False, 'bear_use_atr': True, 'bear_use_adx': False, 'bear_use_spike': False, 'bear_rsi_required': False, 'sideways_strategy': 'breakout', 'sideways_bb_std_mult': 1.5320772670366314, 'sideways_rsi_os': 37, 'sideways_rsi_ob': 45, 'sideways_adx_thresh': 23.11466483152071, 'sideways_atr_min_pct': 0.006277266472974602, 'sideways_atr_max_pct': 0.0662120916648139, 'sideways_tp_mult': 2.443000725133209, 'sideways_tsl_mult': 0.34004931563946483, 'sideways_time_stop': 169, 'sideways_use_sma': True, 'sideways_use_ema': True, 'sideways_use_atr': False, 'sideways_use_adx': False, 'sideways_use_spike': True, 'sideways_rsi_required': False}.
