[I 2025-08-31 03:48:37,223] Trial 125 finished with values: [-1000000000.0, 1000000000.0] and parameters: {'p_sma': 18, 'p_std': 27, 'p_atr': 14, 'p_adx': 11, 'rsi_period': 8, 'ema1': 25, 'ema2': 22, 'slip_atr_k': 0.17322943826923898, 'slip_spread_k': 0.9396503160865468, 'spread_hl_frac': 0.019299687226967698, 'bb_std_mult': 1.84919022389969, 'rsi_os': 6, 'rsi_ob': 85, 'vol_spike': 0.0429913672764725, 'adx_thresh': 21.32437660561032, 'atr_min_pct': 0.011940977333199765, 'atr_max_pct': 0.1034784235325871, 'tp_mult': 1.982153365577128, 'tsl_mult': 0.2247371045317683, 'strategy': 'mean_reversion', 'time_stop': 101, 'use_sma': False, 'use_atr': False, 'use_adx': True, 'use_ema': True, 'use_spike': False, 'rsi_required': True, 'edge_k': 0.788630570882705, 'edge_cap': 0.4069068712626234, 'bull_strategy': 'breakout', 'bull_bb_std_mult': 2.6510766240452095, 'bull_rsi_os': 32, 'bull_rsi_ob': 95, 'bull_adx_thresh': 34.22328701966385, 'bull_atr_min_pct': 0.0006889370103336382, 'bull_atr_max_pct': 0.13035588126787143, 'bull_tp_mult': 2.997881062067149, 'bull_tsl_mult': 0.7049484897301013, 'bull_time_stop': 18, 'bull_use_sma': True, 'bull_use_ema': True, 'bull_use_atr': True, 'bull_use_adx': False, 'bull_use_spike': True, 'bull_rsi_required': False, 'bear_strategy': 'breakout', 'bear_bb_std_mult': 0.9382882198663531, 'bear_rsi_os': 32, 'bear_rsi_ob': 82, 'bear_adx_thresh': 14.821513727960694, 'bear_atr_min_pct': 0.0054679470977073395, 'bear_atr_max_pct': 0.08454038561847982, 'bear_tp_mult': 1.160947034280066, 'bear_tsl_mult': 0.7145115687406095, 'bear_time_stop': 53, 'bear_use_sma': False, 'bear_use_ema': False, 'bear_use_atr': True, 'bear_use_adx': False, 'bear_use_spike': False, 'bear_rsi_required': False, 'sideways_strategy': 'breakout', 'sideways_bb_std_mult': 1.9394600113848266, 'sideways_rsi_os': 32, 'sideways_rsi_ob': 78, 'sideways_adx_thresh': 24.969206503093783, 'sideways_atr_min_pct': 0.022961146890726026, 'sideways_atr_max_pct': 0.12425579170921074, 'sideways_tp_mult': 2.6136906369052926, 'sideways_tsl_mult': 0.13907332462000227, 'sideways_time_stop': 202, 'sideways_use_sma': True, 'sideways_use_ema': True, 'sideways_use_atr': True, 'sideways_use_adx': False, 'sideways_use_spike': True, 'sideways_rsi_required': False}.
[I 2025-08-31 03:48:37,381] Trial 127 finished with values: [-1000000000.0, 1000000000.0] and parameters: {'p_sma': 18, 'p_std': 35, 'p_atr': 14, 'p_adx': 12, 'rsi_period': 75, 'ema1': 7, 'ema2': 40, 'slip_atr_k': 0.17355390272292084, 'slip_spread_k': 0.9241808799567583, 'spread_hl_frac': 0.026488145116291408, 'bb_std_mult': 2.819951033683936, 'rsi_os': 47, 'rsi_ob': 59, 'vol_spike': 0.14007286041947772, 'adx_thresh': 21.556034004563983, 'atr_min_pct': 0.02304647176185832, 'atr_max_pct': 0.10574156431310763, 'tp_mult': 2.8085449158105953, 'tsl_mult': 0.4612854887289801, 'strategy': 'mean_reversion', 'time_stop': 99, 'use_sma': False, 'use_atr': True, 'use_adx': True, 'use_ema': True, 'use_spike': False, 'rsi_required': False, 'edge_k': 0.481187580500274, 'edge_cap': 0.43373010327084927, 'bull_strategy': 'mean_reversion', 'bull_bb_std_mult': 2.4815669673658407, 'bull_rsi_os': 31, 'bull_rsi_ob': 95, 'bull_adx_thresh': 20.754563152913665, 'bull_atr_min_pct': 0.0011918068712372053, 'bull_atr_max_pct': 0.10609033768863867, 'bull_tp_mult': 2.7022362750538345, 'bull_tsl_mult': 0.7068150368306066, 'bull_time_stop': 176, 'bull_use_sma': True, 'bull_use_ema': False, 'bull_use_atr': True, 'bull_use_adx': True, 'bull_use_spike': True, 'bull_rsi_required': True, 'bear_strategy': 'breakout', 'bear_bb_std_mult': 2.701183928630927, 'bear_rsi_os': 24, 'bear_rsi_ob': 82, 'bear_adx_thresh': 28.311569784957094, 'bear_atr_min_pct': 0.005804091659521309, 'bear_atr_max_pct': 0.08648755965503058, 'bear_tp_mult': 1.2453490404220358, 'bear_tsl_mult': 0.7259674623785818, 'bear_time_stop': 50, 'bear_use_sma': True, 'bear_use_ema': True, 'bear_use_atr': True, 'bear_use_adx': False, 'bear_use_spike': True, 'bear_rsi_required': False, 'sideways_strategy': 'breakout', 'sideways_bb_std_mult': 1.2640832314090114, 'sideways_rsi_os': 55, 'sideways_rsi_ob': 85, 'sideways_adx_thresh': 25.176257521819732, 'sideways_atr_min_pct': 0.007607330874279933, 'sideways_atr_max_pct': 0.0920693798275356, 'sideways_tp_mult': 2.627149211734024, 'sideways_tsl_mult': 0.11929645483403822, 'sideways_time_stop': 202, 'sideways_use_sma': True, 'sideways_use_ema': True, 'sideways_use_atr': True, 'sideways_use_adx': False, 'sideways_use_spike': True, 'sideways_rsi_required': True}.
[I 2025-08-31 03:48:37,784] Trial 128 finished with values: [-0.014214654919115888, 0.014151877706445144] and parameters: {'p_sma': 59, 'p_std': 16, 'p_atr': 22, 'p_adx': 9, 'rsi_period': 54, 'ema1': 21, 'ema2': 40, 'slip_atr_k': 0.19254782761040437, 'slip_spread_k': 0.498091738606849, 'spread_hl_frac': 0.023468477762057422, 'bb_std_mult': 0.8889295474965357, 'rsi_os': 8, 'rsi_ob': 85, 'vol_spike': 0.040581008468180024, 'adx_thresh': 23.4080969676073, 'atr_min_pct': 0.02295707820571973, 'atr_max_pct': 0.14804840334106867, 'tp_mult': 1.3718887939828202, 'tsl_mult': 0.2236277740434125, 'strategy': 'breakout', 'time_stop': 117, 'use_sma': False, 'use_atr': False, 'use_adx': False, 'use_ema': True, 'use_spike': False, 'rsi_required': False, 'edge_k': 0.37420757486297956, 'edge_cap': 0.8296482501994042, 'bull_strategy': 'breakout', 'bull_bb_std_mult': 0.5770035083522036, 'bull_rsi_os': 14, 'bull_rsi_ob': 91, 'bull_adx_thresh': 20.66447350302606, 'bull_atr_min_pct': 0.0006076486325042202, 'bull_atr_max_pct': 0.13015913937492524, 'bull_tp_mult': 1.7086382867112333, 'bull_tsl_mult': 0.5091244711555148, 'bull_time_stop': 171, 'bull_use_sma': False, 'bull_use_ema': False, 'bull_use_atr': True, 'bull_use_adx': True, 'bull_use_spike': True, 'bull_rsi_required': False, 'bear_strategy': 'mean_reversion', 'bear_bb_std_mult': 3.1413450945767556, 'bear_rsi_os': 32, 'bear_rsi_ob': 60, 'bear_adx_thresh': 22.540017301814213, 'bear_atr_min_pct': 0.005937503689319876, 'bear_atr_max_pct': 0.1493923355625551, 'bear_tp_mult': 2.4042666912551813, 'bear_tsl_mult': 0.7252937797954248, 'bear_time_stop': 175, 'bear_use_sma': True, 'bear_use_ema': True, 'bear_use_atr': True, 'bear_use_adx': False, 'bear_use_spike': True, 'bear_rsi_required': False, 'sideways_strategy': 'mean_reversion', 'sideways_bb_std_mult': 2.128006893563979, 'sideways_rsi_os': 52, 'sideways_rsi_ob': 82, 'sideways_adx_thresh': 25.24989636364582, 'sideways_atr_min_pct': 0.0075720549779139884, 'sideways_atr_max_pct': 0.01287416898801741, 'sideways_tp_mult': 2.667234612114345, 'sideways_tsl_mult': 0.1304471700477901, 'sideways_time_stop': 297, 'sideways_use_sma': True, 'sideways_use_ema': False, 'sideways_use_atr': False, 'sideways_use_adx': False, 'sideways_use_spike': True, 'sideways_rsi_required': True}.
[I 2025-08-31 03:49:06,563] Trial 130 finished with values: [-1000000000.0, 1000000000.0] and parameters: {'p_sma': 12, 'p_std': 21, 'p_atr': 10, 'p_adx': 9, 'rsi_period': 80, 'ema1': 21, 'ema2': 38, 'slip_atr_k': 0.15906262762031076, 'slip_spread_k': 0.5798963628367223, 'spread_hl_frac': 0.02361434541073989, 'bb_std_mult': 1.7538369981969988, 'rsi_os': 8, 'rsi_ob': 87, 'vol_spike': 0.14155767968915536, 'adx_thresh': 23.45433999473108, 'atr_min_pct': 0.012696454017964702, 'atr_max_pct': 0.14154540846201585, 'tp_mult': 2.211249972601762, 'tsl_mult': 0.18497712065600552, 'strategy': 'breakout', 'time_stop': 132, 'use_sma': False, 'use_atr': True, 'use_adx': False, 'use_ema': True, 'use_spike': False, 'rsi_required': False, 'edge_k': 0.8630720812108793, 'edge_cap': 0.43613395732898647, 'bull_strategy': 'mean_reversion', 'bull_bb_std_mult': 2.9455054591898353, 'bull_rsi_os': 43, 'bull_rsi_ob': 91, 'bull_adx_thresh': 33.5052548124178, 'bull_atr_min_pct': 0.024709100213645543, 'bull_atr_max_pct': 0.10703128612443939, 'bull_tp_mult': 2.052813664006104, 'bull_tsl_mult': 0.4394384538674921, 'bull_time_stop': 177, 'bull_use_sma': False, 'bull_use_ema': False, 'bull_use_atr': True, 'bull_use_adx': True, 'bull_use_spike': True, 'bull_rsi_required': True, 'bear_strategy': 'mean_reversion', 'bear_bb_std_mult': 3.1700369253666025, 'bear_rsi_os': 36, 'bear_rsi_ob': 74, 'bear_adx_thresh': 11.020996928823044, 'bear_atr_min_pct': 0.0021858065265587547, 'bear_atr_max_pct': 0.07423868144994686, 'bear_tp_mult': 2.99081273337796, 'bear_tsl_mult': 0.6887702173634942, 'bear_time_stop': 183, 'bear_use_sma': True, 'bear_use_ema': True, 'bear_use_atr': False, 'bear_use_adx': False, 'bear_use_spike': True, 'bear_rsi_required': False, 'sideways_strategy': 'mean_reversion', 'sideways_bb_std_mult': 1.816410414344629, 'sideways_rsi_os': 42, 'sideways_rsi_ob': 87, 'sideways_adx_thresh': 22.84480062514989, 'sideways_atr_min_pct': 0.007611869320511019, 'sideways_atr_max_pct': 0.011104915330342052, 'sideways_tp_mult': 2.4900948071856055, 'sideways_tsl_mult': 0.5683123658966486, 'sideways_time_stop': 261, 'sideways_use_sma': False, 'sideways_use_ema': False, 'sideways_use_atr': False, 'sideways_use_adx': False, 'sideways_use_spike': False, 'sideways_rsi_required': True}.
[I 2025-08-31 03:49:06,838] Trial 129 finished with values: [-1000000000.0, 1000000000.0] and parameters: {'p_sma': 57, 'p_std': 16, 'p_atr': 14, 'p_adx': 7, 'rsi_period': 81, 'ema1': 22, 'ema2': 35, 'slip_atr_k': 0.15817207249599607, 'slip_spread_k': 0.5845963487218394, 'spread_hl_frac': 0.026528291049428446, 'bb_std_mult': 0.8750827120647455, 'rsi_os': 24, 'rsi_ob': 85, 'vol_spike': 0.14058120825461523, 'adx_thresh': 16.887430177500566, 'atr_min_pct': 0.01139103445309165, 'atr_max_pct': 0.0832201865213117, 'tp_mult': 2.570166106738481, 'tsl_mult': 0.18432319984253354, 'strategy': 'breakout', 'time_stop': 140, 'use_sma': False, 'use_atr': True, 'use_adx': False, 'use_ema': True, 'use_spike': False, 'rsi_required': False, 'edge_k': 0.8660000990554375, 'edge_cap': 0.43433986296628524, 'bull_strategy': 'mean_reversion', 'bull_bb_std_mult': 0.6166395375699987, 'bull_rsi_os': 43, 'bull_rsi_ob': 91, 'bull_adx_thresh': 33.72720751825372, 'bull_atr_min_pct': 0.002074839787948155, 'bull_atr_max_pct': 0.03139781777554146, 'bull_tp_mult': 1.7207563002199324, 'bull_tsl_mult': 0.8088795225140979, 'bull_time_stop': 21, 'bull_use_sma': False, 'bull_use_ema': False, 'bull_use_atr': True, 'bull_use_adx': True, 'bull_use_spike': True, 'bull_rsi_required': True, 'bear_strategy': 'mean_reversion', 'bear_bb_std_mult': 3.0944126092381063, 'bear_rsi_os': 29, 'bear_rsi_ob': 82, 'bear_adx_thresh': 21.560174591089517, 'bear_atr_min_pct': 0.004083335091486529, 'bear_atr_max_pct': 0.0488416858134476, 'bear_tp_mult': 1.3918940999610898, 'bear_tsl_mult': 0.9564867608402955, 'bear_time_stop': 182, 'bear_use_sma': True, 'bear_use_ema': True, 'bear_use_atr': False, 'bear_use_adx': False, 'bear_use_spike': True, 'bear_rsi_required': False, 'sideways_strategy': 'mean_reversion', 'sideways_bb_std_mult': 2.1276498695238444, 'sideways_rsi_os': 28, 'sideways_rsi_ob': 87, 'sideways_adx_thresh': 25.003161355406526, 'sideways_atr_min_pct': 0.026376754313204395, 'sideways_atr_max_pct': 0.12062039425903251, 'sideways_tp_mult': 2.6461883108100164, 'sideways_tsl_mult': 0.1458029637444389, 'sideways_time_stop': 300, 'sideways_use_sma': False, 'sideways_use_ema': False, 'sideways_use_atr': False, 'sideways_use_adx': False, 'sideways_use_spike': True, 'sideways_rsi_required': True}.
[I 2025-08-31 03:49:06,959] Trial 131 finished with values: [-1000000000.0, 1000000000.0] and parameters: {'p_sma': 57, 'p_std': 16, 'p_atr': 22, 'p_adx': 21, 'rsi_period': 66, 'ema1': 21, 'ema2': 16, 'slip_atr_k': 0.10897352719816575, 'slip_spread_k': 0.5945799776382698, 'spread_hl_frac': 0.023907435446028334, 'bb_std_mult': 0.8610940278116412, 'rsi_os': 53, 'rsi_ob': 87, 'vol_spike': 0.15382629272928958, 'adx_thresh': 19.633582647730424, 'atr_min_pct': 0.029297805835496064, 'atr_max_pct': 0.1408885119009606, 'tp_mult': 1.8625093445917253, 'tsl_mult': 0.03182482233665107, 'strategy': 'breakout', 'time_stop': 145, 'use_sma': True, 'use_atr': False, 'use_adx': False, 'use_ema': False, 'use_spike': True, 'rsi_required': False, 'edge_k': 0.36374645718595533, 'edge_cap': 0.3124157666329844, 'bull_strategy': 'breakout', 'bull_bb_std_mult': 2.975807771675556, 'bull_rsi_os': 35, 'bull_rsi_ob': 91, 'bull_adx_thresh': 33.68724678425236, 'bull_atr_min_pct': 0.0020587142166848243, 'bull_atr_max_pct': 0.0959219573945653, 'bull_tp_mult': 2.8196772212431958, 'bull_tsl_mult': 0.8082926126533079, 'bull_time_stop': 291, 'bull_use_sma': False, 'bull_use_ema': False, 'bull_use_atr': False, 'bull_use_adx': True, 'bull_use_spike': False, 'bull_rsi_required': False, 'bear_strategy': 'mean_reversion', 'bear_bb_std_mult': 2.074293550786458, 'bear_rsi_os': 29, 'bear_rsi_ob': 74, 'bear_adx_thresh': 25.001730581058478, 'bear_atr_min_pct': 0.003289176566702511, 'bear_atr_max_pct': 0.01515360826262123, 'bear_tp_mult': 2.4303290919647758, 'bear_tsl_mult': 0.6332496088614745, 'bear_time_stop': 261, 'bear_use_sma': True, 'bear_use_ema': True, 'bear_use_atr': False, 'bear_use_adx': True, 'bear_use_spike': True, 'bear_rsi_required': False, 'sideways_strategy': 'mean_reversion', 'sideways_bb_std_mult': 2.1174833060429608, 'sideways_rsi_os': 53, 'sideways_rsi_ob': 87, 'sideways_adx_thresh': 27.69399933832525, 'sideways_atr_min_pct': 0.011519731643053855, 'sideways_atr_max_pct': 0.07524448455553413, 'sideways_tp_mult': 1.6033981731806817, 'sideways_tsl_mult': 0.7808990359320501, 'sideways_time_stop': 262, 'sideways_use_sma': False, 'sideways_use_ema': False, 'sideways_use_atr': False, 'sideways_use_adx': False, 'sideways_use_spike': False, 'sideways_rsi_required': True}.
[I 2025-08-31 03:49:07,250] Trial 132 finished with values: [-1000000000.0, 1000000000.0] and parameters: {'p_sma': 60, 'p_std': 16, 'p_atr': 22, 'p_adx': 9, 'rsi_period': 60, 'ema1': 26, 'ema2': 40, 'slip_atr_k': 0.2049327389595192, 'slip_spread_k': 0.4931014361327094, 'spread_hl_frac': 0.02375982616033413, 'bb_std_mult': 1.9921280930593523, 'rsi_os': 55, 'rsi_ob': 89, 'vol_spike': 0.0337653641060899, 'adx_thresh': 24.451879976545964, 'atr_min_pct': 0.02244376651706508, 'atr_max_pct': 0.14752778535049063, 'tp_mult': 1.356736450880621, 'tsl_mult': 0.2474712052980887, 'strategy': 'breakout', 'time_stop': 138, 'use_sma': True, 'use_atr': False, 'use_adx': False, 'use_ema': False, 'use_spike': True, 'rsi_required': False, 'edge_k': 0.3646781771437159, 'edge_cap': 0.9020646416732774, 'bull_strategy': 'breakout', 'bull_bb_std_mult': 0.5719627795186144, 'bull_rsi_os': 14, 'bull_rsi_ob': 87, 'bull_adx_thresh': 20.443646479417048, 'bull_atr_min_pct': 0.010068136210890255, 'bull_atr_max_pct': 0.11313434194961967, 'bull_tp_mult': 1.7687850291830594, 'bull_tsl_mult': 0.505281779598292, 'bull_time_stop': 169, 'bull_use_sma': False, 'bull_use_ema': False, 'bull_use_atr': False, 'bull_use_adx': True, 'bull_use_spike': False, 'bull_rsi_required': False, 'bear_strategy': 'mean_reversion', 'bear_bb_std_mult': 3.147169650180354, 'bear_rsi_os': 29, 'bear_rsi_ob': 59, 'bear_adx_thresh': 22.22601606964632, 'bear_atr_min_pct': 0.0034986633972352334, 'bear_atr_max_pct': 0.1498754081715876, 'bear_tp_mult': 2.427586104422087, 'bear_tsl_mult': 0.8056137466571343, 'bear_time_stop': 206, 'bear_use_sma': True, 'bear_use_ema': True, 'bear_use_atr': False, 'bear_use_adx': True, 'bear_use_spike': True, 'bear_rsi_required': False, 'sideways_strategy': 'mean_reversion', 'sideways_bb_std_mult': 2.1256153063422554, 'sideways_rsi_os': 50, 'sideways_rsi_ob': 82, 'sideways_adx_thresh': 22.844200132157148, 'sideways_atr_min_pct': 0.011213443044648552, 'sideways_atr_max_pct': 0.010111718220767275, 'sideways_tp_mult': 2.776236251686608, 'sideways_tsl_mult': 0.20770984447607993, 'sideways_time_stop': 300, 'sideways_use_sma': False, 'sideways_use_ema': False, 'sideways_use_atr': False, 'sideways_use_adx': False, 'sideways_use_spike': True, 'sideways_rsi_required': True}.
[I 2025-08-31 03:49:35,848] Trial 136 finished with values: [-0.014773002514653522, 0.014716010040532983] and parameters: {'p_sma': 59, 'p_std': 14, 'p_atr': 20, 'p_adx': 10, 'rsi_period': 53, 'ema1': 25, 'ema2': 43, 'slip_atr_k': 0.22301210701355967, 'slip_spread_k': 0.45847500758579923, 'spread_hl_frac': 0.022416980494112428, 'bb_std_mult': 2.931346193790369, 'rsi_os': 36, 'rsi_ob': 89, 'vol_spike': 0.02378264707466638, 'adx_thresh': 25.44053379219296, 'atr_min_pct': 0.020972588580652943, 'atr_max_pct': 0.13261946789315673, 'tp_mult': 1.3847876964191852, 'tsl_mult': 0.2734509612755912, 'strategy': 'breakout', 'time_stop': 114, 'use_sma': False, 'use_atr': False, 'use_adx': False, 'use_ema': True, 'use_spike': False, 'rsi_required': False, 'edge_k': 0.3093280420752495, 'edge_cap': 0.6890757441539805, 'bull_strategy': 'breakout', 'bull_bb_std_mult': 1.2250403183356524, 'bull_rsi_os': 16, 'bull_rsi_ob': 86, 'bull_adx_thresh': 18.968295934701505, 'bull_atr_min_pct': 0.00010825930258426568, 'bull_atr_max_pct': 0.11913629187438841, 'bull_tp_mult': 1.8572254892245172, 'bull_tsl_mult': 0.49203434496472914, 'bull_time_stop': 219, 'bull_use_sma': False, 'bull_use_ema': False, 'bull_use_atr': True, 'bull_use_adx': True, 'bull_use_spike': True, 'bull_rsi_required': False, 'bear_strategy': 'mean_reversion', 'bear_bb_std_mult': 3.493518773178276, 'bear_rsi_os': 32, 'bear_rsi_ob': 58, 'bear_adx_thresh': 20.656335377246897, 'bear_atr_min_pct': 0.013871060933910712, 'bear_atr_max_pct': 0.12541409507398746, 'bear_tp_mult': 2.3383462076485584, 'bear_tsl_mult': 0.7624290215557853, 'bear_time_stop': 160, 'bear_use_sma': True, 'bear_use_ema': True, 'bear_use_atr': True, 'bear_use_adx': False, 'bear_use_spike': True, 'bear_rsi_required': False, 'sideways_strategy': 'mean_reversion', 'sideways_bb_std_mult': 2.246481321838194, 'sideways_rsi_os': 49, 'sideways_rsi_ob': 81, 'sideways_adx_thresh': 24.17851920948856, 'sideways_atr_min_pct': 0.005727228955791032, 'sideways_atr_max_pct': 0.016399628863552902, 'sideways_tp_mult': 2.802295594880796, 'sideways_tsl_mult': 0.051995937253290325, 'sideways_time_stop': 294, 'sideways_use_sma': True, 'sideways_use_ema': False, 'sideways_use_atr': False, 'sideways_use_adx': True, 'sideways_use_spike': True, 'sideways_rsi_required': True}.
[I 2025-08-31 03:49:35,980] Trial 133 finished with values: [-1000000000.0, 1000000000.0] and parameters: {'p_sma': 60, 'p_std': 16, 'p_atr': 22, 'p_adx': 9, 'rsi_period': 60, 'ema1': 11, 'ema2': 43, 'slip_atr_k': 0.20654578464672171, 'slip_spread_k': 0.5127225506291253, 'spread_hl_frac': 0.02229235824583244, 'bb_std_mult': 2.9426648422172956, 'rsi_os': 36, 'rsi_ob': 89, 'vol_spike': 0.03017882513132284, 'adx_thresh': 16.84610517209125, 'atr_min_pct': 0.02955011493946003, 'atr_max_pct': 0.12099718821049812, 'tp_mult': 1.275673856296591, 'tsl_mult': 0.2698214648281234, 'strategy': 'breakout', 'time_stop': 142, 'use_sma': True, 'use_atr': False, 'use_adx': False, 'use_ema': False, 'use_spike': True, 'rsi_required': False, 'edge_k': 0.36344927797019694, 'edge_cap': 0.9022733716029969, 'bull_strategy': 'breakout', 'bull_bb_std_mult': 0.6185617845398474, 'bull_rsi_os': 14, 'bull_rsi_ob': 87, 'bull_adx_thresh': 19.301083333463474, 'bull_atr_min_pct': 0.009953316202763775, 'bull_atr_max_pct': 0.1143564855997001, 'bull_tp_mult': 1.7737662828054113, 'bull_tsl_mult': 0.5026608243767158, 'bull_time_stop': 169, 'bull_use_sma': False, 'bull_use_ema': False, 'bull_use_atr': False, 'bull_use_adx': True, 'bull_use_spike': False, 'bull_rsi_required': False, 'bear_strategy': 'mean_reversion', 'bear_bb_std_mult': 3.5999973419078524, 'bear_rsi_os': 29, 'bear_rsi_ob': 59, 'bear_adx_thresh': 22.53319484564396, 'bear_atr_min_pct': 0.013780112947458059, 'bear_atr_max_pct': 0.14880898370818182, 'bear_tp_mult': 2.419782339154911, 'bear_tsl_mult': 0.8037352284665831, 'bear_time_stop': 261, 'bear_use_sma': True, 'bear_use_ema': True, 'bear_use_atr': False, 'bear_use_adx': True, 'bear_use_spike': True, 'bear_rsi_required': False, 'sideways_strategy': 'mean_reversion', 'sideways_bb_std_mult': 2.1510638786013243, 'sideways_rsi_os': 47, 'sideways_rsi_ob': 81, 'sideways_adx_thresh': 23.484847837628408, 'sideways_atr_min_pct': 0.01130186789523866, 'sideways_atr_max_pct': 0.01638778722046419, 'sideways_tp_mult': 2.82326581501483, 'sideways_tsl_mult': 0.202510908137914, 'sideways_time_stop': 300, 'sideways_use_sma': False, 'sideways_use_ema': False, 'sideways_use_atr': False, 'sideways_use_adx': True, 'sideways_use_spike': True, 'sideways_rsi_required': True}.
