[I 2025-08-31 05:02:37,537] Trial 539 finished with values: [-1000000000.0, 1000000000.0] and parameters: {'p_sma': 42, 'p_std': 16, 'p_atr': 28, 'p_adx': 14, 'rsi_period': 24, 'ema1': 10, 'ema2': 37, 'slip_atr_k': 0.04098622717219842, 'slip_spread_k': 0.09344120697757864, 'spread_hl_frac': 0.013102217974362795, 'bb_std_mult': 1.1744150650619178, 'rsi_os': 29, 'rsi_ob': 59, 'vol_spike': 0.008754432471009791, 'adx_thresh': 11.091175143481301, 'atr_min_pct': 0.021097847477794647, 'atr_max_pct': 0.05668402236091778, 'tp_mult': 2.4919323700041818, 'tsl_mult': 0.2434221489946301, 'strategy': 'breakout', 'time_stop': 64, 'use_sma': False, 'use_atr': False, 'use_adx': False, 'use_ema': False, 'use_spike': True, 'rsi_required': False, 'edge_k': 0.3781890894678769, 'edge_cap': 0.6444152321816479, 'bull_strategy': 'mean_reversion', 'bull_bb_std_mult': 0.670161603760788, 'bull_rsi_os': 19, 'bull_rsi_ob': 78, 'bull_adx_thresh': 11.696324853162654, 'bull_atr_min_pct': 0.0025891172789816864, 'bull_atr_max_pct': 0.04371995164124605, 'bull_tp_mult': 1.4180027365329966, 'bull_tsl_mult': 0.8880492447336666, 'bull_time_stop': 141, 'bull_use_sma': False, 'bull_use_ema': False, 'bull_use_atr': True, 'bull_use_adx': True, 'bull_use_spike': False, 'bull_rsi_required': True, 'bear_strategy': 'mean_reversion', 'bear_bb_std_mult': 0.798446613309058, 'bear_rsi_os': 11, 'bear_rsi_ob': 46, 'bear_adx_thresh': 22.1998570897886, 'bear_atr_min_pct': 0.023111123452579485, 'bear_atr_max_pct': 0.03177573021725687, 'bear_tp_mult': 2.7447445621269986, 'bear_tsl_mult': 0.44158349867926455, 'bear_time_stop': 195, 'bear_use_sma': True, 'bear_use_ema': True, 'bear_use_atr': True, 'bear_use_adx': True, 'bear_use_spike': True, 'bear_rsi_required': True, 'sideways_strategy': 'mean_reversion', 'sideways_bb_std_mult': 2.196950215257069, 'sideways_rsi_os': 51, 'sideways_rsi_ob': 67, 'sideways_adx_thresh': 13.697225245904782, 'sideways_atr_min_pct': 0.01289703115891549, 'sideways_atr_max_pct': 0.11853978797808688, 'sideways_tp_mult': 2.1148770669463612, 'sideways_tsl_mult': 0.02897019950526253, 'sideways_time_stop': 64, 'sideways_use_sma': True, 'sideways_use_ema': False, 'sideways_use_atr': False, 'sideways_use_adx': True, 'sideways_use_spike': True, 'sideways_rsi_required': True}.
[I 2025-08-31 05:03:19,753] Trial 542 finished with values: [-1000000000.0, 1000000000.0] and parameters: {'p_sma': 42, 'p_std': 16, 'p_atr': 24, 'p_adx': 10, 'rsi_period': 25, 'ema1': 9, 'ema2': 51, 'slip_atr_k': 0.018724967865686518, 'slip_spread_k': 0.6487776275764057, 'spread_hl_frac': 0.00936619972794806, 'bb_std_mult': 1.5212688063253716, 'rsi_os': 29, 'rsi_ob': 87, 'vol_spike': 0.03765517027170261, 'adx_thresh': 11.450478479385973, 'atr_min_pct': 0.012017304935926383, 'atr_max_pct': 0.12618999034373396, 'tp_mult': 2.587080844534505, 'tsl_mult': 0.48769105080411446, 'strategy': 'breakout', 'time_stop': 111, 'use_sma': False, 'use_atr': False, 'use_adx': False, 'use_ema': False, 'use_spike': True, 'rsi_required': False, 'edge_k': 1.5200207673273858, 'edge_cap': 0.3097607749297713, 'bull_strategy': 'mean_reversion', 'bull_bb_std_mult': 3.204532414025496, 'bull_rsi_os': 37, 'bull_rsi_ob': 86, 'bull_adx_thresh': 10.417858235511552, 'bull_atr_min_pct': 0.018463107896490957, 'bull_atr_max_pct': 0.027748016435139952, 'bull_tp_mult': 1.3157352160066749, 'bull_tsl_mult': 0.8173830601720578, 'bull_time_stop': 20, 'bull_use_sma': False, 'bull_use_ema': False, 'bull_use_atr': True, 'bull_use_adx': True, 'bull_use_spike': False, 'bull_rsi_required': True, 'bear_strategy': 'mean_reversion', 'bear_bb_std_mult': 3.593628845676972, 'bear_rsi_os': 11, 'bear_rsi_ob': 46, 'bear_adx_thresh': 30.205947182746257, 'bear_atr_min_pct': 0.022536791352986883, 'bear_atr_max_pct': 0.09283237066992993, 'bear_tp_mult': 2.7313200396195723, 'bear_tsl_mult': 0.2549695805832564, 'bear_time_stop': 52, 'bear_use_sma': True, 'bear_use_ema': True, 'bear_use_atr': True, 'bear_use_adx': True, 'bear_use_spike': True, 'bear_rsi_required': True, 'sideways_strategy': 'mean_reversion', 'sideways_bb_std_mult': 1.3023206810606234, 'sideways_rsi_os': 37, 'sideways_rsi_ob': 69, 'sideways_adx_thresh': 11.229364579601539, 'sideways_atr_min_pct': 0.01260017321486537, 'sideways_atr_max_pct': 0.1320352623517123, 'sideways_tp_mult': 1.9054696612283804, 'sideways_tsl_mult': 0.6219416719197207, 'sideways_time_stop': 269, 'sideways_use_sma': False, 'sideways_use_ema': False, 'sideways_use_atr': False, 'sideways_use_adx': True, 'sideways_use_spike': True, 'sideways_rsi_required': True}.
[I 2025-08-31 05:03:20,986] Trial 543 finished with values: [-1000000000.0, 1000000000.0] and parameters: {'p_sma': 53, 'p_std': 14, 'p_atr': 11, 'p_adx': 10, 'rsi_period': 26, 'ema1': 14, 'ema2': 26, 'slip_atr_k': 0.01938296960040282, 'slip_spread_k': 0.14414342948408687, 'spread_hl_frac': 0.009807028132000285, 'bb_std_mult': 1.6620658921806917, 'rsi_os': 23, 'rsi_ob': 58, 'vol_spike': 0.2483800060225339, 'adx_thresh': 11.627018936996718, 'atr_min_pct': 0.021256856029626073, 'atr_max_pct': 0.1271417318451062, 'tp_mult': 1.7780198596087562, 'tsl_mult': 0.24638039140870815, 'strategy': 'breakout', 'time_stop': 88, 'use_sma': False, 'use_atr': False, 'use_adx': True, 'use_ema': False, 'use_spike': True, 'rsi_required': False, 'edge_k': 1.524664468644551, 'edge_cap': 0.985230139079961, 'bull_strategy': 'mean_reversion', 'bull_bb_std_mult': 3.5468037767777867, 'bull_rsi_os': 14, 'bull_rsi_ob': 78, 'bull_adx_thresh': 10.805023858419126, 'bull_atr_min_pct': 0.004289057720820548, 'bull_atr_max_pct': 0.03946642886898051, 'bull_tp_mult': 1.5426433642012674, 'bull_tsl_mult': 0.8865355369847722, 'bull_time_stop': 52, 'bull_use_sma': True, 'bull_use_ema': False, 'bull_use_atr': True, 'bull_use_adx': False, 'bull_use_spike': False, 'bull_rsi_required': False, 'bear_strategy': 'mean_reversion', 'bear_bb_std_mult': 0.7899669136021716, 'bear_rsi_os': 46, 'bear_rsi_ob': 50, 'bear_adx_thresh': 8.38254140604667, 'bear_atr_min_pct': 0.022539120564602704, 'bear_atr_max_pct': 0.02802761383667965, 'bear_tp_mult': 2.739670613524234, 'bear_tsl_mult': 0.43890791528310785, 'bear_time_stop': 196, 'bear_use_sma': False, 'bear_use_ema': True, 'bear_use_atr': True, 'bear_use_adx': True, 'bear_use_spike': True, 'bear_rsi_required': True, 'sideways_strategy': 'mean_reversion', 'sideways_bb_std_mult': 0.5083926661623441, 'sideways_rsi_os': 5, 'sideways_rsi_ob': 94, 'sideways_adx_thresh': 20.131095199119745, 'sideways_atr_min_pct': 0.012892597278244844, 'sideways_atr_max_pct': 0.10944739559299825, 'sideways_tp_mult': 2.0386662414869208, 'sideways_tsl_mult': 0.5950287731359404, 'sideways_time_stop': 108, 'sideways_use_sma': False, 'sideways_use_ema': True, 'sideways_use_atr': True, 'sideways_use_adx': True, 'sideways_use_spike': False, 'sideways_rsi_required': False}.
[I 2025-08-31 05:03:21,232] Trial 541 finished with values: [-1000000000.0, 1000000000.0] and parameters: {'p_sma': 57, 'p_std': 14, 'p_atr': 24, 'p_adx': 15, 'rsi_period': 25, 'ema1': 14, 'ema2': 51, 'slip_atr_k': 0.036350020552295, 'slip_spread_k': 0.395514124676689, 'spread_hl_frac': 0.009458104509804947, 'bb_std_mult': 2.087271692054082, 'rsi_os': 29, 'rsi_ob': 75, 'vol_spike': 0.036815640716993045, 'adx_thresh': 11.246580887771977, 'atr_min_pct': 0.014859012142778509, 'atr_max_pct': 0.13234365473028292, 'tp_mult': 2.446499605198421, 'tsl_mult': 0.18581465464169328, 'strategy': 'breakout', 'time_stop': 28, 'use_sma': False, 'use_atr': False, 'use_adx': False, 'use_ema': False, 'use_spike': True, 'rsi_required': False, 'edge_k': 1.1856691167927929, 'edge_cap': 0.6372467624325671, 'bull_strategy': 'mean_reversion', 'bull_bb_std_mult': 1.7474982086967334, 'bull_rsi_os': 54, 'bull_rsi_ob': 78, 'bull_adx_thresh': 9.783510924955195, 'bull_atr_min_pct': 0.004575787546972156, 'bull_atr_max_pct': 0.03972163143018749, 'bull_tp_mult': 1.515547105227881, 'bull_tsl_mult': 0.8907218967948806, 'bull_time_stop': 53, 'bull_use_sma': False, 'bull_use_ema': True, 'bull_use_atr': True, 'bull_use_adx': True, 'bull_use_spike': False, 'bull_rsi_required': True, 'bear_strategy': 'mean_reversion', 'bear_bb_std_mult': 0.787546905347692, 'bear_rsi_os': 46, 'bear_rsi_ob': 46, 'bear_adx_thresh': 22.09332280171008, 'bear_atr_min_pct': 0.02254043528568683, 'bear_atr_max_pct': 0.04129196979870275, 'bear_tp_mult': 2.7131119119798353, 'bear_tsl_mult': 0.25449278159046623, 'bear_time_stop': 223, 'bear_use_sma': True, 'bear_use_ema': False, 'bear_use_atr': True, 'bear_use_adx': True, 'bear_use_spike': True, 'bear_rsi_required': True, 'sideways_strategy': 'mean_reversion', 'sideways_bb_std_mult': 2.109595078839748, 'sideways_rsi_os': 49, 'sideways_rsi_ob': 69, 'sideways_adx_thresh': 20.07763896569816, 'sideways_atr_min_pct': 0.012508065339180674, 'sideways_atr_max_pct': 0.10996708940138805, 'sideways_tp_mult': 1.4234707588876119, 'sideways_tsl_mult': 0.028899674819017063, 'sideways_time_stop': 108, 'sideways_use_sma': False, 'sideways_use_ema': False, 'sideways_use_atr': False, 'sideways_use_adx': True, 'sideways_use_spike': True, 'sideways_rsi_required': True}.
[I 2025-08-31 05:03:21,816] Trial 544 finished with values: [-1000000000.0, 1000000000.0] and parameters: {'p_sma': 44, 'p_std': 60, 'p_atr': 24, 'p_adx': 10, 'rsi_period': 25, 'ema1': 14, 'ema2': 11, 'slip_atr_k': 0.204415090653015, 'slip_spread_k': 0.14342389140875877, 'spread_hl_frac': 0.047930892384842334, 'bb_std_mult': 1.4078799851383608, 'rsi_os': 30, 'rsi_ob': 91, 'vol_spike': 0.19899998427846238, 'adx_thresh': 14.475472119569279, 'atr_min_pct': 0.019801483881744027, 'atr_max_pct': 0.1269006763878114, 'tp_mult': 2.4367383648502825, 'tsl_mult': 0.9129759592230813, 'strategy': 'breakout', 'time_stop': 89, 'use_sma': False, 'use_atr': False, 'use_adx': True, 'use_ema': False, 'use_spike': True, 'rsi_required': False, 'edge_k': 1.3605120068463148, 'edge_cap': 0.31507355966926953, 'bull_strategy': 'mean_reversion', 'bull_bb_std_mult': 3.5940130526660052, 'bull_rsi_os': 39, 'bull_rsi_ob': 76, 'bull_adx_thresh': 10.673398474935837, 'bull_atr_min_pct': 0.0049130862748383, 'bull_atr_max_pct': 0.0275519165106101, 'bull_tp_mult': 1.7675900240587987, 'bull_tsl_mult': 0.81544356522127, 'bull_time_stop': 133, 'bull_use_sma': True, 'bull_use_ema': False, 'bull_use_atr': True, 'bull_use_adx': False, 'bull_use_spike': False, 'bull_rsi_required': False, 'bear_strategy': 'mean_reversion', 'bear_bb_std_mult': 3.5978874199073383, 'bear_rsi_os': 8, 'bear_rsi_ob': 47, 'bear_adx_thresh': 20.900620175588855, 'bear_atr_min_pct': 0.02236646946653546, 'bear_atr_max_pct': 0.04226173105952799, 'bear_tp_mult': 2.740414064071717, 'bear_tsl_mult': 0.25333718966208757, 'bear_time_stop': 198, 'bear_use_sma': False, 'bear_use_ema': True, 'bear_use_atr': True, 'bear_use_adx': True, 'bear_use_spike': True, 'bear_rsi_required': True, 'sideways_strategy': 'mean_reversion', 'sideways_bb_std_mult': 1.3427494822075978, 'sideways_rsi_os': 37, 'sideways_rsi_ob': 65, 'sideways_adx_thresh': 33.076920635059544, 'sideways_atr_min_pct': 0.028803867414263554, 'sideways_atr_max_pct': 0.1319845657585284, 'sideways_tp_mult': 2.0387051602166557, 'sideways_tsl_mult': 0.602445653932778, 'sideways_time_stop': 185, 'sideways_use_sma': False, 'sideways_use_ema': True, 'sideways_use_atr': True, 'sideways_use_adx': True, 'sideways_use_spike': False, 'sideways_rsi_required': False}.
[I 2025-08-31 05:03:22,815] Trial 546 finished with values: [-1000000000.0, 1000000000.0] and parameters: {'p_sma': 55, 'p_std': 17, 'p_atr': 22, 'p_adx': 29, 'rsi_period': 11, 'ema1': 14, 'ema2': 14, 'slip_atr_k': 0.20516559984309982, 'slip_spread_k': 0.08201405203101705, 'spread_hl_frac': 0.010768022983089577, 'bb_std_mult': 1.4031200748548587, 'rsi_os': 54, 'rsi_ob': 91, 'vol_spike': 0.022007203115085045, 'adx_thresh': 10.241609197515183, 'atr_min_pct': 0.024236726729392453, 'atr_max_pct': 0.1309966280047148, 'tp_mult': 2.3977536789811293, 'tsl_mult': 0.18598251483603917, 'strategy': 'mean_reversion', 'time_stop': 34, 'use_sma': False, 'use_atr': False, 'use_adx': False, 'use_ema': False, 'use_spike': True, 'rsi_required': True, 'edge_k': 1.576009177309449, 'edge_cap': 0.9823969327798965, 'bull_strategy': 'mean_reversion', 'bull_bb_std_mult': 3.385820502401087, 'bull_rsi_os': 12, 'bull_rsi_ob': 89, 'bull_adx_thresh': 20.6904038416592, 'bull_atr_min_pct': 0.004788128066184345, 'bull_atr_max_pct': 0.053262529618747514, 'bull_tp_mult': 1.7783974867511283, 'bull_tsl_mult': 0.863815088366442, 'bull_time_stop': 287, 'bull_use_sma': False, 'bull_use_ema': True, 'bull_use_atr': True, 'bull_use_adx': True, 'bull_use_spike': False, 'bull_rsi_required': True, 'bear_strategy': 'mean_reversion', 'bear_bb_std_mult': 0.9195525373556035, 'bear_rsi_os': 9, 'bear_rsi_ob': 47, 'bear_adx_thresh': 21.058705105908334, 'bear_atr_min_pct': 0.024506529959068154, 'bear_atr_max_pct': 0.042231169064669664, 'bear_tp_mult': 2.705724091098332, 'bear_tsl_mult': 0.19058872942343882, 'bear_time_stop': 189, 'bear_use_sma': True, 'bear_use_ema': False, 'bear_use_atr': False, 'bear_use_adx': False, 'bear_use_spike': True, 'bear_rsi_required': True, 'sideways_strategy': 'breakout', 'sideways_bb_std_mult': 1.059969778998959, 'sideways_rsi_os': 26, 'sideways_rsi_ob': 54, 'sideways_adx_thresh': 11.911072447470142, 'sideways_atr_min_pct': 0.0012370618904713488, 'sideways_atr_max_pct': 0.049695045312763385, 'sideways_tp_mult': 1.4273058124150335, 'sideways_tsl_mult': 0.6049055615410361, 'sideways_time_stop': 212, 'sideways_use_sma': False, 'sideways_use_ema': False, 'sideways_use_atr': False, 'sideways_use_adx': True, 'sideways_use_spike': True, 'sideways_rsi_required': True}.
[I 2025-08-31 05:03:22,852] Trial 548 finished with values: [-1000000000.0, 1000000000.0] and parameters: {'p_sma': 55, 'p_std': 17, 'p_atr': 23, 'p_adx': 22, 'rsi_period': 19, 'ema1': 21, 'ema2': 29, 'slip_atr_k': 0.014576511864641595, 'slip_spread_k': 0.9093461263558141, 'spread_hl_frac': 0.03883241551246111, 'bb_std_mult': 1.9136197215841946, 'rsi_os': 54, 'rsi_ob': 60, 'vol_spike': 0.18185396151459932, 'adx_thresh': 10.089984529338611, 'atr_min_pct': 0.024310243512907524, 'atr_max_pct': 0.1156912079122283, 'tp_mult': 1.3342347955128986, 'tsl_mult': 0.8444864070569851, 'strategy': 'mean_reversion', 'time_stop': 37, 'use_sma': True, 'use_atr': True, 'use_adx': False, 'use_ema': True, 'use_spike': False, 'rsi_required': True, 'edge_k': 1.2776449762954254, 'edge_cap': 0.9998300105019404, 'bull_strategy': 'mean_reversion', 'bull_bb_std_mult': 1.2669017802129243, 'bull_rsi_os': 21, 'bull_rsi_ob': 81, 'bull_adx_thresh': 12.560490580457536, 'bull_atr_min_pct': 0.0020031323779586955, 'bull_atr_max_pct': 0.05282249923308742, 'bull_tp_mult': 1.933630781254491, 'bull_tsl_mult': 0.5078605901795976, 'bull_time_stop': 153, 'bull_use_sma': False, 'bull_use_ema': False, 'bull_use_atr': False, 'bull_use_adx': True, 'bull_use_spike': True, 'bull_rsi_required': True, 'bear_strategy': 'breakout', 'bear_bb_std_mult': 1.9867584203017927, 'bear_rsi_os': 9, 'bear_rsi_ob': 68, 'bear_adx_thresh': 21.348223583777425, 'bear_atr_min_pct': 0.024554719657788836, 'bear_atr_max_pct': 0.049006634640454565, 'bear_tp_mult': 2.7715567686068137, 'bear_tsl_mult': 0.19948296151522749, 'bear_time_stop': 189, 'bear_use_sma': True, 'bear_use_ema': True, 'bear_use_atr': False, 'bear_use_adx': False, 'bear_use_spike': True, 'bear_rsi_required': True, 'sideways_strategy': 'breakout', 'sideways_bb_std_mult': 3.3240565671473954, 'sideways_rsi_os': 26, 'sideways_rsi_ob': 92, 'sideways_adx_thresh': 11.763475572924566, 'sideways_atr_min_pct': 0.0012647587146054368, 'sideways_atr_max_pct': 0.14591480422608705, 'sideways_tp_mult': 1.1565147533203692, 'sideways_tsl_mult': 0.6320399666625786, 'sideways_time_stop': 215, 'sideways_use_sma': False, 'sideways_use_ema': False, 'sideways_use_atr': False, 'sideways_use_adx': False, 'sideways_use_spike': True, 'sideways_rsi_required': True}.
[I 2025-08-31 05:04:03,284] Trial 545 finished with values: [-1000000000.0, 1000000000.0] and parameters: {'p_sma': 53, 'p_std': 14, 'p_atr': 11, 'p_adx': 29, 'rsi_period': 18, 'ema1': 21, 'ema2': 16, 'slip_atr_k': 0.2044664334010307, 'slip_spread_k': 0.9017402013352949, 'spread_hl_frac': 0.0481474077599946, 'bb_std_mult': 1.6779290560764295, 'rsi_os': 44, 'rsi_ob': 58, 'vol_spike': 0.2654438318476622, 'adx_thresh': 11.841364515092875, 'atr_min_pct': 0.029301522486911206, 'atr_max_pct': 0.12772741040168795, 'tp_mult': 2.442636178211011, 'tsl_mult': 0.8322823833263505, 'strategy': 'breakout', 'time_stop': 32, 'use_sma': False, 'use_atr': False, 'use_adx': True, 'use_ema': False, 'use_spike': True, 'rsi_required': True, 'edge_k': 0.6974210168924948, 'edge_cap': 0.5313989377945894, 'bull_strategy': 'mean_reversion', 'bull_bb_std_mult': 2.2110594289406276, 'bull_rsi_os': 14, 'bull_rsi_ob': 77, 'bull_adx_thresh': 22.7665244192683, 'bull_atr_min_pct': 0.004544064852218593, 'bull_atr_max_pct': 0.06355893324800266, 'bull_tp_mult': 1.5275833882773224, 'bull_tsl_mult': 0.86795317597036, 'bull_time_stop': 132, 'bull_use_sma': True, 'bull_use_ema': True, 'bull_use_atr': True, 'bull_use_adx': False, 'bull_use_spike': False, 'bull_rsi_required': False, 'bear_strategy': 'mean_reversion', 'bear_bb_std_mult': 3.4629345051683376, 'bear_rsi_os': 10, 'bear_rsi_ob': 72, 'bear_adx_thresh': 21.09636599065836, 'bear_atr_min_pct': 0.020789215842882507, 'bear_atr_max_pct': 0.02770035058445868, 'bear_tp_mult': 2.714255304764397, 'bear_tsl_mult': 0.19301516311557054, 'bear_time_stop': 197, 'bear_use_sma': False, 'bear_use_ema': False, 'bear_use_atr': True, 'bear_use_adx': True, 'bear_use_spike': True, 'bear_rsi_required': True, 'sideways_strategy': 'mean_reversion', 'sideways_bb_std_mult': 2.107321084104013, 'sideways_rsi_os': 26, 'sideways_rsi_ob': 55, 'sideways_adx_thresh': 26.746387358119126, 'sideways_atr_min_pct': 0.013496978219013604, 'sideways_atr_max_pct': 0.10840083501452803, 'sideways_tp_mult': 1.4155111814393675, 'sideways_tsl_mult': 0.5977902992655243, 'sideways_time_stop': 56, 'sideways_use_sma': False, 'sideways_use_ema': True, 'sideways_use_atr': True, 'sideways_use_adx': True, 'sideways_use_spike': False, 'sideways_rsi_required': False}.
[I 2025-08-31 05:04:03,721] Trial 547 finished with values: [-1000000000.0, 1000000000.0] and parameters: {'p_sma': 51, 'p_std': 11, 'p_atr': 12, 'p_adx': 13, 'rsi_period': 11, 'ema1': 16, 'ema2': 11, 'slip_atr_k': 0.013345335788124829, 'slip_spread_k': 0.08537891466565112, 'spread_hl_frac': 0.010942950199723975, 'bb_std_mult': 2.7294323607629525, 'rsi_os': 44, 'rsi_ob': 73, 'vol_spike': 0.021731207993564785, 'adx_thresh': 13.83494088992601, 'atr_min_pct': 0.0197556256628715, 'atr_max_pct': 0.11978851564504418, 'tp_mult': 2.4071211167421005, 'tsl_mult': 0.9120481324217249, 'strategy': 'mean_reversion', 'time_stop': 35, 'use_sma': False, 'use_atr': False, 'use_adx': True, 'use_ema': False, 'use_spike': True, 'rsi_required': True, 'edge_k': 1.5785721398738952, 'edge_cap': 0.4507353607054341, 'bull_strategy': 'mean_reversion', 'bull_bb_std_mult': 3.5955416372746485, 'bull_rsi_os': 12, 'bull_rsi_ob': 77, 'bull_adx_thresh': 23.269221440781134, 'bull_atr_min_pct': 0.019765610183549852, 'bull_atr_max_pct': 0.052692402894329186, 'bull_tp_mult': 1.7718843850427888, 'bull_tsl_mult': 0.3753007778220664, 'bull_time_stop': 132, 'bull_use_sma': True, 'bull_use_ema': False, 'bull_use_atr': True, 'bull_use_adx': False, 'bull_use_spike': False, 'bull_rsi_required': False, 'bear_strategy': 'mean_reversion', 'bear_bb_std_mult': 3.130045615328079, 'bear_rsi_os': 15, 'bear_rsi_ob': 49, 'bear_adx_thresh': 10.298395097964262, 'bear_atr_min_pct': 0.020711693120617786, 'bear_atr_max_pct': 0.04294538365355004, 'bear_tp_mult': 2.770998184265652, 'bear_tsl_mult': 0.19448248529206008, 'bear_time_stop': 188, 'bear_use_sma': False, 'bear_use_ema': True, 'bear_use_atr': False, 'bear_use_adx': False, 'bear_use_spike': True, 'bear_rsi_required': True, 'sideways_strategy': 'breakout', 'sideways_bb_std_mult': 3.465528198172084, 'sideways_rsi_os': 26, 'sideways_rsi_ob': 54, 'sideways_adx_thresh': 12.162586945997283, 'sideways_atr_min_pct': 0.024989259934310604, 'sideways_atr_max_pct': 0.031514177846966765, 'sideways_tp_mult': 2.0016777896396385, 'sideways_tsl_mult': 0.6119184184467842, 'sideways_time_stop': 53, 'sideways_use_sma': False, 'sideways_use_ema': True, 'sideways_use_atr': True, 'sideways_use_adx': True, 'sideways_use_spike': False, 'sideways_rsi_required': False}.
