[I 2025-08-31 04:04:30,307] Trial 244 finished with values: [-0.015343400861756007, 0.015297520024994063] and parameters: {'p_sma': 54, 'p_std': 16, 'p_atr': 28, 'p_adx': 9, 'rsi_period': 25, 'ema1': 15, 'ema2': 31, 'slip_atr_k': 0.023102673086794385, 'slip_spread_k': 0.036437110647285324, 'spread_hl_frac': 0.00991469504624621, 'bb_std_mult': 2.4732886308198743, 'rsi_os': 43, 'rsi_ob': 73, 'vol_spike': 0.041741202880852604, 'adx_thresh': 16.106550681496678, 'atr_min_pct': 0.004825162045970884, 'atr_max_pct': 0.1358619871563714, 'tp_mult': 2.5226019844639698, 'tsl_mult': 0.8561231628779429, 'strategy': 'breakout', 'time_stop': 49, 'use_sma': False, 'use_atr': False, 'use_adx': True, 'use_ema': False, 'use_spike': True, 'rsi_required': False, 'edge_k': 1.4469215772681898, 'edge_cap': 0.7179417735870083, 'bull_strategy': 'mean_reversion', 'bull_bb_std_mult': 3.411315798747949, 'bull_rsi_os': 47, 'bull_rsi_ob': 75, 'bull_adx_thresh': 13.569089889303912, 'bull_atr_min_pct': 0.0018549731937864621, 'bull_atr_max_pct': 0.051173994578013984, 'bull_tp_mult': 2.34433972793472, 'bull_tsl_mult': 0.335499626273315, 'bull_time_stop': 151, 'bull_use_sma': True, 'bull_use_ema': False, 'bull_use_atr': True, 'bull_use_adx': False, 'bull_use_spike': False, 'bull_rsi_required': True, 'bear_strategy': 'breakout', 'bear_bb_std_mult': 0.97046771592574, 'bear_rsi_os': 11, 'bear_rsi_ob': 73, 'bear_adx_thresh': 20.44259785692318, 'bear_atr_min_pct': 0.022625526668507492, 'bear_atr_max_pct': 0.09514954394809218, 'bear_tp_mult': 2.906195706235796, 'bear_tsl_mult': 0.5197813630502713, 'bear_time_stop': 196, 'bear_use_sma': False, 'bear_use_ema': True, 'bear_use_atr': True, 'bear_use_adx': True, 'bear_use_spike': True, 'bear_rsi_required': True, 'sideways_strategy': 'mean_reversion', 'sideways_bb_std_mult': 0.8126463672604891, 'sideways_rsi_os': 43, 'sideways_rsi_ob': 52, 'sideways_adx_thresh': 10.052242592440955, 'sideways_atr_min_pct': 0.013820860318067021, 'sideways_atr_max_pct': 0.11306037515448994, 'sideways_tp_mult': 1.9887595646272374, 'sideways_tsl_mult': 0.5401222160902543, 'sideways_time_stop': 72, 'sideways_use_sma': False, 'sideways_use_ema': True, 'sideways_use_atr': True, 'sideways_use_adx': True, 'sideways_use_spike': False, 'sideways_rsi_required': False}.
[I 2025-08-31 04:04:30,985] Trial 243 finished with values: [-1000000000.0, 1000000000.0] and parameters: {'p_sma': 54, 'p_std': 46, 'p_atr': 25, 'p_adx': 9, 'rsi_period': 26, 'ema1': 25, 'ema2': 36, 'slip_atr_k': 0.22870360962969355, 'slip_spread_k': 0.03141612933318583, 'spread_hl_frac': 0.008709950702425926, 'bb_std_mult': 2.322621074716832, 'rsi_os': 39, 'rsi_ob': 93, 'vol_spike': 0.043867009682711594, 'adx_thresh': 15.94470534129397, 'atr_min_pct': 0.0048262993015236785, 'atr_max_pct': 0.12126550527013195, 'tp_mult': 1.7578675870814313, 'tsl_mult': 0.840388317503905, 'strategy': 'mean_reversion', 'time_stop': 44, 'use_sma': False, 'use_atr': False, 'use_adx': True, 'use_ema': False, 'use_spike': True, 'rsi_required': False, 'edge_k': 0.13833598376944523, 'edge_cap': 0.9287370484737354, 'bull_strategy': 'mean_reversion', 'bull_bb_std_mult': 3.5997552807910376, 'bull_rsi_os': 47, 'bull_rsi_ob': 75, 'bull_adx_thresh': 6.120755000322164, 'bull_atr_min_pct': 0.0035873317648926796, 'bull_atr_max_pct': 0.050526481836156364, 'bull_tp_mult': 1.5888308386145285, 'bull_tsl_mult': 0.8863042988652619, 'bull_time_stop': 42, 'bull_use_sma': True, 'bull_use_ema': False, 'bull_use_atr': True, 'bull_use_adx': False, 'bull_use_spike': False, 'bull_rsi_required': True, 'bear_strategy': 'breakout', 'bear_bb_std_mult': 0.96980139541192, 'bear_rsi_os': 11, 'bear_rsi_ob': 86, 'bear_adx_thresh': 19.911940212823794, 'bear_atr_min_pct': 0.024059088331932942, 'bear_atr_max_pct': 0.040890453721468004, 'bear_tp_mult': 2.867725312377986, 'bear_tsl_mult': 0.5248988445361435, 'bear_time_stop': 191, 'bear_use_sma': False, 'bear_use_ema': True, 'bear_use_atr': True, 'bear_use_adx': True, 'bear_use_spike': True, 'bear_rsi_required': True, 'sideways_strategy': 'breakout', 'sideways_bb_std_mult': 1.767417629613231, 'sideways_rsi_os': 6, 'sideways_rsi_ob': 53, 'sideways_adx_thresh': 17.189238615126285, 'sideways_atr_min_pct': 0.011972336522769234, 'sideways_atr_max_pct': 0.12287211649677407, 'sideways_tp_mult': 1.9971787017277738, 'sideways_tsl_mult': 0.529913592663337, 'sideways_time_stop': 84, 'sideways_use_sma': False, 'sideways_use_ema': True, 'sideways_use_atr': True, 'sideways_use_adx': True, 'sideways_use_spike': False, 'sideways_rsi_required': False}.
[I 2025-08-31 04:05:15,243] Trial 248 finished with values: [-1000000000.0, 1000000000.0] and parameters: {'p_sma': 53, 'p_std': 18, 'p_atr': 24, 'p_adx': 10, 'rsi_period': 23, 'ema1': 13, 'ema2': 49, 'slip_atr_k': 0.02272613977616307, 'slip_spread_k': 0.6697661199640621, 'spread_hl_frac': 0.009769154538602694, 'bb_std_mult': 3.4916375552714087, 'rsi_os': 43, 'rsi_ob': 56, 'vol_spike': 0.02170512253711484, 'adx_thresh': 7.970523184371396, 'atr_min_pct': 0.028846528380093436, 'atr_max_pct': 0.13478335919500642, 'tp_mult': 2.504996023171189, 'tsl_mult': 0.8705245333574573, 'strategy': 'mean_reversion', 'time_stop': 36, 'use_sma': False, 'use_atr': False, 'use_adx': True, 'use_ema': False, 'use_spike': True, 'rsi_required': False, 'edge_k': 1.4121484510135236, 'edge_cap': 0.5668547808218436, 'bull_strategy': 'mean_reversion', 'bull_bb_std_mult': 3.5189941810713896, 'bull_rsi_os': 15, 'bull_rsi_ob': 78, 'bull_adx_thresh': 13.332802601163694, 'bull_atr_min_pct': 0.02280376571079047, 'bull_atr_max_pct': 0.04454156580311326, 'bull_tp_mult': 1.6395830582014363, 'bull_tsl_mult': 0.9058113524232327, 'bull_time_stop': 138, 'bull_use_sma': True, 'bull_use_ema': False, 'bull_use_atr': True, 'bull_use_adx': True, 'bull_use_spike': False, 'bull_rsi_required': True, 'bear_strategy': 'breakout', 'bear_bb_std_mult': 0.9736001438231549, 'bear_rsi_os': 47, 'bear_rsi_ob': 73, 'bear_adx_thresh': 28.96832463311249, 'bear_atr_min_pct': 0.022732608959421856, 'bear_atr_max_pct': 0.10809848862579804, 'bear_tp_mult': 1.7125582938345245, 'bear_tsl_mult': 0.16412548730473497, 'bear_time_stop': 185, 'bear_use_sma': True, 'bear_use_ema': True, 'bear_use_atr': True, 'bear_use_adx': True, 'bear_use_spike': True, 'bear_rsi_required': True, 'sideways_strategy': 'breakout', 'sideways_bb_std_mult': 0.8573046675556463, 'sideways_rsi_os': 19, 'sideways_rsi_ob': 74, 'sideways_adx_thresh': 10.528297221731883, 'sideways_atr_min_pct': 0.006852778559997981, 'sideways_atr_max_pct': 0.11272778778127521, 'sideways_tp_mult': 2.0338063972635396, 'sideways_tsl_mult': 0.6084937150912577, 'sideways_time_stop': 36, 'sideways_use_sma': False, 'sideways_use_ema': True, 'sideways_use_atr': True, 'sideways_use_adx': True, 'sideways_use_spike': False, 'sideways_rsi_required': True}.
[I 2025-08-31 04:05:16,720] Trial 247 finished with values: [-1000000000.0, 1000000000.0] and parameters: {'p_sma': 53, 'p_std': 28, 'p_atr': 24, 'p_adx': 28, 'rsi_period': 25, 'ema1': 13, 'ema2': 48, 'slip_atr_k': 0.015338176761135507, 'slip_spread_k': 0.09927505126274169, 'spread_hl_frac': 0.010020800980928807, 'bb_std_mult': 1.8056080969117836, 'rsi_os': 38, 'rsi_ob': 60, 'vol_spike': 0.02080631707465149, 'adx_thresh': 18.01342881014811, 'atr_min_pct': 0.02374138949648104, 'atr_max_pct': 0.1049125687068311, 'tp_mult': 2.5251961700298957, 'tsl_mult': 0.8875264119382008, 'strategy': 'mean_reversion', 'time_stop': 52, 'use_sma': False, 'use_atr': False, 'use_adx': True, 'use_ema': False, 'use_spike': True, 'rsi_required': False, 'edge_k': 1.4002934006248562, 'edge_cap': 0.5668222042624074, 'bull_strategy': 'mean_reversion', 'bull_bb_std_mult': 3.5173658242403025, 'bull_rsi_os': 51, 'bull_rsi_ob': 78, 'bull_adx_thresh': 13.793249033603532, 'bull_atr_min_pct': 0.022989685024247496, 'bull_atr_max_pct': 0.04418190637598232, 'bull_tp_mult': 1.5760299993985274, 'bull_tsl_mult': 0.9032389080475567, 'bull_time_stop': 29, 'bull_use_sma': True, 'bull_use_ema': False, 'bull_use_atr': True, 'bull_use_adx': False, 'bull_use_spike': False, 'bull_rsi_required': True, 'bear_strategy': 'breakout', 'bear_bb_std_mult': 0.9734675221184276, 'bear_rsi_os': 11, 'bear_rsi_ob': 47, 'bear_adx_thresh': 5.76538198531509, 'bear_atr_min_pct': 0.023043294986630748, 'bear_atr_max_pct': 0.03921720602280322, 'bear_tp_mult': 2.8800167936311447, 'bear_tsl_mult': 0.2638665512520823, 'bear_time_stop': 189, 'bear_use_sma': False, 'bear_use_ema': True, 'bear_use_atr': True, 'bear_use_adx': True, 'bear_use_spike': True, 'bear_rsi_required': True, 'sideways_strategy': 'breakout', 'sideways_bb_std_mult': 0.8945162848604726, 'sideways_rsi_os': 8, 'sideways_rsi_ob': 55, 'sideways_adx_thresh': 10.489419528560154, 'sideways_atr_min_pct': 0.012042678036065235, 'sideways_atr_max_pct': 0.1131082031962493, 'sideways_tp_mult': 2.0235479445224263, 'sideways_tsl_mult': 0.6028740752708562, 'sideways_time_stop': 84, 'sideways_use_sma': False, 'sideways_use_ema': True, 'sideways_use_atr': True, 'sideways_use_adx': True, 'sideways_use_spike': False, 'sideways_rsi_required': False}.
[I 2025-08-31 04:05:17,551] Trial 245 finished with values: [-1000000000.0, 1000000000.0] and parameters: {'p_sma': 53, 'p_std': 46, 'p_atr': 16, 'p_adx': 9, 'rsi_period': 25, 'ema1': 8, 'ema2': 35, 'slip_atr_k': 0.016816522643953703, 'slip_spread_k': 0.118691562201796, 'spread_hl_frac': 0.010611963177053324, 'bb_std_mult': 2.297522230178503, 'rsi_os': 38, 'rsi_ob': 60, 'vol_spike': 0.09965990004726742, 'adx_thresh': 15.8980152326787, 'atr_min_pct': 0.028766328732576684, 'atr_max_pct': 0.1315706940971259, 'tp_mult': 1.7503982886529645, 'tsl_mult': 0.8639166302487649, 'strategy': 'mean_reversion', 'time_stop': 52, 'use_sma': False, 'use_atr': False, 'use_adx': True, 'use_ema': False, 'use_spike': True, 'rsi_required': False, 'edge_k': 0.1407199293625998, 'edge_cap': 0.7177161506005934, 'bull_strategy': 'mean_reversion', 'bull_bb_std_mult': 3.411453502439985, 'bull_rsi_os': 15, 'bull_rsi_ob': 75, 'bull_adx_thresh': 13.469209357269339, 'bull_atr_min_pct': 0.003646514641967946, 'bull_atr_max_pct': 0.04432593880883176, 'bull_tp_mult': 2.3478101911682634, 'bull_tsl_mult': 0.8851931557485119, 'bull_time_stop': 126, 'bull_use_sma': True, 'bull_use_ema': False, 'bull_use_atr': True, 'bull_use_adx': False, 'bull_use_spike': False, 'bull_rsi_required': True, 'bear_strategy': 'breakout', 'bear_bb_std_mult': 0.9335537822056647, 'bear_rsi_os': 11, 'bear_rsi_ob': 73, 'bear_adx_thresh': 20.32465538858926, 'bear_atr_min_pct': 0.023069401496243133, 'bear_atr_max_pct': 0.09913354025873175, 'bear_tp_mult': 2.925810708971367, 'bear_tsl_mult': 0.25689457813992117, 'bear_time_stop': 198, 'bear_use_sma': False, 'bear_use_ema': True, 'bear_use_atr': True, 'bear_use_adx': True, 'bear_use_spike': True, 'bear_rsi_required': True, 'sideways_strategy': 'breakout', 'sideways_bb_std_mult': 0.8794066112963457, 'sideways_rsi_os': 44, 'sideways_rsi_ob': 74, 'sideways_adx_thresh': 10.571909817438172, 'sideways_atr_min_pct': 0.012225850955605185, 'sideways_atr_max_pct': 0.08602587806288849, 'sideways_tp_mult': 1.9878519770936038, 'sideways_tsl_mult': 0.5332545486832649, 'sideways_time_stop': 70, 'sideways_use_sma': False, 'sideways_use_ema': True, 'sideways_use_atr': True, 'sideways_use_adx': True, 'sideways_use_spike': False, 'sideways_rsi_required': False}.
[I 2025-08-31 04:05:17,875] Trial 246 finished with values: [-0.02452551839887751, 0.024470431340550332] and parameters: {'p_sma': 53, 'p_std': 28, 'p_atr': 24, 'p_adx': 28, 'rsi_period': 25, 'ema1': 13, 'ema2': 56, 'slip_atr_k': 0.2341029445640606, 'slip_spread_k': 0.6767000868815294, 'spread_hl_frac': 0.006309041704704773, 'bb_std_mult': 2.2992489730371872, 'rsi_os': 46, 'rsi_ob': 60, 'vol_spike': 0.08378509978476308, 'adx_thresh': 16.146491237293304, 'atr_min_pct': 0.027139038302615697, 'atr_max_pct': 0.10541420749010266, 'tp_mult': 2.525591485380822, 'tsl_mult': 0.8839139933963894, 'strategy': 'mean_reversion', 'time_stop': 36, 'use_sma': False, 'use_atr': False, 'use_adx': True, 'use_ema': False, 'use_spike': True, 'rsi_required': False, 'edge_k': 1.3867243523472772, 'edge_cap': 0.9396915158619042, 'bull_strategy': 'mean_reversion', 'bull_bb_std_mult': 3.5237835319670396, 'bull_rsi_os': 47, 'bull_rsi_ob': 78, 'bull_adx_thresh': 13.85106813298037, 'bull_atr_min_pct': 0.0011855995686462471, 'bull_atr_max_pct': 0.04497628103492325, 'bull_tp_mult': 1.5795277092537323, 'bull_tsl_mult': 0.3270051341404091, 'bull_time_stop': 25, 'bull_use_sma': True, 'bull_use_ema': False, 'bull_use_atr': True, 'bull_use_adx': True, 'bull_use_spike': False, 'bull_rsi_required': True, 'bear_strategy': 'breakout', 'bear_bb_std_mult': 0.9826049585665948, 'bear_rsi_os': 48, 'bear_rsi_ob': 48, 'bear_adx_thresh': 29.170238539984005, 'bear_atr_min_pct': 0.022814644083168314, 'bear_atr_max_pct': 0.03610747706153888, 'bear_tp_mult': 2.9404344213679376, 'bear_tsl_mult': 0.040330931309794205, 'bear_time_stop': 188, 'bear_use_sma': True, 'bear_use_ema': True, 'bear_use_atr': True, 'bear_use_adx': True, 'bear_use_spike': True, 'bear_rsi_required': True, 'sideways_strategy': 'breakout', 'sideways_bb_std_mult': 0.8875286971816959, 'sideways_rsi_os': 39, 'sideways_rsi_ob': 55, 'sideways_adx_thresh': 10.715471497548466, 'sideways_atr_min_pct': 0.005008447331853322, 'sideways_atr_max_pct': 0.03996446676816427, 'sideways_tp_mult': 2.0421584197991343, 'sideways_tsl_mult': 0.6099740281949413, 'sideways_time_stop': 69, 'sideways_use_sma': False, 'sideways_use_ema': True, 'sideways_use_atr': True, 'sideways_use_adx': True, 'sideways_use_spike': False, 'sideways_rsi_required': True}.
[I 2025-08-31 04:06:01,773] Trial 251 finished with values: [-0.021384980039824586, 0.02130914388805987] and parameters: {'p_sma': 55, 'p_std': 16, 'p_atr': 24, 'p_adx': 20, 'rsi_period': 23, 'ema1': 15, 'ema2': 15, 'slip_atr_k': 0.24258655803498946, 'slip_spread_k': 0.14846768161945834, 'spread_hl_frac': 0.049816855851419345, 'bb_std_mult': 3.171596262611304, 'rsi_os': 28, 'rsi_ob': 76, 'vol_spike': 0.2634119134864232, 'adx_thresh': 16.82092615256699, 'atr_min_pct': 0.026372618455874595, 'atr_max_pct': 0.10153244675834022, 'tp_mult': 2.640170055508508, 'tsl_mult': 0.9004522499574286, 'strategy': 'breakout', 'time_stop': 178, 'use_sma': False, 'use_atr': True, 'use_adx': False, 'use_ema': False, 'use_spike': True, 'rsi_required': False, 'edge_k': 1.5266926434534591, 'edge_cap': 0.9652852950923557, 'bull_strategy': 'mean_reversion', 'bull_bb_std_mult': 3.478995364578295, 'bull_rsi_os': 12, 'bull_rsi_ob': 76, 'bull_adx_thresh': 15.502483884131763, 'bull_atr_min_pct': 0.001009934416555983, 'bull_atr_max_pct': 0.05107252894878645, 'bull_tp_mult': 1.7661767846985799, 'bull_tsl_mult': 0.2580795532622898, 'bull_time_stop': 142, 'bull_use_sma': False, 'bull_use_ema': False, 'bull_use_atr': True, 'bull_use_adx': True, 'bull_use_spike': False, 'bull_rsi_required': True, 'bear_strategy': 'mean_reversion', 'bear_bb_std_mult': 2.1878599695281844, 'bear_rsi_os': 8, 'bear_rsi_ob': 48, 'bear_adx_thresh': 21.75033171285631, 'bear_atr_min_pct': 0.024804615637614623, 'bear_atr_max_pct': 0.03640229363125278, 'bear_tp_mult': 1.1016541558308424, 'bear_tsl_mult': 0.04358531395473991, 'bear_time_stop': 116, 'bear_use_sma': True, 'bear_use_ema': True, 'bear_use_atr': False, 'bear_use_adx': True, 'bear_use_spike': True, 'bear_rsi_required': False, 'sideways_strategy': 'mean_reversion', 'sideways_bb_std_mult': 0.9696204911562913, 'sideways_rsi_os': 23, 'sideways_rsi_ob': 54, 'sideways_adx_thresh': 9.732387844599849, 'sideways_atr_min_pct': 0.005210142776848907, 'sideways_atr_max_pct': 0.09323541056150854, 'sideways_tp_mult': 1.3877905751508193, 'sideways_tsl_mult': 0.5782455005515466, 'sideways_time_stop': 53, 'sideways_use_sma': False, 'sideways_use_ema': False, 'sideways_use_atr': False, 'sideways_use_adx': True, 'sideways_use_spike': True, 'sideways_rsi_required': True}.
[I 2025-08-31 04:06:04,070] Trial 252 finished with values: [-1000000000.0, 1000000000.0] and parameters: {'p_sma': 55, 'p_std': 16, 'p_atr': 24, 'p_adx': 8, 'rsi_period': 54, 'ema1': 15, 'ema2': 21, 'slip_atr_k': 0.24383000556371642, 'slip_spread_k': 0.7632667896118829, 'spread_hl_frac': 0.036426970737903915, 'bb_std_mult': 1.9074858136815651, 'rsi_os': 27, 'rsi_ob': 58, 'vol_spike': 0.26716298100258673, 'adx_thresh': 16.868905744578903, 'atr_min_pct': 0.022072153661975284, 'atr_max_pct': 0.12888229743604165, 'tp_mult': 2.997425092802103, 'tsl_mult': 0.9260171274691789, 'strategy': 'breakout', 'time_stop': 61, 'use_sma': True, 'use_atr': True, 'use_adx': False, 'use_ema': False, 'use_spike': True, 'rsi_required': False, 'edge_k': 0.6670511363252546, 'edge_cap': 0.9658914741571963, 'bull_strategy': 'mean_reversion', 'bull_bb_std_mult': 3.330013377064108, 'bull_rsi_os': 12, 'bull_rsi_ob': 77, 'bull_adx_thresh': 11.012661784615315, 'bull_atr_min_pct': 0.00199735003299155, 'bull_atr_max_pct': 0.05127201145624595, 'bull_tp_mult': 2.4642238258159157, 'bull_tsl_mult': 0.9186466891419722, 'bull_time_stop': 141, 'bull_use_sma': False, 'bull_use_ema': False, 'bull_use_atr': False, 'bull_use_adx': True, 'bull_use_spike': False, 'bull_rsi_required': True, 'bear_strategy': 'mean_reversion', 'bear_bb_std_mult': 0.7907869269334324, 'bear_rsi_os': 7, 'bear_rsi_ob': 81, 'bear_adx_thresh': 34.30418930338444, 'bear_atr_min_pct': 0.0001033452182845028, 'bear_atr_max_pct': 0.04829152345110089, 'bear_tp_mult': 2.1874116732169604, 'bear_tsl_mult': 0.2254249306451801, 'bear_time_stop': 85, 'bear_use_sma': True, 'bear_use_ema': True, 'bear_use_atr': False, 'bear_use_adx': True, 'bear_use_spike': True, 'bear_rsi_required': False, 'sideways_strategy': 'mean_reversion', 'sideways_bb_std_mult': 0.9811386171755249, 'sideways_rsi_os': 23, 'sideways_rsi_ob': 61, 'sideways_adx_thresh': 9.892445891098953, 'sideways_atr_min_pct': 0.014709063985821284, 'sideways_atr_max_pct': 0.10858067497068744, 'sideways_tp_mult': 2.260099691838477, 'sideways_tsl_mult': 0.9592589937013747, 'sideways_time_stop': 195, 'sideways_use_sma': False, 'sideways_use_ema': False, 'sideways_use_atr': False, 'sideways_use_adx': True, 'sideways_use_spike': True, 'sideways_rsi_required': True}.
[I 2025-08-31 04:06:04,071] Trial 250 finished with values: [-1000000000.0, 1000000000.0] and parameters: {'p_sma': 24, 'p_std': 16, 'p_atr': 24, 'p_adx': 9, 'rsi_period': 50, 'ema1': 15, 'ema2': 26, 'slip_atr_k': 0.02932145752531462, 'slip_spread_k': 0.20130377908508468, 'spread_hl_frac': 0.0499753743344893, 'bb_std_mult': 1.9049171852233675, 'rsi_os': 28, 'rsi_ob': 58, 'vol_spike': 0.2647940790228507, 'adx_thresh': 16.47981711735667, 'atr_min_pct': 0.029994893622523923, 'atr_max_pct': 0.13093643158825816, 'tp_mult': 2.7615274454661476, 'tsl_mult': 0.9021801119974618, 'strategy': 'breakout', 'time_stop': 25, 'use_sma': False, 'use_atr': True, 'use_adx': False, 'use_ema': False, 'use_spike': True, 'rsi_required': False, 'edge_k': 1.4567134442940255, 'edge_cap': 0.720272904368745, 'bull_strategy': 'mean_reversion', 'bull_bb_std_mult': 3.392315776027738, 'bull_rsi_os': 16, 'bull_rsi_ob': 76, 'bull_adx_thresh': 11.20353651415772, 'bull_atr_min_pct': 0.022042656974238326, 'bull_atr_max_pct': 0.04588795901890378, 'bull_tp_mult': 2.615547447463244, 'bull_tsl_mult': 0.9259927069169241, 'bull_time_stop': 144, 'bull_use_sma': False, 'bull_use_ema': False, 'bull_use_atr': True, 'bull_use_adx': True, 'bull_use_spike': False, 'bull_rsi_required': True, 'bear_strategy': 'mean_reversion', 'bear_bb_std_mult': 0.7957360956850729, 'bear_rsi_os': 7, 'bear_rsi_ob': 48, 'bear_adx_thresh': 34.22533122087993, 'bear_atr_min_pct': 0.02499093277467995, 'bear_atr_max_pct': 0.046439167595127714, 'bear_tp_mult': 2.9355241112911137, 'bear_tsl_mult': 0.1927019835824183, 'bear_time_stop': 197, 'bear_use_sma': True, 'bear_use_ema': True, 'bear_use_atr': False, 'bear_use_adx': True, 'bear_use_spike': True, 'bear_rsi_required': False, 'sideways_strategy': 'mean_reversion', 'sideways_bb_std_mult': 0.9612242712053056, 'sideways_rsi_os': 39, 'sideways_rsi_ob': 55, 'sideways_adx_thresh': 9.878618870461022, 'sideways_atr_min_pct': 0.014932638164844856, 'sideways_atr_max_pct': 0.08603508901044388, 'sideways_tp_mult': 1.5776716574345857, 'sideways_tsl_mult': 0.5862553667364234, 'sideways_time_stop': 20, 'sideways_use_sma': False, 'sideways_use_ema': False, 'sideways_use_atr': False, 'sideways_use_adx': True, 'sideways_use_spike': True, 'sideways_rsi_required': True}.
