[I 2025-08-31 03:35:08,232] Trial 9 finished with values: [-1000000000.0, 1000000000.0] and parameters: {'p_sma': 38, 'p_std': 53, 'p_atr': 26, 'p_adx': 28, 'rsi_period': 69, 'ema1': 27, 'ema2': 51, 'slip_atr_k': 0.05642041186278113, 'slip_spread_k': 0.4766034471206404, 'spread_hl_frac': 0.031456297637162525, 'bb_std_mult': 2.2658650378252796, 'rsi_os': 9, 'rsi_ob': 71, 'vol_spike': 0.22520350245651233, 'adx_thresh': 23.490586225730322, 'atr_min_pct': 0.00116614094718262, 'atr_max_pct': 0.10366591156308189, 'tp_mult': 1.5509943198894727, 'tsl_mult': 0.8436918220963274, 'strategy': 'breakout', 'time_stop': 102, 'use_sma': True, 'use_atr': True, 'use_adx': True, 'use_ema': True, 'use_spike': False, 'rsi_required': False, 'edge_k': 1.4478513589515443, 'edge_cap': 0.9775688219400077, 'bull_strategy': 'mean_reversion', 'bull_bb_std_mult': 2.2530680343917675, 'bull_rsi_os': 35, 'bull_rsi_ob': 74, 'bull_adx_thresh': 5.806847678328689, 'bull_atr_min_pct': 0.014550447385177367, 'bull_atr_max_pct': 0.09926058442206923, 'bull_tp_mult': 2.789810149605745, 'bull_tsl_mult': 0.40006030027192774, 'bull_time_stop': 213, 'bull_use_sma': True, 'bull_use_ema': False, 'bull_use_atr': True, 'bull_use_adx': False, 'bull_use_spike': False, 'bull_rsi_required': True, 'bear_strategy': 'mean_reversion', 'bear_bb_std_mult': 0.9700545160275356, 'bear_rsi_os': 28, 'bear_rsi_ob': 54, 'bear_adx_thresh': 23.223793116930814, 'bear_atr_min_pct': 0.023125803468987533, 'bear_atr_max_pct': 0.13420942435473504, 'bear_tp_mult': 2.0497230675665197, 'bear_tsl_mult': 0.8388839588840512, 'bear_time_stop': 140, 'bear_use_sma': False, 'bear_use_ema': True, 'bear_use_atr': True, 'bear_use_adx': False, 'bear_use_spike': False, 'bear_rsi_required': False, 'sideways_strategy': 'breakout', 'sideways_bb_std_mult': 1.0111729409129786, 'sideways_rsi_os': 5, 'sideways_rsi_ob': 85, 'sideways_adx_thresh': 31.009051476314948, 'sideways_atr_min_pct': 0.0023047847284852385, 'sideways_atr_max_pct': 0.10400942950918526, 'sideways_tp_mult': 2.287108454183449, 'sideways_tsl_mult': 0.46491470284535674, 'sideways_time_stop': 79, 'sideways_use_sma': False, 'sideways_use_ema': True, 'sideways_use_atr': False, 'sideways_use_adx': False, 'sideways_use_spike': True, 'sideways_rsi_required': False}.
[I 2025-08-31 03:35:08,362] Trial 10 finished with values: [-1000000000.0, 1000000000.0] and parameters: {'p_sma': 23, 'p_std': 48, 'p_atr': 15, 'p_adx': 7, 'rsi_period': 77, 'ema1': 22, 'ema2': 42, 'slip_atr_k': 0.002180567137490985, 'slip_spread_k': 0.3255617452190729, 'spread_hl_frac': 0.023923343182875475, 'bb_std_mult': 1.139570090348485, 'rsi_os': 31, 'rsi_ob': 72, 'vol_spike': 0.2394434542569761, 'adx_thresh': 5.832814677818271, 'atr_min_pct': 0.0008712339326896002, 'atr_max_pct': 0.055837609975496354, 'tp_mult': 2.7765729094571077, 'tsl_mult': 0.22468748245164982, 'strategy': 'breakout', 'time_stop': 170, 'use_sma': False, 'use_atr': True, 'use_adx': False, 'use_ema': False, 'use_spike': True, 'rsi_required': False, 'edge_k': 1.6694933706699764, 'edge_cap': 0.16284114393016133, 'bull_strategy': 'breakout', 'bull_bb_std_mult': 1.7617325511082356, 'bull_rsi_os': 49, 'bull_rsi_ob': 45, 'bull_adx_thresh': 11.920356002940057, 'bull_atr_min_pct': 0.02508214840728858, 'bull_atr_max_pct': 0.12228475194158485, 'bull_tp_mult': 1.0779061796615694, 'bull_tsl_mult': 0.07890604983992211, 'bull_time_stop': 121, 'bull_use_sma': False, 'bull_use_ema': False, 'bull_use_atr': False, 'bull_use_adx': True, 'bull_use_spike': False, 'bull_rsi_required': True, 'bear_strategy': 'mean_reversion', 'bear_bb_std_mult': 3.1040496305769225, 'bear_rsi_os': 14, 'bear_rsi_ob': 60, 'bear_adx_thresh': 6.248582614300057, 'bear_atr_min_pct': 0.020818434547508587, 'bear_atr_max_pct': 0.13851247137792075, 'bear_tp_mult': 1.0391693211800006, 'bear_tsl_mult': 0.8248406746050585, 'bear_time_stop': 188, 'bear_use_sma': True, 'bear_use_ema': True, 'bear_use_atr': False, 'bear_use_adx': False, 'bear_use_spike': False, 'bear_rsi_required': False, 'sideways_strategy': 'mean_reversion', 'sideways_bb_std_mult': 3.5846609004318215, 'sideways_rsi_os': 30, 'sideways_rsi_ob': 61, 'sideways_adx_thresh': 27.901251000013115, 'sideways_atr_min_pct': 0.01844801935235895, 'sideways_atr_max_pct': 0.03336227023193585, 'sideways_tp_mult': 1.9319327109154578, 'sideways_tsl_mult': 0.39485925628384244, 'sideways_time_stop': 218, 'sideways_use_sma': False, 'sideways_use_ema': False, 'sideways_use_atr': True, 'sideways_use_adx': False, 'sideways_use_spike': True, 'sideways_rsi_required': False}.
[I 2025-08-31 03:35:08,482] Trial 13 finished with values: [-1000000000.0, 1000000000.0] and parameters: {'p_sma': 56, 'p_std': 29, 'p_atr': 7, 'p_adx': 14, 'rsi_period': 8, 'ema1': 6, 'ema2': 26, 'slip_atr_k': 0.06851628663893228, 'slip_spread_k': 0.123711171870234, 'spread_hl_frac': 0.019566095589993684, 'bb_std_mult': 3.4866622596844863, 'rsi_os': 35, 'rsi_ob': 45, 'vol_spike': 0.180516237669684, 'adx_thresh': 32.8834200473252, 'atr_min_pct': 0.015983955876985652, 'atr_max_pct': 0.09700070824953014, 'tp_mult': 1.0278914111674031, 'tsl_mult': 0.7183886538420527, 'strategy': 'mean_reversion', 'time_stop': 300, 'use_sma': False, 'use_atr': False, 'use_adx': False, 'use_ema': False, 'use_spike': True, 'rsi_required': True, 'edge_k': 1.964105351367992, 'edge_cap': 0.1572256650638924, 'bull_strategy': 'breakout', 'bull_bb_std_mult': 3.237933133559534, 'bull_rsi_os': 55, 'bull_rsi_ob': 46, 'bull_adx_thresh': 17.124775123559083, 'bull_atr_min_pct': 0.0016328055558179882, 'bull_atr_max_pct': 0.012053955988891273, 'bull_tp_mult': 1.6411609014405866, 'bull_tsl_mult': 0.021292643665912492, 'bull_time_stop': 123, 'bull_use_sma': False, 'bull_use_ema': False, 'bull_use_atr': True, 'bull_use_adx': True, 'bull_use_spike': False, 'bull_rsi_required': True, 'bear_strategy': 'breakout', 'bear_bb_std_mult': 3.566835388545344, 'bear_rsi_os': 36, 'bear_rsi_ob': 77, 'bear_adx_thresh': 14.872646217772619, 'bear_atr_min_pct': 0.01631924412210069, 'bear_atr_max_pct': 0.01291991642518274, 'bear_tp_mult': 2.613502361188866, 'bear_tsl_mult': 0.3687011475061328, 'bear_time_stop': 20, 'bear_use_sma': True, 'bear_use_ema': False, 'bear_use_atr': False, 'bear_use_adx': False, 'bear_use_spike': False, 'bear_rsi_required': False, 'sideways_strategy': 'mean_reversion', 'sideways_bb_std_mult': 0.5797042825192305, 'sideways_rsi_os': 38, 'sideways_rsi_ob': 57, 'sideways_adx_thresh': 16.9655420220211, 'sideways_atr_min_pct': 0.013643025334856364, 'sideways_atr_max_pct': 0.015478690354010463, 'sideways_tp_mult': 1.036105179447119, 'sideways_tsl_mult': 0.5946649156595659, 'sideways_time_stop': 99, 'sideways_use_sma': True, 'sideways_use_ema': False, 'sideways_use_atr': True, 'sideways_use_adx': False, 'sideways_use_spike': True, 'sideways_rsi_required': False}.
[I 2025-08-31 03:35:08,556] Trial 14 finished with values: [-1000000000.0, 1000000000.0] and parameters: {'p_sma': 56, 'p_std': 6, 'p_atr': 7, 'p_adx': 14, 'rsi_period': 7, 'ema1': 5, 'ema2': 24, 'slip_atr_k': 0.08750335803669812, 'slip_spread_k': 0.045043338966966884, 'spread_hl_frac': 0.049967597891230744, 'bb_std_mult': 3.5127815720091924, 'rsi_os': 38, 'rsi_ob': 46, 'vol_spike': 0.15946548186327442, 'adx_thresh': 29.80096147457681, 'atr_min_pct': 0.020768003240341094, 'atr_max_pct': 0.09902399259936613, 'tp_mult': 1.0780634250435557, 'tsl_mult': 0.6793279212749239, 'strategy': 'mean_reversion', 'time_stop': 15, 'use_sma': True, 'use_atr': False, 'use_adx': True, 'use_ema': True, 'use_spike': False, 'rsi_required': True, 'edge_k': 1.9845609049355684, 'edge_cap': 0.6733068719446962, 'bull_strategy': 'breakout', 'bull_bb_std_mult': 3.4757483007270293, 'bull_rsi_os': 55, 'bull_rsi_ob': 95, 'bull_adx_thresh': 34.98034520405771, 'bull_atr_min_pct': 0.001381687935818372, 'bull_atr_max_pct': 0.0245627537267536, 'bull_tp_mult': 1.6482763170190189, 'bull_tsl_mult': 0.9646799324075289, 'bull_time_stop': 176, 'bull_use_sma': False, 'bull_use_ema': True, 'bull_use_atr': True, 'bull_use_adx': True, 'bull_use_spike': True, 'bull_rsi_required': False, 'bear_strategy': 'breakout', 'bear_bb_std_mult': 2.1538850723336687, 'bear_rsi_os': 26, 'bear_rsi_ob': 77, 'bear_adx_thresh': 15.02127026515906, 'bear_atr_min_pct': 0.0017168319243893535, 'bear_atr_max_pct': 0.010006217238329548, 'bear_tp_mult': 2.508340837566736, 'bear_tsl_mult': 0.3320355518035709, 'bear_time_stop': 8, 'bear_use_sma': True, 'bear_use_ema': False, 'bear_use_atr': False, 'bear_use_adx': False, 'bear_use_spike': True, 'bear_rsi_required': False, 'sideways_strategy': 'mean_reversion', 'sideways_bb_std_mult': 0.5163104081881276, 'sideways_rsi_os': 16, 'sideways_rsi_ob': 45, 'sideways_adx_thresh': 16.530560905358232, 'sideways_atr_min_pct': 0.011820593073174962, 'sideways_atr_max_pct': 0.07384761499995798, 'sideways_tp_mult': 1.0535834367377592, 'sideways_tsl_mult': 0.6716952116739087, 'sideways_time_stop': 12, 'sideways_use_sma': True, 'sideways_use_ema': True, 'sideways_use_atr': True, 'sideways_use_adx': False, 'sideways_use_spike': True, 'sideways_rsi_required': True}.
[I 2025-08-31 03:35:08,672] Trial 15 finished with values: [-1000000000.0, 1000000000.0] and parameters: {'p_sma': 38, 'p_std': 7, 'p_atr': 29, 'p_adx': 25, 'rsi_period': 41, 'ema1': 7, 'ema2': 26, 'slip_atr_k': 0.10561149046722905, 'slip_spread_k': 0.01787748467612066, 'spread_hl_frac': 0.04893705696883999, 'bb_std_mult': 0.5279366824135534, 'rsi_os': 43, 'rsi_ob': 95, 'vol_spike': 0.29515152446700044, 'adx_thresh': 8.990164930288433, 'atr_min_pct': 0.027114283921716602, 'atr_max_pct': 0.02313311025359977, 'tp_mult': 2.41675633527089, 'tsl_mult': 0.025426147891521145, 'strategy': 'mean_reversion', 'time_stop': 18, 'use_sma': True, 'use_atr': False, 'use_adx': True, 'use_ema': True, 'use_spike': False, 'rsi_required': True, 'edge_k': 0.14523268550198565, 'edge_cap': 0.7052951422716932, 'bull_strategy': 'breakout', 'bull_bb_std_mult': 3.3897671845723423, 'bull_rsi_os': 23, 'bull_rsi_ob': 64, 'bull_adx_thresh': 34.40874154897303, 'bull_atr_min_pct': 0.029552726577742203, 'bull_atr_max_pct': 0.046949326102176565, 'bull_tp_mult': 2.292751663164792, 'bull_tsl_mult': 0.9975875849661586, 'bull_time_stop': 170, 'bull_use_sma': False, 'bull_use_ema': True, 'bull_use_atr': False, 'bull_use_adx': True, 'bull_use_spike': True, 'bull_rsi_required': False, 'bear_strategy': 'breakout', 'bear_bb_std_mult': 2.2830116756244103, 'bear_rsi_os': 6, 'bear_rsi_ob': 74, 'bear_adx_thresh': 15.350407078700693, 'bear_atr_min_pct': 0.0004370634266146426, 'bear_atr_max_pct': 0.03898559823220989, 'bear_tp_mult': 2.3645816260462307, 'bear_tsl_mult': 0.9983634181192551, 'bear_time_stop': 199, 'bear_use_sma': False, 'bear_use_ema': False, 'bear_use_atr': False, 'bear_use_adx': True, 'bear_use_spike': True, 'bear_rsi_required': False, 'sideways_strategy': 'mean_reversion', 'sideways_bb_std_mult': 2.7191221117467412, 'sideways_rsi_os': 19, 'sideways_rsi_ob': 45, 'sideways_adx_thresh': 19.98402959440628, 'sideways_atr_min_pct': 0.0003752809821647059, 'sideways_atr_max_pct': 0.07057502215379323, 'sideways_tp_mult': 2.9887264671143767, 'sideways_tsl_mult': 0.717371857366619, 'sideways_time_stop': 11, 'sideways_use_sma': True, 'sideways_use_ema': True, 'sideways_use_atr': True, 'sideways_use_adx': False, 'sideways_use_spike': True, 'sideways_rsi_required': True}.
[I 2025-08-31 03:35:08,797] Trial 16 finished with values: [-1000000000.0, 1000000000.0] and parameters: {'p_sma': 39, 'p_std': 40, 'p_atr': 30, 'p_adx': 25, 'rsi_period': 42, 'ema1': 10, 'ema2': 28, 'slip_atr_k': 0.16979898778831987, 'slip_spread_k': 0.1899012451719943, 'spread_hl_frac': 0.0011326391968169425, 'bb_std_mult': 0.5060416063668709, 'rsi_os': 46, 'rsi_ob': 95, 'vol_spike': 0.19856096869266432, 'adx_thresh': 7.79450944925663, 'atr_min_pct': 0.02795338752506524, 'atr_max_pct': 0.01108519491252695, 'tp_mult': 2.4362324650571536, 'tsl_mult': 0.002185816630689341, 'strategy': 'breakout', 'time_stop': 14, 'use_sma': True, 'use_atr': True, 'use_adx': True, 'use_ema': True, 'use_spike': False, 'rsi_required': True, 'edge_k': 0.043688769198324096, 'edge_cap': 0.648085934002237, 'bull_strategy': 'mean_reversion', 'bull_bb_std_mult': 2.842895613879835, 'bull_rsi_os': 20, 'bull_rsi_ob': 62, 'bull_adx_thresh': 27.4551853746488, 'bull_atr_min_pct': 0.02969501162369092, 'bull_atr_max_pct': 0.06277597992896462, 'bull_tp_mult': 2.395226511240405, 'bull_tsl_mult': 0.720091767436237, 'bull_time_stop': 300, 'bull_use_sma': False, 'bull_use_ema': True, 'bull_use_atr': False, 'bull_use_adx': True, 'bull_use_spike': True, 'bull_rsi_required': False, 'bear_strategy': 'breakout', 'bear_bb_std_mult': 0.5071710511696168, 'bear_rsi_os': 9, 'bear_rsi_ob': 72, 'bear_adx_thresh': 17.321365294925414, 'bear_atr_min_pct': 0.010646887767505988, 'bear_atr_max_pct': 0.04594249143058289, 'bear_tp_mult': 2.3540600790961173, 'bear_tsl_mult': 0.025110929534281456, 'bear_time_stop': 217, 'bear_use_sma': False, 'bear_use_ema': False, 'bear_use_atr': True, 'bear_use_adx': True, 'bear_use_spike': True, 'bear_rsi_required': False, 'sideways_strategy': 'breakout', 'sideways_bb_std_mult': 2.6865537298634505, 'sideways_rsi_os': 18, 'sideways_rsi_ob': 94, 'sideways_adx_thresh': 21.356609812652273, 'sideways_atr_min_pct': 0.00025830823080418876, 'sideways_atr_max_pct': 0.07382129398744147, 'sideways_tp_mult': 2.521683499964658, 'sideways_tsl_mult': 0.7313900452228909, 'sideways_time_stop': 300, 'sideways_use_sma': False, 'sideways_use_ema': True, 'sideways_use_atr': True, 'sideways_use_adx': True, 'sideways_use_spike': False, 'sideways_rsi_required': True}.
[I 2025-08-31 03:35:35,453] Trial 11 finished with values: [-1000000000.0, 1000000000.0] and parameters: {'p_sma': 12, 'p_std': 12, 'p_atr': 16, 'p_adx': 12, 'rsi_period': 76, 'ema1': 12, 'ema2': 52, 'slip_atr_k': 0.1691332261082168, 'slip_spread_k': 0.5427875704095605, 'spread_hl_frac': 0.014564081188381019, 'bb_std_mult': 3.0614927152170597, 'rsi_os': 45, 'rsi_ob': 76, 'vol_spike': 0.10852924878302198, 'adx_thresh': 33.371935261086136, 'atr_min_pct': 0.013584046745762206, 'atr_max_pct': 0.10465404247277348, 'tp_mult': 1.385818707567812, 'tsl_mult': 0.6804577448491316, 'strategy': 'breakout', 'time_stop': 223, 'use_sma': True, 'use_atr': True, 'use_adx': False, 'use_ema': False, 'use_spike': True, 'rsi_required': True, 'edge_k': 0.8989487705617087, 'edge_cap': 0.06840285764140892, 'bull_strategy': 'breakout', 'bull_bb_std_mult': 3.259243676936339, 'bull_rsi_os': 14, 'bull_rsi_ob': 84, 'bull_adx_thresh': 11.76396804907177, 'bull_atr_min_pct': 0.029781799118726044, 'bull_atr_max_pct': 0.11265615226810709, 'bull_tp_mult': 1.4006542584200397, 'bull_tsl_mult': 0.09062833884837673, 'bull_time_stop': 291, 'bull_use_sma': False, 'bull_use_ema': False, 'bull_use_atr': True, 'bull_use_adx': True, 'bull_use_spike': True, 'bull_rsi_required': True, 'bear_strategy': 'breakout', 'bear_bb_std_mult': 0.6027335559252563, 'bear_rsi_os': 23, 'bear_rsi_ob': 84, 'bear_adx_thresh': 25.472528570747777, 'bear_atr_min_pct': 0.012052715522616138, 'bear_atr_max_pct': 0.012898805541299413, 'bear_tp_mult': 2.854828021211852, 'bear_tsl_mult': 0.8148766226885209, 'bear_time_stop': 126, 'bear_use_sma': False, 'bear_use_ema': True, 'bear_use_atr': False, 'bear_use_adx': False, 'bear_use_spike': True, 'bear_rsi_required': True, 'sideways_strategy': 'mean_reversion', 'sideways_bb_std_mult': 1.3048918502744522, 'sideways_rsi_os': 38, 'sideways_rsi_ob': 65, 'sideways_adx_thresh': 27.846286009456172, 'sideways_atr_min_pct': 0.01331278598311281, 'sideways_atr_max_pct': 0.1423609875183668, 'sideways_tp_mult': 2.0279928369118765, 'sideways_tsl_mult': 0.788031341322319, 'sideways_time_stop': 171, 'sideways_use_sma': False, 'sideways_use_ema': False, 'sideways_use_atr': False, 'sideways_use_adx': True, 'sideways_use_spike': True, 'sideways_rsi_required': False}.
[I 2025-08-31 03:35:37,342] Trial 12 finished with values: [-1000000000.0, 1000000000.0] and parameters: {'p_sma': 59, 'p_std': 33, 'p_atr': 20, 'p_adx': 16, 'rsi_period': 74, 'ema1': 30, 'ema2': 48, 'slip_atr_k': 0.21821049193853168, 'slip_spread_k': 0.07485151925439926, 'spread_hl_frac': 0.03434161654767917, 'bb_std_mult': 2.7002079015903226, 'rsi_os': 12, 'rsi_ob': 80, 'vol_spike': 0.270061377273174, 'adx_thresh': 18.693179985184038, 'atr_min_pct': 0.018122425748112483, 'atr_max_pct': 0.09794889877803101, 'tp_mult': 1.941063861159475, 'tsl_mult': 0.32384624831580555, 'strategy': 'mean_reversion', 'time_stop': 220, 'use_sma': True, 'use_atr': False, 'use_adx': False, 'use_ema': False, 'use_spike': True, 'rsi_required': True, 'edge_k': 1.3209637410140553, 'edge_cap': 0.48977317733834463, 'bull_strategy': 'mean_reversion', 'bull_bb_std_mult': 2.7766339773538813, 'bull_rsi_os': 46, 'bull_rsi_ob': 73, 'bull_adx_thresh': 13.700718470157675, 'bull_atr_min_pct': 0.0048907262725271195, 'bull_atr_max_pct': 0.0807851454852385, 'bull_tp_mult': 1.5571448417507339, 'bull_tsl_mult': 0.4302564955383099, 'bull_time_stop': 61, 'bull_use_sma': True, 'bull_use_ema': False, 'bull_use_atr': False, 'bull_use_adx': False, 'bull_use_spike': False, 'bull_rsi_required': True, 'bear_strategy': 'mean_reversion', 'bear_bb_std_mult': 0.5027502904260529, 'bear_rsi_os': 22, 'bear_rsi_ob': 79, 'bear_adx_thresh': 34.19545108065039, 'bear_atr_min_pct': 0.020034476461471135, 'bear_atr_max_pct': 0.017170222356589472, 'bear_tp_mult': 2.1315336056850827, 'bear_tsl_mult': 0.8010987813315051, 'bear_time_stop': 192, 'bear_use_sma': False, 'bear_use_ema': True, 'bear_use_atr': True, 'bear_use_adx': True, 'bear_use_spike': True, 'bear_rsi_required': False, 'sideways_strategy': 'breakout', 'sideways_bb_std_mult': 1.105187328470419, 'sideways_rsi_os': 11, 'sideways_rsi_ob': 66, 'sideways_adx_thresh': 7.833612470214023, 'sideways_atr_min_pct': 0.0035640442860322918, 'sideways_atr_max_pct': 0.03133668613662042, 'sideways_tp_mult': 2.3669222766651483, 'sideways_tsl_mult': 0.5162042386759926, 'sideways_time_stop': 168, 'sideways_use_sma': True, 'sideways_use_ema': False, 'sideways_use_atr': True, 'sideways_use_adx': True, 'sideways_use_spike': True, 'sideways_rsi_required': False}.
[I 2025-08-31 03:35:38,950] Trial 18 finished with values: [-1000000000.0, 1000000000.0] and parameters: {'p_sma': 6, 'p_std': 21, 'p_atr': 19, 'p_adx': 10, 'rsi_period': 28, 'ema1': 30, 'ema2': 17, 'slip_atr_k': 0.04181567320093603, 'slip_spread_k': 0.6792572932773062, 'spread_hl_frac': 0.012820565039927113, 'bb_std_mult': 1.9445337572169206, 'rsi_os': 6, 'rsi_ob': 84, 'vol_spike': 0.12365278805891733, 'adx_thresh': 34.89119680621882, 'atr_min_pct': 0.010808669449299651, 'atr_max_pct': 0.07660709632021173, 'tp_mult': 1.8653956150688318, 'tsl_mult': 0.4198730320005676, 'strategy': 'breakout', 'time_stop': 284, 'use_sma': False, 'use_atr': True, 'use_adx': True, 'use_ema': False, 'use_spike': True, 'rsi_required': True, 'edge_k': 0.6195509122831512, 'edge_cap': 0.06691502756847939, 'bull_strategy': 'mean_reversion', 'bull_bb_std_mult': 0.6195703660981235, 'bull_rsi_os': 12, 'bull_rsi_ob': 95, 'bull_adx_thresh': 16.36982880072973, 'bull_atr_min_pct': 0.009009481449863237, 'bull_atr_max_pct': 0.07518167092278949, 'bull_tp_mult': 2.0114183341816902, 'bull_tsl_mult': 0.6969297930563856, 'bull_time_stop': 83, 'bull_use_sma': True, 'bull_use_ema': False, 'bull_use_atr': True, 'bull_use_adx': False, 'bull_use_spike': True, 'bull_rsi_required': True, 'bear_strategy': 'mean_reversion', 'bear_bb_std_mult': 1.2486626408632824, 'bear_rsi_os': 55, 'bear_rsi_ob': 46, 'bear_adx_thresh': 34.60222751359368, 'bear_atr_min_pct': 0.014750244372620099, 'bear_atr_max_pct': 0.07953423656538645, 'bear_tp_mult': 2.9549993100186467, 'bear_tsl_mult': 0.6466765849973857, 'bear_time_stop': 104, 'bear_use_sma': True, 'bear_use_ema': True, 'bear_use_atr': True, 'bear_use_adx': False, 'bear_use_spike': False, 'bear_rsi_required': True, 'sideways_strategy': 'breakout', 'sideways_bb_std_mult': 3.041963668841285, 'sideways_rsi_os': 55, 'sideways_rsi_ob': 61, 'sideways_adx_thresh': 34.99902977083927, 'sideways_atr_min_pct': 0.029288342154075834, 'sideways_atr_max_pct': 0.1427070573269607, 'sideways_tp_mult': 1.7605833938768614, 'sideways_tsl_mult': 0.33695611182269375, 'sideways_time_stop': 186, 'sideways_use_sma': False, 'sideways_use_ema': False, 'sideways_use_atr': True, 'sideways_use_adx': True, 'sideways_use_spike': False, 'sideways_rsi_required': False}.
