[I 2025-08-31 04:15:20,787] Trial 298 finished with values: [-1000000000.0, 1000000000.0] and parameters: {'p_sma': 38, 'p_std': 14, 'p_atr': 15, 'p_adx': 9, 'rsi_period': 69, 'ema1': 14, 'ema2': 24, 'slip_atr_k': 0.01555981000629795, 'slip_spread_k': 0.0636967771811563, 'spread_hl_frac': 0.01042879311521697, 'bb_std_mult': 2.69678743414169, 'rsi_os': 19, 'rsi_ob': 58, 'vol_spike': 0.0868744486146337, 'adx_thresh': 5.4711754188896995, 'atr_min_pct': 0.0030823809554307875, 'atr_max_pct': 0.10924700629918399, 'tp_mult': 2.087516230093649, 'tsl_mult': 0.9057622469349793, 'strategy': 'breakout', 'time_stop': 169, 'use_sma': False, 'use_atr': True, 'use_adx': True, 'use_ema': False, 'use_spike': True, 'rsi_required': True, 'edge_k': 1.5210908654367925, 'edge_cap': 0.24101526382906718, 'bull_strategy': 'mean_reversion', 'bull_bb_std_mult': 3.507612376859461, 'bull_rsi_os': 36, 'bull_rsi_ob': 75, 'bull_adx_thresh': 28.1814466494169, 'bull_atr_min_pct': 0.0029659117439812892, 'bull_atr_max_pct': 0.04691176074524099, 'bull_tp_mult': 1.6284001944875368, 'bull_tsl_mult': 0.9705380619685412, 'bull_time_stop': 14, 'bull_use_sma': True, 'bull_use_ema': False, 'bull_use_atr': True, 'bull_use_adx': True, 'bull_use_spike': False, 'bull_rsi_required': True, 'bear_strategy': 'mean_reversion', 'bear_bb_std_mult': 2.022503126230404, 'bear_rsi_os': 44, 'bear_rsi_ob': 47, 'bear_adx_thresh': 20.44285722854317, 'bear_atr_min_pct': 0.004196974023922211, 'bear_atr_max_pct': 0.03530309573118886, 'bear_tp_mult': 2.9483230360960584, 'bear_tsl_mult': 0.27172459591701126, 'bear_time_stop': 113, 'bear_use_sma': True, 'bear_use_ema': True, 'bear_use_atr': True, 'bear_use_adx': True, 'bear_use_spike': True, 'bear_rsi_required': True, 'sideways_strategy': 'mean_reversion', 'sideways_bb_std_mult': 1.9946951470394392, 'sideways_rsi_os': 8, 'sideways_rsi_ob': 57, 'sideways_adx_thresh': 12.566251171378251, 'sideways_atr_min_pct': 0.026982665445581352, 'sideways_atr_max_pct': 0.06499814087992649, 'sideways_tp_mult': 2.0543182114870833, 'sideways_tsl_mult': 0.7165526389350765, 'sideways_time_stop': 48, 'sideways_use_sma': True, 'sideways_use_ema': True, 'sideways_use_atr': True, 'sideways_use_adx': True, 'sideways_use_spike': False, 'sideways_rsi_required': True}.
[I 2025-08-31 04:15:20,921] Trial 296 finished with values: [-1000000000.0, 1000000000.0] and parameters: {'p_sma': 52, 'p_std': 14, 'p_atr': 25, 'p_adx': 20, 'rsi_period': 24, 'ema1': 26, 'ema2': 23, 'slip_atr_k': 0.04250328390752746, 'slip_spread_k': 0.07414791040259154, 'spread_hl_frac': 0.0009263562780139137, 'bb_std_mult': 2.1569007646555014, 'rsi_os': 28, 'rsi_ob': 73, 'vol_spike': 0.09651803814385318, 'adx_thresh': 32.80280007098488, 'atr_min_pct': 0.024463419850514208, 'atr_max_pct': 0.13253046945286898, 'tp_mult': 1.912028835630809, 'tsl_mult': 0.3837203069662557, 'strategy': 'breakout', 'time_stop': 167, 'use_sma': False, 'use_atr': True, 'use_adx': True, 'use_ema': False, 'use_spike': True, 'rsi_required': True, 'edge_k': 1.5749332157891827, 'edge_cap': 0.20072292823425303, 'bull_strategy': 'mean_reversion', 'bull_bb_std_mult': 0.5705189816572209, 'bull_rsi_os': 13, 'bull_rsi_ob': 56, 'bull_adx_thresh': 10.019246672230018, 'bull_atr_min_pct': 0.003424498807634792, 'bull_atr_max_pct': 0.045947286077397724, 'bull_tp_mult': 1.6439648666792859, 'bull_tsl_mult': 0.8920765576479895, 'bull_time_stop': 129, 'bull_use_sma': True, 'bull_use_ema': False, 'bull_use_atr': False, 'bull_use_adx': True, 'bull_use_spike': False, 'bull_rsi_required': True, 'bear_strategy': 'mean_reversion', 'bear_bb_std_mult': 1.5120213982290318, 'bear_rsi_os': 11, 'bear_rsi_ob': 75, 'bear_adx_thresh': 20.582462634055013, 'bear_atr_min_pct': 0.02465465826173376, 'bear_atr_max_pct': 0.043965349718885834, 'bear_tp_mult': 2.592272194758275, 'bear_tsl_mult': 0.2753814481735453, 'bear_time_stop': 113, 'bear_use_sma': True, 'bear_use_ema': True, 'bear_use_atr': True, 'bear_use_adx': True, 'bear_use_spike': True, 'bear_rsi_required': True, 'sideways_strategy': 'mean_reversion', 'sideways_bb_std_mult': 1.1328212296082045, 'sideways_rsi_os': 34, 'sideways_rsi_ob': 58, 'sideways_adx_thresh': 13.337334334081078, 'sideways_atr_min_pct': 0.01417886030342405, 'sideways_atr_max_pct': 0.11829436621523483, 'sideways_tp_mult': 1.6909183779437624, 'sideways_tsl_mult': 0.7050508216794763, 'sideways_time_stop': 49, 'sideways_use_sma': False, 'sideways_use_ema': True, 'sideways_use_atr': True, 'sideways_use_adx': True, 'sideways_use_spike': False, 'sideways_rsi_required': True}.
[I 2025-08-31 04:15:22,187] Trial 302 finished with values: [-1000000000.0, 1000000000.0] and parameters: {'p_sma': 34, 'p_std': 21, 'p_atr': 11, 'p_adx': 9, 'rsi_period': 84, 'ema1': 15, 'ema2': 25, 'slip_atr_k': 0.01971637429033065, 'slip_spread_k': 0.1277769583699496, 'spread_hl_frac': 0.02998013880493596, 'bb_std_mult': 1.7132533552818225, 'rsi_os': 53, 'rsi_ob': 62, 'vol_spike': 0.027821056873596105, 'adx_thresh': 8.519191367758648, 'atr_min_pct': 0.022192190422167694, 'atr_max_pct': 0.1239088326274085, 'tp_mult': 2.4680223675825252, 'tsl_mult': 0.8919463667531917, 'strategy': 'mean_reversion', 'time_stop': 284, 'use_sma': True, 'use_atr': False, 'use_adx': False, 'use_ema': False, 'use_spike': True, 'rsi_required': False, 'edge_k': 1.4710665221529717, 'edge_cap': 0.11618958039487587, 'bull_strategy': 'mean_reversion', 'bull_bb_std_mult': 3.387520521726849, 'bull_rsi_os': 14, 'bull_rsi_ob': 77, 'bull_adx_thresh': 12.65137754297584, 'bull_atr_min_pct': 0.0007370769833817908, 'bull_atr_max_pct': 0.04081033627696723, 'bull_tp_mult': 2.544449913160194, 'bull_tsl_mult': 0.852092926752833, 'bull_time_stop': 136, 'bull_use_sma': False, 'bull_use_ema': False, 'bull_use_atr': True, 'bull_use_adx': True, 'bull_use_spike': False, 'bull_rsi_required': True, 'bear_strategy': 'breakout', 'bear_bb_std_mult': 0.8548708870692946, 'bear_rsi_os': 9, 'bear_rsi_ob': 45, 'bear_adx_thresh': 21.40839481679089, 'bear_atr_min_pct': 0.02206452103125532, 'bear_atr_max_pct': 0.05047577921182963, 'bear_tp_mult': 2.673124662383909, 'bear_tsl_mult': 0.10741411847552373, 'bear_time_stop': 178, 'bear_use_sma': True, 'bear_use_ema': True, 'bear_use_atr': False, 'bear_use_adx': True, 'bear_use_spike': True, 'bear_rsi_required': False, 'sideways_strategy': 'breakout', 'sideways_bb_std_mult': 0.9963871721558482, 'sideways_rsi_os': 22, 'sideways_rsi_ob': 56, 'sideways_adx_thresh': 10.762465398398495, 'sideways_atr_min_pct': 0.029377434409092004, 'sideways_atr_max_pct': 0.10820291501469134, 'sideways_tp_mult': 2.989919634206215, 'sideways_tsl_mult': 0.5801724733366036, 'sideways_time_stop': 25, 'sideways_use_sma': True, 'sideways_use_ema': False, 'sideways_use_atr': False, 'sideways_use_adx': True, 'sideways_use_spike': True, 'sideways_rsi_required': True}.
[I 2025-08-31 04:16:15,290] Trial 301 finished with values: [-1000000000.0, 1000000000.0] and parameters: {'p_sma': 55, 'p_std': 21, 'p_atr': 18, 'p_adx': 9, 'rsi_period': 22, 'ema1': 25, 'ema2': 26, 'slip_atr_k': 0.04318423202599056, 'slip_spread_k': 0.13784598456576563, 'spread_hl_frac': 0.044561284141375536, 'bb_std_mult': 2.1564226153441135, 'rsi_os': 31, 'rsi_ob': 62, 'vol_spike': 0.029063576319060078, 'adx_thresh': 32.65085594857632, 'atr_min_pct': 0.022658552645993826, 'atr_max_pct': 0.1255249550708372, 'tp_mult': 2.461128469102344, 'tsl_mult': 0.4737458067137523, 'strategy': 'mean_reversion', 'time_stop': 64, 'use_sma': True, 'use_atr': False, 'use_adx': False, 'use_ema': False, 'use_spike': True, 'rsi_required': False, 'edge_k': 1.575766667383511, 'edge_cap': 0.9794468426579483, 'bull_strategy': 'mean_reversion', 'bull_bb_std_mult': 2.4045522266829087, 'bull_rsi_os': 48, 'bull_rsi_ob': 74, 'bull_adx_thresh': 12.770156828563689, 'bull_atr_min_pct': 0.0034454282591171365, 'bull_atr_max_pct': 0.04493805253985473, 'bull_tp_mult': 2.049078567610324, 'bull_tsl_mult': 0.17597932382412768, 'bull_time_stop': 86, 'bull_use_sma': False, 'bull_use_ema': False, 'bull_use_atr': True, 'bull_use_adx': True, 'bull_use_spike': False, 'bull_rsi_required': True, 'bear_strategy': 'breakout', 'bear_bb_std_mult': 0.9461012217472219, 'bear_rsi_os': 9, 'bear_rsi_ob': 45, 'bear_adx_thresh': 32.78381810353352, 'bear_atr_min_pct': 0.02472906377016986, 'bear_atr_max_pct': 0.051373869866743804, 'bear_tp_mult': 2.58744462022728, 'bear_tsl_mult': 0.28791578952586566, 'bear_time_stop': 223, 'bear_use_sma': True, 'bear_use_ema': True, 'bear_use_atr': False, 'bear_use_adx': True, 'bear_use_spike': True, 'bear_rsi_required': False, 'sideways_strategy': 'breakout', 'sideways_bb_std_mult': 0.9668298434586697, 'sideways_rsi_os': 22, 'sideways_rsi_ob': 64, 'sideways_adx_thresh': 12.125053697510358, 'sideways_atr_min_pct': 0.013203224944436705, 'sideways_atr_max_pct': 0.09560556569735423, 'sideways_tp_mult': 2.947403587721002, 'sideways_tsl_mult': 0.5698407432366793, 'sideways_time_stop': 71, 'sideways_use_sma': False, 'sideways_use_ema': False, 'sideways_use_atr': False, 'sideways_use_adx': True, 'sideways_use_spike': True, 'sideways_rsi_required': True}.
[I 2025-08-31 04:16:15,293] Trial 299 finished with values: [-1000000000.0, 1000000000.0] and parameters: {'p_sma': 32, 'p_std': 12, 'p_atr': 19, 'p_adx': 9, 'rsi_period': 22, 'ema1': 29, 'ema2': 25, 'slip_atr_k': 0.021092293300894252, 'slip_spread_k': 0.1360090505103752, 'spread_hl_frac': 0.017972352751382134, 'bb_std_mult': 2.711606095993299, 'rsi_os': 19, 'rsi_ob': 58, 'vol_spike': 0.01109741775282589, 'adx_thresh': 5.112326304363872, 'atr_min_pct': 0.024826936756192918, 'atr_max_pct': 0.11072784697077431, 'tp_mult': 2.467538754123748, 'tsl_mult': 0.46901156541681005, 'strategy': 'breakout', 'time_stop': 48, 'use_sma': False, 'use_atr': True, 'use_adx': True, 'use_ema': False, 'use_spike': True, 'rsi_required': True, 'edge_k': 0.2902843498146058, 'edge_cap': 0.11926727229204132, 'bull_strategy': 'mean_reversion', 'bull_bb_std_mult': 3.511110539069989, 'bull_rsi_os': 36, 'bull_rsi_ob': 74, 'bull_adx_thresh': 9.897714842611421, 'bull_atr_min_pct': 0.0264156528167935, 'bull_atr_max_pct': 0.046311082336050656, 'bull_tp_mult': 2.0747041745349266, 'bull_tsl_mult': 0.8533331978043638, 'bull_time_stop': 151, 'bull_use_sma': True, 'bull_use_ema': False, 'bull_use_atr': True, 'bull_use_adx': True, 'bull_use_spike': False, 'bull_rsi_required': True, 'bear_strategy': 'mean_reversion', 'bear_bb_std_mult': 3.5102976942974173, 'bear_rsi_os': 9, 'bear_rsi_ob': 47, 'bear_adx_thresh': 20.624288726720938, 'bear_atr_min_pct': 0.02483349562750871, 'bear_atr_max_pct': 0.04042972786874515, 'bear_tp_mult': 1.1232590637922346, 'bear_tsl_mult': 0.27449043051689465, 'bear_time_stop': 192, 'bear_use_sma': True, 'bear_use_ema': True, 'bear_use_atr': True, 'bear_use_adx': True, 'bear_use_spike': True, 'bear_rsi_required': False, 'sideways_strategy': 'mean_reversion', 'sideways_bb_std_mult': 0.8160136716146448, 'sideways_rsi_os': 8, 'sideways_rsi_ob': 57, 'sideways_adx_thresh': 12.333738609257887, 'sideways_atr_min_pct': 0.029437793819412604, 'sideways_atr_max_pct': 0.09675469252454755, 'sideways_tp_mult': 1.0105618326463903, 'sideways_tsl_mult': 0.03345284140517163, 'sideways_time_stop': 131, 'sideways_use_sma': True, 'sideways_use_ema': True, 'sideways_use_atr': True, 'sideways_use_adx': True, 'sideways_use_spike': False, 'sideways_rsi_required': True}.
[I 2025-08-31 04:16:15,820] Trial 300 finished with values: [-1000000000.0, 1000000000.0] and parameters: {'p_sma': 32, 'p_std': 42, 'p_atr': 10, 'p_adx': 9, 'rsi_period': 68, 'ema1': 15, 'ema2': 26, 'slip_atr_k': 0.020909377270094377, 'slip_spread_k': 0.13350080431703037, 'spread_hl_frac': 0.0448016607679536, 'bb_std_mult': 2.171823474302071, 'rsi_os': 53, 'rsi_ob': 62, 'vol_spike': 0.13080935384414277, 'adx_thresh': 5.499141181851297, 'atr_min_pct': 0.027123004601941482, 'atr_max_pct': 0.12258504240639771, 'tp_mult': 2.4675068415172863, 'tsl_mult': 0.9018873714793203, 'strategy': 'breakout', 'time_stop': 270, 'use_sma': False, 'use_atr': False, 'use_adx': False, 'use_ema': False, 'use_spike': True, 'rsi_required': False, 'edge_k': 1.5852354563677278, 'edge_cap': 0.9983952567345632, 'bull_strategy': 'mean_reversion', 'bull_bb_std_mult': 1.6538846139123229, 'bull_rsi_os': 13, 'bull_rsi_ob': 74, 'bull_adx_thresh': 10.68600933167924, 'bull_atr_min_pct': 0.0007211072577292513, 'bull_atr_max_pct': 0.04030288241737259, 'bull_tp_mult': 2.3020034175726796, 'bull_tsl_mult': 0.8594369356607691, 'bull_time_stop': 83, 'bull_use_sma': False, 'bull_use_ema': False, 'bull_use_atr': True, 'bull_use_adx': True, 'bull_use_spike': False, 'bull_rsi_required': True, 'bear_strategy': 'mean_reversion', 'bear_bb_std_mult': 1.5260440118459706, 'bear_rsi_os': 44, 'bear_rsi_ob': 48, 'bear_adx_thresh': 20.24021888439432, 'bear_atr_min_pct': 0.003948166725432804, 'bear_atr_max_pct': 0.04041897579717359, 'bear_tp_mult': 2.951717174511738, 'bear_tsl_mult': 0.2690440201606958, 'bear_time_stop': 9, 'bear_use_sma': True, 'bear_use_ema': True, 'bear_use_atr': False, 'bear_use_adx': True, 'bear_use_spike': True, 'bear_rsi_required': False, 'sideways_strategy': 'mean_reversion', 'sideways_bb_std_mult': 1.9838778695075745, 'sideways_rsi_os': 8, 'sideways_rsi_ob': 55, 'sideways_adx_thresh': 13.038082742681867, 'sideways_atr_min_pct': 0.013370004940547417, 'sideways_atr_max_pct': 0.10754024783160558, 'sideways_tp_mult': 2.0384228710158125, 'sideways_tsl_mult': 0.5711184589572034, 'sideways_time_stop': 57, 'sideways_use_sma': True, 'sideways_use_ema': False, 'sideways_use_atr': False, 'sideways_use_adx': True, 'sideways_use_spike': True, 'sideways_rsi_required': True}.
[I 2025-08-31 04:16:16,051] Trial 303 finished with values: [-0.016326656441213894, 0.016262716244935076] and parameters: {'p_sma': 54, 'p_std': 12, 'p_atr': 30, 'p_adx': 19, 'rsi_period': 22, 'ema1': 25, 'ema2': 26, 'slip_atr_k': 0.02292128342165619, 'slip_spread_k': 0.7457677250150941, 'spread_hl_frac': 0.009095300437430825, 'bb_std_mult': 1.9230820237469262, 'rsi_os': 26, 'rsi_ob': 61, 'vol_spike': 0.1304587843324157, 'adx_thresh': 34.58452287373166, 'atr_min_pct': 0.02294749562138085, 'atr_max_pct': 0.1367541250502396, 'tp_mult': 2.3928005907298258, 'tsl_mult': 0.4628254152693691, 'strategy': 'breakout', 'time_stop': 272, 'use_sma': False, 'use_atr': False, 'use_adx': False, 'use_ema': False, 'use_spike': True, 'rsi_required': False, 'edge_k': 0.07634431400076969, 'edge_cap': 0.9257074433416673, 'bull_strategy': 'mean_reversion', 'bull_bb_std_mult': 1.6697173586496388, 'bull_rsi_os': 23, 'bull_rsi_ob': 65, 'bull_adx_thresh': 9.407350098567829, 'bull_atr_min_pct': 0.0012755149597391499, 'bull_atr_max_pct': 0.04378255117335844, 'bull_tp_mult': 2.3055579689269177, 'bull_tsl_mult': 0.9336707977537438, 'bull_time_stop': 83, 'bull_use_sma': False, 'bull_use_ema': False, 'bull_use_atr': True, 'bull_use_adx': True, 'bull_use_spike': False, 'bull_rsi_required': True, 'bear_strategy': 'mean_reversion', 'bear_bb_std_mult': 0.9480385099748765, 'bear_rsi_os': 28, 'bear_rsi_ob': 48, 'bear_adx_thresh': 19.98652723264987, 'bear_atr_min_pct': 0.02603422705902752, 'bear_atr_max_pct': 0.041492429459613664, 'bear_tp_mult': 2.768315197451615, 'bear_tsl_mult': 0.23030645205945036, 'bear_time_stop': 192, 'bear_use_sma': True, 'bear_use_ema': True, 'bear_use_atr': False, 'bear_use_adx': True, 'bear_use_spike': True, 'bear_rsi_required': False, 'sideways_strategy': 'mean_reversion', 'sideways_bb_std_mult': 0.9773167015935622, 'sideways_rsi_os': 41, 'sideways_rsi_ob': 55, 'sideways_adx_thresh': 12.295518919140665, 'sideways_atr_min_pct': 0.013334376547790969, 'sideways_atr_max_pct': 0.0950267298520503, 'sideways_tp_mult': 1.962255297283837, 'sideways_tsl_mult': 0.633831641482046, 'sideways_time_stop': 131, 'sideways_use_sma': False, 'sideways_use_ema': False, 'sideways_use_atr': False, 'sideways_use_adx': True, 'sideways_use_spike': True, 'sideways_rsi_required': True}.
[I 2025-08-31 04:17:10,303] Trial 304 finished with values: [-1000000000.0, 1000000000.0] and parameters: {'p_sma': 54, 'p_std': 16, 'p_atr': 30, 'p_adx': 30, 'rsi_period': 26, 'ema1': 24, 'ema2': 21, 'slip_atr_k': 0.026730462833097286, 'slip_spread_k': 0.08976113002980249, 'spread_hl_frac': 0.011445817749284232, 'bb_std_mult': 1.9271269441495942, 'rsi_os': 47, 'rsi_ob': 61, 'vol_spike': 0.1308320784735788, 'adx_thresh': 34.577035427616806, 'atr_min_pct': 0.027158631544358654, 'atr_max_pct': 0.13616145531127388, 'tp_mult': 1.6220295722372906, 'tsl_mult': 0.7353888721004421, 'strategy': 'breakout', 'time_stop': 270, 'use_sma': False, 'use_atr': False, 'use_adx': False, 'use_ema': False, 'use_spike': True, 'rsi_required': False, 'edge_k': 0.09774950347475542, 'edge_cap': 0.999671033494036, 'bull_strategy': 'mean_reversion', 'bull_bb_std_mult': 1.9479744572978053, 'bull_rsi_os': 52, 'bull_rsi_ob': 79, 'bull_adx_thresh': 5.520135031319599, 'bull_atr_min_pct': 0.0012145379143295564, 'bull_atr_max_pct': 0.05291692184495661, 'bull_tp_mult': 1.7002693477713275, 'bull_tsl_mult': 0.9379599915003628, 'bull_time_stop': 145, 'bull_use_sma': False, 'bull_use_ema': True, 'bull_use_atr': True, 'bull_use_adx': False, 'bull_use_spike': False, 'bull_rsi_required': True, 'bear_strategy': 'mean_reversion', 'bear_bb_std_mult': 0.9364447698062206, 'bear_rsi_os': 6, 'bear_rsi_ob': 48, 'bear_adx_thresh': 19.942297356441944, 'bear_atr_min_pct': 0.02575838594845692, 'bear_atr_max_pct': 0.04083655922259357, 'bear_tp_mult': 2.7811652357301972, 'bear_tsl_mult': 0.8680299563401424, 'bear_time_stop': 208, 'bear_use_sma': False, 'bear_use_ema': False, 'bear_use_atr': True, 'bear_use_adx': True, 'bear_use_spike': False, 'bear_rsi_required': True, 'sideways_strategy': 'mean_reversion', 'sideways_bb_std_mult': 1.0685821048188582, 'sideways_rsi_os': 26, 'sideways_rsi_ob': 55, 'sideways_adx_thresh': 22.318943837406145, 'sideways_atr_min_pct': 0.013293659869300046, 'sideways_atr_max_pct': 0.11353608207456559, 'sideways_tp_mult': 1.947107630599944, 'sideways_tsl_mult': 0.6297852755072878, 'sideways_time_stop': 56, 'sideways_use_sma': False, 'sideways_use_ema': False, 'sideways_use_atr': False, 'sideways_use_adx': True, 'sideways_use_spike': True, 'sideways_rsi_required': False}.
[I 2025-08-31 04:17:12,364] Trial 305 finished with values: [-1000000000.0, 1000000000.0] and parameters: {'p_sma': 55, 'p_std': 53, 'p_atr': 8, 'p_adx': 7, 'rsi_period': 25, 'ema1': 24, 'ema2': 29, 'slip_atr_k': 0.1258564576395379, 'slip_spread_k': 0.17848421094609196, 'spread_hl_frac': 0.015364923000961957, 'bb_std_mult': 1.933865560980772, 'rsi_os': 48, 'rsi_ob': 61, 'vol_spike': 0.03778750808406534, 'adx_thresh': 19.41274643960378, 'atr_min_pct': 0.00404360345714075, 'atr_max_pct': 0.13813580465802816, 'tp_mult': 2.393794045544077, 'tsl_mult': 0.1344898745734721, 'strategy': 'breakout', 'time_stop': 300, 'use_sma': False, 'use_atr': False, 'use_adx': False, 'use_ema': False, 'use_spike': True, 'rsi_required': False, 'edge_k': 0.7758643927786018, 'edge_cap': 0.9983769182910874, 'bull_strategy': 'mean_reversion', 'bull_bb_std_mult': 3.0263677181965583, 'bull_rsi_os': 50, 'bull_rsi_ob': 81, 'bull_adx_thresh': 10.650803525279503, 'bull_atr_min_pct': 0.0010672125850085014, 'bull_atr_max_pct': 0.054477701727746033, 'bull_tp_mult': 1.9950579616658128, 'bull_tsl_mult': 0.9359612726556922, 'bull_time_stop': 147, 'bull_use_sma': False, 'bull_use_ema': True, 'bull_use_atr': True, 'bull_use_adx': False, 'bull_use_spike': False, 'bull_rsi_required': True, 'bear_strategy': 'mean_reversion', 'bear_bb_std_mult': 0.9329192505761861, 'bear_rsi_os': 6, 'bear_rsi_ob': 48, 'bear_adx_thresh': 19.919711318907574, 'bear_atr_min_pct': 0.02586382953210872, 'bear_atr_max_pct': 0.04078212380235655, 'bear_tp_mult': 2.752083219400261, 'bear_tsl_mult': 0.22006474079580207, 'bear_time_stop': 208, 'bear_use_sma': False, 'bear_use_ema': False, 'bear_use_atr': True, 'bear_use_adx': True, 'bear_use_spike': False, 'bear_rsi_required': True, 'sideways_strategy': 'mean_reversion', 'sideways_bb_std_mult': 1.0870920067433687, 'sideways_rsi_os': 42, 'sideways_rsi_ob': 55, 'sideways_adx_thresh': 30.367209123011698, 'sideways_atr_min_pct': 0.011627271859608684, 'sideways_atr_max_pct': 0.11248905994488033, 'sideways_tp_mult': 1.951689309737091, 'sideways_tsl_mult': 0.6015256976363687, 'sideways_time_stop': 61, 'sideways_use_sma': False, 'sideways_use_ema': False, 'sideways_use_atr': False, 'sideways_use_adx': True, 'sideways_use_spike': True, 'sideways_rsi_required': False}.
