[I 2025-08-31 04:27:56,125] Trial 359 finished with values: [-1000000000.0, 1000000000.0] and parameters: {'p_sma': 58, 'p_std': 54, 'p_atr': 25, 'p_adx': 26, 'rsi_period': 30, 'ema1': 15, 'ema2': 27, 'slip_atr_k': 0.20611911854562, 'slip_spread_k': 0.07267686445371116, 'spread_hl_frac': 0.009747327454945907, 'bb_std_mult': 1.9165539748068152, 'rsi_os': 50, 'rsi_ob': 58, 'vol_spike': 0.19211328213360207, 'adx_thresh': 10.012138303728008, 'atr_min_pct': 0.028216011346463378, 'atr_max_pct': 0.14002003495586332, 'tp_mult': 2.274492168724759, 'tsl_mult': 0.8494531342314406, 'strategy': 'breakout', 'time_stop': 193, 'use_sma': True, 'use_atr': True, 'use_adx': False, 'use_ema': True, 'use_spike': False, 'rsi_required': False, 'edge_k': 1.602328945011583, 'edge_cap': 0.26625409421311, 'bull_strategy': 'mean_reversion', 'bull_bb_std_mult': 3.4728082620514726, 'bull_rsi_os': 37, 'bull_rsi_ob': 69, 'bull_adx_thresh': 17.73002400729542, 'bull_atr_min_pct': 0.0013044620707759053, 'bull_atr_max_pct': 0.05522933625683284, 'bull_tp_mult': 1.2609669448595615, 'bull_tsl_mult': 0.49220553008211193, 'bull_time_stop': 7, 'bull_use_sma': False, 'bull_use_ema': False, 'bull_use_atr': False, 'bull_use_adx': True, 'bull_use_spike': True, 'bull_rsi_required': False, 'bear_strategy': 'mean_reversion', 'bear_bb_std_mult': 0.9614921540727926, 'bear_rsi_os': 9, 'bear_rsi_ob': 47, 'bear_adx_thresh': 30.37444193877994, 'bear_atr_min_pct': 0.022888793741672037, 'bear_atr_max_pct': 0.09622379899148167, 'bear_tp_mult': 1.3536659452831235, 'bear_tsl_mult': 0.23571266080879863, 'bear_time_stop': 192, 'bear_use_sma': True, 'bear_use_ema': True, 'bear_use_atr': True, 'bear_use_adx': True, 'bear_use_spike': True, 'bear_rsi_required': True, 'sideways_strategy': 'mean_reversion', 'sideways_bb_std_mult': 1.1088958451626985, 'sideways_rsi_os': 31, 'sideways_rsi_ob': 52, 'sideways_adx_thresh': 11.099443471896903, 'sideways_atr_min_pct': 0.014377154571633244, 'sideways_atr_max_pct': 0.11522094638406276, 'sideways_tp_mult': 1.9733641452025543, 'sideways_tsl_mult': 0.9091081936903034, 'sideways_time_stop': 113, 'sideways_use_sma': False, 'sideways_use_ema': False, 'sideways_use_atr': False, 'sideways_use_adx': True, 'sideways_use_spike': True, 'sideways_rsi_required': True}.
[I 2025-08-31 04:27:56,262] Trial 361 finished with values: [-1000000000.0, 1000000000.0] and parameters: {'p_sma': 56, 'p_std': 55, 'p_atr': 23, 'p_adx': 9, 'rsi_period': 20, 'ema1': 15, 'ema2': 26, 'slip_atr_k': 0.0665238585217417, 'slip_spread_k': 0.24860590194054255, 'spread_hl_frac': 0.009364517351134263, 'bb_std_mult': 3.3785168378241845, 'rsi_os': 14, 'rsi_ob': 61, 'vol_spike': 0.0727774783653497, 'adx_thresh': 15.973408776946734, 'atr_min_pct': 0.024869513150533047, 'atr_max_pct': 0.09527384643310523, 'tp_mult': 2.4400163489474416, 'tsl_mult': 0.4929981662513495, 'strategy': 'breakout', 'time_stop': 87, 'use_sma': False, 'use_atr': True, 'use_adx': True, 'use_ema': True, 'use_spike': False, 'rsi_required': True, 'edge_k': 1.264819527618554, 'edge_cap': 0.47202590456321947, 'bull_strategy': 'mean_reversion', 'bull_bb_std_mult': 3.5975479929086402, 'bull_rsi_os': 54, 'bull_rsi_ob': 47, 'bull_adx_thresh': 12.652896397078234, 'bull_atr_min_pct': 0.010213235517114082, 'bull_atr_max_pct': 0.05422427596136685, 'bull_tp_mult': 1.5432698490912475, 'bull_tsl_mult': 0.6026604365106842, 'bull_time_stop': 201, 'bull_use_sma': True, 'bull_use_ema': True, 'bull_use_atr': True, 'bull_use_adx': False, 'bull_use_spike': True, 'bull_rsi_required': True, 'bear_strategy': 'breakout', 'bear_bb_std_mult': 2.407385210675919, 'bear_rsi_os': 9, 'bear_rsi_ob': 70, 'bear_adx_thresh': 19.934985229198666, 'bear_atr_min_pct': 0.025330075774549834, 'bear_atr_max_pct': 0.042625909909404604, 'bear_tp_mult': 1.3362562820065973, 'bear_tsl_mult': 0.6135797855479151, 'bear_time_stop': 285, 'bear_use_sma': False, 'bear_use_ema': False, 'bear_use_atr': True, 'bear_use_adx': True, 'bear_use_spike': False, 'bear_rsi_required': True, 'sideways_strategy': 'mean_reversion', 'sideways_bb_std_mult': 2.0570974844256757, 'sideways_rsi_os': 23, 'sideways_rsi_ob': 71, 'sideways_adx_thresh': 13.129888463496126, 'sideways_atr_min_pct': 0.003085641333679265, 'sideways_atr_max_pct': 0.08910651931317466, 'sideways_tp_mult': 2.4436634663621644, 'sideways_tsl_mult': 0.5524502542818949, 'sideways_time_stop': 67, 'sideways_use_sma': True, 'sideways_use_ema': True, 'sideways_use_atr': True, 'sideways_use_adx': True, 'sideways_use_spike': False, 'sideways_rsi_required': False}.
[I 2025-08-31 04:28:46,403] Trial 362 finished with values: [-0.01497140254212026, 0.014922777109250962] and parameters: {'p_sma': 46, 'p_std': 7, 'p_atr': 25, 'p_adx': 29, 'rsi_period': 20, 'ema1': 28, 'ema2': 28, 'slip_atr_k': 0.03521745898489974, 'slip_spread_k': 0.043073437633182776, 'spread_hl_frac': 0.0101264792659708, 'bb_std_mult': 1.8428153489081316, 'rsi_os': 27, 'rsi_ob': 60, 'vol_spike': 0.027395265762909852, 'adx_thresh': 12.703136062367866, 'atr_min_pct': 0.025205675065142284, 'atr_max_pct': 0.14087432306479977, 'tp_mult': 2.048716440633891, 'tsl_mult': 0.8508640215552914, 'strategy': 'breakout', 'time_stop': 49, 'use_sma': False, 'use_atr': False, 'use_adx': True, 'use_ema': False, 'use_spike': True, 'rsi_required': True, 'edge_k': 1.481580409697988, 'edge_cap': 0.9411051885732133, 'bull_strategy': 'mean_reversion', 'bull_bb_std_mult': 3.5233192372804876, 'bull_rsi_os': 13, 'bull_rsi_ob': 69, 'bull_adx_thresh': 17.504737970827414, 'bull_atr_min_pct': 0.0018311608394640938, 'bull_atr_max_pct': 0.04528362920774238, 'bull_tp_mult': 1.6642723670253532, 'bull_tsl_mult': 0.6000727456760948, 'bull_time_stop': 138, 'bull_use_sma': True, 'bull_use_ema': False, 'bull_use_atr': True, 'bull_use_adx': True, 'bull_use_spike': False, 'bull_rsi_required': True, 'bear_strategy': 'breakout', 'bear_bb_std_mult': 3.186086976492171, 'bear_rsi_os': 9, 'bear_rsi_ob': 75, 'bear_adx_thresh': 8.79246949685446, 'bear_atr_min_pct': 0.02262313345451305, 'bear_atr_max_pct': 0.041996172200305826, 'bear_tp_mult': 1.3674536725733724, 'bear_tsl_mult': 0.24965275759773717, 'bear_time_stop': 194, 'bear_use_sma': True, 'bear_use_ema': True, 'bear_use_atr': False, 'bear_use_adx': True, 'bear_use_spike': True, 'bear_rsi_required': False, 'sideways_strategy': 'mean_reversion', 'sideways_bb_std_mult': 1.3540197178214268, 'sideways_rsi_os': 25, 'sideways_rsi_ob': 55, 'sideways_adx_thresh': 12.998566754188445, 'sideways_atr_min_pct': 0.025141010334943446, 'sideways_atr_max_pct': 0.10944477557769759, 'sideways_tp_mult': 1.971918474365906, 'sideways_tsl_mult': 0.5508187255522425, 'sideways_time_stop': 58, 'sideways_use_sma': False, 'sideways_use_ema': True, 'sideways_use_atr': True, 'sideways_use_adx': True, 'sideways_use_spike': False, 'sideways_rsi_required': True}.
[I 2025-08-31 04:28:46,673] Trial 364 finished with values: [-1000000000.0, 1000000000.0] and parameters: {'p_sma': 45, 'p_std': 14, 'p_atr': 26, 'p_adx': 20, 'rsi_period': 12, 'ema1': 14, 'ema2': 51, 'slip_atr_k': 0.22401364302887988, 'slip_spread_k': 0.12740463816297942, 'spread_hl_frac': 0.007410315555357854, 'bb_std_mult': 3.332162842621642, 'rsi_os': 38, 'rsi_ob': 60, 'vol_spike': 0.021437952037627054, 'adx_thresh': 11.198488367417307, 'atr_min_pct': 0.022817749480900606, 'atr_max_pct': 0.12786179678365608, 'tp_mult': 2.496050902979536, 'tsl_mult': 0.11359688646448818, 'strategy': 'breakout', 'time_stop': 20, 'use_sma': False, 'use_atr': False, 'use_adx': True, 'use_ema': False, 'use_spike': True, 'rsi_required': True, 'edge_k': 0.9991862570480707, 'edge_cap': 0.9400689786768316, 'bull_strategy': 'breakout', 'bull_bb_std_mult': 3.5390068572871205, 'bull_rsi_os': 39, 'bull_rsi_ob': 45, 'bull_adx_thresh': 12.163318607780326, 'bull_atr_min_pct': 0.02591665612200414, 'bull_atr_max_pct': 0.04508102886622375, 'bull_tp_mult': 1.6083051483114421, 'bull_tsl_mult': 0.594951094910947, 'bull_time_stop': 269, 'bull_use_sma': True, 'bull_use_ema': True, 'bull_use_atr': True, 'bull_use_adx': False, 'bull_use_spike': False, 'bull_rsi_required': True, 'bear_strategy': 'breakout', 'bear_bb_std_mult': 1.58394301598288, 'bear_rsi_os': 7, 'bear_rsi_ob': 56, 'bear_adx_thresh': 20.02890202093172, 'bear_atr_min_pct': 0.026649893344352492, 'bear_atr_max_pct': 0.047774987706357935, 'bear_tp_mult': 2.6853408665342755, 'bear_tsl_mult': 0.25883262714415195, 'bear_time_stop': 299, 'bear_use_sma': False, 'bear_use_ema': False, 'bear_use_atr': False, 'bear_use_adx': True, 'bear_use_spike': False, 'bear_rsi_required': False, 'sideways_strategy': 'mean_reversion', 'sideways_bb_std_mult': 1.3525518108826122, 'sideways_rsi_os': 29, 'sideways_rsi_ob': 71, 'sideways_adx_thresh': 10.54152697259934, 'sideways_atr_min_pct': 0.02074537131717513, 'sideways_atr_max_pct': 0.10974432557522076, 'sideways_tp_mult': 2.938438401272954, 'sideways_tsl_mult': 0.8526382280095333, 'sideways_time_stop': 248, 'sideways_use_sma': True, 'sideways_use_ema': True, 'sideways_use_atr': True, 'sideways_use_adx': False, 'sideways_use_spike': False, 'sideways_rsi_required': False}.
[I 2025-08-31 04:28:47,097] Trial 363 finished with values: [-1000000000.0, 1000000000.0] and parameters: {'p_sma': 39, 'p_std': 47, 'p_atr': 25, 'p_adx': 10, 'rsi_period': 47, 'ema1': 15, 'ema2': 27, 'slip_atr_k': 0.027412774760905097, 'slip_spread_k': 0.21765680179278019, 'spread_hl_frac': 0.007709322632126325, 'bb_std_mult': 3.3119218463376177, 'rsi_os': 27, 'rsi_ob': 60, 'vol_spike': 0.006255924482193628, 'adx_thresh': 11.456175498254641, 'atr_min_pct': 0.024930892546288948, 'atr_max_pct': 0.12737601956518294, 'tp_mult': 1.1844496717716295, 'tsl_mult': 0.9282446127735673, 'strategy': 'breakout', 'time_stop': 210, 'use_sma': False, 'use_atr': True, 'use_adx': True, 'use_ema': True, 'use_spike': False, 'rsi_required': True, 'edge_k': 0.4218781105950572, 'edge_cap': 0.9324624533006854, 'bull_strategy': 'mean_reversion', 'bull_bb_std_mult': 3.595697205536445, 'bull_rsi_os': 54, 'bull_rsi_ob': 55, 'bull_adx_thresh': 18.622620847643425, 'bull_atr_min_pct': 0.0019702797863619215, 'bull_atr_max_pct': 0.045006666450202945, 'bull_tp_mult': 1.7347541355508462, 'bull_tsl_mult': 0.595899439512996, 'bull_time_stop': 137, 'bull_use_sma': True, 'bull_use_ema': False, 'bull_use_atr': True, 'bull_use_adx': True, 'bull_use_spike': True, 'bull_rsi_required': True, 'bear_strategy': 'breakout', 'bear_bb_std_mult': 3.1956040994679995, 'bear_rsi_os': 9, 'bear_rsi_ob': 52, 'bear_adx_thresh': 19.731169736796453, 'bear_atr_min_pct': 0.024019575199370282, 'bear_atr_max_pct': 0.04802406303391042, 'bear_tp_mult': 1.4462062992100042, 'bear_tsl_mult': 0.11420450525728953, 'bear_time_stop': 167, 'bear_use_sma': True, 'bear_use_ema': True, 'bear_use_atr': False, 'bear_use_adx': True, 'bear_use_spike': True, 'bear_rsi_required': False, 'sideways_strategy': 'mean_reversion', 'sideways_bb_std_mult': 0.6463486519100214, 'sideways_rsi_os': 21, 'sideways_rsi_ob': 89, 'sideways_adx_thresh': 10.84445326383926, 'sideways_atr_min_pct': 0.012365091607695573, 'sideways_atr_max_pct': 0.08904031805523559, 'sideways_tp_mult': 1.1758751969861398, 'sideways_tsl_mult': 0.5606188892282732, 'sideways_time_stop': 247, 'sideways_use_sma': False, 'sideways_use_ema': True, 'sideways_use_atr': True, 'sideways_use_adx': False, 'sideways_use_spike': False, 'sideways_rsi_required': True}.
[I 2025-08-31 04:28:47,330] Trial 365 finished with values: [-1000000000.0, 1000000000.0] and parameters: {'p_sma': 54, 'p_std': 13, 'p_atr': 26, 'p_adx': 29, 'rsi_period': 25, 'ema1': 20, 'ema2': 27, 'slip_atr_k': 0.004422496615651431, 'slip_spread_k': 0.13109969101134206, 'spread_hl_frac': 0.016163439417934446, 'bb_std_mult': 2.2543570423167107, 'rsi_os': 38, 'rsi_ob': 60, 'vol_spike': 0.022554111558068784, 'adx_thresh': 11.375406011263014, 'atr_min_pct': 0.022713299864773398, 'atr_max_pct': 0.12672715411178087, 'tp_mult': 1.9168854351708202, 'tsl_mult': 0.9386453737550016, 'strategy': 'breakout', 'time_stop': 50, 'use_sma': False, 'use_atr': False, 'use_adx': True, 'use_ema': False, 'use_spike': True, 'rsi_required': True, 'edge_k': 1.8208091085966065, 'edge_cap': 0.9401527894402791, 'bull_strategy': 'breakout', 'bull_bb_std_mult': 2.622224401308547, 'bull_rsi_os': 43, 'bull_rsi_ob': 55, 'bull_adx_thresh': 34.66841186692185, 'bull_atr_min_pct': 0.001954328020810236, 'bull_atr_max_pct': 0.0487130229264558, 'bull_tp_mult': 2.1432446099127427, 'bull_tsl_mult': 0.06216747689519997, 'bull_time_stop': 64, 'bull_use_sma': True, 'bull_use_ema': False, 'bull_use_atr': True, 'bull_use_adx': True, 'bull_use_spike': False, 'bull_rsi_required': True, 'bear_strategy': 'breakout', 'bear_bb_std_mult': 3.2294442882115475, 'bear_rsi_os': 35, 'bear_rsi_ob': 63, 'bear_adx_thresh': 19.966429643841497, 'bear_atr_min_pct': 0.0239582343103013, 'bear_atr_max_pct': 0.013542433900512837, 'bear_tp_mult': 2.6706626038181374, 'bear_tsl_mult': 0.257335156168822, 'bear_time_stop': 89, 'bear_use_sma': True, 'bear_use_ema': True, 'bear_use_atr': False, 'bear_use_adx': False, 'bear_use_spike': True, 'bear_rsi_required': False, 'sideways_strategy': 'mean_reversion', 'sideways_bb_std_mult': 1.2221364978084666, 'sideways_rsi_os': 25, 'sideways_rsi_ob': 55, 'sideways_adx_thresh': 15.40551337840591, 'sideways_atr_min_pct': 0.012321302434954945, 'sideways_atr_max_pct': 0.027057917224622002, 'sideways_tp_mult': 1.942740678861554, 'sideways_tsl_mult': 0.7593756420910243, 'sideways_time_stop': 57, 'sideways_use_sma': False, 'sideways_use_ema': True, 'sideways_use_atr': True, 'sideways_use_adx': False, 'sideways_use_spike': False, 'sideways_rsi_required': True}.
[I 2025-08-31 04:29:39,923] Trial 368 finished with values: [-1000000000.0, 1000000000.0] and parameters: {'p_sma': 54, 'p_std': 7, 'p_atr': 24, 'p_adx': 29, 'rsi_period': 78, 'ema1': 23, 'ema2': 28, 'slip_atr_k': 0.007506263763942979, 'slip_spread_k': 0.17506665312773317, 'spread_hl_frac': 0.013151487683516306, 'bb_std_mult': 2.0557438791153184, 'rsi_os': 29, 'rsi_ob': 82, 'vol_spike': 0.03375310335577041, 'adx_thresh': 34.023571699297, 'atr_min_pct': 0.014354794427183354, 'atr_max_pct': 0.1224288766667331, 'tp_mult': 1.9100255765241978, 'tsl_mult': 0.850750056509984, 'strategy': 'breakout', 'time_stop': 32, 'use_sma': False, 'use_atr': False, 'use_adx': False, 'use_ema': False, 'use_spike': True, 'rsi_required': False, 'edge_k': 1.477201967984532, 'edge_cap': 0.9992307932900888, 'bull_strategy': 'breakout', 'bull_bb_std_mult': 2.6229666125497286, 'bull_rsi_os': 13, 'bull_rsi_ob': 61, 'bull_adx_thresh': 34.92700763845756, 'bull_atr_min_pct': 0.0005665546917839387, 'bull_atr_max_pct': 0.04924792030207151, 'bull_tp_mult': 1.910305828072443, 'bull_tsl_mult': 0.9096002295271824, 'bull_time_stop': 76, 'bull_use_sma': False, 'bull_use_ema': False, 'bull_use_atr': True, 'bull_use_adx': True, 'bull_use_spike': False, 'bull_rsi_required': True, 'bear_strategy': 'mean_reversion', 'bear_bb_std_mult': 0.8379617744981436, 'bear_rsi_os': 10, 'bear_rsi_ob': 75, 'bear_adx_thresh': 8.540225163659072, 'bear_atr_min_pct': 0.01906117368102316, 'bear_atr_max_pct': 0.03896908556300851, 'bear_tp_mult': 2.784251278296817, 'bear_tsl_mult': 0.1610897016720556, 'bear_time_stop': 49, 'bear_use_sma': True, 'bear_use_ema': True, 'bear_use_atr': True, 'bear_use_adx': False, 'bear_use_spike': True, 'bear_rsi_required': True, 'sideways_strategy': 'mean_reversion', 'sideways_bb_std_mult': 0.961782455886393, 'sideways_rsi_os': 28, 'sideways_rsi_ob': 55, 'sideways_adx_thresh': 14.669154380990829, 'sideways_atr_min_pct': 0.013542156362959329, 'sideways_atr_max_pct': 0.11931861811434025, 'sideways_tp_mult': 1.9403783898610092, 'sideways_tsl_mult': 0.7579813088637795, 'sideways_time_stop': 27, 'sideways_use_sma': False, 'sideways_use_ema': False, 'sideways_use_atr': False, 'sideways_use_adx': True, 'sideways_use_spike': True, 'sideways_rsi_required': True}.
[I 2025-08-31 04:29:39,915] Trial 367 finished with values: [-0.01669144729678229, 0.016628796940421346] and parameters: {'p_sma': 54, 'p_std': 13, 'p_atr': 30, 'p_adx': 29, 'rsi_period': 47, 'ema1': 13, 'ema2': 53, 'slip_atr_k': 0.0078253811709388, 'slip_spread_k': 0.03637514986808364, 'spread_hl_frac': 0.008182873356659919, 'bb_std_mult': 1.7614274288039942, 'rsi_os': 44, 'rsi_ob': 95, 'vol_spike': 0.0052988758715933615, 'adx_thresh': 12.470840302165996, 'atr_min_pct': 0.022665011842436245, 'atr_max_pct': 0.14329252367582893, 'tp_mult': 1.9155710135538595, 'tsl_mult': 0.9226952162620331, 'strategy': 'breakout', 'time_stop': 94, 'use_sma': False, 'use_atr': False, 'use_adx': False, 'use_ema': False, 'use_spike': True, 'rsi_required': False, 'edge_k': 1.1842266285728063, 'edge_cap': 0.39977144717395346, 'bull_strategy': 'mean_reversion', 'bull_bb_std_mult': 0.7157256586717897, 'bull_rsi_os': 52, 'bull_rsi_ob': 67, 'bull_adx_thresh': 9.038934753747768, 'bull_atr_min_pct': 0.0005395300257400664, 'bull_atr_max_pct': 0.0488872570122486, 'bull_tp_mult': 1.7366187276366785, 'bull_tsl_mult': 0.8520862383451674, 'bull_time_stop': 139, 'bull_use_sma': False, 'bull_use_ema': False, 'bull_use_atr': True, 'bull_use_adx': True, 'bull_use_spike': False, 'bull_rsi_required': True, 'bear_strategy': 'mean_reversion', 'bear_bb_std_mult': 0.8354936324565563, 'bear_rsi_os': 10, 'bear_rsi_ob': 79, 'bear_adx_thresh': 22.562845620437038, 'bear_atr_min_pct': 0.02029193349748877, 'bear_atr_max_pct': 0.039023160846203386, 'bear_tp_mult': 2.2012833194111345, 'bear_tsl_mult': 0.24473348077495816, 'bear_time_stop': 49, 'bear_use_sma': True, 'bear_use_ema': True, 'bear_use_atr': False, 'bear_use_adx': False, 'bear_use_spike': True, 'bear_rsi_required': True, 'sideways_strategy': 'mean_reversion', 'sideways_bb_std_mult': 0.9758912531780635, 'sideways_rsi_os': 28, 'sideways_rsi_ob': 55, 'sideways_adx_thresh': 9.560009824958977, 'sideways_atr_min_pct': 0.012395247112532376, 'sideways_atr_max_pct': 0.09934803866871429, 'sideways_tp_mult': 1.1992798272769027, 'sideways_tsl_mult': 0.6096574993509546, 'sideways_time_stop': 223, 'sideways_use_sma': False, 'sideways_use_ema': False, 'sideways_use_atr': False, 'sideways_use_adx': False, 'sideways_use_spike': True, 'sideways_rsi_required': True}.
[I 2025-08-31 04:29:40,280] Trial 366 finished with values: [-0.01281182185044849, 0.012757370817563521] and parameters: {'p_sma': 45, 'p_std': 14, 'p_atr': 26, 'p_adx': 10, 'rsi_period': 78, 'ema1': 13, 'ema2': 28, 'slip_atr_k': 0.0056732780590260466, 'slip_spread_k': 0.12751054256098102, 'spread_hl_frac': 0.007952389038646753, 'bb_std_mult': 2.3517909001333885, 'rsi_os': 29, 'rsi_ob': 60, 'vol_spike': 0.0226435837713544, 'adx_thresh': 19.320200575770034, 'atr_min_pct': 0.02253269982297202, 'atr_max_pct': 0.14278479731086355, 'tp_mult': 2.5884712024797882, 'tsl_mult': 0.9349134566973494, 'strategy': 'breakout', 'time_stop': 50, 'use_sma': False, 'use_atr': False, 'use_adx': False, 'use_ema': False, 'use_spike': True, 'rsi_required': False, 'edge_k': 1.4801754487420944, 'edge_cap': 0.9996913313576024, 'bull_strategy': 'breakout', 'bull_bb_std_mult': 3.527572727449713, 'bull_rsi_os': 39, 'bull_rsi_ob': 61, 'bull_adx_thresh': 9.063762995599983, 'bull_atr_min_pct': 0.0005365041189806898, 'bull_atr_max_pct': 0.04847048595518329, 'bull_tp_mult': 1.5955752932683906, 'bull_tsl_mult': 0.7617410973008314, 'bull_time_stop': 137, 'bull_use_sma': False, 'bull_use_ema': False, 'bull_use_atr': True, 'bull_use_adx': True, 'bull_use_spike': False, 'bull_rsi_required': True, 'bear_strategy': 'breakout', 'bear_bb_std_mult': 2.776256258931807, 'bear_rsi_os': 7, 'bear_rsi_ob': 46, 'bear_adx_thresh': 8.596661469895993, 'bear_atr_min_pct': 0.0001414025967808371, 'bear_atr_max_pct': 0.08929766006559531, 'bear_tp_mult': 2.2178601464183867, 'bear_tsl_mult': 0.15166182407640108, 'bear_time_stop': 135, 'bear_use_sma': True, 'bear_use_ema': True, 'bear_use_atr': False, 'bear_use_adx': False, 'bear_use_spike': True, 'bear_rsi_required': False, 'sideways_strategy': 'mean_reversion', 'sideways_bb_std_mult': 1.2132027877649132, 'sideways_rsi_os': 28, 'sideways_rsi_ob': 55, 'sideways_adx_thresh': 15.352279398318899, 'sideways_atr_min_pct': 0.016504184099095705, 'sideways_atr_max_pct': 0.10918876705645103, 'sideways_tp_mult': 2.8306291205621985, 'sideways_tsl_mult': 0.7544668984265726, 'sideways_time_stop': 244, 'sideways_use_sma': False, 'sideways_use_ema': False, 'sideways_use_atr': False, 'sideways_use_adx': False, 'sideways_use_spike': True, 'sideways_rsi_required': True}.
