[I 2025-08-31 05:56:39,563] Trial 837 finished with values: [-0.008681323618826675, 0.008650161634087878] and parameters: {'p_sma': 34, 'p_std': 43, 'p_atr': 12, 'p_adx': 25, 'rsi_period': 16, 'ema1': 17, 'ema2': 20, 'slip_atr_k': 0.005851357252941101, 'slip_spread_k': 0.7728155564615561, 'spread_hl_frac': 0.0009154255821190445, 'bb_std_mult': 3.4141519504831823, 'rsi_os': 47, 'rsi_ob': 70, 'vol_spike': 0.08502392309028595, 'adx_thresh': 8.034048391599518, 'atr_min_pct': 0.009061127106996369, 'atr_max_pct': 0.11360741244808402, 'tp_mult': 2.140858739436087, 'tsl_mult': 0.3834258101360746, 'strategy': 'mean_reversion', 'time_stop': 15, 'use_sma': False, 'use_atr': True, 'use_adx': False, 'use_ema': False, 'use_spike': True, 'rsi_required': True, 'edge_k': 0.8738192760326793, 'edge_cap': 0.3495382419693804, 'bull_strategy': 'breakout', 'bull_bb_std_mult': 1.5973497941797967, 'bull_rsi_os': 37, 'bull_rsi_ob': 71, 'bull_adx_thresh': 33.945978690263736, 'bull_atr_min_pct': 0.01617384448512536, 'bull_atr_max_pct': 0.09467736074307834, 'bull_tp_mult': 1.3874003135850344, 'bull_tsl_mult': 0.7049847259924114, 'bull_time_stop': 175, 'bull_use_sma': False, 'bull_use_ema': True, 'bull_use_atr': False, 'bull_use_adx': False, 'bull_use_spike': False, 'bull_rsi_required': False, 'bear_strategy': 'breakout', 'bear_bb_std_mult': 2.1811665362343913, 'bear_rsi_os': 5, 'bear_rsi_ob': 59, 'bear_adx_thresh': 14.941044369968012, 'bear_atr_min_pct': 0.0009002623398664175, 'bear_atr_max_pct': 0.12453537487335155, 'bear_tp_mult': 1.1011512702059008, 'bear_tsl_mult': 0.07855990126928385, 'bear_time_stop': 243, 'bear_use_sma': True, 'bear_use_ema': False, 'bear_use_atr': True, 'bear_use_adx': False, 'bear_use_spike': False, 'bear_rsi_required': False, 'sideways_strategy': 'breakout', 'sideways_bb_std_mult': 1.3964374508889426, 'sideways_rsi_os': 41, 'sideways_rsi_ob': 46, 'sideways_adx_thresh': 22.353846036083052, 'sideways_atr_min_pct': 0.0025065048958669233, 'sideways_atr_max_pct': 0.05000846992863294, 'sideways_tp_mult': 2.444664749794531, 'sideways_tsl_mult': 0.20789386340987098, 'sideways_time_stop': 140, 'sideways_use_sma': True, 'sideways_use_ema': True, 'sideways_use_atr': False, 'sideways_use_adx': False, 'sideways_use_spike': True, 'sideways_rsi_required': False}.
[I 2025-08-31 05:56:41,308] Trial 838 finished with values: [-0.007886581653931857, 0.007820542202873393] and parameters: {'p_sma': 34, 'p_std': 45, 'p_atr': 12, 'p_adx': 25, 'rsi_period': 16, 'ema1': 17, 'ema2': 20, 'slip_atr_k': 0.005452462732811615, 'slip_spread_k': 0.8491074633570587, 'spread_hl_frac': 0.0033136763561935137, 'bb_std_mult': 3.4003635513204467, 'rsi_os': 47, 'rsi_ob': 70, 'vol_spike': 0.09210390496166322, 'adx_thresh': 8.217069088308218, 'atr_min_pct': 0.009373445705446036, 'atr_max_pct': 0.11310400904883752, 'tp_mult': 2.117844863194398, 'tsl_mult': 0.3838246430091279, 'strategy': 'mean_reversion', 'time_stop': 15, 'use_sma': False, 'use_atr': True, 'use_adx': False, 'use_ema': False, 'use_spike': True, 'rsi_required': True, 'edge_k': 0.8609605804985403, 'edge_cap': 0.35009344287391775, 'bull_strategy': 'breakout', 'bull_bb_std_mult': 1.6208359372908197, 'bull_rsi_os': 37, 'bull_rsi_ob': 71, 'bull_adx_thresh': 33.89691005590627, 'bull_atr_min_pct': 0.01627235274979082, 'bull_atr_max_pct': 0.08665851267241631, 'bull_tp_mult': 1.4926053715443846, 'bull_tsl_mult': 0.6987192795835039, 'bull_time_stop': 175, 'bull_use_sma': False, 'bull_use_ema': True, 'bull_use_atr': False, 'bull_use_adx': False, 'bull_use_spike': False, 'bull_rsi_required': False, 'bear_strategy': 'breakout', 'bear_bb_std_mult': 2.1842327021615895, 'bear_rsi_os': 5, 'bear_rsi_ob': 59, 'bear_adx_thresh': 14.800205007011078, 'bear_atr_min_pct': 0.0007641158823575727, 'bear_atr_max_pct': 0.12485141226183803, 'bear_tp_mult': 1.1014149538842921, 'bear_tsl_mult': 0.0803803891517344, 'bear_time_stop': 242, 'bear_use_sma': True, 'bear_use_ema': False, 'bear_use_atr': True, 'bear_use_adx': False, 'bear_use_spike': False, 'bear_rsi_required': False, 'sideways_strategy': 'breakout', 'sideways_bb_std_mult': 1.6184254809704897, 'sideways_rsi_os': 41, 'sideways_rsi_ob': 46, 'sideways_adx_thresh': 22.07158614007791, 'sideways_atr_min_pct': 0.0026925381702949513, 'sideways_atr_max_pct': 0.04862102708641944, 'sideways_tp_mult': 2.4060268194315286, 'sideways_tsl_mult': 0.28410521611434664, 'sideways_time_stop': 148, 'sideways_use_sma': True, 'sideways_use_ema': True, 'sideways_use_atr': False, 'sideways_use_adx': False, 'sideways_use_spike': True, 'sideways_rsi_required': False}.
[I 2025-08-31 05:56:42,134] Trial 836 finished with values: [-0.010598739033332971, 0.01056601350843396] and parameters: {'p_sma': 34, 'p_std': 43, 'p_atr': 11, 'p_adx': 25, 'rsi_period': 16, 'ema1': 17, 'ema2': 20, 'slip_atr_k': 0.005255542042235996, 'slip_spread_k': 0.7751228593775275, 'spread_hl_frac': 0.0031984625180116813, 'bb_std_mult': 3.4018362483948392, 'rsi_os': 47, 'rsi_ob': 70, 'vol_spike': 0.08377001067803802, 'adx_thresh': 8.130829161568833, 'atr_min_pct': 0.009382165063247927, 'atr_max_pct': 0.11801088747552407, 'tp_mult': 2.134251974232893, 'tsl_mult': 0.3824730053078617, 'strategy': 'mean_reversion', 'time_stop': 15, 'use_sma': False, 'use_atr': True, 'use_adx': False, 'use_ema': False, 'use_spike': True, 'rsi_required': True, 'edge_k': 0.8496963103055, 'edge_cap': 0.35229615703337047, 'bull_strategy': 'breakout', 'bull_bb_std_mult': 1.6488915776069715, 'bull_rsi_os': 37, 'bull_rsi_ob': 71, 'bull_adx_thresh': 33.93690640788071, 'bull_atr_min_pct': 0.01640588445920561, 'bull_atr_max_pct': 0.09342399824289797, 'bull_tp_mult': 1.3994484326947076, 'bull_tsl_mult': 0.7135138151070611, 'bull_time_stop': 176, 'bull_use_sma': False, 'bull_use_ema': True, 'bull_use_atr': False, 'bull_use_adx': False, 'bull_use_spike': False, 'bull_rsi_required': False, 'bear_strategy': 'breakout', 'bear_bb_std_mult': 2.187530986042406, 'bear_rsi_os': 5, 'bear_rsi_ob': 59, 'bear_adx_thresh': 14.773649228407207, 'bear_atr_min_pct': 0.0008619539301683553, 'bear_atr_max_pct': 0.12556270984678422, 'bear_tp_mult': 1.0949790895519225, 'bear_tsl_mult': 0.08297432707839976, 'bear_time_stop': 242, 'bear_use_sma': True, 'bear_use_ema': False, 'bear_use_atr': True, 'bear_use_adx': False, 'bear_use_spike': False, 'bear_rsi_required': False, 'sideways_strategy': 'breakout', 'sideways_bb_std_mult': 1.6225284869381782, 'sideways_rsi_os': 41, 'sideways_rsi_ob': 46, 'sideways_adx_thresh': 22.140569473399587, 'sideways_atr_min_pct': 0.0024195201607444504, 'sideways_atr_max_pct': 0.05039012864891486, 'sideways_tp_mult': 2.421429946880181, 'sideways_tsl_mult': 0.13760961639415564, 'sideways_time_stop': 129, 'sideways_use_sma': True, 'sideways_use_ema': True, 'sideways_use_atr': False, 'sideways_use_adx': False, 'sideways_use_spike': True, 'sideways_rsi_required': True}.
[I 2025-08-31 05:57:32,846] Trial 843 finished with values: [-0.007512573798142852, 0.007708531962669253] and parameters: {'p_sma': 32, 'p_std': 45, 'p_atr': 12, 'p_adx': 25, 'rsi_period': 17, 'ema1': 17, 'ema2': 20, 'slip_atr_k': 0.010261277185082388, 'slip_spread_k': 0.8517297530112211, 'spread_hl_frac': 0.0003214443669120866, 'bb_std_mult': 3.46474209373777, 'rsi_os': 47, 'rsi_ob': 70, 'vol_spike': 0.09448722165724205, 'adx_thresh': 8.538939932284846, 'atr_min_pct': 0.008804166882315998, 'atr_max_pct': 0.1187270039164616, 'tp_mult': 2.1249139066354252, 'tsl_mult': 0.43374438024154116, 'strategy': 'mean_reversion', 'time_stop': 17, 'use_sma': True, 'use_atr': True, 'use_adx': False, 'use_ema': False, 'use_spike': False, 'rsi_required': True, 'edge_k': 0.8965934291927864, 'edge_cap': 0.371279370012046, 'bull_strategy': 'breakout', 'bull_bb_std_mult': 1.6170755634105187, 'bull_rsi_os': 34, 'bull_rsi_ob': 71, 'bull_adx_thresh': 34.05690334755866, 'bull_atr_min_pct': 0.015985067894716442, 'bull_atr_max_pct': 0.08661323794091484, 'bull_tp_mult': 1.4014305854794147, 'bull_tsl_mult': 0.7107920780376895, 'bull_time_stop': 195, 'bull_use_sma': False, 'bull_use_ema': True, 'bull_use_atr': False, 'bull_use_adx': False, 'bull_use_spike': False, 'bull_rsi_required': False, 'bear_strategy': 'breakout', 'bear_bb_std_mult': 2.2971582680932703, 'bear_rsi_os': 5, 'bear_rsi_ob': 59, 'bear_adx_thresh': 15.24428280817003, 'bear_atr_min_pct': 0.000997754393429678, 'bear_atr_max_pct': 0.12538352410194145, 'bear_tp_mult': 1.1054993240067998, 'bear_tsl_mult': 0.06499506725934068, 'bear_time_stop': 238, 'bear_use_sma': True, 'bear_use_ema': False, 'bear_use_atr': True, 'bear_use_adx': False, 'bear_use_spike': False, 'bear_rsi_required': False, 'sideways_strategy': 'breakout', 'sideways_bb_std_mult': 1.6629631974916463, 'sideways_rsi_os': 43, 'sideways_rsi_ob': 46, 'sideways_adx_thresh': 22.025236517364316, 'sideways_atr_min_pct': 0.002728462202016041, 'sideways_atr_max_pct': 0.04678539678248982, 'sideways_tp_mult': 2.425018810361451, 'sideways_tsl_mult': 0.2860754442396006, 'sideways_time_stop': 127, 'sideways_use_sma': True, 'sideways_use_ema': True, 'sideways_use_atr': False, 'sideways_use_adx': False, 'sideways_use_spike': True, 'sideways_rsi_required': False}.
[I 2025-08-31 05:57:32,868] Trial 841 finished with values: [-0.007104883227585401, 0.007297856805757551] and parameters: {'p_sma': 30, 'p_std': 45, 'p_atr': 12, 'p_adx': 25, 'rsi_period': 17, 'ema1': 17, 'ema2': 20, 'slip_atr_k': 0.011409360305943955, 'slip_spread_k': 0.8497045073583704, 'spread_hl_frac': 0.00016344632235128583, 'bb_std_mult': 3.4785843992096463, 'rsi_os': 47, 'rsi_ob': 70, 'vol_spike': 0.09377018429995922, 'adx_thresh': 8.234956598424478, 'atr_min_pct': 0.008799043616628392, 'atr_max_pct': 0.11837741662184376, 'tp_mult': 2.113223761573531, 'tsl_mult': 0.4290354456187662, 'strategy': 'mean_reversion', 'time_stop': 17, 'use_sma': True, 'use_atr': True, 'use_adx': False, 'use_ema': False, 'use_spike': False, 'rsi_required': True, 'edge_k': 0.8957060844303139, 'edge_cap': 0.36458105084941506, 'bull_strategy': 'breakout', 'bull_bb_std_mult': 1.6378862839889783, 'bull_rsi_os': 34, 'bull_rsi_ob': 71, 'bull_adx_thresh': 34.03732442974977, 'bull_atr_min_pct': 0.016366837349358204, 'bull_atr_max_pct': 0.08539139904663295, 'bull_tp_mult': 1.3930752157794577, 'bull_tsl_mult': 0.7129102097847483, 'bull_time_stop': 197, 'bull_use_sma': False, 'bull_use_ema': True, 'bull_use_atr': False, 'bull_use_adx': False, 'bull_use_spike': False, 'bull_rsi_required': False, 'bear_strategy': 'breakout', 'bear_bb_std_mult': 2.2611719319300394, 'bear_rsi_os': 5, 'bear_rsi_ob': 59, 'bear_adx_thresh': 15.166863379598775, 'bear_atr_min_pct': 0.0009152536372711541, 'bear_atr_max_pct': 0.12402410052103181, 'bear_tp_mult': 1.1028965345912127, 'bear_tsl_mult': 0.06541781804366618, 'bear_time_stop': 243, 'bear_use_sma': True, 'bear_use_ema': False, 'bear_use_atr': True, 'bear_use_adx': False, 'bear_use_spike': False, 'bear_rsi_required': False, 'sideways_strategy': 'breakout', 'sideways_bb_std_mult': 1.6156006914512235, 'sideways_rsi_os': 43, 'sideways_rsi_ob': 46, 'sideways_adx_thresh': 22.199660577847183, 'sideways_atr_min_pct': 0.002744521035169426, 'sideways_atr_max_pct': 0.04702129780366136, 'sideways_tp_mult': 2.44752827421581, 'sideways_tsl_mult': 0.2889889439623247, 'sideways_time_stop': 129, 'sideways_use_sma': True, 'sideways_use_ema': True, 'sideways_use_atr': False, 'sideways_use_adx': False, 'sideways_use_spike': True, 'sideways_rsi_required': False}.
[I 2025-08-31 05:57:33,864] Trial 842 finished with values: [-0.007323942819415397, 0.007620650358839014] and parameters: {'p_sma': 30, 'p_std': 45, 'p_atr': 12, 'p_adx': 25, 'rsi_period': 17, 'ema1': 17, 'ema2': 20, 'slip_atr_k': 0.010618080204827853, 'slip_spread_k': 0.8514627079158058, 'spread_hl_frac': 0.000650933274249141, 'bb_std_mult': 3.480976033794985, 'rsi_os': 47, 'rsi_ob': 70, 'vol_spike': 0.09432124933912256, 'adx_thresh': 8.461363602188955, 'atr_min_pct': 0.008631167149466913, 'atr_max_pct': 0.11821433819321488, 'tp_mult': 2.1255110908390615, 'tsl_mult': 0.43081481529891247, 'strategy': 'mean_reversion', 'time_stop': 16, 'use_sma': True, 'use_atr': True, 'use_adx': False, 'use_ema': False, 'use_spike': False, 'rsi_required': True, 'edge_k': 0.903043490508213, 'edge_cap': 0.3626215436755722, 'bull_strategy': 'breakout', 'bull_bb_std_mult': 1.6048786426024846, 'bull_rsi_os': 34, 'bull_rsi_ob': 71, 'bull_adx_thresh': 34.09548013650241, 'bull_atr_min_pct': 0.016483611558892046, 'bull_atr_max_pct': 0.08588961075457367, 'bull_tp_mult': 1.2388045921556043, 'bull_tsl_mult': 0.7019780776239308, 'bull_time_stop': 195, 'bull_use_sma': False, 'bull_use_ema': True, 'bull_use_atr': False, 'bull_use_adx': False, 'bull_use_spike': False, 'bull_rsi_required': False, 'bear_strategy': 'breakout', 'bear_bb_std_mult': 2.264599392322738, 'bear_rsi_os': 5, 'bear_rsi_ob': 59, 'bear_adx_thresh': 15.161547589400982, 'bear_atr_min_pct': 0.00097875091489551, 'bear_atr_max_pct': 0.1250555630407646, 'bear_tp_mult': 1.105838094572338, 'bear_tsl_mult': 0.05796387122909431, 'bear_time_stop': 240, 'bear_use_sma': True, 'bear_use_ema': False, 'bear_use_atr': True, 'bear_use_adx': False, 'bear_use_spike': False, 'bear_rsi_required': False, 'sideways_strategy': 'breakout', 'sideways_bb_std_mult': 1.631803248874808, 'sideways_rsi_os': 43, 'sideways_rsi_ob': 46, 'sideways_adx_thresh': 22.11364304845958, 'sideways_atr_min_pct': 0.0027045451356561613, 'sideways_atr_max_pct': 0.04722405431594052, 'sideways_tp_mult': 2.4121602212690623, 'sideways_tsl_mult': 0.3002791739736862, 'sideways_time_stop': 138, 'sideways_use_sma': True, 'sideways_use_ema': True, 'sideways_use_atr': False, 'sideways_use_adx': False, 'sideways_use_spike': True, 'sideways_rsi_required': False}.
[I 2025-08-31 05:57:34,696] Trial 840 finished with values: [-1000000000.0, 1000000000.0] and parameters: {'p_sma': 30, 'p_std': 46, 'p_atr': 12, 'p_adx': 25, 'rsi_period': 17, 'ema1': 17, 'ema2': 20, 'slip_atr_k': 0.01171347628555194, 'slip_spread_k': 0.857688697930705, 'spread_hl_frac': 0.00024048780019235547, 'bb_std_mult': 3.4509410305747803, 'rsi_os': 47, 'rsi_ob': 70, 'vol_spike': 0.09422154372961875, 'adx_thresh': 8.485892922016301, 'atr_min_pct': 0.008911785399157312, 'atr_max_pct': 0.11761338989981343, 'tp_mult': 2.1168402162805195, 'tsl_mult': 0.4314308996468817, 'strategy': 'mean_reversion', 'time_stop': 16, 'use_sma': True, 'use_atr': True, 'use_adx': False, 'use_ema': False, 'use_spike': False, 'rsi_required': True, 'edge_k': 0.8957414952102896, 'edge_cap': 0.36503695496161426, 'bull_strategy': 'breakout', 'bull_bb_std_mult': 1.6487391308115709, 'bull_rsi_os': 34, 'bull_rsi_ob': 71, 'bull_adx_thresh': 33.80413874913101, 'bull_atr_min_pct': 0.016171479831609305, 'bull_atr_max_pct': 0.08596404025546675, 'bull_tp_mult': 1.2637588749140516, 'bull_tsl_mult': 0.7052371903179734, 'bull_time_stop': 195, 'bull_use_sma': False, 'bull_use_ema': True, 'bull_use_atr': False, 'bull_use_adx': False, 'bull_use_spike': False, 'bull_rsi_required': False, 'bear_strategy': 'breakout', 'bear_bb_std_mult': 2.274271303702966, 'bear_rsi_os': 5, 'bear_rsi_ob': 59, 'bear_adx_thresh': 14.99142428811947, 'bear_atr_min_pct': 0.0009079609402862564, 'bear_atr_max_pct': 0.12595802210586088, 'bear_tp_mult': 1.0953173313267393, 'bear_tsl_mult': 0.07290540278571749, 'bear_time_stop': 239, 'bear_use_sma': True, 'bear_use_ema': False, 'bear_use_atr': True, 'bear_use_adx': False, 'bear_use_spike': False, 'bear_rsi_required': False, 'sideways_strategy': 'breakout', 'sideways_bb_std_mult': 1.6512627267018627, 'sideways_rsi_os': 43, 'sideways_rsi_ob': 46, 'sideways_adx_thresh': 22.146390824389485, 'sideways_atr_min_pct': 0.0028468937023892835, 'sideways_atr_max_pct': 0.0467335014486322, 'sideways_tp_mult': 2.4229034840353543, 'sideways_tsl_mult': 0.2827774174817016, 'sideways_time_stop': 128, 'sideways_use_sma': True, 'sideways_use_ema': True, 'sideways_use_atr': False, 'sideways_use_adx': False, 'sideways_use_spike': True, 'sideways_rsi_required': False}.
[I 2025-08-31 05:58:21,829] Trial 845 finished with values: [-1000000000.0, 1000000000.0] and parameters: {'p_sma': 29, 'p_std': 46, 'p_atr': 11, 'p_adx': 25, 'rsi_period': 17, 'ema1': 17, 'ema2': 20, 'slip_atr_k': 0.012606039835482623, 'slip_spread_k': 0.85816154563065, 'spread_hl_frac': 0.000335055340812845, 'bb_std_mult': 3.501074049999798, 'rsi_os': 47, 'rsi_ob': 70, 'vol_spike': 0.09456459600907324, 'adx_thresh': 8.490230703946738, 'atr_min_pct': 0.008101370459116323, 'atr_max_pct': 0.11896256377098086, 'tp_mult': 2.1330607484313204, 'tsl_mult': 0.430920835578391, 'strategy': 'mean_reversion', 'time_stop': 19, 'use_sma': True, 'use_atr': True, 'use_adx': True, 'use_ema': False, 'use_spike': False, 'rsi_required': True, 'edge_k': 0.9664649189850407, 'edge_cap': 0.36870453433742767, 'bull_strategy': 'breakout', 'bull_bb_std_mult': 1.6406291964192055, 'bull_rsi_os': 33, 'bull_rsi_ob': 71, 'bull_adx_thresh': 33.794690350532065, 'bull_atr_min_pct': 0.01612710239028808, 'bull_atr_max_pct': 0.0852626147613107, 'bull_tp_mult': 1.3629850710628886, 'bull_tsl_mult': 0.7058364100035274, 'bull_time_stop': 198, 'bull_use_sma': True, 'bull_use_ema': True, 'bull_use_atr': False, 'bull_use_adx': False, 'bull_use_spike': False, 'bull_rsi_required': False, 'bear_strategy': 'breakout', 'bear_bb_std_mult': 2.327023214980281, 'bear_rsi_os': 5, 'bear_rsi_ob': 59, 'bear_adx_thresh': 15.245246288744635, 'bear_atr_min_pct': 0.0006113582053740597, 'bear_atr_max_pct': 0.12462324214014767, 'bear_tp_mult': 1.149384826642222, 'bear_tsl_mult': 0.06422344410415089, 'bear_time_stop': 243, 'bear_use_sma': True, 'bear_use_ema': False, 'bear_use_atr': True, 'bear_use_adx': False, 'bear_use_spike': False, 'bear_rsi_required': False, 'sideways_strategy': 'breakout', 'sideways_bb_std_mult': 1.6680653166197008, 'sideways_rsi_os': 44, 'sideways_rsi_ob': 46, 'sideways_adx_thresh': 22.011866494327162, 'sideways_atr_min_pct': 0.0028572115411536875, 'sideways_atr_max_pct': 0.04563428536306535, 'sideways_tp_mult': 2.420404784223066, 'sideways_tsl_mult': 0.2815852353907095, 'sideways_time_stop': 126, 'sideways_use_sma': True, 'sideways_use_ema': True, 'sideways_use_atr': True, 'sideways_use_adx': False, 'sideways_use_spike': False, 'sideways_rsi_required': False}.
[I 2025-08-31 05:58:22,365] Trial 844 finished with values: [-1000000000.0, 1000000000.0] and parameters: {'p_sma': 29, 'p_std': 46, 'p_atr': 11, 'p_adx': 25, 'rsi_period': 16, 'ema1': 17, 'ema2': 20, 'slip_atr_k': 0.01399237282742339, 'slip_spread_k': 0.8527107313044857, 'spread_hl_frac': 1.5568682965985887e-05, 'bb_std_mult': 3.5172631261289022, 'rsi_os': 47, 'rsi_ob': 70, 'vol_spike': 0.09409358135067783, 'adx_thresh': 8.532878781263937, 'atr_min_pct': 0.00742110666629075, 'atr_max_pct': 0.11825505718784629, 'tp_mult': 2.135662248390396, 'tsl_mult': 0.4256248219121311, 'strategy': 'mean_reversion', 'time_stop': 21, 'use_sma': True, 'use_atr': True, 'use_adx': True, 'use_ema': False, 'use_spike': False, 'rsi_required': True, 'edge_k': 0.958325460515568, 'edge_cap': 0.37106950380101206, 'bull_strategy': 'breakout', 'bull_bb_std_mult': 1.6330636919714996, 'bull_rsi_os': 33, 'bull_rsi_ob': 71, 'bull_adx_thresh': 33.59092310524286, 'bull_atr_min_pct': 0.016579864010310485, 'bull_atr_max_pct': 0.08334372745819253, 'bull_tp_mult': 1.3658808571051424, 'bull_tsl_mult': 0.7070153208056118, 'bull_time_stop': 201, 'bull_use_sma': True, 'bull_use_ema': True, 'bull_use_atr': False, 'bull_use_adx': False, 'bull_use_spike': False, 'bull_rsi_required': False, 'bear_strategy': 'breakout', 'bear_bb_std_mult': 2.3244992856576894, 'bear_rsi_os': 5, 'bear_rsi_ob': 59, 'bear_adx_thresh': 15.058258996369819, 'bear_atr_min_pct': 0.0008851167822556568, 'bear_atr_max_pct': 0.12426636865684827, 'bear_tp_mult': 1.1734622467907978, 'bear_tsl_mult': 0.06631028510602559, 'bear_time_stop': 238, 'bear_use_sma': True, 'bear_use_ema': False, 'bear_use_atr': True, 'bear_use_adx': False, 'bear_use_spike': False, 'bear_rsi_required': False, 'sideways_strategy': 'breakout', 'sideways_bb_std_mult': 1.623065293203506, 'sideways_rsi_os': 45, 'sideways_rsi_ob': 47, 'sideways_adx_thresh': 21.898542884371594, 'sideways_atr_min_pct': 0.002892293436959664, 'sideways_atr_max_pct': 0.0453493605161442, 'sideways_tp_mult': 2.424302954313515, 'sideways_tsl_mult': 0.2882291237020511, 'sideways_time_stop': 126, 'sideways_use_sma': True, 'sideways_use_ema': True, 'sideways_use_atr': True, 'sideways_use_adx': False, 'sideways_use_spike': False, 'sideways_rsi_required': False}.
