[I 2025-08-31 05:30:56,882] Trial 702 finished with values: [-1000000000.0, 1000000000.0] and parameters: {'p_sma': 10, 'p_std': 60, 'p_atr': 20, 'p_adx': 7, 'rsi_period': 45, 'ema1': 23, 'ema2': 25, 'slip_atr_k': 0.04080261126180038, 'slip_spread_k': 0.7387091554124736, 'spread_hl_frac': 0.03303954160144458, 'bb_std_mult': 2.976725231911744, 'rsi_os': 24, 'rsi_ob': 61, 'vol_spike': 0.06958291728688225, 'adx_thresh': 31.91683687516784, 'atr_min_pct': 0.0225101070860134, 'atr_max_pct': 0.062380489893703844, 'tp_mult': 2.477226139733709, 'tsl_mult': 0.7647611447566401, 'strategy': 'mean_reversion', 'time_stop': 242, 'use_sma': False, 'use_atr': True, 'use_adx': True, 'use_ema': True, 'use_spike': True, 'rsi_required': True, 'edge_k': 0.6959188022653795, 'edge_cap': 0.697874327842824, 'bull_strategy': 'breakout', 'bull_bb_std_mult': 0.8697223873379077, 'bull_rsi_os': 46, 'bull_rsi_ob': 72, 'bull_adx_thresh': 9.096259337297022, 'bull_atr_min_pct': 0.008486439291317822, 'bull_atr_max_pct': 0.08037402454185448, 'bull_tp_mult': 1.618338785449126, 'bull_tsl_mult': 0.3665530616296617, 'bull_time_stop': 230, 'bull_use_sma': True, 'bull_use_ema': False, 'bull_use_atr': True, 'bull_use_adx': False, 'bull_use_spike': False, 'bull_rsi_required': False, 'bear_strategy': 'breakout', 'bear_bb_std_mult': 1.5447619667417476, 'bear_rsi_os': 11, 'bear_rsi_ob': 87, 'bear_adx_thresh': 28.512679236587243, 'bear_atr_min_pct': 0.009172899136873804, 'bear_atr_max_pct': 0.045658211375327225, 'bear_tp_mult': 1.2612593724524845, 'bear_tsl_mult': 0.7970893338119176, 'bear_time_stop': 237, 'bear_use_sma': False, 'bear_use_ema': True, 'bear_use_atr': False, 'bear_use_adx': False, 'bear_use_spike': False, 'bear_rsi_required': True, 'sideways_strategy': 'breakout', 'sideways_bb_std_mult': 1.023414426554018, 'sideways_rsi_os': 35, 'sideways_rsi_ob': 59, 'sideways_adx_thresh': 29.14604123072292, 'sideways_atr_min_pct': 0.01267425401781956, 'sideways_atr_max_pct': 0.084372898317489, 'sideways_tp_mult': 1.1418392725963187, 'sideways_tsl_mult': 0.3849740361212841, 'sideways_time_stop': 190, 'sideways_use_sma': True, 'sideways_use_ema': True, 'sideways_use_atr': True, 'sideways_use_adx': False, 'sideways_use_spike': False, 'sideways_rsi_required': False}.
[I 2025-08-31 05:30:57,430] Trial 703 finished with values: [-1000000000.0, 1000000000.0] and parameters: {'p_sma': 58, 'p_std': 23, 'p_atr': 20, 'p_adx': 7, 'rsi_period': 20, 'ema1': 20, 'ema2': 55, 'slip_atr_k': 0.10301079254976925, 'slip_spread_k': 0.6726027060877096, 'spread_hl_frac': 0.029880084114319083, 'bb_std_mult': 1.9875247389034834, 'rsi_os': 8, 'rsi_ob': 74, 'vol_spike': 0.06874852200763253, 'adx_thresh': 11.491984730002246, 'atr_min_pct': 0.022543931719102784, 'atr_max_pct': 0.07584288215076093, 'tp_mult': 2.8099184277043157, 'tsl_mult': 0.8036725782129545, 'strategy': 'mean_reversion', 'time_stop': 26, 'use_sma': False, 'use_atr': True, 'use_adx': True, 'use_ema': True, 'use_spike': True, 'rsi_required': True, 'edge_k': 0.23633738404216423, 'edge_cap': 0.7697737443362073, 'bull_strategy': 'mean_reversion', 'bull_bb_std_mult': 1.0085969907226735, 'bull_rsi_os': 42, 'bull_rsi_ob': 55, 'bull_adx_thresh': 9.16974748009251, 'bull_atr_min_pct': 0.007178259682377841, 'bull_atr_max_pct': 0.05505557793497681, 'bull_tp_mult': 1.6327663038751368, 'bull_tsl_mult': 0.8572244302752434, 'bull_time_stop': 228, 'bull_use_sma': True, 'bull_use_ema': False, 'bull_use_atr': True, 'bull_use_adx': False, 'bull_use_spike': False, 'bull_rsi_required': False, 'bear_strategy': 'breakout', 'bear_bb_std_mult': 0.8637325420839632, 'bear_rsi_os': 9, 'bear_rsi_ob': 74, 'bear_adx_thresh': 28.00273419974087, 'bear_atr_min_pct': 0.009264393176666282, 'bear_atr_max_pct': 0.14188382735771735, 'bear_tp_mult': 1.0141515259020528, 'bear_tsl_mult': 0.22155778060501524, 'bear_time_stop': 263, 'bear_use_sma': False, 'bear_use_ema': True, 'bear_use_atr': False, 'bear_use_adx': False, 'bear_use_spike': False, 'bear_rsi_required': True, 'sideways_strategy': 'breakout', 'sideways_bb_std_mult': 3.478568738902328, 'sideways_rsi_os': 45, 'sideways_rsi_ob': 60, 'sideways_adx_thresh': 26.96477263355658, 'sideways_atr_min_pct': 0.012278456993114775, 'sideways_atr_max_pct': 0.06367414701817023, 'sideways_tp_mult': 2.400477551571509, 'sideways_tsl_mult': 0.5178723305337737, 'sideways_time_stop': 215, 'sideways_use_sma': False, 'sideways_use_ema': True, 'sideways_use_atr': True, 'sideways_use_adx': False, 'sideways_use_spike': False, 'sideways_rsi_required': False}.
[I 2025-08-31 05:30:58,223] Trial 704 finished with values: [-1000000000.0, 1000000000.0] and parameters: {'p_sma': 58, 'p_std': 32, 'p_atr': 20, 'p_adx': 7, 'rsi_period': 45, 'ema1': 20, 'ema2': 24, 'slip_atr_k': 0.18335716675238828, 'slip_spread_k': 0.6379370820116794, 'spread_hl_frac': 0.04580176476045761, 'bb_std_mult': 2.011967959112749, 'rsi_os': 25, 'rsi_ob': 61, 'vol_spike': 0.08503910438532562, 'adx_thresh': 11.726556616780693, 'atr_min_pct': 0.024119759405231405, 'atr_max_pct': 0.11142991947793654, 'tp_mult': 1.0620020936182386, 'tsl_mult': 0.8026544232681747, 'strategy': 'mean_reversion', 'time_stop': 41, 'use_sma': False, 'use_atr': True, 'use_adx': True, 'use_ema': True, 'use_spike': False, 'rsi_required': True, 'edge_k': 0.261886061913321, 'edge_cap': 0.7199521075792614, 'bull_strategy': 'mean_reversion', 'bull_bb_std_mult': 0.8617183082701299, 'bull_rsi_os': 53, 'bull_rsi_ob': 49, 'bull_adx_thresh': 9.198684320609082, 'bull_atr_min_pct': 0.0042295500394156395, 'bull_atr_max_pct': 0.024903458160705036, 'bull_tp_mult': 1.553941244854894, 'bull_tsl_mult': 0.8519723540752271, 'bull_time_stop': 294, 'bull_use_sma': True, 'bull_use_ema': False, 'bull_use_atr': True, 'bull_use_adx': False, 'bull_use_spike': True, 'bull_rsi_required': False, 'bear_strategy': 'breakout', 'bear_bb_std_mult': 0.7817759933724697, 'bear_rsi_os': 9, 'bear_rsi_ob': 87, 'bear_adx_thresh': 13.96780763812118, 'bear_atr_min_pct': 0.011470482735964075, 'bear_atr_max_pct': 0.045534816820102235, 'bear_tp_mult': 1.2582567541223206, 'bear_tsl_mult': 0.22060473979714812, 'bear_time_stop': 30, 'bear_use_sma': False, 'bear_use_ema': True, 'bear_use_atr': False, 'bear_use_adx': False, 'bear_use_spike': False, 'bear_rsi_required': True, 'sideways_strategy': 'breakout', 'sideways_bb_std_mult': 1.0402703011815384, 'sideways_rsi_os': 35, 'sideways_rsi_ob': 58, 'sideways_adx_thresh': 29.49995663435479, 'sideways_atr_min_pct': 0.015378212210362027, 'sideways_atr_max_pct': 0.08588332065740291, 'sideways_tp_mult': 2.07881253701759, 'sideways_tsl_mult': 0.5180142256872331, 'sideways_time_stop': 191, 'sideways_use_sma': False, 'sideways_use_ema': True, 'sideways_use_atr': True, 'sideways_use_adx': False, 'sideways_use_spike': False, 'sideways_rsi_required': False}.
[I 2025-08-31 05:31:35,555] Trial 705 finished with values: [-1000000000.0, 1000000000.0] and parameters: {'p_sma': 24, 'p_std': 37, 'p_atr': 17, 'p_adx': 17, 'rsi_period': 20, 'ema1': 26, 'ema2': 24, 'slip_atr_k': 0.18752423894752418, 'slip_spread_k': 0.6741605532422268, 'spread_hl_frac': 0.045721808052665215, 'bb_std_mult': 1.957831281561571, 'rsi_os': 17, 'rsi_ob': 61, 'vol_spike': 0.08328310183605149, 'adx_thresh': 5.1168366541146035, 'atr_min_pct': 0.02405780091424736, 'atr_max_pct': 0.09635230749705874, 'tp_mult': 2.9262923181044753, 'tsl_mult': 0.273502657963774, 'strategy': 'mean_reversion', 'time_stop': 42, 'use_sma': False, 'use_atr': True, 'use_adx': True, 'use_ema': False, 'use_spike': False, 'rsi_required': True, 'edge_k': 0.55566329449823, 'edge_cap': 0.7227951659751854, 'bull_strategy': 'mean_reversion', 'bull_bb_std_mult': 0.8797241052551481, 'bull_rsi_os': 52, 'bull_rsi_ob': 52, 'bull_adx_thresh': 25.650447051935785, 'bull_atr_min_pct': 0.027537705586438317, 'bull_atr_max_pct': 0.07730496318897476, 'bull_tp_mult': 1.5621115506411036, 'bull_tsl_mult': 0.872402459908588, 'bull_time_stop': 253, 'bull_use_sma': True, 'bull_use_ema': False, 'bull_use_atr': True, 'bull_use_adx': False, 'bull_use_spike': True, 'bull_rsi_required': False, 'bear_strategy': 'breakout', 'bear_bb_std_mult': 2.7233980477269566, 'bear_rsi_os': 9, 'bear_rsi_ob': 65, 'bear_adx_thresh': 12.620671779988335, 'bear_atr_min_pct': 0.005376835887484282, 'bear_atr_max_pct': 0.01846642794396043, 'bear_tp_mult': 1.2595779816434935, 'bear_tsl_mult': 0.22139582495819818, 'bear_time_stop': 265, 'bear_use_sma': False, 'bear_use_ema': True, 'bear_use_atr': False, 'bear_use_adx': False, 'bear_use_spike': False, 'bear_rsi_required': True, 'sideways_strategy': 'breakout', 'sideways_bb_std_mult': 1.0297325479855295, 'sideways_rsi_os': 36, 'sideways_rsi_ob': 56, 'sideways_adx_thresh': 26.907658019722646, 'sideways_atr_min_pct': 0.015337815218785744, 'sideways_atr_max_pct': 0.09451250975024256, 'sideways_tp_mult': 1.1656533109438245, 'sideways_tsl_mult': 0.5198281048669314, 'sideways_time_stop': 238, 'sideways_use_sma': False, 'sideways_use_ema': True, 'sideways_use_atr': True, 'sideways_use_adx': False, 'sideways_use_spike': False, 'sideways_rsi_required': False}.
[I 2025-08-31 05:31:44,183] Trial 706 finished with values: [-1000000000.0, 1000000000.0] and parameters: {'p_sma': 26, 'p_std': 15, 'p_atr': 17, 'p_adx': 24, 'rsi_period': 20, 'ema1': 22, 'ema2': 24, 'slip_atr_k': 0.010212461913872466, 'slip_spread_k': 0.7923096630152634, 'spread_hl_frac': 0.010969087636766435, 'bb_std_mult': 1.9623707074325052, 'rsi_os': 34, 'rsi_ob': 65, 'vol_spike': 0.01879107329105445, 'adx_thresh': 11.726829985554422, 'atr_min_pct': 0.02417126332870542, 'atr_max_pct': 0.07618137580364558, 'tp_mult': 1.5807587865412502, 'tsl_mult': 0.27396417002339435, 'strategy': 'mean_reversion', 'time_stop': 197, 'use_sma': False, 'use_atr': True, 'use_adx': False, 'use_ema': False, 'use_spike': False, 'rsi_required': True, 'edge_k': 0.373196664414439, 'edge_cap': 0.7520931393594366, 'bull_strategy': 'mean_reversion', 'bull_bb_std_mult': 0.9981825754845837, 'bull_rsi_os': 51, 'bull_rsi_ob': 79, 'bull_adx_thresh': 6.33643828584135, 'bull_atr_min_pct': 0.0041851054965983394, 'bull_atr_max_pct': 0.024996026653405713, 'bull_tp_mult': 1.5558401960729222, 'bull_tsl_mult': 0.09578254289557409, 'bull_time_stop': 293, 'bull_use_sma': False, 'bull_use_ema': False, 'bull_use_atr': True, 'bull_use_adx': True, 'bull_use_spike': True, 'bull_rsi_required': False, 'bear_strategy': 'breakout', 'bear_bb_std_mult': 0.777293914188245, 'bear_rsi_os': 9, 'bear_rsi_ob': 67, 'bear_adx_thresh': 29.405024423019334, 'bear_atr_min_pct': 0.005393967277416404, 'bear_atr_max_pct': 0.05828274319089467, 'bear_tp_mult': 1.5722699720637778, 'bear_tsl_mult': 0.21763953871741953, 'bear_time_stop': 30, 'bear_use_sma': True, 'bear_use_ema': True, 'bear_use_atr': True, 'bear_use_adx': False, 'bear_use_spike': False, 'bear_rsi_required': True, 'sideways_strategy': 'breakout', 'sideways_bb_std_mult': 1.9754357338960322, 'sideways_rsi_os': 40, 'sideways_rsi_ob': 56, 'sideways_adx_thresh': 22.733641082992712, 'sideways_atr_min_pct': 0.024215148950521237, 'sideways_atr_max_pct': 0.024806829743640638, 'sideways_tp_mult': 2.0155825884255005, 'sideways_tsl_mult': 0.35851354912211525, 'sideways_time_stop': 198, 'sideways_use_sma': False, 'sideways_use_ema': True, 'sideways_use_atr': False, 'sideways_use_adx': False, 'sideways_use_spike': True, 'sideways_rsi_required': True}.
[I 2025-08-31 05:31:44,453] Trial 707 finished with values: [-1000000000.0, 1000000000.0] and parameters: {'p_sma': 56, 'p_std': 15, 'p_atr': 17, 'p_adx': 25, 'rsi_period': 12, 'ema1': 26, 'ema2': 24, 'slip_atr_k': 0.029386604875151365, 'slip_spread_k': 0.6430288592164186, 'spread_hl_frac': 0.0375665977229086, 'bb_std_mult': 1.884569155126631, 'rsi_os': 14, 'rsi_ob': 59, 'vol_spike': 0.0827493456676962, 'adx_thresh': 12.617039052977667, 'atr_min_pct': 0.014402867904154817, 'atr_max_pct': 0.09654458344443542, 'tp_mult': 1.5960807973808147, 'tsl_mult': 0.38620169027366935, 'strategy': 'mean_reversion', 'time_stop': 200, 'use_sma': False, 'use_atr': True, 'use_adx': False, 'use_ema': False, 'use_spike': False, 'rsi_required': True, 'edge_k': 1.8183991219618665, 'edge_cap': 0.7210572970816257, 'bull_strategy': 'mean_reversion', 'bull_bb_std_mult': 0.9547380039653284, 'bull_rsi_os': 52, 'bull_rsi_ob': 79, 'bull_adx_thresh': 9.476806106154067, 'bull_atr_min_pct': 0.0050281111250768725, 'bull_atr_max_pct': 0.02389640555582928, 'bull_tp_mult': 1.7587350114737985, 'bull_tsl_mult': 0.9660807948995974, 'bull_time_stop': 294, 'bull_use_sma': False, 'bull_use_ema': True, 'bull_use_atr': True, 'bull_use_adx': True, 'bull_use_spike': True, 'bull_rsi_required': False, 'bear_strategy': 'breakout', 'bear_bb_std_mult': 0.7899012543183535, 'bear_rsi_os': 10, 'bear_rsi_ob': 72, 'bear_adx_thresh': 11.992200836670511, 'bear_atr_min_pct': 0.0078311772501291, 'bear_atr_max_pct': 0.05874222918619866, 'bear_tp_mult': 1.8161419102001548, 'bear_tsl_mult': 0.6931094572625737, 'bear_time_stop': 289, 'bear_use_sma': True, 'bear_use_ema': False, 'bear_use_atr': True, 'bear_use_adx': False, 'bear_use_spike': False, 'bear_rsi_required': False, 'sideways_strategy': 'breakout', 'sideways_bb_std_mult': 1.0533207662774504, 'sideways_rsi_os': 40, 'sideways_rsi_ob': 76, 'sideways_adx_thresh': 22.598265042271976, 'sideways_atr_min_pct': 0.015345648365519321, 'sideways_atr_max_pct': 0.012016383253997443, 'sideways_tp_mult': 2.025015797910606, 'sideways_tsl_mult': 0.48266617089615954, 'sideways_time_stop': 197, 'sideways_use_sma': False, 'sideways_use_ema': True, 'sideways_use_atr': False, 'sideways_use_adx': False, 'sideways_use_spike': True, 'sideways_rsi_required': True}.
[I 2025-08-31 05:31:44,700] Trial 708 finished with values: [-1000000000.0, 1000000000.0] and parameters: {'p_sma': 56, 'p_std': 15, 'p_atr': 17, 'p_adx': 24, 'rsi_period': 22, 'ema1': 29, 'ema2': 26, 'slip_atr_k': 0.022262960763793676, 'slip_spread_k': 0.9087721863900359, 'spread_hl_frac': 0.011005029673858443, 'bb_std_mult': 1.8506406957095622, 'rsi_os': 41, 'rsi_ob': 59, 'vol_spike': 0.12822792617610398, 'adx_thresh': 10.888590430811377, 'atr_min_pct': 0.023820854310630822, 'atr_max_pct': 0.08476553771624291, 'tp_mult': 2.445843749010855, 'tsl_mult': 0.3049123684991514, 'strategy': 'mean_reversion', 'time_stop': 20, 'use_sma': False, 'use_atr': True, 'use_adx': False, 'use_ema': False, 'use_spike': True, 'rsi_required': True, 'edge_k': 0.37804635341882414, 'edge_cap': 0.7398455779021346, 'bull_strategy': 'mean_reversion', 'bull_bb_std_mult': 0.9525332059856938, 'bull_rsi_os': 50, 'bull_rsi_ob': 79, 'bull_adx_thresh': 27.08892708683548, 'bull_atr_min_pct': 0.020403334493326906, 'bull_atr_max_pct': 0.033651656422325316, 'bull_tp_mult': 1.7234197426309963, 'bull_tsl_mult': 0.09922838322039451, 'bull_time_stop': 218, 'bull_use_sma': False, 'bull_use_ema': True, 'bull_use_atr': True, 'bull_use_adx': True, 'bull_use_spike': False, 'bull_rsi_required': False, 'bear_strategy': 'breakout', 'bear_bb_std_mult': 2.7730878171870335, 'bear_rsi_os': 44, 'bear_rsi_ob': 64, 'bear_adx_thresh': 11.867516134823308, 'bear_atr_min_pct': 0.005364015977846939, 'bear_atr_max_pct': 0.04247609066755561, 'bear_tp_mult': 1.67174221297859, 'bear_tsl_mult': 0.6876212228251384, 'bear_time_stop': 13, 'bear_use_sma': True, 'bear_use_ema': False, 'bear_use_atr': True, 'bear_use_adx': False, 'bear_use_spike': False, 'bear_rsi_required': False, 'sideways_strategy': 'breakout', 'sideways_bb_std_mult': 1.995476266146076, 'sideways_rsi_os': 48, 'sideways_rsi_ob': 56, 'sideways_adx_thresh': 22.700682384747072, 'sideways_atr_min_pct': 0.024327241222925483, 'sideways_atr_max_pct': 0.05492397750954092, 'sideways_tp_mult': 2.025792962862918, 'sideways_tsl_mult': 0.4851396312326427, 'sideways_time_stop': 179, 'sideways_use_sma': False, 'sideways_use_ema': True, 'sideways_use_atr': False, 'sideways_use_adx': False, 'sideways_use_spike': True, 'sideways_rsi_required': True}.
[I 2025-08-31 05:32:33,186] Trial 709 finished with values: [-1000000000.0, 1000000000.0] and parameters: {'p_sma': 35, 'p_std': 10, 'p_atr': 14, 'p_adx': 9, 'rsi_period': 22, 'ema1': 22, 'ema2': 38, 'slip_atr_k': 0.022589924908306077, 'slip_spread_k': 0.7138966177028909, 'spread_hl_frac': 0.011778240567979315, 'bb_std_mult': 1.8441950848078026, 'rsi_os': 35, 'rsi_ob': 83, 'vol_spike': 0.014319254713060281, 'adx_thresh': 6.632346286964388, 'atr_min_pct': 0.023426502738177694, 'atr_max_pct': 0.11561007321762691, 'tp_mult': 1.6030189987008097, 'tsl_mult': 0.6846047398585496, 'strategy': 'mean_reversion', 'time_stop': 168, 'use_sma': False, 'use_atr': True, 'use_adx': False, 'use_ema': False, 'use_spike': True, 'rsi_required': True, 'edge_k': 0.6552211831599687, 'edge_cap': 0.7539561934748472, 'bull_strategy': 'mean_reversion', 'bull_bb_std_mult': 0.9552336340247631, 'bull_rsi_os': 50, 'bull_rsi_ob': 59, 'bull_adx_thresh': 27.524578582830312, 'bull_atr_min_pct': 0.02094424501001565, 'bull_atr_max_pct': 0.1439568525943154, 'bull_tp_mult': 1.7512271992196664, 'bull_tsl_mult': 0.56541173831471, 'bull_time_stop': 237, 'bull_use_sma': False, 'bull_use_ema': True, 'bull_use_atr': True, 'bull_use_adx': True, 'bull_use_spike': False, 'bull_rsi_required': False, 'bear_strategy': 'breakout', 'bear_bb_std_mult': 0.6487004442331219, 'bear_rsi_os': 44, 'bear_rsi_ob': 64, 'bear_adx_thresh': 8.109226837783508, 'bear_atr_min_pct': 0.0080198808963979, 'bear_atr_max_pct': 0.051889789776036144, 'bear_tp_mult': 1.5277373515841988, 'bear_tsl_mult': 0.27103883453915906, 'bear_time_stop': 248, 'bear_use_sma': True, 'bear_use_ema': False, 'bear_use_atr': True, 'bear_use_adx': False, 'bear_use_spike': False, 'bear_rsi_required': False, 'sideways_strategy': 'breakout', 'sideways_bb_std_mult': 1.2212719032302126, 'sideways_rsi_os': 40, 'sideways_rsi_ob': 85, 'sideways_adx_thresh': 32.30309116573409, 'sideways_atr_min_pct': 0.017334849705306386, 'sideways_atr_max_pct': 0.03943371789872783, 'sideways_tp_mult': 2.0198893011947248, 'sideways_tsl_mult': 0.45937545822382997, 'sideways_time_stop': 198, 'sideways_use_sma': False, 'sideways_use_ema': True, 'sideways_use_atr': False, 'sideways_use_adx': False, 'sideways_use_spike': True, 'sideways_rsi_required': True}.
[I 2025-08-31 05:32:33,172] Trial 712 finished with values: [-1000000000.0, 1000000000.0] and parameters: {'p_sma': 27, 'p_std': 13, 'p_atr': 14, 'p_adx': 16, 'rsi_period': 18, 'ema1': 25, 'ema2': 27, 'slip_atr_k': 0.14945686386127313, 'slip_spread_k': 0.8439050175691535, 'spread_hl_frac': 0.0431057097779766, 'bb_std_mult': 1.2507261422362816, 'rsi_os': 22, 'rsi_ob': 94, 'vol_spike': 0.011371451296954924, 'adx_thresh': 17.73954239929025, 'atr_min_pct': 0.02324849358325434, 'atr_max_pct': 0.06908237827401803, 'tp_mult': 1.2657665233969588, 'tsl_mult': 0.8281172181128771, 'strategy': 'mean_reversion', 'time_stop': 35, 'use_sma': True, 'use_atr': True, 'use_adx': False, 'use_ema': False, 'use_spike': True, 'rsi_required': True, 'edge_k': 0.6479874836274674, 'edge_cap': 0.7869784417580232, 'bull_strategy': 'breakout', 'bull_bb_std_mult': 1.1544251423611527, 'bull_rsi_os': 38, 'bull_rsi_ob': 68, 'bull_adx_thresh': 10.434919824886649, 'bull_atr_min_pct': 0.02164076814729556, 'bull_atr_max_pct': 0.0757845271580324, 'bull_tp_mult': 1.6667498329400854, 'bull_tsl_mult': 0.9278111300812313, 'bull_time_stop': 176, 'bull_use_sma': False, 'bull_use_ema': False, 'bull_use_atr': False, 'bull_use_adx': True, 'bull_use_spike': False, 'bull_rsi_required': False, 'bear_strategy': 'breakout', 'bear_bb_std_mult': 2.30801541033735, 'bear_rsi_os': 33, 'bear_rsi_ob': 78, 'bear_adx_thresh': 7.923247554204259, 'bear_atr_min_pct': 0.006751053420955486, 'bear_atr_max_pct': 0.033473425616891726, 'bear_tp_mult': 1.1623688700985575, 'bear_tsl_mult': 0.2468510786246675, 'bear_time_stop': 53, 'bear_use_sma': True, 'bear_use_ema': True, 'bear_use_atr': True, 'bear_use_adx': False, 'bear_use_spike': False, 'bear_rsi_required': True, 'sideways_strategy': 'breakout', 'sideways_bb_std_mult': 2.3811476940628715, 'sideways_rsi_os': 33, 'sideways_rsi_ob': 55, 'sideways_adx_thresh': 24.409273179167773, 'sideways_atr_min_pct': 0.014266141738300967, 'sideways_atr_max_pct': 0.02083678506129548, 'sideways_tp_mult': 1.598250668697423, 'sideways_tsl_mult': 0.45773445686070635, 'sideways_time_stop': 226, 'sideways_use_sma': True, 'sideways_use_ema': True, 'sideways_use_atr': False, 'sideways_use_adx': False, 'sideways_use_spike': True, 'sideways_rsi_required': True}.
