[I 2025-08-31 04:17:12,375] Trial 306 finished with values: [-1000000000.0, 1000000000.0] and parameters: {'p_sma': 56, 'p_std': 16, 'p_atr': 24, 'p_adx': 8, 'rsi_period': 55, 'ema1': 14, 'ema2': 29, 'slip_atr_k': 0.027340037291378325, 'slip_spread_k': 0.8097815339995891, 'spread_hl_frac': 0.011623872131136052, 'bb_std_mult': 2.3854772725623405, 'rsi_os': 26, 'rsi_ob': 61, 'vol_spike': 0.17066258061327627, 'adx_thresh': 34.87028173742671, 'atr_min_pct': 0.023619983221749394, 'atr_max_pct': 0.10587056504253446, 'tp_mult': 1.5974831466824229, 'tsl_mult': 0.5640393686092917, 'strategy': 'breakout', 'time_stop': 49, 'use_sma': False, 'use_atr': False, 'use_adx': False, 'use_ema': False, 'use_spike': True, 'rsi_required': False, 'edge_k': 1.5152649484818523, 'edge_cap': 0.929826935046412, 'bull_strategy': 'mean_reversion', 'bull_bb_std_mult': 2.545770805296812, 'bull_rsi_os': 54, 'bull_rsi_ob': 84, 'bull_adx_thresh': 30.55571389283334, 'bull_atr_min_pct': 0.00409263430864293, 'bull_atr_max_pct': 0.05518736859979545, 'bull_tp_mult': 1.7810708494753333, 'bull_tsl_mult': 0.3036334065510161, 'bull_time_stop': 115, 'bull_use_sma': False, 'bull_use_ema': True, 'bull_use_atr': True, 'bull_use_adx': False, 'bull_use_spike': False, 'bull_rsi_required': True, 'bear_strategy': 'mean_reversion', 'bear_bb_std_mult': 1.257991979316976, 'bear_rsi_os': 6, 'bear_rsi_ob': 92, 'bear_adx_thresh': 19.941674287665766, 'bear_atr_min_pct': 0.025929585567023034, 'bear_atr_max_pct': 0.0453681345864584, 'bear_tp_mult': 2.7582799006719947, 'bear_tsl_mult': 0.5002943323697079, 'bear_time_stop': 209, 'bear_use_sma': False, 'bear_use_ema': False, 'bear_use_atr': True, 'bear_use_adx': True, 'bear_use_spike': False, 'bear_rsi_required': True, 'sideways_strategy': 'mean_reversion', 'sideways_bb_std_mult': 1.0894457610008104, 'sideways_rsi_os': 41, 'sideways_rsi_ob': 95, 'sideways_adx_thresh': 22.4353378070451, 'sideways_atr_min_pct': 0.01515825419521039, 'sideways_atr_max_pct': 0.11346460925543086, 'sideways_tp_mult': 1.9644531298281056, 'sideways_tsl_mult': 0.6343647301530132, 'sideways_time_stop': 86, 'sideways_use_sma': False, 'sideways_use_ema': False, 'sideways_use_atr': False, 'sideways_use_adx': True, 'sideways_use_spike': True, 'sideways_rsi_required': False}.
[I 2025-08-31 04:17:13,447] Trial 307 finished with values: [-1000000000.0, 1000000000.0] and parameters: {'p_sma': 54, 'p_std': 50, 'p_atr': 23, 'p_adx': 14, 'rsi_period': 23, 'ema1': 14, 'ema2': 29, 'slip_atr_k': 0.24973686729271471, 'slip_spread_k': 0.08266549977877467, 'spread_hl_frac': 0.011469737441181665, 'bb_std_mult': 1.9292648022346928, 'rsi_os': 26, 'rsi_ob': 61, 'vol_spike': 0.022868487142514927, 'adx_thresh': 15.589691736362447, 'atr_min_pct': 0.023252011751102385, 'atr_max_pct': 0.13824563767762932, 'tp_mult': 2.395451692423513, 'tsl_mult': 0.8611022383831111, 'strategy': 'breakout', 'time_stop': 46, 'use_sma': False, 'use_atr': False, 'use_adx': False, 'use_ema': False, 'use_spike': True, 'rsi_required': False, 'edge_k': 1.9256949717728502, 'edge_cap': 0.9225504016679728, 'bull_strategy': 'mean_reversion', 'bull_bb_std_mult': 3.4360567912800017, 'bull_rsi_os': 23, 'bull_rsi_ob': 79, 'bull_adx_thresh': 11.542078237536028, 'bull_atr_min_pct': 0.020579000202730836, 'bull_atr_max_pct': 0.05287188224271107, 'bull_tp_mult': 2.2163228219871858, 'bull_tsl_mult': 0.9381820349843122, 'bull_time_stop': 214, 'bull_use_sma': False, 'bull_use_ema': True, 'bull_use_atr': True, 'bull_use_adx': False, 'bull_use_spike': False, 'bull_rsi_required': True, 'bear_strategy': 'mean_reversion', 'bear_bb_std_mult': 0.9297225176733163, 'bear_rsi_os': 28, 'bear_rsi_ob': 86, 'bear_adx_thresh': 19.7479533913754, 'bear_atr_min_pct': 0.0256912307547839, 'bear_atr_max_pct': 0.06203528156581818, 'bear_tp_mult': 2.7375333704881593, 'bear_tsl_mult': 0.5075806721720211, 'bear_time_stop': 100, 'bear_use_sma': False, 'bear_use_ema': False, 'bear_use_atr': True, 'bear_use_adx': True, 'bear_use_spike': False, 'bear_rsi_required': True, 'sideways_strategy': 'mean_reversion', 'sideways_bb_std_mult': 1.0912207068895687, 'sideways_rsi_os': 35, 'sideways_rsi_ob': 54, 'sideways_adx_thresh': 30.304646270391338, 'sideways_atr_min_pct': 0.011753128004102173, 'sideways_atr_max_pct': 0.04191783729514925, 'sideways_tp_mult': 1.8688176518954953, 'sideways_tsl_mult': 0.6278591087417426, 'sideways_time_stop': 86, 'sideways_use_sma': False, 'sideways_use_ema': False, 'sideways_use_atr': False, 'sideways_use_adx': False, 'sideways_use_spike': True, 'sideways_rsi_required': False}.
[I 2025-08-31 04:17:59,426] Trial 309 finished with values: [-1000000000.0, 1000000000.0] and parameters: {'p_sma': 54, 'p_std': 48, 'p_atr': 23, 'p_adx': 22, 'rsi_period': 24, 'ema1': 9, 'ema2': 50, 'slip_atr_k': 0.006152467117917688, 'slip_spread_k': 0.06260559311151068, 'spread_hl_frac': 0.00914340907289168, 'bb_std_mult': 1.9087838623946696, 'rsi_os': 31, 'rsi_ob': 59, 'vol_spike': 0.06554931543266096, 'adx_thresh': 15.735712574124726, 'atr_min_pct': 0.00023785970890883266, 'atr_max_pct': 0.05256450697709275, 'tp_mult': 2.5199653241393736, 'tsl_mult': 0.8629036713968679, 'strategy': 'mean_reversion', 'time_stop': 57, 'use_sma': True, 'use_atr': False, 'use_adx': False, 'use_ema': False, 'use_spike': True, 'rsi_required': False, 'edge_k': 1.2230191571496714, 'edge_cap': 0.3392272162854144, 'bull_strategy': 'mean_reversion', 'bull_bb_std_mult': 3.435968505194996, 'bull_rsi_os': 38, 'bull_rsi_ob': 77, 'bull_adx_thresh': 11.473934854580648, 'bull_atr_min_pct': 0.013203498808398904, 'bull_atr_max_pct': 0.08967842521960191, 'bull_tp_mult': 1.5904903267457973, 'bull_tsl_mult': 0.8104939468486742, 'bull_time_stop': 133, 'bull_use_sma': False, 'bull_use_ema': False, 'bull_use_atr': False, 'bull_use_adx': True, 'bull_use_spike': False, 'bull_rsi_required': True, 'bear_strategy': 'breakout', 'bear_bb_std_mult': 0.8264850429688559, 'bear_rsi_os': 54, 'bear_rsi_ob': 70, 'bear_adx_thresh': 5.652850971085181, 'bear_atr_min_pct': 0.01442513656745384, 'bear_atr_max_pct': 0.036166400245008445, 'bear_tp_mult': 2.7216200217685436, 'bear_tsl_mult': 0.16401698417966515, 'bear_time_stop': 123, 'bear_use_sma': True, 'bear_use_ema': True, 'bear_use_atr': True, 'bear_use_adx': True, 'bear_use_spike': True, 'bear_rsi_required': True, 'sideways_strategy': 'breakout', 'sideways_bb_std_mult': 3.320526117843431, 'sideways_rsi_os': 14, 'sideways_rsi_ob': 46, 'sideways_adx_thresh': 9.803937796983414, 'sideways_atr_min_pct': 0.012437772796530121, 'sideways_atr_max_pct': 0.054388469824739424, 'sideways_tp_mult': 2.079571253837298, 'sideways_tsl_mult': 0.6026969494279582, 'sideways_time_stop': 68, 'sideways_use_sma': False, 'sideways_use_ema': False, 'sideways_use_atr': False, 'sideways_use_adx': False, 'sideways_use_spike': True, 'sideways_rsi_required': True}.
[I 2025-08-31 04:17:59,429] Trial 311 finished with values: [-1000000000.0, 1000000000.0] and parameters: {'p_sma': 56, 'p_std': 18, 'p_atr': 22, 'p_adx': 21, 'rsi_period': 24, 'ema1': 15, 'ema2': 24, 'slip_atr_k': 0.01276202142538321, 'slip_spread_k': 0.042946279178613184, 'spread_hl_frac': 0.009169429936898637, 'bb_std_mult': 1.8789919841643528, 'rsi_os': 37, 'rsi_ob': 59, 'vol_spike': 0.17696353963899672, 'adx_thresh': 7.754267208794785, 'atr_min_pct': 0.01332061904433416, 'atr_max_pct': 0.05186412861623883, 'tp_mult': 2.012274987647144, 'tsl_mult': 0.09314446544362265, 'strategy': 'mean_reversion', 'time_stop': 29, 'use_sma': True, 'use_atr': False, 'use_adx': False, 'use_ema': False, 'use_spike': True, 'rsi_required': False, 'edge_k': 1.371028047919785, 'edge_cap': 0.9654934662338007, 'bull_strategy': 'mean_reversion', 'bull_bb_std_mult': 3.226033247486331, 'bull_rsi_os': 12, 'bull_rsi_ob': 77, 'bull_adx_thresh': 25.36925634303944, 'bull_atr_min_pct': 0.025074310408263436, 'bull_atr_max_pct': 0.04971725142306704, 'bull_tp_mult': 1.595644267742788, 'bull_tsl_mult': 0.8070424916743698, 'bull_time_stop': 132, 'bull_use_sma': False, 'bull_use_ema': False, 'bull_use_atr': False, 'bull_use_adx': True, 'bull_use_spike': False, 'bull_rsi_required': True, 'bear_strategy': 'breakout', 'bear_bb_std_mult': 0.8401731070848331, 'bear_rsi_os': 10, 'bear_rsi_ob': 46, 'bear_adx_thresh': 21.66496050381767, 'bear_atr_min_pct': 0.018266322821290724, 'bear_atr_max_pct': 0.08765623284523143, 'bear_tp_mult': 2.686979258752264, 'bear_tsl_mult': 0.22798453245001896, 'bear_time_stop': 195, 'bear_use_sma': True, 'bear_use_ema': True, 'bear_use_atr': False, 'bear_use_adx': True, 'bear_use_spike': True, 'bear_rsi_required': True, 'sideways_strategy': 'breakout', 'sideways_bb_std_mult': 0.9868609572865561, 'sideways_rsi_os': 24, 'sideways_rsi_ob': 53, 'sideways_adx_thresh': 9.863423481393239, 'sideways_atr_min_pct': 0.016447362284098665, 'sideways_atr_max_pct': 0.12287705563555838, 'sideways_tp_mult': 1.6209996734795087, 'sideways_tsl_mult': 0.6067791541502973, 'sideways_time_stop': 65, 'sideways_use_sma': False, 'sideways_use_ema': False, 'sideways_use_atr': False, 'sideways_use_adx': False, 'sideways_use_spike': True, 'sideways_rsi_required': True}.
[I 2025-08-31 04:17:59,431] Trial 308 finished with values: [-1000000000.0, 1000000000.0] and parameters: {'p_sma': 56, 'p_std': 53, 'p_atr': 23, 'p_adx': 8, 'rsi_period': 55, 'ema1': 9, 'ema2': 56, 'slip_atr_k': 0.1254408445761103, 'slip_spread_k': 0.8112174899787662, 'spread_hl_frac': 0.04276833509375777, 'bb_std_mult': 1.928407333811662, 'rsi_os': 26, 'rsi_ob': 59, 'vol_spike': 0.2110779809312984, 'adx_thresh': 13.368990523232688, 'atr_min_pct': 0.02359034635075358, 'atr_max_pct': 0.12700960566520247, 'tp_mult': 2.5168288239322605, 'tsl_mult': 0.5750947580908101, 'strategy': 'breakout', 'time_stop': 49, 'use_sma': False, 'use_atr': False, 'use_adx': False, 'use_ema': False, 'use_spike': True, 'rsi_required': False, 'edge_k': 0.7569957001726377, 'edge_cap': 0.9670662789568656, 'bull_strategy': 'mean_reversion', 'bull_bb_std_mult': 2.548827444459367, 'bull_rsi_os': 23, 'bull_rsi_ob': 77, 'bull_adx_thresh': 30.57044517463625, 'bull_atr_min_pct': 0.029958101077039584, 'bull_atr_max_pct': 0.050015598817194494, 'bull_tp_mult': 2.129317950415112, 'bull_tsl_mult': 0.917018063216484, 'bull_time_stop': 132, 'bull_use_sma': False, 'bull_use_ema': True, 'bull_use_atr': True, 'bull_use_adx': False, 'bull_use_spike': False, 'bull_rsi_required': True, 'bear_strategy': 'mean_reversion', 'bear_bb_std_mult': 0.8313210921403786, 'bear_rsi_os': 8, 'bear_rsi_ob': 81, 'bear_adx_thresh': 21.077614554236053, 'bear_atr_min_pct': 0.017963842924957323, 'bear_atr_max_pct': 0.1026702899123437, 'bear_tp_mult': 2.7455784690692466, 'bear_tsl_mult': 0.23095604223768434, 'bear_time_stop': 133, 'bear_use_sma': False, 'bear_use_ema': False, 'bear_use_atr': True, 'bear_use_adx': True, 'bear_use_spike': False, 'bear_rsi_required': True, 'sideways_strategy': 'mean_reversion', 'sideways_bb_std_mult': 1.0246915678641444, 'sideways_rsi_os': 42, 'sideways_rsi_ob': 53, 'sideways_adx_thresh': 9.756844320329543, 'sideways_atr_min_pct': 0.0117066964446417, 'sideways_atr_max_pct': 0.0795601045880602, 'sideways_tp_mult': 1.8771004291451463, 'sideways_tsl_mult': 0.6055983553616714, 'sideways_time_stop': 65, 'sideways_use_sma': False, 'sideways_use_ema': False, 'sideways_use_atr': False, 'sideways_use_adx': False, 'sideways_use_spike': True, 'sideways_rsi_required': False}.
[I 2025-08-31 04:17:59,716] Trial 310 finished with values: [-1000000000.0, 1000000000.0] and parameters: {'p_sma': 17, 'p_std': 50, 'p_atr': 23, 'p_adx': 22, 'rsi_period': 23, 'ema1': 15, 'ema2': 50, 'slip_atr_k': 0.006737627138023838, 'slip_spread_k': 0.1112179019882055, 'spread_hl_frac': 0.009261610403807522, 'bb_std_mult': 1.9023905336292224, 'rsi_os': 31, 'rsi_ob': 59, 'vol_spike': 0.022102414350615576, 'adx_thresh': 23.747508315121802, 'atr_min_pct': 0.023046008358908337, 'atr_max_pct': 0.1277231102911801, 'tp_mult': 2.525951997084277, 'tsl_mult': 0.8568061856168889, 'strategy': 'mean_reversion', 'time_stop': 196, 'use_sma': True, 'use_atr': False, 'use_adx': False, 'use_ema': False, 'use_spike': True, 'rsi_required': False, 'edge_k': 1.3823122220550685, 'edge_cap': 0.956628486861364, 'bull_strategy': 'mean_reversion', 'bull_bb_std_mult': 1.566912649833814, 'bull_rsi_os': 12, 'bull_rsi_ob': 77, 'bull_adx_thresh': 9.436680963730838, 'bull_atr_min_pct': 0.0016834131408208696, 'bull_atr_max_pct': 0.049426183822122285, 'bull_tp_mult': 2.2050082660225265, 'bull_tsl_mult': 0.912503124789186, 'bull_time_stop': 131, 'bull_use_sma': False, 'bull_use_ema': False, 'bull_use_atr': False, 'bull_use_adx': True, 'bull_use_spike': False, 'bull_rsi_required': True, 'bear_strategy': 'breakout', 'bear_bb_std_mult': 0.8562174124916049, 'bear_rsi_os': 12, 'bear_rsi_ob': 46, 'bear_adx_thresh': 18.588045395347006, 'bear_atr_min_pct': 0.018225440934446453, 'bear_atr_max_pct': 0.11728196501821117, 'bear_tp_mult': 2.7189301040497167, 'bear_tsl_mult': 0.6599797687523988, 'bear_time_stop': 125, 'bear_use_sma': True, 'bear_use_ema': True, 'bear_use_atr': True, 'bear_use_adx': True, 'bear_use_spike': True, 'bear_rsi_required': True, 'sideways_strategy': 'breakout', 'sideways_bb_std_mult': 0.9952528599939088, 'sideways_rsi_os': 24, 'sideways_rsi_ob': 53, 'sideways_adx_thresh': 9.357121211881084, 'sideways_atr_min_pct': 0.01585873664224529, 'sideways_atr_max_pct': 0.042111191563725614, 'sideways_tp_mult': 1.890470528101407, 'sideways_tsl_mult': 0.6059481380465401, 'sideways_time_stop': 67, 'sideways_use_sma': False, 'sideways_use_ema': False, 'sideways_use_atr': False, 'sideways_use_adx': False, 'sideways_use_spike': True, 'sideways_rsi_required': True}.
[I 2025-08-31 04:18:01,004] Trial 314 finished with values: [-1000000000.0, 1000000000.0] and parameters: {'p_sma': 16, 'p_std': 32, 'p_atr': 11, 'p_adx': 10, 'rsi_period': 7, 'ema1': 22, 'ema2': 23, 'slip_atr_k': 0.02307970161897205, 'slip_spread_k': 0.09935693102634041, 'spread_hl_frac': 0.009798305210148293, 'bb_std_mult': 1.8220119897672826, 'rsi_os': 43, 'rsi_ob': 60, 'vol_spike': 0.016050232708543426, 'adx_thresh': 30.872753428529283, 'atr_min_pct': 0.02173514268640521, 'atr_max_pct': 0.01961666716932281, 'tp_mult': 2.5607317021144946, 'tsl_mult': 0.8820972821968014, 'strategy': 'breakout', 'time_stop': 35, 'use_sma': False, 'use_atr': True, 'use_adx': True, 'use_ema': False, 'use_spike': True, 'rsi_required': True, 'edge_k': 1.4613965206260482, 'edge_cap': 0.9537575872206246, 'bull_strategy': 'mean_reversion', 'bull_bb_std_mult': 3.595992453199659, 'bull_rsi_os': 16, 'bull_rsi_ob': 75, 'bull_adx_thresh': 16.357462661565698, 'bull_atr_min_pct': 0.027216021974241875, 'bull_atr_max_pct': 0.0426291450347783, 'bull_tp_mult': 2.621867822777975, 'bull_tsl_mult': 0.879876267981028, 'bull_time_stop': 98, 'bull_use_sma': True, 'bull_use_ema': False, 'bull_use_atr': True, 'bull_use_adx': True, 'bull_use_spike': False, 'bull_rsi_required': True, 'bear_strategy': 'mean_reversion', 'bear_bb_std_mult': 0.9953429199941561, 'bear_rsi_os': 12, 'bear_rsi_ob': 49, 'bear_adx_thresh': 22.823719137551908, 'bear_atr_min_pct': 0.022761467312885805, 'bear_atr_max_pct': 0.046731455313367996, 'bear_tp_mult': 2.6967401624568104, 'bear_tsl_mult': 0.6649168109481425, 'bear_time_stop': 83, 'bear_use_sma': True, 'bear_use_ema': True, 'bear_use_atr': True, 'bear_use_adx': True, 'bear_use_spike': True, 'bear_rsi_required': False, 'sideways_strategy': 'mean_reversion', 'sideways_bb_std_mult': 3.0784093425554406, 'sideways_rsi_os': 12, 'sideways_rsi_ob': 54, 'sideways_adx_thresh': 11.519566615328749, 'sideways_atr_min_pct': 0.01585323488328999, 'sideways_atr_max_pct': 0.13284977040755155, 'sideways_tp_mult': 2.006435141451385, 'sideways_tsl_mult': 0.6306091981030345, 'sideways_time_stop': 236, 'sideways_use_sma': False, 'sideways_use_ema': True, 'sideways_use_atr': True, 'sideways_use_adx': True, 'sideways_use_spike': False, 'sideways_rsi_required': True}.
[I 2025-08-31 04:18:48,329] Trial 316 finished with values: [-1000000000.0, 1000000000.0] and parameters: {'p_sma': 28, 'p_std': 15, 'p_atr': 28, 'p_adx': 17, 'rsi_period': 20, 'ema1': 11, 'ema2': 20, 'slip_atr_k': 0.03850758053109611, 'slip_spread_k': 0.11547540532834535, 'spread_hl_frac': 0.007285604029595931, 'bb_std_mult': 1.8581093413082534, 'rsi_os': 29, 'rsi_ob': 57, 'vol_spike': 0.28839544304330966, 'adx_thresh': 14.498410810350201, 'atr_min_pct': 0.016018465267452164, 'atr_max_pct': 0.09850037946776903, 'tp_mult': 2.487918969660195, 'tsl_mult': 0.8279712715373589, 'strategy': 'breakout', 'time_stop': 61, 'use_sma': False, 'use_atr': True, 'use_adx': True, 'use_ema': False, 'use_spike': True, 'rsi_required': True, 'edge_k': 1.8612560093149018, 'edge_cap': 0.5531478883184195, 'bull_strategy': 'mean_reversion', 'bull_bb_std_mult': 2.020235364087136, 'bull_rsi_os': 14, 'bull_rsi_ob': 50, 'bull_adx_thresh': 9.205253161113228, 'bull_atr_min_pct': 0.0027685404809000484, 'bull_atr_max_pct': 0.0940014111634627, 'bull_tp_mult': 2.7046982775082675, 'bull_tsl_mult': 0.8696137190547973, 'bull_time_stop': 69, 'bull_use_sma': True, 'bull_use_ema': False, 'bull_use_atr': True, 'bull_use_adx': True, 'bull_use_spike': False, 'bull_rsi_required': True, 'bear_strategy': 'mean_reversion', 'bear_bb_std_mult': 1.0331162130428346, 'bear_rsi_os': 36, 'bear_rsi_ob': 47, 'bear_adx_thresh': 8.019637948619925, 'bear_atr_min_pct': 0.023134157320897148, 'bear_atr_max_pct': 0.10586808259377747, 'bear_tp_mult': 2.795767808667392, 'bear_tsl_mult': 0.9560689341496413, 'bear_time_stop': 198, 'bear_use_sma': True, 'bear_use_ema': True, 'bear_use_atr': False, 'bear_use_adx': True, 'bear_use_spike': True, 'bear_rsi_required': True, 'sideways_strategy': 'mean_reversion', 'sideways_bb_std_mult': 1.9045468053237065, 'sideways_rsi_os': 17, 'sideways_rsi_ob': 76, 'sideways_adx_thresh': 10.935484664804052, 'sideways_atr_min_pct': 0.002525321898709897, 'sideways_atr_max_pct': 0.11626527895539956, 'sideways_tp_mult': 1.978047308124437, 'sideways_tsl_mult': 0.42410517792007485, 'sideways_time_stop': 75, 'sideways_use_sma': True, 'sideways_use_ema': True, 'sideways_use_atr': True, 'sideways_use_adx': True, 'sideways_use_spike': False, 'sideways_rsi_required': True}.
[I 2025-08-31 04:18:49,922] Trial 315 finished with values: [-1000000000.0, 1000000000.0] and parameters: {'p_sma': 58, 'p_std': 17, 'p_atr': 11, 'p_adx': 29, 'rsi_period': 79, 'ema1': 5, 'ema2': 20, 'slip_atr_k': 0.03827939057607282, 'slip_spread_k': 0.024674186625309652, 'spread_hl_frac': 0.012940234152689113, 'bb_std_mult': 1.8473742757289076, 'rsi_os': 29, 'rsi_ob': 60, 'vol_spike': 0.046470596942010486, 'adx_thresh': 30.97944498472313, 'atr_min_pct': 0.02171930505301262, 'atr_max_pct': 0.09863846319200299, 'tp_mult': 1.558046725117864, 'tsl_mult': 0.8857277974859067, 'strategy': 'breakout', 'time_stop': 80, 'use_sma': False, 'use_atr': True, 'use_adx': True, 'use_ema': False, 'use_spike': True, 'rsi_required': True, 'edge_k': 1.4558870762214018, 'edge_cap': 0.9818728831976459, 'bull_strategy': 'mean_reversion', 'bull_bb_std_mult': 2.0334179195037, 'bull_rsi_os': 14, 'bull_rsi_ob': 50, 'bull_adx_thresh': 8.802440156863117, 'bull_atr_min_pct': 0.002793616516230549, 'bull_atr_max_pct': 0.04330440220103994, 'bull_tp_mult': 1.6513949341642842, 'bull_tsl_mult': 0.33158364842426413, 'bull_time_stop': 140, 'bull_use_sma': True, 'bull_use_ema': False, 'bull_use_atr': True, 'bull_use_adx': True, 'bull_use_spike': False, 'bull_rsi_required': True, 'bear_strategy': 'mean_reversion', 'bear_bb_std_mult': 2.1016652537957445, 'bear_rsi_os': 36, 'bear_rsi_ob': 49, 'bear_adx_thresh': 18.840195614186808, 'bear_atr_min_pct': 0.023179207511792164, 'bear_atr_max_pct': 0.04706097845497512, 'bear_tp_mult': 2.78014450866906, 'bear_tsl_mult': 0.24196412775865875, 'bear_time_stop': 90, 'bear_use_sma': True, 'bear_use_ema': True, 'bear_use_atr': False, 'bear_use_adx': True, 'bear_use_spike': True, 'bear_rsi_required': False, 'sideways_strategy': 'mean_reversion', 'sideways_bb_std_mult': 3.0871309055031197, 'sideways_rsi_os': 12, 'sideways_rsi_ob': 75, 'sideways_adx_thresh': 11.527054948784688, 'sideways_atr_min_pct': 0.0019302235450406099, 'sideways_atr_max_pct': 0.13376344060995793, 'sideways_tp_mult': 2.021367104940336, 'sideways_tsl_mult': 0.6338972121703764, 'sideways_time_stop': 112, 'sideways_use_sma': True, 'sideways_use_ema': True, 'sideways_use_atr': True, 'sideways_use_adx': True, 'sideways_use_spike': False, 'sideways_rsi_required': True}.
