[I 2025-08-31 03:50:37,149] Trial 143 finished with values: [-0.022042360214299173, 0.021968980012968535] and parameters: {'p_sma': 59, 'p_std': 12, 'p_atr': 24, 'p_adx': 10, 'rsi_period': 35, 'ema1': 16, 'ema2': 43, 'slip_atr_k': 0.18999389699435065, 'slip_spread_k': 0.4293035598568395, 'spread_hl_frac': 0.022651903366992826, 'bb_std_mult': 0.767723162615797, 'rsi_os': 12, 'rsi_ob': 91, 'vol_spike': 0.006947846362062256, 'adx_thresh': 25.481405068290236, 'atr_min_pct': 0.024141855482888698, 'atr_max_pct': 0.14898243817738618, 'tp_mult': 1.4135467380209998, 'tsl_mult': 0.3477446109755381, 'strategy': 'breakout', 'time_stop': 108, 'use_sma': False, 'use_atr': True, 'use_adx': False, 'use_ema': True, 'use_spike': False, 'rsi_required': False, 'edge_k': 1.6190802762269916, 'edge_cap': 0.8168616195653682, 'bull_strategy': 'mean_reversion', 'bull_bb_std_mult': 1.0709421230504976, 'bull_rsi_os': 18, 'bull_rsi_ob': 86, 'bull_adx_thresh': 21.63583935608307, 'bull_atr_min_pct': 4.213296395750605e-06, 'bull_atr_max_pct': 0.11910338233935962, 'bull_tp_mult': 1.8702535514753795, 'bull_tsl_mult': 0.5862763492115923, 'bull_time_stop': 186, 'bull_use_sma': False, 'bull_use_ema': False, 'bull_use_atr': True, 'bull_use_adx': True, 'bull_use_spike': True, 'bull_rsi_required': True, 'bear_strategy': 'mean_reversion', 'bear_bb_std_mult': 3.2502073735928056, 'bear_rsi_os': 32, 'bear_rsi_ob': 60, 'bear_adx_thresh': 20.971733658152964, 'bear_atr_min_pct': 0.012207650637158611, 'bear_atr_max_pct': 0.12592421750624982, 'bear_tp_mult': 2.325230493689688, 'bear_tsl_mult': 0.8305480142858552, 'bear_time_stop': 172, 'bear_use_sma': True, 'bear_use_ema': True, 'bear_use_atr': True, 'bear_use_adx': False, 'bear_use_spike': True, 'bear_rsi_required': True, 'sideways_strategy': 'mean_reversion', 'sideways_bb_std_mult': 2.283154689125513, 'sideways_rsi_os': 46, 'sideways_rsi_ob': 84, 'sideways_adx_thresh': 24.329049404358475, 'sideways_atr_min_pct': 0.013203625771123268, 'sideways_atr_max_pct': 0.013286668354180667, 'sideways_tp_mult': 2.680219807480026, 'sideways_tsl_mult': 0.2456924901073741, 'sideways_time_stop': 289, 'sideways_use_sma': True, 'sideways_use_ema': False, 'sideways_use_atr': False, 'sideways_use_adx': True, 'sideways_use_spike': True, 'sideways_rsi_required': True}.
[I 2025-08-31 03:51:06,556] Trial 145 finished with values: [-0.022495764344931946, 0.022421566947968322] and parameters: {'p_sma': 59, 'p_std': 11, 'p_atr': 24, 'p_adx': 10, 'rsi_period': 36, 'ema1': 16, 'ema2': 46, 'slip_atr_k': 0.1905727662399897, 'slip_spread_k': 0.4313517510825374, 'spread_hl_frac': 0.045325470608215956, 'bb_std_mult': 0.7566066428495414, 'rsi_os': 12, 'rsi_ob': 90, 'vol_spike': 0.007234416377537307, 'adx_thresh': 25.415073093017906, 'atr_min_pct': 0.024357738720420206, 'atr_max_pct': 0.1484731267723641, 'tp_mult': 1.4080120566347858, 'tsl_mult': 0.35135933374005396, 'strategy': 'breakout', 'time_stop': 108, 'use_sma': False, 'use_atr': True, 'use_adx': False, 'use_ema': True, 'use_spike': False, 'rsi_required': False, 'edge_k': 1.6488566163205256, 'edge_cap': 0.8138700497596754, 'bull_strategy': 'mean_reversion', 'bull_bb_std_mult': 1.223072013523789, 'bull_rsi_os': 19, 'bull_rsi_ob': 86, 'bull_adx_thresh': 21.44161408399388, 'bull_atr_min_pct': 8.454195784407953e-05, 'bull_atr_max_pct': 0.11993838250256503, 'bull_tp_mult': 1.869411300296603, 'bull_tsl_mult': 0.6145348495005303, 'bull_time_stop': 189, 'bull_use_sma': False, 'bull_use_ema': False, 'bull_use_atr': True, 'bull_use_adx': True, 'bull_use_spike': True, 'bull_rsi_required': True, 'bear_strategy': 'mean_reversion', 'bear_bb_std_mult': 3.2480933006478314, 'bear_rsi_os': 32, 'bear_rsi_ob': 60, 'bear_adx_thresh': 20.739727581355165, 'bear_atr_min_pct': 0.011971353498263546, 'bear_atr_max_pct': 0.12556973826849352, 'bear_tp_mult': 2.484445143275834, 'bear_tsl_mult': 0.8312421563388845, 'bear_time_stop': 173, 'bear_use_sma': True, 'bear_use_ema': True, 'bear_use_atr': True, 'bear_use_adx': False, 'bear_use_spike': True, 'bear_rsi_required': True, 'sideways_strategy': 'mean_reversion', 'sideways_bb_std_mult': 2.3047732490069976, 'sideways_rsi_os': 47, 'sideways_rsi_ob': 84, 'sideways_adx_thresh': 23.785891741162033, 'sideways_atr_min_pct': 0.00868005144755626, 'sideways_atr_max_pct': 0.015222967785110932, 'sideways_tp_mult': 2.675165519140834, 'sideways_tsl_mult': 0.24654600269167337, 'sideways_time_stop': 115, 'sideways_use_sma': True, 'sideways_use_ema': False, 'sideways_use_atr': False, 'sideways_use_adx': True, 'sideways_use_spike': True, 'sideways_rsi_required': True}.
[I 2025-08-31 03:51:06,569] Trial 148 finished with values: [-0.02036246586931667, 0.02028699820792659] and parameters: {'p_sma': 41, 'p_std': 14, 'p_atr': 24, 'p_adx': 12, 'rsi_period': 37, 'ema1': 16, 'ema2': 43, 'slip_atr_k': 0.21132293860561338, 'slip_spread_k': 0.46853159070760786, 'spread_hl_frac': 0.04378484466179549, 'bb_std_mult': 0.5037179176094685, 'rsi_os': 41, 'rsi_ob': 86, 'vol_spike': 0.018157650888711817, 'adx_thresh': 29.43609485441405, 'atr_min_pct': 0.02502725634455941, 'atr_max_pct': 0.14432183108497643, 'tp_mult': 1.3703003296789882, 'tsl_mult': 0.30324757563598803, 'strategy': 'breakout', 'time_stop': 116, 'use_sma': False, 'use_atr': True, 'use_adx': False, 'use_ema': True, 'use_spike': False, 'rsi_required': False, 'edge_k': 1.6619360383482176, 'edge_cap': 0.8708362862002931, 'bull_strategy': 'mean_reversion', 'bull_bb_std_mult': 0.9460786535953143, 'bull_rsi_os': 19, 'bull_rsi_ob': 85, 'bull_adx_thresh': 22.36362054745897, 'bull_atr_min_pct': 9.873237937430349e-05, 'bull_atr_max_pct': 0.11114409747328076, 'bull_tp_mult': 1.936846299147958, 'bull_tsl_mult': 0.5154138742617196, 'bull_time_stop': 196, 'bull_use_sma': False, 'bull_use_ema': False, 'bull_use_atr': True, 'bull_use_adx': True, 'bull_use_spike': True, 'bull_rsi_required': True, 'bear_strategy': 'mean_reversion', 'bear_bb_std_mult': 3.400363293485237, 'bear_rsi_os': 32, 'bear_rsi_ob': 58, 'bear_adx_thresh': 18.080737769251886, 'bear_atr_min_pct': 0.011590093646422075, 'bear_atr_max_pct': 0.1305741728522944, 'bear_tp_mult': 2.4809899435486122, 'bear_tsl_mult': 0.7920433592407116, 'bear_time_stop': 160, 'bear_use_sma': True, 'bear_use_ema': True, 'bear_use_atr': True, 'bear_use_adx': False, 'bear_use_spike': True, 'bear_rsi_required': True, 'sideways_strategy': 'mean_reversion', 'sideways_bb_std_mult': 2.4502255243998583, 'sideways_rsi_os': 47, 'sideways_rsi_ob': 83, 'sideways_adx_thresh': 23.52325972425853, 'sideways_atr_min_pct': 0.008573500164770612, 'sideways_atr_max_pct': 0.01839053547421929, 'sideways_tp_mult': 2.7175434962881027, 'sideways_tsl_mult': 0.24749179297467194, 'sideways_time_stop': 118, 'sideways_use_sma': True, 'sideways_use_ema': False, 'sideways_use_atr': False, 'sideways_use_adx': True, 'sideways_use_spike': True, 'sideways_rsi_required': True}.
[I 2025-08-31 03:51:06,670] Trial 146 finished with values: [-0.01998766727755752, 0.01991484735932006] and parameters: {'p_sma': 39, 'p_std': 11, 'p_atr': 24, 'p_adx': 10, 'rsi_period': 35, 'ema1': 16, 'ema2': 43, 'slip_atr_k': 0.19084557233475713, 'slip_spread_k': 0.42829711089567735, 'spread_hl_frac': 0.0016521457771036183, 'bb_std_mult': 0.7624822482047636, 'rsi_os': 12, 'rsi_ob': 86, 'vol_spike': 0.008036714270867794, 'adx_thresh': 25.92211841836185, 'atr_min_pct': 0.02463000257013776, 'atr_max_pct': 0.14965096444772535, 'tp_mult': 1.4120802619388664, 'tsl_mult': 0.34469576141721764, 'strategy': 'breakout', 'time_stop': 107, 'use_sma': False, 'use_atr': True, 'use_adx': False, 'use_ema': True, 'use_spike': False, 'rsi_required': False, 'edge_k': 1.642684754126004, 'edge_cap': 0.8168684738104997, 'bull_strategy': 'mean_reversion', 'bull_bb_std_mult': 1.2182684046882861, 'bull_rsi_os': 17, 'bull_rsi_ob': 86, 'bull_adx_thresh': 21.64239545696415, 'bull_atr_min_pct': 0.0005824105973493327, 'bull_atr_max_pct': 0.11906840625782208, 'bull_tp_mult': 1.872553044604421, 'bull_tsl_mult': 0.6016279568500478, 'bull_time_stop': 193, 'bull_use_sma': False, 'bull_use_ema': False, 'bull_use_atr': True, 'bull_use_adx': True, 'bull_use_spike': True, 'bull_rsi_required': True, 'bear_strategy': 'mean_reversion', 'bear_bb_std_mult': 3.3129015154195143, 'bear_rsi_os': 32, 'bear_rsi_ob': 60, 'bear_adx_thresh': 20.598165662163545, 'bear_atr_min_pct': 0.012101302349867414, 'bear_atr_max_pct': 0.12842693716658277, 'bear_tp_mult': 2.3122917420772495, 'bear_tsl_mult': 0.7718920954982778, 'bear_time_stop': 171, 'bear_use_sma': True, 'bear_use_ema': True, 'bear_use_atr': True, 'bear_use_adx': False, 'bear_use_spike': True, 'bear_rsi_required': True, 'sideways_strategy': 'mean_reversion', 'sideways_bb_std_mult': 2.277422286065588, 'sideways_rsi_os': 47, 'sideways_rsi_ob': 84, 'sideways_adx_thresh': 23.485664852440017, 'sideways_atr_min_pct': 0.008681420751090192, 'sideways_atr_max_pct': 0.016653461594160025, 'sideways_tp_mult': 2.7150358194135666, 'sideways_tsl_mult': 0.24648208840711333, 'sideways_time_stop': 287, 'sideways_use_sma': True, 'sideways_use_ema': False, 'sideways_use_atr': False, 'sideways_use_adx': True, 'sideways_use_spike': True, 'sideways_rsi_required': True}.
[I 2025-08-31 03:51:06,800] Trial 147 finished with values: [-0.022321355606758853, 0.0222470457368262] and parameters: {'p_sma': 59, 'p_std': 12, 'p_atr': 24, 'p_adx': 10, 'rsi_period': 36, 'ema1': 16, 'ema2': 43, 'slip_atr_k': 0.21210351779982717, 'slip_spread_k': 0.43913468855627036, 'spread_hl_frac': 0.018275532463316396, 'bb_std_mult': 0.7512586259995874, 'rsi_os': 12, 'rsi_ob': 86, 'vol_spike': 0.005303815888184033, 'adx_thresh': 25.373008681866008, 'atr_min_pct': 0.024708973169702927, 'atr_max_pct': 0.14844573234297398, 'tp_mult': 1.4182545077953808, 'tsl_mult': 0.32587274897094026, 'strategy': 'breakout', 'time_stop': 108, 'use_sma': False, 'use_atr': True, 'use_adx': False, 'use_ema': True, 'use_spike': False, 'rsi_required': False, 'edge_k': 1.6218392503304986, 'edge_cap': 0.8273985613260468, 'bull_strategy': 'mean_reversion', 'bull_bb_std_mult': 0.9126333113566062, 'bull_rsi_os': 19, 'bull_rsi_ob': 86, 'bull_adx_thresh': 21.438616415360933, 'bull_atr_min_pct': 1.7715021313703822e-06, 'bull_atr_max_pct': 0.11975342620986312, 'bull_tp_mult': 1.8671501117791969, 'bull_tsl_mult': 0.4783387910270072, 'bull_time_stop': 191, 'bull_use_sma': False, 'bull_use_ema': False, 'bull_use_atr': True, 'bull_use_adx': True, 'bull_use_spike': True, 'bull_rsi_required': True, 'bear_strategy': 'mean_reversion', 'bear_bb_std_mult': 3.2584209172792966, 'bear_rsi_os': 32, 'bear_rsi_ob': 58, 'bear_adx_thresh': 20.761787640791002, 'bear_atr_min_pct': 0.012376122252334025, 'bear_atr_max_pct': 0.12650286931412488, 'bear_tp_mult': 2.389209042520941, 'bear_tsl_mult': 0.8299008074508324, 'bear_time_stop': 171, 'bear_use_sma': True, 'bear_use_ema': True, 'bear_use_atr': True, 'bear_use_adx': False, 'bear_use_spike': True, 'bear_rsi_required': True, 'sideways_strategy': 'mean_reversion', 'sideways_bb_std_mult': 2.2448832169719903, 'sideways_rsi_os': 47, 'sideways_rsi_ob': 84, 'sideways_adx_thresh': 23.953329319597664, 'sideways_atr_min_pct': 0.008735510961170102, 'sideways_atr_max_pct': 0.014535091580573199, 'sideways_tp_mult': 2.7090165431728943, 'sideways_tsl_mult': 0.25717741682633777, 'sideways_time_stop': 288, 'sideways_use_sma': True, 'sideways_use_ema': False, 'sideways_use_atr': False, 'sideways_use_adx': True, 'sideways_use_spike': True, 'sideways_rsi_required': True}.
[I 2025-08-31 03:51:35,838] Trial 152 finished with values: [-1000000000.0, 1000000000.0] and parameters: {'p_sma': 40, 'p_std': 7, 'p_atr': 23, 'p_adx': 24, 'rsi_period': 41, 'ema1': 14, 'ema2': 51, 'slip_atr_k': 0.20235812002989012, 'slip_spread_k': 0.46625131207219356, 'spread_hl_frac': 0.02487810636608817, 'bb_std_mult': 0.6884926492345371, 'rsi_os': 9, 'rsi_ob': 88, 'vol_spike': 0.019670450027397757, 'adx_thresh': 28.91295417530545, 'atr_min_pct': 0.022660056088867227, 'atr_max_pct': 0.14431175628123874, 'tp_mult': 2.0469876432436163, 'tsl_mult': 0.3633935079993978, 'strategy': 'breakout', 'time_stop': 117, 'use_sma': False, 'use_atr': False, 'use_adx': False, 'use_ema': False, 'use_spike': True, 'rsi_required': False, 'edge_k': 1.6968439752919346, 'edge_cap': 0.7855680554449492, 'bull_strategy': 'breakout', 'bull_bb_std_mult': 1.3213303293148013, 'bull_rsi_os': 16, 'bull_rsi_ob': 88, 'bull_adx_thresh': 22.615913092998575, 'bull_atr_min_pct': 0.016198833986815018, 'bull_atr_max_pct': 0.11234446395330856, 'bull_tp_mult': 1.9650666942560184, 'bull_tsl_mult': 0.5442494121216175, 'bull_time_stop': 197, 'bull_use_sma': False, 'bull_use_ema': False, 'bull_use_atr': True, 'bull_use_adx': True, 'bull_use_spike': False, 'bull_rsi_required': False, 'bear_strategy': 'mean_reversion', 'bear_bb_std_mult': 3.4399715559525075, 'bear_rsi_os': 34, 'bear_rsi_ob': 57, 'bear_adx_thresh': 19.638975474272307, 'bear_atr_min_pct': 0.013434642181067442, 'bear_atr_max_pct': 0.11943167585128844, 'bear_tp_mult': 2.3738713914470817, 'bear_tsl_mult': 0.7802990318466851, 'bear_time_stop': 191, 'bear_use_sma': True, 'bear_use_ema': True, 'bear_use_atr': False, 'bear_use_adx': True, 'bear_use_spike': True, 'bear_rsi_required': True, 'sideways_strategy': 'mean_reversion', 'sideways_bb_std_mult': 2.473166311919936, 'sideways_rsi_os': 45, 'sideways_rsi_ob': 81, 'sideways_adx_thresh': 21.55312330952201, 'sideways_atr_min_pct': 0.01487690244585103, 'sideways_atr_max_pct': 0.019144533808061998, 'sideways_tp_mult': 2.7989265928037885, 'sideways_tsl_mult': 0.3169064691803647, 'sideways_time_stop': 280, 'sideways_use_sma': False, 'sideways_use_ema': False, 'sideways_use_atr': False, 'sideways_use_adx': False, 'sideways_use_spike': True, 'sideways_rsi_required': True}.
[I 2025-08-31 03:51:35,971] Trial 151 finished with values: [-1000000000.0, 1000000000.0] and parameters: {'p_sma': 39, 'p_std': 14, 'p_atr': 23, 'p_adx': 25, 'rsi_period': 41, 'ema1': 17, 'ema2': 42, 'slip_atr_k': 0.2095035422325937, 'slip_spread_k': 0.4580081611670257, 'spread_hl_frac': 0.0016077848361435582, 'bb_std_mult': 0.6905718929184568, 'rsi_os': 9, 'rsi_ob': 86, 'vol_spike': 0.021881295032024087, 'adx_thresh': 27.419161402315403, 'atr_min_pct': 0.020769959131911417, 'atr_max_pct': 0.14569851427746108, 'tp_mult': 1.352610861084312, 'tsl_mult': 0.32020667344902987, 'strategy': 'breakout', 'time_stop': 118, 'use_sma': False, 'use_atr': False, 'use_adx': False, 'use_ema': False, 'use_spike': True, 'rsi_required': False, 'edge_k': 1.7511485411363332, 'edge_cap': 0.8639934564994562, 'bull_strategy': 'breakout', 'bull_bb_std_mult': 0.9437262668368352, 'bull_rsi_os': 16, 'bull_rsi_ob': 88, 'bull_adx_thresh': 22.654662498064365, 'bull_atr_min_pct': 0.01654580978914566, 'bull_atr_max_pct': 0.11053554982123141, 'bull_tp_mult': 1.9604966165117426, 'bull_tsl_mult': 0.5276620007722533, 'bull_time_stop': 201, 'bull_use_sma': False, 'bull_use_ema': False, 'bull_use_atr': True, 'bull_use_adx': True, 'bull_use_spike': False, 'bull_rsi_required': False, 'bear_strategy': 'mean_reversion', 'bear_bb_std_mult': 3.3706914507477346, 'bear_rsi_os': 34, 'bear_rsi_ob': 57, 'bear_adx_thresh': 18.26204761780911, 'bear_atr_min_pct': 0.01041578553824134, 'bear_atr_max_pct': 0.11868508094343717, 'bear_tp_mult': 2.3801438866441256, 'bear_tsl_mult': 0.7781928694032098, 'bear_time_stop': 167, 'bear_use_sma': True, 'bear_use_ema': True, 'bear_use_atr': False, 'bear_use_adx': True, 'bear_use_spike': True, 'bear_rsi_required': True, 'sideways_strategy': 'mean_reversion', 'sideways_bb_std_mult': 2.0283056579191685, 'sideways_rsi_os': 49, 'sideways_rsi_ob': 83, 'sideways_adx_thresh': 23.297591321492412, 'sideways_atr_min_pct': 0.005546005918960211, 'sideways_atr_max_pct': 0.026152458718694368, 'sideways_tp_mult': 2.783009625329138, 'sideways_tsl_mult': 0.31126649520161487, 'sideways_time_stop': 287, 'sideways_use_sma': True, 'sideways_use_ema': False, 'sideways_use_atr': False, 'sideways_use_adx': False, 'sideways_use_spike': True, 'sideways_rsi_required': True}.
[I 2025-08-31 03:51:36,264] Trial 150 finished with values: [-1000000000.0, 1000000000.0] and parameters: {'p_sma': 41, 'p_std': 7, 'p_atr': 23, 'p_adx': 11, 'rsi_period': 40, 'ema1': 17, 'ema2': 43, 'slip_atr_k': 0.2110361718079134, 'slip_spread_k': 0.46808453916567067, 'spread_hl_frac': 0.0017186827854045253, 'bb_std_mult': 0.6804611966783686, 'rsi_os': 9, 'rsi_ob': 86, 'vol_spike': 0.020559347306199603, 'adx_thresh': 27.774524291384463, 'atr_min_pct': 0.023549587290593473, 'atr_max_pct': 0.14328325249490884, 'tp_mult': 1.353719783567376, 'tsl_mult': 0.31497483919367975, 'strategy': 'breakout', 'time_stop': 115, 'use_sma': True, 'use_atr': False, 'use_adx': False, 'use_ema': False, 'use_spike': True, 'rsi_required': False, 'edge_k': 1.6902716531999553, 'edge_cap': 0.7888936893266433, 'bull_strategy': 'breakout', 'bull_bb_std_mult': 0.9085306734942137, 'bull_rsi_os': 16, 'bull_rsi_ob': 88, 'bull_adx_thresh': 22.450402227983368, 'bull_atr_min_pct': 0.025885440053673877, 'bull_atr_max_pct': 0.11250176879745882, 'bull_tp_mult': 1.9320606472363753, 'bull_tsl_mult': 0.40919484825470775, 'bull_time_stop': 194, 'bull_use_sma': False, 'bull_use_ema': False, 'bull_use_atr': False, 'bull_use_adx': True, 'bull_use_spike': False, 'bull_rsi_required': False, 'bear_strategy': 'mean_reversion', 'bear_bb_std_mult': 3.4129979925148373, 'bear_rsi_os': 34, 'bear_rsi_ob': 58, 'bear_adx_thresh': 19.964151057213414, 'bear_atr_min_pct': 0.010499222110275958, 'bear_atr_max_pct': 0.1304634508276527, 'bear_tp_mult': 2.3988690494722467, 'bear_tsl_mult': 0.7713765123726051, 'bear_time_stop': 167, 'bear_use_sma': True, 'bear_use_ema': True, 'bear_use_atr': True, 'bear_use_adx': True, 'bear_use_spike': True, 'bear_rsi_required': True, 'sideways_strategy': 'mean_reversion', 'sideways_bb_std_mult': 2.427631704398901, 'sideways_rsi_os': 45, 'sideways_rsi_ob': 84, 'sideways_adx_thresh': 24.677215406834765, 'sideways_atr_min_pct': 0.005857440310352522, 'sideways_atr_max_pct': 0.019158547588314333, 'sideways_tp_mult': 2.7399038344967384, 'sideways_tsl_mult': 0.3125701908297679, 'sideways_time_stop': 101, 'sideways_use_sma': True, 'sideways_use_ema': False, 'sideways_use_atr': False, 'sideways_use_adx': False, 'sideways_use_spike': True, 'sideways_rsi_required': True}.
[I 2025-08-31 03:51:36,346] Trial 149 finished with values: [-1000000000.0, 1000000000.0] and parameters: {'p_sma': 58, 'p_std': 8, 'p_atr': 23, 'p_adx': 11, 'rsi_period': 41, 'ema1': 17, 'ema2': 43, 'slip_atr_k': 0.20137636025680092, 'slip_spread_k': 0.46856155209366324, 'spread_hl_frac': 0.019672634743035763, 'bb_std_mult': 0.7055104650639484, 'rsi_os': 40, 'rsi_ob': 88, 'vol_spike': 0.021484848937767975, 'adx_thresh': 29.368100036544988, 'atr_min_pct': 0.02345653982758306, 'atr_max_pct': 0.14525740273336324, 'tp_mult': 1.4696962698260532, 'tsl_mult': 0.31258300585031407, 'strategy': 'breakout', 'time_stop': 114, 'use_sma': True, 'use_atr': False, 'use_adx': False, 'use_ema': False, 'use_spike': True, 'rsi_required': False, 'edge_k': 1.7668439435372039, 'edge_cap': 0.8644247376925122, 'bull_strategy': 'breakout', 'bull_bb_std_mult': 0.9061412597004279, 'bull_rsi_os': 16, 'bull_rsi_ob': 88, 'bull_adx_thresh': 22.514634290494868, 'bull_atr_min_pct': 0.008419462043118359, 'bull_atr_max_pct': 0.11102160591737455, 'bull_tp_mult': 1.9712088696445038, 'bull_tsl_mult': 0.47589815005998115, 'bull_time_stop': 198, 'bull_use_sma': False, 'bull_use_ema': False, 'bull_use_atr': False, 'bull_use_adx': True, 'bull_use_spike': False, 'bull_rsi_required': False, 'bear_strategy': 'mean_reversion', 'bear_bb_std_mult': 3.406613016923221, 'bear_rsi_os': 34, 'bear_rsi_ob': 57, 'bear_adx_thresh': 19.742726835237253, 'bear_atr_min_pct': 0.013396198897941978, 'bear_atr_max_pct': 0.1194657005233983, 'bear_tp_mult': 2.3888057191718, 'bear_tsl_mult': 0.7815189212255881, 'bear_time_stop': 167, 'bear_use_sma': True, 'bear_use_ema': True, 'bear_use_atr': True, 'bear_use_adx': True, 'bear_use_spike': True, 'bear_rsi_required': True, 'sideways_strategy': 'mean_reversion', 'sideways_bb_std_mult': 2.4363133785350715, 'sideways_rsi_os': 45, 'sideways_rsi_ob': 80, 'sideways_adx_thresh': 21.664286332467583, 'sideways_atr_min_pct': 0.01467630128638148, 'sideways_atr_max_pct': 0.018693315141823576, 'sideways_tp_mult': 2.8007987530794294, 'sideways_tsl_mult': 0.3124944888655242, 'sideways_time_stop': 213, 'sideways_use_sma': True, 'sideways_use_ema': False, 'sideways_use_atr': False, 'sideways_use_adx': False, 'sideways_use_spike': True, 'sideways_rsi_required': True}.
