[I 2025-08-31 04:13:30,452] Trial 289 finished with values: [-1000000000.0, 1000000000.0] and parameters: {'p_sma': 51, 'p_std': 34, 'p_atr': 24, 'p_adx': 8, 'rsi_period': 23, 'ema1': 15, 'ema2': 34, 'slip_atr_k': 0.008797240901459863, 'slip_spread_k': 0.046920543102304486, 'spread_hl_frac': 0.04808569076958605, 'bb_std_mult': 3.112495930000298, 'rsi_os': 30, 'rsi_ob': 63, 'vol_spike': 0.22627137443408352, 'adx_thresh': 14.916835836574183, 'atr_min_pct': 0.023317472360838035, 'atr_max_pct': 0.10400751596540385, 'tp_mult': 1.199413288630792, 'tsl_mult': 0.8268258538594975, 'strategy': 'mean_reversion', 'time_stop': 257, 'use_sma': True, 'use_atr': True, 'use_adx': False, 'use_ema': False, 'use_spike': True, 'rsi_required': False, 'edge_k': 1.4978424406254662, 'edge_cap': 0.9680169498160502, 'bull_strategy': 'mean_reversion', 'bull_bb_std_mult': 3.405233599632452, 'bull_rsi_os': 17, 'bull_rsi_ob': 70, 'bull_adx_thresh': 11.024302676995054, 'bull_atr_min_pct': 0.01095903880597846, 'bull_atr_max_pct': 0.041893502910127715, 'bull_tp_mult': 2.4358657469909355, 'bull_tsl_mult': 0.9464167991302014, 'bull_time_stop': 143, 'bull_use_sma': False, 'bull_use_ema': True, 'bull_use_atr': True, 'bull_use_adx': False, 'bull_use_spike': False, 'bull_rsi_required': True, 'bear_strategy': 'breakout', 'bear_bb_std_mult': 0.7662669186161544, 'bear_rsi_os': 8, 'bear_rsi_ob': 47, 'bear_adx_thresh': 18.51554682741708, 'bear_atr_min_pct': 0.02906719709375233, 'bear_atr_max_pct': 0.04240543479191881, 'bear_tp_mult': 2.2485442737227146, 'bear_tsl_mult': 0.554388013504752, 'bear_time_stop': 188, 'bear_use_sma': False, 'bear_use_ema': False, 'bear_use_atr': False, 'bear_use_adx': True, 'bear_use_spike': False, 'bear_rsi_required': True, 'sideways_strategy': 'breakout', 'sideways_bb_std_mult': 1.1952511939157768, 'sideways_rsi_os': 44, 'sideways_rsi_ob': 57, 'sideways_adx_thresh': 11.810014002739614, 'sideways_atr_min_pct': 0.01956091960705957, 'sideways_atr_max_pct': 0.11668351937781693, 'sideways_tp_mult': 1.9250923735241174, 'sideways_tsl_mult': 0.6242840322232368, 'sideways_time_stop': 10, 'sideways_use_sma': True, 'sideways_use_ema': False, 'sideways_use_atr': False, 'sideways_use_adx': True, 'sideways_use_spike': True, 'sideways_rsi_required': False}.
[I 2025-08-31 04:13:30,613] Trial 290 finished with values: [-1000000000.0, 1000000000.0] and parameters: {'p_sma': 13, 'p_std': 34, 'p_atr': 24, 'p_adx': 8, 'rsi_period': 28, 'ema1': 12, 'ema2': 21, 'slip_atr_k': 0.029756410405653792, 'slip_spread_k': 0.05364107005264801, 'spread_hl_frac': 0.011496215904127234, 'bb_std_mult': 2.0387759848531157, 'rsi_os': 30, 'rsi_ob': 63, 'vol_spike': 0.019433260899707448, 'adx_thresh': 9.721166573574902, 'atr_min_pct': 0.02530508023274396, 'atr_max_pct': 0.10328205602364982, 'tp_mult': 2.5732735679757863, 'tsl_mult': 0.8480657352642441, 'strategy': 'mean_reversion', 'time_stop': 257, 'use_sma': True, 'use_atr': False, 'use_adx': False, 'use_ema': False, 'use_spike': True, 'rsi_required': False, 'edge_k': 1.4740018940154929, 'edge_cap': 0.3645625714131982, 'bull_strategy': 'mean_reversion', 'bull_bb_std_mult': 3.3398055226576115, 'bull_rsi_os': 40, 'bull_rsi_ob': 78, 'bull_adx_thresh': 11.076462887468237, 'bull_atr_min_pct': 0.01058720463162378, 'bull_atr_max_pct': 0.04353917890208859, 'bull_tp_mult': 1.4349638690649038, 'bull_tsl_mult': 0.37957474592242507, 'bull_time_stop': 142, 'bull_use_sma': False, 'bull_use_ema': True, 'bull_use_atr': True, 'bull_use_adx': False, 'bull_use_spike': False, 'bull_rsi_required': True, 'bear_strategy': 'breakout', 'bear_bb_std_mult': 0.7623115884627079, 'bear_rsi_os': 7, 'bear_rsi_ob': 83, 'bear_adx_thresh': 10.203245169817116, 'bear_atr_min_pct': 0.015396192576598957, 'bear_atr_max_pct': 0.023831697026061825, 'bear_tp_mult': 1.5838784200601475, 'bear_tsl_mult': 0.3478317098363589, 'bear_time_stop': 254, 'bear_use_sma': False, 'bear_use_ema': False, 'bear_use_atr': False, 'bear_use_adx': True, 'bear_use_spike': False, 'bear_rsi_required': True, 'sideways_strategy': 'breakout', 'sideways_bb_std_mult': 1.1745668831565896, 'sideways_rsi_os': 37, 'sideways_rsi_ob': 60, 'sideways_adx_thresh': 11.753899857620944, 'sideways_atr_min_pct': 0.006565763258231442, 'sideways_atr_max_pct': 0.11557968156714422, 'sideways_tp_mult': 1.9174340788241957, 'sideways_tsl_mult': 0.6115139309611787, 'sideways_time_stop': 190, 'sideways_use_sma': False, 'sideways_use_ema': False, 'sideways_use_atr': False, 'sideways_use_adx': False, 'sideways_use_spike': True, 'sideways_rsi_required': False}.
[I 2025-08-31 04:13:31,058] Trial 287 finished with values: [-0.01406254356079184, 0.014013118576191958] and parameters: {'p_sma': 32, 'p_std': 15, 'p_atr': 19, 'p_adx': 8, 'rsi_period': 24, 'ema1': 6, 'ema2': 21, 'slip_atr_k': 0.11075021075633917, 'slip_spread_k': 0.10917227682146358, 'spread_hl_frac': 0.005393873889801455, 'bb_std_mult': 3.0641908270307363, 'rsi_os': 30, 'rsi_ob': 59, 'vol_spike': 0.22699726658357544, 'adx_thresh': 32.85960949155582, 'atr_min_pct': 0.023337217700651076, 'atr_max_pct': 0.10299475922360853, 'tp_mult': 1.6773777509020769, 'tsl_mult': 0.4171519789308543, 'strategy': 'breakout', 'time_stop': 197, 'use_sma': False, 'use_atr': True, 'use_adx': False, 'use_ema': False, 'use_spike': True, 'rsi_required': False, 'edge_k': 1.32718157591038, 'edge_cap': 0.9712762000747022, 'bull_strategy': 'mean_reversion', 'bull_bb_std_mult': 3.4009840992931677, 'bull_rsi_os': 42, 'bull_rsi_ob': 45, 'bull_adx_thresh': 9.488296904790058, 'bull_atr_min_pct': 0.0016216799645117357, 'bull_atr_max_pct': 0.056024797900281836, 'bull_tp_mult': 1.6101982769292857, 'bull_tsl_mult': 0.11799591400753384, 'bull_time_stop': 145, 'bull_use_sma': False, 'bull_use_ema': False, 'bull_use_atr': True, 'bull_use_adx': False, 'bull_use_spike': False, 'bull_rsi_required': True, 'bear_strategy': 'mean_reversion', 'bear_bb_std_mult': 2.017932074623042, 'bear_rsi_os': 8, 'bear_rsi_ob': 86, 'bear_adx_thresh': 20.05465754207731, 'bear_atr_min_pct': 0.023708677126742822, 'bear_atr_max_pct': 0.04426819406992448, 'bear_tp_mult': 1.9325383476226432, 'bear_tsl_mult': 0.22813534222603474, 'bear_time_stop': 114, 'bear_use_sma': False, 'bear_use_ema': True, 'bear_use_atr': True, 'bear_use_adx': True, 'bear_use_spike': True, 'bear_rsi_required': True, 'sideways_strategy': 'mean_reversion', 'sideways_bb_std_mult': 0.9966872035134623, 'sideways_rsi_os': 40, 'sideways_rsi_ob': 54, 'sideways_adx_thresh': 11.095864328441836, 'sideways_atr_min_pct': 0.012424985487607097, 'sideways_atr_max_pct': 0.11578021181368164, 'sideways_tp_mult': 2.0037472954065856, 'sideways_tsl_mult': 0.9147548857063494, 'sideways_time_stop': 64, 'sideways_use_sma': True, 'sideways_use_ema': False, 'sideways_use_atr': False, 'sideways_use_adx': False, 'sideways_use_spike': True, 'sideways_rsi_required': False}.
[I 2025-08-31 04:14:22,292] Trial 293 finished with values: [-1000000000.0, 1000000000.0] and parameters: {'p_sma': 9, 'p_std': 55, 'p_atr': 26, 'p_adx': 10, 'rsi_period': 50, 'ema1': 22, 'ema2': 27, 'slip_atr_k': 0.062488377423608035, 'slip_spread_k': 0.10132554206397856, 'spread_hl_frac': 0.011348850339312357, 'bb_std_mult': 1.8186390079814956, 'rsi_os': 28, 'rsi_ob': 55, 'vol_spike': 0.12089869544607704, 'adx_thresh': 18.309141435864092, 'atr_min_pct': 0.018211677202850406, 'atr_max_pct': 0.047563885835057225, 'tp_mult': 2.530380348022425, 'tsl_mult': 0.8703886183337575, 'strategy': 'breakout', 'time_stop': 95, 'use_sma': False, 'use_atr': False, 'use_adx': False, 'use_ema': False, 'use_spike': True, 'rsi_required': False, 'edge_k': 1.018408028184657, 'edge_cap': 0.970220485587818, 'bull_strategy': 'mean_reversion', 'bull_bb_std_mult': 3.441972942674978, 'bull_rsi_os': 15, 'bull_rsi_ob': 79, 'bull_adx_thresh': 13.155223068435173, 'bull_atr_min_pct': 0.0022355448784792333, 'bull_atr_max_pct': 0.05021168233420109, 'bull_tp_mult': 1.687119737361202, 'bull_tsl_mult': 0.9207781733112138, 'bull_time_stop': 121, 'bull_use_sma': False, 'bull_use_ema': False, 'bull_use_atr': False, 'bull_use_adx': True, 'bull_use_spike': False, 'bull_rsi_required': True, 'bear_strategy': 'mean_reversion', 'bear_bb_std_mult': 2.3531282179357285, 'bear_rsi_os': 40, 'bear_rsi_ob': 48, 'bear_adx_thresh': 19.48008141660281, 'bear_atr_min_pct': 0.007093139044504105, 'bear_atr_max_pct': 0.048306058021627254, 'bear_tp_mult': 2.773243104454294, 'bear_tsl_mult': 0.19422618021302837, 'bear_time_stop': 73, 'bear_use_sma': True, 'bear_use_ema': True, 'bear_use_atr': True, 'bear_use_adx': True, 'bear_use_spike': True, 'bear_rsi_required': True, 'sideways_strategy': 'mean_reversion', 'sideways_bb_std_mult': 0.9350865521279365, 'sideways_rsi_os': 39, 'sideways_rsi_ob': 67, 'sideways_adx_thresh': 10.979598075405818, 'sideways_atr_min_pct': 0.0138324863056399, 'sideways_atr_max_pct': 0.11300467389497346, 'sideways_tp_mult': 1.9945029278964652, 'sideways_tsl_mult': 0.648153258025153, 'sideways_time_stop': 70, 'sideways_use_sma': False, 'sideways_use_ema': False, 'sideways_use_atr': False, 'sideways_use_adx': False, 'sideways_use_spike': True, 'sideways_rsi_required': True}.
[I 2025-08-31 04:14:22,758] Trial 292 finished with values: [-1000000000.0, 1000000000.0] and parameters: {'p_sma': 55, 'p_std': 26, 'p_atr': 24, 'p_adx': 10, 'rsi_period': 28, 'ema1': 12, 'ema2': 22, 'slip_atr_k': 0.07008336198778575, 'slip_spread_k': 0.10386944547220613, 'spread_hl_frac': 0.005229019290787857, 'bb_std_mult': 2.0371460775798744, 'rsi_os': 28, 'rsi_ob': 60, 'vol_spike': 0.2567368857828002, 'adx_thresh': 9.800203075944548, 'atr_min_pct': 0.0217278379551509, 'atr_max_pct': 0.024596596888327854, 'tp_mult': 2.567170174809697, 'tsl_mult': 0.8600906003819707, 'strategy': 'breakout', 'time_stop': 18, 'use_sma': False, 'use_atr': False, 'use_adx': False, 'use_ema': False, 'use_spike': True, 'rsi_required': False, 'edge_k': 1.3361834089975813, 'edge_cap': 0.9811071881929626, 'bull_strategy': 'mean_reversion', 'bull_bb_std_mult': 3.3159451570101535, 'bull_rsi_os': 15, 'bull_rsi_ob': 78, 'bull_adx_thresh': 13.492500861891902, 'bull_atr_min_pct': 0.023914435088490803, 'bull_atr_max_pct': 0.03568992569436449, 'bull_tp_mult': 1.555440040471527, 'bull_tsl_mult': 0.37757324131913816, 'bull_time_stop': 265, 'bull_use_sma': False, 'bull_use_ema': False, 'bull_use_atr': True, 'bull_use_adx': True, 'bull_use_spike': False, 'bull_rsi_required': True, 'bear_strategy': 'mean_reversion', 'bear_bb_std_mult': 2.3276264752944815, 'bear_rsi_os': 39, 'bear_rsi_ob': 49, 'bear_adx_thresh': 19.321368734413245, 'bear_atr_min_pct': 0.02384316738694122, 'bear_atr_max_pct': 0.047991016616613896, 'bear_tp_mult': 2.845612370660217, 'bear_tsl_mult': 0.2010862191723028, 'bear_time_stop': 63, 'bear_use_sma': True, 'bear_use_ema': True, 'bear_use_atr': True, 'bear_use_adx': True, 'bear_use_spike': True, 'bear_rsi_required': True, 'sideways_strategy': 'mean_reversion', 'sideways_bb_std_mult': 0.9159790249600205, 'sideways_rsi_os': 21, 'sideways_rsi_ob': 52, 'sideways_adx_thresh': 11.428942386195638, 'sideways_atr_min_pct': 0.006525526460073197, 'sideways_atr_max_pct': 0.11996589098292174, 'sideways_tp_mult': 1.995499981423507, 'sideways_tsl_mult': 0.9194336750397056, 'sideways_time_stop': 79, 'sideways_use_sma': False, 'sideways_use_ema': False, 'sideways_use_atr': False, 'sideways_use_adx': False, 'sideways_use_spike': True, 'sideways_rsi_required': True}.
[I 2025-08-31 04:14:22,891] Trial 291 finished with values: [-1000000000.0, 1000000000.0] and parameters: {'p_sma': 56, 'p_std': 37, 'p_atr': 24, 'p_adx': 16, 'rsi_period': 19, 'ema1': 28, 'ema2': 27, 'slip_atr_k': 0.00957837910429693, 'slip_spread_k': 0.2637754405001581, 'spread_hl_frac': 0.013635105691353889, 'bb_std_mult': 1.8153221800378307, 'rsi_os': 30, 'rsi_ob': 60, 'vol_spike': 0.01987012615459026, 'adx_thresh': 16.36525377976779, 'atr_min_pct': 0.02554647511335159, 'atr_max_pct': 0.0484394708517235, 'tp_mult': 2.564519541125832, 'tsl_mult': 0.8385005310790535, 'strategy': 'breakout', 'time_stop': 54, 'use_sma': True, 'use_atr': False, 'use_adx': False, 'use_ema': False, 'use_spike': True, 'rsi_required': False, 'edge_k': 0.19825502331298728, 'edge_cap': 0.963154961048247, 'bull_strategy': 'mean_reversion', 'bull_bb_std_mult': 3.3268682739734166, 'bull_rsi_os': 15, 'bull_rsi_ob': 78, 'bull_adx_thresh': 17.715721327640228, 'bull_atr_min_pct': 0.0023698682904598257, 'bull_atr_max_pct': 0.04938903456619736, 'bull_tp_mult': 1.2006422312403142, 'bull_tsl_mult': 0.12590928355598802, 'bull_time_stop': 143, 'bull_use_sma': False, 'bull_use_ema': True, 'bull_use_atr': True, 'bull_use_adx': False, 'bull_use_spike': False, 'bull_rsi_required': True, 'bear_strategy': 'mean_reversion', 'bear_bb_std_mult': 0.8697503021357651, 'bear_rsi_os': 49, 'bear_rsi_ob': 83, 'bear_adx_thresh': 10.238524023914838, 'bear_atr_min_pct': 0.029005108123845, 'bear_atr_max_pct': 0.042483414496058136, 'bear_tp_mult': 2.5280572289676253, 'bear_tsl_mult': 0.20341106487033525, 'bear_time_stop': 202, 'bear_use_sma': False, 'bear_use_ema': False, 'bear_use_atr': True, 'bear_use_adx': True, 'bear_use_spike': False, 'bear_rsi_required': True, 'sideways_strategy': 'mean_reversion', 'sideways_bb_std_mult': 0.9123262520276232, 'sideways_rsi_os': 39, 'sideways_rsi_ob': 60, 'sideways_adx_thresh': 11.70105952352161, 'sideways_atr_min_pct': 0.01386691269091602, 'sideways_atr_max_pct': 0.1152005246438179, 'sideways_tp_mult': 1.9929653674784586, 'sideways_tsl_mult': 0.6121399600452366, 'sideways_time_stop': 80, 'sideways_use_sma': False, 'sideways_use_ema': False, 'sideways_use_atr': False, 'sideways_use_adx': False, 'sideways_use_spike': True, 'sideways_rsi_required': False}.
[I 2025-08-31 04:14:24,610] Trial 294 finished with values: [-1000000000.0, 1000000000.0] and parameters: {'p_sma': 19, 'p_std': 19, 'p_atr': 25, 'p_adx': 23, 'rsi_period': 47, 'ema1': 13, 'ema2': 27, 'slip_atr_k': 0.07172993585609011, 'slip_spread_k': 0.0986743752228437, 'spread_hl_frac': 0.013766196183036261, 'bb_std_mult': 1.8167918006666859, 'rsi_os': 28, 'rsi_ob': 55, 'vol_spike': 0.00882822822176176, 'adx_thresh': 17.222178036771883, 'atr_min_pct': 0.015074190026933734, 'atr_max_pct': 0.13298817492460505, 'tp_mult': 2.8460467613229334, 'tsl_mult': 0.9332590058557825, 'strategy': 'breakout', 'time_stop': 40, 'use_sma': False, 'use_atr': False, 'use_adx': False, 'use_ema': False, 'use_spike': True, 'rsi_required': False, 'edge_k': 0.18858434593314066, 'edge_cap': 0.19855516762893738, 'bull_strategy': 'mean_reversion', 'bull_bb_std_mult': 3.437930801836204, 'bull_rsi_os': 15, 'bull_rsi_ob': 82, 'bull_adx_thresh': 13.440918723189316, 'bull_atr_min_pct': 0.0023739430012322833, 'bull_atr_max_pct': 0.05071739431542947, 'bull_tp_mult': 1.5515787938660146, 'bull_tsl_mult': 0.9106311443664525, 'bull_time_stop': 126, 'bull_use_sma': False, 'bull_use_ema': False, 'bull_use_atr': False, 'bull_use_adx': True, 'bull_use_spike': False, 'bull_rsi_required': True, 'bear_strategy': 'mean_reversion', 'bear_bb_std_mult': 2.3264091638593465, 'bear_rsi_os': 48, 'bear_rsi_ob': 89, 'bear_adx_thresh': 19.37252972789034, 'bear_atr_min_pct': 0.023812731622035704, 'bear_atr_max_pct': 0.04380965804103477, 'bear_tp_mult': 2.8566911580068286, 'bear_tsl_mult': 0.19151152902798507, 'bear_time_stop': 203, 'bear_use_sma': True, 'bear_use_ema': True, 'bear_use_atr': True, 'bear_use_adx': True, 'bear_use_spike': True, 'bear_rsi_required': True, 'sideways_strategy': 'mean_reversion', 'sideways_bb_std_mult': 1.1226777193852662, 'sideways_rsi_os': 39, 'sideways_rsi_ob': 52, 'sideways_adx_thresh': 11.181196699431894, 'sideways_atr_min_pct': 0.014071348408052246, 'sideways_atr_max_pct': 0.11918879480959249, 'sideways_tp_mult': 1.6832407989272484, 'sideways_tsl_mult': 0.6502949994726848, 'sideways_time_stop': 121, 'sideways_use_sma': False, 'sideways_use_ema': False, 'sideways_use_atr': False, 'sideways_use_adx': True, 'sideways_use_spike': True, 'sideways_rsi_required': True}.
[I 2025-08-31 04:15:20,074] Trial 295 finished with values: [-1000000000.0, 1000000000.0] and parameters: {'p_sma': 38, 'p_std': 19, 'p_atr': 19, 'p_adx': 23, 'rsi_period': 19, 'ema1': 13, 'ema2': 23, 'slip_atr_k': 0.015277828893631672, 'slip_spread_k': 0.7844159355647757, 'spread_hl_frac': 0.005774855034553182, 'bb_std_mult': 1.89051460700498, 'rsi_os': 14, 'rsi_ob': 60, 'vol_spike': 0.021261822187971346, 'adx_thresh': 7.342845628284321, 'atr_min_pct': 0.014984691297600083, 'atr_max_pct': 0.1328766129599772, 'tp_mult': 2.105770209835118, 'tsl_mult': 0.9314869798840426, 'strategy': 'breakout', 'time_stop': 41, 'use_sma': False, 'use_atr': False, 'use_adx': False, 'use_ema': False, 'use_spike': True, 'rsi_required': False, 'edge_k': 0.20399824359429142, 'edge_cap': 0.6689980580250008, 'bull_strategy': 'mean_reversion', 'bull_bb_std_mult': 3.496733976727313, 'bull_rsi_os': 5, 'bull_rsi_ob': 60, 'bull_adx_thresh': 28.062448392235424, 'bull_atr_min_pct': 0.009598890863570915, 'bull_atr_max_pct': 0.034761555565240396, 'bull_tp_mult': 1.5471441179531416, 'bull_tsl_mult': 0.8932007315944833, 'bull_time_stop': 15, 'bull_use_sma': False, 'bull_use_ema': False, 'bull_use_atr': True, 'bull_use_adx': True, 'bull_use_spike': False, 'bull_rsi_required': True, 'bear_strategy': 'mean_reversion', 'bear_bb_std_mult': 0.9319467636609593, 'bear_rsi_os': 11, 'bear_rsi_ob': 49, 'bear_adx_thresh': 29.996883585583294, 'bear_atr_min_pct': 0.023765479439495477, 'bear_atr_max_pct': 0.04398988126245719, 'bear_tp_mult': 1.6901034754718833, 'bear_tsl_mult': 0.22664563488478334, 'bear_time_stop': 201, 'bear_use_sma': True, 'bear_use_ema': True, 'bear_use_atr': True, 'bear_use_adx': True, 'bear_use_spike': True, 'bear_rsi_required': True, 'sideways_strategy': 'mean_reversion', 'sideways_bb_std_mult': 3.593031348693134, 'sideways_rsi_os': 19, 'sideways_rsi_ob': 52, 'sideways_adx_thresh': 10.274194113902677, 'sideways_atr_min_pct': 0.014206923889160422, 'sideways_atr_max_pct': 0.06585201036014775, 'sideways_tp_mult': 1.1840406659107257, 'sideways_tsl_mult': 0.7093939178223483, 'sideways_time_stop': 48, 'sideways_use_sma': False, 'sideways_use_ema': False, 'sideways_use_atr': False, 'sideways_use_adx': True, 'sideways_use_spike': True, 'sideways_rsi_required': True}.
[I 2025-08-31 04:15:20,563] Trial 297 finished with values: [-1000000000.0, 1000000000.0] and parameters: {'p_sma': 52, 'p_std': 5, 'p_atr': 15, 'p_adx': 20, 'rsi_period': 60, 'ema1': 13, 'ema2': 25, 'slip_atr_k': 0.01593457118095572, 'slip_spread_k': 0.5059655946298839, 'spread_hl_frac': 0.01762040847955792, 'bb_std_mult': 1.8662674340261356, 'rsi_os': 23, 'rsi_ob': 73, 'vol_spike': 0.010589333923863116, 'adx_thresh': 13.630149498212859, 'atr_min_pct': 0.024517016042295933, 'atr_max_pct': 0.11049486690471318, 'tp_mult': 2.658355535304202, 'tsl_mult': 0.9396810924604958, 'strategy': 'breakout', 'time_stop': 40, 'use_sma': False, 'use_atr': True, 'use_adx': True, 'use_ema': False, 'use_spike': True, 'rsi_required': True, 'edge_k': 0.9414980733248396, 'edge_cap': 0.9825383058606315, 'bull_strategy': 'mean_reversion', 'bull_bb_std_mult': 3.5029530147529155, 'bull_rsi_os': 12, 'bull_rsi_ob': 56, 'bull_adx_thresh': 9.866682850543935, 'bull_atr_min_pct': 0.017765891446110415, 'bull_atr_max_pct': 0.046530501656098205, 'bull_tp_mult': 1.5446520813485665, 'bull_tsl_mult': 0.8929724553897602, 'bull_time_stop': 15, 'bull_use_sma': True, 'bull_use_ema': False, 'bull_use_atr': False, 'bull_use_adx': True, 'bull_use_spike': False, 'bull_rsi_required': True, 'bear_strategy': 'mean_reversion', 'bear_bb_std_mult': 2.044981412314916, 'bear_rsi_os': 11, 'bear_rsi_ob': 47, 'bear_adx_thresh': 20.63168074581895, 'bear_atr_min_pct': 0.025054922241397763, 'bear_atr_max_pct': 0.04351436327273645, 'bear_tp_mult': 1.9289272229745038, 'bear_tsl_mult': 0.4691374989441417, 'bear_time_stop': 244, 'bear_use_sma': True, 'bear_use_ema': True, 'bear_use_atr': True, 'bear_use_adx': True, 'bear_use_spike': True, 'bear_rsi_required': True, 'sideways_strategy': 'mean_reversion', 'sideways_bb_std_mult': 1.1242432491244598, 'sideways_rsi_os': 30, 'sideways_rsi_ob': 58, 'sideways_adx_thresh': 10.179111118567347, 'sideways_atr_min_pct': 0.014278759235789425, 'sideways_atr_max_pct': 0.11888910840644148, 'sideways_tp_mult': 2.0237387772344113, 'sideways_tsl_mult': 0.08098511395531466, 'sideways_time_stop': 63, 'sideways_use_sma': False, 'sideways_use_ema': True, 'sideways_use_atr': True, 'sideways_use_adx': True, 'sideways_use_spike': False, 'sideways_rsi_required': True}.
