[I 2025-08-31 06:01:49,552] Trial 863 finished with values: [-0.010585490255444863, 0.010527791122354486] and parameters: {'p_sma': 28, 'p_std': 48, 'p_atr': 12, 'p_adx': 25, 'rsi_period': 43, 'ema1': 17, 'ema2': 19, 'slip_atr_k': 0.014297939791462903, 'slip_spread_k': 0.8420917638489156, 'spread_hl_frac': 0.0011398052952333022, 'bb_std_mult': 3.5923507489422124, 'rsi_os': 48, 'rsi_ob': 69, 'vol_spike': 0.09228090198947803, 'adx_thresh': 7.670789931044693, 'atr_min_pct': 0.008263259464862862, 'atr_max_pct': 0.11935456178998066, 'tp_mult': 2.1701429576154845, 'tsl_mult': 0.4061985946654808, 'strategy': 'mean_reversion', 'time_stop': 284, 'use_sma': True, 'use_atr': True, 'use_adx': False, 'use_ema': True, 'use_spike': False, 'rsi_required': True, 'edge_k': 0.8899143780985648, 'edge_cap': 0.3864308577135798, 'bull_strategy': 'breakout', 'bull_bb_std_mult': 1.5993369108571354, 'bull_rsi_os': 34, 'bull_rsi_ob': 72, 'bull_adx_thresh': 34.44303550433595, 'bull_atr_min_pct': 0.015940647336146314, 'bull_atr_max_pct': 0.08631930676692047, 'bull_tp_mult': 1.3941485233115454, 'bull_tsl_mult': 0.7206353812304277, 'bull_time_stop': 195, 'bull_use_sma': False, 'bull_use_ema': True, 'bull_use_atr': False, 'bull_use_adx': False, 'bull_use_spike': True, 'bull_rsi_required': False, 'bear_strategy': 'breakout', 'bear_bb_std_mult': 2.4465450702397313, 'bear_rsi_os': 6, 'bear_rsi_ob': 58, 'bear_adx_thresh': 14.378097709308532, 'bear_atr_min_pct': 0.0008639370478348917, 'bear_atr_max_pct': 0.12220419080105238, 'bear_tp_mult': 1.0967669810221148, 'bear_tsl_mult': 0.06805153210665119, 'bear_time_stop': 243, 'bear_use_sma': True, 'bear_use_ema': False, 'bear_use_atr': False, 'bear_use_adx': False, 'bear_use_spike': False, 'bear_rsi_required': False, 'sideways_strategy': 'breakout', 'sideways_bb_std_mult': 1.6608913929692477, 'sideways_rsi_os': 43, 'sideways_rsi_ob': 46, 'sideways_adx_thresh': 21.103336824649656, 'sideways_atr_min_pct': 0.0020488279217827747, 'sideways_atr_max_pct': 0.04418740716515761, 'sideways_tp_mult': 2.3919646082461488, 'sideways_tsl_mult': 0.2678534994996556, 'sideways_time_stop': 131, 'sideways_use_sma': True, 'sideways_use_ema': True, 'sideways_use_atr': False, 'sideways_use_adx': False, 'sideways_use_spike': True, 'sideways_rsi_required': False}.
[I 2025-08-31 06:02:39,622] Trial 866 finished with values: [-1000000000.0, 1000000000.0] and parameters: {'p_sma': 29, 'p_std': 46, 'p_atr': 12, 'p_adx': 24, 'rsi_period': 71, 'ema1': 17, 'ema2': 21, 'slip_atr_k': 0.012874672549679984, 'slip_spread_k': 0.8638114262060863, 'spread_hl_frac': 0.0011737193453570474, 'bb_std_mult': 3.444717669773252, 'rsi_os': 48, 'rsi_ob': 69, 'vol_spike': 0.09305065346808764, 'adx_thresh': 7.588005512575533, 'atr_min_pct': 0.008073544504515707, 'atr_max_pct': 0.12127597324009765, 'tp_mult': 2.1498738845423953, 'tsl_mult': 0.40037139934479476, 'strategy': 'mean_reversion', 'time_stop': 17, 'use_sma': True, 'use_atr': True, 'use_adx': False, 'use_ema': True, 'use_spike': False, 'rsi_required': True, 'edge_k': 0.8880249401173856, 'edge_cap': 0.3875558186243849, 'bull_strategy': 'breakout', 'bull_bb_std_mult': 1.5850836541885107, 'bull_rsi_os': 34, 'bull_rsi_ob': 72, 'bull_adx_thresh': 34.41804870672826, 'bull_atr_min_pct': 0.016043800816606283, 'bull_atr_max_pct': 0.08904522558202764, 'bull_tp_mult': 1.3698933749175373, 'bull_tsl_mult': 0.6773611619740034, 'bull_time_stop': 193, 'bull_use_sma': False, 'bull_use_ema': True, 'bull_use_atr': False, 'bull_use_adx': False, 'bull_use_spike': True, 'bull_rsi_required': False, 'bear_strategy': 'breakout', 'bear_bb_std_mult': 2.2660972707619056, 'bear_rsi_os': 6, 'bear_rsi_ob': 59, 'bear_adx_thresh': 14.41854369668224, 'bear_atr_min_pct': 0.000677596647933093, 'bear_atr_max_pct': 0.1237589778288776, 'bear_tp_mult': 2.097820744724575, 'bear_tsl_mult': 0.06814026606281581, 'bear_time_stop': 243, 'bear_use_sma': False, 'bear_use_ema': False, 'bear_use_atr': True, 'bear_use_adx': False, 'bear_use_spike': False, 'bear_rsi_required': False, 'sideways_strategy': 'breakout', 'sideways_bb_std_mult': 1.737497641978635, 'sideways_rsi_os': 43, 'sideways_rsi_ob': 46, 'sideways_adx_thresh': 22.537579484143535, 'sideways_atr_min_pct': 0.002572043899784578, 'sideways_atr_max_pct': 0.043752559991580016, 'sideways_tp_mult': 2.4569056165727563, 'sideways_tsl_mult': 0.3208147190497759, 'sideways_time_stop': 132, 'sideways_use_sma': True, 'sideways_use_ema': True, 'sideways_use_atr': False, 'sideways_use_adx': False, 'sideways_use_spike': True, 'sideways_rsi_required': False}.
[I 2025-08-31 06:02:40,271] Trial 868 finished with values: [-0.008967983006611169, 0.008957648793810695] and parameters: {'p_sma': 29, 'p_std': 47, 'p_atr': 11, 'p_adx': 24, 'rsi_period': 17, 'ema1': 17, 'ema2': 20, 'slip_atr_k': 0.0658523872165105, 'slip_spread_k': 0.8420515264128096, 'spread_hl_frac': 1.060554351823843e-05, 'bb_std_mult': 3.4433339227096518, 'rsi_os': 45, 'rsi_ob': 69, 'vol_spike': 0.09418548753947723, 'adx_thresh': 9.03721626917607, 'atr_min_pct': 0.007758949477673655, 'atr_max_pct': 0.11761843352175592, 'tp_mult': 2.134009761283143, 'tsl_mult': 0.4012644872578767, 'strategy': 'mean_reversion', 'time_stop': 172, 'use_sma': True, 'use_atr': True, 'use_adx': False, 'use_ema': False, 'use_spike': False, 'rsi_required': True, 'edge_k': 0.8710362348701383, 'edge_cap': 0.3891050415605328, 'bull_strategy': 'breakout', 'bull_bb_std_mult': 1.5941822662253147, 'bull_rsi_os': 32, 'bull_rsi_ob': 73, 'bull_adx_thresh': 34.32318449189283, 'bull_atr_min_pct': 0.015873002310063118, 'bull_atr_max_pct': 0.08822747919490664, 'bull_tp_mult': 1.3982459665890943, 'bull_tsl_mult': 0.6773948422461009, 'bull_time_stop': 202, 'bull_use_sma': False, 'bull_use_ema': True, 'bull_use_atr': False, 'bull_use_adx': False, 'bull_use_spike': False, 'bull_rsi_required': False, 'bear_strategy': 'breakout', 'bear_bb_std_mult': 2.264545924160771, 'bear_rsi_os': 6, 'bear_rsi_ob': 59, 'bear_adx_thresh': 14.41536277610425, 'bear_atr_min_pct': 0.0006644016445451541, 'bear_atr_max_pct': 0.11887957531075559, 'bear_tp_mult': 1.0889029942827793, 'bear_tsl_mult': 0.06242814652488634, 'bear_time_stop': 237, 'bear_use_sma': False, 'bear_use_ema': False, 'bear_use_atr': True, 'bear_use_adx': False, 'bear_use_spike': False, 'bear_rsi_required': False, 'sideways_strategy': 'breakout', 'sideways_bb_std_mult': 1.5812193316756018, 'sideways_rsi_os': 44, 'sideways_rsi_ob': 46, 'sideways_adx_thresh': 22.71140387479921, 'sideways_atr_min_pct': 0.00278116825187711, 'sideways_atr_max_pct': 0.04253526033420039, 'sideways_tp_mult': 2.2847499566544998, 'sideways_tsl_mult': 0.28346920038853424, 'sideways_time_stop': 124, 'sideways_use_sma': True, 'sideways_use_ema': True, 'sideways_use_atr': False, 'sideways_use_adx': False, 'sideways_use_spike': True, 'sideways_rsi_required': False}.
[I 2025-08-31 06:02:40,756] Trial 865 finished with values: [-1000000000.0, 1000000000.0] and parameters: {'p_sma': 29, 'p_std': 46, 'p_atr': 12, 'p_adx': 24, 'rsi_period': 70, 'ema1': 17, 'ema2': 21, 'slip_atr_k': 0.10726717763741542, 'slip_spread_k': 0.8481512431566476, 'spread_hl_frac': 0.0012329480046374915, 'bb_std_mult': 3.460292137415807, 'rsi_os': 48, 'rsi_ob': 69, 'vol_spike': 0.0930775166596384, 'adx_thresh': 7.388727698048215, 'atr_min_pct': 0.007923147786579009, 'atr_max_pct': 0.12105271480964448, 'tp_mult': 2.130410997321029, 'tsl_mult': 0.4045807074719925, 'strategy': 'mean_reversion', 'time_stop': 173, 'use_sma': True, 'use_atr': True, 'use_adx': False, 'use_ema': True, 'use_spike': False, 'rsi_required': True, 'edge_k': 0.8806642820088586, 'edge_cap': 0.37808233511485856, 'bull_strategy': 'breakout', 'bull_bb_std_mult': 1.5769457292156606, 'bull_rsi_os': 34, 'bull_rsi_ob': 72, 'bull_adx_thresh': 34.46252870808411, 'bull_atr_min_pct': 0.01593275169936999, 'bull_atr_max_pct': 0.08791061956426331, 'bull_tp_mult': 1.3867896220691962, 'bull_tsl_mult': 0.6753938456163233, 'bull_time_stop': 203, 'bull_use_sma': False, 'bull_use_ema': True, 'bull_use_atr': False, 'bull_use_adx': False, 'bull_use_spike': True, 'bull_rsi_required': False, 'bear_strategy': 'breakout', 'bear_bb_std_mult': 2.25872503795513, 'bear_rsi_os': 6, 'bear_rsi_ob': 59, 'bear_adx_thresh': 14.564402875875585, 'bear_atr_min_pct': 0.0006289006186027718, 'bear_atr_max_pct': 0.12252864633531742, 'bear_tp_mult': 1.091389809479989, 'bear_tsl_mult': 0.0671060919265169, 'bear_time_stop': 244, 'bear_use_sma': False, 'bear_use_ema': False, 'bear_use_atr': True, 'bear_use_adx': False, 'bear_use_spike': False, 'bear_rsi_required': False, 'sideways_strategy': 'breakout', 'sideways_bb_std_mult': 1.751971374897925, 'sideways_rsi_os': 43, 'sideways_rsi_ob': 46, 'sideways_adx_thresh': 22.57961965744972, 'sideways_atr_min_pct': 0.002708560767009901, 'sideways_atr_max_pct': 0.0429116778241142, 'sideways_tp_mult': 2.287078065111484, 'sideways_tsl_mult': 0.3208385894684304, 'sideways_time_stop': 132, 'sideways_use_sma': True, 'sideways_use_ema': True, 'sideways_use_atr': False, 'sideways_use_adx': False, 'sideways_use_spike': True, 'sideways_rsi_required': False}.
[I 2025-08-31 06:02:41,499] Trial 867 finished with values: [-1000000000.0, 1000000000.0] and parameters: {'p_sma': 29, 'p_std': 46, 'p_atr': 12, 'p_adx': 24, 'rsi_period': 63, 'ema1': 17, 'ema2': 21, 'slip_atr_k': 0.0665167624537043, 'slip_spread_k': 0.848184911468616, 'spread_hl_frac': 0.0011865778408606989, 'bb_std_mult': 3.450368734499706, 'rsi_os': 48, 'rsi_ob': 69, 'vol_spike': 0.0940841252604879, 'adx_thresh': 7.546170458531716, 'atr_min_pct': 0.007786142568098718, 'atr_max_pct': 0.12063139413945918, 'tp_mult': 2.155241131885469, 'tsl_mult': 0.401138364019639, 'strategy': 'mean_reversion', 'time_stop': 123, 'use_sma': True, 'use_atr': True, 'use_adx': False, 'use_ema': True, 'use_spike': False, 'rsi_required': True, 'edge_k': 0.8780269975095578, 'edge_cap': 0.3837862074097655, 'bull_strategy': 'breakout', 'bull_bb_std_mult': 1.5853139165435064, 'bull_rsi_os': 34, 'bull_rsi_ob': 73, 'bull_adx_thresh': 34.39524571362366, 'bull_atr_min_pct': 0.015747235507249477, 'bull_atr_max_pct': 0.08831647480461621, 'bull_tp_mult': 1.4113880928541025, 'bull_tsl_mult': 0.6771769101294068, 'bull_time_stop': 193, 'bull_use_sma': False, 'bull_use_ema': True, 'bull_use_atr': False, 'bull_use_adx': False, 'bull_use_spike': True, 'bull_rsi_required': False, 'bear_strategy': 'breakout', 'bear_bb_std_mult': 2.2597297942375105, 'bear_rsi_os': 6, 'bear_rsi_ob': 59, 'bear_adx_thresh': 14.830624621895748, 'bear_atr_min_pct': 0.0006413657332151029, 'bear_atr_max_pct': 0.12263755875892088, 'bear_tp_mult': 1.0969323312291743, 'bear_tsl_mult': 0.06576155367099397, 'bear_time_stop': 244, 'bear_use_sma': False, 'bear_use_ema': False, 'bear_use_atr': True, 'bear_use_adx': False, 'bear_use_spike': False, 'bear_rsi_required': False, 'sideways_strategy': 'breakout', 'sideways_bb_std_mult': 1.7845831794533686, 'sideways_rsi_os': 43, 'sideways_rsi_ob': 46, 'sideways_adx_thresh': 22.38551106835668, 'sideways_atr_min_pct': 0.002473538433944159, 'sideways_atr_max_pct': 0.04358542157135456, 'sideways_tp_mult': 2.4554265045907195, 'sideways_tsl_mult': 0.3209481423603509, 'sideways_time_stop': 127, 'sideways_use_sma': True, 'sideways_use_ema': True, 'sideways_use_atr': False, 'sideways_use_adx': False, 'sideways_use_spike': True, 'sideways_rsi_required': False}.
[I 2025-08-31 06:03:29,918] Trial 871 finished with values: [-1000000000.0, 1000000000.0] and parameters: {'p_sma': 31, 'p_std': 47, 'p_atr': 11, 'p_adx': 26, 'rsi_period': 48, 'ema1': 16, 'ema2': 21, 'slip_atr_k': 0.09192835124781404, 'slip_spread_k': 0.8357228233712453, 'spread_hl_frac': 9.397604729830325e-05, 'bb_std_mult': 3.51152775670883, 'rsi_os': 47, 'rsi_ob': 71, 'vol_spike': 0.09060347324993827, 'adx_thresh': 8.94385596156602, 'atr_min_pct': 0.009008081573224068, 'atr_max_pct': 0.11796341795475464, 'tp_mult': 2.0647434368101654, 'tsl_mult': 0.4657254525868364, 'strategy': 'mean_reversion', 'time_stop': 21, 'use_sma': True, 'use_atr': True, 'use_adx': True, 'use_ema': False, 'use_spike': False, 'rsi_required': True, 'edge_k': 0.8592933126679276, 'edge_cap': 0.32951513970425306, 'bull_strategy': 'breakout', 'bull_bb_std_mult': 1.6471826980704705, 'bull_rsi_os': 32, 'bull_rsi_ob': 70, 'bull_adx_thresh': 32.605956240002826, 'bull_atr_min_pct': 0.015643728386578938, 'bull_atr_max_pct': 0.08184639656949011, 'bull_tp_mult': 1.399684573579417, 'bull_tsl_mult': 0.7117150778862734, 'bull_time_stop': 204, 'bull_use_sma': True, 'bull_use_ema': True, 'bull_use_atr': False, 'bull_use_adx': False, 'bull_use_spike': False, 'bull_rsi_required': False, 'bear_strategy': 'breakout', 'bear_bb_std_mult': 2.3559566203589046, 'bear_rsi_os': 5, 'bear_rsi_ob': 60, 'bear_adx_thresh': 14.963145651743954, 'bear_atr_min_pct': 0.0018723800595658216, 'bear_atr_max_pct': 0.1196576522408219, 'bear_tp_mult': 2.4121112112041105, 'bear_tsl_mult': 0.014537329304081623, 'bear_time_stop': 236, 'bear_use_sma': True, 'bear_use_ema': False, 'bear_use_atr': True, 'bear_use_adx': False, 'bear_use_spike': False, 'bear_rsi_required': False, 'sideways_strategy': 'breakout', 'sideways_bb_std_mult': 1.5911383898447182, 'sideways_rsi_os': 44, 'sideways_rsi_ob': 48, 'sideways_adx_thresh': 21.870998498172995, 'sideways_atr_min_pct': 0.0032167628852119334, 'sideways_atr_max_pct': 0.042746925544459045, 'sideways_tp_mult': 2.4665137251543396, 'sideways_tsl_mult': 0.28612654589288183, 'sideways_time_stop': 124, 'sideways_use_sma': True, 'sideways_use_ema': True, 'sideways_use_atr': True, 'sideways_use_adx': False, 'sideways_use_spike': False, 'sideways_rsi_required': False}.
[I 2025-08-31 06:03:30,099] Trial 869 finished with values: [-1000000000.0, 1000000000.0] and parameters: {'p_sma': 31, 'p_std': 47, 'p_atr': 11, 'p_adx': 26, 'rsi_period': 17, 'ema1': 17, 'ema2': 21, 'slip_atr_k': 0.12899560351663744, 'slip_spread_k': 0.8402776002945633, 'spread_hl_frac': 0.0012981616227798148, 'bb_std_mult': 3.5090715696732473, 'rsi_os': 45, 'rsi_ob': 71, 'vol_spike': 0.09041980909362793, 'adx_thresh': 8.971693591469435, 'atr_min_pct': 0.007603803339395164, 'atr_max_pct': 0.12072617931514915, 'tp_mult': 2.132305113350177, 'tsl_mult': 0.4681721282810866, 'strategy': 'mean_reversion', 'time_stop': 210, 'use_sma': True, 'use_atr': True, 'use_adx': False, 'use_ema': False, 'use_spike': False, 'rsi_required': True, 'edge_k': 0.9685969825639809, 'edge_cap': 0.3302396218242782, 'bull_strategy': 'breakout', 'bull_bb_std_mult': 1.6544120189612486, 'bull_rsi_os': 32, 'bull_rsi_ob': 70, 'bull_adx_thresh': 32.704507816866204, 'bull_atr_min_pct': 0.015587213156487787, 'bull_atr_max_pct': 0.08831592607634371, 'bull_tp_mult': 1.3919293551957486, 'bull_tsl_mult': 0.702124101864866, 'bull_time_stop': 203, 'bull_use_sma': False, 'bull_use_ema': True, 'bull_use_atr': False, 'bull_use_adx': False, 'bull_use_spike': False, 'bull_rsi_required': False, 'bear_strategy': 'breakout', 'bear_bb_std_mult': 2.372490642698177, 'bear_rsi_os': 6, 'bear_rsi_ob': 60, 'bear_adx_thresh': 14.946104588757661, 'bear_atr_min_pct': 0.0005659494378458142, 'bear_atr_max_pct': 0.12051779702866458, 'bear_tp_mult': 1.085039940822381, 'bear_tsl_mult': 0.011370971250321105, 'bear_time_stop': 236, 'bear_use_sma': False, 'bear_use_ema': False, 'bear_use_atr': True, 'bear_use_adx': False, 'bear_use_spike': False, 'bear_rsi_required': False, 'sideways_strategy': 'breakout', 'sideways_bb_std_mult': 1.8045419581188573, 'sideways_rsi_os': 43, 'sideways_rsi_ob': 46, 'sideways_adx_thresh': 22.46066672255949, 'sideways_atr_min_pct': 0.0031836974392835922, 'sideways_atr_max_pct': 0.04258462391359782, 'sideways_tp_mult': 2.3028836611236367, 'sideways_tsl_mult': 0.2844573561822033, 'sideways_time_stop': 125, 'sideways_use_sma': True, 'sideways_use_ema': True, 'sideways_use_atr': False, 'sideways_use_adx': False, 'sideways_use_spike': True, 'sideways_rsi_required': False}.
[I 2025-08-31 06:03:30,491] Trial 872 finished with values: [-1000000000.0, 1000000000.0] and parameters: {'p_sma': 31, 'p_std': 47, 'p_atr': 11, 'p_adx': 26, 'rsi_period': 48, 'ema1': 16, 'ema2': 20, 'slip_atr_k': 0.1763609014085589, 'slip_spread_k': 0.8418027289600213, 'spread_hl_frac': 0.0009290924190363118, 'bb_std_mult': 3.528251528950577, 'rsi_os': 45, 'rsi_ob': 71, 'vol_spike': 0.08901414518568358, 'adx_thresh': 9.037944638656827, 'atr_min_pct': 0.009161642931575925, 'atr_max_pct': 0.11624876725272994, 'tp_mult': 2.036281408306088, 'tsl_mult': 0.4697887651771861, 'strategy': 'mean_reversion', 'time_stop': 17, 'use_sma': True, 'use_atr': True, 'use_adx': True, 'use_ema': False, 'use_spike': False, 'rsi_required': True, 'edge_k': 0.9521540011916159, 'edge_cap': 0.33569889400438235, 'bull_strategy': 'breakout', 'bull_bb_std_mult': 1.6644788183255277, 'bull_rsi_os': 33, 'bull_rsi_ob': 70, 'bull_adx_thresh': 32.48073317915395, 'bull_atr_min_pct': 0.016493045717498444, 'bull_atr_max_pct': 0.08386133533956945, 'bull_tp_mult': 1.4047197993415037, 'bull_tsl_mult': 0.7120264394252469, 'bull_time_stop': 205, 'bull_use_sma': True, 'bull_use_ema': True, 'bull_use_atr': False, 'bull_use_adx': False, 'bull_use_spike': False, 'bull_rsi_required': False, 'bear_strategy': 'breakout', 'bear_bb_std_mult': 2.3513744582542966, 'bear_rsi_os': 5, 'bear_rsi_ob': 61, 'bear_adx_thresh': 15.190872098674568, 'bear_atr_min_pct': 0.0015516646198778922, 'bear_atr_max_pct': 0.12848569729844508, 'bear_tp_mult': 1.1846163924935362, 'bear_tsl_mult': 0.02318692951883792, 'bear_time_stop': 235, 'bear_use_sma': True, 'bear_use_ema': False, 'bear_use_atr': True, 'bear_use_adx': False, 'bear_use_spike': False, 'bear_rsi_required': False, 'sideways_strategy': 'breakout', 'sideways_bb_std_mult': 1.576117859582545, 'sideways_rsi_os': 44, 'sideways_rsi_ob': 48, 'sideways_adx_thresh': 21.741922927794768, 'sideways_atr_min_pct': 0.0028789617184428566, 'sideways_atr_max_pct': 0.04890379816037537, 'sideways_tp_mult': 2.466598340134904, 'sideways_tsl_mult': 0.2840887352841446, 'sideways_time_stop': 123, 'sideways_use_sma': True, 'sideways_use_ema': True, 'sideways_use_atr': True, 'sideways_use_adx': False, 'sideways_use_spike': False, 'sideways_rsi_required': False}.
[I 2025-08-31 06:03:31,183] Trial 870 finished with values: [-1000000000.0, 1000000000.0] and parameters: {'p_sma': 31, 'p_std': 46, 'p_atr': 11, 'p_adx': 26, 'rsi_period': 75, 'ema1': 16, 'ema2': 21, 'slip_atr_k': 0.1975763218059624, 'slip_spread_k': 0.8406228131305307, 'spread_hl_frac': 0.0011952475332991934, 'bb_std_mult': 3.5346366164384855, 'rsi_os': 47, 'rsi_ob': 70, 'vol_spike': 0.09416800074738402, 'adx_thresh': 8.925616826655332, 'atr_min_pct': 0.00913637624019255, 'atr_max_pct': 0.1169698333796368, 'tp_mult': 2.0387267309802204, 'tsl_mult': 0.4706310192340738, 'strategy': 'mean_reversion', 'time_stop': 17, 'use_sma': True, 'use_atr': True, 'use_adx': False, 'use_ema': False, 'use_spike': False, 'rsi_required': True, 'edge_k': 0.9681981868110434, 'edge_cap': 0.3409070599612041, 'bull_strategy': 'breakout', 'bull_bb_std_mult': 1.6663673217114057, 'bull_rsi_os': 32, 'bull_rsi_ob': 73, 'bull_adx_thresh': 32.7193778361138, 'bull_atr_min_pct': 0.01579520487977283, 'bull_atr_max_pct': 0.0835856690836701, 'bull_tp_mult': 1.406412759776035, 'bull_tsl_mult': 0.7022634095964412, 'bull_time_stop': 204, 'bull_use_sma': False, 'bull_use_ema': True, 'bull_use_atr': False, 'bull_use_adx': False, 'bull_use_spike': False, 'bull_rsi_required': False, 'bear_strategy': 'breakout', 'bear_bb_std_mult': 2.3636525357700284, 'bear_rsi_os': 5, 'bear_rsi_ob': 60, 'bear_adx_thresh': 14.87980156900121, 'bear_atr_min_pct': 0.000677541139746795, 'bear_atr_max_pct': 0.12023950861573769, 'bear_tp_mult': 1.103110364433852, 'bear_tsl_mult': 0.017838174821629534, 'bear_time_stop': 236, 'bear_use_sma': False, 'bear_use_ema': False, 'bear_use_atr': True, 'bear_use_adx': False, 'bear_use_spike': False, 'bear_rsi_required': False, 'sideways_strategy': 'breakout', 'sideways_bb_std_mult': 1.6578386714870073, 'sideways_rsi_os': 43, 'sideways_rsi_ob': 46, 'sideways_adx_thresh': 22.519718574539556, 'sideways_atr_min_pct': 0.0027875220976784076, 'sideways_atr_max_pct': 0.04149059163114083, 'sideways_tp_mult': 2.460667298839316, 'sideways_tsl_mult': 0.28068523127406697, 'sideways_time_stop': 122, 'sideways_use_sma': True, 'sideways_use_ema': True, 'sideways_use_atr': False, 'sideways_use_adx': False, 'sideways_use_spike': True, 'sideways_rsi_required': False}.
