[I 2025-08-31 03:38:40,959] Trial 45 finished with values: [-1000000000.0, 1000000000.0] and parameters: {'p_sma': 36, 'p_std': 16, 'p_atr': 21, 'p_adx': 13, 'rsi_period': 22, 'ema1': 28, 'ema2': 51, 'slip_atr_k': 0.18036782203582638, 'slip_spread_k': 0.44771363874323816, 'spread_hl_frac': 0.033606856573815444, 'bb_std_mult': 1.3431880237226017, 'rsi_os': 39, 'rsi_ob': 57, 'vol_spike': 0.17538540140502637, 'adx_thresh': 20.132534414258906, 'atr_min_pct': 0.0020061284848445493, 'atr_max_pct': 0.10780487511057998, 'tp_mult': 2.865642459496007, 'tsl_mult': 0.6496278202731003, 'strategy': 'breakout', 'time_stop': 216, 'use_sma': True, 'use_atr': True, 'use_adx': False, 'use_ema': False, 'use_spike': True, 'rsi_required': True, 'edge_k': 1.5489985666818042, 'edge_cap': 0.1173649983919669, 'bull_strategy': 'mean_reversion', 'bull_bb_std_mult': 0.8689289074835576, 'bull_rsi_os': 16, 'bull_rsi_ob': 83, 'bull_adx_thresh': 7.260660784421038, 'bull_atr_min_pct': 0.010502337863787702, 'bull_atr_max_pct': 0.0417457178983314, 'bull_tp_mult': 1.207007673254075, 'bull_tsl_mult': 0.38673816988238563, 'bull_time_stop': 33, 'bull_use_sma': False, 'bull_use_ema': False, 'bull_use_atr': False, 'bull_use_adx': True, 'bull_use_spike': True, 'bull_rsi_required': True, 'bear_strategy': 'mean_reversion', 'bear_bb_std_mult': 1.4768707662442895, 'bear_rsi_os': 16, 'bear_rsi_ob': 88, 'bear_adx_thresh': 22.90289276988897, 'bear_atr_min_pct': 0.0036463328538147693, 'bear_atr_max_pct': 0.13058720406722144, 'bear_tp_mult': 1.1241084737676248, 'bear_tsl_mult': 0.27171700302689944, 'bear_time_stop': 210, 'bear_use_sma': True, 'bear_use_ema': True, 'bear_use_atr': True, 'bear_use_adx': True, 'bear_use_spike': False, 'bear_rsi_required': False, 'sideways_strategy': 'mean_reversion', 'sideways_bb_std_mult': 2.907269960175211, 'sideways_rsi_os': 31, 'sideways_rsi_ob': 64, 'sideways_adx_thresh': 27.015108364593477, 'sideways_atr_min_pct': 0.014252361950034187, 'sideways_atr_max_pct': 0.04869161347983165, 'sideways_tp_mult': 2.2272971381065756, 'sideways_tsl_mult': 0.7791699973329418, 'sideways_time_stop': 275, 'sideways_use_sma': False, 'sideways_use_ema': True, 'sideways_use_atr': True, 'sideways_use_adx': True, 'sideways_use_spike': True, 'sideways_rsi_required': False}.
[I 2025-08-31 03:39:11,040] Trial 47 finished with values: [-1000000000.0, 1000000000.0] and parameters: {'p_sma': 35, 'p_std': 16, 'p_atr': 16, 'p_adx': 20, 'rsi_period': 56, 'ema1': 28, 'ema2': 49, 'slip_atr_k': 0.18753050557350703, 'slip_spread_k': 0.10684581935599602, 'spread_hl_frac': 0.035580909410577184, 'bb_std_mult': 2.6813836741666908, 'rsi_os': 41, 'rsi_ob': 69, 'vol_spike': 0.2602191315827395, 'adx_thresh': 27.45166413045154, 'atr_min_pct': 0.0029429114982862346, 'atr_max_pct': 0.023167447607588924, 'tp_mult': 2.8913401483243444, 'tsl_mult': 0.8755623749221085, 'strategy': 'mean_reversion', 'time_stop': 211, 'use_sma': False, 'use_atr': False, 'use_adx': False, 'use_ema': False, 'use_spike': False, 'rsi_required': True, 'edge_k': 1.5462631520937418, 'edge_cap': 0.9866790525529674, 'bull_strategy': 'breakout', 'bull_bb_std_mult': 3.5113385314037195, 'bull_rsi_os': 15, 'bull_rsi_ob': 84, 'bull_adx_thresh': 10.587581211601213, 'bull_atr_min_pct': 0.023591927967431234, 'bull_atr_max_pct': 0.08447671232646113, 'bull_tp_mult': 1.1848616738598112, 'bull_tsl_mult': 0.9423928096950857, 'bull_time_stop': 28, 'bull_use_sma': True, 'bull_use_ema': False, 'bull_use_atr': False, 'bull_use_adx': True, 'bull_use_spike': True, 'bull_rsi_required': False, 'bear_strategy': 'mean_reversion', 'bear_bb_std_mult': 3.340013342780716, 'bear_rsi_os': 26, 'bear_rsi_ob': 76, 'bear_adx_thresh': 23.13320640084962, 'bear_atr_min_pct': 0.02157479061455042, 'bear_atr_max_pct': 0.12751125871466973, 'bear_tp_mult': 1.1420562819248121, 'bear_tsl_mult': 0.38890493601892867, 'bear_time_stop': 152, 'bear_use_sma': True, 'bear_use_ema': True, 'bear_use_atr': True, 'bear_use_adx': False, 'bear_use_spike': False, 'bear_rsi_required': False, 'sideways_strategy': 'breakout', 'sideways_bb_std_mult': 3.462829602420846, 'sideways_rsi_os': 5, 'sideways_rsi_ob': 64, 'sideways_adx_thresh': 14.520348302119215, 'sideways_atr_min_pct': 0.0273999119512328, 'sideways_atr_max_pct': 0.024628491737084868, 'sideways_tp_mult': 2.246767427312405, 'sideways_tsl_mult': 0.7885543735244873, 'sideways_time_stop': 275, 'sideways_use_sma': True, 'sideways_use_ema': True, 'sideways_use_atr': True, 'sideways_use_adx': False, 'sideways_use_spike': False, 'sideways_rsi_required': False}.
[I 2025-08-31 03:39:11,541] Trial 48 finished with values: [-1000000000.0, 1000000000.0] and parameters: {'p_sma': 27, 'p_std': 37, 'p_atr': 16, 'p_adx': 20, 'rsi_period': 10, 'ema1': 29, 'ema2': 49, 'slip_atr_k': 0.015154248839956072, 'slip_spread_k': 0.621673495645215, 'spread_hl_frac': 0.034364382834057614, 'bb_std_mult': 2.7680130285215627, 'rsi_os': 38, 'rsi_ob': 62, 'vol_spike': 0.26116360776339, 'adx_thresh': 17.718431305822058, 'atr_min_pct': 0.00918530964276301, 'atr_max_pct': 0.06955458358192843, 'tp_mult': 2.8651340849362867, 'tsl_mult': 0.26790851826272843, 'strategy': 'mean_reversion', 'time_stop': 242, 'use_sma': False, 'use_atr': False, 'use_adx': True, 'use_ema': False, 'use_spike': False, 'rsi_required': True, 'edge_k': 1.5135272535141668, 'edge_cap': 0.4776979426181869, 'bull_strategy': 'breakout', 'bull_bb_std_mult': 3.30192918409952, 'bull_rsi_os': 53, 'bull_rsi_ob': 48, 'bull_adx_thresh': 10.74176652077297, 'bull_atr_min_pct': 0.023991885002137888, 'bull_atr_max_pct': 0.08333784611548191, 'bull_tp_mult': 1.706405933417398, 'bull_tsl_mult': 0.046138984766816715, 'bull_time_stop': 31, 'bull_use_sma': True, 'bull_use_ema': False, 'bull_use_atr': False, 'bull_use_adx': False, 'bull_use_spike': True, 'bull_rsi_required': False, 'bear_strategy': 'mean_reversion', 'bear_bb_std_mult': 1.5425131679408055, 'bear_rsi_os': 26, 'bear_rsi_ob': 80, 'bear_adx_thresh': 33.06835689359608, 'bear_atr_min_pct': 0.026895504460545158, 'bear_atr_max_pct': 0.06231965952455802, 'bear_tp_mult': 2.156699383738879, 'bear_tsl_mult': 0.016106080669136436, 'bear_time_stop': 149, 'bear_use_sma': True, 'bear_use_ema': False, 'bear_use_atr': True, 'bear_use_adx': False, 'bear_use_spike': False, 'bear_rsi_required': False, 'sideways_strategy': 'breakout', 'sideways_bb_std_mult': 3.4909210826792325, 'sideways_rsi_os': 40, 'sideways_rsi_ob': 64, 'sideways_adx_thresh': 28.344576692394348, 'sideways_atr_min_pct': 0.014109543452437218, 'sideways_atr_max_pct': 0.02753511746855007, 'sideways_tp_mult': 2.362916543454598, 'sideways_tsl_mult': 0.7595873847972948, 'sideways_time_stop': 274, 'sideways_use_sma': True, 'sideways_use_ema': True, 'sideways_use_atr': True, 'sideways_use_adx': False, 'sideways_use_spike': False, 'sideways_rsi_required': False}.
[I 2025-08-31 03:39:11,547] Trial 46 finished with values: [-1000000000.0, 1000000000.0] and parameters: {'p_sma': 37, 'p_std': 16, 'p_atr': 16, 'p_adx': 20, 'rsi_period': 56, 'ema1': 28, 'ema2': 49, 'slip_atr_k': 0.019093339424980094, 'slip_spread_k': 0.10708948693453424, 'spread_hl_frac': 0.014687601257671315, 'bb_std_mult': 3.2300470224131868, 'rsi_os': 39, 'rsi_ob': 56, 'vol_spike': 0.17389629801452466, 'adx_thresh': 19.346312869138572, 'atr_min_pct': 5.6725968100263674e-05, 'atr_max_pct': 0.03325424877676552, 'tp_mult': 2.786564122531294, 'tsl_mult': 0.6364063454337155, 'strategy': 'breakout', 'time_stop': 204, 'use_sma': False, 'use_atr': True, 'use_adx': False, 'use_ema': False, 'use_spike': True, 'rsi_required': True, 'edge_k': 1.5094092792479912, 'edge_cap': 0.11472711433697108, 'bull_strategy': 'breakout', 'bull_bb_std_mult': 3.5651567432363755, 'bull_rsi_os': 13, 'bull_rsi_ob': 85, 'bull_adx_thresh': 5.702874023798385, 'bull_atr_min_pct': 0.01105285114592744, 'bull_atr_max_pct': 0.04742670458174618, 'bull_tp_mult': 1.6295088655317373, 'bull_tsl_mult': 0.11395687535343912, 'bull_time_stop': 271, 'bull_use_sma': True, 'bull_use_ema': False, 'bull_use_atr': False, 'bull_use_adx': True, 'bull_use_spike': True, 'bull_rsi_required': True, 'bear_strategy': 'mean_reversion', 'bear_bb_std_mult': 3.199823714033828, 'bear_rsi_os': 16, 'bear_rsi_ob': 80, 'bear_adx_thresh': 23.42513708666373, 'bear_atr_min_pct': 0.0036514621377190994, 'bear_atr_max_pct': 0.021703671797693593, 'bear_tp_mult': 2.1812170187382716, 'bear_tsl_mult': 0.002471780974423632, 'bear_time_stop': 152, 'bear_use_sma': True, 'bear_use_ema': True, 'bear_use_atr': True, 'bear_use_adx': False, 'bear_use_spike': False, 'bear_rsi_required': False, 'sideways_strategy': 'mean_reversion', 'sideways_bb_std_mult': 0.8292651172053549, 'sideways_rsi_os': 20, 'sideways_rsi_ob': 64, 'sideways_adx_thresh': 14.29879811993932, 'sideways_atr_min_pct': 0.01419663898932206, 'sideways_atr_max_pct': 0.12447146297483126, 'sideways_tp_mult': 2.2588167039991145, 'sideways_tsl_mult': 0.7984608150289622, 'sideways_time_stop': 278, 'sideways_use_sma': False, 'sideways_use_ema': True, 'sideways_use_atr': True, 'sideways_use_adx': True, 'sideways_use_spike': True, 'sideways_rsi_required': False}.
[I 2025-08-31 03:39:11,741] Trial 49 finished with values: [-1000000000.0, 1000000000.0] and parameters: {'p_sma': 8, 'p_std': 41, 'p_atr': 16, 'p_adx': 7, 'rsi_period': 12, 'ema1': 8, 'ema2': 40, 'slip_atr_k': 0.05812908473821016, 'slip_spread_k': 0.7295210766117882, 'spread_hl_frac': 0.02178587949604133, 'bb_std_mult': 0.6584687256287169, 'rsi_os': 37, 'rsi_ob': 70, 'vol_spike': 0.25308774139557266, 'adx_thresh': 17.785542017767554, 'atr_min_pct': 0.009161493526153214, 'atr_max_pct': 0.02238003206112072, 'tp_mult': 2.9922330598897227, 'tsl_mult': 0.2584142849877805, 'strategy': 'mean_reversion', 'time_stop': 141, 'use_sma': False, 'use_atr': False, 'use_adx': True, 'use_ema': True, 'use_spike': False, 'rsi_required': True, 'edge_k': 1.8928671671934827, 'edge_cap': 0.4683703397369931, 'bull_strategy': 'breakout', 'bull_bb_std_mult': 3.321640350872949, 'bull_rsi_os': 53, 'bull_rsi_ob': 48, 'bull_adx_thresh': 12.27787710227492, 'bull_atr_min_pct': 0.015118537085486548, 'bull_atr_max_pct': 0.12068968905060418, 'bull_tp_mult': 1.7108791054197299, 'bull_tsl_mult': 0.02050661077649446, 'bull_time_stop': 107, 'bull_use_sma': True, 'bull_use_ema': True, 'bull_use_atr': False, 'bull_use_adx': False, 'bull_use_spike': True, 'bull_rsi_required': False, 'bear_strategy': 'breakout', 'bear_bb_std_mult': 3.327821118307443, 'bear_rsi_os': 26, 'bear_rsi_ob': 76, 'bear_adx_thresh': 32.71056421169152, 'bear_atr_min_pct': 0.020547231595379016, 'bear_atr_max_pct': 0.06527837606346383, 'bear_tp_mult': 2.1509656504722803, 'bear_tsl_mult': 0.9433929264053466, 'bear_time_stop': 9, 'bear_use_sma': False, 'bear_use_ema': False, 'bear_use_atr': True, 'bear_use_adx': False, 'bear_use_spike': False, 'bear_rsi_required': False, 'sideways_strategy': 'breakout', 'sideways_bb_std_mult': 3.428219423767093, 'sideways_rsi_os': 40, 'sideways_rsi_ob': 63, 'sideways_adx_thresh': 20.7916700705211, 'sideways_atr_min_pct': 0.02738152074176089, 'sideways_atr_max_pct': 0.14983386831773243, 'sideways_tp_mult': 2.835368972497528, 'sideways_tsl_mult': 0.4102339225436442, 'sideways_time_stop': 164, 'sideways_use_sma': True, 'sideways_use_ema': True, 'sideways_use_atr': True, 'sideways_use_adx': False, 'sideways_use_spike': False, 'sideways_rsi_required': False}.
[I 2025-08-31 03:39:40,250] Trial 53 finished with values: [-1000000000.0, 1000000000.0] and parameters: {'p_sma': 15, 'p_std': 50, 'p_atr': 30, 'p_adx': 25, 'rsi_period': 73, 'ema1': 12, 'ema2': 28, 'slip_atr_k': 0.04627323782210817, 'slip_spread_k': 0.6380777872024564, 'spread_hl_frac': 0.04715461100056876, 'bb_std_mult': 3.585030018407691, 'rsi_os': 30, 'rsi_ob': 93, 'vol_spike': 0.2110841931741211, 'adx_thresh': 11.63127640040468, 'atr_min_pct': 0.021075198834054468, 'atr_max_pct': 0.13701972316955355, 'tp_mult': 1.9498292697328214, 'tsl_mult': 0.7509353070495307, 'strategy': 'mean_reversion', 'time_stop': 80, 'use_sma': False, 'use_atr': False, 'use_adx': True, 'use_ema': True, 'use_spike': False, 'rsi_required': False, 'edge_k': 0.7192503328763747, 'edge_cap': 0.7463333600513764, 'bull_strategy': 'mean_reversion', 'bull_bb_std_mult': 2.7756573238754987, 'bull_rsi_os': 20, 'bull_rsi_ob': 56, 'bull_adx_thresh': 21.66929278563195, 'bull_atr_min_pct': 0.0024308848584455086, 'bull_atr_max_pct': 0.13789346593224866, 'bull_tp_mult': 2.125802552761536, 'bull_tsl_mult': 0.16464993303860487, 'bull_time_stop': 164, 'bull_use_sma': False, 'bull_use_ema': True, 'bull_use_atr': True, 'bull_use_adx': False, 'bull_use_spike': False, 'bull_rsi_required': False, 'bear_strategy': 'breakout', 'bear_bb_std_mult': 0.6470093082663799, 'bear_rsi_os': 29, 'bear_rsi_ob': 56, 'bear_adx_thresh': 13.592111173172054, 'bear_atr_min_pct': 8.464758065663061e-05, 'bear_atr_max_pct': 0.08543417745872577, 'bear_tp_mult': 2.0075898388741216, 'bear_tsl_mult': 0.8529377029586774, 'bear_time_stop': 233, 'bear_use_sma': False, 'bear_use_ema': False, 'bear_use_atr': False, 'bear_use_adx': True, 'bear_use_spike': True, 'bear_rsi_required': True, 'sideways_strategy': 'breakout', 'sideways_bb_std_mult': 0.6407816268132738, 'sideways_rsi_os': 16, 'sideways_rsi_ob': 75, 'sideways_adx_thresh': 33.41297139636073, 'sideways_atr_min_pct': 0.001744670889667621, 'sideways_atr_max_pct': 0.10346988577039216, 'sideways_tp_mult': 2.507274874434662, 'sideways_tsl_mult': 0.6822953550610742, 'sideways_time_stop': 184, 'sideways_use_sma': True, 'sideways_use_ema': False, 'sideways_use_atr': True, 'sideways_use_adx': False, 'sideways_use_spike': False, 'sideways_rsi_required': True}.
[I 2025-08-31 03:39:41,052] Trial 52 finished with values: [-1000000000.0, 1000000000.0] and parameters: {'p_sma': 14, 'p_std': 42, 'p_atr': 30, 'p_adx': 8, 'rsi_period': 38, 'ema1': 8, 'ema2': 29, 'slip_atr_k': 0.051020030552482526, 'slip_spread_k': 0.7314707421761328, 'spread_hl_frac': 8.432064302719283e-05, 'bb_std_mult': 0.6678870249852522, 'rsi_os': 9, 'rsi_ob': 72, 'vol_spike': 0.10102895117395096, 'adx_thresh': 31.42636027444869, 'atr_min_pct': 0.029961018285959228, 'atr_max_pct': 0.13789038202060105, 'tp_mult': 1.9335478550242886, 'tsl_mult': 0.7799631463271903, 'strategy': 'mean_reversion', 'time_stop': 7, 'use_sma': False, 'use_atr': False, 'use_adx': True, 'use_ema': True, 'use_spike': False, 'rsi_required': False, 'edge_k': 0.004740063838423958, 'edge_cap': 0.7394992818961326, 'bull_strategy': 'breakout', 'bull_bb_std_mult': 2.793082360549195, 'bull_rsi_os': 10, 'bull_rsi_ob': 71, 'bull_adx_thresh': 28.096588212047514, 'bull_atr_min_pct': 0.0027423969183001037, 'bull_atr_max_pct': 0.13811042649973962, 'bull_tp_mult': 1.9199460201648844, 'bull_tsl_mult': 0.4588226463169233, 'bull_time_stop': 112, 'bull_use_sma': True, 'bull_use_ema': True, 'bull_use_atr': True, 'bull_use_adx': False, 'bull_use_spike': False, 'bull_rsi_required': False, 'bear_strategy': 'breakout', 'bear_bb_std_mult': 1.0170117380904204, 'bear_rsi_os': 13, 'bear_rsi_ob': 50, 'bear_adx_thresh': 13.57958961589168, 'bear_atr_min_pct': 0.017486396384213024, 'bear_atr_max_pct': 0.039464368140529414, 'bear_tp_mult': 2.5142796053055876, 'bear_tsl_mult': 0.6630269563112102, 'bear_time_stop': 6, 'bear_use_sma': False, 'bear_use_ema': False, 'bear_use_atr': False, 'bear_use_adx': True, 'bear_use_spike': False, 'bear_rsi_required': True, 'sideways_strategy': 'breakout', 'sideways_bb_std_mult': 2.5143550233418863, 'sideways_rsi_os': 17, 'sideways_rsi_ob': 69, 'sideways_adx_thresh': 20.992612597446286, 'sideways_atr_min_pct': 0.006709022804431282, 'sideways_atr_max_pct': 0.149753682131537, 'sideways_tp_mult': 2.8543384591110774, 'sideways_tsl_mult': 0.4072828814107089, 'sideways_time_stop': 163, 'sideways_use_sma': True, 'sideways_use_ema': True, 'sideways_use_atr': True, 'sideways_use_adx': False, 'sideways_use_spike': False, 'sideways_rsi_required': True}.
[I 2025-08-31 03:39:41,059] Trial 51 finished with values: [-1000000000.0, 1000000000.0] and parameters: {'p_sma': 14, 'p_std': 7, 'p_atr': 30, 'p_adx': 7, 'rsi_period': 38, 'ema1': 8, 'ema2': 40, 'slip_atr_k': 0.059744170257207005, 'slip_spread_k': 0.7320976199620869, 'spread_hl_frac': 0.021815075310632613, 'bb_std_mult': 0.6579370499702784, 'rsi_os': 22, 'rsi_ob': 61, 'vol_spike': 0.21231728683069295, 'adx_thresh': 11.565321019562491, 'atr_min_pct': 0.021542610943037825, 'atr_max_pct': 0.13860828300439237, 'tp_mult': 1.9076973444831677, 'tsl_mult': 0.7675270461099658, 'strategy': 'mean_reversion', 'time_stop': 137, 'use_sma': False, 'use_atr': False, 'use_adx': True, 'use_ema': True, 'use_spike': False, 'rsi_required': False, 'edge_k': 0.024357652849566036, 'edge_cap': 0.7330253383068718, 'bull_strategy': 'breakout', 'bull_bb_std_mult': 2.649357164842346, 'bull_rsi_os': 10, 'bull_rsi_ob': 92, 'bull_adx_thresh': 28.917757808145577, 'bull_atr_min_pct': 0.028559511133641788, 'bull_atr_max_pct': 0.06992986196105629, 'bull_tp_mult': 2.484969420818221, 'bull_tsl_mult': 0.4662786642783716, 'bull_time_stop': 164, 'bull_use_sma': True, 'bull_use_ema': True, 'bull_use_atr': True, 'bull_use_adx': False, 'bull_use_spike': False, 'bull_rsi_required': False, 'bear_strategy': 'breakout', 'bear_bb_std_mult': 0.6351566434362708, 'bear_rsi_os': 7, 'bear_rsi_ob': 50, 'bear_adx_thresh': 13.859596400270252, 'bear_atr_min_pct': 0.017942429445283747, 'bear_atr_max_pct': 0.06604440301735216, 'bear_tp_mult': 2.024035817098118, 'bear_tsl_mult': 0.6660219422138564, 'bear_time_stop': 15, 'bear_use_sma': False, 'bear_use_ema': False, 'bear_use_atr': False, 'bear_use_adx': True, 'bear_use_spike': False, 'bear_rsi_required': True, 'sideways_strategy': 'breakout', 'sideways_bb_std_mult': 1.7014777906641614, 'sideways_rsi_os': 46, 'sideways_rsi_ob': 76, 'sideways_adx_thresh': 21.512424017330883, 'sideways_atr_min_pct': 0.006242628943945857, 'sideways_atr_max_pct': 0.10317342462977838, 'sideways_tp_mult': 2.821832517177365, 'sideways_tsl_mult': 0.656833538985849, 'sideways_time_stop': 174, 'sideways_use_sma': True, 'sideways_use_ema': True, 'sideways_use_atr': True, 'sideways_use_adx': False, 'sideways_use_spike': False, 'sideways_rsi_required': True}.
[I 2025-08-31 03:39:41,239] Trial 50 finished with values: [-1000000000.0, 1000000000.0] and parameters: {'p_sma': 15, 'p_std': 49, 'p_atr': 7, 'p_adx': 7, 'rsi_period': 9, 'ema1': 6, 'ema2': 40, 'slip_atr_k': 0.05657635846026027, 'slip_spread_k': 0.5150969346052442, 'spread_hl_frac': 0.047396411967649016, 'bb_std_mult': 0.6949714766754307, 'rsi_os': 36, 'rsi_ob': 72, 'vol_spike': 0.21360443786528052, 'adx_thresh': 7.745894207913844, 'atr_min_pct': 0.00880996149566475, 'atr_max_pct': 0.13662398771469034, 'tp_mult': 1.899826102938049, 'tsl_mult': 0.762160419853679, 'strategy': 'mean_reversion', 'time_stop': 5, 'use_sma': False, 'use_atr': False, 'use_adx': True, 'use_ema': True, 'use_spike': False, 'rsi_required': True, 'edge_k': 0.017680343839402535, 'edge_cap': 0.5002189784505751, 'bull_strategy': 'breakout', 'bull_bb_std_mult': 3.5981829260482483, 'bull_rsi_os': 8, 'bull_rsi_ob': 46, 'bull_adx_thresh': 21.8338093228853, 'bull_atr_min_pct': 0.020145770502907827, 'bull_atr_max_pct': 0.06756422045419568, 'bull_tp_mult': 1.624906480335032, 'bull_tsl_mult': 0.055493442071257615, 'bull_time_stop': 267, 'bull_use_sma': True, 'bull_use_ema': True, 'bull_use_atr': False, 'bull_use_adx': False, 'bull_use_spike': True, 'bull_rsi_required': False, 'bear_strategy': 'breakout', 'bear_bb_std_mult': 3.276495089453972, 'bear_rsi_os': 28, 'bear_rsi_ob': 80, 'bear_adx_thresh': 33.35170922795864, 'bear_atr_min_pct': 0.026924131290907274, 'bear_atr_max_pct': 0.148941320388524, 'bear_tp_mult': 2.176581769341905, 'bear_tsl_mult': 0.8667753860842538, 'bear_time_stop': 12, 'bear_use_sma': False, 'bear_use_ema': False, 'bear_use_atr': True, 'bear_use_adx': False, 'bear_use_spike': False, 'bear_rsi_required': False, 'sideways_strategy': 'breakout', 'sideways_bb_std_mult': 1.6966322448205036, 'sideways_rsi_os': 38, 'sideways_rsi_ob': 75, 'sideways_adx_thresh': 20.27838388057176, 'sideways_atr_min_pct': 0.012228422013055063, 'sideways_atr_max_pct': 0.028215220783010267, 'sideways_tp_mult': 2.363060604625054, 'sideways_tsl_mult': 0.40519332225613236, 'sideways_time_stop': 162, 'sideways_use_sma': True, 'sideways_use_ema': True, 'sideways_use_atr': True, 'sideways_use_adx': False, 'sideways_use_spike': False, 'sideways_rsi_required': True}.
