[I 2025-08-31 03:58:53,760] Trial 205 finished with values: [-1000000000.0, 1000000000.0] and parameters: {'p_sma': 42, 'p_std': 20, 'p_atr': 7, 'p_adx': 8, 'rsi_period': 25, 'ema1': 14, 'ema2': 32, 'slip_atr_k': 0.024881841770546767, 'slip_spread_k': 0.10592742447276574, 'spread_hl_frac': 0.011010701690165804, 'bb_std_mult': 1.9734976481904205, 'rsi_os': 28, 'rsi_ob': 58, 'vol_spike': 0.018517935019718552, 'adx_thresh': 11.455943610537046, 'atr_min_pct': 0.023158867321271925, 'atr_max_pct': 0.10760604260247467, 'tp_mult': 2.710596406941546, 'tsl_mult': 0.8973922972390262, 'strategy': 'breakout', 'time_stop': 68, 'use_sma': False, 'use_atr': True, 'use_adx': False, 'use_ema': False, 'use_spike': True, 'rsi_required': False, 'edge_k': 1.5195331419481657, 'edge_cap': 0.6512470876421722, 'bull_strategy': 'mean_reversion', 'bull_bb_std_mult': 3.4488122693495376, 'bull_rsi_os': 15, 'bull_rsi_ob': 78, 'bull_adx_thresh': 7.7498374698624275, 'bull_atr_min_pct': 0.0030428599903148546, 'bull_atr_max_pct': 0.013083554521597054, 'bull_tp_mult': 1.485660561333414, 'bull_tsl_mult': 0.9181647526144481, 'bull_time_stop': 146, 'bull_use_sma': False, 'bull_use_ema': False, 'bull_use_atr': True, 'bull_use_adx': True, 'bull_use_spike': False, 'bull_rsi_required': True, 'bear_strategy': 'mean_reversion', 'bear_bb_std_mult': 1.1256752874261804, 'bear_rsi_os': 15, 'bear_rsi_ob': 49, 'bear_adx_thresh': 7.404763549081574, 'bear_atr_min_pct': 0.020347527972416662, 'bear_atr_max_pct': 0.051555946836419515, 'bear_tp_mult': 2.8417510834120776, 'bear_tsl_mult': 0.17094066835519442, 'bear_time_stop': 192, 'bear_use_sma': True, 'bear_use_ema': True, 'bear_use_atr': True, 'bear_use_adx': True, 'bear_use_spike': True, 'bear_rsi_required': True, 'sideways_strategy': 'mean_reversion', 'sideways_bb_std_mult': 1.2121611336428646, 'sideways_rsi_os': 38, 'sideways_rsi_ob': 58, 'sideways_adx_thresh': 11.4215305437673, 'sideways_atr_min_pct': 0.014182025454657845, 'sideways_atr_max_pct': 0.12207279036334218, 'sideways_tp_mult': 1.8977936677374667, 'sideways_tsl_mult': 0.6076440384011688, 'sideways_time_stop': 49, 'sideways_use_sma': False, 'sideways_use_ema': False, 'sideways_use_atr': False, 'sideways_use_adx': True, 'sideways_use_spike': True, 'sideways_rsi_required': True}.
[I 2025-08-31 03:58:54,021] Trial 208 finished with values: [-0.08727868084118096, 0.08721931966054679] and parameters: {'p_sma': 40, 'p_std': 15, 'p_atr': 24, 'p_adx': 28, 'rsi_period': 23, 'ema1': 14, 'ema2': 16, 'slip_atr_k': 0.02320680846525154, 'slip_spread_k': 0.0928197387188948, 'spread_hl_frac': 0.007491071313453092, 'bb_std_mult': 1.739098012724787, 'rsi_os': 29, 'rsi_ob': 54, 'vol_spike': 0.2367065224094308, 'adx_thresh': 10.33377021634945, 'atr_min_pct': 0.017130423818025372, 'atr_max_pct': 0.08389379562111193, 'tp_mult': 2.6680644250609387, 'tsl_mult': 0.8888174695800766, 'strategy': 'breakout', 'time_stop': 46, 'use_sma': False, 'use_atr': True, 'use_adx': False, 'use_ema': False, 'use_spike': True, 'rsi_required': False, 'edge_k': 1.3566043420449452, 'edge_cap': 0.6533872353790928, 'bull_strategy': 'mean_reversion', 'bull_bb_std_mult': 3.473187550368971, 'bull_rsi_os': 45, 'bull_rsi_ob': 79, 'bull_adx_thresh': 12.275389893081599, 'bull_atr_min_pct': 0.0024145872475375167, 'bull_atr_max_pct': 0.03734210574191851, 'bull_tp_mult': 1.4876570906455722, 'bull_tsl_mult': 0.9379951987503687, 'bull_time_stop': 120, 'bull_use_sma': False, 'bull_use_ema': False, 'bull_use_atr': True, 'bull_use_adx': True, 'bull_use_spike': False, 'bull_rsi_required': True, 'bear_strategy': 'mean_reversion', 'bear_bb_std_mult': 1.183415098020927, 'bear_rsi_os': 12, 'bear_rsi_ob': 50, 'bear_adx_thresh': 20.735153437246705, 'bear_atr_min_pct': 0.02222020240642418, 'bear_atr_max_pct': 0.05325673206531633, 'bear_tp_mult': 2.6368456771902116, 'bear_tsl_mult': 0.2856007210900734, 'bear_time_stop': 193, 'bear_use_sma': True, 'bear_use_ema': True, 'bear_use_atr': True, 'bear_use_adx': True, 'bear_use_spike': True, 'bear_rsi_required': True, 'sideways_strategy': 'mean_reversion', 'sideways_bb_std_mult': 1.2213252229907452, 'sideways_rsi_os': 24, 'sideways_rsi_ob': 57, 'sideways_adx_thresh': 11.481361758625738, 'sideways_atr_min_pct': 0.0001115473807890583, 'sideways_atr_max_pct': 0.1177620718638984, 'sideways_tp_mult': 1.953886269024343, 'sideways_tsl_mult': 0.45835280154073726, 'sideways_time_stop': 61, 'sideways_use_sma': False, 'sideways_use_ema': False, 'sideways_use_atr': False, 'sideways_use_adx': True, 'sideways_use_spike': True, 'sideways_rsi_required': True}.
[I 2025-08-31 03:59:30,936] Trial 209 finished with values: [-0.052186242649051695, 0.05217846283274756] and parameters: {'p_sma': 30, 'p_std': 26, 'p_atr': 7, 'p_adx': 9, 'rsi_period': 23, 'ema1': 13, 'ema2': 17, 'slip_atr_k': 0.03634108759941135, 'slip_spread_k': 0.0799264282123892, 'spread_hl_frac': 0.007503245409880063, 'bb_std_mult': 1.7656425032794782, 'rsi_os': 32, 'rsi_ob': 54, 'vol_spike': 0.030992271698243222, 'adx_thresh': 10.314225083616527, 'atr_min_pct': 0.022174090920707757, 'atr_max_pct': 0.08629487790210053, 'tp_mult': 2.9323325368855557, 'tsl_mult': 0.8909062872012246, 'strategy': 'breakout', 'time_stop': 50, 'use_sma': False, 'use_atr': True, 'use_adx': False, 'use_ema': False, 'use_spike': True, 'rsi_required': False, 'edge_k': 1.2829498606579453, 'edge_cap': 0.2584918116834884, 'bull_strategy': 'mean_reversion', 'bull_bb_std_mult': 3.416813509555169, 'bull_rsi_os': 12, 'bull_rsi_ob': 77, 'bull_adx_thresh': 13.98557961628257, 'bull_atr_min_pct': 0.008723676554765407, 'bull_atr_max_pct': 0.05369721962557879, 'bull_tp_mult': 1.730596952321414, 'bull_tsl_mult': 0.932058043531476, 'bull_time_stop': 121, 'bull_use_sma': False, 'bull_use_ema': False, 'bull_use_atr': True, 'bull_use_adx': True, 'bull_use_spike': False, 'bull_rsi_required': True, 'bear_strategy': 'mean_reversion', 'bear_bb_std_mult': 1.1799080519351228, 'bear_rsi_os': 12, 'bear_rsi_ob': 47, 'bear_adx_thresh': 20.75207210230699, 'bear_atr_min_pct': 0.027184004085466083, 'bear_atr_max_pct': 0.037638422645577235, 'bear_tp_mult': 2.7445030050843866, 'bear_tsl_mult': 0.17890378555635544, 'bear_time_stop': 199, 'bear_use_sma': True, 'bear_use_ema': True, 'bear_use_atr': True, 'bear_use_adx': True, 'bear_use_spike': True, 'bear_rsi_required': True, 'sideways_strategy': 'mean_reversion', 'sideways_bb_std_mult': 1.66582227719967, 'sideways_rsi_os': 41, 'sideways_rsi_ob': 58, 'sideways_adx_thresh': 11.748797992512124, 'sideways_atr_min_pct': 0.001078325418639935, 'sideways_atr_max_pct': 0.11041575217011866, 'sideways_tp_mult': 1.8631989341227397, 'sideways_tsl_mult': 0.4760825178776326, 'sideways_time_stop': 62, 'sideways_use_sma': False, 'sideways_use_ema': False, 'sideways_use_atr': False, 'sideways_use_adx': True, 'sideways_use_spike': True, 'sideways_rsi_required': True}.
[I 2025-08-31 03:59:31,032] Trial 210 finished with values: [-0.06363077131263495, 0.06358828071101347] and parameters: {'p_sma': 29, 'p_std': 15, 'p_atr': 19, 'p_adx': 9, 'rsi_period': 23, 'ema1': 13, 'ema2': 30, 'slip_atr_k': 0.02445669842822289, 'slip_spread_k': 0.07262835213155633, 'spread_hl_frac': 0.007611849125091939, 'bb_std_mult': 1.9588782731097654, 'rsi_os': 32, 'rsi_ob': 61, 'vol_spike': 0.03318598596363473, 'adx_thresh': 10.144280372248433, 'atr_min_pct': 0.022244160409401043, 'atr_max_pct': 0.08476073594406924, 'tp_mult': 2.9443248699788915, 'tsl_mult': 0.8490029021314721, 'strategy': 'breakout', 'time_stop': 51, 'use_sma': False, 'use_atr': False, 'use_adx': False, 'use_ema': False, 'use_spike': True, 'rsi_required': False, 'edge_k': 0.6601873669323594, 'edge_cap': 0.2324108157525408, 'bull_strategy': 'mean_reversion', 'bull_bb_std_mult': 3.3027187121290154, 'bull_rsi_os': 12, 'bull_rsi_ob': 79, 'bull_adx_thresh': 14.327106400347382, 'bull_atr_min_pct': 0.008602222583568755, 'bull_atr_max_pct': 0.03844498616268274, 'bull_tp_mult': 1.711127201312722, 'bull_tsl_mult': 0.9386577218811818, 'bull_time_stop': 119, 'bull_use_sma': False, 'bull_use_ema': False, 'bull_use_atr': True, 'bull_use_adx': True, 'bull_use_spike': False, 'bull_rsi_required': True, 'bear_strategy': 'mean_reversion', 'bear_bb_std_mult': 1.360110814963374, 'bear_rsi_os': 12, 'bear_rsi_ob': 47, 'bear_adx_thresh': 19.111160069910238, 'bear_atr_min_pct': 0.022471429734845415, 'bear_atr_max_pct': 0.037505820066879705, 'bear_tp_mult': 2.748229983850328, 'bear_tsl_mult': 0.18676200721356825, 'bear_time_stop': 84, 'bear_use_sma': True, 'bear_use_ema': True, 'bear_use_atr': True, 'bear_use_adx': True, 'bear_use_spike': True, 'bear_rsi_required': True, 'sideways_strategy': 'mean_reversion', 'sideways_bb_std_mult': 1.676541443923174, 'sideways_rsi_os': 24, 'sideways_rsi_ob': 58, 'sideways_adx_thresh': 12.856669773026816, 'sideways_atr_min_pct': 0.0007864494569608804, 'sideways_atr_max_pct': 0.11073191303072273, 'sideways_tp_mult': 1.8790018741408154, 'sideways_tsl_mult': 0.6435831691935101, 'sideways_time_stop': 77, 'sideways_use_sma': False, 'sideways_use_ema': False, 'sideways_use_atr': False, 'sideways_use_adx': True, 'sideways_use_spike': True, 'sideways_rsi_required': True}.
[I 2025-08-31 03:59:31,258] Trial 211 finished with values: [-1000000000.0, 1000000000.0] and parameters: {'p_sma': 29, 'p_std': 26, 'p_atr': 8, 'p_adx': 29, 'rsi_period': 23, 'ema1': 13, 'ema2': 25, 'slip_atr_k': 0.036212515474392526, 'slip_spread_k': 0.0227523007409281, 'spread_hl_frac': 0.008385282183311126, 'bb_std_mult': 1.7512339111634425, 'rsi_os': 33, 'rsi_ob': 53, 'vol_spike': 0.032615817965478314, 'adx_thresh': 13.304016325910805, 'atr_min_pct': 0.022305832544771198, 'atr_max_pct': 0.09970487956693767, 'tp_mult': 2.470781688644662, 'tsl_mult': 0.9508945563771583, 'strategy': 'breakout', 'time_stop': 52, 'use_sma': False, 'use_atr': False, 'use_adx': False, 'use_ema': False, 'use_spike': True, 'rsi_required': False, 'edge_k': 1.056849799399973, 'edge_cap': 0.09125765897323601, 'bull_strategy': 'mean_reversion', 'bull_bb_std_mult': 3.291153611293995, 'bull_rsi_os': 12, 'bull_rsi_ob': 77, 'bull_adx_thresh': 14.991367996968142, 'bull_atr_min_pct': 0.020217058955862448, 'bull_atr_max_pct': 0.03863748034750078, 'bull_tp_mult': 1.7262387782393203, 'bull_tsl_mult': 0.8753559026090559, 'bull_time_stop': 135, 'bull_use_sma': False, 'bull_use_ema': False, 'bull_use_atr': True, 'bull_use_adx': True, 'bull_use_spike': False, 'bull_rsi_required': True, 'bear_strategy': 'mean_reversion', 'bear_bb_std_mult': 1.1925610521898231, 'bear_rsi_os': 12, 'bear_rsi_ob': 45, 'bear_adx_thresh': 20.916453533471927, 'bear_atr_min_pct': 0.023013355799639038, 'bear_atr_max_pct': 0.044496951249009424, 'bear_tp_mult': 2.750100389287758, 'bear_tsl_mult': 0.2961815766776129, 'bear_time_stop': 228, 'bear_use_sma': True, 'bear_use_ema': True, 'bear_use_atr': False, 'bear_use_adx': True, 'bear_use_spike': True, 'bear_rsi_required': True, 'sideways_strategy': 'mean_reversion', 'sideways_bb_std_mult': 0.9261977064573456, 'sideways_rsi_os': 24, 'sideways_rsi_ob': 50, 'sideways_adx_thresh': 10.039719580643975, 'sideways_atr_min_pct': 0.012537315420909976, 'sideways_atr_max_pct': 0.10766409987369256, 'sideways_tp_mult': 1.8729052620086712, 'sideways_tsl_mult': 0.4693400290885382, 'sideways_time_stop': 77, 'sideways_use_sma': False, 'sideways_use_ema': False, 'sideways_use_atr': False, 'sideways_use_adx': True, 'sideways_use_spike': True, 'sideways_rsi_required': True}.
[I 2025-08-31 03:59:31,473] Trial 212 finished with values: [-0.054374670768787436, 0.05432976806581231] and parameters: {'p_sma': 29, 'p_std': 16, 'p_atr': 17, 'p_adx': 9, 'rsi_period': 23, 'ema1': 6, 'ema2': 30, 'slip_atr_k': 0.03773556732573126, 'slip_spread_k': 0.019756610925282747, 'spread_hl_frac': 0.008431152674334506, 'bb_std_mult': 1.9282046188939623, 'rsi_os': 33, 'rsi_ob': 61, 'vol_spike': 0.031671917962879874, 'adx_thresh': 9.649697250367131, 'atr_min_pct': 0.022459850609025393, 'atr_max_pct': 0.11482165354535061, 'tp_mult': 2.4869326786443575, 'tsl_mult': 0.854224822518393, 'strategy': 'breakout', 'time_stop': 52, 'use_sma': False, 'use_atr': False, 'use_adx': False, 'use_ema': False, 'use_spike': True, 'rsi_required': False, 'edge_k': 1.2977414501626423, 'edge_cap': 0.26014131875915764, 'bull_strategy': 'mean_reversion', 'bull_bb_std_mult': 3.534575400061693, 'bull_rsi_os': 13, 'bull_rsi_ob': 77, 'bull_adx_thresh': 14.693480085131153, 'bull_atr_min_pct': 0.020183950956159803, 'bull_atr_max_pct': 0.05321902530156492, 'bull_tp_mult': 1.7322669802705437, 'bull_tsl_mult': 0.8721811245195448, 'bull_time_stop': 135, 'bull_use_sma': False, 'bull_use_ema': False, 'bull_use_atr': True, 'bull_use_adx': True, 'bull_use_spike': False, 'bull_rsi_required': True, 'bear_strategy': 'mean_reversion', 'bear_bb_std_mult': 0.8165414034178997, 'bear_rsi_os': 12, 'bear_rsi_ob': 47, 'bear_adx_thresh': 19.372040837873797, 'bear_atr_min_pct': 0.01939607871739904, 'bear_atr_max_pct': 0.0434947542466463, 'bear_tp_mult': 2.739762277500569, 'bear_tsl_mult': 0.3192813778857892, 'bear_time_stop': 287, 'bear_use_sma': True, 'bear_use_ema': True, 'bear_use_atr': False, 'bear_use_adx': True, 'bear_use_spike': True, 'bear_rsi_required': True, 'sideways_strategy': 'mean_reversion', 'sideways_bb_std_mult': 0.9300718270011867, 'sideways_rsi_os': 27, 'sideways_rsi_ob': 50, 'sideways_adx_thresh': 12.83688752414371, 'sideways_atr_min_pct': 0.0011254602648252728, 'sideways_atr_max_pct': 0.11098503024314359, 'sideways_tp_mult': 2.0805994463519624, 'sideways_tsl_mult': 0.5314237417800757, 'sideways_time_stop': 67, 'sideways_use_sma': False, 'sideways_use_ema': False, 'sideways_use_atr': False, 'sideways_use_adx': True, 'sideways_use_spike': True, 'sideways_rsi_required': True}.
[I 2025-08-31 03:59:32,053] Trial 213 finished with values: [-1000000000.0, 1000000000.0] and parameters: {'p_sma': 48, 'p_std': 16, 'p_atr': 19, 'p_adx': 19, 'rsi_period': 18, 'ema1': 7, 'ema2': 50, 'slip_atr_k': 0.01310708206172561, 'slip_spread_k': 0.13046535381004815, 'spread_hl_frac': 0.009548977112656223, 'bb_std_mult': 1.9338521922995235, 'rsi_os': 32, 'rsi_ob': 61, 'vol_spike': 0.03356179149489137, 'adx_thresh': 13.160338587785297, 'atr_min_pct': 0.024524564958804368, 'atr_max_pct': 0.015032108146201248, 'tp_mult': 2.4688759559101072, 'tsl_mult': 0.9500503140524774, 'strategy': 'breakout', 'time_stop': 32, 'use_sma': False, 'use_atr': False, 'use_adx': False, 'use_ema': False, 'use_spike': True, 'rsi_required': False, 'edge_k': 1.4866206838506393, 'edge_cap': 0.09801721777420241, 'bull_strategy': 'mean_reversion', 'bull_bb_std_mult': 3.5375461328889024, 'bull_rsi_os': 10, 'bull_rsi_ob': 63, 'bull_adx_thresh': 14.753302013653437, 'bull_atr_min_pct': 0.02353318534280802, 'bull_atr_max_pct': 0.0923840135647276, 'bull_tp_mult': 1.5661791568486234, 'bull_tsl_mult': 0.8671344088807861, 'bull_time_stop': 133, 'bull_use_sma': False, 'bull_use_ema': False, 'bull_use_atr': True, 'bull_use_adx': True, 'bull_use_spike': False, 'bull_rsi_required': True, 'bear_strategy': 'mean_reversion', 'bear_bb_std_mult': 1.3266121494164191, 'bear_rsi_os': 13, 'bear_rsi_ob': 45, 'bear_adx_thresh': 19.06768597795208, 'bear_atr_min_pct': 0.019173610806951277, 'bear_atr_max_pct': 0.04304426570458084, 'bear_tp_mult': 2.749549826229524, 'bear_tsl_mult': 0.3281151212245891, 'bear_time_stop': 184, 'bear_use_sma': True, 'bear_use_ema': True, 'bear_use_atr': False, 'bear_use_adx': True, 'bear_use_spike': True, 'bear_rsi_required': True, 'sideways_strategy': 'mean_reversion', 'sideways_bb_std_mult': 0.9532227791433636, 'sideways_rsi_os': 26, 'sideways_rsi_ob': 47, 'sideways_adx_thresh': 10.130496913699101, 'sideways_atr_min_pct': 0.012549334818925385, 'sideways_atr_max_pct': 0.10679123406980023, 'sideways_tp_mult': 2.0662796607702614, 'sideways_tsl_mult': 0.6471819939246899, 'sideways_time_stop': 79, 'sideways_use_sma': False, 'sideways_use_ema': False, 'sideways_use_atr': False, 'sideways_use_adx': True, 'sideways_use_spike': True, 'sideways_rsi_required': True}.
[I 2025-08-31 04:00:06,325] Trial 215 finished with values: [-1000000000.0, 1000000000.0] and parameters: {'p_sma': 51, 'p_std': 18, 'p_atr': 17, 'p_adx': 9, 'rsi_period': 18, 'ema1': 10, 'ema2': 57, 'slip_atr_k': 0.01287758743780799, 'slip_spread_k': 0.1355506031460626, 'spread_hl_frac': 0.009355182227645942, 'bb_std_mult': 2.8757520688496405, 'rsi_os': 30, 'rsi_ob': 47, 'vol_spike': 0.017885162659422953, 'adx_thresh': 9.657998854878318, 'atr_min_pct': 0.024611913366262717, 'atr_max_pct': 0.12989160709772268, 'tp_mult': 2.488542771105255, 'tsl_mult': 0.8686423697454692, 'strategy': 'breakout', 'time_stop': 30, 'use_sma': False, 'use_atr': False, 'use_adx': False, 'use_ema': False, 'use_spike': True, 'rsi_required': False, 'edge_k': 1.485049245330216, 'edge_cap': 0.9796221733628172, 'bull_strategy': 'mean_reversion', 'bull_bb_std_mult': 3.54160654188382, 'bull_rsi_os': 13, 'bull_rsi_ob': 52, 'bull_adx_thresh': 11.304846702998917, 'bull_atr_min_pct': 0.024560435704327477, 'bull_atr_max_pct': 0.09066360831057267, 'bull_tp_mult': 1.554540845526229, 'bull_tsl_mult': 0.23807433870523576, 'bull_time_stop': 82, 'bull_use_sma': False, 'bull_use_ema': False, 'bull_use_atr': True, 'bull_use_adx': True, 'bull_use_spike': False, 'bull_rsi_required': True, 'bear_strategy': 'mean_reversion', 'bear_bb_std_mult': 0.7447145603048352, 'bear_rsi_os': 10, 'bear_rsi_ob': 48, 'bear_adx_thresh': 19.407858251539608, 'bear_atr_min_pct': 0.023560576826550644, 'bear_atr_max_pct': 0.04299341865287854, 'bear_tp_mult': 2.8196951965044192, 'bear_tsl_mult': 0.22549462664592082, 'bear_time_stop': 205, 'bear_use_sma': True, 'bear_use_ema': True, 'bear_use_atr': True, 'bear_use_adx': True, 'bear_use_spike': True, 'bear_rsi_required': True, 'sideways_strategy': 'mean_reversion', 'sideways_bb_std_mult': 1.1028472442898003, 'sideways_rsi_os': 27, 'sideways_rsi_ob': 48, 'sideways_adx_thresh': 13.672370381659741, 'sideways_atr_min_pct': 0.013693832856926278, 'sideways_atr_max_pct': 0.11659041423291297, 'sideways_tp_mult': 2.0756758083415345, 'sideways_tsl_mult': 0.5452641938587683, 'sideways_time_stop': 54, 'sideways_use_sma': False, 'sideways_use_ema': False, 'sideways_use_atr': False, 'sideways_use_adx': True, 'sideways_use_spike': True, 'sideways_rsi_required': True}.
[I 2025-08-31 04:00:07,118] Trial 214 finished with values: [-1000000000.0, 1000000000.0] and parameters: {'p_sma': 51, 'p_std': 17, 'p_atr': 17, 'p_adx': 9, 'rsi_period': 17, 'ema1': 15, 'ema2': 25, 'slip_atr_k': 0.013389227387457145, 'slip_spread_k': 0.13021216534646907, 'spread_hl_frac': 0.009372670703984677, 'bb_std_mult': 3.260089270570049, 'rsi_os': 30, 'rsi_ob': 46, 'vol_spike': 0.06776263518136075, 'adx_thresh': 13.125977263554852, 'atr_min_pct': 0.02268193024148324, 'atr_max_pct': 0.1148268118752851, 'tp_mult': 2.4891926303050087, 'tsl_mult': 0.9515903960187834, 'strategy': 'breakout', 'time_stop': 75, 'use_sma': False, 'use_atr': False, 'use_adx': False, 'use_ema': False, 'use_spike': True, 'rsi_required': False, 'edge_k': 1.053778092203126, 'edge_cap': 0.08812674500647633, 'bull_strategy': 'mean_reversion', 'bull_bb_std_mult': 3.5352723842257756, 'bull_rsi_os': 10, 'bull_rsi_ob': 77, 'bull_adx_thresh': 11.56297622081375, 'bull_atr_min_pct': 0.02456890050434972, 'bull_atr_max_pct': 0.10240203245911372, 'bull_tp_mult': 1.5549567175463634, 'bull_tsl_mult': 0.8673146193512167, 'bull_time_stop': 135, 'bull_use_sma': False, 'bull_use_ema': False, 'bull_use_atr': True, 'bull_use_adx': True, 'bull_use_spike': False, 'bull_rsi_required': True, 'bear_strategy': 'mean_reversion', 'bear_bb_std_mult': 2.6168609353756294, 'bear_rsi_os': 9, 'bear_rsi_ob': 45, 'bear_adx_thresh': 30.12840993237425, 'bear_atr_min_pct': 0.02598424887958211, 'bear_atr_max_pct': 0.045650246674751906, 'bear_tp_mult': 2.8216005043794787, 'bear_tsl_mult': 0.22132309271395834, 'bear_time_stop': 201, 'bear_use_sma': True, 'bear_use_ema': True, 'bear_use_atr': False, 'bear_use_adx': True, 'bear_use_spike': True, 'bear_rsi_required': True, 'sideways_strategy': 'mean_reversion', 'sideways_bb_std_mult': 1.1023871761742985, 'sideways_rsi_os': 27, 'sideways_rsi_ob': 48, 'sideways_adx_thresh': 13.691125596060926, 'sideways_atr_min_pct': 0.012662463419428277, 'sideways_atr_max_pct': 0.10754512789240331, 'sideways_tp_mult': 2.080529612202158, 'sideways_tsl_mult': 0.7414278001957417, 'sideways_time_stop': 68, 'sideways_use_sma': False, 'sideways_use_ema': False, 'sideways_use_atr': False, 'sideways_use_adx': True, 'sideways_use_spike': True, 'sideways_rsi_required': True}.
