[I 2025-08-31 04:26:11,865] Trial 353 finished with values: [-1000000000.0, 1000000000.0] and parameters: {'p_sma': 23, 'p_std': 60, 'p_atr': 17, 'p_adx': 9, 'rsi_period': 70, 'ema1': 14, 'ema2': 27, 'slip_atr_k': 0.02208640442087765, 'slip_spread_k': 0.008896210070631003, 'spread_hl_frac': 0.011259649354830705, 'bb_std_mult': 1.3597546360941066, 'rsi_os': 15, 'rsi_ob': 63, 'vol_spike': 0.02413506488565643, 'adx_thresh': 21.970686198683204, 'atr_min_pct': 0.021667463492818763, 'atr_max_pct': 0.12377846283933586, 'tp_mult': 2.3739526051645328, 'tsl_mult': 0.9854383933585044, 'strategy': 'mean_reversion', 'time_stop': 54, 'use_sma': False, 'use_atr': False, 'use_adx': False, 'use_ema': False, 'use_spike': True, 'rsi_required': False, 'edge_k': 1.511828886047741, 'edge_cap': 0.9989107078606405, 'bull_strategy': 'breakout', 'bull_bb_std_mult': 3.5180597176573682, 'bull_rsi_os': 17, 'bull_rsi_ob': 53, 'bull_adx_thresh': 10.844730421075084, 'bull_atr_min_pct': 0.008029100977130589, 'bull_atr_max_pct': 0.040663103661525236, 'bull_tp_mult': 1.7077191303470198, 'bull_tsl_mult': 0.8625871415865252, 'bull_time_stop': 141, 'bull_use_sma': False, 'bull_use_ema': False, 'bull_use_atr': True, 'bull_use_adx': True, 'bull_use_spike': False, 'bull_rsi_required': True, 'bear_strategy': 'mean_reversion', 'bear_bb_std_mult': 0.8863244759681351, 'bear_rsi_os': 10, 'bear_rsi_ob': 54, 'bear_adx_thresh': 13.138329221021777, 'bear_atr_min_pct': 0.022243900752418035, 'bear_atr_max_pct': 0.08068565194808922, 'bear_tp_mult': 2.7538344929227243, 'bear_tsl_mult': 0.20246783436286844, 'bear_time_stop': 70, 'bear_use_sma': True, 'bear_use_ema': True, 'bear_use_atr': True, 'bear_use_adx': True, 'bear_use_spike': True, 'bear_rsi_required': True, 'sideways_strategy': 'breakout', 'sideways_bb_std_mult': 1.0237377355587085, 'sideways_rsi_os': 28, 'sideways_rsi_ob': 57, 'sideways_adx_thresh': 31.41807511069873, 'sideways_atr_min_pct': 0.027714931079596904, 'sideways_atr_max_pct': 0.1064203464737644, 'sideways_tp_mult': 1.8386372081217666, 'sideways_tsl_mult': 0.9402369016136234, 'sideways_time_stop': 76, 'sideways_use_sma': False, 'sideways_use_ema': False, 'sideways_use_atr': False, 'sideways_use_adx': True, 'sideways_use_spike': True, 'sideways_rsi_required': True}.
[I 2025-08-31 04:26:12,314] Trial 351 finished with values: [-1000000000.0, 1000000000.0] and parameters: {'p_sma': 55, 'p_std': 15, 'p_atr': 17, 'p_adx': 8, 'rsi_period': 16, 'ema1': 14, 'ema2': 57, 'slip_atr_k': 0.021898646720133325, 'slip_spread_k': 0.10974891106855122, 'spread_hl_frac': 0.010941330048052337, 'bb_std_mult': 1.8199167600158284, 'rsi_os': 22, 'rsi_ob': 68, 'vol_spike': 0.29292870412240923, 'adx_thresh': 22.260112857570604, 'atr_min_pct': 0.00246857163083246, 'atr_max_pct': 0.11790640666638022, 'tp_mult': 2.3774709494189654, 'tsl_mult': 0.42550600588406484, 'strategy': 'mean_reversion', 'time_stop': 53, 'use_sma': False, 'use_atr': False, 'use_adx': False, 'use_ema': False, 'use_spike': True, 'rsi_required': False, 'edge_k': 0.3223758325942764, 'edge_cap': 0.7912771856588243, 'bull_strategy': 'mean_reversion', 'bull_bb_std_mult': 3.3924384600273774, 'bull_rsi_os': 17, 'bull_rsi_ob': 76, 'bull_adx_thresh': 10.687011103460094, 'bull_atr_min_pct': 0.0028165868661530038, 'bull_atr_max_pct': 0.04162013119988916, 'bull_tp_mult': 2.73703719166034, 'bull_tsl_mult': 0.4395286255342974, 'bull_time_stop': 141, 'bull_use_sma': False, 'bull_use_ema': False, 'bull_use_atr': True, 'bull_use_adx': True, 'bull_use_spike': False, 'bull_rsi_required': True, 'bear_strategy': 'mean_reversion', 'bear_bb_std_mult': 0.8860044149469632, 'bear_rsi_os': 11, 'bear_rsi_ob': 50, 'bear_adx_thresh': 32.44057682855697, 'bear_atr_min_pct': 0.024264936880838514, 'bear_atr_max_pct': 0.06524213450089492, 'bear_tp_mult': 1.1788060073265636, 'bear_tsl_mult': 0.1982248071903946, 'bear_time_stop': 102, 'bear_use_sma': True, 'bear_use_ema': True, 'bear_use_atr': True, 'bear_use_adx': True, 'bear_use_spike': True, 'bear_rsi_required': True, 'sideways_strategy': 'breakout', 'sideways_bb_std_mult': 0.7885693824212703, 'sideways_rsi_os': 33, 'sideways_rsi_ob': 56, 'sideways_adx_thresh': 18.80633761110137, 'sideways_atr_min_pct': 0.015216227334302975, 'sideways_atr_max_pct': 0.10798173092268504, 'sideways_tp_mult': 1.9096697159419094, 'sideways_tsl_mult': 0.5902807173516925, 'sideways_time_stop': 76, 'sideways_use_sma': False, 'sideways_use_ema': False, 'sideways_use_atr': False, 'sideways_use_adx': True, 'sideways_use_spike': True, 'sideways_rsi_required': True}.
[I 2025-08-31 04:26:13,187] Trial 350 finished with values: [-1000000000.0, 1000000000.0] and parameters: {'p_sma': 55, 'p_std': 60, 'p_atr': 25, 'p_adx': 14, 'rsi_period': 58, 'ema1': 12, 'ema2': 26, 'slip_atr_k': 0.02404883153212477, 'slip_spread_k': 0.11144729946303167, 'spread_hl_frac': 0.0420357554400174, 'bb_std_mult': 1.47773747516297, 'rsi_os': 28, 'rsi_ob': 64, 'vol_spike': 0.21643187461276048, 'adx_thresh': 20.88167992122717, 'atr_min_pct': 0.020108931666689818, 'atr_max_pct': 0.11155581913556431, 'tp_mult': 1.7145519468690598, 'tsl_mult': 0.8270317973784777, 'strategy': 'mean_reversion', 'time_stop': 45, 'use_sma': False, 'use_atr': False, 'use_adx': False, 'use_ema': False, 'use_spike': True, 'rsi_required': False, 'edge_k': 1.5098393133443127, 'edge_cap': 0.5232403141972011, 'bull_strategy': 'breakout', 'bull_bb_std_mult': 3.3898386108129683, 'bull_rsi_os': 15, 'bull_rsi_ob': 76, 'bull_adx_thresh': 29.235335934995476, 'bull_atr_min_pct': 0.022049555283291902, 'bull_atr_max_pct': 0.04074099814408135, 'bull_tp_mult': 2.276773018944374, 'bull_tsl_mult': 0.2898275056442823, 'bull_time_stop': 132, 'bull_use_sma': False, 'bull_use_ema': False, 'bull_use_atr': True, 'bull_use_adx': True, 'bull_use_spike': False, 'bull_rsi_required': True, 'bear_strategy': 'mean_reversion', 'bear_bb_std_mult': 1.043180611265391, 'bear_rsi_os': 8, 'bear_rsi_ob': 54, 'bear_adx_thresh': 20.654752637707947, 'bear_atr_min_pct': 0.02429645573963946, 'bear_atr_max_pct': 0.08282481325371435, 'bear_tp_mult': 2.7510195120958945, 'bear_tsl_mult': 0.2110030707955286, 'bear_time_stop': 257, 'bear_use_sma': True, 'bear_use_ema': True, 'bear_use_atr': False, 'bear_use_adx': False, 'bear_use_spike': True, 'bear_rsi_required': False, 'sideways_strategy': 'breakout', 'sideways_bb_std_mult': 1.01560526726961, 'sideways_rsi_os': 33, 'sideways_rsi_ob': 56, 'sideways_adx_thresh': 27.227343418831282, 'sideways_atr_min_pct': 0.029941212787250863, 'sideways_atr_max_pct': 0.07170671937461547, 'sideways_tp_mult': 2.1532871869916295, 'sideways_tsl_mult': 0.6732769677271015, 'sideways_time_stop': 62, 'sideways_use_sma': False, 'sideways_use_ema': False, 'sideways_use_atr': False, 'sideways_use_adx': False, 'sideways_use_spike': True, 'sideways_rsi_required': True}.
[I 2025-08-31 04:27:01,226] Trial 354 finished with values: [-1000000000.0, 1000000000.0] and parameters: {'p_sma': 49, 'p_std': 19, 'p_atr': 7, 'p_adx': 9, 'rsi_period': 67, 'ema1': 22, 'ema2': 48, 'slip_atr_k': 0.016604476597520887, 'slip_spread_k': 0.114587757698161, 'spread_hl_frac': 5.135406093495498e-07, 'bb_std_mult': 1.8066435338856532, 'rsi_os': 30, 'rsi_ob': 63, 'vol_spike': 0.013756505206492976, 'adx_thresh': 9.392031726793554, 'atr_min_pct': 0.0221261755521276, 'atr_max_pct': 0.11736868992872757, 'tp_mult': 2.5228117111186625, 'tsl_mult': 0.8852860308173798, 'strategy': 'mean_reversion', 'time_stop': 55, 'use_sma': False, 'use_atr': False, 'use_adx': False, 'use_ema': False, 'use_spike': True, 'rsi_required': False, 'edge_k': 0.08801090918950849, 'edge_cap': 0.9826608760466642, 'bull_strategy': 'breakout', 'bull_bb_std_mult': 2.9125442567007287, 'bull_rsi_os': 15, 'bull_rsi_ob': 85, 'bull_adx_thresh': 11.069927747674894, 'bull_atr_min_pct': 0.0027118836070334417, 'bull_atr_max_pct': 0.028614562420319983, 'bull_tp_mult': 1.4042904057274914, 'bull_tsl_mult': 0.4003539415435625, 'bull_time_stop': 130, 'bull_use_sma': False, 'bull_use_ema': False, 'bull_use_atr': True, 'bull_use_adx': True, 'bull_use_spike': False, 'bull_rsi_required': True, 'bear_strategy': 'mean_reversion', 'bear_bb_std_mult': 1.8675668835017925, 'bear_rsi_os': 11, 'bear_rsi_ob': 49, 'bear_adx_thresh': 20.935894964862904, 'bear_atr_min_pct': 0.022033802186463364, 'bear_atr_max_pct': 0.07921540299414764, 'bear_tp_mult': 1.185766080068128, 'bear_tsl_mult': 0.20842732901304215, 'bear_time_stop': 247, 'bear_use_sma': True, 'bear_use_ema': True, 'bear_use_atr': True, 'bear_use_adx': True, 'bear_use_spike': True, 'bear_rsi_required': True, 'sideways_strategy': 'breakout', 'sideways_bb_std_mult': 1.0412857580846557, 'sideways_rsi_os': 33, 'sideways_rsi_ob': 77, 'sideways_adx_thresh': 32.47577726071848, 'sideways_atr_min_pct': 0.015413862045132029, 'sideways_atr_max_pct': 0.12313647233292022, 'sideways_tp_mult': 2.278570502831658, 'sideways_tsl_mult': 0.5920844866538774, 'sideways_time_stop': 102, 'sideways_use_sma': False, 'sideways_use_ema': False, 'sideways_use_atr': False, 'sideways_use_adx': True, 'sideways_use_spike': True, 'sideways_rsi_required': True}.
[I 2025-08-31 04:27:02,066] Trial 355 finished with values: [-1000000000.0, 1000000000.0] and parameters: {'p_sma': 49, 'p_std': 9, 'p_atr': 7, 'p_adx': 15, 'rsi_period': 27, 'ema1': 13, 'ema2': 24, 'slip_atr_k': 0.015784334349674606, 'slip_spread_k': 0.4470505765944434, 'spread_hl_frac': 0.0026630683168572186, 'bb_std_mult': 1.4638019368899078, 'rsi_os': 26, 'rsi_ob': 59, 'vol_spike': 0.014193779669651895, 'adx_thresh': 8.800669868914861, 'atr_min_pct': 0.007029865829579738, 'atr_max_pct': 0.07359636639787867, 'tp_mult': 2.528080617975725, 'tsl_mult': 0.8853207745040217, 'strategy': 'breakout', 'time_stop': 39, 'use_sma': False, 'use_atr': False, 'use_adx': False, 'use_ema': False, 'use_spike': True, 'rsi_required': False, 'edge_k': 0.05290553018623534, 'edge_cap': 0.5346740511895086, 'bull_strategy': 'mean_reversion', 'bull_bb_std_mult': 1.6987962829582985, 'bull_rsi_os': 15, 'bull_rsi_ob': 77, 'bull_adx_thresh': 20.227312665668258, 'bull_atr_min_pct': 0.012781316409839469, 'bull_atr_max_pct': 0.041918955616383875, 'bull_tp_mult': 2.739976269161871, 'bull_tsl_mult': 0.5403835471380547, 'bull_time_stop': 132, 'bull_use_sma': False, 'bull_use_ema': False, 'bull_use_atr': False, 'bull_use_adx': True, 'bull_use_spike': False, 'bull_rsi_required': False, 'bear_strategy': 'mean_reversion', 'bear_bb_std_mult': 1.9839794712399401, 'bear_rsi_os': 50, 'bear_rsi_ob': 81, 'bear_adx_thresh': 20.844054731075673, 'bear_atr_min_pct': 0.02334432376273292, 'bear_atr_max_pct': 0.04357846779767869, 'bear_tp_mult': 2.8248049213263133, 'bear_tsl_mult': 0.2823447790218421, 'bear_time_stop': 213, 'bear_use_sma': True, 'bear_use_ema': True, 'bear_use_atr': True, 'bear_use_adx': True, 'bear_use_spike': True, 'bear_rsi_required': True, 'sideways_strategy': 'mean_reversion', 'sideways_bb_std_mult': 0.8761546677818496, 'sideways_rsi_os': 38, 'sideways_rsi_ob': 56, 'sideways_adx_thresh': 12.026157938495524, 'sideways_atr_min_pct': 0.010976691736706496, 'sideways_atr_max_pct': 0.04788649832773484, 'sideways_tp_mult': 2.0277816394809687, 'sideways_tsl_mult': 0.5922043815651326, 'sideways_time_stop': 46, 'sideways_use_sma': False, 'sideways_use_ema': False, 'sideways_use_atr': False, 'sideways_use_adx': True, 'sideways_use_spike': True, 'sideways_rsi_required': True}.
[I 2025-08-31 04:27:02,605] Trial 356 finished with values: [-0.031719387644125185, 0.03166491463640574] and parameters: {'p_sma': 58, 'p_std': 17, 'p_atr': 7, 'p_adx': 24, 'rsi_period': 61, 'ema1': 21, 'ema2': 27, 'slip_atr_k': 0.01696034491946809, 'slip_spread_k': 0.4445838291483251, 'spread_hl_frac': 0.0027512712177572424, 'bb_std_mult': 1.9132736123097946, 'rsi_os': 32, 'rsi_ob': 54, 'vol_spike': 0.013534079995703796, 'adx_thresh': 6.95486608687043, 'atr_min_pct': 0.022293926995927544, 'atr_max_pct': 0.022858666035900484, 'tp_mult': 2.52494379812785, 'tsl_mult': 0.9588932404765547, 'strategy': 'breakout', 'time_stop': 74, 'use_sma': True, 'use_atr': False, 'use_adx': False, 'use_ema': False, 'use_spike': True, 'rsi_required': False, 'edge_k': 1.6000533370066456, 'edge_cap': 0.6613412398527152, 'bull_strategy': 'mean_reversion', 'bull_bb_std_mult': 1.6935425587599138, 'bull_rsi_os': 15, 'bull_rsi_ob': 77, 'bull_adx_thresh': 19.907280207138918, 'bull_atr_min_pct': 0.00133638949086948, 'bull_atr_max_pct': 0.06955594397031001, 'bull_tp_mult': 1.3111494380580342, 'bull_tsl_mult': 0.01801342962081548, 'bull_time_stop': 6, 'bull_use_sma': False, 'bull_use_ema': False, 'bull_use_atr': False, 'bull_use_adx': True, 'bull_use_spike': False, 'bull_rsi_required': False, 'bear_strategy': 'mean_reversion', 'bear_bb_std_mult': 0.9799642891798609, 'bear_rsi_os': 8, 'bear_rsi_ob': 47, 'bear_adx_thresh': 20.7523346185464, 'bear_atr_min_pct': 0.02314561227006643, 'bear_atr_max_pct': 0.05288095844749739, 'bear_tp_mult': 2.048390635901262, 'bear_tsl_mult': 0.6384245909850322, 'bear_time_stop': 60, 'bear_use_sma': True, 'bear_use_ema': True, 'bear_use_atr': True, 'bear_use_adx': True, 'bear_use_spike': True, 'bear_rsi_required': True, 'sideways_strategy': 'mean_reversion', 'sideways_bb_std_mult': 0.8919229018611592, 'sideways_rsi_os': 40, 'sideways_rsi_ob': 59, 'sideways_adx_thresh': 11.119781261823315, 'sideways_atr_min_pct': 0.0012050197182594431, 'sideways_atr_max_pct': 0.11620260292207002, 'sideways_tp_mult': 2.0260820313959993, 'sideways_tsl_mult': 0.6551566221578713, 'sideways_time_stop': 133, 'sideways_use_sma': False, 'sideways_use_ema': False, 'sideways_use_atr': False, 'sideways_use_adx': True, 'sideways_use_spike': True, 'sideways_rsi_required': True}.
[I 2025-08-31 04:27:02,874] Trial 357 finished with values: [-0.04634120113209461, 0.04627460291583417] and parameters: {'p_sma': 58, 'p_std': 17, 'p_atr': 9, 'p_adx': 9, 'rsi_period': 62, 'ema1': 15, 'ema2': 24, 'slip_atr_k': 0.015551492562345136, 'slip_spread_k': 0.059230393554061005, 'spread_hl_frac': 0.048774193243248706, 'bb_std_mult': 1.9293161965302341, 'rsi_os': 30, 'rsi_ob': 59, 'vol_spike': 0.015159119937892809, 'adx_thresh': 7.027039323514444, 'atr_min_pct': 0.016709906306797542, 'atr_max_pct': 0.07289363371197091, 'tp_mult': 2.2741619987448423, 'tsl_mult': 0.8850152506647442, 'strategy': 'breakout', 'time_stop': 39, 'use_sma': True, 'use_atr': False, 'use_adx': False, 'use_ema': False, 'use_spike': True, 'rsi_required': False, 'edge_k': 0.04416131854922134, 'edge_cap': 0.9796879691482211, 'bull_strategy': 'mean_reversion', 'bull_bb_std_mult': 3.472567321687856, 'bull_rsi_os': 14, 'bull_rsi_ob': 84, 'bull_adx_thresh': 9.767937881196042, 'bull_atr_min_pct': 0.001176444975886459, 'bull_atr_max_pct': 0.024594108354652908, 'bull_tp_mult': 1.250982680648029, 'bull_tsl_mult': 0.016048201959466435, 'bull_time_stop': 151, 'bull_use_sma': False, 'bull_use_ema': False, 'bull_use_atr': False, 'bull_use_adx': True, 'bull_use_spike': False, 'bull_rsi_required': False, 'bear_strategy': 'mean_reversion', 'bear_bb_std_mult': 0.962131538138297, 'bear_rsi_os': 27, 'bear_rsi_ob': 47, 'bear_adx_thresh': 23.276002727430008, 'bear_atr_min_pct': 0.023514451641803637, 'bear_atr_max_pct': 0.03374595712372247, 'bear_tp_mult': 1.233999507369063, 'bear_tsl_mult': 0.23548331006192705, 'bear_time_stop': 213, 'bear_use_sma': True, 'bear_use_ema': True, 'bear_use_atr': True, 'bear_use_adx': True, 'bear_use_spike': True, 'bear_rsi_required': True, 'sideways_strategy': 'mean_reversion', 'sideways_bb_std_mult': 1.128337707624906, 'sideways_rsi_os': 40, 'sideways_rsi_ob': 52, 'sideways_adx_thresh': 12.088570379934131, 'sideways_atr_min_pct': 0.001416404099524416, 'sideways_atr_max_pct': 0.12331330542580739, 'sideways_tp_mult': 2.2905874339352654, 'sideways_tsl_mult': 0.6377802546866989, 'sideways_time_stop': 112, 'sideways_use_sma': False, 'sideways_use_ema': False, 'sideways_use_atr': False, 'sideways_use_adx': True, 'sideways_use_spike': True, 'sideways_rsi_required': True}.
[I 2025-08-31 04:27:54,654] Trial 360 finished with values: [-1000000000.0, 1000000000.0] and parameters: {'p_sma': 10, 'p_std': 11, 'p_atr': 22, 'p_adx': 9, 'rsi_period': 63, 'ema1': 6, 'ema2': 25, 'slip_atr_k': 0.06607375685937922, 'slip_spread_k': 0.26708243733317805, 'spread_hl_frac': 0.00947133008042675, 'bb_std_mult': 3.4326974746215937, 'rsi_os': 24, 'rsi_ob': 61, 'vol_spike': 0.10846470718761105, 'adx_thresh': 10.020118153119876, 'atr_min_pct': 0.018388552061240286, 'atr_max_pct': 0.09620301810136876, 'tp_mult': 2.610712482272077, 'tsl_mult': 0.7317586928777408, 'strategy': 'breakout', 'time_stop': 175, 'use_sma': True, 'use_atr': True, 'use_adx': False, 'use_ema': True, 'use_spike': False, 'rsi_required': False, 'edge_k': 1.3671406028808117, 'edge_cap': 0.7246802810896775, 'bull_strategy': 'mean_reversion', 'bull_bb_std_mult': 1.3763122271134447, 'bull_rsi_os': 14, 'bull_rsi_ob': 79, 'bull_adx_thresh': 12.915465348391692, 'bull_atr_min_pct': 0.010204485174912481, 'bull_atr_max_pct': 0.05475499844783441, 'bull_tp_mult': 1.5432312426461825, 'bull_tsl_mult': 0.8959851448520298, 'bull_time_stop': 150, 'bull_use_sma': False, 'bull_use_ema': True, 'bull_use_atr': True, 'bull_use_adx': False, 'bull_use_spike': True, 'bull_rsi_required': True, 'bear_strategy': 'mean_reversion', 'bear_bb_std_mult': 0.962001137656563, 'bear_rsi_os': 25, 'bear_rsi_ob': 70, 'bear_adx_thresh': 21.47316262299231, 'bear_atr_min_pct': 0.02514470898301214, 'bear_atr_max_pct': 0.10751512873292732, 'bear_tp_mult': 1.9122606058353253, 'bear_tsl_mult': 0.5434701851427699, 'bear_time_stop': 283, 'bear_use_sma': False, 'bear_use_ema': False, 'bear_use_atr': True, 'bear_use_adx': True, 'bear_use_spike': False, 'bear_rsi_required': True, 'sideways_strategy': 'mean_reversion', 'sideways_bb_std_mult': 1.1138429191137633, 'sideways_rsi_os': 36, 'sideways_rsi_ob': 53, 'sideways_adx_thresh': 5.0646473584909035, 'sideways_atr_min_pct': 0.014546069733611448, 'sideways_atr_max_pct': 0.11298807558923354, 'sideways_tp_mult': 2.4496972918006943, 'sideways_tsl_mult': 0.6350325175868854, 'sideways_time_stop': 67, 'sideways_use_sma': True, 'sideways_use_ema': False, 'sideways_use_atr': False, 'sideways_use_adx': True, 'sideways_use_spike': True, 'sideways_rsi_required': False}.
[I 2025-08-31 04:27:55,285] Trial 358 finished with values: [-1000000000.0, 1000000000.0] and parameters: {'p_sma': 58, 'p_std': 17, 'p_atr': 9, 'p_adx': 26, 'rsi_period': 62, 'ema1': 6, 'ema2': 24, 'slip_atr_k': 0.034414231974159826, 'slip_spread_k': 0.054421771945954045, 'spread_hl_frac': 0.020324342071593705, 'bb_std_mult': 1.9244097292631748, 'rsi_os': 20, 'rsi_ob': 58, 'vol_spike': 0.027806764251732743, 'adx_thresh': 9.869520202978006, 'atr_min_pct': 0.02833009358669113, 'atr_max_pct': 0.14054377027434709, 'tp_mult': 2.4453498148183517, 'tsl_mult': 0.1541562725263761, 'strategy': 'breakout', 'time_stop': 87, 'use_sma': True, 'use_atr': False, 'use_adx': False, 'use_ema': False, 'use_spike': True, 'rsi_required': False, 'edge_k': 0.5742157423639427, 'edge_cap': 0.6675974052736479, 'bull_strategy': 'mean_reversion', 'bull_bb_std_mult': 0.559641935277774, 'bull_rsi_os': 14, 'bull_rsi_ob': 77, 'bull_adx_thresh': 29.99505784339376, 'bull_atr_min_pct': 0.01028700161008599, 'bull_atr_max_pct': 0.05588715712875317, 'bull_tp_mult': 1.6619580444758686, 'bull_tsl_mult': 0.34431882418247983, 'bull_time_stop': 150, 'bull_use_sma': False, 'bull_use_ema': False, 'bull_use_atr': False, 'bull_use_adx': True, 'bull_use_spike': False, 'bull_rsi_required': False, 'bear_strategy': 'mean_reversion', 'bear_bb_std_mult': 0.9538355207774026, 'bear_rsi_os': 49, 'bear_rsi_ob': 88, 'bear_adx_thresh': 21.473194669823997, 'bear_atr_min_pct': 0.02314856800380437, 'bear_atr_max_pct': 0.042146229608791594, 'bear_tp_mult': 1.3347946218203453, 'bear_tsl_mult': 0.2845552005470411, 'bear_time_stop': 17, 'bear_use_sma': True, 'bear_use_ema': True, 'bear_use_atr': True, 'bear_use_adx': True, 'bear_use_spike': True, 'bear_rsi_required': True, 'sideways_strategy': 'mean_reversion', 'sideways_bb_std_mult': 2.9971543901818585, 'sideways_rsi_os': 30, 'sideways_rsi_ob': 59, 'sideways_adx_thresh': 11.926442423954045, 'sideways_atr_min_pct': 0.014464953228186484, 'sideways_atr_max_pct': 0.08167027643662184, 'sideways_tp_mult': 1.9788372540722958, 'sideways_tsl_mult': 0.41127280899680085, 'sideways_time_stop': 49, 'sideways_use_sma': False, 'sideways_use_ema': False, 'sideways_use_atr': False, 'sideways_use_adx': True, 'sideways_use_spike': True, 'sideways_rsi_required': True}.
