[I 2025-08-31 04:22:12,347] Trial 331 finished with values: [-1000000000.0, 1000000000.0] and parameters: {'p_sma': 51, 'p_std': 13, 'p_atr': 27, 'p_adx': 10, 'rsi_period': 24, 'ema1': 13, 'ema2': 27, 'slip_atr_k': 0.08049260636889173, 'slip_spread_k': 0.7567028945308094, 'spread_hl_frac': 0.035387491196258045, 'bb_std_mult': 1.8681754367873034, 'rsi_os': 29, 'rsi_ob': 56, 'vol_spike': 0.018943309248090772, 'adx_thresh': 16.60130560995981, 'atr_min_pct': 0.021031266630706535, 'atr_max_pct': 0.039500862518996656, 'tp_mult': 2.9648524183761076, 'tsl_mult': 0.6823723097463082, 'strategy': 'breakout', 'time_stop': 43, 'use_sma': False, 'use_atr': False, 'use_adx': False, 'use_ema': False, 'use_spike': True, 'rsi_required': False, 'edge_k': 1.4833481550018683, 'edge_cap': 0.2326554277598472, 'bull_strategy': 'mean_reversion', 'bull_bb_std_mult': 0.7993749485800412, 'bull_rsi_os': 9, 'bull_rsi_ob': 79, 'bull_adx_thresh': 12.355409043717202, 'bull_atr_min_pct': 0.002210777954964613, 'bull_atr_max_pct': 0.09999928134946401, 'bull_tp_mult': 1.5730220489176447, 'bull_tsl_mult': 0.8383480768552838, 'bull_time_stop': 138, 'bull_use_sma': False, 'bull_use_ema': False, 'bull_use_atr': True, 'bull_use_adx': True, 'bull_use_spike': False, 'bull_rsi_required': True, 'bear_strategy': 'breakout', 'bear_bb_std_mult': 3.583557959461337, 'bear_rsi_os': 9, 'bear_rsi_ob': 46, 'bear_adx_thresh': 22.033170327645983, 'bear_atr_min_pct': 0.003112771708834814, 'bear_atr_max_pct': 0.04929075210915647, 'bear_tp_mult': 2.7912330521205546, 'bear_tsl_mult': 0.2632770847763767, 'bear_time_stop': 223, 'bear_use_sma': True, 'bear_use_ema': True, 'bear_use_atr': True, 'bear_use_adx': True, 'bear_use_spike': True, 'bear_rsi_required': False, 'sideways_strategy': 'mean_reversion', 'sideways_bb_std_mult': 0.9300410891210656, 'sideways_rsi_os': 27, 'sideways_rsi_ob': 63, 'sideways_adx_thresh': 11.518202021600345, 'sideways_atr_min_pct': 0.013790902999349338, 'sideways_atr_max_pct': 0.12703244866116348, 'sideways_tp_mult': 2.0419189950058536, 'sideways_tsl_mult': 0.6346307650208042, 'sideways_time_stop': 59, 'sideways_use_sma': False, 'sideways_use_ema': False, 'sideways_use_atr': False, 'sideways_use_adx': False, 'sideways_use_spike': True, 'sideways_rsi_required': True}.
[I 2025-08-31 04:23:01,127] Trial 335 finished with values: [-1000000000.0, 1000000000.0] and parameters: {'p_sma': 57, 'p_std': 38, 'p_atr': 25, 'p_adx': 11, 'rsi_period': 24, 'ema1': 15, 'ema2': 26, 'slip_atr_k': 0.02541620444092005, 'slip_spread_k': 0.1446475626091578, 'spread_hl_frac': 0.012054963047987765, 'bb_std_mult': 1.8748423891458168, 'rsi_os': 28, 'rsi_ob': 60, 'vol_spike': 0.09083426657032295, 'adx_thresh': 17.012822739449078, 'atr_min_pct': 0.023013962353791988, 'atr_max_pct': 0.03946021990740876, 'tp_mult': 2.509746370343946, 'tsl_mult': 0.6839500408474422, 'strategy': 'breakout', 'time_stop': 30, 'use_sma': False, 'use_atr': False, 'use_adx': False, 'use_ema': False, 'use_spike': True, 'rsi_required': False, 'edge_k': 1.0690612209438275, 'edge_cap': 0.961713444912374, 'bull_strategy': 'breakout', 'bull_bb_std_mult': 0.8279163737322814, 'bull_rsi_os': 8, 'bull_rsi_ob': 77, 'bull_adx_thresh': 10.06665900130813, 'bull_atr_min_pct': 0.0016539639492165875, 'bull_atr_max_pct': 0.07652862145790965, 'bull_tp_mult': 2.573718341331413, 'bull_tsl_mult': 0.7843555396966241, 'bull_time_stop': 145, 'bull_use_sma': False, 'bull_use_ema': False, 'bull_use_atr': True, 'bull_use_adx': True, 'bull_use_spike': False, 'bull_rsi_required': True, 'bear_strategy': 'mean_reversion', 'bear_bb_std_mult': 1.2966031127256197, 'bear_rsi_os': 55, 'bear_rsi_ob': 91, 'bear_adx_thresh': 9.534526678318457, 'bear_atr_min_pct': 0.0029105937085929286, 'bear_atr_max_pct': 0.015956546457107257, 'bear_tp_mult': 1.4794662449603613, 'bear_tsl_mult': 0.23743376546139588, 'bear_time_stop': 205, 'bear_use_sma': True, 'bear_use_ema': True, 'bear_use_atr': False, 'bear_use_adx': False, 'bear_use_spike': True, 'bear_rsi_required': True, 'sideways_strategy': 'mean_reversion', 'sideways_bb_std_mult': 1.0433017695616074, 'sideways_rsi_os': 29, 'sideways_rsi_ob': 67, 'sideways_adx_thresh': 11.488450683104087, 'sideways_atr_min_pct': 0.0035658375848995217, 'sideways_atr_max_pct': 0.03071078569208243, 'sideways_tp_mult': 1.9398627428710373, 'sideways_tsl_mult': 0.6718529283807484, 'sideways_time_stop': 65, 'sideways_use_sma': False, 'sideways_use_ema': False, 'sideways_use_atr': False, 'sideways_use_adx': True, 'sideways_use_spike': True, 'sideways_rsi_required': True}.
[I 2025-08-31 04:23:01,992] Trial 334 finished with values: [-1000000000.0, 1000000000.0] and parameters: {'p_sma': 57, 'p_std': 39, 'p_atr': 24, 'p_adx': 11, 'rsi_period': 21, 'ema1': 14, 'ema2': 24, 'slip_atr_k': 0.10421623502507864, 'slip_spread_k': 0.15565582363298952, 'spread_hl_frac': 0.010366171589269552, 'bb_std_mult': 1.8793074739115667, 'rsi_os': 36, 'rsi_ob': 60, 'vol_spike': 0.03861743967442315, 'adx_thresh': 13.701595763477197, 'atr_min_pct': 0.020899607816702356, 'atr_max_pct': 0.08176733905527507, 'tp_mult': 2.5064743769544084, 'tsl_mult': 0.8734632163515202, 'strategy': 'breakout', 'time_stop': 26, 'use_sma': False, 'use_atr': False, 'use_adx': False, 'use_ema': False, 'use_spike': True, 'rsi_required': False, 'edge_k': 1.4589952874383776, 'edge_cap': 0.1752977962831032, 'bull_strategy': 'mean_reversion', 'bull_bb_std_mult': 2.1903050824243926, 'bull_rsi_os': 17, 'bull_rsi_ob': 60, 'bull_adx_thresh': 12.275005272337133, 'bull_atr_min_pct': 0.003137235533888904, 'bull_atr_max_pct': 0.08572864500512689, 'bull_tp_mult': 1.557509297005362, 'bull_tsl_mult': 0.8380577678971599, 'bull_time_stop': 136, 'bull_use_sma': False, 'bull_use_ema': False, 'bull_use_atr': True, 'bull_use_adx': True, 'bull_use_spike': False, 'bull_rsi_required': True, 'bear_strategy': 'mean_reversion', 'bear_bb_std_mult': 1.307736946226331, 'bear_rsi_os': 10, 'bear_rsi_ob': 50, 'bear_adx_thresh': 19.182989109860102, 'bear_atr_min_pct': 0.024500053949377244, 'bear_atr_max_pct': 0.12412370343858253, 'bear_tp_mult': 2.789812898150056, 'bear_tsl_mult': 0.17951056923173425, 'bear_time_stop': 204, 'bear_use_sma': True, 'bear_use_ema': True, 'bear_use_atr': True, 'bear_use_adx': True, 'bear_use_spike': True, 'bear_rsi_required': True, 'sideways_strategy': 'mean_reversion', 'sideways_bb_std_mult': 0.9417423332780758, 'sideways_rsi_os': 20, 'sideways_rsi_ob': 48, 'sideways_adx_thresh': 33.262543294075385, 'sideways_atr_min_pct': 0.0124631405388789, 'sideways_atr_max_pct': 0.10577777588693052, 'sideways_tp_mult': 2.3790531187201416, 'sideways_tsl_mult': 0.635328041000385, 'sideways_time_stop': 196, 'sideways_use_sma': False, 'sideways_use_ema': False, 'sideways_use_atr': False, 'sideways_use_adx': True, 'sideways_use_spike': True, 'sideways_rsi_required': True}.
[I 2025-08-31 04:23:02,044] Trial 336 finished with values: [-1000000000.0, 1000000000.0] and parameters: {'p_sma': 56, 'p_std': 36, 'p_atr': 20, 'p_adx': 16, 'rsi_period': 24, 'ema1': 15, 'ema2': 26, 'slip_atr_k': 0.1190404574301428, 'slip_spread_k': 0.6080679421834505, 'spread_hl_frac': 0.01234904796309495, 'bb_std_mult': 1.9298359459220416, 'rsi_os': 36, 'rsi_ob': 91, 'vol_spike': 0.11385810499669273, 'adx_thresh': 30.207041921935335, 'atr_min_pct': 0.026188013051650666, 'atr_max_pct': 0.10697632375841029, 'tp_mult': 2.677831376300065, 'tsl_mult': 0.7066777791608874, 'strategy': 'breakout', 'time_stop': 38, 'use_sma': False, 'use_atr': False, 'use_adx': False, 'use_ema': False, 'use_spike': True, 'rsi_required': False, 'edge_k': 1.3920374251668268, 'edge_cap': 0.9996377174178233, 'bull_strategy': 'breakout', 'bull_bb_std_mult': 0.7842805414658984, 'bull_rsi_os': 46, 'bull_rsi_ob': 47, 'bull_adx_thresh': 10.30956530994943, 'bull_atr_min_pct': 0.0016011136559455274, 'bull_atr_max_pct': 0.03156979593785889, 'bull_tp_mult': 1.5838845540909723, 'bull_tsl_mult': 0.8418124061369033, 'bull_time_stop': 148, 'bull_use_sma': False, 'bull_use_ema': False, 'bull_use_atr': True, 'bull_use_adx': True, 'bull_use_spike': False, 'bull_rsi_required': True, 'bear_strategy': 'mean_reversion', 'bear_bb_std_mult': 0.9484801810932517, 'bear_rsi_os': 10, 'bear_rsi_ob': 48, 'bear_adx_thresh': 19.244803771461193, 'bear_atr_min_pct': 0.024812345051380157, 'bear_atr_max_pct': 0.11223562110647925, 'bear_tp_mult': 2.710446903156037, 'bear_tsl_mult': 0.07039412864504341, 'bear_time_stop': 205, 'bear_use_sma': True, 'bear_use_ema': True, 'bear_use_atr': False, 'bear_use_adx': False, 'bear_use_spike': True, 'bear_rsi_required': True, 'sideways_strategy': 'mean_reversion', 'sideways_bb_std_mult': 1.0569903903723545, 'sideways_rsi_os': 19, 'sideways_rsi_ob': 48, 'sideways_adx_thresh': 11.167647174483324, 'sideways_atr_min_pct': 0.014427360920013045, 'sideways_atr_max_pct': 0.12635971970811707, 'sideways_tp_mult': 2.368183283072776, 'sideways_tsl_mult': 0.6373121766636681, 'sideways_time_stop': 79, 'sideways_use_sma': False, 'sideways_use_ema': False, 'sideways_use_atr': False, 'sideways_use_adx': True, 'sideways_use_spike': True, 'sideways_rsi_required': True}.
[I 2025-08-31 04:23:02,633] Trial 337 finished with values: [-1000000000.0, 1000000000.0] and parameters: {'p_sma': 56, 'p_std': 18, 'p_atr': 23, 'p_adx': 11, 'rsi_period': 52, 'ema1': 15, 'ema2': 25, 'slip_atr_k': 0.02494776229251532, 'slip_spread_k': 0.6093104390016412, 'spread_hl_frac': 0.012240051341853717, 'bb_std_mult': 1.9519045923404816, 'rsi_os': 27, 'rsi_ob': 60, 'vol_spike': 0.0417874734017252, 'adx_thresh': 13.370622735697136, 'atr_min_pct': 0.023055851106438742, 'atr_max_pct': 0.10791403542661032, 'tp_mult': 2.495613857816307, 'tsl_mult': 0.8678752835354367, 'strategy': 'breakout', 'time_stop': 35, 'use_sma': True, 'use_atr': False, 'use_adx': False, 'use_ema': False, 'use_spike': True, 'rsi_required': False, 'edge_k': 1.4047152494181094, 'edge_cap': 0.9995049409769993, 'bull_strategy': 'breakout', 'bull_bb_std_mult': 3.4869725225880406, 'bull_rsi_os': 14, 'bull_rsi_ob': 73, 'bull_adx_thresh': 10.344404769717023, 'bull_atr_min_pct': 0.0016370293369552063, 'bull_atr_max_pct': 0.010102641064541576, 'bull_tp_mult': 1.5892154597703692, 'bull_tsl_mult': 0.884562970536257, 'bull_time_stop': 144, 'bull_use_sma': False, 'bull_use_ema': False, 'bull_use_atr': False, 'bull_use_adx': True, 'bull_use_spike': False, 'bull_rsi_required': False, 'bear_strategy': 'mean_reversion', 'bear_bb_std_mult': 1.1389376299675376, 'bear_rsi_os': 23, 'bear_rsi_ob': 48, 'bear_adx_thresh': 19.174455508880083, 'bear_atr_min_pct': 0.024803385413358917, 'bear_atr_max_pct': 0.12161160664675573, 'bear_tp_mult': 2.710692236109061, 'bear_tsl_mult': 0.17464340818610366, 'bear_time_stop': 187, 'bear_use_sma': True, 'bear_use_ema': True, 'bear_use_atr': False, 'bear_use_adx': False, 'bear_use_spike': True, 'bear_rsi_required': True, 'sideways_strategy': 'mean_reversion', 'sideways_bb_std_mult': 3.5133155757867223, 'sideways_rsi_os': 20, 'sideways_rsi_ob': 67, 'sideways_adx_thresh': 9.171241126354344, 'sideways_atr_min_pct': 0.01445927911796585, 'sideways_atr_max_pct': 0.030685737407451646, 'sideways_tp_mult': 1.9340017779604437, 'sideways_tsl_mult': 0.7858328881752208, 'sideways_time_stop': 69, 'sideways_use_sma': False, 'sideways_use_ema': False, 'sideways_use_atr': False, 'sideways_use_adx': True, 'sideways_use_spike': True, 'sideways_rsi_required': True}.
[I 2025-08-31 04:23:50,731] Trial 338 finished with values: [-1000000000.0, 1000000000.0] and parameters: {'p_sma': 8, 'p_std': 43, 'p_atr': 8, 'p_adx': 9, 'rsi_period': 81, 'ema1': 14, 'ema2': 25, 'slip_atr_k': 0.1067408420695604, 'slip_spread_k': 0.12361680027448646, 'spread_hl_frac': 0.009831717357962212, 'bb_std_mult': 1.2745715043051646, 'rsi_os': 40, 'rsi_ob': 49, 'vol_spike': 0.03840105634010288, 'adx_thresh': 14.14165726935304, 'atr_min_pct': 0.00821689699502444, 'atr_max_pct': 0.10195543438361347, 'tp_mult': 2.681406031075036, 'tsl_mult': 0.8696116727940862, 'strategy': 'breakout', 'time_stop': 37, 'use_sma': True, 'use_atr': False, 'use_adx': False, 'use_ema': False, 'use_spike': True, 'rsi_required': False, 'edge_k': 1.396537004701228, 'edge_cap': 0.9848573967473881, 'bull_strategy': 'breakout', 'bull_bb_std_mult': 2.23342603068716, 'bull_rsi_os': 46, 'bull_rsi_ob': 83, 'bull_adx_thresh': 10.356470006792227, 'bull_atr_min_pct': 0.0032526698096841, 'bull_atr_max_pct': 0.018306200771074713, 'bull_tp_mult': 1.572176788596824, 'bull_tsl_mult': 0.8925882822212906, 'bull_time_stop': 25, 'bull_use_sma': False, 'bull_use_ema': False, 'bull_use_atr': False, 'bull_use_adx': True, 'bull_use_spike': False, 'bull_rsi_required': False, 'bear_strategy': 'mean_reversion', 'bear_bb_std_mult': 0.9440167259252428, 'bear_rsi_os': 10, 'bear_rsi_ob': 48, 'bear_adx_thresh': 19.026753506183347, 'bear_atr_min_pct': 0.02488319053669026, 'bear_atr_max_pct': 0.14714230689203955, 'bear_tp_mult': 2.812290099441739, 'bear_tsl_mult': 0.8504954200113193, 'bear_time_stop': 187, 'bear_use_sma': True, 'bear_use_ema': True, 'bear_use_atr': True, 'bear_use_adx': True, 'bear_use_spike': True, 'bear_rsi_required': True, 'sideways_strategy': 'mean_reversion', 'sideways_bb_std_mult': 1.0877786693353029, 'sideways_rsi_os': 30, 'sideways_rsi_ob': 79, 'sideways_adx_thresh': 33.51600698159939, 'sideways_atr_min_pct': 0.014153582510619619, 'sideways_atr_max_pct': 0.11388249074046836, 'sideways_tp_mult': 2.0161551869669343, 'sideways_tsl_mult': 0.33544087678892354, 'sideways_time_stop': 81, 'sideways_use_sma': False, 'sideways_use_ema': False, 'sideways_use_atr': False, 'sideways_use_adx': True, 'sideways_use_spike': True, 'sideways_rsi_required': True}.
[I 2025-08-31 04:23:50,867] Trial 340 finished with values: [-1000000000.0, 1000000000.0] and parameters: {'p_sma': 8, 'p_std': 18, 'p_atr': 8, 'p_adx': 9, 'rsi_period': 82, 'ema1': 14, 'ema2': 25, 'slip_atr_k': 0.015376507456610376, 'slip_spread_k': 0.9591134624743209, 'spread_hl_frac': 0.00956144007562588, 'bb_std_mult': 1.7553998926795842, 'rsi_os': 42, 'rsi_ob': 61, 'vol_spike': 0.14745400746424958, 'adx_thresh': 13.053137781271714, 'atr_min_pct': 0.008582565960740834, 'atr_max_pct': 0.10202284879396308, 'tp_mult': 1.7970962946092266, 'tsl_mult': 0.8623504799280066, 'strategy': 'mean_reversion', 'time_stop': 49, 'use_sma': True, 'use_atr': False, 'use_adx': False, 'use_ema': False, 'use_spike': True, 'rsi_required': False, 'edge_k': 1.549631855132452, 'edge_cap': 0.9786349043737028, 'bull_strategy': 'mean_reversion', 'bull_bb_std_mult': 3.4643164381982743, 'bull_rsi_os': 14, 'bull_rsi_ob': 68, 'bull_adx_thresh': 9.52258940023141, 'bull_atr_min_pct': 0.004039189025404788, 'bull_atr_max_pct': 0.044060569370040305, 'bull_tp_mult': 1.6718439591633958, 'bull_tsl_mult': 0.8821539726509521, 'bull_time_stop': 126, 'bull_use_sma': False, 'bull_use_ema': False, 'bull_use_atr': False, 'bull_use_adx': True, 'bull_use_spike': False, 'bull_rsi_required': False, 'bear_strategy': 'mean_reversion', 'bear_bb_std_mult': 2.617376249184244, 'bear_rsi_os': 23, 'bear_rsi_ob': 48, 'bear_adx_thresh': 20.35437716721084, 'bear_atr_min_pct': 0.02838810059733313, 'bear_atr_max_pct': 0.04282863373547901, 'bear_tp_mult': 2.71913968757605, 'bear_tsl_mult': 0.21740393687023868, 'bear_time_stop': 187, 'bear_use_sma': True, 'bear_use_ema': True, 'bear_use_atr': True, 'bear_use_adx': True, 'bear_use_spike': True, 'bear_rsi_required': True, 'sideways_strategy': 'breakout', 'sideways_bb_std_mult': 1.7160173811247945, 'sideways_rsi_os': 26, 'sideways_rsi_ob': 52, 'sideways_adx_thresh': 8.924828876562122, 'sideways_atr_min_pct': 0.008250130891192906, 'sideways_atr_max_pct': 0.11536817014347134, 'sideways_tp_mult': 2.0047706281589286, 'sideways_tsl_mult': 0.792884967052761, 'sideways_time_stop': 70, 'sideways_use_sma': False, 'sideways_use_ema': False, 'sideways_use_atr': False, 'sideways_use_adx': True, 'sideways_use_spike': True, 'sideways_rsi_required': True}.
[I 2025-08-31 04:23:50,994] Trial 339 finished with values: [-1000000000.0, 1000000000.0] and parameters: {'p_sma': 6, 'p_std': 18, 'p_atr': 8, 'p_adx': 28, 'rsi_period': 51, 'ema1': 14, 'ema2': 25, 'slip_atr_k': 0.016460689100143457, 'slip_spread_k': 0.5243763521968645, 'spread_hl_frac': 0.007415629756623358, 'bb_std_mult': 1.7468392375098403, 'rsi_os': 40, 'rsi_ob': 61, 'vol_spike': 0.014161596924867867, 'adx_thresh': 18.23186881501738, 'atr_min_pct': 0.021963597169934256, 'atr_max_pct': 0.12471330445887922, 'tp_mult': 1.7892879092426575, 'tsl_mult': 0.5921164807862271, 'strategy': 'mean_reversion', 'time_stop': 50, 'use_sma': True, 'use_atr': False, 'use_adx': False, 'use_ema': False, 'use_spike': True, 'rsi_required': False, 'edge_k': 1.5417763465453143, 'edge_cap': 0.9998747090185462, 'bull_strategy': 'mean_reversion', 'bull_bb_std_mult': 2.3349684643947146, 'bull_rsi_os': 14, 'bull_rsi_ob': 57, 'bull_adx_thresh': 26.618303817979267, 'bull_atr_min_pct': 0.007101114126387345, 'bull_atr_max_pct': 0.0432043968793229, 'bull_tp_mult': 2.3307386261338108, 'bull_tsl_mult': 0.1117187960090919, 'bull_time_stop': 127, 'bull_use_sma': False, 'bull_use_ema': False, 'bull_use_atr': False, 'bull_use_adx': True, 'bull_use_spike': False, 'bull_rsi_required': False, 'bear_strategy': 'mean_reversion', 'bear_bb_std_mult': 2.6010990113564025, 'bear_rsi_os': 23, 'bear_rsi_ob': 48, 'bear_adx_thresh': 20.321940902546384, 'bear_atr_min_pct': 0.027006955083634626, 'bear_atr_max_pct': 0.0428591232863846, 'bear_tp_mult': 2.713680626343726, 'bear_tsl_mult': 0.2054708388502393, 'bear_time_stop': 152, 'bear_use_sma': True, 'bear_use_ema': True, 'bear_use_atr': True, 'bear_use_adx': True, 'bear_use_spike': True, 'bear_rsi_required': True, 'sideways_strategy': 'breakout', 'sideways_bb_std_mult': 2.7152496506986568, 'sideways_rsi_os': 26, 'sideways_rsi_ob': 56, 'sideways_adx_thresh': 29.375786517748526, 'sideways_atr_min_pct': 0.007177651998531343, 'sideways_atr_max_pct': 0.11417545272852933, 'sideways_tp_mult': 1.849276974476639, 'sideways_tsl_mult': 0.7908735732135772, 'sideways_time_stop': 70, 'sideways_use_sma': False, 'sideways_use_ema': False, 'sideways_use_atr': False, 'sideways_use_adx': True, 'sideways_use_spike': True, 'sideways_rsi_required': True}.
[I 2025-08-31 04:23:51,238] Trial 341 finished with values: [-1000000000.0, 1000000000.0] and parameters: {'p_sma': 54, 'p_std': 43, 'p_atr': 24, 'p_adx': 9, 'rsi_period': 81, 'ema1': 18, 'ema2': 25, 'slip_atr_k': 0.2166390284882279, 'slip_spread_k': 0.9680734123421952, 'spread_hl_frac': 0.028917696287220324, 'bb_std_mult': 2.9234436194943147, 'rsi_os': 31, 'rsi_ob': 72, 'vol_spike': 0.1644913930225437, 'adx_thresh': 14.065597405387606, 'atr_min_pct': 0.006004990805494126, 'atr_max_pct': 0.13536917759019676, 'tp_mult': 2.547089173941672, 'tsl_mult': 0.9028778747238839, 'strategy': 'mean_reversion', 'time_stop': 220, 'use_sma': True, 'use_atr': False, 'use_adx': False, 'use_ema': True, 'use_spike': False, 'rsi_required': False, 'edge_k': 0.7068310454245282, 'edge_cap': 0.9712614092211359, 'bull_strategy': 'mean_reversion', 'bull_bb_std_mult': 1.9014042572220546, 'bull_rsi_os': 13, 'bull_rsi_ob': 72, 'bull_adx_thresh': 9.497648019826135, 'bull_atr_min_pct': 0.006949507382981073, 'bull_atr_max_pct': 0.043678166674179994, 'bull_tp_mult': 1.6462193953816462, 'bull_tsl_mult': 0.9206600903715219, 'bull_time_stop': 124, 'bull_use_sma': False, 'bull_use_ema': False, 'bull_use_atr': False, 'bull_use_adx': False, 'bull_use_spike': True, 'bull_rsi_required': False, 'bear_strategy': 'mean_reversion', 'bear_bb_std_mult': 1.384700726593028, 'bear_rsi_os': 16, 'bear_rsi_ob': 86, 'bear_adx_thresh': 11.10773820983311, 'bear_atr_min_pct': 0.02312063786036328, 'bear_atr_max_pct': 0.09269144810297548, 'bear_tp_mult': 2.7089628340462184, 'bear_tsl_mult': 0.9375710948416374, 'bear_time_stop': 153, 'bear_use_sma': False, 'bear_use_ema': True, 'bear_use_atr': True, 'bear_use_adx': True, 'bear_use_spike': True, 'bear_rsi_required': True, 'sideways_strategy': 'breakout', 'sideways_bb_std_mult': 1.0936815805625022, 'sideways_rsi_os': 26, 'sideways_rsi_ob': 79, 'sideways_adx_thresh': 11.93026627416465, 'sideways_atr_min_pct': 0.013494579926145195, 'sideways_atr_max_pct': 0.11413021470750505, 'sideways_tp_mult': 1.991583356325979, 'sideways_tsl_mult': 0.6157451970666192, 'sideways_time_stop': 54, 'sideways_use_sma': True, 'sideways_use_ema': False, 'sideways_use_atr': False, 'sideways_use_adx': True, 'sideways_use_spike': True, 'sideways_rsi_required': False}.
