[I 2025-08-31 04:40:51,904] Trial 426 finished with values: [-1000000000.0, 1000000000.0] and parameters: {'p_sma': 43, 'p_std': 22, 'p_atr': 9, 'p_adx': 24, 'rsi_period': 24, 'ema1': 12, 'ema2': 27, 'slip_atr_k': 0.01560643071919415, 'slip_spread_k': 0.36371072673864424, 'spread_hl_frac': 0.015518361290122414, 'bb_std_mult': 2.6433925986581146, 'rsi_os': 13, 'rsi_ob': 61, 'vol_spike': 0.22674130710197182, 'adx_thresh': 10.472268701503866, 'atr_min_pct': 0.016894785897902397, 'atr_max_pct': 0.1287028688802851, 'tp_mult': 2.608552924704704, 'tsl_mult': 0.915547022105582, 'strategy': 'mean_reversion', 'time_stop': 74, 'use_sma': False, 'use_atr': False, 'use_adx': False, 'use_ema': False, 'use_spike': True, 'rsi_required': False, 'edge_k': 1.5329952399153426, 'edge_cap': 0.9858567141315812, 'bull_strategy': 'mean_reversion', 'bull_bb_std_mult': 3.4279760608798138, 'bull_rsi_os': 13, 'bull_rsi_ob': 72, 'bull_adx_thresh': 7.8900690868944015, 'bull_atr_min_pct': 0.004194348237475271, 'bull_atr_max_pct': 0.01655907666804285, 'bull_tp_mult': 1.5490059749711547, 'bull_tsl_mult': 0.8524393071875783, 'bull_time_stop': 132, 'bull_use_sma': False, 'bull_use_ema': True, 'bull_use_atr': True, 'bull_use_adx': True, 'bull_use_spike': False, 'bull_rsi_required': False, 'bear_strategy': 'mean_reversion', 'bear_bb_std_mult': 0.7425964628339743, 'bear_rsi_os': 10, 'bear_rsi_ob': 80, 'bear_adx_thresh': 24.9561678713264, 'bear_atr_min_pct': 0.02372004297181337, 'bear_atr_max_pct': 0.04750870286284866, 'bear_tp_mult': 1.6555291843008684, 'bear_tsl_mult': 0.017430550971161918, 'bear_time_stop': 192, 'bear_use_sma': True, 'bear_use_ema': False, 'bear_use_atr': False, 'bear_use_adx': True, 'bear_use_spike': False, 'bear_rsi_required': True, 'sideways_strategy': 'breakout', 'sideways_bb_std_mult': 1.1177325038630166, 'sideways_rsi_os': 51, 'sideways_rsi_ob': 55, 'sideways_adx_thresh': 16.17946320331859, 'sideways_atr_min_pct': 0.021493242238014677, 'sideways_atr_max_pct': 0.13550133233851486, 'sideways_tp_mult': 1.9472935041440749, 'sideways_tsl_mult': 0.6226803789688377, 'sideways_time_stop': 23, 'sideways_use_sma': False, 'sideways_use_ema': False, 'sideways_use_atr': False, 'sideways_use_adx': True, 'sideways_use_spike': True, 'sideways_rsi_required': True}.
[I 2025-08-31 04:40:52,164] Trial 424 finished with values: [-1000000000.0, 1000000000.0] and parameters: {'p_sma': 44, 'p_std': 19, 'p_atr': 25, 'p_adx': 8, 'rsi_period': 22, 'ema1': 14, 'ema2': 10, 'slip_atr_k': 0.016166214871210477, 'slip_spread_k': 0.3614394824905838, 'spread_hl_frac': 0.015966484034177938, 'bb_std_mult': 2.6857509707198246, 'rsi_os': 31, 'rsi_ob': 59, 'vol_spike': 0.02960500334219235, 'adx_thresh': 10.662383915116983, 'atr_min_pct': 0.01643245556250708, 'atr_max_pct': 0.12762304547249384, 'tp_mult': 1.2437818376354692, 'tsl_mult': 0.9385845290845313, 'strategy': 'breakout', 'time_stop': 52, 'use_sma': True, 'use_atr': False, 'use_adx': False, 'use_ema': False, 'use_spike': True, 'rsi_required': False, 'edge_k': 1.1551985516144418, 'edge_cap': 0.9997175032943041, 'bull_strategy': 'breakout', 'bull_bb_std_mult': 3.4086595251896363, 'bull_rsi_os': 13, 'bull_rsi_ob': 75, 'bull_adx_thresh': 11.176212180813161, 'bull_atr_min_pct': 0.0016908462045076397, 'bull_atr_max_pct': 0.04500990330610045, 'bull_tp_mult': 1.5560146093869116, 'bull_tsl_mult': 0.13152195458892774, 'bull_time_stop': 133, 'bull_use_sma': False, 'bull_use_ema': True, 'bull_use_atr': True, 'bull_use_adx': True, 'bull_use_spike': False, 'bull_rsi_required': True, 'bear_strategy': 'mean_reversion', 'bear_bb_std_mult': 1.4697029350309654, 'bear_rsi_os': 18, 'bear_rsi_ob': 77, 'bear_adx_thresh': 19.878543843446387, 'bear_atr_min_pct': 0.02619080752879655, 'bear_atr_max_pct': 0.04898312913246688, 'bear_tp_mult': 1.2647872314523578, 'bear_tsl_mult': 0.2409654217738465, 'bear_time_stop': 40, 'bear_use_sma': True, 'bear_use_ema': False, 'bear_use_atr': True, 'bear_use_adx': False, 'bear_use_spike': False, 'bear_rsi_required': True, 'sideways_strategy': 'mean_reversion', 'sideways_bb_std_mult': 3.222499887067444, 'sideways_rsi_os': 30, 'sideways_rsi_ob': 55, 'sideways_adx_thresh': 11.13129952687716, 'sideways_atr_min_pct': 0.02134307561067793, 'sideways_atr_max_pct': 0.11673558170477356, 'sideways_tp_mult': 1.360699234533256, 'sideways_tsl_mult': 0.7405329292949103, 'sideways_time_stop': 63, 'sideways_use_sma': False, 'sideways_use_ema': False, 'sideways_use_atr': False, 'sideways_use_adx': True, 'sideways_use_spike': True, 'sideways_rsi_required': True}.
[I 2025-08-31 04:40:52,491] Trial 425 finished with values: [-1000000000.0, 1000000000.0] and parameters: {'p_sma': 40, 'p_std': 39, 'p_atr': 25, 'p_adx': 8, 'rsi_period': 22, 'ema1': 12, 'ema2': 10, 'slip_atr_k': 0.014839704239654732, 'slip_spread_k': 0.36201606595364666, 'spread_hl_frac': 0.010299406423639468, 'bb_std_mult': 2.039736349696217, 'rsi_os': 31, 'rsi_ob': 59, 'vol_spike': 0.031039640123759323, 'adx_thresh': 10.68747546558426, 'atr_min_pct': 0.023021794655547222, 'atr_max_pct': 0.1278715588610512, 'tp_mult': 2.6283894687683267, 'tsl_mult': 0.9075878777073799, 'strategy': 'breakout', 'time_stop': 30, 'use_sma': True, 'use_atr': False, 'use_adx': False, 'use_ema': False, 'use_spike': True, 'rsi_required': False, 'edge_k': 1.535597009641135, 'edge_cap': 0.998030982574876, 'bull_strategy': 'breakout', 'bull_bb_std_mult': 1.3254113650201225, 'bull_rsi_os': 27, 'bull_rsi_ob': 75, 'bull_adx_thresh': 18.187784797255922, 'bull_atr_min_pct': 0.02769746048256381, 'bull_atr_max_pct': 0.04389649398170824, 'bull_tp_mult': 1.7644858570142308, 'bull_tsl_mult': 0.5055955270101173, 'bull_time_stop': 129, 'bull_use_sma': False, 'bull_use_ema': True, 'bull_use_atr': True, 'bull_use_adx': True, 'bull_use_spike': False, 'bull_rsi_required': True, 'bear_strategy': 'mean_reversion', 'bear_bb_std_mult': 0.76407113823884, 'bear_rsi_os': 18, 'bear_rsi_ob': 85, 'bear_adx_thresh': 19.87527225108534, 'bear_atr_min_pct': 0.026312101432667812, 'bear_atr_max_pct': 0.038905693936443296, 'bear_tp_mult': 2.627525700342246, 'bear_tsl_mult': 0.5410356113761707, 'bear_time_stop': 190, 'bear_use_sma': True, 'bear_use_ema': False, 'bear_use_atr': True, 'bear_use_adx': False, 'bear_use_spike': False, 'bear_rsi_required': True, 'sideways_strategy': 'mean_reversion', 'sideways_bb_std_mult': 2.4245727146854623, 'sideways_rsi_os': 30, 'sideways_rsi_ob': 88, 'sideways_adx_thresh': 10.115420830933035, 'sideways_atr_min_pct': 0.014360089508912927, 'sideways_atr_max_pct': 0.13510184086286203, 'sideways_tp_mult': 1.3439243470554099, 'sideways_tsl_mult': 0.6219866334571589, 'sideways_time_stop': 158, 'sideways_use_sma': False, 'sideways_use_ema': False, 'sideways_use_atr': False, 'sideways_use_adx': True, 'sideways_use_spike': True, 'sideways_rsi_required': True}.
[I 2025-08-31 04:40:52,596] Trial 423 finished with values: [-1000000000.0, 1000000000.0] and parameters: {'p_sma': 32, 'p_std': 19, 'p_atr': 24, 'p_adx': 24, 'rsi_period': 22, 'ema1': 15, 'ema2': 27, 'slip_atr_k': 0.08359669350397388, 'slip_spread_k': 0.09751369251197634, 'spread_hl_frac': 0.015327660301529962, 'bb_std_mult': 2.6291475507392335, 'rsi_os': 13, 'rsi_ob': 59, 'vol_spike': 0.2998915932562736, 'adx_thresh': 10.604235958529454, 'atr_min_pct': 0.0165424671424016, 'atr_max_pct': 0.12857754131141563, 'tp_mult': 2.5216572061000293, 'tsl_mult': 0.8938078762847592, 'strategy': 'mean_reversion', 'time_stop': 225, 'use_sma': True, 'use_atr': True, 'use_adx': True, 'use_ema': False, 'use_spike': True, 'rsi_required': False, 'edge_k': 0.2776723028116824, 'edge_cap': 0.7965337121725928, 'bull_strategy': 'breakout', 'bull_bb_std_mult': 1.9806267178606907, 'bull_rsi_os': 17, 'bull_rsi_ob': 76, 'bull_adx_thresh': 26.939582982130567, 'bull_atr_min_pct': 0.0013503909965831176, 'bull_atr_max_pct': 0.07403179485425584, 'bull_tp_mult': 2.377907924042505, 'bull_tsl_mult': 0.9116713812483905, 'bull_time_stop': 130, 'bull_use_sma': True, 'bull_use_ema': True, 'bull_use_atr': False, 'bull_use_adx': False, 'bull_use_spike': False, 'bull_rsi_required': True, 'bear_strategy': 'mean_reversion', 'bear_bb_std_mult': 1.076585847219238, 'bear_rsi_os': 8, 'bear_rsi_ob': 46, 'bear_adx_thresh': 20.03428197595972, 'bear_atr_min_pct': 0.023089701636792352, 'bear_atr_max_pct': 0.03515137457028645, 'bear_tp_mult': 2.6402839242335183, 'bear_tsl_mult': 0.24293904871999333, 'bear_time_stop': 191, 'bear_use_sma': False, 'bear_use_ema': False, 'bear_use_atr': False, 'bear_use_adx': False, 'bear_use_spike': False, 'bear_rsi_required': True, 'sideways_strategy': 'breakout', 'sideways_bb_std_mult': 1.0774109863861185, 'sideways_rsi_os': 24, 'sideways_rsi_ob': 88, 'sideways_adx_thresh': 13.504035443260463, 'sideways_atr_min_pct': 0.02739833500145554, 'sideways_atr_max_pct': 0.13584308095401676, 'sideways_tp_mult': 1.9859053047345692, 'sideways_tsl_mult': 0.8458647628557019, 'sideways_time_stop': 218, 'sideways_use_sma': False, 'sideways_use_ema': True, 'sideways_use_atr': True, 'sideways_use_adx': False, 'sideways_use_spike': False, 'sideways_rsi_required': False}.
[I 2025-08-31 04:41:46,440] Trial 430 finished with values: [-1000000000.0, 1000000000.0] and parameters: {'p_sma': 37, 'p_std': 45, 'p_atr': 24, 'p_adx': 9, 'rsi_period': 18, 'ema1': 14, 'ema2': 25, 'slip_atr_k': 0.028605320953033572, 'slip_spread_k': 0.06888444275576418, 'spread_hl_frac': 0.008453230503163595, 'bb_std_mult': 1.6762051625560506, 'rsi_os': 37, 'rsi_ob': 47, 'vol_spike': 0.195135639276493, 'adx_thresh': 11.772653883119187, 'atr_min_pct': 0.007529220277977147, 'atr_max_pct': 0.1241719751677919, 'tp_mult': 2.447922107641834, 'tsl_mult': 0.8412316579819741, 'strategy': 'breakout', 'time_stop': 33, 'use_sma': False, 'use_atr': False, 'use_adx': False, 'use_ema': True, 'use_spike': False, 'rsi_required': False, 'edge_k': 0.95218264774991, 'edge_cap': 0.7334269878135807, 'bull_strategy': 'mean_reversion', 'bull_bb_std_mult': 2.688521456758952, 'bull_rsi_os': 41, 'bull_rsi_ob': 77, 'bull_adx_thresh': 12.533240838363378, 'bull_atr_min_pct': 0.01984907541215824, 'bull_atr_max_pct': 0.05246295313910687, 'bull_tp_mult': 1.670494852747638, 'bull_tsl_mult': 0.0540603900687216, 'bull_time_stop': 196, 'bull_use_sma': False, 'bull_use_ema': False, 'bull_use_atr': True, 'bull_use_adx': True, 'bull_use_spike': True, 'bull_rsi_required': False, 'bear_strategy': 'breakout', 'bear_bb_std_mult': 0.8520737283073211, 'bear_rsi_os': 25, 'bear_rsi_ob': 45, 'bear_adx_thresh': 34.48796925883951, 'bear_atr_min_pct': 0.02397664684203481, 'bear_atr_max_pct': 0.08715439522569902, 'bear_tp_mult': 2.1648269548130052, 'bear_tsl_mult': 0.1695834045786902, 'bear_time_stop': 277, 'bear_use_sma': True, 'bear_use_ema': True, 'bear_use_atr': True, 'bear_use_adx': True, 'bear_use_spike': True, 'bear_rsi_required': False, 'sideways_strategy': 'mean_reversion', 'sideways_bb_std_mult': 3.4586161447426917, 'sideways_rsi_os': 25, 'sideways_rsi_ob': 51, 'sideways_adx_thresh': 12.34430532239069, 'sideways_atr_min_pct': 0.029085438246183058, 'sideways_atr_max_pct': 0.049929742344357944, 'sideways_tp_mult': 1.557973925620653, 'sideways_tsl_mult': 0.6855951567035179, 'sideways_time_stop': 81, 'sideways_use_sma': False, 'sideways_use_ema': False, 'sideways_use_atr': False, 'sideways_use_adx': True, 'sideways_use_spike': True, 'sideways_rsi_required': True}.
[I 2025-08-31 04:41:46,796] Trial 428 finished with values: [-1000000000.0, 1000000000.0] and parameters: {'p_sma': 32, 'p_std': 27, 'p_atr': 24, 'p_adx': 22, 'rsi_period': 77, 'ema1': 5, 'ema2': 27, 'slip_atr_k': 0.02852476930032941, 'slip_spread_k': 0.8771477372938103, 'spread_hl_frac': 0.010285234677442188, 'bb_std_mult': 2.032135866268091, 'rsi_os': 30, 'rsi_ob': 61, 'vol_spike': 0.09468436597979649, 'adx_thresh': 12.37742800119235, 'atr_min_pct': 0.02324743471267156, 'atr_max_pct': 0.12446581933304997, 'tp_mult': 2.451875945001414, 'tsl_mult': 0.8445043666886722, 'strategy': 'breakout', 'time_stop': 28, 'use_sma': False, 'use_atr': False, 'use_adx': False, 'use_ema': True, 'use_spike': False, 'rsi_required': False, 'edge_k': 1.421179038918027, 'edge_cap': 0.9537642655728914, 'bull_strategy': 'mean_reversion', 'bull_bb_std_mult': 1.59406322681779, 'bull_rsi_os': 30, 'bull_rsi_ob': 77, 'bull_adx_thresh': 26.856584246559652, 'bull_atr_min_pct': 0.027731801490961563, 'bull_atr_max_pct': 0.02296915048826869, 'bull_tp_mult': 1.6679278143832506, 'bull_tsl_mult': 0.7159745484487849, 'bull_time_stop': 147, 'bull_use_sma': False, 'bull_use_ema': False, 'bull_use_atr': True, 'bull_use_adx': True, 'bull_use_spike': True, 'bull_rsi_required': True, 'bear_strategy': 'breakout', 'bear_bb_std_mult': 0.8453573502106143, 'bear_rsi_os': 24, 'bear_rsi_ob': 45, 'bear_adx_thresh': 20.54229327884539, 'bear_atr_min_pct': 0.02293390654839791, 'bear_atr_max_pct': 0.06800505940506509, 'bear_tp_mult': 2.868908880034767, 'bear_tsl_mult': 0.12629755446422064, 'bear_time_stop': 56, 'bear_use_sma': True, 'bear_use_ema': True, 'bear_use_atr': True, 'bear_use_adx': True, 'bear_use_spike': True, 'bear_rsi_required': False, 'sideways_strategy': 'mean_reversion', 'sideways_bb_std_mult': 0.9406600532583774, 'sideways_rsi_os': 25, 'sideways_rsi_ob': 56, 'sideways_adx_thresh': 12.664312176770293, 'sideways_atr_min_pct': 0.010385623705496186, 'sideways_atr_max_pct': 0.1233087723042538, 'sideways_tp_mult': 2.1042637097795223, 'sideways_tsl_mult': 0.8545887738683771, 'sideways_time_stop': 157, 'sideways_use_sma': False, 'sideways_use_ema': False, 'sideways_use_atr': False, 'sideways_use_adx': True, 'sideways_use_spike': True, 'sideways_rsi_required': True}.
[I 2025-08-31 04:41:46,804] Trial 429 finished with values: [-1000000000.0, 1000000000.0] and parameters: {'p_sma': 57, 'p_std': 13, 'p_atr': 24, 'p_adx': 9, 'rsi_period': 39, 'ema1': 14, 'ema2': 25, 'slip_atr_k': 0.06188480521180535, 'slip_spread_k': 0.8766524597053853, 'spread_hl_frac': 0.007513210322394888, 'bb_std_mult': 1.545448755030955, 'rsi_os': 11, 'rsi_ob': 71, 'vol_spike': 0.019743375414564196, 'adx_thresh': 12.20113453299557, 'atr_min_pct': 0.024079969597042308, 'atr_max_pct': 0.12383099685125687, 'tp_mult': 2.4333309584014793, 'tsl_mult': 0.8432050326765734, 'strategy': 'breakout', 'time_stop': 34, 'use_sma': False, 'use_atr': False, 'use_adx': False, 'use_ema': True, 'use_spike': False, 'rsi_required': False, 'edge_k': 0.7759202957204627, 'edge_cap': 0.7463927774172554, 'bull_strategy': 'mean_reversion', 'bull_bb_std_mult': 2.252267857057421, 'bull_rsi_os': 37, 'bull_rsi_ob': 77, 'bull_adx_thresh': 34.012956446852286, 'bull_atr_min_pct': 0.020125882040003706, 'bull_atr_max_pct': 0.057773390471538386, 'bull_tp_mult': 1.6650241374551078, 'bull_tsl_mult': 0.20842138155154166, 'bull_time_stop': 148, 'bull_use_sma': False, 'bull_use_ema': False, 'bull_use_atr': True, 'bull_use_adx': True, 'bull_use_spike': True, 'bull_rsi_required': False, 'bear_strategy': 'breakout', 'bear_bb_std_mult': 0.8384962861990611, 'bear_rsi_os': 25, 'bear_rsi_ob': 45, 'bear_adx_thresh': 20.455700505383543, 'bear_atr_min_pct': 0.02402165430567657, 'bear_atr_max_pct': 0.042566421650559495, 'bear_tp_mult': 1.0202246174659138, 'bear_tsl_mult': 0.1278508655559935, 'bear_time_stop': 210, 'bear_use_sma': True, 'bear_use_ema': True, 'bear_use_atr': True, 'bear_use_adx': True, 'bear_use_spike': True, 'bear_rsi_required': False, 'sideways_strategy': 'mean_reversion', 'sideways_bb_std_mult': 0.94351208822865, 'sideways_rsi_os': 45, 'sideways_rsi_ob': 65, 'sideways_adx_thresh': 12.490568219124683, 'sideways_atr_min_pct': 0.023452727911386223, 'sideways_atr_max_pct': 0.12122433356153313, 'sideways_tp_mult': 1.5510653115320623, 'sideways_tsl_mult': 0.676637676956745, 'sideways_time_stop': 74, 'sideways_use_sma': False, 'sideways_use_ema': False, 'sideways_use_atr': False, 'sideways_use_adx': True, 'sideways_use_spike': True, 'sideways_rsi_required': True}.
[I 2025-08-31 04:41:47,031] Trial 427 finished with values: [-1000000000.0, 1000000000.0] and parameters: {'p_sma': 32, 'p_std': 12, 'p_atr': 25, 'p_adx': 8, 'rsi_period': 77, 'ema1': 14, 'ema2': 25, 'slip_atr_k': 0.02678817344993182, 'slip_spread_k': 0.8890853993606282, 'spread_hl_frac': 0.007969476476406254, 'bb_std_mult': 2.2288622404036773, 'rsi_os': 11, 'rsi_ob': 71, 'vol_spike': 0.03010307911476964, 'adx_thresh': 12.369240224845749, 'atr_min_pct': 0.007465034860301336, 'atr_max_pct': 0.12461266887445865, 'tp_mult': 2.4503796266317064, 'tsl_mult': 0.06903834194580827, 'strategy': 'breakout', 'time_stop': 29, 'use_sma': False, 'use_atr': False, 'use_adx': False, 'use_ema': True, 'use_spike': False, 'rsi_required': False, 'edge_k': 0.7711229480499922, 'edge_cap': 0.9987635500302948, 'bull_strategy': 'mean_reversion', 'bull_bb_std_mult': 2.260498314286957, 'bull_rsi_os': 30, 'bull_rsi_ob': 77, 'bull_adx_thresh': 12.689519498268297, 'bull_atr_min_pct': 0.0279596454892916, 'bull_atr_max_pct': 0.04301497300562941, 'bull_tp_mult': 1.6783992172178719, 'bull_tsl_mult': 0.8986325925709876, 'bull_time_stop': 150, 'bull_use_sma': False, 'bull_use_ema': False, 'bull_use_atr': True, 'bull_use_adx': True, 'bull_use_spike': True, 'bull_rsi_required': True, 'bear_strategy': 'mean_reversion', 'bear_bb_std_mult': 0.847727125645615, 'bear_rsi_os': 25, 'bear_rsi_ob': 45, 'bear_adx_thresh': 19.68224788045693, 'bear_atr_min_pct': 0.02406584027551129, 'bear_atr_max_pct': 0.0220698418535726, 'bear_tp_mult': 2.167345975118651, 'bear_tsl_mult': 0.2382972945606938, 'bear_time_stop': 64, 'bear_use_sma': True, 'bear_use_ema': True, 'bear_use_atr': True, 'bear_use_adx': True, 'bear_use_spike': True, 'bear_rsi_required': False, 'sideways_strategy': 'mean_reversion', 'sideways_bb_std_mult': 1.0017063229862473, 'sideways_rsi_os': 25, 'sideways_rsi_ob': 54, 'sideways_adx_thresh': 12.443396331852748, 'sideways_atr_min_pct': 0.029118439092710346, 'sideways_atr_max_pct': 0.09219114219987887, 'sideways_tp_mult': 2.34751318604897, 'sideways_tsl_mult': 0.20641966929485167, 'sideways_time_stop': 158, 'sideways_use_sma': False, 'sideways_use_ema': False, 'sideways_use_atr': False, 'sideways_use_adx': True, 'sideways_use_spike': True, 'sideways_rsi_required': True}.
[I 2025-08-31 04:42:36,341] Trial 434 finished with values: [-1000000000.0, 1000000000.0] and parameters: {'p_sma': 16, 'p_std': 17, 'p_atr': 21, 'p_adx': 9, 'rsi_period': 24, 'ema1': 13, 'ema2': 28, 'slip_atr_k': 0.1008618377176876, 'slip_spread_k': 0.029560994244529293, 'spread_hl_frac': 0.005454454580580037, 'bb_std_mult': 0.8705742939188916, 'rsi_os': 29, 'rsi_ob': 92, 'vol_spike': 0.05019020053874115, 'adx_thresh': 11.601470815396098, 'atr_min_pct': 0.022099936595119846, 'atr_max_pct': 0.1210141742894929, 'tp_mult': 2.4951546681812307, 'tsl_mult': 0.8872580604490427, 'strategy': 'mean_reversion', 'time_stop': 54, 'use_sma': False, 'use_atr': False, 'use_adx': False, 'use_ema': False, 'use_spike': True, 'rsi_required': True, 'edge_k': 1.374864881013249, 'edge_cap': 0.9634600436656564, 'bull_strategy': 'mean_reversion', 'bull_bb_std_mult': 3.527249478625385, 'bull_rsi_os': 9, 'bull_rsi_ob': 80, 'bull_adx_thresh': 13.947762946328108, 'bull_atr_min_pct': 0.012545155703053161, 'bull_atr_max_pct': 0.03984955531417319, 'bull_tp_mult': 1.6119875096608414, 'bull_tsl_mult': 0.9745501422391317, 'bull_time_stop': 138, 'bull_use_sma': False, 'bull_use_ema': False, 'bull_use_atr': True, 'bull_use_adx': True, 'bull_use_spike': False, 'bull_rsi_required': True, 'bear_strategy': 'mean_reversion', 'bear_bb_std_mult': 1.6051840773043415, 'bear_rsi_os': 47, 'bear_rsi_ob': 50, 'bear_adx_thresh': 13.093456707723508, 'bear_atr_min_pct': 0.022400601339367263, 'bear_atr_max_pct': 0.04330503678071709, 'bear_tp_mult': 2.8034399463441533, 'bear_tsl_mult': 0.6284313756379324, 'bear_time_stop': 179, 'bear_use_sma': True, 'bear_use_ema': True, 'bear_use_atr': False, 'bear_use_adx': True, 'bear_use_spike': True, 'bear_rsi_required': True, 'sideways_strategy': 'breakout', 'sideways_bb_std_mult': 1.5800376901994375, 'sideways_rsi_os': 28, 'sideways_rsi_ob': 52, 'sideways_adx_thresh': 27.750206306944804, 'sideways_atr_min_pct': 0.01285085149984121, 'sideways_atr_max_pct': 0.10681991560106183, 'sideways_tp_mult': 2.0516250039790793, 'sideways_tsl_mult': 0.5789208026332011, 'sideways_time_stop': 45, 'sideways_use_sma': True, 'sideways_use_ema': False, 'sideways_use_atr': False, 'sideways_use_adx': True, 'sideways_use_spike': True, 'sideways_rsi_required': True}.
