[I 2025-08-31 05:48:57,346] Trial 801 finished with values: [-0.009594198875720217, 0.009546783787184291] and parameters: {'p_sma': 56, 'p_std': 38, 'p_atr': 13, 'p_adx': 26, 'rsi_period': 15, 'ema1': 20, 'ema2': 11, 'slip_atr_k': 0.003541706399337421, 'slip_spread_k': 0.717602730111508, 'spread_hl_frac': 0.003930623781330321, 'bb_std_mult': 3.0709969870940945, 'rsi_os': 36, 'rsi_ob': 69, 'vol_spike': 0.11026231740021505, 'adx_thresh': 16.596053441189405, 'atr_min_pct': 0.01352536527249283, 'atr_max_pct': 0.03712136311775967, 'tp_mult': 2.5680721121654333, 'tsl_mult': 0.20256890081910955, 'strategy': 'mean_reversion', 'time_stop': 20, 'use_sma': True, 'use_atr': True, 'use_adx': False, 'use_ema': False, 'use_spike': True, 'rsi_required': True, 'edge_k': 0.9186256896767477, 'edge_cap': 0.37204656237758965, 'bull_strategy': 'mean_reversion', 'bull_bb_std_mult': 1.1765547764973985, 'bull_rsi_os': 31, 'bull_rsi_ob': 86, 'bull_adx_thresh': 19.625795156848334, 'bull_atr_min_pct': 0.015758251483198597, 'bull_atr_max_pct': 0.07854878868887366, 'bull_tp_mult': 2.840726824831022, 'bull_tsl_mult': 0.79949596519032, 'bull_time_stop': 180, 'bull_use_sma': False, 'bull_use_ema': False, 'bull_use_atr': True, 'bull_use_adx': False, 'bull_use_spike': False, 'bull_rsi_required': False, 'bear_strategy': 'breakout', 'bear_bb_std_mult': 2.087800883785715, 'bear_rsi_os': 8, 'bear_rsi_ob': 70, 'bear_adx_thresh': 18.44196303496043, 'bear_atr_min_pct': 0.006798818621085337, 'bear_atr_max_pct': 0.13752175605658049, 'bear_tp_mult': 1.093824936100821, 'bear_tsl_mult': 0.1724442088946743, 'bear_time_stop': 18, 'bear_use_sma': False, 'bear_use_ema': True, 'bear_use_atr': True, 'bear_use_adx': False, 'bear_use_spike': False, 'bear_rsi_required': True, 'sideways_strategy': 'breakout', 'sideways_bb_std_mult': 1.2524153400650977, 'sideways_rsi_os': 38, 'sideways_rsi_ob': 46, 'sideways_adx_thresh': 24.6073584782072, 'sideways_atr_min_pct': 0.0023250409679754103, 'sideways_atr_max_pct': 0.06523158927406884, 'sideways_tp_mult': 2.5828317299806964, 'sideways_tsl_mult': 0.8863261595387886, 'sideways_time_stop': 190, 'sideways_use_sma': False, 'sideways_use_ema': True, 'sideways_use_atr': False, 'sideways_use_adx': False, 'sideways_use_spike': True, 'sideways_rsi_required': False}.
[I 2025-08-31 05:48:57,857] Trial 803 finished with values: [-0.03893589355168603, 0.03887519971975584] and parameters: {'p_sma': 34, 'p_std': 44, 'p_atr': 12, 'p_adx': 26, 'rsi_period': 14, 'ema1': 18, 'ema2': 19, 'slip_atr_k': 0.0011764488964720182, 'slip_spread_k': 0.7895450400207624, 'spread_hl_frac': 0.0041122163569438505, 'bb_std_mult': 3.3366742250582373, 'rsi_os': 47, 'rsi_ob': 69, 'vol_spike': 0.07968987513836184, 'adx_thresh': 7.5140117013416425, 'atr_min_pct': 0.011344490595304223, 'atr_max_pct': 0.11291620607965468, 'tp_mult': 2.060930513855076, 'tsl_mult': 0.3557423123578808, 'strategy': 'mean_reversion', 'time_stop': 6, 'use_sma': True, 'use_atr': True, 'use_adx': False, 'use_ema': False, 'use_spike': True, 'rsi_required': True, 'edge_k': 0.9058507996823605, 'edge_cap': 0.3281627760345928, 'bull_strategy': 'breakout', 'bull_bb_std_mult': 1.5333699032739738, 'bull_rsi_os': 29, 'bull_rsi_ob': 70, 'bull_adx_thresh': 33.63274470450929, 'bull_atr_min_pct': 0.018767104588368194, 'bull_atr_max_pct': 0.09127000717628535, 'bull_tp_mult': 1.4835408185516152, 'bull_tsl_mult': 0.7444335530111116, 'bull_time_stop': 181, 'bull_use_sma': False, 'bull_use_ema': True, 'bull_use_atr': False, 'bull_use_adx': False, 'bull_use_spike': False, 'bull_rsi_required': False, 'bear_strategy': 'breakout', 'bear_bb_std_mult': 2.2980324668587135, 'bear_rsi_os': 8, 'bear_rsi_ob': 63, 'bear_adx_thresh': 15.59140769569593, 'bear_atr_min_pct': 0.0015754371339176104, 'bear_atr_max_pct': 0.11490331970808086, 'bear_tp_mult': 1.1211130999895136, 'bear_tsl_mult': 0.10474661948504468, 'bear_time_stop': 240, 'bear_use_sma': False, 'bear_use_ema': False, 'bear_use_atr': True, 'bear_use_adx': False, 'bear_use_spike': False, 'bear_rsi_required': False, 'sideways_strategy': 'breakout', 'sideways_bb_std_mult': 1.500506778429008, 'sideways_rsi_os': 38, 'sideways_rsi_ob': 46, 'sideways_adx_thresh': 24.03033616370934, 'sideways_atr_min_pct': 0.000581061228926744, 'sideways_atr_max_pct': 0.059503994993827566, 'sideways_tp_mult': 2.515083994187546, 'sideways_tsl_mult': 0.3522169672067572, 'sideways_time_stop': 162, 'sideways_use_sma': True, 'sideways_use_ema': True, 'sideways_use_atr': False, 'sideways_use_adx': False, 'sideways_use_spike': True, 'sideways_rsi_required': False}.
[I 2025-08-31 05:48:58,323] Trial 802 finished with values: [-1000000000.0, 1000000000.0] and parameters: {'p_sma': 7, 'p_std': 44, 'p_atr': 13, 'p_adx': 25, 'rsi_period': 15, 'ema1': 18, 'ema2': 21, 'slip_atr_k': 0.0038619567289073344, 'slip_spread_k': 0.7178322849440019, 'spread_hl_frac': 0.006121533724393943, 'bb_std_mult': 3.0597727460885435, 'rsi_os': 36, 'rsi_ob': 69, 'vol_spike': 0.1113614982826785, 'adx_thresh': 8.769144038358192, 'atr_min_pct': 0.013531119645627384, 'atr_max_pct': 0.11360558451752732, 'tp_mult': 2.586323682588512, 'tsl_mult': 0.388990876220223, 'strategy': 'mean_reversion', 'time_stop': 20, 'use_sma': True, 'use_atr': True, 'use_adx': False, 'use_ema': False, 'use_spike': True, 'rsi_required': True, 'edge_k': 0.8989994271599759, 'edge_cap': 0.37140389422042147, 'bull_strategy': 'mean_reversion', 'bull_bb_std_mult': 1.582498415264674, 'bull_rsi_os': 27, 'bull_rsi_ob': 81, 'bull_adx_thresh': 8.030872395123781, 'bull_atr_min_pct': 0.01348828512446949, 'bull_atr_max_pct': 0.07897749641471098, 'bull_tp_mult': 2.8252063685861057, 'bull_tsl_mult': 0.8031920402820862, 'bull_time_stop': 224, 'bull_use_sma': False, 'bull_use_ema': False, 'bull_use_atr': True, 'bull_use_adx': False, 'bull_use_spike': False, 'bull_rsi_required': False, 'bear_strategy': 'breakout', 'bear_bb_std_mult': 2.0913412313431476, 'bear_rsi_os': 8, 'bear_rsi_ob': 63, 'bear_adx_thresh': 18.400114081966755, 'bear_atr_min_pct': 0.007018150336973919, 'bear_atr_max_pct': 0.04201519856348008, 'bear_tp_mult': 1.0100403394050665, 'bear_tsl_mult': 0.1774902667742128, 'bear_time_stop': 227, 'bear_use_sma': False, 'bear_use_ema': True, 'bear_use_atr': True, 'bear_use_adx': False, 'bear_use_spike': False, 'bear_rsi_required': True, 'sideways_strategy': 'breakout', 'sideways_bb_std_mult': 3.179504585450009, 'sideways_rsi_os': 38, 'sideways_rsi_ob': 46, 'sideways_adx_thresh': 24.44056393451062, 'sideways_atr_min_pct': 0.002223606089116523, 'sideways_atr_max_pct': 0.06346145043344083, 'sideways_tp_mult': 2.5144811452936846, 'sideways_tsl_mult': 0.47122905758838046, 'sideways_time_stop': 192, 'sideways_use_sma': False, 'sideways_use_ema': True, 'sideways_use_atr': False, 'sideways_use_adx': False, 'sideways_use_spike': True, 'sideways_rsi_required': False}.
[I 2025-08-31 05:49:47,748] Trial 807 finished with values: [-1000000000.0, 1000000000.0] and parameters: {'p_sma': 33, 'p_std': 43, 'p_atr': 12, 'p_adx': 25, 'rsi_period': 15, 'ema1': 17, 'ema2': 18, 'slip_atr_k': 0.000591024738374304, 'slip_spread_k': 0.7984422746857939, 'spread_hl_frac': 0.003390206198229547, 'bb_std_mult': 3.3660404716464507, 'rsi_os': 47, 'rsi_ob': 70, 'vol_spike': 0.076768709842784, 'adx_thresh': 6.187381699454876, 'atr_min_pct': 0.010775592180360435, 'atr_max_pct': 0.11106639566917068, 'tp_mult': 2.0120977144416954, 'tsl_mult': 0.43993355205580065, 'strategy': 'mean_reversion', 'time_stop': 6, 'use_sma': False, 'use_atr': True, 'use_adx': True, 'use_ema': True, 'use_spike': False, 'rsi_required': True, 'edge_k': 0.9216037776978832, 'edge_cap': 0.33069174251874867, 'bull_strategy': 'breakout', 'bull_bb_std_mult': 1.5200510484065415, 'bull_rsi_os': 31, 'bull_rsi_ob': 67, 'bull_adx_thresh': 31.4160998063291, 'bull_atr_min_pct': 0.019711928518269646, 'bull_atr_max_pct': 0.08931646948473249, 'bull_tp_mult': 1.4791950367808988, 'bull_tsl_mult': 0.7481198983341873, 'bull_time_stop': 177, 'bull_use_sma': True, 'bull_use_ema': True, 'bull_use_atr': False, 'bull_use_adx': True, 'bull_use_spike': True, 'bull_rsi_required': False, 'bear_strategy': 'breakout', 'bear_bb_std_mult': 2.261972433796196, 'bear_rsi_os': 7, 'bear_rsi_ob': 59, 'bear_adx_thresh': 15.310966004349899, 'bear_atr_min_pct': 0.0032210169401514863, 'bear_atr_max_pct': 0.12051421845369087, 'bear_tp_mult': 1.1216258223496556, 'bear_tsl_mult': 0.14728149136830054, 'bear_time_stop': 240, 'bear_use_sma': True, 'bear_use_ema': False, 'bear_use_atr': False, 'bear_use_adx': False, 'bear_use_spike': False, 'bear_rsi_required': False, 'sideways_strategy': 'breakout', 'sideways_bb_std_mult': 1.4829776095209422, 'sideways_rsi_os': 37, 'sideways_rsi_ob': 49, 'sideways_adx_thresh': 23.953742549840083, 'sideways_atr_min_pct': 0.005567463364927335, 'sideways_atr_max_pct': 0.0603791340914756, 'sideways_tp_mult': 2.5029203865702976, 'sideways_tsl_mult': 0.31002381833504133, 'sideways_time_stop': 169, 'sideways_use_sma': True, 'sideways_use_ema': True, 'sideways_use_atr': True, 'sideways_use_adx': False, 'sideways_use_spike': False, 'sideways_rsi_required': True}.
[I 2025-08-31 05:49:48,054] Trial 806 finished with values: [-0.0209033510983343, 0.020899600158170453] and parameters: {'p_sma': 33, 'p_std': 43, 'p_atr': 12, 'p_adx': 25, 'rsi_period': 15, 'ema1': 17, 'ema2': 18, 'slip_atr_k': 0.000218619057422696, 'slip_spread_k': 0.7917320940913444, 'spread_hl_frac': 0.0038317161898699693, 'bb_std_mult': 3.3664453796741554, 'rsi_os': 46, 'rsi_ob': 70, 'vol_spike': 0.07759086476853919, 'adx_thresh': 6.903899833917865, 'atr_min_pct': 0.010612898830952582, 'atr_max_pct': 0.11257474436781205, 'tp_mult': 2.008351699627032, 'tsl_mult': 0.39254030567755377, 'strategy': 'mean_reversion', 'time_stop': 7, 'use_sma': False, 'use_atr': True, 'use_adx': True, 'use_ema': True, 'use_spike': False, 'rsi_required': True, 'edge_k': 0.9201289806263531, 'edge_cap': 0.3335048191057827, 'bull_strategy': 'breakout', 'bull_bb_std_mult': 1.5207559427841775, 'bull_rsi_os': 31, 'bull_rsi_ob': 68, 'bull_adx_thresh': 31.514579873744268, 'bull_atr_min_pct': 0.01934877353110954, 'bull_atr_max_pct': 0.08953599796370114, 'bull_tp_mult': 1.4996981286607642, 'bull_tsl_mult': 0.7447968972957171, 'bull_time_stop': 178, 'bull_use_sma': True, 'bull_use_ema': True, 'bull_use_atr': False, 'bull_use_adx': True, 'bull_use_spike': True, 'bull_rsi_required': False, 'bear_strategy': 'breakout', 'bear_bb_std_mult': 2.2878278916857058, 'bear_rsi_os': 18, 'bear_rsi_ob': 61, 'bear_adx_thresh': 15.334523031246185, 'bear_atr_min_pct': 0.0021097256025593373, 'bear_atr_max_pct': 0.11862190429136907, 'bear_tp_mult': 1.120748545781933, 'bear_tsl_mult': 0.1490561128339687, 'bear_time_stop': 240, 'bear_use_sma': True, 'bear_use_ema': False, 'bear_use_atr': False, 'bear_use_adx': False, 'bear_use_spike': False, 'bear_rsi_required': False, 'sideways_strategy': 'breakout', 'sideways_bb_std_mult': 1.4524695225148199, 'sideways_rsi_os': 38, 'sideways_rsi_ob': 49, 'sideways_adx_thresh': 23.88385576110852, 'sideways_atr_min_pct': 0.0016029149464004341, 'sideways_atr_max_pct': 0.0636785286801724, 'sideways_tp_mult': 2.494162002943032, 'sideways_tsl_mult': 0.3377412171138552, 'sideways_time_stop': 166, 'sideways_use_sma': True, 'sideways_use_ema': True, 'sideways_use_atr': True, 'sideways_use_adx': False, 'sideways_use_spike': False, 'sideways_rsi_required': True}.
[I 2025-08-31 05:49:48,422] Trial 805 finished with values: [-0.03815098769388947, 0.03812107787557226] and parameters: {'p_sma': 34, 'p_std': 44, 'p_atr': 12, 'p_adx': 26, 'rsi_period': 15, 'ema1': 18, 'ema2': 18, 'slip_atr_k': 3.493185211539548e-05, 'slip_spread_k': 0.7892871753927849, 'spread_hl_frac': 0.0031754214513038084, 'bb_std_mult': 3.309742131364873, 'rsi_os': 47, 'rsi_ob': 69, 'vol_spike': 0.07856173833140313, 'adx_thresh': 6.855957611674041, 'atr_min_pct': 0.01149672158799653, 'atr_max_pct': 0.11170012217730595, 'tp_mult': 2.048586114923715, 'tsl_mult': 0.355998180981032, 'strategy': 'mean_reversion', 'time_stop': 5, 'use_sma': True, 'use_atr': True, 'use_adx': False, 'use_ema': False, 'use_spike': True, 'rsi_required': True, 'edge_k': 0.9091393617627719, 'edge_cap': 0.3230302103490579, 'bull_strategy': 'breakout', 'bull_bb_std_mult': 1.5258114519819936, 'bull_rsi_os': 33, 'bull_rsi_ob': 70, 'bull_adx_thresh': 33.740108596639786, 'bull_atr_min_pct': 0.018705373471716864, 'bull_atr_max_pct': 0.09002169708290086, 'bull_tp_mult': 1.4693930463983085, 'bull_tsl_mult': 0.7533506141983476, 'bull_time_stop': 180, 'bull_use_sma': False, 'bull_use_ema': True, 'bull_use_atr': False, 'bull_use_adx': False, 'bull_use_spike': False, 'bull_rsi_required': False, 'bear_strategy': 'breakout', 'bear_bb_std_mult': 2.235279291321789, 'bear_rsi_os': 8, 'bear_rsi_ob': 61, 'bear_adx_thresh': 15.502306112034727, 'bear_atr_min_pct': 0.0034173709148351632, 'bear_atr_max_pct': 0.11967463759316142, 'bear_tp_mult': 1.1161600473966755, 'bear_tsl_mult': 0.10346524382739106, 'bear_time_stop': 241, 'bear_use_sma': True, 'bear_use_ema': False, 'bear_use_atr': False, 'bear_use_adx': False, 'bear_use_spike': False, 'bear_rsi_required': False, 'sideways_strategy': 'breakout', 'sideways_bb_std_mult': 1.559883824582129, 'sideways_rsi_os': 37, 'sideways_rsi_ob': 49, 'sideways_adx_thresh': 23.481635422269967, 'sideways_atr_min_pct': 0.0005203277294606194, 'sideways_atr_max_pct': 0.06027356667392185, 'sideways_tp_mult': 2.492442847011672, 'sideways_tsl_mult': 0.3560215443377609, 'sideways_time_stop': 158, 'sideways_use_sma': True, 'sideways_use_ema': True, 'sideways_use_atr': False, 'sideways_use_adx': False, 'sideways_use_spike': True, 'sideways_rsi_required': False}.
[I 2025-08-31 05:49:48,887] Trial 804 finished with values: [-0.03835503568705989, 0.03832508847790035] and parameters: {'p_sma': 34, 'p_std': 44, 'p_atr': 12, 'p_adx': 26, 'rsi_period': 15, 'ema1': 18, 'ema2': 18, 'slip_atr_k': 0.00011024778824304381, 'slip_spread_k': 0.7895103962938735, 'spread_hl_frac': 0.003851332507121989, 'bb_std_mult': 3.3431525741364654, 'rsi_os': 48, 'rsi_ob': 69, 'vol_spike': 0.07888676680809023, 'adx_thresh': 7.803037022020185, 'atr_min_pct': 0.01172528542484565, 'atr_max_pct': 0.1111623403204518, 'tp_mult': 2.0140453015466493, 'tsl_mult': 0.3624444734357385, 'strategy': 'mean_reversion', 'time_stop': 6, 'use_sma': True, 'use_atr': True, 'use_adx': False, 'use_ema': False, 'use_spike': True, 'rsi_required': True, 'edge_k': 0.9120868017185901, 'edge_cap': 0.3258137302823736, 'bull_strategy': 'breakout', 'bull_bb_std_mult': 1.529740491066858, 'bull_rsi_os': 28, 'bull_rsi_ob': 69, 'bull_adx_thresh': 33.52327022873046, 'bull_atr_min_pct': 0.019349152623462474, 'bull_atr_max_pct': 0.08923011690926884, 'bull_tp_mult': 1.4253190167943584, 'bull_tsl_mult': 0.7430934163090885, 'bull_time_stop': 178, 'bull_use_sma': False, 'bull_use_ema': True, 'bull_use_atr': False, 'bull_use_adx': True, 'bull_use_spike': False, 'bull_rsi_required': False, 'bear_strategy': 'breakout', 'bear_bb_std_mult': 2.2604221789776635, 'bear_rsi_os': 8, 'bear_rsi_ob': 63, 'bear_adx_thresh': 15.308294607452604, 'bear_atr_min_pct': 0.0015043540903928359, 'bear_atr_max_pct': 0.11431719806838661, 'bear_tp_mult': 1.1129643923851413, 'bear_tsl_mult': 0.10570923779404086, 'bear_time_stop': 242, 'bear_use_sma': True, 'bear_use_ema': False, 'bear_use_atr': False, 'bear_use_adx': False, 'bear_use_spike': False, 'bear_rsi_required': False, 'sideways_strategy': 'breakout', 'sideways_bb_std_mult': 1.4788121866893351, 'sideways_rsi_os': 38, 'sideways_rsi_ob': 49, 'sideways_adx_thresh': 24.034250661241803, 'sideways_atr_min_pct': 0.00059836405364475, 'sideways_atr_max_pct': 0.060833757092736473, 'sideways_tp_mult': 2.4855464449671905, 'sideways_tsl_mult': 0.35678654615543176, 'sideways_time_stop': 156, 'sideways_use_sma': True, 'sideways_use_ema': True, 'sideways_use_atr': False, 'sideways_use_adx': False, 'sideways_use_spike': True, 'sideways_rsi_required': True}.
[I 2025-08-31 05:50:39,110] Trial 809 finished with values: [-1000000000.0, 1000000000.0] and parameters: {'p_sma': 35, 'p_std': 43, 'p_atr': 11, 'p_adx': 26, 'rsi_period': 15, 'ema1': 18, 'ema2': 19, 'slip_atr_k': 0.00041846285943786054, 'slip_spread_k': 0.8141395540212077, 'spread_hl_frac': 0.0031167725876904894, 'bb_std_mult': 3.3533243469173546, 'rsi_os': 46, 'rsi_ob': 68, 'vol_spike': 0.08212921223931625, 'adx_thresh': 7.050092224672, 'atr_min_pct': 0.011825119215527301, 'atr_max_pct': 0.11123613682204594, 'tp_mult': 2.116215544886758, 'tsl_mult': 0.36860330605266584, 'strategy': 'mean_reversion', 'time_stop': 10, 'use_sma': False, 'use_atr': True, 'use_adx': False, 'use_ema': False, 'use_spike': True, 'rsi_required': True, 'edge_k': 0.9253487286624221, 'edge_cap': 0.34020939103173287, 'bull_strategy': 'breakout', 'bull_bb_std_mult': 1.4716279219635096, 'bull_rsi_os': 28, 'bull_rsi_ob': 69, 'bull_adx_thresh': 32.776623966773315, 'bull_atr_min_pct': 0.017842996742899183, 'bull_atr_max_pct': 0.09060709579013496, 'bull_tp_mult': 1.4469601697856354, 'bull_tsl_mult': 0.7667953635103404, 'bull_time_stop': 183, 'bull_use_sma': False, 'bull_use_ema': True, 'bull_use_atr': False, 'bull_use_adx': True, 'bull_use_spike': False, 'bull_rsi_required': False, 'bear_strategy': 'breakout', 'bear_bb_std_mult': 2.218219696883993, 'bear_rsi_os': 51, 'bear_rsi_ob': 61, 'bear_adx_thresh': 15.898904349159372, 'bear_atr_min_pct': 0.01231879568892667, 'bear_atr_max_pct': 0.11182528089937441, 'bear_tp_mult': 1.0976469731112353, 'bear_tsl_mult': 0.12182100192113193, 'bear_time_stop': 233, 'bear_use_sma': True, 'bear_use_ema': False, 'bear_use_atr': True, 'bear_use_adx': False, 'bear_use_spike': False, 'bear_rsi_required': False, 'sideways_strategy': 'breakout', 'sideways_bb_std_mult': 1.4600341832921508, 'sideways_rsi_os': 41, 'sideways_rsi_ob': 49, 'sideways_adx_thresh': 23.774258718874712, 'sideways_atr_min_pct': 0.007878006122960742, 'sideways_atr_max_pct': 0.0576421837857623, 'sideways_tp_mult': 2.539440159300219, 'sideways_tsl_mult': 0.2743854315887412, 'sideways_time_stop': 152, 'sideways_use_sma': True, 'sideways_use_ema': True, 'sideways_use_atr': False, 'sideways_use_adx': False, 'sideways_use_spike': True, 'sideways_rsi_required': True}.
[I 2025-08-31 05:50:40,089] Trial 811 finished with values: [-1000000000.0, 1000000000.0] and parameters: {'p_sma': 35, 'p_std': 43, 'p_atr': 11, 'p_adx': 25, 'rsi_period': 13, 'ema1': 18, 'ema2': 19, 'slip_atr_k': 0.0012790830906677193, 'slip_spread_k': 0.8090660408376595, 'spread_hl_frac': 0.004688176665524251, 'bb_std_mult': 3.4132474825303736, 'rsi_os': 46, 'rsi_ob': 68, 'vol_spike': 0.08020534633539628, 'adx_thresh': 8.09574553015036, 'atr_min_pct': 0.011939846196861175, 'atr_max_pct': 0.11053413613853202, 'tp_mult': 2.1465168393949257, 'tsl_mult': 0.29356778451081855, 'strategy': 'mean_reversion', 'time_stop': 12, 'use_sma': False, 'use_atr': True, 'use_adx': False, 'use_ema': False, 'use_spike': True, 'rsi_required': True, 'edge_k': 0.9408787453731647, 'edge_cap': 0.34638529062120677, 'bull_strategy': 'breakout', 'bull_bb_std_mult': 1.481052067530835, 'bull_rsi_os': 35, 'bull_rsi_ob': 68, 'bull_adx_thresh': 32.98669537255382, 'bull_atr_min_pct': 0.01754446427458891, 'bull_atr_max_pct': 0.09380113308213299, 'bull_tp_mult': 1.5107181651288815, 'bull_tsl_mult': 0.7645655969850569, 'bull_time_stop': 185, 'bull_use_sma': False, 'bull_use_ema': True, 'bull_use_atr': False, 'bull_use_adx': True, 'bull_use_spike': False, 'bull_rsi_required': False, 'bear_strategy': 'breakout', 'bear_bb_std_mult': 2.197640099981468, 'bear_rsi_os': 7, 'bear_rsi_ob': 58, 'bear_adx_thresh': 16.09495148452768, 'bear_atr_min_pct': 0.003646756752569526, 'bear_atr_max_pct': 0.1107013617361073, 'bear_tp_mult': 1.0796709211556403, 'bear_tsl_mult': 0.15262679660923043, 'bear_time_stop': 225, 'bear_use_sma': True, 'bear_use_ema': False, 'bear_use_atr': True, 'bear_use_adx': False, 'bear_use_spike': False, 'bear_rsi_required': False, 'sideways_strategy': 'breakout', 'sideways_bb_std_mult': 1.400894663441503, 'sideways_rsi_os': 41, 'sideways_rsi_ob': 49, 'sideways_adx_thresh': 23.93972484440281, 'sideways_atr_min_pct': 0.00439163427666485, 'sideways_atr_max_pct': 0.05684962702061348, 'sideways_tp_mult': 2.5396992921437413, 'sideways_tsl_mult': 0.26534356446488727, 'sideways_time_stop': 171, 'sideways_use_sma': True, 'sideways_use_ema': True, 'sideways_use_atr': False, 'sideways_use_adx': False, 'sideways_use_spike': True, 'sideways_rsi_required': True}.
