[I 2025-08-31 03:37:10,275] Trial 27 finished with values: [-1000000000.0, 1000000000.0] and parameters: {'p_sma': 32, 'p_std': 30, 'p_atr': 13, 'p_adx': 30, 'rsi_period': 19, 'ema1': 25, 'ema2': 46, 'slip_atr_k': 0.20473112671299684, 'slip_spread_k': 0.18301290564689043, 'spread_hl_frac': 0.03746959856222325, 'bb_std_mult': 3.0508241025400182, 'rsi_os': 50, 'rsi_ob': 53, 'vol_spike': 0.013609338381066205, 'adx_thresh': 29.191810023050806, 'atr_min_pct': 0.00511384547868916, 'atr_max_pct': 0.12403970363941283, 'tp_mult': 2.2339777977857938, 'tsl_mult': 0.8176433002228074, 'strategy': 'breakout', 'time_stop': 262, 'use_sma': True, 'use_atr': True, 'use_adx': False, 'use_ema': True, 'use_spike': False, 'rsi_required': False, 'edge_k': 0.8330580537251309, 'edge_cap': 0.5703042116533349, 'bull_strategy': 'mean_reversion', 'bull_bb_std_mult': 2.3843968318528903, 'bull_rsi_os': 35, 'bull_rsi_ob': 89, 'bull_adx_thresh': 23.949895354525836, 'bull_atr_min_pct': 0.014438842230547883, 'bull_atr_max_pct': 0.03144614829911836, 'bull_tp_mult': 2.61487460310505, 'bull_tsl_mult': 0.2114837352879298, 'bull_time_stop': 8, 'bull_use_sma': False, 'bull_use_ema': True, 'bull_use_atr': False, 'bull_use_adx': True, 'bull_use_spike': True, 'bull_rsi_required': True, 'bear_strategy': 'breakout', 'bear_bb_std_mult': 3.546949448235138, 'bear_rsi_os': 42, 'bear_rsi_ob': 83, 'bear_adx_thresh': 30.82954423457027, 'bear_atr_min_pct': 0.003025377282483116, 'bear_atr_max_pct': 0.10984072248180994, 'bear_tp_mult': 2.6820921668313082, 'bear_tsl_mult': 0.4602049627998295, 'bear_time_stop': 286, 'bear_use_sma': False, 'bear_use_ema': False, 'bear_use_atr': True, 'bear_use_adx': False, 'bear_use_spike': True, 'bear_rsi_required': True, 'sideways_strategy': 'mean_reversion', 'sideways_bb_std_mult': 1.5661765583495622, 'sideways_rsi_os': 13, 'sideways_rsi_ob': 81, 'sideways_adx_thresh': 23.601550581605373, 'sideways_atr_min_pct': 0.0096501250330258, 'sideways_atr_max_pct': 0.11551008750203916, 'sideways_tp_mult': 2.696792231657651, 'sideways_tsl_mult': 0.5863424866997236, 'sideways_time_stop': 194, 'sideways_use_sma': False, 'sideways_use_ema': False, 'sideways_use_atr': False, 'sideways_use_adx': True, 'sideways_use_spike': True, 'sideways_rsi_required': False}.
[I 2025-08-31 03:37:10,650] Trial 28 finished with values: [-1000000000.0, 1000000000.0] and parameters: {'p_sma': 11, 'p_std': 32, 'p_atr': 13, 'p_adx': 30, 'rsi_period': 17, 'ema1': 13, 'ema2': 43, 'slip_atr_k': 0.20869809579792326, 'slip_spread_k': 0.5609889832569228, 'spread_hl_frac': 0.04429152922040778, 'bb_std_mult': 2.9777170377235285, 'rsi_os': 49, 'rsi_ob': 51, 'vol_spike': 0.29864399959106025, 'adx_thresh': 15.648738542244203, 'atr_min_pct': 0.0141955269472466, 'atr_max_pct': 0.13071304153185376, 'tp_mult': 2.220393384239369, 'tsl_mult': 0.3521369518775296, 'strategy': 'breakout', 'time_stop': 199, 'use_sma': True, 'use_atr': True, 'use_adx': False, 'use_ema': False, 'use_spike': True, 'rsi_required': True, 'edge_k': 0.8204933110384887, 'edge_cap': 0.33500003022538294, 'bull_strategy': 'mean_reversion', 'bull_bb_std_mult': 2.442113365157037, 'bull_rsi_os': 37, 'bull_rsi_ob': 90, 'bull_adx_thresh': 8.993611623218627, 'bull_atr_min_pct': 0.013236104249769766, 'bull_atr_max_pct': 0.0601249136859584, 'bull_tp_mult': 2.6161977481805114, 'bull_tsl_mult': 0.21323499001504487, 'bull_time_stop': 7, 'bull_use_sma': False, 'bull_use_ema': False, 'bull_use_atr': False, 'bull_use_adx': True, 'bull_use_spike': True, 'bull_rsi_required': True, 'bear_strategy': 'mean_reversion', 'bear_bb_std_mult': 1.7071294869954718, 'bear_rsi_os': 49, 'bear_rsi_ob': 53, 'bear_adx_thresh': 29.482352409172456, 'bear_atr_min_pct': 0.025484625507208335, 'bear_atr_max_pct': 0.028711500349843426, 'bear_tp_mult': 2.713746942147339, 'bear_tsl_mult': 0.9896596396934223, 'bear_time_stop': 36, 'bear_use_sma': False, 'bear_use_ema': True, 'bear_use_atr': True, 'bear_use_adx': True, 'bear_use_spike': True, 'bear_rsi_required': True, 'sideways_strategy': 'mean_reversion', 'sideways_bb_std_mult': 0.8740683929385271, 'sideways_rsi_os': 13, 'sideways_rsi_ob': 82, 'sideways_adx_thresh': 16.293771037098217, 'sideways_atr_min_pct': 0.0104295615436879, 'sideways_atr_max_pct': 0.1170110251710337, 'sideways_tp_mult': 2.7164652761629053, 'sideways_tsl_mult': 0.5938602372310023, 'sideways_time_stop': 211, 'sideways_use_sma': False, 'sideways_use_ema': False, 'sideways_use_atr': False, 'sideways_use_adx': True, 'sideways_use_spike': True, 'sideways_rsi_required': False}.
[I 2025-08-31 03:37:11,658] Trial 29 finished with values: [-1000000000.0, 1000000000.0] and parameters: {'p_sma': 12, 'p_std': 35, 'p_atr': 14, 'p_adx': 22, 'rsi_period': 15, 'ema1': 14, 'ema2': 46, 'slip_atr_k': 0.08148211024794089, 'slip_spread_k': 0.5830597839375229, 'spread_hl_frac': 0.03006903494718947, 'bb_std_mult': 1.585468495499081, 'rsi_os': 17, 'rsi_ob': 90, 'vol_spike': 0.29585535967786974, 'adx_thresh': 9.790657154926482, 'atr_min_pct': 0.015713967285914485, 'atr_max_pct': 0.0636634041568872, 'tp_mult': 2.2856405960786628, 'tsl_mult': 0.3373040500636472, 'strategy': 'breakout', 'time_stop': 193, 'use_sma': True, 'use_atr': True, 'use_adx': False, 'use_ema': False, 'use_spike': True, 'rsi_required': True, 'edge_k': 0.8379218841807514, 'edge_cap': 0.32786513465214595, 'bull_strategy': 'mean_reversion', 'bull_bb_std_mult': 3.029610122933933, 'bull_rsi_os': 39, 'bull_rsi_ob': 64, 'bull_adx_thresh': 8.15530235379563, 'bull_atr_min_pct': 0.013200663840989012, 'bull_atr_max_pct': 0.09082182378819793, 'bull_tp_mult': 1.2873643023644221, 'bull_tsl_mult': 0.23472685528284054, 'bull_time_stop': 245, 'bull_use_sma': True, 'bull_use_ema': False, 'bull_use_atr': False, 'bull_use_adx': True, 'bull_use_spike': False, 'bull_rsi_required': True, 'bear_strategy': 'mean_reversion', 'bear_bb_std_mult': 1.6689894648227008, 'bear_rsi_os': 49, 'bear_rsi_ob': 83, 'bear_adx_thresh': 21.193247660738844, 'bear_atr_min_pct': 0.018321145758888463, 'bear_atr_max_pct': 0.029948315134098215, 'bear_tp_mult': 1.2770368535264813, 'bear_tsl_mult': 0.7137186715707736, 'bear_time_stop': 45, 'bear_use_sma': False, 'bear_use_ema': True, 'bear_use_atr': True, 'bear_use_adx': True, 'bear_use_spike': True, 'bear_rsi_required': False, 'sideways_strategy': 'breakout', 'sideways_bb_std_mult': 0.7523664766293863, 'sideways_rsi_os': 50, 'sideways_rsi_ob': 67, 'sideways_adx_thresh': 16.894863630237865, 'sideways_atr_min_pct': 0.010611827410451151, 'sideways_atr_max_pct': 0.02036380292866731, 'sideways_tp_mult': 2.0865104011427995, 'sideways_tsl_mult': 0.6005275240510802, 'sideways_time_stop': 104, 'sideways_use_sma': False, 'sideways_use_ema': False, 'sideways_use_atr': False, 'sideways_use_adx': True, 'sideways_use_spike': False, 'sideways_rsi_required': False}.
[I 2025-08-31 03:37:11,839] Trial 30 finished with values: [-1000000000.0, 1000000000.0] and parameters: {'p_sma': 10, 'p_std': 45, 'p_atr': 27, 'p_adx': 22, 'rsi_period': 84, 'ema1': 13, 'ema2': 21, 'slip_atr_k': 0.07666129831893109, 'slip_spread_k': 0.5615109079483662, 'spread_hl_frac': 0.045396516766186154, 'bb_std_mult': 3.312550166615817, 'rsi_os': 18, 'rsi_ob': 67, 'vol_spike': 0.29827427920183563, 'adx_thresh': 9.652980543975385, 'atr_min_pct': 0.013303474166245367, 'atr_max_pct': 0.0889111336556545, 'tp_mult': 2.265686868404041, 'tsl_mult': 0.3174455436773012, 'strategy': 'breakout', 'time_stop': 185, 'use_sma': True, 'use_atr': True, 'use_adx': False, 'use_ema': False, 'use_spike': True, 'rsi_required': True, 'edge_k': 1.4003079425576241, 'edge_cap': 0.35309050398005215, 'bull_strategy': 'mean_reversion', 'bull_bb_std_mult': 2.524572203691193, 'bull_rsi_os': 5, 'bull_rsi_ob': 90, 'bull_adx_thresh': 19.93170472253346, 'bull_atr_min_pct': 0.004018923625225277, 'bull_atr_max_pct': 0.09261951512153961, 'bull_tp_mult': 1.859547844368386, 'bull_tsl_mult': 0.20436870703137294, 'bull_time_stop': 250, 'bull_use_sma': True, 'bull_use_ema': False, 'bull_use_atr': False, 'bull_use_adx': False, 'bull_use_spike': False, 'bull_rsi_required': True, 'bear_strategy': 'mean_reversion', 'bear_bb_std_mult': 1.822775274166038, 'bear_rsi_os': 50, 'bear_rsi_ob': 84, 'bear_adx_thresh': 21.151368809971423, 'bear_atr_min_pct': 0.018774129931839884, 'bear_atr_max_pct': 0.12168427970464629, 'bear_tp_mult': 2.3017879675783957, 'bear_tsl_mult': 0.7517947216552515, 'bear_time_stop': 39, 'bear_use_sma': False, 'bear_use_ema': True, 'bear_use_atr': True, 'bear_use_adx': True, 'bear_use_spike': True, 'bear_rsi_required': False, 'sideways_strategy': 'breakout', 'sideways_bb_std_mult': 1.8665894779181018, 'sideways_rsi_os': 35, 'sideways_rsi_ob': 67, 'sideways_adx_thresh': 17.91258003488599, 'sideways_atr_min_pct': 0.02620076711512423, 'sideways_atr_max_pct': 0.02192484748081206, 'sideways_tp_mult': 1.2788333519392614, 'sideways_tsl_mult': 0.5058011871094451, 'sideways_time_stop': 95, 'sideways_use_sma': False, 'sideways_use_ema': True, 'sideways_use_atr': False, 'sideways_use_adx': True, 'sideways_use_spike': False, 'sideways_rsi_required': False}.
[I 2025-08-31 03:37:40,682] Trial 32 finished with values: [-1000000000.0, 1000000000.0] and parameters: {'p_sma': 17, 'p_std': 45, 'p_atr': 28, 'p_adx': 22, 'rsi_period': 81, 'ema1': 8, 'ema2': 22, 'slip_atr_k': 0.07735863352044195, 'slip_spread_k': 0.3880278850726634, 'spread_hl_frac': 0.03276551429567108, 'bb_std_mult': 1.4855878855428077, 'rsi_os': 17, 'rsi_ob': 59, 'vol_spike': 0.2638766679758242, 'adx_thresh': 21.982370973258426, 'atr_min_pct': 0.012332247699024936, 'atr_max_pct': 0.08908669397487316, 'tp_mult': 1.599400657284326, 'tsl_mult': 0.9077204503425815, 'strategy': 'mean_reversion', 'time_stop': 125, 'use_sma': False, 'use_atr': True, 'use_adx': False, 'use_ema': False, 'use_spike': True, 'rsi_required': True, 'edge_k': 1.371279829193571, 'edge_cap': 0.8754589102318509, 'bull_strategy': 'breakout', 'bull_bb_std_mult': 3.010965113456164, 'bull_rsi_os': 6, 'bull_rsi_ob': 66, 'bull_adx_thresh': 19.094996486006167, 'bull_atr_min_pct': 0.0042691079479468125, 'bull_atr_max_pct': 0.09680078522597452, 'bull_tp_mult': 1.8430029983424931, 'bull_tsl_mult': 0.4942619674120619, 'bull_time_stop': 249, 'bull_use_sma': True, 'bull_use_ema': False, 'bull_use_atr': True, 'bull_use_adx': False, 'bull_use_spike': False, 'bull_rsi_required': False, 'bear_strategy': 'mean_reversion', 'bear_bb_std_mult': 2.4138655977479506, 'bear_rsi_os': 55, 'bear_rsi_ob': 59, 'bear_adx_thresh': 7.932276191907688, 'bear_atr_min_pct': 0.029217324953319117, 'bear_atr_max_pct': 0.0593306729431414, 'bear_tp_mult': 1.7654103636862781, 'bear_tsl_mult': 0.7393405346430341, 'bear_time_stop': 245, 'bear_use_sma': True, 'bear_use_ema': True, 'bear_use_atr': True, 'bear_use_adx': True, 'bear_use_spike': True, 'bear_rsi_required': False, 'sideways_strategy': 'breakout', 'sideways_bb_std_mult': 1.8193044537424325, 'sideways_rsi_os': 50, 'sideways_rsi_ob': 90, 'sideways_adx_thresh': 18.763358918862544, 'sideways_atr_min_pct': 0.02474737267184821, 'sideways_atr_max_pct': 0.011234563574422651, 'sideways_tp_mult': 1.2122148056276525, 'sideways_tsl_mult': 0.464339728971318, 'sideways_time_stop': 31, 'sideways_use_sma': False, 'sideways_use_ema': True, 'sideways_use_atr': True, 'sideways_use_adx': True, 'sideways_use_spike': False, 'sideways_rsi_required': True}.
[I 2025-08-31 03:37:41,383] Trial 33 finished with values: [-1000000000.0, 1000000000.0] and parameters: {'p_sma': 19, 'p_std': 44, 'p_atr': 27, 'p_adx': 24, 'rsi_period': 83, 'ema1': 16, 'ema2': 53, 'slip_atr_k': 0.15627833533902524, 'slip_spread_k': 0.7839745078681943, 'spread_hl_frac': 0.00624526785951144, 'bb_std_mult': 1.7021029346193763, 'rsi_os': 34, 'rsi_ob': 58, 'vol_spike': 0.08159708518765342, 'adx_thresh': 22.52643342931409, 'atr_min_pct': 0.011446512905320332, 'atr_max_pct': 0.08730073964246457, 'tp_mult': 1.217544632859266, 'tsl_mult': 0.7680345155334114, 'strategy': 'mean_reversion', 'time_stop': 120, 'use_sma': False, 'use_atr': True, 'use_adx': True, 'use_ema': False, 'use_spike': True, 'rsi_required': True, 'edge_k': 1.3120934870114231, 'edge_cap': 0.886977789543349, 'bull_strategy': 'breakout', 'bull_bb_std_mult': 1.4446149955160028, 'bull_rsi_os': 50, 'bull_rsi_ob': 69, 'bull_adx_thresh': 19.834033382617097, 'bull_atr_min_pct': 0.00391945419896883, 'bull_atr_max_pct': 0.13171479124257543, 'bull_tp_mult': 1.7993053543583175, 'bull_tsl_mult': 0.5262411708295602, 'bull_time_stop': 149, 'bull_use_sma': True, 'bull_use_ema': False, 'bull_use_atr': True, 'bull_use_adx': False, 'bull_use_spike': False, 'bull_rsi_required': False, 'bear_strategy': 'mean_reversion', 'bear_bb_std_mult': 2.2875677542022452, 'bear_rsi_os': 31, 'bear_rsi_ob': 61, 'bear_adx_thresh': 8.216051618947457, 'bear_atr_min_pct': 0.029882985533315087, 'bear_atr_max_pct': 0.12179769094658627, 'bear_tp_mult': 1.8556308280273741, 'bear_tsl_mult': 0.10699436448431932, 'bear_time_stop': 255, 'bear_use_sma': True, 'bear_use_ema': True, 'bear_use_atr': True, 'bear_use_adx': True, 'bear_use_spike': False, 'bear_rsi_required': False, 'sideways_strategy': 'breakout', 'sideways_bb_std_mult': 3.28048604543818, 'sideways_rsi_os': 34, 'sideways_rsi_ob': 89, 'sideways_adx_thresh': 5.0322977961307505, 'sideways_atr_min_pct': 0.025370698758014183, 'sideways_atr_max_pct': 0.08327353879075859, 'sideways_tp_mult': 1.2109539140607772, 'sideways_tsl_mult': 0.44953332847628813, 'sideways_time_stop': 20, 'sideways_use_sma': False, 'sideways_use_ema': True, 'sideways_use_atr': True, 'sideways_use_adx': False, 'sideways_use_spike': False, 'sideways_rsi_required': True}.
[I 2025-08-31 03:37:41,391] Trial 31 finished with values: [-1000000000.0, 1000000000.0] and parameters: {'p_sma': 11, 'p_std': 46, 'p_atr': 28, 'p_adx': 22, 'rsi_period': 83, 'ema1': 15, 'ema2': 55, 'slip_atr_k': 0.07341316693935464, 'slip_spread_k': 0.6009823284318484, 'spread_hl_frac': 0.04479453473780404, 'bb_std_mult': 1.6819819472909268, 'rsi_os': 18, 'rsi_ob': 90, 'vol_spike': 0.296448580940593, 'adx_thresh': 10.001293619893579, 'atr_min_pct': 0.01370991571708292, 'atr_max_pct': 0.06427845639010368, 'tp_mult': 1.293987036084693, 'tsl_mult': 0.3454095908955877, 'strategy': 'breakout', 'time_stop': 190, 'use_sma': True, 'use_atr': True, 'use_adx': False, 'use_ema': False, 'use_spike': True, 'rsi_required': True, 'edge_k': 1.423620353176859, 'edge_cap': 0.33416593788519566, 'bull_strategy': 'breakout', 'bull_bb_std_mult': 3.091324600837085, 'bull_rsi_os': 40, 'bull_rsi_ob': 66, 'bull_adx_thresh': 19.995275848874257, 'bull_atr_min_pct': 0.0001480502333885362, 'bull_atr_max_pct': 0.09289520718851514, 'bull_tp_mult': 1.3670830349013379, 'bull_tsl_mult': 0.5374946383646985, 'bull_time_stop': 249, 'bull_use_sma': True, 'bull_use_ema': False, 'bull_use_atr': True, 'bull_use_adx': False, 'bull_use_spike': False, 'bull_rsi_required': False, 'bear_strategy': 'mean_reversion', 'bear_bb_std_mult': 1.8654777188746006, 'bear_rsi_os': 50, 'bear_rsi_ob': 61, 'bear_adx_thresh': 8.75413865648652, 'bear_atr_min_pct': 0.029565496754648445, 'bear_atr_max_pct': 0.03310758240943552, 'bear_tp_mult': 1.8560199582239263, 'bear_tsl_mult': 0.7172319084089386, 'bear_time_stop': 164, 'bear_use_sma': True, 'bear_use_ema': True, 'bear_use_atr': True, 'bear_use_adx': True, 'bear_use_spike': True, 'bear_rsi_required': False, 'sideways_strategy': 'breakout', 'sideways_bb_std_mult': 3.340740152772626, 'sideways_rsi_os': 35, 'sideways_rsi_ob': 67, 'sideways_adx_thresh': 17.937927703698527, 'sideways_atr_min_pct': 0.024685722033671142, 'sideways_atr_max_pct': 0.014902871456710903, 'sideways_tp_mult': 2.13102209113191, 'sideways_tsl_mult': 0.48023562291195826, 'sideways_time_stop': 105, 'sideways_use_sma': False, 'sideways_use_ema': True, 'sideways_use_atr': True, 'sideways_use_adx': True, 'sideways_use_spike': False, 'sideways_rsi_required': False}.
[I 2025-08-31 03:37:41,470] Trial 34 finished with values: [-1000000000.0, 1000000000.0] and parameters: {'p_sma': 21, 'p_std': 52, 'p_atr': 23, 'p_adx': 9, 'rsi_period': 62, 'ema1': 16, 'ema2': 36, 'slip_atr_k': 0.16261220548972977, 'slip_spread_k': 0.3903163570979752, 'spread_hl_frac': 0.006383771653487313, 'bb_std_mult': 1.6583500527338542, 'rsi_os': 33, 'rsi_ob': 90, 'vol_spike': 0.0799261579482876, 'adx_thresh': 22.027183225477465, 'atr_min_pct': 0.017164182118118317, 'atr_max_pct': 0.04872351765612638, 'tp_mult': 2.062231465383473, 'tsl_mult': 0.5298887986169869, 'strategy': 'mean_reversion', 'time_stop': 134, 'use_sma': False, 'use_atr': False, 'use_adx': True, 'use_ema': False, 'use_spike': False, 'rsi_required': False, 'edge_k': 1.231981099830318, 'edge_cap': 0.9039327874268022, 'bull_strategy': 'breakout', 'bull_bb_std_mult': 1.4235755824438796, 'bull_rsi_os': 50, 'bull_rsi_ob': 69, 'bull_adx_thresh': 19.606499760410024, 'bull_atr_min_pct': 0.026059089781833918, 'bull_atr_max_pct': 0.10639280417576442, 'bull_tp_mult': 1.8066986835621404, 'bull_tsl_mult': 0.530506311984938, 'bull_time_stop': 150, 'bull_use_sma': True, 'bull_use_ema': False, 'bull_use_atr': True, 'bull_use_adx': False, 'bull_use_spike': False, 'bull_rsi_required': False, 'bear_strategy': 'mean_reversion', 'bear_bb_std_mult': 2.49173092746584, 'bear_rsi_os': 55, 'bear_rsi_ob': 58, 'bear_adx_thresh': 8.226191408469473, 'bear_atr_min_pct': 0.028497729186759406, 'bear_atr_max_pct': 0.058497978669189266, 'bear_tp_mult': 1.757816199558208, 'bear_tsl_mult': 0.12677367208156615, 'bear_time_stop': 252, 'bear_use_sma': True, 'bear_use_ema': False, 'bear_use_atr': True, 'bear_use_adx': False, 'bear_use_spike': False, 'bear_rsi_required': False, 'sideways_strategy': 'breakout', 'sideways_bb_std_mult': 2.002350554437689, 'sideways_rsi_os': 25, 'sideways_rsi_ob': 87, 'sideways_adx_thresh': 5.546585608728783, 'sideways_atr_min_pct': 0.022378217695085537, 'sideways_atr_max_pct': 0.08378969071939993, 'sideways_tp_mult': 1.551372714717593, 'sideways_tsl_mult': 0.8727688219849121, 'sideways_time_stop': 30, 'sideways_use_sma': True, 'sideways_use_ema': True, 'sideways_use_atr': True, 'sideways_use_adx': False, 'sideways_use_spike': False, 'sideways_rsi_required': True}.
[I 2025-08-31 03:37:41,742] Trial 37 finished with values: [-1000000000.0, 1000000000.0] and parameters: {'p_sma': 25, 'p_std': 53, 'p_atr': 23, 'p_adx': 8, 'rsi_period': 58, 'ema1': 10, 'ema2': 39, 'slip_atr_k': 0.23174182419935965, 'slip_spread_k': 0.34332057741930666, 'spread_hl_frac': 0.01824794428803312, 'bb_std_mult': 2.176625830436927, 'rsi_os': 54, 'rsi_ob': 79, 'vol_spike': 0.048698642889859464, 'adx_thresh': 18.08710433263115, 'atr_min_pct': 0.01801395316497327, 'atr_max_pct': 0.14923669509907472, 'tp_mult': 2.0862353844971766, 'tsl_mult': 0.4859810975064674, 'strategy': 'mean_reversion', 'time_stop': 156, 'use_sma': False, 'use_atr': False, 'use_adx': True, 'use_ema': True, 'use_spike': False, 'rsi_required': False, 'edge_k': 0.2087604995355119, 'edge_cap': 0.4204884917459071, 'bull_strategy': 'breakout', 'bull_bb_std_mult': 1.567001031296275, 'bull_rsi_os': 9, 'bull_rsi_ob': 49, 'bull_adx_thresh': 22.194806247018818, 'bull_atr_min_pct': 0.0267014826012318, 'bull_atr_max_pct': 0.11038624983874268, 'bull_tp_mult': 2.387388941154174, 'bull_tsl_mult': 0.32174315971037853, 'bull_time_stop': 102, 'bull_use_sma': True, 'bull_use_ema': True, 'bull_use_atr': False, 'bull_use_adx': False, 'bull_use_spike': True, 'bull_rsi_required': False, 'bear_strategy': 'breakout', 'bear_bb_std_mult': 2.5734320196792098, 'bear_rsi_os': 19, 'bear_rsi_ob': 91, 'bear_adx_thresh': 11.297029027452318, 'bear_atr_min_pct': 0.014320656949816926, 'bear_atr_max_pct': 0.14589373928907534, 'bear_tp_mult': 1.3629923097070917, 'bear_tsl_mult': 0.8999987451502429, 'bear_time_stop': 67, 'bear_use_sma': False, 'bear_use_ema': False, 'bear_use_atr': False, 'bear_use_adx': False, 'bear_use_spike': False, 'bear_rsi_required': True, 'sideways_strategy': 'breakout', 'sideways_bb_std_mult': 2.053471477703605, 'sideways_rsi_os': 26, 'sideways_rsi_ob': 49, 'sideways_adx_thresh': 31.546238756912953, 'sideways_atr_min_pct': 0.022153296120010924, 'sideways_atr_max_pct': 0.0846692288751183, 'sideways_tp_mult': 1.6179984853154006, 'sideways_tsl_mult': 0.033634578793877434, 'sideways_time_stop': 242, 'sideways_use_sma': True, 'sideways_use_ema': False, 'sideways_use_atr': False, 'sideways_use_adx': False, 'sideways_use_spike': False, 'sideways_rsi_required': True}.
