[I 2025-08-31 03:47:38,101] Trial 119 finished with values: [-1000000000.0, 1000000000.0] and parameters: {'p_sma': 23, 'p_std': 40, 'p_atr': 14, 'p_adx': 7, 'rsi_period': 12, 'ema1': 23, 'ema2': 55, 'slip_atr_k': 0.24932625428490834, 'slip_spread_k': 0.1405864670233513, 'spread_hl_frac': 0.007858774138472201, 'bb_std_mult': 0.6327547336746671, 'rsi_os': 10, 'rsi_ob': 89, 'vol_spike': 0.2862876679083449, 'adx_thresh': 18.524639489325843, 'atr_min_pct': 0.021871076029308437, 'atr_max_pct': 0.0629112470727564, 'tp_mult': 2.1549486468550025, 'tsl_mult': 0.15940057544007147, 'strategy': 'mean_reversion', 'time_stop': 156, 'use_sma': True, 'use_atr': False, 'use_adx': True, 'use_ema': False, 'use_spike': True, 'rsi_required': True, 'edge_k': 1.1705356586970308, 'edge_cap': 0.1876419382862905, 'bull_strategy': 'breakout', 'bull_bb_std_mult': 1.1391775742796084, 'bull_rsi_os': 33, 'bull_rsi_ob': 57, 'bull_adx_thresh': 13.55005829369209, 'bull_atr_min_pct': 0.004376085505759717, 'bull_atr_max_pct': 0.13497352809204197, 'bull_tp_mult': 2.775597465447148, 'bull_tsl_mult': 0.0026318335573242146, 'bull_time_stop': 160, 'bull_use_sma': True, 'bull_use_ema': True, 'bull_use_atr': False, 'bull_use_adx': False, 'bull_use_spike': False, 'bull_rsi_required': False, 'bear_strategy': 'breakout', 'bear_bb_std_mult': 1.6348742592502583, 'bear_rsi_os': 40, 'bear_rsi_ob': 67, 'bear_adx_thresh': 15.4894353660497, 'bear_atr_min_pct': 0.006766388561961606, 'bear_atr_max_pct': 0.10283430307590802, 'bear_tp_mult': 1.8861476480795323, 'bear_tsl_mult': 0.6046295588895982, 'bear_time_stop': 5, 'bear_use_sma': False, 'bear_use_ema': False, 'bear_use_atr': True, 'bear_use_adx': True, 'bear_use_spike': False, 'bear_rsi_required': False, 'sideways_strategy': 'breakout', 'sideways_bb_std_mult': 3.239475945939098, 'sideways_rsi_os': 6, 'sideways_rsi_ob': 53, 'sideways_adx_thresh': 10.924676120791458, 'sideways_atr_min_pct': 0.003935849710075509, 'sideways_atr_max_pct': 0.06945038214793736, 'sideways_tp_mult': 1.13059860586973, 'sideways_tsl_mult': 0.9994400204125736, 'sideways_time_stop': 276, 'sideways_use_sma': True, 'sideways_use_ema': True, 'sideways_use_atr': True, 'sideways_use_adx': False, 'sideways_use_spike': False, 'sideways_rsi_required': False}.
[I 2025-08-31 03:47:38,261] Trial 117 finished with values: [-1000000000.0, 1000000000.0] and parameters: {'p_sma': 56, 'p_std': 39, 'p_atr': 26, 'p_adx': 8, 'rsi_period': 39, 'ema1': 23, 'ema2': 60, 'slip_atr_k': 0.025679171635351744, 'slip_spread_k': 0.4204252212789778, 'spread_hl_frac': 0.007795378422123751, 'bb_std_mult': 3.4343797106508323, 'rsi_os': 10, 'rsi_ob': 78, 'vol_spike': 0.28899469089672575, 'adx_thresh': 30.530577761226347, 'atr_min_pct': 0.0034023235337110897, 'atr_max_pct': 0.06115626750961235, 'tp_mult': 1.4673969674796599, 'tsl_mult': 0.9034739728292973, 'strategy': 'mean_reversion', 'time_stop': 207, 'use_sma': False, 'use_atr': False, 'use_adx': True, 'use_ema': True, 'use_spike': False, 'rsi_required': True, 'edge_k': 1.2123542298662622, 'edge_cap': 0.6111011068733943, 'bull_strategy': 'breakout', 'bull_bb_std_mult': 2.7374238693755863, 'bull_rsi_os': 48, 'bull_rsi_ob': 92, 'bull_adx_thresh': 15.703579323018282, 'bull_atr_min_pct': 0.0031564998830661004, 'bull_atr_max_pct': 0.14169621059681575, 'bull_tp_mult': 2.7835520126299995, 'bull_tsl_mult': 0.7388469073018279, 'bull_time_stop': 157, 'bull_use_sma': True, 'bull_use_ema': True, 'bull_use_atr': True, 'bull_use_adx': False, 'bull_use_spike': True, 'bull_rsi_required': False, 'bear_strategy': 'breakout', 'bear_bb_std_mult': 2.887438426281805, 'bear_rsi_os': 11, 'bear_rsi_ob': 78, 'bear_adx_thresh': 15.28115628840607, 'bear_atr_min_pct': 0.006546570130099414, 'bear_atr_max_pct': 0.05698364249852365, 'bear_tp_mult': 1.289459667092195, 'bear_tsl_mult': 0.5971433155037669, 'bear_time_stop': 35, 'bear_use_sma': False, 'bear_use_ema': False, 'bear_use_atr': True, 'bear_use_adx': False, 'bear_use_spike': False, 'bear_rsi_required': False, 'sideways_strategy': 'breakout', 'sideways_bb_std_mult': 3.239043710166252, 'sideways_rsi_os': 51, 'sideways_rsi_ob': 68, 'sideways_adx_thresh': 19.405758055391672, 'sideways_atr_min_pct': 0.027894275418155347, 'sideways_atr_max_pct': 0.06945491368119983, 'sideways_tp_mult': 1.8151544513855586, 'sideways_tsl_mult': 0.6238793425547001, 'sideways_time_stop': 276, 'sideways_use_sma': True, 'sideways_use_ema': True, 'sideways_use_atr': True, 'sideways_use_adx': False, 'sideways_use_spike': False, 'sideways_rsi_required': False}.
[I 2025-08-31 03:47:38,344] Trial 118 finished with values: [-1000000000.0, 1000000000.0] and parameters: {'p_sma': 25, 'p_std': 55, 'p_atr': 15, 'p_adx': 26, 'rsi_period': 20, 'ema1': 13, 'ema2': 33, 'slip_atr_k': 0.029226022411004943, 'slip_spread_k': 0.696328475554077, 'spread_hl_frac': 0.04914324399695182, 'bb_std_mult': 3.44410823959785, 'rsi_os': 10, 'rsi_ob': 81, 'vol_spike': 0.28547483526497763, 'adx_thresh': 18.580830895385326, 'atr_min_pct': 0.009350504874210788, 'atr_max_pct': 0.06427269288904992, 'tp_mult': 1.424616957264032, 'tsl_mult': 0.7363247466044169, 'strategy': 'mean_reversion', 'time_stop': 214, 'use_sma': False, 'use_atr': False, 'use_adx': True, 'use_ema': True, 'use_spike': False, 'rsi_required': True, 'edge_k': 1.2189962301532722, 'edge_cap': 0.19293180121509707, 'bull_strategy': 'breakout', 'bull_bb_std_mult': 0.7449869510941389, 'bull_rsi_os': 28, 'bull_rsi_ob': 92, 'bull_adx_thresh': 32.606885787804266, 'bull_atr_min_pct': 0.01377567119760386, 'bull_atr_max_pct': 0.13534484807892, 'bull_tp_mult': 2.766515546502316, 'bull_tsl_mult': 0.6563741417043316, 'bull_time_stop': 157, 'bull_use_sma': True, 'bull_use_ema': True, 'bull_use_atr': True, 'bull_use_adx': False, 'bull_use_spike': True, 'bull_rsi_required': False, 'bear_strategy': 'breakout', 'bear_bb_std_mult': 2.928255178769199, 'bear_rsi_os': 21, 'bear_rsi_ob': 67, 'bear_adx_thresh': 14.275189115967114, 'bear_atr_min_pct': 0.006848911784029778, 'bear_atr_max_pct': 0.13364799898093055, 'bear_tp_mult': 1.2970452197295512, 'bear_tsl_mult': 0.423862862105148, 'bear_time_stop': 142, 'bear_use_sma': False, 'bear_use_ema': False, 'bear_use_atr': True, 'bear_use_adx': False, 'bear_use_spike': False, 'bear_rsi_required': False, 'sideways_strategy': 'breakout', 'sideways_bb_std_mult': 0.7716576858316981, 'sideways_rsi_os': 54, 'sideways_rsi_ob': 88, 'sideways_adx_thresh': 10.978377521396299, 'sideways_atr_min_pct': 0.0239165281154035, 'sideways_atr_max_pct': 0.07025037268046651, 'sideways_tp_mult': 2.508365307902256, 'sideways_tsl_mult': 0.3584343781935705, 'sideways_time_stop': 176, 'sideways_use_sma': True, 'sideways_use_ema': True, 'sideways_use_atr': True, 'sideways_use_adx': False, 'sideways_use_spike': False, 'sideways_rsi_required': False}.
[I 2025-08-31 03:48:07,370] Trial 123 finished with values: [-1000000000.0, 1000000000.0] and parameters: {'p_sma': 34, 'p_std': 10, 'p_atr': 11, 'p_adx': 29, 'rsi_period': 15, 'ema1': 29, 'ema2': 34, 'slip_atr_k': 0.0394636756196681, 'slip_spread_k': 0.8541734430904402, 'spread_hl_frac': 0.010012286233301493, 'bb_std_mult': 0.8172543812116878, 'rsi_os': 5, 'rsi_ob': 50, 'vol_spike': 0.1603925449844483, 'adx_thresh': 22.36914517370939, 'atr_min_pct': 0.018803028887146463, 'atr_max_pct': 0.06872620337356551, 'tp_mult': 1.1366454034139026, 'tsl_mult': 0.3215303082062056, 'strategy': 'breakout', 'time_stop': 124, 'use_sma': True, 'use_atr': False, 'use_adx': False, 'use_ema': False, 'use_spike': True, 'rsi_required': False, 'edge_k': 0.2070610208070381, 'edge_cap': 0.4559226669132311, 'bull_strategy': 'breakout', 'bull_bb_std_mult': 1.5340811305683002, 'bull_rsi_os': 52, 'bull_rsi_ob': 89, 'bull_adx_thresh': 31.83737318896138, 'bull_atr_min_pct': 0.029079692077649412, 'bull_atr_max_pct': 0.0486419615741337, 'bull_tp_mult': 1.2233825447687101, 'bull_tsl_mult': 0.07919386681330898, 'bull_time_stop': 287, 'bull_use_sma': False, 'bull_use_ema': False, 'bull_use_atr': False, 'bull_use_adx': False, 'bull_use_spike': False, 'bull_rsi_required': False, 'bear_strategy': 'breakout', 'bear_bb_std_mult': 2.553112770769091, 'bear_rsi_os': 50, 'bear_rsi_ob': 69, 'bear_adx_thresh': 16.19760870942768, 'bear_atr_min_pct': 0.0185284060097076, 'bear_atr_max_pct': 0.034433274886656665, 'bear_tp_mult': 1.4022375288416653, 'bear_tsl_mult': 0.08624526582420217, 'bear_time_stop': 13, 'bear_use_sma': False, 'bear_use_ema': True, 'bear_use_atr': True, 'bear_use_adx': True, 'bear_use_spike': True, 'bear_rsi_required': True, 'sideways_strategy': 'mean_reversion', 'sideways_bb_std_mult': 1.4748397642265503, 'sideways_rsi_os': 53, 'sideways_rsi_ob': 94, 'sideways_adx_thresh': 9.103748773327585, 'sideways_atr_min_pct': 0.024682595815625468, 'sideways_atr_max_pct': 0.130172942738506, 'sideways_tp_mult': 2.4469288032466587, 'sideways_tsl_mult': 0.4909009228937643, 'sideways_time_stop': 290, 'sideways_use_sma': True, 'sideways_use_ema': False, 'sideways_use_atr': False, 'sideways_use_adx': True, 'sideways_use_spike': False, 'sideways_rsi_required': False}.
[I 2025-08-31 03:48:07,752] Trial 120 finished with values: [-1000000000.0, 1000000000.0] and parameters: {'p_sma': 53, 'p_std': 31, 'p_atr': 12, 'p_adx': 29, 'rsi_period': 39, 'ema1': 23, 'ema2': 34, 'slip_atr_k': 0.14659957625645412, 'slip_spread_k': 0.8553471231991442, 'spread_hl_frac': 0.030492193075671355, 'bb_std_mult': 1.1882368948407032, 'rsi_os': 32, 'rsi_ob': 54, 'vol_spike': 0.15950232460668282, 'adx_thresh': 30.73727693764082, 'atr_min_pct': 0.0032127043143093635, 'atr_max_pct': 0.06384126883765937, 'tp_mult': 2.1371638392411123, 'tsl_mult': 0.1597298178471629, 'strategy': 'mean_reversion', 'time_stop': 214, 'use_sma': True, 'use_atr': False, 'use_adx': True, 'use_ema': False, 'use_spike': True, 'rsi_required': True, 'edge_k': 0.6144871913854746, 'edge_cap': 0.45893558039460797, 'bull_strategy': 'breakout', 'bull_bb_std_mult': 0.8002295084829902, 'bull_rsi_os': 51, 'bull_rsi_ob': 58, 'bull_adx_thresh': 18.022123952670583, 'bull_atr_min_pct': 0.029956333855072844, 'bull_atr_max_pct': 0.1415903349235447, 'bull_tp_mult': 2.783668432787363, 'bull_tsl_mult': 0.6459935873156899, 'bull_time_stop': 161, 'bull_use_sma': True, 'bull_use_ema': True, 'bull_use_atr': False, 'bull_use_adx': False, 'bull_use_spike': False, 'bull_rsi_required': False, 'bear_strategy': 'breakout', 'bear_bb_std_mult': 1.6558138999784446, 'bear_rsi_os': 21, 'bear_rsi_ob': 45, 'bear_adx_thresh': 15.42310435675358, 'bear_atr_min_pct': 0.01865477939129615, 'bear_atr_max_pct': 0.1341157986444919, 'bear_tp_mult': 1.3075183862789266, 'bear_tsl_mult': 0.0633900126903526, 'bear_time_stop': 285, 'bear_use_sma': False, 'bear_use_ema': False, 'bear_use_atr': True, 'bear_use_adx': True, 'bear_use_spike': False, 'bear_rsi_required': True, 'sideways_strategy': 'breakout', 'sideways_bb_std_mult': 0.6787530115275366, 'sideways_rsi_os': 54, 'sideways_rsi_ob': 93, 'sideways_adx_thresh': 28.122660283249182, 'sideways_atr_min_pct': 0.023861468223128728, 'sideways_atr_max_pct': 0.0694044350141228, 'sideways_tp_mult': 1.1308219618275772, 'sideways_tsl_mult': 0.3701662308096791, 'sideways_time_stop': 178, 'sideways_use_sma': True, 'sideways_use_ema': True, 'sideways_use_atr': True, 'sideways_use_adx': False, 'sideways_use_spike': False, 'sideways_rsi_required': False}.
[I 2025-08-31 03:48:07,975] Trial 122 finished with values: [-0.021231460498279398, 0.02116920698041634] and parameters: {'p_sma': 18, 'p_std': 9, 'p_atr': 12, 'p_adx': 11, 'rsi_period': 81, 'ema1': 5, 'ema2': 34, 'slip_atr_k': 0.1710525564120165, 'slip_spread_k': 0.853798125558141, 'spread_hl_frac': 0.030867688220859873, 'bb_std_mult': 1.9807890070163983, 'rsi_os': 6, 'rsi_ob': 81, 'vol_spike': 0.15957272937725886, 'adx_thresh': 19.983478856521714, 'atr_min_pct': 0.001478698806776691, 'atr_max_pct': 0.06891318665617975, 'tp_mult': 1.1127343708959447, 'tsl_mult': 0.3095115736159747, 'strategy': 'mean_reversion', 'time_stop': 215, 'use_sma': True, 'use_atr': False, 'use_adx': True, 'use_ema': True, 'use_spike': False, 'rsi_required': False, 'edge_k': 0.6019891977681278, 'edge_cap': 0.4607615755841788, 'bull_strategy': 'breakout', 'bull_bb_std_mult': 2.453042016800948, 'bull_rsi_os': 30, 'bull_rsi_ob': 95, 'bull_adx_thresh': 17.99264983345109, 'bull_atr_min_pct': 0.0007266518421352421, 'bull_atr_max_pct': 0.09720600923797637, 'bull_tp_mult': 2.9518360921602658, 'bull_tsl_mult': 0.6529584448180078, 'bull_time_stop': 288, 'bull_use_sma': True, 'bull_use_ema': False, 'bull_use_atr': False, 'bull_use_adx': False, 'bull_use_spike': True, 'bull_rsi_required': False, 'bear_strategy': 'breakout', 'bear_bb_std_mult': 0.5777929579729222, 'bear_rsi_os': 20, 'bear_rsi_ob': 62, 'bear_adx_thresh': 25.35060867340279, 'bear_atr_min_pct': 0.002272039759603814, 'bear_atr_max_pct': 0.013262284270953523, 'bear_tp_mult': 1.1514133680575702, 'bear_tsl_mult': 0.7288651990121902, 'bear_time_stop': 262, 'bear_use_sma': False, 'bear_use_ema': True, 'bear_use_atr': True, 'bear_use_adx': False, 'bear_use_spike': True, 'bear_rsi_required': True, 'sideways_strategy': 'breakout', 'sideways_bb_std_mult': 1.4845328041011394, 'sideways_rsi_os': 54, 'sideways_rsi_ob': 78, 'sideways_adx_thresh': 15.63849511087257, 'sideways_atr_min_pct': 0.02396576306867881, 'sideways_atr_max_pct': 0.011126851323666476, 'sideways_tp_mult': 2.631596466994603, 'sideways_tsl_mult': 0.37508040283326416, 'sideways_time_stop': 300, 'sideways_use_sma': True, 'sideways_use_ema': True, 'sideways_use_atr': True, 'sideways_use_adx': True, 'sideways_use_spike': False, 'sideways_rsi_required': False}.
[I 2025-08-31 03:48:08,043] Trial 121 finished with values: [-1000000000.0, 1000000000.0] and parameters: {'p_sma': 53, 'p_std': 19, 'p_atr': 12, 'p_adx': 12, 'rsi_period': 15, 'ema1': 17, 'ema2': 34, 'slip_atr_k': 0.1456926319750098, 'slip_spread_k': 0.4086698895768014, 'spread_hl_frac': 0.03176865394723738, 'bb_std_mult': 1.0513284438948074, 'rsi_os': 6, 'rsi_ob': 51, 'vol_spike': 0.2678124927846009, 'adx_thresh': 30.347738628274744, 'atr_min_pct': 0.01883670230018792, 'atr_max_pct': 0.06880190995163224, 'tp_mult': 1.1264841715353646, 'tsl_mult': 0.3132765873910843, 'strategy': 'mean_reversion', 'time_stop': 215, 'use_sma': False, 'use_atr': False, 'use_adx': True, 'use_ema': True, 'use_spike': False, 'rsi_required': True, 'edge_k': 0.5338228992801308, 'edge_cap': 0.4122590719372028, 'bull_strategy': 'breakout', 'bull_bb_std_mult': 0.8520692007707362, 'bull_rsi_os': 30, 'bull_rsi_ob': 93, 'bull_adx_thresh': 18.248618005219374, 'bull_atr_min_pct': 0.02945989866692291, 'bull_atr_max_pct': 0.1404587029204343, 'bull_tp_mult': 2.943203617874607, 'bull_tsl_mult': 0.242262521594437, 'bull_time_stop': 300, 'bull_use_sma': True, 'bull_use_ema': True, 'bull_use_atr': True, 'bull_use_adx': False, 'bull_use_spike': True, 'bull_rsi_required': False, 'bear_strategy': 'breakout', 'bear_bb_std_mult': 0.7118137242259928, 'bear_rsi_os': 21, 'bear_rsi_ob': 69, 'bear_adx_thresh': 14.10804187551084, 'bear_atr_min_pct': 0.018428045158038798, 'bear_atr_max_pct': 0.07669352856665362, 'bear_tp_mult': 1.2838802632778645, 'bear_tsl_mult': 0.09149238608121685, 'bear_time_stop': 13, 'bear_use_sma': False, 'bear_use_ema': False, 'bear_use_atr': True, 'bear_use_adx': False, 'bear_use_spike': False, 'bear_rsi_required': True, 'sideways_strategy': 'breakout', 'sideways_bb_std_mult': 2.9911480327901807, 'sideways_rsi_os': 54, 'sideways_rsi_ob': 78, 'sideways_adx_thresh': 17.61302698125579, 'sideways_atr_min_pct': 0.02396534550267148, 'sideways_atr_max_pct': 0.12840238432267623, 'sideways_tp_mult': 1.8144554539006028, 'sideways_tsl_mult': 0.8065220210630593, 'sideways_time_stop': 289, 'sideways_use_sma': True, 'sideways_use_ema': True, 'sideways_use_atr': True, 'sideways_use_adx': True, 'sideways_use_spike': False, 'sideways_rsi_required': False}.
[I 2025-08-31 03:48:08,327] Trial 126 finished with values: [-1000000000.0, 1000000000.0] and parameters: {'p_sma': 57, 'p_std': 19, 'p_atr': 12, 'p_adx': 11, 'rsi_period': 71, 'ema1': 12, 'ema2': 27, 'slip_atr_k': 0.17290827629963176, 'slip_spread_k': 0.3646976923917057, 'spread_hl_frac': 0.02610692893134165, 'bb_std_mult': 1.8555308053404327, 'rsi_os': 6, 'rsi_ob': 47, 'vol_spike': 0.2739493126034461, 'adx_thresh': 21.49308280028375, 'atr_min_pct': 0.0014978073123825004, 'atr_max_pct': 0.07915793387059203, 'tp_mult': 2.808800701813437, 'tsl_mult': 0.4629031635546449, 'strategy': 'mean_reversion', 'time_stop': 98, 'use_sma': False, 'use_atr': True, 'use_adx': True, 'use_ema': True, 'use_spike': False, 'rsi_required': True, 'edge_k': 0.5174773848010625, 'edge_cap': 0.4140217717134581, 'bull_strategy': 'mean_reversion', 'bull_bb_std_mult': 2.458576438920511, 'bull_rsi_os': 30, 'bull_rsi_ob': 95, 'bull_adx_thresh': 34.233368063015476, 'bull_atr_min_pct': 0.0012503460286842905, 'bull_atr_max_pct': 0.013233811594672726, 'bull_tp_mult': 2.9519344938219856, 'bull_tsl_mult': 0.7062610282403434, 'bull_time_stop': 90, 'bull_use_sma': True, 'bull_use_ema': True, 'bull_use_atr': True, 'bull_use_adx': False, 'bull_use_spike': True, 'bull_rsi_required': True, 'bear_strategy': 'breakout', 'bear_bb_std_mult': 0.7008526525436014, 'bear_rsi_os': 43, 'bear_rsi_ob': 62, 'bear_adx_thresh': 34.115434604933455, 'bear_atr_min_pct': 0.027828822907039336, 'bear_atr_max_pct': 0.011513530074040587, 'bear_tp_mult': 1.2557796702209878, 'bear_tsl_mult': 0.14362556666017595, 'bear_time_stop': 54, 'bear_use_sma': False, 'bear_use_ema': False, 'bear_use_atr': True, 'bear_use_adx': False, 'bear_use_spike': False, 'bear_rsi_required': False, 'sideways_strategy': 'breakout', 'sideways_bb_std_mult': 1.2426039331746377, 'sideways_rsi_os': 55, 'sideways_rsi_ob': 85, 'sideways_adx_thresh': 15.722507685843421, 'sideways_atr_min_pct': 0.025433890580897362, 'sideways_atr_max_pct': 0.08735785007297016, 'sideways_tp_mult': 2.4094499935905365, 'sideways_tsl_mult': 0.8186915702408171, 'sideways_time_stop': 202, 'sideways_use_sma': True, 'sideways_use_ema': True, 'sideways_use_atr': True, 'sideways_use_adx': True, 'sideways_use_spike': True, 'sideways_rsi_required': False}.
[I 2025-08-31 03:48:36,647] Trial 124 finished with values: [-1000000000.0, 1000000000.0] and parameters: {'p_sma': 59, 'p_std': 11, 'p_atr': 12, 'p_adx': 11, 'rsi_period': 54, 'ema1': 19, 'ema2': 40, 'slip_atr_k': 0.19947206612744978, 'slip_spread_k': 0.5384562038713276, 'spread_hl_frac': 0.031085554485350088, 'bb_std_mult': 1.0203004364156767, 'rsi_os': 16, 'rsi_ob': 59, 'vol_spike': 0.041015113936761605, 'adx_thresh': 21.439950300724973, 'atr_min_pct': 0.011804644697764613, 'atr_max_pct': 0.09979960707897298, 'tp_mult': 1.2578664868761353, 'tsl_mult': 0.23770346480033847, 'strategy': 'mean_reversion', 'time_stop': 195, 'use_sma': False, 'use_atr': False, 'use_adx': True, 'use_ema': True, 'use_spike': False, 'rsi_required': True, 'edge_k': 0.610252984429899, 'edge_cap': 0.8330768444934009, 'bull_strategy': 'breakout', 'bull_bb_std_mult': 2.655260259873927, 'bull_rsi_os': 32, 'bull_rsi_ob': 95, 'bull_adx_thresh': 31.7860352300614, 'bull_atr_min_pct': 0.0007201866820570126, 'bull_atr_max_pct': 0.1303643048990282, 'bull_tp_mult': 2.9593341734698075, 'bull_tsl_mult': 0.7013806514962331, 'bull_time_stop': 285, 'bull_use_sma': True, 'bull_use_ema': True, 'bull_use_atr': True, 'bull_use_adx': False, 'bull_use_spike': True, 'bull_rsi_required': False, 'bear_strategy': 'breakout', 'bear_bb_std_mult': 1.5056345156682416, 'bear_rsi_os': 54, 'bear_rsi_ob': 62, 'bear_adx_thresh': 33.74617233288539, 'bear_atr_min_pct': 0.027904353470174982, 'bear_atr_max_pct': 0.08633299379693428, 'bear_tp_mult': 1.6048154312478022, 'bear_tsl_mult': 0.7246849659515617, 'bear_time_stop': 110, 'bear_use_sma': False, 'bear_use_ema': False, 'bear_use_atr': True, 'bear_use_adx': False, 'bear_use_spike': False, 'bear_rsi_required': True, 'sideways_strategy': 'breakout', 'sideways_bb_std_mult': 1.9684185004278607, 'sideways_rsi_os': 33, 'sideways_rsi_ob': 78, 'sideways_adx_thresh': 17.69692173402479, 'sideways_atr_min_pct': 0.025345136320925714, 'sideways_atr_max_pct': 0.12624660138477606, 'sideways_tp_mult': 2.603231893878339, 'sideways_tsl_mult': 0.8212337165931362, 'sideways_time_stop': 136, 'sideways_use_sma': True, 'sideways_use_ema': True, 'sideways_use_atr': True, 'sideways_use_adx': False, 'sideways_use_spike': False, 'sideways_rsi_required': False}.
