[I 2025-08-29 23:21:08,487] Trial 944 finished with values: [-0.0005224129829560775, 0.0010620023372260917] and parameters: {'p_sma': 39, 'p_std': 10, 'p_atr': 19, 'p_adx': 13, 'rsi_period': 13, 'ema1': 30, 'ema2': 19, 'slip_atr_k': 0.0036871618363137045, 'slip_spread_k': 0.21286384670216335, 'spread_hl_frac': 0.011278681755827082, 'bb_std_mult': 3.228995821174237, 'rsi_os': 12, 'rsi_ob': 58, 'vol_spike': 0.2980333385833005, 'adx_thresh': 26.56589467266288, 'atr_min_pct': 0.0033215934990508053, 'atr_max_pct': 0.057555067456053016, 'tp_mult': 1.8810432335181213, 'tsl_mult': 0.037462350861542815, 'strategy': 'mean_reversion', 'time_stop': 137, 'use_sma': False, 'use_atr': False, 'use_adx': False, 'use_ema': False, 'use_spike': False, 'rsi_required': False, 'edge_k': 0.11710105610689292, 'edge_cap': 0.22021324623613575}.
[I 2025-08-29 23:21:08,778] Trial 945 finished with values: [-0.0017292703431696088, 0.002151375059514465] and parameters: {'p_sma': 24, 'p_std': 56, 'p_atr': 11, 'p_adx': 19, 'rsi_period': 9, 'ema1': 13, 'ema2': 27, 'slip_atr_k': 0.0037377321888093047, 'slip_spread_k': 0.30096675298744724, 'spread_hl_frac': 0.011130270946448754, 'bb_std_mult': 1.5813223135046743, 'rsi_os': 33, 'rsi_ob': 59, 'vol_spike': 0.2340946459041953, 'adx_thresh': 16.605980193533053, 'atr_min_pct': 0.003618997414416037, 'atr_max_pct': 0.05851713004329898, 'tp_mult': 2.033530364045995, 'tsl_mult': 0.7618484903017262, 'strategy': 'mean_reversion', 'time_stop': 280, 'use_sma': False, 'use_atr': False, 'use_adx': False, 'use_ema': False, 'use_spike': False, 'rsi_required': False, 'edge_k': 1.8573816578545599, 'edge_cap': 0.6580416401964466}.
[I 2025-08-29 23:21:08,916] Trial 947 finished with values: [-0.0007796528712505912, 0.001412515804709547] and parameters: {'p_sma': 19, 'p_std': 13, 'p_atr': 11, 'p_adx': 12, 'rsi_period': 65, 'ema1': 15, 'ema2': 18, 'slip_atr_k': 0.004265372890303123, 'slip_spread_k': 0.6607636318628751, 'spread_hl_frac': 0.009255635180040463, 'bb_std_mult': 1.573816449653882, 'rsi_os': 33, 'rsi_ob': 62, 'vol_spike': 0.23815823689058094, 'adx_thresh': 20.025999182010736, 'atr_min_pct': 0.003471492030038187, 'atr_max_pct': 0.020673826770211352, 'tp_mult': 1.4169247693519118, 'tsl_mult': 0.033694509679352114, 'strategy': 'mean_reversion', 'time_stop': 282, 'use_sma': False, 'use_atr': False, 'use_adx': False, 'use_ema': False, 'use_spike': False, 'rsi_required': False, 'edge_k': 1.8526480616361103, 'edge_cap': 0.6481560624438342}.
[I 2025-08-29 23:21:36,385] Trial 950 finished with values: [-0.0017548521497184888, 0.0017244027018527624] and parameters: {'p_sma': 28, 'p_std': 43, 'p_atr': 11, 'p_adx': 27, 'rsi_period': 12, 'ema1': 17, 'ema2': 21, 'slip_atr_k': 0.0053572843784665675, 'slip_spread_k': 0.2854115392922324, 'spread_hl_frac': 0.011567783899151855, 'bb_std_mult': 1.5141817169958514, 'rsi_os': 33, 'rsi_ob': 62, 'vol_spike': 0.23622454123428177, 'adx_thresh': 16.713392789319066, 'atr_min_pct': 0.003797850293543247, 'atr_max_pct': 0.07140764994189856, 'tp_mult': 1.9369969982010078, 'tsl_mult': 0.5976128211990532, 'strategy': 'mean_reversion', 'time_stop': 36, 'use_sma': False, 'use_atr': False, 'use_adx': False, 'use_ema': False, 'use_spike': False, 'rsi_required': False, 'edge_k': 1.840721005906941, 'edge_cap': 0.6589221472279561}.
[I 2025-08-29 23:21:36,404] Trial 948 finished with values: [-1000000000.0, 1000000000.0] and parameters: {'p_sma': 20, 'p_std': 13, 'p_atr': 25, 'p_adx': 12, 'rsi_period': 61, 'ema1': 29, 'ema2': 22, 'slip_atr_k': 0.0042460921199861746, 'slip_spread_k': 0.2878701164659879, 'spread_hl_frac': 0.009068059308269127, 'bb_std_mult': 1.5176537844169333, 'rsi_os': 33, 'rsi_ob': 57, 'vol_spike': 0.223028478175796, 'adx_thresh': 26.439124662909187, 'atr_min_pct': 0.011769703796599331, 'atr_max_pct': 0.07093553465327089, 'tp_mult': 1.9308240894926318, 'tsl_mult': 0.019608092989444825, 'strategy': 'mean_reversion', 'time_stop': 266, 'use_sma': False, 'use_atr': False, 'use_adx': False, 'use_ema': False, 'use_spike': False, 'rsi_required': False, 'edge_k': 0.886329152831316, 'edge_cap': 0.8150205688839098}.
[I 2025-08-29 23:21:36,578] Trial 949 finished with values: [-1000000000.0, 1000000000.0] and parameters: {'p_sma': 19, 'p_std': 12, 'p_atr': 11, 'p_adx': 27, 'rsi_period': 66, 'ema1': 27, 'ema2': 21, 'slip_atr_k': 0.005799807422744335, 'slip_spread_k': 0.2860954009909108, 'spread_hl_frac': 0.008921715936823161, 'bb_std_mult': 1.5485562609454944, 'rsi_os': 33, 'rsi_ob': 62, 'vol_spike': 0.23735532869663428, 'adx_thresh': 21.531483685981986, 'atr_min_pct': 0.0104086187427165, 'atr_max_pct': 0.07014591331909471, 'tp_mult': 1.9573919634042745, 'tsl_mult': 0.5958435155759749, 'strategy': 'mean_reversion', 'time_stop': 138, 'use_sma': False, 'use_atr': False, 'use_adx': False, 'use_ema': False, 'use_spike': False, 'rsi_required': False, 'edge_k': 1.8490542538894474, 'edge_cap': 0.14140264485008885}.
[I 2025-08-29 23:21:36,721] Trial 951 finished with values: [-0.037254318539655884, 0.03724355264151099] and parameters: {'p_sma': 28, 'p_std': 43, 'p_atr': 11, 'p_adx': 12, 'rsi_period': 12, 'ema1': 17, 'ema2': 25, 'slip_atr_k': 8.146653545820814e-05, 'slip_spread_k': 0.27952937926889954, 'spread_hl_frac': 0.018567936202562647, 'bb_std_mult': 1.5676356272398682, 'rsi_os': 33, 'rsi_ob': 60, 'vol_spike': 0.23633787704470988, 'adx_thresh': 16.548845601083567, 'atr_min_pct': 1.9621886013503065e-05, 'atr_max_pct': 0.07040863350054678, 'tp_mult': 1.9423925727721054, 'tsl_mult': 0.596799880905709, 'strategy': 'mean_reversion', 'time_stop': 283, 'use_sma': False, 'use_atr': False, 'use_adx': False, 'use_ema': False, 'use_spike': False, 'rsi_required': False, 'edge_k': 1.8445137438019201, 'edge_cap': 0.6613131691687822}.
[I 2025-08-29 23:22:04,144] Trial 952 finished with values: [-0.002326345445116007, 0.0023786769029155797] and parameters: {'p_sma': 30, 'p_std': 12, 'p_atr': 11, 'p_adx': 14, 'rsi_period': 19, 'ema1': 30, 'ema2': 21, 'slip_atr_k': 0.0001516836055162634, 'slip_spread_k': 0.28744412577486755, 'spread_hl_frac': 0.011719106468273191, 'bb_std_mult': 1.4092189718087103, 'rsi_os': 33, 'rsi_ob': 88, 'vol_spike': 0.2983614707077261, 'adx_thresh': 16.53940718650747, 'atr_min_pct': 0.0038919191462019644, 'atr_max_pct': 0.07030795072927526, 'tp_mult': 1.881784670311005, 'tsl_mult': 0.5906290483437988, 'strategy': 'mean_reversion', 'time_stop': 36, 'use_sma': False, 'use_atr': False, 'use_adx': False, 'use_ema': False, 'use_spike': False, 'rsi_required': False, 'edge_k': 1.8402210495897733, 'edge_cap': 0.8731639145568354}.
[I 2025-08-29 23:22:04,461] Trial 954 finished with values: [-0.00534775639857199, 0.005349996398940707] and parameters: {'p_sma': 29, 'p_std': 56, 'p_atr': 12, 'p_adx': 14, 'rsi_period': 42, 'ema1': 30, 'ema2': 18, 'slip_atr_k': 0.2242145598003234, 'slip_spread_k': 0.27414042924776233, 'spread_hl_frac': 0.011493792409375283, 'bb_std_mult': 1.400754739437888, 'rsi_os': 34, 'rsi_ob': 62, 'vol_spike': 0.08999327789723373, 'adx_thresh': 19.867006947207273, 'atr_min_pct': 0.003584617461070345, 'atr_max_pct': 0.07237476162869393, 'tp_mult': 1.411453274040507, 'tsl_mult': 0.5801824481617183, 'strategy': 'mean_reversion', 'time_stop': 283, 'use_sma': False, 'use_atr': False, 'use_adx': False, 'use_ema': False, 'use_spike': False, 'rsi_required': False, 'edge_k': 1.4345641453614715, 'edge_cap': 0.17949139536981726}.
[I 2025-08-29 23:22:04,583] Trial 953 finished with values: [-1000000000.0, 1000000000.0] and parameters: {'p_sma': 29, 'p_std': 59, 'p_atr': 11, 'p_adx': 14, 'rsi_period': 42, 'ema1': 30, 'ema2': 21, 'slip_atr_k': 0.2227946721639702, 'slip_spread_k': 0.2847831932619362, 'spread_hl_frac': 0.011571944585395863, 'bb_std_mult': 1.4214730548743861, 'rsi_os': 33, 'rsi_ob': 62, 'vol_spike': 0.23733654361903117, 'adx_thresh': 19.75704678706105, 'atr_min_pct': 0.003934107943988824, 'atr_max_pct': 0.07021291010795608, 'tp_mult': 2.339559012791728, 'tsl_mult': 0.5800796935844423, 'strategy': 'mean_reversion', 'time_stop': 181, 'use_sma': False, 'use_atr': False, 'use_adx': False, 'use_ema': False, 'use_spike': False, 'rsi_required': False, 'edge_k': 1.8576814511377076, 'edge_cap': 0.1840505939088784}.
[I 2025-08-29 23:22:04,730] Trial 955 finished with values: [-0.004574755797197572, 0.00453485982025834] and parameters: {'p_sma': 29, 'p_std': 15, 'p_atr': 12, 'p_adx': 13, 'rsi_period': 76, 'ema1': 30, 'ema2': 18, 'slip_atr_k': 0.2238203259627844, 'slip_spread_k': 0.30031139393636885, 'spread_hl_frac': 0.011496240481133659, 'bb_std_mult': 3.407279087535789, 'rsi_os': 34, 'rsi_ob': 62, 'vol_spike': 0.052721148884013025, 'adx_thresh': 19.733960099144717, 'atr_min_pct': 0.0034878192793855994, 'atr_max_pct': 0.07144026033694124, 'tp_mult': 1.8807050321914034, 'tsl_mult': 0.5770618523622173, 'strategy': 'mean_reversion', 'time_stop': 279, 'use_sma': False, 'use_atr': False, 'use_adx': False, 'use_ema': False, 'use_spike': False, 'rsi_required': False, 'edge_k': 1.8859540230460774, 'edge_cap': 0.9364607599026836}.
[I 2025-08-29 23:22:31,916] Trial 959 finished with values: [-1000000000.0, 1000000000.0] and parameters: {'p_sma': 28, 'p_std': 10, 'p_atr': 13, 'p_adx': 12, 'rsi_period': 10, 'ema1': 21, 'ema2': 27, 'slip_atr_k': 0.18724021060104784, 'slip_spread_k': 0.31200120717327096, 'spread_hl_frac': 0.013002007514805968, 'bb_std_mult': 1.3051561554872104, 'rsi_os': 47, 'rsi_ob': 63, 'vol_spike': 0.2797959981208193, 'adx_thresh': 21.483476918550615, 'atr_min_pct': 0.00881803877739272, 'atr_max_pct': 0.07287280111293981, 'tp_mult': 1.8324401689475054, 'tsl_mult': 0.7053634730341648, 'strategy': 'breakout', 'time_stop': 275, 'use_sma': False, 'use_atr': False, 'use_adx': False, 'use_ema': False, 'use_spike': False, 'rsi_required': False, 'edge_k': 1.9663054466712278, 'edge_cap': 0.3127171893002331}.
[I 2025-08-29 23:22:32,346] Trial 957 finished with values: [-1000000000.0, 1000000000.0] and parameters: {'p_sma': 29, 'p_std': 10, 'p_atr': 29, 'p_adx': 13, 'rsi_period': 10, 'ema1': 30, 'ema2': 19, 'slip_atr_k': 0.021926944237921592, 'slip_spread_k': 0.2960805395369659, 'spread_hl_frac': 0.047153916814784924, 'bb_std_mult': 3.4202931914547934, 'rsi_os': 32, 'rsi_ob': 63, 'vol_spike': 0.2818777383497256, 'adx_thresh': 23.15450325800466, 'atr_min_pct': 0.007396228884550096, 'atr_max_pct': 0.07347768669413815, 'tp_mult': 1.239653222337532, 'tsl_mult': 0.9996173656241818, 'strategy': 'mean_reversion', 'time_stop': 73, 'use_sma': False, 'use_atr': False, 'use_adx': False, 'use_ema': False, 'use_spike': False, 'rsi_required': False, 'edge_k': 1.6647073734126017, 'edge_cap': 0.6288160994514004}.
[I 2025-08-29 23:22:32,364] Trial 958 finished with values: [-1000000000.0, 1000000000.0] and parameters: {'p_sma': 29, 'p_std': 10, 'p_atr': 13, 'p_adx': 13, 'rsi_period': 75, 'ema1': 15, 'ema2': 51, 'slip_atr_k': 0.18713403550309549, 'slip_spread_k': 0.306669449970666, 'spread_hl_frac': 0.013830617985966425, 'bb_std_mult': 1.3301479549628843, 'rsi_os': 20, 'rsi_ob': 95, 'vol_spike': 0.018160358319797648, 'adx_thresh': 23.34302632248327, 'atr_min_pct': 0.005089268234275833, 'atr_max_pct': 0.07365704154704322, 'tp_mult': 2.611850957606008, 'tsl_mult': 0.6981690032133857, 'strategy': 'mean_reversion', 'time_stop': 277, 'use_sma': False, 'use_atr': False, 'use_adx': False, 'use_ema': False, 'use_spike': False, 'rsi_required': False, 'edge_k': 1.998974848948678, 'edge_cap': 0.6289659092488655}.
[I 2025-08-29 23:22:32,495] Trial 956 finished with values: [-1000000000.0, 1000000000.0] and parameters: {'p_sma': 28, 'p_std': 10, 'p_atr': 29, 'p_adx': 13, 'rsi_period': 64, 'ema1': 30, 'ema2': 18, 'slip_atr_k': 0.005091199402522805, 'slip_spread_k': 0.2722227488299753, 'spread_hl_frac': 0.011150797262877205, 'bb_std_mult': 1.3963465474696604, 'rsi_os': 34, 'rsi_ob': 62, 'vol_spike': 0.2691045388560905, 'adx_thresh': 19.816250124356745, 'atr_min_pct': 0.005424129264832762, 'atr_max_pct': 0.07228927927188589, 'tp_mult': 1.2540381876096998, 'tsl_mult': 0.0399598921966246, 'strategy': 'mean_reversion', 'time_stop': 279, 'use_sma': False, 'use_atr': False, 'use_adx': False, 'use_ema': False, 'use_spike': False, 'rsi_required': False, 'edge_k': 1.8900745206666851, 'edge_cap': 0.18433390195377028}.
[I 2025-08-29 23:22:59,572] Trial 963 finished with values: [-1000000000.0, 1000000000.0] and parameters: {'p_sma': 31, 'p_std': 13, 'p_atr': 28, 'p_adx': 19, 'rsi_period': 12, 'ema1': 29, 'ema2': 58, 'slip_atr_k': 0.08714793619457503, 'slip_spread_k': 0.536195928197423, 'spread_hl_frac': 0.009995641252992956, 'bb_std_mult': 1.4735357609240496, 'rsi_os': 31, 'rsi_ob': 60, 'vol_spike': 0.10723303537521013, 'adx_thresh': 10.016442212760923, 'atr_min_pct': 0.014292756838919406, 'atr_max_pct': 0.0696033116499452, 'tp_mult': 1.81257362115669, 'tsl_mult': 0.6474506688421506, 'strategy': 'breakout', 'time_stop': 288, 'use_sma': False, 'use_atr': False, 'use_adx': False, 'use_ema': False, 'use_spike': False, 'rsi_required': False, 'edge_k': 0.00041045720879506753, 'edge_cap': 0.21488157852512457}.
[I 2025-08-29 23:23:00,124] Trial 960 finished with values: [-1000000000.0, 1000000000.0] and parameters: {'p_sma': 30, 'p_std': 13, 'p_atr': 13, 'p_adx': 13, 'rsi_period': 12, 'ema1': 30, 'ema2': 16, 'slip_atr_k': 0.007970186355183517, 'slip_spread_k': 0.5299200206357947, 'spread_hl_frac': 0.04876718895656324, 'bb_std_mult': 1.4863239727183764, 'rsi_os': 32, 'rsi_ob': 60, 'vol_spike': 0.27190283042567476, 'adx_thresh': 23.235469078548064, 'atr_min_pct': 0.005273309863812416, 'atr_max_pct': 0.07403597844318761, 'tp_mult': 1.986019094330262, 'tsl_mult': 0.89368348441609, 'strategy': 'mean_reversion', 'time_stop': 74, 'use_sma': False, 'use_atr': False, 'use_adx': False, 'use_ema': False, 'use_spike': False, 'rsi_required': False, 'edge_k': 0.614448541510694, 'edge_cap': 0.21601903118013926}.
[I 2025-08-29 23:23:00,467] Trial 962 finished with values: [-1000000000.0, 1000000000.0] and parameters: {'p_sma': 30, 'p_std': 46, 'p_atr': 7, 'p_adx': 28, 'rsi_period': 13, 'ema1': 29, 'ema2': 16, 'slip_atr_k': 0.004730759101161542, 'slip_spread_k': 0.2598774625934763, 'spread_hl_frac': 0.009920600882515625, 'bb_std_mult': 1.2049681309227132, 'rsi_os': 43, 'rsi_ob': 60, 'vol_spike': 0.10446717039660033, 'adx_thresh': 28.468242547410252, 'atr_min_pct': 0.01577564506403066, 'atr_max_pct': 0.0690929533799814, 'tp_mult': 2.9998556597336967, 'tsl_mult': 0.6287923235041388, 'strategy': 'breakout', 'time_stop': 46, 'use_sma': False, 'use_atr': False, 'use_adx': False, 'use_ema': False, 'use_spike': False, 'rsi_required': False, 'edge_k': 1.104798217870473, 'edge_cap': 0.12035070495531254}.
[I 2025-08-29 23:23:00,550] Trial 961 finished with values: [-1000000000.0, 1000000000.0] and parameters: {'p_sma': 31, 'p_std': 13, 'p_atr': 12, 'p_adx': 12, 'rsi_period': 12, 'ema1': 29, 'ema2': 23, 'slip_atr_k': 0.0043593699649376455, 'slip_spread_k': 0.25677479115663826, 'spread_hl_frac': 0.010305989145187724, 'bb_std_mult': 1.4652146830161459, 'rsi_os': 32, 'rsi_ob': 90, 'vol_spike': 0.2088505050005, 'adx_thresh': 22.407089429837704, 'atr_min_pct': 0.015819160436892913, 'atr_max_pct': 0.06921137621480175, 'tp_mult': 1.9872663383826135, 'tsl_mult': 0.6289462584932016, 'strategy': 'breakout', 'time_stop': 287, 'use_sma': False, 'use_atr': False, 'use_adx': False, 'use_ema': False, 'use_spike': False, 'rsi_required': False, 'edge_k': 1.9025573787256413, 'edge_cap': 0.15431099433121376}.
[I 2025-08-29 23:23:00,840] Trial 965 finished with values: [-1000000000.0, 1000000000.0] and parameters: {'p_sma': 30, 'p_std': 12, 'p_atr': 12, 'p_adx': 26, 'rsi_period': 14, 'ema1': 13, 'ema2': 23, 'slip_atr_k': 0.2498302161631519, 'slip_spread_k': 0.2743411452977828, 'spread_hl_frac': 0.006435308700540068, 'bb_std_mult': 2.6297970190689783, 'rsi_os': 52, 'rsi_ob': 91, 'vol_spike': 0.22690449540970567, 'adx_thresh': 22.246608138839356, 'atr_min_pct': 0.015379613816372819, 'atr_max_pct': 0.06836067710967243, 'tp_mult': 2.0256586234697167, 'tsl_mult': 0.6233551215957809, 'strategy': 'mean_reversion', 'time_stop': 287, 'use_sma': False, 'use_atr': False, 'use_adx': False, 'use_ema': False, 'use_spike': False, 'rsi_required': False, 'edge_k': 1.9208523323293911, 'edge_cap': 0.1586405323938538}.
[I 2025-08-29 23:23:00,862] Trial 966 finished with values: [-1000000000.0, 1000000000.0] and parameters: {'p_sma': 28, 'p_std': 50, 'p_atr': 12, 'p_adx': 26, 'rsi_period': 9, 'ema1': 13, 'ema2': 55, 'slip_atr_k': 0.0003029435679358414, 'slip_spread_k': 0.26637034858074404, 'spread_hl_frac': 0.043665471498033126, 'bb_std_mult': 1.3313019882648718, 'rsi_os': 52, 'rsi_ob': 69, 'vol_spike': 0.04006045242793546, 'adx_thresh': 22.36233835686748, 'atr_min_pct': 0.009730924260868742, 'atr_max_pct': 0.06841891288753707, 'tp_mult': 2.0217751732955045, 'tsl_mult': 0.6180549583077888, 'strategy': 'mean_reversion', 'time_stop': 288, 'use_sma': False, 'use_atr': False, 'use_adx': False, 'use_ema': False, 'use_spike': False, 'rsi_required': False, 'edge_k': 0.1763252962914187, 'edge_cap': 0.15186753662114771}.
[I 2025-08-29 23:23:26,721] Trial 967 finished with values: [-1000000000.0, 1000000000.0] and parameters: {'p_sma': 27, 'p_std': 11, 'p_atr': 12, 'p_adx': 7, 'rsi_period': 10, 'ema1': 30, 'ema2': 49, 'slip_atr_k': 0.014050010548869547, 'slip_spread_k': 0.268586165545234, 'spread_hl_frac': 0.0009351865685735955, 'bb_std_mult': 1.304316201162492, 'rsi_os': 34, 'rsi_ob': 58, 'vol_spike': 0.22597117357019236, 'adx_thresh': 20.493006692632278, 'atr_min_pct': 0.017993782108396136, 'atr_max_pct': 0.0677866715888146, 'tp_mult': 1.930491606142297, 'tsl_mult': 0.614771469590475, 'strategy': 'mean_reversion', 'time_stop': 176, 'use_sma': False, 'use_atr': False, 'use_adx': False, 'use_ema': False, 'use_spike': False, 'rsi_required': False, 'edge_k': 1.9447920749684882, 'edge_cap': 0.19556680889813732}.
[I 2025-08-29 23:23:26,872] Trial 964 finished with values: [-1000000000.0, 1000000000.0] and parameters: {'p_sma': 28, 'p_std': 12, 'p_atr': 7, 'p_adx': 26, 'rsi_period': 12, 'ema1': 22, 'ema2': 49, 'slip_atr_k': 2.388357158281427e-05, 'slip_spread_k': 0.2646272979977423, 'spread_hl_frac': 0.0011037790216194485, 'bb_std_mult': 1.182945984782815, 'rsi_os': 32, 'rsi_ob': 59, 'vol_spike': 0.2912095055138322, 'adx_thresh': 22.353997623770926, 'atr_min_pct': 0.0181802771620397, 'atr_max_pct': 0.06845976968947845, 'tp_mult': 1.9817471934801132, 'tsl_mult': 0.6233689188089556, 'strategy': 'mean_reversion', 'time_stop': 146, 'use_sma': False, 'use_atr': False, 'use_adx': False, 'use_ema': False, 'use_spike': False, 'rsi_required': False, 'edge_k': 0.6004289538870491, 'edge_cap': 0.8486170824712447}.
[I 2025-08-29 23:23:28,077] Trial 968 finished with values: [-1000000000.0, 1000000000.0] and parameters: {'p_sma': 28, 'p_std': 21, 'p_atr': 26, 'p_adx': 20, 'rsi_period': 9, 'ema1': 30, 'ema2': 54, 'slip_atr_k': 0.012894092151650173, 'slip_spread_k': 0.2689585085892263, 'spread_hl_frac': 0.04370648245822151, 'bb_std_mult': 1.3374784364831696, 'rsi_os': 34, 'rsi_ob': 58, 'vol_spike': 0.23751235877450272, 'adx_thresh': 20.462419697304362, 'atr_min_pct': 0.00983909578432526, 'atr_max_pct': 0.0730019309570165, 'tp_mult': 1.9301867419328214, 'tsl_mult': 0.6086037039270777, 'strategy': 'mean_reversion', 'time_stop': 266, 'use_sma': False, 'use_atr': False, 'use_adx': False, 'use_ema': False, 'use_spike': False, 'rsi_required': False, 'edge_k': 1.9547383448252267, 'edge_cap': 0.8416762570786693}.
[I 2025-08-29 23:23:28,311] Trial 969 finished with values: [-1000000000.0, 1000000000.0] and parameters: {'p_sma': 27, 'p_std': 21, 'p_atr': 18, 'p_adx': 7, 'rsi_period': 52, 'ema1': 20, 'ema2': 49, 'slip_atr_k': 0.013646139668666572, 'slip_spread_k': 0.30359627360036484, 'spread_hl_frac': 0.012432589394048546, 'bb_std_mult': 1.2893368082307661, 'rsi_os': 34, 'rsi_ob': 68, 'vol_spike': 0.06418400098415807, 'adx_thresh': 20.352456704649413, 'atr_min_pct': 0.0167685064375358, 'atr_max_pct': 0.07341826654393506, 'tp_mult': 2.4861560507169633, 'tsl_mult': 0.6672111233080683, 'strategy': 'mean_reversion', 'time_stop': 209, 'use_sma': False, 'use_atr': False, 'use_adx': False, 'use_ema': False, 'use_spike': False, 'rsi_required': False, 'edge_k': 1.9996004373471128, 'edge_cap': 0.8384355025252755}.
[I 2025-08-29 23:23:55,502] Trial 972 finished with values: [-0.008548957306722338, 0.00850842402521992] and parameters: {'p_sma': 31, 'p_std': 14, 'p_atr': 11, 'p_adx': 14, 'rsi_period': 52, 'ema1': 10, 'ema2': 26, 'slip_atr_k': 0.16247276623069123, 'slip_spread_k': 0.9054245703721803, 'spread_hl_frac': 0.012421779826159444, 'bb_std_mult': 3.234986591817929, 'rsi_os': 49, 'rsi_ob': 63, 'vol_spike': 0.2694985921978977, 'adx_thresh': 21.446410183438555, 'atr_min_pct': 0.004517993916840897, 'atr_max_pct': 0.0734761121697982, 'tp_mult': 1.8576273779716126, 'tsl_mult': 0.19931929298508327, 'strategy': 'mean_reversion', 'time_stop': 123, 'use_sma': False, 'use_atr': False, 'use_adx': False, 'use_ema': False, 'use_spike': False, 'rsi_required': False, 'edge_k': 0.8224391764037533, 'edge_cap': 0.8996988238610446}.
[I 2025-08-29 23:23:55,793] Trial 973 finished with values: [-1000000000.0, 1000000000.0] and parameters: {'p_sma': 31, 'p_std': 14, 'p_atr': 13, 'p_adx': 14, 'rsi_period': 11, 'ema1': 10, 'ema2': 26, 'slip_atr_k': 0.009773430827169595, 'slip_spread_k': 0.2966272013185414, 'spread_hl_frac': 0.022305627335861063, 'bb_std_mult': 1.3916128901957534, 'rsi_os': 31, 'rsi_ob': 93, 'vol_spike': 0.1408120634247212, 'adx_thresh': 21.565257812302626, 'atr_min_pct': 0.02387792399581636, 'atr_max_pct': 0.07096536959875954, 'tp_mult': 1.8791543174015122, 'tsl_mult': 0.11940672043307077, 'strategy': 'breakout', 'time_stop': 126, 'use_sma': False, 'use_atr': False, 'use_adx': False, 'use_ema': False, 'use_spike': False, 'rsi_required': False, 'edge_k': 1.9355976273343927, 'edge_cap': 0.0688969869473064}.
