[I 2025-08-29 22:41:56,248] Trial 568 finished with values: [-1000000000.0, 1000000000.0] and parameters: {'p_sma': 32, 'p_std': 10, 'p_atr': 11, 'p_adx': 15, 'rsi_period': 9, 'ema1': 29, 'ema2': 13, 'slip_atr_k': 0.005554822445816562, 'slip_spread_k': 0.789734402944184, 'spread_hl_frac': 0.010399294316186334, 'bb_std_mult': 2.877179643477031, 'rsi_os': 30, 'rsi_ob': 57, 'vol_spike': 0.2711210326088648, 'adx_thresh': 21.87505670330234, 'atr_min_pct': 0.006738644377047846, 'atr_max_pct': 0.04666323976766001, 'tp_mult': 2.390231060568574, 'tsl_mult': 0.7888831228370697, 'strategy': 'mean_reversion', 'time_stop': 261, 'use_sma': False, 'use_atr': False, 'use_adx': False, 'use_ema': False, 'use_spike': False, 'rsi_required': False, 'edge_k': 0.7031700905099467, 'edge_cap': 0.2723763490516559}.
[I 2025-08-29 22:41:56,710] Trial 565 finished with values: [-1000000000.0, 1000000000.0] and parameters: {'p_sma': 25, 'p_std': 15, 'p_atr': 10, 'p_adx': 7, 'rsi_period': 7, 'ema1': 15, 'ema2': 10, 'slip_atr_k': 0.006988554229500221, 'slip_spread_k': 0.47752876597129384, 'spread_hl_frac': 0.009243719151712841, 'bb_std_mult': 2.8783893816528243, 'rsi_os': 31, 'rsi_ob': 58, 'vol_spike': 0.2653555993396682, 'adx_thresh': 30.32873508572773, 'atr_min_pct': 0.011620291285420446, 'atr_max_pct': 0.13886170091176306, 'tp_mult': 2.3972352551499925, 'tsl_mult': 0.5850980212950805, 'strategy': 'breakout', 'time_stop': 276, 'use_sma': False, 'use_atr': False, 'use_adx': False, 'use_ema': False, 'use_spike': False, 'rsi_required': False, 'edge_k': 1.7161037717869518, 'edge_cap': 0.2395040564237513}.
[I 2025-08-29 22:41:56,723] Trial 566 finished with values: [-1000000000.0, 1000000000.0] and parameters: {'p_sma': 25, 'p_std': 10, 'p_atr': 10, 'p_adx': 23, 'rsi_period': 8, 'ema1': 21, 'ema2': 12, 'slip_atr_k': 0.008923821739979371, 'slip_spread_k': 0.10361054975256723, 'spread_hl_frac': 0.004164945648144028, 'bb_std_mult': 2.950859933597476, 'rsi_os': 52, 'rsi_ob': 54, 'vol_spike': 0.26339822043032146, 'adx_thresh': 19.941780504050993, 'atr_min_pct': 0.011379371503436157, 'atr_max_pct': 0.13911166918021475, 'tp_mult': 2.104154156861171, 'tsl_mult': 0.5303889301587345, 'strategy': 'breakout', 'time_stop': 262, 'use_sma': False, 'use_atr': False, 'use_adx': False, 'use_ema': False, 'use_spike': False, 'rsi_required': False, 'edge_k': 1.5665770106354469, 'edge_cap': 0.25499450666018986}.
[I 2025-08-29 22:41:57,320] Trial 570 finished with values: [-1000000000.0, 1000000000.0] and parameters: {'p_sma': 23, 'p_std': 10, 'p_atr': 11, 'p_adx': 23, 'rsi_period': 11, 'ema1': 29, 'ema2': 38, 'slip_atr_k': 0.08673423681784254, 'slip_spread_k': 0.8389727667458401, 'spread_hl_frac': 0.011107381553250079, 'bb_std_mult': 3.464792129724602, 'rsi_os': 16, 'rsi_ob': 60, 'vol_spike': 0.25490592973299436, 'adx_thresh': 12.70552763194381, 'atr_min_pct': 0.005008200620586872, 'atr_max_pct': 0.0697716448676284, 'tp_mult': 1.9364179631164826, 'tsl_mult': 0.704214251470802, 'strategy': 'mean_reversion', 'time_stop': 283, 'use_sma': False, 'use_atr': False, 'use_adx': False, 'use_ema': False, 'use_spike': False, 'rsi_required': False, 'edge_k': 0.10109363732073817, 'edge_cap': 0.1916092247665463}.
[I 2025-08-29 22:41:57,512] Trial 571 finished with values: [-1000000000.0, 1000000000.0] and parameters: {'p_sma': 38, 'p_std': 20, 'p_atr': 12, 'p_adx': 23, 'rsi_period': 48, 'ema1': 22, 'ema2': 10, 'slip_atr_k': 0.008948870950883477, 'slip_spread_k': 0.2840232743012996, 'spread_hl_frac': 0.011429585187692002, 'bb_std_mult': 2.94521032327022, 'rsi_os': 48, 'rsi_ob': 46, 'vol_spike': 0.25587933641142296, 'adx_thresh': 30.038104984208896, 'atr_min_pct': 0.013585437756480549, 'atr_max_pct': 0.14539339275641316, 'tp_mult': 1.9196747334765663, 'tsl_mult': 0.5173305667896904, 'strategy': 'mean_reversion', 'time_stop': 19, 'use_sma': False, 'use_atr': False, 'use_adx': False, 'use_ema': False, 'use_spike': False, 'rsi_required': False, 'edge_k': 1.5333992563861163, 'edge_cap': 0.191907415717926}.
[I 2025-08-29 22:41:57,534] Trial 573 finished with values: [-1000000000.0, 1000000000.0] and parameters: {'p_sma': 37, 'p_std': 12, 'p_atr': 8, 'p_adx': 23, 'rsi_period': 11, 'ema1': 22, 'ema2': 11, 'slip_atr_k': 0.2134035202489437, 'slip_spread_k': 0.8423138357161237, 'spread_hl_frac': 0.04721134444209626, 'bb_std_mult': 3.107052294445989, 'rsi_os': 34, 'rsi_ob': 46, 'vol_spike': 0.1831577133857047, 'adx_thresh': 20.6981873209284, 'atr_min_pct': 9.518442275618932e-07, 'atr_max_pct': 0.1455057102816177, 'tp_mult': 2.617364132174327, 'tsl_mult': 0.6210838446876569, 'strategy': 'mean_reversion', 'time_stop': 73, 'use_sma': False, 'use_atr': False, 'use_adx': False, 'use_ema': False, 'use_spike': False, 'rsi_required': False, 'edge_k': 1.2687666725007753, 'edge_cap': 0.1920125595141239}.
[I 2025-08-29 22:41:57,553] Trial 574 finished with values: [-1000000000.0, 1000000000.0] and parameters: {'p_sma': 29, 'p_std': 12, 'p_atr': 14, 'p_adx': 29, 'rsi_period': 11, 'ema1': 26, 'ema2': 11, 'slip_atr_k': 0.003763869644000525, 'slip_spread_k': 0.36655173043151007, 'spread_hl_frac': 0.012912855105276304, 'bb_std_mult': 3.108845520114081, 'rsi_os': 45, 'rsi_ob': 48, 'vol_spike': 0.1882795498135612, 'adx_thresh': 20.812109425157573, 'atr_min_pct': 0.013828157652189756, 'atr_max_pct': 0.03438589183008718, 'tp_mult': 1.6219224246670765, 'tsl_mult': 0.7349105476405143, 'strategy': 'mean_reversion', 'time_stop': 54, 'use_sma': False, 'use_atr': False, 'use_adx': False, 'use_ema': False, 'use_spike': False, 'rsi_required': False, 'edge_k': 1.2277558123513466, 'edge_cap': 0.19956198353795723}.
[I 2025-08-29 22:42:23,719] Trial 572 finished with values: [0.0008559751024741491, 0.00039294234471213147] and parameters: {'p_sma': 29, 'p_std': 12, 'p_atr': 12, 'p_adx': 13, 'rsi_period': 11, 'ema1': 30, 'ema2': 21, 'slip_atr_k': 0.00036776750823600446, 'slip_spread_k': 0.2824610693959856, 'spread_hl_frac': 0.011458252292047475, 'bb_std_mult': 1.3567731155169542, 'rsi_os': 33, 'rsi_ob': 62, 'vol_spike': 0.2548076226284453, 'adx_thresh': 20.957711457937858, 'atr_min_pct': 0.005043263941099074, 'atr_max_pct': 0.07096347843470481, 'tp_mult': 1.9292366801494394, 'tsl_mult': 0.6234671218355805, 'strategy': 'mean_reversion', 'time_stop': 284, 'use_sma': False, 'use_atr': False, 'use_adx': False, 'use_ema': False, 'use_spike': False, 'rsi_required': False, 'edge_k': 1.948777433701144, 'edge_cap': 0.18522944285150417}.
[I 2025-08-29 22:42:25,057] Trial 575 finished with values: [-1000000000.0, 1000000000.0] and parameters: {'p_sma': 32, 'p_std': 12, 'p_atr': 14, 'p_adx': 23, 'rsi_period': 11, 'ema1': 20, 'ema2': 11, 'slip_atr_k': 0.23648688969191317, 'slip_spread_k': 0.8219681118769617, 'spread_hl_frac': 0.02942260521290102, 'bb_std_mult': 3.10152650728851, 'rsi_os': 12, 'rsi_ob': 62, 'vol_spike': 0.15373754808525886, 'adx_thresh': 20.894249852239433, 'atr_min_pct': 0.029395577966912195, 'atr_max_pct': 0.07915128551664681, 'tp_mult': 2.059484613794031, 'tsl_mult': 0.7318812878442091, 'strategy': 'mean_reversion', 'time_stop': 244, 'use_sma': False, 'use_atr': False, 'use_adx': False, 'use_ema': False, 'use_spike': False, 'rsi_required': False, 'edge_k': 1.9430779339703086, 'edge_cap': 0.07030365501480418}.
[I 2025-08-29 22:42:25,752] Trial 577 finished with values: [-1000000000.0, 1000000000.0] and parameters: {'p_sma': 32, 'p_std': 11, 'p_atr': 26, 'p_adx': 22, 'rsi_period': 9, 'ema1': 25, 'ema2': 49, 'slip_atr_k': 0.004239738425748504, 'slip_spread_k': 0.13031643952312177, 'spread_hl_frac': 0.011607823121329217, 'bb_std_mult': 1.2316013143649878, 'rsi_os': 12, 'rsi_ob': 62, 'vol_spike': 0.2759705518864157, 'adx_thresh': 21.73392986250539, 'atr_min_pct': 0.029496546172558525, 'atr_max_pct': 0.14212945140361924, 'tp_mult': 1.4555435466962932, 'tsl_mult': 0.5466768727808695, 'strategy': 'mean_reversion', 'time_stop': 227, 'use_sma': False, 'use_atr': False, 'use_adx': False, 'use_ema': False, 'use_spike': False, 'rsi_required': False, 'edge_k': 1.088090298641494, 'edge_cap': 0.2745735377832375}.
[I 2025-08-29 22:42:25,860] Trial 576 finished with values: [-1000000000.0, 1000000000.0] and parameters: {'p_sma': 33, 'p_std': 17, 'p_atr': 17, 'p_adx': 22, 'rsi_period': 41, 'ema1': 20, 'ema2': 23, 'slip_atr_k': 0.12435888401025384, 'slip_spread_k': 0.36752051739325275, 'spread_hl_frac': 0.013082225265631613, 'bb_std_mult': 3.0779702661017754, 'rsi_os': 32, 'rsi_ob': 62, 'vol_spike': 0.2751978848525657, 'adx_thresh': 21.44773981272281, 'atr_min_pct': 0.008005304806529074, 'atr_max_pct': 0.13452299695887435, 'tp_mult': 1.6058532748400713, 'tsl_mult': 0.7455982024543839, 'strategy': 'mean_reversion', 'time_stop': 55, 'use_sma': False, 'use_atr': False, 'use_adx': False, 'use_ema': False, 'use_spike': False, 'rsi_required': False, 'edge_k': 1.94846807023034, 'edge_cap': 0.30077849135061385}.
[I 2025-08-29 22:42:53,210] Trial 578 finished with values: [-1000000000.0, 1000000000.0] and parameters: {'p_sma': 21, 'p_std': 17, 'p_atr': 13, 'p_adx': 14, 'rsi_period': 15, 'ema1': 30, 'ema2': 23, 'slip_atr_k': 0.23174365388714918, 'slip_spread_k': 0.24412530304809754, 'spread_hl_frac': 0.0022132077028629224, 'bb_std_mult': 1.230619166020776, 'rsi_os': 36, 'rsi_ob': 63, 'vol_spike': 0.2549594843831584, 'adx_thresh': 20.431075714668882, 'atr_min_pct': 0.008172108965200747, 'atr_max_pct': 0.07513441036980757, 'tp_mult': 1.8708175668866498, 'tsl_mult': 0.6415697993759952, 'strategy': 'mean_reversion', 'time_stop': 286, 'use_sma': False, 'use_atr': False, 'use_adx': False, 'use_ema': False, 'use_spike': False, 'rsi_required': False, 'edge_k': 1.9467949834485667, 'edge_cap': 0.1449334159405588}.
[I 2025-08-29 22:42:53,616] Trial 580 finished with values: [-1000000000.0, 1000000000.0] and parameters: {'p_sma': 20, 'p_std': 14, 'p_atr': 13, 'p_adx': 14, 'rsi_period': 16, 'ema1': 30, 'ema2': 21, 'slip_atr_k': 0.08048114269742793, 'slip_spread_k': 0.27430332790705253, 'spread_hl_frac': 0.013145903241267028, 'bb_std_mult': 1.394443717515355, 'rsi_os': 35, 'rsi_ob': 64, 'vol_spike': 0.2436523921779282, 'adx_thresh': 20.172414858630905, 'atr_min_pct': 0.008279999264004873, 'atr_max_pct': 0.07245285329592885, 'tp_mult': 1.8793579295746237, 'tsl_mult': 0.6463724447265372, 'strategy': 'mean_reversion', 'time_stop': 286, 'use_sma': False, 'use_atr': False, 'use_adx': False, 'use_ema': False, 'use_spike': False, 'rsi_required': False, 'edge_k': 1.9512798789982324, 'edge_cap': 0.12099928097764515}.
[I 2025-08-29 22:42:53,709] Trial 579 finished with values: [-1000000000.0, 1000000000.0] and parameters: {'p_sma': 21, 'p_std': 22, 'p_atr': 13, 'p_adx': 14, 'rsi_period': 16, 'ema1': 30, 'ema2': 21, 'slip_atr_k': 0.12405213654752525, 'slip_spread_k': 0.27007683147784356, 'spread_hl_frac': 0.012601561275699063, 'bb_std_mult': 1.2170903735385856, 'rsi_os': 36, 'rsi_ob': 64, 'vol_spike': 0.24377058528637785, 'adx_thresh': 20.057811146549472, 'atr_min_pct': 0.015549341171485936, 'atr_max_pct': 0.07109267824363275, 'tp_mult': 1.859696255575443, 'tsl_mult': 0.637635195430126, 'strategy': 'mean_reversion', 'time_stop': 283, 'use_sma': False, 'use_atr': False, 'use_adx': False, 'use_ema': False, 'use_spike': False, 'rsi_required': False, 'edge_k': 1.9557274097733734, 'edge_cap': 0.12507654460029233}.
[I 2025-08-29 22:42:53,879] Trial 581 finished with values: [-1000000000.0, 1000000000.0] and parameters: {'p_sma': 21, 'p_std': 14, 'p_atr': 13, 'p_adx': 13, 'rsi_period': 14, 'ema1': 30, 'ema2': 21, 'slip_atr_k': 0.10673419292055011, 'slip_spread_k': 0.24262489215301872, 'spread_hl_frac': 0.023505846362114592, 'bb_std_mult': 1.1694815122642563, 'rsi_os': 36, 'rsi_ob': 64, 'vol_spike': 0.24357307767379588, 'adx_thresh': 20.343244558449605, 'atr_min_pct': 0.015247153377807498, 'atr_max_pct': 0.0703401869383059, 'tp_mult': 1.8648198862512082, 'tsl_mult': 0.6469166053181129, 'strategy': 'mean_reversion', 'time_stop': 285, 'use_sma': False, 'use_atr': False, 'use_adx': False, 'use_ema': False, 'use_spike': False, 'rsi_required': False, 'edge_k': 1.9549029292810765, 'edge_cap': 0.1239148053507893}.
[I 2025-08-29 22:43:21,407] Trial 584 finished with values: [-1000000000.0, 1000000000.0] and parameters: {'p_sma': 23, 'p_std': 13, 'p_atr': 14, 'p_adx': 13, 'rsi_period': 14, 'ema1': 30, 'ema2': 19, 'slip_atr_k': 0.0007938342011481322, 'slip_spread_k': 0.24593692150366692, 'spread_hl_frac': 0.021854323196587474, 'bb_std_mult': 1.5539818018846412, 'rsi_os': 36, 'rsi_ob': 64, 'vol_spike': 0.24873923238923953, 'adx_thresh': 19.422200677825696, 'atr_min_pct': 0.009345682114332593, 'atr_max_pct': 0.0669921281545905, 'tp_mult': 1.9459896283007052, 'tsl_mult': 0.6454051384536442, 'strategy': 'breakout', 'time_stop': 281, 'use_sma': False, 'use_atr': False, 'use_adx': False, 'use_ema': False, 'use_spike': False, 'rsi_required': False, 'edge_k': 1.9065931561821359, 'edge_cap': 0.14472620739263897}.
[I 2025-08-29 22:43:22,151] Trial 585 finished with values: [-1000000000.0, 1000000000.0] and parameters: {'p_sma': 24, 'p_std': 7, 'p_atr': 14, 'p_adx': 12, 'rsi_period': 14, 'ema1': 30, 'ema2': 24, 'slip_atr_k': 0.00023734795380947544, 'slip_spread_k': 0.3056215943717764, 'spread_hl_frac': 0.010382093704817484, 'bb_std_mult': 1.3587361460400589, 'rsi_os': 37, 'rsi_ob': 64, 'vol_spike': 0.2438155068228699, 'adx_thresh': 18.90936827257771, 'atr_min_pct': 0.018767965278860495, 'atr_max_pct': 0.06660681328989038, 'tp_mult': 1.974173057241861, 'tsl_mult': 0.6546084238657376, 'strategy': 'breakout', 'time_stop': 279, 'use_sma': False, 'use_atr': False, 'use_adx': False, 'use_ema': False, 'use_spike': False, 'rsi_required': False, 'edge_k': 1.9017889937664874, 'edge_cap': 0.13988456354699502}.
[I 2025-08-29 22:43:22,413] Trial 583 finished with values: [-1000000000.0, 1000000000.0] and parameters: {'p_sma': 23, 'p_std': 25, 'p_atr': 14, 'p_adx': 13, 'rsi_period': 14, 'ema1': 30, 'ema2': 22, 'slip_atr_k': 0.00033230920133541517, 'slip_spread_k': 0.313894406105173, 'spread_hl_frac': 0.01192187975835809, 'bb_std_mult': 1.6880355986871538, 'rsi_os': 36, 'rsi_ob': 64, 'vol_spike': 0.24916097577535234, 'adx_thresh': 5.736751637651528, 'atr_min_pct': 0.01503794164178434, 'atr_max_pct': 0.06719631534260029, 'tp_mult': 2.99818125416765, 'tsl_mult': 0.6513207134732769, 'strategy': 'breakout', 'time_stop': 282, 'use_sma': False, 'use_atr': False, 'use_adx': False, 'use_ema': False, 'use_spike': False, 'rsi_required': False, 'edge_k': 1.9156693758951777, 'edge_cap': 0.12733103548734892}.
[I 2025-08-29 22:43:22,426] Trial 582 finished with values: [-1000000000.0, 1000000000.0] and parameters: {'p_sma': 22, 'p_std': 13, 'p_atr': 13, 'p_adx': 13, 'rsi_period': 16, 'ema1': 30, 'ema2': 21, 'slip_atr_k': 0.0007291426886903954, 'slip_spread_k': 0.3009213716198442, 'spread_hl_frac': 0.04445620651576176, 'bb_std_mult': 1.400221198134056, 'rsi_os': 36, 'rsi_ob': 64, 'vol_spike': 0.24392099547921484, 'adx_thresh': 20.180611051052733, 'atr_min_pct': 0.014840751738035693, 'atr_max_pct': 0.07187257181330046, 'tp_mult': 1.9428349733670922, 'tsl_mult': 0.6513617233956893, 'strategy': 'breakout', 'time_stop': 284, 'use_sma': False, 'use_atr': False, 'use_adx': False, 'use_ema': False, 'use_spike': False, 'rsi_required': False, 'edge_k': 1.9126596835859575, 'edge_cap': 0.10947335622818272}.
[I 2025-08-29 22:43:50,164] Trial 589 finished with values: [-1000000000.0, 1000000000.0] and parameters: {'p_sma': 16, 'p_std': 12, 'p_atr': 15, 'p_adx': 12, 'rsi_period': 13, 'ema1': 29, 'ema2': 17, 'slip_atr_k': 0.012381201240653172, 'slip_spread_k': 0.21782102930375613, 'spread_hl_frac': 0.011114388562933718, 'bb_std_mult': 1.46002774023408, 'rsi_os': 35, 'rsi_ob': 66, 'vol_spike': 0.24764302867237192, 'adx_thresh': 21.045881206280008, 'atr_min_pct': 0.012935198532212255, 'atr_max_pct': 0.07698960774583684, 'tp_mult': 1.9094256674610628, 'tsl_mult': 0.6296700021542039, 'strategy': 'mean_reversion', 'time_stop': 290, 'use_sma': False, 'use_atr': False, 'use_adx': False, 'use_ema': False, 'use_spike': False, 'rsi_required': False, 'edge_k': 1.9915560839873199, 'edge_cap': 0.1679575156495221}.
[I 2025-08-29 22:43:50,600] Trial 588 finished with values: [-1000000000.0, 1000000000.0] and parameters: {'p_sma': 16, 'p_std': 57, 'p_atr': 15, 'p_adx': 12, 'rsi_period': 14, 'ema1': 29, 'ema2': 17, 'slip_atr_k': 0.009006971619842569, 'slip_spread_k': 0.2182422663785109, 'spread_hl_frac': 0.011120599395964652, 'bb_std_mult': 1.4807550868891213, 'rsi_os': 38, 'rsi_ob': 63, 'vol_spike': 0.25069264090350113, 'adx_thresh': 21.26064584241987, 'atr_min_pct': 0.010044226847493922, 'atr_max_pct': 0.07666925661285086, 'tp_mult': 1.0496086957716217, 'tsl_mult': 0.6230928098546292, 'strategy': 'mean_reversion', 'time_stop': 290, 'use_sma': False, 'use_atr': False, 'use_adx': False, 'use_ema': False, 'use_spike': False, 'rsi_required': False, 'edge_k': 1.9838914516093629, 'edge_cap': 0.16602106670288647}.
[I 2025-08-29 22:43:50,616] Trial 587 finished with values: [-1000000000.0, 1000000000.0] and parameters: {'p_sma': 23, 'p_std': 11, 'p_atr': 13, 'p_adx': 12, 'rsi_period': 13, 'ema1': 30, 'ema2': 17, 'slip_atr_k': 0.013074474018174286, 'slip_spread_k': 0.32236441558523304, 'spread_hl_frac': 0.011657598272189484, 'bb_std_mult': 1.688002204591198, 'rsi_os': 38, 'rsi_ob': 66, 'vol_spike': 0.2527386873394333, 'adx_thresh': 21.328474422563453, 'atr_min_pct': 0.007171488887122409, 'atr_max_pct': 0.07767399805253847, 'tp_mult': 1.909766619482068, 'tsl_mult': 0.6347496898105055, 'strategy': 'mean_reversion', 'time_stop': 291, 'use_sma': False, 'use_atr': False, 'use_adx': False, 'use_ema': False, 'use_spike': False, 'rsi_required': False, 'edge_k': 1.9913117067006068, 'edge_cap': 0.09691946314082922}.
[I 2025-08-29 22:43:50,759] Trial 586 finished with values: [-1000000000.0, 1000000000.0] and parameters: {'p_sma': 17, 'p_std': 8, 'p_atr': 14, 'p_adx': 12, 'rsi_period': 13, 'ema1': 30, 'ema2': 22, 'slip_atr_k': 0.012947807186176089, 'slip_spread_k': 0.30341127424853126, 'spread_hl_frac': 0.010297029018123995, 'bb_std_mult': 1.7024434324895465, 'rsi_os': 35, 'rsi_ob': 63, 'vol_spike': 0.24797526250181184, 'adx_thresh': 21.4503874941482, 'atr_min_pct': 0.028050455388422053, 'atr_max_pct': 0.07725993479738755, 'tp_mult': 1.9858671517604956, 'tsl_mult': 0.6560571752765045, 'strategy': 'breakout', 'time_stop': 290, 'use_sma': False, 'use_atr': False, 'use_adx': False, 'use_ema': False, 'use_spike': False, 'rsi_required': False, 'edge_k': 1.8768268298105169, 'edge_cap': 0.16746212167667657}.
[I 2025-08-29 22:44:18,041] Trial 591 finished with values: [-1000000000.0, 1000000000.0] and parameters: {'p_sma': 26, 'p_std': 51, 'p_atr': 12, 'p_adx': 13, 'rsi_period': 13, 'ema1': 30, 'ema2': 25, 'slip_atr_k': 0.15844102804362628, 'slip_spread_k': 0.34045086679791453, 'spread_hl_frac': 0.009530877094801101, 'bb_std_mult': 1.3278235916323995, 'rsi_os': 35, 'rsi_ob': 63, 'vol_spike': 0.23977606318142755, 'adx_thresh': 22.22708537036995, 'atr_min_pct': 0.017940496526439767, 'atr_max_pct': 0.06977668963413873, 'tp_mult': 1.973698623675258, 'tsl_mult': 0.6776925379578298, 'strategy': 'mean_reversion', 'time_stop': 277, 'use_sma': False, 'use_atr': False, 'use_adx': False, 'use_ema': False, 'use_spike': False, 'rsi_required': False, 'edge_k': 1.8707459515159441, 'edge_cap': 0.16592834538543944}.
[I 2025-08-29 22:44:18,052] Trial 593 finished with values: [-1000000000.0, 1000000000.0] and parameters: {'p_sma': 27, 'p_std': 51, 'p_atr': 13, 'p_adx': 15, 'rsi_period': 12, 'ema1': 30, 'ema2': 27, 'slip_atr_k': 0.1468936661165617, 'slip_spread_k': 0.28304250781872975, 'spread_hl_frac': 0.046229528208925535, 'bb_std_mult': 1.277626176797209, 'rsi_os': 34, 'rsi_ob': 63, 'vol_spike': 0.24359690196259445, 'adx_thresh': 29.457857196802824, 'atr_min_pct': 0.023597701456647264, 'atr_max_pct': 0.08118174499059841, 'tp_mult': 1.990643694762257, 'tsl_mult': 0.6312025325025268, 'strategy': 'mean_reversion', 'time_stop': 278, 'use_sma': False, 'use_atr': False, 'use_adx': False, 'use_ema': False, 'use_spike': False, 'rsi_required': False, 'edge_k': 1.84607795647735, 'edge_cap': 0.16424382244019026}.
[I 2025-08-29 22:44:18,164] Trial 592 finished with values: [-1000000000.0, 1000000000.0] and parameters: {'p_sma': 26, 'p_std': 15, 'p_atr': 12, 'p_adx': 15, 'rsi_period': 13, 'ema1': 30, 'ema2': 25, 'slip_atr_k': 0.005627856907749741, 'slip_spread_k': 0.276277276483356, 'spread_hl_frac': 0.04637099842626352, 'bb_std_mult': 1.3015278721329404, 'rsi_os': 35, 'rsi_ob': 63, 'vol_spike': 0.24728689582454233, 'adx_thresh': 22.20216696914224, 'atr_min_pct': 0.005496648428199347, 'atr_max_pct': 0.08169286381030531, 'tp_mult': 1.9910621180675174, 'tsl_mult': 0.6805221564142684, 'strategy': 'mean_reversion', 'time_stop': 277, 'use_sma': False, 'use_atr': False, 'use_adx': False, 'use_ema': False, 'use_spike': False, 'rsi_required': False, 'edge_k': 1.8588817556283097, 'edge_cap': 0.16185470601911825}.
[I 2025-08-29 22:44:18,252] Trial 590 finished with values: [-1000000000.0, 1000000000.0] and parameters: {'p_sma': 26, 'p_std': 10, 'p_atr': 12, 'p_adx': 15, 'rsi_period': 13, 'ema1': 30, 'ema2': 18, 'slip_atr_k': 0.01128183649777416, 'slip_spread_k': 0.2801476866063299, 'spread_hl_frac': 0.0424221961482102, 'bb_std_mult': 1.3255236236795307, 'rsi_os': 37, 'rsi_ob': 63, 'vol_spike': 0.25132453034379904, 'adx_thresh': 29.41871828813322, 'atr_min_pct': 0.005407968838274593, 'atr_max_pct': 0.07473155788365972, 'tp_mult': 1.8219791151118134, 'tsl_mult': 0.6270967493963903, 'strategy': 'mean_reversion', 'time_stop': 289, 'use_sma': False, 'use_atr': False, 'use_adx': False, 'use_ema': False, 'use_spike': False, 'rsi_required': False, 'edge_k': 1.8532567696047233, 'edge_cap': 0.09433841040163292}.
