[I 2025-08-29 22:58:46,904] Trial 731 finished with values: [-1000000000.0, 1000000000.0] and parameters: {'p_sma': 28, 'p_std': 41, 'p_atr': 15, 'p_adx': 12, 'rsi_period': 60, 'ema1': 30, 'ema2': 20, 'slip_atr_k': 0.20805443850307126, 'slip_spread_k': 0.2774192269243412, 'spread_hl_frac': 0.002383073028279333, 'bb_std_mult': 1.6209380944048526, 'rsi_os': 11, 'rsi_ob': 60, 'vol_spike': 0.25290367454655677, 'adx_thresh': 22.098905429262693, 'atr_min_pct': 0.013652176034340036, 'atr_max_pct': 0.07113871737683138, 'tp_mult': 1.9835115733036088, 'tsl_mult': 0.3029300984122887, 'strategy': 'mean_reversion', 'time_stop': 300, 'use_sma': False, 'use_atr': False, 'use_adx': False, 'use_ema': False, 'use_spike': False, 'rsi_required': False, 'edge_k': 1.967890006737967, 'edge_cap': 0.2173268163851399}.
[I 2025-08-29 22:58:47,104] Trial 732 finished with values: [-1000000000.0, 1000000000.0] and parameters: {'p_sma': 38, 'p_std': 13, 'p_atr': 15, 'p_adx': 14, 'rsi_period': 10, 'ema1': 30, 'ema2': 47, 'slip_atr_k': 0.08265404851290609, 'slip_spread_k': 0.13653046138568908, 'spread_hl_frac': 0.014087838503303312, 'bb_std_mult': 1.6048749067300703, 'rsi_os': 11, 'rsi_ob': 86, 'vol_spike': 0.251842266783702, 'adx_thresh': 22.14552309284706, 'atr_min_pct': 0.011884285587093774, 'atr_max_pct': 0.07285129608948245, 'tp_mult': 2.271173324919557, 'tsl_mult': 0.15755853928930513, 'strategy': 'mean_reversion', 'time_stop': 299, 'use_sma': False, 'use_atr': False, 'use_adx': False, 'use_ema': False, 'use_spike': False, 'rsi_required': False, 'edge_k': 1.972408085854901, 'edge_cap': 0.40520096167852965}.
[I 2025-08-29 22:58:47,104] Trial 730 finished with values: [-1000000000.0, 1000000000.0] and parameters: {'p_sma': 12, 'p_std': 14, 'p_atr': 14, 'p_adx': 16, 'rsi_period': 41, 'ema1': 30, 'ema2': 19, 'slip_atr_k': 0.12730006865279136, 'slip_spread_k': 0.3467820886783701, 'spread_hl_frac': 0.03174073688852476, 'bb_std_mult': 2.1694754256361652, 'rsi_os': 48, 'rsi_ob': 86, 'vol_spike': 0.0427120042393368, 'adx_thresh': 5.9730179812833875, 'atr_min_pct': 0.024666511946051024, 'atr_max_pct': 0.0726856671136833, 'tp_mult': 1.9458356874017755, 'tsl_mult': 0.14521331628160872, 'strategy': 'mean_reversion', 'time_stop': 298, 'use_sma': False, 'use_atr': False, 'use_adx': False, 'use_ema': False, 'use_spike': False, 'rsi_required': False, 'edge_k': 1.9682082675497639, 'edge_cap': 0.21583147645247283}.
[I 2025-08-29 22:58:47,229] Trial 729 finished with values: [-1000000000.0, 1000000000.0] and parameters: {'p_sma': 32, 'p_std': 12, 'p_atr': 14, 'p_adx': 11, 'rsi_period': 14, 'ema1': 28, 'ema2': 21, 'slip_atr_k': 0.15976871605719375, 'slip_spread_k': 0.6345147980003718, 'spread_hl_frac': 0.010006298973469007, 'bb_std_mult': 2.184999368780191, 'rsi_os': 47, 'rsi_ob': 60, 'vol_spike': 0.25438891826610516, 'adx_thresh': 21.055575676370665, 'atr_min_pct': 0.019062921409566887, 'atr_max_pct': 0.026052194309880372, 'tp_mult': 1.995074852096743, 'tsl_mult': 0.6473338939303062, 'strategy': 'mean_reversion', 'time_stop': 283, 'use_sma': False, 'use_atr': False, 'use_adx': False, 'use_ema': False, 'use_spike': False, 'rsi_required': False, 'edge_k': 0.18840717291980646, 'edge_cap': 0.20609570388612075}.
[I 2025-08-29 22:58:47,453] Trial 734 finished with values: [-1000000000.0, 1000000000.0] and parameters: {'p_sma': 42, 'p_std': 18, 'p_atr': 26, 'p_adx': 29, 'rsi_period': 11, 'ema1': 30, 'ema2': 24, 'slip_atr_k': 0.0004988447776370155, 'slip_spread_k': 0.3318756754117044, 'spread_hl_frac': 0.009585110963035895, 'bb_std_mult': 1.9309759071050037, 'rsi_os': 9, 'rsi_ob': 60, 'vol_spike': 0.24933078446352963, 'adx_thresh': 9.272284703245754, 'atr_min_pct': 0.027538029854775305, 'atr_max_pct': 0.013266182347064878, 'tp_mult': 1.745847562549358, 'tsl_mult': 0.6256376243440923, 'strategy': 'mean_reversion', 'time_stop': 285, 'use_sma': False, 'use_atr': False, 'use_adx': False, 'use_ema': False, 'use_spike': False, 'rsi_required': False, 'edge_k': 0.7323803859279854, 'edge_cap': 0.6097901111907164}.
[I 2025-08-29 22:59:14,509] Trial 735 finished with values: [-0.022289757186755188, 0.022278770684953295] and parameters: {'p_sma': 55, 'p_std': 54, 'p_atr': 26, 'p_adx': 16, 'rsi_period': 17, 'ema1': 13, 'ema2': 24, 'slip_atr_k': 0.0045812511667685804, 'slip_spread_k': 0.6049182566533559, 'spread_hl_frac': 0.018787328742012097, 'bb_std_mult': 1.9144951509007053, 'rsi_os': 34, 'rsi_ob': 60, 'vol_spike': 0.06836780833069231, 'adx_thresh': 20.139918960717765, 'atr_min_pct': 0.0007614232997581261, 'atr_max_pct': 0.08543424675411374, 'tp_mult': 2.059954625901604, 'tsl_mult': 0.2284114830078129, 'strategy': 'mean_reversion', 'time_stop': 273, 'use_sma': False, 'use_atr': False, 'use_adx': False, 'use_ema': False, 'use_spike': False, 'rsi_required': False, 'edge_k': 1.9253603886365351, 'edge_cap': 0.18924133514116642}.
[I 2025-08-29 22:59:14,778] Trial 737 finished with values: [-1000000000.0, 1000000000.0] and parameters: {'p_sma': 18, 'p_std': 55, 'p_atr': 11, 'p_adx': 7, 'rsi_period': 11, 'ema1': 29, 'ema2': 16, 'slip_atr_k': 0.00010721560089917164, 'slip_spread_k': 0.2443245769478551, 'spread_hl_frac': 0.011837508474566343, 'bb_std_mult': 0.5663903386030796, 'rsi_os': 8, 'rsi_ob': 65, 'vol_spike': 0.18103387235513324, 'adx_thresh': 24.355045239076393, 'atr_min_pct': 0.029098132326966994, 'atr_max_pct': 0.08648272077775182, 'tp_mult': 2.0522180134656622, 'tsl_mult': 0.230126422266064, 'strategy': 'breakout', 'time_stop': 273, 'use_sma': False, 'use_atr': False, 'use_adx': False, 'use_ema': False, 'use_spike': False, 'rsi_required': False, 'edge_k': 1.9248835365849595, 'edge_cap': 0.1894151248898211}.
[I 2025-08-29 22:59:14,936] Trial 733 finished with values: [-1000000000.0, 1000000000.0] and parameters: {'p_sma': 38, 'p_std': 25, 'p_atr': 14, 'p_adx': 7, 'rsi_period': 10, 'ema1': 30, 'ema2': 19, 'slip_atr_k': 0.08626007720677584, 'slip_spread_k': 0.46418708577388684, 'spread_hl_frac': 0.011870882796322051, 'bb_std_mult': 1.2863062843061144, 'rsi_os': 9, 'rsi_ob': 94, 'vol_spike': 0.04082382258137486, 'adx_thresh': 5.760551408868963, 'atr_min_pct': 0.02445872880335454, 'atr_max_pct': 0.10420827202152728, 'tp_mult': 2.5232281379790007, 'tsl_mult': 0.14454111251134588, 'strategy': 'mean_reversion', 'time_stop': 286, 'use_sma': False, 'use_atr': False, 'use_adx': False, 'use_ema': False, 'use_spike': False, 'rsi_required': False, 'edge_k': 1.9988425641930911, 'edge_cap': 0.18356859654796995}.
[I 2025-08-29 22:59:14,936] Trial 736 finished with values: [-1000000000.0, 1000000000.0] and parameters: {'p_sma': 41, 'p_std': 55, 'p_atr': 30, 'p_adx': 13, 'rsi_period': 11, 'ema1': 30, 'ema2': 59, 'slip_atr_k': 0.18265542367051846, 'slip_spread_k': 0.46708179931857163, 'spread_hl_frac': 0.012022259174397318, 'bb_std_mult': 1.9187006907278943, 'rsi_os': 9, 'rsi_ob': 65, 'vol_spike': 0.1782513472052202, 'adx_thresh': 24.58545084210096, 'atr_min_pct': 0.01613016787372681, 'atr_max_pct': 0.08763413366624491, 'tp_mult': 1.7563009512969294, 'tsl_mult': 0.5975975035965476, 'strategy': 'breakout', 'time_stop': 287, 'use_sma': False, 'use_atr': False, 'use_adx': False, 'use_ema': False, 'use_spike': False, 'rsi_required': False, 'edge_k': 1.933978976356571, 'edge_cap': 0.3455919272464175}.
[I 2025-08-29 22:59:15,174] Trial 741 finished with values: [-1000000000.0, 1000000000.0] and parameters: {'p_sma': 36, 'p_std': 11, 'p_atr': 13, 'p_adx': 17, 'rsi_period': 12, 'ema1': 18, 'ema2': 37, 'slip_atr_k': 0.22085523100283044, 'slip_spread_k': 0.6703154741254763, 'spread_hl_frac': 0.013310696320438103, 'bb_std_mult': 2.410650103418548, 'rsi_os': 31, 'rsi_ob': 46, 'vol_spike': 0.25984365691882344, 'adx_thresh': 21.436286355457458, 'atr_min_pct': 0.009786005877082699, 'atr_max_pct': 0.06934391186804646, 'tp_mult': 2.68750160815961, 'tsl_mult': 0.6214103950473064, 'strategy': 'mean_reversion', 'time_stop': 266, 'use_sma': False, 'use_atr': False, 'use_adx': False, 'use_ema': False, 'use_spike': False, 'rsi_required': False, 'edge_k': 1.8741901318872405, 'edge_cap': 0.15114531063123743}.
[I 2025-08-29 22:59:15,280] Trial 742 finished with values: [-1000000000.0, 1000000000.0] and parameters: {'p_sma': 5, 'p_std': 14, 'p_atr': 19, 'p_adx': 10, 'rsi_period': 12, 'ema1': 29, 'ema2': 18, 'slip_atr_k': 0.2470219415046569, 'slip_spread_k': 0.285488333563737, 'spread_hl_frac': 0.007275727119887561, 'bb_std_mult': 1.0622773996892465, 'rsi_os': 39, 'rsi_ob': 48, 'vol_spike': 0.24217689785559043, 'adx_thresh': 20.273490270792827, 'atr_min_pct': 0.02996884037840266, 'atr_max_pct': 0.07783978198714571, 'tp_mult': 1.8201868546314877, 'tsl_mult': 0.6571200553886155, 'strategy': 'mean_reversion', 'time_stop': 293, 'use_sma': False, 'use_atr': False, 'use_adx': False, 'use_ema': False, 'use_spike': False, 'rsi_required': False, 'edge_k': 1.7304081656164672, 'edge_cap': 0.16281357590064832}.
[I 2025-08-29 22:59:41,732] Trial 739 finished with values: [-1000000000.0, 1000000000.0] and parameters: {'p_sma': 30, 'p_std': 52, 'p_atr': 13, 'p_adx': 10, 'rsi_period': 43, 'ema1': 18, 'ema2': 37, 'slip_atr_k': 0.1834060778137791, 'slip_spread_k': 0.4762533618151319, 'spread_hl_frac': 0.011287261890995354, 'bb_std_mult': 1.2592828433772008, 'rsi_os': 39, 'rsi_ob': 61, 'vol_spike': 0.25800589550945485, 'adx_thresh': 7.594251127123933, 'atr_min_pct': 0.016087817086113183, 'atr_max_pct': 0.07817719335328961, 'tp_mult': 1.8197438397423593, 'tsl_mult': 0.06848932082301501, 'strategy': 'breakout', 'time_stop': 289, 'use_sma': False, 'use_atr': False, 'use_adx': False, 'use_ema': False, 'use_spike': False, 'rsi_required': False, 'edge_k': 1.9986237158395201, 'edge_cap': 0.3440021052764892}.
[I 2025-08-29 22:59:42,059] Trial 738 finished with values: [-1000000000.0, 1000000000.0] and parameters: {'p_sma': 30, 'p_std': 11, 'p_atr': 11, 'p_adx': 17, 'rsi_period': 11, 'ema1': 29, 'ema2': 37, 'slip_atr_k': 0.18567947700470483, 'slip_spread_k': 0.24044342101474284, 'spread_hl_frac': 0.011740839389305117, 'bb_std_mult': 1.3005767599616311, 'rsi_os': 39, 'rsi_ob': 65, 'vol_spike': 0.2634611767654055, 'adx_thresh': 31.51614137190016, 'atr_min_pct': 0.01634213874389194, 'atr_max_pct': 0.06782308550030765, 'tp_mult': 1.8297708530921253, 'tsl_mult': 0.5958931775237247, 'strategy': 'breakout', 'time_stop': 287, 'use_sma': False, 'use_atr': False, 'use_adx': False, 'use_ema': False, 'use_spike': False, 'rsi_required': False, 'edge_k': 1.9990334604529567, 'edge_cap': 0.15351822999190518}.
[I 2025-08-29 22:59:42,538] Trial 740 finished with values: [-1000000000.0, 1000000000.0] and parameters: {'p_sma': 36, 'p_std': 11, 'p_atr': 27, 'p_adx': 17, 'rsi_period': 19, 'ema1': 29, 'ema2': 18, 'slip_atr_k': 0.1054868353041068, 'slip_spread_k': 0.9936283283307414, 'spread_hl_frac': 0.013547219732322575, 'bb_std_mult': 1.1724677899495952, 'rsi_os': 39, 'rsi_ob': 61, 'vol_spike': 0.26004399174254167, 'adx_thresh': 21.54798461810435, 'atr_min_pct': 0.009805674598044437, 'atr_max_pct': 0.07844558208964582, 'tp_mult': 1.8234999086727162, 'tsl_mult': 0.6634188203644265, 'strategy': 'mean_reversion', 'time_stop': 212, 'use_sma': False, 'use_atr': False, 'use_adx': False, 'use_ema': False, 'use_spike': False, 'rsi_required': False, 'edge_k': 1.7406649267891028, 'edge_cap': 0.15674125897428912}.
[I 2025-08-29 22:59:43,099] Trial 743 finished with values: [-1000000000.0, 1000000000.0] and parameters: {'p_sma': 20, 'p_std': 50, 'p_atr': 18, 'p_adx': 14, 'rsi_period': 70, 'ema1': 19, 'ema2': 22, 'slip_atr_k': 0.012088628164564031, 'slip_spread_k': 0.961649448631559, 'spread_hl_frac': 0.01092585866137425, 'bb_std_mult': 2.2733408304456506, 'rsi_os': 34, 'rsi_ob': 61, 'vol_spike': 0.25773297908756415, 'adx_thresh': 21.61350916514832, 'atr_min_pct': 0.011308870516768377, 'atr_max_pct': 0.08152570456199938, 'tp_mult': 1.843920086223029, 'tsl_mult': 0.5933714426988995, 'strategy': 'breakout', 'time_stop': 16, 'use_sma': False, 'use_atr': False, 'use_adx': False, 'use_ema': False, 'use_spike': False, 'rsi_required': False, 'edge_k': 1.8148219702431785, 'edge_cap': 0.22767161622521365}.
[I 2025-08-29 23:00:10,543] Trial 747 finished with values: [-1000000000.0, 1000000000.0] and parameters: {'p_sma': 7, 'p_std': 12, 'p_atr': 16, 'p_adx': 13, 'rsi_period': 13, 'ema1': 30, 'ema2': 52, 'slip_atr_k': 0.13564210453357067, 'slip_spread_k': 0.022995618904406434, 'spread_hl_frac': 0.026986141047216843, 'bb_std_mult': 0.702676527152194, 'rsi_os': 33, 'rsi_ob': 89, 'vol_spike': 0.2458876825575382, 'adx_thresh': 25.95850523843273, 'atr_min_pct': 0.009212148848999149, 'atr_max_pct': 0.06396901924227696, 'tp_mult': 2.125724856420301, 'tsl_mult': 0.6292080515884697, 'strategy': 'mean_reversion', 'time_stop': 126, 'use_sma': False, 'use_atr': False, 'use_adx': False, 'use_ema': False, 'use_spike': False, 'rsi_required': False, 'edge_k': 1.878499187412745, 'edge_cap': 0.202583977464456}.
[I 2025-08-29 23:00:11,216] Trial 745 finished with values: [-1000000000.0, 1000000000.0] and parameters: {'p_sma': 21, 'p_std': 42, 'p_atr': 18, 'p_adx': 27, 'rsi_period': 54, 'ema1': 30, 'ema2': 23, 'slip_atr_k': 0.009150986976170727, 'slip_spread_k': 0.3071753506678861, 'spread_hl_frac': 0.008957869925824726, 'bb_std_mult': 2.0201780911310547, 'rsi_os': 21, 'rsi_ob': 62, 'vol_spike': 0.2486539984604326, 'adx_thresh': 21.137650772744994, 'atr_min_pct': 0.014124565561182603, 'atr_max_pct': 0.06459940254924605, 'tp_mult': 1.9326202006235038, 'tsl_mult': 0.6273470456986834, 'strategy': 'mean_reversion', 'time_stop': 276, 'use_sma': False, 'use_atr': False, 'use_adx': False, 'use_ema': False, 'use_spike': False, 'rsi_required': False, 'edge_k': 1.867580050492097, 'edge_cap': 0.22542647099409413}.
[I 2025-08-29 23:00:11,501] Trial 746 finished with values: [-1000000000.0, 1000000000.0] and parameters: {'p_sma': 20, 'p_std': 46, 'p_atr': 14, 'p_adx': 13, 'rsi_period': 54, 'ema1': 19, 'ema2': 53, 'slip_atr_k': 0.13446913293481655, 'slip_spread_k': 0.5238130560731817, 'spread_hl_frac': 0.010501453746897172, 'bb_std_mult': 2.309770896472786, 'rsi_os': 34, 'rsi_ob': 62, 'vol_spike': 0.08748472237378024, 'adx_thresh': 20.90102832866347, 'atr_min_pct': 0.023650187150848562, 'atr_max_pct': 0.06452799927299993, 'tp_mult': 2.1168347399270186, 'tsl_mult': 0.33067582190804845, 'strategy': 'mean_reversion', 'time_stop': 276, 'use_sma': False, 'use_atr': False, 'use_adx': False, 'use_ema': False, 'use_spike': False, 'rsi_required': False, 'edge_k': 1.8580717594135305, 'edge_cap': 0.050892792274701226}.
[I 2025-08-29 23:00:11,566] Trial 744 finished with values: [-1000000000.0, 1000000000.0] and parameters: {'p_sma': 20, 'p_std': 12, 'p_atr': 16, 'p_adx': 13, 'rsi_period': 16, 'ema1': 30, 'ema2': 22, 'slip_atr_k': 2.8361880199578773e-05, 'slip_spread_k': 0.24472395453435863, 'spread_hl_frac': 0.010820812659799547, 'bb_std_mult': 3.289120099343405, 'rsi_os': 34, 'rsi_ob': 89, 'vol_spike': 0.1216009325474336, 'adx_thresh': 29.01049948728843, 'atr_min_pct': 0.010375725808062654, 'atr_max_pct': 0.06743377695219663, 'tp_mult': 1.851123577120637, 'tsl_mult': 0.5890311789474089, 'strategy': 'mean_reversion', 'time_stop': 127, 'use_sma': False, 'use_atr': False, 'use_adx': False, 'use_ema': False, 'use_spike': False, 'rsi_required': False, 'edge_k': 1.8693323791138559, 'edge_cap': 0.9992319617537321}.
[I 2025-08-29 23:00:38,576] Trial 748 finished with values: [-1000000000.0, 1000000000.0] and parameters: {'p_sma': 27, 'p_std': 9, 'p_atr': 11, 'p_adx': 12, 'rsi_period': 16, 'ema1': 28, 'ema2': 55, 'slip_atr_k': 0.008303347935358425, 'slip_spread_k': 0.30482698990500745, 'spread_hl_frac': 0.005116180205527048, 'bb_std_mult': 1.8110451858919987, 'rsi_os': 30, 'rsi_ob': 95, 'vol_spike': 0.14399980587474065, 'adx_thresh': 20.832932972351767, 'atr_min_pct': 0.014242208429917195, 'atr_max_pct': 0.07358679088890033, 'tp_mult': 1.6968001409599411, 'tsl_mult': 0.3468500742647385, 'strategy': 'mean_reversion', 'time_stop': 27, 'use_sma': False, 'use_atr': False, 'use_adx': False, 'use_ema': False, 'use_spike': False, 'rsi_required': False, 'edge_k': 1.943452704747364, 'edge_cap': 0.834057424587041}.
[I 2025-08-29 23:00:38,986] Trial 750 finished with values: [-1000000000.0, 1000000000.0] and parameters: {'p_sma': 27, 'p_std': 6, 'p_atr': 11, 'p_adx': 12, 'rsi_period': 15, 'ema1': 30, 'ema2': 16, 'slip_atr_k': 0.07210029343718596, 'slip_spread_k': 0.22177169161052987, 'spread_hl_frac': 0.014136046495974457, 'bb_std_mult': 1.8221237852541154, 'rsi_os': 16, 'rsi_ob': 63, 'vol_spike': 0.1462604440313528, 'adx_thresh': 16.421533821288623, 'atr_min_pct': 0.013029531844254687, 'atr_max_pct': 0.07366617504436669, 'tp_mult': 2.351553183833175, 'tsl_mult': 0.4048349162065305, 'strategy': 'mean_reversion', 'time_stop': 281, 'use_sma': False, 'use_atr': False, 'use_adx': False, 'use_ema': False, 'use_spike': False, 'rsi_required': False, 'edge_k': 1.9344582883709769, 'edge_cap': 0.1756218040953609}.
[I 2025-08-29 23:00:39,215] Trial 751 finished with values: [-1000000000.0, 1000000000.0] and parameters: {'p_sma': 27, 'p_std': 15, 'p_atr': 11, 'p_adx': 12, 'rsi_period': 49, 'ema1': 16, 'ema2': 17, 'slip_atr_k': 0.020403067534606602, 'slip_spread_k': 0.2763900943548034, 'spread_hl_frac': 0.020511957382011725, 'bb_std_mult': 1.5656377229053107, 'rsi_os': 30, 'rsi_ob': 63, 'vol_spike': 0.02175139528842704, 'adx_thresh': 10.13284570743755, 'atr_min_pct': 0.017136467854421876, 'atr_max_pct': 0.07344034144187406, 'tp_mult': 1.915439714669209, 'tsl_mult': 0.6091482614763275, 'strategy': 'mean_reversion', 'time_stop': 281, 'use_sma': False, 'use_atr': False, 'use_adx': False, 'use_ema': False, 'use_spike': False, 'rsi_required': False, 'edge_k': 1.9630796469347507, 'edge_cap': 0.18244815586132976}.
[I 2025-08-29 23:00:39,386] Trial 749 finished with values: [-1000000000.0, 1000000000.0] and parameters: {'p_sma': 24, 'p_std': 9, 'p_atr': 11, 'p_adx': 19, 'rsi_period': 15, 'ema1': 28, 'ema2': 55, 'slip_atr_k': 0.07334374245718567, 'slip_spread_k': 0.2814861776225768, 'spread_hl_frac': 0.010060788071259414, 'bb_std_mult': 1.8104450713887499, 'rsi_os': 41, 'rsi_ob': 63, 'vol_spike': 0.1203219268106313, 'adx_thresh': 20.163739585643132, 'atr_min_pct': 0.02389418050374839, 'atr_max_pct': 0.10651982166692134, 'tp_mult': 1.6902177990140723, 'tsl_mult': 0.3450974552070768, 'strategy': 'mean_reversion', 'time_stop': 25, 'use_sma': False, 'use_atr': False, 'use_adx': False, 'use_ema': False, 'use_spike': False, 'rsi_required': False, 'edge_k': 1.9372544437493595, 'edge_cap': 0.18082002260464405}.
[I 2025-08-29 23:01:07,612] Trial 753 finished with values: [-0.0030815219617003065, 0.003056699305313536] and parameters: {'p_sma': 53, 'p_std': 15, 'p_atr': 13, 'p_adx': 14, 'rsi_period': 13, 'ema1': 29, 'ema2': 26, 'slip_atr_k': 0.01903215635584726, 'slip_spread_k': 0.2800064631078701, 'spread_hl_frac': 0.012452056187783746, 'bb_std_mult': 3.3946495481851815, 'rsi_os': 36, 'rsi_ob': 62, 'vol_spike': 0.19343184769824, 'adx_thresh': 20.033084315464645, 'atr_min_pct': 0.0036557555687159486, 'atr_max_pct': 0.048120736381984844, 'tp_mult': 2.220293770114377, 'tsl_mult': 0.6120124004088435, 'strategy': 'mean_reversion', 'time_stop': 294, 'use_sma': False, 'use_atr': False, 'use_adx': False, 'use_ema': False, 'use_spike': False, 'rsi_required': False, 'edge_k': 1.911500809807098, 'edge_cap': 0.19754840416956537}.
[I 2025-08-29 23:01:08,105] Trial 752 finished with values: [-1000000000.0, 1000000000.0] and parameters: {'p_sma': 26, 'p_std': 15, 'p_atr': 13, 'p_adx': 20, 'rsi_period': 84, 'ema1': 30, 'ema2': 26, 'slip_atr_k': 0.07286674666927889, 'slip_spread_k': 0.2800157877424157, 'spread_hl_frac': 0.014201536859365638, 'bb_std_mult': 1.5551364480188807, 'rsi_os': 16, 'rsi_ob': 63, 'vol_spike': 0.2392152688049258, 'adx_thresh': 16.295913125785514, 'atr_min_pct': 0.012908738699817752, 'atr_max_pct': 0.04752786420902979, 'tp_mult': 2.3651603544220987, 'tsl_mult': 0.6170517951227614, 'strategy': 'mean_reversion', 'time_stop': 154, 'use_sma': False, 'use_atr': False, 'use_adx': False, 'use_ema': False, 'use_spike': False, 'rsi_required': False, 'edge_k': 1.9426135712895365, 'edge_cap': 0.17430970310004143}.
[I 2025-08-29 23:01:08,336] Trial 755 finished with values: [-1000000000.0, 1000000000.0] and parameters: {'p_sma': 13, 'p_std': 27, 'p_atr': 13, 'p_adx': 15, 'rsi_period': 66, 'ema1': 29, 'ema2': 46, 'slip_atr_k': 2.969169090904139e-05, 'slip_spread_k': 0.3342976047063334, 'spread_hl_frac': 0.015194085650455033, 'bb_std_mult': 3.5183229096670674, 'rsi_os': 36, 'rsi_ob': 66, 'vol_spike': 0.20246285543190637, 'adx_thresh': 22.212408169390077, 'atr_min_pct': 0.025859739012493922, 'atr_max_pct': 0.05247066680689589, 'tp_mult': 2.224938855691961, 'tsl_mult': 0.6764002890198261, 'strategy': 'breakout', 'time_stop': 291, 'use_sma': False, 'use_atr': False, 'use_adx': False, 'use_ema': False, 'use_spike': False, 'rsi_required': False, 'edge_k': 1.9148492948547724, 'edge_cap': 0.138188639948228}.
[I 2025-08-29 23:01:08,410] Trial 754 finished with values: [-1000000000.0, 1000000000.0] and parameters: {'p_sma': 14, 'p_std': 13, 'p_atr': 13, 'p_adx': 14, 'rsi_period': 9, 'ema1': 30, 'ema2': 26, 'slip_atr_k': 0.004584432681604769, 'slip_spread_k': 0.33779726449371417, 'spread_hl_frac': 0.009664449212677846, 'bb_std_mult': 1.3524191357172253, 'rsi_os': 36, 'rsi_ob': 68, 'vol_spike': 0.15997519458170725, 'adx_thresh': 19.539485095253124, 'atr_min_pct': 0.02160324708209007, 'atr_max_pct': 0.056999658675530154, 'tp_mult': 1.96143734243237, 'tsl_mult': 0.6799724749871104, 'strategy': 'breakout', 'time_stop': 268, 'use_sma': False, 'use_atr': False, 'use_adx': False, 'use_ema': False, 'use_spike': False, 'rsi_required': False, 'edge_k': 1.9051856780646323, 'edge_cap': 0.19888287635732627}.
