[I 2025-08-29 22:15:35,157] Trial 322 finished with values: [-1000000000.0, 1000000000.0] and parameters: {'p_sma': 11, 'p_std': 37, 'p_atr': 22, 'p_adx': 21, 'rsi_period': 39, 'ema1': 14, 'ema2': 58, 'slip_atr_k': 0.04362234539091778, 'slip_spread_k': 0.2925935113407301, 'spread_hl_frac': 0.039955781373968845, 'bb_std_mult': 1.8714457258055524, 'rsi_os': 25, 'rsi_ob': 94, 'vol_spike': 0.22972402293485952, 'adx_thresh': 13.953705344628197, 'atr_min_pct': 0.01995138647347662, 'atr_max_pct': 0.13367175328671255, 'tp_mult': 2.8133346153449947, 'tsl_mult': 0.03688938602206954, 'strategy': 'mean_reversion', 'time_stop': 97, 'use_sma': False, 'use_atr': False, 'use_adx': False, 'use_ema': False, 'use_spike': False, 'rsi_required': False, 'edge_k': 0.45510011388070437, 'edge_cap': 0.4531420782159006}.
[I 2025-08-29 22:15:35,567] Trial 323 finished with values: [-1000000000.0, 1000000000.0] and parameters: {'p_sma': 9, 'p_std': 37, 'p_atr': 22, 'p_adx': 21, 'rsi_period': 26, 'ema1': 6, 'ema2': 49, 'slip_atr_k': 0.11854299282394012, 'slip_spread_k': 0.7786909736251478, 'spread_hl_frac': 0.04039182099792961, 'bb_std_mult': 0.5738387547269121, 'rsi_os': 23, 'rsi_ob': 95, 'vol_spike': 0.021858434737213266, 'adx_thresh': 33.63412082006033, 'atr_min_pct': 0.004644833668276701, 'atr_max_pct': 0.05590248249112407, 'tp_mult': 1.0164663046107099, 'tsl_mult': 0.5835874551782223, 'strategy': 'mean_reversion', 'time_stop': 99, 'use_sma': False, 'use_atr': False, 'use_adx': False, 'use_ema': False, 'use_spike': False, 'rsi_required': False, 'edge_k': 0.44798824068550164, 'edge_cap': 0.44831593899567124}.
[I 2025-08-29 22:15:36,799] Trial 326 finished with values: [-1000000000.0, 1000000000.0] and parameters: {'p_sma': 44, 'p_std': 37, 'p_atr': 22, 'p_adx': 21, 'rsi_period': 26, 'ema1': 6, 'ema2': 10, 'slip_atr_k': 0.02541186908753164, 'slip_spread_k': 0.7885289291934979, 'spread_hl_frac': 0.03647747023467437, 'bb_std_mult': 2.0098504532803028, 'rsi_os': 19, 'rsi_ob': 74, 'vol_spike': 0.2385679001745461, 'adx_thresh': 33.80616396470355, 'atr_min_pct': 0.018234882446777984, 'atr_max_pct': 0.13237245192403002, 'tp_mult': 2.8191334988613788, 'tsl_mult': 0.43565527175518504, 'strategy': 'mean_reversion', 'time_stop': 261, 'use_sma': False, 'use_atr': False, 'use_adx': False, 'use_ema': False, 'use_spike': False, 'rsi_required': False, 'edge_k': 0.3981780568478008, 'edge_cap': 0.4392212594960044}.
[I 2025-08-29 22:15:36,984] Trial 327 finished with values: [-1000000000.0, 1000000000.0] and parameters: {'p_sma': 45, 'p_std': 20, 'p_atr': 22, 'p_adx': 21, 'rsi_period': 46, 'ema1': 14, 'ema2': 10, 'slip_atr_k': 0.025438110940148057, 'slip_spread_k': 0.7132779470983166, 'spread_hl_frac': 0.03681828038123474, 'bb_std_mult': 2.885840632840249, 'rsi_os': 53, 'rsi_ob': 82, 'vol_spike': 0.02243079006626658, 'adx_thresh': 32.33369831117489, 'atr_min_pct': 0.004793469428671294, 'atr_max_pct': 0.010071034327944386, 'tp_mult': 2.062940606808725, 'tsl_mult': 0.5928814736876027, 'strategy': 'breakout', 'time_stop': 92, 'use_sma': False, 'use_atr': False, 'use_adx': False, 'use_ema': False, 'use_spike': False, 'rsi_required': False, 'edge_k': 0.9043790287028838, 'edge_cap': 0.40547625981312485}.
[I 2025-08-29 22:16:03,843] Trial 328 finished with values: [-0.0033970477489250195, 0.0034536552978892163] and parameters: {'p_sma': 43, 'p_std': 35, 'p_atr': 22, 'p_adx': 21, 'rsi_period': 25, 'ema1': 6, 'ema2': 49, 'slip_atr_k': 0.1180163532709624, 'slip_spread_k': 0.7146554720559172, 'spread_hl_frac': 0.03678317729993989, 'bb_std_mult': 2.8879998118937746, 'rsi_os': 23, 'rsi_ob': 82, 'vol_spike': 0.02164417404952529, 'adx_thresh': 32.28442801161606, 'atr_min_pct': 0.0012832867607509794, 'atr_max_pct': 0.12374683437371665, 'tp_mult': 2.0804586712165767, 'tsl_mult': 0.4963255463104785, 'strategy': 'breakout', 'time_stop': 20, 'use_sma': False, 'use_atr': False, 'use_adx': False, 'use_ema': False, 'use_spike': False, 'rsi_required': False, 'edge_k': 0.00493113128737932, 'edge_cap': 0.07665032982775549}.
[I 2025-08-29 22:16:03,904] Trial 331 finished with values: [-0.0057336012471117526, 0.005726017679737417] and parameters: {'p_sma': 48, 'p_std': 31, 'p_atr': 23, 'p_adx': 23, 'rsi_period': 23, 'ema1': 10, 'ema2': 39, 'slip_atr_k': 0.03625519283023992, 'slip_spread_k': 0.7554892508819295, 'spread_hl_frac': 0.03471461320985998, 'bb_std_mult': 0.9817750817812512, 'rsi_os': 27, 'rsi_ob': 80, 'vol_spike': 0.15763354780996489, 'adx_thresh': 18.615130335280586, 'atr_min_pct': 0.0011554403891468911, 'atr_max_pct': 0.1469436971739778, 'tp_mult': 1.8143505062216905, 'tsl_mult': 0.49980514153175465, 'strategy': 'breakout', 'time_stop': 124, 'use_sma': False, 'use_atr': False, 'use_adx': False, 'use_ema': False, 'use_spike': False, 'rsi_required': False, 'edge_k': 0.2735816126315111, 'edge_cap': 0.8386343430496783}.
[I 2025-08-29 22:16:04,025] Trial 329 finished with values: [-1000000000.0, 1000000000.0] and parameters: {'p_sma': 43, 'p_std': 13, 'p_atr': 25, 'p_adx': 22, 'rsi_period': 14, 'ema1': 5, 'ema2': 10, 'slip_atr_k': 0.024732881299557863, 'slip_spread_k': 0.34494379482229487, 'spread_hl_frac': 0.0372651461037033, 'bb_std_mult': 2.6909238827053095, 'rsi_os': 27, 'rsi_ob': 80, 'vol_spike': 0.15291911974307815, 'adx_thresh': 32.16004609521681, 'atr_min_pct': 0.01860310079122126, 'atr_max_pct': 0.12310459679812971, 'tp_mult': 1.8222702513501823, 'tsl_mult': 0.9577629062727266, 'strategy': 'breakout', 'time_stop': 29, 'use_sma': False, 'use_atr': False, 'use_adx': False, 'use_ema': False, 'use_spike': False, 'rsi_required': False, 'edge_k': 0.38302008304245955, 'edge_cap': 0.07576801015070378}.
[I 2025-08-29 22:16:04,117] Trial 330 finished with values: [-1000000000.0, 1000000000.0] and parameters: {'p_sma': 37, 'p_std': 35, 'p_atr': 23, 'p_adx': 19, 'rsi_period': 48, 'ema1': 11, 'ema2': 43, 'slip_atr_k': 0.14632526751340558, 'slip_spread_k': 0.1060483264457783, 'spread_hl_frac': 0.023358806750791463, 'bb_std_mult': 1.0128927134251904, 'rsi_os': 27, 'rsi_ob': 67, 'vol_spike': 0.10264957531058996, 'adx_thresh': 14.696627005979598, 'atr_min_pct': 0.011303710524863037, 'atr_max_pct': 0.09781681471482856, 'tp_mult': 1.8292757060770692, 'tsl_mult': 0.4957753374330116, 'strategy': 'breakout', 'time_stop': 160, 'use_sma': False, 'use_atr': False, 'use_adx': False, 'use_ema': False, 'use_spike': False, 'rsi_required': False, 'edge_k': 0.2845011246815053, 'edge_cap': 0.8296498523502711}.
[I 2025-08-29 22:16:30,949] Trial 334 finished with values: [-1000000000.0, 1000000000.0] and parameters: {'p_sma': 28, 'p_std': 33, 'p_atr': 23, 'p_adx': 22, 'rsi_period': 33, 'ema1': 6, 'ema2': 13, 'slip_atr_k': 0.03255497598235163, 'slip_spread_k': 0.7399872624737049, 'spread_hl_frac': 0.023311170748240018, 'bb_std_mult': 2.452252930535704, 'rsi_os': 30, 'rsi_ob': 76, 'vol_spike': 0.21706494939541585, 'adx_thresh': 30.75847623187336, 'atr_min_pct': 0.015423502350191833, 'atr_max_pct': 0.126753524124226, 'tp_mult': 2.899921652921691, 'tsl_mult': 0.14582557187031975, 'strategy': 'mean_reversion', 'time_stop': 106, 'use_sma': False, 'use_atr': False, 'use_adx': False, 'use_ema': False, 'use_spike': False, 'rsi_required': False, 'edge_k': 0.32371495779200926, 'edge_cap': 0.4827960335432321}.
[I 2025-08-29 22:16:31,146] Trial 335 finished with values: [-0.0011837807273273881, 0.0013604050399532892] and parameters: {'p_sma': 59, 'p_std': 33, 'p_atr': 21, 'p_adx': 22, 'rsi_period': 69, 'ema1': 5, 'ema2': 11, 'slip_atr_k': 0.03551946516886099, 'slip_spread_k': 0.7364931823021812, 'spread_hl_frac': 0.00848122459228522, 'bb_std_mult': 2.3319611845337116, 'rsi_os': 36, 'rsi_ob': 64, 'vol_spike': 0.21510381436805, 'adx_thresh': 32.91680702752986, 'atr_min_pct': 0.0026884466097677486, 'atr_max_pct': 0.12660816562667973, 'tp_mult': 2.863757981967841, 'tsl_mult': 0.4673976788261999, 'strategy': 'mean_reversion', 'time_stop': 102, 'use_sma': False, 'use_atr': False, 'use_adx': False, 'use_ema': False, 'use_spike': False, 'rsi_required': False, 'edge_k': 0.5091992991809762, 'edge_cap': 0.625888375794783}.
[I 2025-08-29 22:16:31,585] Trial 333 finished with values: [-0.0032878753721837795, 0.0032680301536346357] and parameters: {'p_sma': 37, 'p_std': 33, 'p_atr': 21, 'p_adx': 22, 'rsi_period': 15, 'ema1': 5, 'ema2': 43, 'slip_atr_k': 0.03029689557686137, 'slip_spread_k': 0.3402488866641895, 'spread_hl_frac': 0.038209022016683816, 'bb_std_mult': 2.341827618892883, 'rsi_os': 30, 'rsi_ob': 76, 'vol_spike': 0.00905850301706243, 'adx_thresh': 30.799402269079692, 'atr_min_pct': 0.002597798531450272, 'atr_max_pct': 0.139951004660003, 'tp_mult': 1.8502875212826648, 'tsl_mult': 0.46983415818003066, 'strategy': 'mean_reversion', 'time_stop': 174, 'use_sma': False, 'use_atr': False, 'use_adx': False, 'use_ema': False, 'use_spike': False, 'rsi_required': False, 'edge_k': 0.39458535948049805, 'edge_cap': 0.49344063712088077}.
[I 2025-08-29 22:16:31,670] Trial 332 finished with values: [-1000000000.0, 1000000000.0] and parameters: {'p_sma': 39, 'p_std': 45, 'p_atr': 23, 'p_adx': 19, 'rsi_period': 15, 'ema1': 22, 'ema2': 43, 'slip_atr_k': 0.14730001480494545, 'slip_spread_k': 0.33097364393426526, 'spread_hl_frac': 0.03356773861308346, 'bb_std_mult': 1.0141222493627604, 'rsi_os': 30, 'rsi_ob': 80, 'vol_spike': 0.07326602409116714, 'adx_thresh': 30.756431584718527, 'atr_min_pct': 0.011468920928015474, 'atr_max_pct': 0.13939141452151466, 'tp_mult': 2.9099541042175274, 'tsl_mult': 0.9562275497807733, 'strategy': 'breakout', 'time_stop': 163, 'use_sma': False, 'use_atr': False, 'use_adx': False, 'use_ema': False, 'use_spike': False, 'rsi_required': False, 'edge_k': 0.2706055061797318, 'edge_cap': 0.831213549349205}.
[I 2025-08-29 22:16:58,526] Trial 337 finished with values: [-1000000000.0, 1000000000.0] and parameters: {'p_sma': 58, 'p_std': 36, 'p_atr': 21, 'p_adx': 24, 'rsi_period': 21, 'ema1': 5, 'ema2': 11, 'slip_atr_k': 0.036772811405469674, 'slip_spread_k': 0.022628527997607506, 'spread_hl_frac': 3.7471008664975713e-06, 'bb_std_mult': 2.326718271809281, 'rsi_os': 24, 'rsi_ob': 79, 'vol_spike': 0.0098654461651973, 'adx_thresh': 33.04130296587971, 'atr_min_pct': 0.002735769156128589, 'atr_max_pct': 0.05464178932850322, 'tp_mult': 2.8387492530492517, 'tsl_mult': 0.4601117611843407, 'strategy': 'mean_reversion', 'time_stop': 243, 'use_sma': False, 'use_atr': False, 'use_adx': False, 'use_ema': False, 'use_spike': False, 'rsi_required': False, 'edge_k': 0.40040283060563114, 'edge_cap': 0.5044473409887926}.
[I 2025-08-29 22:16:59,008] Trial 339 finished with values: [-1000000000.0, 1000000000.0] and parameters: {'p_sma': 45, 'p_std': 36, 'p_atr': 21, 'p_adx': 12, 'rsi_period': 68, 'ema1': 17, 'ema2': 11, 'slip_atr_k': 0.08404677328484375, 'slip_spread_k': 0.07393811192653604, 'spread_hl_frac': 0.01691402478256488, 'bb_std_mult': 2.5224948193261674, 'rsi_os': 26, 'rsi_ob': 79, 'vol_spike': 0.09410760945696135, 'adx_thresh': 17.000114084714543, 'atr_min_pct': 0.002895394679865541, 'atr_max_pct': 0.1201394231993765, 'tp_mult': 2.8236428933139166, 'tsl_mult': 0.858127270734337, 'strategy': 'mean_reversion', 'time_stop': 90, 'use_sma': False, 'use_atr': False, 'use_adx': False, 'use_ema': False, 'use_spike': False, 'rsi_required': False, 'edge_k': 1.4659032974578234, 'edge_cap': 0.5882061109424543}.
[I 2025-08-29 22:16:59,112] Trial 336 finished with values: [-1000000000.0, 1000000000.0] and parameters: {'p_sma': 59, 'p_std': 36, 'p_atr': 21, 'p_adx': 23, 'rsi_period': 29, 'ema1': 5, 'ema2': 11, 'slip_atr_k': 0.03798243846670307, 'slip_spread_k': 0.9996570935887192, 'spread_hl_frac': 0.017000601278523604, 'bb_std_mult': 0.9081822019680343, 'rsi_os': 24, 'rsi_ob': 79, 'vol_spike': 0.22171639647853109, 'adx_thresh': 33.18500285109821, 'atr_min_pct': 0.002776692669665685, 'atr_max_pct': 0.14014676269676998, 'tp_mult': 2.874745515808712, 'tsl_mult': 0.4678879603105579, 'strategy': 'mean_reversion', 'time_stop': 241, 'use_sma': False, 'use_atr': False, 'use_adx': False, 'use_ema': False, 'use_spike': False, 'rsi_required': False, 'edge_k': 0.4906487121652663, 'edge_cap': 0.8873003765991397}.
[I 2025-08-29 22:16:59,212] Trial 338 finished with values: [-1000000000.0, 1000000000.0] and parameters: {'p_sma': 47, 'p_std': 36, 'p_atr': 21, 'p_adx': 13, 'rsi_period': 58, 'ema1': 6, 'ema2': 11, 'slip_atr_k': 0.0950988023002464, 'slip_spread_k': 0.6878405713670308, 'spread_hl_frac': 0.03887175858586064, 'bb_std_mult': 2.551447299694907, 'rsi_os': 26, 'rsi_ob': 79, 'vol_spike': 0.07325819984375836, 'adx_thresh': 12.022204502994185, 'atr_min_pct': 0.0038003203537213424, 'atr_max_pct': 0.05733938076313041, 'tp_mult': 2.920495546959931, 'tsl_mult': 0.8653590881601712, 'strategy': 'mean_reversion', 'time_stop': 137, 'use_sma': False, 'use_atr': False, 'use_adx': False, 'use_ema': False, 'use_spike': False, 'rsi_required': False, 'edge_k': 1.162943878924558, 'edge_cap': 0.5870089346395259}.
[I 2025-08-29 22:17:26,183] Trial 340 finished with values: [-1000000000.0, 1000000000.0] and parameters: {'p_sma': 50, 'p_std': 43, 'p_atr': 21, 'p_adx': 12, 'rsi_period': 23, 'ema1': 6, 'ema2': 12, 'slip_atr_k': 0.09710855888782813, 'slip_spread_k': 0.6758627237143209, 'spread_hl_frac': 0.03802290054964379, 'bb_std_mult': 0.9136416043172706, 'rsi_os': 26, 'rsi_ob': 53, 'vol_spike': 0.07136319076676341, 'adx_thresh': 16.961057857962636, 'atr_min_pct': 0.0037227911645828517, 'atr_max_pct': 0.12664070289633267, 'tp_mult': 2.785508690645547, 'tsl_mult': 0.8688087763770264, 'strategy': 'mean_reversion', 'time_stop': 88, 'use_sma': False, 'use_atr': False, 'use_adx': False, 'use_ema': False, 'use_spike': False, 'rsi_required': False, 'edge_k': 1.1471730161925062, 'edge_cap': 0.27068399029832824}.
[I 2025-08-29 22:17:26,335] Trial 343 finished with values: [-0.009428801543057141, 0.009413214929601845] and parameters: {'p_sma': 51, 'p_std': 38, 'p_atr': 22, 'p_adx': 22, 'rsi_period': 24, 'ema1': 7, 'ema2': 12, 'slip_atr_k': 0.0193200600358955, 'slip_spread_k': 0.7309399609992125, 'spread_hl_frac': 0.03802788624915791, 'bb_std_mult': 0.9126428791466797, 'rsi_os': 35, 'rsi_ob': 58, 'vol_spike': 0.12179909592642628, 'adx_thresh': 19.392737321008212, 'atr_min_pct': 0.0019960201641836556, 'atr_max_pct': 0.07043116114174433, 'tp_mult': 2.7533244544281477, 'tsl_mult': 0.3333118247420911, 'strategy': 'mean_reversion', 'time_stop': 101, 'use_sma': False, 'use_atr': False, 'use_adx': False, 'use_ema': False, 'use_spike': False, 'rsi_required': False, 'edge_k': 0.3359325525604938, 'edge_cap': 0.28196028285439784}.
[I 2025-08-29 22:17:26,493] Trial 342 finished with values: [-1000000000.0, 1000000000.0] and parameters: {'p_sma': 50, 'p_std': 38, 'p_atr': 11, 'p_adx': 13, 'rsi_period': 58, 'ema1': 6, 'ema2': 12, 'slip_atr_k': 0.094583278940415, 'slip_spread_k': 0.9454880130603723, 'spread_hl_frac': 0.038408020252795515, 'bb_std_mult': 0.9157150553480002, 'rsi_os': 28, 'rsi_ob': 84, 'vol_spike': 0.06616854536703887, 'adx_thresh': 19.622814505788078, 'atr_min_pct': 0.0038672890946385985, 'atr_max_pct': 0.12675424209986752, 'tp_mult': 1.2266912793336766, 'tsl_mult': 0.8882586380512812, 'strategy': 'mean_reversion', 'time_stop': 140, 'use_sma': False, 'use_atr': False, 'use_adx': False, 'use_ema': False, 'use_spike': False, 'rsi_required': False, 'edge_k': 0.5510733698711094, 'edge_cap': 0.47070864014806874}.
[I 2025-08-29 22:17:26,494] Trial 341 finished with values: [-1000000000.0, 1000000000.0] and parameters: {'p_sma': 50, 'p_std': 24, 'p_atr': 22, 'p_adx': 7, 'rsi_period': 23, 'ema1': 7, 'ema2': 12, 'slip_atr_k': 0.09626712422472515, 'slip_spread_k': 0.6733080754542475, 'spread_hl_frac': 0.038218779815549955, 'bb_std_mult': 0.9038479395928287, 'rsi_os': 12, 'rsi_ob': 91, 'vol_spike': 0.05840910189472284, 'adx_thresh': 11.484404026369234, 'atr_min_pct': 0.003734348597136143, 'atr_max_pct': 0.1267469170546833, 'tp_mult': 2.7916513339723457, 'tsl_mult': 0.42429929962456586, 'strategy': 'mean_reversion', 'time_stop': 117, 'use_sma': False, 'use_atr': False, 'use_adx': False, 'use_ema': False, 'use_spike': False, 'rsi_required': False, 'edge_k': 0.503177740276665, 'edge_cap': 0.6298629516844519}.
[I 2025-08-29 22:17:53,759] Trial 345 finished with values: [-0.0024449938245272307, 0.002434753873943674] and parameters: {'p_sma': 46, 'p_std': 33, 'p_atr': 16, 'p_adx': 9, 'rsi_period': 27, 'ema1': 30, 'ema2': 51, 'slip_atr_k': 0.048075286594027364, 'slip_spread_k': 0.801693094214822, 'spread_hl_frac': 0.00858433257166432, 'bb_std_mult': 3.025148947341175, 'rsi_os': 14, 'rsi_ob': 91, 'vol_spike': 0.05739420307260805, 'adx_thresh': 28.76602565371701, 'atr_min_pct': 0.0024618502324611075, 'atr_max_pct': 0.06268136679399391, 'tp_mult': 1.3164610998121344, 'tsl_mult': 0.292931352950996, 'strategy': 'breakout', 'time_stop': 116, 'use_sma': False, 'use_atr': False, 'use_adx': False, 'use_ema': False, 'use_spike': False, 'rsi_required': False, 'edge_k': 0.3818278096158769, 'edge_cap': 0.6398171586372219}.
[I 2025-08-29 22:17:53,797] Trial 347 finished with values: [-1000000000.0, 1000000000.0] and parameters: {'p_sma': 54, 'p_std': 34, 'p_atr': 16, 'p_adx': 9, 'rsi_period': 10, 'ema1': 6, 'ema2': 15, 'slip_atr_k': 0.031917721737006736, 'slip_spread_k': 0.27283327438373683, 'spread_hl_frac': 0.03503382519895983, 'bb_std_mult': 1.1502502792017242, 'rsi_os': 40, 'rsi_ob': 76, 'vol_spike': 0.2542551341610777, 'adx_thresh': 28.668578863416098, 'atr_min_pct': 0.008197090275890313, 'atr_max_pct': 0.0461732022624358, 'tp_mult': 1.8798264189409708, 'tsl_mult': 0.5145149081427902, 'strategy': 'breakout', 'time_stop': 300, 'use_sma': False, 'use_atr': False, 'use_adx': False, 'use_ema': False, 'use_spike': False, 'rsi_required': False, 'edge_k': 1.3801609310434741, 'edge_cap': 0.4190675350004135}.
[I 2025-08-29 22:17:53,966] Trial 346 finished with values: [-0.005786624154558551, 0.0058148118815404375] and parameters: {'p_sma': 46, 'p_std': 34, 'p_atr': 12, 'p_adx': 9, 'rsi_period': 26, 'ema1': 6, 'ema2': 55, 'slip_atr_k': 0.18155153571857147, 'slip_spread_k': 0.8111492722665862, 'spread_hl_frac': 0.018333827353280548, 'bb_std_mult': 3.5013734615536323, 'rsi_os': 29, 'rsi_ob': 76, 'vol_spike': 0.2525777444828044, 'adx_thresh': 34.382476731795904, 'atr_min_pct': 0.002468310214543085, 'atr_max_pct': 0.13041523485267845, 'tp_mult': 1.623991989903584, 'tsl_mult': 0.5211344217294113, 'strategy': 'breakout', 'time_stop': 107, 'use_sma': False, 'use_atr': False, 'use_adx': False, 'use_ema': False, 'use_spike': False, 'rsi_required': False, 'edge_k': 1.4059496820268047, 'edge_cap': 0.4984779177588729}.
[I 2025-08-29 22:17:54,074] Trial 344 finished with values: [-0.0025156967118160622, 0.0027676554364409896] and parameters: {'p_sma': 46, 'p_std': 38, 'p_atr': 27, 'p_adx': 7, 'rsi_period': 25, 'ema1': 7, 'ema2': 55, 'slip_atr_k': 0.03151539184599056, 'slip_spread_k': 0.38355967858507284, 'spread_hl_frac': 0.013844056132798814, 'bb_std_mult': 0.7526275062370559, 'rsi_os': 28, 'rsi_ob': 65, 'vol_spike': 0.011077636542460106, 'adx_thresh': 34.42267765272395, 'atr_min_pct': 0.002207430073942788, 'atr_max_pct': 0.13021749236627908, 'tp_mult': 2.7582826520857906, 'tsl_mult': 0.6550362667114447, 'strategy': 'mean_reversion', 'time_stop': 101, 'use_sma': False, 'use_atr': False, 'use_adx': False, 'use_ema': False, 'use_spike': False, 'rsi_required': False, 'edge_k': 0.04748281135067656, 'edge_cap': 0.6261431974912172}.
[I 2025-08-29 22:18:21,143] Trial 350 finished with values: [-1000000000.0, 1000000000.0] and parameters: {'p_sma': 47, 'p_std': 54, 'p_atr': 20, 'p_adx': 10, 'rsi_period': 69, 'ema1': 7, 'ema2': 10, 'slip_atr_k': 0.0481354674650895, 'slip_spread_k': 0.7596534768996775, 'spread_hl_frac': 0.03279307806314092, 'bb_std_mult': 0.994694642549942, 'rsi_os': 26, 'rsi_ob': 63, 'vol_spike': 0.21156655022347307, 'adx_thresh': 34.2004296885516, 'atr_min_pct': 0.012319689806117456, 'atr_max_pct': 0.06230477272128571, 'tp_mult': 2.393759336461892, 'tsl_mult': 0.18921536486810292, 'strategy': 'mean_reversion', 'time_stop': 208, 'use_sma': False, 'use_atr': False, 'use_adx': False, 'use_ema': False, 'use_spike': False, 'rsi_required': False, 'edge_k': 0.3149175458805061, 'edge_cap': 0.3718549567012468}.
[I 2025-08-29 22:18:21,154] Trial 351 finished with values: [-1000000000.0, 1000000000.0] and parameters: {'p_sma': 10, 'p_std': 54, 'p_atr': 20, 'p_adx': 10, 'rsi_period': 69, 'ema1': 26, 'ema2': 51, 'slip_atr_k': 0.04638877388756576, 'slip_spread_k': 0.7429565784588056, 'spread_hl_frac': 0.0022554702109228615, 'bb_std_mult': 1.0414635785485788, 'rsi_os': 28, 'rsi_ob': 78, 'vol_spike': 0.06426200214895578, 'adx_thresh': 15.948559212488636, 'atr_min_pct': 0.0010434262004642145, 'atr_max_pct': 0.06006937656653406, 'tp_mult': 2.3189172597350707, 'tsl_mult': 0.288662904066736, 'strategy': 'mean_reversion', 'time_stop': 101, 'use_sma': False, 'use_atr': False, 'use_adx': False, 'use_ema': False, 'use_spike': False, 'rsi_required': False, 'edge_k': 0.30997712559373936, 'edge_cap': 0.6649895332205108}.
[I 2025-08-29 22:18:21,493] Trial 349 finished with values: [-1000000000.0, 1000000000.0] and parameters: {'p_sma': 46, 'p_std': 35, 'p_atr': 19, 'p_adx': 9, 'rsi_period': 27, 'ema1': 25, 'ema2': 10, 'slip_atr_k': 0.05021955050905533, 'slip_spread_k': 0.7470137584221727, 'spread_hl_frac': 0.032620951108264164, 'bb_std_mult': 3.509595254835552, 'rsi_os': 17, 'rsi_ob': 78, 'vol_spike': 0.27443091500774774, 'adx_thresh': 22.254977164078806, 'atr_min_pct': 0.008934664069557986, 'atr_max_pct': 0.13005114164587142, 'tp_mult': 2.390924271199303, 'tsl_mult': 0.29457406762991, 'strategy': 'mean_reversion', 'time_stop': 107, 'use_sma': False, 'use_atr': False, 'use_adx': False, 'use_ema': False, 'use_spike': False, 'rsi_required': False, 'edge_k': 0.9577053538078678, 'edge_cap': 0.7115613707178216}.
