[I 2025-08-29 22:39:10,254] Trial 541 finished with values: [-1000000000.0, 1000000000.0] and parameters: {'p_sma': 31, 'p_std': 13, 'p_atr': 10, 'p_adx': 23, 'rsi_period': 11, 'ema1': 21, 'ema2': 35, 'slip_atr_k': 0.007798460048747066, 'slip_spread_k': 0.8238130695578741, 'spread_hl_frac': 0.01058476234396761, 'bb_std_mult': 2.914827339792547, 'rsi_os': 10, 'rsi_ob': 62, 'vol_spike': 0.26110763653467495, 'adx_thresh': 10.938432824493304, 'atr_min_pct': 0.005804968793130816, 'atr_max_pct': 0.1450377055684398, 'tp_mult': 2.255654460605566, 'tsl_mult': 0.2626987517690822, 'strategy': 'mean_reversion', 'time_stop': 286, 'use_sma': False, 'use_atr': False, 'use_adx': False, 'use_ema': False, 'use_spike': False, 'rsi_required': False, 'edge_k': 0.9681803237654667, 'edge_cap': 0.22918049830095044}.
[I 2025-08-29 22:39:10,291] Trial 540 finished with values: [-1000000000.0, 1000000000.0] and parameters: {'p_sma': 39, 'p_std': 16, 'p_atr': 11, 'p_adx': 26, 'rsi_period': 10, 'ema1': 25, 'ema2': 11, 'slip_atr_k': 0.22195010923714797, 'slip_spread_k': 0.827808155945769, 'spread_hl_frac': 0.007931689597985842, 'bb_std_mult': 2.9223976227452453, 'rsi_os': 17, 'rsi_ob': 59, 'vol_spike': 0.24651982339983347, 'adx_thresh': 19.84336266053262, 'atr_min_pct': 0.027045195667447113, 'atr_max_pct': 0.14139697468115, 'tp_mult': 1.9315031013387955, 'tsl_mult': 0.67001600442869, 'strategy': 'mean_reversion', 'time_stop': 245, 'use_sma': False, 'use_atr': False, 'use_adx': False, 'use_ema': False, 'use_spike': False, 'rsi_required': False, 'edge_k': 0.9498059657243235, 'edge_cap': 0.2315788685843173}.
[I 2025-08-29 22:39:10,382] Trial 542 finished with values: [-1000000000.0, 1000000000.0] and parameters: {'p_sma': 31, 'p_std': 13, 'p_atr': 10, 'p_adx': 23, 'rsi_period': 10, 'ema1': 25, 'ema2': 11, 'slip_atr_k': 0.005348325366881952, 'slip_spread_k': 0.8236635932792075, 'spread_hl_frac': 0.010628712495931723, 'bb_std_mult': 2.282681869370965, 'rsi_os': 32, 'rsi_ob': 62, 'vol_spike': 0.19557470059080956, 'adx_thresh': 9.309033774577754, 'atr_min_pct': 0.02707053679650525, 'atr_max_pct': 0.14310289899462775, 'tp_mult': 1.3991726375406865, 'tsl_mult': 0.5184541465997459, 'strategy': 'mean_reversion', 'time_stop': 285, 'use_sma': False, 'use_atr': False, 'use_adx': False, 'use_ema': False, 'use_spike': False, 'rsi_required': False, 'edge_k': 0.7522854672734107, 'edge_cap': 0.22645498188052351}.
[I 2025-08-29 22:39:10,679] Trial 543 finished with values: [-1000000000.0, 1000000000.0] and parameters: {'p_sma': 31, 'p_std': 10, 'p_atr': 10, 'p_adx': 23, 'rsi_period': 11, 'ema1': 26, 'ema2': 26, 'slip_atr_k': 0.00731022431761879, 'slip_spread_k': 0.8234975377343714, 'spread_hl_frac': 0.010549437338891368, 'bb_std_mult': 2.0839743320415116, 'rsi_os': 32, 'rsi_ob': 58, 'vol_spike': 0.259347311599627, 'adx_thresh': 13.181332926271352, 'atr_min_pct': 0.02427929305815301, 'atr_max_pct': 0.1458589691446665, 'tp_mult': 1.9239060307829574, 'tsl_mult': 0.5115424364231871, 'strategy': 'mean_reversion', 'time_stop': 255, 'use_sma': False, 'use_atr': False, 'use_adx': False, 'use_ema': False, 'use_spike': False, 'rsi_required': False, 'edge_k': 0.9491329837466416, 'edge_cap': 0.227228314159495}.
[I 2025-08-29 22:39:37,516] Trial 547 finished with values: [-1000000000.0, 1000000000.0] and parameters: {'p_sma': 35, 'p_std': 10, 'p_atr': 30, 'p_adx': 24, 'rsi_period': 7, 'ema1': 29, 'ema2': 12, 'slip_atr_k': 0.18627452929501204, 'slip_spread_k': 0.7931814914647364, 'spread_hl_frac': 0.012241500718799692, 'bb_std_mult': 2.378491264151506, 'rsi_os': 30, 'rsi_ob': 60, 'vol_spike': 0.27005176048934915, 'adx_thresh': 20.471721115413384, 'atr_min_pct': 0.012371118304892688, 'atr_max_pct': 0.14666176976729414, 'tp_mult': 2.4619330594068884, 'tsl_mult': 0.581363238182245, 'strategy': 'breakout', 'time_stop': 230, 'use_sma': False, 'use_atr': False, 'use_adx': False, 'use_ema': False, 'use_spike': False, 'rsi_required': False, 'edge_k': 1.0120864622612544, 'edge_cap': 0.2069879007119915}.
[I 2025-08-29 22:39:37,986] Trial 546 finished with values: [-1000000000.0, 1000000000.0] and parameters: {'p_sma': 33, 'p_std': 11, 'p_atr': 10, 'p_adx': 22, 'rsi_period': 15, 'ema1': 18, 'ema2': 32, 'slip_atr_k': 0.20155292011948922, 'slip_spread_k': 0.4383543372606306, 'spread_hl_frac': 0.012134431946344955, 'bb_std_mult': 2.5136134657635143, 'rsi_os': 31, 'rsi_ob': 60, 'vol_spike': 0.2592602874868318, 'adx_thresh': 6.378151462357458, 'atr_min_pct': 0.01349143850675271, 'atr_max_pct': 0.14674204155309756, 'tp_mult': 2.5374859884165977, 'tsl_mult': 0.3873231669343191, 'strategy': 'breakout', 'time_stop': 232, 'use_sma': False, 'use_atr': False, 'use_adx': False, 'use_ema': False, 'use_spike': False, 'rsi_required': False, 'edge_k': 1.370200644025231, 'edge_cap': 0.14827418876396686}.
[I 2025-08-29 22:39:38,086] Trial 544 finished with values: [-1000000000.0, 1000000000.0] and parameters: {'p_sma': 33, 'p_std': 11, 'p_atr': 25, 'p_adx': 24, 'rsi_period': 7, 'ema1': 30, 'ema2': 32, 'slip_atr_k': 0.00479971227385479, 'slip_spread_k': 0.3867459758128206, 'spread_hl_frac': 0.012229415948429023, 'bb_std_mult': 2.467453927267731, 'rsi_os': 32, 'rsi_ob': 61, 'vol_spike': 0.2592951559774944, 'adx_thresh': 6.315291570346009, 'atr_min_pct': 0.0164051072600774, 'atr_max_pct': 0.1470743012516365, 'tp_mult': 1.4063852185173167, 'tsl_mult': 0.5158552535437667, 'strategy': 'breakout', 'time_stop': 256, 'use_sma': False, 'use_atr': False, 'use_adx': False, 'use_ema': False, 'use_spike': False, 'rsi_required': False, 'edge_k': 0.841806280088445, 'edge_cap': 0.20595843131164795}.
[I 2025-08-29 22:39:38,171] Trial 545 finished with values: [-1000000000.0, 1000000000.0] and parameters: {'p_sma': 33, 'p_std': 11, 'p_atr': 10, 'p_adx': 22, 'rsi_period': 7, 'ema1': 26, 'ema2': 26, 'slip_atr_k': 0.0005659613661389562, 'slip_spread_k': 0.7940787041467859, 'spread_hl_frac': 0.011909604270243585, 'bb_std_mult': 1.908576048114464, 'rsi_os': 31, 'rsi_ob': 58, 'vol_spike': 0.0969813832444121, 'adx_thresh': 20.370396732130377, 'atr_min_pct': 0.012516613469009162, 'atr_max_pct': 0.14691602797145376, 'tp_mult': 2.5392052565790397, 'tsl_mult': 0.5757602217316315, 'strategy': 'breakout', 'time_stop': 254, 'use_sma': False, 'use_atr': False, 'use_adx': False, 'use_ema': False, 'use_spike': False, 'rsi_required': False, 'edge_k': 1.3868002151063246, 'edge_cap': 0.15659950570790318}.
[I 2025-08-29 22:39:38,378] Trial 551 finished with values: [-1000000000.0, 1000000000.0] and parameters: {'p_sma': 27, 'p_std': 14, 'p_atr': 9, 'p_adx': 23, 'rsi_period': 12, 'ema1': 20, 'ema2': 12, 'slip_atr_k': 0.014774807548679787, 'slip_spread_k': 0.8466001018447612, 'spread_hl_frac': 0.009155699613692125, 'bb_std_mult': 1.4693524435211383, 'rsi_os': 53, 'rsi_ob': 56, 'vol_spike': 0.2666704293612008, 'adx_thresh': 9.967573021881854, 'atr_min_pct': 0.010741497758201777, 'atr_max_pct': 0.13392856324879954, 'tp_mult': 2.145193467756328, 'tsl_mult': 0.5374377776665489, 'strategy': 'mean_reversion', 'time_stop': 277, 'use_sma': False, 'use_atr': False, 'use_adx': False, 'use_ema': False, 'use_spike': False, 'rsi_required': False, 'edge_k': 1.5987508131066246, 'edge_cap': 0.29713008414704417}.
[I 2025-08-29 22:40:04,875] Trial 549 finished with values: [-1000000000.0, 1000000000.0] and parameters: {'p_sma': 34, 'p_std': 14, 'p_atr': 16, 'p_adx': 22, 'rsi_period': 8, 'ema1': 14, 'ema2': 12, 'slip_atr_k': 0.014020731561050073, 'slip_spread_k': 0.7996163682773558, 'spread_hl_frac': 0.012946766019524249, 'bb_std_mult': 2.908192395896754, 'rsi_os': 33, 'rsi_ob': 59, 'vol_spike': 0.26568258187351695, 'adx_thresh': 11.927868603643699, 'atr_min_pct': 0.02334714908427541, 'atr_max_pct': 0.13496301541933997, 'tp_mult': 1.9576606979929674, 'tsl_mult': 0.5552021105571538, 'strategy': 'mean_reversion', 'time_stop': 278, 'use_sma': False, 'use_atr': False, 'use_adx': False, 'use_ema': False, 'use_spike': False, 'rsi_required': False, 'edge_k': 1.6116971329047767, 'edge_cap': 0.29426580181774503}.
[I 2025-08-29 22:40:05,164] Trial 550 finished with values: [-1000000000.0, 1000000000.0] and parameters: {'p_sma': 35, 'p_std': 14, 'p_atr': 11, 'p_adx': 22, 'rsi_period': 14, 'ema1': 14, 'ema2': 18, 'slip_atr_k': 0.013031584435275646, 'slip_spread_k': 0.3335427148150355, 'spread_hl_frac': 0.011374062666329895, 'bb_std_mult': 1.9104042872572675, 'rsi_os': 33, 'rsi_ob': 56, 'vol_spike': 0.09346869305605306, 'adx_thresh': 21.081878283843828, 'atr_min_pct': 0.028690701800155743, 'atr_max_pct': 0.13466618394780216, 'tp_mult': 2.0497722427931024, 'tsl_mult': 0.5340646619659769, 'strategy': 'mean_reversion', 'time_stop': 222, 'use_sma': False, 'use_atr': False, 'use_adx': False, 'use_ema': False, 'use_spike': False, 'rsi_required': False, 'edge_k': 1.3350783599052682, 'edge_cap': 0.2754860495876473}.
[I 2025-08-29 22:40:05,441] Trial 552 finished with values: [-1000000000.0, 1000000000.0] and parameters: {'p_sma': 35, 'p_std': 14, 'p_atr': 11, 'p_adx': 22, 'rsi_period': 9, 'ema1': 24, 'ema2': 19, 'slip_atr_k': 0.013800010241787166, 'slip_spread_k': 0.8163318333309274, 'spread_hl_frac': 0.01285383196125468, 'bb_std_mult': 2.9057386946735964, 'rsi_os': 42, 'rsi_ob': 59, 'vol_spike': 0.28784834643837953, 'adx_thresh': 22.388617596579607, 'atr_min_pct': 0.015146187411235417, 'atr_max_pct': 0.13977023711576653, 'tp_mult': 1.9624200809487433, 'tsl_mult': 0.5610757509572599, 'strategy': 'mean_reversion', 'time_stop': 216, 'use_sma': False, 'use_atr': False, 'use_adx': False, 'use_ema': False, 'use_spike': False, 'rsi_required': False, 'edge_k': 1.2478083846675183, 'edge_cap': 0.2459023438313806}.
[I 2025-08-29 22:40:05,502] Trial 548 finished with values: [-1000000000.0, 1000000000.0] and parameters: {'p_sma': 28, 'p_std': 11, 'p_atr': 9, 'p_adx': 22, 'rsi_period': 15, 'ema1': 23, 'ema2': 32, 'slip_atr_k': 0.2068029581403288, 'slip_spread_k': 0.7954700433431283, 'spread_hl_frac': 0.011770988882834331, 'bb_std_mult': 3.1754858783333804, 'rsi_os': 33, 'rsi_ob': 56, 'vol_spike': 0.004448351875144196, 'adx_thresh': 6.526722210242172, 'atr_min_pct': 0.01674579753583129, 'atr_max_pct': 0.13509264043615032, 'tp_mult': 1.8761583839228846, 'tsl_mult': 0.5591179512770824, 'strategy': 'breakout', 'time_stop': 32, 'use_sma': False, 'use_atr': False, 'use_adx': False, 'use_ema': False, 'use_spike': False, 'rsi_required': False, 'edge_k': 0.8429417469894105, 'edge_cap': 0.14945268132730016}.
[I 2025-08-29 22:40:32,862] Trial 554 finished with values: [-1000000000.0, 1000000000.0] and parameters: {'p_sma': 28, 'p_std': 12, 'p_atr': 8, 'p_adx': 8, 'rsi_period': 9, 'ema1': 28, 'ema2': 10, 'slip_atr_k': 0.00015372892361644385, 'slip_spread_k': 0.9161213460616144, 'spread_hl_frac': 0.02699626901323139, 'bb_std_mult': 1.8153884758095167, 'rsi_os': 42, 'rsi_ob': 61, 'vol_spike': 0.2728856174742798, 'adx_thresh': 22.37464967405204, 'atr_min_pct': 0.018357254149777312, 'atr_max_pct': 0.023616001519834166, 'tp_mult': 1.8635460467231415, 'tsl_mult': 0.2218845709948053, 'strategy': 'mean_reversion', 'time_stop': 31, 'use_sma': False, 'use_atr': False, 'use_adx': False, 'use_ema': False, 'use_spike': False, 'rsi_required': False, 'edge_k': 1.5004726795884116, 'edge_cap': 0.34049762766316183}.
[I 2025-08-29 22:40:33,058] Trial 556 finished with values: [-0.004356538275498867, 0.004320188923965081] and parameters: {'p_sma': 40, 'p_std': 10, 'p_atr': 9, 'p_adx': 30, 'rsi_period': 10, 'ema1': 13, 'ema2': 14, 'slip_atr_k': 0.11480910332310575, 'slip_spread_k': 0.8462204398287269, 'spread_hl_frac': 0.010064146770084059, 'bb_std_mult': 3.118196676919875, 'rsi_os': 49, 'rsi_ob': 61, 'vol_spike': 0.2716810898366744, 'adx_thresh': 19.215559282293324, 'atr_min_pct': 0.005523879865619277, 'atr_max_pct': 0.14365383154308317, 'tp_mult': 1.158941454251262, 'tsl_mult': 0.24260475352169308, 'strategy': 'mean_reversion', 'time_stop': 65, 'use_sma': False, 'use_atr': False, 'use_adx': False, 'use_ema': False, 'use_spike': False, 'rsi_required': False, 'edge_k': 1.1785097587465239, 'edge_cap': 0.16683204817006375}.
[I 2025-08-29 22:40:33,182] Trial 555 finished with values: [-1000000000.0, 1000000000.0] and parameters: {'p_sma': 42, 'p_std': 12, 'p_atr': 9, 'p_adx': 18, 'rsi_period': 10, 'ema1': 28, 'ema2': 14, 'slip_atr_k': 0.1792801442254503, 'slip_spread_k': 0.609787692373787, 'spread_hl_frac': 0.005766126507752128, 'bb_std_mult': 3.175632161405498, 'rsi_os': 8, 'rsi_ob': 63, 'vol_spike': 0.0681720858855549, 'adx_thresh': 20.894528795023525, 'atr_min_pct': 0.01010699547166342, 'atr_max_pct': 0.02356802546630983, 'tp_mult': 2.0163840111615188, 'tsl_mult': 0.24843800311195102, 'strategy': 'mean_reversion', 'time_stop': 32, 'use_sma': False, 'use_atr': False, 'use_adx': False, 'use_ema': False, 'use_spike': False, 'rsi_required': False, 'edge_k': 1.4894577456214326, 'edge_cap': 0.3399604859434069}.
[I 2025-08-29 22:40:33,307] Trial 553 finished with values: [-1000000000.0, 1000000000.0] and parameters: {'p_sma': 36, 'p_std': 12, 'p_atr': 9, 'p_adx': 24, 'rsi_period': 9, 'ema1': 23, 'ema2': 20, 'slip_atr_k': 0.00028199513709075986, 'slip_spread_k': 0.9163173171083187, 'spread_hl_frac': 0.005436635960692049, 'bb_std_mult': 3.1568461684110933, 'rsi_os': 7, 'rsi_ob': 61, 'vol_spike': 0.2857223828200737, 'adx_thresh': 20.93643629574138, 'atr_min_pct': 0.028747276799774017, 'atr_max_pct': 0.08801408091078573, 'tp_mult': 1.8870840576331105, 'tsl_mult': 0.9233033236820707, 'strategy': 'mean_reversion', 'time_stop': 33, 'use_sma': False, 'use_atr': False, 'use_adx': False, 'use_ema': False, 'use_spike': False, 'rsi_required': False, 'edge_k': 0.8966102119952377, 'edge_cap': 0.26913177614548867}.
[I 2025-08-29 22:41:00,799] Trial 560 finished with values: [-1000000000.0, 1000000000.0] and parameters: {'p_sma': 30, 'p_std': 8, 'p_atr': 11, 'p_adx': 23, 'rsi_period': 12, 'ema1': 19, 'ema2': 60, 'slip_atr_k': 0.005252831191644506, 'slip_spread_k': 0.9881488744790211, 'spread_hl_frac': 0.01988555148880233, 'bb_std_mult': 3.0322620570580856, 'rsi_os': 30, 'rsi_ob': 60, 'vol_spike': 0.2524540760610398, 'adx_thresh': 8.465448592688142, 'atr_min_pct': 0.008606889590530506, 'atr_max_pct': 0.1497849284448465, 'tp_mult': 2.161446005656801, 'tsl_mult': 0.5967923493708774, 'strategy': 'mean_reversion', 'time_stop': 291, 'use_sma': False, 'use_atr': False, 'use_adx': False, 'use_ema': False, 'use_spike': False, 'rsi_required': False, 'edge_k': 1.4374123869691064, 'edge_cap': 0.21161990515045298}.
[I 2025-08-29 22:41:00,937] Trial 558 finished with values: [-1000000000.0, 1000000000.0] and parameters: {'p_sma': 36, 'p_std': 13, 'p_atr': 28, 'p_adx': 24, 'rsi_period': 7, 'ema1': 30, 'ema2': 16, 'slip_atr_k': 0.19335498009656965, 'slip_spread_k': 0.8116676933838032, 'spread_hl_frac': 0.02015992070026878, 'bb_std_mult': 3.0319557774291357, 'rsi_os': 30, 'rsi_ob': 59, 'vol_spike': 0.14071673582821506, 'adx_thresh': 21.52274239430108, 'atr_min_pct': 0.008677422687432159, 'atr_max_pct': 0.13866726420201886, 'tp_mult': 2.027210149061543, 'tsl_mult': 0.9253004258386017, 'strategy': 'mean_reversion', 'time_stop': 247, 'use_sma': False, 'use_atr': False, 'use_adx': False, 'use_ema': False, 'use_spike': False, 'rsi_required': False, 'edge_k': 0.8916668677312841, 'edge_cap': 0.21521862643432796}.
[I 2025-08-29 22:41:01,139] Trial 559 finished with values: [-1000000000.0, 1000000000.0] and parameters: {'p_sma': 30, 'p_std': 13, 'p_atr': 18, 'p_adx': 24, 'rsi_period': 13, 'ema1': 18, 'ema2': 11, 'slip_atr_k': 0.004445433837109759, 'slip_spread_k': 0.8131224838337248, 'spread_hl_frac': 0.014008210060251068, 'bb_std_mult': 3.032795872475469, 'rsi_os': 36, 'rsi_ob': 60, 'vol_spike': 0.12257668486530518, 'adx_thresh': 21.476026441281093, 'atr_min_pct': 0.022440178457231192, 'atr_max_pct': 0.14979990961810635, 'tp_mult': 1.5468306391138178, 'tsl_mult': 0.9692119125230042, 'strategy': 'mean_reversion', 'time_stop': 293, 'use_sma': False, 'use_atr': False, 'use_adx': False, 'use_ema': False, 'use_spike': False, 'rsi_required': False, 'edge_k': 0.8939242372880126, 'edge_cap': 0.2160473908807119}.
[I 2025-08-29 22:41:01,139] Trial 557 finished with values: [-1000000000.0, 1000000000.0] and parameters: {'p_sma': 36, 'p_std': 12, 'p_atr': 28, 'p_adx': 18, 'rsi_period': 12, 'ema1': 18, 'ema2': 14, 'slip_atr_k': 0.16527949506631717, 'slip_spread_k': 0.8493490374739784, 'spread_hl_frac': 0.030571400110796572, 'bb_std_mult': 3.010721577317706, 'rsi_os': 7, 'rsi_ob': 63, 'vol_spike': 0.28186424128815174, 'adx_thresh': 19.24550151971657, 'atr_min_pct': 0.022106080641998215, 'atr_max_pct': 0.14315751287966025, 'tp_mult': 2.016227050990269, 'tsl_mult': 0.13403527160352918, 'strategy': 'mean_reversion', 'time_stop': 293, 'use_sma': False, 'use_atr': False, 'use_adx': False, 'use_ema': False, 'use_spike': False, 'rsi_required': False, 'edge_k': 1.444155980038883, 'edge_cap': 0.21444613443818883}.
[I 2025-08-29 22:41:28,809] Trial 562 finished with values: [-1000000000.0, 1000000000.0] and parameters: {'p_sma': 39, 'p_std': 13, 'p_atr': 27, 'p_adx': 25, 'rsi_period': 77, 'ema1': 24, 'ema2': 11, 'slip_atr_k': 0.0001366959024561576, 'slip_spread_k': 0.8566165727159072, 'spread_hl_frac': 0.013741222417463844, 'bb_std_mult': 2.9939752904779624, 'rsi_os': 38, 'rsi_ob': 91, 'vol_spike': 0.28071076553765106, 'adx_thresh': 20.34586300707863, 'atr_min_pct': 0.01091294928852575, 'atr_max_pct': 0.14280595698306206, 'tp_mult': 2.3121016295877124, 'tsl_mult': 0.9695263760250792, 'strategy': 'mean_reversion', 'time_stop': 45, 'use_sma': False, 'use_atr': False, 'use_adx': False, 'use_ema': False, 'use_spike': False, 'rsi_required': False, 'edge_k': 1.2983216666048276, 'edge_cap': 0.23699129319540835}.
[I 2025-08-29 22:41:29,014] Trial 561 finished with values: [-1000000000.0, 1000000000.0] and parameters: {'p_sma': 34, 'p_std': 13, 'p_atr': 10, 'p_adx': 24, 'rsi_period': 80, 'ema1': 11, 'ema2': 11, 'slip_atr_k': 0.009506174470820411, 'slip_spread_k': 0.8105976875679756, 'spread_hl_frac': 0.013805028178877117, 'bb_std_mult': 1.6337622376544367, 'rsi_os': 37, 'rsi_ob': 58, 'vol_spike': 0.2791371113525564, 'adx_thresh': 19.720493062463255, 'atr_min_pct': 0.022164079195928887, 'atr_max_pct': 0.14300717469947796, 'tp_mult': 2.274270543136433, 'tsl_mult': 0.5888826119586851, 'strategy': 'mean_reversion', 'time_stop': 300, 'use_sma': False, 'use_atr': False, 'use_adx': False, 'use_ema': False, 'use_spike': False, 'rsi_required': False, 'edge_k': 1.314954779493374, 'edge_cap': 0.24881608778862607}.
[I 2025-08-29 22:41:29,185] Trial 564 finished with values: [-1000000000.0, 1000000000.0] and parameters: {'p_sma': 39, 'p_std': 15, 'p_atr': 27, 'p_adx': 25, 'rsi_period': 7, 'ema1': 21, 'ema2': 28, 'slip_atr_k': 0.10294687178617368, 'slip_spread_k': 0.9660921803977314, 'spread_hl_frac': 0.04923557596750868, 'bb_std_mult': 2.9667368391039886, 'rsi_os': 31, 'rsi_ob': 58, 'vol_spike': 0.1693129986228516, 'adx_thresh': 19.828334756298226, 'atr_min_pct': 0.01081884360164642, 'atr_max_pct': 0.1399403441782729, 'tp_mult': 2.297543089349965, 'tsl_mult': 0.5856675771137072, 'strategy': 'breakout', 'time_stop': 274, 'use_sma': False, 'use_atr': False, 'use_adx': False, 'use_ema': False, 'use_spike': False, 'rsi_required': False, 'edge_k': 1.7227609540996371, 'edge_cap': 0.24963585581614603}.
[I 2025-08-29 22:41:29,276] Trial 563 finished with values: [-1000000000.0, 1000000000.0] and parameters: {'p_sma': 34, 'p_std': 9, 'p_atr': 10, 'p_adx': 25, 'rsi_period': 7, 'ema1': 21, 'ema2': 10, 'slip_atr_k': 0.008380054068772425, 'slip_spread_k': 0.0028479492792721772, 'spread_hl_frac': 0.008950835675809607, 'bb_std_mult': 1.6399445298360893, 'rsi_os': 31, 'rsi_ob': 65, 'vol_spike': 0.2651304146383855, 'adx_thresh': 19.900390459849838, 'atr_min_pct': 0.01095508629046292, 'atr_max_pct': 0.042057833401572826, 'tp_mult': 2.3041018934120734, 'tsl_mult': 0.04367439827065167, 'strategy': 'breakout', 'time_stop': 10, 'use_sma': False, 'use_atr': False, 'use_adx': False, 'use_ema': False, 'use_spike': False, 'rsi_required': False, 'edge_k': 1.0483018947638645, 'edge_cap': 0.24765814306182946}.
[I 2025-08-29 22:41:29,474] Trial 567 finished with values: [-1000000000.0, 1000000000.0] and parameters: {'p_sma': 25, 'p_std': 9, 'p_atr': 10, 'p_adx': 27, 'rsi_period': 83, 'ema1': 27, 'ema2': 13, 'slip_atr_k': 0.00534673699828445, 'slip_spread_k': 0.09797540414729156, 'spread_hl_frac': 0.00416776417766453, 'bb_std_mult': 2.8988715240122573, 'rsi_os': 32, 'rsi_ob': 57, 'vol_spike': 0.2678688488173054, 'adx_thresh': 14.474708796573427, 'atr_min_pct': 0.02039663136374331, 'atr_max_pct': 0.019689522807805435, 'tp_mult': 2.1165194849280278, 'tsl_mult': 0.5343330439126501, 'strategy': 'breakout', 'time_stop': 266, 'use_sma': False, 'use_atr': False, 'use_adx': False, 'use_ema': False, 'use_spike': False, 'rsi_required': False, 'edge_k': 0.7104023977853225, 'edge_cap': 0.884757503963275}.
[I 2025-08-29 22:41:29,553] Trial 569 finished with values: [-1000000000.0, 1000000000.0] and parameters: {'p_sma': 31, 'p_std': 11, 'p_atr': 11, 'p_adx': 23, 'rsi_period': 9, 'ema1': 15, 'ema2': 12, 'slip_atr_k': 0.24950084186342503, 'slip_spread_k': 0.7913100087054563, 'spread_hl_frac': 0.010735409429866812, 'bb_std_mult': 2.594263323247999, 'rsi_os': 52, 'rsi_ob': 59, 'vol_spike': 0.2622470574532389, 'adx_thresh': 22.924075101133226, 'atr_min_pct': 0.006464151714520026, 'atr_max_pct': 0.13789519314505316, 'tp_mult': 1.2754486002508452, 'tsl_mult': 0.5436023010490517, 'strategy': 'mean_reversion', 'time_stop': 235, 'use_sma': False, 'use_atr': False, 'use_adx': False, 'use_ema': False, 'use_spike': False, 'rsi_required': False, 'edge_k': 1.012280506379612, 'edge_cap': 0.16941431277094388}.
