2025-08-29 21:39:56,032 WARNING: DATA SANITY: Extreme jumps >20*ATR200: 42
[I 2025-08-29 21:39:56,044] A new study created in memory with name: no-name-0b51c4fa-ca12-414a-8214-47e1c9ef3da0
[I 2025-08-29 21:40:23,715] Trial 1 finished with values: [-1000000000.0, 1000000000.0] and parameters: {'p_sma': 42, 'p_std': 8, 'p_atr': 26, 'p_adx': 16, 'rsi_period': 27, 'ema1': 18, 'ema2': 45, 'slip_atr_k': 0.1524604903301387, 'slip_spread_k': 0.35998577534359133, 'spread_hl_frac': 0.013851601430281607, 'bb_std_mult': 1.5349069853248445, 'rsi_os': 18, 'rsi_ob': 74, 'vol_spike': 0.2521943997729897, 'adx_thresh': 15.112527820085367, 'atr_min_pct': 0.007664638465428408, 'atr_max_pct': 0.0630671401003048, 'tp_mult': 2.741526437442207, 'tsl_mult': 0.6774365553854252, 'strategy': 'mean_reversion', 'time_stop': 86, 'use_sma': False, 'use_atr': False, 'use_adx': False, 'use_ema': False, 'use_spike': False, 'rsi_required': False, 'edge_k': 1.3057743798215093, 'edge_cap': 0.8770864576046445}.
[I 2025-08-29 21:40:24,028] Trial 0 finished with values: [-1000000000.0, 1000000000.0] and parameters: {'p_sma': 47, 'p_std': 49, 'p_atr': 13, 'p_adx': 7, 'rsi_period': 67, 'ema1': 27, 'ema2': 14, 'slip_atr_k': 0.02961173831285563, 'slip_spread_k': 0.21756859765431524, 'spread_hl_frac': 0.028598325553254207, 'bb_std_mult': 3.326899699457591, 'rsi_os': 36, 'rsi_ob': 53, 'vol_spike': 0.017338991172519833, 'adx_thresh': 27.343590681669827, 'atr_min_pct': 0.015695012280673763, 'atr_max_pct': 0.06836721939400092, 'tp_mult': 1.7884045139480722, 'tsl_mult': 0.9401373967653442, 'strategy': 'mean_reversion', 'time_stop': 215, 'use_sma': False, 'use_atr': False, 'use_adx': False, 'use_ema': False, 'use_spike': False, 'rsi_required': False, 'edge_k': 0.5591717214269452, 'edge_cap': 0.054207476574339636}.
[I 2025-08-29 21:40:24,157] Trial 2 finished with values: [-1000000000.0, 1000000000.0] and parameters: {'p_sma': 57, 'p_std': 53, 'p_atr': 10, 'p_adx': 13, 'rsi_period': 25, 'ema1': 24, 'ema2': 50, 'slip_atr_k': 0.1940351011819116, 'slip_spread_k': 0.48167647198186214, 'spread_hl_frac': 0.006464809887823814, 'bb_std_mult': 1.1498782993950647, 'rsi_os': 5, 'rsi_ob': 88, 'vol_spike': 0.14691922460887386, 'adx_thresh': 16.698609472218127, 'atr_min_pct': 0.005391415658594756, 'atr_max_pct': 0.11757977349272147, 'tp_mult': 2.929375676089641, 'tsl_mult': 0.3901317604938802, 'strategy': 'breakout', 'time_stop': 158, 'use_sma': False, 'use_atr': False, 'use_adx': False, 'use_ema': False, 'use_spike': False, 'rsi_required': False, 'edge_k': 1.2568934565686343, 'edge_cap': 0.7688880137710365}.
[I 2025-08-29 21:40:24,230] Trial 3 finished with values: [-0.03852590661091604, 0.03851430519128365] and parameters: {'p_sma': 14, 'p_std': 14, 'p_atr': 9, 'p_adx': 19, 'rsi_period': 78, 'ema1': 24, 'ema2': 16, 'slip_atr_k': 0.05767691378782816, 'slip_spread_k': 0.5479747264088638, 'spread_hl_frac': 0.015249974253296151, 'bb_std_mult': 1.4712046851801932, 'rsi_os': 47, 'rsi_ob': 52, 'vol_spike': 0.031092799345112453, 'adx_thresh': 7.603438167883989, 'atr_min_pct': 0.0004055127456854956, 'atr_max_pct': 0.0657067645648385, 'tp_mult': 2.731791345011799, 'tsl_mult': 0.2727752149070741, 'strategy': 'breakout', 'time_stop': 78, 'use_sma': False, 'use_atr': False, 'use_adx': False, 'use_ema': False, 'use_spike': False, 'rsi_required': False, 'edge_k': 1.4470083752871168, 'edge_cap': 0.2959882236577708}.
[I 2025-08-29 21:40:50,769] Trial 4 finished with values: [-1000000000.0, 1000000000.0] and parameters: {'p_sma': 12, 'p_std': 50, 'p_atr': 27, 'p_adx': 29, 'rsi_period': 27, 'ema1': 19, 'ema2': 30, 'slip_atr_k': 0.23467659682158062, 'slip_spread_k': 0.18378814017932943, 'spread_hl_frac': 0.03007534320749468, 'bb_std_mult': 3.1967977883365775, 'rsi_os': 18, 'rsi_ob': 90, 'vol_spike': 0.21077303627491203, 'adx_thresh': 31.52316469659203, 'atr_min_pct': 0.024305046348503424, 'atr_max_pct': 0.0542595135459926, 'tp_mult': 2.0666226605665488, 'tsl_mult': 0.729604135889097, 'strategy': 'breakout', 'time_stop': 104, 'use_sma': False, 'use_atr': False, 'use_adx': False, 'use_ema': False, 'use_spike': False, 'rsi_required': False, 'edge_k': 0.3073410231099074, 'edge_cap': 0.487073837454793}.
[I 2025-08-29 21:40:51,618] Trial 5 finished with values: [-1000000000.0, 1000000000.0] and parameters: {'p_sma': 15, 'p_std': 41, 'p_atr': 15, 'p_adx': 25, 'rsi_period': 20, 'ema1': 30, 'ema2': 44, 'slip_atr_k': 0.17187505698162941, 'slip_spread_k': 0.9933238050046651, 'spread_hl_frac': 0.02796715210821925, 'bb_std_mult': 3.152691635699806, 'rsi_os': 47, 'rsi_ob': 56, 'vol_spike': 0.1758050972719194, 'adx_thresh': 5.596183923680567, 'atr_min_pct': 0.026545740028738683, 'atr_max_pct': 0.060279293148126696, 'tp_mult': 1.13772223127022, 'tsl_mult': 0.9534703227394159, 'strategy': 'mean_reversion', 'time_stop': 195, 'use_sma': False, 'use_atr': False, 'use_adx': False, 'use_ema': False, 'use_spike': False, 'rsi_required': False, 'edge_k': 1.654020985190654, 'edge_cap': 0.7615526767362878}.
[I 2025-08-29 21:40:51,901] Trial 7 finished with values: [-1000000000.0, 1000000000.0] and parameters: {'p_sma': 12, 'p_std': 39, 'p_atr': 28, 'p_adx': 21, 'rsi_period': 76, 'ema1': 7, 'ema2': 18, 'slip_atr_k': 0.11334191207378083, 'slip_spread_k': 0.7240171848328781, 'spread_hl_frac': 0.013475279153600628, 'bb_std_mult': 2.6887800323444773, 'rsi_os': 37, 'rsi_ob': 89, 'vol_spike': 0.15186071227785794, 'adx_thresh': 6.138201830148392, 'atr_min_pct': 0.013606842595040343, 'atr_max_pct': 0.05557944881939095, 'tp_mult': 2.4705010142397033, 'tsl_mult': 0.013702176720515657, 'strategy': 'breakout', 'time_stop': 204, 'use_sma': False, 'use_atr': False, 'use_adx': False, 'use_ema': False, 'use_spike': False, 'rsi_required': False, 'edge_k': 0.0901655221444817, 'edge_cap': 0.7917948872104399}.
[I 2025-08-29 21:40:52,193] Trial 6 finished with values: [-1000000000.0, 1000000000.0] and parameters: {'p_sma': 41, 'p_std': 36, 'p_atr': 9, 'p_adx': 27, 'rsi_period': 28, 'ema1': 7, 'ema2': 43, 'slip_atr_k': 0.14322605280424916, 'slip_spread_k': 0.7565430012641369, 'spread_hl_frac': 0.02349198743422573, 'bb_std_mult': 1.7853074105485807, 'rsi_os': 30, 'rsi_ob': 63, 'vol_spike': 0.2707227115502681, 'adx_thresh': 33.34312801308124, 'atr_min_pct': 0.005171082824449422, 'atr_max_pct': 0.08245809333902333, 'tp_mult': 1.4580753592507407, 'tsl_mult': 0.5194176224243513, 'strategy': 'breakout', 'time_stop': 270, 'use_sma': False, 'use_atr': False, 'use_adx': False, 'use_ema': False, 'use_spike': False, 'rsi_required': False, 'edge_k': 1.9849676563507839, 'edge_cap': 0.1560539281223429}.
[I 2025-08-29 21:41:18,552] Trial 8 finished with values: [-1000000000.0, 1000000000.0] and parameters: {'p_sma': 34, 'p_std': 41, 'p_atr': 26, 'p_adx': 18, 'rsi_period': 12, 'ema1': 28, 'ema2': 54, 'slip_atr_k': 0.1079343701910506, 'slip_spread_k': 0.3368395261128363, 'spread_hl_frac': 0.03717776555693938, 'bb_std_mult': 1.0634495092246745, 'rsi_os': 49, 'rsi_ob': 59, 'vol_spike': 0.1684868532444562, 'adx_thresh': 7.98976700516231, 'atr_min_pct': 0.028454743967185666, 'atr_max_pct': 0.12112856815573048, 'tp_mult': 2.8584757822605096, 'tsl_mult': 0.6451197891221596, 'strategy': 'mean_reversion', 'time_stop': 268, 'use_sma': False, 'use_atr': False, 'use_adx': False, 'use_ema': False, 'use_spike': False, 'rsi_required': False, 'edge_k': 1.4099485962013238, 'edge_cap': 0.6247405762830333}.
[I 2025-08-29 21:41:19,277] Trial 10 finished with values: [-1000000000.0, 1000000000.0] and parameters: {'p_sma': 31, 'p_std': 39, 'p_atr': 29, 'p_adx': 26, 'rsi_period': 54, 'ema1': 29, 'ema2': 54, 'slip_atr_k': 0.08848444240829165, 'slip_spread_k': 0.5996765780002351, 'spread_hl_frac': 0.021934455070679478, 'bb_std_mult': 3.241061962331515, 'rsi_os': 28, 'rsi_ob': 83, 'vol_spike': 0.06262803622827592, 'adx_thresh': 17.70951675276832, 'atr_min_pct': 0.025354285711787432, 'atr_max_pct': 0.10557818300154762, 'tp_mult': 2.8957887056227882, 'tsl_mult': 0.9441956512258347, 'strategy': 'breakout', 'time_stop': 144, 'use_sma': False, 'use_atr': False, 'use_adx': False, 'use_ema': False, 'use_spike': False, 'rsi_required': False, 'edge_k': 0.17028000085692074, 'edge_cap': 0.9606123132013082}.
[I 2025-08-29 21:41:19,677] Trial 9 finished with values: [-1000000000.0, 1000000000.0] and parameters: {'p_sma': 48, 'p_std': 47, 'p_atr': 8, 'p_adx': 16, 'rsi_period': 84, 'ema1': 11, 'ema2': 12, 'slip_atr_k': 0.17911674006151462, 'slip_spread_k': 0.4854154943419148, 'spread_hl_frac': 0.023912762195205706, 'bb_std_mult': 1.2412821077123077, 'rsi_os': 46, 'rsi_ob': 74, 'vol_spike': 0.11483802956790978, 'adx_thresh': 20.777240251000784, 'atr_min_pct': 0.026695934231528246, 'atr_max_pct': 0.028878651901241142, 'tp_mult': 1.7993080482607313, 'tsl_mult': 0.5382465567900697, 'strategy': 'breakout', 'time_stop': 202, 'use_sma': False, 'use_atr': False, 'use_adx': False, 'use_ema': False, 'use_spike': False, 'rsi_required': False, 'edge_k': 0.49531732376851867, 'edge_cap': 0.9713510025548652}.
[I 2025-08-29 21:41:20,217] Trial 11 finished with values: [-1000000000.0, 1000000000.0] and parameters: {'p_sma': 21, 'p_std': 33, 'p_atr': 18, 'p_adx': 18, 'rsi_period': 49, 'ema1': 15, 'ema2': 23, 'slip_atr_k': 0.24787878926237045, 'slip_spread_k': 0.39124696055179364, 'spread_hl_frac': 0.011931369931768483, 'bb_std_mult': 3.366037430239212, 'rsi_os': 26, 'rsi_ob': 89, 'vol_spike': 0.21533783970874829, 'adx_thresh': 7.645513034999166, 'atr_min_pct': 0.01836739548563304, 'atr_max_pct': 0.14174058729473762, 'tp_mult': 2.674115940159532, 'tsl_mult': 0.5563081410900477, 'strategy': 'mean_reversion', 'time_stop': 243, 'use_sma': False, 'use_atr': False, 'use_adx': False, 'use_ema': False, 'use_spike': False, 'rsi_required': False, 'edge_k': 0.1896597936114537, 'edge_cap': 0.8410516858430874}.
[I 2025-08-29 21:41:44,773] Trial 12 finished with values: [-1000000000.0, 1000000000.0] and parameters: {'p_sma': 49, 'p_std': 37, 'p_atr': 9, 'p_adx': 19, 'rsi_period': 26, 'ema1': 24, 'ema2': 18, 'slip_atr_k': 0.012350738589175236, 'slip_spread_k': 0.06082029148392132, 'spread_hl_frac': 0.04628839770365825, 'bb_std_mult': 1.5030105866295513, 'rsi_os': 40, 'rsi_ob': 95, 'vol_spike': 0.16920983804717818, 'adx_thresh': 8.707006226929996, 'atr_min_pct': 0.007322041126916088, 'atr_max_pct': 0.07407574890967131, 'tp_mult': 2.6421475754130617, 'tsl_mult': 0.46199119417508405, 'strategy': 'mean_reversion', 'time_stop': 187, 'use_sma': False, 'use_atr': False, 'use_adx': False, 'use_ema': False, 'use_spike': False, 'rsi_required': False, 'edge_k': 1.9255281445541832, 'edge_cap': 0.6812548368540359}.
[I 2025-08-29 21:41:45,931] Trial 13 finished with values: [-0.01223964141797873, 0.012312151567586048] and parameters: {'p_sma': 21, 'p_std': 16, 'p_atr': 20, 'p_adx': 11, 'rsi_period': 84, 'ema1': 12, 'ema2': 28, 'slip_atr_k': 0.021492634874247518, 'slip_spread_k': 0.00832157468500716, 'spread_hl_frac': 0.047965043753615245, 'bb_std_mult': 0.6691180228985174, 'rsi_os': 55, 'rsi_ob': 45, 'vol_spike': 0.0781256640241209, 'adx_thresh': 11.540810874016174, 'atr_min_pct': 0.002055502025048997, 'atr_max_pct': 0.013183201682972087, 'tp_mult': 2.274651070287297, 'tsl_mult': 0.1825096496007031, 'strategy': 'breakout', 'time_stop': 9, 'use_sma': False, 'use_atr': False, 'use_adx': False, 'use_ema': False, 'use_spike': False, 'rsi_required': False, 'edge_k': 0.8174889305008127, 'edge_cap': 0.3199469984026973}.
[I 2025-08-29 21:41:46,782] Trial 14 finished with values: [-0.035136049948765846, 0.03512491577861504] and parameters: {'p_sma': 24, 'p_std': 19, 'p_atr': 15, 'p_adx': 8, 'rsi_period': 64, 'ema1': 23, 'ema2': 27, 'slip_atr_k': 0.01607054878004155, 'slip_spread_k': 0.02890003357827886, 'spread_hl_frac': 0.04607955169442844, 'bb_std_mult': 0.5310826118012664, 'rsi_os': 53, 'rsi_ob': 50, 'vol_spike': 0.0166597018474465, 'adx_thresh': 24.87077037457538, 'atr_min_pct': 0.0008705584311284307, 'atr_max_pct': 0.010053656429159494, 'tp_mult': 2.348621308165783, 'tsl_mult': 0.24191571373997728, 'strategy': 'breakout', 'time_stop': 11, 'use_sma': False, 'use_atr': False, 'use_adx': False, 'use_ema': False, 'use_spike': False, 'rsi_required': False, 'edge_k': 0.86127161674962, 'edge_cap': 0.2553102354435091}.
[I 2025-08-29 21:41:47,458] Trial 15 finished with values: [-0.03523509702105254, 0.03522482842790242] and parameters: {'p_sma': 6, 'p_std': 18, 'p_atr': 13, 'p_adx': 7, 'rsi_period': 66, 'ema1': 24, 'ema2': 32, 'slip_atr_k': 0.03100342731886942, 'slip_spread_k': 0.019854934504637933, 'spread_hl_frac': 0.04562239949333335, 'bb_std_mult': 2.3052505700670056, 'rsi_os': 55, 'rsi_ob': 47, 'vol_spike': 0.006241652727627195, 'adx_thresh': 25.690727733343742, 'atr_min_pct': 0.0003318723943353651, 'atr_max_pct': 0.015563779151390601, 'tp_mult': 2.212970421713738, 'tsl_mult': 0.23409814342375823, 'strategy': 'breakout', 'time_stop': 16, 'use_sma': False, 'use_atr': False, 'use_adx': False, 'use_ema': False, 'use_spike': False, 'rsi_required': False, 'edge_k': 0.7673239284596995, 'edge_cap': 0.26396861262823884}.
[I 2025-08-29 21:42:11,943] Trial 16 finished with values: [-0.05025065404934215, 0.050239818712727265] and parameters: {'p_sma': 23, 'p_std': 13, 'p_atr': 13, 'p_adx': 8, 'rsi_period': 66, 'ema1': 23, 'ema2': 32, 'slip_atr_k': 0.046164153510567706, 'slip_spread_k': 0.6863535346760958, 'spread_hl_frac': 0.0001894849448980246, 'bb_std_mult': 2.3258451286959283, 'rsi_os': 54, 'rsi_ob': 45, 'vol_spike': 0.008726124158027457, 'adx_thresh': 25.743283054061184, 'atr_min_pct': 0.0007378999506080844, 'atr_max_pct': 0.01399535761915164, 'tp_mult': 2.221254030527764, 'tsl_mult': 0.24228726641357817, 'strategy': 'breakout', 'time_stop': 16, 'use_sma': False, 'use_atr': False, 'use_adx': False, 'use_ema': False, 'use_spike': False, 'rsi_required': False, 'edge_k': 0.8547426298659404, 'edge_cap': 0.27437096278555234}.
[I 2025-08-29 21:42:13,254] Trial 17 finished with values: [-0.05176683824446171, 0.05175555093585474] and parameters: {'p_sma': 25, 'p_std': 19, 'p_atr': 22, 'p_adx': 8, 'rsi_period': 64, 'ema1': 13, 'ema2': 33, 'slip_atr_k': 0.05556620732032433, 'slip_spread_k': 0.0001729608740264118, 'spread_hl_frac': 0.04941222520913498, 'bb_std_mult': 0.6552426552442605, 'rsi_os': 54, 'rsi_ob': 45, 'vol_spike': 0.07972335291345338, 'adx_thresh': 13.109339700002478, 'atr_min_pct': 0.0006162683243312011, 'atr_max_pct': 0.011628600819440916, 'tp_mult': 2.258201730065752, 'tsl_mult': 0.1500519314542223, 'strategy': 'breakout', 'time_stop': 10, 'use_sma': False, 'use_atr': False, 'use_adx': False, 'use_ema': False, 'use_spike': False, 'rsi_required': False, 'edge_k': 0.8537470956834896, 'edge_cap': 0.34915565722222386}.
[I 2025-08-29 21:42:13,931] Trial 18 finished with values: [-0.048377260084839335, 0.04836576946144454] and parameters: {'p_sma': 24, 'p_std': 24, 'p_atr': 21, 'p_adx': 8, 'rsi_period': 61, 'ema1': 13, 'ema2': 34, 'slip_atr_k': 0.061590658197355624, 'slip_spread_k': 0.07001894635205835, 'spread_hl_frac': 0.04969382721896333, 'bb_std_mult': 0.5114106182482994, 'rsi_os': 53, 'rsi_ob': 45, 'vol_spike': 0.08790594691948195, 'adx_thresh': 13.212902674760638, 'atr_min_pct': 0.0007267469796601944, 'atr_max_pct': 0.010205141455608996, 'tp_mult': 2.173608750446781, 'tsl_mult': 0.09596823768325558, 'strategy': 'breakout', 'time_stop': 7, 'use_sma': False, 'use_atr': False, 'use_adx': False, 'use_ema': False, 'use_spike': False, 'rsi_required': False, 'edge_k': 0.8293739289888159, 'edge_cap': 0.39090334847197983}.
[I 2025-08-29 21:42:14,631] Trial 19 finished with values: [-1000000000.0, 1000000000.0] and parameters: {'p_sma': 26, 'p_std': 24, 'p_atr': 22, 'p_adx': 11, 'rsi_period': 63, 'ema1': 13, 'ema2': 27, 'slip_atr_k': 0.06671149031342036, 'slip_spread_k': 0.16462750556308625, 'spread_hl_frac': 0.04013619793846203, 'bb_std_mult': 0.5977558791847999, 'rsi_os': 55, 'rsi_ob': 47, 'vol_spike': 0.0881922647653782, 'adx_thresh': 13.528053615497452, 'atr_min_pct': 0.011946307208930095, 'atr_max_pct': 0.03334105876594757, 'tp_mult': 2.276787955071154, 'tsl_mult': 0.011600387840083215, 'strategy': 'breakout', 'time_stop': 10, 'use_sma': False, 'use_atr': False, 'use_adx': False, 'use_ema': False, 'use_spike': False, 'rsi_required': False, 'edge_k': 1.045524483320785, 'edge_cap': 0.44683273481995117}.
[I 2025-08-29 21:42:38,933] Trial 20 finished with values: [-1000000000.0, 1000000000.0] and parameters: {'p_sma': 27, 'p_std': 24, 'p_atr': 22, 'p_adx': 11, 'rsi_period': 40, 'ema1': 12, 'ema2': 25, 'slip_atr_k': 0.07654563290529168, 'slip_spread_k': 0.16474112917107497, 'spread_hl_frac': 0.03970094816663373, 'bb_std_mult': 0.6588988406615257, 'rsi_os': 42, 'rsi_ob': 65, 'vol_spike': 0.08460359220132915, 'adx_thresh': 12.838966899285722, 'atr_min_pct': 0.012217429069606614, 'atr_max_pct': 0.03400874905380501, 'tp_mult': 2.4046394304812724, 'tsl_mult': 0.04327569901415701, 'strategy': 'breakout', 'time_stop': 48, 'use_sma': False, 'use_atr': False, 'use_adx': False, 'use_ema': False, 'use_spike': False, 'rsi_required': False, 'edge_k': 1.002420200336054, 'edge_cap': 0.4171020207130707}.
[I 2025-08-29 21:42:40,753] Trial 21 finished with values: [-1000000000.0, 1000000000.0] and parameters: {'p_sma': 34, 'p_std': 26, 'p_atr': 22, 'p_adx': 11, 'rsi_period': 80, 'ema1': 11, 'ema2': 25, 'slip_atr_k': 0.08463412383622626, 'slip_spread_k': 0.16598363668925167, 'spread_hl_frac': 0.040718529711855626, 'bb_std_mult': 0.6137090327760564, 'rsi_os': 42, 'rsi_ob': 65, 'vol_spike': 0.10013455800468311, 'adx_thresh': 11.717594013262447, 'atr_min_pct': 0.01135767716161883, 'atr_max_pct': 0.034460518512677576, 'tp_mult': 1.6836089153547633, 'tsl_mult': 0.002737666460494781, 'strategy': 'breakout', 'time_stop': 48, 'use_sma': False, 'use_atr': False, 'use_adx': False, 'use_ema': False, 'use_spike': False, 'rsi_required': False, 'edge_k': 1.1060203095519148, 'edge_cap': 0.5281759839251957}.
[I 2025-08-29 21:42:40,871] Trial 22 finished with values: [-1000000000.0, 1000000000.0] and parameters: {'p_sma': 31, 'p_std': 26, 'p_atr': 23, 'p_adx': 11, 'rsi_period': 84, 'ema1': 5, 'ema2': 25, 'slip_atr_k': 0.007212020553680705, 'slip_spread_k': 0.1908729237111301, 'spread_hl_frac': 0.03928419905208739, 'bb_std_mult': 0.8122476092411902, 'rsi_os': 43, 'rsi_ob': 64, 'vol_spike': 0.10969498618099434, 'adx_thresh': 21.314018171993062, 'atr_min_pct': 0.013102191561812153, 'atr_max_pct': 0.03642755044576171, 'tp_mult': 1.8220448919702215, 'tsl_mult': 0.3789688826468741, 'strategy': 'breakout', 'time_stop': 51, 'use_sma': False, 'use_atr': False, 'use_adx': False, 'use_ema': False, 'use_spike': False, 'rsi_required': False, 'edge_k': 1.1139569823863713, 'edge_cap': 0.4609680916192035}.
[I 2025-08-29 21:42:41,160] Trial 26 finished with values: [-1000000000.0, 1000000000.0] and parameters: {'p_sma': 5, 'p_std': 59, 'p_atr': 19, 'p_adx': 22, 'rsi_period': 74, 'ema1': 16, 'ema2': 39, 'slip_atr_k': 0.032223743654729894, 'slip_spread_k': 0.05759798009791801, 'spread_hl_frac': 0.044663612234949, 'bb_std_mult': 2.1591838763159736, 'rsi_os': 50, 'rsi_ob': 50, 'vol_spike': 0.05221341984790874, 'adx_thresh': 23.490805706949324, 'atr_min_pct': 0.021049396772282764, 'atr_max_pct': 0.022664964344536007, 'tp_mult': 1.9747721604961057, 'tsl_mult': 0.20076571358396106, 'strategy': 'mean_reversion', 'time_stop': 36, 'use_sma': False, 'use_atr': False, 'use_adx': False, 'use_ema': False, 'use_spike': False, 'rsi_required': False, 'edge_k': 0.5922357216175355, 'edge_cap': 0.20824706927980874}.
[I 2025-08-29 21:42:41,772] Trial 23 finished with values: [-1000000000.0, 1000000000.0] and parameters: {'p_sma': 32, 'p_std': 58, 'p_atr': 18, 'p_adx': 11, 'rsi_period': 40, 'ema1': 9, 'ema2': 39, 'slip_atr_k': 0.0002212281267489867, 'slip_spread_k': 0.2665920209559488, 'spread_hl_frac': 0.0377449301311017, 'bb_std_mult': 0.9040364213598968, 'rsi_os': 41, 'rsi_ob': 64, 'vol_spike': 0.0475273000301945, 'adx_thresh': 20.655680941568484, 'atr_min_pct': 0.020898026784362242, 'atr_max_pct': 0.09649737172795425, 'tp_mult': 1.823667992519349, 'tsl_mult': 0.35410675787302337, 'strategy': 'breakout', 'time_stop': 49, 'use_sma': False, 'use_atr': False, 'use_adx': False, 'use_ema': False, 'use_spike': False, 'rsi_required': False, 'edge_k': 1.0951485451896437, 'edge_cap': 0.6011465355531238}.
[I 2025-08-29 21:43:05,892] Trial 24 finished with values: [-1000000000.0, 1000000000.0] and parameters: {'p_sma': 7, 'p_std': 5, 'p_atr': 19, 'p_adx': 13, 'rsi_period': 84, 'ema1': 9, 'ema2': 39, 'slip_atr_k': 0.010740544770624, 'slip_spread_k': 0.02124742487855017, 'spread_hl_frac': 0.04495819734759641, 'bb_std_mult': 2.1751039696064156, 'rsi_os': 50, 'rsi_ob': 49, 'vol_spike': 0.12220984950489885, 'adx_thresh': 21.304581389331663, 'atr_min_pct': 0.020239541366530233, 'atr_max_pct': 0.02511073007859883, 'tp_mult': 1.8276125364671905, 'tsl_mult': 0.26121739337908734, 'strategy': 'breakout', 'time_stop': 49, 'use_sma': False, 'use_atr': False, 'use_adx': False, 'use_ema': False, 'use_spike': False, 'rsi_required': False, 'edge_k': 0.6092239295406413, 'edge_cap': 0.19736873917071623}.
[I 2025-08-29 21:43:07,809] Trial 25 finished with values: [-1000000000.0, 1000000000.0] and parameters: {'p_sma': 6, 'p_std': 5, 'p_atr': 18, 'p_adx': 14, 'rsi_period': 71, 'ema1': 5, 'ema2': 37, 'slip_atr_k': 0.0019244050383932475, 'slip_spread_k': 0.006822030705712245, 'spread_hl_frac': 0.03456305784037242, 'bb_std_mult': 2.242238312049499, 'rsi_os': 50, 'rsi_ob': 51, 'vol_spike': 0.0421284569112688, 'adx_thresh': 24.511760495307705, 'atr_min_pct': 0.017381618577496094, 'atr_max_pct': 0.023052789589196845, 'tp_mult': 1.0970484078711422, 'tsl_mult': 0.24345520511719926, 'strategy': 'breakout', 'time_stop': 50, 'use_sma': False, 'use_atr': False, 'use_adx': False, 'use_ema': False, 'use_spike': False, 'rsi_required': False, 'edge_k': 0.5555483812715842, 'edge_cap': 0.19220744560078945}.
