[I 2025-08-29 23:18:22,118] Trial 919 finished with values: [-1000000000.0, 1000000000.0] and parameters: {'p_sma': 43, 'p_std': 16, 'p_atr': 19, 'p_adx': 13, 'rsi_period': 51, 'ema1': 18, 'ema2': 58, 'slip_atr_k': 0.004386530299298482, 'slip_spread_k': 0.23651896414565932, 'spread_hl_frac': 0.008786208160799315, 'bb_std_mult': 1.284565816318727, 'rsi_os': 15, 'rsi_ob': 60, 'vol_spike': 0.2561902587549856, 'adx_thresh': 19.639952892591253, 'atr_min_pct': 0.004831633242216116, 'atr_max_pct': 0.05539732503497227, 'tp_mult': 2.94273784169523, 'tsl_mult': 0.2287840175631266, 'strategy': 'mean_reversion', 'time_stop': 296, 'use_sma': False, 'use_atr': False, 'use_adx': False, 'use_ema': False, 'use_spike': False, 'rsi_required': False, 'edge_k': 1.9679392229346062, 'edge_cap': 0.17127816809745186}.
[I 2025-08-29 23:18:22,304] Trial 921 finished with values: [-1000000000.0, 1000000000.0] and parameters: {'p_sma': 56, 'p_std': 16, 'p_atr': 13, 'p_adx': 13, 'rsi_period': 9, 'ema1': 10, 'ema2': 19, 'slip_atr_k': 0.00023522032448560957, 'slip_spread_k': 0.23558264189684786, 'spread_hl_frac': 0.038954390063158775, 'bb_std_mult': 1.284273505513874, 'rsi_os': 15, 'rsi_ob': 70, 'vol_spike': 0.2314025004804203, 'adx_thresh': 21.85057546788812, 'atr_min_pct': 0.0078242742507499, 'atr_max_pct': 0.050065909660441554, 'tp_mult': 2.7066126947533364, 'tsl_mult': 0.6242354968252828, 'strategy': 'mean_reversion', 'time_stop': 300, 'use_sma': False, 'use_atr': False, 'use_adx': False, 'use_ema': False, 'use_spike': False, 'rsi_required': False, 'edge_k': 1.185867579417068, 'edge_cap': 0.11112892845289184}.
[I 2025-08-29 23:18:22,562] Trial 918 finished with values: [-0.0009265866226855213, 0.00177330828504181] and parameters: {'p_sma': 8, 'p_std': 12, 'p_atr': 29, 'p_adx': 13, 'rsi_period': 18, 'ema1': 18, 'ema2': 17, 'slip_atr_k': 0.00500471510963153, 'slip_spread_k': 0.24201772404999403, 'spread_hl_frac': 0.00857010885313969, 'bb_std_mult': 1.1808957145137506, 'rsi_os': 41, 'rsi_ob': 70, 'vol_spike': 0.052905135458851574, 'adx_thresh': 20.061970256789078, 'atr_min_pct': 0.003917452639718422, 'atr_max_pct': 0.08937933884530909, 'tp_mult': 1.1391871972997367, 'tsl_mult': 0.9587107268118918, 'strategy': 'mean_reversion', 'time_stop': 12, 'use_sma': False, 'use_atr': False, 'use_adx': False, 'use_ema': False, 'use_spike': False, 'rsi_required': False, 'edge_k': 1.9703256193756062, 'edge_cap': 0.42448098384025995}.
[I 2025-08-29 23:18:22,683] Trial 920 finished with values: [-1000000000.0, 1000000000.0] and parameters: {'p_sma': 25, 'p_std': 16, 'p_atr': 20, 'p_adx': 28, 'rsi_period': 9, 'ema1': 29, 'ema2': 20, 'slip_atr_k': 0.2308954944812142, 'slip_spread_k': 0.2315913592438663, 'spread_hl_frac': 0.008489075295582345, 'bb_std_mult': 1.19160585406806, 'rsi_os': 8, 'rsi_ob': 60, 'vol_spike': 0.25450385057419567, 'adx_thresh': 21.96491824782314, 'atr_min_pct': 0.007980324749954784, 'atr_max_pct': 0.03799212575827764, 'tp_mult': 1.145918171040587, 'tsl_mult': 0.6250915027234869, 'strategy': 'mean_reversion', 'time_stop': 300, 'use_sma': False, 'use_atr': False, 'use_adx': False, 'use_ema': False, 'use_spike': False, 'rsi_required': False, 'edge_k': 1.9670476922205213, 'edge_cap': 0.09542672644994538}.
[I 2025-08-29 23:18:50,119] Trial 924 finished with values: [-1000000000.0, 1000000000.0] and parameters: {'p_sma': 26, 'p_std': 11, 'p_atr': 20, 'p_adx': 12, 'rsi_period': 11, 'ema1': 24, 'ema2': 20, 'slip_atr_k': 0.13238234309354752, 'slip_spread_k': 0.2639981651493675, 'spread_hl_frac': 0.0315087601791128, 'bb_std_mult': 1.1940513281144296, 'rsi_os': 21, 'rsi_ob': 63, 'vol_spike': 0.28451198537147004, 'adx_thresh': 20.850214863164762, 'atr_min_pct': 0.018513322329209596, 'atr_max_pct': 0.0829258068518993, 'tp_mult': 1.9782157655837787, 'tsl_mult': 0.9809848016828793, 'strategy': 'breakout', 'time_stop': 26, 'use_sma': False, 'use_atr': False, 'use_adx': False, 'use_ema': False, 'use_spike': False, 'rsi_required': False, 'edge_k': 1.9981162833477866, 'edge_cap': 0.08519704242812842}.
[I 2025-08-29 23:18:50,287] Trial 925 finished with values: [-1000000000.0, 1000000000.0] and parameters: {'p_sma': 27, 'p_std': 11, 'p_atr': 11, 'p_adx': 12, 'rsi_period': 11, 'ema1': 24, 'ema2': 17, 'slip_atr_k': 0.012453937009937549, 'slip_spread_k': 0.28058199848670945, 'spread_hl_frac': 0.011977929606025775, 'bb_std_mult': 1.4423412607581578, 'rsi_os': 35, 'rsi_ob': 66, 'vol_spike': 0.2848049515045033, 'adx_thresh': 18.46413690768422, 'atr_min_pct': 0.009426942151149378, 'atr_max_pct': 0.08314074298664091, 'tp_mult': 1.099975732279779, 'tsl_mult': 0.9552385981127538, 'strategy': 'breakout', 'time_stop': 270, 'use_sma': False, 'use_atr': False, 'use_adx': False, 'use_ema': False, 'use_spike': False, 'rsi_required': False, 'edge_k': 1.9950068678199502, 'edge_cap': 0.21308952763216127}.
[I 2025-08-29 23:18:50,391] Trial 922 finished with values: [-1000000000.0, 1000000000.0] and parameters: {'p_sma': 26, 'p_std': 14, 'p_atr': 13, 'p_adx': 8, 'rsi_period': 10, 'ema1': 28, 'ema2': 20, 'slip_atr_k': 0.0834339570433933, 'slip_spread_k': 0.27169336323614823, 'spread_hl_frac': 0.0029523611755902686, 'bb_std_mult': 1.4477298044487614, 'rsi_os': 36, 'rsi_ob': 67, 'vol_spike': 0.23271493122300874, 'adx_thresh': 22.056455109719543, 'atr_min_pct': 0.008391161971113953, 'atr_max_pct': 0.013009430160668689, 'tp_mult': 2.696833363226028, 'tsl_mult': 0.5715136307798637, 'strategy': 'mean_reversion', 'time_stop': 67, 'use_sma': False, 'use_atr': False, 'use_adx': False, 'use_ema': False, 'use_spike': False, 'rsi_required': False, 'edge_k': 1.967395657452163, 'edge_cap': 0.20490941190342687}.
[I 2025-08-29 23:18:50,468] Trial 923 finished with values: [-1000000000.0, 1000000000.0] and parameters: {'p_sma': 26, 'p_std': 11, 'p_atr': 11, 'p_adx': 8, 'rsi_period': 11, 'ema1': 29, 'ema2': 17, 'slip_atr_k': 0.2065358250555231, 'slip_spread_k': 0.27539233344575664, 'spread_hl_frac': 0.025913231128494457, 'bb_std_mult': 1.443279736603698, 'rsi_os': 33, 'rsi_ob': 82, 'vol_spike': 0.22998557066562111, 'adx_thresh': 6.200735938839658, 'atr_min_pct': 0.014591603376560663, 'atr_max_pct': 0.08246212008637781, 'tp_mult': 1.9779265122372163, 'tsl_mult': 0.7156468107080998, 'strategy': 'breakout', 'time_stop': 68, 'use_sma': False, 'use_atr': False, 'use_adx': False, 'use_ema': False, 'use_spike': False, 'rsi_required': False, 'edge_k': 1.9753683095579997, 'edge_cap': 0.08782053700999604}.
[I 2025-08-29 23:19:17,136] Trial 928 finished with values: [-0.03303761047014253, 0.033028160932213585] and parameters: {'p_sma': 37, 'p_std': 12, 'p_atr': 30, 'p_adx': 29, 'rsi_period': 11, 'ema1': 30, 'ema2': 36, 'slip_atr_k': 0.06543497197870715, 'slip_spread_k': 0.2957895484846203, 'spread_hl_frac': 0.01301314060799865, 'bb_std_mult': 1.32252241307229, 'rsi_os': 33, 'rsi_ob': 63, 'vol_spike': 0.28683559679331977, 'adx_thresh': 7.997024238184517, 'atr_min_pct': 0.001116850730937249, 'atr_max_pct': 0.06354988445102588, 'tp_mult': 1.9019668267393992, 'tsl_mult': 0.3811603533641369, 'strategy': 'mean_reversion', 'time_stop': 289, 'use_sma': False, 'use_atr': False, 'use_adx': False, 'use_ema': False, 'use_spike': False, 'rsi_required': False, 'edge_k': 1.8467793598754283, 'edge_cap': 0.7624838533556766}.
[I 2025-08-29 23:19:17,299] Trial 929 finished with values: [-0.03888589515024765, 0.038875182759079224] and parameters: {'p_sma': 29, 'p_std': 12, 'p_atr': 13, 'p_adx': 13, 'rsi_period': 13, 'ema1': 30, 'ema2': 22, 'slip_atr_k': 0.06598591756275857, 'slip_spread_k': 0.29627125773860064, 'spread_hl_frac': 0.04546615832105663, 'bb_std_mult': 1.3070584148414612, 'rsi_os': 34, 'rsi_ob': 63, 'vol_spike': 0.2306324341177251, 'adx_thresh': 13.018531206353192, 'atr_min_pct': 0.0010233433944909446, 'atr_max_pct': 0.07084427486518649, 'tp_mult': 1.9076173393040097, 'tsl_mult': 0.9106773251480211, 'strategy': 'mean_reversion', 'time_stop': 286, 'use_sma': False, 'use_atr': False, 'use_adx': False, 'use_ema': False, 'use_spike': False, 'rsi_required': False, 'edge_k': 0.7664571695732312, 'edge_cap': 0.17856995485175137}.
[I 2025-08-29 23:19:17,694] Trial 927 finished with values: [-1000000000.0, 1000000000.0] and parameters: {'p_sma': 37, 'p_std': 14, 'p_atr': 29, 'p_adx': 13, 'rsi_period': 10, 'ema1': 28, 'ema2': 22, 'slip_atr_k': 0.18132659005602855, 'slip_spread_k': 0.1864036549819842, 'spread_hl_frac': 0.0051972837434407955, 'bb_std_mult': 1.425756896654411, 'rsi_os': 33, 'rsi_ob': 86, 'vol_spike': 0.2311360446914868, 'adx_thresh': 12.821363129752045, 'atr_min_pct': 0.02490451721554267, 'atr_max_pct': 0.07089196566377177, 'tp_mult': 1.9044866533155984, 'tsl_mult': 0.6857454596099084, 'strategy': 'mean_reversion', 'time_stop': 285, 'use_sma': False, 'use_atr': False, 'use_adx': False, 'use_ema': False, 'use_spike': False, 'rsi_required': False, 'edge_k': 1.8943354570434698, 'edge_cap': 0.421743723800204}.
[I 2025-08-29 23:19:17,842] Trial 926 finished with values: [-1000000000.0, 1000000000.0] and parameters: {'p_sma': 27, 'p_std': 48, 'p_atr': 11, 'p_adx': 20, 'rsi_period': 11, 'ema1': 28, 'ema2': 17, 'slip_atr_k': 0.18065116548441626, 'slip_spread_k': 0.28520170343870227, 'spread_hl_frac': 0.01290718433885689, 'bb_std_mult': 1.4647239603295943, 'rsi_os': 41, 'rsi_ob': 67, 'vol_spike': 0.23319808709875892, 'adx_thresh': 18.54072662913312, 'atr_min_pct': 0.009411156988939209, 'atr_max_pct': 0.06421534348295266, 'tp_mult': 1.9076929712016222, 'tsl_mult': 0.5785921285447435, 'strategy': 'mean_reversion', 'time_stop': 271, 'use_sma': False, 'use_atr': False, 'use_adx': False, 'use_ema': False, 'use_spike': False, 'rsi_required': False, 'edge_k': 0.7675190235699446, 'edge_cap': 0.2205878506135736}.
[I 2025-08-29 23:19:18,104] Trial 931 finished with values: [-1000000000.0, 1000000000.0] and parameters: {'p_sma': 14, 'p_std': 14, 'p_atr': 7, 'p_adx': 13, 'rsi_period': 16, 'ema1': 19, 'ema2': 29, 'slip_atr_k': 0.00018420156972459784, 'slip_spread_k': 0.18921981623588047, 'spread_hl_frac': 0.01052071778875181, 'bb_std_mult': 1.4026957985333763, 'rsi_os': 32, 'rsi_ob': 47, 'vol_spike': 0.22977063042459372, 'adx_thresh': 20.50426882685005, 'atr_min_pct': 0.013473719582699897, 'atr_max_pct': 0.06537407239516477, 'tp_mult': 1.9443942054291725, 'tsl_mult': 0.16812299294643596, 'strategy': 'mean_reversion', 'time_stop': 274, 'use_sma': False, 'use_atr': False, 'use_adx': False, 'use_ema': False, 'use_spike': False, 'rsi_required': False, 'edge_k': 1.9022303208243825, 'edge_cap': 0.16065932374403746}.
[I 2025-08-29 23:19:44,443] Trial 932 finished with values: [-1000000000.0, 1000000000.0] and parameters: {'p_sma': 22, 'p_std': 20, 'p_atr': 11, 'p_adx': 14, 'rsi_period': 57, 'ema1': 19, 'ema2': 29, 'slip_atr_k': 0.007944145213190442, 'slip_spread_k': 0.9396783610488428, 'spread_hl_frac': 0.027294394494670186, 'bb_std_mult': 1.5085830883071425, 'rsi_os': 22, 'rsi_ob': 61, 'vol_spike': 0.2735555053737183, 'adx_thresh': 30.891886347721147, 'atr_min_pct': 0.017498410896063635, 'atr_max_pct': 0.06506433071805404, 'tp_mult': 2.5197234870481933, 'tsl_mult': 0.8060039472765596, 'strategy': 'mean_reversion', 'time_stop': 280, 'use_sma': False, 'use_atr': False, 'use_adx': False, 'use_ema': False, 'use_spike': False, 'rsi_required': False, 'edge_k': 1.360222184113503, 'edge_cap': 0.17019972843580777}.
[I 2025-08-29 23:19:44,795] Trial 930 finished with values: [-1000000000.0, 1000000000.0] and parameters: {'p_sma': 31, 'p_std': 5, 'p_atr': 13, 'p_adx': 13, 'rsi_period': 16, 'ema1': 29, 'ema2': 24, 'slip_atr_k': 0.0050862784188163025, 'slip_spread_k': 0.14595881278780282, 'spread_hl_frac': 0.012377351541451994, 'bb_std_mult': 1.3955978894375882, 'rsi_os': 41, 'rsi_ob': 61, 'vol_spike': 0.22815189405281366, 'adx_thresh': 20.346270832477522, 'atr_min_pct': 0.024865127397519518, 'atr_max_pct': 0.07217923445910122, 'tp_mult': 1.9312372580822363, 'tsl_mult': 0.6762474185504194, 'strategy': 'mean_reversion', 'time_stop': 284, 'use_sma': False, 'use_atr': False, 'use_adx': False, 'use_ema': False, 'use_spike': False, 'rsi_required': False, 'edge_k': 0.7756684113145698, 'edge_cap': 0.1798879092875783}.
[I 2025-08-29 23:19:45,005] Trial 933 finished with values: [-1000000000.0, 1000000000.0] and parameters: {'p_sma': 55, 'p_std': 19, 'p_atr': 27, 'p_adx': 14, 'rsi_period': 48, 'ema1': 19, 'ema2': 24, 'slip_atr_k': 0.007598019165557986, 'slip_spread_k': 0.0007147124062728549, 'spread_hl_frac': 0.020555043582317464, 'bb_std_mult': 1.352356474566361, 'rsi_os': 31, 'rsi_ob': 61, 'vol_spike': 0.27484512521981125, 'adx_thresh': 20.281406483465194, 'atr_min_pct': 0.025547148955744198, 'atr_max_pct': 0.09079700188829982, 'tp_mult': 2.0362674651481587, 'tsl_mult': 0.612206163333974, 'strategy': 'mean_reversion', 'time_stop': 276, 'use_sma': False, 'use_atr': False, 'use_adx': False, 'use_ema': False, 'use_spike': False, 'rsi_required': False, 'edge_k': 0.9393926175566625, 'edge_cap': 0.16523311075462185}.
[I 2025-08-29 23:19:45,216] Trial 934 finished with values: [-1000000000.0, 1000000000.0] and parameters: {'p_sma': 41, 'p_std': 5, 'p_atr': 13, 'p_adx': 30, 'rsi_period': 48, 'ema1': 29, 'ema2': 53, 'slip_atr_k': 0.10226291989157439, 'slip_spread_k': 0.14110821983188998, 'spread_hl_frac': 0.012026579126697788, 'bb_std_mult': 1.3484116596988565, 'rsi_os': 34, 'rsi_ob': 61, 'vol_spike': 0.2747736469768849, 'adx_thresh': 21.044081226859117, 'atr_min_pct': 0.027103982252402726, 'atr_max_pct': 0.08956231690994884, 'tp_mult': 1.3433892904114648, 'tsl_mult': 0.6387348611383581, 'strategy': 'mean_reversion', 'time_stop': 255, 'use_sma': False, 'use_atr': False, 'use_adx': False, 'use_ema': False, 'use_spike': False, 'rsi_required': False, 'edge_k': 0.6739419168725873, 'edge_cap': 0.1690806806830215}.
[I 2025-08-29 23:20:12,413] Trial 938 finished with values: [-1000000000.0, 1000000000.0] and parameters: {'p_sma': 30, 'p_std': 9, 'p_atr': 24, 'p_adx': 12, 'rsi_period': 7, 'ema1': 14, 'ema2': 41, 'slip_atr_k': 0.11032959563190088, 'slip_spread_k': 0.31570732025468345, 'spread_hl_frac': 0.013657285003115822, 'bb_std_mult': 1.2449439023984192, 'rsi_os': 35, 'rsi_ob': 53, 'vol_spike': 0.27929449041828447, 'adx_thresh': 22.537075429934767, 'atr_min_pct': 0.02083389635931537, 'atr_max_pct': 0.0773859968808917, 'tp_mult': 1.9757881256985022, 'tsl_mult': 0.6144568035201085, 'strategy': 'breakout', 'time_stop': 220, 'use_sma': False, 'use_atr': False, 'use_adx': False, 'use_ema': False, 'use_spike': False, 'rsi_required': False, 'edge_k': 1.9453624240602383, 'edge_cap': 0.25257022569431575}.
[I 2025-08-29 23:20:12,873] Trial 936 finished with values: [-1000000000.0, 1000000000.0] and parameters: {'p_sma': 34, 'p_std': 40, 'p_atr': 17, 'p_adx': 12, 'rsi_period': 8, 'ema1': 12, 'ema2': 15, 'slip_atr_k': 0.013105711674651039, 'slip_spread_k': 0.3198641417446686, 'spread_hl_frac': 0.02043860474980074, 'bb_std_mult': 1.3270504542352752, 'rsi_os': 48, 'rsi_ob': 52, 'vol_spike': 0.276758513644922, 'adx_thresh': 21.1985538627002, 'atr_min_pct': 0.021575639608392067, 'atr_max_pct': 0.07552041005338164, 'tp_mult': 2.2879394684946606, 'tsl_mult': 0.339207434298332, 'strategy': 'breakout', 'time_stop': 292, 'use_sma': False, 'use_atr': False, 'use_adx': False, 'use_ema': False, 'use_spike': False, 'rsi_required': False, 'edge_k': 0.6731694648299905, 'edge_cap': 0.20197765624939593}.
[I 2025-08-29 23:20:13,049] Trial 935 finished with values: [-1000000000.0, 1000000000.0] and parameters: {'p_sma': 34, 'p_std': 5, 'p_atr': 13, 'p_adx': 14, 'rsi_period': 7, 'ema1': 14, 'ema2': 15, 'slip_atr_k': 0.004562272954675441, 'slip_spread_k': 0.15458804663764059, 'spread_hl_frac': 0.015338780841668656, 'bb_std_mult': 1.3421616509971268, 'rsi_os': 35, 'rsi_ob': 62, 'vol_spike': 0.274090290578619, 'adx_thresh': 21.01343238326979, 'atr_min_pct': 0.007057864467079337, 'atr_max_pct': 0.0911246527420037, 'tp_mult': 1.5634497872978532, 'tsl_mult': 0.6158174872729404, 'strategy': 'breakout', 'time_stop': 256, 'use_sma': False, 'use_atr': False, 'use_adx': False, 'use_ema': False, 'use_spike': False, 'rsi_required': False, 'edge_k': 0.6761320469403496, 'edge_cap': 0.9620116356171149}.
[I 2025-08-29 23:20:13,153] Trial 937 finished with values: [-1000000000.0, 1000000000.0] and parameters: {'p_sma': 41, 'p_std': 49, 'p_atr': 13, 'p_adx': 30, 'rsi_period': 8, 'ema1': 23, 'ema2': 15, 'slip_atr_k': 0.14697402719045358, 'slip_spread_k': 0.25529933325162374, 'spread_hl_frac': 0.014599902712115063, 'bb_std_mult': 1.2435740002233182, 'rsi_os': 35, 'rsi_ob': 92, 'vol_spike': 0.27364738148160894, 'adx_thresh': 20.905304968752375, 'atr_min_pct': 0.012772974137239728, 'atr_max_pct': 0.060939548122372705, 'tp_mult': 1.968307801149986, 'tsl_mult': 0.634048069512873, 'strategy': 'breakout', 'time_stop': 252, 'use_sma': False, 'use_atr': False, 'use_adx': False, 'use_ema': False, 'use_spike': False, 'rsi_required': False, 'edge_k': 1.543628384007424, 'edge_cap': 0.9949905821855063}.
[I 2025-08-29 23:20:13,472] Trial 940 finished with values: [-1000000000.0, 1000000000.0] and parameters: {'p_sma': 52, 'p_std': 32, 'p_atr': 28, 'p_adx': 18, 'rsi_period': 45, 'ema1': 30, 'ema2': 56, 'slip_atr_k': 0.07705403272284722, 'slip_spread_k': 0.2468151754623049, 'spread_hl_frac': 0.041156461222119634, 'bb_std_mult': 1.2456391011438863, 'rsi_os': 53, 'rsi_ob': 64, 'vol_spike': 0.23310584298742446, 'adx_thresh': 14.514665735276015, 'atr_min_pct': 0.012799658900240228, 'atr_max_pct': 0.06906035296222714, 'tp_mult': 1.541818918040918, 'tsl_mult': 0.6372911814352381, 'strategy': 'mean_reversion', 'time_stop': 189, 'use_sma': False, 'use_atr': False, 'use_adx': False, 'use_ema': False, 'use_spike': False, 'rsi_required': False, 'edge_k': 1.9307242428498548, 'edge_cap': 0.20142935441982177}.
[I 2025-08-29 23:20:40,675] Trial 941 finished with values: [-1000000000.0, 1000000000.0] and parameters: {'p_sma': 53, 'p_std': 49, 'p_atr': 11, 'p_adx': 13, 'rsi_period': 14, 'ema1': 30, 'ema2': 56, 'slip_atr_k': 0.011014944092060597, 'slip_spread_k': 0.08901486455709062, 'spread_hl_frac': 0.010501159242355586, 'bb_std_mult': 1.2560085208476097, 'rsi_os': 32, 'rsi_ob': 64, 'vol_spike': 0.2393338921122221, 'adx_thresh': 29.628589506674157, 'atr_min_pct': 0.023556878938257902, 'atr_max_pct': 0.04507730120935808, 'tp_mult': 2.6472263231260147, 'tsl_mult': 0.6572127742094339, 'strategy': 'mean_reversion', 'time_stop': 293, 'use_sma': False, 'use_atr': False, 'use_adx': False, 'use_ema': False, 'use_spike': False, 'rsi_required': False, 'edge_k': 1.9321735184707296, 'edge_cap': 0.3921129399066108}.
[I 2025-08-29 23:20:40,961] Trial 942 finished with values: [-1000000000.0, 1000000000.0] and parameters: {'p_sma': 44, 'p_std': 55, 'p_atr': 19, 'p_adx': 13, 'rsi_period': 13, 'ema1': 30, 'ema2': 19, 'slip_atr_k': 0.00015587132982777932, 'slip_spread_k': 0.2147094693047224, 'spread_hl_frac': 0.02911006530928854, 'bb_std_mult': 1.155458285285658, 'rsi_os': 12, 'rsi_ob': 64, 'vol_spike': 0.28842593670063305, 'adx_thresh': 29.58871316105885, 'atr_min_pct': 0.022321032183140133, 'atr_max_pct': 0.044106710241830445, 'tp_mult': 1.8624612212170477, 'tsl_mult': 0.6618356559810686, 'strategy': 'mean_reversion', 'time_stop': 195, 'use_sma': False, 'use_atr': False, 'use_adx': False, 'use_ema': False, 'use_spike': False, 'rsi_required': False, 'edge_k': 1.932383657629816, 'edge_cap': 0.2315311109115641}.
[I 2025-08-29 23:20:41,060] Trial 939 finished with values: [-1000000000.0, 1000000000.0] and parameters: {'p_sma': 34, 'p_std': 40, 'p_atr': 17, 'p_adx': 14, 'rsi_period': 9, 'ema1': 23, 'ema2': 47, 'slip_atr_k': 0.01380152422490514, 'slip_spread_k': 0.2513108504051117, 'spread_hl_frac': 0.015305714972368534, 'bb_std_mult': 1.2699544460740508, 'rsi_os': 32, 'rsi_ob': 64, 'vol_spike': 0.23641713460917876, 'adx_thresh': 27.75625428634773, 'atr_min_pct': 0.012968499901152026, 'atr_max_pct': 0.06050815064272849, 'tp_mult': 2.2811333350863903, 'tsl_mult': 0.3290681718014039, 'strategy': 'breakout', 'time_stop': 294, 'use_sma': False, 'use_atr': False, 'use_adx': False, 'use_ema': False, 'use_spike': False, 'rsi_required': False, 'edge_k': 0.11532508018045218, 'edge_cap': 0.2008863902447107}.
[I 2025-08-29 23:20:41,402] Trial 943 finished with values: [-1000000000.0, 1000000000.0] and parameters: {'p_sma': 44, 'p_std': 10, 'p_atr': 19, 'p_adx': 13, 'rsi_period': 14, 'ema1': 30, 'ema2': 26, 'slip_atr_k': 0.00935619197322582, 'slip_spread_k': 0.26172572507416075, 'spread_hl_frac': 0.01065732143155128, 'bb_std_mult': 1.1258942437585828, 'rsi_os': 12, 'rsi_ob': 59, 'vol_spike': 0.20690303062230758, 'adx_thresh': 27.62355479393148, 'atr_min_pct': 0.028662673320090332, 'atr_max_pct': 0.043382550661977784, 'tp_mult': 2.0225610057923107, 'tsl_mult': 0.7583907615735819, 'strategy': 'mean_reversion', 'time_stop': 291, 'use_sma': False, 'use_atr': False, 'use_adx': False, 'use_ema': False, 'use_spike': False, 'rsi_required': False, 'edge_k': 1.745499572051925, 'edge_cap': 0.23534020987976645}.
[I 2025-08-29 23:21:08,058] Trial 946 finished with values: [-0.001114932030331639, 0.0018711832555445016] and parameters: {'p_sma': 20, 'p_std': 10, 'p_atr': 11, 'p_adx': 12, 'rsi_period': 40, 'ema1': 15, 'ema2': 21, 'slip_atr_k': 0.004504661046258713, 'slip_spread_k': 0.3118365707420519, 'spread_hl_frac': 0.011474918254348645, 'bb_std_mult': 1.4851194600460396, 'rsi_os': 33, 'rsi_ob': 62, 'vol_spike': 0.270808285662649, 'adx_thresh': 19.570360152117594, 'atr_min_pct': 0.004059367829403911, 'atr_max_pct': 0.07372725536577517, 'tp_mult': 1.4095006939739365, 'tsl_mult': 0.7558618554775143, 'strategy': 'mean_reversion', 'time_stop': 265, 'use_sma': False, 'use_atr': False, 'use_adx': False, 'use_ema': False, 'use_spike': False, 'rsi_required': False, 'edge_k': 1.999656854646472, 'edge_cap': 0.8583182405161904}.
