[I 2025-08-29 23:23:56,134] Trial 971 finished with values: [-1000000000.0, 1000000000.0] and parameters: {'p_sma': 31, 'p_std': 15, 'p_atr': 11, 'p_adx': 12, 'rsi_period': 58, 'ema1': 25, 'ema2': 26, 'slip_atr_k': 0.16218380771358323, 'slip_spread_k': 0.303148166362754, 'spread_hl_frac': 0.012520041846434207, 'bb_std_mult': 1.3721241592229556, 'rsi_os': 10, 'rsi_ob': 66, 'vol_spike': 0.06550477570300954, 'adx_thresh': 21.504702677697054, 'atr_min_pct': 0.011546948548792804, 'atr_max_pct': 0.0733274909648389, 'tp_mult': 2.4828448139562647, 'tsl_mult': 0.6723633250725084, 'strategy': 'mean_reversion', 'time_stop': 266, 'use_sma': False, 'use_atr': False, 'use_adx': False, 'use_ema': False, 'use_spike': False, 'rsi_required': False, 'edge_k': 1.1598275672307476, 'edge_cap': 0.7896270923244884}.
[I 2025-08-29 23:23:56,249] Trial 970 finished with values: [-1000000000.0, 1000000000.0] and parameters: {'p_sma': 27, 'p_std': 15, 'p_atr': 25, 'p_adx': 12, 'rsi_period': 79, 'ema1': 30, 'ema2': 26, 'slip_atr_k': 0.009956501033741382, 'slip_spread_k': 0.29084722922783096, 'spread_hl_frac': 0.00800923611480455, 'bb_std_mult': 1.3880632420829178, 'rsi_os': 33, 'rsi_ob': 51, 'vol_spike': 0.14156226173676464, 'adx_thresh': 21.540698792430717, 'atr_min_pct': 0.011713150386001663, 'atr_max_pct': 0.07320052195376063, 'tp_mult': 2.556986661122211, 'tsl_mult': 0.6614864877199093, 'strategy': 'mean_reversion', 'time_stop': 206, 'use_sma': False, 'use_atr': False, 'use_adx': False, 'use_ema': False, 'use_spike': False, 'rsi_required': False, 'edge_k': 1.5081528756644398, 'edge_cap': 0.37802186144671024}.
[I 2025-08-29 23:24:23,534] Trial 975 finished with values: [-0.004674756443542871, 0.004667702655668457] and parameters: {'p_sma': 30, 'p_std': 27, 'p_atr': 30, 'p_adx': 12, 'rsi_period': 17, 'ema1': 29, 'ema2': 30, 'slip_atr_k': 0.2383707180789203, 'slip_spread_k': 0.3210839015793231, 'spread_hl_frac': 0.0076173117828975505, 'bb_std_mult': 1.372473250815648, 'rsi_os': 8, 'rsi_ob': 86, 'vol_spike': 0.2711204481426934, 'adx_thresh': 21.00374026373536, 'atr_min_pct': 0.002098292005980466, 'atr_max_pct': 0.0715136183883838, 'tp_mult': 1.9003152549598927, 'tsl_mult': 0.25391768414631677, 'strategy': 'mean_reversion', 'time_stop': 273, 'use_sma': False, 'use_atr': False, 'use_adx': False, 'use_ema': False, 'use_spike': False, 'rsi_required': False, 'edge_k': 1.8991921925682114, 'edge_cap': 0.7824489863628585}.
[I 2025-08-29 23:24:23,733] Trial 974 finished with values: [-0.006821130063844216, 0.006807919666636129] and parameters: {'p_sma': 30, 'p_std': 9, 'p_atr': 20, 'p_adx': 12, 'rsi_period': 73, 'ema1': 29, 'ema2': 25, 'slip_atr_k': 0.008098995594284336, 'slip_spread_k': 0.292914563191135, 'spread_hl_frac': 0.008059307136076284, 'bb_std_mult': 1.3604153228305695, 'rsi_os': 8, 'rsi_ob': 61, 'vol_spike': 0.1420617280193785, 'adx_thresh': 15.066185547066066, 'atr_min_pct': 0.0014905796179440246, 'atr_max_pct': 0.07113101838763668, 'tp_mult': 1.8876480231399484, 'tsl_mult': 0.651169305790192, 'strategy': 'breakout', 'time_stop': 273, 'use_sma': False, 'use_atr': False, 'use_adx': False, 'use_ema': False, 'use_spike': False, 'rsi_required': False, 'edge_k': 1.152653235429022, 'edge_cap': 0.06452672949686006}.
[I 2025-08-29 23:24:23,733] Trial 976 finished with values: [-1000000000.0, 1000000000.0] and parameters: {'p_sma': 29, 'p_std': 11, 'p_atr': 27, 'p_adx': 13, 'rsi_period': 17, 'ema1': 30, 'ema2': 19, 'slip_atr_k': 0.007861845796829322, 'slip_spread_k': 0.2904457216841602, 'spread_hl_frac': 0.008003131933564347, 'bb_std_mult': 1.2636206857464598, 'rsi_os': 33, 'rsi_ob': 61, 'vol_spike': 0.28330363220775, 'adx_thresh': 20.970569877428577, 'atr_min_pct': 0.010607093757555471, 'atr_max_pct': 0.07120650388780299, 'tp_mult': 1.9245115343336148, 'tsl_mult': 0.25802937816251575, 'strategy': 'mean_reversion', 'time_stop': 295, 'use_sma': False, 'use_atr': False, 'use_adx': False, 'use_ema': False, 'use_spike': False, 'rsi_required': False, 'edge_k': 1.8034726898644518, 'edge_cap': 0.3689224465557761}.
[I 2025-08-29 23:24:23,843] Trial 977 finished with values: [-0.012952435623422187, 0.013020744601575224] and parameters: {'p_sma': 29, 'p_std': 7, 'p_atr': 27, 'p_adx': 13, 'rsi_period': 17, 'ema1': 29, 'ema2': 24, 'slip_atr_k': 0.004938324001211202, 'slip_spread_k': 0.4631677077338206, 'spread_hl_frac': 0.031157848119472455, 'bb_std_mult': 1.2732568864531115, 'rsi_os': 33, 'rsi_ob': 61, 'vol_spike': 0.27094519257285465, 'adx_thresh': 12.089284892824491, 'atr_min_pct': 0.0022599393456109243, 'atr_max_pct': 0.06742616436676331, 'tp_mult': 1.9077520123326883, 'tsl_mult': 0.36989743617635296, 'strategy': 'breakout', 'time_stop': 15, 'use_sma': False, 'use_atr': False, 'use_adx': False, 'use_ema': False, 'use_spike': False, 'rsi_required': False, 'edge_k': 1.24610270172985, 'edge_cap': 0.19402162771831316}.
[I 2025-08-29 23:24:24,105] Trial 981 finished with values: [-1000000000.0, 1000000000.0] and parameters: {'p_sma': 27, 'p_std': 29, 'p_atr': 12, 'p_adx': 13, 'rsi_period': 55, 'ema1': 18, 'ema2': 21, 'slip_atr_k': 0.21191607779655985, 'slip_spread_k': 0.2479921597884159, 'spread_hl_frac': 0.01405420829179161, 'bb_std_mult': 3.543368131566556, 'rsi_os': 54, 'rsi_ob': 64, 'vol_spike': 0.23871887124858782, 'adx_thresh': 8.52254243142259, 'atr_min_pct': 0.014810516430455056, 'atr_max_pct': 0.06745427174252457, 'tp_mult': 1.9653642120610533, 'tsl_mult': 0.6447009090270169, 'strategy': 'mean_reversion', 'time_stop': 282, 'use_sma': False, 'use_atr': False, 'use_adx': False, 'use_ema': False, 'use_spike': False, 'rsi_required': False, 'edge_k': 0.9705853015748964, 'edge_cap': 0.24854931845987838}.
[I 2025-08-29 23:24:50,252] Trial 978 finished with values: [-1000000000.0, 1000000000.0] and parameters: {'p_sma': 29, 'p_std': 11, 'p_atr': 14, 'p_adx': 18, 'rsi_period': 40, 'ema1': 30, 'ema2': 24, 'slip_atr_k': 0.00432073743220729, 'slip_spread_k': 0.4988480023395763, 'spread_hl_frac': 0.014004848667666246, 'bb_std_mult': 1.2719644604223876, 'rsi_os': 33, 'rsi_ob': 61, 'vol_spike': 0.17237761570830565, 'adx_thresh': 25.776462944948044, 'atr_min_pct': 0.020020822968672802, 'atr_max_pct': 0.06775710495873916, 'tp_mult': 1.9518261554434517, 'tsl_mult': 0.6417511499251152, 'strategy': 'breakout', 'time_stop': 296, 'use_sma': False, 'use_atr': False, 'use_adx': False, 'use_ema': False, 'use_spike': False, 'rsi_required': False, 'edge_k': 1.248796349072481, 'edge_cap': 0.18716215518435447}.
[I 2025-08-29 23:24:50,652] Trial 980 finished with values: [-0.0025924425875216706, 0.002583562112632533] and parameters: {'p_sma': 32, 'p_std': 29, 'p_atr': 12, 'p_adx': 13, 'rsi_period': 55, 'ema1': 30, 'ema2': 20, 'slip_atr_k': 0.00022233810074705727, 'slip_spread_k': 0.24214671585922326, 'spread_hl_frac': 0.02475163596093911, 'bb_std_mult': 1.4919154339631526, 'rsi_os': 36, 'rsi_ob': 63, 'vol_spike': 0.09541484777009734, 'adx_thresh': 11.93993400463858, 'atr_min_pct': 0.002848811545722606, 'atr_max_pct': 0.06707958546491477, 'tp_mult': 1.9488532661106113, 'tsl_mult': 0.14456364235834707, 'strategy': 'mean_reversion', 'time_stop': 284, 'use_sma': False, 'use_atr': False, 'use_adx': False, 'use_ema': False, 'use_spike': False, 'rsi_required': False, 'edge_k': 0.9581620361380065, 'edge_cap': 0.17586541440286915}.
[I 2025-08-29 23:24:50,950] Trial 982 finished with values: [-1000000000.0, 1000000000.0] and parameters: {'p_sma': 32, 'p_std': 52, 'p_atr': 13, 'p_adx': 14, 'rsi_period': 84, 'ema1': 30, 'ema2': 20, 'slip_atr_k': 0.00395384468151223, 'slip_spread_k': 0.30567951365624724, 'spread_hl_frac': 0.01080707632595729, 'bb_std_mult': 1.4559347535605625, 'rsi_os': 36, 'rsi_ob': 82, 'vol_spike': 0.09669121552819826, 'adx_thresh': 19.18857494578519, 'atr_min_pct': 0.020263195920119718, 'atr_max_pct': 0.0743836236611295, 'tp_mult': 1.821916045739069, 'tsl_mult': 0.5994673722476409, 'strategy': 'mean_reversion', 'time_stop': 295, 'use_sma': False, 'use_atr': False, 'use_adx': False, 'use_ema': False, 'use_spike': False, 'rsi_required': False, 'edge_k': 1.966089899627093, 'edge_cap': 0.13200668833944124}.
[I 2025-08-29 23:24:51,028] Trial 979 finished with values: [-1000000000.0, 1000000000.0] and parameters: {'p_sma': 32, 'p_std': 11, 'p_atr': 12, 'p_adx': 13, 'rsi_period': 15, 'ema1': 18, 'ema2': 33, 'slip_atr_k': 0.004018222768711382, 'slip_spread_k': 0.6577384575778926, 'spread_hl_frac': 0.02503609538698074, 'bb_std_mult': 1.5059299945288678, 'rsi_os': 36, 'rsi_ob': 63, 'vol_spike': 0.1797466308837409, 'adx_thresh': 25.58209273367462, 'atr_min_pct': 0.01365340028717554, 'atr_max_pct': 0.06632526184991422, 'tp_mult': 1.074223086157216, 'tsl_mult': 0.9475169284846936, 'strategy': 'mean_reversion', 'time_stop': 282, 'use_sma': False, 'use_atr': False, 'use_adx': False, 'use_ema': False, 'use_spike': False, 'rsi_required': False, 'edge_k': 1.0375409963554456, 'edge_cap': 0.2424135291827406}.
[I 2025-08-29 23:25:18,277] Trial 983 finished with values: [-1000000000.0, 1000000000.0] and parameters: {'p_sma': 32, 'p_std': 12, 'p_atr': 13, 'p_adx': 17, 'rsi_period': 36, 'ema1': 15, 'ema2': 33, 'slip_atr_k': 0.01755167031348795, 'slip_spread_k': 0.9235417058835598, 'spread_hl_frac': 0.025132412886401386, 'bb_std_mult': 1.4428522670189492, 'rsi_os': 6, 'rsi_ob': 63, 'vol_spike': 0.09517809514692815, 'adx_thresh': 19.098418897450617, 'atr_min_pct': 0.013687967914608658, 'atr_max_pct': 0.07030477941481611, 'tp_mult': 1.8280583868898117, 'tsl_mult': 0.05604743601630613, 'strategy': 'mean_reversion', 'time_stop': 214, 'use_sma': False, 'use_atr': False, 'use_adx': False, 'use_ema': False, 'use_spike': False, 'rsi_required': False, 'edge_k': 1.0318513847465232, 'edge_cap': 0.2165073296422239}.
[I 2025-08-29 23:25:18,714] Trial 984 finished with values: [-1000000000.0, 1000000000.0] and parameters: {'p_sma': 32, 'p_std': 52, 'p_atr': 13, 'p_adx': 11, 'rsi_period': 84, 'ema1': 15, 'ema2': 44, 'slip_atr_k': 0.17200493277894668, 'slip_spread_k': 0.6554004821912573, 'spread_hl_frac': 0.01055840163686265, 'bb_std_mult': 1.446756686986962, 'rsi_os': 31, 'rsi_ob': 62, 'vol_spike': 0.007171907424025459, 'adx_thresh': 20.249510546952557, 'atr_min_pct': 0.006893133596914113, 'atr_max_pct': 0.07532025140266875, 'tp_mult': 2.0268358898509136, 'tsl_mult': 0.6002503853995296, 'strategy': 'mean_reversion', 'time_stop': 85, 'use_sma': False, 'use_atr': False, 'use_adx': False, 'use_ema': False, 'use_spike': False, 'rsi_required': False, 'edge_k': 1.0388108641848053, 'edge_cap': 0.21529372139073533}.
[I 2025-08-29 23:25:18,881] Trial 985 finished with values: [-1000000000.0, 1000000000.0] and parameters: {'p_sma': 28, 'p_std': 57, 'p_atr': 13, 'p_adx': 11, 'rsi_period': 15, 'ema1': 26, 'ema2': 22, 'slip_atr_k': 0.00018174847720775283, 'slip_spread_k': 0.6523892236501859, 'spread_hl_frac': 0.010440668215509354, 'bb_std_mult': 1.194952867672579, 'rsi_os': 31, 'rsi_ob': 63, 'vol_spike': 0.11692080345466034, 'adx_thresh': 20.372642228227065, 'atr_min_pct': 0.006909562412072056, 'atr_max_pct': 0.0748182446523989, 'tp_mult': 2.0192507321076683, 'tsl_mult': 0.8192829837299074, 'strategy': 'mean_reversion', 'time_stop': 54, 'use_sma': False, 'use_atr': False, 'use_adx': False, 'use_ema': False, 'use_spike': False, 'rsi_required': False, 'edge_k': 1.034930583856557, 'edge_cap': 0.21758769061373795}.
[I 2025-08-29 23:25:18,883] Trial 986 finished with values: [-1000000000.0, 1000000000.0] and parameters: {'p_sma': 28, 'p_std': 31, 'p_atr': 13, 'p_adx': 29, 'rsi_period': 9, 'ema1': 29, 'ema2': 22, 'slip_atr_k': 0.00010362269725263388, 'slip_spread_k': 0.6218027821525607, 'spread_hl_frac': 0.009429149220806787, 'bb_std_mult': 1.136021994385675, 'rsi_os': 31, 'rsi_ob': 62, 'vol_spike': 0.1212126032173692, 'adx_thresh': 20.731918737947876, 'atr_min_pct': 0.006606289318539125, 'atr_max_pct': 0.07497050081253263, 'tp_mult': 2.031611875063962, 'tsl_mult': 0.7311294299960212, 'strategy': 'mean_reversion', 'time_stop': 290, 'use_sma': False, 'use_atr': False, 'use_adx': False, 'use_ema': False, 'use_spike': False, 'rsi_required': False, 'edge_k': 1.8822900365080872, 'edge_cap': 0.21552815551450644}.
[I 2025-08-29 23:25:45,685] Trial 987 finished with values: [-1000000000.0, 1000000000.0] and parameters: {'p_sma': 28, 'p_std': 59, 'p_atr': 11, 'p_adx': 27, 'rsi_period': 9, 'ema1': 29, 'ema2': 22, 'slip_atr_k': 0.009874727208183241, 'slip_spread_k': 0.5668099912456914, 'spread_hl_frac': 0.009976086266863424, 'bb_std_mult': 1.196764439160123, 'rsi_os': 31, 'rsi_ob': 62, 'vol_spike': 0.18971916583669046, 'adx_thresh': 24.11091750008766, 'atr_min_pct': 0.005957103848427892, 'atr_max_pct': 0.07471525734915578, 'tp_mult': 2.012742408016112, 'tsl_mult': 0.4032762428750283, 'strategy': 'mean_reversion', 'time_stop': 290, 'use_sma': False, 'use_atr': False, 'use_adx': False, 'use_ema': False, 'use_spike': False, 'rsi_required': False, 'edge_k': 1.8843133251770376, 'edge_cap': 0.16364727585319544}.
[I 2025-08-29 23:25:46,006] Trial 989 finished with values: [-1000000000.0, 1000000000.0] and parameters: {'p_sma': 27, 'p_std': 12, 'p_atr': 11, 'p_adx': 29, 'rsi_period': 9, 'ema1': 29, 'ema2': 23, 'slip_atr_k': 0.06133695297417362, 'slip_spread_k': 0.3239191383432145, 'spread_hl_frac': 0.012787678522728699, 'bb_std_mult': 1.6013709607886466, 'rsi_os': 32, 'rsi_ob': 62, 'vol_spike': 0.08123833061927202, 'adx_thresh': 20.941460430684803, 'atr_min_pct': 0.008444719803956443, 'atr_max_pct': 0.0699183432483232, 'tp_mult': 1.0112597957260105, 'tsl_mult': 0.5690576687260406, 'strategy': 'breakout', 'time_stop': 168, 'use_sma': False, 'use_atr': False, 'use_adx': False, 'use_ema': False, 'use_spike': False, 'rsi_required': False, 'edge_k': 1.8854361520966527, 'edge_cap': 0.16465955931946497}.
[I 2025-08-29 23:25:46,139] Trial 990 finished with values: [-1000000000.0, 1000000000.0] and parameters: {'p_sma': 26, 'p_std': 13, 'p_atr': 11, 'p_adx': 15, 'rsi_period': 11, 'ema1': 30, 'ema2': 36, 'slip_atr_k': 0.07088391091543639, 'slip_spread_k': 0.3140918185556072, 'spread_hl_frac': 0.013126156286490958, 'bb_std_mult': 1.3198048758241157, 'rsi_os': 18, 'rsi_ob': 72, 'vol_spike': 0.19193025344271816, 'adx_thresh': 6.645930233761883, 'atr_min_pct': 0.008844945119152403, 'atr_max_pct': 0.0705620540047399, 'tp_mult': 1.8861937765285948, 'tsl_mult': 0.39956123424958384, 'strategy': 'breakout', 'time_stop': 279, 'use_sma': False, 'use_atr': False, 'use_adx': False, 'use_ema': False, 'use_spike': False, 'rsi_required': False, 'edge_k': 1.3301389574165157, 'edge_cap': 0.1674678637122717}.
[I 2025-08-29 23:25:46,249] Trial 988 finished with values: [-1000000000.0, 1000000000.0] and parameters: {'p_sma': 28, 'p_std': 13, 'p_atr': 11, 'p_adx': 19, 'rsi_period': 9, 'ema1': 30, 'ema2': 22, 'slip_atr_k': 0.0001481667409606995, 'slip_spread_k': 0.3222516321179633, 'spread_hl_frac': 0.009169535567611395, 'bb_std_mult': 1.132562338635302, 'rsi_os': 19, 'rsi_ob': 65, 'vol_spike': 0.11734469240061036, 'adx_thresh': 6.60178218953549, 'atr_min_pct': 0.02815091583753874, 'atr_max_pct': 0.07552414931327761, 'tp_mult': 1.9961432469170608, 'tsl_mult': 0.8217390503992142, 'strategy': 'breakout', 'time_stop': 289, 'use_sma': False, 'use_atr': False, 'use_adx': False, 'use_ema': False, 'use_spike': False, 'rsi_required': False, 'edge_k': 0.7222413600099318, 'edge_cap': 0.16109424059661828}.
[I 2025-08-29 23:26:14,067] Trial 994 finished with values: [-1000000000.0, 1000000000.0] and parameters: {'p_sma': 30, 'p_std': 9, 'p_atr': 12, 'p_adx': 14, 'rsi_period': 50, 'ema1': 30, 'ema2': 17, 'slip_atr_k': 0.2060991583410294, 'slip_spread_k': 0.27548509504248214, 'spread_hl_frac': 0.0026636411250654454, 'bb_std_mult': 2.5398315381709553, 'rsi_os': 35, 'rsi_ob': 60, 'vol_spike': 0.15964208716938857, 'adx_thresh': 21.57421640610108, 'atr_min_pct': 0.021620774230686937, 'atr_max_pct': 0.07157494443638959, 'tp_mult': 1.3536992424465968, 'tsl_mult': 0.689930999810526, 'strategy': 'mean_reversion', 'time_stop': 271, 'use_sma': False, 'use_atr': False, 'use_adx': False, 'use_ema': False, 'use_spike': False, 'rsi_required': False, 'edge_k': 1.9348125762689738, 'edge_cap': 0.29254343234602664}.
[I 2025-08-29 23:26:14,482] Trial 992 finished with values: [-1000000000.0, 1000000000.0] and parameters: {'p_sma': 26, 'p_std': 17, 'p_atr': 12, 'p_adx': 15, 'rsi_period': 11, 'ema1': 30, 'ema2': 47, 'slip_atr_k': 0.07040150813340362, 'slip_spread_k': 0.9982268354906181, 'spread_hl_frac': 0.011561427135837965, 'bb_std_mult': 1.3557805598171733, 'rsi_os': 34, 'rsi_ob': 65, 'vol_spike': 0.2332487333400629, 'adx_thresh': 10.674746088863905, 'atr_min_pct': 0.028082061371475134, 'atr_max_pct': 0.07092747699407727, 'tp_mult': 1.8728174633079542, 'tsl_mult': 0.6294130079087467, 'strategy': 'breakout', 'time_stop': 242, 'use_sma': False, 'use_atr': False, 'use_adx': False, 'use_ema': False, 'use_spike': False, 'rsi_required': False, 'edge_k': 1.9359549818414432, 'edge_cap': 0.1835080297879419}.
[I 2025-08-29 23:26:14,632] Trial 991 finished with values: [-1000000000.0, 1000000000.0] and parameters: {'p_sma': 26, 'p_std': 13, 'p_atr': 24, 'p_adx': 15, 'rsi_period': 71, 'ema1': 30, 'ema2': 40, 'slip_atr_k': 0.07197892629188588, 'slip_spread_k': 0.3216253585431637, 'spread_hl_frac': 0.003532189619515208, 'bb_std_mult': 1.602487563891046, 'rsi_os': 18, 'rsi_ob': 73, 'vol_spike': 0.04707335982263984, 'adx_thresh': 21.265674889936943, 'atr_min_pct': 0.027959964619076502, 'atr_max_pct': 0.07026805495885219, 'tp_mult': 1.1972643774494123, 'tsl_mult': 0.6437396043448466, 'strategy': 'breakout', 'time_stop': 278, 'use_sma': False, 'use_atr': False, 'use_adx': False, 'use_ema': False, 'use_spike': False, 'rsi_required': False, 'edge_k': 1.3090920152406875, 'edge_cap': 0.5983495868138189}.
[I 2025-08-29 23:26:14,633] Trial 993 finished with values: [-1000000000.0, 1000000000.0] and parameters: {'p_sma': 30, 'p_std': 13, 'p_atr': 24, 'p_adx': 14, 'rsi_period': 69, 'ema1': 30, 'ema2': 17, 'slip_atr_k': 0.05323478744987642, 'slip_spread_k': 0.27655766101813245, 'spread_hl_frac': 0.011703979779296516, 'bb_std_mult': 1.3500706494540702, 'rsi_os': 34, 'rsi_ob': 65, 'vol_spike': 0.23072449721591337, 'adx_thresh': 21.859019240595384, 'atr_min_pct': 0.026550696945584457, 'atr_max_pct': 0.07168531581914989, 'tp_mult': 1.4819395792165442, 'tsl_mult': 0.6338557499483497, 'strategy': 'mean_reversion', 'time_stop': 200, 'use_sma': False, 'use_atr': False, 'use_adx': False, 'use_ema': False, 'use_spike': False, 'rsi_required': False, 'edge_k': 1.9300724313681754, 'edge_cap': 0.6971829221758167}.
[I 2025-08-29 23:26:14,909] Trial 997 finished with values: [-1000000000.0, 1000000000.0] and parameters: {'p_sma': 31, 'p_std': 11, 'p_atr': 28, 'p_adx': 13, 'rsi_period': 13, 'ema1': 12, 'ema2': 19, 'slip_atr_k': 0.018116760494145418, 'slip_spread_k': 0.44665358507162345, 'spread_hl_frac': 0.028379193460048212, 'bb_std_mult': 2.6913448613848794, 'rsi_os': 32, 'rsi_ob': 45, 'vol_spike': 0.24013704594961213, 'adx_thresh': 17.184843933551104, 'atr_min_pct': 0.00046466943087053805, 'atr_max_pct': 0.06649089790947664, 'tp_mult': 1.9411502723477383, 'tsl_mult': 0.5921400454380464, 'strategy': 'mean_reversion', 'time_stop': 163, 'use_sma': False, 'use_atr': False, 'use_adx': False, 'use_ema': False, 'use_spike': False, 'rsi_required': False, 'edge_k': 1.9658997396470672, 'edge_cap': 0.13731855017048017}.
[I 2025-08-29 23:26:14,918] Trial 998 finished with values: [-1000000000.0, 1000000000.0] and parameters: {'p_sma': 31, 'p_std': 11, 'p_atr': 14, 'p_adx': 13, 'rsi_period': 13, 'ema1': 21, 'ema2': 32, 'slip_atr_k': 0.12890134955426025, 'slip_spread_k': 0.4432067000468777, 'spread_hl_frac': 0.01214088210530014, 'bb_std_mult': 1.413574903114475, 'rsi_os': 32, 'rsi_ob': 55, 'vol_spike': 0.24133019073942963, 'adx_thresh': 24.96808879525272, 'atr_min_pct': 0.022682071716088995, 'atr_max_pct': 0.01957593613495682, 'tp_mult': 1.9080521841396623, 'tsl_mult': 0.5901418260574196, 'strategy': 'mean_reversion', 'time_stop': 282, 'use_sma': False, 'use_atr': False, 'use_adx': False, 'use_ema': False, 'use_spike': False, 'rsi_required': False, 'edge_k': 1.9982298214722976, 'edge_cap': 0.19705459432665282}.
[I 2025-08-29 23:26:15,357] Trial 999 finished with values: [-1000000000.0, 1000000000.0] and parameters: {'p_sma': 29, 'p_std': 15, 'p_atr': 14, 'p_adx': 12, 'rsi_period': 13, 'ema1': 25, 'ema2': 28, 'slip_atr_k': 0.12896590996580615, 'slip_spread_k': 0.24405598832150766, 'spread_hl_frac': 0.011174514118669179, 'bb_std_mult': 1.27636454069511, 'rsi_os': 50, 'rsi_ob': 70, 'vol_spike': 0.14827993802122758, 'adx_thresh': 30.43137146966179, 'atr_min_pct': 0.02268855639384119, 'atr_max_pct': 0.06746098848584964, 'tp_mult': 1.9145157385130636, 'tsl_mult': 0.42738746697316093, 'strategy': 'mean_reversion', 'time_stop': 281, 'use_sma': False, 'use_atr': False, 'use_adx': False, 'use_ema': False, 'use_spike': False, 'rsi_required': False, 'edge_k': 1.9973731516388606, 'edge_cap': 0.19063089245077655}.
[I 2025-08-29 23:26:40,158] Trial 996 finished with values: [-1000000000.0, 1000000000.0] and parameters: {'p_sma': 30, 'p_std': 14, 'p_atr': 28, 'p_adx': 13, 'rsi_period': 7, 'ema1': 12, 'ema2': 19, 'slip_atr_k': 0.1172250446396014, 'slip_spread_k': 0.2794954072008914, 'spread_hl_frac': 0.039055558132589686, 'bb_std_mult': 1.4166218513135234, 'rsi_os': 32, 'rsi_ob': 64, 'vol_spike': 0.2792093179048035, 'adx_thresh': 14.177514211156193, 'atr_min_pct': 0.017017096212180113, 'atr_max_pct': 0.06754639389547434, 'tp_mult': 2.949219385173821, 'tsl_mult': 0.6119355098116299, 'strategy': 'mean_reversion', 'time_stop': 27, 'use_sma': False, 'use_atr': False, 'use_adx': False, 'use_ema': False, 'use_spike': False, 'rsi_required': False, 'edge_k': 1.4634426886814167, 'edge_cap': 0.1964273862705742}.
