[I 2025-08-29 21:55:04,753] Trial 135 finished with values: [-0.00201601288201092, 0.00202137031131311] and parameters: {'p_sma': 15, 'p_std': 36, 'p_atr': 22, 'p_adx': 16, 'rsi_period': 62, 'ema1': 19, 'ema2': 50, 'slip_atr_k': 0.09916583450551411, 'slip_spread_k': 0.9980285929442417, 'spread_hl_frac': 0.03813521771883154, 'bb_std_mult': 1.327586916815807, 'rsi_os': 23, 'rsi_ob': 72, 'vol_spike': 0.23864126148652648, 'adx_thresh': 29.862186295761195, 'atr_min_pct': 0.000731951930836774, 'atr_max_pct': 0.06157208272641211, 'tp_mult': 2.9260504610914415, 'tsl_mult': 0.8326119684890849, 'strategy': 'breakout', 'time_stop': 125, 'use_sma': False, 'use_atr': False, 'use_adx': False, 'use_ema': False, 'use_spike': False, 'rsi_required': False, 'edge_k': 0.5580018027016472, 'edge_cap': 0.27281650349579156}.
[I 2025-08-29 21:55:31,569] Trial 136 finished with values: [-0.023996687280301243, 0.023986390827329482] and parameters: {'p_sma': 12, 'p_std': 36, 'p_atr': 22, 'p_adx': 13, 'rsi_period': 62, 'ema1': 7, 'ema2': 49, 'slip_atr_k': 0.1011589818785934, 'slip_spread_k': 0.8313206946297373, 'spread_hl_frac': 0.0019273775545737871, 'bb_std_mult': 2.0778771701112637, 'rsi_os': 23, 'rsi_ob': 54, 'vol_spike': 0.035540965200430805, 'adx_thresh': 17.87605630748385, 'atr_min_pct': 2.711522519492377e-05, 'atr_max_pct': 0.09392336337363688, 'tp_mult': 2.0407788589148375, 'tsl_mult': 0.26164141270335417, 'strategy': 'breakout', 'time_stop': 139, 'use_sma': False, 'use_atr': False, 'use_adx': False, 'use_ema': False, 'use_spike': False, 'rsi_required': False, 'edge_k': 1.7577443791699783, 'edge_cap': 0.8239832257545026}.
[I 2025-08-29 21:55:31,849] Trial 138 finished with values: [-1000000000.0, 1000000000.0] and parameters: {'p_sma': 23, 'p_std': 38, 'p_atr': 22, 'p_adx': 8, 'rsi_period': 64, 'ema1': 19, 'ema2': 54, 'slip_atr_k': 0.0323046109349638, 'slip_spread_k': 0.5631034582397166, 'spread_hl_frac': 0.039024342305160054, 'bb_std_mult': 3.130411389226195, 'rsi_os': 23, 'rsi_ob': 54, 'vol_spike': 0.03570916472339952, 'adx_thresh': 26.01006593314544, 'atr_min_pct': 0.02678827660415928, 'atr_max_pct': 0.09276784532956131, 'tp_mult': 2.957461226559186, 'tsl_mult': 0.825893127320014, 'strategy': 'breakout', 'time_stop': 141, 'use_sma': False, 'use_atr': False, 'use_adx': False, 'use_ema': False, 'use_spike': False, 'rsi_required': False, 'edge_k': 1.7834232231328897, 'edge_cap': 0.8278244330302336}.
[I 2025-08-29 21:55:32,204] Trial 139 finished with values: [-0.01069304801705695, 0.010679533461571251] and parameters: {'p_sma': 23, 'p_std': 38, 'p_atr': 23, 'p_adx': 9, 'rsi_period': 43, 'ema1': 19, 'ema2': 47, 'slip_atr_k': 0.04974966244961203, 'slip_spread_k': 0.25998825089966227, 'spread_hl_frac': 0.03892892407176488, 'bb_std_mult': 0.5709608584394739, 'rsi_os': 16, 'rsi_ob': 64, 'vol_spike': 0.1342136215225433, 'adx_thresh': 13.417646868399128, 'atr_min_pct': 1.7170779456751476e-05, 'atr_max_pct': 0.09097474252598052, 'tp_mult': 2.6842966349380366, 'tsl_mult': 0.7893993091474694, 'strategy': 'breakout', 'time_stop': 55, 'use_sma': False, 'use_atr': False, 'use_adx': False, 'use_ema': False, 'use_spike': False, 'rsi_required': False, 'edge_k': 1.778697132266775, 'edge_cap': 0.27125848755396625}.
[I 2025-08-29 21:55:32,387] Trial 137 finished with values: [-1000000000.0, 1000000000.0] and parameters: {'p_sma': 22, 'p_std': 36, 'p_atr': 22, 'p_adx': 8, 'rsi_period': 31, 'ema1': 7, 'ema2': 48, 'slip_atr_k': 0.048389861701198175, 'slip_spread_k': 0.2602408901313688, 'spread_hl_frac': 0.03761566142942417, 'bb_std_mult': 1.2131813091149881, 'rsi_os': 15, 'rsi_ob': 64, 'vol_spike': 0.13387348843542257, 'adx_thresh': 29.848698601952407, 'atr_min_pct': 0.02734793158786824, 'atr_max_pct': 0.05503745354276206, 'tp_mult': 2.9361583540388447, 'tsl_mult': 0.8244235441346588, 'strategy': 'breakout', 'time_stop': 152, 'use_sma': False, 'use_atr': False, 'use_adx': False, 'use_ema': False, 'use_spike': False, 'rsi_required': False, 'edge_k': 0.5541813783277627, 'edge_cap': 0.26549041638611204}.
[I 2025-08-29 21:55:59,046] Trial 142 finished with values: [-1000000000.0, 1000000000.0] and parameters: {'p_sma': 14, 'p_std': 36, 'p_atr': 11, 'p_adx': 20, 'rsi_period': 57, 'ema1': 6, 'ema2': 15, 'slip_atr_k': 0.0614558398175947, 'slip_spread_k': 0.7653000572146405, 'spread_hl_frac': 0.005651627453744371, 'bb_std_mult': 1.7575771617762124, 'rsi_os': 28, 'rsi_ob': 72, 'vol_spike': 0.04670773502532176, 'adx_thresh': 5.640737265190321, 'atr_min_pct': 0.0033882618617035558, 'atr_max_pct': 0.055733106066656324, 'tp_mult': 1.602874570288195, 'tsl_mult': 0.1609767851144498, 'strategy': 'breakout', 'time_stop': 72, 'use_sma': False, 'use_atr': False, 'use_adx': False, 'use_ema': False, 'use_spike': False, 'rsi_required': False, 'edge_k': 1.8709627086534608, 'edge_cap': 0.4991336245706019}.
[I 2025-08-29 21:55:59,371] Trial 141 finished with values: [-0.0026759913119056566, 0.0026650738056603397] and parameters: {'p_sma': 20, 'p_std': 40, 'p_atr': 7, 'p_adx': 12, 'rsi_period': 57, 'ema1': 6, 'ema2': 59, 'slip_atr_k': 0.04987441988521813, 'slip_spread_k': 0.9971034446289041, 'spread_hl_frac': 0.005246369738182374, 'bb_std_mult': 0.9802226804000991, 'rsi_os': 16, 'rsi_ob': 72, 'vol_spike': 0.054704945882697864, 'adx_thresh': 29.52508332507088, 'atr_min_pct': 0.0008771986666909703, 'atr_max_pct': 0.055326151465057184, 'tp_mult': 1.853613486382205, 'tsl_mult': 0.18383364855685824, 'strategy': 'breakout', 'time_stop': 151, 'use_sma': False, 'use_atr': False, 'use_adx': False, 'use_ema': False, 'use_spike': False, 'rsi_required': False, 'edge_k': 1.8696142912272387, 'edge_cap': 0.9615832742665313}.
[I 2025-08-29 21:55:59,413] Trial 140 finished with values: [-0.04324952445292496, 0.04324112391851341] and parameters: {'p_sma': 21, 'p_std': 36, 'p_atr': 7, 'p_adx': 9, 'rsi_period': 32, 'ema1': 20, 'ema2': 59, 'slip_atr_k': 0.02639052569974889, 'slip_spread_k': 0.2701754515718474, 'spread_hl_frac': 0.03912096762226252, 'bb_std_mult': 1.7697379556666908, 'rsi_os': 26, 'rsi_ob': 47, 'vol_spike': 0.04374545035870352, 'adx_thresh': 15.824938334406177, 'atr_min_pct': 0.0007078576795248429, 'atr_max_pct': 0.015620017571191525, 'tp_mult': 2.126435918617778, 'tsl_mult': 0.7904635222956891, 'strategy': 'breakout', 'time_stop': 111, 'use_sma': False, 'use_atr': False, 'use_adx': False, 'use_ema': False, 'use_spike': False, 'rsi_required': False, 'edge_k': 1.0550596883299457, 'edge_cap': 0.49999773702648087}.
[I 2025-08-29 21:55:59,478] Trial 143 finished with values: [-0.006591755662722409, 0.006580404657022495] and parameters: {'p_sma': 20, 'p_std': 14, 'p_atr': 16, 'p_adx': 25, 'rsi_period': 72, 'ema1': 6, 'ema2': 27, 'slip_atr_k': 0.11649848689692947, 'slip_spread_k': 0.1298265228761542, 'spread_hl_frac': 0.04577996722244538, 'bb_std_mult': 3.200523124226922, 'rsi_os': 26, 'rsi_ob': 72, 'vol_spike': 0.04629672837698693, 'adx_thresh': 16.01293616755415, 'atr_min_pct': 0.0007098561493935663, 'atr_max_pct': 0.062060144974839526, 'tp_mult': 2.1309407726841663, 'tsl_mult': 0.17205232365942502, 'strategy': 'breakout', 'time_stop': 81, 'use_sma': False, 'use_atr': False, 'use_adx': False, 'use_ema': False, 'use_spike': False, 'rsi_required': False, 'edge_k': 0.6190850264723542, 'edge_cap': 0.9615713783987712}.
[I 2025-08-29 21:56:25,995] Trial 146 finished with values: [-1000000000.0, 1000000000.0] and parameters: {'p_sma': 11, 'p_std': 40, 'p_atr': 21, 'p_adx': 26, 'rsi_period': 40, 'ema1': 6, 'ema2': 28, 'slip_atr_k': 0.1433972249286452, 'slip_spread_k': 0.11973857789846376, 'spread_hl_frac': 0.035390708629121186, 'bb_std_mult': 3.5741357705135632, 'rsi_os': 25, 'rsi_ob': 50, 'vol_spike': 0.060451854849829116, 'adx_thresh': 15.08834074614867, 'atr_min_pct': 0.007920169760871445, 'atr_max_pct': 0.06667533538216594, 'tp_mult': 1.7973469636428074, 'tsl_mult': 0.8846596951794152, 'strategy': 'breakout', 'time_stop': 94, 'use_sma': False, 'use_atr': False, 'use_adx': False, 'use_ema': False, 'use_spike': False, 'rsi_required': False, 'edge_k': 0.7082761639785708, 'edge_cap': 0.7687947198921958}.
[I 2025-08-29 21:56:26,154] Trial 145 finished with values: [-1000000000.0, 1000000000.0] and parameters: {'p_sma': 58, 'p_std': 40, 'p_atr': 21, 'p_adx': 26, 'rsi_period': 64, 'ema1': 6, 'ema2': 59, 'slip_atr_k': 0.11564383847990652, 'slip_spread_k': 0.12722759387119864, 'spread_hl_frac': 0.03809095854397582, 'bb_std_mult': 0.9963436124652858, 'rsi_os': 25, 'rsi_ob': 71, 'vol_spike': 0.04259083138053752, 'adx_thresh': 16.65438264385749, 'atr_min_pct': 0.007885232491458944, 'atr_max_pct': 0.06172327021552535, 'tp_mult': 1.8343027934906866, 'tsl_mult': 0.8817298037520036, 'strategy': 'breakout', 'time_stop': 81, 'use_sma': False, 'use_atr': False, 'use_adx': False, 'use_ema': False, 'use_spike': False, 'rsi_required': False, 'edge_k': 0.3272581714072899, 'edge_cap': 0.7708560167378448}.
[I 2025-08-29 21:56:26,397] Trial 147 finished with values: [-1000000000.0, 1000000000.0] and parameters: {'p_sma': 13, 'p_std': 40, 'p_atr': 21, 'p_adx': 22, 'rsi_period': 40, 'ema1': 5, 'ema2': 47, 'slip_atr_k': 0.03752319204310979, 'slip_spread_k': 0.20755481866922254, 'spread_hl_frac': 0.028961299797003955, 'bb_std_mult': 2.7949639268798414, 'rsi_os': 11, 'rsi_ob': 49, 'vol_spike': 0.05606053471901397, 'adx_thresh': 16.64801493470779, 'atr_min_pct': 0.007636000907805067, 'atr_max_pct': 0.0677763809164575, 'tp_mult': 1.7990946765546212, 'tsl_mult': 0.8804083749365641, 'strategy': 'breakout', 'time_stop': 104, 'use_sma': False, 'use_atr': False, 'use_adx': False, 'use_ema': False, 'use_spike': False, 'rsi_required': False, 'edge_k': 0.4201300013788865, 'edge_cap': 0.22994346515114555}.
[I 2025-08-29 21:56:26,492] Trial 144 finished with values: [-0.02813597713149807, 0.0281243775684023] and parameters: {'p_sma': 13, 'p_std': 40, 'p_atr': 16, 'p_adx': 11, 'rsi_period': 71, 'ema1': 6, 'ema2': 46, 'slip_atr_k': 0.0282256358905736, 'slip_spread_k': 0.990817430772752, 'spread_hl_frac': 0.03770344909459072, 'bb_std_mult': 2.7901962771658457, 'rsi_os': 24, 'rsi_ob': 49, 'vol_spike': 0.05616671689205768, 'adx_thresh': 15.64206831299504, 'atr_min_pct': 0.0008267580249596381, 'atr_max_pct': 0.061689372806304384, 'tp_mult': 1.5263098304064515, 'tsl_mult': 0.87690953518493, 'strategy': 'breakout', 'time_stop': 80, 'use_sma': False, 'use_atr': False, 'use_adx': False, 'use_ema': False, 'use_spike': False, 'rsi_required': False, 'edge_k': 1.0800870143154426, 'edge_cap': 0.9603617605822289}.
[I 2025-08-29 21:56:53,007] Trial 148 finished with values: [-1000000000.0, 1000000000.0] and parameters: {'p_sma': 9, 'p_std': 39, 'p_atr': 23, 'p_adx': 29, 'rsi_period': 27, 'ema1': 5, 'ema2': 46, 'slip_atr_k': 0.037065698286048575, 'slip_spread_k': 0.20455877934289368, 'spread_hl_frac': 0.029257758982570572, 'bb_std_mult': 2.8150871436309437, 'rsi_os': 24, 'rsi_ob': 91, 'vol_spike': 0.05389614729100907, 'adx_thresh': 16.71846867876394, 'atr_min_pct': 0.017550852429449357, 'atr_max_pct': 0.06090638057094861, 'tp_mult': 1.7471721623269063, 'tsl_mult': 0.6368961318745533, 'strategy': 'breakout', 'time_stop': 118, 'use_sma': False, 'use_atr': False, 'use_adx': False, 'use_ema': False, 'use_spike': False, 'rsi_required': False, 'edge_k': 0.3331205253314481, 'edge_cap': 0.6116025561696561}.
[I 2025-08-29 21:56:53,173] Trial 151 finished with values: [-1000000000.0, 1000000000.0] and parameters: {'p_sma': 9, 'p_std': 34, 'p_atr': 24, 'p_adx': 12, 'rsi_period': 59, 'ema1': 5, 'ema2': 30, 'slip_atr_k': 0.18772716035344017, 'slip_spread_k': 0.3211785383037723, 'spread_hl_frac': 0.003982206491813779, 'bb_std_mult': 2.155377972251297, 'rsi_os': 42, 'rsi_ob': 70, 'vol_spike': 0.282646552869516, 'adx_thresh': 11.633471516463791, 'atr_min_pct': 0.013983516431762962, 'atr_max_pct': 0.05786636457311595, 'tp_mult': 1.7472234127584647, 'tsl_mult': 0.6276755176474905, 'strategy': 'breakout', 'time_stop': 285, 'use_sma': False, 'use_atr': False, 'use_adx': False, 'use_ema': False, 'use_spike': False, 'rsi_required': False, 'edge_k': 1.6953150244885309, 'edge_cap': 0.418904447399367}.
[I 2025-08-29 21:56:53,362] Trial 150 finished with values: [-1000000000.0, 1000000000.0] and parameters: {'p_sma': 9, 'p_std': 34, 'p_atr': 23, 'p_adx': 12, 'rsi_period': 27, 'ema1': 5, 'ema2': 46, 'slip_atr_k': 0.15921438195876175, 'slip_spread_k': 0.2963097959719822, 'spread_hl_frac': 0.03338379861498739, 'bb_std_mult': 2.1696019850210098, 'rsi_os': 33, 'rsi_ob': 92, 'vol_spike': 0.21286537669896216, 'adx_thresh': 18.31543277544274, 'atr_min_pct': 0.004124692748543395, 'atr_max_pct': 0.07357330917834114, 'tp_mult': 1.755825996627165, 'tsl_mult': 0.9043863066503679, 'strategy': 'breakout', 'time_stop': 300, 'use_sma': False, 'use_atr': False, 'use_adx': False, 'use_ema': False, 'use_spike': False, 'rsi_required': False, 'edge_k': 1.2925592402278423, 'edge_cap': 0.15972990832579753}.
[I 2025-08-29 21:56:53,477] Trial 149 finished with values: [-1000000000.0, 1000000000.0] and parameters: {'p_sma': 13, 'p_std': 34, 'p_atr': 23, 'p_adx': 12, 'rsi_period': 59, 'ema1': 5, 'ema2': 46, 'slip_atr_k': 0.16019135310225424, 'slip_spread_k': 0.9962686821450315, 'spread_hl_frac': 0.029179095985262332, 'bb_std_mult': 2.822757046154404, 'rsi_os': 24, 'rsi_ob': 70, 'vol_spike': 0.2787359137209369, 'adx_thresh': 18.347225168080072, 'atr_min_pct': 0.019067180406567245, 'atr_max_pct': 0.057007740513448917, 'tp_mult': 1.7473214593198485, 'tsl_mult': 0.9048515728797495, 'strategy': 'breakout', 'time_stop': 103, 'use_sma': False, 'use_atr': False, 'use_adx': False, 'use_ema': False, 'use_spike': False, 'rsi_required': False, 'edge_k': 0.43015116402506454, 'edge_cap': 0.15840615605764646}.
[I 2025-08-29 21:57:20,318] Trial 154 finished with values: [-1000000000.0, 1000000000.0] and parameters: {'p_sma': 5, 'p_std': 37, 'p_atr': 22, 'p_adx': 10, 'rsi_period': 67, 'ema1': 24, 'ema2': 22, 'slip_atr_k': 0.14872861295941417, 'slip_spread_k': 0.21771028576476453, 'spread_hl_frac': 0.023063550602300014, 'bb_std_mult': 2.9367942120818, 'rsi_os': 23, 'rsi_ob': 73, 'vol_spike': 0.16287646611081288, 'adx_thresh': 20.07510959574674, 'atr_min_pct': 0.0015306858821013732, 'atr_max_pct': 0.05171246309967287, 'tp_mult': 1.687167992491093, 'tsl_mult': 0.8528963116898082, 'strategy': 'mean_reversion', 'time_stop': 131, 'use_sma': False, 'use_atr': False, 'use_adx': False, 'use_ema': False, 'use_spike': False, 'rsi_required': False, 'edge_k': 0.5688645633016891, 'edge_cap': 0.6877502342411844}.
[I 2025-08-29 21:57:20,462] Trial 153 finished with values: [-1000000000.0, 1000000000.0] and parameters: {'p_sma': 55, 'p_std': 38, 'p_atr': 10, 'p_adx': 24, 'rsi_period': 67, 'ema1': 7, 'ema2': 44, 'slip_atr_k': 0.0038532851409386615, 'slip_spread_k': 0.28918824795700027, 'spread_hl_frac': 0.007770942303197824, 'bb_std_mult': 2.9276700457074076, 'rsi_os': 27, 'rsi_ob': 76, 'vol_spike': 0.2118958880420768, 'adx_thresh': 25.36325619132974, 'atr_min_pct': 0.0020671141123439008, 'atr_max_pct': 0.07360539657730474, 'tp_mult': 1.8528126097909712, 'tsl_mult': 0.9052629741554101, 'strategy': 'mean_reversion', 'time_stop': 238, 'use_sma': False, 'use_atr': False, 'use_adx': False, 'use_ema': False, 'use_spike': False, 'rsi_required': False, 'edge_k': 0.5005375152156223, 'edge_cap': 0.6923751927318975}.
[I 2025-08-29 21:57:20,628] Trial 152 finished with values: [-0.004588022198580788, 0.004578674428014101] and parameters: {'p_sma': 55, 'p_std': 34, 'p_atr': 15, 'p_adx': 12, 'rsi_period': 59, 'ema1': 25, 'ema2': 21, 'slip_atr_k': 0.18778272974400784, 'slip_spread_k': 0.32663563020262776, 'spread_hl_frac': 0.033422189800711447, 'bb_std_mult': 2.935982379369766, 'rsi_os': 42, 'rsi_ob': 76, 'vol_spike': 0.27850087610428265, 'adx_thresh': 18.392302794853318, 'atr_min_pct': 0.002798951479059012, 'atr_max_pct': 0.07239148613112148, 'tp_mult': 1.6787604674040366, 'tsl_mult': 0.764212006864045, 'strategy': 'breakout', 'time_stop': 285, 'use_sma': False, 'use_atr': False, 'use_adx': False, 'use_ema': False, 'use_spike': False, 'rsi_required': False, 'edge_k': 0.5156570353917094, 'edge_cap': 0.41540243721572223}.
[I 2025-08-29 21:57:20,710] Trial 155 finished with values: [-0.0034223324639529595, 0.0034061439247866075] and parameters: {'p_sma': 56, 'p_std': 37, 'p_atr': 22, 'p_adx': 10, 'rsi_period': 68, 'ema1': 21, 'ema2': 44, 'slip_atr_k': 0.04542682532235332, 'slip_spread_k': 0.6200408935854437, 'spread_hl_frac': 0.044200742796792036, 'bb_std_mult': 3.0770705741993742, 'rsi_os': 23, 'rsi_ob': 77, 'vol_spike': 0.16592340777062758, 'adx_thresh': 21.623328284310617, 'atr_min_pct': 0.0015091724705840336, 'atr_max_pct': 0.12672102678033403, 'tp_mult': 1.6782817241082273, 'tsl_mult': 0.8488512710265836, 'strategy': 'mean_reversion', 'time_stop': 126, 'use_sma': False, 'use_atr': False, 'use_adx': False, 'use_ema': False, 'use_spike': False, 'rsi_required': False, 'edge_k': 0.5151160246963135, 'edge_cap': 0.7548045136350097}.
[I 2025-08-29 21:57:20,826] Trial 158 finished with values: [-1000000000.0, 1000000000.0] and parameters: {'p_sma': 10, 'p_std': 37, 'p_atr': 22, 'p_adx': 10, 'rsi_period': 65, 'ema1': 7, 'ema2': 48, 'slip_atr_k': 0.044231317069356055, 'slip_spread_k': 0.19546513726560227, 'spread_hl_frac': 0.04129071176353624, 'bb_std_mult': 2.2844188161070034, 'rsi_os': 54, 'rsi_ob': 68, 'vol_spike': 0.038470440730380896, 'adx_thresh': 20.84937266177713, 'atr_min_pct': 0.0012666423554114916, 'atr_max_pct': 0.025518455453360803, 'tp_mult': 1.9005386305735819, 'tsl_mult': 0.8316107370427243, 'strategy': 'mean_reversion', 'time_stop': 90, 'use_sma': False, 'use_atr': False, 'use_adx': False, 'use_ema': False, 'use_spike': False, 'rsi_required': False, 'edge_k': 1.1820002363015782, 'edge_cap': 0.7567340402705445}.
[I 2025-08-29 21:57:46,983] Trial 156 finished with values: [-1000000000.0, 1000000000.0] and parameters: {'p_sma': 11, 'p_std': 37, 'p_atr': 15, 'p_adx': 10, 'rsi_period': 69, 'ema1': 21, 'ema2': 43, 'slip_atr_k': 0.045279294963804215, 'slip_spread_k': 0.37500642795388295, 'spread_hl_frac': 0.04425540273628505, 'bb_std_mult': 2.2956917940742567, 'rsi_os': 19, 'rsi_ob': 87, 'vol_spike': 0.036129922552717006, 'adx_thresh': 19.046822025537498, 'atr_min_pct': 0.02509638989587581, 'atr_max_pct': 0.051781663632028345, 'tp_mult': 1.6706004977096702, 'tsl_mult': 0.8382061695320787, 'strategy': 'mean_reversion', 'time_stop': 90, 'use_sma': False, 'use_atr': False, 'use_adx': False, 'use_ema': False, 'use_spike': False, 'rsi_required': False, 'edge_k': 0.5112884298245434, 'edge_cap': 0.7532071943270287}.
[I 2025-08-29 21:57:47,158] Trial 160 finished with values: [-1000000000.0, 1000000000.0] and parameters: {'p_sma': 40, 'p_std': 38, 'p_atr': 30, 'p_adx': 11, 'rsi_period': 18, 'ema1': 6, 'ema2': 45, 'slip_atr_k': 0.09919257460560722, 'slip_spread_k': 0.6166129801582488, 'spread_hl_frac': 0.04426376344991701, 'bb_std_mult': 1.6513984577891785, 'rsi_os': 21, 'rsi_ob': 73, 'vol_spike': 0.2450900560273886, 'adx_thresh': 22.68013834714962, 'atr_min_pct': 0.01075314725090863, 'atr_max_pct': 0.12855683002186108, 'tp_mult': 1.6130251315366946, 'tsl_mult': 0.8112177898640459, 'strategy': 'breakout', 'time_stop': 126, 'use_sma': False, 'use_atr': False, 'use_adx': False, 'use_ema': False, 'use_spike': False, 'rsi_required': False, 'edge_k': 0.8001460261491414, 'edge_cap': 0.7122849020028373}.
[I 2025-08-29 21:57:47,294] Trial 157 finished with values: [-1000000000.0, 1000000000.0] and parameters: {'p_sma': 40, 'p_std': 55, 'p_atr': 13, 'p_adx': 10, 'rsi_period': 11, 'ema1': 15, 'ema2': 17, 'slip_atr_k': 0.17286496313873823, 'slip_spread_k': 0.6328679794715025, 'spread_hl_frac': 0.03623074693559445, 'bb_std_mult': 2.2841213345043223, 'rsi_os': 8, 'rsi_ob': 68, 'vol_spike': 0.016884672494305197, 'adx_thresh': 21.004859324356023, 'atr_min_pct': 0.02524984848091048, 'atr_max_pct': 0.06488352131623348, 'tp_mult': 1.658640781512663, 'tsl_mult': 0.8371521544767294, 'strategy': 'breakout', 'time_stop': 124, 'use_sma': False, 'use_atr': False, 'use_adx': False, 'use_ema': False, 'use_spike': False, 'rsi_required': False, 'edge_k': 1.4869170432019796, 'edge_cap': 0.7521275082905885}.
[I 2025-08-29 21:57:47,415] Trial 159 finished with values: [-1000000000.0, 1000000000.0] and parameters: {'p_sma': 15, 'p_std': 5, 'p_atr': 12, 'p_adx': 11, 'rsi_period': 64, 'ema1': 7, 'ema2': 17, 'slip_atr_k': 0.04515444486469611, 'slip_spread_k': 0.43821035464633384, 'spread_hl_frac': 0.04132152246483233, 'bb_std_mult': 2.282064880541283, 'rsi_os': 54, 'rsi_ob': 68, 'vol_spike': 0.016615306483896607, 'adx_thresh': 20.979628771847736, 'atr_min_pct': 0.02438127378935284, 'atr_max_pct': 0.06505436736992286, 'tp_mult': 1.7916603426576654, 'tsl_mult': 0.8129621725061345, 'strategy': 'breakout', 'time_stop': 92, 'use_sma': False, 'use_atr': False, 'use_adx': False, 'use_ema': False, 'use_spike': False, 'rsi_required': False, 'edge_k': 1.5847451357175557, 'edge_cap': 0.7510180200955288}.
[I 2025-08-29 21:58:14,225] Trial 162 finished with values: [-1000000000.0, 1000000000.0] and parameters: {'p_sma': 45, 'p_std': 48, 'p_atr': 13, 'p_adx': 9, 'rsi_period': 23, 'ema1': 15, 'ema2': 52, 'slip_atr_k': 0.17258376234866996, 'slip_spread_k': 0.2466333107095432, 'spread_hl_frac': 0.0396763135254404, 'bb_std_mult': 3.0227216186455395, 'rsi_os': 28, 'rsi_ob': 71, 'vol_spike': 0.08560314785111692, 'adx_thresh': 27.351414922338577, 'atr_min_pct': 0.028726529032311147, 'atr_max_pct': 0.08610868965369242, 'tp_mult': 2.364105654533443, 'tsl_mult': 0.668485341490826, 'strategy': 'breakout', 'time_stop': 115, 'use_sma': False, 'use_atr': False, 'use_adx': False, 'use_ema': False, 'use_spike': False, 'rsi_required': False, 'edge_k': 1.5479643305979025, 'edge_cap': 0.8131692053400517}.
