[I 2025-08-29 22:32:40,480] Trial 486 finished with values: [-1000000000.0, 1000000000.0] and parameters: {'p_sma': 33, 'p_std': 10, 'p_atr': 10, 'p_adx': 15, 'rsi_period': 7, 'ema1': 27, 'ema2': 10, 'slip_atr_k': 0.008479485556727034, 'slip_spread_k': 0.8256718393625068, 'spread_hl_frac': 0.011395668274746657, 'bb_std_mult': 3.056238347593031, 'rsi_os': 32, 'rsi_ob': 60, 'vol_spike': 0.27048423411848127, 'adx_thresh': 21.490463753890328, 'atr_min_pct': 0.007260896319790951, 'atr_max_pct': 0.14662062264732553, 'tp_mult': 1.9555302474150653, 'tsl_mult': 0.5257971289310883, 'strategy': 'mean_reversion', 'time_stop': 297, 'use_sma': False, 'use_atr': False, 'use_adx': False, 'use_ema': False, 'use_spike': False, 'rsi_required': False, 'edge_k': 1.1377947517617453, 'edge_cap': 0.19808678467009566}.
[I 2025-08-29 22:32:40,595] Trial 485 finished with values: [-1000000000.0, 1000000000.0] and parameters: {'p_sma': 37, 'p_std': 10, 'p_atr': 10, 'p_adx': 15, 'rsi_period': 7, 'ema1': 27, 'ema2': 10, 'slip_atr_k': 0.00011818459668031542, 'slip_spread_k': 0.8226302458682323, 'spread_hl_frac': 0.011262557930978538, 'bb_std_mult': 3.0767764379618567, 'rsi_os': 32, 'rsi_ob': 59, 'vol_spike': 0.2689577378242089, 'adx_thresh': 21.447335999127276, 'atr_min_pct': 0.013091137250382707, 'atr_max_pct': 0.1494063990178474, 'tp_mult': 2.0323741846017436, 'tsl_mult': 0.7313374122695351, 'strategy': 'mean_reversion', 'time_stop': 269, 'use_sma': False, 'use_atr': False, 'use_adx': False, 'use_ema': False, 'use_spike': False, 'rsi_required': False, 'edge_k': 1.0471687416682938, 'edge_cap': 0.2108441095477531}.
[I 2025-08-29 22:33:07,805] Trial 491 finished with values: [-1000000000.0, 1000000000.0] and parameters: {'p_sma': 30, 'p_std': 13, 'p_atr': 11, 'p_adx': 27, 'rsi_period': 9, 'ema1': 24, 'ema2': 35, 'slip_atr_k': 0.008320124871344724, 'slip_spread_k': 0.8245868008946622, 'spread_hl_frac': 0.011984828120659647, 'bb_std_mult': 3.0196483429575554, 'rsi_os': 31, 'rsi_ob': 62, 'vol_spike': 0.1632693704628814, 'adx_thresh': 20.69153099641603, 'atr_min_pct': 0.005392379621625854, 'atr_max_pct': 0.13857710121202255, 'tp_mult': 2.0431858992632486, 'tsl_mult': 0.5521008619226806, 'strategy': 'mean_reversion', 'time_stop': 276, 'use_sma': False, 'use_atr': False, 'use_adx': False, 'use_ema': False, 'use_spike': False, 'rsi_required': False, 'edge_k': 1.5090495451590409, 'edge_cap': 0.23877694702737387}.
[I 2025-08-29 22:33:08,309] Trial 488 finished with values: [-1000000000.0, 1000000000.0] and parameters: {'p_sma': 31, 'p_std': 10, 'p_atr': 11, 'p_adx': 30, 'rsi_period': 7, 'ema1': 30, 'ema2': 10, 'slip_atr_k': 0.006522791211467507, 'slip_spread_k': 0.8272740216835224, 'spread_hl_frac': 0.011539479856224607, 'bb_std_mult': 3.0367876642917904, 'rsi_os': 32, 'rsi_ob': 59, 'vol_spike': 0.2704529684385232, 'adx_thresh': 20.754803524058715, 'atr_min_pct': 0.008948503556430287, 'atr_max_pct': 0.13774790483645763, 'tp_mult': 2.014320650612653, 'tsl_mult': 0.5436875830897628, 'strategy': 'mean_reversion', 'time_stop': 296, 'use_sma': False, 'use_atr': False, 'use_adx': False, 'use_ema': False, 'use_spike': False, 'rsi_required': False, 'edge_k': 1.0343234779318664, 'edge_cap': 0.24235107400586917}.
[I 2025-08-29 22:33:08,574] Trial 490 finished with values: [-1000000000.0, 1000000000.0] and parameters: {'p_sma': 38, 'p_std': 13, 'p_atr': 11, 'p_adx': 8, 'rsi_period': 9, 'ema1': 29, 'ema2': 10, 'slip_atr_k': 0.00022528204522878167, 'slip_spread_k': 0.8227654190514373, 'spread_hl_frac': 0.012097640939151121, 'bb_std_mult': 3.0017791406744423, 'rsi_os': 31, 'rsi_ob': 62, 'vol_spike': 0.27491057287344717, 'adx_thresh': 20.740414373575803, 'atr_min_pct': 0.007987708292121625, 'atr_max_pct': 0.13779752150890462, 'tp_mult': 2.04443926447962, 'tsl_mult': 0.32290535941190096, 'strategy': 'mean_reversion', 'time_stop': 272, 'use_sma': False, 'use_atr': False, 'use_adx': False, 'use_ema': False, 'use_spike': False, 'rsi_required': False, 'edge_k': 1.0673557860043212, 'edge_cap': 0.24321164069158172}.
[I 2025-08-29 22:33:08,585] Trial 489 finished with values: [-1000000000.0, 1000000000.0] and parameters: {'p_sma': 37, 'p_std': 13, 'p_atr': 11, 'p_adx': 27, 'rsi_period': 7, 'ema1': 27, 'ema2': 10, 'slip_atr_k': 0.00011299609425379165, 'slip_spread_k': 0.83091008529664, 'spread_hl_frac': 0.012219080095178676, 'bb_std_mult': 3.0165603282684903, 'rsi_os': 32, 'rsi_ob': 60, 'vol_spike': 0.16231020502978563, 'adx_thresh': 20.42317841579028, 'atr_min_pct': 0.02272429613324365, 'atr_max_pct': 0.13894491696654407, 'tp_mult': 2.066623634956695, 'tsl_mult': 0.37389724908497307, 'strategy': 'mean_reversion', 'time_stop': 299, 'use_sma': False, 'use_atr': False, 'use_adx': False, 'use_ema': False, 'use_spike': False, 'rsi_required': False, 'edge_k': 1.5165353634342331, 'edge_cap': 0.24442721148059407}.
[I 2025-08-29 22:33:36,436] Trial 492 finished with values: [-1000000000.0, 1000000000.0] and parameters: {'p_sma': 35, 'p_std': 12, 'p_atr': 9, 'p_adx': 25, 'rsi_period': 12, 'ema1': 29, 'ema2': 12, 'slip_atr_k': 0.00540125545976494, 'slip_spread_k': 0.827349056337041, 'spread_hl_frac': 0.008798666585771988, 'bb_std_mult': 3.000758854301714, 'rsi_os': 31, 'rsi_ob': 60, 'vol_spike': 0.2766207237223702, 'adx_thresh': 20.104072316085464, 'atr_min_pct': 0.02268149510523748, 'atr_max_pct': 0.1385707349613309, 'tp_mult': 1.92794336595151, 'tsl_mult': 0.6238144058070485, 'strategy': 'breakout', 'time_stop': 247, 'use_sma': False, 'use_atr': False, 'use_adx': False, 'use_ema': False, 'use_spike': False, 'rsi_required': False, 'edge_k': 1.2028862577465214, 'edge_cap': 0.27766937187608237}.
[I 2025-08-29 22:33:36,628] Trial 494 finished with values: [-1000000000.0, 1000000000.0] and parameters: {'p_sma': 36, 'p_std': 12, 'p_atr': 9, 'p_adx': 23, 'rsi_period': 12, 'ema1': 21, 'ema2': 12, 'slip_atr_k': 0.0053012043458173915, 'slip_spread_k': 0.8105988651402336, 'spread_hl_frac': 0.00882820739985079, 'bb_std_mult': 2.9949102599111765, 'rsi_os': 31, 'rsi_ob': 61, 'vol_spike': 0.2787316697313232, 'adx_thresh': 22.176479913557355, 'atr_min_pct': 0.01635306757491074, 'atr_max_pct': 0.1423916050212757, 'tp_mult': 1.9146122104002108, 'tsl_mult': 0.5637803281542949, 'strategy': 'breakout', 'time_stop': 251, 'use_sma': False, 'use_atr': False, 'use_adx': False, 'use_ema': False, 'use_spike': False, 'rsi_required': False, 'edge_k': 1.2036621616378687, 'edge_cap': 0.28445431847364433}.
[I 2025-08-29 22:33:36,707] Trial 495 finished with values: [-1000000000.0, 1000000000.0] and parameters: {'p_sma': 35, 'p_std': 12, 'p_atr': 9, 'p_adx': 23, 'rsi_period': 12, 'ema1': 21, 'ema2': 12, 'slip_atr_k': 0.005038749376879658, 'slip_spread_k': 0.8733134048458402, 'spread_hl_frac': 0.009053126995104362, 'bb_std_mult': 2.995955635985417, 'rsi_os': 34, 'rsi_ob': 61, 'vol_spike': 0.15057093906480917, 'adx_thresh': 22.175318522168766, 'atr_min_pct': 0.009877330969568717, 'atr_max_pct': 0.14215792095477092, 'tp_mult': 1.9194070509857855, 'tsl_mult': 0.5686800773777549, 'strategy': 'breakout', 'time_stop': 288, 'use_sma': False, 'use_atr': False, 'use_adx': False, 'use_ema': False, 'use_spike': False, 'rsi_required': False, 'edge_k': 1.1777168745569886, 'edge_cap': 0.280065855998896}.
[I 2025-08-29 22:33:36,835] Trial 493 finished with values: [-1000000000.0, 1000000000.0] and parameters: {'p_sma': 35, 'p_std': 12, 'p_atr': 9, 'p_adx': 25, 'rsi_period': 11, 'ema1': 29, 'ema2': 12, 'slip_atr_k': 8.92705649808829e-05, 'slip_spread_k': 0.824819233773899, 'spread_hl_frac': 0.012387994610754132, 'bb_std_mult': 3.014438431643015, 'rsi_os': 34, 'rsi_ob': 62, 'vol_spike': 0.2774683985629729, 'adx_thresh': 22.23228378918047, 'atr_min_pct': 0.009587102011362918, 'atr_max_pct': 0.14125352375566108, 'tp_mult': 1.9362543872800573, 'tsl_mult': 0.5734761729836072, 'strategy': 'breakout', 'time_stop': 266, 'use_sma': False, 'use_atr': False, 'use_adx': False, 'use_ema': False, 'use_spike': False, 'rsi_required': False, 'edge_k': 0.9468327596777111, 'edge_cap': 0.2146327714641762}.
[I 2025-08-29 22:34:04,372] Trial 497 finished with values: [-1000000000.0, 1000000000.0] and parameters: {'p_sma': 28, 'p_std': 9, 'p_atr': 9, 'p_adx': 22, 'rsi_period': 11, 'ema1': 25, 'ema2': 27, 'slip_atr_k': 0.010939573344665424, 'slip_spread_k': 0.8850044123693089, 'spread_hl_frac': 0.010055944116268287, 'bb_std_mult': 2.9719282618243703, 'rsi_os': 33, 'rsi_ob': 58, 'vol_spike': 0.26168174479552664, 'adx_thresh': 22.114723768276267, 'atr_min_pct': 0.010603923150355871, 'atr_max_pct': 0.14798476064064106, 'tp_mult': 1.9768542446084318, 'tsl_mult': 0.6621957001856931, 'strategy': 'mean_reversion', 'time_stop': 267, 'use_sma': False, 'use_atr': False, 'use_adx': False, 'use_ema': False, 'use_spike': False, 'rsi_required': False, 'edge_k': 1.1021906580182874, 'edge_cap': 0.22081576126391955}.
[I 2025-08-29 22:34:04,572] Trial 499 finished with values: [-1000000000.0, 1000000000.0] and parameters: {'p_sma': 28, 'p_std': 14, 'p_atr': 10, 'p_adx': 22, 'rsi_period': 9, 'ema1': 25, 'ema2': 55, 'slip_atr_k': 0.010787343665298429, 'slip_spread_k': 0.81089327169937, 'spread_hl_frac': 0.010454514521732796, 'bb_std_mult': 3.1188222588723726, 'rsi_os': 33, 'rsi_ob': 57, 'vol_spike': 0.25568306409249336, 'adx_thresh': 21.26601992320017, 'atr_min_pct': 0.020486920898683234, 'atr_max_pct': 0.1477132599203913, 'tp_mult': 2.287936015260193, 'tsl_mult': 0.5438834489440688, 'strategy': 'mean_reversion', 'time_stop': 260, 'use_sma': False, 'use_atr': False, 'use_adx': False, 'use_ema': False, 'use_spike': False, 'rsi_required': False, 'edge_k': 1.6190686664684044, 'edge_cap': 0.18021681874566906}.
[I 2025-08-29 22:34:04,875] Trial 496 finished with values: [-1000000000.0, 1000000000.0] and parameters: {'p_sma': 29, 'p_std': 12, 'p_atr': 9, 'p_adx': 23, 'rsi_period': 11, 'ema1': 23, 'ema2': 12, 'slip_atr_k': 0.011499528875850047, 'slip_spread_k': 0.8097436019239894, 'spread_hl_frac': 0.008611829348965388, 'bb_std_mult': 2.96888886287752, 'rsi_os': 34, 'rsi_ob': 63, 'vol_spike': 0.26365672351541025, 'adx_thresh': 22.316274795887296, 'atr_min_pct': 0.0097159574728209, 'atr_max_pct': 0.14756024448103883, 'tp_mult': 2.1466075251280463, 'tsl_mult': 0.5646184439976415, 'strategy': 'breakout', 'time_stop': 263, 'use_sma': False, 'use_atr': False, 'use_adx': False, 'use_ema': False, 'use_spike': False, 'rsi_required': False, 'edge_k': 0.9810366993597401, 'edge_cap': 0.20988416219440148}.
[I 2025-08-29 22:34:05,033] Trial 498 finished with values: [-1000000000.0, 1000000000.0] and parameters: {'p_sma': 34, 'p_std': 14, 'p_atr': 10, 'p_adx': 22, 'rsi_period': 9, 'ema1': 25, 'ema2': 22, 'slip_atr_k': 0.10211341523402244, 'slip_spread_k': 0.8103884639032582, 'spread_hl_frac': 0.010101472228172429, 'bb_std_mult': 3.0958084187336667, 'rsi_os': 33, 'rsi_ob': 57, 'vol_spike': 0.2643159913464939, 'adx_thresh': 21.23632789040025, 'atr_min_pct': 0.010484117141674212, 'atr_max_pct': 0.14769964410657613, 'tp_mult': 1.9851982478329504, 'tsl_mult': 0.5782081026842087, 'strategy': 'mean_reversion', 'time_stop': 241, 'use_sma': False, 'use_atr': False, 'use_adx': False, 'use_ema': False, 'use_spike': False, 'rsi_required': False, 'edge_k': 0.9297915056170519, 'edge_cap': 0.22433656809697503}.
[I 2025-08-29 22:34:32,138] Trial 500 finished with values: [-1000000000.0, 1000000000.0] and parameters: {'p_sma': 31, 'p_std': 10, 'p_atr': 10, 'p_adx': 23, 'rsi_period': 9, 'ema1': 23, 'ema2': 54, 'slip_atr_k': 0.010589753918841894, 'slip_spread_k': 0.80909338374562, 'spread_hl_frac': 0.010644745533773895, 'bb_std_mult': 3.0889667697485184, 'rsi_os': 31, 'rsi_ob': 57, 'vol_spike': 0.26842893104459076, 'adx_thresh': 21.180862455528978, 'atr_min_pct': 0.01746698434925722, 'atr_max_pct': 0.14678592198061274, 'tp_mult': 2.2946195292101845, 'tsl_mult': 0.060801374156967236, 'strategy': 'mean_reversion', 'time_stop': 244, 'use_sma': False, 'use_atr': False, 'use_adx': False, 'use_ema': False, 'use_spike': False, 'rsi_required': False, 'edge_k': 0.9878856285145173, 'edge_cap': 0.18140477216015882}.
[I 2025-08-29 22:34:32,324] Trial 502 finished with values: [-1000000000.0, 1000000000.0] and parameters: {'p_sma': 32, 'p_std': 14, 'p_atr': 10, 'p_adx': 26, 'rsi_period': 9, 'ema1': 20, 'ema2': 17, 'slip_atr_k': 0.00387924172077993, 'slip_spread_k': 0.8587610645273588, 'spread_hl_frac': 0.012813602261209929, 'bb_std_mult': 3.1395819201050252, 'rsi_os': 31, 'rsi_ob': 60, 'vol_spike': 0.19045153672896337, 'adx_thresh': 19.930516974583462, 'atr_min_pct': 0.01760226248064701, 'atr_max_pct': 0.14516714211648205, 'tp_mult': 2.085172685221559, 'tsl_mult': 0.6156396916631086, 'strategy': 'mean_reversion', 'time_stop': 238, 'use_sma': False, 'use_atr': False, 'use_adx': False, 'use_ema': False, 'use_spike': False, 'rsi_required': False, 'edge_k': 1.4087359133133681, 'edge_cap': 0.18951557785325235}.
[I 2025-08-29 22:34:32,648] Trial 501 finished with values: [-1000000000.0, 1000000000.0] and parameters: {'p_sma': 32, 'p_std': 14, 'p_atr': 10, 'p_adx': 23, 'rsi_period': 9, 'ema1': 20, 'ema2': 30, 'slip_atr_k': 0.0054406208995633, 'slip_spread_k': 0.85031985661054, 'spread_hl_frac': 0.01082117623547871, 'bb_std_mult': 1.3108376716029029, 'rsi_os': 31, 'rsi_ob': 63, 'vol_spike': 0.26365557010697765, 'adx_thresh': 21.20675379691508, 'atr_min_pct': 0.017686920668656347, 'atr_max_pct': 0.14387041298657166, 'tp_mult': 2.158001589125407, 'tsl_mult': 0.6068234380617287, 'strategy': 'mean_reversion', 'time_stop': 241, 'use_sma': False, 'use_atr': False, 'use_adx': False, 'use_ema': False, 'use_spike': False, 'rsi_required': False, 'edge_k': 1.4063510013180645, 'edge_cap': 0.26022536325367485}.
[I 2025-08-29 22:34:32,714] Trial 503 finished with values: [-1000000000.0, 1000000000.0] and parameters: {'p_sma': 31, 'p_std': 10, 'p_atr': 11, 'p_adx': 29, 'rsi_period': 9, 'ema1': 22, 'ema2': 36, 'slip_atr_k': 0.005104280153256883, 'slip_spread_k': 0.8366842313792215, 'spread_hl_frac': 0.04720099940373152, 'bb_std_mult': 1.9495672152970855, 'rsi_os': 31, 'rsi_ob': 59, 'vol_spike': 0.2721037179595376, 'adx_thresh': 19.988593790466965, 'atr_min_pct': 0.02990080038434065, 'atr_max_pct': 0.14434312422371992, 'tp_mult': 2.2118739525832503, 'tsl_mult': 0.19460330081524452, 'strategy': 'mean_reversion', 'time_stop': 232, 'use_sma': False, 'use_atr': False, 'use_adx': False, 'use_ema': False, 'use_spike': False, 'rsi_required': False, 'edge_k': 1.3680072733102926, 'edge_cap': 0.26871068059932285}.
[I 2025-08-29 22:34:59,857] Trial 505 finished with values: [-1000000000.0, 1000000000.0] and parameters: {'p_sma': 38, 'p_std': 13, 'p_atr': 11, 'p_adx': 23, 'rsi_period': 7, 'ema1': 28, 'ema2': 14, 'slip_atr_k': 0.00506459651060537, 'slip_spread_k': 0.8717051183124971, 'spread_hl_frac': 0.012437883043787686, 'bb_std_mult': 2.9508690107635553, 'rsi_os': 31, 'rsi_ob': 59, 'vol_spike': 0.27244887796826067, 'adx_thresh': 20.123369551147785, 'atr_min_pct': 0.006320973185314025, 'atr_max_pct': 0.14129238411503714, 'tp_mult': 2.214398630195378, 'tsl_mult': 0.5311854722052367, 'strategy': 'mean_reversion', 'time_stop': 277, 'use_sma': False, 'use_atr': False, 'use_adx': False, 'use_ema': False, 'use_spike': False, 'rsi_required': False, 'edge_k': 1.48131107357933, 'edge_cap': 0.26472098622214324}.
[I 2025-08-29 22:34:59,892] Trial 506 finished with values: [-1000000000.0, 1000000000.0] and parameters: {'p_sma': 38, 'p_std': 11, 'p_atr': 11, 'p_adx': 29, 'rsi_period': 7, 'ema1': 26, 'ema2': 14, 'slip_atr_k': 1.62581199173586e-05, 'slip_spread_k': 0.8428739890759329, 'spread_hl_frac': 0.029104434683105487, 'bb_std_mult': 3.0460110751085385, 'rsi_os': 31, 'rsi_ob': 59, 'vol_spike': 0.28146863655331844, 'adx_thresh': 20.173359288600675, 'atr_min_pct': 0.006068394645655584, 'atr_max_pct': 0.1402314695467371, 'tp_mult': 2.1084616160136993, 'tsl_mult': 0.20692250500489612, 'strategy': 'mean_reversion', 'time_stop': 282, 'use_sma': False, 'use_atr': False, 'use_adx': False, 'use_ema': False, 'use_spike': False, 'rsi_required': False, 'edge_k': 1.4633568619031525, 'edge_cap': 0.24256736641183527}.
[I 2025-08-29 22:34:59,989] Trial 504 finished with values: [-1000000000.0, 1000000000.0] and parameters: {'p_sma': 38, 'p_std': 11, 'p_atr': 11, 'p_adx': 23, 'rsi_period': 8, 'ema1': 20, 'ema2': 14, 'slip_atr_k': 0.005422702089534262, 'slip_spread_k': 0.8478103039920023, 'spread_hl_frac': 0.012274385741069508, 'bb_std_mult': 1.2940156170750965, 'rsi_os': 31, 'rsi_ob': 60, 'vol_spike': 0.13066739949934875, 'adx_thresh': 20.058683105932445, 'atr_min_pct': 0.006256524336740904, 'atr_max_pct': 0.14465096096151453, 'tp_mult': 2.096422232287934, 'tsl_mult': 0.5235657116179233, 'strategy': 'mean_reversion', 'time_stop': 234, 'use_sma': False, 'use_atr': False, 'use_adx': False, 'use_ema': False, 'use_spike': False, 'rsi_required': False, 'edge_k': 1.392043011064929, 'edge_cap': 0.2636044429954394}.
[I 2025-08-29 22:35:00,097] Trial 507 finished with values: [-1000000000.0, 1000000000.0] and parameters: {'p_sma': 38, 'p_std': 11, 'p_atr': 19, 'p_adx': 22, 'rsi_period': 7, 'ema1': 26, 'ema2': 52, 'slip_atr_k': 0.21590973953752982, 'slip_spread_k': 0.8451979130584437, 'spread_hl_frac': 0.012345937792713502, 'bb_std_mult': 3.055403352330016, 'rsi_os': 32, 'rsi_ob': 61, 'vol_spike': 0.2810491465016328, 'adx_thresh': 20.657497402181363, 'atr_min_pct': 0.018972595463754127, 'atr_max_pct': 0.14072063270306762, 'tp_mult': 2.3477390463745853, 'tsl_mult': 0.521576114014723, 'strategy': 'mean_reversion', 'time_stop': 276, 'use_sma': False, 'use_atr': False, 'use_adx': False, 'use_ema': False, 'use_spike': False, 'rsi_required': False, 'edge_k': 1.296475715325936, 'edge_cap': 0.24327409808369346}.
[I 2025-08-29 22:35:27,263] Trial 510 finished with values: [-1000000000.0, 1000000000.0] and parameters: {'p_sma': 33, 'p_std': 13, 'p_atr': 27, 'p_adx': 22, 'rsi_period': 13, 'ema1': 24, 'ema2': 52, 'slip_atr_k': 0.010280658906579315, 'slip_spread_k': 0.8133105932474389, 'spread_hl_frac': 0.011420846487070018, 'bb_std_mult': 0.5880735150568768, 'rsi_os': 32, 'rsi_ob': 61, 'vol_spike': 0.0835038315513281, 'adx_thresh': 21.61672622121345, 'atr_min_pct': 0.013972620157486383, 'atr_max_pct': 0.13664362665325008, 'tp_mult': 1.968183287551557, 'tsl_mult': 0.5501740386633571, 'strategy': 'breakout', 'time_stop': 300, 'use_sma': False, 'use_atr': False, 'use_adx': False, 'use_ema': False, 'use_spike': False, 'rsi_required': False, 'edge_k': 1.2887146600590786, 'edge_cap': 0.16269491563527794}.
[I 2025-08-29 22:35:27,499] Trial 511 finished with values: [-1000000000.0, 1000000000.0] and parameters: {'p_sma': 36, 'p_std': 9, 'p_atr': 26, 'p_adx': 7, 'rsi_period': 11, 'ema1': 30, 'ema2': 11, 'slip_atr_k': 0.10855051382202256, 'slip_spread_k': 0.8080063409354973, 'spread_hl_frac': 0.043349075914503196, 'bb_std_mult': 3.2111116781541487, 'rsi_os': 33, 'rsi_ob': 61, 'vol_spike': 0.26628717804411817, 'adx_thresh': 21.926552638412264, 'atr_min_pct': 0.007539077629505474, 'atr_max_pct': 0.13651013179382843, 'tp_mult': 2.0220163218920493, 'tsl_mult': 0.7110339296704444, 'strategy': 'breakout', 'time_stop': 290, 'use_sma': False, 'use_atr': False, 'use_adx': False, 'use_ema': False, 'use_spike': False, 'rsi_required': False, 'edge_k': 1.2449583033318548, 'edge_cap': 0.29645546765538533}.
[I 2025-08-29 22:35:27,659] Trial 508 finished with values: [-1000000000.0, 1000000000.0] and parameters: {'p_sma': 36, 'p_std': 9, 'p_atr': 10, 'p_adx': 22, 'rsi_period': 8, 'ema1': 24, 'ema2': 11, 'slip_atr_k': 0.009360628531714288, 'slip_spread_k': 0.8063049085496895, 'spread_hl_frac': 0.04333137157482715, 'bb_std_mult': 2.95561182652076, 'rsi_os': 33, 'rsi_ob': 61, 'vol_spike': 0.12865521027619264, 'adx_thresh': 21.825865498397064, 'atr_min_pct': 0.018490695559263384, 'atr_max_pct': 0.14971530017868473, 'tp_mult': 2.0210095199367344, 'tsl_mult': 0.52035027324774, 'strategy': 'mean_reversion', 'time_stop': 257, 'use_sma': False, 'use_atr': False, 'use_adx': False, 'use_ema': False, 'use_spike': False, 'rsi_required': False, 'edge_k': 1.2351545208936257, 'edge_cap': 0.1606216315035707}.
[I 2025-08-29 22:35:27,779] Trial 509 finished with values: [-1000000000.0, 1000000000.0] and parameters: {'p_sma': 36, 'p_std': 9, 'p_atr': 26, 'p_adx': 22, 'rsi_period': 8, 'ema1': 24, 'ema2': 11, 'slip_atr_k': 0.007873134206164811, 'slip_spread_k': 0.8053676498074331, 'spread_hl_frac': 0.02619618282247839, 'bb_std_mult': 2.9344097486811274, 'rsi_os': 30, 'rsi_ob': 61, 'vol_spike': 0.08903761149355253, 'adx_thresh': 20.80457450998939, 'atr_min_pct': 0.013904965136054569, 'atr_max_pct': 0.13990513309660926, 'tp_mult': 2.3558861077164, 'tsl_mult': 0.09398953815834843, 'strategy': 'mean_reversion', 'time_stop': 288, 'use_sma': False, 'use_atr': False, 'use_adx': False, 'use_ema': False, 'use_spike': False, 'rsi_required': False, 'edge_k': 1.2944146769839424, 'edge_cap': 0.21064360596731938}.
[I 2025-08-29 22:35:54,667] Trial 515 finished with values: [-1000000000.0, 1000000000.0] and parameters: {'p_sma': 30, 'p_std': 12, 'p_atr': 10, 'p_adx': 13, 'rsi_period': 10, 'ema1': 28, 'ema2': 13, 'slip_atr_k': 0.16058264110673914, 'slip_spread_k': 0.832845506300546, 'spread_hl_frac': 0.011225147070651514, 'bb_std_mult': 3.0334873812135985, 'rsi_os': 35, 'rsi_ob': 58, 'vol_spike': 0.2563058461354358, 'adx_thresh': 20.835561295065226, 'atr_min_pct': 0.026295003273579122, 'atr_max_pct': 0.14218020537256215, 'tp_mult': 1.8838670547496728, 'tsl_mult': 0.5917495277385392, 'strategy': 'mean_reversion', 'time_stop': 251, 'use_sma': False, 'use_atr': False, 'use_adx': False, 'use_ema': False, 'use_spike': False, 'rsi_required': False, 'edge_k': 0.8623591966953672, 'edge_cap': 0.2295963812486886}.
