[I 2025-08-29 23:43:29,985] Trial 1162 finished with values: [-1000000000.0, 1000000000.0] and parameters: {'p_sma': 29, 'p_std': 13, 'p_atr': 26, 'p_adx': 30, 'rsi_period': 53, 'ema1': 30, 'ema2': 43, 'slip_atr_k': 0.010764925555043985, 'slip_spread_k': 0.5720487854935703, 'spread_hl_frac': 0.019686052929159276, 'bb_std_mult': 1.3981362356445568, 'rsi_os': 8, 'rsi_ob': 67, 'vol_spike': 0.257645115856289, 'adx_thresh': 20.474228143576696, 'atr_min_pct': 0.0196187732758553, 'atr_max_pct': 0.07332741969741663, 'tp_mult': 1.0116903269067645, 'tsl_mult': 0.6561571407606297, 'strategy': 'breakout', 'time_stop': 290, 'use_sma': False, 'use_atr': False, 'use_adx': False, 'use_ema': False, 'use_spike': False, 'rsi_required': False, 'edge_k': 0.9883307761683318, 'edge_cap': 0.3843636038484815}.
[I 2025-08-29 23:43:30,647] Trial 1159 finished with values: [-1000000000.0, 1000000000.0] and parameters: {'p_sma': 23, 'p_std': 8, 'p_atr': 12, 'p_adx': 11, 'rsi_period': 11, 'ema1': 30, 'ema2': 22, 'slip_atr_k': 0.010002889814393689, 'slip_spread_k': 0.20921347939751184, 'spread_hl_frac': 0.01954759733146737, 'bb_std_mult': 1.2093276080295605, 'rsi_os': 34, 'rsi_ob': 61, 'vol_spike': 0.20265790232872893, 'adx_thresh': 8.016920332577458, 'atr_min_pct': 0.01928955291277882, 'atr_max_pct': 0.033865202029820365, 'tp_mult': 1.8979828936899388, 'tsl_mult': 0.8731187196340144, 'strategy': 'mean_reversion', 'time_stop': 265, 'use_sma': False, 'use_atr': False, 'use_adx': False, 'use_ema': False, 'use_spike': False, 'rsi_required': False, 'edge_k': 1.8873984699164197, 'edge_cap': 0.4042081684885104}.
[I 2025-08-29 23:43:30,921] Trial 1163 finished with values: [-1000000000.0, 1000000000.0] and parameters: {'p_sma': 30, 'p_std': 12, 'p_atr': 13, 'p_adx': 18, 'rsi_period': 12, 'ema1': 30, 'ema2': 23, 'slip_atr_k': 0.054739194567951246, 'slip_spread_k': 0.23598360589491874, 'spread_hl_frac': 0.019686937095574723, 'bb_std_mult': 1.3850078876083802, 'rsi_os': 49, 'rsi_ob': 66, 'vol_spike': 0.2550149481366909, 'adx_thresh': 18.41421532316725, 'atr_min_pct': 0.015784225594927648, 'atr_max_pct': 0.07280823145665091, 'tp_mult': 1.9525432239370408, 'tsl_mult': 0.24400696732786653, 'strategy': 'breakout', 'time_stop': 300, 'use_sma': False, 'use_atr': False, 'use_adx': False, 'use_ema': False, 'use_spike': False, 'rsi_required': False, 'edge_k': 0.024655715896885866, 'edge_cap': 0.38137475356942563}.
[I 2025-08-29 23:43:58,549] Trial 1166 finished with values: [-1000000000.0, 1000000000.0] and parameters: {'p_sma': 29, 'p_std': 10, 'p_atr': 13, 'p_adx': 18, 'rsi_period': 64, 'ema1': 14, 'ema2': 23, 'slip_atr_k': 0.01663455354810401, 'slip_spread_k': 0.24070922283212584, 'spread_hl_frac': 0.012278196369814896, 'bb_std_mult': 3.562385243597617, 'rsi_os': 43, 'rsi_ob': 63, 'vol_spike': 0.25343795970437466, 'adx_thresh': 23.529006352434273, 'atr_min_pct': 0.016982563643782318, 'atr_max_pct': 0.0731090135193318, 'tp_mult': 1.854036856733544, 'tsl_mult': 0.9664586782548592, 'strategy': 'breakout', 'time_stop': 128, 'use_sma': False, 'use_atr': False, 'use_adx': False, 'use_ema': False, 'use_spike': False, 'rsi_required': False, 'edge_k': 1.957276371733897, 'edge_cap': 0.11607877753020428}.
[I 2025-08-29 23:43:58,773] Trial 1165 finished with values: [-0.007894118643947845, 0.007877856655745169] and parameters: {'p_sma': 29, 'p_std': 11, 'p_atr': 24, 'p_adx': 25, 'rsi_period': 8, 'ema1': 29, 'ema2': 23, 'slip_atr_k': 0.008511324021429317, 'slip_spread_k': 0.24013613413476617, 'spread_hl_frac': 0.012073804114495977, 'bb_std_mult': 2.5978228742587914, 'rsi_os': 32, 'rsi_ob': 61, 'vol_spike': 0.2536690597834057, 'adx_thresh': 7.91086515288036, 'atr_min_pct': 0.0025701120980511755, 'atr_max_pct': 0.07268353761851931, 'tp_mult': 1.95156649578021, 'tsl_mult': 0.8675608859035217, 'strategy': 'mean_reversion', 'time_stop': 298, 'use_sma': False, 'use_atr': False, 'use_adx': False, 'use_ema': False, 'use_spike': False, 'rsi_required': False, 'edge_k': 1.9416776592448286, 'edge_cap': 0.1179910054432689}.
[I 2025-08-29 23:43:58,967] Trial 1164 finished with values: [-1000000000.0, 1000000000.0] and parameters: {'p_sma': 29, 'p_std': 8, 'p_atr': 13, 'p_adx': 11, 'rsi_period': 41, 'ema1': 14, 'ema2': 23, 'slip_atr_k': 0.054478486895192454, 'slip_spread_k': 0.2931620413064427, 'spread_hl_frac': 0.012080018120262324, 'bb_std_mult': 1.2759281367834125, 'rsi_os': 32, 'rsi_ob': 61, 'vol_spike': 0.2572161145633921, 'adx_thresh': 19.99664489489502, 'atr_min_pct': 0.015764470170880875, 'atr_max_pct': 0.07279459064050957, 'tp_mult': 1.9479688490676101, 'tsl_mult': 0.6228614325351972, 'strategy': 'mean_reversion', 'time_stop': 152, 'use_sma': False, 'use_atr': False, 'use_adx': False, 'use_ema': False, 'use_spike': False, 'rsi_required': False, 'edge_k': 1.6377392185251602, 'edge_cap': 0.9271040371837489}.
[I 2025-08-29 23:43:59,143] Trial 1167 finished with values: [-1000000000.0, 1000000000.0] and parameters: {'p_sma': 29, 'p_std': 10, 'p_atr': 16, 'p_adx': 13, 'rsi_period': 64, 'ema1': 29, 'ema2': 21, 'slip_atr_k': 0.14759914481838698, 'slip_spread_k': 0.6848130958727249, 'spread_hl_frac': 0.012388621438284784, 'bb_std_mult': 3.494234687815146, 'rsi_os': 32, 'rsi_ob': 63, 'vol_spike': 0.2542855911706554, 'adx_thresh': 21.050535264330577, 'atr_min_pct': 0.01692876428627528, 'atr_max_pct': 0.07962447604727407, 'tp_mult': 1.8598837862207536, 'tsl_mult': 0.9664220720050702, 'strategy': 'mean_reversion', 'time_stop': 130, 'use_sma': False, 'use_atr': False, 'use_adx': False, 'use_ema': False, 'use_spike': False, 'rsi_required': False, 'edge_k': 1.9519659958709925, 'edge_cap': 0.12410040910866538}.
[I 2025-08-29 23:44:25,852] Trial 1171 finished with values: [-1000000000.0, 1000000000.0] and parameters: {'p_sma': 30, 'p_std': 20, 'p_atr': 8, 'p_adx': 12, 'rsi_period': 36, 'ema1': 26, 'ema2': 20, 'slip_atr_k': 0.1909754076134134, 'slip_spread_k': 0.29290632143669487, 'spread_hl_frac': 0.048191054164164755, 'bb_std_mult': 2.250415918628283, 'rsi_os': 35, 'rsi_ob': 56, 'vol_spike': 0.24965333251721317, 'adx_thresh': 18.886266359333543, 'atr_min_pct': 0.009260936267566803, 'atr_max_pct': 0.06593888270487844, 'tp_mult': 1.4779546686959868, 'tsl_mult': 0.6063082142152761, 'strategy': 'mean_reversion', 'time_stop': 276, 'use_sma': False, 'use_atr': False, 'use_adx': False, 'use_ema': False, 'use_spike': False, 'rsi_required': False, 'edge_k': 1.9092627092244825, 'edge_cap': 0.18819961297853977}.
[I 2025-08-29 23:44:26,633] Trial 1169 finished with values: [-1000000000.0, 1000000000.0] and parameters: {'p_sma': 28, 'p_std': 39, 'p_atr': 8, 'p_adx': 13, 'rsi_period': 72, 'ema1': 29, 'ema2': 21, 'slip_atr_k': 0.1957761645329911, 'slip_spread_k': 0.29769270282076127, 'spread_hl_frac': 0.048102985556374045, 'bb_std_mult': 1.2866641281820415, 'rsi_os': 23, 'rsi_ob': 63, 'vol_spike': 0.25898313506790577, 'adx_thresh': 21.03733647176759, 'atr_min_pct': 0.023034058286980574, 'atr_max_pct': 0.07981539282168382, 'tp_mult': 1.4913254781551846, 'tsl_mult': 0.6088150910767461, 'strategy': 'mean_reversion', 'time_stop': 149, 'use_sma': False, 'use_atr': False, 'use_adx': False, 'use_ema': False, 'use_spike': False, 'rsi_required': False, 'edge_k': 1.9039446879270883, 'edge_cap': 0.9288472304660536}.
[I 2025-08-29 23:44:26,805] Trial 1168 finished with values: [-1000000000.0, 1000000000.0] and parameters: {'p_sma': 29, 'p_std': 39, 'p_atr': 24, 'p_adx': 21, 'rsi_period': 13, 'ema1': 29, 'ema2': 21, 'slip_atr_k': 0.004609500106463712, 'slip_spread_k': 0.29893826395358275, 'spread_hl_frac': 0.013319333168263739, 'bb_std_mult': 3.44435409891245, 'rsi_os': 32, 'rsi_ob': 92, 'vol_spike': 0.2558019762670934, 'adx_thresh': 19.99041537040065, 'atr_min_pct': 0.00878566118277924, 'atr_max_pct': 0.06508058372167703, 'tp_mult': 1.4812129181704001, 'tsl_mult': 0.6137873455685287, 'strategy': 'mean_reversion', 'time_stop': 71, 'use_sma': False, 'use_atr': False, 'use_adx': False, 'use_ema': False, 'use_spike': False, 'rsi_required': False, 'edge_k': 1.6507685161244727, 'edge_cap': 0.18583712634713528}.
[I 2025-08-29 23:44:26,975] Trial 1170 finished with values: [-1000000000.0, 1000000000.0] and parameters: {'p_sma': 28, 'p_std': 12, 'p_atr': 8, 'p_adx': 13, 'rsi_period': 13, 'ema1': 29, 'ema2': 21, 'slip_atr_k': 0.19512251176829098, 'slip_spread_k': 0.30740424904937635, 'spread_hl_frac': 0.0009129797227970873, 'bb_std_mult': 0.723051789816332, 'rsi_os': 48, 'rsi_ob': 63, 'vol_spike': 0.25042907081509813, 'adx_thresh': 21.028993217605255, 'atr_min_pct': 0.014253585571003924, 'atr_max_pct': 0.0801453598712248, 'tp_mult': 1.4812307221805152, 'tsl_mult': 0.6081368938992486, 'strategy': 'mean_reversion', 'time_stop': 70, 'use_sma': False, 'use_atr': False, 'use_adx': False, 'use_ema': False, 'use_spike': False, 'rsi_required': False, 'edge_k': 1.9990157349384052, 'edge_cap': 0.1783065579628505}.
[I 2025-08-29 23:44:54,193] Trial 1173 finished with values: [-1000000000.0, 1000000000.0] and parameters: {'p_sma': 28, 'p_std': 32, 'p_atr': 18, 'p_adx': 21, 'rsi_period': 13, 'ema1': 30, 'ema2': 19, 'slip_atr_k': 0.00019226126936667623, 'slip_spread_k': 0.9773742155856047, 'spread_hl_frac': 0.013750292037410012, 'bb_std_mult': 1.3330371114254012, 'rsi_os': 10, 'rsi_ob': 62, 'vol_spike': 0.24975352878319879, 'adx_thresh': 20.529766133120294, 'atr_min_pct': 0.01175977379472626, 'atr_max_pct': 0.06913091656219886, 'tp_mult': 1.992768497902666, 'tsl_mult': 0.9069881749194753, 'strategy': 'mean_reversion', 'time_stop': 243, 'use_sma': False, 'use_atr': False, 'use_adx': False, 'use_ema': False, 'use_spike': False, 'rsi_required': False, 'edge_k': 1.9982780465816283, 'edge_cap': 0.1601108435323827}.
[I 2025-08-29 23:44:54,923] Trial 1174 finished with values: [-1000000000.0, 1000000000.0] and parameters: {'p_sma': 28, 'p_std': 12, 'p_atr': 30, 'p_adx': 14, 'rsi_period': 13, 'ema1': 11, 'ema2': 54, 'slip_atr_k': 3.2905335284924564e-05, 'slip_spread_k': 0.34124789232749847, 'spread_hl_frac': 0.0008290275924591091, 'bb_std_mult': 1.4822386664093017, 'rsi_os': 12, 'rsi_ob': 62, 'vol_spike': 0.25066459387545265, 'adx_thresh': 26.190605369282142, 'atr_min_pct': 0.01419623045896895, 'atr_max_pct': 0.06964189582968053, 'tp_mult': 1.144800507234979, 'tsl_mult': 0.04915374932508132, 'strategy': 'breakout', 'time_stop': 242, 'use_sma': False, 'use_atr': False, 'use_adx': False, 'use_ema': False, 'use_spike': False, 'rsi_required': False, 'edge_k': 0.16378518957516985, 'edge_cap': 0.15757031155134354}.
[I 2025-08-29 23:44:54,923] Trial 1172 finished with values: [-0.021928994240445365, 0.021918726910325176] and parameters: {'p_sma': 28, 'p_std': 12, 'p_atr': 12, 'p_adx': 21, 'rsi_period': 13, 'ema1': 30, 'ema2': 19, 'slip_atr_k': 0.0001414215715535485, 'slip_spread_k': 0.12459626520989003, 'spread_hl_frac': 0.014180098548105423, 'bb_std_mult': 1.320007341198448, 'rsi_os': 30, 'rsi_ob': 84, 'vol_spike': 0.25968422699755717, 'adx_thresh': 20.427618141496623, 'atr_min_pct': 0.0010274016634110846, 'atr_max_pct': 0.06909404158044134, 'tp_mult': 2.711203330842072, 'tsl_mult': 0.05238353892165887, 'strategy': 'mean_reversion', 'time_stop': 11, 'use_sma': False, 'use_atr': False, 'use_adx': False, 'use_ema': False, 'use_spike': False, 'rsi_required': False, 'edge_k': 1.997288095075385, 'edge_cap': 0.760372992176944}.
[I 2025-08-29 23:44:54,925] Trial 1175 finished with values: [-0.03420472361036975, 0.03419685707085416] and parameters: {'p_sma': 28, 'p_std': 59, 'p_atr': 12, 'p_adx': 14, 'rsi_period': 10, 'ema1': 30, 'ema2': 19, 'slip_atr_k': 0.16335069158946303, 'slip_spread_k': 0.34025901803527414, 'spread_hl_frac': 0.010708736496802991, 'bb_std_mult': 2.337329697552936, 'rsi_os': 9, 'rsi_ob': 62, 'vol_spike': 0.2619091111773895, 'adx_thresh': 12.272390176891218, 'atr_min_pct': 0.001102469580146646, 'atr_max_pct': 0.10908490463654377, 'tp_mult': 2.227473810633442, 'tsl_mult': 0.72056606952149, 'strategy': 'breakout', 'time_stop': 290, 'use_sma': False, 'use_atr': False, 'use_adx': False, 'use_ema': False, 'use_spike': False, 'rsi_required': False, 'edge_k': 1.359926598931262, 'edge_cap': 0.16085303341631466}.
[I 2025-08-29 23:45:22,424] Trial 1179 finished with values: [-0.011600644365213575, 0.011615545863103942] and parameters: {'p_sma': 30, 'p_std': 24, 'p_atr': 12, 'p_adx': 13, 'rsi_period': 16, 'ema1': 30, 'ema2': 22, 'slip_atr_k': 0.007154536475201298, 'slip_spread_k': 0.26820773922922353, 'spread_hl_frac': 0.02419845794294436, 'bb_std_mult': 0.5305171520943419, 'rsi_os': 34, 'rsi_ob': 61, 'vol_spike': 0.2597883502149005, 'adx_thresh': 21.80384630852843, 'atr_min_pct': 0.0018852388714940597, 'atr_max_pct': 0.07569426551612762, 'tp_mult': 2.095264247352076, 'tsl_mult': 0.5782608234793818, 'strategy': 'mean_reversion', 'time_stop': 269, 'use_sma': False, 'use_atr': False, 'use_adx': False, 'use_ema': False, 'use_spike': False, 'rsi_required': False, 'edge_k': 0.8289198988115225, 'edge_cap': 0.6414728206753758}.
[I 2025-08-29 23:45:22,710] Trial 1177 finished with values: [-1000000000.0, 1000000000.0] and parameters: {'p_sma': 30, 'p_std': 6, 'p_atr': 12, 'p_adx': 13, 'rsi_period': 17, 'ema1': 15, 'ema2': 22, 'slip_atr_k': 0.00849096419936064, 'slip_spread_k': 0.27696524856528404, 'spread_hl_frac': 0.007279684973730473, 'bb_std_mult': 1.6397274382677223, 'rsi_os': 34, 'rsi_ob': 90, 'vol_spike': 0.25786907979791224, 'adx_thresh': 27.391380012215805, 'atr_min_pct': 0.012651484594244013, 'atr_max_pct': 0.04218494317470894, 'tp_mult': 1.9806152468013591, 'tsl_mult': 0.5799490352577126, 'strategy': 'mean_reversion', 'time_stop': 277, 'use_sma': False, 'use_atr': False, 'use_adx': False, 'use_ema': False, 'use_spike': False, 'rsi_required': False, 'edge_k': 1.9245129072021212, 'edge_cap': 0.2235171343990741}.
[I 2025-08-29 23:45:22,745] Trial 1178 finished with values: [-1000000000.0, 1000000000.0] and parameters: {'p_sma': 30, 'p_std': 14, 'p_atr': 12, 'p_adx': 16, 'rsi_period': 9, 'ema1': 30, 'ema2': 22, 'slip_atr_k': 0.07391386847290335, 'slip_spread_k': 0.39532840550915666, 'spread_hl_frac': 0.007175732716012934, 'bb_std_mult': 1.4179626528508615, 'rsi_os': 34, 'rsi_ob': 60, 'vol_spike': 0.25769371136712826, 'adx_thresh': 21.975573706166752, 'atr_min_pct': 0.0081856791096869, 'atr_max_pct': 0.07488780942531012, 'tp_mult': 1.80602041644166, 'tsl_mult': 0.5779519769896151, 'strategy': 'mean_reversion', 'time_stop': 231, 'use_sma': False, 'use_atr': False, 'use_adx': False, 'use_ema': False, 'use_spike': False, 'rsi_required': False, 'edge_k': 0.8757485700368758, 'edge_cap': 0.8054305591508026}.
[I 2025-08-29 23:45:22,866] Trial 1176 finished with values: [-0.05799966057503858, 0.05798771588860813] and parameters: {'p_sma': 30, 'p_std': 6, 'p_atr': 12, 'p_adx': 14, 'rsi_period': 17, 'ema1': 17, 'ema2': 22, 'slip_atr_k': 0.16522858127250825, 'slip_spread_k': 0.11160610613620969, 'spread_hl_frac': 0.010641786768518161, 'bb_std_mult': 1.4391256120168598, 'rsi_os': 52, 'rsi_ob': 60, 'vol_spike': 0.2603303850820205, 'adx_thresh': 22.133453193933285, 'atr_min_pct': 0.0009122954195686329, 'atr_max_pct': 0.11716046309524081, 'tp_mult': 2.648108796239773, 'tsl_mult': 0.0456907710684743, 'strategy': 'breakout', 'time_stop': 269, 'use_sma': False, 'use_atr': False, 'use_adx': False, 'use_ema': False, 'use_spike': False, 'rsi_required': False, 'edge_k': 0.1591551618077668, 'edge_cap': 0.23036936699608773}.
[I 2025-08-29 23:45:23,202] Trial 1180 finished with values: [-1000000000.0, 1000000000.0] and parameters: {'p_sma': 30, 'p_std': 15, 'p_atr': 12, 'p_adx': 15, 'rsi_period': 44, 'ema1': 24, 'ema2': 20, 'slip_atr_k': 5.877524638965624e-06, 'slip_spread_k': 0.40720995648809816, 'spread_hl_frac': 0.009050074398255791, 'bb_std_mult': 1.7449190470124252, 'rsi_os': 52, 'rsi_ob': 91, 'vol_spike': 0.25375402496115224, 'adx_thresh': 28.384389491148028, 'atr_min_pct': 0.012788591972886454, 'atr_max_pct': 0.13250804229353202, 'tp_mult': 2.0620309374929415, 'tsl_mult': 0.6457263761903578, 'strategy': 'mean_reversion', 'time_stop': 279, 'use_sma': False, 'use_atr': False, 'use_adx': False, 'use_ema': False, 'use_spike': False, 'rsi_required': False, 'edge_k': 1.9326046293503822, 'edge_cap': 0.22272193723149958}.
[I 2025-08-29 23:45:50,910] Trial 1184 finished with values: [-1000000000.0, 1000000000.0] and parameters: {'p_sma': 29, 'p_std': 9, 'p_atr': 17, 'p_adx': 12, 'rsi_period': 23, 'ema1': 20, 'ema2': 18, 'slip_atr_k': 0.0990173920073831, 'slip_spread_k': 0.2561033693008021, 'spread_hl_frac': 0.03247420279620208, 'bb_std_mult': 1.244963474681809, 'rsi_os': 38, 'rsi_ob': 64, 'vol_spike': 0.2501523592238625, 'adx_thresh': 8.956041404208348, 'atr_min_pct': 0.007529119280432138, 'atr_max_pct': 0.06685033266160616, 'tp_mult': 1.910808587389105, 'tsl_mult': 0.6859793028355895, 'strategy': 'mean_reversion', 'time_stop': 288, 'use_sma': False, 'use_atr': False, 'use_adx': False, 'use_ema': False, 'use_spike': False, 'rsi_required': False, 'edge_k': 1.5379822913996217, 'edge_cap': 0.2006653024522711}.
[I 2025-08-29 23:45:51,130] Trial 1183 finished with values: [-1000000000.0, 1000000000.0] and parameters: {'p_sma': 29, 'p_std': 13, 'p_atr': 13, 'p_adx': 12, 'rsi_period': 61, 'ema1': 24, 'ema2': 20, 'slip_atr_k': 0.21086047884989206, 'slip_spread_k': 0.3123927829501703, 'spread_hl_frac': 0.008530142994647247, 'bb_std_mult': 1.5282958129233508, 'rsi_os': 31, 'rsi_ob': 65, 'vol_spike': 0.2498659512314088, 'adx_thresh': 21.365281583443817, 'atr_min_pct': 0.005453473041624659, 'atr_max_pct': 0.02737110833817928, 'tp_mult': 1.9152854256544043, 'tsl_mult': 0.7905975140862416, 'strategy': 'mean_reversion', 'time_stop': 289, 'use_sma': False, 'use_atr': False, 'use_adx': False, 'use_ema': False, 'use_spike': False, 'rsi_required': False, 'edge_k': 1.8871764080430993, 'edge_cap': 0.20396387030321367}.
[I 2025-08-29 23:45:51,442] Trial 1182 finished with values: [-1000000000.0, 1000000000.0] and parameters: {'p_sma': 29, 'p_std': 15, 'p_atr': 29, 'p_adx': 15, 'rsi_period': 7, 'ema1': 5, 'ema2': 20, 'slip_atr_k': 0.09579260564103878, 'slip_spread_k': 0.14982371568870395, 'spread_hl_frac': 0.010413688145521214, 'bb_std_mult': 1.4658385213268104, 'rsi_os': 38, 'rsi_ob': 49, 'vol_spike': 0.2517570984944668, 'adx_thresh': 28.387172253481616, 'atr_min_pct': 0.0055402038255851676, 'atr_max_pct': 0.10405811043475846, 'tp_mult': 1.2818871380698755, 'tsl_mult': 0.6477641572888522, 'strategy': 'breakout', 'time_stop': 290, 'use_sma': False, 'use_atr': False, 'use_adx': False, 'use_ema': False, 'use_spike': False, 'rsi_required': False, 'edge_k': 1.2203916125506884, 'edge_cap': 0.19161899830434592}.
[I 2025-08-29 23:45:51,572] Trial 1181 finished with values: [-1000000000.0, 1000000000.0] and parameters: {'p_sma': 29, 'p_std': 14, 'p_atr': 21, 'p_adx': 28, 'rsi_period': 61, 'ema1': 30, 'ema2': 41, 'slip_atr_k': 0.21190121571422457, 'slip_spread_k': 0.25929971241704924, 'spread_hl_frac': 0.009066722397895096, 'bb_std_mult': 1.7573774602188639, 'rsi_os': 54, 'rsi_ob': 81, 'vol_spike': 0.2507400859282251, 'adx_thresh': 19.425696058684082, 'atr_min_pct': 0.007920894375796066, 'atr_max_pct': 0.062406207386257254, 'tp_mult': 1.2824667127378278, 'tsl_mult': 0.6481828941357791, 'strategy': 'breakout', 'time_stop': 38, 'use_sma': False, 'use_atr': False, 'use_adx': False, 'use_ema': False, 'use_spike': False, 'rsi_required': False, 'edge_k': 1.8679526912994966, 'edge_cap': 0.2072781444896406}.
[I 2025-08-29 23:46:19,620] Trial 1188 finished with values: [-1000000000.0, 1000000000.0] and parameters: {'p_sma': 28, 'p_std': 11, 'p_atr': 11, 'p_adx': 10, 'rsi_period': 11, 'ema1': 30, 'ema2': 40, 'slip_atr_k': 0.01622978260366111, 'slip_spread_k': 0.6422355700557795, 'spread_hl_frac': 0.022941790881447537, 'bb_std_mult': 1.32681596990499, 'rsi_os': 5, 'rsi_ob': 74, 'vol_spike': 0.2613243130229663, 'adx_thresh': 9.919382483798547, 'atr_min_pct': 0.025981390462148722, 'atr_max_pct': 0.0699199684043464, 'tp_mult': 2.4775574880605222, 'tsl_mult': 0.1906219989713367, 'strategy': 'mean_reversion', 'time_stop': 282, 'use_sma': False, 'use_atr': False, 'use_adx': False, 'use_ema': False, 'use_spike': False, 'rsi_required': False, 'edge_k': 1.4257777949947228, 'edge_cap': 0.6824622597990303}.
[I 2025-08-29 23:46:19,822] Trial 1185 finished with values: [-1000000000.0, 1000000000.0] and parameters: {'p_sma': 28, 'p_std': 13, 'p_atr': 11, 'p_adx': 29, 'rsi_period': 7, 'ema1': 19, 'ema2': 24, 'slip_atr_k': 0.017099714424209416, 'slip_spread_k': 0.2695381332628183, 'spread_hl_frac': 0.030914580881617713, 'bb_std_mult': 1.3538412744424142, 'rsi_os': 55, 'rsi_ob': 88, 'vol_spike': 0.25157727279810854, 'adx_thresh': 21.347829140562784, 'atr_min_pct': 0.005209554814009911, 'atr_max_pct': 0.06211698479369024, 'tp_mult': 1.8816707425855215, 'tsl_mult': 0.6653964169713671, 'strategy': 'breakout', 'time_stop': 284, 'use_sma': False, 'use_atr': False, 'use_adx': False, 'use_ema': False, 'use_spike': False, 'rsi_required': False, 'edge_k': 1.8812846466324398, 'edge_cap': 0.2780294523457051}.
[I 2025-08-29 23:46:20,014] Trial 1187 finished with values: [-1000000000.0, 1000000000.0] and parameters: {'p_sma': 28, 'p_std': 10, 'p_atr': 11, 'p_adx': 13, 'rsi_period': 11, 'ema1': 30, 'ema2': 59, 'slip_atr_k': 0.012583009820882, 'slip_spread_k': 0.27628815566795806, 'spread_hl_frac': 0.011399305292408218, 'bb_std_mult': 0.6232278191270681, 'rsi_os': 19, 'rsi_ob': 88, 'vol_spike': 0.2597176349437252, 'adx_thresh': 19.650513682262932, 'atr_min_pct': 0.02037764103927267, 'atr_max_pct': 0.06970870154736811, 'tp_mult': 1.6618812494803503, 'tsl_mult': 0.4353270429450964, 'strategy': 'mean_reversion', 'time_stop': 188, 'use_sma': False, 'use_atr': False, 'use_adx': False, 'use_ema': False, 'use_spike': False, 'rsi_required': False, 'edge_k': 1.0999282918337292, 'edge_cap': 0.9980043746539924}.
