[I 2025-08-29 22:07:22,385] Trial 241 finished with values: [-0.0024560744364297005, 0.0024879542587186256] and parameters: {'p_sma': 46, 'p_std': 14, 'p_atr': 16, 'p_adx': 21, 'rsi_period': 26, 'ema1': 6, 'ema2': 26, 'slip_atr_k': 0.03809489342910122, 'slip_spread_k': 0.6174132462509478, 'spread_hl_frac': 0.01007380806117807, 'bb_std_mult': 1.1301362465927651, 'rsi_os': 7, 'rsi_ob': 83, 'vol_spike': 0.15557677042320134, 'adx_thresh': 31.42328565977227, 'atr_min_pct': 0.0013832230009318469, 'atr_max_pct': 0.016536298569904503, 'tp_mult': 1.3417572640648765, 'tsl_mult': 0.4700967186688613, 'strategy': 'mean_reversion', 'time_stop': 119, 'use_sma': False, 'use_atr': False, 'use_adx': False, 'use_ema': False, 'use_spike': False, 'rsi_required': False, 'edge_k': 0.42908304338273684, 'edge_cap': 0.2892962526794196}.
[I 2025-08-29 22:07:22,453] Trial 242 finished with values: [-0.004839159669613569, 0.004892859782783461] and parameters: {'p_sma': 49, 'p_std': 14, 'p_atr': 16, 'p_adx': 22, 'rsi_period': 27, 'ema1': 27, 'ema2': 10, 'slip_atr_k': 0.03895328810642659, 'slip_spread_k': 0.6201910190418931, 'spread_hl_frac': 0.01085775909362531, 'bb_std_mult': 0.8904774999572668, 'rsi_os': 28, 'rsi_ob': 55, 'vol_spike': 0.23051656055219702, 'adx_thresh': 26.917420060949205, 'atr_min_pct': 0.0017890117950099737, 'atr_max_pct': 0.13054045390002844, 'tp_mult': 2.7839708939091485, 'tsl_mult': 0.45861478365167896, 'strategy': 'mean_reversion', 'time_stop': 89, 'use_sma': False, 'use_atr': False, 'use_adx': False, 'use_ema': False, 'use_spike': False, 'rsi_required': False, 'edge_k': 0.4437944048719227, 'edge_cap': 0.4911845324056373}.
[I 2025-08-29 22:07:22,642] Trial 245 finished with values: [-1000000000.0, 1000000000.0] and parameters: {'p_sma': 46, 'p_std': 9, 'p_atr': 21, 'p_adx': 24, 'rsi_period': 27, 'ema1': 6, 'ema2': 40, 'slip_atr_k': 0.15160095016522382, 'slip_spread_k': 0.8186430524410772, 'spread_hl_frac': 0.009826334131856119, 'bb_std_mult': 0.8590664434830529, 'rsi_os': 25, 'rsi_ob': 84, 'vol_spike': 0.180357358077881, 'adx_thresh': 23.162599677989082, 'atr_min_pct': 0.029247286910909245, 'atr_max_pct': 0.015547119985279537, 'tp_mult': 2.864095769194284, 'tsl_mult': 0.46090089505317905, 'strategy': 'mean_reversion', 'time_stop': 88, 'use_sma': False, 'use_atr': False, 'use_adx': False, 'use_ema': False, 'use_spike': False, 'rsi_required': False, 'edge_k': 0.4330364755487999, 'edge_cap': 0.49338792171838486}.
[I 2025-08-29 22:07:49,728] Trial 247 finished with values: [-1000000000.0, 1000000000.0] and parameters: {'p_sma': 46, 'p_std': 46, 'p_atr': 22, 'p_adx': 29, 'rsi_period': 27, 'ema1': 19, 'ema2': 58, 'slip_atr_k': 0.00026917651854488356, 'slip_spread_k': 0.6145880641713029, 'spread_hl_frac': 0.03491066988708306, 'bb_std_mult': 1.1514514265168607, 'rsi_os': 8, 'rsi_ob': 80, 'vol_spike': 0.22073153898749148, 'adx_thresh': 23.268647894979708, 'atr_min_pct': 0.0013250348184708246, 'atr_max_pct': 0.12501571414301982, 'tp_mult': 2.8649727440449726, 'tsl_mult': 0.4704547506097832, 'strategy': 'mean_reversion', 'time_stop': 104, 'use_sma': False, 'use_atr': False, 'use_adx': False, 'use_ema': False, 'use_spike': False, 'rsi_required': False, 'edge_k': 0.4534198508151966, 'edge_cap': 0.4937920963137963}.
[I 2025-08-29 22:07:49,864] Trial 246 finished with values: [-1000000000.0, 1000000000.0] and parameters: {'p_sma': 46, 'p_std': 46, 'p_atr': 22, 'p_adx': 24, 'rsi_period': 53, 'ema1': 6, 'ema2': 29, 'slip_atr_k': 0.03879831869899463, 'slip_spread_k': 0.8909852286900962, 'spread_hl_frac': 0.010817729215814307, 'bb_std_mult': 1.1430843646075544, 'rsi_os': 7, 'rsi_ob': 57, 'vol_spike': 0.22989600256394244, 'adx_thresh': 22.890696767094965, 'atr_min_pct': 0.001493119939460427, 'atr_max_pct': 0.014557115657306913, 'tp_mult': 2.9066245697442232, 'tsl_mult': 0.06436422068330355, 'strategy': 'mean_reversion', 'time_stop': 280, 'use_sma': False, 'use_atr': False, 'use_adx': False, 'use_ema': False, 'use_spike': False, 'rsi_required': False, 'edge_k': 0.46482897051778266, 'edge_cap': 0.2864355660054173}.
[I 2025-08-29 22:07:50,102] Trial 249 finished with values: [-1000000000.0, 1000000000.0] and parameters: {'p_sma': 47, 'p_std': 35, 'p_atr': 22, 'p_adx': 29, 'rsi_period': 26, 'ema1': 7, 'ema2': 36, 'slip_atr_k': 0.030219789337115728, 'slip_spread_k': 0.8945805447281638, 'spread_hl_frac': 0.03490680817242648, 'bb_std_mult': 1.115861021593316, 'rsi_os': 24, 'rsi_ob': 78, 'vol_spike': 0.22163798114078112, 'adx_thresh': 33.065060468399054, 'atr_min_pct': 0.0025599507360287233, 'atr_max_pct': 0.10956810645715312, 'tp_mult': 2.9067128398059388, 'tsl_mult': 0.5257234142638507, 'strategy': 'mean_reversion', 'time_stop': 103, 'use_sma': False, 'use_atr': False, 'use_adx': False, 'use_ema': False, 'use_spike': False, 'rsi_required': False, 'edge_k': 0.844089321419847, 'edge_cap': 0.29363405759986716}.
[I 2025-08-29 22:07:50,114] Trial 248 finished with values: [-0.0038206244228702335, 0.00382333768225335] and parameters: {'p_sma': 35, 'p_std': 33, 'p_atr': 12, 'p_adx': 14, 'rsi_period': 26, 'ema1': 19, 'ema2': 10, 'slip_atr_k': 0.1502950591840385, 'slip_spread_k': 0.06693483312362536, 'spread_hl_frac': 0.03456930903735994, 'bb_std_mult': 0.5205346402043078, 'rsi_os': 7, 'rsi_ob': 78, 'vol_spike': 0.21825192949616523, 'adx_thresh': 31.497100931467838, 'atr_min_pct': 0.0012134248978932507, 'atr_max_pct': 0.125570969385835, 'tp_mult': 1.2556275517423976, 'tsl_mult': 0.05363638436923435, 'strategy': 'mean_reversion', 'time_stop': 113, 'use_sma': False, 'use_atr': False, 'use_adx': False, 'use_ema': False, 'use_spike': False, 'rsi_required': False, 'edge_k': 0.3732433552956108, 'edge_cap': 0.8758815550867352}.
[I 2025-08-29 22:08:16,844] Trial 250 finished with values: [-1000000000.0, 1000000000.0] and parameters: {'p_sma': 47, 'p_std': 33, 'p_atr': 23, 'p_adx': 22, 'rsi_period': 78, 'ema1': 7, 'ema2': 10, 'slip_atr_k': 0.048489029987813195, 'slip_spread_k': 0.8999882994272372, 'spread_hl_frac': 0.03389731153521323, 'bb_std_mult': 1.0123884901954496, 'rsi_os': 23, 'rsi_ob': 78, 'vol_spike': 0.1286291111417233, 'adx_thresh': 33.08788073024939, 'atr_min_pct': 0.0024333017277211834, 'atr_max_pct': 0.12787867609842934, 'tp_mult': 2.9185083639664633, 'tsl_mult': 0.5226426002814119, 'strategy': 'mean_reversion', 'time_stop': 247, 'use_sma': False, 'use_atr': False, 'use_adx': False, 'use_ema': False, 'use_spike': False, 'rsi_required': False, 'edge_k': 0.8683201124624447, 'edge_cap': 0.44519084367151845}.
[I 2025-08-29 22:08:17,568] Trial 251 finished with values: [-1000000000.0, 1000000000.0] and parameters: {'p_sma': 39, 'p_std': 33, 'p_atr': 12, 'p_adx': 22, 'rsi_period': 78, 'ema1': 20, 'ema2': 36, 'slip_atr_k': 0.04774786850780392, 'slip_spread_k': 0.08646150591510027, 'spread_hl_frac': 0.03785440171532098, 'bb_std_mult': 1.03137641602912, 'rsi_os': 25, 'rsi_ob': 78, 'vol_spike': 0.21966153946031364, 'adx_thresh': 32.87406003259903, 'atr_min_pct': 0.002641739548691995, 'atr_max_pct': 0.11037833515041086, 'tp_mult': 2.5195219563317632, 'tsl_mult': 0.41852171057463017, 'strategy': 'mean_reversion', 'time_stop': 256, 'use_sma': False, 'use_atr': False, 'use_adx': False, 'use_ema': False, 'use_spike': False, 'rsi_required': False, 'edge_k': 0.3780078315690886, 'edge_cap': 0.4309384623964604}.
[I 2025-08-29 22:08:17,663] Trial 253 finished with values: [-0.006172989503930193, 0.006144045904647281] and parameters: {'p_sma': 38, 'p_std': 31, 'p_atr': 19, 'p_adx': 16, 'rsi_period': 24, 'ema1': 20, 'ema2': 10, 'slip_atr_k': 0.048552926865622174, 'slip_spread_k': 0.7012049911066653, 'spread_hl_frac': 0.026044181610261643, 'bb_std_mult': 1.0341472362912412, 'rsi_os': 34, 'rsi_ob': 60, 'vol_spike': 0.17163009267423174, 'adx_thresh': 25.46481978243718, 'atr_min_pct': 0.0027449653193472017, 'atr_max_pct': 0.10220599831308311, 'tp_mult': 2.8424254713224406, 'tsl_mult': 0.5033618463424383, 'strategy': 'mean_reversion', 'time_stop': 167, 'use_sma': False, 'use_atr': False, 'use_adx': False, 'use_ema': False, 'use_spike': False, 'rsi_required': False, 'edge_k': 1.0547155403992798, 'edge_cap': 0.4417885632957177}.
[I 2025-08-29 22:08:17,770] Trial 252 finished with values: [-1000000000.0, 1000000000.0] and parameters: {'p_sma': 36, 'p_std': 33, 'p_atr': 17, 'p_adx': 16, 'rsi_period': 22, 'ema1': 8, 'ema2': 10, 'slip_atr_k': 0.16725022989042795, 'slip_spread_k': 0.09042070307187561, 'spread_hl_frac': 0.037729379946846706, 'bb_std_mult': 1.0047251029501796, 'rsi_os': 25, 'rsi_ob': 77, 'vol_spike': 0.20325075637090909, 'adx_thresh': 5.02302848988117, 'atr_min_pct': 0.02812552832409234, 'atr_max_pct': 0.12800973736512294, 'tp_mult': 1.2546349151091722, 'tsl_mult': 0.5084825057137592, 'strategy': 'mean_reversion', 'time_stop': 255, 'use_sma': False, 'use_atr': False, 'use_adx': False, 'use_ema': False, 'use_spike': False, 'rsi_required': False, 'edge_k': 0.3653926107258701, 'edge_cap': 0.43673565281411186}.
[I 2025-08-29 22:08:44,750] Trial 255 finished with values: [-1000000000.0, 1000000000.0] and parameters: {'p_sma': 48, 'p_std': 35, 'p_atr': 23, 'p_adx': 21, 'rsi_period': 24, 'ema1': 28, 'ema2': 26, 'slip_atr_k': 0.09833158761710092, 'slip_spread_k': 0.6991094147439535, 'spread_hl_frac': 0.03688207529957588, 'bb_std_mult': 1.8153943059383915, 'rsi_os': 27, 'rsi_ob': 75, 'vol_spike': 0.2062530629119319, 'adx_thresh': 34.37555886819777, 'atr_min_pct': 0.013041991527183286, 'atr_max_pct': 0.14352128881277104, 'tp_mult': 2.440883240595822, 'tsl_mult': 0.19385533941906175, 'strategy': 'mean_reversion', 'time_stop': 169, 'use_sma': False, 'use_atr': False, 'use_adx': False, 'use_ema': False, 'use_spike': False, 'rsi_required': False, 'edge_k': 0.2750488965921966, 'edge_cap': 0.05083409070790312}.
[I 2025-08-29 22:08:44,892] Trial 256 finished with values: [-1000000000.0, 1000000000.0] and parameters: {'p_sma': 48, 'p_std': 35, 'p_atr': 23, 'p_adx': 30, 'rsi_period': 29, 'ema1': 8, 'ema2': 26, 'slip_atr_k': 0.19186239052049703, 'slip_spread_k': 0.7902844695868863, 'spread_hl_frac': 0.036783045268977306, 'bb_std_mult': 0.7938058731682134, 'rsi_os': 27, 'rsi_ob': 75, 'vol_spike': 0.22841453049605415, 'adx_thresh': 34.40922318760171, 'atr_min_pct': 0.027504552494912904, 'atr_max_pct': 0.12363014336513914, 'tp_mult': 1.9457273983376704, 'tsl_mult': 0.440279998261891, 'strategy': 'mean_reversion', 'time_stop': 110, 'use_sma': False, 'use_atr': False, 'use_adx': False, 'use_ema': False, 'use_spike': False, 'rsi_required': False, 'edge_k': 0.27536631276883977, 'edge_cap': 0.3911896363539884}.
[I 2025-08-29 22:08:45,166] Trial 257 finished with values: [-1000000000.0, 1000000000.0] and parameters: {'p_sma': 28, 'p_std': 25, 'p_atr': 8, 'p_adx': 30, 'rsi_period': 25, 'ema1': 6, 'ema2': 26, 'slip_atr_k': 0.19222391640771172, 'slip_spread_k': 0.8549996122440028, 'spread_hl_frac': 0.03656521497648864, 'bb_std_mult': 0.7768445574892926, 'rsi_os': 32, 'rsi_ob': 75, 'vol_spike': 0.26822853782876444, 'adx_thresh': 34.300653761687435, 'atr_min_pct': 0.02734860333361801, 'atr_max_pct': 0.09570698911827798, 'tp_mult': 2.8072104704347556, 'tsl_mult': 0.7130687831773599, 'strategy': 'mean_reversion', 'time_stop': 111, 'use_sma': False, 'use_atr': False, 'use_adx': False, 'use_ema': False, 'use_spike': False, 'rsi_required': False, 'edge_k': 0.31027228925487516, 'edge_cap': 0.3825729770993282}.
[I 2025-08-29 22:08:45,412] Trial 254 finished with values: [-1000000000.0, 1000000000.0] and parameters: {'p_sma': 48, 'p_std': 59, 'p_atr': 23, 'p_adx': 21, 'rsi_period': 22, 'ema1': 10, 'ema2': 26, 'slip_atr_k': 0.14170787096096918, 'slip_spread_k': 0.6993604252206577, 'spread_hl_frac': 0.03728290407380446, 'bb_std_mult': 1.0346070220677788, 'rsi_os': 34, 'rsi_ob': 79, 'vol_spike': 0.23178256403366135, 'adx_thresh': 34.23770984373106, 'atr_min_pct': 0.011835620529539062, 'atr_max_pct': 0.143501702636057, 'tp_mult': 2.8451553999946944, 'tsl_mult': 0.7166226636921136, 'strategy': 'mean_reversion', 'time_stop': 110, 'use_sma': False, 'use_atr': False, 'use_adx': False, 'use_ema': False, 'use_spike': False, 'rsi_required': False, 'edge_k': 0.29390177710638127, 'edge_cap': 0.5131047658875021}.
[I 2025-08-29 22:08:45,549] Trial 258 finished with values: [-1000000000.0, 1000000000.0] and parameters: {'p_sma': 58, 'p_std': 34, 'p_atr': 13, 'p_adx': 17, 'rsi_period': 74, 'ema1': 6, 'ema2': 13, 'slip_atr_k': 0.030222112883720186, 'slip_spread_k': 0.8541732430185297, 'spread_hl_frac': 0.005545001383911716, 'bb_std_mult': 1.3529549790732442, 'rsi_os': 32, 'rsi_ob': 46, 'vol_spike': 0.21477015067423183, 'adx_thresh': 34.03331150505431, 'atr_min_pct': 0.0034101887573667815, 'atr_max_pct': 0.03676577489743013, 'tp_mult': 2.3113165338935513, 'tsl_mult': 0.7138428422831837, 'strategy': 'mean_reversion', 'time_stop': 225, 'use_sma': False, 'use_atr': False, 'use_adx': False, 'use_ema': False, 'use_spike': False, 'rsi_required': False, 'edge_k': 0.30489448845832257, 'edge_cap': 0.5161857604157879}.
[I 2025-08-29 22:08:45,586] Trial 259 finished with values: [-1000000000.0, 1000000000.0] and parameters: {'p_sma': 44, 'p_std': 25, 'p_atr': 14, 'p_adx': 23, 'rsi_period': 25, 'ema1': 6, 'ema2': 12, 'slip_atr_k': 0.14149883129239177, 'slip_spread_k': 0.7314804702856417, 'spread_hl_frac': 0.028333499771327982, 'bb_std_mult': 1.263924690513858, 'rsi_os': 23, 'rsi_ob': 46, 'vol_spike': 0.23430914676883963, 'adx_thresh': 34.02820146711893, 'atr_min_pct': 0.008721528903135815, 'atr_max_pct': 0.13016654188962798, 'tp_mult': 2.7233178890790892, 'tsl_mult': 0.4782073874152407, 'strategy': 'mean_reversion', 'time_stop': 266, 'use_sma': False, 'use_atr': False, 'use_adx': False, 'use_ema': False, 'use_spike': False, 'rsi_required': False, 'edge_k': 1.7387679383687928, 'edge_cap': 0.5091890973256596}.
[I 2025-08-29 22:08:45,596] Trial 261 finished with values: [-1000000000.0, 1000000000.0] and parameters: {'p_sma': 44, 'p_std': 17, 'p_atr': 22, 'p_adx': 28, 'rsi_period': 84, 'ema1': 5, 'ema2': 13, 'slip_atr_k': 0.02985834206559317, 'slip_spread_k': 0.3443357399594903, 'spread_hl_frac': 0.04777223286543177, 'bb_std_mult': 1.710897337760152, 'rsi_os': 55, 'rsi_ob': 48, 'vol_spike': 0.15831717265479014, 'adx_thresh': 32.216028182388484, 'atr_min_pct': 0.0033731041625997306, 'atr_max_pct': 0.035510148095743384, 'tp_mult': 1.1450753293427276, 'tsl_mult': 0.477951495271989, 'strategy': 'mean_reversion', 'time_stop': 101, 'use_sma': False, 'use_atr': False, 'use_adx': False, 'use_ema': False, 'use_spike': False, 'rsi_required': False, 'edge_k': 1.9891778402637459, 'edge_cap': 0.5200501633761512}.
[I 2025-08-29 22:08:45,811] Trial 264 finished with values: [-1000000000.0, 1000000000.0] and parameters: {'p_sma': 50, 'p_std': 38, 'p_atr': 28, 'p_adx': 8, 'rsi_period': 81, 'ema1': 5, 'ema2': 15, 'slip_atr_k': 0.03635079469622609, 'slip_spread_k': 0.7739826778349725, 'spread_hl_frac': 0.035444123137414005, 'bb_std_mult': 0.8992896750060193, 'rsi_os': 53, 'rsi_ob': 79, 'vol_spike': 0.10175357307872934, 'adx_thresh': 11.807932530678174, 'atr_min_pct': 0.00201500182204811, 'atr_max_pct': 0.1256547401965588, 'tp_mult': 2.2337512836730014, 'tsl_mult': 0.02335395440678706, 'strategy': 'mean_reversion', 'time_stop': 95, 'use_sma': False, 'use_atr': False, 'use_adx': False, 'use_ema': False, 'use_spike': False, 'rsi_required': False, 'edge_k': 0.05470903359159229, 'edge_cap': 0.09631629392548174}.
[I 2025-08-29 22:09:10,466] Trial 260 finished with values: [-0.0061818801777732135, 0.006149149080806413] and parameters: {'p_sma': 46, 'p_std': 44, 'p_atr': 22, 'p_adx': 23, 'rsi_period': 22, 'ema1': 15, 'ema2': 13, 'slip_atr_k': 0.14211443132481977, 'slip_spread_k': 0.7584703389043647, 'spread_hl_frac': 0.03551670538115916, 'bb_std_mult': 1.9052158216305954, 'rsi_os': 45, 'rsi_ob': 90, 'vol_spike': 0.23841453405068966, 'adx_thresh': 33.46241751409154, 'atr_min_pct': 0.0034330393568777974, 'atr_max_pct': 0.03629002319718078, 'tp_mult': 2.7083123765055817, 'tsl_mult': 0.6512975923960737, 'strategy': 'mean_reversion', 'time_stop': 94, 'use_sma': False, 'use_atr': False, 'use_adx': False, 'use_ema': False, 'use_spike': False, 'rsi_required': False, 'edge_k': 0.47739609493267976, 'edge_cap': 0.5187395605026974}.
[I 2025-08-29 22:09:12,376] Trial 263 finished with values: [-0.002944916894549121, 0.002929774554753012] and parameters: {'p_sma': 50, 'p_std': 38, 'p_atr': 21, 'p_adx': 22, 'rsi_period': 28, 'ema1': 15, 'ema2': 12, 'slip_atr_k': 0.03545639049937248, 'slip_spread_k': 0.7599734752152456, 'spread_hl_frac': 0.024474040739603523, 'bb_std_mult': 0.8925698865773668, 'rsi_os': 29, 'rsi_ob': 79, 'vol_spike': 0.2214238464584024, 'adx_thresh': 32.08927857979272, 'atr_min_pct': 0.002068697122799001, 'atr_max_pct': 0.12497537697780575, 'tp_mult': 2.8193619693090226, 'tsl_mult': 0.2442207496938973, 'strategy': 'mean_reversion', 'time_stop': 28, 'use_sma': False, 'use_atr': False, 'use_adx': False, 'use_ema': False, 'use_spike': False, 'rsi_required': False, 'edge_k': 0.20529793389676676, 'edge_cap': 0.4749376704154909}.
[I 2025-08-29 22:09:12,727] Trial 262 finished with values: [-1000000000.0, 1000000000.0] and parameters: {'p_sma': 44, 'p_std': 16, 'p_atr': 14, 'p_adx': 23, 'rsi_period': 25, 'ema1': 5, 'ema2': 12, 'slip_atr_k': 0.021716860692162568, 'slip_spread_k': 0.7714413708409182, 'spread_hl_frac': 0.03556592244357149, 'bb_std_mult': 0.8914815550161905, 'rsi_os': 24, 'rsi_ob': 82, 'vol_spike': 0.08933845529481971, 'adx_thresh': 33.365709525340456, 'atr_min_pct': 0.023960497429172414, 'atr_max_pct': 0.13023146926445472, 'tp_mult': 2.2390858905177797, 'tsl_mult': 0.4789907660720337, 'strategy': 'mean_reversion', 'time_stop': 101, 'use_sma': False, 'use_atr': False, 'use_adx': False, 'use_ema': False, 'use_spike': False, 'rsi_required': False, 'edge_k': 0.21599692744312504, 'edge_cap': 0.47506179811796967}.
[I 2025-08-29 22:09:12,800] Trial 265 finished with values: [-1000000000.0, 1000000000.0] and parameters: {'p_sma': 46, 'p_std': 38, 'p_atr': 21, 'p_adx': 15, 'rsi_period': 17, 'ema1': 7, 'ema2': 12, 'slip_atr_k': 0.020263667112902225, 'slip_spread_k': 0.7638188566627144, 'spread_hl_frac': 0.033691868698850755, 'bb_std_mult': 2.1000952015769396, 'rsi_os': 11, 'rsi_ob': 77, 'vol_spike': 0.2982878406591629, 'adx_thresh': 26.57228348628458, 'atr_min_pct': 0.002230940548366233, 'atr_max_pct': 0.13073070725683428, 'tp_mult': 2.762520825825604, 'tsl_mult': 0.44920921551771353, 'strategy': 'mean_reversion', 'time_stop': 101, 'use_sma': False, 'use_atr': False, 'use_adx': False, 'use_ema': False, 'use_spike': False, 'rsi_required': False, 'edge_k': 0.47565121267473487, 'edge_cap': 0.45897964294011023}.
[I 2025-08-29 22:09:39,843] Trial 266 finished with values: [-1000000000.0, 1000000000.0] and parameters: {'p_sma': 49, 'p_std': 56, 'p_atr': 21, 'p_adx': 22, 'rsi_period': 28, 'ema1': 7, 'ema2': 52, 'slip_atr_k': 0.04364054050077375, 'slip_spread_k': 0.8288177487044837, 'spread_hl_frac': 0.033798424198653615, 'bb_std_mult': 3.362498415980958, 'rsi_os': 28, 'rsi_ob': 83, 'vol_spike': 0.2240271834984466, 'adx_thresh': 34.9443878944017, 'atr_min_pct': 0.02372255428726959, 'atr_max_pct': 0.041593685896724, 'tp_mult': 2.8524877906780812, 'tsl_mult': 0.450697641104499, 'strategy': 'mean_reversion', 'time_stop': 103, 'use_sma': False, 'use_atr': False, 'use_adx': False, 'use_ema': False, 'use_spike': False, 'rsi_required': False, 'edge_k': 0.41026644730752265, 'edge_cap': 0.902593796631826}.
[I 2025-08-29 22:09:40,326] Trial 268 finished with values: [-1000000000.0, 1000000000.0] and parameters: {'p_sma': 49, 'p_std': 38, 'p_atr': 21, 'p_adx': 26, 'rsi_period': 28, 'ema1': 12, 'ema2': 20, 'slip_atr_k': 0.04301668633097598, 'slip_spread_k': 0.7479076325260874, 'spread_hl_frac': 0.033923961132856166, 'bb_std_mult': 3.3366001551263293, 'rsi_os': 26, 'rsi_ob': 80, 'vol_spike': 0.2216333088429375, 'adx_thresh': 26.28670132259222, 'atr_min_pct': 0.010245580914074731, 'atr_max_pct': 0.04430518009340725, 'tp_mult': 1.5272575543628837, 'tsl_mult': 0.44679344943041654, 'strategy': 'mean_reversion', 'time_stop': 26, 'use_sma': False, 'use_atr': False, 'use_adx': False, 'use_ema': False, 'use_spike': False, 'rsi_required': False, 'edge_k': 0.38794609978253825, 'edge_cap': 0.8908366352107633}.
[I 2025-08-29 22:09:40,629] Trial 269 finished with values: [-1000000000.0, 1000000000.0] and parameters: {'p_sma': 52, 'p_std': 38, 'p_atr': 7, 'p_adx': 22, 'rsi_period': 49, 'ema1': 6, 'ema2': 18, 'slip_atr_k': 0.041879853744587504, 'slip_spread_k': 0.7392204845391895, 'spread_hl_frac': 0.0454062703446246, 'bb_std_mult': 3.468339234336997, 'rsi_os': 26, 'rsi_ob': 80, 'vol_spike': 0.22175273303841064, 'adx_thresh': 34.957041020566436, 'atr_min_pct': 0.0011828445982377982, 'atr_max_pct': 0.1224345288330999, 'tp_mult': 2.8147155405365423, 'tsl_mult': 0.5013313837169188, 'strategy': 'mean_reversion', 'time_stop': 116, 'use_sma': False, 'use_atr': False, 'use_adx': False, 'use_ema': False, 'use_spike': False, 'rsi_required': False, 'edge_k': 1.0163365891859197, 'edge_cap': 0.41232004756608304}.
[I 2025-08-29 22:09:40,737] Trial 267 finished with values: [-1000000000.0, 1000000000.0] and parameters: {'p_sma': 21, 'p_std': 38, 'p_atr': 21, 'p_adx': 22, 'rsi_period': 44, 'ema1': 6, 'ema2': 11, 'slip_atr_k': 0.02253854495961702, 'slip_spread_k': 0.741713926201428, 'spread_hl_frac': 0.00303017294914509, 'bb_std_mult': 2.8814393790397235, 'rsi_os': 28, 'rsi_ob': 76, 'vol_spike': 0.21880486233367383, 'adx_thresh': 13.658749170698497, 'atr_min_pct': 0.023912303047219585, 'atr_max_pct': 0.04301974003230258, 'tp_mult': 2.7643425743899566, 'tsl_mult': 0.23942570295998677, 'strategy': 'mean_reversion', 'time_stop': 13, 'use_sma': False, 'use_atr': False, 'use_adx': False, 'use_ema': False, 'use_spike': False, 'rsi_required': False, 'edge_k': 0.40062844584103613, 'edge_cap': 0.46310872048009183}.
