[I 2025-08-29 22:21:08,138] Trial 378 finished with values: [-0.0027999791075262737, 0.002942871537761693] and parameters: {'p_sma': 48, 'p_std': 34, 'p_atr': 22, 'p_adx': 22, 'rsi_period': 24, 'ema1': 5, 'ema2': 50, 'slip_atr_k': 0.014506741401063825, 'slip_spread_k': 0.0010198342318084586, 'spread_hl_frac': 0.036375024762749446, 'bb_std_mult': 0.7339941850744243, 'rsi_os': 23, 'rsi_ob': 66, 'vol_spike': 0.22629243792858333, 'adx_thresh': 32.550065926614046, 'atr_min_pct': 0.0023557296078406073, 'atr_max_pct': 0.025722698889338723, 'tp_mult': 2.122552350273482, 'tsl_mult': 0.7733755691028842, 'strategy': 'breakout', 'time_stop': 109, 'use_sma': False, 'use_atr': False, 'use_adx': False, 'use_ema': False, 'use_spike': False, 'rsi_required': False, 'edge_k': 1.9042006035916694, 'edge_cap': 0.3906235911795519}.
[I 2025-08-29 22:21:34,751] Trial 382 finished with values: [-1000000000.0, 1000000000.0] and parameters: {'p_sma': 48, 'p_std': 36, 'p_atr': 22, 'p_adx': 22, 'rsi_period': 64, 'ema1': 16, 'ema2': 10, 'slip_atr_k': 0.043588913271125365, 'slip_spread_k': 0.6417255899159486, 'spread_hl_frac': 0.003936324602646195, 'bb_std_mult': 1.0306982673197391, 'rsi_os': 26, 'rsi_ob': 90, 'vol_spike': 0.14496345059786045, 'adx_thresh': 33.64710749838745, 'atr_min_pct': 0.0026482119581952685, 'atr_max_pct': 0.11205694035456401, 'tp_mult': 2.263997266725015, 'tsl_mult': 0.5058678872814296, 'strategy': 'mean_reversion', 'time_stop': 112, 'use_sma': False, 'use_atr': False, 'use_adx': False, 'use_ema': False, 'use_spike': False, 'rsi_required': False, 'edge_k': 1.267793003225051, 'edge_cap': 0.948998016800857}.
[I 2025-08-29 22:21:34,782] Trial 381 finished with values: [-0.005650321390569424, 0.005631283509051028] and parameters: {'p_sma': 47, 'p_std': 35, 'p_atr': 25, 'p_adx': 22, 'rsi_period': 64, 'ema1': 6, 'ema2': 10, 'slip_atr_k': 0.17569713070682186, 'slip_spread_k': 0.7307041865828814, 'spread_hl_frac': 0.003378206948779744, 'bb_std_mult': 0.9348197406578445, 'rsi_os': 36, 'rsi_ob': 79, 'vol_spike': 0.22489065909392467, 'adx_thresh': 33.68782800579122, 'atr_min_pct': 0.0022552245039945667, 'atr_max_pct': 0.048911440216829874, 'tp_mult': 1.6591676534849205, 'tsl_mult': 0.8478193063749586, 'strategy': 'mean_reversion', 'time_stop': 286, 'use_sma': False, 'use_atr': False, 'use_adx': False, 'use_ema': False, 'use_spike': False, 'rsi_required': False, 'edge_k': 0.42731071026187434, 'edge_cap': 0.39275386507509236}.
[I 2025-08-29 22:21:35,072] Trial 379 finished with values: [-0.0025808289718836086, 0.002739042130123101] and parameters: {'p_sma': 48, 'p_std': 34, 'p_atr': 25, 'p_adx': 22, 'rsi_period': 29, 'ema1': 15, 'ema2': 50, 'slip_atr_k': 0.04321664159629683, 'slip_spread_k': 0.7543374291646141, 'spread_hl_frac': 0.035761729395737726, 'bb_std_mult': 2.696150414577153, 'rsi_os': 23, 'rsi_ob': 79, 'vol_spike': 0.21583444199632912, 'adx_thresh': 31.682952860396103, 'atr_min_pct': 0.0008297466913463349, 'atr_max_pct': 0.11184214013106589, 'tp_mult': 2.74915151665871, 'tsl_mult': 0.8908784245693914, 'strategy': 'mean_reversion', 'time_stop': 203, 'use_sma': False, 'use_atr': False, 'use_adx': False, 'use_ema': False, 'use_spike': False, 'rsi_required': False, 'edge_k': 0.7809339131123351, 'edge_cap': 0.13194201339131895}.
[I 2025-08-29 22:21:35,217] Trial 380 finished with values: [-1000000000.0, 1000000000.0] and parameters: {'p_sma': 48, 'p_std': 35, 'p_atr': 20, 'p_adx': 22, 'rsi_period': 63, 'ema1': 6, 'ema2': 56, 'slip_atr_k': 0.0441357844764569, 'slip_spread_k': 0.7342352318897072, 'spread_hl_frac': 0.0362004834761273, 'bb_std_mult': 2.6041295514115634, 'rsi_os': 16, 'rsi_ob': 79, 'vol_spike': 0.22676811602513658, 'adx_thresh': 9.686400319553409, 'atr_min_pct': 0.002713913090817039, 'atr_max_pct': 0.07740118342057174, 'tp_mult': 2.1165920695821066, 'tsl_mult': 0.820442976288428, 'strategy': 'mean_reversion', 'time_stop': 111, 'use_sma': False, 'use_atr': False, 'use_adx': False, 'use_ema': False, 'use_spike': False, 'rsi_required': False, 'edge_k': 1.2313295445904142, 'edge_cap': 0.3985979644399182}.
[I 2025-08-29 22:22:02,563] Trial 383 finished with values: [-1000000000.0, 1000000000.0] and parameters: {'p_sma': 24, 'p_std': 35, 'p_atr': 11, 'p_adx': 20, 'rsi_period': 50, 'ema1': 6, 'ema2': 12, 'slip_atr_k': 0.035320484237024614, 'slip_spread_k': 0.8419579074782758, 'spread_hl_frac': 0.03573276902180723, 'bb_std_mult': 0.5092322454269025, 'rsi_os': 28, 'rsi_ob': 64, 'vol_spike': 0.2262014709510618, 'adx_thresh': 34.971588930359154, 'atr_min_pct': 0.01743086432954505, 'atr_max_pct': 0.11964561276039419, 'tp_mult': 2.7121712184090483, 'tsl_mult': 0.07259660651463828, 'strategy': 'mean_reversion', 'time_stop': 87, 'use_sma': False, 'use_atr': False, 'use_adx': False, 'use_ema': False, 'use_spike': False, 'rsi_required': False, 'edge_k': 0.7745997071383928, 'edge_cap': 0.43533137741254374}.
[I 2025-08-29 22:22:02,706] Trial 384 finished with values: [-1000000000.0, 1000000000.0] and parameters: {'p_sma': 24, 'p_std': 35, 'p_atr': 22, 'p_adx': 26, 'rsi_period': 50, 'ema1': 27, 'ema2': 12, 'slip_atr_k': 0.03595751990646582, 'slip_spread_k': 0.867029320438159, 'spread_hl_frac': 0.03622547127390595, 'bb_std_mult': 0.5044277296348989, 'rsi_os': 20, 'rsi_ob': 65, 'vol_spike': 0.22963871807541303, 'adx_thresh': 34.18544650132828, 'atr_min_pct': 0.015007258972492924, 'atr_max_pct': 0.11994556573641757, 'tp_mult': 2.10856272232605, 'tsl_mult': 0.7810702896466242, 'strategy': 'mean_reversion', 'time_stop': 153, 'use_sma': False, 'use_atr': False, 'use_adx': False, 'use_ema': False, 'use_spike': False, 'rsi_required': False, 'edge_k': 1.0717568192306033, 'edge_cap': 0.4227361449582114}.
[I 2025-08-29 22:22:02,933] Trial 386 finished with values: [-1000000000.0, 1000000000.0] and parameters: {'p_sma': 6, 'p_std': 19, 'p_atr': 23, 'p_adx': 9, 'rsi_period': 26, 'ema1': 21, 'ema2': 30, 'slip_atr_k': 0.03536228455998744, 'slip_spread_k': 0.5965072529386325, 'spread_hl_frac': 0.035283908419926124, 'bb_std_mult': 2.8317340679447187, 'rsi_os': 6, 'rsi_ob': 81, 'vol_spike': 0.16669481914618717, 'adx_thresh': 26.781950948461684, 'atr_min_pct': 0.01738633435740157, 'atr_max_pct': 0.12024449137119639, 'tp_mult': 2.687640730351793, 'tsl_mult': 0.47898894737699693, 'strategy': 'mean_reversion', 'time_stop': 70, 'use_sma': False, 'use_atr': False, 'use_adx': False, 'use_ema': False, 'use_spike': False, 'rsi_required': False, 'edge_k': 1.3139589579012856, 'edge_cap': 0.43647822759821764}.
[I 2025-08-29 22:22:03,012] Trial 385 finished with values: [-1000000000.0, 1000000000.0] and parameters: {'p_sma': 24, 'p_std': 29, 'p_atr': 23, 'p_adx': 20, 'rsi_period': 26, 'ema1': 19, 'ema2': 12, 'slip_atr_k': 0.2262119366839845, 'slip_spread_k': 0.7203843038447809, 'spread_hl_frac': 0.008966514044780351, 'bb_std_mult': 2.798669061883452, 'rsi_os': 6, 'rsi_ob': 77, 'vol_spike': 0.2614376723283185, 'adx_thresh': 26.881260506433108, 'atr_min_pct': 0.01295176005014454, 'atr_max_pct': 0.12071469632898642, 'tp_mult': 2.733609286069403, 'tsl_mult': 0.47832843535250774, 'strategy': 'mean_reversion', 'time_stop': 217, 'use_sma': False, 'use_atr': False, 'use_adx': False, 'use_ema': False, 'use_spike': False, 'rsi_required': False, 'edge_k': 1.9595091628537102, 'edge_cap': 0.3483488847616134}.
[I 2025-08-29 22:22:30,244] Trial 390 finished with values: [-0.009277911014299423, 0.00926984959726012] and parameters: {'p_sma': 46, 'p_std': 32, 'p_atr': 28, 'p_adx': 28, 'rsi_period': 21, 'ema1': 20, 'ema2': 19, 'slip_atr_k': 0.029211632817632324, 'slip_spread_k': 0.5612103059537465, 'spread_hl_frac': 0.03475702940605965, 'bb_std_mult': 2.9236941542504065, 'rsi_os': 26, 'rsi_ob': 72, 'vol_spike': 0.0616255459524848, 'adx_thresh': 20.214683194523673, 'atr_min_pct': 0.0011702092589211377, 'atr_max_pct': 0.13198712920735334, 'tp_mult': 2.7785514396778055, 'tsl_mult': 0.12296075554281843, 'strategy': 'breakout', 'time_stop': 97, 'use_sma': False, 'use_atr': False, 'use_adx': False, 'use_ema': False, 'use_spike': False, 'rsi_required': False, 'edge_k': 0.5286624284725362, 'edge_cap': 0.7478865429200662}.
[I 2025-08-29 22:22:30,267] Trial 389 finished with values: [-0.004354209549066734, 0.00434592452154889] and parameters: {'p_sma': 33, 'p_std': 37, 'p_atr': 27, 'p_adx': 23, 'rsi_period': 25, 'ema1': 17, 'ema2': 48, 'slip_atr_k': 0.02872763224169876, 'slip_spread_k': 0.7091137126249599, 'spread_hl_frac': 0.008975138911953808, 'bb_std_mult': 2.772948651087212, 'rsi_os': 26, 'rsi_ob': 77, 'vol_spike': 0.26133289012893685, 'adx_thresh': 14.815357727623056, 'atr_min_pct': 0.001143627210228704, 'atr_max_pct': 0.12617135880522273, 'tp_mult': 2.7505903242884, 'tsl_mult': 0.8976597603714375, 'strategy': 'breakout', 'time_stop': 98, 'use_sma': False, 'use_atr': False, 'use_adx': False, 'use_ema': False, 'use_spike': False, 'rsi_required': False, 'edge_k': 0.3449359937427754, 'edge_cap': 0.8582244932575835}.
[I 2025-08-29 22:22:30,498] Trial 388 finished with values: [-1000000000.0, 1000000000.0] and parameters: {'p_sma': 6, 'p_std': 44, 'p_atr': 23, 'p_adx': 23, 'rsi_period': 26, 'ema1': 10, 'ema2': 48, 'slip_atr_k': 0.029559042178236142, 'slip_spread_k': 0.5920913942730833, 'spread_hl_frac': 0.0057675322236500695, 'bb_std_mult': 2.845038717985717, 'rsi_os': 26, 'rsi_ob': 77, 'vol_spike': 0.21764534252236942, 'adx_thresh': 31.744803971596088, 'atr_min_pct': 0.0009429381217879478, 'atr_max_pct': 0.13119922122572278, 'tp_mult': 2.746408650564796, 'tsl_mult': 0.6948259118880125, 'strategy': 'mean_reversion', 'time_stop': 220, 'use_sma': False, 'use_atr': False, 'use_adx': False, 'use_ema': False, 'use_spike': False, 'rsi_required': False, 'edge_k': 0.5228908536171466, 'edge_cap': 0.4914230764493429}.
[I 2025-08-29 22:22:30,588] Trial 387 finished with values: [-0.014812697662235808, 0.014802426384281106] and parameters: {'p_sma': 6, 'p_std': 30, 'p_atr': 23, 'p_adx': 10, 'rsi_period': 21, 'ema1': 25, 'ema2': 47, 'slip_atr_k': 0.028322238610841734, 'slip_spread_k': 0.707831857765612, 'spread_hl_frac': 0.037240873826755595, 'bb_std_mult': 2.829430235538521, 'rsi_os': 46, 'rsi_ob': 83, 'vol_spike': 0.2309866387633016, 'adx_thresh': 34.134447971687955, 'atr_min_pct': 0.000825562865316, 'atr_max_pct': 0.130995550839949, 'tp_mult': 2.7917116899664474, 'tsl_mult': 0.476901411837242, 'strategy': 'mean_reversion', 'time_stop': 217, 'use_sma': False, 'use_atr': False, 'use_adx': False, 'use_ema': False, 'use_spike': False, 'rsi_required': False, 'edge_k': 0.5411010378708512, 'edge_cap': 0.7658667333313457}.
[I 2025-08-29 22:22:57,769] Trial 393 finished with values: [-1000000000.0, 1000000000.0] and parameters: {'p_sma': 46, 'p_std': 33, 'p_atr': 17, 'p_adx': 10, 'rsi_period': 58, 'ema1': 6, 'ema2': 22, 'slip_atr_k': 0.040829193008883165, 'slip_spread_k': 0.37968856656319183, 'spread_hl_frac': 0.03199136907511121, 'bb_std_mult': 2.7668317148756443, 'rsi_os': 12, 'rsi_ob': 69, 'vol_spike': 0.24388944612494923, 'adx_thresh': 15.863461060031062, 'atr_min_pct': 0.009592867862232585, 'atr_max_pct': 0.12998793781889248, 'tp_mult': 1.3139687585094877, 'tsl_mult': 0.8775758939113343, 'strategy': 'mean_reversion', 'time_stop': 106, 'use_sma': False, 'use_atr': False, 'use_adx': False, 'use_ema': False, 'use_spike': False, 'rsi_required': False, 'edge_k': 0.2431005788968263, 'edge_cap': 0.4535780179750717}.
[I 2025-08-29 22:22:58,135] Trial 392 finished with values: [-1000000000.0, 1000000000.0] and parameters: {'p_sma': 41, 'p_std': 33, 'p_atr': 17, 'p_adx': 10, 'rsi_period': 66, 'ema1': 25, 'ema2': 53, 'slip_atr_k': 0.040801147832980326, 'slip_spread_k': 0.14554267893534728, 'spread_hl_frac': 0.03723798085645816, 'bb_std_mult': 2.727669443886255, 'rsi_os': 33, 'rsi_ob': 69, 'vol_spike': 0.20589793164288978, 'adx_thresh': 34.14800064998766, 'atr_min_pct': 0.016133102209497985, 'atr_max_pct': 0.06308095448250145, 'tp_mult': 2.438326963829293, 'tsl_mult': 0.6941795590447262, 'strategy': 'mean_reversion', 'time_stop': 105, 'use_sma': False, 'use_atr': False, 'use_adx': False, 'use_ema': False, 'use_spike': False, 'rsi_required': False, 'edge_k': 0.3821903864927303, 'edge_cap': 0.18147142391983756}.
[I 2025-08-29 22:22:58,271] Trial 394 finished with values: [-1000000000.0, 1000000000.0] and parameters: {'p_sma': 45, 'p_std': 33, 'p_atr': 22, 'p_adx': 21, 'rsi_period': 79, 'ema1': 22, 'ema2': 10, 'slip_atr_k': 0.1554369416215887, 'slip_spread_k': 0.7790310031132597, 'spread_hl_frac': 0.034305665351384976, 'bb_std_mult': 2.7544928043208543, 'rsi_os': 49, 'rsi_ob': 80, 'vol_spike': 0.20567733784006106, 'adx_thresh': 33.467122326322674, 'atr_min_pct': 0.004162053531273195, 'atr_max_pct': 0.06291536392696873, 'tp_mult': 2.902892696340414, 'tsl_mult': 0.022963656297869728, 'strategy': 'breakout', 'time_stop': 105, 'use_sma': False, 'use_atr': False, 'use_adx': False, 'use_ema': False, 'use_spike': False, 'rsi_required': False, 'edge_k': 0.3832174589923896, 'edge_cap': 0.4623086060657275}.
[I 2025-08-29 22:22:58,399] Trial 391 finished with values: [-1000000000.0, 1000000000.0] and parameters: {'p_sma': 8, 'p_std': 33, 'p_atr': 17, 'p_adx': 10, 'rsi_period': 34, 'ema1': 25, 'ema2': 53, 'slip_atr_k': 0.2040094182118001, 'slip_spread_k': 0.08567124397914891, 'spread_hl_frac': 0.03719063134926659, 'bb_std_mult': 2.679621387607283, 'rsi_os': 24, 'rsi_ob': 83, 'vol_spike': 0.21819322689659798, 'adx_thresh': 29.561277710539358, 'atr_min_pct': 0.016289278117345856, 'atr_max_pct': 0.08475246602302143, 'tp_mult': 2.8981711973451545, 'tsl_mult': 0.8785870264274316, 'strategy': 'mean_reversion', 'time_stop': 227, 'use_sma': False, 'use_atr': False, 'use_adx': False, 'use_ema': False, 'use_spike': False, 'rsi_required': False, 'edge_k': 0.24767323270287805, 'edge_cap': 0.48419382875086214}.
[I 2025-08-29 22:23:25,733] Trial 398 finished with values: [-1000000000.0, 1000000000.0] and parameters: {'p_sma': 12, 'p_std': 37, 'p_atr': 22, 'p_adx': 22, 'rsi_period': 12, 'ema1': 23, 'ema2': 10, 'slip_atr_k': 0.06516308468334056, 'slip_spread_k': 0.9714687958785215, 'spread_hl_frac': 0.03957759096954551, 'bb_std_mult': 0.9589240604514903, 'rsi_os': 27, 'rsi_ob': 78, 'vol_spike': 0.11301117626759069, 'adx_thresh': 32.8621003286209, 'atr_min_pct': 0.029733119092930548, 'atr_max_pct': 0.10366146371210155, 'tp_mult': 1.9019797827382718, 'tsl_mult': 0.502441792231028, 'strategy': 'breakout', 'time_stop': 88, 'use_sma': False, 'use_atr': False, 'use_adx': False, 'use_ema': False, 'use_spike': False, 'rsi_required': False, 'edge_k': 0.33666696908038446, 'edge_cap': 0.7143336091224823}.
[I 2025-08-29 22:23:25,765] Trial 395 finished with values: [-1000000000.0, 1000000000.0] and parameters: {'p_sma': 41, 'p_std': 12, 'p_atr': 22, 'p_adx': 22, 'rsi_period': 23, 'ema1': 22, 'ema2': 10, 'slip_atr_k': 0.021248081763958385, 'slip_spread_k': 0.08568718652993729, 'spread_hl_frac': 0.03427296897958715, 'bb_std_mult': 2.7186710675461474, 'rsi_os': 48, 'rsi_ob': 92, 'vol_spike': 0.13512069393078283, 'adx_thresh': 33.427981031334234, 'atr_min_pct': 0.01585581152510859, 'atr_max_pct': 0.11607335689661458, 'tp_mult': 1.3759304639843863, 'tsl_mult': 0.5146936012888589, 'strategy': 'breakout', 'time_stop': 91, 'use_sma': False, 'use_atr': False, 'use_adx': False, 'use_ema': False, 'use_spike': False, 'rsi_required': False, 'edge_k': 0.38268235219535324, 'edge_cap': 0.17199945734600153}.
[I 2025-08-29 22:23:25,923] Trial 396 finished with values: [-1000000000.0, 1000000000.0] and parameters: {'p_sma': 52, 'p_std': 22, 'p_atr': 22, 'p_adx': 21, 'rsi_period': 79, 'ema1': 23, 'ema2': 10, 'slip_atr_k': 0.1547885917189168, 'slip_spread_k': 0.9790186208853873, 'spread_hl_frac': 0.0400629362904644, 'bb_std_mult': 2.9187670207004253, 'rsi_os': 24, 'rsi_ob': 80, 'vol_spike': 0.11524515683618014, 'adx_thresh': 32.94456698612193, 'atr_min_pct': 0.00312156972115893, 'atr_max_pct': 0.12488712324465237, 'tp_mult': 2.938092168893839, 'tsl_mult': 0.5422708892854117, 'strategy': 'breakout', 'time_stop': 51, 'use_sma': False, 'use_atr': False, 'use_adx': False, 'use_ema': False, 'use_spike': False, 'rsi_required': False, 'edge_k': 0.32363087031811016, 'edge_cap': 0.5107387879526252}.
[I 2025-08-29 22:23:26,011] Trial 397 finished with values: [-1000000000.0, 1000000000.0] and parameters: {'p_sma': 54, 'p_std': 37, 'p_atr': 21, 'p_adx': 25, 'rsi_period': 29, 'ema1': 8, 'ema2': 34, 'slip_atr_k': 0.1326865873762596, 'slip_spread_k': 0.18469796920608, 'spread_hl_frac': 0.03943840472490744, 'bb_std_mult': 2.841056363261837, 'rsi_os': 24, 'rsi_ob': 78, 'vol_spike': 0.13792587893853359, 'adx_thresh': 32.826716986831336, 'atr_min_pct': 0.0032864998941887218, 'atr_max_pct': 0.10055163403672955, 'tp_mult': 2.876799776945951, 'tsl_mult': 0.5055531690382465, 'strategy': 'breakout', 'time_stop': 233, 'use_sma': False, 'use_atr': False, 'use_adx': False, 'use_ema': False, 'use_spike': False, 'rsi_required': False, 'edge_k': 0.3317389953253797, 'edge_cap': 0.9954093326951103}.
[I 2025-08-29 22:23:26,209] Trial 400 finished with values: [-1000000000.0, 1000000000.0] and parameters: {'p_sma': 48, 'p_std': 36, 'p_atr': 21, 'p_adx': 23, 'rsi_period': 30, 'ema1': 8, 'ema2': 28, 'slip_atr_k': 0.13452500874580323, 'slip_spread_k': 0.1827101711934036, 'spread_hl_frac': 0.03580907167537567, 'bb_std_mult': 2.8431589516284785, 'rsi_os': 52, 'rsi_ob': 76, 'vol_spike': 0.07630823796505869, 'adx_thresh': 21.45931706045506, 'atr_min_pct': 0.0034342093548919536, 'atr_max_pct': 0.12467801196861554, 'tp_mult': 2.5668951429158957, 'tsl_mult': 0.45160185915964113, 'strategy': 'mean_reversion', 'time_stop': 178, 'use_sma': False, 'use_atr': False, 'use_adx': False, 'use_ema': False, 'use_spike': False, 'rsi_required': False, 'edge_k': 0.4573521819639047, 'edge_cap': 0.5199594691024954}.
[I 2025-08-29 22:23:53,139] Trial 403 finished with values: [-1000000000.0, 1000000000.0] and parameters: {'p_sma': 46, 'p_std': 24, 'p_atr': 10, 'p_adx': 16, 'rsi_period': 23, 'ema1': 5, 'ema2': 11, 'slip_atr_k': 0.04607745111149044, 'slip_spread_k': 0.8022493641778677, 'spread_hl_frac': 0.03502134363003886, 'bb_std_mult': 2.919982191959429, 'rsi_os': 27, 'rsi_ob': 73, 'vol_spike': 0.12559295850924235, 'adx_thresh': 14.010588768281542, 'atr_min_pct': 0.010255692073307543, 'atr_max_pct': 0.06004545547033177, 'tp_mult': 1.7885802031640377, 'tsl_mult': 0.6102969828358638, 'strategy': 'mean_reversion', 'time_stop': 118, 'use_sma': False, 'use_atr': False, 'use_adx': False, 'use_ema': False, 'use_spike': False, 'rsi_required': False, 'edge_k': 0.11991935782017982, 'edge_cap': 0.49779385989375574}.
[I 2025-08-29 22:23:53,465] Trial 401 finished with values: [-0.004347083846822142, 0.004508464191585456] and parameters: {'p_sma': 48, 'p_std': 15, 'p_atr': 21, 'p_adx': 25, 'rsi_period': 29, 'ema1': 8, 'ema2': 37, 'slip_atr_k': 0.13463818885529819, 'slip_spread_k': 0.42622201773180757, 'spread_hl_frac': 0.041979112075580936, 'bb_std_mult': 2.876493752661419, 'rsi_os': 28, 'rsi_ob': 76, 'vol_spike': 0.27008778925517474, 'adx_thresh': 34.47991320158635, 'atr_min_pct': 0.0018761250345427597, 'atr_max_pct': 0.1489609067771595, 'tp_mult': 2.5738465452895287, 'tsl_mult': 0.4566024012655325, 'strategy': 'mean_reversion', 'time_stop': 122, 'use_sma': False, 'use_atr': False, 'use_adx': False, 'use_ema': False, 'use_spike': False, 'rsi_required': False, 'edge_k': 0.4446352030352171, 'edge_cap': 0.6205683677421928}.
[I 2025-08-29 22:23:53,704] Trial 399 finished with values: [-0.00041464478874186916, 0.0007519752456756527] and parameters: {'p_sma': 48, 'p_std': 36, 'p_atr': 10, 'p_adx': 23, 'rsi_period': 29, 'ema1': 8, 'ema2': 11, 'slip_atr_k': 0.0032559302906668697, 'slip_spread_k': 0.7723017412576533, 'spread_hl_frac': 0.013053837352131078, 'bb_std_mult': 2.8877385391505426, 'rsi_os': 28, 'rsi_ob': 76, 'vol_spike': 0.2697528818160365, 'adx_thresh': 21.41409948782663, 'atr_min_pct': 0.0035280964937069795, 'atr_max_pct': 0.12535858479310216, 'tp_mult': 1.7736763459985807, 'tsl_mult': 0.5499489235514732, 'strategy': 'mean_reversion', 'time_stop': 185, 'use_sma': False, 'use_atr': False, 'use_adx': False, 'use_ema': False, 'use_spike': False, 'rsi_required': False, 'edge_k': 0.4208044507303085, 'edge_cap': 0.5159088851951077}.
[I 2025-08-29 22:23:53,716] Trial 402 finished with values: [-0.007801216929944177, 0.007853946173908888] and parameters: {'p_sma': 48, 'p_std': 15, 'p_atr': 10, 'p_adx': 29, 'rsi_period': 24, 'ema1': 28, 'ema2': 11, 'slip_atr_k': 0.04788262393073721, 'slip_spread_k': 0.8096853321162589, 'spread_hl_frac': 0.03523418873349671, 'bb_std_mult': 2.964281877411649, 'rsi_os': 27, 'rsi_ob': 75, 'vol_spike': 0.09708892092924998, 'adx_thresh': 13.701756042289649, 'atr_min_pct': 0.001830690459069501, 'atr_max_pct': 0.12685917236416586, 'tp_mult': 1.691060175079894, 'tsl_mult': 0.4551310399330114, 'strategy': 'mean_reversion', 'time_stop': 178, 'use_sma': False, 'use_atr': False, 'use_adx': False, 'use_ema': False, 'use_spike': False, 'rsi_required': False, 'edge_k': 0.4316641177028251, 'edge_cap': 0.6253575846665953}.
[I 2025-08-29 22:24:20,902] Trial 406 finished with values: [-1000000000.0, 1000000000.0] and parameters: {'p_sma': 51, 'p_std': 43, 'p_atr': 10, 'p_adx': 24, 'rsi_period': 32, 'ema1': 9, 'ema2': 13, 'slip_atr_k': 0.004339828810889238, 'slip_spread_k': 0.8128927114998602, 'spread_hl_frac': 0.01366993443556611, 'bb_std_mult': 2.9891750886537007, 'rsi_os': 30, 'rsi_ob': 75, 'vol_spike': 0.2796850330493718, 'adx_thresh': 25.094080737109003, 'atr_min_pct': 0.005976290229974932, 'atr_max_pct': 0.11611819426503923, 'tp_mult': 1.776934318388383, 'tsl_mult': 0.5754994625552963, 'strategy': 'mean_reversion', 'time_stop': 186, 'use_sma': False, 'use_atr': False, 'use_adx': False, 'use_ema': False, 'use_spike': False, 'rsi_required': False, 'edge_k': 0.4387812275176889, 'edge_cap': 0.5532674224055921}.
