[I 2025-08-29 23:34:36,064] Trial 1079 finished with values: [-1000000000.0, 1000000000.0] and parameters: {'p_sma': 29, 'p_std': 10, 'p_atr': 14, 'p_adx': 29, 'rsi_period': 16, 'ema1': 29, 'ema2': 21, 'slip_atr_k': 0.004823491750103541, 'slip_spread_k': 0.2696729125569509, 'spread_hl_frac': 0.011820728746648542, 'bb_std_mult': 1.2822410842311927, 'rsi_os': 42, 'rsi_ob': 59, 'vol_spike': 0.022018215580882877, 'adx_thresh': 21.1930680621509, 'atr_min_pct': 0.006871156673925081, 'atr_max_pct': 0.07137019788589569, 'tp_mult': 1.8114387229686013, 'tsl_mult': 0.6302886089798612, 'strategy': 'mean_reversion', 'time_stop': 54, 'use_sma': False, 'use_atr': False, 'use_adx': False, 'use_ema': False, 'use_spike': False, 'rsi_required': False, 'edge_k': 1.9324940423118175, 'edge_cap': 0.1740230033487272}.
[I 2025-08-29 23:35:04,152] Trial 1082 finished with values: [-1000000000.0, 1000000000.0] and parameters: {'p_sma': 29, 'p_std': 13, 'p_atr': 11, 'p_adx': 14, 'rsi_period': 58, 'ema1': 23, 'ema2': 37, 'slip_atr_k': 1.2224735234279299e-06, 'slip_spread_k': 0.2678008989345748, 'spread_hl_frac': 0.01196865463206619, 'bb_std_mult': 0.5874267617764366, 'rsi_os': 33, 'rsi_ob': 67, 'vol_spike': 0.2189200829977373, 'adx_thresh': 21.182371765471487, 'atr_min_pct': 0.01858730191706872, 'atr_max_pct': 0.07374871624140003, 'tp_mult': 2.5682494323262395, 'tsl_mult': 0.6064631987682491, 'strategy': 'breakout', 'time_stop': 183, 'use_sma': False, 'use_atr': False, 'use_adx': False, 'use_ema': False, 'use_spike': False, 'rsi_required': False, 'edge_k': 1.9406049284464024, 'edge_cap': 0.201900736092181}.
[I 2025-08-29 23:35:04,484] Trial 1083 finished with values: [-1000000000.0, 1000000000.0] and parameters: {'p_sma': 29, 'p_std': 13, 'p_atr': 11, 'p_adx': 14, 'rsi_period': 16, 'ema1': 23, 'ema2': 23, 'slip_atr_k': 0.15208712853501039, 'slip_spread_k': 0.27086210060241106, 'spread_hl_frac': 0.012045597097912178, 'bb_std_mult': 2.0090761145628715, 'rsi_os': 55, 'rsi_ob': 63, 'vol_spike': 0.24153115408978498, 'adx_thresh': 16.996896831080143, 'atr_min_pct': 0.01871276732060616, 'atr_max_pct': 0.07684157099420827, 'tp_mult': 2.060788332793796, 'tsl_mult': 0.6065256926305459, 'strategy': 'breakout', 'time_stop': 50, 'use_sma': False, 'use_atr': False, 'use_adx': False, 'use_ema': False, 'use_spike': False, 'rsi_required': False, 'edge_k': 1.9417266744157706, 'edge_cap': 0.19503068730153153}.
[I 2025-08-29 23:35:04,735] Trial 1084 finished with values: [-1000000000.0, 1000000000.0] and parameters: {'p_sma': 11, 'p_std': 13, 'p_atr': 11, 'p_adx': 14, 'rsi_period': 8, 'ema1': 23, 'ema2': 35, 'slip_atr_k': 0.01658549316087244, 'slip_spread_k': 0.2461029628982512, 'spread_hl_frac': 0.0101615357415338, 'bb_std_mult': 2.25309099126943, 'rsi_os': 36, 'rsi_ob': 80, 'vol_spike': 0.2184780520825353, 'adx_thresh': 20.216174896884244, 'atr_min_pct': 0.018805804749101183, 'atr_max_pct': 0.024743787682049254, 'tp_mult': 1.9329702836029072, 'tsl_mult': 0.6058156518601122, 'strategy': 'breakout', 'time_stop': 25, 'use_sma': False, 'use_atr': False, 'use_adx': False, 'use_ema': False, 'use_spike': False, 'rsi_required': False, 'edge_k': 1.9496472479545965, 'edge_cap': 0.20099921129910137}.
[I 2025-08-29 23:35:04,918] Trial 1081 finished with values: [-1000000000.0, 1000000000.0] and parameters: {'p_sma': 29, 'p_std': 27, 'p_atr': 11, 'p_adx': 14, 'rsi_period': 16, 'ema1': 23, 'ema2': 21, 'slip_atr_k': 1.972219422431194e-05, 'slip_spread_k': 0.2679145879433903, 'spread_hl_frac': 0.01187266278845291, 'bb_std_mult': 2.0131662099917182, 'rsi_os': 15, 'rsi_ob': 63, 'vol_spike': 0.2593662302028467, 'adx_thresh': 5.018548925760118, 'atr_min_pct': 0.006672911417344829, 'atr_max_pct': 0.07742865682798256, 'tp_mult': 1.2108787926351103, 'tsl_mult': 0.6097129828018203, 'strategy': 'mean_reversion', 'time_stop': 278, 'use_sma': False, 'use_atr': False, 'use_adx': False, 'use_ema': False, 'use_spike': False, 'rsi_required': False, 'edge_k': 1.9339393329457348, 'edge_cap': 0.1643331228101068}.
[I 2025-08-29 23:35:32,764] Trial 1085 finished with values: [-1000000000.0, 1000000000.0] and parameters: {'p_sma': 27, 'p_std': 40, 'p_atr': 12, 'p_adx': 12, 'rsi_period': 8, 'ema1': 12, 'ema2': 23, 'slip_atr_k': 0.19638602113516865, 'slip_spread_k': 0.24641685664615876, 'spread_hl_frac': 0.047749373063575594, 'bb_std_mult': 3.393217657472193, 'rsi_os': 33, 'rsi_ob': 80, 'vol_spike': 0.26035189507755296, 'adx_thresh': 13.411630009365522, 'atr_min_pct': 0.02437154024245094, 'atr_max_pct': 0.0764914014903906, 'tp_mult': 2.068561870577332, 'tsl_mult': 0.5611697325329115, 'strategy': 'mean_reversion', 'time_stop': 257, 'use_sma': False, 'use_atr': False, 'use_adx': False, 'use_ema': False, 'use_spike': False, 'rsi_required': False, 'edge_k': 1.9552353340099389, 'edge_cap': 0.23027143345428483}.
[I 2025-08-29 23:35:33,045] Trial 1088 finished with values: [-1000000000.0, 1000000000.0] and parameters: {'p_sma': 27, 'p_std': 15, 'p_atr': 12, 'p_adx': 13, 'rsi_period': 10, 'ema1': 12, 'ema2': 23, 'slip_atr_k': 0.1832478217793074, 'slip_spread_k': 0.329127357371426, 'spread_hl_frac': 0.014218298400050499, 'bb_std_mult': 1.2156146805517165, 'rsi_os': 35, 'rsi_ob': 61, 'vol_spike': 0.233002414258839, 'adx_thresh': 20.110207403452108, 'atr_min_pct': 0.024058402233282074, 'atr_max_pct': 0.10484985662462548, 'tp_mult': 1.4653276560242978, 'tsl_mult': 0.5632195970976052, 'strategy': 'mean_reversion', 'time_stop': 88, 'use_sma': False, 'use_atr': False, 'use_adx': False, 'use_ema': False, 'use_spike': False, 'rsi_required': False, 'edge_k': 0.9181146818490757, 'edge_cap': 0.23000857518412945}.
[I 2025-08-29 23:35:33,317] Trial 1087 finished with values: [-1000000000.0, 1000000000.0] and parameters: {'p_sma': 28, 'p_std': 45, 'p_atr': 12, 'p_adx': 9, 'rsi_period': 48, 'ema1': 29, 'ema2': 23, 'slip_atr_k': 0.12482631635572762, 'slip_spread_k': 0.9321810297462234, 'spread_hl_frac': 0.03238106983802338, 'bb_std_mult': 1.1956347218877776, 'rsi_os': 15, 'rsi_ob': 61, 'vol_spike': 0.26141881482495416, 'adx_thresh': 15.812006655488133, 'atr_min_pct': 0.024098009258213555, 'atr_max_pct': 0.06796434961678767, 'tp_mult': 1.861776646542753, 'tsl_mult': 0.5634100862637259, 'strategy': 'mean_reversion', 'time_stop': 276, 'use_sma': False, 'use_atr': False, 'use_adx': False, 'use_ema': False, 'use_spike': False, 'rsi_required': False, 'edge_k': 1.905590633668898, 'edge_cap': 0.8592304631681653}.
[I 2025-08-29 23:35:33,505] Trial 1086 finished with values: [-1000000000.0, 1000000000.0] and parameters: {'p_sma': 60, 'p_std': 40, 'p_atr': 12, 'p_adx': 9, 'rsi_period': 7, 'ema1': 19, 'ema2': 23, 'slip_atr_k': 0.12529598936481867, 'slip_spread_k': 0.32712212167254817, 'spread_hl_frac': 0.004139310684097928, 'bb_std_mult': 1.1946912812349177, 'rsi_os': 35, 'rsi_ob': 80, 'vol_spike': 0.2606357263743205, 'adx_thresh': 20.214222518341664, 'atr_min_pct': 0.02430752332256064, 'atr_max_pct': 0.06707359889889752, 'tp_mult': 1.228794808793884, 'tsl_mult': 0.6821024880356625, 'strategy': 'mean_reversion', 'time_stop': 23, 'use_sma': False, 'use_atr': False, 'use_adx': False, 'use_ema': False, 'use_spike': False, 'rsi_required': False, 'edge_k': 0.9197631793588342, 'edge_cap': 0.9016624923417913}.
[I 2025-08-29 23:36:01,286] Trial 1090 finished with values: [-1000000000.0, 1000000000.0] and parameters: {'p_sma': 34, 'p_std': 11, 'p_atr': 12, 'p_adx': 25, 'rsi_period': 12, 'ema1': 29, 'ema2': 53, 'slip_atr_k': 0.1445950837813262, 'slip_spread_k': 0.2863960392587398, 'spread_hl_frac': 0.010566347202297635, 'bb_std_mult': 1.341869255588009, 'rsi_os': 34, 'rsi_ob': 83, 'vol_spike': 0.28393952174807063, 'adx_thresh': 24.748351373606415, 'atr_min_pct': 0.005167581622973379, 'atr_max_pct': 0.06702055361703532, 'tp_mult': 1.3406834412940274, 'tsl_mult': 0.7972935022292076, 'strategy': 'mean_reversion', 'time_stop': 246, 'use_sma': False, 'use_atr': False, 'use_adx': False, 'use_ema': False, 'use_spike': False, 'rsi_required': False, 'edge_k': 1.5262042608421469, 'edge_cap': 0.15479639390484745}.
[I 2025-08-29 23:36:01,797] Trial 1089 finished with values: [-1000000000.0, 1000000000.0] and parameters: {'p_sma': 60, 'p_std': 11, 'p_atr': 12, 'p_adx': 13, 'rsi_period': 80, 'ema1': 30, 'ema2': 51, 'slip_atr_k': 0.009616559831422147, 'slip_spread_k': 0.3292866084700808, 'spread_hl_frac': 0.014389356204204019, 'bb_std_mult': 1.177506609733623, 'rsi_os': 35, 'rsi_ob': 61, 'vol_spike': 0.24530063568497973, 'adx_thresh': 22.780831429767552, 'atr_min_pct': 0.01227671778163738, 'atr_max_pct': 0.06818737754747989, 'tp_mult': 1.3291273554894256, 'tsl_mult': 0.6809844282892982, 'strategy': 'mean_reversion', 'time_stop': 171, 'use_sma': False, 'use_atr': False, 'use_adx': False, 'use_ema': False, 'use_spike': False, 'rsi_required': False, 'edge_k': 0.5867229719099523, 'edge_cap': 0.8654438265233537}.
[I 2025-08-29 23:36:01,998] Trial 1091 finished with values: [-1000000000.0, 1000000000.0] and parameters: {'p_sma': 32, 'p_std': 11, 'p_atr': 17, 'p_adx': 13, 'rsi_period': 12, 'ema1': 19, 'ema2': 51, 'slip_atr_k': 0.009387830145812254, 'slip_spread_k': 0.12201676966655794, 'spread_hl_frac': 0.04268621362789882, 'bb_std_mult': 1.6287633596350102, 'rsi_os': 34, 'rsi_ob': 63, 'vol_spike': 0.245162735252494, 'adx_thresh': 22.170107352723143, 'atr_min_pct': 0.0053175937560418236, 'atr_max_pct': 0.04788972487686881, 'tp_mult': 1.9653167483911427, 'tsl_mult': 0.6783455272420987, 'strategy': 'mean_reversion', 'time_stop': 292, 'use_sma': False, 'use_atr': False, 'use_adx': False, 'use_ema': False, 'use_spike': False, 'rsi_required': False, 'edge_k': 1.50222397318517, 'edge_cap': 0.1205296824699465}.
[I 2025-08-29 23:36:02,066] Trial 1092 finished with values: [-1000000000.0, 1000000000.0] and parameters: {'p_sma': 34, 'p_std': 11, 'p_atr': 13, 'p_adx': 13, 'rsi_period': 12, 'ema1': 18, 'ema2': 20, 'slip_atr_k': 0.2095097994416365, 'slip_spread_k': 0.30741878723754507, 'spread_hl_frac': 0.02750932688946798, 'bb_std_mult': 1.3309352424965768, 'rsi_os': 34, 'rsi_ob': 56, 'vol_spike': 0.06724065231734573, 'adx_thresh': 29.951431216793118, 'atr_min_pct': 0.005331178947479964, 'atr_max_pct': 0.07118848248247026, 'tp_mult': 1.3654475137690176, 'tsl_mult': 0.3103023667022831, 'strategy': 'mean_reversion', 'time_stop': 265, 'use_sma': False, 'use_atr': False, 'use_adx': False, 'use_ema': False, 'use_spike': False, 'rsi_required': False, 'edge_k': 1.781665645553116, 'edge_cap': 0.8254985118046375}.
[I 2025-08-29 23:36:29,176] Trial 1093 finished with values: [-1000000000.0, 1000000000.0] and parameters: {'p_sma': 32, 'p_std': 11, 'p_atr': 13, 'p_adx': 13, 'rsi_period': 11, 'ema1': 18, 'ema2': 20, 'slip_atr_k': 0.009842588963799165, 'slip_spread_k': 0.29988851028409697, 'spread_hl_frac': 0.028049066253748235, 'bb_std_mult': 1.4128696363755928, 'rsi_os': 32, 'rsi_ob': 62, 'vol_spike': 0.05492578421271645, 'adx_thresh': 22.256123188683297, 'atr_min_pct': 0.015525642661947675, 'atr_max_pct': 0.11678551358662631, 'tp_mult': 1.9712848485383072, 'tsl_mult': 0.35881049031029544, 'strategy': 'breakout', 'time_stop': 265, 'use_sma': False, 'use_atr': False, 'use_adx': False, 'use_ema': False, 'use_spike': False, 'rsi_required': False, 'edge_k': 1.899186873521066, 'edge_cap': 0.052103007801723666}.
[I 2025-08-29 23:36:30,022] Trial 1094 finished with values: [-1000000000.0, 1000000000.0] and parameters: {'p_sma': 32, 'p_std': 8, 'p_atr': 13, 'p_adx': 12, 'rsi_period': 14, 'ema1': 27, 'ema2': 20, 'slip_atr_k': 0.24549772650568844, 'slip_spread_k': 0.3051999573383431, 'spread_hl_frac': 0.009574498518236215, 'bb_std_mult': 1.4032940507115133, 'rsi_os': 33, 'rsi_ob': 46, 'vol_spike': 0.2538675639059225, 'adx_thresh': 21.073719081209365, 'atr_min_pct': 0.0159374684693608, 'atr_max_pct': 0.07206950540882917, 'tp_mult': 1.967553841649679, 'tsl_mult': 0.6468835702509557, 'strategy': 'breakout', 'time_stop': 157, 'use_sma': False, 'use_atr': False, 'use_adx': False, 'use_ema': False, 'use_spike': False, 'rsi_required': False, 'edge_k': 1.7865258847352115, 'edge_cap': 0.1856071682466275}.
[I 2025-08-29 23:36:30,119] Trial 1095 finished with values: [-1000000000.0, 1000000000.0] and parameters: {'p_sma': 30, 'p_std': 12, 'p_atr': 13, 'p_adx': 12, 'rsi_period': 14, 'ema1': 17, 'ema2': 20, 'slip_atr_k': 0.23633538834199752, 'slip_spread_k': 0.2974626084448616, 'spread_hl_frac': 0.01007219287311951, 'bb_std_mult': 1.4348154349357416, 'rsi_os': 46, 'rsi_ob': 62, 'vol_spike': 0.2777364709805319, 'adx_thresh': 21.10342835929661, 'atr_min_pct': 0.01491836381499515, 'atr_max_pct': 0.07185267877574082, 'tp_mult': 1.9229695907876705, 'tsl_mult': 0.649213475623091, 'strategy': 'breakout', 'time_stop': 36, 'use_sma': False, 'use_atr': False, 'use_adx': False, 'use_ema': False, 'use_spike': False, 'rsi_required': False, 'edge_k': 1.7937525290398901, 'edge_cap': 0.8305004745921662}.
[I 2025-08-29 23:36:30,240] Trial 1096 finished with values: [-1000000000.0, 1000000000.0] and parameters: {'p_sma': 30, 'p_std': 8, 'p_atr': 28, 'p_adx': 12, 'rsi_period': 10, 'ema1': 17, 'ema2': 21, 'slip_atr_k': 0.2447735860249211, 'slip_spread_k': 0.29554949587285606, 'spread_hl_frac': 0.020081178131404254, 'bb_std_mult': 1.4147085927826097, 'rsi_os': 19, 'rsi_ob': 62, 'vol_spike': 0.1259091997494179, 'adx_thresh': 21.110037916746073, 'atr_min_pct': 0.014618049259486109, 'atr_max_pct': 0.019816190105859055, 'tp_mult': 1.9272738355761736, 'tsl_mult': 0.5888948527098509, 'strategy': 'breakout', 'time_stop': 294, 'use_sma': False, 'use_atr': False, 'use_adx': False, 'use_ema': False, 'use_spike': False, 'rsi_required': False, 'edge_k': 0.2505543203037527, 'edge_cap': 0.18951098500069602}.
[I 2025-08-29 23:36:30,542] Trial 1098 finished with values: [-1000000000.0, 1000000000.0] and parameters: {'p_sma': 26, 'p_std': 13, 'p_atr': 21, 'p_adx': 12, 'rsi_period': 11, 'ema1': 30, 'ema2': 22, 'slip_atr_k': 0.16953660713110094, 'slip_spread_k': 0.0452579379838185, 'spread_hl_frac': 0.018420863410015344, 'bb_std_mult': 3.52909245638472, 'rsi_os': 50, 'rsi_ob': 60, 'vol_spike': 0.07872900146199774, 'adx_thresh': 21.483442403010333, 'atr_min_pct': 0.0013423290778025836, 'atr_max_pct': 0.019843394342715474, 'tp_mult': 1.8829311232621297, 'tsl_mult': 0.5936939556996068, 'strategy': 'mean_reversion', 'time_stop': 189, 'use_sma': False, 'use_atr': False, 'use_adx': False, 'use_ema': False, 'use_spike': False, 'rsi_required': False, 'edge_k': 1.9995344037107656, 'edge_cap': 0.20460612252317084}.
[I 2025-08-29 23:36:58,147] Trial 1097 finished with values: [-1000000000.0, 1000000000.0] and parameters: {'p_sma': 25, 'p_std': 47, 'p_atr': 23, 'p_adx': 12, 'rsi_period': 14, 'ema1': 30, 'ema2': 21, 'slip_atr_k': 0.003856503310738893, 'slip_spread_k': 0.23223246578958073, 'spread_hl_frac': 0.018286071297196643, 'bb_std_mult': 1.4836083945250014, 'rsi_os': 32, 'rsi_ob': 64, 'vol_spike': 0.2540163377266533, 'adx_thresh': 21.061526385057498, 'atr_min_pct': 0.007301727956849845, 'atr_max_pct': 0.07372605645417679, 'tp_mult': 1.921376969323367, 'tsl_mult': 0.6458572177298, 'strategy': 'breakout', 'time_stop': 159, 'use_sma': False, 'use_atr': False, 'use_adx': False, 'use_ema': False, 'use_spike': False, 'rsi_required': False, 'edge_k': 1.9992641502122834, 'edge_cap': 0.7359871654901448}.
[I 2025-08-29 23:36:58,159] Trial 1099 finished with values: [-1000000000.0, 1000000000.0] and parameters: {'p_sma': 13, 'p_std': 55, 'p_atr': 27, 'p_adx': 13, 'rsi_period': 72, 'ema1': 10, 'ema2': 22, 'slip_atr_k': 0.005725955344730749, 'slip_spread_k': 0.22931303215864257, 'spread_hl_frac': 0.010853759756966863, 'bb_std_mult': 1.3398219696644913, 'rsi_os': 48, 'rsi_ob': 51, 'vol_spike': 0.12614725566695503, 'adx_thresh': 21.68934689866952, 'atr_min_pct': 0.02193950328581931, 'atr_max_pct': 0.07469152080017251, 'tp_mult': 1.8850427593355663, 'tsl_mult': 0.023489352940988195, 'strategy': 'mean_reversion', 'time_stop': 228, 'use_sma': False, 'use_atr': False, 'use_adx': False, 'use_ema': False, 'use_spike': False, 'rsi_required': False, 'edge_k': 1.8513943461827962, 'edge_cap': 0.7214496538264445}.
[I 2025-08-29 23:36:58,250] Trial 1100 finished with values: [-1000000000.0, 1000000000.0] and parameters: {'p_sma': 25, 'p_std': 22, 'p_atr': 16, 'p_adx': 29, 'rsi_period': 60, 'ema1': 30, 'ema2': 22, 'slip_atr_k': 0.0050425257197614995, 'slip_spread_k': 0.2368029207941292, 'spread_hl_frac': 0.010658205545720133, 'bb_std_mult': 1.512894919841246, 'rsi_os': 9, 'rsi_ob': 64, 'vol_spike': 0.07827050164539003, 'adx_thresh': 21.772310910427944, 'atr_min_pct': 0.027056802988723243, 'atr_max_pct': 0.0744768147938575, 'tp_mult': 1.8490209924826895, 'tsl_mult': 0.18342306149597404, 'strategy': 'mean_reversion', 'time_stop': 288, 'use_sma': False, 'use_atr': False, 'use_adx': False, 'use_ema': False, 'use_spike': False, 'rsi_required': False, 'edge_k': 1.8392214741166433, 'edge_cap': 0.4384156751264326}.
[I 2025-08-29 23:36:58,591] Trial 1101 finished with values: [-1000000000.0, 1000000000.0] and parameters: {'p_sma': 28, 'p_std': 32, 'p_atr': 10, 'p_adx': 28, 'rsi_period': 9, 'ema1': 30, 'ema2': 19, 'slip_atr_k': 0.0044042396707058935, 'slip_spread_k': 0.3536355130174407, 'spread_hl_frac': 0.024139364323628922, 'bb_std_mult': 1.5173224015679032, 'rsi_os': 10, 'rsi_ob': 64, 'vol_spike': 0.23437677007882282, 'adx_thresh': 7.408666862304088, 'atr_min_pct': 0.027172236356379234, 'atr_max_pct': 0.03571106980460251, 'tp_mult': 1.839246319527445, 'tsl_mult': 0.6213248590696323, 'strategy': 'mean_reversion', 'time_stop': 279, 'use_sma': False, 'use_atr': False, 'use_adx': False, 'use_ema': False, 'use_spike': False, 'rsi_required': False, 'edge_k': 1.8484215839084601, 'edge_cap': 0.9479773367042076}.
[I 2025-08-29 23:37:25,969] Trial 1102 finished with values: [-1000000000.0, 1000000000.0] and parameters: {'p_sma': 28, 'p_std': 16, 'p_atr': 10, 'p_adx': 27, 'rsi_period': 63, 'ema1': 11, 'ema2': 19, 'slip_atr_k': 0.11149032785908665, 'slip_spread_k': 0.281831143595445, 'spread_hl_frac': 0.01348970844460494, 'bb_std_mult': 1.3367216829262694, 'rsi_os': 23, 'rsi_ob': 60, 'vol_spike': 0.23638440366030183, 'adx_thresh': 20.20138548152384, 'atr_min_pct': 0.027090146107075688, 'atr_max_pct': 0.0696612722131983, 'tp_mult': 2.031153190265948, 'tsl_mult': 0.7329754450211945, 'strategy': 'mean_reversion', 'time_stop': 279, 'use_sma': False, 'use_atr': False, 'use_adx': False, 'use_ema': False, 'use_spike': False, 'rsi_required': False, 'edge_k': 1.961922386556649, 'edge_cap': 0.15921350318509103}.
[I 2025-08-29 23:37:26,219] Trial 1103 finished with values: [-1000000000.0, 1000000000.0] and parameters: {'p_sma': 11, 'p_std': 60, 'p_atr': 10, 'p_adx': 13, 'rsi_period': 9, 'ema1': 29, 'ema2': 19, 'slip_atr_k': 0.016244501011229782, 'slip_spread_k': 0.2809899098860113, 'spread_hl_frac': 0.013349457024010393, 'bb_std_mult': 1.2989088810360416, 'rsi_os': 31, 'rsi_ob': 60, 'vol_spike': 0.038174861378319686, 'adx_thresh': 27.947859896253853, 'atr_min_pct': 0.009749081389601323, 'atr_max_pct': 0.0687161982812737, 'tp_mult': 1.2663275503983313, 'tsl_mult': 0.7712005839747246, 'strategy': 'mean_reversion', 'time_stop': 278, 'use_sma': False, 'use_atr': False, 'use_adx': False, 'use_ema': False, 'use_spike': False, 'rsi_required': False, 'edge_k': 1.9608410424668317, 'edge_cap': 0.15470419650182793}.
[I 2025-08-29 23:37:26,262] Trial 1105 finished with values: [-1000000000.0, 1000000000.0] and parameters: {'p_sma': 5, 'p_std': 16, 'p_atr': 26, 'p_adx': 17, 'rsi_period': 9, 'ema1': 16, 'ema2': 58, 'slip_atr_k': 0.111798853327064, 'slip_spread_k': 0.2548486859100875, 'spread_hl_frac': 0.013258192443582137, 'bb_std_mult': 1.2566483449966939, 'rsi_os': 33, 'rsi_ob': 88, 'vol_spike': 0.04070612365015508, 'adx_thresh': 27.82853095513505, 'atr_min_pct': 0.014013316346992257, 'atr_max_pct': 0.06989599353578965, 'tp_mult': 1.0497692363793, 'tsl_mult': 0.26330073601584997, 'strategy': 'mean_reversion', 'time_stop': 275, 'use_sma': False, 'use_atr': False, 'use_adx': False, 'use_ema': False, 'use_spike': False, 'rsi_required': False, 'edge_k': 1.905896733648093, 'edge_cap': 0.2511326498075628}.
[I 2025-08-29 23:37:26,515] Trial 1104 finished with values: [-0.0028670967202053532, 0.0028442260814135973] and parameters: {'p_sma': 28, 'p_std': 19, 'p_atr': 12, 'p_adx': 17, 'rsi_period': 9, 'ema1': 16, 'ema2': 19, 'slip_atr_k': 0.015031380724585304, 'slip_spread_k': 0.7099675488573753, 'spread_hl_frac': 0.01337066481940883, 'bb_std_mult': 1.2842068314031219, 'rsi_os': 33, 'rsi_ob': 52, 'vol_spike': 0.27158523914006644, 'adx_thresh': 26.425840295226106, 'atr_min_pct': 0.003590157273309259, 'atr_max_pct': 0.06953212683329844, 'tp_mult': 2.023718396517488, 'tsl_mult': 0.2670280209346245, 'strategy': 'mean_reversion', 'time_stop': 279, 'use_sma': False, 'use_atr': False, 'use_adx': False, 'use_ema': False, 'use_spike': False, 'rsi_required': False, 'edge_k': 1.898169610258181, 'edge_cap': 0.15507443775411}.
[I 2025-08-29 23:37:53,817] Trial 1108 finished with values: [-0.00021785212529701337, 0.0004305888252665756] and parameters: {'p_sma': 24, 'p_std': 12, 'p_atr': 19, 'p_adx': 14, 'rsi_period': 67, 'ema1': 14, 'ema2': 21, 'slip_atr_k': 0.010805167994684055, 'slip_spread_k': 0.9810254737112276, 'spread_hl_frac': 0.00540255585164761, 'bb_std_mult': 2.5379307896312873, 'rsi_os': 36, 'rsi_ob': 63, 'vol_spike': 0.0911645033895212, 'adx_thresh': 26.570493711877603, 'atr_min_pct': 0.0037429802185101353, 'atr_max_pct': 0.013705650108892381, 'tp_mult': 2.0090131677377143, 'tsl_mult': 0.6641234662077886, 'strategy': 'mean_reversion', 'time_stop': 294, 'use_sma': False, 'use_atr': False, 'use_adx': False, 'use_ema': False, 'use_spike': False, 'rsi_required': False, 'edge_k': 1.9074442962640463, 'edge_cap': 0.33665984219506817}.
