[I 2025-08-29 23:07:13,410] Trial 810 finished with values: [-1000000000.0, 1000000000.0] and parameters: {'p_sma': 24, 'p_std': 13, 'p_atr': 11, 'p_adx': 13, 'rsi_period': 56, 'ema1': 23, 'ema2': 27, 'slip_atr_k': 0.24225485939943664, 'slip_spread_k': 0.9760051025408771, 'spread_hl_frac': 0.009862568490973682, 'bb_std_mult': 1.4336256441265551, 'rsi_os': 33, 'rsi_ob': 61, 'vol_spike': 0.2585388434569562, 'adx_thresh': 19.9145483025256, 'atr_min_pct': 0.015680327535263695, 'atr_max_pct': 0.07974182048780984, 'tp_mult': 1.95940934043768, 'tsl_mult': 0.012297132328745575, 'strategy': 'mean_reversion', 'time_stop': 268, 'use_sma': False, 'use_atr': False, 'use_adx': False, 'use_ema': False, 'use_spike': False, 'rsi_required': False, 'edge_k': 1.7809070854096802, 'edge_cap': 0.8247524744987674}.
[I 2025-08-29 23:07:13,697] Trial 812 finished with values: [-1000000000.0, 1000000000.0] and parameters: {'p_sma': 53, 'p_std': 23, 'p_atr': 11, 'p_adx': 13, 'rsi_period': 78, 'ema1': 17, 'ema2': 22, 'slip_atr_k': 0.1912893753656538, 'slip_spread_k': 0.5915539172021448, 'spread_hl_frac': 0.011587811821692844, 'bb_std_mult': 1.3934975295126322, 'rsi_os': 34, 'rsi_ob': 64, 'vol_spike': 0.12806957877505462, 'adx_thresh': 16.92835345151246, 'atr_min_pct': 0.013012821932642613, 'atr_max_pct': 0.06850870001328126, 'tp_mult': 1.9571710731185437, 'tsl_mult': 0.6515056112504906, 'strategy': 'mean_reversion', 'time_stop': 268, 'use_sma': False, 'use_atr': False, 'use_adx': False, 'use_ema': False, 'use_spike': False, 'rsi_required': False, 'edge_k': 1.9637145258769781, 'edge_cap': 0.8197804489178597}.
[I 2025-08-29 23:07:13,882] Trial 809 finished with values: [-1000000000.0, 1000000000.0] and parameters: {'p_sma': 54, 'p_std': 14, 'p_atr': 11, 'p_adx': 13, 'rsi_period': 14, 'ema1': 23, 'ema2': 27, 'slip_atr_k': 0.00014928548955939346, 'slip_spread_k': 0.293710889951474, 'spread_hl_frac': 0.02873698682969008, 'bb_std_mult': 1.3772133528682886, 'rsi_os': 33, 'rsi_ob': 64, 'vol_spike': 0.2505936386259657, 'adx_thresh': 23.794322604588125, 'atr_min_pct': 0.015619356033827806, 'atr_max_pct': 0.08196182073291, 'tp_mult': 1.9557392136603395, 'tsl_mult': 0.6590919541673371, 'strategy': 'mean_reversion', 'time_stop': 289, 'use_sma': False, 'use_atr': False, 'use_adx': False, 'use_ema': False, 'use_spike': False, 'rsi_required': False, 'edge_k': 1.768259376236682, 'edge_cap': 0.16572315747254268}.
[I 2025-08-29 23:07:41,553] Trial 816 finished with values: [-1000000000.0, 1000000000.0] and parameters: {'p_sma': 58, 'p_std': 43, 'p_atr': 12, 'p_adx': 14, 'rsi_period': 12, 'ema1': 21, 'ema2': 16, 'slip_atr_k': 0.10847994770434308, 'slip_spread_k': 0.6761739391736791, 'spread_hl_frac': 0.008096789539014377, 'bb_std_mult': 1.466248213132918, 'rsi_os': 34, 'rsi_ob': 51, 'vol_spike': 0.26382495891996244, 'adx_thresh': 20.832585516801508, 'atr_min_pct': 0.027586692882122107, 'atr_max_pct': 0.11216241515756245, 'tp_mult': 1.9151242924819263, 'tsl_mult': 0.21475335114925587, 'strategy': 'mean_reversion', 'time_stop': 40, 'use_sma': False, 'use_atr': False, 'use_adx': False, 'use_ema': False, 'use_spike': False, 'rsi_required': False, 'edge_k': 1.993042460845804, 'edge_cap': 0.12539327382042892}.
[I 2025-08-29 23:07:41,794] Trial 814 finished with values: [-1000000000.0, 1000000000.0] and parameters: {'p_sma': 54, 'p_std': 14, 'p_atr': 12, 'p_adx': 13, 'rsi_period': 72, 'ema1': 29, 'ema2': 53, 'slip_atr_k': 0.004779356571138725, 'slip_spread_k': 0.44885240919426345, 'spread_hl_frac': 0.013845593651201004, 'bb_std_mult': 1.3730453264310583, 'rsi_os': 33, 'rsi_ob': 64, 'vol_spike': 0.261722878478719, 'adx_thresh': 17.073354225801666, 'atr_min_pct': 0.02122592689745519, 'atr_max_pct': 0.06834421028211987, 'tp_mult': 1.9557826645530945, 'tsl_mult': 0.656803920367758, 'strategy': 'mean_reversion', 'time_stop': 41, 'use_sma': False, 'use_atr': False, 'use_adx': False, 'use_ema': False, 'use_spike': False, 'rsi_required': False, 'edge_k': 1.9757169334212854, 'edge_cap': 0.1732819859100685}.
[I 2025-08-29 23:07:41,868] Trial 813 finished with values: [-1000000000.0, 1000000000.0] and parameters: {'p_sma': 55, 'p_std': 14, 'p_atr': 12, 'p_adx': 13, 'rsi_period': 12, 'ema1': 17, 'ema2': 21, 'slip_atr_k': 0.18948544671239642, 'slip_spread_k': 0.9800851205913499, 'spread_hl_frac': 0.011322191324734417, 'bb_std_mult': 1.3731264961663998, 'rsi_os': 32, 'rsi_ob': 72, 'vol_spike': 0.26227128093097113, 'adx_thresh': 19.943910934635998, 'atr_min_pct': 0.012698704876064448, 'atr_max_pct': 0.06809791937918237, 'tp_mult': 1.9532511615817947, 'tsl_mult': 0.1125235878663306, 'strategy': 'mean_reversion', 'time_stop': 287, 'use_sma': False, 'use_atr': False, 'use_adx': False, 'use_ema': False, 'use_spike': False, 'rsi_required': False, 'edge_k': 1.7506170415961138, 'edge_cap': 0.16117383381092018}.
[I 2025-08-29 23:07:41,869] Trial 815 finished with values: [-1000000000.0, 1000000000.0] and parameters: {'p_sma': 39, 'p_std': 7, 'p_atr': 12, 'p_adx': 13, 'rsi_period': 72, 'ema1': 27, 'ema2': 21, 'slip_atr_k': 0.17695774888305643, 'slip_spread_k': 0.6120479121308481, 'spread_hl_frac': 0.016321906792330067, 'bb_std_mult': 1.2509628439191411, 'rsi_os': 34, 'rsi_ob': 93, 'vol_spike': 0.13877867429530122, 'adx_thresh': 31.616139920021702, 'atr_min_pct': 0.0292153067620083, 'atr_max_pct': 0.06672638448932884, 'tp_mult': 1.8982659295880249, 'tsl_mult': 0.6638742920285648, 'strategy': 'mean_reversion', 'time_stop': 287, 'use_sma': False, 'use_atr': False, 'use_adx': False, 'use_ema': False, 'use_spike': False, 'rsi_required': False, 'edge_k': 1.9715882399581595, 'edge_cap': 0.12654816611464414}.
[I 2025-08-29 23:07:42,096] Trial 817 finished with values: [-1000000000.0, 1000000000.0] and parameters: {'p_sma': 39, 'p_std': 56, 'p_atr': 12, 'p_adx': 13, 'rsi_period': 12, 'ema1': 29, 'ema2': 35, 'slip_atr_k': 0.004666843769937651, 'slip_spread_k': 0.251754583264196, 'spread_hl_frac': 0.04183276505038068, 'bb_std_mult': 1.2502455247284854, 'rsi_os': 33, 'rsi_ob': 81, 'vol_spike': 0.2629076730023875, 'adx_thresh': 29.30853621986598, 'atr_min_pct': 0.024952649076376378, 'atr_max_pct': 0.010014667356442089, 'tp_mult': 1.8912973113300304, 'tsl_mult': 0.6319788683097202, 'strategy': 'mean_reversion', 'time_stop': 288, 'use_sma': False, 'use_atr': False, 'use_adx': False, 'use_ema': False, 'use_spike': False, 'rsi_required': False, 'edge_k': 0.6881998452002012, 'edge_cap': 0.18805417893449541}.
[I 2025-08-29 23:08:09,125] Trial 818 finished with values: [-1000000000.0, 1000000000.0] and parameters: {'p_sma': 28, 'p_std': 7, 'p_atr': 13, 'p_adx': 13, 'rsi_period': 8, 'ema1': 10, 'ema2': 45, 'slip_atr_k': 0.1752529688822314, 'slip_spread_k': 0.5479210125727567, 'spread_hl_frac': 0.019911235402934144, 'bb_std_mult': 1.2563262914053064, 'rsi_os': 34, 'rsi_ob': 60, 'vol_spike': 0.13991287828606416, 'adx_thresh': 10.519999787170761, 'atr_min_pct': 0.006250873414517356, 'atr_max_pct': 0.07335683238225242, 'tp_mult': 1.873347061063686, 'tsl_mult': 0.6278610350829377, 'strategy': 'breakout', 'time_stop': 157, 'use_sma': False, 'use_atr': False, 'use_adx': False, 'use_ema': False, 'use_spike': False, 'rsi_required': False, 'edge_k': 1.860342064213776, 'edge_cap': 0.18928261550512088}.
[I 2025-08-29 23:08:09,444] Trial 821 finished with values: [-1000000000.0, 1000000000.0] and parameters: {'p_sma': 28, 'p_std': 10, 'p_atr': 13, 'p_adx': 14, 'rsi_period': 65, 'ema1': 29, 'ema2': 45, 'slip_atr_k': 0.21894131330193156, 'slip_spread_k': 0.26753037742193764, 'spread_hl_frac': 0.0014690680536481662, 'bb_std_mult': 1.3269710093604608, 'rsi_os': 34, 'rsi_ob': 94, 'vol_spike': 0.25837067928869284, 'adx_thresh': 21.690243891478218, 'atr_min_pct': 0.01138133939079495, 'atr_max_pct': 0.10806653603149467, 'tp_mult': 1.8745425457713478, 'tsl_mult': 0.6158057281932182, 'strategy': 'breakout', 'time_stop': 296, 'use_sma': False, 'use_atr': False, 'use_adx': False, 'use_ema': False, 'use_spike': False, 'rsi_required': False, 'edge_k': 1.8696451844521598, 'edge_cap': 0.8883714379130032}.
[I 2025-08-29 23:08:09,530] Trial 819 finished with values: [-0.06531366057444121, 0.06530396231763655] and parameters: {'p_sma': 25, 'p_std': 10, 'p_atr': 13, 'p_adx': 14, 'rsi_period': 8, 'ema1': 20, 'ema2': 35, 'slip_atr_k': 0.013924342173314879, 'slip_spread_k': 0.5161213945090661, 'spread_hl_frac': 0.020897626187530376, 'bb_std_mult': 1.2520772420411836, 'rsi_os': 34, 'rsi_ob': 48, 'vol_spike': 0.25866934666430097, 'adx_thresh': 10.457801759869714, 'atr_min_pct': 1.242702297992674e-05, 'atr_max_pct': 0.04497417002415691, 'tp_mult': 1.8826324763899347, 'tsl_mult': 0.2724203711261077, 'strategy': 'breakout', 'time_stop': 159, 'use_sma': False, 'use_atr': False, 'use_adx': False, 'use_ema': False, 'use_spike': False, 'rsi_required': False, 'edge_k': 1.924970475577656, 'edge_cap': 0.9813054568516848}.
[I 2025-08-29 23:08:09,681] Trial 820 finished with values: [-1000000000.0, 1000000000.0] and parameters: {'p_sma': 18, 'p_std': 11, 'p_atr': 13, 'p_adx': 12, 'rsi_period': 63, 'ema1': 10, 'ema2': 42, 'slip_atr_k': 0.14660240747221454, 'slip_spread_k': 0.5159440411021158, 'spread_hl_frac': 0.001260081947556023, 'bb_std_mult': 1.2228263111857935, 'rsi_os': 34, 'rsi_ob': 60, 'vol_spike': 0.2585183084967459, 'adx_thresh': 21.810071849267164, 'atr_min_pct': 0.005936389431950852, 'atr_max_pct': 0.07153939281047071, 'tp_mult': 1.877603768278435, 'tsl_mult': 0.6239998178743829, 'strategy': 'breakout', 'time_stop': 300, 'use_sma': False, 'use_atr': False, 'use_adx': False, 'use_ema': False, 'use_spike': False, 'rsi_required': False, 'edge_k': 1.9994892203825436, 'edge_cap': 0.9813691888953353}.
[I 2025-08-29 23:08:35,923] Trial 823 finished with values: [-1000000000.0, 1000000000.0] and parameters: {'p_sma': 19, 'p_std': 11, 'p_atr': 11, 'p_adx': 12, 'rsi_period': 42, 'ema1': 30, 'ema2': 18, 'slip_atr_k': 0.014080475423552393, 'slip_spread_k': 0.19616380287005342, 'spread_hl_frac': 0.024767431890141585, 'bb_std_mult': 1.4793358209450573, 'rsi_os': 32, 'rsi_ob': 61, 'vol_spike': 0.2944538865468051, 'adx_thresh': 25.01204405517764, 'atr_min_pct': 0.01825475827827826, 'atr_max_pct': 0.1039742487402375, 'tp_mult': 1.9002729085717547, 'tsl_mult': 0.0834214336869662, 'strategy': 'mean_reversion', 'time_stop': 194, 'use_sma': False, 'use_atr': False, 'use_adx': False, 'use_ema': False, 'use_spike': False, 'rsi_required': False, 'edge_k': 1.9242312697061195, 'edge_cap': 0.15318682878346654}.
[I 2025-08-29 23:08:36,673] Trial 822 finished with values: [-0.007397765051349925, 0.007398482798348979] and parameters: {'p_sma': 31, 'p_std': 11, 'p_atr': 13, 'p_adx': 14, 'rsi_period': 36, 'ema1': 29, 'ema2': 18, 'slip_atr_k': 0.01385408875789922, 'slip_spread_k': 0.19688980881814377, 'spread_hl_frac': 0.04486617942495321, 'bb_std_mult': 1.4591931345594125, 'rsi_os': 32, 'rsi_ob': 48, 'vol_spike': 0.2559988148614147, 'adx_thresh': 21.61132250990624, 'atr_min_pct': 0.0028630623373879192, 'atr_max_pct': 0.07358026237659139, 'tp_mult': 1.920752757663667, 'tsl_mult': 0.6217938654158801, 'strategy': 'breakout', 'time_stop': 281, 'use_sma': False, 'use_atr': False, 'use_adx': False, 'use_ema': False, 'use_spike': False, 'rsi_required': False, 'edge_k': 1.9279389024679292, 'edge_cap': 0.40952691524802387}.
[I 2025-08-29 23:08:36,982] Trial 825 finished with values: [-1000000000.0, 1000000000.0] and parameters: {'p_sma': 23, 'p_std': 12, 'p_atr': 11, 'p_adx': 12, 'rsi_period': 37, 'ema1': 14, 'ema2': 20, 'slip_atr_k': 0.022241049583677074, 'slip_spread_k': 0.19499228390460527, 'spread_hl_frac': 0.013614774169592423, 'bb_std_mult': 1.4632644127927865, 'rsi_os': 32, 'rsi_ob': 55, 'vol_spike': 0.26726393071319876, 'adx_thresh': 19.030940223813197, 'atr_min_pct': 0.014084412982833295, 'atr_max_pct': 0.0846139172442725, 'tp_mult': 1.9274915548695797, 'tsl_mult': 0.6982943341592875, 'strategy': 'mean_reversion', 'time_stop': 280, 'use_sma': False, 'use_atr': False, 'use_adx': False, 'use_ema': False, 'use_spike': False, 'rsi_required': False, 'edge_k': 1.928892922791896, 'edge_cap': 0.23003217585645827}.
[I 2025-08-29 23:08:37,118] Trial 824 finished with values: [-1000000000.0, 1000000000.0] and parameters: {'p_sma': 37, 'p_std': 11, 'p_atr': 11, 'p_adx': 12, 'rsi_period': 15, 'ema1': 30, 'ema2': 42, 'slip_atr_k': 0.009537544927116524, 'slip_spread_k': 0.30577045922630874, 'spread_hl_frac': 0.018186458801577286, 'bb_std_mult': 1.4683951543718188, 'rsi_os': 33, 'rsi_ob': 55, 'vol_spike': 0.1549360457879143, 'adx_thresh': 25.096694432783657, 'atr_min_pct': 0.01393618362015948, 'atr_max_pct': 0.06116379204324662, 'tp_mult': 1.9212061643945693, 'tsl_mult': 0.17771697537498926, 'strategy': 'mean_reversion', 'time_stop': 196, 'use_sma': False, 'use_atr': False, 'use_adx': False, 'use_ema': False, 'use_spike': False, 'rsi_required': False, 'edge_k': 1.9284296953703106, 'edge_cap': 0.7488232409273128}.
[I 2025-08-29 23:09:03,752] Trial 827 finished with values: [-1000000000.0, 1000000000.0] and parameters: {'p_sma': 27, 'p_std': 51, 'p_atr': 12, 'p_adx': 12, 'rsi_period': 15, 'ema1': 30, 'ema2': 56, 'slip_atr_k': 0.008076864559059383, 'slip_spread_k': 0.3318894146757491, 'spread_hl_frac': 0.010569475281899096, 'bb_std_mult': 1.4160612910231865, 'rsi_os': 33, 'rsi_ob': 69, 'vol_spike': 0.15568236909328045, 'adx_thresh': 7.6563975555040695, 'atr_min_pct': 0.010213286739144914, 'atr_max_pct': 0.08547888793472867, 'tp_mult': 1.9850096229232161, 'tsl_mult': 0.7930935850065727, 'strategy': 'mean_reversion', 'time_stop': 272, 'use_sma': False, 'use_atr': False, 'use_adx': False, 'use_ema': False, 'use_spike': False, 'rsi_required': False, 'edge_k': 1.9682946584288645, 'edge_cap': 0.2270767458114558}.
[I 2025-08-29 23:09:04,449] Trial 829 finished with values: [-1000000000.0, 1000000000.0] and parameters: {'p_sma': 12, 'p_std': 59, 'p_atr': 12, 'p_adx': 13, 'rsi_period': 12, 'ema1': 24, 'ema2': 54, 'slip_atr_k': 0.005756705629421594, 'slip_spread_k': 0.2257404493896099, 'spread_hl_frac': 0.010532146160411654, 'bb_std_mult': 1.3302262026120546, 'rsi_os': 35, 'rsi_ob': 62, 'vol_spike': 0.10261716863359473, 'adx_thresh': 20.755565233604642, 'atr_min_pct': 0.017090426704825912, 'atr_max_pct': 0.0776779998489644, 'tp_mult': 1.9632317404673036, 'tsl_mult': 0.5987324745091513, 'strategy': 'mean_reversion', 'time_stop': 263, 'use_sma': False, 'use_atr': False, 'use_adx': False, 'use_ema': False, 'use_spike': False, 'rsi_required': False, 'edge_k': 1.9628832922923012, 'edge_cap': 0.19547682326655486}.
[I 2025-08-29 23:09:04,607] Trial 826 finished with values: [-0.003979128724900138, 0.004032577897742897] and parameters: {'p_sma': 23, 'p_std': 45, 'p_atr': 12, 'p_adx': 14, 'rsi_period': 15, 'ema1': 29, 'ema2': 54, 'slip_atr_k': 0.008284187247775097, 'slip_spread_k': 0.3105429942036234, 'spread_hl_frac': 0.04480839872510699, 'bb_std_mult': 1.4212328256246671, 'rsi_os': 32, 'rsi_ob': 62, 'vol_spike': 0.1549873511315632, 'adx_thresh': 9.365238043352766, 'atr_min_pct': 0.0031056950470173894, 'atr_max_pct': 0.061150578498910854, 'tp_mult': 1.9342223708051145, 'tsl_mult': 0.5796145763071123, 'strategy': 'mean_reversion', 'time_stop': 281, 'use_sma': False, 'use_atr': False, 'use_adx': False, 'use_ema': False, 'use_spike': False, 'rsi_required': False, 'edge_k': 1.9386638291313087, 'edge_cap': 0.4099989307778037}.
[I 2025-08-29 23:09:04,808] Trial 828 finished with values: [-1000000000.0, 1000000000.0] and parameters: {'p_sma': 32, 'p_std': 45, 'p_atr': 12, 'p_adx': 13, 'rsi_period': 15, 'ema1': 13, 'ema2': 22, 'slip_atr_k': 0.008275192002469532, 'slip_spread_k': 0.9512936674598685, 'spread_hl_frac': 0.010173841468410744, 'bb_std_mult': 1.3535701507977806, 'rsi_os': 33, 'rsi_ob': 62, 'vol_spike': 0.2512288504692903, 'adx_thresh': 20.911586674560834, 'atr_min_pct': 0.017252461355382408, 'atr_max_pct': 0.06273882437006709, 'tp_mult': 1.9770059939462428, 'tsl_mult': 0.6025214566594587, 'strategy': 'mean_reversion', 'time_stop': 209, 'use_sma': False, 'use_atr': False, 'use_adx': False, 'use_ema': False, 'use_spike': False, 'rsi_required': False, 'edge_k': 0.6373135389521819, 'edge_cap': 0.1997674905056695}.
[I 2025-08-29 23:09:32,127] Trial 830 finished with values: [-1000000000.0, 1000000000.0] and parameters: {'p_sma': 60, 'p_std': 22, 'p_atr': 12, 'p_adx': 13, 'rsi_period': 11, 'ema1': 24, 'ema2': 30, 'slip_atr_k': 0.07794680691069154, 'slip_spread_k': 0.9080770180132817, 'spread_hl_frac': 0.014638766074972822, 'bb_std_mult': 1.3411640998848502, 'rsi_os': 35, 'rsi_ob': 62, 'vol_spike': 0.24387076301623314, 'adx_thresh': 5.452502632687013, 'atr_min_pct': 0.016927923396834313, 'atr_max_pct': 0.07847451832686576, 'tp_mult': 1.9596892900035856, 'tsl_mult': 0.5895603865023026, 'strategy': 'mean_reversion', 'time_stop': 292, 'use_sma': False, 'use_atr': False, 'use_adx': False, 'use_ema': False, 'use_spike': False, 'rsi_required': False, 'edge_k': 1.8094822270380713, 'edge_cap': 0.20205139419083196}.
[I 2025-08-29 23:09:32,385] Trial 832 finished with values: [-1000000000.0, 1000000000.0] and parameters: {'p_sma': 44, 'p_std': 19, 'p_atr': 12, 'p_adx': 13, 'rsi_period': 11, 'ema1': 13, 'ema2': 22, 'slip_atr_k': 0.16739752546571085, 'slip_spread_k': 0.9996213349205623, 'spread_hl_frac': 0.012186661179307825, 'bb_std_mult': 1.3136427802160164, 'rsi_os': 33, 'rsi_ob': 61, 'vol_spike': 0.16640122130411109, 'adx_thresh': 21.01791942065435, 'atr_min_pct': 0.014940434687917193, 'atr_max_pct': 0.06481997126533594, 'tp_mult': 1.9769182874109288, 'tsl_mult': 0.640736626406316, 'strategy': 'mean_reversion', 'time_stop': 291, 'use_sma': False, 'use_atr': False, 'use_adx': False, 'use_ema': False, 'use_spike': False, 'rsi_required': False, 'edge_k': 0.635069749923257, 'edge_cap': 0.9391618547512226}.
[I 2025-08-29 23:09:32,676] Trial 833 finished with values: [-1000000000.0, 1000000000.0] and parameters: {'p_sma': 14, 'p_std': 13, 'p_atr': 12, 'p_adx': 13, 'rsi_period': 10, 'ema1': 18, 'ema2': 31, 'slip_atr_k': 0.24947943930269945, 'slip_spread_k': 0.09550315403379322, 'spread_hl_frac': 0.0038909837329684574, 'bb_std_mult': 1.3226900691704824, 'rsi_os': 35, 'rsi_ob': 61, 'vol_spike': 0.24680378656571703, 'adx_thresh': 20.05817281568492, 'atr_min_pct': 0.005107347032065047, 'atr_max_pct': 0.07902288907678148, 'tp_mult': 1.9700184448953189, 'tsl_mult': 0.6411047669656339, 'strategy': 'mean_reversion', 'time_stop': 293, 'use_sma': False, 'use_atr': False, 'use_adx': False, 'use_ema': False, 'use_spike': False, 'rsi_required': False, 'edge_k': 1.8840821942892934, 'edge_cap': 0.17179072924177463}.
[I 2025-08-29 23:09:32,744] Trial 831 finished with values: [-1000000000.0, 1000000000.0] and parameters: {'p_sma': 35, 'p_std': 22, 'p_atr': 12, 'p_adx': 14, 'rsi_period': 68, 'ema1': 29, 'ema2': 48, 'slip_atr_k': 0.16698599918537457, 'slip_spread_k': 0.2473531342525982, 'spread_hl_frac': 0.02311339177475703, 'bb_std_mult': 1.3212427577696002, 'rsi_os': 31, 'rsi_ob': 83, 'vol_spike': 0.24683466947642502, 'adx_thresh': 5.450687209340822, 'atr_min_pct': 0.023391425432623274, 'atr_max_pct': 0.06471267467933682, 'tp_mult': 1.9738571952765747, 'tsl_mult': 0.5802150936314993, 'strategy': 'mean_reversion', 'time_stop': 12, 'use_sma': False, 'use_atr': False, 'use_adx': False, 'use_ema': False, 'use_spike': False, 'rsi_required': False, 'edge_k': 0.0023477889010737885, 'edge_cap': 0.17206812957995662}.
[I 2025-08-29 23:09:59,928] Trial 834 finished with values: [-1000000000.0, 1000000000.0] and parameters: {'p_sma': 44, 'p_std': 13, 'p_atr': 25, 'p_adx': 14, 'rsi_period': 9, 'ema1': 18, 'ema2': 19, 'slip_atr_k': 0.23557158894629732, 'slip_spread_k': 0.24746517871958293, 'spread_hl_frac': 0.011942443349893616, 'bb_std_mult': 1.3088418489854985, 'rsi_os': 31, 'rsi_ob': 83, 'vol_spike': 0.2529411294189587, 'adx_thresh': 26.007454858603918, 'atr_min_pct': 0.007142400932186847, 'atr_max_pct': 0.06501289535009236, 'tp_mult': 1.9752722674909065, 'tsl_mult': 0.42325699561868346, 'strategy': 'mean_reversion', 'time_stop': 276, 'use_sma': False, 'use_atr': False, 'use_adx': False, 'use_ema': False, 'use_spike': False, 'rsi_required': False, 'edge_k': 0.20981900041937074, 'edge_cap': 0.1661251551199836}.
[I 2025-08-29 23:10:00,070] Trial 837 finished with values: [-1000000000.0, 1000000000.0] and parameters: {'p_sma': 10, 'p_std': 13, 'p_atr': 11, 'p_adx': 14, 'rsi_period': 13, 'ema1': 22, 'ema2': 26, 'slip_atr_k': 0.23584987652628592, 'slip_spread_k': 0.2680869048781099, 'spread_hl_frac': 0.0321673485305113, 'bb_std_mult': 1.4043032049029287, 'rsi_os': 31, 'rsi_ob': 63, 'vol_spike': 0.07676996083055282, 'adx_thresh': 30.32169673294381, 'atr_min_pct': 0.008836214847262297, 'atr_max_pct': 0.04173326853739296, 'tp_mult': 1.9045709178993147, 'tsl_mult': 0.6772399668779748, 'strategy': 'breakout', 'time_stop': 273, 'use_sma': False, 'use_atr': False, 'use_adx': False, 'use_ema': False, 'use_spike': False, 'rsi_required': False, 'edge_k': 1.5780311023072895, 'edge_cap': 0.1502124227863714}.
[I 2025-08-29 23:10:00,459] Trial 835 finished with values: [-1000000000.0, 1000000000.0] and parameters: {'p_sma': 42, 'p_std': 13, 'p_atr': 11, 'p_adx': 14, 'rsi_period': 68, 'ema1': 30, 'ema2': 16, 'slip_atr_k': 0.0037712875437436654, 'slip_spread_k': 0.26643707484169493, 'spread_hl_frac': 0.011872462454610483, 'bb_std_mult': 1.3058604834831706, 'rsi_os': 31, 'rsi_ob': 63, 'vol_spike': 0.2458470199581418, 'adx_thresh': 30.156546111499033, 'atr_min_pct': 0.007431105461700253, 'atr_max_pct': 0.040482863892482485, 'tp_mult': 1.908753654541571, 'tsl_mult': 0.6443359898308358, 'strategy': 'mean_reversion', 'time_stop': 276, 'use_sma': False, 'use_atr': False, 'use_adx': False, 'use_ema': False, 'use_spike': False, 'rsi_required': False, 'edge_k': 0.7451492742901822, 'edge_cap': 0.16872065288002291}.
