[I 2025-08-29 22:18:21,819] Trial 348 finished with values: [-0.010350935920622972, 0.01033869787649761] and parameters: {'p_sma': 46, 'p_std': 35, 'p_atr': 9, 'p_adx': 9, 'rsi_period': 27, 'ema1': 26, 'ema2': 10, 'slip_atr_k': 0.049792295258433567, 'slip_spread_k': 0.8030547789366782, 'spread_hl_frac': 0.032791827827886075, 'bb_std_mult': 0.758765338325869, 'rsi_os': 28, 'rsi_ob': 63, 'vol_spike': 0.2450361875071284, 'adx_thresh': 22.332299777386073, 'atr_min_pct': 0.0009128633608835689, 'atr_max_pct': 0.12993455531805806, 'tp_mult': 2.331284929676212, 'tsl_mult': 0.5631497197607573, 'strategy': 'mean_reversion', 'time_stop': 107, 'use_sma': False, 'use_atr': False, 'use_adx': False, 'use_ema': False, 'use_spike': False, 'rsi_required': False, 'edge_k': 1.0238781802520938, 'edge_cap': 0.5266742532196185}.
[I 2025-08-29 22:18:21,969] Trial 353 finished with values: [-1000000000.0, 1000000000.0] and parameters: {'p_sma': 13, 'p_std': 41, 'p_atr': 26, 'p_adx': 20, 'rsi_period': 28, 'ema1': 13, 'ema2': 10, 'slip_atr_k': 0.21461253997626112, 'slip_spread_k': 0.480290434822056, 'spread_hl_frac': 0.009700810635241034, 'bb_std_mult': 3.0661897809363587, 'rsi_os': 55, 'rsi_ob': 78, 'vol_spike': 0.08828656040823075, 'adx_thresh': 22.535257813383303, 'atr_min_pct': 0.005529819902210117, 'atr_max_pct': 0.12249149543469404, 'tp_mult': 1.9775605050471683, 'tsl_mult': 0.9101463671840009, 'strategy': 'mean_reversion', 'time_stop': 113, 'use_sma': False, 'use_atr': False, 'use_adx': False, 'use_ema': False, 'use_spike': False, 'rsi_required': False, 'edge_k': 1.7398633620762176, 'edge_cap': 0.522043202559414}.
[I 2025-08-29 22:18:48,818] Trial 356 finished with values: [-1000000000.0, 1000000000.0] and parameters: {'p_sma': 8, 'p_std': 33, 'p_atr': 23, 'p_adx': 11, 'rsi_period': 25, 'ema1': 30, 'ema2': 37, 'slip_atr_k': 0.039615436029657544, 'slip_spread_k': 0.7280494212831227, 'spread_hl_frac': 0.03612051432925997, 'bb_std_mult': 2.645011623958981, 'rsi_os': 25, 'rsi_ob': 74, 'vol_spike': 0.17086665173702734, 'adx_thresh': 34.367582007514336, 'atr_min_pct': 0.025798024366656798, 'atr_max_pct': 0.065441710433925, 'tp_mult': 2.8100967450354424, 'tsl_mult': 0.6616308441305971, 'strategy': 'breakout', 'time_stop': 95, 'use_sma': False, 'use_atr': False, 'use_adx': False, 'use_ema': False, 'use_spike': False, 'rsi_required': False, 'edge_k': 0.8378922430800434, 'edge_cap': 0.10284659800410506}.
[I 2025-08-29 22:18:49,173] Trial 355 finished with values: [-0.00604325922840776, 0.006042390167910804] and parameters: {'p_sma': 48, 'p_std': 33, 'p_atr': 23, 'p_adx': 11, 'rsi_period': 25, 'ema1': 6, 'ema2': 47, 'slip_atr_k': 0.040122952761405026, 'slip_spread_k': 0.7258775228606635, 'spread_hl_frac': 0.013939661412763014, 'bb_std_mult': 3.321960279385101, 'rsi_os': 22, 'rsi_ob': 72, 'vol_spike': 0.2269182176480376, 'adx_thresh': 21.179590571190793, 'atr_min_pct': 0.001724635191752168, 'atr_max_pct': 0.05294602701204202, 'tp_mult': 2.8101194202080575, 'tsl_mult': 0.8182702196819822, 'strategy': 'breakout', 'time_stop': 94, 'use_sma': False, 'use_atr': False, 'use_adx': False, 'use_ema': False, 'use_spike': False, 'rsi_required': False, 'edge_k': 0.07642428191437722, 'edge_cap': 0.9734891548764445}.
[I 2025-08-29 22:18:49,287] Trial 354 finished with values: [-1000000000.0, 1000000000.0] and parameters: {'p_sma': 13, 'p_std': 41, 'p_atr': 9, 'p_adx': 11, 'rsi_period': 25, 'ema1': 13, 'ema2': 35, 'slip_atr_k': 0.04138164631428942, 'slip_spread_k': 0.482845955095418, 'spread_hl_frac': 0.036234096999748645, 'bb_std_mult': 3.05041173006551, 'rsi_os': 55, 'rsi_ob': 51, 'vol_spike': 0.18440260646605747, 'adx_thresh': 20.64224924930536, 'atr_min_pct': 0.025842572103597066, 'atr_max_pct': 0.06646261638847757, 'tp_mult': 2.9561457304668863, 'tsl_mult': 0.661231159229368, 'strategy': 'breakout', 'time_stop': 94, 'use_sma': False, 'use_atr': False, 'use_adx': False, 'use_ema': False, 'use_spike': False, 'rsi_required': False, 'edge_k': 0.4306319116492547, 'edge_cap': 0.5526218461224139}.
[I 2025-08-29 22:18:49,367] Trial 352 finished with values: [-1000000000.0, 1000000000.0] and parameters: {'p_sma': 13, 'p_std': 41, 'p_atr': 23, 'p_adx': 20, 'rsi_period': 28, 'ema1': 13, 'ema2': 10, 'slip_atr_k': 0.0693081333376594, 'slip_spread_k': 0.7232519569621606, 'spread_hl_frac': 0.042819521504168984, 'bb_std_mult': 2.8454179300163736, 'rsi_os': 24, 'rsi_ob': 78, 'vol_spike': 0.2352354733361554, 'adx_thresh': 22.165998075272636, 'atr_min_pct': 0.0032151856015108886, 'atr_max_pct': 0.053381413196356725, 'tp_mult': 2.9428773535496857, 'tsl_mult': 0.5554190239426522, 'strategy': 'mean_reversion', 'time_stop': 95, 'use_sma': False, 'use_atr': False, 'use_adx': False, 'use_ema': False, 'use_spike': False, 'rsi_required': False, 'edge_k': 0.07195977492688377, 'edge_cap': 0.09852090388122975}.
[I 2025-08-29 22:18:49,545] Trial 358 finished with values: [-1000000000.0, 1000000000.0] and parameters: {'p_sma': 49, 'p_std': 38, 'p_atr': 27, 'p_adx': 10, 'rsi_period': 22, 'ema1': 7, 'ema2': 27, 'slip_atr_k': 0.03319358873823308, 'slip_spread_k': 0.7664529528664968, 'spread_hl_frac': 0.03137740949344288, 'bb_std_mult': 1.4594175115505692, 'rsi_os': 45, 'rsi_ob': 49, 'vol_spike': 0.1849864174057933, 'adx_thresh': 33.34402696726512, 'atr_min_pct': 0.003349876925386027, 'atr_max_pct': 0.12017781251006748, 'tp_mult': 2.688577337001217, 'tsl_mult': 0.4321091430592921, 'strategy': 'mean_reversion', 'time_stop': 117, 'use_sma': False, 'use_atr': False, 'use_adx': False, 'use_ema': False, 'use_spike': False, 'rsi_required': False, 'edge_k': 0.41767932144464426, 'edge_cap': 0.4699946458073753}.
[I 2025-08-29 22:19:17,325] Trial 360 finished with values: [-1000000000.0, 1000000000.0] and parameters: {'p_sma': 49, 'p_std': 50, 'p_atr': 22, 'p_adx': 10, 'rsi_period': 22, 'ema1': 7, 'ema2': 59, 'slip_atr_k': 0.19599752183453506, 'slip_spread_k': 0.7680406738007227, 'spread_hl_frac': 0.034962244030016625, 'bb_std_mult': 2.4144783727024404, 'rsi_os': 9, 'rsi_ob': 77, 'vol_spike': 0.2157781937122889, 'adx_thresh': 33.16223788404886, 'atr_min_pct': 0.001724440885693021, 'atr_max_pct': 0.123798571183964, 'tp_mult': 1.2937909808491237, 'tsl_mult': 0.4387187867027254, 'strategy': 'mean_reversion', 'time_stop': 119, 'use_sma': False, 'use_atr': False, 'use_adx': False, 'use_ema': False, 'use_spike': False, 'rsi_required': False, 'edge_k': 0.17339211115542563, 'edge_cap': 0.3051609590415214}.
[I 2025-08-29 22:19:17,559] Trial 359 finished with values: [-0.010367174617162855, 0.010377106255535617] and parameters: {'p_sma': 49, 'p_std': 56, 'p_atr': 28, 'p_adx': 10, 'rsi_period': 22, 'ema1': 19, 'ema2': 13, 'slip_atr_k': 0.19714414320528512, 'slip_spread_k': 0.3948629481291819, 'spread_hl_frac': 0.047829772162465346, 'bb_std_mult': 3.269813086110921, 'rsi_os': 27, 'rsi_ob': 77, 'vol_spike': 0.0161358762380735, 'adx_thresh': 33.1029598842301, 'atr_min_pct': 0.001571035892402838, 'atr_max_pct': 0.12462369247574734, 'tp_mult': 2.6242475653030204, 'tsl_mult': 0.434899648882449, 'strategy': 'mean_reversion', 'time_stop': 280, 'use_sma': False, 'use_atr': False, 'use_adx': False, 'use_ema': False, 'use_spike': False, 'rsi_required': False, 'edge_k': 0.3711007043895987, 'edge_cap': 0.8037447814849753}.
[I 2025-08-29 22:19:17,647] Trial 357 finished with values: [-0.007871584409084642, 0.00786442388286456] and parameters: {'p_sma': 29, 'p_std': 50, 'p_atr': 18, 'p_adx': 11, 'rsi_period': 22, 'ema1': 6, 'ema2': 20, 'slip_atr_k': 0.19805001190425173, 'slip_spread_k': 0.7014149483608724, 'spread_hl_frac': 0.00794671981483007, 'bb_std_mult': 3.2796960029090876, 'rsi_os': 9, 'rsi_ob': 72, 'vol_spike': 0.18454622289899422, 'adx_thresh': 33.033259297838626, 'atr_min_pct': 0.0017964168086681354, 'atr_max_pct': 0.020244119704545788, 'tp_mult': 2.616486331410616, 'tsl_mult': 0.4448222006498318, 'strategy': 'breakout', 'time_stop': 94, 'use_sma': False, 'use_atr': False, 'use_adx': False, 'use_ema': False, 'use_spike': False, 'rsi_required': False, 'edge_k': 0.22084019319534842, 'edge_cap': 0.7917942793441743}.
[I 2025-08-29 22:19:17,920] Trial 361 finished with values: [-0.01039337146829944, 0.010383121326727154] and parameters: {'p_sma': 25, 'p_std': 7, 'p_atr': 22, 'p_adx': 23, 'rsi_period': 61, 'ema1': 7, 'ema2': 13, 'slip_atr_k': 0.22136023380964764, 'slip_spread_k': 0.7008187620891033, 'spread_hl_frac': 0.03472202391242793, 'bb_std_mult': 1.2286027420937473, 'rsi_os': 27, 'rsi_ob': 77, 'vol_spike': 0.016392331686309037, 'adx_thresh': 7.878472090706104, 'atr_min_pct': 0.0017418683286229834, 'atr_max_pct': 0.12405566256249678, 'tp_mult': 2.760369176704525, 'tsl_mult': 0.9987057503683914, 'strategy': 'mean_reversion', 'time_stop': 128, 'use_sma': False, 'use_atr': False, 'use_adx': False, 'use_ema': False, 'use_spike': False, 'rsi_required': False, 'edge_k': 0.38254600168845915, 'edge_cap': 0.7978564540598454}.
[I 2025-08-29 22:19:44,870] Trial 362 finished with values: [-0.016135045956052085, 0.016126154159465556] and parameters: {'p_sma': 26, 'p_std': 56, 'p_atr': 18, 'p_adx': 17, 'rsi_period': 60, 'ema1': 6, 'ema2': 40, 'slip_atr_k': 0.1252042112495251, 'slip_spread_k': 0.11782345282718781, 'spread_hl_frac': 0.03339804270565434, 'bb_std_mult': 1.2479272399603056, 'rsi_os': 27, 'rsi_ob': 55, 'vol_spike': 0.0070998305202891465, 'adx_thresh': 33.924123495745725, 'atr_min_pct': 0.00017874192207309372, 'atr_max_pct': 0.13302086107026204, 'tp_mult': 2.7595522949051703, 'tsl_mult': 0.4503535417728587, 'strategy': 'breakout', 'time_stop': 81, 'use_sma': False, 'use_atr': False, 'use_adx': False, 'use_ema': False, 'use_spike': False, 'rsi_required': False, 'edge_k': 0.5816038876608419, 'edge_cap': 0.4322260962240509}.
[I 2025-08-29 22:19:45,329] Trial 365 finished with values: [-1000000000.0, 1000000000.0] and parameters: {'p_sma': 45, 'p_std': 35, 'p_atr': 24, 'p_adx': 30, 'rsi_period': 67, 'ema1': 5, 'ema2': 11, 'slip_atr_k': 0.16977311492691372, 'slip_spread_k': 0.925446214790994, 'spread_hl_frac': 0.03705891838530835, 'bb_std_mult': 1.6805378633714585, 'rsi_os': 14, 'rsi_ob': 85, 'vol_spike': 0.22125934958678675, 'adx_thresh': 33.86925551544183, 'atr_min_pct': 0.026747983126995716, 'atr_max_pct': 0.13653452341033936, 'tp_mult': 2.868694495580335, 'tsl_mult': 0.3562214022454287, 'strategy': 'breakout', 'time_stop': 85, 'use_sma': False, 'use_atr': False, 'use_adx': False, 'use_ema': False, 'use_spike': False, 'rsi_required': False, 'edge_k': 1.5338819584496801, 'edge_cap': 0.6920777066173287}.
[I 2025-08-29 22:19:45,411] Trial 364 finished with values: [-1000000000.0, 1000000000.0] and parameters: {'p_sma': 7, 'p_std': 31, 'p_atr': 7, 'p_adx': 24, 'rsi_period': 24, 'ema1': 5, 'ema2': 40, 'slip_atr_k': 0.12613069114865594, 'slip_spread_k': 0.11561955288495646, 'spread_hl_frac': 0.03392262146292411, 'bb_std_mult': 1.1238478269739929, 'rsi_os': 38, 'rsi_ob': 60, 'vol_spike': 0.29906738753274975, 'adx_thresh': 25.695342617450457, 'atr_min_pct': 0.026578554949180114, 'atr_max_pct': 0.13312070940853657, 'tp_mult': 2.189006061358159, 'tsl_mult': 0.4907418437184596, 'strategy': 'mean_reversion', 'time_stop': 103, 'use_sma': False, 'use_atr': False, 'use_adx': False, 'use_ema': False, 'use_spike': False, 'rsi_required': False, 'edge_k': 1.5894214818451917, 'edge_cap': 0.15408301023799642}.
[I 2025-08-29 22:19:45,506] Trial 363 finished with values: [-1000000000.0, 1000000000.0] and parameters: {'p_sma': 29, 'p_std': 59, 'p_atr': 14, 'p_adx': 24, 'rsi_period': 31, 'ema1': 6, 'ema2': 11, 'slip_atr_k': 0.008518958491400844, 'slip_spread_k': 0.6962414931565316, 'spread_hl_frac': 0.03366359734167367, 'bb_std_mult': 1.1100813933914462, 'rsi_os': 26, 'rsi_ob': 55, 'vol_spike': 0.05470661281733745, 'adx_thresh': 25.92359859666027, 'atr_min_pct': 0.02690267486571337, 'atr_max_pct': 0.09526809306734246, 'tp_mult': 2.8509202442872326, 'tsl_mult': 0.4839818950867547, 'strategy': 'breakout', 'time_stop': 128, 'use_sma': False, 'use_atr': False, 'use_adx': False, 'use_ema': False, 'use_spike': False, 'rsi_required': False, 'edge_k': 0.46451015847645927, 'edge_cap': 0.7826382171104702}.
[I 2025-08-29 22:20:12,622] Trial 367 finished with values: [-1000000000.0, 1000000000.0] and parameters: {'p_sma': 47, 'p_std': 37, 'p_atr': 7, 'p_adx': 24, 'rsi_period': 18, 'ema1': 6, 'ema2': 42, 'slip_atr_k': 0.11184506809703793, 'slip_spread_k': 0.16066002784569589, 'spread_hl_frac': 0.03532673557208431, 'bb_std_mult': 1.0983633767591083, 'rsi_os': 21, 'rsi_ob': 70, 'vol_spike': 0.22802182950294933, 'adx_thresh': 17.630373675509972, 'atr_min_pct': 0.004407712141782008, 'atr_max_pct': 0.05806701378078923, 'tp_mult': 1.5399634653730074, 'tsl_mult': 0.48818487014018586, 'strategy': 'mean_reversion', 'time_stop': 193, 'use_sma': False, 'use_atr': False, 'use_adx': False, 'use_ema': False, 'use_spike': False, 'rsi_required': False, 'edge_k': 1.6032202507413968, 'edge_cap': 0.4744846738088065}.
[I 2025-08-29 22:20:12,733] Trial 368 finished with values: [-1000000000.0, 1000000000.0] and parameters: {'p_sma': 47, 'p_std': 47, 'p_atr': 13, 'p_adx': 23, 'rsi_period': 7, 'ema1': 6, 'ema2': 42, 'slip_atr_k': 0.035236501221306, 'slip_spread_k': 0.3671830249385586, 'spread_hl_frac': 0.02813621767079348, 'bb_std_mult': 0.9665450989268298, 'rsi_os': 24, 'rsi_ob': 70, 'vol_spike': 0.05424308512263616, 'adx_thresh': 17.826450480445455, 'atr_min_pct': 0.028367532160749054, 'atr_max_pct': 0.05799453898892273, 'tp_mult': 1.7428032560784983, 'tsl_mult': 0.533355972532809, 'strategy': 'mean_reversion', 'time_stop': 269, 'use_sma': False, 'use_atr': False, 'use_adx': False, 'use_ema': False, 'use_spike': False, 'rsi_required': False, 'edge_k': 1.8180005836817363, 'edge_cap': 0.4767627018123187}.
[I 2025-08-29 22:20:13,033] Trial 369 finished with values: [-0.003198524491030197, 0.003178261404326871] and parameters: {'p_sma': 47, 'p_std': 17, 'p_atr': 21, 'p_adx': 27, 'rsi_period': 77, 'ema1': 6, 'ema2': 14, 'slip_atr_k': 0.16229104375609468, 'slip_spread_k': 0.26170967472408974, 'spread_hl_frac': 0.04490668089515264, 'bb_std_mult': 0.9601174282724462, 'rsi_os': 25, 'rsi_ob': 70, 'vol_spike': 0.10690372180340763, 'adx_thresh': 17.772538157607258, 'atr_min_pct': 0.0023872088266470165, 'atr_max_pct': 0.056773749790461694, 'tp_mult': 1.742959189463293, 'tsl_mult': 0.5285380144375308, 'strategy': 'mean_reversion', 'time_stop': 39, 'use_sma': False, 'use_atr': False, 'use_adx': False, 'use_ema': False, 'use_spike': False, 'rsi_required': False, 'edge_k': 1.8111499388117485, 'edge_cap': 0.46782967518297813}.
[I 2025-08-29 22:20:13,152] Trial 366 finished with values: [-1000000000.0, 1000000000.0] and parameters: {'p_sma': 45, 'p_std': 59, 'p_atr': 13, 'p_adx': 30, 'rsi_period': 54, 'ema1': 5, 'ema2': 11, 'slip_atr_k': 0.11263211490300692, 'slip_spread_k': 0.7443896307497665, 'spread_hl_frac': 0.033863012302756804, 'bb_std_mult': 1.0954773179215958, 'rsi_os': 25, 'rsi_ob': 86, 'vol_spike': 0.22132168435107555, 'adx_thresh': 17.68843014513809, 'atr_min_pct': 0.006464170423540921, 'atr_max_pct': 0.13658547750370312, 'tp_mult': 1.1090610476432938, 'tsl_mult': 0.4902401395470151, 'strategy': 'mean_reversion', 'time_stop': 112, 'use_sma': False, 'use_atr': False, 'use_adx': False, 'use_ema': False, 'use_spike': False, 'rsi_required': False, 'edge_k': 0.47889998215063906, 'edge_cap': 0.15114574776786538}.
[I 2025-08-29 22:20:39,910] Trial 371 finished with values: [-1000000000.0, 1000000000.0] and parameters: {'p_sma': 44, 'p_std': 26, 'p_atr': 21, 'p_adx': 21, 'rsi_period': 41, 'ema1': 7, 'ema2': 14, 'slip_atr_k': 0.029036232319706826, 'slip_spread_k': 0.25698602087791694, 'spread_hl_frac': 0.03931079515968726, 'bb_std_mult': 2.170448983485441, 'rsi_os': 25, 'rsi_ob': 80, 'vol_spike': 0.23560473115079006, 'adx_thresh': 24.18249288767737, 'atr_min_pct': 0.024656455928833435, 'atr_max_pct': 0.12820248347564428, 'tp_mult': 2.896763474223195, 'tsl_mult': 0.5103684071498368, 'strategy': 'mean_reversion', 'time_stop': 38, 'use_sma': False, 'use_atr': False, 'use_adx': False, 'use_ema': False, 'use_spike': False, 'rsi_required': False, 'edge_k': 0.6680206885214995, 'edge_cap': 0.509370173967326}.
[I 2025-08-29 22:20:40,061] Trial 373 finished with values: [-1000000000.0, 1000000000.0] and parameters: {'p_sma': 44, 'p_std': 10, 'p_atr': 29, 'p_adx': 21, 'rsi_period': 71, 'ema1': 7, 'ema2': 45, 'slip_atr_k': 0.07532541883580396, 'slip_spread_k': 0.7859188924784845, 'spread_hl_frac': 0.012152648487386045, 'bb_std_mult': 0.8570618976364763, 'rsi_os': 42, 'rsi_ob': 75, 'vol_spike': 0.23874913883578336, 'adx_thresh': 34.527305172289246, 'atr_min_pct': 0.00710423468029423, 'atr_max_pct': 0.08100660466468514, 'tp_mult': 2.8966750269187234, 'tsl_mult': 0.4096550451406904, 'strategy': 'breakout', 'time_stop': 101, 'use_sma': False, 'use_atr': False, 'use_adx': False, 'use_ema': False, 'use_spike': False, 'rsi_required': False, 'edge_k': 0.6397253017085714, 'edge_cap': 0.6490846270673054}.
[I 2025-08-29 22:20:40,150] Trial 370 finished with values: [-1000000000.0, 1000000000.0] and parameters: {'p_sma': 44, 'p_std': 39, 'p_atr': 21, 'p_adx': 21, 'rsi_period': 71, 'ema1': 7, 'ema2': 11, 'slip_atr_k': 0.07516636963632141, 'slip_spread_k': 0.45874160503724243, 'spread_hl_frac': 0.02123208337208711, 'bb_std_mult': 2.9983208159622716, 'rsi_os': 25, 'rsi_ob': 75, 'vol_spike': 0.23460206567048456, 'adx_thresh': 34.487011322516835, 'atr_min_pct': 0.0067027934813422875, 'atr_max_pct': 0.12785264914976666, 'tp_mult': 2.807404156231454, 'tsl_mult': 0.41360529744295355, 'strategy': 'mean_reversion', 'time_stop': 39, 'use_sma': False, 'use_atr': False, 'use_adx': False, 'use_ema': False, 'use_spike': False, 'rsi_required': False, 'edge_k': 0.35534034222811384, 'edge_cap': 0.4509507406366557}.
[I 2025-08-29 22:20:40,269] Trial 372 finished with values: [-1000000000.0, 1000000000.0] and parameters: {'p_sma': 35, 'p_std': 36, 'p_atr': 23, 'p_adx': 21, 'rsi_period': 36, 'ema1': 11, 'ema2': 45, 'slip_atr_k': 0.05634075452590516, 'slip_spread_k': 0.7889077344402511, 'spread_hl_frac': 0.04085911704761582, 'bb_std_mult': 0.8562291911260764, 'rsi_os': 25, 'rsi_ob': 74, 'vol_spike': 0.28725441506571775, 'adx_thresh': 18.751044377654594, 'atr_min_pct': 0.003086516151932099, 'atr_max_pct': 0.12820845580880824, 'tp_mult': 1.0831972390736837, 'tsl_mult': 0.4055329479715675, 'strategy': 'mean_reversion', 'time_stop': 60, 'use_sma': False, 'use_atr': False, 'use_adx': False, 'use_ema': False, 'use_spike': False, 'rsi_required': False, 'edge_k': 0.6808279972312619, 'edge_cap': 0.5057044680765741}.
[I 2025-08-29 22:20:40,444] Trial 374 finished with values: [-1000000000.0, 1000000000.0] and parameters: {'p_sma': 10, 'p_std': 39, 'p_atr': 22, 'p_adx': 23, 'rsi_period': 26, 'ema1': 7, 'ema2': 45, 'slip_atr_k': 0.07539629355654279, 'slip_spread_k': 0.05468961834351488, 'spread_hl_frac': 0.021072335820514317, 'bb_std_mult': 0.859580789184456, 'rsi_os': 41, 'rsi_ob': 47, 'vol_spike': 0.21435627505647248, 'adx_thresh': 13.147876702709699, 'atr_min_pct': 0.021533526977919226, 'atr_max_pct': 0.017574336080576146, 'tp_mult': 2.819362338374017, 'tsl_mult': 0.23661228989811584, 'strategy': 'breakout', 'time_stop': 101, 'use_sma': False, 'use_atr': False, 'use_adx': False, 'use_ema': False, 'use_spike': False, 'rsi_required': False, 'edge_k': 0.2922426103459712, 'edge_cap': 0.4487853920354195}.
[I 2025-08-29 22:21:07,456] Trial 376 finished with values: [-1000000000.0, 1000000000.0] and parameters: {'p_sma': 40, 'p_std': 14, 'p_atr': 22, 'p_adx': 22, 'rsi_period': 24, 'ema1': 29, 'ema2': 54, 'slip_atr_k': 0.017233471966193847, 'slip_spread_k': 0.04066051369292495, 'spread_hl_frac': 0.00139608289841903, 'bb_std_mult': 1.0030427073251602, 'rsi_os': 32, 'rsi_ob': 47, 'vol_spike': 0.20257835656169043, 'adx_thresh': 18.789664147852946, 'atr_min_pct': 0.0213640988448256, 'atr_max_pct': 0.02540060117423692, 'tp_mult': 2.8427881411037603, 'tsl_mult': 0.23519992687873797, 'strategy': 'breakout', 'time_stop': 101, 'use_sma': False, 'use_atr': False, 'use_adx': False, 'use_ema': False, 'use_spike': False, 'rsi_required': False, 'edge_k': 0.28876486913537497, 'edge_cap': 0.4891973043860137}.
[I 2025-08-29 22:21:07,960] Trial 377 finished with values: [-0.0040756353682649404, 0.0040637052618887745] and parameters: {'p_sma': 10, 'p_std': 34, 'p_atr': 22, 'p_adx': 23, 'rsi_period': 29, 'ema1': 5, 'ema2': 51, 'slip_atr_k': 0.015429838307390795, 'slip_spread_k': 0.7561861532380001, 'spread_hl_frac': 0.025697674379804542, 'bb_std_mult': 0.7311400253747298, 'rsi_os': 23, 'rsi_ob': 57, 'vol_spike': 0.21380114731952918, 'adx_thresh': 32.60799748269364, 'atr_min_pct': 0.0009204816117680417, 'atr_max_pct': 0.01649195869644504, 'tp_mult': 2.8439743659634114, 'tsl_mult': 0.45941310944480945, 'strategy': 'breakout', 'time_stop': 102, 'use_sma': False, 'use_atr': False, 'use_adx': False, 'use_ema': False, 'use_spike': False, 'rsi_required': False, 'edge_k': 0.2838226232035214, 'edge_cap': 0.1314092959319868}.
[I 2025-08-29 22:21:08,117] Trial 375 finished with values: [-1000000000.0, 1000000000.0] and parameters: {'p_sma': 35, 'p_std': 34, 'p_atr': 22, 'p_adx': 18, 'rsi_period': 27, 'ema1': 15, 'ema2': 60, 'slip_atr_k': 0.05498480710788346, 'slip_spread_k': 0.7585846142561491, 'spread_hl_frac': 0.021243421520222513, 'bb_std_mult': 0.736959603360317, 'rsi_os': 23, 'rsi_ob': 78, 'vol_spike': 0.2137389916034378, 'adx_thresh': 18.527298641335367, 'atr_min_pct': 0.003054431037126857, 'atr_max_pct': 0.09064989809521713, 'tp_mult': 2.8317630789813593, 'tsl_mult': 0.4606511932166272, 'strategy': 'mean_reversion', 'time_stop': 60, 'use_sma': False, 'use_atr': False, 'use_adx': False, 'use_ema': False, 'use_spike': False, 'rsi_required': False, 'edge_k': 0.29423957046932436, 'edge_cap': 0.23978806554176418}.
