[I 2025-08-29 22:47:34,175] Trial 622 finished with values: [-1000000000.0, 1000000000.0] and parameters: {'p_sma': 56, 'p_std': 12, 'p_atr': 16, 'p_adx': 12, 'rsi_period': 45, 'ema1': 30, 'ema2': 33, 'slip_atr_k': 4.289886726994605e-05, 'slip_spread_k': 0.34454318621452934, 'spread_hl_frac': 0.011732060338765338, 'bb_std_mult': 1.8746515528390915, 'rsi_os': 36, 'rsi_ob': 52, 'vol_spike': 0.25342359124855707, 'adx_thresh': 20.33515671452004, 'atr_min_pct': 0.017285556414577772, 'atr_max_pct': 0.07534591139576922, 'tp_mult': 1.8514153501143, 'tsl_mult': 0.6121734366956638, 'strategy': 'mean_reversion', 'time_stop': 283, 'use_sma': False, 'use_atr': False, 'use_adx': False, 'use_ema': False, 'use_spike': False, 'rsi_required': False, 'edge_k': 1.8825100286970189, 'edge_cap': 0.1877204672728066}.
[I 2025-08-29 22:47:34,279] Trial 621 finished with values: [-1000000000.0, 1000000000.0] and parameters: {'p_sma': 42, 'p_std': 18, 'p_atr': 12, 'p_adx': 12, 'rsi_period': 45, 'ema1': 29, 'ema2': 29, 'slip_atr_k': 0.2295917192314365, 'slip_spread_k': 0.16262818840429294, 'spread_hl_frac': 0.009866765624606673, 'bb_std_mult': 0.5599584400426396, 'rsi_os': 20, 'rsi_ob': 93, 'vol_spike': 0.25782084964108554, 'adx_thresh': 15.461176894188627, 'atr_min_pct': 0.023099766717875662, 'atr_max_pct': 0.06281423293166159, 'tp_mult': 1.8553638999384139, 'tsl_mult': 0.6519942135957678, 'strategy': 'mean_reversion', 'time_stop': 279, 'use_sma': False, 'use_atr': False, 'use_adx': False, 'use_ema': False, 'use_spike': False, 'rsi_required': False, 'edge_k': 1.8692756831420385, 'edge_cap': 0.19568607507662206}.
[I 2025-08-29 22:48:01,407] Trial 625 finished with values: [-1000000000.0, 1000000000.0] and parameters: {'p_sma': 15, 'p_std': 6, 'p_atr': 13, 'p_adx': 8, 'rsi_period': 13, 'ema1': 29, 'ema2': 28, 'slip_atr_k': 0.07897053470625032, 'slip_spread_k': 0.3165626274976429, 'spread_hl_frac': 0.010427084967278476, 'bb_std_mult': 2.0749149548712307, 'rsi_os': 20, 'rsi_ob': 63, 'vol_spike': 0.24032274535711529, 'adx_thresh': 21.48956938248627, 'atr_min_pct': 0.02023489672454411, 'atr_max_pct': 0.06861190256385685, 'tp_mult': 1.3692388476902904, 'tsl_mult': 0.6732855665399201, 'strategy': 'mean_reversion', 'time_stop': 270, 'use_sma': False, 'use_atr': False, 'use_adx': False, 'use_ema': False, 'use_spike': False, 'rsi_required': False, 'edge_k': 1.817035402154141, 'edge_cap': 0.6655105894876602}.
[I 2025-08-29 22:48:01,715] Trial 624 finished with values: [-1000000000.0, 1000000000.0] and parameters: {'p_sma': 42, 'p_std': 45, 'p_atr': 19, 'p_adx': 9, 'rsi_period': 81, 'ema1': 29, 'ema2': 31, 'slip_atr_k': 0.004088687320293019, 'slip_spread_k': 0.3403939358969702, 'spread_hl_frac': 0.011421863062155932, 'bb_std_mult': 1.9143391332575674, 'rsi_os': 43, 'rsi_ob': 90, 'vol_spike': 0.23714609014224097, 'adx_thresh': 21.310854678936437, 'atr_min_pct': 0.017695610324737803, 'atr_max_pct': 0.0756388148818919, 'tp_mult': 2.099076667225086, 'tsl_mult': 0.6812439191451838, 'strategy': 'mean_reversion', 'time_stop': 296, 'use_sma': False, 'use_atr': False, 'use_adx': False, 'use_ema': False, 'use_spike': False, 'rsi_required': False, 'edge_k': 1.9167726137167382, 'edge_cap': 0.8525543911029094}.
[I 2025-08-29 22:48:01,830] Trial 623 finished with values: [-1000000000.0, 1000000000.0] and parameters: {'p_sma': 55, 'p_std': 23, 'p_atr': 16, 'p_adx': 9, 'rsi_period': 48, 'ema1': 29, 'ema2': 28, 'slip_atr_k': 0.01509806973963096, 'slip_spread_k': 0.3516145772191299, 'spread_hl_frac': 0.01212851682434153, 'bb_std_mult': 1.9120781823780983, 'rsi_os': 36, 'rsi_ob': 90, 'vol_spike': 0.2378602379507913, 'adx_thresh': 18.91910857052351, 'atr_min_pct': 0.018534651304881758, 'atr_max_pct': 0.07487662003761061, 'tp_mult': 1.5592723882422657, 'tsl_mult': 0.6748839557929222, 'strategy': 'mean_reversion', 'time_stop': 297, 'use_sma': False, 'use_atr': False, 'use_adx': False, 'use_ema': False, 'use_spike': False, 'rsi_required': False, 'edge_k': 1.8958703208004968, 'edge_cap': 0.10511529471059947}.
[I 2025-08-29 22:48:01,971] Trial 626 finished with values: [-1000000000.0, 1000000000.0] and parameters: {'p_sma': 58, 'p_std': 47, 'p_atr': 13, 'p_adx': 11, 'rsi_period': 13, 'ema1': 29, 'ema2': 23, 'slip_atr_k': 0.1977821102005455, 'slip_spread_k': 0.23267853983545583, 'spread_hl_frac': 0.02716616922218541, 'bb_std_mult': 1.3805930900792323, 'rsi_os': 15, 'rsi_ob': 88, 'vol_spike': 0.23801286027491103, 'adx_thresh': 21.246495533069325, 'atr_min_pct': 0.018117786195125815, 'atr_max_pct': 0.06751467416648262, 'tp_mult': 2.194283621322249, 'tsl_mult': 0.6800778629498034, 'strategy': 'breakout', 'time_stop': 272, 'use_sma': False, 'use_atr': False, 'use_adx': False, 'use_ema': False, 'use_spike': False, 'rsi_required': False, 'edge_k': 1.8084679887030968, 'edge_cap': 0.1535096092291583}.
[I 2025-08-29 22:48:30,761] Trial 630 finished with values: [-1000000000.0, 1000000000.0] and parameters: {'p_sma': 30, 'p_std': 11, 'p_atr': 13, 'p_adx': 14, 'rsi_period': 11, 'ema1': 30, 'ema2': 24, 'slip_atr_k': 0.007821076663844158, 'slip_spread_k': 0.3764407456159953, 'spread_hl_frac': 0.010851427760420255, 'bb_std_mult': 1.4930931424565697, 'rsi_os': 18, 'rsi_ob': 61, 'vol_spike': 0.13209688649297066, 'adx_thresh': 22.393526811046208, 'atr_min_pct': 0.009895833168887364, 'atr_max_pct': 0.08054087180526133, 'tp_mult': 2.0757062886076443, 'tsl_mult': 0.610600652276045, 'strategy': 'breakout', 'time_stop': 286, 'use_sma': False, 'use_atr': False, 'use_adx': False, 'use_ema': False, 'use_spike': False, 'rsi_required': False, 'edge_k': 1.9647597996322426, 'edge_cap': 0.9414265970425952}.
[I 2025-08-29 22:48:31,094] Trial 627 finished with values: [-1000000000.0, 1000000000.0] and parameters: {'p_sma': 21, 'p_std': 9, 'p_atr': 19, 'p_adx': 9, 'rsi_period': 12, 'ema1': 29, 'ema2': 19, 'slip_atr_k': 0.016907069511095683, 'slip_spread_k': 0.22369775169656358, 'spread_hl_frac': 0.012073958437915434, 'bb_std_mult': 1.4591305025086019, 'rsi_os': 35, 'rsi_ob': 85, 'vol_spike': 0.062394101433150675, 'adx_thresh': 22.24359137811434, 'atr_min_pct': 0.0074359823526585055, 'atr_max_pct': 0.08162397324447253, 'tp_mult': 1.536159303673508, 'tsl_mult': 0.6051966290397855, 'strategy': 'breakout', 'time_stop': 298, 'use_sma': False, 'use_atr': False, 'use_adx': False, 'use_ema': False, 'use_spike': False, 'rsi_required': False, 'edge_k': 1.9517711850382327, 'edge_cap': 0.17506804444649554}.
[I 2025-08-29 22:48:31,105] Trial 628 finished with values: [-1000000000.0, 1000000000.0] and parameters: {'p_sma': 17, 'p_std': 9, 'p_atr': 13, 'p_adx': 14, 'rsi_period': 11, 'ema1': 30, 'ema2': 23, 'slip_atr_k': 0.012435012518602767, 'slip_spread_k': 0.230980507558723, 'spread_hl_frac': 0.013672640661834465, 'bb_std_mult': 1.5037427309387044, 'rsi_os': 15, 'rsi_ob': 61, 'vol_spike': 0.2585167608790242, 'adx_thresh': 22.479136479000285, 'atr_min_pct': 0.013585702012119531, 'atr_max_pct': 0.0796412959095977, 'tp_mult': 2.438536149575396, 'tsl_mult': 0.5995814346098355, 'strategy': 'breakout', 'time_stop': 300, 'use_sma': False, 'use_atr': False, 'use_adx': False, 'use_ema': False, 'use_spike': False, 'rsi_required': False, 'edge_k': 1.9544812086517642, 'edge_cap': 0.9527514749587496}.
[I 2025-08-29 22:48:31,178] Trial 629 finished with values: [-1000000000.0, 1000000000.0] and parameters: {'p_sma': 21, 'p_std': 10, 'p_atr': 13, 'p_adx': 14, 'rsi_period': 72, 'ema1': 30, 'ema2': 20, 'slip_atr_k': 0.1788622018696808, 'slip_spread_k': 0.23018682119526765, 'spread_hl_frac': 0.010953678474187609, 'bb_std_mult': 1.5209201101225265, 'rsi_os': 14, 'rsi_ob': 61, 'vol_spike': 0.06281977618644413, 'adx_thresh': 22.085305610052917, 'atr_min_pct': 0.007198557193197671, 'atr_max_pct': 0.06824321835602587, 'tp_mult': 2.1316815783393532, 'tsl_mult': 0.607905489477061, 'strategy': 'breakout', 'time_stop': 273, 'use_sma': False, 'use_atr': False, 'use_adx': False, 'use_ema': False, 'use_spike': False, 'rsi_required': False, 'edge_k': 1.955905956096499, 'edge_cap': 0.1527009260170054}.
[I 2025-08-29 22:48:58,221] Trial 631 finished with values: [-1000000000.0, 1000000000.0] and parameters: {'p_sma': 22, 'p_std': 9, 'p_atr': 15, 'p_adx': 13, 'rsi_period': 42, 'ema1': 30, 'ema2': 20, 'slip_atr_k': 0.21744587182687553, 'slip_spread_k': 0.28498925331301034, 'spread_hl_frac': 0.003258876753758414, 'bb_std_mult': 1.2504369543395075, 'rsi_os': 35, 'rsi_ob': 62, 'vol_spike': 0.0007992663278464096, 'adx_thresh': 7.90487588196285, 'atr_min_pct': 0.007676787435945067, 'atr_max_pct': 0.061559035013917754, 'tp_mult': 2.1337843024176815, 'tsl_mult': 0.6028287877624823, 'strategy': 'mean_reversion', 'time_stop': 5, 'use_sma': False, 'use_atr': False, 'use_adx': False, 'use_ema': False, 'use_spike': False, 'rsi_required': False, 'edge_k': 1.950641369159738, 'edge_cap': 0.1579968316699776}.
[I 2025-08-29 22:48:58,967] Trial 634 finished with values: [-1000000000.0, 1000000000.0] and parameters: {'p_sma': 24, 'p_std': 58, 'p_atr': 12, 'p_adx': 13, 'rsi_period': 55, 'ema1': 30, 'ema2': 21, 'slip_atr_k': 0.21687083172112176, 'slip_spread_k': 0.2811636980441096, 'spread_hl_frac': 0.014352718815838036, 'bb_std_mult': 2.3113916413352262, 'rsi_os': 46, 'rsi_ob': 62, 'vol_spike': 0.24864717773086437, 'adx_thresh': 20.779000483758246, 'atr_min_pct': 0.004899120385290086, 'atr_max_pct': 0.05955594677071728, 'tp_mult': 2.001463091482458, 'tsl_mult': 0.6309101683929382, 'strategy': 'mean_reversion', 'time_stop': 285, 'use_sma': False, 'use_atr': False, 'use_adx': False, 'use_ema': False, 'use_spike': False, 'rsi_required': False, 'edge_k': 1.909695196859769, 'edge_cap': 0.997523088225378}.
[I 2025-08-29 22:48:59,059] Trial 632 finished with values: [-1000000000.0, 1000000000.0] and parameters: {'p_sma': 26, 'p_std': 58, 'p_atr': 12, 'p_adx': 11, 'rsi_period': 56, 'ema1': 30, 'ema2': 20, 'slip_atr_k': 0.00412693200578804, 'slip_spread_k': 0.31791335342824684, 'spread_hl_frac': 0.0034808398206275896, 'bb_std_mult': 1.2504377156146562, 'rsi_os': 41, 'rsi_ob': 62, 'vol_spike': 0.10854260535201815, 'adx_thresh': 9.725892687161492, 'atr_min_pct': 0.027405640475744265, 'atr_max_pct': 0.09114419122144907, 'tp_mult': 2.1336430332446836, 'tsl_mult': 0.6294955530887439, 'strategy': 'mean_reversion', 'time_stop': 275, 'use_sma': False, 'use_atr': False, 'use_adx': False, 'use_ema': False, 'use_spike': False, 'rsi_required': False, 'edge_k': 1.9176558690485586, 'edge_cap': 0.8188713719378882}.
[I 2025-08-29 22:48:59,196] Trial 633 finished with values: [-1000000000.0, 1000000000.0] and parameters: {'p_sma': 26, 'p_std': 21, 'p_atr': 12, 'p_adx': 13, 'rsi_period': 10, 'ema1': 30, 'ema2': 25, 'slip_atr_k': 0.004984374368316215, 'slip_spread_k': 0.28366144844848007, 'spread_hl_frac': 0.03066020684809621, 'bb_std_mult': 1.744336670655215, 'rsi_os': 5, 'rsi_ob': 62, 'vol_spike': 0.08300546671258713, 'adx_thresh': 9.720743830641842, 'atr_min_pct': 0.00784985076485038, 'atr_max_pct': 0.06151037850803042, 'tp_mult': 1.4386761899677123, 'tsl_mult': 0.6179186909406721, 'strategy': 'mean_reversion', 'time_stop': 275, 'use_sma': False, 'use_atr': False, 'use_adx': False, 'use_ema': False, 'use_spike': False, 'rsi_required': False, 'edge_k': 1.9263776019881302, 'edge_cap': 0.16894467261361867}.
[I 2025-08-29 22:48:59,417] Trial 636 finished with values: [-1000000000.0, 1000000000.0] and parameters: {'p_sma': 27, 'p_std': 12, 'p_atr': 25, 'p_adx': 18, 'rsi_period': 10, 'ema1': 30, 'ema2': 23, 'slip_atr_k': 0.0044297525791970015, 'slip_spread_k': 0.3131774150497954, 'spread_hl_frac': 0.024725866841949468, 'bb_std_mult': 1.7767329475307196, 'rsi_os': 50, 'rsi_ob': 64, 'vol_spike': 0.19635636060462258, 'adx_thresh': 20.775404209432388, 'atr_min_pct': 0.00018149480158510638, 'atr_max_pct': 0.07141349378875365, 'tp_mult': 1.429158616154275, 'tsl_mult': 0.6574368175747892, 'strategy': 'mean_reversion', 'time_stop': 132, 'use_sma': False, 'use_atr': False, 'use_adx': False, 'use_ema': False, 'use_spike': False, 'rsi_required': False, 'edge_k': 1.9983521247057787, 'edge_cap': 0.06330018525472803}.
[I 2025-08-29 22:48:59,533] Trial 639 finished with values: [-1000000000.0, 1000000000.0] and parameters: {'p_sma': 29, 'p_std': 56, 'p_atr': 17, 'p_adx': 11, 'rsi_period': 84, 'ema1': 29, 'ema2': 17, 'slip_atr_k': 0.009816984788076443, 'slip_spread_k': 0.4073546122202803, 'spread_hl_frac': 0.00953579308368402, 'bb_std_mult': 0.609433642647923, 'rsi_os': 34, 'rsi_ob': 45, 'vol_spike': 0.10124689599037706, 'adx_thresh': 21.124908038967952, 'atr_min_pct': 0.011415202128245403, 'atr_max_pct': 0.06532805581790357, 'tp_mult': 1.805482679133548, 'tsl_mult': 0.6575785324752896, 'strategy': 'mean_reversion', 'time_stop': 291, 'use_sma': False, 'use_atr': False, 'use_adx': False, 'use_ema': False, 'use_spike': False, 'rsi_required': False, 'edge_k': 1.8383666824469036, 'edge_cap': 0.2057184870281472}.
[I 2025-08-29 22:49:25,770] Trial 637 finished with values: [-0.04203048514086172, 0.042025482245483796] and parameters: {'p_sma': 27, 'p_std': 12, 'p_atr': 14, 'p_adx': 11, 'rsi_period': 14, 'ema1': 29, 'ema2': 25, 'slip_atr_k': 0.004699649948875389, 'slip_spread_k': 0.19864154631882602, 'spread_hl_frac': 0.03106004576051764, 'bb_std_mult': 0.6891877039858723, 'rsi_os': 34, 'rsi_ob': 63, 'vol_spike': 0.08497330558554078, 'adx_thresh': 26.423728638022816, 'atr_min_pct': 0.0003788573836601833, 'atr_max_pct': 0.07207266441529762, 'tp_mult': 1.7921768074122773, 'tsl_mult': 0.655649463578189, 'strategy': 'mean_reversion', 'time_stop': 284, 'use_sma': False, 'use_atr': False, 'use_adx': False, 'use_ema': False, 'use_spike': False, 'rsi_required': False, 'edge_k': 1.9208929772590735, 'edge_cap': 0.10781161749508532}.
[I 2025-08-29 22:49:26,268] Trial 635 finished with values: [-1000000000.0, 1000000000.0] and parameters: {'p_sma': 27, 'p_std': 12, 'p_atr': 12, 'p_adx': 13, 'rsi_period': 54, 'ema1': 30, 'ema2': 25, 'slip_atr_k': 0.11129983466526724, 'slip_spread_k': 0.41884328167437435, 'spread_hl_frac': 0.00022747413398564037, 'bb_std_mult': 1.7453116733600278, 'rsi_os': 5, 'rsi_ob': 63, 'vol_spike': 0.11660011003295784, 'adx_thresh': 20.737822771027915, 'atr_min_pct': 0.011585338783370798, 'atr_max_pct': 0.0924918899045526, 'tp_mult': 1.9896421869877001, 'tsl_mult': 0.6558119611147732, 'strategy': 'mean_reversion', 'time_stop': 284, 'use_sma': False, 'use_atr': False, 'use_adx': False, 'use_ema': False, 'use_spike': False, 'rsi_required': False, 'edge_k': 1.9137223541351311, 'edge_cap': 0.6448100509801851}.
[I 2025-08-29 22:49:26,287] Trial 638 finished with values: [-0.040767188379714936, 0.04075795398685971] and parameters: {'p_sma': 28, 'p_std': 14, 'p_atr': 29, 'p_adx': 18, 'rsi_period': 14, 'ema1': 29, 'ema2': 17, 'slip_atr_k': 0.009544333737129691, 'slip_spread_k': 0.2037894562331019, 'spread_hl_frac': 0.009413639360233286, 'bb_std_mult': 0.6345439626850327, 'rsi_os': 34, 'rsi_ob': 64, 'vol_spike': 0.19367208948151746, 'adx_thresh': 20.90985724154486, 'atr_min_pct': 0.0002145603218757907, 'atr_max_pct': 0.07218345680097617, 'tp_mult': 1.8916197244728679, 'tsl_mult': 0.659163471639061, 'strategy': 'mean_reversion', 'time_stop': 291, 'use_sma': False, 'use_atr': False, 'use_adx': False, 'use_ema': False, 'use_spike': False, 'rsi_required': False, 'edge_k': 1.993665510304821, 'edge_cap': 0.062408945365598656}.
[I 2025-08-29 22:49:27,083] Trial 640 finished with values: [-1000000000.0, 1000000000.0] and parameters: {'p_sma': 59, 'p_std': 13, 'p_atr': 29, 'p_adx': 10, 'rsi_period': 53, 'ema1': 29, 'ema2': 27, 'slip_atr_k': 0.11010009645119921, 'slip_spread_k': 0.3894825397138523, 'spread_hl_frac': 0.0412525490447207, 'bb_std_mult': 0.7141443817884194, 'rsi_os': 47, 'rsi_ob': 94, 'vol_spike': 0.11692770350482191, 'adx_thresh': 18.73701584354567, 'atr_min_pct': 0.008823336795848787, 'atr_max_pct': 0.07707982429758799, 'tp_mult': 1.9028255082996668, 'tsl_mult': 0.6358788493393775, 'strategy': 'mean_reversion', 'time_stop': 287, 'use_sma': False, 'use_atr': False, 'use_adx': False, 'use_ema': False, 'use_spike': False, 'rsi_required': False, 'edge_k': 1.8949735305316877, 'edge_cap': 0.900357697762581}.
[I 2025-08-29 22:49:27,275] Trial 643 finished with values: [-1000000000.0, 1000000000.0] and parameters: {'p_sma': 19, 'p_std': 14, 'p_atr': 15, 'p_adx': 10, 'rsi_period': 12, 'ema1': 30, 'ema2': 22, 'slip_atr_k': 0.005030265935962034, 'slip_spread_k': 0.3869926445661954, 'spread_hl_frac': 0.049536286233591915, 'bb_std_mult': 1.6624864394212098, 'rsi_os': 37, 'rsi_ob': 50, 'vol_spike': 0.25962254179513855, 'adx_thresh': 20.18366309374617, 'atr_min_pct': 0.02158473235177254, 'atr_max_pct': 0.07685354892815541, 'tp_mult': 1.9224563657921738, 'tsl_mult': 0.6303804151732455, 'strategy': 'mean_reversion', 'time_stop': 281, 'use_sma': False, 'use_atr': False, 'use_adx': False, 'use_ema': False, 'use_spike': False, 'rsi_required': False, 'edge_k': 1.960293484296324, 'edge_cap': 0.8724999772273991}.
[I 2025-08-29 22:49:54,478] Trial 641 finished with values: [-1000000000.0, 1000000000.0] and parameters: {'p_sma': 30, 'p_std': 14, 'p_atr': 30, 'p_adx': 17, 'rsi_period': 12, 'ema1': 30, 'ema2': 34, 'slip_atr_k': 0.11260367941116708, 'slip_spread_k': 0.2603723032594624, 'spread_hl_frac': 0.012108940763451188, 'bb_std_mult': 2.5370833451499766, 'rsi_os': 33, 'rsi_ob': 65, 'vol_spike': 0.1435743597064961, 'adx_thresh': 5.672409890769712, 'atr_min_pct': 0.024151329091817844, 'atr_max_pct': 0.07791019238156156, 'tp_mult': 1.1457637310879933, 'tsl_mult': 0.627696299981218, 'strategy': 'mean_reversion', 'time_stop': 286, 'use_sma': False, 'use_atr': False, 'use_adx': False, 'use_ema': False, 'use_spike': False, 'rsi_required': False, 'edge_k': 1.9953082640296502, 'edge_cap': 0.9029319788485605}.
[I 2025-08-29 22:49:54,511] Trial 644 finished with values: [-1000000000.0, 1000000000.0] and parameters: {'p_sma': 30, 'p_std': 15, 'p_atr': 16, 'p_adx': 17, 'rsi_period': 39, 'ema1': 30, 'ema2': 19, 'slip_atr_k': 0.1621851586247048, 'slip_spread_k': 0.3334785895148715, 'spread_hl_frac': 0.012064228123647384, 'bb_std_mult': 1.3347885790627962, 'rsi_os': 37, 'rsi_ob': 65, 'vol_spike': 0.1487811529722524, 'adx_thresh': 21.782579099234503, 'atr_min_pct': 0.012708411980040978, 'atr_max_pct': 0.049975167545493124, 'tp_mult': 2.363397541142016, 'tsl_mult': 0.6239078266628193, 'strategy': 'mean_reversion', 'time_stop': 279, 'use_sma': False, 'use_atr': False, 'use_adx': False, 'use_ema': False, 'use_spike': False, 'rsi_required': False, 'edge_k': 1.9581639286655954, 'edge_cap': 0.6909131849127005}.
[I 2025-08-29 22:49:54,699] Trial 642 finished with values: [-1000000000.0, 1000000000.0] and parameters: {'p_sma': 25, 'p_std': 14, 'p_atr': 30, 'p_adx': 15, 'rsi_period': 13, 'ema1': 29, 'ema2': 31, 'slip_atr_k': 0.009556754237222376, 'slip_spread_k': 0.2633365013571114, 'spread_hl_frac': 0.0492429756297849, 'bb_std_mult': 2.490840153848037, 'rsi_os': 38, 'rsi_ob': 65, 'vol_spike': 0.1497624887530719, 'adx_thresh': 6.9777355631770295, 'atr_min_pct': 0.02161420835178749, 'atr_max_pct': 0.0776453667942687, 'tp_mult': 1.9103728442151107, 'tsl_mult': 0.6274220512219093, 'strategy': 'mean_reversion', 'time_stop': 292, 'use_sma': False, 'use_atr': False, 'use_adx': False, 'use_ema': False, 'use_spike': False, 'rsi_required': False, 'edge_k': 1.9635073165911134, 'edge_cap': 0.1335127530042069}.
[I 2025-08-29 22:49:54,892] Trial 645 finished with values: [-1000000000.0, 1000000000.0] and parameters: {'p_sma': 30, 'p_std': 53, 'p_atr': 14, 'p_adx': 15, 'rsi_period': 16, 'ema1': 30, 'ema2': 35, 'slip_atr_k': 0.00028361349947298565, 'slip_spread_k': 0.25829944224838863, 'spread_hl_frac': 0.02301283829158818, 'bb_std_mult': 2.145260489279715, 'rsi_os': 37, 'rsi_ob': 61, 'vol_spike': 0.140543666928402, 'adx_thresh': 21.6446957179937, 'atr_min_pct': 0.01033639845314685, 'atr_max_pct': 0.05116850441217236, 'tp_mult': 1.126680130745097, 'tsl_mult': 0.6028120265818646, 'strategy': 'breakout', 'time_stop': 277, 'use_sma': False, 'use_atr': False, 'use_adx': False, 'use_ema': False, 'use_spike': False, 'rsi_required': False, 'edge_k': 1.9643639246400526, 'edge_cap': 0.2038932132435208}.
[I 2025-08-29 22:50:22,470] Trial 648 finished with values: [-1000000000.0, 1000000000.0] and parameters: {'p_sma': 54, 'p_std': 11, 'p_atr': 13, 'p_adx': 15, 'rsi_period': 77, 'ema1': 28, 'ema2': 26, 'slip_atr_k': 0.08652376377454168, 'slip_spread_k': 0.2957742929542747, 'spread_hl_frac': 0.028977888276083545, 'bb_std_mult': 2.153035228491123, 'rsi_os': 33, 'rsi_ob': 61, 'vol_spike': 0.25006929841031794, 'adx_thresh': 14.281823790525232, 'atr_min_pct': 0.005875121953276424, 'atr_max_pct': 0.06874287030365428, 'tp_mult': 1.0352925436960208, 'tsl_mult': 0.6103351961766121, 'strategy': 'breakout', 'time_stop': 270, 'use_sma': False, 'use_atr': False, 'use_adx': False, 'use_ema': False, 'use_spike': False, 'rsi_required': False, 'edge_k': 1.8875202509155726, 'edge_cap': 0.20177082712589134}.
[I 2025-08-29 22:50:22,507] Trial 646 finished with values: [-1000000000.0, 1000000000.0] and parameters: {'p_sma': 54, 'p_std': 54, 'p_atr': 13, 'p_adx': 15, 'rsi_period': 16, 'ema1': 30, 'ema2': 31, 'slip_atr_k': 0.24000923798983656, 'slip_spread_k': 0.2985629093223125, 'spread_hl_frac': 0.021560923167267744, 'bb_std_mult': 2.0342106570862333, 'rsi_os': 51, 'rsi_ob': 61, 'vol_spike': 0.24523561298961735, 'adx_thresh': 11.666940659335495, 'atr_min_pct': 0.006724337647780073, 'atr_max_pct': 0.06624435227125662, 'tp_mult': 1.6602847929402165, 'tsl_mult': 0.6186141686569213, 'strategy': 'breakout', 'time_stop': 269, 'use_sma': False, 'use_atr': False, 'use_adx': False, 'use_ema': False, 'use_spike': False, 'rsi_required': False, 'edge_k': 1.8257304678990776, 'edge_cap': 0.13569011489097285}.
