[I 2025-08-29 22:12:52,469] Trial 295 finished with values: [-1000000000.0, 1000000000.0] and parameters: {'p_sma': 19, 'p_std': 37, 'p_atr': 28, 'p_adx': 23, 'rsi_period': 49, 'ema1': 18, 'ema2': 42, 'slip_atr_k': 0.10355984411471048, 'slip_spread_k': 0.7150883250746669, 'spread_hl_frac': 0.04994249116536591, 'bb_std_mult': 1.0711465581037611, 'rsi_os': 5, 'rsi_ob': 73, 'vol_spike': 0.21426648372810372, 'adx_thresh': 33.826609774403636, 'atr_min_pct': 0.014480503986329947, 'atr_max_pct': 0.1163526741617361, 'tp_mult': 1.421990075792218, 'tsl_mult': 0.2591992392849285, 'strategy': 'mean_reversion', 'time_stop': 145, 'use_sma': False, 'use_atr': False, 'use_adx': False, 'use_ema': False, 'use_spike': False, 'rsi_required': False, 'edge_k': 0.48391282509334343, 'edge_cap': 0.47533812039356654}.
[I 2025-08-29 22:12:52,601] Trial 298 finished with values: [-1000000000.0, 1000000000.0] and parameters: {'p_sma': 46, 'p_std': 37, 'p_atr': 23, 'p_adx': 21, 'rsi_period': 24, 'ema1': 18, 'ema2': 10, 'slip_atr_k': 0.10637110604506017, 'slip_spread_k': 0.7471934448066346, 'spread_hl_frac': 0.037189593940007, 'bb_std_mult': 2.574456314934345, 'rsi_os': 52, 'rsi_ob': 76, 'vol_spike': 0.215477416432747, 'adx_thresh': 34.44711020994375, 'atr_min_pct': 0.003613931745680396, 'atr_max_pct': 0.10610121249184656, 'tp_mult': 2.8510317812981376, 'tsl_mult': 0.26088741532743887, 'strategy': 'breakout', 'time_stop': 192, 'use_sma': False, 'use_atr': False, 'use_adx': False, 'use_ema': False, 'use_spike': False, 'rsi_required': False, 'edge_k': 0.29190135255293315, 'edge_cap': 0.45020195491268544}.
[I 2025-08-29 22:13:19,135] Trial 300 finished with values: [-1000000000.0, 1000000000.0] and parameters: {'p_sma': 15, 'p_std': 48, 'p_atr': 20, 'p_adx': 15, 'rsi_period': 23, 'ema1': 5, 'ema2': 10, 'slip_atr_k': 0.03836685682547187, 'slip_spread_k': 0.745871392060453, 'spread_hl_frac': 0.03751084307113765, 'bb_std_mult': 0.9912561744769933, 'rsi_os': 22, 'rsi_ob': 81, 'vol_spike': 0.23231114122442909, 'adx_thresh': 34.39183430281231, 'atr_min_pct': 0.01708858588818275, 'atr_max_pct': 0.1257567592825678, 'tp_mult': 1.5326936687250265, 'tsl_mult': 0.38777991119778593, 'strategy': 'mean_reversion', 'time_stop': 98, 'use_sma': False, 'use_atr': False, 'use_adx': False, 'use_ema': False, 'use_spike': False, 'rsi_required': False, 'edge_k': 0.19657403834044862, 'edge_cap': 0.6544682221818299}.
[I 2025-08-29 22:13:19,468] Trial 299 finished with values: [-1000000000.0, 1000000000.0] and parameters: {'p_sma': 18, 'p_std': 48, 'p_atr': 15, 'p_adx': 21, 'rsi_period': 24, 'ema1': 5, 'ema2': 10, 'slip_atr_k': 0.03973556715017941, 'slip_spread_k': 0.3591080762637729, 'spread_hl_frac': 0.03348611308982237, 'bb_std_mult': 0.6847273923657455, 'rsi_os': 46, 'rsi_ob': 78, 'vol_spike': 0.23318067835430517, 'adx_thresh': 34.344252436738756, 'atr_min_pct': 0.0035370625801033773, 'atr_max_pct': 0.1252388155891332, 'tp_mult': 2.197844863168372, 'tsl_mult': 0.21724385794481282, 'strategy': 'breakout', 'time_stop': 78, 'use_sma': False, 'use_atr': False, 'use_adx': False, 'use_ema': False, 'use_spike': False, 'rsi_required': False, 'edge_k': 0.2070833371841464, 'edge_cap': 0.3315953124868857}.
[I 2025-08-29 22:13:19,612] Trial 302 finished with values: [-1000000000.0, 1000000000.0] and parameters: {'p_sma': 41, 'p_std': 36, 'p_atr': 21, 'p_adx': 24, 'rsi_period': 28, 'ema1': 5, 'ema2': 11, 'slip_atr_k': 0.03992165405762891, 'slip_spread_k': 0.7915394307106718, 'spread_hl_frac': 0.0047161381361643905, 'bb_std_mult': 0.9754107746781173, 'rsi_os': 25, 'rsi_ob': 81, 'vol_spike': 0.12918327143736472, 'adx_thresh': 19.131089434176555, 'atr_min_pct': 0.0038573917816108576, 'atr_max_pct': 0.12547289869797135, 'tp_mult': 2.9544876844270997, 'tsl_mult': 0.4431297336654483, 'strategy': 'mean_reversion', 'time_stop': 83, 'use_sma': False, 'use_atr': False, 'use_adx': False, 'use_ema': False, 'use_spike': False, 'rsi_required': False, 'edge_k': 0.36929934900559014, 'edge_cap': 0.4070993638700062}.
[I 2025-08-29 22:13:19,689] Trial 301 finished with values: [-1000000000.0, 1000000000.0] and parameters: {'p_sma': 47, 'p_std': 49, 'p_atr': 20, 'p_adx': 15, 'rsi_period': 23, 'ema1': 13, 'ema2': 10, 'slip_atr_k': 0.03906686407960696, 'slip_spread_k': 0.7436911423900385, 'spread_hl_frac': 0.004769001431993498, 'bb_std_mult': 1.9505036945711491, 'rsi_os': 22, 'rsi_ob': 78, 'vol_spike': 0.2308458811526877, 'adx_thresh': 24.581789357120947, 'atr_min_pct': 0.016695233001126894, 'atr_max_pct': 0.10662740638760246, 'tp_mult': 2.8572913485495754, 'tsl_mult': 0.48535953828627987, 'strategy': 'breakout', 'time_stop': 97, 'use_sma': False, 'use_atr': False, 'use_adx': False, 'use_ema': False, 'use_spike': False, 'rsi_required': False, 'edge_k': 0.28866388280608735, 'edge_cap': 0.3231813879311598}.
[I 2025-08-29 22:13:19,872] Trial 303 finished with values: [-1000000000.0, 1000000000.0] and parameters: {'p_sma': 48, 'p_std': 36, 'p_atr': 15, 'p_adx': 25, 'rsi_period': 28, 'ema1': 6, 'ema2': 50, 'slip_atr_k': 0.041933040611780506, 'slip_spread_k': 0.054260219174268154, 'spread_hl_frac': 0.03956090013747149, 'bb_std_mult': 0.9039974672480278, 'rsi_os': 50, 'rsi_ob': 78, 'vol_spike': 0.13719324981821202, 'adx_thresh': 8.558794101389388, 'atr_min_pct': 0.006213892082031474, 'atr_max_pct': 0.1238771701146041, 'tp_mult': 1.4871446768873022, 'tsl_mult': 0.6271195550024158, 'strategy': 'mean_reversion', 'time_stop': 76, 'use_sma': False, 'use_atr': False, 'use_adx': False, 'use_ema': False, 'use_spike': False, 'rsi_required': False, 'edge_k': 0.36858650296839, 'edge_cap': 0.32811308566038677}.
[I 2025-08-29 22:13:19,883] Trial 304 finished with values: [-1000000000.0, 1000000000.0] and parameters: {'p_sma': 47, 'p_std': 36, 'p_atr': 16, 'p_adx': 25, 'rsi_period': 28, 'ema1': 6, 'ema2': 12, 'slip_atr_k': 0.030233798546832835, 'slip_spread_k': 0.7945930831471932, 'spread_hl_frac': 0.035761696034164264, 'bb_std_mult': 3.592691168801667, 'rsi_os': 50, 'rsi_ob': 78, 'vol_spike': 0.2641864641188515, 'adx_thresh': 8.463550346937192, 'atr_min_pct': 0.007394681708142241, 'atr_max_pct': 0.1355817393541332, 'tp_mult': 2.285769374323548, 'tsl_mult': 0.10500583325861124, 'strategy': 'mean_reversion', 'time_stop': 87, 'use_sma': False, 'use_atr': False, 'use_adx': False, 'use_ema': False, 'use_spike': False, 'rsi_required': False, 'edge_k': 0.36703892334363747, 'edge_cap': 0.5437476913009343}.
[I 2025-08-29 22:13:45,880] Trial 305 finished with values: [-0.0053494354475372985, 0.0053335329466430575] and parameters: {'p_sma': 47, 'p_std': 34, 'p_atr': 21, 'p_adx': 22, 'rsi_period': 35, 'ema1': 6, 'ema2': 52, 'slip_atr_k': 0.03006175713993673, 'slip_spread_k': 0.7745203170415693, 'spread_hl_frac': 0.03571606000311005, 'bb_std_mult': 3.175608773595105, 'rsi_os': 23, 'rsi_ob': 61, 'vol_spike': 0.20942590079108098, 'adx_thresh': 6.045912972944807, 'atr_min_pct': 0.0005360742464649448, 'atr_max_pct': 0.09326556196447272, 'tp_mult': 1.4898388318568587, 'tsl_mult': 0.6272137814988179, 'strategy': 'mean_reversion', 'time_stop': 94, 'use_sma': False, 'use_atr': False, 'use_adx': False, 'use_ema': False, 'use_spike': False, 'rsi_required': False, 'edge_k': 0.4169011234496325, 'edge_cap': 0.19247465886650567}.
[I 2025-08-29 22:13:46,612] Trial 306 finished with values: [-0.011739063228800806, 0.011749076096223901] and parameters: {'p_sma': 48, 'p_std': 9, 'p_atr': 26, 'p_adx': 22, 'rsi_period': 25, 'ema1': 6, 'ema2': 28, 'slip_atr_k': 0.030596789625622553, 'slip_spread_k': 0.7733487201173409, 'spread_hl_frac': 0.035633851934626586, 'bb_std_mult': 0.8861141195062178, 'rsi_os': 26, 'rsi_ob': 61, 'vol_spike': 0.11387513474494158, 'adx_thresh': 20.547561517485153, 'atr_min_pct': 3.126992395468663e-05, 'atr_max_pct': 0.12147374882416379, 'tp_mult': 2.7797670028599417, 'tsl_mult': 0.6236613831664688, 'strategy': 'mean_reversion', 'time_stop': 182, 'use_sma': False, 'use_atr': False, 'use_adx': False, 'use_ema': False, 'use_spike': False, 'rsi_required': False, 'edge_k': 0.39930713368935095, 'edge_cap': 0.4575714495518336}.
[I 2025-08-29 22:13:46,613] Trial 308 finished with values: [-0.006505054324804638, 0.006583485585737608] and parameters: {'p_sma': 10, 'p_std': 9, 'p_atr': 17, 'p_adx': 28, 'rsi_period': 26, 'ema1': 7, 'ema2': 13, 'slip_atr_k': 0.03471872691518782, 'slip_spread_k': 0.41902151855539516, 'spread_hl_frac': 0.019219927075849404, 'bb_std_mult': 0.774979461516013, 'rsi_os': 23, 'rsi_ob': 87, 'vol_spike': 0.208376039839279, 'adx_thresh': 12.752530578145606, 'atr_min_pct': 0.0006047131046610095, 'atr_max_pct': 0.05975032414122723, 'tp_mult': 2.7777748509837994, 'tsl_mult': 0.5302207749030612, 'strategy': 'mean_reversion', 'time_stop': 63, 'use_sma': False, 'use_atr': False, 'use_adx': False, 'use_ema': False, 'use_spike': False, 'rsi_required': False, 'edge_k': 0.4217285245528865, 'edge_cap': 0.5005853053053662}.
[I 2025-08-29 22:13:46,749] Trial 307 finished with values: [-0.036476312631858465, 0.03646407304346258] and parameters: {'p_sma': 50, 'p_std': 34, 'p_atr': 17, 'p_adx': 22, 'rsi_period': 25, 'ema1': 6, 'ema2': 17, 'slip_atr_k': 0.16432663817483384, 'slip_spread_k': 0.7691977762033595, 'spread_hl_frac': 0.03557258695499768, 'bb_std_mult': 3.1618991064997273, 'rsi_os': 35, 'rsi_ob': 71, 'vol_spike': 0.031840118636192356, 'adx_thresh': 5.800061853303145, 'atr_min_pct': 0.0004438805442542696, 'atr_max_pct': 0.13591468169131832, 'tp_mult': 2.758763233049146, 'tsl_mult': 0.10208398247424733, 'strategy': 'mean_reversion', 'time_stop': 276, 'use_sma': False, 'use_atr': False, 'use_adx': False, 'use_ema': False, 'use_spike': False, 'rsi_required': False, 'edge_k': 1.3539647539684507, 'edge_cap': 0.5382843506340355}.
[I 2025-08-29 22:14:13,691] Trial 310 finished with values: [-1000000000.0, 1000000000.0] and parameters: {'p_sma': 12, 'p_std': 22, 'p_atr': 22, 'p_adx': 17, 'rsi_period': 56, 'ema1': 24, 'ema2': 17, 'slip_atr_k': 0.1847616387019072, 'slip_spread_k': 0.7166462582107455, 'spread_hl_frac': 0.03434532303831806, 'bb_std_mult': 1.3373514225406715, 'rsi_os': 11, 'rsi_ob': 71, 'vol_spike': 0.031016748130302783, 'adx_thresh': 32.62534820855429, 'atr_min_pct': 0.01000982347211208, 'atr_max_pct': 0.03924161534906119, 'tp_mult': 2.9066456657538606, 'tsl_mult': 0.4567350268874855, 'strategy': 'breakout', 'time_stop': 101, 'use_sma': False, 'use_atr': False, 'use_adx': False, 'use_ema': False, 'use_spike': False, 'rsi_required': False, 'edge_k': 0.31350346378137195, 'edge_cap': 0.43103454841993677}.
[I 2025-08-29 22:14:13,989] Trial 309 finished with values: [-1000000000.0, 1000000000.0] and parameters: {'p_sma': 12, 'p_std': 55, 'p_atr': 13, 'p_adx': 23, 'rsi_period': 42, 'ema1': 7, 'ema2': 55, 'slip_atr_k': 0.20607868928908063, 'slip_spread_k': 0.7318391889368239, 'spread_hl_frac': 0.03425508584510989, 'bb_std_mult': 0.9970993874297454, 'rsi_os': 9, 'rsi_ob': 70, 'vol_spike': 0.034403095962877585, 'adx_thresh': 32.61276450039676, 'atr_min_pct': 0.0013694039675321381, 'atr_max_pct': 0.059310833510320474, 'tp_mult': 2.78532716296598, 'tsl_mult': 0.5378506648642079, 'strategy': 'mean_reversion', 'time_stop': 100, 'use_sma': False, 'use_atr': False, 'use_adx': False, 'use_ema': False, 'use_spike': False, 'rsi_required': False, 'edge_k': 0.3170303121282766, 'edge_cap': 0.5024622468698011}.
[I 2025-08-29 22:14:13,989] Trial 311 finished with values: [-0.004474407458015639, 0.004473612966923583] and parameters: {'p_sma': 45, 'p_std': 32, 'p_atr': 22, 'p_adx': 21, 'rsi_period': 56, 'ema1': 24, 'ema2': 12, 'slip_atr_k': 0.046701494529791214, 'slip_spread_k': 0.7162926410772085, 'spread_hl_frac': 0.0342948519429556, 'bb_std_mult': 1.7733205763208129, 'rsi_os': 26, 'rsi_ob': 71, 'vol_spike': 0.031849426069129994, 'adx_thresh': 16.247358963622055, 'atr_min_pct': 0.0015379191791318016, 'atr_max_pct': 0.07539171516307307, 'tp_mult': 2.9972530930211683, 'tsl_mult': 0.4530825902128279, 'strategy': 'breakout', 'time_stop': 5, 'use_sma': False, 'use_atr': False, 'use_adx': False, 'use_ema': False, 'use_spike': False, 'rsi_required': False, 'edge_k': 0.2574790494912698, 'edge_cap': 0.9871889310256016}.
[I 2025-08-29 22:14:14,158] Trial 312 finished with values: [-0.002581717115055615, 0.002653578594610923] and parameters: {'p_sma': 12, 'p_std': 15, 'p_atr': 8, 'p_adx': 21, 'rsi_period': 18, 'ema1': 8, 'ema2': 11, 'slip_atr_k': 0.04683145629210021, 'slip_spread_k': 0.7345389846632544, 'spread_hl_frac': 0.03392365622672852, 'bb_std_mult': 1.0221946963787683, 'rsi_os': 27, 'rsi_ob': 75, 'vol_spike': 0.038849576528212235, 'adx_thresh': 32.55821168559751, 'atr_min_pct': 0.0019579896810905375, 'atr_max_pct': 0.039203447676609784, 'tp_mult': 1.0116746543395296, 'tsl_mult': 0.4522552216522528, 'strategy': 'breakout', 'time_stop': 107, 'use_sma': False, 'use_atr': False, 'use_adx': False, 'use_ema': False, 'use_spike': False, 'rsi_required': False, 'edge_k': 0.2592556320674688, 'edge_cap': 0.9819265873775137}.
[I 2025-08-29 22:14:41,368] Trial 315 finished with values: [-1000000000.0, 1000000000.0] and parameters: {'p_sma': 22, 'p_std': 15, 'p_atr': 8, 'p_adx': 16, 'rsi_period': 31, 'ema1': 8, 'ema2': 14, 'slip_atr_k': 0.23501637090455318, 'slip_spread_k': 0.7524867034295274, 'spread_hl_frac': 0.03193189357065085, 'bb_std_mult': 2.981967183751039, 'rsi_os': 28, 'rsi_ob': 79, 'vol_spike': 0.22145585697924072, 'adx_thresh': 33.38186528559661, 'atr_min_pct': 0.0032082797067716556, 'atr_max_pct': 0.03141382643179883, 'tp_mult': 2.8340941329439993, 'tsl_mult': 0.48365618415970213, 'strategy': 'breakout', 'time_stop': 107, 'use_sma': False, 'use_atr': False, 'use_adx': False, 'use_ema': False, 'use_spike': False, 'rsi_required': False, 'edge_k': 1.0929707220067266, 'edge_cap': 0.4802558619661008}.
[I 2025-08-29 22:14:41,604] Trial 314 finished with values: [-0.0015252165502801507, 0.0018215909815329288] and parameters: {'p_sma': 22, 'p_std': 14, 'p_atr': 23, 'p_adx': 14, 'rsi_period': 18, 'ema1': 9, 'ema2': 11, 'slip_atr_k': 0.05883336421936622, 'slip_spread_k': 0.3246969802236108, 'spread_hl_frac': 0.03303132055829503, 'bb_std_mult': 2.06865473730894, 'rsi_os': 28, 'rsi_ob': 83, 'vol_spike': 0.22080378933969994, 'adx_thresh': 25.086793287885705, 'atr_min_pct': 0.0029436890367805133, 'atr_max_pct': 0.12789696425420846, 'tp_mult': 2.7150696667217247, 'tsl_mult': 0.48115793656260003, 'strategy': 'breakout', 'time_stop': 109, 'use_sma': False, 'use_atr': False, 'use_adx': False, 'use_ema': False, 'use_spike': False, 'rsi_required': False, 'edge_k': 0.349824648862322, 'edge_cap': 0.4785393296531745}.
[I 2025-08-29 22:14:41,735] Trial 316 finished with values: [-1000000000.0, 1000000000.0] and parameters: {'p_sma': 10, 'p_std': 58, 'p_atr': 29, 'p_adx': 14, 'rsi_period': 19, 'ema1': 8, 'ema2': 11, 'slip_atr_k': 0.05065580074268848, 'slip_spread_k': 0.7533018220972951, 'spread_hl_frac': 0.027404763491127252, 'bb_std_mult': 2.7795267338323395, 'rsi_os': 28, 'rsi_ob': 75, 'vol_spike': 0.22303814618628826, 'adx_thresh': 33.25759773168222, 'atr_min_pct': 0.001972412528867363, 'atr_max_pct': 0.03185067589291353, 'tp_mult': 1.149375289265476, 'tsl_mult': 0.845678118526127, 'strategy': 'breakout', 'time_stop': 109, 'use_sma': False, 'use_atr': False, 'use_adx': False, 'use_ema': False, 'use_spike': False, 'rsi_required': False, 'edge_k': 0.7273773756889605, 'edge_cap': 0.4765011229216}.
[I 2025-08-29 22:14:41,804] Trial 313 finished with values: [-1000000000.0, 1000000000.0] and parameters: {'p_sma': 22, 'p_std': 32, 'p_atr': 8, 'p_adx': 14, 'rsi_period': 73, 'ema1': 8, 'ema2': 32, 'slip_atr_k': 0.05133960002857245, 'slip_spread_k': 0.7353643198234222, 'spread_hl_frac': 0.03304750478509529, 'bb_std_mult': 2.129147259210384, 'rsi_os': 27, 'rsi_ob': 69, 'vol_spike': 0.29106936008780654, 'adx_thresh': 16.41828435999189, 'atr_min_pct': 0.029155136784424815, 'atr_max_pct': 0.030896993730486537, 'tp_mult': 2.54759524322102, 'tsl_mult': 0.48026919766123, 'strategy': 'breakout', 'time_stop': 110, 'use_sma': False, 'use_atr': False, 'use_adx': False, 'use_ema': False, 'use_spike': False, 'rsi_required': False, 'edge_k': 0.24505308056688144, 'edge_cap': 0.4836577541042867}.
[I 2025-08-29 22:14:41,970] Trial 319 finished with values: [-1000000000.0, 1000000000.0] and parameters: {'p_sma': 8, 'p_std': 39, 'p_atr': 22, 'p_adx': 23, 'rsi_period': 73, 'ema1': 28, 'ema2': 32, 'slip_atr_k': 0.05887340616835046, 'slip_spread_k': 0.1420311833980361, 'spread_hl_frac': 0.04179731866805911, 'bb_std_mult': 2.111723771898616, 'rsi_os': 25, 'rsi_ob': 48, 'vol_spike': 0.03966563708163778, 'adx_thresh': 25.132984324810284, 'atr_min_pct': 0.02920259991808979, 'atr_max_pct': 0.1286655631660997, 'tp_mult': 2.7215744961452906, 'tsl_mult': 0.47818510408629983, 'strategy': 'mean_reversion', 'time_stop': 94, 'use_sma': False, 'use_atr': False, 'use_adx': False, 'use_ema': False, 'use_spike': False, 'rsi_required': False, 'edge_k': 0.3505227255163737, 'edge_cap': 0.9166237555163201}.
[I 2025-08-29 22:15:08,967] Trial 318 finished with values: [-1000000000.0, 1000000000.0] and parameters: {'p_sma': 9, 'p_std': 34, 'p_atr': 22, 'p_adx': 26, 'rsi_period': 73, 'ema1': 5, 'ema2': 11, 'slip_atr_k': 0.03554313108459598, 'slip_spread_k': 0.13228452177460914, 'spread_hl_frac': 0.03844789823731909, 'bb_std_mult': 3.4123617347166233, 'rsi_os': 18, 'rsi_ob': 69, 'vol_spike': 0.0501397914014082, 'adx_thresh': 34.98184766480853, 'atr_min_pct': 0.013368010773922329, 'atr_max_pct': 0.12872678615502306, 'tp_mult': 1.5767766056431562, 'tsl_mult': 0.8362978339590934, 'strategy': 'breakout', 'time_stop': 116, 'use_sma': False, 'use_atr': False, 'use_adx': False, 'use_ema': False, 'use_spike': False, 'rsi_required': False, 'edge_k': 0.3513722245704434, 'edge_cap': 0.4600547729734583}.
[I 2025-08-29 22:15:09,298] Trial 320 finished with values: [-1000000000.0, 1000000000.0] and parameters: {'p_sma': 11, 'p_std': 29, 'p_atr': 22, 'p_adx': 22, 'rsi_period': 37, 'ema1': 9, 'ema2': 21, 'slip_atr_k': 0.059800529943182884, 'slip_spread_k': 0.3181293020362828, 'spread_hl_frac': 0.04641772237538008, 'bb_std_mult': 0.8322504089861549, 'rsi_os': 25, 'rsi_ob': 77, 'vol_spike': 0.041319150044263404, 'adx_thresh': 34.96616039013189, 'atr_min_pct': 0.022871521661356455, 'atr_max_pct': 0.11250478522391985, 'tp_mult': 2.713589893972973, 'tsl_mult': 0.7959006943265725, 'strategy': 'mean_reversion', 'time_stop': 249, 'use_sma': False, 'use_atr': False, 'use_adx': False, 'use_ema': False, 'use_spike': False, 'rsi_required': False, 'edge_k': 0.35351321324075863, 'edge_cap': 0.45816842392084145}.
[I 2025-08-29 22:15:09,532] Trial 321 finished with values: [-1000000000.0, 1000000000.0] and parameters: {'p_sma': 9, 'p_std': 34, 'p_atr': 22, 'p_adx': 13, 'rsi_period': 27, 'ema1': 9, 'ema2': 23, 'slip_atr_k': 0.2436093670544271, 'slip_spread_k': 0.3110645456324985, 'spread_hl_frac': 0.046239204699763094, 'bb_std_mult': 0.8344458481861242, 'rsi_os': 25, 'rsi_ob': 95, 'vol_spike': 0.22961067095612586, 'adx_thresh': 34.811082028372276, 'atr_min_pct': 0.022939762113553194, 'atr_max_pct': 0.08661419265376509, 'tp_mult': 1.580354478001648, 'tsl_mult': 0.8042696530936639, 'strategy': 'mean_reversion', 'time_stop': 98, 'use_sma': False, 'use_atr': False, 'use_adx': False, 'use_ema': False, 'use_spike': False, 'rsi_required': False, 'edge_k': 1.6501773803144801, 'edge_cap': 0.6965208185054184}.
[I 2025-08-29 22:15:09,532] Trial 317 finished with values: [-1000000000.0, 1000000000.0] and parameters: {'p_sma': 9, 'p_std': 39, 'p_atr': 23, 'p_adx': 14, 'rsi_period': 18, 'ema1': 29, 'ema2': 32, 'slip_atr_k': 0.24450503376239624, 'slip_spread_k': 0.2991653054414902, 'spread_hl_frac': 0.02697176517700588, 'bb_std_mult': 2.7525448635464618, 'rsi_os': 25, 'rsi_ob': 95, 'vol_spike': 0.22672987300177588, 'adx_thresh': 28.032260488623354, 'atr_min_pct': 0.013434216398144088, 'atr_max_pct': 0.12876816618784942, 'tp_mult': 2.721635868295421, 'tsl_mult': 0.8337100915405001, 'strategy': 'mean_reversion', 'time_stop': 113, 'use_sma': False, 'use_atr': False, 'use_adx': False, 'use_ema': False, 'use_spike': False, 'rsi_required': False, 'edge_k': 1.9414991082142476, 'edge_cap': 0.45655920779821885}.
[I 2025-08-29 22:15:09,735] Trial 325 finished with values: [-1000000000.0, 1000000000.0] and parameters: {'p_sma': 11, 'p_std': 5, 'p_atr': 21, 'p_adx': 29, 'rsi_period': 82, 'ema1': 7, 'ema2': 53, 'slip_atr_k': 0.04491802304402456, 'slip_spread_k': 0.28320643610957996, 'spread_hl_frac': 0.015280010229753553, 'bb_std_mult': 1.8669027668319553, 'rsi_os': 21, 'rsi_ob': 45, 'vol_spike': 0.20100399228533766, 'adx_thresh': 18.097919324674596, 'atr_min_pct': 0.00221034079438571, 'atr_max_pct': 0.0637963765025558, 'tp_mult': 1.9406909232896983, 'tsl_mult': 0.881003763357206, 'strategy': 'mean_reversion', 'time_stop': 105, 'use_sma': False, 'use_atr': False, 'use_adx': False, 'use_ema': False, 'use_spike': False, 'rsi_required': False, 'edge_k': 0.4441392025637577, 'edge_cap': 0.501801133153721}.
[I 2025-08-29 22:15:09,739] Trial 324 finished with values: [-1000000000.0, 1000000000.0] and parameters: {'p_sma': 11, 'p_std': 5, 'p_atr': 21, 'p_adx': 22, 'rsi_period': 82, 'ema1': 7, 'ema2': 34, 'slip_atr_k': 0.04353100447873114, 'slip_spread_k': 0.6924608294887934, 'spread_hl_frac': 0.015412294675394327, 'bb_std_mult': 1.8448131001327799, 'rsi_os': 6, 'rsi_ob': 45, 'vol_spike': 0.21822896821031137, 'adx_thresh': 33.816084017751436, 'atr_min_pct': 0.002276912620729836, 'atr_max_pct': 0.13210037870279512, 'tp_mult': 1.9294506565798988, 'tsl_mult': 0.5142709847994829, 'strategy': 'mean_reversion', 'time_stop': 292, 'use_sma': False, 'use_atr': False, 'use_adx': False, 'use_ema': False, 'use_spike': False, 'rsi_required': False, 'edge_k': 0.532426191298458, 'edge_cap': 0.4362371727975095}.
