[I 2025-08-29 23:46:20,079] Trial 1186 finished with values: [-1000000000.0, 1000000000.0] and parameters: {'p_sma': 28, 'p_std': 11, 'p_atr': 11, 'p_adx': 17, 'rsi_period': 7, 'ema1': 30, 'ema2': 59, 'slip_atr_k': 0.017508601979079965, 'slip_spread_k': 0.17948814165396687, 'spread_hl_frac': 0.03094149515726184, 'bb_std_mult': 1.359894782088619, 'rsi_os': 33, 'rsi_ob': 88, 'vol_spike': 0.25393599955288815, 'adx_thresh': 20.099657931764444, 'atr_min_pct': 0.004738116754814722, 'atr_max_pct': 0.012198960098260617, 'tp_mult': 1.878777932378327, 'tsl_mult': 0.6673474803833231, 'strategy': 'breakout', 'time_stop': 217, 'use_sma': False, 'use_atr': False, 'use_adx': False, 'use_ema': False, 'use_spike': False, 'rsi_required': False, 'edge_k': 1.81755426615995, 'edge_cap': 0.2805477811965761}.
[I 2025-08-29 23:46:47,171] Trial 1191 finished with values: [-1000000000.0, 1000000000.0] and parameters: {'p_sma': 30, 'p_std': 17, 'p_atr': 13, 'p_adx': 26, 'rsi_period': 32, 'ema1': 29, 'ema2': 32, 'slip_atr_k': 0.0040468043759910284, 'slip_spread_k': 0.9359131659243853, 'spread_hl_frac': 0.01576724514365284, 'bb_std_mult': 1.87218477509058, 'rsi_os': 33, 'rsi_ob': 61, 'vol_spike': 0.2630444307536674, 'adx_thresh': 20.62454302682287, 'atr_min_pct': 0.011413358520649158, 'atr_max_pct': 0.07702446093462921, 'tp_mult': 1.055654564598571, 'tsl_mult': 0.6320770485866898, 'strategy': 'mean_reversion', 'time_stop': 163, 'use_sma': False, 'use_atr': False, 'use_adx': False, 'use_ema': False, 'use_spike': False, 'rsi_required': False, 'edge_k': 1.964489516832067, 'edge_cap': 0.14334831425811853}.
[I 2025-08-29 23:46:47,322] Trial 1190 finished with values: [-1000000000.0, 1000000000.0] and parameters: {'p_sma': 28, 'p_std': 10, 'p_atr': 13, 'p_adx': 12, 'rsi_period': 77, 'ema1': 29, 'ema2': 59, 'slip_atr_k': 0.2323374930313614, 'slip_spread_k': 0.2790101086306398, 'spread_hl_frac': 0.04402036143700519, 'bb_std_mult': 1.26205758294217, 'rsi_os': 33, 'rsi_ob': 61, 'vol_spike': 0.26066202811229305, 'adx_thresh': 11.548236849742102, 'atr_min_pct': 0.011299810215690164, 'atr_max_pct': 0.06725060650930892, 'tp_mult': 1.9655835955717746, 'tsl_mult': 0.6240780454003005, 'strategy': 'mean_reversion', 'time_stop': 118, 'use_sma': False, 'use_atr': False, 'use_adx': False, 'use_ema': False, 'use_spike': False, 'rsi_required': False, 'edge_k': 1.8102091737513903, 'edge_cap': 0.1415012340722035}.
[I 2025-08-29 23:46:47,516] Trial 1189 finished with values: [-0.0017563892356056154, 0.0017249896808709563] and parameters: {'p_sma': 28, 'p_std': 10, 'p_atr': 11, 'p_adx': 20, 'rsi_period': 32, 'ema1': 21, 'ema2': 21, 'slip_atr_k': 0.005154228910908377, 'slip_spread_k': 0.8729085165450206, 'spread_hl_frac': 0.011726481141773444, 'bb_std_mult': 1.3766501585752562, 'rsi_os': 33, 'rsi_ob': 61, 'vol_spike': 0.2544780428627005, 'adx_thresh': 31.79413163743687, 'atr_min_pct': 0.003386220467194015, 'atr_max_pct': 0.0653034083155333, 'tp_mult': 1.883421526689415, 'tsl_mult': 0.6270558066622693, 'strategy': 'mean_reversion', 'time_stop': 91, 'use_sma': False, 'use_atr': False, 'use_adx': False, 'use_ema': False, 'use_spike': False, 'rsi_required': False, 'edge_k': 1.958848794343373, 'edge_cap': 0.2702326099933729}.
[I 2025-08-29 23:46:47,624] Trial 1192 finished with values: [-1000000000.0, 1000000000.0] and parameters: {'p_sma': 30, 'p_std': 18, 'p_atr': 13, 'p_adx': 12, 'rsi_period': 77, 'ema1': 29, 'ema2': 33, 'slip_atr_k': 0.004736760003418187, 'slip_spread_k': 0.07006131695940998, 'spread_hl_frac': 0.044200498283542416, 'bb_std_mult': 3.3826807647891908, 'rsi_os': 31, 'rsi_ob': 71, 'vol_spike': 0.26213412059035024, 'adx_thresh': 22.85614839444158, 'atr_min_pct': 0.011336827801926328, 'atr_max_pct': 0.06647209885474653, 'tp_mult': 2.960979823459731, 'tsl_mult': 0.35965145046005936, 'strategy': 'mean_reversion', 'time_stop': 58, 'use_sma': False, 'use_atr': False, 'use_adx': False, 'use_ema': False, 'use_spike': False, 'rsi_required': False, 'edge_k': 1.9636980086015565, 'edge_cap': 0.2502381440371879}.
[I 2025-08-29 23:46:47,929] Trial 1193 finished with values: [-1000000000.0, 1000000000.0] and parameters: {'p_sma': 30, 'p_std': 29, 'p_atr': 27, 'p_adx': 20, 'rsi_period': 56, 'ema1': 28, 'ema2': 35, 'slip_atr_k': 0.007610213875622681, 'slip_spread_k': 0.2827914184266898, 'spread_hl_frac': 0.012931305915803874, 'bb_std_mult': 1.2562716333280506, 'rsi_os': 22, 'rsi_ob': 45, 'vol_spike': 0.24756113769149257, 'adx_thresh': 29.365362443985354, 'atr_min_pct': 0.00283035893395509, 'atr_max_pct': 0.06613406914035935, 'tp_mult': 1.954976777592122, 'tsl_mult': 0.4951263154343485, 'strategy': 'mean_reversion', 'time_stop': 278, 'use_sma': False, 'use_atr': False, 'use_adx': False, 'use_ema': False, 'use_spike': False, 'rsi_required': False, 'edge_k': 1.9646081147228414, 'edge_cap': 0.1723783788587817}.
[I 2025-08-29 23:47:15,101] Trial 1195 finished with values: [-1000000000.0, 1000000000.0] and parameters: {'p_sma': 30, 'p_std': 13, 'p_atr': 25, 'p_adx': 14, 'rsi_period': 15, 'ema1': 28, 'ema2': 46, 'slip_atr_k': 0.18315167404131116, 'slip_spread_k': 0.3213449568480313, 'spread_hl_frac': 0.012991033018689216, 'bb_std_mult': 1.548647440211097, 'rsi_os': 35, 'rsi_ob': 69, 'vol_spike': 0.24661203082073876, 'adx_thresh': 22.705476128419722, 'atr_min_pct': 0.014914435682763273, 'atr_max_pct': 0.07294264553818128, 'tp_mult': 2.7655721347286946, 'tsl_mult': 0.5929575819193644, 'strategy': 'mean_reversion', 'time_stop': 59, 'use_sma': False, 'use_atr': False, 'use_adx': False, 'use_ema': False, 'use_spike': False, 'rsi_required': False, 'edge_k': 1.9308651626817013, 'edge_cap': 0.17271562046423755}.
[I 2025-08-29 23:47:15,345] Trial 1194 finished with values: [-1000000000.0, 1000000000.0] and parameters: {'p_sma': 30, 'p_std': 46, 'p_atr': 12, 'p_adx': 14, 'rsi_period': 15, 'ema1': 22, 'ema2': 21, 'slip_atr_k': 0.004736530337483035, 'slip_spread_k': 0.06958448770209436, 'spread_hl_frac': 0.0050688998242705355, 'bb_std_mult': 1.002281303177729, 'rsi_os': 35, 'rsi_ob': 71, 'vol_spike': 0.24853207552986073, 'adx_thresh': 18.259336548282725, 'atr_min_pct': 0.018281684045554816, 'atr_max_pct': 0.07271530179989164, 'tp_mult': 2.008267711153948, 'tsl_mult': 0.4966976880617943, 'strategy': 'mean_reversion', 'time_stop': 50, 'use_sma': False, 'use_atr': False, 'use_adx': False, 'use_ema': False, 'use_spike': False, 'rsi_required': False, 'edge_k': 1.9628568485349127, 'edge_cap': 0.16751822921962783}.
[I 2025-08-29 23:47:15,489] Trial 1196 finished with values: [-0.00025606065034644576, 0.001023656457331814] and parameters: {'p_sma': 29, 'p_std': 31, 'p_atr': 25, 'p_adx': 14, 'rsi_period': 56, 'ema1': 30, 'ema2': 21, 'slip_atr_k': 0.00918507402255819, 'slip_spread_k': 0.3237550918130969, 'spread_hl_frac': 0.01003492546280984, 'bb_std_mult': 1.4332558050213882, 'rsi_os': 35, 'rsi_ob': 63, 'vol_spike': 0.255909124966623, 'adx_thresh': 30.658573271844134, 'atr_min_pct': 0.0030062338593682693, 'atr_max_pct': 0.07320255735275365, 'tp_mult': 1.383242760059118, 'tsl_mult': 0.5949719499082988, 'strategy': 'mean_reversion', 'time_stop': 280, 'use_sma': False, 'use_atr': False, 'use_adx': False, 'use_ema': False, 'use_spike': False, 'rsi_required': False, 'edge_k': 1.9294803850631266, 'edge_cap': 0.1773655927423564}.
[I 2025-08-29 23:47:15,727] Trial 1197 finished with values: [-1000000000.0, 1000000000.0] and parameters: {'p_sma': 29, 'p_std': 13, 'p_atr': 16, 'p_adx': 14, 'rsi_period': 15, 'ema1': 30, 'ema2': 21, 'slip_atr_k': 0.18105986637189184, 'slip_spread_k': 0.322669242016818, 'spread_hl_frac': 0.027003272160650925, 'bb_std_mult': 0.9905981900967522, 'rsi_os': 35, 'rsi_ob': 68, 'vol_spike': 0.24581819325187437, 'adx_thresh': 20.931166578421994, 'atr_min_pct': 0.015189940725010575, 'atr_max_pct': 0.07215893278932672, 'tp_mult': 2.0205058515018726, 'tsl_mult': 0.7439676668127756, 'strategy': 'mean_reversion', 'time_stop': 80, 'use_sma': False, 'use_atr': False, 'use_adx': False, 'use_ema': False, 'use_spike': False, 'rsi_required': False, 'edge_k': 0.7005317403117557, 'edge_cap': 0.18327591930353976}.
[I 2025-08-29 23:47:29,089] Trial 1199 finished with values: [-1000000000.0, 1000000000.0] and parameters: {'p_sma': 29, 'p_std': 12, 'p_atr': 12, 'p_adx': 13, 'rsi_period': 10, 'ema1': 30, 'ema2': 54, 'slip_atr_k': 0.011204711132697836, 'slip_spread_k': 0.2515375787891199, 'spread_hl_frac': 0.009985010656167623, 'bb_std_mult': 1.4391060177525319, 'rsi_os': 6, 'rsi_ob': 63, 'vol_spike': 0.2554151840313975, 'adx_thresh': 16.097189591731226, 'atr_min_pct': 0.009851918738280018, 'atr_max_pct': 0.07647411247972906, 'tp_mult': 1.936167841993263, 'tsl_mult': 0.6211621147151787, 'strategy': 'mean_reversion', 'time_stop': 295, 'use_sma': False, 'use_atr': False, 'use_adx': False, 'use_ema': False, 'use_spike': False, 'rsi_required': False, 'edge_k': 0.5537815646524769, 'edge_cap': 0.6162551309259995}.
[I 2025-08-29 23:47:29,179] Trial 1198 finished with values: [-1000000000.0, 1000000000.0] and parameters: {'p_sma': 29, 'p_std': 12, 'p_atr': 12, 'p_adx': 11, 'rsi_period': 10, 'ema1': 30, 'ema2': 21, 'slip_atr_k': 1.1659895763816439e-05, 'slip_spread_k': 0.24982399366409985, 'spread_hl_frac': 0.00553835328081289, 'bb_std_mult': 1.4376907105297316, 'rsi_os': 6, 'rsi_ob': 63, 'vol_spike': 0.25467449939727616, 'adx_thresh': 18.265697744068714, 'atr_min_pct': 0.010001931355408195, 'atr_max_pct': 0.023021071595163985, 'tp_mult': 2.0211929251631098, 'tsl_mult': 0.9440036257738956, 'strategy': 'mean_reversion', 'time_stop': 19, 'use_sma': False, 'use_atr': False, 'use_adx': False, 'use_ema': False, 'use_spike': False, 'rsi_required': False, 'edge_k': 1.9100944688218244, 'edge_cap': 0.5579252206555648}.
Starting optimization (1200 trials, n_jobs=4) | multi-objective=True
Saved trials CSV -> runs/SPOT_LONG_fee5e-4_slip4e-4_UShours_blend/trials_metrics.csv
Saved Pareto plot -> runs/SPOT_LONG_fee5e-4_slip4e-4_UShours_blend/pareto_return_vs_drawdown.png
Top-K under DD cap: [986, 1091, 898] (agg='median')
=== Selected trial(s) ===
top_k=3 selected_trial_numbers=[986, 1091, 898] primary=986
ret%_train=0.06% dd%_train=-0.03% trades=133
ret%_test=0.11% dd%_test=-0.02% pnl_test=22.66 trades_test=55
Dumped TEST trades -> runs/SPOT_LONG_fee5e-4_slip4e-4_UShours_blend/test_trades.csv
WFO fold 1: OOS PnL=-0.22 trades=1 win_rate=0.00% avg=-0.216055 ret%=-0.00% maxDD=0.000000 maxDD%=0.00%
WFO fold 2: OOS PnL=22.19 trades=35 win_rate=51.43% avg=0.634039 ret%=0.11% maxDD=-2.759864 maxDD%=-0.01%
WFO fold 3: OOS PnL=-1.63 trades=10 win_rate=50.00% avg=-0.162630 ret%=-0.01% maxDD=-2.510806 maxDD%=-0.01%
WFO fold 4: OOS PnL=-1.01 trades=1 win_rate=0.00% avg=-1.007302 ret%=-0.01% maxDD=0.000000 maxDD%=0.00%
WFO fold 5: OOS PnL=4.64 trades=4 win_rate=100.00% avg=1.159683 ret%=0.02% maxDD=0.000000 maxDD%=0.00%
WFO fold 6: OOS PnL=-1.33 trades=4 win_rate=25.00% avg=-0.332518 ret%=-0.01% maxDD=-1.774317 maxDD%=-0.01%
WFO summary: meanPnL=3.78 stdPnL=8.50 meanWR=37.74% meanAvg=0.012536 meanRet%=0.02% worstDD=-2.759864 worstDD%=-0.01% folds=6 trades=55
Wrote runs/SPOT_LONG_fee5e-4_slip4e-4_UShours_blend/strategy_profile.json
=== ECHO SELECTED PARAMS (JSON) ===
{
  "adx_thresh": 20.731918737947876,
  "aggregate_params": "median",
  "atr_max_pct": 0.05992022732600813,
  "atr_min_pct": 0.006606289318539125,
  "bar_priority": "stop_first",
  "bb_std_mult": 1.6287633596350102,
  "cooldown_bars": 30,
  "daily_loss_limit_pct": 0.03,
  "edge_cap": 0.21552815551450644,
  "edge_k": 1.50222397318517,
  "ema1": 29,
  "ema2": 26,
  "embargo_bars": 120,
  "fee": 0.0005,
  "fill_timing": "next_open",
  "include_hours_set": "{3, 4, 6, 8, 10, 11, 14, 15, 18, 22}",
  "lockout_bars": 90,
  "max_consec_losses": 3,
  "max_notional_pct_equity": 1.0,
  "min_notional": 5.0,
  "ml_thresh": 0.0,
  "objective": "multi",
  "p_adx": 14,
  "p_atr": 13,
  "p_sma": 28,
  "p_std": 13,
  "participation_cap": 1.0,
  "price_step": 0.0001,
  "proba_temp": 1.0,
  "qty_step": 0.0001,
  "regime_adapt": true,
  "regime_band": 0.006,
  "regime_fast": 50,
  "regime_overrides": {
    "bear": {
      "adx": 20.0,
      "allowed_sides": [
        "long",
        "short"
      ],
      "atr_range": [
        0.0015,
        0.06
      ],
      "bb_std_mult": 1.2571599337995167,
      "mode": "breakout",
      "rsi_required": true,
      "time_stop_bars": 122,
      "tp_mult": 1.7149673432024581,
      "tsl_mult": 0.25,
      "use_adx": true,
      "use_atr": true
    },
    "bull": {
      "adx": 18.0,
      "allowed_sides": [
        "long",
        "short"
      ],
      "atr_range": [
        0.0008,
        0.06
      ],
      "bb_std_mult": 2.0169431746748376,
      "mode": "mean_reversion",
      "rsi_required": false,
      "time_stop_bars": 214,
      "tp_mult": 1.9194251920826044,
      "tsl_mult": 0.6891458682949287,
      "use_adx": true,
      "use_atr": true
    },
    "sideways": {
      "adx": 15.0,
      "allowed_sides": [
        "long",
        "short"
      ],
      "atr_range": [
        0.001,
        0.14
      ],
      "bb_std_mult": 1.5828092896467827,
      "mode": "breakout",
      "rsi_required": true,
      "time_stop_bars": 235,
      "tp_mult": 2.341879695778944,
      "tsl_mult": 0.651967765830165,
      "use_adx": true,
      "use_atr": true
    }
  },
  "regime_slow": 200,
  "risk_min_stop_frac": 0.001,
  "risk_per_trade": 0.003,
  "risk_stop_atr_mult": 1.0,
  "round_exits": true,
  "rsi_key": "rsi9",
  "rsi_ob": 62,
  "rsi_os": 31,
  "rsi_period": 9,
  "rsi_required": false,
  "select_top_k": 3,
  "session_end": 24,
  "session_start": 0,
  "sides": "long",
  "slip_atr_k": 0.003801540039245826,
  "slip_spread_k": 0.4309715179140392,
  "slippage": 0.0004,
  "spread_hl_frac": 0.02348264067462158,
  "start_equity": 20000.0,
  "stop_extra_slip": 0.0,
  "strategy": "mean_reversion",
  "time_stop": 290,
  "tp_mult": 1.9653167483911427,
  "tsl_mult": 0.6783455272420987,
  "use_adx": false,
  "use_atr": false,
  "use_ema": false,
  "use_ml": false,
  "use_sma": false,
  "use_spike": false,
  "vol_spike": 0.245162735252494,
  "wfo_folds": 6
}
Wrote runs/SPOT_LONG_fee5e-4_slip4e-4_UShours_blend/best_params.pkl
