[I 2025-08-29 21:52:20,528] Trial 110 finished with values: [-1000000000.0, 1000000000.0] and parameters: {'p_sma': 60, 'p_std': 28, 'p_atr': 20, 'p_adx': 21, 'rsi_period': 29, 'ema1': 28, 'ema2': 23, 'slip_atr_k': 0.13704552836264555, 'slip_spread_k': 0.24541507975280785, 'spread_hl_frac': 0.03341506045720437, 'bb_std_mult': 0.7893315628942672, 'rsi_os': 18, 'rsi_ob': 65, 'vol_spike': 0.036945220088973926, 'adx_thresh': 21.288701985846632, 'atr_min_pct': 0.01251163458432872, 'atr_max_pct': 0.07198009567736312, 'tp_mult': 2.0784309788733277, 'tsl_mult': 0.8320925154521254, 'strategy': 'mean_reversion', 'time_stop': 267, 'use_sma': False, 'use_atr': False, 'use_adx': False, 'use_ema': False, 'use_spike': False, 'rsi_required': False, 'edge_k': 1.154455080430464, 'edge_cap': 0.16997559139522694}.
[I 2025-08-29 21:52:20,857] Trial 108 finished with values: [-1000000000.0, 1000000000.0] and parameters: {'p_sma': 10, 'p_std': 35, 'p_atr': 20, 'p_adx': 24, 'rsi_period': 66, 'ema1': 21, 'ema2': 19, 'slip_atr_k': 0.029565327205904324, 'slip_spread_k': 0.2430333487849828, 'spread_hl_frac': 0.03687166478313784, 'bb_std_mult': 0.7242477182243137, 'rsi_os': 24, 'rsi_ob': 68, 'vol_spike': 0.03826848299723187, 'adx_thresh': 33.84407197771355, 'atr_min_pct': 0.001275203736494077, 'atr_max_pct': 0.14520365407613947, 'tp_mult': 2.0663883737937696, 'tsl_mult': 0.6570942866396908, 'strategy': 'mean_reversion', 'time_stop': 272, 'use_sma': False, 'use_atr': False, 'use_adx': False, 'use_ema': False, 'use_spike': False, 'rsi_required': False, 'edge_k': 0.9902740246503987, 'edge_cap': 0.4818138129467654}.
[I 2025-08-29 21:52:20,954] Trial 111 finished with values: [-1000000000.0, 1000000000.0] and parameters: {'p_sma': 54, 'p_std': 35, 'p_atr': 22, 'p_adx': 21, 'rsi_period': 66, 'ema1': 17, 'ema2': 43, 'slip_atr_k': 0.027292562896239478, 'slip_spread_k': 0.3152462050703062, 'spread_hl_frac': 0.004535185183898678, 'bb_std_mult': 2.9605154934369877, 'rsi_os': 18, 'rsi_ob': 54, 'vol_spike': 0.22017672935618143, 'adx_thresh': 21.210449033822453, 'atr_min_pct': 0.0027904769768530933, 'atr_max_pct': 0.14226339065709215, 'tp_mult': 1.8162362365084463, 'tsl_mult': 0.755936250848724, 'strategy': 'mean_reversion', 'time_stop': 272, 'use_sma': False, 'use_atr': False, 'use_adx': False, 'use_ema': False, 'use_spike': False, 'rsi_required': False, 'edge_k': 0.3988548856848415, 'edge_cap': 0.11600431209715745}.
[I 2025-08-29 21:52:21,014] Trial 109 finished with values: [-0.0042418993676054395, 0.0042623591286480335] and parameters: {'p_sma': 60, 'p_std': 28, 'p_atr': 22, 'p_adx': 10, 'rsi_period': 30, 'ema1': 21, 'ema2': 23, 'slip_atr_k': 0.030196618480097484, 'slip_spread_k': 0.919982015959737, 'spread_hl_frac': 0.037803720343934546, 'bb_std_mult': 0.7987196748315222, 'rsi_os': 24, 'rsi_ob': 54, 'vol_spike': 0.037882575458281935, 'adx_thresh': 17.2376807490965, 'atr_min_pct': 0.0015060874181487762, 'atr_max_pct': 0.0514736043310543, 'tp_mult': 2.0546851648966835, 'tsl_mult': 0.8343996502043852, 'strategy': 'mean_reversion', 'time_stop': 130, 'use_sma': False, 'use_atr': False, 'use_adx': False, 'use_ema': False, 'use_spike': False, 'rsi_required': False, 'edge_k': 1.1651202345960976, 'edge_cap': 0.11254843515428065}.
[I 2025-08-29 21:52:47,707] Trial 112 finished with values: [-1000000000.0, 1000000000.0] and parameters: {'p_sma': 10, 'p_std': 35, 'p_atr': 22, 'p_adx': 13, 'rsi_period': 65, 'ema1': 17, 'ema2': 47, 'slip_atr_k': 0.11040879909542273, 'slip_spread_k': 0.9213021549899161, 'spread_hl_frac': 0.03965841342910166, 'bb_std_mult': 2.9578782036862035, 'rsi_os': 24, 'rsi_ob': 90, 'vol_spike': 0.06030642652668783, 'adx_thresh': 17.247001882857372, 'atr_min_pct': 0.002515382560097026, 'atr_max_pct': 0.04323635073079042, 'tp_mult': 1.508922267874385, 'tsl_mult': 0.9784453308872032, 'strategy': 'mean_reversion', 'time_stop': 209, 'use_sma': False, 'use_atr': False, 'use_adx': False, 'use_ema': False, 'use_spike': False, 'rsi_required': False, 'edge_k': 0.6862220186732905, 'edge_cap': 0.09423346098636809}.
[I 2025-08-29 21:52:48,202] Trial 114 finished with values: [-0.012159006699182795, 0.012147453056927146] and parameters: {'p_sma': 7, 'p_std': 46, 'p_atr': 22, 'p_adx': 9, 'rsi_period': 25, 'ema1': 9, 'ema2': 47, 'slip_atr_k': 0.07184926014608208, 'slip_spread_k': 0.21020564463560432, 'spread_hl_frac': 0.040226688943994, 'bb_std_mult': 1.301666095699785, 'rsi_os': 34, 'rsi_ob': 58, 'vol_spike': 0.25122428825988574, 'adx_thresh': 17.07296775733832, 'atr_min_pct': 0.0007204220305443589, 'atr_max_pct': 0.08244628210051405, 'tp_mult': 1.2757319557381344, 'tsl_mult': 0.9730067316670724, 'strategy': 'breakout', 'time_stop': 129, 'use_sma': False, 'use_atr': False, 'use_adx': False, 'use_ema': False, 'use_spike': False, 'rsi_required': False, 'edge_k': 0.4944886401760648, 'edge_cap': 0.7789565470853456}.
[I 2025-08-29 21:52:48,202] Trial 113 finished with values: [-1000000000.0, 1000000000.0] and parameters: {'p_sma': 55, 'p_std': 34, 'p_atr': 22, 'p_adx': 7, 'rsi_period': 47, 'ema1': 9, 'ema2': 47, 'slip_atr_k': 0.007980188113691722, 'slip_spread_k': 0.8963322653104564, 'spread_hl_frac': 0.038729962368144764, 'bb_std_mult': 2.8921394670154523, 'rsi_os': 23, 'rsi_ob': 59, 'vol_spike': 0.2582418054876781, 'adx_thresh': 17.193306155565548, 'atr_min_pct': 0.024059021160128084, 'atr_max_pct': 0.037276503134993866, 'tp_mult': 1.835755044494822, 'tsl_mult': 0.865374649044933, 'strategy': 'breakout', 'time_stop': 159, 'use_sma': False, 'use_atr': False, 'use_adx': False, 'use_ema': False, 'use_spike': False, 'rsi_required': False, 'edge_k': 0.4165818087770806, 'edge_cap': 0.7759265942170267}.
[I 2025-08-29 21:52:48,300] Trial 115 finished with values: [-0.0015846925293131475, 0.0016347044904527494] and parameters: {'p_sma': 9, 'p_std': 46, 'p_atr': 14, 'p_adx': 7, 'rsi_period': 25, 'ema1': 9, 'ema2': 13, 'slip_atr_k': 0.039810417325727446, 'slip_spread_k': 0.9274199321555388, 'spread_hl_frac': 0.038052533643377566, 'bb_std_mult': 2.9176982105233127, 'rsi_os': 23, 'rsi_ob': 71, 'vol_spike': 0.05828113650767412, 'adx_thresh': 17.197740905484668, 'atr_min_pct': 0.0016690759005409308, 'atr_max_pct': 0.05944881217283768, 'tp_mult': 1.0366743985081874, 'tsl_mult': 0.8698544309695925, 'strategy': 'breakout', 'time_stop': 129, 'use_sma': False, 'use_atr': False, 'use_adx': False, 'use_ema': False, 'use_spike': False, 'rsi_required': False, 'edge_k': 1.326621348751187, 'edge_cap': 0.7755112878787771}.
[I 2025-08-29 21:53:15,404] Trial 116 finished with values: [-0.0023286282566487015, 0.0026135320713477506] and parameters: {'p_sma': 7, 'p_std': 21, 'p_atr': 14, 'p_adx': 7, 'rsi_period': 60, 'ema1': 22, 'ema2': 58, 'slip_atr_k': 0.03908895760588457, 'slip_spread_k': 0.1841952844565692, 'spread_hl_frac': 0.03792446023906003, 'bb_std_mult': 3.308178071467318, 'rsi_os': 22, 'rsi_ob': 58, 'vol_spike': 0.1746667545123738, 'adx_thresh': 27.39644472652973, 'atr_min_pct': 0.0017349744091094748, 'atr_max_pct': 0.083070397584973, 'tp_mult': 2.422433577164289, 'tsl_mult': 0.8701737313891192, 'strategy': 'breakout', 'time_stop': 128, 'use_sma': False, 'use_atr': False, 'use_adx': False, 'use_ema': False, 'use_spike': False, 'rsi_required': False, 'edge_k': 0.6405984961036064, 'edge_cap': 0.7752049231848677}.
[I 2025-08-29 21:53:15,574] Trial 118 finished with values: [-1000000000.0, 1000000000.0] and parameters: {'p_sma': 9, 'p_std': 28, 'p_atr': 17, 'p_adx': 10, 'rsi_period': 60, 'ema1': 5, 'ema2': 13, 'slip_atr_k': 0.038434746320720276, 'slip_spread_k': 0.8088855453102669, 'spread_hl_frac': 0.037550818178305655, 'bb_std_mult': 3.438320828708494, 'rsi_os': 27, 'rsi_ob': 71, 'vol_spike': 0.05325326808830052, 'adx_thresh': 27.083168529071596, 'atr_min_pct': 0.001741288913460844, 'atr_max_pct': 0.05966951064148875, 'tp_mult': 1.4017241165630265, 'tsl_mult': 0.8325837131276366, 'strategy': 'breakout', 'time_stop': 77, 'use_sma': False, 'use_atr': False, 'use_adx': False, 'use_ema': False, 'use_spike': False, 'rsi_required': False, 'edge_k': 1.3071613323347717, 'edge_cap': 0.7247065992698858}.
[I 2025-08-29 21:53:15,702] Trial 117 finished with values: [-1000000000.0, 1000000000.0] and parameters: {'p_sma': 9, 'p_std': 29, 'p_atr': 14, 'p_adx': 10, 'rsi_period': 59, 'ema1': 5, 'ema2': 49, 'slip_atr_k': 0.24058724814408222, 'slip_spread_k': 0.7937489430895022, 'spread_hl_frac': 0.018826467662210557, 'bb_std_mult': 2.216897582380694, 'rsi_os': 26, 'rsi_ob': 71, 'vol_spike': 0.28822687228848143, 'adx_thresh': 18.299707230706236, 'atr_min_pct': 0.001636879782802586, 'atr_max_pct': 0.05933983006979416, 'tp_mult': 1.0198445423483544, 'tsl_mult': 0.8961191182655666, 'strategy': 'breakout', 'time_stop': 107, 'use_sma': False, 'use_atr': False, 'use_adx': False, 'use_ema': False, 'use_spike': False, 'rsi_required': False, 'edge_k': 0.6427979369016759, 'edge_cap': 0.7384718370749109}.
[I 2025-08-29 21:53:15,843] Trial 119 finished with values: [-0.002150953481416251, 0.0022096592271834093] and parameters: {'p_sma': 9, 'p_std': 29, 'p_atr': 14, 'p_adx': 14, 'rsi_period': 60, 'ema1': 5, 'ema2': 56, 'slip_atr_k': 0.040748159593534505, 'slip_spread_k': 0.8375229177078021, 'spread_hl_frac': 0.037726720497683365, 'bb_std_mult': 3.273220707566889, 'rsi_os': 27, 'rsi_ob': 62, 'vol_spike': 0.1996856303610187, 'adx_thresh': 9.878834063996218, 'atr_min_pct': 0.0016944227898883506, 'atr_max_pct': 0.05934194039743888, 'tp_mult': 2.4252918260090097, 'tsl_mult': 0.8328187240548218, 'strategy': 'breakout', 'time_stop': 107, 'use_sma': False, 'use_atr': False, 'use_adx': False, 'use_ema': False, 'use_spike': False, 'rsi_required': False, 'edge_k': 0.6401563956758787, 'edge_cap': 0.6798662218249263}.
[I 2025-08-29 21:53:42,980] Trial 123 finished with values: [-1000000000.0, 1000000000.0] and parameters: {'p_sma': 11, 'p_std': 20, 'p_atr': 24, 'p_adx': 14, 'rsi_period': 52, 'ema1': 7, 'ema2': 57, 'slip_atr_k': 0.04164748095765526, 'slip_spread_k': 0.6074576561716373, 'spread_hl_frac': 6.753035174032057e-05, 'bb_std_mult': 3.139305388140267, 'rsi_os': 7, 'rsi_ob': 74, 'vol_spike': 0.17795275864061005, 'adx_thresh': 24.787893082951886, 'atr_min_pct': 0.009023348634623585, 'atr_max_pct': 0.06873228072343723, 'tp_mult': 2.221419809300719, 'tsl_mult': 0.5788921957532233, 'strategy': 'breakout', 'time_stop': 67, 'use_sma': False, 'use_atr': False, 'use_adx': False, 'use_ema': False, 'use_spike': False, 'rsi_required': False, 'edge_k': 0.2617764257678117, 'edge_cap': 0.6325485734143553}.
[I 2025-08-29 21:53:42,991] Trial 120 finished with values: [-1000000000.0, 1000000000.0] and parameters: {'p_sma': 9, 'p_std': 22, 'p_atr': 14, 'p_adx': 8, 'rsi_period': 60, 'ema1': 5, 'ema2': 13, 'slip_atr_k': 0.04699172014004083, 'slip_spread_k': 0.18434295450176175, 'spread_hl_frac': 0.03417076754378396, 'bb_std_mult': 3.2949976325891464, 'rsi_os': 27, 'rsi_ob': 76, 'vol_spike': 0.17315221461446897, 'adx_thresh': 24.03317668915467, 'atr_min_pct': 0.0258743926809161, 'atr_max_pct': 0.05894655373140012, 'tp_mult': 2.4197838032025016, 'tsl_mult': 0.8928148414539175, 'strategy': 'breakout', 'time_stop': 108, 'use_sma': False, 'use_atr': False, 'use_adx': False, 'use_ema': False, 'use_spike': False, 'rsi_required': False, 'edge_k': 1.5735173842934462, 'edge_cap': 0.7243695008720793}.
[I 2025-08-29 21:53:43,285] Trial 121 finished with values: [-1000000000.0, 1000000000.0] and parameters: {'p_sma': 6, 'p_std': 25, 'p_atr': 12, 'p_adx': 14, 'rsi_period': 9, 'ema1': 27, 'ema2': 56, 'slip_atr_k': 0.24117990369219072, 'slip_spread_k': 0.17601386398736665, 'spread_hl_frac': 0.034982923892710495, 'bb_std_mult': 3.321426721568336, 'rsi_os': 22, 'rsi_ob': 74, 'vol_spike': 0.1946539584633527, 'adx_thresh': 23.62110866293598, 'atr_min_pct': 0.02023500656780786, 'atr_max_pct': 0.12380893475752705, 'tp_mult': 1.3417425026976173, 'tsl_mult': 0.7000726634233141, 'strategy': 'breakout', 'time_stop': 109, 'use_sma': False, 'use_atr': False, 'use_adx': False, 'use_ema': False, 'use_spike': False, 'rsi_required': False, 'edge_k': 0.6560268597596748, 'edge_cap': 0.6780665003977787}.
[I 2025-08-29 21:53:43,349] Trial 122 finished with values: [-1000000000.0, 1000000000.0] and parameters: {'p_sma': 11, 'p_std': 21, 'p_atr': 24, 'p_adx': 14, 'rsi_period': 64, 'ema1': 27, 'ema2': 56, 'slip_atr_k': 0.04423037241431641, 'slip_spread_k': 0.18748377986712164, 'spread_hl_frac': 0.04301001918854219, 'bb_std_mult': 3.3054744971445382, 'rsi_os': 5, 'rsi_ob': 74, 'vol_spike': 0.025906802281984595, 'adx_thresh': 24.52307101191493, 'atr_min_pct': 0.019942798050186214, 'atr_max_pct': 0.05393141460245725, 'tp_mult': 2.1989570469589856, 'tsl_mult': 0.5235292247611951, 'strategy': 'breakout', 'time_stop': 101, 'use_sma': False, 'use_atr': False, 'use_adx': False, 'use_ema': False, 'use_spike': False, 'rsi_required': False, 'edge_k': 0.4733698207757464, 'edge_cap': 0.5495892832875211}.
[I 2025-08-29 21:54:10,251] Trial 124 finished with values: [-1000000000.0, 1000000000.0] and parameters: {'p_sma': 50, 'p_std': 25, 'p_atr': 23, 'p_adx': 13, 'rsi_period': 65, 'ema1': 7, 'ema2': 43, 'slip_atr_k': 0.054897644024855516, 'slip_spread_k': 0.19446238395796708, 'spread_hl_frac': 0.020007224034986573, 'bb_std_mult': 2.6086071277375695, 'rsi_os': 22, 'rsi_ob': 69, 'vol_spike': 0.025566817970869172, 'adx_thresh': 19.400675672557405, 'atr_min_pct': 0.015014010630999422, 'atr_max_pct': 0.05344410851217461, 'tp_mult': 2.142093703382349, 'tsl_mult': 0.5245624312183422, 'strategy': 'breakout', 'time_stop': 98, 'use_sma': False, 'use_atr': False, 'use_adx': False, 'use_ema': False, 'use_spike': False, 'rsi_required': False, 'edge_k': 0.46881094985728494, 'edge_cap': 0.673543657121773}.
[I 2025-08-29 21:54:10,297] Trial 126 finished with values: [-1000000000.0, 1000000000.0] and parameters: {'p_sma': 13, 'p_std': 51, 'p_atr': 18, 'p_adx': 28, 'rsi_period': 82, 'ema1': 22, 'ema2': 45, 'slip_atr_k': 0.16388461512291141, 'slip_spread_k': 0.23615740228697085, 'spread_hl_frac': 0.042695500801714525, 'bb_std_mult': 1.4823681777400437, 'rsi_os': 9, 'rsi_ob': 69, 'vol_spike': 0.027891388535813348, 'adx_thresh': 27.830287207402577, 'atr_min_pct': 0.015331160881046507, 'atr_max_pct': 0.06362925344646392, 'tp_mult': 1.4511978638432754, 'tsl_mult': 0.8661713323502154, 'strategy': 'breakout', 'time_stop': 100, 'use_sma': False, 'use_atr': False, 'use_adx': False, 'use_ema': False, 'use_spike': False, 'rsi_required': False, 'edge_k': 0.47095079976787896, 'edge_cap': 0.33301004126873757}.
[I 2025-08-29 21:54:10,698] Trial 127 finished with values: [-1000000000.0, 1000000000.0] and parameters: {'p_sma': 48, 'p_std': 39, 'p_atr': 18, 'p_adx': 7, 'rsi_period': 56, 'ema1': 22, 'ema2': 45, 'slip_atr_k': 0.055990553590557504, 'slip_spread_k': 0.23334210236781816, 'spread_hl_frac': 0.04051393349416338, 'bb_std_mult': 2.606679745241587, 'rsi_os': 22, 'rsi_ob': 89, 'vol_spike': 0.14299696739173656, 'adx_thresh': 19.006270925771602, 'atr_min_pct': 0.015469920685654599, 'atr_max_pct': 0.13546087713934746, 'tp_mult': 1.468020781504365, 'tsl_mult': 0.12329285925371986, 'strategy': 'breakout', 'time_stop': 96, 'use_sma': False, 'use_atr': False, 'use_adx': False, 'use_ema': False, 'use_spike': False, 'rsi_required': False, 'edge_k': 1.3985723103710224, 'edge_cap': 0.7644804124163064}.
[I 2025-08-29 21:54:10,767] Trial 125 finished with values: [-1000000000.0, 1000000000.0] and parameters: {'p_sma': 6, 'p_std': 55, 'p_atr': 23, 'p_adx': 27, 'rsi_period': 67, 'ema1': 29, 'ema2': 43, 'slip_atr_k': 0.05446963466178728, 'slip_spread_k': 0.16453045756849322, 'spread_hl_frac': 0.042811628413186295, 'bb_std_mult': 2.62753218001812, 'rsi_os': 22, 'rsi_ob': 69, 'vol_spike': 0.19669207765150895, 'adx_thresh': 19.428575069983104, 'atr_min_pct': 0.014861101614994616, 'atr_max_pct': 0.13683434590095658, 'tp_mult': 1.4749288470163535, 'tsl_mult': 0.6902843682680931, 'strategy': 'breakout', 'time_stop': 88, 'use_sma': False, 'use_atr': False, 'use_adx': False, 'use_ema': False, 'use_spike': False, 'rsi_required': False, 'edge_k': 0.4693536103819612, 'edge_cap': 0.33506436349465296}.
[I 2025-08-29 21:54:36,681] Trial 128 finished with values: [-1000000000.0, 1000000000.0] and parameters: {'p_sma': 47, 'p_std': 51, 'p_atr': 20, 'p_adx': 7, 'rsi_period': 67, 'ema1': 8, 'ema2': 45, 'slip_atr_k': 0.017569927343436292, 'slip_spread_k': 0.23724396286736535, 'spread_hl_frac': 0.0406456410327002, 'bb_std_mult': 1.477609891882497, 'rsi_os': 36, 'rsi_ob': 61, 'vol_spike': 0.14355671384684607, 'adx_thresh': 8.327882939879972, 'atr_min_pct': 0.028715344726156052, 'atr_max_pct': 0.06370540719744437, 'tp_mult': 1.4602046859767706, 'tsl_mult': 0.8650462172956991, 'strategy': 'breakout', 'time_stop': 220, 'use_sma': False, 'use_atr': False, 'use_adx': False, 'use_ema': False, 'use_spike': False, 'rsi_required': False, 'edge_k': 1.4232456172348296, 'edge_cap': 0.7975454460949019}.
[I 2025-08-29 21:54:36,923] Trial 129 finished with values: [-1000000000.0, 1000000000.0] and parameters: {'p_sma': 17, 'p_std': 32, 'p_atr': 8, 'p_adx': 7, 'rsi_period': 76, 'ema1': 6, 'ema2': 41, 'slip_atr_k': 0.20479619406047794, 'slip_spread_k': 0.7192098410741763, 'spread_hl_frac': 0.04048076206283397, 'bb_std_mult': 2.5182282049341826, 'rsi_os': 30, 'rsi_ob': 89, 'vol_spike': 0.14086686260233286, 'adx_thresh': 32.58918350638672, 'atr_min_pct': 0.01639527960669245, 'atr_max_pct': 0.1027581069034879, 'tp_mult': 1.1168852735381947, 'tsl_mult': 0.47145967832756014, 'strategy': 'mean_reversion', 'time_stop': 177, 'use_sma': False, 'use_atr': False, 'use_adx': False, 'use_ema': False, 'use_spike': False, 'rsi_required': False, 'edge_k': 1.4026915129057136, 'edge_cap': 0.7945649494628982}.
[I 2025-08-29 21:54:37,116] Trial 131 finished with values: [-0.012816800864749567, 0.012771878017347802] and parameters: {'p_sma': 17, 'p_std': 42, 'p_atr': 8, 'p_adx': 23, 'rsi_period': 16, 'ema1': 8, 'ema2': 41, 'slip_atr_k': 0.21089590921344342, 'slip_spread_k': 0.6725859465354016, 'spread_hl_frac': 0.03133163606013743, 'bb_std_mult': 2.40424096234781, 'rsi_os': 25, 'rsi_ob': 66, 'vol_spike': 0.0032315786563339166, 'adx_thresh': 8.190672590059389, 'atr_min_pct': 0.0023511275988088664, 'atr_max_pct': 0.04754256643129661, 'tp_mult': 1.9369646436754686, 'tsl_mult': 0.9443792481553377, 'strategy': 'mean_reversion', 'time_stop': 232, 'use_sma': False, 'use_atr': False, 'use_adx': False, 'use_ema': False, 'use_spike': False, 'rsi_required': False, 'edge_k': 0.3902672295269779, 'edge_cap': 0.7940710320089894}.
[I 2025-08-29 21:54:37,374] Trial 130 finished with values: [-1000000000.0, 1000000000.0] and parameters: {'p_sma': 7, 'p_std': 32, 'p_atr': 20, 'p_adx': 7, 'rsi_period': 76, 'ema1': 8, 'ema2': 11, 'slip_atr_k': 0.1313789134477867, 'slip_spread_k': 0.1616312670028388, 'spread_hl_frac': 0.00905932303289133, 'bb_std_mult': 2.501369799166841, 'rsi_os': 36, 'rsi_ob': 66, 'vol_spike': 0.06988202996164537, 'adx_thresh': 9.878710637369647, 'atr_min_pct': 0.011617814209519262, 'atr_max_pct': 0.11429694699002971, 'tp_mult': 1.103466348455716, 'tsl_mult': 0.05934994620077233, 'strategy': 'mean_reversion', 'time_stop': 87, 'use_sma': False, 'use_atr': False, 'use_adx': False, 'use_ema': False, 'use_spike': False, 'rsi_required': False, 'edge_k': 0.37568971344762536, 'edge_cap': 0.7906245448187127}.
[I 2025-08-29 21:55:04,109] Trial 134 finished with values: [-0.0056100738870638045, 0.005604417537609338] and parameters: {'p_sma': 15, 'p_std': 10, 'p_atr': 29, 'p_adx': 16, 'rsi_period': 61, 'ema1': 16, 'ema2': 50, 'slip_atr_k': 0.03224171043612262, 'slip_spread_k': 0.21061586617481978, 'spread_hl_frac': 0.03823000221590339, 'bb_std_mult': 1.360896529620298, 'rsi_os': 24, 'rsi_ob': 72, 'vol_spike': 0.23360640549452044, 'adx_thresh': 17.466645024761426, 'atr_min_pct': 0.001647472577419401, 'atr_max_pct': 0.05110966748287038, 'tp_mult': 1.7183819845800006, 'tsl_mult': 0.8448824875390922, 'strategy': 'mean_reversion', 'time_stop': 123, 'use_sma': False, 'use_atr': False, 'use_adx': False, 'use_ema': False, 'use_spike': False, 'rsi_required': False, 'edge_k': 0.5446803621829833, 'edge_cap': 0.7440532433497262}.
[I 2025-08-29 21:55:04,439] Trial 132 finished with values: [-1000000000.0, 1000000000.0] and parameters: {'p_sma': 18, 'p_std': 32, 'p_atr': 29, 'p_adx': 13, 'rsi_period': 62, 'ema1': 16, 'ema2': 50, 'slip_atr_k': 0.04036125316425414, 'slip_spread_k': 0.677522120499169, 'spread_hl_frac': 0.002023004990088239, 'bb_std_mult': 2.442581261438391, 'rsi_os': 20, 'rsi_ob': 66, 'vol_spike': 0.06846727525124387, 'adx_thresh': 17.778127584568608, 'atr_min_pct': 0.0023676147227270276, 'atr_max_pct': 0.04768464424442298, 'tp_mult': 1.7096610738481068, 'tsl_mult': 0.2779596622990307, 'strategy': 'mean_reversion', 'time_stop': 179, 'use_sma': False, 'use_atr': False, 'use_adx': False, 'use_ema': False, 'use_spike': False, 'rsi_required': False, 'edge_k': 0.3775283888414691, 'edge_cap': 0.7423850497840644}.
[I 2025-08-29 21:55:04,575] Trial 133 finished with values: [-1000000000.0, 1000000000.0] and parameters: {'p_sma': 7, 'p_std': 17, 'p_atr': 21, 'p_adx': 11, 'rsi_period': 62, 'ema1': 8, 'ema2': 50, 'slip_atr_k': 0.04009975254187062, 'slip_spread_k': 0.672848312014865, 'spread_hl_frac': 0.00942485373643878, 'bb_std_mult': 1.0982222003508344, 'rsi_os': 20, 'rsi_ob': 94, 'vol_spike': 0.2276316453301879, 'adx_thresh': 17.880444649181584, 'atr_min_pct': 0.002305808072384113, 'atr_max_pct': 0.047484333295227464, 'tp_mult': 1.7101039918638028, 'tsl_mult': 0.25919361539831554, 'strategy': 'mean_reversion', 'time_stop': 165, 'use_sma': False, 'use_atr': False, 'use_adx': False, 'use_ema': False, 'use_spike': False, 'rsi_required': False, 'edge_k': 0.3807209293561103, 'edge_cap': 0.7160743379582248}.
