[I 2025-08-29 23:37:54,152] Trial 1109 finished with values: [-1000000000.0, 1000000000.0] and parameters: {'p_sma': 7, 'p_std': 43, 'p_atr': 30, 'p_adx': 14, 'rsi_period': 13, 'ema1': 29, 'ema2': 21, 'slip_atr_k': 0.1611040652358702, 'slip_spread_k': 0.4337570714347039, 'spread_hl_frac': 0.005510444135664181, 'bb_std_mult': 2.5154755378271627, 'rsi_os': 32, 'rsi_ob': 62, 'vol_spike': 0.09175835439590525, 'adx_thresh': 20.09868926584838, 'atr_min_pct': 0.01275802798036558, 'atr_max_pct': 0.06426919382838606, 'tp_mult': 1.9690369440549258, 'tsl_mult': 0.7005920202093263, 'strategy': 'mean_reversion', 'time_stop': 294, 'use_sma': False, 'use_atr': False, 'use_adx': False, 'use_ema': False, 'use_spike': False, 'rsi_required': False, 'edge_k': 1.965120888345809, 'edge_cap': 0.218403892712018}.
[I 2025-08-29 23:37:54,305] Trial 1106 finished with values: [-1000000000.0, 1000000000.0] and parameters: {'p_sma': 7, 'p_std': 12, 'p_atr': 7, 'p_adx': 14, 'rsi_period': 42, 'ema1': 26, 'ema2': 46, 'slip_atr_k': 0.013778462683376277, 'slip_spread_k': 0.7043192044817158, 'spread_hl_frac': 0.038623410904558925, 'bb_std_mult': 1.3671807241103393, 'rsi_os': 32, 'rsi_ob': 63, 'vol_spike': 0.13553220758060844, 'adx_thresh': 20.081059657857672, 'atr_min_pct': 0.009799284091242519, 'atr_max_pct': 0.06526780880715959, 'tp_mult': 2.0033258656806807, 'tsl_mult': 0.7593870810466539, 'strategy': 'mean_reversion', 'time_stop': 293, 'use_sma': False, 'use_atr': False, 'use_adx': False, 'use_ema': False, 'use_spike': False, 'rsi_required': False, 'edge_k': 1.6017109425293954, 'edge_cap': 0.3469679566414283}.
[I 2025-08-29 23:37:54,504] Trial 1107 finished with values: [-1000000000.0, 1000000000.0] and parameters: {'p_sma': 24, 'p_std': 31, 'p_atr': 7, 'p_adx': 14, 'rsi_period': 43, 'ema1': 16, 'ema2': 21, 'slip_atr_k': 0.012137053544015777, 'slip_spread_k': 0.31819794325111245, 'spread_hl_frac': 0.04653067254391919, 'bb_std_mult': 1.285018883042235, 'rsi_os': 7, 'rsi_ob': 68, 'vol_spike': 0.2716023394854592, 'adx_thresh': 17.750842721487498, 'atr_min_pct': 0.0035679026825277374, 'atr_max_pct': 0.09351976108416542, 'tp_mult': 1.1654613843597013, 'tsl_mult': 0.412350306022615, 'strategy': 'mean_reversion', 'time_stop': 294, 'use_sma': False, 'use_atr': False, 'use_adx': False, 'use_ema': False, 'use_spike': False, 'rsi_required': False, 'edge_k': 1.9078118817346013, 'edge_cap': 0.21240740663262106}.
[I 2025-08-29 23:37:54,784] Trial 1111 finished with values: [-1000000000.0, 1000000000.0] and parameters: {'p_sma': 57, 'p_std': 50, 'p_atr': 12, 'p_adx': 11, 'rsi_period': 21, 'ema1': 30, 'ema2': 21, 'slip_atr_k': 6.27646400925215e-05, 'slip_spread_k': 0.9592303396039195, 'spread_hl_frac': 0.046266702322460704, 'bb_std_mult': 1.3760322832001908, 'rsi_os': 36, 'rsi_ob': 69, 'vol_spike': 0.2675859963932452, 'adx_thresh': 23.23643597293685, 'atr_min_pct': 0.01809449263469942, 'atr_max_pct': 0.014019554356997171, 'tp_mult': 1.9386322181646662, 'tsl_mult': 0.4112234718941653, 'strategy': 'mean_reversion', 'time_stop': 289, 'use_sma': False, 'use_atr': False, 'use_adx': False, 'use_ema': False, 'use_spike': False, 'rsi_required': False, 'edge_k': 0.8524456856124552, 'edge_cap': 0.10285086809471572}.
[I 2025-08-29 23:38:21,996] Trial 1112 finished with values: [-1000000000.0, 1000000000.0] and parameters: {'p_sma': 24, 'p_std': 10, 'p_atr': 12, 'p_adx': 11, 'rsi_period': 21, 'ema1': 14, 'ema2': 21, 'slip_atr_k': 0.007435896628042825, 'slip_spread_k': 0.09710899388039768, 'spread_hl_frac': 0.008110421041899907, 'bb_std_mult': 2.177882388873824, 'rsi_os': 5, 'rsi_ob': 71, 'vol_spike': 0.11304081580114846, 'adx_thresh': 17.7443302749859, 'atr_min_pct': 0.008626755404444235, 'atr_max_pct': 0.014146175348717649, 'tp_mult': 1.931265352565751, 'tsl_mult': 0.6668471844692895, 'strategy': 'mean_reversion', 'time_stop': 287, 'use_sma': False, 'use_atr': False, 'use_adx': False, 'use_ema': False, 'use_spike': False, 'rsi_required': False, 'edge_k': 1.4206023927716758, 'edge_cap': 0.1885442731981848}.
[I 2025-08-29 23:38:22,151] Trial 1110 finished with values: [-1000000000.0, 1000000000.0] and parameters: {'p_sma': 31, 'p_std': 12, 'p_atr': 12, 'p_adx': 15, 'rsi_period': 13, 'ema1': 29, 'ema2': 21, 'slip_atr_k': 0.00877011034419217, 'slip_spread_k': 0.9596854728110138, 'spread_hl_frac': 0.009457830548371725, 'bb_std_mult': 1.3816653143018376, 'rsi_os': 36, 'rsi_ob': 93, 'vol_spike': 0.10839510324759548, 'adx_thresh': 20.194909208191703, 'atr_min_pct': 0.008650144324081763, 'atr_max_pct': 0.040873312885554645, 'tp_mult': 1.9827325348743314, 'tsl_mult': 0.13461954897351008, 'strategy': 'mean_reversion', 'time_stop': 122, 'use_sma': False, 'use_atr': False, 'use_adx': False, 'use_ema': False, 'use_spike': False, 'rsi_required': False, 'edge_k': 1.5940297006320105, 'edge_cap': 0.10304807951284482}.
[I 2025-08-29 23:38:22,492] Trial 1113 finished with values: [-1000000000.0, 1000000000.0] and parameters: {'p_sma': 31, 'p_std': 25, 'p_atr': 12, 'p_adx': 15, 'rsi_period': 21, 'ema1': 20, 'ema2': 55, 'slip_atr_k': 0.008581271280640396, 'slip_spread_k': 0.08836839474241642, 'spread_hl_frac': 0.008876888686851409, 'bb_std_mult': 1.441992913669376, 'rsi_os': 37, 'rsi_ob': 65, 'vol_spike': 0.16705980709970591, 'adx_thresh': 23.02950200703133, 'atr_min_pct': 0.02326245489195617, 'atr_max_pct': 0.07842518516432614, 'tp_mult': 2.521715812659927, 'tsl_mult': 0.661294077496011, 'strategy': 'breakout', 'time_stop': 286, 'use_sma': False, 'use_atr': False, 'use_adx': False, 'use_ema': False, 'use_spike': False, 'rsi_required': False, 'edge_k': 1.9243349791365316, 'edge_cap': 0.7999443589655518}.
[I 2025-08-29 23:38:22,647] Trial 1114 finished with values: [-1000000000.0, 1000000000.0] and parameters: {'p_sma': 26, 'p_std': 18, 'p_atr': 12, 'p_adx': 11, 'rsi_period': 18, 'ema1': 30, 'ema2': 22, 'slip_atr_k': 0.0066982758290009764, 'slip_spread_k': 0.2576477777471557, 'spread_hl_frac': 0.030911928429444305, 'bb_std_mult': 2.181816075343691, 'rsi_os': 41, 'rsi_ob': 58, 'vol_spike': 0.24142973227629577, 'adx_thresh': 20.78589841163861, 'atr_min_pct': 0.020822140080081947, 'atr_max_pct': 0.10707212157536994, 'tp_mult': 1.5771948849752362, 'tsl_mult': 0.6626122186965404, 'strategy': 'breakout', 'time_stop': 213, 'use_sma': False, 'use_atr': False, 'use_adx': False, 'use_ema': False, 'use_spike': False, 'rsi_required': False, 'edge_k': 1.9207794755188388, 'edge_cap': 0.18482814405858383}.
[I 2025-08-29 23:38:50,260] Trial 1117 finished with values: [-1000000000.0, 1000000000.0] and parameters: {'p_sma': 27, 'p_std': 15, 'p_atr': 12, 'p_adx': 7, 'rsi_period': 18, 'ema1': 30, 'ema2': 57, 'slip_atr_k': 0.06212562744969223, 'slip_spread_k': 0.2604738218021491, 'spread_hl_frac': 0.021756716476344515, 'bb_std_mult': 2.3863299712135273, 'rsi_os': 51, 'rsi_ob': 58, 'vol_spike': 0.1452508635999736, 'adx_thresh': 31.202768236999386, 'atr_min_pct': 0.020611516694051875, 'atr_max_pct': 0.07244293556055341, 'tp_mult': 1.8837375069011741, 'tsl_mult': 0.6229904870920596, 'strategy': 'breakout', 'time_stop': 272, 'use_sma': False, 'use_atr': False, 'use_adx': False, 'use_ema': False, 'use_spike': False, 'rsi_required': False, 'edge_k': 1.96212553108137, 'edge_cap': 0.623710587107137}.
[I 2025-08-29 23:38:50,511] Trial 1115 finished with values: [-1000000000.0, 1000000000.0] and parameters: {'p_sma': 31, 'p_std': 13, 'p_atr': 12, 'p_adx': 12, 'rsi_period': 11, 'ema1': 24, 'ema2': 41, 'slip_atr_k': 0.004315577353904872, 'slip_spread_k': 0.5624687695138791, 'spread_hl_frac': 0.009387017548352545, 'bb_std_mult': 1.5647335162404536, 'rsi_os': 34, 'rsi_ob': 82, 'vol_spike': 0.1644992711422682, 'adx_thresh': 20.770464350962545, 'atr_min_pct': 0.0043658898427115355, 'atr_max_pct': 0.07850929698159828, 'tp_mult': 2.5240703328489293, 'tsl_mult': 0.6226371416184022, 'strategy': 'breakout', 'time_stop': 75, 'use_sma': False, 'use_atr': False, 'use_adx': False, 'use_ema': False, 'use_spike': False, 'rsi_required': False, 'edge_k': 1.9289763848402637, 'edge_cap': 0.6784606838647358}.
[I 2025-08-29 23:38:50,633] Trial 1116 finished with values: [-0.0451986996879723, 0.04518847816993145] and parameters: {'p_sma': 27, 'p_std': 25, 'p_atr': 12, 'p_adx': 7, 'rsi_period': 11, 'ema1': 25, 'ema2': 44, 'slip_atr_k': 3.841189274866863e-06, 'slip_spread_k': 0.6727917083542067, 'spread_hl_frac': 0.016818827647944328, 'bb_std_mult': 1.5690132317744183, 'rsi_os': 34, 'rsi_ob': 58, 'vol_spike': 0.16559432188327644, 'adx_thresh': 26.950857830852847, 'atr_min_pct': 0.0005834596926021099, 'atr_max_pct': 0.0777986943502054, 'tp_mult': 2.52112726519416, 'tsl_mult': 0.6176702780379281, 'strategy': 'breakout', 'time_stop': 283, 'use_sma': False, 'use_atr': False, 'use_adx': False, 'use_ema': False, 'use_spike': False, 'rsi_required': False, 'edge_k': 0.7085602891449736, 'edge_cap': 0.18383238221764614}.
[I 2025-08-29 23:38:50,703] Trial 1118 finished with values: [-1000000000.0, 1000000000.0] and parameters: {'p_sma': 27, 'p_std': 6, 'p_atr': 12, 'p_adx': 7, 'rsi_period': 7, 'ema1': 22, 'ema2': 36, 'slip_atr_k': 0.06166916036091033, 'slip_spread_k': 0.28430259003134917, 'spread_hl_frac': 0.016761687695839352, 'bb_std_mult': 2.637848697132225, 'rsi_os': 29, 'rsi_ob': 61, 'vol_spike': 0.25008757426533856, 'adx_thresh': 31.22155137596659, 'atr_min_pct': 0.010444637214513719, 'atr_max_pct': 0.06628383279779092, 'tp_mult': 2.7333105063890932, 'tsl_mult': 0.9566344596650717, 'strategy': 'mean_reversion', 'time_stop': 274, 'use_sma': False, 'use_atr': False, 'use_adx': False, 'use_ema': False, 'use_spike': False, 'rsi_required': False, 'edge_k': 1.6959498860309858, 'edge_cap': 0.07637010168281233}.
[I 2025-08-29 23:38:51,008] Trial 1122 finished with values: [-1000000000.0, 1000000000.0] and parameters: {'p_sma': 30, 'p_std': 9, 'p_atr': 12, 'p_adx': 11, 'rsi_period': 79, 'ema1': 29, 'ema2': 38, 'slip_atr_k': 0.020161011936490867, 'slip_spread_k': 0.2851839389536317, 'spread_hl_frac': 0.011336533202214408, 'bb_std_mult': 1.8726693908401049, 'rsi_os': 45, 'rsi_ob': 49, 'vol_spike': 0.19476705295515628, 'adx_thresh': 21.982633090896243, 'atr_min_pct': 0.007637600990066397, 'atr_max_pct': 0.07463091580831685, 'tp_mult': 1.8296740304466226, 'tsl_mult': 0.591078865438259, 'strategy': 'mean_reversion', 'time_stop': 31, 'use_sma': False, 'use_atr': False, 'use_adx': False, 'use_ema': False, 'use_spike': False, 'rsi_required': False, 'edge_k': 0.8033725117674394, 'edge_cap': 0.1322255139717044}.
[I 2025-08-29 23:39:18,521] Trial 1120 finished with values: [-0.050025052234382694, 0.05001264329606621] and parameters: {'p_sma': 27, 'p_std': 14, 'p_atr': 12, 'p_adx': 11, 'rsi_period': 15, 'ema1': 29, 'ema2': 20, 'slip_atr_k': 0.22000905715224522, 'slip_spread_k': 0.285183786325846, 'spread_hl_frac': 0.011315379722469113, 'bb_std_mult': 0.6877603788552755, 'rsi_os': 33, 'rsi_ob': 62, 'vol_spike': 0.24981341876151492, 'adx_thresh': 22.126799958149313, 'atr_min_pct': 0.000752783358423389, 'atr_max_pct': 0.07499558029552997, 'tp_mult': 1.830485104610012, 'tsl_mult': 0.5820736568816278, 'strategy': 'mean_reversion', 'time_stop': 285, 'use_sma': False, 'use_atr': False, 'use_adx': False, 'use_ema': False, 'use_spike': False, 'rsi_required': False, 'edge_k': 1.6961274879319534, 'edge_cap': 0.1308939158735929}.
[I 2025-08-29 23:39:18,545] Trial 1121 finished with values: [-1000000000.0, 1000000000.0] and parameters: {'p_sma': 30, 'p_std': 9, 'p_atr': 12, 'p_adx': 11, 'rsi_period': 15, 'ema1': 29, 'ema2': 23, 'slip_atr_k': 0.01949688349658386, 'slip_spread_k': 0.287663918889838, 'spread_hl_frac': 0.011700713825677035, 'bb_std_mult': 1.0691502277094498, 'rsi_os': 17, 'rsi_ob': 63, 'vol_spike': 0.2568524601524397, 'adx_thresh': 19.294310880828924, 'atr_min_pct': 0.013356942232725277, 'atr_max_pct': 0.07390235971822168, 'tp_mult': 1.7857746919773925, 'tsl_mult': 0.5867677245940053, 'strategy': 'mean_reversion', 'time_stop': 284, 'use_sma': False, 'use_atr': False, 'use_adx': False, 'use_ema': False, 'use_spike': False, 'rsi_required': False, 'edge_k': 0.5286506513837815, 'edge_cap': 0.13675303538540745}.
[I 2025-08-29 23:39:18,838] Trial 1123 finished with values: [-1000000000.0, 1000000000.0] and parameters: {'p_sma': 29, 'p_std': 13, 'p_atr': 12, 'p_adx': 18, 'rsi_period': 56, 'ema1': 30, 'ema2': 60, 'slip_atr_k': 0.00452917875931388, 'slip_spread_k': 0.8807112346165116, 'spread_hl_frac': 0.012090730153096429, 'bb_std_mult': 1.4714211740192726, 'rsi_os': 31, 'rsi_ob': 63, 'vol_spike': 0.06043667181102523, 'adx_thresh': 16.28174158805786, 'atr_min_pct': 0.019922350789387918, 'atr_max_pct': 0.07083630915017765, 'tp_mult': 1.779642732386793, 'tsl_mult': 0.6421959171008591, 'strategy': 'mean_reversion', 'time_stop': 14, 'use_sma': False, 'use_atr': False, 'use_adx': False, 'use_ema': False, 'use_spike': False, 'rsi_required': False, 'edge_k': 1.8725137685279913, 'edge_cap': 0.9743384011685909}.
[I 2025-08-29 23:39:18,918] Trial 1119 finished with values: [-1000000000.0, 1000000000.0] and parameters: {'p_sma': 30, 'p_std': 13, 'p_atr': 12, 'p_adx': 26, 'rsi_period': 52, 'ema1': 25, 'ema2': 45, 'slip_atr_k': 0.00486719831950028, 'slip_spread_k': 0.2877346737565492, 'spread_hl_frac': 0.012120232607307085, 'bb_std_mult': 1.072880849021663, 'rsi_os': 34, 'rsi_ob': 82, 'vol_spike': 0.2568015661719874, 'adx_thresh': 19.23089677616036, 'atr_min_pct': 0.011126693532254995, 'atr_max_pct': 0.07348021952141233, 'tp_mult': 1.8234753242190869, 'tsl_mult': 0.5939111207193765, 'strategy': 'mean_reversion', 'time_stop': 180, 'use_sma': False, 'use_atr': False, 'use_adx': False, 'use_ema': False, 'use_spike': False, 'rsi_required': False, 'edge_k': 1.8655666461088665, 'edge_cap': 0.9765836925204276}.
[I 2025-08-29 23:39:46,556] Trial 1126 finished with values: [-1000000000.0, 1000000000.0] and parameters: {'p_sma': 35, 'p_std': 12, 'p_atr': 8, 'p_adx': 26, 'rsi_period': 10, 'ema1': 30, 'ema2': 22, 'slip_atr_k': 7.261368253347046e-05, 'slip_spread_k': 0.3568458722171932, 'spread_hl_frac': 0.010727045639742177, 'bb_std_mult': 1.2230421315198259, 'rsi_os': 35, 'rsi_ob': 86, 'vol_spike': 0.2656624484949781, 'adx_thresh': 8.700568206284972, 'atr_min_pct': 0.011169076492027894, 'atr_max_pct': 0.1017631929729882, 'tp_mult': 1.8882609078291253, 'tsl_mult': 0.6392561320098641, 'strategy': 'mean_reversion', 'time_stop': 168, 'use_sma': False, 'use_atr': False, 'use_adx': False, 'use_ema': False, 'use_spike': False, 'rsi_required': False, 'edge_k': 0.1030252402992301, 'edge_cap': 0.9185587120765923}.
[I 2025-08-29 23:39:46,741] Trial 1124 finished with values: [-1000000000.0, 1000000000.0] and parameters: {'p_sma': 35, 'p_std': 13, 'p_atr': 11, 'p_adx': 14, 'rsi_period': 10, 'ema1': 30, 'ema2': 22, 'slip_atr_k': 0.00011772266077312161, 'slip_spread_k': 0.4608595123262119, 'spread_hl_frac': 0.01223111405355306, 'bb_std_mult': 1.4617689462807508, 'rsi_os': 31, 'rsi_ob': 63, 'vol_spike': 0.2657049700463558, 'adx_thresh': 21.455201368820266, 'atr_min_pct': 0.00606155452224468, 'atr_max_pct': 0.07131476771273663, 'tp_mult': 1.893713320147785, 'tsl_mult': 0.6425525243223772, 'strategy': 'mean_reversion', 'time_stop': 265, 'use_sma': False, 'use_atr': False, 'use_adx': False, 'use_ema': False, 'use_spike': False, 'rsi_required': False, 'edge_k': 0.08177037147938093, 'edge_cap': 0.2389481760477023}.
[I 2025-08-29 23:39:46,857] Trial 1125 finished with values: [-1000000000.0, 1000000000.0] and parameters: {'p_sma': 29, 'p_std': 42, 'p_atr': 11, 'p_adx': 25, 'rsi_period': 12, 'ema1': 30, 'ema2': 20, 'slip_atr_k': 0.1393986703483786, 'slip_spread_k': 0.5966649142844229, 'spread_hl_frac': 0.03979472120307707, 'bb_std_mult': 1.4644854967795016, 'rsi_os': 31, 'rsi_ob': 63, 'vol_spike': 0.26640486373652383, 'adx_thresh': 14.163542160607715, 'atr_min_pct': 0.025831601649013897, 'atr_max_pct': 0.10182210199604598, 'tp_mult': 1.9037829387459326, 'tsl_mult': 0.8340515285964041, 'strategy': 'mean_reversion', 'time_stop': 269, 'use_sma': False, 'use_atr': False, 'use_adx': False, 'use_ema': False, 'use_spike': False, 'rsi_required': False, 'edge_k': 1.8589257364972671, 'edge_cap': 0.23276043040116776}.
[I 2025-08-29 23:39:46,984] Trial 1127 finished with values: [-1000000000.0, 1000000000.0] and parameters: {'p_sma': 35, 'p_std': 12, 'p_atr': 13, 'p_adx': 15, 'rsi_period': 78, 'ema1': 30, 'ema2': 22, 'slip_atr_k': 0.011383845309558811, 'slip_spread_k': 0.6003986494471455, 'spread_hl_frac': 0.002314149180015431, 'bb_std_mult': 1.2366876324694889, 'rsi_os': 31, 'rsi_ob': 61, 'vol_spike': 0.014842203539599641, 'adx_thresh': 14.015647596235757, 'atr_min_pct': 0.006222535212113918, 'atr_max_pct': 0.06662458822315055, 'tp_mult': 2.201153477209548, 'tsl_mult': 0.6407651486406929, 'strategy': 'mean_reversion', 'time_stop': 250, 'use_sma': False, 'use_atr': False, 'use_adx': False, 'use_ema': False, 'use_spike': False, 'rsi_required': False, 'edge_k': 1.1719062040175015, 'edge_cap': 0.20380692370285194}.
[I 2025-08-29 23:39:47,304] Trial 1128 finished with values: [-1000000000.0, 1000000000.0] and parameters: {'p_sma': 34, 'p_std': 10, 'p_atr': 19, 'p_adx': 14, 'rsi_period': 12, 'ema1': 30, 'ema2': 20, 'slip_atr_k': 0.13926850209849312, 'slip_spread_k': 0.6080209332881112, 'spread_hl_frac': 0.04169999891622182, 'bb_std_mult': 1.327954701768152, 'rsi_os': 32, 'rsi_ob': 47, 'vol_spike': 0.24425259472452482, 'adx_thresh': 28.794426652342835, 'atr_min_pct': 0.016580370346109093, 'atr_max_pct': 0.06741420469470678, 'tp_mult': 1.5469508155156098, 'tsl_mult': 0.3377139599336896, 'strategy': 'mean_reversion', 'time_stop': 239, 'use_sma': False, 'use_atr': False, 'use_adx': False, 'use_ema': False, 'use_spike': False, 'rsi_required': False, 'edge_k': 0.20961852908491663, 'edge_cap': 0.23585135219518885}.
[I 2025-08-29 23:40:14,355] Trial 1131 finished with values: [-1000000000.0, 1000000000.0] and parameters: {'p_sma': 32, 'p_std': 10, 'p_atr': 11, 'p_adx': 14, 'rsi_period': 13, 'ema1': 20, 'ema2': 23, 'slip_atr_k': 0.13324584195475497, 'slip_spread_k': 0.25086430493671363, 'spread_hl_frac': 0.010235344906445927, 'bb_std_mult': 1.3427722107516777, 'rsi_os': 33, 'rsi_ob': 60, 'vol_spike': 0.2796367237770018, 'adx_thresh': 11.887422497508181, 'atr_min_pct': 0.01633123221645107, 'atr_max_pct': 0.06954638430627658, 'tp_mult': 1.5477638538902991, 'tsl_mult': 0.6127451939965619, 'strategy': 'mean_reversion', 'time_stop': 206, 'use_sma': False, 'use_atr': False, 'use_adx': False, 'use_ema': False, 'use_spike': False, 'rsi_required': False, 'edge_k': 1.9639292506746815, 'edge_cap': 0.16589528805889397}.
[I 2025-08-29 23:40:14,731] Trial 1130 finished with values: [-1000000000.0, 1000000000.0] and parameters: {'p_sma': 32, 'p_std': 48, 'p_atr': 13, 'p_adx': 15, 'rsi_period': 83, 'ema1': 28, 'ema2': 20, 'slip_atr_k': 0.012807002458630102, 'slip_spread_k': 0.5049973785649313, 'spread_hl_frac': 0.02251420908921596, 'bb_std_mult': 1.356270048536193, 'rsi_os': 33, 'rsi_ob': 61, 'vol_spike': 0.24307495106444055, 'adx_thresh': 20.669928262344953, 'atr_min_pct': 0.012154929715793353, 'atr_max_pct': 0.06654343026689076, 'tp_mult': 2.048091355728112, 'tsl_mult': 0.34224906411982703, 'strategy': 'mean_reversion', 'time_stop': 291, 'use_sma': False, 'use_atr': False, 'use_adx': False, 'use_ema': False, 'use_spike': False, 'rsi_required': False, 'edge_k': 0.20015330769513795, 'edge_cap': 0.20245647663407135}.
[I 2025-08-29 23:40:14,912] Trial 1129 finished with values: [-0.034088326167611704, 0.034088732323115205] and parameters: {'p_sma': 26, 'p_std': 10, 'p_atr': 11, 'p_adx': 15, 'rsi_period': 12, 'ema1': 28, 'ema2': 20, 'slip_atr_k': 0.1554545207119048, 'slip_spread_k': 0.5084377099446157, 'spread_hl_frac': 0.03986801630110288, 'bb_std_mult': 1.3459587940677988, 'rsi_os': 32, 'rsi_ob': 61, 'vol_spike': 0.28317040909071967, 'adx_thresh': 20.899347878876174, 'atr_min_pct': 0.0015011709247405138, 'atr_max_pct': 0.02267586901814584, 'tp_mult': 1.9978840311417785, 'tsl_mult': 0.6139877255696273, 'strategy': 'mean_reversion', 'time_stop': 295, 'use_sma': False, 'use_atr': False, 'use_adx': False, 'use_ema': False, 'use_spike': False, 'rsi_required': False, 'edge_k': 1.969476376397339, 'edge_cap': 0.2715471778944269}.
[I 2025-08-29 23:40:15,116] Trial 1132 finished with values: [-1000000000.0, 1000000000.0] and parameters: {'p_sma': 32, 'p_std': 48, 'p_atr': 12, 'p_adx': 15, 'rsi_period': 66, 'ema1': 28, 'ema2': 23, 'slip_atr_k': 0.004071164390656604, 'slip_spread_k': 0.31453451460696313, 'spread_hl_frac': 0.010591555431546223, 'bb_std_mult': 1.4014842083772148, 'rsi_os': 33, 'rsi_ob': 60, 'vol_spike': 0.2857647167592482, 'adx_thresh': 20.660331938349028, 'atr_min_pct': 0.012170618864717752, 'atr_max_pct': 0.026308771164412166, 'tp_mult': 1.9711513207951643, 'tsl_mult': 0.6106346898974596, 'strategy': 'breakout', 'time_stop': 207, 'use_sma': False, 'use_atr': False, 'use_adx': False, 'use_ema': False, 'use_spike': False, 'rsi_required': False, 'edge_k': 1.9360034045915733, 'edge_cap': 0.1663608542013012}.
[I 2025-08-29 23:40:42,220] Trial 1135 finished with values: [-1000000000.0, 1000000000.0] and parameters: {'p_sma': 25, 'p_std': 15, 'p_atr': 28, 'p_adx': 19, 'rsi_period': 7, 'ema1': 29, 'ema2': 19, 'slip_atr_k': 0.20033798219643917, 'slip_spread_k': 0.18667002912253466, 'spread_hl_frac': 0.014289485513665394, 'bb_std_mult': 3.2661956789061, 'rsi_os': 35, 'rsi_ob': 62, 'vol_spike': 0.09992298251250434, 'adx_thresh': 21.60923106747278, 'atr_min_pct': 0.0094077017173011, 'atr_max_pct': 0.0635207403174447, 'tp_mult': 1.962064158401993, 'tsl_mult': 0.6216441920179071, 'strategy': 'breakout', 'time_stop': 281, 'use_sma': False, 'use_atr': False, 'use_adx': False, 'use_ema': False, 'use_spike': False, 'rsi_required': False, 'edge_k': 1.9019110803934358, 'edge_cap': 0.17158960864928655}.
