[I 2025-08-29 23:01:35,333] Trial 757 finished with values: [-1000000000.0, 1000000000.0] and parameters: {'p_sma': 43, 'p_std': 13, 'p_atr': 15, 'p_adx': 9, 'rsi_period': 9, 'ema1': 30, 'ema2': 43, 'slip_atr_k': 0.23436014059990173, 'slip_spread_k': 0.3128201475158381, 'spread_hl_frac': 0.009301471696696541, 'bb_std_mult': 1.3453184173689694, 'rsi_os': 32, 'rsi_ob': 67, 'vol_spike': 0.2643264665899113, 'adx_thresh': 22.45394206140111, 'atr_min_pct': 0.025738280511203044, 'atr_max_pct': 0.05665469954573202, 'tp_mult': 2.014697361005535, 'tsl_mult': 0.2526463227606697, 'strategy': 'breakout', 'time_stop': 273, 'use_sma': False, 'use_atr': False, 'use_adx': False, 'use_ema': False, 'use_spike': False, 'rsi_required': False, 'edge_k': 1.902415165500219, 'edge_cap': 0.7901800602414282}.
[I 2025-08-29 23:01:35,826] Trial 759 finished with values: [-1000000000.0, 1000000000.0] and parameters: {'p_sma': 32, 'p_std': 14, 'p_atr': 29, 'p_adx': 16, 'rsi_period': 10, 'ema1': 29, 'ema2': 19, 'slip_atr_k': 0.0048157091391874815, 'slip_spread_k': 0.25935893046922753, 'spread_hl_frac': 0.01258372020115158, 'bb_std_mult': 2.6420928385994444, 'rsi_os': 32, 'rsi_ob': 83, 'vol_spike': 0.2338698896651517, 'adx_thresh': 17.357678295121673, 'atr_min_pct': 0.019480455351240218, 'atr_max_pct': 0.061494182665284, 'tp_mult': 2.0307045016533376, 'tsl_mult': 0.3678676786813323, 'strategy': 'mean_reversion', 'time_stop': 65, 'use_sma': False, 'use_atr': False, 'use_adx': False, 'use_ema': False, 'use_spike': False, 'rsi_required': False, 'edge_k': 0.14538997849945112, 'edge_cap': 0.884067229719086}.
[I 2025-08-29 23:01:35,865] Trial 756 finished with values: [-0.022702230797439382, 0.02269397020853586] and parameters: {'p_sma': 43, 'p_std': 13, 'p_atr': 15, 'p_adx': 9, 'rsi_period': 84, 'ema1': 30, 'ema2': 20, 'slip_atr_k': 0.0053336289458850925, 'slip_spread_k': 0.3331185938430851, 'spread_hl_frac': 0.008351800893872257, 'bb_std_mult': 3.5252831430671354, 'rsi_os': 31, 'rsi_ob': 55, 'vol_spike': 0.2007990470236845, 'adx_thresh': 12.893420437310333, 'atr_min_pct': 0.0007014956101848036, 'atr_max_pct': 0.021042519019747408, 'tp_mult': 2.031603926195784, 'tsl_mult': 0.2502514897264894, 'strategy': 'breakout', 'time_stop': 50, 'use_sma': False, 'use_atr': False, 'use_adx': False, 'use_ema': False, 'use_spike': False, 'rsi_required': False, 'edge_k': 1.9052254044179822, 'edge_cap': 0.2043356650500061}.
[I 2025-08-29 23:01:35,939] Trial 758 finished with values: [-1000000000.0, 1000000000.0] and parameters: {'p_sma': 60, 'p_std': 13, 'p_atr': 29, 'p_adx': 9, 'rsi_period': 10, 'ema1': 29, 'ema2': 43, 'slip_atr_k': 4.262340478129972e-05, 'slip_spread_k': 0.3059904511774241, 'spread_hl_frac': 0.00879813764493062, 'bb_std_mult': 1.4487741677986812, 'rsi_os': 32, 'rsi_ob': 51, 'vol_spike': 0.2653240268185346, 'adx_thresh': 8.395995315247609, 'atr_min_pct': 0.006338363433591191, 'atr_max_pct': 0.07006445283034748, 'tp_mult': 1.8831889219442648, 'tsl_mult': 0.24883771404047167, 'strategy': 'mean_reversion', 'time_stop': 49, 'use_sma': False, 'use_atr': False, 'use_adx': False, 'use_ema': False, 'use_spike': False, 'rsi_required': False, 'edge_k': 1.9652863345319496, 'edge_cap': 0.9495034025874936}.
[I 2025-08-29 23:01:36,200] Trial 762 finished with values: [-1000000000.0, 1000000000.0] and parameters: {'p_sma': 30, 'p_std': 11, 'p_atr': 7, 'p_adx': 26, 'rsi_period': 12, 'ema1': 30, 'ema2': 23, 'slip_atr_k': 0.11595481080621706, 'slip_spread_k': 0.2540867555455664, 'spread_hl_frac': 0.011299581042522471, 'bb_std_mult': 2.10964028825042, 'rsi_os': 51, 'rsi_ob': 61, 'vol_spike': 0.10485981356659627, 'adx_thresh': 8.74242854557297, 'atr_min_pct': 0.0064432910987683185, 'atr_max_pct': 0.08148022361411755, 'tp_mult': 1.882955468379035, 'tsl_mult': 0.6436384032872826, 'strategy': 'mean_reversion', 'time_stop': 285, 'use_sma': False, 'use_atr': False, 'use_adx': False, 'use_ema': False, 'use_spike': False, 'rsi_required': False, 'edge_k': 1.7987859479597057, 'edge_cap': 0.22375854394379857}.
[I 2025-08-29 23:02:03,461] Trial 760 finished with values: [-1000000000.0, 1000000000.0] and parameters: {'p_sma': 37, 'p_std': 14, 'p_atr': 14, 'p_adx': 26, 'rsi_period': 11, 'ema1': 12, 'ema2': 19, 'slip_atr_k': 0.005432435621111739, 'slip_spread_k': 0.254790207489535, 'spread_hl_frac': 0.04697167497717012, 'bb_std_mult': 2.1152901233333212, 'rsi_os': 31, 'rsi_ob': 61, 'vol_spike': 0.25585979208237336, 'adx_thresh': 8.279693475059204, 'atr_min_pct': 0.006885700936574728, 'atr_max_pct': 0.06891795846729883, 'tp_mult': 1.8853270495780365, 'tsl_mult': 0.6399757084497943, 'strategy': 'mean_reversion', 'time_stop': 286, 'use_sma': False, 'use_atr': False, 'use_adx': False, 'use_ema': False, 'use_spike': False, 'rsi_required': False, 'edge_k': 1.963032070198764, 'edge_cap': 0.22289352396275727}.
[I 2025-08-29 23:02:03,639] Trial 763 finished with values: [-1000000000.0, 1000000000.0] and parameters: {'p_sma': 24, 'p_std': 44, 'p_atr': 25, 'p_adx': 13, 'rsi_period': 13, 'ema1': 30, 'ema2': 21, 'slip_atr_k': 0.011267286364171172, 'slip_spread_k': 0.2537748953279938, 'spread_hl_frac': 0.044175610211039, 'bb_std_mult': 2.1090050561710574, 'rsi_os': 37, 'rsi_ob': 64, 'vol_spike': 0.25330132172079173, 'adx_thresh': 20.559702099421575, 'atr_min_pct': 0.005203199028474168, 'atr_max_pct': 0.08204829027375948, 'tp_mult': 1.3433789108009384, 'tsl_mult': 0.6444481021271976, 'strategy': 'mean_reversion', 'time_stop': 278, 'use_sma': False, 'use_atr': False, 'use_adx': False, 'use_ema': False, 'use_spike': False, 'rsi_required': False, 'edge_k': 0.7992363168525791, 'edge_cap': 0.13619168960833083}.
[I 2025-08-29 23:02:03,726] Trial 761 finished with values: [-1000000000.0, 1000000000.0] and parameters: {'p_sma': 24, 'p_std': 11, 'p_atr': 14, 'p_adx': 18, 'rsi_period': 76, 'ema1': 30, 'ema2': 21, 'slip_atr_k': 0.054815449658698126, 'slip_spread_k': 0.14846411831637213, 'spread_hl_frac': 0.043930926168542286, 'bb_std_mult': 2.104595281922044, 'rsi_os': 7, 'rsi_ob': 61, 'vol_spike': 0.25350836704925256, 'adx_thresh': 20.64680207954256, 'atr_min_pct': 0.0068992752921015945, 'atr_max_pct': 0.021089937288515957, 'tp_mult': 1.9021218557787951, 'tsl_mult': 0.746957349590248, 'strategy': 'mean_reversion', 'time_stop': 51, 'use_sma': False, 'use_atr': False, 'use_adx': False, 'use_ema': False, 'use_spike': False, 'rsi_required': False, 'edge_k': 0.7994628270661989, 'edge_cap': 0.6846761450044588}.
[I 2025-08-29 23:02:03,819] Trial 764 finished with values: [-1000000000.0, 1000000000.0] and parameters: {'p_sma': 29, 'p_std': 21, 'p_atr': 14, 'p_adx': 15, 'rsi_period': 14, 'ema1': 12, 'ema2': 21, 'slip_atr_k': 0.012927982643772408, 'slip_spread_k': 0.14871555310518175, 'spread_hl_frac': 0.019287966900144376, 'bb_std_mult': 1.1889903670480506, 'rsi_os': 33, 'rsi_ob': 64, 'vol_spike': 0.25306703393069263, 'adx_thresh': 20.49474992591961, 'atr_min_pct': 0.005225272314360379, 'atr_max_pct': 0.09212280431113834, 'tp_mult': 1.2135094181049815, 'tsl_mult': 0.7172963523401038, 'strategy': 'mean_reversion', 'time_stop': 265, 'use_sma': False, 'use_atr': False, 'use_adx': False, 'use_ema': False, 'use_spike': False, 'rsi_required': False, 'edge_k': 1.9673999807512745, 'edge_cap': 0.13500940408623674}.
[I 2025-08-29 23:02:04,137] Trial 766 finished with values: [-1000000000.0, 1000000000.0] and parameters: {'p_sma': 56, 'p_std': 12, 'p_atr': 8, 'p_adx': 18, 'rsi_period': 14, 'ema1': 16, 'ema2': 49, 'slip_atr_k': 0.05659617896581384, 'slip_spread_k': 0.3566826389556025, 'spread_hl_frac': 0.011930216485782541, 'bb_std_mult': 1.141121930716542, 'rsi_os': 33, 'rsi_ob': 49, 'vol_spike': 0.24829301118448716, 'adx_thresh': 21.19567259550929, 'atr_min_pct': 0.007807557111097121, 'atr_max_pct': 0.07113983420174384, 'tp_mult': 1.9648176868086722, 'tsl_mult': 0.7089665501311642, 'strategy': 'mean_reversion', 'time_stop': 294, 'use_sma': False, 'use_atr': False, 'use_adx': False, 'use_ema': False, 'use_spike': False, 'rsi_required': False, 'edge_k': 0.749937589330774, 'edge_cap': 0.15953877517123619}.
[I 2025-08-29 23:02:04,181] Trial 767 finished with values: [-1000000000.0, 1000000000.0] and parameters: {'p_sma': 29, 'p_std': 12, 'p_atr': 24, 'p_adx': 28, 'rsi_period': 14, 'ema1': 16, 'ema2': 49, 'slip_atr_k': 0.014181850653104525, 'slip_spread_k': 0.08020242416006007, 'spread_hl_frac': 0.0281194311219471, 'bb_std_mult': 1.184687853987962, 'rsi_os': 52, 'rsi_ob': 49, 'vol_spike': 0.08093697589457248, 'adx_thresh': 21.617567300201348, 'atr_min_pct': 0.02049672301311737, 'atr_max_pct': 0.09281123798807106, 'tp_mult': 2.0874810367194367, 'tsl_mult': 0.9069298520178091, 'strategy': 'mean_reversion', 'time_stop': 81, 'use_sma': False, 'use_atr': False, 'use_adx': False, 'use_ema': False, 'use_spike': False, 'rsi_required': False, 'edge_k': 0.611136548165109, 'edge_cap': 0.7318449508434349}.
[I 2025-08-29 23:02:30,581] Trial 768 finished with values: [-1000000000.0, 1000000000.0] and parameters: {'p_sma': 57, 'p_std': 12, 'p_atr': 8, 'p_adx': 11, 'rsi_period': 71, 'ema1': 29, 'ema2': 24, 'slip_atr_k': 0.009358037461514679, 'slip_spread_k': 0.21065542715520366, 'spread_hl_frac': 0.012078116515864174, 'bb_std_mult': 0.8119601601519693, 'rsi_os': 38, 'rsi_ob': 62, 'vol_spike': 0.2409442540884449, 'adx_thresh': 28.019036683265185, 'atr_min_pct': 0.015355947095596172, 'atr_max_pct': 0.07562333629042053, 'tp_mult': 2.07532071013388, 'tsl_mult': 0.6641573813792122, 'strategy': 'mean_reversion', 'time_stop': 80, 'use_sma': False, 'use_atr': False, 'use_adx': False, 'use_ema': False, 'use_spike': False, 'rsi_required': False, 'edge_k': 1.9931483908206724, 'edge_cap': 0.16280531836767417}.
[I 2025-08-29 23:02:30,606] Trial 765 finished with values: [-1000000000.0, 1000000000.0] and parameters: {'p_sma': 16, 'p_std': 10, 'p_atr': 24, 'p_adx': 15, 'rsi_period': 13, 'ema1': 30, 'ema2': 21, 'slip_atr_k': 0.16654883554078903, 'slip_spread_k': 0.2056858420548936, 'spread_hl_frac': 0.012221835683740124, 'bb_std_mult': 1.117959145345257, 'rsi_os': 33, 'rsi_ob': 64, 'vol_spike': 0.24974696062712667, 'adx_thresh': 20.622030514889286, 'atr_min_pct': 0.014812914503567594, 'atr_max_pct': 0.09322011152707085, 'tp_mult': 1.9494911788872114, 'tsl_mult': 0.6054697057918126, 'strategy': 'mean_reversion', 'time_stop': 263, 'use_sma': False, 'use_atr': False, 'use_adx': False, 'use_ema': False, 'use_spike': False, 'rsi_required': False, 'edge_k': 0.7894608084072919, 'edge_cap': 0.7340885492608947}.
[I 2025-08-29 23:02:32,298] Trial 769 finished with values: [-1000000000.0, 1000000000.0] and parameters: {'p_sma': 35, 'p_std': 31, 'p_atr': 16, 'p_adx': 11, 'rsi_period': 8, 'ema1': 29, 'ema2': 33, 'slip_atr_k': 0.008214940461373083, 'slip_spread_k': 0.22654984236926834, 'spread_hl_frac': 0.013342765875054508, 'bb_std_mult': 1.053959212159063, 'rsi_os': 35, 'rsi_ob': 62, 'vol_spike': 0.05721979036407203, 'adx_thresh': 27.855271846544184, 'atr_min_pct': 0.01460040598680128, 'atr_max_pct': 0.07545931870884898, 'tp_mult': 2.090930469141708, 'tsl_mult': 0.9025334284735183, 'strategy': 'breakout', 'time_stop': 272, 'use_sma': False, 'use_atr': False, 'use_adx': False, 'use_ema': False, 'use_spike': False, 'rsi_required': False, 'edge_k': 1.9996309209303655, 'edge_cap': 0.19415167679735568}.
[I 2025-08-29 23:02:32,441] Trial 770 finished with values: [-1000000000.0, 1000000000.0] and parameters: {'p_sma': 32, 'p_std': 8, 'p_atr': 11, 'p_adx': 11, 'rsi_period': 64, 'ema1': 29, 'ema2': 28, 'slip_atr_k': 0.008351089392298986, 'slip_spread_k': 0.2119163650553691, 'spread_hl_frac': 0.013128902773767662, 'bb_std_mult': 0.8059805513653051, 'rsi_os': 35, 'rsi_ob': 60, 'vol_spike': 0.056174882578893054, 'adx_thresh': 19.304895688346402, 'atr_min_pct': 0.02647481092774867, 'atr_max_pct': 0.0364179164409196, 'tp_mult': 2.584311191318176, 'tsl_mult': 0.8269854575361458, 'strategy': 'breakout', 'time_stop': 281, 'use_sma': False, 'use_atr': False, 'use_adx': False, 'use_ema': False, 'use_spike': False, 'rsi_required': False, 'edge_k': 1.9990048076459568, 'edge_cap': 0.19747965813811874}.
[I 2025-08-29 23:02:59,829] Trial 771 finished with values: [-1000000000.0, 1000000000.0] and parameters: {'p_sma': 28, 'p_std': 30, 'p_atr': 11, 'p_adx': 29, 'rsi_period': 79, 'ema1': 29, 'ema2': 60, 'slip_atr_k': 0.19563636886284874, 'slip_spread_k': 0.5662059275758856, 'spread_hl_frac': 0.013165057815559003, 'bb_std_mult': 1.7293778061827627, 'rsi_os': 54, 'rsi_ob': 60, 'vol_spike': 0.26001107804766205, 'adx_thresh': 19.080164905885457, 'atr_min_pct': 0.02222516606296779, 'atr_max_pct': 0.059823435747191414, 'tp_mult': 2.5763130045033575, 'tsl_mult': 0.29780098535442584, 'strategy': 'breakout', 'time_stop': 278, 'use_sma': False, 'use_atr': False, 'use_adx': False, 'use_ema': False, 'use_spike': False, 'rsi_required': False, 'edge_k': 1.8346914353643786, 'edge_cap': 0.2000175887108744}.
[I 2025-08-29 23:02:59,893] Trial 772 finished with values: [-1000000000.0, 1000000000.0] and parameters: {'p_sma': 35, 'p_std': 31, 'p_atr': 16, 'p_adx': 30, 'rsi_period': 8, 'ema1': 29, 'ema2': 60, 'slip_atr_k': 0.0002129169232849598, 'slip_spread_k': 0.4942789796035805, 'spread_hl_frac': 0.011248077419954013, 'bb_std_mult': 2.2411126877519614, 'rsi_os': 35, 'rsi_ob': 60, 'vol_spike': 0.1709039057811129, 'adx_thresh': 19.276358018985864, 'atr_min_pct': 0.02244384855996908, 'atr_max_pct': 0.06109192294115217, 'tp_mult': 1.9889440481655905, 'tsl_mult': 0.5851516201246385, 'strategy': 'breakout', 'time_stop': 272, 'use_sma': False, 'use_atr': False, 'use_adx': False, 'use_ema': False, 'use_spike': False, 'rsi_required': False, 'edge_k': 1.8280919151391992, 'edge_cap': 0.3676911789125341}.
[I 2025-08-29 23:03:00,584] Trial 773 finished with values: [-1000000000.0, 1000000000.0] and parameters: {'p_sma': 39, 'p_std': 8, 'p_atr': 19, 'p_adx': 13, 'rsi_period': 11, 'ema1': 30, 'ema2': 17, 'slip_atr_k': 1.3925728794796565e-06, 'slip_spread_k': 0.11273011246582987, 'spread_hl_frac': 0.01135152595103772, 'bb_std_mult': 1.6544846072859185, 'rsi_os': 34, 'rsi_ob': 60, 'vol_spike': 0.24471728460334385, 'adx_thresh': 13.797643066012778, 'atr_min_pct': 0.013468783682226468, 'atr_max_pct': 0.09732702830832002, 'tp_mult': 1.535121353499895, 'tsl_mult': 0.5820282240888318, 'strategy': 'breakout', 'time_stop': 280, 'use_sma': False, 'use_atr': False, 'use_adx': False, 'use_ema': False, 'use_spike': False, 'rsi_required': False, 'edge_k': 1.8349006843622202, 'edge_cap': 0.7653821216833105}.
[I 2025-08-29 23:03:00,584] Trial 774 finished with values: [-1000000000.0, 1000000000.0] and parameters: {'p_sma': 28, 'p_std': 46, 'p_atr': 19, 'p_adx': 29, 'rsi_period': 11, 'ema1': 13, 'ema2': 17, 'slip_atr_k': 0.004604497422030165, 'slip_spread_k': 0.28856876441659096, 'spread_hl_frac': 0.010402247743315664, 'bb_std_mult': 0.5056679324762334, 'rsi_os': 19, 'rsi_ob': 82, 'vol_spike': 0.2596947185696665, 'adx_thresh': 13.660580480329397, 'atr_min_pct': 0.01177551121380262, 'atr_max_pct': 0.06699792015068395, 'tp_mult': 1.749901070764026, 'tsl_mult': 0.2869889882691592, 'strategy': 'mean_reversion', 'time_stop': 37, 'use_sma': False, 'use_atr': False, 'use_adx': False, 'use_ema': False, 'use_spike': False, 'rsi_required': False, 'edge_k': 1.8257315632225495, 'edge_cap': 0.36856062320092725}.
[I 2025-08-29 23:03:28,378] Trial 778 finished with values: [-1000000000.0, 1000000000.0] and parameters: {'p_sma': 11, 'p_std': 60, 'p_atr': 30, 'p_adx': 12, 'rsi_period': 40, 'ema1': 30, 'ema2': 16, 'slip_atr_k': 0.06203909683639544, 'slip_spread_k': 0.2939613395674105, 'spread_hl_frac': 0.0031569178059189414, 'bb_std_mult': 2.371551476316026, 'rsi_os': 49, 'rsi_ob': 62, 'vol_spike': 0.09343594450910259, 'adx_thresh': 21.90268541418468, 'atr_min_pct': 0.010851841200036511, 'atr_max_pct': 0.0793975258758186, 'tp_mult': 1.6409618403869848, 'tsl_mult': 0.627403172812419, 'strategy': 'mean_reversion', 'time_stop': 136, 'use_sma': False, 'use_atr': False, 'use_adx': False, 'use_ema': False, 'use_spike': False, 'rsi_required': False, 'edge_k': 0.03495557887931189, 'edge_cap': 0.17681808410103242}.
[I 2025-08-29 23:03:28,714] Trial 775 finished with values: [-1000000000.0, 1000000000.0] and parameters: {'p_sma': 17, 'p_std': 20, 'p_atr': 30, 'p_adx': 12, 'rsi_period': 11, 'ema1': 30, 'ema2': 40, 'slip_atr_k': 0.00019969702328987508, 'slip_spread_k': 0.29133286467763153, 'spread_hl_frac': 0.010411638106315744, 'bb_std_mult': 0.652784747574904, 'rsi_os': 43, 'rsi_ob': 53, 'vol_spike': 0.09300112899830401, 'adx_thresh': 21.874207341688567, 'atr_min_pct': 0.011751377928424327, 'atr_max_pct': 0.0669093279179585, 'tp_mult': 1.6473763429091968, 'tsl_mult': 0.5876430094666805, 'strategy': 'mean_reversion', 'time_stop': 288, 'use_sma': False, 'use_atr': False, 'use_adx': False, 'use_ema': False, 'use_spike': False, 'rsi_required': False, 'edge_k': 0.019623703314857854, 'edge_cap': 0.9132625548863709}.
[I 2025-08-29 23:03:29,123] Trial 777 finished with values: [-1000000000.0, 1000000000.0] and parameters: {'p_sma': 17, 'p_std': 10, 'p_atr': 27, 'p_adx': 8, 'rsi_period': 50, 'ema1': 30, 'ema2': 40, 'slip_atr_k': 0.004588331079758174, 'slip_spread_k': 0.2975285195796519, 'spread_hl_frac': 0.010274865659610251, 'bb_std_mult': 2.463081889098905, 'rsi_os': 49, 'rsi_ob': 69, 'vol_spike': 0.0006450415181161184, 'adx_thresh': 21.889584312531234, 'atr_min_pct': 0.010378210831090045, 'atr_max_pct': 0.07855367719442581, 'tp_mult': 1.7785325209533827, 'tsl_mult': 0.6348949043064546, 'strategy': 'mean_reversion', 'time_stop': 133, 'use_sma': False, 'use_atr': False, 'use_adx': False, 'use_ema': False, 'use_spike': False, 'rsi_required': False, 'edge_k': 1.6285818228666509, 'edge_cap': 0.623769894832429}.
[I 2025-08-29 23:03:29,352] Trial 776 finished with values: [-1000000000.0, 1000000000.0] and parameters: {'p_sma': 22, 'p_std': 11, 'p_atr': 19, 'p_adx': 8, 'rsi_period': 61, 'ema1': 28, 'ema2': 17, 'slip_atr_k': 0.06363292796781626, 'slip_spread_k': 0.6453109681097874, 'spread_hl_frac': 0.010371118288528507, 'bb_std_mult': 2.3722075278543415, 'rsi_os': 42, 'rsi_ob': 53, 'vol_spike': 0.2666834793643345, 'adx_thresh': 22.523777985240493, 'atr_min_pct': 0.010752517487206483, 'atr_max_pct': 0.06745309390112347, 'tp_mult': 1.4151848545214798, 'tsl_mult': 0.09900855605454983, 'strategy': 'mean_reversion', 'time_stop': 287, 'use_sma': False, 'use_atr': False, 'use_adx': False, 'use_ema': False, 'use_spike': False, 'rsi_required': False, 'edge_k': 1.6634775121092948, 'edge_cap': 0.9083946408443919}.
[I 2025-08-29 23:03:56,828] Trial 780 finished with values: [-1000000000.0, 1000000000.0] and parameters: {'p_sma': 9, 'p_std': 10, 'p_atr': 26, 'p_adx': 14, 'rsi_period': 44, 'ema1': 28, 'ema2': 27, 'slip_atr_k': 0.004819922613140433, 'slip_spread_k': 0.3158374691243304, 'spread_hl_frac': 0.031024603840989675, 'bb_std_mult': 2.5550721282621502, 'rsi_os': 30, 'rsi_ob': 65, 'vol_spike': 0.001445842453217383, 'adx_thresh': 20.04692923443567, 'atr_min_pct': 0.028376693724434535, 'atr_max_pct': 0.06376139137270145, 'tp_mult': 2.461799951051298, 'tsl_mult': 0.6644845659444044, 'strategy': 'mean_reversion', 'time_stop': 295, 'use_sma': False, 'use_atr': False, 'use_adx': False, 'use_ema': False, 'use_spike': False, 'rsi_required': False, 'edge_k': 1.9259313484431995, 'edge_cap': 0.21057312417285257}.
[I 2025-08-29 23:03:57,161] Trial 779 finished with values: [0.0006613248583133835, 0.0006633786481286332] and parameters: {'p_sma': 22, 'p_std': 28, 'p_atr': 13, 'p_adx': 10, 'rsi_period': 9, 'ema1': 28, 'ema2': 40, 'slip_atr_k': 0.005419824853158127, 'slip_spread_k': 0.6392667317527243, 'spread_hl_frac': 0.007388164320606236, 'bb_std_mult': 1.4186089987571395, 'rsi_os': 30, 'rsi_ob': 92, 'vol_spike': 0.237265946411687, 'adx_thresh': 22.625696969536715, 'atr_min_pct': 0.004740860212131218, 'atr_max_pct': 0.02630523566032103, 'tp_mult': 1.7908238057753403, 'tsl_mult': 0.6598182377318098, 'strategy': 'mean_reversion', 'time_stop': 289, 'use_sma': False, 'use_atr': False, 'use_adx': False, 'use_ema': False, 'use_spike': False, 'rsi_required': False, 'edge_k': 1.6367281418346384, 'edge_cap': 0.6499999622520447}.
[I 2025-08-29 23:03:57,330] Trial 782 finished with values: [-1000000000.0, 1000000000.0] and parameters: {'p_sma': 41, 'p_std': 48, 'p_atr': 17, 'p_adx': 14, 'rsi_period': 67, 'ema1': 14, 'ema2': 22, 'slip_atr_k': 0.014722837557728656, 'slip_spread_k': 0.2715660023504949, 'spread_hl_frac': 0.015049048870867478, 'bb_std_mult': 1.4074896682903226, 'rsi_os': 30, 'rsi_ob': 63, 'vol_spike': 0.11094193380075945, 'adx_thresh': 19.982356958461047, 'atr_min_pct': 0.004807874754341628, 'atr_max_pct': 0.07105968632706161, 'tp_mult': 1.7174828093997867, 'tsl_mult': 0.6558923479481401, 'strategy': 'mean_reversion', 'time_stop': 293, 'use_sma': False, 'use_atr': False, 'use_adx': False, 'use_ema': False, 'use_spike': False, 'rsi_required': False, 'edge_k': 1.8845133769832845, 'edge_cap': 0.16640021008963984}.
[I 2025-08-29 23:03:57,424] Trial 781 finished with values: [-1000000000.0, 1000000000.0] and parameters: {'p_sma': 22, 'p_std': 58, 'p_atr': 13, 'p_adx': 14, 'rsi_period': 17, 'ema1': 30, 'ema2': 25, 'slip_atr_k': 0.15336406663145108, 'slip_spread_k': 0.6494644350722686, 'spread_hl_frac': 0.007518799550648075, 'bb_std_mult': 1.2567648017173596, 'rsi_os': 5, 'rsi_ob': 64, 'vol_spike': 0.06580646365970276, 'adx_thresh': 20.00573232887518, 'atr_min_pct': 0.0036063411478058677, 'atr_max_pct': 0.07027141684700788, 'tp_mult': 1.8036706031937069, 'tsl_mult': 0.19240721136110855, 'strategy': 'mean_reversion', 'time_stop': 295, 'use_sma': False, 'use_atr': False, 'use_adx': False, 'use_ema': False, 'use_spike': False, 'rsi_required': False, 'edge_k': 1.9429247258313107, 'edge_cap': 0.8632467145085136}.
