[I 2025-08-29 22:27:34,827] Trial 434 finished with values: [-1000000000.0, 1000000000.0] and parameters: {'p_sma': 50, 'p_std': 58, 'p_atr': 10, 'p_adx': 24, 'rsi_period': 29, 'ema1': 9, 'ema2': 18, 'slip_atr_k': 2.8883316272362847e-05, 'slip_spread_k': 0.9063086733381667, 'spread_hl_frac': 0.012677745848708646, 'bb_std_mult': 3.034786057933683, 'rsi_os': 29, 'rsi_ob': 73, 'vol_spike': 0.25865208657586436, 'adx_thresh': 27.650988810661946, 'atr_min_pct': 0.006899786457972965, 'atr_max_pct': 0.12688308247693345, 'tp_mult': 1.8554635121873218, 'tsl_mult': 0.542720934546266, 'strategy': 'mean_reversion', 'time_stop': 223, 'use_sma': False, 'use_atr': False, 'use_adx': False, 'use_ema': False, 'use_spike': False, 'rsi_required': False, 'edge_k': 0.41369129379731423, 'edge_cap': 0.5126086417232442}.
[I 2025-08-29 22:27:34,876] Trial 433 finished with values: [-1000000000.0, 1000000000.0] and parameters: {'p_sma': 48, 'p_std': 17, 'p_atr': 8, 'p_adx': 23, 'rsi_period': 31, 'ema1': 8, 'ema2': 18, 'slip_atr_k': 0.019563480912776803, 'slip_spread_k': 0.7758008313539299, 'spread_hl_frac': 0.012404208483979285, 'bb_std_mult': 3.0364293487920007, 'rsi_os': 32, 'rsi_ob': 75, 'vol_spike': 0.2592544565783947, 'adx_thresh': 19.16467970195493, 'atr_min_pct': 0.007079943539812969, 'atr_max_pct': 0.09216134506104484, 'tp_mult': 1.8713396283416086, 'tsl_mult': 0.5581074337738611, 'strategy': 'mean_reversion', 'time_stop': 175, 'use_sma': False, 'use_atr': False, 'use_adx': False, 'use_ema': False, 'use_spike': False, 'rsi_required': False, 'edge_k': 0.41389263206785004, 'edge_cap': 0.5179595662822631}.
[I 2025-08-29 22:27:35,195] Trial 435 finished with values: [-1000000000.0, 1000000000.0] and parameters: {'p_sma': 32, 'p_std': 40, 'p_atr': 10, 'p_adx': 25, 'rsi_period': 30, 'ema1': 9, 'ema2': 33, 'slip_atr_k': 0.010865906422670223, 'slip_spread_k': 0.7930621412175184, 'spread_hl_frac': 0.017230426871688655, 'bb_std_mult': 2.896201587665877, 'rsi_os': 32, 'rsi_ob': 73, 'vol_spike': 0.25711905300858034, 'adx_thresh': 22.633834078602376, 'atr_min_pct': 0.01513152291838588, 'atr_max_pct': 0.12665960062523732, 'tp_mult': 1.8592329452565934, 'tsl_mult': 0.5532524638955469, 'strategy': 'mean_reversion', 'time_stop': 190, 'use_sma': False, 'use_atr': False, 'use_adx': False, 'use_ema': False, 'use_spike': False, 'rsi_required': False, 'edge_k': 0.40850012719672507, 'edge_cap': 0.5142248639128324}.
[I 2025-08-29 22:27:35,206] Trial 432 finished with values: [-1000000000.0, 1000000000.0] and parameters: {'p_sma': 48, 'p_std': 11, 'p_atr': 9, 'p_adx': 23, 'rsi_period': 29, 'ema1': 8, 'ema2': 21, 'slip_atr_k': 0.020992533813141985, 'slip_spread_k': 0.7740192690686779, 'spread_hl_frac': 0.012935509266907895, 'bb_std_mult': 2.8836088140690035, 'rsi_os': 39, 'rsi_ob': 59, 'vol_spike': 0.2785520693230508, 'adx_thresh': 26.317183604240476, 'atr_min_pct': 0.014942083153322235, 'atr_max_pct': 0.10828895970221104, 'tp_mult': 1.8886955484183947, 'tsl_mult': 0.5865953745049285, 'strategy': 'mean_reversion', 'time_stop': 190, 'use_sma': False, 'use_atr': False, 'use_adx': False, 'use_ema': False, 'use_spike': False, 'rsi_required': False, 'edge_k': 0.4115210297339868, 'edge_cap': 0.5134156781537682}.
[I 2025-08-29 22:27:35,397] Trial 438 finished with values: [-1000000000.0, 1000000000.0] and parameters: {'p_sma': 47, 'p_std': 36, 'p_atr': 7, 'p_adx': 26, 'rsi_period': 32, 'ema1': 9, 'ema2': 27, 'slip_atr_k': 0.00834824272046465, 'slip_spread_k': 0.867994998932154, 'spread_hl_frac': 0.019575196865899612, 'bb_std_mult': 2.8117729921502796, 'rsi_os': 30, 'rsi_ob': 50, 'vol_spike': 0.24963957913414314, 'adx_thresh': 23.579909289099668, 'atr_min_pct': 0.0209389462340899, 'atr_max_pct': 0.02898525030990881, 'tp_mult': 1.7452070218891917, 'tsl_mult': 0.5347144438047013, 'strategy': 'mean_reversion', 'time_stop': 164, 'use_sma': False, 'use_atr': False, 'use_adx': False, 'use_ema': False, 'use_spike': False, 'rsi_required': False, 'edge_k': 0.9124948157779071, 'edge_cap': 0.5520487598922906}.
[I 2025-08-29 22:27:35,399] Trial 437 finished with values: [-1000000000.0, 1000000000.0] and parameters: {'p_sma': 47, 'p_std': 36, 'p_atr': 13, 'p_adx': 24, 'rsi_period': 32, 'ema1': 9, 'ema2': 31, 'slip_atr_k': 0.01051828726430995, 'slip_spread_k': 0.8456301018765694, 'spread_hl_frac': 0.018321404070568578, 'bb_std_mult': 2.9034107208604034, 'rsi_os': 39, 'rsi_ob': 49, 'vol_spike': 0.2509259552054028, 'adx_thresh': 29.118465120730317, 'atr_min_pct': 0.014697417914733382, 'atr_max_pct': 0.12217828529079865, 'tp_mult': 1.7338219737936742, 'tsl_mult': 0.5713358800841527, 'strategy': 'mean_reversion', 'time_stop': 189, 'use_sma': False, 'use_atr': False, 'use_adx': False, 'use_ema': False, 'use_spike': False, 'rsi_required': False, 'edge_k': 1.0246116484659444, 'edge_cap': 0.5463252432364281}.
[I 2025-08-29 22:27:35,419] Trial 439 finished with values: [-1000000000.0, 1000000000.0] and parameters: {'p_sma': 47, 'p_std': 36, 'p_atr': 11, 'p_adx': 26, 'rsi_period': 32, 'ema1': 9, 'ema2': 11, 'slip_atr_k': 0.013809680922810982, 'slip_spread_k': 0.8621866603703079, 'spread_hl_frac': 0.018210877968431443, 'bb_std_mult': 2.9504091968165835, 'rsi_os': 30, 'rsi_ob': 49, 'vol_spike': 0.25146038122807995, 'adx_thresh': 23.407719596229477, 'atr_min_pct': 0.018004458286535057, 'atr_max_pct': 0.12318173130679735, 'tp_mult': 1.7338734802417513, 'tsl_mult': 0.6067489521513265, 'strategy': 'mean_reversion', 'time_stop': 165, 'use_sma': False, 'use_atr': False, 'use_adx': False, 'use_ema': False, 'use_spike': False, 'rsi_required': False, 'edge_k': 1.1787121950121437, 'edge_cap': 0.5367784361494601}.
[I 2025-08-29 22:27:35,648] Trial 442 finished with values: [-1000000000.0, 1000000000.0] and parameters: {'p_sma': 55, 'p_std': 18, 'p_atr': 11, 'p_adx': 27, 'rsi_period': 43, 'ema1': 14, 'ema2': 57, 'slip_atr_k': 0.015425011650231999, 'slip_spread_k': 0.8013720083496747, 'spread_hl_frac': 0.007854969455658188, 'bb_std_mult': 2.7976489875006703, 'rsi_os': 28, 'rsi_ob': 53, 'vol_spike': 0.2686285764336718, 'adx_thresh': 20.42470883851632, 'atr_min_pct': 0.023359184360579092, 'atr_max_pct': 0.021459285034646766, 'tp_mult': 1.6475416283126076, 'tsl_mult': 0.5306341309183153, 'strategy': 'mean_reversion', 'time_stop': 229, 'use_sma': False, 'use_atr': False, 'use_adx': False, 'use_ema': False, 'use_spike': False, 'rsi_required': False, 'edge_k': 1.438727990120691, 'edge_cap': 0.6034222726769956}.
[I 2025-08-29 22:28:00,223] Trial 436 finished with values: [-1000000000.0, 1000000000.0] and parameters: {'p_sma': 57, 'p_std': 8, 'p_atr': 13, 'p_adx': 25, 'rsi_period': 29, 'ema1': 9, 'ema2': 11, 'slip_atr_k': 0.01138351236277231, 'slip_spread_k': 0.7956719596352323, 'spread_hl_frac': 0.008346205946566806, 'bb_std_mult': 2.891522321466155, 'rsi_os': 30, 'rsi_ob': 53, 'vol_spike': 0.24998189755396, 'adx_thresh': 28.88128338268444, 'atr_min_pct': 0.01526115061404704, 'atr_max_pct': 0.028104167978133768, 'tp_mult': 1.7292547024994303, 'tsl_mult': 0.6066009179514399, 'strategy': 'mean_reversion', 'time_stop': 189, 'use_sma': False, 'use_atr': False, 'use_adx': False, 'use_ema': False, 'use_spike': False, 'rsi_required': False, 'edge_k': 0.7140184517078161, 'edge_cap': 0.5516984084068707}.
[I 2025-08-29 22:28:02,428] Trial 440 finished with values: [-1000000000.0, 1000000000.0] and parameters: {'p_sma': 57, 'p_std': 37, 'p_atr': 11, 'p_adx': 24, 'rsi_period': 34, 'ema1': 9, 'ema2': 31, 'slip_atr_k': 0.016501390581175855, 'slip_spread_k': 0.8061854954736279, 'spread_hl_frac': 0.0080431435501373, 'bb_std_mult': 2.9435206693992666, 'rsi_os': 28, 'rsi_ob': 74, 'vol_spike': 0.2698296353229468, 'adx_thresh': 20.453552804481962, 'atr_min_pct': 0.01684871456671555, 'atr_max_pct': 0.1235886274313629, 'tp_mult': 1.6503669398085279, 'tsl_mult': 0.6053531637695088, 'strategy': 'mean_reversion', 'time_stop': 136, 'use_sma': False, 'use_atr': False, 'use_adx': False, 'use_ema': False, 'use_spike': False, 'rsi_required': False, 'edge_k': 1.6532332800626115, 'edge_cap': 0.5382333067585933}.
[I 2025-08-29 22:28:02,742] Trial 441 finished with values: [-1000000000.0, 1000000000.0] and parameters: {'p_sma': 50, 'p_std': 19, 'p_atr': 11, 'p_adx': 23, 'rsi_period': 43, 'ema1': 8, 'ema2': 11, 'slip_atr_k': 0.015429603844332222, 'slip_spread_k': 0.7983101346357669, 'spread_hl_frac': 0.009804711518416812, 'bb_std_mult': 2.9685433614630217, 'rsi_os': 28, 'rsi_ob': 62, 'vol_spike': 0.27219276831890465, 'adx_thresh': 20.52023519525366, 'atr_min_pct': 0.016889294404955242, 'atr_max_pct': 0.08316086780553812, 'tp_mult': 1.6342430094698064, 'tsl_mult': 0.6156409620711044, 'strategy': 'mean_reversion', 'time_stop': 228, 'use_sma': False, 'use_atr': False, 'use_adx': False, 'use_ema': False, 'use_spike': False, 'rsi_required': False, 'edge_k': 1.436572771970612, 'edge_cap': 0.5350862119185873}.
[I 2025-08-29 22:28:03,054] Trial 443 finished with values: [-1000000000.0, 1000000000.0] and parameters: {'p_sma': 36, 'p_std': 49, 'p_atr': 10, 'p_adx': 23, 'rsi_period': 37, 'ema1': 8, 'ema2': 13, 'slip_atr_k': 0.016851499725122593, 'slip_spread_k': 0.7936167409112251, 'spread_hl_frac': 0.008988201376930668, 'bb_std_mult': 2.6976981630746337, 'rsi_os': 28, 'rsi_ob': 62, 'vol_spike': 0.27503353476347153, 'adx_thresh': 25.423040876158588, 'atr_min_pct': 0.006382165081016118, 'atr_max_pct': 0.03545989134341301, 'tp_mult': 1.7018043065533615, 'tsl_mult': 0.5967340083395417, 'strategy': 'mean_reversion', 'time_stop': 183, 'use_sma': False, 'use_atr': False, 'use_adx': False, 'use_ema': False, 'use_spike': False, 'rsi_required': False, 'edge_k': 0.4655094404803524, 'edge_cap': 0.5098790337444221}.
[I 2025-08-29 22:28:03,204] Trial 445 finished with values: [-1000000000.0, 1000000000.0] and parameters: {'p_sma': 50, 'p_std': 39, 'p_atr': 14, 'p_adx': 23, 'rsi_period': 28, 'ema1': 8, 'ema2': 36, 'slip_atr_k': 0.00035690953440670626, 'slip_spread_k': 0.7511097621783288, 'spread_hl_frac': 0.013839828379816515, 'bb_std_mult': 2.692807871199365, 'rsi_os': 54, 'rsi_ob': 76, 'vol_spike': 0.27433738344813496, 'adx_thresh': 22.730757928956077, 'atr_min_pct': 0.009861474432561522, 'atr_max_pct': 0.12772018860195725, 'tp_mult': 1.7759444860437592, 'tsl_mult': 0.5707647982546016, 'strategy': 'mean_reversion', 'time_stop': 204, 'use_sma': False, 'use_atr': False, 'use_adx': False, 'use_ema': False, 'use_spike': False, 'rsi_required': False, 'edge_k': 0.45657272122480663, 'edge_cap': 0.5023677012843308}.
[I 2025-08-29 22:28:03,220] Trial 447 finished with values: [-1000000000.0, 1000000000.0] and parameters: {'p_sma': 22, 'p_std': 57, 'p_atr': 7, 'p_adx': 24, 'rsi_period': 28, 'ema1': 8, 'ema2': 12, 'slip_atr_k': 0.08340834444854565, 'slip_spread_k': 0.7520986686271601, 'spread_hl_frac': 0.015670179534862543, 'bb_std_mult': 2.8488902533500404, 'rsi_os': 54, 'rsi_ob': 76, 'vol_spike': 0.2984100954909832, 'adx_thresh': 22.491832483264012, 'atr_min_pct': 0.02185533406157998, 'atr_max_pct': 0.1290538599994015, 'tp_mult': 1.7824714263452568, 'tsl_mult': 0.5661069921982705, 'strategy': 'mean_reversion', 'time_stop': 199, 'use_sma': False, 'use_atr': False, 'use_adx': False, 'use_ema': False, 'use_spike': False, 'rsi_required': False, 'edge_k': 0.46816144122326564, 'edge_cap': 0.5079725641402383}.
[I 2025-08-29 22:28:28,789] Trial 444 finished with values: [-1000000000.0, 1000000000.0] and parameters: {'p_sma': 22, 'p_std': 38, 'p_atr': 10, 'p_adx': 23, 'rsi_period': 35, 'ema1': 8, 'ema2': 12, 'slip_atr_k': 0.0008406555854877252, 'slip_spread_k': 0.750630058512302, 'spread_hl_frac': 0.013997378379726788, 'bb_std_mult': 2.948151618932793, 'rsi_os': 28, 'rsi_ob': 74, 'vol_spike': 0.2738725198240474, 'adx_thresh': 27.106681859311408, 'atr_min_pct': 0.016993272379375365, 'atr_max_pct': 0.12889862230855897, 'tp_mult': 1.7767721393763127, 'tsl_mult': 0.5621180025665926, 'strategy': 'mean_reversion', 'time_stop': 139, 'use_sma': False, 'use_atr': False, 'use_adx': False, 'use_ema': False, 'use_spike': False, 'rsi_required': False, 'edge_k': 0.46960029404001896, 'edge_cap': 0.5063747687633778}.
[I 2025-08-29 22:28:29,989] Trial 446 finished with values: [-1000000000.0, 1000000000.0] and parameters: {'p_sma': 49, 'p_std': 40, 'p_atr': 10, 'p_adx': 15, 'rsi_period': 28, 'ema1': 8, 'ema2': 13, 'slip_atr_k': 5.880451712817576e-05, 'slip_spread_k': 0.9504072204984899, 'spread_hl_frac': 0.015617162342327877, 'bb_std_mult': 2.714894320024062, 'rsi_os': 14, 'rsi_ob': 76, 'vol_spike': 0.27486510219905386, 'adx_thresh': 27.212097465278692, 'atr_min_pct': 0.009913090325380411, 'atr_max_pct': 0.07639096753135677, 'tp_mult': 1.782756515034197, 'tsl_mult': 0.5592962603511396, 'strategy': 'mean_reversion', 'time_stop': 196, 'use_sma': False, 'use_atr': False, 'use_adx': False, 'use_ema': False, 'use_spike': False, 'rsi_required': False, 'edge_k': 0.46184128762279053, 'edge_cap': 0.5056051695697095}.
[I 2025-08-29 22:28:31,089] Trial 449 finished with values: [-1000000000.0, 1000000000.0] and parameters: {'p_sma': 49, 'p_std': 51, 'p_atr': 12, 'p_adx': 24, 'rsi_period': 30, 'ema1': 8, 'ema2': 14, 'slip_atr_k': 0.005142654053165303, 'slip_spread_k': 0.7727199470541323, 'spread_hl_frac': 0.011760915994649577, 'bb_std_mult': 2.784769578349927, 'rsi_os': 18, 'rsi_ob': 56, 'vol_spike': 0.2925920655147436, 'adx_thresh': 27.273448676182248, 'atr_min_pct': 0.005916865353116554, 'atr_max_pct': 0.043930970633430835, 'tp_mult': 1.8334684095849794, 'tsl_mult': 0.5441892526472475, 'strategy': 'mean_reversion', 'time_stop': 174, 'use_sma': False, 'use_atr': False, 'use_adx': False, 'use_ema': False, 'use_spike': False, 'rsi_required': False, 'edge_k': 1.5539907144849425, 'edge_cap': 0.5190155231141239}.
[I 2025-08-29 22:28:31,090] Trial 448 finished with values: [-1000000000.0, 1000000000.0] and parameters: {'p_sma': 49, 'p_std': 37, 'p_atr': 7, 'p_adx': 24, 'rsi_period': 46, 'ema1': 8, 'ema2': 29, 'slip_atr_k': 0.08178852749547594, 'slip_spread_k': 0.765023743185066, 'spread_hl_frac': 0.015658134025805227, 'bb_std_mult': 2.812142036381157, 'rsi_os': 11, 'rsi_ob': 87, 'vol_spike': 0.2939879231513362, 'adx_thresh': 6.445987457385307, 'atr_min_pct': 0.021979235734364114, 'atr_max_pct': 0.11992099470127308, 'tp_mult': 1.8356160656228138, 'tsl_mult': 0.5551737181712735, 'strategy': 'mean_reversion', 'time_stop': 142, 'use_sma': False, 'use_atr': False, 'use_adx': False, 'use_ema': False, 'use_spike': False, 'rsi_required': False, 'edge_k': 0.5092296278429675, 'edge_cap': 0.20624194179850863}.
[I 2025-08-29 22:28:31,298] Trial 453 finished with values: [-1000000000.0, 1000000000.0] and parameters: {'p_sma': 30, 'p_std': 60, 'p_atr': 8, 'p_adx': 23, 'rsi_period': 30, 'ema1': 10, 'ema2': 11, 'slip_atr_k': 0.18311987532013022, 'slip_spread_k': 0.5241266167633827, 'spread_hl_frac': 0.013268283970012609, 'bb_std_mult': 2.875866138862814, 'rsi_os': 51, 'rsi_ob': 77, 'vol_spike': 0.26592188126046606, 'adx_thresh': 19.511884549179513, 'atr_min_pct': 0.013458334413771809, 'atr_max_pct': 0.14641667267879604, 'tp_mult': 1.919068488089092, 'tsl_mult': 0.5329138160974998, 'strategy': 'mean_reversion', 'time_stop': 219, 'use_sma': False, 'use_atr': False, 'use_adx': False, 'use_ema': False, 'use_spike': False, 'rsi_required': False, 'edge_k': 1.328472778685934, 'edge_cap': 0.05186556383019314}.
[I 2025-08-29 22:28:59,347] Trial 452 finished with values: [-1000000000.0, 1000000000.0] and parameters: {'p_sma': 39, 'p_std': 36, 'p_atr': 8, 'p_adx': 18, 'rsi_period': 46, 'ema1': 10, 'ema2': 11, 'slip_atr_k': 0.2343328228626002, 'slip_spread_k': 0.782807903035762, 'spread_hl_frac': 0.01652115763908225, 'bb_std_mult': 3.046276502467791, 'rsi_os': 11, 'rsi_ob': 67, 'vol_spike': 0.29008911022255623, 'adx_thresh': 12.401799917915932, 'atr_min_pct': 0.020262666592644633, 'atr_max_pct': 0.12038705351432401, 'tp_mult': 1.9309122937537873, 'tsl_mult': 0.5336745352494043, 'strategy': 'mean_reversion', 'time_stop': 246, 'use_sma': False, 'use_atr': False, 'use_adx': False, 'use_ema': False, 'use_spike': False, 'rsi_required': False, 'edge_k': 0.5265020390504039, 'edge_cap': 0.2550183192930838}.
[I 2025-08-29 22:28:59,368] Trial 451 finished with values: [-1000000000.0, 1000000000.0] and parameters: {'p_sma': 39, 'p_std': 60, 'p_atr': 12, 'p_adx': 18, 'rsi_period': 30, 'ema1': 10, 'ema2': 28, 'slip_atr_k': 0.06332315619708807, 'slip_spread_k': 0.7805650843931599, 'spread_hl_frac': 0.012352833083557528, 'bb_std_mult': 2.8357827425637425, 'rsi_os': 34, 'rsi_ob': 92, 'vol_spike': 0.28989989443284103, 'adx_thresh': 21.100637280472792, 'atr_min_pct': 0.01112004459098679, 'atr_max_pct': 0.08000746350685707, 'tp_mult': 1.8433889598590563, 'tsl_mult': 0.5293377271742954, 'strategy': 'mean_reversion', 'time_stop': 174, 'use_sma': False, 'use_atr': False, 'use_adx': False, 'use_ema': False, 'use_spike': False, 'rsi_required': False, 'edge_k': 1.548308747868999, 'edge_cap': 0.9050548832193857}.
[I 2025-08-29 22:28:59,383] Trial 450 finished with values: [-1000000000.0, 1000000000.0] and parameters: {'p_sma': 49, 'p_std': 35, 'p_atr': 8, 'p_adx': 28, 'rsi_period': 30, 'ema1': 10, 'ema2': 29, 'slip_atr_k': 0.23452321639749324, 'slip_spread_k': 0.9451003133647289, 'spread_hl_frac': 0.016483177768367448, 'bb_std_mult': 2.80573680313092, 'rsi_os': 35, 'rsi_ob': 86, 'vol_spike': 0.2644718925092959, 'adx_thresh': 19.711304804328137, 'atr_min_pct': 0.01126552586698754, 'atr_max_pct': 0.09756160092266841, 'tp_mult': 1.8303877225528513, 'tsl_mult': 0.533293516997052, 'strategy': 'mean_reversion', 'time_stop': 173, 'use_sma': False, 'use_atr': False, 'use_adx': False, 'use_ema': False, 'use_spike': False, 'rsi_required': False, 'edge_k': 0.5562945872984449, 'edge_cap': 0.5261459239144701}.
[I 2025-08-29 22:28:59,520] Trial 454 finished with values: [-1000000000.0, 1000000000.0] and parameters: {'p_sma': 47, 'p_std': 35, 'p_atr': 9, 'p_adx': 18, 'rsi_period': 10, 'ema1': 10, 'ema2': 11, 'slip_atr_k': 0.006770438276512609, 'slip_spread_k': 0.7779798147437711, 'spread_hl_frac': 0.011797932604106593, 'bb_std_mult': 3.027581710633911, 'rsi_os': 29, 'rsi_ob': 77, 'vol_spike': 0.2844020551940223, 'adx_thresh': 28.100949936596763, 'atr_min_pct': 0.011042860883273317, 'atr_max_pct': 0.12461233116787676, 'tp_mult': 1.6962648072102664, 'tsl_mult': 0.5241259967746364, 'strategy': 'mean_reversion', 'time_stop': 179, 'use_sma': False, 'use_atr': False, 'use_adx': False, 'use_ema': False, 'use_spike': False, 'rsi_required': False, 'edge_k': 0.3832552431810835, 'edge_cap': 0.5606528217327853}.
[I 2025-08-29 22:29:26,991] Trial 456 finished with values: [-1000000000.0, 1000000000.0] and parameters: {'p_sma': 47, 'p_std': 35, 'p_atr': 9, 'p_adx': 25, 'rsi_period': 40, 'ema1': 9, 'ema2': 12, 'slip_atr_k': 0.020084653006746406, 'slip_spread_k': 0.8212999479592367, 'spread_hl_frac': 0.011422846044771137, 'bb_std_mult': 1.516382198613595, 'rsi_os': 8, 'rsi_ob': 77, 'vol_spike': 0.28169997948653913, 'adx_thresh': 23.808528519550546, 'atr_min_pct': 0.008264578504283497, 'atr_max_pct': 0.12506176817894976, 'tp_mult': 1.171797588128717, 'tsl_mult': 0.30937132635505676, 'strategy': 'mean_reversion', 'time_stop': 258, 'use_sma': False, 'use_atr': False, 'use_adx': False, 'use_ema': False, 'use_spike': False, 'rsi_required': False, 'edge_k': 1.373236123536734, 'edge_cap': 0.5674355585589737}.
[I 2025-08-29 22:29:27,120] Trial 458 finished with values: [-1000000000.0, 1000000000.0] and parameters: {'p_sma': 48, 'p_std': 37, 'p_atr': 9, 'p_adx': 29, 'rsi_period': 75, 'ema1': 30, 'ema2': 11, 'slip_atr_k': 0.20914019394225186, 'slip_spread_k': 0.8390262389165893, 'spread_hl_frac': 0.014850015320199677, 'bb_std_mult': 1.3862809659478224, 'rsi_os': 29, 'rsi_ob': 74, 'vol_spike': 0.25775341138282076, 'adx_thresh': 11.399704580638094, 'atr_min_pct': 0.025010883776207637, 'atr_max_pct': 0.12509057080751063, 'tp_mult': 1.7547429612070469, 'tsl_mult': 0.17694513796468603, 'strategy': 'mean_reversion', 'time_stop': 253, 'use_sma': False, 'use_atr': False, 'use_adx': False, 'use_ema': False, 'use_spike': False, 'rsi_required': False, 'edge_k': 0.38798755369904175, 'edge_cap': 0.29992789347263826}.
[I 2025-08-29 22:29:27,258] Trial 455 finished with values: [-1000000000.0, 1000000000.0] and parameters: {'p_sma': 53, 'p_std': 46, 'p_atr': 9, 'p_adx': 28, 'rsi_period': 34, 'ema1': 9, 'ema2': 25, 'slip_atr_k': 0.006731759422615885, 'slip_spread_k': 0.8391899573818574, 'spread_hl_frac': 0.00988575201975146, 'bb_std_mult': 2.998576279878659, 'rsi_os': 29, 'rsi_ob': 77, 'vol_spike': 0.26020070164219133, 'adx_thresh': 28.161849802715892, 'atr_min_pct': 0.008249351230881188, 'atr_max_pct': 0.12455034469517087, 'tp_mult': 1.7026465293702868, 'tsl_mult': 0.5851259931601026, 'strategy': 'mean_reversion', 'time_stop': 254, 'use_sma': False, 'use_atr': False, 'use_adx': False, 'use_ema': False, 'use_spike': False, 'rsi_required': False, 'edge_k': 0.39167118777878124, 'edge_cap': 0.5591902034255037}.
[I 2025-08-29 22:29:27,371] Trial 457 finished with values: [-1000000000.0, 1000000000.0] and parameters: {'p_sma': 47, 'p_std': 46, 'p_atr': 9, 'p_adx': 25, 'rsi_period': 17, 'ema1': 9, 'ema2': 60, 'slip_atr_k': 0.022337058267722348, 'slip_spread_k': 0.6206336529849281, 'spread_hl_frac': 0.014551642616514305, 'bb_std_mult': 1.5233757898737814, 'rsi_os': 29, 'rsi_ob': 77, 'vol_spike': 0.28485228019051667, 'adx_thresh': 23.89823323463707, 'atr_min_pct': 0.02763181903366437, 'atr_max_pct': 0.1252344696228212, 'tp_mult': 1.7075213663774949, 'tsl_mult': 0.04334412432737006, 'strategy': 'mean_reversion', 'time_stop': 254, 'use_sma': False, 'use_atr': False, 'use_adx': False, 'use_ema': False, 'use_spike': False, 'rsi_required': False, 'edge_k': 0.4127006258390618, 'edge_cap': 0.5671971795289991}.
