[I 2025-08-29 22:35:55,016] Trial 514 finished with values: [-1000000000.0, 1000000000.0] and parameters: {'p_sma': 29, 'p_std': 12, 'p_atr': 18, 'p_adx': 13, 'rsi_period': 10, 'ema1': 28, 'ema2': 13, 'slip_atr_k': 0.004878838107952947, 'slip_spread_k': 0.8273083096804266, 'spread_hl_frac': 0.04848193803673617, 'bb_std_mult': 2.929297063836623, 'rsi_os': 30, 'rsi_ob': 58, 'vol_spike': 0.14511296332725712, 'adx_thresh': 20.94909691382052, 'atr_min_pct': 0.02537143934899935, 'atr_max_pct': 0.13924061260892406, 'tp_mult': 2.2488017207803224, 'tsl_mult': 0.5969595571003359, 'strategy': 'mean_reversion', 'time_stop': 247, 'use_sma': False, 'use_atr': False, 'use_adx': False, 'use_ema': False, 'use_spike': False, 'rsi_required': False, 'edge_k': 1.1590624393597193, 'edge_cap': 0.20188579913597765}.
[I 2025-08-29 22:35:55,016] Trial 512 finished with values: [-1000000000.0, 1000000000.0] and parameters: {'p_sma': 30, 'p_std': 9, 'p_atr': 18, 'p_adx': 24, 'rsi_period': 11, 'ema1': 28, 'ema2': 11, 'slip_atr_k': 0.0006755926985672501, 'slip_spread_k': 0.8134979430949991, 'spread_hl_frac': 0.04360455103420005, 'bb_std_mult': 2.9431870744400435, 'rsi_os': 33, 'rsi_ob': 58, 'vol_spike': 0.2539972524480882, 'adx_thresh': 21.755616452815314, 'atr_min_pct': 0.0262203673711561, 'atr_max_pct': 0.14967231978615078, 'tp_mult': 2.00992036262759, 'tsl_mult': 0.11547881357859907, 'strategy': 'mean_reversion', 'time_stop': 289, 'use_sma': False, 'use_atr': False, 'use_adx': False, 'use_ema': False, 'use_spike': False, 'rsi_required': False, 'edge_k': 1.1565564860602915, 'edge_cap': 0.2058334262893315}.
[I 2025-08-29 22:35:55,150] Trial 513 finished with values: [-1000000000.0, 1000000000.0] and parameters: {'p_sma': 40, 'p_std': 12, 'p_atr': 10, 'p_adx': 24, 'rsi_period': 10, 'ema1': 24, 'ema2': 11, 'slip_atr_k': 1.557641267802435e-08, 'slip_spread_k': 0.8273315083973463, 'spread_hl_frac': 0.009386962759414641, 'bb_std_mult': 2.9412504725816917, 'rsi_os': 35, 'rsi_ob': 58, 'vol_spike': 0.25556585982824276, 'adx_thresh': 20.86252595968343, 'atr_min_pct': 0.02566129940688449, 'atr_max_pct': 0.14045875763652746, 'tp_mult': 1.8996591833047554, 'tsl_mult': 0.9479697444907105, 'strategy': 'mean_reversion', 'time_stop': 270, 'use_sma': False, 'use_atr': False, 'use_adx': False, 'use_ema': False, 'use_spike': False, 'rsi_required': False, 'edge_k': 1.1506395326515704, 'edge_cap': 0.2096923498858928}.
[I 2025-08-29 22:36:21,723] Trial 519 finished with values: [-1000000000.0, 1000000000.0] and parameters: {'p_sma': 27, 'p_std': 15, 'p_atr': 9, 'p_adx': 23, 'rsi_period': 7, 'ema1': 23, 'ema2': 37, 'slip_atr_k': 0.12109202140540568, 'slip_spread_k': 0.6536893046074417, 'spread_hl_frac': 0.007354351369319535, 'bb_std_mult': 3.1322551962715566, 'rsi_os': 32, 'rsi_ob': 60, 'vol_spike': 0.1027624761189383, 'adx_thresh': 7.91862559116281, 'atr_min_pct': 0.011484894082194663, 'atr_max_pct': 0.13566882127817378, 'tp_mult': 1.207201879144836, 'tsl_mult': 0.545039445552145, 'strategy': 'breakout', 'time_stop': 270, 'use_sma': False, 'use_atr': False, 'use_adx': False, 'use_ema': False, 'use_spike': False, 'rsi_required': False, 'edge_k': 0.8910018935770184, 'edge_cap': 0.2482309362205587}.
[I 2025-08-29 22:36:22,725] Trial 518 finished with values: [-1000000000.0, 1000000000.0] and parameters: {'p_sma': 40, 'p_std': 15, 'p_atr': 9, 'p_adx': 24, 'rsi_period': 7, 'ema1': 22, 'ema2': 10, 'slip_atr_k': 0.004122411126388259, 'slip_spread_k': 0.655247970226301, 'spread_hl_frac': 0.009485573863428853, 'bb_std_mult': 3.1220791500362433, 'rsi_os': 32, 'rsi_ob': 60, 'vol_spike': 0.2726363227867352, 'adx_thresh': 20.49613576738766, 'atr_min_pct': 0.023700390908431714, 'atr_max_pct': 0.14479273548932464, 'tp_mult': 1.241897409531956, 'tsl_mult': 0.15516609192325387, 'strategy': 'breakout', 'time_stop': 270, 'use_sma': False, 'use_atr': False, 'use_adx': False, 'use_ema': False, 'use_spike': False, 'rsi_required': False, 'edge_k': 1.5798347023403498, 'edge_cap': 0.24337776656925592}.
[I 2025-08-29 22:36:22,848] Trial 517 finished with values: [-1000000000.0, 1000000000.0] and parameters: {'p_sma': 34, 'p_std': 15, 'p_atr': 9, 'p_adx': 24, 'rsi_period': 7, 'ema1': 22, 'ema2': 10, 'slip_atr_k': 0.004311165317475212, 'slip_spread_k': 0.5802775258782227, 'spread_hl_frac': 0.009461435696284602, 'bb_std_mult': 2.202102379548357, 'rsi_os': 32, 'rsi_ob': 60, 'vol_spike': 0.26012390811907005, 'adx_thresh': 19.408575477591594, 'atr_min_pct': 0.015853167010065873, 'atr_max_pct': 0.1361330372807042, 'tp_mult': 2.1405056339665895, 'tsl_mult': 0.15548010763706527, 'strategy': 'breakout', 'time_stop': 270, 'use_sma': False, 'use_atr': False, 'use_adx': False, 'use_ema': False, 'use_spike': False, 'rsi_required': False, 'edge_k': 1.3421675684780634, 'edge_cap': 0.23011029758475582}.
[I 2025-08-29 22:36:22,918] Trial 516 finished with values: [-1000000000.0, 1000000000.0] and parameters: {'p_sma': 34, 'p_std': 14, 'p_atr': 9, 'p_adx': 14, 'rsi_period': 10, 'ema1': 22, 'ema2': 34, 'slip_atr_k': 0.00011374696209751674, 'slip_spread_k': 0.5727146506817582, 'spread_hl_frac': 0.009868171526382565, 'bb_std_mult': 2.2036276528519996, 'rsi_os': 32, 'rsi_ob': 64, 'vol_spike': 0.17292988187465286, 'adx_thresh': 21.234770445940352, 'atr_min_pct': 0.012552709598109592, 'atr_max_pct': 0.1354277865389079, 'tp_mult': 1.8986693988908803, 'tsl_mult': 0.9489234375371087, 'strategy': 'mean_reversion', 'time_stop': 272, 'use_sma': False, 'use_atr': False, 'use_adx': False, 'use_ema': False, 'use_spike': False, 'rsi_required': False, 'edge_k': 1.347014495954288, 'edge_cap': 0.1966687982790556}.
[I 2025-08-29 22:36:49,466] Trial 520 finished with values: [-1000000000.0, 1000000000.0] and parameters: {'p_sma': 34, 'p_std': 13, 'p_atr': 9, 'p_adx': 14, 'rsi_period': 9, 'ema1': 19, 'ema2': 10, 'slip_atr_k': 0.22657322820477022, 'slip_spread_k': 0.8962789205594316, 'spread_hl_frac': 0.010047307611521134, 'bb_std_mult': 2.210404676313126, 'rsi_os': 32, 'rsi_ob': 63, 'vol_spike': 0.17595483387920816, 'adx_thresh': 19.42473992058405, 'atr_min_pct': 0.015818771150653756, 'atr_max_pct': 0.14504854415241275, 'tp_mult': 1.242195106592162, 'tsl_mult': 0.5772953071919718, 'strategy': 'mean_reversion', 'time_stop': 280, 'use_sma': False, 'use_atr': False, 'use_adx': False, 'use_ema': False, 'use_spike': False, 'rsi_required': False, 'edge_k': 1.5604660921435205, 'edge_cap': 0.2353465976161948}.
[I 2025-08-29 22:36:50,102] Trial 521 finished with values: [-1000000000.0, 1000000000.0] and parameters: {'p_sma': 33, 'p_std': 13, 'p_atr': 10, 'p_adx': 8, 'rsi_period': 13, 'ema1': 16, 'ema2': 12, 'slip_atr_k': 0.011493035479950788, 'slip_spread_k': 0.587294005117263, 'spread_hl_frac': 0.011262319654012372, 'bb_std_mult': 3.4299388161637747, 'rsi_os': 30, 'rsi_ob': 62, 'vol_spike': 0.176908622234992, 'adx_thresh': 21.568805469882168, 'atr_min_pct': 0.021108934554968005, 'atr_max_pct': 0.14356334639514243, 'tp_mult': 1.8999488503335629, 'tsl_mult': 0.5609552215046787, 'strategy': 'mean_reversion', 'time_stop': 258, 'use_sma': False, 'use_atr': False, 'use_adx': False, 'use_ema': False, 'use_spike': False, 'rsi_required': False, 'edge_k': 1.088712562914262, 'edge_cap': 0.3141500410561634}.
[I 2025-08-29 22:36:50,312] Trial 522 finished with values: [-1000000000.0, 1000000000.0] and parameters: {'p_sma': 32, 'p_std': 13, 'p_atr': 29, 'p_adx': 12, 'rsi_period': 9, 'ema1': 19, 'ema2': 12, 'slip_atr_k': 0.010911225596488073, 'slip_spread_k': 0.8952939913428666, 'spread_hl_frac': 0.02235326503167479, 'bb_std_mult': 1.4093450463791686, 'rsi_os': 30, 'rsi_ob': 63, 'vol_spike': 0.2669287524503357, 'adx_thresh': 19.578405748695793, 'atr_min_pct': 0.021008300741460664, 'atr_max_pct': 0.14418746503684637, 'tp_mult': 2.0485272894279567, 'tsl_mult': 0.5802128883214416, 'strategy': 'mean_reversion', 'time_stop': 281, 'use_sma': False, 'use_atr': False, 'use_adx': False, 'use_ema': False, 'use_spike': False, 'rsi_required': False, 'edge_k': 1.057146500785329, 'edge_cap': 0.28165859891996264}.
[I 2025-08-29 22:36:50,470] Trial 523 finished with values: [-1000000000.0, 1000000000.0] and parameters: {'p_sma': 33, 'p_std': 13, 'p_atr': 29, 'p_adx': 12, 'rsi_period': 13, 'ema1': 19, 'ema2': 41, 'slip_atr_k': 0.012012790338721385, 'slip_spread_k': 0.48993244968570204, 'spread_hl_frac': 0.011390741748109475, 'bb_std_mult': 3.3603990557001246, 'rsi_os': 30, 'rsi_ob': 62, 'vol_spike': 0.26703735229309605, 'adx_thresh': 21.719640554710153, 'atr_min_pct': 0.020850553157830753, 'atr_max_pct': 0.14404976720186272, 'tp_mult': 2.064086263316016, 'tsl_mult': 0.5721145134090675, 'strategy': 'mean_reversion', 'time_stop': 279, 'use_sma': False, 'use_atr': False, 'use_adx': False, 'use_ema': False, 'use_spike': False, 'rsi_required': False, 'edge_k': 1.066098777885291, 'edge_cap': 0.31055489672140446}.
[I 2025-08-29 22:37:18,367] Trial 527 finished with values: [-1000000000.0, 1000000000.0] and parameters: {'p_sma': 35, 'p_std': 11, 'p_atr': 28, 'p_adx': 23, 'rsi_period': 9, 'ema1': 30, 'ema2': 59, 'slip_atr_k': 0.14400647825483423, 'slip_spread_k': 0.7901186619241074, 'spread_hl_frac': 0.01172705771038537, 'bb_std_mult': 3.0071911985822077, 'rsi_os': 31, 'rsi_ob': 56, 'vol_spike': 0.2736895598270337, 'adx_thresh': 22.74945960024995, 'atr_min_pct': 0.007563053150617105, 'atr_max_pct': 0.14973223447870487, 'tp_mult': 1.9560027682237495, 'tsl_mult': 0.543172087823115, 'strategy': 'mean_reversion', 'time_stop': 228, 'use_sma': False, 'use_atr': False, 'use_adx': False, 'use_ema': False, 'use_spike': False, 'rsi_required': False, 'edge_k': 1.6627061039058044, 'edge_cap': 0.17823232042904608}.
[I 2025-08-29 22:37:18,378] Trial 524 finished with values: [-1000000000.0, 1000000000.0] and parameters: {'p_sma': 32, 'p_std': 11, 'p_atr': 10, 'p_adx': 23, 'rsi_period': 13, 'ema1': 16, 'ema2': 41, 'slip_atr_k': 0.13947836431036711, 'slip_spread_k': 0.7975357322976069, 'spread_hl_frac': 0.011395308345696832, 'bb_std_mult': 2.987597856652659, 'rsi_os': 30, 'rsi_ob': 62, 'vol_spike': 0.26720502093447057, 'adx_thresh': 22.671069187402544, 'atr_min_pct': 0.021111484076017182, 'atr_max_pct': 0.14285102501281902, 'tp_mult': 1.9697126339147781, 'tsl_mult': 0.5479710877320864, 'strategy': 'mean_reversion', 'time_stop': 259, 'use_sma': False, 'use_atr': False, 'use_adx': False, 'use_ema': False, 'use_spike': False, 'rsi_required': False, 'edge_k': 1.009498386728356, 'edge_cap': 0.2879543304092038}.
[I 2025-08-29 22:37:18,397] Trial 526 finished with values: [-1000000000.0, 1000000000.0] and parameters: {'p_sma': 35, 'p_std': 11, 'p_atr': 11, 'p_adx': 23, 'rsi_period': 8, 'ema1': 30, 'ema2': 16, 'slip_atr_k': 0.14124999506642083, 'slip_spread_k': 0.40388893334866255, 'spread_hl_frac': 0.01264004099274111, 'bb_std_mult': 1.5857011898467042, 'rsi_os': 31, 'rsi_ob': 59, 'vol_spike': 0.27266059885815386, 'adx_thresh': 22.385683057823506, 'atr_min_pct': 0.005165479005333109, 'atr_max_pct': 0.13832527996842228, 'tp_mult': 2.509617692158567, 'tsl_mult': 0.027013565936495787, 'strategy': 'mean_reversion', 'time_stop': 223, 'use_sma': False, 'use_atr': False, 'use_adx': False, 'use_ema': False, 'use_spike': False, 'rsi_required': False, 'edge_k': 1.6798937772219182, 'edge_cap': 0.18194970810417865}.
[I 2025-08-29 22:37:18,561] Trial 525 finished with values: [-1000000000.0, 1000000000.0] and parameters: {'p_sma': 32, 'p_std': 11, 'p_atr': 11, 'p_adx': 28, 'rsi_period': 9, 'ema1': 26, 'ema2': 41, 'slip_atr_k': 0.12950972817311424, 'slip_spread_k': 0.4990622887236328, 'spread_hl_frac': 0.012777915395182192, 'bb_std_mult': 3.02004945813058, 'rsi_os': 30, 'rsi_ob': 59, 'vol_spike': 0.26635449982954224, 'adx_thresh': 20.33474515708245, 'atr_min_pct': 0.007133339042495853, 'atr_max_pct': 0.14994013808504777, 'tp_mult': 2.072680289775998, 'tsl_mult': 0.5392892523089554, 'strategy': 'mean_reversion', 'time_stop': 250, 'use_sma': False, 'use_atr': False, 'use_adx': False, 'use_ema': False, 'use_spike': False, 'rsi_required': False, 'edge_k': 1.6452619098829548, 'edge_cap': 0.2814262312663266}.
[I 2025-08-29 22:37:46,280] Trial 529 finished with values: [-1000000000.0, 1000000000.0] and parameters: {'p_sma': 26, 'p_std': 10, 'p_atr': 10, 'p_adx': 25, 'rsi_period': 11, 'ema1': 21, 'ema2': 39, 'slip_atr_k': 0.1299429475508356, 'slip_spread_k': 0.855370802211082, 'spread_hl_frac': 0.013143609543016344, 'bb_std_mult': 3.242981648331453, 'rsi_os': 31, 'rsi_ob': 59, 'vol_spike': 0.2608419370301398, 'adx_thresh': 20.427231790379434, 'atr_min_pct': 0.006743478661177386, 'atr_max_pct': 0.1405457271079315, 'tp_mult': 2.4278311188946735, 'tsl_mult': 0.9953697094403628, 'strategy': 'breakout', 'time_stop': 300, 'use_sma': False, 'use_atr': False, 'use_adx': False, 'use_ema': False, 'use_spike': False, 'rsi_required': False, 'edge_k': 0.8093297959985115, 'edge_cap': 0.2223114554999586}.
[I 2025-08-29 22:37:46,316] Trial 531 finished with values: [-1000000000.0, 1000000000.0] and parameters: {'p_sma': 29, 'p_std': 10, 'p_atr': 19, 'p_adx': 25, 'rsi_period': 11, 'ema1': 29, 'ema2': 11, 'slip_atr_k': 0.15121337842648858, 'slip_spread_k': 0.35505895477955113, 'spread_hl_frac': 0.04525636007310115, 'bb_std_mult': 2.0085242408799076, 'rsi_os': 34, 'rsi_ob': 60, 'vol_spike': 0.1569419754266243, 'adx_thresh': 20.54844748657552, 'atr_min_pct': 0.008683239604432694, 'atr_max_pct': 0.14738478919945755, 'tp_mult': 2.116300267387213, 'tsl_mult': 0.2926089420706173, 'strategy': 'breakout', 'time_stop': 14, 'use_sma': False, 'use_atr': False, 'use_adx': False, 'use_ema': False, 'use_spike': False, 'rsi_required': False, 'edge_k': 1.4282298601945034, 'edge_cap': 0.21716826305445094}.
[I 2025-08-29 22:37:46,437] Trial 528 finished with values: [-1000000000.0, 1000000000.0] and parameters: {'p_sma': 26, 'p_std': 12, 'p_atr': 15, 'p_adx': 16, 'rsi_period': 11, 'ema1': 26, 'ema2': 11, 'slip_atr_k': 0.1520860105414479, 'slip_spread_k': 0.5344518471151055, 'spread_hl_frac': 0.024258446585370727, 'bb_std_mult': 3.242455912923701, 'rsi_os': 34, 'rsi_ob': 57, 'vol_spike': 0.2825915422127571, 'adx_thresh': 21.17775635887514, 'atr_min_pct': 0.01969611582691239, 'atr_max_pct': 0.1469573090547819, 'tp_mult': 2.0933755851586238, 'tsl_mult': 0.33326627348855636, 'strategy': 'breakout', 'time_stop': 249, 'use_sma': False, 'use_atr': False, 'use_adx': False, 'use_ema': False, 'use_spike': False, 'rsi_required': False, 'edge_k': 1.2022264556251185, 'edge_cap': 0.2602274204228959}.
[I 2025-08-29 22:37:46,604] Trial 530 finished with values: [-1000000000.0, 1000000000.0] and parameters: {'p_sma': 37, 'p_std': 12, 'p_atr': 10, 'p_adx': 16, 'rsi_period': 7, 'ema1': 27, 'ema2': 23, 'slip_atr_k': 0.241490725609154, 'slip_spread_k': 0.7990510346975492, 'spread_hl_frac': 0.04547087715861964, 'bb_std_mult': 3.0579190093375312, 'rsi_os': 34, 'rsi_ob': 59, 'vol_spike': 0.2831261696177106, 'adx_thresh': 20.666184987632302, 'atr_min_pct': 0.019713872651828508, 'atr_max_pct': 0.14698215461277547, 'tp_mult': 1.3365963182391507, 'tsl_mult': 0.5996577287284344, 'strategy': 'breakout', 'time_stop': 286, 'use_sma': False, 'use_atr': False, 'use_adx': False, 'use_ema': False, 'use_spike': False, 'rsi_required': False, 'edge_k': 1.2104045836017632, 'edge_cap': 0.2206069030180855}.
[I 2025-08-29 22:38:13,752] Trial 532 finished with values: [-1000000000.0, 1000000000.0] and parameters: {'p_sma': 37, 'p_std': 12, 'p_atr': 15, 'p_adx': 22, 'rsi_period': 7, 'ema1': 23, 'ema2': 12, 'slip_atr_k': 0.06926923403268176, 'slip_spread_k': 0.8369922524616459, 'spread_hl_frac': 0.028085880152274575, 'bb_std_mult': 3.068901475021587, 'rsi_os': 19, 'rsi_ob': 57, 'vol_spike': 0.11853355983813235, 'adx_thresh': 21.173470578363407, 'atr_min_pct': 0.01917595625439071, 'atr_max_pct': 0.1376506198723983, 'tp_mult': 1.1129659218657042, 'tsl_mult': 0.6132593140359336, 'strategy': 'mean_reversion', 'time_stop': 24, 'use_sma': False, 'use_atr': False, 'use_adx': False, 'use_ema': False, 'use_spike': False, 'rsi_required': False, 'edge_k': 1.7734298683501848, 'edge_cap': 0.26134248537042365}.
[I 2025-08-29 22:38:14,223] Trial 535 finished with values: [-1000000000.0, 1000000000.0] and parameters: {'p_sma': 41, 'p_std': 14, 'p_atr': 11, 'p_adx': 17, 'rsi_period': 8, 'ema1': 29, 'ema2': 13, 'slip_atr_k': 0.1737852324764027, 'slip_spread_k': 0.3070825041886318, 'spread_hl_frac': 0.0008570884102393796, 'bb_std_mult': 0.6365465221624229, 'rsi_os': 36, 'rsi_ob': 61, 'vol_spike': 0.2521523381137786, 'adx_thresh': 7.5220173497483405, 'atr_min_pct': 0.014529339873634872, 'atr_max_pct': 0.13722293416995632, 'tp_mult': 2.1933482323641087, 'tsl_mult': 0.7620408373177544, 'strategy': 'mean_reversion', 'time_stop': 264, 'use_sma': False, 'use_atr': False, 'use_adx': False, 'use_ema': False, 'use_spike': False, 'rsi_required': False, 'edge_k': 1.7803726704485978, 'edge_cap': 0.2445438994905499}.
[I 2025-08-29 22:38:14,319] Trial 533 finished with values: [-1000000000.0, 1000000000.0] and parameters: {'p_sma': 37, 'p_std': 12, 'p_atr': 16, 'p_adx': 16, 'rsi_period': 8, 'ema1': 17, 'ema2': 13, 'slip_atr_k': 0.17480153309888014, 'slip_spread_k': 0.5395031029826843, 'spread_hl_frac': 0.025092918982695712, 'bb_std_mult': 3.068185378681559, 'rsi_os': 47, 'rsi_ob': 60, 'vol_spike': 0.10902369598577116, 'adx_thresh': 21.259266653522925, 'atr_min_pct': 0.02774866299040432, 'atr_max_pct': 0.13755816333854637, 'tp_mult': 1.3410798274923605, 'tsl_mult': 0.6237140524785305, 'strategy': 'mean_reversion', 'time_stop': 263, 'use_sma': False, 'use_atr': False, 'use_adx': False, 'use_ema': False, 'use_spike': False, 'rsi_required': False, 'edge_k': 1.4575693505155642, 'edge_cap': 0.2643518039197513}.
[I 2025-08-29 22:38:14,424] Trial 534 finished with values: [-1000000000.0, 1000000000.0] and parameters: {'p_sma': 37, 'p_std': 8, 'p_atr': 10, 'p_adx': 24, 'rsi_period': 7, 'ema1': 27, 'ema2': 57, 'slip_atr_k': 0.00019050912499140847, 'slip_spread_k': 0.7997706257922299, 'spread_hl_frac': 0.0027052398234978306, 'bb_std_mult': 3.0710492865413115, 'rsi_os': 19, 'rsi_ob': 64, 'vol_spike': 0.2795621011429567, 'adx_thresh': 21.30367552462539, 'atr_min_pct': 0.014451103277966343, 'atr_max_pct': 0.13914509497990799, 'tp_mult': 1.1168527140592337, 'tsl_mult': 0.646954200735465, 'strategy': 'mean_reversion', 'time_stop': 240, 'use_sma': False, 'use_atr': False, 'use_adx': False, 'use_ema': False, 'use_spike': False, 'rsi_required': False, 'edge_k': 1.5193270629855222, 'edge_cap': 0.25625279841046644}.
[I 2025-08-29 22:38:41,793] Trial 539 finished with values: [-1000000000.0, 1000000000.0] and parameters: {'p_sma': 30, 'p_std': 14, 'p_atr': 9, 'p_adx': 23, 'rsi_period': 9, 'ema1': 28, 'ema2': 10, 'slip_atr_k': 0.0072036999535569175, 'slip_spread_k': 0.8724992356937492, 'spread_hl_frac': 0.010503879566304494, 'bb_std_mult': 2.983201278618436, 'rsi_os': 40, 'rsi_ob': 60, 'vol_spike': 0.2755684699834346, 'adx_thresh': 21.869622252775446, 'atr_min_pct': 0.009191436837017179, 'atr_max_pct': 0.13508652159216888, 'tp_mult': 1.999836563805426, 'tsl_mult': 0.5577545072714044, 'strategy': 'mean_reversion', 'time_stop': 294, 'use_sma': False, 'use_atr': False, 'use_adx': False, 'use_ema': False, 'use_spike': False, 'rsi_required': False, 'edge_k': 1.1323982848047154, 'edge_cap': 0.1843531611268529}.
[I 2025-08-29 22:38:42,098] Trial 537 finished with values: [-1000000000.0, 1000000000.0] and parameters: {'p_sma': 36, 'p_std': 16, 'p_atr': 10, 'p_adx': 19, 'rsi_period': 9, 'ema1': 27, 'ema2': 57, 'slip_atr_k': 0.00033514440164649547, 'slip_spread_k': 0.873040628120898, 'spread_hl_frac': 0.008138418429627623, 'bb_std_mult': 3.5819481242401503, 'rsi_os': 13, 'rsi_ob': 60, 'vol_spike': 0.27439674239669165, 'adx_thresh': 19.920298697090587, 'atr_min_pct': 0.00909874524189555, 'atr_max_pct': 0.14046985340340834, 'tp_mult': 1.9942631898506773, 'tsl_mult': 0.6745268937676149, 'strategy': 'mean_reversion', 'time_stop': 237, 'use_sma': False, 'use_atr': False, 'use_adx': False, 'use_ema': False, 'use_spike': False, 'rsi_required': False, 'edge_k': 1.123045896307779, 'edge_cap': 0.18941500273278986}.
[I 2025-08-29 22:38:42,117] Trial 536 finished with values: [-1000000000.0, 1000000000.0] and parameters: {'p_sma': 41, 'p_std': 16, 'p_atr': 11, 'p_adx': 26, 'rsi_period': 8, 'ema1': 17, 'ema2': 13, 'slip_atr_k': 0.005788067036664749, 'slip_spread_k': 0.628890800654031, 'spread_hl_frac': 0.0009568015296453625, 'bb_std_mult': 2.9750733041002846, 'rsi_os': 31, 'rsi_ob': 61, 'vol_spike': 0.24796830739553524, 'adx_thresh': 21.8668646846359, 'atr_min_pct': 0.011696793557569128, 'atr_max_pct': 0.14146984095842688, 'tp_mult': 2.1898912671385777, 'tsl_mult': 0.36306131541601866, 'strategy': 'mean_reversion', 'time_stop': 264, 'use_sma': False, 'use_atr': False, 'use_adx': False, 'use_ema': False, 'use_spike': False, 'rsi_required': False, 'edge_k': 1.1269418791192631, 'edge_cap': 0.24587202973367484}.
[I 2025-08-29 22:38:42,301] Trial 538 finished with values: [-1000000000.0, 1000000000.0] and parameters: {'p_sma': 39, 'p_std': 8, 'p_atr': 9, 'p_adx': 19, 'rsi_period': 9, 'ema1': 25, 'ema2': 10, 'slip_atr_k': 0.22161540440021116, 'slip_spread_k': 0.05885868541197897, 'spread_hl_frac': 0.007981427809148553, 'bb_std_mult': 2.9780426501747246, 'rsi_os': 40, 'rsi_ob': 62, 'vol_spike': 0.2773705400893161, 'adx_thresh': 21.90341490801777, 'atr_min_pct': 0.007937053337398029, 'atr_max_pct': 0.14162238147777426, 'tp_mult': 1.0562051811569364, 'tsl_mult': 0.6736722743622268, 'strategy': 'mean_reversion', 'time_stop': 240, 'use_sma': False, 'use_atr': False, 'use_adx': False, 'use_ema': False, 'use_spike': False, 'rsi_required': False, 'edge_k': 1.1106046634038516, 'edge_cap': 0.19484321483339342}.
