[I 2025-08-29 23:10:00,560] Trial 836 finished with values: [-1000000000.0, 1000000000.0] and parameters: {'p_sma': 10, 'p_std': 15, 'p_atr': 11, 'p_adx': 14, 'rsi_period': 68, 'ema1': 30, 'ema2': 19, 'slip_atr_k': 0.004051058943144875, 'slip_spread_k': 0.03726053566107773, 'spread_hl_frac': 0.0320474582993452, 'bb_std_mult': 1.3992052651258873, 'rsi_os': 31, 'rsi_ob': 85, 'vol_spike': 0.07785853471424056, 'adx_thresh': 19.487012038537365, 'atr_min_pct': 0.018885517638901946, 'atr_max_pct': 0.07447987948620015, 'tp_mult': 1.9257991115641508, 'tsl_mult': 0.6732050938254175, 'strategy': 'mean_reversion', 'time_stop': 276, 'use_sma': False, 'use_atr': False, 'use_adx': False, 'use_ema': False, 'use_spike': False, 'rsi_required': False, 'edge_k': 0.7415360536480577, 'edge_cap': 0.14561029946395673}.
[I 2025-08-29 23:10:27,450] Trial 838 finished with values: [-1000000000.0, 1000000000.0] and parameters: {'p_sma': 30, 'p_std': 12, 'p_atr': 13, 'p_adx': 12, 'rsi_period': 13, 'ema1': 30, 'ema2': 26, 'slip_atr_k': 0.0043749698967680715, 'slip_spread_k': 0.2721221684950759, 'spread_hl_frac': 0.008433644662987818, 'bb_std_mult': 1.400679412961785, 'rsi_os': 32, 'rsi_ob': 71, 'vol_spike': 0.021419295204696376, 'adx_thresh': 20.416220786919247, 'atr_min_pct': 0.018733365640281087, 'atr_max_pct': 0.07070418525196231, 'tp_mult': 1.913997862882028, 'tsl_mult': 0.7347959464267124, 'strategy': 'breakout', 'time_stop': 285, 'use_sma': False, 'use_atr': False, 'use_adx': False, 'use_ema': False, 'use_spike': False, 'rsi_required': False, 'edge_k': 1.860368139213851, 'edge_cap': 0.15334917097797593}.
[I 2025-08-29 23:10:27,803] Trial 839 finished with values: [-1000000000.0, 1000000000.0] and parameters: {'p_sma': 7, 'p_std': 15, 'p_atr': 13, 'p_adx': 13, 'rsi_period': 8, 'ema1': 30, 'ema2': 23, 'slip_atr_k': 0.003927397998047051, 'slip_spread_k': 0.03474395794815671, 'spread_hl_frac': 0.008870911708482917, 'bb_std_mult': 1.3988296429066824, 'rsi_os': 34, 'rsi_ob': 85, 'vol_spike': 0.2644373560879961, 'adx_thresh': 20.407595860235567, 'atr_min_pct': 0.02655325977848782, 'atr_max_pct': 0.0989794652395409, 'tp_mult': 1.8816871616646735, 'tsl_mult': 0.9604459108931007, 'strategy': 'mean_reversion', 'time_stop': 34, 'use_sma': False, 'use_atr': False, 'use_adx': False, 'use_ema': False, 'use_spike': False, 'rsi_required': False, 'edge_k': 1.8557278710253389, 'edge_cap': 0.1868823966807705}.
[I 2025-08-29 23:10:27,943] Trial 841 finished with values: [-1000000000.0, 1000000000.0] and parameters: {'p_sma': 27, 'p_std': 10, 'p_atr': 13, 'p_adx': 12, 'rsi_period': 53, 'ema1': 30, 'ema2': 23, 'slip_atr_k': 0.00038494751604328613, 'slip_spread_k': 0.2788565943444099, 'spread_hl_frac': 0.006048513178776187, 'bb_std_mult': 1.2167860099764476, 'rsi_os': 34, 'rsi_ob': 71, 'vol_spike': 0.25383359612733264, 'adx_thresh': 12.585333350251695, 'atr_min_pct': 0.012189016599933846, 'atr_max_pct': 0.07008283727641294, 'tp_mult': 1.8600995330412162, 'tsl_mult': 0.6116975186965669, 'strategy': 'breakout', 'time_stop': 286, 'use_sma': False, 'use_atr': False, 'use_adx': False, 'use_ema': False, 'use_spike': False, 'rsi_required': False, 'edge_k': 0.13972217515773688, 'edge_cap': 0.3310859427924847}.
[I 2025-08-29 23:10:28,054] Trial 840 finished with values: [-1000000000.0, 1000000000.0] and parameters: {'p_sma': 5, 'p_std': 15, 'p_atr': 13, 'p_adx': 12, 'rsi_period': 46, 'ema1': 30, 'ema2': 23, 'slip_atr_k': 0.0038512240649188987, 'slip_spread_k': 0.3338794900471853, 'spread_hl_frac': 0.006274867179282648, 'bb_std_mult': 1.5087131081396319, 'rsi_os': 33, 'rsi_ob': 46, 'vol_spike': 0.1903545785546547, 'adx_thresh': 20.416006192969785, 'atr_min_pct': 0.026772825295378815, 'atr_max_pct': 0.09902553741136394, 'tp_mult': 1.8836111229178336, 'tsl_mult': 0.7281667040497783, 'strategy': 'breakout', 'time_stop': 286, 'use_sma': False, 'use_atr': False, 'use_adx': False, 'use_ema': False, 'use_spike': False, 'rsi_required': False, 'edge_k': 1.9964579932651234, 'edge_cap': 0.13529022911771799}.
[I 2025-08-29 23:10:28,357] Trial 842 finished with values: [-1000000000.0, 1000000000.0] and parameters: {'p_sma': 33, 'p_std': 10, 'p_atr': 13, 'p_adx': 13, 'rsi_period': 53, 'ema1': 29, 'ema2': 23, 'slip_atr_k': 0.004031427236559298, 'slip_spread_k': 0.1259197198966347, 'spread_hl_frac': 0.013263595287530315, 'bb_std_mult': 1.501486598375692, 'rsi_os': 21, 'rsi_ob': 46, 'vol_spike': 0.26723899467807694, 'adx_thresh': 21.064490916441578, 'atr_min_pct': 0.012072177729073156, 'atr_max_pct': 0.07367150476876264, 'tp_mult': 1.863367825118663, 'tsl_mult': 0.610902145593904, 'strategy': 'mean_reversion', 'time_stop': 31, 'use_sma': False, 'use_atr': False, 'use_adx': False, 'use_ema': False, 'use_spike': False, 'rsi_required': False, 'edge_k': 0.15373107718909373, 'edge_cap': 0.07862855696589838}.
[I 2025-08-29 23:10:28,371] Trial 844 finished with values: [-1000000000.0, 1000000000.0] and parameters: {'p_sma': 16, 'p_std': 12, 'p_atr': 12, 'p_adx': 12, 'rsi_period': 46, 'ema1': 29, 'ema2': 33, 'slip_atr_k': 0.1017266365018707, 'slip_spread_k': 0.3332685840672293, 'spread_hl_frac': 0.013406443072361864, 'bb_std_mult': 1.4952883363147311, 'rsi_os': 53, 'rsi_ob': 59, 'vol_spike': 0.08416700366499999, 'adx_thresh': 15.764101808305897, 'atr_min_pct': 0.017819561246508766, 'atr_max_pct': 0.07314398349309595, 'tp_mult': 1.940400979552087, 'tsl_mult': 0.832356123232372, 'strategy': 'mean_reversion', 'time_stop': 281, 'use_sma': False, 'use_atr': False, 'use_adx': False, 'use_ema': False, 'use_spike': False, 'rsi_required': False, 'edge_k': 1.9956113659138908, 'edge_cap': 0.20950890931812105}.
[I 2025-08-29 23:10:54,787] Trial 843 finished with values: [-1000000000.0, 1000000000.0] and parameters: {'p_sma': 27, 'p_std': 57, 'p_atr': 13, 'p_adx': 12, 'rsi_period': 20, 'ema1': 29, 'ema2': 20, 'slip_atr_k': 5.8913504202577e-06, 'slip_spread_k': 0.3017682148012412, 'spread_hl_frac': 0.013273616911977091, 'bb_std_mult': 1.2343490890457522, 'rsi_os': 33, 'rsi_ob': 59, 'vol_spike': 0.08710360513782935, 'adx_thresh': 26.995922753841967, 'atr_min_pct': 0.017878029680197173, 'atr_max_pct': 0.03515484899126577, 'tp_mult': 1.8596709676826404, 'tsl_mult': 0.8155891906426957, 'strategy': 'mean_reversion', 'time_stop': 283, 'use_sma': False, 'use_atr': False, 'use_adx': False, 'use_ema': False, 'use_spike': False, 'rsi_required': False, 'edge_k': 0.9807507526999402, 'edge_cap': 0.3298439069795637}.
[I 2025-08-29 23:10:54,804] Trial 845 finished with values: [-1000000000.0, 1000000000.0] and parameters: {'p_sma': 33, 'p_std': 54, 'p_atr': 12, 'p_adx': 13, 'rsi_period': 10, 'ema1': 29, 'ema2': 21, 'slip_atr_k': 7.806693816923176e-05, 'slip_spread_k': 0.5765996655868998, 'spread_hl_frac': 0.0134153221061688, 'bb_std_mult': 1.2120207604376443, 'rsi_os': 33, 'rsi_ob': 59, 'vol_spike': 0.2682213563435984, 'adx_thresh': 18.241554923896782, 'atr_min_pct': 0.025251068583369365, 'atr_max_pct': 0.07444948550197289, 'tp_mult': 1.9354595819440177, 'tsl_mult': 0.6070288024541655, 'strategy': 'mean_reversion', 'time_stop': 295, 'use_sma': False, 'use_atr': False, 'use_adx': False, 'use_ema': False, 'use_spike': False, 'rsi_required': False, 'edge_k': 1.8872912250949647, 'edge_cap': 0.2130915233284571}.
[I 2025-08-29 23:10:55,753] Trial 847 finished with values: [-1000000000.0, 1000000000.0] and parameters: {'p_sma': 24, 'p_std': 12, 'p_atr': 12, 'p_adx': 13, 'rsi_period': 77, 'ema1': 27, 'ema2': 28, 'slip_atr_k': 0.08273996714064172, 'slip_spread_k': 0.22417035545791447, 'spread_hl_frac': 0.04640230064093399, 'bb_std_mult': 1.2354457690825487, 'rsi_os': 47, 'rsi_ob': 64, 'vol_spike': 0.2550114304008376, 'adx_thresh': 27.169909105570426, 'atr_min_pct': 0.028429999084843102, 'atr_max_pct': 0.03550273039591799, 'tp_mult': 1.9361547793914888, 'tsl_mult': 0.6487075068990753, 'strategy': 'mean_reversion', 'time_stop': 223, 'use_sma': False, 'use_atr': False, 'use_adx': False, 'use_ema': False, 'use_spike': False, 'rsi_required': False, 'edge_k': 1.8972707142575396, 'edge_cap': 0.5888085176465382}.
[I 2025-08-29 23:10:56,055] Trial 846 finished with values: [-1000000000.0, 1000000000.0] and parameters: {'p_sma': 31, 'p_std': 12, 'p_atr': 12, 'p_adx': 13, 'rsi_period': 20, 'ema1': 28, 'ema2': 32, 'slip_atr_k': 0.00017028597823542894, 'slip_spread_k': 0.30214646930733496, 'spread_hl_frac': 0.011057005277278813, 'bb_std_mult': 1.2566048254673503, 'rsi_os': 12, 'rsi_ob': 65, 'vol_spike': 0.2529068470752406, 'adx_thresh': 21.356463920886586, 'atr_min_pct': 0.013401764005165299, 'atr_max_pct': 0.08782619154512043, 'tp_mult': 1.9389925507968246, 'tsl_mult': 0.3228432436989652, 'strategy': 'mean_reversion', 'time_stop': 260, 'use_sma': False, 'use_atr': False, 'use_adx': False, 'use_ema': False, 'use_spike': False, 'rsi_required': False, 'edge_k': 1.998762259734778, 'edge_cap': 0.2200095600621807}.
[I 2025-08-29 23:11:23,977] Trial 849 finished with values: [-1000000000.0, 1000000000.0] and parameters: {'p_sma': 25, 'p_std': 50, 'p_atr': 20, 'p_adx': 13, 'rsi_period': 61, 'ema1': 27, 'ema2': 17, 'slip_atr_k': 0.2236304458423819, 'slip_spread_k': 0.30125601450767436, 'spread_hl_frac': 0.010850434969540445, 'bb_std_mult': 1.2833054740406784, 'rsi_os': 32, 'rsi_ob': 64, 'vol_spike': 0.2530865643147832, 'adx_thresh': 22.031854981283203, 'atr_min_pct': 0.024047367398486924, 'atr_max_pct': 0.0824682230894083, 'tp_mult': 1.9829437234580312, 'tsl_mult': 0.37371082876590855, 'strategy': 'mean_reversion', 'time_stop': 267, 'use_sma': False, 'use_atr': False, 'use_adx': False, 'use_ema': False, 'use_spike': False, 'rsi_required': False, 'edge_k': 1.9022537505443082, 'edge_cap': 0.22877690311705035}.
[I 2025-08-29 23:11:24,407] Trial 848 finished with values: [-1000000000.0, 1000000000.0] and parameters: {'p_sma': 25, 'p_std': 12, 'p_atr': 20, 'p_adx': 13, 'rsi_period': 17, 'ema1': 30, 'ema2': 25, 'slip_atr_k': 0.009552213727762071, 'slip_spread_k': 0.39518270320114357, 'spread_hl_frac': 0.0111698539634713, 'bb_std_mult': 1.2967077434527077, 'rsi_os': 32, 'rsi_ob': 65, 'vol_spike': 0.2531447641460914, 'adx_thresh': 31.169580938553835, 'atr_min_pct': 0.013414908752219432, 'atr_max_pct': 0.08120129614591297, 'tp_mult': 1.9411123930865053, 'tsl_mult': 0.6367070051991285, 'strategy': 'mean_reversion', 'time_stop': 142, 'use_sma': False, 'use_atr': False, 'use_adx': False, 'use_ema': False, 'use_spike': False, 'rsi_required': False, 'edge_k': 1.9010800006896416, 'edge_cap': 0.18751920659243468}.
[I 2025-08-29 23:11:24,529] Trial 851 finished with values: [-1000000000.0, 1000000000.0] and parameters: {'p_sma': 13, 'p_std': 26, 'p_atr': 11, 'p_adx': 28, 'rsi_period': 50, 'ema1': 12, 'ema2': 17, 'slip_atr_k': 0.013128595356434814, 'slip_spread_k': 0.24282833819789928, 'spread_hl_frac': 0.009793153284269147, 'bb_std_mult': 1.353112075114615, 'rsi_os': 32, 'rsi_ob': 61, 'vol_spike': 0.04994960915002772, 'adx_thresh': 19.67830413212457, 'atr_min_pct': 0.021819008289978944, 'atr_max_pct': 0.05329129082764751, 'tp_mult': 1.2855542134161377, 'tsl_mult': 0.9260227427652801, 'strategy': 'mean_reversion', 'time_stop': 266, 'use_sma': False, 'use_atr': False, 'use_adx': False, 'use_ema': False, 'use_spike': False, 'rsi_required': False, 'edge_k': 1.9452290050805163, 'edge_cap': 0.7722586399862353}.
[I 2025-08-29 23:11:24,688] Trial 850 finished with values: [-1000000000.0, 1000000000.0] and parameters: {'p_sma': 25, 'p_std': 47, 'p_atr': 11, 'p_adx': 13, 'rsi_period': 40, 'ema1': 28, 'ema2': 17, 'slip_atr_k': 0.11619516703294755, 'slip_spread_k': 0.3075381847963222, 'spread_hl_frac': 0.011135419633963632, 'bb_std_mult': 1.285742612450063, 'rsi_os': 35, 'rsi_ob': 65, 'vol_spike': 0.06767958720158308, 'adx_thresh': 6.398671259531168, 'atr_min_pct': 0.011003826382370581, 'atr_max_pct': 0.05751362325885193, 'tp_mult': 1.9704902740937844, 'tsl_mult': 0.6359105876220121, 'strategy': 'mean_reversion', 'time_stop': 168, 'use_sma': False, 'use_atr': False, 'use_adx': False, 'use_ema': False, 'use_spike': False, 'rsi_required': False, 'edge_k': 1.961569656844416, 'edge_cap': 0.235779605052756}.
[I 2025-08-29 23:11:52,040] Trial 852 finished with values: [-1000000000.0, 1000000000.0] and parameters: {'p_sma': 21, 'p_std': 47, 'p_atr': 11, 'p_adx': 27, 'rsi_period': 44, 'ema1': 12, 'ema2': 24, 'slip_atr_k': 0.011788388862822852, 'slip_spread_k': 0.3921138085424559, 'spread_hl_frac': 0.009566794525156214, 'bb_std_mult': 1.3492899362242265, 'rsi_os': 35, 'rsi_ob': 67, 'vol_spike': 0.2608968786737554, 'adx_thresh': 13.23297925907453, 'atr_min_pct': 0.010194850870172682, 'atr_max_pct': 0.05660972180490854, 'tp_mult': 1.9976470604147976, 'tsl_mult': 0.6283461750683611, 'strategy': 'breakout', 'time_stop': 141, 'use_sma': False, 'use_atr': False, 'use_adx': False, 'use_ema': False, 'use_spike': False, 'rsi_required': False, 'edge_k': 1.9642759333621824, 'edge_cap': 0.6143783879977514}.
[I 2025-08-29 23:11:52,678] Trial 855 finished with values: [-1000000000.0, 1000000000.0] and parameters: {'p_sma': 29, 'p_std': 8, 'p_atr': 12, 'p_adx': 14, 'rsi_period': 8, 'ema1': 30, 'ema2': 38, 'slip_atr_k': 0.018704646753315558, 'slip_spread_k': 0.2599967398517426, 'spread_hl_frac': 0.027431215517905706, 'bb_std_mult': 1.4412866693864896, 'rsi_os': 34, 'rsi_ob': 87, 'vol_spike': 0.17537901254671492, 'adx_thresh': 14.869529201831355, 'atr_min_pct': 0.010159901008306193, 'atr_max_pct': 0.06706312378573567, 'tp_mult': 1.8917534773272193, 'tsl_mult': 0.12559948167272061, 'strategy': 'breakout', 'time_stop': 5, 'use_sma': False, 'use_atr': False, 'use_adx': False, 'use_ema': False, 'use_spike': False, 'rsi_required': False, 'edge_k': 1.9524294333561605, 'edge_cap': 0.7133805647184105}.
[I 2025-08-29 23:11:53,180] Trial 853 finished with values: [-1000000000.0, 1000000000.0] and parameters: {'p_sma': 21, 'p_std': 14, 'p_atr': 11, 'p_adx': 14, 'rsi_period': 8, 'ema1': 30, 'ema2': 18, 'slip_atr_k': 0.11438108459571254, 'slip_spread_k': 0.2287225571542541, 'spread_hl_frac': 0.009317557152884955, 'bb_std_mult': 1.3737595892766161, 'rsi_os': 35, 'rsi_ob': 61, 'vol_spike': 0.24106152022420135, 'adx_thresh': 19.546436435792014, 'atr_min_pct': 0.0220536530939247, 'atr_max_pct': 0.06713658987194626, 'tp_mult': 1.283055006059688, 'tsl_mult': 0.9334738385842191, 'strategy': 'breakout', 'time_stop': 124, 'use_sma': False, 'use_atr': False, 'use_adx': False, 'use_ema': False, 'use_spike': False, 'rsi_required': False, 'edge_k': 1.9508366846478782, 'edge_cap': 0.19019305631623967}.
[I 2025-08-29 23:11:53,257] Trial 854 finished with values: [-1000000000.0, 1000000000.0] and parameters: {'p_sma': 21, 'p_std': 47, 'p_atr': 11, 'p_adx': 14, 'rsi_period': 13, 'ema1': 30, 'ema2': 59, 'slip_atr_k': 0.06833297641409646, 'slip_spread_k': 0.9269706143945093, 'spread_hl_frac': 0.030324455766263286, 'bb_std_mult': 1.4360648271355996, 'rsi_os': 17, 'rsi_ob': 63, 'vol_spike': 0.2606308383908978, 'adx_thresh': 21.516752667176895, 'atr_min_pct': 0.010234929158197814, 'atr_max_pct': 0.057252272310033166, 'tp_mult': 1.99953005995868, 'tsl_mult': 0.6652849302887135, 'strategy': 'breakout', 'time_stop': 292, 'use_sma': False, 'use_atr': False, 'use_adx': False, 'use_ema': False, 'use_spike': False, 'rsi_required': False, 'edge_k': 1.9537070627277962, 'edge_cap': 0.6118869771568285}.
[I 2025-08-29 23:11:53,512] Trial 858 finished with values: [-1000000000.0, 1000000000.0] and parameters: {'p_sma': 38, 'p_std': 11, 'p_atr': 12, 'p_adx': 12, 'rsi_period': 13, 'ema1': 15, 'ema2': 50, 'slip_atr_k': 0.19855859952056615, 'slip_spread_k': 0.3476299657804286, 'spread_hl_frac': 0.012407438443623022, 'bb_std_mult': 1.4233214046550227, 'rsi_os': 17, 'rsi_ob': 47, 'vol_spike': 0.2599520060636692, 'adx_thresh': 21.331397130500847, 'atr_min_pct': 0.001530596535104001, 'atr_max_pct': 0.07684005059354665, 'tp_mult': 2.962794095655748, 'tsl_mult': 0.7027637303576565, 'strategy': 'mean_reversion', 'time_stop': 291, 'use_sma': False, 'use_atr': False, 'use_adx': False, 'use_ema': False, 'use_spike': False, 'rsi_required': False, 'edge_k': 1.8469728283902926, 'edge_cap': 0.17559560357971743}.
[I 2025-08-29 23:12:20,598] Trial 857 finished with values: [-0.005570283622807981, 0.00553415410747877] and parameters: {'p_sma': 38, 'p_std': 42, 'p_atr': 12, 'p_adx': 30, 'rsi_period': 13, 'ema1': 21, 'ema2': 59, 'slip_atr_k': 0.09060489176133846, 'slip_spread_k': 0.6628620931365918, 'spread_hl_frac': 0.03031181434177989, 'bb_std_mult': 1.4384805945579668, 'rsi_os': 34, 'rsi_ob': 63, 'vol_spike': 0.24085901898928505, 'adx_thresh': 21.40402608955516, 'atr_min_pct': 0.0036765447114495958, 'atr_max_pct': 0.0698691163461033, 'tp_mult': 1.138711549445001, 'tsl_mult': 0.5805451950663949, 'strategy': 'mean_reversion', 'time_stop': 289, 'use_sma': False, 'use_atr': False, 'use_adx': False, 'use_ema': False, 'use_spike': False, 'rsi_required': False, 'edge_k': 1.80898571447534, 'edge_cap': 0.1872544310415971}.
[I 2025-08-29 23:12:21,302] Trial 859 finished with values: [-1000000000.0, 1000000000.0] and parameters: {'p_sma': 38, 'p_std': 11, 'p_atr': 12, 'p_adx': 12, 'rsi_period': 11, 'ema1': 29, 'ema2': 50, 'slip_atr_k': 0.009259146071851215, 'slip_spread_k': 0.16882893394276716, 'spread_hl_frac': 0.014984023380394725, 'bb_std_mult': 1.4192434276245092, 'rsi_os': 33, 'rsi_ob': 63, 'vol_spike': 0.24728308611953967, 'adx_thresh': 22.027980278951745, 'atr_min_pct': 0.006508676530975365, 'atr_max_pct': 0.07680369425240607, 'tp_mult': 2.507826056374359, 'tsl_mult': 0.5877953795989973, 'strategy': 'mean_reversion', 'time_stop': 289, 'use_sma': False, 'use_atr': False, 'use_adx': False, 'use_ema': False, 'use_spike': False, 'rsi_required': False, 'edge_k': 1.811144065330314, 'edge_cap': 0.1822113535751341}.
[I 2025-08-29 23:12:21,337] Trial 856 finished with values: [-0.02419020295481933, 0.024180837655538728] and parameters: {'p_sma': 38, 'p_std': 11, 'p_atr': 12, 'p_adx': 14, 'rsi_period': 8, 'ema1': 16, 'ema2': 59, 'slip_atr_k': 0.01866713092704718, 'slip_spread_k': 0.17171210160896078, 'spread_hl_frac': 0.002463204523581272, 'bb_std_mult': 1.4386164336928193, 'rsi_os': 34, 'rsi_ob': 63, 'vol_spike': 0.242275934197483, 'adx_thresh': 28.230599301849068, 'atr_min_pct': 0.0013605609123850618, 'atr_max_pct': 0.06778129049180084, 'tp_mult': 1.8952671277149242, 'tsl_mult': 0.6964305446131217, 'strategy': 'breakout', 'time_stop': 290, 'use_sma': False, 'use_atr': False, 'use_adx': False, 'use_ema': False, 'use_spike': False, 'rsi_required': False, 'edge_k': 1.8249181238517254, 'edge_cap': 0.7177604880281538}.
[I 2025-08-29 23:12:21,502] Trial 860 finished with values: [-1000000000.0, 1000000000.0] and parameters: {'p_sma': 35, 'p_std': 10, 'p_atr': 12, 'p_adx': 19, 'rsi_period': 11, 'ema1': 29, 'ema2': 41, 'slip_atr_k': 0.21063531810766611, 'slip_spread_k': 0.2793232836728908, 'spread_hl_frac': 0.01485162423884794, 'bb_std_mult': 1.3715154141420156, 'rsi_os': 20, 'rsi_ob': 60, 'vol_spike': 0.03377195268436005, 'adx_thresh': 22.249202809075044, 'atr_min_pct': 0.006639031655866304, 'atr_max_pct': 0.02289849519084694, 'tp_mult': 1.0513491586783759, 'tsl_mult': 0.8634213707864572, 'strategy': 'mean_reversion', 'time_stop': 21, 'use_sma': False, 'use_atr': False, 'use_adx': False, 'use_ema': False, 'use_spike': False, 'rsi_required': False, 'edge_k': 1.7082381107242741, 'edge_cap': 0.6780168001471392}.
[I 2025-08-29 23:12:21,804] Trial 864 finished with values: [-1000000000.0, 1000000000.0] and parameters: {'p_sma': 30, 'p_std': 13, 'p_atr': 13, 'p_adx': 13, 'rsi_period': 10, 'ema1': 30, 'ema2': 15, 'slip_atr_k': 0.005283996733845884, 'slip_spread_k': 0.28892523864433706, 'spread_hl_frac': 0.012186542931816154, 'bb_std_mult': 1.3466992314758028, 'rsi_os': 50, 'rsi_ob': 54, 'vol_spike': 0.12996746824063543, 'adx_thresh': 20.66221568517284, 'atr_min_pct': 0.005482748419163005, 'atr_max_pct': 0.11082260005649036, 'tp_mult': 2.6790251021514546, 'tsl_mult': 0.604299436769119, 'strategy': 'mean_reversion', 'time_stop': 300, 'use_sma': False, 'use_atr': False, 'use_adx': False, 'use_ema': False, 'use_spike': False, 'rsi_required': False, 'edge_k': 1.9048516057183027, 'edge_cap': 0.2050675495747938}.
[I 2025-08-29 23:12:21,810] Trial 863 finished with values: [-1000000000.0, 1000000000.0] and parameters: {'p_sma': 34, 'p_std': 13, 'p_atr': 28, 'p_adx': 13, 'rsi_period': 11, 'ema1': 30, 'ema2': 15, 'slip_atr_k': 3.393684226607761e-05, 'slip_spread_k': 0.28544185866116123, 'spread_hl_frac': 0.048148117989296184, 'bb_std_mult': 1.3622298884389417, 'rsi_os': 50, 'rsi_ob': 60, 'vol_spike': 0.12645009458823758, 'adx_thresh': 23.014903766113214, 'atr_min_pct': 0.005678064496210382, 'atr_max_pct': 0.014883831860467836, 'tp_mult': 1.84156099482205, 'tsl_mult': 0.6055973729555383, 'strategy': 'mean_reversion', 'time_stop': 300, 'use_sma': False, 'use_atr': False, 'use_adx': False, 'use_ema': False, 'use_spike': False, 'rsi_required': False, 'edge_k': 1.703805368098065, 'edge_cap': 0.12245904905603947}.
[I 2025-08-29 23:12:47,787] Trial 861 finished with values: [-1000000000.0, 1000000000.0] and parameters: {'p_sma': 30, 'p_std': 10, 'p_atr': 18, 'p_adx': 13, 'rsi_period': 10, 'ema1': 29, 'ema2': 15, 'slip_atr_k': 0.00827234452155331, 'slip_spread_k': 0.28839020580171276, 'spread_hl_frac': 0.014507056639578329, 'bb_std_mult': 1.3620282204934657, 'rsi_os': 33, 'rsi_ob': 60, 'vol_spike': 0.034876548017562625, 'adx_thresh': 22.072949596312977, 'atr_min_pct': 0.019908108498000645, 'atr_max_pct': 0.022974706823843907, 'tp_mult': 1.0528142476301277, 'tsl_mult': 0.16254334751887534, 'strategy': 'mean_reversion', 'time_stop': 203, 'use_sma': False, 'use_atr': False, 'use_adx': False, 'use_ema': False, 'use_spike': False, 'rsi_required': False, 'edge_k': 1.9217670194877763, 'edge_cap': 0.1255032411991052}.
