[I 2025-08-29 23:29:29,334] Trial 1028 finished with values: [-1000000000.0, 1000000000.0] and parameters: {'p_sma': 28, 'p_std': 12, 'p_atr': 11, 'p_adx': 13, 'rsi_period': 12, 'ema1': 30, 'ema2': 20, 'slip_atr_k': 0.009952167512377576, 'slip_spread_k': 0.30419409906804357, 'spread_hl_frac': 0.010800083199959223, 'bb_std_mult': 3.4984076392925565, 'rsi_os': 31, 'rsi_ob': 61, 'vol_spike': 0.23092232957182188, 'adx_thresh': 18.84696645854364, 'atr_min_pct': 0.02545699020368158, 'atr_max_pct': 0.039326444750171115, 'tp_mult': 1.9884011642561539, 'tsl_mult': 0.3450660992962865, 'strategy': 'breakout', 'time_stop': 293, 'use_sma': False, 'use_atr': False, 'use_adx': False, 'use_ema': False, 'use_spike': False, 'rsi_required': False, 'edge_k': 1.868062576700324, 'edge_cap': 0.20671831588823258}.
[I 2025-08-29 23:29:29,531] Trial 1029 finished with values: [-1000000000.0, 1000000000.0] and parameters: {'p_sma': 33, 'p_std': 15, 'p_atr': 11, 'p_adx': 8, 'rsi_period': 8, 'ema1': 26, 'ema2': 21, 'slip_atr_k': 0.11336655592152742, 'slip_spread_k': 0.306745386897305, 'spread_hl_frac': 0.04986333427394751, 'bb_std_mult': 1.3699974063812865, 'rsi_os': 43, 'rsi_ob': 64, 'vol_spike': 0.08734181695080814, 'adx_thresh': 21.154205423278636, 'atr_min_pct': 0.007691887624756169, 'atr_max_pct': 0.03770653868761942, 'tp_mult': 1.1705802711068583, 'tsl_mult': 0.6362044244657086, 'strategy': 'breakout', 'time_stop': 292, 'use_sma': False, 'use_atr': False, 'use_adx': False, 'use_ema': False, 'use_spike': False, 'rsi_required': False, 'edge_k': 1.8576437262600825, 'edge_cap': 0.23221849759611796}.
[I 2025-08-29 23:29:29,724] Trial 1027 finished with values: [-1000000000.0, 1000000000.0] and parameters: {'p_sma': 26, 'p_std': 32, 'p_atr': 11, 'p_adx': 8, 'rsi_period': 12, 'ema1': 30, 'ema2': 20, 'slip_atr_k': 0.00992651977263233, 'slip_spread_k': 0.3070535593333258, 'spread_hl_frac': 0.010644841506419742, 'bb_std_mult': 1.3567117487694893, 'rsi_os': 16, 'rsi_ob': 64, 'vol_spike': 0.0008307752673993585, 'adx_thresh': 19.30857452188189, 'atr_min_pct': 0.025282256429667752, 'atr_max_pct': 0.11460662410148283, 'tp_mult': 2.0570807650040415, 'tsl_mult': 0.8783097477987885, 'strategy': 'breakout', 'time_stop': 296, 'use_sma': False, 'use_atr': False, 'use_adx': False, 'use_ema': False, 'use_spike': False, 'rsi_required': False, 'edge_k': 1.95578223090814, 'edge_cap': 0.9296242540495528}.
[I 2025-08-29 23:29:29,807] Trial 1026 finished with values: [-1000000000.0, 1000000000.0] and parameters: {'p_sma': 5, 'p_std': 12, 'p_atr': 11, 'p_adx': 8, 'rsi_period': 12, 'ema1': 24, 'ema2': 22, 'slip_atr_k': 0.004567330793260931, 'slip_spread_k': 0.30887590293876077, 'spread_hl_frac': 0.02633845781066627, 'bb_std_mult': 1.1816263846145745, 'rsi_os': 9, 'rsi_ob': 53, 'vol_spike': 0.27862065560607696, 'adx_thresh': 13.67608344681667, 'atr_min_pct': 0.008086195387142676, 'atr_max_pct': 0.07602057048417112, 'tp_mult': 1.9865424411563464, 'tsl_mult': 0.6299629337982329, 'strategy': 'breakout', 'time_stop': 135, 'use_sma': False, 'use_atr': False, 'use_adx': False, 'use_ema': False, 'use_spike': False, 'rsi_required': False, 'edge_k': 1.8620371403502092, 'edge_cap': 0.20473809045025326}.
[I 2025-08-29 23:29:57,140] Trial 1032 finished with values: [-1000000000.0, 1000000000.0] and parameters: {'p_sma': 26, 'p_std': 54, 'p_atr': 13, 'p_adx': 14, 'rsi_period': 40, 'ema1': 29, 'ema2': 22, 'slip_atr_k': 0.016827618469603917, 'slip_spread_k': 0.26949513270162734, 'spread_hl_frac': 0.022712493465237574, 'bb_std_mult': 1.5169229744551236, 'rsi_os': 32, 'rsi_ob': 68, 'vol_spike': 0.2869203226591296, 'adx_thresh': 20.584880183559406, 'atr_min_pct': 0.026290768429118254, 'atr_max_pct': 0.07533784332484952, 'tp_mult': 1.5940122351711303, 'tsl_mult': 0.839701602141318, 'strategy': 'mean_reversion', 'time_stop': 81, 'use_sma': False, 'use_atr': False, 'use_adx': False, 'use_ema': False, 'use_spike': False, 'rsi_required': False, 'edge_k': 1.9124900524420356, 'edge_cap': 0.8119865600559315}.
[I 2025-08-29 23:29:57,170] Trial 1033 finished with values: [-1000000000.0, 1000000000.0] and parameters: {'p_sma': 33, 'p_std': 13, 'p_atr': 14, 'p_adx': 12, 'rsi_period': 40, 'ema1': 29, 'ema2': 22, 'slip_atr_k': 0.017758180071299645, 'slip_spread_k': 0.041553548510204874, 'spread_hl_frac': 0.004773996005293088, 'bb_std_mult': 1.4909325777547795, 'rsi_os': 32, 'rsi_ob': 66, 'vol_spike': 0.2664282720446561, 'adx_thresh': 20.49898184509251, 'atr_min_pct': 0.01853031167706327, 'atr_max_pct': 0.0693995416836154, 'tp_mult': 2.6192966705259737, 'tsl_mult': 0.7189336719225513, 'strategy': 'mean_reversion', 'time_stop': 281, 'use_sma': False, 'use_atr': False, 'use_adx': False, 'use_ema': False, 'use_spike': False, 'rsi_required': False, 'edge_k': 1.9128104243863775, 'edge_cap': 0.3368569604600705}.
[I 2025-08-29 23:29:57,280] Trial 1030 finished with values: [-1000000000.0, 1000000000.0] and parameters: {'p_sma': 25, 'p_std': 41, 'p_atr': 13, 'p_adx': 14, 'rsi_period': 8, 'ema1': 26, 'ema2': 21, 'slip_atr_k': 0.15003085292780047, 'slip_spread_k': 0.2935285055797902, 'spread_hl_frac': 0.047294187507208416, 'bb_std_mult': 1.3669221024980278, 'rsi_os': 32, 'rsi_ob': 66, 'vol_spike': 0.17419733769200632, 'adx_thresh': 21.082566897449915, 'atr_min_pct': 0.007532523634229014, 'atr_max_pct': 0.09876816141824546, 'tp_mult': 1.598772719382798, 'tsl_mult': 0.6360092272991893, 'strategy': 'breakout', 'time_stop': 192, 'use_sma': False, 'use_atr': False, 'use_adx': False, 'use_ema': False, 'use_spike': False, 'rsi_required': False, 'edge_k': 1.96679917477734, 'edge_cap': 0.8827318347835795}.
[I 2025-08-29 23:29:57,349] Trial 1031 finished with values: [-1000000000.0, 1000000000.0] and parameters: {'p_sma': 27, 'p_std': 16, 'p_atr': 16, 'p_adx': 12, 'rsi_period': 12, 'ema1': 30, 'ema2': 22, 'slip_atr_k': 2.5237106167115683e-06, 'slip_spread_k': 0.2599127507140393, 'spread_hl_frac': 0.010848144510517153, 'bb_std_mult': 2.6647252828887633, 'rsi_os': 32, 'rsi_ob': 93, 'vol_spike': 0.1696390961813907, 'adx_thresh': 20.622888068369384, 'atr_min_pct': 0.02623355080620375, 'atr_max_pct': 0.0762156279255526, 'tp_mult': 2.589855233763179, 'tsl_mult': 0.7135937849288233, 'strategy': 'mean_reversion', 'time_stop': 33, 'use_sma': False, 'use_atr': False, 'use_adx': False, 'use_ema': False, 'use_spike': False, 'rsi_required': False, 'edge_k': 1.9498430129763071, 'edge_cap': 0.10394237906309173}.
[I 2025-08-29 23:30:24,149] Trial 1035 finished with values: [-1000000000.0, 1000000000.0] and parameters: {'p_sma': 28, 'p_std': 8, 'p_atr': 12, 'p_adx': 15, 'rsi_period': 10, 'ema1': 30, 'ema2': 21, 'slip_atr_k': 0.005080249470870174, 'slip_spread_k': 0.26513920780382616, 'spread_hl_frac': 0.011497440210985652, 'bb_std_mult': 1.28290743757779, 'rsi_os': 21, 'rsi_ob': 63, 'vol_spike': 0.17353300195593632, 'adx_thresh': 21.846069524606946, 'atr_min_pct': 0.029590904627035747, 'atr_max_pct': 0.032671083692641496, 'tp_mult': 1.918405146732756, 'tsl_mult': 0.6532744784938093, 'strategy': 'mean_reversion', 'time_stop': 286, 'use_sma': False, 'use_atr': False, 'use_adx': False, 'use_ema': False, 'use_spike': False, 'rsi_required': False, 'edge_k': 1.9987567065690823, 'edge_cap': 0.8769108683018931}.
[I 2025-08-29 23:30:24,415] Trial 1036 finished with values: [-0.000788536273613083, 0.001712413463983802] and parameters: {'p_sma': 8, 'p_std': 30, 'p_atr': 20, 'p_adx': 7, 'rsi_period': 10, 'ema1': 10, 'ema2': 20, 'slip_atr_k': 8.060393682356995e-05, 'slip_spread_k': 0.27780706901620744, 'spread_hl_frac': 0.010570026143151064, 'bb_std_mult': 1.228905711652309, 'rsi_os': 13, 'rsi_ob': 92, 'vol_spike': 0.23915945815851278, 'adx_thresh': 21.757306202060477, 'atr_min_pct': 0.0014626590247272617, 'atr_max_pct': 0.06700630246917015, 'tp_mult': 1.9432497344788362, 'tsl_mult': 0.5844551705771954, 'strategy': 'mean_reversion', 'time_stop': 232, 'use_sma': False, 'use_atr': False, 'use_adx': False, 'use_ema': False, 'use_spike': False, 'rsi_required': False, 'edge_k': 0.11641629964383726, 'edge_cap': 0.151460201560636}.
[I 2025-08-29 23:30:24,653] Trial 1034 finished with values: [-1000000000.0, 1000000000.0] and parameters: {'p_sma': 27, 'p_std': 14, 'p_atr': 20, 'p_adx': 15, 'rsi_period': 8, 'ema1': 30, 'ema2': 21, 'slip_atr_k': 0.0001634944923428288, 'slip_spread_k': 0.6950046387594062, 'spread_hl_frac': 0.001925478618180869, 'bb_std_mult': 1.231987560053209, 'rsi_os': 34, 'rsi_ob': 63, 'vol_spike': 0.24530333671916799, 'adx_thresh': 27.239965710577916, 'atr_min_pct': 0.029485015424413022, 'atr_max_pct': 0.03376996573526918, 'tp_mult': 1.9073496046372598, 'tsl_mult': 0.6549638406768379, 'strategy': 'mean_reversion', 'time_stop': 231, 'use_sma': False, 'use_atr': False, 'use_adx': False, 'use_ema': False, 'use_spike': False, 'rsi_required': False, 'edge_k': 1.9584317446303603, 'edge_cap': 0.1506667688571745}.
[I 2025-08-29 23:30:24,654] Trial 1037 finished with values: [-1000000000.0, 1000000000.0] and parameters: {'p_sma': 29, 'p_std': 14, 'p_atr': 12, 'p_adx': 27, 'rsi_period': 57, 'ema1': 18, 'ema2': 20, 'slip_atr_k': 0.004562105825822311, 'slip_spread_k': 0.2712714306717685, 'spread_hl_frac': 0.012671049794788738, 'bb_std_mult': 1.2288453308829428, 'rsi_os': 36, 'rsi_ob': 61, 'vol_spike': 0.12475168026211375, 'adx_thresh': 28.443067221143682, 'atr_min_pct': 0.013014307249262815, 'atr_max_pct': 0.06846830676938817, 'tp_mult': 1.9282418313843328, 'tsl_mult': 0.6547693124814552, 'strategy': 'mean_reversion', 'time_stop': 283, 'use_sma': False, 'use_atr': False, 'use_adx': False, 'use_ema': False, 'use_spike': False, 'rsi_required': False, 'edge_k': 1.9707552817509335, 'edge_cap': 0.1548384711399829}.
[I 2025-08-29 23:30:52,841] Trial 1041 finished with values: [-0.01208936925398374, 0.012087358461627264] and parameters: {'p_sma': 24, 'p_std': 11, 'p_atr': 18, 'p_adx': 13, 'rsi_period': 13, 'ema1': 23, 'ema2': 20, 'slip_atr_k': 0.011263755407171117, 'slip_spread_k': 0.21816053475296654, 'spread_hl_frac': 0.008537084016390955, 'bb_std_mult': 2.211572519642632, 'rsi_os': 33, 'rsi_ob': 62, 'vol_spike': 0.29827119819843895, 'adx_thresh': 10.22296545964534, 'atr_min_pct': 0.0020625586396382737, 'atr_max_pct': 0.06584638577284396, 'tp_mult': 1.9454407257867579, 'tsl_mult': 0.3208903003159464, 'strategy': 'mean_reversion', 'time_stop': 279, 'use_sma': False, 'use_atr': False, 'use_adx': False, 'use_ema': False, 'use_spike': False, 'rsi_required': False, 'edge_k': 1.0855175231625152, 'edge_cap': 0.1807699039003979}.
[I 2025-08-29 23:30:53,023] Trial 1039 finished with values: [-1000000000.0, 1000000000.0] and parameters: {'p_sma': 29, 'p_std': 6, 'p_atr': 18, 'p_adx': 13, 'rsi_period': 38, 'ema1': 13, 'ema2': 20, 'slip_atr_k': 0.004628724943389378, 'slip_spread_k': 0.6069465230454728, 'spread_hl_frac': 7.65728298830412e-05, 'bb_std_mult': 1.2168330516900798, 'rsi_os': 33, 'rsi_ob': 61, 'vol_spike': 0.24461330858526448, 'adx_thresh': 17.69727987876474, 'atr_min_pct': 0.004798265061489295, 'atr_max_pct': 0.025432038181533036, 'tp_mult': 2.5290520644195236, 'tsl_mult': 0.20271500719302848, 'strategy': 'mean_reversion', 'time_stop': 283, 'use_sma': False, 'use_atr': False, 'use_adx': False, 'use_ema': False, 'use_spike': False, 'rsi_required': False, 'edge_k': 1.2021794831414387, 'edge_cap': 0.18025928602214106}.
[I 2025-08-29 23:30:53,109] Trial 1038 finished with values: [-0.021171979333620805, 0.021156813183657995] and parameters: {'p_sma': 29, 'p_std': 28, 'p_atr': 12, 'p_adx': 13, 'rsi_period': 11, 'ema1': 13, 'ema2': 20, 'slip_atr_k': 0.08693643337507972, 'slip_spread_k': 0.6733087517875929, 'spread_hl_frac': 0.012677978911912035, 'bb_std_mult': 2.4947950013653286, 'rsi_os': 34, 'rsi_ob': 61, 'vol_spike': 0.2930405654647186, 'adx_thresh': 10.2095291268124, 'atr_min_pct': 0.0018316508926629455, 'atr_max_pct': 0.06589898941628124, 'tp_mult': 1.9612996009640917, 'tsl_mult': 0.5887722983163405, 'strategy': 'mean_reversion', 'time_stop': 281, 'use_sma': False, 'use_atr': False, 'use_adx': False, 'use_ema': False, 'use_spike': False, 'rsi_required': False, 'edge_k': 1.9996693868731164, 'edge_cap': 0.1855456263085952}.
[I 2025-08-29 23:30:53,201] Trial 1040 finished with values: [-0.031981422116868274, 0.031991414931321516] and parameters: {'p_sma': 59, 'p_std': 30, 'p_atr': 18, 'p_adx': 13, 'rsi_period': 10, 'ema1': 29, 'ema2': 21, 'slip_atr_k': 0.24042228259388398, 'slip_spread_k': 0.22462690411415015, 'spread_hl_frac': 0.0068345955191768115, 'bb_std_mult': 2.3193690586301248, 'rsi_os': 42, 'rsi_ob': 89, 'vol_spike': 0.2986903811146735, 'adx_thresh': 11.14263001732374, 'atr_min_pct': 0.0018458852144164748, 'atr_max_pct': 0.06546077766261812, 'tp_mult': 2.0436984437601913, 'tsl_mult': 0.21229641810370026, 'strategy': 'mean_reversion', 'time_stop': 279, 'use_sma': False, 'use_atr': False, 'use_adx': False, 'use_ema': False, 'use_spike': False, 'rsi_required': False, 'edge_k': 1.2132970753297174, 'edge_cap': 0.1833746043949897}.
[I 2025-08-29 23:30:53,475] Trial 1045 finished with values: [-1000000000.0, 1000000000.0] and parameters: {'p_sma': 31, 'p_std': 51, 'p_atr': 12, 'p_adx': 13, 'rsi_period': 54, 'ema1': 30, 'ema2': 22, 'slip_atr_k': 0.009145995274178208, 'slip_spread_k': 0.2903280790944497, 'spread_hl_frac': 0.04191639328777061, 'bb_std_mult': 1.4603499190441103, 'rsi_os': 33, 'rsi_ob': 64, 'vol_spike': 0.26446186374270436, 'adx_thresh': 19.943842159384314, 'atr_min_pct': 0.019565058440096962, 'atr_max_pct': 0.01702778952773977, 'tp_mult': 2.3074460033578417, 'tsl_mult': 0.15973790668873533, 'strategy': 'mean_reversion', 'time_stop': 174, 'use_sma': False, 'use_atr': False, 'use_adx': False, 'use_ema': False, 'use_spike': False, 'rsi_required': False, 'edge_k': 1.9178938015482845, 'edge_cap': 0.6868377251254704}.
[I 2025-08-29 23:30:53,507] Trial 1043 finished with values: [-1000000000.0, 1000000000.0] and parameters: {'p_sma': 31, 'p_std': 43, 'p_atr': 12, 'p_adx': 13, 'rsi_period': 14, 'ema1': 29, 'ema2': 22, 'slip_atr_k': 0.023212649922218068, 'slip_spread_k': 0.9767713917597689, 'spread_hl_frac': 0.010681907692613034, 'bb_std_mult': 3.597085913992016, 'rsi_os': 34, 'rsi_ob': 48, 'vol_spike': 0.2625495362089413, 'adx_thresh': 19.583328752248523, 'atr_min_pct': 0.0061444274090533, 'atr_max_pct': 0.10442724003804629, 'tp_mult': 2.253012963141005, 'tsl_mult': 0.5946237143173642, 'strategy': 'mean_reversion', 'time_stop': 17, 'use_sma': False, 'use_atr': False, 'use_adx': False, 'use_ema': False, 'use_spike': False, 'rsi_required': False, 'edge_k': 1.893255746867711, 'edge_cap': 0.22682116047328227}.
[I 2025-08-29 23:30:53,516] Trial 1044 finished with values: [-1000000000.0, 1000000000.0] and parameters: {'p_sma': 59, 'p_std': 48, 'p_atr': 14, 'p_adx': 13, 'rsi_period': 54, 'ema1': 28, 'ema2': 22, 'slip_atr_k': 0.021740991807238777, 'slip_spread_k': 0.2884527037168246, 'spread_hl_frac': 0.00687769712991055, 'bb_std_mult': 2.3160060770066635, 'rsi_os': 17, 'rsi_ob': 48, 'vol_spike': 0.26530406113605265, 'adx_thresh': 11.307764149280601, 'atr_min_pct': 0.01967482921438639, 'atr_max_pct': 0.0695818635197927, 'tp_mult': 2.255152513109118, 'tsl_mult': 0.620607695497265, 'strategy': 'mean_reversion', 'time_stop': 300, 'use_sma': False, 'use_atr': False, 'use_adx': False, 'use_ema': False, 'use_spike': False, 'rsi_required': False, 'edge_k': 0.17706591654835546, 'edge_cap': 0.21979891241857463}.
[I 2025-08-29 23:31:17,534] Trial 1042 finished with values: [-0.004883551396877017, 0.004850548508648759] and parameters: {'p_sma': 31, 'p_std': 30, 'p_atr': 12, 'p_adx': 13, 'rsi_period': 10, 'ema1': 30, 'ema2': 22, 'slip_atr_k': 0.16796155079590674, 'slip_spread_k': 0.2357563455447713, 'spread_hl_frac': 0.006703257950614956, 'bb_std_mult': 1.3982357627240365, 'rsi_os': 33, 'rsi_ob': 89, 'vol_spike': 0.2636891767519668, 'adx_thresh': 23.883046479175466, 'atr_min_pct': 0.004759802200124217, 'atr_max_pct': 0.06976971465685822, 'tp_mult': 2.0410977546085993, 'tsl_mult': 0.5970623004626415, 'strategy': 'mean_reversion', 'time_stop': 300, 'use_sma': False, 'use_atr': False, 'use_adx': False, 'use_ema': False, 'use_spike': False, 'rsi_required': False, 'edge_k': 1.999343963592497, 'edge_cap': 0.7079496573950984}.
[I 2025-08-29 23:31:21,620] Trial 1046 finished with values: [-1000000000.0, 1000000000.0] and parameters: {'p_sma': 7, 'p_std': 20, 'p_atr': 14, 'p_adx': 13, 'rsi_period': 13, 'ema1': 20, 'ema2': 22, 'slip_atr_k': 0.023176273556407213, 'slip_spread_k': 0.24348777715465636, 'spread_hl_frac': 0.021149039268967187, 'bb_std_mult': 1.4046592913314457, 'rsi_os': 33, 'rsi_ob': 52, 'vol_spike': 0.2629116445471561, 'adx_thresh': 23.92737848638294, 'atr_min_pct': 0.0063303082950142585, 'atr_max_pct': 0.06985694039046646, 'tp_mult': 2.0065828779494, 'tsl_mult': 0.6270198967281927, 'strategy': 'mean_reversion', 'time_stop': 219, 'use_sma': False, 'use_atr': False, 'use_adx': False, 'use_ema': False, 'use_spike': False, 'rsi_required': False, 'edge_k': 1.8950172085987669, 'edge_cap': 0.13120227281481806}.
[I 2025-08-29 23:31:21,734] Trial 1047 finished with values: [-1000000000.0, 1000000000.0] and parameters: {'p_sma': 57, 'p_std': 13, 'p_atr': 29, 'p_adx': 13, 'rsi_period': 67, 'ema1': 28, 'ema2': 22, 'slip_atr_k': 0.004338251755814356, 'slip_spread_k': 0.3497081880064209, 'spread_hl_frac': 0.014765972303638193, 'bb_std_mult': 1.406097990610577, 'rsi_os': 33, 'rsi_ob': 59, 'vol_spike': 0.11174800877041047, 'adx_thresh': 8.551992433525749, 'atr_min_pct': 0.00913248567381493, 'atr_max_pct': 0.07057695045506729, 'tp_mult': 1.9997986593909405, 'tsl_mult': 0.6142279506283227, 'strategy': 'mean_reversion', 'time_stop': 300, 'use_sma': False, 'use_atr': False, 'use_adx': False, 'use_ema': False, 'use_spike': False, 'rsi_required': False, 'edge_k': 0.8295221633470488, 'edge_cap': 0.9574166415941342}.
[I 2025-08-29 23:31:21,896] Trial 1048 finished with values: [-1000000000.0, 1000000000.0] and parameters: {'p_sma': 9, 'p_std': 13, 'p_atr': 29, 'p_adx': 13, 'rsi_period': 16, 'ema1': 10, 'ema2': 20, 'slip_atr_k': 0.05095504387384489, 'slip_spread_k': 0.2441703801482653, 'spread_hl_frac': 0.009901931954249456, 'bb_std_mult': 1.3916909311086494, 'rsi_os': 33, 'rsi_ob': 90, 'vol_spike': 0.18481890076909918, 'adx_thresh': 23.985203928570424, 'atr_min_pct': 0.003937913309209649, 'atr_max_pct': 0.07425658450169766, 'tp_mult': 2.7277563497260635, 'tsl_mult': 0.03508653576133297, 'strategy': 'mean_reversion', 'time_stop': 290, 'use_sma': False, 'use_atr': False, 'use_adx': False, 'use_ema': False, 'use_spike': False, 'rsi_required': False, 'edge_k': 1.9286854167454501, 'edge_cap': 0.3577514702539293}.
[I 2025-08-29 23:31:48,767] Trial 1049 finished with values: [-1000000000.0, 1000000000.0] and parameters: {'p_sma': 26, 'p_std': 11, 'p_atr': 7, 'p_adx': 13, 'rsi_period': 19, 'ema1': 17, 'ema2': 20, 'slip_atr_k': 0.05196339824015579, 'slip_spread_k': 0.31768265411121516, 'spread_hl_frac': 0.009725166580712397, 'bb_std_mult': 1.3009565081477712, 'rsi_os': 34, 'rsi_ob': 71, 'vol_spike': 0.1850182306562686, 'adx_thresh': 21.313833369285906, 'atr_min_pct': 0.009103576662273695, 'atr_max_pct': 0.07378535896585522, 'tp_mult': 1.8456674690006967, 'tsl_mult': 0.07258145371544722, 'strategy': 'breakout', 'time_stop': 221, 'use_sma': False, 'use_atr': False, 'use_adx': False, 'use_ema': False, 'use_spike': False, 'rsi_required': False, 'edge_k': 0.1352149727240941, 'edge_cap': 0.11501995687884542}.
[I 2025-08-29 23:31:49,495] Trial 1050 finished with values: [-1000000000.0, 1000000000.0] and parameters: {'p_sma': 26, 'p_std': 13, 'p_atr': 29, 'p_adx': 13, 'rsi_period': 19, 'ema1': 21, 'ema2': 21, 'slip_atr_k': 0.005680065534227762, 'slip_spread_k': 0.259290471460052, 'spread_hl_frac': 0.009970855904160247, 'bb_std_mult': 1.3085553269155452, 'rsi_os': 31, 'rsi_ob': 91, 'vol_spike': 0.18265083159320428, 'adx_thresh': 8.041240312698788, 'atr_min_pct': 0.010453091583682236, 'atr_max_pct': 0.07371175143647038, 'tp_mult': 1.8415724641361475, 'tsl_mult': 0.6160553280525104, 'strategy': 'breakout', 'time_stop': 290, 'use_sma': False, 'use_atr': False, 'use_adx': False, 'use_ema': False, 'use_spike': False, 'rsi_required': False, 'edge_k': 1.8339185622830223, 'edge_cap': 0.3953374291828827}.
[I 2025-08-29 23:31:49,787] Trial 1051 finished with values: [-1000000000.0, 1000000000.0] and parameters: {'p_sma': 26, 'p_std': 17, 'p_atr': 30, 'p_adx': 13, 'rsi_period': 7, 'ema1': 29, 'ema2': 20, 'slip_atr_k': 0.013940052953078748, 'slip_spread_k': 0.13305216628308475, 'spread_hl_frac': 0.009198095646171436, 'bb_std_mult': 1.3122262263638567, 'rsi_os': 13, 'rsi_ob': 62, 'vol_spike': 0.08164458884403936, 'adx_thresh': 21.534494219228666, 'atr_min_pct': 0.02057127711957871, 'atr_max_pct': 0.021140305574432437, 'tp_mult': 1.86227390359646, 'tsl_mult': 0.06660207437600207, 'strategy': 'breakout', 'time_stop': 289, 'use_sma': False, 'use_atr': False, 'use_adx': False, 'use_ema': False, 'use_spike': False, 'rsi_required': False, 'edge_k': 1.8336621959174144, 'edge_cap': 0.5750583002901183}.
[I 2025-08-29 23:31:49,852] Trial 1052 finished with values: [-1000000000.0, 1000000000.0] and parameters: {'p_sma': 54, 'p_std': 11, 'p_atr': 17, 'p_adx': 13, 'rsi_period': 21, 'ema1': 21, 'ema2': 21, 'slip_atr_k': 0.013602524556260641, 'slip_spread_k': 0.6383941713368354, 'spread_hl_frac': 0.011736159109743197, 'bb_std_mult': 1.3169674994762866, 'rsi_os': 31, 'rsi_ob': 62, 'vol_spike': 0.15183559647583467, 'adx_thresh': 21.370913599630384, 'atr_min_pct': 0.022114689085399424, 'atr_max_pct': 0.07266627530549186, 'tp_mult': 1.8574765757992893, 'tsl_mult': 0.06370711058982198, 'strategy': 'breakout', 'time_stop': 269, 'use_sma': False, 'use_atr': False, 'use_adx': False, 'use_ema': False, 'use_spike': False, 'rsi_required': False, 'edge_k': 0.12631575881490686, 'edge_cap': 0.5768093278263051}.
