[I 2025-08-29 22:55:31,122] Trial 705 finished with values: [-1000000000.0, 1000000000.0] and parameters: {'p_sma': 30, 'p_std': 60, 'p_atr': 25, 'p_adx': 11, 'rsi_period': 14, 'ema1': 30, 'ema2': 19, 'slip_atr_k': 0.07847065396355404, 'slip_spread_k': 0.28240977728597966, 'spread_hl_frac': 0.015025199616764007, 'bb_std_mult': 1.9679034974667062, 'rsi_os': 33, 'rsi_ob': 45, 'vol_spike': 0.09603783656497687, 'adx_thresh': 17.35390351535503, 'atr_min_pct': 0.020927139076187096, 'atr_max_pct': 0.08366653667364926, 'tp_mult': 1.9738306172770905, 'tsl_mult': 0.6171280314490336, 'strategy': 'mean_reversion', 'time_stop': 300, 'use_sma': False, 'use_atr': False, 'use_adx': False, 'use_ema': False, 'use_spike': False, 'rsi_required': False, 'edge_k': 1.923840184666971, 'edge_cap': 0.16315596405514293}.
[I 2025-08-29 22:55:31,126] Trial 703 finished with values: [-1000000000.0, 1000000000.0] and parameters: {'p_sma': 26, 'p_std': 8, 'p_atr': 25, 'p_adx': 11, 'rsi_period': 14, 'ema1': 30, 'ema2': 19, 'slip_atr_k': 9.672093390720554e-05, 'slip_spread_k': 0.5096177640987097, 'spread_hl_frac': 0.022495804023893815, 'bb_std_mult': 1.984918229760493, 'rsi_os': 55, 'rsi_ob': 62, 'vol_spike': 0.09822394368833813, 'adx_thresh': 20.3617842996276, 'atr_min_pct': 0.01318434340163322, 'atr_max_pct': 0.08362434971558835, 'tp_mult': 2.9989163667377436, 'tsl_mult': 0.6932151689459705, 'strategy': 'mean_reversion', 'time_stop': 286, 'use_sma': False, 'use_atr': False, 'use_adx': False, 'use_ema': False, 'use_spike': False, 'rsi_required': False, 'edge_k': 0.11559091119102816, 'edge_cap': 0.18680177841829854}.
[I 2025-08-29 22:55:56,770] Trial 702 finished with values: [-1000000000.0, 1000000000.0] and parameters: {'p_sma': 19, 'p_std': 5, 'p_atr': 17, 'p_adx': 14, 'rsi_period': 13, 'ema1': 30, 'ema2': 23, 'slip_atr_k': 0.00017714738909718836, 'slip_spread_k': 0.2803146843422594, 'spread_hl_frac': 0.011694567491017736, 'bb_std_mult': 3.592386331983746, 'rsi_os': 50, 'rsi_ob': 47, 'vol_spike': 0.07474301205487449, 'adx_thresh': 20.56376343955635, 'atr_min_pct': 0.00782944517430851, 'atr_max_pct': 0.11057174823431215, 'tp_mult': 1.6199589532724907, 'tsl_mult': 0.688708319288149, 'strategy': 'breakout', 'time_stop': 280, 'use_sma': False, 'use_atr': False, 'use_adx': False, 'use_ema': False, 'use_spike': False, 'rsi_required': False, 'edge_k': 1.9195296151146926, 'edge_cap': 0.18758376091659448}.
[I 2025-08-29 22:55:57,062] Trial 704 finished with values: [-1000000000.0, 1000000000.0] and parameters: {'p_sma': 19, 'p_std': 21, 'p_atr': 14, 'p_adx': 16, 'rsi_period': 65, 'ema1': 15, 'ema2': 19, 'slip_atr_k': 0.21186109542082804, 'slip_spread_k': 0.30270755894648205, 'spread_hl_frac': 0.022742183901047517, 'bb_std_mult': 1.2519545344541392, 'rsi_os': 20, 'rsi_ob': 62, 'vol_spike': 0.1735377496702336, 'adx_thresh': 20.776927263952835, 'atr_min_pct': 0.021118506622635556, 'atr_max_pct': 0.0650315018833137, 'tp_mult': 1.9537810342800388, 'tsl_mult': 0.6695293311592507, 'strategy': 'mean_reversion', 'time_stop': 286, 'use_sma': False, 'use_atr': False, 'use_adx': False, 'use_ema': False, 'use_spike': False, 'rsi_required': False, 'edge_k': 1.9237513754971514, 'edge_cap': 0.18932317727487194}.
[I 2025-08-29 22:55:58,470] Trial 706 finished with values: [-1000000000.0, 1000000000.0] and parameters: {'p_sma': 19, 'p_std': 12, 'p_atr': 17, 'p_adx': 12, 'rsi_period': 9, 'ema1': 15, 'ema2': 22, 'slip_atr_k': 0.20164103030169328, 'slip_spread_k': 0.9395047144212298, 'spread_hl_frac': 0.0126193803077171, 'bb_std_mult': 0.7733876476753664, 'rsi_os': 38, 'rsi_ob': 62, 'vol_spike': 0.07481872566098949, 'adx_thresh': 20.39882299207282, 'atr_min_pct': 0.005957541638292208, 'atr_max_pct': 0.08208177733509803, 'tp_mult': 2.9840462953381577, 'tsl_mult': 0.6381939988358324, 'strategy': 'mean_reversion', 'time_stop': 39, 'use_sma': False, 'use_atr': False, 'use_adx': False, 'use_ema': False, 'use_spike': False, 'rsi_required': False, 'edge_k': 0.09347172641157797, 'edge_cap': 0.1905801395864814}.
[I 2025-08-29 22:55:58,567] Trial 707 finished with values: [-1000000000.0, 1000000000.0] and parameters: {'p_sma': 33, 'p_std': 11, 'p_atr': 17, 'p_adx': 14, 'rsi_period': 12, 'ema1': 15, 'ema2': 23, 'slip_atr_k': 0.20175854487298964, 'slip_spread_k': 0.9334019995319401, 'spread_hl_frac': 0.048524098773956637, 'bb_std_mult': 3.434421638188886, 'rsi_os': 35, 'rsi_ob': 63, 'vol_spike': 0.006315425986001766, 'adx_thresh': 21.247168077414564, 'atr_min_pct': 0.006177255297689276, 'atr_max_pct': 0.0688856508157715, 'tp_mult': 1.9227018321008147, 'tsl_mult': 0.6405864960262155, 'strategy': 'mean_reversion', 'time_stop': 268, 'use_sma': False, 'use_atr': False, 'use_adx': False, 'use_ema': False, 'use_spike': False, 'rsi_required': False, 'edge_k': 1.961278405790098, 'edge_cap': 0.19888432260263375}.
[I 2025-08-29 22:56:24,880] Trial 708 finished with values: [-1000000000.0, 1000000000.0] and parameters: {'p_sma': 33, 'p_std': 11, 'p_atr': 14, 'p_adx': 12, 'rsi_period': 10, 'ema1': 15, 'ema2': 22, 'slip_atr_k': 0.12245242611319622, 'slip_spread_k': 0.3042491278155145, 'spread_hl_frac': 0.00892532023438021, 'bb_std_mult': 0.7593000500201263, 'rsi_os': 35, 'rsi_ob': 63, 'vol_spike': 0.0070061971411826685, 'adx_thresh': 18.12037210325801, 'atr_min_pct': 0.009105195750984665, 'atr_max_pct': 0.06926178019767414, 'tp_mult': 1.7767508563102012, 'tsl_mult': 0.19639130505168245, 'strategy': 'mean_reversion', 'time_stop': 140, 'use_sma': False, 'use_atr': False, 'use_adx': False, 'use_ema': False, 'use_spike': False, 'rsi_required': False, 'edge_k': 1.9610497290147124, 'edge_cap': 0.1595770503455906}.
[I 2025-08-29 22:56:26,134] Trial 711 finished with values: [-1000000000.0, 1000000000.0] and parameters: {'p_sma': 38, 'p_std': 14, 'p_atr': 14, 'p_adx': 15, 'rsi_period': 9, 'ema1': 29, 'ema2': 51, 'slip_atr_k': 0.06714529114739645, 'slip_spread_k': 0.23061090528733122, 'spread_hl_frac': 0.010330477101042288, 'bb_std_mult': 2.2799373625623685, 'rsi_os': 36, 'rsi_ob': 53, 'vol_spike': 0.2356601049346539, 'adx_thresh': 21.53085657000826, 'atr_min_pct': 0.01673778984125846, 'atr_max_pct': 0.05972152749290023, 'tp_mult': 1.7996625680711713, 'tsl_mult': 0.08844959829785115, 'strategy': 'mean_reversion', 'time_stop': 273, 'use_sma': False, 'use_atr': False, 'use_adx': False, 'use_ema': False, 'use_spike': False, 'rsi_required': False, 'edge_k': 1.9599511168673298, 'edge_cap': 0.16207802084237793}.
[I 2025-08-29 22:56:26,243] Trial 710 finished with values: [-1000000000.0, 1000000000.0] and parameters: {'p_sma': 33, 'p_std': 11, 'p_atr': 16, 'p_adx': 11, 'rsi_period': 57, 'ema1': 29, 'ema2': 25, 'slip_atr_k': 0.238775866412285, 'slip_spread_k': 0.24189960180275977, 'spread_hl_frac': 0.010336108406628707, 'bb_std_mult': 1.5585959816342623, 'rsi_os': 35, 'rsi_ob': 60, 'vol_spike': 0.23461836570621478, 'adx_thresh': 6.957113492279069, 'atr_min_pct': 0.007187080963908963, 'atr_max_pct': 0.06963308331129861, 'tp_mult': 1.7831366465934784, 'tsl_mult': 0.5944162133151077, 'strategy': 'mean_reversion', 'time_stop': 142, 'use_sma': False, 'use_atr': False, 'use_adx': False, 'use_ema': False, 'use_spike': False, 'rsi_required': False, 'edge_k': 1.9627534163367422, 'edge_cap': 0.20766199587595646}.
[I 2025-08-29 22:56:26,408] Trial 709 finished with values: [-1000000000.0, 1000000000.0] and parameters: {'p_sma': 42, 'p_std': 31, 'p_atr': 17, 'p_adx': 13, 'rsi_period': 52, 'ema1': 29, 'ema2': 22, 'slip_atr_k': 0.09856249055532873, 'slip_spread_k': 0.06688729572877317, 'spread_hl_frac': 0.009050444540477485, 'bb_std_mult': 0.7642874071783643, 'rsi_os': 35, 'rsi_ob': 60, 'vol_spike': 0.18770713533899858, 'adx_thresh': 15.085295102036596, 'atr_min_pct': 0.005635843365951035, 'atr_max_pct': 0.06011442621486186, 'tp_mult': 2.1090106443270535, 'tsl_mult': 0.6435257690800016, 'strategy': 'mean_reversion', 'time_stop': 268, 'use_sma': False, 'use_atr': False, 'use_adx': False, 'use_ema': False, 'use_spike': False, 'rsi_required': False, 'edge_k': 1.9614935915074718, 'edge_cap': 0.2105737208818645}.
[I 2025-08-29 22:56:26,677] Trial 715 finished with values: [-1000000000.0, 1000000000.0] and parameters: {'p_sma': 29, 'p_std': 22, 'p_atr': 24, 'p_adx': 20, 'rsi_period': 12, 'ema1': 30, 'ema2': 20, 'slip_atr_k': 0.009180614504806743, 'slip_spread_k': 0.27832176841027145, 'spread_hl_frac': 0.04108349383806038, 'bb_std_mult': 1.6736733581865377, 'rsi_os': 53, 'rsi_ob': 61, 'vol_spike': 0.11167180204848665, 'adx_thresh': 22.250076033451794, 'atr_min_pct': 0.025178353913434946, 'atr_max_pct': 0.07758420335048906, 'tp_mult': 1.175145987836346, 'tsl_mult': 0.6182712232250156, 'strategy': 'mean_reversion', 'time_stop': 282, 'use_sma': False, 'use_atr': False, 'use_adx': False, 'use_ema': False, 'use_spike': False, 'rsi_required': False, 'edge_k': 0.04355501362999081, 'edge_cap': 0.1698203386493012}.
[I 2025-08-29 22:56:53,449] Trial 713 finished with values: [-1000000000.0, 1000000000.0] and parameters: {'p_sma': 28, 'p_std': 15, 'p_atr': 16, 'p_adx': 27, 'rsi_period': 57, 'ema1': 11, 'ema2': 25, 'slip_atr_k': 0.01096333312632046, 'slip_spread_k': 0.062057247112728864, 'spread_hl_frac': 0.029964450856894177, 'bb_std_mult': 1.7157873316610492, 'rsi_os': 32, 'rsi_ob': 84, 'vol_spike': 0.25164923926912314, 'adx_thresh': 6.814506816399183, 'atr_min_pct': 0.005471789108772986, 'atr_max_pct': 0.07547180444522732, 'tp_mult': 1.8786138645033288, 'tsl_mult': 0.5926121872945982, 'strategy': 'mean_reversion', 'time_stop': 287, 'use_sma': False, 'use_atr': False, 'use_adx': False, 'use_ema': False, 'use_spike': False, 'rsi_required': False, 'edge_k': 1.999769140279653, 'edge_cap': 0.1996833678801035}.
[I 2025-08-29 22:56:53,721] Trial 714 finished with values: [-1000000000.0, 1000000000.0] and parameters: {'p_sma': 29, 'p_std': 49, 'p_atr': 24, 'p_adx': 13, 'rsi_period': 12, 'ema1': 11, 'ema2': 58, 'slip_atr_k': 0.01086294452065359, 'slip_spread_k': 0.28525324985397243, 'spread_hl_frac': 0.014049929661561267, 'bb_std_mult': 1.7223375823012463, 'rsi_os': 32, 'rsi_ob': 84, 'vol_spike': 0.25245936663440544, 'adx_thresh': 11.632349848453643, 'atr_min_pct': 0.027126765692159965, 'atr_max_pct': 0.07641836494250666, 'tp_mult': 1.8854371973841813, 'tsl_mult': 0.6229563517785663, 'strategy': 'mean_reversion', 'time_stop': 283, 'use_sma': False, 'use_atr': False, 'use_adx': False, 'use_ema': False, 'use_spike': False, 'rsi_required': False, 'edge_k': 1.887740675828738, 'edge_cap': 0.20391139085138718}.
[I 2025-08-29 22:56:53,956] Trial 712 finished with values: [-1000000000.0, 1000000000.0] and parameters: {'p_sma': 27, 'p_std': 15, 'p_atr': 20, 'p_adx': 13, 'rsi_period': 51, 'ema1': 29, 'ema2': 25, 'slip_atr_k': 0.00909548364997241, 'slip_spread_k': 0.23137751507908255, 'spread_hl_frac': 0.04129664047188568, 'bb_std_mult': 1.6831408605305274, 'rsi_os': 37, 'rsi_ob': 61, 'vol_spike': 0.2360232693633128, 'adx_thresh': 29.822874810211406, 'atr_min_pct': 0.007085899561555694, 'atr_max_pct': 0.05992678929554712, 'tp_mult': 1.175298855285443, 'tsl_mult': 0.5936161570047098, 'strategy': 'mean_reversion', 'time_stop': 272, 'use_sma': False, 'use_atr': False, 'use_adx': False, 'use_ema': False, 'use_spike': False, 'rsi_required': False, 'edge_k': 1.8880601982034697, 'edge_cap': 0.21080593255827812}.
[I 2025-08-29 22:56:54,476] Trial 716 finished with values: [-1000000000.0, 1000000000.0] and parameters: {'p_sma': 25, 'p_std': 17, 'p_atr': 20, 'p_adx': 13, 'rsi_period': 16, 'ema1': 30, 'ema2': 25, 'slip_atr_k': 0.017947794123540157, 'slip_spread_k': 0.3176987961021882, 'spread_hl_frac': 0.01766959129970017, 'bb_std_mult': 0.6175789067300601, 'rsi_os': 10, 'rsi_ob': 64, 'vol_spike': 0.2455445003056762, 'adx_thresh': 11.697136834459522, 'atr_min_pct': 0.022224149394518895, 'atr_max_pct': 0.07563766108478377, 'tp_mult': 1.8843262323686454, 'tsl_mult': 0.11828779956388724, 'strategy': 'mean_reversion', 'time_stop': 287, 'use_sma': False, 'use_atr': False, 'use_adx': False, 'use_ema': False, 'use_spike': False, 'rsi_required': False, 'edge_k': 1.8911970613746025, 'edge_cap': 0.17902690268513508}.
[I 2025-08-29 22:57:21,916] Trial 720 finished with values: [-0.0047549333631339286, 0.0050585981643571365] and parameters: {'p_sma': 22, 'p_std': 13, 'p_atr': 28, 'p_adx': 14, 'rsi_period': 9, 'ema1': 30, 'ema2': 42, 'slip_atr_k': 0.14427542350657035, 'slip_spread_k': 0.2648942810911554, 'spread_hl_frac': 0.010713340779949752, 'bb_std_mult': 2.6611578159696636, 'rsi_os': 34, 'rsi_ob': 66, 'vol_spike': 0.2417472547523858, 'adx_thresh': 18.618328682334504, 'atr_min_pct': 0.004448289156884333, 'atr_max_pct': 0.03374182266085079, 'tp_mult': 2.0233383538566323, 'tsl_mult': 0.6585933452758748, 'strategy': 'breakout', 'time_stop': 278, 'use_sma': False, 'use_atr': False, 'use_adx': False, 'use_ema': False, 'use_spike': False, 'rsi_required': False, 'edge_k': 0.6679210536153495, 'edge_cap': 0.1653863434496897}.
[I 2025-08-29 22:57:22,615] Trial 717 finished with values: [-1000000000.0, 1000000000.0] and parameters: {'p_sma': 25, 'p_std': 13, 'p_atr': 20, 'p_adx': 19, 'rsi_period': 9, 'ema1': 30, 'ema2': 44, 'slip_atr_k': 0.008818804462380734, 'slip_spread_k': 0.3236442573543227, 'spread_hl_frac': 0.01704408043782974, 'bb_std_mult': 0.6310203543265098, 'rsi_os': 33, 'rsi_ob': 64, 'vol_spike': 0.2469947601066801, 'adx_thresh': 29.86917145141214, 'atr_min_pct': 0.004436771436080491, 'atr_max_pct': 0.043601066966277253, 'tp_mult': 1.8432012200382493, 'tsl_mult': 0.9865490133376691, 'strategy': 'breakout', 'time_stop': 57, 'use_sma': False, 'use_atr': False, 'use_adx': False, 'use_ema': False, 'use_spike': False, 'rsi_required': False, 'edge_k': 0.6741384315548493, 'edge_cap': 0.17535272766263849}.
[I 2025-08-29 22:57:22,681] Trial 719 finished with values: [-1000000000.0, 1000000000.0] and parameters: {'p_sma': 22, 'p_std': 17, 'p_atr': 28, 'p_adx': 14, 'rsi_period': 9, 'ema1': 30, 'ema2': 18, 'slip_atr_k': 0.005551715507954279, 'slip_spread_k': 0.5579141301408056, 'spread_hl_frac': 0.017154697791317744, 'bb_std_mult': 2.508470999471565, 'rsi_os': 33, 'rsi_ob': 55, 'vol_spike': 0.24414775646612893, 'adx_thresh': 18.803734737830407, 'atr_min_pct': 0.004688670997415047, 'atr_max_pct': 0.04350641912046701, 'tp_mult': 1.4639354527333805, 'tsl_mult': 0.27586047715858386, 'strategy': 'breakout', 'time_stop': 57, 'use_sma': False, 'use_atr': False, 'use_adx': False, 'use_ema': False, 'use_spike': False, 'rsi_required': False, 'edge_k': 1.8444137030625054, 'edge_cap': 0.176134188080998}.
[I 2025-08-29 22:57:22,693] Trial 718 finished with values: [-1000000000.0, 1000000000.0] and parameters: {'p_sma': 25, 'p_std': 13, 'p_atr': 28, 'p_adx': 30, 'rsi_period': 9, 'ema1': 30, 'ema2': 23, 'slip_atr_k': 0.15066001002483398, 'slip_spread_k': 0.32506436662787647, 'spread_hl_frac': 7.345263475019154e-05, 'bb_std_mult': 2.4881057645714524, 'rsi_os': 37, 'rsi_ob': 64, 'vol_spike': 0.24382325226476378, 'adx_thresh': 18.691176463649406, 'atr_min_pct': 0.02621933865076185, 'atr_max_pct': 0.04098771752370309, 'tp_mult': 2.210036807305024, 'tsl_mult': 0.9894593042906221, 'strategy': 'breakout', 'time_stop': 278, 'use_sma': False, 'use_atr': False, 'use_adx': False, 'use_ema': False, 'use_spike': False, 'rsi_required': False, 'edge_k': 1.8459874147048536, 'edge_cap': 0.17630064546380955}.
[I 2025-08-29 22:57:50,506] Trial 723 finished with values: [-1000000000.0, 1000000000.0] and parameters: {'p_sma': 35, 'p_std': 10, 'p_atr': 7, 'p_adx': 15, 'rsi_period': 68, 'ema1': 29, 'ema2': 17, 'slip_atr_k': 0.004613321821029083, 'slip_spread_k': 0.29765103927688796, 'spread_hl_frac': 0.012742819925571339, 'bb_std_mult': 1.8684839407800857, 'rsi_os': 32, 'rsi_ob': 82, 'vol_spike': 0.25541005895406316, 'adx_thresh': 21.60853959900233, 'atr_min_pct': 0.028216169962942156, 'atr_max_pct': 0.06354617467259938, 'tp_mult': 2.474638343426118, 'tsl_mult': 0.6072562072703824, 'strategy': 'mean_reversion', 'time_stop': 292, 'use_sma': False, 'use_atr': False, 'use_adx': False, 'use_ema': False, 'use_spike': False, 'rsi_required': False, 'edge_k': 0.6188205504748402, 'edge_cap': 0.1482877767922037}.
[I 2025-08-29 22:57:51,225] Trial 724 finished with values: [-1000000000.0, 1000000000.0] and parameters: {'p_sma': 39, 'p_std': 10, 'p_atr': 14, 'p_adx': 15, 'rsi_period': 80, 'ema1': 29, 'ema2': 39, 'slip_atr_k': 0.059628529816295434, 'slip_spread_k': 0.4391975753473694, 'spread_hl_frac': 0.015808979772989236, 'bb_std_mult': 1.3704444247178922, 'rsi_os': 32, 'rsi_ob': 63, 'vol_spike': 0.0288515262799873, 'adx_thresh': 23.362594827255435, 'atr_min_pct': 0.017951484050014427, 'atr_max_pct': 0.04935667913125985, 'tp_mult': 1.6755019991773392, 'tsl_mult': 0.6182103046280565, 'strategy': 'mean_reversion', 'time_stop': 291, 'use_sma': False, 'use_atr': False, 'use_adx': False, 'use_ema': False, 'use_spike': False, 'rsi_required': False, 'edge_k': 1.912190451701243, 'edge_cap': 0.6399810351282189}.
[I 2025-08-29 22:57:51,724] Trial 722 finished with values: [-1000000000.0, 1000000000.0] and parameters: {'p_sma': 34, 'p_std': 10, 'p_atr': 7, 'p_adx': 12, 'rsi_period': 47, 'ema1': 29, 'ema2': 39, 'slip_atr_k': 0.1774480691746744, 'slip_spread_k': 0.2975119275822165, 'spread_hl_frac': 0.012900341030397172, 'bb_std_mult': 1.196404167852975, 'rsi_os': 44, 'rsi_ob': 63, 'vol_spike': 0.26329102691960404, 'adx_thresh': 23.18105101425062, 'atr_min_pct': 0.017911126263119297, 'atr_max_pct': 0.06588886084562866, 'tp_mult': 2.16423877973997, 'tsl_mult': 0.9171007044395874, 'strategy': 'mean_reversion', 'time_stop': 290, 'use_sma': False, 'use_atr': False, 'use_adx': False, 'use_ema': False, 'use_spike': False, 'rsi_required': False, 'edge_k': 1.9207650560193084, 'edge_cap': 0.19048759479413502}.
[I 2025-08-29 22:57:51,727] Trial 721 finished with values: [-1000000000.0, 1000000000.0] and parameters: {'p_sma': 34, 'p_std': 10, 'p_atr': 27, 'p_adx': 15, 'rsi_period': 74, 'ema1': 30, 'ema2': 23, 'slip_atr_k': 0.005676244099180351, 'slip_spread_k': 0.30265384622153957, 'spread_hl_frac': 0.012713180516182967, 'bb_std_mult': 1.499713998659477, 'rsi_os': 44, 'rsi_ob': 63, 'vol_spike': 0.2624149466220826, 'adx_thresh': 23.161323889325253, 'atr_min_pct': 0.010688382708590575, 'atr_max_pct': 0.09049091360492227, 'tp_mult': 2.1717686890489385, 'tsl_mult': 0.7163482845589642, 'strategy': 'breakout', 'time_stop': 10, 'use_sma': False, 'use_atr': False, 'use_adx': False, 'use_ema': False, 'use_spike': False, 'rsi_required': False, 'edge_k': 1.8505545934437173, 'edge_cap': 0.15035587854795965}.
[I 2025-08-29 22:58:18,343] Trial 725 finished with values: [-1000000000.0, 1000000000.0] and parameters: {'p_sma': 34, 'p_std': 9, 'p_atr': 19, 'p_adx': 12, 'rsi_period': 74, 'ema1': 29, 'ema2': 39, 'slip_atr_k': 0.00450199883039988, 'slip_spread_k': 0.2663988204727778, 'spread_hl_frac': 0.011127106737371946, 'bb_std_mult': 1.3717171249774742, 'rsi_os': 14, 'rsi_ob': 62, 'vol_spike': 0.028427420049238095, 'adx_thresh': 23.002612919815437, 'atr_min_pct': 0.008643988122968248, 'atr_max_pct': 0.0662369374603339, 'tp_mult': 2.159521319167532, 'tsl_mult': 0.946383043695808, 'strategy': 'mean_reversion', 'time_stop': 5, 'use_sma': False, 'use_atr': False, 'use_adx': False, 'use_ema': False, 'use_spike': False, 'rsi_required': False, 'edge_k': 1.904613680318307, 'edge_cap': 0.7533186437121151}.
[I 2025-08-29 22:58:19,382] Trial 726 finished with values: [-1000000000.0, 1000000000.0] and parameters: {'p_sma': 31, 'p_std': 12, 'p_atr': 29, 'p_adx': 11, 'rsi_period': 74, 'ema1': 28, 'ema2': 36, 'slip_atr_k': 0.015186936880203658, 'slip_spread_k': 0.25914959315622915, 'spread_hl_frac': 0.010524050957063156, 'bb_std_mult': 1.5024786950952564, 'rsi_os': 44, 'rsi_ob': 52, 'vol_spike': 0.262447490571467, 'adx_thresh': 20.971717660616566, 'atr_min_pct': 0.008523208277892791, 'atr_max_pct': 0.018599617059880356, 'tp_mult': 1.9926641139014023, 'tsl_mult': 0.9385389649726394, 'strategy': 'mean_reversion', 'time_stop': 281, 'use_sma': False, 'use_atr': False, 'use_adx': False, 'use_ema': False, 'use_spike': False, 'rsi_required': False, 'edge_k': 1.9146079425105913, 'edge_cap': 0.15722006509616807}.
[I 2025-08-29 22:58:19,382] Trial 728 finished with values: [-1000000000.0, 1000000000.0] and parameters: {'p_sma': 15, 'p_std': 57, 'p_atr': 8, 'p_adx': 11, 'rsi_period': 14, 'ema1': 14, 'ema2': 21, 'slip_atr_k': 0.015153196879668105, 'slip_spread_k': 0.043696351169863035, 'spread_hl_frac': 0.045956450353514776, 'bb_std_mult': 1.0590353986797147, 'rsi_os': 40, 'rsi_ob': 62, 'vol_spike': 0.1653314276186045, 'adx_thresh': 27.325663631364453, 'atr_min_pct': 0.008395949984100757, 'atr_max_pct': 0.08021130995879967, 'tp_mult': 1.9193346176123223, 'tsl_mult': 0.6493076267750703, 'strategy': 'mean_reversion', 'time_stop': 280, 'use_sma': False, 'use_atr': False, 'use_adx': False, 'use_ema': False, 'use_spike': False, 'rsi_required': False, 'edge_k': 0.17933853864293903, 'edge_cap': 0.698038010396536}.
[I 2025-08-29 22:58:19,395] Trial 727 finished with values: [-0.015381780437965231, 0.015394328606358091] and parameters: {'p_sma': 31, 'p_std': 12, 'p_atr': 8, 'p_adx': 11, 'rsi_period': 13, 'ema1': 14, 'ema2': 20, 'slip_atr_k': 0.1592015712364789, 'slip_spread_k': 0.2633860163072515, 'spread_hl_frac': 0.04559637251714394, 'bb_std_mult': 1.5054833843886406, 'rsi_os': 36, 'rsi_ob': 52, 'vol_spike': 0.25444372823144656, 'adx_thresh': 20.49678867185326, 'atr_min_pct': 0.0034632131985673944, 'atr_max_pct': 0.05536624709321833, 'tp_mult': 2.0919971298679316, 'tsl_mult': 0.6382677360210054, 'strategy': 'mean_reversion', 'time_stop': 280, 'use_sma': False, 'use_atr': False, 'use_adx': False, 'use_ema': False, 'use_spike': False, 'rsi_required': False, 'edge_k': 1.9676530334382751, 'edge_cap': 0.8706562304883628}.
