[I 2025-08-29 23:15:34,283] Trial 891 finished with values: [-1000000000.0, 1000000000.0] and parameters: {'p_sma': 35, 'p_std': 10, 'p_atr': 18, 'p_adx': 7, 'rsi_period': 66, 'ema1': 29, 'ema2': 38, 'slip_atr_k': 0.007416188197739139, 'slip_spread_k': 0.554515097191748, 'spread_hl_frac': 0.016564278464808686, 'bb_std_mult': 3.4730328735399816, 'rsi_os': 33, 'rsi_ob': 62, 'vol_spike': 0.04560701673365282, 'adx_thresh': 5.026811964786232, 'atr_min_pct': 0.019247166581486886, 'atr_max_pct': 0.10250221981205096, 'tp_mult': 2.319904659593956, 'tsl_mult': 0.6721876962628432, 'strategy': 'breakout', 'time_stop': 279, 'use_sma': False, 'use_atr': False, 'use_adx': False, 'use_ema': False, 'use_spike': False, 'rsi_required': False, 'edge_k': 0.21294963394451571, 'edge_cap': 0.21297062482653345}.
[I 2025-08-29 23:15:35,489] Trial 892 finished with values: [-0.008422508489256852, 0.00840288718411381] and parameters: {'p_sma': 37, 'p_std': 51, 'p_atr': 26, 'p_adx': 27, 'rsi_period': 11, 'ema1': 26, 'ema2': 18, 'slip_atr_k': 0.17179124327882805, 'slip_spread_k': 0.250807722369267, 'spread_hl_frac': 0.016171629893265274, 'bb_std_mult': 1.1734380931619657, 'rsi_os': 34, 'rsi_ob': 62, 'vol_spike': 0.02564032639982275, 'adx_thresh': 31.84903386732588, 'atr_min_pct': 0.0018852447945832927, 'atr_max_pct': 0.07516127990898497, 'tp_mult': 1.8506179748830094, 'tsl_mult': 0.27314769114133863, 'strategy': 'mean_reversion', 'time_stop': 261, 'use_sma': False, 'use_atr': False, 'use_adx': False, 'use_ema': False, 'use_spike': False, 'rsi_required': False, 'edge_k': 1.9082357872189604, 'edge_cap': 0.9171076908377751}.
[I 2025-08-29 23:15:35,601] Trial 893 finished with values: [-1000000000.0, 1000000000.0] and parameters: {'p_sma': 6, 'p_std': 10, 'p_atr': 11, 'p_adx': 27, 'rsi_period': 10, 'ema1': 29, 'ema2': 18, 'slip_atr_k': 0.007017597739336635, 'slip_spread_k': 0.3224901109706601, 'spread_hl_frac': 0.011274022802919314, 'bb_std_mult': 3.461257786757383, 'rsi_os': 34, 'rsi_ob': 62, 'vol_spike': 0.198867051013417, 'adx_thresh': 24.537321157883532, 'atr_min_pct': 0.019431577675468777, 'atr_max_pct': 0.06635586162853538, 'tp_mult': 2.0096221843842885, 'tsl_mult': 0.6635047006676409, 'strategy': 'breakout', 'time_stop': 211, 'use_sma': False, 'use_atr': False, 'use_adx': False, 'use_ema': False, 'use_spike': False, 'rsi_required': False, 'edge_k': 0.8218766028352679, 'edge_cap': 0.16612175402674362}.
[I 2025-08-29 23:15:35,812] Trial 895 finished with values: [-1000000000.0, 1000000000.0] and parameters: {'p_sma': 31, 'p_std': 9, 'p_atr': 7, 'p_adx': 13, 'rsi_period': 14, 'ema1': 30, 'ema2': 34, 'slip_atr_k': 0.01741003511427802, 'slip_spread_k': 0.32734932969887687, 'spread_hl_frac': 0.011071772192150572, 'bb_std_mult': 1.1902027379549291, 'rsi_os': 52, 'rsi_ob': 91, 'vol_spike': 0.025923250560856675, 'adx_thresh': 31.768410745540038, 'atr_min_pct': 0.00212849074216432, 'atr_max_pct': 0.06856900424650944, 'tp_mult': 2.0068248028188753, 'tsl_mult': 0.6130307445645481, 'strategy': 'mean_reversion', 'time_stop': 202, 'use_sma': False, 'use_atr': False, 'use_adx': False, 'use_ema': False, 'use_spike': False, 'rsi_required': False, 'edge_k': 1.9012164981508128, 'edge_cap': 0.9137138322689362}.
[I 2025-08-29 23:16:02,062] Trial 894 finished with values: [-1000000000.0, 1000000000.0] and parameters: {'p_sma': 11, 'p_std': 10, 'p_atr': 12, 'p_adx': 13, 'rsi_period': 10, 'ema1': 29, 'ema2': 34, 'slip_atr_k': 0.016822605892989548, 'slip_spread_k': 0.056819928727817715, 'spread_hl_frac': 0.011019807120562703, 'bb_std_mult': 1.3101358871098376, 'rsi_os': 34, 'rsi_ob': 72, 'vol_spike': 0.2605499700952191, 'adx_thresh': 32.01004044772353, 'atr_min_pct': 0.01936176240197549, 'atr_max_pct': 0.11471225417450842, 'tp_mult': 2.0223950452577464, 'tsl_mult': 0.6730247593282084, 'strategy': 'mean_reversion', 'time_stop': 290, 'use_sma': False, 'use_atr': False, 'use_adx': False, 'use_ema': False, 'use_spike': False, 'rsi_required': False, 'edge_k': 1.9087548397263114, 'edge_cap': 0.3560095009086062}.
[I 2025-08-29 23:16:02,312] Trial 897 finished with values: [-1000000000.0, 1000000000.0] and parameters: {'p_sma': 31, 'p_std': 17, 'p_atr': 12, 'p_adx': 14, 'rsi_period': 38, 'ema1': 30, 'ema2': 22, 'slip_atr_k': 0.01680932228295806, 'slip_spread_k': 0.05645734221906312, 'spread_hl_frac': 0.02348574226594338, 'bb_std_mult': 1.308418281277015, 'rsi_os': 31, 'rsi_ob': 73, 'vol_spike': 0.2606435997180767, 'adx_thresh': 22.453581514534847, 'atr_min_pct': 0.029276019635985424, 'atr_max_pct': 0.06890067725167977, 'tp_mult': 1.9929984111284589, 'tsl_mult': 0.6412360169297489, 'strategy': 'mean_reversion', 'time_stop': 82, 'use_sma': False, 'use_atr': False, 'use_adx': False, 'use_ema': False, 'use_spike': False, 'rsi_required': False, 'edge_k': 1.4035699596102973, 'edge_cap': 0.8021678730838477}.
[I 2025-08-29 23:16:02,811] Trial 896 finished with values: [-0.03101440879677886, 0.03100513240998666] and parameters: {'p_sma': 6, 'p_std': 12, 'p_atr': 12, 'p_adx': 14, 'rsi_period': 7, 'ema1': 30, 'ema2': 26, 'slip_atr_k': 0.00018730321540108243, 'slip_spread_k': 0.6865425288283278, 'spread_hl_frac': 0.011635906832885736, 'bb_std_mult': 1.3056331954861953, 'rsi_os': 31, 'rsi_ob': 59, 'vol_spike': 0.12003734617627389, 'adx_thresh': 21.529434168214507, 'atr_min_pct': 0.000631931120934355, 'atr_max_pct': 0.06566524063494253, 'tp_mult': 1.9836124920589953, 'tsl_mult': 0.6156736070141787, 'strategy': 'mean_reversion', 'time_stop': 268, 'use_sma': False, 'use_atr': False, 'use_adx': False, 'use_ema': False, 'use_spike': False, 'rsi_required': False, 'edge_k': 1.9642606474109676, 'edge_cap': 0.1464937430564492}.
[I 2025-08-29 23:16:03,258] Trial 898 finished with values: [-1000000000.0, 1000000000.0] and parameters: {'p_sma': 24, 'p_std': 13, 'p_atr': 12, 'p_adx': 14, 'rsi_period': 7, 'ema1': 30, 'ema2': 26, 'slip_atr_k': 0.003801540039245826, 'slip_spread_k': 0.4309715179140392, 'spread_hl_frac': 0.02348264067462158, 'bb_std_mult': 3.59819094212266, 'rsi_os': 31, 'rsi_ob': 59, 'vol_spike': 0.2588581232283746, 'adx_thresh': 19.07756512221494, 'atr_min_pct': 0.007107016592231289, 'atr_max_pct': 0.05992022732600813, 'tp_mult': 1.9205334812365389, 'tsl_mult': 0.3107875823558127, 'strategy': 'mean_reversion', 'time_stop': 172, 'use_sma': False, 'use_atr': False, 'use_adx': False, 'use_ema': False, 'use_spike': False, 'rsi_required': False, 'edge_k': 1.479082412868641, 'edge_cap': 0.3496420371084357}.
[I 2025-08-29 23:16:30,421] Trial 899 finished with values: [-1000000000.0, 1000000000.0] and parameters: {'p_sma': 30, 'p_std': 13, 'p_atr': 25, 'p_adx': 14, 'rsi_period': 38, 'ema1': 30, 'ema2': 22, 'slip_atr_k': 0.15048386520418938, 'slip_spread_k': 0.8951496398237037, 'spread_hl_frac': 0.012544258566795662, 'bb_std_mult': 1.320704825652105, 'rsi_os': 32, 'rsi_ob': 65, 'vol_spike': 0.2559231068362005, 'adx_thresh': 22.100047685787697, 'atr_min_pct': 0.029198957731279916, 'atr_max_pct': 0.06365228234995993, 'tp_mult': 1.91803623918533, 'tsl_mult': 0.19154644193448317, 'strategy': 'mean_reversion', 'time_stop': 270, 'use_sma': False, 'use_atr': False, 'use_adx': False, 'use_ema': False, 'use_spike': False, 'rsi_required': False, 'edge_k': 1.6266187151094529, 'edge_cap': 0.579844458162321}.
[I 2025-08-29 23:16:30,672] Trial 900 finished with values: [-1000000000.0, 1000000000.0] and parameters: {'p_sma': 24, 'p_std': 13, 'p_atr': 13, 'p_adx': 13, 'rsi_period': 73, 'ema1': 30, 'ema2': 48, 'slip_atr_k': 0.05556388318157911, 'slip_spread_k': 0.684225212652524, 'spread_hl_frac': 0.012859667375681737, 'bb_std_mult': 1.3360090427950801, 'rsi_os': 48, 'rsi_ob': 65, 'vol_spike': 0.25044211912190856, 'adx_thresh': 19.18193805215672, 'atr_min_pct': 0.025965036212299696, 'atr_max_pct': 0.05870851586168649, 'tp_mult': 1.9152292211942274, 'tsl_mult': 0.6135329654778248, 'strategy': 'mean_reversion', 'time_stop': 295, 'use_sma': False, 'use_atr': False, 'use_adx': False, 'use_ema': False, 'use_spike': False, 'rsi_required': False, 'edge_k': 1.5993959464953051, 'edge_cap': 0.9492392332945017}.
[I 2025-08-29 23:16:30,899] Trial 901 finished with values: [-1000000000.0, 1000000000.0] and parameters: {'p_sma': 57, 'p_std': 13, 'p_atr': 13, 'p_adx': 30, 'rsi_period': 12, 'ema1': 28, 'ema2': 19, 'slip_atr_k': 0.1209616714819635, 'slip_spread_k': 0.5914917261953976, 'spread_hl_frac': 0.012714349170166507, 'bb_std_mult': 1.2495602581150944, 'rsi_os': 32, 'rsi_ob': 64, 'vol_spike': 0.2517069034747793, 'adx_thresh': 19.295634846769985, 'atr_min_pct': 0.009541883439913867, 'atr_max_pct': 0.06317543287008529, 'tp_mult': 1.9106546240680087, 'tsl_mult': 0.30347460058476505, 'strategy': 'mean_reversion', 'time_stop': 293, 'use_sma': False, 'use_atr': False, 'use_adx': False, 'use_ema': False, 'use_spike': False, 'rsi_required': False, 'edge_k': 1.9596396989988973, 'edge_cap': 0.582863520169808}.
[I 2025-08-29 23:16:30,908] Trial 902 finished with values: [-1000000000.0, 1000000000.0] and parameters: {'p_sma': 27, 'p_std': 11, 'p_atr': 13, 'p_adx': 28, 'rsi_period': 49, 'ema1': 16, 'ema2': 48, 'slip_atr_k': 0.05732184035058431, 'slip_spread_k': 0.28062397405257766, 'spread_hl_frac': 0.028647962734617283, 'bb_std_mult': 1.2419666664141098, 'rsi_os': 10, 'rsi_ob': 65, 'vol_spike': 0.2497944349728911, 'adx_thresh': 20.432157119562856, 'atr_min_pct': 0.0050146556133579484, 'atr_max_pct': 0.09186845921721146, 'tp_mult': 2.4562605914831086, 'tsl_mult': 0.5784958160775201, 'strategy': 'mean_reversion', 'time_stop': 226, 'use_sma': False, 'use_atr': False, 'use_adx': False, 'use_ema': False, 'use_spike': False, 'rsi_required': False, 'edge_k': 1.5927254838336733, 'edge_cap': 0.1928932880014227}.
[I 2025-08-29 23:16:58,802] Trial 903 finished with values: [-0.012473708733565347, 0.012462676290245401] and parameters: {'p_sma': 16, 'p_std': 11, 'p_atr': 13, 'p_adx': 13, 'rsi_period': 12, 'ema1': 16, 'ema2': 23, 'slip_atr_k': 0.12257918786329272, 'slip_spread_k': 0.604656019676058, 'spread_hl_frac': 0.009807020783000187, 'bb_std_mult': 1.245748560845473, 'rsi_os': 5, 'rsi_ob': 63, 'vol_spike': 0.24873763616355632, 'adx_thresh': 20.683700256437927, 'atr_min_pct': 3.974223237193826e-06, 'atr_max_pct': 0.07304930878351551, 'tp_mult': 1.8794518718772926, 'tsl_mult': 0.6341342093108375, 'strategy': 'mean_reversion', 'time_stop': 289, 'use_sma': False, 'use_atr': False, 'use_adx': False, 'use_ema': False, 'use_spike': False, 'rsi_required': False, 'edge_k': 1.9661237534041116, 'edge_cap': 0.19049342581973333}.
[I 2025-08-29 23:16:59,255] Trial 905 finished with values: [-1000000000.0, 1000000000.0] and parameters: {'p_sma': 33, 'p_std': 54, 'p_atr': 11, 'p_adx': 13, 'rsi_period': 15, 'ema1': 29, 'ema2': 44, 'slip_atr_k': 0.0002477196410444083, 'slip_spread_k': 0.9614464899311381, 'spread_hl_frac': 0.00978453372394238, 'bb_std_mult': 1.4138759434546082, 'rsi_os': 36, 'rsi_ob': 84, 'vol_spike': 0.17008135986109332, 'adx_thresh': 15.520680070264131, 'atr_min_pct': 0.016154685298615516, 'atr_max_pct': 0.07252429638592717, 'tp_mult': 1.3917261421234515, 'tsl_mult': 0.7495301957559688, 'strategy': 'breakout', 'time_stop': 284, 'use_sma': False, 'use_atr': False, 'use_adx': False, 'use_ema': False, 'use_spike': False, 'rsi_required': False, 'edge_k': 1.9998888186270418, 'edge_cap': 0.19295032013885505}.
[I 2025-08-29 23:16:59,517] Trial 906 finished with values: [-1000000000.0, 1000000000.0] and parameters: {'p_sma': 17, 'p_std': 8, 'p_atr': 11, 'p_adx': 13, 'rsi_period': 35, 'ema1': 29, 'ema2': 40, 'slip_atr_k': 0.21859518234148115, 'slip_spread_k': 0.9632034575067412, 'spread_hl_frac': 0.009792515693843675, 'bb_std_mult': 1.418525957108234, 'rsi_os': 42, 'rsi_ob': 84, 'vol_spike': 0.14885043422044572, 'adx_thresh': 26.141771904279462, 'atr_min_pct': 0.01386030646094779, 'atr_max_pct': 0.07319735041091278, 'tp_mult': 1.8663700964643528, 'tsl_mult': 0.6423268079144228, 'strategy': 'breakout', 'time_stop': 283, 'use_sma': False, 'use_atr': False, 'use_adx': False, 'use_ema': False, 'use_spike': False, 'rsi_required': False, 'edge_k': 1.9243105405956955, 'edge_cap': 0.19408439640388317}.
[I 2025-08-29 23:16:59,527] Trial 904 finished with values: [-1000000000.0, 1000000000.0] and parameters: {'p_sma': 17, 'p_std': 8, 'p_atr': 11, 'p_adx': 13, 'rsi_period': 12, 'ema1': 16, 'ema2': 43, 'slip_atr_k': 0.009452955559187627, 'slip_spread_k': 0.2806857834188803, 'spread_hl_frac': 0.009814771184488487, 'bb_std_mult': 3.322708705918857, 'rsi_os': 35, 'rsi_ob': 63, 'vol_spike': 0.24187278640470083, 'adx_thresh': 20.434786947948766, 'atr_min_pct': 0.01651360592617008, 'atr_max_pct': 0.053021542322380134, 'tp_mult': 1.8698230666826836, 'tsl_mult': 0.42060444613701475, 'strategy': 'breakout', 'time_stop': 226, 'use_sma': False, 'use_atr': False, 'use_adx': False, 'use_ema': False, 'use_spike': False, 'rsi_required': False, 'edge_k': 1.7827148334273413, 'edge_cap': 0.193672505519022}.
[I 2025-08-29 23:16:59,780] Trial 910 finished with values: [-1000000000.0, 1000000000.0] and parameters: {'p_sma': 36, 'p_std': 30, 'p_atr': 12, 'p_adx': 12, 'rsi_period': 9, 'ema1': 13, 'ema2': 28, 'slip_atr_k': 0.00017932520057004347, 'slip_spread_k': 0.30774882368877504, 'spread_hl_frac': 0.046711092340319685, 'bb_std_mult': 1.4746200752033467, 'rsi_os': 33, 'rsi_ob': 45, 'vol_spike': 0.2681095883348591, 'adx_thresh': 21.401031883054333, 'atr_min_pct': 0.01091907634453901, 'atr_max_pct': 0.08449220385896619, 'tp_mult': 1.9501240218236728, 'tsl_mult': 0.5954347913802677, 'strategy': 'mean_reversion', 'time_stop': 56, 'use_sma': False, 'use_atr': False, 'use_adx': False, 'use_ema': False, 'use_spike': False, 'rsi_required': False, 'edge_k': 0.993762457842061, 'edge_cap': 0.1394614375120303}.
[I 2025-08-29 23:17:26,998] Trial 909 finished with values: [-1000000000.0, 1000000000.0] and parameters: {'p_sma': 12, 'p_std': 25, 'p_atr': 12, 'p_adx': 12, 'rsi_period': 83, 'ema1': 11, 'ema2': 28, 'slip_atr_k': 0.09545656595496788, 'slip_spread_k': 0.11772268569926309, 'spread_hl_frac': 0.013519559478077375, 'bb_std_mult': 3.3235452596502624, 'rsi_os': 35, 'rsi_ob': 61, 'vol_spike': 0.2401836710748626, 'adx_thresh': 23.432970520213775, 'atr_min_pct': 0.011177773375718783, 'atr_max_pct': 0.053131758038694674, 'tp_mult': 1.8316985916839517, 'tsl_mult': 0.5952735964218566, 'strategy': 'mean_reversion', 'time_stop': 276, 'use_sma': False, 'use_atr': False, 'use_adx': False, 'use_ema': False, 'use_spike': False, 'rsi_required': False, 'edge_k': 0.5645183928366657, 'edge_cap': 0.1388411057186703}.
[I 2025-08-29 23:17:27,344] Trial 907 finished with values: [-1000000000.0, 1000000000.0] and parameters: {'p_sma': 33, 'p_std': 8, 'p_atr': 11, 'p_adx': 13, 'rsi_period': 15, 'ema1': 29, 'ema2': 20, 'slip_atr_k': 0.09414188133865267, 'slip_spread_k': 0.11270131861211324, 'spread_hl_frac': 0.04028519708920734, 'bb_std_mult': 3.348982614601848, 'rsi_os': 32, 'rsi_ob': 61, 'vol_spike': 0.07153243292208139, 'adx_thresh': 16.085805265135704, 'atr_min_pct': 0.01214899779450305, 'atr_max_pct': 0.028293798618351067, 'tp_mult': 1.8388444798751344, 'tsl_mult': 0.09557387841796122, 'strategy': 'breakout', 'time_stop': 164, 'use_sma': False, 'use_atr': False, 'use_adx': False, 'use_ema': False, 'use_spike': False, 'rsi_required': False, 'edge_k': 1.7889225336866026, 'edge_cap': 0.234834951531127}.
[I 2025-08-29 23:17:27,459] Trial 908 finished with values: [-1000000000.0, 1000000000.0] and parameters: {'p_sma': 17, 'p_std': 25, 'p_atr': 12, 'p_adx': 12, 'rsi_period': 35, 'ema1': 11, 'ema2': 27, 'slip_atr_k': 0.21594489620151255, 'slip_spread_k': 0.3040219580560038, 'spread_hl_frac': 0.014052978410977166, 'bb_std_mult': 3.2730174471525277, 'rsi_os': 32, 'rsi_ob': 94, 'vol_spike': 0.24224627968809975, 'adx_thresh': 21.49821031302186, 'atr_min_pct': 0.002539103777024764, 'atr_max_pct': 0.028636517645802995, 'tp_mult': 1.8511555179251085, 'tsl_mult': 0.600081820557071, 'strategy': 'breakout', 'time_stop': 278, 'use_sma': False, 'use_atr': False, 'use_adx': False, 'use_ema': False, 'use_spike': False, 'rsi_required': False, 'edge_k': 1.9357294141311163, 'edge_cap': 0.139546557445978}.
[I 2025-08-29 23:17:27,831] Trial 911 finished with values: [-1000000000.0, 1000000000.0] and parameters: {'p_sma': 32, 'p_std': 23, 'p_atr': 12, 'p_adx': 12, 'rsi_period': 77, 'ema1': 21, 'ema2': 32, 'slip_atr_k': 0.09462105599404025, 'slip_spread_k': 0.6343943217568981, 'spread_hl_frac': 0.004367134467847308, 'bb_std_mult': 1.3768113922041274, 'rsi_os': 16, 'rsi_ob': 94, 'vol_spike': 0.013128065153354573, 'adx_thresh': 9.110569972585365, 'atr_min_pct': 0.012416076699780183, 'atr_max_pct': 0.03247820901153129, 'tp_mult': 1.4975853441617548, 'tsl_mult': 0.09669076809584642, 'strategy': 'mean_reversion', 'time_stop': 235, 'use_sma': False, 'use_atr': False, 'use_adx': False, 'use_ema': False, 'use_spike': False, 'rsi_required': False, 'edge_k': 1.0680092172697944, 'edge_cap': 0.15470099688501437}.
[I 2025-08-29 23:17:28,067] Trial 912 finished with values: [-1000000000.0, 1000000000.0] and parameters: {'p_sma': 29, 'p_std': 14, 'p_atr': 12, 'p_adx': 18, 'rsi_period': 14, 'ema1': 30, 'ema2': 52, 'slip_atr_k': 0.19890803571059837, 'slip_spread_k': 0.4867501203044562, 'spread_hl_frac': 0.017908144558371936, 'bb_std_mult': 1.3588292577382777, 'rsi_os': 18, 'rsi_ob': 49, 'vol_spike': 0.29067672263343025, 'adx_thresh': 22.735342568188916, 'atr_min_pct': 0.006406216099125608, 'atr_max_pct': 0.07721908407487772, 'tp_mult': 2.398236719000981, 'tsl_mult': 0.09741527527087035, 'strategy': 'mean_reversion', 'time_stop': 280, 'use_sma': False, 'use_atr': False, 'use_adx': False, 'use_ema': False, 'use_spike': False, 'rsi_required': False, 'edge_k': 1.9326637378197487, 'edge_cap': 0.7423568668393903}.
[I 2025-08-29 23:17:28,095] Trial 914 finished with values: [-1000000000.0, 1000000000.0] and parameters: {'p_sma': 60, 'p_std': 28, 'p_atr': 26, 'p_adx': 19, 'rsi_period': 13, 'ema1': 15, 'ema2': 23, 'slip_atr_k': 0.00820756433919726, 'slip_spread_k': 0.35182754214881384, 'spread_hl_frac': 0.010892107108036805, 'bb_std_mult': 1.3647898411189088, 'rsi_os': 34, 'rsi_ob': 49, 'vol_spike': 0.2640967536547568, 'adx_thresh': 13.849103584979975, 'atr_min_pct': 0.006234247449494225, 'atr_max_pct': 0.07735171366642236, 'tp_mult': 1.1978313408525394, 'tsl_mult': 0.6525556786603934, 'strategy': 'mean_reversion', 'time_stop': 120, 'use_sma': False, 'use_atr': False, 'use_adx': False, 'use_ema': False, 'use_spike': False, 'rsi_required': False, 'edge_k': 1.895733449214275, 'edge_cap': 0.7412775514943952}.
[I 2025-08-29 23:17:52,805] Trial 915 finished with values: [-1000000000.0, 1000000000.0] and parameters: {'p_sma': 23, 'p_std': 42, 'p_atr': 17, 'p_adx': 14, 'rsi_period': 13, 'ema1': 30, 'ema2': 46, 'slip_atr_k': 0.19437819705434728, 'slip_spread_k': 0.34254458051606174, 'spread_hl_frac': 0.011723469214809868, 'bb_std_mult': 1.5375476842051212, 'rsi_os': 30, 'rsi_ob': 61, 'vol_spike': 0.2567971843682514, 'adx_thresh': 21.07897171258728, 'atr_min_pct': 0.006129444238824187, 'atr_max_pct': 0.06869384008946886, 'tp_mult': 2.3942960507640287, 'tsl_mult': 0.13517454673219992, 'strategy': 'mean_reversion', 'time_stop': 288, 'use_sma': False, 'use_atr': False, 'use_adx': False, 'use_ema': False, 'use_spike': False, 'rsi_required': False, 'edge_k': 1.8342839863185663, 'edge_cap': 0.6942979745324692}.
[I 2025-08-29 23:17:53,416] Trial 913 finished with values: [-0.013651375488584194, 0.013630410994622897] and parameters: {'p_sma': 19, 'p_std': 12, 'p_atr': 12, 'p_adx': 14, 'rsi_period': 18, 'ema1': 30, 'ema2': 31, 'slip_atr_k': 0.20136252885717396, 'slip_spread_k': 0.4734236405289423, 'spread_hl_frac': 0.011831102710058126, 'bb_std_mult': 1.3725189254297212, 'rsi_os': 30, 'rsi_ob': 54, 'vol_spike': 0.2918624466228027, 'adx_thresh': 9.158376963591529, 'atr_min_pct': 0.0028278777083894295, 'atr_max_pct': 0.06720071645726478, 'tp_mult': 1.0174925084859012, 'tsl_mult': 0.6522280522100032, 'strategy': 'mean_reversion', 'time_stop': 233, 'use_sma': False, 'use_atr': False, 'use_adx': False, 'use_ema': False, 'use_spike': False, 'rsi_required': False, 'edge_k': 1.9250648742276544, 'edge_cap': 0.23040528788555747}.
[I 2025-08-29 23:17:55,035] Trial 916 finished with values: [-1000000000.0, 1000000000.0] and parameters: {'p_sma': 9, 'p_std': 53, 'p_atr': 26, 'p_adx': 14, 'rsi_period': 43, 'ema1': 30, 'ema2': 23, 'slip_atr_k': 0.00474121915108414, 'slip_spread_k': 0.3356156930612194, 'spread_hl_frac': 0.010884111297525515, 'bb_std_mult': 1.5184783703979683, 'rsi_os': 30, 'rsi_ob': 89, 'vol_spike': 0.2654874695669527, 'adx_thresh': 19.877873838747888, 'atr_min_pct': 0.004232589163497628, 'atr_max_pct': 0.06839085118714275, 'tp_mult': 1.9708281499863962, 'tsl_mult': 0.8461194025704949, 'strategy': 'mean_reversion', 'time_stop': 12, 'use_sma': False, 'use_atr': False, 'use_adx': False, 'use_ema': False, 'use_spike': False, 'rsi_required': False, 'edge_k': 1.8826921771595324, 'edge_cap': 0.16666939774208242}.
[I 2025-08-29 23:17:55,147] Trial 917 finished with values: [-0.0016304327988662104, 0.0016919203946185414] and parameters: {'p_sma': 55, 'p_std': 21, 'p_atr': 20, 'p_adx': 14, 'rsi_period': 9, 'ema1': 10, 'ema2': 17, 'slip_atr_k': 0.004475834372854665, 'slip_spread_k': 0.23213395680906784, 'spread_hl_frac': 0.012093577570737937, 'bb_std_mult': 1.5283551783476552, 'rsi_os': 36, 'rsi_ob': 61, 'vol_spike': 0.2570595357744825, 'adx_thresh': 27.6701259724493, 'atr_min_pct': 0.004063713093899806, 'atr_max_pct': 0.06971982128111881, 'tp_mult': 1.9925522789431531, 'tsl_mult': 0.383337930474621, 'strategy': 'mean_reversion', 'time_stop': 288, 'use_sma': False, 'use_atr': False, 'use_adx': False, 'use_ema': False, 'use_spike': False, 'rsi_required': False, 'edge_k': 1.8402885467789643, 'edge_cap': 0.6925525511940482}.
