[I 2025-08-29 22:24:21,129] Trial 407 finished with values: [-1000000000.0, 1000000000.0] and parameters: {'p_sma': 50, 'p_std': 37, 'p_atr': 11, 'p_adx': 24, 'rsi_period': 32, 'ema1': 8, 'ema2': 14, 'slip_atr_k': 0.004163645876442653, 'slip_spread_k': 0.8120413589002009, 'spread_hl_frac': 0.01333776579747812, 'bb_std_mult': 2.9817529398415594, 'rsi_os': 30, 'rsi_ob': 74, 'vol_spike': 0.2804681057212531, 'adx_thresh': 23.398591072651456, 'atr_min_pct': 0.006046603584585164, 'atr_max_pct': 0.12165337308140896, 'tp_mult': 1.7730914245790201, 'tsl_mult': 0.5816754295063999, 'strategy': 'mean_reversion', 'time_stop': 188, 'use_sma': False, 'use_atr': False, 'use_adx': False, 'use_ema': False, 'use_spike': False, 'rsi_required': False, 'edge_k': 0.4404443577907973, 'edge_cap': 0.5616097276526092}.
[I 2025-08-29 22:24:21,456] Trial 404 finished with values: [-0.026123787030618795, 0.026118239354177987] and parameters: {'p_sma': 38, 'p_std': 36, 'p_atr': 30, 'p_adx': 17, 'rsi_period': 84, 'ema1': 7, 'ema2': 13, 'slip_atr_k': 0.037660789531327205, 'slip_spread_k': 0.4212856358557441, 'spread_hl_frac': 0.03375032357695599, 'bb_std_mult': 0.8013441315612803, 'rsi_os': 44, 'rsi_ob': 89, 'vol_spike': 0.22084124515639555, 'adx_thresh': 8.983029654797333, 'atr_min_pct': 0.00010961827748582394, 'atr_max_pct': 0.14421994218257453, 'tp_mult': 2.0329198660505075, 'tsl_mult': 0.45773855631809574, 'strategy': 'mean_reversion', 'time_stop': 200, 'use_sma': False, 'use_atr': False, 'use_adx': False, 'use_ema': False, 'use_spike': False, 'rsi_required': False, 'edge_k': 0.4245997029636562, 'edge_cap': 0.6312284347222586}.
[I 2025-08-29 22:24:21,584] Trial 405 finished with values: [-1000000000.0, 1000000000.0] and parameters: {'p_sma': 49, 'p_std': 36, 'p_atr': 30, 'p_adx': 9, 'rsi_period': 55, 'ema1': 12, 'ema2': 13, 'slip_atr_k': 0.039194208193541635, 'slip_spread_k': 0.5144347563020089, 'spread_hl_frac': 0.033052407390442864, 'bb_std_mult': 0.8058718799092559, 'rsi_os': 22, 'rsi_ob': 71, 'vol_spike': 0.2214493312292466, 'adx_thresh': 34.99330741508, 'atr_min_pct': 0.002170705955741283, 'atr_max_pct': 0.1272199141494155, 'tp_mult': 2.0314732849903163, 'tsl_mult': 0.21257440577993647, 'strategy': 'mean_reversion', 'time_stop': 202, 'use_sma': False, 'use_atr': False, 'use_adx': False, 'use_ema': False, 'use_spike': False, 'rsi_required': False, 'edge_k': 1.9926451777598124, 'edge_cap': 0.46800168978458595}.
[I 2025-08-29 22:24:48,246] Trial 409 finished with values: [-1000000000.0, 1000000000.0] and parameters: {'p_sma': 51, 'p_std': 39, 'p_atr': 9, 'p_adx': 24, 'rsi_period': 34, 'ema1': 8, 'ema2': 13, 'slip_atr_k': 0.0018879947115922617, 'slip_spread_k': 0.8290983338294164, 'spread_hl_frac': 0.011273054379403655, 'bb_std_mult': 2.9126390957324175, 'rsi_os': 31, 'rsi_ob': 75, 'vol_spike': 0.27074192403288433, 'adx_thresh': 24.213889708217526, 'atr_min_pct': 0.007712168029371872, 'atr_max_pct': 0.11761059424433225, 'tp_mult': 1.8008622335857583, 'tsl_mult': 0.5967394845111261, 'strategy': 'mean_reversion', 'time_stop': 198, 'use_sma': False, 'use_atr': False, 'use_adx': False, 'use_ema': False, 'use_spike': False, 'rsi_required': False, 'edge_k': 0.48516307086592114, 'edge_cap': 0.5399812835062173}.
[I 2025-08-29 22:24:48,492] Trial 408 finished with values: [-1000000000.0, 1000000000.0] and parameters: {'p_sma': 50, 'p_std': 38, 'p_atr': 12, 'p_adx': 24, 'rsi_period': 32, 'ema1': 9, 'ema2': 15, 'slip_atr_k': 0.0005172428753545538, 'slip_spread_k': 0.8294739883805076, 'spread_hl_frac': 0.01179358989952875, 'bb_std_mult': 2.9243307491077677, 'rsi_os': 31, 'rsi_ob': 75, 'vol_spike': 0.2704329546165112, 'adx_thresh': 24.057798705004647, 'atr_min_pct': 0.00766751563312734, 'atr_max_pct': 0.12156823746056399, 'tp_mult': 1.7509437845989186, 'tsl_mult': 0.5923913626542681, 'strategy': 'mean_reversion', 'time_stop': 200, 'use_sma': False, 'use_atr': False, 'use_adx': False, 'use_ema': False, 'use_spike': False, 'rsi_required': False, 'edge_k': 0.49677818342707636, 'edge_cap': 0.5452334985550358}.
[I 2025-08-29 22:24:48,680] Trial 411 finished with values: [-1000000000.0, 1000000000.0] and parameters: {'p_sma': 51, 'p_std': 38, 'p_atr': 9, 'p_adx': 24, 'rsi_period': 34, 'ema1': 9, 'ema2': 15, 'slip_atr_k': 0.010312890906081467, 'slip_spread_k': 0.7953966728906294, 'spread_hl_frac': 0.011435570510509623, 'bb_std_mult': 2.9064595391954624, 'rsi_os': 29, 'rsi_ob': 74, 'vol_spike': 0.2720666265821584, 'adx_thresh': 24.346521954714806, 'atr_min_pct': 0.0075664848656175135, 'atr_max_pct': 0.11696911004091048, 'tp_mult': 1.729300572858988, 'tsl_mult': 0.5604034659523, 'strategy': 'mean_reversion', 'time_stop': 211, 'use_sma': False, 'use_atr': False, 'use_adx': False, 'use_ema': False, 'use_spike': False, 'rsi_required': False, 'edge_k': 0.4820134933261247, 'edge_cap': 0.5363895350252883}.
[I 2025-08-29 22:24:48,830] Trial 410 finished with values: [-1000000000.0, 1000000000.0] and parameters: {'p_sma': 51, 'p_std': 39, 'p_atr': 9, 'p_adx': 25, 'rsi_period': 33, 'ema1': 9, 'ema2': 15, 'slip_atr_k': 0.000660877867892329, 'slip_spread_k': 0.829473761988767, 'spread_hl_frac': 0.011964555028992858, 'bb_std_mult': 2.92498014523496, 'rsi_os': 31, 'rsi_ob': 75, 'vol_spike': 0.27374724965660163, 'adx_thresh': 24.27315397414901, 'atr_min_pct': 0.008740501074014076, 'atr_max_pct': 0.12176502906694028, 'tp_mult': 1.8000149641614085, 'tsl_mult': 0.5701006287089286, 'strategy': 'mean_reversion', 'time_stop': 205, 'use_sma': False, 'use_atr': False, 'use_adx': False, 'use_ema': False, 'use_spike': False, 'rsi_required': False, 'edge_k': 1.999102510073316, 'edge_cap': 0.5464607855146646}.
[I 2025-08-29 22:25:15,900] Trial 415 finished with values: [-1000000000.0, 1000000000.0] and parameters: {'p_sma': 49, 'p_std': 10, 'p_atr': 8, 'p_adx': 24, 'rsi_period': 31, 'ema1': 9, 'ema2': 13, 'slip_atr_k': 0.008598797437289706, 'slip_spread_k': 0.7998414557806774, 'spread_hl_frac': 0.014568829264772246, 'bb_std_mult': 3.012284139115033, 'rsi_os': 29, 'rsi_ob': 74, 'vol_spike': 0.26271414442071434, 'adx_thresh': 22.929734157361917, 'atr_min_pct': 0.010909946565150434, 'atr_max_pct': 0.12234861586493967, 'tp_mult': 1.84871169351582, 'tsl_mult': 0.5631879373125958, 'strategy': 'mean_reversion', 'time_stop': 173, 'use_sma': False, 'use_atr': False, 'use_adx': False, 'use_ema': False, 'use_spike': False, 'rsi_required': False, 'edge_k': 0.45286333330643797, 'edge_cap': 0.5713642213285004}.
[I 2025-08-29 22:25:16,394] Trial 412 finished with values: [-1000000000.0, 1000000000.0] and parameters: {'p_sma': 50, 'p_std': 38, 'p_atr': 12, 'p_adx': 24, 'rsi_period': 32, 'ema1': 9, 'ema2': 15, 'slip_atr_k': 0.009532592907370812, 'slip_spread_k': 0.7956030248080063, 'spread_hl_frac': 0.012091019719741325, 'bb_std_mult': 2.9141803689579557, 'rsi_os': 29, 'rsi_ob': 74, 'vol_spike': 0.27470267008912996, 'adx_thresh': 23.06305569519548, 'atr_min_pct': 0.0116892173589758, 'atr_max_pct': 0.12298644190397015, 'tp_mult': 1.7285911210028537, 'tsl_mult': 0.5562709069181395, 'strategy': 'mean_reversion', 'time_stop': 170, 'use_sma': False, 'use_atr': False, 'use_adx': False, 'use_ema': False, 'use_spike': False, 'rsi_required': False, 'edge_k': 0.48754934647862985, 'edge_cap': 0.5350027034758753}.
[I 2025-08-29 22:25:16,547] Trial 414 finished with values: [-1000000000.0, 1000000000.0] and parameters: {'p_sma': 50, 'p_std': 47, 'p_atr': 8, 'p_adx': 23, 'rsi_period': 31, 'ema1': 9, 'ema2': 14, 'slip_atr_k': 0.007671715379196722, 'slip_spread_k': 0.7770418303482458, 'spread_hl_frac': 0.015091742965825267, 'bb_std_mult': 3.009824711330568, 'rsi_os': 29, 'rsi_ob': 75, 'vol_spike': 0.28631238721221447, 'adx_thresh': 21.548738495560837, 'atr_min_pct': 0.00925480896263027, 'atr_max_pct': 0.1217820647573943, 'tp_mult': 1.821381149404163, 'tsl_mult': 0.5712525387886588, 'strategy': 'mean_reversion', 'time_stop': 167, 'use_sma': False, 'use_atr': False, 'use_adx': False, 'use_ema': False, 'use_spike': False, 'rsi_required': False, 'edge_k': 0.45791652717786885, 'edge_cap': 0.5335161370042363}.
[I 2025-08-29 22:25:16,654] Trial 413 finished with values: [-1000000000.0, 1000000000.0] and parameters: {'p_sma': 51, 'p_std': 38, 'p_atr': 11, 'p_adx': 24, 'rsi_period': 31, 'ema1': 9, 'ema2': 15, 'slip_atr_k': 0.00885025348590264, 'slip_spread_k': 0.7732598653838368, 'spread_hl_frac': 0.012858064108697897, 'bb_std_mult': 2.8848184248518463, 'rsi_os': 29, 'rsi_ob': 74, 'vol_spike': 0.28534815419644105, 'adx_thresh': 23.077167487641397, 'atr_min_pct': 0.009104636685819486, 'atr_max_pct': 0.1227056840075893, 'tp_mult': 1.7224963674089835, 'tsl_mult': 0.5660070458870013, 'strategy': 'mean_reversion', 'time_stop': 168, 'use_sma': False, 'use_atr': False, 'use_adx': False, 'use_ema': False, 'use_spike': False, 'rsi_required': False, 'edge_k': 0.46662209867671456, 'edge_cap': 0.5369314691505066}.
[I 2025-08-29 22:25:43,211] Trial 419 finished with values: [-1000000000.0, 1000000000.0] and parameters: {'p_sma': 49, 'p_std': 45, 'p_atr': 10, 'p_adx': 23, 'rsi_period': 35, 'ema1': 8, 'ema2': 13, 'slip_atr_k': 0.015821098378196133, 'slip_spread_k': 0.7892712753262003, 'spread_hl_frac': 0.010308739967820559, 'bb_std_mult': 2.8162824933219532, 'rsi_os': 30, 'rsi_ob': 76, 'vol_spike': 0.2572697494734066, 'adx_thresh': 20.396177882275644, 'atr_min_pct': 0.018741286611307077, 'atr_max_pct': 0.11851752688192002, 'tp_mult': 1.8571394380454282, 'tsl_mult': 0.5972630581313491, 'strategy': 'mean_reversion', 'time_stop': 146, 'use_sma': False, 'use_atr': False, 'use_adx': False, 'use_ema': False, 'use_spike': False, 'rsi_required': False, 'edge_k': 0.42181337636434824, 'edge_cap': 0.5653932835729312}.
[I 2025-08-29 22:25:43,645] Trial 417 finished with values: [-1000000000.0, 1000000000.0] and parameters: {'p_sma': 49, 'p_std': 7, 'p_atr': 10, 'p_adx': 23, 'rsi_period': 31, 'ema1': 8, 'ema2': 13, 'slip_atr_k': 0.005776542230151213, 'slip_spread_k': 0.7809343870754413, 'spread_hl_frac': 0.010056036574295539, 'bb_std_mult': 3.0094688364304174, 'rsi_os': 30, 'rsi_ob': 75, 'vol_spike': 0.28605054683662257, 'adx_thresh': 21.284490136310552, 'atr_min_pct': 0.00943093533128803, 'atr_max_pct': 0.11762314655478323, 'tp_mult': 1.8296587362186962, 'tsl_mult': 0.6152277308793505, 'strategy': 'mean_reversion', 'time_stop': 193, 'use_sma': False, 'use_atr': False, 'use_adx': False, 'use_ema': False, 'use_spike': False, 'rsi_required': False, 'edge_k': 0.4549734984453371, 'edge_cap': 0.525331742152379}.
[I 2025-08-29 22:25:43,892] Trial 418 finished with values: [-1000000000.0, 1000000000.0] and parameters: {'p_sma': 49, 'p_std': 6, 'p_atr': 11, 'p_adx': 24, 'rsi_period': 36, 'ema1': 8, 'ema2': 12, 'slip_atr_k': 0.012648136503606024, 'slip_spread_k': 0.7850272503502944, 'spread_hl_frac': 0.013204424361867991, 'bb_std_mult': 2.8341739915168866, 'rsi_os': 30, 'rsi_ob': 76, 'vol_spike': 0.265054300435161, 'adx_thresh': 20.820532110715536, 'atr_min_pct': 0.011998290430724753, 'atr_max_pct': 0.11893515430547043, 'tp_mult': 1.77602412279923, 'tsl_mult': 0.6099919843950479, 'strategy': 'mean_reversion', 'time_stop': 184, 'use_sma': False, 'use_atr': False, 'use_adx': False, 'use_ema': False, 'use_spike': False, 'rsi_required': False, 'edge_k': 0.42100459714494415, 'edge_cap': 0.5629414424825726}.
[I 2025-08-29 22:25:44,058] Trial 416 finished with values: [-1000000000.0, 1000000000.0] and parameters: {'p_sma': 52, 'p_std': 52, 'p_atr': 11, 'p_adx': 24, 'rsi_period': 31, 'ema1': 9, 'ema2': 13, 'slip_atr_k': 0.011725106713764396, 'slip_spread_k': 0.7836049145188121, 'spread_hl_frac': 0.012914774298899206, 'bb_std_mult': 2.8685983297396467, 'rsi_os': 29, 'rsi_ob': 75, 'vol_spike': 0.28629757871432737, 'adx_thresh': 21.52050618321555, 'atr_min_pct': 0.013780160704058611, 'atr_max_pct': 0.11853702724289847, 'tp_mult': 1.7248579911105406, 'tsl_mult': 0.5562544859085783, 'strategy': 'mean_reversion', 'time_stop': 147, 'use_sma': False, 'use_atr': False, 'use_adx': False, 'use_ema': False, 'use_spike': False, 'rsi_required': False, 'edge_k': 0.8791887924270986, 'edge_cap': 0.5300197398062368}.
[I 2025-08-29 22:26:11,504] Trial 421 finished with values: [-1000000000.0, 1000000000.0] and parameters: {'p_sma': 52, 'p_std': 37, 'p_atr': 11, 'p_adx': 24, 'rsi_period': 36, 'ema1': 8, 'ema2': 12, 'slip_atr_k': 0.015732467797233696, 'slip_spread_k': 0.803394827416981, 'spread_hl_frac': 0.013872449911553151, 'bb_std_mult': 2.8466064671674136, 'rsi_os': 29, 'rsi_ob': 76, 'vol_spike': 0.2639065407545923, 'adx_thresh': 21.957403718670676, 'atr_min_pct': 0.012347351974075951, 'atr_max_pct': 0.039398849586649215, 'tp_mult': 1.7560191179821096, 'tsl_mult': 0.5522839076895585, 'strategy': 'mean_reversion', 'time_stop': 183, 'use_sma': False, 'use_atr': False, 'use_adx': False, 'use_ema': False, 'use_spike': False, 'rsi_required': False, 'edge_k': 0.4118752526142128, 'edge_cap': 0.5245041473856877}.
[I 2025-08-29 22:26:11,831] Trial 420 finished with values: [-1000000000.0, 1000000000.0] and parameters: {'p_sma': 20, 'p_std': 53, 'p_atr': 10, 'p_adx': 24, 'rsi_period': 33, 'ema1': 8, 'ema2': 12, 'slip_atr_k': 0.0035623376678446117, 'slip_spread_k': 0.7867464966251531, 'spread_hl_frac': 0.01620671520996047, 'bb_std_mult': 2.871247801189928, 'rsi_os': 29, 'rsi_ob': 76, 'vol_spike': 0.2634206345078019, 'adx_thresh': 21.056466329293137, 'atr_min_pct': 0.012400730113098998, 'atr_max_pct': 0.039502275930505495, 'tp_mult': 1.7625645365913176, 'tsl_mult': 0.6072152523864615, 'strategy': 'mean_reversion', 'time_stop': 193, 'use_sma': False, 'use_atr': False, 'use_adx': False, 'use_ema': False, 'use_spike': False, 'rsi_required': False, 'edge_k': 0.9722433661910792, 'edge_cap': 0.5200288763537427}.
[I 2025-08-29 22:26:11,964] Trial 422 finished with values: [-1000000000.0, 1000000000.0] and parameters: {'p_sma': 52, 'p_std': 13, 'p_atr': 9, 'p_adx': 24, 'rsi_period': 30, 'ema1': 9, 'ema2': 12, 'slip_atr_k': 0.00024931395344311713, 'slip_spread_k': 0.8032644755488486, 'spread_hl_frac': 0.01576930873340955, 'bb_std_mult': 2.8356005230187433, 'rsi_os': 29, 'rsi_ob': 76, 'vol_spike': 0.29458049865936103, 'adx_thresh': 21.800532677211713, 'atr_min_pct': 0.01393137515636848, 'atr_max_pct': 0.07274143088750559, 'tp_mult': 1.6955079337563495, 'tsl_mult': 0.5482368028463899, 'strategy': 'mean_reversion', 'time_stop': 159, 'use_sma': False, 'use_atr': False, 'use_adx': False, 'use_ema': False, 'use_spike': False, 'rsi_required': False, 'edge_k': 0.4990613254328251, 'edge_cap': 0.5313957607640896}.
[I 2025-08-29 22:26:12,058] Trial 423 finished with values: [-1000000000.0, 1000000000.0] and parameters: {'p_sma': 49, 'p_std': 28, 'p_atr': 12, 'p_adx': 23, 'rsi_period': 33, 'ema1': 10, 'ema2': 58, 'slip_atr_k': 0.0025648726153150716, 'slip_spread_k': 0.8121163608606763, 'spread_hl_frac': 0.014027945282347022, 'bb_std_mult': 2.9525340343809825, 'rsi_os': 29, 'rsi_ob': 76, 'vol_spike': 0.25292855278323434, 'adx_thresh': 21.981045924670482, 'atr_min_pct': 0.010388544886455513, 'atr_max_pct': 0.1253351621201837, 'tp_mult': 1.7693454499372987, 'tsl_mult': 0.5416568470506959, 'strategy': 'mean_reversion', 'time_stop': 159, 'use_sma': False, 'use_atr': False, 'use_adx': False, 'use_ema': False, 'use_spike': False, 'rsi_required': False, 'edge_k': 0.4997746238978098, 'edge_cap': 0.5216935524539341}.
[I 2025-08-29 22:26:39,351] Trial 425 finished with values: [-1000000000.0, 1000000000.0] and parameters: {'p_sma': 59, 'p_std': 36, 'p_atr': 12, 'p_adx': 23, 'rsi_period': 30, 'ema1': 10, 'ema2': 12, 'slip_atr_k': 0.005253286601865576, 'slip_spread_k': 0.8159948398359438, 'spread_hl_frac': 0.01628018767268759, 'bb_std_mult': 2.96344341373876, 'rsi_os': 28, 'rsi_ob': 74, 'vol_spike': 0.2679384388126843, 'adx_thresh': 19.9093553466102, 'atr_min_pct': 0.01043180524923046, 'atr_max_pct': 0.08817345160438647, 'tp_mult': 1.6827547585928353, 'tsl_mult': 0.64160943078906, 'strategy': 'mean_reversion', 'time_stop': 158, 'use_sma': False, 'use_atr': False, 'use_adx': False, 'use_ema': False, 'use_spike': False, 'rsi_required': False, 'edge_k': 1.476596884610565, 'edge_cap': 0.5519958701570099}.
[I 2025-08-29 22:26:39,612] Trial 427 finished with values: [-1000000000.0, 1000000000.0] and parameters: {'p_sma': 19, 'p_std': 23, 'p_atr': 8, 'p_adx': 25, 'rsi_period': 30, 'ema1': 8, 'ema2': 12, 'slip_atr_k': 0.01194544287851797, 'slip_spread_k': 0.8218783967969467, 'spread_hl_frac': 0.01506144749590891, 'bb_std_mult': 2.9720106935296577, 'rsi_os': 31, 'rsi_ob': 75, 'vol_spike': 0.26670393157802524, 'adx_thresh': 25.07101981810571, 'atr_min_pct': 0.012827155453077048, 'atr_max_pct': 0.1136851672782555, 'tp_mult': 1.8596315880694825, 'tsl_mult': 0.5754441126554131, 'strategy': 'mean_reversion', 'time_stop': 179, 'use_sma': False, 'use_atr': False, 'use_adx': False, 'use_ema': False, 'use_spike': False, 'rsi_required': False, 'edge_k': 0.4071209789354292, 'edge_cap': 0.5512164572058371}.
[I 2025-08-29 22:26:39,795] Trial 424 finished with values: [-1000000000.0, 1000000000.0] and parameters: {'p_sma': 49, 'p_std': 28, 'p_atr': 10, 'p_adx': 23, 'rsi_period': 33, 'ema1': 8, 'ema2': 12, 'slip_atr_k': 0.005111449172148841, 'slip_spread_k': 0.8180619410384118, 'spread_hl_frac': 0.014612385997031501, 'bb_std_mult': 2.7963372641332715, 'rsi_os': 28, 'rsi_ob': 75, 'vol_spike': 0.2538428637592387, 'adx_thresh': 19.807096351166994, 'atr_min_pct': 0.01968356633963354, 'atr_max_pct': 0.11347772881593024, 'tp_mult': 1.7005212273464059, 'tsl_mult': 0.5820693256407665, 'strategy': 'mean_reversion', 'time_stop': 156, 'use_sma': False, 'use_atr': False, 'use_adx': False, 'use_ema': False, 'use_spike': False, 'rsi_required': False, 'edge_k': 1.6829744612069675, 'edge_cap': 0.5256594097242683}.
[I 2025-08-29 22:26:39,988] Trial 426 finished with values: [-1000000000.0, 1000000000.0] and parameters: {'p_sma': 49, 'p_std': 28, 'p_atr': 12, 'p_adx': 23, 'rsi_period': 33, 'ema1': 10, 'ema2': 14, 'slip_atr_k': 0.005671516863694474, 'slip_spread_k': 0.7620993180972717, 'spread_hl_frac': 0.01440507099107086, 'bb_std_mult': 2.958634223825948, 'rsi_os': 28, 'rsi_ob': 75, 'vol_spike': 0.2776648584179998, 'adx_thresh': 24.84673961196956, 'atr_min_pct': 0.008421767103962759, 'atr_max_pct': 0.013170241833592097, 'tp_mult': 1.7974142088230762, 'tsl_mult': 0.6393888465780104, 'strategy': 'mean_reversion', 'time_stop': 154, 'use_sma': False, 'use_atr': False, 'use_adx': False, 'use_ema': False, 'use_spike': False, 'rsi_required': False, 'edge_k': 1.762772466704777, 'edge_cap': 0.549963056897648}.
[I 2025-08-29 22:27:07,263] Trial 431 finished with values: [-1000000000.0, 1000000000.0] and parameters: {'p_sma': 27, 'p_std': 26, 'p_atr': 9, 'p_adx': 23, 'rsi_period': 38, 'ema1': 8, 'ema2': 24, 'slip_atr_k': 0.015980458867781995, 'slip_spread_k': 0.7636385129142846, 'spread_hl_frac': 0.010694464382820311, 'bb_std_mult': 3.1200055413033017, 'rsi_os': 30, 'rsi_ob': 76, 'vol_spike': 0.2928201961772616, 'adx_thresh': 25.8300181581803, 'atr_min_pct': 0.005288186724891679, 'atr_max_pct': 0.12461119996076778, 'tp_mult': 1.8143501318132547, 'tsl_mult': 0.5350754732102122, 'strategy': 'mean_reversion', 'time_stop': 209, 'use_sma': False, 'use_atr': False, 'use_adx': False, 'use_ema': False, 'use_spike': False, 'rsi_required': False, 'edge_k': 1.0978585139747108, 'edge_cap': 0.5794879113274366}.
[I 2025-08-29 22:27:07,516] Trial 430 finished with values: [-1000000000.0, 1000000000.0] and parameters: {'p_sma': 17, 'p_std': 37, 'p_atr': 9, 'p_adx': 23, 'rsi_period': 39, 'ema1': 8, 'ema2': 16, 'slip_atr_k': 0.01990804915299159, 'slip_spread_k': 0.7710935672722236, 'spread_hl_frac': 0.011104825024015361, 'bb_std_mult': 3.089007613498709, 'rsi_os': 28, 'rsi_ob': 76, 'vol_spike': 0.28127380873793767, 'adx_thresh': 23.524557802952, 'atr_min_pct': 0.008497044075207379, 'atr_max_pct': 0.10944154838513646, 'tp_mult': 1.7961949721391637, 'tsl_mult': 0.5394656721166876, 'strategy': 'mean_reversion', 'time_stop': 213, 'use_sma': False, 'use_atr': False, 'use_adx': False, 'use_ema': False, 'use_spike': False, 'rsi_required': False, 'edge_k': 0.8216172977613747, 'edge_cap': 0.5736570471664337}.
[I 2025-08-29 22:27:07,687] Trial 429 finished with values: [-1000000000.0, 1000000000.0] and parameters: {'p_sma': 48, 'p_std': 26, 'p_atr': 9, 'p_adx': 23, 'rsi_period': 35, 'ema1': 8, 'ema2': 19, 'slip_atr_k': 0.020074163960998898, 'slip_spread_k': 0.767252574852946, 'spread_hl_frac': 0.010713698628965521, 'bb_std_mult': 2.7574287421003127, 'rsi_os': 28, 'rsi_ob': 75, 'vol_spike': 0.27968589007171885, 'adx_thresh': 26.12614473479112, 'atr_min_pct': 0.019735110374129564, 'atr_max_pct': 0.12496195077244764, 'tp_mult': 1.8052522743497743, 'tsl_mult': 0.5846140937733411, 'strategy': 'mean_reversion', 'time_stop': 152, 'use_sma': False, 'use_atr': False, 'use_adx': False, 'use_ema': False, 'use_spike': False, 'rsi_required': False, 'edge_k': 0.04365212379337535, 'edge_cap': 0.5829202260137392}.
[I 2025-08-29 22:27:07,697] Trial 428 finished with values: [-1000000000.0, 1000000000.0] and parameters: {'p_sma': 48, 'p_std': 21, 'p_atr': 8, 'p_adx': 23, 'rsi_period': 29, 'ema1': 8, 'ema2': 24, 'slip_atr_k': 0.012347698052337834, 'slip_spread_k': 0.76901358407773, 'spread_hl_frac': 0.01078262573532468, 'bb_std_mult': 2.766707154492995, 'rsi_os': 31, 'rsi_ob': 75, 'vol_spike': 0.2789556601412304, 'adx_thresh': 24.804522713762438, 'atr_min_pct': 0.0051578193014197886, 'atr_max_pct': 0.11371494376763275, 'tp_mult': 1.7996283664255175, 'tsl_mult': 0.5833701309918164, 'strategy': 'mean_reversion', 'time_stop': 210, 'use_sma': False, 'use_atr': False, 'use_adx': False, 'use_ema': False, 'use_spike': False, 'rsi_required': False, 'edge_k': 1.1030419415922137, 'edge_cap': 0.5114472650230377}.
