[I 2025-08-29 23:12:48,045] Trial 862 finished with values: [-1000000000.0, 1000000000.0] and parameters: {'p_sma': 52, 'p_std': 9, 'p_atr': 13, 'p_adx': 19, 'rsi_period': 10, 'ema1': 30, 'ema2': 21, 'slip_atr_k': 0.14004282574007612, 'slip_spread_k': 0.4954341441280133, 'spread_hl_frac': 0.04844588718067539, 'bb_std_mult': 1.3746120888697477, 'rsi_os': 33, 'rsi_ob': 61, 'vol_spike': 0.13094725303653643, 'adx_thresh': 20.531792842715088, 'atr_min_pct': 0.005765337395818433, 'atr_max_pct': 0.06201242557047938, 'tp_mult': 1.898755551606397, 'tsl_mult': 0.8707882812490244, 'strategy': 'mean_reversion', 'time_stop': 20, 'use_sma': False, 'use_atr': False, 'use_adx': False, 'use_ema': False, 'use_spike': False, 'rsi_required': False, 'edge_k': 1.5344227253065092, 'edge_cap': 0.6784110189178194}.
[I 2025-08-29 23:12:49,709] Trial 866 finished with values: [-1000000000.0, 1000000000.0] and parameters: {'p_sma': 18, 'p_std': 30, 'p_atr': 25, 'p_adx': 12, 'rsi_period': 12, 'ema1': 20, 'ema2': 52, 'slip_atr_k': 0.14205916346294403, 'slip_spread_k': 0.3227861289062596, 'spread_hl_frac': 0.011901785809218966, 'bb_std_mult': 1.5303100565210184, 'rsi_os': 7, 'rsi_ob': 62, 'vol_spike': 0.265710501867476, 'adx_thresh': 19.176304217004486, 'atr_min_pct': 0.004799447745573464, 'atr_max_pct': 0.06154071815290914, 'tp_mult': 1.3716975113530565, 'tsl_mult': 0.8873927008055105, 'strategy': 'mean_reversion', 'time_stop': 76, 'use_sma': False, 'use_atr': False, 'use_adx': False, 'use_ema': False, 'use_spike': False, 'rsi_required': False, 'edge_k': 1.9197382572025212, 'edge_cap': 0.3885227308636292}.
[I 2025-08-29 23:12:49,910] Trial 865 finished with values: [-1000000000.0, 1000000000.0] and parameters: {'p_sma': 18, 'p_std': 14, 'p_atr': 28, 'p_adx': 12, 'rsi_period': 11, 'ema1': 30, 'ema2': 20, 'slip_atr_k': 0.12551271937380556, 'slip_spread_k': 0.6242795380513941, 'spread_hl_frac': 0.007504714389182054, 'bb_std_mult': 1.2899208716606585, 'rsi_os': 6, 'rsi_ob': 62, 'vol_spike': 0.26459812556838697, 'adx_thresh': 22.924110663714508, 'atr_min_pct': 0.020181191278732545, 'atr_max_pct': 0.09524385445655839, 'tp_mult': 1.8673520013285823, 'tsl_mult': 0.6230146037086052, 'strategy': 'mean_reversion', 'time_stop': 273, 'use_sma': False, 'use_atr': False, 'use_adx': False, 'use_ema': False, 'use_spike': False, 'rsi_required': False, 'edge_k': 1.6462593903699247, 'edge_cap': 0.12716929338010569}.
[I 2025-08-29 23:13:16,813] Trial 868 finished with values: [-1000000000.0, 1000000000.0] and parameters: {'p_sma': 40, 'p_std': 17, 'p_atr': 12, 'p_adx': 12, 'rsi_period': 59, 'ema1': 20, 'ema2': 20, 'slip_atr_k': 0.0057289533811525906, 'slip_spread_k': 0.329797865240251, 'spread_hl_frac': 0.007562153377525381, 'bb_std_mult': 1.4907712474089576, 'rsi_os': 32, 'rsi_ob': 95, 'vol_spike': 0.2639468194392743, 'adx_thresh': 18.72053996025909, 'atr_min_pct': 0.008905942886847946, 'atr_max_pct': 0.09605075976519536, 'tp_mult': 1.857714228758499, 'tsl_mult': 0.6534164371537696, 'strategy': 'mean_reversion', 'time_stop': 272, 'use_sma': False, 'use_atr': False, 'use_adx': False, 'use_ema': False, 'use_spike': False, 'rsi_required': False, 'edge_k': 1.8764493631307153, 'edge_cap': 0.15880175938965138}.
[I 2025-08-29 23:13:17,147] Trial 870 finished with values: [-1000000000.0, 1000000000.0] and parameters: {'p_sma': 40, 'p_std': 6, 'p_atr': 29, 'p_adx': 20, 'rsi_period': 59, 'ema1': 28, 'ema2': 19, 'slip_atr_k': 0.005240121904524377, 'slip_spread_k': 0.2349650581064852, 'spread_hl_frac': 0.03971796381783293, 'bb_std_mult': 1.2039489109635944, 'rsi_os': 15, 'rsi_ob': 70, 'vol_spike': 0.18371425755573814, 'adx_thresh': 17.674346567531387, 'atr_min_pct': 0.01639276746981788, 'atr_max_pct': 0.04624962709146037, 'tp_mult': 1.936392963018732, 'tsl_mult': 0.07039510350210504, 'strategy': 'breakout', 'time_stop': 281, 'use_sma': False, 'use_atr': False, 'use_adx': False, 'use_ema': False, 'use_spike': False, 'rsi_required': False, 'edge_k': 1.880243626370449, 'edge_cap': 0.153186247761479}.
[I 2025-08-29 23:13:17,271] Trial 867 finished with values: [-1000000000.0, 1000000000.0] and parameters: {'p_sma': 40, 'p_std': 9, 'p_atr': 13, 'p_adx': 12, 'rsi_period': 9, 'ema1': 30, 'ema2': 20, 'slip_atr_k': 0.13903831997079977, 'slip_spread_k': 0.07372135640959437, 'spread_hl_frac': 0.007516864196437718, 'bb_std_mult': 1.5053206024665213, 'rsi_os': 32, 'rsi_ob': 62, 'vol_spike': 0.20651132051346846, 'adx_thresh': 11.231313865322633, 'atr_min_pct': 0.020629812330192933, 'atr_max_pct': 0.06195946533325254, 'tp_mult': 1.908290934062588, 'tsl_mult': 0.653413105884084, 'strategy': 'mean_reversion', 'time_stop': 279, 'use_sma': False, 'use_atr': False, 'use_adx': False, 'use_ema': False, 'use_spike': False, 'rsi_required': False, 'edge_k': 0.9240049027278301, 'edge_cap': 0.1594646535277833}.
[I 2025-08-29 23:13:17,281] Trial 869 finished with values: [-1000000000.0, 1000000000.0] and parameters: {'p_sma': 32, 'p_std': 20, 'p_atr': 27, 'p_adx': 14, 'rsi_period': 13, 'ema1': 30, 'ema2': 19, 'slip_atr_k': 0.005470708289654627, 'slip_spread_k': 0.25232069090625464, 'spread_hl_frac': 0.010295158301149594, 'bb_std_mult': 1.2606744687504383, 'rsi_os': 32, 'rsi_ob': 62, 'vol_spike': 0.18332037282449098, 'adx_thresh': 17.81915316548888, 'atr_min_pct': 0.008819244873358644, 'atr_max_pct': 0.07149885433852103, 'tp_mult': 1.9399831197483821, 'tsl_mult': 0.6647338818176591, 'strategy': 'mean_reversion', 'time_stop': 271, 'use_sma': False, 'use_atr': False, 'use_adx': False, 'use_ema': False, 'use_spike': False, 'rsi_required': False, 'edge_k': 1.969160320836063, 'edge_cap': 0.15397380342683842}.
[I 2025-08-29 23:13:44,710] Trial 872 finished with values: [-1000000000.0, 1000000000.0] and parameters: {'p_sma': 26, 'p_std': 40, 'p_atr': 11, 'p_adx': 13, 'rsi_period': 14, 'ema1': 25, 'ema2': 46, 'slip_atr_k': 0.015008711207318568, 'slip_spread_k': 0.27563567279387224, 'spread_hl_frac': 0.021751160812336048, 'bb_std_mult': 1.3155360227848871, 'rsi_os': 46, 'rsi_ob': 64, 'vol_spike': 0.24930546524056282, 'adx_thresh': 20.940714645326334, 'atr_min_pct': 0.02302573868470682, 'atr_max_pct': 0.07897333258676245, 'tp_mult': 2.001857288083962, 'tsl_mult': 0.5760927315610838, 'strategy': 'breakout', 'time_stop': 185, 'use_sma': False, 'use_atr': False, 'use_adx': False, 'use_ema': False, 'use_spike': False, 'rsi_required': False, 'edge_k': 1.9328256603343785, 'edge_cap': 0.199747846782906}.
[I 2025-08-29 23:13:44,716] Trial 874 finished with values: [-0.005826331121129069, 0.005934076224321846] and parameters: {'p_sma': 36, 'p_std': 27, 'p_atr': 11, 'p_adx': 13, 'rsi_period': 12, 'ema1': 25, 'ema2': 22, 'slip_atr_k': 0.0001519742281185021, 'slip_spread_k': 0.2667749548001211, 'spread_hl_frac': 0.021730680106887636, 'bb_std_mult': 1.2819407721150962, 'rsi_os': 35, 'rsi_ob': 64, 'vol_spike': 0.2510899591300323, 'adx_thresh': 20.199516143951215, 'atr_min_pct': 0.0025550548796866583, 'atr_max_pct': 0.01812034525969739, 'tp_mult': 1.9955960872422893, 'tsl_mult': 0.2105224211233806, 'strategy': 'breakout', 'time_stop': 279, 'use_sma': False, 'use_atr': False, 'use_adx': False, 'use_ema': False, 'use_spike': False, 'rsi_required': False, 'edge_k': 1.9975053441116912, 'edge_cap': 0.2378115414022254}.
[I 2025-08-29 23:13:44,924] Trial 873 finished with values: [-0.06690851159982736, 0.06689709109004989] and parameters: {'p_sma': 26, 'p_std': 14, 'p_atr': 11, 'p_adx': 13, 'rsi_period': 12, 'ema1': 29, 'ema2': 28, 'slip_atr_k': 0.1562821779986516, 'slip_spread_k': 0.2723395792949125, 'spread_hl_frac': 0.011682752055967171, 'bb_std_mult': 1.2953840647218533, 'rsi_os': 34, 'rsi_ob': 61, 'vol_spike': 0.06048950941864244, 'adx_thresh': 7.190270931119112, 'atr_min_pct': 0.0005066086353579351, 'atr_max_pct': 0.07521549545122136, 'tp_mult': 1.9941931175324281, 'tsl_mult': 0.032426283135108924, 'strategy': 'breakout', 'time_stop': 65, 'use_sma': False, 'use_atr': False, 'use_adx': False, 'use_ema': False, 'use_spike': False, 'rsi_required': False, 'edge_k': 1.999148593003648, 'edge_cap': 0.19888381728268817}.
[I 2025-08-29 23:13:44,940] Trial 871 finished with values: [-1000000000.0, 1000000000.0] and parameters: {'p_sma': 32, 'p_std': 41, 'p_atr': 11, 'p_adx': 20, 'rsi_period': 14, 'ema1': 29, 'ema2': 22, 'slip_atr_k': 0.1573131887255158, 'slip_spread_k': 0.2488384483938616, 'spread_hl_frac': 0.0102017780976245, 'bb_std_mult': 1.2482482109329323, 'rsi_os': 31, 'rsi_ob': 64, 'vol_spike': 0.24982625592067106, 'adx_thresh': 11.318353487321408, 'atr_min_pct': 0.02274626706393673, 'atr_max_pct': 0.07078578335458938, 'tp_mult': 1.4585916030124102, 'tsl_mult': 0.0688400789268852, 'strategy': 'breakout', 'time_stop': 281, 'use_sma': False, 'use_atr': False, 'use_adx': False, 'use_ema': False, 'use_spike': False, 'rsi_required': False, 'edge_k': 1.9988600828628307, 'edge_cap': 0.24151745310387568}.
[I 2025-08-29 23:14:12,424] Trial 878 finished with values: [-1000000000.0, 1000000000.0] and parameters: {'p_sma': 15, 'p_std': 13, 'p_atr': 12, 'p_adx': 14, 'rsi_period': 17, 'ema1': 22, 'ema2': 25, 'slip_atr_k': 0.024735121701359802, 'slip_spread_k': 0.44433634327076416, 'spread_hl_frac': 0.012380348439543498, 'bb_std_mult': 1.3916144687806205, 'rsi_os': 33, 'rsi_ob': 66, 'vol_spike': 0.25780086821027076, 'adx_thresh': 21.114620101151996, 'atr_min_pct': 0.015220251770831987, 'atr_max_pct': 0.10590867106620849, 'tp_mult': 1.9045063976519405, 'tsl_mult': 0.7806970190723778, 'strategy': 'mean_reversion', 'time_stop': 285, 'use_sma': False, 'use_atr': False, 'use_adx': False, 'use_ema': False, 'use_spike': False, 'rsi_required': False, 'edge_k': 1.9211456056428462, 'edge_cap': 0.7876988915762646}.
[I 2025-08-29 23:14:12,919] Trial 875 finished with values: [-1000000000.0, 1000000000.0] and parameters: {'p_sma': 23, 'p_std': 12, 'p_atr': 12, 'p_adx': 14, 'rsi_period': 75, 'ema1': 29, 'ema2': 25, 'slip_atr_k': 0.02344491747443994, 'slip_spread_k': 0.3144579966484904, 'spread_hl_frac': 0.011502678407078934, 'bb_std_mult': 1.2140090083590467, 'rsi_os': 43, 'rsi_ob': 68, 'vol_spike': 0.1626537770406754, 'adx_thresh': 7.151032935804359, 'atr_min_pct': 0.011713856261626274, 'atr_max_pct': 0.07108820515889505, 'tp_mult': 1.957023680211839, 'tsl_mult': 0.6272031205333181, 'strategy': 'mean_reversion', 'time_stop': 285, 'use_sma': False, 'use_atr': False, 'use_adx': False, 'use_ema': False, 'use_spike': False, 'rsi_required': False, 'edge_k': 1.0293466838145935, 'edge_cap': 0.05109654738135894}.
[I 2025-08-29 23:14:13,059] Trial 876 finished with values: [-1000000000.0, 1000000000.0] and parameters: {'p_sma': 28, 'p_std': 24, 'p_atr': 12, 'p_adx': 26, 'rsi_period': 16, 'ema1': 29, 'ema2': 36, 'slip_atr_k': 0.1566093978641468, 'slip_spread_k': 0.3077039953669837, 'spread_hl_frac': 0.01203376984154628, 'bb_std_mult': 1.227570937956448, 'rsi_os': 13, 'rsi_ob': 61, 'vol_spike': 0.257619334782644, 'adx_thresh': 20.178131942289127, 'atr_min_pct': 0.012699875690164234, 'atr_max_pct': 0.1070060752813447, 'tp_mult': 1.458965361477126, 'tsl_mult': 0.6250871290344303, 'strategy': 'mean_reversion', 'time_stop': 285, 'use_sma': False, 'use_atr': False, 'use_adx': False, 'use_ema': False, 'use_spike': False, 'rsi_required': False, 'edge_k': 1.9285372215253203, 'edge_cap': 0.1774389386979608}.
[I 2025-08-29 23:14:13,125] Trial 877 finished with values: [-1000000000.0, 1000000000.0] and parameters: {'p_sma': 8, 'p_std': 13, 'p_atr': 12, 'p_adx': 14, 'rsi_period': 41, 'ema1': 22, 'ema2': 25, 'slip_atr_k': 0.13056154599294792, 'slip_spread_k': 0.3740830549232277, 'spread_hl_frac': 0.010288312277040195, 'bb_std_mult': 1.4489383395002036, 'rsi_os': 31, 'rsi_ob': 90, 'vol_spike': 0.009431637250396696, 'adx_thresh': 20.08923481340629, 'atr_min_pct': 0.01516354012810734, 'atr_max_pct': 0.07177241708151114, 'tp_mult': 1.9108761821767897, 'tsl_mult': 0.7800168361758546, 'strategy': 'mean_reversion', 'time_stop': 286, 'use_sma': False, 'use_atr': False, 'use_adx': False, 'use_ema': False, 'use_spike': False, 'rsi_required': False, 'edge_k': 0.08565710183842312, 'edge_cap': 0.09734286441954493}.
[I 2025-08-29 23:14:39,758] Trial 882 finished with values: [-1000000000.0, 1000000000.0] and parameters: {'p_sma': 22, 'p_std': 60, 'p_atr': 13, 'p_adx': 13, 'rsi_period': 9, 'ema1': 30, 'ema2': 56, 'slip_atr_k': 0.011621308140834468, 'slip_spread_k': 0.3438164491563215, 'spread_hl_frac': 0.009042677934024315, 'bb_std_mult': 1.3209846854992284, 'rsi_os': 11, 'rsi_ob': 51, 'vol_spike': 0.2979040660818475, 'adx_thresh': 21.52571105069821, 'atr_min_pct': 0.0076210071399574345, 'atr_max_pct': 0.06524011285351591, 'tp_mult': 1.8564260985986278, 'tsl_mult': 0.6857407338762912, 'strategy': 'mean_reversion', 'time_stop': 131, 'use_sma': False, 'use_atr': False, 'use_adx': False, 'use_ema': False, 'use_spike': False, 'rsi_required': False, 'edge_k': 0.6993211668276333, 'edge_cap': 0.21564577224668838}.
[I 2025-08-29 23:14:40,514] Trial 880 finished with values: [-1000000000.0, 1000000000.0] and parameters: {'p_sma': 58, 'p_std': 11, 'p_atr': 12, 'p_adx': 26, 'rsi_period': 10, 'ema1': 30, 'ema2': 24, 'slip_atr_k': 0.010754615294612706, 'slip_spread_k': 0.3712591190963692, 'spread_hl_frac': 0.008920980319251905, 'bb_std_mult': 1.4672356524428278, 'rsi_os': 22, 'rsi_ob': 61, 'vol_spike': 0.1943650771814257, 'adx_thresh': 19.95627320943683, 'atr_min_pct': 0.011174102396819416, 'atr_max_pct': 0.08429740725132133, 'tp_mult': 2.5457352049285875, 'tsl_mult': 0.5976350112771426, 'strategy': 'mean_reversion', 'time_stop': 294, 'use_sma': False, 'use_atr': False, 'use_adx': False, 'use_ema': False, 'use_spike': False, 'rsi_required': False, 'edge_k': 0.06157114547028231, 'edge_cap': 0.17695749051151785}.
[I 2025-08-29 23:14:40,600] Trial 881 finished with values: [-1000000000.0, 1000000000.0] and parameters: {'p_sma': 22, 'p_std': 11, 'p_atr': 13, 'p_adx': 13, 'rsi_period': 8, 'ema1': 30, 'ema2': 24, 'slip_atr_k': 0.011724608614703116, 'slip_spread_k': 0.22215195781532143, 'spread_hl_frac': 0.043091199083494514, 'bb_std_mult': 1.4498432747134653, 'rsi_os': 34, 'rsi_ob': 81, 'vol_spike': 0.26899391684183144, 'adx_thresh': 20.833002681041155, 'atr_min_pct': 0.014466312709920829, 'atr_max_pct': 0.08713154828503439, 'tp_mult': 1.2341258281390834, 'tsl_mult': 0.5984636003312702, 'strategy': 'mean_reversion', 'time_stop': 132, 'use_sma': False, 'use_atr': False, 'use_adx': False, 'use_ema': False, 'use_spike': False, 'rsi_required': False, 'edge_k': 0.08613347721205511, 'edge_cap': 0.30846161028368324}.
[I 2025-08-29 23:14:40,679] Trial 879 finished with values: [-1000000000.0, 1000000000.0] and parameters: {'p_sma': 28, 'p_std': 12, 'p_atr': 12, 'p_adx': 14, 'rsi_period': 8, 'ema1': 30, 'ema2': 24, 'slip_atr_k': 0.010021402111487783, 'slip_spread_k': 0.3700287714758993, 'spread_hl_frac': 0.0424723527541591, 'bb_std_mult': 1.4429715448787794, 'rsi_os': 13, 'rsi_ob': 88, 'vol_spike': 0.16452900587232894, 'adx_thresh': 19.849529876649726, 'atr_min_pct': 0.02997411108037097, 'atr_max_pct': 0.0872678583648734, 'tp_mult': 2.611962741137819, 'tsl_mult': 0.6278116545178631, 'strategy': 'mean_reversion', 'time_stop': 284, 'use_sma': False, 'use_atr': False, 'use_adx': False, 'use_ema': False, 'use_spike': False, 'rsi_required': False, 'edge_k': 1.8939391539969401, 'edge_cap': 0.1786907070403788}.
[I 2025-08-29 23:14:40,935] Trial 886 finished with values: [-1000000000.0, 1000000000.0] and parameters: {'p_sma': 20, 'p_std': 44, 'p_atr': 27, 'p_adx': 12, 'rsi_period': 80, 'ema1': 14, 'ema2': 16, 'slip_atr_k': 0.0050192532850675585, 'slip_spread_k': 0.29877465406313436, 'spread_hl_frac': 0.00010370029729814614, 'bb_std_mult': 1.3315564569732417, 'rsi_os': 51, 'rsi_ob': 63, 'vol_spike': 0.23522474235238458, 'adx_thresh': 11.958446234425624, 'atr_min_pct': 0.008221278202194572, 'atr_max_pct': 0.0799214058613653, 'tp_mult': 1.9584205930690026, 'tsl_mult': 0.6438203569336617, 'strategy': 'mean_reversion', 'time_stop': 46, 'use_sma': False, 'use_atr': False, 'use_adx': False, 'use_ema': False, 'use_spike': False, 'rsi_required': False, 'edge_k': 1.956662172737855, 'edge_cap': 0.8881728226739385}.
[I 2025-08-29 23:15:07,607] Trial 883 finished with values: [-1000000000.0, 1000000000.0] and parameters: {'p_sma': 28, 'p_std': 18, 'p_atr': 24, 'p_adx': 13, 'rsi_period': 81, 'ema1': 30, 'ema2': 16, 'slip_atr_k': 0.10672876675931943, 'slip_spread_k': 0.22490086141197285, 'spread_hl_frac': 0.04221273427495966, 'bb_std_mult': 1.4760635950686918, 'rsi_os': 45, 'rsi_ob': 60, 'vol_spike': 0.2702363631276437, 'adx_thresh': 20.907104043793076, 'atr_min_pct': 0.021228649780698144, 'atr_max_pct': 0.08122932189780577, 'tp_mult': 1.9469645627293577, 'tsl_mult': 0.6014695348102266, 'strategy': 'mean_reversion', 'time_stop': 296, 'use_sma': False, 'use_atr': False, 'use_adx': False, 'use_ema': False, 'use_spike': False, 'rsi_required': False, 'edge_k': 1.8704605656773294, 'edge_cap': 0.17824054057143726}.
[I 2025-08-29 23:15:07,981] Trial 885 finished with values: [-1000000000.0, 1000000000.0] and parameters: {'p_sma': 29, 'p_std': 44, 'p_atr': 30, 'p_adx': 12, 'rsi_period': 55, 'ema1': 28, 'ema2': 30, 'slip_atr_k': 0.00015456304873059378, 'slip_spread_k': 0.29568653530726063, 'spread_hl_frac': 0.025140421770061514, 'bb_std_mult': 1.3807997047062228, 'rsi_os': 35, 'rsi_ob': 63, 'vol_spike': 0.23494012557449964, 'adx_thresh': 28.88042752765186, 'atr_min_pct': 0.0037848329163679877, 'atr_max_pct': 0.0797959264696959, 'tp_mult': 1.9517673374504476, 'tsl_mult': 0.3978706259045049, 'strategy': 'mean_reversion', 'time_stop': 275, 'use_sma': False, 'use_atr': False, 'use_adx': False, 'use_ema': False, 'use_spike': False, 'rsi_required': False, 'edge_k': 1.8551925680100927, 'edge_cap': 0.19330762400376603}.
[I 2025-08-29 23:15:07,981] Trial 884 finished with values: [-0.003519075184783116, 0.0035145833614667965] and parameters: {'p_sma': 20, 'p_std': 15, 'p_atr': 13, 'p_adx': 13, 'rsi_period': 70, 'ema1': 30, 'ema2': 21, 'slip_atr_k': 0.004268164426425994, 'slip_spread_k': 0.21236859278353937, 'spread_hl_frac': 0.019376071126124265, 'bb_std_mult': 1.383322222912944, 'rsi_os': 45, 'rsi_ob': 56, 'vol_spike': 0.10087819261869319, 'adx_thresh': 20.924696936410047, 'atr_min_pct': 0.0032160474668952513, 'atr_max_pct': 0.07931169765728613, 'tp_mult': 1.954838695870897, 'tsl_mult': 0.6479735446533901, 'strategy': 'mean_reversion', 'time_stop': 154, 'use_sma': False, 'use_atr': False, 'use_adx': False, 'use_ema': False, 'use_spike': False, 'rsi_required': False, 'edge_k': 1.8571735793571553, 'edge_cap': 0.8643024346516347}.
[I 2025-08-29 23:15:08,338] Trial 887 finished with values: [-1000000000.0, 1000000000.0] and parameters: {'p_sma': 42, 'p_std': 15, 'p_atr': 24, 'p_adx': 12, 'rsi_period': 62, 'ema1': 17, 'ema2': 21, 'slip_atr_k': 0.24411502041991978, 'slip_spread_k': 0.016633659004088752, 'spread_hl_frac': 0.013878461653947946, 'bb_std_mult': 1.384056037772561, 'rsi_os': 19, 'rsi_ob': 60, 'vol_spike': 0.2453650013315973, 'adx_thresh': 21.800173545712873, 'atr_min_pct': 0.024385486127746776, 'atr_max_pct': 0.0485901986461742, 'tp_mult': 1.9327952710861274, 'tsl_mult': 0.3572337225704012, 'strategy': 'mean_reversion', 'time_stop': 153, 'use_sma': False, 'use_atr': False, 'use_adx': False, 'use_ema': False, 'use_spike': False, 'rsi_required': False, 'edge_k': 1.8650128736170184, 'edge_cap': 0.8422106806104978}.
[I 2025-08-29 23:15:08,598] Trial 890 finished with values: [-1000000000.0, 1000000000.0] and parameters: {'p_sma': 35, 'p_std': 12, 'p_atr': 18, 'p_adx': 29, 'rsi_period': 12, 'ema1': 19, 'ema2': 38, 'slip_atr_k': 0.24359624056729717, 'slip_spread_k': 0.5553121973528949, 'spread_hl_frac': 0.013049270231013363, 'bb_std_mult': 1.535583289245836, 'rsi_os': 33, 'rsi_ob': 62, 'vol_spike': 0.2542479013498058, 'adx_thresh': 9.757989982124453, 'atr_min_pct': 0.027759426996058233, 'atr_max_pct': 0.02645685420328081, 'tp_mult': 1.8872802533530681, 'tsl_mult': 0.6225442821444506, 'strategy': 'breakout', 'time_stop': 279, 'use_sma': False, 'use_atr': False, 'use_adx': False, 'use_ema': False, 'use_spike': False, 'rsi_required': False, 'edge_k': 1.9523350932134549, 'edge_cap': 0.2151700173417786}.
[I 2025-08-29 23:15:08,635] Trial 888 finished with values: [-1000000000.0, 1000000000.0] and parameters: {'p_sma': 34, 'p_std': 14, 'p_atr': 13, 'p_adx': 12, 'rsi_period': 70, 'ema1': 26, 'ema2': 21, 'slip_atr_k': 0.004197361603649839, 'slip_spread_k': 0.2574195319032076, 'spread_hl_frac': 0.01058177590632999, 'bb_std_mult': 1.3828980108792222, 'rsi_os': 54, 'rsi_ob': 56, 'vol_spike': 0.24447817833049915, 'adx_thresh': 29.120580803428126, 'atr_min_pct': 0.027647443052696688, 'atr_max_pct': 0.07521069742996522, 'tp_mult': 1.8472254514765287, 'tsl_mult': 0.5771117869223014, 'strategy': 'mean_reversion', 'time_stop': 275, 'use_sma': False, 'use_atr': False, 'use_adx': False, 'use_ema': False, 'use_spike': False, 'rsi_required': False, 'edge_k': 1.9587186301318231, 'edge_cap': 0.21418448218358854}.
[I 2025-08-29 23:15:33,444] Trial 889 finished with values: [-1000000000.0, 1000000000.0] and parameters: {'p_sma': 42, 'p_std': 58, 'p_atr': 11, 'p_adx': 7, 'rsi_period': 63, 'ema1': 29, 'ema2': 18, 'slip_atr_k': 0.16327005228414096, 'slip_spread_k': 0.2614325947464108, 'spread_hl_frac': 0.01665072959215634, 'bb_std_mult': 1.548579682367733, 'rsi_os': 33, 'rsi_ob': 62, 'vol_spike': 0.2562191239888411, 'adx_thresh': 24.168657021608833, 'atr_min_pct': 0.004339655679062802, 'atr_max_pct': 0.07560213183588516, 'tp_mult': 1.8942434095612235, 'tsl_mult': 0.2730935683913376, 'strategy': 'breakout', 'time_stop': 261, 'use_sma': False, 'use_atr': False, 'use_adx': False, 'use_ema': False, 'use_spike': False, 'rsi_required': False, 'edge_k': 0.21850508591902784, 'edge_cap': 0.6361106906196868}.
