[I 2025-08-29 22:53:10,939] Trial 676 finished with values: [-1000000000.0, 1000000000.0] and parameters: {'p_sma': 27, 'p_std': 59, 'p_atr': 13, 'p_adx': 12, 'rsi_period': 62, 'ema1': 30, 'ema2': 18, 'slip_atr_k': 0.1721220173508496, 'slip_spread_k': 0.2714953902012609, 'spread_hl_frac': 0.008188915127314952, 'bb_std_mult': 2.2316865900441973, 'rsi_os': 34, 'rsi_ob': 64, 'vol_spike': 0.25268341084955115, 'adx_thresh': 21.27628639222893, 'atr_min_pct': 0.01231462282366181, 'atr_max_pct': 0.07484407673385034, 'tp_mult': 2.006777168299324, 'tsl_mult': 0.6425973582963362, 'strategy': 'mean_reversion', 'time_stop': 294, 'use_sma': False, 'use_atr': False, 'use_adx': False, 'use_ema': False, 'use_spike': False, 'rsi_required': False, 'edge_k': 1.9526785193089624, 'edge_cap': 0.8435717758733163}.
[I 2025-08-29 22:53:11,374] Trial 674 finished with values: [-1000000000.0, 1000000000.0] and parameters: {'p_sma': 29, 'p_std': 7, 'p_atr': 12, 'p_adx': 12, 'rsi_period': 67, 'ema1': 30, 'ema2': 25, 'slip_atr_k': 0.13821566851192618, 'slip_spread_k': 0.265624718572732, 'spread_hl_frac': 0.008058180604105111, 'bb_std_mult': 3.375265832562688, 'rsi_os': 34, 'rsi_ob': 64, 'vol_spike': 0.25351774270571803, 'adx_thresh': 30.8991827246316, 'atr_min_pct': 0.012319253050815257, 'atr_max_pct': 0.015555190317940365, 'tp_mult': 2.0097426544855126, 'tsl_mult': 0.5943401273694227, 'strategy': 'mean_reversion', 'time_stop': 270, 'use_sma': False, 'use_atr': False, 'use_adx': False, 'use_ema': False, 'use_spike': False, 'rsi_required': False, 'edge_k': 1.851922435216355, 'edge_cap': 0.9688818826511357}.
[I 2025-08-29 22:53:11,518] Trial 675 finished with values: [-1000000000.0, 1000000000.0] and parameters: {'p_sma': 40, 'p_std': 16, 'p_atr': 13, 'p_adx': 12, 'rsi_period': 15, 'ema1': 13, 'ema2': 18, 'slip_atr_k': 0.0003859848424552458, 'slip_spread_k': 0.2694665239508395, 'spread_hl_frac': 0.010569795021568311, 'bb_std_mult': 1.4618920073014083, 'rsi_os': 6, 'rsi_ob': 64, 'vol_spike': 0.24181440893325867, 'adx_thresh': 30.501376925227653, 'atr_min_pct': 0.012294196102765408, 'atr_max_pct': 0.0748706355602316, 'tp_mult': 1.4945846726513736, 'tsl_mult': 0.6446408467845375, 'strategy': 'mean_reversion', 'time_stop': 268, 'use_sma': False, 'use_atr': False, 'use_adx': False, 'use_ema': False, 'use_spike': False, 'rsi_required': False, 'edge_k': 1.8598025520006396, 'edge_cap': 0.9740144297217668}.
[I 2025-08-29 22:53:38,516] Trial 680 finished with values: [-1000000000.0, 1000000000.0] and parameters: {'p_sma': 40, 'p_std': 16, 'p_atr': 11, 'p_adx': 13, 'rsi_period': 13, 'ema1': 29, 'ema2': 16, 'slip_atr_k': 0.10403226292454783, 'slip_spread_k': 0.3302359075502004, 'spread_hl_frac': 0.010849457834922138, 'bb_std_mult': 2.3538481778831697, 'rsi_os': 36, 'rsi_ob': 62, 'vol_spike': 0.24330646797270067, 'adx_thresh': 19.989240278598952, 'atr_min_pct': 0.009952389756168543, 'atr_max_pct': 0.06694915174252018, 'tp_mult': 1.5109612940729602, 'tsl_mult': 0.6823156723257253, 'strategy': 'mean_reversion', 'time_stop': 278, 'use_sma': False, 'use_atr': False, 'use_adx': False, 'use_ema': False, 'use_spike': False, 'rsi_required': False, 'edge_k': 1.9999327213336147, 'edge_cap': 0.3792791004362944}.
[I 2025-08-29 22:53:38,539] Trial 678 finished with values: [-1000000000.0, 1000000000.0] and parameters: {'p_sma': 27, 'p_std': 11, 'p_atr': 11, 'p_adx': 14, 'rsi_period': 15, 'ema1': 30, 'ema2': 18, 'slip_atr_k': 0.004480616154049458, 'slip_spread_k': 0.27198712114350443, 'spread_hl_frac': 0.008221001809075418, 'bb_std_mult': 2.1981196804067222, 'rsi_os': 39, 'rsi_ob': 63, 'vol_spike': 0.18062589506411247, 'adx_thresh': 19.674920507948915, 'atr_min_pct': 0.012652944330069275, 'atr_max_pct': 0.04608966252779885, 'tp_mult': 2.333160871476364, 'tsl_mult': 0.6633864647513952, 'strategy': 'mean_reversion', 'time_stop': 289, 'use_sma': False, 'use_atr': False, 'use_adx': False, 'use_ema': False, 'use_spike': False, 'rsi_required': False, 'edge_k': 1.9587702452972855, 'edge_cap': 0.14096890179745664}.
[I 2025-08-29 22:53:38,814] Trial 681 finished with values: [-0.004763305361722314, 0.004811836282880997] and parameters: {'p_sma': 26, 'p_std': 11, 'p_atr': 11, 'p_adx': 14, 'rsi_period': 12, 'ema1': 29, 'ema2': 20, 'slip_atr_k': 0.13104347217860807, 'slip_spread_k': 0.3238657879335739, 'spread_hl_frac': 0.01181019093687804, 'bb_std_mult': 2.361850659273294, 'rsi_os': 36, 'rsi_ob': 85, 'vol_spike': 0.26156717931350254, 'adx_thresh': 20.22487476931507, 'atr_min_pct': 0.0051103445567319185, 'atr_max_pct': 0.06239567659641301, 'tp_mult': 1.9395074709548394, 'tsl_mult': 0.6731381863158324, 'strategy': 'mean_reversion', 'time_stop': 290, 'use_sma': False, 'use_atr': False, 'use_adx': False, 'use_ema': False, 'use_spike': False, 'rsi_required': False, 'edge_k': 1.9992845311957113, 'edge_cap': 0.3779853675299222}.
[I 2025-08-29 22:53:38,933] Trial 679 finished with values: [-1000000000.0, 1000000000.0] and parameters: {'p_sma': 40, 'p_std': 15, 'p_atr': 11, 'p_adx': 14, 'rsi_period': 15, 'ema1': 28, 'ema2': 20, 'slip_atr_k': 0.004828592558278562, 'slip_spread_k': 0.32410416828849126, 'spread_hl_frac': 0.01082866026697735, 'bb_std_mult': 0.696016820074158, 'rsi_os': 6, 'rsi_ob': 63, 'vol_spike': 0.2616239177646296, 'adx_thresh': 30.736851590916245, 'atr_min_pct': 0.009924618351472778, 'atr_max_pct': 0.06683783600900213, 'tp_mult': 1.9334969834180658, 'tsl_mult': 0.5938086821398629, 'strategy': 'mean_reversion', 'time_stop': 289, 'use_sma': False, 'use_atr': False, 'use_adx': False, 'use_ema': False, 'use_spike': False, 'rsi_required': False, 'edge_k': 1.857245387952247, 'edge_cap': 0.7309017528477602}.
[I 2025-08-29 22:54:06,182] Trial 682 finished with values: [-1000000000.0, 1000000000.0] and parameters: {'p_sma': 56, 'p_std': 29, 'p_atr': 12, 'p_adx': 15, 'rsi_period': 10, 'ema1': 28, 'ema2': 20, 'slip_atr_k': 0.0001926545711175309, 'slip_spread_k': 0.3064549854625877, 'spread_hl_frac': 0.012365298758530196, 'bb_std_mult': 1.7098353915039897, 'rsi_os': 19, 'rsi_ob': 86, 'vol_spike': 0.13517072155201834, 'adx_thresh': 21.93905479907034, 'atr_min_pct': 0.023780486348461166, 'atr_max_pct': 0.0625043559367186, 'tp_mult': 2.2522853548983734, 'tsl_mult': 0.6115901326362685, 'strategy': 'breakout', 'time_stop': 43, 'use_sma': False, 'use_atr': False, 'use_adx': False, 'use_ema': False, 'use_spike': False, 'rsi_required': False, 'edge_k': 1.9459713910611665, 'edge_cap': 0.7139979185974974}.
[I 2025-08-29 22:54:06,671] Trial 684 finished with values: [-1000000000.0, 1000000000.0] and parameters: {'p_sma': 23, 'p_std': 45, 'p_atr': 12, 'p_adx': 15, 'rsi_period': 10, 'ema1': 12, 'ema2': 24, 'slip_atr_k': 0.09346304043878471, 'slip_spread_k': 0.3088717880709252, 'spread_hl_frac': 0.024079281335159304, 'bb_std_mult': 2.574317095566321, 'rsi_os': 21, 'rsi_ob': 62, 'vol_spike': 0.13496572008397667, 'adx_thresh': 21.960248509049368, 'atr_min_pct': 0.011295556273842306, 'atr_max_pct': 0.0668107153260051, 'tp_mult': 1.7712505929073359, 'tsl_mult': 0.6199225532194018, 'strategy': 'breakout', 'time_stop': 283, 'use_sma': False, 'use_atr': False, 'use_adx': False, 'use_ema': False, 'use_spike': False, 'rsi_required': False, 'edge_k': 1.9443259000164366, 'edge_cap': 0.08343899728313206}.
[I 2025-08-29 22:54:06,850] Trial 683 finished with values: [-1000000000.0, 1000000000.0] and parameters: {'p_sma': 23, 'p_std': 29, 'p_atr': 12, 'p_adx': 15, 'rsi_period': 10, 'ema1': 28, 'ema2': 20, 'slip_atr_k': 0.09230789938829767, 'slip_spread_k': 0.2909718922225606, 'spread_hl_frac': 0.024041351720670196, 'bb_std_mult': 0.6866740640139027, 'rsi_os': 33, 'rsi_ob': 62, 'vol_spike': 0.1335302957619798, 'adx_thresh': 21.691569407861667, 'atr_min_pct': 0.014903555215442774, 'atr_max_pct': 0.06252542957309562, 'tp_mult': 2.5565843204802636, 'tsl_mult': 0.12919215381458266, 'strategy': 'breakout', 'time_stop': 284, 'use_sma': False, 'use_atr': False, 'use_adx': False, 'use_ema': False, 'use_spike': False, 'rsi_required': False, 'edge_k': 1.9540256068770816, 'edge_cap': 0.1734944149572748}.
[I 2025-08-29 22:54:06,863] Trial 685 finished with values: [-1000000000.0, 1000000000.0] and parameters: {'p_sma': 23, 'p_std': 29, 'p_atr': 12, 'p_adx': 15, 'rsi_period': 12, 'ema1': 30, 'ema2': 24, 'slip_atr_k': 2.711522933038598e-05, 'slip_spread_k': 0.29052967842271765, 'spread_hl_frac': 0.02411998419616826, 'bb_std_mult': 2.5789363905261316, 'rsi_os': 32, 'rsi_ob': 61, 'vol_spike': 0.2481947670848378, 'adx_thresh': 22.009465136251595, 'atr_min_pct': 0.011131207631319157, 'atr_max_pct': 0.08543378075127209, 'tp_mult': 2.172855109699307, 'tsl_mult': 0.6208988281805515, 'strategy': 'breakout', 'time_stop': 282, 'use_sma': False, 'use_atr': False, 'use_adx': False, 'use_ema': False, 'use_spike': False, 'rsi_required': False, 'edge_k': 1.9420358111664935, 'edge_cap': 0.16702637022507538}.
[I 2025-08-29 22:54:34,716] Trial 687 finished with values: [-1000000000.0, 1000000000.0] and parameters: {'p_sma': 58, 'p_std': 12, 'p_atr': 13, 'p_adx': 13, 'rsi_period': 49, 'ema1': 30, 'ema2': 22, 'slip_atr_k': 0.014088967128035697, 'slip_spread_k': 0.2893493866535379, 'spread_hl_frac': 0.01387736469242493, 'bb_std_mult': 1.2095826674222765, 'rsi_os': 32, 'rsi_ob': 61, 'vol_spike': 0.10597300750652916, 'adx_thresh': 20.709757276656838, 'atr_min_pct': 0.018615047468585687, 'atr_max_pct': 0.08870003582107612, 'tp_mult': 2.048781710734553, 'tsl_mult': 0.21271698713544268, 'strategy': 'mean_reversion', 'time_stop': 276, 'use_sma': False, 'use_atr': False, 'use_adx': False, 'use_ema': False, 'use_spike': False, 'rsi_required': False, 'edge_k': 1.8907768645654341, 'edge_cap': 0.6687029463668281}.
[I 2025-08-29 22:54:34,914] Trial 688 finished with values: [-1000000000.0, 1000000000.0] and parameters: {'p_sma': 59, 'p_std': 24, 'p_atr': 13, 'p_adx': 13, 'rsi_period': 18, 'ema1': 11, 'ema2': 17, 'slip_atr_k': 0.1645802686275248, 'slip_spread_k': 0.2409444429479754, 'spread_hl_frac': 0.01276258207803679, 'bb_std_mult': 0.5825002446433887, 'rsi_os': 33, 'rsi_ob': 61, 'vol_spike': 0.25748057936374097, 'adx_thresh': 8.21381109258207, 'atr_min_pct': 0.018302641080968227, 'atr_max_pct': 0.10134851755120255, 'tp_mult': 1.2636683717334947, 'tsl_mult': 0.027224300917305932, 'strategy': 'mean_reversion', 'time_stop': 128, 'use_sma': False, 'use_atr': False, 'use_adx': False, 'use_ema': False, 'use_spike': False, 'rsi_required': False, 'edge_k': 1.8893952045607494, 'edge_cap': 0.665594978924727}.
[I 2025-08-29 22:54:34,914] Trial 689 finished with values: [-1000000000.0, 1000000000.0] and parameters: {'p_sma': 59, 'p_std': 10, 'p_atr': 13, 'p_adx': 13, 'rsi_period': 42, 'ema1': 29, 'ema2': 17, 'slip_atr_k': 0.014202584603258824, 'slip_spread_k': 0.23853147396480368, 'spread_hl_frac': 0.0474407308894384, 'bb_std_mult': 1.896865468520604, 'rsi_os': 16, 'rsi_ob': 88, 'vol_spike': 0.25574236889722896, 'adx_thresh': 12.99211482943118, 'atr_min_pct': 0.018521858498382213, 'atr_max_pct': 0.10149779116478683, 'tp_mult': 2.051367952464804, 'tsl_mult': 0.020990084092002315, 'strategy': 'mean_reversion', 'time_stop': 276, 'use_sma': False, 'use_atr': False, 'use_adx': False, 'use_ema': False, 'use_spike': False, 'rsi_required': False, 'edge_k': 1.890975987830827, 'edge_cap': 0.31983527952015006}.
[I 2025-08-29 22:54:34,988] Trial 686 finished with values: [-1000000000.0, 1000000000.0] and parameters: {'p_sma': 23, 'p_std': 12, 'p_atr': 12, 'p_adx': 13, 'rsi_period': 10, 'ema1': 12, 'ema2': 24, 'slip_atr_k': 0.011699734738841944, 'slip_spread_k': 0.29166471830947593, 'spread_hl_frac': 0.013407312842650478, 'bb_std_mult': 1.5580504286744594, 'rsi_os': 32, 'rsi_ob': 61, 'vol_spike': 0.05690077512008468, 'adx_thresh': 20.62327212460689, 'atr_min_pct': 0.01481009197409111, 'atr_max_pct': 0.10001484716122103, 'tp_mult': 1.2613220690801525, 'tsl_mult': 0.6213676898831575, 'strategy': 'mean_reversion', 'time_stop': 134, 'use_sma': False, 'use_atr': False, 'use_adx': False, 'use_ema': False, 'use_spike': False, 'rsi_required': False, 'edge_k': 1.8916406545288647, 'edge_cap': 0.6703170342687541}.
[I 2025-08-29 22:54:35,230] Trial 693 finished with values: [-1000000000.0, 1000000000.0] and parameters: {'p_sma': 43, 'p_std': 13, 'p_atr': 11, 'p_adx': 28, 'rsi_period': 12, 'ema1': 30, 'ema2': 54, 'slip_atr_k': 0.00528911807178884, 'slip_spread_k': 0.32440238658942355, 'spread_hl_frac': 0.011249772800699921, 'bb_std_mult': 1.808520055327061, 'rsi_os': 40, 'rsi_ob': 50, 'vol_spike': 0.2493093431078937, 'adx_thresh': 19.0741496519091, 'atr_min_pct': 0.017333672785039136, 'atr_max_pct': 0.03716686332982554, 'tp_mult': 1.7269150232408736, 'tsl_mult': 0.5982248277870288, 'strategy': 'mean_reversion', 'time_stop': 286, 'use_sma': False, 'use_atr': False, 'use_adx': False, 'use_ema': False, 'use_spike': False, 'rsi_required': False, 'edge_k': 1.9626759432031582, 'edge_cap': 0.1981027236445962}.
[I 2025-08-29 22:54:35,232] Trial 691 finished with values: [-1000000000.0, 1000000000.0] and parameters: {'p_sma': 28, 'p_std': 13, 'p_atr': 11, 'p_adx': 28, 'rsi_period': 13, 'ema1': 30, 'ema2': 27, 'slip_atr_k': 0.2252553594405361, 'slip_spread_k': 0.27746573817193704, 'spread_hl_frac': 0.027961475967538778, 'bb_std_mult': 1.7793793360768073, 'rsi_os': 37, 'rsi_ob': 50, 'vol_spike': 0.011635804790347287, 'adx_thresh': 26.62031381517158, 'atr_min_pct': 0.015540539329854641, 'atr_max_pct': 0.07767917843093261, 'tp_mult': 1.7221084969543978, 'tsl_mult': 0.050867225513637315, 'strategy': 'mean_reversion', 'time_stop': 294, 'use_sma': False, 'use_atr': False, 'use_adx': False, 'use_ema': False, 'use_spike': False, 'rsi_required': False, 'edge_k': 1.9603889090847524, 'edge_cap': 0.19697784045046746}.
[I 2025-08-29 22:54:35,244] Trial 690 finished with values: [-1000000000.0, 1000000000.0] and parameters: {'p_sma': 13, 'p_std': 24, 'p_atr': 13, 'p_adx': 13, 'rsi_period': 18, 'ema1': 14, 'ema2': 27, 'slip_atr_k': 0.008037437964020644, 'slip_spread_k': 0.2517874680385889, 'spread_hl_frac': 0.012743566325141106, 'bb_std_mult': 1.7942517512206084, 'rsi_os': 35, 'rsi_ob': 50, 'vol_spike': 0.2562006885520194, 'adx_thresh': 21.02876305574125, 'atr_min_pct': 0.015574787120443053, 'atr_max_pct': 0.02978306670827844, 'tp_mult': 2.410368998089637, 'tsl_mult': 0.6044266700967549, 'strategy': 'mean_reversion', 'time_stop': 292, 'use_sma': False, 'use_atr': False, 'use_adx': False, 'use_ema': False, 'use_spike': False, 'rsi_required': False, 'edge_k': 1.8784692394962024, 'edge_cap': 0.20279411391032728}.
[I 2025-08-29 22:54:35,580] Trial 696 finished with values: [-1000000000.0, 1000000000.0] and parameters: {'p_sma': 18, 'p_std': 9, 'p_atr': 12, 'p_adx': 14, 'rsi_period': 39, 'ema1': 29, 'ema2': 15, 'slip_atr_k': 0.004987415542744093, 'slip_spread_k': 0.25852985910912313, 'spread_hl_frac': 0.009459652711177918, 'bb_std_mult': 3.3200590928537927, 'rsi_os': 51, 'rsi_ob': 65, 'vol_spike': 0.2993038604035253, 'adx_thresh': 21.3707397830756, 'atr_min_pct': 0.0038708263175846296, 'atr_max_pct': 0.07149220371047901, 'tp_mult': 1.015692946223451, 'tsl_mult': 0.652558115843661, 'strategy': 'mean_reversion', 'time_stop': 51, 'use_sma': False, 'use_atr': False, 'use_adx': False, 'use_ema': False, 'use_spike': False, 'rsi_required': False, 'edge_k': 1.920248576470613, 'edge_cap': 0.812700447680032}.
[I 2025-08-29 22:55:00,093] Trial 692 finished with values: [-0.0015183317368310245, 0.0015007847282320322] and parameters: {'p_sma': 17, 'p_std': 13, 'p_atr': 11, 'p_adx': 14, 'rsi_period': 13, 'ema1': 30, 'ema2': 25, 'slip_atr_k': 0.004683611072068037, 'slip_spread_k': 0.25314840477504597, 'spread_hl_frac': 0.011593738599465353, 'bb_std_mult': 2.0874271543050944, 'rsi_os': 37, 'rsi_ob': 84, 'vol_spike': 0.012168638967866907, 'adx_thresh': 21.091166887610598, 'atr_min_pct': 0.0038036372302863823, 'atr_max_pct': 0.09437168335538994, 'tp_mult': 2.4265338361003987, 'tsl_mult': 0.8030041406441577, 'strategy': 'mean_reversion', 'time_stop': 296, 'use_sma': False, 'use_atr': False, 'use_adx': False, 'use_ema': False, 'use_spike': False, 'rsi_required': False, 'edge_k': 1.9605045464174997, 'edge_cap': 0.1974153681963427}.
[I 2025-08-29 22:55:01,842] Trial 694 finished with values: [-1000000000.0, 1000000000.0] and parameters: {'p_sma': 32, 'p_std': 48, 'p_atr': 12, 'p_adx': 10, 'rsi_period': 39, 'ema1': 29, 'ema2': 15, 'slip_atr_k': 0.008014378046043925, 'slip_spread_k': 0.25702243598512925, 'spread_hl_frac': 0.02019754649405487, 'bb_std_mult': 1.0730817365236849, 'rsi_os': 13, 'rsi_ob': 65, 'vol_spike': 0.2606340951511135, 'adx_thresh': 23.557723781331397, 'atr_min_pct': 0.0039360121820795416, 'atr_max_pct': 0.0721680450609563, 'tp_mult': 2.4329675887172577, 'tsl_mult': 0.8117115743619441, 'strategy': 'mean_reversion', 'time_stop': 294, 'use_sma': False, 'use_atr': False, 'use_adx': False, 'use_ema': False, 'use_spike': False, 'rsi_required': False, 'edge_k': 1.9322654784879063, 'edge_cap': 0.7767448575785724}.
[I 2025-08-29 22:55:01,984] Trial 695 finished with values: [-1000000000.0, 1000000000.0] and parameters: {'p_sma': 14, 'p_std': 10, 'p_atr': 12, 'p_adx': 10, 'rsi_period': 78, 'ema1': 29, 'ema2': 50, 'slip_atr_k': 0.00582951373858238, 'slip_spread_k': 0.2557657120065912, 'spread_hl_frac': 0.02550100117587875, 'bb_std_mult': 1.6283310113481546, 'rsi_os': 12, 'rsi_ob': 63, 'vol_spike': 0.26076446655036417, 'adx_thresh': 21.02667401734985, 'atr_min_pct': 0.006612626070789237, 'atr_max_pct': 0.029647634796185797, 'tp_mult': 2.4111467478084894, 'tsl_mult': 0.357902951407577, 'strategy': 'mean_reversion', 'time_stop': 294, 'use_sma': False, 'use_atr': False, 'use_adx': False, 'use_ema': False, 'use_spike': False, 'rsi_required': False, 'edge_k': 1.9988814114963969, 'edge_cap': 0.9308987779803036}.
[I 2025-08-29 22:55:02,713] Trial 697 finished with values: [-0.022471052458371887, 0.02247359246358421] and parameters: {'p_sma': 21, 'p_std': 56, 'p_atr': 12, 'p_adx': 10, 'rsi_period': 72, 'ema1': 30, 'ema2': 21, 'slip_atr_k': 0.003960197990238101, 'slip_spread_k': 0.31200739742930994, 'spread_hl_frac': 0.011890924647726323, 'bb_std_mult': 2.0743968831737356, 'rsi_os': 46, 'rsi_ob': 91, 'vol_spike': 0.1572366006252053, 'adx_thresh': 19.704266026040568, 'atr_min_pct': 1.938845461800249e-05, 'atr_max_pct': 0.09585599706182127, 'tp_mult': 1.3836583274200134, 'tsl_mult': 0.7957733010871413, 'strategy': 'mean_reversion', 'time_stop': 76, 'use_sma': False, 'use_atr': False, 'use_adx': False, 'use_ema': False, 'use_spike': False, 'rsi_required': False, 'edge_k': 1.9999966210964866, 'edge_cap': 0.9250778204533999}.
[I 2025-08-29 22:55:30,396] Trial 698 finished with values: [-0.0075418807227434215, 0.007532028925904112] and parameters: {'p_sma': 16, 'p_std': 44, 'p_atr': 15, 'p_adx': 12, 'rsi_period': 11, 'ema1': 17, 'ema2': 21, 'slip_atr_k': 0.00016816319757665825, 'slip_spread_k': 0.2713702299967462, 'spread_hl_frac': 0.025545422041202005, 'bb_std_mult': 2.0773672048464045, 'rsi_os': 46, 'rsi_ob': 91, 'vol_spike': 0.262195796258941, 'adx_thresh': 19.70853324434332, 'atr_min_pct': 2.06185216567005e-05, 'atr_max_pct': 0.0725288575557418, 'tp_mult': 1.831051085477784, 'tsl_mult': 0.8013767375909187, 'strategy': 'breakout', 'time_stop': 295, 'use_sma': False, 'use_atr': False, 'use_adx': False, 'use_ema': False, 'use_spike': False, 'rsi_required': False, 'edge_k': 1.8179245955549677, 'edge_cap': 0.18304431022337356}.
[I 2025-08-29 22:55:30,567] Trial 701 finished with values: [-1000000000.0, 1000000000.0] and parameters: {'p_sma': 17, 'p_std': 14, 'p_atr': 15, 'p_adx': 12, 'rsi_period': 11, 'ema1': 30, 'ema2': 22, 'slip_atr_k': 0.00035538973928044004, 'slip_spread_k': 0.34027440953955906, 'spread_hl_frac': 0.011537256781461773, 'bb_std_mult': 1.4408601694833214, 'rsi_os': 34, 'rsi_ob': 60, 'vol_spike': 0.1261015271020815, 'adx_thresh': 5.047520972309773, 'atr_min_pct': 0.020054822671397392, 'atr_max_pct': 0.05307970445768828, 'tp_mult': 1.6335085043629431, 'tsl_mult': 0.6376434739404403, 'strategy': 'breakout', 'time_stop': 278, 'use_sma': False, 'use_atr': False, 'use_adx': False, 'use_ema': False, 'use_spike': False, 'rsi_required': False, 'edge_k': 0.7888754286644853, 'edge_cap': 0.17564228234673743}.
[I 2025-08-29 22:55:30,713] Trial 699 finished with values: [-1000000000.0, 1000000000.0] and parameters: {'p_sma': 31, 'p_std': 8, 'p_atr': 15, 'p_adx': 14, 'rsi_period': 76, 'ema1': 17, 'ema2': 21, 'slip_atr_k': 0.004009327980015893, 'slip_spread_k': 0.3393123984840249, 'spread_hl_frac': 0.011644997966093055, 'bb_std_mult': 2.0643626941425444, 'rsi_os': 45, 'rsi_ob': 63, 'vol_spike': 0.24912917799691764, 'adx_thresh': 19.681136761575903, 'atr_min_pct': 0.020092707502942512, 'atr_max_pct': 0.10905011755651334, 'tp_mult': 1.5873094473409157, 'tsl_mult': 0.6930179057167742, 'strategy': 'breakout', 'time_stop': 76, 'use_sma': False, 'use_atr': False, 'use_adx': False, 'use_ema': False, 'use_spike': False, 'rsi_required': False, 'edge_k': 1.833358511675215, 'edge_cap': 0.16907633377178827}.
[I 2025-08-29 22:55:30,842] Trial 700 finished with values: [-1000000000.0, 1000000000.0] and parameters: {'p_sma': 26, 'p_std': 12, 'p_atr': 15, 'p_adx': 16, 'rsi_period': 11, 'ema1': 17, 'ema2': 21, 'slip_atr_k': 0.000489601291117126, 'slip_spread_k': 0.3130744925683766, 'spread_hl_frac': 0.04384301074080563, 'bb_std_mult': 1.4251760274760361, 'rsi_os': 18, 'rsi_ob': 62, 'vol_spike': 0.19953204534790164, 'adx_thresh': 19.59263398929031, 'atr_min_pct': 0.0076348778520744145, 'atr_max_pct': 0.09477512907427343, 'tp_mult': 1.5726102967034836, 'tsl_mult': 0.6654462978807921, 'strategy': 'breakout', 'time_stop': 276, 'use_sma': False, 'use_atr': False, 'use_adx': False, 'use_ema': False, 'use_spike': False, 'rsi_required': False, 'edge_k': 1.8004570686512267, 'edge_cap': 0.1831418555962473}.
