[I 2025-08-29 23:04:24,755] Trial 783 finished with values: [-0.01827872540595732, 0.018266557472046505] and parameters: {'p_sma': 41, 'p_std': 49, 'p_atr': 13, 'p_adx': 10, 'rsi_period': 9, 'ema1': 30, 'ema2': 57, 'slip_atr_k': 0.14116854402203105, 'slip_spread_k': 0.26944792261470835, 'spread_hl_frac': 0.006755354311955151, 'bb_std_mult': 1.4663084974104652, 'rsi_os': 14, 'rsi_ob': 66, 'vol_spike': 0.11285884547783752, 'adx_thresh': 21.343015550741516, 'atr_min_pct': 0.0006361323324836164, 'atr_max_pct': 0.07104095107268715, 'tp_mult': 2.1424602802590496, 'tsl_mult': 0.05040395523622415, 'strategy': 'mean_reversion', 'time_stop': 290, 'use_sma': False, 'use_atr': False, 'use_adx': False, 'use_ema': False, 'use_spike': False, 'rsi_required': False, 'edge_k': 1.8813284434481843, 'edge_cap': 0.6537849429592192}.
[I 2025-08-29 23:04:24,798] Trial 784 finished with values: [-0.04674270937421532, 0.046730777713583124] and parameters: {'p_sma': 26, 'p_std': 28, 'p_atr': 12, 'p_adx': 10, 'rsi_period': 10, 'ema1': 30, 'ema2': 57, 'slip_atr_k': 0.153484270797578, 'slip_spread_k': 0.2701649128898023, 'spread_hl_frac': 0.015855299715032842, 'bb_std_mult': 1.3955977426615862, 'rsi_os': 31, 'rsi_ob': 62, 'vol_spike': 0.11190461041878909, 'adx_thresh': 21.10071107840524, 'atr_min_pct': 0.0007432743390561655, 'atr_max_pct': 0.07315617702213573, 'tp_mult': 1.9627079833366186, 'tsl_mult': 0.6203658160962711, 'strategy': 'mean_reversion', 'time_stop': 294, 'use_sma': False, 'use_atr': False, 'use_adx': False, 'use_ema': False, 'use_spike': False, 'rsi_required': False, 'edge_k': 1.8828598436755646, 'edge_cap': 0.32119483985579944}.
[I 2025-08-29 23:04:25,032] Trial 786 finished with values: [-0.01322141269318855, 0.013209945168220124] and parameters: {'p_sma': 8, 'p_std': 14, 'p_atr': 12, 'p_adx': 10, 'rsi_period': 10, 'ema1': 30, 'ema2': 23, 'slip_atr_k': 0.0979085654415113, 'slip_spread_k': 0.4249510420250091, 'spread_hl_frac': 0.029830729831286394, 'bb_std_mult': 1.3680482688302573, 'rsi_os': 18, 'rsi_ob': 92, 'vol_spike': 0.1878789852749192, 'adx_thresh': 26.694152583015132, 'atr_min_pct': 0.0009441578044574392, 'atr_max_pct': 0.054512979589085936, 'tp_mult': 1.9275357856413013, 'tsl_mult': 0.6082328830595425, 'strategy': 'mean_reversion', 'time_stop': 217, 'use_sma': False, 'use_atr': False, 'use_adx': False, 'use_ema': False, 'use_spike': False, 'rsi_required': False, 'edge_k': 1.9449520242473952, 'edge_cap': 0.3932929753316757}.
[I 2025-08-29 23:04:25,130] Trial 785 finished with values: [-0.004283192936607505, 0.004531112831252502] and parameters: {'p_sma': 25, 'p_std': 28, 'p_atr': 12, 'p_adx': 10, 'rsi_period': 9, 'ema1': 30, 'ema2': 51, 'slip_atr_k': 0.09829654383665251, 'slip_spread_k': 0.4105021894894222, 'spread_hl_frac': 0.04979981925353778, 'bb_std_mult': 1.322737188339716, 'rsi_os': 14, 'rsi_ob': 92, 'vol_spike': 0.045562016010752035, 'adx_thresh': 15.30982942008917, 'atr_min_pct': 0.0034419550369473124, 'atr_max_pct': 0.05481110731859612, 'tp_mult': 1.9177784539334282, 'tsl_mult': 0.04704787771810809, 'strategy': 'mean_reversion', 'time_stop': 300, 'use_sma': False, 'use_atr': False, 'use_adx': False, 'use_ema': False, 'use_spike': False, 'rsi_required': False, 'edge_k': 1.940004993954135, 'edge_cap': 0.6471076772898142}.
[I 2025-08-29 23:04:52,827] Trial 789 finished with values: [-1000000000.0, 1000000000.0] and parameters: {'p_sma': 33, 'p_std': 12, 'p_atr': 12, 'p_adx': 13, 'rsi_period': 12, 'ema1': 29, 'ema2': 20, 'slip_atr_k': 0.00890736310247247, 'slip_spread_k': 0.2388563478925686, 'spread_hl_frac': 0.00932215143627061, 'bb_std_mult': 1.322238419474188, 'rsi_os': 33, 'rsi_ob': 62, 'vol_spike': 0.035324566313809994, 'adx_thresh': 20.96674936951954, 'atr_min_pct': 0.019127430528194753, 'atr_max_pct': 0.08530689995264397, 'tp_mult': 1.8556108959383644, 'tsl_mult': 0.6056758267730852, 'strategy': 'breakout', 'time_stop': 170, 'use_sma': False, 'use_atr': False, 'use_adx': False, 'use_ema': False, 'use_spike': False, 'rsi_required': False, 'edge_k': 1.9536883109092495, 'edge_cap': 0.80304442617104}.
[I 2025-08-29 23:04:53,037] Trial 790 finished with values: [-1000000000.0, 1000000000.0] and parameters: {'p_sma': 33, 'p_std': 13, 'p_atr': 12, 'p_adx': 20, 'rsi_period': 13, 'ema1': 29, 'ema2': 20, 'slip_atr_k': 0.22871138010229283, 'slip_spread_k': 0.23736484214327308, 'spread_hl_frac': 0.04807723402116563, 'bb_std_mult': 1.35519232777248, 'rsi_os': 33, 'rsi_ob': 87, 'vol_spike': 0.15137087147817355, 'adx_thresh': 18.06856699327037, 'atr_min_pct': 0.0174620918261063, 'atr_max_pct': 0.0321000915508322, 'tp_mult': 1.8626583731905693, 'tsl_mult': 0.609781640590115, 'strategy': 'breakout', 'time_stop': 284, 'use_sma': False, 'use_atr': False, 'use_adx': False, 'use_ema': False, 'use_spike': False, 'rsi_required': False, 'edge_k': 1.9615425917307323, 'edge_cap': 0.14851002027558147}.
[I 2025-08-29 23:04:53,037] Trial 788 finished with values: [-1000000000.0, 1000000000.0] and parameters: {'p_sma': 31, 'p_std': 14, 'p_atr': 12, 'p_adx': 13, 'rsi_period': 12, 'ema1': 20, 'ema2': 23, 'slip_atr_k': 9.114890121271783e-06, 'slip_spread_k': 0.231606822492388, 'spread_hl_frac': 0.049860165296451917, 'bb_std_mult': 1.3292529372672486, 'rsi_os': 55, 'rsi_ob': 90, 'vol_spike': 0.23208638681570518, 'adx_thresh': 21.11319663125206, 'atr_min_pct': 0.016729888005212867, 'atr_max_pct': 0.017115177342282753, 'tp_mult': 1.9346989619354429, 'tsl_mult': 0.9689267137586641, 'strategy': 'breakout', 'time_stop': 284, 'use_sma': False, 'use_atr': False, 'use_adx': False, 'use_ema': False, 'use_spike': False, 'rsi_required': False, 'edge_k': 1.9536841265415958, 'edge_cap': 0.18346739333449888}.
[I 2025-08-29 23:04:53,164] Trial 787 finished with values: [-1000000000.0, 1000000000.0] and parameters: {'p_sma': 31, 'p_std': 41, 'p_atr': 12, 'p_adx': 16, 'rsi_period': 13, 'ema1': 29, 'ema2': 23, 'slip_atr_k': 0.22747372903325905, 'slip_spread_k': 0.4118459970720117, 'spread_hl_frac': 0.009337341855474024, 'bb_std_mult': 1.327954800682342, 'rsi_os': 38, 'rsi_ob': 45, 'vol_spike': 0.24021595016841377, 'adx_thresh': 25.435626382143504, 'atr_min_pct': 0.023051241431066856, 'atr_max_pct': 0.0315002515882849, 'tp_mult': 1.926542913200311, 'tsl_mult': 0.6053326122294597, 'strategy': 'breakout', 'time_stop': 217, 'use_sma': False, 'use_atr': False, 'use_adx': False, 'use_ema': False, 'use_spike': False, 'rsi_required': False, 'edge_k': 1.9487861102988338, 'edge_cap': 0.1748674548615698}.
[I 2025-08-29 23:04:53,413] Trial 791 finished with values: [-1000000000.0, 1000000000.0] and parameters: {'p_sma': 30, 'p_std': 13, 'p_atr': 12, 'p_adx': 16, 'rsi_period': 12, 'ema1': 29, 'ema2': 15, 'slip_atr_k': 0.213752384060012, 'slip_spread_k': 0.31652257173877657, 'spread_hl_frac': 0.021962937329769797, 'bb_std_mult': 1.383465172276512, 'rsi_os': 55, 'rsi_ob': 88, 'vol_spike': 0.2431456233330725, 'adx_thresh': 21.39325583605539, 'atr_min_pct': 0.009323488312659646, 'atr_max_pct': 0.027658600677503788, 'tp_mult': 1.9947740259935676, 'tsl_mult': 0.6416775497484245, 'strategy': 'mean_reversion', 'time_stop': 285, 'use_sma': False, 'use_atr': False, 'use_adx': False, 'use_ema': False, 'use_spike': False, 'rsi_required': False, 'edge_k': 1.691210279292703, 'edge_cap': 0.18720673942801352}.
[I 2025-08-29 23:05:20,589] Trial 792 finished with values: [-1000000000.0, 1000000000.0] and parameters: {'p_sma': 36, 'p_std': 52, 'p_atr': 12, 'p_adx': 16, 'rsi_period': 11, 'ema1': 30, 'ema2': 34, 'slip_atr_k': 0.08900707043969411, 'slip_spread_k': 0.3223956899380864, 'spread_hl_frac': 0.011300398817275747, 'bb_std_mult': 1.414811128402947, 'rsi_os': 37, 'rsi_ob': 61, 'vol_spike': 0.26538294406246415, 'adx_thresh': 21.54210109789636, 'atr_min_pct': 0.008703807198533853, 'atr_max_pct': 0.07586820990252705, 'tp_mult': 2.000866805322226, 'tsl_mult': 0.638962406975219, 'strategy': 'mean_reversion', 'time_stop': 148, 'use_sma': False, 'use_atr': False, 'use_adx': False, 'use_ema': False, 'use_spike': False, 'rsi_required': False, 'edge_k': 1.9092353581906818, 'edge_cap': 0.21532537458300355}.
[I 2025-08-29 23:05:21,031] Trial 795 finished with values: [-0.0004709060657714925, 0.0009406768259025823] and parameters: {'p_sma': 37, 'p_std': 16, 'p_atr': 12, 'p_adx': 19, 'rsi_period': 38, 'ema1': 30, 'ema2': 47, 'slip_atr_k': 0.005139031960914957, 'slip_spread_k': 0.35949157252738784, 'spread_hl_frac': 0.011286896459005217, 'bb_std_mult': 1.4198468372472461, 'rsi_os': 34, 'rsi_ob': 61, 'vol_spike': 0.25702679917488447, 'adx_thresh': 20.70310376196826, 'atr_min_pct': 0.004463243039872699, 'atr_max_pct': 0.08866277582171327, 'tp_mult': 2.0226817399089994, 'tsl_mult': 0.62654139706611, 'strategy': 'mean_reversion', 'time_stop': 275, 'use_sma': False, 'use_atr': False, 'use_adx': False, 'use_ema': False, 'use_spike': False, 'rsi_required': False, 'edge_k': 1.9097236634829342, 'edge_cap': 0.22906702631982812}.
[I 2025-08-29 23:05:21,161] Trial 793 finished with values: [-1000000000.0, 1000000000.0] and parameters: {'p_sma': 36, 'p_std': 11, 'p_atr': 12, 'p_adx': 16, 'rsi_period': 52, 'ema1': 30, 'ema2': 15, 'slip_atr_k': 0.0052814046129801605, 'slip_spread_k': 0.31791064421122917, 'spread_hl_frac': 0.011376431157177139, 'bb_std_mult': 1.406598695953576, 'rsi_os': 38, 'rsi_ob': 61, 'vol_spike': 0.23795232725814353, 'adx_thresh': 12.176675379804323, 'atr_min_pct': 0.009521009973163078, 'atr_max_pct': 0.07650503941979597, 'tp_mult': 2.005141745039151, 'tsl_mult': 0.6298655417190334, 'strategy': 'mean_reversion', 'time_stop': 270, 'use_sma': False, 'use_atr': False, 'use_adx': False, 'use_ema': False, 'use_spike': False, 'rsi_required': False, 'edge_k': 0.8524081080453646, 'edge_cap': 0.22961302711485368}.
[I 2025-08-29 23:05:21,225] Trial 794 finished with values: [-1000000000.0, 1000000000.0] and parameters: {'p_sma': 6, 'p_std': 53, 'p_atr': 12, 'p_adx': 15, 'rsi_period': 11, 'ema1': 30, 'ema2': 18, 'slip_atr_k': 0.006081597279347109, 'slip_spread_k': 0.31371228248643135, 'spread_hl_frac': 0.043008755267488506, 'bb_std_mult': 1.4143160451337877, 'rsi_os': 37, 'rsi_ob': 59, 'vol_spike': 0.24755445078944222, 'adx_thresh': 21.547836805114095, 'atr_min_pct': 0.009332458447001712, 'atr_max_pct': 0.07622829826140656, 'tp_mult': 2.0258084180160747, 'tsl_mult': 0.6282775046981601, 'strategy': 'mean_reversion', 'time_stop': 147, 'use_sma': False, 'use_atr': False, 'use_adx': False, 'use_ema': False, 'use_spike': False, 'rsi_required': False, 'edge_k': 0.8597063103222472, 'edge_cap': 0.18898086765539185}.
[I 2025-08-29 23:05:48,406] Trial 797 finished with values: [-1000000000.0, 1000000000.0] and parameters: {'p_sma': 15, 'p_std': 25, 'p_atr': 12, 'p_adx': 12, 'rsi_period': 9, 'ema1': 30, 'ema2': 19, 'slip_atr_k': 0.0048937200597638205, 'slip_spread_k': 0.5358290799647389, 'spread_hl_frac': 0.014116388388627492, 'bb_std_mult': 1.4009263754766497, 'rsi_os': 33, 'rsi_ob': 62, 'vol_spike': 0.25998913553365327, 'adx_thresh': 20.396285993153455, 'atr_min_pct': 0.007995610001449136, 'atr_max_pct': 0.03862488572605973, 'tp_mult': 1.8949888667895933, 'tsl_mult': 0.6844819035808978, 'strategy': 'mean_reversion', 'time_stop': 276, 'use_sma': False, 'use_atr': False, 'use_adx': False, 'use_ema': False, 'use_spike': False, 'rsi_required': False, 'edge_k': 0.8576375129198421, 'edge_cap': 0.1446390481944691}.
[I 2025-08-29 23:05:49,091] Trial 798 finished with values: [-1000000000.0, 1000000000.0] and parameters: {'p_sma': 26, 'p_std': 12, 'p_atr': 12, 'p_adx': 15, 'rsi_period': 9, 'ema1': 19, 'ema2': 18, 'slip_atr_k': 0.012810895986119838, 'slip_spread_k': 0.25462977271744125, 'spread_hl_frac': 0.04048818691649875, 'bb_std_mult': 1.278491661235381, 'rsi_os': 33, 'rsi_ob': 63, 'vol_spike': 0.2553110297113044, 'adx_thresh': 20.597771683292077, 'atr_min_pct': 0.008117699218566385, 'atr_max_pct': 0.08983990118251882, 'tp_mult': 2.052811588989356, 'tsl_mult': 0.6561277298268625, 'strategy': 'mean_reversion', 'time_stop': 279, 'use_sma': False, 'use_atr': False, 'use_adx': False, 'use_ema': False, 'use_spike': False, 'rsi_required': False, 'edge_k': 1.88125679310532, 'edge_cap': 0.14449887698140096}.
[I 2025-08-29 23:05:49,252] Trial 799 finished with values: [-0.0016563388223943543, 0.0021403475139357307] and parameters: {'p_sma': 55, 'p_std': 16, 'p_atr': 12, 'p_adx': 12, 'rsi_period': 38, 'ema1': 19, 'ema2': 44, 'slip_atr_k': 0.017230669366628867, 'slip_spread_k': 0.5436173705722553, 'spread_hl_frac': 0.04037191023396993, 'bb_std_mult': 1.315197064641045, 'rsi_os': 33, 'rsi_ob': 63, 'vol_spike': 0.2556530505518277, 'adx_thresh': 23.899958645668786, 'atr_min_pct': 0.003962819128813865, 'atr_max_pct': 0.03939253823947117, 'tp_mult': 1.8942914181160468, 'tsl_mult': 0.685219555723242, 'strategy': 'mean_reversion', 'time_stop': 62, 'use_sma': False, 'use_atr': False, 'use_adx': False, 'use_ema': False, 'use_spike': False, 'rsi_required': False, 'edge_k': 1.874295557691725, 'edge_cap': 0.15268005900319814}.
[I 2025-08-29 23:05:49,550] Trial 796 finished with values: [-1000000000.0, 1000000000.0] and parameters: {'p_sma': 26, 'p_std': 11, 'p_atr': 12, 'p_adx': 12, 'rsi_period': 47, 'ema1': 30, 'ema2': 19, 'slip_atr_k': 0.007503713547391093, 'slip_spread_k': 0.0032243599370709863, 'spread_hl_frac': 0.012527368935023913, 'bb_std_mult': 1.2997433917291896, 'rsi_os': 31, 'rsi_ob': 61, 'vol_spike': 0.25731598146201595, 'adx_thresh': 20.45647028467068, 'atr_min_pct': 0.008004089209489454, 'atr_max_pct': 0.08944222795171347, 'tp_mult': 2.0175624842942925, 'tsl_mult': 0.6791523753563303, 'strategy': 'mean_reversion', 'time_stop': 276, 'use_sma': False, 'use_atr': False, 'use_adx': False, 'use_ema': False, 'use_spike': False, 'rsi_required': False, 'edge_k': 1.8773612223617278, 'edge_cap': 0.22841332825016075}.
[I 2025-08-29 23:06:16,700] Trial 803 finished with values: [-1000000000.0, 1000000000.0] and parameters: {'p_sma': 21, 'p_std': 5, 'p_atr': 12, 'p_adx': 13, 'rsi_period': 19, 'ema1': 11, 'ema2': 44, 'slip_atr_k': 0.017156432389966062, 'slip_spread_k': 0.3716611724962291, 'spread_hl_frac': 0.00472840676874426, 'bb_std_mult': 1.2791921610148638, 'rsi_os': 34, 'rsi_ob': 85, 'vol_spike': 0.25295344594797414, 'adx_thresh': 19.63104229728575, 'atr_min_pct': 0.005716273843625358, 'atr_max_pct': 0.06477904420985936, 'tp_mult': 1.9232101748107093, 'tsl_mult': 0.755465800529814, 'strategy': 'mean_reversion', 'time_stop': 289, 'use_sma': False, 'use_atr': False, 'use_adx': False, 'use_ema': False, 'use_spike': False, 'rsi_required': False, 'edge_k': 1.930050780860474, 'edge_cap': 0.5987893672548644}.
[I 2025-08-29 23:06:17,293] Trial 800 finished with values: [-0.005964749658517565, 0.006120141178029199] and parameters: {'p_sma': 40, 'p_std': 16, 'p_atr': 12, 'p_adx': 13, 'rsi_period': 38, 'ema1': 19, 'ema2': 24, 'slip_atr_k': 0.20624557239554953, 'slip_spread_k': 0.25719894557392375, 'spread_hl_frac': 0.012668727204809374, 'bb_std_mult': 1.2839559157872398, 'rsi_os': 33, 'rsi_ob': 63, 'vol_spike': 0.25507043452710804, 'adx_thresh': 11.080523201050497, 'atr_min_pct': 0.004242505662783251, 'atr_max_pct': 0.06319371211714864, 'tp_mult': 1.972165664114441, 'tsl_mult': 0.998316324106655, 'strategy': 'mean_reversion', 'time_stop': 276, 'use_sma': False, 'use_atr': False, 'use_adx': False, 'use_ema': False, 'use_spike': False, 'rsi_required': False, 'edge_k': 0.5828407206121291, 'edge_cap': 0.7041103346882962}.
[I 2025-08-29 23:06:17,501] Trial 801 finished with values: [-1000000000.0, 1000000000.0] and parameters: {'p_sma': 34, 'p_std': 16, 'p_atr': 12, 'p_adx': 13, 'rsi_period': 80, 'ema1': 11, 'ema2': 47, 'slip_atr_k': 0.019716322058006743, 'slip_spread_k': 0.35513158520605514, 'spread_hl_frac': 0.012524071169701112, 'bb_std_mult': 1.2836761881325698, 'rsi_os': 34, 'rsi_ob': 62, 'vol_spike': 0.2558497767531563, 'adx_thresh': 22.60826988760751, 'atr_min_pct': 0.00451570890792531, 'atr_max_pct': 0.05975259791632478, 'tp_mult': 1.932536921274582, 'tsl_mult': 0.8490241723444167, 'strategy': 'mean_reversion', 'time_stop': 19, 'use_sma': False, 'use_atr': False, 'use_adx': False, 'use_ema': False, 'use_spike': False, 'rsi_required': False, 'edge_k': 1.9965952356259227, 'edge_cap': 0.21065871250883095}.
[I 2025-08-29 23:06:17,599] Trial 802 finished with values: [-0.004074734755932008, 0.0043198219252181865] and parameters: {'p_sma': 21, 'p_std': 9, 'p_atr': 12, 'p_adx': 13, 'rsi_period': 48, 'ema1': 11, 'ema2': 24, 'slip_atr_k': 0.12140801610738766, 'slip_spread_k': 0.3618857475199038, 'spread_hl_frac': 0.01260194551053069, 'bb_std_mult': 1.2869951975837035, 'rsi_os': 34, 'rsi_ob': 62, 'vol_spike': 0.2562134901334247, 'adx_thresh': 22.779664463232617, 'atr_min_pct': 0.004121161579452861, 'atr_max_pct': 0.05866612536432586, 'tp_mult': 1.9348142523221237, 'tsl_mult': 0.5855287839746274, 'strategy': 'mean_reversion', 'time_stop': 276, 'use_sma': False, 'use_atr': False, 'use_adx': False, 'use_ema': False, 'use_spike': False, 'rsi_required': False, 'edge_k': 1.912252495796701, 'edge_cap': 0.21045096736399727}.
[I 2025-08-29 23:06:44,750] Trial 805 finished with values: [-1000000000.0, 1000000000.0] and parameters: {'p_sma': 23, 'p_std': 9, 'p_atr': 13, 'p_adx': 13, 'rsi_period': 10, 'ema1': 28, 'ema2': 22, 'slip_atr_k': 0.010439603147650524, 'slip_spread_k': 0.350041824653952, 'spread_hl_frac': 0.026516627336949573, 'bb_std_mult': 1.4586772709366782, 'rsi_os': 32, 'rsi_ob': 62, 'vol_spike': 0.24754294257631496, 'adx_thresh': 22.416374824666725, 'atr_min_pct': 0.0073405234828986315, 'atr_max_pct': 0.05783262397303817, 'tp_mult': 1.9196608044981802, 'tsl_mult': 0.590491822760041, 'strategy': 'mean_reversion', 'time_stop': 61, 'use_sma': False, 'use_atr': False, 'use_adx': False, 'use_ema': False, 'use_spike': False, 'rsi_required': False, 'edge_k': 1.9084615278955468, 'edge_cap': 0.20693648376762766}.
[I 2025-08-29 23:06:45,028] Trial 807 finished with values: [-0.005747616234718755, 0.005755232328419396] and parameters: {'p_sma': 29, 'p_std': 18, 'p_atr': 13, 'p_adx': 13, 'rsi_period': 58, 'ema1': 28, 'ema2': 25, 'slip_atr_k': 0.00016008128158113502, 'slip_spread_k': 0.2884900220121842, 'spread_hl_frac': 0.010939868842528722, 'bb_std_mult': 1.3526036099193561, 'rsi_os': 32, 'rsi_ob': 63, 'vol_spike': 0.2488410379943415, 'adx_thresh': 21.04064841758776, 'atr_min_pct': 0.001435415016440535, 'atr_max_pct': 0.024648343878882928, 'tp_mult': 1.9122086844299984, 'tsl_mult': 0.6150999312236602, 'strategy': 'breakout', 'time_stop': 282, 'use_sma': False, 'use_atr': False, 'use_adx': False, 'use_ema': False, 'use_spike': False, 'rsi_required': False, 'edge_k': 0.08309006746840919, 'edge_cap': 0.17904404066076463}.
[I 2025-08-29 23:06:45,333] Trial 806 finished with values: [-1000000000.0, 1000000000.0] and parameters: {'p_sma': 29, 'p_std': 9, 'p_atr': 13, 'p_adx': 13, 'rsi_period': 10, 'ema1': 29, 'ema2': 25, 'slip_atr_k': 0.00019322421997382226, 'slip_spread_k': 0.2901346346948478, 'spread_hl_frac': 0.026411315448791727, 'bb_std_mult': 1.358547949675379, 'rsi_os': 32, 'rsi_ob': 63, 'vol_spike': 0.2488375334637973, 'adx_thresh': 22.563263487917258, 'atr_min_pct': 0.019707774464162085, 'atr_max_pct': 0.08237650533046574, 'tp_mult': 1.9106462720854702, 'tsl_mult': 0.5984323023105159, 'strategy': 'mean_reversion', 'time_stop': 61, 'use_sma': False, 'use_atr': False, 'use_adx': False, 'use_ema': False, 'use_spike': False, 'rsi_required': False, 'edge_k': 1.906017227880917, 'edge_cap': 0.16482363163792552}.
[I 2025-08-29 23:06:45,450] Trial 804 finished with values: [-1000000000.0, 1000000000.0] and parameters: {'p_sma': 34, 'p_std': 16, 'p_atr': 12, 'p_adx': 13, 'rsi_period': 10, 'ema1': 28, 'ema2': 24, 'slip_atr_k': 0.009969573707295776, 'slip_spread_k': 0.2902640361733806, 'spread_hl_frac': 0.012630211590539364, 'bb_std_mult': 1.3202830643625445, 'rsi_os': 32, 'rsi_ob': 62, 'vol_spike': 0.2516735202885484, 'adx_thresh': 22.129853443263563, 'atr_min_pct': 0.01568845012853319, 'atr_max_pct': 0.05134224805293179, 'tp_mult': 1.947662156299215, 'tsl_mult': 0.62262514137087, 'strategy': 'mean_reversion', 'time_stop': 282, 'use_sma': False, 'use_atr': False, 'use_adx': False, 'use_ema': False, 'use_spike': False, 'rsi_required': False, 'edge_k': 0.584998329915128, 'edge_cap': 0.20922309390782035}.
[I 2025-08-29 23:06:45,731] Trial 811 finished with values: [-1000000000.0, 1000000000.0] and parameters: {'p_sma': 32, 'p_std': 12, 'p_atr': 11, 'p_adx': 13, 'rsi_period': 56, 'ema1': 23, 'ema2': 20, 'slip_atr_k': 5.73718257780453e-05, 'slip_spread_k': 0.2721177095576327, 'spread_hl_frac': 0.009774400369748953, 'bb_std_mult': 1.431554571593282, 'rsi_os': 33, 'rsi_ob': 61, 'vol_spike': 0.013024296869184881, 'adx_thresh': 23.79827411597187, 'atr_min_pct': 0.020597853055058856, 'atr_max_pct': 0.013497099378138547, 'tp_mult': 1.959543824587188, 'tsl_mult': 0.000611471058498958, 'strategy': 'breakout', 'time_stop': 180, 'use_sma': False, 'use_atr': False, 'use_adx': False, 'use_ema': False, 'use_spike': False, 'rsi_required': False, 'edge_k': 0.9232981942733415, 'edge_cap': 0.9630500064231264}.
[I 2025-08-29 23:07:12,505] Trial 808 finished with values: [-0.040057308463487096, 0.040047939555364696] and parameters: {'p_sma': 37, 'p_std': 12, 'p_atr': 11, 'p_adx': 13, 'rsi_period': 14, 'ema1': 28, 'ema2': 27, 'slip_atr_k': 0.12855801607052134, 'slip_spread_k': 0.2871598798632599, 'spread_hl_frac': 0.01113004425425847, 'bb_std_mult': 1.3591337631576743, 'rsi_os': 32, 'rsi_ob': 63, 'vol_spike': 0.24870822888154323, 'adx_thresh': 14.564580947375209, 'atr_min_pct': 0.0012983524595126775, 'atr_max_pct': 0.05072055951498347, 'tp_mult': 1.8907015170820958, 'tsl_mult': 0.3994888870941764, 'strategy': 'breakout', 'time_stop': 178, 'use_sma': False, 'use_atr': False, 'use_adx': False, 'use_ema': False, 'use_spike': False, 'rsi_required': False, 'edge_k': 1.8476726069000653, 'edge_cap': 0.8486121885710095}.
