[I 2025-08-29 22:10:08,335] Trial 272 finished with values: [-1000000000.0, 1000000000.0] and parameters: {'p_sma': 47, 'p_std': 35, 'p_atr': 20, 'p_adx': 21, 'rsi_period': 12, 'ema1': 9, 'ema2': 11, 'slip_atr_k': 0.03498681861538334, 'slip_spread_k': 0.7249082727409917, 'spread_hl_frac': 0.0384481137390877, 'bb_std_mult': 0.9482855306367004, 'rsi_os': 29, 'rsi_ob': 86, 'vol_spike': 0.22877754373493553, 'adx_thresh': 32.503620477424064, 'atr_min_pct': 0.004376323810080172, 'atr_max_pct': 0.12720540002505373, 'tp_mult': 2.744516003248901, 'tsl_mult': 0.48902546309702694, 'strategy': 'mean_reversion', 'time_stop': 10, 'use_sma': False, 'use_atr': False, 'use_adx': False, 'use_ema': False, 'use_spike': False, 'rsi_required': False, 'edge_k': 1.315135625908004, 'edge_cap': 0.4666964413845778}.
[I 2025-08-29 22:10:08,566] Trial 271 finished with values: [-1000000000.0, 1000000000.0] and parameters: {'p_sma': 53, 'p_std': 35, 'p_atr': 15, 'p_adx': 20, 'rsi_period': 44, 'ema1': 17, 'ema2': 11, 'slip_atr_k': 0.24979360445912674, 'slip_spread_k': 0.7312889770681882, 'spread_hl_frac': 0.017570607621634822, 'bb_std_mult': 0.9570285343657993, 'rsi_os': 29, 'rsi_ob': 76, 'vol_spike': 0.2277899109172555, 'adx_thresh': 7.068358853642785, 'atr_min_pct': 0.024834330789475702, 'atr_max_pct': 0.1239613854200325, 'tp_mult': 2.809561102573923, 'tsl_mult': 0.49572275413622763, 'strategy': 'mean_reversion', 'time_stop': 236, 'use_sma': False, 'use_atr': False, 'use_adx': False, 'use_ema': False, 'use_spike': False, 'rsi_required': False, 'edge_k': 0.9932730744100619, 'edge_cap': 0.5635132907251018}.
[I 2025-08-29 22:10:08,670] Trial 270 finished with values: [-1000000000.0, 1000000000.0] and parameters: {'p_sma': 51, 'p_std': 38, 'p_atr': 20, 'p_adx': 22, 'rsi_period': 70, 'ema1': 6, 'ema2': 19, 'slip_atr_k': 0.03491237495098188, 'slip_spread_k': 0.7373148708389976, 'spread_hl_frac': 0.02444368048607014, 'bb_std_mult': 0.9570184775053237, 'rsi_os': 29, 'rsi_ob': 80, 'vol_spike': 0.21802931913654214, 'adx_thresh': 7.123719677692787, 'atr_min_pct': 0.0042167871032972645, 'atr_max_pct': 0.12254673184338405, 'tp_mult': 2.818765455049255, 'tsl_mult': 0.2872335277837075, 'strategy': 'mean_reversion', 'time_stop': 119, 'use_sma': False, 'use_atr': False, 'use_adx': False, 'use_ema': False, 'use_spike': False, 'rsi_required': False, 'edge_k': 0.3818854614350352, 'edge_cap': 0.482430936246918}.
[I 2025-08-29 22:10:08,746] Trial 273 finished with values: [-0.01892169972477109, 0.01891008265366306] and parameters: {'p_sma': 47, 'p_std': 36, 'p_atr': 22, 'p_adx': 21, 'rsi_period': 12, 'ema1': 29, 'ema2': 10, 'slip_atr_k': 0.24966457293547473, 'slip_spread_k': 0.7279055237720898, 'spread_hl_frac': 0.038540797628796544, 'bb_std_mult': 0.9675395701124985, 'rsi_os': 25, 'rsi_ob': 79, 'vol_spike': 0.22808282126735832, 'adx_thresh': 32.02355742948026, 'atr_min_pct': 0.000878645145143028, 'atr_max_pct': 0.12659833341878363, 'tp_mult': 2.7977989437159363, 'tsl_mult': 0.5385267197251961, 'strategy': 'mean_reversion', 'time_stop': 121, 'use_sma': False, 'use_atr': False, 'use_adx': False, 'use_ema': False, 'use_spike': False, 'rsi_required': False, 'edge_k': 1.916396227748673, 'edge_cap': 0.6112775427689945}.
[I 2025-08-29 22:10:35,468] Trial 274 finished with values: [-0.021645957279037842, 0.021648206995879254] and parameters: {'p_sma': 45, 'p_std': 36, 'p_atr': 22, 'p_adx': 18, 'rsi_period': 70, 'ema1': 21, 'ema2': 60, 'slip_atr_k': 0.0315050391009164, 'slip_spread_k': 0.7525202244281115, 'spread_hl_frac': 0.024931871657418746, 'bb_std_mult': 0.9558430409925782, 'rsi_os': 43, 'rsi_ob': 79, 'vol_spike': 0.21367958185212396, 'adx_thresh': 7.271749403535397, 'atr_min_pct': 0.0010033200974475184, 'atr_max_pct': 0.12464897335838232, 'tp_mult': 2.1037124112201453, 'tsl_mult': 0.33808644710039637, 'strategy': 'mean_reversion', 'time_stop': 236, 'use_sma': False, 'use_atr': False, 'use_adx': False, 'use_ema': False, 'use_spike': False, 'rsi_required': False, 'edge_k': 1.1973660378212316, 'edge_cap': 0.5683292976531925}.
[I 2025-08-29 22:10:35,525] Trial 275 finished with values: [-0.02941121297289684, 0.02940031806996175] and parameters: {'p_sma': 42, 'p_std': 20, 'p_atr': 25, 'p_adx': 22, 'rsi_period': 30, 'ema1': 6, 'ema2': 31, 'slip_atr_k': 0.00770611576088906, 'slip_spread_k': 0.720586863700195, 'spread_hl_frac': 0.012834651527990007, 'bb_std_mult': 2.731465390623304, 'rsi_os': 43, 'rsi_ob': 79, 'vol_spike': 0.00020420609099375264, 'adx_thresh': 23.85948947386374, 'atr_min_pct': 0.000770759563966041, 'atr_max_pct': 0.12807758397961796, 'tp_mult': 1.9917619205598773, 'tsl_mult': 7.315827180748302e-05, 'strategy': 'mean_reversion', 'time_stop': 121, 'use_sma': False, 'use_atr': False, 'use_adx': False, 'use_ema': False, 'use_spike': False, 'rsi_required': False, 'edge_k': 0.7594955846174463, 'edge_cap': 0.47708656248407433}.
[I 2025-08-29 22:10:36,039] Trial 276 finished with values: [-0.023589626608702896, 0.02358132851338914] and parameters: {'p_sma': 42, 'p_std': 36, 'p_atr': 22, 'p_adx': 18, 'rsi_period': 24, 'ema1': 21, 'ema2': 51, 'slip_atr_k': 0.1131693938331263, 'slip_spread_k': 0.7577255933738974, 'spread_hl_frac': 0.03887154085768898, 'bb_std_mult': 2.475657458331068, 'rsi_os': 43, 'rsi_ob': 79, 'vol_spike': 0.2747422744547814, 'adx_thresh': 23.773568508614904, 'atr_min_pct': 0.0016579258829750945, 'atr_max_pct': 0.10532516185943269, 'tp_mult': 1.363779838701276, 'tsl_mult': 0.5277089623097774, 'strategy': 'mean_reversion', 'time_stop': 95, 'use_sma': False, 'use_atr': False, 'use_adx': False, 'use_ema': False, 'use_spike': False, 'rsi_required': False, 'edge_k': 1.1259987854765283, 'edge_cap': 0.49206007823673953}.
[I 2025-08-29 22:10:36,145] Trial 277 finished with values: [-1000000000.0, 1000000000.0] and parameters: {'p_sma': 45, 'p_std': 51, 'p_atr': 22, 'p_adx': 23, 'rsi_period': 30, 'ema1': 5, 'ema2': 24, 'slip_atr_k': 0.0528616155851931, 'slip_spread_k': 0.7636305088717109, 'spread_hl_frac': 0.034947159773183224, 'bb_std_mult': 0.8486926894920509, 'rsi_os': 24, 'rsi_ob': 78, 'vol_spike': 0.0010899261844095898, 'adx_thresh': 33.441922536449034, 'atr_min_pct': 0.0017858219881548276, 'atr_max_pct': 0.0185447865606816, 'tp_mult': 2.8638084257808747, 'tsl_mult': 0.08175478543314058, 'strategy': 'mean_reversion', 'time_stop': 205, 'use_sma': False, 'use_atr': False, 'use_adx': False, 'use_ema': False, 'use_spike': False, 'rsi_required': False, 'edge_k': 0.34332987684127503, 'edge_cap': 0.13930683177709224}.
[I 2025-08-29 22:11:02,934] Trial 281 finished with values: [-0.004725357086953541, 0.004890494312508992] and parameters: {'p_sma': 48, 'p_std': 34, 'p_atr': 27, 'p_adx': 14, 'rsi_period': 23, 'ema1': 26, 'ema2': 10, 'slip_atr_k': 0.028010861266225876, 'slip_spread_k': 0.9703209704656941, 'spread_hl_frac': 0.014619807386489613, 'bb_std_mult': 1.4574884027726016, 'rsi_os': 37, 'rsi_ob': 63, 'vol_spike': 0.25608613017133985, 'adx_thresh': 29.94748695183077, 'atr_min_pct': 0.002425053299805096, 'atr_max_pct': 0.13461194525005793, 'tp_mult': 2.158365330789731, 'tsl_mult': 0.42244040588424786, 'strategy': 'breakout', 'time_stop': 45, 'use_sma': False, 'use_atr': False, 'use_adx': False, 'use_ema': False, 'use_spike': False, 'rsi_required': False, 'edge_k': 0.3451563534750072, 'edge_cap': 0.6398853118980368}.
[I 2025-08-29 22:11:03,072] Trial 279 finished with values: [-0.0062928989550711245, 0.006356830316557507] and parameters: {'p_sma': 17, 'p_std': 37, 'p_atr': 22, 'p_adx': 23, 'rsi_period': 26, 'ema1': 30, 'ema2': 10, 'slip_atr_k': 0.05391422883433873, 'slip_spread_k': 0.7653223017905301, 'spread_hl_frac': 0.007013723603984206, 'bb_std_mult': 0.8581109282232385, 'rsi_os': 37, 'rsi_ob': 50, 'vol_spike': 0.07958705004870407, 'adx_thresh': 30.04683875344827, 'atr_min_pct': 0.001637826206090143, 'atr_max_pct': 0.13410984870743317, 'tp_mult': 1.3688694691878964, 'tsl_mult': 0.46786710055218833, 'strategy': 'breakout', 'time_stop': 107, 'use_sma': False, 'use_atr': False, 'use_adx': False, 'use_ema': False, 'use_spike': False, 'rsi_required': False, 'edge_k': 0.34138991149823245, 'edge_cap': 0.4926481983797127}.
[I 2025-08-29 22:11:03,138] Trial 280 finished with values: [-0.003077018372976581, 0.0030898867049298077] and parameters: {'p_sma': 56, 'p_std': 37, 'p_atr': 23, 'p_adx': 14, 'rsi_period': 52, 'ema1': 5, 'ema2': 23, 'slip_atr_k': 0.051810362087495995, 'slip_spread_k': 0.7859748934219488, 'spread_hl_frac': 0.03448073389805423, 'bb_std_mult': 0.8254586098118648, 'rsi_os': 23, 'rsi_ob': 88, 'vol_spike': 0.20737524043504882, 'adx_thresh': 30.168406404697016, 'atr_min_pct': 0.0023621795211615894, 'atr_max_pct': 0.11650067856141368, 'tp_mult': 2.863612864740917, 'tsl_mult': 0.4735173557391236, 'strategy': 'breakout', 'time_stop': 107, 'use_sma': False, 'use_atr': False, 'use_adx': False, 'use_ema': False, 'use_spike': False, 'rsi_required': False, 'edge_k': 0.3414109387440282, 'edge_cap': 0.3263245552283284}.
[I 2025-08-29 22:11:03,221] Trial 278 finished with values: [-0.003272870153485763, 0.003302732567629023] and parameters: {'p_sma': 48, 'p_std': 21, 'p_atr': 25, 'p_adx': 23, 'rsi_period': 30, 'ema1': 5, 'ema2': 24, 'slip_atr_k': 0.02665708165021935, 'slip_spread_k': 0.7629170814196945, 'spread_hl_frac': 0.022787531392448143, 'bb_std_mult': 0.8283259864505963, 'rsi_os': 24, 'rsi_ob': 77, 'vol_spike': 0.08254684034654222, 'adx_thresh': 27.762817408339043, 'atr_min_pct': 0.001899869552117778, 'atr_max_pct': 0.03243457003619536, 'tp_mult': 2.8561450014013543, 'tsl_mult': 0.4652859974839661, 'strategy': 'breakout', 'time_stop': 45, 'use_sma': False, 'use_atr': False, 'use_adx': False, 'use_ema': False, 'use_spike': False, 'rsi_required': False, 'edge_k': 0.739047731292635, 'edge_cap': 0.4832910850054635}.
[I 2025-08-29 22:11:29,549] Trial 282 finished with values: [-1000000000.0, 1000000000.0] and parameters: {'p_sma': 26, 'p_std': 37, 'p_atr': 23, 'p_adx': 27, 'rsi_period': 27, 'ema1': 5, 'ema2': 22, 'slip_atr_k': 0.037873978874639835, 'slip_spread_k': 0.9352211768596522, 'spread_hl_frac': 0.006767589121219376, 'bb_std_mult': 0.8312627285201046, 'rsi_os': 39, 'rsi_ob': 77, 'vol_spike': 0.08012586202515141, 'adx_thresh': 9.38753294188073, 'atr_min_pct': 0.020432273803471172, 'atr_max_pct': 0.07853514248088349, 'tp_mult': 1.3035334559261564, 'tsl_mult': 0.47362834016523997, 'strategy': 'breakout', 'time_stop': 107, 'use_sma': False, 'use_atr': False, 'use_adx': False, 'use_ema': False, 'use_spike': False, 'rsi_required': False, 'edge_k': 0.8052729800866508, 'edge_cap': 0.4476801290049897}.
[I 2025-08-29 22:11:30,113] Trial 284 finished with values: [-1000000000.0, 1000000000.0] and parameters: {'p_sma': 56, 'p_std': 34, 'p_atr': 23, 'p_adx': 21, 'rsi_period': 26, 'ema1': 23, 'ema2': 30, 'slip_atr_k': 0.22570705754420572, 'slip_spread_k': 0.5029364582226304, 'spread_hl_frac': 0.03626320789791535, 'bb_std_mult': 0.8229337160727319, 'rsi_os': 15, 'rsi_ob': 56, 'vol_spike': 0.21024731401044058, 'adx_thresh': 15.172165852764754, 'atr_min_pct': 0.022175025086313655, 'atr_max_pct': 0.13084969707603294, 'tp_mult': 2.94095616180666, 'tsl_mult': 0.6807680549098337, 'strategy': 'breakout', 'time_stop': 91, 'use_sma': False, 'use_atr': False, 'use_adx': False, 'use_ema': False, 'use_spike': False, 'rsi_required': False, 'edge_k': 0.23716169407701368, 'edge_cap': 0.22259805286961654}.
[I 2025-08-29 22:11:30,231] Trial 283 finished with values: [-1000000000.0, 1000000000.0] and parameters: {'p_sma': 27, 'p_std': 7, 'p_atr': 23, 'p_adx': 27, 'rsi_period': 26, 'ema1': 5, 'ema2': 12, 'slip_atr_k': 0.12756398618406037, 'slip_spread_k': 0.36878603985324476, 'spread_hl_frac': 0.03642472208223841, 'bb_std_mult': 1.5306901110444144, 'rsi_os': 27, 'rsi_ob': 77, 'vol_spike': 0.28403227621954297, 'adx_thresh': 15.307396436313908, 'atr_min_pct': 0.020680680203524385, 'atr_max_pct': 0.08374603207437399, 'tp_mult': 1.0663199810813615, 'tsl_mult': 0.46570532782111795, 'strategy': 'breakout', 'time_stop': 156, 'use_sma': False, 'use_atr': False, 'use_adx': False, 'use_ema': False, 'use_spike': False, 'rsi_required': False, 'edge_k': 0.4326471491105794, 'edge_cap': 0.2182869740046834}.
[I 2025-08-29 22:11:30,309] Trial 285 finished with values: [-1000000000.0, 1000000000.0] and parameters: {'p_sma': 47, 'p_std': 27, 'p_atr': 24, 'p_adx': 8, 'rsi_period': 53, 'ema1': 7, 'ema2': 15, 'slip_atr_k': 0.03628575493729499, 'slip_spread_k': 0.5047245360090175, 'spread_hl_frac': 0.029923088073680652, 'bb_std_mult': 2.21977452266037, 'rsi_os': 15, 'rsi_ob': 77, 'vol_spike': 0.20683945516445357, 'adx_thresh': 10.154551826758022, 'atr_min_pct': 0.02230674679222655, 'atr_max_pct': 0.13123987409097926, 'tp_mult': 2.014709932037461, 'tsl_mult': 0.4634624193424633, 'strategy': 'breakout', 'time_stop': 82, 'use_sma': False, 'use_atr': False, 'use_adx': False, 'use_ema': False, 'use_spike': False, 'rsi_required': False, 'edge_k': 1.51353300835882, 'edge_cap': 0.850385061440185}.
[I 2025-08-29 22:11:30,482] Trial 289 finished with values: [-1000000000.0, 1000000000.0] and parameters: {'p_sma': 31, 'p_std': 30, 'p_atr': 9, 'p_adx': 7, 'rsi_period': 72, 'ema1': 7, 'ema2': 57, 'slip_atr_k': 0.17499014233789617, 'slip_spread_k': 0.7849063033926024, 'spread_hl_frac': 0.03199258413407821, 'bb_std_mult': 2.64414826406773, 'rsi_os': 26, 'rsi_ob': 91, 'vol_spike': 0.2390210067888604, 'adx_thresh': 31.36121640371785, 'atr_min_pct': 0.025522416043434196, 'atr_max_pct': 0.011592796337460604, 'tp_mult': 2.394772523523047, 'tsl_mult': 0.5110133954717992, 'strategy': 'mean_reversion', 'time_stop': 214, 'use_sma': False, 'use_atr': False, 'use_adx': False, 'use_ema': False, 'use_spike': False, 'rsi_required': False, 'edge_k': 1.8249122141135565, 'edge_cap': 0.6198572234552913}.
[I 2025-08-29 22:11:56,705] Trial 287 finished with values: [-1000000000.0, 1000000000.0] and parameters: {'p_sma': 30, 'p_std': 35, 'p_atr': 20, 'p_adx': 8, 'rsi_period': 53, 'ema1': 7, 'ema2': 12, 'slip_atr_k': 0.06452363695634515, 'slip_spread_k': 0.5409372364725578, 'spread_hl_frac': 0.03012995098229642, 'bb_std_mult': 0.9011155874878671, 'rsi_os': 27, 'rsi_ob': 70, 'vol_spike': 0.24220195309308126, 'adx_thresh': 10.317942417436784, 'atr_min_pct': 0.021302561732618186, 'atr_max_pct': 0.12159852870360953, 'tp_mult': 2.0203646475527166, 'tsl_mult': 0.9851090899150716, 'strategy': 'mean_reversion', 'time_stop': 97, 'use_sma': False, 'use_atr': False, 'use_adx': False, 'use_ema': False, 'use_spike': False, 'rsi_required': False, 'edge_k': 0.4328327092866439, 'edge_cap': 0.8659609974127288}.
[I 2025-08-29 22:11:57,399] Trial 286 finished with values: [-0.005030637719534159, 0.005118911515074811] and parameters: {'p_sma': 34, 'p_std': 35, 'p_atr': 24, 'p_adx': 22, 'rsi_period': 55, 'ema1': 23, 'ema2': 29, 'slip_atr_k': 0.15732670120280245, 'slip_spread_k': 0.41116543441185865, 'spread_hl_frac': 0.030057612054205388, 'bb_std_mult': 2.237189485741028, 'rsi_os': 27, 'rsi_ob': 55, 'vol_spike': 0.23581002774385842, 'adx_thresh': 15.438844454144858, 'atr_min_pct': 0.002689848620480732, 'atr_max_pct': 0.13157343411278277, 'tp_mult': 2.4913710708655707, 'tsl_mult': 0.6819051394563908, 'strategy': 'breakout', 'time_stop': 91, 'use_sma': False, 'use_atr': False, 'use_adx': False, 'use_ema': False, 'use_spike': False, 'rsi_required': False, 'edge_k': 1.4418998322978314, 'edge_cap': 0.8660139609833598}.
[I 2025-08-29 22:11:57,406] Trial 288 finished with values: [-1000000000.0, 1000000000.0] and parameters: {'p_sma': 31, 'p_std': 27, 'p_atr': 24, 'p_adx': 7, 'rsi_period': 52, 'ema1': 7, 'ema2': 41, 'slip_atr_k': 0.03299778337418741, 'slip_spread_k': 0.5318078057985285, 'spread_hl_frac': 0.03479492109951594, 'bb_std_mult': 0.9127438283340977, 'rsi_os': 26, 'rsi_ob': 71, 'vol_spike': 0.20036575624935993, 'adx_thresh': 31.38577417168962, 'atr_min_pct': 0.0029054707372211004, 'atr_max_pct': 0.12895005179781824, 'tp_mult': 2.4827730671084223, 'tsl_mult': 0.5101793069066702, 'strategy': 'mean_reversion', 'time_stop': 53, 'use_sma': False, 'use_atr': False, 'use_adx': False, 'use_ema': False, 'use_spike': False, 'rsi_required': False, 'edge_k': 0.5671701813455438, 'edge_cap': 0.6742767140772632}.
[I 2025-08-29 22:11:57,703] Trial 290 finished with values: [-1000000000.0, 1000000000.0] and parameters: {'p_sma': 20, 'p_std': 35, 'p_atr': 24, 'p_adx': 22, 'rsi_period': 80, 'ema1': 16, 'ema2': 11, 'slip_atr_k': 0.08941819285698087, 'slip_spread_k': 0.5495005809744772, 'spread_hl_frac': 0.03460435207422517, 'bb_std_mult': 1.608197729411983, 'rsi_os': 25, 'rsi_ob': 53, 'vol_spike': 0.1476862739796179, 'adx_thresh': 29.14680330294192, 'atr_min_pct': 0.0027853200208487177, 'atr_max_pct': 0.10055041088457714, 'tp_mult': 2.479414766458488, 'tsl_mult': 0.4953635634584151, 'strategy': 'mean_reversion', 'time_stop': 104, 'use_sma': False, 'use_atr': False, 'use_adx': False, 'use_ema': False, 'use_spike': False, 'rsi_required': False, 'edge_k': 0.5601168589385872, 'edge_cap': 0.6775728331429136}.
[I 2025-08-29 22:12:24,123] Trial 293 finished with values: [-0.012049186221274044, 0.012037832993296275] and parameters: {'p_sma': 49, 'p_std': 12, 'p_atr': 21, 'p_adx': 22, 'rsi_period': 21, 'ema1': 6, 'ema2': 10, 'slip_atr_k': 0.025571270668888937, 'slip_spread_k': 0.4486489765245889, 'spread_hl_frac': 0.04058630450610725, 'bb_std_mult': 1.6038037889662402, 'rsi_os': 48, 'rsi_ob': 88, 'vol_spike': 0.22438477101104765, 'adx_thresh': 33.034796879478726, 'atr_min_pct': 0.0020242366236517284, 'atr_max_pct': 0.023663286782766996, 'tp_mult': 2.655446527702034, 'tsl_mult': 0.16583758771325463, 'strategy': 'mean_reversion', 'time_stop': 104, 'use_sma': False, 'use_atr': False, 'use_adx': False, 'use_ema': False, 'use_spike': False, 'rsi_required': False, 'edge_k': 1.2787964222611103, 'edge_cap': 0.4299222778702414}.
[I 2025-08-29 22:12:24,530] Trial 291 finished with values: [-1000000000.0, 1000000000.0] and parameters: {'p_sma': 34, 'p_std': 35, 'p_atr': 24, 'p_adx': 13, 'rsi_period': 75, 'ema1': 6, 'ema2': 41, 'slip_atr_k': 0.03286577634486046, 'slip_spread_k': 0.01361119882639697, 'spread_hl_frac': 0.022201121952033193, 'bb_std_mult': 1.0998006441297608, 'rsi_os': 25, 'rsi_ob': 58, 'vol_spike': 0.22379764875667227, 'adx_thresh': 32.995892057944154, 'atr_min_pct': 0.0027500779743464482, 'atr_max_pct': 0.1285539967616479, 'tp_mult': 1.4323595149130088, 'tsl_mult': 0.5010531977622369, 'strategy': 'mean_reversion', 'time_stop': 104, 'use_sma': False, 'use_atr': False, 'use_adx': False, 'use_ema': False, 'use_spike': False, 'rsi_required': False, 'edge_k': 1.6115503846507013, 'edge_cap': 0.9500657941091087}.
[I 2025-08-29 22:12:24,703] Trial 292 finished with values: [-0.008573803772076283, 0.00858785399804437] and parameters: {'p_sma': 49, 'p_std': 52, 'p_atr': 30, 'p_adx': 22, 'rsi_period': 21, 'ema1': 6, 'ema2': 11, 'slip_atr_k': 0.026062634303644736, 'slip_spread_k': 0.7171581951079561, 'spread_hl_frac': 0.04997611911182259, 'bb_std_mult': 1.0674923297969376, 'rsi_os': 48, 'rsi_ob': 73, 'vol_spike': 0.22419466383199266, 'adx_thresh': 27.572228563090107, 'atr_min_pct': 0.002234169609455046, 'atr_max_pct': 0.0571855162964876, 'tp_mult': 2.6577476345284974, 'tsl_mult': 0.16278905955619877, 'strategy': 'mean_reversion', 'time_stop': 104, 'use_sma': False, 'use_atr': False, 'use_adx': False, 'use_ema': False, 'use_spike': False, 'rsi_required': False, 'edge_k': 0.4840005041775535, 'edge_cap': 0.2502783018283503}.
[I 2025-08-29 22:12:24,876] Trial 294 finished with values: [-1000000000.0, 1000000000.0] and parameters: {'p_sma': 49, 'p_std': 52, 'p_atr': 19, 'p_adx': 23, 'rsi_period': 76, 'ema1': 15, 'ema2': 35, 'slip_atr_k': 0.07844481880933069, 'slip_spread_k': 0.4449976291229588, 'spread_hl_frac': 0.04876143105538932, 'bb_std_mult': 1.0643873995674773, 'rsi_os': 24, 'rsi_ob': 65, 'vol_spike': 0.17839653834700003, 'adx_thresh': 33.30496216087374, 'atr_min_pct': 0.0022226594931289145, 'atr_max_pct': 0.08966288683966306, 'tp_mult': 1.4401381567349978, 'tsl_mult': 0.738923126513476, 'strategy': 'mean_reversion', 'time_stop': 111, 'use_sma': False, 'use_atr': False, 'use_adx': False, 'use_ema': False, 'use_spike': False, 'rsi_required': False, 'edge_k': 0.12045152433678108, 'edge_cap': 0.9343936252974203}.
[I 2025-08-29 22:12:51,802] Trial 297 finished with values: [-1000000000.0, 1000000000.0] and parameters: {'p_sma': 46, 'p_std': 33, 'p_atr': 23, 'p_adx': 20, 'rsi_period': 51, 'ema1': 8, 'ema2': 38, 'slip_atr_k': 0.04443644409132519, 'slip_spread_k': 0.10420765324831593, 'spread_hl_frac': 0.037595630827732957, 'bb_std_mult': 1.1985761958099055, 'rsi_os': 24, 'rsi_ob': 76, 'vol_spike': 0.2173927795478171, 'adx_thresh': 33.8941368152379, 'atr_min_pct': 0.014357118596786816, 'atr_max_pct': 0.06201119314438276, 'tp_mult': 2.890144265670447, 'tsl_mult': 0.4341438112971561, 'strategy': 'breakout', 'time_stop': 112, 'use_sma': False, 'use_atr': False, 'use_adx': False, 'use_ema': False, 'use_spike': False, 'rsi_required': False, 'edge_k': 0.31366569364289215, 'edge_cap': 0.8339473926959999}.
[I 2025-08-29 22:12:52,321] Trial 296 finished with values: [-1000000000.0, 1000000000.0] and parameters: {'p_sma': 46, 'p_std': 60, 'p_atr': 30, 'p_adx': 20, 'rsi_period': 24, 'ema1': 12, 'ema2': 38, 'slip_atr_k': 0.013597431992756717, 'slip_spread_k': 0.391047751540726, 'spread_hl_frac': 0.03295958727028273, 'bb_std_mult': 0.6863681008894922, 'rsi_os': 24, 'rsi_ob': 73, 'vol_spike': 0.17830742247302128, 'adx_thresh': 33.82894439521038, 'atr_min_pct': 0.01434701782419277, 'atr_max_pct': 0.1183859986408072, 'tp_mult': 1.9049911887782431, 'tsl_mult': 0.7421900803673598, 'strategy': 'breakout', 'time_stop': 114, 'use_sma': False, 'use_atr': False, 'use_adx': False, 'use_ema': False, 'use_spike': False, 'rsi_required': False, 'edge_k': 0.48653285676335634, 'edge_cap': 0.5976894614229821}.
