[I 2025-08-29 22:04:11,126] Trial 215 finished with values: [-0.0013959498882568644, 0.0014130907601862144] and parameters: {'p_sma': 46, 'p_std': 36, 'p_atr': 22, 'p_adx': 23, 'rsi_period': 26, 'ema1': 6, 'ema2': 10, 'slip_atr_k': 0.040086132314729454, 'slip_spread_k': 0.7302160824411384, 'spread_hl_frac': 0.032729357928333404, 'bb_std_mult': 0.8265477375580947, 'rsi_os': 24, 'rsi_ob': 77, 'vol_spike': 0.2242886733696349, 'adx_thresh': 34.471653722849084, 'atr_min_pct': 0.002168186792291838, 'atr_max_pct': 0.1298873383776663, 'tp_mult': 2.739359852100777, 'tsl_mult': 0.4763157301149629, 'strategy': 'mean_reversion', 'time_stop': 101, 'use_sma': False, 'use_atr': False, 'use_adx': False, 'use_ema': False, 'use_spike': False, 'rsi_required': False, 'edge_k': 0.056199890169476574, 'edge_cap': 0.47712587194536016}.
[I 2025-08-29 22:04:37,991] Trial 217 finished with values: [-1000000000.0, 1000000000.0] and parameters: {'p_sma': 46, 'p_std': 36, 'p_atr': 22, 'p_adx': 23, 'rsi_period': 25, 'ema1': 6, 'ema2': 10, 'slip_atr_k': 0.03943487098502377, 'slip_spread_k': 0.6925813180966607, 'spread_hl_frac': 0.036413663407711155, 'bb_std_mult': 0.9656620958928595, 'rsi_os': 25, 'rsi_ob': 82, 'vol_spike': 0.21551706132617166, 'adx_thresh': 33.4726423318446, 'atr_min_pct': 0.004124890759647637, 'atr_max_pct': 0.1294421479611683, 'tp_mult': 2.740425612734543, 'tsl_mult': 0.4789813243485666, 'strategy': 'mean_reversion', 'time_stop': 293, 'use_sma': False, 'use_atr': False, 'use_adx': False, 'use_ema': False, 'use_spike': False, 'rsi_required': False, 'edge_k': 0.35127964719640126, 'edge_cap': 0.4633876056136916}.
[I 2025-08-29 22:04:38,330] Trial 220 finished with values: [-0.0045423913047376585, 0.00451046546654118] and parameters: {'p_sma': 47, 'p_std': 32, 'p_atr': 21, 'p_adx': 22, 'rsi_period': 24, 'ema1': 7, 'ema2': 14, 'slip_atr_k': 0.107789819789574, 'slip_spread_k': 0.8061484464255662, 'spread_hl_frac': 0.03509510498635624, 'bb_std_mult': 1.0060119245484198, 'rsi_os': 37, 'rsi_ob': 79, 'vol_spike': 0.2166084378442128, 'adx_thresh': 33.33988168550432, 'atr_min_pct': 0.0038312053254274006, 'atr_max_pct': 0.12581303650998846, 'tp_mult': 2.743802049861139, 'tsl_mult': 0.4446768040660646, 'strategy': 'mean_reversion', 'time_stop': 119, 'use_sma': False, 'use_atr': False, 'use_adx': False, 'use_ema': False, 'use_spike': False, 'rsi_required': False, 'edge_k': 0.3748632958141671, 'edge_cap': 0.48781662466718967}.
[I 2025-08-29 22:04:38,405] Trial 219 finished with values: [-1000000000.0, 1000000000.0] and parameters: {'p_sma': 47, 'p_std': 37, 'p_atr': 21, 'p_adx': 23, 'rsi_period': 24, 'ema1': 26, 'ema2': 14, 'slip_atr_k': 0.09224342545340897, 'slip_spread_k': 0.8019821497485109, 'spread_hl_frac': 0.03488570449272483, 'bb_std_mult': 0.9926935060944736, 'rsi_os': 39, 'rsi_ob': 76, 'vol_spike': 0.2176393949126728, 'adx_thresh': 33.40670796503284, 'atr_min_pct': 0.01785302265506663, 'atr_max_pct': 0.1162264206425361, 'tp_mult': 2.7430955206010856, 'tsl_mult': 0.545618353903772, 'strategy': 'mean_reversion', 'time_stop': 293, 'use_sma': False, 'use_atr': False, 'use_adx': False, 'use_ema': False, 'use_spike': False, 'rsi_required': False, 'edge_k': 1.4614705859615604, 'edge_cap': 0.4797270551723764}.
[I 2025-08-29 22:04:38,488] Trial 218 finished with values: [-1000000000.0, 1000000000.0] and parameters: {'p_sma': 47, 'p_std': 27, 'p_atr': 21, 'p_adx': 19, 'rsi_period': 26, 'ema1': 24, 'ema2': 11, 'slip_atr_k': 0.23105853733482984, 'slip_spread_k': 0.8088362799178972, 'spread_hl_frac': 0.035300439865085374, 'bb_std_mult': 0.9845555516136218, 'rsi_os': 27, 'rsi_ob': 76, 'vol_spike': 0.215147886867694, 'adx_thresh': 31.254994438105054, 'atr_min_pct': 0.003814999041108126, 'atr_max_pct': 0.12445993399303061, 'tp_mult': 2.7375072723215546, 'tsl_mult': 0.5484297547885516, 'strategy': 'mean_reversion', 'time_stop': 96, 'use_sma': False, 'use_atr': False, 'use_adx': False, 'use_ema': False, 'use_spike': False, 'rsi_required': False, 'edge_k': 1.7021081954858093, 'edge_cap': 0.48313128045016174}.
[I 2025-08-29 22:05:05,702] Trial 221 finished with values: [-1000000000.0, 1000000000.0] and parameters: {'p_sma': 48, 'p_std': 32, 'p_atr': 26, 'p_adx': 21, 'rsi_period': 24, 'ema1': 25, 'ema2': 11, 'slip_atr_k': 0.069866664484061, 'slip_spread_k': 0.7263626273930779, 'spread_hl_frac': 0.030958706639852902, 'bb_std_mult': 1.0197499709511135, 'rsi_os': 26, 'rsi_ob': 76, 'vol_spike': 0.21975860124262106, 'adx_thresh': 32.67578428755375, 'atr_min_pct': 0.017803231570253757, 'atr_max_pct': 0.12547293300414505, 'tp_mult': 2.9242900751841225, 'tsl_mult': 0.45501899864613854, 'strategy': 'mean_reversion', 'time_stop': 188, 'use_sma': False, 'use_atr': False, 'use_adx': False, 'use_ema': False, 'use_spike': False, 'rsi_required': False, 'edge_k': 1.6977484268328844, 'edge_cap': 0.4845042891731526}.
[I 2025-08-29 22:05:05,976] Trial 223 finished with values: [-1000000000.0, 1000000000.0] and parameters: {'p_sma': 45, 'p_std': 6, 'p_atr': 18, 'p_adx': 22, 'rsi_period': 27, 'ema1': 25, 'ema2': 11, 'slip_atr_k': 0.047497139157717354, 'slip_spread_k': 0.7283514251959118, 'spread_hl_frac': 0.049142908063905304, 'bb_std_mult': 0.9060985231071111, 'rsi_os': 27, 'rsi_ob': 80, 'vol_spike': 0.23570535169545725, 'adx_thresh': 32.79269993645504, 'atr_min_pct': 0.01679279282582866, 'atr_max_pct': 0.12331185582192657, 'tp_mult': 2.932238207042402, 'tsl_mult': 0.502371744721162, 'strategy': 'mean_reversion', 'time_stop': 151, 'use_sma': False, 'use_atr': False, 'use_adx': False, 'use_ema': False, 'use_spike': False, 'rsi_required': False, 'edge_k': 0.44390553763824836, 'edge_cap': 0.4001917432061365}.
[I 2025-08-29 22:05:05,988] Trial 224 finished with values: [-0.0044338444506228925, 0.004418874295222787] and parameters: {'p_sma': 49, 'p_std': 35, 'p_atr': 18, 'p_adx': 21, 'rsi_period': 28, 'ema1': 18, 'ema2': 11, 'slip_atr_k': 0.0732422429085948, 'slip_spread_k': 0.6861449461863581, 'spread_hl_frac': 0.0010134686237486604, 'bb_std_mult': 0.9062614842652169, 'rsi_os': 29, 'rsi_ob': 80, 'vol_spike': 0.23458960238734516, 'adx_thresh': 32.680305156241104, 'atr_min_pct': 0.0018479936494363754, 'atr_max_pct': 0.12288333613754814, 'tp_mult': 2.935141112928963, 'tsl_mult': 0.4983789419426973, 'strategy': 'mean_reversion', 'time_stop': 46, 'use_sma': False, 'use_atr': False, 'use_adx': False, 'use_ema': False, 'use_spike': False, 'rsi_required': False, 'edge_k': 0.28435654094389357, 'edge_cap': 0.4486382288094102}.
[I 2025-08-29 22:05:06,174] Trial 222 finished with values: [-1000000000.0, 1000000000.0] and parameters: {'p_sma': 48, 'p_std': 11, 'p_atr': 26, 'p_adx': 21, 'rsi_period': 26, 'ema1': 24, 'ema2': 11, 'slip_atr_k': 0.23056757662819133, 'slip_spread_k': 0.7285834765430924, 'spread_hl_frac': 0.03107961147715393, 'bb_std_mult': 0.6435335451682005, 'rsi_os': 27, 'rsi_ob': 76, 'vol_spike': 0.23410121550600255, 'adx_thresh': 32.74831713887493, 'atr_min_pct': 0.022437793700678624, 'atr_max_pct': 0.12314546128786606, 'tp_mult': 2.7960418928201367, 'tsl_mult': 0.5430926506055255, 'strategy': 'mean_reversion', 'time_stop': 149, 'use_sma': False, 'use_atr': False, 'use_adx': False, 'use_ema': False, 'use_spike': False, 'rsi_required': False, 'edge_k': 1.682956893451308, 'edge_cap': 0.4478292105647061}.
[I 2025-08-29 22:05:32,531] Trial 228 finished with values: [-0.002262621303422696, 0.0023533580976572853] and parameters: {'p_sma': 50, 'p_std': 34, 'p_atr': 22, 'p_adx': 22, 'rsi_period': 23, 'ema1': 16, 'ema2': 10, 'slip_atr_k': 0.03527315757389586, 'slip_spread_k': 0.8525851842023484, 'spread_hl_frac': 0.03418947711395809, 'bb_std_mult': 0.7354664877610347, 'rsi_os': 25, 'rsi_ob': 78, 'vol_spike': 0.22542171329226582, 'adx_thresh': 34.977475587264266, 'atr_min_pct': 0.0018149525564427546, 'atr_max_pct': 0.1278782172715885, 'tp_mult': 2.8235148619701684, 'tsl_mult': 0.42112614390787884, 'strategy': 'mean_reversion', 'time_stop': 106, 'use_sma': False, 'use_atr': False, 'use_adx': False, 'use_ema': False, 'use_spike': False, 'rsi_required': False, 'edge_k': 0.1921111514216095, 'edge_cap': 0.503420371805188}.
[I 2025-08-29 22:05:32,724] Trial 226 finished with values: [-1000000000.0, 1000000000.0] and parameters: {'p_sma': 50, 'p_std': 50, 'p_atr': 23, 'p_adx': 22, 'rsi_period': 27, 'ema1': 6, 'ema2': 10, 'slip_atr_k': 0.036230459308877534, 'slip_spread_k': 0.8643341246351508, 'spread_hl_frac': 0.034190535804114616, 'bb_std_mult': 0.6332055786949315, 'rsi_os': 25, 'rsi_ob': 78, 'vol_spike': 0.2282231623925827, 'adx_thresh': 34.835697324678605, 'atr_min_pct': 0.014164914386307528, 'atr_max_pct': 0.12788572266338238, 'tp_mult': 2.813832194002228, 'tsl_mult': 0.4650886813829273, 'strategy': 'mean_reversion', 'time_stop': 112, 'use_sma': False, 'use_atr': False, 'use_adx': False, 'use_ema': False, 'use_spike': False, 'rsi_required': False, 'edge_k': 1.234247613001755, 'edge_cap': 0.5036799402777282}.
[I 2025-08-29 22:05:32,969] Trial 225 finished with values: [-1000000000.0, 1000000000.0] and parameters: {'p_sma': 45, 'p_std': 11, 'p_atr': 23, 'p_adx': 22, 'rsi_period': 28, 'ema1': 6, 'ema2': 12, 'slip_atr_k': 0.03452067252974023, 'slip_spread_k': 0.6821866033403651, 'spread_hl_frac': 0.0006779461580955284, 'bb_std_mult': 0.8832308518739964, 'rsi_os': 10, 'rsi_ob': 79, 'vol_spike': 0.2348991467854349, 'adx_thresh': 34.91750468637373, 'atr_min_pct': 0.01613414690747273, 'atr_max_pct': 0.12822253104194978, 'tp_mult': 2.8365330189654245, 'tsl_mult': 0.5001125858979825, 'strategy': 'mean_reversion', 'time_stop': 110, 'use_sma': False, 'use_atr': False, 'use_adx': False, 'use_ema': False, 'use_spike': False, 'rsi_required': False, 'edge_k': 1.2454433584569886, 'edge_cap': 0.4405776317874102}.
[I 2025-08-29 22:05:33,107] Trial 227 finished with values: [-0.012817518997944699, 0.012809231381637644] and parameters: {'p_sma': 50, 'p_std': 34, 'p_atr': 23, 'p_adx': 22, 'rsi_period': 26, 'ema1': 22, 'ema2': 10, 'slip_atr_k': 0.03312771121847738, 'slip_spread_k': 0.7794996457147854, 'spread_hl_frac': 0.03378011052787027, 'bb_std_mult': 0.6091094207888084, 'rsi_os': 47, 'rsi_ob': 78, 'vol_spike': 0.22359378082041834, 'adx_thresh': 34.9254340833759, 'atr_min_pct': 0.00167843675620804, 'atr_max_pct': 0.12806212645651865, 'tp_mult': 2.8312153350757323, 'tsl_mult': 0.4551032777016271, 'strategy': 'mean_reversion', 'time_stop': 109, 'use_sma': False, 'use_atr': False, 'use_adx': False, 'use_ema': False, 'use_spike': False, 'rsi_required': False, 'edge_k': 0.3466457544758407, 'edge_cap': 0.5050828322611783}.
[I 2025-08-29 22:05:59,328] Trial 229 finished with values: [-1000000000.0, 1000000000.0] and parameters: {'p_sma': 45, 'p_std': 34, 'p_atr': 22, 'p_adx': 22, 'rsi_period': 29, 'ema1': 11, 'ema2': 10, 'slip_atr_k': 0.03377989609272221, 'slip_spread_k': 0.8432437685284631, 'spread_hl_frac': 0.03434894048770318, 'bb_std_mult': 0.85677496684254, 'rsi_os': 17, 'rsi_ob': 78, 'vol_spike': 0.22647094775681598, 'adx_thresh': 33.87077724954743, 'atr_min_pct': 0.01102903705957604, 'atr_max_pct': 0.12701688097846175, 'tp_mult': 2.82562154880755, 'tsl_mult': 0.4632483083692413, 'strategy': 'mean_reversion', 'time_stop': 106, 'use_sma': False, 'use_atr': False, 'use_adx': False, 'use_ema': False, 'use_spike': False, 'rsi_required': False, 'edge_k': 0.2517108862684577, 'edge_cap': 0.5086380008364588}.
[I 2025-08-29 22:06:00,073] Trial 232 finished with values: [-1000000000.0, 1000000000.0] and parameters: {'p_sma': 48, 'p_std': 35, 'p_atr': 29, 'p_adx': 23, 'rsi_period': 23, 'ema1': 16, 'ema2': 13, 'slip_atr_k': 0.17943866747022127, 'slip_spread_k': 0.4034552704678209, 'spread_hl_frac': 0.02349515469703055, 'bb_std_mult': 1.405108247519042, 'rsi_os': 25, 'rsi_ob': 79, 'vol_spike': 0.225628337122956, 'adx_thresh': 34.08577825922062, 'atr_min_pct': 0.010785916425233476, 'atr_max_pct': 0.13271811954368187, 'tp_mult': 2.802137508211111, 'tsl_mult': 0.5195050095962918, 'strategy': 'mean_reversion', 'time_stop': 92, 'use_sma': False, 'use_atr': False, 'use_adx': False, 'use_ema': False, 'use_spike': False, 'rsi_required': False, 'edge_k': 0.17746207367640687, 'edge_cap': 0.464430585138056}.
[I 2025-08-29 22:06:00,137] Trial 231 finished with values: [-1000000000.0, 1000000000.0] and parameters: {'p_sma': 57, 'p_std': 53, 'p_atr': 22, 'p_adx': 22, 'rsi_period': 23, 'ema1': 11, 'ema2': 10, 'slip_atr_k': 0.04288932943389349, 'slip_spread_k': 0.7536311453933722, 'spread_hl_frac': 0.015726073673405255, 'bb_std_mult': 0.8486583073186068, 'rsi_os': 47, 'rsi_ob': 81, 'vol_spike': 0.22506642024230283, 'adx_thresh': 33.818224438921376, 'atr_min_pct': 0.019392997319290464, 'atr_max_pct': 0.13407851148004798, 'tp_mult': 2.80839336504255, 'tsl_mult': 0.43031454354949406, 'strategy': 'mean_reversion', 'time_stop': 106, 'use_sma': False, 'use_atr': False, 'use_adx': False, 'use_ema': False, 'use_spike': False, 'rsi_required': False, 'edge_k': 0.25981055809986, 'edge_cap': 0.13428627862988168}.
[I 2025-08-29 22:06:00,254] Trial 230 finished with values: [-1000000000.0, 1000000000.0] and parameters: {'p_sma': 45, 'p_std': 34, 'p_atr': 22, 'p_adx': 22, 'rsi_period': 23, 'ema1': 22, 'ema2': 12, 'slip_atr_k': 0.03444942958391043, 'slip_spread_k': 0.7522004267586682, 'spread_hl_frac': 0.036804295549769786, 'bb_std_mult': 1.0616220778338372, 'rsi_os': 17, 'rsi_ob': 79, 'vol_spike': 0.22497590661403757, 'adx_thresh': 33.91771524762537, 'atr_min_pct': 0.01594088260153953, 'atr_max_pct': 0.13327440082441178, 'tp_mult': 2.8350288742429104, 'tsl_mult': 0.43694605026179395, 'strategy': 'mean_reversion', 'time_stop': 106, 'use_sma': False, 'use_atr': False, 'use_adx': False, 'use_ema': False, 'use_spike': False, 'rsi_required': False, 'edge_k': 1.8722876108365387, 'edge_cap': 0.3555112849610206}.
[I 2025-08-29 22:06:26,890] Trial 235 finished with values: [-0.010911781158983502, 0.010904997313249733] and parameters: {'p_sma': 47, 'p_std': 37, 'p_atr': 10, 'p_adx': 23, 'rsi_period': 25, 'ema1': 7, 'ema2': 54, 'slip_atr_k': 0.02634630549844484, 'slip_spread_k': 0.7077607059799277, 'spread_hl_frac': 0.03580690211189944, 'bb_std_mult': 1.0734957829459293, 'rsi_os': 44, 'rsi_ob': 93, 'vol_spike': 0.20860828886993088, 'adx_thresh': 33.55563238783531, 'atr_min_pct': 0.002014259769972158, 'atr_max_pct': 0.12622280921901216, 'tp_mult': 2.8829903181607412, 'tsl_mult': 0.4822787149691594, 'strategy': 'mean_reversion', 'time_stop': 98, 'use_sma': False, 'use_atr': False, 'use_adx': False, 'use_ema': False, 'use_spike': False, 'rsi_required': False, 'edge_k': 0.3972102448758024, 'edge_cap': 0.5375149799733537}.
[I 2025-08-29 22:06:27,128] Trial 234 finished with values: [-1000000000.0, 1000000000.0] and parameters: {'p_sma': 44, 'p_std': 37, 'p_atr': 22, 'p_adx': 23, 'rsi_period': 24, 'ema1': 6, 'ema2': 55, 'slip_atr_k': 0.04229501887010923, 'slip_spread_k': 0.7457946747729008, 'spread_hl_frac': 0.03672799687070731, 'bb_std_mult': 1.0642348256825245, 'rsi_os': 26, 'rsi_ob': 93, 'vol_spike': 0.21216667498219818, 'adx_thresh': 33.619404315200306, 'atr_min_pct': 0.019286667775415482, 'atr_max_pct': 0.13317254356015948, 'tp_mult': 2.8829770299397377, 'tsl_mult': 0.43297421770745714, 'strategy': 'mean_reversion', 'time_stop': 97, 'use_sma': False, 'use_atr': False, 'use_adx': False, 'use_ema': False, 'use_spike': False, 'rsi_required': False, 'edge_k': 1.8609493513900401, 'edge_cap': 0.3540091586956404}.
[I 2025-08-29 22:06:27,364] Trial 236 finished with values: [-0.005866940959621925, 0.005831611203743273] and parameters: {'p_sma': 47, 'p_std': 37, 'p_atr': 10, 'p_adx': 23, 'rsi_period': 25, 'ema1': 7, 'ema2': 53, 'slip_atr_k': 0.025089465496013492, 'slip_spread_k': 0.5973223681328574, 'spread_hl_frac': 0.03574264757424359, 'bb_std_mult': 0.9448363633874955, 'rsi_os': 41, 'rsi_ob': 93, 'vol_spike': 0.24622878513631452, 'adx_thresh': 30.44790441625399, 'atr_min_pct': 0.003162471711569523, 'atr_max_pct': 0.12104727173807556, 'tp_mult': 1.0616691916600276, 'tsl_mult': 0.4856953518058708, 'strategy': 'mean_reversion', 'time_stop': 98, 'use_sma': False, 'use_atr': False, 'use_adx': False, 'use_ema': False, 'use_spike': False, 'rsi_required': False, 'edge_k': 0.3950873290503969, 'edge_cap': 0.5418321583491194}.
[I 2025-08-29 22:06:27,504] Trial 233 finished with values: [-1000000000.0, 1000000000.0] and parameters: {'p_sma': 48, 'p_std': 54, 'p_atr': 29, 'p_adx': 23, 'rsi_period': 24, 'ema1': 5, 'ema2': 12, 'slip_atr_k': 0.042901534495790566, 'slip_spread_k': 0.7722063610903572, 'spread_hl_frac': 0.012547723301655982, 'bb_std_mult': 0.7410795059611632, 'rsi_os': 26, 'rsi_ob': 81, 'vol_spike': 0.21073770869326075, 'adx_thresh': 33.74080336909511, 'atr_min_pct': 0.019197751758017814, 'atr_max_pct': 0.14998868223840356, 'tp_mult': 2.778499071044121, 'tsl_mult': 0.4889162428554056, 'strategy': 'mean_reversion', 'time_stop': 92, 'use_sma': False, 'use_atr': False, 'use_adx': False, 'use_ema': False, 'use_spike': False, 'rsi_required': False, 'edge_k': 1.858623371226241, 'edge_cap': 0.46013145950197804}.
[I 2025-08-29 22:06:54,396] Trial 239 finished with values: [-1000000000.0, 1000000000.0] and parameters: {'p_sma': 25, 'p_std': 36, 'p_atr': 21, 'p_adx': 21, 'rsi_period': 20, 'ema1': 5, 'ema2': 11, 'slip_atr_k': 0.21299753203465793, 'slip_spread_k': 0.6554348605585064, 'spread_hl_frac': 0.032593324880522224, 'bb_std_mult': 0.9486528869136929, 'rsi_os': 26, 'rsi_ob': 77, 'vol_spike': 0.216102788356414, 'adx_thresh': 10.704873930895477, 'atr_min_pct': 0.026762002660243783, 'atr_max_pct': 0.028051020197802132, 'tp_mult': 2.982517350860137, 'tsl_mult': 0.5171088441941819, 'strategy': 'mean_reversion', 'time_stop': 182, 'use_sma': False, 'use_atr': False, 'use_adx': False, 'use_ema': False, 'use_spike': False, 'rsi_required': False, 'edge_k': 0.3353778245035181, 'edge_cap': 0.4714227155046467}.
[I 2025-08-29 22:06:54,645] Trial 237 finished with values: [-1000000000.0, 1000000000.0] and parameters: {'p_sma': 24, 'p_std': 36, 'p_atr': 22, 'p_adx': 21, 'rsi_period': 20, 'ema1': 5, 'ema2': 11, 'slip_atr_k': 0.12136948016611541, 'slip_spread_k': 0.4723276098573683, 'spread_hl_frac': 0.03244109827342123, 'bb_std_mult': 0.7245402068767702, 'rsi_os': 26, 'rsi_ob': 59, 'vol_spike': 0.2430389283534153, 'adx_thresh': 33.43621204413601, 'atr_min_pct': 0.003029481630929555, 'atr_max_pct': 0.11991643472778159, 'tp_mult': 1.3393983660422193, 'tsl_mult': 0.4883621544204051, 'strategy': 'mean_reversion', 'time_stop': 97, 'use_sma': False, 'use_atr': False, 'use_adx': False, 'use_ema': False, 'use_spike': False, 'rsi_required': False, 'edge_k': 0.3234265772675, 'edge_cap': 0.47038858374335935}.
[I 2025-08-29 22:06:54,934] Trial 240 finished with values: [-1000000000.0, 1000000000.0] and parameters: {'p_sma': 24, 'p_std': 36, 'p_atr': 22, 'p_adx': 21, 'rsi_period': 20, 'ema1': 6, 'ema2': 11, 'slip_atr_k': 0.21101650861457133, 'slip_spread_k': 0.6402053940439798, 'spread_hl_frac': 0.008224619904566358, 'bb_std_mult': 0.9524694128157281, 'rsi_os': 28, 'rsi_ob': 88, 'vol_spike': 0.151371001798102, 'adx_thresh': 34.409911624213855, 'atr_min_pct': 0.026252695897702513, 'atr_max_pct': 0.02783661413759409, 'tp_mult': 2.6666584500916866, 'tsl_mult': 0.5139553955307188, 'strategy': 'mean_reversion', 'time_stop': 119, 'use_sma': False, 'use_atr': False, 'use_adx': False, 'use_ema': False, 'use_spike': False, 'rsi_required': False, 'edge_k': 0.34505489481740004, 'edge_cap': 0.9794290481458361}.
[I 2025-08-29 22:06:54,994] Trial 238 finished with values: [-0.0053109146574832344, 0.005285522575562781] and parameters: {'p_sma': 49, 'p_std': 36, 'p_atr': 27, 'p_adx': 21, 'rsi_period': 20, 'ema1': 27, 'ema2': 11, 'slip_atr_k': 0.03896564922916919, 'slip_spread_k': 0.48362288544244625, 'spread_hl_frac': 0.032714283315955044, 'bb_std_mult': 0.9459292055203583, 'rsi_os': 41, 'rsi_ob': 77, 'vol_spike': 0.2473211100764777, 'adx_thresh': 10.898290544386963, 'atr_min_pct': 0.003378250688769897, 'atr_max_pct': 0.12041358378071912, 'tp_mult': 2.7794998551828254, 'tsl_mult': 0.4877788451680354, 'strategy': 'mean_reversion', 'time_stop': 102, 'use_sma': False, 'use_atr': False, 'use_adx': False, 'use_ema': False, 'use_spike': False, 'rsi_required': False, 'edge_k': 0.3265643419323562, 'edge_cap': 0.4656480249396801}.
[I 2025-08-29 22:07:21,831] Trial 244 finished with values: [-0.0023056512636261406, 0.0023082100107346118] and parameters: {'p_sma': 38, 'p_std': 23, 'p_atr': 21, 'p_adx': 22, 'rsi_period': 26, 'ema1': 19, 'ema2': 40, 'slip_atr_k': 0.029219250999898028, 'slip_spread_k': 0.8219473856183102, 'spread_hl_frac': 0.03462892877323186, 'bb_std_mult': 0.5005114618609374, 'rsi_os': 6, 'rsi_ob': 85, 'vol_spike': 0.22807595814077272, 'adx_thresh': 26.901037804977, 'atr_min_pct': 0.0017052196010882606, 'atr_max_pct': 0.13077760281536469, 'tp_mult': 2.8547689981205453, 'tsl_mult': 0.45938574261539555, 'strategy': 'mean_reversion', 'time_stop': 104, 'use_sma': False, 'use_atr': False, 'use_adx': False, 'use_ema': False, 'use_spike': False, 'rsi_required': False, 'edge_k': 0.37628025294759726, 'edge_cap': 0.49249761715055657}.
[I 2025-08-29 22:07:22,286] Trial 243 finished with values: [-0.0035438110502216125, 0.003560856679442615] and parameters: {'p_sma': 30, 'p_std': 23, 'p_atr': 21, 'p_adx': 22, 'rsi_period': 30, 'ema1': 27, 'ema2': 40, 'slip_atr_k': 0.03924822794076706, 'slip_spread_k': 0.6719421534030138, 'spread_hl_frac': 0.019325231938050653, 'bb_std_mult': 0.8757037944420046, 'rsi_os': 24, 'rsi_ob': 85, 'vol_spike': 0.2575464681470412, 'adx_thresh': 6.042508809727115, 'atr_min_pct': 0.001999004003637596, 'atr_max_pct': 0.13032298511148901, 'tp_mult': 2.775448918958995, 'tsl_mult': 0.46633196839907426, 'strategy': 'mean_reversion', 'time_stop': 86, 'use_sma': False, 'use_atr': False, 'use_adx': False, 'use_ema': False, 'use_spike': False, 'rsi_required': False, 'edge_k': 0.4184072829924082, 'edge_cap': 0.48902953096334423}.
