[I 2025-08-29 23:40:43,058] Trial 1133 finished with values: [-1000000000.0, 1000000000.0] and parameters: {'p_sma': 55, 'p_std': 48, 'p_atr': 12, 'p_adx': 21, 'rsi_period': 67, 'ema1': 28, 'ema2': 52, 'slip_atr_k': 0.004574719644695812, 'slip_spread_k': 0.31747063220649685, 'spread_hl_frac': 0.014259459880574464, 'bb_std_mult': 1.656322230272913, 'rsi_os': 33, 'rsi_ob': 65, 'vol_spike': 0.2894663523731563, 'adx_thresh': 20.754774983886918, 'atr_min_pct': 0.004702581997237677, 'atr_max_pct': 0.06307659400153531, 'tp_mult': 1.9390877987031245, 'tsl_mult': 0.44340252819803216, 'strategy': 'breakout', 'time_stop': 295, 'use_sma': False, 'use_atr': False, 'use_adx': False, 'use_ema': False, 'use_spike': False, 'rsi_required': False, 'edge_k': 1.9689015681810704, 'edge_cap': 0.17722291601663362}.
[I 2025-08-29 23:40:43,138] Trial 1136 finished with values: [-1000000000.0, 1000000000.0] and parameters: {'p_sma': 25, 'p_std': 15, 'p_atr': 12, 'p_adx': 12, 'rsi_period': 7, 'ema1': 29, 'ema2': 19, 'slip_atr_k': 0.11891837034478688, 'slip_spread_k': 0.26642825734990705, 'spread_hl_frac': 0.012644273224929423, 'bb_std_mult': 1.2718026945458103, 'rsi_os': 44, 'rsi_ob': 95, 'vol_spike': 0.10142924772295697, 'adx_thresh': 22.69559938297858, 'atr_min_pct': 0.029926696717979887, 'atr_max_pct': 0.11115916340548597, 'tp_mult': 1.9346294464902558, 'tsl_mult': 0.6705203199006735, 'strategy': 'breakout', 'time_stop': 281, 'use_sma': False, 'use_atr': False, 'use_adx': False, 'use_ema': False, 'use_spike': False, 'rsi_required': False, 'edge_k': 1.896623759881821, 'edge_cap': 0.17800654519409298}.
[I 2025-08-29 23:40:43,309] Trial 1134 finished with values: [-0.007313004831053682, 0.007301292573468297] and parameters: {'p_sma': 25, 'p_std': 46, 'p_atr': 12, 'p_adx': 19, 'rsi_period': 35, 'ema1': 13, 'ema2': 23, 'slip_atr_k': 0.11749736739945785, 'slip_spread_k': 0.3202328447717006, 'spread_hl_frac': 0.012597113145596578, 'bb_std_mult': 2.692461940335236, 'rsi_os': 35, 'rsi_ob': 65, 'vol_spike': 0.25272370133803385, 'adx_thresh': 24.60495096650526, 'atr_min_pct': 0.0014637884436561979, 'atr_max_pct': 0.017301956494145634, 'tp_mult': 1.9395590113401828, 'tsl_mult': 0.6151978799571719, 'strategy': 'breakout', 'time_stop': 296, 'use_sma': False, 'use_atr': False, 'use_adx': False, 'use_ema': False, 'use_spike': False, 'rsi_required': False, 'edge_k': 1.9709743088701361, 'edge_cap': 0.17072568972317081}.
[I 2025-08-29 23:40:43,632] Trial 1140 finished with values: [-1000000000.0, 1000000000.0] and parameters: {'p_sma': 23, 'p_std': 23, 'p_atr': 13, 'p_adx': 12, 'rsi_period': 10, 'ema1': 30, 'ema2': 34, 'slip_atr_k': 0.007955169927747781, 'slip_spread_k': 0.2289615493728936, 'spread_hl_frac': 0.01114670699688207, 'bb_std_mult': 1.4243337958656972, 'rsi_os': 53, 'rsi_ob': 62, 'vol_spike': 0.04909313207439793, 'adx_thresh': 6.953498444520413, 'atr_min_pct': 8.584610149700578e-06, 'atr_max_pct': 0.07035984775280578, 'tp_mult': 1.635474350736922, 'tsl_mult': 0.6976951617884588, 'strategy': 'mean_reversion', 'time_stop': 143, 'use_sma': False, 'use_atr': False, 'use_adx': False, 'use_ema': False, 'use_spike': False, 'rsi_required': False, 'edge_k': 1.8256429566981387, 'edge_cap': 0.20261502677688564}.
[I 2025-08-29 23:41:11,194] Trial 1139 finished with values: [-1000000000.0, 1000000000.0] and parameters: {'p_sma': 28, 'p_std': 28, 'p_atr': 13, 'p_adx': 12, 'rsi_period': 10, 'ema1': 21, 'ema2': 47, 'slip_atr_k': 0.008494889248445856, 'slip_spread_k': 0.22203191424802646, 'spread_hl_frac': 0.011199364241917704, 'bb_std_mult': 2.7520675281125224, 'rsi_os': 21, 'rsi_ob': 72, 'vol_spike': 0.05044420620605444, 'adx_thresh': 19.699822579886682, 'atr_min_pct': 0.02153707887623606, 'atr_max_pct': 0.07129836163656987, 'tp_mult': 1.854882836527397, 'tsl_mult': 0.6988228292927056, 'strategy': 'mean_reversion', 'time_stop': 61, 'use_sma': False, 'use_atr': False, 'use_adx': False, 'use_ema': False, 'use_spike': False, 'rsi_required': False, 'edge_k': 1.9952253804318112, 'edge_cap': 0.3642185469960461}.
[I 2025-08-29 23:41:11,368] Trial 1138 finished with values: [-1000000000.0, 1000000000.0] and parameters: {'p_sma': 12, 'p_std': 57, 'p_atr': 13, 'p_adx': 27, 'rsi_period': 58, 'ema1': 30, 'ema2': 34, 'slip_atr_k': 0.2265433446424361, 'slip_spread_k': 0.3369226165317579, 'spread_hl_frac': 0.0038368097375665253, 'bb_std_mult': 1.4172567812781414, 'rsi_os': 34, 'rsi_ob': 64, 'vol_spike': 0.25201539386300936, 'adx_thresh': 6.87959596044843, 'atr_min_pct': 0.013126464414450843, 'atr_max_pct': 0.07112361343001036, 'tp_mult': 1.8638317234183346, 'tsl_mult': 0.8122000625785624, 'strategy': 'mean_reversion', 'time_stop': 142, 'use_sma': False, 'use_atr': False, 'use_adx': False, 'use_ema': False, 'use_spike': False, 'rsi_required': False, 'edge_k': 1.99845299335507, 'edge_cap': 0.21034409290189562}.
[I 2025-08-29 23:41:11,632] Trial 1137 finished with values: [-0.011818222175562942, 0.011812038959159343] and parameters: {'p_sma': 12, 'p_std': 58, 'p_atr': 12, 'p_adx': 12, 'rsi_period': 10, 'ema1': 29, 'ema2': 34, 'slip_atr_k': 0.008784201272833683, 'slip_spread_k': 0.3186534002925839, 'spread_hl_frac': 0.012687778991050414, 'bb_std_mult': 1.2792815164073343, 'rsi_os': 18, 'rsi_ob': 64, 'vol_spike': 0.17779817794101563, 'adx_thresh': 22.6296459890726, 'atr_min_pct': 2.4105547695319612e-05, 'atr_max_pct': 0.07156551284007535, 'tp_mult': 1.9261720162549403, 'tsl_mult': 0.15838244191800022, 'strategy': 'mean_reversion', 'time_stop': 289, 'use_sma': False, 'use_atr': False, 'use_adx': False, 'use_ema': False, 'use_spike': False, 'rsi_required': False, 'edge_k': 1.9731936322306902, 'edge_cap': 0.18391433624533968}.
[I 2025-08-29 23:41:11,852] Trial 1141 finished with values: [-1000000000.0, 1000000000.0] and parameters: {'p_sma': 28, 'p_std': 27, 'p_atr': 21, 'p_adx': 28, 'rsi_period': 11, 'ema1': 10, 'ema2': 21, 'slip_atr_k': 0.06629355436674836, 'slip_spread_k': 0.3398647328719969, 'spread_hl_frac': 0.003932887417998698, 'bb_std_mult': 2.4759630596860314, 'rsi_os': 40, 'rsi_ob': 64, 'vol_spike': 0.23575166131954092, 'adx_thresh': 19.559772010711406, 'atr_min_pct': 0.02177017355436256, 'atr_max_pct': 0.07168181178655977, 'tp_mult': 1.8706565517361868, 'tsl_mult': 0.5707458166781533, 'strategy': 'mean_reversion', 'time_stop': 288, 'use_sma': False, 'use_atr': False, 'use_adx': False, 'use_ema': False, 'use_spike': False, 'rsi_required': False, 'edge_k': 1.9994301137326658, 'edge_cap': 0.2196589193116866}.
[I 2025-08-29 23:41:38,967] Trial 1143 finished with values: [-1000000000.0, 1000000000.0] and parameters: {'p_sma': 33, 'p_std': 11, 'p_atr': 11, 'p_adx': 20, 'rsi_period': 13, 'ema1': 10, 'ema2': 21, 'slip_atr_k': 2.1303147799002064e-06, 'slip_spread_k': 0.9988213785730992, 'spread_hl_frac': 0.033306074279076295, 'bb_std_mult': 1.272602540278463, 'rsi_os': 16, 'rsi_ob': 85, 'vol_spike': 0.23441366233768257, 'adx_thresh': 21.404068183961797, 'atr_min_pct': 0.022414250149890548, 'atr_max_pct': 0.0759174434395117, 'tp_mult': 2.3408744434480133, 'tsl_mult': 0.5642575744239914, 'strategy': 'mean_reversion', 'time_stop': 273, 'use_sma': False, 'use_atr': False, 'use_adx': False, 'use_ema': False, 'use_spike': False, 'rsi_required': False, 'edge_k': 1.3312826148738026, 'edge_cap': 0.747941871270879}.
[I 2025-08-29 23:41:39,110] Trial 1142 finished with values: [-1000000000.0, 1000000000.0] and parameters: {'p_sma': 30, 'p_std': 11, 'p_atr': 11, 'p_adx': 27, 'rsi_period': 59, 'ema1': 10, 'ema2': 53, 'slip_atr_k': 0.00011339811149044254, 'slip_spread_k': 0.9110610387459392, 'spread_hl_frac': 0.028957832235494408, 'bb_std_mult': 2.5428002113313006, 'rsi_os': 34, 'rsi_ob': 64, 'vol_spike': 0.233345048265139, 'adx_thresh': 21.627859290335916, 'atr_min_pct': 0.008124150716956964, 'atr_max_pct': 0.07485460835347416, 'tp_mult': 2.410482467523993, 'tsl_mult': 0.1590595676441416, 'strategy': 'mean_reversion', 'time_stop': 274, 'use_sma': False, 'use_atr': False, 'use_adx': False, 'use_ema': False, 'use_spike': False, 'rsi_required': False, 'edge_k': 1.9201884397963003, 'edge_cap': 0.21297812206456065}.
[I 2025-08-29 23:41:39,317] Trial 1144 finished with values: [-0.020847615042770884, 0.0208476858762291] and parameters: {'p_sma': 29, 'p_std': 41, 'p_atr': 11, 'p_adx': 14, 'rsi_period': 13, 'ema1': 30, 'ema2': 21, 'slip_atr_k': 0.18635789938711417, 'slip_spread_k': 0.25287709339960246, 'spread_hl_frac': 0.009500159004149081, 'bb_std_mult': 0.5761989452894727, 'rsi_os': 40, 'rsi_ob': 59, 'vol_spike': 0.275742593532744, 'adx_thresh': 21.359815204370037, 'atr_min_pct': 0.0023083052067898566, 'atr_max_pct': 0.07611406784195109, 'tp_mult': 2.4105452617067336, 'tsl_mult': 0.6538000999251479, 'strategy': 'mean_reversion', 'time_stop': 274, 'use_sma': False, 'use_atr': False, 'use_adx': False, 'use_ema': False, 'use_spike': False, 'rsi_required': False, 'edge_k': 1.9209695566273899, 'edge_cap': 0.22103216298709374}.
[I 2025-08-29 23:41:39,317] Trial 1145 finished with values: [-1000000000.0, 1000000000.0] and parameters: {'p_sma': 10, 'p_std': 11, 'p_atr': 11, 'p_adx': 14, 'rsi_period': 14, 'ema1': 15, 'ema2': 31, 'slip_atr_k': 0.08360338566268638, 'slip_spread_k': 0.92202458582397, 'spread_hl_frac': 0.008133056869472702, 'bb_std_mult': 1.1413913263040747, 'rsi_os': 32, 'rsi_ob': 59, 'vol_spike': 0.2615730801242214, 'adx_thresh': 21.769312056887124, 'atr_min_pct': 0.007067594419052385, 'atr_max_pct': 0.0772107316496565, 'tp_mult': 2.02016630288701, 'tsl_mult': 0.2204812861848619, 'strategy': 'mean_reversion', 'time_stop': 274, 'use_sma': False, 'use_atr': False, 'use_adx': False, 'use_ema': False, 'use_spike': False, 'rsi_required': False, 'edge_k': 1.9311656054483772, 'edge_cap': 0.5581635500338121}.
[I 2025-08-29 23:42:07,155] Trial 1148 finished with values: [-1000000000.0, 1000000000.0] and parameters: {'p_sma': 45, 'p_std': 14, 'p_atr': 27, 'p_adx': 8, 'rsi_period': 8, 'ema1': 27, 'ema2': 22, 'slip_atr_k': 0.004837070997762386, 'slip_spread_k': 0.3019748561869413, 'spread_hl_frac': 0.010102617109322271, 'bb_std_mult': 1.3958298102203772, 'rsi_os': 30, 'rsi_ob': 87, 'vol_spike': 0.2582801987094752, 'adx_thresh': 19.975795914079054, 'atr_min_pct': 0.013955367919819103, 'atr_max_pct': 0.06637017280748943, 'tp_mult': 2.998337992076109, 'tsl_mult': 0.633742508196205, 'strategy': 'mean_reversion', 'time_stop': 114, 'use_sma': False, 'use_atr': False, 'use_adx': False, 'use_ema': False, 'use_spike': False, 'rsi_required': False, 'edge_k': 1.8720352419651816, 'edge_cap': 0.1493466671754943}.
[I 2025-08-29 23:42:07,398] Trial 1146 finished with values: [-1000000000.0, 1000000000.0] and parameters: {'p_sma': 10, 'p_std': 14, 'p_atr': 23, 'p_adx': 14, 'rsi_period': 39, 'ema1': 30, 'ema2': 48, 'slip_atr_k': 0.003995670069611609, 'slip_spread_k': 0.25224648893305096, 'spread_hl_frac': 0.009853252145435164, 'bb_std_mult': 1.1419440806231695, 'rsi_os': 29, 'rsi_ob': 62, 'vol_spike': 0.27651026249899036, 'adx_thresh': 20.298554628521316, 'atr_min_pct': 0.0058725461073748375, 'atr_max_pct': 0.07841762714018789, 'tp_mult': 1.4426245538624984, 'tsl_mult': 0.08901306187959535, 'strategy': 'mean_reversion', 'time_stop': 195, 'use_sma': False, 'use_atr': False, 'use_adx': False, 'use_ema': False, 'use_spike': False, 'rsi_required': False, 'edge_k': 0.6452508090096198, 'edge_cap': 0.3203923773006076}.
[I 2025-08-29 23:42:07,525] Trial 1149 finished with values: [-1000000000.0, 1000000000.0] and parameters: {'p_sma': 26, 'p_std': 21, 'p_atr': 12, 'p_adx': 14, 'rsi_period': 48, 'ema1': 27, 'ema2': 22, 'slip_atr_k': 0.24955785255000262, 'slip_spread_k': 0.26974257871032314, 'spread_hl_frac': 0.015548131266170828, 'bb_std_mult': 2.056727130026033, 'rsi_os': 29, 'rsi_ob': 53, 'vol_spike': 0.2125934571607375, 'adx_thresh': 10.872177272706839, 'atr_min_pct': 0.010519250114091976, 'atr_max_pct': 0.06824853537642905, 'tp_mult': 1.4236025718506247, 'tsl_mult': 0.08233412949989222, 'strategy': 'mean_reversion', 'time_stop': 257, 'use_sma': False, 'use_atr': False, 'use_adx': False, 'use_ema': False, 'use_spike': False, 'rsi_required': False, 'edge_k': 0.6071653782928506, 'edge_cap': 0.3256838861018888}.
[I 2025-08-29 23:42:07,598] Trial 1147 finished with values: [-1000000000.0, 1000000000.0] and parameters: {'p_sma': 45, 'p_std': 14, 'p_atr': 23, 'p_adx': 8, 'rsi_period': 69, 'ema1': 27, 'ema2': 37, 'slip_atr_k': 0.20652799636834257, 'slip_spread_k': 0.26837583395275266, 'spread_hl_frac': 0.009808744608432866, 'bb_std_mult': 1.9572866561281481, 'rsi_os': 32, 'rsi_ob': 53, 'vol_spike': 0.27449403614706164, 'adx_thresh': 5.523908834861151, 'atr_min_pct': 0.010611049483675052, 'atr_max_pct': 0.09478367902342143, 'tp_mult': 2.0231779279622284, 'tsl_mult': 0.9978246490198883, 'strategy': 'mean_reversion', 'time_stop': 282, 'use_sma': False, 'use_atr': False, 'use_adx': False, 'use_ema': False, 'use_spike': False, 'rsi_required': False, 'edge_k': 0.6438716021046055, 'edge_cap': 0.3317504883099501}.
[I 2025-08-29 23:42:34,122] Trial 1150 finished with values: [-1000000000.0, 1000000000.0] and parameters: {'p_sma': 58, 'p_std': 12, 'p_atr': 12, 'p_adx': 14, 'rsi_period': 47, 'ema1': 30, 'ema2': 37, 'slip_atr_k': 0.013209260868542702, 'slip_spread_k': 0.2709227864439428, 'spread_hl_frac': 0.0258988359135252, 'bb_std_mult': 1.4866460315498082, 'rsi_os': 36, 'rsi_ob': 62, 'vol_spike': 0.15227954256221987, 'adx_thresh': 5.717318143203947, 'atr_min_pct': 0.017830916516340018, 'atr_max_pct': 0.03875021498890893, 'tp_mult': 1.9919609988286364, 'tsl_mult': 0.2999029782703643, 'strategy': 'mean_reversion', 'time_stop': 283, 'use_sma': False, 'use_atr': False, 'use_adx': False, 'use_ema': False, 'use_spike': False, 'rsi_required': False, 'edge_k': 1.0669203225164359, 'edge_cap': 0.20084566844852383}.
[I 2025-08-29 23:42:34,407] Trial 1152 finished with values: [-1000000000.0, 1000000000.0] and parameters: {'p_sma': 29, 'p_std': 51, 'p_atr': 15, 'p_adx': 12, 'rsi_period': 9, 'ema1': 29, 'ema2': 20, 'slip_atr_k': 0.013294160175558234, 'slip_spread_k': 0.2965322758085982, 'spread_hl_frac': 0.021079591553399713, 'bb_std_mult': 3.33603604075381, 'rsi_os': 36, 'rsi_ob': 62, 'vol_spike': 0.08551530861952293, 'adx_thresh': 21.023656792488815, 'atr_min_pct': 0.0249332500043963, 'atr_max_pct': 0.04605615054306527, 'tp_mult': 1.9820695623598945, 'tsl_mult': 0.5970622040556318, 'strategy': 'breakout', 'time_stop': 285, 'use_sma': False, 'use_atr': False, 'use_adx': False, 'use_ema': False, 'use_spike': False, 'rsi_required': False, 'edge_k': 1.8877375205165128, 'edge_cap': 0.19271205337075129}.
[I 2025-08-29 23:42:35,034] Trial 1151 finished with values: [-1000000000.0, 1000000000.0] and parameters: {'p_sma': 15, 'p_std': 52, 'p_atr': 17, 'p_adx': 12, 'rsi_period': 81, 'ema1': 29, 'ema2': 39, 'slip_atr_k': 0.027511131230414168, 'slip_spread_k': 0.273494015340095, 'spread_hl_frac': 0.011626058492861685, 'bb_std_mult': 1.5083946654618816, 'rsi_os': 46, 'rsi_ob': 62, 'vol_spike': 0.24521156156709986, 'adx_thresh': 25.601945617604194, 'atr_min_pct': 0.01030951595582047, 'atr_max_pct': 0.06841450584712852, 'tp_mult': 2.5940258268229726, 'tsl_mult': 0.5950200180667476, 'strategy': 'breakout', 'time_stop': 258, 'use_sma': False, 'use_atr': False, 'use_adx': False, 'use_ema': False, 'use_spike': False, 'rsi_required': False, 'edge_k': 1.7469071390053408, 'edge_cap': 0.7055326128112653}.
[I 2025-08-29 23:42:35,147] Trial 1153 finished with values: [-1000000000.0, 1000000000.0] and parameters: {'p_sma': 15, 'p_std': 51, 'p_atr': 15, 'p_adx': 12, 'rsi_period': 9, 'ema1': 29, 'ema2': 20, 'slip_atr_k': 0.02642254334369956, 'slip_spread_k': 0.0194877710607822, 'spread_hl_frac': 0.04997982204888514, 'bb_std_mult': 3.179501247610563, 'rsi_os': 36, 'rsi_ob': 94, 'vol_spike': 0.2479449541247527, 'adx_thresh': 22.243858509242457, 'atr_min_pct': 0.003997365232060436, 'atr_max_pct': 0.037553336396236606, 'tp_mult': 2.607797377420808, 'tsl_mult': 0.5929609102973429, 'strategy': 'breakout', 'time_stop': 282, 'use_sma': False, 'use_atr': False, 'use_adx': False, 'use_ema': False, 'use_spike': False, 'rsi_required': False, 'edge_k': 0.7606539208777403, 'edge_cap': 0.18886889305101667}.
[I 2025-08-29 23:42:35,514] Trial 1157 finished with values: [-1000000000.0, 1000000000.0] and parameters: {'p_sma': 33, 'p_std': 12, 'p_atr': 25, 'p_adx': 13, 'rsi_period': 15, 'ema1': 30, 'ema2': 50, 'slip_atr_k': 0.0041181921452228785, 'slip_spread_k': 0.05582981997124986, 'spread_hl_frac': 0.011151655334914034, 'bb_std_mult': 1.332427101956888, 'rsi_os': 14, 'rsi_ob': 46, 'vol_spike': 0.22265967581285956, 'adx_thresh': 15.256399644582716, 'atr_min_pct': 0.014930815900159173, 'atr_max_pct': 0.1148244288063616, 'tp_mult': 2.2865592686969625, 'tsl_mult': 0.38914861468237705, 'strategy': 'mean_reversion', 'time_stop': 223, 'use_sma': False, 'use_atr': False, 'use_adx': False, 'use_ema': False, 'use_spike': False, 'rsi_required': False, 'edge_k': 1.9392835229915175, 'edge_cap': 0.1568284017350743}.
[I 2025-08-29 23:43:02,231] Trial 1156 finished with values: [-1000000000.0, 1000000000.0] and parameters: {'p_sma': 53, 'p_std': 44, 'p_atr': 20, 'p_adx': 13, 'rsi_period': 15, 'ema1': 9, 'ema2': 50, 'slip_atr_k': 0.005193058857131605, 'slip_spread_k': 0.0029056216723718498, 'spread_hl_frac': 0.04288971995473423, 'bb_std_mult': 1.329067536528779, 'rsi_os': 14, 'rsi_ob': 60, 'vol_spike': 0.2473141135685109, 'adx_thresh': 22.222461726944434, 'atr_min_pct': 0.004155662278616617, 'atr_max_pct': 0.06408118891524443, 'tp_mult': 1.9073011371930269, 'tsl_mult': 0.01931116773972591, 'strategy': 'mean_reversion', 'time_stop': 85, 'use_sma': False, 'use_atr': False, 'use_adx': False, 'use_ema': False, 'use_spike': False, 'rsi_required': False, 'edge_k': 0.9467759858733067, 'edge_cap': 0.14876284280648042}.
[I 2025-08-29 23:43:02,407] Trial 1154 finished with values: [-0.0004549012628501936, 0.0007246789985962914] and parameters: {'p_sma': 31, 'p_std': 12, 'p_atr': 15, 'p_adx': 12, 'rsi_period': 81, 'ema1': 29, 'ema2': 54, 'slip_atr_k': 0.00012794233174675447, 'slip_spread_k': 0.29489544501367876, 'spread_hl_frac': 0.011610375240521366, 'bb_std_mult': 1.3291900483932437, 'rsi_os': 49, 'rsi_ob': 61, 'vol_spike': 0.2476225957800481, 'adx_thresh': 25.36131884097561, 'atr_min_pct': 0.0035827038625647293, 'atr_max_pct': 0.04519433972491028, 'tp_mult': 2.2972546599595667, 'tsl_mult': 0.6012862689425704, 'strategy': 'breakout', 'time_stop': 153, 'use_sma': False, 'use_atr': False, 'use_adx': False, 'use_ema': False, 'use_spike': False, 'rsi_required': False, 'edge_k': 1.8997917210141029, 'edge_cap': 0.1566158849414639}.
[I 2025-08-29 23:43:02,945] Trial 1155 finished with values: [-0.0014375722963851922, 0.0017017396031042663] and parameters: {'p_sma': 31, 'p_std': 12, 'p_atr': 12, 'p_adx': 30, 'rsi_period': 15, 'ema1': 30, 'ema2': 19, 'slip_atr_k': 7.060037199029976e-05, 'slip_spread_k': 0.36591789947077147, 'spread_hl_frac': 0.03736712779869418, 'bb_std_mult': 1.3127345981548344, 'rsi_os': 46, 'rsi_ob': 46, 'vol_spike': 0.24574367621974563, 'adx_thresh': 23.502826599873497, 'atr_min_pct': 0.0043059366726716074, 'atr_max_pct': 0.030693330864028652, 'tp_mult': 2.6352961813896645, 'tsl_mult': 0.6324082058995076, 'strategy': 'breakout', 'time_stop': 151, 'use_sma': False, 'use_atr': False, 'use_adx': False, 'use_ema': False, 'use_spike': False, 'rsi_required': False, 'edge_k': 1.628082797281781, 'edge_cap': 0.14932465248342996}.
[I 2025-08-29 23:43:03,109] Trial 1158 finished with values: [-1000000000.0, 1000000000.0] and parameters: {'p_sma': 31, 'p_std': 54, 'p_atr': 20, 'p_adx': 13, 'rsi_period': 11, 'ema1': 22, 'ema2': 57, 'slip_atr_k': 0.17061042001173626, 'slip_spread_k': 0.36793725399374766, 'spread_hl_frac': 0.03718208259048353, 'bb_std_mult': 1.2102335521633338, 'rsi_os': 33, 'rsi_ob': 55, 'vol_spike': 0.206683097505296, 'adx_thresh': 17.270483361191584, 'atr_min_pct': 0.007329898313787978, 'atr_max_pct': 0.06961741689792086, 'tp_mult': 1.9030114821080417, 'tsl_mult': 0.6317624927835309, 'strategy': 'mean_reversion', 'time_stop': 43, 'use_sma': False, 'use_atr': False, 'use_adx': False, 'use_ema': False, 'use_spike': False, 'rsi_required': False, 'edge_k': 0.2752765046397301, 'edge_cap': 0.44674688066035595}.
[I 2025-08-29 23:43:03,401] Trial 1161 finished with values: [-1000000000.0, 1000000000.0] and parameters: {'p_sma': 29, 'p_std': 17, 'p_atr': 12, 'p_adx': 29, 'rsi_period': 11, 'ema1': 30, 'ema2': 57, 'slip_atr_k': 0.23790329612203337, 'slip_spread_k': 0.20413418437818132, 'spread_hl_frac': 0.008629667651754033, 'bb_std_mult': 1.2069673338355638, 'rsi_os': 34, 'rsi_ob': 50, 'vol_spike': 0.25541110174287596, 'adx_thresh': 13.143353911952726, 'atr_min_pct': 0.01927567088878966, 'atr_max_pct': 0.03158632100886772, 'tp_mult': 1.9088335909464826, 'tsl_mult': 0.6663541687740757, 'strategy': 'mean_reversion', 'time_stop': 175, 'use_sma': False, 'use_atr': False, 'use_adx': False, 'use_ema': False, 'use_spike': False, 'rsi_required': False, 'edge_k': 1.259119240230369, 'edge_cap': 0.25719093173259777}.
[I 2025-08-29 23:43:29,954] Trial 1160 finished with values: [-1000000000.0, 1000000000.0] and parameters: {'p_sma': 29, 'p_std': 13, 'p_atr': 19, 'p_adx': 9, 'rsi_period': 11, 'ema1': 12, 'ema2': 19, 'slip_atr_k': 3.328779777181829e-05, 'slip_spread_k': 0.539213949398914, 'spread_hl_frac': 0.037264880912600884, 'bb_std_mult': 1.403099157986182, 'rsi_os': 7, 'rsi_ob': 66, 'vol_spike': 0.2557494448551409, 'adx_thresh': 30.117226050208256, 'atr_min_pct': 0.019269474228574685, 'atr_max_pct': 0.050159540087463664, 'tp_mult': 2.9237882962225865, 'tsl_mult': 0.6374092171250305, 'strategy': 'mean_reversion', 'time_stop': 287, 'use_sma': False, 'use_atr': False, 'use_adx': False, 'use_ema': False, 'use_spike': False, 'rsi_required': False, 'edge_k': 1.8186297207672113, 'edge_cap': 0.8970584615313857}.
