[I 2025-08-29 22:01:27,140] Trial 190 finished with values: [-1000000000.0, 1000000000.0] and parameters: {'p_sma': 46, 'p_std': 30, 'p_atr': 21, 'p_adx': 22, 'rsi_period': 29, 'ema1': 28, 'ema2': 12, 'slip_atr_k': 0.018109040020066632, 'slip_spread_k': 0.7355243229835258, 'spread_hl_frac': 0.031098170492643157, 'bb_std_mult': 1.0494329947492131, 'rsi_os': 27, 'rsi_ob': 80, 'vol_spike': 0.2046262922109785, 'adx_thresh': 34.34346416310554, 'atr_min_pct': 0.00342309584858738, 'atr_max_pct': 0.1357850209034098, 'tp_mult': 2.824127607109583, 'tsl_mult': 0.5757831884806257, 'strategy': 'mean_reversion', 'time_stop': 94, 'use_sma': False, 'use_atr': False, 'use_adx': False, 'use_ema': False, 'use_spike': False, 'rsi_required': False, 'edge_k': 0.22563527017151475, 'edge_cap': 0.4348936653771923}.
[I 2025-08-29 22:01:27,256] Trial 189 finished with values: [-1000000000.0, 1000000000.0] and parameters: {'p_sma': 49, 'p_std': 30, 'p_atr': 23, 'p_adx': 25, 'rsi_period': 38, 'ema1': 6, 'ema2': 12, 'slip_atr_k': 0.017423146668233528, 'slip_spread_k': 0.7392022577887055, 'spread_hl_frac': 0.03182618064457338, 'bb_std_mult': 1.0110954197928057, 'rsi_os': 27, 'rsi_ob': 80, 'vol_spike': 0.22357539186979608, 'adx_thresh': 34.30230043094521, 'atr_min_pct': 0.003581883362576587, 'atr_max_pct': 0.13373908456466257, 'tp_mult': 2.9071910620875157, 'tsl_mult': 0.5629793153815861, 'strategy': 'mean_reversion', 'time_stop': 95, 'use_sma': False, 'use_atr': False, 'use_adx': False, 'use_ema': False, 'use_spike': False, 'rsi_required': False, 'edge_k': 0.22800955950281648, 'edge_cap': 0.4467617054855489}.
[I 2025-08-29 22:01:27,384] Trial 192 finished with values: [-0.00127396339578556, 0.0014125724758342047] and parameters: {'p_sma': 49, 'p_std': 30, 'p_atr': 23, 'p_adx': 19, 'rsi_period': 13, 'ema1': 7, 'ema2': 12, 'slip_atr_k': 0.03621494404606664, 'slip_spread_k': 0.8346039909573404, 'spread_hl_frac': 0.03174727852257691, 'bb_std_mult': 1.064817631875733, 'rsi_os': 27, 'rsi_ob': 80, 'vol_spike': 0.20347915826481303, 'adx_thresh': 34.35917259101706, 'atr_min_pct': 0.0033620841411361162, 'atr_max_pct': 0.13518676320983797, 'tp_mult': 2.8995040443099955, 'tsl_mult': 0.5102055991424417, 'strategy': 'mean_reversion', 'time_stop': 95, 'use_sma': False, 'use_atr': False, 'use_adx': False, 'use_ema': False, 'use_spike': False, 'rsi_required': False, 'edge_k': 0.24673876924826696, 'edge_cap': 0.44604829002297747}.
[I 2025-08-29 22:01:27,514] Trial 191 finished with values: [-1000000000.0, 1000000000.0] and parameters: {'p_sma': 49, 'p_std': 34, 'p_atr': 21, 'p_adx': 27, 'rsi_period': 14, 'ema1': 7, 'ema2': 12, 'slip_atr_k': 0.022720401459332604, 'slip_spread_k': 0.8286889893163738, 'spread_hl_frac': 0.03219132170857067, 'bb_std_mult': 0.9702067839909831, 'rsi_os': 27, 'rsi_ob': 80, 'vol_spike': 0.20518650884846676, 'adx_thresh': 32.98450028823159, 'atr_min_pct': 0.0035160232098179157, 'atr_max_pct': 0.13261104954167588, 'tp_mult': 2.8435758961671507, 'tsl_mult': 0.5587898457993283, 'strategy': 'mean_reversion', 'time_stop': 96, 'use_sma': False, 'use_atr': False, 'use_adx': False, 'use_ema': False, 'use_spike': False, 'rsi_required': False, 'edge_k': 0.34893093865949826, 'edge_cap': 0.43871849728094015}.
[I 2025-08-29 22:01:54,592] Trial 195 finished with values: [-0.0026983036362420165, 0.0027203845279954886] and parameters: {'p_sma': 53, 'p_std': 34, 'p_atr': 23, 'p_adx': 19, 'rsi_period': 13, 'ema1': 7, 'ema2': 11, 'slip_atr_k': 0.038477985563523144, 'slip_spread_k': 0.8325469566169843, 'spread_hl_frac': 0.03313208067833861, 'bb_std_mult': 0.8607278975150499, 'rsi_os': 28, 'rsi_ob': 77, 'vol_spike': 0.23798766711220082, 'adx_thresh': 32.84954633195535, 'atr_min_pct': 0.0029640409610430228, 'atr_max_pct': 0.12329283225586607, 'tp_mult': 2.784378682857914, 'tsl_mult': 0.5469555081239611, 'strategy': 'mean_reversion', 'time_stop': 107, 'use_sma': False, 'use_atr': False, 'use_adx': False, 'use_ema': False, 'use_spike': False, 'rsi_required': False, 'edge_k': 0.37116075830537953, 'edge_cap': 0.5002397436060603}.
[I 2025-08-29 22:01:54,854] Trial 196 finished with values: [-1000000000.0, 1000000000.0] and parameters: {'p_sma': 42, 'p_std': 35, 'p_atr': 23, 'p_adx': 24, 'rsi_period': 14, 'ema1': 5, 'ema2': 11, 'slip_atr_k': 0.038946407324553525, 'slip_spread_k': 0.7889143979253967, 'spread_hl_frac': 0.03344197180489484, 'bb_std_mult': 0.874481254241845, 'rsi_os': 28, 'rsi_ob': 77, 'vol_spike': 0.23906227012473644, 'adx_thresh': 32.874483366986595, 'atr_min_pct': 0.004739249123927132, 'atr_max_pct': 0.1237402720733095, 'tp_mult': 2.6334779441606857, 'tsl_mult': 0.4998519883100842, 'strategy': 'mean_reversion', 'time_stop': 108, 'use_sma': False, 'use_atr': False, 'use_adx': False, 'use_ema': False, 'use_spike': False, 'rsi_required': False, 'edge_k': 0.3649829291117736, 'edge_cap': 0.5095256455097634}.
[I 2025-08-29 22:01:54,854] Trial 194 finished with values: [-1000000000.0, 1000000000.0] and parameters: {'p_sma': 49, 'p_std': 34, 'p_atr': 17, 'p_adx': 20, 'rsi_period': 28, 'ema1': 7, 'ema2': 11, 'slip_atr_k': 0.036140069965844346, 'slip_spread_k': 0.8417564038987952, 'spread_hl_frac': 0.033105994038594766, 'bb_std_mult': 0.8632831374605594, 'rsi_os': 28, 'rsi_ob': 77, 'vol_spike': 0.2388117838206159, 'adx_thresh': 33.192347311809186, 'atr_min_pct': 0.0046819623553630745, 'atr_max_pct': 0.13973184867908536, 'tp_mult': 2.967066182408078, 'tsl_mult': 0.5077588352408038, 'strategy': 'mean_reversion', 'time_stop': 108, 'use_sma': False, 'use_atr': False, 'use_adx': False, 'use_ema': False, 'use_spike': False, 'rsi_required': False, 'edge_k': 0.36016781293078304, 'edge_cap': 0.5017714656136714}.
[I 2025-08-29 22:01:54,954] Trial 193 finished with values: [-0.0022645500629818738, 0.0024095418761636346] and parameters: {'p_sma': 49, 'p_std': 34, 'p_atr': 23, 'p_adx': 25, 'rsi_period': 8, 'ema1': 7, 'ema2': 12, 'slip_atr_k': 0.039470722182305, 'slip_spread_k': 0.8404440294302915, 'spread_hl_frac': 0.03359918116622927, 'bb_std_mult': 0.8632338923111165, 'rsi_os': 28, 'rsi_ob': 80, 'vol_spike': 0.2437806715811936, 'adx_thresh': 32.842246159954875, 'atr_min_pct': 0.0033683049042963764, 'atr_max_pct': 0.12434991634999036, 'tp_mult': 2.884812888411805, 'tsl_mult': 0.5414714934655589, 'strategy': 'mean_reversion', 'time_stop': 86, 'use_sma': False, 'use_atr': False, 'use_adx': False, 'use_ema': False, 'use_spike': False, 'rsi_required': False, 'edge_k': 0.37046876221486114, 'edge_cap': 0.5338093648663673}.
[I 2025-08-29 22:02:21,730] Trial 197 finished with values: [-1000000000.0, 1000000000.0] and parameters: {'p_sma': 44, 'p_std': 35, 'p_atr': 23, 'p_adx': 20, 'rsi_period': 8, 'ema1': 5, 'ema2': 13, 'slip_atr_k': 0.03606818343770537, 'slip_spread_k': 0.7900661765182876, 'spread_hl_frac': 0.0337479649178734, 'bb_std_mult': 0.8598018792426383, 'rsi_os': 28, 'rsi_ob': 79, 'vol_spike': 0.23179439684877298, 'adx_thresh': 32.94100949264455, 'atr_min_pct': 0.005153542015749708, 'atr_max_pct': 0.12525591451390822, 'tp_mult': 2.7957127441486933, 'tsl_mult': 0.5074505852409842, 'strategy': 'mean_reversion', 'time_stop': 109, 'use_sma': False, 'use_atr': False, 'use_adx': False, 'use_ema': False, 'use_spike': False, 'rsi_required': False, 'edge_k': 0.38808445337218345, 'edge_cap': 0.49422388267099243}.
[I 2025-08-29 22:02:21,918] Trial 200 finished with values: [-1000000000.0, 1000000000.0] and parameters: {'p_sma': 45, 'p_std': 35, 'p_atr': 20, 'p_adx': 21, 'rsi_period': 9, 'ema1': 5, 'ema2': 13, 'slip_atr_k': 0.032658387198503586, 'slip_spread_k': 0.654496852337072, 'spread_hl_frac': 0.03527641412629729, 'bb_std_mult': 1.1010317822402622, 'rsi_os': 26, 'rsi_ob': 79, 'vol_spike': 0.22842913208238624, 'adx_thresh': 34.93447489868389, 'atr_min_pct': 0.005443611026182935, 'atr_max_pct': 0.1316578020309122, 'tp_mult': 2.778147929023445, 'tsl_mult': 0.3536606195852971, 'strategy': 'mean_reversion', 'time_stop': 116, 'use_sma': False, 'use_atr': False, 'use_adx': False, 'use_ema': False, 'use_spike': False, 'rsi_required': False, 'edge_k': 0.4109975490143897, 'edge_cap': 0.48644363315300027}.
[I 2025-08-29 22:02:22,042] Trial 198 finished with values: [-1000000000.0, 1000000000.0] and parameters: {'p_sma': 44, 'p_std': 36, 'p_atr': 7, 'p_adx': 20, 'rsi_period': 7, 'ema1': 5, 'ema2': 10, 'slip_atr_k': 0.03205319061637811, 'slip_spread_k': 0.8814437174816028, 'spread_hl_frac': 0.035574102953715686, 'bb_std_mult': 1.089486773525298, 'rsi_os': 26, 'rsi_ob': 81, 'vol_spike': 0.24986517438128722, 'adx_thresh': 31.854779380089145, 'atr_min_pct': 0.005447396091662187, 'atr_max_pct': 0.13155746594582504, 'tp_mult': 2.7644877767490144, 'tsl_mult': 0.37184999556902426, 'strategy': 'mean_reversion', 'time_stop': 86, 'use_sma': False, 'use_atr': False, 'use_adx': False, 'use_ema': False, 'use_spike': False, 'rsi_required': False, 'edge_k': 0.4045763865012339, 'edge_cap': 0.5312623153002727}.
[I 2025-08-29 22:02:22,293] Trial 199 finished with values: [-0.004905508045690676, 0.004889038600212945] and parameters: {'p_sma': 50, 'p_std': 36, 'p_atr': 23, 'p_adx': 20, 'rsi_period': 9, 'ema1': 5, 'ema2': 14, 'slip_atr_k': 0.044278114489053874, 'slip_spread_k': 0.6487536867942274, 'spread_hl_frac': 0.03412409996354586, 'bb_std_mult': 1.1017627200019968, 'rsi_os': 26, 'rsi_ob': 79, 'vol_spike': 0.23107306548023607, 'adx_thresh': 34.55199068680269, 'atr_min_pct': 0.0022773893412280895, 'atr_max_pct': 0.12625786790180898, 'tp_mult': 2.7696157536328356, 'tsl_mult': 0.5290218831686992, 'strategy': 'mean_reversion', 'time_stop': 115, 'use_sma': False, 'use_atr': False, 'use_adx': False, 'use_ema': False, 'use_spike': False, 'rsi_required': False, 'edge_k': 0.4108355278433078, 'edge_cap': 0.48041539896134433}.
[I 2025-08-29 22:02:49,169] Trial 203 finished with values: [-0.002031265929533954, 0.0023184655597410946] and parameters: {'p_sma': 46, 'p_std': 31, 'p_atr': 11, 'p_adx': 19, 'rsi_period': 33, 'ema1': 7, 'ema2': 14, 'slip_atr_k': 0.04455624569662537, 'slip_spread_k': 0.8096453846926093, 'spread_hl_frac': 0.03412909456281699, 'bb_std_mult': 1.0472457343207573, 'rsi_os': 27, 'rsi_ob': 77, 'vol_spike': 0.19643270816513295, 'adx_thresh': 33.79937700536775, 'atr_min_pct': 0.00231126133642787, 'atr_max_pct': 0.11854983419312243, 'tp_mult': 2.872372644694432, 'tsl_mult': 0.6028630213684104, 'strategy': 'mean_reversion', 'time_stop': 120, 'use_sma': False, 'use_atr': False, 'use_adx': False, 'use_ema': False, 'use_spike': False, 'rsi_required': False, 'edge_k': 0.1421592353780076, 'edge_cap': 0.464459176606315}.
[I 2025-08-29 22:02:49,367] Trial 201 finished with values: [-0.003335831191279559, 0.0033958623320772693] and parameters: {'p_sma': 53, 'p_std': 32, 'p_atr': 7, 'p_adx': 22, 'rsi_period': 20, 'ema1': 8, 'ema2': 10, 'slip_atr_k': 0.046044048328166866, 'slip_spread_k': 0.5846478023841, 'spread_hl_frac': 0.0355527083217647, 'bb_std_mult': 0.7768932037353752, 'rsi_os': 26, 'rsi_ob': 81, 'vol_spike': 0.19367792877603027, 'adx_thresh': 31.81792380957544, 'atr_min_pct': 0.0031160448914902845, 'atr_max_pct': 0.11869276793741933, 'tp_mult': 2.8801354109498436, 'tsl_mult': 0.37573313499133487, 'strategy': 'mean_reversion', 'time_stop': 86, 'use_sma': False, 'use_atr': False, 'use_adx': False, 'use_ema': False, 'use_spike': False, 'rsi_required': False, 'edge_k': 0.24990414503830616, 'edge_cap': 0.5240429108825769}.
[I 2025-08-29 22:02:49,392] Trial 202 finished with values: [-0.0024347024535045225, 0.0025402654640773493] and parameters: {'p_sma': 46, 'p_std': 36, 'p_atr': 11, 'p_adx': 22, 'rsi_period': 21, 'ema1': 7, 'ema2': 10, 'slip_atr_k': 0.04423530787721765, 'slip_spread_k': 0.8889606578675129, 'spread_hl_frac': 0.0358878747231992, 'bb_std_mult': 1.0496520926824506, 'rsi_os': 26, 'rsi_ob': 82, 'vol_spike': 0.25179806392358134, 'adx_thresh': 33.87556887153378, 'atr_min_pct': 0.003087589274856567, 'atr_max_pct': 0.11929313490323809, 'tp_mult': 2.8803304883150846, 'tsl_mult': 0.3752774901762985, 'strategy': 'mean_reversion', 'time_stop': 85, 'use_sma': False, 'use_atr': False, 'use_adx': False, 'use_ema': False, 'use_spike': False, 'rsi_required': False, 'edge_k': 0.1477990780520145, 'edge_cap': 0.4221692472974192}.
[I 2025-08-29 22:02:49,464] Trial 204 finished with values: [-1000000000.0, 1000000000.0] and parameters: {'p_sma': 53, 'p_std': 32, 'p_atr': 14, 'p_adx': 24, 'rsi_period': 41, 'ema1': 7, 'ema2': 10, 'slip_atr_k': 0.04353364361487799, 'slip_spread_k': 0.7112329756540287, 'spread_hl_frac': 0.03551444588899599, 'bb_std_mult': 0.7901515226964403, 'rsi_os': 27, 'rsi_ob': 77, 'vol_spike': 0.19960236641770285, 'adx_thresh': 33.928704503498, 'atr_min_pct': 0.0032115710912509294, 'atr_max_pct': 0.11826126233165954, 'tp_mult': 2.898964594897834, 'tsl_mult': 0.6033135400493477, 'strategy': 'mean_reversion', 'time_stop': 100, 'use_sma': False, 'use_atr': False, 'use_adx': False, 'use_ema': False, 'use_spike': False, 'rsi_required': False, 'edge_k': 0.14123462069543602, 'edge_cap': 0.4571570551185521}.
[I 2025-08-29 22:03:15,530] Trial 205 finished with values: [-0.002067778306786394, 0.0021565078194612343] and parameters: {'p_sma': 46, 'p_std': 18, 'p_atr': 22, 'p_adx': 24, 'rsi_period': 21, 'ema1': 7, 'ema2': 10, 'slip_atr_k': 0.04260493690101095, 'slip_spread_k': 0.5817629668278329, 'spread_hl_frac': 0.03548849211251578, 'bb_std_mult': 0.7945342711308045, 'rsi_os': 27, 'rsi_ob': 77, 'vol_spike': 0.19813966316789927, 'adx_thresh': 33.83053337728075, 'atr_min_pct': 0.003026656119300107, 'atr_max_pct': 0.11821797650915036, 'tp_mult': 2.903532834275873, 'tsl_mult': 0.5951280214915989, 'strategy': 'mean_reversion', 'time_stop': 102, 'use_sma': False, 'use_atr': False, 'use_adx': False, 'use_ema': False, 'use_spike': False, 'rsi_required': False, 'edge_k': 0.3195335130912033, 'edge_cap': 0.4002351696426255}.
[I 2025-08-29 22:03:16,229] Trial 206 finished with values: [-0.003510094094577254, 0.0035307898687956603] and parameters: {'p_sma': 46, 'p_std': 32, 'p_atr': 11, 'p_adx': 24, 'rsi_period': 22, 'ema1': 7, 'ema2': 10, 'slip_atr_k': 0.04726917949913746, 'slip_spread_k': 0.701399708114808, 'spread_hl_frac': 0.03583357843737911, 'bb_std_mult': 0.7747629347286926, 'rsi_os': 31, 'rsi_ob': 77, 'vol_spike': 0.19482739762328122, 'adx_thresh': 33.788003437486786, 'atr_min_pct': 0.0031144715848224896, 'atr_max_pct': 0.11834898554693919, 'tp_mult': 2.8864673556994696, 'tsl_mult': 0.41579970361301805, 'strategy': 'mean_reversion', 'time_stop': 167, 'use_sma': False, 'use_atr': False, 'use_adx': False, 'use_ema': False, 'use_spike': False, 'rsi_required': False, 'edge_k': 0.15100825706923787, 'edge_cap': 0.4583197339097491}.
[I 2025-08-29 22:03:16,372] Trial 207 finished with values: [-0.0026036574509009647, 0.002576986612046126] and parameters: {'p_sma': 46, 'p_std': 32, 'p_atr': 26, 'p_adx': 22, 'rsi_period': 22, 'ema1': 22, 'ema2': 10, 'slip_atr_k': 0.046225142167302634, 'slip_spread_k': 0.5864033963824568, 'spread_hl_frac': 0.03570881173693265, 'bb_std_mult': 0.8103056787274937, 'rsi_os': 32, 'rsi_ob': 77, 'vol_spike': 0.24147554041821098, 'adx_thresh': 34.1746534499808, 'atr_min_pct': 0.003140993101406208, 'atr_max_pct': 0.11859001896309943, 'tp_mult': 2.881951609797518, 'tsl_mult': 0.4057882800650682, 'strategy': 'mean_reversion', 'time_stop': 102, 'use_sma': False, 'use_atr': False, 'use_adx': False, 'use_ema': False, 'use_spike': False, 'rsi_required': False, 'edge_k': 0.26547419547277845, 'edge_cap': 0.5329445929424049}.
[I 2025-08-29 22:03:16,595] Trial 208 finished with values: [-0.0079523210104675, 0.007920732965902254] and parameters: {'p_sma': 46, 'p_std': 37, 'p_atr': 11, 'p_adx': 19, 'rsi_period': 22, 'ema1': 7, 'ema2': 12, 'slip_atr_k': 0.23776960971809427, 'slip_spread_k': 0.5724129642706453, 'spread_hl_frac': 0.034306651241622126, 'bb_std_mult': 0.9349013314766079, 'rsi_os': 27, 'rsi_ob': 78, 'vol_spike': 0.24033826721290358, 'adx_thresh': 33.785041041039456, 'atr_min_pct': 0.002960612351245814, 'atr_max_pct': 0.12130276108353841, 'tp_mult': 2.8774638165030475, 'tsl_mult': 0.40698957090781707, 'strategy': 'mean_reversion', 'time_stop': 242, 'use_sma': False, 'use_atr': False, 'use_adx': False, 'use_ema': False, 'use_spike': False, 'rsi_required': False, 'edge_k': 0.2583809685634416, 'edge_cap': 0.5209431950379143}.
[I 2025-08-29 22:03:43,390] Trial 212 finished with values: [-0.00544823622944246, 0.005431950742821685] and parameters: {'p_sma': 48, 'p_std': 34, 'p_atr': 22, 'p_adx': 22, 'rsi_period': 20, 'ema1': 17, 'ema2': 11, 'slip_atr_k': 0.0476959229013406, 'slip_spread_k': 0.8179282034011103, 'spread_hl_frac': 0.03602101285042838, 'bb_std_mult': 0.9225428988659486, 'rsi_os': 33, 'rsi_ob': 81, 'vol_spike': 0.18952127256733317, 'adx_thresh': 32.174787986477085, 'atr_min_pct': 0.0023326913454590602, 'atr_max_pct': 0.13871521347552473, 'tp_mult': 2.8136603428343014, 'tsl_mult': 0.4524823925259686, 'strategy': 'mean_reversion', 'time_stop': 171, 'use_sma': False, 'use_atr': False, 'use_adx': False, 'use_ema': False, 'use_spike': False, 'rsi_required': False, 'edge_k': 0.31617393844488045, 'edge_cap': 0.4578562331109744}.
[I 2025-08-29 22:03:43,547] Trial 209 finished with values: [-0.006084581910756781, 0.006048728137680515] and parameters: {'p_sma': 46, 'p_std': 34, 'p_atr': 22, 'p_adx': 22, 'rsi_period': 22, 'ema1': 10, 'ema2': 12, 'slip_atr_k': 0.23960535894407592, 'slip_spread_k': 0.5738110722086314, 'spread_hl_frac': 0.03425091640363176, 'bb_std_mult': 1.0368503444491621, 'rsi_os': 26, 'rsi_ob': 78, 'vol_spike': 0.19227302123996715, 'adx_thresh': 32.02237765383867, 'atr_min_pct': 0.002421666294261087, 'atr_max_pct': 0.13840312562454882, 'tp_mult': 2.8861674682128564, 'tsl_mult': 0.3934681483081697, 'strategy': 'mean_reversion', 'time_stop': 88, 'use_sma': False, 'use_atr': False, 'use_adx': False, 'use_ema': False, 'use_spike': False, 'rsi_required': False, 'edge_k': 0.3351304923242736, 'edge_cap': 0.5276599550073249}.
[I 2025-08-29 22:03:43,840] Trial 211 finished with values: [-0.0044053247876523205, 0.004426230609349262] and parameters: {'p_sma': 48, 'p_std': 18, 'p_atr': 11, 'p_adx': 22, 'rsi_period': 22, 'ema1': 7, 'ema2': 12, 'slip_atr_k': 0.029698888595362842, 'slip_spread_k': 0.7760599499161575, 'spread_hl_frac': 0.03587789963768053, 'bb_std_mult': 0.9162226893933213, 'rsi_os': 31, 'rsi_ob': 78, 'vol_spike': 0.21213247229822854, 'adx_thresh': 34.001382133364686, 'atr_min_pct': 0.0029715642237633055, 'atr_max_pct': 0.13674774061289346, 'tp_mult': 2.874145031466924, 'tsl_mult': 0.4054641939191399, 'strategy': 'mean_reversion', 'time_stop': 93, 'use_sma': False, 'use_atr': False, 'use_adx': False, 'use_ema': False, 'use_spike': False, 'rsi_required': False, 'edge_k': 0.32121059489402626, 'edge_cap': 0.42028630895968466}.
[I 2025-08-29 22:03:43,924] Trial 210 finished with values: [-0.0033981594882065425, 0.003387454391975857] and parameters: {'p_sma': 46, 'p_std': 18, 'p_atr': 10, 'p_adx': 22, 'rsi_period': 22, 'ema1': 16, 'ema2': 12, 'slip_atr_k': 0.040703310756647806, 'slip_spread_k': 0.8175671700341733, 'spread_hl_frac': 0.0362009212198352, 'bb_std_mult': 0.9284209663158504, 'rsi_os': 27, 'rsi_ob': 78, 'vol_spike': 0.21263283295039576, 'adx_thresh': 33.89955475676564, 'atr_min_pct': 0.0028876045622436637, 'atr_max_pct': 0.12143378406818861, 'tp_mult': 2.8646712106316174, 'tsl_mult': 0.41012546523997545, 'strategy': 'mean_reversion', 'time_stop': 90, 'use_sma': False, 'use_atr': False, 'use_adx': False, 'use_ema': False, 'use_spike': False, 'rsi_required': False, 'edge_k': 0.32157582006405183, 'edge_cap': 0.5260401690941486}.
[I 2025-08-29 22:04:10,688] Trial 214 finished with values: [-1000000000.0, 1000000000.0] and parameters: {'p_sma': 48, 'p_std': 19, 'p_atr': 22, 'p_adx': 21, 'rsi_period': 32, 'ema1': 6, 'ema2': 10, 'slip_atr_k': 0.030165168764642772, 'slip_spread_k': 0.7800007002976023, 'spread_hl_frac': 0.033036233388192365, 'bb_std_mult': 0.8143633548920218, 'rsi_os': 24, 'rsi_ob': 77, 'vol_spike': 0.22519466574091526, 'adx_thresh': 34.32167181776126, 'atr_min_pct': 0.002879879123836141, 'atr_max_pct': 0.11897046244788616, 'tp_mult': 2.8631215081886894, 'tsl_mult': 0.4860803543616529, 'strategy': 'mean_reversion', 'time_stop': 102, 'use_sma': False, 'use_atr': False, 'use_adx': False, 'use_ema': False, 'use_spike': False, 'rsi_required': False, 'edge_k': 0.2858065769074316, 'edge_cap': 0.42103351682067536}.
[I 2025-08-29 22:04:10,863] Trial 216 finished with values: [-1000000000.0, 1000000000.0] and parameters: {'p_sma': 46, 'p_std': 36, 'p_atr': 22, 'p_adx': 23, 'rsi_period': 26, 'ema1': 6, 'ema2': 10, 'slip_atr_k': 0.03850682663967614, 'slip_spread_k': 0.7088158688834789, 'spread_hl_frac': 0.03299843415557788, 'bb_std_mult': 0.7951036451064798, 'rsi_os': 24, 'rsi_ob': 77, 'vol_spike': 0.2239761270155215, 'adx_thresh': 34.50396231798351, 'atr_min_pct': 0.002221823380273829, 'atr_max_pct': 0.1305100209531534, 'tp_mult': 2.8304705072808662, 'tsl_mult': 0.480021239008108, 'strategy': 'mean_reversion', 'time_stop': 101, 'use_sma': False, 'use_atr': False, 'use_adx': False, 'use_ema': False, 'use_spike': False, 'rsi_required': False, 'edge_k': 0.3047615624052923, 'edge_cap': 0.46741541728559705}.
[I 2025-08-29 22:04:10,997] Trial 213 finished with values: [-1000000000.0, 1000000000.0] and parameters: {'p_sma': 46, 'p_std': 33, 'p_atr': 22, 'p_adx': 22, 'rsi_period': 32, 'ema1': 6, 'ema2': 10, 'slip_atr_k': 0.042682780317417714, 'slip_spread_k': 0.7215625394233526, 'spread_hl_frac': 0.03624118412755557, 'bb_std_mult': 0.8113726931504832, 'rsi_os': 24, 'rsi_ob': 77, 'vol_spike': 0.21029537342770782, 'adx_thresh': 34.292860091524695, 'atr_min_pct': 0.002383655473346305, 'atr_max_pct': 0.13007984485344648, 'tp_mult': 2.8606479459768295, 'tsl_mult': 0.47151529600718584, 'strategy': 'mean_reversion', 'time_stop': 100, 'use_sma': False, 'use_atr': False, 'use_adx': False, 'use_ema': False, 'use_spike': False, 'rsi_required': False, 'edge_k': 0.06488275195732418, 'edge_cap': 0.4237257624210032}.
