[I 2025-08-29 22:44:45,119] Trial 597 finished with values: [-1000000000.0, 1000000000.0] and parameters: {'p_sma': 19, 'p_std': 29, 'p_atr': 12, 'p_adx': 11, 'rsi_period': 17, 'ema1': 29, 'ema2': 19, 'slip_atr_k': 0.2431814097469252, 'slip_spread_k': 0.25124456792115546, 'spread_hl_frac': 0.025938291327175844, 'bb_std_mult': 0.6592596106167197, 'rsi_os': 34, 'rsi_ob': 65, 'vol_spike': 0.25064817565694164, 'adx_thresh': 7.362921983222906, 'atr_min_pct': 0.007418080299315389, 'atr_max_pct': 0.08428556945452025, 'tp_mult': 1.1902304079726003, 'tsl_mult': 0.6195107248074562, 'strategy': 'mean_reversion', 'time_stop': 286, 'use_sma': False, 'use_atr': False, 'use_adx': False, 'use_ema': False, 'use_spike': False, 'rsi_required': False, 'edge_k': 1.9290943432387226, 'edge_cap': 0.1406217666577872}.
[I 2025-08-29 22:44:45,653] Trial 595 finished with values: [-1000000000.0, 1000000000.0] and parameters: {'p_sma': 18, 'p_std': 53, 'p_atr': 12, 'p_adx': 14, 'rsi_period': 13, 'ema1': 29, 'ema2': 24, 'slip_atr_k': 0.004955121606162644, 'slip_spread_k': 0.2698629958079327, 'spread_hl_frac': 0.042179424549509716, 'bb_std_mult': 0.6535264890608833, 'rsi_os': 34, 'rsi_ob': 65, 'vol_spike': 0.2494426028257351, 'adx_thresh': 9.001232751762021, 'atr_min_pct': 0.012091863662784568, 'atr_max_pct': 0.07296298757095863, 'tp_mult': 1.8279088942943027, 'tsl_mult': 0.6219463105808483, 'strategy': 'mean_reversion', 'time_stop': 285, 'use_sma': False, 'use_atr': False, 'use_adx': False, 'use_ema': False, 'use_spike': False, 'rsi_required': False, 'edge_k': 1.9318752429887212, 'edge_cap': 0.1507050395094332}.
[I 2025-08-29 22:44:45,974] Trial 594 finished with values: [-1000000000.0, 1000000000.0] and parameters: {'p_sma': 26, 'p_std': 10, 'p_atr': 12, 'p_adx': 11, 'rsi_period': 13, 'ema1': 29, 'ema2': 20, 'slip_atr_k': 4.079912232490812e-06, 'slip_spread_k': 0.26227564714859813, 'spread_hl_frac': 0.012459122523215077, 'bb_std_mult': 0.5563422372795982, 'rsi_os': 34, 'rsi_ob': 65, 'vol_spike': 0.24947726558309116, 'adx_thresh': 28.54136521790226, 'atr_min_pct': 0.005672811902318718, 'atr_max_pct': 0.07422644140950356, 'tp_mult': 1.8370429499463128, 'tsl_mult': 0.6229158088752867, 'strategy': 'mean_reversion', 'time_stop': 287, 'use_sma': False, 'use_atr': False, 'use_adx': False, 'use_ema': False, 'use_spike': False, 'rsi_required': False, 'edge_k': 1.9281281152374323, 'edge_cap': 0.14436657821879378}.
[I 2025-08-29 22:44:46,033] Trial 596 finished with values: [-1000000000.0, 1000000000.0] and parameters: {'p_sma': 18, 'p_std': 30, 'p_atr': 14, 'p_adx': 11, 'rsi_period': 12, 'ema1': 29, 'ema2': 19, 'slip_atr_k': 0.1686205794878423, 'slip_spread_k': 0.33054852707528526, 'spread_hl_frac': 0.042535349318274365, 'bb_std_mult': 1.8386825321614308, 'rsi_os': 34, 'rsi_ob': 62, 'vol_spike': 0.25041426236567205, 'adx_thresh': 28.510985443740523, 'atr_min_pct': 0.01993083921767369, 'atr_max_pct': 0.07484392229750043, 'tp_mult': 2.587372149976561, 'tsl_mult': 0.6265122795810348, 'strategy': 'mean_reversion', 'time_stop': 287, 'use_sma': False, 'use_atr': False, 'use_adx': False, 'use_ema': False, 'use_spike': False, 'rsi_required': False, 'edge_k': 1.9297387354599658, 'edge_cap': 0.15209515498695342}.
[I 2025-08-29 22:45:13,694] Trial 601 finished with values: [-1000000000.0, 1000000000.0] and parameters: {'p_sma': 24, 'p_std': 11, 'p_atr': 13, 'p_adx': 17, 'rsi_period': 15, 'ema1': 30, 'ema2': 29, 'slip_atr_k': 0.004294355151411599, 'slip_spread_k': 0.19910863780683813, 'spread_hl_frac': 0.019117097175362027, 'bb_std_mult': 2.1431814698953824, 'rsi_os': 37, 'rsi_ob': 62, 'vol_spike': 0.2399962067728509, 'adx_thresh': 20.542370126623087, 'atr_min_pct': 0.02477011755300288, 'atr_max_pct': 0.06432985623755043, 'tp_mult': 2.6547412865039646, 'tsl_mult': 0.654323741658051, 'strategy': 'breakout', 'time_stop': 295, 'use_sma': False, 'use_atr': False, 'use_adx': False, 'use_ema': False, 'use_spike': False, 'rsi_required': False, 'edge_k': 1.9746424542863668, 'edge_cap': 0.17918165223419344}.
[I 2025-08-29 22:45:14,356] Trial 598 finished with values: [-1000000000.0, 1000000000.0] and parameters: {'p_sma': 18, 'p_std': 5, 'p_atr': 14, 'p_adx': 17, 'rsi_period': 12, 'ema1': 29, 'ema2': 20, 'slip_atr_k': 0.00025968637529328524, 'slip_spread_k': 0.26035745126996274, 'spread_hl_frac': 0.012272856246750983, 'bb_std_mult': 1.7932814886156982, 'rsi_os': 34, 'rsi_ob': 65, 'vol_spike': 0.2471428678959775, 'adx_thresh': 8.836852358745963, 'atr_min_pct': 0.025165794977268847, 'atr_max_pct': 0.07386905067526416, 'tp_mult': 2.0550079204403042, 'tsl_mult': 0.615198397582766, 'strategy': 'mean_reversion', 'time_stop': 284, 'use_sma': False, 'use_atr': False, 'use_adx': False, 'use_ema': False, 'use_spike': False, 'rsi_required': False, 'edge_k': 1.9569127031733333, 'edge_cap': 0.1449944680705675}.
[I 2025-08-29 22:45:14,531] Trial 599 finished with values: [-1000000000.0, 1000000000.0] and parameters: {'p_sma': 24, 'p_std': 12, 'p_atr': 13, 'p_adx': 11, 'rsi_period': 15, 'ema1': 30, 'ema2': 30, 'slip_atr_k': 0.00041898294633508265, 'slip_spread_k': 0.3249772864391764, 'spread_hl_frac': 0.014505687794004839, 'bb_std_mult': 1.5391975707780048, 'rsi_os': 37, 'rsi_ob': 62, 'vol_spike': 0.24071721601579704, 'adx_thresh': 28.733893545891004, 'atr_min_pct': 0.01718732646465729, 'atr_max_pct': 0.0646435446635207, 'tp_mult': 2.5960500265314828, 'tsl_mult': 0.6658246440064397, 'strategy': 'mean_reversion', 'time_stop': 294, 'use_sma': False, 'use_atr': False, 'use_adx': False, 'use_ema': False, 'use_spike': False, 'rsi_required': False, 'edge_k': 1.9670930445098058, 'edge_cap': 0.1409607198260102}.
[I 2025-08-29 22:45:14,611] Trial 600 finished with values: [-1000000000.0, 1000000000.0] and parameters: {'p_sma': 28, 'p_std': 12, 'p_atr': 13, 'p_adx': 17, 'rsi_period': 16, 'ema1': 30, 'ema2': 30, 'slip_atr_k': 0.0066205376361662405, 'slip_spread_k': 0.22211495086991312, 'spread_hl_frac': 0.008649483086879085, 'bb_std_mult': 2.1244168795084937, 'rsi_os': 37, 'rsi_ob': 62, 'vol_spike': 0.23998318395607562, 'adx_thresh': 31.10406977403207, 'atr_min_pct': 0.016247921157412182, 'atr_max_pct': 0.06511802870083928, 'tp_mult': 2.0784483779657266, 'tsl_mult': 0.6656793104366215, 'strategy': 'breakout', 'time_stop': 296, 'use_sma': False, 'use_atr': False, 'use_adx': False, 'use_ema': False, 'use_spike': False, 'rsi_required': False, 'edge_k': 1.99109784070618, 'edge_cap': 0.17535476330866492}.
[I 2025-08-29 22:45:42,252] Trial 602 finished with values: [-1000000000.0, 1000000000.0] and parameters: {'p_sma': 28, 'p_std': 13, 'p_atr': 15, 'p_adx': 15, 'rsi_period': 12, 'ema1': 30, 'ema2': 22, 'slip_atr_k': 0.09962936012791185, 'slip_spread_k': 0.236721128234344, 'spread_hl_frac': 0.008735317368775981, 'bb_std_mult': 1.9852444024386464, 'rsi_os': 35, 'rsi_ob': 63, 'vol_spike': 0.24068639997025534, 'adx_thresh': 10.213039035235571, 'atr_min_pct': 0.01650441013767586, 'atr_max_pct': 0.07009554368580005, 'tp_mult': 2.2265645762223283, 'tsl_mult': 0.6655662301038141, 'strategy': 'mean_reversion', 'time_stop': 279, 'use_sma': False, 'use_atr': False, 'use_adx': False, 'use_ema': False, 'use_spike': False, 'rsi_required': False, 'edge_k': 1.9866716198907863, 'edge_cap': 0.17655547253475187}.
[I 2025-08-29 22:45:42,410] Trial 604 finished with values: [-1000000000.0, 1000000000.0] and parameters: {'p_sma': 28, 'p_std': 48, 'p_atr': 13, 'p_adx': 14, 'rsi_period': 12, 'ema1': 30, 'ema2': 23, 'slip_atr_k': 0.00880118582100593, 'slip_spread_k': 0.29823477544895566, 'spread_hl_frac': 0.008890679452414188, 'bb_std_mult': 1.9695577467004963, 'rsi_os': 39, 'rsi_ob': 62, 'vol_spike': 0.25588466477004335, 'adx_thresh': 23.024588720899906, 'atr_min_pct': 0.01595449093562583, 'atr_max_pct': 0.06736928212746016, 'tp_mult': 1.907833170740911, 'tsl_mult': 0.6402584284114169, 'strategy': 'breakout', 'time_stop': 274, 'use_sma': False, 'use_atr': False, 'use_adx': False, 'use_ema': False, 'use_spike': False, 'rsi_required': False, 'edge_k': 1.8877571141793292, 'edge_cap': 0.11465360587501083}.
[I 2025-08-29 22:45:42,509] Trial 603 finished with values: [-1000000000.0, 1000000000.0] and parameters: {'p_sma': 28, 'p_std': 13, 'p_atr': 13, 'p_adx': 15, 'rsi_period': 15, 'ema1': 30, 'ema2': 30, 'slip_atr_k': 9.759323326145446e-05, 'slip_spread_k': 0.227267760570544, 'spread_hl_frac': 0.014327217554386928, 'bb_std_mult': 2.0414418217709405, 'rsi_os': 39, 'rsi_ob': 63, 'vol_spike': 0.2399039254055153, 'adx_thresh': 11.120710497374276, 'atr_min_pct': 0.021692093159565825, 'atr_max_pct': 0.0690267807177036, 'tp_mult': 1.9038077088706784, 'tsl_mult': 0.6581449103374662, 'strategy': 'mean_reversion', 'time_stop': 274, 'use_sma': False, 'use_atr': False, 'use_adx': False, 'use_ema': False, 'use_spike': False, 'rsi_required': False, 'edge_k': 1.8885269712257011, 'edge_cap': 0.17793111024565575}.
[I 2025-08-29 22:45:42,612] Trial 605 finished with values: [-1000000000.0, 1000000000.0] and parameters: {'p_sma': 27, 'p_std': 27, 'p_atr': 15, 'p_adx': 14, 'rsi_period': 12, 'ema1': 30, 'ema2': 28, 'slip_atr_k': 0.017055282778073888, 'slip_spread_k': 0.353022441779693, 'spread_hl_frac': 0.028272798283040607, 'bb_std_mult': 1.982542333202491, 'rsi_os': 35, 'rsi_ob': 63, 'vol_spike': 0.25682844250585946, 'adx_thresh': 19.49127134890174, 'atr_min_pct': 0.01289983022948226, 'atr_max_pct': 0.06729128497753167, 'tp_mult': 1.902620464652236, 'tsl_mult': 0.6392327908080736, 'strategy': 'mean_reversion', 'time_stop': 273, 'use_sma': False, 'use_atr': False, 'use_adx': False, 'use_ema': False, 'use_spike': False, 'rsi_required': False, 'edge_k': 1.8973831366041103, 'edge_cap': 0.1812343493413961}.
[I 2025-08-29 22:46:10,210] Trial 608 finished with values: [-1000000000.0, 1000000000.0] and parameters: {'p_sma': 14, 'p_std': 16, 'p_atr': 15, 'p_adx': 13, 'rsi_period': 51, 'ema1': 29, 'ema2': 27, 'slip_atr_k': 0.07133082204597595, 'slip_spread_k': 0.34875318643401887, 'spread_hl_frac': 0.010107415053428057, 'bb_std_mult': 1.424295731014098, 'rsi_os': 35, 'rsi_ob': 64, 'vol_spike': 0.2503959361921846, 'adx_thresh': 20.819638326521815, 'atr_min_pct': 0.009583353319176808, 'atr_max_pct': 0.07948371365572889, 'tp_mult': 2.0285268446840337, 'tsl_mult': 0.6157975981369792, 'strategy': 'mean_reversion', 'time_stop': 281, 'use_sma': False, 'use_atr': False, 'use_adx': False, 'use_ema': False, 'use_spike': False, 'rsi_required': False, 'edge_k': 1.9182280783571324, 'edge_cap': 0.08354271170972688}.
[I 2025-08-29 22:46:10,427] Trial 609 finished with values: [-1000000000.0, 1000000000.0] and parameters: {'p_sma': 20, 'p_std': 15, 'p_atr': 12, 'p_adx': 13, 'rsi_period': 11, 'ema1': 29, 'ema2': 18, 'slip_atr_k': 0.18704330715345616, 'slip_spread_k': 0.2936236305787325, 'spread_hl_frac': 0.007237883868981814, 'bb_std_mult': 1.5948570816748362, 'rsi_os': 34, 'rsi_ob': 64, 'vol_spike': 0.2545165969717218, 'adx_thresh': 20.846446056314022, 'atr_min_pct': 0.009045956200073212, 'atr_max_pct': 0.07940440291283135, 'tp_mult': 2.0369542589668166, 'tsl_mult': 0.6950620867020948, 'strategy': 'mean_reversion', 'time_stop': 280, 'use_sma': False, 'use_atr': False, 'use_adx': False, 'use_ema': False, 'use_spike': False, 'rsi_required': False, 'edge_k': 1.8298670222660922, 'edge_cap': 0.08345471539408028}.
[I 2025-08-29 22:46:10,427] Trial 607 finished with values: [-1000000000.0, 1000000000.0] and parameters: {'p_sma': 22, 'p_std': 16, 'p_atr': 15, 'p_adx': 13, 'rsi_period': 51, 'ema1': 29, 'ema2': 26, 'slip_atr_k': 0.18816291850474637, 'slip_spread_k': 0.29929539627946466, 'spread_hl_frac': 0.007156733344534214, 'bb_std_mult': 1.621153786282695, 'rsi_os': 35, 'rsi_ob': 64, 'vol_spike': 0.25478328850522497, 'adx_thresh': 20.752125702357574, 'atr_min_pct': 0.006330420665211568, 'atr_max_pct': 0.078734934944726, 'tp_mult': 2.024725923219541, 'tsl_mult': 0.6959017200299793, 'strategy': 'mean_reversion', 'time_stop': 281, 'use_sma': False, 'use_atr': False, 'use_adx': False, 'use_ema': False, 'use_spike': False, 'rsi_required': False, 'edge_k': 1.911809585269698, 'edge_cap': 0.18766657141494256}.
[I 2025-08-29 22:46:10,587] Trial 606 finished with values: [-1000000000.0, 1000000000.0] and parameters: {'p_sma': 27, 'p_std': 11, 'p_atr': 12, 'p_adx': 14, 'rsi_period': 12, 'ema1': 30, 'ema2': 27, 'slip_atr_k': 0.06323205161287793, 'slip_spread_k': 0.2935325727660454, 'spread_hl_frac': 0.007065459285325509, 'bb_std_mult': 1.5907729414085945, 'rsi_os': 36, 'rsi_ob': 63, 'vol_spike': 0.2560248650975765, 'adx_thresh': 22.85557047534361, 'atr_min_pct': 0.011959803140604375, 'atr_max_pct': 0.06885233554073841, 'tp_mult': 2.0318420967018516, 'tsl_mult': 0.6359887374187934, 'strategy': 'mean_reversion', 'time_stop': 274, 'use_sma': False, 'use_atr': False, 'use_adx': False, 'use_ema': False, 'use_spike': False, 'rsi_required': False, 'edge_k': 1.8989802866996348, 'edge_cap': 0.12402277324908978}.
[I 2025-08-29 22:46:37,617] Trial 611 finished with values: [-1000000000.0, 1000000000.0] and parameters: {'p_sma': 25, 'p_std': 11, 'p_atr': 12, 'p_adx': 16, 'rsi_period': 11, 'ema1': 30, 'ema2': 24, 'slip_atr_k': 0.1372319912181878, 'slip_spread_k': 0.32862130790840083, 'spread_hl_frac': 0.01108683678414519, 'bb_std_mult': 1.751589911781167, 'rsi_os': 10, 'rsi_ob': 87, 'vol_spike': 0.2463027682116083, 'adx_thresh': 21.801495549637895, 'atr_min_pct': 0.019398007665381297, 'atr_max_pct': 0.08385748122024259, 'tp_mult': 2.146534824427257, 'tsl_mult': 0.6099309424584981, 'strategy': 'breakout', 'time_stop': 292, 'use_sma': False, 'use_atr': False, 'use_adx': False, 'use_ema': False, 'use_spike': False, 'rsi_required': False, 'edge_k': 1.9561737529295906, 'edge_cap': 0.13273242259629445}.
[I 2025-08-29 22:46:37,899] Trial 610 finished with values: [-1000000000.0, 1000000000.0] and parameters: {'p_sma': 23, 'p_std': 43, 'p_atr': 14, 'p_adx': 16, 'rsi_period': 11, 'ema1': 29, 'ema2': 26, 'slip_atr_k': 0.005060740198880283, 'slip_spread_k': 0.2945813328187878, 'spread_hl_frac': 0.011176585881831659, 'bb_std_mult': 1.5761382710363783, 'rsi_os': 34, 'rsi_ob': 64, 'vol_spike': 0.25447511887913704, 'adx_thresh': 21.652656960532248, 'atr_min_pct': 0.0062686032677300284, 'atr_max_pct': 0.07273958459153206, 'tp_mult': 1.3014880117962822, 'tsl_mult': 0.6937710589417149, 'strategy': 'mean_reversion', 'time_stop': 282, 'use_sma': False, 'use_atr': False, 'use_adx': False, 'use_ema': False, 'use_spike': False, 'rsi_required': False, 'edge_k': 1.999080711298258, 'edge_cap': 0.1880741589595536}.
[I 2025-08-29 22:46:38,105] Trial 613 finished with values: [-1000000000.0, 1000000000.0] and parameters: {'p_sma': 23, 'p_std': 9, 'p_atr': 16, 'p_adx': 16, 'rsi_period': 17, 'ema1': 30, 'ema2': 22, 'slip_atr_k': 0.11819480398219513, 'slip_spread_k': 0.3184232462677242, 'spread_hl_frac': 0.048027821226582876, 'bb_std_mult': 1.161767170576306, 'rsi_os': 10, 'rsi_ob': 62, 'vol_spike': 0.24523493757895143, 'adx_thresh': 12.336652707345415, 'atr_min_pct': 0.01448315651492639, 'atr_max_pct': 0.06198819075551282, 'tp_mult': 1.3130411376182884, 'tsl_mult': 0.6097965359483427, 'strategy': 'breakout', 'time_stop': 294, 'use_sma': False, 'use_atr': False, 'use_adx': False, 'use_ema': False, 'use_spike': False, 'rsi_required': False, 'edge_k': 1.9955640342947563, 'edge_cap': 0.13448163115039213}.
[I 2025-08-29 22:46:38,223] Trial 612 finished with values: [-1000000000.0, 1000000000.0] and parameters: {'p_sma': 25, 'p_std': 43, 'p_atr': 12, 'p_adx': 16, 'rsi_period': 11, 'ema1': 30, 'ema2': 24, 'slip_atr_k': 0.06696843123025184, 'slip_spread_k': 0.2021550219166371, 'spread_hl_frac': 0.010887306693699103, 'bb_std_mult': 2.3650521865504723, 'rsi_os': 38, 'rsi_ob': 62, 'vol_spike': 0.24482736367992447, 'adx_thresh': 14.945737779722748, 'atr_min_pct': 0.014280120415913764, 'atr_max_pct': 0.0835340001183887, 'tp_mult': 2.4848086458218717, 'tsl_mult': 0.6311365760634662, 'strategy': 'breakout', 'time_stop': 290, 'use_sma': False, 'use_atr': False, 'use_adx': False, 'use_ema': False, 'use_spike': False, 'rsi_required': False, 'edge_k': 1.996820040193426, 'edge_cap': 0.12020742654347194}.
[I 2025-08-29 22:47:05,592] Trial 617 finished with values: [-1000000000.0, 1000000000.0] and parameters: {'p_sma': 5, 'p_std': 14, 'p_atr': 13, 'p_adx': 15, 'rsi_period': 15, 'ema1': 29, 'ema2': 16, 'slip_atr_k': 0.00890446407485088, 'slip_spread_k': 0.24517857656958386, 'spread_hl_frac': 0.013083417875939654, 'bb_std_mult': 2.250007525120946, 'rsi_os': 33, 'rsi_ob': 62, 'vol_spike': 0.07830993216851949, 'adx_thresh': 19.601753699375877, 'atr_min_pct': 0.005099992896760425, 'atr_max_pct': 0.08722546417286245, 'tp_mult': 1.9434395289434563, 'tsl_mult': 0.6109576522813402, 'strategy': 'mean_reversion', 'time_stop': 286, 'use_sma': False, 'use_atr': False, 'use_adx': False, 'use_ema': False, 'use_spike': False, 'rsi_required': False, 'edge_k': 1.9401870584357643, 'edge_cap': 0.16150031251724095}.
[I 2025-08-29 22:47:05,856] Trial 615 finished with values: [-1000000000.0, 1000000000.0] and parameters: {'p_sma': 20, 'p_std': 49, 'p_atr': 14, 'p_adx': 11, 'rsi_period': 14, 'ema1': 30, 'ema2': 22, 'slip_atr_k': 0.11789148095351187, 'slip_spread_k': 0.25460738429469415, 'spread_hl_frac': 0.01285803417256447, 'bb_std_mult': 1.1707045306948813, 'rsi_os': 33, 'rsi_ob': 66, 'vol_spike': 0.24585401650300098, 'adx_thresh': 12.430511891801803, 'atr_min_pct': 0.014396000345560045, 'atr_max_pct': 0.0865546046889767, 'tp_mult': 1.9446757793932314, 'tsl_mult': 0.6350128033910755, 'strategy': 'breakout', 'time_stop': 290, 'use_sma': False, 'use_atr': False, 'use_adx': False, 'use_ema': False, 'use_spike': False, 'rsi_required': False, 'edge_k': 1.9431417177122132, 'edge_cap': 0.16163609181784688}.
[I 2025-08-29 22:47:06,139] Trial 616 finished with values: [-1000000000.0, 1000000000.0] and parameters: {'p_sma': 25, 'p_std': 14, 'p_atr': 14, 'p_adx': 15, 'rsi_period': 14, 'ema1': 30, 'ema2': 16, 'slip_atr_k': 0.09394433762830953, 'slip_spread_k': 0.2535574660816919, 'spread_hl_frac': 0.012738369755495553, 'bb_std_mult': 2.2690752892967248, 'rsi_os': 38, 'rsi_ob': 66, 'vol_spike': 0.25250713501252064, 'adx_thresh': 19.613827540285666, 'atr_min_pct': 0.010490729088138756, 'atr_max_pct': 0.07112973984858131, 'tp_mult': 1.9602604261407117, 'tsl_mult': 0.6347007762990051, 'strategy': 'mean_reversion', 'time_stop': 289, 'use_sma': False, 'use_atr': False, 'use_adx': False, 'use_ema': False, 'use_spike': False, 'rsi_required': False, 'edge_k': 1.9381551177957905, 'edge_cap': 0.16280850519445128}.
[I 2025-08-29 22:47:06,313] Trial 614 finished with values: [-1000000000.0, 1000000000.0] and parameters: {'p_sma': 23, 'p_std': 13, 'p_atr': 14, 'p_adx': 16, 'rsi_period': 18, 'ema1': 30, 'ema2': 16, 'slip_atr_k': 0.009005935906140097, 'slip_spread_k': 0.19373676013286334, 'spread_hl_frac': 0.013138386818062701, 'bb_std_mult': 1.1749890200277577, 'rsi_os': 33, 'rsi_ob': 67, 'vol_spike': 0.2465734865431909, 'adx_thresh': 13.452765496864039, 'atr_min_pct': 0.026271345152038942, 'atr_max_pct': 0.07220296159405568, 'tp_mult': 1.3146522891821257, 'tsl_mult': 0.6201217373994274, 'strategy': 'mean_reversion', 'time_stop': 289, 'use_sma': False, 'use_atr': False, 'use_adx': False, 'use_ema': False, 'use_spike': False, 'rsi_required': False, 'edge_k': 1.9757092088509407, 'edge_cap': 0.37449298271966214}.
[I 2025-08-29 22:47:06,547] Trial 620 finished with values: [-1000000000.0, 1000000000.0] and parameters: {'p_sma': 19, 'p_std': 11, 'p_atr': 12, 'p_adx': 12, 'rsi_period': 75, 'ema1': 29, 'ema2': 20, 'slip_atr_k': 0.2096197092786054, 'slip_spread_k': 0.2737574253114123, 'spread_hl_frac': 0.010034229358820574, 'bb_std_mult': 0.5523450421044466, 'rsi_os': 55, 'rsi_ob': 61, 'vol_spike': 0.25692947032175567, 'adx_thresh': 13.526697714405714, 'atr_min_pct': 0.02446084756673675, 'atr_max_pct': 0.06436589388140111, 'tp_mult': 1.6511374804682861, 'tsl_mult': 0.6502491927568265, 'strategy': 'mean_reversion', 'time_stop': 279, 'use_sma': False, 'use_atr': False, 'use_adx': False, 'use_ema': False, 'use_spike': False, 'rsi_required': False, 'edge_k': 1.8623665250052048, 'edge_cap': 0.19510651275699223}.
[I 2025-08-29 22:47:33,663] Trial 619 finished with values: [-1000000000.0, 1000000000.0] and parameters: {'p_sma': 29, 'p_std': 20, 'p_atr': 14, 'p_adx': 12, 'rsi_period': 44, 'ema1': 30, 'ema2': 18, 'slip_atr_k': 0.22940055727010142, 'slip_spread_k': 0.16607059069903884, 'spread_hl_frac': 0.009650053611093628, 'bb_std_mult': 2.434120300564679, 'rsi_os': 40, 'rsi_ob': 52, 'vol_spike': 0.2522378077604363, 'adx_thresh': 20.0128806982929, 'atr_min_pct': 0.025858368694102445, 'atr_max_pct': 0.06416358561878124, 'tp_mult': 1.8558858826042068, 'tsl_mult': 0.6452904488151099, 'strategy': 'mean_reversion', 'time_stop': 279, 'use_sma': False, 'use_atr': False, 'use_adx': False, 'use_ema': False, 'use_spike': False, 'rsi_required': False, 'edge_k': 1.867883721575996, 'edge_cap': 0.18282541266816527}.
[I 2025-08-29 22:47:33,999] Trial 618 finished with values: [-1000000000.0, 1000000000.0] and parameters: {'p_sma': 29, 'p_std': 13, 'p_atr': 12, 'p_adx': 12, 'rsi_period': 45, 'ema1': 30, 'ema2': 18, 'slip_atr_k': 4.152563362774006e-05, 'slip_spread_k': 0.26228111173575364, 'spread_hl_frac': 0.012089347817410926, 'bb_std_mult': 1.831873567243627, 'rsi_os': 36, 'rsi_ob': 66, 'vol_spike': 0.2531414145913243, 'adx_thresh': 20.146107282834237, 'atr_min_pct': 0.023214417487302068, 'atr_max_pct': 0.07132433716035096, 'tp_mult': 1.8437609017987096, 'tsl_mult': 0.6411912170851697, 'strategy': 'mean_reversion', 'time_stop': 281, 'use_sma': False, 'use_atr': False, 'use_adx': False, 'use_ema': False, 'use_spike': False, 'rsi_required': False, 'edge_k': 1.858730586542115, 'edge_cap': 0.19629152526756846}.
