[I 2025-08-29 23:31:50,152] Trial 1056 finished with values: [-1000000000.0, 1000000000.0] and parameters: {'p_sma': 28, 'p_std': 15, 'p_atr': 13, 'p_adx': 14, 'rsi_period': 9, 'ema1': 25, 'ema2': 23, 'slip_atr_k': 0.00011455978608960679, 'slip_spread_k': 0.2740334294466561, 'spread_hl_frac': 0.03153581627562008, 'bb_std_mult': 3.356180636925436, 'rsi_os': 22, 'rsi_ob': 45, 'vol_spike': 0.23721744626524421, 'adx_thresh': 19.989769549457083, 'atr_min_pct': 0.016261120799186193, 'atr_max_pct': 0.07767758732071588, 'tp_mult': 1.9016143831823962, 'tsl_mult': 0.6436826717820784, 'strategy': 'mean_reversion', 'time_stop': 238, 'use_sma': False, 'use_atr': False, 'use_adx': False, 'use_ema': False, 'use_spike': False, 'rsi_required': False, 'edge_k': 1.938115071937751, 'edge_cap': 0.19742056305435207}.
[I 2025-08-29 23:32:16,194] Trial 1053 finished with values: [-1000000000.0, 1000000000.0] and parameters: {'p_sma': 28, 'p_std': 12, 'p_atr': 13, 'p_adx': 21, 'rsi_period': 9, 'ema1': 29, 'ema2': 21, 'slip_atr_k': 0.20304251195217252, 'slip_spread_k': 0.6297062794645352, 'spread_hl_frac': 0.03777597696141708, 'bb_std_mult': 1.3133795279561988, 'rsi_os': 13, 'rsi_ob': 62, 'vol_spike': 0.2452167658767897, 'adx_thresh': 21.436655691062526, 'atr_min_pct': 0.01057870486481291, 'atr_max_pct': 0.07371264685640207, 'tp_mult': 1.8952946906728454, 'tsl_mult': 0.37506911387676034, 'strategy': 'breakout', 'time_stop': 273, 'use_sma': False, 'use_atr': False, 'use_adx': False, 'use_ema': False, 'use_spike': False, 'rsi_required': False, 'edge_k': 1.8278888058110037, 'edge_cap': 0.39590547803850984}.
[I 2025-08-29 23:32:16,375] Trial 1055 finished with values: [-0.03839871810252771, 0.03838880234601117] and parameters: {'p_sma': 32, 'p_std': 9, 'p_atr': 24, 'p_adx': 14, 'rsi_period': 9, 'ema1': 30, 'ema2': 21, 'slip_atr_k': 0.21532284399385787, 'slip_spread_k': 0.2806187700211295, 'spread_hl_frac': 0.012104271117185221, 'bb_std_mult': 1.5116571823538951, 'rsi_os': 34, 'rsi_ob': 63, 'vol_spike': 0.23816197013746046, 'adx_thresh': 32.300802988922555, 'atr_min_pct': 0.001187120887897082, 'atr_max_pct': 0.07192432485635605, 'tp_mult': 1.9093599478734908, 'tsl_mult': 0.7481422791031263, 'strategy': 'mean_reversion', 'time_stop': 269, 'use_sma': False, 'use_atr': False, 'use_adx': False, 'use_ema': False, 'use_spike': False, 'rsi_required': False, 'edge_k': 1.9371488806620771, 'edge_cap': 0.20208643451280184}.
[I 2025-08-29 23:32:16,558] Trial 1054 finished with values: [-1000000000.0, 1000000000.0] and parameters: {'p_sma': 28, 'p_std': 9, 'p_atr': 24, 'p_adx': 9, 'rsi_period': 8, 'ema1': 30, 'ema2': 21, 'slip_atr_k': 0.01339039673100241, 'slip_spread_k': 0.9090588708150561, 'spread_hl_frac': 0.011380214875662507, 'bb_std_mult': 3.2809962535175323, 'rsi_os': 13, 'rsi_ob': 84, 'vol_spike': 0.24515410797950288, 'adx_thresh': 12.660661160066347, 'atr_min_pct': 0.016689495365315526, 'atr_max_pct': 0.07812407198354007, 'tp_mult': 1.878669351836235, 'tsl_mult': 0.3791599177952667, 'strategy': 'mean_reversion', 'time_stop': 270, 'use_sma': False, 'use_atr': False, 'use_adx': False, 'use_ema': False, 'use_spike': False, 'rsi_required': False, 'edge_k': 1.9361679701554988, 'edge_cap': 0.16354056240471382}.
[I 2025-08-29 23:32:17,517] Trial 1057 finished with values: [-1000000000.0, 1000000000.0] and parameters: {'p_sma': 56, 'p_std': 9, 'p_atr': 11, 'p_adx': 12, 'rsi_period': 34, 'ema1': 30, 'ema2': 19, 'slip_atr_k': 0.2152834506621052, 'slip_spread_k': 0.32406230728389984, 'spread_hl_frac': 0.013176593647337505, 'bb_std_mult': 1.4963180710004433, 'rsi_os': 49, 'rsi_ob': 60, 'vol_spike': 0.15961187006211008, 'adx_thresh': 32.34501545714709, 'atr_min_pct': 0.017501212023749588, 'atr_max_pct': 0.06745445273952029, 'tp_mult': 1.9555187278650226, 'tsl_mult': 0.11516664047724245, 'strategy': 'mean_reversion', 'time_stop': 272, 'use_sma': False, 'use_atr': False, 'use_adx': False, 'use_ema': False, 'use_spike': False, 'rsi_required': False, 'edge_k': 1.8801005034990674, 'edge_cap': 0.16480354289521262}.
[I 2025-08-29 23:32:17,740] Trial 1059 finished with values: [-1000000000.0, 1000000000.0] and parameters: {'p_sma': 30, 'p_std': 44, 'p_atr': 11, 'p_adx': 7, 'rsi_period': 12, 'ema1': 30, 'ema2': 19, 'slip_atr_k': 0.00019841083952461662, 'slip_spread_k': 0.578254276720951, 'spread_hl_frac': 0.01414971419431711, 'bb_std_mult': 2.734644427530293, 'rsi_os': 51, 'rsi_ob': 60, 'vol_spike': 0.13231403004591766, 'adx_thresh': 12.656703453958535, 'atr_min_pct': 0.01735309889899895, 'atr_max_pct': 0.06891502103096006, 'tp_mult': 1.951323861426776, 'tsl_mult': 0.5784613336172764, 'strategy': 'mean_reversion', 'time_stop': 286, 'use_sma': False, 'use_atr': False, 'use_adx': False, 'use_ema': False, 'use_spike': False, 'rsi_required': False, 'edge_k': 1.2866355981857125, 'edge_cap': 0.7725168704544414}.
[I 2025-08-29 23:32:18,008] Trial 1062 finished with values: [-1000000000.0, 1000000000.0] and parameters: {'p_sma': 24, 'p_std': 53, 'p_atr': 12, 'p_adx': 18, 'rsi_period': 74, 'ema1': 15, 'ema2': 23, 'slip_atr_k': 0.008909860999590551, 'slip_spread_k': 0.5431867829945864, 'spread_hl_frac': 0.010595301952274276, 'bb_std_mult': 1.1029377248896977, 'rsi_os': 54, 'rsi_ob': 64, 'vol_spike': 0.27324060763520563, 'adx_thresh': 18.647184795139218, 'atr_min_pct': 0.005723448106554916, 'atr_max_pct': 0.06548897097038284, 'tp_mult': 2.9616059517325315, 'tsl_mult': 0.6927391378842149, 'strategy': 'mean_reversion', 'time_stop': 42, 'use_sma': False, 'use_atr': False, 'use_adx': False, 'use_ema': False, 'use_spike': False, 'rsi_required': False, 'edge_k': 1.9669541700437947, 'edge_cap': 0.24639178243668552}.
[I 2025-08-29 23:32:43,281] Trial 1060 finished with values: [-1000000000.0, 1000000000.0] and parameters: {'p_sma': 30, 'p_std': 11, 'p_atr': 11, 'p_adx': 12, 'rsi_period': 74, 'ema1': 30, 'ema2': 23, 'slip_atr_k': 3.426335360167776e-05, 'slip_spread_k': 0.3139394404017185, 'spread_hl_frac': 0.013528415149226924, 'bb_std_mult': 1.1324314155714175, 'rsi_os': 32, 'rsi_ob': 60, 'vol_spike': 0.15914649937756295, 'adx_thresh': 18.797853944742545, 'atr_min_pct': 0.017366189021773615, 'atr_max_pct': 0.0676032825491367, 'tp_mult': 1.9549982079894979, 'tsl_mult': 0.11829641543334796, 'strategy': 'mean_reversion', 'time_stop': 277, 'use_sma': False, 'use_atr': False, 'use_adx': False, 'use_ema': False, 'use_spike': False, 'rsi_required': False, 'edge_k': 1.2868695071458656, 'edge_cap': 0.16444021105719178}.
[I 2025-08-29 23:32:44,052] Trial 1061 finished with values: [-0.03164805696329476, 0.031636397466325836] and parameters: {'p_sma': 30, 'p_std': 53, 'p_atr': 16, 'p_adx': 28, 'rsi_period': 12, 'ema1': 30, 'ema2': 23, 'slip_atr_k': 0.09836561978827532, 'slip_spread_k': 0.2940230767892145, 'spread_hl_frac': 0.048851625234162914, 'bb_std_mult': 1.1358357894955542, 'rsi_os': 32, 'rsi_ob': 64, 'vol_spike': 0.10187763947556899, 'adx_thresh': 18.5940174187613, 'atr_min_pct': 1.743644649110712e-05, 'atr_max_pct': 0.06808066369927755, 'tp_mult': 1.954631932613589, 'tsl_mult': 0.5751261211712027, 'strategy': 'mean_reversion', 'time_stop': 65, 'use_sma': False, 'use_atr': False, 'use_adx': False, 'use_ema': False, 'use_spike': False, 'rsi_required': False, 'edge_k': 0.643216190685928, 'edge_cap': 0.7728754502393236}.
[I 2025-08-29 23:32:44,097] Trial 1058 finished with values: [-0.0235114950598323, 0.02349962161434828] and parameters: {'p_sma': 32, 'p_std': 11, 'p_atr': 11, 'p_adx': 12, 'rsi_period': 34, 'ema1': 30, 'ema2': 20, 'slip_atr_k': 0.12098064763795847, 'slip_spread_k': 0.313004788048162, 'spread_hl_frac': 0.02368481301423404, 'bb_std_mult': 1.5290243905521022, 'rsi_os': 34, 'rsi_ob': 85, 'vol_spike': 0.24753171069729324, 'adx_thresh': 14.929768686241774, 'atr_min_pct': 0.0006003357483945308, 'atr_max_pct': 0.06816377934010093, 'tp_mult': 1.9467164975443858, 'tsl_mult': 0.5813536895048952, 'strategy': 'mean_reversion', 'time_stop': 287, 'use_sma': False, 'use_atr': False, 'use_adx': False, 'use_ema': False, 'use_spike': False, 'rsi_required': False, 'edge_k': 1.8845096219802193, 'edge_cap': 0.24689773702401657}.
[I 2025-08-29 23:32:45,351] Trial 1063 finished with values: [-1000000000.0, 1000000000.0] and parameters: {'p_sma': 33, 'p_std': 19, 'p_atr': 13, 'p_adx': 19, 'rsi_period': 14, 'ema1': 14, 'ema2': 20, 'slip_atr_k': 0.10116867592849416, 'slip_spread_k': 0.2992096616280491, 'spread_hl_frac': 0.02961750316801777, 'bb_std_mult': 1.4536468362728654, 'rsi_os': 32, 'rsi_ob': 95, 'vol_spike': 0.007231322425490461, 'adx_thresh': 9.50003612271004, 'atr_min_pct': 0.028675107561011492, 'atr_max_pct': 0.07043602352307926, 'tp_mult': 1.088086333805212, 'tsl_mult': 0.6334025686991551, 'strategy': 'mean_reversion', 'time_stop': 65, 'use_sma': False, 'use_atr': False, 'use_adx': False, 'use_ema': False, 'use_spike': False, 'rsi_required': False, 'edge_k': 0.7235492292205322, 'edge_cap': 0.6043096177078742}.
[I 2025-08-29 23:32:45,576] Trial 1065 finished with values: [-1000000000.0, 1000000000.0] and parameters: {'p_sma': 33, 'p_std': 56, 'p_atr': 12, 'p_adx': 14, 'rsi_period': 37, 'ema1': 29, 'ema2': 20, 'slip_atr_k': 0.0062614672105164694, 'slip_spread_k': 0.2618881120348953, 'spread_hl_frac': 0.01147353731312747, 'bb_std_mult': 1.4444536529599978, 'rsi_os': 53, 'rsi_ob': 61, 'vol_spike': 0.011731595357880376, 'adx_thresh': 14.65352643404924, 'atr_min_pct': 0.028833080711582686, 'atr_max_pct': 0.07517355230427393, 'tp_mult': 1.1039823811984935, 'tsl_mult': 0.9317883405164538, 'strategy': 'mean_reversion', 'time_stop': 295, 'use_sma': False, 'use_atr': False, 'use_adx': False, 'use_ema': False, 'use_spike': False, 'rsi_required': False, 'edge_k': 1.1187265233242472, 'edge_cap': 0.19095611589699185}.
[I 2025-08-29 23:33:11,417] Trial 1064 finished with values: [-1000000000.0, 1000000000.0] and parameters: {'p_sma': 33, 'p_std': 12, 'p_atr': 25, 'p_adx': 19, 'rsi_period': 37, 'ema1': 29, 'ema2': 20, 'slip_atr_k': 0.0049729137887620425, 'slip_spread_k': 0.47866032816039455, 'spread_hl_frac': 0.011096761995407468, 'bb_std_mult': 1.4578298461749741, 'rsi_os': 32, 'rsi_ob': 73, 'vol_spike': 0.044882231603516745, 'adx_thresh': 9.460356536925058, 'atr_min_pct': 0.01352392200393392, 'atr_max_pct': 0.07184184674198026, 'tp_mult': 1.1145300526690498, 'tsl_mult': 0.9355332147985258, 'strategy': 'mean_reversion', 'time_stop': 294, 'use_sma': False, 'use_atr': False, 'use_adx': False, 'use_ema': False, 'use_spike': False, 'rsi_required': False, 'edge_k': 1.1243011307650213, 'edge_cap': 0.5988025659146052}.
[I 2025-08-29 23:33:12,010] Trial 1067 finished with values: [-1000000000.0, 1000000000.0] and parameters: {'p_sma': 27, 'p_std': 50, 'p_atr': 27, 'p_adx': 14, 'rsi_period': 11, 'ema1': 29, 'ema2': 21, 'slip_atr_k': 0.059476907096481374, 'slip_spread_k': 0.2643052245391366, 'spread_hl_frac': 0.011280729134190702, 'bb_std_mult': 1.2604268649181118, 'rsi_os': 33, 'rsi_ob': 63, 'vol_spike': 0.21205712166435123, 'adx_thresh': 20.39794615092639, 'atr_min_pct': 0.013474401956576704, 'atr_max_pct': 0.07595070848734332, 'tp_mult': 2.000976920311329, 'tsl_mult': 0.6574885290478724, 'strategy': 'breakout', 'time_stop': 5, 'use_sma': False, 'use_atr': False, 'use_adx': False, 'use_ema': False, 'use_spike': False, 'rsi_required': False, 'edge_k': 1.6450052708002745, 'edge_cap': 0.19215087268689793}.
[I 2025-08-29 23:33:12,153] Trial 1066 finished with values: [-1000000000.0, 1000000000.0] and parameters: {'p_sma': 33, 'p_std': 23, 'p_atr': 25, 'p_adx': 14, 'rsi_period': 50, 'ema1': 16, 'ema2': 20, 'slip_atr_k': 4.058308191949578e-05, 'slip_spread_k': 0.48197220922718764, 'spread_hl_frac': 0.029795326408237552, 'bb_std_mult': 1.445435438737296, 'rsi_os': 44, 'rsi_ob': 73, 'vol_spike': 0.22735301792631135, 'adx_thresh': 20.718100794352612, 'atr_min_pct': 0.028817913009130412, 'atr_max_pct': 0.07609355900242881, 'tp_mult': 1.9946704739626582, 'tsl_mult': 0.9031118976139867, 'strategy': 'mean_reversion', 'time_stop': 117, 'use_sma': False, 'use_atr': False, 'use_adx': False, 'use_ema': False, 'use_spike': False, 'rsi_required': False, 'edge_k': 1.9619442302731753, 'edge_cap': 0.6034182442645624}.
[I 2025-08-29 23:33:13,041] Trial 1068 finished with values: [-1000000000.0, 1000000000.0] and parameters: {'p_sma': 27, 'p_std': 12, 'p_atr': 10, 'p_adx': 13, 'rsi_period': 82, 'ema1': 29, 'ema2': 22, 'slip_atr_k': 0.004900846409712799, 'slip_spread_k': 0.8852300812243089, 'spread_hl_frac': 0.01893010430016687, 'bb_std_mult': 2.617888042645586, 'rsi_os': 6, 'rsi_ob': 58, 'vol_spike': 0.22707165203661234, 'adx_thresh': 20.657381763735064, 'atr_min_pct': 0.011564294796018233, 'atr_max_pct': 0.11117462902114839, 'tp_mult': 1.997893874397907, 'tsl_mult': 0.655006687619954, 'strategy': 'breakout', 'time_stop': 199, 'use_sma': False, 'use_atr': False, 'use_adx': False, 'use_ema': False, 'use_spike': False, 'rsi_required': False, 'edge_k': 1.7136842899641107, 'edge_cap': 0.3082002929579206}.
[I 2025-08-29 23:33:40,266] Trial 1071 finished with values: [-1000000000.0, 1000000000.0] and parameters: {'p_sma': 25, 'p_std': 58, 'p_atr': 13, 'p_adx': 13, 'rsi_period': 14, 'ema1': 11, 'ema2': 22, 'slip_atr_k': 0.07825821195467028, 'slip_spread_k': 0.16640091459166012, 'spread_hl_frac': 0.012664254815282213, 'bb_std_mult': 1.3660478434650283, 'rsi_os': 47, 'rsi_ob': 62, 'vol_spike': 0.23909897004545813, 'adx_thresh': 22.161942663698657, 'atr_min_pct': 0.015238512169158955, 'atr_max_pct': 0.02912815568924077, 'tp_mult': 1.3900697298049831, 'tsl_mult': 0.42869793000616263, 'strategy': 'breakout', 'time_stop': 144, 'use_sma': False, 'use_atr': False, 'use_adx': False, 'use_ema': False, 'use_spike': False, 'rsi_required': False, 'edge_k': 1.9069677152407651, 'edge_cap': 0.29068276482359545}.
[I 2025-08-29 23:33:40,634] Trial 1069 finished with values: [-1000000000.0, 1000000000.0] and parameters: {'p_sma': 55, 'p_std': 7, 'p_atr': 10, 'p_adx': 26, 'rsi_period': 61, 'ema1': 28, 'ema2': 22, 'slip_atr_k': 0.07701471250977351, 'slip_spread_k': 0.34737813469329776, 'spread_hl_frac': 0.012782327953373954, 'bb_std_mult': 1.2552979184809345, 'rsi_os': 20, 'rsi_ob': 63, 'vol_spike': 0.27013730718082757, 'adx_thresh': 20.6943861705578, 'atr_min_pct': 0.011759250861149581, 'atr_max_pct': 0.03026696268578563, 'tp_mult': 2.437333706357232, 'tsl_mult': 0.65892203400419, 'strategy': 'breakout', 'time_stop': 277, 'use_sma': False, 'use_atr': False, 'use_adx': False, 'use_ema': False, 'use_spike': False, 'rsi_required': False, 'edge_k': 1.9658798686037762, 'edge_cap': 0.2875199225665245}.
[I 2025-08-29 23:33:40,855] Trial 1072 finished with values: [-0.002701328886433707, 0.002690697964098765] and parameters: {'p_sma': 25, 'p_std': 14, 'p_atr': 13, 'p_adx': 21, 'rsi_period': 11, 'ema1': 28, 'ema2': 22, 'slip_atr_k': 0.008497097276124787, 'slip_spread_k': 0.5243174564043518, 'spread_hl_frac': 0.012719590991477205, 'bb_std_mult': 1.3766061863108905, 'rsi_os': 20, 'rsi_ob': 62, 'vol_spike': 0.2685142934978086, 'adx_thresh': 25.39128762599504, 'atr_min_pct': 0.0026393099808233677, 'atr_max_pct': 0.06416026371575555, 'tp_mult': 2.4622481261877533, 'tsl_mult': 0.9808256543846197, 'strategy': 'mean_reversion', 'time_stop': 79, 'use_sma': False, 'use_atr': False, 'use_adx': False, 'use_ema': False, 'use_spike': False, 'rsi_required': False, 'edge_k': 1.9992726958177045, 'edge_cap': 0.21833851046280234}.
[I 2025-08-29 23:33:40,863] Trial 1070 finished with values: [-1000000000.0, 1000000000.0] and parameters: {'p_sma': 29, 'p_std': 14, 'p_atr': 13, 'p_adx': 13, 'rsi_period': 50, 'ema1': 28, 'ema2': 22, 'slip_atr_k': 0.08041052354624016, 'slip_spread_k': 0.16392096963245006, 'spread_hl_frac': 0.012989275247159919, 'bb_std_mult': 1.3613715138098526, 'rsi_os': 34, 'rsi_ob': 92, 'vol_spike': 0.22850480719810887, 'adx_thresh': 20.637530537081034, 'atr_min_pct': 0.009792626420226252, 'atr_max_pct': 0.04214325130278833, 'tp_mult': 2.919615839999299, 'tsl_mult': 0.8903978643640343, 'strategy': 'mean_reversion', 'time_stop': 200, 'use_sma': False, 'use_atr': False, 'use_adx': False, 'use_ema': False, 'use_spike': False, 'rsi_required': False, 'edge_k': 1.9128960694743768, 'edge_cap': 0.2123051089546592}.
[I 2025-08-29 23:34:08,203] Trial 1073 finished with values: [-0.003931748916597311, 0.004054679337663866] and parameters: {'p_sma': 31, 'p_std': 14, 'p_atr': 12, 'p_adx': 13, 'rsi_period': 69, 'ema1': 30, 'ema2': 19, 'slip_atr_k': 0.09018448403963447, 'slip_spread_k': 0.38551375632849855, 'spread_hl_frac': 0.010472659810452182, 'bb_std_mult': 1.2391745123483018, 'rsi_os': 34, 'rsi_ob': 69, 'vol_spike': 0.269160853255312, 'adx_thresh': 23.03185699945054, 'atr_min_pct': 0.002557595196264211, 'atr_max_pct': 0.06420821639939833, 'tp_mult': 1.90548209638394, 'tsl_mult': 0.6004032025892685, 'strategy': 'mean_reversion', 'time_stop': 284, 'use_sma': False, 'use_atr': False, 'use_adx': False, 'use_ema': False, 'use_spike': False, 'rsi_required': False, 'edge_k': 0.05441046545372774, 'edge_cap': 0.1320334768411487}.
[I 2025-08-29 23:34:08,243] Trial 1074 finished with values: [-0.006357660233146323, 0.006341157726120481] and parameters: {'p_sma': 24, 'p_std': 14, 'p_atr': 12, 'p_adx': 13, 'rsi_period': 11, 'ema1': 30, 'ema2': 19, 'slip_atr_k': 0.009958683647485991, 'slip_spread_k': 0.38489688511891174, 'spread_hl_frac': 0.015171515587623717, 'bb_std_mult': 1.3682535801522533, 'rsi_os': 30, 'rsi_ob': 65, 'vol_spike': 0.24995225359483547, 'adx_thresh': 19.531971547026295, 'atr_min_pct': 0.0025450518524218688, 'atr_max_pct': 0.0643132611712693, 'tp_mult': 1.906144912135563, 'tsl_mult': 0.6078743882531533, 'strategy': 'mean_reversion', 'time_stop': 282, 'use_sma': False, 'use_atr': False, 'use_adx': False, 'use_ema': False, 'use_spike': False, 'rsi_required': False, 'edge_k': 1.9992805825964215, 'edge_cap': 0.21731561571100966}.
[I 2025-08-29 23:34:08,386] Trial 1076 finished with values: [-1000000000.0, 1000000000.0] and parameters: {'p_sma': 31, 'p_std': 16, 'p_atr': 12, 'p_adx': 13, 'rsi_period': 76, 'ema1': 30, 'ema2': 19, 'slip_atr_k': 0.08942460550062727, 'slip_spread_k': 0.2889099753744937, 'spread_hl_frac': 0.015579283912562117, 'bb_std_mult': 1.5619518269143131, 'rsi_os': 30, 'rsi_ob': 61, 'vol_spike': 0.2499492074048274, 'adx_thresh': 19.441349576378798, 'atr_min_pct': 0.004062184399473685, 'atr_max_pct': 0.0975526524680866, 'tp_mult': 1.8963883294742627, 'tsl_mult': 0.6325591335408457, 'strategy': 'mean_reversion', 'time_stop': 283, 'use_sma': False, 'use_atr': False, 'use_adx': False, 'use_ema': False, 'use_spike': False, 'rsi_required': False, 'edge_k': 1.8706592924933778, 'edge_cap': 0.13954770208365574}.
[I 2025-08-29 23:34:08,493] Trial 1075 finished with values: [-1000000000.0, 1000000000.0] and parameters: {'p_sma': 31, 'p_std': 10, 'p_atr': 20, 'p_adx': 20, 'rsi_period': 13, 'ema1': 30, 'ema2': 19, 'slip_atr_k': 0.09024016189465445, 'slip_spread_k': 0.20896858080107666, 'spread_hl_frac': 0.008773080349176798, 'bb_std_mult': 3.455556103497053, 'rsi_os': 31, 'rsi_ob': 65, 'vol_spike': 0.24981824572429212, 'adx_thresh': 21.917613715731093, 'atr_min_pct': 0.023616955012280467, 'atr_max_pct': 0.07244991296538372, 'tp_mult': 1.8145399111602114, 'tsl_mult': 0.6297959427716826, 'strategy': 'mean_reversion', 'time_stop': 129, 'use_sma': False, 'use_atr': False, 'use_adx': False, 'use_ema': False, 'use_spike': False, 'rsi_required': False, 'edge_k': 0.991266302882059, 'edge_cap': 0.1443325774363428}.
[I 2025-08-29 23:34:35,250] Trial 1080 finished with values: [-1000000000.0, 1000000000.0] and parameters: {'p_sma': 52, 'p_std': 12, 'p_atr': 14, 'p_adx': 12, 'rsi_period': 10, 'ema1': 29, 'ema2': 21, 'slip_atr_k': 2.290102314342655e-05, 'slip_spread_k': 0.06963783512960353, 'spread_hl_frac': 0.04452396243425777, 'bb_std_mult': 1.2945439338846627, 'rsi_os': 42, 'rsi_ob': 59, 'vol_spike': 0.029958561956558175, 'adx_thresh': 29.190667796412576, 'atr_min_pct': 0.02119242077937778, 'atr_max_pct': 0.07033718685092037, 'tp_mult': 2.670829449470192, 'tsl_mult': 0.2344523366247142, 'strategy': 'mean_reversion', 'time_stop': 288, 'use_sma': False, 'use_atr': False, 'use_adx': False, 'use_ema': False, 'use_spike': False, 'rsi_required': False, 'edge_k': 1.3617687066887953, 'edge_cap': 0.17556956134549392}.
[I 2025-08-29 23:34:35,914] Trial 1078 finished with values: [-1000000000.0, 1000000000.0] and parameters: {'p_sma': 53, 'p_std': 12, 'p_atr': 14, 'p_adx': 12, 'rsi_period': 76, 'ema1': 30, 'ema2': 21, 'slip_atr_k': 0.00011911332761722253, 'slip_spread_k': 0.015459757236372829, 'spread_hl_frac': 0.0447535355441658, 'bb_std_mult': 3.2227243998998594, 'rsi_os': 31, 'rsi_ob': 61, 'vol_spike': 0.25954302170205973, 'adx_thresh': 21.7373425821219, 'atr_min_pct': 0.0066561857205381355, 'atr_max_pct': 0.09713551528636603, 'tp_mult': 2.338314587339621, 'tsl_mult': 0.6311851029003693, 'strategy': 'mean_reversion', 'time_stop': 288, 'use_sma': False, 'use_atr': False, 'use_adx': False, 'use_ema': False, 'use_spike': False, 'rsi_required': False, 'edge_k': 1.8596607941018268, 'edge_cap': 0.1736700907659779}.
[I 2025-08-29 23:34:35,914] Trial 1077 finished with values: [-1000000000.0, 1000000000.0] and parameters: {'p_sma': 8, 'p_std': 10, 'p_atr': 20, 'p_adx': 20, 'rsi_period': 13, 'ema1': 30, 'ema2': 21, 'slip_atr_k': 0.004383121517899375, 'slip_spread_k': 0.20917973760898745, 'spread_hl_frac': 0.008599433156165261, 'bb_std_mult': 2.4175703071334005, 'rsi_os': 30, 'rsi_ob': 66, 'vol_spike': 0.02272199923258536, 'adx_thresh': 19.484013992181985, 'atr_min_pct': 0.00849728215668637, 'atr_max_pct': 0.10021613945188841, 'tp_mult': 2.661100786976095, 'tsl_mult': 0.633320260158228, 'strategy': 'mean_reversion', 'time_stop': 283, 'use_sma': False, 'use_atr': False, 'use_adx': False, 'use_ema': False, 'use_spike': False, 'rsi_required': False, 'edge_k': 1.8791740805941943, 'edge_cap': 0.173316380783469}.
