[I 2025-08-29 21:58:14,741] Trial 163 finished with values: [-1000000000.0, 1000000000.0] and parameters: {'p_sma': 7, 'p_std': 45, 'p_atr': 20, 'p_adx': 9, 'rsi_period': 61, 'ema1': 7, 'ema2': 44, 'slip_atr_k': 0.2176246309622532, 'slip_spread_k': 0.4308727891260896, 'spread_hl_frac': 0.039496565737295715, 'bb_std_mult': 1.9223255656600102, 'rsi_os': 26, 'rsi_ob': 71, 'vol_spike': 0.027770273397141252, 'adx_thresh': 14.31071307980253, 'atr_min_pct': 0.0008446869976763981, 'atr_max_pct': 0.10292098826248526, 'tp_mult': 1.7981795496142903, 'tsl_mult': 0.5943297567096918, 'strategy': 'breakout', 'time_stop': 112, 'use_sma': False, 'use_atr': False, 'use_adx': False, 'use_ema': False, 'use_spike': False, 'rsi_required': False, 'edge_k': 1.6114092203314154, 'edge_cap': 0.2061655121905595}.
[I 2025-08-29 21:58:14,906] Trial 161 finished with values: [-0.017020744246449837, 0.01700916671720384] and parameters: {'p_sma': 7, 'p_std': 38, 'p_atr': 30, 'p_adx': 11, 'rsi_period': 19, 'ema1': 6, 'ema2': 44, 'slip_atr_k': 0.020967988765473566, 'slip_spread_k': 0.25532635177945495, 'spread_hl_frac': 0.03944684796088289, 'bb_std_mult': 2.7061247878783736, 'rsi_os': 21, 'rsi_ob': 57, 'vol_spike': 0.015532824326456942, 'adx_thresh': 21.951356700265727, 'atr_min_pct': 0.0005340222792387426, 'atr_max_pct': 0.06591519642615488, 'tp_mult': 2.353482402705232, 'tsl_mult': 0.20068386143899453, 'strategy': 'breakout', 'time_stop': 110, 'use_sma': False, 'use_atr': False, 'use_adx': False, 'use_ema': False, 'use_spike': False, 'rsi_required': False, 'edge_k': 1.5568368683126153, 'edge_cap': 0.7115564119169365}.
[I 2025-08-29 21:58:14,907] Trial 164 finished with values: [-0.011055477704842054, 0.01104892918373678] and parameters: {'p_sma': 34, 'p_std': 48, 'p_atr': 22, 'p_adx': 9, 'rsi_period': 23, 'ema1': 23, 'ema2': 44, 'slip_atr_k': 0.21817840367584282, 'slip_spread_k': 0.2537902449423106, 'spread_hl_frac': 0.039717649024823075, 'bb_std_mult': 0.8483451311321981, 'rsi_os': 45, 'rsi_ob': 71, 'vol_spike': 0.026587487604920558, 'adx_thresh': 22.06772024103809, 'atr_min_pct': 0.0017350570952553556, 'atr_max_pct': 0.08653806148508222, 'tp_mult': 2.3687484979986, 'tsl_mult': 0.3204900958438903, 'strategy': 'breakout', 'time_stop': 114, 'use_sma': False, 'use_atr': False, 'use_adx': False, 'use_ema': False, 'use_spike': False, 'rsi_required': False, 'edge_k': 0.6072793944894901, 'edge_cap': 0.20810472159867072}.
[I 2025-08-29 21:58:42,015] Trial 168 finished with values: [-1000000000.0, 1000000000.0] and parameters: {'p_sma': 12, 'p_std': 39, 'p_atr': 9, 'p_adx': 10, 'rsi_period': 63, 'ema1': 6, 'ema2': 48, 'slip_atr_k': 0.03180245455777081, 'slip_spread_k': 0.9189703127614006, 'spread_hl_frac': 0.013573111531673041, 'bb_std_mult': 3.1072567341353747, 'rsi_os': 22, 'rsi_ob': 70, 'vol_spike': 0.05020262691338833, 'adx_thresh': 29.49781073714372, 'atr_min_pct': 0.012571939955236804, 'atr_max_pct': 0.058448831820549794, 'tp_mult': 1.8748046208611338, 'tsl_mult': 0.015438424812632079, 'strategy': 'mean_reversion', 'time_stop': 98, 'use_sma': False, 'use_atr': False, 'use_adx': False, 'use_ema': False, 'use_spike': False, 'rsi_required': False, 'edge_k': 0.8851889195366098, 'edge_cap': 0.5507673389832888}.
[I 2025-08-29 21:58:42,224] Trial 165 finished with values: [-1000000000.0, 1000000000.0] and parameters: {'p_sma': 8, 'p_std': 13, 'p_atr': 22, 'p_adx': 9, 'rsi_period': 62, 'ema1': 23, 'ema2': 44, 'slip_atr_k': 0.21904782053825816, 'slip_spread_k': 0.6998269727804993, 'spread_hl_frac': 0.037337049805559165, 'bb_std_mult': 3.0905215216958313, 'rsi_os': 22, 'rsi_ob': 72, 'vol_spike': 0.025549710367482638, 'adx_thresh': 21.725084610688214, 'atr_min_pct': 0.012431493810994579, 'atr_max_pct': 0.05629879725018711, 'tp_mult': 1.818081559676329, 'tsl_mult': 0.30873170795855964, 'strategy': 'breakout', 'time_stop': 207, 'use_sma': False, 'use_atr': False, 'use_adx': False, 'use_ema': False, 'use_spike': False, 'rsi_required': False, 'edge_k': 0.5981609089701853, 'edge_cap': 0.7780908115928602}.
[I 2025-08-29 21:58:42,304] Trial 167 finished with values: [-1000000000.0, 1000000000.0] and parameters: {'p_sma': 10, 'p_std': 35, 'p_atr': 9, 'p_adx': 10, 'rsi_period': 63, 'ema1': 11, 'ema2': 48, 'slip_atr_k': 0.03353163177433072, 'slip_spread_k': 0.22761937408825797, 'spread_hl_frac': 0.03698973764762405, 'bb_std_mult': 3.427522285258938, 'rsi_os': 24, 'rsi_ob': 70, 'vol_spike': 0.024325885900233147, 'adx_thresh': 17.265852404838032, 'atr_min_pct': 0.023266411311248424, 'atr_max_pct': 0.058739093539429625, 'tp_mult': 1.8799314658070452, 'tsl_mult': 0.31418210160779936, 'strategy': 'mean_reversion', 'time_stop': 98, 'use_sma': False, 'use_atr': False, 'use_adx': False, 'use_ema': False, 'use_spike': False, 'rsi_required': False, 'edge_k': 0.6143465416764294, 'edge_cap': 0.773656042460621}.
[I 2025-08-29 21:58:42,418] Trial 166 finished with values: [-1000000000.0, 1000000000.0] and parameters: {'p_sma': 11, 'p_std': 36, 'p_atr': 22, 'p_adx': 10, 'rsi_period': 63, 'ema1': 6, 'ema2': 48, 'slip_atr_k': 0.031868392486359046, 'slip_spread_k': 0.6976896569262244, 'spread_hl_frac': 0.037227844386394024, 'bb_std_mult': 0.7196650882226912, 'rsi_os': 22, 'rsi_ob': 72, 'vol_spike': 0.050532203756506355, 'adx_thresh': 11.104105056846576, 'atr_min_pct': 0.0018383229773703534, 'atr_max_pct': 0.05942806556368313, 'tp_mult': 1.8636205689747303, 'tsl_mult': 0.8524795741584024, 'strategy': 'breakout', 'time_stop': 213, 'use_sma': False, 'use_atr': False, 'use_adx': False, 'use_ema': False, 'use_spike': False, 'rsi_required': False, 'edge_k': 0.614141977236724, 'edge_cap': 0.7280611390220098}.
[I 2025-08-29 21:59:10,097] Trial 170 finished with values: [-0.0034255538836305277, 0.0034115984177682584] and parameters: {'p_sma': 51, 'p_std': 23, 'p_atr': 21, 'p_adx': 10, 'rsi_period': 45, 'ema1': 20, 'ema2': 25, 'slip_atr_k': 0.04003737674250896, 'slip_spread_k': 0.22806689422451096, 'spread_hl_frac': 0.020722436145656834, 'bb_std_mult': 3.233333507367406, 'rsi_os': 25, 'rsi_ob': 80, 'vol_spike': 0.03201401631644975, 'adx_thresh': 32.353803522457326, 'atr_min_pct': 0.0013234942437773583, 'atr_max_pct': 0.032716875793257626, 'tp_mult': 2.837099853298744, 'tsl_mult': 0.8613932435124978, 'strategy': 'mean_reversion', 'time_stop': 224, 'use_sma': False, 'use_atr': False, 'use_adx': False, 'use_ema': False, 'use_spike': False, 'rsi_required': False, 'edge_k': 0.9293386449666636, 'edge_cap': 0.7346165970441887}.
[I 2025-08-29 21:59:10,267] Trial 171 finished with values: [-0.0075353077395009516, 0.007524961779320729] and parameters: {'p_sma': 51, 'p_std': 36, 'p_atr': 21, 'p_adx': 11, 'rsi_period': 45, 'ema1': 5, 'ema2': 49, 'slip_atr_k': 0.2002593708099624, 'slip_spread_k': 0.15625624136401067, 'spread_hl_frac': 0.025468281355474992, 'bb_std_mult': 3.2477826461480417, 'rsi_os': 25, 'rsi_ob': 83, 'vol_spike': 0.04050386216654826, 'adx_thresh': 19.90535180304195, 'atr_min_pct': 0.0012755935076468514, 'atr_max_pct': 0.03311223212711755, 'tp_mult': 1.7116566682463668, 'tsl_mult': 0.8645809302559239, 'strategy': 'breakout', 'time_stop': 224, 'use_sma': False, 'use_atr': False, 'use_adx': False, 'use_ema': False, 'use_spike': False, 'rsi_required': False, 'edge_k': 0.6955647227146484, 'edge_cap': 0.7316588634518221}.
[I 2025-08-29 21:59:10,448] Trial 169 finished with values: [-1000000000.0, 1000000000.0] and parameters: {'p_sma': 51, 'p_std': 23, 'p_atr': 22, 'p_adx': 28, 'rsi_period': 61, 'ema1': 5, 'ema2': 47, 'slip_atr_k': 0.050838875653565735, 'slip_spread_k': 0.22531158525474299, 'spread_hl_frac': 0.0372883069420448, 'bb_std_mult': 0.72822831127486, 'rsi_os': 51, 'rsi_ob': 46, 'vol_spike': 0.2628534378927264, 'adx_thresh': 34.94086760091505, 'atr_min_pct': 0.023363915260537604, 'atr_max_pct': 0.054730958641563125, 'tp_mult': 2.538903134512028, 'tsl_mult': 0.8498099045558394, 'strategy': 'breakout', 'time_stop': 218, 'use_sma': False, 'use_atr': False, 'use_adx': False, 'use_ema': False, 'use_spike': False, 'rsi_required': False, 'edge_k': 1.9245129150422213, 'edge_cap': 0.7289123586994554}.
[I 2025-08-29 21:59:10,522] Trial 172 finished with values: [-1000000000.0, 1000000000.0] and parameters: {'p_sma': 14, 'p_std': 42, 'p_atr': 21, 'p_adx': 10, 'rsi_period': 47, 'ema1': 5, 'ema2': 33, 'slip_atr_k': 0.20032560664988952, 'slip_spread_k': 0.15836688566231005, 'spread_hl_frac': 0.02048297012464493, 'bb_std_mult': 3.1910038781484555, 'rsi_os': 5, 'rsi_ob': 75, 'vol_spike': 0.0337950139517941, 'adx_thresh': 19.84703540153718, 'atr_min_pct': 0.0031073213539902847, 'atr_max_pct': 0.05510987515318205, 'tp_mult': 1.7115607657704088, 'tsl_mult': 0.8662133035318412, 'strategy': 'breakout', 'time_stop': 68, 'use_sma': False, 'use_atr': False, 'use_adx': False, 'use_ema': False, 'use_spike': False, 'rsi_required': False, 'edge_k': 0.9427208152231403, 'edge_cap': 0.08248238665935465}.
[I 2025-08-29 21:59:36,984] Trial 175 finished with values: [-1000000000.0, 1000000000.0] and parameters: {'p_sma': 27, 'p_std': 16, 'p_atr': 23, 'p_adx': 19, 'rsi_period': 35, 'ema1': 20, 'ema2': 45, 'slip_atr_k': 0.039964312384802865, 'slip_spread_k': 0.18447533583313205, 'spread_hl_frac': 0.04713393925647833, 'bb_std_mult': 2.538251118379316, 'rsi_os': 23, 'rsi_ob': 75, 'vol_spike': 0.031182261761475132, 'adx_thresh': 32.47216563651807, 'atr_min_pct': 0.020809989985660946, 'atr_max_pct': 0.06961580001545048, 'tp_mult': 2.2626052115940847, 'tsl_mult': 0.11165519194663309, 'strategy': 'mean_reversion', 'time_stop': 69, 'use_sma': False, 'use_atr': False, 'use_adx': False, 'use_ema': False, 'use_spike': False, 'rsi_required': False, 'edge_k': 0.952290842913264, 'edge_cap': 0.06495342728592113}.
[I 2025-08-29 21:59:37,319] Trial 176 finished with values: [-1000000000.0, 1000000000.0] and parameters: {'p_sma': 6, 'p_std': 7, 'p_atr': 23, 'p_adx': 21, 'rsi_period': 82, 'ema1': 29, 'ema2': 25, 'slip_atr_k': 0.0836341252334254, 'slip_spread_k': 0.1814599582098121, 'spread_hl_frac': 0.011318727275936436, 'bb_std_mult': 2.0281640319366687, 'rsi_os': 23, 'rsi_ob': 74, 'vol_spike': 0.11904664612985869, 'adx_thresh': 32.272237046945605, 'atr_min_pct': 0.0011905358969126756, 'atr_max_pct': 0.08087445558463027, 'tp_mult': 1.608058595017292, 'tsl_mult': 0.8942828662559534, 'strategy': 'mean_reversion', 'time_stop': 198, 'use_sma': False, 'use_atr': False, 'use_adx': False, 'use_ema': False, 'use_spike': False, 'rsi_required': False, 'edge_k': 0.4379900540024815, 'edge_cap': 0.3755503681737201}.
[I 2025-08-29 21:59:37,428] Trial 174 finished with values: [-1000000000.0, 1000000000.0] and parameters: {'p_sma': 43, 'p_std': 41, 'p_atr': 23, 'p_adx': 30, 'rsi_period': 47, 'ema1': 7, 'ema2': 34, 'slip_atr_k': 0.08539498170114841, 'slip_spread_k': 0.17799978992345808, 'spread_hl_frac': 0.020504485870412887, 'bb_std_mult': 2.356691543309036, 'rsi_os': 51, 'rsi_ob': 69, 'vol_spike': 0.034581104181178296, 'adx_thresh': 7.684684480934358, 'atr_min_pct': 0.0213783620354494, 'atr_max_pct': 0.054130844383043296, 'tp_mult': 1.6012055279675106, 'tsl_mult': 0.8631069131255805, 'strategy': 'breakout', 'time_stop': 133, 'use_sma': False, 'use_atr': False, 'use_adx': False, 'use_ema': False, 'use_spike': False, 'rsi_required': False, 'edge_k': 0.26178080948785165, 'edge_cap': 0.11667344229427434}.
[I 2025-08-29 21:59:37,648] Trial 173 finished with values: [-1000000000.0, 1000000000.0] and parameters: {'p_sma': 51, 'p_std': 42, 'p_atr': 24, 'p_adx': 11, 'rsi_period': 34, 'ema1': 18, 'ema2': 33, 'slip_atr_k': 0.20073920995325528, 'slip_spread_k': 0.17109806687867846, 'spread_hl_frac': 0.020491069920976684, 'bb_std_mult': 2.37836764165369, 'rsi_os': 51, 'rsi_ob': 52, 'vol_spike': 0.11684417239570973, 'adx_thresh': 19.871147885337514, 'atr_min_pct': 0.00690965070906501, 'atr_max_pct': 0.022039419833244984, 'tp_mult': 1.708398067077461, 'tsl_mult': 0.1272889399378429, 'strategy': 'breakout', 'time_stop': 197, 'use_sma': False, 'use_atr': False, 'use_adx': False, 'use_ema': False, 'use_spike': False, 'rsi_required': False, 'edge_k': 0.25630977702313273, 'edge_cap': 0.7336094031931434}.
[I 2025-08-29 22:00:04,771] Trial 179 finished with values: [-0.01040868655352356, 0.010447953717034934] and parameters: {'p_sma': 16, 'p_std': 37, 'p_atr': 24, 'p_adx': 9, 'rsi_period': 66, 'ema1': 6, 'ema2': 46, 'slip_atr_k': 0.1330317299394569, 'slip_spread_k': 0.23209367465711325, 'spread_hl_frac': 0.03819046539849659, 'bb_std_mult': 1.1751242390670007, 'rsi_os': 13, 'rsi_ob': 51, 'vol_spike': 0.04446740835420758, 'adx_thresh': 18.817649896606493, 'atr_min_pct': 0.0019037085802976615, 'atr_max_pct': 0.0214634969782751, 'tp_mult': 2.4555172286752867, 'tsl_mult': 0.13998742036326106, 'strategy': 'breakout', 'time_stop': 262, 'use_sma': False, 'use_atr': False, 'use_adx': False, 'use_ema': False, 'use_spike': False, 'rsi_required': False, 'edge_k': 0.46007183406528906, 'edge_cap': 0.806784572809425}.
[I 2025-08-29 22:00:05,110] Trial 177 finished with values: [-1000000000.0, 1000000000.0] and parameters: {'p_sma': 43, 'p_std': 57, 'p_atr': 24, 'p_adx': 11, 'rsi_period': 57, 'ema1': 13, 'ema2': 31, 'slip_atr_k': 0.12778703169674946, 'slip_spread_k': 0.0009162576745474493, 'spread_hl_frac': 0.014684684186890246, 'bb_std_mult': 2.0327280896979096, 'rsi_os': 13, 'rsi_ob': 52, 'vol_spike': 0.040823341901582794, 'adx_thresh': 9.533275026493687, 'atr_min_pct': 0.009612762939471602, 'atr_max_pct': 0.08135624077399504, 'tp_mult': 1.6102355953894425, 'tsl_mult': 0.9204091545025647, 'strategy': 'breakout', 'time_stop': 199, 'use_sma': False, 'use_atr': False, 'use_adx': False, 'use_ema': False, 'use_spike': False, 'rsi_required': False, 'edge_k': 0.5516324716442876, 'edge_cap': 0.18171121656039402}.
[I 2025-08-29 22:00:05,471] Trial 178 finished with values: [-1000000000.0, 1000000000.0] and parameters: {'p_sma': 8, 'p_std': 39, 'p_atr': 24, 'p_adx': 11, 'rsi_period': 66, 'ema1': 7, 'ema2': 46, 'slip_atr_k': 0.13414404886551046, 'slip_spread_k': 0.04281961544412649, 'spread_hl_frac': 0.03854990595256621, 'bb_std_mult': 2.4103453883273875, 'rsi_os': 13, 'rsi_ob': 52, 'vol_spike': 0.18600137667982033, 'adx_thresh': 28.433343913520353, 'atr_min_pct': 0.006746599340002116, 'atr_max_pct': 0.05114501660368451, 'tp_mult': 1.2238374715534883, 'tsl_mult': 0.9319644207990638, 'strategy': 'breakout', 'time_stop': 135, 'use_sma': False, 'use_atr': False, 'use_adx': False, 'use_ema': False, 'use_spike': False, 'rsi_required': False, 'edge_k': 1.3541573329725223, 'edge_cap': 0.17801581043234865}.
[I 2025-08-29 22:00:05,555] Trial 180 finished with values: [-1000000000.0, 1000000000.0] and parameters: {'p_sma': 16, 'p_std': 33, 'p_atr': 21, 'p_adx': 18, 'rsi_period': 65, 'ema1': 6, 'ema2': 46, 'slip_atr_k': 0.13658050106290393, 'slip_spread_k': 0.21742620858672512, 'spread_hl_frac': 0.01691322898018943, 'bb_std_mult': 1.196275592758598, 'rsi_os': 14, 'rsi_ob': 79, 'vol_spike': 0.045213594507486236, 'adx_thresh': 34.07411803143918, 'atr_min_pct': 0.0005341806359278828, 'atr_max_pct': 0.11433644806451408, 'tp_mult': 2.844869440253432, 'tsl_mult': 0.22707254883816425, 'strategy': 'breakout', 'time_stop': 75, 'use_sma': False, 'use_atr': False, 'use_adx': False, 'use_ema': False, 'use_spike': False, 'rsi_required': False, 'edge_k': 1.1274246024877281, 'edge_cap': 0.8137823647217439}.
[I 2025-08-29 22:00:32,838] Trial 181 finished with values: [-1000000000.0, 1000000000.0] and parameters: {'p_sma': 60, 'p_std': 58, 'p_atr': 22, 'p_adx': 16, 'rsi_period': 57, 'ema1': 13, 'ema2': 20, 'slip_atr_k': 0.041216691214832415, 'slip_spread_k': 0.03265119547246054, 'spread_hl_frac': 0.0033590642815808334, 'bb_std_mult': 3.5410910989737627, 'rsi_os': 26, 'rsi_ob': 95, 'vol_spike': 0.04308524281128391, 'adx_thresh': 28.320162187744565, 'atr_min_pct': 0.009360155510689583, 'atr_max_pct': 0.11401679912388119, 'tp_mult': 1.7682711290664295, 'tsl_mult': 0.9278795016125576, 'strategy': 'breakout', 'time_stop': 105, 'use_sma': False, 'use_atr': False, 'use_adx': False, 'use_ema': False, 'use_spike': False, 'rsi_required': False, 'edge_k': 0.3457233329258316, 'edge_cap': 0.7714132346237605}.
[I 2025-08-29 22:00:33,064] Trial 183 finished with values: [-0.0008565248361425137, 0.0012548330104668463] and parameters: {'p_sma': 47, 'p_std': 35, 'p_atr': 22, 'p_adx': 22, 'rsi_period': 25, 'ema1': 6, 'ema2': 10, 'slip_atr_k': 0.036667792353595456, 'slip_spread_k': 0.7456363603823002, 'spread_hl_frac': 0.035070897280394926, 'bb_std_mult': 0.9358222782057344, 'rsi_os': 26, 'rsi_ob': 78, 'vol_spike': 0.22313342620948934, 'adx_thresh': 33.829727201915524, 'atr_min_pct': 0.002553043655071851, 'atr_max_pct': 0.12711461708413818, 'tp_mult': 2.827568045771569, 'tsl_mult': 0.4795104817130562, 'strategy': 'mean_reversion', 'time_stop': 102, 'use_sma': False, 'use_atr': False, 'use_adx': False, 'use_ema': False, 'use_spike': False, 'rsi_required': False, 'edge_k': 0.34442409175905314, 'edge_cap': 0.4737862006476361}.
[I 2025-08-29 22:00:33,080] Trial 182 finished with values: [-0.00418061992044827, 0.0041650913313740455] and parameters: {'p_sma': 60, 'p_std': 39, 'p_atr': 21, 'p_adx': 25, 'rsi_period': 38, 'ema1': 6, 'ema2': 11, 'slip_atr_k': 0.04059917268810247, 'slip_spread_k': 0.7414966457665714, 'spread_hl_frac': 0.017875289961034935, 'bb_std_mult': 1.2934418375274328, 'rsi_os': 25, 'rsi_ob': 62, 'vol_spike': 0.06183017521395574, 'adx_thresh': 13.138518869581652, 'atr_min_pct': 0.0026848901661241883, 'atr_max_pct': 0.12220261393177709, 'tp_mult': 1.7754617172389664, 'tsl_mult': 0.9393088741435426, 'strategy': 'breakout', 'time_stop': 106, 'use_sma': False, 'use_atr': False, 'use_adx': False, 'use_ema': False, 'use_spike': False, 'rsi_required': False, 'edge_k': 1.3486081329492894, 'edge_cap': 0.2478566179312246}.
[I 2025-08-29 22:00:33,149] Trial 184 finished with values: [-1000000000.0, 1000000000.0] and parameters: {'p_sma': 5, 'p_std': 35, 'p_atr': 22, 'p_adx': 23, 'rsi_period': 60, 'ema1': 30, 'ema2': 10, 'slip_atr_k': 0.035798602605959434, 'slip_spread_k': 0.5480645709631502, 'spread_hl_frac': 0.03627447736077033, 'bb_std_mult': 3.561498988301603, 'rsi_os': 25, 'rsi_ob': 62, 'vol_spike': 0.2932097955263597, 'adx_thresh': 17.546495164880078, 'atr_min_pct': 0.0026745289349043026, 'atr_max_pct': 0.1212349172342217, 'tp_mult': 1.6735314056356472, 'tsl_mult': 0.7629696632614228, 'strategy': 'mean_reversion', 'time_stop': 57, 'use_sma': False, 'use_atr': False, 'use_adx': False, 'use_ema': False, 'use_spike': False, 'rsi_required': False, 'edge_k': 0.5190023807123036, 'edge_cap': 0.31102700733484645}.
[I 2025-08-29 22:00:59,065] Trial 188 finished with values: [-1000000000.0, 1000000000.0] and parameters: {'p_sma': 47, 'p_std': 33, 'p_atr': 21, 'p_adx': 21, 'rsi_period': 16, 'ema1': 6, 'ema2': 11, 'slip_atr_k': 0.026439441456483234, 'slip_spread_k': 0.7649923216746797, 'spread_hl_frac': 0.03458628961426109, 'bb_std_mult': 0.923516426286087, 'rsi_os': 30, 'rsi_ob': 78, 'vol_spike': 0.21798367676848468, 'adx_thresh': 33.43078064002827, 'atr_min_pct': 0.003903824686029433, 'atr_max_pct': 0.12695082605218058, 'tp_mult': 2.688756522323791, 'tsl_mult': 0.4734865505329137, 'strategy': 'mean_reversion', 'time_stop': 104, 'use_sma': False, 'use_atr': False, 'use_adx': False, 'use_ema': False, 'use_spike': False, 'rsi_required': False, 'edge_k': 0.2958715695038753, 'edge_cap': 0.47186895193717193}.
[I 2025-08-29 22:00:59,774] Trial 186 finished with values: [-1000000000.0, 1000000000.0] and parameters: {'p_sma': 47, 'p_std': 33, 'p_atr': 22, 'p_adx': 23, 'rsi_period': 25, 'ema1': 6, 'ema2': 10, 'slip_atr_k': 0.02709784993392717, 'slip_spread_k': 0.7646144337258455, 'spread_hl_frac': 0.03469265509148135, 'bb_std_mult': 0.9443191829627278, 'rsi_os': 29, 'rsi_ob': 78, 'vol_spike': 0.22040437032122162, 'adx_thresh': 33.72734902839911, 'atr_min_pct': 0.008371620091453388, 'atr_max_pct': 0.12871418476453364, 'tp_mult': 2.701795762123343, 'tsl_mult': 0.4613085843168018, 'strategy': 'mean_reversion', 'time_stop': 101, 'use_sma': False, 'use_atr': False, 'use_adx': False, 'use_ema': False, 'use_spike': False, 'rsi_required': False, 'edge_k': 0.2948172850248844, 'edge_cap': 0.47522512541538486}.
[I 2025-08-29 22:01:00,043] Trial 185 finished with values: [-1000000000.0, 1000000000.0] and parameters: {'p_sma': 19, 'p_std': 35, 'p_atr': 22, 'p_adx': 22, 'rsi_period': 60, 'ema1': 6, 'ema2': 42, 'slip_atr_k': 0.05001984013398394, 'slip_spread_k': 0.7551733124768323, 'spread_hl_frac': 0.006376033516526047, 'bb_std_mult': 1.544162660755052, 'rsi_os': 25, 'rsi_ob': 72, 'vol_spike': 0.1659254873640584, 'adx_thresh': 17.61180818305143, 'atr_min_pct': 0.00267975373188184, 'atr_max_pct': 0.0611225765424655, 'tp_mult': 1.656041254623909, 'tsl_mult': 0.820580637933399, 'strategy': 'mean_reversion', 'time_stop': 277, 'use_sma': False, 'use_atr': False, 'use_adx': False, 'use_ema': False, 'use_spike': False, 'rsi_required': False, 'edge_k': 0.5228916937377258, 'edge_cap': 0.7934432754190605}.
[I 2025-08-29 22:01:00,117] Trial 187 finished with values: [-1000000000.0, 1000000000.0] and parameters: {'p_sma': 47, 'p_std': 33, 'p_atr': 22, 'p_adx': 23, 'rsi_period': 25, 'ema1': 6, 'ema2': 10, 'slip_atr_k': 0.02615540917575581, 'slip_spread_k': 0.7464415252288299, 'spread_hl_frac': 0.03495632211777988, 'bb_std_mult': 0.9594354295097637, 'rsi_os': 30, 'rsi_ob': 78, 'vol_spike': 0.22130923052579712, 'adx_thresh': 33.397059142211646, 'atr_min_pct': 0.004164193813375383, 'atr_max_pct': 0.1278441131191687, 'tp_mult': 2.715855607962369, 'tsl_mult': 0.5714307826109707, 'strategy': 'mean_reversion', 'time_stop': 103, 'use_sma': False, 'use_atr': False, 'use_adx': False, 'use_ema': False, 'use_spike': False, 'rsi_required': False, 'edge_k': 0.3130207658403546, 'edge_cap': 0.46781885626602976}.
