[I 2025-08-29 22:29:54,646] Trial 462 finished with values: [-1000000000.0, 1000000000.0] and parameters: {'p_sma': 60, 'p_std': 38, 'p_atr': 13, 'p_adx': 16, 'rsi_period': 32, 'ema1': 8, 'ema2': 16, 'slip_atr_k': 0.08944917304855989, 'slip_spread_k': 0.7525762860114752, 'spread_hl_frac': 0.013183048071490096, 'bb_std_mult': 2.9243851528955407, 'rsi_os': 31, 'rsi_ob': 94, 'vol_spike': 0.26400766090016414, 'adx_thresh': 18.546715697615387, 'atr_min_pct': 0.005696120236339321, 'atr_max_pct': 0.12866635100891913, 'tp_mult': 1.7602526711549233, 'tsl_mult': 0.6337835955415851, 'strategy': 'mean_reversion', 'time_stop': 237, 'use_sma': False, 'use_atr': False, 'use_adx': False, 'use_ema': False, 'use_spike': False, 'rsi_required': False, 'edge_k': 1.8426637222015416, 'edge_cap': 0.11872293938932471}.
[I 2025-08-29 22:29:54,961] Trial 459 finished with values: [-1000000000.0, 1000000000.0] and parameters: {'p_sma': 53, 'p_std': 38, 'p_atr': 13, 'p_adx': 23, 'rsi_period': 32, 'ema1': 18, 'ema2': 25, 'slip_atr_k': 0.022508562010738125, 'slip_spread_k': 0.7499528704147557, 'spread_hl_frac': 0.009632368640420247, 'bb_std_mult': 2.054452373810023, 'rsi_os': 29, 'rsi_ob': 74, 'vol_spike': 0.26036059674937395, 'adx_thresh': 18.220192100819272, 'atr_min_pct': 0.024745593267292622, 'atr_max_pct': 0.1263394743992139, 'tp_mult': 1.747649744697241, 'tsl_mult': 0.6365012171413957, 'strategy': 'mean_reversion', 'time_stop': 206, 'use_sma': False, 'use_atr': False, 'use_adx': False, 'use_ema': False, 'use_spike': False, 'rsi_required': False, 'edge_k': 1.199315518728615, 'edge_cap': 0.35843535008690386}.
[I 2025-08-29 22:29:55,286] Trial 461 finished with values: [-0.0016827701134572992, 0.002139067420407977] and parameters: {'p_sma': 51, 'p_std': 38, 'p_atr': 11, 'p_adx': 23, 'rsi_period': 33, 'ema1': 18, 'ema2': 13, 'slip_atr_k': 0.021324860146818655, 'slip_spread_k': 0.6288510239122, 'spread_hl_frac': 0.013379416209661807, 'bb_std_mult': 2.8924335090667372, 'rsi_os': 37, 'rsi_ob': 58, 'vol_spike': 0.2672076056963691, 'adx_thresh': 5.549096630548277, 'atr_min_pct': 0.0047832765737601275, 'atr_max_pct': 0.12829370361149264, 'tp_mult': 1.7559682029168, 'tsl_mult': 0.6345116487323313, 'strategy': 'mean_reversion', 'time_stop': 235, 'use_sma': False, 'use_atr': False, 'use_adx': False, 'use_ema': False, 'use_spike': False, 'rsi_required': False, 'edge_k': 1.8435340138643332, 'edge_cap': 0.5313818403361942}.
[I 2025-08-29 22:29:55,289] Trial 460 finished with values: [-1000000000.0, 1000000000.0] and parameters: {'p_sma': 60, 'p_std': 38, 'p_atr': 10, 'p_adx': 16, 'rsi_period': 34, 'ema1': 18, 'ema2': 25, 'slip_atr_k': 0.09023867859331189, 'slip_spread_k': 0.7552939235006112, 'spread_hl_frac': 0.00943635310901178, 'bb_std_mult': 2.8911460173954606, 'rsi_os': 37, 'rsi_ob': 58, 'vol_spike': 0.2618089655514849, 'adx_thresh': 5.101709788975786, 'atr_min_pct': 0.02878128205848069, 'atr_max_pct': 0.12836013673988633, 'tp_mult': 1.6857896758851227, 'tsl_mult': 0.5889147144301684, 'strategy': 'mean_reversion', 'time_stop': 206, 'use_sma': False, 'use_atr': False, 'use_adx': False, 'use_ema': False, 'use_spike': False, 'rsi_required': False, 'edge_k': 1.893136448819347, 'edge_cap': 0.967289130137334}.
[I 2025-08-29 22:29:55,455] Trial 463 finished with values: [-1000000000.0, 1000000000.0] and parameters: {'p_sma': 31, 'p_std': 37, 'p_atr': 12, 'p_adx': 17, 'rsi_period': 28, 'ema1': 8, 'ema2': 13, 'slip_atr_k': 0.16901876767866797, 'slip_spread_k': 0.7542574712336365, 'spread_hl_frac': 0.01748396186741841, 'bb_std_mult': 3.1323525907409966, 'rsi_os': 50, 'rsi_ob': 58, 'vol_spike': 0.2664358142844834, 'adx_thresh': 24.82786002840876, 'atr_min_pct': 0.02823003919513294, 'atr_max_pct': 0.12119942981687504, 'tp_mult': 1.893331078132983, 'tsl_mult': 0.5832257572864825, 'strategy': 'mean_reversion', 'time_stop': 148, 'use_sma': False, 'use_atr': False, 'use_adx': False, 'use_ema': False, 'use_spike': False, 'rsi_required': False, 'edge_k': 1.2162408610167357, 'edge_cap': 0.536122374929492}.
[I 2025-08-29 22:30:21,937] Trial 466 finished with values: [-1000000000.0, 1000000000.0] and parameters: {'p_sma': 15, 'p_std': 42, 'p_atr': 12, 'p_adx': 23, 'rsi_period': 37, 'ema1': 12, 'ema2': 14, 'slip_atr_k': 0.006806816915490697, 'slip_spread_k': 0.554550604287046, 'spread_hl_frac': 0.006767874232467011, 'bb_std_mult': 3.0759660670107376, 'rsi_os': 15, 'rsi_ob': 76, 'vol_spike': 0.26826563649555457, 'adx_thresh': 21.968447752737465, 'atr_min_pct': 0.004698554344640804, 'atr_max_pct': 0.12159386269924093, 'tp_mult': 1.5758360926857158, 'tsl_mult': 0.5513538784239597, 'strategy': 'mean_reversion', 'time_stop': 149, 'use_sma': False, 'use_atr': False, 'use_adx': False, 'use_ema': False, 'use_spike': False, 'rsi_required': False, 'edge_k': 0.5872375132031107, 'edge_cap': 0.9237201258303086}.
[I 2025-08-29 22:30:22,466] Trial 464 finished with values: [-1000000000.0, 1000000000.0] and parameters: {'p_sma': 51, 'p_std': 24, 'p_atr': 15, 'p_adx': 17, 'rsi_period': 28, 'ema1': 8, 'ema2': 39, 'slip_atr_k': 0.190331150940667, 'slip_spread_k': 0.7973339430932165, 'spread_hl_frac': 0.00656514597529443, 'bb_std_mult': 2.886792656071149, 'rsi_os': 28, 'rsi_ob': 65, 'vol_spike': 0.2685758440698924, 'adx_thresh': 5.16090067446466, 'atr_min_pct': 0.018951705363817267, 'atr_max_pct': 0.12062780402519778, 'tp_mult': 1.8133037832958816, 'tsl_mult': 0.14254793208863809, 'strategy': 'mean_reversion', 'time_stop': 145, 'use_sma': False, 'use_atr': False, 'use_adx': False, 'use_ema': False, 'use_spike': False, 'rsi_required': False, 'edge_k': 0.44099832394159455, 'edge_cap': 0.5341925896484019}.
[I 2025-08-29 22:30:22,586] Trial 465 finished with values: [-1000000000.0, 1000000000.0] and parameters: {'p_sma': 18, 'p_std': 36, 'p_atr': 12, 'p_adx': 23, 'rsi_period': 28, 'ema1': 12, 'ema2': 13, 'slip_atr_k': 0.006745560176798917, 'slip_spread_k': 0.45402454175377027, 'spread_hl_frac': 0.017842256382048456, 'bb_std_mult': 3.0893643952815313, 'rsi_os': 28, 'rsi_ob': 58, 'vol_spike': 0.2689450598425967, 'adx_thresh': 21.70934834631995, 'atr_min_pct': 0.0046368905548600445, 'atr_max_pct': 0.10366629207861333, 'tp_mult': 1.5901348973358866, 'tsl_mult': 0.5867411211996195, 'strategy': 'mean_reversion', 'time_stop': 195, 'use_sma': False, 'use_atr': False, 'use_adx': False, 'use_ema': False, 'use_spike': False, 'rsi_required': False, 'edge_k': 1.9023393654251906, 'edge_cap': 0.9249198234492371}.
[I 2025-08-29 22:30:22,697] Trial 467 finished with values: [-0.0025521929770327967, 0.0026889671226448726] and parameters: {'p_sma': 51, 'p_std': 35, 'p_atr': 11, 'p_adx': 23, 'rsi_period': 37, 'ema1': 12, 'ema2': 56, 'slip_atr_k': 0.006871139348316271, 'slip_spread_k': 0.458439981666607, 'spread_hl_frac': 0.013699219219075002, 'bb_std_mult': 1.7681311828865354, 'rsi_os': 44, 'rsi_ob': 51, 'vol_spike': 0.2774147669110768, 'adx_thresh': 16.516305892196712, 'atr_min_pct': 0.004698650514815406, 'atr_max_pct': 0.11602980081926922, 'tp_mult': 1.977723157272153, 'tsl_mult': 0.551105066188068, 'strategy': 'mean_reversion', 'time_stop': 163, 'use_sma': False, 'use_atr': False, 'use_adx': False, 'use_ema': False, 'use_spike': False, 'rsi_required': False, 'edge_k': 0.44237822667828186, 'edge_cap': 0.5259697787947936}.
[I 2025-08-29 22:30:49,303] Trial 470 finished with values: [-0.002656724266535293, 0.0026842682722609747] and parameters: {'p_sma': 50, 'p_std': 35, 'p_atr': 11, 'p_adx': 24, 'rsi_period': 30, 'ema1': 9, 'ema2': 12, 'slip_atr_k': 0.004980038033786806, 'slip_spread_k': 0.8871065350807931, 'spread_hl_frac': 0.013340841982625286, 'bb_std_mult': 1.6564884369236434, 'rsi_os': 41, 'rsi_ob': 51, 'vol_spike': 0.2781568451167266, 'adx_thresh': 19.178926396278158, 'atr_min_pct': 0.004069557788993558, 'atr_max_pct': 0.10030576208463624, 'tp_mult': 2.0024780017078143, 'tsl_mult': 0.7506377280527936, 'strategy': 'mean_reversion', 'time_stop': 185, 'use_sma': False, 'use_atr': False, 'use_adx': False, 'use_ema': False, 'use_spike': False, 'rsi_required': False, 'edge_k': 0.44182914069979895, 'edge_cap': 0.49917589624736564}.
[I 2025-08-29 22:30:49,576] Trial 469 finished with values: [-0.003594026061015221, 0.003562328217723342] and parameters: {'p_sma': 50, 'p_std': 44, 'p_atr': 11, 'p_adx': 24, 'rsi_period': 29, 'ema1': 9, 'ema2': 12, 'slip_atr_k': 0.01036193626186777, 'slip_spread_k': 0.7785655677028106, 'spread_hl_frac': 0.013599307904827565, 'bb_std_mult': 2.7462183507325086, 'rsi_os': 46, 'rsi_ob': 89, 'vol_spike': 0.24691245875515974, 'adx_thresh': 16.908284314443172, 'atr_min_pct': 0.004317014974064939, 'atr_max_pct': 0.012911585466439446, 'tp_mult': 1.9940458603411622, 'tsl_mult': 0.571018727902865, 'strategy': 'mean_reversion', 'time_stop': 186, 'use_sma': False, 'use_atr': False, 'use_adx': False, 'use_ema': False, 'use_spike': False, 'rsi_required': False, 'edge_k': 1.4922164942700367, 'edge_cap': 0.49478172155348554}.
[I 2025-08-29 22:30:49,946] Trial 471 finished with values: [-1000000000.0, 1000000000.0] and parameters: {'p_sma': 50, 'p_std': 6, 'p_atr': 11, 'p_adx': 19, 'rsi_period': 30, 'ema1': 9, 'ema2': 12, 'slip_atr_k': 0.0040467695017784525, 'slip_spread_k': 0.918640850714738, 'spread_hl_frac': 0.013456669005646005, 'bb_std_mult': 2.770396853092669, 'rsi_os': 27, 'rsi_ob': 84, 'vol_spike': 0.2747088713683953, 'adx_thresh': 16.69038822507381, 'atr_min_pct': 0.0043989957671618386, 'atr_max_pct': 0.11554644558650529, 'tp_mult': 1.9877108008894078, 'tsl_mult': 0.5474499889494808, 'strategy': 'mean_reversion', 'time_stop': 264, 'use_sma': False, 'use_atr': False, 'use_adx': False, 'use_ema': False, 'use_spike': False, 'rsi_required': False, 'edge_k': 0.4372502000477577, 'edge_cap': 0.5191473756268153}.
[I 2025-08-29 22:30:49,959] Trial 468 finished with values: [-0.001974645831211097, 0.0021789042453058947] and parameters: {'p_sma': 51, 'p_std': 55, 'p_atr': 11, 'p_adx': 24, 'rsi_period': 28, 'ema1': 16, 'ema2': 12, 'slip_atr_k': 2.3898764821405488e-05, 'slip_spread_k': 0.4616978580374062, 'spread_hl_frac': 0.013810950986114278, 'bb_std_mult': 2.8860648281087733, 'rsi_os': 46, 'rsi_ob': 60, 'vol_spike': 0.2752261789682978, 'adx_thresh': 16.417298954740428, 'atr_min_pct': 0.004441686465357892, 'atr_max_pct': 0.09525026141766539, 'tp_mult': 1.998208536103291, 'tsl_mult': 0.14411900388389215, 'strategy': 'mean_reversion', 'time_stop': 213, 'use_sma': False, 'use_atr': False, 'use_adx': False, 'use_ema': False, 'use_spike': False, 'rsi_required': False, 'edge_k': 0.45037594116153506, 'edge_cap': 0.4958487094543586}.
[I 2025-08-29 22:31:17,209] Trial 473 finished with values: [-1000000000.0, 1000000000.0] and parameters: {'p_sma': 33, 'p_std': 16, 'p_atr': 16, 'p_adx': 19, 'rsi_period': 33, 'ema1': 8, 'ema2': 33, 'slip_atr_k': 0.0035718017333780383, 'slip_spread_k': 0.02613733525955564, 'spread_hl_frac': 0.01082991439868065, 'bb_std_mult': 1.76253792144605, 'rsi_os': 33, 'rsi_ob': 84, 'vol_spike': 0.2732724130225017, 'adx_thresh': 25.61002343775192, 'atr_min_pct': 0.00468409900246714, 'atr_max_pct': 0.09452115066977781, 'tp_mult': 1.507983336688306, 'tsl_mult': 0.5499588265991352, 'strategy': 'mean_reversion', 'time_stop': 265, 'use_sma': False, 'use_atr': False, 'use_adx': False, 'use_ema': False, 'use_spike': False, 'rsi_required': False, 'edge_k': 0.48878483611985546, 'edge_cap': 0.5175458703714456}.
[I 2025-08-29 22:31:17,418] Trial 474 finished with values: [0.00016603374885226785, 0.0006767743040364632] and parameters: {'p_sma': 34, 'p_std': 12, 'p_atr': 10, 'p_adx': 23, 'rsi_period': 8, 'ema1': 29, 'ema2': 11, 'slip_atr_k': 0.0004149364066045394, 'slip_spread_k': 0.8080140356708538, 'spread_hl_frac': 0.011376412552194251, 'bb_std_mult': 2.978453930843581, 'rsi_os': 31, 'rsi_ob': 60, 'vol_spike': 0.26837167238481924, 'adx_thresh': 21.039036600472496, 'atr_min_pct': 0.00501493038461822, 'atr_max_pct': 0.1429746625335267, 'tp_mult': 1.94614320672511, 'tsl_mult': 0.5558747404761799, 'strategy': 'mean_reversion', 'time_stop': 274, 'use_sma': False, 'use_atr': False, 'use_adx': False, 'use_ema': False, 'use_spike': False, 'rsi_required': False, 'edge_k': 1.2591835466485402, 'edge_cap': 0.23187228485053085}.
[I 2025-08-29 22:31:17,816] Trial 472 finished with values: [-1000000000.0, 1000000000.0] and parameters: {'p_sma': 48, 'p_std': 55, 'p_atr': 14, 'p_adx': 23, 'rsi_period': 31, 'ema1': 17, 'ema2': 56, 'slip_atr_k': 0.00035510595270842266, 'slip_spread_k': 0.7832531610347089, 'spread_hl_frac': 0.010942795756454352, 'bb_std_mult': 2.9728849541034457, 'rsi_os': 27, 'rsi_ob': 60, 'vol_spike': 0.27465152259408954, 'adx_thresh': 25.543547621939396, 'atr_min_pct': 0.004179645024498053, 'atr_max_pct': 0.13051013294221994, 'tp_mult': 1.4784626108984307, 'tsl_mult': 0.5666251551199417, 'strategy': 'mean_reversion', 'time_stop': 274, 'use_sma': False, 'use_atr': False, 'use_adx': False, 'use_ema': False, 'use_spike': False, 'rsi_required': False, 'edge_k': 1.7301648321298184, 'edge_cap': 0.5932506348076217}.
[I 2025-08-29 22:31:17,817] Trial 475 finished with values: [-1000000000.0, 1000000000.0] and parameters: {'p_sma': 48, 'p_std': 55, 'p_atr': 10, 'p_adx': 23, 'rsi_period': 33, 'ema1': 29, 'ema2': 38, 'slip_atr_k': 0.0005958991029204092, 'slip_spread_k': 0.028642528221350938, 'spread_hl_frac': 0.010795099781975195, 'bb_std_mult': 1.7204583590870908, 'rsi_os': 5, 'rsi_ob': 83, 'vol_spike': 0.26896024486060544, 'adx_thresh': 10.517420470366803, 'atr_min_pct': 0.0041190370363309945, 'atr_max_pct': 0.06867653195456969, 'tp_mult': 1.5060314635710217, 'tsl_mult': 0.5645980579489007, 'strategy': 'mean_reversion', 'time_stop': 163, 'use_sma': False, 'use_atr': False, 'use_adx': False, 'use_ema': False, 'use_spike': False, 'rsi_required': False, 'edge_k': 0.5259350968777535, 'edge_cap': 0.5896696539552984}.
[I 2025-08-29 22:31:44,765] Trial 476 finished with values: [-0.003200698868587648, 0.0032161525529892463] and parameters: {'p_sma': 48, 'p_std': 39, 'p_atr': 10, 'p_adx': 23, 'rsi_period': 36, 'ema1': 24, 'ema2': 11, 'slip_atr_k': 0.0006328866556459798, 'slip_spread_k': 0.8162847780718807, 'spread_hl_frac': 0.012078092343098729, 'bb_std_mult': 2.8496451978213626, 'rsi_os': 44, 'rsi_ob': 82, 'vol_spike': 0.2689930547203763, 'adx_thresh': 21.030053820853595, 'atr_min_pct': 0.003974498940707684, 'atr_max_pct': 0.07445075905151952, 'tp_mult': 1.950087388766678, 'tsl_mult': 0.001044974222050521, 'strategy': 'mean_reversion', 'time_stop': 163, 'use_sma': False, 'use_atr': False, 'use_adx': False, 'use_ema': False, 'use_spike': False, 'rsi_required': False, 'edge_k': 1.2574196550586405, 'edge_cap': 0.49369846456907895}.
[I 2025-08-29 22:31:45,000] Trial 478 finished with values: [-1000000000.0, 1000000000.0] and parameters: {'p_sma': 34, 'p_std': 13, 'p_atr': 10, 'p_adx': 24, 'rsi_period': 8, 'ema1': 28, 'ema2': 11, 'slip_atr_k': 0.0009055691279594431, 'slip_spread_k': 0.8474312277402778, 'spread_hl_frac': 0.011819002080252482, 'bb_std_mult': 3.1779582487805764, 'rsi_os': 33, 'rsi_ob': 61, 'vol_spike': 0.26365042992500703, 'adx_thresh': 20.87161918452246, 'atr_min_pct': 0.01195360045740387, 'atr_max_pct': 0.14234817757301232, 'tp_mult': 2.077067448970306, 'tsl_mult': 0.27146226379951494, 'strategy': 'breakout', 'time_stop': 290, 'use_sma': False, 'use_atr': False, 'use_adx': False, 'use_ema': False, 'use_spike': False, 'rsi_required': False, 'edge_k': 1.2429010606505349, 'edge_cap': 0.2257796713161571}.
[I 2025-08-29 22:31:45,000] Trial 477 finished with values: [-1000000000.0, 1000000000.0] and parameters: {'p_sma': 36, 'p_std': 12, 'p_atr': 10, 'p_adx': 23, 'rsi_period': 8, 'ema1': 28, 'ema2': 11, 'slip_atr_k': 0.003035844045804989, 'slip_spread_k': 0.8403501466028749, 'spread_hl_frac': 0.010435918838459832, 'bb_std_mult': 3.183355451216251, 'rsi_os': 32, 'rsi_ob': 61, 'vol_spike': 0.2667618784410952, 'adx_thresh': 20.965653116324063, 'atr_min_pct': 0.006751994834791036, 'atr_max_pct': 0.14178462977246495, 'tp_mult': 2.0932875885336695, 'tsl_mult': 0.5730158546468955, 'strategy': 'breakout', 'time_stop': 273, 'use_sma': False, 'use_atr': False, 'use_adx': False, 'use_ema': False, 'use_spike': False, 'rsi_required': False, 'edge_k': 1.2791660528779962, 'edge_cap': 0.229825137421374}.
[I 2025-08-29 22:31:45,087] Trial 479 finished with values: [-1000000000.0, 1000000000.0] and parameters: {'p_sma': 34, 'p_std': 13, 'p_atr': 10, 'p_adx': 24, 'rsi_period': 8, 'ema1': 27, 'ema2': 11, 'slip_atr_k': 0.0003884209415298118, 'slip_spread_k': 0.8598444726266419, 'spread_hl_frac': 0.011687315146846256, 'bb_std_mult': 3.1814534796816956, 'rsi_os': 33, 'rsi_ob': 61, 'vol_spike': 0.26383147636113546, 'adx_thresh': 21.06935148499691, 'atr_min_pct': 0.018164304996167988, 'atr_max_pct': 0.14254725068801788, 'tp_mult': 2.063197765530199, 'tsl_mult': 0.9778422212177167, 'strategy': 'breakout', 'time_stop': 282, 'use_sma': False, 'use_atr': False, 'use_adx': False, 'use_ema': False, 'use_spike': False, 'rsi_required': False, 'edge_k': 1.2619831010718232, 'edge_cap': 0.22844960311377438}.
[I 2025-08-29 22:32:12,490] Trial 480 finished with values: [-1000000000.0, 1000000000.0] and parameters: {'p_sma': 34, 'p_std': 12, 'p_atr': 10, 'p_adx': 24, 'rsi_period': 8, 'ema1': 26, 'ema2': 21, 'slip_atr_k': 0.003979981590390411, 'slip_spread_k': 0.8517370532098988, 'spread_hl_frac': 0.009832536357287798, 'bb_std_mult': 3.1713000345906317, 'rsi_os': 33, 'rsi_ob': 61, 'vol_spike': 0.26264958460907284, 'adx_thresh': 20.623994638482092, 'atr_min_pct': 0.011932572616457065, 'atr_max_pct': 0.14235347175136256, 'tp_mult': 2.131464855403891, 'tsl_mult': 0.5825340391790971, 'strategy': 'breakout', 'time_stop': 283, 'use_sma': False, 'use_atr': False, 'use_adx': False, 'use_ema': False, 'use_spike': False, 'rsi_required': False, 'edge_k': 1.2874004838995763, 'edge_cap': 0.22791741878124547}.
[I 2025-08-29 22:32:12,625] Trial 483 finished with values: [-1000000000.0, 1000000000.0] and parameters: {'p_sma': 32, 'p_std': 11, 'p_atr': 10, 'p_adx': 24, 'rsi_period': 10, 'ema1': 30, 'ema2': 13, 'slip_atr_k': 0.005517321103741432, 'slip_spread_k': 0.8710430868587952, 'spread_hl_frac': 0.009738366678918916, 'bb_std_mult': 3.109727604113769, 'rsi_os': 33, 'rsi_ob': 60, 'vol_spike': 0.25698190625172074, 'adx_thresh': 20.344185311054673, 'atr_min_pct': 0.024162788686189065, 'atr_max_pct': 0.14555698295526068, 'tp_mult': 2.16440774203712, 'tsl_mult': 0.08306490368743968, 'strategy': 'mean_reversion', 'time_stop': 289, 'use_sma': False, 'use_atr': False, 'use_adx': False, 'use_ema': False, 'use_spike': False, 'rsi_required': False, 'edge_k': 1.3222008365062423, 'edge_cap': 0.2561039413111842}.
[I 2025-08-29 22:32:12,937] Trial 482 finished with values: [-1000000000.0, 1000000000.0] and parameters: {'p_sma': 37, 'p_std': 11, 'p_atr': 10, 'p_adx': 24, 'rsi_period': 10, 'ema1': 29, 'ema2': 14, 'slip_atr_k': 0.0007444429197452603, 'slip_spread_k': 0.8531272644594056, 'spread_hl_frac': 0.010254075891625861, 'bb_std_mult': 3.0979698728786356, 'rsi_os': 32, 'rsi_ob': 59, 'vol_spike': 0.2557697914147326, 'adx_thresh': 21.558564241138196, 'atr_min_pct': 0.012990308335732599, 'atr_max_pct': 0.14566865253245107, 'tp_mult': 2.192109253574622, 'tsl_mult': 0.5959278069934276, 'strategy': 'mean_reversion', 'time_stop': 282, 'use_sma': False, 'use_atr': False, 'use_adx': False, 'use_ema': False, 'use_spike': False, 'rsi_required': False, 'edge_k': 1.3292835364621236, 'edge_cap': 0.26262392178793975}.
[I 2025-08-29 22:32:13,020] Trial 481 finished with values: [-1000000000.0, 1000000000.0] and parameters: {'p_sma': 33, 'p_std': 11, 'p_atr': 10, 'p_adx': 24, 'rsi_period': 10, 'ema1': 26, 'ema2': 20, 'slip_atr_k': 5.964636098678517e-06, 'slip_spread_k': 0.8534478826196661, 'spread_hl_frac': 0.010154812058805366, 'bb_std_mult': 3.066008489688104, 'rsi_os': 32, 'rsi_ob': 59, 'vol_spike': 0.25982772190391135, 'adx_thresh': 21.396312148230653, 'atr_min_pct': 0.013215895100134758, 'atr_max_pct': 0.14510826466562057, 'tp_mult': 2.169336782333197, 'tsl_mult': 0.5950050864102655, 'strategy': 'mean_reversion', 'time_stop': 295, 'use_sma': False, 'use_atr': False, 'use_adx': False, 'use_ema': False, 'use_spike': False, 'rsi_required': False, 'edge_k': 1.1351398992745838, 'edge_cap': 0.2592516076924567}.
[I 2025-08-29 22:32:39,669] Trial 487 finished with values: [-1000000000.0, 1000000000.0] and parameters: {'p_sma': 35, 'p_std': 14, 'p_atr': 10, 'p_adx': 7, 'rsi_period': 7, 'ema1': 27, 'ema2': 58, 'slip_atr_k': 0.008728045473838635, 'slip_spread_k': 0.8346953918631268, 'spread_hl_frac': 0.01105294580839447, 'bb_std_mult': 3.0448802398157757, 'rsi_os': 31, 'rsi_ob': 60, 'vol_spike': 0.2698204266479528, 'adx_thresh': 20.006693892127835, 'atr_min_pct': 0.015565222043914988, 'atr_max_pct': 0.14988095909493432, 'tp_mult': 1.9534531594043145, 'tsl_mult': 0.35333213475869796, 'strategy': 'mean_reversion', 'time_stop': 260, 'use_sma': False, 'use_atr': False, 'use_adx': False, 'use_ema': False, 'use_spike': False, 'rsi_required': False, 'edge_k': 1.4132144389975685, 'edge_cap': 0.19951184698577076}.
[I 2025-08-29 22:32:40,282] Trial 484 finished with values: [-1000000000.0, 1000000000.0] and parameters: {'p_sma': 32, 'p_std': 11, 'p_atr': 10, 'p_adx': 30, 'rsi_period': 10, 'ema1': 30, 'ema2': 13, 'slip_atr_k': 0.005294238953775157, 'slip_spread_k': 0.8393233261853484, 'spread_hl_frac': 0.010930603624800549, 'bb_std_mult': 3.100767388619366, 'rsi_os': 32, 'rsi_ob': 59, 'vol_spike': 0.25876778931561184, 'adx_thresh': 21.59409071158593, 'atr_min_pct': 0.014249861559126907, 'atr_max_pct': 0.1445018228596854, 'tp_mult': 2.230444857567634, 'tsl_mult': 0.5244387202384864, 'strategy': 'mean_reversion', 'time_stop': 294, 'use_sma': False, 'use_atr': False, 'use_adx': False, 'use_ema': False, 'use_spike': False, 'rsi_required': False, 'edge_k': 1.3632200244627832, 'edge_cap': 0.19755651124230397}.
