[I 2025-08-29 22:50:22,810] Trial 647 finished with values: [-1000000000.0, 1000000000.0] and parameters: {'p_sma': 29, 'p_std': 11, 'p_atr': 13, 'p_adx': 8, 'rsi_period': 16, 'ema1': 30, 'ema2': 26, 'slip_atr_k': 0.0001315724556297615, 'slip_spread_k': 0.30928754370462785, 'spread_hl_frac': 0.021198535655787498, 'bb_std_mult': 2.1147086468015353, 'rsi_os': 39, 'rsi_ob': 61, 'vol_spike': 0.24683068624725463, 'adx_thresh': 14.373163946483636, 'atr_min_pct': 0.016886847136931723, 'atr_max_pct': 0.08288754135279522, 'tp_mult': 1.0912779292293018, 'tsl_mult': 0.6066948136319227, 'strategy': 'breakout', 'time_stop': 47, 'use_sma': False, 'use_atr': False, 'use_adx': False, 'use_ema': False, 'use_spike': False, 'rsi_required': False, 'edge_k': 1.8363373850110734, 'edge_cap': 0.13775699575796932}.
[I 2025-08-29 22:50:22,919] Trial 649 finished with values: [-1000000000.0, 1000000000.0] and parameters: {'p_sma': 15, 'p_std': 10, 'p_atr': 13, 'p_adx': 8, 'rsi_period': 79, 'ema1': 29, 'ema2': 26, 'slip_atr_k': 0.0002749818131313475, 'slip_spread_k': 0.31401187311899437, 'spread_hl_frac': 0.029351075299491984, 'bb_std_mult': 2.0246871586466235, 'rsi_os': 33, 'rsi_ob': 63, 'vol_spike': 0.25152527896576965, 'adx_thresh': 14.155726200737764, 'atr_min_pct': 0.013273854366117332, 'atr_max_pct': 0.0839892308072015, 'tp_mult': 1.0875940706967344, 'tsl_mult': 0.6122412310261282, 'strategy': 'breakout', 'time_stop': 295, 'use_sma': False, 'use_atr': False, 'use_adx': False, 'use_ema': False, 'use_spike': False, 'rsi_required': False, 'edge_k': 1.8192348066758621, 'edge_cap': 0.17738595978966246}.
[I 2025-08-29 22:50:50,485] Trial 652 finished with values: [-1000000000.0, 1000000000.0] and parameters: {'p_sma': 14, 'p_std': 50, 'p_atr': 18, 'p_adx': 14, 'rsi_period': 10, 'ema1': 29, 'ema2': 21, 'slip_atr_k': 0.20357978177593594, 'slip_spread_k': 0.3614083110505606, 'spread_hl_frac': 0.013467222560236735, 'bb_std_mult': 1.8435278943835365, 'rsi_os': 17, 'rsi_ob': 63, 'vol_spike': 0.2566429584167732, 'adx_thresh': 19.21252401608014, 'atr_min_pct': 0.02795719340656866, 'atr_max_pct': 0.07316652611051745, 'tp_mult': 1.9678382354568187, 'tsl_mult': 0.6479365144223763, 'strategy': 'mean_reversion', 'time_stop': 295, 'use_sma': False, 'use_atr': False, 'use_adx': False, 'use_ema': False, 'use_spike': False, 'rsi_required': False, 'edge_k': 1.9299246340774838, 'edge_cap': 0.17225755497497794}.
[I 2025-08-29 22:50:50,486] Trial 653 finished with values: [-1000000000.0, 1000000000.0] and parameters: {'p_sma': 24, 'p_std': 8, 'p_atr': 18, 'p_adx': 14, 'rsi_period': 74, 'ema1': 30, 'ema2': 21, 'slip_atr_k': 0.014675882697033666, 'slip_spread_k': 0.35849117925228835, 'spread_hl_frac': 0.010354597607721467, 'bb_std_mult': 1.423550622055025, 'rsi_os': 9, 'rsi_ob': 54, 'vol_spike': 0.2566688141832089, 'adx_thresh': 19.190036916533874, 'atr_min_pct': 0.009494121584455123, 'atr_max_pct': 0.08931616900535935, 'tp_mult': 1.9648350866887563, 'tsl_mult': 0.6447549239121817, 'strategy': 'mean_reversion', 'time_stop': 284, 'use_sma': False, 'use_atr': False, 'use_adx': False, 'use_ema': False, 'use_spike': False, 'rsi_required': False, 'edge_k': 0.0046069724129329526, 'edge_cap': 0.17099099650663468}.
[I 2025-08-29 22:50:50,613] Trial 650 finished with values: [-1000000000.0, 1000000000.0] and parameters: {'p_sma': 22, 'p_std': 11, 'p_atr': 14, 'p_adx': 12, 'rsi_period': 19, 'ema1': 29, 'ema2': 21, 'slip_atr_k': 0.05925210264572364, 'slip_spread_k': 0.21161057163461472, 'spread_hl_frac': 0.013450031578277646, 'bb_std_mult': 0.508806731967041, 'rsi_os': 17, 'rsi_ob': 54, 'vol_spike': 0.2576988618493477, 'adx_thresh': 20.31889347350795, 'atr_min_pct': 0.015618438296329602, 'atr_max_pct': 0.08623456334582749, 'tp_mult': 1.0857363184900426, 'tsl_mult': 0.2807427289867257, 'strategy': 'mean_reversion', 'time_stop': 69, 'use_sma': False, 'use_atr': False, 'use_adx': False, 'use_ema': False, 'use_spike': False, 'rsi_required': False, 'edge_k': 1.9297764424532895, 'edge_cap': 0.17428564033958338}.
[I 2025-08-29 22:50:50,699] Trial 651 finished with values: [-1000000000.0, 1000000000.0] and parameters: {'p_sma': 16, 'p_std': 11, 'p_atr': 7, 'p_adx': 12, 'rsi_period': 10, 'ema1': 29, 'ema2': 29, 'slip_atr_k': 0.005385459129388658, 'slip_spread_k': 0.3707348175043573, 'spread_hl_frac': 0.013467797732172243, 'bb_std_mult': 1.8466675341052843, 'rsi_os': 35, 'rsi_ob': 63, 'vol_spike': 0.1617372529399163, 'adx_thresh': 19.636908444359108, 'atr_min_pct': 0.020456735327089165, 'atr_max_pct': 0.07444758901871892, 'tp_mult': 1.9607978424799914, 'tsl_mult': 0.3386628963762207, 'strategy': 'mean_reversion', 'time_stop': 69, 'use_sma': False, 'use_atr': False, 'use_adx': False, 'use_ema': False, 'use_spike': False, 'rsi_required': False, 'edge_k': 1.9332971561058252, 'edge_cap': 0.17788118442922263}.
[I 2025-08-29 22:50:50,935] Trial 656 finished with values: [-1000000000.0, 1000000000.0] and parameters: {'p_sma': 43, 'p_std': 13, 'p_atr': 12, 'p_adx': 12, 'rsi_period': 11, 'ema1': 30, 'ema2': 29, 'slip_atr_k': 0.1552275736031864, 'slip_spread_k': 0.27509476174014413, 'spread_hl_frac': 0.014863033466695038, 'bb_std_mult': 2.3154031957649144, 'rsi_os': 35, 'rsi_ob': 48, 'vol_spike': 0.24186568339828765, 'adx_thresh': 23.258068303992275, 'atr_min_pct': 0.01948534005486344, 'atr_max_pct': 0.06515293523747463, 'tp_mult': 2.501798944265733, 'tsl_mult': 0.31726728528232484, 'strategy': 'mean_reversion', 'time_stop': 276, 'use_sma': False, 'use_atr': False, 'use_adx': False, 'use_ema': False, 'use_spike': False, 'rsi_required': False, 'edge_k': 1.8750182689093224, 'edge_cap': 0.19824646185584746}.
[I 2025-08-29 22:51:17,421] Trial 654 finished with values: [-1000000000.0, 1000000000.0] and parameters: {'p_sma': 41, 'p_std': 12, 'p_atr': 12, 'p_adx': 12, 'rsi_period': 11, 'ema1': 30, 'ema2': 29, 'slip_atr_k': 0.005110494599069802, 'slip_spread_k': 0.21515193207674277, 'spread_hl_frac': 0.014840740375466458, 'bb_std_mult': 0.5050843220491199, 'rsi_os': 35, 'rsi_ob': 89, 'vol_spike': 0.07161394994545689, 'adx_thresh': 19.8918954002795, 'atr_min_pct': 0.019169416541957765, 'atr_max_pct': 0.06541012837509201, 'tp_mult': 2.18121545819088, 'tsl_mult': 0.1021310960565956, 'strategy': 'mean_reversion', 'time_stop': 70, 'use_sma': False, 'use_atr': False, 'use_adx': False, 'use_ema': False, 'use_spike': False, 'rsi_required': False, 'edge_k': 1.8819702649876855, 'edge_cap': 0.21316946777166923}.
[I 2025-08-29 22:51:17,611] Trial 657 finished with values: [-1000000000.0, 1000000000.0] and parameters: {'p_sma': 19, 'p_std': 12, 'p_atr': 12, 'p_adx': 13, 'rsi_period': 70, 'ema1': 11, 'ema2': 16, 'slip_atr_k': 0.2454603112092198, 'slip_spread_k': 0.24962155362533833, 'spread_hl_frac': 0.0446651551319383, 'bb_std_mult': 2.620199468969148, 'rsi_os': 35, 'rsi_ob': 62, 'vol_spike': 0.12335707998809468, 'adx_thresh': 21.373082822121777, 'atr_min_pct': 0.006827500760289899, 'atr_max_pct': 0.09726424938158051, 'tp_mult': 2.0656955587290837, 'tsl_mult': 0.3125906876475459, 'strategy': 'mean_reversion', 'time_stop': 277, 'use_sma': False, 'use_atr': False, 'use_adx': False, 'use_ema': False, 'use_spike': False, 'rsi_required': False, 'edge_k': 1.879238747764475, 'edge_cap': 0.19744181511299386}.
[I 2025-08-29 22:51:17,857] Trial 658 finished with values: [-0.0003933716946917798, 0.0014591284905084217] and parameters: {'p_sma': 19, 'p_std': 12, 'p_atr': 12, 'p_adx': 11, 'rsi_period': 12, 'ema1': 30, 'ema2': 18, 'slip_atr_k': 1.9088758249837597e-05, 'slip_spread_k': 0.24360025995086235, 'spread_hl_frac': 0.011240988863726396, 'bb_std_mult': 1.1477331848058652, 'rsi_os': 45, 'rsi_ob': 85, 'vol_spike': 0.0475099973327715, 'adx_thresh': 21.3927614020106, 'atr_min_pct': 0.004757141307005143, 'atr_max_pct': 0.06907247144242429, 'tp_mult': 2.2419842132149466, 'tsl_mult': 0.18300413086749423, 'strategy': 'mean_reversion', 'time_stop': 289, 'use_sma': False, 'use_atr': False, 'use_adx': False, 'use_ema': False, 'use_spike': False, 'rsi_required': False, 'edge_k': 1.890447305999666, 'edge_cap': 0.36408202956622593}.
[I 2025-08-29 22:51:17,967] Trial 655 finished with values: [-1000000000.0, 1000000000.0] and parameters: {'p_sma': 22, 'p_std': 12, 'p_atr': 12, 'p_adx': 12, 'rsi_period': 11, 'ema1': 30, 'ema2': 29, 'slip_atr_k': 0.006113441190697161, 'slip_spread_k': 0.21647604112824115, 'spread_hl_frac': 0.008542488215670739, 'bb_std_mult': 1.3402698081925153, 'rsi_os': 34, 'rsi_ob': 67, 'vol_spike': 0.2596464830378176, 'adx_thresh': 20.338516032736557, 'atr_min_pct': 0.012128344766870424, 'atr_max_pct': 0.06914084615102227, 'tp_mult': 2.23434803467672, 'tsl_mult': 0.07276568630840896, 'strategy': 'mean_reversion', 'time_stop': 72, 'use_sma': False, 'use_atr': False, 'use_adx': False, 'use_ema': False, 'use_spike': False, 'rsi_required': False, 'edge_k': 1.998174663818339, 'edge_cap': 0.2115508256651293}.
[I 2025-08-29 22:51:18,179] Trial 662 finished with values: [-1000000000.0, 1000000000.0] and parameters: {'p_sma': 21, 'p_std': 15, 'p_atr': 12, 'p_adx': 13, 'rsi_period': 12, 'ema1': 30, 'ema2': 22, 'slip_atr_k': 0.012655673225570874, 'slip_spread_k': 0.27405139786404425, 'spread_hl_frac': 0.011530603395879673, 'bb_std_mult': 1.6821148647762656, 'rsi_os': 53, 'rsi_ob': 68, 'vol_spike': 0.01709585262671648, 'adx_thresh': 21.869359724151057, 'atr_min_pct': 0.004309434305918371, 'atr_max_pct': 0.058232750074433674, 'tp_mult': 1.6052690168230974, 'tsl_mult': 0.6739330319605454, 'strategy': 'mean_reversion', 'time_stop': 25, 'use_sma': False, 'use_atr': False, 'use_adx': False, 'use_ema': False, 'use_spike': False, 'rsi_required': False, 'edge_k': 0.15151316757496858, 'edge_cap': 0.10231729346514663}.
[I 2025-08-29 22:51:18,189] Trial 661 finished with values: [-1000000000.0, 1000000000.0] and parameters: {'p_sma': 20, 'p_std': 19, 'p_atr': 12, 'p_adx': 13, 'rsi_period': 14, 'ema1': 30, 'ema2': 18, 'slip_atr_k': 0.009595338852148264, 'slip_spread_k': 0.28212975291510767, 'spread_hl_frac': 0.011305402322606984, 'bb_std_mult': 1.1067793125802285, 'rsi_os': 54, 'rsi_ob': 64, 'vol_spike': 0.2593922761689387, 'adx_thresh': 20.70143718524422, 'atr_min_pct': 0.0050094765489304876, 'atr_max_pct': 0.05949130999019246, 'tp_mult': 1.2143221809323514, 'tsl_mult': 0.7041902246503906, 'strategy': 'mean_reversion', 'time_stop': 290, 'use_sma': False, 'use_atr': False, 'use_adx': False, 'use_ema': False, 'use_spike': False, 'rsi_required': False, 'edge_k': 1.997162910344538, 'edge_cap': 0.10975734846006885}.
[I 2025-08-29 22:51:18,456] Trial 663 finished with values: [-1000000000.0, 1000000000.0] and parameters: {'p_sma': 31, 'p_std': 10, 'p_atr': 12, 'p_adx': 14, 'rsi_period': 14, 'ema1': 30, 'ema2': 19, 'slip_atr_k': 0.009833487459563323, 'slip_spread_k': 0.28218898539809295, 'spread_hl_frac': 0.010703423253377333, 'bb_std_mult': 1.1171046455563625, 'rsi_os': 33, 'rsi_ob': 47, 'vol_spike': 0.1680269442791211, 'adx_thresh': 18.30605667375463, 'atr_min_pct': 0.02280106330382729, 'atr_max_pct': 0.054355351593231196, 'tp_mult': 1.8254823829076725, 'tsl_mult': 0.0006095136350405261, 'strategy': 'mean_reversion', 'time_stop': 290, 'use_sma': False, 'use_atr': False, 'use_adx': False, 'use_ema': False, 'use_spike': False, 'rsi_required': False, 'edge_k': 1.9492046070002107, 'edge_cap': 0.12224378062662207}.
[I 2025-08-29 22:51:43,845] Trial 659 finished with values: [-1000000000.0, 1000000000.0] and parameters: {'p_sma': 20, 'p_std': 42, 'p_atr': 26, 'p_adx': 9, 'rsi_period': 69, 'ema1': 28, 'ema2': 17, 'slip_atr_k': 0.010913093398591395, 'slip_spread_k': 0.17778550516641461, 'spread_hl_frac': 0.018693841854489676, 'bb_std_mult': 1.1359855269682273, 'rsi_os': 45, 'rsi_ob': 68, 'vol_spike': 0.26089967093419936, 'adx_thresh': 21.239931324781878, 'atr_min_pct': 0.0298536677305868, 'atr_max_pct': 0.05618232313091004, 'tp_mult': 2.0550712941185383, 'tsl_mult': 0.7213379524457413, 'strategy': 'mean_reversion', 'time_stop': 290, 'use_sma': False, 'use_atr': False, 'use_adx': False, 'use_ema': False, 'use_spike': False, 'rsi_required': False, 'edge_k': 1.9740762020183529, 'edge_cap': 0.11339389738531258}.
[I 2025-08-29 22:51:43,995] Trial 660 finished with values: [-1000000000.0, 1000000000.0] and parameters: {'p_sma': 31, 'p_std': 19, 'p_atr': 14, 'p_adx': 16, 'rsi_period': 12, 'ema1': 30, 'ema2': 18, 'slip_atr_k': 0.009247533208118008, 'slip_spread_k': 0.1789137821196816, 'spread_hl_frac': 0.011429219079877009, 'bb_std_mult': 1.3631070167763444, 'rsi_os': 33, 'rsi_ob': 67, 'vol_spike': 0.01642487291921882, 'adx_thresh': 20.449701673290082, 'atr_min_pct': 0.028824150355596625, 'atr_max_pct': 0.05753236444486873, 'tp_mult': 1.8253918167089211, 'tsl_mult': 0.17589408817931812, 'strategy': 'mean_reversion', 'time_stop': 21, 'use_sma': False, 'use_atr': False, 'use_adx': False, 'use_ema': False, 'use_spike': False, 'rsi_required': False, 'edge_k': 1.9715111198991557, 'edge_cap': 0.3594163133001249}.
[I 2025-08-29 22:51:45,756] Trial 664 finished with values: [-1000000000.0, 1000000000.0] and parameters: {'p_sma': 31, 'p_std': 23, 'p_atr': 12, 'p_adx': 14, 'rsi_period': 59, 'ema1': 29, 'ema2': 19, 'slip_atr_k': 0.07451171085730637, 'slip_spread_k': 0.2907386434363012, 'spread_hl_frac': 0.006055506369954743, 'bb_std_mult': 1.149230712998834, 'rsi_os': 43, 'rsi_ob': 62, 'vol_spike': 0.24579935731825953, 'adx_thresh': 15.766929253734677, 'atr_min_pct': 0.02275379232121115, 'atr_max_pct': 0.06971030952010249, 'tp_mult': 1.8752540509558284, 'tsl_mult': 0.1771148724004864, 'strategy': 'breakout', 'time_stop': 284, 'use_sma': False, 'use_atr': False, 'use_adx': False, 'use_ema': False, 'use_spike': False, 'rsi_required': False, 'edge_k': 1.9291741851175461, 'edge_cap': 0.15480736566227699}.
[I 2025-08-29 22:51:46,181] Trial 665 finished with values: [-1000000000.0, 1000000000.0] and parameters: {'p_sma': 17, 'p_std': 13, 'p_atr': 12, 'p_adx': 14, 'rsi_period': 10, 'ema1': 29, 'ema2': 24, 'slip_atr_k': 0.017977307775074197, 'slip_spread_k': 0.2935467350062266, 'spread_hl_frac': 0.012630079444252044, 'bb_std_mult': 1.5468001436737266, 'rsi_os': 13, 'rsi_ob': 87, 'vol_spike': 0.2509513218497565, 'adx_thresh': 27.710422769065637, 'atr_min_pct': 0.008477411837406858, 'atr_max_pct': 0.010117023127652086, 'tp_mult': 1.8780784345063584, 'tsl_mult': 0.6015446876629938, 'strategy': 'breakout', 'time_stop': 281, 'use_sma': False, 'use_atr': False, 'use_adx': False, 'use_ema': False, 'use_spike': False, 'rsi_required': False, 'edge_k': 1.9012915354187279, 'edge_cap': 0.18608442844666745}.
[I 2025-08-29 22:52:13,881] Trial 667 finished with values: [-1000000000.0, 1000000000.0] and parameters: {'p_sma': 5, 'p_std': 13, 'p_atr': 12, 'p_adx': 13, 'rsi_period': 59, 'ema1': 29, 'ema2': 23, 'slip_atr_k': 0.01745474900876422, 'slip_spread_k': 0.3039320678415292, 'spread_hl_frac': 0.006017527100069402, 'bb_std_mult': 2.4323302205927613, 'rsi_os': 42, 'rsi_ob': 62, 'vol_spike': 0.025519630458451292, 'adx_thresh': 21.869698300332303, 'atr_min_pct': 0.00834547765234385, 'atr_max_pct': 0.07053399376782607, 'tp_mult': 2.0857174780672336, 'tsl_mult': 0.7671439127639657, 'strategy': 'breakout', 'time_stop': 61, 'use_sma': False, 'use_atr': False, 'use_adx': False, 'use_ema': False, 'use_spike': False, 'rsi_required': False, 'edge_k': 1.9295417990346304, 'edge_cap': 0.15455349167828372}.
[I 2025-08-29 22:52:14,127] Trial 666 finished with values: [-1000000000.0, 1000000000.0] and parameters: {'p_sma': 57, 'p_std': 27, 'p_atr': 12, 'p_adx': 14, 'rsi_period': 10, 'ema1': 29, 'ema2': 24, 'slip_atr_k': 0.14752338962853648, 'slip_spread_k': 0.29663803372619363, 'spread_hl_frac': 0.009823875434660775, 'bb_std_mult': 3.51830598590245, 'rsi_os': 41, 'rsi_ob': 92, 'vol_spike': 0.24922983792449882, 'adx_thresh': 15.928627302290476, 'atr_min_pct': 0.005869030408920228, 'atr_max_pct': 0.06993476974883434, 'tp_mult': 1.8783990670799051, 'tsl_mult': 0.7728452157970996, 'strategy': 'breakout', 'time_stop': 281, 'use_sma': False, 'use_atr': False, 'use_adx': False, 'use_ema': False, 'use_spike': False, 'rsi_required': False, 'edge_k': 1.9055092878668867, 'edge_cap': 0.14798171537119875}.
[I 2025-08-29 22:52:14,127] Trial 669 finished with values: [-1000000000.0, 1000000000.0] and parameters: {'p_sma': 25, 'p_std': 13, 'p_atr': 12, 'p_adx': 13, 'rsi_period': 13, 'ema1': 30, 'ema2': 21, 'slip_atr_k': 0.19468486178034508, 'slip_spread_k': 0.2650469780037541, 'spread_hl_frac': 0.009732529670666677, 'bb_std_mult': 1.2944178732902472, 'rsi_os': 8, 'rsi_ob': 63, 'vol_spike': 0.23596967459477197, 'adx_thresh': 10.677987761976576, 'atr_min_pct': 0.01064819396103886, 'atr_max_pct': 0.07277406630165242, 'tp_mult': 2.0962035808300303, 'tsl_mult': 0.7745278778695883, 'strategy': 'mean_reversion', 'time_stop': 273, 'use_sma': False, 'use_atr': False, 'use_adx': False, 'use_ema': False, 'use_spike': False, 'rsi_required': False, 'edge_k': 1.9195915480653867, 'edge_cap': 0.607322207619076}.
[I 2025-08-29 22:52:14,223] Trial 668 finished with values: [-1000000000.0, 1000000000.0] and parameters: {'p_sma': 24, 'p_std': 26, 'p_atr': 12, 'p_adx': 13, 'rsi_period': 47, 'ema1': 16, 'ema2': 23, 'slip_atr_k': 0.19135575186638482, 'slip_spread_k': 0.29313625041527985, 'spread_hl_frac': 0.0014551563747399292, 'bb_std_mult': 2.4210727848614497, 'rsi_os': 36, 'rsi_ob': 93, 'vol_spike': 0.09027792652771972, 'adx_thresh': 10.819721434725297, 'atr_min_pct': 0.025423293896917498, 'atr_max_pct': 0.06273784206818649, 'tp_mult': 2.641804560148661, 'tsl_mult': 0.38737388687880525, 'strategy': 'breakout', 'time_stop': 282, 'use_sma': False, 'use_atr': False, 'use_adx': False, 'use_ema': False, 'use_spike': False, 'rsi_required': False, 'edge_k': 1.9088305852850667, 'edge_cap': 0.1914903731222757}.
[I 2025-08-29 22:52:41,233] Trial 673 finished with values: [-1000000000.0, 1000000000.0] and parameters: {'p_sma': 7, 'p_std': 47, 'p_atr': 12, 'p_adx': 11, 'rsi_period': 82, 'ema1': 30, 'ema2': 20, 'slip_atr_k': 0.004779584027270554, 'slip_spread_k': 0.24210777151356158, 'spread_hl_frac': 0.012418853117706224, 'bb_std_mult': 1.2070358627027358, 'rsi_os': 33, 'rsi_ob': 95, 'vol_spike': 0.25298233259420944, 'adx_thresh': 22.681914606180342, 'atr_min_pct': 0.0139830846664977, 'atr_max_pct': 0.0805001821645431, 'tp_mult': 1.7983945963210455, 'tsl_mult': 0.6365217347307909, 'strategy': 'mean_reversion', 'time_stop': 14, 'use_sma': False, 'use_atr': False, 'use_adx': False, 'use_ema': False, 'use_spike': False, 'rsi_required': False, 'edge_k': 1.7752076199788647, 'edge_cap': 0.22127630168362075}.
[I 2025-08-29 22:52:41,733] Trial 671 finished with values: [-1000000000.0, 1000000000.0] and parameters: {'p_sma': 24, 'p_std': 7, 'p_atr': 12, 'p_adx': 11, 'rsi_period': 82, 'ema1': 16, 'ema2': 22, 'slip_atr_k': 0.1815434457648037, 'slip_spread_k': 0.24692785126166594, 'spread_hl_frac': 0.0018154847048557805, 'bb_std_mult': 1.9484462111983256, 'rsi_os': 49, 'rsi_ob': 61, 'vol_spike': 0.05041947257679871, 'adx_thresh': 22.664470557851974, 'atr_min_pct': 0.01377830206698007, 'atr_max_pct': 0.10588428945924848, 'tp_mult': 2.6372936534977214, 'tsl_mult': 0.6306950655020342, 'strategy': 'mean_reversion', 'time_stop': 285, 'use_sma': False, 'use_atr': False, 'use_adx': False, 'use_ema': False, 'use_spike': False, 'rsi_required': False, 'edge_k': 1.7764479477059192, 'edge_cap': 0.2220826429495142}.
[I 2025-08-29 22:52:41,872] Trial 672 finished with values: [-1000000000.0, 1000000000.0] and parameters: {'p_sma': 29, 'p_std': 10, 'p_atr': 12, 'p_adx': 11, 'rsi_period': 82, 'ema1': 30, 'ema2': 22, 'slip_atr_k': 0.004255199709656613, 'slip_spread_k': 0.24314724400072638, 'spread_hl_frac': 0.02644408178155922, 'bb_std_mult': 1.619146264557005, 'rsi_os': 48, 'rsi_ob': 61, 'vol_spike': 0.04969772624969758, 'adx_thresh': 20.945510018395993, 'atr_min_pct': 0.01627369175327937, 'atr_max_pct': 0.07949898701778554, 'tp_mult': 2.650985005789503, 'tsl_mult': 0.38316381542339595, 'strategy': 'mean_reversion', 'time_stop': 300, 'use_sma': False, 'use_atr': False, 'use_adx': False, 'use_ema': False, 'use_spike': False, 'rsi_required': False, 'edge_k': 1.780817462240555, 'edge_cap': 0.21860472196014097}.
[I 2025-08-29 22:52:42,192] Trial 670 finished with values: [-1000000000.0, 1000000000.0] and parameters: {'p_sma': 25, 'p_std': 26, 'p_atr': 12, 'p_adx': 11, 'rsi_period': 82, 'ema1': 30, 'ema2': 23, 'slip_atr_k': 0.00031960442649092485, 'slip_spread_k': 0.265494304325639, 'spread_hl_frac': 0.009879906261855545, 'bb_std_mult': 1.284830242819461, 'rsi_os': 34, 'rsi_ob': 93, 'vol_spike': 0.23571473194319778, 'adx_thresh': 22.639853101074614, 'atr_min_pct': 0.026791508445043972, 'atr_max_pct': 0.08068136044772695, 'tp_mult': 2.009257436880088, 'tsl_mult': 0.636254535986537, 'strategy': 'mean_reversion', 'time_stop': 274, 'use_sma': False, 'use_atr': False, 'use_adx': False, 'use_ema': False, 'use_spike': False, 'rsi_required': False, 'edge_k': 1.8615530287376458, 'edge_cap': 0.2186962953627059}.
[I 2025-08-29 22:53:10,608] Trial 677 finished with values: [-1000000000.0, 1000000000.0] and parameters: {'p_sma': 28, 'p_std': 52, 'p_atr': 13, 'p_adx': 12, 'rsi_period': 62, 'ema1': 13, 'ema2': 19, 'slip_atr_k': 0.17134290984855388, 'slip_spread_k': 0.3145590868149826, 'spread_hl_frac': 0.004765378135856212, 'bb_std_mult': 1.4090444261221768, 'rsi_os': 38, 'rsi_ob': 64, 'vol_spike': 0.24259234824851894, 'adx_thresh': 21.24112660320917, 'atr_min_pct': 0.009235433012481451, 'atr_max_pct': 0.07504200493689149, 'tp_mult': 1.6731873831568427, 'tsl_mult': 0.6004823345597439, 'strategy': 'mean_reversion', 'time_stop': 269, 'use_sma': False, 'use_atr': False, 'use_adx': False, 'use_ema': False, 'use_spike': False, 'rsi_required': False, 'edge_k': 0.6379770001825045, 'edge_cap': 0.1865704480274207}.
