[I 2025-09-01 09:39:49,592] Trial 207 finished with values: [-1000000000.0, 1000000000.0] and parameters: {'p_sma': 47, 'p_std': 37, 'p_atr': 16, 'p_adx': 18, 'rsi_period': 22, 'ema1': 12, 'ema2': 14, 'slip_atr_k': 0.19219507265163838, 'slip_spread_k': 0.6115557296023884, 'spread_hl_frac': 0.02789011533668817, 'bb_std_mult': 1.2947712059797234, 'rsi_os': 35, 'rsi_ob': 65, 'vol_spike': 0.028918614803560356, 'adx_thresh': 30.949903822285172, 'atr_min_pct': 0.027543427658009413, 'atr_max_pct': 0.07790634784341252, 'tp_mult': 1.0178359312395573, 'tsl_mult': 0.8804342275945274, 'strategy': 'breakout', 'time_stop': 256, 'use_sma': True, 'use_atr': False, 'use_adx': False, 'use_ema': True, 'use_spike': True, 'rsi_required': True, 'edge_k': 0.9002275537238846, 'edge_cap': 0.6247275007000923, 'bull_strategy': 'breakout', 'bull_bb_std_mult': 3.5283897342201946, 'bull_rsi_os': 46, 'bull_rsi_ob': 49, 'bull_adx_thresh': 7.190294702542055, 'bull_atr_min_pct': 0.02327120208028566, 'bull_atr_max_pct': 0.10895084186002776, 'bull_tp_mult': 1.5740229634419154, 'bull_tsl_mult': 0.49493427907716214, 'bull_time_stop': 248, 'bull_use_sma': True, 'bull_use_ema': False, 'bull_use_atr': True, 'bull_use_adx': False, 'bull_use_spike': False, 'bull_rsi_required': True, 'bear_strategy': 'mean_reversion', 'bear_bb_std_mult': 2.6092278718357016, 'bear_rsi_os': 27, 'bear_rsi_ob': 55, 'bear_adx_thresh': 24.970606576235088, 'bear_atr_min_pct': 0.02883486922849925, 'bear_atr_max_pct': 0.07623055900104152, 'bear_tp_mult': 2.19241118675244, 'bear_tsl_mult': 0.21744043025662635, 'bear_time_stop': 276, 'bear_use_sma': False, 'bear_use_ema': True, 'bear_use_atr': True, 'bear_use_adx': False, 'bear_use_spike': False, 'bear_rsi_required': False, 'sideways_strategy': 'mean_reversion', 'sideways_bb_std_mult': 1.0154861481562096, 'sideways_rsi_os': 29, 'sideways_rsi_ob': 90, 'sideways_adx_thresh': 26.50907668320374, 'sideways_atr_min_pct': 0.0055413727114711625, 'sideways_atr_max_pct': 0.08426391603653223, 'sideways_tp_mult': 2.9455307464186493, 'sideways_tsl_mult': 0.10843552162414638, 'sideways_time_stop': 34, 'sideways_use_sma': True, 'sideways_use_ema': False, 'sideways_use_atr': False, 'sideways_use_adx': True, 'sideways_use_spike': False, 'sideways_rsi_required': False}.
[I 2025-09-01 09:39:50,607] Trial 208 finished with values: [-1000000000.0, 1000000000.0] and parameters: {'p_sma': 36, 'p_std': 51, 'p_atr': 16, 'p_adx': 18, 'rsi_period': 25, 'ema1': 12, 'ema2': 14, 'slip_atr_k': 0.10424652939332824, 'slip_spread_k': 0.6110899491768322, 'spread_hl_frac': 0.03322555446084895, 'bb_std_mult': 1.2795773935130497, 'rsi_os': 35, 'rsi_ob': 67, 'vol_spike': 0.02962807943473659, 'adx_thresh': 33.33593464972963, 'atr_min_pct': 0.012891571485669958, 'atr_max_pct': 0.07784000316899428, 'tp_mult': 2.3224386818538565, 'tsl_mult': 0.4731500038852062, 'strategy': 'breakout', 'time_stop': 277, 'use_sma': True, 'use_atr': False, 'use_adx': False, 'use_ema': True, 'use_spike': True, 'rsi_required': True, 'edge_k': 0.8623819750290301, 'edge_cap': 0.6238959894799679, 'bull_strategy': 'breakout', 'bull_bb_std_mult': 3.529282716117101, 'bull_rsi_os': 50, 'bull_rsi_ob': 49, 'bull_adx_thresh': 23.805968142665876, 'bull_atr_min_pct': 0.02439899050327171, 'bull_atr_max_pct': 0.019800085678272017, 'bull_tp_mult': 1.9131504334011322, 'bull_tsl_mult': 0.9391562715970487, 'bull_time_stop': 13, 'bull_use_sma': True, 'bull_use_ema': False, 'bull_use_atr': True, 'bull_use_adx': False, 'bull_use_spike': False, 'bull_rsi_required': True, 'bear_strategy': 'mean_reversion', 'bear_bb_std_mult': 1.9571185228606813, 'bear_rsi_os': 51, 'bear_rsi_ob': 90, 'bear_adx_thresh': 25.420395078499684, 'bear_atr_min_pct': 0.02941895719719133, 'bear_atr_max_pct': 0.07563364930782175, 'bear_tp_mult': 2.195145487718897, 'bear_tsl_mult': 0.6466243900989481, 'bear_time_stop': 272, 'bear_use_sma': False, 'bear_use_ema': True, 'bear_use_atr': True, 'bear_use_adx': False, 'bear_use_spike': False, 'bear_rsi_required': False, 'sideways_strategy': 'mean_reversion', 'sideways_bb_std_mult': 1.022150942836149, 'sideways_rsi_os': 51, 'sideways_rsi_ob': 74, 'sideways_adx_thresh': 6.9139665049601895, 'sideways_atr_min_pct': 0.0225002797978056, 'sideways_atr_max_pct': 0.08502685391535639, 'sideways_tp_mult': 2.123071358668673, 'sideways_tsl_mult': 0.11518531748897515, 'sideways_time_stop': 10, 'sideways_use_sma': True, 'sideways_use_ema': False, 'sideways_use_atr': False, 'sideways_use_adx': True, 'sideways_use_spike': False, 'sideways_rsi_required': False}.
[I 2025-09-01 09:39:50,607] Trial 206 finished with values: [-1000000000.0, 1000000000.0] and parameters: {'p_sma': 22, 'p_std': 33, 'p_atr': 13, 'p_adx': 18, 'rsi_period': 19, 'ema1': 19, 'ema2': 12, 'slip_atr_k': 0.05779588144007905, 'slip_spread_k': 0.6119255115825438, 'spread_hl_frac': 0.028787494231759397, 'bb_std_mult': 1.2272126196476907, 'rsi_os': 25, 'rsi_ob': 81, 'vol_spike': 0.01275647163484745, 'adx_thresh': 31.091608283375688, 'atr_min_pct': 0.00459931666410592, 'atr_max_pct': 0.06751783809991291, 'tp_mult': 1.0124842226016595, 'tsl_mult': 0.47621678852943894, 'strategy': 'breakout', 'time_stop': 289, 'use_sma': True, 'use_atr': False, 'use_adx': False, 'use_ema': True, 'use_spike': True, 'rsi_required': True, 'edge_k': 1.628320579845153, 'edge_cap': 0.8435017258032483, 'bull_strategy': 'breakout', 'bull_bb_std_mult': 3.5537051015103627, 'bull_rsi_os': 25, 'bull_rsi_ob': 49, 'bull_adx_thresh': 7.7696080925153606, 'bull_atr_min_pct': 0.01133118193857105, 'bull_atr_max_pct': 0.09608240487915305, 'bull_tp_mult': 1.50149628319369, 'bull_tsl_mult': 0.08049038076597248, 'bull_time_stop': 248, 'bull_use_sma': True, 'bull_use_ema': False, 'bull_use_atr': True, 'bull_use_adx': True, 'bull_use_spike': False, 'bull_rsi_required': True, 'bear_strategy': 'mean_reversion', 'bear_bb_std_mult': 2.3012076356666835, 'bear_rsi_os': 29, 'bear_rsi_ob': 95, 'bear_adx_thresh': 24.56171598103965, 'bear_atr_min_pct': 0.028716428556889183, 'bear_atr_max_pct': 0.06742169032834351, 'bear_tp_mult': 1.7822307397362458, 'bear_tsl_mult': 0.9129326038395341, 'bear_time_stop': 214, 'bear_use_sma': True, 'bear_use_ema': True, 'bear_use_atr': True, 'bear_use_adx': False, 'bear_use_spike': False, 'bear_rsi_required': False, 'sideways_strategy': 'mean_reversion', 'sideways_bb_std_mult': 2.729977969905281, 'sideways_rsi_os': 28, 'sideways_rsi_ob': 90, 'sideways_adx_thresh': 20.023510142531972, 'sideways_atr_min_pct': 0.016609007208369504, 'sideways_atr_max_pct': 0.08478094188927576, 'sideways_tp_mult': 1.9834984842165115, 'sideways_tsl_mult': 0.0015804492671923631, 'sideways_time_stop': 19, 'sideways_use_sma': True, 'sideways_use_ema': False, 'sideways_use_atr': False, 'sideways_use_adx': True, 'sideways_use_spike': False, 'sideways_rsi_required': True}.
[I 2025-09-01 09:40:29,130] Trial 213 finished with values: [-1000000000.0, 1000000000.0] and parameters: {'p_sma': 19, 'p_std': 28, 'p_atr': 15, 'p_adx': 19, 'rsi_period': 29, 'ema1': 26, 'ema2': 17, 'slip_atr_k': 0.03380729133964494, 'slip_spread_k': 0.6926508059092975, 'spread_hl_frac': 0.03086547216389517, 'bb_std_mult': 1.6024801550670529, 'rsi_os': 39, 'rsi_ob': 66, 'vol_spike': 0.2750087855307521, 'adx_thresh': 15.246901692901513, 'atr_min_pct': 0.025868029241376267, 'atr_max_pct': 0.06317487571149653, 'tp_mult': 1.065548871064088, 'tsl_mult': 0.7714973151395543, 'strategy': 'mean_reversion', 'time_stop': 264, 'use_sma': False, 'use_atr': False, 'use_adx': False, 'use_ema': True, 'use_spike': True, 'rsi_required': False, 'edge_k': 1.2952116474336917, 'edge_cap': 0.13427367181002986, 'bull_strategy': 'breakout', 'bull_bb_std_mult': 3.431903280230191, 'bull_rsi_os': 48, 'bull_rsi_ob': 46, 'bull_adx_thresh': 5.627796317703882, 'bull_atr_min_pct': 0.006316537221246297, 'bull_atr_max_pct': 0.09090881731717126, 'bull_tp_mult': 1.6058695938222365, 'bull_tsl_mult': 0.9177368098532132, 'bull_time_stop': 240, 'bull_use_sma': True, 'bull_use_ema': True, 'bull_use_atr': True, 'bull_use_adx': False, 'bull_use_spike': False, 'bull_rsi_required': False, 'bear_strategy': 'mean_reversion', 'bear_bb_std_mult': 2.088021383946874, 'bear_rsi_os': 53, 'bear_rsi_ob': 93, 'bear_adx_thresh': 18.487565367744438, 'bear_atr_min_pct': 0.0011187319641618836, 'bear_atr_max_pct': 0.10754091842553246, 'bear_tp_mult': 2.0747055498655236, 'bear_tsl_mult': 0.23557446331740467, 'bear_time_stop': 300, 'bear_use_sma': True, 'bear_use_ema': True, 'bear_use_atr': True, 'bear_use_adx': True, 'bear_use_spike': False, 'bear_rsi_required': False, 'sideways_strategy': 'breakout', 'sideways_bb_std_mult': 0.9312241841312667, 'sideways_rsi_os': 49, 'sideways_rsi_ob': 69, 'sideways_adx_thresh': 28.243886182475386, 'sideways_atr_min_pct': 0.021209698691456242, 'sideways_atr_max_pct': 0.07916131391676035, 'sideways_tp_mult': 2.020081117852024, 'sideways_tsl_mult': 0.7346383774263057, 'sideways_time_stop': 288, 'sideways_use_sma': True, 'sideways_use_ema': False, 'sideways_use_atr': True, 'sideways_use_adx': False, 'sideways_use_spike': True, 'sideways_rsi_required': False}.
[I 2025-09-01 09:40:29,132] Trial 211 finished with values: [-1000000000.0, 1000000000.0] and parameters: {'p_sma': 36, 'p_std': 51, 'p_atr': 12, 'p_adx': 8, 'rsi_period': 33, 'ema1': 13, 'ema2': 17, 'slip_atr_k': 0.21548249389292562, 'slip_spread_k': 0.6925635718960439, 'spread_hl_frac': 0.006682442463648321, 'bb_std_mult': 1.6122076018792957, 'rsi_os': 33, 'rsi_ob': 67, 'vol_spike': 0.00880920911239369, 'adx_thresh': 15.030118505541889, 'atr_min_pct': 0.012646773712213061, 'atr_max_pct': 0.14635492140915268, 'tp_mult': 2.197110449956768, 'tsl_mult': 0.4779772932696419, 'strategy': 'mean_reversion', 'time_stop': 280, 'use_sma': False, 'use_atr': False, 'use_adx': False, 'use_ema': True, 'use_spike': True, 'rsi_required': True, 'edge_k': 1.292972073853917, 'edge_cap': 0.8436291042546392, 'bull_strategy': 'breakout', 'bull_bb_std_mult': 3.4498104548964323, 'bull_rsi_os': 48, 'bull_rsi_ob': 88, 'bull_adx_thresh': 23.723862677913573, 'bull_atr_min_pct': 0.0063819024104701545, 'bull_atr_max_pct': 0.01942037811031981, 'bull_tp_mult': 2.7513778296704476, 'bull_tsl_mult': 0.07433713641896356, 'bull_time_stop': 247, 'bull_use_sma': True, 'bull_use_ema': True, 'bull_use_atr': True, 'bull_use_adx': True, 'bull_use_spike': False, 'bull_rsi_required': True, 'bear_strategy': 'mean_reversion', 'bear_bb_std_mult': 0.5802251852771443, 'bear_rsi_os': 53, 'bear_rsi_ob': 94, 'bear_adx_thresh': 23.41220255185841, 'bear_atr_min_pct': 0.00895645562722952, 'bear_atr_max_pct': 0.07526818284609156, 'bear_tp_mult': 2.147903079093941, 'bear_tsl_mult': 0.6622539345453641, 'bear_time_stop': 286, 'bear_use_sma': True, 'bear_use_ema': True, 'bear_use_atr': True, 'bear_use_adx': False, 'bear_use_spike': False, 'bear_rsi_required': False, 'sideways_strategy': 'mean_reversion', 'sideways_bb_std_mult': 0.9319357166016359, 'sideways_rsi_os': 51, 'sideways_rsi_ob': 87, 'sideways_adx_thresh': 34.017004879795664, 'sideways_atr_min_pct': 0.02250371181756222, 'sideways_atr_max_pct': 0.0793883558220115, 'sideways_tp_mult': 1.9030207734209235, 'sideways_tsl_mult': 0.7385952216801982, 'sideways_time_stop': 58, 'sideways_use_sma': True, 'sideways_use_ema': False, 'sideways_use_atr': False, 'sideways_use_adx': True, 'sideways_use_spike': True, 'sideways_rsi_required': True}.
[I 2025-09-01 09:40:29,315] Trial 212 finished with values: [-1000000000.0, 1000000000.0] and parameters: {'p_sma': 16, 'p_std': 24, 'p_atr': 12, 'p_adx': 19, 'rsi_period': 29, 'ema1': 10, 'ema2': 58, 'slip_atr_k': 0.035127440704160504, 'slip_spread_k': 0.6876022662213175, 'spread_hl_frac': 0.030332703269791202, 'bb_std_mult': 1.6254942029608865, 'rsi_os': 13, 'rsi_ob': 88, 'vol_spike': 0.019164413277744957, 'adx_thresh': 23.243008430569134, 'atr_min_pct': 0.008440725538839747, 'atr_max_pct': 0.05923688627447432, 'tp_mult': 2.99386608372118, 'tsl_mult': 0.4574345498866817, 'strategy': 'mean_reversion', 'time_stop': 269, 'use_sma': False, 'use_atr': False, 'use_adx': False, 'use_ema': True, 'use_spike': True, 'rsi_required': False, 'edge_k': 1.2973598556859667, 'edge_cap': 0.8730625740122127, 'bull_strategy': 'breakout', 'bull_bb_std_mult': 3.4319668865061908, 'bull_rsi_os': 15, 'bull_rsi_ob': 88, 'bull_adx_thresh': 5.864608390349426, 'bull_atr_min_pct': 0.025631656679995646, 'bull_atr_max_pct': 0.08492483109250168, 'bull_tp_mult': 1.4499008198305283, 'bull_tsl_mult': 0.9189224556225687, 'bull_time_stop': 237, 'bull_use_sma': True, 'bull_use_ema': True, 'bull_use_atr': True, 'bull_use_adx': False, 'bull_use_spike': False, 'bull_rsi_required': False, 'bear_strategy': 'mean_reversion', 'bear_bb_std_mult': 2.104940369891395, 'bear_rsi_os': 53, 'bear_rsi_ob': 50, 'bear_adx_thresh': 18.500804358469352, 'bear_atr_min_pct': 0.011578498225519911, 'bear_atr_max_pct': 0.1080749396863401, 'bear_tp_mult': 1.8317578070702945, 'bear_tsl_mult': 0.1013206704293666, 'bear_time_stop': 287, 'bear_use_sma': True, 'bear_use_ema': True, 'bear_use_atr': True, 'bear_use_adx': True, 'bear_use_spike': False, 'bear_rsi_required': False, 'sideways_strategy': 'breakout', 'sideways_bb_std_mult': 0.9347037212526353, 'sideways_rsi_os': 49, 'sideways_rsi_ob': 64, 'sideways_adx_thresh': 26.675101248588007, 'sideways_atr_min_pct': 0.021289259380938935, 'sideways_atr_max_pct': 0.07894754622237742, 'sideways_tp_mult': 1.905749126823693, 'sideways_tsl_mult': 0.7323141452060686, 'sideways_time_stop': 284, 'sideways_use_sma': True, 'sideways_use_ema': False, 'sideways_use_atr': True, 'sideways_use_adx': False, 'sideways_use_spike': True, 'sideways_rsi_required': False}.
[I 2025-09-01 09:40:29,667] Trial 210 finished with values: [-1000000000.0, 1000000000.0] and parameters: {'p_sma': 15, 'p_std': 51, 'p_atr': 18, 'p_adx': 18, 'rsi_period': 7, 'ema1': 11, 'ema2': 14, 'slip_atr_k': 0.16563943185315627, 'slip_spread_k': 0.5075264248914695, 'spread_hl_frac': 0.027843337241331794, 'bb_std_mult': 1.6067657183862507, 'rsi_os': 38, 'rsi_ob': 66, 'vol_spike': 0.02629750743329624, 'adx_thresh': 30.88584314732201, 'atr_min_pct': 0.008461752107286937, 'atr_max_pct': 0.0781481787353684, 'tp_mult': 1.0560538068433112, 'tsl_mult': 0.4834408851190686, 'strategy': 'mean_reversion', 'time_stop': 263, 'use_sma': False, 'use_atr': False, 'use_adx': False, 'use_ema': True, 'use_spike': True, 'rsi_required': True, 'edge_k': 1.6194817307245066, 'edge_cap': 0.6226050912628277, 'bull_strategy': 'breakout', 'bull_bb_std_mult': 3.4370267415896425, 'bull_rsi_os': 14, 'bull_rsi_ob': 46, 'bull_adx_thresh': 7.278485490049337, 'bull_atr_min_pct': 0.02981853323613951, 'bull_atr_max_pct': 0.024253888924242642, 'bull_tp_mult': 2.2919281614482805, 'bull_tsl_mult': 0.49443556058309657, 'bull_time_stop': 250, 'bull_use_sma': True, 'bull_use_ema': True, 'bull_use_atr': True, 'bull_use_adx': False, 'bull_use_spike': False, 'bull_rsi_required': True, 'bear_strategy': 'mean_reversion', 'bear_bb_std_mult': 2.099967575354462, 'bear_rsi_os': 53, 'bear_rsi_ob': 94, 'bear_adx_thresh': 23.330195224462603, 'bear_atr_min_pct': 0.029032242108263287, 'bear_atr_max_pct': 0.07651868450059322, 'bear_tp_mult': 2.190812864084014, 'bear_tsl_mult': 0.22037997815827287, 'bear_time_stop': 276, 'bear_use_sma': True, 'bear_use_ema': True, 'bear_use_atr': True, 'bear_use_adx': False, 'bear_use_spike': False, 'bear_rsi_required': False, 'sideways_strategy': 'mean_reversion', 'sideways_bb_std_mult': 1.9292975461114108, 'sideways_rsi_os': 33, 'sideways_rsi_ob': 74, 'sideways_adx_thresh': 7.1619252860340925, 'sideways_atr_min_pct': 0.005592414780890528, 'sideways_atr_max_pct': 0.08351802335003812, 'sideways_tp_mult': 2.122646293847909, 'sideways_tsl_mult': 0.439323310432875, 'sideways_time_stop': 10, 'sideways_use_sma': True, 'sideways_use_ema': False, 'sideways_use_atr': False, 'sideways_use_adx': True, 'sideways_use_spike': True, 'sideways_rsi_required': False}.
[I 2025-09-01 09:40:30,564] Trial 215 finished with values: [-1000000000.0, 1000000000.0] and parameters: {'p_sma': 51, 'p_std': 47, 'p_atr': 18, 'p_adx': 18, 'rsi_period': 45, 'ema1': 20, 'ema2': 16, 'slip_atr_k': 0.2024308116242317, 'slip_spread_k': 0.1760452482219565, 'spread_hl_frac': 0.029343157284881752, 'bb_std_mult': 2.44357215974855, 'rsi_os': 41, 'rsi_ob': 68, 'vol_spike': 0.10106847431732008, 'adx_thresh': 32.1512012709706, 'atr_min_pct': 0.028325093859354878, 'atr_max_pct': 0.016780725610040723, 'tp_mult': 2.3904724309155614, 'tsl_mult': 0.4250564381596841, 'strategy': 'breakout', 'time_stop': 249, 'use_sma': True, 'use_atr': False, 'use_adx': False, 'use_ema': True, 'use_spike': True, 'rsi_required': True, 'edge_k': 1.2231921283571294, 'edge_cap': 0.5646145549812112, 'bull_strategy': 'mean_reversion', 'bull_bb_std_mult': 1.8635397420557747, 'bull_rsi_os': 46, 'bull_rsi_ob': 47, 'bull_adx_thresh': 33.784396897167994, 'bull_atr_min_pct': 0.001336302135307879, 'bull_atr_max_pct': 0.09296715310370596, 'bull_tp_mult': 2.2893108515438017, 'bull_tsl_mult': 0.4046426998415141, 'bull_time_stop': 233, 'bull_use_sma': True, 'bull_use_ema': False, 'bull_use_atr': True, 'bull_use_adx': False, 'bull_use_spike': False, 'bull_rsi_required': True, 'bear_strategy': 'mean_reversion', 'bear_bb_std_mult': 2.194743317904647, 'bear_rsi_os': 46, 'bear_rsi_ob': 75, 'bear_adx_thresh': 23.505323564905336, 'bear_atr_min_pct': 0.028438681784305014, 'bear_atr_max_pct': 0.09728815322172332, 'bear_tp_mult': 2.287547379117672, 'bear_tsl_mult': 0.9740636750564005, 'bear_time_stop': 293, 'bear_use_sma': True, 'bear_use_ema': False, 'bear_use_atr': True, 'bear_use_adx': False, 'bear_use_spike': False, 'bear_rsi_required': False, 'sideways_strategy': 'mean_reversion', 'sideways_bb_std_mult': 0.7840596513551444, 'sideways_rsi_os': 52, 'sideways_rsi_ob': 49, 'sideways_adx_thresh': 27.357690337492635, 'sideways_atr_min_pct': 0.0235212535566788, 'sideways_atr_max_pct': 0.12039019861099821, 'sideways_tp_mult': 2.014378924650912, 'sideways_tsl_mult': 0.44252226039137466, 'sideways_time_stop': 191, 'sideways_use_sma': True, 'sideways_use_ema': False, 'sideways_use_atr': False, 'sideways_use_adx': True, 'sideways_use_spike': False, 'sideways_rsi_required': False}.
[I 2025-09-01 09:41:09,227] Trial 216 finished with values: [-0.035211700057102835, 0.03507989667411585] and parameters: {'p_sma': 51, 'p_std': 39, 'p_atr': 18, 'p_adx': 18, 'rsi_period': 62, 'ema1': 9, 'ema2': 20, 'slip_atr_k': 0.06830414467800658, 'slip_spread_k': 0.6400672996710967, 'spread_hl_frac': 0.029452421593081052, 'bb_std_mult': 2.22148389174268, 'rsi_os': 41, 'rsi_ob': 68, 'vol_spike': 0.10393881203881808, 'adx_thresh': 27.531132713662974, 'atr_min_pct': 0.005901382898726125, 'atr_max_pct': 0.07241168899116512, 'tp_mult': 1.726970553448489, 'tsl_mult': 0.7090130685740221, 'strategy': 'breakout', 'time_stop': 300, 'use_sma': True, 'use_atr': False, 'use_adx': False, 'use_ema': True, 'use_spike': True, 'rsi_required': True, 'edge_k': 1.247233495646623, 'edge_cap': 0.5866305818002622, 'bull_strategy': 'mean_reversion', 'bull_bb_std_mult': 1.1625733315211022, 'bull_rsi_os': 18, 'bull_rsi_ob': 47, 'bull_adx_thresh': 33.91375674304614, 'bull_atr_min_pct': 0.0012927194217702657, 'bull_atr_max_pct': 0.09017459225031046, 'bull_tp_mult': 1.47461403034005, 'bull_tsl_mult': 0.9818983108715058, 'bull_time_stop': 77, 'bull_use_sma': True, 'bull_use_ema': False, 'bull_use_atr': True, 'bull_use_adx': False, 'bull_use_spike': False, 'bull_rsi_required': True, 'bear_strategy': 'mean_reversion', 'bear_bb_std_mult': 0.8933748590828214, 'bear_rsi_os': 55, 'bear_rsi_ob': 94, 'bear_adx_thresh': 23.48350947929826, 'bear_atr_min_pct': 0.01528626153013099, 'bear_atr_max_pct': 0.068173301122764, 'bear_tp_mult': 2.457309899905176, 'bear_tsl_mult': 0.3819095981557311, 'bear_time_stop': 291, 'bear_use_sma': True, 'bear_use_ema': False, 'bear_use_atr': True, 'bear_use_adx': False, 'bear_use_spike': False, 'bear_rsi_required': False, 'sideways_strategy': 'mean_reversion', 'sideways_bb_std_mult': 1.9523052642326841, 'sideways_rsi_os': 24, 'sideways_rsi_ob': 91, 'sideways_adx_thresh': 27.039046408858095, 'sideways_atr_min_pct': 0.010415803693302587, 'sideways_atr_max_pct': 0.12072724933092568, 'sideways_tp_mult': 1.5366150727219368, 'sideways_tsl_mult': 0.47010320399423294, 'sideways_time_stop': 195, 'sideways_use_sma': True, 'sideways_use_ema': False, 'sideways_use_atr': False, 'sideways_use_adx': True, 'sideways_use_spike': False, 'sideways_rsi_required': False}.
